[{"match_name":"AGC_20170903","match_date":"2017-09-03","stage_classifiercode":"99-11","member_number":"A85442","first_name":"SPENCER","last_name":"STEIN","classification":"M","division":"OPEN","hit_factor":13.6816},{"match_name":"RBGC 2017-06-24","match_date":"2017-06-24","stage_classifiercode":"99-11","member_number":"TY36570","first_name":"KC","last_name":"EUSEBIO","classification":"G","division":"OPEN","hit_factor":13.4474},{"match_name":"2016-05-07 USPSA at Phoenix Rod and Gun Club","match_date":"2016-05-07","stage_classifiercode":"99-11","member_number":"A22810","first_name":"KERRY","last_name":"PEARSON","classification":"G","division":"OPEN","hit_factor":13.3489},{"match_name":"ORPCI USPSA Saturday 2020.07.18","match_date":"2020-07-18","stage_classifiercode":"99-11","member_number":"A104223","first_name":"JOSH","last_name":"TILFORD","classification":"A","division":"OPEN","hit_factor":13.1455},{"match_name":"GoShoot Outdoor January 10th","match_date":"2021-01-10","stage_classifiercode":"99-11","member_number":"L3042","first_name":"CHRIS","last_name":"TILLEY","classification":"G","division":"OPEN","hit_factor":12.8205},{"match_name":"SCCCJULYCLASSIFIER2016","match_date":"2016-07-30","stage_classifiercode":"99-11","member_number":"L2615","first_name":"STEVE","last_name":"MARSDEN","classification":"U","division":"OPEN","hit_factor":12.5908},{"match_name":"Denali September","match_date":"2018-09-07","stage_classifiercode":"99-11","member_number":"A51363","first_name":"KENNETH","last_name":"TERRY","classification":"M","division":"OPEN","hit_factor":12.5581},{"match_name":"Emmett July Match","match_date":"2017-07-21","stage_classifiercode":"99-11","member_number":"a79438","first_name":"KOLBY","last_name":"PAVLOCK","classification":"M","division":"OPEN","hit_factor":12.4424},{"match_name":"Pathfinder July USPSA Match","match_date":"2018-07-15","stage_classifiercode":"99-11","member_number":"A102251","first_name":"TYLER","last_name":"WEATHERWAX","classification":"none","division":"OPEN","hit_factor":12.3913},{"match_name":"Dundee Practical Shooters - Single Stack Challenge - Jan 23 2021","match_date":"2021-01-23","stage_classifiercode":"99-11","member_number":"A95617","first_name":"JOSEPH","last_name":"TYLER","classification":"M","division":"OPEN","hit_factor":12.2622},{"match_name":"CFRPC December USPSA (Classifier)","match_date":"2018-12-16","stage_classifiercode":"99-11","member_number":"L4448","first_name":"IAN","last_name":"MCPHERSON","classification":"M","division":"OPEN","hit_factor":12.2538},{"match_name":"ORPCI USPSA Saturday 2020.07.18","match_date":"2020-07-18","stage_classifiercode":"99-11","member_number":"TY113747","first_name":"CODY","last_name":"BEAN","classification":"B","division":"OPEN","hit_factor":12.1849},{"match_name":"WGC August 2018 USPSA Classifier","match_date":"2018-08-12","stage_classifiercode":"99-11","member_number":"YY97639","first_name":"JASON","last_name":"WATTS","classification":"A","division":"OPEN","hit_factor":11.875},{"match_name":"SWGC USPSA Pistol Match - November 2021","match_date":"2021-11-06","stage_classifiercode":"99-11","member_number":"A95951","first_name":"JUSTIN","last_name":"SMITH","classification":"A","division":"OPEN","hit_factor":11.8609},{"match_name":"GoShoot Indoors","match_date":"2017-06-11","stage_classifiercode":"99-11","member_number":"L3042","first_name":"CHRIS","last_name":"TILLEY","classification":"G","division":"OPEN","hit_factor":11.8605},{"match_name":"TAP USPSA Pistol Match Aug 14 2016","match_date":"2016-08-14","stage_classifiercode":"99-11","member_number":"A85939","first_name":"NILO","last_name":"NUNEZ II","classification":"M","division":"OPEN","hit_factor":11.804},{"match_name":"Denali September","match_date":"2018-09-07","stage_classifiercode":"99-11","member_number":"A51363","first_name":"KENNETH","last_name":"TERRY","classification":"M","division":"OPEN","hit_factor":11.7647},{"match_name":"SUPS USPSA 11/21/15 A","match_date":"2015-11-21","stage_classifiercode":"99-11","member_number":"FY44837","first_name":"JEFF","last_name":"BAILEY","classification":"M","division":"OPEN","hit_factor":11.7647},{"match_name":"Nampa USPSA December 4th 2021","match_date":"2021-12-04","stage_classifiercode":"99-11","member_number":"TY85172","first_name":"MIKE","last_name":"O'LEARY","classification":"M","division":"OPEN","hit_factor":11.7172},{"match_name":"June 22 2016 A Zone","match_date":"2016-06-22","stage_classifiercode":"99-11","member_number":"L3082","first_name":"ROY","last_name":"STEDMAN","classification":"G","division":"OPEN","hit_factor":11.6667},{"match_name":"Matamoras USPSA August Match","match_date":"2017-08-27","stage_classifiercode":"99-11","member_number":"L2483","first_name":"BRYAN","last_name":"JONES","classification":"GM","division":"OPEN","hit_factor":11.6183},{"match_name":"TGC USPSA JANUARY 2018","match_date":"2018-01-20","stage_classifiercode":"99-11","member_number":"A82591","first_name":"WADE","last_name":"WHETSTONE","classification":"G","division":"OPEN","hit_factor":11.6071},{"match_name":"Strongpoint August 2017 Match","match_date":"2017-08-05","stage_classifiercode":"99-11","member_number":"TY19303","first_name":"BRAD","last_name":"GRIFFIN","classification":"G","division":"OPEN","hit_factor":11.5721},{"match_name":"SEPSA July 2017","match_date":"2017-07-08","stage_classifiercode":"99-11","member_number":"A30555","first_name":"DAVID","last_name":"WILDS","classification":"\"\"","division":"OPEN","hit_factor":11.5619},{"match_name":"Dawg Valley USPSA Oct 13","match_date":"2018-10-13","stage_classifiercode":"99-11","member_number":"TY81742","first_name":"BEN","last_name":"WEST","classification":"M","division":"OPEN","hit_factor":11.5464},{"match_name":"Steel City USPSA December 2 2017","match_date":"2017-12-02","stage_classifiercode":"99-11","member_number":"TY53706","first_name":"RANDAL","last_name":"WEBB","classification":"M","division":"OPEN","hit_factor":11.5063},{"match_name":"2017 Bay bridge Charity Classic - Richmond October 14-15-2017","match_date":"2017-10-14","stage_classifiercode":"99-11","member_number":"A85939","first_name":"NILO","last_name":"NUNEZ II","classification":"M","division":"OPEN","hit_factor":11.499},{"match_name":"BAS  April 2017 USPSA","match_date":"2017-04-15","stage_classifiercode":"99-11","member_number":"A28945","first_name":"SCOTT","last_name":"BOTELHO","classification":"G","division":"OPEN","hit_factor":11.4719},{"match_name":"Collin County USPSA 04-25-2021","match_date":"2021-04-24","stage_classifiercode":"99-11","member_number":"A83433","first_name":"KEN","last_name":"YANG","classification":"M","division":"OPEN","hit_factor":11.4519},{"match_name":"Rio Salado UPPL September 2020","match_date":"2020-09-13","stage_classifiercode":"99-11","member_number":"A49035","first_name":"EDDIE","last_name":"GARCIA","classification":"G","division":"OPEN","hit_factor":11.4504},{"match_name":"APSC 4th Annual Holiday Hosefest USPSA Match 12-02-17","match_date":"2017-12-02","stage_classifiercode":"99-11","member_number":"A82591","first_name":"WADE","last_name":"W","classification":"G","division":"OPEN","hit_factor":11.4035},{"match_name":"Nampa USPSA December 26th 2020","match_date":"2020-12-26","stage_classifiercode":"99-11","member_number":"TY85985","first_name":"CHRISTOPHER","last_name":"COLLINS","classification":"M","division":"OPEN","hit_factor":11.332},{"match_name":"NHRPC - March 2021 USPSA","match_date":"2021-03-14","stage_classifiercode":"99-11","member_number":"A91701","first_name":"RYAN","last_name":"POBLETE","classification":"M","division":"OPEN","hit_factor":11.3208},{"match_name":"Ontelaunee USPSA July 2016","match_date":"2016-07-23","stage_classifiercode":"99-11","member_number":"L3280","first_name":"JOSEPH","last_name":"ROBERTS","classification":"A","division":"OPEN","hit_factor":11.2474},{"match_name":"HTF Practical Shooters","match_date":"2017-09-24","stage_classifiercode":"99-11","member_number":"A100328","first_name":"JOSH","last_name":"TAYLOR","classification":"B","division":"OPEN","hit_factor":11.2266},{"match_name":"SLOSA DEC 2020 USPSA CLASSIFIER","match_date":"2020-12-13","stage_classifiercode":"99-11","member_number":"A95060","first_name":"CHRISTIAN","last_name":"GOINS","classification":"X","division":"OPEN","hit_factor":11.2205},{"match_name":"CFRPC December USPSA (Classifier)","match_date":"2018-12-16","stage_classifiercode":"99-11","member_number":"A94563","first_name":"LAMAR","last_name":"STANDISH","classification":"A","division":"OPEN","hit_factor":11.2088},{"match_name":"PCSI - September 2017 USPSA","match_date":"2017-09-02","stage_classifiercode":"99-11","member_number":"A81837","first_name":"CODY","last_name":"BAKER","classification":"GM","division":"OPEN","hit_factor":11.2016},{"match_name":"MS06 Team Magnolia February 2018 USPSA Match","match_date":"2018-02-03","stage_classifiercode":"99-11","member_number":"A93372","first_name":"JAMES","last_name":"LOFTON","classification":"M","division":"OPEN","hit_factor":11.194},{"match_name":"PRG 2017 Classifier Match","match_date":"2017-02-19","stage_classifiercode":"99-11","member_number":"A87556","first_name":"ROB","last_name":"CHOI","classification":"M","division":"OPEN","hit_factor":11.1765},{"match_name":"COPS 2015 Missouri Fall Classic","match_date":"2015-10-03","stage_classifiercode":"99-11","member_number":"A35986","first_name":"YUTH","last_name":"J","classification":"M","division":"OPEN","hit_factor":11.1597},{"match_name":"HSA USPSA March 2020","match_date":"2020-03-04","stage_classifiercode":"99-11","member_number":"A91710","first_name":"RYAN","last_name":"POBLETE","classification":"A","division":"OPEN","hit_factor":11.1349},{"match_name":"June 2018 CAS USPSA","match_date":"2018-06-03","stage_classifiercode":"99-11","member_number":"TY44221","first_name":"BRANDON","last_name":"GUILLORY","classification":"M","division":"OPEN","hit_factor":11.1111},{"match_name":"USPSA-Alberta 2018-03 Indoor Classifier 3 at TSE","match_date":"2018-04-29","stage_classifiercode":"99-11","member_number":"TYF94515","first_name":"MATT","last_name":"PORTH","classification":"A","division":"OPEN","hit_factor":11.0887},{"match_name":"Coyote USPSA match 4-21-18","match_date":"2018-04-21","stage_classifiercode":"99-11","member_number":"A83214","first_name":"ETHAN","last_name":"INOCANDO","classification":"G","division":"OPEN","hit_factor":11.0883},{"match_name":"Dawg Valley USPSA Oct 13","match_date":"2018-10-13","stage_classifiercode":"99-11","member_number":"A46956","first_name":"CHRIS","last_name":"KEEN","classification":"G","division":"OPEN","hit_factor":11.0609},{"match_name":"Devil Dog USPSA Classifier Match-Saturday Session","match_date":"2018-03-10","stage_classifiercode":"99-11","member_number":"A90156","first_name":"STEVE","last_name":"EVERETT","classification":"A","division":"OPEN","hit_factor":11.0465},{"match_name":"RSPP 3rd Saturday November 2016","match_date":"2016-11-19","stage_classifiercode":"99-11","member_number":"A49035","first_name":"EDDIE","last_name":"GARCIA","classification":"GM","division":"OPEN","hit_factor":11.0236},{"match_name":"Richmond Hot Shots April 14-15-2018 USPSA Pistol Match","match_date":"2018-04-14","stage_classifiercode":"99-11","member_number":"TY91248","first_name":"DAVID","last_name":"GEORGE","classification":"A","division":"OPEN","hit_factor":11.0204},{"match_name":"AGC_20170903","match_date":"2017-09-03","stage_classifiercode":"99-11","member_number":"A28779","first_name":"PAUL JR","last_name":"CLARK","classification":"M","division":"OPEN","hit_factor":11.0169},{"match_name":"PCSI - September 2017 USPSA","match_date":"2017-09-02","stage_classifiercode":"99-11","member_number":"L4135","first_name":"TOM","last_name":"SARGENT","classification":"M","division":"OPEN","hit_factor":11.0169},{"match_name":"CSA Coalfield Shooters Association USPSA March 2020","match_date":"2020-03-08","stage_classifiercode":"99-11","member_number":"A89266","first_name":"SCOTT","last_name":"RIDDLE","classification":"B","division":"OPEN","hit_factor":11.0057},{"match_name":"Cactus USPSA ALL CLASSIFIER August 2020","match_date":"2020-08-02","stage_classifiercode":"99-11","member_number":"A122959","first_name":"BRSNDON","last_name":"ENGBRECHT","classification":"B","division":"OPEN","hit_factor":11.002},{"match_name":"CFRPC December USPSA (Classifier)","match_date":"2018-12-16","stage_classifiercode":"99-11","member_number":"A81323","first_name":"JOE","last_name":"DRAGHI","classification":"A","division":"OPEN","hit_factor":10.9914},{"match_name":"17s PSC - Go Fast Donâ€™t Suck 2020 Spring Postal Match (USPSA)","match_date":"2020-05-16","stage_classifiercode":"99-11","member_number":"A104744","first_name":"DAVID","last_name":"LYELL","classification":"M","division":"OPEN","hit_factor":10.9804},{"match_name":"CGC 4.30.17","match_date":"2017-04-30","stage_classifiercode":"99-11","member_number":"Fy49558","first_name":"JOHN","last_name":"ARENA","classification":"G","division":"OPEN","hit_factor":10.9641},{"match_name":"PTPC  February 7th USPSA Match","match_date":"2016-02-07","stage_classifiercode":"99-11","member_number":"TY80219","first_name":"MAX","last_name":"KLATT","classification":"A","division":"OPEN","hit_factor":10.9533},{"match_name":"Tangi January 2016 USPSA","match_date":"2016-01-23","stage_classifiercode":"99-11","member_number":"a85466","first_name":"CHRIS","last_name":"CARNEY","classification":"A","division":"OPEN","hit_factor":10.9375},{"match_name":"Heritage March 2021 USPSA","match_date":"2021-03-13","stage_classifiercode":"99-11","member_number":"A118815","first_name":"MICHAEL","last_name":"HWANG","classification":"G","division":"OPEN","hit_factor":10.9375},{"match_name":"2017 Bay bridge Charity Classic - Richmond October 14-15-2017","match_date":"2017-10-14","stage_classifiercode":"99-11","member_number":"TY91248","first_name":"DAVID","last_name":"GEORGE","classification":"A","division":"OPEN","hit_factor":10.9228},{"match_name":"Dundee USPSA Feb 2016","match_date":"2016-02-27","stage_classifiercode":"99-11","member_number":"A84371","first_name":"RYAN","last_name":"GOOLD","classification":"A","division":"OPEN","hit_factor":10.9091},{"match_name":"APS August 1st Monthly USPSA Match  Classifier Match","match_date":"2021-08-01","stage_classifiercode":"99-11","member_number":"A131354","first_name":"MIKE","last_name":"ULLOA2","classification":"A","division":"OPEN","hit_factor":10.9023},{"match_name":"RDS USPSA 8.13.16","match_date":"2016-08-13","stage_classifiercode":"99-11","member_number":"A79174","first_name":"BRIXEY","last_name":"NELSON","classification":"A","division":"OPEN","hit_factor":10.8987},{"match_name":"Richmond Hot Shots October 6-7 USPSA Pistol Match","match_date":"2018-10-06","stage_classifiercode":"99-11","member_number":"A85939","first_name":"NILO","last_name":"NUNEZ II","classification":"G","division":"OPEN","hit_factor":10.8844},{"match_name":"Heritage March 2021 USPSA","match_date":"2021-03-13","stage_classifiercode":"99-11","member_number":"A105033","first_name":"CAMERON","last_name":"TANNER","classification":"A","division":"OPEN","hit_factor":10.883},{"match_name":"Hopkinton USPSA July 2018","match_date":"2018-07-07","stage_classifiercode":"99-11","member_number":"TY73127","first_name":"SEAN","last_name":"JANICKI","classification":"M","division":"OPEN","hit_factor":10.8787},{"match_name":"November 2016 PCSI USPSA Monster Match","match_date":"2016-11-05","stage_classifiercode":"99-11","member_number":"L4135","first_name":"TOM","last_name":"SARGENT","classification":"A","division":"OPEN","hit_factor":10.8481},{"match_name":"FAS Sunday Indoors USPSA","match_date":"2021-10-17","stage_classifiercode":"99-11","member_number":"A111317","first_name":"JUN","last_name":"CHANG","classification":"G","division":"OPEN","hit_factor":10.8225},{"match_name":"NCPS USPSA Handgun Match November 27 2016","match_date":"2016-11-27","stage_classifiercode":"99-11","member_number":"A85939","first_name":"NILO","last_name":"NUNEZ II","classification":"M","division":"OPEN","hit_factor":10.8216},{"match_name":"Bare Arms Indoo 12/08/18","match_date":"2018-12-08","stage_classifiercode":"99-11","member_number":"A100644","first_name":"SETH","last_name":"LEWIS","classification":"B","division":"OPEN","hit_factor":10.8055},{"match_name":"ENPS 2018 June USPSA Match","match_date":"2018-06-03","stage_classifiercode":"99-11","member_number":"TY53045","first_name":"AUSTIN","last_name":"GRIFFITH","classification":"M","division":"OPEN","hit_factor":10.7955},{"match_name":"MPSA 07182020 USPSA","match_date":"2020-07-18","stage_classifiercode":"99-11","member_number":"A92885","first_name":"TAYLOR","last_name":"ZIMMERMAN","classification":"B","division":"OPEN","hit_factor":10.7759},{"match_name":"MCAS March 2021 USPSA","match_date":"2021-03-28","stage_classifiercode":"99-11","member_number":"Ty23626","first_name":"SCOTT","last_name":"NIELSEN","classification":"G","division":"OPEN","hit_factor":10.7664},{"match_name":"WSPS AUGUST 2016 USPSA","match_date":"2016-08-20","stage_classifiercode":"99-11","member_number":"TY39983","first_name":"BRETT","last_name":"BUCHANAN","classification":"M","division":"OPEN","hit_factor":10.7505},{"match_name":"Pistol Petes Circle Jerk USPSA 8-29-20 Dropping a Deuce","match_date":"2020-08-29","stage_classifiercode":"99-11","member_number":"Ty86867","first_name":"ANDREW","last_name":"HEATH","classification":"M","division":"OPEN","hit_factor":10.7505},{"match_name":"WNPL USPSA - REDEMPTION - NOVEMBER 2016","match_date":"2016-11-06","stage_classifiercode":"99-11","member_number":"A36569","first_name":"ERIK","last_name":"WARREN","classification":"M","division":"OPEN","hit_factor":10.7486},{"match_name":"ENPS 2018 June USPSA Match","match_date":"2018-06-03","stage_classifiercode":"99-11","member_number":"TY57269","first_name":"CRAIG","last_name":"TAPPE","classification":"G","division":"OPEN","hit_factor":10.7468},{"match_name":"PPPS 11-13-16","match_date":"2016-11-13","stage_classifiercode":"99-11","member_number":"A49558","first_name":"JOHN","last_name":"ARENAS","classification":"G","division":"OPEN","hit_factor":10.728},{"match_name":"Hopkinton June  2016","match_date":"2016-06-04","stage_classifiercode":"99-11","member_number":"TY65772","first_name":"STEVE","last_name":"PICHE","classification":"A","division":"OPEN","hit_factor":10.7209},{"match_name":"ORGC Tuesday Classifier CM 99-11 El Presidente","match_date":"2021-07-27","stage_classifiercode":"99-11","member_number":"Ty81223","first_name":"TIMOTHY","last_name":"FRIEDAY","classification":"M","division":"OPEN","hit_factor":10.7143},{"match_name":"ORPCI USPSA Saturday 2021.07.17","match_date":"2021-07-17","stage_classifiercode":"99-11","member_number":"A104224","first_name":"ANDY","last_name":"TILFORD","classification":"M","division":"OPEN","hit_factor":10.7011},{"match_name":"OFGC Practical Pistol Match 01-19-2020","match_date":"2020-01-19","stage_classifiercode":"99-11","member_number":"TY42278","first_name":"KELLY","last_name":"RAGLIN","classification":"M","division":"OPEN","hit_factor":10.687},{"match_name":"Hopkinton USPSA May 2017","match_date":"2017-05-06","stage_classifiercode":"99-11","member_number":"A92399","first_name":"JUSTIN","last_name":"LANDRY","classification":"G","division":"OPEN","hit_factor":10.6589},{"match_name":"SLOSA DEC 2020 USPSA CLASSIFIER","match_date":"2020-12-13","stage_classifiercode":"99-11","member_number":"TY87459","first_name":"AARON","last_name":"RUNYAN","classification":"B","division":"OPEN","hit_factor":10.6557},{"match_name":"MAPSA 2016.10.08","match_date":"2016-10-08","stage_classifiercode":"99-11","member_number":"TY44744","first_name":"LARRY","last_name":"SITTER","classification":"M","division":"OPEN","hit_factor":10.6178},{"match_name":"Rdh","match_date":"2017-07-11","stage_classifiercode":"99-11","member_number":"\"\"","first_name":"R","last_name":"DH","classification":"\"\"","division":"OPEN","hit_factor":10.6115},{"match_name":"Coyote USPSA match 4-21-18","match_date":"2018-04-21","stage_classifiercode":"99-11","member_number":"TY86283","first_name":"MEL","last_name":"RODERO","classification":"G","division":"OPEN","hit_factor":10.609},{"match_name":"WNPL USPSA - Nov 2017","match_date":"2017-11-05","stage_classifiercode":"99-11","member_number":"FY71885","first_name":"BRADEN","last_name":"PICCININI","classification":"M","division":"OPEN","hit_factor":10.6061},{"match_name":"PSAC_20161022","match_date":"2016-10-22","stage_classifiercode":"99-11","member_number":"A69978","first_name":"DOMINIC","last_name":"KOH","classification":"\"\"","division":"OPEN","hit_factor":10.586},{"match_name":"MCAS March 2021 USPSA","match_date":"2021-03-28","stage_classifiercode":"99-11","member_number":"FY69896","first_name":"JIM","last_name":"SANDERS","classification":"M","division":"OPEN","hit_factor":10.5788},{"match_name":"RSPP 3rd Saturday November 2016","match_date":"2016-11-19","stage_classifiercode":"99-11","member_number":"A80318","first_name":"JIM","last_name":"ADAME","classification":"M","division":"OPEN","hit_factor":10.5708},{"match_name":"RSPP 3rd Saturday November 2016","match_date":"2016-11-19","stage_classifiercode":"99-11","member_number":"L684","first_name":"ROB","last_name":"LEATHAM","classification":"GM","division":"OPEN","hit_factor":10.566},{"match_name":"Richmond Hot Shots January 17-2016 USPSA Pistol","match_date":"2016-01-17","stage_classifiercode":"99-11","member_number":"A88607","first_name":"FRANCO","last_name":"GESMUNDO","classification":"B","division":"OPEN","hit_factor":10.5647},{"match_name":"CGC 4.30.17","match_date":"2017-04-30","stage_classifiercode":"99-11","member_number":"A85442","first_name":"SPENCER","last_name":"STEIN","classification":"M","division":"OPEN","hit_factor":10.5495},{"match_name":"DPSL July 22 2018 All Classifier","match_date":"2018-07-22","stage_classifiercode":"99-11","member_number":"L3364","first_name":"SEAN","last_name":"JACKSON","classification":"G","division":"OPEN","hit_factor":10.536},{"match_name":"Target  Sports Central Indiana Championship","match_date":"2020-08-22","stage_classifiercode":"99-11","member_number":"A26597","first_name":"MAX","last_name":"BEDWELL","classification":"G","division":"OPEN","hit_factor":10.536},{"match_name":"KSA USPSA  3 April 2021","match_date":"2021-04-03","stage_classifiercode":"99-11","member_number":"FY115754","first_name":"ADAM","last_name":"ROBINSON","classification":"A","division":"OPEN","hit_factor":10.536},{"match_name":"HPS April Tax Time Fun Shoot","match_date":"2017-04-22","stage_classifiercode":"99-11","member_number":"A75056","first_name":"ELMER","last_name":"BANEZ","classification":"A","division":"OPEN","hit_factor":10.5058},{"match_name":"Ontelaunee USPSA September 2015","match_date":"2015-09-27","stage_classifiercode":"99-11","member_number":"A70990","first_name":"STACEY","last_name":"BORGIA","classification":"M","division":"OPEN","hit_factor":10.4962},{"match_name":"LCSC Linden USPSA 092621","match_date":"2021-09-25","stage_classifiercode":"99-11","member_number":"ty91248","first_name":"DAVID","last_name":"GEORGE","classification":"M","division":"OPEN","hit_factor":10.4693},{"match_name":"Sharp Practical Shooters March USPSA Match - Indoor","match_date":"2021-03-28","stage_classifiercode":"99-11","member_number":"A87873","first_name":"SCOTT","last_name":"MEREDITH","classification":"M","division":"OPEN","hit_factor":10.4673},{"match_name":"INAS May 2020 USPSA","match_date":"2020-05-09","stage_classifiercode":"99-11","member_number":"A87873","first_name":"SCOTT","last_name":"MEREDITH","classification":"M","division":"OPEN","hit_factor":10.4651},{"match_name":"CCPL May  Day Match","match_date":"2021-05-23","stage_classifiercode":"99-11","member_number":"A88732","first_name":"TIGER","last_name":"NGUYEN","classification":"M","division":"OPEN","hit_factor":10.4536},{"match_name":"Benton Gun Club-USPSA June 27  9AM","match_date":"2021-06-27","stage_classifiercode":"99-11","member_number":"Ty64204","first_name":"BLAKE","last_name":"LILES","classification":"G","division":"OPEN","hit_factor":10.4449},{"match_name":"Grandbaggers August 2017","match_date":"2017-08-03","stage_classifiercode":"99-11","member_number":"A22810","first_name":"KERRY","last_name":"PEARSON","classification":"G","division":"OPEN","hit_factor":10.4444},{"match_name":"NW01 Paul Bunyan CS Series May 9 2021","match_date":"2021-05-09","stage_classifiercode":"99-11","member_number":"A89438","first_name":"NICHOLAS","last_name":"STOCKWELL","classification":"G","division":"OPEN","hit_factor":10.4396},{"match_name":"WVRPC USPSA 1SEPT2018","match_date":"2018-09-01","stage_classifiercode":"99-11","member_number":"TY86867","first_name":"ANDREW","last_name":"HEATH","classification":"M","division":"OPEN","hit_factor":10.4294},{"match_name":"CFRPC December USPSA (Classifier)","match_date":"2018-12-16","stage_classifiercode":"99-11","member_number":"FY91472","first_name":"BRUCE","last_name":"STEIN","classification":"B","division":"OPEN","hit_factor":10.4167},{"match_name":"Prescott Action Shooters 1st Saturday USPSA 7-7-2018","match_date":"2018-07-07","stage_classifiercode":"99-11","member_number":"A54668","first_name":"DAVE","last_name":"ZINK","classification":"M","division":"OPEN","hit_factor":10.4046},{"match_name":"Nampa USPSA May 29th 2021","match_date":"2021-05-29","stage_classifiercode":"99-11","member_number":"TY85172","first_name":"MIKE","last_name":"O'LEARY","classification":"M","division":"OPEN","hit_factor":10.395},{"match_name":"Wvpps Nov. 2016","match_date":"2016-11-20","stage_classifiercode":"99-11","member_number":"A26597","first_name":"MAX","last_name":"BEDWELL","classification":"G","division":"OPEN","hit_factor":10.3922},{"match_name":"MVPSA USPSA 9-15-18","match_date":"2018-09-15","stage_classifiercode":"99-11","member_number":"a103560","first_name":"RILEY","last_name":"COOPER","classification":"U","division":"OPEN","hit_factor":10.3896},{"match_name":"Brothers N Arms December 2018 USPSA Match","match_date":"2018-12-15","stage_classifiercode":"99-11","member_number":"FY81419","first_name":"JOHN","last_name":"NGUYEN","classification":"M","division":"OPEN","hit_factor":10.387},{"match_name":"CISSA USPSA Classier Match Dec 8th 2018","match_date":"2018-12-08","stage_classifiercode":"99-11","member_number":"TYF100265","first_name":"TONY","last_name":"CAMPNEY","classification":"\"\"","division":"OPEN","hit_factor":10.3825},{"match_name":"Hopkinton USPSA October 2018","match_date":"2018-10-06","stage_classifiercode":"99-11","member_number":"A28945","first_name":"SCOTT","last_name":"BOTELHO","classification":"G","division":"OPEN","hit_factor":10.3792},{"match_name":"SSS USPSA June 2020 FATHERS DAY Match","match_date":"2020-06-21","stage_classifiercode":"99-11","member_number":"A104744","first_name":"DAVID","last_name":"LYELL","classification":"M (Master)","division":"OPEN","hit_factor":10.3774},{"match_name":"WPGC 8-7-2017","match_date":"2017-08-07","stage_classifiercode":"99-11","member_number":"A69978","first_name":"DOMINIC","last_name":"KOH","classification":"M","division":"OPEN","hit_factor":10.3636},{"match_name":"MCAS March 2018 USPSA","match_date":"2018-03-17","stage_classifiercode":"99-11","member_number":"TY23626","first_name":"SCOTT","last_name":"NIELSEN","classification":"G","division":"OPEN","hit_factor":10.325},{"match_name":"Emmett July Match","match_date":"2017-07-21","stage_classifiercode":"99-11","member_number":"a84287","first_name":"SHANE","last_name":"STEUBE","classification":"A","division":"OPEN","hit_factor":10.3203},{"match_name":"YRPA USPSA MARCH  2018","match_date":"2018-03-25","stage_classifiercode":"99-11","member_number":"L3269","first_name":"BRIAN","last_name":"HUMANN","classification":"B","division":"OPEN","hit_factor":10.3189},{"match_name":"Extreme GM USPSA  November","match_date":"2020-11-27","stage_classifiercode":"99-11","member_number":"A78915","first_name":"STEVE","last_name":"KAWASMY","classification":"A","division":"OPEN","hit_factor":10.3147},{"match_name":"Rankin Field Sunday USPSA","match_date":"2018-04-15","stage_classifiercode":"99-11","member_number":"A90137","first_name":"LELAND","last_name":"HART","classification":"A","division":"OPEN","hit_factor":10.3131},{"match_name":"SAPSC Special Classifier Match","match_date":"2018-04-26","stage_classifiercode":"99-11","member_number":"A83950","first_name":"BRANDON","last_name":"REYNOLDS","classification":"U","division":"OPEN","hit_factor":10.3131},{"match_name":"MAPSA 2016.10.08","match_date":"2016-10-08","stage_classifiercode":"99-11","member_number":"TY77451","first_name":"JOEL","last_name":"ANDERSON","classification":"A","division":"OPEN","hit_factor":10.3053},{"match_name":"OFGC Practical Pistol Match 01-19-2020","match_date":"2020-01-19","stage_classifiercode":"99-11","member_number":"TY54207","first_name":"JAY","last_name":"MACKEY SR","classification":"M","division":"OPEN","hit_factor":10.297},{"match_name":"Ripon Oct USPSA Match","match_date":"2015-10-24","stage_classifiercode":"99-11","member_number":"A6358","first_name":"JEFF","last_name":"BUDEWITZ","classification":"G","division":"OPEN","hit_factor":10.2941},{"match_name":"SCCCNOVEMBER2016","match_date":"2016-11-13","stage_classifiercode":"99-11","member_number":"a46846","first_name":"KEVIN","last_name":"HODSDON","classification":"M","division":"OPEN","hit_factor":10.2857},{"match_name":"Superior Practical Shooters May 2018 Match","match_date":"2018-05-02","stage_classifiercode":"99-11","member_number":"A70332","first_name":"NICK","last_name":"HELBERT","classification":"M","division":"OPEN","hit_factor":10.2823},{"match_name":"OK15 USPSA at USSA May 6th 2018","match_date":"2018-05-06","stage_classifiercode":"99-11","member_number":"TY64463","first_name":"CHAD","last_name":"STANTON","classification":"U","division":"OPEN","hit_factor":10.2823},{"match_name":"June 2018 CAS USPSA","match_date":"2018-06-03","stage_classifiercode":"99-11","member_number":"L2100","first_name":"MAX","last_name":"MICHEL","classification":"M","division":"OPEN","hit_factor":10.2787},{"match_name":"NCPS USPSA Handgun Match November 27 2016","match_date":"2016-11-27","stage_classifiercode":"99-11","member_number":"TY68979","first_name":"GRIFFIN","last_name":"GUMAGAY","classification":"A","division":"OPEN","hit_factor":10.2767},{"match_name":"CFRPC December USPSA (Classifier)","match_date":"2018-12-16","stage_classifiercode":"99-11","member_number":"A81323","first_name":"JOE","last_name":"DRAGHI","classification":"A","division":"OPEN","hit_factor":10.2669},{"match_name":"Rio Salado Hosemasters February 2021","match_date":"2021-02-27","stage_classifiercode":"99-11","member_number":"A111995","first_name":"LEE","last_name":"WEINSTEIN","classification":"U","division":"OPEN","hit_factor":10.2655},{"match_name":"DAPS USPSA at ETTS 7-8-17","match_date":"2017-07-08","stage_classifiercode":"99-11","member_number":"TY53799","first_name":"LEE","last_name":"NEEL","classification":"G","division":"OPEN","hit_factor":10.2564},{"match_name":"Payson Practical Shooters - USPSA 2018 01 06","match_date":"2018-01-06","stage_classifiercode":"99-11","member_number":"L1849","first_name":"PAUL","last_name":"THOMPSON","classification":"M","division":"OPEN","hit_factor":10.2518},{"match_name":"RSPP 3rd Saturday November 2016","match_date":"2016-11-19","stage_classifiercode":"99-11","member_number":"TY55530","first_name":"TIM","last_name":"HIBBS","classification":"M","division":"OPEN","hit_factor":10.2515},{"match_name":"Pinetucky USPSA 06-16-18","match_date":"2018-06-16","stage_classifiercode":"99-11","member_number":"Ty61426","first_name":"THOMAS","last_name":"NYLAND","classification":"A","division":"OPEN","hit_factor":10.2421},{"match_name":"Hawkeye Gun Club July 2016 Match","match_date":"2016-07-16","stage_classifiercode":"99-11","member_number":"A93370","first_name":"CRAIG","last_name":"HOOKS","classification":"A","division":"OPEN","hit_factor":10.2377},{"match_name":"West Coast IPSC","match_date":"2018-07-22","stage_classifiercode":"99-11","member_number":"A98726","first_name":"CALEB","last_name":"BAER","classification":"A","division":"OPEN","hit_factor":10.219},{"match_name":"TCGC Polo July 2017","match_date":"2017-07-23","stage_classifiercode":"99-11","member_number":"A55556","first_name":"RON","last_name":"EVANS","classification":"B","division":"OPEN","hit_factor":10.1961},{"match_name":"Nampa USPSA December 4th 2021","match_date":"2021-12-04","stage_classifiercode":"99-11","member_number":"TY81469","first_name":"COBRA","last_name":"PANDA","classification":"M","division":"OPEN","hit_factor":10.1818},{"match_name":"WVPPS November 2020","match_date":"2020-11-15","stage_classifiercode":"99-11","member_number":"TY106367","first_name":"DANIEL","last_name":"MATHIAS","classification":"A","division":"OPEN","hit_factor":10.1796},{"match_name":"Ontelaunee USPSA Hose Fest","match_date":"2021-01-02","stage_classifiercode":"99-11","member_number":"A117552","first_name":"IAN","last_name":"FUNTILON","classification":"C","division":"OPEN","hit_factor":10.1761},{"match_name":"RSPP 3rd Saturday November 2016","match_date":"2016-11-19","stage_classifiercode":"99-11","member_number":"A18698","first_name":"MICHAEL","last_name":"DALE","classification":"M","division":"OPEN","hit_factor":10.1604},{"match_name":"BSPSC 2021 July Geo Thompson Single Stack Classic","match_date":"2021-07-11","stage_classifiercode":"99-11","member_number":"A103385","first_name":"TANNER","last_name":"COCHRELL","classification":"A","division":"OPEN","hit_factor":10.1594},{"match_name":"Benton Gun Club-USPSA June 27  9AM","match_date":"2021-06-27","stage_classifiercode":"99-11","member_number":"Fy101141","first_name":"MATHEW","last_name":"DOZIER","classification":"A","division":"OPEN","hit_factor":10.1549},{"match_name":"Hopkinton June  2016","match_date":"2016-06-04","stage_classifiercode":"99-11","member_number":"A34817","first_name":"DANIEL","last_name":"DIGIOVINE","classification":"A","division":"OPEN","hit_factor":10.1476},{"match_name":"ORGC CLASSIFIER 07-04-2017","match_date":"2017-07-04","stage_classifiercode":"99-11","member_number":"TY78149","first_name":"ELI","last_name":"SABER","classification":"A","division":"OPEN","hit_factor":10.1313},{"match_name":"LBAS160220","match_date":"2016-02-20","stage_classifiercode":"99-11","member_number":"A30546","first_name":"STEVE","last_name":"BURKE","classification":"M","division":"OPEN","hit_factor":10.1313},{"match_name":"NCPS USPSA Handgun Match November 27 2016","match_date":"2016-11-27","stage_classifiercode":"99-11","member_number":"TY91248","first_name":"DAVID","last_name":"GEORGE","classification":"U","division":"OPEN","hit_factor":10.1243},{"match_name":"LIPSA -  April 17th 2016 - USPSA Special Classifier Match","match_date":"2016-04-17","stage_classifiercode":"99-11","member_number":"ty41042","first_name":"JOSEPH","last_name":"PROCOPIO","classification":"M","division":"OPEN","hit_factor":10.124},{"match_name":"FAS Sunday Indoors USPSA Match","match_date":"2021-02-07","stage_classifiercode":"99-11","member_number":"A111317","first_name":"JUN","last_name":"CHANG","classification":"M","division":"OPEN","hit_factor":10.1215},{"match_name":"Brothers N Arms April 2016 USPSA Match (22Apr16-08:54:02)","match_date":"2016-04-23","stage_classifiercode":"99-11","member_number":"TY28590","first_name":"TIM","last_name":"FRANK","classification":"B","division":"OPEN","hit_factor":10.1083},{"match_name":"Rio Salado RSPP 3rd Saturday February 2020","match_date":"2020-02-15","stage_classifiercode":"99-11","member_number":"FYF68512","first_name":"MUNEKI","last_name":"SAMEJIMA","classification":"G","division":"OPEN","hit_factor":10.1053},{"match_name":"RSPP 3rd Saturday November 2016","match_date":"2016-11-19","stage_classifiercode":"99-11","member_number":"FYF68612","first_name":"MUNEKI","last_name":"SAMEJIMA","classification":"GM","division":"OPEN","hit_factor":10.1031},{"match_name":"Rio Salado UPPL September 2020","match_date":"2020-09-13","stage_classifiercode":"99-11","member_number":"A122959","first_name":"BRANDON","last_name":"ENGBRECHT","classification":"M","division":"OPEN","hit_factor":10.101},{"match_name":"ORPCI USPSA Saturday 2021.07.17","match_date":"2021-07-17","stage_classifiercode":"99-11","member_number":"TY120666","first_name":"PATRICK","last_name":"EAMES","classification":"B","division":"OPEN","hit_factor":10.0971},{"match_name":"Prescott Action Shooters 1st Saturday USPSA 6-2-2018 ","match_date":"2018-06-03","stage_classifiercode":"99-11","member_number":"L4093","first_name":"LEIGHTON","last_name":"OOSTHUISEN","classification":"G","division":"OPEN","hit_factor":10.0901},{"match_name":"Richmond Hot Shots April 30-May 1st USPSA Pistol Match","match_date":"2016-04-30","stage_classifiercode":"99-11","member_number":"L3657","first_name":"JAMES","last_name":"ONG","classification":"G","division":"OPEN","hit_factor":10.0823},{"match_name":"Ontelaunee USPSA July 2016","match_date":"2016-07-23","stage_classifiercode":"99-11","member_number":"TY41042","first_name":"JOSEPH","last_name":"PROCOPIO","classification":"M","division":"OPEN","hit_factor":10.0707},{"match_name":"WPGC 8-7-2017","match_date":"2017-08-07","stage_classifiercode":"99-11","member_number":"L3320","first_name":"CHARLIE","last_name":"PEREZ","classification":"G","division":"OPEN","hit_factor":10.0694},{"match_name":"Chillicothe February 2021 USPSA Match","match_date":"2021-02-28","stage_classifiercode":"99-11","member_number":"A52979","first_name":"AUSTIN","last_name":"CISNA","classification":"A","division":"OPEN","hit_factor":10.058},{"match_name":"APS August 1st Monthly USPSA Match  Classifier Match","match_date":"2021-08-01","stage_classifiercode":"99-11","member_number":"A131354","first_name":"MIKE","last_name":"ULLOA","classification":"A","division":"OPEN","hit_factor":10.0559},{"match_name":"MAPSA June Special Classifier","match_date":"2018-06-09","stage_classifiercode":"99-11","member_number":"FY69138","first_name":"JOHN","last_name":"CEDARBERG","classification":"A","division":"OPEN","hit_factor":10.052},{"match_name":"Dundee Practical Shooters - Oct 27 2018","match_date":"2018-10-27","stage_classifiercode":"99-11","member_number":"TY64113","first_name":"TOBIAS","last_name":"RICE","classification":"A","division":"OPEN","hit_factor":10.0352},{"match_name":"COPS 2015 Missouri Fall Classic","match_date":"2015-10-03","stage_classifiercode":"99-11","member_number":"L2615","first_name":"STEVEN","last_name":"MARSDEN","classification":"M","division":"OPEN","hit_factor":10.0186},{"match_name":"WGC April 2017 USPSA","match_date":"2017-04-23","stage_classifiercode":"99-11","member_number":"A93372","first_name":"JAMES","last_name":"LOFTON","classification":"A","division":"OPEN","hit_factor":10.0186},{"match_name":"2016-05-07 USPSA at Phoenix Rod and Gun Club","match_date":"2016-05-07","stage_classifiercode":"99-11","member_number":"FYF68512","first_name":"MUNEKI","last_name":"SAMEJIMA","classification":"G","division":"OPEN","hit_factor":10},{"match_name":"Hopkinton June  2016","match_date":"2016-06-04","stage_classifiercode":"99-11","member_number":"TY81500","first_name":"STEWART","last_name":"GINSBERG","classification":"C","division":"OPEN","hit_factor":10},{"match_name":"RBGC 2017-06-24","match_date":"2017-06-24","stage_classifiercode":"99-11","member_number":"TY56769","first_name":"JESSIE","last_name":"DUFF","classification":"G","division":"OPEN","hit_factor":10},{"match_name":"Richmond Hot Shots April 14-15-2018 USPSA Pistol Match","match_date":"2018-04-14","stage_classifiercode":"99-11","member_number":"A84616","first_name":"MJ","last_name":"FINEZA","classification":"M","division":"OPEN","hit_factor":10},{"match_name":"Prescott Action Shooters 1st Saturday USPSA 7-7-2018","match_date":"2018-07-07","stage_classifiercode":"99-11","member_number":"FYF68512","first_name":"MUNEKI","last_name":"SAMEJIMA","classification":"G","division":"OPEN","hit_factor":9.9796},{"match_name":"2017 EOD Warrior Foundation Match","match_date":"2017-04-29","stage_classifiercode":"99-11","member_number":"TY95504","first_name":"TANNER","last_name":"CARROLL","classification":"B","division":"OPEN","hit_factor":9.9644},{"match_name":"IN19 ACC USPSA September 23","match_date":"2018-09-23","stage_classifiercode":"99-11","member_number":"L2755","first_name":"LINCOLN","last_name":"CARR","classification":"A","division":"OPEN","hit_factor":9.9638},{"match_name":"CSA Coalfield Shooters Association USPSA March 2020","match_date":"2020-03-08","stage_classifiercode":"99-11","member_number":"A100644","first_name":"SETH","last_name":"LEWIS","classification":"A","division":"OPEN","hit_factor":9.9631},{"match_name":"Freeport","match_date":"2018-03-10","stage_classifiercode":"99-11","member_number":"TY90280","first_name":"ANTHONY","last_name":"BRUNO","classification":"A","division":"OPEN","hit_factor":9.9617},{"match_name":"Collin County USPSA 04-25-2021","match_date":"2021-04-24","stage_classifiercode":"99-11","member_number":"TY53799","first_name":"LEE","last_name":"NEEL","classification":"G","division":"OPEN","hit_factor":9.9494},{"match_name":"CSA Coalfield Shooters Association USPSA March 2020","match_date":"2020-03-08","stage_classifiercode":"99-11","member_number":"A110946","first_name":"BRIAN","last_name":"KELLER","classification":"A","division":"OPEN","hit_factor":9.9467},{"match_name":"Richmond Hot Shots April 30-May 1st USPSA Pistol Match","match_date":"2016-04-30","stage_classifiercode":"99-11","member_number":"TY24456","first_name":"RANDY","last_name":"MELTON","classification":"M","division":"OPEN","hit_factor":9.9448},{"match_name":"Pitcairn-Monroeville Sportsmens Club USPSA August 2017","match_date":"2017-08-05","stage_classifiercode":"99-11","member_number":"A82941","first_name":"DARREN","last_name":"HEROLD","classification":"B","division":"OPEN","hit_factor":9.9437},{"match_name":"LIPSA  December 11th 2016 - USPSA Match","match_date":"2016-12-11","stage_classifiercode":"99-11","member_number":"TY41042","first_name":"JOSEPH","last_name":"PROCOPIO","classification":"M","division":"OPEN","hit_factor":9.9426},{"match_name":"OK15 USPSA at USSA May 6th 2018","match_date":"2018-05-06","stage_classifiercode":"99-11","member_number":"TY54207","first_name":"JAY","last_name":"MACKEY SR","classification":"M","division":"OPEN","hit_factor":9.9415},{"match_name":"Clone Tue","match_date":"2017-03-29","stage_classifiercode":"99-11","member_number":"a86283","first_name":"MEL","last_name":"RODERO LL","classification":"M","division":"OPEN","hit_factor":9.9379},{"match_name":"BRSP Tuesday Night USPSA Match - Sept 11","match_date":"2018-09-12","stage_classifiercode":"99-11","member_number":"A73074","first_name":"STEVE","last_name":"COULTER","classification":"M","division":"OPEN","hit_factor":9.9278},{"match_name":"GRPC USPSA TAX REFUND ","match_date":"2018-04-15","stage_classifiercode":"99-11","member_number":"TY26527","first_name":"DAVE","last_name":"CAMPBELL","classification":"M","division":"OPEN","hit_factor":9.9029},{"match_name":"Baps March Uspsa","match_date":"2016-03-19","stage_classifiercode":"99-11","member_number":"L3674","first_name":"AUGUST","last_name":"BALAGTAS","classification":"M","division":"OPEN","hit_factor":9.8958},{"match_name":"OREGON ARPC CC05 USPSA AUGUST 12 2017","match_date":"2017-08-12","stage_classifiercode":"99-11","member_number":"TY80149","first_name":"JIM","last_name":"BOONE","classification":"B","division":"OPEN","hit_factor":9.8921},{"match_name":"WVPPS November 2018","match_date":"2018-11-18","stage_classifiercode":"99-11","member_number":"A26597","first_name":"MAX","last_name":"BEDWELL","classification":"G","division":"OPEN","hit_factor":9.8921},{"match_name":"Shadow Hawk Defense USPSA Special Classifier","match_date":"2020-11-14","stage_classifiercode":"99-11","member_number":"TY72738","first_name":"DAVID","last_name":"THOMPSON","classification":"B","division":"OPEN","hit_factor":9.8901},{"match_name":"Ontelaunee USPSA  July 2018","match_date":"2018-07-29","stage_classifiercode":"99-11","member_number":"TY90280","first_name":"ANTHONY","last_name":"BRUNO","classification":"M","division":"OPEN","hit_factor":9.8901},{"match_name":"USPSA MO21 2Alpha SBRC December 22 2018","match_date":"2018-12-22","stage_classifiercode":"99-11","member_number":"A102464","first_name":"COLE","last_name":"HUFFMAN","classification":"B","division":"OPEN","hit_factor":9.8787},{"match_name":"Hopkinton USPSA May 2017","match_date":"2017-05-06","stage_classifiercode":"99-11","member_number":"TY90354","first_name":"BRIAN","last_name":"HARRINGTON","classification":"A","division":"OPEN","hit_factor":9.8765},{"match_name":"BA USPSA Sep  23/2017","match_date":"2017-09-23","stage_classifiercode":"99-11","member_number":"A100644","first_name":"SETH","last_name":"LEWIS","classification":"B","division":"OPEN","hit_factor":9.872},{"match_name":"LIPSA  December 11th 2016 - USPSA Match","match_date":"2016-12-11","stage_classifiercode":"99-11","member_number":"TY85379","first_name":"JOE","last_name":"TOLENO","classification":"A","division":"OPEN","hit_factor":9.872},{"match_name":"DCPA USPSA 10-11-2020","match_date":"2020-10-11","stage_classifiercode":"99-11","member_number":"A68001","first_name":"GUS","last_name":"VANETTEN","classification":"M","division":"OPEN","hit_factor":9.872},{"match_name":"SCCCNOVEMBER2016","match_date":"2016-11-13","stage_classifiercode":"99-11","member_number":"a26597","first_name":"MAX","last_name":"BEDWELL","classification":"M","division":"OPEN","hit_factor":9.872},{"match_name":"AAPS AAFG Level 1 Match - May 5 2018","match_date":"2018-05-05","stage_classifiercode":"99-11","member_number":"L3202","first_name":"RUSSELL","last_name":"FORTNEY","classification":"A","division":"OPEN","hit_factor":9.8662},{"match_name":"Pardoe Sportsmens Association- USPSA Saturday 4-3-21","match_date":"2021-04-03","stage_classifiercode":"99-11","member_number":"TY91700","first_name":"JEFF","last_name":"MORSE","classification":"U","division":"OPEN","hit_factor":9.8566},{"match_name":"Richmond Hot Shots October 6-7 USPSA Pistol Match","match_date":"2018-10-06","stage_classifiercode":"99-11","member_number":"TY74322","first_name":"ANDRE","last_name":"TAUBE","classification":"A","division":"OPEN","hit_factor":9.8456},{"match_name":"Brothers N Arms December 2018 USPSA Match","match_date":"2018-12-15","stage_classifiercode":"99-11","member_number":"A106584","first_name":"PHILLIP","last_name":"SEXTON","classification":"M","division":"OPEN","hit_factor":9.8446},{"match_name":"GAS June Special Classifier","match_date":"2017-06-03","stage_classifiercode":"99-11","member_number":"A76728","first_name":"KRIS","last_name":"NEWSTROM","classification":"A","division":"OPEN","hit_factor":9.8418},{"match_name":"Dundee Practical Shooters - Single Stack Challenge - Jan 23 2021","match_date":"2021-01-23","stage_classifiercode":"99-11","member_number":"A81899","first_name":"TANNER","last_name":"BREEN","classification":"A","division":"OPEN","hit_factor":9.8266},{"match_name":"WVPPS May 2021","match_date":"2021-05-16","stage_classifiercode":"99-11","member_number":"A26597","first_name":"MAX","last_name":"BEDWELL","classification":"G","division":"OPEN","hit_factor":9.8246},{"match_name":"Nampa USPSA December 4th 2021","match_date":"2021-12-04","stage_classifiercode":"99-11","member_number":"A530","first_name":"JERRY","last_name":"DIX","classification":"M","division":"OPEN","hit_factor":9.8214},{"match_name":"Grandbaggers August 2017","match_date":"2017-08-03","stage_classifiercode":"99-11","member_number":"TY85183","first_name":"DANNY","last_name":"D'ANGELO","classification":"A","division":"OPEN","hit_factor":9.8139},{"match_name":"WNYPPL August 2017 Classifier Match","match_date":"2017-08-27","stage_classifiercode":"99-11","member_number":"FYF29266","first_name":"PAT","last_name":"HARRISON","classification":"M","division":"OPEN","hit_factor":9.8074},{"match_name":"K-Foot Classifier EW RP JP","match_date":"2017-03-30","stage_classifiercode":"99-11","member_number":"A78020","first_name":"JASON","last_name":"PRATT","classification":"U","division":"OPEN","hit_factor":9.8074},{"match_name":"LCSA USPSA March Match","match_date":"2016-03-12","stage_classifiercode":"99-11","member_number":"L1205","first_name":"STEVE","last_name":"MARTIN","classification":"G","division":"OPEN","hit_factor":9.8004},{"match_name":"Ontelaunee USPSA  July 2018","match_date":"2018-07-29","stage_classifiercode":"99-11","member_number":"TY82014","first_name":"TONY","last_name":"SPINILLO","classification":"B","division":"OPEN","hit_factor":9.7973},{"match_name":"SWGC USPSA Pistol Match - November 2021","match_date":"2021-11-06","stage_classifiercode":"99-11","member_number":"L4056","first_name":"DILLION","last_name":"WALKER","classification":"M","division":"OPEN","hit_factor":9.7917},{"match_name":"Swamp Eagles 2015-12","match_date":"2015-12-20","stage_classifiercode":"99-11","member_number":"A85466","first_name":"CHRIS","last_name":"CARNEY","classification":"A","division":"OPEN","hit_factor":9.7844},{"match_name":"CGGR July USPSA Match","match_date":"2018-07-21","stage_classifiercode":"99-11","member_number":"L3974","first_name":"ANDY","last_name":"KWON","classification":"M","division":"OPEN","hit_factor":9.7826},{"match_name":"Hopkinton USPSA October 2018","match_date":"2018-10-06","stage_classifiercode":"99-11","member_number":"A34817","first_name":"DANIEL","last_name":"DIGIOVINE JR","classification":"A","division":"OPEN","hit_factor":9.7808},{"match_name":"Dundee Practical Shooters - Single Stack Challenge - Jan 23 2021","match_date":"2021-01-23","stage_classifiercode":"99-11","member_number":"A85786","first_name":"NOEL","last_name":"DOMINGO","classification":"A","division":"OPEN","hit_factor":9.7731},{"match_name":"LRC USPSA 2016-6-15","match_date":"2016-06-15","stage_classifiercode":"99-11","member_number":"L3567","first_name":"RON","last_name":"SELBY","classification":"A","division":"OPEN","hit_factor":9.7682},{"match_name":"LBAS160220","match_date":"2016-02-20","stage_classifiercode":"99-11","member_number":"TY32676","first_name":"JOHN","last_name":"MIEZEJEWSKI","classification":"M","division":"OPEN","hit_factor":9.7606},{"match_name":"TPS USPSA at CMP March 18 2017","match_date":"2017-03-18","stage_classifiercode":"99-11","member_number":"TY59210","first_name":"KACI LYNN","last_name":"COCHRAN","classification":"M","division":"OPEN","hit_factor":9.7561},{"match_name":"Shoot Gtr USPSA 10/18","match_date":"2016-10-18","stage_classifiercode":"99-11","member_number":"TY69089","first_name":"MATT","last_name":"MITCHELL","classification":"A","division":"OPEN","hit_factor":9.7521},{"match_name":"USPSA MO21 2Alpha SBRC December 22 2018","match_date":"2018-12-22","stage_classifiercode":"99-11","member_number":"A79174","first_name":"BRIXEY","last_name":"NELSON","classification":"M","division":"OPEN","hit_factor":9.7473},{"match_name":"Lin's","match_date":"2017-07-15","stage_classifiercode":"99-11","member_number":"\"\"","first_name":"JAMES","last_name":"LOFTON","classification":"\"\"","division":"OPEN","hit_factor":9.7391},{"match_name":"HSC USPSA October 7th 2017","match_date":"2017-10-06","stage_classifiercode":"99-11","member_number":"l1063","first_name":"CHUCK","last_name":"BROOKS","classification":"A","division":"OPEN","hit_factor":9.7315},{"match_name":"FAS Tuesday Night Indoors Match","match_date":"2021-03-17","stage_classifiercode":"99-11","member_number":"TY112345","first_name":"ZACHARY","last_name":"MCLAUGHLIN","classification":"M","division":"OPEN","hit_factor":9.7276},{"match_name":"LPRGC - Lower Providence USPSA Match November 2021","match_date":"2021-11-06","stage_classifiercode":"99-11","member_number":"TY82014","first_name":"TONY","last_name":"SPINILLO","classification":"A","division":"OPEN","hit_factor":9.727},{"match_name":"KSA USPSA  3 April 2021","match_date":"2021-04-03","stage_classifiercode":"99-11","member_number":"FY115754","first_name":"ADAM","last_name":"ROBINSON","classification":"A","division":"OPEN","hit_factor":9.7173},{"match_name":"Shadow Hawk Defense USPSA Special Classifier","match_date":"2020-11-14","stage_classifiercode":"99-11","member_number":"A72815","first_name":"BRETT","last_name":"DAVENPORT","classification":"A","division":"OPEN","hit_factor":9.7143},{"match_name":"Pelham USPSA 2016-09-18","match_date":"2016-09-18","stage_classifiercode":"99-11","member_number":"A34817","first_name":"DAN","last_name":"DIGIOVINE","classification":"A","division":"OPEN","hit_factor":9.7122},{"match_name":"COPS 2015 Missouri Fall Classic","match_date":"2015-10-03","stage_classifiercode":"99-11","member_number":"L3177","first_name":"SHERWYN","last_name":"GREENFIELD","classification":"M","division":"OPEN","hit_factor":9.7104},{"match_name":"Grandbaggers August 2017","match_date":"2017-08-03","stage_classifiercode":"99-11","member_number":"TY92648","first_name":"E.T.","last_name":"SAFFON","classification":"M","division":"OPEN","hit_factor":9.7087},{"match_name":"Shadow Hawk Defense USPSA Special Classifier","match_date":"2020-11-14","stage_classifiercode":"99-11","member_number":"TY109443","first_name":"JASON","last_name":"TAJIMA","classification":"C","division":"OPEN","hit_factor":9.707},{"match_name":"MVS ANPRACS USPSA 2-21-16","match_date":"2016-02-21","stage_classifiercode":"99-11","member_number":"A54095","first_name":"ALBERT","last_name":"MANUEL","classification":"A","division":"OPEN","hit_factor":9.7015},{"match_name":"17s PSC - Go Fast Donâ€™t Suck 2020 Spring Postal Match (USPSA)","match_date":"2020-05-16","stage_classifiercode":"99-11","member_number":"FY90896","first_name":"CHANDLER","last_name":"NELSON","classification":"A","division":"OPEN","hit_factor":9.6886},{"match_name":"BLUE RIDGE ARSENAL July 6 Classifier Match","match_date":"2018-07-06","stage_classifiercode":"99-11","member_number":"Ty89408","first_name":"CHRISTOPHER","last_name":"AN","classification":"B","division":"OPEN","hit_factor":9.6886},{"match_name":"Grandbaggers August 2017","match_date":"2017-08-03","stage_classifiercode":"99-11","member_number":"FL3478","first_name":"FRANK","last_name":"KOCH","classification":"M","division":"OPEN","hit_factor":9.6774},{"match_name":"CSS February 2016","match_date":"2016-02-12","stage_classifiercode":"99-11","member_number":"A78528","first_name":"TIM","last_name":"MEKOSH","classification":"M","division":"OPEN","hit_factor":9.6774},{"match_name":"JPPS Club Match","match_date":"2015-09-12","stage_classifiercode":"99-11","member_number":"A23320","first_name":"JOHN","last_name":"STIEDLE","classification":"M","division":"OPEN","hit_factor":9.6601},{"match_name":"Dundee Practical Shooters - Single Stack Challenge - Jan 23 2021","match_date":"2021-01-23","stage_classifiercode":"99-11","member_number":"L4735","first_name":"GEOFFREY","last_name":"PESTES","classification":"B","division":"OPEN","hit_factor":9.6601},{"match_name":"NHRPC - March 2021 USPSA","match_date":"2021-03-14","stage_classifiercode":"99-11","member_number":"TY99130","first_name":"AMEET","last_name":"DAS","classification":"A","division":"OPEN","hit_factor":9.6563},{"match_name":"NW01 April da Turd","match_date":"2018-04-04","stage_classifiercode":"99-11","member_number":"FY76563","first_name":"SORIDA","last_name":"EAP","classification":"A","division":"OPEN","hit_factor":9.6552},{"match_name":"Rio Salado Hosemasters February 2021","match_date":"2021-02-27","stage_classifiercode":"99-11","member_number":"A49035","first_name":"EDDIE","last_name":"GARCIA","classification":"G","division":"OPEN","hit_factor":9.6506},{"match_name":"CSA Coalfield Shooters Association USPSA March 2020","match_date":"2020-03-08","stage_classifiercode":"99-11","member_number":"A110946","first_name":"BRIAN","last_name":"KELLER","classification":"A","division":"OPEN","hit_factor":9.6491},{"match_name":"Richmond Hot Shots April 30-May 1st USPSA Pistol Match","match_date":"2016-04-30","stage_classifiercode":"99-11","member_number":"A85939","first_name":"NILO","last_name":"NUNEZ II","classification":"M","division":"OPEN","hit_factor":9.6457},{"match_name":"AGC_20170903","match_date":"2017-09-03","stage_classifiercode":"99-11","member_number":"TY69978","first_name":"DOMINIC","last_name":"KOH","classification":"M","division":"OPEN","hit_factor":9.6429},{"match_name":"Richmond Hot Shots October 6-7 USPSA Pistol Match","match_date":"2018-10-06","stage_classifiercode":"99-11","member_number":"FY82686","first_name":"CASEY","last_name":"RYAN","classification":"M","division":"OPEN","hit_factor":9.6386},{"match_name":"SFA   USPSA 2/20/2016","match_date":"2016-02-20","stage_classifiercode":"99-11","member_number":"A78467","first_name":"LYNDA","last_name":"TURNBULL","classification":"B","division":"OPEN","hit_factor":9.6346},{"match_name":"RBGC 2017-06-24","match_date":"2017-06-24","stage_classifiercode":"99-11","member_number":"TY59210","first_name":"KACI LYNN","last_name":"COCHRAN","classification":"M","division":"OPEN","hit_factor":9.6296},{"match_name":"Deadwood Boys USPSA All Classifier Match","match_date":"2016-08-07","stage_classifiercode":"99-11","member_number":"A78856","first_name":"CRIS","last_name":"CARPENTER","classification":"B","division":"OPEN","hit_factor":9.6296},{"match_name":"CSS July 2016","match_date":"2016-07-09","stage_classifiercode":"99-11","member_number":"A78528","first_name":"TIM","last_name":"MEKOSH","classification":"M","division":"OPEN","hit_factor":9.6284},{"match_name":"Emmett July Match","match_date":"2017-07-21","stage_classifiercode":"99-11","member_number":"a530","first_name":"JERRY","last_name":"DIX","classification":"M","division":"OPEN","hit_factor":9.6257},{"match_name":"LBAS160220","match_date":"2016-02-20","stage_classifiercode":"99-11","member_number":"TY47022","first_name":"BRUCE","last_name":"WOOD","classification":"A","division":"OPEN","hit_factor":9.6154},{"match_name":"COPS 2015 Missouri Fall Classic","match_date":"2015-10-03","stage_classifiercode":"99-11","member_number":"TY-55378","first_name":"TRAVIS","last_name":"THOMPSON","classification":"B","division":"OPEN","hit_factor":9.6121},{"match_name":"PRG - Oh Shoot USPSA February 21st - 3rd Sunday Match","match_date":"2021-02-21","stage_classifiercode":"99-11","member_number":"L1102","first_name":"TOM","last_name":"FACE","classification":"M","division":"OPEN","hit_factor":9.6118},{"match_name":"Palmetto Gun Club - April 2017 USPSA","match_date":"2017-04-08","stage_classifiercode":"99-11","member_number":"TY67776","first_name":"NICK","last_name":"ORTALAZA","classification":"B","division":"OPEN","hit_factor":9.5986},{"match_name":"Freeport","match_date":"2018-03-10","stage_classifiercode":"99-11","member_number":"L3851","first_name":"JEFF","last_name":"PAULSEN","classification":"A","division":"OPEN","hit_factor":9.5986},{"match_name":"11 March Classifier Match","match_date":"2018-03-10","stage_classifiercode":"99-11","member_number":"A105266","first_name":"ERIC","last_name":"FORREST","classification":"B","division":"OPEN","hit_factor":9.596},{"match_name":"TMGN December 21 Practical Shooter Match","match_date":"2017-12-22","stage_classifiercode":"99-11","member_number":"\"\"","first_name":"KEVIN","last_name":"STICKLEY","classification":"\"\"","division":"OPEN","hit_factor":9.5918},{"match_name":"GoShoot Indoors","match_date":"2017-06-11","stage_classifiercode":"99-11","member_number":"ty88829","first_name":"STEVE","last_name":"DRAPER","classification":"A","division":"OPEN","hit_factor":9.5915},{"match_name":"Richmond Hot Shots October 6-7 USPSA Pistol Match","match_date":"2018-10-06","stage_classifiercode":"99-11","member_number":"A61934","first_name":"WILLIAM","last_name":"TIU","classification":"B","division":"OPEN","hit_factor":9.5915},{"match_name":"MPSA 07182020 USPSA","match_date":"2020-07-18","stage_classifiercode":"99-11","member_number":"TY98602","first_name":"NEIL","last_name":"DRENNAN","classification":"B","division":"OPEN","hit_factor":9.589},{"match_name":"MPSA 07182020 USPSA","match_date":"2020-07-18","stage_classifiercode":"99-11","member_number":"TY42086","first_name":"BILL","last_name":"JACKSON","classification":"A","division":"OPEN","hit_factor":9.589},{"match_name":"TMGN April 5 USPSA Classifiers Match","match_date":"2018-04-05","stage_classifiercode":"99-11","member_number":"A101649","first_name":"PAUL","last_name":"WILLIAMS","classification":"\"\"","division":"OPEN","hit_factor":9.5841},{"match_name":"Blackstone Shooting Sports May 2017 USPSA Pistol Level 1","match_date":"2017-05-09","stage_classifiercode":"99-11","member_number":"L3906","first_name":"ARIC","last_name":"COWART","classification":"B","division":"OPEN","hit_factor":9.5819},{"match_name":"LCSC Linden USPSA 092621","match_date":"2021-09-25","stage_classifiercode":"99-11","member_number":"TY94643","first_name":"CARLSON","last_name":"SETO","classification":"B","division":"OPEN","hit_factor":9.5798},{"match_name":"Prescott 1 st Saturday 12-03-2016","match_date":"2016-12-03","stage_classifiercode":"99-11","member_number":"A88480","first_name":"DANIEL","last_name":"LINDEGREN","classification":"M","division":"OPEN","hit_factor":9.5785},{"match_name":"Brothers N Arms December 2018 USPSA Match","match_date":"2018-12-15","stage_classifiercode":"99-11","member_number":"TY28619","first_name":"SCOTT","last_name":"JACOB","classification":"A","division":"OPEN","hit_factor":9.5764},{"match_name":"CSA Coalfield Shooters Association USPSA March 2020","match_date":"2020-03-08","stage_classifiercode":"99-11","member_number":"A100644","first_name":"SETH","last_name":"LEWIS","classification":"A","division":"OPEN","hit_factor":9.5764},{"match_name":"July 2016 H&H Match","match_date":"2016-07-24","stage_classifiercode":"99-11","member_number":"A71435","first_name":"FEGEE","last_name":"MATLOCK","classification":"A","division":"OPEN","hit_factor":9.571},{"match_name":"MCAS March 2021 USPSA","match_date":"2021-03-28","stage_classifiercode":"99-11","member_number":"Ty63885","first_name":"TIMOTHY","last_name":"PROCTOR","classification":"A","division":"OPEN","hit_factor":9.571},{"match_name":"Pitcairn-Monroeville Sportsmens Club USPSA August 2017","match_date":"2017-08-05","stage_classifiercode":"99-11","member_number":"TY90731","first_name":"MICHAEL","last_name":"FORD","classification":"B","division":"OPEN","hit_factor":9.5703},{"match_name":"Collin County USPSA 04-25-2021","match_date":"2021-04-24","stage_classifiercode":"99-11","member_number":"TY56332","first_name":"DERON","last_name":"WOOD","classification":"A","division":"OPEN","hit_factor":9.5588},{"match_name":"SFA   USPSA 2/20/2016","match_date":"2016-02-20","stage_classifiercode":"99-11","member_number":"TY76701","first_name":"GLENN","last_name":"FANNIN","classification":"A","division":"OPEN","hit_factor":9.5575},{"match_name":"TMGN April 5 USPSA Classifiers Match","match_date":"2018-04-05","stage_classifiercode":"99-11","member_number":"A103667","first_name":"KEANU","last_name":"SY","classification":"\"\"","division":"OPEN","hit_factor":9.5552},{"match_name":"Prescott Action Shooters 1st Saturday USPSA 6-2-2018 ","match_date":"2018-06-03","stage_classifiercode":"99-11","member_number":"A88480","first_name":"DANIEL","last_name":"LINDEGREN","classification":"M","division":"OPEN","hit_factor":9.54},{"match_name":"Nampa USPSA May 29th 2021","match_date":"2021-05-29","stage_classifiercode":"99-11","member_number":"TY85985","first_name":"CHRISTOPHER","last_name":"COLLINS","classification":"M","division":"OPEN","hit_factor":9.5331},{"match_name":"ORGC Tuesday classifier August-21-2018","match_date":"2018-08-21","stage_classifiercode":"99-11","member_number":"FY105696","first_name":"STUART","last_name":"WEAVER","classification":"B","division":"OPEN","hit_factor":9.5321},{"match_name":"RPS December 2017 USPSA Match","match_date":"2017-12-09","stage_classifiercode":"99-11","member_number":"TY90226","first_name":"JAMES","last_name":"TURNURE","classification":"G","division":"OPEN","hit_factor":9.5321},{"match_name":"Hallstead USPSA  July Match","match_date":"2020-07-25","stage_classifiercode":"99-11","member_number":"a33985","first_name":"DONALD","last_name":"SEIGLE","classification":"M","division":"OPEN","hit_factor":9.5156},{"match_name":"North Mountain PS April","match_date":"2016-04-15","stage_classifiercode":"99-11","member_number":"L2902","first_name":"ROBERT","last_name":"KING","classification":"A","division":"OPEN","hit_factor":9.5146},{"match_name":"LdF USPSA Match January 25 2020","match_date":"2020-01-25","stage_classifiercode":"99-11","member_number":"TY110175","first_name":"JASON","last_name":"HURST","classification":"B","division":"OPEN","hit_factor":9.5064},{"match_name":"SUPS All Classifier Match March 1718 2018","match_date":"2018-03-17","stage_classifiercode":"99-11","member_number":"A84390","first_name":"JUSTINE","last_name":"WILLIAMS","classification":"M","division":"OPEN","hit_factor":9.5064},{"match_name":"2016-05-07 USPSA at Phoenix Rod and Gun Club","match_date":"2016-05-07","stage_classifiercode":"99-11","member_number":"FY64379","first_name":"RICK","last_name":"DENTON","classification":"M","division":"OPEN","hit_factor":9.4842},{"match_name":"ENPS 2018 June USPSA Match","match_date":"2018-06-03","stage_classifiercode":"99-11","member_number":"TY4180","first_name":"JAY","last_name":"TAPPE","classification":"A","division":"OPEN","hit_factor":9.4771},{"match_name":"MS06 Team Magnolia USPSA Sept Match","match_date":"2015-09-06","stage_classifiercode":"99-11","member_number":"L3696","first_name":"ROBERT","last_name":"HALSELL","classification":"A","division":"OPEN","hit_factor":9.4771},{"match_name":"MSSA Uspsa Club Match","match_date":"2017-08-27","stage_classifiercode":"99-11","member_number":"A23320","first_name":"JOHN","last_name":"STIEDLE","classification":"M","division":"OPEN","hit_factor":9.4737},{"match_name":"Devil Dog USPSA Classifier Match-Saturday Session","match_date":"2018-03-10","stage_classifiercode":"99-11","member_number":"TY88829","first_name":"STEVE","last_name":"DRAPER","classification":"A","division":"OPEN","hit_factor":9.4737},{"match_name":"SCCCNOVEMBER2016","match_date":"2016-11-13","stage_classifiercode":"99-11","member_number":"L2755","first_name":"LINCOLN","last_name":"CARR","classification":"A","division":"OPEN","hit_factor":9.4684},{"match_name":"MS06 Team Magnolia February 2018 USPSA Match","match_date":"2018-02-03","stage_classifiercode":"99-11","member_number":"A77783","first_name":"GREG","last_name":"GREENE","classification":"B","division":"OPEN","hit_factor":9.4664},{"match_name":"SCCCNOVEMBER2016","match_date":"2016-11-13","stage_classifiercode":"99-11","member_number":"L3088","first_name":"RALPH","last_name":"LOPEZ","classification":"A","division":"OPEN","hit_factor":9.4643},{"match_name":"Brothers N Arms April 2016 USPSA Match (22Apr16-08:54:02)","match_date":"2016-04-23","stage_classifiercode":"99-11","member_number":"Fy81419","first_name":"JOHN","last_name":"NGUYEN","classification":"A","division":"OPEN","hit_factor":9.462},{"match_name":"GoShoot Outdoor January 10th","match_date":"2021-01-10","stage_classifiercode":"99-11","member_number":"A90953","first_name":"DAVID","last_name":"CLAY","classification":"M","division":"OPEN","hit_factor":9.4595},{"match_name":"NCPS USPSA Handgun Match November 27 2016","match_date":"2016-11-27","stage_classifiercode":"99-11","member_number":"A88607","first_name":"FRANCO","last_name":"GESMUNDO","classification":"A","division":"OPEN","hit_factor":9.4567},{"match_name":"Ontelaunee USPSA July 2016","match_date":"2016-07-23","stage_classifiercode":"99-11","member_number":"TY58697","first_name":"GARY","last_name":"PARSONS","classification":"B","division":"OPEN","hit_factor":9.4545},{"match_name":"TMGN USPSA July 6th Match","match_date":"2017-07-06","stage_classifiercode":"99-11","member_number":"l2902","first_name":"ROBERT","last_name":"KING","classification":"M","division":"OPEN","hit_factor":9.4545},{"match_name":"Richmond Hot Shots April 30-May 1st USPSA Pistol Match","match_date":"2016-04-30","stage_classifiercode":"99-11","member_number":"L2908","first_name":"JOHNNY","last_name":"LIM","classification":"A","division":"OPEN","hit_factor":9.4545},{"match_name":"WNYPPL August 2017 Classifier Match","match_date":"2017-08-27","stage_classifiercode":"99-11","member_number":"L2551","first_name":"DEREK","last_name":"ZMOZYNSKI","classification":"M","division":"OPEN","hit_factor":9.4406},{"match_name":"MVS ANPRACS USPSA 2-21-16","match_date":"2016-02-21","stage_classifiercode":"99-11","member_number":"A27383","first_name":"MANNY","last_name":"AURIGUE","classification":"A","division":"OPEN","hit_factor":9.434},{"match_name":"PRG 2017 Classifier Match","match_date":"2017-02-19","stage_classifiercode":"99-11","member_number":"TY68524","first_name":"ZVI","last_name":"DAVIDOFF","classification":"A","division":"OPEN","hit_factor":9.427},{"match_name":"DPSL July 22 2018 All Classifier","match_date":"2018-07-22","stage_classifiercode":"99-11","member_number":"FY80542","first_name":"DIANA","last_name":"DRISCOLL","classification":"B","division":"OPEN","hit_factor":9.4241},{"match_name":"CCPL 01102016 ALL CLASSIFIER MATCH","match_date":"2016-01-10","stage_classifiercode":"99-11","member_number":"A54659","first_name":"TOM","last_name":"SCHILLER","classification":"A","division":"OPEN","hit_factor":9.4241},{"match_name":"LPRGC-Lower Providence USPSA May-1 2017","match_date":"2017-05-05","stage_classifiercode":"99-11","member_number":"A33985","first_name":"DONALD","last_name":"SEIGLE","classification":"M","division":"OPEN","hit_factor":9.4215},{"match_name":"ORPCI USPSA Saturday 2021.07.17","match_date":"2021-07-17","stage_classifiercode":"99-11","member_number":"A55824","first_name":"JEFF","last_name":"GORDON","classification":"B","division":"OPEN","hit_factor":9.4077},{"match_name":"WNYPPL August 2017 Classifier Match","match_date":"2017-08-27","stage_classifiercode":"99-11","member_number":"F67164","first_name":"BRUNO","last_name":"PRONIO","classification":"B","division":"OPEN","hit_factor":9.4077},{"match_name":"ORPCI USPSA Saturday 2020.07.18","match_date":"2020-07-18","stage_classifiercode":"99-11","member_number":"A104224","first_name":"ANDY","last_name":"TILFORD","classification":"","division":"OPEN","hit_factor":9.4059},{"match_name":"Rio Salado Hosemasters February 2021","match_date":"2021-02-27","stage_classifiercode":"99-11","member_number":"A86545","first_name":"JAY","last_name":"WEBB","classification":"A","division":"OPEN","hit_factor":9.3913},{"match_name":"Dundee USPSA Feb 2016","match_date":"2016-02-27","stage_classifiercode":"99-11","member_number":"TY61952","first_name":"JOHN","last_name":"MCCLELLAND","classification":"B","division":"OPEN","hit_factor":9.3904},{"match_name":"Target  Sports Central Indiana Championship","match_date":"2020-08-22","stage_classifiercode":"99-11","member_number":"TY106367","first_name":"DANIEL","last_name":"MATHIAS","classification":"A","division":"OPEN","hit_factor":9.3851},{"match_name":"CCPL 12102017","match_date":"2017-12-08","stage_classifiercode":"99-11","member_number":"TY87000","first_name":"GREG","last_name":"VAUGHN","classification":"A","division":"OPEN","hit_factor":9.3802},{"match_name":"Nampa USPSA December 4th 2021","match_date":"2021-12-04","stage_classifiercode":"99-11","member_number":"TY106643","first_name":"EUGENE","last_name":"DINA","classification":"U","division":"OPEN","hit_factor":9.375},{"match_name":"Maine Practical Shooters March 2018","match_date":"2018-03-24","stage_classifiercode":"99-11","member_number":"A105968","first_name":"JAY","last_name":"BEAL","classification":"B","division":"OPEN","hit_factor":9.375},{"match_name":"ORPCI USPSA Saturday 2021.07.17","match_date":"2021-07-17","stage_classifiercode":"99-11","member_number":"A89770","first_name":"TOM","last_name":"WELBORN","classification":"B","division":"OPEN","hit_factor":9.364},{"match_name":"SUPS All Classifier Match March 1718 2018","match_date":"2018-03-17","stage_classifiercode":"99-11","member_number":"A1462","first_name":"DAVE","last_name":"BOSHARD","classification":"M","division":"OPEN","hit_factor":9.3596},{"match_name":"Skills 116 Rounds","match_date":"2016-07-09","stage_classifiercode":"99-11","member_number":"A72613","first_name":"DONNIE","last_name":"SMITH","classification":"A","division":"OPEN","hit_factor":9.3588},{"match_name":"FBURG USPSA November 2020","match_date":"2020-11-01","stage_classifiercode":"99-11","member_number":"A72815","first_name":"BRETT","last_name":"DAVENPORT","classification":"A","division":"OPEN","hit_factor":9.3489},{"match_name":"West Coast IPSC","match_date":"2018-07-22","stage_classifiercode":"99-11","member_number":"FY39124","first_name":"RAMIRO","last_name":"REYES","classification":"M","division":"OPEN","hit_factor":9.3474},{"match_name":"Brothers N Arms December 2018 USPSA Match","match_date":"2018-12-15","stage_classifiercode":"99-11","member_number":"A86980","first_name":"BRYAN","last_name":"TULLOS","classification":"A","division":"OPEN","hit_factor":9.3426},{"match_name":"WNYPPL August 2017 Classifier Match","match_date":"2017-08-27","stage_classifiercode":"99-11","member_number":"FL1179","first_name":"JOSKO","last_name":"KOVIC","classification":"A","division":"OPEN","hit_factor":9.3398},{"match_name":"Tangi May 2016 USPSA","match_date":"2016-05-29","stage_classifiercode":"99-11","member_number":"L3707","first_name":"WOODY","last_name":"LANDRY","classification":"B","division":"OPEN","hit_factor":9.3379},{"match_name":"NCPS USPSA Handgun Match June 24 2018","match_date":"2018-06-24","stage_classifiercode":"99-11","member_number":"A59813","first_name":"CINDY","last_name":"TUCKER","classification":"A","division":"OPEN","hit_factor":9.3379},{"match_name":"OK15 USPSA at USSA May 6th 2018","match_date":"2018-05-06","stage_classifiercode":"99-11","member_number":"A95417","first_name":"CHANCE","last_name":"DEASON","classification":"B","division":"OPEN","hit_factor":9.3379},{"match_name":"USPSA MO21 2Alpha SBRC October 2017","match_date":"2017-10-21","stage_classifiercode":"99-11","member_number":"A102464","first_name":"COLE","last_name":"HUFFMAN","classification":"B","division":"OPEN","hit_factor":9.3354},{"match_name":"CVSC 07-29-2018","match_date":"2018-07-29","stage_classifiercode":"99-11","member_number":"A88732","first_name":"TIGER","last_name":"NGUYEN","classification":"M","division":"OPEN","hit_factor":9.3333},{"match_name":"OK15 USPSA at USSA May 6th 2018","match_date":"2018-05-06","stage_classifiercode":"99-11","member_number":"Ty78454","first_name":"GRANT","last_name":"GAINES","classification":"M","division":"OPEN","hit_factor":9.3333},{"match_name":"May 2018 4th Tues CAPS USPSA Level 1 - Range At Ballantyne","match_date":"2018-05-20","stage_classifiercode":"99-11","member_number":"A31524","first_name":"COUNCIL","last_name":"BRADSHAW","classification":"G","division":"OPEN","hit_factor":9.3313},{"match_name":"SFPS 8-5-18 USPSA Match","match_date":"2018-08-05","stage_classifiercode":"99-11","member_number":"TY65769","first_name":"DANIEL","last_name":"NESTHUS","classification":"B","division":"OPEN","hit_factor":9.329},{"match_name":"2016-05-07 USPSA at Phoenix Rod and Gun Club","match_date":"2016-05-07","stage_classifiercode":"99-11","member_number":"A88480","first_name":"DANIEL","last_name":"LINDEGREN","classification":"A","division":"OPEN","hit_factor":9.3284},{"match_name":"MPSA 07182020 USPSA","match_date":"2020-07-18","stage_classifiercode":"99-11","member_number":"A107778","first_name":"TIM","last_name":"PATTERSON","classification":"B","division":"OPEN","hit_factor":9.322},{"match_name":"COPS 2015 Missouri Fall Classic","match_date":"2015-10-03","stage_classifiercode":"99-11","member_number":"A69412","first_name":"GREYSON","last_name":"LEE","classification":"A","division":"OPEN","hit_factor":9.319},{"match_name":"Grandbaggers August 2017","match_date":"2017-08-03","stage_classifiercode":"99-11","member_number":"FL3478","first_name":"FRANK","last_name":"KOCH","classification":"M","division":"OPEN","hit_factor":9.3103},{"match_name":"Dundee Practical Shooters - Single Stack Challenge - Jan 23 2021","match_date":"2021-01-23","stage_classifiercode":"99-11","member_number":"Ty86951","first_name":"EMILIO","last_name":"DOMINGO","classification":"A","division":"OPEN","hit_factor":9.3098},{"match_name":"Richmond Hot Shots April 30-May 1st USPSA Pistol Match","match_date":"2016-04-30","stage_classifiercode":"99-11","member_number":"TY76701","first_name":"GLENN","last_name":"FANNIN","classification":"A","division":"OPEN","hit_factor":9.2982},{"match_name":"Lin","match_date":"2016-12-17","stage_classifiercode":"99-11","member_number":"L3696","first_name":"ROBERT","last_name":"HALSELL","classification":"A","division":"OPEN","hit_factor":9.2869},{"match_name":"OFGC Practical Pistol Match 01-19-2020","match_date":"2020-01-19","stage_classifiercode":"99-11","member_number":"A92527","first_name":"JAKE","last_name":"NOBLE","classification":"B","division":"OPEN","hit_factor":9.2749},{"match_name":"Double Tap USPSA 4/17","match_date":"2017-03-30","stage_classifiercode":"99-11","member_number":"\"\"","first_name":"COLT","last_name":"WILKINSON","classification":"M","division":"OPEN","hit_factor":9.2727},{"match_name":"Competitive Shooters of Lake Norman Thursday evening indoor USPSA pistol match North Carolina","match_date":"2017-08-03","stage_classifiercode":"99-11","member_number":"A88634","first_name":"KEN","last_name":"KILLI","classification":"B","division":"OPEN","hit_factor":9.2702},{"match_name":"Ontelaunee USPSA September 2015","match_date":"2015-09-27","stage_classifiercode":"99-11","member_number":"L1158","first_name":"JIM","last_name":"HAND","classification":"M","division":"OPEN","hit_factor":9.2683},{"match_name":"MPPL 08052018 Summer Fun","match_date":"2018-08-05","stage_classifiercode":"99-11","member_number":"A75056","first_name":"ELMER","last_name":"BANEZ","classification":"A","division":"OPEN","hit_factor":9.2657},{"match_name":"Maryland Practical Shooters Association July 2018","match_date":"2018-07-22","stage_classifiercode":"99-11","member_number":"L2577","first_name":"PAUL","last_name":"NOWOTARSKI","classification":"A","division":"OPEN","hit_factor":9.2657},{"match_name":"RBPS April Pistol","match_date":"2016-04-17","stage_classifiercode":"99-11","member_number":"FY39257","first_name":"PAUL","last_name":"ROBERTS","classification":"M","division":"OPEN","hit_factor":9.2652},{"match_name":"NCPS USPSA Handgun Match November 27 2016","match_date":"2016-11-27","stage_classifiercode":"99-11","member_number":"A83502","first_name":"PAUL","last_name":"CLANTON","classification":"B","division":"OPEN","hit_factor":9.2622},{"match_name":"RSPP 3rd Saturday November 2016","match_date":"2016-11-19","stage_classifiercode":"99-11","member_number":"TY6397","first_name":"ANTHONY","last_name":"BARONE","classification":"M","division":"OPEN","hit_factor":9.2496},{"match_name":"Extreme GM","match_date":"2020-06-12","stage_classifiercode":"99-11","member_number":"FY91472","first_name":"BRUCE","last_name":"STEIN","classification":"A","division":"OPEN","hit_factor":9.2453},{"match_name":"Rio Salado Hosemasters February 2021","match_date":"2021-02-27","stage_classifiercode":"99-11","member_number":"L1849","first_name":"PAUL","last_name":"THOMPSON","classification":"M","division":"OPEN","hit_factor":9.2437},{"match_name":"LdF USPSA Match January 25 2020","match_date":"2020-01-25","stage_classifiercode":"99-11","member_number":"TY80057","first_name":"CHRIS","last_name":"SOUSOUNIS","classification":"B","division":"OPEN","hit_factor":9.2437},{"match_name":"Richmond Boro Gun Club April 2017 USPSA Pistol Match","match_date":"2017-04-08","stage_classifiercode":"99-11","member_number":"L3851","first_name":"JEFF","last_name":"PAULSEN","classification":"B","division":"OPEN","hit_factor":9.2437},{"match_name":"Impact Match  2/24/2016","match_date":"2016-02-24","stage_classifiercode":"99-11","member_number":"A85172","first_name":"MIKE","last_name":"OLEARY","classification":"A","division":"OPEN","hit_factor":9.2421},{"match_name":"Rio Salado RSPP 3rd Saturday February 2020","match_date":"2020-02-15","stage_classifiercode":"99-11","member_number":"FL3478","first_name":"FRANK","last_name":"KOCH","classification":"M","division":"OPEN","hit_factor":9.2421},{"match_name":"GPS.   August  2016 ","match_date":"2016-08-28","stage_classifiercode":"99-11","member_number":"l3674","first_name":"AUGUST","last_name":"BALAGTAS","classification":"M","division":"OPEN","hit_factor":9.2362},{"match_name":"CCPL May  Day Match","match_date":"2021-05-23","stage_classifiercode":"99-11","member_number":"A72602","first_name":"STEVEN","last_name":"MURRAY","classification":"B","division":"OPEN","hit_factor":9.2357},{"match_name":"ISPS 6/19/2016 USPSA","match_date":"2016-06-19","stage_classifiercode":"99-11","member_number":"A58360","first_name":"BEAU","last_name":"BROWN","classification":"M","division":"OPEN","hit_factor":9.2338},{"match_name":"CCPL May  Day Match","match_date":"2021-05-23","stage_classifiercode":"99-11","member_number":"TY109346","first_name":"MADDUX","last_name":"LE","classification":"M","division":"OPEN","hit_factor":9.2279},{"match_name":"COPS 2015 Missouri Fall Classic","match_date":"2015-10-03","stage_classifiercode":"99-11","member_number":"L2281","first_name":"J","last_name":"GRIFFIN","classification":"A","division":"OPEN","hit_factor":9.2233},{"match_name":"Lin's","match_date":"2017-07-15","stage_classifiercode":"99-11","member_number":"\"\"","first_name":"BOB","last_name":"HALSELL","classification":"\"\"","division":"OPEN","hit_factor":9.2233},{"match_name":"EWPSA 2016-04","match_date":"2016-04-17","stage_classifiercode":"99-11","member_number":"A87873","first_name":"SCOTT","last_name":"MEREDITH","classification":"B","division":"OPEN","hit_factor":9.2105},{"match_name":"LA05 Tangi June USPSA 2020","match_date":"2020-06-28","stage_classifiercode":"99-11","member_number":"TY63532","first_name":"GEORGE","last_name":"HEMSTAD","classification":"M","division":"OPEN","hit_factor":9.2084},{"match_name":"AGC_20170903","match_date":"2017-09-03","stage_classifiercode":"99-11","member_number":"TY16618","first_name":"JEFF","last_name":"MEYER","classification":"A","division":"OPEN","hit_factor":9.1932},{"match_name":"West Coast IPSC","match_date":"2018-07-22","stage_classifiercode":"99-11","member_number":"\"\"","first_name":"ERIC","last_name":"LIU","classification":"A","division":"OPEN","hit_factor":9.1892},{"match_name":"Nampa USPSA May 29th 2021","match_date":"2021-05-29","stage_classifiercode":"99-11","member_number":"A530","first_name":"JERRY","last_name":"DIX","classification":"M","division":"OPEN","hit_factor":9.1854},{"match_name":"FBURG USPSA November 2020","match_date":"2020-11-01","stage_classifiercode":"99-11","member_number":"FY15413","first_name":"TOM","last_name":"SUIT","classification":"M","division":"OPEN","hit_factor":9.1837},{"match_name":"TAPS MARCH MATCH","match_date":"2017-03-11","stage_classifiercode":"99-11","member_number":"A93218","first_name":"AUSTIN","last_name":"HARRIS","classification":"B","division":"OPEN","hit_factor":9.1837},{"match_name":"Pardoe Sportsmens Association-WPA14-2017-10-01","match_date":"2017-10-01","stage_classifiercode":"99-11","member_number":"A55531","first_name":"J.W.","last_name":"RUTKOWSKI","classification":"A","division":"OPEN","hit_factor":9.1772},{"match_name":"Richmond Hot Shots October 6-7 USPSA Pistol Match","match_date":"2018-10-06","stage_classifiercode":"99-11","member_number":"TY98008","first_name":"JANET","last_name":"TSUI","classification":"B","division":"OPEN","hit_factor":9.1743},{"match_name":"Tangi May 2016 USPSA","match_date":"2016-05-29","stage_classifiercode":"99-11","member_number":"TY63532","first_name":"GEORGE","last_name":"HEMSTAD","classification":"M","division":"OPEN","hit_factor":9.1696},{"match_name":"Shoot GTR 05/07/17","match_date":"2017-05-07","stage_classifiercode":"99-11","member_number":"TY34497","first_name":"PATRICK","last_name":"GAUVIN","classification":"A","division":"OPEN","hit_factor":9.1667},{"match_name":"OREGON ARPC CC05 USPSA AUGUST 12 2017","match_date":"2017-08-12","stage_classifiercode":"99-11","member_number":"L4215","first_name":"MARK","last_name":"MCDONALD","classification":"A","division":"OPEN","hit_factor":9.1653},{"match_name":"Monson March 2016","match_date":"2016-03-26","stage_classifiercode":"99-11","member_number":"A34817","first_name":"DAN","last_name":"DIGIOVINE","classification":"A","division":"OPEN","hit_factor":9.1653},{"match_name":"Ontelaunee USPSA July 2016","match_date":"2016-07-23","stage_classifiercode":"99-11","member_number":"TY9036","first_name":"STANLEY","last_name":"DOROSKI","classification":"A","division":"OPEN","hit_factor":9.1615},{"match_name":"CCPL 12102017","match_date":"2017-12-08","stage_classifiercode":"99-11","member_number":"A88732","first_name":"TIGER","last_name":"NGUYEN","classification":"A","division":"OPEN","hit_factor":9.1549},{"match_name":"Rio Salado RSPP 3rd Saturday February 2020","match_date":"2020-02-15","stage_classifiercode":"99-11","member_number":"A100830","first_name":"MATT","last_name":"DARTON","classification":"B","division":"OPEN","hit_factor":9.1537},{"match_name":"TAP USPSA Pistol Match Aug 14 2016","match_date":"2016-08-14","stage_classifiercode":"99-11","member_number":"A90183","first_name":"GABBY","last_name":"LOPEZ","classification":"B","division":"OPEN","hit_factor":9.1537},{"match_name":"SFPS 8-5-18 USPSA Match","match_date":"2018-08-05","stage_classifiercode":"99-11","member_number":"TY63885","first_name":"TIMOTHY","last_name":"PROCTOR","classification":"C","division":"OPEN","hit_factor":9.1537},{"match_name":"Prescott Action Shooters 1st Saturday USPSA 7-7-2018","match_date":"2018-07-07","stage_classifiercode":"99-11","member_number":"TY18698","first_name":"MICHAEL","last_name":"DALE","classification":"M","division":"OPEN","hit_factor":9.1514},{"match_name":"Dundee Practical Shooters - Oct 27 2018","match_date":"2018-10-27","stage_classifiercode":"99-11","member_number":"A95617","first_name":"JOSEPH","last_name":"TYLER","classification":"A","division":"OPEN","hit_factor":9.1503},{"match_name":"WELD ECO09 20180916","match_date":"2018-09-16","stage_classifiercode":"99-11","member_number":"A102318","first_name":"TED","last_name":"NISCHAN","classification":"M","division":"OPEN","hit_factor":9.1489},{"match_name":"MS06 Team Magnolia June 2017 USPSA Match","match_date":"2017-06-04","stage_classifiercode":"99-11","member_number":"A77783","first_name":"GREG","last_name":"GREENE","classification":"B","division":"OPEN","hit_factor":9.1371},{"match_name":"CGC 4.30.17","match_date":"2017-04-30","stage_classifiercode":"99-11","member_number":"L3320","first_name":"CHARLIE","last_name":"PEREZ","classification":"M","division":"OPEN","hit_factor":9.127},{"match_name":"CGC 03-10-2018","match_date":"2018-03-10","stage_classifiercode":"99-11","member_number":"A93370","first_name":"CRAIG","last_name":"HOOKS","classification":"M","division":"OPEN","hit_factor":9.1216},{"match_name":"LA05 Tangi June USPSA 2020","match_date":"2020-06-28","stage_classifiercode":"99-11","member_number":"A43326","first_name":"CHRIS","last_name":"PLAIAANCE","classification":"U","division":"OPEN","hit_factor":9.1216},{"match_name":"2016-05-07 USPSA at Phoenix Rod and Gun Club","match_date":"2016-05-07","stage_classifiercode":"99-11","member_number":"Ty22096","first_name":"LEIGHTON","last_name":"OOSTHUISEN","classification":"M","division":"OPEN","hit_factor":9.1211},{"match_name":"Crooked Creek Pistol League - June 2016","match_date":"2016-06-25","stage_classifiercode":"99-11","member_number":"A55013","first_name":"RICHARD","last_name":"GENNARO","classification":"B","division":"OPEN","hit_factor":9.1195},{"match_name":"2017 Bay bridge Charity Classic - Richmond October 14-15-2017","match_date":"2017-10-14","stage_classifiercode":"99-11","member_number":"TY85663","first_name":"JASON","last_name":"YU","classification":"B","division":"OPEN","hit_factor":9.1075},{"match_name":"WNPL USPSA - REDEMPTION - NOVEMBER 2016","match_date":"2016-11-06","stage_classifiercode":"99-11","member_number":"FY38198","first_name":"JULIAN","last_name":"LIM","classification":"A","division":"OPEN","hit_factor":9.1062},{"match_name":"LIPSA  December 11th 2016 - USPSA Match","match_date":"2016-12-11","stage_classifiercode":"99-11","member_number":"TY9036","first_name":"STANLEY","last_name":"DOROSKI","classification":"A","division":"OPEN","hit_factor":9.0909},{"match_name":"USPSA MO21 2Alpha SBRC December 22 2018","match_date":"2018-12-22","stage_classifiercode":"99-11","member_number":"TY89171","first_name":"AUSTIN","last_name":"CHAMBERLAIN","classification":"M","division":"OPEN","hit_factor":9.0909},{"match_name":"Crooked Creek Pistol League - June 2017","match_date":"2017-06-24","stage_classifiercode":"99-11","member_number":"A55013","first_name":"RICHARD","last_name":"GENNARO","classification":"A","division":"OPEN","hit_factor":9.0909},{"match_name":"Rankin field Sunday match Clone","match_date":"2016-07-17","stage_classifiercode":"99-11","member_number":"\"\"","first_name":"TOM","last_name":"ROWE","classification":"U","division":"OPEN","hit_factor":9.0909},{"match_name":"HPPS 1-16-2021","match_date":"2021-01-16","stage_classifiercode":"99-11","member_number":"A109232","first_name":"BEN","last_name":"EVANS","classification":"A","division":"OPEN","hit_factor":9.0909},{"match_name":"LIPSA -  April 17th 2016 - USPSA Special Classifier Match","match_date":"2016-04-17","stage_classifiercode":"99-11","member_number":"L3851","first_name":"JEFF","last_name":"PAULSEN","classification":"C","division":"OPEN","hit_factor":9.0764},{"match_name":"Ontelaunee USPSA July 2016","match_date":"2016-07-23","stage_classifiercode":"99-11","member_number":"TY16248","first_name":"BARRY","last_name":"RUANE","classification":"M","division":"OPEN","hit_factor":9.0759},{"match_name":"HPS March 2020 Club Fun Match","match_date":"2020-03-07","stage_classifiercode":"99-11","member_number":"FY51827","first_name":"JOSHUA","last_name":"RAPANOT","classification":"U","division":"OPEN","hit_factor":9.062},{"match_name":"Dundee USPSA Feb 2016","match_date":"2016-02-27","stage_classifiercode":"99-11","member_number":"TY63731","first_name":"JAN","last_name":"HASE","classification":"M","division":"OPEN","hit_factor":9.0615},{"match_name":"CCPL 01102016 ALL CLASSIFIER MATCH","match_date":"2016-01-10","stage_classifiercode":"99-11","member_number":"A88732","first_name":"THI","last_name":"NGUYEN","classification":"B","division":"OPEN","hit_factor":9.061},{"match_name":"DWB - Deadwood Boys USPSA 20 September 2020  Classifier Match Makeup","match_date":"2020-09-20","stage_classifiercode":"99-11","member_number":"A123199","first_name":"DANIEL","last_name":"JOSE","classification":"B","division":"OPEN","hit_factor":9.061},{"match_name":"CSA For PCGC","match_date":"2016-06-26","stage_classifiercode":"99-11","member_number":"TY79986","first_name":"TOM","last_name":"SARGENT","classification":"A","division":"OPEN","hit_factor":9.061},{"match_name":"Applied IN25 USPSA April Classifier 2018","match_date":"2018-04-17","stage_classifiercode":"99-11","member_number":"L4004","first_name":"AARON 3","last_name":"LORTON","classification":"A","division":"OPEN","hit_factor":9.0604},{"match_name":"AGC_20170903","match_date":"2017-09-03","stage_classifiercode":"99-11","member_number":"A69423","first_name":"JOSH","last_name":"HORNER","classification":"M","division":"OPEN","hit_factor":9.0586},{"match_name":"Ontelaunee USPSA  July 2018","match_date":"2018-07-29","stage_classifiercode":"99-11","member_number":"TY82429","first_name":"DAVID","last_name":"HEALEY 2","classification":"M","division":"OPEN","hit_factor":9.058},{"match_name":"ARPC USPSA Match 3-26-17","match_date":"2017-03-26","stage_classifiercode":"99-11","member_number":"TY33410","first_name":"JEFF","last_name":"MATSCHE","classification":"M","division":"OPEN","hit_factor":9.0468},{"match_name":"Rio Salado Hosemasters February 2021","match_date":"2021-02-27","stage_classifiercode":"99-11","member_number":"FYF68512","first_name":"MUNEKI","last_name":"SAMAJIMA","classification":"G","division":"OPEN","hit_factor":9.0461},{"match_name":"LPRGC - Lower Providence USPSA October 2018","match_date":"2018-10-06","stage_classifiercode":"99-11","member_number":"A86775","first_name":"ALEXANDER","last_name":"REALUYO","classification":"A","division":"OPEN","hit_factor":9.0461},{"match_name":"TPS USPSA at CMP March 18 2017","match_date":"2017-03-18","stage_classifiercode":"99-11","member_number":"A14583","first_name":"STEPHEN","last_name":"HORN","classification":"B","division":"OPEN","hit_factor":9.0426},{"match_name":"WGC WI USPSA League 11-8-2016","match_date":"2016-11-09","stage_classifiercode":"99-11","member_number":"\"\"","first_name":"DAVE","last_name":"DEYOE","classification":"M","division":"OPEN","hit_factor":9.0416},{"match_name":"WNPL USPSA - Nov 2017","match_date":"2017-11-05","stage_classifiercode":"99-11","member_number":"FY63987","first_name":"COLTON","last_name":"PICCININI","classification":"A","division":"OPEN","hit_factor":9.0385},{"match_name":"SLPSA July USPSA match","match_date":"2018-07-21","stage_classifiercode":"99-11","member_number":"TY99820","first_name":"KLAY","last_name":"GROVER","classification":"A","division":"OPEN","hit_factor":9.0333},{"match_name":"17s PSC - Go Fast Donâ€™t Suck 2020 Spring Postal Match (USPSA)","match_date":"2020-05-16","stage_classifiercode":"99-11","member_number":"FY69538","first_name":"ALAN","last_name":"MATTHEWS","classification":"A","division":"OPEN","hit_factor":9.0323},{"match_name":"APSC USPSA 02-15-20","match_date":"2020-02-15","stage_classifiercode":"99-11","member_number":"L4624","first_name":"REESE","last_name":"BISHOP","classification":"B","division":"OPEN","hit_factor":9.0323},{"match_name":"RBPS April Pistol","match_date":"2016-04-17","stage_classifiercode":"99-11","member_number":"TY45990","first_name":"JOHN","last_name":"MARCAIDA","classification":"M","division":"OPEN","hit_factor":9.0312},{"match_name":"Richmond Hot Shots January 17-2016 USPSA Pistol","match_date":"2016-01-17","stage_classifiercode":"99-11","member_number":"A84616","first_name":"MJ","last_name":"FINEZA","classification":"B","division":"OPEN","hit_factor":9.0301},{"match_name":"APSC 4th Annual Holiday Hosefest USPSA Match 12-02-17","match_date":"2017-12-02","stage_classifiercode":"99-11","member_number":"L3082","first_name":"ROY","last_name":"STEDMAN","classification":"G","division":"OPEN","hit_factor":9.029},{"match_name":"Swamp Eagles 2015-12","match_date":"2015-12-20","stage_classifiercode":"99-11","member_number":"FY52014","first_name":"BRIAN","last_name":"DOLLY","classification":"A","division":"OPEN","hit_factor":9.0278},{"match_name":"CFRPC December USPSA (Classifier)","match_date":"2018-12-16","stage_classifiercode":"99-11","member_number":"A92734","first_name":"BEN","last_name":"WHITE","classification":"B","division":"OPEN","hit_factor":9.0226},{"match_name":"BHPSC Monthly Match October 2018","match_date":"2018-10-26","stage_classifiercode":"99-11","member_number":"L1870","first_name":"LES","last_name":"COX","classification":"M","division":"OPEN","hit_factor":9.0177},{"match_name":"PRG - Oh Shoot USPSA February 21st - 3rd Sunday Match","match_date":"2021-02-21","stage_classifiercode":"99-11","member_number":"a37333","first_name":"ERIC","last_name":"BENEDICTO","classification":"B","division":"OPEN","hit_factor":9.0106},{"match_name":"RBGC 2017-06-24","match_date":"2017-06-24","stage_classifiercode":"99-11","member_number":"TY88155","first_name":"TYLER","last_name":"GREEN","classification":"B","division":"OPEN","hit_factor":9.009},{"match_name":"USPSA MO21 2Alpha SBRC December 22 2018","match_date":"2018-12-22","stage_classifiercode":"99-11","member_number":"A105865","first_name":"DAN","last_name":"HOWARD","classification":"B","division":"OPEN","hit_factor":9.0062},{"match_name":"Grandbaggers 07-05-2018","match_date":"2018-07-05","stage_classifiercode":"99-11","member_number":"TY83533","first_name":"ANDY","last_name":"FEIGIN","classification":"M","division":"OPEN","hit_factor":9.0062},{"match_name":"2016-02-06 USPSA at Phoenix Rod and Gun Club","match_date":"2016-02-06","stage_classifiercode":"99-11","member_number":"A11151","first_name":"KIRBY","last_name":"GOODMAN","classification":"M","division":"OPEN","hit_factor":9.0016},{"match_name":"Live Fire","match_date":"2017-07-11","stage_classifiercode":"99-11","member_number":"\"\"","first_name":"ROBERT","last_name":"HALSELL","classification":"\"\"","division":"OPEN","hit_factor":9.0016},{"match_name":"Ontelaunee USPSA Hose Fest","match_date":"2021-01-02","stage_classifiercode":"99-11","member_number":"TY99130","first_name":"AMEET","last_name":"DAS","classification":"B","division":"OPEN","hit_factor":9.0016},{"match_name":"LA05 Tangi USPSA 4th Sunday May 2021","match_date":"2021-05-23","stage_classifiercode":"99-11","member_number":"TY63532","first_name":"GEORGE","last_name":"HEMSTAD","classification":"M","division":"OPEN","hit_factor":9.0016},{"match_name":"Grandbaggers August 2017","match_date":"2017-08-03","stage_classifiercode":"99-11","member_number":"TY83533","first_name":"ANDY","last_name":"FEIGIN","classification":"A","division":"OPEN","hit_factor":8.9965},{"match_name":"BAS  April 2017 USPSA","match_date":"2017-04-15","stage_classifiercode":"99-11","member_number":"TY35185","first_name":"MATT","last_name":"JOE","classification":"M","division":"OPEN","hit_factor":8.9888},{"match_name":"CSA Coalfield Shooters Association USPSA March 2020","match_date":"2020-03-08","stage_classifiercode":"99-11","member_number":"TY104241","first_name":"DAVID","last_name":"BOWEN","classification":"A","division":"OPEN","hit_factor":8.9888},{"match_name":"SWGC USPSA Pistol Match - November 2021","match_date":"2021-11-06","stage_classifiercode":"99-11","member_number":"TY98245","first_name":"MIKE","last_name":"SHARRETT","classification":"B","division":"OPEN","hit_factor":8.9869},{"match_name":"SAPSC Monthly USPSA Classifier Match 20160209","match_date":"2016-02-09","stage_classifiercode":"99-11","member_number":"A93439","first_name":"CHRIS","last_name":"ELLIS 2","classification":"U","division":"OPEN","hit_factor":8.9869},{"match_name":"Grandbaggers 07-05-2018","match_date":"2018-07-05","stage_classifiercode":"99-11","member_number":"A103575","first_name":"STEVEN","last_name":"SCACCIA","classification":"A","division":"OPEN","hit_factor":8.9767},{"match_name":"2017 Bay bridge Charity Classic - Richmond October 14-15-2017","match_date":"2017-10-14","stage_classifiercode":"99-11","member_number":"TY79640","first_name":"ELPIDIO","last_name":"CORPUZ","classification":"B","division":"OPEN","hit_factor":8.9764},{"match_name":"MISS USPSA Match 10-5-16","match_date":"2016-10-03","stage_classifiercode":"99-11","member_number":"TY80219","first_name":"MAX","last_name":"KLATT","classification":"M","division":"OPEN","hit_factor":8.9744},{"match_name":"MPSA 021817","match_date":"2017-02-18","stage_classifiercode":"99-11","member_number":"FY90633","first_name":"BRANT","last_name":"PACE","classification":"B","division":"OPEN","hit_factor":8.9744},{"match_name":"ARPC USPSA Match 8-23-20","match_date":"2020-08-23","stage_classifiercode":"99-11","member_number":"TY33410","first_name":"JEFF","last_name":"MATSCHE","classification":"M","division":"OPEN","hit_factor":8.9744},{"match_name":"Richmond Hot Shots January 17-2016 USPSA Pistol","match_date":"2016-01-17","stage_classifiercode":"99-11","member_number":"TY74322","first_name":"ANDRE","last_name":"TAUBE","classification":"A","division":"OPEN","hit_factor":8.972},{"match_name":"EWPSA 2018-10","match_date":"2018-10-20","stage_classifiercode":"99-11","member_number":"FY80708","first_name":"DON","last_name":"BROWN","classification":"B","division":"OPEN","hit_factor":8.9701},{"match_name":"RPS November 2018 USPSA Match","match_date":"2018-11-10","stage_classifiercode":"99-11","member_number":"TY73345","first_name":"GARY","last_name":"CROUCH","classification":"M","division":"OPEN","hit_factor":8.9701},{"match_name":"DAPS USPSA at ETTS 7-8-17","match_date":"2017-07-08","stage_classifiercode":"99-11","member_number":"A80640","first_name":"SKY","last_name":"KILLIAN","classification":"M","division":"OPEN","hit_factor":8.9606},{"match_name":"CJR&PC USPSA  June 10","match_date":"2018-06-10","stage_classifiercode":"99-11","member_number":"A66127","first_name":"KENNY","last_name":"LEE","classification":"\"\"","division":"OPEN","hit_factor":8.96},{"match_name":"BSPSC 2021 July Geo Thompson Single Stack Classic","match_date":"2021-07-11","stage_classifiercode":"99-11","member_number":"A111357","first_name":"DALE","last_name":"COCHRELL","classification":"B","division":"OPEN","hit_factor":8.9552},{"match_name":"MCPSL Pistol 3-10-18","match_date":"2018-03-10","stage_classifiercode":"99-11","member_number":"A100931","first_name":"CALEB","last_name":"PATERSON","classification":"B","division":"OPEN","hit_factor":8.9501},{"match_name":"COPS 2015 Missouri Fall Classic","match_date":"2015-10-03","stage_classifiercode":"99-11","member_number":"TY58129","first_name":"DARREN","last_name":"LESKIW","classification":"B","division":"OPEN","hit_factor":8.9494},{"match_name":"2017-04 Bone Creek USPSA","match_date":"2017-04-02","stage_classifiercode":"99-11","member_number":"TY29453","first_name":"J.D.","last_name":"SMITH","classification":"M","division":"OPEN","hit_factor":8.9482},{"match_name":"WSPS JUNE 2018 USPSA MATCH","match_date":"2018-06-16","stage_classifiercode":"99-11","member_number":"L4464","first_name":"ERIC","last_name":"WONG","classification":"A","division":"OPEN","hit_factor":8.9457},{"match_name":"BA USPSA Jun 17-2017","match_date":"2017-06-11","stage_classifiercode":"99-11","member_number":"TY42975","first_name":"JASON","last_name":"RATLIFF","classification":"A","division":"OPEN","hit_factor":8.9431},{"match_name":"Rio Salado UPPL September 2020","match_date":"2020-09-13","stage_classifiercode":"99-11","member_number":"FL3478","first_name":"FRANK","last_name":"KOCH","classification":"M","division":"OPEN","hit_factor":8.9431},{"match_name":"HOPS USPSA 072118","match_date":"2018-07-21","stage_classifiercode":"99-11","member_number":"A86398","first_name":"GREG","last_name":"GILLILAND","classification":"B","division":"OPEN","hit_factor":8.9404},{"match_name":"Richmond Hot Shots April 30-May 1st USPSA Pistol Match","match_date":"2016-04-30","stage_classifiercode":"99-11","member_number":"A38711","first_name":"KENNETH","last_name":"MELTON","classification":"B","division":"OPEN","hit_factor":8.9394},{"match_name":"BSPSC 2021 July Geo Thompson Single Stack Classic","match_date":"2021-07-11","stage_classifiercode":"99-11","member_number":"TY12199","first_name":"NEAL","last_name":"HANSEN","classification":"A","division":"OPEN","hit_factor":8.9376},{"match_name":"MSSA Uspsa Club Match","match_date":"2017-08-27","stage_classifiercode":"99-11","member_number":"FY75422","first_name":"BRANTLEY","last_name":"GAITHER","classification":"B","division":"OPEN","hit_factor":8.9342},{"match_name":"Prescott 1 st Saturday 12-03-2016","match_date":"2016-12-03","stage_classifiercode":"99-11","member_number":"A18698","first_name":"MICHAEL","last_name":"DALE","classification":"M","division":"OPEN","hit_factor":8.9317},{"match_name":"Maryland Practical Shooters Association July 2018","match_date":"2018-07-22","stage_classifiercode":"99-11","member_number":"L4443","first_name":"PAUL","last_name":"WILLIAMS","classification":"A","division":"OPEN","hit_factor":8.9286},{"match_name":"SWGC USPSA Pistol Match - November 2021","match_date":"2021-11-06","stage_classifiercode":"99-11","member_number":"A104834","first_name":"LOGAN","last_name":"SAUNDERS","classification":"B","division":"OPEN","hit_factor":8.9256},{"match_name":"Hose Monster Action ","match_date":"2020-07-19","stage_classifiercode":"99-11","member_number":"A58117","first_name":"JIM","last_name":"TALOY","classification":"A","division":"OPEN","hit_factor":8.9231},{"match_name":"Freeport March 2020","match_date":"2020-03-01","stage_classifiercode":"99-11","member_number":"L3851","first_name":"JEFF","last_name":"PAULSEN","classification":"M","division":"OPEN","hit_factor":8.9219},{"match_name":"PTPC  February 7th USPSA Match","match_date":"2016-02-07","stage_classifiercode":"99-11","member_number":"A91934","first_name":"ALFRED","last_name":"LADORES","classification":"B","division":"OPEN","hit_factor":8.9194},{"match_name":"PTPC April 2nd USPSA Match","match_date":"2017-04-02","stage_classifiercode":"99-11","member_number":"L4223","first_name":"DARRYL","last_name":"DOUGHERTY","classification":"M","division":"OPEN","hit_factor":8.9172},{"match_name":"BPSA January 2017 USPSA","match_date":"2017-01-22","stage_classifiercode":"99-11","member_number":"TY42086","first_name":"BILL","last_name":"JACKSON","classification":"B","division":"OPEN","hit_factor":8.9172},{"match_name":"Shasta Shooters 2018 June Special Classifier","match_date":"2018-06-09","stage_classifiercode":"99-11","member_number":"L3873","first_name":"DON","last_name":"SANTORO","classification":"A","division":"OPEN","hit_factor":8.9041},{"match_name":"Blackstone Shooting Sports May 2017 USPSA Pistol Level 1","match_date":"2017-05-09","stage_classifiercode":"99-11","member_number":"L4080","first_name":"KYLE","last_name":"LEE","classification":"B","division":"OPEN","hit_factor":8.9005},{"match_name":"MSSA USPSA June  10 2017","match_date":"2017-06-10","stage_classifiercode":"99-11","member_number":"A23320","first_name":"JOHN","last_name":"STIEDLE","classification":"M","division":"OPEN","hit_factor":8.9005},{"match_name":"MSSA USPSA June  10 2017","match_date":"2017-06-10","stage_classifiercode":"99-11","member_number":"\"\"","first_name":"CHANDLER","last_name":"LAFRAIN","classification":"B","division":"OPEN","hit_factor":8.8968},{"match_name":"DWB - Deadwood Boys USPSA 20 September 2020  Classifier Match Makeup","match_date":"2020-09-20","stage_classifiercode":"99-11","member_number":"TY88653","first_name":"JIMMY","last_name":"PARK","classification":"B","division":"OPEN","hit_factor":8.8926},{"match_name":"MPPL 08052018 Summer Fun","match_date":"2018-08-05","stage_classifiercode":"99-11","member_number":"L4210","first_name":"BONG","last_name":"BARRANCO","classification":"B","division":"OPEN","hit_factor":8.8924},{"match_name":"Shoot Gtr USPSA 10/18","match_date":"2016-10-18","stage_classifiercode":"99-11","member_number":"TY27735","first_name":"BOB","last_name":"MILLS","classification":"A","division":"OPEN","hit_factor":8.8924},{"match_name":"AAPS AAFG Level 1 Match - May 5 2018","match_date":"2018-05-05","stage_classifiercode":"99-11","member_number":"L4464","first_name":"ERIC","last_name":"WONG","classification":"B","division":"OPEN","hit_factor":8.8821},{"match_name":"SAPSC Monthly USPSA Classifier Match 20160209","match_date":"2016-02-09","stage_classifiercode":"99-11","member_number":"A79844","first_name":"JAKE","last_name":"REED","classification":"A","division":"OPEN","hit_factor":8.8768},{"match_name":"Prescott Action Shooters 1st Saturday USPSA 6-2-2018 ","match_date":"2018-06-03","stage_classifiercode":"99-11","member_number":"TY28855","first_name":"PHILLIP","last_name":"GALLEGOS","classification":"A","division":"OPEN","hit_factor":8.8737},{"match_name":"MAPSA 2016.10.08","match_date":"2016-10-08","stage_classifiercode":"99-11","member_number":"\"\"","first_name":"GREGORY","last_name":"THOMAS","classification":"B","division":"OPEN","hit_factor":8.8722},{"match_name":"Ontelaunee USPSA July 2016","match_date":"2016-07-23","stage_classifiercode":"99-11","member_number":"A82014","first_name":"TONY","last_name":"SPINILLO","classification":"U","division":"OPEN","hit_factor":8.871},{"match_name":"HOPS USPSA 072118","match_date":"2018-07-21","stage_classifiercode":"99-11","member_number":"FY29453","first_name":"JD","last_name":"SMITH","classification":"U","division":"OPEN","hit_factor":8.8647},{"match_name":"AGC_20151206","match_date":"2015-12-06","stage_classifiercode":"99-11","member_number":"A69423","first_name":"JOSH","last_name":"HORNER","classification":"M","division":"OPEN","hit_factor":8.8629},{"match_name":"Granby Action Shooters Oct 2016","match_date":"2016-10-02","stage_classifiercode":"99-11","member_number":"TY76010","first_name":"TIMOTHY","last_name":"SMITH","classification":"U","division":"OPEN","hit_factor":8.8629},{"match_name":"Hopkinton USPSA May 2017","match_date":"2017-05-06","stage_classifiercode":"99-11","member_number":"A92915","first_name":"DUSTIN","last_name":"BRISSON","classification":"A","division":"OPEN","hit_factor":8.8608},{"match_name":"ORPCI USPSA Saturday 2020.07.18","match_date":"2020-07-18","stage_classifiercode":"99-11","member_number":"A120666","first_name":"PATRICK","last_name":"EAMES","classification":"","division":"OPEN","hit_factor":8.8608},{"match_name":"Afternoon SMPS 09 February 2020 USPSA Classifier Match","match_date":"2020-02-09","stage_classifiercode":"99-11","member_number":"FY15413","first_name":"TOM","last_name":"SUIT","classification":"M","division":"OPEN","hit_factor":8.8567},{"match_name":"Palmetto Gun Club - April 2017 USPSA","match_date":"2017-04-08","stage_classifiercode":"99-11","member_number":"FY69538","first_name":"ALAN","last_name":"MATTHEWS","classification":"B","division":"OPEN","hit_factor":8.8542},{"match_name":"Classifier Match","match_date":"2020-05-29","stage_classifiercode":"99-11","member_number":"A127522","first_name":"TYLER","last_name":"LUPER","classification":"U","division":"OPEN","hit_factor":8.8481},{"match_name":"AIGR USPSA 8-4-17","match_date":"2017-08-04","stage_classifiercode":"99-11","member_number":"\"\"","first_name":"BOBBY","last_name":"IVESTER","classification":"U","division":"OPEN","hit_factor":8.8435},{"match_name":"Bare Arms Indoo 12/08/18","match_date":"2018-12-08","stage_classifiercode":"99-11","member_number":"A110946","first_name":"BRIAN","last_name":"KELLER","classification":"B","division":"OPEN","hit_factor":8.8435},{"match_name":"Ontelaunee USPSA July 2016","match_date":"2016-07-23","stage_classifiercode":"99-11","member_number":"A33985","first_name":"DONALD","last_name":"SEIGLE","classification":"M","division":"OPEN","hit_factor":8.8388},{"match_name":"COPS 2015 Missouri Fall Classic","match_date":"2015-10-03","stage_classifiercode":"99-11","member_number":"TY-33410","first_name":"JEFF","last_name":"MATSCHE","classification":"M","division":"OPEN","hit_factor":8.838},{"match_name":"EWPSA 2018-10","match_date":"2018-10-20","stage_classifiercode":"99-11","member_number":"TY94621","first_name":"BRIAN","last_name":"PEPPER","classification":"B","division":"OPEN","hit_factor":8.8339},{"match_name":"ORPCI USPSA Friday 2021.07.16","match_date":"2021-07-16","stage_classifiercode":"99-11","member_number":"A89770","first_name":"TOM","last_name":"WELBORN","classification":"B","division":"OPEN","hit_factor":8.8333},{"match_name":"BUAS February Match","match_date":"2020-02-09","stage_classifiercode":"99-11","member_number":"Ty79508","first_name":"SHANE","last_name":"FUNGAFAT","classification":"A","division":"OPEN","hit_factor":8.8283},{"match_name":"Rankin field Sunday match Clone","match_date":"2016-07-17","stage_classifiercode":"99-11","member_number":"A77402","first_name":"BRIAN","last_name":"LUM","classification":"X","division":"OPEN","hit_factor":8.8235},{"match_name":"IN19 ACC USPSA September 23","match_date":"2018-09-23","stage_classifiercode":"99-11","member_number":"a26597","first_name":"MAX","last_name":"BEDWELL","classification":"G","division":"OPEN","hit_factor":8.8235},{"match_name":"LCSA USPSA March Match","match_date":"2016-03-12","stage_classifiercode":"99-11","member_number":"A77032","first_name":"TYLER","last_name":"COKE","classification":"B","division":"OPEN","hit_factor":8.8191},{"match_name":"Rio Salado Hosemasters February 2021","match_date":"2021-02-27","stage_classifiercode":"99-11","member_number":"TY18698","first_name":"MICHAEL","last_name":"DALE","classification":"M","division":"OPEN","hit_factor":8.8189},{"match_name":"APSC 4th Annual Holiday Hosefest USPSA Match 12-02-17","match_date":"2017-12-02","stage_classifiercode":"99-11","member_number":"FY75134","first_name":"RYAN","last_name":"BANKS","classification":"A","division":"OPEN","hit_factor":8.8186},{"match_name":"Oakdale USPSA MN07 8-12-2021","match_date":"2021-08-12","stage_classifiercode":"99-11","member_number":"TY-41080","first_name":"JOHN","last_name":"BUEHLER","classification":"B","division":"OPEN","hit_factor":8.8141},{"match_name":"Oakdale USPSA MN07 6-25-2020","match_date":"2020-06-25","stage_classifiercode":"99-11","member_number":"A105266","first_name":"ERIC","last_name":"FORREST","classification":"A","division":"OPEN","hit_factor":8.8091},{"match_name":"Collin County USPSA 04-25-2021","match_date":"2021-04-24","stage_classifiercode":"99-11","member_number":"TY82289","first_name":"JEREMY","last_name":"DYER","classification":"B","division":"OPEN","hit_factor":8.8083},{"match_name":"COPS 2015 Missouri Fall Classic","match_date":"2015-10-03","stage_classifiercode":"99-11","member_number":"a47787","first_name":"SCOTT","last_name":"LANE","classification":"M","division":"OPEN","hit_factor":8.8073},{"match_name":"APS August 1st Monthly USPSA Match  Classifier Match","match_date":"2021-08-01","stage_classifiercode":"99-11","member_number":"TY106854","first_name":"ODED","last_name":"ZYSSMAN","classification":"B","division":"OPEN","hit_factor":8.805},{"match_name":"June 2018 CAS USPSA","match_date":"2018-06-03","stage_classifiercode":"99-11","member_number":"TY64151","first_name":"DON","last_name":"GRANIER","classification":"A","division":"OPEN","hit_factor":8.8012},{"match_name":"Maine Practical Shooters February 2020","match_date":"2020-02-22","stage_classifiercode":"99-11","member_number":"ty49143","first_name":"TAD","last_name":"DAVIDSON","classification":"M","division":"OPEN","hit_factor":8.7986},{"match_name":"FAS Sunday Indoors USPSA","match_date":"2021-10-17","stage_classifiercode":"99-11","member_number":"A126158","first_name":"SAM","last_name":"TERWILLIGER","classification":"A","division":"OPEN","hit_factor":8.7963},{"match_name":"Swamp Eagles 2015-12","match_date":"2015-12-20","stage_classifiercode":"99-11","member_number":"TY3531","first_name":"CHARLES","last_name":"ALEXANDER","classification":"B","division":"OPEN","hit_factor":8.7963},{"match_name":"Nampa USPSA May 29th 2021","match_date":"2021-05-29","stage_classifiercode":"99-11","member_number":"TY106643","first_name":"EUGENE","last_name":"DINA","classification":"A","division":"OPEN","hit_factor":8.7954},{"match_name":"Range 54 USPSA","match_date":"2017-03-10","stage_classifiercode":"99-11","member_number":"A89295","first_name":"CHASE","last_name":"FARKAS","classification":"C","division":"OPEN","hit_factor":8.7948},{"match_name":"CCAS June 2016","match_date":"2016-06-25","stage_classifiercode":"99-11","member_number":"A73178","first_name":"JOE","last_name":"WILLIS","classification":"B","division":"OPEN","hit_factor":8.7859},{"match_name":"PSAC_20161022","match_date":"2016-10-22","stage_classifiercode":"99-11","member_number":"TY36854","first_name":"KEN","last_name":"KWIAT","classification":"\"\"","division":"OPEN","hit_factor":8.7838},{"match_name":"LPRGC - Lower Providence USPSA Match November 2021","match_date":"2021-11-06","stage_classifiercode":"99-11","member_number":"L1158","first_name":"JIM","last_name":"HAND","classification":"M","division":"OPEN","hit_factor":8.7814},{"match_name":"HAS Classifier Match January 2020","match_date":"2020-01-15","stage_classifiercode":"99-11","member_number":"A92915","first_name":"DUSTIN","last_name":"BRISSON","classification":"A","division":"OPEN","hit_factor":8.7814},{"match_name":"WLPS USPSA May 2016","match_date":"2016-05-22","stage_classifiercode":"99-11","member_number":"TY57269","first_name":"CRAIG","last_name":"TAPPE","classification":"A","division":"OPEN","hit_factor":8.7719},{"match_name":"FAS Sunday Indoors USPSA Match","match_date":"2021-02-07","stage_classifiercode":"99-11","member_number":"TY90397","first_name":"JOEY","last_name":"MARRAPODI","classification":"B","division":"OPEN","hit_factor":8.7719},{"match_name":"North Mountain PS April","match_date":"2016-04-15","stage_classifiercode":"99-11","member_number":"A82592","first_name":"THOMAS","last_name":"KOH","classification":"A","division":"OPEN","hit_factor":8.7657},{"match_name":"OREGON ARPC CC05 USPSA AUGUST 12 2017","match_date":"2017-08-12","stage_classifiercode":"99-11","member_number":"ty-58134","first_name":"DAN","last_name":"CARPENTER","classification":"B","division":"OPEN","hit_factor":8.7637},{"match_name":"ORPCI 2018.03.31 USPSA Special","match_date":"2018-03-31","stage_classifiercode":"99-11","member_number":"A104223","first_name":"JOSH","last_name":"TILFORD","classification":"B","division":"OPEN","hit_factor":8.7629},{"match_name":"RBGC 2017-06-24","match_date":"2017-06-24","stage_classifiercode":"99-11","member_number":"TY49008","first_name":"MOON","last_name":"JEONG","classification":"A","division":"OPEN","hit_factor":8.7603},{"match_name":"DAPS USPSA at ETTS 7-8-17","match_date":"2017-07-08","stage_classifiercode":"99-11","member_number":"TY56332","first_name":"DERON","last_name":"WOOD","classification":"A","division":"OPEN","hit_factor":8.7603},{"match_name":"Brazosland Pistoleros USPSA - Sunday August 8th","match_date":"2021-08-08","stage_classifiercode":"99-11","member_number":"A123359","first_name":"DYLAN","last_name":"LORENCE","classification":"C","division":"OPEN","hit_factor":8.752},{"match_name":"Granby Action Shooters Oct 2016","match_date":"2016-10-02","stage_classifiercode":"99-11","member_number":"A27309","first_name":"TERRY","last_name":"ROBERTSON","classification":"A","division":"OPEN","hit_factor":8.7413},{"match_name":"NCPS USPSA Handgun Match November 27 2016","match_date":"2016-11-27","stage_classifiercode":"99-11","member_number":"A84616","first_name":"MJ","last_name":"FINEZA","classification":"A","division":"OPEN","hit_factor":8.7315},{"match_name":"MCPSL Pistol 3-10-18","match_date":"2018-03-10","stage_classifiercode":"99-11","member_number":"L1870","first_name":"LES","last_name":"COX","classification":"M","division":"OPEN","hit_factor":8.7302},{"match_name":"Bossier Parish Practical Shooters August 16 2020","match_date":"2020-08-16","stage_classifiercode":"99-11","member_number":"TY116299","first_name":"JUSTIN","last_name":"HEATON","classification":"U","division":"OPEN","hit_factor":8.726},{"match_name":"Ontelaunee USPSA  July 2018","match_date":"2018-07-29","stage_classifiercode":"99-11","member_number":"TY9036","first_name":"STANLEY","last_name":"DOROSKI","classification":"M","division":"OPEN","hit_factor":8.7248},{"match_name":"SUPS USPSA 11/21/15 A","match_date":"2015-11-21","stage_classifiercode":"99-11","member_number":"L1899","first_name":"GARY","last_name":"POWELL","classification":"B","division":"OPEN","hit_factor":8.7237},{"match_name":"Rankin FIeld USPSA","match_date":"2015-10-10","stage_classifiercode":"99-11","member_number":"TY22721","first_name":"WAYDE","last_name":"SHIMODA","classification":"B","division":"OPEN","hit_factor":8.7237},{"match_name":"SCCC CLASSIFIER MATCH 7_23_17","match_date":"2017-07-23","stage_classifiercode":"99-11","member_number":"TY96280","first_name":"TY_1","last_name":"O'BRADOVICH","classification":"U","division":"OPEN","hit_factor":8.7218},{"match_name":"SLPSA August USPSA Match 2","match_date":"2020-08-15","stage_classifiercode":"99-11","member_number":"FY53120","first_name":"BRANDON","last_name":"FARR","classification":"M","division":"OPEN","hit_factor":8.7179},{"match_name":"Dundee Practical Shooters - Single Stack Challenge - Jan 23 2021","match_date":"2021-01-23","stage_classifiercode":"99-11","member_number":"A101001","first_name":"TIM","last_name":"AUSTIN","classification":"A","division":"OPEN","hit_factor":8.7163},{"match_name":"2016-02-06 USPSA at Phoenix Rod and Gun Club","match_date":"2016-02-06","stage_classifiercode":"99-11","member_number":"A78028","first_name":"MARCELO","last_name":"MARIANO IV","classification":"B","division":"OPEN","hit_factor":8.7149},{"match_name":"WGC WI USPSA League 11-8-2016","match_date":"2016-11-09","stage_classifiercode":"99-11","member_number":"A68824","first_name":"KELSEY","last_name":"SCHAEFER","classification":"B","division":"OPEN","hit_factor":8.7097},{"match_name":"PPPS 11-13-16","match_date":"2016-11-13","stage_classifiercode":"99-11","member_number":"A85442","first_name":"SPENCER","last_name":"STEIN","classification":"M","division":"OPEN","hit_factor":8.7037},{"match_name":"TAP USPSA Pistol Match Aug 14 2016","match_date":"2016-08-14","stage_classifiercode":"99-11","member_number":"A84617","first_name":"MIKE","last_name":"FINEZA","classification":"B","division":"OPEN","hit_factor":8.7025},{"match_name":"SFA   USPSA 2/20/2016","match_date":"2016-02-20","stage_classifiercode":"99-11","member_number":"A47970","first_name":"DAVE","last_name":"ABELOE","classification":"A","division":"OPEN","hit_factor":8.7023},{"match_name":"APSC 4th Annual Holiday Hosefest USPSA Match 12-02-17","match_date":"2017-12-02","stage_classifiercode":"99-11","member_number":"TY55326","first_name":"NATE","last_name":"HEINRICHS","classification":"M","division":"OPEN","hit_factor":8.6957},{"match_name":"ORGC Tuesday Classifier June 5-2018","match_date":"2018-06-05","stage_classifiercode":"99-11","member_number":"L1189","first_name":"JOHN","last_name":"LAMARCA","classification":"A","division":"OPEN","hit_factor":8.6957},{"match_name":"Sharp Practical Shooters March USPSA Match - Indoor","match_date":"2021-03-28","stage_classifiercode":"99-11","member_number":"L3511","first_name":"JIM","last_name":"BALDREE","classification":"A","division":"OPEN","hit_factor":8.6957},{"match_name":"Collin County USPSA 04-25-2021","match_date":"2021-04-24","stage_classifiercode":"99-11","member_number":"A44381","first_name":"MICHAEL","last_name":"KLAUSMANN","classification":"M","division":"OPEN","hit_factor":8.6957},{"match_name":"NRF 2021-09 USPSA","match_date":"2021-09-04","stage_classifiercode":"99-11","member_number":"L4979","first_name":"CHRIS","last_name":"SAWLSVILLE","classification":"B","division":"OPEN","hit_factor":8.6885},{"match_name":"ORPCI USPSA Saturday 2020.07.18","match_date":"2020-07-18","stage_classifiercode":"99-11","member_number":"TY113944","first_name":"JONATHON","last_name":"RANDOLPH","classification":"B","division":"OPEN","hit_factor":8.6879},{"match_name":"RCPS USPSA 14 Nov 2015","match_date":"2015-11-14","stage_classifiercode":"99-11","member_number":"A71589","first_name":"SCOTTIE","last_name":"ROBERSON","classification":"U","division":"OPEN","hit_factor":8.6826},{"match_name":"LBAS160220","match_date":"2016-02-20","stage_classifiercode":"99-11","member_number":"L3695","first_name":"BRUCE","last_name":"HEGGSTROM","classification":"A","division":"OPEN","hit_factor":8.6806},{"match_name":"NW01 Paul Bunyan CS Series May 9 2021","match_date":"2021-05-09","stage_classifiercode":"99-11","member_number":"TY96141","first_name":"JAIMEE","last_name":"MENDOZA","classification":"M","division":"OPEN","hit_factor":8.6751},{"match_name":"WGC April 2017 USPSA","match_date":"2017-04-23","stage_classifiercode":"99-11","member_number":"A84392","first_name":"JAMES","last_name":"TEDFORD","classification":"B","division":"OPEN","hit_factor":8.6677},{"match_name":"June 2018 CAS USPSA","match_date":"2018-06-03","stage_classifiercode":"99-11","member_number":"TY28619","first_name":"SCOTT","last_name":"JACOB","classification":"A","division":"OPEN","hit_factor":8.6667},{"match_name":"SAPSC Weekly USPSA Classifier Match 20170221","match_date":"2017-02-22","stage_classifiercode":"99-11","member_number":"A79844","first_name":"JAKE","last_name":"REED","classification":"A","division":"OPEN","hit_factor":8.6655},{"match_name":"Strongpoint August 2017 Match","match_date":"2017-08-05","stage_classifiercode":"99-11","member_number":"L3510","first_name":"KEN","last_name":"WILCOX","classification":"B","division":"OPEN","hit_factor":8.6601},{"match_name":"FAS Sunday Indoors USPSA Match","match_date":"2021-02-07","stage_classifiercode":"99-11","member_number":"TY87343","first_name":"KEITH","last_name":"BERRIAN","classification":"B","division":"OPEN","hit_factor":8.6601},{"match_name":"Castlewood July 2017 USPSA Match","match_date":"2017-07-22","stage_classifiercode":"99-11","member_number":"FY39111","first_name":"OLIE","last_name":"ERICKSEN","classification":"B","division":"OPEN","hit_factor":8.6553},{"match_name":"LBAS160220","match_date":"2016-02-20","stage_classifiercode":"99-11","member_number":"L2757","first_name":"RICK","last_name":"PUNU","classification":"M","division":"OPEN","hit_factor":8.6538},{"match_name":"WNPL USPSA - REDEMPTION - NOVEMBER 2016","match_date":"2016-11-06","stage_classifiercode":"99-11","member_number":"L2908","first_name":"JOHNNY","last_name":"LIM","classification":"A","division":"OPEN","hit_factor":8.651},{"match_name":"Maryland Practical Shooters Association July 2018","match_date":"2018-07-22","stage_classifiercode":"99-11","member_number":"L3202","first_name":"RUSSELL","last_name":"FORTNEY","classification":"A","division":"OPEN","hit_factor":8.6505},{"match_name":"LCSA  USPSA April 2017","match_date":"2017-04-08","stage_classifiercode":"99-11","member_number":"l1063","first_name":"CHUCK","last_name":"BROOKS","classification":"A","division":"OPEN","hit_factor":8.6505},{"match_name":"SB Action Pistol Match Classifier","match_date":"2017-12-14","stage_classifiercode":"99-11","member_number":"TY77451","first_name":"JOEL","last_name":"ANDERSON","classification":"\"\"","division":"OPEN","hit_factor":8.6498},{"match_name":"RBPS April Pistol","match_date":"2016-04-17","stage_classifiercode":"99-11","member_number":"L3750","first_name":"MIKE","last_name":"COLE","classification":"M","division":"OPEN","hit_factor":8.6495},{"match_name":"GRRC Wk 8","match_date":"2018-06-25","stage_classifiercode":"99-11","member_number":"A105972","first_name":"BEN","last_name":"MOORE","classification":"B","division":"OPEN","hit_factor":8.6478},{"match_name":"MPPL 08052018 Summer Fun","match_date":"2018-08-05","stage_classifiercode":"99-11","member_number":"TY80437","first_name":"ERIC","last_name":"CAMPOS","classification":"B","division":"OPEN","hit_factor":8.6438},{"match_name":"TPS USPSA at CMP March 18 2017","match_date":"2017-03-18","stage_classifiercode":"99-11","member_number":"TY87916","first_name":"ERIK","last_name":"PETERSON","classification":"B","division":"OPEN","hit_factor":8.6356},{"match_name":"ANPRACS USPSA 6-3-18","match_date":"2018-06-03","stage_classifiercode":"99-11","member_number":"TY27383","first_name":"MANUEL","last_name":"AURIGUE","classification":"A","division":"OPEN","hit_factor":8.6239},{"match_name":"HPS March 2020 Club Fun Match","match_date":"2020-03-07","stage_classifiercode":"99-11","member_number":"A45196","first_name":"NESTOR","last_name":"TANI","classification":"M","division":"OPEN","hit_factor":8.6176},{"match_name":"Hopkinton June  2016","match_date":"2016-06-04","stage_classifiercode":"99-11","member_number":"TY12934","first_name":"ERICH","last_name":"THALHEIMER","classification":"A","division":"OPEN","hit_factor":8.6154},{"match_name":"CGC 03-10-2018","match_date":"2018-03-10","stage_classifiercode":"99-11","member_number":"A24841","first_name":"CARLOS","last_name":"RUBIO","classification":"A","division":"OPEN","hit_factor":8.6124},{"match_name":"MS06 Team Magnolia June 2017 USPSA Match","match_date":"2017-06-04","stage_classifiercode":"99-11","member_number":"TY36282","first_name":"BILL","last_name":"MAHLEY","classification":"B","division":"OPEN","hit_factor":8.6103},{"match_name":"Pitcairn-Monroeville Sportsmens Club USPSA August 2017","match_date":"2017-08-05","stage_classifiercode":"99-11","member_number":"FY72047","first_name":"GREG","last_name":"ZOMBEK","classification":"B","division":"OPEN","hit_factor":8.6103},{"match_name":"Swamp Eagles 2015-12","match_date":"2015-12-20","stage_classifiercode":"99-11","member_number":"TY63532","first_name":"GEORGE","last_name":"HEMSTAD","classification":"M","division":"OPEN","hit_factor":8.6093},{"match_name":"PCPS Classifier and Slot Match Jan 2020","match_date":"2020-01-12","stage_classifiercode":"99-11","member_number":"A92734","first_name":"BEN","last_name":"WHITE","classification":"B","division":"OPEN","hit_factor":8.6081},{"match_name":"LdF USPSA Match May 12 2018","match_date":"2018-05-12","stage_classifiercode":"99-11","member_number":"A18808","first_name":"LOU","last_name":"PAZ","classification":"A","division":"OPEN","hit_factor":8.6072},{"match_name":"Rio Salado Hosemasters February 2021","match_date":"2021-02-27","stage_classifiercode":"99-11","member_number":"A79494","first_name":"ROBB","last_name":"ASHCROFT","classification":"B","division":"OPEN","hit_factor":8.6039},{"match_name":"2016-05-07 USPSA at Phoenix Rod and Gun Club","match_date":"2016-05-07","stage_classifiercode":"99-11","member_number":"Ty28855","first_name":"PHILLIP","last_name":"GALLEGOS","classification":"A","division":"OPEN","hit_factor":8.6022},{"match_name":"Rio Grande Practical Shooters - Oct 2015","match_date":"2015-10-03","stage_classifiercode":"99-11","member_number":"A76944","first_name":"BRANDON","last_name":"WILL","classification":"B","division":"OPEN","hit_factor":8.5973},{"match_name":"COPS 2015 Missouri Fall Classic","match_date":"2015-10-03","stage_classifiercode":"99-11","member_number":"A61385","first_name":"STEVE","last_name":"LEE","classification":"U","division":"OPEN","hit_factor":8.5938},{"match_name":"CGC 4.30.17","match_date":"2017-04-30","stage_classifiercode":"99-11","member_number":"TY69978","first_name":"DOMINIC","last_name":"KOH","classification":"M","division":"OPEN","hit_factor":8.5911},{"match_name":"Rio Salado RSPP 3rd Saturday February 2020","match_date":"2020-02-15","stage_classifiercode":"99-11","member_number":"A79494","first_name":"ROBB","last_name":"ASHCROFT","classification":"B","division":"OPEN","hit_factor":8.5851},{"match_name":"2017 Bay bridge Charity Classic - Richmond October 14-15-2017","match_date":"2017-10-14","stage_classifiercode":"99-11","member_number":"A96836","first_name":"JOSEF","last_name":"RAPADAS","classification":"A","division":"OPEN","hit_factor":8.5851},{"match_name":"Rio Salado UPPL September 2020","match_date":"2020-09-13","stage_classifiercode":"99-11","member_number":"TY83533","first_name":"ANDY","last_name":"FEIGIN","classification":"M","division":"OPEN","hit_factor":8.5843},{"match_name":"July 2016 H&H Match","match_date":"2016-07-24","stage_classifiercode":"99-11","member_number":"Fy69155","first_name":"WES","last_name":"BOLES","classification":"B","division":"OPEN","hit_factor":8.5809},{"match_name":"ORPCI USPSA Friday 2021.07.16","match_date":"2021-07-16","stage_classifiercode":"99-11","member_number":"A85354","first_name":"JAY","last_name":"GRAHAM","classification":"B","division":"OPEN","hit_factor":8.5809},{"match_name":"PCSI - September 2017 USPSA","match_date":"2017-09-02","stage_classifiercode":"99-11","member_number":"A100061","first_name":"JASON","last_name":"HOLLEY","classification":"B","division":"OPEN","hit_factor":8.5803},{"match_name":"Bagram Practical Shooters - Thanksgiving Tournament","match_date":"2018-11-22","stage_classifiercode":"99-11","member_number":"a104727","first_name":"KEVIN","last_name":"STICKLEY","classification":"M","division":"OPEN","hit_factor":8.5667},{"match_name":"ARPC USPSA Match 8-23-20","match_date":"2020-08-23","stage_classifiercode":"99-11","member_number":"A44819","first_name":"JIM","last_name":"KOETTING","classification":"B","division":"OPEN","hit_factor":8.5667},{"match_name":"Richmond Hot Shots April 14-15-2018 USPSA Pistol Match","match_date":"2018-04-14","stage_classifiercode":"99-11","member_number":"A51918","first_name":"TIM","last_name":"BOFMAN","classification":"A","division":"OPEN","hit_factor":8.5627},{"match_name":"Double Tap USPSA 4/17","match_date":"2017-03-30","stage_classifiercode":"99-11","member_number":"\"\"","first_name":"JACK","last_name":"DUMAS","classification":"A","division":"OPEN","hit_factor":8.5578},{"match_name":"June 2018 CAS USPSA","match_date":"2018-06-03","stage_classifiercode":"99-11","member_number":"TY63532","first_name":"GEORGE","last_name":"HEMSTAD","classification":"M","division":"OPEN","hit_factor":8.5546},{"match_name":"Ontelaunee USPSA  July 2018","match_date":"2018-07-29","stage_classifiercode":"99-11","member_number":"TY93363","first_name":"DEAN","last_name":"CHASSE","classification":"A","division":"OPEN","hit_factor":8.5546},{"match_name":"FAS Tuesday Night Indoors Match","match_date":"2021-03-17","stage_classifiercode":"99-11","member_number":"FY89154","first_name":"SYDNEY","last_name":"PACE","classification":"B","division":"OPEN","hit_factor":8.5537},{"match_name":"Rio Salado RSPP 3rd Saturday February 2020","match_date":"2020-02-15","stage_classifiercode":"99-11","member_number":"L1849","first_name":"PAUL","last_name":"THOMPSON","classification":"M","division":"OPEN","hit_factor":8.5526},{"match_name":"Palmetto Gun Club - April 2017 USPSA","match_date":"2017-04-08","stage_classifiercode":"99-11","member_number":"A93929","first_name":"TRAVIS","last_name":"BRODIE","classification":"C","division":"OPEN","hit_factor":8.5496},{"match_name":"DAPS USPSA at ETTS 7-8-17","match_date":"2017-07-08","stage_classifiercode":"99-11","member_number":"A45104","first_name":"ATHENA","last_name":"LEE","classification":"M","division":"OPEN","hit_factor":8.5484},{"match_name":"PRG - Oh Shoot USPSA February 21st - 3rd Sunday Match","match_date":"2021-02-21","stage_classifiercode":"99-11","member_number":"FU68614","first_name":"KRIT","last_name":"RERKSAWAT","classification":"A","division":"OPEN","hit_factor":8.5484},{"match_name":"ORPCI USPSA Friday 2021.07.16","match_date":"2021-07-16","stage_classifiercode":"99-11","member_number":"A55824","first_name":"JEFF","last_name":"GORDON","classification":"B","division":"OPEN","hit_factor":8.547},{"match_name":"OFGC USPSA Match Feb 19th 2017","match_date":"2017-02-19","stage_classifiercode":"99-11","member_number":"A81825","first_name":"IAN","last_name":"ZACHER","classification":"B","division":"OPEN","hit_factor":8.5455},{"match_name":"WGC Winsboro ","match_date":"2016-08-28","stage_classifiercode":"99-11","member_number":"L3696","first_name":"ROBERT","last_name":"HALSELL","classification":"A","division":"OPEN","hit_factor":8.5443},{"match_name":"Ontelaunee USPSA Hose Fest","match_date":"2021-01-02","stage_classifiercode":"99-11","member_number":"A102632","first_name":"BILL","last_name":"COLEMAN","classification":"B","division":"OPEN","hit_factor":8.5386},{"match_name":"Ontelaunee USPSA Hose Fest","match_date":"2021-01-02","stage_classifiercode":"99-11","member_number":"A118028","first_name":"CJ","last_name":"LORUSSO","classification":"B","division":"OPEN","hit_factor":8.5308},{"match_name":"2016-05-07 USPSA at Phoenix Rod and Gun Club","match_date":"2016-05-07","stage_classifiercode":"99-11","member_number":"Ty68115","first_name":"RAYMOND","last_name":"ENG","classification":"A","division":"OPEN","hit_factor":8.5284},{"match_name":"COPS 2015 Missouri Fall Classic","match_date":"2015-10-03","stage_classifiercode":"99-11","member_number":"A70465","first_name":"ROB","last_name":"MALIN","classification":"B","division":"OPEN","hit_factor":8.5236},{"match_name":"Tangi May 2016 USPSA","match_date":"2016-05-29","stage_classifiercode":"99-11","member_number":"A86980","first_name":"BRYAN","last_name":"TULLOS","classification":"B","division":"OPEN","hit_factor":8.5209},{"match_name":"NPS October 2017 Match","match_date":"2017-10-14","stage_classifiercode":"99-11","member_number":"A30659","first_name":"BRAD","last_name":"SMITH","classification":"B","division":"OPEN","hit_factor":8.5202},{"match_name":"Richmond Hot Shots April 30-May 1st USPSA Pistol Match","match_date":"2016-04-30","stage_classifiercode":"99-11","member_number":"FY18635","first_name":"JAMES","last_name":"SABUROMARU","classification":"M","division":"OPEN","hit_factor":8.5202},{"match_name":"IN19 ACC USPSA September 23","match_date":"2018-09-23","stage_classifiercode":"99-11","member_number":"Ty64065","first_name":"DANIEL","last_name":"HART","classification":"M","division":"OPEN","hit_factor":8.5142},{"match_name":"Grandbaggers 07-05-2018","match_date":"2018-07-05","stage_classifiercode":"99-11","member_number":"TY92648","first_name":"E.T.","last_name":"SAFFON","classification":"GM","division":"OPEN","hit_factor":8.5106},{"match_name":"BUAS December Match","match_date":"2016-12-11","stage_classifiercode":"99-11","member_number":"ty79508","first_name":"SHANE","last_name":"FUNGAFAT","classification":"A","division":"OPEN","hit_factor":8.5106},{"match_name":"2018-05 Bone Creek USPSA","match_date":"2018-05-06","stage_classifiercode":"99-11","member_number":"FY29453","first_name":"JD","last_name":"SMITH","classification":"M","division":"OPEN","hit_factor":8.5008},{"match_name":"LIPSA -  April 17th 2016 - USPSA Special Classifier Match","match_date":"2016-04-17","stage_classifiercode":"99-11","member_number":"TY20395","first_name":"LEO","last_name":"PRIMERO","classification":"U","division":"OPEN","hit_factor":8.4977},{"match_name":"Caja De Rio November 2017","match_date":"2017-11-18","stage_classifiercode":"99-11","member_number":"L3694","first_name":"CHRIS","last_name":"TAYLOR","classification":"A","division":"OPEN","hit_factor":8.4936},{"match_name":"2017 Bay bridge Charity Classic - Richmond October 14-15-2017","match_date":"2017-10-14","stage_classifiercode":"99-11","member_number":"TY74322","first_name":"ANDRE","last_name":"TAUBE","classification":"A","division":"OPEN","hit_factor":8.4922},{"match_name":"OK15 USPSA at USSA","match_date":"2017-12-10","stage_classifiercode":"99-11","member_number":"FY69155","first_name":"WES","last_name":"BOLES","classification":"B","division":"OPEN","hit_factor":8.4906},{"match_name":"WELD ECO09 20180916","match_date":"2018-09-16","stage_classifiercode":"99-11","member_number":"FY16618","first_name":"JEFF","last_name":"MEYER","classification":"A","division":"OPEN","hit_factor":8.489},{"match_name":"MCPSL Pistol 8-12-17","match_date":"2017-08-12","stage_classifiercode":"99-11","member_number":"TY29453","first_name":"JD","last_name":"SMITH","classification":"M","division":"OPEN","hit_factor":8.4859},{"match_name":"2016-02-06 USPSA at Phoenix Rod and Gun Club","match_date":"2016-02-06","stage_classifiercode":"99-11","member_number":"FY10574","first_name":"RICH","last_name":"REED","classification":"A","division":"OPEN","hit_factor":8.4859},{"match_name":"Ontelaunee USPSA September 2015","match_date":"2015-09-27","stage_classifiercode":"99-11","member_number":"A30857","first_name":"GIANLUIGI","last_name":"VALERI","classification":"B","division":"OPEN","hit_factor":8.4848},{"match_name":"SLOSA NOVEMBER 2017 USPSA MATCH","match_date":"2017-11-11","stage_classifiercode":"99-11","member_number":"A88732","first_name":"TIGER","last_name":"NGUYEN","classification":"A","division":"OPEN","hit_factor":8.4848},{"match_name":"Pardoe Sportsmens Association- USPSA Saturday 4-3-21","match_date":"2021-04-03","stage_classifiercode":"99-11","member_number":"TY91700","first_name":"JEFF","last_name":"MORSE","classification":"A","division":"OPEN","hit_factor":8.4772},{"match_name":"RPS November 2018 USPSA Match","match_date":"2018-11-10","stage_classifiercode":"99-11","member_number":"FY96230","first_name":"DALE","last_name":"COBERLY","classification":"B","division":"OPEN","hit_factor":8.4695},{"match_name":"Ontelaunee USPSA Hose Fest","match_date":"2021-01-02","stage_classifiercode":"99-11","member_number":"A91710","first_name":"RYAN","last_name":"POBLETE","classification":"M","division":"OPEN","hit_factor":8.4685},{"match_name":"MCPSL Pistol 8-12-17","match_date":"2017-08-12","stage_classifiercode":"99-11","member_number":"L1870","first_name":"LES","last_name":"COX","classification":"M","division":"OPEN","hit_factor":8.4665},{"match_name":"ORPCI 2018.03.31 USPSA Special","match_date":"2018-03-31","stage_classifiercode":"99-11","member_number":"TY101688","first_name":"DONALD","last_name":"APPLEGARTH","classification":"U","division":"OPEN","hit_factor":8.4639},{"match_name":"Freeport March 2020","match_date":"2020-03-01","stage_classifiercode":"99-11","member_number":"L3570","first_name":"KEVIN","last_name":"DRISCOLL","classification":"B","division":"OPEN","hit_factor":8.4639},{"match_name":"Crooked Creek Pistol League - June 2016","match_date":"2016-06-25","stage_classifiercode":"99-11","member_number":"L2450","first_name":"BUD","last_name":"CONNOLLY","classification":"B","division":"OPEN","hit_factor":8.4615},{"match_name":"Shongum Pistol November 2015","match_date":"2015-11-07","stage_classifiercode":"99-11","member_number":"L2483","first_name":"BRYAN","last_name":"JONES","classification":"M","division":"OPEN","hit_factor":8.4615},{"match_name":"Dundee USPSA Feb 2016","match_date":"2016-02-27","stage_classifiercode":"99-11","member_number":"TY76563","first_name":"SORIDA","last_name":"EAP","classification":"A","division":"OPEN","hit_factor":8.4592},{"match_name":"CVSC 07-29-2018","match_date":"2018-07-29","stage_classifiercode":"99-11","member_number":"TY96532","first_name":"ALLAN","last_name":"WEBSTER","classification":"A","division":"OPEN","hit_factor":8.4592},{"match_name":"OREGON ARPC CC05 USPSA AUGUST 12 2017","match_date":"2017-08-12","stage_classifiercode":"99-11","member_number":"l3775","first_name":"GENE","last_name":"MORIN","classification":"M","division":"OPEN","hit_factor":8.4553},{"match_name":"LIPSA  December 11th 2016 - USPSA Match","match_date":"2016-12-11","stage_classifiercode":"99-11","member_number":"TY90280","first_name":"ANTHONY","last_name":"BRUNO","classification":"B","division":"OPEN","hit_factor":8.4553},{"match_name":"Custer Feb USPSA","match_date":"2018-02-04","stage_classifiercode":"99-11","member_number":"TY90071","first_name":"ZACK","last_name":"MARR","classification":"A","division":"OPEN","hit_factor":8.4553},{"match_name":"Hopkinton June  2016","match_date":"2016-06-04","stage_classifiercode":"99-11","member_number":"TY63853","first_name":"DAVID","last_name":"GIRARDIN","classification":"B","division":"OPEN","hit_factor":8.4548},{"match_name":"Richmond Hot Shots April 14-15-2018 USPSA Pistol Match","match_date":"2018-04-14","stage_classifiercode":"99-11","member_number":"FY62950","first_name":"DARRELL","last_name":"INOUYE","classification":"A","division":"OPEN","hit_factor":8.453},{"match_name":"SCCCNOVEMBER2016","match_date":"2016-11-13","stage_classifiercode":"99-11","member_number":"\"\"","first_name":"SARAH","last_name":"TAMAELA","classification":"U","division":"OPEN","hit_factor":8.4485},{"match_name":"MCPSL Pistol 3-10-18","match_date":"2018-03-10","stage_classifiercode":"99-11","member_number":"TY29453","first_name":"JD","last_name":"SMITH","classification":"M","division":"OPEN","hit_factor":8.4465},{"match_name":"LdF USPSA Match May 12 2018","match_date":"2018-05-12","stage_classifiercode":"99-11","member_number":"TY90077","first_name":"DOUGLAS","last_name":"TELLEF","classification":"B","division":"OPEN","hit_factor":8.4437},{"match_name":"Dundee Practical Shooters - Oct 27 2018","match_date":"2018-10-27","stage_classifiercode":"99-11","member_number":"A81899","first_name":"TANNER","last_name":"BREEN","classification":"B","division":"OPEN","hit_factor":8.4416},{"match_name":"RPS December 2017 USPSA Match","match_date":"2017-12-09","stage_classifiercode":"99-11","member_number":"L3974","first_name":"ANDY","last_name":"KWON","classification":"M","division":"OPEN","hit_factor":8.4356},{"match_name":"SB Action Pistol Match Classifier","match_date":"2017-12-14","stage_classifiercode":"99-11","member_number":"TY94384","first_name":"ROBERT","last_name":"UPEGUI","classification":"\"\"","division":"OPEN","hit_factor":8.4356},{"match_name":"MCRC USPSA August 2018","match_date":"2018-08-11","stage_classifiercode":"99-11","member_number":"A63410","first_name":"EDDIE","last_name":"HUGHES","classification":"B","division":"OPEN","hit_factor":8.4337},{"match_name":"Richmond Hot Shots April 30-May 1st USPSA Pistol Match","match_date":"2016-04-30","stage_classifiercode":"99-11","member_number":"A25441","first_name":"WALTER","last_name":"HASHIMOTO","classification":"A","division":"OPEN","hit_factor":8.4337},{"match_name":"Richmond Hot Shots January 17-2016 USPSA Pistol","match_date":"2016-01-17","stage_classifiercode":"99-11","member_number":"FY18635","first_name":"JAMES","last_name":"SABUROMARU","classification":"M","division":"OPEN","hit_factor":8.432},{"match_name":"RPS November 2018 USPSA Match","match_date":"2018-11-10","stage_classifiercode":"99-11","member_number":"A31524","first_name":"COUNCIL","last_name":"BRADSHAW","classification":"GM","division":"OPEN","hit_factor":8.4211},{"match_name":"Hopkinton June  2016","match_date":"2016-06-04","stage_classifiercode":"99-11","member_number":"A95077","first_name":"MICHAEL","last_name":"KLINKER","classification":"U","division":"OPEN","hit_factor":8.4192},{"match_name":"Rio Salado UPPL September 2020","match_date":"2020-09-13","stage_classifiercode":"99-11","member_number":"FY92648","first_name":"E.T.","last_name":"SAFFON","classification":"G","division":"OPEN","hit_factor":8.418},{"match_name":"Ontelaunee USPSA  July 2018","match_date":"2018-07-29","stage_classifiercode":"99-11","member_number":"A86774","first_name":"NICHOLAS","last_name":"REALUYO","classification":"B","division":"OPEN","hit_factor":8.4142},{"match_name":"RBPS April Pistol","match_date":"2016-04-17","stage_classifiercode":"99-11","member_number":"TY5113","first_name":"PAUL","last_name":"GOODMAN","classification":"B","division":"OPEN","hit_factor":8.4127},{"match_name":"ORPCI USPSA Friday 2021.07.16","match_date":"2021-07-16","stage_classifiercode":"99-11","member_number":"TY67575","first_name":"JIM","last_name":"PETER","classification":"A","division":"OPEN","hit_factor":8.4098},{"match_name":"SWGC USPSA Pistol Match - November 2021","match_date":"2021-11-06","stage_classifiercode":"99-11","member_number":"TY95749","first_name":"PAYTON","last_name":"SAUTER","classification":"A","division":"OPEN","hit_factor":8.402},{"match_name":"ARPC USPSA Match Sept 27 2015","match_date":"2015-09-27","stage_classifiercode":"99-11","member_number":"A78405","first_name":"SEAN","last_name":"ROLEN","classification":"Unclassified","division":"OPEN","hit_factor":8.4006},{"match_name":"Strategic Edge July 2018 USPSA","match_date":"2018-07-21","stage_classifiercode":"99-11","member_number":"TY82182","first_name":"NORMA","last_name":"LEGADOS","classification":"A","division":"OPEN","hit_factor":8.3994},{"match_name":"Freeport","match_date":"2018-03-10","stage_classifiercode":"99-11","member_number":"TY82663","first_name":"KEVIN","last_name":"OBRIEN","classification":"U","division":"OPEN","hit_factor":8.3947},{"match_name":"Custer Feb USPSA","match_date":"2018-02-04","stage_classifiercode":"99-11","member_number":"TY86951","first_name":"EMILIO","last_name":"DOMINGO","classification":"A","division":"OPEN","hit_factor":8.3861},{"match_name":"USPSA-Alberta 2018-03 Indoor Classifier 3 at TSE","match_date":"2018-04-29","stage_classifiercode":"99-11","member_number":"F78887","first_name":"JEREMY","last_name":"REYNOLDS","classification":"C","division":"OPEN","hit_factor":8.3841},{"match_name":"Monson March 2016","match_date":"2016-03-26","stage_classifiercode":"99-11","member_number":"A92399","first_name":"JUSTIN","last_name":"LANDRY","classification":"B","division":"OPEN","hit_factor":8.3832},{"match_name":"Veterans 3 Gun AM Classifier Benefit Match","match_date":"2020-02-22","stage_classifiercode":"99-11","member_number":"A97425","first_name":"JORDAN","last_name":"PARKER","classification":"B","division":"OPEN","hit_factor":8.3799},{"match_name":"Brazosland Pistoleros August 20 2017","match_date":"2017-08-20","stage_classifiercode":"99-11","member_number":"A74846","first_name":"KYLE","last_name":"POST","classification":"B","division":"OPEN","hit_factor":8.3728},{"match_name":"SCCC CLASSIFIER MATCH 7_23_17","match_date":"2017-07-23","stage_classifiercode":"99-11","member_number":"a96988","first_name":"CRAIG","last_name":"BENEFIEL_2","classification":"U","division":"OPEN","hit_factor":8.3721},{"match_name":"Prescott 1 st Saturday 12-03-2016","match_date":"2016-12-03","stage_classifiercode":"99-11","member_number":"A89759","first_name":"MATT","last_name":"CHARTERS","classification":"B","division":"OPEN","hit_factor":8.3721},{"match_name":"Payson Practical Shooters - USPSA 2018 01 06","match_date":"2018-01-06","stage_classifiercode":"99-11","member_number":"A79494","first_name":"ROBB","last_name":"ASHCROFT","classification":"B","division":"OPEN","hit_factor":8.3707},{"match_name":"SWGC USPSA Pistol Match - November 2021","match_date":"2021-11-06","stage_classifiercode":"99-11","member_number":"TY94292","first_name":"TJ","last_name":"MEYERS","classification":"A","division":"OPEN","hit_factor":8.3601},{"match_name":"Pitcairn-Monroeville Sportsmens Club USPSA August 2017","match_date":"2017-08-05","stage_classifiercode":"99-11","member_number":"TY60055","first_name":"RICK","last_name":"KALYN","classification":"B","division":"OPEN","hit_factor":8.3601},{"match_name":"OK15 USPSA at USSA May 6th 2018","match_date":"2018-05-06","stage_classifiercode":"99-11","member_number":"L1224","first_name":"BILL","last_name":"GEE","classification":"M","division":"OPEN","hit_factor":8.3587},{"match_name":"RCPS USPSA March 10","match_date":"2018-03-10","stage_classifiercode":"99-11","member_number":"A71589","first_name":"SCOTTIE","last_name":"ROBERSON","classification":"M","division":"OPEN","hit_factor":8.3587},{"match_name":"NCPS USPSA Handgun Match November 27 2016","match_date":"2016-11-27","stage_classifiercode":"99-11","member_number":"A59813","first_name":"CINDY","last_name":"TUCKER","classification":"B","division":"OPEN","hit_factor":8.3472},{"match_name":"Rio Salado Hosemasters February 2021","match_date":"2021-02-27","stage_classifiercode":"99-11","member_number":"L4835","first_name":"JESSICA","last_name":"JONASSON","classification":"B","division":"OPEN","hit_factor":8.3467},{"match_name":"RBPS April Pistol","match_date":"2016-04-17","stage_classifiercode":"99-11","member_number":"A95157","first_name":"JIM","last_name":"CIVITELLO","classification":"U","division":"OPEN","hit_factor":8.3467},{"match_name":"Sage   9-18-16","match_date":"2016-09-18","stage_classifiercode":"99-11","member_number":"TY30717","first_name":"GARY","last_name":"TILLEY","classification":"M","division":"OPEN","hit_factor":8.346},{"match_name":"Douglas Ridge USPSA March 7","match_date":"2020-03-07","stage_classifiercode":"99-11","member_number":"L4735","first_name":"GEOFFREY","last_name":"PESTES","classification":"B","division":"OPEN","hit_factor":8.3458},{"match_name":"Richmond Hot Shots April 14-15-2018 USPSA Pistol Match","match_date":"2018-04-14","stage_classifiercode":"99-11","member_number":"A33147","first_name":"VINCENT","last_name":"DIONISIO","classification":"B","division":"OPEN","hit_factor":8.3451},{"match_name":"GRPC USPSA WE STOP FOR NO STORM","match_date":"2017-09-03","stage_classifiercode":"99-11","member_number":"TY75597","first_name":"JANICE","last_name":"PACLEB","classification":"B","division":"OPEN","hit_factor":8.3333},{"match_name":"CGGR July USPSA Match","match_date":"2018-07-21","stage_classifiercode":"99-11","member_number":"L4056","first_name":"DILLION","last_name":"WALKER","classification":"B","division":"OPEN","hit_factor":8.3333},{"match_name":"Palmetto Gun Club - April 2017 USPSA","match_date":"2017-04-08","stage_classifiercode":"99-11","member_number":"L2328","first_name":"KEM","last_name":"DUDLEY","classification":"A","division":"OPEN","hit_factor":8.3333},{"match_name":"USPSA MO21 2Alpha SBRC Classifier 2016","match_date":"2016-11-26","stage_classifiercode":"99-11","member_number":"TY-89171","first_name":"AUSTIN","last_name":"CHAMBERLAIN","classification":"U","division":"OPEN","hit_factor":8.3333},{"match_name":"USPSA MO21 2Alpha SBRC March 2018","match_date":"2018-03-24","stage_classifiercode":"99-11","member_number":"A92034","first_name":"DEREK","last_name":"PARKER","classification":"U","division":"OPEN","hit_factor":8.3333},{"match_name":"Swamp Eagles 2015-12","match_date":"2015-12-20","stage_classifiercode":"99-11","member_number":"L2688","first_name":"STEPHEN","last_name":"LASAVIA","classification":"M","division":"OPEN","hit_factor":8.3333},{"match_name":"Ontelaunee USPSA  July 2018","match_date":"2018-07-29","stage_classifiercode":"99-11","member_number":"TY90513","first_name":"MARK","last_name":"NOVAKOWSKI","classification":"B","division":"OPEN","hit_factor":8.3333},{"match_name":"Extreme GM USPSA  November","match_date":"2020-11-27","stage_classifiercode":"99-11","member_number":"ty102782","first_name":"CORNELIUS","last_name":"LLOYD","classification":"B","division":"OPEN","hit_factor":8.3333},{"match_name":"Applied IN25 USPSA April Classifier 2018","match_date":"2018-04-17","stage_classifiercode":"99-11","member_number":"L2755","first_name":"LINCOLN","last_name":"CARR1","classification":"A","division":"OPEN","hit_factor":8.3333},{"match_name":"Clinton County USPSA July 23 2016","match_date":"2016-07-23","stage_classifiercode":"99-11","member_number":"A91663","first_name":"DEREK","last_name":"MARTIN","classification":"U","division":"OPEN","hit_factor":8.3333},{"match_name":"Grandbaggers September 2018","match_date":"2018-09-06","stage_classifiercode":"99-11","member_number":"TY83533","first_name":"ANDY","last_name":"FEIGIN","classification":"M","division":"OPEN","hit_factor":8.3333},{"match_name":"Hose Monster Action ","match_date":"2020-07-19","stage_classifiercode":"99-11","member_number":"A98251","first_name":"SCOTT","last_name":"SEABOURN","classification":"C","division":"OPEN","hit_factor":8.3207},{"match_name":"Lefthanders Gun Club Practical Shooters October","match_date":"2017-09-30","stage_classifiercode":"99-11","member_number":"FY85612","first_name":"STEPHEN","last_name":"STEWART","classification":"B","division":"OPEN","hit_factor":8.3205},{"match_name":"Richmond Boro Gun Club April 2017 USPSA Pistol Match","match_date":"2017-04-08","stage_classifiercode":"99-11","member_number":"TY82399","first_name":"JAMES","last_name":"BYRNE","classification":"B","division":"OPEN","hit_factor":8.32},{"match_name":"Target  Sports Central Indiana Championship","match_date":"2020-08-22","stage_classifiercode":"99-11","member_number":"L2755","first_name":"LINCOLN","last_name":"CARR","classification":"A","division":"OPEN","hit_factor":8.3189},{"match_name":"ORSA USPSA October 2017","match_date":"2017-10-21","stage_classifiercode":"99-11","member_number":"A76106","first_name":"KEN","last_name":"HARDIN","classification":"B","division":"OPEN","hit_factor":8.3186},{"match_name":"LCSA USPSA March Match","match_date":"2016-03-12","stage_classifiercode":"99-11","member_number":"l1063","first_name":"CHARLES","last_name":"BROOKS","classification":"A","division":"OPEN","hit_factor":8.309},{"match_name":"FSA USPSA 01-26-20","match_date":"2020-01-27","stage_classifiercode":"99-11","member_number":"Ty54308","first_name":"GLEN","last_name":"BICKING","classification":"B","division":"OPEN","hit_factor":8.3067},{"match_name":"Prescott Action Shooters 1st Saturday USPSA 7-7-2018","match_date":"2018-07-07","stage_classifiercode":"99-11","member_number":"L4468","first_name":"RAYMOND","last_name":"ENG","classification":"A","division":"OPEN","hit_factor":8.3045},{"match_name":"Matamoras USPSA August Match","match_date":"2017-08-27","stage_classifiercode":"99-11","member_number":"A90513","first_name":"MARK","last_name":"NOVAKOWSKI","classification":"B","division":"OPEN","hit_factor":8.2976},{"match_name":"CASA USPSA  Feb 17","match_date":"2017-02-05","stage_classifiercode":"99-11","member_number":"TY53177","first_name":"CLEVE","last_name":"MATHEWS","classification":"C","division":"OPEN","hit_factor":8.2956},{"match_name":"PTPC  February 7th USPSA Match","match_date":"2016-02-07","stage_classifiercode":"99-11","member_number":"TY43340","first_name":"MARTIN","last_name":"GUTT","classification":"M","division":"OPEN","hit_factor":8.2942},{"match_name":"SMPSA 2018-01 Pistol","match_date":"2018-01-14","stage_classifiercode":"99-11","member_number":"A77322","first_name":"ROGER","last_name":"HENN","classification":"A","division":"OPEN","hit_factor":8.2919},{"match_name":"RBPS April Pistol","match_date":"2016-04-17","stage_classifiercode":"99-11","member_number":"TY31907","first_name":"JEFF","last_name":"CURTS","classification":"A","division":"OPEN","hit_factor":8.2883},{"match_name":"PRG 2017 Classifier Match","match_date":"2017-02-19","stage_classifiercode":"99-11","member_number":"L3942","first_name":"LEON","last_name":"SUNG","classification":"B","division":"OPEN","hit_factor":8.2849},{"match_name":"Shasta Shooters 2021 Nov","match_date":"2021-11-13","stage_classifiercode":"99-11","member_number":"TY87118","first_name":"STAN","last_name":"CLEWETT","classification":"A","division":"OPEN","hit_factor":8.2813},{"match_name":"PRPSA USPSA CHALLENGE PAN AMERICAN","match_date":"2021-07-11","stage_classifiercode":"99-11","member_number":"SFC","first_name":"JOEY","last_name":"RODRIGUEZ","classification":"","division":"OPEN","hit_factor":8.2813},{"match_name":"TCGC Polo July 2017","match_date":"2017-07-23","stage_classifiercode":"99-11","member_number":"FY84558","first_name":"CEDRIC","last_name":"CANDO","classification":"U","division":"OPEN","hit_factor":8.2803},{"match_name":"WNYPPL August 2017 Classifier Match","match_date":"2017-08-27","stage_classifiercode":"99-11","member_number":"TYF70043","first_name":"FERNANDO","last_name":"SOUSA","classification":"D","division":"OPEN","hit_factor":8.2729},{"match_name":"Rio Salado RSPP 3rd Saturday February 2020","match_date":"2020-02-15","stage_classifiercode":"99-11","member_number":"L1189","first_name":"JOHN","last_name":"LAMARCA","classification":"A","division":"OPEN","hit_factor":8.2718},{"match_name":"SCAPSA MN05 Summer League 8","match_date":"2017-08-01","stage_classifiercode":"99-11","member_number":"TY94384","first_name":"ROBERT","last_name":"UPEGUI","classification":"D","division":"OPEN","hit_factor":8.2695},{"match_name":"COPS 2015 Missouri Fall Classic","match_date":"2015-10-03","stage_classifiercode":"99-11","member_number":"TY29453","first_name":"JD","last_name":"SMITH","classification":"M","division":"OPEN","hit_factor":8.2601},{"match_name":"Cactus USPSA ALL CLASSIFIER August 2020","match_date":"2020-08-02","stage_classifiercode":"99-11","member_number":"A100726","first_name":"DOMINIC","last_name":"NAPOLITANO","classification":"B","division":"OPEN","hit_factor":8.2583},{"match_name":"PRG 2017 Classifier Match","match_date":"2017-02-19","stage_classifiercode":"99-11","member_number":"A75787","first_name":"MIKE","last_name":"DIXON","classification":"A","division":"OPEN","hit_factor":8.2569},{"match_name":"TMGN USPSA July 6th Match","match_date":"2017-07-06","stage_classifiercode":"99-11","member_number":"A100231","first_name":"JEREMY","last_name":"HAINES","classification":"C","division":"OPEN","hit_factor":8.2569},{"match_name":"LIPSA -  April 17th 2016 - USPSA Special Classifier Match","match_date":"2016-04-17","stage_classifiercode":"99-11","member_number":"TY-51319","first_name":"CHARLES","last_name":"CHIN","classification":"B","division":"OPEN","hit_factor":8.2555},{"match_name":"WILLISTON PRACTICAL SHOOTERS CLUB","match_date":"2020-10-03","stage_classifiercode":"99-11","member_number":"A77994","first_name":"TOM","last_name":"DAVIS","classification":"B","division":"OPEN","hit_factor":8.2524},{"match_name":"Richmond Hot Shots April 30-May 1st USPSA Pistol Match","match_date":"2016-04-30","stage_classifiercode":"99-11","member_number":"A85957","first_name":"TRISTAN","last_name":"TOLENTINO","classification":"B","division":"OPEN","hit_factor":8.2524},{"match_name":"NCPS USPSA Handgun Match November 27 2016","match_date":"2016-11-27","stage_classifiercode":"99-11","member_number":"A51928","first_name":"CESAR","last_name":"MATA","classification":"M","division":"OPEN","hit_factor":8.2474},{"match_name":"Brothers N Arms April 2016 USPSA Match (22Apr16-08:54:02)","match_date":"2016-04-23","stage_classifiercode":"99-11","member_number":"A65599","first_name":"GALE","last_name":"BUTLER","classification":"B","division":"OPEN","hit_factor":8.2409},{"match_name":"2017-10-07 USPSA at Phoenix Rod and Gun Club","match_date":"2017-10-07","stage_classifiercode":"99-11","member_number":"TY28855","first_name":"PHILLIP","last_name":"GALLEGOS","classification":"A","division":"OPEN","hit_factor":8.2386},{"match_name":"CGGR July USPSA Match","match_date":"2018-07-21","stage_classifiercode":"99-11","member_number":"FY96230","first_name":"DALE","last_name":"COBERLY","classification":"B","division":"OPEN","hit_factor":8.237},{"match_name":"Collin County USPSA 04-25-2021","match_date":"2021-04-24","stage_classifiercode":"99-11","member_number":"TY55323","first_name":"NIC","last_name":"NEEL","classification":"G","division":"OPEN","hit_factor":8.2353},{"match_name":"RCPS USPSA 14 Nov 2015","match_date":"2015-11-14","stage_classifiercode":"99-11","member_number":"FY36328","first_name":"MIKE","last_name":"GETTEMY","classification":"B","division":"OPEN","hit_factor":8.2317},{"match_name":"OKCGC USPSA June 2018","match_date":"2018-06-02","stage_classifiercode":"99-11","member_number":"Ty90580","first_name":"JASON","last_name":"SOUPENE","classification":"A","division":"OPEN","hit_factor":8.2298},{"match_name":"CFRPC December USPSA (Classifier)","match_date":"2018-12-16","stage_classifiercode":"99-11","member_number":"A44363","first_name":"COLLIN","last_name":"SMITH","classification":"A","division":"OPEN","hit_factor":8.2278},{"match_name":"CASA USPSA  Jul 2016","match_date":"2016-07-09","stage_classifiercode":"99-11","member_number":"TY53177","first_name":"CLEVE","last_name":"MATHEWS","classification":"C","division":"OPEN","hit_factor":8.2258},{"match_name":"PPPS 11-13-16","match_date":"2016-11-13","stage_classifiercode":"99-11","member_number":"TY41573","first_name":"CRAIG","last_name":"CALKINS","classification":"A","division":"OPEN","hit_factor":8.2243},{"match_name":"DAPS USPSA at ETTS 7-8-17","match_date":"2017-07-08","stage_classifiercode":"99-11","member_number":"A69625","first_name":"KEITH","last_name":"GYGER","classification":"A","division":"OPEN","hit_factor":8.2237},{"match_name":"LPRGC - Lower Providence USPSA October 2018","match_date":"2018-10-06","stage_classifiercode":"99-11","member_number":"A65858","first_name":"VICTOR","last_name":"KHOMENKO","classification":"B","division":"OPEN","hit_factor":8.2192},{"match_name":"Crooked Creek Pistol League - June 2017","match_date":"2017-06-24","stage_classifiercode":"99-11","member_number":"TY66305","first_name":"HERB","last_name":"SMITH","classification":"B","division":"OPEN","hit_factor":8.2153},{"match_name":"10-04-2015 USPSA","match_date":"2015-10-02","stage_classifiercode":"99-11","member_number":"L2450","first_name":"BUD","last_name":"CONNOLLY","classification":"B","division":"OPEN","hit_factor":8.2148},{"match_name":"NCPS USPSA Handgun Match November 27 2016","match_date":"2016-11-27","stage_classifiercode":"99-11","member_number":"A86599","first_name":"SEAN","last_name":"AGUAS","classification":"B","division":"OPEN","hit_factor":8.2111},{"match_name":"Hopkinton USPSA May 2017","match_date":"2017-05-06","stage_classifiercode":"99-11","member_number":"A34817","first_name":"DANIEL","last_name":"DIGIOVINE","classification":"A","division":"OPEN","hit_factor":8.209},{"match_name":"MSSA USPSA June  10 2017","match_date":"2017-06-10","stage_classifiercode":"99-11","member_number":"A52191","first_name":"SLOAN","last_name":"SANDERS","classification":"M","division":"OPEN","hit_factor":8.209},{"match_name":"Coastal Bend Shooters USPSA October 9 2016","match_date":"2016-10-09","stage_classifiercode":"99-11","member_number":"A98346","first_name":"DAVID","last_name":"GRIFFITH","classification":"U","division":"OPEN","hit_factor":8.2043},{"match_name":"AGC_20170903","match_date":"2017-09-03","stage_classifiercode":"99-11","member_number":"A71925","first_name":"LAUREN","last_name":"HORNER","classification":"U","division":"OPEN","hit_factor":8.2014},{"match_name":"CRC/SVPS AUGUST  2018","match_date":"2018-08-17","stage_classifiercode":"99-11","member_number":"TY103886","first_name":"JASON","last_name":"WALKER","classification":"U","division":"OPEN","hit_factor":8.1994},{"match_name":"FBURG March Level I USPSA","match_date":"2016-03-06","stage_classifiercode":"99-11","member_number":"A71480","first_name":"DAVID","last_name":"SCORDY","classification":"C","division":"OPEN","hit_factor":8.1991},{"match_name":"Custer Feb USPSA","match_date":"2018-02-04","stage_classifiercode":"99-11","member_number":"\"\"","first_name":"SAM","last_name":"SAM","classification":"U","division":"OPEN","hit_factor":8.1921},{"match_name":"Rio Salado UPPL September 2020","match_date":"2020-09-13","stage_classifiercode":"99-11","member_number":"TY114245","first_name":"EUGENE","last_name":"OH","classification":"B","division":"OPEN","hit_factor":8.1871},{"match_name":"ARPC USPSA Match Sept 27 2015","match_date":"2015-09-27","stage_classifiercode":"99-11","member_number":"A66661","first_name":"CHRISTINE","last_name":"GUINN","classification":"B","division":"OPEN","hit_factor":8.1862},{"match_name":"May 2018 4th Tues CAPS USPSA Level 1 - Range At Ballantyne","match_date":"2018-05-20","stage_classifiercode":"99-11","member_number":"A95240","first_name":"SAM","last_name":"STEPHENS","classification":"B","division":"OPEN","hit_factor":8.1851},{"match_name":"OKCGC USPSA June 2018","match_date":"2018-06-02","stage_classifiercode":"99-11","member_number":"A71435","first_name":"FEEGEE","last_name":"MATLOCK","classification":"A","division":"OPEN","hit_factor":8.1845},{"match_name":"Ontelaunee USPSA September 2015","match_date":"2015-09-27","stage_classifiercode":"99-11","member_number":"TY70694","first_name":"ALEX","last_name":"SALAZAR","classification":"B","division":"OPEN","hit_factor":8.1818},{"match_name":"Applied IN25 USPSA April Classifier 2018","match_date":"2018-04-17","stage_classifiercode":"99-11","member_number":"L2755","first_name":"LINCOLN","last_name":"CARR","classification":"A","division":"OPEN","hit_factor":8.1784},{"match_name":"FAS Sunday Indoors USPSA Match","match_date":"2021-02-07","stage_classifiercode":"99-11","member_number":"L4554","first_name":"PETER","last_name":"WHITE","classification":"B","division":"OPEN","hit_factor":8.1752},{"match_name":"Rio Salado RSPP 3rd Saturday February 2020","match_date":"2020-02-15","stage_classifiercode":"99-11","member_number":"TY47460","first_name":"STEVE","last_name":"LEACH","classification":"A","division":"OPEN","hit_factor":8.1717},{"match_name":"AIPS  USPSA 11-14-15","match_date":"2015-11-14","stage_classifiercode":"99-11","member_number":"A53309","first_name":"JESSE","last_name":"PETERSON","classification":"B","division":"OPEN","hit_factor":8.1717},{"match_name":"OK15 USPSA at USSA","match_date":"2017-12-10","stage_classifiercode":"99-11","member_number":"A95417","first_name":"CHANCE","last_name":"DEASON","classification":"B","division":"OPEN","hit_factor":8.1705},{"match_name":"Hose Monster Action ","match_date":"2020-07-19","stage_classifiercode":"99-11","member_number":"L1620","first_name":"THOMAS","last_name":"CHAN","classification":"A","division":"OPEN","hit_factor":8.1694},{"match_name":"TAP USPSA Pistol Match Aug 14 2016","match_date":"2016-08-14","stage_classifiercode":"99-11","member_number":"A85957","first_name":"TRISTAN","last_name":"TOLENTINO","classification":"B","division":"OPEN","hit_factor":8.167},{"match_name":"APS August 1st Monthly USPSA Match  Classifier Match","match_date":"2021-08-01","stage_classifiercode":"99-11","member_number":"A114462","first_name":"CHRIS","last_name":"PARKER","classification":"U","division":"OPEN","hit_factor":8.1664},{"match_name":"Granby Action Shooters Oct 2016","match_date":"2016-10-02","stage_classifiercode":"99-11","member_number":"\"\"","first_name":"MIKE","last_name":"PALOMBO","classification":"\"\"","division":"OPEN","hit_factor":8.1662},{"match_name":"Lefthanders Gun Club Practical Shooters October","match_date":"2017-09-30","stage_classifiercode":"99-11","member_number":"TY72670","first_name":"DALE","last_name":"HARDING","classification":"B","division":"OPEN","hit_factor":8.1633},{"match_name":"FAS Tuesday Night Indoors Match","match_date":"2021-03-17","stage_classifiercode":"99-11","member_number":"A115534","first_name":"TONY","last_name":"GREENE","classification":"C","division":"OPEN","hit_factor":8.1633},{"match_name":"BA USPSA Sep  23/2017","match_date":"2017-09-23","stage_classifiercode":"99-11","member_number":"A100061","first_name":"JASON","last_name":"HOLLEY","classification":"B","division":"OPEN","hit_factor":8.1571},{"match_name":"FAS Sunday Indoors USPSA","match_date":"2021-10-17","stage_classifiercode":"99-11","member_number":"TY87343","first_name":"KEITH","last_name":"BERRIAN","classification":"B","division":"OPEN","hit_factor":8.1481},{"match_name":"Shoot Gtr USPSA 10/18","match_date":"2016-10-18","stage_classifiercode":"99-11","member_number":"TY34497","first_name":"PATRICK","last_name":"GAUVIN","classification":"A","division":"OPEN","hit_factor":8.147},{"match_name":"NW01 Paul Bunyan CS Series May 9 2021","match_date":"2021-05-09","stage_classifiercode":"99-11","member_number":"A110099","first_name":"HAROLD","last_name":"MARTINEZ","classification":"A","division":"OPEN","hit_factor":8.1461},{"match_name":"Richmond Boro Gun Club April 2017 USPSA Pistol Match","match_date":"2017-04-08","stage_classifiercode":"99-11","member_number":"TY90280","first_name":"ANTHONY","last_name":"BRUNO","classification":"B","division":"OPEN","hit_factor":8.1456},{"match_name":"Firing Line Classifier","match_date":"2018-01-26","stage_classifiercode":"99-11","member_number":"A105972","first_name":"BEN","last_name":"MOORE","classification":"U","division":"OPEN","hit_factor":8.1448},{"match_name":"INAS May 2020 USPSA","match_date":"2020-05-09","stage_classifiercode":"99-11","member_number":"TY14401","first_name":"PAT","last_name":"KELLEY","classification":"M","division":"OPEN","hit_factor":8.1433},{"match_name":"LCSA USPSA March Match","match_date":"2016-03-12","stage_classifiercode":"99-11","member_number":"A77032","first_name":"TYLER","last_name":"COKE","classification":"B","division":"OPEN","hit_factor":8.1395},{"match_name":"2016-05-07 USPSA at Phoenix Rod and Gun Club","match_date":"2016-05-07","stage_classifiercode":"99-11","member_number":"L2568","first_name":"JAMES","last_name":"NORTZ","classification":"M","division":"OPEN","hit_factor":8.137},{"match_name":"HPS April Tax Time Fun Shoot","match_date":"2017-04-22","stage_classifiercode":"99-11","member_number":"L2624","first_name":"MARIO","last_name":"LAYUGAN","classification":"A","division":"OPEN","hit_factor":8.134},{"match_name":"LdF USPSA Match May 12 2018","match_date":"2018-05-12","stage_classifiercode":"99-11","member_number":"a18808","first_name":"LOU","last_name":"PAZ 2","classification":"A","division":"OPEN","hit_factor":8.1315},{"match_name":"Ontelaunee USPSA Hose Fest","match_date":"2021-01-02","stage_classifiercode":"99-11","member_number":"L4967","first_name":"JM","last_name":"MARQUEZ","classification":"B","division":"OPEN","hit_factor":8.1241},{"match_name":"Tangi January 2016 USPSA","match_date":"2016-01-23","stage_classifiercode":"99-11","member_number":"TY44221","first_name":"BRANDON","last_name":"GUILLORY","classification":"M","division":"OPEN","hit_factor":8.1197},{"match_name":"2017-10-07 USPSA at Phoenix Rod and Gun Club","match_date":"2017-10-07","stage_classifiercode":"99-11","member_number":"A55530","first_name":"TIM","last_name":"HIBBS","classification":"M","division":"OPEN","hit_factor":8.1159},{"match_name":"HPS March 2020 Club Fun Match","match_date":"2020-03-07","stage_classifiercode":"99-11","member_number":"FY85757","first_name":"EDGAR","last_name":"VICENTE","classification":"C","division":"OPEN","hit_factor":8.1119},{"match_name":"Pitcairn-Monroeville Sportsmens Club USPSA August 2017","match_date":"2017-08-05","stage_classifiercode":"99-11","member_number":"A42456","first_name":"GARRY","last_name":"LITTLE","classification":"B","division":"OPEN","hit_factor":8.1042},{"match_name":"LIPSA -  April 17th 2016 - USPSA Special Classifier Match","match_date":"2016-04-17","stage_classifiercode":"99-11","member_number":"ty9036","first_name":"STANLEY","last_name":"DOROSKI","classification":"A","division":"OPEN","hit_factor":8.1006},{"match_name":"MAPSA June Special Classifier","match_date":"2018-06-09","stage_classifiercode":"99-11","member_number":"L4062","first_name":"KEN","last_name":"SPOONER","classification":"B","division":"OPEN","hit_factor":8.1001},{"match_name":"ShooT GTR USPSA 1/1/17","match_date":"2017-01-01","stage_classifiercode":"99-11","member_number":"TY27735","first_name":"BOB","last_name":"MILLS","classification":"A","division":"OPEN","hit_factor":8.1001},{"match_name":"DTR USPS A Jan 21","match_date":"2021-01-09","stage_classifiercode":"99-11","member_number":"FY88787","first_name":"MARK","last_name":"MILLER","classification":"A","division":"OPEN","hit_factor":8.0979},{"match_name":"OKCGC USPSA June 2018","match_date":"2018-06-02","stage_classifiercode":"99-11","member_number":"FY66343","first_name":"JOE","last_name":"HOLMES","classification":"B","division":"OPEN","hit_factor":8.0893},{"match_name":"Richmond Hot Shots April 30-May 1st USPSA Pistol Match","match_date":"2016-04-30","stage_classifiercode":"99-11","member_number":"A88783","first_name":"JOHNMAR","last_name":"SAMSON","classification":"B","division":"OPEN","hit_factor":8.0882},{"match_name":"NCPS USPSA Handgun Match June 24 2018","match_date":"2018-06-24","stage_classifiercode":"99-11","member_number":"A96836","first_name":"JOSEF","last_name":"RAPADAS","classification":"M","division":"OPEN","hit_factor":8.0871},{"match_name":"EIPS 12/6/2018","match_date":"2018-12-06","stage_classifiercode":"99-11","member_number":"TY45596","first_name":"WILLIAM","last_name":"BEEM","classification":"A","division":"OPEN","hit_factor":8.0851},{"match_name":"Pardoe Sportsmens Association-WPA14-2017-10-01","match_date":"2017-10-01","stage_classifiercode":"99-11","member_number":"TY91700","first_name":"JEFF","last_name":"MORSE","classification":"B","division":"OPEN","hit_factor":8.0851},{"match_name":"GRRC Wk 8","match_date":"2018-06-25","stage_classifiercode":"99-11","member_number":"A97255","first_name":"DARIN","last_name":"MAGER","classification":"B","division":"OPEN","hit_factor":8.0838},{"match_name":"WGC Winsboro ","match_date":"2016-08-28","stage_classifiercode":"99-11","member_number":"A93372","first_name":"JAMES","last_name":"LOFTON","classification":"B","division":"OPEN","hit_factor":8.0824},{"match_name":"STAGE ZERO SHOOTING SUPPLY USPSA","match_date":"2020-07-16","stage_classifiercode":"99-11","member_number":"A129097","first_name":"KRISTOFER","last_name":"MCFATE","classification":"U","division":"OPEN","hit_factor":8.0808},{"match_name":"Monson March 2016","match_date":"2016-03-26","stage_classifiercode":"99-11","member_number":"TY11901","first_name":"DAVE","last_name":"LOPEZ","classification":"A","division":"OPEN","hit_factor":8.078},{"match_name":"FAS USPSA   One Small Step","match_date":"2018-10-07","stage_classifiercode":"99-11","member_number":"A94571","first_name":"THOMAS","last_name":"BAZOR","classification":"U","division":"OPEN","hit_factor":8.0775},{"match_name":"NHRPC - March 2021 USPSA","match_date":"2021-03-14","stage_classifiercode":"99-11","member_number":"A118028","first_name":"CJ","last_name":"LORUSSO","classification":"B","division":"OPEN","hit_factor":8.0764},{"match_name":"Rio Grande Practical Shooters - Oct 2015","match_date":"2015-10-03","stage_classifiercode":"99-11","member_number":"A4820","first_name":"JAMES","last_name":"LAMBERT","classification":"A","division":"OPEN","hit_factor":8.0745},{"match_name":"LA05 Tangi June USPSA 2020","match_date":"2020-06-28","stage_classifiercode":"99-11","member_number":"L2725","first_name":"CHARLES","last_name":"BLACK","classification":"M","division":"OPEN","hit_factor":8.0717},{"match_name":"WGC Winsboro ","match_date":"2016-08-28","stage_classifiercode":"99-11","member_number":"A77783","first_name":"GREG","last_name":"GREENE","classification":"\"\"","division":"OPEN","hit_factor":8.0692},{"match_name":"PCSI - September 2017 USPSA","match_date":"2017-09-02","stage_classifiercode":"99-11","member_number":"TY79620","first_name":"DAVID","last_name":"BLAIR","classification":"B","division":"OPEN","hit_factor":8.0645},{"match_name":"LdF USPSA Match January 25 2020","match_date":"2020-01-25","stage_classifiercode":"99-11","member_number":"TY17381","first_name":"JOHN","last_name":"HURST","classification":"M","division":"OPEN","hit_factor":8.0622},{"match_name":"RISE INDOOR CLASSIFIER","match_date":"2018-12-15","stage_classifiercode":"99-11","member_number":"TY82663","first_name":"KEVIN","last_name":"O'BRIEN","classification":"A","division":"OPEN","hit_factor":8.0622},{"match_name":"FAS USPSA   One Small Step","match_date":"2018-10-07","stage_classifiercode":"99-11","member_number":"A87343","first_name":"KEITH","last_name":"BERRIAN","classification":"C","division":"OPEN","hit_factor":8.0601},{"match_name":"Ontelaunee USPSA September 2015","match_date":"2015-09-27","stage_classifiercode":"99-11","member_number":"TY16248","first_name":"BARRY","last_name":"RUANE","classification":"M","division":"OPEN","hit_factor":8.0597},{"match_name":"BUAS February Match","match_date":"2020-02-09","stage_classifiercode":"99-11","member_number":"Ty111079","first_name":"MIKE","last_name":"PAN","classification":"M","division":"OPEN","hit_factor":8.055},{"match_name":"Benton Gun Club-USPSA June 28  9AM","match_date":"2020-06-28","stage_classifiercode":"99-11","member_number":"A126576","first_name":"TOM","last_name":"FLEMING","classification":"C","division":"OPEN","hit_factor":8.0547},{"match_name":"ORPCI 2017 June USPSA Classifer Match","match_date":"2017-06-25","stage_classifiercode":"99-11","member_number":"\"\"","first_name":"BRAD","last_name":"STEELMAN","classification":"X","division":"OPEN","hit_factor":8.0515},{"match_name":"Baps March Uspsa","match_date":"2016-03-19","stage_classifiercode":"99-11","member_number":"L2875","first_name":"LANDIS","last_name":"NEWBANKS","classification":"A","division":"OPEN","hit_factor":8.0508},{"match_name":"OKCGC USPSA June 2018","match_date":"2018-06-02","stage_classifiercode":"99-11","member_number":"A104353","first_name":"PATRICK","last_name":"RUNNELS","classification":"U","division":"OPEN","hit_factor":8.0501},{"match_name":"Baileys July 2017","match_date":"2017-07-02","stage_classifiercode":"99-11","member_number":"L3674","first_name":"AUGUST","last_name":"BALAGTAS","classification":"U","division":"OPEN","hit_factor":8.046},{"match_name":"Rio Salado UPPL September 2020","match_date":"2020-09-13","stage_classifiercode":"99-11","member_number":"TY85346","first_name":"DAVID","last_name":"BAKER","classification":"B","division":"OPEN","hit_factor":8.0439},{"match_name":"BA USPSA Sep  23/2017","match_date":"2017-09-23","stage_classifiercode":"99-11","member_number":"A103069","first_name":"CHANCE","last_name":"BILLINGS","classification":"D","division":"OPEN","hit_factor":8.0409},{"match_name":"NW01 Paul Bunyan CS Series May 9 2021","match_date":"2021-05-09","stage_classifiercode":"99-11","member_number":"TY66256","first_name":"LOKE UEI","last_name":"TAN","classification":"G","division":"OPEN","hit_factor":8.0357},{"match_name":"Rio Salado UPPL September 2020","match_date":"2020-09-13","stage_classifiercode":"99-11","member_number":"TY13606","first_name":"PAUL","last_name":"GARCIA","classification":"U","division":"OPEN","hit_factor":8.0357},{"match_name":"Springfield Tactical Shooters 04/05/2018","match_date":"2018-04-05","stage_classifiercode":"99-11","member_number":"L1467","first_name":"CHARLES","last_name":"MORSE","classification":"B","division":"OPEN","hit_factor":8.0357},{"match_name":"Dundee Practical Shooters - Oct 27 2018","match_date":"2018-10-27","stage_classifiercode":"99-11","member_number":"A81898","first_name":"JIM","last_name":"BREEN","classification":"B","division":"OPEN","hit_factor":8.0344},{"match_name":"PPS CLASSIFIER MATCH 2020-01-28","match_date":"2020-01-29","stage_classifiercode":"99-11","member_number":"Ty29454","first_name":"JD","last_name":"SMITH","classification":"M","division":"OPEN","hit_factor":8.0315},{"match_name":"CJR&PC USPSA  June 10","match_date":"2018-06-10","stage_classifiercode":"99-11","member_number":"\"\"","first_name":"ALEX","last_name":"SALAZAR","classification":"\"\"","division":"OPEN","hit_factor":8.0315},{"match_name":"SAPSC Special Classifier Match","match_date":"2018-04-26","stage_classifiercode":"99-11","member_number":"A58496","first_name":"GREG","last_name":"SMITH","classification":"U","division":"OPEN","hit_factor":8.0238},{"match_name":"CSoS Feb2016 Match","match_date":"2016-02-21","stage_classifiercode":"99-11","member_number":"A91357","first_name":"BEN","last_name":"LANGFORD","classification":"B","division":"OPEN","hit_factor":8.0189},{"match_name":"PSAC 20171028","match_date":"2017-10-28","stage_classifiercode":"99-11","member_number":"A69423","first_name":"JOSH","last_name":"HORNER","classification":"M","division":"OPEN","hit_factor":8.0114},{"match_name":"FAS Tuesday Night Indoors Match","match_date":"2021-03-17","stage_classifiercode":"99-11","member_number":"TY87343","first_name":"KEITH","last_name":"BERRIAN","classification":"B","division":"OPEN","hit_factor":8.006},{"match_name":"RBPS April Pistol","match_date":"2016-04-17","stage_classifiercode":"99-11","member_number":"A80418","first_name":"ALVA","last_name":"ENGLISH","classification":"B","division":"OPEN","hit_factor":8},{"match_name":"CCPL 01102016 ALL CLASSIFIER MATCH","match_date":"2016-01-10","stage_classifiercode":"99-11","member_number":"A34139","first_name":"LEE","last_name":"ROWE","classification":"A","division":"OPEN","hit_factor":8},{"match_name":"Hawkeye Gun Club July 2016 Match","match_date":"2016-07-16","stage_classifiercode":"99-11","member_number":"A91357","first_name":"BEN","last_name":"LANGFORD","classification":"B","division":"OPEN","hit_factor":8},{"match_name":"WNPL - USPSA March Snowblind Blowout 2017","match_date":"2017-03-05","stage_classifiercode":"99-11","member_number":"\"\"","first_name":"SEAN","last_name":"O'BRIEN","classification":"U","division":"OPEN","hit_factor":8},{"match_name":"HPS April Tax Time Fun Shoot","match_date":"2017-04-22","stage_classifiercode":"99-11","member_number":"L4210","first_name":"BONG","last_name":"BARRANCO","classification":"B","division":"OPEN","hit_factor":8},{"match_name":"COPS 2015 Missouri Fall Classic","match_date":"2015-10-03","stage_classifiercode":"99-11","member_number":"A66661","first_name":"CHRISTINE","last_name":"GUINN","classification":"B","division":"OPEN","hit_factor":8},{"match_name":"NCPS USPSA Handgun Match November 27 2016","match_date":"2016-11-27","stage_classifiercode":"99-11","member_number":"NONE","first_name":"JOHNMAR","last_name":"SAMSON","classification":"B","division":"OPEN","hit_factor":8},{"match_name":"WNPL USPSA - REDEMPTION - NOVEMBER 2016","match_date":"2016-11-06","stage_classifiercode":"99-11","member_number":"TY76701","first_name":"GLENN","last_name":"FANNIN","classification":"A","division":"OPEN","hit_factor":8},{"match_name":"Dundee USPSA Feb 2016","match_date":"2016-02-27","stage_classifiercode":"99-11","member_number":"TY47743","first_name":"NORMAN","last_name":"BRIGHT","classification":"M","division":"OPEN","hit_factor":7.9942},{"match_name":"Pitcairn-Monroeville Sportsmens Club USPSA August 2017","match_date":"2017-08-05","stage_classifiercode":"99-11","member_number":"fy83046","first_name":"TOM","last_name":"GILLECE","classification":"B","division":"OPEN","hit_factor":7.9937},{"match_name":"USPSA MB Classifier Match One","match_date":"2018-12-26","stage_classifiercode":"99-11","member_number":"F89074","first_name":"KEITH","last_name":"ADVICE","classification":"B","division":"OPEN","hit_factor":7.9935},{"match_name":"Bare Arms Indoo 12/08/18","match_date":"2018-12-08","stage_classifiercode":"99-11","member_number":"L1779","first_name":"ALLEN","last_name":"RATLIFF","classification":"M","division":"OPEN","hit_factor":7.9935},{"match_name":"Swamp Eagles 2015-12","match_date":"2015-12-20","stage_classifiercode":"99-11","member_number":"TY42086","first_name":"BILL","last_name":"JACKSON","classification":"B","division":"OPEN","hit_factor":7.9877},{"match_name":"SAGC CTX04 Monthly USPSA Match - September 2020","match_date":"2020-09-27","stage_classifiercode":"99-11","member_number":"L2181","first_name":"DALE","last_name":"ALCORN","classification":"A","division":"OPEN","hit_factor":7.9867},{"match_name":"ISPS 6/19/2016 USPSA","match_date":"2016-06-19","stage_classifiercode":"99-11","member_number":"TY2666","first_name":"MIKE","last_name":"JONES","classification":"A","division":"OPEN","hit_factor":7.9838},{"match_name":"TAP USPSA Pistol Match Aug 14 2016","match_date":"2016-08-14","stage_classifiercode":"99-11","member_number":"A75591","first_name":"JONATHAN","last_name":"JUNG","classification":"U","division":"OPEN","hit_factor":7.9826},{"match_name":"LIPSA  December 11th 2016 - USPSA Match","match_date":"2016-12-11","stage_classifiercode":"99-11","member_number":"TY82399","first_name":"JAMES","last_name":"BYRNE","classification":"C","division":"OPEN","hit_factor":7.9819},{"match_name":"ORGC Tuesday classifier August-21-2018","match_date":"2018-08-21","stage_classifiercode":"99-11","member_number":"L1189","first_name":"JOHN","last_name":"LAMARCA","classification":"A","division":"OPEN","hit_factor":7.9787},{"match_name":"MSSA Uspsa Match 1/3/16","match_date":"2016-01-03","stage_classifiercode":"99-11","member_number":"L843","first_name":"LYNN","last_name":"JONES","classification":"M","division":"OPEN","hit_factor":7.9777},{"match_name":"NW01 Paul Bunyan CS Series May 9 2021","match_date":"2021-05-09","stage_classifiercode":"99-11","member_number":"Ty47022","first_name":"BRUCE","last_name":"WOOD","classification":"A","division":"OPEN","hit_factor":7.9764},{"match_name":"Denali September","match_date":"2018-09-07","stage_classifiercode":"99-11","member_number":"L3808","first_name":"MARK","last_name":"BROWN","classification":"B","division":"OPEN","hit_factor":7.9764},{"match_name":"Extreme GM","match_date":"2020-06-12","stage_classifiercode":"99-11","member_number":"ty102782","first_name":"LLOYD","last_name":"CORNELIUS","classification":"B","division":"OPEN","hit_factor":7.9755},{"match_name":"SLPSA August USPSA Match 2","match_date":"2020-08-15","stage_classifiercode":"99-11","member_number":"A94408","first_name":"BRETT","last_name":"THOMAS","classification":"M","division":"OPEN","hit_factor":7.9745},{"match_name":"OK15 USPSA at USSA May 6th 2018","match_date":"2018-05-06","stage_classifiercode":"99-11","member_number":"Fy69155","first_name":"WES","last_name":"BOLES","classification":"A","division":"OPEN","hit_factor":7.9734},{"match_name":"RSPP 3rd Saturday November 2016","match_date":"2016-11-19","stage_classifiercode":"99-11","member_number":"\"\"","first_name":"RON","last_name":"ASCHENBACH","classification":"B","division":"OPEN","hit_factor":7.973},{"match_name":"RCPS USPSA 14 Nov 2015","match_date":"2015-11-14","stage_classifiercode":"99-11","member_number":"A26587","first_name":"RUSCHAK","last_name":"MARK","classification":"B","division":"OPEN","hit_factor":7.971},{"match_name":"PRG 2017 Classifier Match","match_date":"2017-02-19","stage_classifiercode":"99-11","member_number":"TY87774","first_name":"TONY","last_name":"CHEN","classification":"C","division":"OPEN","hit_factor":7.9688},{"match_name":"LPRGC - Lower Providence USPSA October 2018","match_date":"2018-10-06","stage_classifiercode":"99-11","member_number":"A47067","first_name":"AL","last_name":"REALUYO","classification":"B","division":"OPEN","hit_factor":7.9675},{"match_name":"SLPSA August USPSA Match 2","match_date":"2020-08-15","stage_classifiercode":"99-11","member_number":"A95104","first_name":"TAYLOR","last_name":"WALKER","classification":"A","division":"OPEN","hit_factor":7.9646},{"match_name":"USPSA MO21 2Alpha SBRC December 22 2018","match_date":"2018-12-22","stage_classifiercode":"99-11","member_number":"A108097","first_name":"JOSEPH","last_name":"HICKS","classification":"U","division":"OPEN","hit_factor":7.9646},{"match_name":"PRG 2017 Classifier Match","match_date":"2017-02-19","stage_classifiercode":"99-11","member_number":"FY93402","first_name":"GENG","last_name":"NIE","classification":"B","division":"OPEN","hit_factor":7.9618},{"match_name":"Richmond Hot Shots April 30-May 1st USPSA Pistol Match","match_date":"2016-04-30","stage_classifiercode":"99-11","member_number":"A84617","first_name":"MIKE","last_name":"FINEZA","classification":"C","division":"OPEN","hit_factor":7.9618},{"match_name":"2016-05-07 USPSA at Phoenix Rod and Gun Club","match_date":"2016-05-07","stage_classifiercode":"99-11","member_number":"A78028","first_name":"MARCELO","last_name":"MARIANO IV","classification":"B","division":"OPEN","hit_factor":7.9595},{"match_name":"BA USPSA Jun 17-2017","match_date":"2017-06-11","stage_classifiercode":"99-11","member_number":"L3887","first_name":"ADAM","last_name":"BIRKHIMER","classification":"B","division":"OPEN","hit_factor":7.9561},{"match_name":"MAPSA June Special Classifier","match_date":"2018-06-09","stage_classifiercode":"99-11","member_number":"A86183","first_name":"IAN","last_name":"JOHNSON","classification":"C","division":"OPEN","hit_factor":7.9545},{"match_name":"NCPS USPSA Handgun Match November 27 2016","match_date":"2016-11-27","stage_classifiercode":"99-11","member_number":"TY79640","first_name":"ELPIDIO (PETE)","last_name":"CORPUZ","classification":"B","division":"OPEN","hit_factor":7.9545},{"match_name":"LCHG May USPSA","match_date":"2017-05-21","stage_classifiercode":"99-11","member_number":"TY89426","first_name":"LARRY","last_name":"SCUSA","classification":"C","division":"OPEN","hit_factor":7.9545},{"match_name":"Heritage March 2021 USPSA","match_date":"2021-03-13","stage_classifiercode":"99-11","member_number":"Ty106160","first_name":"JOSH","last_name":"BREWER","classification":"B","division":"OPEN","hit_factor":7.9545},{"match_name":"CSA Coalfield Shooters Association USPSA March 2020","match_date":"2020-03-08","stage_classifiercode":"99-11","member_number":"TY88347","first_name":"MATT","last_name":"BOWEN","classification":"B","division":"OPEN","hit_factor":7.9511},{"match_name":"LdF USPSA Match May 12 2018","match_date":"2018-05-12","stage_classifiercode":"99-11","member_number":"TY17381","first_name":"JOHN","last_name":"HURST","classification":"M","division":"OPEN","hit_factor":7.9498},{"match_name":"LA05 Tangi USPSA 4th Sunday May 2021","match_date":"2021-05-23","stage_classifiercode":"99-11","member_number":"A93349","first_name":"JONATHAN","last_name":"PARKER","classification":"B","division":"OPEN","hit_factor":7.9498},{"match_name":"Shoot GTR USPSA MAY 24","match_date":"2016-05-24","stage_classifiercode":"99-11","member_number":"TY27735","first_name":"BOB","last_name":"MILLS","classification":"A","division":"OPEN","hit_factor":7.946},{"match_name":"CCPL 12102017","match_date":"2017-12-08","stage_classifiercode":"99-11","member_number":"A72602","first_name":"STEVE","last_name":"MURRAY","classification":"B","division":"OPEN","hit_factor":7.9408},{"match_name":"BA USPSA Sep  23/2017","match_date":"2017-09-23","stage_classifiercode":"99-11","member_number":"L1780","first_name":"BJ","last_name":"RATLIFF","classification":"A","division":"OPEN","hit_factor":7.9389},{"match_name":"Dundee Practical Shooters - Single Stack Challenge - Jan 23 2021","match_date":"2021-01-23","stage_classifiercode":"99-11","member_number":"A87752","first_name":"JOANNE","last_name":"TEGTMEYER","classification":"B","division":"OPEN","hit_factor":7.9389},{"match_name":"Hawkeye Gun Club July 2016 Match","match_date":"2016-07-16","stage_classifiercode":"99-11","member_number":"Ty90226","first_name":"JAMES","last_name":"TURNURE","classification":"M","division":"OPEN","hit_factor":7.9365},{"match_name":"SAGC CTX04 Monthly USPSA Match - November 2018","match_date":"2018-11-25","stage_classifiercode":"99-11","member_number":"TY74908","first_name":"KAREN","last_name":"CHIASSON","classification":"B","division":"OPEN","hit_factor":7.9365},{"match_name":"Applied IN25 USPSA December 2016","match_date":"2016-12-23","stage_classifiercode":"99-11","member_number":"A93257","first_name":"ALEX","last_name":"BAKKEN","classification":"U","division":"OPEN","hit_factor":7.932},{"match_name":"HTF Practical Shooters","match_date":"2018-07-01","stage_classifiercode":"99-11","member_number":"A106160","first_name":"JOSH","last_name":"BREWER","classification":"C","division":"OPEN","hit_factor":7.9295},{"match_name":"AIGR USPSA 8-4-17","match_date":"2017-08-04","stage_classifiercode":"99-11","member_number":"a101405","first_name":"CHANDRA","last_name":"DAM","classification":"U","division":"OPEN","hit_factor":7.9295},{"match_name":"MPSA 07182020 USPSA","match_date":"2020-07-18","stage_classifiercode":"99-11","member_number":"TY76693","first_name":"LEE","last_name":"FRAISER","classification":"B","division":"OPEN","hit_factor":7.9251},{"match_name":"Grandbaggers 07-05-2018","match_date":"2018-07-05","stage_classifiercode":"99-11","member_number":"FL3478","first_name":"FRANK","last_name":"KOCH","classification":"M","division":"OPEN","hit_factor":7.9245},{"match_name":"Danville Rifle and Pistol Club USPSA IL17 July 7 2018","match_date":"2018-07-07","stage_classifiercode":"99-11","member_number":"Ty76261","first_name":"DAN","last_name":"LONG","classification":"B","division":"OPEN","hit_factor":7.9223},{"match_name":"June 2018 CAS USPSA","match_date":"2018-06-03","stage_classifiercode":"99-11","member_number":"A92067","first_name":"DON","last_name":"ALBARES","classification":"C","division":"OPEN","hit_factor":7.9179},{"match_name":"Rio Salado UPPL September 2020","match_date":"2020-09-13","stage_classifiercode":"99-11","member_number":"TY18698","first_name":"MICHAEL","last_name":"DALE","classification":"M","division":"OPEN","hit_factor":7.9137},{"match_name":"WNPL - USPSA March Snowblind Blowout 2017","match_date":"2017-03-05","stage_classifiercode":"99-11","member_number":"TY75664","first_name":"GREG","last_name":"BLAIR","classification":"B","division":"OPEN","hit_factor":7.9063},{"match_name":"WNPL USPSA - REDEMPTION - NOVEMBER 2016","match_date":"2016-11-06","stage_classifiercode":"99-11","member_number":"A55939","first_name":"STEVE","last_name":"SCHUETTE","classification":"B","division":"OPEN","hit_factor":7.9027},{"match_name":"RSPP 3rd Saturday November 2016","match_date":"2016-11-19","stage_classifiercode":"99-11","member_number":"L1189","first_name":"JOHN","last_name":"LAMARCA","classification":"A","division":"OPEN","hit_factor":7.9023},{"match_name":"Rio Salado UPPL September 2020","match_date":"2020-09-13","stage_classifiercode":"99-11","member_number":"TY65635","first_name":"CHRIS","last_name":"COLLINS","classification":"B","division":"OPEN","hit_factor":7.9019},{"match_name":"Tangi May 2016 USPSA","match_date":"2016-05-29","stage_classifiercode":"99-11","member_number":"A92067","first_name":"DONALD","last_name":"ALBARES","classification":"C","division":"OPEN","hit_factor":7.8989},{"match_name":"17s PSC - Go Fast Donâ€™t Suck 2020 Spring Postal Match (USPSA)","match_date":"2020-05-16","stage_classifiercode":"99-11","member_number":"TY119739","first_name":"GARRETT","last_name":"PHILLIPS","classification":"U","division":"OPEN","hit_factor":7.8987},{"match_name":"West Coast IPSC","match_date":"2018-07-22","stage_classifiercode":"99-11","member_number":"TY57887","first_name":"BRETT","last_name":"HEITMANN","classification":"B","division":"OPEN","hit_factor":7.8947},{"match_name":"Prescott 1st Saturday 8-05-17","match_date":"2017-08-05","stage_classifiercode":"99-11","member_number":"A88480","first_name":"DANIEL","last_name":"LINDEGREN","classification":"M","division":"OPEN","hit_factor":7.8899},{"match_name":"LIPSA  December 11th 2016 - USPSA Match","match_date":"2016-12-11","stage_classifiercode":"99-11","member_number":"L2286","first_name":"RONNIEO","last_name":"JOW","classification":"A","division":"OPEN","hit_factor":7.8869},{"match_name":"SFPC Aug 8 2021 USPSA Classifier match","match_date":"2021-08-08","stage_classifiercode":"99-11","member_number":"A83243","first_name":"GIL","last_name":"ELNATAN","classification":"B","division":"OPEN","hit_factor":7.8869},{"match_name":"LdF USPSA Match January 25 2020","match_date":"2020-01-25","stage_classifiercode":"99-11","member_number":"TY43291","first_name":"WILLIAM","last_name":"JEHL","classification":"B","division":"OPEN","hit_factor":7.8844},{"match_name":"2017 Bay bridge Charity Classic - Richmond October 14-15-2017","match_date":"2017-10-14","stage_classifiercode":"99-11","member_number":"TY32422","first_name":"MARK R","last_name":"VANZEVERN","classification":"B","division":"OPEN","hit_factor":7.8832},{"match_name":"Pitcairn-Monroeville Sportsmens Club USPSA August 2017","match_date":"2017-08-05","stage_classifiercode":"99-11","member_number":"A62841","first_name":"THOMAS","last_name":"MCDEVITT","classification":"A","division":"OPEN","hit_factor":7.8797},{"match_name":"Shoot Gtr USPSA 10/18","match_date":"2016-10-18","stage_classifiercode":"99-11","member_number":"TY53290","first_name":"KENT","last_name":"CORI","classification":"B","division":"OPEN","hit_factor":7.8797},{"match_name":"Richmond Hot Shots April 14-15-2018 USPSA Pistol Match","match_date":"2018-04-14","stage_classifiercode":"99-11","member_number":"TY79621","first_name":"STEPHEN","last_name":"COLLEN","classification":"A","division":"OPEN","hit_factor":7.8762},{"match_name":"FBURG March Level I USPSA","match_date":"2016-03-06","stage_classifiercode":"99-11","member_number":"TY77564","first_name":"KEVIN","last_name":"MCPHEE","classification":"B","division":"OPEN","hit_factor":7.8762},{"match_name":"Augusta USPSA 10-14-18","match_date":"2018-10-14","stage_classifiercode":"99-11","member_number":"TY54308","first_name":"GLEN","last_name":"BICKING","classification":"B","division":"OPEN","hit_factor":7.8752},{"match_name":"2017 Bay bridge Charity Classic - Richmond October 14-15-2017","match_date":"2017-10-14","stage_classifiercode":"99-11","member_number":"A51918","first_name":"TIM","last_name":"BOFMAN","classification":"A","division":"OPEN","hit_factor":7.874},{"match_name":"IN19 ACC USPSA September 23","match_date":"2018-09-23","stage_classifiercode":"99-11","member_number":"A99001","first_name":"MATT","last_name":"SPANNAN","classification":"B","division":"OPEN","hit_factor":7.8695},{"match_name":"NCPS USPSA Handgun Match November 27 2016","match_date":"2016-11-27","stage_classifiercode":"99-11","member_number":"TY64320","first_name":"ROBERT","last_name":"SHARP","classification":"B","division":"OPEN","hit_factor":7.8684},{"match_name":"2017 Bay bridge Charity Classic - Richmond October 14-15-2017","match_date":"2017-10-14","stage_classifiercode":"99-11","member_number":"A33147","first_name":"VINCENT","last_name":"DIONISIO","classification":"B","division":"OPEN","hit_factor":7.8684},{"match_name":"Pelham USPSA 2016-09-18","match_date":"2016-09-18","stage_classifiercode":"99-11","member_number":"TY82118","first_name":"PETER","last_name":"GILBERT","classification":"B","division":"OPEN","hit_factor":7.8669},{"match_name":"CSS February 2016","match_date":"2016-02-12","stage_classifiercode":"99-11","member_number":"TY69922","first_name":"DALE","last_name":"CRAIG","classification":"B","division":"OPEN","hit_factor":7.8652},{"match_name":"Ontelaunee USPSA July 2016","match_date":"2016-07-23","stage_classifiercode":"99-11","member_number":"TY90280","first_name":"ANTHONY","last_name":"BRUNO","classification":"B","division":"OPEN","hit_factor":7.8616},{"match_name":"Richmond Hot Shots October 6-7 USPSA Pistol Match","match_date":"2018-10-06","stage_classifiercode":"99-11","member_number":"A75591","first_name":"JONATHAN","last_name":"JUNG","classification":"B","division":"OPEN","hit_factor":7.8616},{"match_name":"Dundee Practical Shooters - Single Stack Challenge - Jan 23 2021","match_date":"2021-01-23","stage_classifiercode":"99-11","member_number":"L4718","first_name":"LYNSEY","last_name":"PESTES","classification":"B","division":"OPEN","hit_factor":7.8582},{"match_name":"SRSC USPSA 8-29-20","match_date":"2020-08-29","stage_classifiercode":"99-11","member_number":"Ty72577","first_name":"RANDY","last_name":"BALLARD","classification":"B","division":"OPEN","hit_factor":7.8526},{"match_name":"WNPL USPSA - REDEMPTION - NOVEMBER 2016","match_date":"2016-11-06","stage_classifiercode":"99-11","member_number":"A47970","first_name":"DAVE","last_name":"ABELOE","classification":"A","division":"OPEN","hit_factor":7.8488},{"match_name":"2016-05-07 USPSA at Phoenix Rod and Gun Club","match_date":"2016-05-07","stage_classifiercode":"99-11","member_number":"TY65635","first_name":"CHRIS","last_name":"COLLINS","classification":"B","division":"OPEN","hit_factor":7.8462},{"match_name":"HPSP Heartland Practical Shooters June USPSA Shoot","match_date":"2018-06-24","stage_classifiercode":"99-11","member_number":"A81355","first_name":"MATT","last_name":"SEIDEL","classification":"Unclassified","division":"OPEN","hit_factor":7.8459},{"match_name":"Brothers N Arms December 2018 USPSA Match","match_date":"2018-12-15","stage_classifiercode":"99-11","member_number":"TY76693","first_name":"LEE","last_name":"FRAISER","classification":"B","division":"OPEN","hit_factor":7.8431},{"match_name":"Grandbaggers September 2018","match_date":"2018-09-06","stage_classifiercode":"99-11","member_number":"A34501","first_name":"RON","last_name":"FUCHS","classification":"B","division":"OPEN","hit_factor":7.8374},{"match_name":"Range54 USPSA","match_date":"2018-05-04","stage_classifiercode":"99-11","member_number":"A95101","first_name":"RYAN","last_name":"BURGARDT","classification":"C","division":"OPEN","hit_factor":7.837},{"match_name":"Dawg Valley USPSA Oct 13","match_date":"2018-10-13","stage_classifiercode":"99-11","member_number":"A96252","first_name":"STEVE","last_name":"FISCHER","classification":"B","division":"OPEN","hit_factor":7.837},{"match_name":"Ontelaunee USPSA July 2016","match_date":"2016-07-23","stage_classifiercode":"99-11","member_number":"A47067","first_name":"AL","last_name":"REALUYO","classification":"B","division":"OPEN","hit_factor":7.8365},{"match_name":"MPSA 021817","match_date":"2017-02-18","stage_classifiercode":"99-11","member_number":"TY82331","first_name":"DREW","last_name":"WALTERS","classification":"U","division":"OPEN","hit_factor":7.8341},{"match_name":"RISE INDOOR CLASSIFIER","match_date":"2018-12-15","stage_classifiercode":"99-11","member_number":"TY93363","first_name":"DEAN","last_name":"CHASSE","classification":"A","division":"OPEN","hit_factor":7.8261},{"match_name":"MAPSA 2016.04.09","match_date":"2016-04-09","stage_classifiercode":"99-11","member_number":"A91806","first_name":"JOSH","last_name":"FROELICH","classification":"U","division":"OPEN","hit_factor":7.8247},{"match_name":"MPPL 08052018 Summer Fun","match_date":"2018-08-05","stage_classifiercode":"99-11","member_number":"A91672","first_name":"FRED","last_name":"TAMAYO","classification":"C","division":"OPEN","hit_factor":7.8236},{"match_name":"Shoot GTR USPSA MAY 24","match_date":"2016-05-24","stage_classifiercode":"99-11","member_number":"TY34497","first_name":"PATRICK","last_name":"GAUVIN","classification":"A","division":"OPEN","hit_factor":7.8236},{"match_name":"ISPS 6/19/2016 USPSA","match_date":"2016-06-19","stage_classifiercode":"99-11","member_number":"a85172","first_name":"MIKE","last_name":"O'LEARY","classification":"M","division":"OPEN","hit_factor":7.8212},{"match_name":"Extreme GM USPSA  November","match_date":"2020-11-27","stage_classifiercode":"99-11","member_number":"A86123","first_name":"DARREN","last_name":"GORDON","classification":"B","division":"OPEN","hit_factor":7.8203},{"match_name":"USPSA Strategic Edge SEGR August 21st 2021","match_date":"2021-08-21","stage_classifiercode":"99-11","member_number":"Fy57702","first_name":"REY","last_name":"FODRA","classification":"B","division":"OPEN","hit_factor":7.8195},{"match_name":"March 2018 USPSA Classifier Special","match_date":"2018-03-17","stage_classifiercode":"99-11","member_number":"f35840","first_name":"TOM","last_name":"YARDY","classification":"\"\"","division":"OPEN","hit_factor":7.8189},{"match_name":"Wvpps Nov. 2017","match_date":"2017-11-19","stage_classifiercode":"99-11","member_number":"A26597","first_name":"MAX","last_name":"BEDWELL","classification":"G","division":"OPEN","hit_factor":7.8171},{"match_name":"Brazosland Pistoleros USPSA - Sunday January 19th","match_date":"2020-01-19","stage_classifiercode":"99-11","member_number":"A118075","first_name":"SAM","last_name":"PRUETT","classification":"U","division":"OPEN","hit_factor":7.8167},{"match_name":"April 18 M160","match_date":"2021-04-18","stage_classifiercode":"99-11","member_number":"A111665","first_name":"CRAIG","last_name":"KILLEN(BD)","classification":"B","division":"OPEN","hit_factor":7.8167},{"match_name":"LA05 Tangi USPSA 4th Sunday May 2021","match_date":"2021-05-23","stage_classifiercode":"99-11","member_number":"A93997","first_name":"JIM","last_name":"RAMOIN","classification":"B","division":"OPEN","hit_factor":7.8167},{"match_name":"Monson March 2016","match_date":"2016-03-26","stage_classifiercode":"99-11","member_number":"\"\"","first_name":"PETER","last_name":"GILBERT","classification":"B","division":"OPEN","hit_factor":7.8125},{"match_name":"FAS Sunday Indoors USPSA Match","match_date":"2021-02-07","stage_classifiercode":"99-11","member_number":"A115534","first_name":"TONY","last_name":"GREENE","classification":"C","division":"OPEN","hit_factor":7.8125},{"match_name":"West Coast IPSC","match_date":"2018-07-22","stage_classifiercode":"99-11","member_number":"FY24813","first_name":"RALPH","last_name":"ARREDONDO","classification":"M","division":"OPEN","hit_factor":7.8125},{"match_name":"MSSA USPSA June  10 2017","match_date":"2017-06-10","stage_classifiercode":"99-11","member_number":"\"\"","first_name":"BILL","last_name":"ASHABRANNER","classification":"\"\"","division":"OPEN","hit_factor":7.8103},{"match_name":"MCPSL Pistol 3-10-18","match_date":"2018-03-10","stage_classifiercode":"99-11","member_number":"A89172","first_name":"CASSIE","last_name":"BEAHR","classification":"A","division":"OPEN","hit_factor":7.8095},{"match_name":"Richmond Hot Shots October 6-7 USPSA Pistol Match","match_date":"2018-10-06","stage_classifiercode":"99-11","member_number":"TY79640","first_name":"ELPIDIO","last_name":"CORPUZ","classification":"A","division":"OPEN","hit_factor":7.8082},{"match_name":"ORPCI 2018.03.31 USPSA Special","match_date":"2018-03-31","stage_classifiercode":"99-11","member_number":"A104224","first_name":"ANDREW","last_name":"TILFORD","classification":"B","division":"OPEN","hit_factor":7.804},{"match_name":"SLPSA July USPSA match","match_date":"2018-07-21","stage_classifiercode":"99-11","member_number":"A74550","first_name":"KIRBY","last_name":"LUNT","classification":"B","division":"OPEN","hit_factor":7.7994},{"match_name":"Brothers N Arms December 2018 USPSA Match","match_date":"2018-12-15","stage_classifiercode":"99-11","member_number":"A107778","first_name":"TIM","last_name":"PATTERSON","classification":"C","division":"OPEN","hit_factor":7.7961},{"match_name":"RBGC 2017-06-24","match_date":"2017-06-24","stage_classifiercode":"99-11","member_number":"FY73238","first_name":"RANDY","last_name":"GAMBLE","classification":"B","division":"OPEN","hit_factor":7.7886},{"match_name":"Portage-Summit Field And Stream - OH17 - 2015-09-19","match_date":"2015-09-19","stage_classifiercode":"99-11","member_number":"TY66305","first_name":"HERB","last_name":"SMITH","classification":"B","division":"OPEN","hit_factor":7.7886},{"match_name":"GoShoot Outdoor January 10th","match_date":"2021-01-10","stage_classifiercode":"99-11","member_number":"A121806","first_name":"PHILIP","last_name":"HUDOCK","classification":"B","division":"OPEN","hit_factor":7.7886},{"match_name":"Applied IN25 USPSA April Classifier 2018","match_date":"2018-04-17","stage_classifiercode":"99-11","member_number":"L4004","first_name":"AARON","last_name":"LORTON","classification":"A","division":"OPEN","hit_factor":7.7876},{"match_name":"TAP USPSA Pistol Match Aug 14 2016","match_date":"2016-08-14","stage_classifiercode":"99-11","member_number":"TY74322","first_name":"ANDRE","last_name":"TAUBE","classification":"A","division":"OPEN","hit_factor":7.7827},{"match_name":"RangeMasters 9-27-2018","match_date":"2018-09-27","stage_classifiercode":"99-11","member_number":"A94852","first_name":"RANDY","last_name":"GOODNEY","classification":"A","division":"OPEN","hit_factor":7.7827},{"match_name":"PPS USPSA Classifiers 2018-05-01","match_date":"2018-05-02","stage_classifiercode":"99-11","member_number":"TY29453","first_name":"JD","last_name":"SMITH","classification":"M","division":"OPEN","hit_factor":7.7796},{"match_name":"Blackstone Shooting Sports November 2016 USPSA Level 1","match_date":"2016-11-08","stage_classifiercode":"99-11","member_number":"A91357","first_name":"BEN","last_name":"LANGFORD","classification":"A","division":"OPEN","hit_factor":7.7778},{"match_name":"MPSA 042118 USPSA","match_date":"2018-04-21","stage_classifiercode":"99-11","member_number":"TY82660","first_name":"GERALD","last_name":"PATCH","classification":"C","division":"OPEN","hit_factor":7.7748},{"match_name":"RPS November 2018 USPSA Match","match_date":"2018-11-10","stage_classifiercode":"99-11","member_number":"L1613","first_name":"MIKE","last_name":"LOY","classification":"B","division":"OPEN","hit_factor":7.7684},{"match_name":"OFGC USPSA Match Feb 19th 2017","match_date":"2017-02-19","stage_classifiercode":"99-11","member_number":"TY34745","first_name":"KEITH","last_name":"HAMMOND","classification":"B","division":"OPEN","hit_factor":7.7684},{"match_name":"Payson Practical Pistol - Action Shooting - 2017 12 28","match_date":"2017-12-28","stage_classifiercode":"99-11","member_number":"TY61820","first_name":"MICHAEL","last_name":"MCCRITE","classification":"C","division":"OPEN","hit_factor":7.767},{"match_name":"SMPSA 2018-01 Pistol","match_date":"2018-01-14","stage_classifiercode":"99-11","member_number":"TY63532","first_name":"GEORGE","last_name":"HEMSTAD","classification":"M","division":"OPEN","hit_factor":7.7644},{"match_name":"CGGR July USPSA Match","match_date":"2018-07-21","stage_classifiercode":"99-11","member_number":"A104727","first_name":"KEVIN","last_name":"STICKLEY","classification":"M","division":"OPEN","hit_factor":7.7626},{"match_name":"Rankin FIeld USPSA","match_date":"2015-10-10","stage_classifiercode":"99-11","member_number":"A77900","first_name":"JONATHAN","last_name":"COLLADO","classification":"B","division":"OPEN","hit_factor":7.7626},{"match_name":"ORPCI 2018.03.31 USPSA Special","match_date":"2018-03-31","stage_classifiercode":"99-11","member_number":"A96280","first_name":"TY","last_name":"O'BRADOVICH","classification":"A","division":"OPEN","hit_factor":7.7617},{"match_name":"PSAC_20161022","match_date":"2016-10-22","stage_classifiercode":"99-11","member_number":"A71925","first_name":"LAUREN","last_name":"CANNON","classification":"\"\"","division":"OPEN","hit_factor":7.7599},{"match_name":"FAS Sunday Indoors USPSA","match_date":"2021-10-17","stage_classifiercode":"99-11","member_number":"A111317","first_name":"JUN","last_name":"CHANG","classification":"G","division":"OPEN","hit_factor":7.7586},{"match_name":"PRG 2017 Classifier Match","match_date":"2017-02-19","stage_classifiercode":"99-11","member_number":"A79771","first_name":"RANDALL","last_name":"NG","classification":"A","division":"OPEN","hit_factor":7.7544},{"match_name":"Klamath USPSA 06/05/16 JSPS OR09","match_date":"2016-06-05","stage_classifiercode":"99-11","member_number":"L2214","first_name":"LARRY","last_name":"WATSON","classification":"A","division":"OPEN","hit_factor":7.7519},{"match_name":"WPS USPSA Monthly Match April 2021","match_date":"2021-04-07","stage_classifiercode":"99-11","member_number":"TY11901","first_name":"DAVID","last_name":"LOPEZ","classification":"A","division":"OPEN","hit_factor":7.7496},{"match_name":"PAS 2018 Special Classifier","match_date":"2018-09-15","stage_classifiercode":"99-11","member_number":"a101808","first_name":"TYLER","last_name":"SPINKS","classification":"B","division":"OPEN","hit_factor":7.7475},{"match_name":"KSA USPSA  3 April 2021","match_date":"2021-04-03","stage_classifiercode":"99-11","member_number":"a101299","first_name":"BILL","last_name":"ROMIG","classification":"B","division":"OPEN","hit_factor":7.7437},{"match_name":"Pitcairn-Monroeville Sportsmens Club USPSA August 2017","match_date":"2017-08-05","stage_classifiercode":"99-11","member_number":"TY-90731","first_name":"MICHAEL","last_name":"FORD","classification":"B","division":"OPEN","hit_factor":7.7393},{"match_name":"West Coast IPSC","match_date":"2018-07-22","stage_classifiercode":"99-11","member_number":"L4112","first_name":"JAY","last_name":"HU","classification":"C","division":"OPEN","hit_factor":7.7381},{"match_name":"Pharr action shooters USPSA match at Coyote 02-20-16","match_date":"2016-02-20","stage_classifiercode":"99-11","member_number":"\"\"","first_name":"CARLOS","last_name":"ALDABA","classification":"U","division":"OPEN","hit_factor":7.7372},{"match_name":"PPPS 11-13-16","match_date":"2016-11-13","stage_classifiercode":"99-11","member_number":"A69978","first_name":"DOMINIC","last_name":"KOH","classification":"A","division":"OPEN","hit_factor":7.7358},{"match_name":"LCSA USPSA March Match","match_date":"2016-03-12","stage_classifiercode":"99-11","member_number":"TY-90731","first_name":"MICHAEL","last_name":"FORD","classification":"C","division":"OPEN","hit_factor":7.7348},{"match_name":"ISPS 6/19/2016 USPSA","match_date":"2016-06-19","stage_classifiercode":"99-11","member_number":"A71703","first_name":"DON","last_name":"MARTIN","classification":"B","division":"OPEN","hit_factor":7.7341},{"match_name":"April 18 M160","match_date":"2021-04-18","stage_classifiercode":"99-11","member_number":"A111665","first_name":"CRAIG","last_name":"KILLEN(BD)","classification":"B","division":"OPEN","hit_factor":7.7341},{"match_name":"AGC_20170903","match_date":"2017-09-03","stage_classifiercode":"99-11","member_number":"TY10704","first_name":"BOB","last_name":"HUGHES","classification":"M","division":"OPEN","hit_factor":7.7333},{"match_name":"CGGR July USPSA Match","match_date":"2018-07-21","stage_classifiercode":"99-11","member_number":"A63410","first_name":"EDDIE","last_name":"HUGHES","classification":"B","division":"OPEN","hit_factor":7.7287},{"match_name":"CFRPC April USPSA Match","match_date":"2018-04-15","stage_classifiercode":"99-11","member_number":"FY89495","first_name":"MIGUEL","last_name":"PLATINO","classification":"A","division":"OPEN","hit_factor":7.7266},{"match_name":"Sharp Practical Shooters November  USPSA - Indoor","match_date":"2021-11-28","stage_classifiercode":"99-11","member_number":"TY123772","first_name":"JOHN","last_name":"HEDLUND","classification":"A","division":"OPEN","hit_factor":7.7263},{"match_name":"November 2016 PCSI USPSA Monster Match","match_date":"2016-11-05","stage_classifiercode":"99-11","member_number":"TY79620","first_name":"DAVID","last_name":"BLAIR","classification":"B","division":"OPEN","hit_factor":7.7241},{"match_name":"LA05 Tangi June USPSA 2020","match_date":"2020-06-28","stage_classifiercode":"99-11","member_number":"A93997","first_name":"JIM","last_name":"RAMOIN","classification":"B","division":"OPEN","hit_factor":7.7241},{"match_name":"LdF USPSA Match May 12 2018","match_date":"2018-05-12","stage_classifiercode":"99-11","member_number":"TY99082","first_name":"LUKE","last_name":"WANG2","classification":"B","division":"OPEN","hit_factor":7.7241},{"match_name":"Crooked Creek Pistol League - June 2016","match_date":"2016-06-25","stage_classifiercode":"99-11","member_number":"A55013","first_name":"RICHARD","last_name":"GENNARO","classification":"B","division":"OPEN","hit_factor":7.7151},{"match_name":"SSS Pistol Match March 2017","match_date":"2017-03-12","stage_classifiercode":"99-11","member_number":"A98916","first_name":"DILON","last_name":"PRICE","classification":"B (B Class)","division":"OPEN","hit_factor":7.7147},{"match_name":"RSPP 3rd Saturday November 2016","match_date":"2016-11-19","stage_classifiercode":"99-11","member_number":"CL67","first_name":"ROGER","last_name":"FORCEVILL","classification":"M","division":"OPEN","hit_factor":7.7143},{"match_name":"DAPS USPSA at ETTS 7-8-17","match_date":"2017-07-08","stage_classifiercode":"99-11","member_number":"A57591","first_name":"NICK","last_name":"ANSELMO","classification":"C","division":"OPEN","hit_factor":7.7143},{"match_name":"FAS Tuesday Night Indoors Match","match_date":"2021-03-17","stage_classifiercode":"99-11","member_number":"TY87343","first_name":"KEITH","last_name":"BERRIAN","classification":"B","division":"OPEN","hit_factor":7.7143},{"match_name":"Brazosland Pistoleros August 20 2017","match_date":"2017-08-20","stage_classifiercode":"99-11","member_number":"A94852","first_name":"RANDY","last_name":"GOODNEY","classification":"A","division":"OPEN","hit_factor":7.7128},{"match_name":"Ontelaunee USPSA  July 2018","match_date":"2018-07-29","stage_classifiercode":"99-11","member_number":"A101299","first_name":"BILL","last_name":"ROMIG","classification":"B","division":"OPEN","hit_factor":7.7033},{"match_name":"Caja De Rio November 2017","match_date":"2017-11-18","stage_classifiercode":"99-11","member_number":"A96124","first_name":"JONATHON","last_name":"RICKARD","classification":"A","division":"OPEN","hit_factor":7.7029},{"match_name":"MSSA Uspsa Club Match","match_date":"2017-08-27","stage_classifiercode":"99-11","member_number":"A78858","first_name":"WILLIAM","last_name":"ASHABRANNER","classification":"B","division":"OPEN","hit_factor":7.7029},{"match_name":"Pathfinder July USPSA Match","match_date":"2016-07-17","stage_classifiercode":"99-11","member_number":"FY45777","first_name":"TED","last_name":"FIRNSTEIN","classification":"A","division":"OPEN","hit_factor":7.6923},{"match_name":"Brazosland Pistoleros USPSA - Sunday August 8th","match_date":"2021-08-08","stage_classifiercode":"99-11","member_number":"TY81983","first_name":"MATT","last_name":"HAWES","classification":"B","division":"OPEN","hit_factor":7.6923},{"match_name":"Richmond Hot Shots April 14-15-2018 USPSA Pistol Match","match_date":"2018-04-14","stage_classifiercode":"99-11","member_number":"FY69835","first_name":"JEREMY","last_name":"JAVIER","classification":"A","division":"OPEN","hit_factor":7.6923},{"match_name":"NCPS USPSA Handgun Match November 27 2016","match_date":"2016-11-27","stage_classifiercode":"99-11","member_number":"TY46152","first_name":"ALLEN","last_name":"LOWE","classification":"M","division":"OPEN","hit_factor":7.6923},{"match_name":"ORSA USPSA October 2017","match_date":"2017-10-21","stage_classifiercode":"99-11","member_number":"A100533","first_name":"CHRIS","last_name":"THOMAS","classification":"C","division":"OPEN","hit_factor":7.6923},{"match_name":"Baileys September 2016","match_date":"2016-09-04","stage_classifiercode":"99-11","member_number":"a33941","first_name":"JACK","last_name":"HERSHBENGER","classification":"A","division":"OPEN","hit_factor":7.6818},{"match_name":"PSAC_20161022","match_date":"2016-10-22","stage_classifiercode":"99-11","member_number":"A47982","first_name":"DON","last_name":"DOBYNS","classification":"\"\"","division":"OPEN","hit_factor":7.6814},{"match_name":"Chillicothe February 2021 USPSA Match","match_date":"2021-02-28","stage_classifiercode":"99-11","member_number":"A83660","first_name":"MATT","last_name":"LEE","classification":"B","division":"OPEN","hit_factor":7.6814},{"match_name":"HSC USPSA October 7th 2017","match_date":"2017-10-06","stage_classifiercode":"99-11","member_number":"Ty77032","first_name":"TYLER","last_name":"COKE","classification":"B","division":"OPEN","hit_factor":7.6812},{"match_name":"Pitcairn-Monroeville Sportsmens Club USPSA August 2017","match_date":"2017-08-05","stage_classifiercode":"99-11","member_number":"L3218","first_name":"ROB","last_name":"EGER","classification":"M","division":"OPEN","hit_factor":7.6807},{"match_name":"Rio Salado RSPP 3rd Saturday February 2020","match_date":"2020-02-15","stage_classifiercode":"99-11","member_number":"L4468","first_name":"RAYMOND","last_name":"ENG","classification":"A","division":"OPEN","hit_factor":7.6807},{"match_name":"Cactus USPSA ALL CLASSIFIER August 2020","match_date":"2020-08-02","stage_classifiercode":"99-11","member_number":"A99490","first_name":"BRYAN","last_name":"DE LA FUENTE","classification":"U","division":"OPEN","hit_factor":7.6795},{"match_name":"USPSA-Alberta 2018-01 Indoor Classifier 1","match_date":"2018-02-26","stage_classifiercode":"99-11","member_number":"TYF-94515","first_name":"MATT","last_name":"PORTH","classification":"B","division":"OPEN","hit_factor":7.6768},{"match_name":"PRG 2017 Classifier Match","match_date":"2017-02-19","stage_classifiercode":"99-11","member_number":"TY67966","first_name":"MIKE","last_name":"HOLLINGSWORTH","classification":"A","division":"OPEN","hit_factor":7.6716},{"match_name":"MS06 Team Magnolia June 2017 USPSA Match","match_date":"2017-06-04","stage_classifiercode":"99-11","member_number":"A52191","first_name":"SLOAN","last_name":"SANDERS","classification":"M","division":"OPEN","hit_factor":7.6709},{"match_name":"Springfield Tactical Shooters 04/05/2018","match_date":"2018-04-05","stage_classifiercode":"99-11","member_number":"A30365","first_name":"ED","last_name":"TRIBBLE","classification":"A","division":"OPEN","hit_factor":7.67},{"match_name":"APSC 4th Annual Holiday Hosefest USPSA Match 12-02-17","match_date":"2017-12-02","stage_classifiercode":"99-11","member_number":"A21254","first_name":"MARC","last_name":"JASCHKE","classification":"B","division":"OPEN","hit_factor":7.6607},{"match_name":"MVPSA USPSA 9-15-18","match_date":"2018-09-15","stage_classifiercode":"99-11","member_number":"TY89492","first_name":"JESSE","last_name":"CLAUSSE","classification":"M","division":"OPEN","hit_factor":7.6607},{"match_name":"Ontelaunee USPSA July 2016","match_date":"2016-07-23","stage_classifiercode":"99-11","member_number":"A30857","first_name":"GIANLUIGI","last_name":"VALERI","classification":"B","division":"OPEN","hit_factor":7.6607},{"match_name":"MS06 Team Magnolia June 2017 USPSA Match","match_date":"2017-06-04","stage_classifiercode":"99-11","member_number":"A80452","first_name":"ERNIE","last_name":"MATTINGLY","classification":"C","division":"OPEN","hit_factor":7.659},{"match_name":"ARPC USPSA Match 8-23-20","match_date":"2020-08-23","stage_classifiercode":"99-11","member_number":"A67446","first_name":"DANIEL","last_name":"SPRAUL","classification":"A","division":"OPEN","hit_factor":7.6577},{"match_name":"West Coast IPSC","match_date":"2018-07-22","stage_classifiercode":"99-11","member_number":"TY67188","first_name":"IVAN","last_name":"GARCIA","classification":"U","division":"OPEN","hit_factor":7.6563},{"match_name":"Shasta Shooters 2021 Nov","match_date":"2021-11-13","stage_classifiercode":"99-11","member_number":"A1234","first_name":"TODD","last_name":"HENDERSON","classification":"A","division":"OPEN","hit_factor":7.6503},{"match_name":"GTS Indoor USPSA February 27 2020","match_date":"2020-02-28","stage_classifiercode":"99-11","member_number":"A112531","first_name":"COLT","last_name":"GOLDE","classification":"U","division":"OPEN","hit_factor":7.6495},{"match_name":"Baps March Uspsa","match_date":"2016-03-19","stage_classifiercode":"99-11","member_number":"TY26527","first_name":"DAVE","last_name":"CAMPBELL","classification":"M","division":"OPEN","hit_factor":7.6487},{"match_name":"Richmond Hot Shots October 6-7 USPSA Pistol Match","match_date":"2018-10-06","stage_classifiercode":"99-11","member_number":"L1620","first_name":"THOMAS","last_name":"CHAN","classification":"A","division":"OPEN","hit_factor":7.6471},{"match_name":"CJR&PC USPSA  June 10","match_date":"2018-06-10","stage_classifiercode":"99-11","member_number":"A93637","first_name":"MICHAEL","last_name":"COSENTINO","classification":"\"\"","division":"OPEN","hit_factor":7.6462},{"match_name":"NAAS 2018-01-21 Special Classifier Match","match_date":"2018-01-21","stage_classifiercode":"99-11","member_number":"A80807","first_name":"JON","last_name":"WASHER","classification":"B","division":"OPEN","hit_factor":7.6462},{"match_name":"Grandbaggers August 2017","match_date":"2017-08-03","stage_classifiercode":"99-11","member_number":"A90727","first_name":"DANYELA","last_name":"D'ANGELO","classification":"B","division":"OPEN","hit_factor":7.6453},{"match_name":"Lefthanders Gun Club Practical Shooters October","match_date":"2017-09-30","stage_classifiercode":"99-11","member_number":"FY59095","first_name":"SHELBY","last_name":"STOCKTON","classification":"U","division":"OPEN","hit_factor":7.6433},{"match_name":"WI21 June 24 2018 Points Match","match_date":"2018-06-06","stage_classifiercode":"99-11","member_number":"A68824","first_name":"KELSEY","last_name":"SCHAEFER","classification":"B","division":"OPEN","hit_factor":7.6423},{"match_name":"WELD ECO09 20180916","match_date":"2018-09-16","stage_classifiercode":"99-11","member_number":"L3589","first_name":"JACK","last_name":"PATTON","classification":"A","division":"OPEN","hit_factor":7.6423},{"match_name":"AGC_20151206","match_date":"2015-12-06","stage_classifiercode":"99-11","member_number":"TY10704","first_name":"BOB","last_name":"HUGHES","classification":"M","division":"OPEN","hit_factor":7.6369},{"match_name":"Pardoe Sportsmens Association- USPSA Saturday 4-3-21","match_date":"2021-04-03","stage_classifiercode":"99-11","member_number":"FY39111","first_name":"OLIE","last_name":"ERICKSEN","classification":"U","division":"OPEN","hit_factor":7.6324},{"match_name":"10-04-2015 USPSA","match_date":"2015-10-02","stage_classifiercode":"99-11","member_number":"TY43238","first_name":"RICHARD","last_name":"KONNERTH","classification":"C","division":"OPEN","hit_factor":7.6294},{"match_name":"SLPSA August USPSA Match 2","match_date":"2020-08-15","stage_classifiercode":"99-11","member_number":"TY76832","first_name":"JAKE","last_name":"BROWN","classification":"B","division":"OPEN","hit_factor":7.6283},{"match_name":"April 18 M160","match_date":"2021-04-18","stage_classifiercode":"99-11","member_number":"A115790","first_name":"CHRISTINE","last_name":"KILLEN (LM)","classification":"C","division":"OPEN","hit_factor":7.6246},{"match_name":"PTPC April 2nd USPSA Match","match_date":"2017-04-02","stage_classifiercode":"99-11","member_number":"A55556","first_name":"RON","last_name":"EVANS","classification":"B","division":"OPEN","hit_factor":7.6208},{"match_name":"Hopkinton USPSA October 2018","match_date":"2018-10-06","stage_classifiercode":"99-11","member_number":"TY79508","first_name":"SHANE","last_name":"FUNGAFAT","classification":"B","division":"OPEN","hit_factor":7.6203},{"match_name":"DTR USPSA Jan 20","match_date":"2020-01-11","stage_classifiercode":"99-11","member_number":"Ty64204","first_name":"BLAKE","last_name":"LILES","classification":"G","division":"OPEN","hit_factor":7.6172},{"match_name":"APSC USPSA 10-06-18","match_date":"2018-10-06","stage_classifiercode":"99-11","member_number":"\"\"","first_name":"WADE","last_name":"WHETSTONE","classification":"G","division":"OPEN","hit_factor":7.6132},{"match_name":"COPS 2015 Missouri Fall Classic","match_date":"2015-10-03","stage_classifiercode":"99-11","member_number":"A60217","first_name":"GARY","last_name":"SANDERS","classification":"B","division":"OPEN","hit_factor":7.6101},{"match_name":"WELD ECO09 20180916","match_date":"2018-09-16","stage_classifiercode":"99-11","member_number":"TY10704","first_name":"BOB","last_name":"HUGHES","classification":"M","division":"OPEN","hit_factor":7.6},{"match_name":"Coyote USPSA match 4-21-18","match_date":"2018-04-21","stage_classifiercode":"99-11","member_number":"A99994","first_name":"DUSTIN","last_name":"DUHAMEL","classification":"U","division":"OPEN","hit_factor":7.5984},{"match_name":"Bossier Parish Practical Shooters August 16 2020","match_date":"2020-08-16","stage_classifiercode":"99-11","member_number":"A81881","first_name":"BARBARA","last_name":"WATTS","classification":"C","division":"OPEN","hit_factor":7.5967},{"match_name":"MPSA 070718 USPSA","match_date":"2018-07-07","stage_classifiercode":"99-11","member_number":"TY99308","first_name":"GEORGE","last_name":"MILLER","classification":"B","division":"OPEN","hit_factor":7.5881},{"match_name":"Lin's","match_date":"2017-07-15","stage_classifiercode":"99-11","member_number":"\"\"","first_name":"GREG","last_name":"GREENE","classification":"\"\"","division":"OPEN","hit_factor":7.5862},{"match_name":"PSAC 20171028","match_date":"2017-10-28","stage_classifiercode":"99-11","member_number":"A71925","first_name":"LAUREN","last_name":"HORNER","classification":"U","division":"OPEN","hit_factor":7.5862},{"match_name":"West Coast IPSC","match_date":"2018-07-22","stage_classifiercode":"99-11","member_number":"A106671","first_name":"CHRIS","last_name":"ILLIANO","classification":"C","division":"OPEN","hit_factor":7.5862},{"match_name":"TPS USPSA at CMP March 18 2017","match_date":"2017-03-18","stage_classifiercode":"99-11","member_number":"TY88155","first_name":"TYLER","last_name":"GREEN","classification":"B","division":"OPEN","hit_factor":7.5823},{"match_name":"ORSA USPSA October 2017","match_date":"2017-10-21","stage_classifiercode":"99-11","member_number":"A73262","first_name":"KEVIN","last_name":"SUFFRIDGE","classification":"A","division":"OPEN","hit_factor":7.5823},{"match_name":"2016-05-07 USPSA at Phoenix Rod and Gun Club","match_date":"2016-05-07","stage_classifiercode":"99-11","member_number":"A80318","first_name":"JIM","last_name":"ADAME","classification":"M","division":"OPEN","hit_factor":7.5802},{"match_name":"Sharp Practical Shooters November  USPSA - Indoor","match_date":"2021-11-28","stage_classifiercode":"99-11","member_number":"TY105651","first_name":"DALE","last_name":"FORREST","classification":"C","division":"OPEN","hit_factor":7.5783},{"match_name":"Crooked Creek Pistol League - June 2016","match_date":"2016-06-25","stage_classifiercode":"99-11","member_number":"L3288","first_name":"GREGG","last_name":"SHAFER","classification":"B","division":"OPEN","hit_factor":7.578},{"match_name":"Augusta USPSA 10-14-18","match_date":"2018-10-14","stage_classifiercode":"99-11","member_number":"A108074","first_name":"TREVOR","last_name":"KNUTSON","classification":"B","division":"OPEN","hit_factor":7.5734},{"match_name":"Ontelaunee USPSA September 2015","match_date":"2015-09-27","stage_classifiercode":"99-11","member_number":"TY58697","first_name":"GARY","last_name":"PARSONS","classification":"B","division":"OPEN","hit_factor":7.571},{"match_name":"Granby Action Shooters Oct 2016","match_date":"2016-10-02","stage_classifiercode":"99-11","member_number":"TY63853","first_name":"DAVE","last_name":"GIARDIN","classification":"B","division":"OPEN","hit_factor":7.5676},{"match_name":"Shongum October 2017 Match","match_date":"2017-10-07","stage_classifiercode":"99-11","member_number":"L2421","first_name":"GEORGE","last_name":"JONES","classification":"A","division":"OPEN","hit_factor":7.5668},{"match_name":"Dundee Practical Shooters - Single Stack Challenge - Jan 23 2021","match_date":"2021-01-23","stage_classifiercode":"99-11","member_number":"L3253","first_name":"SCOTT","last_name":"LEROUX","classification":"A","division":"OPEN","hit_factor":7.5668},{"match_name":"TMGN December 21 Practical Shooter Match","match_date":"2017-12-22","stage_classifiercode":"99-11","member_number":"A101649","first_name":"PAUL","last_name":"WILLIAMS","classification":"\"\"","division":"OPEN","hit_factor":7.5668},{"match_name":"PPS USPSA Classifiers 2018-05-01","match_date":"2018-05-02","stage_classifiercode":"99-11","member_number":"A100931","first_name":"CALEB","last_name":"PATERSON","classification":"A","division":"OPEN","hit_factor":7.5646},{"match_name":"2017-10-07 USPSA at Phoenix Rod and Gun Club","match_date":"2017-10-07","stage_classifiercode":"99-11","member_number":"\"\"","first_name":"DAVID","last_name":"CARTER  JR.","classification":"U","division":"OPEN","hit_factor":7.5619},{"match_name":"Danville Rifle and Pistol Club USPSA IL17 July 7 2018","match_date":"2018-07-07","stage_classifiercode":"99-11","member_number":"A69428","first_name":"CARTER","last_name":"JONES","classification":"C","division":"OPEN","hit_factor":7.5597},{"match_name":"Rio Salado UPPL September 2020","match_date":"2020-09-13","stage_classifiercode":"99-11","member_number":"L1849","first_name":"PAUL","last_name":"THOMPSON","classification":"M","division":"OPEN","hit_factor":7.5581},{"match_name":"Ontelaunee USPSA July 2016","match_date":"2016-07-23","stage_classifiercode":"99-11","member_number":"A86775","first_name":"ALEXANDER","last_name":"REALUYO","classification":"C","division":"OPEN","hit_factor":7.5581},{"match_name":"MAPSA June Special Classifier","match_date":"2018-06-09","stage_classifiercode":"99-11","member_number":"L4436","first_name":"JON","last_name":"MCCARTY","classification":"B","division":"OPEN","hit_factor":7.5574},{"match_name":"Hopkinton USPSA July 2018","match_date":"2018-07-07","stage_classifiercode":"99-11","member_number":"L4262","first_name":"STEWART","last_name":"GINSBERG","classification":"B","division":"OPEN","hit_factor":7.5556},{"match_name":"MPSA 070718 USPSA","match_date":"2018-07-07","stage_classifiercode":"99-11","member_number":"A92317","first_name":"KYLE","last_name":"HUFF","classification":"C","division":"OPEN","hit_factor":7.5534},{"match_name":"Custer Feb USPSA","match_date":"2018-02-04","stage_classifiercode":"99-11","member_number":"A96141","first_name":"JAIMEE","last_name":"MENDOZA","classification":"A","division":"OPEN","hit_factor":7.5524},{"match_name":"SRSC USPSA 8-29-20","match_date":"2020-08-29","stage_classifiercode":"99-11","member_number":"TY87041","first_name":"DIRK","last_name":"DEIGHTON","classification":"C","division":"OPEN","hit_factor":7.5524},{"match_name":"BPSA January 2017 USPSA","match_date":"2017-01-22","stage_classifiercode":"99-11","member_number":"A98602","first_name":"NEIL","last_name":"DRENNAN","classification":"U","division":"OPEN","hit_factor":7.5501},{"match_name":"FBURG March Level I USPSA","match_date":"2016-03-06","stage_classifiercode":"99-11","member_number":"FY72075","first_name":"DAVID","last_name":"MCMORRIS","classification":"B","division":"OPEN","hit_factor":7.5472},{"match_name":"GoShoot Outdoor January 10th","match_date":"2021-01-10","stage_classifiercode":"99-11","member_number":"ty91756","first_name":"DAVID","last_name":"MARTON","classification":"A","division":"OPEN","hit_factor":7.5423},{"match_name":"MCAS March 2021 USPSA","match_date":"2021-03-28","stage_classifiercode":"99-11","member_number":"Ty12199","first_name":"NEAL","last_name":"HANSEN","classification":"A","division":"OPEN","hit_factor":7.5419},{"match_name":"Richmond Hot Shots April 30-May 1st USPSA Pistol Match","match_date":"2016-04-30","stage_classifiercode":"99-11","member_number":"a84616","first_name":"MJ","last_name":"FINEZA","classification":"A","division":"OPEN","hit_factor":7.5415},{"match_name":"NCPS USPSA Handgun Match June 24 2018","match_date":"2018-06-24","stage_classifiercode":"99-11","member_number":"TY68979","first_name":"GRIFFIN","last_name":"GUMAGAY","classification":"A","division":"OPEN","hit_factor":7.541},{"match_name":"PRPSA USPSA CHALLENGE PAN AMERICAN","match_date":"2021-07-11","stage_classifiercode":"99-11","member_number":"YUKI","first_name":"JULIANA","last_name":"RODRIGUEZ","classification":"","division":"OPEN","hit_factor":7.537},{"match_name":"TMGN April 5 USPSA Classifiers Match","match_date":"2018-04-05","stage_classifiercode":"99-11","member_number":"Ty99530","first_name":"CHRISTOPHER","last_name":"RICHTER","classification":"\"\"","division":"OPEN","hit_factor":7.5362},{"match_name":"AGC_20151206","match_date":"2015-12-06","stage_classifiercode":"99-11","member_number":"A71925","first_name":"LAUREN","last_name":"CANNON","classification":"B","division":"OPEN","hit_factor":7.5362},{"match_name":"TBAS USPSA Match 2/21/21","match_date":"2021-02-21","stage_classifiercode":"99-11","member_number":"A108997","first_name":"BRENT","last_name":"SMITH","classification":"","division":"OPEN","hit_factor":7.5362},{"match_name":"BUAS February Match","match_date":"2018-02-11","stage_classifiercode":"99-11","member_number":"ty49143","first_name":"THOMAS","last_name":"DAVIDSON","classification":"M","division":"OPEN","hit_factor":7.5342},{"match_name":"Ontelaunee USPSA July 2016","match_date":"2016-07-23","stage_classifiercode":"99-11","member_number":"TY22346","first_name":"BUCKY","last_name":"POLLARD","classification":"M","division":"OPEN","hit_factor":7.5301},{"match_name":"RangeMasters 9-27-2018","match_date":"2018-09-27","stage_classifiercode":"99-11","member_number":"A94853","first_name":"BOB","last_name":"ZWECK","classification":"B","division":"OPEN","hit_factor":7.5253},{"match_name":"ENPS December 2020 USPSA Match","match_date":"2020-12-06","stage_classifiercode":"99-11","member_number":"A110229","first_name":"ANDREW","last_name":"HIPWELL","classification":"C","division":"OPEN","hit_factor":7.5235},{"match_name":"APSC 4th Annual Holiday Hosefest USPSA Match 12-02-17","match_date":"2017-12-02","stage_classifiercode":"99-11","member_number":"\"\"","first_name":"HEATH","last_name":"FORBIS","classification":"U","division":"OPEN","hit_factor":7.5227},{"match_name":"USPSA - Bridgeville DE - lvl 1 Clone","match_date":"2018-07-01","stage_classifiercode":"99-11","member_number":"L3202","first_name":"RUSSELL","last_name":"FORTNEY","classification":"A","division":"OPEN","hit_factor":7.5163},{"match_name":"Deadwood Boys USPSA All Classifier Match - 29 July 2018","match_date":"2018-07-29","stage_classifiercode":"99-11","member_number":"A103847","first_name":"CHRIS","last_name":"CORCINO","classification":"U","division":"OPEN","hit_factor":7.5145},{"match_name":"Blackstone Shooting Sports Snow Days January 2017 USPSA Level  1","match_date":"2017-01-08","stage_classifiercode":"99-11","member_number":"A71008","first_name":"RYAN","last_name":"KIDD","classification":"A","division":"OPEN","hit_factor":7.511},{"match_name":"Brothers N Arms April 2016 USPSA Match (22Apr16-08:54:02)","match_date":"2016-04-23","stage_classifiercode":"99-11","member_number":"A92067","first_name":"DON","last_name":"ALBARES","classification":"D","division":"OPEN","hit_factor":7.5104},{"match_name":"Blackstone Shooting Sports November 2016 USPSA Level 1","match_date":"2016-11-08","stage_classifiercode":"99-11","member_number":"A98916","first_name":"DILON","last_name":"PRICE","classification":"U","division":"OPEN","hit_factor":7.5099},{"match_name":"West Coast IPSC","match_date":"2018-07-22","stage_classifiercode":"99-11","member_number":"L4121","first_name":"NAN","last_name":"WANG","classification":"B","division":"OPEN","hit_factor":7.5099},{"match_name":"ENPS December 2020 USPSA Match","match_date":"2020-12-06","stage_classifiercode":"99-11","member_number":"A101489","first_name":"TODD","last_name":"WOITZEL","classification":"B","division":"OPEN","hit_factor":7.5},{"match_name":"GPS.   August  2016 ","match_date":"2016-08-28","stage_classifiercode":"99-11","member_number":"\"\"","first_name":"OGIE","last_name":"DELAROSA","classification":"A","division":"OPEN","hit_factor":7.5},{"match_name":"Monson March 2016","match_date":"2016-03-26","stage_classifiercode":"99-11","member_number":"TY63853","first_name":"DAVID","last_name":"GIRARDIN","classification":"B","division":"OPEN","hit_factor":7.4967},{"match_name":"NPCCC 05-07-2017 USPSA","match_date":"2017-05-07","stage_classifiercode":"99-11","member_number":"TY51788","first_name":"JOHN","last_name":"ORNELAS","classification":"B","division":"OPEN","hit_factor":7.4928},{"match_name":"SLPSA July USPSA match","match_date":"2018-07-21","stage_classifiercode":"99-11","member_number":"TY53120","first_name":"BRANDON","last_name":"FARR","classification":"M","division":"OPEN","hit_factor":7.4924},{"match_name":"SCCCNOVEMBER2016","match_date":"2016-11-13","stage_classifiercode":"99-11","member_number":"a86403","first_name":"JUSTIN","last_name":"WILLIAMS","classification":"U","division":"OPEN","hit_factor":7.4896},{"match_name":"Pitcairn-Monroeville Sportsmens Club USPSA August 2017","match_date":"2017-08-05","stage_classifiercode":"99-11","member_number":"A80108","first_name":"KEN","last_name":"DITTIG","classification":"C","division":"OPEN","hit_factor":7.489},{"match_name":"SLOSA NOVEMBER 2017 USPSA MATCH","match_date":"2017-11-11","stage_classifiercode":"99-11","member_number":"A4449","first_name":"DANNY","last_name":"VILLAMIN","classification":"M","division":"OPEN","hit_factor":7.489},{"match_name":"Rio Salado Hosemasters February 2021","match_date":"2021-02-27","stage_classifiercode":"99-11","member_number":"FY63687","first_name":"DAN","last_name":"NEWTON","classification":"B","division":"OPEN","hit_factor":7.4883},{"match_name":"2016-05-07 USPSA at Phoenix Rod and Gun Club","match_date":"2016-05-07","stage_classifiercode":"99-11","member_number":"19103","first_name":"EARL","last_name":"BELISLE","classification":"U","division":"OPEN","hit_factor":7.4866},{"match_name":"ORPCI USPSA Saturday 2020.07.18","match_date":"2020-07-18","stage_classifiercode":"99-11","member_number":"FY48388","first_name":"SUE","last_name":"VANBLARICUM","classification":"B","division":"OPEN","hit_factor":7.4866},{"match_name":"CCAS June 2016","match_date":"2016-06-25","stage_classifiercode":"99-11","member_number":"TY21646","first_name":"JAMES","last_name":"JONES","classification":"B","division":"OPEN","hit_factor":7.483},{"match_name":"Shadow Hawk Defense USPSA Special Classifier","match_date":"2020-11-14","stage_classifiercode":"99-11","member_number":"FY15413","first_name":"TOM","last_name":"SUIT","classification":"M","division":"OPEN","hit_factor":7.482},{"match_name":"Richmond Hot Shots October 6-7 USPSA Pistol Match","match_date":"2018-10-06","stage_classifiercode":"99-11","member_number":"FY62950","first_name":"DARRELL","last_name":"INOUYE","classification":"M","division":"OPEN","hit_factor":7.4792},{"match_name":"Ontelaunee USPSA Hose Fest","match_date":"2021-01-02","stage_classifiercode":"99-11","member_number":"L4593","first_name":"ADAM","last_name":"MCINNIS","classification":"B","division":"OPEN","hit_factor":7.4778},{"match_name":"MSSA Uspsa Match 1/3/16","match_date":"2016-01-03","stage_classifiercode":"99-11","member_number":"A17417","first_name":"BILL","last_name":"GREWE","classification":"B","division":"OPEN","hit_factor":7.4713},{"match_name":"ORPCI 2018.03.31 USPSA Special","match_date":"2018-03-31","stage_classifiercode":"99-11","member_number":"Ty35534","first_name":"DUNDEE","last_name":"UY","classification":"A","division":"OPEN","hit_factor":7.4713},{"match_name":"Springfield Tactical Shooters 05/06/2021","match_date":"2021-05-06","stage_classifiercode":"99-11","member_number":"FY95946","first_name":"PAUL","last_name":"EMERY","classification":"B","division":"OPEN","hit_factor":7.4689},{"match_name":"West Coast IPSC","match_date":"2018-07-22","stage_classifiercode":"99-11","member_number":"L3958","first_name":"LEI","last_name":"XU","classification":"B","division":"OPEN","hit_factor":7.4671},{"match_name":"Cactus USPSA ALL CLASSIFIER August 2020","match_date":"2020-08-02","stage_classifiercode":"99-11","member_number":"A111232","first_name":"NICCO","last_name":"PUNZALAN","classification":"B","division":"OPEN","hit_factor":7.4656},{"match_name":"DAPS USPSA at ETTS 7-8-17","match_date":"2017-07-08","stage_classifiercode":"99-11","member_number":"A12924","first_name":"CHRIS","last_name":"DAVIES","classification":"A","division":"OPEN","hit_factor":7.465},{"match_name":"HTF Practical Shooters","match_date":"2017-09-24","stage_classifiercode":"99-11","member_number":"A100328","first_name":"JOSH","last_name":"TAYLOR","classification":"B","division":"OPEN","hit_factor":7.4627},{"match_name":"Brothers N Arms September 2017 USPSA Match","match_date":"2017-09-16","stage_classifiercode":"99-11","member_number":"A66934","first_name":"ELIZABETH","last_name":"YOUNG","classification":"C","division":"OPEN","hit_factor":7.4607},{"match_name":"MS06 Team Magnolia February 2018 USPSA Match","match_date":"2018-02-03","stage_classifiercode":"99-11","member_number":"L3707","first_name":"WOODY","last_name":"LANDRY","classification":"B","division":"OPEN","hit_factor":7.4567},{"match_name":"LGCSEMPS April 2018 Special Classifier","match_date":"2018-04-08","stage_classifiercode":"99-11","member_number":"TY 80894","first_name":"VINCE","last_name":"PALAZZOLO","classification":"C","division":"OPEN","hit_factor":7.4567},{"match_name":"Denali Practical Pistol October","match_date":"2016-10-08","stage_classifiercode":"99-11","member_number":"L3808","first_name":"MARK","last_name":"BROWN","classification":"B","division":"OPEN","hit_factor":7.4561},{"match_name":"TAP USPSA Pistol Match Aug 14 2016","match_date":"2016-08-14","stage_classifiercode":"99-11","member_number":"TY88651","first_name":"ULYSSES","last_name":"VILLANUEVA","classification":"C","division":"OPEN","hit_factor":7.4561},{"match_name":"TMGN December 21 Practical Shooter Match","match_date":"2017-12-22","stage_classifiercode":"99-11","member_number":"A88350","first_name":"DAVID","last_name":"WAMPLER","classification":"\"\"","division":"OPEN","hit_factor":7.4561},{"match_name":"April 18 M160","match_date":"2021-04-18","stage_classifiercode":"99-11","member_number":"A115790","first_name":"CHRISTINE","last_name":"KILLEN (LM)","classification":"C","division":"OPEN","hit_factor":7.4516},{"match_name":"Richmond Hot Shots October 6-7 USPSA Pistol Match","match_date":"2018-10-06","stage_classifiercode":"99-11","member_number":"A38711","first_name":"KENNETH","last_name":"MELTON","classification":"B","division":"OPEN","hit_factor":7.4468},{"match_name":"MPPL 08052018 Summer Fun","match_date":"2018-08-05","stage_classifiercode":"99-11","member_number":"TY98598","first_name":"MARK","last_name":"PAZ","classification":"C","division":"OPEN","hit_factor":7.4453},{"match_name":"NCPS USPSA Handgun Match June 24 2018","match_date":"2018-06-24","stage_classifiercode":"99-11","member_number":"TY79640","first_name":"ELPIDIO","last_name":"CORPUZ","classification":"A","division":"OPEN","hit_factor":7.4438},{"match_name":"Ontelaunee USPSA  July 2018","match_date":"2018-07-29","stage_classifiercode":"99-11","member_number":"L2421","first_name":"GEORGE","last_name":"JONES","classification":"A","division":"OPEN","hit_factor":7.4425},{"match_name":"NCPS USPSA Handgun Match November 27 2016","match_date":"2016-11-27","stage_classifiercode":"99-11","member_number":"FY62950","first_name":"DARRELL","last_name":"INOUYE","classification":"B","division":"OPEN","hit_factor":7.4405},{"match_name":"MPPL 08052018 Summer Fun","match_date":"2018-08-05","stage_classifiercode":"99-11","member_number":"L4015","first_name":"ANGELO","last_name":"BARRANCO","classification":"B","division":"OPEN","hit_factor":7.4369},{"match_name":"Tangi May 2016 USPSA","match_date":"2016-05-29","stage_classifiercode":"99-11","member_number":"A65599","first_name":"GALE","last_name":"BUTLER","classification":"B","division":"OPEN","hit_factor":7.4355},{"match_name":"RBPS April Pistol","match_date":"2016-04-17","stage_classifiercode":"99-11","member_number":"A58687","first_name":"ROBERT","last_name":"HILFIKER","classification":"A","division":"OPEN","hit_factor":7.4349},{"match_name":"Swamp Eagles 2015-12","match_date":"2015-12-20","stage_classifiercode":"99-11","member_number":"\"\"","first_name":"ASHLEY","last_name":"YATES","classification":"U","division":"OPEN","hit_factor":7.4324},{"match_name":"COPS 2015 Missouri Fall Classic","match_date":"2015-10-03","stage_classifiercode":"99-11","member_number":"TY57362","first_name":"OWEN","last_name":"RAYSOR","classification":"B","division":"OPEN","hit_factor":7.4324},{"match_name":"Grandbaggers August 2017","match_date":"2017-08-03","stage_classifiercode":"99-11","member_number":"CL67","first_name":"ROGER","last_name":"F","classification":"M","division":"OPEN","hit_factor":7.4307},{"match_name":"Bgs Hudson Week 6","match_date":"2017-02-19","stage_classifiercode":"99-11","member_number":"TY73645","first_name":"JOE","last_name":"BENSON","classification":"U","division":"OPEN","hit_factor":7.4264},{"match_name":"Brothers N Arms December 2018 USPSA Match","match_date":"2018-12-15","stage_classifiercode":"99-11","member_number":"TY42086","first_name":"BILL","last_name":"JACKSON","classification":"B","division":"OPEN","hit_factor":7.423},{"match_name":"Hopkinton June  2016","match_date":"2016-06-04","stage_classifiercode":"99-11","member_number":"TY51270","first_name":"WILLIAM","last_name":"THALHEIMER","classification":"B","division":"OPEN","hit_factor":7.4199},{"match_name":"SKSC USPSA April 2018 Match","match_date":"2018-04-21","stage_classifiercode":"99-11","member_number":"A77983","first_name":"GARY","last_name":"ROLLENHAGEN","classification":"B","division":"OPEN","hit_factor":7.4172},{"match_name":"PTPC  February 7th USPSA Match","match_date":"2016-02-07","stage_classifiercode":"99-11","member_number":"A88900","first_name":"JAYSON","last_name":"GAMBOA","classification":"M","division":"OPEN","hit_factor":7.413},{"match_name":"SAPSC Weekly USPSA Classifier Match 20170221","match_date":"2017-02-22","stage_classifiercode":"99-11","member_number":"A93439","first_name":"CHRIS","last_name":"ELLIS","classification":"B","division":"OPEN","hit_factor":7.4128},{"match_name":"WSRC USPSA","match_date":"2016-10-22","stage_classifiercode":"99-11","member_number":"FY53427","first_name":"ANTHONY","last_name":"FRIEDRICH","classification":"B","division":"OPEN","hit_factor":7.4121},{"match_name":"November 2016 PCSI USPSA Monster Match","match_date":"2016-11-05","stage_classifiercode":"99-11","member_number":"A50721","first_name":"NIK","last_name":"REPASKY","classification":"B","division":"OPEN","hit_factor":7.4074},{"match_name":"Prescott 1 st Saturday 12-03-2016","match_date":"2016-12-03","stage_classifiercode":"99-11","member_number":"L3243","first_name":"PETE","last_name":"CONNAL","classification":"B","division":"OPEN","hit_factor":7.4074},{"match_name":"WNYPPL November 2016 Match","match_date":"2016-11-27","stage_classifiercode":"99-11","member_number":"A80418","first_name":"ALVA","last_name":"ENGLISH","classification":"B","division":"OPEN","hit_factor":7.4074},{"match_name":"MSSA Uspsa Match 1/3/16","match_date":"2016-01-03","stage_classifiercode":"99-11","member_number":"TY34082","first_name":"DOC","last_name":"AQUINO","classification":"A","division":"OPEN","hit_factor":7.4074},{"match_name":"North Mountain PS April","match_date":"2016-04-15","stage_classifiercode":"99-11","member_number":"TY77564","first_name":"KEVIN","last_name":"MCPHEE","classification":"B","division":"OPEN","hit_factor":7.4024},{"match_name":"CAPS USPSA June 2021","match_date":"2021-06-05","stage_classifiercode":"99-11","member_number":"L2188","first_name":"BRIAN","last_name":"ROYALTY","classification":"C","division":"OPEN","hit_factor":7.4022},{"match_name":"Steel City USPSA December 2 2017","match_date":"2017-12-02","stage_classifiercode":"99-11","member_number":"A106488","first_name":"GARRETT","last_name":"RABEL","classification":"U","division":"OPEN","hit_factor":7.402},{"match_name":"MAPSA June Special Classifier","match_date":"2018-06-09","stage_classifiercode":"99-11","member_number":"a90911","first_name":"LINCOLN","last_name":"JENSEN","classification":"U","division":"OPEN","hit_factor":7.3976},{"match_name":"AAPS AAFG Level 1 Match - May 5 2018","match_date":"2018-05-05","stage_classifiercode":"99-11","member_number":"TY43673","first_name":"DALE","last_name":"MOUNTAIN","classification":"U","division":"OPEN","hit_factor":7.3969},{"match_name":"Shasta Shooters April 2016","match_date":"2016-04-09","stage_classifiercode":"99-11","member_number":"\"\"","first_name":"TODD","last_name":"HENDERSON","classification":"X","division":"OPEN","hit_factor":7.3913},{"match_name":"FSA-USPSA-03-11-2018","match_date":"2018-03-11","stage_classifiercode":"99-11","member_number":"a97671","first_name":"MIKE","last_name":"EYGENDAAL","classification":"C","division":"OPEN","hit_factor":7.3913},{"match_name":"Collin County USPSA 04-25-2021","match_date":"2021-04-24","stage_classifiercode":"99-11","member_number":"A129293","first_name":"\"THY (\"\"TEE\"\")\"","last_name":"NGO","classification":"B","division":"OPEN","hit_factor":7.3913},{"match_name":"West Coast IPSC","match_date":"2018-07-22","stage_classifiercode":"99-11","member_number":"FY97525","first_name":"LIANG","last_name":"GUO","classification":"B","division":"OPEN","hit_factor":7.3913},{"match_name":"July 2016 H&H Match","match_date":"2016-07-24","stage_classifiercode":"99-11","member_number":"TY75344","first_name":"CARY","last_name":"ROWTON","classification":"B","division":"OPEN","hit_factor":7.3906},{"match_name":"CVSC  09-25-16","match_date":"2016-09-25","stage_classifiercode":"99-11","member_number":"A34139","first_name":"LEE","last_name":"ROWE","classification":"A","division":"OPEN","hit_factor":7.3885},{"match_name":"MCAS March 2021 USPSA","match_date":"2021-03-28","stage_classifiercode":"99-11","member_number":"A125844","first_name":"TAD","last_name":"FARMER","classification":"C","division":"OPEN","hit_factor":7.3879},{"match_name":"Richmond Hot Shots October 6-7 USPSA Pistol Match","match_date":"2018-10-06","stage_classifiercode":"99-11","member_number":"A33147","first_name":"VINCENT","last_name":"DIONISIO","classification":"B","division":"OPEN","hit_factor":7.3871},{"match_name":"NCPS USPSA Handgun Match November 27 2016","match_date":"2016-11-27","stage_classifiercode":"99-11","member_number":"A84617","first_name":"MIKE","last_name":"FINEZA","classification":"B","division":"OPEN","hit_factor":7.3836},{"match_name":"Dundee USPSA Feb 2016","match_date":"2016-02-27","stage_classifiercode":"99-11","member_number":"A38510","first_name":"ERIC","last_name":"FALKNER","classification":"B","division":"OPEN","hit_factor":7.3816},{"match_name":"Richmond Hot Shots January 17-2016 USPSA Pistol","match_date":"2016-01-17","stage_classifiercode":"99-11","member_number":"A85939","first_name":"NILO","last_name":"NUNEZ II","classification":"M","division":"OPEN","hit_factor":7.3795},{"match_name":"Freeport  Sept 5 2021","match_date":"2021-09-05","stage_classifiercode":"99-11","member_number":"A106098","first_name":"ALLEN","last_name":"BERG","classification":"C","division":"OPEN","hit_factor":7.3791},{"match_name":"NCPS USPSA Handgun Match June 24 2018","match_date":"2018-06-24","stage_classifiercode":"99-11","member_number":"A80595","first_name":"EDGAR","last_name":"ALLAS","classification":"C","division":"OPEN","hit_factor":7.3791},{"match_name":"Prescott Action Shooters 1st Saturday USPSA 6-2-2018 ","match_date":"2018-06-03","stage_classifiercode":"99-11","member_number":"TY18698","first_name":"MICHAEL","last_name":"DALE","classification":"M","division":"OPEN","hit_factor":7.377},{"match_name":"Campeonato USPSA 2020","match_date":"2020-05-30","stage_classifiercode":"99-11","member_number":"TY91054","first_name":"WILBERTO","last_name":"ALAMO","classification":"B","division":"OPEN","hit_factor":7.377},{"match_name":"SSS USPSA February 2020","match_date":"2020-02-16","stage_classifiercode":"99-11","member_number":"TY98542","first_name":"BARRON","last_name":"SMITH","classification":"C (C Class)","division":"OPEN","hit_factor":7.3759},{"match_name":"PTPC  February 7th USPSA Match","match_date":"2016-02-07","stage_classifiercode":"99-11","member_number":"A71862","first_name":"JOE","last_name":"SINYAKOVICH","classification":"B","division":"OPEN","hit_factor":7.3746},{"match_name":"CCC Shooting Complex October 2016","match_date":"2016-10-02","stage_classifiercode":"99-11","member_number":"TY75597","first_name":"JANICE","last_name":"PACLEB","classification":"B","division":"OPEN","hit_factor":7.3739},{"match_name":"Hallstead USPSA  July Match","match_date":"2020-07-25","stage_classifiercode":"99-11","member_number":"ty82014","first_name":"TONY","last_name":"SPINILLO","classification":"A","division":"OPEN","hit_factor":7.3724},{"match_name":"ORPCI 2017 June USPSA Classifer Match","match_date":"2017-06-25","stage_classifiercode":"99-11","member_number":"\"\"","first_name":"STACY","last_name":"SIMON","classification":"X","division":"OPEN","hit_factor":7.3698},{"match_name":"LPRGC - Lower Providence USPSA Match November 2021","match_date":"2021-11-06","stage_classifiercode":"99-11","member_number":"TY109049","first_name":"SIFEI","last_name":"HAN","classification":"U","division":"OPEN","hit_factor":7.3698},{"match_name":"BSPSC 2017 April Special Classifier","match_date":"2017-04-09","stage_classifiercode":"99-11","member_number":"TY77508","first_name":"LEE","last_name":"BERGMAN","classification":"C","division":"OPEN","hit_factor":7.367},{"match_name":"SCCCNOVEMBER2016","match_date":"2016-11-13","stage_classifiercode":"99-11","member_number":"a85354","first_name":"JAY","last_name":"GRAHAM","classification":"B","division":"OPEN","hit_factor":7.367},{"match_name":"Range 54 USPSA","match_date":"2017-03-10","stage_classifiercode":"99-11","member_number":"A90580","first_name":"JASON","last_name":"SOUPENE","classification":"B","division":"OPEN","hit_factor":7.362},{"match_name":"Bigfork Gun Club October Match","match_date":"2016-10-01","stage_classifiercode":"99-11","member_number":"TY77891","first_name":"JEFF","last_name":"TUREK","classification":"C","division":"OPEN","hit_factor":7.362},{"match_name":"CRC/SVPS AUGUST  2018","match_date":"2018-08-17","stage_classifiercode":"99-11","member_number":"A68880","first_name":"JOSH","last_name":"WILGOCKI","classification":"U","division":"OPEN","hit_factor":7.355},{"match_name":"MCPSL Pistol 3-10-18","match_date":"2018-03-10","stage_classifiercode":"99-11","member_number":"TY78821","first_name":"STEVE","last_name":"GIRARD","classification":"C","division":"OPEN","hit_factor":7.3548},{"match_name":"ARPC USPSA Match Sept 27 2015","match_date":"2015-09-27","stage_classifiercode":"99-11","member_number":"L2177","first_name":"CHRIS","last_name":"THOMAS","classification":"A","division":"OPEN","hit_factor":7.3548},{"match_name":"Hopkinton USPSA May 2017","match_date":"2017-05-06","stage_classifiercode":"99-11","member_number":"A39028","first_name":"JOHN","last_name":"SARDINA","classification":"M","division":"OPEN","hit_factor":7.3529},{"match_name":"Rio Salado RSPP 3rd Saturday February 2020","match_date":"2020-02-15","stage_classifiercode":"99-11","member_number":"TY114245","first_name":"EUGENE","last_name":"OH","classification":"U","division":"OPEN","hit_factor":7.3529},{"match_name":"July 2016 H&H Match","match_date":"2016-07-24","stage_classifiercode":"99-11","member_number":"A74860","first_name":"CHUCK","last_name":"HYDE","classification":"D","division":"OPEN","hit_factor":7.3529},{"match_name":"Pitcairn-Monroeville Sportsmens Club USPSA August 2017","match_date":"2017-08-05","stage_classifiercode":"99-11","member_number":"fy83046","first_name":"THOMAS","last_name":"GILLECE","classification":"B","division":"OPEN","hit_factor":7.3507},{"match_name":"MPSA 081818 USPSA","match_date":"2018-08-18","stage_classifiercode":"99-11","member_number":"L4105","first_name":"GREG","last_name":"HAMMER","classification":"B","division":"OPEN","hit_factor":7.3438},{"match_name":"MPSA 021817","match_date":"2017-02-18","stage_classifiercode":"99-11","member_number":"TY82660","first_name":"GERALD","last_name":"PATCH","classification":"C","division":"OPEN","hit_factor":7.3431},{"match_name":"APSC 4th Annual Holiday Hosefest USPSA Match 12-02-17","match_date":"2017-12-02","stage_classifiercode":"99-11","member_number":"TY40176","first_name":"KEITH","last_name":"OLTMANN","classification":"B","division":"OPEN","hit_factor":7.3394},{"match_name":"HSC USPSA October 7th 2017","match_date":"2017-10-06","stage_classifiercode":"99-11","member_number":"a93980","first_name":"KEN","last_name":"LALIBERTE","classification":"C","division":"OPEN","hit_factor":7.3394},{"match_name":"Ontelaunee USPSA  July 2018","match_date":"2018-07-29","stage_classifiercode":"99-11","member_number":"L1158","first_name":"JIM","last_name":"HAND","classification":"M","division":"OPEN","hit_factor":7.3381},{"match_name":"Superior Practical Shooters May 2018 Match","match_date":"2018-05-02","stage_classifiercode":"99-11","member_number":"a-96673","first_name":"JACK","last_name":"STEPHENS II","classification":"C","division":"OPEN","hit_factor":7.3343},{"match_name":"LBAS160220","match_date":"2016-02-20","stage_classifiercode":"99-11","member_number":"A34448","first_name":"LARRY","last_name":"LEBEAU","classification":"A","division":"OPEN","hit_factor":7.3325},{"match_name":"MSSA Uspsa Match 1/3/16","match_date":"2016-01-03","stage_classifiercode":"99-11","member_number":"L1325","first_name":"MARC","last_name":"REINHARDT","classification":"M","division":"OPEN","hit_factor":7.3298},{"match_name":"HPS All-Classifier  Match","match_date":"2017-10-01","stage_classifiercode":"99-11","member_number":"TY26523","first_name":"STEVE","last_name":"RIBAO","classification":"B","division":"OPEN","hit_factor":7.3298},{"match_name":"Springfield Tactical Shooters 04/05/2018","match_date":"2018-04-05","stage_classifiercode":"99-11","member_number":"L3651","first_name":"RYAN","last_name":"BRADLEY","classification":"A","division":"OPEN","hit_factor":7.3282},{"match_name":"Deadwood Boys USPSA All Classifier Match","match_date":"2016-08-07","stage_classifiercode":"99-11","member_number":"Ty92176","first_name":"JAE","last_name":"AHN","classification":"B","division":"OPEN","hit_factor":7.3244},{"match_name":"WSPS JUNE 2018 USPSA MATCH","match_date":"2018-06-16","stage_classifiercode":"99-11","member_number":"A101299","first_name":"BILLY","last_name":"ROMIG","classification":"B","division":"OPEN","hit_factor":7.3236},{"match_name":"Rankin Field June Sunday USPSA","match_date":"2020-06-21","stage_classifiercode":"99-11","member_number":"TY109346","first_name":"MADDUX","last_name":"LE","classification":"B","division":"OPEN","hit_factor":7.3209},{"match_name":"VISSC Ray Will Have a Coke","match_date":"2020-09-27","stage_classifiercode":"99-11","member_number":"A113546","first_name":"JOHN","last_name":"BOWKER","classification":"B","division":"OPEN","hit_factor":7.3209},{"match_name":"Monson March 2016","match_date":"2016-03-26","stage_classifiercode":"99-11","member_number":"A44762","first_name":"MICHAEL D.","last_name":"PALUMBO","classification":"A","division":"OPEN","hit_factor":7.3204},{"match_name":"Trigger Guard USPSA","match_date":"2016-04-02","stage_classifiercode":"99-11","member_number":"a90580","first_name":"JASON","last_name":"SOUPENE","classification":"U","division":"OPEN","hit_factor":7.3204},{"match_name":"Prescott 1 st Saturday 12-03-2016","match_date":"2016-12-03","stage_classifiercode":"99-11","member_number":"A12460","first_name":"ED","last_name":"SERICH","classification":"A","division":"OPEN","hit_factor":7.3203},{"match_name":"RangeMasters 5-31-2018","match_date":"2018-05-31","stage_classifiercode":"99-11","member_number":"A94853","first_name":"BOB","last_name":"ZWECK","classification":"B","division":"OPEN","hit_factor":7.3171},{"match_name":"NW01 April da Turd","match_date":"2018-04-04","stage_classifiercode":"99-11","member_number":"TY47022","first_name":"BRUCE","last_name":"WOOD","classification":"A","division":"OPEN","hit_factor":7.3171},{"match_name":"Rio Salado RSPP 3rd Saturday February 2020","match_date":"2020-02-15","stage_classifiercode":"99-11","member_number":"FY95577","first_name":"MATT","last_name":"KITZMILLER","classification":"B","division":"OPEN","hit_factor":7.314},{"match_name":"RSCS USPSA  27 Mar 2016","match_date":"2016-03-27","stage_classifiercode":"99-11","member_number":"A-79569","first_name":"RUSS","last_name":"GOULD","classification":"U","division":"OPEN","hit_factor":7.3134},{"match_name":"Emmett July Match","match_date":"2017-07-21","stage_classifiercode":"99-11","member_number":"a94890","first_name":"CHRISTOPHER","last_name":"CLARK","classification":"B","division":"OPEN","hit_factor":7.3134},{"match_name":"Tidewater Practical Shooters February Match","match_date":"2020-02-17","stage_classifiercode":"99-11","member_number":"A95764","first_name":"DEAN","last_name":"L'HOSTE","classification":"C","division":"OPEN","hit_factor":7.311},{"match_name":"Emmett July Match","match_date":"2017-07-21","stage_classifiercode":"99-11","member_number":"a69178","first_name":"JASON","last_name":"PRICE","classification":"B","division":"OPEN","hit_factor":7.3103},{"match_name":"2016-02-06 USPSA at Phoenix Rod and Gun Club","match_date":"2016-02-06","stage_classifiercode":"99-11","member_number":"FY59131","first_name":"SCOTT","last_name":"KRUSHAK","classification":"B","division":"OPEN","hit_factor":7.3084},{"match_name":"FBURG March Level I USPSA","match_date":"2016-03-06","stage_classifiercode":"99-11","member_number":"ty34991","first_name":"ZACH","last_name":"TEICH","classification":"A","division":"OPEN","hit_factor":7.3072},{"match_name":"NTPS-SE November Classifier 2016","match_date":"2016-11-19","stage_classifiercode":"99-11","member_number":"TY82182","first_name":"NORMA","last_name":"LEGADOS","classification":"U","division":"OPEN","hit_factor":7.3072},{"match_name":"Rio Salado RSPP 3rd Saturday February 2020","match_date":"2020-02-15","stage_classifiercode":"99-11","member_number":"A89861","first_name":"LEON","last_name":"SMITH","classification":"B","division":"OPEN","hit_factor":7.3041},{"match_name":"MCAS March 2021 USPSA","match_date":"2021-03-28","stage_classifiercode":"99-11","member_number":"L3916","first_name":"TAMI","last_name":"WAITE","classification":"B","division":"OPEN","hit_factor":7.3003},{"match_name":"Richmond Hot Shots April 14-15-2018 USPSA Pistol Match","match_date":"2018-04-14","stage_classifiercode":"99-11","member_number":"A103940","first_name":"JOE","last_name":"SAMANIEGO","classification":"U","division":"OPEN","hit_factor":7.2948},{"match_name":"ORPCI USPSA Saturday 2020.07.18","match_date":"2020-07-18","stage_classifiercode":"99-11","member_number":"A125227","first_name":"MARK","last_name":"CARTER","classification":"C","division":"OPEN","hit_factor":7.2944},{"match_name":"Applied IN25 USPSA April Classifier 2018","match_date":"2018-04-17","stage_classifiercode":"99-11","member_number":"TY90126","first_name":"TOM","last_name":"BURZYNSKI","classification":"B","division":"OPEN","hit_factor":7.2944},{"match_name":"Range54 USPSA","match_date":"2018-06-08","stage_classifiercode":"99-11","member_number":"A20044","first_name":"JIM","last_name":"MYERS","classification":"U","division":"OPEN","hit_factor":7.293},{"match_name":"WGC Winsboro ","match_date":"2016-08-28","stage_classifiercode":"99-11","member_number":"A81881","first_name":"BARBARA","last_name":"WATTS","classification":"C","division":"OPEN","hit_factor":7.2904},{"match_name":"MCAS March 2021 USPSA","match_date":"2021-03-28","stage_classifiercode":"99-11","member_number":"Fy20463","first_name":"DENNIS","last_name":"BAUER","classification":"M","division":"OPEN","hit_factor":7.289},{"match_name":"CCPL 01102016 ALL CLASSIFIER MATCH","match_date":"2016-01-10","stage_classifiercode":"99-11","member_number":"A82654","first_name":"JIMMIE","last_name":"RABINA","classification":"U","division":"OPEN","hit_factor":7.2874},{"match_name":"LIPSA -  April 17th 2016 - USPSA Special Classifier Match","match_date":"2016-04-17","stage_classifiercode":"99-11","member_number":"TY82399","first_name":"JAMES","last_name":"BYRNE","classification":"U","division":"OPEN","hit_factor":7.2864},{"match_name":"PSAC_20161022","match_date":"2016-10-22","stage_classifiercode":"99-11","member_number":"A85442","first_name":"SPENCER","last_name":"STEIN","classification":"\"\"","division":"OPEN","hit_factor":7.2848},{"match_name":"Custer USPSA Mar 7th 2021","match_date":"2021-03-07","stage_classifiercode":"99-11","member_number":"FY107432","first_name":"REZNER","last_name":"ABUBAKAR","classification":"U","division":"OPEN","hit_factor":7.2848},{"match_name":"BUAS February Match","match_date":"2020-02-09","stage_classifiercode":"99-11","member_number":"A103354","first_name":"STEVEN","last_name":"CHAET","classification":"B","division":"OPEN","hit_factor":7.2838},{"match_name":"Lefthanders Gun Club Practical Shooters October","match_date":"2017-09-30","stage_classifiercode":"99-11","member_number":"TY72670","first_name":"DALE","last_name":"HARDING","classification":"B","division":"OPEN","hit_factor":7.2822},{"match_name":"SLPSA July USPSA match","match_date":"2018-07-21","stage_classifiercode":"99-11","member_number":"A14464","first_name":"CARTER","last_name":"REED","classification":"A","division":"OPEN","hit_factor":7.2808},{"match_name":"Brothers N Arms September 2017 USPSA Match","match_date":"2017-09-16","stage_classifiercode":"99-11","member_number":"TY42086","first_name":"BILL","last_name":"JACKSON","classification":"B","division":"OPEN","hit_factor":7.2808},{"match_name":"BHPC USPSA Monthly Match 7-8-18 IOWA","match_date":"2018-07-08","stage_classifiercode":"99-11","member_number":"A101705","first_name":"JOHN","last_name":"RIGGS","classification":"C","division":"OPEN","hit_factor":7.278},{"match_name":"ORPCI 2018.03.31 USPSA Special","match_date":"2018-03-31","stage_classifiercode":"99-11","member_number":"A85354","first_name":"JAY","last_name":"GRAHAM","classification":"B","division":"OPEN","hit_factor":7.2776},{"match_name":"Ontelaunee USPSA  July 2018","match_date":"2018-07-29","stage_classifiercode":"99-11","member_number":"A105042","first_name":"SHAUN","last_name":"TAYLOR","classification":"C","division":"OPEN","hit_factor":7.2751},{"match_name":"SAGC CTX04 Monthly USPSA Match - September 2020","match_date":"2020-09-27","stage_classifiercode":"99-11","member_number":"TY41061","first_name":"KIRBY","last_name":"DAHL","classification":"C","division":"OPEN","hit_factor":7.2727},{"match_name":"INAS May 2020 USPSA","match_date":"2020-05-09","stage_classifiercode":"99-11","member_number":"A84240","first_name":"MIKE","last_name":"KENNEDY","classification":"B","division":"OPEN","hit_factor":7.2727},{"match_name":"ORGC Tuesday Classifier CM 99-11 El Presidente","match_date":"2021-07-27","stage_classifiercode":"99-11","member_number":"L1189","first_name":"JOHN","last_name":"LAMARCA","classification":"A","division":"OPEN","hit_factor":7.2727},{"match_name":"Strongpoint August 2017 Match","match_date":"2017-08-05","stage_classifiercode":"99-11","member_number":"A44785","first_name":"BRAD","last_name":"BALSLEY","classification":"G","division":"OPEN","hit_factor":7.2727},{"match_name":"TAP USPSA Pistol Match Aug 14 2016","match_date":"2016-08-14","stage_classifiercode":"99-11","member_number":"A67589","first_name":"DEXTER","last_name":"LOPEZ","classification":"C","division":"OPEN","hit_factor":7.27},{"match_name":"Richmond Hot Shots April 30-May 1st USPSA Pistol Match","match_date":"2016-04-30","stage_classifiercode":"99-11","member_number":"A69205","first_name":"OZZIE","last_name":"FREGOSO","classification":"M","division":"OPEN","hit_factor":7.2695},{"match_name":"Crooked Creek Pistol League - June 2017","match_date":"2017-06-24","stage_classifiercode":"99-11","member_number":"L2450","first_name":"BUD","last_name":"CONNOLLY","classification":"B","division":"OPEN","hit_factor":7.267},{"match_name":"HOPS USPSA 072118","match_date":"2018-07-21","stage_classifiercode":"99-11","member_number":"A100931","first_name":"CALEB","last_name":"PATERSON","classification":"A","division":"OPEN","hit_factor":7.2664},{"match_name":"Granby Action Shooters Oct 2016","match_date":"2016-10-02","stage_classifiercode":"99-11","member_number":"FY8825","first_name":"JOHN","last_name":"HABERERN","classification":"M","division":"OPEN","hit_factor":7.2664},{"match_name":"GRB JAN USPSA  at Cav","match_date":"2017-01-21","stage_classifiercode":"99-11","member_number":"TY92299","first_name":"BOB","last_name":"ROSEBROUGH","classification":"A","division":"OPEN","hit_factor":7.2664},{"match_name":"DAPS USPSA at ETTS 7-8-17","match_date":"2017-07-08","stage_classifiercode":"99-11","member_number":"A65248","first_name":"JR","last_name":"ERASMUS","classification":"A","division":"OPEN","hit_factor":7.265},{"match_name":"2020-03 Bone Creek USPSA","match_date":"2020-03-01","stage_classifiercode":"99-11","member_number":"FY83466","first_name":"EMIL","last_name":"KASERMAN","classification":"C","division":"OPEN","hit_factor":7.2633},{"match_name":"VISSC Ray Will Have a Coke","match_date":"2020-09-27","stage_classifiercode":"99-11","member_number":"TY79257","first_name":"GARLOU","last_name":"VILLENA","classification":"C","division":"OPEN","hit_factor":7.2603},{"match_name":"WVPPS May 2021","match_date":"2021-05-16","stage_classifiercode":"99-11","member_number":"TY17278","first_name":"STEVE","last_name":"WRIGHT","classification":"B","division":"OPEN","hit_factor":7.2581},{"match_name":"MPPL 11042018 Hoser Heaven","match_date":"2018-11-04","stage_classifiercode":"99-11","member_number":"A113332","first_name":"MARIA","last_name":"DUMBRIQUE","classification":"U","division":"OPEN","hit_factor":7.2569},{"match_name":"LPRGC - Lower Providence USPSA Match November 2021","match_date":"2021-11-06","stage_classifiercode":"99-11","member_number":"TY16248","first_name":"BARRY","last_name":"RUANE","classification":"M","division":"OPEN","hit_factor":7.2566},{"match_name":"Rio Salado Hosemasters February 2021","match_date":"2021-02-27","stage_classifiercode":"99-11","member_number":"TY87041","first_name":"DIRK","last_name":"DEIGHTON","classification":"C","division":"OPEN","hit_factor":7.2546},{"match_name":"Pelham USPSA 2016-09-18","match_date":"2016-09-18","stage_classifiercode":"99-11","member_number":"L1876","first_name":"SIMEON","last_name":"GOUROUSIS","classification":"B","division":"OPEN","hit_factor":7.2539},{"match_name":"NW01 April da Turd","match_date":"2018-04-04","stage_classifiercode":"99-11","member_number":"\"\"","first_name":"DUSTIN","last_name":"TAWATAO","classification":"\"\"","division":"OPEN","hit_factor":7.2508},{"match_name":"Payson Practical Shooters - USPSA 2018 01 06","match_date":"2018-01-06","stage_classifiercode":"99-11","member_number":"TY92648","first_name":"E.T.","last_name":"SAFFON","classification":"M","division":"OPEN","hit_factor":7.2491},{"match_name":"SLPSA August USPSA Match 2","match_date":"2020-08-15","stage_classifiercode":"99-11","member_number":"TY78631","first_name":"KENNETH","last_name":"WRIGHT","classification":"C","division":"OPEN","hit_factor":7.2483},{"match_name":"RBGC 2017-06-24","match_date":"2017-06-24","stage_classifiercode":"99-11","member_number":"A94631","first_name":"TIM","last_name":"HADDEN","classification":"U","division":"OPEN","hit_factor":7.2483},{"match_name":"LdF USPSA Match May 12 2018","match_date":"2018-05-12","stage_classifiercode":"99-11","member_number":"TY94265","first_name":"STEVE","last_name":"BENCE","classification":"C","division":"OPEN","hit_factor":7.2483},{"match_name":"MS06 Team Magnolia February 2018 USPSA Match","match_date":"2018-02-03","stage_classifiercode":"99-11","member_number":"TY65599","first_name":"GALE","last_name":"BUTLER","classification":"B","division":"OPEN","hit_factor":7.2443},{"match_name":"COPS 2015 Missouri Fall Classic","match_date":"2015-10-03","stage_classifiercode":"99-11","member_number":"A61333","first_name":"TYLER","last_name":"WILSON","classification":"A","division":"OPEN","hit_factor":7.2423},{"match_name":"LIPSA  December 11th 2016 - USPSA Match","match_date":"2016-12-11","stage_classifiercode":"99-11","member_number":"L3924","first_name":"MANNY","last_name":"CAMEAN","classification":"C","division":"OPEN","hit_factor":7.2386},{"match_name":"MSSA Uspsa Match 1/3/16","match_date":"2016-01-03","stage_classifiercode":"99-11","member_number":"TY34082","first_name":"DOC","last_name":"AQUINO","classification":"A","division":"OPEN","hit_factor":7.2368},{"match_name":"DTR USPSA Jan 20","match_date":"2020-01-11","stage_classifiercode":"99-11","member_number":"TY36494","first_name":"ROBERT","last_name":"PORTER","classification":"B","division":"OPEN","hit_factor":7.2347},{"match_name":"Richmond Hot Shots April 30-May 1st USPSA Pistol Match","match_date":"2016-04-30","stage_classifiercode":"99-11","member_number":"A-83191","first_name":"MANUEL","last_name":"SARMIENTO","classification":"B","division":"OPEN","hit_factor":7.234},{"match_name":"Pinetucky A6 Classifier Match","match_date":"2016-03-30","stage_classifiercode":"99-11","member_number":"TY61426","first_name":"THOMAS","last_name":"NYLAND","classification":"none","division":"OPEN","hit_factor":7.2323},{"match_name":"VISSC Ray Will Have a Coke","match_date":"2020-09-27","stage_classifiercode":"99-11","member_number":"A79242","first_name":"DENVER","last_name":"VALDEZ","classification":"B","division":"OPEN","hit_factor":7.2323},{"match_name":"LdF USPSA Match May 12 2018","match_date":"2018-05-12","stage_classifiercode":"99-11","member_number":"TY43291","first_name":"WILLIAM","last_name":"JEHL","classification":"B","division":"OPEN","hit_factor":7.2273},{"match_name":"Pitcairn-Monroeville Sportsmens Club USPSA August 2017","match_date":"2017-08-05","stage_classifiercode":"99-11","member_number":"FY72047","first_name":"GREG","last_name":"ZOMBEK","classification":"B","division":"OPEN","hit_factor":7.2271},{"match_name":"ARPC USPSA Match 5-27-18","match_date":"2018-05-27","stage_classifiercode":"99-11","member_number":"TY49036","first_name":"STEVE","last_name":"CRIPPEN","classification":"A","division":"OPEN","hit_factor":7.2271},{"match_name":"April 18 M160","match_date":"2021-04-18","stage_classifiercode":"99-11","member_number":"A115790","first_name":"CHRISTINE","last_name":"KILLEN (LM)","classification":"C","division":"OPEN","hit_factor":7.2254},{"match_name":"Bayou City Weekly","match_date":"2015-10-01","stage_classifiercode":"99-11","member_number":"A14418","first_name":"RANDY","last_name":"CALLISON","classification":"B","division":"OPEN","hit_factor":7.218},{"match_name":"INAS May 2020 USPSA","match_date":"2020-05-09","stage_classifiercode":"99-11","member_number":"TY105651","first_name":"DALE","last_name":"FORREST","classification":"","division":"OPEN","hit_factor":7.215},{"match_name":"RBGC 2017-06-24","match_date":"2017-06-24","stage_classifiercode":"99-11","member_number":"A68960","first_name":"TYLER","last_name":"HUFF","classification":"A","division":"OPEN","hit_factor":7.2131},{"match_name":"Shongum November 2021 USPSA Match","match_date":"2021-11-06","stage_classifiercode":"99-11","member_number":"Ty110177","first_name":"DANIEL","last_name":"FELTYBERGER","classification":"B","division":"OPEN","hit_factor":7.2122},{"match_name":"BHPSC Special Classifier Match 03-25-16","match_date":"2016-03-25","stage_classifiercode":"99-11","member_number":"A90516","first_name":"JARED","last_name":"FOX","classification":"U","division":"OPEN","hit_factor":7.2122},{"match_name":"HPS March 2020 Club Fun Match","match_date":"2020-03-07","stage_classifiercode":"99-11","member_number":"FY88006","first_name":"BOBBY","last_name":"REGALARIO","classification":"C","division":"OPEN","hit_factor":7.2109},{"match_name":"LPRGC-Lower Providence USPSA May-1 2017","match_date":"2017-05-05","stage_classifiercode":"99-11","member_number":"TY82780","first_name":"JEANNE","last_name":"RUANE","classification":"C","division":"OPEN","hit_factor":7.2096},{"match_name":"2017 Bay bridge Charity Classic - Richmond October 14-15-2017","match_date":"2017-10-14","stage_classifiercode":"99-11","member_number":"L1620","first_name":"THOMAS","last_name":"CHAN","classification":"A","division":"OPEN","hit_factor":7.2084},{"match_name":"Pardoe Sportsmens Association-WPA14-2017-10-01","match_date":"2017-10-01","stage_classifiercode":"99-11","member_number":"FY39111","first_name":"OLIE","last_name":"ERICKSEN","classification":"B","division":"OPEN","hit_factor":7.2059},{"match_name":"FBURG USPSA November 2020","match_date":"2020-11-01","stage_classifiercode":"99-11","member_number":"L3535","first_name":"TAK 2GN","last_name":"ONG","classification":"B","division":"OPEN","hit_factor":7.2034},{"match_name":"Pardoe Sportsmens Association- USPSA Saturday 4-3-21","match_date":"2021-04-03","stage_classifiercode":"99-11","member_number":"L1063","first_name":"CHUCK","last_name":"BROOKS","classification":"A","division":"OPEN","hit_factor":7.1964},{"match_name":"Pitcairn-Monroeville Sportsmens Club USPSA August 2017","match_date":"2017-08-05","stage_classifiercode":"99-11","member_number":"FY83046","first_name":"THOMAS","last_name":"GILLECE","classification":"B","division":"OPEN","hit_factor":7.1964},{"match_name":"USPSA-Alberta 2018-01 Indoor Classifier 1","match_date":"2018-02-26","stage_classifiercode":"99-11","member_number":"FYF91822","first_name":"JEFF","last_name":"ORITA","classification":"C","division":"OPEN","hit_factor":7.1964},{"match_name":"LA05 Tangi USPSA 4th Sunday May 2021","match_date":"2021-05-23","stage_classifiercode":"99-11","member_number":"L2725","first_name":"CHARLES","last_name":"BLACK","classification":"M","division":"OPEN","hit_factor":7.1932},{"match_name":"Lefthanders Gun Club Practical Shooters October","match_date":"2017-09-30","stage_classifiercode":"99-11","member_number":"A69428","first_name":"CARTER","last_name":"JONES","classification":"C","division":"OPEN","hit_factor":7.1913},{"match_name":"BUAS February Match","match_date":"2018-02-11","stage_classifiercode":"99-11","member_number":"ty53502","first_name":"DAVID","last_name":"PARKER","classification":"M","division":"OPEN","hit_factor":7.1904},{"match_name":"ARPC USPSA Match 5-27-18","match_date":"2018-05-27","stage_classifiercode":"99-11","member_number":"A44819","first_name":"JIM","last_name":"KOETTING","classification":"B","division":"OPEN","hit_factor":7.1864},{"match_name":"Swamp Eagles 2015-12","match_date":"2015-12-20","stage_classifiercode":"99-11","member_number":"A90671","first_name":"COREY","last_name":"YATES","classification":"B","division":"OPEN","hit_factor":7.1845},{"match_name":"GoShoot Indoors","match_date":"2017-06-11","stage_classifiercode":"99-11","member_number":"TY99801","first_name":"GREG","last_name":"MANNY","classification":"U","division":"OPEN","hit_factor":7.1839},{"match_name":"Danville Rifle and Pistol Club USPSA IL17 July 7 2018","match_date":"2018-07-07","stage_classifiercode":"99-11","member_number":"TY91334","first_name":"BILL","last_name":"SIDELL","classification":"B","division":"OPEN","hit_factor":7.1831},{"match_name":"RCPS USPSA 14 Nov 2015","match_date":"2015-11-14","stage_classifiercode":"99-11","member_number":"A57557","first_name":"RALFIE","last_name":"CASTANEDA","classification":"A","division":"OPEN","hit_factor":7.1804},{"match_name":"WVRPC USPSA 1APR2017 CLASSIFIER","match_date":"2017-04-01","stage_classifiercode":"99-11","member_number":"TY85469","first_name":"MATTHEW","last_name":"WILKERSON","classification":"B","division":"OPEN","hit_factor":7.1756},{"match_name":"PTPC April 2nd USPSA Match","match_date":"2017-04-02","stage_classifiercode":"99-11","member_number":"A91934","first_name":"ALFRED","last_name":"LADORES","classification":"M","division":"OPEN","hit_factor":7.1749},{"match_name":"USPSA-Classifier","match_date":"2017-03-26","stage_classifiercode":"99-11","member_number":"A97588","first_name":"DAVID","last_name":"CAPELLA PASTRANA","classification":"C","division":"OPEN","hit_factor":7.1749},{"match_name":"April 18 M160","match_date":"2021-04-18","stage_classifiercode":"99-11","member_number":"A111665","first_name":"CRAIG","last_name":"KILLEN(BD)","classification":"B","division":"OPEN","hit_factor":7.1742},{"match_name":"Hose Monster Action ","match_date":"2020-07-19","stage_classifiercode":"99-11","member_number":"A61463","first_name":"DAVID","last_name":"HILLERMAN","classification":"B","division":"OPEN","hit_factor":7.1719},{"match_name":"Crooked Creek Pistol League - June 2017","match_date":"2017-06-24","stage_classifiercode":"99-11","member_number":"TY91700","first_name":"JEFF","last_name":"MORSE","classification":"B","division":"OPEN","hit_factor":7.1719},{"match_name":"Dundee USPSA Feb 2016","match_date":"2016-02-27","stage_classifiercode":"99-11","member_number":"A70998","first_name":"JAKE","last_name":"DYER","classification":"M","division":"OPEN","hit_factor":7.1705},{"match_name":"AGC_20151206","match_date":"2015-12-06","stage_classifiercode":"99-11","member_number":"A49558","first_name":"JOHN","last_name":"ARENAS","classification":"M","division":"OPEN","hit_factor":7.1698},{"match_name":"Bossier Parish Practical Shooters August 16 2020","match_date":"2020-08-16","stage_classifiercode":"99-11","member_number":"A121424","first_name":"JAMES","last_name":"YAWN","classification":"B","division":"OPEN","hit_factor":7.1685},{"match_name":"OFGC USPSA Match Feb 19th 2017","match_date":"2017-02-19","stage_classifiercode":"99-11","member_number":"TY72436","first_name":"ROBERT","last_name":"TERBIETEN","classification":"B","division":"OPEN","hit_factor":7.1633},{"match_name":"Custer Feb USPSA","match_date":"2018-02-04","stage_classifiercode":"99-11","member_number":"B60","first_name":"MARK","last_name":"MCCALLISTER","classification":"U","division":"OPEN","hit_factor":7.1629},{"match_name":"Portage-Summit Field And Stream - OH17 - 2015-09-19","match_date":"2015-09-19","stage_classifiercode":"99-11","member_number":"TY66305","first_name":"HERB","last_name":"SMITH","classification":"B","division":"OPEN","hit_factor":7.1618},{"match_name":"Laser Ninja Dragon League USPSA July 2nd Special Classifier","match_date":"2017-07-02","stage_classifiercode":"99-11","member_number":"A101554","first_name":"ALBERT","last_name":"MONTANEZ","classification":"C","division":"OPEN","hit_factor":7.1608},{"match_name":"Range54 USPSA","match_date":"2018-05-04","stage_classifiercode":"99-11","member_number":"A20044","first_name":"JIM","last_name":"MYERS","classification":"U","division":"OPEN","hit_factor":7.1608},{"match_name":"Custer USPSA Mar 7th 2021","match_date":"2021-03-07","stage_classifiercode":"99-11","member_number":"TY114649","first_name":"JORDAN","last_name":"ROGERS","classification":"M","division":"OPEN","hit_factor":7.1567},{"match_name":"Ontelaunee USPSA July 2016","match_date":"2016-07-23","stage_classifiercode":"99-11","member_number":"L1158","first_name":"JIM","last_name":"HAND","classification":"M","division":"OPEN","hit_factor":7.1553},{"match_name":"LdF USPSA Match May 12 2018","match_date":"2018-05-12","stage_classifiercode":"99-11","member_number":"FY39124","first_name":"RAMIRO","last_name":"REYES","classification":"M","division":"OPEN","hit_factor":7.1553},{"match_name":"MCPSL Pistol 3-10-18","match_date":"2018-03-10","stage_classifiercode":"99-11","member_number":"L3506","first_name":"DAN","last_name":"MILLER","classification":"U","division":"OPEN","hit_factor":7.1535},{"match_name":"Steel City USPSA December 2 2017","match_date":"2017-12-02","stage_classifiercode":"99-11","member_number":"TY71580","first_name":"ANTHONY","last_name":"DIGIOVANNI II","classification":"B","division":"OPEN","hit_factor":7.1535},{"match_name":"Richmond Hot Shots April 30-May 1st USPSA Pistol Match","match_date":"2016-04-30","stage_classifiercode":"99-11","member_number":"L1620","first_name":"THOMAS","last_name":"CHAN","classification":"A","division":"OPEN","hit_factor":7.1525},{"match_name":"Payson Practical Shooters USPSA Jan 2 2021","match_date":"2021-01-02","stage_classifiercode":"99-11","member_number":"L523","first_name":"BILL","last_name":"HAAS","classification":"U","division":"OPEN","hit_factor":7.1517},{"match_name":"SLPSA July USPSA match","match_date":"2018-07-21","stage_classifiercode":"99-11","member_number":"L3007","first_name":"FARLEY","last_name":"COLLINS","classification":"B","division":"OPEN","hit_factor":7.1515},{"match_name":"PTPC  February 7th USPSA Match","match_date":"2016-02-07","stage_classifiercode":"99-11","member_number":"A89602","first_name":"CHARLEY","last_name":"APPLE","classification":"U","division":"OPEN","hit_factor":7.1429},{"match_name":"OREGON ARPC CC05 USPSA AUGUST 12 2017","match_date":"2017-08-12","stage_classifiercode":"99-11","member_number":"L3292","first_name":"BILL","last_name":"MARRS","classification":"B","division":"OPEN","hit_factor":7.1429},{"match_name":"OKCGC USPSA June 2018","match_date":"2018-06-02","stage_classifiercode":"99-11","member_number":"TY33925","first_name":"ROBAIRE SENIOR","last_name":"PULLICAR","classification":"C","division":"OPEN","hit_factor":7.1429},{"match_name":"CAPS USPSA June 2021","match_date":"2021-06-05","stage_classifiercode":"99-11","member_number":"FY95946","first_name":"PAUL","last_name":"EMERY","classification":"B","division":"OPEN","hit_factor":7.1429},{"match_name":"Fairfax PS USPSA  2018 October","match_date":"2018-10-16","stage_classifiercode":"99-11","member_number":"L4478","first_name":"ARTIE","last_name":"HAGLICH","classification":"B","division":"OPEN","hit_factor":7.1429},{"match_name":"COPS 2015 Missouri Fall Classic","match_date":"2015-10-03","stage_classifiercode":"99-11","member_number":"A30365","first_name":"ED","last_name":"TRIBBLE","classification":"A","division":"OPEN","hit_factor":7.1339},{"match_name":"Georgia Run N Gun 1-28-2016","match_date":"2016-01-29","stage_classifiercode":"99-11","member_number":"A85797","first_name":"GARY","last_name":"WILLIAMS","classification":"C","division":"OPEN","hit_factor":7.1336},{"match_name":"HSC USPSA October 7th 2017","match_date":"2017-10-06","stage_classifiercode":"99-11","member_number":"a93980","first_name":"KEN","last_name":"LALIBERTE","classification":"C","division":"OPEN","hit_factor":7.1332},{"match_name":"Hopkinton USPSA October 2018","match_date":"2018-10-06","stage_classifiercode":"99-11","member_number":"TY93513","first_name":"MICHAEL","last_name":"KANE","classification":"C","division":"OPEN","hit_factor":7.1329},{"match_name":"MSSA USPSA June  10 2017","match_date":"2017-06-10","stage_classifiercode":"99-11","member_number":"TY17417","first_name":"BILL","last_name":"GREWE","classification":"B","division":"OPEN","hit_factor":7.1327},{"match_name":"Pharr action shooters USPSA match at Coyote 02-20-16","match_date":"2016-02-20","stage_classifiercode":"99-11","member_number":"TY52066","first_name":"OGIE","last_name":"DELAROSA","classification":"A","division":"OPEN","hit_factor":7.1325},{"match_name":"NHRPC - March 2021 USPSA","match_date":"2021-03-14","stage_classifiercode":"99-11","member_number":"ty121316","first_name":"JASON","last_name":"STEM","classification":"C","division":"OPEN","hit_factor":7.132},{"match_name":"BPSA January 2017 USPSA","match_date":"2017-01-22","stage_classifiercode":"99-11","member_number":"A94451","first_name":"TODD","last_name":"DEMPSTER","classification":"U","division":"OPEN","hit_factor":7.1253},{"match_name":"MAPSA 2016.10.08","match_date":"2016-10-08","stage_classifiercode":"99-11","member_number":"FY53872","first_name":"JON","last_name":"MCCARTY","classification":"B","division":"OPEN","hit_factor":7.125},{"match_name":"Rio Salado Hosemasters February 2021","match_date":"2021-02-27","stage_classifiercode":"99-11","member_number":"TY116032","first_name":"JEFF","last_name":"STANLEY","classification":"C","division":"OPEN","hit_factor":7.1247},{"match_name":"Freeport March 13-2021","match_date":"2021-03-12","stage_classifiercode":"99-11","member_number":"A106098","first_name":"ALLEN","last_name":"BERG","classification":"C","division":"OPEN","hit_factor":7.1247},{"match_name":"Prescott 1st Saturday 8-05-17","match_date":"2017-08-05","stage_classifiercode":"99-11","member_number":"A56187","first_name":"MICHAEL","last_name":"FILOSOFO","classification":"B","division":"OPEN","hit_factor":7.1233},{"match_name":"WNPL USPSA - Nov 2017","match_date":"2017-11-05","stage_classifiercode":"99-11","member_number":"A47970","first_name":"DAVE","last_name":"ABELOE","classification":"A","division":"OPEN","hit_factor":7.1225},{"match_name":"Richmond Hot Shots April 14-15-2018 USPSA Pistol Match","match_date":"2018-04-14","stage_classifiercode":"99-11","member_number":"A85957","first_name":"TRISTAN","last_name":"TOLENTINO","classification":"B","division":"OPEN","hit_factor":7.1212},{"match_name":"Richmond Hot Shots April 30-May 1st USPSA Pistol Match","match_date":"2016-04-30","stage_classifiercode":"99-11","member_number":"A64949","first_name":"HIROSHI","last_name":"TAKAMA","classification":"C","division":"OPEN","hit_factor":7.1207},{"match_name":"Ontelaunee USPSA  July 2018","match_date":"2018-07-29","stage_classifiercode":"99-11","member_number":"A33985","first_name":"DONALD","last_name":"SEIGLE","classification":"M","division":"OPEN","hit_factor":7.1181},{"match_name":"17 South - April Fools Match","match_date":"2017-04-01","stage_classifiercode":"99-11","member_number":"L4002","first_name":"STUART","last_name":"MURRAY","classification":"U","division":"OPEN","hit_factor":7.1166},{"match_name":"Steel City USPSA December 2 2017","match_date":"2017-12-02","stage_classifiercode":"99-11","member_number":"L2723","first_name":"ROBERT","last_name":"ADAMS","classification":"B","division":"OPEN","hit_factor":7.1156},{"match_name":"MAPSA 2016.10.08","match_date":"2016-10-08","stage_classifiercode":"99-11","member_number":"L4062","first_name":"KEN","last_name":"SPOONER","classification":"C","division":"OPEN","hit_factor":7.1151},{"match_name":"Brazosland Pistoleros August 20 2017","match_date":"2017-08-20","stage_classifiercode":"99-11","member_number":"TY56894","first_name":"CHRIS","last_name":"PEDUTO","classification":"U","division":"OPEN","hit_factor":7.1141},{"match_name":"CVSC 07-29-2018","match_date":"2018-07-29","stage_classifiercode":"99-11","member_number":"A72602","first_name":"STEVE","last_name":"MURRAY","classification":"B","division":"OPEN","hit_factor":7.1141},{"match_name":"Ripon Oct USPSA Match","match_date":"2015-10-24","stage_classifiercode":"99-11","member_number":"\"\"","first_name":"JIM","last_name":"DERKS","classification":"U","division":"OPEN","hit_factor":7.1135},{"match_name":"CGC 03-10-2018","match_date":"2018-03-10","stage_classifiercode":"99-11","member_number":"L3624","first_name":"DAVID","last_name":"JIMENEZ","classification":"C","division":"OPEN","hit_factor":7.1135},{"match_name":"Sharp Practical Shooters March USPSA Match - Indoor","match_date":"2021-03-28","stage_classifiercode":"99-11","member_number":"TY118820","first_name":"RYAN","last_name":"QUIRK","classification":"C","division":"OPEN","hit_factor":7.1118},{"match_name":"ACPSA November 2018","match_date":"2018-11-24","stage_classifiercode":"99-11","member_number":"\"\"","first_name":"FRED","last_name":"MOFFAT","classification":"U","division":"OPEN","hit_factor":7.1111},{"match_name":"Richmond Hot Shots January 17-2016 USPSA Pistol","match_date":"2016-01-17","stage_classifiercode":"99-11","member_number":"FY81272","first_name":"GAYLORD","last_name":"GABRIEL","classification":"B","division":"OPEN","hit_factor":7.1048},{"match_name":"PSAC 20171028","match_date":"2017-10-28","stage_classifiercode":"99-11","member_number":"TY16618","first_name":"JEFF","last_name":"MEYER","classification":"A","division":"OPEN","hit_factor":7.1014},{"match_name":"Hose Monster Action ","match_date":"2020-07-19","stage_classifiercode":"99-11","member_number":"TY66432","first_name":"DANNY","last_name":"REA","classification":"B","division":"OPEN","hit_factor":7.0984},{"match_name":"Richmond Hot Shots April 30-May 1st USPSA Pistol Match","match_date":"2016-04-30","stage_classifiercode":"99-11","member_number":"TY32985","first_name":"DAVID","last_name":"PONCE","classification":"M","division":"OPEN","hit_factor":7.0978},{"match_name":"Blackstone Shooting Sports Snow Days January 2017 USPSA Level  1","match_date":"2017-01-08","stage_classifiercode":"99-11","member_number":"A31524","first_name":"COUNCIL","last_name":"BRADSHAW","classification":"G","division":"OPEN","hit_factor":7.0968},{"match_name":"Rio Salado RSPP 3rd Saturday February 2020","match_date":"2020-02-15","stage_classifiercode":"99-11","member_number":"TY37812","first_name":"SAL","last_name":"WONG","classification":"C","division":"OPEN","hit_factor":7.0959},{"match_name":"SKSC USPSA April 2018 Match","match_date":"2018-04-21","stage_classifiercode":"99-11","member_number":"Ty18713","first_name":"DALE","last_name":"VANDERZEE","classification":"B","division":"OPEN","hit_factor":7.095},{"match_name":"NCPS USPSA Handgun Match November 27 2016","match_date":"2016-11-27","stage_classifiercode":"99-11","member_number":"A92599","first_name":"JEREMY","last_name":"CHEUNG","classification":"U","division":"OPEN","hit_factor":7.0941},{"match_name":"Rankin Field Sunday USPSA","match_date":"2018-04-15","stage_classifiercode":"99-11","member_number":"A72602","first_name":"STEVE","last_name":"MURRAY","classification":"B","division":"OPEN","hit_factor":7.0922},{"match_name":"WPS USPSA Monthly Match April 2021","match_date":"2021-04-07","stage_classifiercode":"99-11","member_number":"A68001","first_name":"GUS","last_name":"VANETTEN","classification":"M","division":"OPEN","hit_factor":7.0881},{"match_name":"CGGR July USPSA Match","match_date":"2018-07-21","stage_classifiercode":"99-11","member_number":"A97425","first_name":"JORDAN","last_name":"PARKER","classification":"B","division":"OPEN","hit_factor":7.0878},{"match_name":"SUPS USPSA 11/21/15 A","match_date":"2015-11-21","stage_classifiercode":"99-11","member_number":"L1899","first_name":"GARY","last_name":"POWELL","classification":"B","division":"OPEN","hit_factor":7.0853},{"match_name":"USPSA MO21 2Alpha SBRC March 2018","match_date":"2018-03-24","stage_classifiercode":"99-11","member_number":"A79715","first_name":"MICHAEL","last_name":"NELSON","classification":"B","division":"OPEN","hit_factor":7.0822},{"match_name":"Rio Salado Hosemasters February 2021","match_date":"2021-02-27","stage_classifiercode":"99-11","member_number":"A89861","first_name":"LEON","last_name":"SMITH","classification":"B","division":"OPEN","hit_factor":7.0818},{"match_name":"RCPS USPSA 14 Nov 2015","match_date":"2015-11-14","stage_classifiercode":"99-11","member_number":"TY65382","first_name":"JOHN","last_name":"TAYLOR","classification":"B","division":"OPEN","hit_factor":7.0796},{"match_name":"Triforce Practical Shooters at BigWoodsGoods 11-30-17","match_date":"2017-12-01","stage_classifiercode":"99-11","member_number":"A27940","first_name":"RICK","last_name":"DOBBS","classification":"A","division":"OPEN","hit_factor":7.0773},{"match_name":"Prescott Action Shooters 1st Saturday USPSA 6-2-2018 ","match_date":"2018-06-03","stage_classifiercode":"99-11","member_number":"A22810","first_name":"KERRY","last_name":"PEARSON","classification":"G","division":"OPEN","hit_factor":7.0746},{"match_name":"BPSA January 2017 USPSA","match_date":"2017-01-22","stage_classifiercode":"99-11","member_number":"A66934","first_name":"ELIZABETH","last_name":"YOUNG","classification":"C","division":"OPEN","hit_factor":7.0732},{"match_name":"Springfield Tactical Shooters 04/05/2018","match_date":"2018-04-05","stage_classifiercode":"99-11","member_number":"TY69724","first_name":"CRAIG","last_name":"HANSEN","classification":"\"\"","division":"OPEN","hit_factor":7.0661},{"match_name":"HSC USPSA October 7th 2017","match_date":"2017-10-06","stage_classifiercode":"99-11","member_number":"Ty84298","first_name":"JUSTIN","last_name":"MILLER","classification":"C","division":"OPEN","hit_factor":7.0652},{"match_name":"Crooked Creek Pistol League - June 2017","match_date":"2017-06-24","stage_classifiercode":"99-11","member_number":"A43231","first_name":"VERN","last_name":"MOORE","classification":"X","division":"OPEN","hit_factor":7.0603},{"match_name":"MVPSA USPSA 9-15-18","match_date":"2018-09-15","stage_classifiercode":"99-11","member_number":"L3033","first_name":"LARRY","last_name":"AOKI","classification":"A","division":"OPEN","hit_factor":7.0588},{"match_name":"Ontelaunee USPSA  July 2018","match_date":"2018-07-29","stage_classifiercode":"99-11","member_number":"A86775","first_name":"ALEXANDER","last_name":"REALUYO","classification":"A","division":"OPEN","hit_factor":7.0588},{"match_name":"BA USPSA Jun 17-2017","match_date":"2017-06-11","stage_classifiercode":"99-11","member_number":"A100644","first_name":"SETH","last_name":"LEWIS","classification":"B","division":"OPEN","hit_factor":7.0552},{"match_name":"Freeport March 13-2021","match_date":"2021-03-12","stage_classifiercode":"99-11","member_number":"L3570","first_name":"KEVIN","last_name":"DRISCOLL","classification":"B","division":"OPEN","hit_factor":7.0522},{"match_name":"Maryland Practical Shooters Association July 2018","match_date":"2018-07-22","stage_classifiercode":"99-11","member_number":"A105990","first_name":"TIM","last_name":"STEDMAN","classification":"C","division":"OPEN","hit_factor":7.0505},{"match_name":"DTR USPSA Jan 20","match_date":"2020-01-11","stage_classifiercode":"99-11","member_number":"FY88787","first_name":"MARK","last_name":"MILLER","classification":"A","division":"OPEN","hit_factor":7.0501},{"match_name":"CASA USPSA  Jul 2016","match_date":"2016-07-09","stage_classifiercode":"99-11","member_number":"TY34745","first_name":"KEITH","last_name":"HAMMOND","classification":"B","division":"OPEN","hit_factor":7.049},{"match_name":"YVPS Feb 2020","match_date":"2020-02-08","stage_classifiercode":"99-11","member_number":"TY98439","first_name":"DAVID","last_name":"GOOD","classification":"","division":"OPEN","hit_factor":7.0485},{"match_name":"Ontelaunee USPSA September 2015","match_date":"2015-09-27","stage_classifiercode":"99-11","member_number":"A66127","first_name":"KENNY","last_name":"LEE","classification":"B","division":"OPEN","hit_factor":7.0444},{"match_name":"Freeport  Oct 2020 The Goodfellas Match","match_date":"2020-10-04","stage_classifiercode":"99-11","member_number":"L2823","first_name":"DANNY","last_name":"GAMBELLA","classification":"B","division":"OPEN","hit_factor":7.0442},{"match_name":"Lin","match_date":"2016-12-17","stage_classifiercode":"99-11","member_number":"A93372","first_name":"JAMES","last_name":"LOFTON","classification":"A","division":"OPEN","hit_factor":7.0423},{"match_name":"MS06 Team Magnolia February 2018 USPSA Match","match_date":"2018-02-03","stage_classifiercode":"99-11","member_number":"FY81419","first_name":"JOHN","last_name":"NGUYEN","classification":"M","division":"OPEN","hit_factor":7.0397},{"match_name":"WI21 June 24 2018 Points Match","match_date":"2018-06-06","stage_classifiercode":"99-11","member_number":"TY78531","first_name":"ROBERT","last_name":"DEFEVER","classification":"C","division":"OPEN","hit_factor":7.0365},{"match_name":"GRPC USPSA TAX REFUND ","match_date":"2018-04-15","stage_classifiercode":"99-11","member_number":"A94852","first_name":"RANDY","last_name":"GOODNEY","classification":"A","division":"OPEN","hit_factor":7.0359},{"match_name":"BHPSC Monthly Match - Jul 2020","match_date":"2020-07-31","stage_classifiercode":"99-11","member_number":"TY78821","first_name":"STEVE","last_name":"GIRARD","classification":"C","division":"OPEN","hit_factor":7.0332},{"match_name":"WGC April 2017 USPSA","match_date":"2017-04-23","stage_classifiercode":"99-11","member_number":"TY34082","first_name":"ADELO","last_name":"AQUINO","classification":"A","division":"OPEN","hit_factor":7.0313},{"match_name":"USPSA CM99 Special Classifier MO19 Lamar October 9 2016","match_date":"2016-10-09","stage_classifiercode":"99-11","member_number":"a95238","first_name":"JUSTIN","last_name":"MCELROY","classification":"U","division":"OPEN","hit_factor":7.0288},{"match_name":"Richmond Hot Shots January 17-2016 USPSA Pistol","match_date":"2016-01-17","stage_classifiercode":"99-11","member_number":"A64949","first_name":"HIROSHI","last_name":"TAKAMA","classification":"C","division":"OPEN","hit_factor":7.0278},{"match_name":"MISS USPSA Match 10-5-16","match_date":"2016-10-03","stage_classifiercode":"99-11","member_number":"A89151","first_name":"MICHAEL","last_name":"STERN","classification":"C","division":"OPEN","hit_factor":7.0225},{"match_name":"Blackstone Shooting Sports November 2016 USPSA Level 1","match_date":"2016-11-08","stage_classifiercode":"99-11","member_number":"L4080","first_name":"KYLE","last_name":"LEE","classification":"C","division":"OPEN","hit_factor":7.0221},{"match_name":"WGC Winsboro ","match_date":"2016-08-28","stage_classifiercode":"99-11","member_number":"A73014","first_name":"JAMES","last_name":"SIKES","classification":"U","division":"OPEN","hit_factor":7.0221},{"match_name":"Almaden Valley Action Pistol 5-26-18","match_date":"2018-05-26","stage_classifiercode":"99-11","member_number":"L3415","first_name":"RICKY","last_name":"FONG","classification":"B","division":"OPEN","hit_factor":7.0221},{"match_name":"RangeMasters 5-31-2018","match_date":"2018-05-31","stage_classifiercode":"99-11","member_number":"FY71894","first_name":"NEAL","last_name":"NANDIN","classification":"C","division":"OPEN","hit_factor":7.0197},{"match_name":"APSC USPSA 02-15-20","match_date":"2020-02-15","stage_classifiercode":"99-11","member_number":"L3804","first_name":"DAVID","last_name":"BISHOP","classification":"A","division":"OPEN","hit_factor":7.0175},{"match_name":"Hopkinton USPSA July 2018","match_date":"2018-07-07","stage_classifiercode":"99-11","member_number":"A34817","first_name":"DANIEL","last_name":"DIGIOVINE JR","classification":"A","division":"OPEN","hit_factor":7.0175},{"match_name":"EWPSA 2016-04","match_date":"2016-04-17","stage_classifiercode":"99-11","member_number":"A85264","first_name":"SPENCER","last_name":"MORENO","classification":"B","division":"OPEN","hit_factor":7.0175},{"match_name":"North Mountain PS April","match_date":"2016-04-15","stage_classifiercode":"99-11","member_number":"L1305","first_name":"ALAN","last_name":"MEEK","classification":"B","division":"OPEN","hit_factor":7.0153},{"match_name":"WGC Winsboro ","match_date":"2016-08-28","stage_classifiercode":"99-11","member_number":"TY97639","first_name":"JASON","last_name":"WATTS","classification":"U","division":"OPEN","hit_factor":7.0111},{"match_name":"RSPP 3rd Saturday November 2016","match_date":"2016-11-19","stage_classifiercode":"99-11","member_number":"TY58233","first_name":"AL","last_name":"BARR","classification":"B","division":"OPEN","hit_factor":7.01},{"match_name":"Tangi January 2016 USPSA","match_date":"2016-01-23","stage_classifiercode":"99-11","member_number":"A86980","first_name":"BRYAN","last_name":"TULLOS","classification":"U","division":"OPEN","hit_factor":7.01},{"match_name":"Dundee USPSA Feb 2016","match_date":"2016-02-27","stage_classifiercode":"99-11","member_number":"TY7127","first_name":"TOM","last_name":"ANGELL","classification":"B","division":"OPEN","hit_factor":7.0093},{"match_name":"Grandbaggers August 2017","match_date":"2017-08-03","stage_classifiercode":"99-11","member_number":"A91055","first_name":"BOB","last_name":"WAGNER","classification":"B","division":"OPEN","hit_factor":7.0088},{"match_name":"Hawkeye Gun Club July 2016 Match","match_date":"2016-07-16","stage_classifiercode":"99-11","member_number":"A86799","first_name":"BILL","last_name":"ROACH","classification":"C","division":"OPEN","hit_factor":7.0088},{"match_name":"Collin County USPSA 04-25-2021","match_date":"2021-04-24","stage_classifiercode":"99-11","member_number":"TY47162","first_name":"SCOTT","last_name":"STOCKTON","classification":"G","division":"OPEN","hit_factor":7.0085},{"match_name":"Denali Practical Pistol October","match_date":"2016-10-08","stage_classifiercode":"99-11","member_number":"L3808","first_name":"MARK","last_name":"BROWN","classification":"B","division":"OPEN","hit_factor":7.0081},{"match_name":"CFRPC USPSA 2020-09-13","match_date":"2020-09-13","stage_classifiercode":"99-11","member_number":"TY110539","first_name":"SASHA","last_name":"MOISEEV","classification":"C","division":"OPEN","hit_factor":7.0028},{"match_name":"West Coast IPSC","match_date":"2018-07-22","stage_classifiercode":"99-11","member_number":"A38618","first_name":"HENRY","last_name":"TORIBIO","classification":"M","division":"OPEN","hit_factor":7.0013},{"match_name":"PGC USPSA Practice Match 9-26-17","match_date":"2017-09-25","stage_classifiercode":"99-11","member_number":"TY78821","first_name":"STEVE","last_name":"GIRARD","classification":"C","division":"OPEN","hit_factor":7},{"match_name":"MPSA 042118 USPSA","match_date":"2018-04-21","stage_classifiercode":"99-11","member_number":"A66934","first_name":"ELIZABETH","last_name":"YOUNG","classification":"C","division":"OPEN","hit_factor":7},{"match_name":"WELD ECO09 20180916","match_date":"2018-09-16","stage_classifiercode":"99-11","member_number":"A56905","first_name":"BLAIR","last_name":"HANSEN","classification":"B","division":"OPEN","hit_factor":6.9939},{"match_name":"MAPSA 2016.04.09","match_date":"2016-04-09","stage_classifiercode":"99-11","member_number":"A77361","first_name":"CRAIG","last_name":"EVANS","classification":"U","division":"OPEN","hit_factor":6.9921},{"match_name":"Extreme GM USPSA  November","match_date":"2020-11-27","stage_classifiercode":"99-11","member_number":"A83270","first_name":"LEE","last_name":"NUGUIT","classification":"A","division":"OPEN","hit_factor":6.9863},{"match_name":"Richmond Hot Shots April 14-15-2018 USPSA Pistol Match","match_date":"2018-04-14","stage_classifiercode":"99-11","member_number":"L3415","first_name":"RICKY","last_name":"FONG","classification":"B","division":"OPEN","hit_factor":6.9832},{"match_name":"WI21 June 24 2018 Points Match","match_date":"2018-06-06","stage_classifiercode":"99-11","member_number":"TY72120","first_name":"DAVID","last_name":"DEYOE","classification":"M","division":"OPEN","hit_factor":6.9767},{"match_name":"Freeport  Oct 2020 The Goodfellas Match","match_date":"2020-10-04","stage_classifiercode":"99-11","member_number":"TY85379","first_name":"JOE","last_name":"TOLENO","classification":"M","division":"OPEN","hit_factor":6.9767},{"match_name":"TPS USPSA at CMP March 18 2017","match_date":"2017-03-18","stage_classifiercode":"99-11","member_number":"\"\"","first_name":"GARY","last_name":"WILLIAMS","classification":"C","division":"OPEN","hit_factor":6.9767},{"match_name":"Rio Salado Hosemasters February 2021","match_date":"2021-02-27","stage_classifiercode":"99-11","member_number":"TY89432","first_name":"ALLEN","last_name":"SCHULTZ","classification":"C","division":"OPEN","hit_factor":6.9735},{"match_name":"Ontelaunee USPSA July 2016","match_date":"2016-07-23","stage_classifiercode":"99-11","member_number":"A86774","first_name":"NICHOLAS","last_name":"REALUYO","classification":"C","division":"OPEN","hit_factor":6.9708},{"match_name":"Lefthanders Gun Club Practical Shooters October","match_date":"2017-09-30","stage_classifiercode":"99-11","member_number":"TY78405","first_name":"ROLEN","last_name":"SEAN","classification":"B","division":"OPEN","hit_factor":6.9686},{"match_name":"WVPPS November 2018","match_date":"2018-11-18","stage_classifiercode":"99-11","member_number":"A55824","first_name":"JEFF","last_name":"GORDON","classification":"B","division":"OPEN","hit_factor":6.9686},{"match_name":"West Coast IPSC","match_date":"2018-07-22","stage_classifiercode":"99-11","member_number":"\"\"","first_name":"BO","last_name":"WANG","classification":"B","division":"OPEN","hit_factor":6.9643},{"match_name":"TCGC Polo July 2017","match_date":"2017-07-23","stage_classifiercode":"99-11","member_number":"FY24139","first_name":"BRUCE","last_name":"CARBY","classification":"A","division":"OPEN","hit_factor":6.9565},{"match_name":"LA05 Tangi USPSA 4th Sunday May 2021","match_date":"2021-05-23","stage_classifiercode":"99-11","member_number":"L2688","first_name":"STEPHEN","last_name":"LASAVIA","classification":"M","division":"OPEN","hit_factor":6.9541},{"match_name":"Rankin Field Sunday USPSA","match_date":"2018-04-15","stage_classifiercode":"99-11","member_number":"FY29119","first_name":"EDDY","last_name":"DICE","classification":"B","division":"OPEN","hit_factor":6.9532},{"match_name":"Deadwood Boys USPSA All Classifier Match - 29 July 2018","match_date":"2018-07-29","stage_classifiercode":"99-11","member_number":"A112576","first_name":"KHOI","last_name":"PHAM","classification":"U","division":"OPEN","hit_factor":6.9512},{"match_name":"LIPSA -  April 17th 2016 - USPSA Special Classifier Match","match_date":"2016-04-17","stage_classifiercode":"99-11","member_number":"FY14356","first_name":"JOHN","last_name":"SOLTESZ","classification":"A","division":"OPEN","hit_factor":6.9512},{"match_name":"Ontelaunee USPSA Hose Fest","match_date":"2021-01-02","stage_classifiercode":"99-11","member_number":"TY104882","first_name":"CHRISTOPHER","last_name":"GELNETT","classification":"M","division":"OPEN","hit_factor":6.9492},{"match_name":"NCPS USPSA Handgun Match June 24 2018","match_date":"2018-06-24","stage_classifiercode":"99-11","member_number":"A46152","first_name":"ALLEN","last_name":"LOWE","classification":"M","division":"OPEN","hit_factor":6.947},{"match_name":"BHPSC 11-20-2020","match_date":"2020-11-21","stage_classifiercode":"99-11","member_number":"TY112283","first_name":"ELLIOT","last_name":"JOHNSON","classification":"U","division":"OPEN","hit_factor":6.9465},{"match_name":"SAPSC Monthly USPSA Classifier Match at ARO 20180215","match_date":"2018-02-16","stage_classifiercode":"99-11","member_number":"A79845","first_name":"JOHNNY","last_name":"REED","classification":"A","division":"OPEN","hit_factor":6.9463},{"match_name":"BA USPSA Sep  23/2017","match_date":"2017-09-23","stage_classifiercode":"99-11","member_number":"A85695","first_name":"ALAN","last_name":"FRENCH","classification":"B","division":"OPEN","hit_factor":6.9444},{"match_name":"CCG 5-29-16","match_date":"2016-05-29","stage_classifiercode":"99-11","member_number":"A86526","first_name":"DOUG","last_name":"NORMAN","classification":"B","division":"OPEN","hit_factor":6.9405},{"match_name":"Prescott 1st Saturday 8-05-17","match_date":"2017-08-05","stage_classifiercode":"99-11","member_number":"A47144","first_name":"JIGGER","last_name":"AGUILAR","classification":"M","division":"OPEN","hit_factor":6.9374},{"match_name":"West Coast IPSC","match_date":"2018-07-22","stage_classifiercode":"99-11","member_number":"A87556","first_name":"ROB","last_name":"CHOI","classification":"M","division":"OPEN","hit_factor":6.9364},{"match_name":"TPS USPSA at CMP March 18 2017","match_date":"2017-03-18","stage_classifiercode":"99-11","member_number":"A94603","first_name":"RONALDO","last_name":"BORGES","classification":"B","division":"OPEN","hit_factor":6.9281},{"match_name":"Dundee USPSA Feb 2016","match_date":"2016-02-27","stage_classifiercode":"99-11","member_number":"TY45897","first_name":"LARRY","last_name":"MULL","classification":"C","division":"OPEN","hit_factor":6.9249},{"match_name":"2017 EOD Warrior Foundation Match","match_date":"2017-04-29","stage_classifiercode":"99-11","member_number":"A94746","first_name":"ERNEST","last_name":"PRICE","classification":"\"\"","division":"OPEN","hit_factor":6.9175},{"match_name":"ENPS 2018 June USPSA Match","match_date":"2018-06-03","stage_classifiercode":"99-11","member_number":"TY109377","first_name":"STEVE","last_name":"PORTER","classification":"U","division":"OPEN","hit_factor":6.9164},{"match_name":"Denali Practical Pistol April","match_date":"2017-04-08","stage_classifiercode":"99-11","member_number":"L3808","first_name":"MARK","last_name":"BROWN","classification":"B","division":"OPEN","hit_factor":6.9164},{"match_name":"TAP USPSA Pistol Match Aug 14 2016","match_date":"2016-08-14","stage_classifiercode":"99-11","member_number":"A84616","first_name":"MJ","last_name":"FINEZA","classification":"A","division":"OPEN","hit_factor":6.9149},{"match_name":"COPS 2015 Missouri Fall Classic","match_date":"2015-10-03","stage_classifiercode":"99-11","member_number":"Ty10182","first_name":"BRYAN","last_name":"MILLER","classification":"A","division":"OPEN","hit_factor":6.913},{"match_name":"Laser Ninja Dragon League USPSA July 2nd Special Classifier","match_date":"2017-07-02","stage_classifiercode":"99-11","member_number":"L3620","first_name":"STEVE","last_name":"FOUTZ","classification":"B","division":"OPEN","hit_factor":6.91},{"match_name":"Richmond Hot Shots April 30-May 1st USPSA Pistol Match","match_date":"2016-04-30","stage_classifiercode":"99-11","member_number":"A 51896","first_name":"LORI","last_name":"BOFMAN","classification":"B","division":"OPEN","hit_factor":6.91},{"match_name":"2016-02-06 USPSA at Phoenix Rod and Gun Club","match_date":"2016-02-06","stage_classifiercode":"99-11","member_number":"TY65635","first_name":"CHRIS","last_name":"COLLINS","classification":"B","division":"OPEN","hit_factor":6.9095},{"match_name":"Tidewater Practical Shooter August 9th Match","match_date":"2021-08-09","stage_classifiercode":"99-11","member_number":"A120538","first_name":"JAMES","last_name":"HYSONG","classification":"B","division":"OPEN","hit_factor":6.9074},{"match_name":"SAPSA January 2020 Match","match_date":"2020-01-18","stage_classifiercode":"99-11","member_number":"A103496","first_name":"MICHAEL","last_name":"HARBISON","classification":"U","division":"OPEN","hit_factor":6.9061},{"match_name":"BSPSC 2017 April Special Classifier","match_date":"2017-04-09","stage_classifiercode":"99-11","member_number":"FY13159","first_name":"MIKE","last_name":"SHAPIRO","classification":"B","division":"OPEN","hit_factor":6.9048},{"match_name":"HOPS USPSA 072118","match_date":"2018-07-21","stage_classifiercode":"99-11","member_number":"TY108017","first_name":"DONNIE","last_name":"SIMPSON","classification":"C","division":"OPEN","hit_factor":6.9014},{"match_name":"PSAC_20161022","match_date":"2016-10-22","stage_classifiercode":"99-11","member_number":"TY18366","first_name":"RICK","last_name":"HEBERT","classification":"\"\"","division":"OPEN","hit_factor":6.8966},{"match_name":"EWPSA 2016-04","match_date":"2016-04-17","stage_classifiercode":"99-11","member_number":"L3238","first_name":"MATT","last_name":"NEWBURN","classification":"B","division":"OPEN","hit_factor":6.8966},{"match_name":"Richmond Hot Shots October 6-7 USPSA Pistol Match","match_date":"2018-10-06","stage_classifiercode":"99-11","member_number":"FY69835","first_name":"JEREMY","last_name":"JAVIER","classification":"A","division":"OPEN","hit_factor":6.8966},{"match_name":"Prescott 1st Saturday 8-05-17","match_date":"2017-08-05","stage_classifiercode":"99-11","member_number":"A8169","first_name":"PHIL","last_name":"GRUBBS","classification":"B","division":"OPEN","hit_factor":6.8924},{"match_name":"Freeport March 2020","match_date":"2020-03-01","stage_classifiercode":"99-11","member_number":"TY83520","first_name":"JAMES","last_name":"MARQUES","classification":"C","division":"OPEN","hit_factor":6.8922},{"match_name":"CCPL May  Day Match","match_date":"2021-05-23","stage_classifiercode":"99-11","member_number":"FY7035","first_name":"BILL","last_name":"LUPER","classification":"A","division":"OPEN","hit_factor":6.8908},{"match_name":"Tangi May 2016 USPSA","match_date":"2016-05-29","stage_classifiercode":"99-11","member_number":"TY64151","first_name":"DON","last_name":"GRANIER","classification":"X","division":"OPEN","hit_factor":6.8908},{"match_name":"HSC USPSA August 5th 2017","match_date":"2017-08-05","stage_classifiercode":"99-11","member_number":"A95768","first_name":"THOMAS","last_name":"COOK","classification":"C","division":"OPEN","hit_factor":6.8878},{"match_name":"TAP USPSA Pistol Match Aug 14 2016","match_date":"2016-08-14","stage_classifiercode":"99-11","member_number":"A88773","first_name":"EPHRAIM","last_name":"SAN FELIPE","classification":"C","division":"OPEN","hit_factor":6.8871},{"match_name":"West Coast IPSC","match_date":"2018-07-22","stage_classifiercode":"99-11","member_number":"TY99082","first_name":"LUKE","last_name":"WANG","classification":"B","division":"OPEN","hit_factor":6.8871},{"match_name":"ENPS 2018 June USPSA Match","match_date":"2018-06-03","stage_classifiercode":"99-11","member_number":"A99832","first_name":"NICK","last_name":"GRUBEL","classification":"U","division":"OPEN","hit_factor":6.8862},{"match_name":"OREGON ARPC CC05 USPSA AUGUST 12 2017","match_date":"2017-08-12","stage_classifiercode":"99-11","member_number":"TY45892","first_name":"RICHARD","last_name":"BROWNING","classification":"B","division":"OPEN","hit_factor":6.8826},{"match_name":"MVPSA USPSA 9-15-18","match_date":"2018-09-15","stage_classifiercode":"99-11","member_number":"A89949","first_name":"THOMAS","last_name":"YOUNG","classification":"B","division":"OPEN","hit_factor":6.8783},{"match_name":"Matamoras USPSA August Match","match_date":"2017-08-27","stage_classifiercode":"99-11","member_number":"TY82780","first_name":"JEANNE","last_name":"RUANE","classification":"B","division":"OPEN","hit_factor":6.8724},{"match_name":"GPSL 10-4-2016","match_date":"2016-10-04","stage_classifiercode":"99-11","member_number":"FY42199","first_name":"BART","last_name":"HARKEY","classification":"B","division":"OPEN","hit_factor":6.872},{"match_name":"WI21 June 24 2018 Points Match","match_date":"2018-06-06","stage_classifiercode":"99-11","member_number":"TY54308","first_name":"GLEN","last_name":"BICKING","classification":"B","division":"OPEN","hit_factor":6.8713},{"match_name":"CCPL 01102016 ALL CLASSIFIER MATCH","match_date":"2016-01-10","stage_classifiercode":"99-11","member_number":"A72602","first_name":"STEVE","last_name":"MURRAY","classification":"C","division":"OPEN","hit_factor":6.8664},{"match_name":"OFGC USPSA Match Feb 19th 2017","match_date":"2017-02-19","stage_classifiercode":"99-11","member_number":"TY50326","first_name":"ROB","last_name":"ELSTON","classification":"B","division":"OPEN","hit_factor":6.8615},{"match_name":"MSSA Uspsa Match 1/3/16","match_date":"2016-01-03","stage_classifiercode":"99-11","member_number":"A78858","first_name":"BILL","last_name":"ASHABRANNER","classification":"C","division":"OPEN","hit_factor":6.8602},{"match_name":"HPS March 2020 Club Fun Match","match_date":"2020-03-07","stage_classifiercode":"99-11","member_number":"TY26523","first_name":"STEVE","last_name":"RIBAO","classification":"B","division":"OPEN","hit_factor":6.8602},{"match_name":"BUAS May Match","match_date":"2021-05-02","stage_classifiercode":"99-11","member_number":"A103354","first_name":"STEVEN","last_name":"CHAET","classification":"B","division":"OPEN","hit_factor":6.8592},{"match_name":"APSC USPSA 02-15-20","match_date":"2020-02-15","stage_classifiercode":"99-11","member_number":"NA","first_name":"JONATHAN","last_name":"FOO","classification":"U","division":"OPEN","hit_factor":6.8571},{"match_name":"FSA USPSA 01-26-20","match_date":"2020-01-27","stage_classifiercode":"99-11","member_number":"Ty99422","first_name":"CORY","last_name":"TUCHSCHERER","classification":"B","division":"OPEN","hit_factor":6.8493},{"match_name":"LPRGC-Lower Providence USPSA May-1 2017","match_date":"2017-05-05","stage_classifiercode":"99-11","member_number":"TY16248","first_name":"BARRY","last_name":"RUANE","classification":"M","division":"OPEN","hit_factor":6.8468},{"match_name":"Pardoe Sportsmens Association-WPA14-2017-10-01","match_date":"2017-10-01","stage_classifiercode":"99-11","member_number":"A99541","first_name":"WADE","last_name":"SHANER","classification":"C","division":"OPEN","hit_factor":6.8441},{"match_name":"Rio Salado UPPL September 2020","match_date":"2020-09-13","stage_classifiercode":"99-11","member_number":"L4799","first_name":"BILL","last_name":"ROBERTS","classification":"A","division":"OPEN","hit_factor":6.8436},{"match_name":"Colonial RPC Inaugural USPSA Match","match_date":"2018-04-07","stage_classifiercode":"99-11","member_number":"L3570","first_name":"KEVIN","last_name":"DRISCOLL","classification":"C","division":"OPEN","hit_factor":6.8436},{"match_name":"GLSRC pistol 1-2-18","match_date":"2018-01-01","stage_classifiercode":"99-11","member_number":"\"\"","first_name":"JOSH","last_name":"GARDINER","classification":"U","division":"OPEN","hit_factor":6.8396},{"match_name":"Bgs Hudson Week 6","match_date":"2017-02-19","stage_classifiercode":"99-11","member_number":"TY73645","first_name":"JOE","last_name":"BENSON","classification":"U","division":"OPEN","hit_factor":6.8376},{"match_name":"2016-07 Bone Creek USPSA","match_date":"2016-07-03","stage_classifiercode":"99-11","member_number":"TY29453","first_name":"J.D.","last_name":"SMITH","classification":"M","division":"OPEN","hit_factor":6.8354},{"match_name":"MCPSL Pistol 8-12-17","match_date":"2017-08-12","stage_classifiercode":"99-11","member_number":"TY78821","first_name":"STEVE","last_name":"GIRARD","classification":"C","division":"OPEN","hit_factor":6.8354},{"match_name":"North Mountain PS April","match_date":"2016-04-15","stage_classifiercode":"99-11","member_number":"TY55989","first_name":"MIKE","last_name":"WHITMAN","classification":"B","division":"OPEN","hit_factor":6.8345},{"match_name":"Range54 USPSA","match_date":"2018-06-08","stage_classifiercode":"99-11","member_number":"l1224","first_name":"BILL","last_name":"GEE","classification":"M","division":"OPEN","hit_factor":6.8333},{"match_name":"Richmond Hot Shots April 30-May 1st USPSA Pistol Match","match_date":"2016-04-30","stage_classifiercode":"99-11","member_number":"Ty90077","first_name":"DOUGLAS","last_name":"TELLEF","classification":"C","division":"OPEN","hit_factor":6.8314},{"match_name":"Richmond Hot Shots April 30-May 1st USPSA Pistol Match","match_date":"2016-04-30","stage_classifiercode":"99-11","member_number":"TY79640","first_name":"ELPIDIO (PETE)","last_name":"CORPUZ","classification":"B","division":"OPEN","hit_factor":6.8268},{"match_name":"FAS Sunday Indoors USPSA Match","match_date":"2021-02-07","stage_classifiercode":"99-11","member_number":"TY90397","first_name":"JOEY","last_name":"MARRAPODI","classification":"B","division":"OPEN","hit_factor":6.8259},{"match_name":"LdF USPSA Match May 12 2018","match_date":"2018-05-12","stage_classifiercode":"99-11","member_number":"A44789","first_name":"KEN","last_name":"TICZON","classification":"M","division":"OPEN","hit_factor":6.8241},{"match_name":"BSPSC 2021 July Geo Thompson Single Stack Classic","match_date":"2021-07-11","stage_classifiercode":"99-11","member_number":"TY104679","first_name":"LUKE","last_name":"ARCHER","classification":"B","division":"OPEN","hit_factor":6.8213},{"match_name":"PTPC  February 7th USPSA Match","match_date":"2016-02-07","stage_classifiercode":"99-11","member_number":"TY11967","first_name":"KEITH","last_name":"BOYSEN","classification":"M","division":"OPEN","hit_factor":6.8143},{"match_name":"MPPL 11042018 Hoser Heaven","match_date":"2018-11-04","stage_classifiercode":"99-11","member_number":"FY85757","first_name":"EDGAR","last_name":"VICENTE","classification":"C","division":"OPEN","hit_factor":6.81},{"match_name":"RBGC 2017-06-24","match_date":"2017-06-24","stage_classifiercode":"99-11","member_number":"A94603","first_name":"RONALDO","last_name":"BORGES","classification":"B","division":"OPEN","hit_factor":6.8091},{"match_name":"EWPSA 2016-04","match_date":"2016-04-17","stage_classifiercode":"99-11","member_number":"TY70904","first_name":"MICHAEL","last_name":"GIMERA","classification":"C","division":"OPEN","hit_factor":6.8091},{"match_name":"Cactus USPSA ALL CLASSIFIER August 2020","match_date":"2020-08-02","stage_classifiercode":"99-11","member_number":"A96830","first_name":"JACK","last_name":"HATTON","classification":"C","division":"OPEN","hit_factor":6.8085},{"match_name":"Maine Practical Shooters February 2020","match_date":"2020-02-22","stage_classifiercode":"99-11","member_number":"A82210","first_name":"JOHN","last_name":"JONES","classification":"B","division":"OPEN","hit_factor":6.8063},{"match_name":"BUAS December Match","match_date":"2016-12-11","stage_classifiercode":"99-11","member_number":"TY52264","first_name":"RICH","last_name":"FRAZIER","classification":"C","division":"OPEN","hit_factor":6.8063},{"match_name":"Applied IN25 USPSA December 2016","match_date":"2016-12-23","stage_classifiercode":"99-11","member_number":"TY86867","first_name":"ANDREW","last_name":"HEATH","classification":"A","division":"OPEN","hit_factor":6.7982},{"match_name":"Ontelaunee USPSA September 2015","match_date":"2015-09-27","stage_classifiercode":"99-11","member_number":"TY77564","first_name":"KEVIN","last_name":"MCPHEE","classification":"C","division":"OPEN","hit_factor":6.7961},{"match_name":"USPSA CM99 Special Classifier MO19 Lamar October 9 2016","match_date":"2016-10-09","stage_classifiercode":"99-11","member_number":"ty73010","first_name":"KYLE","last_name":"SAYRE","classification":"B","division":"OPEN","hit_factor":6.7961},{"match_name":"SAPS Match 1/16/2021","match_date":"2021-01-16","stage_classifiercode":"99-11","member_number":"A121607","first_name":"TJ","last_name":"RISEN","classification":"U","division":"OPEN","hit_factor":6.7949},{"match_name":"Hallstead USPSA  July Match","match_date":"2020-07-25","stage_classifiercode":"99-11","member_number":"A93292","first_name":"CRAIG","last_name":"SANTASIERO","classification":"C","division":"OPEN","hit_factor":6.7938},{"match_name":"MS06 Team Magnolia USPSA Sept Match","match_date":"2015-09-06","stage_classifiercode":"99-11","member_number":"A80452","first_name":"ERNIE","last_name":"MATTINGLY","classification":"C","division":"OPEN","hit_factor":6.7885},{"match_name":"WSPS JUNE 2018 USPSA MATCH","match_date":"2018-06-16","stage_classifiercode":"99-11","member_number":"TY101530","first_name":"JEROME","last_name":"HOY","classification":"C","division":"OPEN","hit_factor":6.7862},{"match_name":"NCPS USPSA Handgun Match June 24 2018","match_date":"2018-06-24","stage_classifiercode":"99-11","member_number":"A18729","first_name":"STEVE","last_name":"MCCORMICK","classification":"A","division":"OPEN","hit_factor":6.7862},{"match_name":"Emmett July Match","match_date":"2017-07-21","stage_classifiercode":"99-11","member_number":"71703","first_name":"DONALD","last_name":"MARTIN","classification":"B","division":"OPEN","hit_factor":6.7843},{"match_name":"SLPSA July USPSA match","match_date":"2018-07-21","stage_classifiercode":"99-11","member_number":"TY74321","first_name":"STEPHEN","last_name":"PRICE","classification":"B","division":"OPEN","hit_factor":6.7836},{"match_name":"Crooked Creek Pistol League - June 2016","match_date":"2016-06-25","stage_classifiercode":"99-11","member_number":"TY66305","first_name":"HERB","last_name":"SMITH","classification":"B","division":"OPEN","hit_factor":6.7797},{"match_name":"Swamp Eagles 2015-12","match_date":"2015-12-20","stage_classifiercode":"99-11","member_number":"A66934","first_name":"BETSY","last_name":"YOUNG","classification":"C","division":"OPEN","hit_factor":6.7776},{"match_name":"USPSA-Alberta 2018-01 Indoor Classifier 1","match_date":"2018-02-26","stage_classifiercode":"99-11","member_number":"TYF105207","first_name":"DAN","last_name":"WHITE","classification":"U","division":"OPEN","hit_factor":6.7754},{"match_name":"Bridgeville - USPSA - Dec","match_date":"2020-12-06","stage_classifiercode":"99-11","member_number":"TY99554","first_name":"SASHA","last_name":"DANJCZEK","classification":"","division":"OPEN","hit_factor":6.7723},{"match_name":"Extreme GM","match_date":"2020-06-12","stage_classifiercode":"99-11","member_number":"TY110539","first_name":"SASHA","last_name":"MOISEEV","classification":"C","division":"OPEN","hit_factor":6.7708},{"match_name":"SCAPSA MN05 Summer League 8","match_date":"2017-08-01","stage_classifiercode":"99-11","member_number":"L4275","first_name":"MIKE","last_name":"BERTRAND","classification":"C","division":"OPEN","hit_factor":6.7708},{"match_name":"USPSA-Classifier","match_date":"2017-03-26","stage_classifiercode":"99-11","member_number":"F88122","first_name":"JOEY","last_name":"RODRIGUEZ","classification":"B","division":"OPEN","hit_factor":6.7708},{"match_name":"MPPL 11042018 Hoser Heaven","match_date":"2018-11-04","stage_classifiercode":"99-11","member_number":"TY38050","first_name":"PAT","last_name":"ACACIO","classification":"B","division":"OPEN","hit_factor":6.7688},{"match_name":"RSPP 3rd Saturday November 2016","match_date":"2016-11-19","stage_classifiercode":"99-11","member_number":"TY16907","first_name":"SPENCE","last_name":"CUTRELL","classification":"A","division":"OPEN","hit_factor":6.7616},{"match_name":"THS XMAS Match","match_date":"2015-12-13","stage_classifiercode":"99-11","member_number":"A76966","first_name":"FERDI","last_name":"UMALI","classification":"C","division":"OPEN","hit_factor":6.7602},{"match_name":"CRC/SVPS AUGUST  2018","match_date":"2018-08-17","stage_classifiercode":"99-11","member_number":"A107227","first_name":"KENNY","last_name":"NGUYEN","classification":"C","division":"OPEN","hit_factor":6.7602},{"match_name":"Applied IN25 USPSA April Classifier 2018","match_date":"2018-04-17","stage_classifiercode":"99-11","member_number":"Ty86867","first_name":"ANDREW","last_name":"HEATH","classification":"M","division":"OPEN","hit_factor":6.7568},{"match_name":"Ontelaunee USPSA  July 2018","match_date":"2018-07-29","stage_classifiercode":"99-11","member_number":"TY63853","first_name":"DAVE","last_name":"GIRARDIN","classification":"M","division":"OPEN","hit_factor":6.7548},{"match_name":"OKCGC USPSA June 2018","match_date":"2018-06-02","stage_classifiercode":"99-11","member_number":"A77565","first_name":"JASON","last_name":"GRANT","classification":"C","division":"OPEN","hit_factor":6.7485},{"match_name":"Extreme GM USPSA  November","match_date":"2020-11-27","stage_classifiercode":"99-11","member_number":"A98509","first_name":"JOEY","last_name":"EMPAMANO","classification":"B","division":"OPEN","hit_factor":6.743},{"match_name":"Richmond Hot Shots April 30-May 1st USPSA Pistol Match","match_date":"2016-04-30","stage_classifiercode":"99-11","member_number":"TY74322","first_name":"ANDRE","last_name":"TAUBE","classification":"A","division":"OPEN","hit_factor":6.7416},{"match_name":"SAGC CTX04 Monthly USPSA Match - November 2018","match_date":"2018-11-25","stage_classifiercode":"99-11","member_number":"A101336","first_name":"BOBBY","last_name":"IVESTER","classification":"A","division":"OPEN","hit_factor":6.7389},{"match_name":"EIPS 12/6/2018","match_date":"2018-12-06","stage_classifiercode":"99-11","member_number":"A101705","first_name":"JOHN","last_name":"RIGGS","classification":"C","division":"OPEN","hit_factor":6.7376},{"match_name":"WELD ECO09 20180916","match_date":"2018-09-16","stage_classifiercode":"99-11","member_number":"L3762","first_name":"LANCE","last_name":"FOSTER","classification":"A","division":"OPEN","hit_factor":6.735},{"match_name":"Ontelaunee USPSA September 2015","match_date":"2015-09-27","stage_classifiercode":"99-11","member_number":"FY73439","first_name":"CHRIS","last_name":"OLSZEWSKI","classification":"A","division":"OPEN","hit_factor":6.7273},{"match_name":"NHRPC - March 2021 USPSA","match_date":"2021-03-14","stage_classifiercode":"99-11","member_number":"A115130","first_name":"JOSHUA","last_name":"TUKAY","classification":"C","division":"OPEN","hit_factor":6.7259},{"match_name":"OFGC USPSA Match Feb 19th 2017","match_date":"2017-02-19","stage_classifiercode":"99-11","member_number":"A73637","first_name":"JAMES","last_name":"JONES","classification":"U","division":"OPEN","hit_factor":6.7207},{"match_name":" IPSC93 Oct 2021","match_date":"2021-10-29","stage_classifiercode":"99-11","member_number":"TY51119","first_name":"CHRIS","last_name":"MOLNAR","classification":"A","division":"OPEN","hit_factor":6.7204},{"match_name":"Denali Practical Pistol October","match_date":"2016-10-08","stage_classifiercode":"99-11","member_number":"\"\"","first_name":"SETH","last_name":"YOUNG","classification":"U","division":"OPEN","hit_factor":6.7183},{"match_name":"MSSA USPSA June  10 2017","match_date":"2017-06-10","stage_classifiercode":"99-11","member_number":"\"\"","first_name":"BILL","last_name":"ASHABRANNER","classification":"B","division":"OPEN","hit_factor":6.7174},{"match_name":"TPS USPSA at CMP March 18 2017","match_date":"2017-03-18","stage_classifiercode":"99-11","member_number":"A68960","first_name":"TYLER","last_name":"HUFF","classification":"A","division":"OPEN","hit_factor":6.7114},{"match_name":"2017 Bay bridge Charity Classic - Richmond October 14-15-2017","match_date":"2017-10-14","stage_classifiercode":"99-11","member_number":"FY69835","first_name":"JEREMY","last_name":"JAVIER","classification":"A","division":"OPEN","hit_factor":6.71},{"match_name":"Rio Salado UPPL September 2020","match_date":"2020-09-13","stage_classifiercode":"99-11","member_number":"FYF68512","first_name":"MUNEKI","last_name":"SAMEJIMA","classification":"G","division":"OPEN","hit_factor":6.7083},{"match_name":"Dundee Practical Shooters - Single Stack Challenge - Jan 23 2021","match_date":"2021-01-23","stage_classifiercode":"99-11","member_number":"A81972","first_name":"ANDREW","last_name":"MERCER","classification":"B","division":"OPEN","hit_factor":6.7073},{"match_name":"RSCS USPSA  27 Mar 2016","match_date":"2016-03-27","stage_classifiercode":"99-11","member_number":"A85602","first_name":"NICK","last_name":"GUTIERREZ","classification":"U","division":"OPEN","hit_factor":6.7024},{"match_name":"GAS Special Classifier","match_date":"2016-07-02","stage_classifiercode":"99-11","member_number":"FY65812","first_name":"TAMI","last_name":"WAITE","classification":"U","division":"OPEN","hit_factor":6.7017},{"match_name":"Freeport March 2020","match_date":"2020-03-01","stage_classifiercode":"99-11","member_number":"A106098","first_name":"ALLEN","last_name":"BERG","classification":"D","division":"OPEN","hit_factor":6.698},{"match_name":"NCPS USPSA Handgun Match November 27 2016","match_date":"2016-11-27","stage_classifiercode":"99-11","member_number":"FY81272","first_name":"GAYLORD","last_name":"GABRIEL","classification":"B","division":"OPEN","hit_factor":6.6946},{"match_name":"MSSA Uspsa Club Match","match_date":"2017-08-27","stage_classifiercode":"99-11","member_number":"TY34082","first_name":"ADELO","last_name":"AQUINO","classification":"A","division":"OPEN","hit_factor":6.6924},{"match_name":"LdF USPSA Match May 12 2018","match_date":"2018-05-12","stage_classifiercode":"99-11","member_number":"\"\"","first_name":"JIM","last_name":"BUCCELLATO","classification":"M","division":"OPEN","hit_factor":6.6849},{"match_name":"COPS 2015 Missouri Fall Classic","match_date":"2015-10-03","stage_classifiercode":"99-11","member_number":"TY78481","first_name":"TERRY","last_name":"LAUWERS","classification":"B","division":"OPEN","hit_factor":6.6841},{"match_name":"PPPS 11-13-16","match_date":"2016-11-13","stage_classifiercode":"99-11","member_number":"L2744","first_name":"RICK","last_name":"BITTLE","classification":"B","division":"OPEN","hit_factor":6.6838},{"match_name":"ARPC USPSA Match 8-23-20","match_date":"2020-08-23","stage_classifiercode":"99-11","member_number":"TY93058","first_name":"BRUCE","last_name":"CURRY","classification":"C","division":"OPEN","hit_factor":6.6823},{"match_name":"WSRC USPSA","match_date":"2016-10-22","stage_classifiercode":"99-11","member_number":"A87386","first_name":"MATT","last_name":"OPFER","classification":"C","division":"OPEN","hit_factor":6.6749},{"match_name":"Coyote USPSA match 4-21-18","match_date":"2018-04-21","stage_classifiercode":"99-11","member_number":"a45644","first_name":"TRACY","last_name":"SELF","classification":"B","division":"OPEN","hit_factor":6.6667},{"match_name":"GWPP January 2016 Pistol","match_date":"2016-01-09","stage_classifiercode":"99-11","member_number":"L3738","first_name":"JAY","last_name":"OLMSTEAD","classification":"C","division":"OPEN","hit_factor":6.6667},{"match_name":"OK15 USPSA at USSA May 6th 2018","match_date":"2018-05-06","stage_classifiercode":"99-11","member_number":"A90580","first_name":"JASON","last_name":"SOUPENE","classification":"A","division":"OPEN","hit_factor":6.6667},{"match_name":"MAPSA 2016.04.09","match_date":"2016-04-09","stage_classifiercode":"99-11","member_number":"A90525","first_name":"CHRIS","last_name":"PETERSON","classification":"U","division":"OPEN","hit_factor":6.6593},{"match_name":"LA05 Tangi USPSA 4th Sunday May 2021","match_date":"2021-05-23","stage_classifiercode":"99-11","member_number":"A66934","first_name":"ELIZABETH","last_name":"YOUNG","classification":"C","division":"OPEN","hit_factor":6.6591},{"match_name":"BGS Hudson Week 1","match_date":"2017-11-26","stage_classifiercode":"99-11","member_number":"A105266","first_name":"ERIC","last_name":"FORREST","classification":"B","division":"OPEN","hit_factor":6.6584},{"match_name":"Extreme GM","match_date":"2020-06-12","stage_classifiercode":"99-11","member_number":"A104504","first_name":"LES","last_name":"HERMAN","classification":"C","division":"OPEN","hit_factor":6.6578},{"match_name":"BHPSC 11-20-2020","match_date":"2020-11-21","stage_classifiercode":"99-11","member_number":"TY78821","first_name":"STEVE","last_name":"GIRARD","classification":"C","division":"OPEN","hit_factor":6.657},{"match_name":"Custer USPSA Mar 7th 2021","match_date":"2021-03-07","stage_classifiercode":"99-11","member_number":"A63830","first_name":"DERI","last_name":"HELTERLINE","classification":"C","division":"OPEN","hit_factor":6.6514},{"match_name":"March 2018 USPSA Classifier Special","match_date":"2018-03-17","stage_classifiercode":"99-11","member_number":"F54510","first_name":"LYONEL","last_name":"BAIRD","classification":"\"\"","division":"OPEN","hit_factor":6.6438},{"match_name":"PRG - Oh Shoot USPSA February 21st - 3rd Sunday Match","match_date":"2021-02-21","stage_classifiercode":"99-11","member_number":"Ty110175","first_name":"JASON","last_name":"HURST","classification":"B","division":"OPEN","hit_factor":6.6434},{"match_name":"NCPS USPSA Handgun Match November 27 2016","match_date":"2016-11-27","stage_classifiercode":"99-11","member_number":"A86047","first_name":"RANCE","last_name":"DEL MAR","classification":"C","division":"OPEN","hit_factor":6.6421},{"match_name":"Freeport","match_date":"2018-03-10","stage_classifiercode":"99-11","member_number":"TY83520","first_name":"JAMES C","last_name":"MARQUEZ JR","classification":"C","division":"OPEN","hit_factor":6.6421},{"match_name":"Pharr action shooters USPSA match at Coyote 02-20-16","match_date":"2016-02-20","stage_classifiercode":"99-11","member_number":"A30373","first_name":"TONY","last_name":"DEVEGA","classification":"B","division":"OPEN","hit_factor":6.6416},{"match_name":"RISE INDOOR CLASSIFIER","match_date":"2018-12-15","stage_classifiercode":"99-11","member_number":"A109268","first_name":"ALAIN","last_name":"RMAND","classification":"U","division":"OPEN","hit_factor":6.6416},{"match_name":"ARPC USPSA Match 3-26-17","match_date":"2017-03-26","stage_classifiercode":"99-11","member_number":"TY39965","first_name":"CHITO","last_name":"TAGAYUN","classification":"B","division":"OPEN","hit_factor":6.6401},{"match_name":"CSA Coalfield Shooters Association USPSA March 2020","match_date":"2020-03-08","stage_classifiercode":"99-11","member_number":"\"\"","first_name":"DOUG","last_name":"DEAN","classification":"U","division":"OPEN","hit_factor":6.6356},{"match_name":"NW01 April da Turd","match_date":"2018-04-04","stage_classifiercode":"99-11","member_number":"TY97470","first_name":"DENNIS","last_name":"MAHLE","classification":"C","division":"OPEN","hit_factor":6.6313},{"match_name":"Baps March Uspsa","match_date":"2016-03-19","stage_classifiercode":"99-11","member_number":"FY71894","first_name":"NEAL","last_name":"NANDIN","classification":"C","division":"OPEN","hit_factor":6.6286},{"match_name":"COPS 2015 Missouri Fall Classic","match_date":"2015-10-03","stage_classifiercode":"99-11","member_number":"L2662","first_name":"CHUCK","last_name":"EVELAND","classification":"B","division":"OPEN","hit_factor":6.6279},{"match_name":"Prescott 1 st Saturday 12-03-2016","match_date":"2016-12-03","stage_classifiercode":"99-11","member_number":"A82013","first_name":"ELIJAH","last_name":"SABA","classification":"B","division":"OPEN","hit_factor":6.625},{"match_name":"Ontelaunee USPSA  July 2018","match_date":"2018-07-29","stage_classifiercode":"99-11","member_number":"FY73439","first_name":"CHRIS","last_name":"OLSZEWSKI","classification":"A","division":"OPEN","hit_factor":6.6246},{"match_name":"APSC USPSA 10-06-18","match_date":"2018-10-06","stage_classifiercode":"99-11","member_number":"A34650","first_name":"BRUCE","last_name":"BRITAIN","classification":"B","division":"OPEN","hit_factor":6.6242},{"match_name":"Tangi January 2016 USPSA","match_date":"2016-01-23","stage_classifiercode":"99-11","member_number":"ty63531","first_name":"CHARLES","last_name":"ALEXANDER","classification":"B","division":"OPEN","hit_factor":6.6234},{"match_name":"PRG - Oh Shoot USPSA February 21st - 3rd Sunday Match","match_date":"2021-02-21","stage_classifiercode":"99-11","member_number":"Fy84506","first_name":"MARC","last_name":"BARBANI","classification":"C","division":"OPEN","hit_factor":6.6225},{"match_name":"LCHG September 2018 USPSA Special Classifier","match_date":"2018-09-08","stage_classifiercode":"99-11","member_number":"A104679","first_name":"LUKE","last_name":"ARCHER","classification":"C","division":"OPEN","hit_factor":6.6216},{"match_name":"BA USPSA Jun 17-2017","match_date":"2017-06-11","stage_classifiercode":"99-11","member_number":"L1780","first_name":"BJ","last_name":"RATLIFF","classification":"A","division":"OPEN","hit_factor":6.6216},{"match_name":"CSA Coalfield Shooters Association USPSA March 2020","match_date":"2020-03-08","stage_classifiercode":"99-11","member_number":"TY104241","first_name":"DAVID","last_name":"BOWEN","classification":"A","division":"OPEN","hit_factor":6.6214},{"match_name":"Bills Baxter 12-10-20","match_date":"2020-12-11","stage_classifiercode":"99-11","member_number":"A116443","first_name":"DANIEL","last_name":"BREMNER","classification":"U","division":"OPEN","hit_factor":6.6194},{"match_name":"TAP USPSA Pistol Match Aug 14 2016","match_date":"2016-08-14","stage_classifiercode":"99-11","member_number":"A51918","first_name":"TIM","last_name":"BOFMAN","classification":"A","division":"OPEN","hit_factor":6.619},{"match_name":"CSoS Feb2016 Match","match_date":"2016-02-21","stage_classifiercode":"99-11","member_number":"ty74794","first_name":"SKIP","last_name":"POPE","classification":"C","division":"OPEN","hit_factor":6.6138},{"match_name":"SFPC Aug 8 2021 USPSA Classifier match","match_date":"2021-08-08","stage_classifiercode":"99-11","member_number":"A123950","first_name":"CHAD","last_name":"BAGINSKI","classification":"C","division":"OPEN","hit_factor":6.6125},{"match_name":"Baps March Uspsa","match_date":"2016-03-19","stage_classifiercode":"99-11","member_number":"TY68938","first_name":"ALBERT","last_name":"ATMOSFERA","classification":"C","division":"OPEN","hit_factor":6.6116},{"match_name":"TMGN USPSA March 2nd Pistol Match","match_date":"2017-03-03","stage_classifiercode":"99-11","member_number":"A100231","first_name":"JEREMY","last_name":"HAINES","classification":"C","division":"OPEN","hit_factor":6.6106},{"match_name":"USPSA MO21 2Alpha SBRC March 2018","match_date":"2018-03-24","stage_classifiercode":"99-11","member_number":"A102464","first_name":"COLE","last_name":"HUFFMAN","classification":"B","division":"OPEN","hit_factor":6.6087},{"match_name":"APSC USPSA 02-15-20","match_date":"2020-02-15","stage_classifiercode":"99-11","member_number":"TY16471","first_name":"GREG","last_name":"PEINE","classification":"M","division":"OPEN","hit_factor":6.6069},{"match_name":"RDS USPSA 8.13.16","match_date":"2016-08-13","stage_classifiercode":"99-11","member_number":"FY34677","first_name":"DALE","last_name":"PANKRATZ","classification":"C","division":"OPEN","hit_factor":6.5963},{"match_name":"CBS USPSA Mar  2018","match_date":"2018-03-21","stage_classifiercode":"99-11","member_number":"L3399","first_name":"JIM","last_name":"SHAMESS","classification":"C","division":"OPEN","hit_factor":6.5947},{"match_name":"Klamath USPSA 06/05/16 JSPS OR09","match_date":"2016-06-05","stage_classifiercode":"99-11","member_number":"A63155","first_name":"CHARLIE","last_name":"HALVORSEN","classification":"C","division":"OPEN","hit_factor":6.5934},{"match_name":"SFPC Oct 3 2021   USPSA Monthly Match","match_date":"2021-10-03","stage_classifiercode":"99-11","member_number":"A123950","first_name":"CHAD","last_name":"BAGINSKI","classification":"C","division":"OPEN","hit_factor":6.5934},{"match_name":"North Mountain PS April","match_date":"2016-04-15","stage_classifiercode":"99-11","member_number":"A82592","first_name":"THOMAS","last_name":"KOH 2","classification":"A","division":"OPEN","hit_factor":6.5878},{"match_name":"LIPSA -  April 17th 2016 - USPSA Special Classifier Match","match_date":"2016-04-17","stage_classifiercode":"99-11","member_number":"Ty90280","first_name":"ANTHONY","last_name":"BRUNO","classification":"C","division":"OPEN","hit_factor":6.5876},{"match_name":"BPSA January 2017 USPSA","match_date":"2017-01-22","stage_classifiercode":"99-11","member_number":"A69732","first_name":"GERALD","last_name":"FORBES","classification":"C","division":"OPEN","hit_factor":6.5876},{"match_name":"BPSA January 2017 USPSA","match_date":"2017-01-22","stage_classifiercode":"99-11","member_number":"TY82660","first_name":"GERALD","last_name":"PATCH","classification":"C","division":"OPEN","hit_factor":6.5868},{"match_name":"LIPSA -  April 17th 2016 - USPSA Special Classifier Match","match_date":"2016-04-17","stage_classifiercode":"99-11","member_number":"L2939","first_name":"MATT","last_name":"MCMAHON","classification":"A","division":"OPEN","hit_factor":6.5854},{"match_name":"Rio Salado Hosemasters February 2021","match_date":"2021-02-27","stage_classifiercode":"99-11","member_number":"TY114245","first_name":"EUGENE","last_name":"OH","classification":"B","division":"OPEN","hit_factor":6.582},{"match_name":"ARPC USPSA Match Sept 27 2015","match_date":"2015-09-27","stage_classifiercode":"99-11","member_number":"Fy53427","first_name":"TONY","last_name":"FRIEDRICH","classification":"B","division":"OPEN","hit_factor":6.5811},{"match_name":"Emmett July Match","match_date":"2017-07-21","stage_classifiercode":"99-11","member_number":"A84438","first_name":"TYSON","last_name":"DIXON","classification":"B","division":"OPEN","hit_factor":6.5806},{"match_name":"PRG 2017 Classifier Match","match_date":"2017-02-19","stage_classifiercode":"99-11","member_number":"L4112","first_name":"JAY","last_name":"HU","classification":"U","division":"OPEN","hit_factor":6.5789},{"match_name":"Richmond Hot Shots October 6-7 USPSA Pistol Match","match_date":"2018-10-06","stage_classifiercode":"99-11","member_number":"A88607","first_name":"FRANCO","last_name":"GESMUNDO","classification":"A","division":"OPEN","hit_factor":6.5789},{"match_name":"IN19 ACC USPSA September 23","match_date":"2018-09-23","stage_classifiercode":"99-11","member_number":"Ty86867","first_name":"ANDREW","last_name":"HEATH","classification":"M","division":"OPEN","hit_factor":6.5789},{"match_name":"Swamp Eagles 2015-12","match_date":"2015-12-20","stage_classifiercode":"99-11","member_number":"A81207","first_name":"CECIL","last_name":"JANISE","classification":"C","division":"OPEN","hit_factor":6.5744},{"match_name":"SFPC Aug 8 2021 USPSA Classifier match","match_date":"2021-08-08","stage_classifiercode":"99-11","member_number":"A105315","first_name":"DOG GIANCARLO","last_name":"PELOSI","classification":"C","division":"OPEN","hit_factor":6.5685},{"match_name":"LdF USPSA Match May 12 2018","match_date":"2018-05-12","stage_classifiercode":"99-11","member_number":"FY51774","first_name":"ED","last_name":"CHINCHILLA","classification":"M","division":"OPEN","hit_factor":6.5657},{"match_name":"ENPS December 2020 USPSA Match","match_date":"2020-12-06","stage_classifiercode":"99-11","member_number":"A104318","first_name":"JIM","last_name":"HOLTMEYER","classification":"U","division":"OPEN","hit_factor":6.5651},{"match_name":"Triforce Practical Shooters at BigWoodsGoods 11-30-17","match_date":"2017-12-01","stage_classifiercode":"99-11","member_number":"A104844","first_name":"EDWIN","last_name":"CARILAO","classification":"C","division":"OPEN","hit_factor":6.5651},{"match_name":"EAPS July 2017 USPSA","match_date":"2017-07-16","stage_classifiercode":"99-11","member_number":"L714","first_name":"LLOYD","last_name":"LANDRY","classification":"B","division":"OPEN","hit_factor":6.5632},{"match_name":"Total Defense 3-7-18 Points Series 4","match_date":"2018-03-07","stage_classifiercode":"99-11","member_number":"A100450","first_name":"MARK","last_name":"TUTILA","classification":"C","division":"OPEN","hit_factor":6.5617},{"match_name":"MSSA USPSA June  10 2017","match_date":"2017-06-10","stage_classifiercode":"99-11","member_number":"FY19950","first_name":"JOHN","last_name":"KELLER","classification":"M","division":"OPEN","hit_factor":6.5611},{"match_name":"RSPP 3rd Saturday November 2016","match_date":"2016-11-19","stage_classifiercode":"99-11","member_number":"A85802","first_name":"RANDY","last_name":"CKER","classification":"C","division":"OPEN","hit_factor":6.5594},{"match_name":"Richmond Hot Shots October 6-7 USPSA Pistol Match","match_date":"2018-10-06","stage_classifiercode":"99-11","member_number":"L3995","first_name":"VINCENT I","last_name":"SARGENTINI","classification":"B","division":"OPEN","hit_factor":6.5554},{"match_name":"MS06 Team Magnolia USPSA Sept Match","match_date":"2015-09-06","stage_classifiercode":"99-11","member_number":"A84392","first_name":"JAMES","last_name":"TEDFORD","classification":"C","division":"OPEN","hit_factor":6.5513},{"match_name":"MSSA USPSA June  10 2017","match_date":"2017-06-10","stage_classifiercode":"99-11","member_number":"\"\"","first_name":"BOB","last_name":"DUBOIS","classification":"B","division":"OPEN","hit_factor":6.5483},{"match_name":"Ontelaunee USPSA Hose Fest","match_date":"2021-01-02","stage_classifiercode":"99-11","member_number":"A115130","first_name":"JOSHUA","last_name":"TUKAY","classification":"D","division":"OPEN","hit_factor":6.5463},{"match_name":"CGGR July USPSA Match","match_date":"2018-07-21","stage_classifiercode":"99-11","member_number":"A99924","first_name":"CLAYTON","last_name":"RUTAN","classification":"D","division":"OPEN","hit_factor":6.5455},{"match_name":"November 2016 PCSI USPSA Monster Match","match_date":"2016-11-05","stage_classifiercode":"99-11","member_number":"TY80623","first_name":"TODD","last_name":"DEVORE","classification":"B","division":"OPEN","hit_factor":6.5449},{"match_name":"Shot Through The Heart Classifiers","match_date":"2018-02-04","stage_classifiercode":"99-11","member_number":"A16788","first_name":"RANDY","last_name":"JANOLINO","classification":"A","division":"OPEN","hit_factor":6.5445},{"match_name":"Square Deal Sportsmen September USPSA match","match_date":"2018-09-02","stage_classifiercode":"99-11","member_number":"a87550","first_name":"KARINA","last_name":"DRAGHI","classification":"B","division":"OPEN","hit_factor":6.5432},{"match_name":"HPS March 2020 Club Fun Match","match_date":"2020-03-07","stage_classifiercode":"99-11","member_number":"FY66771","first_name":"ORLINO","last_name":"CARDENAS","classification":"C","division":"OPEN","hit_factor":6.5398},{"match_name":"Deadwood Boys USPSA All Classifier Match","match_date":"2016-08-07","stage_classifiercode":"99-11","member_number":"A96151","first_name":"RUSSEL","last_name":"CURTIS","classification":"U","division":"OPEN","hit_factor":6.5385},{"match_name":"10-04-2015 USPSA","match_date":"2015-10-02","stage_classifiercode":"99-11","member_number":"A18878","first_name":"ED","last_name":"NIELSEN","classification":"B","division":"OPEN","hit_factor":6.5367},{"match_name":"Springfield Tactical Shooters 05/06/2021","match_date":"2021-05-06","stage_classifiercode":"99-11","member_number":"FY95946","first_name":"PAUL","last_name":"EMERY","classification":"B","division":"OPEN","hit_factor":6.5351},{"match_name":"2017 Bay bridge Charity Classic - Richmond October 14-15-2017","match_date":"2017-10-14","stage_classifiercode":"99-11","member_number":"TY79621","first_name":"STEPHEN","last_name":"COLLEN","classification":"C","division":"OPEN","hit_factor":6.535},{"match_name":"TCGC September 2020","match_date":"2020-09-24","stage_classifiercode":"99-11","member_number":"A107205","first_name":"BRIAN","last_name":"GROVER","classification":"B","division":"OPEN","hit_factor":6.5327},{"match_name":"LIPSA -  April 17th 2016 - USPSA Special Classifier Match","match_date":"2016-04-17","stage_classifiercode":"99-11","member_number":"L2939","first_name":"MATT","last_name":"MCMAHON","classification":"U","division":"OPEN","hit_factor":6.5306},{"match_name":"Baps March Uspsa","match_date":"2016-03-19","stage_classifiercode":"99-11","member_number":"PEN","first_name":"DANNY","last_name":"NARAMORE","classification":"U","division":"OPEN","hit_factor":6.5268},{"match_name":"Pardoe Sportsmens Association- USPSA Saturday 4-3-21","match_date":"2021-04-03","stage_classifiercode":"99-11","member_number":"ty84357","first_name":"RAY","last_name":"DONCH","classification":"B","division":"OPEN","hit_factor":6.5243},{"match_name":"Dundee Practical Shooters - Single Stack Challenge - Jan 23 2021","match_date":"2021-01-23","stage_classifiercode":"99-11","member_number":"L4199","first_name":"JAN","last_name":"MCDONALD","classification":"C","division":"OPEN","hit_factor":6.5217},{"match_name":"SFPS 8-5-18 USPSA Match","match_date":"2018-08-05","stage_classifiercode":"99-11","member_number":"TY72577","first_name":"RANDY","last_name":"BALLARD","classification":"B","division":"OPEN","hit_factor":6.5189},{"match_name":"2017 Bay bridge Charity Classic - Richmond October 14-15-2017","match_date":"2017-10-14","stage_classifiercode":"99-11","member_number":"A80595","first_name":"EDGAR","last_name":"ALLAS","classification":"C","division":"OPEN","hit_factor":6.5189},{"match_name":"LCSA USPSA March Match","match_date":"2016-03-12","stage_classifiercode":"99-11","member_number":"A78253","first_name":"NICK","last_name":"CHEN","classification":"U","division":"OPEN","hit_factor":6.5185},{"match_name":"Payson Practical Pistol - Action Shooting - 2017 12 28","match_date":"2017-12-28","stage_classifiercode":"99-11","member_number":"TY61820","first_name":"MICHAEL","last_name":"MCCRITE","classification":"C","division":"OPEN","hit_factor":6.5156},{"match_name":"Douglas Ridge USPSA March 7","match_date":"2020-03-07","stage_classifiercode":"99-11","member_number":"TY45892","first_name":"RICHARD","last_name":"BROWNING","classification":"B","division":"OPEN","hit_factor":6.5139},{"match_name":"Extreme GM USPSA  November","match_date":"2020-11-27","stage_classifiercode":"99-11","member_number":"A104504","first_name":"LES","last_name":"HERMAN","classification":"C","division":"OPEN","hit_factor":6.5129},{"match_name":"ISPS 6/19/2016 USPSA","match_date":"2016-06-19","stage_classifiercode":"99-11","member_number":"TY30712","first_name":"DENNIS","last_name":"WILSON","classification":"B","division":"OPEN","hit_factor":6.5116},{"match_name":"CRCPS 2020-08-08","match_date":"2020-08-08","stage_classifiercode":"99-11","member_number":"L3985","first_name":"FRANK","last_name":"JOHNSON","classification":"C","division":"OPEN","hit_factor":6.5116},{"match_name":"Extreme GM","match_date":"2020-06-12","stage_classifiercode":"99-11","member_number":"A82594","first_name":"JUDY","last_name":"MACKOWSKI","classification":"B","division":"OPEN","hit_factor":6.5111},{"match_name":"OK Corral Action Challenge October","match_date":"2015-10-24","stage_classifiercode":"99-11","member_number":"A83681","first_name":"IAN","last_name":"SOLENDER","classification":"U","division":"OPEN","hit_factor":6.5081},{"match_name":"Extreme GM USPSA  November","match_date":"2020-11-27","stage_classifiercode":"99-11","member_number":"TY27735","first_name":"BOB","last_name":"MILLS","classification":"A","division":"OPEN","hit_factor":6.5076},{"match_name":"Dundee USPSA Feb 2016","match_date":"2016-02-27","stage_classifiercode":"99-11","member_number":"A89438","first_name":"NICHOLAS","last_name":"STOCKWELL","classification":"M","division":"OPEN","hit_factor":6.5056},{"match_name":"TPS USPSA at CMP March 18 2017","match_date":"2017-03-18","stage_classifiercode":"99-11","member_number":"L3273","first_name":"JOEY","last_name":"HARDY","classification":"G","division":"OPEN","hit_factor":6.5053},{"match_name":"Blackstone Shooting Sports November 2016 USPSA Level 1","match_date":"2016-11-08","stage_classifiercode":"99-11","member_number":"A98473","first_name":"TONY","last_name":"MOFFRE","classification":"D","division":"OPEN","hit_factor":6.5041},{"match_name":"SLOSA NOVEMBER 2017 USPSA MATCH","match_date":"2017-11-11","stage_classifiercode":"99-11","member_number":"TY87139","first_name":"EFREN","last_name":"CABREROS","classification":"B","division":"OPEN","hit_factor":6.4978},{"match_name":"BSPSC 2017 April Special Classifier","match_date":"2017-04-09","stage_classifiercode":"99-11","member_number":"A28492","first_name":"DAVE","last_name":"MARCIN","classification":"C","division":"OPEN","hit_factor":6.495},{"match_name":"ANPRACS USPSA 2-1-20","match_date":"2020-02-01","stage_classifiercode":"99-11","member_number":"A116039","first_name":"JESSE","last_name":"FLIRIS","classification":"D","division":"OPEN","hit_factor":6.4935},{"match_name":"Griffin USPSA Match Dec 2017","match_date":"2017-12-16","stage_classifiercode":"99-11","member_number":"A20840","first_name":"CHARLES","last_name":"FERREE","classification":"A","division":"OPEN","hit_factor":6.4912},{"match_name":"MPPL 08052018 Summer Fun","match_date":"2018-08-05","stage_classifiercode":"99-11","member_number":"FY26350","first_name":"ZUMEL","last_name":"AGUILAR","classification":"\"\"","division":"OPEN","hit_factor":6.4901},{"match_name":"FSA USPSA 12/16/2018 WI 22","match_date":"2018-12-16","stage_classifiercode":"99-11","member_number":"L4071","first_name":"RAY","last_name":"FEGER","classification":"C","division":"OPEN","hit_factor":6.4901},{"match_name":"Richmond Boro Gun Club April 2017 USPSA Pistol Match","match_date":"2017-04-08","stage_classifiercode":"99-11","member_number":"L2939","first_name":"MATT","last_name":"MCMAHON","classification":"A","division":"OPEN","hit_factor":6.4901},{"match_name":"GPS.   August  2016 ","match_date":"2016-08-28","stage_classifiercode":"99-11","member_number":"a72378","first_name":"CHEVIRIC","last_name":"JACOT","classification":"C","division":"OPEN","hit_factor":6.4835},{"match_name":"APSC USPSA 02-15-20","match_date":"2020-02-15","stage_classifiercode":"99-11","member_number":"TY85663","first_name":"JASON","last_name":"YU","classification":"B","division":"OPEN","hit_factor":6.483},{"match_name":"SWGC USPSA Pistol Match - November 2021","match_date":"2021-11-06","stage_classifiercode":"99-11","member_number":"A97295","first_name":"CHRIS","last_name":"EWEN","classification":"C","division":"OPEN","hit_factor":6.483},{"match_name":"Rio Salado Hosemasters February 2021","match_date":"2021-02-27","stage_classifiercode":"99-11","member_number":"L1189","first_name":"JOHN","last_name":"LAMARCA","classification":"A","division":"OPEN","hit_factor":6.4773},{"match_name":"MS06 Team Magnolia USPSA Sept Match","match_date":"2015-09-06","stage_classifiercode":"99-11","member_number":"A77783","first_name":"GREG","last_name":"GREENE","classification":"B","division":"OPEN","hit_factor":6.4764},{"match_name":"LIPSA  December 11th 2016 - USPSA Match","match_date":"2016-12-11","stage_classifiercode":"99-11","member_number":"TY80361","first_name":"PHIL","last_name":"PIAZZA","classification":"C","division":"OPEN","hit_factor":6.4759},{"match_name":"BORCC USPSA August 2017","match_date":"2017-08-27","stage_classifiercode":"99-11","member_number":"A90859","first_name":"TERRY","last_name":"FLOWERS","classification":"C","division":"OPEN","hit_factor":6.4757},{"match_name":"North Lawrence Fish and Game 10-20-18","match_date":"2018-10-20","stage_classifiercode":"99-11","member_number":"A90421","first_name":"DON","last_name":"BATES","classification":"C","division":"OPEN","hit_factor":6.4721},{"match_name":"HAS Classifier Match January 2020","match_date":"2020-01-15","stage_classifiercode":"99-11","member_number":"TY79508","first_name":"SHANE","last_name":"FUNGAFAT","classification":"A","division":"OPEN","hit_factor":6.4721},{"match_name":"NW01 Paul Bunyan CS Series May 9 2021","match_date":"2021-05-09","stage_classifiercode":"99-11","member_number":"A83018","first_name":"RAE ARSEN","last_name":"BALEROS","classification":"B","division":"OPEN","hit_factor":6.4677},{"match_name":"GRPC USPSA TAX REFUND ","match_date":"2018-04-15","stage_classifiercode":"99-11","member_number":"TY40226","first_name":"BRIAN","last_name":"WHELIHAN","classification":"A","division":"OPEN","hit_factor":6.4671},{"match_name":"MCPSL Pistol 8-12-17","match_date":"2017-08-12","stage_classifiercode":"99-11","member_number":"TY15566","first_name":"KEN","last_name":"RICKEY","classification":"C","division":"OPEN","hit_factor":6.4644},{"match_name":"Pitcairn-Monroeville Sportsmens Club USPSA August 2017","match_date":"2017-08-05","stage_classifiercode":"99-11","member_number":"a99541","first_name":"WADE","last_name":"SHANER","classification":"U","division":"OPEN","hit_factor":6.463},{"match_name":"Granby Action Shooters Oct 2016","match_date":"2016-10-02","stage_classifiercode":"99-11","member_number":"A34817","first_name":"DAN","last_name":"DIGIOVINE","classification":"A","division":"OPEN","hit_factor":6.463},{"match_name":"Dundee USPSA Feb 2016","match_date":"2016-02-27","stage_classifiercode":"99-11","member_number":"TY57679","first_name":"KEN","last_name":"KING","classification":"C","division":"OPEN","hit_factor":6.4603},{"match_name":"MSSA USPSA June  10 2017","match_date":"2017-06-10","stage_classifiercode":"99-11","member_number":"TY34082","first_name":"ADELO","last_name":"AQUINO","classification":"A","division":"OPEN","hit_factor":6.4603},{"match_name":"ARPC USPSA Match 3-26-17","match_date":"2017-03-26","stage_classifiercode":"99-11","member_number":"TY13859","first_name":"FRANK","last_name":"OBARR","classification":"B","division":"OPEN","hit_factor":6.4593},{"match_name":"SKSC USPSA April 2018 Match","match_date":"2018-04-21","stage_classifiercode":"99-11","member_number":"\"\"","first_name":"NICK","last_name":"TAPE","classification":"\"\"","division":"OPEN","hit_factor":6.4516},{"match_name":"CFRPC December USPSA (Classifier)","match_date":"2018-12-16","stage_classifiercode":"99-11","member_number":"TY79474","first_name":"JOSE","last_name":"ORTIZ","classification":"U","division":"OPEN","hit_factor":6.4516},{"match_name":"Deadwood Boys USPSA All Classifier Match - 29 July 2018","match_date":"2018-07-29","stage_classifiercode":"99-11","member_number":"A107066","first_name":"STEVE","last_name":"SVEJDA","classification":"U","division":"OPEN","hit_factor":6.4516},{"match_name":"NCPS USPSA Handgun Match November 27 2016","match_date":"2016-11-27","stage_classifiercode":"99-11","member_number":"TY33484","first_name":"CARLOS","last_name":"KATALBAS","classification":"G","division":"OPEN","hit_factor":6.4516},{"match_name":"Rio Salado RSPP 3rd Saturday February 2020","match_date":"2020-02-15","stage_classifiercode":"99-11","member_number":"A100726","first_name":"DOMINIC","last_name":"NAPOLITANO","classification":"B","division":"OPEN","hit_factor":6.4477},{"match_name":"EWPSA 2016-04","match_date":"2016-04-17","stage_classifiercode":"99-11","member_number":"A67259","first_name":"CHAD","last_name":"SHUMAN","classification":"C","division":"OPEN","hit_factor":6.4477},{"match_name":"Grandbaggers August 2017","match_date":"2017-08-03","stage_classifiercode":"99-11","member_number":"A91055","first_name":"BOB","last_name":"WAGNER","classification":"B","division":"OPEN","hit_factor":6.4474},{"match_name":"RDS USPSA 8.13.16","match_date":"2016-08-13","stage_classifiercode":"99-11","member_number":"TY92057","first_name":"CAMERON","last_name":"DASSO","classification":"C","division":"OPEN","hit_factor":6.443},{"match_name":"Ontelaunee USPSA  July 2018","match_date":"2018-07-29","stage_classifiercode":"99-11","member_number":"TY85379","first_name":"JOSEPH","last_name":"TOLENO","classification":"M","division":"OPEN","hit_factor":6.4407},{"match_name":"Pelham USPSA 2016-09-18","match_date":"2016-09-18","stage_classifiercode":"99-11","member_number":"TY43644","first_name":"JEFFREY","last_name":"BRENNAN","classification":"C","division":"OPEN","hit_factor":6.4403},{"match_name":"BA USPSA Sep  23/2017","match_date":"2017-09-23","stage_classifiercode":"99-11","member_number":"A103689","first_name":"BOBBY","last_name":"LEWIS","classification":"C","division":"OPEN","hit_factor":6.4371},{"match_name":"MCAS March 2018 USPSA","match_date":"2018-03-17","stage_classifiercode":"99-11","member_number":"L3916","first_name":"TAMI","last_name":"WAITE","classification":"B","division":"OPEN","hit_factor":6.4368},{"match_name":"LPRGC-Lower Providence USPSA May-1 2017","match_date":"2017-05-05","stage_classifiercode":"99-11","member_number":"A82014","first_name":"TONY","last_name":"SPINILLO","classification":"B","division":"OPEN","hit_factor":6.4362},{"match_name":"2016-02-06 USPSA at Phoenix Rod and Gun Club","match_date":"2016-02-06","stage_classifiercode":"99-11","member_number":"a89169","first_name":"PHIL","last_name":"GRUBBS","classification":"C","division":"OPEN","hit_factor":6.4362},{"match_name":"LCSA  USPSA April 2017","match_date":"2017-04-08","stage_classifiercode":"99-11","member_number":"ty81249","first_name":"MILLER","last_name":"BRIAN","classification":"B","division":"OPEN","hit_factor":6.4327},{"match_name":"Wvpps Nov. 2016","match_date":"2016-11-20","stage_classifiercode":"99-11","member_number":"\"\"","first_name":"WAHJU","last_name":"TAMAELA","classification":"\"\"","division":"OPEN","hit_factor":6.4304},{"match_name":"Lefthanders Gun Club Practical Shooters October","match_date":"2017-09-30","stage_classifiercode":"99-11","member_number":"TY60499","first_name":"TOM","last_name":"CASH","classification":"B","division":"OPEN","hit_factor":6.4294},{"match_name":"Pitcairn-Monroeville Sportsmens Club USPSA August 2017","match_date":"2017-08-05","stage_classifiercode":"99-11","member_number":"ty104312","first_name":"CHRIS","last_name":"HAMMOND","classification":"U","division":"OPEN","hit_factor":6.4286},{"match_name":"Granby Action Shooters Oct 2016","match_date":"2016-10-02","stage_classifiercode":"99-11","member_number":"L1876","first_name":"SIMEON","last_name":"GOUROUSIS","classification":"B","division":"OPEN","hit_factor":6.4277},{"match_name":"MPPL 11042018 Hoser Heaven","match_date":"2018-11-04","stage_classifiercode":"99-11","member_number":"TY92048","first_name":"HAROLD","last_name":"DOMINGO","classification":"C","division":"OPEN","hit_factor":6.4262},{"match_name":"Grandbaggers August 2017","match_date":"2017-08-03","stage_classifiercode":"99-11","member_number":"A34501","first_name":"RON","last_name":"FUCHS","classification":"U","division":"OPEN","hit_factor":6.4257},{"match_name":"Ontelaunee USPSA Hose Fest","match_date":"2021-01-02","stage_classifiercode":"99-11","member_number":"TY117640","first_name":"CARL","last_name":"ANDERSON JR","classification":"B","division":"OPEN","hit_factor":6.423},{"match_name":"SFPS 8-5-18 USPSA Match","match_date":"2018-08-05","stage_classifiercode":"99-11","member_number":"TY109377","first_name":"STEVE","last_name":"PORTER","classification":"U","division":"OPEN","hit_factor":6.422},{"match_name":"CFRPC April USPSA Match","match_date":"2018-04-15","stage_classifiercode":"99-11","member_number":"TY106297","first_name":"JAMES","last_name":"BELL","classification":"C","division":"OPEN","hit_factor":6.4198},{"match_name":"APSC 4th Annual Holiday Hosefest USPSA Match 12-02-17","match_date":"2017-12-02","stage_classifiercode":"99-11","member_number":"A12134","first_name":"PAUL","last_name":"PAYNE","classification":"C","division":"OPEN","hit_factor":6.4177},{"match_name":"SB Action Pistol Match Classifier","match_date":"2017-12-14","stage_classifiercode":"99-11","member_number":"L4355","first_name":"JEFF","last_name":"PINKERTON","classification":"\"\"","division":"OPEN","hit_factor":6.4177},{"match_name":"Range 54 USPSA","match_date":"2017-03-10","stage_classifiercode":"99-11","member_number":"A20044","first_name":"JIM","last_name":"MÅ¸ERS","classification":"U","division":"OPEN","hit_factor":6.4171},{"match_name":"Baileys April 2016","match_date":"2016-04-03","stage_classifiercode":"99-11","member_number":"L3738","first_name":"JAY","last_name":"OLMSTEAD","classification":"C","division":"OPEN","hit_factor":6.4118},{"match_name":"WGC April 2017 USPSA","match_date":"2017-04-23","stage_classifiercode":"99-11","member_number":"L3696","first_name":"ROBERT","last_name":"HALSELL","classification":"A","division":"OPEN","hit_factor":6.4103},{"match_name":"TriggerGuard USPSA Classifier Match","match_date":"2018-03-24","stage_classifiercode":"99-11","member_number":"l1224","first_name":"BILL","last_name":"GEE","classification":"M","division":"OPEN","hit_factor":6.407},{"match_name":"GLSRC Action Pistol 3-20-18","match_date":"2018-03-18","stage_classifiercode":"99-11","member_number":"\"\"","first_name":"JOSH","last_name":"GARDINER","classification":"U","division":"OPEN","hit_factor":6.4057},{"match_name":"SCCCNOVEMBER2016","match_date":"2016-11-13","stage_classifiercode":"99-11","member_number":"\"\"","first_name":"WAHJU","last_name":"TAMAELA","classification":"U","division":"OPEN","hit_factor":6.4045},{"match_name":"NHRPC - March 2021 USPSA","match_date":"2021-03-14","stage_classifiercode":"99-11","member_number":"TY106050","first_name":"COREY","last_name":"MULHOLLAND","classification":"B","division":"OPEN","hit_factor":6.4039},{"match_name":"TriggerGuard USPSA","match_date":"2016-10-01","stage_classifiercode":"99-11","member_number":"A53547","first_name":"ARIEL","last_name":"NIXON","classification":"U","division":"OPEN","hit_factor":6.4028},{"match_name":"MAPSA 2016.04.09","match_date":"2016-04-09","stage_classifiercode":"99-11","member_number":"L2789","first_name":"BILL","last_name":"MCCARTY","classification":"C","division":"OPEN","hit_factor":6.4018},{"match_name":"BUAS December Match","match_date":"2016-12-11","stage_classifiercode":"99-11","member_number":"A39028","first_name":"JOHN","last_name":"SARDINA","classification":"M","division":"OPEN","hit_factor":6.4014},{"match_name":"Rankin field Sunday match Clone","match_date":"2016-07-17","stage_classifiercode":"99-11","member_number":"A88732","first_name":"\"THI \"\"TIGER\"\"\"","last_name":"NGUYEN","classification":"A","division":"OPEN","hit_factor":6.4011},{"match_name":"Skills 116 Rounds","match_date":"2016-07-09","stage_classifiercode":"99-11","member_number":"\"\"","first_name":"JAMES","last_name":"LOFTON","classification":"\"\"","division":"OPEN","hit_factor":6.3988},{"match_name":"West Coast IPSC","match_date":"2018-07-22","stage_classifiercode":"99-11","member_number":"FY77491","first_name":"TODD","last_name":"MAO","classification":"B","division":"OPEN","hit_factor":6.3898},{"match_name":"Rio Salado Hosemasters February 2021","match_date":"2021-02-27","stage_classifiercode":"99-11","member_number":"FL3478","first_name":"FRANK","last_name":"KOCH","classification":"M","division":"OPEN","hit_factor":6.3893},{"match_name":"Hopkinton June  2016","match_date":"2016-06-04","stage_classifiercode":"99-11","member_number":"A36777","first_name":"GREGORY","last_name":"STUDLEY","classification":"B","division":"OPEN","hit_factor":6.3879},{"match_name":"COPS 2015 Missouri Fall Classic","match_date":"2015-10-03","stage_classifiercode":"99-11","member_number":"A85988","first_name":"TYLER","last_name":"HILL","classification":"Unclassified","division":"OPEN","hit_factor":6.3857},{"match_name":"BHPSC Monthy World Championship 12-29-2017","match_date":"2017-12-30","stage_classifiercode":"99-11","member_number":"FY72619","first_name":"JIM","last_name":"THOMAS","classification":"C","division":"OPEN","hit_factor":6.3805},{"match_name":"Rio Salado UPPL September 2020","match_date":"2020-09-13","stage_classifiercode":"99-11","member_number":"L4468","first_name":"RAYMOND","last_name":"ENG","classification":"A","division":"OPEN","hit_factor":6.3796},{"match_name":"NRF 2021-09 USPSA","match_date":"2021-09-04","stage_classifiercode":"99-11","member_number":"TY76693","first_name":"LEE","last_name":"FRAISER","classification":"B","division":"OPEN","hit_factor":6.3768},{"match_name":"CCG 5-29-16","match_date":"2016-05-29","stage_classifiercode":"99-11","member_number":"A49558","first_name":"JOHN","last_name":"ARENAS","classification":"M","division":"OPEN","hit_factor":6.3752},{"match_name":"Richmond Hot Shots October 6-7 USPSA Pistol Match","match_date":"2018-10-06","stage_classifiercode":"99-11","member_number":"A84617","first_name":"MIKE","last_name":"FINEZA","classification":"B","division":"OPEN","hit_factor":6.3683},{"match_name":"PPS USPSA Classifiers 2018-05-01","match_date":"2018-05-02","stage_classifiercode":"99-11","member_number":"TY78821","first_name":"STEVE","last_name":"GIRARD","classification":"C","division":"OPEN","hit_factor":6.3647},{"match_name":"Griffin USPSA Match Dec 2017","match_date":"2017-12-16","stage_classifiercode":"99-11","member_number":"A38371","first_name":"TERRY","last_name":"CHENEY","classification":"B","division":"OPEN","hit_factor":6.3647},{"match_name":"WSRC USPSA","match_date":"2016-10-22","stage_classifiercode":"99-11","member_number":"TY80998","first_name":"JIM","last_name":"ROTHBARTH","classification":"C","division":"OPEN","hit_factor":6.3616},{"match_name":"Lafayette Practical Shooters - WED-THUR - Dec 19-20 - CLASSIFIER MATCH","match_date":"2018-12-20","stage_classifiercode":"99-11","member_number":"L3707","first_name":"WOODY","last_name":"LANDRY","classification":"A","division":"OPEN","hit_factor":6.3551},{"match_name":"AGC_20151206","match_date":"2015-12-06","stage_classifiercode":"99-11","member_number":"TY5392","first_name":"ROGER","last_name":"BRIDEN","classification":"B","division":"OPEN","hit_factor":6.3545},{"match_name":"MAPSA 2016.04.09","match_date":"2016-04-09","stage_classifiercode":"99-11","member_number":"TY29847","first_name":"ROSS","last_name":"ROSENBERG","classification":"A","division":"OPEN","hit_factor":6.354},{"match_name":"OREGON ARPC CC05 USPSA AUGUST 12 2017","match_date":"2017-08-12","stage_classifiercode":"99-11","member_number":"L4198","first_name":"JAN","last_name":"MCDONALD","classification":"C","division":"OPEN","hit_factor":6.3536},{"match_name":"WVPPS May 2021","match_date":"2021-05-16","stage_classifiercode":"99-11","member_number":"A108362","first_name":"SCOTT","last_name":"SASSER","classification":"U","division":"OPEN","hit_factor":6.3512},{"match_name":"BPSA January 2017 USPSA","match_date":"2017-01-22","stage_classifiercode":"99-11","member_number":"TY76693","first_name":"LEE","last_name":"FRAISER","classification":"U","division":"OPEN","hit_factor":6.3492},{"match_name":"Crooked Creek Pistol League - June 2016","match_date":"2016-06-25","stage_classifiercode":"99-11","member_number":"A7695","first_name":"ANDREW","last_name":"DIBARTOLOMEO","classification":"C","division":"OPEN","hit_factor":6.3472},{"match_name":"LA05 Tangi USPSA 4th Sunday May 2021","match_date":"2021-05-23","stage_classifiercode":"99-11","member_number":"L4343","first_name":"EDWARD M.","last_name":"LISTER","classification":"C","division":"OPEN","hit_factor":6.3472},{"match_name":"Brothers N Arms April 2016 USPSA Match (22Apr16-08:54:02)","match_date":"2016-04-23","stage_classifiercode":"99-11","member_number":"A-89768","first_name":"WILLIAM","last_name":"THOMAS","classification":"U","division":"OPEN","hit_factor":6.3388},{"match_name":"ORPCI USPSA Saturday 2021.07.17","match_date":"2021-07-17","stage_classifiercode":"99-11","member_number":"A120720","first_name":"SAMUEL","last_name":"BUNNELL","classification":"","division":"OPEN","hit_factor":6.338},{"match_name":"Rankin Field Sunday USPSA","match_date":"2018-04-15","stage_classifiercode":"99-11","member_number":"FY80861","first_name":"DAVE (OPEN)","last_name":"MAYEDA","classification":"U","division":"OPEN","hit_factor":6.3364},{"match_name":"Deadwood Boys USPSA All Classifier Match - 29 July 2018","match_date":"2018-07-29","stage_classifiercode":"99-11","member_number":"A102749","first_name":"ASHLEY","last_name":"YAMAMOTO","classification":"C","division":"OPEN","hit_factor":6.3321},{"match_name":"Chillicothe February 2021 USPSA Match","match_date":"2021-02-28","stage_classifiercode":"99-11","member_number":"TY72670","first_name":"DALE","last_name":"HARDING","classification":"B","division":"OPEN","hit_factor":6.3321},{"match_name":"Benton Gun Club-USPSA March 25 2018","match_date":"2018-03-25","stage_classifiercode":"99-11","member_number":"\"\"","first_name":"ZACHARIAH","last_name":"WATSON","classification":"U","division":"OPEN","hit_factor":6.3319},{"match_name":"FBURG March Level I USPSA","match_date":"2016-03-06","stage_classifiercode":"99-11","member_number":"A85896","first_name":"JOHN","last_name":"MCQUEEN","classification":"C","division":"OPEN","hit_factor":6.3306},{"match_name":"WVRPC USPSA 1SEPT2018","match_date":"2018-09-01","stage_classifiercode":"99-11","member_number":"\"\"","first_name":"CARTER","last_name":"JONES","classification":"C","division":"OPEN","hit_factor":6.3197},{"match_name":"USPSA-Alberta 2018-01 Indoor Classifier 1","match_date":"2018-02-26","stage_classifiercode":"99-11","member_number":"F88802","first_name":"REESE","last_name":"NOLAN","classification":"U","division":"OPEN","hit_factor":6.3158},{"match_name":"Pinetucky USPSA 06-16-18","match_date":"2018-06-16","stage_classifiercode":"99-11","member_number":"TY93235","first_name":"JENNIFER","last_name":"PETTY","classification":"B","division":"OPEN","hit_factor":6.3131},{"match_name":"Hopkinton June  2016","match_date":"2016-06-04","stage_classifiercode":"99-11","member_number":"TY60000","first_name":"GREG","last_name":"SOUCIE","classification":"A","division":"OPEN","hit_factor":6.3107},{"match_name":"MAPSA 2016.10.08","match_date":"2016-10-08","stage_classifiercode":"99-11","member_number":"L2789","first_name":"BILL","last_name":"MCCARTY","classification":"C","division":"OPEN","hit_factor":6.3095},{"match_name":"Deadwood Boys USPSA All Classifier Match","match_date":"2016-08-07","stage_classifiercode":"99-11","member_number":"A-2581","first_name":"ROSS","last_name":"DEANE","classification":"M","division":"OPEN","hit_factor":6.3063},{"match_name":"BLUE RIDGE ARSENAL July 6 Classifier Match","match_date":"2018-07-06","stage_classifiercode":"99-11","member_number":"A106608","first_name":"JUSTIN","last_name":"HECHINGER","classification":"U","division":"OPEN","hit_factor":6.2972},{"match_name":"Tangi May 2016 USPSA","match_date":"2016-05-29","stage_classifiercode":"99-11","member_number":"TY29304","first_name":"DANIEL","last_name":"HIDALGO","classification":"M","division":"OPEN","hit_factor":6.2925},{"match_name":"WNYPPL August 2017 Classifier Match","match_date":"2017-08-27","stage_classifiercode":"99-11","member_number":"TY32500","first_name":"CARL","last_name":"SCHOENHARDT","classification":"B","division":"OPEN","hit_factor":6.2921},{"match_name":"SCCCNOVEMBER2016","match_date":"2016-11-13","stage_classifiercode":"99-11","member_number":"A29454","first_name":"ALEX","last_name":"LYONS","classification":"B","division":"OPEN","hit_factor":6.291},{"match_name":"SCCCNOVEMBER2016","match_date":"2016-11-13","stage_classifiercode":"99-11","member_number":"A55824","first_name":"JEFF","last_name":"GORDON","classification":"B","division":"OPEN","hit_factor":6.29},{"match_name":"NAAS 03-05-2016","match_date":"2017-03-05","stage_classifiercode":"99-11","member_number":"FY42199","first_name":"BART","last_name":"HARKEY SR","classification":"B","division":"OPEN","hit_factor":6.2864},{"match_name":"RBGC 2017-06-24","match_date":"2017-06-24","stage_classifiercode":"99-11","member_number":"TY57617","first_name":"ERIC","last_name":"DAVIS","classification":"B","division":"OPEN","hit_factor":6.2827},{"match_name":"Ontelaunee USPSA September 2015","match_date":"2015-09-27","stage_classifiercode":"99-11","member_number":"A86765","first_name":"DON","last_name":"STOUT JR","classification":"B","division":"OPEN","hit_factor":6.2827},{"match_name":"USPSA MO21 2Alpha SBRC December 22 2018","match_date":"2018-12-22","stage_classifiercode":"99-11","member_number":"TY108017","first_name":"DONNIE","last_name":"SIMPSON","classification":"C","division":"OPEN","hit_factor":6.2802},{"match_name":"PCPS Classifier and Slot Match Jan 2020","match_date":"2020-01-12","stage_classifiercode":"99-11","member_number":"tyf107192","first_name":"MONTY","last_name":"PETIPAS","classification":"U","division":"OPEN","hit_factor":6.2802},{"match_name":"NHRPC - March 2021 USPSA","match_date":"2021-03-14","stage_classifiercode":"99-11","member_number":"Ty106069","first_name":"ERNESTO","last_name":"FIGUEROA","classification":"C","division":"OPEN","hit_factor":6.2745},{"match_name":"Deadwood Boys USPSA All Classifier Match","match_date":"2016-08-07","stage_classifiercode":"99-11","member_number":"A40050","first_name":"JEFF","last_name":"CHURCH","classification":"B","division":"OPEN","hit_factor":6.2731},{"match_name":"RSPP 3rd Saturday November 2016","match_date":"2016-11-19","stage_classifiercode":"99-11","member_number":"TY68115","first_name":"RAYMOND","last_name":"ENG","classification":"A","division":"OPEN","hit_factor":6.2706},{"match_name":"Ontelaunee USPSA July 2016","match_date":"2016-07-23","stage_classifiercode":"99-11","member_number":"L2939","first_name":"MATT","last_name":"MCMAHON","classification":"A","division":"OPEN","hit_factor":6.2706},{"match_name":"MS06 Team Magnolia June 2017 USPSA Match","match_date":"2017-06-04","stage_classifiercode":"99-11","member_number":"A81881","first_name":"BARBARA","last_name":"WATTS","classification":"C","division":"OPEN","hit_factor":6.2703},{"match_name":"HSC USPSA August 5th 2017","match_date":"2017-08-05","stage_classifiercode":"99-11","member_number":"Ty77032","first_name":"TYLER","last_name":"COKE","classification":"B","division":"OPEN","hit_factor":6.2682},{"match_name":"Grandbaggers August 2017","match_date":"2017-08-03","stage_classifiercode":"99-11","member_number":"TY46991","first_name":"RON","last_name":"ASCHENBACH","classification":"B","division":"OPEN","hit_factor":6.2663},{"match_name":"Bulletstop Friday Night USPSA","match_date":"2016-02-12","stage_classifiercode":"99-11","member_number":"PEN","first_name":"RYAN","last_name":"BURGARDT","classification":"U","division":"OPEN","hit_factor":6.266},{"match_name":"MS06 Team Magnolia June 2017 USPSA Match","match_date":"2017-06-04","stage_classifiercode":"99-11","member_number":"TY34082","first_name":"ADELO","last_name":"AQUINO","classification":"A","division":"OPEN","hit_factor":6.2657},{"match_name":"November 2016 PCSI USPSA Monster Match","match_date":"2016-11-05","stage_classifiercode":"99-11","member_number":"\"\"","first_name":"ASHLEIGH","last_name":"GOSNELL","classification":"U","division":"OPEN","hit_factor":6.2657},{"match_name":"FAS Sunday Indoors USPSA Match","match_date":"2021-02-07","stage_classifiercode":"99-11","member_number":"TY87343","first_name":"KEITH","last_name":"BERRIAN","classification":"B","division":"OPEN","hit_factor":6.2593},{"match_name":"PRG 2017 Classifier Match","match_date":"2017-02-19","stage_classifiercode":"99-11","member_number":"L3347","first_name":"GLENN","last_name":"SEKI","classification":"A","division":"OPEN","hit_factor":6.25},{"match_name":"Winter League # 6","match_date":"2018-01-05","stage_classifiercode":"99-11","member_number":"A77818","first_name":"ANDY","last_name":"JOHNSON 2","classification":"B","division":"OPEN","hit_factor":6.25},{"match_name":"UVPS Practice 6-19-21","match_date":"2021-06-19","stage_classifiercode":"99-11","member_number":"TY65695","first_name":"WILLIAM","last_name":"DAUGHERTY","classification":"U","division":"OPEN","hit_factor":6.25},{"match_name":"10-04-2015 USPSA","match_date":"2015-10-02","stage_classifiercode":"99-11","member_number":"TY43238","first_name":"RICHARD","last_name":"KONNERTH","classification":"C","division":"OPEN","hit_factor":6.25},{"match_name":"ORPCI USPSA Saturday 2021.07.17","match_date":"2021-07-17","stage_classifiercode":"99-11","member_number":"TY66195","first_name":"ADAM","last_name":"DEWUS","classification":"C","division":"OPEN","hit_factor":6.25},{"match_name":"TAP USPSA Pistol Match Aug 14 2016","match_date":"2016-08-14","stage_classifiercode":"99-11","member_number":"A51896","first_name":"LORI","last_name":"BOFMAN","classification":"B","division":"OPEN","hit_factor":6.25},{"match_name":"Extreme GM USPSA  November","match_date":"2020-11-27","stage_classifiercode":"99-11","member_number":"FY91472","first_name":"BRUCE","last_name":"STEIN","classification":"A","division":"OPEN","hit_factor":6.25},{"match_name":"RangeMasters 5-31-2018","match_date":"2018-05-31","stage_classifiercode":"99-11","member_number":"L3738","first_name":"JAY","last_name":"OLMSTEAD","classification":"C","division":"OPEN","hit_factor":6.243},{"match_name":"RCPS USPSA 14 Nov 2015","match_date":"2015-11-14","stage_classifiercode":"99-11","member_number":"L2723","first_name":"ROBERT","last_name":"ADAMS","classification":"B","division":"OPEN","hit_factor":6.2429},{"match_name":"BRC_20180114","match_date":"2018-01-14","stage_classifiercode":"99-11","member_number":"L3762","first_name":"LANCE","last_name":"FOSTER","classification":"A","division":"OPEN","hit_factor":6.2397},{"match_name":"Lefthanders Gun Club Practical Shooters October","match_date":"2017-09-30","stage_classifiercode":"99-11","member_number":"A7424","first_name":"MARTY","last_name":"GERINGER","classification":"A","division":"OPEN","hit_factor":6.2338},{"match_name":"2018-05 Bone Creek USPSA","match_date":"2018-05-06","stage_classifiercode":"99-11","member_number":"A83466","first_name":"EMIL","last_name":"KASERMAN","classification":"C","division":"OPEN","hit_factor":6.2334},{"match_name":"USPSA - Bridgeville DE - lvl 1 Clone","match_date":"2018-07-01","stage_classifiercode":"99-11","member_number":"L4478","first_name":"ARTIE","last_name":"HAGLICH","classification":"B","division":"OPEN","hit_factor":6.2331},{"match_name":"Hallstead USPSA  July Match","match_date":"2020-07-25","stage_classifiercode":"99-11","member_number":"A82780","first_name":"JEANNE","last_name":"RUANE","classification":"C","division":"OPEN","hit_factor":6.2323},{"match_name":"LA05 Tangi USPSA 4th Sunday May 2021","match_date":"2021-05-23","stage_classifiercode":"99-11","member_number":"A43937","first_name":"ROBERT","last_name":"BRENNAN","classification":"B","division":"OPEN","hit_factor":6.231},{"match_name":"Richmond Hot Shots April 30-May 1st USPSA Pistol Match","match_date":"2016-04-30","stage_classifiercode":"99-11","member_number":"A22479","first_name":"PAUL","last_name":"GHENT","classification":"M","division":"OPEN","hit_factor":6.2295},{"match_name":"LCSA USPSA July Classifier Match","match_date":"2016-07-30","stage_classifiercode":"99-11","member_number":"a93980","first_name":"KENNETH","last_name":"LALIBERTE","classification":"C","division":"OPEN","hit_factor":6.2284},{"match_name":"NW01 Paul Bunyan CS Series May 9 2021","match_date":"2021-05-09","stage_classifiercode":"99-11","member_number":"A95958","first_name":"LANI","last_name":"KUANONI","classification":"B","division":"OPEN","hit_factor":6.2201},{"match_name":"HPS March 2020 Club Fun Match","match_date":"2020-03-07","stage_classifiercode":"99-11","member_number":"A68491","first_name":"LITO","last_name":"BALINO","classification":"A","division":"OPEN","hit_factor":6.2201},{"match_name":"MCRC USPSA August 2018","match_date":"2018-08-11","stage_classifiercode":"99-11","member_number":"A100438","first_name":"RENE","last_name":"QUINDO","classification":"B","division":"OPEN","hit_factor":6.2183},{"match_name":"PRPSA USPSA CHALLENGE PAN AMERICAN","match_date":"2021-07-11","stage_classifiercode":"99-11","member_number":"CALM","first_name":"CARLOS","last_name":"ALMANZAR","classification":"A","division":"OPEN","hit_factor":6.2153},{"match_name":"Pathfinder July USPSA Match","match_date":"2018-07-15","stage_classifiercode":"99-11","member_number":"A11321","first_name":"JOSEPH","last_name":"GAGLIARDO","classification":"none","division":"OPEN","hit_factor":6.2147},{"match_name":"AAPS AAFG Level 1 Match - May 5 2018","match_date":"2018-05-05","stage_classifiercode":"99-11","member_number":"L4464","first_name":"ERIC","last_name":"WONG","classification":"B","division":"OPEN","hit_factor":6.213},{"match_name":"USPSA MO21 2Alpha SBRC December 22 2018","match_date":"2018-12-22","stage_classifiercode":"99-11","member_number":"A79715","first_name":"MICHAEL","last_name":"NELSON","classification":"B","division":"OPEN","hit_factor":6.2119},{"match_name":"COPS 2015 Missouri Fall Classic","match_date":"2015-10-03","stage_classifiercode":"99-11","member_number":"ty43257","first_name":"FRED","last_name":"NOBLE","classification":"C","division":"OPEN","hit_factor":6.2112},{"match_name":"Extreme GM USPSA  November","match_date":"2020-11-27","stage_classifiercode":"99-11","member_number":"A93627","first_name":"TUCKER","last_name":"SCHMIDT","classification":"M","division":"OPEN","hit_factor":6.2102},{"match_name":"GoShoot Indoors","match_date":"2017-06-11","stage_classifiercode":"99-11","member_number":"A99611","first_name":"RYAN","last_name":"WARD","classification":"U","division":"OPEN","hit_factor":6.2084},{"match_name":"COPS 2015 Missouri Fall Classic","match_date":"2015-10-03","stage_classifiercode":"99-11","member_number":"Ty75997","first_name":"BRIAN","last_name":"STOKER","classification":"C","division":"OPEN","hit_factor":6.2077},{"match_name":"HSC USPSA May 5th 2018","match_date":"2018-05-05","stage_classifiercode":"99-11","member_number":"Ty84298","first_name":"JUSTIN","last_name":"MILLER","classification":"C","division":"OPEN","hit_factor":6.2061},{"match_name":"LA05 Tangi USPSA 4th Sunday May 2021","match_date":"2021-05-23","stage_classifiercode":"99-11","member_number":"TY64029","first_name":"VIC","last_name":"SAUNIER","classification":"C","division":"OPEN","hit_factor":6.2061},{"match_name":"Baps March Uspsa","match_date":"2016-03-19","stage_classifiercode":"99-11","member_number":"TY70210","first_name":"MYRNA","last_name":"RUSSIAN","classification":"C","division":"OPEN","hit_factor":6.2048},{"match_name":"2016-05-07 USPSA at Phoenix Rod and Gun Club","match_date":"2016-05-07","stage_classifiercode":"99-11","member_number":"A23111","first_name":"BOB","last_name":"BUFFA","classification":"D","division":"OPEN","hit_factor":6.2035},{"match_name":"Lefthanders Gun Club Practical Shooters October","match_date":"2017-09-30","stage_classifiercode":"99-11","member_number":"L2188","first_name":"BRIAN","last_name":"ROYALTY","classification":"C","division":"OPEN","hit_factor":6.2007},{"match_name":"TCGC Polo July 2017","match_date":"2017-07-23","stage_classifiercode":"99-11","member_number":"A91934","first_name":"ALFRED","last_name":"LADORES","classification":"M","division":"OPEN","hit_factor":6.196},{"match_name":"Pardoe Sportsmens Association-WPA14-2017-10-01","match_date":"2017-10-01","stage_classifiercode":"99-11","member_number":"TY76812","first_name":"MIKE","last_name":"WEAVER","classification":"M","division":"OPEN","hit_factor":6.1934},{"match_name":"11 March Classifier Match","match_date":"2018-03-10","stage_classifiercode":"99-11","member_number":"A107689","first_name":"BRANDON","last_name":"ZIMMERMANN","classification":"\"\"","division":"OPEN","hit_factor":6.1911},{"match_name":"WVRPC USPSA 1APR2017 CLASSIFIER","match_date":"2017-04-01","stage_classifiercode":"99-11","member_number":"L2755","first_name":"LINCOLN","last_name":"CARR","classification":"A","division":"OPEN","hit_factor":6.1889},{"match_name":"Ontelaunee USPSA July 2016","match_date":"2016-07-23","stage_classifiercode":"99-11","member_number":"\"\"","first_name":"DAVID","last_name":"FIGLER","classification":"U","division":"OPEN","hit_factor":6.1878},{"match_name":"OK15 USPSA at USSA","match_date":"2017-12-10","stage_classifiercode":"99-11","member_number":"TY75344","first_name":"CARY","last_name":"ROWTON","classification":"A","division":"OPEN","hit_factor":6.1789},{"match_name":"ENPS 2018 June USPSA Match","match_date":"2018-06-03","stage_classifiercode":"99-11","member_number":"FY67061","first_name":"JULIE","last_name":"HOWARD","classification":"C","division":"OPEN","hit_factor":6.178},{"match_name":"Tangi May 2016 USPSA","match_date":"2016-05-29","stage_classifiercode":"99-11","member_number":"A81207","first_name":"CECIL","last_name":"JANISE","classification":"C","division":"OPEN","hit_factor":6.1768},{"match_name":"SLOSA NOVEMBER 2017 USPSA MATCH","match_date":"2017-11-11","stage_classifiercode":"99-11","member_number":"TY87459","first_name":"AARON","last_name":"RUNYAN","classification":"B","division":"OPEN","hit_factor":6.1747},{"match_name":"SFPC Aug 8 2021 USPSA Classifier match","match_date":"2021-08-08","stage_classifiercode":"99-11","member_number":"A95026","first_name":"JAMIE","last_name":"BUTERA","classification":"U","division":"OPEN","hit_factor":6.1674},{"match_name":"Swamp Eagles 2015-12","match_date":"2015-12-20","stage_classifiercode":"99-11","member_number":"A36282","first_name":"WILLIAM","last_name":"MAHLEY","classification":"B","division":"OPEN","hit_factor":6.1674},{"match_name":"Pardoe Sportsmens Association- USPSA Saturday 4-3-21","match_date":"2021-04-03","stage_classifiercode":"99-11","member_number":"ty23758","first_name":"MATT","last_name":"MASLONEK","classification":"C","division":"OPEN","hit_factor":6.1669},{"match_name":"Custer USPSA Mar 7th 2021","match_date":"2021-03-07","stage_classifiercode":"99-11","member_number":"A83018","first_name":"RAE ARSEN","last_name":"BALEROS","classification":"B","division":"OPEN","hit_factor":6.1669},{"match_name":"Shot Through The Heart Classifiers","match_date":"2018-02-04","stage_classifiercode":"99-11","member_number":"A76697","first_name":"IVAN","last_name":"DUENAS","classification":"D","division":"OPEN","hit_factor":6.1659},{"match_name":"MS06 Team Magnolia June 2017 USPSA Match","match_date":"2017-06-04","stage_classifiercode":"99-11","member_number":"TY94846","first_name":"RUTH","last_name":"MAHLEY","classification":"C","division":"OPEN","hit_factor":6.1628},{"match_name":"CSoS Feb2016 Match","match_date":"2016-02-21","stage_classifiercode":"99-11","member_number":"L1850","first_name":"DAVID","last_name":"NEIS","classification":"B","division":"OPEN","hit_factor":6.1628},{"match_name":"Richmond Hot Shots January 17-2016 USPSA Pistol","match_date":"2016-01-17","stage_classifiercode":"99-11","member_number":"A84617","first_name":"MIKE","last_name":"FINEZA","classification":"U","division":"OPEN","hit_factor":6.1584},{"match_name":"RCPS USPSA 14 Nov 2015","match_date":"2015-11-14","stage_classifiercode":"99-11","member_number":"FY35534","first_name":"DUNDEE","last_name":"UY","classification":"A","division":"OPEN","hit_factor":6.1558},{"match_name":"WNYPPL September 2015 Match","match_date":"2015-09-27","stage_classifiercode":"99-11","member_number":"L2551","first_name":"DEREK","last_name":"ZMOZYNSKI","classification":"M","division":"OPEN","hit_factor":6.1538},{"match_name":"Collin County USPSA 04-25-2021","match_date":"2021-04-24","stage_classifiercode":"99-11","member_number":"TY50225","first_name":"RHONDA","last_name":"STONAKER","classification":"B","division":"OPEN","hit_factor":6.1518},{"match_name":"MPSA 121518 USPA Classifer Match","match_date":"2018-12-15","stage_classifiercode":"99-11","member_number":"L4105","first_name":"GREG","last_name":"HAMMER","classification":"B","division":"OPEN","hit_factor":6.1514},{"match_name":"FAS Sunday Indoors USPSA","match_date":"2021-10-17","stage_classifiercode":"99-11","member_number":"A133287","first_name":"NICK","last_name":"COLEMAN","classification":"C","division":"OPEN","hit_factor":6.1511},{"match_name":"NCPS USPSA Handgun Match November 27 2016","match_date":"2016-11-27","stage_classifiercode":"99-11","member_number":"A87650","first_name":"ALEX","last_name":"GOETZE","classification":"C","division":"OPEN","hit_factor":6.1501},{"match_name":"BHPSC 11-20-2020","match_date":"2020-11-21","stage_classifiercode":"99-11","member_number":"FY83466","first_name":"EMIL","last_name":"KASERMAN","classification":"C","division":"OPEN","hit_factor":6.1481},{"match_name":"Bayou City USPSA Weekly June 4","match_date":"2020-06-04","stage_classifiercode":"99-11","member_number":"TY79434","first_name":"GARRY","last_name":"NEWTON","classification":"A","division":"OPEN","hit_factor":6.1475},{"match_name":"Custer Feb USPSA","match_date":"2018-02-04","stage_classifiercode":"99-11","member_number":"L2396","first_name":"FLOYD","last_name":"SHOEMAKER","classification":"M","division":"OPEN","hit_factor":6.1462},{"match_name":"Springfield Tactical Shooters 04/05/2018","match_date":"2018-04-05","stage_classifiercode":"99-11","member_number":"A68186","first_name":"CODY","last_name":"BRADLEY","classification":"M","division":"OPEN","hit_factor":6.1453},{"match_name":"Rio Salado UPPL September 2020","match_date":"2020-09-13","stage_classifiercode":"99-11","member_number":"A104053","first_name":"RAYMOND","last_name":"GALLEGOS","classification":"B","division":"OPEN","hit_factor":6.1433},{"match_name":"SWGC USPSA Pistol Match - November 2021","match_date":"2021-11-06","stage_classifiercode":"99-11","member_number":"A123912","first_name":"JOHN","last_name":"HELD","classification":"C","division":"OPEN","hit_factor":6.136},{"match_name":"APSC USPSA 10-06-18","match_date":"2018-10-06","stage_classifiercode":"99-11","member_number":"A12134","first_name":"PAUL","last_name":"PAYNE","classification":"C","division":"OPEN","hit_factor":6.1356},{"match_name":"CFRPC April USPSA Match","match_date":"2018-04-15","stage_classifiercode":"99-11","member_number":"TY78915","first_name":"STEVE","last_name":"KAWASMY","classification":"B","division":"OPEN","hit_factor":6.1341},{"match_name":"June 2018 CAS USPSA","match_date":"2018-06-03","stage_classifiercode":"99-11","member_number":"A66934","first_name":"ELIZABETH","last_name":"YOUNG","classification":"C","division":"OPEN","hit_factor":6.1315},{"match_name":"Rio Salado Hosemasters February 2021","match_date":"2021-02-27","stage_classifiercode":"99-11","member_number":"A100087","first_name":"LUEL","last_name":"BAYLON","classification":"C","division":"OPEN","hit_factor":6.1311},{"match_name":"TAPS MARCH MATCH","match_date":"2017-03-11","stage_classifiercode":"99-11","member_number":"A70027","first_name":"DOUGLAS","last_name":"MCPHERSON","classification":"U","division":"OPEN","hit_factor":6.1311},{"match_name":"RDS USPSA 8.13.16","match_date":"2016-08-13","stage_classifiercode":"99-11","member_number":"A79715","first_name":"MICHAEL","last_name":"NELSON","classification":"U","division":"OPEN","hit_factor":6.1298},{"match_name":"HPS All-Classifier  Match","match_date":"2017-10-01","stage_classifiercode":"99-11","member_number":"A55833","first_name":"FROILAN","last_name":"RIVERO","classification":"U","division":"OPEN","hit_factor":6.1269},{"match_name":"Deadwood Boys USPSA All Classifier Match - 29 July 2018","match_date":"2018-07-29","stage_classifiercode":"99-11","member_number":"A98726","first_name":"CALEB","last_name":"BAER","classification":"A","division":"OPEN","hit_factor":6.1258},{"match_name":"2017-04 Bone Creek USPSA","match_date":"2017-04-02","stage_classifiercode":"99-11","member_number":"TY73010","first_name":"KYLE","last_name":"SAYRE","classification":"B","division":"OPEN","hit_factor":6.1252},{"match_name":"Prescott 1 st Saturday 12-03-2016","match_date":"2016-12-03","stage_classifiercode":"99-11","member_number":"TY79879","first_name":"FRANK","last_name":"BARBARO","classification":"B","division":"OPEN","hit_factor":6.1224},{"match_name":"Fairfax PS USPSA  2018 October","match_date":"2018-10-16","stage_classifiercode":"99-11","member_number":"ty55989","first_name":"MIKE","last_name":"WHITMAN","classification":"B","division":"OPEN","hit_factor":6.1224},{"match_name":"Denali Practical Pistol October","match_date":"2016-10-08","stage_classifiercode":"99-11","member_number":"\"\"","first_name":"JARED","last_name":"STEPP","classification":"U","division":"OPEN","hit_factor":6.12},{"match_name":"Pitcairn-Monroeville Sportsmens Club USPSA August 2017","match_date":"2017-08-05","stage_classifiercode":"99-11","member_number":"TY-90731","first_name":"MICHAEL","last_name":"FORD","classification":"B","division":"OPEN","hit_factor":6.1144},{"match_name":"Rankin FIeld USPSA","match_date":"2015-10-10","stage_classifiercode":"99-11","member_number":"A88732","first_name":"THI","last_name":"NGUYEN","classification":"B","division":"OPEN","hit_factor":6.1135},{"match_name":"Ontelaunee USPSA September 2015","match_date":"2015-09-27","stage_classifiercode":"99-11","member_number":"TY13104","first_name":"GARY","last_name":"VENEROSO","classification":"C","division":"OPEN","hit_factor":6.1077},{"match_name":"LCSA  USPSA April 2017","match_date":"2017-04-08","stage_classifiercode":"99-11","member_number":"a80108","first_name":"KEN","last_name":"DITTIG","classification":"D","division":"OPEN","hit_factor":6.1069},{"match_name":"LIPSA -  April 17th 2016 - USPSA Special Classifier Match","match_date":"2016-04-17","stage_classifiercode":"99-11","member_number":"Ty33497","first_name":"CLAY","last_name":"ERKMANN","classification":"B","division":"OPEN","hit_factor":6.1053},{"match_name":"ORPCI 2017 June USPSA Classifer Match","match_date":"2017-06-25","stage_classifiercode":"99-11","member_number":"A96280","first_name":"TY","last_name":"O'BRADOVICH","classification":"U","division":"OPEN","hit_factor":6.1033},{"match_name":"SAGC CTX04 Monthly USPSA Match - November 2018","match_date":"2018-11-25","stage_classifiercode":"99-11","member_number":"TY41061","first_name":"KIRBY","last_name":"DAHL","classification":"C","division":"OPEN","hit_factor":6.0991},{"match_name":"Deadwood Boys USPSA All Classifier Match - 29 July 2018","match_date":"2018-07-29","stage_classifiercode":"99-11","member_number":"a78856","first_name":"CRIS","last_name":"CARPENTER","classification":"A","division":"OPEN","hit_factor":6.0976},{"match_name":"ORPCI USPSA Saturday 2020.07.18","match_date":"2020-07-18","stage_classifiercode":"99-11","member_number":"A121160","first_name":"JOE","last_name":"EAMES","classification":"","division":"OPEN","hit_factor":6.0976},{"match_name":"Ontelaunee USPSA  July 2018","match_date":"2018-07-29","stage_classifiercode":"99-11","member_number":"A80080","first_name":"BLAESE","last_name":"ROMANO","classification":"U","division":"OPEN","hit_factor":6.0976},{"match_name":"TriggerGuard USPSA","match_date":"2017-08-05","stage_classifiercode":"99-11","member_number":"L3354","first_name":"RYAN","last_name":"DOLL","classification":"C","division":"OPEN","hit_factor":6.0961},{"match_name":"Richmond Hot Shots October 6-7 USPSA Pistol Match","match_date":"2018-10-06","stage_classifiercode":"99-11","member_number":"L3415","first_name":"RICKY","last_name":"FONG","classification":"B","division":"OPEN","hit_factor":6.0958},{"match_name":"Ontelaunee USPSA Hose Fest","match_date":"2021-01-02","stage_classifiercode":"99-11","member_number":"TY77457","first_name":"DRAGON","last_name":"CHOW","classification":"B","division":"OPEN","hit_factor":6.0938},{"match_name":"USPSA MO21 2Alpha SBRC March 2018","match_date":"2018-03-24","stage_classifiercode":"99-11","member_number":"A109456","first_name":"CHRIS","last_name":"BOARDMAN","classification":"U","division":"OPEN","hit_factor":6.0924},{"match_name":"Ontelaunee USPSA  July 2018","match_date":"2018-07-29","stage_classifiercode":"99-11","member_number":"TY87347","first_name":"AUSTIN","last_name":"NEARY","classification":"C","division":"OPEN","hit_factor":6.089},{"match_name":"HOPS USPSA 072118","match_date":"2018-07-21","stage_classifiercode":"99-11","member_number":"FY72619","first_name":"JAMES","last_name":"THOMAS","classification":"C","division":"OPEN","hit_factor":6.0881},{"match_name":"CFRPC April USPSA Match","match_date":"2018-04-15","stage_classifiercode":"99-11","member_number":"a94563","first_name":"LAMAR","last_name":"STANDISH","classification":"A","division":"OPEN","hit_factor":6.087},{"match_name":"CSS Oct USPSA","match_date":"2016-10-03","stage_classifiercode":"99-11","member_number":"a17864","first_name":"HENRY","last_name":"THEILS","classification":"B","division":"OPEN","hit_factor":6.087},{"match_name":"Hopkinton USPSA May 2017","match_date":"2017-05-06","stage_classifiercode":"99-11","member_number":"A60885","first_name":"LOU","last_name":"DENYS","classification":"B","division":"OPEN","hit_factor":6.085},{"match_name":"Rio Salado Hosemasters February 2021","match_date":"2021-02-27","stage_classifiercode":"99-11","member_number":"A105744","first_name":"KRISTIAN","last_name":"BAYLON","classification":"B","division":"OPEN","hit_factor":6.079},{"match_name":"LBAS160220","match_date":"2016-02-20","stage_classifiercode":"99-11","member_number":"A48358","first_name":"KEN","last_name":"COOMBS","classification":"C","division":"OPEN","hit_factor":6.0759},{"match_name":"October 2015 PCSI","match_date":"2015-10-03","stage_classifiercode":"99-11","member_number":"A47043","first_name":"MIKE","last_name":"MCDOWELL","classification":"B","division":"OPEN","hit_factor":6.0753},{"match_name":"FBURG March Level I USPSA","match_date":"2016-03-06","stage_classifiercode":"99-11","member_number":"Ty61626","first_name":"HAROLD","last_name":"WOLF","classification":"U","division":"OPEN","hit_factor":6.0729},{"match_name":"Shasta Shooters 2021 Nov","match_date":"2021-11-13","stage_classifiercode":"99-11","member_number":"A114013","first_name":"KYLE","last_name":"BROWN","classification":"U","division":"OPEN","hit_factor":6.0698},{"match_name":"Custer Feb USPSA","match_date":"2018-02-04","stage_classifiercode":"99-11","member_number":"FY76563","first_name":"SORIDA","last_name":"EAP","classification":"A","division":"OPEN","hit_factor":6.0698},{"match_name":"PPS USPSA Classifiers 2018-05-01","match_date":"2018-05-02","stage_classifiercode":"99-11","member_number":"A91071","first_name":"MICHAEL","last_name":"SIRNA","classification":"U","division":"OPEN","hit_factor":6.0683},{"match_name":"Baps March Uspsa","match_date":"2016-03-19","stage_classifiercode":"99-11","member_number":"A74846","first_name":"KYLE","last_name":"POST","classification":"B","division":"OPEN","hit_factor":6.0656},{"match_name":"PTPC  February 7th USPSA Match","match_date":"2016-02-07","stage_classifiercode":"99-11","member_number":"FY46501","first_name":"JOHN","last_name":"GUTT","classification":"C","division":"OPEN","hit_factor":6.0653},{"match_name":"SFA   USPSA 2/20/2016","match_date":"2016-02-20","stage_classifiercode":"99-11","member_number":"78463","first_name":"MIKE","last_name":"TURNBULL","classification":"B","division":"OPEN","hit_factor":6.0642},{"match_name":"MPSA 042118 USPSA","match_date":"2018-04-21","stage_classifiercode":"99-11","member_number":"L4195","first_name":"THOMAS","last_name":"HEARD","classification":"C","division":"OPEN","hit_factor":6.0641},{"match_name":"SAGC CTX04 Monthly USPSA Match - June USPSA Match","match_date":"2018-06-24","stage_classifiercode":"99-11","member_number":"A101336","first_name":"BOBBY","last_name":"IVESTER","classification":"A","division":"OPEN","hit_factor":6.0639},{"match_name":"MAPSA 2016.04.09","match_date":"2016-04-09","stage_classifiercode":"99-11","member_number":"TY51432","first_name":"FRANK","last_name":"SKOG","classification":"C","division":"OPEN","hit_factor":6.0638},{"match_name":"ORPCI USPSA Saturday 2021.07.17","match_date":"2021-07-17","stage_classifiercode":"99-11","member_number":"FY48388","first_name":"SUE","last_name":"VANBLARICUM","classification":"B","division":"OPEN","hit_factor":6.0574},{"match_name":"USPSA CM99 Special Classifier MO19 Lamar October 9 2016","match_date":"2016-10-09","stage_classifiercode":"99-11","member_number":"ty84551","first_name":"DAN","last_name":"REVELLE","classification":"B","division":"OPEN","hit_factor":6.0571},{"match_name":"Crooked Creek Pistol League - June 2016","match_date":"2016-06-25","stage_classifiercode":"99-11","member_number":"A43231","first_name":"VERN","last_name":"MOORE","classification":"\u0000","division":"OPEN","hit_factor":6.0502},{"match_name":"RISE INDOOR CLASSIFIER","match_date":"2018-12-15","stage_classifiercode":"99-11","member_number":"TY83520","first_name":"JAMES","last_name":"MARQUEZ","classification":"U","division":"OPEN","hit_factor":6.0484},{"match_name":"Strategic Edge July 2018 USPSA","match_date":"2018-07-21","stage_classifiercode":"99-11","member_number":"X","first_name":"JOE","last_name":"NEILL","classification":"\"\"","division":"OPEN","hit_factor":6.048},{"match_name":"ENPS 2018 June USPSA Match","match_date":"2018-06-03","stage_classifiercode":"99-11","member_number":"FY47278","first_name":"KENNETH","last_name":"ANDERSEN","classification":"A","division":"OPEN","hit_factor":6.0465},{"match_name":"Custer USPSA Mar 7th 2021","match_date":"2021-03-07","stage_classifiercode":"99-11","member_number":"TY103985","first_name":"CHRIS","last_name":"TEDFORD","classification":"U","division":"OPEN","hit_factor":6.0453},{"match_name":"COPS 2015 Missouri Fall Classic","match_date":"2015-10-03","stage_classifiercode":"99-11","member_number":"l1489","first_name":"ESTHER","last_name":"STOCK","classification":"C","division":"OPEN","hit_factor":6.0373},{"match_name":"SSS Pistol Match March 2017","match_date":"2017-03-12","stage_classifiercode":"99-11","member_number":"A101792","first_name":"ROBERT","last_name":"PRICE","classification":"U (Unclassified)","division":"OPEN","hit_factor":6.0364},{"match_name":"SLOSA NOVEMBER 2017 USPSA MATCH","match_date":"2017-11-11","stage_classifiercode":"99-11","member_number":"L1620","first_name":"THOMAS","last_name":"CHAN","classification":"A","division":"OPEN","hit_factor":6.0357},{"match_name":"WPS USPSA Monthly Match November 2020","match_date":"2020-11-14","stage_classifiercode":"99-11","member_number":"TY92889","first_name":"FRANK","last_name":"HILL","classification":"B","division":"OPEN","hit_factor":6.0332},{"match_name":"WNYPPL September 2015 Match","match_date":"2015-09-27","stage_classifiercode":"99-11","member_number":"L1021","first_name":"JOE","last_name":"MITCHELL","classification":"A","division":"OPEN","hit_factor":6.0284},{"match_name":"FSA-USPSA-03-11-2018","match_date":"2018-03-11","stage_classifiercode":"99-11","member_number":"ty54308","first_name":"GLEN","last_name":"BICKING","classification":"B","division":"OPEN","hit_factor":6.0274},{"match_name":"Rankin FIeld USPSA","match_date":"2015-10-10","stage_classifiercode":"99-11","member_number":"\"\"","first_name":"JIMMY","last_name":"RABINA","classification":"none","division":"OPEN","hit_factor":6.0241},{"match_name":"Hose Monster Action ","match_date":"2020-07-19","stage_classifiercode":"99-11","member_number":"l3390","first_name":"JOHN","last_name":"WHEELER","classification":"A","division":"OPEN","hit_factor":6.0227},{"match_name":"FAS USPSA   One Small Step","match_date":"2018-10-07","stage_classifiercode":"99-11","member_number":"A112175","first_name":"JONATHAN","last_name":"JACHIM","classification":"C","division":"OPEN","hit_factor":6.0226},{"match_name":"RBPS April Pistol","match_date":"2016-04-17","stage_classifiercode":"99-11","member_number":"A62449","first_name":"JOHN M","last_name":"KOZIOL","classification":"C","division":"OPEN","hit_factor":6.0159},{"match_name":"LIPSA -  April 17th 2016 - USPSA Special Classifier Match","match_date":"2016-04-17","stage_classifiercode":"99-11","member_number":"TY11597","first_name":"GARY","last_name":"COOPER","classification":"C","division":"OPEN","hit_factor":6.0159},{"match_name":"CGGR July USPSA Match","match_date":"2018-07-21","stage_classifiercode":"99-11","member_number":"L3838","first_name":"NATHAN","last_name":"THOMPSON","classification":"M","division":"OPEN","hit_factor":6.0137},{"match_name":"TCGC Polo July 2017","match_date":"2017-07-23","stage_classifiercode":"99-11","member_number":"TY88494","first_name":"GEORGE","last_name":"DYSICO","classification":"C","division":"OPEN","hit_factor":6.0127},{"match_name":"HOPS USPSA 072118","match_date":"2018-07-21","stage_classifiercode":"99-11","member_number":"TY107304","first_name":"TRENT","last_name":"SIMPSON","classification":"C","division":"OPEN","hit_factor":6.01},{"match_name":"BRC_20180114","match_date":"2018-01-14","stage_classifiercode":"99-11","member_number":"TY5392","first_name":"ROGER","last_name":"BRIDEN","classification":"B","division":"OPEN","hit_factor":6.0091},{"match_name":"Brazosland Pistoleros USPSA - Sunday August 8th","match_date":"2021-08-08","stage_classifiercode":"99-11","member_number":"A119637","first_name":"BRIAN","last_name":"KOLENDA","classification":"C","division":"OPEN","hit_factor":6.0052},{"match_name":"Dundee USPSA Feb 2016","match_date":"2016-02-27","stage_classifiercode":"99-11","member_number":"L2525","first_name":"KEITH","last_name":"TYLER","classification":"G","division":"OPEN","hit_factor":6.0034},{"match_name":"Benton Gun Club-USPSA June 27  9AM","match_date":"2021-06-27","stage_classifiercode":"99-11","member_number":"TY126576","first_name":"TOM","last_name":"FLEMING","classification":"B","division":"OPEN","hit_factor":5.9908},{"match_name":"Pharr action shooters USPSA match at Coyote 02-20-16","match_date":"2016-02-20","stage_classifiercode":"99-11","member_number":"a45644","first_name":"TRACY","last_name":"SELF","classification":"B","division":"OPEN","hit_factor":5.9908},{"match_name":"LGCSEMPS April 2018 Special Classifier","match_date":"2018-04-08","stage_classifiercode":"99-11","member_number":"A104695","first_name":"BRAD","last_name":"RAINEY","classification":"U","division":"OPEN","hit_factor":5.9893},{"match_name":"SCCCNOVEMBER2016","match_date":"2016-11-13","stage_classifiercode":"99-11","member_number":"ty61081","first_name":"TOM","last_name":"SCHWENN","classification":"B","division":"OPEN","hit_factor":5.988},{"match_name":"Nampa USPSA May 29th 2021","match_date":"2021-05-29","stage_classifiercode":"99-11","member_number":"Ty91986","first_name":"TRAVIS","last_name":"DEMARAY","classification":"A","division":"OPEN","hit_factor":5.9813},{"match_name":"FSA-USPSA-03-11-2018","match_date":"2018-03-11","stage_classifiercode":"99-11","member_number":"a107715","first_name":"JAMES","last_name":"NIEDT","classification":"U","division":"OPEN","hit_factor":5.9811},{"match_name":"Rio Salado RSPP 3rd Saturday February 2020","match_date":"2020-02-15","stage_classifiercode":"99-11","member_number":"TY65813","first_name":"JOE","last_name":"HANNIS","classification":"C","division":"OPEN","hit_factor":5.9794},{"match_name":"Lafayette Practical Shooters - WED - Nov 4","match_date":"2020-11-05","stage_classifiercode":"99-11","member_number":"A93310","first_name":"JON","last_name":"MARINO","classification":"B","division":"OPEN","hit_factor":5.9783},{"match_name":"SAPSC Monthly USPSA Classifier Match 20160209","match_date":"2016-02-09","stage_classifiercode":"99-11","member_number":"A93439","first_name":"CHRIS","last_name":"ELLIS","classification":"U","division":"OPEN","hit_factor":5.9744},{"match_name":"GPS.   August  2016 ","match_date":"2016-08-28","stage_classifiercode":"99-11","member_number":"a74721","first_name":"ALBERT","last_name":"CALDERON","classification":"B","division":"OPEN","hit_factor":5.9686},{"match_name":"Parabellum USPSA May 10 2017","match_date":"2017-05-10","stage_classifiercode":"99-11","member_number":"TY17278","first_name":"STEVEN","last_name":"WRIGHT","classification":"B","division":"OPEN","hit_factor":5.9685},{"match_name":"Ontelaunee USPSA  July 2018","match_date":"2018-07-29","stage_classifiercode":"99-11","member_number":"A104792","first_name":"JIM","last_name":"CIRIGLIANO","classification":"C","division":"OPEN","hit_factor":5.9669},{"match_name":"Crooked Creek Pistol League - June 2017","match_date":"2017-06-24","stage_classifiercode":"99-11","member_number":"TY43238","first_name":"RICHARD","last_name":"KONNERTH","classification":"C","division":"OPEN","hit_factor":5.9666},{"match_name":"MS06 Team Magnolia February 2018 USPSA Match","match_date":"2018-02-03","stage_classifiercode":"99-11","member_number":"A98482","first_name":"AARON","last_name":"FITZGERALD","classification":"B","division":"OPEN","hit_factor":5.9663},{"match_name":"Richmond Hot Shots April 14-15-2018 USPSA Pistol Match","match_date":"2018-04-14","stage_classifiercode":"99-11","member_number":"TY79640","first_name":"ELPIDIO","last_name":"CORPUZ","classification":"A","division":"OPEN","hit_factor":5.9655},{"match_name":"MPPL 11042018 Hoser Heaven","match_date":"2018-11-04","stage_classifiercode":"99-11","member_number":"A51827","first_name":"JOSHUA","last_name":"RAPANOT","classification":"U","division":"OPEN","hit_factor":5.9645},{"match_name":"TAP USPSA Pistol Match Aug 14 2016","match_date":"2016-08-14","stage_classifiercode":"99-11","member_number":"A81430","first_name":"PAUL","last_name":"VALMORES","classification":"U","division":"OPEN","hit_factor":5.9645},{"match_name":"PTPC April 2nd USPSA Match","match_date":"2017-04-02","stage_classifiercode":"99-11","member_number":"A22716","first_name":"EDWIN","last_name":"LASKEY","classification":"C","division":"OPEN","hit_factor":5.9618},{"match_name":"Grandbaggers August 2017","match_date":"2017-08-03","stage_classifiercode":"99-11","member_number":"A34501","first_name":"RON","last_name":"FUCHS","classification":"U","division":"OPEN","hit_factor":5.9613},{"match_name":"Armory Indoor League","match_date":"2016-09-23","stage_classifiercode":"99-11","member_number":"A94967","first_name":"JARED","last_name":"STEPP","classification":"U","division":"OPEN","hit_factor":5.9609},{"match_name":"Rio Salado RSPP 3rd Saturday February 2020","match_date":"2020-02-15","stage_classifiercode":"99-11","member_number":"TY63687","first_name":"DAN","last_name":"NEWTON","classification":"B","division":"OPEN","hit_factor":5.9574},{"match_name":"DTR USPS A Jan 21","match_date":"2021-01-09","stage_classifiercode":"99-11","member_number":"A114007","first_name":"CHARLES","last_name":"BERRYHILL","classification":"A","division":"OPEN","hit_factor":5.9561},{"match_name":"FAS USPSA   One Small Step","match_date":"2018-10-07","stage_classifiercode":"99-11","member_number":"A106890","first_name":"KYLE","last_name":"WAY","classification":"U","division":"OPEN","hit_factor":5.9553},{"match_name":"Rankin Field Sunday USPSA","match_date":"2018-04-15","stage_classifiercode":"99-11","member_number":"TY87874","first_name":"RODEL","last_name":"JARDINASO","classification":"U","division":"OPEN","hit_factor":5.9551},{"match_name":"Monson March 2016","match_date":"2016-03-26","stage_classifiercode":"99-11","member_number":"A36777","first_name":"GREG","last_name":"STUDLEY","classification":"B","division":"OPEN","hit_factor":5.9537},{"match_name":"Rankin field Sunday match Clone","match_date":"2016-07-17","stage_classifiercode":"99-11","member_number":"A34139","first_name":"LEE","last_name":"ROWE","classification":"A","division":"OPEN","hit_factor":5.9536},{"match_name":"Grandbaggers 07-05-2018","match_date":"2018-07-05","stage_classifiercode":"99-11","member_number":"A97078","first_name":"JIM","last_name":"CONNER","classification":"B","division":"OPEN","hit_factor":5.9504},{"match_name":"Live Fire","match_date":"2017-07-11","stage_classifiercode":"99-11","member_number":"A84392","first_name":"JAMES","last_name":"TEDFORD","classification":"B","division":"OPEN","hit_factor":5.9486},{"match_name":"TPS USPSA -  August Classifier Match 2020","match_date":"2020-08-01","stage_classifiercode":"99-11","member_number":"FY97931","first_name":"SCOTT","last_name":"NEWNAM","classification":"U","division":"OPEN","hit_factor":5.9435},{"match_name":"Sage   9-18-16","match_date":"2016-09-18","stage_classifiercode":"99-11","member_number":"FY19335","first_name":"EDWARD","last_name":"FREY","classification":"B","division":"OPEN","hit_factor":5.9406},{"match_name":"WGC August 2018 USPSA Classifier","match_date":"2018-08-12","stage_classifiercode":"99-11","member_number":"TY34082","first_name":"ADELO","last_name":"AQUINO","classification":"A","division":"OPEN","hit_factor":5.9406},{"match_name":"TMGN December 8th Pistol Match","match_date":"2016-12-09","stage_classifiercode":"99-11","member_number":"\"\"","first_name":"BRENDAN","last_name":"WARSHAUER","classification":"none","division":"OPEN","hit_factor":5.9379},{"match_name":"ENPS 2018 June USPSA Match","match_date":"2018-06-03","stage_classifiercode":"99-11","member_number":"TY71896","first_name":"HAROLD","last_name":"HOLLINS","classification":"C","division":"OPEN","hit_factor":5.9367},{"match_name":"Pitcairn-Monroeville Sportsmens Club USPSA August 2017","match_date":"2017-08-05","stage_classifiercode":"99-11","member_number":"FY-90924","first_name":"SOPHIA","last_name":"SMITH","classification":"C","division":"OPEN","hit_factor":5.9365},{"match_name":"Hose Monster Action ","match_date":"2020-07-19","stage_classifiercode":"99-11","member_number":"a129147","first_name":"RUGENE","last_name":"CABANTING","classification":"\"\"","division":"OPEN","hit_factor":5.9355},{"match_name":"MAPSA 2016.04.09","match_date":"2016-04-09","stage_classifiercode":"99-11","member_number":"FY53872","first_name":"JON","last_name":"MCCARTY","classification":"C","division":"OPEN","hit_factor":5.9351},{"match_name":"Hopkinton USPSA May 2017","match_date":"2017-05-06","stage_classifiercode":"99-11","member_number":"A28945","first_name":"SCOTT","last_name":"BOTELHO","classification":"G","division":"OPEN","hit_factor":5.9341},{"match_name":"CCG 5-29-16","match_date":"2016-05-29","stage_classifiercode":"99-11","member_number":"A56905","first_name":"BLAIR","last_name":"HANSEN","classification":"B","division":"OPEN","hit_factor":5.9341},{"match_name":"LCSA USPSA July Classifier Match","match_date":"2016-07-30","stage_classifiercode":"99-11","member_number":"a93980","first_name":"KENNETH","last_name":"LALIBERTE","classification":"C","division":"OPEN","hit_factor":5.9312},{"match_name":"May 14th YVPS USPSA","match_date":"2016-05-14","stage_classifiercode":"99-11","member_number":"\"\"","first_name":"JAE","last_name":"SEIFERT","classification":"\"\"","division":"OPEN","hit_factor":5.9293},{"match_name":"WVRPC USPSA 2APR2016","match_date":"2016-04-02","stage_classifiercode":"99-11","member_number":"L2755","first_name":"LINCOLN","last_name":"CARR","classification":"A","division":"OPEN","hit_factor":5.9222},{"match_name":"USPSA Strategic Edge SEGR August 21st 2021","match_date":"2021-08-21","stage_classifiercode":"99-11","member_number":"A129839","first_name":"JAKOB","last_name":"HURST","classification":"B","division":"OPEN","hit_factor":5.9211},{"match_name":"MAPSA 2016.04.09","match_date":"2016-04-09","stage_classifiercode":"99-11","member_number":"A73645","first_name":"JOE","last_name":"BENSON","classification":"C","division":"OPEN","hit_factor":5.9186},{"match_name":"Range 54 USPSA","match_date":"2017-03-10","stage_classifiercode":"99-11","member_number":"A-94567","first_name":"CHRIS","last_name":"KRUEGER","classification":"U","division":"OPEN","hit_factor":5.9146},{"match_name":"North Mountain PS April","match_date":"2016-04-15","stage_classifiercode":"99-11","member_number":"\"\"","first_name":"MATT","last_name":"RENZ","classification":"U","division":"OPEN","hit_factor":5.9146},{"match_name":"Maine Practical Shooters August 2016","match_date":"2016-08-27","stage_classifiercode":"99-11","member_number":"A-54089","first_name":"STEPHEN","last_name":"BADE","classification":"U","division":"OPEN","hit_factor":5.9091},{"match_name":"MAPSA 2016.10.08","match_date":"2016-10-08","stage_classifiercode":"99-11","member_number":"A73645","first_name":"JOE","last_name":"BENSON","classification":"B","division":"OPEN","hit_factor":5.9072},{"match_name":"UVPS Practice 6-19-21","match_date":"2021-06-19","stage_classifiercode":"99-11","member_number":"A134886","first_name":"BILL","last_name":"RICE","classification":"U","division":"OPEN","hit_factor":5.9032},{"match_name":"PRG 2017 Classifier Match","match_date":"2017-02-19","stage_classifiercode":"99-11","member_number":"A41798","first_name":"ALLAN","last_name":"AURELIO","classification":"A","division":"OPEN","hit_factor":5.9016},{"match_name":"MPPL 08052018 Summer Fun","match_date":"2018-08-05","stage_classifiercode":"99-11","member_number":"A113332","first_name":"MARIA","last_name":"DUMBRIQUE","classification":"U","division":"OPEN","hit_factor":5.9},{"match_name":"TAP USPSA Pistol Match Aug 14 2016","match_date":"2016-08-14","stage_classifiercode":"99-11","member_number":"A25441","first_name":"WALTER","last_name":"HASHIMOTO","classification":"A","division":"OPEN","hit_factor":5.8997},{"match_name":"USPSA MO21 2Alpha SBRC Classifier 2016","match_date":"2016-11-26","stage_classifiercode":"99-11","member_number":"A-97624","first_name":"MICHAEL","last_name":"MARTIN","classification":"U","division":"OPEN","hit_factor":5.895},{"match_name":"CCPL 12102017","match_date":"2017-12-08","stage_classifiercode":"99-11","member_number":"\"\"","first_name":"THOMAS","last_name":"CHAN","classification":"A","division":"OPEN","hit_factor":5.8943},{"match_name":"Rankin field Sunday match Clone","match_date":"2016-07-17","stage_classifiercode":"99-11","member_number":"L2116","first_name":"BRUCE","last_name":"PARBST","classification":"B","division":"OPEN","hit_factor":5.8941},{"match_name":"Douglas Ridge USPSA March 7","match_date":"2020-03-07","stage_classifiercode":"99-11","member_number":"L4735","first_name":"GEOFFREY","last_name":"PESTES","classification":"B","division":"OPEN","hit_factor":5.8912},{"match_name":"LdF USPSA Match May 12 2018","match_date":"2018-05-12","stage_classifiercode":"99-11","member_number":"TY99082","first_name":"LUKE","last_name":"WANG","classification":"B","division":"OPEN","hit_factor":5.891},{"match_name":"Colonial RPC Inaugural USPSA Match","match_date":"2018-04-07","stage_classifiercode":"99-11","member_number":"TY - 103555","first_name":"JOHN","last_name":"FEVELO","classification":"D","division":"OPEN","hit_factor":5.8888},{"match_name":"GLSRC Action Pistol 3-20-18","match_date":"2018-03-18","stage_classifiercode":"99-11","member_number":"\"\"","first_name":"JUSTIN","last_name":"COBB","classification":"U","division":"OPEN","hit_factor":5.8824},{"match_name":"INAS May 2020 USPSA","match_date":"2020-05-09","stage_classifiercode":"99-11","member_number":"A100340","first_name":"THOMAS","last_name":"MICHAELS","classification":"C","division":"OPEN","hit_factor":5.8824},{"match_name":"PRG - Oh Shoot USPSA February 21st - 3rd Sunday Match","match_date":"2021-02-21","stage_classifiercode":"99-11","member_number":"TY88653","first_name":"JIMMY","last_name":"PARK","classification":"B","division":"OPEN","hit_factor":5.8824},{"match_name":"JPPS Club Match","match_date":"2018-04-21","stage_classifiercode":"99-11","member_number":"A23320","first_name":"JOHN","last_name":"STIEDLE","classification":"M","division":"OPEN","hit_factor":5.8824},{"match_name":"2017 Bay bridge Charity Classic - Richmond October 14-15-2017","match_date":"2017-10-14","stage_classifiercode":"99-11","member_number":"A88783","first_name":"JOHNMAR","last_name":"SAMSON","classification":"A","division":"OPEN","hit_factor":5.8824},{"match_name":"GWPP January 2016 Pistol","match_date":"2016-01-09","stage_classifiercode":"99-11","member_number":"A13721","first_name":"BILL","last_name":"HUNTER","classification":"B","division":"OPEN","hit_factor":5.8763},{"match_name":"Rio Salado Hosemasters February 2021","match_date":"2021-02-27","stage_classifiercode":"99-11","member_number":"L4929","first_name":"JIM","last_name":"DUFFY","classification":"C","division":"OPEN","hit_factor":5.8761},{"match_name":"HPS April Tax Time Fun Shoot","match_date":"2017-04-22","stage_classifiercode":"99-11","member_number":"FY66771","first_name":"ORLINO","last_name":"CARDENAS","classification":"C","division":"OPEN","hit_factor":5.8753},{"match_name":"Prescott 1st Saturday 8-05-17","match_date":"2017-08-05","stage_classifiercode":"99-11","member_number":"L4050","first_name":"CHRIS","last_name":"NOWACK","classification":"B","division":"OPEN","hit_factor":5.8741},{"match_name":"PTPC April 2nd USPSA Match","match_date":"2017-04-02","stage_classifiercode":"99-11","member_number":"A71862","first_name":"JOSEPH","last_name":"SINYAKOVICH","classification":"B","division":"OPEN","hit_factor":5.873},{"match_name":"Granby Action Shooters Oct 2016","match_date":"2016-10-02","stage_classifiercode":"99-11","member_number":"TY11901","first_name":"DAVID","last_name":"LOPEZ","classification":"A","division":"OPEN","hit_factor":5.8728},{"match_name":"COPS 2015 Missouri Fall Classic","match_date":"2015-10-03","stage_classifiercode":"99-11","member_number":"A87386","first_name":"MATT","last_name":"OPFER","classification":"C","division":"OPEN","hit_factor":5.8708},{"match_name":"MPPL 08052018 Summer Fun","match_date":"2018-08-05","stage_classifiercode":"99-11","member_number":"FY66771","first_name":"ORLINO","last_name":"CARDENAS","classification":"C","division":"OPEN","hit_factor":5.8698},{"match_name":"MPSA 021817","match_date":"2017-02-18","stage_classifiercode":"99-11","member_number":"A92317","first_name":"KYLE","last_name":"HUFF","classification":"X","division":"OPEN","hit_factor":5.8696},{"match_name":"OFGC Practical Pistol Match 01-19-2020","match_date":"2020-01-19","stage_classifiercode":"99-11","member_number":"A92526","first_name":"BREANNA","last_name":"NOBLE","classification":"D","division":"OPEN","hit_factor":5.8625},{"match_name":"RPS November 2018 USPSA Match","match_date":"2018-11-10","stage_classifiercode":"99-11","member_number":"A82536","first_name":"BRAD","last_name":"BANKS","classification":"B","division":"OPEN","hit_factor":5.8615},{"match_name":"Superior Practical Shooters May 2018 Match","match_date":"2018-05-02","stage_classifiercode":"99-11","member_number":"A95764","first_name":"DEAN","last_name":"L'HOSTE","classification":"C","division":"OPEN","hit_factor":5.8589},{"match_name":"Bills Baxter 12-10-20","match_date":"2020-12-11","stage_classifiercode":"99-11","member_number":"A109338","first_name":"LOUIE","last_name":"WINSKOWSKI","classification":"U","division":"OPEN","hit_factor":5.8537},{"match_name":"NCPS USPSA Handgun Match November 27 2016","match_date":"2016-11-27","stage_classifiercode":"99-11","member_number":"A63834","first_name":"EDWIN","last_name":"CUCIO","classification":"B","division":"OPEN","hit_factor":5.8528},{"match_name":"MSSA Uspsa Club Match","match_date":"2017-08-27","stage_classifiercode":"99-11","member_number":"\"\"","first_name":"BOB","last_name":"DUBOIS","classification":"B","division":"OPEN","hit_factor":5.8516},{"match_name":"SFPC June 7 2020 AM     USPSA Monthly Match","match_date":"2020-06-07","stage_classifiercode":"99-11","member_number":"A83243","first_name":"GIL","last_name":"ELNATAN","classification":"C","division":"OPEN","hit_factor":5.848},{"match_name":"Bossier Parish Practical Shooters August 16 2020","match_date":"2020-08-16","stage_classifiercode":"99-11","member_number":"F16070","first_name":"JEANNETTE","last_name":"SHARP","classification":"\"\"","division":"OPEN","hit_factor":5.8424},{"match_name":"CSA Coalfield Shooters Association USPSA March 2020","match_date":"2020-03-08","stage_classifiercode":"99-11","member_number":"\"\"","first_name":"DOUG","last_name":"DEAN","classification":"U","division":"OPEN","hit_factor":5.8409},{"match_name":"Swamp Eagles 2015-12","match_date":"2015-12-20","stage_classifiercode":"99-11","member_number":"FY81419","first_name":"JOHN","last_name":"NGUYEN","classification":"A","division":"OPEN","hit_factor":5.8407},{"match_name":"Applied IN25 USPSA April Classifier 2018","match_date":"2018-04-17","stage_classifiercode":"99-11","member_number":"TY92980","first_name":"DAVID","last_name":"BURNS","classification":"A","division":"OPEN","hit_factor":5.8383},{"match_name":"LdF USPSA Match January 25 2020","match_date":"2020-01-25","stage_classifiercode":"99-11","member_number":"TY73362","first_name":"MARK","last_name":"LEMOGE","classification":"U","division":"OPEN","hit_factor":5.8361},{"match_name":"SAPSC Monthly USPSA Classifier Match 20160209","match_date":"2016-02-09","stage_classifiercode":"99-11","member_number":"TY87266","first_name":"KYLE","last_name":"MAPP","classification":"C","division":"OPEN","hit_factor":5.8323},{"match_name":"Collin County USPSA 04-25-2021","match_date":"2021-04-24","stage_classifiercode":"99-11","member_number":"L3571","first_name":"KEN","last_name":"COBB","classification":"M","division":"OPEN","hit_factor":5.8268},{"match_name":"Ontelaunee USPSA  July 2018","match_date":"2018-07-29","stage_classifiercode":"99-11","member_number":"TY83520","first_name":"JAMES","last_name":"MARQUEZ","classification":"C","division":"OPEN","hit_factor":5.8252},{"match_name":"GWPP January 2016 Pistol","match_date":"2016-01-09","stage_classifiercode":"99-11","member_number":"TY39532","first_name":"NORM E","last_name":"LEE","classification":"B","division":"OPEN","hit_factor":5.8252},{"match_name":"Applied IN25 USPSA January 17th 2018","match_date":"2018-01-17","stage_classifiercode":"99-11","member_number":"A69428","first_name":"CARTER","last_name":"JONES","classification":"C","division":"OPEN","hit_factor":5.824},{"match_name":"PTPC  February 7th USPSA Match","match_date":"2016-02-07","stage_classifiercode":"99-11","member_number":"A55556","first_name":"RON","last_name":"EVANS","classification":"B","division":"OPEN","hit_factor":5.8219},{"match_name":"Chillicothe February 2021 USPSA Match","match_date":"2021-02-28","stage_classifiercode":"99-11","member_number":"TY100795","first_name":"JOHN","last_name":"KLENDWORTH","classification":"B","division":"OPEN","hit_factor":5.8209},{"match_name":"BUAS February Match","match_date":"2020-02-09","stage_classifiercode":"99-11","member_number":"A104656","first_name":"CRAIG","last_name":"TRAHAN","classification":"C","division":"OPEN","hit_factor":5.8193},{"match_name":"Triforce Practical Shooters at BigWoodsGoods 11-30-17","match_date":"2017-12-01","stage_classifiercode":"99-11","member_number":"A94721","first_name":"BOB","last_name":"MCCOLL","classification":"D","division":"OPEN","hit_factor":5.8163},{"match_name":"PRG 2017 Classifier Match","match_date":"2017-02-19","stage_classifiercode":"99-11","member_number":"A78877","first_name":"TOMMY","last_name":"HANDOJO","classification":"U","division":"OPEN","hit_factor":5.8156},{"match_name":"MS06 Team Magnolia June 2017 USPSA Match","match_date":"2017-06-04","stage_classifiercode":"99-11","member_number":"TY65599","first_name":"GALE","last_name":"BUTLER","classification":"B","division":"OPEN","hit_factor":5.814},{"match_name":"Lefthanders Gun Club Practical Shooters October","match_date":"2017-09-30","stage_classifiercode":"99-11","member_number":"A63658","first_name":"JASON","last_name":"CAREY","classification":"C","division":"OPEN","hit_factor":5.8065},{"match_name":"RangeMasters 9-27-2018","match_date":"2018-09-27","stage_classifiercode":"99-11","member_number":"TY96553","first_name":"DANNY","last_name":"NARAMORE","classification":"C","division":"OPEN","hit_factor":5.8065},{"match_name":"Competitive Shooters of Lake Norman CORNELIUS Thursday Evening Indoor USPSA Pistol Match North Carolina","match_date":"2021-09-16","stage_classifiercode":"99-11","member_number":"Ty69724","first_name":"CRAIG","last_name":"HANSEN","classification":"B","division":"OPEN","hit_factor":5.8047},{"match_name":"BSPSC 2017 April Special Classifier","match_date":"2017-04-09","stage_classifiercode":"99-11","member_number":"TY89426","first_name":"LARRY","last_name":"SCUSA","classification":"C","division":"OPEN","hit_factor":5.8036},{"match_name":"Shot Through The Heart Classifiers","match_date":"2018-02-04","stage_classifiercode":"99-11","member_number":"\"\"","first_name":"MICHELLE","last_name":"CULPEPPER","classification":"\"\"","division":"OPEN","hit_factor":5.8005},{"match_name":"STAGE ZERO SHOOTING SUPPLY USPSA","match_date":"2020-07-16","stage_classifiercode":"99-11","member_number":"A112141","first_name":"WILL","last_name":"HAINES","classification":"D","division":"OPEN","hit_factor":5.8002},{"match_name":"Richmond Hot Shots April 30-May 1st USPSA Pistol Match","match_date":"2016-04-30","stage_classifiercode":"99-11","member_number":"FY81272","first_name":"GAYLORD","last_name":"GABRIEL","classification":"B","division":"OPEN","hit_factor":5.7992},{"match_name":"COPS 2015 Missouri Fall Classic","match_date":"2015-10-03","stage_classifiercode":"99-11","member_number":"A79174","first_name":"BRIXEY","last_name":"NELSON","classification":"B","division":"OPEN","hit_factor":5.7987},{"match_name":"Applied IN25 USPSA April Classifier 2018","match_date":"2018-04-17","stage_classifiercode":"99-11","member_number":"A110293","first_name":"WILLIAM 2","last_name":"ARMAN","classification":"U","division":"OPEN","hit_factor":5.7986},{"match_name":"Crooked Creek Pistol League - June 2016","match_date":"2016-06-25","stage_classifiercode":"99-11","member_number":"TY91700","first_name":"JEFF","last_name":"MORSE","classification":"C","division":"OPEN","hit_factor":5.794},{"match_name":"IL16 USPSA MAR 20 2016","match_date":"2016-03-20","stage_classifiercode":"99-11","member_number":"a-83657","first_name":"LLOYD","last_name":"ANDERSON","classification":"U","division":"OPEN","hit_factor":5.7937},{"match_name":"Richmond Hot Shots April 30-May 1st USPSA Pistol Match","match_date":"2016-04-30","stage_classifiercode":"99-11","member_number":"L3415","first_name":"RICKY","last_name":"FONG","classification":"C","division":"OPEN","hit_factor":5.7901},{"match_name":"Danville Rifle and Pistol Club USPSA IL17 July 7 2018","match_date":"2018-07-07","stage_classifiercode":"99-11","member_number":"TY91334","first_name":"BILL","last_name":"SIDELL","classification":"A","division":"OPEN","hit_factor":5.7887},{"match_name":"LPRGC-Lower Providence USPSA May-1 2017","match_date":"2017-05-05","stage_classifiercode":"99-11","member_number":"L1476","first_name":"JAMES","last_name":"CHESTNUT","classification":"A","division":"OPEN","hit_factor":5.7864},{"match_name":"5/15/2021 Missouri Bootheel USPSA","match_date":"2021-05-15","stage_classifiercode":"99-11","member_number":"FY71888","first_name":"DEAN","last_name":"NGAROTATA. 2","classification":"U","division":"OPEN","hit_factor":5.7816},{"match_name":"RCPS USPSA 14 Nov 2015","match_date":"2015-11-14","stage_classifiercode":"99-11","member_number":"F82549","first_name":"GAIL","last_name":"HARRIS-COPPENS","classification":"U","division":"OPEN","hit_factor":5.7816},{"match_name":"CGGR July USPSA Match","match_date":"2018-07-21","stage_classifiercode":"99-11","member_number":"L729","first_name":"ROBERT","last_name":"WALKER","classification":"A","division":"OPEN","hit_factor":5.7811},{"match_name":"RSPP 3rd Saturday November 2016","match_date":"2016-11-19","stage_classifiercode":"99-11","member_number":"A74253","first_name":"LESLIE","last_name":"KORZEP","classification":"C","division":"OPEN","hit_factor":5.7762},{"match_name":"PPPS 11-13-16","match_date":"2016-11-13","stage_classifiercode":"99-11","member_number":"L3985","first_name":"FRANK","last_name":"JOHNSON","classification":"C","division":"OPEN","hit_factor":5.7732},{"match_name":"Richmond Hot Shots April 30-May 1st USPSA Pistol Match","match_date":"2016-04-30","stage_classifiercode":"99-11","member_number":"A33147","first_name":"VINCE","last_name":"DIONISIO","classification":"B","division":"OPEN","hit_factor":5.7722},{"match_name":"Georgia Run N Gun 1-28-2016","match_date":"2016-01-29","stage_classifiercode":"99-11","member_number":"a-36675","first_name":"ROBERT","last_name":"SINCLAIR SE","classification":"C","division":"OPEN","hit_factor":5.7715},{"match_name":"Rio Salado UPPL September 2020","match_date":"2020-09-13","stage_classifiercode":"99-11","member_number":"A119567","first_name":"LAURI","last_name":"SAFFON","classification":"D","division":"OPEN","hit_factor":5.7711},{"match_name":"GWPP Pistol December 2027","match_date":"2017-12-08","stage_classifiercode":"99-11","member_number":"\"\"","first_name":"CHRIS","last_name":"LINDER","classification":"U","division":"OPEN","hit_factor":5.7692},{"match_name":"Armory Indoor League","match_date":"2016-09-23","stage_classifiercode":"99-11","member_number":"L3900","first_name":"STEVE","last_name":"TERRY","classification":"C","division":"OPEN","hit_factor":5.7674},{"match_name":"PCPS Classifier and Slot Match Jan 2020","match_date":"2020-01-12","stage_classifiercode":"99-11","member_number":"A110090","first_name":"NICK","last_name":"SPRAGUE","classification":"U","division":"OPEN","hit_factor":5.7644},{"match_name":"LIPSA -  April 17th 2016 - USPSA Special Classifier Match","match_date":"2016-04-17","stage_classifiercode":"99-11","member_number":"A93363","first_name":"DEAN","last_name":"CHASSE","classification":"U","division":"OPEN","hit_factor":5.7644},{"match_name":"IOP Rifle And Pistol Club USPSA Match March 2020","match_date":"2020-03-01","stage_classifiercode":"99-11","member_number":"A55262","first_name":"DEAN","last_name":"GOMEZ","classification":"B","division":"OPEN","hit_factor":5.7569},{"match_name":"AAPS AAFG Level 1 Match - May 5 2018","match_date":"2018-05-05","stage_classifiercode":"99-11","member_number":"L4464","first_name":"ERIC","last_name":"WONG","classification":"B","division":"OPEN","hit_factor":5.7561},{"match_name":"MVS  ANPRACS USPSA Extra Classifier 2-21-16","match_date":"2016-02-21","stage_classifiercode":"99-11","member_number":"TY83723","first_name":"BENJAMIN","last_name":"HIGGINS","classification":"\"\"","division":"OPEN","hit_factor":5.7554},{"match_name":"Hopkinton USPSA July 2018","match_date":"2018-07-07","stage_classifiercode":"99-11","member_number":"L4262","first_name":"STEWART","last_name":"GINSBERG","classification":"B","division":"OPEN","hit_factor":5.7543},{"match_name":"NW01 Paul Bunyan CS Series May 9 2021","match_date":"2021-05-09","stage_classifiercode":"99-11","member_number":"Ty86951","first_name":"EMILIO","last_name":"DOMINGO","classification":"A","division":"OPEN","hit_factor":5.7531},{"match_name":"EWPSA 2016-04","match_date":"2016-04-17","stage_classifiercode":"99-11","member_number":"A80666","first_name":"SHANE","last_name":"HILL","classification":"M","division":"OPEN","hit_factor":5.7522},{"match_name":"OFGC USPSA Match Feb 19th 2017","match_date":"2017-02-19","stage_classifiercode":"99-11","member_number":"\"\"","first_name":"CODY","last_name":"GRAHAM","classification":"U","division":"OPEN","hit_factor":5.7508},{"match_name":"HPSP Heartland Practical Shooters June USPSA Shoot","match_date":"2018-06-24","stage_classifiercode":"99-11","member_number":"A102287","first_name":"DUSTIN","last_name":"BAILEY","classification":"C","division":"OPEN","hit_factor":5.7471},{"match_name":"KSA USPSA  3 April 2021","match_date":"2021-04-03","stage_classifiercode":"99-11","member_number":"A94749","first_name":"JOHN","last_name":"BURCH","classification":"B","division":"OPEN","hit_factor":5.7453},{"match_name":"LIPSA -  April 17th 2016 - USPSA Special Classifier Match","match_date":"2016-04-17","stage_classifiercode":"99-11","member_number":"L-3915","first_name":"SALVATORE","last_name":"RUSSO","classification":"U","division":"OPEN","hit_factor":5.7377},{"match_name":"Ontelaunee USPSA  July 2018","match_date":"2018-07-29","stage_classifiercode":"99-11","member_number":"A66127","first_name":"KENNY","last_name":"LEE","classification":"B","division":"OPEN","hit_factor":5.7364},{"match_name":"Payson Practical Shooters USPSA Jan 2 2021","match_date":"2021-01-02","stage_classifiercode":"99-11","member_number":"FL3478","first_name":"FRANK","last_name":"KOCH","classification":"M","division":"OPEN","hit_factor":5.7353},{"match_name":"Maryland Practical Shooters Association July 2018","match_date":"2018-07-22","stage_classifiercode":"99-11","member_number":"TY112150","first_name":"SCOTT","last_name":"FUNK","classification":"U","division":"OPEN","hit_factor":5.7312},{"match_name":"Applied IN25 USPSA April Classifier 2018","match_date":"2018-04-17","stage_classifiercode":"99-11","member_number":"A69428","first_name":"CARTER","last_name":"JONES","classification":"C","division":"OPEN","hit_factor":5.7297},{"match_name":"Rio Salado Hosemasters February 2021","match_date":"2021-02-27","stage_classifiercode":"99-11","member_number":"L4468","first_name":"RAYMOND","last_name":"ENG","classification":"A","division":"OPEN","hit_factor":5.7276},{"match_name":"Lefthanders Gun Club Practical Shooters October","match_date":"2017-09-30","stage_classifiercode":"99-11","member_number":"TY56049","first_name":"KENT","last_name":"CHRISTEN","classification":"C","division":"OPEN","hit_factor":5.7274},{"match_name":"MAPSA 2016.04.09","match_date":"2016-04-09","stage_classifiercode":"99-11","member_number":"A73645","first_name":"JOE","last_name":"BENSON","classification":"C","division":"OPEN","hit_factor":5.7264},{"match_name":"SAPSA January 2020 Match","match_date":"2020-01-18","stage_classifiercode":"99-11","member_number":"A58329","first_name":"JERWIN","last_name":"CAYONTE","classification":"A","division":"OPEN","hit_factor":5.7229},{"match_name":"2017-10-07 USPSA at Phoenix Rod and Gun Club","match_date":"2017-10-07","stage_classifiercode":"99-11","member_number":"A2576","first_name":"BOB","last_name":"BORDER","classification":"U","division":"OPEN","hit_factor":5.7211},{"match_name":"2017 EOD Warrior Foundation Match","match_date":"2017-04-29","stage_classifiercode":"99-11","member_number":"TY81761","first_name":"JOHN","last_name":"DOLAN","classification":"U","division":"OPEN","hit_factor":5.7208},{"match_name":"DAPS USPSA at ETTS 7-8-17","match_date":"2017-07-08","stage_classifiercode":"99-11","member_number":"\"\"","first_name":"MAX","last_name":"SPURGEON","classification":"\"\"","division":"OPEN","hit_factor":5.7208},{"match_name":"Oakdale USPSA MN07 6-25-2020","match_date":"2020-06-25","stage_classifiercode":"99-11","member_number":"L4275","first_name":"MIKE","last_name":"BERTRAND","classification":"B","division":"OPEN","hit_factor":5.719},{"match_name":"SFPC Oct 3 2021   USPSA Monthly Match","match_date":"2021-10-03","stage_classifiercode":"99-11","member_number":"TY76862","first_name":"MARK","last_name":"SHANNON","classification":"C","division":"OPEN","hit_factor":5.7187},{"match_name":"Collin County USPSA 04-25-2021","match_date":"2021-04-24","stage_classifiercode":"99-11","member_number":"TY72656","first_name":"AIDAN","last_name":"STOCKTON","classification":"B","division":"OPEN","hit_factor":5.7185},{"match_name":"Rio Salado UPPL September 2020","match_date":"2020-09-13","stage_classifiercode":"99-11","member_number":"A100726","first_name":"DOMINIC","last_name":"NAPOLITANO","classification":"B","division":"OPEN","hit_factor":5.7173},{"match_name":"Triforce Practical Shooters at BigWoodsGoods 11-30-17","match_date":"2017-12-01","stage_classifiercode":"99-11","member_number":"\"\"","first_name":"ALLEN","last_name":"DEAN","classification":"U","division":"OPEN","hit_factor":5.7143},{"match_name":"Richmond Hot Shots April 14-15-2018 USPSA Pistol Match","match_date":"2018-04-14","stage_classifiercode":"99-11","member_number":"A80595","first_name":"EDGAR","last_name":"ALLAS","classification":"C","division":"OPEN","hit_factor":5.7143},{"match_name":"Strongpoint August 2017 Match","match_date":"2017-08-05","stage_classifiercode":"99-11","member_number":"NONE","first_name":"JACOB","last_name":"TAYLOR","classification":"U","division":"OPEN","hit_factor":5.7143},{"match_name":"Prescott Action Shooters 1st Saturday USPSA 7-7-2018","match_date":"2018-07-07","stage_classifiercode":"99-11","member_number":"TY98350","first_name":"ERIC","last_name":"HAGBERG","classification":"C","division":"OPEN","hit_factor":5.708},{"match_name":"USPSA Strategic Edge SEGR August 21st 2021","match_date":"2021-08-21","stage_classifiercode":"99-11","member_number":"A128608","first_name":"DEREK","last_name":"LEWIS","classification":"C","division":"OPEN","hit_factor":5.7061},{"match_name":"Richmond Hot Shots April 30-May 1st USPSA Pistol Match","match_date":"2016-04-30","stage_classifiercode":"99-11","member_number":"A 51918","first_name":"TIM","last_name":"BOFMAN","classification":"A","division":"OPEN","hit_factor":5.7018},{"match_name":"MS06 Team Magnolia USPSA Sept Match","match_date":"2015-09-06","stage_classifiercode":"99-11","member_number":"A65599","first_name":"GALE","last_name":"BUTLER","classification":"B","division":"OPEN","hit_factor":5.6988},{"match_name":"MPSA 121518 USPA Classifer Match","match_date":"2018-12-15","stage_classifiercode":"99-11","member_number":"A78083","first_name":"JEFFREY","last_name":"BLITCH","classification":"B","division":"OPEN","hit_factor":5.6936},{"match_name":"Prescott Action Shooters 1st Saturday USPSA 6-2-2018 ","match_date":"2018-06-03","stage_classifiercode":"99-11","member_number":"A106012","first_name":"SHEREE","last_name":"SCORE","classification":"D","division":"OPEN","hit_factor":5.6911},{"match_name":"MPSA 121518 USPA Classifer Match","match_date":"2018-12-15","stage_classifiercode":"99-11","member_number":"L4195","first_name":"THOMAS","last_name":"HEARD","classification":"C","division":"OPEN","hit_factor":5.6902},{"match_name":"Hopkinton USPSA October 2018","match_date":"2018-10-06","stage_classifiercode":"99-11","member_number":"TY106156","first_name":"DAVID","last_name":"SEAVEY","classification":"U","division":"OPEN","hit_factor":5.6897},{"match_name":"NW01 Paul Bunyan CS Series May 9 2021","match_date":"2021-05-09","stage_classifiercode":"99-11","member_number":"L4865","first_name":"CLIFFORD","last_name":"AGUILAR","classification":"C","division":"OPEN","hit_factor":5.6877},{"match_name":"Prescott Action Shooters 1st Saturday USPSA 6-2-2018 ","match_date":"2018-06-03","stage_classifiercode":"99-11","member_number":"L4214","first_name":"SARAH","last_name":"NYBERG-VILLARINO","classification":"C","division":"OPEN","hit_factor":5.6856},{"match_name":"SKSC USPSA April 2018 Match","match_date":"2018-04-21","stage_classifiercode":"99-11","member_number":"A110327","first_name":"CHAD","last_name":"VANHAUN","classification":"U","division":"OPEN","hit_factor":5.6842},{"match_name":"WPGC 10-1-18","match_date":"2018-10-01","stage_classifiercode":"99-11","member_number":"TY41573","first_name":"CRAIG","last_name":"CALKINS","classification":"A","division":"OPEN","hit_factor":5.6842},{"match_name":"Nampa USPSA May 29th 2021","match_date":"2021-05-29","stage_classifiercode":"99-11","member_number":"A129778","first_name":"EMILY","last_name":"HUGHSTON","classification":"C","division":"OPEN","hit_factor":5.683},{"match_name":"OREGON ARPC CC05 USPSA AUGUST 12 2017","match_date":"2017-08-12","stage_classifiercode":"99-11","member_number":"ty45897","first_name":"LAWRENCE","last_name":"MULL","classification":"C","division":"OPEN","hit_factor":5.6807},{"match_name":"CCPL 05-23-2021","match_date":"2021-05-23","stage_classifiercode":"99-11","member_number":"A114267","first_name":"SHARRON","last_name":"MURRAY","classification":"C","division":"OPEN","hit_factor":5.6806},{"match_name":"Denali Practical Pistol October","match_date":"2016-10-08","stage_classifiercode":"99-11","member_number":"\"\"","first_name":"JARED","last_name":"STEPP","classification":"U","division":"OPEN","hit_factor":5.6805},{"match_name":"BSPSC 2017 April Special Classifier","match_date":"2017-04-09","stage_classifiercode":"99-11","member_number":"A101382","first_name":"ANDREW","last_name":"MCDOUGALL","classification":"U","division":"OPEN","hit_factor":5.6795},{"match_name":"Crooked Creek Pistol League - June 2016","match_date":"2016-06-25","stage_classifiercode":"99-11","member_number":"TY91700","first_name":"JEFF","last_name":"MORSE","classification":"C","division":"OPEN","hit_factor":5.6779},{"match_name":"Prescott 1 st Saturday 12-03-2016","match_date":"2016-12-03","stage_classifiercode":"99-11","member_number":"A95422","first_name":"SARAH","last_name":"NYBERG","classification":"D","division":"OPEN","hit_factor":5.6769},{"match_name":"Monson March 2016","match_date":"2016-03-26","stage_classifiercode":"99-11","member_number":"TY79508","first_name":"SHANE","last_name":"FUNGAFAT","classification":"B","division":"OPEN","hit_factor":5.6738},{"match_name":"MRPC OHS02 042218","match_date":"2018-04-21","stage_classifiercode":"99-11","member_number":"TY59608","first_name":"KIMBERLY","last_name":"RUSS","classification":"D","division":"OPEN","hit_factor":5.6696},{"match_name":"GPS.   August  2016 ","match_date":"2016-08-28","stage_classifiercode":"99-11","member_number":"a85089","first_name":"JOEL","last_name":"CRUZ","classification":"D","division":"OPEN","hit_factor":5.6645},{"match_name":"Wvpps Nov. 2016","match_date":"2016-11-20","stage_classifiercode":"99-11","member_number":"TY98629","first_name":"SARAH","last_name":"TAMAELA","classification":"U","division":"OPEN","hit_factor":5.6634},{"match_name":"OK15 USPSA at USSA May 6th 2018","match_date":"2018-05-06","stage_classifiercode":"99-11","member_number":"A-48869","first_name":"BRIAN","last_name":"GEE","classification":"M","division":"OPEN","hit_factor":5.6604},{"match_name":"West Coast IPSC","match_date":"2018-07-22","stage_classifiercode":"99-11","member_number":"TY99769","first_name":"SAM","last_name":"MAO","classification":"B","division":"OPEN","hit_factor":5.6583},{"match_name":"PGC USPSA Practice Match 9-26-17","match_date":"2017-09-25","stage_classifiercode":"99-11","member_number":"\"\"","first_name":"RED","last_name":"KASERMAN","classification":"M","division":"OPEN","hit_factor":5.6582},{"match_name":"Payson Practical Shooters - USPSA 2018 01 06","match_date":"2018-01-06","stage_classifiercode":"99-11","member_number":"A94167","first_name":"JASON","last_name":"BEATTY","classification":"U","division":"OPEN","hit_factor":5.6579},{"match_name":"PTPC  February 7th USPSA Match","match_date":"2016-02-07","stage_classifiercode":"99-11","member_number":"A19231","first_name":"DARRYL","last_name":"DOUGHERTY","classification":"M","division":"OPEN","hit_factor":5.6577},{"match_name":"AGC_20170903","match_date":"2017-09-03","stage_classifiercode":"99-11","member_number":"A101580","first_name":"DAVID","last_name":"VALDEZ","classification":"U","division":"OPEN","hit_factor":5.6575},{"match_name":"WSPS JUNE 2018 USPSA MATCH","match_date":"2018-06-16","stage_classifiercode":"99-11","member_number":"TY93356","first_name":"DOMINICK","last_name":"GATTUSO","classification":"C","division":"OPEN","hit_factor":5.6575},{"match_name":"Deadwood Boys USPSA All Classifier Match","match_date":"2016-08-07","stage_classifiercode":"99-11","member_number":"TY42673","first_name":"CHUCK","last_name":"CHURCH","classification":"C","division":"OPEN","hit_factor":5.6564},{"match_name":"Richmond Hot Shots January 17-2016 USPSA Pistol","match_date":"2016-01-17","stage_classifiercode":"99-11","member_number":"A90183","first_name":"GABRIELLE","last_name":"LOPEZ","classification":"C","division":"OPEN","hit_factor":5.6543},{"match_name":"GTS Indoor USPSA February 27 2020","match_date":"2020-02-28","stage_classifiercode":"99-11","member_number":"L4609","first_name":"JASON","last_name":"MAGNUSON","classification":"U","division":"OPEN","hit_factor":5.6505},{"match_name":"NCPS USPSA Handgun Match November 27 2016","match_date":"2016-11-27","stage_classifiercode":"99-11","member_number":"L4134","first_name":"CHRISTOPHER","last_name":"WALLACE","classification":"B","division":"OPEN","hit_factor":5.6497},{"match_name":"OK15 USPSA at USSA May 6th 2018","match_date":"2018-05-06","stage_classifiercode":"99-11","member_number":"A24950","first_name":"RICK","last_name":"PEELER","classification":"B","division":"OPEN","hit_factor":5.6497},{"match_name":"Campeonato USPSA 2020","match_date":"2020-05-30","stage_classifiercode":"99-11","member_number":"F116122","first_name":"JOSE","last_name":"ORTIZ-LEON","classification":"U","division":"OPEN","hit_factor":5.6478},{"match_name":"GWPP December 2020 Pistol","match_date":"2020-12-12","stage_classifiercode":"99-11","member_number":"a94852","first_name":"RANDY","last_name":"GOODNEY","classification":"A","division":"OPEN","hit_factor":5.6452},{"match_name":"SLPSA August USPSA Match 2","match_date":"2020-08-15","stage_classifiercode":"99-11","member_number":"TY74321","first_name":"STEPHEN","last_name":"PRICE","classification":"B","division":"OPEN","hit_factor":5.644},{"match_name":"MPPL 08052018 Summer Fun","match_date":"2018-08-05","stage_classifiercode":"99-11","member_number":"TY88006","first_name":"BOBBY","last_name":"REGALARIO","classification":"C","division":"OPEN","hit_factor":5.6433},{"match_name":"Rio Salado UPPL September 2020","match_date":"2020-09-13","stage_classifiercode":"99-11","member_number":"A46504","first_name":"TRISHA","last_name":"DENNETT","classification":"C","division":"OPEN","hit_factor":5.638},{"match_name":"ENPS 2018 June USPSA Match","match_date":"2018-06-03","stage_classifiercode":"99-11","member_number":"TY96710","first_name":"ZACHARY","last_name":"BRODER","classification":"C","division":"OPEN","hit_factor":5.6338},{"match_name":"LIPSA -  April 17th 2016 - USPSA Special Classifier Match","match_date":"2016-04-17","stage_classifiercode":"99-11","member_number":"Ty85181","first_name":"JEFF","last_name":"MELWORM","classification":"D","division":"OPEN","hit_factor":5.6338},{"match_name":"Applied IN25 USPSA April Classifier 2018","match_date":"2018-04-17","stage_classifiercode":"99-11","member_number":"\"\"","first_name":"VINCENT","last_name":"ANDREWS","classification":"U","division":"OPEN","hit_factor":5.6338},{"match_name":"March 2018 USPSA Classifier Special","match_date":"2018-03-17","stage_classifiercode":"99-11","member_number":"f105639","first_name":"SAMUEL","last_name":"NAPENAS","classification":"\"\"","division":"OPEN","hit_factor":5.6311},{"match_name":"LCSA USPSA July Classifier Match","match_date":"2016-07-30","stage_classifiercode":"99-11","member_number":"A80068","first_name":"QUENTIN","last_name":"SCOTT","classification":"U","division":"OPEN","hit_factor":5.6306},{"match_name":"Hopkinton USPSA October 2018","match_date":"2018-10-06","stage_classifiercode":"99-11","member_number":"TY80786","first_name":"DAN","last_name":"HAYWOOD","classification":"U","division":"OPEN","hit_factor":5.6296},{"match_name":"GRB JAN USPSA  at Cav","match_date":"2017-01-21","stage_classifiercode":"99-11","member_number":"A85896","first_name":"JOHN","last_name":"MCQUEEN","classification":"C","division":"OPEN","hit_factor":5.6291},{"match_name":"MAPSA 2016.04.09","match_date":"2016-04-09","stage_classifiercode":"99-11","member_number":"TY77062","first_name":"KEN","last_name":"SPOONER","classification":"U","division":"OPEN","hit_factor":5.6269},{"match_name":"Rio Grande Practical Shooters - Oct 2015","match_date":"2015-10-03","stage_classifiercode":"99-11","member_number":"A6063","first_name":"NANCI","last_name":"LAMBERT","classification":"B","division":"OPEN","hit_factor":5.6263},{"match_name":"Tangi May 2016 USPSA","match_date":"2016-05-29","stage_classifiercode":"99-11","member_number":"TY64029","first_name":"VIC","last_name":"SAUNIER","classification":"C","division":"OPEN","hit_factor":5.6136},{"match_name":"June 2018 CAS USPSA","match_date":"2018-06-03","stage_classifiercode":"99-11","member_number":"A60170","first_name":"DAVE","last_name":"DELGER","classification":"C","division":"OPEN","hit_factor":5.6122},{"match_name":"Dawg Valley USPSA Oct 13","match_date":"2018-10-13","stage_classifiercode":"99-11","member_number":"FY64885","first_name":"KEVIN","last_name":"SANDERS","classification":"A","division":"OPEN","hit_factor":5.6122},{"match_name":"Richmond Hot Shots January 17-2016 USPSA Pistol","match_date":"2016-01-17","stage_classifiercode":"99-11","member_number":"A25441","first_name":"WALTER","last_name":"HASHIMOTO","classification":"A","division":"OPEN","hit_factor":5.6115},{"match_name":"HPS All-Classifier  Match","match_date":"2017-10-01","stage_classifiercode":"99-11","member_number":"FY66771","first_name":"ORLINO","last_name":"CARDENAS","classification":"C","division":"OPEN","hit_factor":5.6102},{"match_name":"Shasta Shooters 2017 June Classifier Match","match_date":"2017-06-10","stage_classifiercode":"99-11","member_number":"L3873","first_name":"DON","last_name":"SANTORO","classification":"A","division":"OPEN","hit_factor":5.609},{"match_name":"CSA Coalfield Shooters Association USPSA March 2020","match_date":"2020-03-08","stage_classifiercode":"99-11","member_number":"TY103689","first_name":"BOBBY","last_name":"LEWIS","classification":"B","division":"OPEN","hit_factor":5.6075},{"match_name":"Lafayette Practical Shooters - WED-THUR - Dec 19-20 - CLASSIFIER MATCH","match_date":"2018-12-20","stage_classifiercode":"99-11","member_number":"FY81419","first_name":"JOHN","last_name":"NGUYEN","classification":"M","division":"OPEN","hit_factor":5.6061},{"match_name":"Ontelaunee USPSA September 2015","match_date":"2015-09-27","stage_classifiercode":"99-11","member_number":"A82085","first_name":"DAVE","last_name":"HEALEY","classification":"B","division":"OPEN","hit_factor":5.6061},{"match_name":"Triforce Practical Shooters at BigWoodsGoods 11-30-17","match_date":"2017-12-01","stage_classifiercode":"99-11","member_number":"A80964","first_name":"MICHAEL","last_name":"DUPUIS","classification":"U","division":"OPEN","hit_factor":5.6054},{"match_name":"Hopkinton USPSA May 2017","match_date":"2017-05-06","stage_classifiercode":"99-11","member_number":"TY81500","first_name":"STEWART","last_name":"GINSBERG","classification":"B","division":"OPEN","hit_factor":5.6034},{"match_name":"ARPC USPSA Match 5-27-18","match_date":"2018-05-27","stage_classifiercode":"99-11","member_number":"TY93058","first_name":"BRUCE","last_name":"CURRY","classification":"C","division":"OPEN","hit_factor":5.6034},{"match_name":"Rio Salado Hosemasters February 2021","match_date":"2021-02-27","stage_classifiercode":"99-11","member_number":"L4050","first_name":"CHRIS","last_name":"NOWACK","classification":"B","division":"OPEN","hit_factor":5.5974},{"match_name":"OFGC USPSA Match Feb 19th 2017","match_date":"2017-02-19","stage_classifiercode":"99-11","member_number":"TY94217","first_name":"DUSTIN","last_name":"CHAMBERLAIN","classification":"C","division":"OPEN","hit_factor":5.5937},{"match_name":"Benton Gun Club-USPSA March 25 2018","match_date":"2018-03-25","stage_classifiercode":"99-11","member_number":"A39940","first_name":"JIM","last_name":"FOWLER","classification":"A","division":"OPEN","hit_factor":5.5932},{"match_name":"RSPP 3rd Saturday November 2016","match_date":"2016-11-19","stage_classifiercode":"99-11","member_number":"\"\"","first_name":"MARVIN","last_name":"INSCHO","classification":"U","division":"OPEN","hit_factor":5.5741},{"match_name":"Dundee USPSA Feb 2016","match_date":"2016-02-27","stage_classifiercode":"99-11","member_number":"TY58134","first_name":"DAN","last_name":"CARPENTER","classification":"B","division":"OPEN","hit_factor":5.5732},{"match_name":"NHRPC - March 2021 USPSA","match_date":"2021-03-14","stage_classifiercode":"99-11","member_number":"A102632","first_name":"BILL","last_name":"COLEMAN","classification":"B","division":"OPEN","hit_factor":5.5728},{"match_name":"Prescott Action Shooters 1st Saturday USPSA 6-2-2018 ","match_date":"2018-06-03","stage_classifiercode":"99-11","member_number":"NA","first_name":"PENNY","last_name":"CRAMER","classification":"Unclassified","division":"OPEN","hit_factor":5.5662},{"match_name":"TMGN December 21 Practical Shooter Match","match_date":"2017-12-22","stage_classifiercode":"99-11","member_number":"\"\"","first_name":"TOM","last_name":"KOH","classification":"\"\"","division":"OPEN","hit_factor":5.5641},{"match_name":"TCGC Polo September 2015","match_date":"2015-09-27","stage_classifiercode":"99-11","member_number":"A91934","first_name":"ALFRED","last_name":"LADORES","classification":"C","division":"OPEN","hit_factor":5.5626},{"match_name":"YRPA USPSA MARCH  2018","match_date":"2018-03-25","stage_classifiercode":"99-11","member_number":"TY108103","first_name":"DUSTAN","last_name":"AADLAND","classification":"U","division":"OPEN","hit_factor":5.5609},{"match_name":"Swamp Eagles 2015-12","match_date":"2015-12-20","stage_classifiercode":"99-11","member_number":"TY43937","first_name":"ROBERT","last_name":"BRENNAN","classification":"B","division":"OPEN","hit_factor":5.5556},{"match_name":"ARPC USPSA Match 5-27-18","match_date":"2018-05-27","stage_classifiercode":"99-11","member_number":"TY33410","first_name":"JEFF","last_name":"MATSCHE","classification":"M","division":"OPEN","hit_factor":5.5556},{"match_name":"SB Action Pistol Match Classifier","match_date":"2017-12-14","stage_classifiercode":"99-11","member_number":"TY20461","first_name":"LARS","last_name":"FLINK","classification":"\"\"","division":"OPEN","hit_factor":5.5556},{"match_name":"Dundee USPSA Feb 2016","match_date":"2016-02-27","stage_classifiercode":"99-11","member_number":"TY45892","first_name":"RICHARD","last_name":"BROWNING","classification":"B","division":"OPEN","hit_factor":5.5485},{"match_name":"USPSA-Alberta 2018-01 Indoor Classifier 1","match_date":"2018-02-26","stage_classifiercode":"99-11","member_number":"F78887","first_name":"JEREMY","last_name":"REYNOLDS","classification":"U","division":"OPEN","hit_factor":5.5394},{"match_name":"LdF USPSA Match January 25 2020","match_date":"2020-01-25","stage_classifiercode":"99-11","member_number":"A18808","first_name":"LOU","last_name":"PAZ","classification":"A","division":"OPEN","hit_factor":5.5369},{"match_name":"RCPS USPSA March 10","match_date":"2018-03-10","stage_classifiercode":"99-11","member_number":"TY100969","first_name":"DAVID","last_name":"BARNES","classification":"C","division":"OPEN","hit_factor":5.5363},{"match_name":"APSA October 2021 USPSA match","match_date":"2021-10-09","stage_classifiercode":"99-11","member_number":"A97740","first_name":"DAVID","last_name":"MEDLING","classification":"D","division":"OPEN","hit_factor":5.5344},{"match_name":"TBAS USPSA Match 2/21/21","match_date":"2021-02-21","stage_classifiercode":"99-11","member_number":"A116034","first_name":"DILLON","last_name":"BOMGARDNER","classification":"B","division":"OPEN","hit_factor":5.5331},{"match_name":"Fairfax PS USPSA  2018 October","match_date":"2018-10-16","stage_classifiercode":"99-11","member_number":"A109301","first_name":"DAVID","last_name":"THOMPSON","classification":"U","division":"OPEN","hit_factor":5.5325},{"match_name":"Blackstone Shooting Sports Snow Days January 2017 USPSA Level  1","match_date":"2017-01-08","stage_classifiercode":"99-11","member_number":"A91357","first_name":"BEN","last_name":"LANGFORD","classification":"A","division":"OPEN","hit_factor":5.5283},{"match_name":"USPSA MO21 2Alpha SBRC March 2018","match_date":"2018-03-24","stage_classifiercode":"99-11","member_number":"A109365","first_name":"DANNY","last_name":"CLEVENGER","classification":"U","division":"OPEN","hit_factor":5.5271},{"match_name":"October 2015 PCSI","match_date":"2015-10-03","stage_classifiercode":"99-11","member_number":"A81837","first_name":"CODY","last_name":"BAKER","classification":"G","division":"OPEN","hit_factor":5.5268},{"match_name":"North Lawrence Fish and Game 10-20-18","match_date":"2018-10-20","stage_classifiercode":"99-11","member_number":"A102834","first_name":"DAVID","last_name":"CONLEY","classification":"C","division":"OPEN","hit_factor":5.526},{"match_name":"Pardoe Sportsmens Association- USPSA Saturday 4-3-21","match_date":"2021-04-03","stage_classifiercode":"99-11","member_number":"FY90731","first_name":"MICHAEL","last_name":"FORD","classification":"U","division":"OPEN","hit_factor":5.5215},{"match_name":"ORSA USPSA October 2017","match_date":"2017-10-21","stage_classifiercode":"99-11","member_number":"\"\"","first_name":"TIM","last_name":"CASEY","classification":"\"\"","division":"OPEN","hit_factor":5.5192},{"match_name":"November 2016 PCSI USPSA Monster Match","match_date":"2016-11-05","stage_classifiercode":"99-11","member_number":"A85085","first_name":"RICK","last_name":"NEASE","classification":"B","division":"OPEN","hit_factor":5.513},{"match_name":"RSCS USPSA  27 Mar 2016","match_date":"2016-03-27","stage_classifiercode":"99-11","member_number":"A-90286","first_name":"ROBERT","last_name":"THOMURE","classification":"U","division":"OPEN","hit_factor":5.511},{"match_name":"MRPC OHS02 042218","match_date":"2018-04-21","stage_classifiercode":"99-11","member_number":"TY77376","first_name":"RON","last_name":"WELKER","classification":"U","division":"OPEN","hit_factor":5.5094},{"match_name":"Pathfinder July USPSA Match","match_date":"2018-07-15","stage_classifiercode":"99-11","member_number":"A101569","first_name":"VINCENT","last_name":"PERRONE","classification":"none","division":"OPEN","hit_factor":5.5046},{"match_name":"TBAS USPSA Match 2/23/20","match_date":"2020-02-23","stage_classifiercode":"99-11","member_number":"A82205","first_name":"DALE","last_name":"CLELLAND","classification":"","division":"OPEN","hit_factor":5.5046},{"match_name":"LCSA  USPSA April 2017","match_date":"2017-04-08","stage_classifiercode":"99-11","member_number":"A90924","first_name":"SOPHIA","last_name":"SMITH","classification":"C","division":"OPEN","hit_factor":5.5028},{"match_name":"Armory Indoor League","match_date":"2016-09-23","stage_classifiercode":"99-11","member_number":"\"\"","first_name":"SETH","last_name":"YOUNG","classification":"U","division":"OPEN","hit_factor":5.5026},{"match_name":"MPSA 07182020 USPSA","match_date":"2020-07-18","stage_classifiercode":"99-11","member_number":"L4195","first_name":"THOMAS","last_name":"HEARD","classification":"C","division":"OPEN","hit_factor":5.5026},{"match_name":"Payson Practical Shooters Action Shooting ","match_date":"2021-11-04","stage_classifiercode":"99-11","member_number":"L1436","first_name":"AVERY","last_name":"CLONTZ","classification":"U","division":"OPEN","hit_factor":5.5006},{"match_name":"Oakdale USPSA MN07 8-12-2021","match_date":"2021-08-12","stage_classifiercode":"99-11","member_number":"A57121","first_name":"JOE","last_name":"GRIFFIN","classification":"B","division":"OPEN","hit_factor":5.4976},{"match_name":"Rio Grande Practical Shooters - Oct 2015","match_date":"2015-10-03","stage_classifiercode":"99-11","member_number":"TY24322","first_name":"RANDY","last_name":"RYAN","classification":"M","division":"OPEN","hit_factor":5.4927},{"match_name":"ARPC USPSA Match 3-26-17","match_date":"2017-03-26","stage_classifiercode":"99-11","member_number":"TY80998","first_name":"JIM","last_name":"ROTHBARTH","classification":"C","division":"OPEN","hit_factor":5.4907},{"match_name":"FSA-USPSA-03-11-2018","match_date":"2018-03-11","stage_classifiercode":"99-11","member_number":"l4071","first_name":"RAY","last_name":"FEGER","classification":"C","division":"OPEN","hit_factor":5.4902},{"match_name":"Dundee Practical Shooters - Oct 27 2018","match_date":"2018-10-27","stage_classifiercode":"99-11","member_number":"A101001","first_name":"TIM","last_name":"AUSTIN","classification":"B","division":"OPEN","hit_factor":5.4902},{"match_name":"TPS USPSA at CMP March 18 2017","match_date":"2017-03-18","stage_classifiercode":"99-11","member_number":"TY41492","first_name":"MARK","last_name":"HEARN","classification":"C","division":"OPEN","hit_factor":5.4878},{"match_name":"Ontelaunee USPSA Hose Fest","match_date":"2021-01-02","stage_classifiercode":"99-11","member_number":"FY83515","first_name":"JAMES","last_name":"VALERIANO","classification":"C","division":"OPEN","hit_factor":5.4857},{"match_name":"June 2018 CAS USPSA","match_date":"2018-06-03","stage_classifiercode":"99-11","member_number":"L4343","first_name":"EDWARD","last_name":"LISTER","classification":"U","division":"OPEN","hit_factor":5.4839},{"match_name":"Richmond Hot Shots January 17-2016 USPSA Pistol","match_date":"2016-01-17","stage_classifiercode":"99-11","member_number":"A85957","first_name":"TRISTAN","last_name":"TOLENTINO","classification":"B","division":"OPEN","hit_factor":5.4839},{"match_name":"Rio Salado RSPP 3rd Saturday February 2020","match_date":"2020-02-15","stage_classifiercode":"99-11","member_number":"TY16908","first_name":"SPENCE","last_name":"CUTRELL","classification":"A","division":"OPEN","hit_factor":5.4835},{"match_name":"Applied IN25 USPSA January 17th 2018","match_date":"2018-01-17","stage_classifiercode":"99-11","member_number":"Ty86867","first_name":"ANDREW","last_name":"HEATH","classification":"M","division":"OPEN","hit_factor":5.4825},{"match_name":"WNPL USPSA - Nov 2017","match_date":"2017-11-05","stage_classifiercode":"99-11","member_number":"A55939","first_name":"STEVE","last_name":"SCHUETTE","classification":"B","division":"OPEN","hit_factor":5.4822},{"match_name":"PSAC_20161022","match_date":"2016-10-22","stage_classifiercode":"99-11","member_number":"A74075","first_name":"KAIDEN","last_name":"DOBYNS","classification":"\"\"","division":"OPEN","hit_factor":5.477},{"match_name":"COPS 2015 Missouri Fall Classic","match_date":"2015-10-03","stage_classifiercode":"99-11","member_number":"A51784","first_name":"JOEL","last_name":"PARKS","classification":"C","division":"OPEN","hit_factor":5.4741},{"match_name":"RBPS April Pistol","match_date":"2016-04-17","stage_classifiercode":"99-11","member_number":"TY21034","first_name":"BOB","last_name":"URBAN","classification":"M","division":"OPEN","hit_factor":5.4645},{"match_name":"RBGC 2017-06-24","match_date":"2017-06-24","stage_classifiercode":"99-11","member_number":"TY93235","first_name":"JENNIFER","last_name":"PETTY","classification":"C","division":"OPEN","hit_factor":5.4636},{"match_name":"FSTC Classifier - December 2016","match_date":"2016-12-18","stage_classifiercode":"99-11","member_number":"Fy53791","first_name":"MICHAEL","last_name":"OLSON","classification":"C","division":"OPEN","hit_factor":5.4622},{"match_name":"CJR&PC USPSA  June 10","match_date":"2018-06-10","stage_classifiercode":"99-11","member_number":"TY92927","first_name":"ANTHONY","last_name":"MAINOLFI","classification":"\"\"","division":"OPEN","hit_factor":5.4591},{"match_name":"Richmond Hot Shots January 17-2016 USPSA Pistol","match_date":"2016-01-17","stage_classifiercode":"99-11","member_number":"A67589","first_name":"DEXTER","last_name":"LOPEZ","classification":"C","division":"OPEN","hit_factor":5.4572},{"match_name":"SWGC USPSA Pistol Match - November 2021","match_date":"2021-11-06","stage_classifiercode":"99-11","member_number":"TY39085","first_name":"MARTIN","last_name":"LITTLE","classification":"M","division":"OPEN","hit_factor":5.457},{"match_name":"PRPSA USPSA CHALLENGE PAN AMERICAN","match_date":"2021-07-11","stage_classifiercode":"99-11","member_number":"HFLORES","first_name":"HECTOR","last_name":"FLORES MORALES","classification":"","division":"OPEN","hit_factor":5.457},{"match_name":"ENPS 2018 June USPSA Match","match_date":"2018-06-03","stage_classifiercode":"99-11","member_number":"A19646","first_name":"RICHARD","last_name":"MARX","classification":"B","division":"OPEN","hit_factor":5.4545},{"match_name":"Range 54 USPSA","match_date":"2017-03-10","stage_classifiercode":"99-11","member_number":"a100769","first_name":"SAM","last_name":"DYE","classification":"U","division":"OPEN","hit_factor":5.4487},{"match_name":"GWPP August 2018 Pistol","match_date":"2018-08-11","stage_classifiercode":"99-11","member_number":"TY7309","first_name":"STEVE","last_name":"JACK","classification":"M","division":"OPEN","hit_factor":5.4398},{"match_name":"Richmond Hot Shots January 17-2016 USPSA Pistol","match_date":"2016-01-17","stage_classifiercode":"99-11","member_number":"A88783","first_name":"JOHNMAR","last_name":"SAMSON","classification":"B","division":"OPEN","hit_factor":5.4381},{"match_name":"BHPSC Monthly Match October 2018","match_date":"2018-10-26","stage_classifiercode":"99-11","member_number":"A90285","first_name":"CHRIS","last_name":"HOOVER","classification":"A","division":"OPEN","hit_factor":5.4363},{"match_name":"BGS Hudson Week 1","match_date":"2017-11-26","stage_classifiercode":"99-11","member_number":"TY94384","first_name":"ROBERT","last_name":"UPEGUI","classification":"B","division":"OPEN","hit_factor":5.4348},{"match_name":"Prescott 1 st Saturday 12-03-2016","match_date":"2016-12-03","stage_classifiercode":"99-11","member_number":"TY96704","first_name":"LANCE","last_name":"HUPPER","classification":"C","division":"OPEN","hit_factor":5.4348},{"match_name":"Shongum November 2021 USPSA Match","match_date":"2021-11-06","stage_classifiercode":"99-11","member_number":"A115011","first_name":"MARK","last_name":"MIELKE","classification":"X","division":"OPEN","hit_factor":5.4348},{"match_name":"OK15 USPSA at USSA May 6th 2018","match_date":"2018-05-06","stage_classifiercode":"99-11","member_number":"A77565","first_name":"JASON","last_name":"GRANT","classification":"C","division":"OPEN","hit_factor":5.4274},{"match_name":"NHRPC - March 2021 USPSA","match_date":"2021-03-14","stage_classifiercode":"99-11","member_number":"Ty103194","first_name":"KYLE","last_name":"SAMS","classification":"B","division":"OPEN","hit_factor":5.4252},{"match_name":"LCSC Linden USPSA 092621","match_date":"2021-09-25","stage_classifiercode":"99-11","member_number":"TY107336","first_name":"JACKIE","last_name":"ZHAO","classification":"C","division":"OPEN","hit_factor":5.4217},{"match_name":"SCAPSA MN05 Summer League 8","match_date":"2017-08-01","stage_classifiercode":"99-11","member_number":"FY53872","first_name":"JON","last_name":"MCCARTY","classification":"B","division":"OPEN","hit_factor":5.4198},{"match_name":"CVSC 07-29-2018","match_date":"2018-07-29","stage_classifiercode":"99-11","member_number":"L4383","first_name":"BRYAN","last_name":"LARSON","classification":"A","division":"OPEN","hit_factor":5.418},{"match_name":"Castlewood July 2017 USPSA Match","match_date":"2017-07-22","stage_classifiercode":"99-11","member_number":"A-101737","first_name":"JOHN","last_name":"BRIMLOW","classification":"C","division":"OPEN","hit_factor":5.4115},{"match_name":"DAPS USPSA at ETTS 7-8-17","match_date":"2017-07-08","stage_classifiercode":"99-11","member_number":"TY50225","first_name":"RHONDA","last_name":"STONAKER","classification":"B","division":"OPEN","hit_factor":5.4092},{"match_name":"SLOSA NOVEMBER 2017 USPSA MATCH","match_date":"2017-11-11","stage_classifiercode":"99-11","member_number":"A97236","first_name":"LORIN","last_name":"WINGFIELD","classification":"U","division":"OPEN","hit_factor":5.4027},{"match_name":"ETRPC-USPSA","match_date":"2021-03-27","stage_classifiercode":"99-11","member_number":"TY93367","first_name":"JAY","last_name":"LONG","classification":"B","division":"OPEN","hit_factor":5.4012},{"match_name":"GTS Indoor USPSA February 27 2020","match_date":"2020-02-28","stage_classifiercode":"99-11","member_number":"A105203","first_name":"ERIC","last_name":"RULOFSON","classification":"U","division":"OPEN","hit_factor":5.3996},{"match_name":"RBPS April Pistol","match_date":"2016-04-17","stage_classifiercode":"99-11","member_number":"TY75013","first_name":"BETH","last_name":"HYNES","classification":"C","division":"OPEN","hit_factor":5.3977},{"match_name":"Rankin Field June Sunday USPSA","match_date":"2020-06-21","stage_classifiercode":"99-11","member_number":"TY114590","first_name":"JEREMY","last_name":"ALBRIGHT","classification":"U","division":"OPEN","hit_factor":5.3977},{"match_name":"Brazosland Pistoleros USPSA - Sunday August 8th","match_date":"2021-08-08","stage_classifiercode":"99-11","member_number":"A131290","first_name":"ROBERT","last_name":"TAYLOR","classification":"U","division":"OPEN","hit_factor":5.3957},{"match_name":"Payson Practical Shooters Action Shooting ","match_date":"2021-11-04","stage_classifiercode":"99-11","member_number":"TY50145","first_name":"SUE","last_name":"LITTLE","classification":"C","division":"OPEN","hit_factor":5.3927},{"match_name":"Extreme GM USPSA  November","match_date":"2020-11-27","stage_classifiercode":"99-11","member_number":"A107644","first_name":"ISAGANI","last_name":"RIRAO","classification":"C","division":"OPEN","hit_factor":5.3922},{"match_name":"WI21 June 24 2018 Points Match","match_date":"2018-06-06","stage_classifiercode":"99-11","member_number":"L4071","first_name":"RAY","last_name":"FEGER","classification":"C","division":"OPEN","hit_factor":5.3898},{"match_name":"Lefthanders Gun Club Practical Shooters October","match_date":"2017-09-30","stage_classifiercode":"99-11","member_number":"TY10182","first_name":"BRYAN","last_name":"MILLER","classification":"A","division":"OPEN","hit_factor":5.3898},{"match_name":"TCGC Polo July 2017","match_date":"2017-07-23","stage_classifiercode":"99-11","member_number":"L1697","first_name":"DENNY","last_name":"SHADEL","classification":"C","division":"OPEN","hit_factor":5.3879},{"match_name":"Shadow Hawk Defense USPSA Special Classifier","match_date":"2020-11-14","stage_classifiercode":"99-11","member_number":"a107669","first_name":"JUNG","last_name":"PARK","classification":"U","division":"OPEN","hit_factor":5.3821},{"match_name":"Rankin field Sunday match Clone","match_date":"2016-07-17","stage_classifiercode":"99-11","member_number":"FY29119","first_name":"EDDY","last_name":"DICE","classification":"B","division":"OPEN","hit_factor":5.3779},{"match_name":"BA USPSA Jun 17-2017","match_date":"2017-06-11","stage_classifiercode":"99-11","member_number":"A103069","first_name":"CHANCE","last_name":"BILLINGS","classification":"U","division":"OPEN","hit_factor":5.3776},{"match_name":"SWGC USPSA Pistol Match - November 2021","match_date":"2021-11-06","stage_classifiercode":"99-11","member_number":"A116868","first_name":"MICHAEL","last_name":"MADUSKE","classification":"B","division":"OPEN","hit_factor":5.3731},{"match_name":"Pitcairn-Monroeville Sportsmens Club USPSA August 2017","match_date":"2017-08-05","stage_classifiercode":"99-11","member_number":"Na","first_name":"BRANDON","last_name":"BONNER","classification":"U","division":"OPEN","hit_factor":5.3731},{"match_name":"WELD ECO09 20180916","match_date":"2018-09-16","stage_classifiercode":"99-11","member_number":"L3588","first_name":"DEBBIE","last_name":"PATTON","classification":"C","division":"OPEN","hit_factor":5.3706},{"match_name":"LA05 Tangi June USPSA 2020","match_date":"2020-06-28","stage_classifiercode":"99-11","member_number":"TY64029","first_name":"VIC","last_name":"SAUNIER","classification":"C","division":"OPEN","hit_factor":5.3683},{"match_name":"Matamoras USPSA August Match","match_date":"2017-08-27","stage_classifiercode":"99-11","member_number":"A101569","first_name":"VINCENT","last_name":"PERRONE","classification":"C","division":"OPEN","hit_factor":5.3521},{"match_name":"SEPSA July 2017","match_date":"2017-07-08","stage_classifiercode":"99-11","member_number":"TY73281","first_name":"JACK","last_name":"DARTIGALONGUE","classification":"C","division":"OPEN","hit_factor":5.3515},{"match_name":"Maine Practical Shooters March 2018","match_date":"2018-03-24","stage_classifiercode":"99-11","member_number":"A87906","first_name":"TIM","last_name":"LECLAIR","classification":"D","division":"OPEN","hit_factor":5.3486},{"match_name":"AGC_20170903","match_date":"2017-09-03","stage_classifiercode":"99-11","member_number":"A105218","first_name":"ROBERT","last_name":"RHINER","classification":"U","division":"OPEN","hit_factor":5.3471},{"match_name":"CJR&PC USPSA  June 10","match_date":"2018-06-10","stage_classifiercode":"99-11","member_number":"A92575","first_name":"RICHARD","last_name":"LAROCCA","classification":"\"\"","division":"OPEN","hit_factor":5.3455},{"match_name":"Denali September","match_date":"2018-09-07","stage_classifiercode":"99-11","member_number":"L3808","first_name":"MARK","last_name":"BROWN","classification":"B","division":"OPEN","hit_factor":5.3412},{"match_name":"SLPSA July USPSA match","match_date":"2018-07-21","stage_classifiercode":"99-11","member_number":"L3900","first_name":"STEVE","last_name":"TERRY","classification":"C","division":"OPEN","hit_factor":5.3358},{"match_name":"WNYPPL August 2017 Classifier Match","match_date":"2017-08-27","stage_classifiercode":"99-11","member_number":"L1021","first_name":"JOE","last_name":"MITCHELL","classification":"A","division":"OPEN","hit_factor":5.3319},{"match_name":"Castlewood USPSA Sept 2020 shoot","match_date":"2020-09-26","stage_classifiercode":"99-11","member_number":"L2555","first_name":"TERRY","last_name":"HALDIN","classification":"C","division":"OPEN","hit_factor":5.3297},{"match_name":"BUAS February Match","match_date":"2018-02-11","stage_classifiercode":"99-11","member_number":"A22549","first_name":"STEPHEN","last_name":"BROWN","classification":"B","division":"OPEN","hit_factor":5.3296},{"match_name":"November 2016 PCSI USPSA Monster Match","match_date":"2016-11-05","stage_classifiercode":"99-11","member_number":"TY66305","first_name":"HERB","last_name":"SMITH","classification":"B","division":"OPEN","hit_factor":5.3284},{"match_name":"OFGC Practical Pistol Match 01-19-2020","match_date":"2020-01-19","stage_classifiercode":"99-11","member_number":"TY72436","first_name":"ROBERT","last_name":"TERBIETEN","classification":"B","division":"OPEN","hit_factor":5.3265},{"match_name":"BUAS February Match","match_date":"2020-02-09","stage_classifiercode":"99-11","member_number":"ty53502","first_name":"DAVID","last_name":"PARKER","classification":"X","division":"OPEN","hit_factor":5.3241},{"match_name":"CSA For PCGC","match_date":"2016-06-26","stage_classifiercode":"99-11","member_number":"A85695","first_name":"ALAN","last_name":"FRENCH","classification":"C","division":"OPEN","hit_factor":5.3167},{"match_name":"Heritage March 2021 USPSA","match_date":"2021-03-13","stage_classifiercode":"99-11","member_number":"A87604","first_name":"ETHAN","last_name":"HOWELL","classification":"G","division":"OPEN","hit_factor":5.3161},{"match_name":"Springfield Tactical Shooters 04/05/2018","match_date":"2018-04-05","stage_classifiercode":"99-11","member_number":"L3651","first_name":"RYAN","last_name":"BRADLEY","classification":"A","division":"OPEN","hit_factor":5.3156},{"match_name":"CSA Coalfield Shooters Association USPSA March 2020","match_date":"2020-03-08","stage_classifiercode":"99-11","member_number":"TY2931","first_name":"ROGER","last_name":"RAMEY","classification":"C","division":"OPEN","hit_factor":5.315},{"match_name":"Bridgeville - USPSA - Dec","match_date":"2020-12-06","stage_classifiercode":"99-11","member_number":"A102632","first_name":"BILL","last_name":"COLEMAN","classification":"B","division":"OPEN","hit_factor":5.3111},{"match_name":"RBPS April Pistol","match_date":"2016-04-17","stage_classifiercode":"99-11","member_number":"FY89061","first_name":"DAVE","last_name":"PANICCIA","classification":"D","division":"OPEN","hit_factor":5.3109},{"match_name":"WNPL USPSA - REDEMPTION - NOVEMBER 2016","match_date":"2016-11-06","stage_classifiercode":"99-11","member_number":"TY84503","first_name":"CRISTINA","last_name":"GO","classification":"D","division":"OPEN","hit_factor":5.3073},{"match_name":"2020-03 Bone Creek USPSA","match_date":"2020-03-01","stage_classifiercode":"99-11","member_number":"TY73010","first_name":"KYLE","last_name":"SAYRE","classification":"B","division":"OPEN","hit_factor":5.3053},{"match_name":"COPS 2015 Missouri Fall Classic","match_date":"2015-10-03","stage_classifiercode":"99-11","member_number":"Ty42278","first_name":"KELLY","last_name":"RAGLIN","classification":"M","division":"OPEN","hit_factor":5.3045},{"match_name":"PSAC_20161022","match_date":"2016-10-22","stage_classifiercode":"99-11","member_number":"A61105","first_name":"SANDRA","last_name":"SOTO","classification":"\"\"","division":"OPEN","hit_factor":5.3023},{"match_name":"PRG - Oh Shoot USPSA February 21st - 3rd Sunday Match","match_date":"2021-02-21","stage_classifiercode":"99-11","member_number":"ty102087","first_name":"KEN","last_name":"REDDING","classification":"C","division":"OPEN","hit_factor":5.3004},{"match_name":"Dundee Practical Shooters - Oct 27 2018","match_date":"2018-10-27","stage_classifiercode":"99-11","member_number":"TY34264","first_name":"GARY","last_name":"FISH","classification":"B","division":"OPEN","hit_factor":5.296},{"match_name":"Grandbaggers August 2017","match_date":"2017-08-03","stage_classifiercode":"99-11","member_number":"TY92648","first_name":"ET","last_name":"SAFFON","classification":"M","division":"OPEN","hit_factor":5.2885},{"match_name":"Prescott 1 st Saturday 12-03-2016","match_date":"2016-12-03","stage_classifiercode":"99-11","member_number":"TY30283","first_name":"LARRY","last_name":"FOUTZ","classification":"B","division":"OPEN","hit_factor":5.2859},{"match_name":"Dundee Practical Shooters - Oct 27 2018","match_date":"2018-10-27","stage_classifiercode":"99-11","member_number":"TY45897","first_name":"LAWRENCE","last_name":"MULL","classification":"C","division":"OPEN","hit_factor":5.2854},{"match_name":"Georgia Run N Gun 1-28-2016","match_date":"2016-01-29","stage_classifiercode":"99-11","member_number":"A84201","first_name":"ZANE","last_name":"RUTLEDGE","classification":"C","division":"OPEN","hit_factor":5.2823},{"match_name":"G2G Practical Shooters 10-16-2018","match_date":"2018-10-16","stage_classifiercode":"99-11","member_number":"A21017","first_name":"DAVID","last_name":"KONG","classification":"C","division":"OPEN","hit_factor":5.2805},{"match_name":"Ontelaunee USPSA  July 2018","match_date":"2018-07-29","stage_classifiercode":"99-11","member_number":"A15037","first_name":"STEVEN","last_name":"DUNKEL","classification":"B","division":"OPEN","hit_factor":5.2767},{"match_name":"APSA May 2016 USPSA Match","match_date":"2016-05-14","stage_classifiercode":"99-11","member_number":"TY85933","first_name":"STEVE","last_name":"KELLY","classification":"U","division":"OPEN","hit_factor":5.2733},{"match_name":"SLPSA July USPSA match","match_date":"2018-07-21","stage_classifiercode":"99-11","member_number":"\"\"","first_name":"DAVID","last_name":"KIRKWOOD","classification":"U","division":"OPEN","hit_factor":5.2707},{"match_name":"WLPS USPSA May 2016","match_date":"2016-05-22","stage_classifiercode":"99-11","member_number":"A80868","first_name":"CHAD","last_name":"PRITCHARD","classification":"U","division":"OPEN","hit_factor":5.2705},{"match_name":"LPRGC - Lower Providence USPSA October 2018","match_date":"2018-10-06","stage_classifiercode":"99-11","member_number":"PENDING","first_name":"JOSEPH MARTIN","last_name":"SANTOS","classification":"U","division":"OPEN","hit_factor":5.2692},{"match_name":"ARPC USPSA Match 3-26-17","match_date":"2017-03-26","stage_classifiercode":"99-11","member_number":"A32462","first_name":"BRADLEY","last_name":"BOYD","classification":"C","division":"OPEN","hit_factor":5.2685},{"match_name":"NVSA USPSA 1811","match_date":"2018-11-04","stage_classifiercode":"99-11","member_number":"A107874","first_name":"KRISTOPHER","last_name":"BERNSTEIN","classification":"U","division":"OPEN","hit_factor":5.2679},{"match_name":"Monson March 2016","match_date":"2016-03-26","stage_classifiercode":"99-11","member_number":"TY60000","first_name":"GREG","last_name":"SOUCIE","classification":"A","division":"OPEN","hit_factor":5.2632},{"match_name":"ARPC USPSA Match 5-27-18","match_date":"2018-05-27","stage_classifiercode":"99-11","member_number":"NONE","first_name":"MATTHEW","last_name":"CROW","classification":"Unclassified","division":"OPEN","hit_factor":5.2632},{"match_name":"FBURG March Level I USPSA","match_date":"2016-03-06","stage_classifiercode":"99-11","member_number":"L3977","first_name":"SCOT","last_name":"COOK","classification":"B","division":"OPEN","hit_factor":5.2632},{"match_name":"Prescott 1 st Saturday 12-03-2016","match_date":"2016-12-03","stage_classifiercode":"99-11","member_number":"A54668","first_name":"DAVE","last_name":"ZINK","classification":"U","division":"OPEN","hit_factor":5.257},{"match_name":"Cactus USPSA ALL CLASSIFIER August 2020","match_date":"2020-08-02","stage_classifiercode":"99-11","member_number":"A103599","first_name":"BEN","last_name":"KRUSE","classification":"U","division":"OPEN","hit_factor":5.2559},{"match_name":"Coyote USPSA match 4-21-18","match_date":"2018-04-21","stage_classifiercode":"99-11","member_number":"A85241","first_name":"JEFF","last_name":"WILLIAMS","classification":"A","division":"OPEN","hit_factor":5.2542},{"match_name":"Payson Practical Shooters USPSA Jan 2 2021","match_date":"2021-01-02","stage_classifiercode":"99-11","member_number":"Ty50145","first_name":"SUE","last_name":"LITTLE","classification":"C","division":"OPEN","hit_factor":5.2531},{"match_name":"Grandbaggers 07-05-2018","match_date":"2018-07-05","stage_classifiercode":"99-11","member_number":"A103229","first_name":"STEPHANIE","last_name":"THOME","classification":"C","division":"OPEN","hit_factor":5.2493},{"match_name":"RBGC 2017-06-24","match_date":"2017-06-24","stage_classifiercode":"99-11","member_number":"L3945","first_name":"ERIC","last_name":"HAGAN","classification":"C","division":"OPEN","hit_factor":5.2482},{"match_name":"GAS Special Classifier","match_date":"2016-07-02","stage_classifiercode":"99-11","member_number":"A89426","first_name":"LARRY","last_name":"SCUSA","classification":"C","division":"OPEN","hit_factor":5.2434},{"match_name":"GLSRC pistol 1-2-18","match_date":"2018-01-01","stage_classifiercode":"99-11","member_number":"\"\"","first_name":"BILL","last_name":"COBB","classification":"U","division":"OPEN","hit_factor":5.2419},{"match_name":"May 14th YVPS USPSA","match_date":"2016-05-14","stage_classifiercode":"99-11","member_number":"\"\"","first_name":"SEAN","last_name":"NALETTE","classification":"\"\"","division":"OPEN","hit_factor":5.2411},{"match_name":"HTF Practical Shooters","match_date":"2018-10-04","stage_classifiercode":"99-11","member_number":"A106631","first_name":"JOEY","last_name":"TOMLINSON","classification":"B","division":"OPEN","hit_factor":5.2402},{"match_name":"Maryland Practical Shooters Association July 2018","match_date":"2018-07-22","stage_classifiercode":"99-11","member_number":"TY33946","first_name":"FREDERICK","last_name"