[{"match_name":"LdF USPSA Match November 7 2021","match_date":"2021-11-07","stage_classifiercode":"20-01","member_number":"A88221","first_name":"JON","last_name":"BAUTISTA","classification":"M","division":"CARRY OPTICS","hit_factor":9.0062},{"match_name":"DCSC MONTHLY USPSA MATCH","match_date":"2021-07-02","stage_classifiercode":"20-01","member_number":"A119214","first_name":"BRENNAN","last_name":"CONAWAY","classification":"U","division":"CARRY OPTICS","hit_factor":8.75},{"match_name":"PMRPC USPSA 12Dec20 - all Classifier","match_date":"2020-12-12","stage_classifiercode":"20-01","member_number":"A129703","first_name":"BRENDON","last_name":"KEISER","classification":"B","division":"CARRY OPTICS","hit_factor":8.547},{"match_name":"STAGE ZERO ALL CLASSIFIER","match_date":"2021-09-04","stage_classifiercode":"20-01","member_number":"A128926","first_name":"SAMUEL","last_name":"NELSON99","classification":"A","division":"CARRY OPTICS","hit_factor":8.3218},{"match_name":"STAGE ZERO ALL CLASSIFIER","match_date":"2021-09-04","stage_classifiercode":"20-01","member_number":"A123280","first_name":"DON","last_name":"SMART","classification":"A","division":"CARRY OPTICS","hit_factor":8.2504},{"match_name":"QPS Quantico Shooting Club December USPSA   ","match_date":"2020-12-12","stage_classifiercode":"20-01","member_number":"A83744","first_name":"SCOTT","last_name":"RADER","classification":"M","division":"CARRY OPTICS","hit_factor":8.1514},{"match_name":"CCPS July 2021 USPSA","match_date":"2021-07-04","stage_classifiercode":"20-01","member_number":"A90516","first_name":"JARED","last_name":"FOX","classification":"G","division":"CARRY OPTICS","hit_factor":8.0717},{"match_name":"ESPS  USPSA  March","match_date":"2021-03-27","stage_classifiercode":"20-01","member_number":"A81062","first_name":"MICHAEL","last_name":"ENNIS","classification":"M","division":"CARRY OPTICS","hit_factor":8.0344},{"match_name":"DSSA 2021-02 USPSA Pistol","match_date":"2021-02-28","stage_classifiercode":"20-01","member_number":"A111663","first_name":"JIM","last_name":"KRANTZ","classification":"M","division":"CARRY OPTICS","hit_factor":8.0221},{"match_name":"STAGE ZERO  ALL CLASSIFIER","match_date":"2020-11-21","stage_classifiercode":"20-01","member_number":"A113889","first_name":"BRANDON","last_name":"ALVAREZ2","classification":"M","division":"CARRY OPTICS","hit_factor":7.932},{"match_name":"STAGE ZERO  ALL CLASSIFIER","match_date":"2020-11-21","stage_classifiercode":"20-01","member_number":"A126015","first_name":"JAKE","last_name":"MORROW99","classification":"M","division":"CARRY OPTICS","hit_factor":7.8984},{"match_name":"BORCC USPSA April 2021","match_date":"2021-04-17","stage_classifiercode":"20-01","member_number":"A117264","first_name":"JOHN","last_name":"CHINCHEN","classification":"M","division":"CARRY OPTICS","hit_factor":7.8303},{"match_name":"TPS USPSA At CMP July 17 2021","match_date":"2021-07-17","stage_classifiercode":"20-01","member_number":"A90256","first_name":"KEEGAN","last_name":"SINGETON","classification":"M","division":"CARRY OPTICS","hit_factor":7.7562},{"match_name":"RBGC USPSA 2021-01-23","match_date":"2021-01-23","stage_classifiercode":"20-01","member_number":"A58496","first_name":"GREG","last_name":"SMITH","classification":"G","division":"CARRY OPTICS","hit_factor":7.7455},{"match_name":"17s PSC - USPSA - January 2021","match_date":"2021-01-16","stage_classifiercode":"20-01","member_number":"A81371","first_name":"BRIAN","last_name":"GIOVANNINI","classification":"M","division":"CARRY OPTICS","hit_factor":7.7241},{"match_name":"GoShoot Outdoor A6 Warm up And Classifier match!","match_date":"2021-04-03","stage_classifiercode":"20-01","member_number":"A116503","first_name":"ADDISON","last_name":"CLARK2","classification":"A","division":"CARRY OPTICS","hit_factor":7.723},{"match_name":"BORCC USPSA April 2021","match_date":"2021-04-17","stage_classifiercode":"20-01","member_number":"L4606","first_name":"JOSEPH","last_name":"MARGHERONE","classification":"M","division":"CARRY OPTICS","hit_factor":7.7121},{"match_name":"ACPSA November 2020","match_date":"2020-11-28","stage_classifiercode":"20-01","member_number":"A124198","first_name":"SAM","last_name":"SCHIPPER","classification":"A","division":"CARRY OPTICS","hit_factor":7.7042},{"match_name":"FBURG September 2021 USPSA","match_date":"2021-09-05","stage_classifiercode":"20-01","member_number":"L4988","first_name":"LUKE","last_name":"CAO","classification":"G","division":"CARRY OPTICS","hit_factor":7.7033},{"match_name":"Dundee Practical Shooters - Feb 27 2021","match_date":"2021-02-27","stage_classifiercode":"20-01","member_number":"TY96364","first_name":"MICAH","last_name":"SWAN","classification":"M","division":"CARRY OPTICS","hit_factor":7.7022},{"match_name":"OREGON ARPC CC05 USPSA NOVEMBER 14 2020","match_date":"2020-11-14","stage_classifiercode":"20-01","member_number":"A9917","first_name":"DOUG","last_name":"NEWQUIST","classification":"M","division":"CARRY OPTICS","hit_factor":7.6628},{"match_name":"Oh Shoot -PRG Nov 27th - Uspsa Classifier Match","match_date":"2021-11-27","stage_classifiercode":"20-01","member_number":"A118929","first_name":"GOVINDA2","last_name":"IFURUNG","classification":"B","division":"CARRY OPTICS","hit_factor":7.6618},{"match_name":"MPSA 2020-11-21","match_date":"2020-11-21","stage_classifiercode":"20-01","member_number":"A98845","first_name":"BLAYNE","last_name":"DUPUY","classification":"M","division":"CARRY OPTICS","hit_factor":7.6487},{"match_name":"Volusia County Gun and Hunt Club","match_date":"2020-11-21","stage_classifiercode":"20-01","member_number":"A101884","first_name":"ANTHONY","last_name":"PARRA","classification":"A","division":"CARRY OPTICS","hit_factor":7.6023},{"match_name":"LdF USPSA Classifier Match December 12 2020","match_date":"2020-12-12","stage_classifiercode":"20-01","member_number":"FY97525","first_name":"LIANG","last_name":"GUO","classification":"A","division":"CARRY OPTICS","hit_factor":7.5619},{"match_name":"SOAP July 2021 USPSA Match","match_date":"2021-07-11","stage_classifiercode":"20-01","member_number":"A91378","first_name":"CHRISTOPHER","last_name":"BUENDIA","classification":"A","division":"CARRY OPTICS","hit_factor":7.5574},{"match_name":"Oh Shoot -PRG Nov 27th - Uspsa Classifier Match","match_date":"2021-11-27","stage_classifiercode":"20-01","member_number":"A131623","first_name":"ANDY","last_name":"ZAMORA","classification":"A","division":"CARRY OPTICS","hit_factor":7.5472},{"match_name":"MAPSA 5/8/21","match_date":"2021-05-08","stage_classifiercode":"20-01","member_number":"Ty115837","first_name":"NOAH","last_name":"GOODRICH","classification":"G","division":"CARRY OPTICS","hit_factor":7.5472},{"match_name":"Matamoras USPSA September 2021","match_date":"2021-09-19","stage_classifiercode":"20-01","member_number":"TY98581","first_name":"CHRISTOPHER","last_name":"SENDELSKY","classification":"M","division":"CARRY OPTICS","hit_factor":7.5472},{"match_name":"ACPSA November 2020","match_date":"2020-11-28","stage_classifiercode":"20-01","member_number":"A88003","first_name":"RICH","last_name":"OTT","classification":"M","division":"CARRY OPTICS","hit_factor":7.5253},{"match_name":"DCSC MONTHLY USPSA MATCH","match_date":"2021-07-02","stage_classifiercode":"20-01","member_number":"A104151","first_name":"SETH","last_name":"MCMAHAN","classification":"A","division":"CARRY OPTICS","hit_factor":7.5145},{"match_name":"Moss Branch USPSA June match","match_date":"2021-06-26","stage_classifiercode":"20-01","member_number":"A97854","first_name":"CONNOR","last_name":"WILLIAMS","classification":"A","division":"CARRY OPTICS","hit_factor":7.4967},{"match_name":"BORCC USPSA April 2021","match_date":"2021-04-17","stage_classifiercode":"20-01","member_number":"TY81670","first_name":"DAVID","last_name":"MILLER","classification":"U","division":"CARRY OPTICS","hit_factor":7.4928},{"match_name":"FBURG September 2021 USPSA","match_date":"2021-09-05","stage_classifiercode":"20-01","member_number":"A114066","first_name":"SAMUEL","last_name":"LORINO","classification":"M","division":"CARRY OPTICS","hit_factor":7.4896},{"match_name":"MCTS -  USPSA March 2021 Classifier Match","match_date":"2021-03-21","stage_classifiercode":"20-01","member_number":"A130977","first_name":"ANDREW","last_name":"MILLER","classification":"B","division":"CARRY OPTICS","hit_factor":7.4667},{"match_name":"NW01 T-Day 2020","match_date":"2020-11-08","stage_classifiercode":"20-01","member_number":"A124172","first_name":"KATON","last_name":"BINGHAM","classification":"A","division":"CARRY OPTICS","hit_factor":7.4442},{"match_name":"SFPS 5-16-21 Super Classifier","match_date":"2021-05-16","stage_classifiercode":"20-01","member_number":"FY103448","first_name":"STEVE","last_name":"LAWSON","classification":"C","division":"CARRY OPTICS","hit_factor":7.4405},{"match_name":"Coastal Area Practical Shooters 10-23-21","match_date":"2021-10-23","stage_classifiercode":"20-01","member_number":"A81371","first_name":"BRIAN","last_name":"GIOVANNINI","classification":"M","division":"CARRY OPTICS","hit_factor":7.4369},{"match_name":"MRPC OHS02 06272021","match_date":"2021-06-27","stage_classifiercode":"20-01","member_number":"A87893","first_name":"JOSE","last_name":"ROSSY","classification":"B","division":"CARRY OPTICS","hit_factor":7.4172},{"match_name":"OREGON ARPC CC05 USPSA NOVEMBER 14 2020","match_date":"2020-11-14","stage_classifiercode":"20-01","member_number":"TY96364","first_name":"MICAH","last_name":"SWAN","classification":"M","division":"CARRY OPTICS","hit_factor":7.4074},{"match_name":"Cowtown Pistol Club USPSA MONDAY November 1 2021","match_date":"2021-11-02","stage_classifiercode":"20-01","member_number":"A128043","first_name":"CARRSON","last_name":"HERDING","classification":"M","division":"CARRY OPTICS","hit_factor":7.3885},{"match_name":"Volusia County Gun and Hunt Club","match_date":"2020-11-21","stage_classifiercode":"20-01","member_number":"A89416","first_name":"GORKA","last_name":"IBANEZ CHAROLA","classification":"M","division":"CARRY OPTICS","hit_factor":7.3801},{"match_name":"Nampa USPSA December 5th 2020","match_date":"2020-12-05","stage_classifiercode":"20-01","member_number":"L3972","first_name":"EVANS","last_name":"KUO","classification":"M","division":"CARRY OPTICS","hit_factor":7.3439},{"match_name":"RPS January 2021 USPSA Match","match_date":"2021-01-09","stage_classifiercode":"20-01","member_number":"A127213","first_name":"TAYLOR","last_name":"ELLISON","classification":"C","division":"CARRY OPTICS","hit_factor":7.3394},{"match_name":"WSPS MARCH 2021 USPSA","match_date":"2021-03-20","stage_classifiercode":"20-01","member_number":"TY113265","first_name":"STEVE","last_name":"BIRD","classification":"B","division":"CARRY OPTICS","hit_factor":7.327},{"match_name":"CCPS July 2021 USPSA","match_date":"2021-07-04","stage_classifiercode":"20-01","member_number":"A117463","first_name":"LARK","last_name":"CENIZA","classification":"M","division":"CARRY OPTICS","hit_factor":7.3248},{"match_name":"Collin County USPSA  08-22-2021","match_date":"2021-08-22","stage_classifiercode":"20-01","member_number":"TY129286","first_name":"DARIAN","last_name":"SCHMIDT","classification":"M","division":"CARRY OPTICS","hit_factor":7.3239},{"match_name":"JCSSA DEC 5 2020","match_date":"2020-12-05","stage_classifiercode":"20-01","member_number":"A76773","first_name":"ZACK","last_name":"CAM","classification":"A","division":"CARRY OPTICS","hit_factor":7.3232},{"match_name":"BNA USPSA - July 25 2021 (Brothers N Arms)","match_date":"2021-07-25","stage_classifiercode":"20-01","member_number":"A98844","first_name":"BRYCE","last_name":"DUPUY","classification":"A","division":"CARRY OPTICS","hit_factor":7.3171},{"match_name":"RBGC USPSA 2021-01-23","match_date":"2021-01-23","stage_classifiercode":"20-01","member_number":"TY101758","first_name":"DAVID","last_name":"BOHANNON","classification":"A","division":"CARRY OPTICS","hit_factor":7.3012},{"match_name":"TPS USPSA at CMP Dec 19 2020 Special Classifier Match","match_date":"2020-12-19","stage_classifiercode":"20-01","member_number":"Ty110068","first_name":"SEAN","last_name":"PHAM","classification":"A","division":"CARRY OPTICS","hit_factor":7.2917},{"match_name":"Collin County USPSA  08-22-2021","match_date":"2021-08-22","stage_classifiercode":"20-01","member_number":"A99344","first_name":"KEVIN","last_name":"HARDING","classification":"A","division":"CARRY OPTICS","hit_factor":7.2904},{"match_name":"CCPS July 2021 USPSA","match_date":"2021-07-04","stage_classifiercode":"20-01","member_number":"A92348","first_name":"CHARLIE","last_name":"MODEREGER","classification":"M","division":"CARRY OPTICS","hit_factor":7.2874},{"match_name":"Matamoras USPSA September 2021","match_date":"2021-09-19","stage_classifiercode":"20-01","member_number":"A90521","first_name":"SAMUEL","last_name":"CALLAHAN","classification":"M","division":"CARRY OPTICS","hit_factor":7.2864},{"match_name":"NISA August 2021","match_date":"2021-08-22","stage_classifiercode":"20-01","member_number":"A127768","first_name":"DAVE","last_name":"DEL ROSARIO","classification":"M","division":"CARRY OPTICS","hit_factor":7.2776},{"match_name":"TPS USPSA at CMP Dec 19 2020 Special Classifier Match","match_date":"2020-12-19","stage_classifiercode":"20-01","member_number":"A97854","first_name":"CONNOR","last_name":"WILLIAMS","classification":"B","division":"CARRY OPTICS","hit_factor":7.2682},{"match_name":"LdF USPSA Match November 7 2021","match_date":"2021-11-07","stage_classifiercode":"20-01","member_number":"TY86409","first_name":"BO","last_name":"GIBBONS","classification":"M","division":"CARRY OPTICS","hit_factor":7.2633},{"match_name":"Fast 7-30-21","match_date":"2021-07-30","stage_classifiercode":"20-01","member_number":"Fy99995","first_name":"ALAN","last_name":"SHAFRAN2","classification":"A","division":"CARRY OPTICS","hit_factor":7.2591},{"match_name":"TTS USPSA Match 12JUN2021","match_date":"2021-06-12","stage_classifiercode":"20-01","member_number":"TY87973","first_name":"WALDO","last_name":"SAMANO","classification":"M","division":"CARRY OPTICS","hit_factor":7.2539},{"match_name":"USPSA Strategic Edge SEGR May 15th 2021","match_date":"2021-05-15","stage_classifiercode":"20-01","member_number":"A87762","first_name":"MATT","last_name":"CHANDLER","classification":"B","division":"CARRY OPTICS","hit_factor":7.2464},{"match_name":"Quinton USPSA - April 10 2021","match_date":"2021-04-10","stage_classifiercode":"20-01","member_number":"a111073","first_name":"MATTHEW","last_name":"HEMPLE","classification":"G","division":"CARRY OPTICS","hit_factor":7.2445},{"match_name":"OREGON ARPC CC05 USPSA OCT 9 2021","match_date":"2021-10-09","stage_classifiercode":"20-01","member_number":"A107036","first_name":"BO","last_name":"OELTJEN","classification":"M","division":"CARRY OPTICS","hit_factor":7.2445},{"match_name":"CIPSC IL02 Havana August USPSA","match_date":"2021-08-07","stage_classifiercode":"20-01","member_number":"A102567","first_name":"MIKE","last_name":"STEELE","classification":"M","division":"CARRY OPTICS","hit_factor":7.2409},{"match_name":"LNDL July 11th Classifier Match","match_date":"2021-07-11","stage_classifiercode":"20-01","member_number":"A106099","first_name":"CHASE","last_name":"RAINS","classification":"U","division":"CARRY OPTICS","hit_factor":7.2323},{"match_name":"STAGE ZERO ALL CLASSIFIER","match_date":"2021-09-04","stage_classifiercode":"20-01","member_number":"TY120144","first_name":"FRANK","last_name":"GAO","classification":"U","division":"CARRY OPTICS","hit_factor":7.2319},{"match_name":"Ontelaunee USPSA November 2020","match_date":"2020-11-20","stage_classifiercode":"20-01","member_number":"A111073","first_name":"MATTHEW","last_name":"HEMPLE","classification":"G","division":"CARRY OPTICS","hit_factor":7.2254},{"match_name":"JCSSA DEC 5 2020","match_date":"2020-12-05","stage_classifiercode":"20-01","member_number":"Ty116542","first_name":"JONATHAN","last_name":"STEPHENSON","classification":"U","division":"CARRY OPTICS","hit_factor":7.2183},{"match_name":"STAGE ZERO  ALL CLASSIFIER","match_date":"2020-11-21","stage_classifiercode":"20-01","member_number":"A126015","first_name":"JAKE","last_name":"MORROW","classification":"M","division":"CARRY OPTICS","hit_factor":7.1904},{"match_name":"YMM  IPSC02 2021_01_10","match_date":"2021-01-10","stage_classifiercode":"20-01","member_number":"L4768","first_name":"IAN","last_name":"MEYERS","classification":"M","division":"CARRY OPTICS","hit_factor":7.1887},{"match_name":"ENPS September 2021 USPSA Match","match_date":"2021-09-04","stage_classifiercode":"20-01","member_number":"A107227","first_name":"KENNY","last_name":"NGUYEN","classification":"M","division":"CARRY OPTICS","hit_factor":7.1823},{"match_name":"Collin County USPSA  08-22-2021","match_date":"2021-08-22","stage_classifiercode":"20-01","member_number":"A93241","first_name":"DAZHI","last_name":"ZHANG","classification":"G","division":"CARRY OPTICS","hit_factor":7.1625},{"match_name":"BORCC USPSA April 2021","match_date":"2021-04-17","stage_classifiercode":"20-01","member_number":"A127768","first_name":"DAVE","last_name":"DEL ROSARIO","classification":"A","division":"CARRY OPTICS","hit_factor":7.1523},{"match_name":"CTASA - 3rd Sunday USPSA at Triple C Range - 12-20-2020","match_date":"2020-12-20","stage_classifiercode":"20-01","member_number":"A79128","first_name":"RYAN","last_name":"WILKS","classification":"M","division":"CARRY OPTICS","hit_factor":7.1429},{"match_name":"Shadow Hawk Defense USPSA - Sep  Sunday","match_date":"2021-09-12","stage_classifiercode":"20-01","member_number":"A136016","first_name":"SAMUEL","last_name":"STOVER","classification":"U","division":"CARRY OPTICS","hit_factor":7.1341},{"match_name":"CIPSC IL Havana May USPSA","match_date":"2021-05-08","stage_classifiercode":"20-01","member_number":"A49435","first_name":"JOHN","last_name":"WILKINSON","classification":"M","division":"CARRY OPTICS","hit_factor":7.1338},{"match_name":"CCPS July 2021 USPSA","match_date":"2021-07-04","stage_classifiercode":"20-01","member_number":"L4806","first_name":"KEITH","last_name":"STEPHENSON","classification":"A","division":"CARRY OPTICS","hit_factor":7.1334},{"match_name":"Square Deal Sportsmen June USPSA Match 2021","match_date":"2021-06-06","stage_classifiercode":"20-01","member_number":"TY106182","first_name":"MIKE","last_name":"SHATALOV","classification":"\"\"","division":"CARRY OPTICS","hit_factor":7.1334},{"match_name":"Chillicothe Sportsmens Club July USPSA","match_date":"2021-07-24","stage_classifiercode":"20-01","member_number":"A102567","first_name":"MIKE","last_name":"STEELE","classification":"M","division":"CARRY OPTICS","hit_factor":7.1334},{"match_name":"STAGE ZERO ALL CLASSIFIER","match_date":"2021-09-04","stage_classifiercode":"20-01","member_number":"TY94292","first_name":"TJ","last_name":"MEYERS","classification":"A","division":"CARRY OPTICS","hit_factor":7.1135},{"match_name":"APSC USPSA 08-21-21","match_date":"2021-08-21","stage_classifiercode":"20-01","member_number":"TY78159","first_name":"ERIC","last_name":"WISE","classification":"U","division":"CARRY OPTICS","hit_factor":7.1078},{"match_name":"BNA USPSA - July 25 2021 (Brothers N Arms)","match_date":"2021-07-25","stage_classifiercode":"20-01","member_number":"Ty84389","first_name":"ETHAN","last_name":"BOUDREAUX","classification":"M","division":"CARRY OPTICS","hit_factor":7.1038},{"match_name":"Coyote Arms Classifier Match 10-31-21","match_date":"2021-10-31","stage_classifiercode":"20-01","member_number":"A132129","first_name":"TORI","last_name":"MARTINEZ","classification":"B","division":"CARRY OPTICS","hit_factor":7.1038},{"match_name":"Matamoras USPSA September 2021","match_date":"2021-09-19","stage_classifiercode":"20-01","member_number":"A122115","first_name":"BEN","last_name":"CZYZEWSKI","classification":"M","division":"CARRY OPTICS","hit_factor":7.1038},{"match_name":"Chattanooga Practical Shooting Assoc   USPSA - Saturday Oct 9th 2021","match_date":"2021-10-09","stage_classifiercode":"20-01","member_number":"A90145","first_name":"JOEY","last_name":"LIEW","classification":"U","division":"CARRY OPTICS","hit_factor":7.0991},{"match_name":"Bossier Parish Practical Shooters November 21 2021","match_date":"2021-11-21","stage_classifiercode":"20-01","member_number":"A50568","first_name":"HARMON","last_name":"GREER","classification":"U","division":"CARRY OPTICS","hit_factor":7.0959},{"match_name":"CCPL 05-09-2021","match_date":"2021-05-09","stage_classifiercode":"20-01","member_number":"A118929","first_name":"GOVINDA","last_name":"IFURUNG","classification":"B","division":"CARRY OPTICS","hit_factor":7.0866},{"match_name":"Hallstead USPSA April 24 match","match_date":"2021-04-24","stage_classifiercode":"20-01","member_number":"A115000","first_name":"NIKOLAI","last_name":"LOPATOFSKY","classification":"A","division":"CARRY OPTICS","hit_factor":7.0866},{"match_name":"Collin County USPSA  08-22-2021","match_date":"2021-08-22","stage_classifiercode":"20-01","member_number":"A79128","first_name":"RYAN","last_name":"WILKS","classification":"M","division":"CARRY OPTICS","hit_factor":7.0845},{"match_name":"GAS MAY 2021 USPSA","match_date":"2021-05-01","stage_classifiercode":"20-01","member_number":"Ty109544","first_name":"RICH","last_name":"BISHOP","classification":"G","division":"CARRY OPTICS","hit_factor":7.0796},{"match_name":"STAGE ZERO  ALL CLASSIFIER","match_date":"2020-11-21","stage_classifiercode":"20-01","member_number":"A113889","first_name":"BRANDON","last_name":"ALVAREZ","classification":"M","division":"CARRY OPTICS","hit_factor":7.0773},{"match_name":"CCPS July 2021 USPSA","match_date":"2021-07-04","stage_classifiercode":"20-01","member_number":"L4896","first_name":"MATT","last_name":"HOPKINS","classification":"M","division":"CARRY OPTICS","hit_factor":7.0748},{"match_name":"WGC AUGUST 2021 USPSA CLASSIFIER MATCH","match_date":"2021-08-08","stage_classifiercode":"20-01","member_number":"TY97639","first_name":"JASON","last_name":"WATTS","classification":"G","division":"CARRY OPTICS","hit_factor":7.0707},{"match_name":"MRPC OHS02 06272021","match_date":"2021-06-27","stage_classifiercode":"20-01","member_number":"A119451","first_name":"JAMES","last_name":"PETERS","classification":"A","division":"CARRY OPTICS","hit_factor":7.0707},{"match_name":"SOAP July 2021 USPSA Match","match_date":"2021-07-11","stage_classifiercode":"20-01","member_number":"A109030","first_name":"RUBEN","last_name":"GARCIA","classification":"A","division":"CARRY OPTICS","hit_factor":7.0707},{"match_name":"Richmond Hot Shots Aug 14-15-2021 USPSA","match_date":"2021-08-14","stage_classifiercode":"20-01","member_number":"TY121691","first_name":"AARON","last_name":"MATZ","classification":"B","division":"CARRY OPTICS","hit_factor":7.0681},{"match_name":"QPS Quantico Shooting Club December USPSA   ","match_date":"2020-12-12","stage_classifiercode":"20-01","member_number":"A119398","first_name":"JOHN","last_name":"GLOMBA","classification":"U","division":"CARRY OPTICS","hit_factor":7.044},{"match_name":"QPS Quantico Shooting Club December USPSA   ","match_date":"2020-12-12","stage_classifiercode":"20-01","member_number":"A113610","first_name":"KYLE","last_name":"HUTSON","classification":"U","division":"CARRY OPTICS","hit_factor":7.0423},{"match_name":"STAGE ZERO ALL CLASSIFIER","match_date":"2021-09-04","stage_classifiercode":"20-01","member_number":"A133007","first_name":"WYATT","last_name":"LONG","classification":"B","division":"CARRY OPTICS","hit_factor":7.0352},{"match_name":"Sharp Practical Shooters September USPSA - Outdoor Classifier Match","match_date":"2021-09-25","stage_classifiercode":"20-01","member_number":"A124807","first_name":"ANTHONY","last_name":"MENDEZ","classification":"U","division":"CARRY OPTICS","hit_factor":7.034},{"match_name":"TPS USPSA at CMP Dec 19 2020 Special Classifier Match","match_date":"2020-12-19","stage_classifiercode":"20-01","member_number":"Ty110068","first_name":"SEAN K","last_name":"PHAM","classification":"A","division":"CARRY OPTICS","hit_factor":7.0175},{"match_name":"RBGC USPSA 2021-8-15 Special Classifier Match","match_date":"2021-08-15","stage_classifiercode":"20-01","member_number":"A120293","first_name":"ALEXANDRU","last_name":"DAVIDOVICI","classification":"B","division":"CARRY OPTICS","hit_factor":7},{"match_name":"OREGON ARPC CC05 USPSA OCT 9 2021","match_date":"2021-10-09","stage_classifiercode":"20-01","member_number":"TY80327","first_name":"DAVID","last_name":"LUND","classification":"M","division":"CARRY OPTICS","hit_factor":6.9712},{"match_name":"GRB USPSA JANUARY 2021 AT CAVALIER","match_date":"2021-01-16","stage_classifiercode":"20-01","member_number":"Ty97341","first_name":"JAMES","last_name":"HAN","classification":"A","division":"CARRY OPTICS","hit_factor":6.9519},{"match_name":"LNDL July 11th Classifier Match","match_date":"2021-07-11","stage_classifiercode":"20-01","member_number":"A12371","first_name":"RAYMOND","last_name":"WITHAM JR","classification":"A","division":"CARRY OPTICS","hit_factor":6.9479},{"match_name":"Oh Shoot -PRG Nov 27th - Uspsa Classifier Match","match_date":"2021-11-27","stage_classifiercode":"20-01","member_number":"A131765","first_name":"JARROD","last_name":"MURRIETA","classification":"B","division":"CARRY OPTICS","hit_factor":6.9444},{"match_name":"Extreme GM uspsa Nov-13","match_date":"2021-11-13","stage_classifiercode":"20-01","member_number":"A88252","first_name":"MARK","last_name":"HILLIARD","classification":"A","division":"CARRY OPTICS","hit_factor":6.9444},{"match_name":"Harvard Action Shooters May 2021 USPSA Pistol Match","match_date":"2021-05-02","stage_classifiercode":"20-01","member_number":"A84437","first_name":"SEBASTIAN","last_name":"YORDAN","classification":"A","division":"CARRY OPTICS","hit_factor":6.9409},{"match_name":"RBGC USPSA 2021-01-23","match_date":"2021-01-23","stage_classifiercode":"20-01","member_number":"TY94240","first_name":"ANDY","last_name":"WALKER","classification":"M","division":"CARRY OPTICS","hit_factor":6.9409},{"match_name":"BORCC USPSA April 2021","match_date":"2021-04-17","stage_classifiercode":"20-01","member_number":"TY76095","first_name":"JEFF","last_name":"SLUSSER","classification":"M","division":"CARRY OPTICS","hit_factor":6.9348},{"match_name":"STAGE ZERO ALL CLASSIFIER","match_date":"2021-09-04","stage_classifiercode":"20-01","member_number":"A131499","first_name":"NICK","last_name":"GREER","classification":"B","division":"CARRY OPTICS","hit_factor":6.9333},{"match_name":"WSPS MARCH 2021 USPSA","match_date":"2021-03-20","stage_classifiercode":"20-01","member_number":"L4988","first_name":"XUEFENG","last_name":"CAO","classification":"M","division":"CARRY OPTICS","hit_factor":6.9231},{"match_name":"MAPSA 5/8/21","match_date":"2021-05-08","stage_classifiercode":"20-01","member_number":"A111663","first_name":"JIM","last_name":"KRANTZ","classification":"M","division":"CARRY OPTICS","hit_factor":6.9051},{"match_name":"ESPS  USPSA  March","match_date":"2021-03-27","stage_classifiercode":"20-01","member_number":"A111018","first_name":"BILLY","last_name":"SARGENT","classification":"A","division":"CARRY OPTICS","hit_factor":6.8966},{"match_name":"APSC USPSA 08-21-21","match_date":"2021-08-21","stage_classifiercode":"20-01","member_number":"A124680","first_name":"KRISTOPHER","last_name":"BOLLETER","classification":"A","division":"CARRY OPTICS","hit_factor":6.8966},{"match_name":"EHPSA USPSA 26 September 2021","match_date":"2021-09-26","stage_classifiercode":"20-01","member_number":"A113663","first_name":"LAWRENCE","last_name":"DANIELS","classification":"A","division":"CARRY OPTICS","hit_factor":6.8881},{"match_name":"RBGC USPSA 2021-8-15 Special Classifier Match","match_date":"2021-08-15","stage_classifiercode":"20-01","member_number":"FY68930","first_name":"NOAH","last_name":"TEAL","classification":"B","division":"CARRY OPTICS","hit_factor":6.8802},{"match_name":"Shadow Hawk Defense - USPSA Dec 13th","match_date":"2020-12-13","stage_classifiercode":"20-01","member_number":"A98812","first_name":"LUKE","last_name":"CAO","classification":"M","division":"CARRY OPTICS","hit_factor":6.872},{"match_name":"SOAP July 2021 USPSA Match","match_date":"2021-07-11","stage_classifiercode":"20-01","member_number":"A99969","first_name":"KARL","last_name":"MACARAIG","classification":"B","division":"CARRY OPTICS","hit_factor":6.8712},{"match_name":"MCRC USPSA March 2021","match_date":"2021-03-13","stage_classifiercode":"20-01","member_number":"TY115747","first_name":"ROBERT","last_name":"BRADLEY","classification":"A","division":"CARRY OPTICS","hit_factor":6.8639},{"match_name":"ANPRACS USPSA 9-4-21","match_date":"2021-09-04","stage_classifiercode":"20-01","member_number":"FY83723","first_name":"BEN","last_name":"HIGGINS","classification":"A","division":"CARRY OPTICS","hit_factor":6.8615},{"match_name":"Harvard Action Shooters May 2021 USPSA Pistol Match","match_date":"2021-05-02","stage_classifiercode":"20-01","member_number":"TY124069","first_name":"DYLAN","last_name":"POULIN","classification":"B","division":"CARRY OPTICS","hit_factor":6.8602},{"match_name":"SPSA USPSA January 1st Sat Match","match_date":"2021-01-02","stage_classifiercode":"20-01","member_number":"A118286","first_name":"RUSTY","last_name":"POPE","classification":"A","division":"CARRY OPTICS","hit_factor":6.8528},{"match_name":"SKSC USPSA Oct 2021","match_date":"2021-10-16","stage_classifiercode":"20-01","member_number":"TY76095","first_name":"JEFF","last_name":"SLUSSER","classification":"M","division":"CARRY OPTICS","hit_factor":6.8399},{"match_name":"FBURG September 2021 USPSA","match_date":"2021-09-05","stage_classifiercode":"20-01","member_number":"A136016","first_name":"SAMUEL","last_name":"STOVER","classification":"U","division":"CARRY OPTICS","hit_factor":6.8316},{"match_name":"OPSC USPSA JUNE 2021","match_date":"2021-06-13","stage_classifiercode":"20-01","member_number":"A127768","first_name":"DAVE","last_name":"DEL ROSARIO","classification":"A","division":"CARRY OPTICS","hit_factor":6.8279},{"match_name":"DCSC MONTHLY USPSA MATCH","match_date":"2021-07-02","stage_classifiercode":"20-01","member_number":"A54411","first_name":"ANDY","last_name":"WOOD","classification":"M","division":"CARRY OPTICS","hit_factor":6.8279},{"match_name":"Minot USPSA 6-13-21","match_date":"2021-06-13","stage_classifiercode":"20-01","member_number":"A114132","first_name":"MARTIN","last_name":"SMITH","classification":"U","division":"CARRY OPTICS","hit_factor":6.8268},{"match_name":"GRB USPSA JANUARY 2021 AT CAVALIER","match_date":"2021-01-16","stage_classifiercode":"20-01","member_number":"TY63501","first_name":"JOSH","last_name":"SIMS","classification":"A","division":"CARRY OPTICS","hit_factor":6.8241},{"match_name":"WLPS May 2021 ALL USPSA Classifier Match ","match_date":"2021-05-23","stage_classifiercode":"20-01","member_number":"TY 107850","first_name":"DREW","last_name":"GADBERRY","classification":"A","division":"CARRY OPTICS","hit_factor":6.8235},{"match_name":"NHRPC - November 2021 USPSA","match_date":"2021-11-13","stage_classifiercode":"20-01","member_number":"L4837","first_name":"JAMES","last_name":"CANTRELL","classification":"M","division":"CARRY OPTICS","hit_factor":6.8182},{"match_name":"OPSC USPSA JUNE 2021","match_date":"2021-06-13","stage_classifiercode":"20-01","member_number":"A119691","first_name":"CHRIS","last_name":"NIELSEN","classification":"B","division":"CARRY OPTICS","hit_factor":6.8127},{"match_name":"LdF USPSA Classifier Match December 12 2020","match_date":"2020-12-12","stage_classifiercode":"20-01","member_number":"A126139","first_name":"ALEX","last_name":"CHU","classification":"A","division":"CARRY OPTICS","hit_factor":6.8096},{"match_name":"Sharp Practical Shooters September USPSA - Outdoor Classifier Match","match_date":"2021-09-25","stage_classifiercode":"20-01","member_number":"A111024","first_name":"JESSE","last_name":"CAMPBELL","classification":"M","division":"CARRY OPTICS","hit_factor":6.8044},{"match_name":"Wallis Orchard Practical Shooters April 2021 Club Match","match_date":"2021-04-18","stage_classifiercode":"20-01","member_number":"FY34763","first_name":"MATT","last_name":"LEM","classification":"A","division":"CARRY OPTICS","hit_factor":6.7961},{"match_name":"CTASA - 3rd Sunday USPSA at Triple C Range - 12-20-2020","match_date":"2020-12-20","stage_classifiercode":"20-01","member_number":"A129286","first_name":"DARIAN","last_name":"SCHMIDT","classification":"M","division":"CARRY OPTICS","hit_factor":6.7961},{"match_name":"MAPSA 5/8/21","match_date":"2021-05-08","stage_classifiercode":"20-01","member_number":"133726","first_name":"TREVOR","last_name":"PONTIUS","classification":"U","division":"CARRY OPTICS","hit_factor":6.7925},{"match_name":"OREGON ARPC CC05 USPSA OCT 9 2021","match_date":"2021-10-09","stage_classifiercode":"20-01","member_number":"TY92856","first_name":"JASON","last_name":"SCHAFER","classification":"A","division":"CARRY OPTICS","hit_factor":6.7839},{"match_name":"Collin County USPSA  08-22-2021","match_date":"2021-08-22","stage_classifiercode":"20-01","member_number":"A98020","first_name":"BILL","last_name":"SILVIA","classification":"A","division":"CARRY OPTICS","hit_factor":6.7757},{"match_name":"NW01 T-Day 2020","match_date":"2020-11-08","stage_classifiercode":"20-01","member_number":"L4898","first_name":"MARCEL","last_name":"ENGLMAIER","classification":"A","division":"CARRY OPTICS","hit_factor":6.7701},{"match_name":"OPSC USPSA JUNE 2021","match_date":"2021-06-13","stage_classifiercode":"20-01","member_number":"TY118067","first_name":"EUGENE","last_name":"CHOI","classification":"U","division":"CARRY OPTICS","hit_factor":6.7633},{"match_name":"RBGC USPSA 2021-01-23","match_date":"2021-01-23","stage_classifiercode":"20-01","member_number":"A76603","first_name":"TYLER","last_name":"INGRAM","classification":"U","division":"CARRY OPTICS","hit_factor":6.7568},{"match_name":"OREGON ARPC CC05 USPSA NOVEMBER 14 2020","match_date":"2020-11-14","stage_classifiercode":"20-01","member_number":"A107036","first_name":"BO","last_name":"OELTJEN","classification":"M","division":"CARRY OPTICS","hit_factor":6.752},{"match_name":"Volusia County Gun and Hunt Club","match_date":"2020-11-21","stage_classifiercode":"20-01","member_number":"A124198","first_name":"SAM","last_name":"SCHIPPER","classification":"A","division":"CARRY OPTICS","hit_factor":6.7445},{"match_name":"SWGC USPSA Pistol Match - May 2021","match_date":"2021-05-01","stage_classifiercode":"20-01","member_number":"A133675","first_name":"ARTHUR","last_name":"MALONE","classification":"B","division":"CARRY OPTICS","hit_factor":6.734},{"match_name":"Coastal Area Practical Shooters 10-23-21","match_date":"2021-10-23","stage_classifiercode":"20-01","member_number":"TY115661","first_name":"RICHARD","last_name":"STEWART","classification":"B","division":"CARRY OPTICS","hit_factor":6.7265},{"match_name":"Shasta Shooters 2021 June","match_date":"2021-06-12","stage_classifiercode":"20-01","member_number":"Ty118064","first_name":"MIKE","last_name":"MCMULLEN","classification":"B","division":"CARRY OPTICS","hit_factor":6.7227},{"match_name":"Richmond Hot Shots Aug 14-15-2021 USPSA","match_date":"2021-08-14","stage_classifiercode":"20-01","member_number":"FY94841","first_name":"STEVE","last_name":"HARTUNG","classification":"A","division":"CARRY OPTICS","hit_factor":6.7207},{"match_name":"EHPSA USPSA 26 September 2021","match_date":"2021-09-26","stage_classifiercode":"20-01","member_number":"A130787","first_name":"BRANDON","last_name":"KEPLINGER","classification":"B","division":"CARRY OPTICS","hit_factor":6.7146},{"match_name":"RBGC USPSA 2021-8-15 Special Classifier Match","match_date":"2021-08-15","stage_classifiercode":"20-01","member_number":"TY114311","first_name":"TYLER","last_name":"BARTLETT","classification":"M","division":"CARRY OPTICS","hit_factor":6.7081},{"match_name":"Extreme GM uspsa Nov-13","match_date":"2021-11-13","stage_classifiercode":"20-01","member_number":"A89824","first_name":"MIKE","last_name":"WIERDSMA","classification":"A","division":"CARRY OPTICS","hit_factor":6.6756},{"match_name":"YRPA USPSA May 2nd 2021","match_date":"2021-05-02","stage_classifiercode":"20-01","member_number":"L4667","first_name":"RACHEL","last_name":"HARPER","classification":"M","division":"CARRY OPTICS","hit_factor":6.6743},{"match_name":"Pioneer Action Shooters USPSA 11-15-20","match_date":"2020-11-15","stage_classifiercode":"20-01","member_number":"A113993","first_name":"KENTON","last_name":"STEADMAN","classification":"M","division":"CARRY OPTICS","hit_factor":6.6667},{"match_name":"Ontelaunee USPSA November 2020","match_date":"2020-11-20","stage_classifiercode":"20-01","member_number":"L4776","first_name":"NOEL","last_name":"ZARZA","classification":"A","division":"CARRY OPTICS","hit_factor":6.659},{"match_name":"GoShoot Outdoor A6 Warm up And Classifier match!","match_date":"2021-04-03","stage_classifiercode":"20-01","member_number":"A72513","first_name":"STEPHEN","last_name":"TUCKER","classification":"B","division":"CARRY OPTICS","hit_factor":6.6587},{"match_name":"Pioneer Action Shooters USPSA 11-15-20","match_date":"2020-11-15","stage_classifiercode":"20-01","member_number":"A124069","first_name":"DYLAN","last_name":"POULIN","classification":"U","division":"CARRY OPTICS","hit_factor":6.6587},{"match_name":"Hallstead USPSA April 24 match","match_date":"2021-04-24","stage_classifiercode":"20-01","member_number":"A88322","first_name":"JEFF","last_name":"POLANIN","classification":"A","division":"CARRY OPTICS","hit_factor":6.6584},{"match_name":"Moss Branch USPSA June match","match_date":"2021-06-26","stage_classifiercode":"20-01","member_number":"A101864","first_name":"DONNY","last_name":"HUDGINS","classification":"M","division":"CARRY OPTICS","hit_factor":6.6581},{"match_name":"JCSSA DEC 5 2020","match_date":"2020-12-05","stage_classifiercode":"20-01","member_number":"A86941","first_name":"MIKE","last_name":"NAKPAIRAT","classification":"B","division":"CARRY OPTICS","hit_factor":6.6581},{"match_name":"GFDS POSTAL MATCH USPSA 10/2/2021 hosted by Glacier Practical Shooters","match_date":"2021-10-02","stage_classifiercode":"20-01","member_number":"TY93274","first_name":"JOSHUA","last_name":"FANT","classification":"B","division":"CARRY OPTICS","hit_factor":6.6578},{"match_name":"EHPSA USPSA 26 September 2021","match_date":"2021-09-26","stage_classifiercode":"20-01","member_number":"A121744","first_name":"LEE","last_name":"EDDER","classification":"X","division":"CARRY OPTICS","hit_factor":6.6502},{"match_name":"Hampden RPC November USPSA Match","match_date":"2020-11-08","stage_classifiercode":"20-01","member_number":"TY104860","first_name":"SAUL","last_name":"ALLEN","classification":"M","division":"CARRY OPTICS","hit_factor":6.6502},{"match_name":"Dundee Practical Shooters - Feb 27 2021","match_date":"2021-02-27","stage_classifiercode":"20-01","member_number":"A107036","first_name":"BO","last_name":"OELTJEN","classification":"M","division":"CARRY OPTICS","hit_factor":6.6496},{"match_name":"Fast 7-30-21","match_date":"2021-07-30","stage_classifiercode":"20-01","member_number":"ty80057","first_name":"CHRIS","last_name":"SOUSOUNIS","classification":"A","division":"CARRY OPTICS","hit_factor":6.6411},{"match_name":"GCL Monthly USPSA Match Saturday 11-6-2021  INDOORS","match_date":"2021-11-06","stage_classifiercode":"20-01","member_number":"FY105696","first_name":"STUART","last_name":"WEAVER","classification":"B","division":"CARRY OPTICS","hit_factor":6.6362},{"match_name":"NW01 T-Day 2020","match_date":"2020-11-08","stage_classifiercode":"20-01","member_number":"TY112299","first_name":"WENZENG","last_name":"WEI","classification":"B","division":"CARRY OPTICS","hit_factor":6.6362},{"match_name":"CCPL 05-09-2021","match_date":"2021-05-09","stage_classifiercode":"20-01","member_number":"A127842","first_name":"GEORGE","last_name":"WAYNE","classification":"A","division":"CARRY OPTICS","hit_factor":6.6258},{"match_name":"SCAPSA MN05 SPRING 6","match_date":"2021-05-18","stage_classifiercode":"20-01","member_number":"Ty115837","first_name":"NOAH","last_name":"GOODRICH","classification":"M","division":"CARRY OPTICS","hit_factor":6.6158},{"match_name":"CCPS July 2021 USPSA","match_date":"2021-07-04","stage_classifiercode":"20-01","member_number":"TY91071","first_name":"MICHAEL","last_name":"SIRNA","classification":"B","division":"CARRY OPTICS","hit_factor":6.6095},{"match_name":"Moss Branch USPSA June match","match_date":"2021-06-26","stage_classifiercode":"20-01","member_number":"A114647","first_name":"DREW","last_name":"BITTLE","classification":"A","division":"CARRY OPTICS","hit_factor":6.6074},{"match_name":"OPSC USPSA JUNE 2021","match_date":"2021-06-13","stage_classifiercode":"20-01","member_number":"A114800","first_name":"ALAIN","last_name":"JURIDICO","classification":"B","division":"CARRY OPTICS","hit_factor":6.599},{"match_name":"GoShoot Outdoor A6 Warm up And Classifier match!","match_date":"2021-04-03","stage_classifiercode":"20-01","member_number":"A116503","first_name":"ADDISON","last_name":"CLARK","classification":"A","division":"CARRY OPTICS","hit_factor":6.5934},{"match_name":"Volusia County Gun and Hunt Club","match_date":"2020-11-21","stage_classifiercode":"20-01","member_number":"Ty106150","first_name":"TOM","last_name":"CASTRO","classification":"G","division":"CARRY OPTICS","hit_factor":6.5876},{"match_name":"MRPC OHS02 06272021","match_date":"2021-06-27","stage_classifiercode":"20-01","member_number":"TY95620","first_name":"DERRICK","last_name":"ALLEN","classification":"U","division":"CARRY OPTICS","hit_factor":6.5876},{"match_name":"Chillicothe Sportsmens Club July USPSA","match_date":"2021-07-24","stage_classifiercode":"20-01","member_number":"TY99831","first_name":"JASON","last_name":"ANGLIN","classification":"A","division":"CARRY OPTICS","hit_factor":6.5844},{"match_name":"MRPC OHS02 06272021","match_date":"2021-06-27","stage_classifiercode":"20-01","member_number":"A133047","first_name":"PETER","last_name":"WOOLARD","classification":"A","division":"CARRY OPTICS","hit_factor":6.5823},{"match_name":"Ontelaunee USPSA November 2020","match_date":"2020-11-20","stage_classifiercode":"20-01","member_number":"A108055","first_name":"BRANDON","last_name":"MO","classification":"A","division":"CARRY OPTICS","hit_factor":6.5823},{"match_name":"JCSSA DEC 5 2020","match_date":"2020-12-05","stage_classifiercode":"20-01","member_number":"A76683","first_name":"CALVIN","last_name":"TRUONG","classification":"A","division":"CARRY OPTICS","hit_factor":6.5773},{"match_name":"Pioneer Action Shooters USPSA 11-15-20","match_date":"2020-11-15","stage_classifiercode":"20-01","member_number":"A123724","first_name":"BRYAN","last_name":"FISCHER","classification":"M","division":"CARRY OPTICS","hit_factor":6.5753},{"match_name":"Nampa USPSA September 10th 2021 Classifier Match","match_date":"2021-09-10","stage_classifiercode":"20-01","member_number":"TY41217","first_name":"RAUL","last_name":"GARCIA","classification":"A","division":"CARRY OPTICS","hit_factor":6.5693},{"match_name":"GRB USPSA JANUARY 2021 AT CAVALIER","match_date":"2021-01-16","stage_classifiercode":"20-01","member_number":"L4870","first_name":"MICHAEL","last_name":"FISCHER","classification":"A","division":"CARRY OPTICS","hit_factor":6.5651},{"match_name":"YMM  IPSC02 2021_01_10","match_date":"2021-01-10","stage_classifiercode":"20-01","member_number":"TY24066","first_name":"GEORGE","last_name":"MANDES","classification":"M","division":"CARRY OPTICS","hit_factor":6.5611},{"match_name":"BORCC USPSA April 2021","match_date":"2021-04-17","stage_classifiercode":"20-01","member_number":"A104572","first_name":"CHRIS","last_name":"GOOSSEN","classification":"A","division":"CARRY OPTICS","hit_factor":6.5497},{"match_name":"DCSC MONTHLY USPSA MATCH","match_date":"2021-07-02","stage_classifiercode":"20-01","member_number":"A54411","first_name":"ANDY","last_name":"WOOD","classification":"M","division":"CARRY OPTICS","hit_factor":6.5455},{"match_name":"JCSSA DEC 5 2020","match_date":"2020-12-05","stage_classifiercode":"20-01","member_number":"A79128","first_name":"RYAN","last_name":"WILKS","classification":"M","division":"CARRY OPTICS","hit_factor":6.5434},{"match_name":"SPSA USPSA January 1st Sat Match","match_date":"2021-01-02","stage_classifiercode":"20-01","member_number":"FY85974","first_name":"JAMES","last_name":"BASCIO","classification":"M","division":"CARRY OPTICS","hit_factor":6.5389},{"match_name":"MCTS -  USPSA March 2021 Classifier Match","match_date":"2021-03-21","stage_classifiercode":"20-01","member_number":"A122337","first_name":"LINH","last_name":"TRAN","classification":"A","division":"CARRY OPTICS","hit_factor":6.5375},{"match_name":"Oh Shoot -PRG Nov 27th - Uspsa Classifier Match","match_date":"2021-11-27","stage_classifiercode":"20-01","member_number":"TY94897","first_name":"SHAWN","last_name":"WALTERS1","classification":"A","division":"CARRY OPTICS","hit_factor":6.5296},{"match_name":"GFDS POSTAL MATCH USPSA 10/2/2021 hosted by Glacier Practical Shooters","match_date":"2021-10-02","stage_classifiercode":"20-01","member_number":"TY109180","first_name":"PATRICK","last_name":"FUREY","classification":"A","division":"CARRY OPTICS","hit_factor":6.5245},{"match_name":"Wallis Orchard Practical Shooters April 2021 Club Match","match_date":"2021-04-18","stage_classifiercode":"20-01","member_number":"A93447","first_name":"JASON","last_name":"BRIGHT","classification":"B","division":"CARRY OPTICS","hit_factor":6.5081},{"match_name":"TPS USPSA -  January Match 2021 Rescheduled","match_date":"2021-01-03","stage_classifiercode":"20-01","member_number":"A29708","first_name":"JOHN","last_name":"RASMUSSEN","classification":"U","division":"CARRY OPTICS","hit_factor":6.5022},{"match_name":"SFPS 5-16-21 Super Classifier","match_date":"2021-05-16","stage_classifiercode":"20-01","member_number":"A85579","first_name":"CHRIS","last_name":"BALSTER","classification":"M","division":"CARRY OPTICS","hit_factor":6.502},{"match_name":"Oh Shoot -PRG Nov 27th - Uspsa Classifier Match","match_date":"2021-11-27","stage_classifiercode":"20-01","member_number":"L5052","first_name":"JINYANG","last_name":"XIAO1","classification":"M","division":"CARRY OPTICS","hit_factor":6.5005},{"match_name":"Hosemonster Action  ","match_date":"2021-01-17","stage_classifiercode":"20-01","member_number":"A90943","first_name":"FRANCISCO","last_name":"FELIX","classification":"M","division":"CARRY OPTICS","hit_factor":6.4982},{"match_name":"BORCC USPSA April 2021","match_date":"2021-04-17","stage_classifiercode":"20-01","member_number":"TY112945","first_name":"NICHOLAS","last_name":"HARIG","classification":"C","division":"CARRY OPTICS","hit_factor":6.4904},{"match_name":"ENPS September 2021 USPSA Match","match_date":"2021-09-04","stage_classifiercode":"20-01","member_number":"L3232","first_name":"THOMAS","last_name":"HOWARD","classification":"M","division":"CARRY OPTICS","hit_factor":6.4904},{"match_name":"CTASA - 3rd Sunday USPSA at Triple C Range - 12-20-2020","match_date":"2020-12-20","stage_classifiercode":"20-01","member_number":"A127998","first_name":"MICHAEL","last_name":"SI","classification":"U","division":"CARRY OPTICS","hit_factor":6.4904},{"match_name":"LCSC Linden USPSA 122720","match_date":"2020-12-27","stage_classifiercode":"20-01","member_number":"A90943","first_name":"FRANCISCO","last_name":"FELIX","classification":"A","division":"CARRY OPTICS","hit_factor":6.4851},{"match_name":"Shasta Shooters 2021 June","match_date":"2021-06-12","stage_classifiercode":"20-01","member_number":"Fy89662","first_name":"TODD","last_name":"CANCILLA","classification":"A","division":"CARRY OPTICS","hit_factor":6.4838},{"match_name":"EHPSA USPSA 26 September 2021","match_date":"2021-09-26","stage_classifiercode":"20-01","member_number":"A134934","first_name":"DREW","last_name":"MARUSKI","classification":"A","division":"CARRY OPTICS","hit_factor":6.4777},{"match_name":"ACPSA November 2020","match_date":"2020-11-28","stage_classifiercode":"20-01","member_number":"A55594","first_name":"GENE","last_name":"WILKERSON","classification":"A","division":"CARRY OPTICS","hit_factor":6.4725},{"match_name":"SRSC USPSA 3-28-21 Superclassifier","match_date":"2021-03-28","stage_classifiercode":"20-01","member_number":"A96689","first_name":"ANDREW","last_name":"ERICKSON","classification":"A","division":"CARRY OPTICS","hit_factor":6.4677},{"match_name":"GRB USPSA JANUARY 2021 AT CAVALIER","match_date":"2021-01-16","stage_classifiercode":"20-01","member_number":"TY114978","first_name":"RHYS","last_name":"WILLIAMS","classification":"B","division":"CARRY OPTICS","hit_factor":6.4655},{"match_name":"PMRPC USPSA 12Dec20 - all Classifier","match_date":"2020-12-12","stage_classifiercode":"20-01","member_number":"A19050","first_name":"TYLER","last_name":"KEISER","classification":"C","division":"CARRY OPTICS","hit_factor":6.4516},{"match_name":"NISA August 2021","match_date":"2021-08-22","stage_classifiercode":"20-01","member_number":"FY134078","first_name":"JOHN","last_name":"MARTELLO","classification":"A","division":"CARRY OPTICS","hit_factor":6.4439},{"match_name":"NW01 T-Day 2020","match_date":"2020-11-08","stage_classifiercode":"20-01","member_number":"TY100339","first_name":"CHRIS","last_name":"MCMEEN","classification":"B","division":"CARRY OPTICS","hit_factor":6.4373},{"match_name":"2020-12-05 USPSA  at Phoenix Rod and Gun Club","match_date":"2020-12-05","stage_classifiercode":"20-01","member_number":"A128784","first_name":"BRANDON","last_name":"MERMIS","classification":"U","division":"CARRY OPTICS","hit_factor":6.4356},{"match_name":"QPS Quantico Shooting Club December USPSA   ","match_date":"2020-12-12","stage_classifiercode":"20-01","member_number":"TY113363","first_name":"JULIAN","last_name":"ACKLAND","classification":"B","division":"CARRY OPTICS","hit_factor":6.435},{"match_name":"Vortex Edge USPSA October 2021","match_date":"2021-10-09","stage_classifiercode":"20-01","member_number":"TY125755","first_name":"TYLER","last_name":"JACKSON","classification":"M","division":"CARRY OPTICS","hit_factor":6.4294},{"match_name":"Oh Shoot -PRG Nov 27th - Uspsa Classifier Match","match_date":"2021-11-27","stage_classifiercode":"20-01","member_number":"TY107329","first_name":"ROBERT","last_name":"DATOR","classification":"B","division":"CARRY OPTICS","hit_factor":6.4103},{"match_name":"RBGC USPSA 2021-01-23","match_date":"2021-01-23","stage_classifiercode":"20-01","member_number":"TY117531","first_name":"TOM","last_name":"NGUYEN","classification":"C","division":"CARRY OPTICS","hit_factor":6.4073},{"match_name":"Sharp Practical Shooters September USPSA - Outdoor Classifier Match","match_date":"2021-09-25","stage_classifiercode":"20-01","member_number":"Ty101657","first_name":"FRANK","last_name":"THORNTON","classification":"M","division":"CARRY OPTICS","hit_factor":6.4039},{"match_name":"YRPA USPSA May 2nd 2021","match_date":"2021-05-02","stage_classifiercode":"20-01","member_number":"TY109181","first_name":"SAM","last_name":"WAGG","classification":"B","division":"CARRY OPTICS","hit_factor":6.4039},{"match_name":"Dundee Practical Shooters - Feb 27 2021","match_date":"2021-02-27","stage_classifiercode":"20-01","member_number":"None","first_name":"JASON","last_name":"SCHAFER","classification":"U","division":"CARRY OPTICS","hit_factor":6.4},{"match_name":"Dundee Practical Shooters - Feb 27 2021","match_date":"2021-02-27","stage_classifiercode":"20-01","member_number":"A70123","first_name":"MARK","last_name":"SUE","classification":"U","division":"CARRY OPTICS","hit_factor":6.3981},{"match_name":"WLPS May 2021 ALL USPSA Classifier Match ","match_date":"2021-05-23","stage_classifiercode":"20-01","member_number":"A119729","first_name":"STEVE","last_name":"DIETZ","classification":"A","division":"CARRY OPTICS","hit_factor":6.3882},{"match_name":"CAS March 2021","match_date":"2021-03-07","stage_classifiercode":"20-01","member_number":"A93310","first_name":"JON","last_name":"MARINO","classification":"A","division":"CARRY OPTICS","hit_factor":6.3857},{"match_name":"Dundee Practical Shooters - Feb 27 2021","match_date":"2021-02-27","stage_classifiercode":"20-01","member_number":"A123901","first_name":"MARK","last_name":"MCHUGH","classification":"B","division":"CARRY OPTICS","hit_factor":6.3854},{"match_name":"Matamoras USPSA September 2021","match_date":"2021-09-19","stage_classifiercode":"20-01","member_number":"TY111679","first_name":"ZUOMING","last_name":"ZHENG","classification":"M","division":"CARRY OPTICS","hit_factor":6.3781},{"match_name":"DSSA 2021-02 USPSA Pistol","match_date":"2021-02-28","stage_classifiercode":"20-01","member_number":"TY100941","first_name":"JAMES","last_name":"MERRITT","classification":"U","division":"CARRY OPTICS","hit_factor":6.3709},{"match_name":"BNA USPSA - July 25 2021 (Brothers N Arms)","match_date":"2021-07-25","stage_classifiercode":"20-01","member_number":"L4667","first_name":"RACHEL","last_name":"DUPUY HARPER","classification":"M","division":"CARRY OPTICS","hit_factor":6.3647},{"match_name":"CIPSC IL Havana May USPSA","match_date":"2021-05-08","stage_classifiercode":"20-01","member_number":"Ty99831","first_name":"JASON","last_name":"ANGLIN","classification":"A","division":"CARRY OPTICS","hit_factor":6.3647},{"match_name":"ESPS  USPSA  March","match_date":"2021-03-27","stage_classifiercode":"20-01","member_number":"A76022","first_name":"MASHU","last_name":"KOBAYASHI","classification":"B","division":"CARRY OPTICS","hit_factor":6.3636},{"match_name":"CAS March 2021","match_date":"2021-03-07","stage_classifiercode":"20-01","member_number":"FY52014","first_name":"BRIAN","last_name":"DOLLY","classification":"B","division":"CARRY OPTICS","hit_factor":6.3636},{"match_name":"NISA August 2021","match_date":"2021-08-22","stage_classifiercode":"20-01","member_number":"TY122444","first_name":"KENNETH","last_name":"WICKES","classification":"B","division":"CARRY OPTICS","hit_factor":6.3604},{"match_name":"EWPSA 2021-04","match_date":"2021-04-17","stage_classifiercode":"20-01","member_number":"TY100023","first_name":"JUSTIN","last_name":"SCOTCH","classification":"A","division":"CARRY OPTICS","hit_factor":6.3604},{"match_name":"CIPSC IL02 Havana August USPSA","match_date":"2021-08-07","stage_classifiercode":"20-01","member_number":"FY98887","first_name":"DAVID","last_name":"MANDROS","classification":"B","division":"CARRY OPTICS","hit_factor":6.357},{"match_name":"FBURG September 2021 USPSA","match_date":"2021-09-05","stage_classifiercode":"20-01","member_number":"L4870","first_name":"MICHAEL","last_name":"FISCHER","classification":"A","division":"CARRY OPTICS","hit_factor":6.3532},{"match_name":"FBURG September 2021 USPSA","match_date":"2021-09-05","stage_classifiercode":"20-01","member_number":"TY104180","first_name":"LUCAS","last_name":"DEBRUHL","classification":"A","division":"CARRY OPTICS","hit_factor":6.3532},{"match_name":"MCRC USPSA March 2021","match_date":"2021-03-13","stage_classifiercode":"20-01","member_number":"A127720","first_name":"BRUNO","last_name":"ESPINOSA","classification":"B","division":"CARRY OPTICS","hit_factor":6.3532},{"match_name":"Richmond Hot Shots Aug 14-15-2021 USPSA","match_date":"2021-08-14","stage_classifiercode":"20-01","member_number":"A129247","first_name":"AARON","last_name":"FRANKEL","classification":"B","division":"CARRY OPTICS","hit_factor":6.3492},{"match_name":"Wallis Orchard Practical Shooters April 2021 Club Match","match_date":"2021-04-18","stage_classifiercode":"20-01","member_number":"A116144","first_name":"JOHN","last_name":"BRUNKHORST","classification":"B","division":"CARRY OPTICS","hit_factor":6.3492},{"match_name":"APSC USPSA 11-7-20","match_date":"2020-11-07","stage_classifiercode":"20-01","member_number":"A111836","first_name":"JOSHUA","last_name":"BAUMAN","classification":"U","division":"CARRY OPTICS","hit_factor":6.342},{"match_name":"OREGON ARPC CC05 USPSA OCT 9 2021","match_date":"2021-10-09","stage_classifiercode":"20-01","member_number":"A74268","first_name":"AARON","last_name":"AVON","classification":"A","division":"CARRY OPTICS","hit_factor":6.3415},{"match_name":"SPSA USPSA January 1st Sat Match","match_date":"2021-01-02","stage_classifiercode":"20-01","member_number":"A84529","first_name":"DAVID","last_name":"STRICKLAND","classification":"M","division":"CARRY OPTICS","hit_factor":6.3408},{"match_name":"APSC USPSA 08-21-21","match_date":"2021-08-21","stage_classifiercode":"20-01","member_number":"A119231","first_name":"ANTHONY","last_name":"VEITH","classification":"U","division":"CARRY OPTICS","hit_factor":6.338},{"match_name":"NISA August 2021","match_date":"2021-08-22","stage_classifiercode":"20-01","member_number":"A130227","first_name":"TONY","last_name":"PONTRELLI","classification":"A","division":"CARRY OPTICS","hit_factor":6.3325},{"match_name":"SCPS ECO19 January 23rd 2021","match_date":"2021-01-22","stage_classifiercode":"20-01","member_number":"A106994","first_name":"TANNER","last_name":"GATES","classification":"B","division":"CARRY OPTICS","hit_factor":6.3291},{"match_name":"MRPC OHS02 06272021","match_date":"2021-06-27","stage_classifiercode":"20-01","member_number":"A31894","first_name":"BOB","last_name":"STOUFFER","classification":"A","division":"CARRY OPTICS","hit_factor":6.326},{"match_name":"TPS USPSA At CMP July 17 2021","match_date":"2021-07-17","stage_classifiercode":"20-01","member_number":"A127747","first_name":"ALEXANDER DENNY","last_name":"ACENAN","classification":"A","division":"CARRY OPTICS","hit_factor":6.3211},{"match_name":"Shadow Hawk Defense - USPSA Dec 13th","match_date":"2020-12-13","stage_classifiercode":"20-01","member_number":"TY74344","first_name":"LANCE","last_name":"DEHLER","classification":"A","division":"CARRY OPTICS","hit_factor":6.3158},{"match_name":"BNA USPSA - July 25 2021 (Brothers N Arms)","match_date":"2021-07-25","stage_classifiercode":"20-01","member_number":"A98845","first_name":"BLAYNE","last_name":"DUPUY","classification":"M","division":"CARRY OPTICS","hit_factor":6.3131},{"match_name":"Ontelaunee USPSA November 2020","match_date":"2020-11-20","stage_classifiercode":"20-01","member_number":"TY88100","first_name":"JOE","last_name":"PISANO","classification":"B","division":"CARRY OPTICS","hit_factor":6.3107},{"match_name":"Shadow Hawk Defense USPSA - Sep  Sunday","match_date":"2021-09-12","stage_classifiercode":"20-01","member_number":"FY51532","first_name":"CHRISTOPHER","last_name":"RHINES","classification":"A","division":"CARRY OPTICS","hit_factor":6.2992},{"match_name":"LdF USPSA Classifier Match December 12 2020","match_date":"2020-12-12","stage_classifiercode":"20-01","member_number":"A72431","first_name":"SONNY","last_name":"SARTE","classification":"U","division":"CARRY OPTICS","hit_factor":6.2972},{"match_name":"MRPC OHS02 06272021","match_date":"2021-06-27","stage_classifiercode":"20-01","member_number":"TY52377","first_name":"BENJAMIN","last_name":"HOFFMAN","classification":"U","division":"CARRY OPTICS","hit_factor":6.2972},{"match_name":"RPS January 2021 USPSA Match","match_date":"2021-01-09","stage_classifiercode":"20-01","member_number":"TY65504","first_name":"CHARLES","last_name":"LINKER","classification":"M","division":"CARRY OPTICS","hit_factor":6.2954},{"match_name":"GRB USPSA JANUARY 2021 AT CAVALIER","match_date":"2021-01-16","stage_classifiercode":"20-01","member_number":"TY59220","first_name":"LARRY","last_name":"TALBOTT","classification":"B","division":"CARRY OPTICS","hit_factor":6.2937},{"match_name":"STAGE ZERO ALL CLASSIFIER","match_date":"2021-09-04","stage_classifiercode":"20-01","member_number":"A111228","first_name":"DYLAN","last_name":"CICERO","classification":"U","division":"CARRY OPTICS","hit_factor":6.2937},{"match_name":"GCL Saturday 4-3-2021","match_date":"2021-04-03","stage_classifiercode":"20-01","member_number":"A110919","first_name":"NELSON","last_name":"HUERTAS JR","classification":"A","division":"CARRY OPTICS","hit_factor":6.291},{"match_name":"PIPS 04-28-2021","match_date":"2021-04-27","stage_classifiercode":"20-01","member_number":"B65","first_name":"HARRISON","last_name":"DIAMOND","classification":"A","division":"CARRY OPTICS","hit_factor":6.2878},{"match_name":"Fast 7-30-21","match_date":"2021-07-30","stage_classifiercode":"20-01","member_number":"Fy99995","first_name":"ALAN","last_name":"SHAFRAN","classification":"A","division":"CARRY OPTICS","hit_factor":6.2878},{"match_name":"Nampa USPSA September 10th 2021 Classifier Match","match_date":"2021-09-10","stage_classifiercode":"20-01","member_number":"TY116605","first_name":"CARL","last_name":"OLSON","classification":"A","division":"CARRY OPTICS","hit_factor":6.2851},{"match_name":"Nampa USPSA September 10th 2021 Classifier Match","match_date":"2021-09-10","stage_classifiercode":"20-01","member_number":"A111211","first_name":"BRYAN","last_name":"MONTGOMERY","classification":"A","division":"CARRY OPTICS","hit_factor":6.2791},{"match_name":"Volusia County Gun and Hunt Club","match_date":"2020-11-21","stage_classifiercode":"20-01","member_number":"A95166","first_name":"ELIJAH","last_name":"TORRES","classification":"A","division":"CARRY OPTICS","hit_factor":6.2735},{"match_name":"SOAP July 2021 USPSA Match","match_date":"2021-07-11","stage_classifiercode":"20-01","member_number":"A107109","first_name":"CHRISTOPHER","last_name":"DASILVA","classification":"A","division":"CARRY OPTICS","hit_factor":6.2718},{"match_name":"USPSA MO21 2Alpha SBRC December 26 2020","match_date":"2020-12-26","stage_classifiercode":"20-01","member_number":"A49382","first_name":"BRENDAN","last_name":"NANGLE","classification":"A","division":"CARRY OPTICS","hit_factor":6.2645},{"match_name":"MCRC USPSA March 2021","match_date":"2021-03-13","stage_classifiercode":"20-01","member_number":"A127675","first_name":"PIERCE","last_name":"WERNER","classification":"U","division":"CARRY OPTICS","hit_factor":6.2581},{"match_name":"RPS January 2021 USPSA Match","match_date":"2021-01-09","stage_classifiercode":"20-01","member_number":"TY83413","first_name":"DOUG","last_name":"HARDING","classification":"B","division":"CARRY OPTICS","hit_factor":6.2572},{"match_name":"Ontelaunee USPSA November 2020","match_date":"2020-11-20","stage_classifiercode":"20-01","member_number":"TY111679","first_name":"ZUOMING","last_name":"ZHENG","classification":"A","division":"CARRY OPTICS","hit_factor":6.257},{"match_name":"SOAP July 2021 USPSA Match","match_date":"2021-07-11","stage_classifiercode":"20-01","member_number":"TY116214","first_name":"DON","last_name":"SANDRETTO","classification":"B","division":"CARRY OPTICS","hit_factor":6.2433},{"match_name":"TPS USPSA At CMP July 17 2021","match_date":"2021-07-17","stage_classifiercode":"20-01","member_number":"TY89704","first_name":"ROB","last_name":"MOORE","classification":"U","division":"CARRY OPTICS","hit_factor":6.243},{"match_name":"LPRGC- Lower Providence USPSA Nov 2020 Match","match_date":"2020-11-07","stage_classifiercode":"20-01","member_number":"X","first_name":"SCOTT","last_name":"BAKER","classification":"X","division":"CARRY OPTICS","hit_factor":6.243},{"match_name":"GoShoot Outdoor A6 Warm up And Classifier match!","match_date":"2021-04-03","stage_classifiercode":"20-01","member_number":"TY122867","first_name":"MAX","last_name":"GATES","classification":"A","division":"CARRY OPTICS","hit_factor":6.2425},{"match_name":"OK06-30OCT21-SCRP-USPSA","match_date":"2021-10-30","stage_classifiercode":"20-01","member_number":"Ty80501","first_name":"JON-LUC","last_name":"RUBEN","classification":"A","division":"CARRY OPTICS","hit_factor":6.2422},{"match_name":"TPS USPSA At CMP July 17 2021","match_date":"2021-07-17","stage_classifiercode":"20-01","member_number":"A113942","first_name":"TIMOTHY","last_name":"PARSONS","classification":"B","division":"CARRY OPTICS","hit_factor":6.2422},{"match_name":"17s PSC - USPSA - January 2021","match_date":"2021-01-16","stage_classifiercode":"20-01","member_number":"Fy83548","first_name":"JEFF","last_name":"CHU","classification":"U","division":"CARRY OPTICS","hit_factor":6.2361},{"match_name":"Chillicothe Sportsmens Club November USPSA","match_date":"2020-11-21","stage_classifiercode":"20-01","member_number":"A102567","first_name":"MIKE","last_name":"STEELE","classification":"M","division":"CARRY OPTICS","hit_factor":6.2356},{"match_name":"LPRGC- Lower Providence USPSA Nov 2020 Match","match_date":"2020-11-07","stage_classifiercode":"20-01","member_number":"TY111679","first_name":"ZUOMING","last_name":"ZHENG","classification":"A","division":"CARRY OPTICS","hit_factor":6.2356},{"match_name":"SCPS ECO19 January 23rd 2021","match_date":"2021-01-22","stage_classifiercode":"20-01","member_number":"A117103","first_name":"PAUL","last_name":"SMITH","classification":"A","division":"CARRY OPTICS","hit_factor":6.2344},{"match_name":"SFA USPSA November 20 2021 MATCH","match_date":"2021-11-20","stage_classifiercode":"20-01","member_number":"A33885","first_name":"TIM","last_name":"SHAVER","classification":"A","division":"CARRY OPTICS","hit_factor":6.2291},{"match_name":"Collin County USPSA  08-22-2021","match_date":"2021-08-22","stage_classifiercode":"20-01","member_number":"FY104076","first_name":"JAMES","last_name":"SANDIFER","classification":"A","division":"CARRY OPTICS","hit_factor":6.2267},{"match_name":"APSC USPSA 11-7-20","match_date":"2020-11-07","stage_classifiercode":"20-01","member_number":"TY82278","first_name":"ROWDY","last_name":"BRICCO","classification":"A","division":"CARRY OPTICS","hit_factor":6.2257},{"match_name":"LPRGC- Lower Providence USPSA Nov 2020 Match","match_date":"2020-11-07","stage_classifiercode":"20-01","member_number":"L3016","first_name":"BOB","last_name":"ARIYAMITR","classification":"B","division":"CARRY OPTICS","hit_factor":6.2165},{"match_name":"MCPSL Pistol 1-9-2021","match_date":"2021-01-09","stage_classifiercode":"20-01","member_number":"L4896","first_name":"MATT","last_name":"HOPKINS","classification":"M","division":"CARRY OPTICS","hit_factor":6.214},{"match_name":"CCAS September 2021","match_date":"2021-09-18","stage_classifiercode":"20-01","member_number":"A118905","first_name":"CORY","last_name":"GRIFFITH","classification":"B","division":"CARRY OPTICS","hit_factor":6.214},{"match_name":"TPS USPSA At CMP July 17 2021","match_date":"2021-07-17","stage_classifiercode":"20-01","member_number":"A120293","first_name":"ALEXANDRU","last_name":"DAVIDOVICI","classification":"B","division":"CARRY OPTICS","hit_factor":6.2127},{"match_name":"Maine Practical Shooters May 2021","match_date":"2021-05-08","stage_classifiercode":"20-01","member_number":"A101785","first_name":"JOHN","last_name":"LOHLUN","classification":"A","division":"CARRY OPTICS","hit_factor":6.2069},{"match_name":"PIPS 04-28-2021","match_date":"2021-04-27","stage_classifiercode":"20-01","member_number":"A82378","first_name":"RYAN","last_name":"RAYMOND","classification":"M","division":"CARRY OPTICS","hit_factor":6.2053},{"match_name":"Ontelaunee USPSA November 2020","match_date":"2020-11-20","stage_classifiercode":"20-01","member_number":"TY54330","first_name":"VICTOR","last_name":"GRILLETTO","classification":"A","division":"CARRY OPTICS","hit_factor":6.2053},{"match_name":"Matamoras USPSA September 2021","match_date":"2021-09-19","stage_classifiercode":"20-01","member_number":"L3767","first_name":"BEN","last_name":"HSIAO","classification":"A","division":"CARRY OPTICS","hit_factor":6.1998},{"match_name":"SRSC USPSA 3-28-21 Superclassifier","match_date":"2021-03-28","stage_classifiercode":"20-01","member_number":"A85579","first_name":"CHRIS","last_name":"BALSTER","classification":"M","division":"CARRY OPTICS","hit_factor":6.1958},{"match_name":"QPS Quantico Shooting Club December USPSA   ","match_date":"2020-12-12","stage_classifiercode":"20-01","member_number":"A113611","first_name":"JERROD","last_name":"ADAMS","classification":"A","division":"CARRY OPTICS","hit_factor":6.1935},{"match_name":"Chillicothe Sportsmens Club November USPSA","match_date":"2020-11-21","stage_classifiercode":"20-01","member_number":"A109460","first_name":"DONALD","last_name":"DILLON","classification":"A","division":"CARRY OPTICS","hit_factor":6.1927},{"match_name":"Matamoras USPSA September 2021","match_date":"2021-09-19","stage_classifiercode":"20-01","member_number":"TY75879","first_name":"SCOTT","last_name":"WEISENFLUH","classification":"A","division":"CARRY OPTICS","hit_factor":6.1856},{"match_name":"MRPC OHS02 06272021","match_date":"2021-06-27","stage_classifiercode":"20-01","member_number":"A121317","first_name":"ROBBIE","last_name":"THOMAS","classification":"B","division":"CARRY OPTICS","hit_factor":6.181},{"match_name":"OREGON ARPC CC05 USPSA NOVEMBER 14 2020","match_date":"2020-11-14","stage_classifiercode":"20-01","member_number":"Ty98685","first_name":"ROB","last_name":"COATES","classification":"C","division":"CARRY OPTICS","hit_factor":6.1785},{"match_name":"TPS USPSA At CMP July 17 2021","match_date":"2021-07-17","stage_classifiercode":"20-01","member_number":"A70300","first_name":"DAVE","last_name":"HORN","classification":"U","division":"CARRY OPTICS","hit_factor":6.1785},{"match_name":"Cowtown Pistol Club USPSA MONDAY November 1 2021","match_date":"2021-11-02","stage_classifiercode":"20-01","member_number":"A123174","first_name":"RYAN","last_name":"MCMAKEN","classification":"M","division":"CARRY OPTICS","hit_factor":6.1785},{"match_name":"MRPC OHS02 06272021","match_date":"2021-06-27","stage_classifiercode":"20-01","member_number":"A132639","first_name":"MICHAEL","last_name":"NORMAN","classification":"U","division":"CARRY OPTICS","hit_factor":6.1768},{"match_name":"OPSC USPSA JUNE 2021","match_date":"2021-06-13","stage_classifiercode":"20-01","member_number":"FY134078","first_name":"JOHN","last_name":"MARTELLO","classification":"B","division":"CARRY OPTICS","hit_factor":6.1742},{"match_name":"17s PSC - USPSA - January 2021","match_date":"2021-01-16","stage_classifiercode":"20-01","member_number":"Ty81791","first_name":"ADAM","last_name":"JEZEWSKI","classification":"B","division":"CARRY OPTICS","hit_factor":6.1714},{"match_name":"RBGC USPSA 2021-8-15 Special Classifier Match","match_date":"2021-08-15","stage_classifiercode":"20-01","member_number":"TY113996","first_name":"LUIS","last_name":"CRESPO","classification":"C","division":"CARRY OPTICS","hit_factor":6.1714},{"match_name":"JCSSA DEC 5 2020","match_date":"2020-12-05","stage_classifiercode":"20-01","member_number":"A118619","first_name":"CASEY","last_name":"JONES","classification":"B","division":"CARRY OPTICS","hit_factor":6.1684},{"match_name":"Extreme GM uspsa Nov-13","match_date":"2021-11-13","stage_classifiercode":"20-01","member_number":"FY77988","first_name":"RICH","last_name":"VALVO","classification":"B","division":"CARRY OPTICS","hit_factor":6.1674},{"match_name":"EAGC January 2021 USPSA Classifier Match","match_date":"2021-01-30","stage_classifiercode":"20-01","member_number":"A116267","first_name":"COLE","last_name":"JOHNSON","classification":"U","division":"CARRY OPTICS","hit_factor":6.1644},{"match_name":"RBGC USPSA 2021-01-23","match_date":"2021-01-23","stage_classifiercode":"20-01","member_number":"FY68930","first_name":"NOAH","last_name":"TEAL","classification":"B","division":"CARRY OPTICS","hit_factor":6.1637},{"match_name":"Volusia County Gun and Hunt Club","match_date":"2020-11-21","stage_classifiercode":"20-01","member_number":"A60691","first_name":"STEVEN","last_name":"LUCIANO","classification":"A","division":"CARRY OPTICS","hit_factor":6.1611},{"match_name":"Oh Shoot -PRG Nov 27th - Uspsa Classifier Match","match_date":"2021-11-27","stage_classifiercode":"20-01","member_number":"TY123132","first_name":"COYLED4","last_name":"COBRA COMMANDER","classification":"B","division":"CARRY OPTICS","hit_factor":6.1574},{"match_name":"RBGC USPSA 2021-01-23","match_date":"2021-01-23","stage_classifiercode":"20-01","member_number":"TY110068","first_name":"SEAN","last_name":"PHAM","classification":"A","division":"CARRY OPTICS","hit_factor":6.1538},{"match_name":"Dundee Practical Shooters - Feb 27 2021","match_date":"2021-02-27","stage_classifiercode":"20-01","member_number":"TY80327","first_name":"DAVE","last_name":"LUND","classification":"A","division":"CARRY OPTICS","hit_factor":6.1506},{"match_name":"GoShoot Outdoor A6 Warm up And Classifier match!","match_date":"2021-04-03","stage_classifiercode":"20-01","member_number":"TY120968","first_name":"NICK","last_name":"YOUNG","classification":"M","division":"CARRY OPTICS","hit_factor":6.146},{"match_name":"Cactus USPSA ALL CLASSIFIER January 2021","match_date":"2021-01-03","stage_classifiercode":"20-01","member_number":"ty123343","first_name":"CHRIS","last_name":"LA LONDE-BERG","classification":"B","division":"CARRY OPTICS","hit_factor":6.1433},{"match_name":"GRB USPSA JANUARY 2021 AT CAVALIER","match_date":"2021-01-16","stage_classifiercode":"20-01","member_number":"Ty96148","first_name":"RICO","last_name":"REYNA","classification":"B","division":"CARRY OPTICS","hit_factor":6.1425},{"match_name":"LPRGC- Lower Providence USPSA Nov 2020 Match","match_date":"2020-11-07","stage_classifiercode":"20-01","member_number":"L4776","first_name":"NOEL","last_name":"ZARZA","classification":"A","division":"CARRY OPTICS","hit_factor":6.1404},{"match_name":"RPS January 2021 USPSA Match","match_date":"2021-01-09","stage_classifiercode":"20-01","member_number":"TY88089","first_name":"DAVID","last_name":"BURTON","classification":"B","division":"CARRY OPTICS","hit_factor":6.135},{"match_name":"CCPS July 2021 USPSA","match_date":"2021-07-04","stage_classifiercode":"20-01","member_number":"A118717","first_name":"VINCENT","last_name":"HALL","classification":"M","division":"CARRY OPTICS","hit_factor":6.135},{"match_name":"EHPSA USPSA 26 September 2021","match_date":"2021-09-26","stage_classifiercode":"20-01","member_number":"A118242","first_name":"MARIO","last_name":"VENDITTI","classification":"B","division":"CARRY OPTICS","hit_factor":6.135},{"match_name":"Heartland PS USPSA *ALL CLASSIFIER* 18 July 2021","match_date":"2021-07-18","stage_classifiercode":"20-01","member_number":"A84928","first_name":"AARON","last_name":"HIEMKE","classification":"U","division":"CARRY OPTICS","hit_factor":6.1321},{"match_name":"EHPSA USPSA 26 September 2021","match_date":"2021-09-26","stage_classifiercode":"20-01","member_number":"A122755","first_name":"NATHAN","last_name":"LINGSCH","classification":"A","division":"CARRY OPTICS","hit_factor":6.1321},{"match_name":"Cowtown Pistol Club USPSA MONDAY November 1 2021","match_date":"2021-11-02","stage_classifiercode":"20-01","member_number":"A129851","first_name":"HUNTER","last_name":"LONG","classification":"A","division":"CARRY OPTICS","hit_factor":6.1294},{"match_name":"LdF USPSA Classifier Match December 12 2020","match_date":"2020-12-12","stage_classifiercode":"20-01","member_number":"A126139","first_name":"ALEX","last_name":"CHU","classification":"A","division":"CARRY OPTICS","hit_factor":6.1224},{"match_name":"Glacier Practical Shooters Special Classifier Match 05/01/2021","match_date":"2021-05-01","stage_classifiercode":"20-01","member_number":"TY109180","first_name":"PATRICK","last_name":"FUREY","classification":"A","division":"CARRY OPTICS","hit_factor":6.12},{"match_name":"Dundee Practical Shooters - Feb 27 2021","match_date":"2021-02-27","stage_classifiercode":"20-01","member_number":"L2525","first_name":"KEITH","last_name":"TYLER","classification":"G","division":"CARRY OPTICS","hit_factor":6.1146},{"match_name":"Shadow Hawk Defense - USPSA Dec 13th","match_date":"2020-12-13","stage_classifiercode":"20-01","member_number":"A89090","first_name":"BOBBY","last_name":"YI - SUN","classification":"U","division":"CARRY OPTICS","hit_factor":6.1135},{"match_name":"APSC USPSA 08-21-21","match_date":"2021-08-21","stage_classifiercode":"20-01","member_number":"TY84373","first_name":"BRIAN","last_name":"LEVY","classification":"M","division":"CARRY OPTICS","hit_factor":6.1135},{"match_name":"FBURG September 2021 USPSA","match_date":"2021-09-05","stage_classifiercode":"20-01","member_number":"TY114978","first_name":"RHYS","last_name":"WILLIAMS","classification":"B","division":"CARRY OPTICS","hit_factor":6.1117},{"match_name":"SWGC USPSA Pistol Match - May 2021","match_date":"2021-05-01","stage_classifiercode":"20-01","member_number":"A119204","first_name":"ALEX","last_name":"CHAPPELL","classification":"A","division":"CARRY OPTICS","hit_factor":6.1111},{"match_name":"LNDL July 11th Classifier Match","match_date":"2021-07-11","stage_classifiercode":"20-01","member_number":"L4332","first_name":"MARCO","last_name":"DAVIS","classification":"A","division":"CARRY OPTICS","hit_factor":6.1086},{"match_name":"OREGON ARPC CC05 USPSA NOVEMBER 14 2020","match_date":"2020-11-14","stage_classifiercode":"20-01","member_number":"A74268","first_name":"AARON","last_name":"AVON","classification":"A","division":"CARRY OPTICS","hit_factor":6.1069},{"match_name":"OREGON ARPC CC05 USPSA OCT 9 2021","match_date":"2021-10-09","stage_classifiercode":"20-01","member_number":"A112110","first_name":"COLLIN","last_name":"WEST III","classification":"U","division":"CARRY OPTICS","hit_factor":6.105},{"match_name":"OPSC USPSA JUNE 2021","match_date":"2021-06-13","stage_classifiercode":"20-01","member_number":"TY94513","first_name":"TONY","last_name":"SALLIS","classification":"B","division":"CARRY OPTICS","hit_factor":6.1033},{"match_name":"Matamoras USPSA September 2021","match_date":"2021-09-19","stage_classifiercode":"20-01","member_number":"A98775","first_name":"JOHN","last_name":"JACKMAN","classification":"B","division":"CARRY OPTICS","hit_factor":6.0976},{"match_name":"TPS USPSA at CMP Dec 19 2020 Special Classifier Match","match_date":"2020-12-19","stage_classifiercode":"20-01","member_number":"A88052","first_name":"JOSHUA","last_name":"COBB","classification":"U","division":"CARRY OPTICS","hit_factor":6.0914},{"match_name":"LIPSA  - March  21st  2021 - March Madness USPSA Match ","match_date":"2021-03-21","stage_classifiercode":"20-01","member_number":"TY91801","first_name":"\"BO \"\"DAAGO\"\"\"","last_name":"TIAN","classification":"B","division":"CARRY OPTICS","hit_factor":6.089},{"match_name":"Oh Shoot -PRG Nov 27th - Uspsa Classifier Match","match_date":"2021-11-27","stage_classifiercode":"20-01","member_number":"A123975","first_name":"YIMIN","last_name":"LIANG2","classification":"U","division":"CARRY OPTICS","hit_factor":6.0879},{"match_name":"Shadow Hawk Defense USPSA - Sep  Sunday","match_date":"2021-09-12","stage_classifiercode":"20-01","member_number":"A117486","first_name":"JAMES","last_name":"BAKER","classification":"U","division":"CARRY OPTICS","hit_factor":6.087},{"match_name":"2020-12-05 USPSA  at Phoenix Rod and Gun Club","match_date":"2020-12-05","stage_classifiercode":"20-01","member_number":"A120240","first_name":"ROBERT","last_name":"SAUNDERS","classification":"C","division":"CARRY OPTICS","hit_factor":6.087},{"match_name":"GRB USPSA JANUARY 2021 AT CAVALIER","match_date":"2021-01-16","stage_classifiercode":"20-01","member_number":"A75059","first_name":"JENU RHODE","last_name":"TOMAS","classification":"B","division":"CARRY OPTICS","hit_factor":6.087},{"match_name":"OPSC USPSA JUNE 2021","match_date":"2021-06-13","stage_classifiercode":"20-01","member_number":"A130227","first_name":"TONY","last_name":"PONTRELLI","classification":"A","division":"CARRY OPTICS","hit_factor":6.0827},{"match_name":"CAS March 2021","match_date":"2021-03-07","stage_classifiercode":"20-01","member_number":"A104207","first_name":"SCOTT","last_name":"BRAATEN","classification":"A","division":"CARRY OPTICS","hit_factor":6.0759},{"match_name":"Dundee Practical Shooters - Feb 27 2021","match_date":"2021-02-27","stage_classifiercode":"20-01","member_number":"A114271","first_name":"BRIAN","last_name":"DOLINAR","classification":"C","division":"CARRY OPTICS","hit_factor":6.0748},{"match_name":"SWGC USPSA Pistol Match - May 2021","match_date":"2021-05-01","stage_classifiercode":"20-01","member_number":"A123280","first_name":"DON","last_name":"SMART","classification":"A","division":"CARRY OPTICS","hit_factor":6.0742},{"match_name":"LdF USPSA Classifier Match December 12 2020","match_date":"2020-12-12","stage_classifiercode":"20-01","member_number":"A81101","first_name":"LES","last_name":"ANDERSON","classification":"U","division":"CARRY OPTICS","hit_factor":6.0738},{"match_name":"Cowtown Pistol Club USPSA MONDAY November 1 2021","match_date":"2021-11-02","stage_classifiercode":"20-01","member_number":"A129359","first_name":"BRAD","last_name":"NEESE","classification":"B","division":"CARRY OPTICS","hit_factor":6.0733},{"match_name":"MCPSL Pistol 1-9-2021","match_date":"2021-01-09","stage_classifiercode":"20-01","member_number":"A92348","first_name":"CHARLIE","last_name":"MODEREGER","classification":"B","division":"CARRY OPTICS","hit_factor":6.0677},{"match_name":"Harvard Action Shooters May 2021 USPSA Pistol Match","match_date":"2021-05-02","stage_classifiercode":"20-01","member_number":"TY82636","first_name":"CRISTIAN","last_name":"ARCILLA","classification":"U","division":"CARRY OPTICS","hit_factor":6.0677},{"match_name":"Hallstead USPSA April 24 match","match_date":"2021-04-24","stage_classifiercode":"20-01","member_number":"TY75879","first_name":"SCOTT","last_name":"WEISENFLUH","classification":"A","division":"CARRY OPTICS","hit_factor":6.0606},{"match_name":"Cameo USPSA Match November 21 2020","match_date":"2020-11-21","stage_classifiercode":"20-01","member_number":"FY45419","first_name":"TODD","last_name":"HALLER","classification":"B","division":"CARRY OPTICS","hit_factor":6.0606},{"match_name":"EHPSA USPSA 26 September 2021","match_date":"2021-09-26","stage_classifiercode":"20-01","member_number":"A122755","first_name":"NATHAN","last_name":"LINGSCH","classification":"A","division":"CARRY OPTICS","hit_factor":6.0606},{"match_name":"Vortex Edge USPSA October 2021","match_date":"2021-10-09","stage_classifiercode":"20-01","member_number":"Ty89958","first_name":"JESSE","last_name":"NEWTON","classification":"G","division":"CARRY OPTICS","hit_factor":6.0541},{"match_name":"OREGON ARPC CC05 USPSA OCT 9 2021","match_date":"2021-10-09","stage_classifiercode":"20-01","member_number":"A112430","first_name":"ANAN","last_name":"KANTAWEE","classification":"B","division":"CARRY OPTICS","hit_factor":6.0538},{"match_name":"SKSC USPSA Oct 2021","match_date":"2021-10-16","stage_classifiercode":"20-01","member_number":"A113681","first_name":"BRANDON","last_name":"BOYD","classification":"A","division":"CARRY OPTICS","hit_factor":6.0538},{"match_name":"Shadow Hawk Defense USPSA - Sep Sat","match_date":"2021-09-11","stage_classifiercode":"20-01","member_number":"A89090","first_name":"BOBBY","last_name":"YI","classification":"B","division":"CARRY OPTICS","hit_factor":6.0538},{"match_name":"PMRPC USPSA 12Dec20 - all Classifier","match_date":"2020-12-12","stage_classifiercode":"20-01","member_number":"A129703","first_name":"BRENDON","last_name":"KEISER","classification":"B","division":"CARRY OPTICS","hit_factor":6.0536},{"match_name":"LdF USPSA Classifier Match December 12 2020","match_date":"2020-12-12","stage_classifiercode":"20-01","member_number":"TY83987","first_name":"JOSH","last_name":"YOSHIMOTO","classification":"C","division":"CARRY OPTICS","hit_factor":6.0475},{"match_name":"Extreme GM uspsa Nov-13","match_date":"2021-11-13","stage_classifiercode":"20-01","member_number":"A88251","first_name":"LINDA","last_name":"HILTON","classification":"B","division":"CARRY OPTICS","hit_factor":6.047},{"match_name":"AIPS Weekly USPSA 8 June 2021","match_date":"2021-06-08","stage_classifiercode":"20-01","member_number":"TY4180","first_name":"JAY","last_name":"TAPPE","classification":"A","division":"CARRY OPTICS","hit_factor":6.047},{"match_name":"2020-12-05 USPSA  at Phoenix Rod and Gun Club","match_date":"2020-12-05","stage_classifiercode":"20-01","member_number":"A117260","first_name":"ALEXANDER","last_name":"SCHULTZ","classification":"B","division":"CARRY OPTICS","hit_factor":6.0465},{"match_name":"OREGON ARPC CC05 USPSA OCT 9 2021","match_date":"2021-10-09","stage_classifiercode":"20-01","member_number":"A121597","first_name":"JOSHUA","last_name":"RAVENCRAFT","classification":"B","division":"CARRY OPTICS","hit_factor":6.0459},{"match_name":"GoShoot Outdoor A6 Warm up And Classifier match!","match_date":"2021-04-03","stage_classifiercode":"20-01","member_number":"A133675","first_name":"ARTHUR","last_name":"MALONE","classification":"U","division":"CARRY OPTICS","hit_factor":6.0386},{"match_name":"Maine Practical Shooters May 2021","match_date":"2021-05-08","stage_classifiercode":"20-01","member_number":"A89748","first_name":"VINCENT","last_name":"DAVIES","classification":"M","division":"CARRY OPTICS","hit_factor":6.0325},{"match_name":"MCTS -  USPSA March 2021 Classifier Match","match_date":"2021-03-21","stage_classifiercode":"20-01","member_number":"A130977","first_name":"ANDREW","last_name":"MILLER","classification":"B","division":"CARRY OPTICS","hit_factor":6.0325},{"match_name":"APSC USPSA 08-21-21","match_date":"2021-08-21","stage_classifiercode":"20-01","member_number":"A107354","first_name":"BRIAN","last_name":"PURKISS","classification":"M","division":"CARRY OPTICS","hit_factor":6.0302},{"match_name":"ACPSA November 2020","match_date":"2020-11-28","stage_classifiercode":"20-01","member_number":"A107310","first_name":"LUCIANO","last_name":"MICELI","classification":"A","division":"CARRY OPTICS","hit_factor":6.0291},{"match_name":"Dundee Practical Shooters - Feb 27 2021","match_date":"2021-02-27","stage_classifiercode":"20-01","member_number":"A74268","first_name":"AARON","last_name":"AVON","classification":"A","division":"CARRY OPTICS","hit_factor":6.0268},{"match_name":"MRPC OHS02 06272021","match_date":"2021-06-27","stage_classifiercode":"20-01","member_number":"A109246","first_name":"ZACHARY","last_name":"WRIGHT","classification":"C","division":"CARRY OPTICS","hit_factor":6.0241},{"match_name":"Pioneer Action Shooters USPSA 11-15-20","match_date":"2020-11-15","stage_classifiercode":"20-01","member_number":"A101933","first_name":"PAUL","last_name":"STINSON","classification":"A","division":"CARRY OPTICS","hit_factor":6.0201},{"match_name":"Vortex Edge USPSA October 2021","match_date":"2021-10-09","stage_classifiercode":"20-01","member_number":"FY68626","first_name":"PETER","last_name":"SCHREIER","classification":"A","division":"CARRY OPTICS","hit_factor":6.0181},{"match_name":"Moss Branch USPSA June match","match_date":"2021-06-26","stage_classifiercode":"20-01","member_number":"A97648","first_name":"ADAM","last_name":"JOINER","classification":"B","division":"CARRY OPTICS","hit_factor":6.015},{"match_name":"Magnolia Rifle and Pistol Club May  2021 USPSA Match","match_date":"2021-05-15","stage_classifiercode":"20-01","member_number":"A111435","first_name":"STONEY","last_name":"STEELE","classification":"M","division":"CARRY OPTICS","hit_factor":6.0131},{"match_name":"PMRPC USPSA 12Dec20 - all Classifier","match_date":"2020-12-12","stage_classifiercode":"20-01","member_number":"A104504","first_name":"LESLIE","last_name":"HERMAN","classification":"U","division":"CARRY OPTICS","hit_factor":6.0104},{"match_name":"BORCC USPSA April 2021","match_date":"2021-04-17","stage_classifiercode":"20-01","member_number":"TY106580","first_name":"ROBERT","last_name":"ALAMO","classification":"B","division":"CARRY OPTICS","hit_factor":6.0075},{"match_name":"Cactus USPSA ALL CLASSIFIER January 2021","match_date":"2021-01-03","stage_classifiercode":"20-01","member_number":"Ty93834","first_name":"THOMAS","last_name":"SMITH","classification":"B","division":"CARRY OPTICS","hit_factor":6.0021},{"match_name":"LdF USPSA Match November 7 2021","match_date":"2021-11-07","stage_classifiercode":"20-01","member_number":"A104163","first_name":"FRANCIS","last_name":"SANCHEZ","classification":"A","division":"CARRY OPTICS","hit_factor":5.9977},{"match_name":"SOAP July 2021 USPSA Match","match_date":"2021-07-11","stage_classifiercode":"20-01","member_number":"TY112305","first_name":"DANIEL","last_name":"CARVO","classification":"A","division":"CARRY OPTICS","hit_factor":5.9977},{"match_name":"MRPC OHS02 06272021","match_date":"2021-06-27","stage_classifiercode":"20-01","member_number":"TY135194","first_name":"JEREMY","last_name":"STECK","classification":"U","division":"CARRY OPTICS","hit_factor":5.9957},{"match_name":"Ontelaunee USPSA November 2020","match_date":"2020-11-20","stage_classifiercode":"20-01","member_number":"A100045","first_name":"KYLE","last_name":"KIM","classification":"B","division":"CARRY OPTICS","hit_factor":5.9933},{"match_name":"ENPS September 2021 USPSA Match","match_date":"2021-09-04","stage_classifiercode":"20-01","member_number":"A132690","first_name":"TYREL","last_name":"SPRAGUE","classification":"C","division":"CARRY OPTICS","hit_factor":5.9917},{"match_name":"Wallis Orchard Practical Shooters April 2021 Club Match","match_date":"2021-04-18","stage_classifiercode":"20-01","member_number":"FY34819","first_name":"MIKE","last_name":"JUNCO","classification":"A","division":"CARRY OPTICS","hit_factor":5.988},{"match_name":"GCL Saturday 4-3-2021","match_date":"2021-04-03","stage_classifiercode":"20-01","member_number":"TY110732","first_name":"TONY","last_name":"CAVICCHIOLI","classification":"B","division":"CARRY OPTICS","hit_factor":5.988},{"match_name":"Maine Practical Shooters May 2021","match_date":"2021-05-08","stage_classifiercode":"20-01","member_number":"A126575","first_name":"MARK","last_name":"DARRIGO","classification":"B","division":"CARRY OPTICS","hit_factor":5.9867},{"match_name":"PIPS 04-28-2021","match_date":"2021-04-27","stage_classifiercode":"20-01","member_number":"FY95574","first_name":"CHARLES","last_name":"KIM","classification":"M","division":"CARRY OPTICS","hit_factor":5.9818},{"match_name":"STAGE ZERO  ALL CLASSIFIER","match_date":"2020-11-21","stage_classifiercode":"20-01","member_number":"A116868","first_name":"MICHAEL","last_name":"MADUSKE","classification":"C","division":"CARRY OPTICS","hit_factor":5.9737},{"match_name":"STAGE ZERO ALL CLASSIFIER","match_date":"2021-09-04","stage_classifiercode":"20-01","member_number":"A127512","first_name":"EDWARD","last_name":"LEONI99","classification":"C","division":"CARRY OPTICS","hit_factor":5.9633},{"match_name":"Pioneer Action Shooters USPSA 11-15-20","match_date":"2020-11-15","stage_classifiercode":"20-01","member_number":"TY79813","first_name":"JOEL","last_name":"PENNEY","classification":"U","division":"CARRY OPTICS","hit_factor":5.9565},{"match_name":"SOAP July 2021 USPSA Match","match_date":"2021-07-11","stage_classifiercode":"20-01","member_number":"A93855","first_name":"DAVE","last_name":"LONGCOR","classification":"B","division":"CARRY OPTICS","hit_factor":5.9537},{"match_name":"ESPS  USPSA  March","match_date":"2021-03-27","stage_classifiercode":"20-01","member_number":"TY31868","first_name":"DENNIS","last_name":"BOYLE","classification":"A","division":"CARRY OPTICS","hit_factor":5.9511},{"match_name":"NW01 T-Day 2020","match_date":"2020-11-08","stage_classifiercode":"20-01","member_number":"A97885","first_name":"TODD","last_name":"ANDERSON","classification":"U","division":"CARRY OPTICS","hit_factor":5.9497},{"match_name":"MRPC OHS02 06272021","match_date":"2021-06-27","stage_classifiercode":"20-01","member_number":"A75756","first_name":"DALE","last_name":"WRIGHT","classification":"B","division":"CARRY OPTICS","hit_factor":5.9453},{"match_name":"NW01 T-Day 2020","match_date":"2020-11-08","stage_classifiercode":"20-01","member_number":"TY109181","first_name":"SAM","last_name":"WAGG","classification":"U","division":"CARRY OPTICS","hit_factor":5.9448},{"match_name":"Collin County USPSA  08-22-2021","match_date":"2021-08-22","stage_classifiercode":"20-01","member_number":"A118138","first_name":"MATT","last_name":"CHUA","classification":"M","division":"CARRY OPTICS","hit_factor":5.9432},{"match_name":"FBURG September 2021 USPSA","match_date":"2021-09-05","stage_classifiercode":"20-01","member_number":"A131681","first_name":"DANIEL","last_name":"YU","classification":"C","division":"CARRY OPTICS","hit_factor":5.9385},{"match_name":"ENPS September 2021 USPSA Match","match_date":"2021-09-04","stage_classifiercode":"20-01","member_number":"TY101521","first_name":"JEFF","last_name":"KING","classification":"B","division":"CARRY OPTICS","hit_factor":5.9341},{"match_name":"TPS USPSA at CMP Dec 19 2020 Special Classifier Match","match_date":"2020-12-19","stage_classifiercode":"20-01","member_number":"a123422","first_name":"GARRET","last_name":"MCLAREN","classification":"A","division":"CARRY OPTICS","hit_factor":5.9299},{"match_name":"SFPS 5-16-21 Super Classifier","match_date":"2021-05-16","stage_classifiercode":"20-01","member_number":"A117144","first_name":"MICHAEL","last_name":"HERBST","classification":"A","division":"CARRY OPTICS","hit_factor":5.9293},{"match_name":"QPS Quantico Shooting Club December USPSA   ","match_date":"2020-12-12","stage_classifiercode":"20-01","member_number":"A101186","first_name":"ZACH","last_name":"BASICH","classification":"U","division":"CARRY OPTICS","hit_factor":5.9202},{"match_name":"SOAP December 2020 USPSA Match","match_date":"2020-12-11","stage_classifiercode":"20-01","member_number":"L3567","first_name":"RON","last_name":"SELBY","classification":"M","division":"CARRY OPTICS","hit_factor":5.9197},{"match_name":"Chillicothe Sportsmens Club July USPSA","match_date":"2021-07-24","stage_classifiercode":"20-01","member_number":"A111013","first_name":"JASON","last_name":"SAUDER","classification":"B","division":"CARRY OPTICS","hit_factor":5.9197},{"match_name":"Mvpsa USPSA November 7 2020","match_date":"2020-11-07","stage_classifiercode":"20-01","member_number":"TY85911","first_name":"NICHOLAS","last_name":"STAVROS","classification":"M","division":"CARRY OPTICS","hit_factor":5.9172},{"match_name":"GRB USPSA JANUARY 2021 AT CAVALIER","match_date":"2021-01-16","stage_classifiercode":"20-01","member_number":"A89090","first_name":"BOBBY","last_name":"YI","classification":"B","division":"CARRY OPTICS","hit_factor":5.9134},{"match_name":"Shadow Hawk Defense USPSA - Sep Sat","match_date":"2021-09-11","stage_classifiercode":"20-01","member_number":"TY109924","first_name":"JOHN","last_name":"MCMAHON","classification":"C","division":"CARRY OPTICS","hit_factor":5.9081},{"match_name":"EAGC January 2021 USPSA Classifier Match","match_date":"2021-01-30","stage_classifiercode":"20-01","member_number":"A116198","first_name":"ETHAN","last_name":"FOSHEE","classification":"B","division":"CARRY OPTICS","hit_factor":5.9072},{"match_name":"CAS March 2021","match_date":"2021-03-07","stage_classifiercode":"20-01","member_number":"L2100","first_name":"MAX","last_name":"MICHEL SR.","classification":"A","division":"CARRY OPTICS","hit_factor":5.9072},{"match_name":"Medford USPSA Oct 2021 Match","match_date":"2021-10-17","stage_classifiercode":"20-01","member_number":"A130392","first_name":"LANCE","last_name":"MENOLD","classification":"B","division":"CARRY OPTICS","hit_factor":5.9024},{"match_name":"WLPS May 2021 ALL USPSA Classifier Match ","match_date":"2021-05-23","stage_classifiercode":"20-01","member_number":"A118534","first_name":"ERIC","last_name":"MALONEY","classification":"U","division":"CARRY OPTICS","hit_factor":5.9016},{"match_name":"YMM  IPSC02 2021_01_10","match_date":"2021-01-10","stage_classifiercode":"20-01","member_number":"TY111439","first_name":"CHARLENE","last_name":"MARTIN","classification":"A","division":"CARRY OPTICS","hit_factor":5.8957},{"match_name":"MCPSL Pistol 1-9-2021","match_date":"2021-01-09","stage_classifiercode":"20-01","member_number":"L2897","first_name":"DONN","last_name":"HILL","classification":"U","division":"CARRY OPTICS","hit_factor":5.8952},{"match_name":"GoShoot Outdoor A6 Warm up And Classifier match!","match_date":"2021-04-03","stage_classifiercode":"20-01","member_number":"A127180","first_name":"MICAH","last_name":"MATHENA","classification":"A","division":"CARRY OPTICS","hit_factor":5.8893},{"match_name":"TPS USPSA -  January Match 2021 Rescheduled","match_date":"2021-01-03","stage_classifiercode":"20-01","member_number":"FY82088","first_name":"PARKS","last_name":"SMALL","classification":"A","division":"CARRY OPTICS","hit_factor":5.8893},{"match_name":"Cactus USPSA ALL CLASSIFIER January 2021","match_date":"2021-01-03","stage_classifiercode":"20-01","member_number":"A125201","first_name":"MONTE","last_name":"SELLARDS","classification":"B","division":"CARRY OPTICS","hit_factor":5.889},{"match_name":"Magnolia Rifle and Pistol Club May  2021 USPSA Match","match_date":"2021-05-15","stage_classifiercode":"20-01","member_number":"A75028","first_name":"TYLER","last_name":"THARP","classification":"B","division":"CARRY OPTICS","hit_factor":5.8824},{"match_name":"Southern Kentucky Gun Club USPSA April Match","match_date":"2021-04-25","stage_classifiercode":"20-01","member_number":"A110422","first_name":"IKE","last_name":"LANAS","classification":"C","division":"CARRY OPTICS","hit_factor":5.8824},{"match_name":"APSC USPSA 11-7-20","match_date":"2020-11-07","stage_classifiercode":"20-01","member_number":"TY116493","first_name":"CHRISTOPHER","last_name":"MARRAPODI","classification":"B","division":"CARRY OPTICS","hit_factor":5.8764},{"match_name":"SRSC USPSA 3-28-21 Superclassifier","match_date":"2021-03-28","stage_classifiercode":"20-01","member_number":"TY122705","first_name":"GREG","last_name":"KING","classification":"C","division":"CARRY OPTICS","hit_factor":5.8764},{"match_name":"LASC-USPSA April 2021","match_date":"2021-04-17","stage_classifiercode":"20-01","member_number":"FY89170","first_name":"DUDLEY","last_name":"IRBY","classification":"U","division":"CARRY OPTICS","hit_factor":5.8762},{"match_name":"NISA August 2021","match_date":"2021-08-22","stage_classifiercode":"20-01","member_number":"A131825","first_name":"JUSTIN","last_name":"MORAVEC","classification":"B","division":"CARRY OPTICS","hit_factor":5.8757},{"match_name":"Oh Shoot -PRG Nov 27th - Uspsa Classifier Match","match_date":"2021-11-27","stage_classifiercode":"20-01","member_number":"TY132558","first_name":"MIKHAIL","last_name":"REYES","classification":"B","division":"CARRY OPTICS","hit_factor":5.8757},{"match_name":"CTASA - 3rd Sunday USPSA at Triple C Range - 12-20-2020","match_date":"2020-12-20","stage_classifiercode":"20-01","member_number":"A76773","first_name":"ZACK","last_name":"CAM","classification":"A","division":"CARRY OPTICS","hit_factor":5.8748},{"match_name":"EHPSA USPSA 26 September 2021","match_date":"2021-09-26","stage_classifiercode":"20-01","member_number":"A118242","first_name":"MARIO","last_name":"VENDITTI","classification":"B","division":"CARRY OPTICS","hit_factor":5.87},{"match_name":"ANPRACS USPSA 9-4-21","match_date":"2021-09-04","stage_classifiercode":"20-01","member_number":"Fy95886","first_name":"LOREN","last_name":"ZEIGLER","classification":"B","division":"CARRY OPTICS","hit_factor":5.8599},{"match_name":"SOAP December 2020 USPSA Match","match_date":"2020-12-11","stage_classifiercode":"20-01","member_number":"TY101829","first_name":"MARC","last_name":"VETOVITZ","classification":"B","division":"CARRY OPTICS","hit_factor":5.8586},{"match_name":"CIPSC IL Havana May USPSA","match_date":"2021-05-08","stage_classifiercode":"20-01","member_number":"A109460","first_name":"DONALD","last_name":"DILLON","classification":"A","division":"CARRY OPTICS","hit_factor":5.8568},{"match_name":"CAS March 2021","match_date":"2021-03-07","stage_classifiercode":"20-01","member_number":"FY38991","first_name":"MIKE","last_name":"ADAM","classification":"A","division":"CARRY OPTICS","hit_factor":5.8568},{"match_name":"CIPSC IL Havana May USPSA","match_date":"2021-05-08","stage_classifiercode":"20-01","member_number":"A102567","first_name":"MIKE","last_name":"STEELE","classification":"M","division":"CARRY OPTICS","hit_factor":5.8548},{"match_name":"GoShoot Outdoor A6 Warm up And Classifier match!","match_date":"2021-04-03","stage_classifiercode":"20-01","member_number":"A61575","first_name":"MICHAEL","last_name":"BACHMAN","classification":"U","division":"CARRY OPTICS","hit_factor":5.8537},{"match_name":"CIPSC IL02 Havana August USPSA","match_date":"2021-08-07","stage_classifiercode":"20-01","member_number":"A16729","first_name":"MIKE","last_name":"FARNIOK","classification":"U","division":"CARRY OPTICS","hit_factor":5.8516},{"match_name":"CCPS July 2021 USPSA","match_date":"2021-07-04","stage_classifiercode":"20-01","member_number":"A108739","first_name":"BRAD","last_name":"BERMAN","classification":"A","division":"CARRY OPTICS","hit_factor":5.8516},{"match_name":"Harvard Action Shooters May 2021 USPSA Pistol Match","match_date":"2021-05-02","stage_classifiercode":"20-01","member_number":"TY115395","first_name":"JOHN","last_name":"SHPACK","classification":"B","division":"CARRY OPTICS","hit_factor":5.8505},{"match_name":"Magnolia Rifle and Pistol Club May  2021 USPSA Match","match_date":"2021-05-15","stage_classifiercode":"20-01","member_number":"L1740","first_name":"JOHNNY","last_name":"BRISTER","classification":"M","division":"CARRY OPTICS","hit_factor":5.8505},{"match_name":"SFA USPSA November 20 2021 MATCH","match_date":"2021-11-20","stage_classifiercode":"20-01","member_number":"TY79621","first_name":"STEVE","last_name":"COLLEN","classification":"A","division":"CARRY OPTICS","hit_factor":5.848},{"match_name":"Cactus USPSA ALL CLASSIFIER January 2021","match_date":"2021-01-03","stage_classifiercode":"20-01","member_number":"A120431","first_name":"MARK","last_name":"ZILINSKAS","classification":"B","division":"CARRY OPTICS","hit_factor":5.848},{"match_name":"Magnolia Rifle and Pistol Club May  2021 USPSA Match","match_date":"2021-05-15","stage_classifiercode":"20-01","member_number":"A113380","first_name":"SCOTT","last_name":"CAGE","classification":"B","division":"CARRY OPTICS","hit_factor":5.8465},{"match_name":"EHPSA USPSA 26 September 2021","match_date":"2021-09-26","stage_classifiercode":"20-01","member_number":"A122755","first_name":"NATHAN","last_name":"LINGSCH","classification":"A","division":"CARRY OPTICS","hit_factor":5.8455},{"match_name":"Shadow Hawk Defense USPSA - Sep  Sunday","match_date":"2021-09-12","stage_classifiercode":"20-01","member_number":"A122755","first_name":"NATHAN","last_name":"LINGSCH","classification":"A","division":"CARRY OPTICS","hit_factor":5.8411},{"match_name":"LdF USPSA Classifier Match December 12 2020","match_date":"2020-12-12","stage_classifiercode":"20-01","member_number":"TY80057","first_name":"CHRIS","last_name":"SOUSOUNIS2","classification":"U","division":"CARRY OPTICS","hit_factor":5.8366},{"match_name":"SKSC USPSA Oct 2021","match_date":"2021-10-16","stage_classifiercode":"20-01","member_number":"A104572","first_name":"CHRIS","last_name":"GOOSSEN","classification":"M","division":"CARRY OPTICS","hit_factor":5.8361},{"match_name":"MCRC USPSA March 2021","match_date":"2021-03-13","stage_classifiercode":"20-01","member_number":"A8318","first_name":"BOB","last_name":"BAILEY","classification":"M","division":"CARRY OPTICS","hit_factor":5.8309},{"match_name":"Vortex Edge USPSA October 2021","match_date":"2021-10-09","stage_classifiercode":"20-01","member_number":"A120645","first_name":"COLIN","last_name":"KLOK","classification":"M","division":"CARRY OPTICS","hit_factor":5.8296},{"match_name":"SRSC USPSA 3-28-21 Superclassifier","match_date":"2021-03-28","stage_classifiercode":"20-01","member_number":"TY123292","first_name":"STEPHEN","last_name":"TOMILSON","classification":"C","division":"CARRY OPTICS","hit_factor":5.8291},{"match_name":"Shadow Hawk Defense USPSA - Sep  Sunday","match_date":"2021-09-12","stage_classifiercode":"20-01","member_number":"Ty74344","first_name":"LANCE","last_name":"DEHLER","classification":"M","division":"CARRY OPTICS","hit_factor":5.8275},{"match_name":"SWGC USPSA Pistol Match - May 2021","match_date":"2021-05-01","stage_classifiercode":"20-01","member_number":"A128926","first_name":"SAMUEL","last_name":"NELSON","classification":"U","division":"CARRY OPTICS","hit_factor":5.8252},{"match_name":"Square Deal Sportsmen June USPSA Match 2021","match_date":"2021-06-06","stage_classifiercode":"20-01","member_number":"A122115","first_name":"BEN","last_name":"CZYZEWSKI","classification":"M","division":"CARRY OPTICS","hit_factor":5.8231},{"match_name":"ACPSA November 2020","match_date":"2020-11-28","stage_classifiercode":"20-01","member_number":"A78372","first_name":"BILL","last_name":"HARRIS","classification":"C","division":"CARRY OPTICS","hit_factor":5.8212},{"match_name":"EAGC January 2021 USPSA Classifier Match","match_date":"2021-01-30","stage_classifiercode":"20-01","member_number":"TY98112","first_name":"BUD","last_name":"HUMELSINE","classification":"A","division":"CARRY OPTICS","hit_factor":5.8152},{"match_name":"Magnolia Rifle and Pistol Club May  2021 USPSA Match","match_date":"2021-05-15","stage_classifiercode":"20-01","member_number":"A131702","first_name":"SAMUEL","last_name":"PATRICK","classification":"U","division":"CARRY OPTICS","hit_factor":5.8152},{"match_name":"LdF USPSA Classifier Match December 12 2020","match_date":"2020-12-12","stage_classifiercode":"20-01","member_number":"TY80157","first_name":"DAVE","last_name":"DEZAN","classification":"U","division":"CARRY OPTICS","hit_factor":5.8058},{"match_name":"OPSC USPSA JUNE 2021","match_date":"2021-06-13","stage_classifiercode":"20-01","member_number":"A127797","first_name":"BERNARD","last_name":"BENETEAU","classification":"A","division":"CARRY OPTICS","hit_factor":5.8036},{"match_name":"ACPSA November 2020","match_date":"2020-11-28","stage_classifiercode":"20-01","member_number":"A30555","first_name":"DAVID","last_name":"WILDS","classification":"A","division":"CARRY OPTICS","hit_factor":5.7971},{"match_name":"EWPSA 2021-04","match_date":"2021-04-17","stage_classifiercode":"20-01","member_number":"TY82489","first_name":"TRENT","last_name":"WETHERBEE","classification":"B","division":"CARRY OPTICS","hit_factor":5.7971},{"match_name":"MAPSA 5/8/21","match_date":"2021-05-08","stage_classifiercode":"20-01","member_number":"A107108","first_name":"CRAIG","last_name":"SCHMITT","classification":"B","division":"CARRY OPTICS","hit_factor":5.7942},{"match_name":"OREGON ARPC CC05 USPSA OCT 9 2021","match_date":"2021-10-09","stage_classifiercode":"20-01","member_number":"A133832","first_name":"MATT","last_name":"OLSOFSKY","classification":"B","division":"CARRY OPTICS","hit_factor":5.7942},{"match_name":"Wallis Orchard Practical Shooters April 2021 Club Match","match_date":"2021-04-18","stage_classifiercode":"20-01","member_number":"TY70984","first_name":"MIKE","last_name":"KAHL","classification":"B","division":"CARRY OPTICS","hit_factor":5.787},{"match_name":"5 Dogs December USPSA 2020","match_date":"2020-12-06","stage_classifiercode":"20-01","member_number":"A107575","first_name":"DUDLEY","last_name":"BAKER","classification":"B","division":"CARRY OPTICS","hit_factor":5.7842},{"match_name":"PIPS 04-28-2021","match_date":"2021-04-27","stage_classifiercode":"20-01","member_number":"A100775","first_name":"JON","last_name":"EICHTEN","classification":"B","division":"CARRY OPTICS","hit_factor":5.7842},{"match_name":"JPPS USPSA Match 8-15-2021","match_date":"2021-08-15","stage_classifiercode":"20-01","member_number":"A102910","first_name":"BRENT","last_name":"ROSS","classification":"U","division":"CARRY OPTICS","hit_factor":5.7748},{"match_name":"CTASA - 3rd Sunday USPSA at Triple C Range - 12-20-2020","match_date":"2020-12-20","stage_classifiercode":"20-01","member_number":"A130493","first_name":"DANIEL","last_name":"LEE","classification":"B","division":"CARRY OPTICS","hit_factor":5.7692},{"match_name":"Wallis Orchard Practical Shooters April 2021 Club Match","match_date":"2021-04-18","stage_classifiercode":"20-01","member_number":"A99651","first_name":"RIDONG","last_name":"WEN","classification":"U","division":"CARRY OPTICS","hit_factor":5.7654},{"match_name":"TTS USPSA Match 12JUN2021","match_date":"2021-06-12","stage_classifiercode":"20-01","member_number":"FY128600","first_name":"PHIL","last_name":"TRUONG","classification":"C","division":"CARRY OPTICS","hit_factor":5.765},{"match_name":"RBGC USPSA 2021-01-23","match_date":"2021-01-23","stage_classifiercode":"20-01","member_number":"A105182","first_name":"STEVE","last_name":"JAWORSKI","classification":"A","division":"CARRY OPTICS","hit_factor":5.7554},{"match_name":"ACPSA November 2020","match_date":"2020-11-28","stage_classifiercode":"20-01","member_number":"TY60272","first_name":"RICKY","last_name":"HAYES","classification":"B","division":"CARRY OPTICS","hit_factor":5.7554},{"match_name":"SFA USPSA JANUARY 16 2021 MATCH","match_date":"2021-01-16","stage_classifiercode":"20-01","member_number":"A70458","first_name":"SHAWN","last_name":"KONO","classification":"B","division":"CARRY OPTICS","hit_factor":5.7554},{"match_name":"KSA USPSA  3 April 2021","match_date":"2021-04-03","stage_classifiercode":"20-01","member_number":"A119314","first_name":"TRAVIS","last_name":"TURNER","classification":"A","division":"CARRY OPTICS","hit_factor":5.7537},{"match_name":"Pioneer Action Shooters USPSA 11-15-20","match_date":"2020-11-15","stage_classifiercode":"20-01","member_number":"TY128695","first_name":"RICK","last_name":"BARKER","classification":"C","division":"CARRY OPTICS","hit_factor":5.7537},{"match_name":"Chillicothe Sportsmens Club November USPSA","match_date":"2020-11-21","stage_classifiercode":"20-01","member_number":"FY98887","first_name":"DAVID","last_name":"MANDROS","classification":"B","division":"CARRY OPTICS","hit_factor":5.7522},{"match_name":"SWGC USPSA Pistol Match - May 2021","match_date":"2021-05-01","stage_classifiercode":"20-01","member_number":"A128312","first_name":"MATTHEW","last_name":"SIMPSON","classification":"B","division":"CARRY OPTICS","hit_factor":5.7508},{"match_name":"SOAP December 2020 USPSA Match","match_date":"2020-12-11","stage_classifiercode":"20-01","member_number":"TY101811","first_name":"BRENT","last_name":"VETOVITZ","classification":"B","division":"CARRY OPTICS","hit_factor":5.7495},{"match_name":"EHPSA USPSA 26 September 2021","match_date":"2021-09-26","stage_classifiercode":"20-01","member_number":"A75062","first_name":"CALVIN","last_name":"BRANTNER","classification":"B","division":"CARRY OPTICS","hit_factor":5.7495},{"match_name":"RPS January 2021 USPSA Match","match_date":"2021-01-09","stage_classifiercode":"20-01","member_number":"A124088","first_name":"CHUCK","last_name":"KUANG","classification":"C","division":"CARRY OPTICS","hit_factor":5.7471},{"match_name":"SOAP December 2020 USPSA Match","match_date":"2020-12-11","stage_classifiercode":"20-01","member_number":"FY94841","first_name":"STEVE","last_name":"HARTUNG-2","classification":"A","division":"CARRY OPTICS","hit_factor":5.7471},{"match_name":"WGC AUGUST 2021 USPSA CLASSIFIER MATCH","match_date":"2021-08-08","stage_classifiercode":"20-01","member_number":"L4911","first_name":"CARLOS","last_name":"PERAZZA","classification":"U","division":"CARRY OPTICS","hit_factor":5.7459},{"match_name":"Shadow Hawk Defense USPSA - Sep Sat","match_date":"2021-09-11","stage_classifiercode":"20-01","member_number":"A135851","first_name":"THOMAS","last_name":"SCHURTZ","classification":"U","division":"CARRY OPTICS","hit_factor":5.7459},{"match_name":"MCRC USPSA March 2021","match_date":"2021-03-13","stage_classifiercode":"20-01","member_number":"A104252","first_name":"ROB","last_name":"TEAGUE","classification":"B","division":"CARRY OPTICS","hit_factor":5.7428},{"match_name":"Harvard Action Shooters May 2021 USPSA Pistol Match","match_date":"2021-05-02","stage_classifiercode":"20-01","member_number":"A116218","first_name":"NAN","last_name":"ZHANG","classification":"B","division":"CARRY OPTICS","hit_factor":5.7386},{"match_name":"OREGON ARPC CC05 USPSA NOVEMBER 14 2020","match_date":"2020-11-14","stage_classifiercode":"20-01","member_number":"A121597","first_name":"JOSHUA","last_name":"RAVENCRAFT","classification":"B","division":"CARRY OPTICS","hit_factor":5.7369},{"match_name":"RPS January 2021 USPSA Match","match_date":"2021-01-09","stage_classifiercode":"20-01","member_number":"A127992","first_name":"JARROD","last_name":"HILL","classification":"B","division":"CARRY OPTICS","hit_factor":5.7366},{"match_name":"LdF USPSA Match November 7 2021","match_date":"2021-11-07","stage_classifiercode":"20-01","member_number":"TY95319","first_name":"JEREMIAH","last_name":"GROSS","classification":"U","division":"CARRY OPTICS","hit_factor":5.7332},{"match_name":"CCPS July 2021 USPSA","match_date":"2021-07-04","stage_classifiercode":"20-01","member_number":"TY127965","first_name":"AUSTIN","last_name":"DEJEAN","classification":"B","division":"CARRY OPTICS","hit_factor":5.7318},{"match_name":"FBURG September 2021 USPSA","match_date":"2021-09-05","stage_classifiercode":"20-01","member_number":"A133203","first_name":"RYAN","last_name":"GEHO","classification":"B","division":"CARRY OPTICS","hit_factor":5.7279},{"match_name":"FBURG September 2021 USPSA","match_date":"2021-09-05","stage_classifiercode":"20-01","member_number":"A69761","first_name":"GABBY","last_name":"FRANCO","classification":"B","division":"CARRY OPTICS","hit_factor":5.7279},{"match_name":"Payson Practical Shooters USPSA Dec 5  2020","match_date":"2020-12-05","stage_classifiercode":"20-01","member_number":"ty80124","first_name":"MATT","last_name":"MISINO","classification":"A","division":"CARRY OPTICS","hit_factor":5.7279},{"match_name":"TPS USPSA at CMP Dec 19 2020 Special Classifier Match","match_date":"2020-12-19","stage_classifiercode":"20-01","member_number":"A127747","first_name":"ALEXANDER DENNY","last_name":"ACENAN","classification":"C","division":"CARRY OPTICS","hit_factor":5.7274},{"match_name":"TPS USPSA at CMP Dec 19 2020 Special Classifier Match","match_date":"2020-12-19","stage_classifiercode":"20-01","member_number":"A117180","first_name":"ZACHARY","last_name":"BUNCH","classification":"U","division":"CARRY OPTICS","hit_factor":5.7274},{"match_name":"Collin County USPSA  08-22-2021","match_date":"2021-08-22","stage_classifiercode":"20-01","member_number":"A107865","first_name":"DEVIN","last_name":"BOWEN","classification":"U","division":"CARRY OPTICS","hit_factor":5.726},{"match_name":"Sharp Practical Shooters September USPSA - Outdoor Classifier Match","match_date":"2021-09-25","stage_classifiercode":"20-01","member_number":"A133697","first_name":"RAMIL","last_name":"SACPOPO","classification":"B","division":"CARRY OPTICS","hit_factor":5.7256},{"match_name":"Southern Kentucky Gun Club USPSA April Match","match_date":"2021-04-25","stage_classifiercode":"20-01","member_number":"A121160","first_name":"JOE","last_name":"EAMES","classification":"U","division":"CARRY OPTICS","hit_factor":5.7256},{"match_name":"YMM  IPSC02 2021_01_10","match_date":"2021-01-10","stage_classifiercode":"20-01","member_number":"A125201","first_name":"MONTE","last_name":"SELLARDS","classification":"B","division":"CARRY OPTICS","hit_factor":5.7211},{"match_name":"Nampa USPSA December 5th 2020","match_date":"2020-12-05","stage_classifiercode":"20-01","member_number":"TY37136","first_name":"JOHN","last_name":"PLATT","classification":"B","division":"CARRY OPTICS","hit_factor":5.7206},{"match_name":"MCPSL Pistol 1-9-2021","match_date":"2021-01-09","stage_classifiercode":"20-01","member_number":"A127837","first_name":"BLAKE","last_name":"ROLAND","classification":"B","division":"CARRY OPTICS","hit_factor":5.7201},{"match_name":"NW01 T-Day 2020","match_date":"2020-11-08","stage_classifiercode":"20-01","member_number":"TY13332","first_name":"MICHAEL","last_name":"GALANTI","classification":"B","division":"CARRY OPTICS","hit_factor":5.7199},{"match_name":"FAS Sunday Outdoor USPSA Match","match_date":"2021-05-02","stage_classifiercode":"20-01","member_number":"TY112345","first_name":"ZACHARY","last_name":"MCLAUGHLIN","classification":"G","division":"CARRY OPTICS","hit_factor":5.7143},{"match_name":"Richmond Hot Shots Aug 14-15-2021 USPSA","match_date":"2021-08-14","stage_classifiercode":"20-01","member_number":"TY128813","first_name":"RYAN","last_name":"GODWIN","classification":"B","division":"CARRY OPTICS","hit_factor":5.7143},{"match_name":"Tehama Shooters November 2020 USPSA","match_date":"2020-11-28","stage_classifiercode":"20-01","member_number":"A121276","first_name":"PAUL","last_name":"DAVIS","classification":"C","division":"CARRY OPTICS","hit_factor":5.7143},{"match_name":"ACPSA November 2020","match_date":"2020-11-28","stage_classifiercode":"20-01","member_number":"A92232","first_name":"DARREN","last_name":"CRIBBS","classification":"B","division":"CARRY OPTICS","hit_factor":5.7143},{"match_name":"WSPS MARCH 2021 USPSA","match_date":"2021-03-20","stage_classifiercode":"20-01","member_number":"A121984","first_name":"JACK","last_name":"WALLACE","classification":"C","division":"CARRY OPTICS","hit_factor":5.7143},{"match_name":"CTASA - 3rd Sunday USPSA at Triple C Range - 12-20-2020","match_date":"2020-12-20","stage_classifiercode":"20-01","member_number":"A122236","first_name":"BRENT","last_name":"MAYORGA","classification":"U","division":"CARRY OPTICS","hit_factor":5.7085},{"match_name":"FBURG September 2021 USPSA","match_date":"2021-09-05","stage_classifiercode":"20-01","member_number":"A130870","first_name":"TAO","last_name":"MENG","classification":"B","division":"CARRY OPTICS","hit_factor":5.7078},{"match_name":"2020-12-05 USPSA  at Phoenix Rod and Gun Club","match_date":"2020-12-05","stage_classifiercode":"20-01","member_number":"TY93834","first_name":"THOMAS","last_name":"SMITH","classification":"C","division":"CARRY OPTICS","hit_factor":5.703},{"match_name":"SFA USPSA JANUARY 16 2021 MATCH","match_date":"2021-01-16","stage_classifiercode":"20-01","member_number":"A87496","first_name":"BOBBY","last_name":"KOLVET","classification":"A","division":"CARRY OPTICS","hit_factor":5.6968},{"match_name":"OREGON ARPC CC05 USPSA OCT 9 2021","match_date":"2021-10-09","stage_classifiercode":"20-01","member_number":"A61446","first_name":"KEN","last_name":"FLOOD","classification":"U","division":"CARRY OPTICS","hit_factor":5.6962},{"match_name":"FBURG September 2021 USPSA","match_date":"2021-09-05","stage_classifiercode":"20-01","member_number":"A136524","first_name":"DANIEL","last_name":"RHODES","classification":"U","division":"CARRY OPTICS","hit_factor":5.694},{"match_name":"Cameo USPSA Match November 21 2020","match_date":"2020-11-21","stage_classifiercode":"20-01","member_number":"A80976","first_name":"DAVID","last_name":"HILL","classification":"A","division":"CARRY OPTICS","hit_factor":5.6863},{"match_name":"LCSC Linden USPSA 122720","match_date":"2020-12-27","stage_classifiercode":"20-01","member_number":"TY112305","first_name":"DANIEL","last_name":"CARVO","classification":"A","division":"CARRY OPTICS","hit_factor":5.6853},{"match_name":"ENPS September 2021 USPSA Match","match_date":"2021-09-04","stage_classifiercode":"20-01","member_number":"A96710","first_name":"ZACHARY","last_name":"BRODER","classification":"B","division":"CARRY OPTICS","hit_factor":5.6842},{"match_name":"Ontelaunee USPSA November 2020","match_date":"2020-11-20","stage_classifiercode":"20-01","member_number":"A82490","first_name":"THOMAS","last_name":"NGUYEN","classification":"B","division":"CARRY OPTICS","hit_factor":5.6807},{"match_name":"Ontelaunee USPSA November 2020","match_date":"2020-11-20","stage_classifiercode":"20-01","member_number":"A118310","first_name":"JOHN","last_name":"NICE","classification":"U","division":"CARRY OPTICS","hit_factor":5.6738},{"match_name":"TPS USPSA -  January Match 2021 Rescheduled","match_date":"2021-01-03","stage_classifiercode":"20-01","member_number":"A72424","first_name":"WOUTER","last_name":"BADENHORST","classification":"B","division":"CARRY OPTICS","hit_factor":5.6711},{"match_name":"FBURG September 2021 USPSA","match_date":"2021-09-05","stage_classifiercode":"20-01","member_number":"A89090","first_name":"BOBBY","last_name":"YI","classification":"B","division":"CARRY OPTICS","hit_factor":5.6707},{"match_name":"LPRGC- Lower Providence USPSA Nov 2020 Match","match_date":"2020-11-07","stage_classifiercode":"20-01","member_number":"L1158","first_name":"JIM","last_name":"HAND","classification":"A","division":"CARRY OPTICS","hit_factor":5.668},{"match_name":"Nampa USPSA December 5th 2020","match_date":"2020-12-05","stage_classifiercode":"20-01","member_number":"a75553","first_name":"MARK","last_name":"WEAVER","classification":"A","division":"CARRY OPTICS","hit_factor":5.6641},{"match_name":"MAPSA 5/8/21","match_date":"2021-05-08","stage_classifiercode":"20-01","member_number":"A116283","first_name":"TIM","last_name":"DUNDERI","classification":"G","division":"CARRY OPTICS","hit_factor":5.6623},{"match_name":"Shadow Hawk Defense USPSA - Sep Sat","match_date":"2021-09-11","stage_classifiercode":"20-01","member_number":"Ty74344","first_name":"LANCE","last_name":"DEHLER","classification":"M","division":"CARRY OPTICS","hit_factor":5.6604},{"match_name":"SFPS 5-16-21 Super Classifier","match_date":"2021-05-16","stage_classifiercode":"20-01","member_number":"A91120","first_name":"JASON","last_name":"BENNETT","classification":"U","division":"CARRY OPTICS","hit_factor":5.6583},{"match_name":"SCPS ECO19 January 23rd 2021","match_date":"2021-01-22","stage_classifiercode":"20-01","member_number":"A107763","first_name":"TIM","last_name":"GATES","classification":"A","division":"CARRY OPTICS","hit_factor":5.6583},{"match_name":"Medford USPSA Oct 2021 Match","match_date":"2021-10-17","stage_classifiercode":"20-01","member_number":"A130369","first_name":"JOSEPH","last_name":"STUART","classification":"B","division":"CARRY OPTICS","hit_factor":5.6485},{"match_name":"OREGON ARPC CC05 USPSA OCT 9 2021","match_date":"2021-10-09","stage_classifiercode":"20-01","member_number":"TY98685","first_name":"ROB","last_name":"COATES","classification":"B","division":"CARRY OPTICS","hit_factor":5.646},{"match_name":"SFPS 5-16-21 Super Classifier","match_date":"2021-05-16","stage_classifiercode":"20-01","member_number":"A110229","first_name":"ANDREW","last_name":"HIPWELL","classification":"C","division":"CARRY OPTICS","hit_factor":5.6404},{"match_name":"Oh Shoot -PRG Nov 27th - Uspsa Classifier Match","match_date":"2021-11-27","stage_classifiercode":"20-01","member_number":"A113147","first_name":"JAMES","last_name":"CARDENAS","classification":"C","division":"CARRY OPTICS","hit_factor":5.6395},{"match_name":"USPSA Strategic Edge SEGR May 15th 2021","match_date":"2021-05-15","stage_classifiercode":"20-01","member_number":"A106869","first_name":"JOSEPH","last_name":"POTTER","classification":"M","division":"CARRY OPTICS","hit_factor":5.6395},{"match_name":"Chillicothe Sportsmens Club November USPSA","match_date":"2020-11-21","stage_classifiercode":"20-01","member_number":"TY77453","first_name":"JOEL","last_name":"GUSTAFSON","classification":"B","division":"CARRY OPTICS","hit_factor":5.6309},{"match_name":"ACPSA November 2020","match_date":"2020-11-28","stage_classifiercode":"20-01","member_number":"TY99020","first_name":"BILL","last_name":"GOGA","classification":"B","division":"CARRY OPTICS","hit_factor":5.6309},{"match_name":"NW01 T-Day 2020","match_date":"2020-11-08","stage_classifiercode":"20-01","member_number":"L1770","first_name":"BOB","last_name":"LOO","classification":"B","division":"CARRY OPTICS","hit_factor":5.6281},{"match_name":"Richmond Hot Shots Aug 14-15-2021 USPSA","match_date":"2021-08-14","stage_classifiercode":"20-01","member_number":"A124572","first_name":"ERWIN","last_name":"REYES","classification":"B","division":"CARRY OPTICS","hit_factor":5.6281},{"match_name":"2020-12-05 USPSA  at Phoenix Rod and Gun Club","match_date":"2020-12-05","stage_classifiercode":"20-01","member_number":"A116589","first_name":"SERGIO","last_name":"LOPEZ","classification":"U","division":"CARRY OPTICS","hit_factor":5.6277},{"match_name":"Shadow Hawk Defense USPSA - Sep Sat","match_date":"2021-09-11","stage_classifiercode":"20-01","member_number":"A89090","first_name":"BOBBY","last_name":"YI - PM","classification":"B","division":"CARRY OPTICS","hit_factor":5.6243},{"match_name":"NISA August 2021","match_date":"2021-08-22","stage_classifiercode":"20-01","member_number":"A125845","first_name":"MIKE","last_name":"SHIROBOKOV","classification":"B","division":"CARRY OPTICS","hit_factor":5.618},{"match_name":"RBGC USPSA 2021-01-23","match_date":"2021-01-23","stage_classifiercode":"20-01","member_number":"A105781","first_name":"JONATHAN","last_name":"MCLEOD","classification":"M","division":"CARRY OPTICS","hit_factor":5.6156},{"match_name":"Cactus USPSA ALL CLASSIFIER January 2021","match_date":"2021-01-03","stage_classifiercode":"20-01","member_number":"A114041","first_name":"WAYNE","last_name":"BAKER","classification":"C","division":"CARRY OPTICS","hit_factor":5.6156},{"match_name":"CFRPC USPSA 2021-11-14","match_date":"2021-11-14","stage_classifiercode":"20-01","member_number":"A136216","first_name":"CHASE","last_name":"XU","classification":"U","division":"CARRY OPTICS","hit_factor":5.6127},{"match_name":"Glacier Practical Shooters Special Classifier Match 05/01/2021","match_date":"2021-05-01","stage_classifiercode":"20-01","member_number":"A107334","first_name":"KATHERINE","last_name":"LICENCE","classification":"U","division":"CARRY OPTICS","hit_factor":5.6093},{"match_name":"QPS Quantico Shooting Club December USPSA   ","match_date":"2020-12-12","stage_classifiercode":"20-01","member_number":"A114066","first_name":"SAMUEL","last_name":"LORINO","classification":"U","division":"CARRY OPTICS","hit_factor":5.6088},{"match_name":"Dundee Practical Shooters - Feb 27 2021","match_date":"2021-02-27","stage_classifiercode":"20-01","member_number":"A94833","first_name":"DENNIS","last_name":"TEGTMEYER","classification":"B","division":"CARRY OPTICS","hit_factor":5.6075},{"match_name":"USPSA Strategic Edge SEGR May 15th 2021","match_date":"2021-05-15","stage_classifiercode":"20-01","member_number":"TY82182","first_name":"NORMA","last_name":"LEGADOS","classification":"A","division":"CARRY OPTICS","hit_factor":5.6075},{"match_name":"ARPC USPSA Match 4-25-21","match_date":"2021-04-25","stage_classifiercode":"20-01","member_number":"A123011","first_name":"NICHOLAS","last_name":"BERGEN","classification":"B","division":"CARRY OPTICS","hit_factor":5.6054},{"match_name":"SRSC USPSA 3-28-21 Superclassifier","match_date":"2021-03-28","stage_classifiercode":"20-01","member_number":"A117144","first_name":"MICHAEL","last_name":"HERBST","classification":"U","division":"CARRY OPTICS","hit_factor":5.6039},{"match_name":"GRB USPSA JANUARY 2021 AT CAVALIER","match_date":"2021-01-16","stage_classifiercode":"20-01","member_number":"A66693","first_name":"MICHAEL","last_name":"BUTCH","classification":"C","division":"CARRY OPTICS","hit_factor":5.5991},{"match_name":"OK06-30OCT21-SCRP-USPSA","match_date":"2021-10-30","stage_classifiercode":"20-01","member_number":"A125922","first_name":"BRENTON","last_name":"SWIFT","classification":"B","division":"CARRY OPTICS","hit_factor":5.5918},{"match_name":"SPSA USPSA January 1st Sat Match","match_date":"2021-01-02","stage_classifiercode":"20-01","member_number":"A104252","first_name":"ROB","last_name":"TEAGUE","classification":"B","division":"CARRY OPTICS","hit_factor":5.5893},{"match_name":"NISA August 2021","match_date":"2021-08-22","stage_classifiercode":"20-01","member_number":"A126723","first_name":"JOSH","last_name":"ODONER","classification":"B","division":"CARRY OPTICS","hit_factor":5.5879},{"match_name":"Pioneer Action Shooters USPSA 11-15-20","match_date":"2020-11-15","stage_classifiercode":"20-01","member_number":"TY101333","first_name":"UDO","last_name":"SCHNEIDER","classification":"C","division":"CARRY OPTICS","hit_factor":5.5877},{"match_name":"Bass River USPSA May 2021","match_date":"2021-05-02","stage_classifiercode":"20-01","member_number":"A118472","first_name":"AARON","last_name":"HARTNETT","classification":"U","division":"CARRY OPTICS","hit_factor":5.5866},{"match_name":"Pioneer Action Shooters USPSA 11-15-20","match_date":"2020-11-15","stage_classifiercode":"20-01","member_number":"A123158","first_name":"SEAN","last_name":"WILBUR","classification":"B","division":"CARRY OPTICS","hit_factor":5.5843},{"match_name":"Richmond Hot Shots Aug 14-15-2021 USPSA","match_date":"2021-08-14","stage_classifiercode":"20-01","member_number":"TY88874","first_name":"JOHN","last_name":"BREGLIA","classification":"B","division":"CARRY OPTICS","hit_factor":5.5794},{"match_name":"Vortex Edge USPSA October 2021","match_date":"2021-10-09","stage_classifiercode":"20-01","member_number":"A107673","first_name":"DANE","last_name":"NIELSEN","classification":"B","division":"CARRY OPTICS","hit_factor":5.5762},{"match_name":"USPSA Strategic Edge SEGR May 15th 2021","match_date":"2021-05-15","stage_classifiercode":"20-01","member_number":"ty119475","first_name":"PHILIP","last_name":"GIANNONE","classification":"A","division":"CARRY OPTICS","hit_factor":5.5721},{"match_name":"NISA August 2021","match_date":"2021-08-22","stage_classifiercode":"20-01","member_number":"TY114794","first_name":"KEVIN","last_name":"PURVES","classification":"C","division":"CARRY OPTICS","hit_factor":5.571},{"match_name":"Extreme GM uspsa Nov-13","match_date":"2021-11-13","stage_classifiercode":"20-01","member_number":"A123620","first_name":"MIKE","last_name":"COOK","classification":"U","division":"CARRY OPTICS","hit_factor":5.571},{"match_name":"Shasta Shooters 2021 June","match_date":"2021-06-12","stage_classifiercode":"20-01","member_number":"TY98589","first_name":"CASEY","last_name":"CANCILLA","classification":"B","division":"CARRY OPTICS","hit_factor":5.571},{"match_name":"SWGC USPSA Pistol Match - May 2021","match_date":"2021-05-01","stage_classifiercode":"20-01","member_number":"A63664","first_name":"STEVE","last_name":"WILLIAMS","classification":"B","division":"CARRY OPTICS","hit_factor":5.5675},{"match_name":"SCPS ECO19 January 23rd 2021","match_date":"2021-01-22","stage_classifiercode":"20-01","member_number":"A108323","first_name":"RILEY","last_name":"BOWMAN","classification":"A","division":"CARRY OPTICS","hit_factor":5.5627},{"match_name":"NW01 T-Day 2020","match_date":"2020-11-08","stage_classifiercode":"20-01","member_number":"A114180","first_name":"OWEN","last_name":"YEASTING","classification":"M","division":"CARRY OPTICS","hit_factor":5.5613},{"match_name":"Ontelaunee USPSA November 2020","match_date":"2020-11-20","stage_classifiercode":"20-01","member_number":"A88050","first_name":"PATRICK","last_name":"MCKERNAN","classification":"B","division":"CARRY OPTICS","hit_factor":5.5613},{"match_name":"Richmond Hot Shots Aug 14-15-2021 USPSA","match_date":"2021-08-14","stage_classifiercode":"20-01","member_number":"TY71640","first_name":"JAMES","last_name":"YEOM","classification":"A","division":"CARRY OPTICS","hit_factor":5.5556},{"match_name":"ACPSA November 2020","match_date":"2020-11-28","stage_classifiercode":"20-01","member_number":"FY92025","first_name":"MATT","last_name":"MORRISON","classification":"A","division":"CARRY OPTICS","hit_factor":5.5556},{"match_name":"APSC USPSA 08-21-21","match_date":"2021-08-21","stage_classifiercode":"20-01","member_number":"L3082","first_name":"ROY","last_name":"STEDMAN","classification":"M","division":"CARRY OPTICS","hit_factor":5.5556},{"match_name":"DSSA 2021-02 USPSA Pistol","match_date":"2021-02-28","stage_classifiercode":"20-01","member_number":"A65429","first_name":"KEN","last_name":"CORNWELL","classification":"B","division":"CARRY OPTICS","hit_factor":5.5556},{"match_name":"Mesilla Valley P September 2021 classifier match","match_date":"2021-09-04","stage_classifiercode":"20-01","member_number":"TY44808","first_name":"WILLIAM","last_name":"MILLER","classification":"A","division":"CARRY OPTICS","hit_factor":5.5504},{"match_name":"November All-Classifier USPSA Match at C and C Indoor Range","match_date":"2020-11-17","stage_classifiercode":"20-01","member_number":"A116600","first_name":"TIM","last_name":"OWEN","classification":"A","division":"CARRY OPTICS","hit_factor":5.5491},{"match_name":"MRPC OHS02 06272021","match_date":"2021-06-27","stage_classifiercode":"20-01","member_number":"A125761","first_name":"ANTONIO","last_name":"SANTIAGO","classification":"C","division":"CARRY OPTICS","hit_factor":5.5453},{"match_name":"SCPS ECO19 January 23rd 2021","match_date":"2021-01-22","stage_classifiercode":"20-01","member_number":"A100974","first_name":"JAMES","last_name":"LUTTER","classification":"B","division":"CARRY OPTICS","hit_factor":5.5446},{"match_name":"Collin County USPSA  08-22-2021","match_date":"2021-08-22","stage_classifiercode":"20-01","member_number":"A111753","first_name":"EKO","last_name":"ONG","classification":"B","division":"CARRY OPTICS","hit_factor":5.5441},{"match_name":"Wallis Orchard Practical Shooters April 2021 Club Match","match_date":"2021-04-18","stage_classifiercode":"20-01","member_number":"A103016","first_name":"ROBERT","last_name":"BUI","classification":"C","division":"CARRY OPTICS","hit_factor":5.5441},{"match_name":"FBURG September 2021 USPSA","match_date":"2021-09-05","stage_classifiercode":"20-01","member_number":"A136079","first_name":"NICK","last_name":"BOREK","classification":"B","division":"CARRY OPTICS","hit_factor":5.5437},{"match_name":"Ontelaunee USPSA November 2020","match_date":"2020-11-20","stage_classifiercode":"20-01","member_number":"A110843","first_name":"CHRIS","last_name":"HAHN","classification":"B","division":"CARRY OPTICS","hit_factor":5.5427},{"match_name":"Richmond Hot Shots Aug 14-15-2021 USPSA","match_date":"2021-08-14","stage_classifiercode":"20-01","member_number":"A99211","first_name":"JOSH","last_name":"FELDMAN","classification":"M","division":"CARRY OPTICS","hit_factor":5.5422},{"match_name":"2020-12-05 USPSA  at Phoenix Rod and Gun Club","match_date":"2020-12-05","stage_classifiercode":"20-01","member_number":"TY118967","first_name":"ZACH","last_name":"STEWART","classification":"M","division":"CARRY OPTICS","hit_factor":5.5391},{"match_name":"FBURG September 2021 USPSA","match_date":"2021-09-05","stage_classifiercode":"20-01","member_number":"TY126613","first_name":"YANG","last_name":"WU","classification":"B","division":"CARRY OPTICS","hit_factor":5.5378},{"match_name":"Hallstead USPSA April 24 match","match_date":"2021-04-24","stage_classifiercode":"20-01","member_number":"A95285","first_name":"DAVID","last_name":"PHILLIPS","classification":"M","division":"CARRY OPTICS","hit_factor":5.5371},{"match_name":"GCL Saturday 4-3-2021","match_date":"2021-04-03","stage_classifiercode":"20-01","member_number":"A58687","first_name":"ROBERT","last_name":"HILFIKER","classification":"A","division":"CARRY OPTICS","hit_factor":5.5363},{"match_name":"Nampa USPSA September 10th 2021 Classifier Match","match_date":"2021-09-10","stage_classifiercode":"20-01","member_number":"TY37136","first_name":"JOHN","last_name":"PLATT","classification":"B","division":"CARRY OPTICS","hit_factor":5.5351},{"match_name":"17s PSC - USPSA - January 2021","match_date":"2021-01-16","stage_classifiercode":"20-01","member_number":"A128451","first_name":"CHRIS","last_name":"MCNEIL","classification":"U","division":"CARRY OPTICS","hit_factor":5.5336},{"match_name":"Harvard Action Shooters May 2021 USPSA Pistol Match","match_date":"2021-05-02","stage_classifiercode":"20-01","member_number":"TY104477","first_name":"BRENDEN","last_name":"LAU","classification":"U","division":"CARRY OPTICS","hit_factor":5.5336},{"match_name":"Hampden RPC November USPSA Match","match_date":"2020-11-08","stage_classifiercode":"20-01","member_number":"A118203","first_name":"KEITH","last_name":"ALBEE","classification":"C","division":"CARRY OPTICS","hit_factor":5.5336},{"match_name":"TTS USPSA Match 12JUN2021","match_date":"2021-06-12","stage_classifiercode":"20-01","member_number":"A132627","first_name":"RALF","last_name":"MIGS","classification":"U","division":"CARRY OPTICS","hit_factor":5.5328},{"match_name":"MCAS MAY 2021 USPSA","match_date":"2021-05-15","stage_classifiercode":"20-01","member_number":"A90239","first_name":"KYNAN","last_name":"SUTTER","classification":"B","division":"CARRY OPTICS","hit_factor":5.53},{"match_name":"GAS MAY 2021 USPSA","match_date":"2021-05-01","stage_classifiercode":"20-01","member_number":"TY13940","first_name":"MAC","last_name":"CLARK","classification":"B","division":"CARRY OPTICS","hit_factor":5.5291},{"match_name":"Richmond Boro Gun Club Monthly USPSA Match May 2021","match_date":"2021-05-08","stage_classifiercode":"20-01","member_number":"FY92927","first_name":"ANTHONY","last_name":"MAINOLFI","classification":"B","division":"CARRY OPTICS","hit_factor":5.5281},{"match_name":"Ontelaunee USPSA November 2020","match_date":"2020-11-20","stage_classifiercode":"20-01","member_number":"TY113265","first_name":"STEVE","last_name":"BIRD","classification":"B","division":"CARRY OPTICS","hit_factor":5.526},{"match_name":"APSC USPSA 11-7-20","match_date":"2020-11-07","stage_classifiercode":"20-01","member_number":"A124680","first_name":"KRISTOPHER","last_name":"BOLLETER","classification":"B","division":"CARRY OPTICS","hit_factor":5.5215},{"match_name":"TTS USPSA Match 12JUN2021","match_date":"2021-06-12","stage_classifiercode":"20-01","member_number":"L4670","first_name":"ROMAN","last_name":"GWISCZ","classification":"A","division":"CARRY OPTICS","hit_factor":5.5215},{"match_name":"NW01 T-Day 2020","match_date":"2020-11-08","stage_classifiercode":"20-01","member_number":"A128950","first_name":"CHRIS","last_name":"RIES","classification":"B","division":"CARRY OPTICS","hit_factor":5.5198},{"match_name":"Harvard Action Shooters May 2021 USPSA Pistol Match","match_date":"2021-05-02","stage_classifiercode":"20-01","member_number":"TY52759","first_name":"IRA","last_name":"GROSSMAN","classification":"B","division":"CARRY OPTICS","hit_factor":5.5186},{"match_name":"Shadow Hawk Defense USPSA - Sep Sat","match_date":"2021-09-11","stage_classifiercode":"20-01","member_number":"TY77488","first_name":"OLEG","last_name":"SHEIN","classification":"U","division":"CARRY OPTICS","hit_factor":5.5158},{"match_name":"Triforce Practical Shooters at Big Woods Goods 03-25-2021","match_date":"2021-03-25","stage_classifiercode":"20-01","member_number":"TY80332","first_name":"REVO","last_name":"MANN","classification":"X","division":"CARRY OPTICS","hit_factor":5.5147},{"match_name":"Harvard Action Shooters May 2021 USPSA Pistol Match","match_date":"2021-05-02","stage_classifiercode":"20-01","member_number":"A123119","first_name":"ZACHARY","last_name":"LEE","classification":"U","division":"CARRY OPTICS","hit_factor":5.5143},{"match_name":"LIPSA  - March  21st  2021 - March Madness USPSA Match ","match_date":"2021-03-21","stage_classifiercode":"20-01","member_number":"TY87868","first_name":"JAMES","last_name":"HENKE","classification":"C","division":"CARRY OPTICS","hit_factor":5.5143},{"match_name":"LdF USPSA Classifier Match December 12 2020","match_date":"2020-12-12","stage_classifiercode":"20-01","member_number":"L2797","first_name":"DAVID","last_name":"EN","classification":"A","division":"CARRY OPTICS","hit_factor":5.5064},{"match_name":"EHPSA USPSA 26 September 2021","match_date":"2021-09-26","stage_classifiercode":"20-01","member_number":"A134934","first_name":"DREW","last_name":"MARUSKI","classification":"A","division":"CARRY OPTICS","hit_factor":5.506},{"match_name":"LdF USPSA Classifier Match December 12 2020","match_date":"2020-12-12","stage_classifiercode":"20-01","member_number":"L2797","first_name":"DAVID","last_name":"EN","classification":"A","division":"CARRY OPTICS","hit_factor":5.5026},{"match_name":"Richmond Hot Shots Aug 14-15-2021 USPSA","match_date":"2021-08-14","stage_classifiercode":"20-01","member_number":"A131941","first_name":"KEN","last_name":"MEJICA","classification":"C","division":"CARRY OPTICS","hit_factor":5.501},{"match_name":"SPSA USPSA January 1st Sat Match","match_date":"2021-01-02","stage_classifiercode":"20-01","member_number":"A84265","first_name":"ROD","last_name":"GOFORTH","classification":"B","division":"CARRY OPTICS","hit_factor":5.5006},{"match_name":"Oh Shoot -PRG Nov 27th - Uspsa Classifier Match","match_date":"2021-11-27","stage_classifiercode":"20-01","member_number":"TY87479","first_name":"KRIS","last_name":"HEAD","classification":"C","division":"CARRY OPTICS","hit_factor":5.4983},{"match_name":"Dundee Practical Shooters - Feb 27 2021","match_date":"2021-02-27","stage_classifiercode":"20-01","member_number":"Ty85533","first_name":"DARRIN","last_name":"BOWERS","classification":"B","division":"CARRY OPTICS","hit_factor":5.4983},{"match_name":"RBGC USPSA 2021-8-15 Special Classifier Match","match_date":"2021-08-15","stage_classifiercode":"20-01","member_number":"A53630","first_name":"ARTHUR","last_name":"BROWN","classification":"C","division":"CARRY OPTICS","hit_factor":5.4934},{"match_name":"RBGC USPSA 2021-01-23","match_date":"2021-01-23","stage_classifiercode":"20-01","member_number":"TY117499","first_name":"SCOTT","last_name":"FANN","classification":"B","division":"CARRY OPTICS","hit_factor":5.4931},{"match_name":"Medford USPSA March 2021 OR-04","match_date":"2021-03-21","stage_classifiercode":"20-01","member_number":"A118064","first_name":"MIKE","last_name":"MCMULLEN","classification":"B","division":"CARRY OPTICS","hit_factor":5.491},{"match_name":"LIPSA  - March  21st  2021 - March Madness USPSA Match ","match_date":"2021-03-21","stage_classifiercode":"20-01","member_number":"TY120855","first_name":"TOMASZ","last_name":"SANCZENKO","classification":"B","division":"CARRY OPTICS","hit_factor":5.4872},{"match_name":"RBGC USPSA 2021-01-23","match_date":"2021-01-23","stage_classifiercode":"20-01","member_number":"A120293","first_name":"ALEXANDRU","last_name":"DAVIDOVICI","classification":"B","division":"CARRY OPTICS","hit_factor":5.4863},{"match_name":"RPS January 2021 USPSA Match","match_date":"2021-01-09","stage_classifiercode":"20-01","member_number":"A115221","first_name":"PATRICK","last_name":"MANERS","classification":"A","division":"CARRY OPTICS","hit_factor":5.4815},{"match_name":"CAS March 2021","match_date":"2021-03-07","stage_classifiercode":"20-01","member_number":"A121987","first_name":"GLENN","last_name":"ROBICHAUX","classification":"B","division":"CARRY OPTICS","hit_factor":5.4795},{"match_name":"Vortex Edge USPSA October 2021","match_date":"2021-10-09","stage_classifiercode":"20-01","member_number":"A137414","first_name":"CORY","last_name":"NELSON","classification":"U","division":"CARRY OPTICS","hit_factor":5.4688},{"match_name":"FBURG September 2021 USPSA","match_date":"2021-09-05","stage_classifiercode":"20-01","member_number":"FY82370","first_name":"MARK","last_name":"ATTANASIO","classification":"B","division":"CARRY OPTICS","hit_factor":5.4665},{"match_name":"SPSA USPSA January 1st Sat Match","match_date":"2021-01-02","stage_classifiercode":"20-01","member_number":"TY88089","first_name":"DAVID","last_name":"BURTON","classification":"B","division":"CARRY OPTICS","hit_factor":5.4665},{"match_name":"Pioneer Action Shooters USPSA 11-15-20","match_date":"2020-11-15","stage_classifiercode":"20-01","member_number":"A130712","first_name":"LUTHER","last_name":"HYSLOP","classification":"B","division":"CARRY OPTICS","hit_factor":5.4645},{"match_name":"NW01 T-Day 2020","match_date":"2020-11-08","stage_classifiercode":"20-01","member_number":"A129753","first_name":"SAM","last_name":"NURIK","classification":"C","division":"CARRY OPTICS","hit_factor":5.4632},{"match_name":"SCAPSA MN05 SPRING 6","match_date":"2021-05-18","stage_classifiercode":"20-01","member_number":"A127959","first_name":"ROBERT","last_name":"GOETTL","classification":"C","division":"CARRY OPTICS","hit_factor":5.4622},{"match_name":"NHRPC - November 2021 USPSA","match_date":"2021-11-13","stage_classifiercode":"20-01","member_number":"A88050","first_name":"PATRICK","last_name":"MCKERNAN","classification":"B","division":"CARRY OPTICS","hit_factor":5.4601},{"match_name":"GAS MAY 2021 USPSA","match_date":"2021-05-01","stage_classifiercode":"20-01","member_number":"A90239","first_name":"KYNAN","last_name":"SUTTER","classification":"B","division":"CARRY OPTICS","hit_factor":5.4565},{"match_name":"EHPSA USPSA 26 September 2021","match_date":"2021-09-26","stage_classifiercode":"20-01","member_number":"TY126034","first_name":"SAM","last_name":"LITTLEFIELD","classification":"B","division":"CARRY OPTICS","hit_factor":5.4526},{"match_name":"Dundee Practical Shooters - Feb 27 2021","match_date":"2021-02-27","stage_classifiercode":"20-01","member_number":"A98852","first_name":"BRIAN","last_name":"SCHAFFER","classification":"B","division":"CARRY OPTICS","hit_factor":5.4511},{"match_name":"USPSA MO21 2Alpha SBRC December 26 2020","match_date":"2020-12-26","stage_classifiercode":"20-01","member_number":"A35986","first_name":"WEERAYUTH","last_name":"JUNEWEERANONG","classification":"M","division":"CARRY OPTICS","hit_factor":5.449},{"match_name":"RBGC USPSA 2021-8-15 Special Classifier Match","match_date":"2021-08-15","stage_classifiercode":"20-01","member_number":"A127747","first_name":"ALEXANDER DENNY","last_name":"ACENAN","classification":"A","division":"CARRY OPTICS","hit_factor":5.4484},{"match_name":"FBURG September 2021 USPSA","match_date":"2021-09-05","stage_classifiercode":"20-01","member_number":"A66693","first_name":"MICHAEL","last_name":"BUTCH","classification":"B","division":"CARRY OPTICS","hit_factor":5.4475},{"match_name":"QPS Quantico Shooting Club December USPSA   ","match_date":"2020-12-12","stage_classifiercode":"20-01","member_number":"TY113190","first_name":"BRENDEN","last_name":"FRISK(2)","classification":"C","division":"CARRY OPTICS","hit_factor":5.4475},{"match_name":"Hosemonster Action  ","match_date":"2021-01-17","stage_classifiercode":"20-01","member_number":"Ty106623","first_name":"DAVID","last_name":"BRADY","classification":"B","division":"CARRY OPTICS","hit_factor":5.446},{"match_name":"Payson Practical Shooters USPSA Dec 5  2020","match_date":"2020-12-05","stage_classifiercode":"20-01","member_number":"fy92648","first_name":"E.T.","last_name":"SAFFON","classification":"M","division":"CARRY OPTICS","hit_factor":5.4455},{"match_name":"MCRC USPSA March 2021","match_date":"2021-03-13","stage_classifiercode":"20-01","member_number":"A124378","first_name":"DAVID","last_name":"DUBOIS","classification":"U","division":"CARRY OPTICS","hit_factor":5.4435},{"match_name":"GCL Saturday 4-3-2021","match_date":"2021-04-03","stage_classifiercode":"20-01","member_number":"A107808","first_name":"CHRIS","last_name":"RANSON","classification":"U","division":"CARRY OPTICS","hit_factor":5.4393},{"match_name":"WTPS USPSA Match 12.12.2020","match_date":"2020-12-12","stage_classifiercode":"20-01","member_number":"A125823","first_name":"RYAN","last_name":"CREDLE","classification":"U","division":"CARRY OPTICS","hit_factor":5.4381},{"match_name":"Maine Practical Shooters May 2021","match_date":"2021-05-08","stage_classifiercode":"20-01","member_number":"TY104860","first_name":"SAUL","last_name":"ALLEN","classification":"M","division":"CARRY OPTICS","hit_factor":5.4374},{"match_name":"NW01 T-Day 2020","match_date":"2020-11-08","stage_classifiercode":"20-01","member_number":"A54938","first_name":"CEL","last_name":"ALVAREZ","classification":"D","division":"CARRY OPTICS","hit_factor":5.4348},{"match_name":"RBGC USPSA 2021-01-23","match_date":"2021-01-23","stage_classifiercode":"20-01","member_number":"A82592","first_name":"THOMAS","last_name":"KOH","classification":"M","division":"CARRY OPTICS","hit_factor":5.4321},{"match_name":"LPRGC- Lower Providence USPSA Nov 2020 Match","match_date":"2020-11-07","stage_classifiercode":"20-01","member_number":"A105600","first_name":"TOM","last_name":"PIPER","classification":"B","division":"CARRY OPTICS","hit_factor":5.4307},{"match_name":"RBGC USPSA 2021-8-15 Special Classifier Match","match_date":"2021-08-15","stage_classifiercode":"20-01","member_number":"A128215","first_name":"SCOTT","last_name":"HAUSWIRTH","classification":"B","division":"CARRY OPTICS","hit_factor":5.4289},{"match_name":"Wallis Orchard Practical Shooters April 2021 Club Match","match_date":"2021-04-18","stage_classifiercode":"20-01","member_number":"A72378","first_name":"CHEV","last_name":"JACOT","classification":"B","division":"CARRY OPTICS","hit_factor":5.4264},{"match_name":"Hallstead USPSA April 24 match","match_date":"2021-04-24","stage_classifiercode":"20-01","member_number":"A107808","first_name":"CHRIS","last_name":"RANSON","classification":"B","division":"CARRY OPTICS","hit_factor":5.4211},{"match_name":"BORCC USPSA April 2021","match_date":"2021-04-17","stage_classifiercode":"20-01","member_number":"A125845","first_name":"MIKE","last_name":"SHIROBOKOV","classification":"B","division":"CARRY OPTICS","hit_factor":5.4181},{"match_name":"17s PSC - USPSA - January 2021","match_date":"2021-01-16","stage_classifiercode":"20-01","member_number":"TY75765","first_name":"DAVID","last_name":"WHITE","classification":"A","division":"CARRY OPTICS","hit_factor":5.4054},{"match_name":"Richmond Hot Shots Aug 14-15-2021 USPSA","match_date":"2021-08-14","stage_classifiercode":"20-01","member_number":"A99969","first_name":"KARL","last_name":"MACARAIG","classification":"B","division":"CARRY OPTICS","hit_factor":5.4054},{"match_name":"LNDL  RS","match_date":"2021-07-12","stage_classifiercode":"20-01","member_number":"FY70390","first_name":"MEGHAN","last_name":"SMILEY","classification":"U","division":"CARRY OPTICS","hit_factor":5.4054},{"match_name":"Medford USPSA March 2021 OR-04","match_date":"2021-03-21","stage_classifiercode":"20-01","member_number":"A130392","first_name":"LANCE","last_name":"MENOLD","classification":"U","division":"CARRY OPTICS","hit_factor":5.4054},{"match_name":"Homestead USPSA June Classifier Match 2021","match_date":"2021-06-20","stage_classifiercode":"20-01","member_number":"A106652","first_name":"MATTHEW","last_name":"GNAD","classification":"U","division":"CARRY OPTICS","hit_factor":5.4005},{"match_name":"PIPS 04-28-2021","match_date":"2021-04-27","stage_classifiercode":"20-01","member_number":"A107108","first_name":"CRAIG","last_name":"SCHMITT","classification":"B","division":"CARRY OPTICS","hit_factor":5.3998},{"match_name":"5 Dogs December USPSA 2020","match_date":"2020-12-06","stage_classifiercode":"20-01","member_number":"A119545","first_name":"RICHARD","last_name":"GUERZON","classification":"U","division":"CARRY OPTICS","hit_factor":5.3996},{"match_name":"NHRPC - November 2021 USPSA","match_date":"2021-11-13","stage_classifiercode":"20-01","member_number":"A105600","first_name":"TOM","last_name":"PIPER","classification":"B","division":"CARRY OPTICS","hit_factor":5.3937},{"match_name":"GCL Monthly USPSA Match Saturday 11-6-2021  INDOORS","match_date":"2021-11-06","stage_classifiercode":"20-01","member_number":"a96622","first_name":"LARRY","last_name":"STROLLO 2","classification":"B","division":"CARRY OPTICS","hit_factor":5.3886},{"match_name":"GAS MAY 2021 USPSA","match_date":"2021-05-01","stage_classifiercode":"20-01","member_number":"A43042","first_name":"DAN","last_name":"HASH","classification":"A","division":"CARRY OPTICS","hit_factor":5.3872},{"match_name":"NW01 T-Day 2020","match_date":"2020-11-08","stage_classifiercode":"20-01","member_number":"A130679","first_name":"SHAWN","last_name":"COLLINGE","classification":"U","division":"CARRY OPTICS","hit_factor":5.383},{"match_name":"Oh Shoot -PRG Nov 27th - Uspsa Classifier Match","match_date":"2021-11-27","stage_classifiercode":"20-01","member_number":"TY131641","first_name":"JAKE","last_name":"MONTES","classification":"C","division":"CARRY OPTICS","hit_factor":5.3821},{"match_name":"Harvard Action Shooters May 2021 USPSA Pistol Match","match_date":"2021-05-02","stage_classifiercode":"20-01","member_number":"TY73574","first_name":"MICHAEL","last_name":"LABOSSIERE","classification":"B","division":"CARRY OPTICS","hit_factor":5.3794},{"match_name":"MCRC USPSA March 2021","match_date":"2021-03-13","stage_classifiercode":"20-01","member_number":"A3853","first_name":"WILBERT","last_name":"SPRUELL","classification":"B","division":"CARRY OPTICS","hit_factor":5.3794},{"match_name":"Volusia County Gun and Hunt Club","match_date":"2020-11-21","stage_classifiercode":"20-01","member_number":"FY88426","first_name":"FRANCISCO","last_name":"ROMERO","classification":"B","division":"CARRY OPTICS","hit_factor":5.3794},{"match_name":"TPS USPSA At CMP July 17 2021","match_date":"2021-07-17","stage_classifiercode":"20-01","member_number":"TY119222","first_name":"CLARK","last_name":"DARLEY","classification":"C","division":"CARRY OPTICS","hit_factor":5.3794},{"match_name":"Oh Shoot -PRG Nov 27th - Uspsa Classifier Match","match_date":"2021-11-27","stage_classifiercode":"20-01","member_number":"A137333","first_name":"TERI","last_name":"HOCK","classification":"U","division":"CARRY OPTICS","hit_factor":5.3763},{"match_name":"TPS USPSA -  January Match 2021 Rescheduled","match_date":"2021-01-03","stage_classifiercode":"20-01","member_number":"A131947","first_name":"OLIVER","last_name":"LEONG","classification":"U","division":"CARRY OPTICS","hit_factor":5.3753},{"match_name":"MCPSL Pistol 1-9-2021","match_date":"2021-01-09","stage_classifiercode":"20-01","member_number":"A35986","first_name":"WEERAYUTH","last_name":"JUNEWEERANONG","classification":"M","division":"CARRY OPTICS","hit_factor":5.3731},{"match_name":"Chillicothe Sportsmens Club November USPSA","match_date":"2020-11-21","stage_classifiercode":"20-01","member_number":"A109815","first_name":"JASON","last_name":"BROUGHTON","classification":"M","division":"CARRY OPTICS","hit_factor":5.3706},{"match_name":"Vortex Edge USPSA October 2021","match_date":"2021-10-09","stage_classifiercode":"20-01","member_number":"TY106197","first_name":"DOUG","last_name":"ANDERSON","classification":"B","division":"CARRY OPTICS","hit_factor":5.3654},{"match_name":"Harvard Action Shooters May 2021 USPSA Pistol Match","match_date":"2021-05-02","stage_classifiercode":"20-01","member_number":"TY111935","first_name":"NIELS","last_name":"COSMAN","classification":"B","division":"CARRY OPTICS","hit_factor":5.3648},{"match_name":"TPS USPSA at CMP Dec 19 2020 Special Classifier Match","match_date":"2020-12-19","stage_classifiercode":"20-01","member_number":"A120007","first_name":"DIMA","last_name":"ULBERG","classification":"C","division":"CARRY OPTICS","hit_factor":5.364},{"match_name":"Hallstead USPSA April 24 match","match_date":"2021-04-24","stage_classifiercode":"20-01","member_number":"A120532","first_name":"MATTHEW","last_name":"HOGUE","classification":"B","division":"CARRY OPTICS","hit_factor":5.364},{"match_name":"2020-12-05 USPSA  at Phoenix Rod and Gun Club","match_date":"2020-12-05","stage_classifiercode":"20-01","member_number":"A127908","first_name":"GENNI","last_name":"STEWART","classification":"B","division":"CARRY OPTICS","hit_factor":5.364},{"match_name":"NISA August 2021","match_date":"2021-08-22","stage_classifiercode":"20-01","member_number":"A121327","first_name":"JEREMY","last_name":"WALKER","classification":"B","division":"CARRY OPTICS","hit_factor":5.3631},{"match_name":"Rankin Field February Saturday USPSA","match_date":"2021-02-06","stage_classifiercode":"20-01","member_number":"TY114590","first_name":"JEREMY","last_name":"ALBRIGHT","classification":"U","division":"CARRY OPTICS","hit_factor":5.3591},{"match_name":"CAS March 2021","match_date":"2021-03-07","stage_classifiercode":"20-01","member_number":"L4908","first_name":"CHAD","last_name":"GUILLOTTE","classification":"B","division":"CARRY OPTICS","hit_factor":5.3571},{"match_name":"QPS Quantico Shooting Club December USPSA   ","match_date":"2020-12-12","stage_classifiercode":"20-01","member_number":"A110976","first_name":"JOHN","last_name":"WEBB","classification":"C","division":"CARRY OPTICS","hit_factor":5.3537},{"match_name":"SFA USPSA JANUARY 16 2021 MATCH","match_date":"2021-01-16","stage_classifiercode":"20-01","member_number":"A118978","first_name":"DAN","last_name":"GLENN","classification":"B","division":"CARRY OPTICS","hit_factor":5.3537},{"match_name":"Richmond Hot Shots Aug 14-15-2021 USPSA","match_date":"2021-08-14","stage_classifiercode":"20-01","member_number":"TY87259","first_name":"YEE-MIN","last_name":"LIN","classification":"A","division":"CARRY OPTICS","hit_factor":5.3508},{"match_name":"DSSA 2021-02 USPSA Pistol","match_date":"2021-02-28","stage_classifiercode":"20-01","member_number":"TY126117","first_name":"DUSTIN","last_name":"BOBST","classification":"A","division":"CARRY OPTICS","hit_factor":5.3486},{"match_name":"Cowtown Pistol Club USPSA MONDAY November 1 2021","match_date":"2021-11-02","stage_classifiercode":"20-01","member_number":"A121050","first_name":"JUAN","last_name":"TOLEDO","classification":"B","division":"CARRY OPTICS","hit_factor":5.3476},{"match_name":"Matamoras USPSA September 2021","match_date":"2021-09-19","stage_classifiercode":"20-01","member_number":"TY57983","first_name":"JUN","last_name":"TIOZON","classification":"C","division":"CARRY OPTICS","hit_factor":5.3452},{"match_name":"LdF USPSA Classifier Match December 12 2020","match_date":"2020-12-12","stage_classifiercode":"20-01","member_number":"A102381","first_name":"MIKE","last_name":"MCNICOLL","classification":"C","division":"CARRY OPTICS","hit_factor":5.3443},{"match_name":"Shadow Hawk Defense USPSA - Sep Sat","match_date":"2021-09-11","stage_classifiercode":"20-01","member_number":"TY135382","first_name":"DAESUNG","last_name":"JI","classification":"B","division":"CARRY OPTICS","hit_factor":5.3428},{"match_name":"Chillicothe Sportsmens Club November USPSA","match_date":"2020-11-21","stage_classifiercode":"20-01","member_number":"A127768","first_name":"DAVE","last_name":"DEL ROSARIO","classification":"B","division":"CARRY OPTICS","hit_factor":5.3398},{"match_name":"Ontelaunee USPSA November 2020","match_date":"2020-11-20","stage_classifiercode":"20-01","member_number":"A108310","first_name":"ROSENDO","last_name":"DOMINGO","classification":"C","division":"CARRY OPTICS","hit_factor":5.3388},{"match_name":"RBGC USPSA 2021-8-15 Special Classifier Match","match_date":"2021-08-15","stage_classifiercode":"20-01","member_number":"A112835","first_name":"ERIC","last_name":"SURETTE","classification":"D","division":"CARRY OPTICS","hit_factor":5.3384},{"match_name":"RBGC USPSA 2021-01-23","match_date":"2021-01-23","stage_classifiercode":"20-01","member_number":"TY94807","first_name":"JAMES MAVERICK","last_name":"GARNER","classification":"B","division":"CARRY OPTICS","hit_factor":5.3384},{"match_name":"Shongum May 2021 USPSA Match","match_date":"2021-05-01","stage_classifiercode":"20-01","member_number":"TY86478","first_name":"CLIFFORD","last_name":"PIETRUSKI","classification":"B","division":"CARRY OPTICS","hit_factor":5.3358},{"match_name":"CTASA - 3rd Sunday USPSA at Triple C Range - 12-20-2020","match_date":"2020-12-20","stage_classifiercode":"20-01","member_number":"A96761","first_name":"RICHARD","last_name":"HAERTLING","classification":"A","division":"CARRY OPTICS","hit_factor":5.3358},{"match_name":"SCAPSA MN05 SPRING 6","match_date":"2021-05-18","stage_classifiercode":"20-01","member_number":"TY100255","first_name":"CHRIS","last_name":"BUDION","classification":"U","division":"CARRY OPTICS","hit_factor":5.3333},{"match_name":"LdF USPSA Classifier Match December 12 2020","match_date":"2020-12-12","stage_classifiercode":"20-01","member_number":"A123395","first_name":"TRAVIS","last_name":"LOPEZ","classification":"A","division":"CARRY OPTICS","hit_factor":5.3316},{"match_name":"USPSA Strategic Edge SEGR May 15th 2021","match_date":"2021-05-15","stage_classifiercode":"20-01","member_number":"TY98458","first_name":"ERIK","last_name":"SCHALL","classification":"U","division":"CARRY OPTICS","hit_factor":5.3314},{"match_name":"RBGC USPSA 2021-8-15 Special Classifier Match","match_date":"2021-08-15","stage_classifiercode":"20-01","member_number":"A123422","first_name":"GARRET","last_name":"MCLAREN","classification":"A","division":"CARRY OPTICS","hit_factor":5.3302},{"match_name":"Shasta Shooters 2021 June","match_date":"2021-06-12","stage_classifiercode":"20-01","member_number":"A130392","first_name":"LANCE","last_name":"MENOLD","classification":"C","division":"CARRY OPTICS","hit_factor":5.3274},{"match_name":"ARPC USPSA Match 4-25-21","match_date":"2021-04-25","stage_classifiercode":"20-01","member_number":"A79608","first_name":"DAVID","last_name":"OVERLAND","classification":"A","division":"CARRY OPTICS","hit_factor":5.3239},{"match_name":"WI21 Apr 25 2021","match_date":"2021-04-25","stage_classifiercode":"20-01","member_number":"TY96480","first_name":"KEN","last_name":"SCHMIDTCHEN","classification":"B","division":"CARRY OPTICS","hit_factor":5.3202},{"match_name":"Coyote Arms Classifier Match 10-31-21","match_date":"2021-10-31","stage_classifiercode":"20-01","member_number":"TY137278","first_name":"SANTIAGO","last_name":"FLORES","classification":"U","division":"CARRY OPTICS","hit_factor":5.3202},{"match_name":"MRPC OHS02 06272021","match_date":"2021-06-27","stage_classifiercode":"20-01","member_number":"A129954","first_name":"PEYTON","last_name":"CLEMONS","classification":"U","division":"CARRY OPTICS","hit_factor":5.3179},{"match_name":"Vortex Edge USPSA October 2021","match_date":"2021-10-09","stage_classifiercode":"20-01","member_number":"L4256","first_name":"MIKE","last_name":"GRIFFIN","classification":"C","division":"CARRY OPTICS","hit_factor":5.3162},{"match_name":"2020-12-05 USPSA  at Phoenix Rod and Gun Club","match_date":"2020-12-05","stage_classifiercode":"20-01","member_number":"A86012","first_name":"MICHAEL","last_name":"DE BOLT","classification":"C","division":"CARRY OPTICS","hit_factor":5.3162},{"match_name":"Dundee Practical Shooters - Feb 27 2021","match_date":"2021-02-27","stage_classifiercode":"20-01","member_number":"Ty98685","first_name":"ROB","last_name":"COATES","classification":"B","division":"CARRY OPTICS","hit_factor":5.314},{"match_name":"GCL Monthly USPSA Match Saturday 11-6-2021  INDOORS","match_date":"2021-11-06","stage_classifiercode":"20-01","member_number":"A121564","first_name":"WILLIAM","last_name":"CROWE","classification":"C","division":"CARRY OPTICS","hit_factor":5.3097},{"match_name":"Coastal Area Practical Shooters 10-23-21","match_date":"2021-10-23","stage_classifiercode":"20-01","member_number":"TY65408","first_name":"ANDY","last_name":"WILBUR","classification":"U","division":"CARRY OPTICS","hit_factor":5.3097},{"match_name":"DSSA 2021-02 USPSA Pistol","match_date":"2021-02-28","stage_classifiercode":"20-01","member_number":"A95304","first_name":"JOEL","last_name":"EDWARDS","classification":"C","division":"CARRY OPTICS","hit_factor":5.3097},{"match_name":"GCL Monthly USPSA Match Saturday 11-6-2021  INDOORS","match_date":"2021-11-06","stage_classifiercode":"20-01","member_number":"TY95806","first_name":"ERIC","last_name":"HOBRON","classification":"C","division":"CARRY OPTICS","hit_factor":5.3081},{"match_name":"LdF USPSA Classifier Match December 12 2020","match_date":"2020-12-12","stage_classifiercode":"20-01","member_number":"TY109446","first_name":"CHARLIE","last_name":"THAI","classification":"U","division":"CARRY OPTICS","hit_factor":5.3045},{"match_name":"CAS March 2021","match_date":"2021-03-07","stage_classifiercode":"20-01","member_number":"TY106146","first_name":"MATHEW B","last_name":"DOZIER","classification":"B","division":"CARRY OPTICS","hit_factor":5.303},{"match_name":"OPSC USPSA JUNE 2021","match_date":"2021-06-13","stage_classifiercode":"20-01","member_number":"PEN","first_name":"MATT","last_name":"HOCKETT","classification":"U (UNCLASSIFIED)","division":"CARRY OPTICS","hit_factor":5.3016},{"match_name":"5 Dogs December USPSA 2020","match_date":"2020-12-06","stage_classifiercode":"20-01","member_number":"A90297","first_name":"ROMEL","last_name":"DE CASTRO","classification":"C","division":"CARRY OPTICS","hit_factor":5.2993},{"match_name":"LdF USPSA Match November 7 2021","match_date":"2021-11-07","stage_classifiercode":"20-01","member_number":"FY65090","first_name":"KEITH","last_name":"DEY","classification":"C","division":"CARRY OPTICS","hit_factor":5.2966},{"match_name":"MCRC USPSA March 2021","match_date":"2021-03-13","stage_classifiercode":"20-01","member_number":"A110328","first_name":"ROSS","last_name":"BOWMAN","classification":"C","division":"CARRY OPTICS","hit_factor":5.2953},{"match_name":"EHPSA USPSA 26 September 2021","match_date":"2021-09-26","stage_classifiercode":"20-01","member_number":"ty84357","first_name":"RAY","last_name":"DONCH","classification":"C","division":"CARRY OPTICS","hit_factor":5.2941},{"match_name":"YRPA USPSA May 2nd 2021","match_date":"2021-05-02","stage_classifiercode":"20-01","member_number":"A119728","first_name":"LANE","last_name":"PLUMLEE","classification":"B","division":"CARRY OPTICS","hit_factor":5.292},{"match_name":"SCAPSA MN05 SPRING 6","match_date":"2021-05-18","stage_classifiercode":"20-01","member_number":"ty106794","first_name":"GUY","last_name":"ASMUS","classification":"C","division":"CARRY OPTICS","hit_factor":5.291},{"match_name":"Pioneer Action Shooters USPSA 11-15-20","match_date":"2020-11-15","stage_classifiercode":"20-01","member_number":"A105142","first_name":"ERIC","last_name":"HILL","classification":"U","division":"CARRY OPTICS","hit_factor":5.2899},{"match_name":"STAGE ZERO ALL CLASSIFIER","match_date":"2021-09-04","stage_classifiercode":"20-01","member_number":"A136575","first_name":"BRYCE","last_name":"KLARNER","classification":"U","division":"CARRY OPTICS","hit_factor":5.2889},{"match_name":"GoShoot Outdoor A6 Warm up And Classifier match!","match_date":"2021-04-03","stage_classifiercode":"20-01","member_number":"A131499","first_name":"NICK","last_name":"GREER","classification":"C","division":"CARRY OPTICS","hit_factor":5.2863},{"match_name":"2020-12-05 USPSA  at Phoenix Rod and Gun Club","match_date":"2020-12-05","stage_classifiercode":"20-01","member_number":"TY119060","first_name":"TONY","last_name":"SQUAGLIA","classification":"B","division":"CARRY OPTICS","hit_factor":5.2854},{"match_name":"OREGON ARPC CC05 USPSA OCT 9 2021","match_date":"2021-10-09","stage_classifiercode":"20-01","member_number":"A114271","first_name":"BRIAN","last_name":"DOLINAR","classification":"C","division":"CARRY OPTICS","hit_factor":5.2838},{"match_name":"JCSSA DEC 5 2020","match_date":"2020-12-05","stage_classifiercode":"20-01","member_number":"A118618","first_name":"MAURICIO","last_name":"BELTRAN","classification":"U","division":"CARRY OPTICS","hit_factor":5.283},{"match_name":"MCPSL Pistol 1-9-2021","match_date":"2021-01-09","stage_classifiercode":"20-01","member_number":"A119230","first_name":"FRANK","last_name":"WOODLING","classification":"B","division":"CARRY OPTICS","hit_factor":5.2805},{"match_name":"STAGE ZERO ALL CLASSIFIER","match_date":"2021-09-04","stage_classifiercode":"20-01","member_number":"A126334","first_name":"DAVID","last_name":"MCFADYEN","classification":"C","division":"CARRY OPTICS","hit_factor":5.2805},{"match_name":"OK06-30OCT21-SCRP-USPSA","match_date":"2021-10-30","stage_classifiercode":"20-01","member_number":"A131149","first_name":"TANNER","last_name":"WEST","classification":"C","division":"CARRY OPTICS","hit_factor":5.2798},{"match_name":"Heartland PS USPSA Monthly 21 March 2021","match_date":"2021-03-21","stage_classifiercode":"20-01","member_number":"A84928","first_name":"AARON","last_name":"HIEMKE","classification":"U","division":"CARRY OPTICS","hit_factor":5.277},{"match_name":"Oh Shoot -PRG Nov 27th - Uspsa Classifier Match","match_date":"2021-11-27","stage_classifiercode":"20-01","member_number":"A-98143","first_name":"REX","last_name":"HO","classification":"C","division":"CARRY OPTICS","hit_factor":5.2747},{"match_name":"Magnolia Rifle and Pistol Club May  2021 USPSA Match","match_date":"2021-05-15","stage_classifiercode":"20-01","member_number":"Ty109250","first_name":"ARTHUR","last_name":"CALIMARAN","classification":"B","division":"CARRY OPTICS","hit_factor":5.2687},{"match_name":"TPS USPSA at CMP Dec 19 2020 Special Classifier Match","match_date":"2020-12-19","stage_classifiercode":"20-01","member_number":"A108784","first_name":"JOSH","last_name":"DAVIS","classification":"B","division":"CARRY OPTICS","hit_factor":5.2678},{"match_name":"RBGC USPSA 2021-8-15 Special Classifier Match","match_date":"2021-08-15","stage_classifiercode":"20-01","member_number":"A118569","first_name":"JOSH","last_name":"HARRISS","classification":"B","division":"CARRY OPTICS","hit_factor":5.2678},{"match_name":"Richmond Hot Shots Aug 14-15-2021 USPSA","match_date":"2021-08-14","stage_classifiercode":"20-01","member_number":"A133312","first_name":"JUSTIN","last_name":"HAYES","classification":"U","division":"CARRY OPTICS","hit_factor":5.2632},{"match_name":"Chillicothe Sportsmens Club July USPSA","match_date":"2021-07-24","stage_classifiercode":"20-01","member_number":"A40542","first_name":"JOEL","last_name":"RIPPER","classification":"B","division":"CARRY OPTICS","hit_factor":5.2632},{"match_name":"YRPA USPSA May 2nd 2021","match_date":"2021-05-02","stage_classifiercode":"20-01","member_number":"A133931","first_name":"PAUL","last_name":"HUGHES","classification":"U","division":"CARRY OPTICS","hit_factor":5.258},{"match_name":"FAS Sunday Outdoor USPSA Match","match_date":"2021-05-02","stage_classifiercode":"20-01","member_number":"A93778","first_name":"JOHN","last_name":"NAPOLSKI","classification":"B","division":"CARRY OPTICS","hit_factor":5.2578},{"match_name":"MCRC USPSA March 2021","match_date":"2021-03-13","stage_classifiercode":"20-01","member_number":"A128549","first_name":"PHILIP","last_name":"POWERS","classification":"U","division":"CARRY OPTICS","hit_factor":5.2529},{"match_name":"LGCSEMPS April 2021 Special Classifier","match_date":"2021-04-11","stage_classifiercode":"20-01","member_number":"A131339","first_name":"JON","last_name":"DUFFY","classification":"U","division":"CARRY OPTICS","hit_factor":5.2529},{"match_name":"Cactus USPSA ALL CLASSIFIER January 2021","match_date":"2021-01-03","stage_classifiercode":"20-01","member_number":"A112657","first_name":"RICKY","last_name":"LABISTRE","classification":"A","division":"CARRY OPTICS","hit_factor":5.2511},{"match_name":"Collin County USPSA  08-22-2021","match_date":"2021-08-22","stage_classifiercode":"20-01","member_number":"TY94608","first_name":"ESTUARDO","last_name":"BALDERAS","classification":"A","division":"CARRY OPTICS","hit_factor":5.2493},{"match_name":"Shasta Shooters 2021 Jan","match_date":"2021-01-09","stage_classifiercode":"20-01","member_number":"L4425","first_name":"MITCH","last_name":"MORA","classification":"M","division":"CARRY OPTICS","hit_factor":5.249},{"match_name":"Bossier Parish Practical Shooters March 21 2021","match_date":"2021-03-21","stage_classifiercode":"20-01","member_number":"TY107325","first_name":"DAVID","last_name":"GIERLING","classification":"U","division":"CARRY OPTICS","hit_factor":5.2489},{"match_name":"Medford USPSA Oct 2021 Match","match_date":"2021-10-17","stage_classifiercode":"20-01","member_number":"A84091","first_name":"DAN","last_name":"GETTLING","classification":"B","division":"CARRY OPTICS","hit_factor":5.2441},{"match_name":"QPS Quantico Shooting Club December USPSA   ","match_date":"2020-12-12","stage_classifiercode":"20-01","member_number":"A82648","first_name":"JIM","last_name":"SANTORO","classification":"U","division":"CARRY OPTICS","hit_factor":5.2394},{"match_name":"LIPSA  - March  21st  2021 - March Madness USPSA Match ","match_date":"2021-03-21","stage_classifiercode":"20-01","member_number":"A104497","first_name":"JEFFERY","last_name":"YOUNG","classification":"U","division":"CARRY OPTICS","hit_factor":5.2385},{"match_name":"NISA August 2021","match_date":"2021-08-22","stage_classifiercode":"20-01","member_number":"A131565","first_name":"RICARDO","last_name":"GARZA","classification":"C","division":"CARRY OPTICS","hit_factor":5.2356},{"match_name":"NISA August 2021","match_date":"2021-08-22","stage_classifiercode":"20-01","member_number":"A123850","first_name":"DAVE","last_name":"MANN","classification":"M","division":"CARRY OPTICS","hit_factor":5.2314},{"match_name":"RPS January 2021 USPSA Match","match_date":"2021-01-09","stage_classifiercode":"20-01","member_number":"L4619","first_name":"TUDOR","last_name":"STURZU","classification":"B","division":"CARRY OPTICS","hit_factor":5.2314},{"match_name":"GoShoot Outdoor A6 Warm up And Classifier match!","match_date":"2021-04-03","stage_classifiercode":"20-01","member_number":"A120887","first_name":"PATRICK","last_name":"HUNG","classification":"C","division":"CARRY OPTICS","hit_factor":5.2299},{"match_name":"Richmond Hot Shots Aug 14-15-2021 USPSA","match_date":"2021-08-14","stage_classifiercode":"20-01","member_number":"Ty107140","first_name":"ROWELL","last_name":"FERRER","classification":"U","division":"CARRY OPTICS","hit_factor":5.2261},{"match_name":"Ontelaunee USPSA November 2020","match_date":"2020-11-20","stage_classifiercode":"20-01","member_number":"A119314","first_name":"TRAVIS","last_name":"TURNER","classification":"B","division":"CARRY OPTICS","hit_factor":5.2247},{"match_name":"Glacier Practical Shooters Special Classifier Match 05/01/2021","match_date":"2021-05-01","stage_classifiercode":"20-01","member_number":"A114874","first_name":"ADAM","last_name":"KOVATCH","classification":"U","division":"CARRY OPTICS","hit_factor":5.219},{"match_name":"Hampden RPC November USPSA Match","match_date":"2020-11-08","stage_classifiercode":"20-01","member_number":"TY104654","first_name":"TED","last_name":"PARKER","classification":"C","division":"CARRY OPTICS","hit_factor":5.219},{"match_name":"Moss Branch USPSA June match","match_date":"2021-06-26","stage_classifiercode":"20-01","member_number":"A113351","first_name":"JAKE","last_name":"CULOTTA","classification":"B","division":"CARRY OPTICS","hit_factor":5.2174},{"match_name":"LIPSA  - March  21st  2021 - March Madness USPSA Match ","match_date":"2021-03-21","stage_classifiercode":"20-01","member_number":"L4011","first_name":"TOMMY","last_name":"GEORGIOPOULOS","classification":"U","division":"CARRY OPTICS","hit_factor":5.2138},{"match_name":"Southern Kentucky Gun Club USPSA April Match","match_date":"2021-04-25","stage_classifiercode":"20-01","member_number":"TY106277","first_name":"KENNETH","last_name":"FAST","classification":"U","division":"CARRY OPTICS","hit_factor":5.2117},{"match_name":"SPSA USPSA January 1st Sat Match","match_date":"2021-01-02","stage_classifiercode":"20-01","member_number":"A116600","first_name":"TIM","last_name":"OWEN","classification":"A","division":"CARRY OPTICS","hit_factor":5.2083},{"match_name":"CTASA - 3rd Sunday USPSA at Triple C Range - 12-20-2020","match_date":"2020-12-20","stage_classifiercode":"20-01","member_number":"A130350","first_name":"ANDREW","last_name":"BUI","classification":"U","division":"CARRY OPTICS","hit_factor":5.2073},{"match_name":"Homestead USPSA June Classifier Match 2021","match_date":"2021-06-20","stage_classifiercode":"20-01","member_number":"TY122820","first_name":"ELIEZER","last_name":"RODRIGUEZ","classification":"U","division":"CARRY OPTICS","hit_factor":5.2065},{"match_name":"RBGC USPSA 2021-8-15 Special Classifier Match","match_date":"2021-08-15","stage_classifiercode":"20-01","member_number":"TY75523","first_name":"BILAL","last_name":"SINNO","classification":"U","division":"CARRY OPTICS","hit_factor":5.2061},{"match_name":"Triforce Practical Shooters at Big Woods Goods 03-25-2021","match_date":"2021-03-25","stage_classifiercode":"20-01","member_number":"A109744","first_name":"TUCKER","last_name":"JUDD","classification":"C","division":"CARRY OPTICS","hit_factor":5.2045},{"match_name":"Coastal Area Practical Shooters 10-23-21","match_date":"2021-10-23","stage_classifiercode":"20-01","member_number":"A104959","first_name":"JEREMY","last_name":"PETROVAY","classification":"C","division":"CARRY OPTICS","hit_factor":5.2045},{"match_name":"SOAP July 2021 USPSA Match","match_date":"2021-07-11","stage_classifiercode":"20-01","member_number":"TY101811","first_name":"BRENT","last_name":"VETOVITZ","classification":"B","division":"CARRY OPTICS","hit_factor":5.2},{"match_name":"Extreme GM uspsa Nov-13","match_date":"2021-11-13","stage_classifiercode":"20-01","member_number":"FY88426","first_name":"FRANCISCO","last_name":"ROMERO","classification":"B","division":"CARRY OPTICS","hit_factor":5.1996},{"match_name":"TTS USPSA Match 12JUN2021","match_date":"2021-06-12","stage_classifiercode":"20-01","member_number":"TY111128","first_name":"BRANDON","last_name":"TRUONG","classification":"X","division":"CARRY OPTICS","hit_factor":5.1948},{"match_name":"Hampden RPC November USPSA Match","match_date":"2020-11-08","stage_classifiercode":"20-01","member_number":"A128399","first_name":"JONATHAN","last_name":"WHEATON","classification":"B","division":"CARRY OPTICS","hit_factor":5.1948},{"match_name":"Richmond Boro Gun Club Monthly USPSA Match May 2021","match_date":"2021-05-08","stage_classifiercode":"20-01","member_number":"FY11178","first_name":"DAVID","last_name":"MENA","classification":"U","division":"CARRY OPTICS","hit_factor":5.1925},{"match_name":"SFA USPSA November 20 2021 MATCH","match_date":"2021-11-20","stage_classifiercode":"20-01","member_number":"A70458","first_name":"SHAWN","last_name":"KONO","classification":"B","division":"CARRY OPTICS","hit_factor":5.1923},{"match_name":"SOAP December 2020 USPSA Match","match_date":"2020-12-11","stage_classifiercode":"20-01","member_number":"TY116214","first_name":"DON","last_name":"SANDRETTO","classification":"B","division":"CARRY OPTICS","hit_factor":5.1844},{"match_name":"MAPSA 5/8/21","match_date":"2021-05-08","stage_classifiercode":"20-01","member_number":"A133185","first_name":"AUSTIN","last_name":"KRANTZ","classification":"C","division":"CARRY OPTICS","hit_factor":5.1793},{"match_name":"DSSA 2021-02 USPSA Pistol","match_date":"2021-02-28","stage_classifiercode":"20-01","member_number":"A129733","first_name":"WILLIAM","last_name":"NOWADNICK","classification":"U","division":"CARRY OPTICS","hit_factor":5.1774},{"match_name":"GCL Monthly USPSA Match Saturday 11-6-2021  INDOORS","match_date":"2021-11-06","stage_classifiercode":"20-01","member_number":"a96622","first_name":"LARRY","last_name":"STROLLO","classification":"B","division":"CARRY OPTICS","hit_factor":5.1724},{"match_name":"STAGE ZERO ALL CLASSIFIER","match_date":"2021-09-04","stage_classifiercode":"20-01","member_number":"A136738","first_name":"LUCAS","last_name":"CORNISH","classification":"U","division":"CARRY OPTICS","hit_factor":5.1708},{"match_name":"OPSC USPSA JUNE 2021","match_date":"2021-06-13","stage_classifiercode":"20-01","member_number":"A117487","first_name":"RYAN","last_name":"PLUNKETT","classification":"B","division":"CARRY OPTICS","hit_factor":5.1708},{"match_name":"OREGON ARPC CC05 USPSA NOVEMBER 14 2020","match_date":"2020-11-14","stage_classifiercode":"20-01","member_number":"A94833","first_name":"DENNIS","last_name":"TEGTMEYER","classification":"B","division":"CARRY OPTICS","hit_factor":5.1625},{"match_name":"BNA USPSA - July 25 2021 (Brothers N Arms)","match_date":"2021-07-25","stage_classifiercode":"20-01","member_number":"Ty96287","first_name":"NICK","last_name":"BRANDT","classification":"U","division":"CARRY OPTICS","hit_factor":5.157},{"match_name":"OREGON ARPC CC05 USPSA NOVEMBER 14 2020","match_date":"2020-11-14","stage_classifiercode":"20-01","member_number":"A114271","first_name":"BRIAN","last_name":"DOLINAR","classification":"U","division":"CARRY OPTICS","hit_factor":5.1557},{"match_name":"Bossier Parish Practical Shooters November 21 2021","match_date":"2021-11-21","stage_classifiercode":"20-01","member_number":"TY116349","first_name":"OWEN","last_name":"MCDONNELL","classification":"B","division":"CARRY OPTICS","hit_factor":5.1536},{"match_name":"FBURG September 2021 USPSA","match_date":"2021-09-05","stage_classifiercode":"20-01","member_number":"A125257","first_name":"TYLER","last_name":"LINDSEY","classification":"A","division":"CARRY OPTICS","hit_factor":5.1493},{"match_name":"GRB USPSA JANUARY 2021 AT CAVALIER","match_date":"2021-01-16","stage_classifiercode":"20-01","member_number":"A118287","first_name":"CHRISTOPHER","last_name":"WIESE","classification":"B","division":"CARRY OPTICS","hit_factor":5.144},{"match_name":"CCPL 11-8-2020","match_date":"2020-11-08","stage_classifiercode":"20-01","member_number":"A125746","first_name":"RYAN","last_name":"SWAIN","classification":"U","division":"CARRY OPTICS","hit_factor":5.1429},{"match_name":"Nampa USPSA September 10th 2021 Classifier Match","match_date":"2021-09-10","stage_classifiercode":"20-01","member_number":"TY91986","first_name":"TRAVIS","last_name":"DEMARAY","classification":"U","division":"CARRY OPTICS","hit_factor":5.1418},{"match_name":"Shasta Shooters 2021 June","match_date":"2021-06-12","stage_classifiercode":"20-01","member_number":"A130896","first_name":"GRIFFITH","last_name":"TONKIN","classification":"B","division":"CARRY OPTICS","hit_factor":5.1392},{"match_name":"Shongum May 2021 USPSA Match","match_date":"2021-05-01","stage_classifiercode":"20-01","member_number":"A113668","first_name":"RICHARD","last_name":"ASCHER","classification":"B","division":"CARRY OPTICS","hit_factor":5.1331},{"match_name":"ESPS  USPSA  March","match_date":"2021-03-27","stage_classifiercode":"20-01","member_number":"FY58056","first_name":"NOEL","last_name":"MARUCUT","classification":"B","division":"CARRY OPTICS","hit_factor":5.1331},{"match_name":"MCRC USPSA March 2021","match_date":"2021-03-13","stage_classifiercode":"20-01","member_number":"TY90693","first_name":"MIKE","last_name":"WILKERSON","classification":"U","division":"CARRY OPTICS","hit_factor":5.1248},{"match_name":"LdF USPSA Match November 7 2021","match_date":"2021-11-07","stage_classifiercode":"20-01","member_number":"TY94265","first_name":"STEVE","last_name":"BENCE","classification":"B","division":"CARRY OPTICS","hit_factor":5.123},{"match_name":"PMRPC USPSA 12Dec20 - all Classifier","match_date":"2020-12-12","stage_classifiercode":"20-01","member_number":"A125543","first_name":"SCOTT","last_name":"HAWLEY","classification":"U","division":"CARRY OPTICS","hit_factor":5.1195},{"match_name":"GRRC 2021 wk 7","match_date":"2021-06-14","stage_classifiercode":"20-01","member_number":"A100450","first_name":"MARK","last_name":"TUTILA","classification":"B","division":"CARRY OPTICS","hit_factor":5.1192},{"match_name":"WLPS May 2021 ALL USPSA Classifier Match ","match_date":"2021-05-23","stage_classifiercode":"20-01","member_number":"A112534","first_name":"TOM","last_name":"KEEFE","classification":"C","division":"CARRY OPTICS","hit_factor":5.1192},{"match_name":"OREGON ARPC CC05 USPSA OCT 9 2021","match_date":"2021-10-09","stage_classifiercode":"20-01","member_number":"A98700","first_name":"MITCHELL","last_name":"PHAN","classification":"B","division":"CARRY OPTICS","hit_factor":5.1188},{"match_name":"NISA August 2021","match_date":"2021-08-22","stage_classifiercode":"20-01","member_number":"TY98752","first_name":"PETER","last_name":"DIAZ DE LEON","classification":"A","division":"CARRY OPTICS","hit_factor":5.1142},{"match_name":"Coyote Arms Classifier Match 10-31-21","match_date":"2021-10-31","stage_classifiercode":"20-01","member_number":"A137267","first_name":"KRIS","last_name":"CADENA","classification":"U","division":"CARRY OPTICS","hit_factor":5.1142},{"match_name":"SOAP December 2020 USPSA Match","match_date":"2020-12-11","stage_classifiercode":"20-01","member_number":"A111056","first_name":"MARTIN","last_name":"AYALA","classification":"C","division":"CARRY OPTICS","hit_factor":5.1095},{"match_name":"YRPA USPSA May 2nd 2021","match_date":"2021-05-02","stage_classifiercode":"20-01","member_number":"FY80982","first_name":"LARRY","last_name":"ROMAINE","classification":"C","division":"CARRY OPTICS","hit_factor":5.0955},{"match_name":"Cactus USPSA ALL CLASSIFIER January 2021","match_date":"2021-01-03","stage_classifiercode":"20-01","member_number":"A104053","first_name":"RAYMOND","last_name":"GALLEGOS","classification":"C","division":"CARRY OPTICS","hit_factor":5.093},{"match_name":"Shongum May 2021 USPSA Match","match_date":"2021-05-01","stage_classifiercode":"20-01","member_number":"A110177","first_name":"DANIEL","last_name":"FELTYBERGER","classification":"B","division":"CARRY OPTICS","hit_factor":5.0922},{"match_name":"YRPA USPSA May 2nd 2021","match_date":"2021-05-02","stage_classifiercode":"20-01","member_number":"A111027","first_name":"RYAN","last_name":"BLOSSER","classification":"C","division":"CARRY OPTICS","hit_factor":5.0922},{"match_name":"TPS USPSA at CMP Dec 19 2020 Special Classifier Match","match_date":"2020-12-19","stage_classifiercode":"20-01","member_number":"TY108549","first_name":"MICHAEL","last_name":"COLE","classification":"A","division":"CARRY OPTICS","hit_factor":5.0901},{"match_name":"SWGC USPSA Pistol Match - May 2021","match_date":"2021-05-01","stage_classifiercode":"20-01","member_number":"A122575","first_name":"BOYD","last_name":"CARLSON","classification":"U","division":"CARRY OPTICS","hit_factor":5.0847},{"match_name":"FBURG September 2021 USPSA","match_date":"2021-09-05","stage_classifiercode":"20-01","member_number":"TY128047","first_name":"JOHN","last_name":"TREAT","classification":"B","division":"CARRY OPTICS","hit_factor":5.0847},{"match_name":"RBGC USPSA 2021-8-15 Special Classifier Match","match_date":"2021-08-15","stage_classifiercode":"20-01","member_number":"TY119222","first_name":"CLARK","last_name":"DARLEY","classification":"C","division":"CARRY OPTICS","hit_factor":5.0847},{"match_name":"LPRGC- Lower Providence USPSA Nov 2020 Match","match_date":"2020-11-07","stage_classifiercode":"20-01","member_number":"TY119082","first_name":"KYLE","last_name":"ILEY","classification":"C","division":"CARRY OPTICS","hit_factor":5.0831},{"match_name":"Pioneer Action Shooters USPSA 11-15-20","match_date":"2020-11-15","stage_classifiercode":"20-01","member_number":"TY80270","first_name":"JOHN","last_name":"BECKER","classification":"C","division":"CARRY OPTICS","hit_factor":5.0804},{"match_name":"SPSA USPSA January 1st Sat Match","match_date":"2021-01-02","stage_classifiercode":"20-01","member_number":"FY83413","first_name":"DOUG","last_name":"HARDING","classification":"B","division":"CARRY OPTICS","hit_factor":5.0773},{"match_name":"LNDL July 11th Classifier Match","match_date":"2021-07-11","stage_classifiercode":"20-01","member_number":"L2952","first_name":"ERIC","last_name":"ROGERS","classification":"U","division":"CARRY OPTICS","hit_factor":5.0771},{"match_name":"Triforce Practical Shooters at Big Woods Goods 03-25-2021","match_date":"2021-03-25","stage_classifiercode":"20-01","member_number":"FY124976","first_name":"KYLE","last_name":"TAYLOR","classification":"U","division":"CARRY OPTICS","hit_factor":5.0771},{"match_name":"LCSC Linden USPSA 122720","match_date":"2020-12-27","stage_classifiercode":"20-01","member_number":"TY106623","first_name":"DAVID","last_name":"BRADY","classification":"B","division":"CARRY OPTICS","hit_factor":5.0744},{"match_name":"SFPS 5-16-21 Super Classifier","match_date":"2021-05-16","stage_classifiercode":"20-01","member_number":"TY64877","first_name":"TIM","last_name":"MATTHEWS","classification":"C","division":"CARRY OPTICS","hit_factor":5.0744},{"match_name":"RBGC USPSA 2021-8-15 Special Classifier Match","match_date":"2021-08-15","stage_classifiercode":"20-01","member_number":"FY132624","first_name":"BOBBY","last_name":"FIORENTINI","classification":"C","division":"CARRY OPTICS","hit_factor":5.0744},{"match_name":"CFRPC USPSA 2021-11-14","match_date":"2021-11-14","stage_classifiercode":"20-01","member_number":"Ty95166","first_name":"ELIJAH","last_name":"TORRES","classification":"A","division":"CARRY OPTICS","hit_factor":5.0686},{"match_name":"LIPSA  - March  21st  2021 - March Madness USPSA Match ","match_date":"2021-03-21","stage_classifiercode":"20-01","member_number":"TY121075","first_name":"LOU","last_name":"D'AGOSTINO","classification":"B","division":"CARRY OPTICS","hit_factor":5.0676},{"match_name":"GRB USPSA JANUARY 2021 AT CAVALIER","match_date":"2021-01-16","stage_classifiercode":"20-01","member_number":"Ty97341","first_name":"JAMES","last_name":"HAN","classification":"A","division":"CARRY OPTICS","hit_factor":5.0655},{"match_name":"Medford USPSA March 2021 OR-04","match_date":"2021-03-21","stage_classifiercode":"20-01","member_number":"TY126850","first_name":"JOSH","last_name":"EGGLESTON","classification":"B","division":"CARRY OPTICS","hit_factor":5.0609},{"match_name":"Dundee Practical Shooters - Feb 27 2021","match_date":"2021-02-27","stage_classifiercode":"20-01","member_number":"A121896","first_name":"KYLE","last_name":"JAMESON","classification":"B","division":"CARRY OPTICS","hit_factor":5.0605},{"match_name":"KSA USPSA  3 April 2021","match_date":"2021-04-03","stage_classifiercode":"20-01","member_number":"A121984","first_name":"JACK","last_name":"WALLACE","classification":"C","division":"CARRY OPTICS","hit_factor":5.0584},{"match_name":"GRB USPSA JANUARY 2021 AT CAVALIER","match_date":"2021-01-16","stage_classifiercode":"20-01","member_number":"a109707","first_name":"OMAR","last_name":"AYOUBI","classification":"A","division":"CARRY OPTICS","hit_factor":5.0584},{"match_name":"Matamoras USPSA September 2021","match_date":"2021-09-19","stage_classifiercode":"20-01","member_number":"A101876","first_name":"SEAN","last_name":"CONLEY","classification":"B","division":"CARRY OPTICS","hit_factor":5.0569},{"match_name":"RBGC USPSA 2021-01-23","match_date":"2021-01-23","stage_classifiercode":"20-01","member_number":"A113650","first_name":"GARY","last_name":"GAUDIO","classification":"C","division":"CARRY OPTICS","hit_factor":5.0567},{"match_name":"EWPSA 2021-04","match_date":"2021-04-17","stage_classifiercode":"20-01","member_number":"A118718","first_name":"JOSHUA","last_name":"COMBS","classification":"U","division":"CARRY OPTICS","hit_factor":5.0562},{"match_name":"NHRPC - November 2021 USPSA","match_date":"2021-11-13","stage_classifiercode":"20-01","member_number":"A 76022","first_name":"MASHU","last_name":"KOBAYASHI","classification":"B","division":"CARRY OPTICS","hit_factor":5.0485},{"match_name":"Volusia County Gun and Hunt Club","match_date":"2020-11-21","stage_classifiercode":"20-01","member_number":"TY126201","first_name":"TED","last_name":"LEE","classification":"C","division":"CARRY OPTICS","hit_factor":5.0479},{"match_name":"FAS Sunday Outdoor USPSA Match","match_date":"2021-05-02","stage_classifiercode":"20-01","member_number":"A127548","first_name":"NICHOLAS","last_name":"WEBB","classification":"C","division":"CARRY OPTICS","hit_factor":5.0467},{"match_name":"Volusia County Gun and Hunt Club","match_date":"2020-11-21","stage_classifiercode":"20-01","member_number":"A113169","first_name":"RICHARD","last_name":"TURNER","classification":"U","division":"CARRY OPTICS","hit_factor":5.045},{"match_name":"LIPSA  - March  21st  2021 - March Madness USPSA Match ","match_date":"2021-03-21","stage_classifiercode":"20-01","member_number":"TY84200","first_name":"PAUL","last_name":"MARTELLO","classification":"B","division":"CARRY OPTICS","hit_factor":5.045},{"match_name":"Richmond Boro Gun Club Monthly USPSA Match May 2021","match_date":"2021-05-08","stage_classifiercode":"20-01","member_number":"A109627","first_name":"JON-VINCENT","last_name":"TESTACCIO","classification":"C","division":"CARRY OPTICS","hit_factor":5.042},{"match_name":"USPSA MO21 2Alpha SBRC December 26 2020","match_date":"2020-12-26","stage_classifiercode":"20-01","member_number":"A99964","first_name":"DAVID","last_name":"WARD","classification":"B","division":"CARRY OPTICS","hit_factor":5.0405},{"match_name":"SPSA USPSA January 1st Sat Match","match_date":"2021-01-02","stage_classifiercode":"20-01","member_number":"TY114569","first_name":"GARY","last_name":"CHRISTOPHER","classification":"B","division":"CARRY OPTICS","hit_factor":5.0405},{"match_name":"NHRPC - November 2021 USPSA","match_date":"2021-11-13","stage_classifiercode":"20-01","member_number":"A135260","first_name":"MARTIN","last_name":"LAGUNSAD","classification":"C","division":"CARRY OPTICS","hit_factor":5.0403},{"match_name":"LdF USPSA Classifier Match December 12 2020","match_date":"2020-12-12","stage_classifiercode":"20-01","member_number":"FY92801","first_name":"JINYANG","last_name":"XIAO","classification":"A","division":"CARRY OPTICS","hit_factor":5.0383},{"match_name":"Ontelaunee USPSA November 2020","match_date":"2020-11-20","stage_classifiercode":"20-01","member_number":"A120840","first_name":"BOBBY","last_name":"ZINK","classification":"C","division":"CARRY OPTICS","hit_factor":5.036},{"match_name":"FBURG September 2021 USPSA","match_date":"2021-09-05","stage_classifiercode":"20-01","member_number":"FY51532","first_name":"CHRIS","last_name":"RHINES","classification":"A","division":"CARRY OPTICS","hit_factor":5.0314},{"match_name":"MCRC USPSA March 2021","match_date":"2021-03-13","stage_classifiercode":"20-01","member_number":"A88808","first_name":"RICK","last_name":"ROBERTS","classification":"C","division":"CARRY OPTICS","hit_factor":5.0314},{"match_name":"ENPS September 2021 USPSA Match","match_date":"2021-09-04","stage_classifiercode":"20-01","member_number":"A101977","first_name":"ASHER","last_name":"LANGTON","classification":"C","division":"CARRY OPTICS","hit_factor":5.0314},{"match_name":"MCAS MAY 2021 USPSA","match_date":"2021-05-15","stage_classifiercode":"20-01","member_number":"A130483","first_name":"TRAVIS","last_name":"ROBINSON","classification":"C","division":"CARRY OPTICS","hit_factor":5.0304},{"match_name":"CIPSC IL Havana May USPSA","match_date":"2021-05-08","stage_classifiercode":"20-01","member_number":"Ty34796","first_name":"JAMES","last_name":"DAVIDSON","classification":"B","division":"CARRY OPTICS","hit_factor":5.0304},{"match_name":"TPS USPSA At CMP July 17 2021","match_date":"2021-07-17","stage_classifiercode":"20-01","member_number":"Ty114311","first_name":"TYLER","last_name":"BARTLETT","classification":"M","division":"CARRY OPTICS","hit_factor":5.0287},{"match_name":"Extreme GM uspsa Nov-13","match_date":"2021-11-13","stage_classifiercode":"20-01","member_number":"A98372","first_name":"BORGES","last_name":"WILFREDO","classification":"B","division":"CARRY OPTICS","hit_factor":5.0286},{"match_name":"Richmond Boro Gun Club Monthly USPSA Match May 2021","match_date":"2021-05-08","stage_classifiercode":"20-01","member_number":"A106529","first_name":"FRANK","last_name":"RIZZI","classification":"B","division":"CARRY OPTICS","hit_factor":5.0262},{"match_name":"Richmond Boro Gun Club Monthly USPSA Match May 2021","match_date":"2021-05-08","stage_classifiercode":"20-01","member_number":"A113668","first_name":"RICHARD","last_name":"ASCHER","classification":"B","division":"CARRY OPTICS","hit_factor":5.0233},{"match_name":"OPSC USPSA JUNE 2021","match_date":"2021-06-13","stage_classifiercode":"20-01","member_number":"A65099","first_name":"JOHN","last_name":"MURPHY","classification":"C","division":"CARRY OPTICS","hit_factor":5.0218},{"match_name":"WLPS May 2021 ALL USPSA Classifier Match ","match_date":"2021-05-23","stage_classifiercode":"20-01","member_number":"A120025","first_name":"NICHOLAS","last_name":"GRADY","classification":"U","division":"CARRY OPTICS","hit_factor":5.0179},{"match_name":"QPS Quantico Shooting Club December USPSA   ","match_date":"2020-12-12","stage_classifiercode":"20-01","member_number":"A129848","first_name":"MATT","last_name":"MAHOVICH","classification":"U","division":"CARRY OPTICS","hit_factor":5.0173},{"match_name":"YRPA USPSA May 2nd 2021","match_date":"2021-05-02","stage_classifiercode":"20-01","member_number":"TY100339","first_name":"CHRIS","last_name":"MCMEEN","classification":"A","division":"CARRY OPTICS","hit_factor":5.0136},{"match_name":"PIPS 04-28-2021","match_date":"2021-04-27","stage_classifiercode":"20-01","member_number":"TY101880","first_name":"JOEY","last_name":"BETELAK","classification":"U","division":"CARRY OPTICS","hit_factor":5.0134},{"match_name":"Square Deal Sportsmen June USPSA Match 2021","match_date":"2021-06-06","stage_classifiercode":"20-01","member_number":"A93292","first_name":"CRAIG","last_name":"SANTASIERO","classification":"B","division":"CARRY OPTICS","hit_factor":5.0104},{"match_name":"BORCC USPSA April 2021","match_date":"2021-04-17","stage_classifiercode":"20-01","member_number":"A114937","first_name":"HEATH","last_name":"FENTRESS","classification":"C","division":"CARRY OPTICS","hit_factor":5.0096},{"match_name":"EAGC January 2021 USPSA Classifier Match","match_date":"2021-01-30","stage_classifiercode":"20-01","member_number":"A121673","first_name":"JEFF","last_name":"LIU","classification":"A","division":"CARRY OPTICS","hit_factor":5.0046},{"match_name":"GoShoot Outdoor A6 Warm up And Classifier match!","match_date":"2021-04-03","stage_classifiercode":"20-01","member_number":"A108977","first_name":"RJ","last_name":"MCVOY","classification":"M","division":"CARRY OPTICS","hit_factor":5},{"match_name":"Cowtown Pistol Club USPSA MONDAY November 1 2021","match_date":"2021-11-02","stage_classifiercode":"20-01","member_number":"A132368","first_name":"TYLER","last_name":"SCHRAMECK","classification":"B","division":"CARRY OPTICS","hit_factor":5},{"match_name":"DCSC MONTHLY USPSA MATCH","match_date":"2021-07-02","stage_classifiercode":"20-01","member_number":"A99415","first_name":"GENE","last_name":"FAUL","classification":"B","division":"CARRY OPTICS","hit_factor":5},{"match_name":"Ontelaunee USPSA November 2020","match_date":"2020-11-20","stage_classifiercode":"20-01","member_number":"A76022","first_name":"MASHU","last_name":"KOBAYASHI","classification":"B","division":"CARRY OPTICS","hit_factor":4.9954},{"match_name":"Homestead USPSA June Classifier Match 2021","match_date":"2021-06-20","stage_classifiercode":"20-01","member_number":"FY127798","first_name":"ALEJANDRO","last_name":"ALONSO","classification":"C","division":"CARRY OPTICS","hit_factor":4.995},{"match_name":"Harvard Action Shooters May 2021 USPSA Pistol Match","match_date":"2021-05-02","stage_classifiercode":"20-01","member_number":"TY99763","first_name":"ANDREW","last_name":"CHAN","classification":"B","division":"CARRY OPTICS","hit_factor":4.9914},{"match_name":"GCL Saturday 4-3-2021","match_date":"2021-04-03","stage_classifiercode":"20-01","member_number":"A109114","first_name":"FAUSTO","last_name":"PRATTICO","classification":"C","division":"CARRY OPTICS","hit_factor":4.9914},{"match_name":"EWPSA 2021-04","match_date":"2021-04-17","stage_classifiercode":"20-01","member_number":"A131479","first_name":"JOSEPH","last_name":"IGLESIAS","classification":"U","division":"CARRY OPTICS","hit_factor":4.9914},{"match_name":"Medford USPSA March 2021 OR-04","match_date":"2021-03-21","stage_classifiercode":"20-01","member_number":"A84091","first_name":"DAN","last_name":"GETTLING","classification":"B","division":"CARRY OPTICS","hit_factor":4.9908},{"match_name":"November All-Classifier USPSA Match at C and C Indoor Range","match_date":"2020-11-17","stage_classifiercode":"20-01","member_number":"A111476","first_name":"VINCE","last_name":"POTEET","classification":"B","division":"CARRY OPTICS","hit_factor":4.99},{"match_name":"MCAS MAY 2021 USPSA","match_date":"2021-05-15","stage_classifiercode":"20-01","member_number":"Ty13940","first_name":"MAC","last_name":"CLARK","classification":"B","division":"CARRY OPTICS","hit_factor":4.9871},{"match_name":"NW01 T-Day 2020","match_date":"2020-11-08","stage_classifiercode":"20-01","member_number":"Ty108653","first_name":"LUKE","last_name":"SCHWEBKE","classification":"B","division":"CARRY OPTICS","hit_factor":4.9866},{"match_name":"CIPSC IL02 Havana August USPSA","match_date":"2021-08-07","stage_classifiercode":"20-01","member_number":"A104414","first_name":"STEVE","last_name":"EDGE","classification":"B","division":"CARRY OPTICS","hit_factor":4.9861},{"match_name":"Shasta Shooters 2021 June","match_date":"2021-06-12","stage_classifiercode":"20-01","member_number":"TY95382","first_name":"TONY","last_name":"CHEN","classification":"U","division":"CARRY OPTICS","hit_factor":4.985},{"match_name":"Quinton USPSA - April 10 2021","match_date":"2021-04-10","stage_classifiercode":"20-01","member_number":"A106520","first_name":"BEN","last_name":"PLAPPERT","classification":"C","division":"CARRY OPTICS","hit_factor":4.9834},{"match_name":"CIPSC IL02 Havana August USPSA","match_date":"2021-08-07","stage_classifiercode":"20-01","member_number":"FY99127","first_name":"STEVE","last_name":"FRAZIER","classification":"C","division":"CARRY OPTICS","hit_factor":4.9815},{"match_name":"EHPSA USPSA 26 September 2021","match_date":"2021-09-26","stage_classifiercode":"20-01","member_number":"A122042","first_name":"BRIAN","last_name":"HELFRICH","classification":"B","division":"CARRY OPTICS","hit_factor":4.9815},{"match_name":"Matamoras USPSA September 2021","match_date":"2021-09-19","stage_classifiercode":"20-01","member_number":"TY98580","first_name":"JASON","last_name":"SENDELSKY","classification":"M","division":"CARRY OPTICS","hit_factor":4.9813},{"match_name":"SOAP July 2021 USPSA Match","match_date":"2021-07-11","stage_classifiercode":"20-01","member_number":"Ty44154","first_name":"KEITH","last_name":"GARCIA","classification":"U","division":"CARRY OPTICS","hit_factor":4.9793},{"match_name":"Shasta Shooters 2021 June","match_date":"2021-06-12","stage_classifiercode":"20-01","member_number":"TY114067","first_name":"DAVID","last_name":"DUARTE","classification":"C","division":"CARRY OPTICS","hit_factor":4.977},{"match_name":"Shasta Shooters 2021 Jan","match_date":"2021-01-09","stage_classifiercode":"20-01","member_number":"A130896","first_name":"GRIFFITH","last_name":"TONKIN","classification":"U","division":"CARRY OPTICS","hit_factor":4.977},{"match_name":"Chillicothe Sportsmens Club July USPSA","match_date":"2021-07-24","stage_classifiercode":"20-01","member_number":"TY104414","first_name":"STEVE","last_name":"EDGE","classification":"B","division":"CARRY OPTICS","hit_factor":4.977},{"match_name":"SFA USPSA November 20 2021 MATCH","match_date":"2021-11-20","stage_classifiercode":"20-01","member_number":"A87496","first_name":"BOBBY","last_name":"KOLVET","classification":"A","division":"CARRY OPTICS","hit_factor":4.9731},{"match_name":"GoShoot Outdoor A6 Warm up And Classifier match!","match_date":"2021-04-03","stage_classifiercode":"20-01","member_number":"a126334","first_name":"DAVID","last_name":"MCFADYEN","classification":"C","division":"CARRY OPTICS","hit_factor":4.9678},{"match_name":"Shadow Hawk Defense - USPSA Dec 13th","match_date":"2020-12-13","stage_classifiercode":"20-01","member_number":"A126613","first_name":"YAN","last_name":"WU","classification":"U","division":"CARRY OPTICS","hit_factor":4.9678},{"match_name":"SPSA USPSA January 1st Sat Match","match_date":"2021-01-02","stage_classifiercode":"20-01","member_number":"A111476","first_name":"VINCE","last_name":"POTEET","classification":"B","division":"CARRY OPTICS","hit_factor":4.9676},{"match_name":"SPSA USPSA January 1st Sat Match","match_date":"2021-01-02","stage_classifiercode":"20-01","member_number":"A127992","first_name":"JARROD","last_name":"HILL","classification":"B","division":"CARRY OPTICS","hit_factor":4.9645},{"match_name":"OPSC USPSA JUNE 2021","match_date":"2021-06-13","stage_classifiercode":"20-01","member_number":"TY131349","first_name":"VAN","last_name":"LAM","classification":"B","division":"CARRY OPTICS","hit_factor":4.9638},{"match_name":"Bossier Parish Practical Shooters March 21 2021","match_date":"2021-03-21","stage_classifiercode":"20-01","member_number":"TY116349","first_name":"OWEN","last_name":"MCDONNELL","classification":"B","division":"CARRY OPTICS","hit_factor":4.9628},{"match_name":"MPSA 2020-11-21","match_date":"2020-11-21","stage_classifiercode":"20-01","member_number":"TY103705","first_name":"BLAKE","last_name":"ARNOLD","classification":"A","division":"CARRY OPTICS","hit_factor":4.9624},{"match_name":"Hampden RPC November USPSA Match","match_date":"2020-11-08","stage_classifiercode":"20-01","member_number":"TY104803","first_name":"BOBBY","last_name":"HUKKI","classification":"C","division":"CARRY OPTICS","hit_factor":4.9601},{"match_name":"GoShoot Outdoor A6 Warm up And Classifier match!","match_date":"2021-04-03","stage_classifiercode":"20-01","member_number":"A28661","first_name":"DAVID","last_name":"CRAIG","classification":"C","division":"CARRY OPTICS","hit_factor":4.9587},{"match_name":"CTASA - 3rd Sunday USPSA at Triple C Range - 12-20-2020","match_date":"2020-12-20","stage_classifiercode":"20-01","member_number":"TY92077","first_name":"DONNIE","last_name":"STONE","classification":"U","division":"CARRY OPTICS","hit_factor":4.9587},{"match_name":"WGC AUGUST 2021 USPSA CLASSIFIER MATCH","match_date":"2021-08-08","stage_classifiercode":"20-01","member_number":"A122138","first_name":"BUCK","last_name":"BURNS","classification":"B","division":"CARRY OPTICS","hit_factor":4.9577},{"match_name":"Bossier Parish Practical Shooters November 21 2021","match_date":"2021-11-21","stage_classifiercode":"20-01","member_number":"A136492","first_name":"NICK","last_name":"REESE","classification":"U","division":"CARRY OPTICS","hit_factor":4.9571},{"match_name":"Heartland PS USPSA *ALL CLASSIFIER* 18 July 2021","match_date":"2021-07-18","stage_classifiercode":"20-01","member_number":"TY96769","first_name":"BILL","last_name":"STEEN","classification":"C","division":"CARRY OPTICS","hit_factor":4.9571},{"match_name":"ENPS September 2021 USPSA Match","match_date":"2021-09-04","stage_classifiercode":"20-01","member_number":"A133959","first_name":"JEFF","last_name":"FOWLER","classification":"B","division":"CARRY OPTICS","hit_factor":4.9514},{"match_name":"OREGON ARPC CC05 USPSA OCT 9 2021","match_date":"2021-10-09","stage_classifiercode":"20-01","member_number":"TY98534","first_name":"CLIFF","last_name":"WRIGHT","classification":"B","division":"CARRY OPTICS","hit_factor":4.947},{"match_name":"NISA August 2021","match_date":"2021-08-22","stage_classifiercode":"20-01","member_number":"A122495","first_name":"STEVEN","last_name":"LO VULLO","classification":"C","division":"CARRY OPTICS","hit_factor":4.9464},{"match_name":"RPS January 2021 USPSA Match","match_date":"2021-01-09","stage_classifiercode":"20-01","member_number":"TY93719","first_name":"JOHN","last_name":"WESTBROOK","classification":"A","division":"CARRY OPTICS","hit_factor":4.9456},{"match_name":"JCSSA DEC 5 2020","match_date":"2020-12-05","stage_classifiercode":"20-01","member_number":"TY101659","first_name":"MARK","last_name":"DRAPER","classification":"C","division":"CARRY OPTICS","hit_factor":4.9426},{"match_name":"OREGON ARPC CC05 USPSA OCT 9 2021","match_date":"2021-10-09","stage_classifiercode":"20-01","member_number":"A134468","first_name":"RANDAL","last_name":"LEE","classification":"C","division":"CARRY OPTICS","hit_factor":4.9426},{"match_name":"LdF USPSA Match November 7 2021","match_date":"2021-11-07","stage_classifiercode":"20-01","member_number":"A109799","first_name":"MIKE","last_name":"VIVES","classification":"B","division":"CARRY OPTICS","hit_factor":4.9383},{"match_name":"GRB USPSA JANUARY 2021 AT CAVALIER","match_date":"2021-01-16","stage_classifiercode":"20-01","member_number":"FY32906","first_name":"TERRANCE","last_name":"BAILADO","classification":"B","division":"CARRY OPTICS","hit_factor":4.9362},{"match_name":"GRB USPSA JANUARY 2021 AT CAVALIER","match_date":"2021-01-16","stage_classifiercode":"20-01","member_number":"A50322","first_name":"MAX","last_name":"DELO","classification":"C","division":"CARRY OPTICS","hit_factor":4.936},{"match_name":"Hampden RPC November USPSA Match","match_date":"2020-11-08","stage_classifiercode":"20-01","member_number":"A62983","first_name":"DARRELL","last_name":"KING","classification":"C","division":"CARRY OPTICS","hit_factor":4.936},{"match_name":"Oh Shoot -PRG Nov 27th - Uspsa Classifier Match","match_date":"2021-11-27","stage_classifiercode":"20-01","member_number":"Ty136731","first_name":"JUSTIN","last_name":"RADLEY","classification":"U","division":"CARRY OPTICS","hit_factor":4.9339},{"match_name":"USPSA Strategic Edge SEGR May 15th 2021","match_date":"2021-05-15","stage_classifiercode":"20-01","member_number":"TY89678","first_name":"JOEL","last_name":"VALLEJO","classification":"C","division":"CARRY OPTICS","hit_factor":4.9336},{"match_name":"Heartland PS USPSA Monthly 21 March 2021","match_date":"2021-03-21","stage_classifiercode":"20-01","member_number":"TY123292","first_name":"STEPHEN","last_name":"TOMILSON","classification":"U","division":"CARRY OPTICS","hit_factor":4.9336},{"match_name":"EHPSA USPSA 26 September 2021","match_date":"2021-09-26","stage_classifiercode":"20-01","member_number":"TY40651","first_name":"RON","last_name":"RODGERS","classification":"B","division":"CARRY OPTICS","hit_factor":4.9336},{"match_name":"Medford USPSA March 2021 OR-04","match_date":"2021-03-21","stage_classifiercode":"20-01","member_number":"A106395","first_name":"ROBERT","last_name":"KELTY","classification":"B","division":"CARRY OPTICS","hit_factor":4.9302},{"match_name":"Richmond Hot Shots Aug 14-15-2021 USPSA","match_date":"2021-08-14","stage_classifiercode":"20-01","member_number":"A134116","first_name":"DANIEL","last_name":"HER","classification":"U","division":"CARRY OPTICS","hit_factor":4.927},{"match_name":"Maine Practical Shooters May 2021","match_date":"2021-05-08","stage_classifiercode":"20-01","member_number":"a62983","first_name":"DARRELL","last_name":"KING","classification":"C","division":"CARRY OPTICS","hit_factor":4.9252},{"match_name":"ENPS September 2021 USPSA Match","match_date":"2021-09-04","stage_classifiercode":"20-01","member_number":"TY95559","first_name":"ZACH","last_name":"COLHOUR","classification":"U","division":"CARRY OPTICS","hit_factor":4.9252},{"match_name":"SPSA USPSA January 1st Sat Match","match_date":"2021-01-02","stage_classifiercode":"20-01","member_number":"A8318","first_name":"BOB","last_name":"BAILEY","classification":"M","division":"CARRY OPTICS","hit_factor":4.9242},{"match_name":"Matamoras USPSA September 2021","match_date":"2021-09-19","stage_classifiercode":"20-01","member_number":"TY60043","first_name":"CHRISTOPHER","last_name":"PRIMAVERA","classification":"C","division":"CARRY OPTICS","hit_factor":4.9225},{"match_name":"SWGC USPSA Pistol Match - May 2021","match_date":"2021-05-01","stage_classifiercode":"20-01","member_number":"A90156","first_name":"STEVE","last_name":"EVERETT","classification":"M","division":"CARRY OPTICS","hit_factor":4.922},{"match_name":"LGCSEMPS April 2021 Special Classifier","match_date":"2021-04-11","stage_classifiercode":"20-01","member_number":"TY21120","first_name":"ERIC","last_name":"LARSEN","classification":"U","division":"CARRY OPTICS","hit_factor":4.918},{"match_name":"JCSSA DEC 5 2020","match_date":"2020-12-05","stage_classifiercode":"20-01","member_number":"A130759","first_name":"TODD","last_name":"FLETCHER","classification":"U","division":"CARRY OPTICS","hit_factor":4.9166},{"match_name":"Richmond Hot Shots Aug 14-15-2021 USPSA","match_date":"2021-08-14","stage_classifiercode":"20-01","member_number":"A131187","first_name":"PATRICK","last_name":"PRADO","classification":"U","division":"CARRY OPTICS","hit_factor":4.9136},{"match_name":"KSA USPSA  3 April 2021","match_date":"2021-04-03","stage_classifiercode":"20-01","member_number":"A119314","first_name":"TRAVIS","last_name":"TURNER","classification":"A","division":"CARRY OPTICS","hit_factor":4.9057},{"match_name":"Shadow Hawk Defense USPSA - Sep Sat","match_date":"2021-09-11","stage_classifiercode":"20-01","member_number":"A135552","first_name":"BRAD","last_name":"SARRIS","classification":"U","division":"CARRY OPTICS","hit_factor":4.9057},{"match_name":"Ontelaunee USPSA November 2020","match_date":"2020-11-20","stage_classifiercode":"20-01","member_number":"A128133","first_name":"DAVID","last_name":"ROLLER","classification":"C","division":"CARRY OPTICS","hit_factor":4.9046},{"match_name":"RPS January 2021 USPSA Match","match_date":"2021-01-09","stage_classifiercode":"20-01","member_number":"A106258","first_name":"DAVID","last_name":"BARKER","classification":"B","division":"CARRY OPTICS","hit_factor":4.9037},{"match_name":"FBURG September 2021 USPSA","match_date":"2021-09-05","stage_classifiercode":"20-01","member_number":"A127230","first_name":"CHRIS","last_name":"BENDEN","classification":"C","division":"CARRY OPTICS","hit_factor":4.898},{"match_name":"SCPS ECO19 January 23rd 2021","match_date":"2021-01-22","stage_classifiercode":"20-01","member_number":"A127841","first_name":"DANNY","last_name":"WOODS","classification":"C","division":"CARRY OPTICS","hit_factor":4.8957},{"match_name":"Quinton USPSA - April 10 2021","match_date":"2021-04-10","stage_classifiercode":"20-01","member_number":"Ty49074","first_name":"GARY","last_name":"JONES","classification":"A","division":"CARRY OPTICS","hit_factor":4.8936},{"match_name":"Shadow Hawk Defense USPSA - Sep Sat","match_date":"2021-09-11","stage_classifiercode":"20-01","member_number":"A80461","first_name":"MICHAEL","last_name":"WIESNER","classification":"A","division":"CARRY OPTICS","hit_factor":4.8936},{"match_name":"TPS USPSA at CMP Dec 19 2020 Special Classifier Match","match_date":"2020-12-19","stage_classifiercode":"20-01","member_number":"A118818","first_name":"BRIAN","last_name":"ROY","classification":"B","division":"CARRY OPTICS","hit_factor":4.8908},{"match_name":"Maine Practical Shooters May 2021","match_date":"2021-05-08","stage_classifiercode":"20-01","member_number":"A121236","first_name":"CODY","last_name":"WILLIAMS","classification":"B","division":"CARRY OPTICS","hit_factor":4.8876},{"match_name":"Shadow Hawk Defense USPSA - Sep Sat","match_date":"2021-09-11","stage_classifiercode":"20-01","member_number":"A136811","first_name":"ANDREW","last_name":"SULLIVAN","classification":"U","division":"CARRY OPTICS","hit_factor":4.8828},{"match_name":"Belton Gun Club USPSA March Classifier MATCH 3-7-21","match_date":"2021-03-07","stage_classifiercode":"20-01","member_number":"TY60473","first_name":"KEVIN","last_name":"BARNEY","classification":"U","division":"CARRY OPTICS","hit_factor":4.8826},{"match_name":"Oh Shoot -PRG Nov 27th - Uspsa Classifier Match","match_date":"2021-11-27","stage_classifiercode":"20-01","member_number":"A118386","first_name":"ALEXANDER","last_name":"LITWINENKO","classification":"U","division":"CARRY OPTICS","hit_factor":4.8823},{"match_name":"Oh Shoot -PRG Nov 27th - Uspsa Classifier Match","match_date":"2021-11-27","stage_classifiercode":"20-01","member_number":"A137331","first_name":"JASON","last_name":"HOCK","classification":"U","division":"CARRY OPTICS","hit_factor":4.878},{"match_name":"Shasta Shooters 2021 June","match_date":"2021-06-12","stage_classifiercode":"20-01","member_number":"A114013","first_name":"KYLE","last_name":"BROWN","classification":"B","division":"CARRY OPTICS","hit_factor":4.878},{"match_name":"QPS Quantico Shooting Club December USPSA   ","match_date":"2020-12-12","stage_classifiercode":"20-01","member_number":"TY112159","first_name":"RICHARD","last_name":"WAINWRIGHT","classification":"C","division":"CARRY OPTICS","hit_factor":4.8736},{"match_name":"LGCSEMPS April 2021 Special Classifier","match_date":"2021-04-11","stage_classifiercode":"20-01","member_number":"A133433","first_name":"ZACH","last_name":"HUDSON","classification":"U","division":"CARRY OPTICS","hit_factor":4.8731},{"match_name":"Ontelaunee USPSA November 2020","match_date":"2020-11-20","stage_classifiercode":"20-01","member_number":"L1158","first_name":"JIM","last_name":"HAND","classification":"A","division":"CARRY OPTICS","hit_factor":4.8731},{"match_name":"RBGC USPSA 2021-01-23","match_date":"2021-01-23","stage_classifiercode":"20-01","member_number":"A109744","first_name":"TUCKER","last_name":"JUDD","classification":"C","division":"CARRY OPTICS","hit_factor":4.8701},{"match_name":"Hosemonster Action  ","match_date":"2021-01-17","stage_classifiercode":"20-01","member_number":"TY17315","first_name":"RON","last_name":"NAKABAYASHI","classification":"B","division":"CARRY OPTICS","hit_factor":4.8693},{"match_name":"Wallis Orchard Practical Shooters April 2021 Club Match","match_date":"2021-04-18","stage_classifiercode":"20-01","member_number":"Ty66330","first_name":"MARLON","last_name":"PORALAN","classification":"C","division":"CARRY OPTICS","hit_factor":4.8658},{"match_name":"2020-12-05 USPSA  at Phoenix Rod and Gun Club","match_date":"2020-12-05","stage_classifiercode":"20-01","member_number":"TY46968","first_name":"STEVEN","last_name":"REDIES","classification":"B","division":"CARRY OPTICS","hit_factor":4.8658},{"match_name":"APSC USPSA 08-21-21","match_date":"2021-08-21","stage_classifiercode":"20-01","member_number":"A131182","first_name":"LUCA","last_name":"BARBERA","classification":"C","division":"CARRY OPTICS","hit_factor":4.8658},{"match_name":"Square Deal Sportsmen June USPSA Match 2021","match_date":"2021-06-06","stage_classifiercode":"20-01","member_number":"A130008","first_name":"KEVIN","last_name":"KRINER","classification":"U","division":"CARRY OPTICS","hit_factor":4.8617},{"match_name":"STAGE ZERO ALL CLASSIFIER","match_date":"2021-09-04","stage_classifiercode":"20-01","member_number":"A136184","first_name":"ANTONIO","last_name":"FLOREZ2","classification":"U","division":"CARRY OPTICS","hit_factor":4.8611},{"match_name":"Collin County USPSA  08-22-2021","match_date":"2021-08-22","stage_classifiercode":"20-01","member_number":"A133489","first_name":"ANDREW","last_name":"CRUZ","classification":"U","division":"CARRY OPTICS","hit_factor":4.8605},{"match_name":"CTASA - 3rd Sunday USPSA at Triple C Range - 12-20-2020","match_date":"2020-12-20","stage_classifiercode":"20-01","member_number":"A130277","first_name":"MARK","last_name":"DEPAOLO","classification":"","division":"CARRY OPTICS","hit_factor":4.8605},{"match_name":"Pioneer Action Shooters USPSA 11-15-20","match_date":"2020-11-15","stage_classifiercode":"20-01","member_number":"A121236","first_name":"CODY","last_name":"WILLIAMS","classification":"B","division":"CARRY OPTICS","hit_factor":4.8598},{"match_name":"QPS Quantico Shooting Club December USPSA   ","match_date":"2020-12-12","stage_classifiercode":"20-01","member_number":"A114651","first_name":"JIMMY","last_name":"BUNN","classification":"U","division":"CARRY OPTICS","hit_factor":4.8576},{"match_name":"Payson Practical Shooters USPSA Dec 5  2020","match_date":"2020-12-05","stage_classifiercode":"20-01","member_number":"TY65635","first_name":"CHRIS","last_name":"COLLINS","classification":"U","division":"CARRY OPTICS","hit_factor":4.8544},{"match_name":"Chillicothe Sportsmens Club July USPSA","match_date":"2021-07-24","stage_classifiercode":"20-01","member_number":"A109460","first_name":"DONALD","last_name":"DILLON","classification":"A","division":"CARRY OPTICS","hit_factor":4.8544},{"match_name":"LIPSA  - March  21st  2021 - March Madness USPSA Match ","match_date":"2021-03-21","stage_classifiercode":"20-01","member_number":"TY120855","first_name":"TOMASZ","last_name":"SANCZENKO","classification":"B","division":"CARRY OPTICS","hit_factor":4.8512},{"match_name":"GFDS POSTAL MATCH USPSA 10/2/2021 hosted by Glacier Practical Shooters","match_date":"2021-10-02","stage_classifiercode":"20-01","member_number":"ty101382","first_name":"ANDREW","last_name":"MCDOUGALL","classification":"B","division":"CARRY OPTICS","hit_factor":4.8495},{"match_name":"SOAP July 2021 USPSA Match","match_date":"2021-07-11","stage_classifiercode":"20-01","member_number":"A60193","first_name":"JOHN","last_name":"GUIDERO","classification":"C","division":"CARRY OPTICS","hit_factor":4.8485},{"match_name":"Bossier Parish Practical Shooters March 21 2021","match_date":"2021-03-21","stage_classifiercode":"20-01","member_number":"Ty97639","first_name":"JASON","last_name":"WATTS","classification":"G","division":"CARRY OPTICS","hit_factor":4.8485},{"match_name":"Ontelaunee USPSA November 2020","match_date":"2020-11-20","stage_classifiercode":"20-01","member_number":"A126835","first_name":"LAKE","last_name":"SERAFIN","classification":"U","division":"CARRY OPTICS","hit_factor":4.8454},{"match_name":"LdF USPSA Match November 7 2021","match_date":"2021-11-07","stage_classifiercode":"20-01","member_number":"A105550","first_name":"BLAINE","last_name":"DAVAZ","classification":"B","division":"CARRY OPTICS","hit_factor":4.8421},{"match_name":"OREGON ARPC CC05 USPSA NOVEMBER 14 2020","match_date":"2020-11-14","stage_classifiercode":"20-01","member_number":"A121896","first_name":"KYLE","last_name":"JAMESON","classification":"B","division":"CARRY OPTICS","hit_factor":4.8403},{"match_name":"FBURG September 2021 USPSA","match_date":"2021-09-05","stage_classifiercode":"20-01","member_number":"A121028","first_name":"MIKE","last_name":"HUBBARD","classification":"C","division":"CARRY OPTICS","hit_factor":4.8387},{"match_name":"ARPC USPSA Match 4-25-21","match_date":"2021-04-25","stage_classifiercode":"20-01","member_number":"A114202","first_name":"AARON","last_name":"KOHLER","classification":"B","division":"CARRY OPTICS","hit_factor":4.8374},{"match_name":"CCPS July 2021 USPSA","match_date":"2021-07-04","stage_classifiercode":"20-01","member_number":"A112762","first_name":"CARY","last_name":"BROSA","classification":"C","division":"CARRY OPTICS","hit_factor":4.8372},{"match_name":"LIPSA  - March  21st  2021 - March Madness USPSA Match ","match_date":"2021-03-21","stage_classifiercode":"20-01","member_number":"TY121241","first_name":"FRANK","last_name":"JAEGER","classification":"C","division":"CARRY OPTICS","hit_factor":4.8348},{"match_name":"QPS Quantico Shooting Club December USPSA   ","match_date":"2020-12-12","stage_classifiercode":"20-01","member_number":"TY129368","first_name":"JAMES","last_name":"DRAKE","classification":"U","division":"CARRY OPTICS","hit_factor":4.8348},{"match_name":"Bossier Parish Practical Shooters November 21 2021","match_date":"2021-11-21","stage_classifiercode":"20-01","member_number":"A133624","first_name":"JASON","last_name":"FERTAL","classification":"D","division":"CARRY OPTICS","hit_factor":4.8344},{"match_name":"Medford USPSA March 2021 OR-04","match_date":"2021-03-21","stage_classifiercode":"20-01","member_number":"A130369","first_name":"JOSEPH","last_name":"STUART","classification":"U","division":"CARRY OPTICS","hit_factor":4.8344},{"match_name":"Homestead USPSA June Classifier Match 2021","match_date":"2021-06-20","stage_classifiercode":"20-01","member_number":"A106652","first_name":"MATTHEW","last_name":"GNAD","classification":"U","division":"CARRY OPTICS","hit_factor":4.8333},{"match_name":"Payson Practical Shooters USPSA Dec 5  2020","match_date":"2020-12-05","stage_classifiercode":"20-01","member_number":"ty92310","first_name":"STACY","last_name":"MISINO","classification":"C","division":"CARRY OPTICS","hit_factor":4.8318},{"match_name":"Matamoras USPSA September 2021","match_date":"2021-09-19","stage_classifiercode":"20-01","member_number":"A96271","first_name":"BEN","last_name":"ADAMS","classification":"U","division":"CARRY OPTICS","hit_factor":4.8309},{"match_name":"RPS January 2021 USPSA Match","match_date":"2021-01-09","stage_classifiercode":"20-01","member_number":"A111436","first_name":"JASON","last_name":"HUNNICUTT","classification":"B","division":"CARRY OPTICS","hit_factor":4.8241},{"match_name":"LIPSA  - March  21st  2021 - March Madness USPSA Match ","match_date":"2021-03-21","stage_classifiercode":"20-01","member_number":"A110843","first_name":"CHRIS","last_name":"HAHN","classification":"B","division":"CARRY OPTICS","hit_factor":4.8148},{"match_name":"TTS USPSA Match 12JUN2021","match_date":"2021-06-12","stage_classifiercode":"20-01","member_number":"A86498","first_name":"ALEX","last_name":"GOBEN","classification":"A","division":"CARRY OPTICS","hit_factor":4.8148},{"match_name":"Southern Kentucky Gun Club USPSA April Match","match_date":"2021-04-25","stage_classifiercode":"20-01","member_number":"L4035","first_name":"TOM","last_name":"OWENS","classification":"B","division":"CARRY OPTICS","hit_factor":4.8148},{"match_name":"Cameo USPSA Match November 21 2020","match_date":"2020-11-21","stage_classifiercode":"20-01","member_number":"TY124186","first_name":"KARA","last_name":"HALL","classification":"C","division":"CARRY OPTICS","hit_factor":4.8115},{"match_name":"Southern Kentucky Gun Club USPSA April Match","match_date":"2021-04-25","stage_classifiercode":"20-01","member_number":"TY71085","first_name":"DARYL","last_name":"EASLEY","classification":"U","division":"CARRY OPTICS","hit_factor":4.8077},{"match_name":"Hosemonster Action  ","match_date":"2021-01-17","stage_classifiercode":"20-01","member_number":"a83657","first_name":"ROBERT","last_name":"RABINO","classification":"C","division":"CARRY OPTICS","hit_factor":4.8069},{"match_name":"APSC USPSA 11-7-20","match_date":"2020-11-07","stage_classifiercode":"20-01","member_number":"A92760","first_name":"MIKE","last_name":"REED","classification":"C","division":"CARRY OPTICS","hit_factor":4.8038},{"match_name":"Triforce Practical Shooters at Big Woods Goods 03-25-2021","match_date":"2021-03-25","stage_classifiercode":"20-01","member_number":"A130410","first_name":"BOB","last_name":"MANKER","classification":"U","division":"CARRY OPTICS","hit_factor":4.8013},{"match_name":"RDS June 2021 USPSA Match","match_date":"2021-06-05","stage_classifiercode":"20-01","member_number":"A101376","first_name":"SHANE","last_name":"MACON","classification":"A","division":"CARRY OPTICS","hit_factor":4.7974},{"match_name":"Pioneer Action Shooters USPSA 11-15-20","match_date":"2020-11-15","stage_classifiercode":"20-01","member_number":"A122347","first_name":"LEONEL","last_name":"KLASSEN","classification":"C","division":"CARRY OPTICS","hit_factor":4.7962},{"match_name":"TPS USPSA At CMP July 17 2021","match_date":"2021-07-17","stage_classifiercode":"20-01","member_number":"TY41492","first_name":"MARK","last_name":"HEARN","classification":"B","division":"CARRY OPTICS","hit_factor":4.7945},{"match_name":"GoShoot Outdoor A6 Warm up And Classifier match!","match_date":"2021-04-03","stage_classifiercode":"20-01","member_number":"A83833","first_name":"LUKAS","last_name":"HERBST","classification":"U","division":"CARRY OPTICS","hit_factor":4.7885},{"match_name":"SCPS ECO19 January 23rd 2021","match_date":"2021-01-22","stage_classifiercode":"20-01","member_number":"TY72960","first_name":"JOEL","last_name":"WHITTINGTON","classification":"B","division":"CARRY OPTICS","hit_factor":4.7882},{"match_name":"LCSC Linden USPSA 122720","match_date":"2020-12-27","stage_classifiercode":"20-01","member_number":"A112143","first_name":"CHARLES","last_name":"LEUBNER","classification":"C","division":"CARRY OPTICS","hit_factor":4.7872},{"match_name":"DSSA 2021-02 USPSA Pistol","match_date":"2021-02-28","stage_classifiercode":"20-01","member_number":"A104207","first_name":"SCOTT","last_name":"BRAATEN","classification":"U","division":"CARRY OPTICS","hit_factor":4.7863},{"match_name":"Mvpsa USPSA November 7 2020","match_date":"2020-11-07","stage_classifiercode":"20-01","member_number":"a119052","first_name":"BRIGGS","last_name":"ED","classification":"C","division":"CARRY OPTICS","hit_factor":4.7809},{"match_name":"SPSA USPSA January 1st Sat Match","match_date":"2021-01-02","stage_classifiercode":"20-01","member_number":"A106258","first_name":"DAVID","last_name":"BARKER","classification":"B","division":"CARRY OPTICS","hit_factor":4.7809},{"match_name":"Medford USPSA March 2021 OR-04","match_date":"2021-03-21","stage_classifiercode":"20-01","member_number":"L4326","first_name":"DAN","last_name":"MCDONNELL","classification":"B","division":"CARRY OPTICS","hit_factor":4.7776},{"match_name":"Dundee Practical Shooters - Feb 27 2021","match_date":"2021-02-27","stage_classifiercode":"20-01","member_number":"N/A","first_name":"RYAN","last_name":"BANCROFT","classification":"U","division":"CARRY OPTICS","hit_factor":4.7745},{"match_name":"USPSA MO21 2Alpha SBRC December 26 2020","match_date":"2020-12-26","stage_classifiercode":"20-01","member_number":"A100327","first_name":"DARELL","last_name":"BANDY","classification":"U","division":"CARRY OPTICS","hit_factor":4.7706},{"match_name":"LdF USPSA Classifier Match December 12 2020","match_date":"2020-12-12","stage_classifiercode":"20-01","member_number":"A127117","first_name":"ANDY","last_name":"TIEN","classification":"A","division":"CARRY OPTICS","hit_factor":4.7703},{"match_name":"USPSA MO21 2Alpha SBRC December 26 2020","match_date":"2020-12-26","stage_classifiercode":"20-01","member_number":"A104380","first_name":"MELISSA","last_name":"ODOM","classification":"U","division":"CARRY OPTICS","hit_factor":4.7703},{"match_name":"Nampa USPSA September 10th 2021 Classifier Match","match_date":"2021-09-10","stage_classifiercode":"20-01","member_number":"FY87660","first_name":"ARIC","last_name":"TENEYCK","classification":"C","division":"CARRY OPTICS","hit_factor":4.77},{"match_name":"GCL Saturday 4-3-2021","match_date":"2021-04-03","stage_classifiercode":"20-01","member_number":"TY70462","first_name":"BOB","last_name":"CHRISTOPHER","classification":"C","division":"CARRY OPTICS","hit_factor":4.7697},{"match_name":"Bossier Parish Practical Shooters November 21 2021","match_date":"2021-11-21","stage_classifiercode":"20-01","member_number":"A112921","first_name":"GRANT","last_name":"KLEINPETER","classification":"C","division":"CARRY OPTICS","hit_factor":4.7695},{"match_name":"SOAP July 2021 USPSA Match","match_date":"2021-07-11","stage_classifiercode":"20-01","member_number":"A129609","first_name":"ATHAN","last_name":"MANINGAS","classification":"C","division":"CARRY OPTICS","hit_factor":4.7666},{"match_name":"NW01 T-Day 2020","match_date":"2020-11-08","stage_classifiercode":"20-01","member_number":"A129511","first_name":"KEANU","last_name":"DUNN","classification":"U","division":"CARRY OPTICS","hit_factor":4.7619},{"match_name":"Shasta Shooters 2021 Jan","match_date":"2021-01-09","stage_classifiercode":"20-01","member_number":"A127680","first_name":"EVEN","last_name":"ARTHUR","classification":"B","division":"CARRY OPTICS","hit_factor":4.7619},{"match_name":"MCPSL Pistol 1-9-2021","match_date":"2021-01-09","stage_classifiercode":"20-01","member_number":"TY83224","first_name":"DEAN","last_name":"STRANSKY","classification":"C","division":"CARRY OPTICS","hit_factor":4.758},{"match_name":"USPSA MO21 2Alpha SBRC December 26 2020","match_date":"2020-12-26","stage_classifiercode":"20-01","member_number":"A103550","first_name":"JOSEPH","last_name":"ROBERTS","classification":"U","division":"CARRY OPTICS","hit_factor":4.7577},{"match_name":"Richmond Hot Shots Aug 14-15-2021 USPSA","match_date":"2021-08-14","stage_classifiercode":"20-01","member_number":"A134288","first_name":"JONATHAN","last_name":"NAUGLE","classification":"C","division":"CARRY OPTICS","hit_factor":4.7568},{"match_name":"MRPC OHS02 06272021","match_date":"2021-06-27","stage_classifiercode":"20-01","member_number":"TY99384","first_name":"JEFF","last_name":"SCHNEIDER","classification":"C","division":"CARRY OPTICS","hit_factor":4.7538},{"match_name":"LdF USPSA Classifier Match December 12 2020","match_date":"2020-12-12","stage_classifiercode":"20-01","member_number":"A123581","first_name":"MATTHEW","last_name":"THOMPSON","classification":"U","division":"CARRY OPTICS","hit_factor":4.7493},{"match_name":"MRPC OHS02 06272021","match_date":"2021-06-27","stage_classifiercode":"20-01","member_number":"TY109746","first_name":"LAFE","last_name":"KUNKEL","classification":"A","division":"CARRY OPTICS","hit_factor":4.749},{"match_name":"FBURG September 2021 USPSA","match_date":"2021-09-05","stage_classifiercode":"20-01","member_number":"TY132317","first_name":"JEFF","last_name":"JEFFERSON","classification":"C","division":"CARRY OPTICS","hit_factor":4.7478},{"match_name":"Richmond Hot Shots Aug 14-15-2021 USPSA","match_date":"2021-08-14","stage_classifiercode":"20-01","member_number":"TY108602","first_name":"STEVEN","last_name":"CHANG","classification":"A","division":"CARRY OPTICS","hit_factor":4.7458},{"match_name":"RPS January 2021 USPSA Match","match_date":"2021-01-09","stage_classifiercode":"20-01","member_number":"A131499","first_name":"NICHOLAS","last_name":"GREER","classification":"U","division":"CARRY OPTICS","hit_factor":4.7404},{"match_name":"LdF USPSA Match November 7 2021","match_date":"2021-11-07","stage_classifiercode":"20-01","member_number":"A132800","first_name":"CHASE","last_name":"AURE","classification":"U","division":"CARRY OPTICS","hit_factor":4.7402},{"match_name":"VISSC The Final Countdown Part 2","match_date":"2021-01-17","stage_classifiercode":"20-01","member_number":"A113546","first_name":"JOHN","last_name":"BOWKER","classification":"B","division":"CARRY OPTICS","hit_factor":4.7386},{"match_name":"LIPSA  - March  21st  2021 - March Madness USPSA Match ","match_date":"2021-03-21","stage_classifiercode":"20-01","member_number":"A132082","first_name":"JOHN","last_name":"LEDERMANN","classification":"U","division":"CARRY OPTICS","hit_factor":4.7386},{"match_name":"Shadow Hawk Defense USPSA - Sep Sat","match_date":"2021-09-11","stage_classifiercode":"20-01","member_number":"A135078","first_name":"JAMES","last_name":"KONG","classification":"U","division":"CARRY OPTICS","hit_factor":4.7337},{"match_name":"Tehama Shooters November 2020 USPSA","match_date":"2020-11-28","stage_classifiercode":"20-01","member_number":"A106174","first_name":"ISAAC","last_name":"LOCKWOOD","classification":"G","division":"CARRY OPTICS","hit_factor":4.7328},{"match_name":"BORCC USPSA April 2021","match_date":"2021-04-17","stage_classifiercode":"20-01","member_number":"A128670","first_name":"DEREK","last_name":"GUAY","classification":"U","division":"CARRY OPTICS","hit_factor":4.7327},{"match_name":"LCSC Linden USPSA 122720","match_date":"2020-12-27","stage_classifiercode":"20-01","member_number":"A93855","first_name":"DAVE","last_name":"LONGCOR","classification":"B","division":"CARRY OPTICS","hit_factor":4.7316},{"match_name":"Dundee Practical Shooters - Feb 27 2021","match_date":"2021-02-27","stage_classifiercode":"20-01","member_number":"L4412","first_name":"JOHN","last_name":"LONG","classification":"C","division":"CARRY OPTICS","hit_factor":4.7259},{"match_name":"MCTS -  USPSA March 2021 Classifier Match","match_date":"2021-03-21","stage_classifiercode":"20-01","member_number":"A122337","first_name":"LINH","last_name":"TRAN","classification":"A","division":"CARRY OPTICS","hit_factor":4.7257},{"match_name":"Richmond Boro Gun Club Monthly USPSA Match May 2021","match_date":"2021-05-08","stage_classifiercode":"20-01","member_number":"TY91996","first_name":"NEIL","last_name":"SCHOER","classification":"B","division":"CARRY OPTICS","hit_factor":4.7244},{"match_name":"EAGC January 2021 USPSA Classifier Match","match_date":"2021-01-30","stage_classifiercode":"20-01","member_number":"A131750","first_name":"LANCE","last_name":"GUEST","classification":"U","division":"CARRY OPTICS","hit_factor":4.7231},{"match_name":"NW01 T-Day 2020","match_date":"2020-11-08","stage_classifiercode":"20-01","member_number":"L1145","first_name":"SQUIRE","last_name":"TOMASIE","classification":"A","division":"CARRY OPTICS","hit_factor":4.7207},{"match_name":"MRPC OHS02 06272021","match_date":"2021-06-27","stage_classifiercode":"20-01","member_number":"A123309","first_name":"RUSSELL","last_name":"SEESE","classification":"U","division":"CARRY OPTICS","hit_factor":4.7193},{"match_name":"Ontelaunee USPSA November 2020","match_date":"2020-11-20","stage_classifiercode":"20-01","member_number":"L2186","first_name":"FRANK","last_name":"KOO","classification":"B","division":"CARRY OPTICS","hit_factor":4.7187},{"match_name":"5 Dogs December USPSA 2020","match_date":"2020-12-06","stage_classifiercode":"20-01","member_number":"A121804","first_name":"PAUL","last_name":"CAUDILLO","classification":"C","division":"CARRY OPTICS","hit_factor":4.717},{"match_name":"Harvard Action Shooters May 2021 USPSA Pistol Match","match_date":"2021-05-02","stage_classifiercode":"20-01","member_number":"A124071","first_name":"TIMOTHY","last_name":"HARNDEN","classification":"U","division":"CARRY OPTICS","hit_factor":4.7144},{"match_name":"LIPSA  - March  21st  2021 - March Madness USPSA Match ","match_date":"2021-03-21","stage_classifiercode":"20-01","member_number":"TY111032","first_name":"ROBERT","last_name":"DUGRE'","classification":"B","division":"CARRY OPTICS","hit_factor":4.7144},{"match_name":"MCTS -  USPSA March 2021 Classifier Match","match_date":"2021-03-21","stage_classifiercode":"20-01","member_number":"A132081","first_name":"MIKE","last_name":"STEEL","classification":"U","division":"CARRY OPTICS","hit_factor":4.7133},{"match_name":"WSPS MARCH 2021 USPSA","match_date":"2021-03-20","stage_classifiercode":"20-01","member_number":"Ty104882","first_name":"CHRISTOPHER","last_name":"GELNETT","classification":"M","division":"CARRY OPTICS","hit_factor":4.7106},{"match_name":"Chillicothe Sportsmens Club July USPSA","match_date":"2021-07-24","stage_classifiercode":"20-01","member_number":"FY99127","first_name":"STEVE","last_name":"FRAZIER","classification":"C","division":"CARRY OPTICS","hit_factor":4.7105},{"match_name":"Shadow Hawk Defense USPSA - Sep Sat","match_date":"2021-09-11","stage_classifiercode":"20-01","member_number":"A111754","first_name":"GEORGE","last_name":"TAMULA","classification":"B","division":"CARRY OPTICS","hit_factor":4.7101},{"match_name":"Ontelaunee USPSA November 2020","match_date":"2020-11-20","stage_classifiercode":"20-01","member_number":"TY117266","first_name":"JOEL","last_name":"CHUA","classification":"U","division":"CARRY OPTICS","hit_factor":4.7098},{"match_name":"OPSC USPSA JUNE 2021","match_date":"2021-06-13","stage_classifiercode":"20-01","member_number":"TY101348","first_name":"VASSIL","last_name":"VELEV","classification":"C","division":"CARRY OPTICS","hit_factor":4.7059},{"match_name":"SRSC USPSA 3-28-21 Superclassifier","match_date":"2021-03-28","stage_classifiercode":"20-01","member_number":"A50695","first_name":"TIMOTHY","last_name":"THOMAS","classification":"B","division":"CARRY OPTICS","hit_factor":4.7016},{"match_name":"LdF USPSA Classifier Match December 12 2020","match_date":"2020-12-12","stage_classifiercode":"20-01","member_number":"A105550","first_name":"BLAINE","last_name":"DAVAZ","classification":"B","division":"CARRY OPTICS","hit_factor":4.7009},{"match_name":"YRPA USPSA May 2nd 2021","match_date":"2021-05-02","stage_classifiercode":"20-01","member_number":"A113268","first_name":"JIM","last_name":"SPEEDY","classification":"A","division":"CARRY OPTICS","hit_factor":4.7009},{"match_name":"TPS USPSA at CMP Dec 19 2020 Special Classifier Match","match_date":"2020-12-19","stage_classifiercode":"20-01","member_number":"A128215","first_name":"SCOTT","last_name":"HAUSWIRTH","classification":"U","division":"CARRY OPTICS","hit_factor":4.6974},{"match_name":"Ontelaunee USPSA November 2020","match_date":"2020-11-20","stage_classifiercode":"20-01","member_number":"A45063","first_name":"ROBERT","last_name":"WOLSKY","classification":"C","division":"CARRY OPTICS","hit_factor":4.6974},{"match_name":"EWPSA 2021-04","match_date":"2021-04-17","stage_classifiercode":"20-01","member_number":"A113268","first_name":"JIM","last_name":"SPEEDY","classification":"A","division":"CARRY OPTICS","hit_factor":4.6954},{"match_name":"SWGC USPSA Pistol Match - May 2021","match_date":"2021-05-01","stage_classifiercode":"20-01","member_number":"A131882","first_name":"JEREMY","last_name":"SMITH","classification":"U","division":"CARRY OPTICS","hit_factor":4.6912},{"match_name":"STAGE ZERO ALL CLASSIFIER","match_date":"2021-09-04","stage_classifiercode":"20-01","member_number":"A128926","first_name":"SAMUEL","last_name":"NELSON","classification":"A","division":"CARRY OPTICS","hit_factor":4.6888},{"match_name":"Shadow Hawk Defense USPSA - Sep Sat","match_date":"2021-09-11","stage_classifiercode":"20-01","member_number":"A69569","first_name":"JEFF","last_name":"CUSTER","classification":"C","division":"CARRY OPTICS","hit_factor":4.685},{"match_name":"STAGE ZERO  ALL CLASSIFIER","match_date":"2020-11-21","stage_classifiercode":"20-01","member_number":"TY35970","first_name":"JERRY","last_name":"NGUYEN","classification":"B","division":"CARRY OPTICS","hit_factor":4.6843},{"match_name":"STAGE ZERO  ALL CLASSIFIER","match_date":"2020-11-21","stage_classifiercode":"20-01","member_number":"A127180","first_name":"MICAH","last_name":"MATHENA","classification":"U","division":"CARRY OPTICS","hit_factor":4.6829},{"match_name":"CAS classifier match","match_date":"2021-08-01","stage_classifiercode":"20-01","member_number":"A130694","first_name":"MATTHEW","last_name":"LANDRY","classification":"U","division":"CARRY OPTICS","hit_factor":4.6745},{"match_name":"APSC USPSA 11-7-20","match_date":"2020-11-07","stage_classifiercode":"20-01","member_number":"TY55289","first_name":"RON","last_name":"MODEQUILLO","classification":"B","division":"CARRY OPTICS","hit_factor":4.6719},{"match_name":"Collin County USPSA  08-22-2021","match_date":"2021-08-22","stage_classifiercode":"20-01","member_number":"TY112409","first_name":"SHAWN","last_name":"CASEY","classification":"A","division":"CARRY OPTICS","hit_factor":4.6709},{"match_name":"Matamoras USPSA September 2021","match_date":"2021-09-19","stage_classifiercode":"20-01","member_number":"A81773","first_name":"SHAWN","last_name":"SARLES","classification":"B","division":"CARRY OPTICS","hit_factor":4.6707},{"match_name":"LCSC Linden USPSA 122720","match_date":"2020-12-27","stage_classifiercode":"20-01","member_number":"A102844","first_name":"ANDREW","last_name":"SCHUMACHER","classification":"C","division":"CARRY OPTICS","hit_factor":4.6706},{"match_name":"GRB USPSA JANUARY 2021 AT CAVALIER","match_date":"2021-01-16","stage_classifiercode":"20-01","member_number":"A123698","first_name":"CORB","last_name":"SLUSHER","classification":"C","division":"CARRY OPTICS","hit_factor":4.6706},{"match_name":"Medford USPSA March 2021 OR-04","match_date":"2021-03-21","stage_classifiercode":"20-01","member_number":"A126984","first_name":"WAYNE","last_name":"EVANS","classification":"C","division":"CARRY OPTICS","hit_factor":4.6693},{"match_name":"Square Deal Sportsmen June USPSA Match 2021","match_date":"2021-06-06","stage_classifiercode":"20-01","member_number":"TY6334","first_name":"JIM","last_name":"DECRISTO","classification":"A","division":"CARRY OPTICS","hit_factor":4.6693},{"match_name":"LdF USPSA Classifier Match December 12 2020","match_date":"2020-12-12","stage_classifiercode":"20-01","member_number":"A116238","first_name":"ADELINA","last_name":"TIETZ","classification":"B","division":"CARRY OPTICS","hit_factor":4.6667},{"match_name":"Quinton USPSA - April 10 2021","match_date":"2021-04-10","stage_classifiercode":"20-01","member_number":"A103415","first_name":"JEFF","last_name":"HEWES","classification":"M","division":"CARRY OPTICS","hit_factor":4.6644},{"match_name":"OREGON ARPC CC05 USPSA NOVEMBER 14 2020","match_date":"2020-11-14","stage_classifiercode":"20-01","member_number":"A59547","first_name":"STEVE","last_name":"KENDELL","classification":"C","division":"CARRY OPTICS","hit_factor":4.6624},{"match_name":"Medford USPSA Oct 2021 Match","match_date":"2021-10-17","stage_classifiercode":"20-01","member_number":"TY105730","first_name":"DIANA","last_name":"SCHOLTZ","classification":"C","division":"CARRY OPTICS","hit_factor":4.6595},{"match_name":"TPS USPSA At CMP July 17 2021","match_date":"2021-07-17","stage_classifiercode":"20-01","member_number":"A120007","first_name":"DIMA","last_name":"ULBERG","classification":"B","division":"CARRY OPTICS","hit_factor":4.6559},{"match_name":"Ontelaunee USPSA November 2020","match_date":"2020-11-20","stage_classifiercode":"20-01","member_number":"TY121241","first_name":"FRANK","last_name":"JAEGER","classification":"C","division":"CARRY OPTICS","hit_factor":4.6555},{"match_name":"Shasta Shooters 2021 Jan","match_date":"2021-01-09","stage_classifiercode":"20-01","member_number":"TY114067","first_name":"DAVID","last_name":"DUARTE","classification":"C","division":"CARRY OPTICS","hit_factor":4.6552},{"match_name":"OREGON ARPC CC05 USPSA NOVEMBER 14 2020","match_date":"2020-11-14","stage_classifiercode":"20-01","member_number":"A98700","first_name":"MITCHELL","last_name":"PHAN","classification":"C","division":"CARRY OPTICS","hit_factor":4.6512},{"match_name":"RBGC USPSA 2021-8-15 Special Classifier Match","match_date":"2021-08-15","stage_classifiercode":"20-01","member_number":"A135599","first_name":"MATT","last_name":"WHEELER","classification":"U","division":"CARRY OPTICS","hit_factor":4.6512},{"match_name":"Shongum May 2021 USPSA Match","match_date":"2021-05-01","stage_classifiercode":"20-01","member_number":"L3296","first_name":"RON","last_name":"GUMANN","classification":"C","division":"CARRY OPTICS","hit_factor":4.6476},{"match_name":"GCL Monthly USPSA Match Saturday 11-6-2021  INDOORS","match_date":"2021-11-06","stage_classifiercode":"20-01","member_number":"A109114","first_name":"FAUSTO","last_name":"PRATTICO","classification":"C","division":"CARRY OPTICS","hit_factor":4.6474},{"match_name":"APSC USPSA 11-7-20","match_date":"2020-11-07","stage_classifiercode":"20-01","member_number":"A127145","first_name":"JOSHUA","last_name":"PATTON","classification":"U","division":"CARRY OPTICS","hit_factor":4.6437},{"match_name":"EHPSA USPSA 26 September 2021","match_date":"2021-09-26","stage_classifiercode":"20-01","member_number":"A110744","first_name":"SERETHA","last_name":"HALL","classification":"X","division":"CARRY OPTICS","hit_factor":4.6434},{"match_name":"RBGC USPSA 2021-8-15 Special Classifier Match","match_date":"2021-08-15","stage_classifiercode":"20-01","member_number":"TY86759","first_name":"CANDICE","last_name":"JULIANO","classification":"U","division":"CARRY OPTICS","hit_factor":4.6419},{"match_name":"Oh Shoot -PRG Nov 27th - Uspsa Classifier Match","match_date":"2021-11-27","stage_classifiercode":"20-01","member_number":"A60766","first_name":"DANIEL","last_name":"LEUNG","classification":"U","division":"CARRY OPTICS","hit_factor":4.6404},{"match_name":"TPS USPSA At CMP July 17 2021","match_date":"2021-07-17","stage_classifiercode":"20-01","member_number":"A113351","first_name":"JAKE","last_name":"CULOTTA","classification":"B","division":"CARRY OPTICS","hit_factor":4.6377},{"match_name":"NISA August 2021","match_date":"2021-08-22","stage_classifiercode":"20-01","member_number":"A134126","first_name":"BRAD","last_name":"FRANK","classification":"B","division":"CARRY OPTICS","hit_factor":4.6371},{"match_name":"EWPSA 2021-04","match_date":"2021-04-17","stage_classifiercode":"20-01","member_number":"A55355","first_name":"RANDALL","last_name":"BAYUK","classification":"U","division":"CARRY OPTICS","hit_factor":4.6352},{"match_name":"Vortex Edge USPSA October 2021","match_date":"2021-10-09","stage_classifiercode":"20-01","member_number":"A121327","first_name":"JEREMY","last_name":"WALKER","classification":"B","division":"CARRY OPTICS","hit_factor":4.6346},{"match_name":"Coastal Area Practical Shooters 10-23-21","match_date":"2021-10-23","stage_classifiercode":"20-01","member_number":"A43818","first_name":"GROVER","last_name":"ROBINSON","classification":"B","division":"CARRY OPTICS","hit_factor":4.6312},{"match_name":"LIPSA  - March  21st  2021 - March Madness USPSA Match ","match_date":"2021-03-21","stage_classifiercode":"20-01","member_number":"L4810","first_name":"MIKE","last_name":"ROSEDALE","classification":"C","division":"CARRY OPTICS","hit_factor":4.6296},{"match_name":"FBURG September 2021 USPSA","match_date":"2021-09-05","stage_classifiercode":"20-01","member_number":"TY104708","first_name":"HAO","last_name":"LUAN","classification":"U","division":"CARRY OPTICS","hit_factor":4.6281},{"match_name":"TPS USPSA at CMP Dec 19 2020 Special Classifier Match","match_date":"2020-12-19","stage_classifiercode":"20-01","member_number":"A114316","first_name":"CLAYTON","last_name":"WEBB","classification":"B","division":"CARRY OPTICS","hit_factor":4.6171},{"match_name":"MRPC OHS02 06272021","match_date":"2021-06-27","stage_classifiercode":"20-01","member_number":"TY119351","first_name":"JOHN","last_name":"MARSHALL","classification":"U","division":"CARRY OPTICS","hit_factor":4.6168},{"match_name":"CCPL 05-09-2021","match_date":"2021-05-09","stage_classifiercode":"20-01","member_number":"A114756","first_name":"NORMAN","last_name":"PABLO","classification":"U","division":"CARRY OPTICS","hit_factor":4.6154},{"match_name":"Vortex Edge USPSA October 2021","match_date":"2021-10-09","stage_classifiercode":"20-01","member_number":"FY105307","first_name":"TEO","last_name":"BRUM","classification":"C","division":"CARRY OPTICS","hit_factor":4.614},{"match_name":"Wallis Orchard Practical Shooters April 2021 Club Match","match_date":"2021-04-18","stage_classifiercode":"20-01","member_number":"A124540","first_name":"MARCHONI","last_name":"AQUINO","classification":"D","division":"CARRY OPTICS","hit_factor":4.6075},{"match_name":"Richmond Boro Gun Club Monthly USPSA Match May 2021","match_date":"2021-05-08","stage_classifiercode":"20-01","member_number":"TU91913","first_name":"LANCE","last_name":"COLLO","classification":"B","division":"CARRY OPTICS","hit_factor":4.6075},{"match_name":"Medford USPSA Oct 2021 Match","match_date":"2021-10-17","stage_classifiercode":"20-01","member_number":"A7116","first_name":"ED","last_name":"BOENING","classification":"A","division":"CARRY OPTICS","hit_factor":4.6068},{"match_name":"GRB USPSA JANUARY 2021 AT CAVALIER","match_date":"2021-01-16","stage_classifiercode":"20-01","member_number":"A132317","first_name":"JEFF","last_name":"JEFFERSON","classification":"U","division":"CARRY OPTICS","hit_factor":4.6018},{"match_name":"Shadow Hawk Defense USPSA - Sep Sat","match_date":"2021-09-11","stage_classifiercode":"20-01","member_number":"TY135380","first_name":"CHRIS","last_name":"PARK","classification":"C","division":"CARRY OPTICS","hit_factor":4.5977},{"match_name":"SFA USPSA JANUARY 16 2021 MATCH","match_date":"2021-01-16","stage_classifiercode":"20-01","member_number":"A89126","first_name":"RON","last_name":"WAGNER","classification":"U - I don't know and don't care","division":"CARRY OPTICS","hit_factor":4.5977},{"match_name":"BORCC USPSA April 2021","match_date":"2021-04-17","stage_classifiercode":"20-01","member_number":"A111525","first_name":"CHARLES","last_name":"BURNETT","classification":"C","division":"CARRY OPTICS","hit_factor":4.5957},{"match_name":"Square Deal Sportsmen June USPSA Match 2021","match_date":"2021-06-06","stage_classifiercode":"20-01","member_number":"L2271","first_name":"EDWARD","last_name":"PUTNAM","classification":"B","division":"CARRY OPTICS","hit_factor":4.5939},{"match_name":"LdF USPSA Classifier Match December 12 2020","match_date":"2020-12-12","stage_classifiercode":"20-01","member_number":"A131178","first_name":"TIM","last_name":"ASHJIAN","classification":"U","division":"CARRY OPTICS","hit_factor":4.5918},{"match_name":"CIPSC IL02 Havana August USPSA","match_date":"2021-08-07","stage_classifiercode":"20-01","member_number":"TY26842","first_name":"ERIC","last_name":"PREWITT","classification":"A","division":"CARRY OPTICS","hit_factor":4.5862},{"match_name":"Pioneer Action Shooters USPSA 11-15-20","match_date":"2020-11-15","stage_classifiercode":"20-01","member_number":"A113277","first_name":"JONATHAN","last_name":"DAVIS","classification":"C","division":"CARRY OPTICS","hit_factor":4.5855},{"match_name":"RBGC USPSA 2021-01-23","match_date":"2021-01-23","stage_classifiercode":"20-01","member_number":"A81479","first_name":"LARRY","last_name":"DRUM","classification":"C","division":"CARRY OPTICS","hit_factor":4.5827},{"match_name":"MCPSL Pistol 1-9-2021","match_date":"2021-01-09","stage_classifiercode":"20-01","member_number":"FY10738","first_name":"BLAISE","last_name":"CORNELL-D'ECHERT","classification":"C","division":"CARRY OPTICS","hit_factor":4.5802},{"match_name":"GCL Saturday 4-3-2021","match_date":"2021-04-03","stage_classifiercode":"20-01","member_number":"FY74975","first_name":"BILL","last_name":"STEGER","classification":"B","division":"CARRY OPTICS","hit_factor":4.5789},{"match_name":"Harvard Action Shooters May 2021 USPSA Pistol Match","match_date":"2021-05-02","stage_classifiercode":"20-01","member_number":"TY129212","first_name":"DAVID","last_name":"LANTAGNE","classification":"U","division":"CARRY OPTICS","hit_factor":4.5775},{"match_name":"Extreme GM uspsa Nov-13","match_date":"2021-11-13","stage_classifiercode":"20-01","member_number":"A126259","first_name":"BRANDON","last_name":"MONTVILLE","classification":"C","division":"CARRY OPTICS","hit_factor":4.5775},{"match_name":"LdF USPSA Classifier Match December 12 2020","match_date":"2020-12-12","stage_classifiercode":"20-01","member_number":"FY106039","first_name":"TIMOTHY","last_name":"PAK","classification":"U","division":"CARRY OPTICS","hit_factor":4.5691},{"match_name":"Matamoras USPSA September 2021","match_date":"2021-09-19","stage_classifiercode":"20-01","member_number":"FY92972","first_name":"JOSEPH","last_name":"UTERA","classification":"C","division":"CARRY OPTICS","hit_factor":4.5671},{"match_name":"Nampa USPSA September 10th 2021 Classifier Match","match_date":"2021-09-10","stage_classifiercode":"20-01","member_number":"a84188","first_name":"LARRY","last_name":"OLETSKI","classification":"U","division":"CARRY OPTICS","hit_factor":4.5657},{"match_name":"NISA August 2021","match_date":"2021-08-22","stage_classifiercode":"20-01","member_number":"A127797","first_name":"BERNARD","last_name":"BENETEAU","classification":"M","division":"CARRY OPTICS","hit_factor":4.5627},{"match_name":"EWPSA 2021-04","match_date":"2021-04-17","stage_classifiercode":"20-01","member_number":"FY80982","first_name":"LARRY","last_name":"ROMAINE","classification":"B","division":"CARRY OPTICS","hit_factor":4.5597},{"match_name":"Shadow Hawk Defense USPSA - Sep  Sunday","match_date":"2021-09-12","stage_classifiercode":"20-01","member_number":"TY31868","first_name":"DENNIS (2)","last_name":"BOYLE","classification":"B","division":"CARRY OPTICS","hit_factor":4.5584},{"match_name":"LIPSA  - March  21st  2021 - March Madness USPSA Match ","match_date":"2021-03-21","stage_classifiercode":"20-01","member_number":"TY122836","first_name":"BRIAN","last_name":"BRESOCNIK","classification":"C","division":"CARRY OPTICS","hit_factor":4.5584},{"match_name":"Medford USPSA Oct 2021 Match","match_date":"2021-10-17","stage_classifiercode":"20-01","member_number":"A126984","first_name":"WAYNE","last_name":"EVANS","classification":"C","division":"CARRY OPTICS","hit_factor":4.5574},{"match_name":"Richmond Boro Gun Club Monthly USPSA Match May 2021","match_date":"2021-05-08","stage_classifiercode":"20-01","member_number":"A105434","first_name":"FRED","last_name":"LAFEMINA","classification":"C","division":"CARRY OPTICS","hit_factor":4.5574},{"match_name":"Southern Kentucky Gun Club USPSA April Match","match_date":"2021-04-25","stage_classifiercode":"20-01","member_number":"TY125465","first_name":"LEROY","last_name":"MIDDLETON","classification":"C","division":"CARRY OPTICS","hit_factor":4.5528},{"match_name":"JCSSA DEC 5 2020","match_date":"2020-12-05","stage_classifiercode":"20-01","member_number":"A12630","first_name":"TROY","last_name":"SCOGGINS","classification":"B","division":"CARRY OPTICS","hit_factor":4.5498},{"match_name":"Medford USPSA Oct 2021 Match","match_date":"2021-10-17","stage_classifiercode":"20-01","member_number":"TY70884","first_name":"TOM","last_name":"FLOWERS","classification":"C","division":"CARRY OPTICS","hit_factor":4.5493},{"match_name":"Nampa USPSA December 5th 2020","match_date":"2020-12-05","stage_classifiercode":"20-01","member_number":"a108234","first_name":"ALEXANDRA","last_name":"DEES","classification":"C","division":"CARRY OPTICS","hit_factor":4.549},{"match_name":"OREGON ARPC CC05 USPSA OCT 9 2021","match_date":"2021-10-09","stage_classifiercode":"20-01","member_number":"None","first_name":"CHARLES","last_name":"SCHUH","classification":"U","division":"CARRY OPTICS","hit_factor":4.5419},{"match_name":"TTS USPSA Match 12JUN2021","match_date":"2021-06-12","stage_classifiercode":"20-01","member_number":"A127710","first_name":"SHAUNDY","last_name":"PEPITO","classification":"U","division":"CARRY OPTICS","hit_factor":4.5419},{"match_name":"Ontelaunee USPSA November 2020","match_date":"2020-11-20","stage_classifiercode":"20-01","member_number":"A127904","first_name":"JAYSON","last_name":"LAZARO","classification":"D","division":"CARRY OPTICS","hit_factor":4.5415},{"match_name":"Moss Branch USPSA June match","match_date":"2021-06-26","stage_classifiercode":"20-01","member_number":"TY95298","first_name":"JAMES","last_name":"PALMER","classification":"B","division":"CARRY OPTICS","hit_factor":4.5369},{"match_name":"Nampa USPSA September 10th 2021 Classifier Match","match_date":"2021-09-10","stage_classifiercode":"20-01","member_number":"A60752","first_name":"DENNY","last_name":"CARTER","classification":"M","division":"CARRY OPTICS","hit_factor":4.5349},{"match_name":"Triforce Practical Shooters at Big Woods Goods 03-25-2021","match_date":"2021-03-25","stage_classifiercode":"20-01","member_number":"TY94721","first_name":"ROBERT","last_name":"MCCOLL","classification":"C","division":"CARRY OPTICS","hit_factor":4.5331},{"match_name":"GCL Monthly USPSA Match Saturday 11-6-2021  INDOORS","match_date":"2021-11-06","stage_classifiercode":"20-01","member_number":"A118426","first_name":"MATT","last_name":"WOLFF","classification":"U","division":"CARRY OPTICS","hit_factor":4.5317},{"match_name":"ESPS  USPSA  March","match_date":"2021-03-27","stage_classifiercode":"20-01","member_number":"A127904","first_name":"JAYSON","last_name":"LAZARO","classification":"C","division":"CARRY OPTICS","hit_factor":4.5314},{"match_name":"RDS June 2021 USPSA Match","match_date":"2021-06-05","stage_classifiercode":"20-01","member_number":"A117501","first_name":"ROD","last_name":"COLEMAN","classification":"C","division":"CARRY OPTICS","hit_factor":4.5313},{"match_name":"Shasta Shooters 2021 Jan","match_date":"2021-01-09","stage_classifiercode":"20-01","member_number":"A114013","first_name":"KYLE","last_name":"BROWN","classification":"B","division":"CARRY OPTICS","hit_factor":4.5307},{"match_name":"MRPC OHS02 06272021","match_date":"2021-06-27","stage_classifiercode":"20-01","member_number":"A125036","first_name":"LIAM","last_name":"WENNING","classification":"C","division":"CARRY OPTICS","hit_factor":4.5277},{"match_name":"OK06-30OCT21-SCRP-USPSA","match_date":"2021-10-30","stage_classifiercode":"20-01","member_number":"A121313","first_name":"ALEX","last_name":"LACKEY","classification":"A","division":"CARRY OPTICS","hit_factor":4.5249},{"match_name":"ESPS  USPSA  March","match_date":"2021-03-27","stage_classifiercode":"20-01","member_number":"A102736","first_name":"JAMES","last_name":"DAVIS","classification":"B","division":"CARRY OPTICS","hit_factor":4.5188},{"match_name":"LGCSEMPS April 2021 Special Classifier","match_date":"2021-04-11","stage_classifiercode":"20-01","member_number":"A128530","first_name":"TOSHIO","last_name":"LEWIS","classification":"U","division":"CARRY OPTICS","hit_factor":4.5188},{"match_name":"Cowtown Pistol Club USPSA MONDAY November 1 2021","match_date":"2021-11-02","stage_classifiercode":"20-01","member_number":"A114185","first_name":"JIM","last_name":"METCALF","classification":"B","division":"CARRY OPTICS","hit_factor":4.5188},{"match_name":"Nampa USPSA December 5th 2020","match_date":"2020-12-05","stage_classifiercode":"20-01","member_number":"ty84511","first_name":"HAROLD","last_name":"KROPP","classification":"C","division":"CARRY OPTICS","hit_factor":4.5113},{"match_name":"GRB USPSA JANUARY 2021 AT CAVALIER","match_date":"2021-01-16","stage_classifiercode":"20-01","member_number":"A87953","first_name":"CHARLES","last_name":"BAJER","classification":"C","division":"CARRY OPTICS","hit_factor":4.5075},{"match_name":"YMM  IPSC02 2021_01_10","match_date":"2021-01-10","stage_classifiercode":"20-01","member_number":"TY121494","first_name":"NEAL","last_name":"BUSH","classification":"B","division":"CARRY OPTICS","hit_factor":4.507},{"match_name":"Medford USPSA March 2021 OR-04","match_date":"2021-03-21","stage_classifiercode":"20-01","member_number":"TY105730","first_name":"DIANA","last_name":"SCHOLTZ","classification":"C","division":"CARRY OPTICS","hit_factor":4.5052},{"match_name":"SPSA USPSA January 1st Sat Match","match_date":"2021-01-02","stage_classifiercode":"20-01","member_number":"A124387","first_name":"DONOVAN","last_name":"BROOKS","classification":"B","division":"CARRY OPTICS","hit_factor":4.5038},{"match_name":"OPSC USPSA JUNE 2021","match_date":"2021-06-13","stage_classifiercode":"20-01","member_number":"TY106580","first_name":"ROBERT","last_name":"ALAMO","classification":"B","division":"CARRY OPTICS","hit_factor":4.5012},{"match_name":"GFDS POSTAL MATCH USPSA 10/2/2021 hosted by Glacier Practical Shooters","match_date":"2021-10-02","stage_classifiercode":"20-01","member_number":"A134184","first_name":"DUSTIN","last_name":"DEMARS","classification":"C","division":"CARRY OPTICS","hit_factor":4.5011},{"match_name":"BNA USPSA - July 25 2021 (Brothers N Arms)","match_date":"2021-07-25","stage_classifiercode":"20-01","member_number":"A134595","first_name":"WILLIAM","last_name":"HERRINGTON","classification":"C","division":"CARRY OPTICS","hit_factor":4.4986},{"match_name":"FBURG September 2021 USPSA","match_date":"2021-09-05","stage_classifiercode":"20-01","member_number":"FY32906","first_name":"TERRY","last_name":"BAILADO","classification":"B","division":"CARRY OPTICS","hit_factor":4.4983},{"match_name":"Ontelaunee USPSA November 2020","match_date":"2020-11-20","stage_classifiercode":"20-01","member_number":"A127671","first_name":"JUSTIN","last_name":"HANKS","classification":"U","division":"CARRY OPTICS","hit_factor":4.4963},{"match_name":"Medford USPSA March 2021 OR-04","match_date":"2021-03-21","stage_classifiercode":"20-01","member_number":"A124659","first_name":"WILLIAM","last_name":"POWELL","classification":"C","division":"CARRY OPTICS","hit_factor":4.4925},{"match_name":"Coyote Arms Classifier Match 10-31-21","match_date":"2021-10-31","stage_classifiercode":"20-01","member_number":"A136686","first_name":"DAN","last_name":"SMITH","classification":"U","division":"CARRY OPTICS","hit_factor":4.4924},{"match_name":"Cactus USPSA ALL CLASSIFIER January 2021","match_date":"2021-01-03","stage_classifiercode":"20-01","member_number":"TY124493","first_name":"ANGELO","last_name":"ARENA","classification":"B","division":"CARRY OPTICS","hit_factor":4.4883},{"match_name":"PIPS 04-28-2021","match_date":"2021-04-27","stage_classifiercode":"20-01","member_number":"TY122606","first_name":"COLLIN","last_name":"UNDERDAHL","classification":"A","division":"CARRY OPTICS","hit_factor":4.4872},{"match_name":"Heartland PS USPSA Monthly 21 March 2021","match_date":"2021-03-21","stage_classifiercode":"20-01","member_number":"A126923","first_name":"ALEX","last_name":"BRINER","classification":"C","division":"CARRY OPTICS","hit_factor":4.4843},{"match_name":"CAS classifier match","match_date":"2021-08-01","stage_classifiercode":"20-01","member_number":"TY44221","first_name":"BRANDON","last_name":"GUILLORY","classification":"U","division":"CARRY OPTICS","hit_factor":4.4788},{"match_name":"MPSA 2020-11-21","match_date":"2020-11-21","stage_classifiercode":"20-01","member_number":"Fy94000","first_name":"MICHAEL","last_name":"MORGAN","classification":"U","division":"CARRY OPTICS","hit_factor":4.4776},{"match_name":"Ontelaunee USPSA November 2020","match_date":"2020-11-20","stage_classifiercode":"20-01","member_number":"L3767","first_name":"BEN","last_name":"HSIAO","classification":"B","division":"CARRY OPTICS","hit_factor":4.476},{"match_name":"STAGE ZERO  ALL CLASSIFIER","match_date":"2020-11-21","stage_classifiercode":"20-01","member_number":"A118783","first_name":"ZACK","last_name":"SMELTZ2","classification":"U","division":"CARRY OPTICS","hit_factor":4.4739},{"match_name":"Sharp Practical Shooters September USPSA - Outdoor Classifier Match","match_date":"2021-09-25","stage_classifiercode":"20-01","member_number":"TY95955","first_name":"THOMAS","last_name":"LEACHMAN","classification":"B","division":"CARRY OPTICS","hit_factor":4.4728},{"match_name":"SOAP July 2021 USPSA Match","match_date":"2021-07-11","stage_classifiercode":"20-01","member_number":"TY101829","first_name":"MARC","last_name":"VETOVITZ","classification":"A","division":"CARRY OPTICS","hit_factor":4.4715},{"match_name":"Magnolia Rifle and Pistol Club May  2021 USPSA Match","match_date":"2021-05-15","stage_classifiercode":"20-01","member_number":"TY65599","first_name":"GALE","last_name":"BUTLER","classification":"B","division":"CARRY OPTICS","hit_factor":4.4684},{"match_name":"GRB USPSA JANUARY 2021 AT CAVALIER","match_date":"2021-01-16","stage_classifiercode":"20-01","member_number":"Ty126071","first_name":"JOSH","last_name":"SCHROEPFER","classification":"U","division":"CARRY OPTICS","hit_factor":4.4674},{"match_name":"Cameo USPSA Match November 21 2020","match_date":"2020-11-21","stage_classifiercode":"20-01","member_number":"A130863","first_name":"KENJI","last_name":"NAKATA","classification":"U","division":"CARRY OPTICS","hit_factor":4.4665},{"match_name":"CCPS July 2021 USPSA","match_date":"2021-07-04","stage_classifiercode":"20-01","member_number":"TY69818","first_name":"TY","last_name":"CLARK","classification":"B","division":"CARRY OPTICS","hit_factor":4.4632},{"match_name":"SKSC USPSA Oct 2021","match_date":"2021-10-16","stage_classifiercode":"20-01","member_number":"A135217","first_name":"JOHN","last_name":"TURKAL","classification":"U","division":"CARRY OPTICS","hit_factor":4.4628},{"match_name":"Wallis Orchard Practical Shooters April 2021 Club Match","match_date":"2021-04-18","stage_classifiercode":"20-01","member_number":"A124958","first_name":"ANTONIO","last_name":"TORMIS","classification":"C","division":"CARRY OPTICS","hit_factor":4.4622},{"match_name":"Coyote Arms Classifier Match 10-31-21","match_date":"2021-10-31","stage_classifiercode":"20-01","member_number":"A86575","first_name":"LENIN","last_name":"MIRANDA","classification":"X","division":"CARRY OPTICS","hit_factor":4.4603},{"match_name":"LGCSEMPS April 2021 Special Classifier","match_date":"2021-04-11","stage_classifiercode":"20-01","member_number":"A133576","first_name":"DANIEL","last_name":"RICHARDSON","classification":"U","division":"CARRY OPTICS","hit_factor":4.4543},{"match_name":"NHRPC - November 2021 USPSA","match_date":"2021-11-13","stage_classifiercode":"20-01","member_number":"A128133","first_name":"DAVID","last_name":"ROLLER","classification":"C","division":"CARRY OPTICS","hit_factor":4.453},{"match_name":"LASC-USPSA April 2021","match_date":"2021-04-17","stage_classifiercode":"20-01","member_number":"TY-94144","first_name":"JACOB","last_name":"ZIELIE","classification":"C","division":"CARRY OPTICS","hit_factor":4.4524},{"match_name":"Hallstead USPSA April 24 match","match_date":"2021-04-24","stage_classifiercode":"20-01","member_number":"A121767","first_name":"JOE","last_name":"HAINES","classification":"B","division":"CARRY OPTICS","hit_factor":4.4444},{"match_name":"SCAPSA MN05 SPRING 6","match_date":"2021-05-18","stage_classifiercode":"20-01","member_number":"TY58815","first_name":"MIKE","last_name":"VAN MEETEREN","classification":"U","division":"CARRY OPTICS","hit_factor":4.441},{"match_name":"Belton Gun Club USPSA March Classifier MATCH 3-7-21","match_date":"2021-03-07","stage_classifiercode":"20-01","member_number":"TY97524","first_name":"IVAN","last_name":"LIECHTY","classification":"C","division":"CARRY OPTICS","hit_factor":4.4408},{"match_name":"SOAP July 2021 USPSA Match","match_date":"2021-07-11","stage_classifiercode":"20-01","member_number":"TY99258","first_name":"DON","last_name":"MCELHINNEY","classification":"B","division":"CARRY OPTICS","hit_factor":4.4362},{"match_name":"EAGC January 2021 USPSA Classifier Match","match_date":"2021-01-30","stage_classifiercode":"20-01","member_number":"A121673","first_name":"JEFF","last_name":"LIU","classification":"A","division":"CARRY OPTICS","hit_factor":4.436},{"match_name":"Heartland PS USPSA *ALL CLASSIFIER* 18 July 2021","match_date":"2021-07-18","stage_classifiercode":"20-01","member_number":"TY64877","first_name":"TIM","last_name":"MATTHEWS","classification":"C","division":"CARRY OPTICS","hit_factor":4.4339},{"match_name":"Belton Gun Club USPSA March Classifier MATCH 3-7-21","match_date":"2021-03-07","stage_classifiercode":"20-01","member_number":"A92545","first_name":"RONNIE","last_name":"STATEN","classification":"U","division":"CARRY OPTICS","hit_factor":4.4335},{"match_name":"EAGC January 2021 USPSA Classifier Match","match_date":"2021-01-30","stage_classifiercode":"20-01","member_number":"A129927","first_name":"LEO","last_name":"FORD","classification":"U","division":"CARRY OPTICS","hit_factor":4.4331},{"match_name":"QPS Quantico Shooting Club December USPSA   ","match_date":"2020-12-12","stage_classifiercode":"20-01","member_number":"A129830","first_name":"ANTHONY","last_name":"VIGGIANI","classification":"U","division":"CARRY OPTICS","hit_factor":4.4304},{"match_name":"Mvpsa USPSA November 7 2020","match_date":"2020-11-07","stage_classifiercode":"20-01","member_number":"Ty57751","first_name":"BOB","last_name":"HARRIS","classification":"A","division":"CARRY OPTICS","hit_factor":4.4299},{"match_name":"Vortex Edge USPSA October 2021","match_date":"2021-10-09","stage_classifiercode":"20-01","member_number":"A126743","first_name":"MELANIE","last_name":"WALKER","classification":"C","division":"CARRY OPTICS","hit_factor":4.4255},{"match_name":"Harvard Action Shooters May 2021 USPSA Pistol Match","match_date":"2021-05-02","stage_classifiercode":"20-01","member_number":"A114103","first_name":"BRIAN","last_name":"ZAKRAJSEK","classification":"D","division":"CARRY OPTICS","hit_factor":4.4218},{"match_name":"Medford USPSA Oct 2021 Match","match_date":"2021-10-17","stage_classifiercode":"20-01","member_number":"A124659","first_name":"WILLIAM","last_name":"POWELL","classification":"C","division":"CARRY OPTICS","hit_factor":4.4199},{"match_name":"GCL Saturday 4-3-2021","match_date":"2021-04-03","stage_classifiercode":"20-01","member_number":"Ty86723","first_name":"PETER","last_name":"MILLS","classification":"C","division":"CARRY OPTICS","hit_factor":4.4199},{"match_name":"RBGC USPSA 2021-8-15 Special Classifier Match","match_date":"2021-08-15","stage_classifiercode":"20-01","member_number":"TY116678","first_name":"MARK","last_name":"HU","classification":"C","division":"CARRY OPTICS","hit_factor":4.4183},{"match_name":"Payson Practical Shooters USPSA Dec 5  2020","match_date":"2020-12-05","stage_classifiercode":"20-01","member_number":"A123687","first_name":"JON","last_name":"HEGRENESS","classification":"D","division":"CARRY OPTICS","hit_factor":4.4164},{"match_name":"PMRPC USPSA 12Dec20 - all Classifier","match_date":"2020-12-12","stage_classifiercode":"20-01","member_number":"A125543","first_name":"SCOTT","last_name":"HAWLEY","classification":"U","division":"CARRY OPTICS","hit_factor":4.415},{"match_name":"WTPS USPSA Match 12.12.2020","match_date":"2020-12-12","stage_classifiercode":"20-01","member_number":"A118905","first_name":"CORY","last_name":"GRIFFITH","classification":"B","division":"CARRY OPTICS","hit_factor":4.4118},{"match_name":"EWPSA 2021-04","match_date":"2021-04-17","stage_classifiercode":"20-01","member_number":"A132889","first_name":"BOB","last_name":"DIZON","classification":"U","division":"CARRY OPTICS","hit_factor":4.4118},{"match_name":"Extreme GM uspsa Nov-13","match_date":"2021-11-13","stage_classifiercode":"20-01","member_number":"TY91351","first_name":"FERNANDO","last_name":"ALMEIDA","classification":"B","division":"CARRY OPTICS","hit_factor":4.4068},{"match_name":"EAGC January 2021 USPSA Classifier Match","match_date":"2021-01-30","stage_classifiercode":"20-01","member_number":"A118818","first_name":"BRIAN","last_name":"ROY","classification":"B","division":"CARRY OPTICS","hit_factor":4.4068},{"match_name":"FBURG September 2021 USPSA","match_date":"2021-09-05","stage_classifiercode":"20-01","member_number":"A128847","first_name":"DAVE","last_name":"WEAVER","classification":"C","division":"CARRY OPTICS","hit_factor":4.4053},{"match_name":"Richmond Boro Gun Club Monthly USPSA Match May 2021","match_date":"2021-05-08","stage_classifiercode":"20-01","member_number":"A123651","first_name":"JOEL","last_name":"MONTECINO","classification":"C","division":"CARRY OPTICS","hit_factor":4.403},{"match_name":"Oh Shoot -PRG Nov 27th - Uspsa Classifier Match","match_date":"2021-11-27","stage_classifiercode":"20-01","member_number":"A129700","first_name":"ALLAN","last_name":"FELICANO","classification":"U","division":"CARRY OPTICS","hit_factor":4.4025},{"match_name":"LIPSA  - March  21st  2021 - March Madness USPSA Match ","match_date":"2021-03-21","stage_classifiercode":"20-01","member_number":"FY104384","first_name":"TONG","last_name":"YU","classification":"C","division":"CARRY OPTICS","hit_factor":4.4014},{"match_name":"Ontelaunee USPSA November 2020","match_date":"2020-11-20","stage_classifiercode":"20-01","member_number":"A129906","first_name":"DALE","last_name":"MELLINGER","classification":"D","division":"CARRY OPTICS","hit_factor":4.4006},{"match_name":"NW01 T-Day 2020","match_date":"2020-11-08","stage_classifiercode":"20-01","member_number":"A71578","first_name":"KEITH","last_name":"TSANG","classification":"B","division":"CARRY OPTICS","hit_factor":4.3956},{"match_name":"JCSSA DEC 5 2020","match_date":"2020-12-05","stage_classifiercode":"20-01","member_number":"A58583","first_name":"GLENN","last_name":"GANAC","classification":"U","division":"CARRY OPTICS","hit_factor":4.3956},{"match_name":"Cactus USPSA ALL CLASSIFIER January 2021","match_date":"2021-01-03","stage_classifiercode":"20-01","member_number":"A129195","first_name":"RICHARD","last_name":"ARTHUR","classification":"U","division":"CARRY OPTICS","hit_factor":4.3956},{"match_name":"Chattanooga Practical Shooting Assoc   USPSA - Saturday Oct 9th 2021","match_date":"2021-10-09","stage_classifiercode":"20-01","member_number":"TY94240","first_name":"ANDY","last_name":"WALKER","classification":"M","division":"CARRY OPTICS","hit_factor":4.3915},{"match_name":"GRB USPSA JANUARY 2021 AT CAVALIER","match_date":"2021-01-16","stage_classifiercode":"20-01","member_number":"TY109392","first_name":"SCOTT","last_name":"HINES","classification":"B","division":"CARRY OPTICS","hit_factor":4.3915},{"match_name":"Coyote Arms Classifier Match 10-31-21","match_date":"2021-10-31","stage_classifiercode":"20-01","member_number":"A137642","first_name":"NICHOLAS","last_name":"SCHILLER","classification":"U","division":"CARRY OPTICS","hit_factor":4.3906},{"match_name":"Collin County USPSA  08-22-2021","match_date":"2021-08-22","stage_classifiercode":"20-01","member_number":"6969","first_name":"CLAY","last_name":"SMITH","classification":"X","division":"CARRY OPTICS","hit_factor":4.3873},{"match_name":"Nampa USPSA September 10th 2021 Classifier Match","match_date":"2021-09-10","stage_classifiercode":"20-01","member_number":"A135788","first_name":"TAYLOR","last_name":"JOY","classification":"C","division":"CARRY OPTICS","hit_factor":4.3853},{"match_name":"JPPS USPSA Match 8-15-2021","match_date":"2021-08-15","stage_classifiercode":"20-01","member_number":"A103819","first_name":"ALEXANDER","last_name":"BIGGER","classification":"U","division":"CARRY OPTICS","hit_factor":4.382},{"match_name":"EHPSA USPSA 26 September 2021","match_date":"2021-09-26","stage_classifiercode":"20-01","member_number":"A132845","first_name":"ANDREW","last_name":"MCCALL","classification":"C","division":"CARRY OPTICS","hit_factor":4.3803},{"match_name":"GRRC 2021 wk 7","match_date":"2021-06-14","stage_classifiercode":"20-01","member_number":"A101845","first_name":"JOE","last_name":"RENFROW","classification":"C","division":"CARRY OPTICS","hit_factor":4.3774},{"match_name":"Volusia County Gun and Hunt Club","match_date":"2020-11-21","stage_classifiercode":"20-01","member_number":"TY79474","first_name":"JOSE","last_name":"ORTIZ","classification":"B","division":"CARRY OPTICS","hit_factor":4.3745},{"match_name":"MCAS 2021 USPSA Classifier League","match_date":"2021-05-26","stage_classifiercode":"20-01","member_number":"TY95712","first_name":"PAUL","last_name":"MISH","classification":"C","division":"CARRY OPTICS","hit_factor":4.37},{"match_name":"FBURG September 2021 USPSA","match_date":"2021-09-05","stage_classifiercode":"20-01","member_number":"A131685","first_name":"SHAN","last_name":"WANG","classification":"C","division":"CARRY OPTICS","hit_factor":4.3685},{"match_name":"FBURG September 2021 USPSA","match_date":"2021-09-05","stage_classifiercode":"20-01","member_number":"TY96779","first_name":"MIKE","last_name":"WILLOUGHBY","classification":"A","division":"CARRY OPTICS","hit_factor":4.3624},{"match_name":"Shongum May 2021 USPSA Match","match_date":"2021-05-01","stage_classifiercode":"20-01","member_number":"Ty120732","first_name":"JEFFREY","last_name":"WOLINSKY","classification":"C","division":"CARRY OPTICS","hit_factor":4.3609},{"match_name":"QPS Quantico Shooting Club December USPSA   ","match_date":"2020-12-12","stage_classifiercode":"20-01","member_number":"TY104069","first_name":"MAEGAN","last_name":"KATZ","classification":"U","division":"CARRY OPTICS","hit_factor":4.3588},{"match_name":"Vortex Edge USPSA October 2021","match_date":"2021-10-09","stage_classifiercode":"20-01","member_number":"A131279","first_name":"CHRIS","last_name":"URRUTIA","classification":"B","division":"CARRY OPTICS","hit_factor":4.3584},{"match_name":"LdF USPSA Classifier Match December 12 2020","match_date":"2020-12-12","stage_classifiercode":"20-01","member_number":"TY82298","first_name":"WALTER","last_name":"MICHALOWSKI","classification":"C","division":"CARRY OPTICS","hit_factor":4.3561},{"match_name":"ENPS September 2021 USPSA Match","match_date":"2021-09-04","stage_classifiercode":"20-01","member_number":"TY98625","first_name":"LANE","last_name":"GRIES","classification":"G","division":"CARRY OPTICS","hit_factor":4.3548},{"match_name":"OREGON ARPC CC05 USPSA OCT 9 2021","match_date":"2021-10-09","stage_classifiercode":"20-01","member_number":"A135266","first_name":"AARON","last_name":"DUMBROW","classification":"D","division":"CARRY OPTICS","hit_factor":4.3516},{"match_name":"CCPS July 2021 USPSA","match_date":"2021-07-04","stage_classifiercode":"20-01","member_number":"A50587","first_name":"RIICHIRO","last_name":"SUZUKI","classification":"C","division":"CARRY OPTICS","hit_factor":4.3512},{"match_name":"Oh Shoot -PRG Nov 27th - Uspsa Classifier Match","match_date":"2021-11-27","stage_classifiercode":"20-01","member_number":"A133547","first_name":"DARRIN","last_name":"SANTOS","classification":"C","division":"CARRY OPTICS","hit_factor":4.3478},{"match_name":"OREGON ARPC CC05 USPSA OCT 9 2021","match_date":"2021-10-09","stage_classifiercode":"20-01","member_number":"TY67840","first_name":"MARC","last_name":"ROCQUE","classification":"C","division":"CARRY OPTICS","hit_factor":4.3478},{"match_name":"LPRGC- Lower Providence USPSA Nov 2020 Match","match_date":"2020-11-07","stage_classifiercode":"20-01","member_number":"L1476","first_name":"JAMES","last_name":"CHESTNUT","classification":"U","division":"CARRY OPTICS","hit_factor":4.3478},{"match_name":"SFA USPSA JANUARY 16 2021 MATCH","match_date":"2021-01-16","stage_classifiercode":"20-01","member_number":"PENDING","first_name":"LAWRENCE","last_name":"VANDYKE","classification":"U - I don't know and don't care","division":"CARRY OPTICS","hit_factor":4.3478},{"match_name":"Hosemonster Action  ","match_date":"2021-01-17","stage_classifiercode":"20-01","member_number":"TY123809","first_name":"RICHARD","last_name":"CHRISTESON","classification":"C","division":"CARRY OPTICS","hit_factor":4.344},{"match_name":"Wallis Orchard Practical Shooters April 2021 Club Match","match_date":"2021-04-18","stage_classifiercode":"20-01","member_number":"a114636","first_name":"JIM","last_name":"HAVENS","classification":"A","division":"CARRY OPTICS","hit_factor":4.3427},{"match_name":"OPSC USPSA JUNE 2021","match_date":"2021-06-13","stage_classifiercode":"20-01","member_number":"PEN","first_name":"BRANDON","last_name":"GARCIA","classification":"U (UNCLASSIFIED)","division":"CARRY OPTICS","hit_factor":4.3413},{"match_name":"Tehama Shooters November 2020 USPSA","match_date":"2020-11-28","stage_classifiercode":"20-01","member_number":"TY114068","first_name":"TRACY","last_name":"DUARTE","classification":"C","division":"CARRY OPTICS","hit_factor":4.3406},{"match_name":"APSC USPSA 11-7-20","match_date":"2020-11-07","stage_classifiercode":"20-01","member_number":"A131182","first_name":"LUCA","last_name":"BARBERA","classification":"U","division":"CARRY OPTICS","hit_factor":4.3373},{"match_name":"GFDS POSTAL MATCH USPSA 10/2/2021 hosted by Glacier Practical Shooters","match_date":"2021-10-02","stage_classifiercode":"20-01","member_number":"FY123958","first_name":"JUSTIN","last_name":"PRITCHARD","classification":"U","division":"CARRY OPTICS","hit_factor":4.3353},{"match_name":"OREGON ARPC CC05 USPSA OCT 9 2021","match_date":"2021-10-09","stage_classifiercode":"20-01","member_number":"none","first_name":"DANIEL","last_name":"MATZINGER","classification":"U","division":"CARRY OPTICS","hit_factor":4.3339},{"match_name":"Coastal Area Practical Shooters 10-23-21","match_date":"2021-10-23","stage_classifiercode":"20-01","member_number":"A124019","first_name":"ESTEBAN","last_name":"VIALIZ","classification":"U","division":"CARRY OPTICS","hit_factor":4.3321},{"match_name":"Maine Practical Shooters May 2021","match_date":"2021-05-08","stage_classifiercode":"20-01","member_number":"A118203","first_name":"KEITH","last_name":"ALBEE","classification":"B","division":"CARRY OPTICS","hit_factor":4.3315},{"match_name":"QPS Quantico Shooting Club December USPSA   ","match_date":"2020-12-12","stage_classifiercode":"20-01","member_number":"A116580","first_name":"JESSE","last_name":"WALKER","classification":"U","division":"CARRY OPTICS","hit_factor":4.3315},{"match_name":"Richmond Boro Gun Club Monthly USPSA Match May 2021","match_date":"2021-05-08","stage_classifiercode":"20-01","member_number":"TY82583","first_name":"MICHAEL","last_name":"CHEN","classification":"B","division":"CARRY OPTICS","hit_factor":4.3315},{"match_name":"WSPS MARCH 2021 USPSA","match_date":"2021-03-20","stage_classifiercode":"20-01","member_number":"ty31868","first_name":"DENNIS","last_name":"BOYLE","classification":"A","division":"CARRY OPTICS","hit_factor":4.329},{"match_name":"Richmond Hot Shots Aug 14-15-2021 USPSA","match_date":"2021-08-14","stage_classifiercode":"20-01","member_number":"A129609","first_name":"ATHAN","last_name":"MANINGAS","classification":"C","division":"CARRY OPTICS","hit_factor":4.3269},{"match_name":"LdF USPSA Classifier Match December 12 2020","match_date":"2020-12-12","stage_classifiercode":"20-01","member_number":"A126734","first_name":"AVIN","last_name":"KIM","classification":"U","division":"CARRY OPTICS","hit_factor":4.3259},{"match_name":"CTASA - 3rd Sunday USPSA at Triple C Range - 12-20-2020","match_date":"2020-12-20","stage_classifiercode":"20-01","member_number":"A130759","first_name":"TODD","last_name":"FLETCHER","classification":"U","division":"CARRY OPTICS","hit_factor":4.3251},{"match_name":"Matamoras USPSA September 2021","match_date":"2021-09-19","stage_classifiercode":"20-01","member_number":"TY130890","first_name":"LOU","last_name":"MIGLIACCI","classification":"D","division":"CARRY OPTICS","hit_factor":4.3235},{"match_name":"Oh Shoot -PRG Nov 27th - Uspsa Classifier Match","match_date":"2021-11-27","stage_classifiercode":"20-01","member_number":"TY120846","first_name":"VICTOR","last_name":"FRACASSA","classification":"U","division":"CARRY OPTICS","hit_factor":4.3222},{"match_name":"SCPS ECO19 January 23rd 2021","match_date":"2021-01-22","stage_classifiercode":"20-01","member_number":"A90627","first_name":"RUSTIN","last_name":"SLAUGHTER","classification":"U","division":"CARRY OPTICS","hit_factor":4.3222},{"match_name":"Vortex Edge USPSA October 2021","match_date":"2021-10-09","stage_classifiercode":"20-01","member_number":"A134454","first_name":"JIMMY","last_name":"MAIER","classification":"U","division":"CARRY OPTICS","hit_factor":4.3155},{"match_name":"LdF USPSA Classifier Match December 12 2020","match_date":"2020-12-12","stage_classifiercode":"20-01","member_number":"A92662","first_name":"JONATHON","last_name":"MCMENAMY","classification":"U","division":"CARRY OPTICS","hit_factor":4.3127},{"match_name":"Heartland PS USPSA *ALL CLASSIFIER* 18 July 2021","match_date":"2021-07-18","stage_classifiercode":"20-01","member_number":"TY74763","first_name":"JESSE","last_name":"HILGER","classification":"U","division":"CARRY OPTICS","hit_factor":4.3123},{"match_name":"Oh Shoot -PRG Nov 27th - Uspsa Classifier Match","match_date":"2021-11-27","stage_classifiercode":"20-01","member_number":"TY136582","first_name":"FRANK","last_name":"DUARTE","classification":"U","division":"CARRY OPTICS","hit_factor":4.311},{"match_name":"MCAS 2021 USPSA Classifier League","match_date":"2021-05-26","stage_classifiercode":"20-01","member_number":"A130483","first_name":"TRAVIS","last_name":"ROBINSON","classification":"C","division":"CARRY OPTICS","hit_factor":4.3095},{"match_name":"GCL Monthly USPSA Match Saturday 11-6-2021  INDOORS","match_date":"2021-11-06","stage_classifiercode":"20-01","member_number":"A110729","first_name":"RUSS","last_name":"MARCHESE JR","classification":"C","division":"CARRY OPTICS","hit_factor":4.3077},{"match_name":"Richmond Hot Shots Aug 14-15-2021 USPSA","match_date":"2021-08-14","stage_classifiercode":"20-01","member_number":"A122309","first_name":"RYAN","last_name":"MCDONNELL","classification":"B","division":"CARRY OPTICS","hit_factor":4.3073},{"match_name":"Shadow Hawk Defense USPSA - Sep Sat","match_date":"2021-09-11","stage_classifiercode":"20-01","member_number":"Ty88414","first_name":"MIKE","last_name":"BRUNSON","classification":"B","division":"CARRY OPTICS","hit_factor":4.3044},{"match_name":"GCL Monthly USPSA Match Saturday 11-6-2021  INDOORS","match_date":"2021-11-06","stage_classifiercode":"20-01","member_number":"FY74975","first_name":"BILL","last_name":"STEGER","classification":"B","division":"CARRY OPTICS","hit_factor":4.3028},{"match_name":"ESPS  USPSA  March","match_date":"2021-03-27","stage_classifiercode":"20-01","member_number":"TY103554","first_name":"PATRICK","last_name":"MCALLISTER","classification":"U","division":"CARRY OPTICS","hit_factor":4.3028},{"match_name":"YRPA USPSA May 2nd 2021","match_date":"2021-05-02","stage_classifiercode":"20-01","member_number":"A111031","first_name":"BRYNN","last_name":"SHELTON","classification":"C","division":"CARRY OPTICS","hit_factor":4.3011},{"match_name":"ANPRACS USPSA 9-4-21","match_date":"2021-09-04","stage_classifiercode":"20-01","member_number":"FY47478","first_name":"ALLEN","last_name":"CHAPMAN","classification":"B","division":"CARRY OPTICS","hit_factor":4.2972},{"match_name":"YMM  IPSC02 2021_01_10","match_date":"2021-01-10","stage_classifiercode":"20-01","member_number":"A131385","first_name":"RYAN","last_name":"GOFF","classification":"U","division":"CARRY OPTICS","hit_factor":4.2959},{"match_name":"MRPC OHS02 06272021","match_date":"2021-06-27","stage_classifiercode":"20-01","member_number":"A79385","first_name":"JAMES","last_name":"GARTHER","classification":"U","division":"CARRY OPTICS","hit_factor":4.2959},{"match_name":"MCRC USPSA March 2021","match_date":"2021-03-13","stage_classifiercode":"20-01","member_number":"L2945","first_name":"LEE","last_name":"ROUSE","classification":"U","division":"CARRY OPTICS","hit_factor":4.2955},{"match_name":"Ontelaunee USPSA November 2020","match_date":"2020-11-20","stage_classifiercode":"20-01","member_number":"TY71971","first_name":"ED","last_name":"BRADLEY","classification":"C","division":"CARRY OPTICS","hit_factor":4.2931},{"match_name":"TPS USPSA at CMP Dec 19 2020 Special Classifier Match","match_date":"2020-12-19","stage_classifiercode":"20-01","member_number":"TY94603","first_name":"\"RONALDO \"\"SHERIFF \"\"\"","last_name":"BORGES","classification":"C","division":"CARRY OPTICS","hit_factor":4.2918},{"match_name":"LdF USPSA Classifier Match December 12 2020","match_date":"2020-12-12","stage_classifiercode":"20-01","member_number":"A131841","first_name":"LUCAS","last_name":"ELLIN","classification":"U","division":"CARRY OPTICS","hit_factor":4.2891},{"match_name":"Cowtown Pistol Club USPSA MONDAY November 1 2021","match_date":"2021-11-02","stage_classifiercode":"20-01","member_number":"A135891","first_name":"MARK","last_name":"SMITH","classification":"C","division":"CARRY OPTICS","hit_factor":4.2869},{"match_name":"NISA August 2021","match_date":"2021-08-22","stage_classifiercode":"20-01","member_number":"TY106580","first_name":"ROBERT","last_name":"ALAMO","classification":"B","division":"CARRY OPTICS","hit_factor":4.2842},{"match_name":"2020-12-05 USPSA  at Phoenix Rod and Gun Club","match_date":"2020-12-05","stage_classifiercode":"20-01","member_number":"A125768","first_name":"AVERY","last_name":"GLENDENNING","classification":"D","division":"CARRY OPTICS","hit_factor":4.2773},{"match_name":"RBGC USPSA 2021-01-23","match_date":"2021-01-23","stage_classifiercode":"20-01","member_number":"A99465","first_name":"JOHN","last_name":"IRIZARRY","classification":"C","division":"CARRY OPTICS","hit_factor":4.2735},{"match_name":"Hampden RPC November USPSA Match","match_date":"2020-11-08","stage_classifiercode":"20-01","member_number":"A130758","first_name":"JORDAN","last_name":"LOBLEY","classification":"C","division":"CARRY OPTICS","hit_factor":4.2728},{"match_name":"APSC USPSA 08-21-21","match_date":"2021-08-21","stage_classifiercode":"20-01","member_number":"A124182","first_name":"ANDY","last_name":"STOCKWELL","classification":"C","division":"CARRY OPTICS","hit_factor":4.2722},{"match_name":"Quinton USPSA - April 10 2021","match_date":"2021-04-10","stage_classifiercode":"20-01","member_number":"TY102571","first_name":"GLEN","last_name":"WEEKS","classification":"A","division":"CARRY OPTICS","hit_factor":4.2708},{"match_name":"ESPS  USPSA  March","match_date":"2021-03-27","stage_classifiercode":"20-01","member_number":"A81132","first_name":"JERRY","last_name":"OBRIEN","classification":"C","division":"CARRY OPTICS","hit_factor":4.2699},{"match_name":"FBURG September 2021 USPSA","match_date":"2021-09-05","stage_classifiercode":"20-01","member_number":"A27108","first_name":"RANDY","last_name":"MCFARLAND","classification":"U","division":"CARRY OPTICS","hit_factor":4.2688},{"match_name":"Matamoras USPSA September 2021","match_date":"2021-09-19","stage_classifiercode":"20-01","member_number":"TY115712","first_name":"FRED","last_name":"LIPE","classification":"C","division":"CARRY OPTICS","hit_factor":4.2688},{"match_name":"RBGC USPSA 2021-01-23","match_date":"2021-01-23","stage_classifiercode":"20-01","member_number":"A127140","first_name":"MIKE","last_name":"MELANCON","classification":"C","division":"CARRY OPTICS","hit_factor":4.2659},{"match_name":"Shadow Hawk Defense - USPSA Dec 13th","match_date":"2020-12-13","stage_classifiercode":"20-01","member_number":"TY12067","first_name":"MAJA","last_name":"TAJIMA","classification":"C","division":"CARRY OPTICS","hit_factor":4.2644},{"match_name":"Richmond Hot Shots Aug 14-15-2021 USPSA","match_date":"2021-08-14","stage_classifiercode":"20-01","member_number":"A132031","first_name":"DAVID","last_name":"CHRISTY","classification":"U","division":"CARRY OPTICS","hit_factor":4.262},{"match_name":"USPSA Strategic Edge SEGR May 15th 2021","match_date":"2021-05-15","stage_classifiercode":"20-01","member_number":"F123002","first_name":"PHILIPPE","last_name":"BROUARD","classification":"B","division":"CARRY OPTICS","hit_factor":4.262},{"match_name":"TTS USPSA Match 12JUN2021","match_date":"2021-06-12","stage_classifiercode":"20-01","member_number":"Ty130790","first_name":"JACK","last_name":"LIU","classification":"U","division":"CARRY OPTICS","hit_factor":4.2587},{"match_name":"Bass River USPSA May 2021","match_date":"2021-05-02","stage_classifiercode":"20-01","member_number":"B57","first_name":"DAVID","last_name":"BOLD","classification":"B","division":"CARRY OPTICS","hit_factor":4.2583},{"match_name":"Magnolia Rifle and Pistol Club May  2021 USPSA Match","match_date":"2021-05-15","stage_classifiercode":"20-01","member_number":"A86560","first_name":"DARRELL","last_name":"CAREY","classification":"B","division":"CARRY OPTICS","hit_factor":4.2553},{"match_name":"RBGC USPSA 2021-01-23","match_date":"2021-01-23","stage_classifiercode":"20-01","member_number":"A129425","first_name":"JOHN","last_name":"VISSER","classification":"U","division":"CARRY OPTICS","hit_factor":4.2553},{"match_name":"Hosemonster Action  ","match_date":"2021-01-17","stage_classifiercode":"20-01","member_number":"l4840","first_name":"JASON","last_name":"GAO","classification":"C","division":"CARRY OPTICS","hit_factor":4.2527},{"match_name":"LdF USPSA Match November 7 2021","match_date":"2021-11-07","stage_classifiercode":"20-01","member_number":"TY122069","first_name":"WILLIAM","last_name":"MCNEESE","classification":"U","division":"CARRY OPTICS","hit_factor":4.2521},{"match_name":"BORCC USPSA April 2021","match_date":"2021-04-17","stage_classifiercode":"20-01","member_number":"L1531","first_name":"STEVE","last_name":"HAINES","classification":"C","division":"CARRY OPTICS","hit_factor":4.2516},{"match_name":"Heartland PS USPSA *ALL CLASSIFIER* 18 July 2021","match_date":"2021-07-18","stage_classifiercode":"20-01","member_number":"A132690","first_name":"TYREL","last_name":"SPRAGUE","classification":"U","division":"CARRY OPTICS","hit_factor":4.2478},{"match_name":"WGC AUGUST 2021 USPSA CLASSIFIER MATCH","match_date":"2021-08-08","stage_classifiercode":"20-01","member_number":"A123584","first_name":"CHRYS","last_name":"BURNS","classification":"C","division":"CARRY OPTICS","hit_factor":4.2418},{"match_name":"Maine Practical Shooters May 2021","match_date":"2021-05-08","stage_classifiercode":"20-01","member_number":"A113740","first_name":"DAVID","last_name":"BOONE","classification":"B","division":"CARRY OPTICS","hit_factor":4.2389},{"match_name":"Wallis Orchard Practical Shooters April 2021 Club Match","match_date":"2021-04-18","stage_classifiercode":"20-01","member_number":"L4670","first_name":"ROMAN","last_name":"GWISCZ","classification":"A","division":"CARRY OPTICS","hit_factor":4.2383},{"match_name":"RBGC USPSA 2021-01-23","match_date":"2021-01-23","stage_classifiercode":"20-01","member_number":"A107497","first_name":"HARLEY","last_name":"WIEGERT","classification":"A","division":"CARRY OPTICS","hit_factor":4.2322},{"match_name":"OREGON ARPC CC05 USPSA OCT 9 2021","match_date":"2021-10-09","stage_classifiercode":"20-01","member_number":"A70123","first_name":"MARK","last_name":"SUE","classification":"M","division":"CARRY OPTICS","hit_factor":4.2292},{"match_name":"Cactus USPSA ALL CLASSIFIER January 2021","match_date":"2021-01-03","stage_classifiercode":"20-01","member_number":"ty114395","first_name":"JOHN","last_name":"MCKEAN","classification":"U","division":"CARRY OPTICS","hit_factor":4.2274},{"match_name":"MRPC OHS02 06272021","match_date":"2021-06-27","stage_classifiercode":"20-01","member_number":"A125918","first_name":"JOSH","last_name":"ELDRIDGE","classification":"B","division":"CARRY OPTICS","hit_factor":4.2271},{"match_name":"Dundee Practical Shooters - Feb 27 2021","match_date":"2021-02-27","stage_classifiercode":"20-01","member_number":"a38510","first_name":"ERIC","last_name":"FALKNER","classification":"C","division":"CARRY OPTICS","hit_factor":4.223},{"match_name":"CTASA - 3rd Sunday USPSA at Triple C Range - 12-20-2020","match_date":"2020-12-20","stage_classifiercode":"20-01","member_number":"TY101659","first_name":"MARK","last_name":"DRAPER","classification":"C","division":"CARRY OPTICS","hit_factor":4.222},{"match_name":"ACPSA November 2020","match_date":"2020-11-28","stage_classifiercode":"20-01","member_number":"TY73162","first_name":"STEVEN","last_name":"BEALL","classification":"U","division":"CARRY OPTICS","hit_factor":4.2169},{"match_name":"SOAP December 2020 USPSA Match","match_date":"2020-12-11","stage_classifiercode":"20-01","member_number":"A106629","first_name":"MARY-GRACE","last_name":"MCMAHON","classification":"C","division":"CARRY OPTICS","hit_factor":4.2164},{"match_name":"RBGC USPSA 2021-01-23","match_date":"2021-01-23","stage_classifiercode":"20-01","member_number":"TY94721","first_name":"ROBERT","last_name":"MCCOLL","classification":"C","division":"CARRY OPTICS","hit_factor":4.2163},{"match_name":"Nampa USPSA September 10th 2021 Classifier Match","match_date":"2021-09-10","stage_classifiercode":"20-01","member_number":"A133918","first_name":"BRENDEN","last_name":"WHEELER","classification":"C","division":"CARRY OPTICS","hit_factor":4.2105},{"match_name":"GAS MAY 2021 USPSA","match_date":"2021-05-01","stage_classifiercode":"20-01","member_number":"A111097","first_name":"KAREN","last_name":"PARKER","classification":"C","division":"CARRY OPTICS","hit_factor":4.2105},{"match_name":"EAGC January 2021 USPSA Classifier Match","match_date":"2021-01-30","stage_classifiercode":"20-01","member_number":"L3733","first_name":"MARK","last_name":"KAUDER","classification":"C","division":"CARRY OPTICS","hit_factor":4.2029},{"match_name":"SOAP July 2021 USPSA Match","match_date":"2021-07-11","stage_classifiercode":"20-01","member_number":"Fy101699","first_name":"DON","last_name":"HAN","classification":"B","division":"CARRY OPTICS","hit_factor":4.2017},{"match_name":"GRB USPSA JANUARY 2021 AT CAVALIER","match_date":"2021-01-16","stage_classifiercode":"20-01","member_number":"A121042","first_name":"AARON","last_name":"RUBIN","classification":"C","division":"CARRY OPTICS","hit_factor":4.2011},{"match_name":"CCPL 11-8-2020","match_date":"2020-11-08","stage_classifiercode":"20-01","member_number":"A127842","first_name":"GEORGE","last_name":"WAYNE","classification":"A","division":"CARRY OPTICS","hit_factor":4.2008},{"match_name":"Quinton USPSA - April 10 2021","match_date":"2021-04-10","stage_classifiercode":"20-01","member_number":"A117315","first_name":"RAYMOND","last_name":"ZUENDEL","classification":"D","division":"CARRY OPTICS","hit_factor":4.1999},{"match_name":"SKSC USPSA Oct 2021","match_date":"2021-10-16","stage_classifiercode":"20-01","member_number":"A128845","first_name":"ALEXIS","last_name":"CHENEY","classification":"C","division":"CARRY OPTICS","hit_factor":4.1968},{"match_name":"D.I.D -ShootOut!- 9-21-21","match_date":"2021-09-21","stage_classifiercode":"20-01","member_number":"ty126034","first_name":"SAM","last_name":"LITTLEFIELD","classification":"B","division":"CARRY OPTICS","hit_factor":4.1958},{"match_name":"Coyote Arms Classifier Match 10-31-21","match_date":"2021-10-31","stage_classifiercode":"20-01","member_number":"L4116","first_name":"HENRY","last_name":"RUIZ","classification":"B","division":"CARRY OPTICS","hit_factor":4.1951},{"match_name":"Fast 7-30-21","match_date":"2021-07-30","stage_classifiercode":"20-01","member_number":"FY62295","first_name":"DAVE","last_name":"MORRIS","classification":"A","division":"CARRY OPTICS","hit_factor":4.1925},{"match_name":"OPSC USPSA JUNE 2021","match_date":"2021-06-13","stage_classifiercode":"20-01","member_number":"TY94514","first_name":"JAKI","last_name":"SALLIS","classification":"C","division":"CARRY OPTICS","hit_factor":4.1905},{"match_name":"NHRPC - November 2021 USPSA","match_date":"2021-11-13","stage_classifiercode":"20-01","member_number":"TY137082","first_name":"GEORGE","last_name":"LEE","classification":"U","division":"CARRY OPTICS","hit_factor":4.1876},{"match_name":"EWPSA 2021-04","match_date":"2021-04-17","stage_classifiercode":"20-01","member_number":"A133931","first_name":"PAUL","last_name":"HUGHES","classification":"U","division":"CARRY OPTICS","hit_factor":4.1854},{"match_name":"LPRGC- Lower Providence USPSA Nov 2020 Match","match_date":"2020-11-07","stage_classifiercode":"20-01","member_number":"TY112467","first_name":"GERRY","last_name":"HENDERSON","classification":"D","division":"CARRY OPTICS","hit_factor":4.1841},{"match_name":"CFRPC USPSA 2021-11-14","match_date":"2021-11-14","stage_classifiercode":"20-01","member_number":"Ty83237","first_name":"LEN","last_name":"KRAVITZ","classification":"C","division":"CARRY OPTICS","hit_factor":4.1828},{"match_name":"NHRPC - November 2021 USPSA","match_date":"2021-11-13","stage_classifiercode":"20-01","member_number":"A119940","first_name":"KWASI","last_name":"ASANTE","classification":"A","division":"CARRY OPTICS","hit_factor":4.1825},{"match_name":"Heartland PS USPSA *ALL CLASSIFIER* 18 July 2021","match_date":"2021-07-18","stage_classifiercode":"20-01","member_number":"A105669","first_name":"CALEB","last_name":"DIEDRICHS","classification":"U","division":"CARRY OPTICS","hit_factor":4.1739},{"match_name":"SCAPSA MN05 SPRING 6","match_date":"2021-05-18","stage_classifiercode":"20-01","member_number":"A133484","first_name":"JEFF","last_name":"BAUERLY","classification":"U","division":"CARRY OPTICS","hit_factor":4.1725},{"match_name":"YRPA USPSA May 2nd 2021","match_date":"2021-05-02","stage_classifiercode":"20-01","member_number":"TY35490","first_name":"MARK","last_name":"BRADLEY","classification":"M","division":"CARRY OPTICS","hit_factor":4.1711},{"match_name":"TPS USPSA at CMP Dec 19 2020 Special Classifier Match","match_date":"2020-12-19","stage_classifiercode":"20-01","member_number":"A124995","first_name":"SHANNON","last_name":"WOMACK","classification":"C","division":"CARRY OPTICS","hit_factor":4.1667},{"match_name":"SCPS ECO19 January 23rd 2021","match_date":"2021-01-22","stage_classifiercode":"20-01","member_number":"A129677","first_name":"MELISSA","last_name":"MARSHALL","classification":"U","division":"CARRY OPTICS","hit_factor":4.1667},{"match_name":"LdF USPSA Match November 7 2021","match_date":"2021-11-07","stage_classifiercode":"20-01","member_number":"A53164","first_name":"MATT","last_name":"DOBBS","classification":"U","division":"CARRY OPTICS","hit_factor":4.1632},{"match_name":"SFPS 5-16-21 Super Classifier","match_date":"2021-05-16","stage_classifiercode":"20-01","member_number":"FY126904","first_name":"DAN","last_name":"WALINSKY","classification":"D","division":"CARRY OPTICS","hit_factor":4.1609},{"match_name":"Hallstead USPSA April 24 match","match_date":"2021-04-24","stage_classifiercode":"20-01","member_number":"A130008","first_name":"KEVIN","last_name":"KRINER","classification":"C","division":"CARRY OPTICS","hit_factor":4.1602},{"match_name":"OPSC USPSA JUNE 2021","match_date":"2021-06-13","stage_classifiercode":"20-01","member_number":"A113209","first_name":"CHUCK","last_name":"GRECO","classification":"C","division":"CARRY OPTICS","hit_factor":4.16},{"match_name":"Collin County USPSA  08-22-2021","match_date":"2021-08-22","stage_classifiercode":"20-01","member_number":"A105700","first_name":"BENJAMIN","last_name":"NG","classification":"B","division":"CARRY OPTICS","hit_factor":4.1512},{"match_name":"LdF USPSA Classifier Match December 12 2020","match_date":"2020-12-12","stage_classifiercode":"20-01","member_number":"A131140","first_name":"REMIN","last_name":"PINEDA","classification":"U","division":"CARRY OPTICS","hit_factor":4.1512},{"match_name":"LdF USPSA Classifier Match December 12 2020","match_date":"2020-12-12","stage_classifiercode":"20-01","member_number":"TY37963","first_name":"ED","last_name":"FERRELL","classification":"C","division":"CARRY OPTICS","hit_factor":4.1494},{"match_name":"Mesilla Valley P September 2021 classifier match","match_date":"2021-09-04","stage_classifiercode":"20-01","member_number":"a106409","first_name":"JOHN","last_name":"SHNOWSKE","classification":"B","division":"CARRY OPTICS","hit_factor":4.1451},{"match_name":"RBGC USPSA 2021-01-23","match_date":"2021-01-23","stage_classifiercode":"20-01","member_number":"TY116461","first_name":"BRIAN","last_name":"CEMBOR","classification":"U","division":"CARRY OPTICS","hit_factor":4.1441},{"match_name":"LNDL July 11th Classifier Match","match_date":"2021-07-11","stage_classifiercode":"20-01","member_number":"TY76427","first_name":"BILL","last_name":"COLLINS","classification":"U","division":"CARRY OPTICS","hit_factor":4.1408},{"match_name":"Richmond Boro Gun Club Monthly USPSA Match May 2021","match_date":"2021-05-08","stage_classifiercode":"20-01","member_number":"TY71971","first_name":"ED","last_name":"BRADLEY","classification":"C","division":"CARRY OPTICS","hit_factor":4.1399},{"match_name":"OK06-30OCT21-SCRP-USPSA","match_date":"2021-10-30","stage_classifiercode":"20-01","member_number":"L4083","first_name":"HAZEN","last_name":"BAZINET","classification":"U","division":"CARRY OPTICS","hit_factor":4.1369},{"match_name":"SFA USPSA November 20 2021 MATCH","match_date":"2021-11-20","stage_classifiercode":"20-01","member_number":"TY113849","first_name":"CHRIS","last_name":"NORFOLK","classification":"U - I don't know and don't care","division":"CARRY OPTICS","hit_factor":4.1348},{"match_name":"Fast 7-30-21","match_date":"2021-07-30","stage_classifiercode":"20-01","member_number":"FY62295","first_name":"DAVE","last_name":"MORRIS2","classification":"A","division":"CARRY OPTICS","hit_factor":4.1344},{"match_name":"NHRPC - November 2021 USPSA","match_date":"2021-11-13","stage_classifiercode":"20-01","member_number":"A106207","first_name":"SHERLEY","last_name":"VASQUEZ","classification":"U","division":"CARRY OPTICS","hit_factor":4.1294},{"match_name":"CIPSC IL02 Havana August USPSA","match_date":"2021-08-07","stage_classifiercode":"20-01","member_number":"A104730","first_name":"JON","last_name":"NEUBAUM","classification":"B","division":"CARRY OPTICS","hit_factor":4.1221},{"match_name":"Coyote Arms Classifier Match 10-31-21","match_date":"2021-10-31","stage_classifiercode":"20-01","member_number":"A45644","first_name":"TRACY","last_name":"SELF","classification":"B","division":"CARRY OPTICS","hit_factor":4.119},{"match_name":"Vortex Edge USPSA October 2021","match_date":"2021-10-09","stage_classifiercode":"20-01","member_number":"A134861","first_name":"LLOYD","last_name":"MAIER","classification":"U","division":"CARRY OPTICS","hit_factor":4.1172},{"match_name":"SOAP July 2021 USPSA Match","match_date":"2021-07-11","stage_classifiercode":"20-01","member_number":"A134111","first_name":"VIET","last_name":"NGUYEN","classification":"U","division":"CARRY OPTICS","hit_factor":4.1159},{"match_name":"MCAS MAY 2021 USPSA","match_date":"2021-05-15","stage_classifiercode":"20-01","member_number":"TY-92356","first_name":"JAY","last_name":"SHEARER","classification":"C","division":"CARRY OPTICS","hit_factor":4.1116},{"match_name":"CAS classifier match","match_date":"2021-08-01","stage_classifiercode":"20-01","member_number":"A127275","first_name":"KEN","last_name":"ROGERS SR","classification":"U","division":"CARRY OPTICS","hit_factor":4.1086},{"match_name":"Cactus USPSA ALL CLASSIFIER January 2021","match_date":"2021-01-03","stage_classifiercode":"20-01","member_number":"a88737","first_name":"GEORGE","last_name":"VESELY","classification":"B","division":"CARRY OPTICS","hit_factor":4.1026},{"match_name":"LIPSA  - March  21st  2021 - March Madness USPSA Match ","match_date":"2021-03-21","stage_classifiercode":"20-01","member_number":"A74383","first_name":"PAUL","last_name":"ROBINSON","classification":"C","division":"CARRY OPTICS","hit_factor":4.0966},{"match_name":"MCAS 2021 USPSA Classifier League","match_date":"2021-05-26","stage_classifiercode":"20-01","member_number":"TY95730","first_name":"PATTI","last_name":"LAHAIE","classification":"C","division":"CARRY OPTICS","hit_factor":4.096},{"match_name":"Quinton USPSA - April 10 2021","match_date":"2021-04-10","stage_classifiercode":"20-01","member_number":"TY88493","first_name":"PETER","last_name":"DIDONATO","classification":"B","division":"CARRY OPTICS","hit_factor":4.0945},{"match_name":"MCRC USPSA March 2021","match_date":"2021-03-13","stage_classifiercode":"20-01","member_number":"TY101414","first_name":"RON","last_name":"LEGASPI","classification":"U","division":"CARRY OPTICS","hit_factor":4.0945},{"match_name":"Medford USPSA Oct 2021 Match","match_date":"2021-10-17","stage_classifiercode":"20-01","member_number":"A132606","first_name":"RON","last_name":"KING","classification":"U","division":"CARRY OPTICS","hit_factor":4.0906},{"match_name":"CFRPC USPSA 2021-11-14","match_date":"2021-11-14","stage_classifiercode":"20-01","member_number":"L4119","first_name":"MORGAN","last_name":"GORING","classification":"U","division":"CARRY OPTICS","hit_factor":4.09},{"match_name":"Square Deal Sportsmen June USPSA Match 2021","match_date":"2021-06-06","stage_classifiercode":"20-01","member_number":"A121767","first_name":"JOE","last_name":"HAINES","classification":"B","division":"CARRY OPTICS","hit_factor":4.0881},{"match_name":"CAS classifier match","match_date":"2021-08-01","stage_classifiercode":"20-01","member_number":"A132024","first_name":"BRADY","last_name":"DELATTE","classification":"U","division":"CARRY OPTICS","hit_factor":4.0878},{"match_name":"BORCC USPSA April 2021","match_date":"2021-04-17","stage_classifiercode":"20-01","member_number":"L324","first_name":"MICHAEL","last_name":"BACA","classification":"U","division":"CARRY OPTICS","hit_factor":4.0848},{"match_name":"LdF USPSA Classifier Match December 12 2020","match_date":"2020-12-12","stage_classifiercode":"20-01","member_number":"L1424","first_name":"TIMOTHY","last_name":"STEFFEN","classification":"U","division":"CARRY OPTICS","hit_factor":4.0847},{"match_name":"WI21 Apr 25 2021","match_date":"2021-04-25","stage_classifiercode":"20-01","member_number":"TY96480","first_name":"KEN","last_name":"SCHMIDTCHEN","classification":"B","division":"CARRY OPTICS","hit_factor":4.0816},{"match_name":"AIPS Weekly USPSA 8 June 2021","match_date":"2021-06-08","stage_classifiercode":"20-01","member_number":"PEN","first_name":"ERIK","last_name":"STONEBERG","classification":"Unclassified","division":"CARRY OPTICS","hit_factor":4.0816},{"match_name":"Richmond Boro Gun Club Monthly USPSA Match May 2021","match_date":"2021-05-08","stage_classifiercode":"20-01","member_number":"L4964","first_name":"KYLE","last_name":"KIM","classification":"B","division":"CARRY OPTICS","hit_factor":4.0794},{"match_name":"Shadow Hawk Defense USPSA - Sep Sat","match_date":"2021-09-11","stage_classifiercode":"20-01","member_number":"L5004","first_name":"STEPHEN","last_name":"DOUGHERTY","classification":"C","division":"CARRY OPTICS","hit_factor":4.0783},{"match_name":"Matamoras USPSA September 2021","match_date":"2021-09-19","stage_classifiercode":"20-01","member_number":"A100049","first_name":"PATRICK","last_name":"HURLEY","classification":"U","division":"CARRY OPTICS","hit_factor":4.0759},{"match_name":"EWPSA 2021-04","match_date":"2021-04-17","stage_classifiercode":"20-01","member_number":"A129295","first_name":"JON","last_name":"DAYTON","classification":"C","division":"CARRY OPTICS","hit_factor":4.0741},{"match_name":"LGCSEMPS April 2021 Special Classifier","match_date":"2021-04-11","stage_classifiercode":"20-01","member_number":"A112634","first_name":"KRYSTAL","last_name":"PERRY","classification":"D","division":"CARRY OPTICS","hit_factor":4.0727},{"match_name":"2020-12-05 USPSA  at Phoenix Rod and Gun Club","match_date":"2020-12-05","stage_classifiercode":"20-01","member_number":"A5723","first_name":"MICHAEL","last_name":"HIGASHI","classification":"U","division":"CARRY OPTICS","hit_factor":4.0727},{"match_name":"MAPSA 5/8/21","match_date":"2021-05-08","stage_classifiercode":"20-01","member_number":"A122586","first_name":"RALPH","last_name":"CHU","classification":"D","division":"CARRY OPTICS","hit_factor":4.0689},{"match_name":"OREGON ARPC CC05 USPSA OCT 9 2021","match_date":"2021-10-09","stage_classifiercode":"20-01","member_number":"Fy87796","first_name":"MICHAEL","last_name":"SMITH","classification":"C","division":"CARRY OPTICS","hit_factor":4.0683},{"match_name":"Ontelaunee USPSA November 2020","match_date":"2020-11-20","stage_classifiercode":"20-01","member_number":"TY18643","first_name":"CHARLIE","last_name":"FORDHAM","classification":"C","division":"CARRY OPTICS","hit_factor":4.0673},{"match_name":"Volusia County Gun and Hunt Club","match_date":"2020-11-21","stage_classifiercode":"20-01","member_number":"A102166","first_name":"MICHAEL","last_name":"GEE","classification":"C","division":"CARRY OPTICS","hit_factor":4.065},{"match_name":"GAS MAY 2021 USPSA","match_date":"2021-05-01","stage_classifiercode":"20-01","member_number":"A122633","first_name":"MANNY","last_name":"RODRIGUEZ","classification":"U","division":"CARRY OPTICS","hit_factor":4.0623},{"match_name":"SCPS ECO19 January 23rd 2021","match_date":"2021-01-22","stage_classifiercode":"20-01","member_number":"TY97032","first_name":"NELSON","last_name":"LABRADOR","classification":"C","division":"CARRY OPTICS","hit_factor":4.0617},{"match_name":"Chillicothe Sportsmens Club November USPSA","match_date":"2020-11-21","stage_classifiercode":"20-01","member_number":"TY27598","first_name":"RICHARD(RICK)","last_name":"RICCIONI","classification":"C","division":"CARRY OPTICS","hit_factor":4.0616},{"match_name":"NISA August 2021","match_date":"2021-08-22","stage_classifiercode":"20-01","member_number":"TY111973","first_name":"PAUL","last_name":"DONISCH","classification":"C","division":"CARRY OPTICS","hit_factor":4.0584},{"match_name":"SFPS 5-16-21 Super Classifier","match_date":"2021-05-16","stage_classifiercode":"20-01","member_number":"A76462","first_name":"DENNIS","last_name":"SOMERS","classification":"C","division":"CARRY OPTICS","hit_factor":4.0568},{"match_name":"WLPS May 2021 ALL USPSA Classifier Match ","match_date":"2021-05-23","stage_classifiercode":"20-01","member_number":"A119075","first_name":"RICHARD","last_name":"GERJETS","classification":"U","division":"CARRY OPTICS","hit_factor":4.0519},{"match_name":"RBGC USPSA 2021-01-23","match_date":"2021-01-23","stage_classifiercode":"20-01","member_number":"TY116678","first_name":"MARK","last_name":"HU","classification":"C","division":"CARRY OPTICS","hit_factor":4.0467},{"match_name":"APSC USPSA 11-7-20","match_date":"2020-11-07","stage_classifiercode":"20-01","member_number":"A107428","first_name":"BILL","last_name":"SHARAR","classification":"B","division":"CARRY OPTICS","hit_factor":4.0462},{"match_name":"SCAPSA MN05 SPRING 6","match_date":"2021-05-18","stage_classifiercode":"20-01","member_number":"a111652","first_name":"HENRY","last_name":"WIELAND","classification":"D","division":"CARRY OPTICS","hit_factor":4.0404},{"match_name":"Square Deal Sportsmen June USPSA Match 2021","match_date":"2021-06-06","stage_classifiercode":"20-01","member_number":"TY112888","first_name":"JOHN","last_name":"HUBBARD","classification":"C","division":"CARRY OPTICS","hit_factor":4.0404},{"match_name":"TPS USPSA At CMP July 17 2021","match_date":"2021-07-17","stage_classifiercode":"20-01","member_number":"A114986","first_name":"CHRISTOPHER","last_name":"COLE","classification":"B","division":"CARRY OPTICS","hit_factor":4.0392},{"match_name":"SFPS 5-16-21 Super Classifier","match_date":"2021-05-16","stage_classifiercode":"20-01","member_number":"A120370","first_name":"GOKHAN","last_name":"ANDI","classification":"U","division":"CARRY OPTICS","hit_factor":4.039},{"match_name":"Ontelaunee USPSA November 2020","match_date":"2020-11-20","stage_classifiercode":"20-01","member_number":"L3957","first_name":"MARK","last_name":"EVANS","classification":"C","division":"CARRY OPTICS","hit_factor":4.0373},{"match_name":"Shongum May 2021 USPSA Match","match_date":"2021-05-01","stage_classifiercode":"20-01","member_number":"Ty18643","first_name":"CHARLIE","last_name":"FORDHAM","classification":"C","division":"CARRY OPTICS","hit_factor":4.0359},{"match_name":"MRPC OHS02 06272021","match_date":"2021-06-27","stage_classifiercode":"20-01","member_number":"A115760","first_name":"GREG","last_name":"LEITNER","classification":"C","division":"CARRY OPTICS","hit_factor":4.0323},{"match_name":"JPPS USPSA Match 8-15-2021","match_date":"2021-08-15","stage_classifiercode":"20-01","member_number":"A110086","first_name":"RODNEY","last_name":"CHEDISTER","classification":"C","division":"CARRY OPTICS","hit_factor":4.0299},{"match_name":"TPS USPSA -  January Match 2021 Rescheduled","match_date":"2021-01-03","stage_classifiercode":"20-01","member_number":"FY97416","first_name":"BOB","last_name":"PERKINS","classification":"B","division":"CARRY OPTICS","hit_factor":4.029},{"match_name":"STAGE ZERO  ALL CLASSIFIER","match_date":"2020-11-21","stage_classifiercode":"20-01","member_number":"A131204","first_name":"JOHN","last_name":"HARTLEY99","classification":"U","division":"CARRY OPTICS","hit_factor":4.0279},{"match_name":"Cactus USPSA ALL CLASSIFIER January 2021","match_date":"2021-01-03","stage_classifiercode":"20-01","member_number":"Ty28855","first_name":"PHILLIP","last_name":"GALLEGOS","classification":"B","division":"CARRY OPTICS","hit_factor":4.0268},{"match_name":"AIPS Weekly USPSA 8 June 2021","match_date":"2021-06-08","stage_classifiercode":"20-01","member_number":"A135015","first_name":"TYLER","last_name":"STALLMAN","classification":"Unclassified","division":"CARRY OPTICS","hit_factor":4.0268},{"match_name":"Chillicothe Sportsmens Club November USPSA","match_date":"2020-11-21","stage_classifiercode":"20-01","member_number":"A95517","first_name":"RICK","last_name":"WARD","classification":"C","division":"CARRY OPTICS","hit_factor":4.0258},{"match_name":"Ontelaunee USPSA November 2020","match_date":"2020-11-20","stage_classifiercode":"20-01","member_number":"A119386","first_name":"JACOB","last_name":"MORRIS","classification":"B","division":"CARRY OPTICS","hit_factor":4.0248},{"match_name":"PIPS 04-28-2021","match_date":"2021-04-27","stage_classifiercode":"20-01","member_number":"TY67266","first_name":"MARK","last_name":"SLETNER","classification":"U","division":"CARRY OPTICS","hit_factor":4.0222},{"match_name":"Coyote Arms Classifier Match 10-31-21","match_date":"2021-10-31","stage_classifiercode":"20-01","member_number":"TY11297","first_name":"MIKE","last_name":"MERKLER","classification":"B","division":"CARRY OPTICS","hit_factor":4.0201},{"match_name":"SPSA USPSA January 1st Sat Match","match_date":"2021-01-02","stage_classifiercode":"20-01","member_number":"TY97524","first_name":"IVAN","last_name":"LIECHTY","classification":"C","division":"CARRY OPTICS","hit_factor":4.0119},{"match_name":"JCSSA DEC 5 2020","match_date":"2020-12-05","stage_classifiercode":"20-01","member_number":"A91630","first_name":"LARRY","last_name":"WALDRIP","classification":"C","division":"CARRY OPTICS","hit_factor":4.0032},{"match_name":"NW01 T-Day 2020","match_date":"2020-11-08","stage_classifiercode":"20-01","member_number":"TY130155","first_name":"ROBERT","last_name":"HUBBELL","classification":"U","division":"CARRY OPTICS","hit_factor":4.0028},{"match_name":"MAPSA 5/8/21","match_date":"2021-05-08","stage_classifiercode":"20-01","member_number":"A133374","first_name":"KUE","last_name":"LEE","classification":"U","division":"CARRY OPTICS","hit_factor":4},{"match_name":"WTPS USPSA Match 12.12.2020","match_date":"2020-12-12","stage_classifiercode":"20-01","member_number":"A130090","first_name":"MARISSA","last_name":"HUMPHREY-GUTIERREZ","classification":"U","division":"CARRY OPTICS","hit_factor":3.9943},{"match_name":"QPS Quantico Shooting Club December USPSA   ","match_date":"2020-12-12","stage_classifiercode":"20-01","member_number":"A130435","first_name":"ANDREW","last_name":"LESSON","classification":"U","division":"CARRY OPTICS","hit_factor":3.9941},{"match_name":"SCAPSA MN05 SPRING 6","match_date":"2021-05-18","stage_classifiercode":"20-01","member_number":"TY98004","first_name":"MICHEAL","last_name":"ANGELI","classification":"C","division":"CARRY OPTICS","hit_factor":3.9941},{"match_name":"GCL Monthly USPSA Match Saturday 11-6-2021  INDOORS","match_date":"2021-11-06","stage_classifiercode":"20-01","member_number":"A121737","first_name":"SAMANTHA","last_name":"CROWE","classification":"D","division":"CARRY OPTICS","hit_factor":3.992},{"match_name":"MCAS MAY 2021 USPSA","match_date":"2021-05-15","stage_classifiercode":"20-01","member_number":"A127654","first_name":"QUENTIN","last_name":"RHOADES","classification":"Unclassified","division":"CARRY OPTICS","hit_factor":3.992},{"match_name":"Vortex Edge USPSA October 2021","match_date":"2021-10-09","stage_classifiercode":"20-01","member_number":"Ty 30286","first_name":"STEVEN","last_name":"SCHUMACHER","classification":"C","division":"CARRY OPTICS","hit_factor":3.9847},{"match_name":"Shongum May 2021 USPSA Match","match_date":"2021-05-01","stage_classifiercode":"20-01","member_number":"TY83306","first_name":"ZACK","last_name":"BECKER","classification":"C","division":"CARRY OPTICS","hit_factor":3.9834},{"match_name":"OREGON ARPC CC05 USPSA OCT 9 2021","match_date":"2021-10-09","stage_classifiercode":"20-01","member_number":"A59547","first_name":"STEVE","last_name":"KENDELL","classification":"C","division":"CARRY OPTICS","hit_factor":3.9816},{"match_name":"Medford USPSA March 2021 OR-04","match_date":"2021-03-21","stage_classifiercode":"20-01","member_number":"A126143","first_name":"TRACY","last_name":"EHR","classification":"U","division":"CARRY OPTICS","hit_factor":3.9808},{"match_name":"QPS Quantico Shooting Club December USPSA   ","match_date":"2020-12-12","stage_classifiercode":"20-01","member_number":"L4943","first_name":"ANTHONY","last_name":"RUGGIERO","classification":"U","division":"CARRY OPTICS","hit_factor":3.9801},{"match_name":"Magnolia Rifle and Pistol Club May  2021 USPSA Match","match_date":"2021-05-15","stage_classifiercode":"20-01","member_number":"TY118696","first_name":"DAVID","last_name":"NAGEL","classification":"C","division":"CARRY OPTICS","hit_factor":3.9786},{"match_name":"RPS January 2021 USPSA Match","match_date":"2021-01-09","stage_classifiercode":"20-01","member_number":"A112156","first_name":"PHILLIP","last_name":"DILLARD","classification":"B","division":"CARRY OPTICS","hit_factor":3.9777},{"match_name":"ESPS  USPSA  March","match_date":"2021-03-27","stage_classifiercode":"20-01","member_number":"TY68809","first_name":"JAMES","last_name":"GRAZIANO SR","classification":"U","division":"CARRY OPTICS","hit_factor":3.9768},{"match_name":"Nampa USPSA September 10th 2021 Classifier Match","match_date":"2021-09-10","stage_classifiercode":"20-01","member_number":"A127194","first_name":"KAMERON","last_name":"ERB","classification":"D","division":"CARRY OPTICS","hit_factor":3.9746},{"match_name":"SCPS ECO19 January 23rd 2021","match_date":"2021-01-22","stage_classifiercode":"20-01","member_number":"A112133","first_name":"DON","last_name":"YENGLIN","classification":"C","division":"CARRY OPTICS","hit_factor":3.9735},{"match_name":"NISA August 2021","match_date":"2021-08-22","stage_classifiercode":"20-01","member_number":"A133258","first_name":"ELMER","last_name":"RODRIGUEZ","classification":"C","division":"CARRY OPTICS","hit_factor":3.9722},{"match_name":"OPSC USPSA JUNE 2021","match_date":"2021-06-13","stage_classifiercode":"20-01","member_number":"TY110218","first_name":"REMO","last_name":"BRISENO","classification":"C","division":"CARRY OPTICS","hit_factor":3.9714},{"match_name":"DCSC MONTHLY USPSA MATCH","match_date":"2021-07-02","stage_classifiercode":"20-01","member_number":"A126092","first_name":"DAVID","last_name":"BOTTER","classification":"X","division":"CARRY OPTICS","hit_factor":3.9698},{"match_name":"YMM  IPSC02 2021_01_10","match_date":"2021-01-10","stage_classifiercode":"20-01","member_number":"A104163","first_name":"FRANCIS","last_name":"SANCHEZ","classification":"A","division":"CARRY OPTICS","hit_factor":3.9674},{"match_name":"Vortex Edge USPSA October 2021","match_date":"2021-10-09","stage_classifiercode":"20-01","member_number":"A125144","first_name":"EDWARD","last_name":"RHODES","classification":"B","division":"CARRY OPTICS","hit_factor":3.9652},{"match_name":"Dundee Practical Shooters - Feb 27 2021","match_date":"2021-02-27","stage_classifiercode":"20-01","member_number":"A34601","first_name":"JASON","last_name":"WOODSIDE","classification":"B","division":"CARRY OPTICS","hit_factor":3.9614},{"match_name":"LdF USPSA Classifier Match December 12 2020","match_date":"2020-12-12","stage_classifiercode":"20-01","member_number":"A104163","first_name":"FRANCIS","last_name":"SANCHEZ","classification":"B","division":"CARRY OPTICS","hit_factor":3.9604},{"match_name":"SKSC USPSA Oct 2021","match_date":"2021-10-16","stage_classifiercode":"20-01","member_number":"A108147","first_name":"STEVE","last_name":"BAHR","classification":"C","division":"CARRY OPTICS","hit_factor":3.9604},{"match_name":"FBURG September 2021 USPSA","match_date":"2021-09-05","stage_classifiercode":"20-01","member_number":"A99492","first_name":"SIMON","last_name":"GONZALEZ","classification":"B","division":"CARRY OPTICS","hit_factor":3.9568},{"match_name":"RBGC USPSA 2021-8-15 Special Classifier Match","match_date":"2021-08-15","stage_classifiercode":"20-01","member_number":"A130410","first_name":"BOB","last_name":"MANKER","classification":"D","division":"CARRY OPTICS","hit_factor":3.956},{"match_name":"Coastal Area Practical Shooters 10-23-21","match_date":"2021-10-23","stage_classifiercode":"20-01","member_number":"TY90951","first_name":"JOHN","last_name":"THOMAS II","classification":"U","division":"CARRY OPTICS","hit_factor":3.9552},{"match_name":"Matamoras USPSA September 2021","match_date":"2021-09-19","stage_classifiercode":"20-01","member_number":"A118024","first_name":"TIM","last_name":"PHILLIPS","classification":"U","division":"CARRY OPTICS","hit_factor":3.9548},{"match_name":"Volusia County Gun and Hunt Club","match_date":"2020-11-21","stage_classifiercode":"20-01","member_number":"A127105","first_name":"AARON","last_name":"KINCAID","classification":"U","division":"CARRY OPTICS","hit_factor":3.952},{"match_name":"SOAP July 2021 USPSA Match","match_date":"2021-07-11","stage_classifiercode":"20-01","member_number":"A103694","first_name":"GEORGE","last_name":"WAGNER","classification":"C","division":"CARRY OPTICS","hit_factor":3.952},{"match_name":"Richmond Hot Shots Aug 14-15-2021 USPSA","match_date":"2021-08-14","stage_classifiercode":"20-01","member_number":"L2531","first_name":"BRIAN","last_name":"CHIN","classification":"C","division":"CARRY OPTICS","hit_factor":3.9497},{"match_name":"Richmond Hot Shots Aug 14-15-2021 USPSA","match_date":"2021-08-14","stage_classifiercode":"20-01","member_number":"A127467","first_name":"STEVEN","last_name":"CHIU","classification":"U","division":"CARRY OPTICS","hit_factor":3.9492},{"match_name":"Dundee Practical Shooters - Feb 27 2021","match_date":"2021-02-27","stage_classifiercode":"20-01","member_number":"A128506","first_name":"EMILEE","last_name":"WONG","classification":"U","division":"CARRY OPTICS","hit_factor":3.9492},{"match_name":"Bossier Parish Practical Shooters November 21 2021","match_date":"2021-11-21","stage_classifiercode":"20-01","member_number":"A117525","first_name":"JUSTIN","last_name":"MCDONNELL","classification":"C","division":"CARRY OPTICS","hit_factor":3.9462},{"match_name":"TPS USPSA At CMP July 17 2021","match_date":"2021-07-17","stage_classifiercode":"20-01","member_number":"A92921","first_name":"FRED","last_name":"WU","classification":"U","division":"CARRY OPTICS","hit_factor":3.9451},{"match_name":"Homestead USPSA June Classifier Match 2021","match_date":"2021-06-20","stage_classifiercode":"20-01","member_number":"A130568","first_name":"PATRICK","last_name":"RAWLE","classification":"D","division":"CARRY OPTICS","hit_factor":3.9429},{"match_name":"NHRPC - November 2021 USPSA","match_date":"2021-11-13","stage_classifiercode":"20-01","member_number":"A121947","first_name":"ZACH","last_name":"HILL","classification":"C","division":"CARRY OPTICS","hit_factor":3.9417},{"match_name":"Dundee Practical Shooters - Feb 27 2021","match_date":"2021-02-27","stage_classifiercode":"20-01","member_number":"ty44669","first_name":"RICH","last_name":"HALLEY","classification":"C","division":"CARRY OPTICS","hit_factor":3.9409},{"match_name":"OREGON ARPC CC05 USPSA OCT 9 2021","match_date":"2021-10-09","stage_classifiercode":"20-01","member_number":"TY51199","first_name":"CHRIS","last_name":"FITZMORRIS","classification":"B","division":"CARRY OPTICS","hit_factor":3.9405},{"match_name":"Coyote Arms Classifier Match 10-31-21","match_date":"2021-10-31","stage_classifiercode":"20-01","member_number":"A137806","first_name":"AUSTIN","last_name":"SINCLAIR","classification":"X","division":"CARRY OPTICS","hit_factor":3.9396},{"match_name":"BORCC USPSA April 2021","match_date":"2021-04-17","stage_classifiercode":"20-01","member_number":"A118180","first_name":"BEN","last_name":"HOLST","classification":"B","division":"CARRY OPTICS","hit_factor":3.9384},{"match_name":"Richmond Boro Gun Club Monthly USPSA Match May 2021","match_date":"2021-05-08","stage_classifiercode":"20-01","member_number":"A106866","first_name":"MIKHAIL","last_name":"OSTROV","classification":"C","division":"CARRY OPTICS","hit_factor":3.9375},{"match_name":"Richmond Hot Shots Aug 14-15-2021 USPSA","match_date":"2021-08-14","stage_classifiercode":"20-01","member_number":"A130145","first_name":"SEAN","last_name":"EICHELBERGER","classification":"B","division":"CARRY OPTICS","hit_factor":3.9363},{"match_name":"EWPSA 2021-04","match_date":"2021-04-17","stage_classifiercode":"20-01","member_number":"A101557","first_name":"CODY","last_name":"CALKINS","classification":"U","division":"CARRY OPTICS","hit_factor":3.9347},{"match_name":"FBURG September 2021 USPSA","match_date":"2021-09-05","stage_classifiercode":"20-01","member_number":"L4049","first_name":"CHRISTIAN VET","last_name":"VIVERETTE","classification":"C","division":"CARRY OPTICS","hit_factor":3.9326},{"match_name":"FBURG September 2021 USPSA","match_date":"2021-09-05","stage_classifiercode":"20-01","member_number":"A134103","first_name":"ELBY","last_name":"GODWIN","classification":"U","division":"CARRY OPTICS","hit_factor":3.9308},{"match_name":"Mesilla Valley P September 2021 classifier match","match_date":"2021-09-04","stage_classifiercode":"20-01","member_number":"L4905","first_name":"DENNIS","last_name":"KIM","classification":"B","division":"CARRY OPTICS","hit_factor":3.929},{"match_name":"OK06-30OCT21-SCRP-USPSA","match_date":"2021-10-30","stage_classifiercode":"20-01","member_number":"A91389","first_name":"RUSS","last_name":"BRIDGES","classification":"C","division":"CARRY OPTICS","hit_factor":3.9251},{"match_name":"SFPS 5-16-21 Super Classifier","match_date":"2021-05-16","stage_classifiercode":"20-01","member_number":"A112086","first_name":"TOM","last_name":"MARSH","classification":"C","division":"CARRY OPTICS","hit_factor":3.9246},{"match_name":"Collin County USPSA  08-22-2021","match_date":"2021-08-22","stage_classifiercode":"20-01","member_number":"A128688","first_name":"STEVE","last_name":"DAVIS","classification":"C","division":"CARRY OPTICS","hit_factor":3.9216},{"match_name":"GRB USPSA JANUARY 2021 AT CAVALIER","match_date":"2021-01-16","stage_classifiercode":"20-01","member_number":"A94779","first_name":"DANIEL","last_name":"LOWE","classification":"U","division":"CARRY OPTICS","hit_factor":3.9216},{"match_name":"ESPS  USPSA  March","match_date":"2021-03-27","stage_classifiercode":"20-01","member_number":"A112273","first_name":"JULES","last_name":"CASTILLO","classification":"C","division":"CARRY OPTICS","hit_factor":3.9192},{"match_name":"Chillicothe Sportsmens Club July USPSA","match_date":"2021-07-24","stage_classifiercode":"20-01","member_number":"A95517","first_name":"RICK","last_name":"WARD","classification":"C","division":"CARRY OPTICS","hit_factor":3.9189},{"match_name":"Hosemonster Action  ","match_date":"2021-01-17","stage_classifiercode":"20-01","member_number":"A130399","first_name":"LLOYD","last_name":"SAGUCIO","classification":"U","division":"CARRY OPTICS","hit_factor":3.9184},{"match_name":"GCL Saturday 4-3-2021","match_date":"2021-04-03","stage_classifiercode":"20-01","member_number":"A125229","first_name":"MARCUS","last_name":"KROLL","classification":"U","division":"CARRY OPTICS","hit_factor":3.9181},{"match_name":"Maine Practical Shooters May 2021","match_date":"2021-05-08","stage_classifiercode":"20-01","member_number":"Ty104803","first_name":"BOBBY","last_name":"HUKKI","classification":"C","division":"CARRY OPTICS","hit_factor":3.9163},{"match_name":"Maine Practical Shooters May 2021","match_date":"2021-05-08","stage_classifiercode":"20-01","member_number":"ty104654","first_name":"TED","last_name":"PARKER","classification":"B","division":"CARRY OPTICS","hit_factor":3.9098},{"match_name":"Ontelaunee USPSA November 2020","match_date":"2020-11-20","stage_classifiercode":"20-01","member_number":"A104823","first_name":"RAFAEL","last_name":"ALICEA","classification":"C","division":"CARRY OPTICS","hit_factor":3.9024},{"match_name":"TPS USPSA at CMP Dec 19 2020 Special Classifier Match","match_date":"2020-12-19","stage_classifiercode":"20-01","member_number":"TY41492","first_name":"MARK","last_name":"HEARN","classification":"U","division":"CARRY OPTICS","hit_factor":3.8981},{"match_name":"Quinton USPSA - April 10 2021","match_date":"2021-04-10","stage_classifiercode":"20-01","member_number":"A-98282","first_name":"STEVE","last_name":"MOLNAR","classification":"U","division":"CARRY OPTICS","hit_factor":3.8978},{"match_name":"LdF USPSA Classifier Match December 12 2020","match_date":"2020-12-12","stage_classifiercode":"20-01","member_number":"TY131526","first_name":"CHRISTIAN","last_name":"CACHOLA","classification":"U","division":"CARRY OPTICS","hit_factor":3.8961},{"match_name":"MCAS 2021 USPSA Classifier League","match_date":"2021-05-26","stage_classifiercode":"20-01","member_number":"ty-96523","first_name":"DAN","last_name":"DOOLEY","classification":"Unclassified","division":"CARRY OPTICS","hit_factor":3.8952},{"match_name":"Quinton USPSA - April 10 2021","match_date":"2021-04-10","stage_classifiercode":"20-01","member_number":"A111789","first_name":"NATHAN","last_name":"GORENSTEIN","classification":"U","division":"CARRY OPTICS","hit_factor":3.8911},{"match_name":"CCPL 05-09-2021","match_date":"2021-05-09","stage_classifiercode":"20-01","member_number":"A115250","first_name":"JEFFERSON","last_name":"CAMARCE","classification":"U","division":"CARRY OPTICS","hit_factor":3.888},{"match_name":"GoShoot Outdoor A6 Warm up And Classifier match!","match_date":"2021-04-03","stage_classifiercode":"20-01","member_number":"TY131625","first_name":"ALBERT","last_name":"HAINES","classification":"U","division":"CARRY OPTICS","hit_factor":3.8874},{"match_name":"OPSC USPSA JUNE 2021","match_date":"2021-06-13","stage_classifiercode":"20-01","member_number":"TY104330","first_name":"KENT","last_name":"LERDAL","classification":"C","division":"CARRY OPTICS","hit_factor":3.8819},{"match_name":"Pioneer Action Shooters USPSA 11-15-20","match_date":"2020-11-15","stage_classifiercode":"20-01","member_number":"A77615","first_name":"JAMES","last_name":"SQUIRES","classification":"C","division":"CARRY OPTICS","hit_factor":3.8784},{"match_name":"SFA USPSA JANUARY 16 2021 MATCH","match_date":"2021-01-16","stage_classifiercode":"20-01","member_number":"TY14807","first_name":"KEN","last_name":"JOHNSON","classification":"C","division":"CARRY OPTICS","hit_factor":3.871},{"match_name":"Volusia County Gun and Hunt Club","match_date":"2020-11-21","stage_classifiercode":"20-01","member_number":"Ty83237","first_name":"LEN","last_name":"KRAVITZ","classification":"C","division":"CARRY OPTICS","hit_factor":3.87},{"match_name":"TPS USPSA At CMP July 17 2021","match_date":"2021-07-17","stage_classifiercode":"20-01","member_number":"A113650","first_name":"GARY","last_name":"GAUDIO","classification":"C","division":"CARRY OPTICS","hit_factor":3.8688},{"match_name":"Ontelaunee USPSA November 2020","match_date":"2020-11-20","stage_classifiercode":"20-01","member_number":"A122753","first_name":"LISA","last_name":"AMATO","classification":"C","division":"CARRY OPTICS","hit_factor":3.8688},{"match_name":"DSSA 2021-02 USPSA Pistol","match_date":"2021-02-28","stage_classifiercode":"20-01","member_number":"A82537","first_name":"HERMAN","last_name":"COX","classification":"C","division":"CARRY OPTICS","hit_factor":3.8616},{"match_name":"Richmond Hot Shots Aug 14-15-2021 USPSA","match_date":"2021-08-14","stage_classifiercode":"20-01","member_number":"TY99185","first_name":"DOMINADOR","last_name":"EDUARDO JR","classification":"U","division":"CARRY OPTICS","hit_factor":3.858},{"match_name":"Shasta Shooters 2021 Jan","match_date":"2021-01-09","stage_classifiercode":"20-01","member_number":"TY109510","first_name":"VINCE","last_name":"CLEMENTS","classification":"U","division":"CARRY OPTICS","hit_factor":3.858},{"match_name":"Chillicothe Sportsmens Club July USPSA","match_date":"2021-07-24","stage_classifiercode":"20-01","member_number":"A95517","first_name":"RICK","last_name":"WARD","classification":"C","division":"CARRY OPTICS","hit_factor":3.858},{"match_name":"RDS June 2021 USPSA Match","match_date":"2021-06-05","stage_classifiercode":"20-01","member_number":"A78316","first_name":"JODY","last_name":"BOX","classification":"U","division":"CARRY OPTICS","hit_factor":3.8565},{"match_name":"LIPSA  - March  21st  2021 - March Madness USPSA Match ","match_date":"2021-03-21","stage_classifiercode":"20-01","member_number":"A104497","first_name":"JEFFERY","last_name":"YOUNG","classification":"U","division":"CARRY OPTICS","hit_factor":3.8551},{"match_name":"Hosemonster Action  ","match_date":"2021-01-17","stage_classifiercode":"20-01","member_number":"A128373","first_name":"MICHAEL","last_name":"BIXLER","classification":"U","division":"CARRY OPTICS","hit_factor":3.8529},{"match_name":"GAS MAY 2021 USPSA","match_date":"2021-05-01","stage_classifiercode":"20-01","member_number":"A73573","first_name":"JACK","last_name":"SPILLMAN","classification":"B","division":"CARRY OPTICS","hit_factor":3.8519},{"match_name":"DSSA 2021-02 USPSA Pistol","match_date":"2021-02-28","stage_classifiercode":"20-01","member_number":"TY93223","first_name":"CALVIN","last_name":"LINDSAY","classification":"D","division":"CARRY OPTICS","hit_factor":3.8511},{"match_name":"APSC USPSA 11-7-20","match_date":"2020-11-07","stage_classifiercode":"20-01","member_number":"A12134","first_name":"PAUL","last_name":"PAYNE","classification":"C","division":"CARRY OPTICS","hit_factor":3.8436},{"match_name":"STAGE ZERO ALL CLASSIFIER","match_date":"2021-09-04","stage_classifiercode":"20-01","member_number":"A136184","first_name":"ANTONIO","last_name":"FLOREZ","classification":"U","division":"CARRY OPTICS","hit_factor":3.8424},{"match_name":"PIPS 04-28-2021","match_date":"2021-04-27","stage_classifiercode":"20-01","member_number":"TY64015","first_name":"STEVE","last_name":"LANSING","classification":"C","division":"CARRY OPTICS","hit_factor":3.8411},{"match_name":"PIPS 04-28-2021","match_date":"2021-04-27","stage_classifiercode":"20-01","member_number":"A90034","first_name":"BOB","last_name":"ANDREWS","classification":"C","division":"CARRY OPTICS","hit_factor":3.8382},{"match_name":"Medford USPSA Oct 2021 Match","match_date":"2021-10-17","stage_classifiercode":"20-01","member_number":"A137126","first_name":"DENNIS","last_name":"CONNER","classification":"U","division":"CARRY OPTICS","hit_factor":3.8376},{"match_name":"Matamoras USPSA September 2021","match_date":"2021-09-19","stage_classifiercode":"20-01","member_number":"A62082","first_name":"CARLOS","last_name":"MERCADO","classification":"C","division":"CARRY OPTICS","hit_factor":3.836},{"match_name":"SFPS 5-16-21 Super Classifier","match_date":"2021-05-16","stage_classifiercode":"20-01","member_number":"Ty122705","first_name":"GREG","last_name":"KING","classification":"C","division":"CARRY OPTICS","hit_factor":3.8342},{"match_name":"RBGC USPSA 2021-8-15 Special Classifier Match","match_date":"2021-08-15","stage_classifiercode":"20-01","member_number":"A135975","first_name":"JACOB","last_name":"PASHIA","classification":"U","division":"CARRY OPTICS","hit_factor":3.8241},{"match_name":"NISA August 2021","match_date":"2021-08-22","stage_classifiercode":"20-01","member_number":"A126743","first_name":"MELANIE","last_name":"WALKER","classification":"C","division":"CARRY OPTICS","hit_factor":3.8206},{"match_name":"LGCSEMPS April 2021 Special Classifier","match_date":"2021-04-11","stage_classifiercode":"20-01","member_number":"A96042","first_name":"BILL","last_name":"BRYANT","classification":"C","division":"CARRY OPTICS","hit_factor":3.8136},{"match_name":"USPSA Strategic Edge SEGR May 15th 2021","match_date":"2021-05-15","stage_classifiercode":"20-01","member_number":"A80124","first_name":"MATT","last_name":"EMM","classification":"A","division":"CARRY OPTICS","hit_factor":3.8123},{"match_name":"LdF USPSA Match November 7 2021","match_date":"2021-11-07","stage_classifiercode":"20-01","member_number":"A137333","first_name":"TERI","last_name":"KUHN","classification":"U","division":"CARRY OPTICS","hit_factor":3.8108},{"match_name":"LIPSA  - March  21st  2021 - March Madness USPSA Match ","match_date":"2021-03-21","stage_classifiercode":"20-01","member_number":"TY84200","first_name":"PAUL","last_name":"MARTELLO","classification":"B","division":"CARRY OPTICS","hit_factor":3.8095},{"match_name":"CTASA - 3rd Sunday USPSA at Triple C Range - 12-20-2020","match_date":"2020-12-20","stage_classifiercode":"20-01","member_number":"A91630","first_name":"LARRY","last_name":"WALDRIP","classification":"C","division":"CARRY OPTICS","hit_factor":3.8067},{"match_name":"NISA August 2021","match_date":"2021-08-22","stage_classifiercode":"20-01","member_number":"TY72663","first_name":"EMIL","last_name":"KOZELL","classification":"C","division":"CARRY OPTICS","hit_factor":3.804},{"match_name":"SOAP July 2021 USPSA Match","match_date":"2021-07-11","stage_classifiercode":"20-01","member_number":"TY116550","first_name":"GARRY","last_name":"PACQUIAO","classification":"D","division":"CARRY OPTICS","hit_factor":3.8033},{"match_name":"QPS Quantico Shooting Club December USPSA   ","match_date":"2020-12-12","stage_classifiercode":"20-01","member_number":"TY114978","first_name":"RHYS","last_name":"WILLIAMS","classification":"B","division":"CARRY OPTICS","hit_factor":3.8005},{"match_name":"2020-12-05 USPSA  at Phoenix Rod and Gun Club","match_date":"2020-12-05","stage_classifiercode":"20-01","member_number":"TY28778","first_name":"DEBBIE","last_name":"CLARK","classification":"C","division":"CARRY OPTICS","hit_factor":3.7984},{"match_name":"ESPS  USPSA  March","match_date":"2021-03-27","stage_classifiercode":"20-01","member_number":"TY90681","first_name":"ROGER","last_name":"BOYCE","classification":"C","division":"CARRY OPTICS","hit_factor":3.7965},{"match_name":"SWGC USPSA Pistol Match - May 2021","match_date":"2021-05-01","stage_classifiercode":"20-01","member_number":"TY131625","first_name":"ALBERT","last_name":"HAINES","classification":"C","division":"CARRY OPTICS","hit_factor":3.7951},{"match_name":"Ontelaunee USPSA November 2020","match_date":"2020-11-20","stage_classifiercode":"20-01","member_number":"A105600","first_name":"TOM","last_name":"PIPER","classification":"B","division":"CARRY OPTICS","hit_factor":3.7949},{"match_name":"ARPC USPSA Match 4-25-21","match_date":"2021-04-25","stage_classifiercode":"20-01","member_number":"A90200","first_name":"CRAIG","last_name":"CASH","classification":"Unclassified","division":"CARRY OPTICS","hit_factor":3.7915},{"match_name":"Shadow Hawk Defense USPSA - Sep Sat","match_date":"2021-09-11","stage_classifiercode":"20-01","member_number":"A117486","first_name":"JAMES","last_name":"BAKER","classification":"U","division":"CARRY OPTICS","hit_factor":3.7901},{"match_name":"MAPSA 5/8/21","match_date":"2021-05-08","stage_classifiercode":"20-01","member_number":"A46881","first_name":"SHANE","last_name":"DIDUR","classification":"C","division":"CARRY OPTICS","hit_factor":3.7895},{"match_name":"Prairie Thunder GP17 USPSA 3-28-21","match_date":"2021-03-28","stage_classifiercode":"20-01","member_number":"TY102031","first_name":"DAVE","last_name":"HOUSE","classification":"B","division":"CARRY OPTICS","hit_factor":3.7895},{"match_name":"RPS January 2021 USPSA Match","match_date":"2021-01-09","stage_classifiercode":"20-01","member_number":"A121310","first_name":"CHRIS","last_name":"NANNEY","classification":"C","division":"CARRY OPTICS","hit_factor":3.7879},{"match_name":"LdF USPSA Classifier Match December 12 2020","match_date":"2020-12-12","stage_classifiercode":"20-01","member_number":"A116295","first_name":"CHRIS","last_name":"MEINHARDT","classification":"C","division":"CARRY OPTICS","hit_factor":3.7858},{"match_name":"CAS March 2021","match_date":"2021-03-07","stage_classifiercode":"20-01","member_number":"TY108974","first_name":"AUBREY","last_name":"LANDRY","classification":"C","division":"CARRY OPTICS","hit_factor":3.7831},{"match_name":"ENPS September 2021 USPSA Match","match_date":"2021-09-04","stage_classifiercode":"20-01","member_number":"A116691","first_name":"FREEMAN","last_name":"SANDQUIST","classification":"B","division":"CARRY OPTICS","hit_factor":3.781},{"match_name":"Oh Shoot -PRG Nov 27th - Uspsa Classifier Match","match_date":"2021-11-27","stage_classifiercode":"20-01","member_number":"TY94265","first_name":"STEVE","last_name":"BENCE","classification":"B","division":"CARRY OPTICS","hit_factor":3.7767},{"match_name":"NW01 T-Day 2020","match_date":"2020-11-08","stage_classifiercode":"20-01","member_number":"A128707","first_name":"DEAN","last_name":"PRAYNER","classification":"D","division":"CARRY OPTICS","hit_factor":3.7762},{"match_name":"ESPS  USPSA  March","match_date":"2021-03-27","stage_classifiercode":"20-01","member_number":"TY86590","first_name":"RONALD","last_name":"LORCA","classification":"U","division":"CARRY OPTICS","hit_factor":3.7717},{"match_name":"Wallis Orchard Practical Shooters April 2021 Club Match","match_date":"2021-04-18","stage_classifiercode":"20-01","member_number":"A123783","first_name":"TIM","last_name":"YANG","classification":"B","division":"CARRY OPTICS","hit_factor":3.7713},{"match_name":"ESPS  USPSA  March","match_date":"2021-03-27","stage_classifiercode":"20-01","member_number":"A83866","first_name":"JAMES","last_name":"OBORNE","classification":"C","division":"CARRY OPTICS","hit_factor":3.7711},{"match_name":"OK06-30OCT21-SCRP-USPSA","match_date":"2021-10-30","stage_classifiercode":"20-01","member_number":"Fy96793","first_name":"DENIS","last_name":"RIGDON","classification":"C","division":"CARRY OPTICS","hit_factor":3.771},{"match_name":"Homestead USPSA June Classifier Match 2021","match_date":"2021-06-20","stage_classifiercode":"20-01","member_number":"A133344","first_name":"JACOB","last_name":"WISE","classification":"U","division":"CARRY OPTICS","hit_factor":3.764},{"match_name":"LdF USPSA Classifier Match December 12 2020","match_date":"2020-12-12","stage_classifiercode":"20-01","member_number":"A120958","first_name":"ROBB","last_name":"LANE","classification":"U","division":"CARRY OPTICS","hit_factor":3.7631},{"match_name":"RBGC USPSA 2021-8-15 Special Classifier Match","match_date":"2021-08-15","stage_classifiercode":"20-01","member_number":"A114338","first_name":"CAMILLE","last_name":"BROWN","classification":"C","division":"CARRY OPTICS","hit_factor":3.7612},{"match_name":"Medford USPSA Oct 2021 Match","match_date":"2021-10-17","stage_classifiercode":"20-01","member_number":"A62645","first_name":"TODD","last_name":"OVERTURF","classification":"C","division":"CARRY OPTICS","hit_factor":3.7565},{"match_name":"SKSC USPSA Oct 2021","match_date":"2021-10-16","stage_classifiercode":"20-01","member_number":"A132271","first_name":"DONNIE","last_name":"LOVE","classification":"C","division":"CARRY OPTICS","hit_factor":3.7551},{"match_name":"LCSC Linden USPSA 122720","match_date":"2020-12-27","stage_classifiercode":"20-01","member_number":"A115452","first_name":"JIM","last_name":"MARTIN","classification":"C","division":"CARRY OPTICS","hit_factor":3.75},{"match_name":"LGCSEMPS April 2021 Special Classifier","match_date":"2021-04-11","stage_classifiercode":"20-01","member_number":"TY131258","first_name":"CHRIS","last_name":"SORGATZ","classification":"U","division":"CARRY OPTICS","hit_factor":3.75},{"match_name":"Hosemonster Action  ","match_date":"2021-01-17","stage_classifiercode":"20-01","member_number":"A127128","first_name":"LILY","last_name":"GRASSMIDT","classification":"U","division":"CARRY OPTICS","hit_factor":3.749},{"match_name":"Square Deal Sportsmen June USPSA Match 2021","match_date":"2021-06-06","stage_classifiercode":"20-01","member_number":"A130223","first_name":"CHRISTOPHER","last_name":"SOLTIS","classification":"U","division":"CARRY OPTICS","hit_factor":3.7483},{"match_name":"LdF USPSA Match November 7 2021","match_date":"2021-11-07","stage_classifiercode":"20-01","member_number":"A134791","first_name":"JEFF","last_name":"NILSON","classification":"U","division":"CARRY OPTICS","hit_factor":3.7458},{"match_name":"RBGC USPSA 2021-8-15 Special Classifier Match","match_date":"2021-08-15","stage_classifiercode":"20-01","member_number":"TY71518","first_name":"CABOT","last_name":"HARRINGTON","classification":"U","division":"CARRY OPTICS","hit_factor":3.7456},{"match_name":"Hosemonster Action  ","match_date":"2021-01-17","stage_classifiercode":"20-01","member_number":"A115452","first_name":"JIM","last_name":"MARTIN","classification":"C","division":"CARRY OPTICS","hit_factor":3.7453},{"match_name":"Moss Branch USPSA June match","match_date":"2021-06-26","stage_classifiercode":"20-01","member_number":"A133965","first_name":"SETH","last_name":"THORNE","classification":"B","division":"CARRY OPTICS","hit_factor":3.7419},{"match_name":"EWPSA 2021-04","match_date":"2021-04-17","stage_classifiercode":"20-01","member_number":"TY125370","first_name":"KEVIN","last_name":"BENSEMA","classification":"U","division":"CARRY OPTICS","hit_factor":3.7408},{"match_name":"Wallis Orchard Practical Shooters April 2021 Club Match","match_date":"2021-04-18","stage_classifiercode":"20-01","member_number":"A103491","first_name":"NORMAN","last_name":"ODUCADO","classification":"U","division":"CARRY OPTICS","hit_factor":3.7397},{"match_name":"OREGON ARPC CC05 USPSA OCT 9 2021","match_date":"2021-10-09","stage_classifiercode":"20-01","member_number":"a106410","first_name":"WOODY","last_name":"LITTLE","classification":"C","division":"CARRY OPTICS","hit_factor":3.7375},{"match_name":"5 Dogs December USPSA 2020","match_date":"2020-12-06","stage_classifiercode":"20-01","member_number":"A115419","first_name":"JERELLE","last_name":"ANDRADA","classification":"B","division":"CARRY OPTICS","hit_factor":3.733},{"match_name":"Dundee Practical Shooters - Feb 27 2021","match_date":"2021-02-27","stage_classifiercode":"20-01","member_number":"None","first_name":"MATHEW","last_name":"HILL","classification":"U","division":"CARRY OPTICS","hit_factor":3.733},{"match_name":"GRB USPSA JANUARY 2021 AT CAVALIER","match_date":"2021-01-16","stage_classifiercode":"20-01","member_number":"A121028","first_name":"MIKE","last_name":"HUBBARD","classification":"C","division":"CARRY OPTICS","hit_factor":3.7277},{"match_name":"Square Deal Sportsmen June USPSA Match 2021","match_date":"2021-06-06","stage_classifiercode":"20-01","member_number":"Na","first_name":"BARRY","last_name":"SHAPIRO","classification":"U","division":"CARRY OPTICS","hit_factor":3.7275},{"match_name":"CFRPC USPSA 2021-11-14","match_date":"2021-11-14","stage_classifiercode":"20-01","member_number":"A115677","first_name":"ELMER","last_name":"BANSIL","classification":"D","division":"CARRY OPTICS","hit_factor":3.7249},{"match_name":"CCPS July 2021 USPSA","match_date":"2021-07-04","stage_classifiercode":"20-01","member_number":"FY10738","first_name":"BLAISE","last_name":"CORNELL-D'ECHERT","classification":"B","division":"CARRY OPTICS","hit_factor":3.7234},{"match_name":"USPSA Strategic Edge SEGR May 15th 2021","match_date":"2021-05-15","stage_classifiercode":"20-01","member_number":"A129281","first_name":"MICHAEL","last_name":"FENLON","classification":"U","division":"CARRY OPTICS","hit_factor":3.7227},{"match_name":"Shasta Shooters 2021 Jan","match_date":"2021-01-09","stage_classifiercode":"20-01","member_number":"TY114068","first_name":"TRACY","last_name":"DUARTE","classification":"C","division":"CARRY OPTICS","hit_factor":3.7223},{"match_name":"Richmond Boro Gun Club Monthly USPSA Match May 2021","match_date":"2021-05-08","stage_classifiercode":"20-01","member_number":"A110318","first_name":"JOE","last_name":"LARUSSO","classification":"C","division":"CARRY OPTICS","hit_factor":3.7187},{"match_name":"EWPSA 2021-04","match_date":"2021-04-17","stage_classifiercode":"20-01","member_number":"A129945","first_name":"GABRIEL","last_name":"PARKS","classification":"U","division":"CARRY OPTICS","hit_factor":3.7178},{"match_name":"Mvpsa USPSA November 7 2020","match_date":"2020-11-07","stage_classifiercode":"20-01","member_number":"A103631","first_name":"MICHEAL","last_name":"COOPER","classification":"C","division":"CARRY OPTICS","hit_factor":3.7165},{"match_name":"Richmond Hot Shots Aug 14-15-2021 USPSA","match_date":"2021-08-14","stage_classifiercode":"20-01","member_number":"A131662","first_name":"K","last_name":"NAKAMURA","classification":"U","division":"CARRY OPTICS","hit_factor":3.7164},{"match_name":"WLPS May 2021 ALL USPSA Classifier Match ","match_date":"2021-05-23","stage_classifiercode":"20-01","member_number":"L1934","first_name":"JOHN","last_name":"MATTHEWS","classification":"U","division":"CARRY OPTICS","hit_factor":3.716},{"match_name":"WLPS May 2021 ALL USPSA Classifier Match ","match_date":"2021-05-23","stage_classifiercode":"20-01","member_number":"TY102469","first_name":"JOHN","last_name":"BAKER","classification":"B","division":"CARRY OPTICS","hit_factor":3.7113},{"match_name":"SCPS ECO19 January 23rd 2021","match_date":"2021-01-22","stage_classifiercode":"20-01","member_number":"TY127695","first_name":"MATTHEW","last_name":"DOBBS","classification":"U","division":"CARRY OPTICS","hit_factor":3.7007},{"match_name":"ENPS September 2021 USPSA Match","match_date":"2021-09-04","stage_classifiercode":"20-01","member_number":"TY109253","first_name":"TODD","last_name":"REZNICEK","classification":"C","division":"CARRY OPTICS","hit_factor":3.6986},{"match_name":"NW01 T-Day 2020","match_date":"2020-11-08","stage_classifiercode":"20-01","member_number":"L4681","first_name":"JOSHUA","last_name":"GLASTRA","classification":"M","division":"CARRY OPTICS","hit_factor":3.6984},{"match_name":"SFA USPSA November 20 2021 MATCH","match_date":"2021-11-20","stage_classifiercode":"20-01","member_number":"A124168","first_name":"IAN","last_name":"COBERLY","classification":"M","division":"CARRY OPTICS","hit_factor":3.6919},{"match_name":"Oh Shoot -PRG Nov 27th - Uspsa Classifier Match","match_date":"2021-11-27","stage_classifiercode":"20-01","member_number":"A137780","first_name":"VINCE","last_name":"MEDENILLA","classification":"U","division":"CARRY OPTICS","hit_factor":3.6913},{"match_name":"Cactus USPSA ALL CLASSIFIER January 2021","match_date":"2021-01-03","stage_classifiercode":"20-01","member_number":"L699","first_name":"DONALD","last_name":"MORAN","classification":"C","division":"CARRY OPTICS","hit_factor":3.6885},{"match_name":"NHRPC - November 2021 USPSA","match_date":"2021-11-13","stage_classifiercode":"20-01","member_number":"A119880","first_name":"WILLIAM","last_name":"ROBINSON","classification":"C","division":"CARRY OPTICS","hit_factor":3.6872},{"match_name":"WLPS May 2021 ALL USPSA Classifier Match ","match_date":"2021-05-23","stage_classifiercode":"20-01","member_number":"A116317","first_name":"RICK","last_name":"MCBRIDE","classification":"U","division":"CARRY OPTICS","hit_factor":3.681},{"match_name":"Tehama Shooters November 2020 USPSA","match_date":"2020-11-28","stage_classifiercode":"20-01","member_number":"TY114067","first_name":"DAVID","last_name":"DUARTE","classification":"C","division":"CARRY OPTICS","hit_factor":3.676},{"match_name":"Triforce Practical Shooters at Big Woods Goods 03-25-2021","match_date":"2021-03-25","stage_classifiercode":"20-01","member_number":"A96103","first_name":"MARK","last_name":"BUCHHEIT","classification":"C","division":"CARRY OPTICS","hit_factor":3.6758},{"match_name":"QPS Quantico Shooting Club December USPSA   ","match_date":"2020-12-12","stage_classifiercode":"20-01","member_number":"A121028","first_name":"MIKE","last_name":"HUBBARD","classification":"U","division":"CARRY OPTICS","hit_factor":3.6753},{"match_name":"LIPSA  - March  21st  2021 - March Madness USPSA Match ","match_date":"2021-03-21","stage_classifiercode":"20-01","member_number":"A122414","first_name":"DEBBIE","last_name":"JAEGER","classification":"U","division":"CARRY OPTICS","hit_factor":3.6749},{"match_name":"ENPS September 2021 USPSA Match","match_date":"2021-09-04","stage_classifiercode":"20-01","member_number":"TY48539","first_name":"TERRY","last_name":"BEGLEY","classification":"C","division":"CARRY OPTICS","hit_factor":3.6742},{"match_name":"GCL Monthly USPSA Match Saturday 11-6-2021  INDOORS","match_date":"2021-11-06","stage_classifiercode":"20-01","member_number":"TY123346","first_name":"MICHAEL","last_name":"PIERCE","classification":"U","division":"CARRY OPTICS","hit_factor":3.6735},{"match_name":"Magnolia Rifle and Pistol Club May  2021 USPSA Match","match_date":"2021-05-15","stage_classifiercode":"20-01","member_number":"TY108705","first_name":"JAY","last_name":"WHITLOCK","classification":"C","division":"CARRY OPTICS","hit_factor":3.6732},{"match_name":"Bossier Parish Practical Shooters November 21 2021","match_date":"2021-11-21","stage_classifiercode":"20-01","member_number":"TY116348","first_name":"DENISE","last_name":"MCDONNELL","classification":"C","division":"CARRY OPTICS","hit_factor":3.6711},{"match_name":"JPPS USPSA Match 8-15-2021","match_date":"2021-08-15","stage_classifiercode":"20-01","member_number":"A121066","first_name":"RICHARD","last_name":"LOONEY","classification":"U","division":"CARRY OPTICS","hit_factor":3.666},{"match_name":"MCPSL Pistol 1-9-2021","match_date":"2021-01-09","stage_classifiercode":"20-01","member_number":"A118717","first_name":"VINCENT","last_name":"HALL","classification":"M","division":"CARRY OPTICS","hit_factor":3.6649},{"match_name":"CAS March 2021","match_date":"2021-03-07","stage_classifiercode":"20-01","member_number":"A115736","first_name":"EUGENE","last_name":"KWARTENG","classification":"U","division":"CARRY OPTICS","hit_factor":3.6635},{"match_name":"OREGON ARPC CC05 USPSA NOVEMBER 14 2020","match_date":"2020-11-14","stage_classifiercode":"20-01","member_number":"TY98534","first_name":"CLIFF","last_name":"WRIGHT","classification":"C","division":"CARRY OPTICS","hit_factor":3.6624},{"match_name":"Coastal Area Practical Shooters 10-23-21","match_date":"2021-10-23","stage_classifiercode":"20-01","member_number":"L399","first_name":"BILL","last_name":"STRUDEL","classification":"C","division":"CARRY OPTICS","hit_factor":3.661},{"match_name":"NHRPC - November 2021 USPSA","match_date":"2021-11-13","stage_classifiercode":"20-01","member_number":"Ty105682","first_name":"STEVE","last_name":"ZINK","classification":"B","division":"CARRY OPTICS","hit_factor":3.6585},{"match_name":"CAS March 2021","match_date":"2021-03-07","stage_classifiercode":"20-01","member_number":"A132024","first_name":"BRADY","last_name":"DELATTE","classification":"U","division":"CARRY OPTICS","hit_factor":3.6585},{"match_name":"GRB USPSA JANUARY 2021 AT CAVALIER","match_date":"2021-01-16","stage_classifiercode":"20-01","member_number":"a66709","first_name":"LARRY","last_name":"BLACKMON","classification":"C","division":"CARRY OPTICS","hit_factor":3.6585},{"match_name":"BNA USPSA - July 25 2021 (Brothers N Arms)","match_date":"2021-07-25","stage_classifiercode":"20-01","member_number":"TY65599","first_name":"GALE","last_name":"BUTLER","classification":"B","division":"CARRY OPTICS","hit_factor":3.6568},{"match_name":"GRB USPSA JANUARY 2021 AT CAVALIER","match_date":"2021-01-16","stage_classifiercode":"20-01","member_number":"A78167","first_name":"LESLIE","last_name":"MASON","classification":"C","division":"CARRY OPTICS","hit_factor":3.6517},{"match_name":"17s PSC - USPSA - January 2021","match_date":"2021-01-16","stage_classifiercode":"20-01","member_number":"A97400","first_name":"ALLEN","last_name":"EGERTON","classification":"D","division":"CARRY OPTICS","hit_factor":3.6482},{"match_name":"SWGC USPSA Pistol Match - May 2021","match_date":"2021-05-01","stage_classifiercode":"20-01","member_number":"A120296","first_name":"ANDY","last_name":"MAST","classification":"D","division":"CARRY OPTICS","hit_factor":3.639},{"match_name":"SOAP July 2021 USPSA Match","match_date":"2021-07-11","stage_classifiercode":"20-01","member_number":"FY95777","first_name":"SEBASTIAN","last_name":"MUNOZ","classification":"A","division":"CARRY OPTICS","hit_factor":3.6386},{"match_name":"LPRGC- Lower Providence USPSA Nov 2020 Match","match_date":"2020-11-07","stage_classifiercode":"20-01","member_number":"TY98673","first_name":"BRIAN","last_name":"ATTENBOROUGH","classification":"C","division":"CARRY OPTICS","hit_factor":3.629},{"match_name":"ARPC USPSA Match 4-25-21","match_date":"2021-04-25","stage_classifiercode":"20-01","member_number":"A109465","first_name":"JASON","last_name":"JAMESON","classification":"B","division":"CARRY OPTICS","hit_factor":3.6278},{"match_name":"RPS January 2021 USPSA Match","match_date":"2021-01-09","stage_classifiercode":"20-01","member_number":"A130943","first_name":"CHRIS","last_name":"CRANFORD","classification":"D","division":"CARRY OPTICS","hit_factor":3.625},{"match_name":"Moss Branch USPSA June match","match_date":"2021-06-26","stage_classifiercode":"20-01","member_number":"A128279","first_name":"JACK","last_name":"MCKEE","classification":"B","division":"CARRY OPTICS","hit_factor":3.6239},{"match_name":"Prairie Thunder GP17 USPSA 3-28-21","match_date":"2021-03-28","stage_classifiercode":"20-01","member_number":"A61767","first_name":"BOB","last_name":"NASH","classification":"A","division":"CARRY OPTICS","hit_factor":3.6239},{"match_name":"17s PSC - USPSA - January 2021","match_date":"2021-01-16","stage_classifiercode":"20-01","member_number":"A128587","first_name":"BEAU","last_name":"HOLLY","classification":"C","division":"CARRY OPTICS","hit_factor":3.6224},{"match_name":"Matamoras USPSA September 2021","match_date":"2021-09-19","stage_classifiercode":"20-01","member_number":"TY125339","first_name":"DAVID","last_name":"SMITH","classification":"C","division":"CARRY OPTICS","hit_factor":3.616},{"match_name":"Cameo USPSA Match November 21 2020","match_date":"2020-11-21","stage_classifiercode":"20-01","member_number":"A125932","first_name":"ROBERT","last_name":"BAILEY","classification":"U","division":"CARRY OPTICS","hit_factor":3.6123},{"match_name":"Hosemonster Action  ","match_date":"2021-01-17","stage_classifiercode":"20-01","member_number":"A111063","first_name":"ANDREW","last_name":"ROBINSON","classification":"C","division":"CARRY OPTICS","hit_factor":3.609},{"match_name":"TPS USPSA -  January Match 2021 Rescheduled","match_date":"2021-01-03","stage_classifiercode":"20-01","member_number":"A111815","first_name":"JAMIE","last_name":"MONDY","classification":"B","division":"CARRY OPTICS","hit_factor":3.6066},{"match_name":"MRPC OHS02 06272021","match_date":"2021-06-27","stage_classifiercode":"20-01","member_number":"A115177","first_name":"AARON","last_name":"LAWSON","classification":"U","division":"CARRY OPTICS","hit_factor":3.6049},{"match_name":"NVGC USPSA September 2021","match_date":"2021-09-11","stage_classifiercode":"20-01","member_number":"A65327","first_name":"DAVE","last_name":"FARLEY","classification":"\"\"","division":"CARRY OPTICS","hit_factor":3.6047},{"match_name":"Oh Shoot -PRG Nov 27th - Uspsa Classifier Match","match_date":"2021-11-27","stage_classifiercode":"20-01","member_number":"A137635","first_name":"SEAN","last_name":"LEHMANN","classification":"U","division":"CARRY OPTICS","hit_factor":3.6024},{"match_name":"LdF USPSA Classifier Match December 12 2020","match_date":"2020-12-12","stage_classifiercode":"20-01","member_number":"A68860","first_name":"DAVID ALLAN","last_name":"CHUA","classification":"U","division":"CARRY OPTICS","hit_factor":3.5994},{"match_name":"MCRC USPSA March 2021","match_date":"2021-03-13","stage_classifiercode":"20-01","member_number":"A110753","first_name":"AARON","last_name":"ENGLISH","classification":"A","division":"CARRY OPTICS","hit_factor":3.598},{"match_name":"PMRPC USPSA 12Dec20 - all Classifier","match_date":"2020-12-12","stage_classifiercode":"20-01","member_number":"A104504","first_name":"LESLIE","last_name":"HERMAN","classification":"U","division":"CARRY OPTICS","hit_factor":3.5959},{"match_name":"LPRGC- Lower Providence USPSA Nov 2020 Match","match_date":"2020-11-07","stage_classifiercode":"20-01","member_number":"A127904","first_name":"JAYSON","last_name":"LAZARO","classification":"D","division":"CARRY OPTICS","hit_factor":3.5948},{"match_name":"LGCSEMPS April 2021 Special Classifier","match_date":"2021-04-11","stage_classifiercode":"20-01","member_number":"A101956","first_name":"XAVIER","last_name":"FAJARDO","classification":"U","division":"CARRY OPTICS","hit_factor":3.5936},{"match_name":"USPSA Strategic Edge SEGR May 15th 2021","match_date":"2021-05-15","stage_classifiercode":"20-01","member_number":"TY92310","first_name":"STACY","last_name":"EMM","classification":"C","division":"CARRY OPTICS","hit_factor":3.5868},{"match_name":"SFA USPSA November 20 2021 MATCH","match_date":"2021-11-20","stage_classifiercode":"20-01","member_number":"TY14807","first_name":"KEN","last_name":"JOHNSON","classification":"C","division":"CARRY OPTICS","hit_factor":3.5826},{"match_name":"Medford USPSA March 2021 OR-04","match_date":"2021-03-21","stage_classifiercode":"20-01","member_number":"A113860","first_name":"ART","last_name":"SCHOLTZ","classification":"D","division":"CARRY OPTICS","hit_factor":3.5821},{"match_name":"TTS USPSA Match 12JUN2021","match_date":"2021-06-12","stage_classifiercode":"20-01","member_number":"A132413","first_name":"ROMELIO","last_name":"SAN JOSE","classification":"D","division":"CARRY OPTICS","hit_factor":3.5775},{"match_name":"STAGE ZERO  ALL CLASSIFIER","match_date":"2020-11-21","stage_classifiercode":"20-01","member_number":"A131204","first_name":"JOHN","last_name":"HARTLEY","classification":"U","division":"CARRY OPTICS","hit_factor":3.5745},{"match_name":"Cowtown Pistol Club USPSA MONDAY November 1 2021","match_date":"2021-11-02","stage_classifiercode":"20-01","member_number":"Ty61281","first_name":"TIM","last_name":"THOMAS","classification":"A","division":"CARRY OPTICS","hit_factor":3.5738},{"match_name":"RDS June 2021 USPSA Match","match_date":"2021-06-05","stage_classifiercode":"20-01","member_number":"A117002","first_name":"CODY","last_name":"AUTRY","classification":"U","division":"CARRY OPTICS","hit_factor":3.5714},{"match_name":"SFA USPSA JANUARY 16 2021 MATCH","match_date":"2021-01-16","stage_classifiercode":"20-01","member_number":"A123413","first_name":"SHERWIN","last_name":"IBAY","classification":"C","division":"CARRY OPTICS","hit_factor":3.5714},{"match_name":"Richmond Boro Gun Club Monthly USPSA Match May 2021","match_date":"2021-05-08","stage_classifiercode":"20-01","member_number":"A133041","first_name":"VINCENT","last_name":"FARESE","classification":"C","division":"CARRY OPTICS","hit_factor":3.569},{"match_name":"Shasta Shooters 2021 June","match_date":"2021-06-12","stage_classifiercode":"20-01","member_number":"TY114068","first_name":"TRACY","last_name":"DUARTE","classification":"C","division":"CARRY OPTICS","hit_factor":3.5688},{"match_name":"RPS January 2021 USPSA Match","match_date":"2021-01-09","stage_classifiercode":"20-01","member_number":"TY109144","first_name":"MARK","last_name":"SCHULTE","classification":"B","division":"CARRY OPTICS","hit_factor":3.5646},{"match_name":"MCAS 2021 USPSA Classifier League","match_date":"2021-05-26","stage_classifiercode":"20-01","member_number":"TY-92356","first_name":"JAY","last_name":"SHEARER","classification":"C","division":"CARRY OPTICS","hit_factor":3.5616},{"match_name":"QPS Quantico Shooting Club December USPSA   ","match_date":"2020-12-12","stage_classifiercode":"20-01","member_number":"TY76353","first_name":"GARY","last_name":"WOTRING","classification":"C","division":"CARRY OPTICS","hit_factor":3.5605},{"match_name":"Ontelaunee USPSA November 2020","match_date":"2020-11-20","stage_classifiercode":"20-01","member_number":"TY127907","first_name":"MIKE","last_name":"BROWN","classification":"U","division":"CARRY OPTICS","hit_factor":3.5576},{"match_name":"TPS USPSA at CMP Dec 19 2020 Special Classifier Match","match_date":"2020-12-19","stage_classifiercode":"20-01","member_number":"YF119892","first_name":"QUINCY","last_name":"MCDONALD","classification":"U","division":"CARRY OPTICS","hit_factor":3.5573},{"match_name":"CAS classifier match","match_date":"2021-08-01","stage_classifiercode":"20-01","member_number":"TY136127","first_name":"JAMES","last_name":"LANDRY","classification":"U","division":"CARRY OPTICS","hit_factor":3.5562},{"match_name":"Richmond Hot Shots Aug 14-15-2021 USPSA","match_date":"2021-08-14","stage_classifiercode":"20-01","member_number":"A134249","first_name":"PETER","last_name":"CHANG","classification":"C","division":"CARRY OPTICS","hit_factor":3.5543},{"match_name":"EWPSA 2021-04","match_date":"2021-04-17","stage_classifiercode":"20-01","member_number":"TY95955","first_name":"THOMAS","last_name":"LEACHMAN","classification":"B","division":"CARRY OPTICS","hit_factor":3.5477},{"match_name":"GAS MAY 2021 USPSA","match_date":"2021-05-01","stage_classifiercode":"20-01","member_number":"A130483","first_name":"TRAVIS","last_name":"ROBINSON","classification":"U","division":"CARRY OPTICS","hit_factor":3.5449},{"match_name":"PIPS 04-28-2021","match_date":"2021-04-27","stage_classifiercode":"20-01","member_number":"A46881","first_name":"SHANE","last_name":"DIDUR","classification":"U","division":"CARRY OPTICS","hit_factor":3.5433},{"match_name":"Dundee Practical Shooters - Feb 27 2021","match_date":"2021-02-27","stage_classifiercode":"20-01","member_number":"none","first_name":"MATT","last_name":"SAAGER","classification":"U","division":"CARRY OPTICS","hit_factor":3.5344},{"match_name":"Mesilla Valley P September 2021 classifier match","match_date":"2021-09-04","stage_classifiercode":"20-01","member_number":"a100408","first_name":"JAMES","last_name":"HEBERT","classification":"M","division":"CARRY OPTICS","hit_factor":3.5323},{"match_name":"LGCSEMPS April 2021 Special Classifier","match_date":"2021-04-11","stage_classifiercode":"20-01","member_number":"A97547","first_name":"THOMAS","last_name":"LOVETT","classification":"D","division":"CARRY OPTICS","hit_factor":3.5242},{"match_name":"Cactus USPSA ALL CLASSIFIER January 2021","match_date":"2021-01-03","stage_classifiercode":"20-01","member_number":"A129449","first_name":"ALEXSANDRA","last_name":"FLOTTO","classification":"D","division":"CARRY OPTICS","hit_factor":3.5211},{"match_name":"5 Dogs December USPSA 2020","match_date":"2020-12-06","stage_classifiercode":"20-01","member_number":"XXXX","first_name":"DEREK","last_name":"MOUSSEAU","classification":"U","division":"CARRY OPTICS","hit_factor":3.5156},{"match_name":"SKSC USPSA Oct 2021","match_date":"2021-10-16","stage_classifiercode":"20-01","member_number":"A87353","first_name":"DAVID","last_name":"KOCHAROFF","classification":"C","division":"CARRY OPTICS","hit_factor":3.5111},{"match_name":"QPS Quantico Shooting Club December USPSA   ","match_date":"2020-12-12","stage_classifiercode":"20-01","member_number":"TY104180","first_name":"LUCAS","last_name":"DEBRUHL","classification":"U","division":"CARRY OPTICS","hit_factor":3.5069},{"match_name":"MAPSA 5/8/21","match_date":"2021-05-08","stage_classifiercode":"20-01","member_number":"L4043","first_name":"THOMAS","last_name":"KREBSBACH","classification":"C","division":"CARRY OPTICS","hit_factor":3.5029},{"match_name":"CAS March 2021","match_date":"2021-03-07","stage_classifiercode":"20-01","member_number":"a132969","first_name":"BUI","last_name":"JUSTIN","classification":"U","division":"CARRY OPTICS","hit_factor":3.5004},{"match_name":"Coastal Area Practical Shooters 10-23-21","match_date":"2021-10-23","stage_classifiercode":"20-01","member_number":"A90679","first_name":"BRIAN","last_name":"TURNER","classification":"U","division":"CARRY OPTICS","hit_factor":3.4985},{"match_name":"Dundee Practical Shooters - Feb 27 2021","match_date":"2021-02-27","stage_classifiercode":"20-01","member_number":"a58876","first_name":"ANTHONY","last_name":"FALKNER","classification":"D","division":"CARRY OPTICS","hit_factor":3.4974},{"match_name":"Oh Shoot -PRG Nov 27th - Uspsa Classifier Match","match_date":"2021-11-27","stage_classifiercode":"20-01","member_number":"TY120662","first_name":"HARRISON","last_name":"PHAM","classification":"U","division":"CARRY OPTICS","hit_factor":3.4898},{"match_name":"Richmond Hot Shots Aug 14-15-2021 USPSA","match_date":"2021-08-14","stage_classifiercode":"20-01","member_number":"Ty103488","first_name":"ERIC","last_name":"KAN","classification":"C","division":"CARRY OPTICS","hit_factor":3.4876},{"match_name":"OREGON ARPC CC05 USPSA OCT 9 2021","match_date":"2021-10-09","stage_classifiercode":"20-01","member_number":"TY108809","first_name":"JIM","last_name":"BERG","classification":"D","division":"CARRY OPTICS","hit_factor":3.4806},{"match_name":"ARPC USPSA Match 4-25-21","match_date":"2021-04-25","stage_classifiercode":"20-01","member_number":"A82327","first_name":"BRIAN","last_name":"SIX","classification":"Unclassified","division":"CARRY OPTICS","hit_factor":3.4792},{"match_name":"SWGC USPSA Pistol Match - May 2021","match_date":"2021-05-01","stage_classifiercode":"20-01","member_number":"A126334","first_name":"DAVID","last_name":"MCFADYEN","classification":"C","division":"CARRY OPTICS","hit_factor":3.4709},{"match_name":"Glacier Practical Shooters Special Classifier Match 05/01/2021","match_date":"2021-05-01","stage_classifiercode":"20-01","member_number":"A134184","first_name":"DUSTIN","last_name":"DEMARS","classification":"U","division":"CARRY OPTICS","hit_factor":3.4696},{"match_name":"MCAS MAY 2021 USPSA","match_date":"2021-05-15","stage_classifiercode":"20-01","member_number":"TY95730","first_name":"PATTI","last_name":"LAHAIE","classification":"C","division":"CARRY OPTICS","hit_factor":3.4675},{"match_name":"OREGON ARPC CC05 USPSA OCT 9 2021","match_date":"2021-10-09","stage_classifiercode":"20-01","member_number":"None","first_name":"CASSIE","last_name":"BURGESS","classification":"C","division":"CARRY OPTICS","hit_factor":3.4653},{"match_name":"Shasta Shooters 2021 June","match_date":"2021-06-12","stage_classifiercode":"20-01","member_number":"A126166","first_name":"JAMES","last_name":"KNOLLE JR","classification":"C","division":"CARRY OPTICS","hit_factor":3.4626},{"match_name":"SOAP December 2020 USPSA Match","match_date":"2020-12-11","stage_classifiercode":"20-01","member_number":"L4854","first_name":"DEXTER","last_name":"LOPEZ","classification":"C","division":"CARRY OPTICS","hit_factor":3.4593},{"match_name":"LGCSEMPS April 2021 Special Classifier","match_date":"2021-04-11","stage_classifiercode":"20-01","member_number":"A72906","first_name":"AARON","last_name":"KENDAL","classification":"C","division":"CARRY OPTICS","hit_factor":3.4589},{"match_name":"YMM  IPSC02 2021_01_10","match_date":"2021-01-10","stage_classifiercode":"20-01","member_number":"A121487","first_name":"JESSE","last_name":"RAY","classification":"U","division":"CARRY OPTICS","hit_factor":3.4555},{"match_name":"Dundee Practical Shooters - Feb 27 2021","match_date":"2021-02-27","stage_classifiercode":"20-01","member_number":"A122448","first_name":"DENNIS","last_name":"MCCOLLUM","classification":"D","division":"CARRY OPTICS","hit_factor":3.4551},{"match_name":"2020-12-05 USPSA  at Phoenix Rod and Gun Club","match_date":"2020-12-05","stage_classifiercode":"20-01","member_number":"TYF104260","first_name":"STEVEN","last_name":"JOHN","classification":"C","division":"CARRY OPTICS","hit_factor":3.4547},{"match_name":"SKSC USPSA Oct 2021","match_date":"2021-10-16","stage_classifiercode":"20-01","member_number":"TY111545","first_name":"JANE","last_name":"MCCULLOUGH","classification":"U","division":"CARRY OPTICS","hit_factor":3.4504},{"match_name":"Richmond Hot Shots Aug 14-15-2021 USPSA","match_date":"2021-08-14","stage_classifiercode":"20-01","member_number":"FY121417","first_name":"MAKANA","last_name":"ROYAL","classification":"C","division":"CARRY OPTICS","hit_factor":3.4483},{"match_name":"CIPSC IL Havana May USPSA","match_date":"2021-05-08","stage_classifiercode":"20-01","member_number":"FY99127","first_name":"STEVE","last_name":"FRAZIER","classification":"C","division":"CARRY OPTICS","hit_factor":3.4299},{"match_name":"Matamoras USPSA September 2021","match_date":"2021-09-19","stage_classifiercode":"20-01","member_number":"FY95285","first_name":"DAVID","last_name":"PHILLIPS","classification":"M","division":"CARRY OPTICS","hit_factor":3.4256},{"match_name":"SPSA USPSA January 1st Sat Match","match_date":"2021-01-02","stage_classifiercode":"20-01","member_number":"A130943","first_name":"CHRIS","last_name":"CRANFORD","classification":"D","division":"CARRY OPTICS","hit_factor":3.4149},{"match_name":"OK06-30OCT21-SCRP-USPSA","match_date":"2021-10-30","stage_classifiercode":"20-01","member_number":"A134947","first_name":"DAVID","last_name":"SCHUCKER","classification":"B","division":"CARRY OPTICS","hit_factor":3.4138},{"match_name":"NHRPC - November 2021 USPSA","match_date":"2021-11-13","stage_classifiercode":"20-01","member_number":"A133782","first_name":"JOSEPH","last_name":"DATU","classification":"D","division":"CARRY OPTICS","hit_factor":3.4118},{"match_name":"Medford USPSA March 2021 OR-04","match_date":"2021-03-21","stage_classifiercode":"20-01","member_number":"TY77822","first_name":"DAVID","last_name":"ENLOE","classification":"C","division":"CARRY OPTICS","hit_factor":3.4105},{"match_name":"SFA USPSA JANUARY 16 2021 MATCH","match_date":"2021-01-16","stage_classifiercode":"20-01","member_number":"TY120365","first_name":"MACLEAN","last_name":"HESS","classification":"U - I don't know and don't care","division":"CARRY OPTICS","hit_factor":3.4091},{"match_name":"MRPC OHS02 06272021","match_date":"2021-06-27","stage_classifiercode":"20-01","member_number":"A73642","first_name":"JOHN","last_name":"HERDERING","classification":"U","division":"CARRY OPTICS","hit_factor":3.4082},{"match_name":"Mesilla Valley P September 2021 classifier match","match_date":"2021-09-04","stage_classifiercode":"20-01","member_number":"A120259","first_name":"ERIK","last_name":"COOK","classification":"U","division":"CARRY OPTICS","hit_factor":3.4072},{"match_name":"CIPSC IL Havana May USPSA","match_date":"2021-05-08","stage_classifiercode":"20-01","member_number":"A86672","first_name":"DON","last_name":"HITCHINGS","classification":"C","division":"CARRY OPTICS","hit_factor":3.4043},{"match_name":"SFPS 5-16-21 Super Classifier","match_date":"2021-05-16","stage_classifiercode":"20-01","member_number":"a23396","first_name":"DION","last_name":"JOHNSON","classification":"C","division":"CARRY OPTICS","hit_factor":3.3999},{"match_name":"Shasta Shooters 2021 June","match_date":"2021-06-12","stage_classifiercode":"20-01","member_number":"a43454","first_name":"ADRIAN","last_name":"BORTOLIN","classification":"C","division":"CARRY OPTICS","hit_factor":3.3941},{"match_name":"NHRPC - November 2021 USPSA","match_date":"2021-11-13","stage_classifiercode":"20-01","member_number":"ty98673","first_name":"BRIAN","last_name":"ATTENBOROUGH","classification":"C","division":"CARRY OPTICS","hit_factor":3.392},{"match_name":"WLPS May 2021 ALL USPSA Classifier Match ","match_date":"2021-05-23","stage_classifiercode":"20-01","member_number":"FY79193","first_name":"LELAND","last_name":"BELDING","classification":"U","division":"CARRY OPTICS","hit_factor":3.3919},{"match_name":"Wallis Orchard Practical Shooters April 2021 Club Match","match_date":"2021-04-18","stage_classifiercode":"20-01","member_number":"A132413","first_name":"ROMELIO","last_name":"SAN JOSE","classification":"U","division":"CARRY OPTICS","hit_factor":3.3898},{"match_name":"Oh Shoot -PRG Nov 27th - Uspsa Classifier Match","match_date":"2021-11-27","stage_classifiercode":"20-01","member_number":"A135762","first_name":"CHRIS","last_name":"WOOD","classification":"U","division":"CARRY OPTICS","hit_factor":3.3876},{"match_name":"Coastal Area Practical Shooters 10-23-21","match_date":"2021-10-23","stage_classifiercode":"20-01","member_number":"TY83837","first_name":"BOB","last_name":"GUNDEL","classification":"C","division":"CARRY OPTICS","hit_factor":3.3837},{"match_name":"CIPSC IL Havana May USPSA","match_date":"2021-05-08","stage_classifiercode":"20-01","member_number":"ty27598","first_name":"RICK","last_name":"RICCIONI","classification":"C","division":"CARRY OPTICS","hit_factor":3.3837},{"match_name":"OPSC USPSA JUNE 2021","match_date":"2021-06-13","stage_classifiercode":"20-01","member_number":"A133752","first_name":"DAVID","last_name":"PETTIGREW","classification":"U","division":"CARRY OPTICS","hit_factor":3.3813},{"match_name":"Medford USPSA Oct 2021 Match","match_date":"2021-10-17","stage_classifiercode":"20-01","member_number":"TY113860","first_name":"ART","last_name":"SCHOLTZ","classification":"C","division":"CARRY OPTICS","hit_factor":3.38},{"match_name":"MRPC OHS02 06272021","match_date":"2021-06-27","stage_classifiercode":"20-01","member_number":"A112450","first_name":"DOUGLAS","last_name":"HOFF","classification":"C","division":"CARRY OPTICS","hit_factor":3.3777},{"match_name":"Maine Practical Shooters May 2021","match_date":"2021-05-08","stage_classifiercode":"20-01","member_number":"TY128399","first_name":"JONATHAN","last_name":"WHEATON","classification":"B","division":"CARRY OPTICS","hit_factor":3.3698},{"match_name":"CCPL 05-09-2021","match_date":"2021-05-09","stage_classifiercode":"20-01","member_number":"A107370","first_name":"GERARD","last_name":"MEDEIROS","classification":"U","division":"CARRY OPTICS","hit_factor":3.3689},{"match_name":"Chattanooga Practical Shooting Assoc   USPSA - Saturday Oct 9th 2021","match_date":"2021-10-09","stage_classifiercode":"20-01","member_number":"FY48598","first_name":"DAVID","last_name":"GROB","classification":"U","division":"CARRY OPTICS","hit_factor":3.3651},{"match_name":"Oh Shoot -PRG Nov 27th - Uspsa Classifier Match","match_date":"2021-11-27","stage_classifiercode":"20-01","member_number":"A127498","first_name":"MIKE","last_name":"MRAK","classification":"U","division":"CARRY OPTICS","hit_factor":3.3639},{"match_name":"TPS USPSA at CMP Dec 19 2020 Special Classifier Match","match_date":"2020-12-19","stage_classifiercode":"20-01","member_number":"TY83047","first_name":"FRANK","last_name":"POLACK","classification":"C","division":"CARRY OPTICS","hit_factor":3.3613},{"match_name":"LdF USPSA Match November 7 2021","match_date":"2021-11-07","stage_classifiercode":"20-01","member_number":"FY70424","first_name":"DONALD","last_name":"RATLIFF","classification":"U","division":"CARRY OPTICS","hit_factor":3.3604},{"match_name":"SWGC USPSA Pistol Match - May 2021","match_date":"2021-05-01","stage_classifiercode":"20-01","member_number":"A129138","first_name":"TREVOR","last_name":"EVAN","classification":"U","division":"CARRY OPTICS","hit_factor":3.3604},{"match_name":"QPS Quantico Shooting Club December USPSA   ","match_date":"2020-12-12","stage_classifiercode":"20-01","member_number":"A130384","first_name":"JASON","last_name":"DILLON","classification":"D","division":"CARRY OPTICS","hit_factor":3.3573},{"match_name":"SKSC USPSA Oct 2021","match_date":"2021-10-16","stage_classifiercode":"20-01","member_number":"A128670","first_name":"DEREK","last_name":"GUAY","classification":"C","division":"CARRY OPTICS","hit_factor":3.355},{"match_name":"TPS USPSA At CMP July 17 2021","match_date":"2021-07-17","stage_classifiercode":"20-01","member_number":"A124192","first_name":"PAUL","last_name":"HALLAS","classification":"C","division":"CARRY OPTICS","hit_factor":3.3545},{"match_name":"TTS USPSA Match 12JUN2021","match_date":"2021-06-12","stage_classifiercode":"20-01","member_number":"A133284","first_name":"DUANE","last_name":"BELLAMY","classification":"U","division":"CARRY OPTICS","hit_factor":3.3543},{"match_name":"Shasta Shooters 2021 Jan","match_date":"2021-01-09","stage_classifiercode":"20-01","member_number":"ty126795","first_name":"JOHN","last_name":"HEATH","classification":"U","division":"CARRY OPTICS","hit_factor":3.3512},{"match_name":"LdF USPSA Match November 7 2021","match_date":"2021-11-07","stage_classifiercode":"20-01","member_number":"TY92479","first_name":"JOEL","last_name":"GONZALES","classification":"A","division":"CARRY OPTICS","hit_factor":3.3496},{"match_name":"LIPSA  - March  21st  2021 - March Madness USPSA Match ","match_date":"2021-03-21","stage_classifiercode":"20-01","member_number":"A111178","first_name":"DAVID","last_name":"MENA","classification":"C","division":"CARRY OPTICS","hit_factor":3.3461},{"match_name":"Shasta Shooters 2021 June","match_date":"2021-06-12","stage_classifiercode":"20-01","member_number":"TY109510","first_name":"VINCE","last_name":"CLEMENTS","classification":"C","division":"CARRY OPTICS","hit_factor":3.3437},{"match_name":"Ontelaunee USPSA November 2020","match_date":"2020-11-20","stage_classifiercode":"20-01","member_number":"A122519","first_name":"EMILY","last_name":"MO","classification":"B","division":"CARRY OPTICS","hit_factor":3.3429},{"match_name":"CCPL 05-09-2021","match_date":"2021-05-09","stage_classifiercode":"20-01","member_number":"TY120481","first_name":"MARK","last_name":"RAU","classification":"D","division":"CARRY OPTICS","hit_factor":3.34},{"match_name":"Medford USPSA March 2021 OR-04","match_date":"2021-03-21","stage_classifiercode":"20-01","member_number":"A133299","first_name":"ZACHERY","last_name":"ROBLES","classification":"U","division":"CARRY OPTICS","hit_factor":3.3353},{"match_name":"MCAS MAY 2021 USPSA","match_date":"2021-05-15","stage_classifiercode":"20-01","member_number":"TY95712","first_name":"PAUL","last_name":"MISH","classification":"C","division":"CARRY OPTICS","hit_factor":3.3333},{"match_name":"SFPS 5-16-21 Super Classifier","match_date":"2021-05-16","stage_classifiercode":"20-01","member_number":"a110252","first_name":"WAYNE","last_name":"HEUER","classification":"U","division":"CARRY OPTICS","hit_factor":3.3311},{"match_name":"Matamoras USPSA September 2021","match_date":"2021-09-19","stage_classifiercode":"20-01","member_number":"TY131097","first_name":"PETER","last_name":"RAYMOND","classification":"D","division":"CARRY OPTICS","hit_factor":3.3289},{"match_name":"Richmond Boro Gun Club Monthly USPSA Match May 2021","match_date":"2021-05-08","stage_classifiercode":"20-01","member_number":"TY108539","first_name":"LOUIS","last_name":"SEGGIO","classification":"D","division":"CARRY OPTICS","hit_factor":3.3272},{"match_name":"QPS Quantico Shooting Club December USPSA   ","match_date":"2020-12-12","stage_classifiercode":"20-01","member_number":"A50322","first_name":"MAX","last_name":"DELO","classification":"U","division":"CARRY OPTICS","hit_factor":3.3243},{"match_name":"YMM  IPSC02 2021_01_10","match_date":"2021-01-10","stage_classifiercode":"20-01","member_number":"A127056","first_name":"PATRICK","last_name":"HOLLAND","classification":"U","division":"CARRY OPTICS","hit_factor":3.3241},{"match_name":"DSSA 2021-02 USPSA Pistol","match_date":"2021-02-28","stage_classifiercode":"20-01","member_number":"A119238","first_name":"AUSTIN","last_name":"CURRY","classification":"U","division":"CARRY OPTICS","hit_factor":3.3231},{"match_name":"SOAP July 2021 USPSA Match","match_date":"2021-07-11","stage_classifiercode":"20-01","member_number":"TY106419","first_name":"JEFF","last_name":"SCHMIDT","classification":"B","division":"CARRY OPTICS","hit_factor":3.3184},{"match_name":"Southern Kentucky Gun Club USPSA April Match","match_date":"2021-04-25","stage_classifiercode":"20-01","member_number":"A133876","first_name":"MICHAEL","last_name":"ELKINS","classification":"U","division":"CARRY OPTICS","hit_factor":3.3149},{"match_name":"Belton Gun Club USPSA March Classifier MATCH 3-7-21","match_date":"2021-03-07","stage_classifiercode":"20-01","member_number":"A114556","first_name":"HANS","last_name":"BIRNBRICH","classification":"U","division":"CARRY OPTICS","hit_factor":3.3135},{"match_name":"SRSC USPSA 3-28-21 Superclassifier","match_date":"2021-03-28","stage_classifiercode":"20-01","member_number":"A129456","first_name":"NICK","last_name":"CRAMER","classification":"U","division":"CARRY OPTICS","hit_factor":3.3129},{"match_name":"GCL Monthly USPSA Match Saturday 11-6-2021  INDOORS","match_date":"2021-11-06","stage_classifiercode":"20-01","member_number":"A85329","first_name":"JIM","last_name":"BROWNE","classification":"C","division":"CARRY OPTICS","hit_factor":3.3086},{"match_name":"Nampa USPSA December 5th 2020","match_date":"2020-12-05","stage_classifiercode":"20-01","member_number":"TY41041","first_name":"NICK","last_name":"WELCH","classification":"B","division":"CARRY OPTICS","hit_factor":3.3064},{"match_name":"MPSA 2020-11-21","match_date":"2020-11-21","stage_classifiercode":"20-01","member_number":"A124219","first_name":"STEPHAN","last_name":"HANKINS","classification":"U","division":"CARRY OPTICS","hit_factor":3.3038},{"match_name":"NHRPC - November 2021 USPSA","match_date":"2021-11-13","stage_classifiercode":"20-01","member_number":"A104823","first_name":"RAFAEL","last_name":"ALICEA","classification":"C","division":"CARRY OPTICS","hit_factor":3.3028},{"match_name":"Shongum May 2021 USPSA Match","match_date":"2021-05-01","stage_classifiercode":"20-01","member_number":"Ty120732","first_name":"JEFFREY","last_name":"WOLINSKY","classification":"C","division":"CARRY OPTICS","hit_factor":3.3025},{"match_name":"November All-Classifier USPSA Match at C and C Indoor Range","match_date":"2020-11-17","stage_classifiercode":"20-01","member_number":"A124161","first_name":"TRAVIS","last_name":"CARROLL","classification":"C","division":"CARRY OPTICS","hit_factor":3.2984},{"match_name":"OREGON ARPC CC05 USPSA OCT 9 2021","match_date":"2021-10-09","stage_classifiercode":"20-01","member_number":"A-29352","first_name":"CHRIS","last_name":"MCRAE","classification":"U","division":"CARRY OPTICS","hit_factor":3.2927},{"match_name":"Hallstead USPSA April 24 match","match_date":"2021-04-24","stage_classifiercode":"20-01","member_number":"A127212","first_name":"JEFF","last_name":"MARTIN","classification":"U","division":"CARRY OPTICS","hit_factor":3.2885},{"match_name":"Hampden RPC November USPSA Match","match_date":"2020-11-08","stage_classifiercode":"20-01","member_number":"A113740","first_name":"DAVID","last_name":"BOONE","classification":"B","division":"CARRY OPTICS","hit_factor":3.2828},{"match_name":"Maine Practical Shooters May 2021","match_date":"2021-05-08","stage_classifiercode":"20-01","member_number":"TY121574","first_name":"JEREMY","last_name":"WAITE","classification":"U","division":"CARRY OPTICS","hit_factor":3.2804},{"match_name":"SCPS ECO19 January 23rd 2021","match_date":"2021-01-22","stage_classifiercode":"20-01","member_number":"L3985","first_name":"FRANK","last_name":"JOHNSON","classification":"D","division":"CARRY OPTICS","hit_factor":3.2768},{"match_name":"Wallis Orchard Practical Shooters April 2021 Club Match","match_date":"2021-04-18","stage_classifiercode":"20-01","member_number":"A118114","first_name":"NATHANIEL","last_name":"LOVAN","classification":"D","division":"CARRY OPTICS","hit_factor":3.2762},{"match_name":"Richmond Boro Gun Club Monthly USPSA Match May 2021","match_date":"2021-05-08","stage_classifiercode":"20-01","member_number":"A124448","first_name":"ALEX","last_name":"KOKIT","classification":"D","division":"CARRY OPTICS","hit_factor":3.2644},{"match_name":"USPSA Strategic Edge SEGR May 15th 2021","match_date":"2021-05-15","stage_classifiercode":"20-01","member_number":"A132218","first_name":"ENDA","last_name":"MURPHY","classification":"U","division":"CARRY OPTICS","hit_factor":3.2596},{"match_name":"BNA USPSA - July 25 2021 (Brothers N Arms)","match_date":"2021-07-25","stage_classifiercode":"20-01","member_number":"Ty109250","first_name":"ARTHUR","last_name":"CALIMARAN","classification":"B","division":"CARRY OPTICS","hit_factor":3.2573},{"match_name":"OK06-30OCT21-SCRP-USPSA","match_date":"2021-10-30","stage_classifiercode":"20-01","member_number":"TY114237","first_name":"CHRISTOPHER","last_name":"STALLWORTH","classification":"B","division":"CARRY OPTICS","hit_factor":3.2551},{"match_name":"MRPC OHS02 06272021","match_date":"2021-06-27","stage_classifiercode":"20-01","member_number":"A58577","first_name":"PAUL","last_name":"SANTIAGO","classification":"U","division":"CARRY OPTICS","hit_factor":3.2529},{"match_name":"QPS Quantico Shooting Club December USPSA   ","match_date":"2020-12-12","stage_classifiercode":"20-01","member_number":"A131244","first_name":"JAXON","last_name":"DILLON","classification":"U","division":"CARRY OPTICS","hit_factor":3.2513},{"match_name":"Southern Kentucky Gun Club USPSA April Match","match_date":"2021-04-25","stage_classifiercode":"20-01","member_number":"TY110092","first_name":"ROBBIE","last_name":"SPRATT","classification":"U","division":"CARRY OPTICS","hit_factor":3.25},{"match_name":"APSC USPSA 11-7-20","match_date":"2020-11-07","stage_classifiercode":"20-01","member_number":"TY107029","first_name":"RON","last_name":"WOOD","classification":"C","division":"CARRY OPTICS","hit_factor":3.2493},{"match_name":"WSPS MARCH 2021 USPSA","match_date":"2021-03-20","stage_classifiercode":"20-01","member_number":"A76695","first_name":"TODD","last_name":"BOYER","classification":"C","division":"CARRY OPTICS","hit_factor":3.2468},{"match_name":"Coyote Arms Classifier Match 10-31-21","match_date":"2021-10-31","stage_classifiercode":"20-01","member_number":"A90542","first_name":"MICHAEL","last_name":"CATEORA","classification":"U","division":"CARRY OPTICS","hit_factor":3.2417},{"match_name":"Dundee Practical Shooters - Feb 27 2021","match_date":"2021-02-27","stage_classifiercode":"20-01","member_number":"Ty96825","first_name":"CASSIE","last_name":"BURGESS","classification":"D","division":"CARRY OPTICS","hit_factor":3.237},{"match_name":"SRSC USPSA 3-28-21 Superclassifier","match_date":"2021-03-28","stage_classifiercode":"20-01","member_number":"TY125435","first_name":"PETER","last_name":"MONZEL","classification":"U","division":"CARRY OPTICS","hit_factor":3.2316},{"match_name":"Cactus USPSA ALL CLASSIFIER January 2021","match_date":"2021-01-03","stage_classifiercode":"20-01","member_number":"A114926","first_name":"ROBERT","last_name":"HARRIS","classification":"D","division":"CARRY OPTICS","hit_factor":3.2276},{"match_name":"Vortex Edge USPSA October 2021","match_date":"2021-10-09","stage_classifiercode":"20-01","member_number":"A121431","first_name":"DUSTIN","last_name":"JONES","classification":"U","division":"CARRY OPTICS","hit_factor":3.2258},{"match_name":"Richmond Hot Shots Aug 14-15-2021 USPSA","match_date":"2021-08-14","stage_classifiercode":"20-01","member_number":"A130671","first_name":"SAM","last_name":"LUU","classification":"C","division":"CARRY OPTICS","hit_factor":3.2258},{"match_name":"SRSC USPSA 3-28-21 Superclassifier","match_date":"2021-03-28","stage_classifiercode":"20-01","member_number":"TY13098","first_name":"DAVID","last_name":"HINELINE","classification":"C","division":"CARRY OPTICS","hit_factor":3.2189},{"match_name":"Medford USPSA Oct 2021 Match","match_date":"2021-10-17","stage_classifiercode":"20-01","member_number":"TY77822","first_name":"DAVID","last_name":"ENLOE","classification":"C","division":"CARRY OPTICS","hit_factor":3.2184},{"match_name":"17s PSC - USPSA - January 2021","match_date":"2021-01-16","stage_classifiercode":"20-01","member_number":"TY 83837","first_name":"BOB","last_name":"GUNDEL","classification":"C","division":"CARRY OPTICS","hit_factor":3.2151},{"match_name":"APSC USPSA 11-7-20","match_date":"2020-11-07","stage_classifiercode":"20-01","member_number":"A126671","first_name":"TONY","last_name":"PIERCE","classification":"U","division":"CARRY OPTICS","hit_factor":3.215},{"match_name":"Heartland PS USPSA Monthly 21 March 2021","match_date":"2021-03-21","stage_classifiercode":"20-01","member_number":"A126941","first_name":"DANIEL","last_name":"HOFF","classification":"C","division":"CARRY OPTICS","hit_factor":3.2072},{"match_name":"MCRC USPSA March 2021","match_date":"2021-03-13","stage_classifiercode":"20-01","member_number":"A108199","first_name":"TIM","last_name":"OVERSTREET","classification":"A","division":"CARRY OPTICS","hit_factor":3.2},{"match_name":"Cactus USPSA ALL CLASSIFIER January 2021","match_date":"2021-01-03","stage_classifiercode":"20-01","member_number":"A127546","first_name":"MISSI","last_name":"LABISTRE","classification":"U","division":"CARRY OPTICS","hit_factor":3.1991},{"match_name":"Quinton USPSA - April 10 2021","match_date":"2021-04-10","stage_classifiercode":"20-01","member_number":"A92191","first_name":"JUSTIN","last_name":"PLATT JR.","classification":"D","division":"CARRY OPTICS","hit_factor":3.1921},{"match_name":"Shadow Hawk Defense - USPSA Dec 13th","match_date":"2020-12-13","stage_classifiercode":"20-01","member_number":"A120434","first_name":"KAREN","last_name":"ZEIGLER","classification":"U","division":"CARRY OPTICS","hit_factor":3.1873},{"match_name":"Richmond Hot Shots Aug 14-15-2021 USPSA","match_date":"2021-08-14","stage_classifiercode":"20-01","member_number":"A132841","first_name":"RENATO","last_name":"GIRON","classification":"D","division":"CARRY OPTICS","hit_factor":3.1804},{"match_name":"MCTS -  USPSA March 2021 Classifier Match","match_date":"2021-03-21","stage_classifiercode":"20-01","member_number":"A99748","first_name":"DAVID","last_name":"VON HAGEN","classification":"C","division":"CARRY OPTICS","hit_factor":3.1795},{"match_name":"GCL Saturday 4-3-2021","match_date":"2021-04-03","stage_classifiercode":"20-01","member_number":"TY93730","first_name":"CHUCK","last_name":"BUSS","classification":"D","division":"CARRY OPTICS","hit_factor":3.1768},{"match_name":"CTASA - 3rd Sunday USPSA at Triple C Range - 12-20-2020","match_date":"2020-12-20","stage_classifiercode":"20-01","member_number":"76683","first_name":"CALVIN","last_name":"TRUONG","classification":"A","division":"CARRY OPTICS","hit_factor":3.1616},{"match_name":"OPSC USPSA JUNE 2021","match_date":"2021-06-13","stage_classifiercode":"20-01","member_number":"A108204","first_name":"FRANK","last_name":"POLAK","classification":"U","division":"CARRY OPTICS","hit_factor":3.1603},{"match_name":"WLPS May 2021 ALL USPSA Classifier Match ","match_date":"2021-05-23","stage_classifiercode":"20-01","member_number":"TY112165","first_name":"DAN","last_name":"HANUS","classification":"U","division":"CARRY OPTICS","hit_factor":3.16},{"match_name":"LGCSEMPS April 2021 Special Classifier","match_date":"2021-04-11","stage_classifiercode":"20-01","member_number":"TY102288","first_name":"RICK","last_name":"ROSS","classification":"C","division":"CARRY OPTICS","hit_factor":3.1548},{"match_name":"NW01 T-Day 2020","match_date":"2020-11-08","stage_classifiercode":"20-01","member_number":"A86506","first_name":"DENNIS","last_name":"MAGUDDAYAO","classification":"D","division":"CARRY OPTICS","hit_factor":3.154},{"match_name":"JPPS USPSA Match 8-15-2021","match_date":"2021-08-15","stage_classifiercode":"20-01","member_number":"A91127","first_name":"BRAD","last_name":"DONEY","classification":"U","division":"CARRY OPTICS","hit_factor":3.1505},{"match_name":"Chillicothe Sportsmens Club July USPSA","match_date":"2021-07-24","stage_classifiercode":"20-01","member_number":"TY131245","first_name":"JIM","last_name":"BARTLEY","classification":"U","division":"CARRY OPTICS","hit_factor":3.1502},{"match_name":"ARPC USPSA Match 4-25-21","match_date":"2021-04-25","stage_classifiercode":"20-01","member_number":"NONE","first_name":"TIM","last_name":"WILLIAMS","classification":"Unclassified","division":"CARRY OPTICS","hit_factor":3.1487},{"match_name":"JPPS USPSA Match 8-15-2021","match_date":"2021-08-15","stage_classifiercode":"20-01","member_number":"A89751","first_name":"TONY","last_name":"DIAMOND TENNEY","classification":"B","division":"CARRY OPTICS","hit_factor":3.1453},{"match_name":"Dundee Practical Shooters - Feb 27 2021","match_date":"2021-02-27","stage_classifiercode":"20-01","member_number":"none","first_name":"TOM","last_name":"CHONG","classification":"U","division":"CARRY OPTICS","hit_factor":3.1436},{"match_name":"Shasta Shooters 2021 Jan","match_date":"2021-01-09","stage_classifiercode":"20-01","member_number":"A131730","first_name":"KALVIN","last_name":"KVALVIK","classification":"U","division":"CARRY OPTICS","hit_factor":3.1302},{"match_name":"YMM  IPSC02 2021_01_10","match_date":"2021-01-10","stage_classifiercode":"20-01","member_number":"L4933","first_name":"JEFF","last_name":"BLACKWELL","classification":"D","division":"CARRY OPTICS","hit_factor":3.1268},{"match_name":"BNA USPSA - July 25 2021 (Brothers N Arms)","match_date":"2021-07-25","stage_classifiercode":"20-01","member_number":"FY99028","first_name":"JOHN","last_name":"CAUSEY","classification":"C","division":"CARRY OPTICS","hit_factor":3.1196},{"match_name":"WLPS May 2021 ALL USPSA Classifier Match ","match_date":"2021-05-23","stage_classifiercode":"20-01","member_number":"ty96505","first_name":"TONY","last_name":"RATH","classification":"U","division":"CARRY OPTICS","hit_factor":3.1191},{"match_name":"Bossier Parish Practical Shooters March 21 2021","match_date":"2021-03-21","stage_classifiercode":"20-01","member_number":"TY116348","first_name":"DENISE","last_name":"MCDONNELL","classification":"C","division":"CARRY OPTICS","hit_factor":3.1144},{"match_name":"Chattanooga Practical Shooting Assoc   USPSA - Saturday Oct 9th 2021","match_date":"2021-10-09","stage_classifiercode":"20-01","member_number":"A136895","first_name":"JEFF","last_name":"BENNETT","classification":"U","division":"CARRY OPTICS","hit_factor":3.1136},{"match_name":"2020-12-05 USPSA  at Phoenix Rod and Gun Club","match_date":"2020-12-05","stage_classifiercode":"20-01","member_number":"TY67883","first_name":"JOE","last_name":"PASQUALI","classification":"D","division":"CARRY OPTICS","hit_factor":3.1106},{"match_name":"LASC-USPSA April 2021","match_date":"2021-04-17","stage_classifiercode":"20-01","member_number":"TY110181","first_name":"MARV","last_name":"ALME","classification":"D","division":"CARRY OPTICS","hit_factor":3.1088},{"match_name":"Medford USPSA March 2021 OR-04","match_date":"2021-03-21","stage_classifiercode":"20-01","member_number":"A109969","first_name":"VIC","last_name":"DOWNER","classification":"D","division":"CARRY OPTICS","hit_factor":3.1077},{"match_name":"CCPS July 2021 USPSA","match_date":"2021-07-04","stage_classifiercode":"20-01","member_number":"A122846","first_name":"JEREMY","last_name":"BRYANT","classification":"\"\"","division":"CARRY OPTICS","hit_factor":3.106},{"match_name":"Hampden RPC November USPSA Match","match_date":"2020-11-08","stage_classifiercode":"20-01","member_number":"A128214","first_name":"WESLEY","last_name":"RAYMOND","classification":"U","division":"CARRY OPTICS","hit_factor":3.1028},{"match_name":"GCL Saturday 4-3-2021","match_date":"2021-04-03","stage_classifiercode":"20-01","member_number":"TY107802","first_name":"AMY","last_name":"LONGYEAR","classification":"C","division":"CARRY OPTICS","hit_factor":3.0996},{"match_name":"LNDL July 11th Classifier Match","match_date":"2021-07-11","stage_classifiercode":"20-01","member_number":"A128274","first_name":"DAVID","last_name":"GUINN","classification":"U","division":"CARRY OPTICS","hit_factor":3.0907},{"match_name":"TPS USPSA at CMP Dec 19 2020 Special Classifier Match","match_date":"2020-12-19","stage_classifiercode":"20-01","member_number":"TY74047","first_name":"LEE","last_name":"KERR","classification":"C","division":"CARRY OPTICS","hit_factor":3.0905},{"match_name":"MAPSA 5/8/21","match_date":"2021-05-08","stage_classifiercode":"20-01","member_number":"A132164","first_name":"JOHN","last_name":"LARSON","classification":"U","division":"CARRY OPTICS","hit_factor":3.0888},{"match_name":"SPSA USPSA January 1st Sat Match","match_date":"2021-01-02","stage_classifiercode":"20-01","member_number":"A88808","first_name":"RICK","last_name":"ROBERTS","classification":"C","division":"CARRY OPTICS","hit_factor":3.0827},{"match_name":"Oh Shoot -PRG Nov 27th - Uspsa Classifier Match","match_date":"2021-11-27","stage_classifiercode":"20-01","member_number":"A114106","first_name":"MELISSA","last_name":"LEE","classification":"U","division":"CARRY OPTICS","hit_factor":3.0747},{"match_name":"SGC USPSA Match 5-29-21","match_date":"2021-05-29","stage_classifiercode":"20-01","member_number":"A129336","first_name":"DAVE","last_name":"HOPKINS","classification":"U","division":"CARRY OPTICS","hit_factor":3.063},{"match_name":"LIPSA  - March  21st  2021 - March Madness USPSA Match ","match_date":"2021-03-21","stage_classifiercode":"20-01","member_number":"TY104475","first_name":"ED","last_name":"GOTTLIEB","classification":"U","division":"CARRY OPTICS","hit_factor":3.0575},{"match_name":"FBURG September 2021 USPSA","match_date":"2021-09-05","stage_classifiercode":"20-01","member_number":"TY109812","first_name":"AMY","last_name":"AI","classification":"U","division":"CARRY OPTICS","hit_factor":3.0568},{"match_name":"Nampa USPSA December 5th 2020","match_date":"2020-12-05","stage_classifiercode":"20-01","member_number":"A98645","first_name":"JIM","last_name":"BUXTON","classification":"C","division":"CARRY OPTICS","hit_factor":3.0481},{"match_name":"NISA August 2021","match_date":"2021-08-22","stage_classifiercode":"20-01","member_number":"A91891","first_name":"BILL","last_name":"PARRILLI","classification":"C","division":"CARRY OPTICS","hit_factor":3.0445},{"match_name":"Volusia County Gun and Hunt Club","match_date":"2020-11-21","stage_classifiercode":"20-01","member_number":"A117448","first_name":"ANGELO","last_name":"LOPEZ","classification":"C","division":"CARRY OPTICS","hit_factor":3.0322},{"match_name":"LIPSA  - March  21st  2021 - March Madness USPSA Match ","match_date":"2021-03-21","stage_classifiercode":"20-01","member_number":"TY125174","first_name":"FRANK JR","last_name":"SEMAR","classification":"B","division":"CARRY OPTICS","hit_factor":3.0303},{"match_name":"QPS Quantico Shooting Club December USPSA   ","match_date":"2020-12-12","stage_classifiercode":"20-01","member_number":"A131316","first_name":"BEN","last_name":"SEIDEN","classification":"U","division":"CARRY OPTICS","hit_factor":3.0211},{"match_name":"Collin County USPSA  08-22-2021","match_date":"2021-08-22","stage_classifiercode":"20-01","member_number":"A109764","first_name":"DAN","last_name":"AUTON","classification":"C","division":"CARRY OPTICS","hit_factor":3.0151},{"match_name":"APSC USPSA 08-21-21","match_date":"2021-08-21","stage_classifiercode":"20-01","member_number":"TY86863","first_name":"CINDI","last_name":"MARTIN","classification":"C","division":"CARRY OPTICS","hit_factor":3.0139},{"match_name":"GCL Monthly USPSA Match Saturday 11-6-2021  INDOORS","match_date":"2021-11-06","stage_classifiercode":"20-01","member_number":"Ty86723","first_name":"PETER","last_name":"MILLS","classification":"C","division":"CARRY OPTICS","hit_factor":3.0065},{"match_name":"Dundee Practical Shooters - Feb 27 2021","match_date":"2021-02-27","stage_classifiercode":"20-01","member_number":"A98700","first_name":"MITCHELL","last_name":"PHAN","classification":"C","division":"CARRY OPTICS","hit_factor":3.0058},{"match_name":"APSC USPSA 08-21-21","match_date":"2021-08-21","stage_classifiercode":"20-01","member_number":"A124001","first_name":"CARMEN","last_name":"SHARAR","classification":"C","division":"CARRY OPTICS","hit_factor":3.0017},{"match_name":"Chillicothe Sportsmens Club July USPSA","match_date":"2021-07-24","stage_classifiercode":"20-01","member_number":"A104730","first_name":"JON","last_name":"NEUBAUM","classification":"B","division":"CARRY OPTICS","hit_factor":3.001},{"match_name":"FBURG September 2021 USPSA","match_date":"2021-09-05","stage_classifiercode":"20-01","member_number":"A130870","first_name":"TAO X","last_name":"MENG","classification":"B","division":"CARRY OPTICS","hit_factor":2.9963},{"match_name":"NHRPC - November 2021 USPSA","match_date":"2021-11-13","stage_classifiercode":"20-01","member_number":"A136945","first_name":"RYAN","last_name":"MOSES","classification":"U","division":"CARRY OPTICS","hit_factor":2.9928},{"match_name":"RBGC USPSA 2021-01-23","match_date":"2021-01-23","stage_classifiercode":"20-01","member_number":"A84202","first_name":"DOUG","last_name":"RUTLEDGE","classification":"B","division":"CARRY OPTICS","hit_factor":2.9928},{"match_name":"Richmond Boro Gun Club Monthly USPSA Match May 2021","match_date":"2021-05-08","stage_classifiercode":"20-01","member_number":"A116175","first_name":"RALPH","last_name":"PALASCIANO","classification":"D","division":"CARRY OPTICS","hit_factor":2.991},{"match_name":"CIPSC IL02 Havana August USPSA","match_date":"2021-08-07","stage_classifiercode":"20-01","member_number":"ty27598","first_name":"RICK","last_name":"RICCIONI","classification":"C","division":"CARRY OPTICS","hit_factor":2.9904},{"match_name":"Cactus USPSA ALL CLASSIFIER January 2021","match_date":"2021-01-03","stage_classifiercode":"20-01","member_number":"A108405","first_name":"DON","last_name":"PUCHATY","classification":"D","division":"CARRY OPTICS","hit_factor":2.9868},{"match_name":"Extreme GM uspsa Nov-13","match_date":"2021-11-13","stage_classifiercode":"20-01","member_number":"TY83237","first_name":"LEN","last_name":"KRAVITZ","classification":"C","division":"CARRY OPTICS","hit_factor":2.9851},{"match_name":"Nampa USPSA September 10th 2021 Classifier Match","match_date":"2021-09-10","stage_classifiercode":"20-01","member_number":"TY84532","first_name":"KENNY","last_name":"PLATT","classification":"U","division":"CARRY OPTICS","hit_factor":2.9831},{"match_name":"MRPC OHS02 06272021","match_date":"2021-06-27","stage_classifiercode":"20-01","member_number":"A122333","first_name":"JACEK","last_name":"BRZEZINSKI","classification":"U","division":"CARRY OPTICS","hit_factor":2.9762},{"match_name":"LdF USPSA Classifier Match December 12 2020","match_date":"2020-12-12","stage_classifiercode":"20-01","member_number":"A111060","first_name":"ROBBIE","last_name":"ROBINSON","classification":"U","division":"CARRY OPTICS","hit_factor":2.9744},{"match_name":"OPSC USPSA JUNE 2021","match_date":"2021-06-13","stage_classifiercode":"20-01","member_number":"A79144","first_name":"WAYNE","last_name":"WAGNER","classification":"B","division":"CARRY OPTICS","hit_factor":2.9674},{"match_name":"MCRC USPSA March 2021","match_date":"2021-03-13","stage_classifiercode":"20-01","member_number":"TY120889","first_name":"DAVID","last_name":"SCOTT","classification":"U","division":"CARRY OPTICS","hit_factor":2.963},{"match_name":"FBURG September 2021 USPSA","match_date":"2021-09-05","stage_classifiercode":"20-01","member_number":"NONE","first_name":"ADAM","last_name":"RUSSELL","classification":"U","division":"CARRY OPTICS","hit_factor":2.9489},{"match_name":"EWPSA 2021-04","match_date":"2021-04-17","stage_classifiercode":"20-01","member_number":"A133457","first_name":"GRANT","last_name":"FUJIMOTO","classification":"U","division":"CARRY OPTICS","hit_factor":2.948},{"match_name":"FBURG September 2021 USPSA","match_date":"2021-09-05","stage_classifiercode":"20-01","member_number":"L3460","first_name":"TROY","last_name":"HAYES","classification":"C","division":"CARRY OPTICS","hit_factor":2.9412},{"match_name":"Hosemonster Action  ","match_date":"2021-01-17","stage_classifiercode":"20-01","member_number":"TY123789","first_name":"BRENDA","last_name":"CHRISTESON","classification":"D","division":"CARRY OPTICS","hit_factor":2.9354},{"match_name":"Ontelaunee USPSA November 2020","match_date":"2020-11-20","stage_classifiercode":"20-01","member_number":"A114923","first_name":"MICHAEL","last_name":"DEMBROSKY","classification":"U","division":"CARRY OPTICS","hit_factor":2.9297},{"match_name":"EAGC January 2021 USPSA Classifier Match","match_date":"2021-01-30","stage_classifiercode":"20-01","member_number":"A128841","first_name":"JESSICA","last_name":"MAURO","classification":"U","division":"CARRY OPTICS","hit_factor":2.9281},{"match_name":"ESPS  USPSA  March","match_date":"2021-03-27","stage_classifiercode":"20-01","member_number":"FY82148","first_name":"CLYDE","last_name":"FORMILLEZA","classification":"B","division":"CARRY OPTICS","hit_factor":2.9252},{"match_name":"LIPSA  - March  21st  2021 - March Madness USPSA Match ","match_date":"2021-03-21","stage_classifiercode":"20-01","member_number":"A36160","first_name":"BARRY","last_name":"URBANICK","classification":"D","division":"CARRY OPTICS","hit_factor":2.9212},{"match_name":"Dundee Practical Shooters - Feb 27 2021","match_date":"2021-02-27","stage_classifiercode":"20-01","member_number":"130161","first_name":"WILLIAM","last_name":"PETERS","classification":"U","division":"CARRY OPTICS","hit_factor":2.9189},{"match_name":"FAS Sunday Outdoor USPSA Match","match_date":"2021-05-02","stage_classifiercode":"20-01","member_number":"TY125541","first_name":"TILDEN","last_name":"MORGAN","classification":"D","division":"CARRY OPTICS","hit_factor":2.9036},{"match_name":"MPSA 2020-11-21","match_date":"2020-11-21","stage_classifiercode":"20-01","member_number":"Pending","first_name":"BRADY","last_name":"MONTGOMERY","classification":"U","division":"CARRY OPTICS","hit_factor":2.9026},{"match_name":"Prairie Thunder GP17 USPSA 3-28-21","match_date":"2021-03-28","stage_classifiercode":"20-01","member_number":"A131272","first_name":"CHAD","last_name":"FOOS","classification":"U","division":"CARRY OPTICS","hit_factor":2.893},{"match_name":"Medford USPSA Oct 2021 Match","match_date":"2021-10-17","stage_classifiercode":"20-01","member_number":"TY109969","first_name":"VIC","last_name":"DOWNER","classification":"C","division":"CARRY OPTICS","hit_factor":2.8921},{"match_name":"RBGC USPSA 2021-01-23","match_date":"2021-01-23","stage_classifiercode":"20-01","member_number":"A122884","first_name":"COLE","last_name":"BRIDGES","classification":"B","division":"CARRY OPTICS","hit_factor":2.8868},{"match_name":"GoShoot Outdoor A6 Warm up And Classifier match!","match_date":"2021-04-03","stage_classifiercode":"20-01","member_number":"A122139","first_name":"THOMAS","last_name":"WALZ","classification":"U","division":"CARRY OPTICS","hit_factor":2.8868},{"match_name":"NISA August 2021","match_date":"2021-08-22","stage_classifiercode":"20-01","member_number":"L3825","first_name":"TOM","last_name":"PALMER","classification":"C","division":"CARRY OPTICS","hit_factor":2.8792},{"match_name":"EAGC January 2021 USPSA Classifier Match","match_date":"2021-01-30","stage_classifiercode":"20-01","member_number":"A132543","first_name":"AMY","last_name":"WAY","classification":"U","division":"CARRY OPTICS","hit_factor":2.8754},{"match_name":"Coyote Arms Classifier Match 10-31-21","match_date":"2021-10-31","stage_classifiercode":"20-01","member_number":"TY2958","first_name":"PETE","last_name":"CARPENTIER JR","classification":"U","division":"CARRY OPTICS","hit_factor":2.8634},{"match_name":"LdF USPSA Classifier Match December 12 2020","match_date":"2020-12-12","stage_classifiercode":"20-01","member_number":"FY131837","first_name":"KELLY","last_name":"GALEAZZI","classification":"U","division":"CARRY OPTICS","hit_factor":2.8614},{"match_name":"Glacier Practical Shooters Special Classifier Match 05/01/2021","match_date":"2021-05-01","stage_classifiercode":"20-01","member_number":"TY125585","first_name":"RON","last_name":"JARVIS","classification":"U","division":"CARRY OPTICS","hit_factor":2.8571},{"match_name":"Quinton USPSA - April 10 2021","match_date":"2021-04-10","stage_classifiercode":"20-01","member_number":"TY113568","first_name":"BOBBY","last_name":"HOFF","classification":"C","division":"CARRY OPTICS","hit_factor":2.8558},{"match_name":"LIPSA  - March  21st  2021 - March Madness USPSA Match ","match_date":"2021-03-21","stage_classifiercode":"20-01","member_number":"A105434","first_name":"FRED","last_name":"LAFEMINA","classification":"C","division":"CARRY OPTICS","hit_factor":2.8545},{"match_name":"ESPS  USPSA  March","match_date":"2021-03-27","stage_classifiercode":"20-01","member_number":"TY111522","first_name":"MAT","last_name":"FAULKNER","classification":"D","division":"CARRY OPTICS","hit_factor":2.8483},{"match_name":"Oh Shoot -PRG Nov 27th - Uspsa Classifier Match","match_date":"2021-11-27","stage_classifiercode":"20-01","member_number":"A137848","first_name":"ANDREW","last_name":"AYRADO","classification":"U","division":"CARRY OPTICS","hit_factor":2.8472},{"match_name":"Payson Practical Shooters USPSA Dec 5  2020","match_date":"2020-12-05","stage_classifiercode":"20-01","member_number":"TY90036","first_name":"MIKE","last_name":"PURKISS","classification":"B","division":"CARRY OPTICS","hit_factor":2.8358},{"match_name":"MRPC OHS02 06272021","match_date":"2021-06-27","stage_classifiercode":"20-01","member_number":"A134565","first_name":"HUNTER","last_name":"EVERSOLE","classification":"U","division":"CARRY OPTICS","hit_factor":2.8314},{"match_name":"SWGC USPSA Pistol Match - May 2021","match_date":"2021-05-01","stage_classifiercode":"20-01","member_number":"A112344","first_name":"SHELLY","last_name":"WINGERTER","classification":"D","division":"CARRY OPTICS","hit_factor":2.8198},{"match_name":"TPS USPSA -  January Match 2021 Rescheduled","match_date":"2021-01-03","stage_classifiercode":"20-01","member_number":"A131795","first_name":"MATTHEW","last_name":"WILSON","classification":"U","division":"CARRY OPTICS","hit_factor":2.8184},{"match_name":"GRRC 2021 wk 7","match_date":"2021-06-14","stage_classifiercode":"20-01","member_number":"A36739","first_name":"STEVEN","last_name":"SHIMEK","classification":"C","division":"CARRY OPTICS","hit_factor":2.8131},{"match_name":"LdF USPSA Match November 7 2021","match_date":"2021-11-07","stage_classifiercode":"20-01","member_number":"TY46745","first_name":"DANIEL","last_name":"STRAGIER","classification":"U","division":"CARRY OPTICS","hit_factor":2.8108},{"match_name":"RBGC USPSA 2021-01-23","match_date":"2021-01-23","stage_classifiercode":"20-01","member_number":"A132018","first_name":"KRIS","last_name":"GREEN","classification":"U","division":"CARRY OPTICS","hit_factor":2.8019},{"match_name":"MCAS 2021 USPSA Classifier League","match_date":"2021-05-26","stage_classifiercode":"20-01","member_number":"TY13940","first_name":"MAC","last_name":"CLARK","classification":"B","division":"CARRY OPTICS","hit_factor":2.7972},{"match_name":"MCAS MAY 2021 USPSA","match_date":"2021-05-15","stage_classifiercode":"20-01","member_number":"L3920","first_name":"ANDY","last_name":"RIO","classification":"D","division":"CARRY OPTICS","hit_factor":2.7902},{"match_name":"RPS January 2021 USPSA Match","match_date":"2021-01-09","stage_classifiercode":"20-01","member_number":"A98342","first_name":"HEATH","last_name":"RUFFNER","classification":"B","division":"CARRY OPTICS","hit_factor":2.7885},{"match_name":"MCRC USPSA March 2021","match_date":"2021-03-13","stage_classifiercode":"20-01","member_number":"A132876","first_name":"ERIC","last_name":"JACKSON","classification":"U","division":"CARRY OPTICS","hit_factor":2.7809},{"match_name":"Belton Gun Club USPSA March Classifier MATCH 3-7-21","match_date":"2021-03-07","stage_classifiercode":"20-01","member_number":"A131573","first_name":"GREGORY","last_name":"MARZETT","classification":"U","division":"CARRY OPTICS","hit_factor":2.7723},{"match_name":"Oh Shoot -PRG Nov 27th - Uspsa Classifier Match","match_date":"2021-11-27","stage_classifiercode":"20-01","member_number":"A75314","first_name":"AARON","last_name":"MUN","classification":"A","division":"CARRY OPTICS","hit_factor":2.765},{"match_name":"USPSA Strategic Edge SEGR May 15th 2021","match_date":"2021-05-15","stage_classifiercode":"20-01","member_number":"A123887","first_name":"MIKE","last_name":"PHILLIPS","classification":"B","division":"CARRY OPTICS","hit_factor":2.754},{"match_name":"Payson Practical Shooters USPSA Dec 5  2020","match_date":"2020-12-05","stage_classifiercode":"20-01","member_number":"a119567","first_name":"LAURI","last_name":"SAFFON","classification":"D","division":"CARRY OPTICS","hit_factor":2.7533},{"match_name":"JCSSA DEC 5 2020","match_date":"2020-12-05","stage_classifiercode":"20-01","member_number":"TY102469","first_name":"JOHN","last_name":"BAKER","classification":"B","division":"CARRY OPTICS","hit_factor":2.7523},{"match_name":"LdF USPSA Match November 7 2021","match_date":"2021-11-07","stage_classifiercode":"20-01","member_number":"TY136582","first_name":"FRANK","last_name":"DUARTE","classification":"U","division":"CARRY OPTICS","hit_factor":2.7464},{"match_name":"LIPSA  - March  21st  2021 - March Madness USPSA Match ","match_date":"2021-03-21","stage_classifiercode":"20-01","member_number":"FY96404","first_name":"ANNA","last_name":"ROINA","classification":"C","division":"CARRY OPTICS","hit_factor":2.7273},{"match_name":"Extreme GM uspsa Nov-13","match_date":"2021-11-13","stage_classifiercode":"20-01","member_number":"A113160","first_name":"SEAN","last_name":"GOLDENBERG","classification":"U","division":"CARRY OPTICS","hit_factor":2.7144},{"match_name":"LdF USPSA Classifier Match December 12 2020","match_date":"2020-12-12","stage_classifiercode":"20-01","member_number":"TY97709","first_name":"DAVID JR.","last_name":"DEZAN","classification":"U","division":"CARRY OPTICS","hit_factor":2.7128},{"match_name":"SKSC USPSA Oct 2021","match_date":"2021-10-16","stage_classifiercode":"20-01","member_number":"TY131082","first_name":"MICHELLE","last_name":"BAUER","classification":"C","division":"CARRY OPTICS","hit_factor":2.7108},{"match_name":"Moss Branch USPSA June match","match_date":"2021-06-26","stage_classifiercode":"20-01","member_number":"A129965","first_name":"BRADFORD","last_name":"BENTLEY","classification":"U","division":"CARRY OPTICS","hit_factor":2.706},{"match_name":"YMM  IPSC02 2021_01_10","match_date":"2021-01-10","stage_classifiercode":"20-01","member_number":"A127546","first_name":"MISSI","last_name":"LABISTRE","classification":"C","division":"CARRY OPTICS","hit_factor":2.6915},{"match_name":"CFRPC USPSA 2021-11-14","match_date":"2021-11-14","stage_classifiercode":"20-01","member_number":"A60772","first_name":"BOB","last_name":"PATTERSON","classification":"C","division":"CARRY OPTICS","hit_factor":2.6818},{"match_name":"BNA USPSA - July 25 2021 (Brothers N Arms)","match_date":"2021-07-25","stage_classifiercode":"20-01","member_number":"A134603","first_name":"BRAYDEN","last_name":"HERRINGTON","classification":"C","division":"CARRY OPTICS","hit_factor":2.6793},{"match_name":"Shasta Shooters 2021 Jan","match_date":"2021-01-09","stage_classifiercode":"20-01","member_number":"A104921","first_name":"PAUL","last_name":"JOHNSON","classification":"C","division":"CARRY OPTICS","hit_factor":2.677},{"match_name":"FBURG September 2021 USPSA","match_date":"2021-09-05","stage_classifiercode":"20-01","member_number":"A136224","first_name":"JOE","last_name":"VAN AUKEN","classification":"U","division":"CARRY OPTICS","hit_factor":2.6756},{"match_name":"Matamoras USPSA September 2021","match_date":"2021-09-19","stage_classifiercode":"20-01","member_number":"A135841","first_name":"ALEC","last_name":"SAUCHIK","classification":"U","division":"CARRY OPTICS","hit_factor":2.6679},{"match_name":"Oh Shoot -PRG Nov 27th - Uspsa Classifier Match","match_date":"2021-11-27","stage_classifiercode":"20-01","member_number":"TY123132","first_name":"COYLED","last_name":"COBRA COMMANDER","classification":"B","division":"CARRY OPTICS","hit_factor":2.6651},{"match_name":"SRSC USPSA 3-28-21 Superclassifier","match_date":"2021-03-28","stage_classifiercode":"20-01","member_number":"A112086","first_name":"TOM","last_name":"MARSH","classification":"U","division":"CARRY OPTICS","hit_factor":2.6619},{"match_name":"SPSA USPSA January 1st Sat Match","match_date":"2021-01-02","stage_classifiercode":"20-01","member_number":"TY106507","first_name":"KEITH","last_name":"NAGELSKI","classification":"C","division":"CARRY OPTICS","hit_factor":2.6612},{"match_name":"Wallis Orchard Practical Shooters April 2021 Club Match","match_date":"2021-04-18","stage_classifiercode":"20-01","member_number":"A132909","first_name":"HOPPER","last_name":"PO","classification":"U","division":"CARRY OPTICS","hit_factor":2.6598},{"match_name":"LdF USPSA Classifier Match December 12 2020","match_date":"2020-12-12","stage_classifiercode":"20-01","member_number":"A86401","first_name":"JOSEPH","last_name":"DEMATTIA","classification":"U","division":"CARRY OPTICS","hit_factor":2.6555},{"match_name":"Cactus USPSA ALL CLASSIFIER January 2021","match_date":"2021-01-03","stage_classifiercode":"20-01","member_number":"A132160","first_name":"EDUARDO","last_name":"AGUILAR","classification":"U","division":"CARRY OPTICS","hit_factor":2.6506},{"match_name":"5 Dogs December USPSA 2020","match_date":"2020-12-06","stage_classifiercode":"20-01","member_number":"X","first_name":"CLIFF","last_name":"VAN KOPP","classification":"U","division":"CARRY OPTICS","hit_factor":2.6465},{"match_name":"OPSC USPSA JUNE 2021","match_date":"2021-06-13","stage_classifiercode":"20-01","member_number":"TY67761","first_name":"PHILLIP","last_name":"PROIETTI","classification":"U","division":"CARRY OPTICS","hit_factor":2.646},{"match_name":"Medford USPSA Oct 2021 Match","match_date":"2021-10-17","stage_classifiercode":"20-01","member_number":"TY43784","first_name":"PHILLIP","last_name":"DODDRIDGE","classification":"U","division":"CARRY OPTICS","hit_factor":2.6436},{"match_name":"CIPSC IL02 Havana August USPSA","match_date":"2021-08-07","stage_classifiercode":"20-01","member_number":"TY99831","first_name":"JASON","last_name":"ANGLIN","classification":"A","division":"CARRY OPTICS","hit_factor":2.6201},{"match_name":"LIPSA  - March  21st  2021 - March Madness USPSA Match ","match_date":"2021-03-21","stage_classifiercode":"20-01","member_number":"A60235","first_name":"GLENN","last_name":"CHIN","classification":"U","division":"CARRY OPTICS","hit_factor":2.615},{"match_name":"Cowtown Pistol Club USPSA MONDAY November 1 2021","match_date":"2021-11-02","stage_classifiercode":"20-01","member_number":"A134470","first_name":"KERI","last_name":"HERDING","classification":"U","division":"CARRY OPTICS","hit_factor":2.611},{"match_name":"Matamoras USPSA September 2021","match_date":"2021-09-19","stage_classifiercode":"20-01","member_number":"A88322","first_name":"JEFF","last_name":"POLANIN","classification":"M","division":"CARRY OPTICS","hit_factor":2.6101},{"match_name":"Dundee Practical Shooters - Feb 27 2021","match_date":"2021-02-27","stage_classifiercode":"20-01","member_number":"A102894","first_name":"COBRA","last_name":"JACK","classification":"M","division":"CARRY OPTICS","hit_factor":2.5974},{"match_name":"Shasta Shooters 2021 June","match_date":"2021-06-12","stage_classifiercode":"20-01","member_number":"None","first_name":"JILLIAN","last_name":"MENOLD","classification":"U","division":"CARRY OPTICS","hit_factor":2.5961},{"match_name":"Cactus USPSA ALL CLASSIFIER January 2021","match_date":"2021-01-03","stage_classifiercode":"20-01","member_number":"A131804","first_name":"DIMITRY","last_name":"SHERMAN","classification":"U","division":"CARRY OPTICS","hit_factor":2.5624},{"match_name":"Hosemonster Action  ","match_date":"2021-01-17","stage_classifiercode":"20-01","member_number":"A128400","first_name":"TYLER","last_name":"ROWE","classification":"U","division":"CARRY OPTICS","hit_factor":2.5522},{"match_name":"Belton Gun Club USPSA March Classifier MATCH 3-7-21","match_date":"2021-03-07","stage_classifiercode":"20-01","member_number":"A125073","first_name":"TIM","last_name":"POTTER","classification":"U","division":"CARRY OPTICS","hit_factor":2.547},{"match_name":"Coastal Area Practical Shooters 10-23-21","match_date":"2021-10-23","stage_classifiercode":"20-01","member_number":"A137669","first_name":"LESLIE","last_name":"SUMNER","classification":"U","division":"CARRY OPTICS","hit_factor":2.536},{"match_name":"Richmond Hot Shots Aug 14-15-2021 USPSA","match_date":"2021-08-14","stage_classifiercode":"20-01","member_number":"fy80180","first_name":"WILLIAM","last_name":"KWOK","classification":"U","division":"CARRY OPTICS","hit_factor":2.5343},{"match_name":"VISSC The Final Countdown Part 2","match_date":"2021-01-17","stage_classifiercode":"20-01","member_number":"A130755","first_name":"HAROLD","last_name":"ALAMAR","classification":"U","division":"CARRY OPTICS","hit_factor":2.5034},{"match_name":"LNDL July 11th Classifier Match","match_date":"2021-07-11","stage_classifiercode":"20-01","member_number":"FY70390","first_name":"MEGHAN","last_name":"SMILEY","classification":"U","division":"CARRY OPTICS","hit_factor":2.5},{"match_name":"Chillicothe Sportsmens Club July USPSA","match_date":"2021-07-24","stage_classifiercode":"20-01","member_number":"A132112","first_name":"SHERI","last_name":"HENNESS","classification":"D","division":"CARRY OPTICS","hit_factor":2.4986},{"match_name":"CIPSC IL02 Havana August USPSA","match_date":"2021-08-07","stage_classifiercode":"20-01","member_number":"A132112","first_name":"SHERI","last_name":"HENNESS","classification":"D","division":"CARRY OPTICS","hit_factor":2.4965},{"match_name":"Pioneer Action Shooters USPSA 11-15-20","match_date":"2020-11-15","stage_classifiercode":"20-01","member_number":"A33626","first_name":"ED","last_name":"BOADWAY","classification":"B","division":"CARRY OPTICS","hit_factor":2.49},{"match_name":"Hosemonster Action  ","match_date":"2021-01-17","stage_classifiercode":"20-01","member_number":"A129398","first_name":"FERNANDO","last_name":"FLOREZ","classification":"U","division":"CARRY OPTICS","hit_factor":2.4665},{"match_name":"Richmond Hot Shots Aug 14-15-2021 USPSA","match_date":"2021-08-14","stage_classifiercode":"20-01","member_number":"A130935","first_name":"RAYMOND","last_name":"LIANG","classification":"D","division":"CARRY OPTICS","hit_factor":2.4645},{"match_name":"CCAS October 2021","match_date":"2021-10-16","stage_classifiercode":"20-01","member_number":"A130310","first_name":"RUBY","last_name":"DZIAMSKI","classification":"U","division":"CARRY OPTICS","hit_factor":2.462},{"match_name":"Chillicothe Sportsmens Club November USPSA","match_date":"2020-11-21","stage_classifiercode":"20-01","member_number":"TY104414","first_name":"STEVE","last_name":"EDGE","classification":"B","division":"CARRY OPTICS","hit_factor":2.4598},{"match_name":"LGCSEMPS April 2021 Special Classifier","match_date":"2021-04-11","stage_classifiercode":"20-01","member_number":"A131706","first_name":"MICHAEL","last_name":"ADAMS","classification":"U","division":"CARRY OPTICS","hit_factor":2.4442},{"match_name":"TPS USPSA at CMP Dec 19 2020 Special Classifier Match","match_date":"2020-12-19","stage_classifiercode":"20-01","member_number":"A128279","first_name":"JACK","last_name":"MCKEE","classification":"C","division":"CARRY OPTICS","hit_factor":2.439},{"match_name":"LIPSA  - March  21st  2021 - March Madness USPSA Match ","match_date":"2021-03-21","stage_classifiercode":"20-01","member_number":"TY121075","first_name":"LOU","last_name":"D'AGOSTINO","classification":"B","division":"CARRY OPTICS","hit_factor":2.4318},{"match_name":"ESPS  USPSA  March","match_date":"2021-03-27","stage_classifiercode":"20-01","member_number":"TY90681","first_name":"BARBARA","last_name":"BOYCE","classification":"C","division":"CARRY OPTICS","hit_factor":2.4122},{"match_name":"SPSA USPSA January 1st Sat Match","match_date":"2021-01-02","stage_classifiercode":"20-01","member_number":"A91937","first_name":"DAVID","last_name":"HARTLEY","classification":"A","division":"CARRY OPTICS","hit_factor":2.4109},{"match_name":"LdF USPSA Match November 7 2021","match_date":"2021-11-07","stage_classifiercode":"20-01","member_number":"FY27761","first_name":"LARRY","last_name":"CZOKA","classification":"B","division":"CARRY OPTICS","hit_factor":2.4107},{"match_name":"APSC USPSA 08-21-21","match_date":"2021-08-21","stage_classifiercode":"20-01","member_number":"TY79642","first_name":"SOPHIA","last_name":"PARAFINA","classification":"C","division":"CARRY OPTICS","hit_factor":2.407},{"match_name":"PIPS 04-28-2021","match_date":"2021-04-27","stage_classifiercode":"20-01","member_number":"A133283","first_name":"TUCKER","last_name":"PRETZER","classification":"U","division":"CARRY OPTICS","hit_factor":2.4066},{"match_name":"Qsc Test","match_date":"2021-07-08","stage_classifiercode":"20-01","member_number":"TY77177","first_name":"TIMOTHY","last_name":"HICHAK","classification":"U","division":"CARRY OPTICS","hit_factor":2.4},{"match_name":"BNA USPSA - July 25 2021 (Brothers N Arms)","match_date":"2021-07-25","stage_classifiercode":"20-01","member_number":"A135427","first_name":"GAVIN","last_name":"BARRETT","classification":"U","division":"CARRY OPTICS","hit_factor":2.3947},{"match_name":"YRPA USPSA May 2nd 2021","match_date":"2021-05-02","stage_classifiercode":"20-01","member_number":"A129295","first_name":"JON","last_name":"DAYTON","classification":"","division":"CARRY OPTICS","hit_factor":2.3697},{"match_name":"Payson Practical Shooters USPSA Dec 5  2020","match_date":"2020-12-05","stage_classifiercode":"20-01","member_number":"Ty96111","first_name":"EARL","last_name":"SMITH","classification":"D","division":"CARRY OPTICS","hit_factor":2.3678},{"match_name":"LdF USPSA Classifier Match December 12 2020","match_date":"2020-12-12","stage_classifiercode":"20-01","member_number":"A18725","first_name":"JIM","last_name":"MESSINA","classification":"U","division":"CARRY OPTICS","hit_factor":2.3658},{"match_name":"APSC USPSA 08-21-21","match_date":"2021-08-21","stage_classifiercode":"20-01","member_number":"TY84155","first_name":"DON","last_name":"DAHL","classification":"U","division":"CARRY OPTICS","hit_factor":2.3649},{"match_name":"TPS USPSA At CMP July 17 2021","match_date":"2021-07-17","stage_classifiercode":"20-01","member_number":"A132670","first_name":"MICHAEL","last_name":"TOKARSKY","classification":"U","division":"CARRY OPTICS","hit_factor":2.3618},{"match_name":"LIPSA  - March  21st  2021 - March Madness USPSA Match ","match_date":"2021-03-21","stage_classifiercode":"20-01","member_number":"A106866","first_name":"MIKHAIL","last_name":"OSTROV","classification":"U","division":"CARRY OPTICS","hit_factor":2.3577},{"match_name":"CAS March 2021","match_date":"2021-03-07","stage_classifiercode":"20-01","member_number":"A119557","first_name":"DONNA","last_name":"LAIRD","classification":"D","division":"CARRY OPTICS","hit_factor":2.3256},{"match_name":"DSSA 2021-02 USPSA Pistol","match_date":"2021-02-28","stage_classifiercode":"20-01","member_number":"A119557","first_name":"DONNA","last_name":"LAIRD","classification":"U","division":"CARRY OPTICS","hit_factor":2.3229},{"match_name":"Chillicothe Sportsmens Club July USPSA","match_date":"2021-07-24","stage_classifiercode":"20-01","member_number":"FY98887","first_name":"DAVID","last_name":"MANDROS","classification":"B","division":"CARRY OPTICS","hit_factor":2.3202},{"match_name":"Dundee Practical Shooters - Feb 27 2021","match_date":"2021-02-27","stage_classifiercode":"20-01","member_number":"TY122652","first_name":"SUSAN","last_name":"TONG","classification":"D","division":"CARRY OPTICS","hit_factor":2.301},{"match_name":"SCAPSA MN05 SPRING 6","match_date":"2021-05-18","stage_classifiercode":"20-01","member_number":"A111663","first_name":"JIM","last_name":"KRANTZ","classification":"M","division":"CARRY OPTICS","hit_factor":2.2956},{"match_name":"GCL Saturday 4-3-2021","match_date":"2021-04-03","stage_classifiercode":"20-01","member_number":"a120731","first_name":"TOM","last_name":"DIPIAZZA","classification":"D","division":"CARRY OPTICS","hit_factor":2.2915},{"match_name":"Hampden RPC November USPSA Match","match_date":"2020-11-08","stage_classifiercode":"20-01","member_number":"A127461","first_name":"MORGAN","last_name":"CALL","classification":"U","division":"CARRY OPTICS","hit_factor":2.2789},{"match_name":"Dundee Practical Shooters - Feb 27 2021","match_date":"2021-02-27","stage_classifiercode":"20-01","member_number":"Ty93092","first_name":"MARK","last_name":"CARLETON","classification":"D","division":"CARRY OPTICS","hit_factor":2.2717},{"match_name":"2020-12-05 USPSA  at Phoenix Rod and Gun Club","match_date":"2020-12-05","stage_classifiercode":"20-01","member_number":"A113291","first_name":"EMMA","last_name":"DOMINGUEZ","classification":"U","division":"CARRY OPTICS","hit_factor":2.2479},{"match_name":"DSSA 2021-02 USPSA Pistol","match_date":"2021-02-28","stage_classifiercode":"20-01","member_number":"A63240","first_name":"DON","last_name":"EVANS","classification":"C","division":"CARRY OPTICS","hit_factor":2.2355},{"match_name":"Richmond Hot Shots Aug 14-15-2021 USPSA","match_date":"2021-08-14","stage_classifiercode":"20-01","member_number":"A130650","first_name":"BRIAN","last_name":"LEE","classification":"C","division":"CARRY OPTICS","hit_factor":2.2343},{"match_name":"EAGC January 2021 USPSA Classifier Match","match_date":"2021-01-30","stage_classifiercode":"20-01","member_number":"A129745","first_name":"KYLE","last_name":"NUTTING","classification":"D","division":"CARRY OPTICS","hit_factor":2.2222},{"match_name":"EHPSA USPSA 26 September 2021","match_date":"2021-09-26","stage_classifiercode":"20-01","member_number":"L3174","first_name":"VINCENT","last_name":"LUCCHETTI","classification":"B","division":"CARRY OPTICS","hit_factor":2.2222},{"match_name":"CCPL 11-8-2020","match_date":"2020-11-08","stage_classifiercode":"20-01","member_number":"A130053","first_name":"HAL","last_name":"BILTZ","classification":"U","division":"CARRY OPTICS","hit_factor":2.2132},{"match_name":"FBURG September 2021 USPSA","match_date":"2021-09-05","stage_classifiercode":"20-01","member_number":"A83744","first_name":"SCOTT","last_name":"RADER","classification":"G","division":"CARRY OPTICS","hit_factor":2.2109},{"match_name":"17s PSC - USPSA - January 2021","match_date":"2021-01-16","stage_classifiercode":"20-01","member_number":"TY113003","first_name":"ROBERT","last_name":"PALUMBO","classification":"U","division":"CARRY OPTICS","hit_factor":2.1987},{"match_name":"PIPS 04-28-2021","match_date":"2021-04-27","stage_classifiercode":"20-01","member_number":"A110614","first_name":"JOSE","last_name":"BANZON","classification":"B","division":"CARRY OPTICS","hit_factor":2.1688},{"match_name":"APSC USPSA 08-21-21","match_date":"2021-08-21","stage_classifiercode":"20-01","member_number":"A107428","first_name":"BILL","last_name":"SHARAR","classification":"B","division":"CARRY OPTICS","hit_factor":2.1668},{"match_name":"MCRC USPSA March 2021","match_date":"2021-03-13","stage_classifiercode":"20-01","member_number":"TY4747","first_name":"MICHAEL","last_name":"WINGARD","classification":"U","division":"CARRY OPTICS","hit_factor":2.157},{"match_name":"RDS June 2021 USPSA Match","match_date":"2021-06-05","stage_classifiercode":"20-01","member_number":"Ty69614","first_name":"JIM","last_name":"WOODFORD","classification":"C","division":"CARRY OPTICS","hit_factor":2.1442},{"match_name":"Triforce Practical Shooters at Big Woods Goods 03-25-2021","match_date":"2021-03-25","stage_classifiercode":"20-01","member_number":"a114338","first_name":"CAMILLE","last_name":"BROWN","classification":"C","division":"CARRY OPTICS","hit_factor":2.109},{"match_name":"Belton Gun Club USPSA March Classifier MATCH 3-7-21","match_date":"2021-03-07","stage_classifiercode":"20-01","member_number":"a115214","first_name":"TODD","last_name":"HOLMES","classification":"C","division":"CARRY OPTICS","hit_factor":2.1043},{"match_name":"Shasta Shooters 2021 Jan","match_date":"2021-01-09","stage_classifiercode":"20-01","member_number":"A130550","first_name":"DARIN","last_name":"GASTON","classification":"C","division":"CARRY OPTICS","hit_factor":2.1006},{"match_name":"Sharp Practical Shooters September USPSA - Outdoor Classifier Match","match_date":"2021-09-25","stage_classifiercode":"20-01","member_number":"A101557","first_name":"CODY","last_name":"CALKINS","classification":"B","division":"CARRY OPTICS","hit_factor":2.0455},{"match_name":"EHPSA USPSA 26 September 2021","match_date":"2021-09-26","stage_classifiercode":"20-01","member_number":"A135768","first_name":"MELVIN","last_name":"TROUT","classification":"C","division":"CARRY OPTICS","hit_factor":2.027},{"match_name":"PIPS 04-28-2021","match_date":"2021-04-27","stage_classifiercode":"20-01","member_number":"TY107053","first_name":"ED","last_name":"RAJEK","classification":"D","division":"CARRY OPTICS","hit_factor":2.0197},{"match_name":"LdF USPSA Classifier Match December 12 2020","match_date":"2020-12-12","stage_classifiercode":"20-01","member_number":"A81018","first_name":"BART","last_name":"DEL RIO","classification":"U","division":"CARRY OPTICS","hit_factor":2.0161},{"match_name":"Pioneer Action Shooters USPSA 11-15-20","match_date":"2020-11-15","stage_classifiercode":"20-01","member_number":"A92498","first_name":"BILL","last_name":"MARTIN","classification":"D","division":"CARRY OPTICS","hit_factor":2.0093},{"match_name":"Shongum May 2021 USPSA Match","match_date":"2021-05-01","stage_classifiercode":"20-01","member_number":"A81786","first_name":"DONALD","last_name":"CAMPBELL","classification":"X","division":"CARRY OPTICS","hit_factor":2.0067},{"match_name":"Dundee Practical Shooters - Feb 27 2021","match_date":"2021-02-27","stage_classifiercode":"20-01","member_number":"A59547","first_name":"STEVE","last_name":"KENDELL","classification":"C","division":"CARRY OPTICS","hit_factor":2.0036},{"match_name":"CCAS September 2021","match_date":"2021-09-18","stage_classifiercode":"20-01","member_number":"A130310","first_name":"RUBY","last_name":"DZIAMSKI","classification":"U","division":"CARRY OPTICS","hit_factor":1.9767},{"match_name":"PIPS 04-28-2021","match_date":"2021-04-27","stage_classifiercode":"20-01","member_number":"A97349","first_name":"JONATHAN","last_name":"KOTEK","classification":"D","division":"CARRY OPTICS","hit_factor":1.941},{"match_name":"Mesilla Valley P September 2021 classifier match","match_date":"2021-09-04","stage_classifiercode":"20-01","member_number":"A101283","first_name":"HOWARD","last_name":"COTHERN","classification":"U","division":"CARRY OPTICS","hit_factor":1.9321},{"match_name":"YMM  IPSC02 2021_01_10","match_date":"2021-01-10","stage_classifiercode":"20-01","member_number":"TY109086","first_name":"ELAINE","last_name":"AGEE","classification":"U","division":"CARRY OPTICS","hit_factor":1.9197},{"match_name":"CCPL 11-8-2020","match_date":"2020-11-08","stage_classifiercode":"20-01","member_number":"FY7035","first_name":"BILL","last_name":"LUPER","classification":"U","division":"CARRY OPTICS","hit_factor":1.9194},{"match_name":"LdF USPSA Classifier Match December 12 2020","match_date":"2020-12-12","stage_classifiercode":"20-01","member_number":"FY76199","first_name":"BRION","last_name":"THOMAS","classification":"U","division":"CARRY OPTICS","hit_factor":1.8911},{"match_name":"Hampden RPC November USPSA Match","match_date":"2020-11-08","stage_classifiercode":"20-01","member_number":"A126909","first_name":"STACEY","last_name":"MODRUSAN","classification":"D","division":"CARRY OPTICS","hit_factor":1.8837},{"match_name":"LdF USPSA Classifier Match December 12 2020","match_date":"2020-12-12","stage_classifiercode":"20-01","member_number":"A92544","first_name":"DEBBIE","last_name":"PAPS","classification":"U","division":"CARRY OPTICS","hit_factor":1.8733},{"match_name":"Extreme GM uspsa Nov-13","match_date":"2021-11-13","stage_classifiercode":"20-01","member_number":"A90126","first_name":"TOM","last_name":"BURZYNSKI","classification":"U","division":"CARRY OPTICS","hit_factor":1.8622},{"match_name":"Shasta Shooters 2021 June","match_date":"2021-06-12","stage_classifiercode":"20-01","member_number":"TY116293","first_name":"DENNIS","last_name":"CHURCHILL","classification":"U","division":"CARRY OPTICS","hit_factor":1.8554},{"match_name":"KSA USPSA  3 April 2021","match_date":"2021-04-03","stage_classifiercode":"20-01","member_number":"Ty127907","first_name":"MIKE","last_name":"BROWN","classification":"D","division":"CARRY OPTICS","hit_factor":1.8425},{"match_name":"MCRC USPSA March 2021","match_date":"2021-03-13","stage_classifiercode":"20-01","member_number":"A125073","first_name":"TIM","last_name":"POTTER","classification":"C","division":"CARRY OPTICS","hit_factor":1.8196},{"match_name":"RBGC USPSA 2021-01-23","match_date":"2021-01-23","stage_classifiercode":"20-01","member_number":"A128215","first_name":"SCOTT","last_name":"HAUSWIRTH","classification":"C","division":"CARRY OPTICS","hit_factor":1.8182},{"match_name":"Ontelaunee USPSA November 2020","match_date":"2020-11-20","stage_classifiercode":"20-01","member_number":"A114924","first_name":"CONNIE","last_name":"RODENBERG","classification":"U","division":"CARRY OPTICS","hit_factor":1.7909},{"match_name":"TPS USPSA -  January Match 2021 Rescheduled","match_date":"2021-01-03","stage_classifiercode":"20-01","member_number":"TY65263","first_name":"GLENN","last_name":"MILLER","classification":"U","division":"CARRY OPTICS","hit_factor":1.785},{"match_name":"Collin County USPSA  08-22-2021","match_date":"2021-08-22","stage_classifiercode":"20-01","member_number":"A130360","first_name":"PAUL","last_name":"BOLTON","classification":"C","division":"CARRY OPTICS","hit_factor":1.7845},{"match_name":"PMRPC USPSA 12Dec20 - all Classifier","match_date":"2020-12-12","stage_classifiercode":"20-01","member_number":"A19050","first_name":"TYLER","last_name":"KEISER","classification":"C","division":"CARRY OPTICS","hit_factor":1.7843},{"match_name":"SCPS ECO19 January 23rd 2021","match_date":"2021-01-22","stage_classifiercode":"20-01","member_number":"A123173","first_name":"ROBERT","last_name":"BENNETT","classification":"C","division":"CARRY OPTICS","hit_factor":1.7794},{"match_name":"Shasta Shooters 2021 June","match_date":"2021-06-12","stage_classifiercode":"20-01","member_number":"A133301","first_name":"CECILIA","last_name":"COSTA","classification":"U","division":"CARRY OPTICS","hit_factor":1.7776},{"match_name":"2020-12-05 USPSA  at Phoenix Rod and Gun Club","match_date":"2020-12-05","stage_classifiercode":"20-01","member_number":"A61982","first_name":"ROBERT","last_name":"PICKERING","classification":"C","division":"CARRY OPTICS","hit_factor":1.7459},{"match_name":"MCTS -  USPSA March 2021 Classifier Match","match_date":"2021-03-21","stage_classifiercode":"20-01","member_number":"TY53337","first_name":"STEVEN","last_name":"HOFNER","classification":"U","division":"CARRY OPTICS","hit_factor":1.7007},{"match_name":"RBGC USPSA 2021-01-23","match_date":"2021-01-23","stage_classifiercode":"20-01","member_number":"A114338","first_name":"CAMILLE","last_name":"BROWN","classification":"C","division":"CARRY OPTICS","hit_factor":1.6992},{"match_name":"FBURG September 2021 USPSA","match_date":"2021-09-05","stage_classifiercode":"20-01","member_number":"A123188","first_name":"SIMON","last_name":"ZHENG","classification":"C","division":"CARRY OPTICS","hit_factor":1.6935},{"match_name":"CCPS July 2021 USPSA","match_date":"2021-07-04","stage_classifiercode":"20-01","member_number":"A130667","first_name":"DENISE","last_name":"DEHAEMERS","classification":"U","division":"CARRY OPTICS","hit_factor":1.68},{"match_name":"2020-12-05 USPSA  at Phoenix Rod and Gun Club","match_date":"2020-12-05","stage_classifiercode":"20-01","member_number":"A131779","first_name":"SCOTT","last_name":"ROWE","classification":"U","division":"CARRY OPTICS","hit_factor":1.6575},{"match_name":"Medford USPSA Oct 2021 Match","match_date":"2021-10-17","stage_classifiercode":"20-01","member_number":"A125786","first_name":"MEGHAN","last_name":"MORA","classification":"C","division":"CARRY OPTICS","hit_factor":1.6515},{"match_name":"APSC USPSA 11-7-20","match_date":"2020-11-07","stage_classifiercode":"20-01","member_number":"TY84155","first_name":"DON","last_name":"DAHL","classification":"C","division":"CARRY OPTICS","hit_factor":1.6471},{"match_name":"Harvard Action Shooters May 2021 USPSA Pistol Match","match_date":"2021-05-02","stage_classifiercode":"20-01","member_number":"A129783","first_name":"JESSICA","last_name":"ZAKRAJSEK","classification":"U","division":"CARRY OPTICS","hit_factor":1.6464},{"match_name":"D.I.D -ShootOut!- 9-21-21","match_date":"2021-09-21","stage_classifiercode":"20-01","member_number":"a126483","first_name":"GARY.22","last_name":"SCHUBERT.22","classification":"U","division":"CARRY OPTICS","hit_factor":1.6362},{"match_name":"SFPS 5-16-21 Super Classifier","match_date":"2021-05-16","stage_classifiercode":"20-01","member_number":"A50695","first_name":"TIMOTHY","last_name":"THOMAS","classification":"B","division":"CARRY OPTICS","hit_factor":1.6129},{"match_name":"SKSC USPSA Oct 2021","match_date":"2021-10-16","stage_classifiercode":"20-01","member_number":"TY98976","first_name":"JUDY","last_name":"WORDEN","classification":"C","division":"CARRY OPTICS","hit_factor":1.5952},{"match_name":"BORCC USPSA April 2021","match_date":"2021-04-17","stage_classifiercode":"20-01","member_number":"A101591","first_name":"DANIELA","last_name":"DIBENNARDI","classification":"C","division":"CARRY OPTICS","hit_factor":1.5514},{"match_name":"Oh Shoot -PRG Nov 27th - Uspsa Classifier Match","match_date":"2021-11-27","stage_classifiercode":"20-01","member_number":"A121704","first_name":"GARY","last_name":"SZE","classification":"U","division":"CARRY OPTICS","hit_factor":1.5174},{"match_name":"TTS USPSA Match 12JUN2021","match_date":"2021-06-12","stage_classifiercode":"20-01","member_number":"A100318","first_name":"JAMES JIMO","last_name":"O'FLAHERTY","classification":"B","division":"CARRY OPTICS","hit_factor":1.4493},{"match_name":"EWPSA 2021-04","match_date":"2021-04-17","stage_classifiercode":"20-01","member_number":"A111027","first_name":"RYAN","last_name":"BLOSSER","classification":"C","division":"CARRY OPTICS","hit_factor":1.4286},{"match_name":"Oh Shoot -PRG Nov 27th - Uspsa Classifier Match","match_date":"2021-11-27","stage_classifiercode":"20-01","member_number":"A100824","first_name":"JOHN","last_name":"KOPP","classification":"U","division":"CARRY OPTICS","hit_factor":1.3961},{"match_name":"PIPS 04-28-2021","match_date":"2021-04-27","stage_classifiercode":"20-01","member_number":"FY51432","first_name":"FRANK","last_name":"SKOG","classification":"U","division":"CARRY OPTICS","hit_factor":1.3068},{"match_name":"YRPA USPSA May 2nd 2021","match_date":"2021-05-02","stage_classifiercode":"20-01","member_number":"A47658","first_name":"THILO","last_name":"NEUBERT","classification":"C","division":"CARRY OPTICS","hit_factor":1.3015},{"match_name":"Richmond Boro Gun Club Monthly USPSA Match May 2021","match_date":"2021-05-08","stage_classifiercode":"20-01","member_number":"TY92021","first_name":"PETER","last_name":"CRISTALLI","classification":"D","division":"CARRY OPTICS","hit_factor":1.2326},{"match_name":"Dundee Practical Shooters - Feb 27 2021","match_date":"2021-02-27","stage_classifiercode":"20-01","member_number":"A132462","first_name":"DALE","last_name":"DANIELS","classification":"U","division":"CARRY OPTICS","hit_factor":1.2295},{"match_name":"GCL Saturday 4-3-2021","match_date":"2021-04-03","stage_classifiercode":"20-01","member_number":"A120516","first_name":"JEFFREY","last_name":"COLEGROVE","classification":"C","division":"CARRY OPTICS","hit_factor":1.107},{"match_name":"ENPS September 2021 USPSA Match","match_date":"2021-09-04","stage_classifiercode":"20-01","member_number":"TY116922","first_name":"TYLER","last_name":"ANDERSON","classification":"C","division":"CARRY OPTICS","hit_factor":1.0982},{"match_name":"SCAPSA MN05 SPRING 6","match_date":"2021-05-18","stage_classifiercode":"20-01","member_number":"FY95574","first_name":"CHARLES","last_name":"KIM","classification":"M","division":"CARRY OPTICS","hit_factor":1.0972},{"match_name":"OK06-30OCT21-SCRP-USPSA","match_date":"2021-10-30","stage_classifiercode":"20-01","member_number":"A121525","first_name":"NANCY","last_name":"GOODELL","classification":"D","division":"CARRY OPTICS","hit_factor":1.0717},{"match_name":"RBGC USPSA 2021-8-15 Special Classifier Match","match_date":"2021-08-15","stage_classifiercode":"20-01","member_number":"TY117499","first_name":"SCOTT","last_name":"FANN","classification":"B","division":"CARRY OPTICS","hit_factor":1.0601},{"match_name":"LdF USPSA Classifier Match December 12 2020","match_date":"2020-12-12","stage_classifiercode":"20-01","member_number":"A131866","first_name":"NIC","last_name":"CHEUNG","classification":"U","division":"CARRY OPTICS","hit_factor":1.0545},{"match_name":"GAS MAY 2021 USPSA","match_date":"2021-05-01","stage_classifiercode":"20-01","member_number":"A18993","first_name":"JERRY","last_name":"FRANCISCO","classification":"C","division":"CARRY OPTICS","hit_factor":1.0383},{"match_name":"EWPSA 2021-04","match_date":"2021-04-17","stage_classifiercode":"20-01","member_number":"A132016","first_name":"MEGAN","last_name":"PHELPS","classification":"U","division":"CARRY OPTICS","hit_factor":1.0033},{"match_name":"Matamoras USPSA September 2021","match_date":"2021-09-19","stage_classifiercode":"20-01","member_number":"A112589","first_name":"BILL","last_name":"MAYHEW","classification":"U","division":"CARRY OPTICS","hit_factor":0.9971},{"match_name":"WLPS May 2021 ALL USPSA Classifier Match ","match_date":"2021-05-23","stage_classifiercode":"20-01","member_number":"A134665","first_name":"JETT","last_name":"BLACK","classification":"U","division":"CARRY OPTICS","hit_factor":0.9021},{"match_name":"EHPSA USPSA 26 September 2021","match_date":"2021-09-26","stage_classifiercode":"20-01","member_number":"TY118278","first_name":"ANTHONY","last_name":"VENDITTI","classification":"B","division":"CARRY OPTICS","hit_factor":0.6494},{"match_name":"Hosemonster Action  ","match_date":"2021-01-17","stage_classifiercode":"20-01","member_number":"TY130594","first_name":"DOMINIC","last_name":"SELF","classification":"U","division":"CARRY OPTICS","hit_factor":0.6366},{"match_name":"5 Dogs December USPSA 2020","match_date":"2020-12-06","stage_classifiercode":"20-01","member_number":"A120733","first_name":"TIMOTHY","last_name":"BALDWIN","classification":"U","division":"CARRY OPTICS","hit_factor":0.6211},{"match_name":"ESPS  USPSA  March","match_date":"2021-03-27","stage_classifiercode":"20-01","member_number":"TY71675","first_name":"JEFF","last_name":"VANCE","classification":"U","division":"CARRY OPTICS","hit_factor":0.5501},{"match_name":"Richmond Hot Shots Aug 14-15-2021 USPSA","match_date":"2021-08-14","stage_classifiercode":"20-01","member_number":"A114315","first_name":"B. JAMES","last_name":"YEN","classification":"C","division":"CARRY OPTICS","hit_factor":0.4981},{"match_name":"ESPS  USPSA  March","match_date":"2021-03-27","stage_classifiercode":"20-01","member_number":"A118306","first_name":"WILL","last_name":"SALO","classification":"B","division":"CARRY OPTICS","hit_factor":0.484},{"match_name":"LPRGC- Lower Providence USPSA Nov 2020 Match","match_date":"2020-11-07","stage_classifiercode":"20-01","member_number":"A130240","first_name":"NORMAN","last_name":"COFFEY","classification":"U","division":"CARRY OPTICS","hit_factor":0.4642},{"match_name":"SWGC USPSA Pistol Match - May 2021","match_date":"2021-05-01","stage_classifiercode":"20-01","member_number":"A133096","first_name":"DAVE","last_name":"RUSHING","classification":"U","division":"CARRY OPTICS","hit_factor":0.3653},{"match_name":"Richmond Hot Shots Aug 14-15-2021 USPSA","match_date":"2021-08-14","stage_classifiercode":"20-01","member_number":"TY88856","first_name":"JOE","last_name":"OLIVERI","classification":"B","division":"CARRY OPTICS","hit_factor":0.3021},{"match_name":"Ontelaunee USPSA November 2020","match_date":"2020-11-20","stage_classifiercode":"20-01","member_number":"TY82583","first_name":"MICHAEL","last_name":"CHEN","classification":"B","division":"CARRY OPTICS","hit_factor":0.291}]