[{"match_name":"Pelham USPSA 2017-08-20","match_date":"2017-08-20","stage_classifiercode":"99-16","member_number":"TY81222","first_name":"MASON","last_name":"LANE","classification":"G","division":"LIMITED","hit_factor":10.2837},{"match_name":"PCWC USPSA  1 28 17","match_date":"2017-01-28","stage_classifiercode":"99-16","member_number":"L3329","first_name":"CHAD","last_name":"THOMPSON","classification":"G","division":"LIMITED","hit_factor":9.6828},{"match_name":"SPSA USPSA June 1st Sat Match","match_date":"2021-06-05","stage_classifiercode":"99-16","member_number":"A100099","first_name":"TYLER","last_name":"MEISENHEIMER","classification":"A","division":"LIMITED","hit_factor":9.4637},{"match_name":"SWGC USPSA Pistol Match - December","match_date":"2016-12-03","stage_classifiercode":"99-16","member_number":"A57152","first_name":"GARY","last_name":"BYERLY","classification":"A","division":"LIMITED","hit_factor":9.4215},{"match_name":"FLPSA MN14 USPSA May 17 2018","match_date":"2018-05-17","stage_classifiercode":"99-16","member_number":"A68543","first_name":"BRIAN","last_name":"HANSEN","classification":"M","division":"LIMITED","hit_factor":9.4178},{"match_name":"FLPSA MN14 USPSA May 17 2018","match_date":"2018-05-17","stage_classifiercode":"99-16","member_number":"A86548","first_name":"JOSHUA","last_name":"EERNISSE","classification":"M","division":"LIMITED","hit_factor":9.3489},{"match_name":"OK15 USPSA at USSA","match_date":"2016-12-11","stage_classifiercode":"99-16","member_number":"TY68934","first_name":"TIM","last_name":"HERRON","classification":"M","division":"LIMITED","hit_factor":9.3489},{"match_name":"Emmett March Match","match_date":"2016-03-25","stage_classifiercode":"99-16","member_number":"a68939","first_name":"MATT","last_name":"EVANCIC","classification":"M","division":"LIMITED","hit_factor":9.2869},{"match_name":"OK15 USPSA at USSA","match_date":"2016-12-11","stage_classifiercode":"99-16","member_number":"A64463","first_name":"CHAD","last_name":"STANTON","classification":"A","division":"LIMITED","hit_factor":9.28},{"match_name":"MCPSL Pistol 10-9-2021","match_date":"2021-10-09","stage_classifiercode":"99-16","member_number":"FY110979","first_name":"JACK","last_name":"BROWN","classification":"M","division":"LIMITED","hit_factor":9.2357},{"match_name":"MVPSA USPSA 7-7-18","match_date":"2018-07-07","stage_classifiercode":"99-16","member_number":"A84593","first_name":"JESSE","last_name":"POSELEY","classification":"A","division":"LIMITED","hit_factor":9.2127},{"match_name":"MCPSL Pistol 10-9-2021","match_date":"2021-10-09","stage_classifiercode":"99-16","member_number":"A98829","first_name":"ALEXIS","last_name":"PENA","classification":"M","division":"LIMITED","hit_factor":9.1993},{"match_name":"EWPSA 2018-09","match_date":"2018-09-16","stage_classifiercode":"99-16","member_number":"TY49461","first_name":"DAVID","last_name":"BLOSSER","classification":"G","division":"LIMITED","hit_factor":9.0253},{"match_name":"Idaho ISPS August 5th Break from the Heat","match_date":"2017-08-05","stage_classifiercode":"99-16","member_number":"TY84532","first_name":"KENNY","last_name":"PLATT","classification":"G","division":"LIMITED","hit_factor":8.9888},{"match_name":"OK15 USPSA at USSA","match_date":"2016-12-11","stage_classifiercode":"99-16","member_number":"A90516","first_name":"JARED","last_name":"FOX","classification":"A","division":"LIMITED","hit_factor":8.9764},{"match_name":"SPSA USPSA July 4th Sat match","match_date":"2018-07-28","stage_classifiercode":"99-16","member_number":"TY53092","first_name":"DEWEY","last_name":"HUTSON","classification":"M","division":"LIMITED","hit_factor":8.8091},{"match_name":"Shasta Shooters 2020 Dec","match_date":"2020-12-12","stage_classifiercode":"99-16","member_number":"A96344","first_name":"RON","last_name":"HILDEBRANT","classification":"M","division":"LIMITED","hit_factor":8.7774},{"match_name":"SRAPS Amarillo Action May","match_date":"2016-05-28","stage_classifiercode":"99-16","member_number":"A69716","first_name":"JEREMY","last_name":"REID","classification":"M","division":"LIMITED","hit_factor":8.7379},{"match_name":"MS06 Team Magnolia USPSA January Match2","match_date":"2016-01-03","stage_classifiercode":"99-16","member_number":"A77712","first_name":"STEVEN","last_name":"SANDERS","classification":"G","division":"LIMITED","hit_factor":8.6553},{"match_name":"EWPSA 2018-09","match_date":"2018-09-16","stage_classifiercode":"99-16","member_number":"A69094","first_name":"AARON","last_name":"LAWS","classification":"M","division":"LIMITED","hit_factor":8.6495},{"match_name":"Grandbaggers 07/2017","match_date":"2017-07-06","stage_classifiercode":"99-16","member_number":"L3902","first_name":"ALEXANDER","last_name":"VALENTINE","classification":"U","division":"LIMITED","hit_factor":8.5672},{"match_name":"RBGC 2017-10-21","match_date":"2017-10-21","stage_classifiercode":"99-16","member_number":"A98278","first_name":"JACK","last_name":"WINDES","classification":"M","division":"LIMITED","hit_factor":8.5627},{"match_name":"Laser Ninja Dragon League MSA USPSA January 8th 2017","match_date":"2017-01-08","stage_classifiercode":"99-16","member_number":"A91005","first_name":"PRESTON","last_name":"CLARK","classification":"M","division":"LIMITED","hit_factor":8.5202},{"match_name":"TPS USPSA -  January 2017 - Talon Range","match_date":"2017-01-07","stage_classifiercode":"99-16","member_number":"FY42749","first_name":"KEVIN","last_name":"BRADSHAW","classification":"M","division":"LIMITED","hit_factor":8.4211},{"match_name":"EWPSA 2018-09","match_date":"2018-09-16","stage_classifiercode":"99-16","member_number":"TY76664","first_name":"JEFF","last_name":"WEAVER","classification":"M","division":"LIMITED","hit_factor":8.3958},{"match_name":"Hosemasters 2nd Sunday May 2017","match_date":"2017-05-14","stage_classifiercode":"99-16","member_number":"L2568","first_name":"JAMES","last_name":"NORTZ","classification":"G","division":"LIMITED","hit_factor":8.3333},{"match_name":"AIPS Weekly USPSA 3 August 2021","match_date":"2021-08-03","stage_classifiercode":"99-16","member_number":"A103331","first_name":"ROSS","last_name":"WOODFORD","classification":"M","division":"LIMITED","hit_factor":8.3077},{"match_name":"Maine Practical Shooters May 2017","match_date":"2017-05-13","stage_classifiercode":"99-16","member_number":"A56213","first_name":"JOE","last_name":"DEBIASE","classification":"M","division":"LIMITED","hit_factor":8.2865},{"match_name":"CRC_20160514_SuperClassifier","match_date":"2016-05-14","stage_classifiercode":"99-16","member_number":"FY26112","first_name":"RW","last_name":"SWAINSON","classification":"M","division":"LIMITED","hit_factor":8.2729},{"match_name":"PCWC USPSA  1 28 17","match_date":"2017-01-28","stage_classifiercode":"99-16","member_number":"L4114","first_name":"JEFF","last_name":"SMITH","classification":"A","division":"LIMITED","hit_factor":8.2037},{"match_name":"CRC_20160514_SuperClassifier","match_date":"2016-05-14","stage_classifiercode":"99-16","member_number":"FY26112","first_name":"RW","last_name":"SWAINSON","classification":"M","division":"LIMITED","hit_factor":8.2037},{"match_name":"RCPS USPSA 12 Nov 2016","match_date":"2016-11-12","stage_classifiercode":"99-16","member_number":"A87604","first_name":"ETHAN","last_name":"HOWELL","classification":"A","division":"LIMITED","hit_factor":8.1717},{"match_name":"PCWC USPSA  1 28 17","match_date":"2017-01-28","stage_classifiercode":"99-16","member_number":"ty33365","first_name":"KERT","last_name":"GASKILL","classification":"G","division":"LIMITED","hit_factor":8.1081},{"match_name":"CCPL 2 Day Match 2018","match_date":"2018-04-26","stage_classifiercode":"99-16","member_number":"TY96532","first_name":"ALLAN","last_name":"WEBSTER","classification":"A","division":"LIMITED","hit_factor":8.1037},{"match_name":"LdF USPSA Match September 23 2017","match_date":"2017-09-23","stage_classifiercode":"99-16","member_number":"A69003","first_name":"JOHN","last_name":"WOOLFREY","classification":"A","division":"LIMITED","hit_factor":8.0925},{"match_name":"PCWC USPSA  1 28 17","match_date":"2017-01-28","stage_classifiercode":"99-16","member_number":"L729","first_name":"ROBERT","last_name":"WALKER","classification":"M","division":"LIMITED","hit_factor":8.0668},{"match_name":"Shadow Hawk Defense USPSA Special Classifier","match_date":"2020-11-14","stage_classifiercode":"99-16","member_number":"A93612","first_name":"PAUL","last_name":"RANDAZZO","classification":"B","division":"LIMITED","hit_factor":8.0622},{"match_name":"MS06 Team Magnolia USPSA January Match2","match_date":"2016-01-03","stage_classifiercode":"99-16","member_number":"A74057","first_name":"JAMIE","last_name":"PRICE","classification":"U","division":"LIMITED","hit_factor":8.0229},{"match_name":"Sharp Practical Shooters May USPSA Match","match_date":"2018-05-27","stage_classifiercode":"99-16","member_number":"\"\"","first_name":"CHRIS","last_name":"TRIPPLET","classification":"U","division":"LIMITED","hit_factor":7.9838},{"match_name":"Briar Rabbit  June Match 2016 OH 20","match_date":"2016-06-12","stage_classifiercode":"99-16","member_number":"A72557","first_name":"RYAN","last_name":"LEAS","classification":"A","division":"LIMITED","hit_factor":7.9387},{"match_name":"ENPS March 2017 USPSA Match","match_date":"2017-03-05","stage_classifiercode":"99-16","member_number":"TY61813","first_name":"TOM","last_name":"ENGEL","classification":"A","division":"LIMITED","hit_factor":7.9251},{"match_name":"USPSA MO21 Special Classifier 2Alpha SBRC February 27 2021","match_date":"2021-02-27","stage_classifiercode":"99-16","member_number":"TY86706","first_name":"CHRIS","last_name":"DEWEY","classification":"B","division":"LIMITED","hit_factor":7.8762},{"match_name":"CCPL 02-09-2020","match_date":"2020-02-09","stage_classifiercode":"99-16","member_number":"A109094","first_name":"TONY","last_name":"LUNA","classification":"B","division":"LIMITED","hit_factor":7.8212},{"match_name":"SPSA USPSA December 1st Sat Match","match_date":"2016-12-03","stage_classifiercode":"99-16","member_number":"TY3777","first_name":"MIKE","last_name":"MORRIS","classification":"A","division":"LIMITED","hit_factor":7.7886},{"match_name":"Shadow Hawk Defense USPSA Special Classifier","match_date":"2020-11-14","stage_classifiercode":"99-16","member_number":"TY88820","first_name":"DARIN","last_name":"MORRELL","classification":"B","division":"LIMITED","hit_factor":7.7793},{"match_name":"LdF USPSA Match September 23 2017","match_date":"2017-09-23","stage_classifiercode":"99-16","member_number":"A78063","first_name":"MIKE","last_name":"PAPS","classification":"B","division":"LIMITED","hit_factor":7.7763},{"match_name":"RCPS USPSA 12 Nov 2016","match_date":"2016-11-12","stage_classifiercode":"99-16","member_number":"A54880","first_name":"STEFAN","last_name":"WIGGINS","classification":"X","division":"LIMITED","hit_factor":7.754},{"match_name":"SWGC USPSA Pistol Match - December","match_date":"2016-12-03","stage_classifiercode":"99-16","member_number":"L3329","first_name":"CHAD","last_name":"THOMPSON","classification":"G","division":"LIMITED","hit_factor":7.7455},{"match_name":"Sharp Practical Shooters May USPSA Match","match_date":"2018-05-27","stage_classifiercode":"99-16","member_number":"A87751","first_name":"DYLAN","last_name":"ERVIN","classification":"M","division":"LIMITED","hit_factor":7.7295},{"match_name":"WLPS June 2017","match_date":"2017-06-25","stage_classifiercode":"99-16","member_number":"A98611","first_name":"JEREMY","last_name":"DUVEL","classification":"U","division":"LIMITED","hit_factor":7.7135},{"match_name":"SPSA USPSA December 1st Sat Match","match_date":"2016-12-03","stage_classifiercode":"99-16","member_number":"A87032","first_name":"TRE","last_name":"ROACH","classification":"B","division":"LIMITED","hit_factor":7.7033},{"match_name":"LdF USPSA Match September 23 2017","match_date":"2017-09-23","stage_classifiercode":"99-16","member_number":"TY80157","first_name":"DAVE","last_name":"DEZAN","classification":"M","division":"LIMITED","hit_factor":7.6823},{"match_name":"PRG-USPSA - Oh Shoot January 3rd - 1st Sunday","match_date":"2021-01-03","stage_classifiercode":"99-16","member_number":"ty102539","first_name":"THOMAS","last_name":"MILLER","classification":"C","division":"LIMITED","hit_factor":7.6818},{"match_name":"West Liberty USPSA Oct 2018","match_date":"2018-10-28","stage_classifiercode":"99-16","member_number":"A47064","first_name":"BOB","last_name":"JENSEN","classification":"A","division":"LIMITED","hit_factor":7.6816},{"match_name":"CCPL 2 Day Match 2018","match_date":"2018-04-26","stage_classifiercode":"99-16","member_number":"TY44130","first_name":"SEBASTIAO","last_name":"FILHO","classification":"G","division":"LIMITED","hit_factor":7.68},{"match_name":"Shadow Hawk Defense USPSA Special Classifier","match_date":"2020-11-14","stage_classifiercode":"99-16","member_number":"FY88229","first_name":"BEN","last_name":"FECK","classification":"B","division":"LIMITED","hit_factor":7.67},{"match_name":"SPSA USPSA July 4th Sat match","match_date":"2018-07-28","stage_classifiercode":"99-16","member_number":"A100440","first_name":"LUKE","last_name":"CROOP","classification":"A","division":"LIMITED","hit_factor":7.6487},{"match_name":"BSPSC 2018 August Special Classifier","match_date":"2018-08-12","stage_classifiercode":"99-16","member_number":"A96355","first_name":"BRENNAN","last_name":"RICHARDSON","classification":"B","division":"LIMITED","hit_factor":7.6416},{"match_name":"LdF USPSA Match September 23 2017","match_date":"2017-09-23","stage_classifiercode":"99-16","member_number":"A93090","first_name":"RICHARD","last_name":"EZELL","classification":"A","division":"LIMITED","hit_factor":7.6305},{"match_name":"Shadow Hawk Defense USPSA Special Classifier","match_date":"2020-11-14","stage_classifiercode":"99-16","member_number":"A119732","first_name":"BRIAN","last_name":"MOONEY","classification":"B","division":"LIMITED","hit_factor":7.6283},{"match_name":"CCPS March 2018 USPSA","match_date":"2018-03-18","stage_classifiercode":"99-16","member_number":"A100933","first_name":"RON","last_name":"PATERSON","classification":"B","division":"LIMITED","hit_factor":7.619},{"match_name":"Pima Pistol Club USPSA Match - May 29 ","match_date":"2016-05-29","stage_classifiercode":"99-16","member_number":"\"\"","first_name":"RICK","last_name":"PERAZA","classification":"U","division":"LIMITED","hit_factor":7.607},{"match_name":"USPSA MO21 Special Classifier 2Alpha SBRC February 27 2021","match_date":"2021-02-27","stage_classifiercode":"99-16","member_number":"TY78370","first_name":"JAMES","last_name":"CHOATE","classification":"B","division":"LIMITED","hit_factor":7.563},{"match_name":"USPSA MO21 Special Classifier 2Alpha SBRC February 27 2021","match_date":"2021-02-27","stage_classifiercode":"99-16","member_number":"TY49960","first_name":"SHANE","last_name":"RICHARDS","classification":"B","division":"LIMITED","hit_factor":7.5472},{"match_name":"Sharp Practical Shooters May USPSA Match","match_date":"2018-05-27","stage_classifiercode":"99-16","member_number":"A95272","first_name":"WADE","last_name":"MEYER","classification":"B","division":"LIMITED","hit_factor":7.5423},{"match_name":"DWB - Deadwood Boys USPSA 20 May 2018","match_date":"2018-05-20","stage_classifiercode":"99-16","member_number":"A104916","first_name":"JONATHAN","last_name":"STEVENS","classification":"U","division":"LIMITED","hit_factor":7.5227},{"match_name":"MVPSA USPSA 7-7-18","match_date":"2018-07-07","stage_classifiercode":"99-16","member_number":"TY97549","first_name":"ERIC","last_name":"HERZOG","classification":"B","division":"LIMITED","hit_factor":7.5168},{"match_name":"SFA USPSA NOVEMBER 14 2020","match_date":"2020-11-14","stage_classifiercode":"99-16","member_number":"TY50453","first_name":"ARNOLD","last_name":"PETERSON","classification":"M","division":"LIMITED","hit_factor":7.5094},{"match_name":"SWGC USPSA Pistol Match - December","match_date":"2016-12-03","stage_classifiercode":"99-16","member_number":"L729","first_name":"ROBERT","last_name":"WALKER","classification":"M","division":"LIMITED","hit_factor":7.5},{"match_name":"LdF USPSA Match September 23 2017","match_date":"2017-09-23","stage_classifiercode":"99-16","member_number":"A54150","first_name":"DANIEL","last_name":"NICKEL","classification":"A","division":"LIMITED","hit_factor":7.4896},{"match_name":"MPSA 101720 USPSA","match_date":"2020-10-17","stage_classifiercode":"99-16","member_number":"TY110243","first_name":"SHAN","last_name":"SMITH","classification":"B","division":"LIMITED","hit_factor":7.4896},{"match_name":"APSC USPSA Match 1-6-18","match_date":"2018-01-06","stage_classifiercode":"99-16","member_number":"L3804","first_name":"DAVID","last_name":"BISHOP","classification":"M","division":"LIMITED","hit_factor":7.4753},{"match_name":"Pima Pistol Club USPSA Match - May 29 ","match_date":"2016-05-29","stage_classifiercode":"99-16","member_number":"A55525","first_name":"MICHAEL","last_name":"MCDANNELL","classification":"B","division":"LIMITED","hit_factor":7.4705},{"match_name":"CRC_20160514_SuperClassifier","match_date":"2016-05-14","stage_classifiercode":"99-16","member_number":"TY65590","first_name":"STEVE","last_name":"STETLER","classification":"A","division":"LIMITED","hit_factor":7.4605},{"match_name":"CCPL 2 Day Match 2018","match_date":"2018-04-26","stage_classifiercode":"99-16","member_number":"A65481","first_name":"KEVIN","last_name":"DORAN","classification":"B","division":"LIMITED","hit_factor":7.4567},{"match_name":"Sharp Practical Shooters May USPSA Match","match_date":"2018-05-27","stage_classifiercode":"99-16","member_number":"A84525","first_name":"KEVIN","last_name":"VAUGHN","classification":"A","division":"LIMITED","hit_factor":7.4543},{"match_name":"EWPSA 2018-09","match_date":"2018-09-16","stage_classifiercode":"99-16","member_number":"A85658","first_name":"NICK","last_name":"BERGER","classification":"M","division":"LIMITED","hit_factor":7.438},{"match_name":"DWB - Deadwood Boys USPSA 20 May 2018","match_date":"2018-05-20","stage_classifiercode":"99-16","member_number":"TY78872","first_name":"BRANDON","last_name":"CHIN","classification":"U","division":"LIMITED","hit_factor":7.438},{"match_name":"WLPS June 2017","match_date":"2017-06-25","stage_classifiercode":"99-16","member_number":"A57298","first_name":"DAVID","last_name":"SCHROEDER","classification":"A","division":"LIMITED","hit_factor":7.4124},{"match_name":"USPSA MO21 Special Classifier 2Alpha SBRC February 27 2021","match_date":"2021-02-27","stage_classifiercode":"99-16","member_number":"A126957","first_name":"JOSHUA","last_name":"WILSON","classification":"C","division":"LIMITED","hit_factor":7.4122},{"match_name":"USPSA MO21 Special Classifier 2Alpha SBRC February 27 2021","match_date":"2021-02-27","stage_classifiercode":"99-16","member_number":"A110827","first_name":"DREW","last_name":"HICKS","classification":"B","division":"LIMITED","hit_factor":7.3976},{"match_name":"CCPL 2 Day Match 2018","match_date":"2018-04-26","stage_classifiercode":"99-16","member_number":"TY87000","first_name":"GREG","last_name":"VAUGHN","classification":"A","division":"LIMITED","hit_factor":7.3834},{"match_name":"Hernando Sportsmans Club","match_date":"2017-02-12","stage_classifiercode":"99-16","member_number":"A71248","first_name":"CHAD","last_name":"HYLANDER","classification":"\"\"","division":"LIMITED","hit_factor":7.3834},{"match_name":"PCWC USPSA  1 28 17","match_date":"2017-01-28","stage_classifiercode":"99-16","member_number":"A90780","first_name":"RYAN","last_name":"CARVER","classification":"M","division":"LIMITED","hit_factor":7.3491},{"match_name":"SWGC USPSA Pistol Match - December","match_date":"2016-12-03","stage_classifiercode":"99-16","member_number":"A91636","first_name":"LUKE","last_name":"ADAMS","classification":"B","division":"LIMITED","hit_factor":7.3343},{"match_name":"Shadow Hawk Defense USPSA Special Classifier","match_date":"2020-11-14","stage_classifiercode":"99-16","member_number":"TY95638","first_name":"ERIK","last_name":"FECK","classification":"C","division":"LIMITED","hit_factor":7.3325},{"match_name":"EWPSA 2018-09","match_date":"2018-09-16","stage_classifiercode":"99-16","member_number":"A92411","first_name":"CRAIG","last_name":"WORRELL","classification":"B","division":"LIMITED","hit_factor":7.326},{"match_name":"Hosemasters 2nd Sunday May 2017","match_date":"2017-05-14","stage_classifiercode":"99-16","member_number":"FY72117","first_name":"MARK","last_name":"GARDNER","classification":"A","division":"LIMITED","hit_factor":7.2993},{"match_name":"BORCC USPSA July 2018 Classifier Match","match_date":"2018-07-02","stage_classifiercode":"99-16","member_number":"TY112945","first_name":"NICHOLAS","last_name":"HARIG","classification":"U","division":"LIMITED","hit_factor":7.2917},{"match_name":"LdF USPSA Match September 23 2017","match_date":"2017-09-23","stage_classifiercode":"99-16","member_number":"TY78824","first_name":"MATTHEW","last_name":"CLARK","classification":"G","division":"LIMITED","hit_factor":7.2881},{"match_name":"Pima Pistol Club USPSA Match - May 29 ","match_date":"2016-05-29","stage_classifiercode":"99-16","member_number":"A87474","first_name":"DAVID","last_name":"FRAZIER","classification":"B","division":"LIMITED","hit_factor":7.2427},{"match_name":"TPS USPSA -  January 2017 - Talon Range","match_date":"2017-01-07","stage_classifiercode":"99-16","member_number":"09235","first_name":"CJ","last_name":"SCROGGINS","classification":"C","division":"LIMITED","hit_factor":7.2273},{"match_name":"Nampa USPSA May 27th 2020 Classifier Match","match_date":"2020-05-27","stage_classifiercode":"99-16","member_number":"A68393","first_name":"MATTHEW","last_name":"EVANCIC","classification":"M","division":"LIMITED","hit_factor":7.2271},{"match_name":"ORSA USPSA July 2016 ","match_date":"2016-07-16","stage_classifiercode":"99-16","member_number":"FY72214","first_name":"AARON","last_name":"SONTAG","classification":"B","division":"LIMITED","hit_factor":7.2193},{"match_name":"Emmett March Match","match_date":"2016-03-25","stage_classifiercode":"99-16","member_number":"ty41217","first_name":"RAUL","last_name":"GARCIA","classification":"B","division":"LIMITED","hit_factor":7.2109},{"match_name":"Pelham USPSA 2017-08-20","match_date":"2017-08-20","stage_classifiercode":"99-16","member_number":"TY76424","first_name":"HARRISON","last_name":"SCHMIDT","classification":"A","division":"LIMITED","hit_factor":7.2096},{"match_name":"Bass River USPSA September 2018","match_date":"2018-09-02","stage_classifiercode":"99-16","member_number":"TY76424","first_name":"HARRISON","last_name":"SCHMIDT","classification":"\"\"","division":"LIMITED","hit_factor":7.2072},{"match_name":"CIPSC Havana July USPSA","match_date":"2018-07-07","stage_classifiercode":"99-16","member_number":"A88823","first_name":"KYLE","last_name":"SMITH","classification":"A","division":"LIMITED","hit_factor":7.1611253196931},{"match_name":"PRG-USPSA - Oh Shoot January 3rd - 1st Sunday","match_date":"2021-01-03","stage_classifiercode":"99-16","member_number":"FY67188","first_name":"IVAN","last_name":"GARCIA","classification":"B","division":"LIMITED","hit_factor":7.1336},{"match_name":"Shadow Hawk Defense USPSA Special Classifier","match_date":"2020-11-14","stage_classifiercode":"99-16","member_number":"A119732","first_name":"BRIAN","last_name":"MOONEY","classification":"B","division":"LIMITED","hit_factor":7.1229},{"match_name":"LdF USPSA Match September 23 2017","match_date":"2017-09-23","stage_classifiercode":"99-16","member_number":"TY92479","first_name":"JOEL","last_name":"GONZALES","classification":"B","division":"LIMITED","hit_factor":7.1084},{"match_name":"Rio Grande Practical Shooters - May 2018","match_date":"2018-05-05","stage_classifiercode":"99-16","member_number":"A7721","first_name":"CHARLIE","last_name":"MYERS","classification":"M","division":"LIMITED","hit_factor":7.0773},{"match_name":"PIPS 07-25-2018","match_date":"2018-07-25","stage_classifiercode":"99-16","member_number":"TY96283","first_name":"NOAH","last_name":"LANDERS","classification":"B","division":"LIMITED","hit_factor":7.0773},{"match_name":"LCSC USPSA 01.14.18","match_date":"2018-01-13","stage_classifiercode":"99-16","member_number":"TY87259","first_name":"YEE-MIN","last_name":"LIN","classification":"B","division":"LIMITED","hit_factor":7.0755},{"match_name":"Nampa USPSA May 27th 2020 Classifier Match","match_date":"2020-05-27","stage_classifiercode":"99-16","member_number":"TY85985","first_name":"CHRISTOPHER","last_name":"COLLINS","classification":"M","division":"LIMITED","hit_factor":7.0545},{"match_name":"PRG-USPSA - Oh Shoot January 3rd - 1st Sunday","match_date":"2021-01-03","stage_classifiercode":"99-16","member_number":"TY112098","first_name":"SAMUEL","last_name":"BRIGGS2","classification":"B","division":"LIMITED","hit_factor":7.0385},{"match_name":"SPSA USPSA June 1st Sat Match","match_date":"2021-06-05","stage_classifiercode":"99-16","member_number":"TY3777","first_name":"MIKE","last_name":"MORRIS","classification":"A","division":"LIMITED","hit_factor":7.037},{"match_name":"WLPS USPSA Sep 2016","match_date":"2016-09-25","stage_classifiercode":"99-16","member_number":"29765","first_name":"CHRISTOPHER","last_name":"TERRINGTON","classification":"A","division":"LIMITED","hit_factor":7.0263},{"match_name":"MSSA Uspsa Club Matcg","match_date":"2017-09-24","stage_classifiercode":"99-16","member_number":"A50757","first_name":"JOHN","last_name":"NETTLES","classification":"B","division":"LIMITED","hit_factor":7.0258},{"match_name":"LCSC USPSA 01.14.18","match_date":"2018-01-13","stage_classifiercode":"99-16","member_number":"A84672","first_name":"DALON","last_name":"LITTLEJOHN","classification":"A","division":"LIMITED","hit_factor":7.0155},{"match_name":"CCPL 02-09-2020","match_date":"2020-02-09","stage_classifiercode":"99-16","member_number":"TY87001","first_name":"LAWRENCE","last_name":"CASADO","classification":"B","division":"LIMITED","hit_factor":7.0111},{"match_name":"ShooT GTR USPSA 1/1/17","match_date":"2017-01-01","stage_classifiercode":"99-16","member_number":"TY94255","first_name":"SHANE","last_name":"BETHEA","classification":"A","division":"LIMITED","hit_factor":7.0081},{"match_name":"SPSA USPSA December 1st Sat Match","match_date":"2016-12-03","stage_classifiercode":"99-16","member_number":"A47715","first_name":"SCOTT","last_name":"DELUCE","classification":"B","division":"LIMITED","hit_factor":6.988},{"match_name":"ShooT GTR USPSA 1/1/17","match_date":"2017-01-01","stage_classifiercode":"99-16","member_number":"FY77988","first_name":"RICH","last_name":"VALVO","classification":"B","division":"LIMITED","hit_factor":6.9853},{"match_name":"Briar Rabbit  June Match 2016 OH 20","match_date":"2016-06-12","stage_classifiercode":"99-16","member_number":"TY81742","first_name":"BEN","last_name":"WEST","classification":"A","division":"LIMITED","hit_factor":6.9697},{"match_name":"RBGC 2017-10-21","match_date":"2017-10-21","stage_classifiercode":"99-16","member_number":"A79470","first_name":"DAVID","last_name":"BUENGER","classification":"X","division":"LIMITED","hit_factor":6.9677},{"match_name":"PCWC USPSA  1 28 17","match_date":"2017-01-28","stage_classifiercode":"99-16","member_number":"A91636","first_name":"LUKE","last_name":"ADAMS","classification":"B","division":"LIMITED","hit_factor":6.9588},{"match_name":"Idaho ISPS August 5th Break from the Heat","match_date":"2017-08-05","stage_classifiercode":"99-16","member_number":"A92669","first_name":"SCOTT","last_name":"VICKERS","classification":"B","division":"LIMITED","hit_factor":6.9588},{"match_name":"Idaho ISPS August 5th Break from the Heat","match_date":"2017-08-05","stage_classifiercode":"99-16","member_number":"A99345","first_name":"PEDEE","last_name":"EWING","classification":"B","division":"LIMITED","hit_factor":6.9532},{"match_name":"PRG-USPSA - Oh Shoot January 3rd - 1st Sunday","match_date":"2021-01-03","stage_classifiercode":"99-16","member_number":"TY112098","first_name":"SAMUEL","last_name":"BRIGGS","classification":"B","division":"LIMITED","hit_factor":6.9409},{"match_name":"ShooT GTR USPSA 1/1/17","match_date":"2017-01-01","stage_classifiercode":"99-16","member_number":"\"\"","first_name":"BUD","last_name":"EHRMANN","classification":"U","division":"LIMITED","hit_factor":6.9378},{"match_name":"SWGC USPSA Pistol Match - December","match_date":"2016-12-03","stage_classifiercode":"99-16","member_number":"FY28545","first_name":"GREG","last_name":"MORANDO","classification":"M","division":"LIMITED","hit_factor":6.9307},{"match_name":"CCPL 2 Day Match 2018","match_date":"2018-04-26","stage_classifiercode":"99-16","member_number":"TY96702","first_name":"BRUCE","last_name":"LE","classification":"U","division":"LIMITED","hit_factor":6.9249},{"match_name":"MS06 Team Magnolia USPSA January Match2","match_date":"2016-01-03","stage_classifiercode":"99-16","member_number":"A67704","first_name":"MICHAEL","last_name":"MCDONALD","classification":"U","division":"LIMITED","hit_factor":6.9221},{"match_name":"CRC_20160514_SuperClassifier","match_date":"2016-05-14","stage_classifiercode":"99-16","member_number":"TY81049","first_name":"ROBERT","last_name":"MERKEL","classification":"B","division":"LIMITED","hit_factor":6.8878},{"match_name":"4ta Fecha USPSA","match_date":"2018-04-07","stage_classifiercode":"99-16","member_number":"A97576","first_name":"RAMON","last_name":"RIVERA","classification":"B","division":"LIMITED","hit_factor":6.8878},{"match_name":"WLPS June 2017","match_date":"2017-06-25","stage_classifiercode":"99-16","member_number":"A47064","first_name":"BOB","last_name":"JENSEN","classification":"A","division":"LIMITED","hit_factor":6.8878},{"match_name":"SPSA USPSA December 1st Sat Match","match_date":"2016-12-03","stage_classifiercode":"99-16","member_number":"A82837","first_name":"DANIEL","last_name":"BOYLSTON","classification":"B","division":"LIMITED","hit_factor":6.8836},{"match_name":"PTPC May 7th USPSA Match","match_date":"2017-05-07","stage_classifiercode":"99-16","member_number":"A101123","first_name":"JAKE","last_name":"MANSFIELD","classification":"U","division":"LIMITED","hit_factor":6.8571},{"match_name":"CRC_20160514_SuperClassifier","match_date":"2016-05-14","stage_classifiercode":"99-16","member_number":"FY26112","first_name":"RW","last_name":"SWAINSON","classification":"M","division":"LIMITED","hit_factor":6.8477},{"match_name":"Coyote Arms USPSA","match_date":"2016-09-17","stage_classifiercode":"99-16","member_number":"PEN","first_name":"DAVID","last_name":"LEE","classification":"C","division":"LIMITED","hit_factor":6.8387},{"match_name":"PRG-USPSA - Oh Shoot January 3rd - 1st Sunday","match_date":"2021-01-03","stage_classifiercode":"99-16","member_number":"TY127703","first_name":"MARC","last_name":"MAGLINTE","classification":"C","division":"LIMITED","hit_factor":6.8354},{"match_name":"PRG-USPSA - Oh Shoot January 3rd - 1st Sunday","match_date":"2021-01-03","stage_classifiercode":"99-16","member_number":"A86815","first_name":"TYLER","last_name":"IRWIN","classification":"B","division":"LIMITED","hit_factor":6.8316},{"match_name":"RCPS USPSA 12 Nov 2016","match_date":"2016-11-12","stage_classifiercode":"99-16","member_number":"A65338","first_name":"JAMES","last_name":"CLARK","classification":"B","division":"LIMITED","hit_factor":6.8316},{"match_name":"4ta Fecha USPSA","match_date":"2018-04-07","stage_classifiercode":"99-16","member_number":"A92124","first_name":"GERMAN","last_name":"VELEZ","classification":"B","division":"LIMITED","hit_factor":6.8182},{"match_name":"Hernando Sportsmans Club","match_date":"2017-02-12","stage_classifiercode":"99-16","member_number":"A66277","first_name":"DAVID","last_name":"BRACKETT","classification":"A","division":"LIMITED","hit_factor":6.8155},{"match_name":"Pinetucky USPSA 02-27-16","match_date":"2016-02-27","stage_classifiercode":"99-16","member_number":"TY67776","first_name":"NICK","last_name":"ORTALAZA","classification":"B","division":"LIMITED","hit_factor":6.8129},{"match_name":"SPSA USPSA December 1st Sat Match","match_date":"2016-12-03","stage_classifiercode":"99-16","member_number":"A93370","first_name":"CRAIG","last_name":"HOOKS","classification":"U","division":"LIMITED","hit_factor":6.8044},{"match_name":"CIPSC Havana July USPSA","match_date":"2018-07-07","stage_classifiercode":"99-16","member_number":"TY90126","first_name":"TOM","last_name":"BURZYNSKI","classification":"B","division":"LIMITED","hit_factor":6.8019093078759},{"match_name":"ORSA USPSA July 2016 ","match_date":"2016-07-16","stage_classifiercode":"99-16","member_number":"A65108","first_name":"BOB","last_name":"TONER","classification":"B","division":"LIMITED","hit_factor":6.7847},{"match_name":"CIPSC Havana July USPSA","match_date":"2018-07-07","stage_classifiercode":"99-16","member_number":"A74372","first_name":"BRIAN","last_name":"ROWLISON","classification":"B","division":"LIMITED","hit_factor":6.78391959799},{"match_name":"Shasta Shooters September 2016","match_date":"2016-09-10","stage_classifiercode":"99-16","member_number":"A84097","first_name":"GIANNI","last_name":"GIORDANO","classification":"B","division":"LIMITED","hit_factor":6.7757},{"match_name":"CIPSC Havana July USPSA","match_date":"2018-07-07","stage_classifiercode":"99-16","member_number":"A107035","first_name":"PAUL","last_name":"GERKE","classification":"D","division":"LIMITED","hit_factor":6.7660550458716},{"match_name":"Hernando Sportsmans Club","match_date":"2017-02-12","stage_classifiercode":"99-16","member_number":"\"\"","first_name":"JUSTIN","last_name":"MALINCHAK","classification":"U","division":"LIMITED","hit_factor":6.7568},{"match_name":"Rio Grande Practical Shooters - May 2018","match_date":"2018-05-05","stage_classifiercode":"99-16","member_number":"TY97763","first_name":"BRANDON","last_name":"BUTLER","classification":"B","division":"LIMITED","hit_factor":6.7442},{"match_name":"RCPS USPSA 12 Nov 2016","match_date":"2016-11-12","stage_classifiercode":"99-16","member_number":"A96308","first_name":"JOHN","last_name":"GOMEZ","classification":"C","division":"LIMITED","hit_factor":6.7389},{"match_name":"ORSA USPSA July 2016 ","match_date":"2016-07-16","stage_classifiercode":"99-16","member_number":"TY77301","first_name":"SHANE","last_name":"CHARLES","classification":"B","division":"LIMITED","hit_factor":6.7385},{"match_name":"CRC_20160514_SuperClassifier","match_date":"2016-05-14","stage_classifiercode":"99-16","member_number":"FY26112","first_name":"RW","last_name":"SWAINSON","classification":"M","division":"LIMITED","hit_factor":6.7376},{"match_name":"Hernando Sportsmans Club","match_date":"2017-02-12","stage_classifiercode":"99-16","member_number":"FY77988","first_name":"RICH","last_name":"VALVO","classification":"A","division":"LIMITED","hit_factor":6.7174},{"match_name":"PIPS 07-25-2018","match_date":"2018-07-25","stage_classifiercode":"99-16","member_number":"A101542","first_name":"COLIN","last_name":"MAXON","classification":"B","division":"LIMITED","hit_factor":6.6991},{"match_name":"PCWC USPSA  1 28 17","match_date":"2017-01-28","stage_classifiercode":"99-16","member_number":"A87132","first_name":"TONY","last_name":"BICHLER","classification":"B","division":"LIMITED","hit_factor":6.698},{"match_name":"Renton USPSA - August 2020 - NW05","match_date":"2020-08-23","stage_classifiercode":"99-16","member_number":"Ty92223","first_name":"STUART","last_name":"WILSON","classification":"A","division":"LIMITED","hit_factor":6.6919},{"match_name":"Sharp Practical Shooters May USPSA Match","match_date":"2018-05-27","stage_classifiercode":"99-16","member_number":"\"\"","first_name":"ASHFURD","last_name":"WEST","classification":"U","division":"LIMITED","hit_factor":6.682},{"match_name":"PCWC USPSA  1 28 17","match_date":"2017-01-28","stage_classifiercode":"99-16","member_number":"TY78922","first_name":"DON","last_name":"ADAM","classification":"B","division":"LIMITED","hit_factor":6.6667},{"match_name":"AIPS Weekly USPSA 3 August 2021","match_date":"2021-08-03","stage_classifiercode":"99-16","member_number":"L4815","first_name":"JOHN","last_name":"ROOZEBOOM","classification":"C","division":"LIMITED","hit_factor":6.6667},{"match_name":"Shasta Shooters September 2016","match_date":"2016-09-10","stage_classifiercode":"99-16","member_number":"a33123","first_name":"DAREN","last_name":"HUSA","classification":"B","division":"LIMITED","hit_factor":6.659},{"match_name":"ORSA USPSA August 2020","match_date":"2020-08-15","stage_classifiercode":"99-16","member_number":"A99934","first_name":"ANDREW","last_name":"KEITH","classification":"B","division":"LIMITED","hit_factor":6.6581},{"match_name":"Shongum April 2016 Pistol Match","match_date":"2016-04-02","stage_classifiercode":"99-16","member_number":"A91710","first_name":"RYAN","last_name":"POBLETE","classification":"B","division":"LIMITED","hit_factor":6.6356},{"match_name":"Emmett March Match","match_date":"2016-03-25","stage_classifiercode":"99-16","member_number":"a94683","first_name":"JAMES","last_name":"BAILEY","classification":"C","division":"LIMITED","hit_factor":6.6356},{"match_name":"ARPC USPSA Match 7-26-20","match_date":"2020-07-26","stage_classifiercode":"99-16","member_number":"A100828","first_name":"MICHAEL","last_name":"HARPER","classification":"B","division":"LIMITED","hit_factor":6.6339},{"match_name":"SFA USPSA March 2017","match_date":"2017-03-18","stage_classifiercode":"99-16","member_number":"A81703","first_name":"DAVID","last_name":"BORWICK","classification":"B","division":"LIMITED","hit_factor":6.621},{"match_name":"WLPS June 2017","match_date":"2017-06-25","stage_classifiercode":"99-16","member_number":"A84539","first_name":"JUSTIN","last_name":"ADAMS","classification":"B","division":"LIMITED","hit_factor":6.6125},{"match_name":"SPSA USPSA December 1st Sat Match","match_date":"2016-12-03","stage_classifiercode":"99-16","member_number":"L1583","first_name":"EDDIE","last_name":"WAGNER","classification":"B","division":"LIMITED","hit_factor":6.596},{"match_name":"Briar Rabbit  June Match 2016 OH 20","match_date":"2016-06-12","stage_classifiercode":"99-16","member_number":"A96691","first_name":"WILLIAM","last_name":"SORBES","classification":"U","division":"LIMITED","hit_factor":6.5882},{"match_name":"Sage Pistol League USPSA August 16 2020","match_date":"2020-08-16","stage_classifiercode":"99-16","member_number":"A45520","first_name":"BENNIE","last_name":"DUNN IV","classification":"A","division":"LIMITED","hit_factor":6.5839},{"match_name":"Hernando Sportsmans Club","match_date":"2017-02-12","stage_classifiercode":"99-16","member_number":"\"\"","first_name":"AL","last_name":"SIENA","classification":"U","division":"LIMITED","hit_factor":6.5693},{"match_name":"CRC_20160514_SuperClassifier","match_date":"2016-05-14","stage_classifiercode":"99-16","member_number":"A90490","first_name":"LEE","last_name":"SCHOENIKE","classification":"B","division":"LIMITED","hit_factor":6.5594},{"match_name":"Emmett March Match","match_date":"2016-03-25","stage_classifiercode":"99-16","member_number":"a94890","first_name":"CHRIS","last_name":"CLARK","classification":"U","division":"LIMITED","hit_factor":6.5271},{"match_name":"TPS USPSA -  January 2017 - Talon Range","match_date":"2017-01-07","stage_classifiercode":"99-16","member_number":"A-90896","first_name":"CHANDLER","last_name":"NELSON","classification":"C","division":"LIMITED","hit_factor":6.5242},{"match_name":"TPS USPSA -  January 2017 - Talon Range","match_date":"2017-01-07","stage_classifiercode":"99-16","member_number":"A87135","first_name":"ENVER","last_name":"FOCAKOVIC","classification":"B","division":"LIMITED","hit_factor":6.5068},{"match_name":"Maine Practical Shooters May 2017","match_date":"2017-05-13","stage_classifiercode":"99-16","member_number":"A82266","first_name":"JOSH","last_name":"HOLMES","classification":"C","division":"LIMITED","hit_factor":6.506},{"match_name":"Sharp Practical Shooters May USPSA Match","match_date":"2018-05-27","stage_classifiercode":"99-16","member_number":"\"\"","first_name":"KENNETH","last_name":"HESS","classification":"U","division":"LIMITED","hit_factor":6.4757},{"match_name":"LdF USPSA Match September 23 2017","match_date":"2017-09-23","stage_classifiercode":"99-16","member_number":"A81018","first_name":"BART","last_name":"DEL RIO","classification":"M","division":"LIMITED","hit_factor":6.4721},{"match_name":"Shongum December 2017 USPSA Match","match_date":"2017-12-02","stage_classifiercode":"99-16","member_number":"A93032","first_name":"PAUL","last_name":"TEVALD","classification":"B","division":"LIMITED","hit_factor":6.4593},{"match_name":"LCSC USPSA 01.14.18","match_date":"2018-01-13","stage_classifiercode":"99-16","member_number":"A99969","first_name":"KARL","last_name":"MACARAIG","classification":"U","division":"LIMITED","hit_factor":6.448},{"match_name":"Renton USPSA - August 2020 - NW05","match_date":"2020-08-23","stage_classifiercode":"99-16","member_number":"FY100095","first_name":"MARK","last_name":"BANTA","classification":"C","division":"LIMITED","hit_factor":6.4407},{"match_name":"EWPSA 2018-09","match_date":"2018-09-16","stage_classifiercode":"99-16","member_number":"TY68374","first_name":"MIKAYLA","last_name":"BLOSSER","classification":"M","division":"LIMITED","hit_factor":6.4389},{"match_name":"CRC_20160514_SuperClassifier","match_date":"2016-05-14","stage_classifiercode":"99-16","member_number":"TY81049","first_name":"ROBERT","last_name":"MERKEL","classification":"B","division":"LIMITED","hit_factor":6.435},{"match_name":"ENPS March 2017 USPSA Match","match_date":"2017-03-05","stage_classifiercode":"99-16","member_number":"A90722","first_name":"NICHOLAS","last_name":"SPECK","classification":"C","division":"LIMITED","hit_factor":6.434},{"match_name":"Renton USPSA - August 2020 - NW05","match_date":"2020-08-23","stage_classifiercode":"99-16","member_number":"A71578","first_name":"KEITH","last_name":"TSANG","classification":"B","division":"LIMITED","hit_factor":6.427},{"match_name":"AIPS Weekly USPSA 3 August 2021","match_date":"2021-08-03","stage_classifiercode":"99-16","member_number":"A112032","first_name":"ELDON","last_name":"EMMICK","classification":"Unclassified","division":"LIMITED","hit_factor":6.4177},{"match_name":"ENPS March 2017 USPSA Match","match_date":"2017-03-05","stage_classifiercode":"99-16","member_number":"A86172","first_name":"TRAVIS","last_name":"CALDWELL","classification":"B","division":"LIMITED","hit_factor":6.4171},{"match_name":"LGCSEMPS September 2017 Handgun","match_date":"2017-09-10","stage_classifiercode":"99-16","member_number":"A92994","first_name":"MIKE","last_name":"NYSTROM","classification":"C","division":"LIMITED","hit_factor":6.4159},{"match_name":"BRSP Tuesday Night USPSA Match - June 5","match_date":"2018-06-06","stage_classifiercode":"99-16","member_number":"FY84358","first_name":"TYLER","last_name":"VIRGIN","classification":"B","division":"LIMITED","hit_factor":6.402},{"match_name":"OREGON ARPC CC05 USPSA Jan 14 2017","match_date":"2017-01-14","stage_classifiercode":"99-16","member_number":"A99370","first_name":"JARRETT","last_name":"COLEMAN","classification":"U","division":"LIMITED","hit_factor":6.4},{"match_name":"MS06 Team Magnolia USPSA January Match2","match_date":"2016-01-03","stage_classifiercode":"99-16","member_number":"TY74425","first_name":"BILL","last_name":"OGLETREE","classification":"B","division":"LIMITED","hit_factor":6.3932},{"match_name":"PTPC May 7th USPSA Match","match_date":"2017-05-07","stage_classifiercode":"99-16","member_number":"A85072","first_name":"FRANK","last_name":"VALY","classification":"A","division":"LIMITED","hit_factor":6.3855},{"match_name":"March 2016 USPSA Ponca CityMatch","match_date":"2016-03-12","stage_classifiercode":"99-16","member_number":"FY4352","first_name":"DOUGLAS","last_name":"STEPHENS","classification":"B","division":"LIMITED","hit_factor":6.3709},{"match_name":"Dundee USPSA Mar 2017","match_date":"2017-03-25","stage_classifiercode":"99-16","member_number":"A98685","first_name":"ROB","last_name":"COATES","classification":"C","division":"LIMITED","hit_factor":6.3527},{"match_name":"Renton USPSA - August 2020 - NW05","match_date":"2020-08-23","stage_classifiercode":"99-16","member_number":"L4494","first_name":"VINH","last_name":"HOANG","classification":"M","division":"LIMITED","hit_factor":6.3415},{"match_name":"Pima Pistol Club USPSA Match - May 29 ","match_date":"2016-05-29","stage_classifiercode":"99-16","member_number":"A56219","first_name":"ROMMEL","last_name":"AUSTIN","classification":"B","division":"LIMITED","hit_factor":6.3388},{"match_name":"AVAP CLASSIFIER 71418","match_date":"2018-07-14","stage_classifiercode":"99-16","member_number":"A101186","first_name":"ZACH","last_name":"BASICH","classification":"B","division":"LIMITED","hit_factor":6.3246},{"match_name":"Pelham USPSA 2017-08-20","match_date":"2017-08-20","stage_classifiercode":"99-16","member_number":"\"\"","first_name":"DAVE","last_name":"MOWBRAY","classification":"B","division":"LIMITED","hit_factor":6.3205},{"match_name":"SPSA USPSA December 1st Sat Match","match_date":"2016-12-03","stage_classifiercode":"99-16","member_number":"TY81382","first_name":"BRIAN","last_name":"AGNER","classification":"B","division":"LIMITED","hit_factor":6.3169},{"match_name":"Idaho ISPS August 5th Break from the Heat","match_date":"2017-08-05","stage_classifiercode":"99-16","member_number":"A68393","first_name":"MATTHEW","last_name":"EVANCIC","classification":"M","division":"LIMITED","hit_factor":6.3142},{"match_name":"CRC_20160514_SuperClassifier","match_date":"2016-05-14","stage_classifiercode":"99-16","member_number":"A82785","first_name":"DAVID","last_name":"DOWNEY","classification":"C","division":"LIMITED","hit_factor":6.2921},{"match_name":"EWPSA 2018-09","match_date":"2018-09-16","stage_classifiercode":"99-16","member_number":"\"\"","first_name":"JOSH","last_name":"PENNELL","classification":"\"\"","division":"LIMITED","hit_factor":6.2851},{"match_name":"Emmett March Match","match_date":"2016-03-25","stage_classifiercode":"99-16","member_number":"a57987","first_name":"PETE","last_name":"TURNER","classification":"B","division":"LIMITED","hit_factor":6.2845},{"match_name":"RCPS USPSA 12 Nov 2016","match_date":"2016-11-12","stage_classifiercode":"99-16","member_number":"FY17098","first_name":"TJ","last_name":"TURNER","classification":"M","division":"LIMITED","hit_factor":6.267},{"match_name":"LGCSEMPS September 2017 Handgun","match_date":"2017-09-10","stage_classifiercode":"99-16","member_number":"TY72961","first_name":"WALT","last_name":"PAEGEL","classification":"B","division":"LIMITED","hit_factor":6.2635},{"match_name":"CCPL 2 Day Match 2018","match_date":"2018-04-26","stage_classifiercode":"99-16","member_number":"TY87404","first_name":"MARIO","last_name":"RODRIGUEZ","classification":"C","division":"LIMITED","hit_factor":6.25},{"match_name":"WLPS June 2017","match_date":"2017-06-25","stage_classifiercode":"99-16","member_number":"A50601","first_name":"JASON","last_name":"ROSS","classification":"C","division":"LIMITED","hit_factor":6.25},{"match_name":"ORSA USPSA July 2016 ","match_date":"2016-07-16","stage_classifiercode":"99-16","member_number":"A97527","first_name":"JED","last_name":"MERCER","classification":"U","division":"LIMITED","hit_factor":6.2363},{"match_name":"USPSA Bass River April 2017","match_date":"2017-04-02","stage_classifiercode":"99-16","member_number":"TY76424","first_name":"HARRISON","last_name":"SCHMIDT","classification":"\"\"","division":"LIMITED","hit_factor":6.2291},{"match_name":"Idaho ISPS August 5th Break from the Heat","match_date":"2017-08-05","stage_classifiercode":"99-16","member_number":"A95272","first_name":"WADE","last_name":"MEYER","classification":"B","division":"LIMITED","hit_factor":6.2291},{"match_name":"CCPL 2 Day Match 2018","match_date":"2018-04-26","stage_classifiercode":"99-16","member_number":"TY96702","first_name":"MADDUX","last_name":"LE","classification":"U","division":"LIMITED","hit_factor":6.2232},{"match_name":"LGCSEMPS September 2017 Handgun","match_date":"2017-09-10","stage_classifiercode":"99-16","member_number":"A86161","first_name":"TOM","last_name":"KEAN","classification":"B","division":"LIMITED","hit_factor":6.2227},{"match_name":"PIPS 05-25-2016","match_date":"2016-05-24","stage_classifiercode":"99-16","member_number":"FY95176","first_name":"CHRIS","last_name":"BORTON","classification":"U","division":"LIMITED","hit_factor":6.2212},{"match_name":"Hosemasters 2nd Sunday May 2017","match_date":"2017-05-14","stage_classifiercode":"99-16","member_number":"TY78036","first_name":"MIKE","last_name":"PACHECO","classification":"B","division":"LIMITED","hit_factor":6.2134},{"match_name":"SWGC USPSA Pistol Match - December","match_date":"2016-12-03","stage_classifiercode":"99-16","member_number":"ty29595","first_name":"RICKY","last_name":"COLVILLE","classification":"B","division":"LIMITED","hit_factor":6.2092},{"match_name":"Dundee USPSA Mar 2017","match_date":"2017-03-25","stage_classifiercode":"99-16","member_number":"A87752","first_name":"JOANNE","last_name":"TEGTMEYER","classification":"B","division":"LIMITED","hit_factor":6.2007},{"match_name":"HSC USPSA April 7th 2018","match_date":"2018-04-07","stage_classifiercode":"99-16","member_number":"A84775","first_name":"STEPHEN","last_name":"VAN","classification":"U","division":"LIMITED","hit_factor":6.1988},{"match_name":"Sharp Practical Shooters May USPSA Match","match_date":"2018-05-27","stage_classifiercode":"99-16","member_number":"Ty93274","first_name":"JOSHUA","last_name":"FANT","classification":"B","division":"LIMITED","hit_factor":6.196},{"match_name":"Pelham USPSA 2017-08-20","match_date":"2017-08-20","stage_classifiercode":"99-16","member_number":"A101494","first_name":"BRAD","last_name":"COLEGROVE","classification":"C","division":"LIMITED","hit_factor":6.191},{"match_name":"FLPSA MN14 USPSA May 17 2018","match_date":"2018-05-17","stage_classifiercode":"99-16","member_number":"A100417","first_name":"ROBERT","last_name":"GALE","classification":"B","division":"LIMITED","hit_factor":6.1856},{"match_name":"4ta Fecha USPSA","match_date":"2018-04-07","stage_classifiercode":"99-16","member_number":"A109072","first_name":"LUIS A.","last_name":"SIERRA-VALENTIN","classification":"U","division":"LIMITED","hit_factor":6.1768},{"match_name":"MS06 Team Magnolia USPSA January Match2","match_date":"2016-01-03","stage_classifiercode":"99-16","member_number":"TY57390","first_name":"SCOTT","last_name":"WOMACK","classification":"B","division":"LIMITED","hit_factor":6.1571},{"match_name":"SPSA USPSA July 4th Sat match","match_date":"2018-07-28","stage_classifiercode":"99-16","member_number":"TY90372","first_name":"CLARK","last_name":"SMITH","classification":"B","division":"LIMITED","hit_factor":6.1538},{"match_name":"5 August - USPSA match - 17 South PSC","match_date":"2017-08-05","stage_classifiercode":"99-16","member_number":"Fy83548","first_name":"JEFF","last_name":"CHU","classification":"B","division":"LIMITED","hit_factor":6.1521},{"match_name":"WLPS USPSA Sep 2016","match_date":"2016-09-25","stage_classifiercode":"99-16","member_number":"A47064","first_name":"BOB","last_name":"JENSEN","classification":"A","division":"LIMITED","hit_factor":6.1469},{"match_name":"SWGC USPSA Pistol Match - December","match_date":"2016-12-03","stage_classifiercode":"99-16","member_number":"a62764","first_name":"TIM","last_name":"SELLERS","classification":"A","division":"LIMITED","hit_factor":6.1394},{"match_name":"RBGC 2017-10-21","match_date":"2017-10-21","stage_classifiercode":"99-16","member_number":"TY83004","first_name":"CASEY","last_name":"THERIOT","classification":"C","division":"LIMITED","hit_factor":6.1224},{"match_name":"CRC_20160514_SuperClassifier","match_date":"2016-05-14","stage_classifiercode":"99-16","member_number":"L3812","first_name":"STEVEN","last_name":"LICHON","classification":"B","division":"LIMITED","hit_factor":6.1162},{"match_name":"Pelham USPSA 2017-08-20","match_date":"2017-08-20","stage_classifiercode":"99-16","member_number":"TY73127","first_name":"SEAN","last_name":"JANICKI","classification":"M","division":"LIMITED","hit_factor":6.1157},{"match_name":"Emmett March Match","match_date":"2016-03-25","stage_classifiercode":"99-16","member_number":"a84532","first_name":"KENNY","last_name":"PLATT","classification":"M","division":"LIMITED","hit_factor":6.113},{"match_name":"RCPS USPSA 12 Nov 2016","match_date":"2016-11-12","stage_classifiercode":"99-16","member_number":"\"\"","first_name":"DAVID","last_name":"NALL","classification":"X","division":"LIMITED","hit_factor":6.0948},{"match_name":"Dundee USPSA Mar 2017","match_date":"2017-03-25","stage_classifiercode":"99-16","member_number":"L3452","first_name":"MARK","last_name":"GOSS","classification":"B","division":"LIMITED","hit_factor":6.0948},{"match_name":"EWPSA 2018-09","match_date":"2018-09-16","stage_classifiercode":"99-16","member_number":"TY82308","first_name":"CURT","last_name":"BERGER","classification":"M","division":"LIMITED","hit_factor":6.0936},{"match_name":"SPSA USPSA June 1st Sat Match","match_date":"2021-06-05","stage_classifiercode":"99-16","member_number":"A78495","first_name":"BILL","last_name":"KEULER","classification":"B","division":"LIMITED","hit_factor":6.0879},{"match_name":"SPSA USPSA December 1st Sat Match","match_date":"2016-12-03","stage_classifiercode":"99-16","member_number":"A92045","first_name":"RICHARD","last_name":"HIPP","classification":"C","division":"LIMITED","hit_factor":6.087},{"match_name":"CCPS March 2018 USPSA","match_date":"2018-03-18","stage_classifiercode":"99-16","member_number":"TY53551","first_name":"GREG","last_name":"BILLS","classification":"A","division":"LIMITED","hit_factor":6.087},{"match_name":"APSC USPSA Match 1-6-18","match_date":"2018-01-06","stage_classifiercode":"99-16","member_number":"\"\"","first_name":"JOHN","last_name":"FOO","classification":"U","division":"LIMITED","hit_factor":6.0827},{"match_name":"SWGC USPSA Pistol Match - December","match_date":"2016-12-03","stage_classifiercode":"99-16","member_number":"A-87132","first_name":"TONY","last_name":"BICHLER","classification":"C","division":"LIMITED","hit_factor":6.0797},{"match_name":"PCWC USPSA  1 28 17","match_date":"2017-01-28","stage_classifiercode":"99-16","member_number":"Ty52476","first_name":"JOHN","last_name":"TISCHLER","classification":"B","division":"LIMITED","hit_factor":6.0674},{"match_name":"Shadow Hawk Defense USPSA Special Classifier","match_date":"2020-11-14","stage_classifiercode":"99-16","member_number":"A108990","first_name":"ED","last_name":"KELLY","classification":"U","division":"LIMITED","hit_factor":6.0672},{"match_name":"MVPSA USPSA 7-7-18","match_date":"2018-07-07","stage_classifiercode":"99-16","member_number":"A84593","first_name":"JESSE","last_name":"POSELEY","classification":"A","division":"LIMITED","hit_factor":6.0653},{"match_name":"ENPS March 2017 USPSA Match","match_date":"2017-03-05","stage_classifiercode":"99-16","member_number":"\"\"","first_name":"JOSIAH","last_name":"WARREN","classification":"U","division":"LIMITED","hit_factor":6.0606},{"match_name":"Idaho ISPS August 5th Break from the Heat","match_date":"2017-08-05","stage_classifiercode":"99-16","member_number":"A71703","first_name":"DON","last_name":"MARTIN","classification":"B","division":"LIMITED","hit_factor":6.0573},{"match_name":"SFA USPSA NOVEMBER 14 2020","match_date":"2020-11-14","stage_classifiercode":"99-16","member_number":"TY114777","first_name":"BOB","last_name":"MORROW","classification":"C","division":"LIMITED","hit_factor":6.0543},{"match_name":"SPSA USPSA July 4th Sat match","match_date":"2018-07-28","stage_classifiercode":"99-16","member_number":"TY32558","first_name":"KEN","last_name":"TISDALE","classification":"M","division":"LIMITED","hit_factor":6.0543},{"match_name":"March 2016 USPSA Ponca CityMatch","match_date":"2016-03-12","stage_classifiercode":"99-16","member_number":"l2206","first_name":"SCOTT","last_name":"GRAVES","classification":"B","division":"LIMITED","hit_factor":6.051},{"match_name":"OK15 USPSA at USSA","match_date":"2016-12-11","stage_classifiercode":"99-16","member_number":"TY33925","first_name":"ROBAIRE SR","last_name":"PULLICAR","classification":"B","division":"LIMITED","hit_factor":6.0459},{"match_name":"Emmett March Match","match_date":"2016-03-25","stage_classifiercode":"99-16","member_number":"a84481","first_name":"DEREK","last_name":"POLLARD","classification":"A","division":"LIMITED","hit_factor":6.0307},{"match_name":"ENPS March 2017 USPSA Match","match_date":"2017-03-05","stage_classifiercode":"99-16","member_number":"A90387","first_name":"JOHN","last_name":"GASKO","classification":"C","division":"LIMITED","hit_factor":6.0291},{"match_name":"March 2016 USPSA Ponca CityMatch","match_date":"2016-03-12","stage_classifiercode":"99-16","member_number":"ty699","first_name":"STEVE","last_name":"OCHS","classification":"A","division":"LIMITED","hit_factor":6.0228},{"match_name":"USPSA MO21 Special Classifier 2Alpha SBRC February 27 2021","match_date":"2021-02-27","stage_classifiercode":"99-16","member_number":"A132351","first_name":"SHANNA","last_name":"DUCK","classification":"U","division":"LIMITED","hit_factor":5.9794},{"match_name":"DAP December 2015 Classifier match","match_date":"2015-12-12","stage_classifiercode":"99-16","member_number":"A93975","first_name":"STEPAN","last_name":"GENERALOV","classification":"none","division":"LIMITED","hit_factor":5.9794},{"match_name":"DWB - Deadwood Boys USPSA 20 May 2018","match_date":"2018-05-20","stage_classifiercode":"99-16","member_number":"ty47220","first_name":"MIKE","last_name":"LAZARUS","classification":"C","division":"LIMITED","hit_factor":5.9732},{"match_name":"Shasta Shooters September 2016","match_date":"2016-09-10","stage_classifiercode":"99-16","member_number":"A30368","first_name":"WAYNE","last_name":"FACCA","classification":"B","division":"LIMITED","hit_factor":5.9701},{"match_name":"TPS USPSA -  January 2017 - Talon Range","match_date":"2017-01-07","stage_classifiercode":"99-16","member_number":"A92510","first_name":"MARK","last_name":"RAICHE","classification":"B","division":"LIMITED","hit_factor":5.9686},{"match_name":"RCPS USPSA 12 Nov 2016","match_date":"2016-11-12","stage_classifiercode":"99-16","member_number":"\"\"","first_name":"RYAN","last_name":"NEWBERN","classification":"B","division":"LIMITED","hit_factor":5.9656},{"match_name":"Hosemasters 2nd Sunday May 2017","match_date":"2017-05-14","stage_classifiercode":"99-16","member_number":"TY95703","first_name":"GEORGE","last_name":"LOVE","classification":"B","division":"LIMITED","hit_factor":5.9656},{"match_name":"PRG-USPSA - Oh Shoot January 3rd - 1st Sunday","match_date":"2021-01-03","stage_classifiercode":"99-16","member_number":"A116257","first_name":"KEVIN","last_name":"WONG2","classification":"B","division":"LIMITED","hit_factor":5.9618},{"match_name":"USPSA MO21 Special Classifier 2Alpha SBRC February 27 2021","match_date":"2021-02-27","stage_classifiercode":"99-16","member_number":"A132351","first_name":"SHANNA","last_name":"DUCK","classification":"U","division":"LIMITED","hit_factor":5.9609},{"match_name":"LCSC USPSA 01.14.18","match_date":"2018-01-13","stage_classifiercode":"99-16","member_number":"TY91389","first_name":"RUSS","last_name":"BRIDGES","classification":"B","division":"LIMITED","hit_factor":5.9588},{"match_name":"Hernando Sportsmans Club","match_date":"2017-02-12","stage_classifiercode":"99-16","member_number":"TY52498","first_name":"SCOTTY","last_name":"HUBBARD","classification":"B","division":"LIMITED","hit_factor":5.9561},{"match_name":"Renton USPSA - August 2020 - NW05","match_date":"2020-08-23","stage_classifiercode":"99-16","member_number":"Ty92838","first_name":"GREG","last_name":"BECK","classification":"B","division":"LIMITED","hit_factor":5.9259},{"match_name":"Sharp Practical Shooters May USPSA Match","match_date":"2018-05-27","stage_classifiercode":"99-16","member_number":"TY21925","first_name":"WILL","last_name":"PARK","classification":"B","division":"LIMITED","hit_factor":5.9237},{"match_name":"Dundee USPSA Mar 2017","match_date":"2017-03-25","stage_classifiercode":"99-16","member_number":"a63197","first_name":"NEAL","last_name":"TANKSLEY","classification":"B","division":"LIMITED","hit_factor":5.9072},{"match_name":"Laser Ninja Dragon League MSA USPSA January 8th 2017","match_date":"2017-01-08","stage_classifiercode":"99-16","member_number":"A-99942","first_name":"JOHN","last_name":"MORRISON (LIMITED)","classification":"U","division":"LIMITED","hit_factor":5.9063},{"match_name":"ORSA USPSA July 2016 ","match_date":"2016-07-16","stage_classifiercode":"99-16","member_number":"A87027","first_name":"RALEIGH","last_name":"PRINCE","classification":"B","division":"LIMITED","hit_factor":5.9013},{"match_name":"SFA USPSA NOVEMBER 14 2020","match_date":"2020-11-14","stage_classifiercode":"99-16","member_number":"TY113849","first_name":"CHRIS","last_name":"NORFOLK","classification":"C","division":"LIMITED","hit_factor":5.8824},{"match_name":"CCPL 2 Day Match 2018","match_date":"2018-04-26","stage_classifiercode":"99-16","member_number":"TY90929","first_name":"JOHN","last_name":"DEVERE","classification":"A","division":"LIMITED","hit_factor":5.8824},{"match_name":"APSC USPSA Match 1-6-18","match_date":"2018-01-06","stage_classifiercode":"99-16","member_number":"\"\"","first_name":"JAKE","last_name":"SAENZ","classification":"U","division":"LIMITED","hit_factor":5.8764},{"match_name":"Pelham USPSA 2017-08-20","match_date":"2017-08-20","stage_classifiercode":"99-16","member_number":"A446","first_name":"DAN","last_name":"SIERPINA","classification":"B","division":"LIMITED","hit_factor":5.8648},{"match_name":"LGCSEMPS September 2017 Handgun","match_date":"2017-09-10","stage_classifiercode":"99-16","member_number":"A82217","first_name":"SCOTT","last_name":"JOHNSON","classification":"U","division":"LIMITED","hit_factor":5.8645},{"match_name":"OK15 USPSA at USSA","match_date":"2016-12-11","stage_classifiercode":"99-16","member_number":"A78550","first_name":"BILLY","last_name":"YORK","classification":"B","division":"LIMITED","hit_factor":5.859},{"match_name":"Briar Rabbit  June Match 2016 OH 20","match_date":"2016-06-12","stage_classifiercode":"99-16","member_number":"BD2207322DA2","first_name":"BRADY","last_name":"RICH","classification":"U","division":"LIMITED","hit_factor":5.8343},{"match_name":"DWB - Deadwood Boys USPSA 20 May 2018","match_date":"2018-05-20","stage_classifiercode":"99-16","member_number":"a59385","first_name":"SANDOR","last_name":"KOROSSY","classification":"B","division":"LIMITED","hit_factor":5.8273},{"match_name":"LGCSEMPS September 2017 Handgun","match_date":"2017-09-10","stage_classifiercode":"99-16","member_number":"TY85415","first_name":"SALAM","last_name":"FATOHI","classification":"C","division":"LIMITED","hit_factor":5.8252},{"match_name":"USPSA MO21 Special Classifier 2Alpha SBRC February 27 2021","match_date":"2021-02-27","stage_classifiercode":"99-16","member_number":"A117501","first_name":"ROD","last_name":"COLEMAN","classification":"C","division":"LIMITED","hit_factor":5.8252},{"match_name":"MVS ANPRACS Classifier Match 6/3/17","match_date":"2017-05-31","stage_classifiercode":"99-16","member_number":"A97714","first_name":"JUSTIN","last_name":"LARKIN","classification":"B","division":"LIMITED","hit_factor":5.8223},{"match_name":"LGCSEMPS September 2017 Handgun","match_date":"2017-09-10","stage_classifiercode":"99-16","member_number":"TY102288","first_name":"RICK","last_name":"ROSS","classification":"D","division":"LIMITED","hit_factor":5.8127},{"match_name":"RCPS USPSA Sep 11","match_date":"2021-09-11","stage_classifiercode":"99-16","member_number":"A65338","first_name":"JAMES","last_name":"CLARK","classification":"B","division":"LIMITED","hit_factor":5.8078},{"match_name":"Pima Pistol Club USPSA Match - May 29 ","match_date":"2016-05-29","stage_classifiercode":"99-16","member_number":"A63736","first_name":"KURT","last_name":"ARNOLD","classification":"B","division":"LIMITED","hit_factor":5.8047},{"match_name":"OK15 USPSA at USSA","match_date":"2016-12-11","stage_classifiercode":"99-16","member_number":"A20546","first_name":"JESS","last_name":"ANDERSON","classification":"M","division":"LIMITED","hit_factor":5.7884},{"match_name":"CRC_20160514_SuperClassifier","match_date":"2016-05-14","stage_classifiercode":"99-16","member_number":"A91485","first_name":"RYAN","last_name":"EMMITE","classification":"U","division":"LIMITED","hit_factor":5.7851},{"match_name":"Hernando Sportsmans Club","match_date":"2017-02-12","stage_classifiercode":"99-16","member_number":"A79995","first_name":"BRIAN","last_name":"MAULDIN","classification":"C","division":"LIMITED","hit_factor":5.7786},{"match_name":"HSC USPSA April 7th 2018","match_date":"2018-04-07","stage_classifiercode":"99-16","member_number":"ty40651","first_name":"RON","last_name":"RODGERS","classification":"B","division":"LIMITED","hit_factor":5.7732},{"match_name":"CCPS March 2018 USPSA","match_date":"2018-03-18","stage_classifiercode":"99-16","member_number":"TY61228","first_name":"RICK","last_name":"NICHOLSON","classification":"C","division":"LIMITED","hit_factor":5.7692},{"match_name":"Bass River USPSA September 2018","match_date":"2018-09-02","stage_classifiercode":"99-16","member_number":"\"\"","first_name":"DAN","last_name":"GRAFTON","classification":"\"\"","division":"LIMITED","hit_factor":5.7692},{"match_name":"SWGC USPSA Pistol Match - December","match_date":"2016-12-03","stage_classifiercode":"99-16","member_number":"A91756","first_name":"DAVID","last_name":"MARTON","classification":"B","division":"LIMITED","hit_factor":5.7654},{"match_name":"OK15 USPSA at USSA","match_date":"2016-12-11","stage_classifiercode":"99-16","member_number":"TY93213","first_name":"KEITH","last_name":"STEWART","classification":"C","division":"LIMITED","hit_factor":5.765},{"match_name":"ARPC USPSA Match 7-26-20","match_date":"2020-07-26","stage_classifiercode":"99-16","member_number":"A99557","first_name":"KIRK","last_name":"WRIGHT","classification":"B","division":"LIMITED","hit_factor":5.7582},{"match_name":"ARPC USPSA Match 3-26-17","match_date":"2017-03-26","stage_classifiercode":"99-16","member_number":"TY86060","first_name":"NANCHO","last_name":"RODRIGUEZ","classification":"B","division":"LIMITED","hit_factor":5.7546},{"match_name":"LGCSEMPS September 2017 Handgun","match_date":"2017-09-10","stage_classifiercode":"99-16","member_number":"TY77249","first_name":"ERIC","last_name":"SCHUTT","classification":"B","division":"LIMITED","hit_factor":5.7495},{"match_name":"HSC USPSA April 7th 2018","match_date":"2018-04-07","stage_classifiercode":"99-16","member_number":"ty40651","first_name":"RON","last_name":"RODGERS","classification":"B","division":"LIMITED","hit_factor":5.746},{"match_name":"PIPS 07-25-2018","match_date":"2018-07-25","stage_classifiercode":"99-16","member_number":"A103536","first_name":"SHAWN","last_name":"DONAHUE","classification":"C","division":"LIMITED","hit_factor":5.7449},{"match_name":"LdF USPSA Match September 23 2017","match_date":"2017-09-23","stage_classifiercode":"99-16","member_number":"TY82338","first_name":"AL","last_name":"WILLINGHAM","classification":"B","division":"LIMITED","hit_factor":5.7432},{"match_name":"March 2016 USPSA Ponca CityMatch","match_date":"2016-03-12","stage_classifiercode":"99-16","member_number":"ty47716","first_name":"ANTHONY","last_name":"NIXON","classification":"A","division":"LIMITED","hit_factor":5.7256},{"match_name":"CIPSC Havana July USPSA","match_date":"2018-07-07","stage_classifiercode":"99-16","member_number":"TY58309","first_name":"ERIC","last_name":"HENSON","classification":"B","division":"LIMITED","hit_factor":5.7255676209279},{"match_name":"PCWC USPSA  1 28 17","match_date":"2017-01-28","stage_classifiercode":"99-16","member_number":"ty63839","first_name":"BEN","last_name":"SMITH","classification":"C","division":"LIMITED","hit_factor":5.7172},{"match_name":"Laser Ninja Dragon League MSA USPSA January 8th 2017","match_date":"2017-01-08","stage_classifiercode":"99-16","member_number":"A-99689","first_name":"LONNY","last_name":"GUPTON","classification":"D","division":"LIMITED","hit_factor":5.7078},{"match_name":"BSPSC 2018 August Special Classifier","match_date":"2018-08-12","stage_classifiercode":"99-16","member_number":"A112781","first_name":"SHANE","last_name":"HOFF","classification":"U","division":"LIMITED","hit_factor":5.7026},{"match_name":"CCPS March 2018 USPSA","match_date":"2018-03-18","stage_classifiercode":"99-16","member_number":"A96146","first_name":"BEN","last_name":"DEHAEMERS","classification":"B","division":"LIMITED","hit_factor":5.7026},{"match_name":"Coyote Arms USPSA","match_date":"2016-09-17","stage_classifiercode":"99-16","member_number":"TY87616","first_name":"MITCH","last_name":"BARLOW","classification":"A","division":"LIMITED","hit_factor":5.6899},{"match_name":"Coyote Arms USPSA","match_date":"2016-09-17","stage_classifiercode":"99-16","member_number":"\"\"","first_name":"MIKE","last_name":"CATEORA","classification":"\"\"","division":"LIMITED","hit_factor":5.6805},{"match_name":"Laser Ninja Dragon League MSA USPSA January 8th 2017","match_date":"2017-01-08","stage_classifiercode":"99-16","member_number":"A75176","first_name":"TEAK-ALLEN","last_name":"BARRY","classification":"B","division":"LIMITED","hit_factor":5.6795},{"match_name":"Hosemasters 2nd Sunday May 2017","match_date":"2017-05-14","stage_classifiercode":"99-16","member_number":"A97078","first_name":"JIM","last_name":"CONNER","classification":"C","division":"LIMITED","hit_factor":5.6782},{"match_name":"LdF USPSA Match September 23 2017","match_date":"2017-09-23","stage_classifiercode":"99-16","member_number":"A104664","first_name":"IVAN","last_name":"SNEGIREV","classification":"U","division":"LIMITED","hit_factor":5.6671},{"match_name":"Pelham USPSA 2017-08-20","match_date":"2017-08-20","stage_classifiercode":"99-16","member_number":"A84331","first_name":"SCOTT","last_name":"HARRIS","classification":"D","division":"LIMITED","hit_factor":5.6566},{"match_name":"Briar Rabbit  June Match 2016 OH 20","match_date":"2016-06-12","stage_classifiercode":"99-16","member_number":"A84225","first_name":"MIKE","last_name":"WEST","classification":"B","division":"LIMITED","hit_factor":5.653},{"match_name":"ENPS March 2017 USPSA Match","match_date":"2017-03-05","stage_classifiercode":"99-16","member_number":"\"\"","first_name":"DENNIS","last_name":"KIRCHHOFF","classification":"U","division":"LIMITED","hit_factor":5.6522},{"match_name":"HSC USPSA April 7th 2018","match_date":"2018-04-07","stage_classifiercode":"99-16","member_number":"L4084","first_name":"KEVIN","last_name":"MCPHEE","classification":"B","division":"LIMITED","hit_factor":5.6309},{"match_name":"LdF USPSA Match September 23 2017","match_date":"2017-09-23","stage_classifiercode":"99-16","member_number":"PENDING","first_name":"MARIO","last_name":"FREITAS","classification":"U","division":"LIMITED","hit_factor":5.6306},{"match_name":"Nampa USPSA May 27th 2020 Classifier Match","match_date":"2020-05-27","stage_classifiercode":"99-16","member_number":"A104877","first_name":"GRIFFIN","last_name":"RULE","classification":"U","division":"LIMITED","hit_factor":5.6306},{"match_name":"MSSA Uspsa Club Matcg","match_date":"2017-09-24","stage_classifiercode":"99-16","member_number":"\"\"","first_name":"ADAM","last_name":"CAREY","classification":"U","division":"LIMITED","hit_factor":5.6285},{"match_name":"Sharp Practical Shooters May USPSA Match","match_date":"2018-05-27","stage_classifiercode":"99-16","member_number":"\"\"","first_name":"GENJURO","last_name":"QUALE","classification":"C","division":"LIMITED","hit_factor":5.6241},{"match_name":"OK15 USPSA at USSA","match_date":"2016-12-11","stage_classifiercode":"99-16","member_number":"A89709","first_name":"BRIAN","last_name":"SMITH","classification":"C","division":"LIMITED","hit_factor":5.6206},{"match_name":"PIPS 07-25-2018","match_date":"2018-07-25","stage_classifiercode":"99-16","member_number":"A81305","first_name":"DREW","last_name":"BECKMAN","classification":"B","division":"LIMITED","hit_factor":5.6133},{"match_name":"Shasta Shooters September 2016","match_date":"2016-09-10","stage_classifiercode":"99-16","member_number":"L2292","first_name":"JOEL","last_name":"NORTHRUP","classification":"M","division":"LIMITED","hit_factor":5.5804},{"match_name":"Coyote Arms USPSA","match_date":"2016-09-17","stage_classifiercode":"99-16","member_number":"L3849","first_name":"DARRELL","last_name":"HOLLAND","classification":"C","division":"LIMITED","hit_factor":5.5781},{"match_name":"SFA USPSA March 2017","match_date":"2017-03-18","stage_classifiercode":"99-16","member_number":"A91971","first_name":"LARRY","last_name":"SKINNER","classification":"C","division":"LIMITED","hit_factor":5.5777},{"match_name":"SWGC USPSA Pistol Match - December","match_date":"2016-12-03","stage_classifiercode":"99-16","member_number":"A90780","first_name":"RYAN","last_name":"CARVER","classification":"A","division":"LIMITED","hit_factor":5.5767},{"match_name":"DWB - Deadwood Boys USPSA 20 May 2018","match_date":"2018-05-20","stage_classifiercode":"99-16","member_number":"A103867","first_name":"DAVID","last_name":"ZHU","classification":"U","division":"LIMITED","hit_factor":5.5699},{"match_name":"Cameo USPSA Match March 20 2021","match_date":"2021-03-20","stage_classifiercode":"99-16","member_number":"A94946","first_name":"CLAY","last_name":"BUERGER","classification":"B","division":"LIMITED","hit_factor":5.5679},{"match_name":"Coyote Arms USPSA","match_date":"2016-09-17","stage_classifiercode":"99-16","member_number":"A86283","first_name":"MEL","last_name":"RODERO","classification":"B","division":"LIMITED","hit_factor":5.562},{"match_name":"SFA USPSA March 2017","match_date":"2017-03-18","stage_classifiercode":"99-16","member_number":"TY95061","first_name":"JOHN","last_name":"WOOTEN","classification":"U","division":"LIMITED","hit_factor":5.5617},{"match_name":"MPSA 101720 USPSA","match_date":"2020-10-17","stage_classifiercode":"99-16","member_number":"A37163","first_name":"LARRY","last_name":"HUFF","classification":"M","division":"LIMITED","hit_factor":5.5556},{"match_name":"SFPS 10-08-2017 USPSA match","match_date":"2017-10-08","stage_classifiercode":"99-16","member_number":"TY62740","first_name":"DAVE","last_name":"SOMMERS","classification":"B","division":"LIMITED","hit_factor":5.5503},{"match_name":"OREGON ARPC CC05 USPSA Jan 14 2017","match_date":"2017-01-14","stage_classifiercode":"99-16","member_number":"A87752","first_name":"JOANNE","last_name":"TEGTMEYER","classification":"B","division":"LIMITED","hit_factor":5.5502},{"match_name":"ENPS March 2017 USPSA Match","match_date":"2017-03-05","stage_classifiercode":"99-16","member_number":"A87521","first_name":"CODY","last_name":"WIDMAN","classification":"D","division":"LIMITED","hit_factor":5.5499},{"match_name":"PCWC USPSA  1 28 17","match_date":"2017-01-28","stage_classifiercode":"99-16","member_number":"TY64301","first_name":"WILL","last_name":"EBERLE","classification":"B","division":"LIMITED","hit_factor":5.5498},{"match_name":"LCSC USPSA 01.14.18","match_date":"2018-01-13","stage_classifiercode":"99-16","member_number":"\"\"","first_name":"JASON","last_name":"ORROCK","classification":"U","division":"LIMITED","hit_factor":5.5446},{"match_name":"Emmett March Match","match_date":"2016-03-25","stage_classifiercode":"99-16","member_number":"PEN","first_name":"SPENSER","last_name":"BUHLER","classification":"U","division":"LIMITED","hit_factor":5.5391},{"match_name":"Pima Pistol Club USPSA Match - May 29 ","match_date":"2016-05-29","stage_classifiercode":"99-16","member_number":"TY61723","first_name":"JUSTIN","last_name":"SLATER","classification":"C","division":"LIMITED","hit_factor":5.5324},{"match_name":"Range E11even October 2017","match_date":"2017-10-28","stage_classifiercode":"99-16","member_number":"A100125","first_name":"JOHN","last_name":"EDENS","classification":"C","division":"LIMITED","hit_factor":5.5319},{"match_name":"PCWC USPSA  1 28 17","match_date":"2017-01-28","stage_classifiercode":"99-16","member_number":"A87724","first_name":"TODD","last_name":"ADAMS","classification":"A","division":"LIMITED","hit_factor":5.5096},{"match_name":"Coyote Arms USPSA","match_date":"2016-09-17","stage_classifiercode":"99-16","member_number":"A92997","first_name":"ARMANDO","last_name":"HERRERA","classification":"C","division":"LIMITED","hit_factor":5.5066},{"match_name":"Emmett March Match","match_date":"2016-03-25","stage_classifiercode":"99-16","member_number":"a92669","first_name":"SCOTT","last_name":"VICKERS","classification":"C","division":"LIMITED","hit_factor":5.5046},{"match_name":"Cameo USPSA Match March 20 2021","match_date":"2021-03-20","stage_classifiercode":"99-16","member_number":"TY85349","first_name":"TROY","last_name":"DAVID","classification":"B","division":"LIMITED","hit_factor":5.5019},{"match_name":"Range E11even October 2017","match_date":"2017-10-28","stage_classifiercode":"99-16","member_number":"A93775","first_name":"JOHN","last_name":"WESTBROOK JR","classification":"C","division":"LIMITED","hit_factor":5.501},{"match_name":"ARPC USPSA Match 3-26-17","match_date":"2017-03-26","stage_classifiercode":"99-16","member_number":"TY73933","first_name":"JEFF","last_name":"MEYERS","classification":"Unclassified","division":"LIMITED","hit_factor":5.4978},{"match_name":"SPSA USPSA July 4th Sat match","match_date":"2018-07-28","stage_classifiercode":"99-16","member_number":"TY96072","first_name":"SCOTT","last_name":"FORTSON","classification":"C","division":"LIMITED","hit_factor":5.4966},{"match_name":"FLPSA MN14 USPSA May 17 2018","match_date":"2018-05-17","stage_classifiercode":"99-16","member_number":"TY3634","first_name":"GREGORY","last_name":"THOMAS","classification":"C","division":"LIMITED","hit_factor":5.4958},{"match_name":"4ta Fecha USPSA","match_date":"2018-04-07","stage_classifiercode":"99-16","member_number":"A92864","first_name":"EDWIN","last_name":"PEREZ","classification":"U","division":"LIMITED","hit_factor":5.4945},{"match_name":"LdF USPSA Match September 23 2017","match_date":"2017-09-23","stage_classifiercode":"99-16","member_number":"PENDING","first_name":"LEX","last_name":"BELTRAN","classification":"U","division":"LIMITED","hit_factor":5.4934},{"match_name":"Dundee USPSA Mar 2017","match_date":"2017-03-25","stage_classifiercode":"99-16","member_number":"\"\"","first_name":"KYLE","last_name":"SCHMIDT","classification":"U","division":"LIMITED","hit_factor":5.4934},{"match_name":"MVPSA USPSA 7-7-18","match_date":"2018-07-07","stage_classifiercode":"99-16","member_number":"A90710","first_name":"RICHARD","last_name":"PURCELL","classification":"B","division":"LIMITED","hit_factor":5.492},{"match_name":"SPSA USPSA July 4th Sat match","match_date":"2018-07-28","stage_classifiercode":"99-16","member_number":"TY78711","first_name":"JON","last_name":"WAKEMAN","classification":"C","division":"LIMITED","hit_factor":5.4885},{"match_name":"Superior Practical Shooters - March Match","match_date":"2017-03-01","stage_classifiercode":"99-16","member_number":"L4084","first_name":"KEVIN","last_name":"MCPHEE","classification":"C","division":"LIMITED","hit_factor":5.4872},{"match_name":"CIPSC Havana July USPSA","match_date":"2018-07-07","stage_classifiercode":"99-16","member_number":"TY94427","first_name":"CHRIS","last_name":"SMITH","classification":"C","division":"LIMITED","hit_factor":5.4852320675105},{"match_name":"USPSA Bass River April 2017","match_date":"2017-04-02","stage_classifiercode":"99-16","member_number":"PEN","first_name":"STEVE","last_name":"GOMES","classification":"\"\"","division":"LIMITED","hit_factor":5.4822},{"match_name":"SFPS 10-08-2017 USPSA match","match_date":"2017-10-08","stage_classifiercode":"99-16","member_number":"TY103448","first_name":"STEVE","last_name":"LAWSON","classification":"D","division":"LIMITED","hit_factor":5.4822},{"match_name":"SWGC USPSA Pistol Match - December","match_date":"2016-12-03","stage_classifiercode":"99-16","member_number":"TY71430","first_name":"JOSH","last_name":"WEEKS","classification":"M","division":"LIMITED","hit_factor":5.4808},{"match_name":"4ta Fecha USPSA","match_date":"2018-04-07","stage_classifiercode":"99-16","member_number":"A63950","first_name":"EFREN","last_name":"CAMACHO","classification":"A","division":"LIMITED","hit_factor":5.4769},{"match_name":"SPSA USPSA July 4th Sat match","match_date":"2018-07-28","stage_classifiercode":"99-16","member_number":"A60634","first_name":"MICHAEL","last_name":"SLAY","classification":"B","division":"LIMITED","hit_factor":5.4702},{"match_name":"Idaho ISPS August 5th Break from the Heat","match_date":"2017-08-05","stage_classifiercode":"99-16","member_number":"TY30712","first_name":"DENNIS","last_name":"WILSON","classification":"A","division":"LIMITED","hit_factor":5.4639},{"match_name":"4ta Fecha USPSA","match_date":"2018-04-07","stage_classifiercode":"99-16","member_number":"TYF82011","first_name":"GUILLERMO","last_name":"TORRUELLA","classification":"C","division":"LIMITED","hit_factor":5.4604},{"match_name":"Rio Grande Practical Shooters - May 2018","match_date":"2018-05-05","stage_classifiercode":"99-16","member_number":"TY89170","first_name":"DUDLEY","last_name":"IRBY","classification":"C","division":"LIMITED","hit_factor":5.4581},{"match_name":"SPSA USPSA June 1st Sat Match","match_date":"2021-06-05","stage_classifiercode":"99-16","member_number":"A125767","first_name":"JAKE","last_name":"NIERGARTH","classification":"B","division":"LIMITED","hit_factor":5.4519},{"match_name":"ORSA USPSA August 2020","match_date":"2020-08-15","stage_classifiercode":"99-16","member_number":"A124620","first_name":"SEAN","last_name":"HEARNE","classification":"C","division":"LIMITED","hit_factor":5.4509},{"match_name":"Superior Practical Shooters - March Match","match_date":"2017-03-01","stage_classifiercode":"99-16","member_number":"TY96561","first_name":"STEPHEN","last_name":"TO","classification":"U","division":"LIMITED","hit_factor":5.4496},{"match_name":"CIPSC Havana July USPSA","match_date":"2018-07-07","stage_classifiercode":"99-16","member_number":"TY49550","first_name":"CRAIG","last_name":"BERGMAN","classification":"B","division":"LIMITED","hit_factor":5.4478301015697},{"match_name":"NNRPA USPSA March 26th 2016","match_date":"2016-03-26","stage_classifiercode":"99-16","member_number":"\"\"","first_name":"JOSH","last_name":"YOUNG","classification":"C","division":"LIMITED","hit_factor":5.4475},{"match_name":"APSC USPSA Match 1-6-18","match_date":"2018-01-06","stage_classifiercode":"99-16","member_number":"\"\"","first_name":"KYLEIGH","last_name":"HAYWORTH","classification":"U","division":"LIMITED","hit_factor":5.4446},{"match_name":"LCSC USPSA 01.14.18","match_date":"2018-01-13","stage_classifiercode":"99-16","member_number":"A101653","first_name":"JONATHAN","last_name":"DIAZ","classification":"C","division":"LIMITED","hit_factor":5.4422},{"match_name":"CIPSC Havana July USPSA","match_date":"2018-07-07","stage_classifiercode":"99-16","member_number":"TY89535","first_name":"DENNIS","last_name":"RAINVILLE","classification":"C","division":"LIMITED","hit_factor":5.4389312977099},{"match_name":"Pima Pistol Club USPSA Match - May 29 ","match_date":"2016-05-29","stage_classifiercode":"99-16","member_number":"A90353","first_name":"TRAVIS","last_name":"MCCAMISH","classification":"A","division":"LIMITED","hit_factor":5.4377},{"match_name":"FLPSA MN14 USPSA May 17 2018","match_date":"2018-05-17","stage_classifiercode":"99-16","member_number":"Fy78025","first_name":"ROBERT","last_name":"STRANGE","classification":"M","division":"LIMITED","hit_factor":5.4363},{"match_name":"Sharp Practical Shooters May USPSA Match","match_date":"2018-05-27","stage_classifiercode":"99-16","member_number":"A89478","first_name":"DANIEL","last_name":"ASHE","classification":"C","division":"LIMITED","hit_factor":5.4328},{"match_name":"Idaho ISPS August 5th Break from the Heat","match_date":"2017-08-05","stage_classifiercode":"99-16","member_number":"TY82856","first_name":"JOHN","last_name":"KITSON","classification":"G","division":"LIMITED","hit_factor":5.4264},{"match_name":"Renton USPSA - August 2020 - NW05","match_date":"2020-08-23","stage_classifiercode":"99-16","member_number":"A110185","first_name":"RYAN","last_name":"HALWICK","classification":"B","division":"LIMITED","hit_factor":5.4226},{"match_name":"Pelham USPSA 2017-08-20","match_date":"2017-08-20","stage_classifiercode":"99-16","member_number":"A598","first_name":"KEN","last_name":"RUEFFERT","classification":"A","division":"LIMITED","hit_factor":5.4162},{"match_name":"ORSA USPSA August 2020","match_date":"2020-08-15","stage_classifiercode":"99-16","member_number":"TY117201","first_name":"ANDREW","last_name":"STURGILL","classification":"C","division":"LIMITED","hit_factor":5.4113},{"match_name":"PCWC USPSA  1 28 17","match_date":"2017-01-28","stage_classifiercode":"99-16","member_number":"a63200","first_name":"LOUIS","last_name":"WEAVER","classification":"C","division":"LIMITED","hit_factor":5.4108},{"match_name":"Pima Pistol Club USPSA Match - May 29 ","match_date":"2016-05-29","stage_classifiercode":"99-16","member_number":"\"\"","first_name":"MATTHEW","last_name":"CHUEY","classification":"U","division":"LIMITED","hit_factor":5.4108},{"match_name":"MS06 Team Magnolia USPSA January Match2","match_date":"2016-01-03","stage_classifiercode":"99-16","member_number":"A61700","first_name":"STEVE","last_name":"ROBERTS","classification":"B","division":"LIMITED","hit_factor":5.4104},{"match_name":"Flagstaff Fun Shoot September 15 2018","match_date":"2018-09-15","stage_classifiercode":"99-16","member_number":"Ty98159","first_name":"TOBY","last_name":"WALSH","classification":"\"\"","division":"LIMITED","hit_factor":5.4028},{"match_name":"Hosemasters 2nd Sunday May 2017","match_date":"2017-05-14","stage_classifiercode":"99-16","member_number":"TY87182","first_name":"MILTON","last_name":"MEANS","classification":"B","division":"LIMITED","hit_factor":5.4018},{"match_name":"SPSA USPSA December 1st Sat Match","match_date":"2016-12-03","stage_classifiercode":"99-16","member_number":"TY78960","first_name":"TIM","last_name":"FRITZ","classification":"C","division":"LIMITED","hit_factor":5.4002},{"match_name":"Dundee USPSA Mar 2017","match_date":"2017-03-25","stage_classifiercode":"99-16","member_number":"A96567","first_name":"ANDREW","last_name":"JORDON","classification":"D","division":"LIMITED","hit_factor":5.3998},{"match_name":"4ta Fecha USPSA","match_date":"2018-04-07","stage_classifiercode":"99-16","member_number":"F78832","first_name":"ERNESTO","last_name":"RODRIGUEZ","classification":"B","division":"LIMITED","hit_factor":5.3942},{"match_name":"Hosemasters 2nd Sunday May 2017","match_date":"2017-05-14","stage_classifiercode":"99-16","member_number":"A96985","first_name":"KEVIN","last_name":"HAGLUND","classification":"U","division":"LIMITED","hit_factor":5.3942},{"match_name":"RCPS USPSA 12 Nov 2016","match_date":"2016-11-12","stage_classifiercode":"99-16","member_number":"A35589","first_name":"TIM","last_name":"BOLDEN","classification":"C","division":"LIMITED","hit_factor":5.3853},{"match_name":"MVS ANPRACS Classifier Match 6/3/17","match_date":"2017-05-31","stage_classifiercode":"99-16","member_number":"A100631","first_name":"BRIAN","last_name":"HONG","classification":"\"\"","division":"LIMITED","hit_factor":5.3803},{"match_name":"CCPL 02-09-2020","match_date":"2020-02-09","stage_classifiercode":"99-16","member_number":"U","first_name":"SAL","last_name":"RODRIGUEZ","classification":"U","division":"LIMITED","hit_factor":5.379},{"match_name":"RBGC 2017-10-21","match_date":"2017-10-21","stage_classifiercode":"99-16","member_number":"FY70014","first_name":"KEITH","last_name":"HUNTER","classification":"U","division":"LIMITED","hit_factor":5.3743},{"match_name":"CRC_20160514_SuperClassifier","match_date":"2016-05-14","stage_classifiercode":"99-16","member_number":"TY89745","first_name":"GREGORY","last_name":"ROBINSON","classification":"C","division":"LIMITED","hit_factor":5.3664},{"match_name":"Briar Rabbit  June Match 2016 OH 20","match_date":"2016-06-12","stage_classifiercode":"99-16","member_number":"\"\"","first_name":"DAN","last_name":"BARTOK","classification":"X","division":"LIMITED","hit_factor":5.3654},{"match_name":"West Liberty USPSA Oct 2018","match_date":"2018-10-28","stage_classifiercode":"99-16","member_number":"TY38361","first_name":"IAN","last_name":"WICKE","classification":"B","division":"LIMITED","hit_factor":5.3636},{"match_name":"SPSA USPSA July 4th Sat match","match_date":"2018-07-28","stage_classifiercode":"99-16","member_number":"TY3777","first_name":"MIKE","last_name":"MORRIS","classification":"A","division":"LIMITED","hit_factor":5.3593},{"match_name":"SPSA USPSA July 4th Sat match","match_date":"2018-07-28","stage_classifiercode":"99-16","member_number":"A94849","first_name":"KENT","last_name":"SILVERTHORN","classification":"C","division":"LIMITED","hit_factor":5.3555},{"match_name":"EWPSA 2018-09","match_date":"2018-09-16","stage_classifiercode":"99-16","member_number":"\"\"","first_name":"ERIC","last_name":"DAMBERG","classification":"U","division":"LIMITED","hit_factor":5.3554},{"match_name":"Laser Ninja Dragon League MSA USPSA January 8th 2017","match_date":"2017-01-08","stage_classifiercode":"99-16","member_number":"A93137","first_name":"BILLY","last_name":"DODSON","classification":"A","division":"LIMITED","hit_factor":5.3548},{"match_name":"RCPS USPSA 12 Nov 2016","match_date":"2016-11-12","stage_classifiercode":"99-16","member_number":"A82868","first_name":"HEATH","last_name":"DAVIS","classification":"B","division":"LIMITED","hit_factor":5.3537},{"match_name":"Shasta Shooters 2020 Dec","match_date":"2020-12-12","stage_classifiercode":"99-16","member_number":"A127680","first_name":"EVEN","last_name":"ARTHUR","classification":"C","division":"LIMITED","hit_factor":5.3525},{"match_name":"Laser Ninja Dragon League MSA USPSA January 8th 2017","match_date":"2017-01-08","stage_classifiercode":"99-16","member_number":"A-98608","first_name":"DANIEL","last_name":"FLOWERS","classification":"U","division":"LIMITED","hit_factor":5.3486},{"match_name":"Idaho ISPS August 5th Break from the Heat","match_date":"2017-08-05","stage_classifiercode":"99-16","member_number":"TY87660","first_name":"ARIC","last_name":"TENEYCK","classification":"C","division":"LIMITED","hit_factor":5.3412},{"match_name":"TPS USPSA -  April 2018 Clone","match_date":"2018-04-08","stage_classifiercode":"99-16","member_number":"a99539","first_name":"KALEB","last_name":"CASEY","classification":"C","division":"LIMITED","hit_factor":5.3358},{"match_name":"SWGC USPSA Pistol Match - December","match_date":"2016-12-03","stage_classifiercode":"99-16","member_number":"L4114","first_name":"JEFF","last_name":"SMITH","classification":"A","division":"LIMITED","hit_factor":5.3191},{"match_name":"Hosemasters 2nd Sunday May 2017","match_date":"2017-05-14","stage_classifiercode":"99-16","member_number":"A49739","first_name":"ROBERT","last_name":"THORNE","classification":"B","division":"LIMITED","hit_factor":5.3115},{"match_name":"PIPS 07-25-2018","match_date":"2018-07-25","stage_classifiercode":"99-16","member_number":"A91025","first_name":"DICK","last_name":"ANNEKE","classification":"U","division":"LIMITED","hit_factor":5.3045},{"match_name":"4ta Fecha USPSA","match_date":"2018-04-07","stage_classifiercode":"99-16","member_number":"TY94373","first_name":"ROMAN","last_name":"SIFUENTES-PEREZ","classification":"B","division":"LIMITED","hit_factor":5.3015},{"match_name":"SPSA USPSA June 1st Sat Match","match_date":"2021-06-05","stage_classifiercode":"99-16","member_number":"A92582","first_name":"JEFF","last_name":"MANGLE","classification":"B","division":"LIMITED","hit_factor":5.3},{"match_name":"APSC USPSA Match 1-6-18","match_date":"2018-01-06","stage_classifiercode":"99-16","member_number":"A105812","first_name":"RILEY","last_name":"KROPFF","classification":"U","division":"LIMITED","hit_factor":5.2972},{"match_name":"CIPSC Havana July USPSA","match_date":"2018-07-07","stage_classifiercode":"99-16","member_number":"TY92908","first_name":"DAVID","last_name":"BURNS","classification":"M","division":"LIMITED","hit_factor":5.2966101694915},{"match_name":"2da Copa Nacional USPSA ","match_date":"2016-05-22","stage_classifiercode":"99-16","member_number":"\"\"","first_name":"JAVIER","last_name":"JIMENEZ-VAZQUEZ","classification":"U","division":"LIMITED","hit_factor":5.2953},{"match_name":"SFA USPSA March 2017","match_date":"2017-03-18","stage_classifiercode":"99-16","member_number":"A95925","first_name":"SCOTT","last_name":"ANDERSON","classification":"C","division":"LIMITED","hit_factor":5.2899},{"match_name":"PIPS 05-25-2016","match_date":"2016-05-24","stage_classifiercode":"99-16","member_number":"TY55156","first_name":"JON","last_name":"GALDE","classification":"B","division":"LIMITED","hit_factor":5.2859},{"match_name":"HSC USPSA April 7th 2018","match_date":"2018-04-07","stage_classifiercode":"99-16","member_number":"ty91964","first_name":"JACOB","last_name":"WILLSON","classification":"B","division":"LIMITED","hit_factor":5.2821},{"match_name":"PRG-USPSA - Oh Shoot January 3rd - 1st Sunday","match_date":"2021-01-03","stage_classifiercode":"99-16","member_number":"Ty97861","first_name":"BEN","last_name":"SCHULTE","classification":"B","division":"LIMITED","hit_factor":5.282},{"match_name":"SRAPS Amarillo Action May","match_date":"2016-05-28","stage_classifiercode":"99-16","member_number":"TY76134","first_name":"JOSH","last_name":"REID","classification":"A","division":"LIMITED","hit_factor":5.2792},{"match_name":"TPS USPSA -  January 2017 - Talon Range","match_date":"2017-01-07","stage_classifiercode":"99-16","member_number":"A77700","first_name":"BOB","last_name":"JONES","classification":"B","division":"LIMITED","hit_factor":5.2733},{"match_name":"CIPSC Havana July USPSA","match_date":"2018-07-07","stage_classifiercode":"99-16","member_number":"A62932","first_name":"RICHARD","last_name":"LANE","classification":"B","division":"LIMITED","hit_factor":5.2687038988409},{"match_name":"Pinetucky USPSA 02-27-16","match_date":"2016-02-27","stage_classifiercode":"99-16","member_number":"A91554","first_name":"MICHAEL","last_name":"ISHIDA","classification":"C","division":"LIMITED","hit_factor":5.2632},{"match_name":"2da Copa Nacional USPSA ","match_date":"2016-05-22","stage_classifiercode":"99-16","member_number":"A97029","first_name":"WALTER","last_name":"ALMODOVAR","classification":"U","division":"LIMITED","hit_factor":5.2632},{"match_name":"SPSA USPSA June 1st Sat Match","match_date":"2021-06-05","stage_classifiercode":"99-16","member_number":"TY90372","first_name":"CLARK","last_name":"SMITH","classification":"B","division":"LIMITED","hit_factor":5.2632},{"match_name":"Shasta Shooters September 2016","match_date":"2016-09-10","stage_classifiercode":"99-16","member_number":"TY72868","first_name":"BLAIR","last_name":"MASON","classification":"B","division":"LIMITED","hit_factor":5.2555},{"match_name":"CIPSC Havana July USPSA","match_date":"2018-07-07","stage_classifiercode":"99-16","member_number":"TY56034","first_name":"DAVE","last_name":"DIRKSMEYER","classification":"C","division":"LIMITED","hit_factor":5.2536231884058},{"match_name":"Maine Practical Shooters May 2017","match_date":"2017-05-13","stage_classifiercode":"99-16","member_number":"A96126","first_name":"LUKE","last_name":"HILTON","classification":"C","division":"LIMITED","hit_factor":5.2535},{"match_name":"Idaho ISPS August 5th Break from the Heat","match_date":"2017-08-05","stage_classifiercode":"99-16","member_number":"A81167","first_name":"KEN","last_name":"ADCOCK","classification":"U","division":"LIMITED","hit_factor":5.2533},{"match_name":"TPS USPSA -  April 2018 Clone","match_date":"2018-04-08","stage_classifiercode":"99-16","member_number":"\"\"","first_name":"DAVE","last_name":"MUELLER","classification":"M","division":"LIMITED","hit_factor":5.2486},{"match_name":"SPSA USPSA December 1st Sat Match","match_date":"2016-12-03","stage_classifiercode":"99-16","member_number":"TY39820","first_name":"MARK","last_name":"WAGNER","classification":"C","division":"LIMITED","hit_factor":5.2356},{"match_name":"SWGC USPSA Pistol Match - December","match_date":"2016-12-03","stage_classifiercode":"99-16","member_number":"TY77480","first_name":"GORDON","last_name":"SNADEN","classification":"B","division":"LIMITED","hit_factor":5.2295},{"match_name":"PIPS 05-25-2016","match_date":"2016-05-24","stage_classifiercode":"99-16","member_number":"A96637","first_name":"CHRIS","last_name":"INMAN","classification":"U","division":"LIMITED","hit_factor":5.2201},{"match_name":"Sharp Practical Shooters May USPSA Match","match_date":"2018-05-27","stage_classifiercode":"99-16","member_number":"A109805","first_name":"TANNER","last_name":"BOEVE","classification":"U","division":"LIMITED","hit_factor":5.2184},{"match_name":"Pelham USPSA 2017-08-20","match_date":"2017-08-20","stage_classifiercode":"99-16","member_number":"A104371","first_name":"DANE","last_name":"SPIELMAN","classification":"U","division":"LIMITED","hit_factor":5.2083},{"match_name":"SFPS 10-08-2017 USPSA match","match_date":"2017-10-08","stage_classifiercode":"99-16","member_number":"A96689","first_name":"ANDY","last_name":"ERICKSON","classification":"C","division":"LIMITED","hit_factor":5.2073},{"match_name":"Shasta Shooters 2020 Dec","match_date":"2020-12-12","stage_classifiercode":"99-16","member_number":"None","first_name":"JAY","last_name":"MCPEEK","classification":"U","division":"LIMITED","hit_factor":5.2023},{"match_name":"Sage Pistol League USPSA August 16 2020","match_date":"2020-08-16","stage_classifiercode":"99-16","member_number":"A27589","first_name":"SCOTT","last_name":"HAYMAN","classification":"B","division":"LIMITED","hit_factor":5.2012},{"match_name":"AVAP CLASSIFIER 71418","match_date":"2018-07-14","stage_classifiercode":"99-16","member_number":"TY86792","first_name":"MARVIN","last_name":"ESPINO","classification":"D","division":"LIMITED","hit_factor":5.1988},{"match_name":"PIPS 07-25-2018","match_date":"2018-07-25","stage_classifiercode":"99-16","member_number":"TY64637","first_name":"KEVIN","last_name":"COLLINS","classification":"B","division":"LIMITED","hit_factor":5.1965},{"match_name":"Shasta Shooters 2020 Dec","match_date":"2020-12-12","stage_classifiercode":"99-16","member_number":"A33123","first_name":"DAREN","last_name":"HUSA","classification":"B","division":"LIMITED","hit_factor":5.1935},{"match_name":"Hernando Sportsmans Club","match_date":"2017-02-12","stage_classifiercode":"99-16","member_number":"TY70818","first_name":"DALE","last_name":"FRAYSUR","classification":"C","division":"LIMITED","hit_factor":5.19},{"match_name":"HSC USPSA April 7th 2018","match_date":"2018-04-07","stage_classifiercode":"99-16","member_number":"A74936","first_name":"ROGER","last_name":"ELDER","classification":"B","division":"LIMITED","hit_factor":5.1896},{"match_name":"Nampa USPSA May 27th 2020 Classifier Match","match_date":"2020-05-27","stage_classifiercode":"99-16","member_number":"TY63273","first_name":"GREGG","last_name":"HARWOOD","classification":"C","division":"LIMITED","hit_factor":5.1887},{"match_name":"Hosemasters 2nd Sunday May 2017","match_date":"2017-05-14","stage_classifiercode":"99-16","member_number":"A77066","first_name":"MARCELO","last_name":"MARIANO","classification":"A","division":"LIMITED","hit_factor":5.1813},{"match_name":"MS06 Team Magnolia USPSA January Match2","match_date":"2016-01-03","stage_classifiercode":"99-16","member_number":"A86980","first_name":"BRYAN","last_name":"TULLOS","classification":"B","division":"LIMITED","hit_factor":5.1724},{"match_name":"SPSA USPSA July 4th Sat match","match_date":"2018-07-28","stage_classifiercode":"99-16","member_number":"L1583","first_name":"EDDIE","last_name":"WAGNER","classification":"B","division":"LIMITED","hit_factor":5.168},{"match_name":"PRG-USPSA - Oh Shoot January 3rd - 1st Sunday","match_date":"2021-01-03","stage_classifiercode":"99-16","member_number":"A81444","first_name":"JEFF","last_name":"GOFF","classification":"C","division":"LIMITED","hit_factor":5.1675},{"match_name":"Idaho ISPS August 5th Break from the Heat","match_date":"2017-08-05","stage_classifiercode":"99-16","member_number":"A96612","first_name":"DAN","last_name":"MEDLEY","classification":"C","division":"LIMITED","hit_factor":5.16},{"match_name":"BSPSC 2018 August Special Classifier","match_date":"2018-08-12","stage_classifiercode":"99-16","member_number":"A87383","first_name":"KEVIN","last_name":"OLEN","classification":"C","division":"LIMITED","hit_factor":5.157},{"match_name":"Pinetucky USPSA 02-27-16","match_date":"2016-02-27","stage_classifiercode":"99-16","member_number":"A90616","first_name":"ERIK","last_name":"JENSEN III","classification":"C","division":"LIMITED","hit_factor":5.1471},{"match_name":"Laser Ninja Dragon League MSA USPSA January 8th 2017","match_date":"2017-01-08","stage_classifiercode":"99-16","member_number":"NA","first_name":"JONATHON","last_name":"FLAKNE","classification":"U","division":"LIMITED","hit_factor":5.1471},{"match_name":"Shasta Shooters September 2016","match_date":"2016-09-10","stage_classifiercode":"99-16","member_number":"TY68537","first_name":"MARK","last_name":"BALL","classification":"C","division":"LIMITED","hit_factor":5.1458},{"match_name":"Emmett March Match","match_date":"2016-03-25","stage_classifiercode":"99-16","member_number":"\"\"","first_name":"RICH","last_name":"NIEMAN","classification":"U","division":"LIMITED","hit_factor":5.1434},{"match_name":"SWGC USPSA Pistol Match - December","match_date":"2016-12-03","stage_classifiercode":"99-16","member_number":"ty66753","first_name":"JIM","last_name":"DYSON","classification":"B","division":"LIMITED","hit_factor":5.1402},{"match_name":"SPSA USPSA July 4th Sat match","match_date":"2018-07-28","stage_classifiercode":"99-16","member_number":"A106507","first_name":"KEITH","last_name":"NAGELSKI","classification":"C","division":"LIMITED","hit_factor":5.138},{"match_name":"LdF USPSA Match September 23 2017","match_date":"2017-09-23","stage_classifiercode":"99-16","member_number":"L3960","first_name":"BRIAN","last_name":"GAYNOR","classification":"B","division":"LIMITED","hit_factor":5.136},{"match_name":"Grandbaggers 07/2017","match_date":"2017-07-06","stage_classifiercode":"99-16","member_number":"A97078","first_name":"JIM","last_name":"CONNER","classification":"C","division":"LIMITED","hit_factor":5.1342},{"match_name":"SWGC USPSA Pistol Match - December","match_date":"2016-12-03","stage_classifiercode":"99-16","member_number":"a82683","first_name":"BRIAN","last_name":"WOLFF","classification":"B","division":"LIMITED","hit_factor":5.1306},{"match_name":"SPSA USPSA December 1st Sat Match","match_date":"2016-12-03","stage_classifiercode":"99-16","member_number":"A82536","first_name":"BRAD","last_name":"BANKS","classification":"C","division":"LIMITED","hit_factor":5.125},{"match_name":"ENPS March 2017 USPSA Match","match_date":"2017-03-05","stage_classifiercode":"99-16","member_number":"TY44974","first_name":"RICHARD J","last_name":"SIMANDL","classification":"C","division":"LIMITED","hit_factor":5.1188},{"match_name":"WLPS June 2017","match_date":"2017-06-25","stage_classifiercode":"99-16","member_number":"\"\"","first_name":"JASON","last_name":"SMITH","classification":"U","division":"LIMITED","hit_factor":5.1142},{"match_name":"Emmett March Match","match_date":"2016-03-25","stage_classifiercode":"99-16","member_number":"a89431","first_name":"KYLE","last_name":"HARBISON","classification":"C","division":"LIMITED","hit_factor":5.104},{"match_name":"WLPS USPSA Sep 2016","match_date":"2016-09-25","stage_classifiercode":"99-16","member_number":"TY68680","first_name":"HERB","last_name":"MARTIN","classification":"B","division":"LIMITED","hit_factor":5.102},{"match_name":"LCSC USPSA 01.14.18","match_date":"2018-01-13","stage_classifiercode":"99-16","member_number":"A88072","first_name":"DOUG","last_name":"HOGUE","classification":"C","division":"LIMITED","hit_factor":5.1002},{"match_name":"Pelham USPSA 2017-08-20","match_date":"2017-08-20","stage_classifiercode":"99-16","member_number":"TY69179","first_name":"BEN","last_name":"LINEBERRY","classification":"C","division":"LIMITED","hit_factor":5.0984},{"match_name":"CRC_20160514_SuperClassifier","match_date":"2016-05-14","stage_classifiercode":"99-16","member_number":"A94756","first_name":"PAUL","last_name":"HAUSER","classification":"U","division":"LIMITED","hit_factor":5.0895},{"match_name":"Hernando Sportsmans Club","match_date":"2017-02-12","stage_classifiercode":"99-16","member_number":"A96288","first_name":"BRAD","last_name":"GEDDIE","classification":"U","division":"LIMITED","hit_factor":5.0881},{"match_name":"Pinetucky USPSA 02-27-16","match_date":"2016-02-27","stage_classifiercode":"99-16","member_number":"TY61427","first_name":"MICHAEL","last_name":"NYLAND","classification":"B","division":"LIMITED","hit_factor":5.0877},{"match_name":"WLPS USPSA Sep 2016","match_date":"2016-09-25","stage_classifiercode":"99-16","member_number":"TY38361","first_name":"IAN","last_name":"WICKE","classification":"B","division":"LIMITED","hit_factor":5.0847},{"match_name":"Cameo USPSA Match March 20 2021","match_date":"2021-03-20","stage_classifiercode":"99-16","member_number":"A71960","first_name":"ROBERT","last_name":"QUINN","classification":"B","division":"LIMITED","hit_factor":5.0847},{"match_name":"TPS USPSA -  April 2018 Clone","match_date":"2018-04-08","stage_classifiercode":"99-16","member_number":"A-103247","first_name":"GRANT","last_name":"BECK","classification":"C","division":"LIMITED","hit_factor":5.0833},{"match_name":"ENPS March 2017 USPSA Match","match_date":"2017-03-05","stage_classifiercode":"99-16","member_number":"A89115","first_name":"ERIC","last_name":"WHITE","classification":"U","division":"LIMITED","hit_factor":5.0833},{"match_name":"SPSA USPSA December 1st Sat Match","match_date":"2016-12-03","stage_classifiercode":"99-16","member_number":"TY81420","first_name":"TIM","last_name":"AGNER","classification":"C","division":"LIMITED","hit_factor":5.0832},{"match_name":"CIPSC Havana July USPSA","match_date":"2018-07-07","stage_classifiercode":"99-16","member_number":"FY47125","first_name":"KEVIN","last_name":"MONK","classification":"B","division":"LIMITED","hit_factor":5.0799623706491},{"match_name":"PTPC May 7th USPSA Match","match_date":"2017-05-07","stage_classifiercode":"99-16","member_number":"A96712","first_name":"JEFFREY","last_name":"JOHNSON","classification":"C","division":"LIMITED","hit_factor":5.0738},{"match_name":"USPSA Bass River April 2017","match_date":"2017-04-02","stage_classifiercode":"99-16","member_number":"A19435","first_name":"BOB","last_name":"WHITE","classification":"\"\"","division":"LIMITED","hit_factor":5.0718},{"match_name":"CIPSC Havana July USPSA","match_date":"2018-07-07","stage_classifiercode":"99-16","member_number":"A102630","first_name":"NATE","last_name":"POULSON","classification":"M","division":"LIMITED","hit_factor":5.0717703349282},{"match_name":"ORSA USPSA July 2016 ","match_date":"2016-07-16","stage_classifiercode":"99-16","member_number":"A90235","first_name":"KELLIE","last_name":"PRINCE","classification":"C","division":"LIMITED","hit_factor":5.0704},{"match_name":"Hosemasters 2nd Sunday May 2017","match_date":"2017-05-14","stage_classifiercode":"99-16","member_number":"A55572","first_name":"SHANE","last_name":"CELINO","classification":"B","division":"LIMITED","hit_factor":5.0649},{"match_name":"PRG-USPSA - Oh Shoot January 3rd - 1st Sunday","match_date":"2021-01-03","stage_classifiercode":"99-16","member_number":"A128913","first_name":"LUIS","last_name":"HUERTA","classification":"U","division":"LIMITED","hit_factor":5.0584},{"match_name":"MVPSA USPSA 7-7-18","match_date":"2018-07-07","stage_classifiercode":"99-16","member_number":"A103631","first_name":"MICHAEL","last_name":"COOPER","classification":"C","division":"LIMITED","hit_factor":5.0555},{"match_name":"Idaho ISPS August 5th Break from the Heat","match_date":"2017-08-05","stage_classifiercode":"99-16","member_number":"A73101","first_name":"RALPH","last_name":"GRIENINGER","classification":"B","division":"LIMITED","hit_factor":5.0542},{"match_name":"DWB - Deadwood Boys USPSA 20 May 2018","match_date":"2018-05-20","stage_classifiercode":"99-16","member_number":"\"\"","first_name":"KEVIN","last_name":"WONG","classification":"U","division":"LIMITED","hit_factor":5.0435},{"match_name":"PCWC USPSA  1 28 17","match_date":"2017-01-28","stage_classifiercode":"99-16","member_number":"a84845","first_name":"JOHN","last_name":"DELAMAR","classification":"U","division":"LIMITED","hit_factor":5.0251},{"match_name":"LCSC USPSA 01.14.18","match_date":"2018-01-13","stage_classifiercode":"99-16","member_number":"A63724","first_name":"CHRISTINE","last_name":"RIVLIN","classification":"C","division":"LIMITED","hit_factor":5.0233},{"match_name":"FLPSA MN14 USPSA May 17 2018","match_date":"2018-05-17","stage_classifiercode":"99-16","member_number":"TY65770","first_name":"BOB","last_name":"LINDER","classification":"C","division":"LIMITED","hit_factor":5.0224},{"match_name":"CCPL 2 Day Match 2018","match_date":"2018-04-26","stage_classifiercode":"99-16","member_number":"A86712","first_name":"CHRIS","last_name":"KIMES","classification":"A","division":"LIMITED","hit_factor":5.0189},{"match_name":"MvpNov2015","match_date":"2015-11-06","stage_classifiercode":"99-16","member_number":"ty20128","first_name":"GARY","last_name":"BALES","classification":"B","division":"LIMITED","hit_factor":5.017},{"match_name":"LGCSEMPS September 2017 Handgun","match_date":"2017-09-10","stage_classifiercode":"99-16","member_number":"\"\"","first_name":"KEVIN","last_name":"KRYDER","classification":"U","division":"LIMITED","hit_factor":5.0134},{"match_name":"ENPS March 2017 USPSA Match","match_date":"2017-03-05","stage_classifiercode":"99-16","member_number":"A50695","first_name":"TIM","last_name":"THOMAS","classification":"C","division":"LIMITED","hit_factor":5.013},{"match_name":"DWB - Deadwood Boys USPSA 20 May 2018","match_date":"2018-05-20","stage_classifiercode":"99-16","member_number":"A96882","first_name":"ROMMEL","last_name":"DEL ROSARIO","classification":"C","division":"LIMITED","hit_factor":5.0109},{"match_name":"DWB - Deadwood Boys USPSA 20 May 2018","match_date":"2018-05-20","stage_classifiercode":"99-16","member_number":"TY96556","first_name":"KEITH","last_name":"JUNG","classification":"C","division":"LIMITED","hit_factor":5},{"match_name":"ARPC USPSA Match 3-26-17","match_date":"2017-03-26","stage_classifiercode":"99-16","member_number":"A98873","first_name":"STEVEN","last_name":"FORREST","classification":"Unclassified","division":"LIMITED","hit_factor":5},{"match_name":"WLPS USPSA Sep 2016","match_date":"2016-09-25","stage_classifiercode":"99-16","member_number":"TY90436","first_name":"JAMES","last_name":"ALVAREZ","classification":"U","division":"LIMITED","hit_factor":4.9914},{"match_name":"Maine Practical Shooters May 2017","match_date":"2017-05-13","stage_classifiercode":"99-16","member_number":"A76493","first_name":"JUSTIN","last_name":"DRESCHER","classification":"U","division":"LIMITED","hit_factor":4.9904},{"match_name":"Pelham USPSA 2017-08-20","match_date":"2017-08-20","stage_classifiercode":"99-16","member_number":"TY78926","first_name":"BOB","last_name":"DZAMKO","classification":"C","division":"LIMITED","hit_factor":4.97},{"match_name":"Emmett March Match","match_date":"2016-03-25","stage_classifiercode":"99-16","member_number":"\"\"","first_name":"JARED","last_name":"FORNACHON","classification":"U","division":"LIMITED","hit_factor":4.9618},{"match_name":"SPSA USPSA June 1st Sat Match","match_date":"2021-06-05","stage_classifiercode":"99-16","member_number":"TY78125","first_name":"BRAD","last_name":"ARMSTRONG","classification":"C","division":"LIMITED","hit_factor":4.9601},{"match_name":"BRSP Tuesday Night USPSA Match - June 5","match_date":"2018-06-06","stage_classifiercode":"99-16","member_number":"A106443","first_name":"LYLE","last_name":"ROWE","classification":"D","division":"LIMITED","hit_factor":4.9601},{"match_name":"Shongum December 2017 USPSA Match","match_date":"2017-12-02","stage_classifiercode":"99-16","member_number":"A105603","first_name":"CHRIS","last_name":"WOOD","classification":"U","division":"LIMITED","hit_factor":4.9601},{"match_name":"LGCSEMPS September 2017 Handgun","match_date":"2017-09-10","stage_classifiercode":"99-16","member_number":"A96042","first_name":"BILL","last_name":"BRYANT","classification":"C","division":"LIMITED","hit_factor":4.9596},{"match_name":"RCPS USPSA Sep 11","match_date":"2021-09-11","stage_classifiercode":"99-16","member_number":"TY81767","first_name":"WILLIAM","last_name":"KODADEK","classification":"B","division":"LIMITED","hit_factor":4.9558},{"match_name":"ARPC USPSA Match 3-26-17","match_date":"2017-03-26","stage_classifiercode":"99-16","member_number":"TY41747","first_name":"GENE","last_name":"GHILARDI","classification":"B","division":"LIMITED","hit_factor":4.9522},{"match_name":"Pinetucky USPSA 02-27-16","match_date":"2016-02-27","stage_classifiercode":"99-16","member_number":"A26716","first_name":"BELL","last_name":"MIKE","classification":"B","division":"LIMITED","hit_factor":4.9412},{"match_name":"CRC_20160514_SuperClassifier","match_date":"2016-05-14","stage_classifiercode":"99-16","member_number":"A90490","first_name":"LEE","last_name":"SCHOENIKE","classification":"B","division":"LIMITED","hit_factor":4.9394},{"match_name":"March 2016 USPSA Ponca CityMatch","match_date":"2016-03-12","stage_classifiercode":"99-16","member_number":"a89882","first_name":"TRAVIS","last_name":"LOWRY","classification":"C","division":"LIMITED","hit_factor":4.9242},{"match_name":"Grandbaggers 07/2017","match_date":"2017-07-06","stage_classifiercode":"99-16","member_number":"TY101251","first_name":"TOM","last_name":"SHARP","classification":"U","division":"LIMITED","hit_factor":4.9223},{"match_name":"LdF USPSA Match September 23 2017","match_date":"2017-09-23","stage_classifiercode":"99-16","member_number":"TY80057","first_name":"CHRIS","last_name":"SOUSOUNIS","classification":"B","division":"LIMITED","hit_factor":4.9161},{"match_name":"Rio Grande Practical Shooters - May 2018","match_date":"2018-05-05","stage_classifiercode":"99-16","member_number":"A1405","first_name":"KEN","last_name":"SCOGGINS","classification":"B","division":"LIMITED","hit_factor":4.9145},{"match_name":"LGCSEMPS September 2017 Handgun","match_date":"2017-09-10","stage_classifiercode":"99-16","member_number":"\"\"","first_name":"ZACHARY","last_name":"BROWN","classification":"U","division":"LIMITED","hit_factor":4.8986},{"match_name":"MSSA Uspsa Club Matcg","match_date":"2017-09-24","stage_classifiercode":"99-16","member_number":"\"\"","first_name":"JAMES","last_name":"WADE","classification":"C","division":"LIMITED","hit_factor":4.8945},{"match_name":"Rio Grande Practical Shooters - May 2018","match_date":"2018-05-05","stage_classifiercode":"99-16","member_number":"A70486","first_name":"SCOTT","last_name":"TEARE","classification":"U","division":"LIMITED","hit_factor":4.883},{"match_name":"Flagstaff Fun Shoot September 15 2018","match_date":"2018-09-15","stage_classifiercode":"99-16","member_number":"TY82548","first_name":"TIM","last_name":"GALES","classification":"\"\"","division":"LIMITED","hit_factor":4.8738},{"match_name":"PCWC USPSA  1 28 17","match_date":"2017-01-28","stage_classifiercode":"99-16","member_number":"a84860","first_name":"MATT","last_name":"MAINWARING","classification":"C","division":"LIMITED","hit_factor":4.8699},{"match_name":"SFA USPSA March 2017","match_date":"2017-03-18","stage_classifiercode":"99-16","member_number":"A71335","first_name":"DAVE","last_name":"TOCKEY","classification":"C","division":"LIMITED","hit_factor":4.8617},{"match_name":"SRAPS Amarillo Action May","match_date":"2016-05-28","stage_classifiercode":"99-16","member_number":"A89689","first_name":"TRENTON","last_name":"GRANT","classification":"U","division":"LIMITED","hit_factor":4.8605},{"match_name":"BSPSC 2018 August Special Classifier","match_date":"2018-08-12","stage_classifiercode":"99-16","member_number":"A85423","first_name":"MIKE","last_name":"MOCABEE","classification":"C","division":"LIMITED","hit_factor":4.8579},{"match_name":"SPSA USPSA July 4th Sat match","match_date":"2018-07-28","stage_classifiercode":"99-16","member_number":"A6712","first_name":"PHILIP","last_name":"DEDMON","classification":"B","division":"LIMITED","hit_factor":4.8576},{"match_name":"ARPC USPSA Match 3-26-17","match_date":"2017-03-26","stage_classifiercode":"99-16","member_number":"A92234","first_name":"BOB","last_name":"KOKOTOVICH","classification":"D","division":"LIMITED","hit_factor":4.8574},{"match_name":"SWGC USPSA Pistol Match - December","match_date":"2016-12-03","stage_classifiercode":"99-16","member_number":"Ty39654","first_name":"LEE","last_name":"DENNEY","classification":"B","division":"LIMITED","hit_factor":4.8552},{"match_name":"PRG-USPSA - Oh Shoot January 3rd - 1st Sunday","match_date":"2021-01-03","stage_classifiercode":"99-16","member_number":"A116257","first_name":"KEVIN","last_name":"WONG","classification":"B","division":"LIMITED","hit_factor":4.8485},{"match_name":"Pinetucky USPSA 02-27-16","match_date":"2016-02-27","stage_classifiercode":"99-16","member_number":"A-91952","first_name":"PHILIP","last_name":"LEE","classification":"C","division":"LIMITED","hit_factor":4.8414},{"match_name":"Shasta Shooters 2020 Dec","match_date":"2020-12-12","stage_classifiercode":"99-16","member_number":"A102631","first_name":"RICK","last_name":"FREITAS","classification":"U","division":"LIMITED","hit_factor":4.8414},{"match_name":"CIPSC Havana July USPSA","match_date":"2018-07-07","stage_classifiercode":"99-16","member_number":"A59515","first_name":"DAVE","last_name":"WILLI","classification":"B","division":"LIMITED","hit_factor":4.8357664233577},{"match_name":"MS06 Team Magnolia USPSA January Match2","match_date":"2016-01-03","stage_classifiercode":"99-16","member_number":"A82324","first_name":"COREY","last_name":"MITCHELL","classification":"U","division":"LIMITED","hit_factor":4.8327},{"match_name":"Dundee USPSA Mar 2017","match_date":"2017-03-25","stage_classifiercode":"99-16","member_number":"A100695","first_name":"FLYNT","last_name":"WANNER","classification":"U","division":"LIMITED","hit_factor":4.8309},{"match_name":"CRC_20160514_SuperClassifier","match_date":"2016-05-14","stage_classifiercode":"99-16","member_number":"A94589","first_name":"JOE","last_name":"TREGENZA","classification":"U","division":"LIMITED","hit_factor":4.8234},{"match_name":"LdF USPSA Match September 23 2017","match_date":"2017-09-23","stage_classifiercode":"99-16","member_number":"TY95545","first_name":"ANDY","last_name":"ONGUN","classification":"C","division":"LIMITED","hit_factor":4.8159},{"match_name":"Flagstaff Fun Shoot September 15 2018","match_date":"2018-09-15","stage_classifiercode":"99-16","member_number":"L3214","first_name":"TOM","last_name":"CHESTERMAN","classification":"\"\"","division":"LIMITED","hit_factor":4.8148},{"match_name":"AVAP CLASSIFIER 71418","match_date":"2018-07-14","stage_classifiercode":"99-16","member_number":"\"\"","first_name":"VICTOR","last_name":"TRAN","classification":"U","division":"LIMITED","hit_factor":4.8128},{"match_name":"WLPS June 2017","match_date":"2017-06-25","stage_classifiercode":"99-16","member_number":"TY68680","first_name":"HERB","last_name":"MARTIN","classification":"B","division":"LIMITED","hit_factor":4.8085},{"match_name":"CIPSC Havana July USPSA","match_date":"2018-07-07","stage_classifiercode":"99-16","member_number":"NONE","first_name":"JOE","last_name":"SMITHERS","classification":"U","division":"LIMITED","hit_factor":4.8076923076923},{"match_name":"WLPS USPSA Sep 2016","match_date":"2016-09-25","stage_classifiercode":"99-16","member_number":"TY57083","first_name":"WILLIAM","last_name":"WILLSON","classification":"C","division":"LIMITED","hit_factor":4.8046},{"match_name":"RBGC 2017-10-21","match_date":"2017-10-21","stage_classifiercode":"99-16","member_number":"A84202","first_name":"DOUG","last_name":"RUTLEDGE","classification":"B","division":"LIMITED","hit_factor":4.8045},{"match_name":"WLPS June 2017","match_date":"2017-06-25","stage_classifiercode":"99-16","member_number":"\"\"","first_name":"KENT","last_name":"POWERS","classification":"U","division":"LIMITED","hit_factor":4.8026},{"match_name":"OREGON ARPC CC05 USPSA Jan 14 2017","match_date":"2017-01-14","stage_classifiercode":"99-16","member_number":"A98685","first_name":"ROB","last_name":"COATES","classification":"D","division":"LIMITED","hit_factor":4.7986},{"match_name":"Idaho ISPS August 5th Break from the Heat","match_date":"2017-08-05","stage_classifiercode":"99-16","member_number":"\"\"","first_name":"TREVER","last_name":"TOLMAN","classification":"U","division":"LIMITED","hit_factor":4.7934},{"match_name":"4ta Fecha USPSA","match_date":"2018-04-07","stage_classifiercode":"99-16","member_number":"\"\"","first_name":"JULIO","last_name":"RODRIGUEZ MOJICA","classification":"U","division":"LIMITED","hit_factor":4.7926},{"match_name":"MS06 Team Magnolia USPSA January Match2","match_date":"2016-01-03","stage_classifiercode":"99-16","member_number":"A80844","first_name":"ROBERT","last_name":"SUTTON","classification":"D","division":"LIMITED","hit_factor":4.7882},{"match_name":"ENPS March 2017 USPSA Match","match_date":"2017-03-05","stage_classifiercode":"99-16","member_number":"TY68981","first_name":"JOEL","last_name":"LUDWIG","classification":"B","division":"LIMITED","hit_factor":4.7859},{"match_name":"MSSA Uspsa Club Matcg","match_date":"2017-09-24","stage_classifiercode":"99-16","member_number":"A99095","first_name":"JASON","last_name":"PADAWER","classification":"\"\"","division":"LIMITED","hit_factor":4.7852},{"match_name":"CRC_20160514_SuperClassifier","match_date":"2016-05-14","stage_classifiercode":"99-16","member_number":"TY89745","first_name":"GREGORY","last_name":"ROBINSON","classification":"C","division":"LIMITED","hit_factor":4.7847},{"match_name":"West Liberty USPSA Oct 2018","match_date":"2018-10-28","stage_classifiercode":"99-16","member_number":"A108908","first_name":"SETH","last_name":"PATTERSON","classification":"U","division":"LIMITED","hit_factor":4.7761},{"match_name":"AIPS Weekly USPSA 3 August 2021","match_date":"2021-08-03","stage_classifiercode":"99-16","member_number":"FY48057","first_name":"EARL","last_name":"HILL","classification":"C","division":"LIMITED","hit_factor":4.7619},{"match_name":"MvpNov2015","match_date":"2015-11-06","stage_classifiercode":"99-16","member_number":"TY12239","first_name":"TONY","last_name":"BACA","classification":"B","division":"LIMITED","hit_factor":4.7579},{"match_name":"ENPS March 2017 USPSA Match","match_date":"2017-03-05","stage_classifiercode":"99-16","member_number":"PEN","first_name":"TYLER","last_name":"NITZ","classification":"U","division":"LIMITED","hit_factor":4.7572},{"match_name":"CIPSC Havana July USPSA","match_date":"2018-07-07","stage_classifiercode":"99-16","member_number":"A16729","first_name":"MICHAEL","last_name":"FARNIOK","classification":"A","division":"LIMITED","hit_factor":4.7563805104408},{"match_name":"CCPS March 2018 USPSA","match_date":"2018-03-18","stage_classifiercode":"99-16","member_number":"\"\"","first_name":"LYDIA","last_name":"PATERSON","classification":"U","division":"LIMITED","hit_factor":4.7535},{"match_name":"Sharp Practical Shooters May USPSA Match","match_date":"2018-05-27","stage_classifiercode":"99-16","member_number":"A-104426","first_name":"BILL","last_name":"TURNER","classification":"C","division":"LIMITED","hit_factor":4.7511},{"match_name":"PCWC USPSA  1 28 17","match_date":"2017-01-28","stage_classifiercode":"99-16","member_number":"\"\"","first_name":"JASON","last_name":"MADRE","classification":"U","division":"LIMITED","hit_factor":4.7478},{"match_name":"Pelham USPSA 2017-08-20","match_date":"2017-08-20","stage_classifiercode":"99-16","member_number":"\"\"","first_name":"BRIAN","last_name":"SANDS","classification":"Unclassified","division":"LIMITED","hit_factor":4.7466},{"match_name":"Range E11even October 2017","match_date":"2017-10-28","stage_classifiercode":"99-16","member_number":"TY80548","first_name":"DAN","last_name":"DOIRON","classification":"B","division":"LIMITED","hit_factor":4.7461},{"match_name":"RBGC 2017-10-21","match_date":"2017-10-21","stage_classifiercode":"99-16","member_number":"A100132","first_name":"CLINT","last_name":"BARNETT","classification":"C","division":"LIMITED","hit_factor":4.745},{"match_name":"SPSA USPSA December 1st Sat Match","match_date":"2016-12-03","stage_classifiercode":"99-16","member_number":"\"\"","first_name":"MATT","last_name":"GINN","classification":"U","division":"LIMITED","hit_factor":4.7445},{"match_name":"CRC_20160514_SuperClassifier","match_date":"2016-05-14","stage_classifiercode":"99-16","member_number":"A91942","first_name":"NATHAN","last_name":"VANCE","classification":"C","division":"LIMITED","hit_factor":4.7436},{"match_name":"ARPC USPSA Match 3-26-17","match_date":"2017-03-26","stage_classifiercode":"99-16","member_number":"A101680","first_name":"ROBERT","last_name":"TYLER","classification":"Unclassified","division":"LIMITED","hit_factor":4.7377},{"match_name":"ORSA USPSA August 2020","match_date":"2020-08-15","stage_classifiercode":"99-16","member_number":"A101662","first_name":"TRINA","last_name":"GREGORY","classification":"D","division":"LIMITED","hit_factor":4.7368},{"match_name":"SFA USPSA March 2017","match_date":"2017-03-18","stage_classifiercode":"99-16","member_number":"A86005","first_name":"RICH","last_name":"FRY","classification":"B","division":"LIMITED","hit_factor":4.7347},{"match_name":"SPSA USPSA December 1st Sat Match","match_date":"2016-12-03","stage_classifiercode":"99-16","member_number":"\"\"","first_name":"MARK","last_name":"SPAIN","classification":"U","division":"LIMITED","hit_factor":4.7342},{"match_name":"RBGC 2017-10-21","match_date":"2017-10-21","stage_classifiercode":"99-16","member_number":"A104394","first_name":"DAVID","last_name":"RAISSI","classification":"D","division":"LIMITED","hit_factor":4.7308},{"match_name":"BRSP Tuesday Night USPSA Match - June 5","match_date":"2018-06-06","stage_classifiercode":"99-16","member_number":"TY104105","first_name":"ERIC","last_name":"ABBOTT","classification":"U","division":"LIMITED","hit_factor":4.7297},{"match_name":"BORCC USPSA July 2018 Classifier Match","match_date":"2018-07-02","stage_classifiercode":"99-16","member_number":"A99883","first_name":"ANGELA","last_name":"SPALLA","classification":"U","division":"LIMITED","hit_factor":4.7297},{"match_name":"Pelham USPSA 2017-08-20","match_date":"2017-08-20","stage_classifiercode":"99-16","member_number":"\"\"","first_name":"DAVID","last_name":"SPIELMAN","classification":"Unclassified","division":"LIMITED","hit_factor":4.7185},{"match_name":"Pima Pistol Club USPSA Match - May 29 ","match_date":"2016-05-29","stage_classifiercode":"99-16","member_number":"A70334","first_name":"BRAD","last_name":"LOUIS","classification":"B","division":"LIMITED","hit_factor":4.712},{"match_name":"CIPSC Havana July USPSA","match_date":"2018-07-07","stage_classifiercode":"99-16","member_number":"A103339","first_name":"LEON","last_name":"OLIVER","classification":"C","division":"LIMITED","hit_factor":4.7095761381476},{"match_name":"ENPS March 2017 USPSA Match","match_date":"2017-03-05","stage_classifiercode":"99-16","member_number":"A96710","first_name":"ZACHARY","last_name":"BRODER","classification":"D","division":"LIMITED","hit_factor":4.7035},{"match_name":"DWB - Deadwood Boys USPSA 20 May 2018","match_date":"2018-05-20","stage_classifiercode":"99-16","member_number":"TY75469","first_name":"OSCAR","last_name":"ACENCIO","classification":"C","division":"LIMITED","hit_factor":4.698},{"match_name":"CCPL 02-09-2020","match_date":"2020-02-09","stage_classifiercode":"99-16","member_number":"A114756","first_name":"NORMAN","last_name":"PABLO","classification":"B","division":"LIMITED","hit_factor":4.6968},{"match_name":"West Liberty USPSA Oct 2018","match_date":"2018-10-28","stage_classifiercode":"99-16","member_number":"A50601","first_name":"JASON","last_name":"ROSS","classification":"B","division":"LIMITED","hit_factor":4.6964},{"match_name":"Dundee USPSA Mar 2017","match_date":"2017-03-25","stage_classifiercode":"99-16","member_number":"A87653","first_name":"DENNIS","last_name":"OHEARN","classification":"U","division":"LIMITED","hit_factor":4.694},{"match_name":"HSC USPSA April 7th 2018","match_date":"2018-04-07","stage_classifiercode":"99-16","member_number":"A74936","first_name":"ROGER","last_name":"ELDER","classification":"B","division":"LIMITED","hit_factor":4.69},{"match_name":"CCPL 2 Day Match 2018","match_date":"2018-04-26","stage_classifiercode":"99-16","member_number":"\"\"","first_name":"JIM","last_name":"ADLER","classification":"B","division":"LIMITED","hit_factor":4.6804},{"match_name":"ENPS March 2017 USPSA Match","match_date":"2017-03-05","stage_classifiercode":"99-16","member_number":"A74964","first_name":"TRACY","last_name":"ALDRICH","classification":"C","division":"LIMITED","hit_factor":4.6753},{"match_name":"Shasta Shooters September 2016","match_date":"2016-09-10","stage_classifiercode":"99-16","member_number":"98571","first_name":"SHAWN","last_name":"ANSTINE","classification":"U","division":"LIMITED","hit_factor":4.6667},{"match_name":"LGCSEMPS September 2017 Handgun","match_date":"2017-09-10","stage_classifiercode":"99-16","member_number":"FY99375","first_name":"GREG","last_name":"STONE","classification":"C","division":"LIMITED","hit_factor":4.6661},{"match_name":"CCPL 2 Day Match 2018","match_date":"2018-04-26","stage_classifiercode":"99-16","member_number":"TY75163","first_name":"MIKE","last_name":"LILJEROOS","classification":"B","division":"LIMITED","hit_factor":4.6651},{"match_name":"SFPS 10-08-2017 USPSA match","match_date":"2017-10-08","stage_classifiercode":"99-16","member_number":"PEN","first_name":"TYLER","last_name":"MEESTER","classification":"C","division":"LIMITED","hit_factor":4.6552},{"match_name":"PCWC USPSA  1 28 17","match_date":"2017-01-28","stage_classifiercode":"99-16","member_number":"TY-63269","first_name":"JAY","last_name":"HAGGARD","classification":"A","division":"LIMITED","hit_factor":4.6533},{"match_name":"SWGC USPSA Pistol Match - December","match_date":"2016-12-03","stage_classifiercode":"99-16","member_number":"A-93396","first_name":"MICHAEL","last_name":"COSTLEY","classification":"C","division":"LIMITED","hit_factor":4.6422},{"match_name":"Briar Rabbit  June Match 2016 OH 20","match_date":"2016-06-12","stage_classifiercode":"99-16","member_number":"A95785","first_name":"KEVIN","last_name":"MILLER","classification":"D","division":"LIMITED","hit_factor":4.642},{"match_name":"Briar Rabbit  June Match 2016 OH 20","match_date":"2016-06-12","stage_classifiercode":"99-16","member_number":"\"\"","first_name":"JOE","last_name":"FINCK","classification":"U","division":"LIMITED","hit_factor":4.6332},{"match_name":"APSC USPSA Match 1-6-18","match_date":"2018-01-06","stage_classifiercode":"99-16","member_number":"A103016","first_name":"ROBERT","last_name":"BUI","classification":"C","division":"LIMITED","hit_factor":4.6287},{"match_name":"TPS USPSA -  January 2017 - Talon Range","match_date":"2017-01-07","stage_classifiercode":"99-16","member_number":"A-97274","first_name":"MATTHEW","last_name":"PAREDES","classification":"U","division":"LIMITED","hit_factor":4.6218},{"match_name":"LGCSEMPS September 2017 Handgun","match_date":"2017-09-10","stage_classifiercode":"99-16","member_number":"\"\"","first_name":"ZAK","last_name":"BAER","classification":"U","division":"LIMITED","hit_factor":4.6211},{"match_name":"CCPL 02-09-2020","match_date":"2020-02-09","stage_classifiercode":"99-16","member_number":"A100211","first_name":"PAUL","last_name":"CHETWOOD","classification":"B","division":"LIMITED","hit_factor":4.6154},{"match_name":"MS06 Team Magnolia USPSA January Match2","match_date":"2016-01-03","stage_classifiercode":"99-16","member_number":"TY71097","first_name":"CHRIS","last_name":"BAUCUM","classification":"B","division":"LIMITED","hit_factor":4.6117},{"match_name":"SPSA USPSA December 1st Sat Match","match_date":"2016-12-03","stage_classifiercode":"99-16","member_number":"A78495","first_name":"BILL","last_name":"KEULER","classification":"B","division":"LIMITED","hit_factor":4.6117},{"match_name":"CRC_20160514_SuperClassifier","match_date":"2016-05-14","stage_classifiercode":"99-16","member_number":"A73453","first_name":"MIKE","last_name":"WILLEY","classification":"D","division":"LIMITED","hit_factor":4.6075},{"match_name":"Shongum December 2017 USPSA Match","match_date":"2017-12-02","stage_classifiercode":"99-16","member_number":"Ty88100","first_name":"JOE","last_name":"PISANO","classification":"C","division":"LIMITED","hit_factor":4.6025},{"match_name":"Hosemasters 2nd Sunday May 2017","match_date":"2017-05-14","stage_classifiercode":"99-16","member_number":"TY22856","first_name":"JOE","last_name":"WHEELER","classification":"X","division":"LIMITED","hit_factor":4.5959},{"match_name":"SFPS 10-08-2017 USPSA match","match_date":"2017-10-08","stage_classifiercode":"99-16","member_number":"TY87041","first_name":"DIRK","last_name":"DEIGHTON","classification":"C","division":"LIMITED","hit_factor":4.5936},{"match_name":"CRC_20160514_SuperClassifier","match_date":"2016-05-14","stage_classifiercode":"99-16","member_number":"A91942","first_name":"NATHAN","last_name":"VANCE","classification":"C","division":"LIMITED","hit_factor":4.5913},{"match_name":"RCPS USPSA 12 Nov 2016","match_date":"2016-11-12","stage_classifiercode":"99-16","member_number":"TY87967","first_name":"GARY","last_name":"HYDE","classification":"C","division":"LIMITED","hit_factor":4.5902},{"match_name":"2da Copa Nacional USPSA ","match_date":"2016-05-22","stage_classifiercode":"99-16","member_number":"F78832","first_name":"ERNESTO","last_name":"RODRIGUEZ","classification":"C","division":"LIMITED","hit_factor":4.5896},{"match_name":"PCWC USPSA  1 28 17","match_date":"2017-01-28","stage_classifiercode":"99-16","member_number":"A69371","first_name":"PAUL","last_name":"SHOVER","classification":"C","division":"LIMITED","hit_factor":4.5894},{"match_name":"CCPL 02-09-2020","match_date":"2020-02-09","stage_classifiercode":"99-16","member_number":"A111370","first_name":"MING","last_name":"TANG","classification":"C","division":"LIMITED","hit_factor":4.5887},{"match_name":"RCPS USPSA Sep 11","match_date":"2021-09-11","stage_classifiercode":"99-16","member_number":"A133183","first_name":"JODY","last_name":"SMITH","classification":"U","division":"LIMITED","hit_factor":4.5872},{"match_name":"MVPSA USPSA 7-7-18","match_date":"2018-07-07","stage_classifiercode":"99-16","member_number":"TY97549","first_name":"ERIC","last_name":"HERZOG","classification":"B","division":"LIMITED","hit_factor":4.5777},{"match_name":"RBGC 2017-10-21","match_date":"2017-10-21","stage_classifiercode":"99-16","member_number":"TY71518","first_name":"CABOT","last_name":"HARRINGTON","classification":"B","division":"LIMITED","hit_factor":4.5775},{"match_name":"RCPS USPSA 12 Nov 2016","match_date":"2016-11-12","stage_classifiercode":"99-16","member_number":"\"\"","first_name":"BRANDON","last_name":"HALL","classification":"X","division":"LIMITED","hit_factor":4.577},{"match_name":"CRC_20160514_SuperClassifier","match_date":"2016-05-14","stage_classifiercode":"99-16","member_number":"A96328","first_name":"PAUL","last_name":"GREGORY","classification":"U","division":"LIMITED","hit_factor":4.5579},{"match_name":"Hosemasters 2nd Sunday May 2017","match_date":"2017-05-14","stage_classifiercode":"99-16","member_number":"TY100245","first_name":"CHRISTOPHER","last_name":"NOLAN","classification":"U","division":"LIMITED","hit_factor":4.5562},{"match_name":"CRC_20160514_SuperClassifier","match_date":"2016-05-14","stage_classifiercode":"99-16","member_number":"A96669","first_name":"MARK","last_name":"WILLIAMS","classification":"U","division":"LIMITED","hit_factor":4.5494},{"match_name":"Coyote Arms USPSA","match_date":"2016-09-17","stage_classifiercode":"99-16","member_number":"A85241","first_name":"JEFF","last_name":"WILLIAMS","classification":"C","division":"LIMITED","hit_factor":4.5455},{"match_name":"LCSC USPSA 01.14.18","match_date":"2018-01-13","stage_classifiercode":"99-16","member_number":"\"\"","first_name":"GEORGE","last_name":"MINORI","classification":"U","division":"LIMITED","hit_factor":4.5455},{"match_name":"Shongum December 2017 USPSA Match","match_date":"2017-12-02","stage_classifiercode":"99-16","member_number":"Ty82166","first_name":"HOWARD","last_name":"SCHOENBERGER","classification":"C","division":"LIMITED","hit_factor":4.5378},{"match_name":"Maine Practical Shooters May 2017","match_date":"2017-05-13","stage_classifiercode":"99-16","member_number":"L3959","first_name":"LEONARD","last_name":"CABANA","classification":"C","division":"LIMITED","hit_factor":4.535},{"match_name":"Dundee USPSA Mar 2017","match_date":"2017-03-25","stage_classifiercode":"99-16","member_number":"\"\"","first_name":"SHAWN","last_name":"TAYLOR","classification":"U","division":"LIMITED","hit_factor":4.534},{"match_name":"Pinetucky USPSA 02-27-16","match_date":"2016-02-27","stage_classifiercode":"99-16","member_number":"\"\"","first_name":"MALCOLM","last_name":"LEWIS","classification":"X","division":"LIMITED","hit_factor":4.5299},{"match_name":"LCSC USPSA 01.14.18","match_date":"2018-01-13","stage_classifiercode":"99-16","member_number":"A105494","first_name":"JACOB","last_name":"GEIBIG","classification":"C","division":"LIMITED","hit_factor":4.5217},{"match_name":"ARPC USPSA Match 7-26-20","match_date":"2020-07-26","stage_classifiercode":"99-16","member_number":"NA","first_name":"DON","last_name":"MCDONALD","classification":"Unclassified","division":"LIMITED","hit_factor":4.5178},{"match_name":"SPSA USPSA December 1st Sat Match","match_date":"2016-12-03","stage_classifiercode":"99-16","member_number":"A97527","first_name":"JED","last_name":"MERCER","classification":"B","division":"LIMITED","hit_factor":4.5147},{"match_name":"Pima Pistol Club USPSA Match - May 29 ","match_date":"2016-05-29","stage_classifiercode":"99-16","member_number":"A77066","first_name":"MARCELO","last_name":"MARIANO III","classification":"A","division":"LIMITED","hit_factor":4.5075},{"match_name":"SPSA USPSA July 4th Sat match","match_date":"2018-07-28","stage_classifiercode":"99-16","member_number":"A108779","first_name":"DARRELL","last_name":"BISHOP","classification":"C","division":"LIMITED","hit_factor":4.5055},{"match_name":"Flagstaff Fun Shoot September 15 2018","match_date":"2018-09-15","stage_classifiercode":"99-16","member_number":"a107615","first_name":"CHRIS","last_name":"NOORDA","classification":"\"\"","division":"LIMITED","hit_factor":4.5045},{"match_name":"Pinetucky USPSA 02-27-16","match_date":"2016-02-27","stage_classifiercode":"99-16","member_number":"A90372","first_name":"CLARK","last_name":"SMITH","classification":"C","division":"LIMITED","hit_factor":4.4971},{"match_name":"USPSA MO21 Special Classifier 2Alpha SBRC February 27 2021","match_date":"2021-02-27","stage_classifiercode":"99-16","member_number":"A51402","first_name":"DOC (WAYNE)","last_name":"WELSHER","classification":"B","division":"LIMITED","hit_factor":4.4961},{"match_name":"Pelham USPSA 2017-08-20","match_date":"2017-08-20","stage_classifiercode":"99-16","member_number":"A96745","first_name":"NATHANIAL","last_name":"BALLEW","classification":"C","division":"LIMITED","hit_factor":4.4924},{"match_name":"SPSA USPSA July 4th Sat match","match_date":"2018-07-28","stage_classifiercode":"99-16","member_number":"FY104137","first_name":"DARRYL","last_name":"FLOWERS","classification":"C","division":"LIMITED","hit_factor":4.4908},{"match_name":"CCPL 2 Day Match 2018","match_date":"2018-04-26","stage_classifiercode":"99-16","member_number":"TY87922","first_name":"EDWARD","last_name":"VIERRA","classification":"U","division":"LIMITED","hit_factor":4.4907},{"match_name":"WLPS June 2017","match_date":"2017-06-25","stage_classifiercode":"99-16","member_number":"A98767","first_name":"MIKE","last_name":"WALKER","classification":"C","division":"LIMITED","hit_factor":4.4892},{"match_name":"Dundee USPSA Mar 2017","match_date":"2017-03-25","stage_classifiercode":"99-16","member_number":"TY98534","first_name":"CLIFF","last_name":"WRIGHT","classification":"D","division":"LIMITED","hit_factor":4.4822},{"match_name":"Emmett March Match","match_date":"2016-03-25","stage_classifiercode":"99-16","member_number":"a83721","first_name":"MIKE","last_name":"MALONE","classification":"C","division":"LIMITED","hit_factor":4.4792},{"match_name":"March 2016 USPSA Ponca CityMatch","match_date":"2016-03-12","stage_classifiercode":"99-16","member_number":"a53547","first_name":"ARIEL","last_name":"NIXON","classification":"D","division":"LIMITED","hit_factor":4.4776},{"match_name":"MVPSA USPSA 7-7-18","match_date":"2018-07-07","stage_classifiercode":"99-16","member_number":"A99084","first_name":"RILEY","last_name":"WARD","classification":"D","division":"LIMITED","hit_factor":4.475},{"match_name":"PCWC USPSA  1 28 17","match_date":"2017-01-28","stage_classifiercode":"99-16","member_number":"A88928","first_name":"JOSEPH","last_name":"HERBERT 111","classification":"B","division":"LIMITED","hit_factor":4.4693},{"match_name":"Idaho ISPS August 5th Break from the Heat","match_date":"2017-08-05","stage_classifiercode":"99-16","member_number":"TY93831","first_name":"SUSAN","last_name":"QUINT","classification":"C","division":"LIMITED","hit_factor":4.4693},{"match_name":"RCPS USPSA 12 Nov 2016","match_date":"2016-11-12","stage_classifiercode":"99-16","member_number":"TY72046","first_name":"PETER M","last_name":"HUTTON","classification":"C","division":"LIMITED","hit_factor":4.4674},{"match_name":"BRSP Tuesday Night USPSA Match - June 5","match_date":"2018-06-06","stage_classifiercode":"99-16","member_number":"A104784","first_name":"CODY","last_name":"HOLLAND","classification":"C","division":"LIMITED","hit_factor":4.4665},{"match_name":"LGCSEMPS September 2017 Handgun","match_date":"2017-09-10","stage_classifiercode":"99-16","member_number":"\"\"","first_name":"JUSTIN","last_name":"SUMMERS","classification":"U","division":"LIMITED","hit_factor":4.4628},{"match_name":"SWGC USPSA Pistol Match - December","match_date":"2016-12-03","stage_classifiercode":"99-16","member_number":"A84845","first_name":"JOHN","last_name":"DELAMAR","classification":"U","division":"LIMITED","hit_factor":4.4574},{"match_name":"USPSA MO21 Special Classifier 2Alpha SBRC February 27 2021","match_date":"2021-02-27","stage_classifiercode":"99-16","member_number":"A110966","first_name":"TROY","last_name":"POTTER","classification":"B","division":"LIMITED","hit_factor":4.4554},{"match_name":"Sharp Practical Shooters May USPSA Match","match_date":"2018-05-27","stage_classifiercode":"99-16","member_number":"\"\"","first_name":"DESMOND","last_name":"GUIDA","classification":"U","division":"LIMITED","hit_factor":4.4527},{"match_name":"CIPSC Havana July USPSA","match_date":"2018-07-07","stage_classifiercode":"99-16","member_number":"A96810","first_name":"JASON","last_name":"PALMER","classification":"B","division":"LIMITED","hit_factor":4.4500419815281},{"match_name":"Briar Rabbit  June Match 2016 OH 20","match_date":"2016-06-12","stage_classifiercode":"99-16","member_number":"A88674","first_name":"STAN","last_name":"WATSON","classification":"C","division":"LIMITED","hit_factor":4.4444},{"match_name":"WLPS June 2017","match_date":"2017-06-25","stage_classifiercode":"99-16","member_number":"TY38361","first_name":"IAN","last_name":"WICKE","classification":"B","division":"LIMITED","hit_factor":4.4444},{"match_name":"FLPSA MN14 USPSA May 17 2018","match_date":"2018-05-17","stage_classifiercode":"99-16","member_number":"\"\"","first_name":"ADAM","last_name":"JANITSCHKE","classification":"U","division":"LIMITED","hit_factor":4.4423},{"match_name":"CRC_20160514_SuperClassifier","match_date":"2016-05-14","stage_classifiercode":"99-16","member_number":"A84517","first_name":"JOHN","last_name":"CHAPPELL","classification":"D","division":"LIMITED","hit_factor":4.4371},{"match_name":"SPSA USPSA December 1st Sat Match","match_date":"2016-12-03","stage_classifiercode":"99-16","member_number":"A96050","first_name":"MIKE","last_name":"GINN","classification":"B","division":"LIMITED","hit_factor":4.4346},{"match_name":"Shongum April 2016 Pistol Match","match_date":"2016-04-02","stage_classifiercode":"99-16","member_number":"A74770","first_name":"JASON","last_name":"BEDIONES","classification":"U","division":"LIMITED","hit_factor":4.4323},{"match_name":"SPSA USPSA December 1st Sat Match","match_date":"2016-12-03","stage_classifiercode":"99-16","member_number":"A90559","first_name":"IKE","last_name":"STARNES","classification":"B","division":"LIMITED","hit_factor":4.4318},{"match_name":"USPSA Bass River April 2017","match_date":"2017-04-02","stage_classifiercode":"99-16","member_number":"A43588","first_name":"DENNIS","last_name":"GARANT","classification":"\"\"","division":"LIMITED","hit_factor":4.4262},{"match_name":"Pelham USPSA 2017-08-20","match_date":"2017-08-20","stage_classifiercode":"99-16","member_number":"A605254","first_name":"MICHAEL","last_name":"PAN","classification":"Unclassified","division":"LIMITED","hit_factor":4.4218},{"match_name":"Sage Pistol League USPSA August 16 2020","match_date":"2020-08-16","stage_classifiercode":"99-16","member_number":"TY109719","first_name":"GARY","last_name":"WICENSKI","classification":"U","division":"LIMITED","hit_factor":4.4207},{"match_name":"EWPSA 2018-09","match_date":"2018-09-16","stage_classifiercode":"99-16","member_number":"\"\"","first_name":"RYAN","last_name":"ROSENTHAL","classification":"U","division":"LIMITED","hit_factor":4.4143},{"match_name":"SPSA USPSA June 1st Sat Match","match_date":"2021-06-05","stage_classifiercode":"99-16","member_number":"TY79557","first_name":"DAVE","last_name":"PAYNE","classification":"C","division":"LIMITED","hit_factor":4.4141},{"match_name":"NCPL 2016 July","match_date":"2016-07-31","stage_classifiercode":"99-16","member_number":"A30368","first_name":"WAYNE","last_name":"FACCA","classification":"B","division":"LIMITED","hit_factor":4.4131},{"match_name":"PCWC USPSA  1 28 17","match_date":"2017-01-28","stage_classifiercode":"99-16","member_number":"A49560","first_name":"LACY","last_name":"LOCKLEAR","classification":"C","division":"LIMITED","hit_factor":4.4118},{"match_name":"CRC_20160514_SuperClassifier","match_date":"2016-05-14","stage_classifiercode":"99-16","member_number":"A87911","first_name":"KEITH","last_name":"MARKEY","classification":"B","division":"LIMITED","hit_factor":4.4101},{"match_name":"ENPS March 2017 USPSA Match","match_date":"2017-03-05","stage_classifiercode":"99-16","member_number":"PEN","first_name":"ALLEN","last_name":"MCCREA","classification":"U","division":"LIMITED","hit_factor":4.4068},{"match_name":"Dundee USPSA Mar 2017","match_date":"2017-03-25","stage_classifiercode":"99-16","member_number":"A99370","first_name":"JARRETT","last_name":"COLEMAN","classification":"B","division":"LIMITED","hit_factor":4.4057},{"match_name":"Idaho ISPS August 5th Break from the Heat","match_date":"2017-08-05","stage_classifiercode":"99-16","member_number":"A80263","first_name":"STEVE","last_name":"HARRIS","classification":"B","division":"LIMITED","hit_factor":4.4053},{"match_name":"ENPS March 2017 USPSA Match","match_date":"2017-03-05","stage_classifiercode":"99-16","member_number":"A91511","first_name":"DANIEL","last_name":"WIDMAN","classification":"C","division":"LIMITED","hit_factor":4.4039},{"match_name":"Laser Ninja Dragon League MSA USPSA January 8th 2017","match_date":"2017-01-08","stage_classifiercode":"99-16","member_number":"\"\"","first_name":"KLATE","last_name":"GRAHAM","classification":"U","division":"LIMITED","hit_factor":4.3876},{"match_name":"SPSA USPSA July 4th Sat match","match_date":"2018-07-28","stage_classifiercode":"99-16","member_number":"\"\"","first_name":"CHRIS","last_name":"VAKOC","classification":"U","division":"LIMITED","hit_factor":4.3771},{"match_name":"CCPL 02-09-2020","match_date":"2020-02-09","stage_classifiercode":"99-16","member_number":"A115731","first_name":"DONALD","last_name":"DIAZ","classification":"D","division":"LIMITED","hit_factor":4.3697},{"match_name":"Idaho ISPS August 5th Break from the Heat","match_date":"2017-08-05","stage_classifiercode":"99-16","member_number":"A97567","first_name":"JARED","last_name":"FORNACHON","classification":"C","division":"LIMITED","hit_factor":4.3668},{"match_name":"Idaho ISPS August 5th Break from the Heat","match_date":"2017-08-05","stage_classifiercode":"99-16","member_number":"A104578","first_name":"DOUG","last_name":"ADAMS","classification":"U","division":"LIMITED","hit_factor":4.3663},{"match_name":"Hosemasters 2nd Sunday May 2017","match_date":"2017-05-14","stage_classifiercode":"99-16","member_number":"TY96346","first_name":"CHRIS","last_name":"STADLER","classification":"U","division":"LIMITED","hit_factor":4.358},{"match_name":"Dundee USPSA Mar 2017","match_date":"2017-03-25","stage_classifiercode":"99-16","member_number":"PEN","first_name":"DAVE","last_name":"OATHES","classification":"U","division":"LIMITED","hit_factor":4.3564},{"match_name":"ORSA USPSA July 2016 ","match_date":"2016-07-16","stage_classifiercode":"99-16","member_number":"NONE","first_name":"NICK","last_name":"SHORTER","classification":"U","division":"LIMITED","hit_factor":4.3478},{"match_name":"PIPS 07-25-2018","match_date":"2018-07-25","stage_classifiercode":"99-16","member_number":"A102576","first_name":"MEL","last_name":"BEHNKE","classification":"C","division":"LIMITED","hit_factor":4.3478},{"match_name":"BSPSC 2018 August Special Classifier","match_date":"2018-08-12","stage_classifiercode":"99-16","member_number":"A111439","first_name":"CHARLENE","last_name":"MARTIN","classification":"C","division":"LIMITED","hit_factor":4.3403},{"match_name":"DWB - Deadwood Boys USPSA 20 May 2018","match_date":"2018-05-20","stage_classifiercode":"99-16","member_number":"\"\"","first_name":"JAMES","last_name":"KENNEDY","classification":"U","division":"LIMITED","hit_factor":4.3381},{"match_name":"Range E11even October 2017","match_date":"2017-10-28","stage_classifiercode":"99-16","member_number":"TY82683","first_name":"BRIAN","last_name":"WOLFF","classification":"B","division":"LIMITED","hit_factor":4.3337},{"match_name":"CCPL 2 Day Match 2018","match_date":"2018-04-26","stage_classifiercode":"99-16","member_number":"\"\"","first_name":"JEFFERSON","last_name":"CAMARCE","classification":"U","division":"LIMITED","hit_factor":4.3301},{"match_name":"SPSA USPSA June 1st Sat Match","match_date":"2021-06-05","stage_classifiercode":"99-16","member_number":"TY88089","first_name":"DAVID","last_name":"BURTON","classification":"B","division":"LIMITED","hit_factor":4.3299},{"match_name":"Hosemasters 2nd Sunday May 2017","match_date":"2017-05-14","stage_classifiercode":"99-16","member_number":"TY99718","first_name":"CHRISTOPHER","last_name":"CAMPBELL","classification":"C","division":"LIMITED","hit_factor":4.3215},{"match_name":"Shongum April 2016 Pistol Match","match_date":"2016-04-02","stage_classifiercode":"99-16","member_number":"A88971","first_name":"TOM","last_name":"FORAN III","classification":"D","division":"LIMITED","hit_factor":4.3171},{"match_name":"RCPS USPSA 12 Nov 2016","match_date":"2016-11-12","stage_classifiercode":"99-16","member_number":"A95298","first_name":"JAMES","last_name":"PALMER","classification":"U","division":"LIMITED","hit_factor":4.3149},{"match_name":"Hosemasters 2nd Sunday May 2017","match_date":"2017-05-14","stage_classifiercode":"99-16","member_number":"A89241","first_name":"KENDALL","last_name":"ERETH","classification":"C","division":"LIMITED","hit_factor":4.3116},{"match_name":"HRC Jul 08 2017","match_date":"2017-07-07","stage_classifiercode":"99-16","member_number":"A84948","first_name":"ANDREW","last_name":"HOLBROOK","classification":"U","division":"LIMITED","hit_factor":4.3113},{"match_name":"Superior Practical Shooters - March Match","match_date":"2017-03-01","stage_classifiercode":"99-16","member_number":"A95764","first_name":"DEAN","last_name":"L'HOSTE","classification":"U","division":"LIMITED","hit_factor":4.3103},{"match_name":"Pinetucky USPSA 02-27-16","match_date":"2016-02-27","stage_classifiercode":"99-16","member_number":"A33671","first_name":"MARK","last_name":"SULLIVAN","classification":"B","division":"LIMITED","hit_factor":4.3054},{"match_name":"Shongum December 2017 USPSA Match","match_date":"2017-12-02","stage_classifiercode":"99-16","member_number":"A81786","first_name":"DONALD","last_name":"CAMPBELL","classification":"C","division":"LIMITED","hit_factor":4.3036},{"match_name":"ORSA USPSA July 2016 ","match_date":"2016-07-16","stage_classifiercode":"99-16","member_number":"\"\"","first_name":"JAMES","last_name":"ABERCROMBIE","classification":"U","division":"LIMITED","hit_factor":4.2992},{"match_name":"MCPSL Pistol 10-9-2021","match_date":"2021-10-09","stage_classifiercode":"99-16","member_number":"FY122854","first_name":"MIKE","last_name":"COTT","classification":"B","division":"LIMITED","hit_factor":4.2973},{"match_name":"SPSA USPSA December 1st Sat Match","match_date":"2016-12-03","stage_classifiercode":"99-16","member_number":"\"\"","first_name":"ERICK","last_name":"SWANGER","classification":"U","division":"LIMITED","hit_factor":4.2951},{"match_name":"Sharp Practical Shooters May USPSA Match","match_date":"2018-05-27","stage_classifiercode":"99-16","member_number":"A111024","first_name":"JESSE","last_name":"CAMPBELL","classification":"U","division":"LIMITED","hit_factor":4.2932},{"match_name":"Pinetucky USPSA 02-27-16","match_date":"2016-02-27","stage_classifiercode":"99-16","member_number":"A-92653","first_name":"DANE","last_name":"TROYER","classification":"U","division":"LIMITED","hit_factor":4.2796},{"match_name":"Pinetucky USPSA 02-27-16","match_date":"2016-02-27","stage_classifiercode":"99-16","member_number":"A92538","first_name":"HANS","last_name":"BIRNBRICH","classification":"C","division":"LIMITED","hit_factor":4.2781},{"match_name":"MCPSL Pistol 10-9-2021","match_date":"2021-10-09","stage_classifiercode":"99-16","member_number":"L1479","first_name":"SCOTT","last_name":"ROSS","classification":"B","division":"LIMITED","hit_factor":4.2751},{"match_name":"DAP December 2015 Classifier match","match_date":"2015-12-12","stage_classifiercode":"99-16","member_number":"A90077","first_name":"DOUGLAS","last_name":"TELLEF","classification":"U","division":"LIMITED","hit_factor":4.2689},{"match_name":"MvpNov2015","match_date":"2015-11-06","stage_classifiercode":"99-16","member_number":"\"\"","first_name":"ROGER","last_name":"CLAEPS","classification":"U","division":"LIMITED","hit_factor":4.2683},{"match_name":"2da Copa Nacional USPSA ","match_date":"2016-05-22","stage_classifiercode":"99-16","member_number":"\"\"","first_name":"EDWIN","last_name":"PEREZ","classification":"B","division":"LIMITED","hit_factor":4.2647},{"match_name":"SPSA USPSA December 1st Sat Match","match_date":"2016-12-03","stage_classifiercode":"99-16","member_number":"\"\"","first_name":"ROBERT","last_name":"HUMPHRIES","classification":"U","division":"LIMITED","hit_factor":4.2636},{"match_name":"Pinetucky USPSA 02-27-16","match_date":"2016-02-27","stage_classifiercode":"99-16","member_number":"\"\"","first_name":"TYLER","last_name":"BUSSEY","classification":"X","division":"LIMITED","hit_factor":4.2629},{"match_name":"Hernando Sportsmans Club","match_date":"2017-02-12","stage_classifiercode":"99-16","member_number":"A100811","first_name":"PAUL","last_name":"MINNICH","classification":"U","division":"LIMITED","hit_factor":4.2553},{"match_name":"DAP December 2015 Classifier match","match_date":"2015-12-12","stage_classifiercode":"99-16","member_number":"A81430","first_name":"PAUL","last_name":"VALMORES","classification":"U","division":"LIMITED","hit_factor":4.2553},{"match_name":"Hosemasters 2nd Sunday May 2017","match_date":"2017-05-14","stage_classifiercode":"99-16","member_number":"A47027","first_name":"JACK","last_name":"JOHNSTON","classification":"C","division":"LIMITED","hit_factor":4.2446},{"match_name":"BORCC USPSA July 2018 Classifier Match","match_date":"2018-07-02","stage_classifiercode":"99-16","member_number":"A89246","first_name":"LARRY","last_name":"FRANCIS","classification":"C","division":"LIMITED","hit_factor":4.2418},{"match_name":"Bass River USPSA September 2018","match_date":"2018-09-02","stage_classifiercode":"99-16","member_number":"TY77782","first_name":"JOSEPH","last_name":"TUCKER","classification":"\"\"","division":"LIMITED","hit_factor":4.2398},{"match_name":"Idaho ISPS August 5th Break from the Heat","match_date":"2017-08-05","stage_classifiercode":"99-16","member_number":"A81094","first_name":"NATHAN","last_name":"HART","classification":"U","division":"LIMITED","hit_factor":4.2398},{"match_name":"Hosemasters 2nd Sunday May 2017","match_date":"2017-05-14","stage_classifiercode":"99-16","member_number":"A47374","first_name":"JOEY","last_name":"ORTIZ","classification":"C","division":"LIMITED","hit_factor":4.2385},{"match_name":"SWGC USPSA Pistol Match - December","match_date":"2016-12-03","stage_classifiercode":"99-16","member_number":"A87724","first_name":"TODD","last_name":"ADAMS","classification":"A","division":"LIMITED","hit_factor":4.2286},{"match_name":"SPSA USPSA December 1st Sat Match","match_date":"2016-12-03","stage_classifiercode":"99-16","member_number":"A88634","first_name":"KEN","last_name":"KILLI","classification":"B","division":"LIMITED","hit_factor":4.2269},{"match_name":"Hosemasters 2nd Sunday May 2017","match_date":"2017-05-14","stage_classifiercode":"99-16","member_number":"TY22852","first_name":"DEBBIE","last_name":"KEEHART","classification":"B","division":"LIMITED","hit_factor":4.2268},{"match_name":"March 2016 USPSA Ponca CityMatch","match_date":"2016-03-12","stage_classifiercode":"99-16","member_number":"a90087","first_name":"RICHARD","last_name":"TYLER","classification":"U","division":"LIMITED","hit_factor":4.2243},{"match_name":"Bass River USPSA September 2018","match_date":"2018-09-02","stage_classifiercode":"99-16","member_number":"L4376","first_name":"JON","last_name":"GREENE","classification":"\"\"","division":"LIMITED","hit_factor":4.223},{"match_name":"Rio Grande Practical Shooters - May 2018","match_date":"2018-05-05","stage_classifiercode":"99-16","member_number":"TY52764","first_name":"DAVID","last_name":"MERTES","classification":"B","division":"LIMITED","hit_factor":4.222},{"match_name":"SPSA USPSA December 1st Sat Match","match_date":"2016-12-03","stage_classifiercode":"99-16","member_number":"\"\"","first_name":"BUSTER","last_name":"COCHRANE","classification":"C","division":"LIMITED","hit_factor":4.2208},{"match_name":"PCWC USPSA  1 28 17","match_date":"2017-01-28","stage_classifiercode":"99-16","member_number":"A95502","first_name":"CHRIS","last_name":"VARLEY","classification":"C","division":"LIMITED","hit_factor":4.2202},{"match_name":"ARPC USPSA Match 3-26-17","match_date":"2017-03-26","stage_classifiercode":"99-16","member_number":"A92354","first_name":"ROBERT","last_name":"PUCKETT","classification":"C","division":"LIMITED","hit_factor":4.2084},{"match_name":"ARPC USPSA Match 7-26-20","match_date":"2020-07-26","stage_classifiercode":"99-16","member_number":"A95803","first_name":"ANDY","last_name":"OLWIG","classification":"B","division":"LIMITED","hit_factor":4.1958},{"match_name":"2da Copa Nacional USPSA ","match_date":"2016-05-22","stage_classifiercode":"99-16","member_number":"A85595","first_name":"FERNANDO","last_name":"RODRIGUEZ","classification":"D","division":"LIMITED","hit_factor":4.1921},{"match_name":"SPSA USPSA July 4th Sat match","match_date":"2018-07-28","stage_classifiercode":"99-16","member_number":"TY83413","first_name":"DOUG","last_name":"HARDING","classification":"B","division":"LIMITED","hit_factor":4.1893},{"match_name":"Emmett March Match","match_date":"2016-03-25","stage_classifiercode":"99-16","member_number":"a88427","first_name":"CASEY","last_name":"RYAN","classification":"D","division":"LIMITED","hit_factor":4.1876},{"match_name":"LGCSEMPS September 2017 Handgun","match_date":"2017-09-10","stage_classifiercode":"99-16","member_number":"A81280","first_name":"JAYJAY","last_name":"LIMBO","classification":"B","division":"LIMITED","hit_factor":4.1855},{"match_name":"Maine Practical Shooters May 2017","match_date":"2017-05-13","stage_classifiercode":"99-16","member_number":"A97314","first_name":"STEVEN","last_name":"BURGESS","classification":"C","division":"LIMITED","hit_factor":4.1845},{"match_name":"LdF USPSA Match September 23 2017","match_date":"2017-09-23","stage_classifiercode":"99-16","member_number":"PENDING","first_name":"TYLER","last_name":"CRAFTS","classification":"U","division":"LIMITED","hit_factor":4.1812},{"match_name":"OK15 USPSA at USSA","match_date":"2016-12-11","stage_classifiercode":"99-16","member_number":"\"\"","first_name":"RICK","last_name":"DEVORE","classification":"U","division":"LIMITED","hit_factor":4.1703},{"match_name":"Rio Grande Practical Shooters - May 2018","match_date":"2018-05-05","stage_classifiercode":"99-16","member_number":"A95944","first_name":"REBECCA","last_name":"IVEY","classification":"D","division":"LIMITED","hit_factor":4.1699},{"match_name":"Bass River USPSA September 2018","match_date":"2018-09-02","stage_classifiercode":"99-16","member_number":"A76880","first_name":"BILL","last_name":"FERRY","classification":"\"\"","division":"LIMITED","hit_factor":4.1696},{"match_name":"USPSA MO21 Special Classifier 2Alpha SBRC February 27 2021","match_date":"2021-02-27","stage_classifiercode":"99-16","member_number":"A10768","first_name":"JOHN","last_name":"ESLICK","classification":"C","division":"LIMITED","hit_factor":4.1667},{"match_name":"Hosemasters 2nd Sunday May 2017","match_date":"2017-05-14","stage_classifiercode":"99-16","member_number":"A103193","first_name":"LARRY","last_name":"LOBE","classification":"U","division":"LIMITED","hit_factor":4.1667},{"match_name":"Sharp Practical Shooters May USPSA Match","match_date":"2018-05-27","stage_classifiercode":"99-16","member_number":"A83133","first_name":"SCOTT","last_name":"BUZAN","classification":"B","division":"LIMITED","hit_factor":4.1568},{"match_name":"LGCSEMPS September 2017 Handgun","match_date":"2017-09-10","stage_classifiercode":"99-16","member_number":"TY86689","first_name":"DONALD","last_name":"HASSELBACH","classification":"B","division":"LIMITED","hit_factor":4.1549},{"match_name":"Sharp Practical Shooters May USPSA Match","match_date":"2018-05-27","stage_classifiercode":"99-16","member_number":"\"\"","first_name":"SANDS","last_name":"ANDERSON","classification":"U","division":"LIMITED","hit_factor":4.1489},{"match_name":"Cameo USPSA Match March 20 2021","match_date":"2021-03-20","stage_classifiercode":"99-16","member_number":"TY94370","first_name":"LAUREL","last_name":"WALTERS","classification":"C","division":"LIMITED","hit_factor":4.1429},{"match_name":"Coyote Arms USPSA","match_date":"2016-09-17","stage_classifiercode":"99-16","member_number":"A98409","first_name":"TOM","last_name":"BYNUM","classification":"\"\"","division":"LIMITED","hit_factor":4.1414},{"match_name":"ARPC USPSA Match 7-26-20","match_date":"2020-07-26","stage_classifiercode":"99-16","member_number":"TY61235","first_name":"STEPHEN","last_name":"FILLA","classification":"C","division":"LIMITED","hit_factor":4.1404},{"match_name":"Laser Ninja Dragon League MSA USPSA January 8th 2017","match_date":"2017-01-08","stage_classifiercode":"99-16","member_number":"\"\"","first_name":"JUSTIN","last_name":"CAVE","classification":"U","division":"LIMITED","hit_factor":4.1344},{"match_name":"LGCSEMPS September 2017 Handgun","match_date":"2017-09-10","stage_classifiercode":"99-16","member_number":"TY31462","first_name":"JEFFREY","last_name":"GERAK","classification":"G","division":"LIMITED","hit_factor":4.1278},{"match_name":"Sharp Practical Shooters May USPSA Match","match_date":"2018-05-27","stage_classifiercode":"99-16","member_number":"\"\"","first_name":"NICK","last_name":"WEST","classification":"U","division":"LIMITED","hit_factor":4.1221},{"match_name":"Briar Rabbit  June Match 2016 OH 20","match_date":"2016-06-12","stage_classifiercode":"99-16","member_number":"A91776","first_name":"RANDY","last_name":"TAYLOR","classification":"U","division":"LIMITED","hit_factor":4.1204},{"match_name":"Grandbaggers 07/2017","match_date":"2017-07-06","stage_classifiercode":"99-16","member_number":"TY95703","first_name":"GEORGE","last_name":"LOVE","classification":"B","division":"LIMITED","hit_factor":4.1176},{"match_name":"ENPS March 2017 USPSA Match","match_date":"2017-03-05","stage_classifiercode":"99-16","member_number":"PEN","first_name":"ALEX","last_name":"STOVER","classification":"U","division":"LIMITED","hit_factor":4.1168},{"match_name":"SPSA USPSA July 4th Sat match","match_date":"2018-07-28","stage_classifiercode":"99-16","member_number":"A90559","first_name":"IKE","last_name":"STARNES","classification":"B","division":"LIMITED","hit_factor":4.1165},{"match_name":"LCSC USPSA 01.14.18","match_date":"2018-01-13","stage_classifiercode":"99-16","member_number":"TY93622","first_name":"CARLO","last_name":"PABELICO","classification":"C","division":"LIMITED","hit_factor":4.1157},{"match_name":"Pelham USPSA 2017-08-20","match_date":"2017-08-20","stage_classifiercode":"99-16","member_number":"A97203","first_name":"ERIC","last_name":"LAPIERRE","classification":"U","division":"LIMITED","hit_factor":4.1128},{"match_name":"Maine Practical Shooters May 2017","match_date":"2017-05-13","stage_classifiercode":"99-16","member_number":"A99532","first_name":"JOSH","last_name":"POISSONNIER","classification":"C","division":"LIMITED","hit_factor":4.1096},{"match_name":"SPSA USPSA June 1st Sat Match","match_date":"2021-06-05","stage_classifiercode":"99-16","member_number":"TY112155","first_name":"TIMOTHY","last_name":"RUMSEY","classification":"U","division":"LIMITED","hit_factor":4.1085},{"match_name":"SFA USPSA March 2017","match_date":"2017-03-18","stage_classifiercode":"99-16","member_number":"TY71346","first_name":"ARDEY","last_name":"VAD","classification":"C","division":"LIMITED","hit_factor":4.1063},{"match_name":"WLPS June 2017","match_date":"2017-06-25","stage_classifiercode":"99-16","member_number":"TY57083","first_name":"WILLIAM","last_name":"WILLSON","classification":"C","division":"LIMITED","hit_factor":4.1041},{"match_name":"CRC_20160514_SuperClassifier","match_date":"2016-05-14","stage_classifiercode":"99-16","member_number":"A90490","first_name":"LEE","last_name":"SCHOENIKE","classification":"B","division":"LIMITED","hit_factor":4.0948},{"match_name":"SPSA USPSA December 1st Sat Match","match_date":"2016-12-03","stage_classifiercode":"99-16","member_number":"A98983","first_name":"JAMES","last_name":"POOLE","classification":"U","division":"LIMITED","hit_factor":4.0816},{"match_name":"RCPS USPSA 12 Nov 2016","match_date":"2016-11-12","stage_classifiercode":"99-16","member_number":"TY60976","first_name":"DAVID","last_name":"HYLTON","classification":"B","division":"LIMITED","hit_factor":4.0755},{"match_name":"SRAPS Amarillo Action May","match_date":"2016-05-28","stage_classifiercode":"99-16","member_number":"\"\"","first_name":"TY","last_name":"CRUM","classification":"\"\"","division":"LIMITED","hit_factor":4.0755},{"match_name":"USPSA MO21 Special Classifier 2Alpha SBRC February 27 2021","match_date":"2021-02-27","stage_classifiercode":"99-16","member_number":"A107973","first_name":"GARY","last_name":"NEUBAUM","classification":"C","division":"LIMITED","hit_factor":4.0752},{"match_name":"Shadow Hawk Defense USPSA Special Classifier","match_date":"2020-11-14","stage_classifiercode":"99-16","member_number":"A97515","first_name":"JOHN","last_name":"YUN","classification":"U","division":"LIMITED","hit_factor":4.0741},{"match_name":"SFPS 10-08-2017 USPSA match","match_date":"2017-10-08","stage_classifiercode":"99-16","member_number":"TY103743","first_name":"FRANCISCO","last_name":"HERNANDEZ","classification":"D","division":"LIMITED","hit_factor":4.0706},{"match_name":"CIPSC Havana July USPSA","match_date":"2018-07-07","stage_classifiercode":"99-16","member_number":"TY9065","first_name":"MIKE","last_name":"MOREHEAD","classification":"C","division":"LIMITED","hit_factor":4.0530582166544},{"match_name":"FLPSA MN14 USPSA May 17 2018","match_date":"2018-05-17","stage_classifiercode":"99-16","member_number":"TY104875","first_name":"JIM","last_name":"WEATHERHEAD","classification":"C","division":"LIMITED","hit_factor":4.0457},{"match_name":"Emmett March Match","match_date":"2016-03-25","stage_classifiercode":"99-16","member_number":"TY80815","first_name":"JOHN","last_name":"DANIELSON","classification":"C","division":"LIMITED","hit_factor":4.0438},{"match_name":"PCWC USPSA  1 28 17","match_date":"2017-01-28","stage_classifiercode":"99-16","member_number":"0000000","first_name":"DAVID","last_name":"MEREDITH","classification":"X","division":"LIMITED","hit_factor":4.0394},{"match_name":"CARO USPSA MATCH NO 3","match_date":"2018-07-28","stage_classifiercode":"99-16","member_number":"A99369","first_name":"GARY","last_name":"SCHULTHEIS","classification":"U","division":"LIMITED","hit_factor":4.0346},{"match_name":"5 August - USPSA match - 17 South PSC","match_date":"2017-08-05","stage_classifiercode":"99-16","member_number":"A-95602","first_name":"WES","last_name":"MAHR","classification":"U","division":"LIMITED","hit_factor":4.0278},{"match_name":"Briar Rabbit  June Match 2016 OH 20","match_date":"2016-06-12","stage_classifiercode":"99-16","member_number":"\"\"","first_name":"KENDALL","last_name":"MERRILL","classification":"B","division":"LIMITED","hit_factor":4.023},{"match_name":"SPSA USPSA December 1st Sat Match","match_date":"2016-12-03","stage_classifiercode":"99-16","member_number":"TY79557","first_name":"DAVE","last_name":"PAYNE","classification":"D","division":"LIMITED","hit_factor":4.0226},{"match_name":"Briar Rabbit  June Match 2016 OH 20","match_date":"2016-06-12","stage_classifiercode":"99-16","member_number":"X","first_name":"JASON","last_name":"ROTH","classification":"U","division":"LIMITED","hit_factor":4.0208},{"match_name":"CCPL 2 Day Match 2018","match_date":"2018-04-26","stage_classifiercode":"99-16","member_number":"A94718","first_name":"NICKOLAS","last_name":"ROBERTS","classification":"A","division":"LIMITED","hit_factor":4.0196},{"match_name":"Shasta Shooters 2020 Dec","match_date":"2020-12-12","stage_classifiercode":"99-16","member_number":"Ty126795","first_name":"JOHN","last_name":"HEATH","classification":"D","division":"LIMITED","hit_factor":4.0193},{"match_name":"SWGC USPSA Pistol Match - December","match_date":"2016-12-03","stage_classifiercode":"99-16","member_number":"A86809","first_name":"BRANDON","last_name":"MOUNCE","classification":"B","division":"LIMITED","hit_factor":4.0082},{"match_name":"Renton USPSA - August 2020 - NW05","match_date":"2020-08-23","stage_classifiercode":"99-16","member_number":"TY113642","first_name":"MARK","last_name":"MCLAUCHLIN","classification":"U","division":"LIMITED","hit_factor":3.9973},{"match_name":"TPS USPSA -  April 2018 Clone","match_date":"2018-04-08","stage_classifiercode":"99-16","member_number":"a83456","first_name":"JULIE","last_name":"FLEMING","classification":"D","division":"LIMITED","hit_factor":3.9941},{"match_name":"Dundee USPSA Mar 2017","match_date":"2017-03-25","stage_classifiercode":"99-16","member_number":"A90940","first_name":"FREDDY","last_name":"MALDONADO","classification":"D","division":"LIMITED","hit_factor":3.9941},{"match_name":"4ta Fecha USPSA","match_date":"2018-04-07","stage_classifiercode":"99-16","member_number":"\"\"","first_name":"JOHN P.","last_name":"RIVERA-SEPULVEDA","classification":"U","division":"LIMITED","hit_factor":3.9924},{"match_name":"Laser Ninja Dragon League MSA USPSA January 8th 2017","match_date":"2017-01-08","stage_classifiercode":"99-16","member_number":"A91713","first_name":"SHAWN","last_name":"SMITH","classification":"C","division":"LIMITED","hit_factor":3.9847},{"match_name":"Renton USPSA - August 2020 - NW05","match_date":"2020-08-23","stage_classifiercode":"99-16","member_number":"A91246","first_name":"JIM","last_name":"STEWARD","classification":"B","division":"LIMITED","hit_factor":3.981},{"match_name":"SFA USPSA NOVEMBER 14 2020","match_date":"2020-11-14","stage_classifiercode":"99-16","member_number":"A29919","first_name":"DAN","last_name":"TURNER","classification":"A","division":"LIMITED","hit_factor":3.9788},{"match_name":"CRC_20160514_SuperClassifier","match_date":"2016-05-14","stage_classifiercode":"99-16","member_number":"A87194","first_name":"GARRETT","last_name":"MCKIERNAN","classification":"D","division":"LIMITED","hit_factor":3.9746},{"match_name":"CCPS March 2018 USPSA","match_date":"2018-03-18","stage_classifiercode":"99-16","member_number":"A95090","first_name":"MARK","last_name":"RAMIREZ","classification":"B","division":"LIMITED","hit_factor":3.9742},{"match_name":"WLPS June 2017","match_date":"2017-06-25","stage_classifiercode":"99-16","member_number":"\"\"","first_name":"JIM","last_name":"MEIER","classification":"U","division":"LIMITED","hit_factor":3.9672},{"match_name":"RCPS USPSA Sep 11","match_date":"2021-09-11","stage_classifiercode":"99-16","member_number":"TY60976","first_name":"DAVID","last_name":"HYLTON","classification":"C","division":"LIMITED","hit_factor":3.9623},{"match_name":"TPS USPSA -  April 2018 Clone","match_date":"2018-04-08","stage_classifiercode":"99-16","member_number":"a102480","first_name":"ANDREW","last_name":"FULLER","classification":"U","division":"LIMITED","hit_factor":3.9578},{"match_name":"MS06 Team Magnolia USPSA January Match2","match_date":"2016-01-03","stage_classifiercode":"99-16","member_number":"A78185","first_name":"DREW","last_name":"HOLLIS","classification":"U","division":"LIMITED","hit_factor":3.956},{"match_name":"TPS USPSA -  April 2018 Clone","match_date":"2018-04-08","stage_classifiercode":"99-16","member_number":"\"\"","first_name":"JOHN","last_name":"MACIVER","classification":"D","division":"LIMITED","hit_factor":3.9448},{"match_name":"Dundee USPSA Mar 2017","match_date":"2017-03-25","stage_classifiercode":"99-16","member_number":"a52255","first_name":"MARTIN","last_name":"HARVEY","classification":"C","division":"LIMITED","hit_factor":3.9422},{"match_name":"WLPS USPSA Sep 2016","match_date":"2016-09-25","stage_classifiercode":"99-16","member_number":"\"\"","first_name":"CHARLES","last_name":"HALL","classification":"U","division":"LIMITED","hit_factor":3.9375},{"match_name":"BRSP Tuesday Night USPSA Match - June 5","match_date":"2018-06-06","stage_classifiercode":"99-16","member_number":"TY85802","first_name":"JOHN","last_name":"CLER","classification":"C","division":"LIMITED","hit_factor":3.9354},{"match_name":"NCPL 2016 July","match_date":"2016-07-31","stage_classifiercode":"99-16","member_number":"TY71659","first_name":"ROSS","last_name":"THOMPSON","classification":"C","division":"LIMITED","hit_factor":3.9331},{"match_name":"NCPL 2016 July","match_date":"2016-07-31","stage_classifiercode":"99-16","member_number":"A91533","first_name":"BRIAN","last_name":"GROSSMAN","classification":"D","division":"LIMITED","hit_factor":3.9281},{"match_name":"SPSA USPSA December 1st Sat Match","match_date":"2016-12-03","stage_classifiercode":"99-16","member_number":"TY78711","first_name":"JON","last_name":"WAKEMAN","classification":"D","division":"LIMITED","hit_factor":3.9254},{"match_name":"SPSA USPSA December 1st Sat Match","match_date":"2016-12-03","stage_classifiercode":"99-16","member_number":"TY83747","first_name":"TODD","last_name":"HOFFNER","classification":"C","division":"LIMITED","hit_factor":3.9235},{"match_name":"SFPS 10-08-2017 USPSA match","match_date":"2017-10-08","stage_classifiercode":"99-16","member_number":"A81490","first_name":"SAM","last_name":"JACOBSON","classification":"U","division":"LIMITED","hit_factor":3.9216},{"match_name":"FLPSA MN14 USPSA May 17 2018","match_date":"2018-05-17","stage_classifiercode":"99-16","member_number":"A-74965","first_name":"JAMES","last_name":"POLSTER","classification":"D","division":"LIMITED","hit_factor":3.9154},{"match_name":"EWPSA 2018-09","match_date":"2018-09-16","stage_classifiercode":"99-16","member_number":"B6","first_name":"M DWIGHT","last_name":"HUGHES","classification":"A","division":"LIMITED","hit_factor":3.9137},{"match_name":"ORSA USPSA August 2020","match_date":"2020-08-15","stage_classifiercode":"99-16","member_number":"L1789","first_name":"ROBERT","last_name":"BALLARD","classification":"C","division":"LIMITED","hit_factor":3.9111},{"match_name":"Maine Practical Shooters May 2017","match_date":"2017-05-13","stage_classifiercode":"99-16","member_number":"A97195","first_name":"KRIS","last_name":"WINNER","classification":"U","division":"LIMITED","hit_factor":3.9007},{"match_name":"DWB - Deadwood Boys USPSA 20 May 2018","match_date":"2018-05-20","stage_classifiercode":"99-16","member_number":"\"\"","first_name":"ENRIQUE","last_name":"ARAGON","classification":"G","division":"LIMITED","hit_factor":3.8904},{"match_name":"CRC_20160514_SuperClassifier","match_date":"2016-05-14","stage_classifiercode":"99-16","member_number":"A93099","first_name":"DAIN","last_name":"CUMMINGS","classification":"U","division":"LIMITED","hit_factor":3.886},{"match_name":"PCWC USPSA  1 28 17","match_date":"2017-01-28","stage_classifiercode":"99-16","member_number":"TY84726","first_name":"JIM","last_name":"HORNER","classification":"U","division":"LIMITED","hit_factor":3.8744},{"match_name":"AIPS Weekly USPSA 3 August 2021","match_date":"2021-08-03","stage_classifiercode":"99-16","member_number":"A77048","first_name":"NICK","last_name":"SEDGLEY","classification":"C","division":"LIMITED","hit_factor":3.8686},{"match_name":"DAP December 2015 Classifier match","match_date":"2015-12-12","stage_classifiercode":"99-16","member_number":"A82878","first_name":"RICHARD","last_name":"WILLIAMS","classification":"C","division":"LIMITED","hit_factor":3.8685},{"match_name":"CRC_20160514_SuperClassifier","match_date":"2016-05-14","stage_classifiercode":"99-16","member_number":"A73453","first_name":"MIKE","last_name":"WILLEY","classification":"D","division":"LIMITED","hit_factor":3.8682},{"match_name":"ShooT GTR USPSA 1/1/17","match_date":"2017-01-01","stage_classifiercode":"99-16","member_number":"\"\"","first_name":"LARRY","last_name":"DELK","classification":"X","division":"LIMITED","hit_factor":3.867},{"match_name":"BRSP Tuesday Night USPSA Match - June 5","match_date":"2018-06-06","stage_classifiercode":"99-16","member_number":"TY103504","first_name":"AMY","last_name":"ABBOTT","classification":"U","division":"LIMITED","hit_factor":3.8662},{"match_name":"Pima Pistol Club USPSA Match - May 29 ","match_date":"2016-05-29","stage_classifiercode":"99-16","member_number":"\"\"","first_name":"JUDD","last_name":"ARNOLD","classification":"U","division":"LIMITED","hit_factor":3.8647},{"match_name":"Sharp Practical Shooters May USPSA Match","match_date":"2018-05-27","stage_classifiercode":"99-16","member_number":"A95136","first_name":"ANDREW","last_name":"TODARO","classification":"C","division":"LIMITED","hit_factor":3.8631},{"match_name":"Dundee USPSA Mar 2017","match_date":"2017-03-25","stage_classifiercode":"99-16","member_number":"\"\"","first_name":"JOSE","last_name":"GONZALEZ","classification":"U","division":"LIMITED","hit_factor":3.8576},{"match_name":"Range E11even October 2017","match_date":"2017-10-28","stage_classifiercode":"99-16","member_number":"A91263","first_name":"MATTHEW","last_name":"WOLFF","classification":"B","division":"LIMITED","hit_factor":3.8554},{"match_name":"Briar Rabbit  June Match 2016 OH 20","match_date":"2016-06-12","stage_classifiercode":"99-16","member_number":"A89715","first_name":"MATT","last_name":"WEILAND","classification":"C","division":"LIMITED","hit_factor":3.8546},{"match_name":"Shasta Shooters September 2016","match_date":"2016-09-10","stage_classifiercode":"99-16","member_number":"L3873","first_name":"DON","last_name":"SANTORO","classification":"A","division":"LIMITED","hit_factor":3.8514},{"match_name":"Dundee USPSA Mar 2017","match_date":"2017-03-25","stage_classifiercode":"99-16","member_number":"A93794","first_name":"CHRISTOPHER","last_name":"GOSS","classification":"D","division":"LIMITED","hit_factor":3.8488},{"match_name":"CCPL 2 Day Match 2018","match_date":"2018-04-26","stage_classifiercode":"99-16","member_number":"L3505","first_name":"WILLIAM (BILL)","last_name":"STEWART","classification":"C","division":"LIMITED","hit_factor":3.8462},{"match_name":"Pima Pistol Club USPSA Match - May 29 ","match_date":"2016-05-29","stage_classifiercode":"99-16","member_number":"A89647","first_name":"RANDY","last_name":"BENNETT","classification":"C","division":"LIMITED","hit_factor":3.8423},{"match_name":"MCPSL Pistol 10-9-2021","match_date":"2021-10-09","stage_classifiercode":"99-16","member_number":"A131080","first_name":"DARREN","last_name":"HAIN","classification":"U","division":"LIMITED","hit_factor":3.8411},{"match_name":"SFPS 10-08-2017 USPSA match","match_date":"2017-10-08","stage_classifiercode":"99-16","member_number":"\"\"","first_name":"CHRISTOPHER","last_name":"HECK","classification":"U","division":"LIMITED","hit_factor":3.8405},{"match_name":"ORSA USPSA July 2016 ","match_date":"2016-07-16","stage_classifiercode":"99-16","member_number":"A58352","first_name":"KEITH","last_name":"EDWARDS","classification":"B","division":"LIMITED","hit_factor":3.8386},{"match_name":"ENPS March 2017 USPSA Match","match_date":"2017-03-05","stage_classifiercode":"99-16","member_number":"A95571","first_name":"BROCK","last_name":"LYNCH","classification":"C","division":"LIMITED","hit_factor":3.831},{"match_name":"ENPS March 2017 USPSA Match","match_date":"2017-03-05","stage_classifiercode":"99-16","member_number":"a96525","first_name":"CASEY","last_name":"ROSE","classification":"D","division":"LIMITED","hit_factor":3.8278},{"match_name":"Rio Grande Practical Shooters - May 2018","match_date":"2018-05-05","stage_classifiercode":"99-16","member_number":"TY78151","first_name":"HEIDI","last_name":"CHOWNING","classification":"D","division":"LIMITED","hit_factor":3.8208},{"match_name":"Pinetucky USPSA 02-27-16","match_date":"2016-02-27","stage_classifiercode":"99-16","member_number":"A90561","first_name":"RICK","last_name":"GILDER","classification":"U","division":"LIMITED","hit_factor":3.8199},{"match_name":"Pinetucky USPSA 02-27-16","match_date":"2016-02-27","stage_classifiercode":"99-16","member_number":"a-94684","first_name":"GREG","last_name":"CANNON","classification":"U","division":"LIMITED","hit_factor":3.8188},{"match_name":"SWGC USPSA Pistol Match - December","match_date":"2016-12-03","stage_classifiercode":"99-16","member_number":"\"\"","first_name":"JOHN","last_name":"TISCHLER","classification":"B","division":"LIMITED","hit_factor":3.815},{"match_name":"WLPS USPSA Sep 2016","match_date":"2016-09-25","stage_classifiercode":"99-16","member_number":"A83530","first_name":"ARTHUR","last_name":"SILBERNAGEL","classification":"C","division":"LIMITED","hit_factor":3.8147},{"match_name":"Maine Practical Shooters May 2017","match_date":"2017-05-13","stage_classifiercode":"99-16","member_number":"A96645","first_name":"ALEX","last_name":"BROWNEWELL","classification":"C","division":"LIMITED","hit_factor":3.8139},{"match_name":"TPS USPSA -  April 2018 Clone","match_date":"2018-04-08","stage_classifiercode":"99-16","member_number":"\"\"","first_name":"JEFF","last_name":"CARTER","classification":"U","division":"LIMITED","hit_factor":3.8102},{"match_name":"Maine Practical Shooters May 2017","match_date":"2017-05-13","stage_classifiercode":"99-16","member_number":"A103362","first_name":"RYAN","last_name":"BLAKENEY","classification":"\"\"","division":"LIMITED","hit_factor":3.8071},{"match_name":"CCPS March 2018 USPSA","match_date":"2018-03-18","stage_classifiercode":"99-16","member_number":"\"\"","first_name":"ZACHARY","last_name":"MITCHELL","classification":"U","division":"LIMITED","hit_factor":3.8043},{"match_name":"NCPL 2016 July","match_date":"2016-07-31","stage_classifiercode":"99-16","member_number":"A96822","first_name":"CRAIG","last_name":"CASEY","classification":"U","division":"LIMITED","hit_factor":3.804},{"match_name":"ARPC USPSA Match 7-26-20","match_date":"2020-07-26","stage_classifiercode":"99-16","member_number":"A127324","first_name":"MATT","last_name":"GERLING","classification":"Unclassified","division":"LIMITED","hit_factor":3.8035},{"match_name":"SWGC USPSA Pistol Match - December","match_date":"2016-12-03","stage_classifiercode":"99-16","member_number":"A98772","first_name":"JUSTIN","last_name":"KRAFT","classification":"C","division":"LIMITED","hit_factor":3.7886},{"match_name":"Emmett March Match","match_date":"2016-03-25","stage_classifiercode":"99-16","member_number":"A69178","first_name":"JASON","last_name":"PRICE","classification":"C","division":"LIMITED","hit_factor":3.7871},{"match_name":"USPSA-AB 2018-14 at Brooks Pistol Club -adhoc","match_date":"2018-08-08","stage_classifiercode":"99-16","member_number":"\"\"","first_name":"ROGER","last_name":"SYVRET","classification":"U","division":"LIMITED","hit_factor":3.7847},{"match_name":"AVAP CLASSIFIER 71418","match_date":"2018-07-14","stage_classifiercode":"99-16","member_number":"A11254","first_name":"JOHN PAUL","last_name":"CARBONEL","classification":"U","division":"LIMITED","hit_factor":3.7832},{"match_name":"Shongum April 2016 Pistol Match","match_date":"2016-04-02","stage_classifiercode":"99-16","member_number":"TY89577","first_name":"PAUL","last_name":"ZUZIK","classification":"D","division":"LIMITED","hit_factor":3.7793},{"match_name":"PRG-USPSA - Oh Shoot January 3rd - 1st Sunday","match_date":"2021-01-03","stage_classifiercode":"99-16","member_number":"A108080","first_name":"STERLYN","last_name":"RIGSBY","classification":"B","division":"LIMITED","hit_factor":3.7719},{"match_name":"Sharp Practical Shooters May USPSA Match","match_date":"2018-05-27","stage_classifiercode":"99-16","member_number":"A89845","first_name":"WILL","last_name":"STONE","classification":"C","division":"LIMITED","hit_factor":3.7714},{"match_name":"ENPS March 2017 USPSA Match","match_date":"2017-03-05","stage_classifiercode":"99-16","member_number":"PEN","first_name":"BEN","last_name":"KASSERA","classification":"U","division":"LIMITED","hit_factor":3.7707},{"match_name":"ShooT GTR USPSA 1/1/17","match_date":"2017-01-01","stage_classifiercode":"99-16","member_number":"A71729","first_name":"JIM","last_name":"MILLER","classification":"C","division":"LIMITED","hit_factor":3.7665},{"match_name":"Renton USPSA - August 2020 - NW05","match_date":"2020-08-23","stage_classifiercode":"99-16","member_number":"A114139","first_name":"BRIAN","last_name":"ROWE","classification":"C","division":"LIMITED","hit_factor":3.7613},{"match_name":"APSC USPSA Match 1-6-18","match_date":"2018-01-06","stage_classifiercode":"99-16","member_number":"TY88668","first_name":"CARROLL","last_name":"VICK","classification":"D","division":"LIMITED","hit_factor":3.7584},{"match_name":"NNRPA USPSA March 26th 2016","match_date":"2016-03-26","stage_classifiercode":"99-16","member_number":"Ty79968","first_name":"TRENT","last_name":"EDWARDS","classification":"D","division":"LIMITED","hit_factor":3.7567},{"match_name":"PRG-USPSA - Oh Shoot January 3rd - 1st Sunday","match_date":"2021-01-03","stage_classifiercode":"99-16","member_number":"TY130861","first_name":"ALAINA","last_name":"HICKS","classification":"D","division":"LIMITED","hit_factor":3.7459},{"match_name":"APSC USPSA Match 1-6-18","match_date":"2018-01-06","stage_classifiercode":"99-16","member_number":"A100724","first_name":"BRIAN","last_name":"TARBOX","classification":"U","division":"LIMITED","hit_factor":3.741},{"match_name":"LCSC USPSA 01.14.18","match_date":"2018-01-13","stage_classifiercode":"99-16","member_number":"FY59179","first_name":"DAVE","last_name":"BUNN","classification":"C","division":"LIMITED","hit_factor":3.7363},{"match_name":"4ta Fecha USPSA","match_date":"2018-04-07","stage_classifiercode":"99-16","member_number":"A94686","first_name":"KENNETH","last_name":"BRUTON-MOLINA","classification":"U","division":"LIMITED","hit_factor":3.7308},{"match_name":"USPSA","match_date":"2020-07-05","stage_classifiercode":"99-16","member_number":"L3576","first_name":"TY","last_name":"GENTRY","classification":"A","division":"LIMITED","hit_factor":3.7275},{"match_name":"Laser Ninja Dragon League MSA USPSA January 8th 2017","match_date":"2017-01-08","stage_classifiercode":"99-16","member_number":"NA","first_name":"MIKE","last_name":"SMITH","classification":"U","division":"LIMITED","hit_factor":3.7274},{"match_name":"Hosemasters 2nd Sunday May 2017","match_date":"2017-05-14","stage_classifiercode":"99-16","member_number":"TY85174","first_name":"DAN","last_name":"SHERMAN","classification":"C","division":"LIMITED","hit_factor":3.7223},{"match_name":"Hosemasters 2nd Sunday May 2017","match_date":"2017-05-14","stage_classifiercode":"99-16","member_number":"\"\"","first_name":"DAVID","last_name":"BRANDT","classification":"B","division":"LIMITED","hit_factor":3.7165},{"match_name":"SPSA USPSA July 4th Sat match","match_date":"2018-07-28","stage_classifiercode":"99-16","member_number":"TY56998","first_name":"GREGORY","last_name":"LANE","classification":"C","division":"LIMITED","hit_factor":3.7149},{"match_name":"MPSA 101720 USPSA","match_date":"2020-10-17","stage_classifiercode":"99-16","member_number":"L4339","first_name":"COLIN","last_name":"HARTERY","classification":"C","division":"LIMITED","hit_factor":3.7104},{"match_name":"USPSA MO21 Special Classifier 2Alpha SBRC February 27 2021","match_date":"2021-02-27","stage_classifiercode":"99-16","member_number":"A49382","first_name":"BRENDAN","last_name":"NANGLE","classification":"A","division":"LIMITED","hit_factor":3.7088},{"match_name":"RBGC 2017-10-21","match_date":"2017-10-21","stage_classifiercode":"99-16","member_number":"A106074","first_name":"ANTHONY","last_name":"JOHNSON","classification":"U","division":"LIMITED","hit_factor":3.6958},{"match_name":"PCWC USPSA  1 28 17","match_date":"2017-01-28","stage_classifiercode":"99-16","member_number":"A46766","first_name":"ANTHONY","last_name":"WETHERELL","classification":"B","division":"LIMITED","hit_factor":3.6929},{"match_name":"SFPS 10-08-2017 USPSA match","match_date":"2017-10-08","stage_classifiercode":"99-16","member_number":"A23396","first_name":"DION","last_name":"JOHNSON","classification":"C","division":"LIMITED","hit_factor":3.6819},{"match_name":"LGCSEMPS September 2017 Handgun","match_date":"2017-09-10","stage_classifiercode":"99-16","member_number":"TY42332","first_name":"HERB","last_name":"SMITH","classification":"C","division":"LIMITED","hit_factor":3.6749},{"match_name":"MS06 Team Magnolia USPSA January Match2","match_date":"2016-01-03","stage_classifiercode":"99-16","member_number":"L1670","first_name":"TOM","last_name":"DUCHMANN JR.","classification":"C","division":"LIMITED","hit_factor":3.671},{"match_name":"MS06 Team Magnolia USPSA January Match2","match_date":"2016-01-03","stage_classifiercode":"99-16","member_number":"A92067","first_name":"DON","last_name":"ALBARES","classification":"C","division":"LIMITED","hit_factor":3.6691},{"match_name":"Pinetucky USPSA 02-27-16","match_date":"2016-02-27","stage_classifiercode":"99-16","member_number":"A92545","first_name":"RONNIE","last_name":"STATEN","classification":"D","division":"LIMITED","hit_factor":3.6664},{"match_name":"ORSA USPSA August 2020","match_date":"2020-08-15","stage_classifiercode":"99-16","member_number":"A109173","first_name":"MIKE","last_name":"MUNCY","classification":"C","division":"LIMITED","hit_factor":3.6552},{"match_name":"LdF USPSA Match September 23 2017","match_date":"2017-09-23","stage_classifiercode":"99-16","member_number":"FY63382","first_name":"MICHAEL","last_name":"SUEDA","classification":"M","division":"LIMITED","hit_factor":3.6466},{"match_name":"Sharp Practical Shooters May USPSA Match","match_date":"2018-05-27","stage_classifiercode":"99-16","member_number":"\"\"","first_name":"JARED","last_name":"BOCK","classification":"U","division":"LIMITED","hit_factor":3.6364},{"match_name":"4ta Fecha USPSA","match_date":"2018-04-07","stage_classifiercode":"99-16","member_number":"\"\"","first_name":"CESAR F.","last_name":"BURGOS-MONTALVO","classification":"U","division":"LIMITED","hit_factor":3.6125},{"match_name":"ORSA USPSA July 2016 ","match_date":"2016-07-16","stage_classifiercode":"99-16","member_number":"NONE","first_name":"JOHN","last_name":"PAGEL","classification":"U","division":"LIMITED","hit_factor":3.612},{"match_name":"Rio Grande Practical Shooters - May 2018","match_date":"2018-05-05","stage_classifiercode":"99-16","member_number":"A106076","first_name":"JAMIE","last_name":"LENBERG","classification":"D","division":"LIMITED","hit_factor":3.6106},{"match_name":"MSSA Uspsa Club Matcg","match_date":"2017-09-24","stage_classifiercode":"99-16","member_number":"\"\"","first_name":"THOMAS","last_name":"PELOQUIN","classification":"U","division":"LIMITED","hit_factor":3.6049},{"match_name":"Pima Pistol Club USPSA Match - May 29 ","match_date":"2016-05-29","stage_classifiercode":"99-16","member_number":"A96529","first_name":"JONATHAN","last_name":"NAGY","classification":"Unclassified","division":"LIMITED","hit_factor":3.6036},{"match_name":"DAP December 2015 Classifier match","match_date":"2015-12-12","stage_classifiercode":"99-16","member_number":"A92465","first_name":"JOSE","last_name":"RAPADAS","classification":"U","division":"LIMITED","hit_factor":3.6008},{"match_name":"OREGON ARPC CC05 USPSA Jan 14 2017","match_date":"2017-01-14","stage_classifiercode":"99-16","member_number":"A93794","first_name":"CHRISTOPHER","last_name":"GOSS","classification":"D","division":"LIMITED","hit_factor":3.5976},{"match_name":"Pinetucky USPSA 02-27-16","match_date":"2016-02-27","stage_classifiercode":"99-16","member_number":"A93234","first_name":"SEAN","last_name":"MERRILL","classification":"D","division":"LIMITED","hit_factor":3.5948},{"match_name":"Shongum December 2017 USPSA Match","match_date":"2017-12-02","stage_classifiercode":"99-16","member_number":"TY98580","first_name":"JASON","last_name":"SENDELSKY","classification":"U","division":"LIMITED","hit_factor":3.5755},{"match_name":"BSPSC 2018 August Special Classifier","match_date":"2018-08-12","stage_classifiercode":"99-16","member_number":"A113185","first_name":"KENT","last_name":"ANDERSON","classification":"U","division":"LIMITED","hit_factor":3.5744},{"match_name":"SWGC USPSA Pistol Match - December","match_date":"2016-12-03","stage_classifiercode":"99-16","member_number":"TY74728","first_name":"CHARLES","last_name":"KEITH","classification":"C","division":"LIMITED","hit_factor":3.5679},{"match_name":"LdF USPSA Match September 23 2017","match_date":"2017-09-23","stage_classifiercode":"99-16","member_number":"A102726","first_name":"TRACY","last_name":"TOMASIAN","classification":"D","division":"LIMITED","hit_factor":3.5678},{"match_name":"WLPS June 2017","match_date":"2017-06-25","stage_classifiercode":"99-16","member_number":"\"\"","first_name":"TOM","last_name":"KEEFE","classification":"U","division":"LIMITED","hit_factor":3.5641},{"match_name":"ARPC USPSA Match 7-26-20","match_date":"2020-07-26","stage_classifiercode":"99-16","member_number":"A119910","first_name":"CHRISTOPHER","last_name":"PUDER","classification":"Unclassified","division":"LIMITED","hit_factor":3.5568},{"match_name":"Idaho ISPS August 5th Break from the Heat","match_date":"2017-08-05","stage_classifiercode":"99-16","member_number":"TY91986","first_name":"TRAVIS","last_name":"DEMARAY","classification":"A","division":"LIMITED","hit_factor":3.5503},{"match_name":"MVPSA USPSA 7-7-18","match_date":"2018-07-07","stage_classifiercode":"99-16","member_number":"\"\"","first_name":"JOSHUA","last_name":"KERN","classification":"U","division":"LIMITED","hit_factor":3.5488},{"match_name":"DAP December 2015 Classifier match","match_date":"2015-12-12","stage_classifiercode":"99-16","member_number":"TY81315","first_name":"DILLON","last_name":"MAPPES","classification":"D","division":"LIMITED","hit_factor":3.5452},{"match_name":"LGCSEMPS September 2017 Handgun","match_date":"2017-09-10","stage_classifiercode":"99-16","member_number":"\"\"","first_name":"DAVID","last_name":"RAMALES","classification":"U","division":"LIMITED","hit_factor":3.5422},{"match_name":"APSC USPSA Match 1-6-18","match_date":"2018-01-06","stage_classifiercode":"99-16","member_number":"TY86863","first_name":"CINDI","last_name":"MARTIN","classification":"D","division":"LIMITED","hit_factor":3.5398},{"match_name":"CCPL 2 Day Match 2018","match_date":"2018-04-26","stage_classifiercode":"99-16","member_number":"A87403","first_name":"ROD","last_name":"PFITZER","classification":"C","division":"LIMITED","hit_factor":3.5375},{"match_name":"ORSA USPSA July 2016 ","match_date":"2016-07-16","stage_classifiercode":"99-16","member_number":"NONE","first_name":"FAUSTO","last_name":"VACA","classification":"U","division":"LIMITED","hit_factor":3.5367},{"match_name":"Emmett March Match","match_date":"2016-03-25","stage_classifiercode":"99-16","member_number":"TY93831","first_name":"SUE","last_name":"QUINT","classification":"U","division":"LIMITED","hit_factor":3.536},{"match_name":"CCPL 2 Day Match 2018","match_date":"2018-04-26","stage_classifiercode":"99-16","member_number":"A92260","first_name":"LAURI","last_name":"VAUGHN","classification":"C","division":"LIMITED","hit_factor":3.532},{"match_name":"MvpNov2015","match_date":"2015-11-06","stage_classifiercode":"99-16","member_number":"TY76477","first_name":"JOSE","last_name":"ALEMAN","classification":"B","division":"LIMITED","hit_factor":3.5294},{"match_name":"NCPL 2016 July","match_date":"2016-07-31","stage_classifiercode":"99-16","member_number":"TY53820","first_name":"BRIAN","last_name":"CONNORS","classification":"U","division":"LIMITED","hit_factor":3.5161},{"match_name":"5 August - USPSA match - 17 South PSC","match_date":"2017-08-05","stage_classifiercode":"99-16","member_number":"\"\"","first_name":"BOBBY","last_name":"TRIANTOS","classification":"U","division":"LIMITED","hit_factor":3.5161},{"match_name":"Pelham USPSA 2017-08-20","match_date":"2017-08-20","stage_classifiercode":"99-16","member_number":"A103105","first_name":"CHRISTOPHER","last_name":"STOAKES","classification":"C","division":"LIMITED","hit_factor":3.5131},{"match_name":"4ta Fecha USPSA","match_date":"2018-04-07","stage_classifiercode":"99-16","member_number":"\"\"","first_name":"HUMBERTO","last_name":"DIAZ-TORRES","classification":"U","division":"LIMITED","hit_factor":3.5115},{"match_name":"DWB - Deadwood Boys USPSA 20 May 2018","match_date":"2018-05-20","stage_classifiercode":"99-16","member_number":"A83686","first_name":"DAVID","last_name":"KAFFEL","classification":"A","division":"LIMITED","hit_factor":3.5111},{"match_name":"LGCSEMPS September 2017 Handgun","match_date":"2017-09-10","stage_classifiercode":"99-16","member_number":"TY100851","first_name":"THOMAS","last_name":"KUGLER","classification":"U","division":"LIMITED","hit_factor":3.5072},{"match_name":"OREGON ARPC CC05 USPSA Jan 14 2017","match_date":"2017-01-14","stage_classifiercode":"99-16","member_number":"A85805","first_name":"ERIC","last_name":"HILL","classification":"U","division":"LIMITED","hit_factor":3.5019},{"match_name":"Bass River USPSA September 2018","match_date":"2018-09-02","stage_classifiercode":"99-16","member_number":"A43588","first_name":"DENNIS","last_name":"GARANT","classification":"\"\"","division":"LIMITED","hit_factor":3.5017},{"match_name":"4ta Fecha USPSA","match_date":"2018-04-07","stage_classifiercode":"99-16","member_number":"A104237","first_name":"EDDIE","last_name":"FLORES-FERNANDEZ","classification":"U","division":"LIMITED","hit_factor":3.501},{"match_name":"CCPL 2 Day Match 2018","match_date":"2018-04-26","stage_classifiercode":"99-16","member_number":"A106407","first_name":"VICTOR","last_name":"SUPERALES","classification":"C","division":"LIMITED","hit_factor":3.4991},{"match_name":"PIPS 05-25-2016","match_date":"2016-05-24","stage_classifiercode":"99-16","member_number":"A87198","first_name":"ALAN","last_name":"HETER","classification":"D","division":"LIMITED","hit_factor":3.4948},{"match_name":"SPSA USPSA December 1st Sat Match","match_date":"2016-12-03","stage_classifiercode":"99-16","member_number":"A94849","first_name":"KENT","last_name":"SILVERTHORN","classification":"C","division":"LIMITED","hit_factor":3.4911},{"match_name":"CCPS March 2018 USPSA","match_date":"2018-03-18","stage_classifiercode":"99-16","member_number":"fy56818","first_name":"KEVIN","last_name":"MCENERY","classification":"C","division":"LIMITED","hit_factor":3.4862},{"match_name":"Sharp Practical Shooters May USPSA Match","match_date":"2018-05-27","stage_classifiercode":"99-16","member_number":"A111339","first_name":"JEREMY","last_name":"BROWN","classification":"U","division":"LIMITED","hit_factor":3.4833},{"match_name":"2da Copa Nacional USPSA ","match_date":"2016-05-22","stage_classifiercode":"99-16","member_number":"TY94373","first_name":"ROMN","last_name":"SIFUENTES PREZ","classification":"U","division":"LIMITED","hit_factor":3.481},{"match_name":"SWGC USPSA Pistol Match - December","match_date":"2016-12-03","stage_classifiercode":"99-16","member_number":"A69874","first_name":"DAVID","last_name":"WILSON","classification":"C","division":"LIMITED","hit_factor":3.4792},{"match_name":"Hernando Sportsmans Club","match_date":"2017-02-12","stage_classifiercode":"99-16","member_number":"A85829","first_name":"RONALD","last_name":"BENNETT","classification":"D","division":"LIMITED","hit_factor":3.4783},{"match_name":"WLPS June 2017","match_date":"2017-06-25","stage_classifiercode":"99-16","member_number":"TY55423","first_name":"BRUCE","last_name":"GUITHER","classification":"D","division":"LIMITED","hit_factor":3.4657},{"match_name":"Pelham USPSA 2017-08-20","match_date":"2017-08-20","stage_classifiercode":"99-16","member_number":"\"\"","first_name":"PETER","last_name":"LANE","classification":"Unclassified","division":"LIMITED","hit_factor":3.4632},{"match_name":"Dundee USPSA Mar 2017","match_date":"2017-03-25","stage_classifiercode":"99-16","member_number":"A90923","first_name":"MIKE","last_name":"FOWLER","classification":"C","division":"LIMITED","hit_factor":3.4574},{"match_name":"SFA USPSA NOVEMBER 14 2020","match_date":"2020-11-14","stage_classifiercode":"99-16","member_number":"TY54695","first_name":"RODEL","last_name":"SAMONTE","classification":"C","division":"LIMITED","hit_factor":3.4483},{"match_name":"Grandbaggers 07/2017","match_date":"2017-07-06","stage_classifiercode":"99-16","member_number":"A88917","first_name":"MARC","last_name":"CONWAY","classification":"U","division":"LIMITED","hit_factor":3.4455},{"match_name":"Emmett March Match","match_date":"2016-03-25","stage_classifiercode":"99-16","member_number":"l3771","first_name":"CHUCK","last_name":"GALLOWAY","classification":"C","division":"LIMITED","hit_factor":3.4263},{"match_name":"ORSA USPSA July 2016 ","match_date":"2016-07-16","stage_classifiercode":"99-16","member_number":"A92055","first_name":"BRYAN","last_name":"KISER","classification":"C","division":"LIMITED","hit_factor":3.4256},{"match_name":"CRC_20160514_SuperClassifier","match_date":"2016-05-14","stage_classifiercode":"99-16","member_number":"A94756","first_name":"PAUL","last_name":"HAUSER","classification":"U","division":"LIMITED","hit_factor":3.4217},{"match_name":"MVS ANPRACS Classifier Match 6/3/17","match_date":"2017-05-31","stage_classifiercode":"99-16","member_number":"A96203","first_name":"EUGENE","last_name":"VANNI","classification":"C","division":"LIMITED","hit_factor":3.4211},{"match_name":"Pinetucky USPSA 02-27-16","match_date":"2016-02-27","stage_classifiercode":"99-16","member_number":"A69714","first_name":"MARK","last_name":"GAINEY","classification":"C","division":"LIMITED","hit_factor":3.4188},{"match_name":"Pinetucky USPSA 02-27-16","match_date":"2016-02-27","stage_classifiercode":"99-16","member_number":"\"\"","first_name":"ALSTON","last_name":"SWINNIE","classification":"X","division":"LIMITED","hit_factor":3.4138},{"match_name":"SPSA USPSA July 4th Sat match","match_date":"2018-07-28","stage_classifiercode":"99-16","member_number":"TY79557","first_name":"DAVE","last_name":"PAYNE","classification":"C","division":"LIMITED","hit_factor":3.411},{"match_name":"MVS ANPRACS Classifier Match 6/3/17","match_date":"2017-05-31","stage_classifiercode":"99-16","member_number":"\"\"","first_name":"JASON","last_name":"WALLBAUM","classification":"\"\"","division":"LIMITED","hit_factor":3.4082},{"match_name":"Hosemasters 2nd Sunday May 2017","match_date":"2017-05-14","stage_classifiercode":"99-16","member_number":"A101092","first_name":"MICHAEL","last_name":"NAVARRO","classification":"U","division":"LIMITED","hit_factor":3.4048},{"match_name":"Dundee USPSA Mar 2017","match_date":"2017-03-25","stage_classifiercode":"99-16","member_number":"A85533","first_name":"DARRIN","last_name":"BOWERS","classification":"C","division":"LIMITED","hit_factor":3.4047},{"match_name":"Emmett March Match","match_date":"2016-03-25","stage_classifiercode":"99-16","member_number":"a-68354","first_name":"DAVID","last_name":"WALL","classification":"D","division":"LIMITED","hit_factor":3.4007},{"match_name":"PIPS 05-25-2016","match_date":"2016-05-24","stage_classifiercode":"99-16","member_number":"A65112","first_name":"DOUGLAS","last_name":"ANDERSON","classification":"U","division":"LIMITED","hit_factor":3.3937},{"match_name":"ARPC USPSA Match 7-26-20","match_date":"2020-07-26","stage_classifiercode":"99-16","member_number":"A75024","first_name":"ROBERT","last_name":"BRUCE","classification":"C","division":"LIMITED","hit_factor":3.3868},{"match_name":"RBGC 2017-10-21","match_date":"2017-10-21","stage_classifiercode":"99-16","member_number":"TY41564","first_name":"BRUCE","last_name":"ANDERSON","classification":"C","division":"LIMITED","hit_factor":3.3828},{"match_name":"ORSA USPSA July 2016 ","match_date":"2016-07-16","stage_classifiercode":"99-16","member_number":"NONE","first_name":"BRANNIN","last_name":"LAKEY","classification":"U","division":"LIMITED","hit_factor":3.3827},{"match_name":"PCWC USPSA  1 28 17","match_date":"2017-01-28","stage_classifiercode":"99-16","member_number":"TY74728","first_name":"CHARLES","last_name":"KEITH","classification":"C","division":"LIMITED","hit_factor":3.3816},{"match_name":"Emmett March Match","match_date":"2016-03-25","stage_classifiercode":"99-16","member_number":"a80263","first_name":"STEVE","last_name":"HARRIS","classification":"B","division":"LIMITED","hit_factor":3.3784},{"match_name":"CCPL 02-09-2020","match_date":"2020-02-09","stage_classifiercode":"99-16","member_number":"A115644","first_name":"KEVIN","last_name":"HAM","classification":"D","division":"LIMITED","hit_factor":3.3732},{"match_name":"Renton USPSA - August 2020 - NW05","match_date":"2020-08-23","stage_classifiercode":"99-16","member_number":"A121214","first_name":"DALTON","last_name":"CUTHBERT","classification":"U","division":"LIMITED","hit_factor":3.373},{"match_name":"WLPS USPSA Sep 2016","match_date":"2016-09-25","stage_classifiercode":"99-16","member_number":"\"\"","first_name":"CASEY","last_name":"HUDSON","classification":"U","division":"LIMITED","hit_factor":3.3724},{"match_name":"Emmett March Match","match_date":"2016-03-25","stage_classifiercode":"99-16","member_number":"a84188","first_name":"LARRY","last_name":"O`LETSKI","classification":"C","division":"LIMITED","hit_factor":3.3719},{"match_name":"SPSA USPSA December 1st Sat Match","match_date":"2016-12-03","stage_classifiercode":"99-16","member_number":"A85996","first_name":"KEITH","last_name":"CASHION","classification":"D","division":"LIMITED","hit_factor":3.3679},{"match_name":"Flagstaff Fun Shoot September 15 2018","match_date":"2018-09-15","stage_classifiercode":"99-16","member_number":"A96462","first_name":"BRANDON","last_name":"JOHNSON","classification":"\"\"","division":"LIMITED","hit_factor":3.3625},{"match_name":"WLPS USPSA Sep 2016","match_date":"2016-09-25","stage_classifiercode":"99-16","member_number":"\"\"","first_name":"MIKE","last_name":"WALKER","classification":"U","division":"LIMITED","hit_factor":3.3571},{"match_name":"USPSA MO21 Special Classifier 2Alpha SBRC February 27 2021","match_date":"2021-02-27","stage_classifiercode":"99-16","member_number":"A117002","first_name":"CODY","last_name":"AUTRY","classification":"C","division":"LIMITED","hit_factor":3.3533},{"match_name":"TPS USPSA -  April 2018 Clone","match_date":"2018-04-08","stage_classifiercode":"99-16","member_number":"\"\"","first_name":"PAUL","last_name":"CRAFT","classification":"D","division":"LIMITED","hit_factor":3.3489},{"match_name":"PCWC USPSA  1 28 17","match_date":"2017-01-28","stage_classifiercode":"99-16","member_number":"0000000","first_name":"EDDIE","last_name":"OCALAHAN","classification":"X","division":"LIMITED","hit_factor":3.3311},{"match_name":"RCPS USPSA 12 Nov 2016","match_date":"2016-11-12","stage_classifiercode":"99-16","member_number":"TY73907","first_name":"THOMAS","last_name":"MASSEY","classification":"C","division":"LIMITED","hit_factor":3.3305},{"match_name":"ARPC USPSA Match 3-26-17","match_date":"2017-03-26","stage_classifiercode":"99-16","member_number":"TY93949","first_name":"KEITH","last_name":"SHORT","classification":"Unclassified","division":"LIMITED","hit_factor":3.3237},{"match_name":"WLPS June 2017","match_date":"2017-06-25","stage_classifiercode":"99-16","member_number":"\"\"","first_name":"DAVE","last_name":"CHARLSON","classification":"U","division":"LIMITED","hit_factor":3.3202},{"match_name":"USPSA MO21 Special Classifier 2Alpha SBRC February 27 2021","match_date":"2021-02-27","stage_classifiercode":"99-16","member_number":"A132761","first_name":"NATHAN","last_name":"BURTON","classification":"U","division":"LIMITED","hit_factor":3.3162},{"match_name":"West Liberty USPSA Oct 2018","match_date":"2018-10-28","stage_classifiercode":"99-16","member_number":"A100305","first_name":"CASEY","last_name":"HUDSON","classification":"C","division":"LIMITED","hit_factor":3.31},{"match_name":"SPSA USPSA December 1st Sat Match","match_date":"2016-12-03","stage_classifiercode":"99-16","member_number":"A88808","first_name":"RICK","last_name":"ROBERTS","classification":"C","division":"LIMITED","hit_factor":3.3066},{"match_name":"Dundee USPSA Mar 2017","match_date":"2017-03-25","stage_classifiercode":"99-16","member_number":"\"\"","first_name":"RICK","last_name":"RICKERT","classification":"U","division":"LIMITED","hit_factor":3.299},{"match_name":"Hernando Sportsmans Club","match_date":"2017-02-12","stage_classifiercode":"99-16","member_number":"A71729","first_name":"JIM","last_name":"MILLER","classification":"C","division":"LIMITED","hit_factor":3.2898},{"match_name":"Flagstaff Fun Shoot September 15 2018","match_date":"2018-09-15","stage_classifiercode":"99-16","member_number":"A-84474","first_name":"BOB","last_name":"WHEELER","classification":"\"\"","division":"LIMITED","hit_factor":3.2891},{"match_name":"Superior Practical Shooters - March Match","match_date":"2017-03-01","stage_classifiercode":"99-16","member_number":"A-97271","first_name":"BEN","last_name":"OREWILER","classification":"U","division":"LIMITED","hit_factor":3.286},{"match_name":"CCPL 2 Day Match 2018","match_date":"2018-04-26","stage_classifiercode":"99-16","member_number":"A99045","first_name":"ANTHONY","last_name":"NGUYEN","classification":"U","division":"LIMITED","hit_factor":3.2832},{"match_name":"BORCC USPSA July 2018 Classifier Match","match_date":"2018-07-02","stage_classifiercode":"99-16","member_number":"A106367","first_name":"DANIEL","last_name":"MATHIAS","classification":"B","division":"LIMITED","hit_factor":3.2787},{"match_name":"5 August - USPSA match - 17 South PSC","match_date":"2017-08-05","stage_classifiercode":"99-16","member_number":"a96881","first_name":"JASON","last_name":"KELLY","classification":"C","division":"LIMITED","hit_factor":3.2772},{"match_name":"PCWC USPSA  1 28 17","match_date":"2017-01-28","stage_classifiercode":"99-16","member_number":"A98606","first_name":"KEVIN","last_name":"LEE","classification":"U","division":"LIMITED","hit_factor":3.2727},{"match_name":"MCPSL Pistol 10-9-2021","match_date":"2021-10-09","stage_classifiercode":"99-16","member_number":"A137417","first_name":"JACOB","last_name":"HEPPNER","classification":"U","division":"LIMITED","hit_factor":3.27},{"match_name":"2da Copa Nacional USPSA ","match_date":"2016-05-22","stage_classifiercode":"99-16","member_number":"A88194","first_name":"HECTOR","last_name":"ROSARIO SERRANO","classification":"D","division":"LIMITED","hit_factor":3.2668},{"match_name":"MVS ANPRACS Classifier Match 6/3/17","match_date":"2017-05-31","stage_classifiercode":"99-16","member_number":"\"\"","first_name":"MICHAEL","last_name":"HILLIARD","classification":"\"\"","division":"LIMITED","hit_factor":3.2665},{"match_name":"SPSA USPSA June 1st Sat Match","match_date":"2021-06-05","stage_classifiercode":"99-16","member_number":"FY96072","first_name":"SCOTT","last_name":"FORTSON","classification":"B","division":"LIMITED","hit_factor":3.2563},{"match_name":"Pelham USPSA 2017-08-20","match_date":"2017-08-20","stage_classifiercode":"99-16","member_number":"\"\"","first_name":"PHILIP","last_name":"PAQUIN","classification":"Unclassified","division":"LIMITED","hit_factor":3.2476},{"match_name":"LGCSEMPS September 2017 Handgun","match_date":"2017-09-10","stage_classifiercode":"99-16","member_number":"A78900","first_name":"SVETLANA","last_name":"PAEGEL","classification":"C","division":"LIMITED","hit_factor":3.2385},{"match_name":"RBGC 2017-10-21","match_date":"2017-10-21","stage_classifiercode":"99-16","member_number":"A31955","first_name":"MARTY","last_name":"RUBIN","classification":"C","division":"LIMITED","hit_factor":3.2334},{"match_name":"TPS USPSA -  January 2017 - Talon Range","match_date":"2017-01-07","stage_classifiercode":"99-16","member_number":"\"\"","first_name":"PAUL","last_name":"CRAFT","classification":"U","division":"LIMITED","hit_factor":3.2315},{"match_name":"Shasta Shooters September 2016","match_date":"2016-09-10","stage_classifiercode":"99-16","member_number":"PEN","first_name":"JASON","last_name":"MOORE","classification":"U","division":"LIMITED","hit_factor":3.231},{"match_name":"Laser Ninja Dragon League MSA USPSA January 8th 2017","match_date":"2017-01-08","stage_classifiercode":"99-16","member_number":"A-90978","first_name":"KANE","last_name":"KOLISEK","classification":"B","division":"LIMITED","hit_factor":3.2258},{"match_name":"RCPS USPSA Sep 11","match_date":"2021-09-11","stage_classifiercode":"99-16","member_number":"TY60104","first_name":"STACY","last_name":"HYLTON","classification":"C","division":"LIMITED","hit_factor":3.2218},{"match_name":"BSPSC 2018 August Special Classifier","match_date":"2018-08-12","stage_classifiercode":"99-16","member_number":"TY62923","first_name":"TERRY","last_name":"MCCREA","classification":"D","division":"LIMITED","hit_factor":3.2178},{"match_name":"ENPS March 2017 USPSA Match","match_date":"2017-03-05","stage_classifiercode":"99-16","member_number":"TY48539","first_name":"TERRY","last_name":"BEGLEY","classification":"D","division":"LIMITED","hit_factor":3.2178},{"match_name":"CRC_20160514_SuperClassifier","match_date":"2016-05-14","stage_classifiercode":"99-16","member_number":"A95219","first_name":"LUKE","last_name":"POOLE","classification":"U","division":"LIMITED","hit_factor":3.2123},{"match_name":"OK15 USPSA at USSA","match_date":"2016-12-11","stage_classifiercode":"99-16","member_number":"A77565","first_name":"JASON","last_name":"GRANT","classification":"C","division":"LIMITED","hit_factor":3.2086},{"match_name":"Idaho ISPS August 5th Break from the Heat","match_date":"2017-08-05","stage_classifiercode":"99-16","member_number":"\"\"","first_name":"SCOTT","last_name":"LEONARD","classification":"U","division":"LIMITED","hit_factor":3.2031},{"match_name":"SWGC USPSA Pistol Match - December","match_date":"2016-12-03","stage_classifiercode":"99-16","member_number":"A49560","first_name":"LACY","last_name":"LOCKLEAR","classification":"C","division":"LIMITED","hit_factor":3.2031},{"match_name":"Shadow Hawk Defense USPSA Special Classifier","match_date":"2020-11-14","stage_classifiercode":"99-16","member_number":"FY130934","first_name":"SCOTT","last_name":"FITZSIMMONS","classification":"U","division":"LIMITED","hit_factor":3.1746},{"match_name":"RBGC 2017-10-21","match_date":"2017-10-21","stage_classifiercode":"99-16","member_number":"TY89180","first_name":"CHARLES","last_name":"HOLLANDS","classification":"C","division":"LIMITED","hit_factor":3.1668},{"match_name":"CCPL 02-09-2020","match_date":"2020-02-09","stage_classifiercode":"99-16","member_number":"A107370","first_name":"GERARD","last_name":"MEDEIROS","classification":"C","division":"LIMITED","hit_factor":3.1638},{"match_name":"Laser Ninja Dragon League MSA USPSA January 8th 2017","match_date":"2017-01-08","stage_classifiercode":"99-16","member_number":"A99880","first_name":"JEREMY","last_name":"LUSTER","classification":"C","division":"LIMITED","hit_factor":3.1625},{"match_name":"Laser Ninja Dragon League MSA USPSA January 8th 2017","match_date":"2017-01-08","stage_classifiercode":"99-16","member_number":"A-99711","first_name":"MICHAEL","last_name":"HENRY","classification":"U","division":"LIMITED","hit_factor":3.1579},{"match_name":"Hernando Sportsmans Club","match_date":"2017-02-12","stage_classifiercode":"99-16","member_number":"A97643","first_name":"SHIZUKA","last_name":"CAMPAGNA","classification":"D","division":"LIMITED","hit_factor":3.1348},{"match_name":"TPS USPSA -  January 2017 - Talon Range","match_date":"2017-01-07","stage_classifiercode":"99-16","member_number":"A-100154","first_name":"ANDAEW","last_name":"LAU","classification":"U","division":"LIMITED","hit_factor":3.1329},{"match_name":"RCPS USPSA 12 Nov 2016","match_date":"2016-11-12","stage_classifiercode":"99-16","member_number":"PEN","first_name":"DAN","last_name":"GREENE","classification":"U","division":"LIMITED","hit_factor":3.1325},{"match_name":"CCPL 2 Day Match 2018","match_date":"2018-04-26","stage_classifiercode":"99-16","member_number":"TY105155","first_name":"ALBERT","last_name":"COITO","classification":"D","division":"LIMITED","hit_factor":3.1303},{"match_name":"DAP December 2015 Classifier match","match_date":"2015-12-12","stage_classifiercode":"99-16","member_number":"TY81819","first_name":"TOD","last_name":"MAPPES","classification":"D","division":"LIMITED","hit_factor":3.125},{"match_name":"Pinetucky USPSA 02-27-16","match_date":"2016-02-27","stage_classifiercode":"99-16","member_number":"TY93534","first_name":"DANNY","last_name":"IDICA","classification":"D","division":"LIMITED","hit_factor":3.1198},{"match_name":"TPS USPSA -  April 2018 Clone","match_date":"2018-04-08","stage_classifiercode":"99-16","member_number":"a84115","first_name":"ALLIE","last_name":"HOWE","classification":"C","division":"LIMITED","hit_factor":3.1169},{"match_name":"Maine Practical Shooters May 2017","match_date":"2017-05-13","stage_classifiercode":"99-16","member_number":"\"\"","first_name":"ALEK","last_name":"MALISKI","classification":"none","division":"LIMITED","hit_factor":3.1049},{"match_name":"SFA USPSA NOVEMBER 14 2020","match_date":"2020-11-14","stage_classifiercode":"99-16","member_number":"A86005","first_name":"RICH","last_name":"FRY","classification":"B","division":"LIMITED","hit_factor":3.1032},{"match_name":"SFA USPSA March 2017","match_date":"2017-03-18","stage_classifiercode":"99-16","member_number":"TY67089","first_name":"ELYNDA","last_name":"LONG","classification":"D","division":"LIMITED","hit_factor":3.0973},{"match_name":"Range E11even October 2017","match_date":"2017-10-28","stage_classifiercode":"99-16","member_number":"A53524","first_name":"DAVE","last_name":"GRIFFITH","classification":"C","division":"LIMITED","hit_factor":3.0962},{"match_name":"Maine Practical Shooters May 2017","match_date":"2017-05-13","stage_classifiercode":"99-16","member_number":"PEN","first_name":"PETER","last_name":"EDGECOMB","classification":"\"\"","division":"LIMITED","hit_factor":3.0946},{"match_name":"Renton USPSA - August 2020 - NW05","match_date":"2020-08-23","stage_classifiercode":"99-16","member_number":"L4865","first_name":"CLIFFORD","last_name":"AGUILAR","classification":"U","division":"LIMITED","hit_factor":3.0864},{"match_name":"Sharp Practical Shooters May USPSA Match","match_date":"2018-05-27","stage_classifiercode":"99-16","member_number":"\"\"","first_name":"BRIAN","last_name":"BORSKE","classification":"X","division":"LIMITED","hit_factor":3.0856},{"match_name":"USPSA MO21 Special Classifier 2Alpha SBRC February 27 2021","match_date":"2021-02-27","stage_classifiercode":"99-16","member_number":"A92715","first_name":"J.R.","last_name":"WEBB","classification":"C","division":"LIMITED","hit_factor":3.0831},{"match_name":"WLPS USPSA Sep 2016","match_date":"2016-09-25","stage_classifiercode":"99-16","member_number":"\"\"","first_name":"JAMIE","last_name":"KIRK","classification":"U","division":"LIMITED","hit_factor":3.0827},{"match_name":"PCWC USPSA  1 28 17","match_date":"2017-01-28","stage_classifiercode":"99-16","member_number":"\"\"","first_name":"JOE","last_name":"CAVANAUGH","classification":"X","division":"LIMITED","hit_factor":3.0804},{"match_name":"Superior Practical Shooters - March Match","match_date":"2017-03-01","stage_classifiercode":"99-16","member_number":"A-101236","first_name":"ISAAC","last_name":"GROSFELD-KATZ","classification":"U","division":"LIMITED","hit_factor":3.0745},{"match_name":"Hosemasters 2nd Sunday May 2017","match_date":"2017-05-14","stage_classifiercode":"99-16","member_number":"A98722","first_name":"TOM","last_name":"BENNETT","classification":"U","division":"LIMITED","hit_factor":3.0705},{"match_name":"Hosemasters 2nd Sunday May 2017","match_date":"2017-05-14","stage_classifiercode":"99-16","member_number":"TY94645","first_name":"GENE","last_name":"ERICKSON","classification":"C","division":"LIMITED","hit_factor":3.0685},{"match_name":"Sharp Practical Shooters May USPSA Match","match_date":"2018-05-27","stage_classifiercode":"99-16","member_number":"\"\"","first_name":"TIFFANY","last_name":"TURNER","classification":"U","division":"LIMITED","hit_factor":3.0663},{"match_name":"SPSA USPSA July 4th Sat match","match_date":"2018-07-28","stage_classifiercode":"99-16","member_number":"A98983","first_name":"JAMES","last_name":"POOLE","classification":"C","division":"LIMITED","hit_factor":3.0655},{"match_name":"Sharp Practical Shooters May USPSA Match","match_date":"2018-05-27","stage_classifiercode":"99-16","member_number":"A105651","first_name":"DALE","last_name":"FORREST","classification":"U","division":"LIMITED","hit_factor":3.0655},{"match_name":"WLPS June 2017","match_date":"2017-06-25","stage_classifiercode":"99-16","member_number":"\"\"","first_name":"CHARLES","last_name":"HALL","classification":"U","division":"LIMITED","hit_factor":3.0635},{"match_name":"PCWC USPSA  1 28 17","match_date":"2017-01-28","stage_classifiercode":"99-16","member_number":"\"\"","first_name":"NATE","last_name":"LATHER","classification":"U","division":"LIMITED","hit_factor":3.0558},{"match_name":"Nampa USPSA May 27th 2020 Classifier Match","match_date":"2020-05-27","stage_classifiercode":"99-16","member_number":"A127019","first_name":"BRENT","last_name":"MERRICK","classification":"U","division":"LIMITED","hit_factor":3.0503},{"match_name":"SFA USPSA March 2017","match_date":"2017-03-18","stage_classifiercode":"99-16","member_number":"A100799","first_name":"JOSHUA","last_name":"COFFEY","classification":"U","division":"LIMITED","hit_factor":3.0496},{"match_name":"2da Copa Nacional USPSA ","match_date":"2016-05-22","stage_classifiercode":"99-16","member_number":"F93563","first_name":"JORGE L.","last_name":"ENCARNACIN","classification":"D","division":"LIMITED","hit_factor":3.0429},{"match_name":"Pinetucky USPSA 02-27-16","match_date":"2016-02-27","stage_classifiercode":"99-16","member_number":"A90786","first_name":"TYLER","last_name":"THOMAN","classification":"D","division":"LIMITED","hit_factor":3.0408},{"match_name":"MS06 Team Magnolia USPSA January Match2","match_date":"2016-01-03","stage_classifiercode":"99-16","member_number":"A77370","first_name":"MITCH","last_name":"SINGLEY","classification":"C","division":"LIMITED","hit_factor":3.0383},{"match_name":"CRC_20160514_SuperClassifier","match_date":"2016-05-14","stage_classifiercode":"99-16","member_number":"TY65590","first_name":"STEVE","last_name":"STETLER","classification":"A","division":"LIMITED","hit_factor":3.0377},{"match_name":"Pinetucky USPSA 02-27-16","match_date":"2016-02-27","stage_classifiercode":"99-16","member_number":"\"\"","first_name":"RONALD","last_name":"FRANKLIN","classification":"X","division":"LIMITED","hit_factor":3.0303},{"match_name":"Superior Practical Shooters - March Match","match_date":"2017-03-01","stage_classifiercode":"99-16","member_number":"A-92935","first_name":"JOHN","last_name":"JACKSON","classification":"D","division":"LIMITED","hit_factor":3.0224},{"match_name":"ARPC USPSA Match 3-26-17","match_date":"2017-03-26","stage_classifiercode":"99-16","member_number":"A101790","first_name":"SCOTTIE","last_name":"CORRIGAN","classification":"Unclassified","division":"LIMITED","hit_factor":3.0214},{"match_name":"LCSC USPSA 01.14.18","match_date":"2018-01-13","stage_classifiercode":"99-16","member_number":"A86333","first_name":"PAUL","last_name":"MARTINEZ","classification":"A","division":"LIMITED","hit_factor":3.0199},{"match_name":"EWPSA 2018-09","match_date":"2018-09-16","stage_classifiercode":"99-16","member_number":"TY35490","first_name":"MARK","last_name":"BRADLEY","classification":"M","division":"LIMITED","hit_factor":3.0159},{"match_name":"PRG-USPSA - Oh Shoot January 3rd - 1st Sunday","match_date":"2021-01-03","stage_classifiercode":"99-16","member_number":"TY128944","first_name":"FERNANDO","last_name":"HUERTA","classification":"U","division":"LIMITED","hit_factor":2.9983},{"match_name":"NNRPA USPSA March 26th 2016","match_date":"2016-03-26","stage_classifiercode":"99-16","member_number":"TY51797","first_name":"DENNIS","last_name":"MARSH","classification":"C","division":"LIMITED","hit_factor":2.9952},{"match_name":"ARPC USPSA Match 3-26-17","match_date":"2017-03-26","stage_classifiercode":"99-16","member_number":"A95803","first_name":"ANDREW","last_name":"OLWIG","classification":"C","division":"LIMITED","hit_factor":2.9838},{"match_name":"CCPL 02-09-2020","match_date":"2020-02-09","stage_classifiercode":"99-16","member_number":"TY114590","first_name":"JEREMY","last_name":"ALBRIGHT","classification":"A","division":"LIMITED","hit_factor":2.9814},{"match_name":"PIPS 07-25-2018","match_date":"2018-07-25","stage_classifiercode":"99-16","member_number":"A17334","first_name":"BRAD","last_name":"MATTISON","classification":"M","division":"LIMITED","hit_factor":2.9805},{"match_name":"Pinetucky USPSA 02-27-16","match_date":"2016-02-27","stage_classifiercode":"99-16","member_number":"A93416","first_name":"MICHAEL","last_name":"BALLIET","classification":"U","division":"LIMITED","hit_factor":2.9791},{"match_name":"Laser Ninja Dragon League MSA USPSA January 8th 2017","match_date":"2017-01-08","stage_classifiercode":"99-16","member_number":"1095","first_name":"CHARLIE","last_name":"BARRY","classification":"C","division":"LIMITED","hit_factor":2.9703},{"match_name":"March 2016 USPSA Ponca CityMatch","match_date":"2016-03-12","stage_classifiercode":"99-16","member_number":"\"\"","first_name":"DENNIS","last_name":"SANDERS","classification":"U","division":"LIMITED","hit_factor":2.967},{"match_name":"SWGC USPSA Pistol Match - December","match_date":"2016-12-03","stage_classifiercode":"99-16","member_number":"TY49325","first_name":"JOHN","last_name":"REID","classification":"B","division":"LIMITED","hit_factor":2.9656},{"match_name":"BSPSC 2018 August Special Classifier","match_date":"2018-08-12","stage_classifiercode":"99-16","member_number":"A81810","first_name":"NANETTE","last_name":"MOROZUMI","classification":"C","division":"LIMITED","hit_factor":2.9624},{"match_name":"Pinetucky USPSA 02-27-16","match_date":"2016-02-27","stage_classifiercode":"99-16","member_number":"PEN","first_name":"RACHEL","last_name":"MYERS","classification":"X","division":"LIMITED","hit_factor":2.9603},{"match_name":"RCPS USPSA 12 Nov 2016","match_date":"2016-11-12","stage_classifiercode":"99-16","member_number":"A94198","first_name":"JUSTIN","last_name":"HORNBUCKLE","classification":"D","division":"LIMITED","hit_factor":2.9593},{"match_name":"Pelham USPSA 2017-08-20","match_date":"2017-08-20","stage_classifiercode":"99-16","member_number":"A103474","first_name":"JASON","last_name":"BISCHOFF","classification":"D","division":"LIMITED","hit_factor":2.9547},{"match_name":"Laser Ninja Dragon League MSA USPSA January 8th 2017","match_date":"2017-01-08","stage_classifiercode":"99-16","member_number":"A-99946","first_name":"DEREK","last_name":"NEW","classification":"U","division":"LIMITED","hit_factor":2.9524},{"match_name":"SWGC USPSA Pistol Match - December","match_date":"2016-12-03","stage_classifiercode":"99-16","member_number":"A54296","first_name":"ROBERT","last_name":"BOWLES","classification":"B","division":"LIMITED","hit_factor":2.9442},{"match_name":"WLPS June 2017","match_date":"2017-06-25","stage_classifiercode":"99-16","member_number":"A100305","first_name":"CASEY","last_name":"HUDSON","classification":"D","division":"LIMITED","hit_factor":2.9295},{"match_name":"CCPL 02-09-2020","match_date":"2020-02-09","stage_classifiercode":"99-16","member_number":"L4505","first_name":"GREG","last_name":"VAUGHN","classification":"A","division":"LIMITED","hit_factor":2.9284},{"match_name":"West Liberty USPSA Oct 2018","match_date":"2018-10-28","stage_classifiercode":"99-16","member_number":"A112534","first_name":"TOM","last_name":"KEEFE","classification":"U","division":"LIMITED","hit_factor":2.9221},{"match_name":"BRSP Tuesday Night USPSA Match - June 5","match_date":"2018-06-06","stage_classifiercode":"99-16","member_number":"A104930","first_name":"DON","last_name":"EASTERLY","classification":"D","division":"LIMITED","hit_factor":2.9108},{"match_name":"SPSA USPSA December 1st Sat Match","match_date":"2016-12-03","stage_classifiercode":"99-16","member_number":"A97524","first_name":"IVAN","last_name":"LIECHTY","classification":"U","division":"LIMITED","hit_factor":2.9046},{"match_name":"4ta Fecha USPSA","match_date":"2018-04-07","stage_classifiercode":"99-16","member_number":"\"\"","first_name":"OMAR J.","last_name":"MORALES-RIVERA","classification":"U","division":"LIMITED","hit_factor":2.8945},{"match_name":"4ta Fecha USPSA","match_date":"2018-04-07","stage_classifiercode":"99-16","member_number":"\"\"","first_name":"EDGAR O","last_name":"RIVERA REYES","classification":"U","division":"LIMITED","hit_factor":2.893},{"match_name":"Idaho ISPS August 5th Break from the Heat","match_date":"2017-08-05","stage_classifiercode":"99-16","member_number":"TY57674","first_name":"GARY","last_name":"CASNER","classification":"C","division":"LIMITED","hit_factor":2.8918},{"match_name":"CIPSC Havana July USPSA","match_date":"2018-07-07","stage_classifiercode":"99-16","member_number":"A90793","first_name":"NOEL","last_name":"ZEMAN","classification":"B","division":"LIMITED","hit_factor":2.8888888888889},{"match_name":"ORSA USPSA August 2020","match_date":"2020-08-15","stage_classifiercode":"99-16","member_number":"A121843","first_name":"BUBBA","last_name":"RICKER","classification":"C","division":"LIMITED","hit_factor":2.8651},{"match_name":"AIPS Weekly USPSA 3 August 2021","match_date":"2021-08-03","stage_classifiercode":"99-16","member_number":"A120380","first_name":"JAN","last_name":"POLAND","classification":"D","division":"LIMITED","hit_factor":2.864},{"match_name":"Maine Practical Shooters May 2017","match_date":"2017-05-13","stage_classifiercode":"99-16","member_number":"A102777","first_name":"FRANCIS","last_name":"SANTOS","classification":"U","division":"LIMITED","hit_factor":2.8638},{"match_name":"Briar Rabbit  June Match 2016 OH 20","match_date":"2016-06-12","stage_classifiercode":"99-16","member_number":"\"\"","first_name":"MIKE","last_name":"MARTIN","classification":"D","division":"LIMITED","hit_factor":2.8614},{"match_name":"5 August - USPSA match - 17 South PSC","match_date":"2017-08-05","stage_classifiercode":"99-16","member_number":"A104657","first_name":"JAMEY","last_name":"SAUNDERS","classification":"C","division":"LIMITED","hit_factor":2.8537},{"match_name":"Rio Grande Practical Shooters - May 2018","match_date":"2018-05-05","stage_classifiercode":"99-16","member_number":"A102831","first_name":"RICKY","last_name":"KENNEDY","classification":"D","division":"LIMITED","hit_factor":2.8505},{"match_name":"Briar Rabbit  June Match 2016 OH 20","match_date":"2016-06-12","stage_classifiercode":"99-16","member_number":"A95933","first_name":"AJ","last_name":"DAVIS","classification":"U","division":"LIMITED","hit_factor":2.8436},{"match_name":"USPSA MO21 Special Classifier 2Alpha SBRC February 27 2021","match_date":"2021-02-27","stage_classifiercode":"99-16","member_number":"A130070","first_name":"CHRIS","last_name":"SHORT","classification":"C","division":"LIMITED","hit_factor":2.8424},{"match_name":"PCWC USPSA  1 28 17","match_date":"2017-01-28","stage_classifiercode":"99-16","member_number":"A91782","first_name":"OLGA","last_name":"KELLEY","classification":"D","division":"LIMITED","hit_factor":2.8413},{"match_name":"RCPS USPSA 12 Nov 2016","match_date":"2016-11-12","stage_classifiercode":"99-16","member_number":"PEN","first_name":"PAUL","last_name":"PEPE","classification":"X","division":"LIMITED","hit_factor":2.8369},{"match_name":"WMPS  11-13-2016","match_date":"2016-11-13","stage_classifiercode":"99-16","member_number":"\"\"","first_name":"SETH","last_name":"NADEL","classification":"B","division":"LIMITED","hit_factor":2.8365},{"match_name":"MvpNov2015","match_date":"2015-11-06","stage_classifiercode":"99-16","member_number":"a17414","first_name":"JAN","last_name":"SCULLY","classification":"B","division":"LIMITED","hit_factor":2.8361},{"match_name":"SPSA USPSA June 1st Sat Match","match_date":"2021-06-05","stage_classifiercode":"99-16","member_number":"TY88693","first_name":"ANDY","last_name":"POTEAT","classification":"B","division":"LIMITED","hit_factor":2.8302},{"match_name":"Pima Pistol Club USPSA Match - May 29 ","match_date":"2016-05-29","stage_classifiercode":"99-16","member_number":"\"\"","first_name":"CHARLES","last_name":"HOOVER","classification":"\"\"","division":"LIMITED","hit_factor":2.8259},{"match_name":"LGCSEMPS September 2017 Handgun","match_date":"2017-09-10","stage_classifiercode":"99-16","member_number":"A104581","first_name":"GERALD","last_name":"BEAUDET","classification":"U","division":"LIMITED","hit_factor":2.8256},{"match_name":"PCWC USPSA  1 28 17","match_date":"2017-01-28","stage_classifiercode":"99-16","member_number":"ty96982","first_name":"TOM","last_name":"HORNER","classification":"U","division":"LIMITED","hit_factor":2.824},{"match_name":"Flagstaff Fun Shoot September 15 2018","match_date":"2018-09-15","stage_classifiercode":"99-16","member_number":"A82213","first_name":"DEB","last_name":"WOLF","classification":"\"\"","division":"LIMITED","hit_factor":2.8238},{"match_name":"Renton USPSA - August 2020 - NW05","match_date":"2020-08-23","stage_classifiercode":"99-16","member_number":"fy122523","first_name":"WISLY","last_name":"MARTINEZ","classification":"U","division":"LIMITED","hit_factor":2.8157},{"match_name":"Hosemasters 2nd Sunday May 2017","match_date":"2017-05-14","stage_classifiercode":"99-16","member_number":"FY66994","first_name":"SCOTT","last_name":"BONOMO","classification":"B","division":"LIMITED","hit_factor":2.8103},{"match_name":"ORSA USPSA August 2020","match_date":"2020-08-15","stage_classifiercode":"99-16","member_number":"TY112420","first_name":"JAMES","last_name":"LANEY","classification":"U","division":"LIMITED","hit_factor":2.8084},{"match_name":"LCSC USPSA 01.14.18","match_date":"2018-01-13","stage_classifiercode":"99-16","member_number":"A103682","first_name":"CARLOS","last_name":"CARRASQUEL","classification":"U","division":"LIMITED","hit_factor":2.8058},{"match_name":"CCPL 02-09-2020","match_date":"2020-02-09","stage_classifiercode":"99-16","member_number":"A91855","first_name":"PEDRO","last_name":"BRAZ","classification":"B","division":"LIMITED","hit_factor":2.8037},{"match_name":"Dundee USPSA Mar 2017","match_date":"2017-03-25","stage_classifiercode":"99-16","member_number":"TY98312","first_name":"STEVEN","last_name":"WRIGHT","classification":"U","division":"LIMITED","hit_factor":2.8033},{"match_name":"Range E11even October 2017","match_date":"2017-10-28","stage_classifiercode":"99-16","member_number":"\"\"","first_name":"DEVIN","last_name":"DAVIS","classification":"U","division":"LIMITED","hit_factor":2.8019},{"match_name":"Rio Grande Practical Shooters - May 2018","match_date":"2018-05-05","stage_classifiercode":"99-16","member_number":"A105188","first_name":"DEMIR","last_name":"ORAL","classification":"D","division":"LIMITED","hit_factor":2.7988},{"match_name":"ORSA USPSA July 2016 ","match_date":"2016-07-16","stage_classifiercode":"99-16","member_number":"A21270","first_name":"BRUCE","last_name":"IHLENFELD","classification":"C","division":"LIMITED","hit_factor":2.7985},{"match_name":"ENPS March 2017 USPSA Match","match_date":"2017-03-05","stage_classifiercode":"99-16","member_number":"A89507","first_name":"JUSTYN A","last_name":"RILEY","classification":"C","division":"LIMITED","hit_factor":2.795},{"match_name":"MVS ANPRACS Classifier Match 6/3/17","match_date":"2017-05-31","stage_classifiercode":"99-16","member_number":"A93950","first_name":"LUCAS","last_name":"LOHT","classification":"U","division":"LIMITED","hit_factor":2.7948},{"match_name":"West Liberty USPSA Oct 2018","match_date":"2018-10-28","stage_classifiercode":"99-16","member_number":"Ty95801","first_name":"SHAWN","last_name":"MALONEY","classification":"C","division":"LIMITED","hit_factor":2.7927},{"match_name":"Coyote Arms USPSA","match_date":"2016-09-17","stage_classifiercode":"99-16","member_number":"TY50475","first_name":"ROLAND","last_name":"VILLAREAL","classification":"B","division":"LIMITED","hit_factor":2.7861},{"match_name":"5 August - USPSA match - 17 South PSC","match_date":"2017-08-05","stage_classifiercode":"99-16","member_number":"\"\"","first_name":"EVERETTE","last_name":"REECK","classification":"U","division":"LIMITED","hit_factor":2.7793},{"match_name":"TPS USPSA -  January 2017 - Talon Range","match_date":"2017-01-07","stage_classifiercode":"99-16","member_number":"non member","first_name":"BILL","last_name":"BELL","classification":"C","division":"LIMITED","hit_factor":2.7765},{"match_name":"Rio Grande Practical Shooters - May 2018","match_date":"2018-05-05","stage_classifiercode":"99-16","member_number":"\"\"","first_name":"GEORGE","last_name":"HAUSNER","classification":"U","division":"LIMITED","hit_factor":2.7752},{"match_name":"CIPSC Havana July USPSA","match_date":"2018-07-07","stage_classifiercode":"99-16","member_number":"A103675","first_name":"TONY","last_name":"COOK","classification":"C","division":"LIMITED","hit_factor":2.7749229188078},{"match_name":"RCPS USPSA Sep 11","match_date":"2021-09-11","stage_classifiercode":"99-16","member_number":"TY122942","first_name":"BRIAN","last_name":"GRAY","classification":"U","division":"LIMITED","hit_factor":2.7743},{"match_name":"AVAP CLASSIFIER 71418","match_date":"2018-07-14","stage_classifiercode":"99-16","member_number":"A104324","first_name":"JONATHAN","last_name":"ESPINOZA","classification":"U","division":"LIMITED","hit_factor":2.769},{"match_name":"Shadow Hawk Defense USPSA Special Classifier","match_date":"2020-11-14","stage_classifiercode":"99-16","member_number":"A128315","first_name":"LARRY","last_name":"SALO","classification":"U","division":"LIMITED","hit_factor":2.766},{"match_name":"Idaho ISPS August 5th Break from the Heat","match_date":"2017-08-05","stage_classifiercode":"99-16","member_number":"A99406","first_name":"RICK","last_name":"JUNGE","classification":"C","division":"LIMITED","hit_factor":2.7656},{"match_name":"WLPS June 2017","match_date":"2017-06-25","stage_classifiercode":"99-16","member_number":"\"\"","first_name":"LEO","last_name":"BERTLING","classification":"U","division":"LIMITED","hit_factor":2.7637},{"match_name":"Superior Practical Shooters - March Match","match_date":"2017-03-01","stage_classifiercode":"99-16","member_number":"a92892","first_name":"MIKE","last_name":"LIVINGSTON","classification":"U","division":"LIMITED","hit_factor":2.7586},{"match_name":"SFPS 10-08-2017 USPSA match","match_date":"2017-10-08","stage_classifiercode":"99-16","member_number":"A106055","first_name":"JOE","last_name":"BROCKELSBY","classification":"U","division":"LIMITED","hit_factor":2.7548},{"match_name":"SPSA USPSA July 4th Sat match","match_date":"2018-07-28","stage_classifiercode":"99-16","member_number":"TY97524","first_name":"IVAN","last_name":"LIECHTY","classification":"C","division":"LIMITED","hit_factor":2.7536},{"match_name":"Dundee USPSA Mar 2017","match_date":"2017-03-25","stage_classifiercode":"99-16","member_number":"TY53715","first_name":"DAN","last_name":"ORME","classification":"C","division":"LIMITED","hit_factor":2.7516},{"match_name":"ORSA USPSA July 2016 ","match_date":"2016-07-16","stage_classifiercode":"99-16","member_number":"TY90051","first_name":"JOHN","last_name":"SCHWAGER","classification":"U","division":"LIMITED","hit_factor":2.7442},{"match_name":"Pelham USPSA 2017-08-20","match_date":"2017-08-20","stage_classifiercode":"99-16","member_number":"A104656","first_name":"CRAIG","last_name":"TRAHAN","classification":"U","division":"LIMITED","hit_factor":2.7408},{"match_name":"Idaho ISPS August 5th Break from the Heat","match_date":"2017-08-05","stage_classifiercode":"99-16","member_number":"A104647","first_name":"KURT","last_name":"KELSON","classification":"U","division":"LIMITED","hit_factor":2.7387},{"match_name":"DWB - Deadwood Boys USPSA 20 May 2018","match_date":"2018-05-20","stage_classifiercode":"99-16","member_number":"ty93265","first_name":"DUNN","last_name":"BILL","classification":"C","division":"LIMITED","hit_factor":2.7382},{"match_name":"Superior Practical Shooters - March Match","match_date":"2017-03-01","stage_classifiercode":"99-16","member_number":"\"\"","first_name":"COLEMAN","last_name":"BONNEY","classification":"U","division":"LIMITED","hit_factor":2.7382},{"match_name":"Nampa USPSA May 27th 2020 Classifier Match","match_date":"2020-05-27","stage_classifiercode":"99-16","member_number":"TY93831","first_name":"SUSAN","last_name":"QUINT","classification":"C","division":"LIMITED","hit_factor":2.7357},{"match_name":"EWPSA 2018-09","match_date":"2018-09-16","stage_classifiercode":"99-16","member_number":"\"\"","first_name":"TREVOR","last_name":"VANARSDALE","classification":"\"\"","division":"LIMITED","hit_factor":2.7352},{"match_name":"Rio Grande Practical Shooters - May 2018","match_date":"2018-05-05","stage_classifiercode":"99-16","member_number":"\"\"","first_name":"MIKE","last_name":"OWENS","classification":"\"\"","division":"LIMITED","hit_factor":2.7337},{"match_name":"LCSC USPSA 01.14.18","match_date":"2018-01-13","stage_classifiercode":"99-16","member_number":"A106811","first_name":"CHRISTOPHER","last_name":"HAND","classification":"U","division":"LIMITED","hit_factor":2.7331},{"match_name":"CCPL 2 Day Match 2018","match_date":"2018-04-26","stage_classifiercode":"99-16","member_number":"A88980","first_name":"GARY","last_name":"LAMB","classification":"D","division":"LIMITED","hit_factor":2.7295},{"match_name":"2da Copa Nacional USPSA ","match_date":"2016-05-22","stage_classifiercode":"99-16","member_number":"\"\"","first_name":"NESTOR A.","last_name":"FLORES ACOSTA","classification":"U","division":"LIMITED","hit_factor":2.7182},{"match_name":"HRC Jul 08 2017","match_date":"2017-07-07","stage_classifiercode":"99-16","member_number":"A39468","first_name":"DAVE","last_name":"CANNEY","classification":"U","division":"LIMITED","hit_factor":2.7146},{"match_name":"Idaho ISPS August 5th Break from the Heat","match_date":"2017-08-05","stage_classifiercode":"99-16","member_number":"\"\"","first_name":"JOHN","last_name":"BELL","classification":"U","division":"LIMITED","hit_factor":2.7127},{"match_name":"Pinetucky USPSA 02-27-16","match_date":"2016-02-27","stage_classifiercode":"99-16","member_number":"PEN","first_name":"JEFF","last_name":"REXROAT","classification":"U","division":"LIMITED","hit_factor":2.7055},{"match_name":"Pinetucky USPSA 02-27-16","match_date":"2016-02-27","stage_classifiercode":"99-16","member_number":"\"\"","first_name":"MIKE","last_name":"OPACITY","classification":"G","division":"LIMITED","hit_factor":2.7041},{"match_name":"March 2016 USPSA Ponca CityMatch","match_date":"2016-03-12","stage_classifiercode":"99-16","member_number":"\"\"","first_name":"LARRY","last_name":"MILLER","classification":"U","division":"LIMITED","hit_factor":2.6965},{"match_name":"Superior Practical Shooters - March Match","match_date":"2017-03-01","stage_classifiercode":"99-16","member_number":"\"\"","first_name":"ALEXANDER","last_name":"SBRANA","classification":"U","division":"LIMITED","hit_factor":2.6942},{"match_name":"Laser Ninja Dragon League MSA USPSA January 8th 2017","match_date":"2017-01-08","stage_classifiercode":"99-16","member_number":"\"\"","first_name":"KEAGAN","last_name":"PARHAM","classification":"G","division":"LIMITED","hit_factor":2.6921},{"match_name":"5 August - USPSA match - 17 South PSC","match_date":"2017-08-05","stage_classifiercode":"99-16","member_number":"\"\"","first_name":"NICHOLAS","last_name":"MERVA","classification":"U","division":"LIMITED","hit_factor":2.6653},{"match_name":"Hosemasters 2nd Sunday May 2017","match_date":"2017-05-14","stage_classifiercode":"99-16","member_number":"A84050","first_name":"DONNA","last_name":"HANCOCK","classification":"D","division":"LIMITED","hit_factor":2.6618},{"match_name":"CCPL 2 Day Match 2018","match_date":"2018-04-26","stage_classifiercode":"99-16","member_number":"A107370","first_name":"GERARD","last_name":"MEDEIROS","classification":"U","division":"LIMITED","hit_factor":2.6616},{"match_name":"CRC_20160514_SuperClassifier","match_date":"2016-05-14","stage_classifiercode":"99-16","member_number":"A96539","first_name":"BECKY","last_name":"MUELLER","classification":"U","division":"LIMITED","hit_factor":2.6576},{"match_name":"Coyote Arms USPSA","match_date":"2016-09-17","stage_classifiercode":"99-16","member_number":"TY87589","first_name":"PASTOR BOB","last_name":"ALDERMAN","classification":"C","division":"LIMITED","hit_factor":2.6554},{"match_name":"5 August - USPSA match - 17 South PSC","match_date":"2017-08-05","stage_classifiercode":"99-16","member_number":"7065333","first_name":"GENE","last_name":"GRAHAM","classification":"U","division":"LIMITED","hit_factor":2.6422},{"match_name":"Superior Practical Shooters - March Match","match_date":"2017-03-01","stage_classifiercode":"99-16","member_number":"\"\"","first_name":"JEFFREY","last_name":"JACOB","classification":"U","division":"LIMITED","hit_factor":2.6393},{"match_name":"MvpNov2015","match_date":"2015-11-06","stage_classifiercode":"99-16","member_number":"a93228","first_name":"BOB","last_name":"WATSON","classification":"U","division":"LIMITED","hit_factor":2.6367},{"match_name":"Superior Practical Shooters - March Match","match_date":"2017-03-01","stage_classifiercode":"99-16","member_number":"NA","first_name":"CRAIG","last_name":"SILVA","classification":"U","division":"LIMITED","hit_factor":2.6316},{"match_name":"Coyote Arms USPSA","match_date":"2016-09-17","stage_classifiercode":"99-16","member_number":"\"\"","first_name":"WAYNE","last_name":"WILLIAMS","classification":"\"\"","division":"LIMITED","hit_factor":2.6257},{"match_name":"ORSA USPSA July 2016 ","match_date":"2016-07-16","stage_classifiercode":"99-16","member_number":"A94902","first_name":"DON","last_name":"REAGAN","classification":"U","division":"LIMITED","hit_factor":2.6221},{"match_name":"Dundee USPSA Mar 2017","match_date":"2017-03-25","stage_classifiercode":"99-16","member_number":"PEN","first_name":"JIM","last_name":"BATES","classification":"U","division":"LIMITED","hit_factor":2.6164},{"match_name":"Superior Practical Shooters - March Match","match_date":"2017-03-01","stage_classifiercode":"99-16","member_number":"6658354","first_name":"ROBERT","last_name":"WATSON","classification":"U","division":"LIMITED","hit_factor":2.6071},{"match_name":"Dundee USPSA Mar 2017","match_date":"2017-03-25","stage_classifiercode":"99-16","member_number":"A94713","first_name":"CODY","last_name":"OLSEN","classification":"C","division":"LIMITED","hit_factor":2.6022},{"match_name":"SFA USPSA NOVEMBER 14 2020","match_date":"2020-11-14","stage_classifiercode":"99-16","member_number":"A118507","first_name":"JOE","last_name":"GUTIERREZ","classification":"D","division":"LIMITED","hit_factor":2.5952},{"match_name":"Rio Grande Practical Shooters - May 2018","match_date":"2018-05-05","stage_classifiercode":"99-16","member_number":"A95675","first_name":"GABRIEL","last_name":"NAJAR","classification":"U","division":"LIMITED","hit_factor":2.5943},{"match_name":"LGCSEMPS September 2017 Handgun","match_date":"2017-09-10","stage_classifiercode":"99-16","member_number":"A 104912","first_name":"WILLIAM","last_name":"SMITH","classification":"U","division":"LIMITED","hit_factor":2.5937},{"match_name":"ENPS March 2017 USPSA Match","match_date":"2017-03-05","stage_classifiercode":"99-16","member_number":"PEN","first_name":"ZACHARY","last_name":"FALLOWFIELD","classification":"U","division":"LIMITED","hit_factor":2.592},{"match_name":"WLPS USPSA Sep 2016","match_date":"2016-09-25","stage_classifiercode":"99-16","member_number":"0","first_name":"TONY","last_name":"HAINLINE","classification":"U","division":"LIMITED","hit_factor":2.581},{"match_name":"PIPS 05-25-2016","match_date":"2016-05-24","stage_classifiercode":"99-16","member_number":"PEN","first_name":"LAYTON","last_name":"BADGER","classification":"C","division":"LIMITED","hit_factor":2.5768},{"match_name":"Bass River USPSA September 2018","match_date":"2018-09-02","stage_classifiercode":"99-16","member_number":"ty29024","first_name":"RAY","last_name":"GOGUEN","classification":"A","division":"LIMITED","hit_factor":2.5765},{"match_name":"MS06 Team Magnolia USPSA January Match2","match_date":"2016-01-03","stage_classifiercode":"99-16","member_number":"A78158","first_name":"COLBY","last_name":"ORTEGA","classification":"D","division":"LIMITED","hit_factor":2.5758},{"match_name":"EWPSA 2018-09","match_date":"2018-09-16","stage_classifiercode":"99-16","member_number":"\"\"","first_name":"ADAM","last_name":"NICKEL","classification":"U","division":"LIMITED","hit_factor":2.5743},{"match_name":"LGCSEMPS September 2017 Handgun","match_date":"2017-09-10","stage_classifiercode":"99-16","member_number":"A103722","first_name":"KEVIN","last_name":"HALL","classification":"U","division":"LIMITED","hit_factor":2.5707},{"match_name":"Range E11even October 2017","match_date":"2017-10-28","stage_classifiercode":"99-16","member_number":"\"\"","first_name":"TED","last_name":"SHORE","classification":"U","division":"LIMITED","hit_factor":2.5707},{"match_name":"RCPS USPSA 12 Nov 2016","match_date":"2016-11-12","stage_classifiercode":"99-16","member_number":"\"\"","first_name":"DANIEL","last_name":"FORY","classification":"X","division":"LIMITED","hit_factor":2.5681},{"match_name":"Nampa USPSA May 27th 2020 Classifier Match","match_date":"2020-05-27","stage_classifiercode":"99-16","member_number":"A102914","first_name":"JOHN","last_name":"KOTAKI","classification":"C","division":"LIMITED","hit_factor":2.5575},{"match_name":"RBGC 2017-10-21","match_date":"2017-10-21","stage_classifiercode":"99-16","member_number":"A101916","first_name":"ZAKK","last_name":"RUTLEDGE","classification":"U","division":"LIMITED","hit_factor":2.5562},{"match_name":"CCPL 2 Day Match 2018","match_date":"2018-04-26","stage_classifiercode":"99-16","member_number":"\"\"","first_name":"COOKIE","last_name":"CHAN","classification":"U","division":"LIMITED","hit_factor":2.5527},{"match_name":"Dundee USPSA Mar 2017","match_date":"2017-03-25","stage_classifiercode":"99-16","member_number":"A96112","first_name":"JEFF","last_name":"BOWERS","classification":"U","division":"LIMITED","hit_factor":2.5493},{"match_name":"RCPS USPSA 12 Nov 2016","match_date":"2016-11-12","stage_classifiercode":"99-16","member_number":"PEN","first_name":"STEPHEN","last_name":"COUNCIL","classification":"U","division":"LIMITED","hit_factor":2.5483},{"match_name":"ARPC USPSA Match 3-26-17","match_date":"2017-03-26","stage_classifiercode":"99-16","member_number":"PENDING","first_name":"BRIDGETTE","last_name":"MILLER","classification":"Unclassified","division":"LIMITED","hit_factor":2.543},{"match_name":"MPSA 101720 USPSA","match_date":"2020-10-17","stage_classifiercode":"99-16","member_number":"a119434","first_name":"ANTHONY","last_name":"EVANS","classification":"C","division":"LIMITED","hit_factor":2.5397},{"match_name":"Dundee USPSA Mar 2017","match_date":"2017-03-25","stage_classifiercode":"99-16","member_number":"\"\"","first_name":"MARK","last_name":"MCHUGH","classification":"U","division":"LIMITED","hit_factor":2.5338},{"match_name":"West Liberty USPSA Oct 2018","match_date":"2018-10-28","stage_classifiercode":"99-16","member_number":"TY57083","first_name":"WILLIAM","last_name":"WILLSON","classification":"C","division":"LIMITED","hit_factor":2.5309},{"match_name":"AIPS Weekly USPSA 3 August 2021","match_date":"2021-08-03","stage_classifiercode":"99-16","member_number":"A123164","first_name":"TANNER","last_name":"POLAND","classification":"D","division":"LIMITED","hit_factor":2.529},{"match_name":"SPSA USPSA June 1st Sat Match","match_date":"2021-06-05","stage_classifiercode":"99-16","member_number":"TY118798","first_name":"TIM","last_name":"VANBLON","classification":"C","division":"LIMITED","hit_factor":2.5285},{"match_name":"MSSA Uspsa Club Matcg","match_date":"2017-09-24","stage_classifiercode":"99-16","member_number":"TY79011","first_name":"JOYCE","last_name":"BEGGS","classification":"D","division":"LIMITED","hit_factor":2.5228},{"match_name":"USPSA MO21 Special Classifier 2Alpha SBRC February 27 2021","match_date":"2021-02-27","stage_classifiercode":"99-16","member_number":"A105069","first_name":"MICHAEL","last_name":"KINCHELOE","classification":"D","division":"LIMITED","hit_factor":2.5157},{"match_name":"HRC Jul 08 2017","match_date":"2017-07-07","stage_classifiercode":"99-16","member_number":"A91234","first_name":"RICK","last_name":"NAGINE","classification":"U","division":"LIMITED","hit_factor":2.5108},{"match_name":"SFA USPSA NOVEMBER 14 2020","match_date":"2020-11-14","stage_classifiercode":"99-16","member_number":"TY126180","first_name":"DAVID","last_name":"MOHN","classification":"U - I don't know and don't care","division":"LIMITED","hit_factor":2.5094},{"match_name":"Coyote Arms USPSA","match_date":"2016-09-17","stage_classifiercode":"99-16","member_number":"TY85728","first_name":"BOBBI","last_name":"HOLLAND","classification":"D","division":"LIMITED","hit_factor":2.5018},{"match_name":"SFPS 10-08-2017 USPSA match","match_date":"2017-10-08","stage_classifiercode":"99-16","member_number":"FY65949","first_name":"GARY","last_name":"STEWART","classification":"D","division":"LIMITED","hit_factor":2.4941},{"match_name":"NNRPA USPSA March 26th 2016","match_date":"2016-03-26","stage_classifiercode":"99-16","member_number":"\"\"","first_name":"TY","last_name":"TERVORT","classification":"U","division":"LIMITED","hit_factor":2.4872},{"match_name":"FLPSA MN14 USPSA May 17 2018","match_date":"2018-05-17","stage_classifiercode":"99-16","member_number":"A86797","first_name":"RON","last_name":"ROZESKE","classification":"D","division":"LIMITED","hit_factor":2.4818},{"match_name":"Pinetucky USPSA 02-27-16","match_date":"2016-02-27","stage_classifiercode":"99-16","member_number":"\"\"","first_name":"KEVIN","last_name":"KIGHT","classification":"X","division":"LIMITED","hit_factor":2.4715},{"match_name":"SFA USPSA March 2017","match_date":"2017-03-18","stage_classifiercode":"99-16","member_number":"\"\"","first_name":"ZACH","last_name":"STETSON","classification":"U","division":"LIMITED","hit_factor":2.4703},{"match_name":"Shasta Shooters 2020 Dec","match_date":"2020-12-12","stage_classifiercode":"99-16","member_number":"fy21065","first_name":"PETE","last_name":"RAY","classification":"C","division":"LIMITED","hit_factor":2.4615},{"match_name":"ORSA USPSA August 2020","match_date":"2020-08-15","stage_classifiercode":"99-16","member_number":"A118177","first_name":"MARY","last_name":"KING","classification":"D","division":"LIMITED","hit_factor":2.4545},{"match_name":"TPS USPSA -  April 2018 Clone","match_date":"2018-04-08","stage_classifiercode":"99-16","member_number":"\"\"","first_name":"BRITTANY","last_name":"REESE","classification":"U","division":"LIMITED","hit_factor":2.4483},{"match_name":"Renton USPSA - August 2020 - NW05","match_date":"2020-08-23","stage_classifiercode":"99-16","member_number":"a117306","first_name":"RONALDI","last_name":"HANANTHA","classification":"U","division":"LIMITED","hit_factor":2.4436},{"match_name":"NCPL 2016 July","match_date":"2016-07-31","stage_classifiercode":"99-16","member_number":"TY67972","first_name":"SCOTT","last_name":"SAVERCOOL","classification":"C","division":"LIMITED","hit_factor":2.4117},{"match_name":"Idaho ISPS August 5th Break from the Heat","match_date":"2017-08-05","stage_classifiercode":"99-16","member_number":"A103528","first_name":"MATTHEW","last_name":"FISHBACK","classification":"U","division":"LIMITED","hit_factor":2.3983},{"match_name":"Idaho ISPS August 5th Break from the Heat","match_date":"2017-08-05","stage_classifiercode":"99-16","member_number":"A103720","first_name":"MIKE","last_name":"AUSTIN","classification":"C","division":"LIMITED","hit_factor":2.3952},{"match_name":"LGCSEMPS September 2017 Handgun","match_date":"2017-09-10","stage_classifiercode":"99-16","member_number":"\"\"","first_name":"DOUG","last_name":"MERCER","classification":"U","division":"LIMITED","hit_factor":2.3929},{"match_name":"Sharp Practical Shooters May USPSA Match","match_date":"2018-05-27","stage_classifiercode":"99-16","member_number":"\"\"","first_name":"MARK","last_name":"WIESS","classification":"C","division":"LIMITED","hit_factor":2.3907},{"match_name":"Shongum April 2016 Pistol Match","match_date":"2016-04-02","stage_classifiercode":"99-16","member_number":"A82626","first_name":"CONSTANTINO","last_name":"RIVERA","classification":"U","division":"LIMITED","hit_factor":2.3857},{"match_name":"5 August - USPSA match - 17 South PSC","match_date":"2017-08-05","stage_classifiercode":"99-16","member_number":"L4036","first_name":"MARK","last_name":"COMPTON","classification":"D","division":"LIMITED","hit_factor":2.3715},{"match_name":"LGCSEMPS September 2017 Handgun","match_date":"2017-09-10","stage_classifiercode":"99-16","member_number":"\"\"","first_name":"WADE","last_name":"WALLAZY","classification":"U","division":"LIMITED","hit_factor":2.371},{"match_name":"SPSA USPSA July 4th Sat match","match_date":"2018-07-28","stage_classifiercode":"99-16","member_number":"A79299","first_name":"ED","last_name":"ROTHSCHILD","classification":"C","division":"LIMITED","hit_factor":2.3674},{"match_name":"Cameo USPSA Match March 20 2021","match_date":"2021-03-20","stage_classifiercode":"99-16","member_number":"A130527","first_name":"ELIZABETH","last_name":"WHITTON","classification":"D","division":"LIMITED","hit_factor":2.36},{"match_name":"Superior Practical Shooters - March Match","match_date":"2017-03-01","stage_classifiercode":"99-16","member_number":"A83138","first_name":"DAVID","last_name":"PETERSON","classification":"C","division":"LIMITED","hit_factor":2.3573},{"match_name":"Nampa USPSA May 27th 2020 Classifier Match","match_date":"2020-05-27","stage_classifiercode":"99-16","member_number":"A124366","first_name":"STEVEN","last_name":"BLAKESLEE","classification":"D","division":"LIMITED","hit_factor":2.3467},{"match_name":"ORSA USPSA July 2016 ","match_date":"2016-07-16","stage_classifiercode":"99-16","member_number":"A91322","first_name":"WES","last_name":"NELLIS","classification":"U","division":"LIMITED","hit_factor":2.3415},{"match_name":"LdF USPSA Match September 23 2017","match_date":"2017-09-23","stage_classifiercode":"99-16","member_number":"FY77491","first_name":"TODD","last_name":"MAO","classification":"B","division":"LIMITED","hit_factor":2.3379},{"match_name":"BRSP Tuesday Night USPSA Match - June 5","match_date":"2018-06-06","stage_classifiercode":"99-16","member_number":"A106003","first_name":"ROGER","last_name":"CHAMPLIN","classification":"D","division":"LIMITED","hit_factor":2.3246},{"match_name":"RCPS USPSA Sep 11","match_date":"2021-09-11","stage_classifiercode":"99-16","member_number":"A136668","first_name":"BERT","last_name":"HASELDEN","classification":"U","division":"LIMITED","hit_factor":2.317},{"match_name":"SFA USPSA March 2017","match_date":"2017-03-18","stage_classifiercode":"99-16","member_number":"A97732","first_name":"CHRISTIAN","last_name":"ANDERSON","classification":"D","division":"LIMITED","hit_factor":2.3166},{"match_name":"Pima Pistol Club USPSA Match - May 29 ","match_date":"2016-05-29","stage_classifiercode":"99-16","member_number":"A96070","first_name":"SEAN","last_name":"FRANCISICO","classification":"U","division":"LIMITED","hit_factor":2.3089},{"match_name":"SFA USPSA NOVEMBER 14 2020","match_date":"2020-11-14","stage_classifiercode":"99-16","member_number":"PENDING","first_name":"TRACY","last_name":"OVERTON","classification":"U - I don't know and don't care","division":"LIMITED","hit_factor":2.3067},{"match_name":"Pelham USPSA 2017-08-20","match_date":"2017-08-20","stage_classifiercode":"99-16","member_number":"\"\"","first_name":"ROBERT","last_name":"DIXON","classification":"Unclassified","division":"LIMITED","hit_factor":2.3061},{"match_name":"Pinetucky USPSA 02-27-16","match_date":"2016-02-27","stage_classifiercode":"99-16","member_number":"PEN","first_name":"BILL","last_name":"LEWIS","classification":"X","division":"LIMITED","hit_factor":2.3052},{"match_name":"AIPS Weekly USPSA 3 August 2021","match_date":"2021-08-03","stage_classifiercode":"99-16","member_number":"TY96763","first_name":"BENJAMIN","last_name":"STARITS","classification":"B","division":"LIMITED","hit_factor":2.2968},{"match_name":"SPSA USPSA June 1st Sat Match","match_date":"2021-06-05","stage_classifiercode":"99-16","member_number":"TY94335","first_name":"CAREY","last_name":"RABIDEAU","classification":"B","division":"LIMITED","hit_factor":2.2936},{"match_name":"Cameo USPSA Match March 20 2021","match_date":"2021-03-20","stage_classifiercode":"99-16","member_number":"TY81282","first_name":"DOROTHY","last_name":"THROOP","classification":"D","division":"LIMITED","hit_factor":2.2914},{"match_name":"CRC_20160514_SuperClassifier","match_date":"2016-05-14","stage_classifiercode":"99-16","member_number":"A93015","first_name":"AMANDA","last_name":"PUGLIESE","classification":"U","division":"LIMITED","hit_factor":2.2881},{"match_name":"LdF USPSA Match September 23 2017","match_date":"2017-09-23","stage_classifiercode":"99-16","member_number":"A59897","first_name":"ARNEL","last_name":"ARCAL","classification":"U","division":"LIMITED","hit_factor":2.2811},{"match_name":"Idaho ISPS August 5th Break from the Heat","match_date":"2017-08-05","stage_classifiercode":"99-16","member_number":"A103721","first_name":"KYLA","last_name":"AUSTIN","classification":"D","division":"LIMITED","hit_factor":2.2737},{"match_name":"Pinetucky USPSA 02-27-16","match_date":"2016-02-27","stage_classifiercode":"99-16","member_number":"PEN","first_name":"SCOTT","last_name":"FORTSON","classification":"X","division":"LIMITED","hit_factor":2.2556},{"match_name":"LdF USPSA Match September 23 2017","match_date":"2017-09-23","stage_classifiercode":"99-16","member_number":"PENDING","first_name":"ALEX","last_name":"MOUSSERON","classification":"U","division":"LIMITED","hit_factor":2.2519},{"match_name":"APSC USPSA Match 1-6-18","match_date":"2018-01-06","stage_classifiercode":"99-16","member_number":"\"\"","first_name":"KURT","last_name":"GRUBER","classification":"B","division":"LIMITED","hit_factor":2.2396},{"match_name":"LCSC USPSA 01.14.18","match_date":"2018-01-13","stage_classifiercode":"99-16","member_number":"A104624","first_name":"CORY","last_name":"PETERSON","classification":"D","division":"LIMITED","hit_factor":2.2394},{"match_name":"USPSA","match_date":"2020-07-05","stage_classifiercode":"99-16","member_number":"A128633","first_name":"DAVID","last_name":"CHEEK","classification":"","division":"LIMITED","hit_factor":2.2293},{"match_name":"Emmett March Match","match_date":"2016-03-25","stage_classifiercode":"99-16","member_number":"a54548","first_name":"AARON","last_name":"GOODFELLOW","classification":"U","division":"LIMITED","hit_factor":2.2292},{"match_name":"SFA USPSA NOVEMBER 14 2020","match_date":"2020-11-14","stage_classifiercode":"99-16","member_number":"PENDING","first_name":"GARY","last_name":"DOWNING","classification":"U - I don't know and don't care","division":"LIMITED","hit_factor":2.2251},{"match_name":"CCPL 02-09-2020","match_date":"2020-02-09","stage_classifiercode":"99-16","member_number":"FY121894","first_name":"ENG","last_name":"LIM","classification":"U","division":"LIMITED","hit_factor":2.2207},{"match_name":"APSC USPSA Match 1-6-18","match_date":"2018-01-06","stage_classifiercode":"99-16","member_number":"\"\"","first_name":"ASHLYNNE","last_name":"THOMAS","classification":"U","division":"LIMITED","hit_factor":2.2053},{"match_name":"LGCSEMPS September 2017 Handgun","match_date":"2017-09-10","stage_classifiercode":"99-16","member_number":"A98811","first_name":"ARUEL","last_name":"TANGUILIG","classification":"U","division":"LIMITED","hit_factor":2.2031},{"match_name":"Laser Ninja Dragon League MSA USPSA January 8th 2017","match_date":"2017-01-08","stage_classifiercode":"99-16","member_number":"A95342","first_name":"ROLAND","last_name":"WOLF","classification":"D","division":"LIMITED","hit_factor":2.202},{"match_name":"RCPS USPSA 12 Nov 2016","match_date":"2016-11-12","stage_classifiercode":"99-16","member_number":"\"\"","first_name":"BEARDLSEY","last_name":"BILL","classification":"X","division":"LIMITED","hit_factor":2.1969},{"match_name":"DAP December 2015 Classifier match","match_date":"2015-12-12","stage_classifiercode":"99-16","member_number":"A87259","first_name":"YEE-MIN","last_name":"LIN","classification":"U","division":"LIMITED","hit_factor":2.1854},{"match_name":"CCPL 02-09-2020","match_date":"2020-02-09","stage_classifiercode":"99-16","member_number":"TY92260","first_name":"LAURI","last_name":"VAUGHN","classification":"C","division":"LIMITED","hit_factor":2.1814},{"match_name":"4ta Fecha USPSA","match_date":"2018-04-07","stage_classifiercode":"99-16","member_number":"A97576","first_name":"RAMON","last_name":"RIVERA","classification":"B","division":"LIMITED","hit_factor":2.1739},{"match_name":"SPSA USPSA June 1st Sat Match","match_date":"2021-06-05","stage_classifiercode":"99-16","member_number":"TY93173","first_name":"CAROL","last_name":"CAMPBELL","classification":"C","division":"LIMITED","hit_factor":2.1707},{"match_name":"DAP December 2015 Classifier match","match_date":"2015-12-12","stage_classifiercode":"99-16","member_number":"A84916","first_name":"JOHN","last_name":"MITCHELL","classification":"D","division":"LIMITED","hit_factor":2.1583},{"match_name":"ENPS March 2017 USPSA Match","match_date":"2017-03-05","stage_classifiercode":"99-16","member_number":"A85128","first_name":"MICHAEL","last_name":"ANDERSON","classification":"C","division":"LIMITED","hit_factor":2.1526},{"match_name":"Dundee USPSA Mar 2017","match_date":"2017-03-25","stage_classifiercode":"99-16","member_number":"A76099","first_name":"DARYL","last_name":"FITZPATRICK","classification":"C","division":"LIMITED","hit_factor":2.1498},{"match_name":"SFPS 10-08-2017 USPSA match","match_date":"2017-10-08","stage_classifiercode":"99-16","member_number":"TY76790","first_name":"BRYAN","last_name":"KINNEY","classification":"C","division":"LIMITED","hit_factor":2.1386},{"match_name":"CCPL 2 Day Match 2018","match_date":"2018-04-26","stage_classifiercode":"99-16","member_number":"A108446","first_name":"VIC","last_name":"THAO","classification":"U","division":"LIMITED","hit_factor":2.1277},{"match_name":"WLPS June 2017","match_date":"2017-06-25","stage_classifiercode":"99-16","member_number":"\"\"","first_name":"BERRY","last_name":"AKINS","classification":"U","division":"LIMITED","hit_factor":2.1176},{"match_name":"SFA USPSA NOVEMBER 14 2020","match_date":"2020-11-14","stage_classifiercode":"99-16","member_number":"A123222","first_name":"ELIJAH","last_name":"JENNINGS","classification":"U - I don't know and don't care","division":"LIMITED","hit_factor":2.1148},{"match_name":"Dundee USPSA Mar 2017","match_date":"2017-03-25","stage_classifiercode":"99-16","member_number":"A98098","first_name":"AAMIR","last_name":"ZAKARIA","classification":"U","division":"LIMITED","hit_factor":2.1097},{"match_name":"PCWC USPSA  1 28 17","match_date":"2017-01-28","stage_classifiercode":"99-16","member_number":"TY80373","first_name":"BEN","last_name":"PRIESTER","classification":"D","division":"LIMITED","hit_factor":2.1062},{"match_name":"Hernando Sportsmans Club","match_date":"2017-02-12","stage_classifiercode":"99-16","member_number":"A53534","first_name":"WAYNE","last_name":"RAMSEY","classification":"C","division":"LIMITED","hit_factor":2.103},{"match_name":"AIPS Weekly USPSA 3 August 2021","match_date":"2021-08-03","stage_classifiercode":"99-16","member_number":"PEN","first_name":"JUSTON","last_name":"JENNINGS","classification":"Unclassified","division":"LIMITED","hit_factor":2.1006},{"match_name":"LGCSEMPS September 2017 Handgun","match_date":"2017-09-10","stage_classifiercode":"99-16","member_number":"TY86226","first_name":"EARL","last_name":"LAVASSEUR","classification":"C","division":"LIMITED","hit_factor":2.0997},{"match_name":"SPSA USPSA July 4th Sat match","match_date":"2018-07-28","stage_classifiercode":"99-16","member_number":"TY93173","first_name":"CAROL","last_name":"CAMPBELL","classification":"C","division":"LIMITED","hit_factor":2.0939},{"match_name":"SWGC USPSA Pistol Match - December","match_date":"2016-12-03","stage_classifiercode":"99-16","member_number":"A91782","first_name":"OLGA","last_name":"KELLEY","classification":"D","division":"LIMITED","hit_factor":2.0932},{"match_name":"USPSA MO21 Special Classifier 2Alpha SBRC February 27 2021","match_date":"2021-02-27","stage_classifiercode":"99-16","member_number":"A92707","first_name":"NOAH","last_name":"WEBB","classification":"U","division":"LIMITED","hit_factor":2.0908},{"match_name":"Cameo USPSA Match March 20 2021","match_date":"2021-03-20","stage_classifiercode":"99-16","member_number":"TY86408","first_name":"SCOTT","last_name":"MARTIN","classification":"C","division":"LIMITED","hit_factor":2.0844},{"match_name":"Pelham USPSA 2017-08-20","match_date":"2017-08-20","stage_classifiercode":"99-16","member_number":"A22811","first_name":"ED","last_name":"KRUZEL","classification":"B","division":"LIMITED","hit_factor":2.0824},{"match_name":"FLPSA MN14 USPSA May 17 2018","match_date":"2018-05-17","stage_classifiercode":"99-16","member_number":"ty95998","first_name":"GREGG","last_name":"STEFFEN","classification":"C","division":"LIMITED","hit_factor":2.0814},{"match_name":"5 August - USPSA match - 17 South PSC","match_date":"2017-08-05","stage_classifiercode":"99-16","member_number":"A104302","first_name":"JOHN","last_name":"LEVANGER","classification":"U","division":"LIMITED","hit_factor":2.0796},{"match_name":"Shongum December 2017 USPSA Match","match_date":"2017-12-02","stage_classifiercode":"99-16","member_number":"A83305","first_name":"RUSSELL","last_name":"TAGLIARENI","classification":"C","division":"LIMITED","hit_factor":2.0794},{"match_name":"Pinetucky USPSA 02-27-16","match_date":"2016-02-27","stage_classifiercode":"99-16","member_number":"A90054","first_name":"DOUG","last_name":"LOWE","classification":"C","division":"LIMITED","hit_factor":2.0743},{"match_name":"Shasta Shooters 2020 Dec","match_date":"2020-12-12","stage_classifiercode":"99-16","member_number":"A131441","first_name":"DAVID","last_name":"STODDARD","classification":"U","division":"LIMITED","hit_factor":2.0694},{"match_name":"Renton USPSA - August 2020 - NW05","match_date":"2020-08-23","stage_classifiercode":"99-16","member_number":"fy105750","first_name":"LEE","last_name":"BOYLE","classification":"D","division":"LIMITED","hit_factor":2.0609},{"match_name":"Pinetucky USPSA 02-27-16","match_date":"2016-02-27","stage_classifiercode":"99-16","member_number":"\"\"","first_name":"MORRIS","last_name":"MARTY","classification":"U","division":"LIMITED","hit_factor":2.0566},{"match_name":"Nampa USPSA May 27th 2020 Classifier Match","match_date":"2020-05-27","stage_classifiercode":"99-16","member_number":"A127870","first_name":"BRIAN","last_name":"NYLAND","classification":"U","division":"LIMITED","hit_factor":2.051},{"match_name":"SPSA USPSA June 1st Sat Match","match_date":"2021-06-05","stage_classifiercode":"99-16","member_number":"A134049","first_name":"MERRITT","last_name":"BELL","classification":"U","division":"LIMITED","hit_factor":2.0425},{"match_name":"MVPSA USPSA 7-7-18","match_date":"2018-07-07","stage_classifiercode":"99-16","member_number":"A90442","first_name":"KATHLEEN","last_name":"DONAHUE","classification":"D","division":"LIMITED","hit_factor":2.0367},{"match_name":"4ta Fecha USPSA","match_date":"2018-04-07","stage_classifiercode":"99-16","member_number":"\"\"","first_name":"DOMINGO","last_name":"PEREZ-PLACER","classification":"U","division":"LIMITED","hit_factor":2.0282},{"match_name":"USPSA Bass River April 2017","match_date":"2017-04-02","stage_classifiercode":"99-16","member_number":"FY62658","first_name":"JOHN","last_name":"CATTERALL","classification":"\"\"","division":"LIMITED","hit_factor":2.027},{"match_name":"SPSA USPSA July 4th Sat match","match_date":"2018-07-28","stage_classifiercode":"99-16","member_number":"\"\"","first_name":"HAYDEN","last_name":"VAKOC","classification":"U","division":"LIMITED","hit_factor":2.0247},{"match_name":"DAP December 2015 Classifier match","match_date":"2015-12-12","stage_classifiercode":"99-16","member_number":"TY81715","first_name":"ARNEL","last_name":"BAGGAO","classification":"U","division":"LIMITED","hit_factor":2.0231},{"match_name":"Hernando Sportsmans Club","match_date":"2017-02-12","stage_classifiercode":"99-16","member_number":"A84621","first_name":"JUDY","last_name":"POTTER","classification":"D","division":"LIMITED","hit_factor":1.9981},{"match_name":"SPSA USPSA December 1st Sat Match","match_date":"2016-12-03","stage_classifiercode":"99-16","member_number":"\"\"","first_name":"JAMES","last_name":"DIGGES","classification":"U","division":"LIMITED","hit_factor":1.9979},{"match_name":"WLPS June 2017","match_date":"2017-06-25","stage_classifiercode":"99-16","member_number":"\"\"","first_name":"KYLE","last_name":"VROMAN","classification":"U","division":"LIMITED","hit_factor":1.9968},{"match_name":"SWGC USPSA Pistol Match - December","match_date":"2016-12-03","stage_classifiercode":"99-16","member_number":"A89891","first_name":"JOEY","last_name":"KAPHERR","classification":"C","division":"LIMITED","hit_factor":1.9954},{"match_name":"PCWC USPSA  1 28 17","match_date":"2017-01-28","stage_classifiercode":"99-16","member_number":"A98447","first_name":"ANGUS","last_name":"JOHNSTON","classification":"U","division":"LIMITED","hit_factor":1.9749},{"match_name":"ENPS March 2017 USPSA Match","match_date":"2017-03-05","stage_classifiercode":"99-16","member_number":"PEN","first_name":"BRITTANY","last_name":"COX","classification":"U","division":"LIMITED","hit_factor":1.9693},{"match_name":"Superior Practical Shooters - March Match","match_date":"2017-03-01","stage_classifiercode":"99-16","member_number":"A100015","first_name":"SAM","last_name":"STEERMAN","classification":"U","division":"LIMITED","hit_factor":1.9619},{"match_name":"Emmett March Match","match_date":"2016-03-25","stage_classifiercode":"99-16","member_number":"TY71315","first_name":"MIKE","last_name":"GALLOWAY","classification":"D","division":"LIMITED","hit_factor":1.9587},{"match_name":"Pinetucky USPSA 02-27-16","match_date":"2016-02-27","stage_classifiercode":"99-16","member_number":"\"\"","first_name":"JONNEY","last_name":"GRUNNET","classification":"X","division":"LIMITED","hit_factor":1.9516},{"match_name":"RCPS USPSA 12 Nov 2016","match_date":"2016-11-12","stage_classifiercode":"99-16","member_number":"\"\"","first_name":"MONIQUE","last_name":"RAMIREZ","classification":"U","division":"LIMITED","hit_factor":1.9434},{"match_name":"CIPSC Havana July USPSA","match_date":"2018-07-07","stage_classifiercode":"99-16","member_number":"TY58309","first_name":"ERIC","last_name":"HENSON","classification":"B","division":"LIMITED","hit_factor":1.9427066183734},{"match_name":"WLPS June 2017","match_date":"2017-06-25","stage_classifiercode":"99-16","member_number":"A79445","first_name":"ALBERT","last_name":"CRAM","classification":"D","division":"LIMITED","hit_factor":1.9341},{"match_name":"TPS USPSA -  January 2017 - Talon Range","match_date":"2017-01-07","stage_classifiercode":"99-16","member_number":"unknown","first_name":"ADAM","last_name":"DRAVES","classification":"U","division":"LIMITED","hit_factor":1.9205},{"match_name":"CCPL 2 Day Match 2018","match_date":"2018-04-26","stage_classifiercode":"99-16","member_number":"\"\"","first_name":"NICK","last_name":"HARRISON","classification":"U","division":"LIMITED","hit_factor":1.9097},{"match_name":"CCPL 2 Day Match 2018","match_date":"2018-04-26","stage_classifiercode":"99-16","member_number":"\"\"","first_name":"MING","last_name":"TANG","classification":"U","division":"LIMITED","hit_factor":1.9024},{"match_name":"RBGC 2017-10-21","match_date":"2017-10-21","stage_classifiercode":"99-16","member_number":"\"\"","first_name":"ALAN","last_name":"GLADNEY","classification":"U","division":"LIMITED","hit_factor":1.8949},{"match_name":"ENPS March 2017 USPSA Match","match_date":"2017-03-05","stage_classifiercode":"99-16","member_number":"PEN","first_name":"THOMAS","last_name":"MCDAVITT","classification":"U","division":"LIMITED","hit_factor":1.8852},{"match_name":"CCPL 02-09-2020","match_date":"2020-02-09","stage_classifiercode":"99-16","member_number":"A65481","first_name":"KEVIN","last_name":"DORAN","classification":"B","division":"LIMITED","hit_factor":1.8847},{"match_name":"Superior Practical Shooters - March Match","match_date":"2017-03-01","stage_classifiercode":"99-16","member_number":"A-96226","first_name":"JUDE","last_name":"AURILIO","classification":"U","division":"LIMITED","hit_factor":1.8744},{"match_name":"CRC_20160514_SuperClassifier","match_date":"2016-05-14","stage_classifiercode":"99-16","member_number":"\"\"","first_name":"JOHN","last_name":"LUNA","classification":"U","division":"LIMITED","hit_factor":1.8445},{"match_name":"DAP December 2015 Classifier match","match_date":"2015-12-12","stage_classifiercode":"99-16","member_number":"A88607","first_name":"FRANCO","last_name":"GESMUNDO","classification":"U","division":"LIMITED","hit_factor":1.833},{"match_name":"WLPS June 2017","match_date":"2017-06-25","stage_classifiercode":"99-16","member_number":"\"\"","first_name":"MATI","last_name":"VISNAPUU","classification":"U","division":"LIMITED","hit_factor":1.8325},{"match_name":"MSSA Uspsa Club Matcg","match_date":"2017-09-24","stage_classifiercode":"99-16","member_number":"\"\"","first_name":"JON","last_name":"SATERSTAD","classification":"U","division":"LIMITED","hit_factor":1.8308},{"match_name":"5 August - USPSA match - 17 South PSC","match_date":"2017-08-05","stage_classifiercode":"99-16","member_number":"A104296","first_name":"TAMMY","last_name":"LEVANGER","classification":"U","division":"LIMITED","hit_factor":1.8202},{"match_name":"APSC USPSA Match 1-6-18","match_date":"2018-01-06","stage_classifiercode":"99-16","member_number":"A87214","first_name":"CORY","last_name":"KLEMASHEVICH","classification":"G","division":"LIMITED","hit_factor":1.8051},{"match_name":"FLPSA MN14 USPSA May 17 2018","match_date":"2018-05-17","stage_classifiercode":"99-16","member_number":"A100801","first_name":"ROBERT","last_name":"WOITAS","classification":"\"\"","division":"LIMITED","hit_factor":1.8044},{"match_name":"PIPS 07-25-2018","match_date":"2018-07-25","stage_classifiercode":"99-16","member_number":"A111546","first_name":"NANCY","last_name":"MCGEE","classification":"U","division":"LIMITED","hit_factor":1.8039},{"match_name":"NNRPA USPSA March 26th 2016","match_date":"2016-03-26","stage_classifiercode":"99-16","member_number":"\"\"","first_name":"RANDY","last_name":"CRIST","classification":"U","division":"LIMITED","hit_factor":1.7867},{"match_name":"CRC_20160514_SuperClassifier","match_date":"2016-05-14","stage_classifiercode":"99-16","member_number":"A95143","first_name":"NICOLE","last_name":"HULET","classification":"U","division":"LIMITED","hit_factor":1.7842},{"match_name":"BSPSC 2018 August Special Classifier","match_date":"2018-08-12","stage_classifiercode":"99-16","member_number":"A10311","first_name":"EDGAR","last_name":"SOLORZANO","classification":"U","division":"LIMITED","hit_factor":1.7765},{"match_name":"TPS USPSA -  April 2018 Clone","match_date":"2018-04-08","stage_classifiercode":"99-16","member_number":"\"\"","first_name":"MELANIE","last_name":"HOWE","classification":"D","division":"LIMITED","hit_factor":1.765},{"match_name":"Idaho ISPS August 5th Break from the Heat","match_date":"2017-08-05","stage_classifiercode":"99-16","member_number":"\"\"","first_name":"KELLY","last_name":"ALLEN","classification":"U","division":"LIMITED","hit_factor":1.7356},{"match_name":"MVS ANPRACS Classifier Match 6/3/17","match_date":"2017-05-31","stage_classifiercode":"99-16","member_number":"\"\"","first_name":"JEREMY","last_name":"ALF","classification":"\"\"","division":"LIMITED","hit_factor":1.7288},{"match_name":"CRC_20160514_SuperClassifier","match_date":"2016-05-14","stage_classifiercode":"99-16","member_number":"\"\"","first_name":"ROBERT","last_name":"WOOD","classification":"U","division":"LIMITED","hit_factor":1.7277},{"match_name":"Maine Practical Shooters May 2017","match_date":"2017-05-13","stage_classifiercode":"99-16","member_number":"A-86070","first_name":"BRYAN","last_name":"SPIVEY","classification":"U","division":"LIMITED","hit_factor":1.7274},{"match_name":"SPSA USPSA December 1st Sat Match","match_date":"2016-12-03","stage_classifiercode":"99-16","member_number":"A84096","first_name":"CHRIS","last_name":"BUCHKO","classification":"B","division":"LIMITED","hit_factor":1.7186},{"match_name":"SWGC USPSA Pistol Match - December","match_date":"2016-12-03","stage_classifiercode":"99-16","member_number":"Fy71201","first_name":"BARRON","last_name":"ROPER","classification":"C","division":"LIMITED","hit_factor":1.71},{"match_name":"Pima Pistol Club USPSA Match - May 29 ","match_date":"2016-05-29","stage_classifiercode":"99-16","member_number":"A72975","first_name":"JIM","last_name":"HEDGCOCK","classification":"B","division":"LIMITED","hit_factor":1.7013},{"match_name":"Idaho ISPS August 5th Break from the Heat","match_date":"2017-08-05","stage_classifiercode":"99-16","member_number":"\"\"","first_name":"JUDY","last_name":"HEID","classification":"U","division":"LIMITED","hit_factor":1.6857},{"match_name":"2da Copa Nacional USPSA ","match_date":"2016-05-22","stage_classifiercode":"99-16","member_number":"\"\"","first_name":"LUIS","last_name":"RIVERA","classification":"U","division":"LIMITED","hit_factor":1.6711},{"match_name":"TPS USPSA -  January 2017 - Talon Range","match_date":"2017-01-07","stage_classifiercode":"99-16","member_number":"\"\"","first_name":"JUSTIN","last_name":"CALHOUN","classification":"U","division":"LIMITED","hit_factor":1.6497},{"match_name":"Briar Rabbit  June Match 2016 OH 20","match_date":"2016-06-12","stage_classifiercode":"99-16","member_number":"A88673","first_name":"CINDY","last_name":"WATSON","classification":"C","division":"LIMITED","hit_factor":1.6318},{"match_name":"ENPS March 2017 USPSA Match","match_date":"2017-03-05","stage_classifiercode":"99-16","member_number":"A94771","first_name":"TAMMY","last_name":"ALDRICH","classification":"D","division":"LIMITED","hit_factor":1.621},{"match_name":"RCPS USPSA Sep 11","match_date":"2021-09-11","stage_classifiercode":"99-16","member_number":"A130738","first_name":"TOMMY","last_name":"MCELYEA","classification":"D","division":"LIMITED","hit_factor":1.6205},{"match_name":"ENPS March 2017 USPSA Match","match_date":"2017-03-05","stage_classifiercode":"99-16","member_number":"\"\"","first_name":"JEFF","last_name":"KING","classification":"U","division":"LIMITED","hit_factor":1.5974},{"match_name":"SPSA USPSA July 4th Sat match","match_date":"2018-07-28","stage_classifiercode":"99-16","member_number":"A108116","first_name":"FRANK","last_name":"PIPOLI","classification":"U","division":"LIMITED","hit_factor":1.5973},{"match_name":"MS06 Team Magnolia USPSA January Match2","match_date":"2016-01-03","stage_classifiercode":"99-16","member_number":"FY81259","first_name":"WAYNE","last_name":"COLEY","classification":"U","division":"LIMITED","hit_factor":1.5887},{"match_name":"Nampa USPSA May 27th 2020 Classifier Match","match_date":"2020-05-27","stage_classifiercode":"99-16","member_number":"A116439","first_name":"MIKE","last_name":"GODINHO","classification":"C","division":"LIMITED","hit_factor":1.5611},{"match_name":"Superior Practical Shooters - March Match","match_date":"2017-03-01","stage_classifiercode":"99-16","member_number":"\"\"","first_name":"GREGORY","last_name":"ZOHOVETZ","classification":"U","division":"LIMITED","hit_factor":1.5583},{"match_name":"OK15 USPSA at USSA","match_date":"2016-12-11","stage_classifiercode":"99-16","member_number":"\"\"","first_name":"RICK","last_name":"DEVORE SR","classification":"U","division":"LIMITED","hit_factor":1.5499},{"match_name":"5 August - USPSA match - 17 South PSC","match_date":"2017-08-05","stage_classifiercode":"99-16","member_number":"A64134","first_name":"RICHARD","last_name":"SCHOOLEY","classification":"U","division":"LIMITED","hit_factor":1.5351},{"match_name":"WLPS USPSA Sep 2016","match_date":"2016-09-25","stage_classifiercode":"99-16","member_number":"\"\"","first_name":"JAKE","last_name":"OSTERHOUT","classification":"U","division":"LIMITED","hit_factor":1.5193},{"match_name":"5 August - USPSA match - 17 South PSC","match_date":"2017-08-05","stage_classifiercode":"99-16","member_number":"\"\"","first_name":"JEFF","last_name":"LAZENBY","classification":"U","division":"LIMITED","hit_factor":1.5152},{"match_name":"Emmett March Match","match_date":"2016-03-25","stage_classifiercode":"99-16","member_number":"a72337","first_name":"CODY","last_name":"SCHEIHING","classification":"U","division":"LIMITED","hit_factor":1.5098},{"match_name":"ARPC USPSA Match 3-26-17","match_date":"2017-03-26","stage_classifiercode":"99-16","member_number":"TY57677","first_name":"JOE","last_name":"SHADDUCK","classification":"C","division":"LIMITED","hit_factor":1.5025},{"match_name":"ORSA USPSA July 2016 ","match_date":"2016-07-16","stage_classifiercode":"99-16","member_number":"44133","first_name":"ERIC","last_name":"BELL","classification":"U","division":"LIMITED","hit_factor":1.4969},{"match_name":"SPSA USPSA July 4th Sat match","match_date":"2018-07-28","stage_classifiercode":"99-16","member_number":"TY101839","first_name":"LUCKY","last_name":"GRAY","classification":"B","division":"LIMITED","hit_factor":1.4888},{"match_name":"Superior Practical Shooters - March Match","match_date":"2017-03-01","stage_classifiercode":"99-16","member_number":"TY-92942","first_name":"AARON","last_name":"BUSTIN","classification":"U","division":"LIMITED","hit_factor":1.4834},{"match_name":"USPSA","match_date":"2020-07-05","stage_classifiercode":"99-16","member_number":"A124140","first_name":"JOSHUA","last_name":"BENWARE","classification":"U","division":"LIMITED","hit_factor":1.4803},{"match_name":"APSC USPSA Match 1-6-18","match_date":"2018-01-06","stage_classifiercode":"99-16","member_number":"TY84155","first_name":"DON","last_name":"DAHL","classification":"C","division":"LIMITED","hit_factor":1.4742},{"match_name":"Range E11even October 2017","match_date":"2017-10-28","stage_classifiercode":"99-16","member_number":"\"\"","first_name":"AUSTIN","last_name":"DAY","classification":"U","division":"LIMITED","hit_factor":1.4706},{"match_name":"MVPSA USPSA 7-7-18","match_date":"2018-07-07","stage_classifiercode":"99-16","member_number":"A109856","first_name":"BRIAN","last_name":"SABALA","classification":"C","division":"LIMITED","hit_factor":1.4538},{"match_name":"CCPS March 2018 USPSA","match_date":"2018-03-18","stage_classifiercode":"99-16","member_number":"Ty31475","first_name":"JERRY","last_name":"NELSON","classification":"B","division":"LIMITED","hit_factor":1.4428},{"match_name":"Pelham USPSA 2017-08-20","match_date":"2017-08-20","stage_classifiercode":"99-16","member_number":"\"\"","first_name":"CLIFF","last_name":"WILLIAMS","classification":"Unclassified","division":"LIMITED","hit_factor":1.4366},{"match_name":"BRSP Tuesday Night USPSA Match - June 5","match_date":"2018-06-06","stage_classifiercode":"99-16","member_number":"A108123","first_name":"LARRY","last_name":"HOLMES","classification":"U","division":"LIMITED","hit_factor":1.4232},{"match_name":"SFPS 10-08-2017 USPSA match","match_date":"2017-10-08","stage_classifiercode":"99-16","member_number":"PEN","first_name":"CLIFF","last_name":"FOSS","classification":"U","division":"LIMITED","hit_factor":1.4228},{"match_name":"BRSP Tuesday Night USPSA Match - June 5","match_date":"2018-06-06","stage_classifiercode":"99-16","member_number":"\"\"","first_name":"MIKEA","last_name":"FULTON","classification":"\"\"","division":"LIMITED","hit_factor":1.4041},{"match_name":"Idaho ISPS August 5th Break from the Heat","match_date":"2017-08-05","stage_classifiercode":"99-16","member_number":"A84511","first_name":"HAROLD","last_name":"KROPP","classification":"U","division":"LIMITED","hit_factor":1.3866},{"match_name":"RBGC 2017-10-21","match_date":"2017-10-21","stage_classifiercode":"99-16","member_number":"\"\"","first_name":"ALEX","last_name":"WEBB","classification":"U","division":"LIMITED","hit_factor":1.3578},{"match_name":"Idaho ISPS August 5th Break from the Heat","match_date":"2017-08-05","stage_classifiercode":"99-16","member_number":"TY82308","first_name":"CURT","last_name":"BERGER","classification":"A","division":"LIMITED","hit_factor":1.355},{"match_name":"4ta Fecha USPSA","match_date":"2018-04-07","stage_classifiercode":"99-16","member_number":"\"\"","first_name":"FERNANDO","last_name":"FERNANDEZ","classification":"U","division":"LIMITED","hit_factor":1.337},{"match_name":"LGCSEMPS September 2017 Handgun","match_date":"2017-09-10","stage_classifiercode":"99-16","member_number":"\"\"","first_name":"BENJAMIN","last_name":"MERCER","classification":"U","division":"LIMITED","hit_factor":1.3184},{"match_name":"Pima Pistol Club USPSA Match - May 29 ","match_date":"2016-05-29","stage_classifiercode":"99-16","member_number":"A61377","first_name":"T.","last_name":"TRAIN","classification":"C","division":"LIMITED","hit_factor":1.3096},{"match_name":"Idaho ISPS August 5th Break from the Heat","match_date":"2017-08-05","stage_classifiercode":"99-16","member_number":"\"\"","first_name":"PAUL","last_name":"FARMER","classification":"U","division":"LIMITED","hit_factor":1.297},{"match_name":"WMPS  11-13-2016","match_date":"2016-11-13","stage_classifiercode":"99-16","member_number":"\"\"","first_name":"JOHN","last_name":"JAEGER","classification":"U","division":"LIMITED","hit_factor":1.2934},{"match_name":"Nampa USPSA May 27th 2020 Classifier Match","match_date":"2020-05-27","stage_classifiercode":"99-16","member_number":"A127849","first_name":"DOMINIQUE","last_name":"OWENS","classification":"U","division":"LIMITED","hit_factor":1.2708},{"match_name":"Maine Practical Shooters May 2017","match_date":"2017-05-13","stage_classifiercode":"99-16","member_number":"\"\"","first_name":"BRUCE","last_name":"STAPLES","classification":"U","division":"LIMITED","hit_factor":1.2376},{"match_name":"Nampa USPSA May 27th 2020 Classifier Match","match_date":"2020-05-27","stage_classifiercode":"99-16","member_number":"A127755","first_name":"CECIL","last_name":"RHODES","classification":"U","division":"LIMITED","hit_factor":1.2315},{"match_name":"4ta Fecha USPSA","match_date":"2018-04-07","stage_classifiercode":"99-16","member_number":"\"\"","first_name":"FRANCISCO","last_name":"DIEZ-PEREZ","classification":"U","division":"LIMITED","hit_factor":1.2283},{"match_name":"Superior Practical Shooters - March Match","match_date":"2017-03-01","stage_classifiercode":"99-16","member_number":"\"\"","first_name":"CHRIS","last_name":"DRIVER","classification":"U","division":"LIMITED","hit_factor":1.2009},{"match_name":"DWB - Deadwood Boys USPSA 20 May 2018","match_date":"2018-05-20","stage_classifiercode":"99-16","member_number":"TY84603","first_name":"ARIEL","last_name":"GARCIA","classification":"C","division":"LIMITED","hit_factor":1.1852},{"match_name":"Shasta Shooters 2020 Dec","match_date":"2020-12-12","stage_classifiercode":"99-16","member_number":"FY89297","first_name":"STEPHEN","last_name":"ECKARD","classification":"D","division":"LIMITED","hit_factor":1.1803},{"match_name":"WMPS  11-13-2016","match_date":"2016-11-13","stage_classifiercode":"99-16","member_number":"\"\"","first_name":"MARTIN","last_name":"VANDEURSEN","classification":"U","division":"LIMITED","hit_factor":1.1774},{"match_name":"PCWC USPSA  1 28 17","match_date":"2017-01-28","stage_classifiercode":"99-16","member_number":"TY89907","first_name":"STACI","last_name":"RUBIO","classification":"D","division":"LIMITED","hit_factor":1.1758},{"match_name":"CIPSC Havana July USPSA","match_date":"2018-07-07","stage_classifiercode":"99-16","member_number":"FY47125","first_name":"KEVIN","last_name":"MONK","classification":"B","division":"LIMITED","hit_factor":1.1310084825636},{"match_name":"DWB - Deadwood Boys USPSA 20 May 2018","match_date":"2018-05-20","stage_classifiercode":"99-16","member_number":"\"\"","first_name":"SYLVESTER","last_name":"SARUCA","classification":"G","division":"LIMITED","hit_factor":1.1294},{"match_name":"2da Copa Nacional USPSA ","match_date":"2016-05-22","stage_classifiercode":"99-16","member_number":"\"\"","first_name":"MIGUEL A","last_name":"FERNANDEZ","classification":"U","division":"LIMITED","hit_factor":1.1278},{"match_name":"USPSA","match_date":"2020-07-05","stage_classifiercode":"99-16","member_number":"TY90052","first_name":"RANDY","last_name":"STANKO","classification":"C","division":"LIMITED","hit_factor":1.0357},{"match_name":"Pinetucky USPSA 02-27-16","match_date":"2016-02-27","stage_classifiercode":"99-16","member_number":"\"\"","first_name":"NANCY","last_name":"GRUNNET","classification":"X","division":"LIMITED","hit_factor":1.029},{"match_name":"WMPS  11-13-2016","match_date":"2016-11-13","stage_classifiercode":"99-16","member_number":"A96575","first_name":"SEAN","last_name":"LYNCH","classification":"B","division":"LIMITED","hit_factor":1.0204},{"match_name":"Emmett March Match","match_date":"2016-03-25","stage_classifiercode":"99-16","member_number":"a92422","first_name":"KEN","last_name":"LEWIS","classification":"U","division":"LIMITED","hit_factor":1.02},{"match_name":"FLPSA MN14 USPSA May 17 2018","match_date":"2018-05-17","stage_classifiercode":"99-16","member_number":"\"\"","first_name":"BOB","last_name":"MATUSKA","classification":"\"\"","division":"LIMITED","hit_factor":1.0101},{"match_name":"Pinetucky USPSA 02-27-16","match_date":"2016-02-27","stage_classifiercode":"99-16","member_number":"\"\"","first_name":"DENISE","last_name":"NICODEMUS","classification":"X","division":"LIMITED","hit_factor":0.995},{"match_name":"Superior Practical Shooters - March Match","match_date":"2017-03-01","stage_classifiercode":"99-16","member_number":"NA","first_name":"PARTY","last_name":"OVERHERE","classification":"U","division":"LIMITED","hit_factor":0.9901},{"match_name":"DAP December 2015 Classifier match","match_date":"2015-12-12","stage_classifiercode":"99-16","member_number":"L3798","first_name":"ROBERT","last_name":"MAPPES","classification":"D","division":"LIMITED","hit_factor":0.9456},{"match_name":"Nampa USPSA May 27th 2020 Classifier Match","match_date":"2020-05-27","stage_classifiercode":"99-16","member_number":"TY34980","first_name":"DENNIS","last_name":"MAGEE","classification":"B","division":"LIMITED","hit_factor":0.9425},{"match_name":"WLPS USPSA Sep 2016","match_date":"2016-09-25","stage_classifiercode":"99-16","member_number":"\"\"","first_name":"JASON","last_name":"SMITH","classification":"U","division":"LIMITED","hit_factor":0.9061},{"match_name":"PCWC USPSA  1 28 17","match_date":"2017-01-28","stage_classifiercode":"99-16","member_number":"\"\"","first_name":"BRYON","last_name":"RICE","classification":"U","division":"LIMITED","hit_factor":0.905},{"match_name":"Hernando Sportsmans Club","match_date":"2017-02-12","stage_classifiercode":"99-16","member_number":"\"\"","first_name":"RODNEY","last_name":"JOHNSON","classification":"U","division":"LIMITED","hit_factor":0.8973},{"match_name":"FLPSA MN14 USPSA May 17 2018","match_date":"2018-05-17","stage_classifiercode":"99-16","member_number":"fy97194","first_name":"IAN","last_name":"ANDREWS","classification":"B","division":"LIMITED","hit_factor":0.8738},{"match_name":"TPS USPSA -  January 2017 - Talon Range","match_date":"2017-01-07","stage_classifiercode":"99-16","member_number":"A97784","first_name":"MELANIE","last_name":"HOWE","classification":"U","division":"LIMITED","hit_factor":0.8732},{"match_name":"Sharp Practical Shooters May USPSA Match","match_date":"2018-05-27","stage_classifiercode":"99-16","member_number":"A102091","first_name":"KOLETON","last_name":"VAUGHN","classification":"U","division":"LIMITED","hit_factor":0.8715},{"match_name":"TPS USPSA -  January 2017 - Talon Range","match_date":"2017-01-07","stage_classifiercode":"99-16","member_number":"a99941","first_name":"LENNIE","last_name":"ZEILER","classification":"G","division":"LIMITED","hit_factor":0.866},{"match_name":"5 August - USPSA match - 17 South PSC","match_date":"2017-08-05","stage_classifiercode":"99-16","member_number":"\"\"","first_name":"JOSH","last_name":"COFFIELD","classification":"U","division":"LIMITED","hit_factor":0.8531},{"match_name":"Pinetucky USPSA 02-27-16","match_date":"2016-02-27","stage_classifiercode":"99-16","member_number":"\"\"","first_name":"JOSHUA","last_name":"HODGES","classification":"U","division":"LIMITED","hit_factor":0.8368},{"match_name":"MVS ANPRACS Classifier Match 6/3/17","match_date":"2017-05-31","stage_classifiercode":"99-16","member_number":"\"\"","first_name":"JOHN","last_name":"JONES","classification":"\"\"","division":"LIMITED","hit_factor":0.811},{"match_name":"5 August - USPSA match - 17 South PSC","match_date":"2017-08-05","stage_classifiercode":"99-16","member_number":"\"\"","first_name":"SCOTT","last_name":"DAVIS","classification":"U","division":"LIMITED","hit_factor":0.8099},{"match_name":"Pinetucky USPSA 02-27-16","match_date":"2016-02-27","stage_classifiercode":"99-16","member_number":"\"\"","first_name":"JEFFREY","last_name":"GARLINGTON","classification":"U","division":"LIMITED","hit_factor":0.7897},{"match_name":"PCWC USPSA  1 28 17","match_date":"2017-01-28","stage_classifiercode":"99-16","member_number":"A-95752","first_name":"IVEY","last_name":"SANDERSON","classification":"U","division":"LIMITED","hit_factor":0.7886},{"match_name":"Sharp Practical Shooters May USPSA Match","match_date":"2018-05-27","stage_classifiercode":"99-16","member_number":"\"\"","first_name":"BEN","last_name":"LITTLE","classification":"U","division":"LIMITED","hit_factor":0.7862},{"match_name":"ShooT GTR USPSA 1/1/17","match_date":"2017-01-01","stage_classifiercode":"99-16","member_number":"TY42315","first_name":"ROD","last_name":"CASSIDY","classification":"A","division":"LIMITED","hit_factor":0.775},{"match_name":"ARPC USPSA Match 3-26-17","match_date":"2017-03-26","stage_classifiercode":"99-16","member_number":"TY82895","first_name":"JON","last_name":"ADLOF","classification":"C","division":"LIMITED","hit_factor":0.7678},{"match_name":"EWPSA 2018-09","match_date":"2018-09-16","stage_classifiercode":"99-16","member_number":"\"\"","first_name":"MIKE","last_name":"STEPHENSON","classification":"U","division":"LIMITED","hit_factor":0.7252},{"match_name":"Pinetucky USPSA 02-27-16","match_date":"2016-02-27","stage_classifiercode":"99-16","member_number":"\"\"","first_name":"KRISTIN","last_name":"LEWIS","classification":"X","division":"LIMITED","hit_factor":0.6587},{"match_name":"ORSA USPSA July 2016 ","match_date":"2016-07-16","stage_classifiercode":"99-16","member_number":"NONE","first_name":"NATHAN","last_name":"KING","classification":"U","division":"LIMITED","hit_factor":0.6299},{"match_name":"ENPS March 2017 USPSA Match","match_date":"2017-03-05","stage_classifiercode":"99-16","member_number":"PEN","first_name":"PAUL","last_name":"MCNERNEY","classification":"U","division":"LIMITED","hit_factor":0.5643},{"match_name":"CIPSC Havana July USPSA","match_date":"2018-07-07","stage_classifiercode":"99-16","member_number":"NONE","first_name":"WYATT","last_name":"CURRY","classification":"X","division":"LIMITED","hit_factor":0.54005400540054},{"match_name":"BSPSC 2018 August Special Classifier","match_date":"2018-08-12","stage_classifiercode":"99-16","member_number":"A108583","first_name":"CHAZ","last_name":"FLINN","classification":"U","division":"LIMITED","hit_factor":0.5203},{"match_name":"SFPS 10-08-2017 USPSA match","match_date":"2017-10-08","stage_classifiercode":"99-16","member_number":"PEN","first_name":"THOMAS","last_name":"BOBAY","classification":"U","division":"LIMITED","hit_factor":0.5171},{"match_name":"4ta Fecha USPSA","match_date":"2018-04-07","stage_classifiercode":"99-16","member_number":"F110389","first_name":"LUIS","last_name":"ALVARADO","classification":"U","division":"LIMITED","hit_factor":0.5124},{"match_name":"Idaho ISPS August 5th Break from the Heat","match_date":"2017-08-05","stage_classifiercode":"99-16","member_number":"\"\"","first_name":"SHAWN","last_name":"RUSSELL","classification":"U","division":"LIMITED","hit_factor":0.498},{"match_name":"AVAP CLASSIFIER 71418","match_date":"2018-07-14","stage_classifiercode":"99-16","member_number":"TY111282","first_name":"KRIS","last_name":"CHIANG","classification":"U","division":"LIMITED","hit_factor":0.4919},{"match_name":"Pelham USPSA 2017-08-20","match_date":"2017-08-20","stage_classifiercode":"99-16","member_number":"\"\"","first_name":"JUSTIN","last_name":"LANE","classification":"Unclassified","division":"LIMITED","hit_factor":0.4789},{"match_name":"LGCSEMPS September 2017 Handgun","match_date":"2017-09-10","stage_classifiercode":"99-16","member_number":"\"\"","first_name":"GORDON","last_name":"MACHLEIT","classification":"U","division":"LIMITED","hit_factor":0.4611},{"match_name":"MSSA Uspsa Club Matcg","match_date":"2017-09-24","stage_classifiercode":"99-16","member_number":"\"\"","first_name":"DANIEL","last_name":"MOSCON","classification":"U","division":"LIMITED","hit_factor":0.4283},{"match_name":"WMPS  11-13-2016","match_date":"2016-11-13","stage_classifiercode":"99-16","member_number":"L3895","first_name":"CASEY","last_name":"HECKMAN","classification":"C","division":"LIMITED","hit_factor":0.405},{"match_name":"FLPSA MN14 USPSA May 17 2018","match_date":"2018-05-17","stage_classifiercode":"99-16","member_number":"\"\"","first_name":"KEVIN","last_name":"SCHWEIGEL","classification":"U","division":"LIMITED","hit_factor":0.3193},{"match_name":"5 August - USPSA match - 17 South PSC","match_date":"2017-08-05","stage_classifiercode":"99-16","member_number":"888040","first_name":"JEFF","last_name":"JENKINS","classification":"U","division":"LIMITED","hit_factor":0.3147},{"match_name":"Grandbaggers 07/2017","match_date":"2017-07-06","stage_classifiercode":"99-16","member_number":"A85099","first_name":"JESSICA","last_name":"NIETZEL","classification":"U","division":"LIMITED","hit_factor":0.3006},{"match_name":"PCWC USPSA  1 28 17","match_date":"2017-01-28","stage_classifiercode":"99-16","member_number":"A-93396","first_name":"MICHAEL","last_name":"COSTLEY","classification":"C","division":"LIMITED","hit_factor":0.2939},{"match_name":"WMPS  11-13-2016","match_date":"2016-11-13","stage_classifiercode":"99-16","member_number":"A42817","first_name":"ALAN","last_name":"ROUSH","classification":"C","division":"LIMITED","hit_factor":0.2686},{"match_name":"Renton USPSA - August 2020 - NW05","match_date":"2020-08-23","stage_classifiercode":"99-16","member_number":"PEN","first_name":"SUNG","last_name":"H","classification":"U","division":"LIMITED","hit_factor":0.2553},{"match_name":"Hernando Sportsmans Club","match_date":"2017-02-12","stage_classifiercode":"99-16","member_number":"\"\"","first_name":"TONY","last_name":"DAMIANO","classification":"U","division":"LIMITED","hit_factor":0.2068},{"match_name":"Pinetucky USPSA 02-27-16","match_date":"2016-02-27","stage_classifiercode":"99-16","member_number":"\"\"","first_name":"JESSICA","last_name":"HEADRICK","classification":"X","division":"LIMITED","hit_factor":0.2042},{"match_name":"Bass River USPSA September 2018","match_date":"2018-09-02","stage_classifiercode":"99-16","member_number":"\"\"","first_name":"MYLES","last_name":"KENT","classification":"\"\"","division":"LIMITED","hit_factor":0.2004},{"match_name":"PCWC USPSA  1 28 17","match_date":"2017-01-28","stage_classifiercode":"99-16","member_number":"\"\"","first_name":"CHARLIE","last_name":"COSTANZO","classification":"U","division":"LIMITED","hit_factor":0.1913},{"match_name":"MSSA Uspsa Club Matcg","match_date":"2017-09-24","stage_classifiercode":"99-16","member_number":"TY79011","first_name":"JOYCE","last_name":"BEGGS","classification":"D","division":"LIMITED","hit_factor":0.1709},{"match_name":"ENPS March 2017 USPSA Match","match_date":"2017-03-05","stage_classifiercode":"99-16","member_number":"PEN","first_name":"BRENDEN","last_name":"RAGETH","classification":"U","division":"LIMITED","hit_factor":0.1641},{"match_name":"4ta Fecha USPSA","match_date":"2018-04-07","stage_classifiercode":"99-16","member_number":"\"\"","first_name":"ALBERTO","last_name":"RIVERA SEPULVEDA","classification":"D","division":"LIMITED","hit_factor":0.1561},{"match_name":"Grandbaggers 07/2017","match_date":"2017-07-06","stage_classifiercode":"99-16","member_number":"PENDING","first_name":"JOLEEN","last_name":"TURNER","classification":"U","division":"LIMITED","hit_factor":0.143},{"match_name":"4ta Fecha USPSA","match_date":"2018-04-07","stage_classifiercode":"99-16","member_number":"\"\"","first_name":"NORBERTO","last_name":"ALAMO-WILSON","classification":"U","division":"LIMITED","hit_factor":0.1356},{"match_name":"Renton USPSA - August 2020 - NW05","match_date":"2020-08-23","stage_classifiercode":"99-16","member_number":"124035","first_name":"DON","last_name":"BERMUDEZ","classification":"U","division":"LIMITED","hit_factor":0.1156},{"match_name":"LCSC USPSA 01.14.18","match_date":"2018-01-13","stage_classifiercode":"99-16","member_number":"00033","first_name":"MELISSA","last_name":"RHETT-COSTA","classification":"\"\"","division":"LIMITED","hit_factor":0.0807},{"match_name":"SPSA USPSA June 1st Sat Match","match_date":"2021-06-05","stage_classifiercode":"99-16","member_number":"TY101839","first_name":"LUCKY","last_name":"GRAY","classification":"B","division":"LIMITED","hit_factor":0.0767}]