[{"match_name":"FLPSA MN14 USPSA May 17 2018","match_date":"2018-05-17","stage_classifiercode":"99-16","member_number":"A72549","first_name":"ANDRE","last_name":"DESAUTEL","classification":"M","division":"PRODUCTION","hit_factor":10.0346},{"match_name":"ORSA USPSA July 2016 ","match_date":"2016-07-16","stage_classifiercode":"99-16","member_number":"A76603","first_name":"TYLER","last_name":"INGRAM","classification":"G","division":"PRODUCTION","hit_factor":9.4374},{"match_name":"FLPSA MN14 USPSA May 17 2018","match_date":"2018-05-17","stage_classifiercode":"99-16","member_number":"A78033","first_name":"CASEY","last_name":"REED","classification":"G","division":"PRODUCTION","hit_factor":9.2357},{"match_name":"RBGC 2017-10-21","match_date":"2017-10-21","stage_classifiercode":"99-16","member_number":"A84978","first_name":"TYLER","last_name":"TURNER","classification":"G","division":"PRODUCTION","hit_factor":9.1371},{"match_name":"ShooT GTR USPSA 1/1/17","match_date":"2017-01-01","stage_classifiercode":"99-16","member_number":"TY69089","first_name":"MATT","last_name":"MITCHELL","classification":"M","division":"PRODUCTION","hit_factor":9.0634},{"match_name":"RBGC 2017-10-21","match_date":"2017-10-21","stage_classifiercode":"99-16","member_number":"A85054","first_name":"ROB","last_name":"CHAVOUS","classification":"M","division":"PRODUCTION","hit_factor":8.9701},{"match_name":"APSC USPSA Match 1-6-18","match_date":"2018-01-06","stage_classifiercode":"99-16","member_number":"A78421","first_name":"BEN","last_name":"GILMAN","classification":"M","division":"PRODUCTION","hit_factor":8.9404},{"match_name":"BORCC USPSA July 2018 Classifier Match","match_date":"2018-07-02","stage_classifiercode":"99-16","member_number":"TY86867","first_name":"ANDREW","last_name":"HEATH","classification":"M","division":"PRODUCTION","hit_factor":8.9347},{"match_name":"APSC USPSA Match 1-6-18","match_date":"2018-01-06","stage_classifiercode":"99-16","member_number":"L3524","first_name":"TIM","last_name":"MEYERS","classification":"G","division":"PRODUCTION","hit_factor":8.8889},{"match_name":"ORSA USPSA July 2016 ","match_date":"2016-07-16","stage_classifiercode":"99-16","member_number":"A76106","first_name":"KEN","last_name":"HARDIN","classification":"A","division":"PRODUCTION","hit_factor":8.7464},{"match_name":"TPS USPSA -  April 2018 Clone","match_date":"2018-04-08","stage_classifiercode":"99-16","member_number":"a29708","first_name":"JOHN","last_name":"RASMUSSEN","classification":"M","division":"PRODUCTION","hit_factor":8.7464},{"match_name":"Pelham USPSA 2017-08-20","match_date":"2017-08-20","stage_classifiercode":"99-16","member_number":"TY76786","first_name":"ROB","last_name":"LACROIX","classification":"G","division":"PRODUCTION","hit_factor":8.6957},{"match_name":"Idaho ISPS August 5th Break from the Heat","match_date":"2017-08-05","stage_classifiercode":"99-16","member_number":"TY83544","first_name":"ZACK","last_name":"IRWIN","classification":"M","division":"PRODUCTION","hit_factor":8.6022},{"match_name":"Briar Rabbit  June Match 2016 OH 20","match_date":"2016-06-12","stage_classifiercode":"99-16","member_number":"A79476","first_name":"SCOTT","last_name":"PIRAINO","classification":"M","division":"PRODUCTION","hit_factor":8.5294},{"match_name":"Renton USPSA - August 2020 - NW05","match_date":"2020-08-23","stage_classifiercode":"99-16","member_number":"FY108575","first_name":"ERIC","last_name":"BEERBAUM","classification":"M","division":"PRODUCTION","hit_factor":8.3467},{"match_name":"Idaho ISPS August 5th Break from the Heat","match_date":"2017-08-05","stage_classifiercode":"99-16","member_number":"A98216","first_name":"ANDREW","last_name":"SUTTON","classification":"U","division":"PRODUCTION","hit_factor":8.3333},{"match_name":"RBGC 2017-10-21","match_date":"2017-10-21","stage_classifiercode":"99-16","member_number":"TY75523","first_name":"BILAL","last_name":"SINNO","classification":"M","division":"PRODUCTION","hit_factor":8.2963},{"match_name":"Grandbaggers 07/2017","match_date":"2017-07-06","stage_classifiercode":"99-16","member_number":"TY84457","first_name":"CALEB","last_name":"TILLERY","classification":"A","division":"PRODUCTION","hit_factor":8.2111},{"match_name":"APSC USPSA Match 1-6-18","match_date":"2018-01-06","stage_classifiercode":"99-16","member_number":"A71754","first_name":"JONATHAN","last_name":"SLAYTON","classification":"A","division":"PRODUCTION","hit_factor":8.1694},{"match_name":"CCPL 02-09-2020","match_date":"2020-02-09","stage_classifiercode":"99-16","member_number":"A94432","first_name":"GRANT","last_name":"SCOTT","classification":"A","division":"PRODUCTION","hit_factor":8.1346},{"match_name":"SPSA USPSA July 4th Sat match","match_date":"2018-07-28","stage_classifiercode":"99-16","member_number":"FY42385","first_name":"JOHN","last_name":"HILL","classification":"M","division":"PRODUCTION","hit_factor":8.0925},{"match_name":"LGCSEMPS September 2017 Handgun","match_date":"2017-09-10","stage_classifiercode":"99-16","member_number":"A91766","first_name":"QUINTON","last_name":"HO","classification":"G","division":"PRODUCTION","hit_factor":8.0668},{"match_name":"ShooT GTR USPSA 1/1/17","match_date":"2017-01-01","stage_classifiercode":"99-16","member_number":"TY94255","first_name":"SHANE","last_name":"BETHEA","classification":"M","division":"PRODUCTION","hit_factor":8.0576},{"match_name":"OK15 USPSA at USSA","match_date":"2016-12-11","stage_classifiercode":"99-16","member_number":"A82437","first_name":"STEVE","last_name":"WOLF","classification":"B","division":"PRODUCTION","hit_factor":8},{"match_name":"PRG-USPSA - Oh Shoot January 3rd - 1st Sunday","match_date":"2021-01-03","stage_classifiercode":"99-16","member_number":"A54150","first_name":"DANIEL","last_name":"NICKEL","classification":"B","division":"PRODUCTION","hit_factor":7.978},{"match_name":"PTPC May 7th USPSA Match","match_date":"2017-05-07","stage_classifiercode":"99-16","member_number":"TY85003","first_name":"MIKE","last_name":"BOUGHTON","classification":"M","division":"PRODUCTION","hit_factor":7.947},{"match_name":"Pima Pistol Club USPSA Match - May 29 ","match_date":"2016-05-29","stage_classifiercode":"99-16","member_number":"A40144","first_name":"ERIC","last_name":"FRANCE","classification":"G","division":"PRODUCTION","hit_factor":7.9239},{"match_name":"RCPS USPSA 12 Nov 2016","match_date":"2016-11-12","stage_classifiercode":"99-16","member_number":"A87604","first_name":"ETHAN","last_name":"HOWELL","classification":"B","division":"PRODUCTION","hit_factor":7.9096},{"match_name":"Pelham USPSA 2017-08-20","match_date":"2017-08-20","stage_classifiercode":"99-16","member_number":"A79813","first_name":"JOEL","last_name":"PENNEY","classification":"A","division":"PRODUCTION","hit_factor":7.8762},{"match_name":"CIPSC Havana July USPSA","match_date":"2018-07-07","stage_classifiercode":"99-16","member_number":"FY51334","first_name":"JIM","last_name":"STOBAUGH","classification":"A","division":"PRODUCTION","hit_factor":7.8740157480315},{"match_name":"APSC USPSA Match 1-6-18","match_date":"2018-01-06","stage_classifiercode":"99-16","member_number":"TY78159","first_name":"RODNEY","last_name":"WISE","classification":"A","division":"PRODUCTION","hit_factor":7.8717},{"match_name":"ShooT GTR USPSA 1/1/17","match_date":"2017-01-01","stage_classifiercode":"99-16","member_number":"A87317","first_name":"MICHAEL","last_name":"DUKES","classification":"B","division":"PRODUCTION","hit_factor":7.8697},{"match_name":"APSC USPSA Match 1-6-18","match_date":"2018-01-06","stage_classifiercode":"99-16","member_number":"TY88699","first_name":"DEREK","last_name":"GUTHRIE","classification":"A","division":"PRODUCTION","hit_factor":7.8488},{"match_name":"RBGC 2017-10-21","match_date":"2017-10-21","stage_classifiercode":"99-16","member_number":"A80656","first_name":"ANDREAS","last_name":"YANKOPOLUS","classification":"G","division":"PRODUCTION","hit_factor":7.8322},{"match_name":"OK15 USPSA at USSA","match_date":"2016-12-11","stage_classifiercode":"99-16","member_number":"L3603","first_name":"MITCH","last_name":"GIBSON","classification":"A","division":"PRODUCTION","hit_factor":7.781},{"match_name":"USPSA MO21 Special Classifier 2Alpha SBRC February 27 2021","match_date":"2021-02-27","stage_classifiercode":"99-16","member_number":"A104348","first_name":"ROBERT","last_name":"ALGER","classification":"B","division":"PRODUCTION","hit_factor":7.7778},{"match_name":"CIPSC Havana July USPSA","match_date":"2018-07-07","stage_classifiercode":"99-16","member_number":"A91182","first_name":"MATTHEW","last_name":"ACKER","classification":"A","division":"PRODUCTION","hit_factor":7.7727952167414},{"match_name":"DWB - Deadwood Boys USPSA 20 May 2018","match_date":"2018-05-20","stage_classifiercode":"99-16","member_number":"A96044","first_name":"SEAN","last_name":"HENSLEY","classification":"U","division":"PRODUCTION","hit_factor":7.7698},{"match_name":"TPS USPSA -  April 2018 Clone","match_date":"2018-04-08","stage_classifiercode":"99-16","member_number":"a82422","first_name":"LAWTON","last_name":"SEGLER","classification":"A","division":"PRODUCTION","hit_factor":7.7437},{"match_name":"CRC_20160514_SuperClassifier","match_date":"2016-05-14","stage_classifiercode":"99-16","member_number":"A86605","first_name":"SEM","last_name":"CHIM","classification":"A","division":"PRODUCTION","hit_factor":7.7266},{"match_name":"Dundee USPSA Mar 2017","match_date":"2017-03-25","stage_classifiercode":"99-16","member_number":"A64113","first_name":"TOBIAS","last_name":"RICE","classification":"A","division":"PRODUCTION","hit_factor":7.7253},{"match_name":"Shasta Shooters September 2016","match_date":"2016-09-10","stage_classifiercode":"99-16","member_number":"A62459","first_name":"TODD","last_name":"HENDERSON","classification":"A","division":"PRODUCTION","hit_factor":7.723},{"match_name":"HSC USPSA April 7th 2018","match_date":"2018-04-07","stage_classifiercode":"99-16","member_number":"ty83667","first_name":"DARREN","last_name":"RASH","classification":"B","division":"PRODUCTION","hit_factor":7.6923},{"match_name":"RCPS USPSA 12 Nov 2016","match_date":"2016-11-12","stage_classifiercode":"99-16","member_number":"A71261","first_name":"TONY","last_name":"DONATELLI","classification":"A","division":"PRODUCTION","hit_factor":7.6596},{"match_name":"APSC USPSA Match 1-6-18","match_date":"2018-01-06","stage_classifiercode":"99-16","member_number":"\"\"","first_name":"DAVID","last_name":"REICHEK","classification":"U","division":"PRODUCTION","hit_factor":7.6487},{"match_name":"BORCC USPSA July 2018 Classifier Match","match_date":"2018-07-02","stage_classifiercode":"99-16","member_number":"A92992","first_name":"JACOB","last_name":"WEDGE","classification":"A","division":"PRODUCTION","hit_factor":7.6135},{"match_name":"CCPL 2 Day Match 2018","match_date":"2018-04-26","stage_classifiercode":"99-16","member_number":"A73456","first_name":"JORDAN","last_name":"HALL","classification":"M","division":"PRODUCTION","hit_factor":7.607},{"match_name":"LGCSEMPS September 2017 Handgun","match_date":"2017-09-10","stage_classifiercode":"99-16","member_number":"A81126","first_name":"MATT","last_name":"KRAJNIAK","classification":"A","division":"PRODUCTION","hit_factor":7.6046},{"match_name":"SPSA USPSA July 4th Sat match","match_date":"2018-07-28","stage_classifiercode":"99-16","member_number":"A100922","first_name":"TIM","last_name":"FULK","classification":"M","division":"PRODUCTION","hit_factor":7.5916},{"match_name":"LdF USPSA Match September 23 2017","match_date":"2017-09-23","stage_classifiercode":"99-16","member_number":"TY86409","first_name":"BO","last_name":"GIBBONS","classification":"A","division":"PRODUCTION","hit_factor":7.5881},{"match_name":"CCPS March 2018 USPSA","match_date":"2018-03-18","stage_classifiercode":"99-16","member_number":"A57180","first_name":"TROY M","last_name":"WILLARD","classification":"B","division":"PRODUCTION","hit_factor":7.5843},{"match_name":"PIPS 07-25-2018","match_date":"2018-07-25","stage_classifiercode":"99-16","member_number":"A74052","first_name":"TED","last_name":"ZWIEG","classification":"A","division":"PRODUCTION","hit_factor":7.5691},{"match_name":"HRC Jul 08 2017","match_date":"2017-07-07","stage_classifiercode":"99-16","member_number":"\"\"","first_name":"PADDY","last_name":"SULLIVAN","classification":"U","division":"PRODUCTION","hit_factor":7.5567},{"match_name":"ORSA USPSA July 2016 ","match_date":"2016-07-16","stage_classifiercode":"99-16","member_number":"L3403","first_name":"JOHN","last_name":"STONE","classification":"A","division":"PRODUCTION","hit_factor":7.5419},{"match_name":"OK15 USPSA at USSA","match_date":"2016-12-11","stage_classifiercode":"99-16","member_number":"A62501","first_name":"ROBBIE","last_name":"DAUGHERTY","classification":"A","division":"PRODUCTION","hit_factor":7.5188},{"match_name":"Hosemasters 2nd Sunday May 2017","match_date":"2017-05-14","stage_classifiercode":"99-16","member_number":"TY60349","first_name":"RIC","last_name":"GALLAWAY","classification":"M","division":"PRODUCTION","hit_factor":7.4766},{"match_name":"Renton USPSA - August 2020 - NW05","match_date":"2020-08-23","stage_classifiercode":"99-16","member_number":"A97885","first_name":"TODD","last_name":"ANDERSON","classification":"G","division":"PRODUCTION","hit_factor":7.4303},{"match_name":"PRG-USPSA - Oh Shoot January 3rd - 1st Sunday","match_date":"2021-01-03","stage_classifiercode":"99-16","member_number":"A123581","first_name":"MATTHEW","last_name":"THOMPSON","classification":"C","division":"PRODUCTION","hit_factor":7.4278},{"match_name":"Renton USPSA - August 2020 - NW05","match_date":"2020-08-23","stage_classifiercode":"99-16","member_number":"a79746","first_name":"CHARIS","last_name":"DENTON","classification":"A","division":"PRODUCTION","hit_factor":7.4074},{"match_name":"Dundee USPSA Mar 2017","match_date":"2017-03-25","stage_classifiercode":"99-16","member_number":"A64113","first_name":"TOBIAS","last_name":"RICE","classification":"A","division":"PRODUCTION","hit_factor":7.3871},{"match_name":"Pima Pistol Club USPSA Match - May 29 ","match_date":"2016-05-29","stage_classifiercode":"99-16","member_number":"FY81071","first_name":"ROB","last_name":"LISKA","classification":"B","division":"PRODUCTION","hit_factor":7.3864},{"match_name":"APSC USPSA Match 1-6-18","match_date":"2018-01-06","stage_classifiercode":"99-16","member_number":"A63634","first_name":"NICK","last_name":"BRUNNET","classification":"M","division":"PRODUCTION","hit_factor":7.337},{"match_name":"FLPSA MN14 USPSA May 17 2018","match_date":"2018-05-17","stage_classifiercode":"99-16","member_number":"A92403","first_name":"BRIAN","last_name":"FABIAN","classification":"M","division":"PRODUCTION","hit_factor":7.3343},{"match_name":"CIPSC Havana July USPSA","match_date":"2018-07-07","stage_classifiercode":"99-16","member_number":"L3231","first_name":"ERIC","last_name":"GRIGGS","classification":"A","division":"PRODUCTION","hit_factor":7.3232323232323},{"match_name":"BSPSC 2018 August Special Classifier","match_date":"2018-08-12","stage_classifiercode":"99-16","member_number":"TY24066","first_name":"GEORGE","last_name":"MANDES","classification":"A","division":"PRODUCTION","hit_factor":7.3171},{"match_name":"Grandbaggers 07/2017","match_date":"2017-07-06","stage_classifiercode":"99-16","member_number":"FY72117","first_name":"MARK","last_name":"GARDNER","classification":"A","division":"PRODUCTION","hit_factor":7.3012},{"match_name":"LCSC USPSA 01.14.18","match_date":"2018-01-13","stage_classifiercode":"99-16","member_number":"A46690","first_name":"GILBERT","last_name":"GESMUNDO","classification":"B","division":"PRODUCTION","hit_factor":7.2727},{"match_name":"CCPS March 2018 USPSA","match_date":"2018-03-18","stage_classifiercode":"99-16","member_number":"TY69818","first_name":"TY","last_name":"CLARK","classification":"A","division":"PRODUCTION","hit_factor":7.2581},{"match_name":"Pelham USPSA 2017-08-20","match_date":"2017-08-20","stage_classifiercode":"99-16","member_number":"TY79396","first_name":"ANDREW","last_name":"MACGRAY","classification":"B","division":"PRODUCTION","hit_factor":7.2386},{"match_name":"TPS USPSA -  January 2017 - Talon Range","match_date":"2017-01-07","stage_classifiercode":"99-16","member_number":"a-16020","first_name":"A.J.","last_name":"MCCARTNEY","classification":"M","division":"PRODUCTION","hit_factor":7.2289},{"match_name":"PCWC USPSA  1 28 17","match_date":"2017-01-28","stage_classifiercode":"99-16","member_number":"A84544","first_name":"GERRIT","last_name":"HEINRICH","classification":"U","division":"PRODUCTION","hit_factor":7.2258},{"match_name":"ShooT GTR USPSA 1/1/17","match_date":"2017-01-01","stage_classifiercode":"99-16","member_number":"TY98637","first_name":"KYLE","last_name":"STEPHENS","classification":"U","division":"PRODUCTION","hit_factor":7.2229},{"match_name":"USPSA Bass River April 2017","match_date":"2017-04-02","stage_classifiercode":"99-16","member_number":"TY66111","first_name":"DARIO","last_name":"LILLI","classification":"\"\"","division":"PRODUCTION","hit_factor":7.2115},{"match_name":"Shadow Hawk Defense USPSA Special Classifier","match_date":"2020-11-14","stage_classifiercode":"99-16","member_number":"A124319","first_name":"DANIEL","last_name":"SULLIVAN","classification":"U","division":"PRODUCTION","hit_factor":7.1871},{"match_name":"Shongum April 2016 Pistol Match","match_date":"2016-04-02","stage_classifiercode":"99-16","member_number":"TY86917","first_name":"DAN","last_name":"MARCHIARULLO","classification":"A","division":"PRODUCTION","hit_factor":7.1713},{"match_name":"DWB - Deadwood Boys USPSA 20 May 2018","match_date":"2018-05-20","stage_classifiercode":"99-16","member_number":"A103866","first_name":"LAWRENCE","last_name":"SHIN","classification":"C","division":"PRODUCTION","hit_factor":7.1523},{"match_name":"PCWC USPSA  1 28 17","match_date":"2017-01-28","stage_classifiercode":"99-16","member_number":"TY77177","first_name":"TIMOTHY","last_name":"HICHAK","classification":"A","division":"PRODUCTION","hit_factor":7.1429},{"match_name":"SPSA USPSA December 1st Sat Match","match_date":"2016-12-03","stage_classifiercode":"99-16","member_number":"A76179","first_name":"WESTON","last_name":"HENSLEY","classification":"G","division":"PRODUCTION","hit_factor":7.1156},{"match_name":"BORCC USPSA July 2018 Classifier Match","match_date":"2018-07-02","stage_classifiercode":"99-16","member_number":"A61733","first_name":"KEITH","last_name":"HAFER","classification":"A","division":"PRODUCTION","hit_factor":7.1146},{"match_name":"LdF USPSA Match September 23 2017","match_date":"2017-09-23","stage_classifiercode":"99-16","member_number":"TY63347","first_name":"MICHAEL","last_name":"ZOLEZZI","classification":"B","division":"PRODUCTION","hit_factor":7.1038},{"match_name":"PCWC USPSA  1 28 17","match_date":"2017-01-28","stage_classifiercode":"99-16","member_number":"A71719","first_name":"ED","last_name":"CHASE","classification":"A","division":"PRODUCTION","hit_factor":7.056},{"match_name":"USPSA-AB 2018-14 at Brooks Pistol Club -adhoc","match_date":"2018-08-08","stage_classifiercode":"99-16","member_number":"TY24475","first_name":"RICHARD","last_name":"INGRAM","classification":"M","division":"PRODUCTION","hit_factor":7.013},{"match_name":"LCSC USPSA 01.14.18","match_date":"2018-01-13","stage_classifiercode":"99-16","member_number":"A48595","first_name":"JOHN","last_name":"MERCURIO","classification":"A","division":"PRODUCTION","hit_factor":7.0126},{"match_name":"4ta Fecha USPSA","match_date":"2018-04-07","stage_classifiercode":"99-16","member_number":"TY70567","first_name":"HANZEL","last_name":"MIRANDA","classification":"A","division":"PRODUCTION","hit_factor":7.0093},{"match_name":"ENPS March 2017 USPSA Match","match_date":"2017-03-05","stage_classifiercode":"99-16","member_number":"L3077","first_name":"SHAWN","last_name":"KNIGHT","classification":"A","division":"PRODUCTION","hit_factor":7.0028},{"match_name":"SPSA USPSA July 4th Sat match","match_date":"2018-07-28","stage_classifiercode":"99-16","member_number":"A108199","first_name":"TIM","last_name":"OVERSTREET","classification":"U","division":"PRODUCTION","hit_factor":7.0012},{"match_name":"ENPS March 2017 USPSA Match","match_date":"2017-03-05","stage_classifiercode":"99-16","member_number":"A71916","first_name":"GREG","last_name":"HOLLINS","classification":"M","division":"PRODUCTION","hit_factor":6.9948},{"match_name":"SWGC USPSA Pistol Match - December","match_date":"2016-12-03","stage_classifiercode":"99-16","member_number":"A97069","first_name":"JUSTIN","last_name":"JOHNSON","classification":"U","division":"PRODUCTION","hit_factor":6.9913},{"match_name":"CARO USPSA MATCH NO 3","match_date":"2018-07-28","stage_classifiercode":"99-16","member_number":"A113079","first_name":"RENLIN","last_name":"ZHANG","classification":"U","division":"PRODUCTION","hit_factor":6.988},{"match_name":"BRSP Tuesday Night USPSA Match - June 5","match_date":"2018-06-06","stage_classifiercode":"99-16","member_number":"A88816","first_name":"BILL","last_name":"PEARCH","classification":"B","division":"PRODUCTION","hit_factor":6.9638},{"match_name":"Nampa USPSA May 27th 2020 Classifier Match","match_date":"2020-05-27","stage_classifiercode":"99-16","member_number":"A103720","first_name":"MIKE","last_name":"AUSTIN","classification":"A","division":"PRODUCTION","hit_factor":6.9498},{"match_name":"Dundee USPSA Mar 2017","match_date":"2017-03-25","stage_classifiercode":"99-16","member_number":"L3893","first_name":"MICHAEL","last_name":"BURGESS","classification":"B","division":"PRODUCTION","hit_factor":6.9409},{"match_name":"SPSA USPSA July 4th Sat match","match_date":"2018-07-28","stage_classifiercode":"99-16","member_number":"A106222","first_name":"DANIEL","last_name":"LEITH","classification":"A","division":"PRODUCTION","hit_factor":6.9252},{"match_name":"LGCSEMPS September 2017 Handgun","match_date":"2017-09-10","stage_classifiercode":"99-16","member_number":"TY87630","first_name":"MINGRAN","last_name":"QIAN","classification":"M","division":"PRODUCTION","hit_factor":6.9252},{"match_name":"DWB - Deadwood Boys USPSA 20 May 2018","match_date":"2018-05-20","stage_classifiercode":"99-16","member_number":"A102225","first_name":"KEVIN","last_name":"RICHARDSON","classification":"B","division":"PRODUCTION","hit_factor":6.9221},{"match_name":"SFPS 10-08-2017 USPSA match","match_date":"2017-10-08","stage_classifiercode":"99-16","member_number":"TY30630","first_name":"FRED","last_name":"LEDWELL","classification":"B","division":"PRODUCTION","hit_factor":6.9212},{"match_name":"Pelham USPSA 2017-08-20","match_date":"2017-08-20","stage_classifiercode":"99-16","member_number":"TY86431","first_name":"NEAL","last_name":"LIDDLE","classification":"B","division":"PRODUCTION","hit_factor":6.8966},{"match_name":"DAP December 2015 Classifier match","match_date":"2015-12-12","stage_classifiercode":"99-16","member_number":"TY76892","first_name":"BRYAN","last_name":"LUM","classification":"A","division":"PRODUCTION","hit_factor":6.8878},{"match_name":"ARPC USPSA Match 3-26-17","match_date":"2017-03-26","stage_classifiercode":"99-16","member_number":"A78694","first_name":"STEPHEN","last_name":"LUTMAN","classification":"G","division":"PRODUCTION","hit_factor":6.8871},{"match_name":"TPS USPSA -  April 2018 Clone","match_date":"2018-04-08","stage_classifiercode":"99-16","member_number":"a72424","first_name":"WOUTER","last_name":"BADENHORST","classification":"A","division":"PRODUCTION","hit_factor":6.8712},{"match_name":"SPSA USPSA December 1st Sat Match","match_date":"2016-12-03","stage_classifiercode":"99-16","member_number":"A78777","first_name":"EMILY","last_name":"ROBINSON","classification":"B","division":"PRODUCTION","hit_factor":6.8615},{"match_name":"LdF USPSA Match September 23 2017","match_date":"2017-09-23","stage_classifiercode":"99-16","member_number":"A86247","first_name":"SEAN","last_name":"DAVIS","classification":"B","division":"PRODUCTION","hit_factor":6.8602},{"match_name":"Pelham USPSA 2017-08-20","match_date":"2017-08-20","stage_classifiercode":"99-16","member_number":"A60707","first_name":"DAVE","last_name":"SOLIMINI","classification":"M","division":"PRODUCTION","hit_factor":6.8543},{"match_name":"CRC_20160514_SuperClassifier","match_date":"2016-05-14","stage_classifiercode":"99-16","member_number":"A86605","first_name":"SEM","last_name":"CHIM","classification":"A","division":"PRODUCTION","hit_factor":6.8511},{"match_name":"MSSA Uspsa Club Matcg","match_date":"2017-09-24","stage_classifiercode":"99-16","member_number":"L3615","first_name":"BOBBY","last_name":"RIVERA","classification":"M","division":"PRODUCTION","hit_factor":6.8268},{"match_name":"Hosemasters 2nd Sunday May 2017","match_date":"2017-05-14","stage_classifiercode":"99-16","member_number":"FY73383","first_name":"SANDY","last_name":"RUTHVEN","classification":"M","division":"PRODUCTION","hit_factor":6.821},{"match_name":"Pinetucky USPSA 02-27-16","match_date":"2016-02-27","stage_classifiercode":"99-16","member_number":"Ty53092","first_name":"DEWEY","last_name":"HUTSON","classification":"M","division":"PRODUCTION","hit_factor":6.8027},{"match_name":"Shasta Shooters September 2016","match_date":"2016-09-10","stage_classifiercode":"99-16","member_number":"TY-94941","first_name":"JEREMY","last_name":"BAKER","classification":"B","division":"PRODUCTION","hit_factor":6.7843},{"match_name":"DWB - Deadwood Boys USPSA 20 May 2018","match_date":"2018-05-20","stage_classifiercode":"99-16","member_number":"A101565","first_name":"KYLE","last_name":"LITZIE","classification":"B","division":"PRODUCTION","hit_factor":6.7511},{"match_name":"CIPSC Havana July USPSA","match_date":"2018-07-07","stage_classifiercode":"99-16","member_number":"L3831","first_name":"JEFF","last_name":"HICKS","classification":"M","division":"PRODUCTION","hit_factor":6.7510548523207},{"match_name":"Pelham USPSA 2017-08-20","match_date":"2017-08-20","stage_classifiercode":"99-16","member_number":"A101456","first_name":"MICHAEL","last_name":"NGUYEN","classification":"B","division":"PRODUCTION","hit_factor":6.7476},{"match_name":"Cameo USPSA Match March 20 2021","match_date":"2021-03-20","stage_classifiercode":"99-16","member_number":"A91314","first_name":"CHRIS","last_name":"OLIVER","classification":"B","division":"PRODUCTION","hit_factor":6.7442},{"match_name":"ENPS March 2017 USPSA Match","match_date":"2017-03-05","stage_classifiercode":"99-16","member_number":"TY50841","first_name":"JOEL","last_name":"PARK","classification":"M","division":"PRODUCTION","hit_factor":6.734},{"match_name":"Briar Rabbit  June Match 2016 OH 20","match_date":"2016-06-12","stage_classifiercode":"99-16","member_number":"TY27846","first_name":"LYLE","last_name":"HERMAN","classification":"A","division":"PRODUCTION","hit_factor":6.7295},{"match_name":"Shongum December 2017 USPSA Match","match_date":"2017-12-02","stage_classifiercode":"99-16","member_number":"A81788","first_name":"CHRIS","last_name":"JARONSKY","classification":"M","division":"PRODUCTION","hit_factor":6.7248},{"match_name":"DAP December 2015 Classifier match","match_date":"2015-12-12","stage_classifiercode":"99-16","member_number":"TY88263","first_name":"BRIAN","last_name":"FARID","classification":"B","division":"PRODUCTION","hit_factor":6.7204},{"match_name":"SWGC USPSA Pistol Match - December","match_date":"2016-12-03","stage_classifiercode":"99-16","member_number":"TY77177","first_name":"TIMOTHY","last_name":"HICHAK","classification":"A","division":"PRODUCTION","hit_factor":6.7066},{"match_name":"SPSA USPSA December 1st Sat Match","match_date":"2016-12-03","stage_classifiercode":"99-16","member_number":"TY56396","first_name":"MORGAN","last_name":"ALLEN","classification":"A","division":"PRODUCTION","hit_factor":6.6998},{"match_name":"CIPSC Havana July USPSA","match_date":"2018-07-07","stage_classifiercode":"99-16","member_number":"TY76849","first_name":"RYAN","last_name":"CLOUSE","classification":"B","division":"PRODUCTION","hit_factor":6.6897347174164},{"match_name":"RBGC 2017-10-21","match_date":"2017-10-21","stage_classifiercode":"99-16","member_number":"FY56598","first_name":"KEVIN","last_name":"ALLEN","classification":"X","division":"PRODUCTION","hit_factor":6.6832},{"match_name":"BORCC USPSA July 2018 Classifier Match","match_date":"2018-07-02","stage_classifiercode":"99-16","member_number":"A76095","first_name":"JEFF","last_name":"SLUSSER","classification":"A","division":"PRODUCTION","hit_factor":6.6773},{"match_name":"AIPS Weekly USPSA 3 August 2021","match_date":"2021-08-03","stage_classifiercode":"99-16","member_number":"FY72636","first_name":"ANDREW","last_name":"SMITHSON","classification":"C","division":"PRODUCTION","hit_factor":6.6749},{"match_name":"PIPS 07-25-2018","match_date":"2018-07-25","stage_classifiercode":"99-16","member_number":"TY68444","first_name":"MONTE","last_name":"BRUESEWITZ","classification":"B","division":"PRODUCTION","hit_factor":6.6667},{"match_name":"Shongum April 2016 Pistol Match","match_date":"2016-04-02","stage_classifiercode":"99-16","member_number":"L3767","first_name":"BEN","last_name":"HSIAO","classification":"A","division":"PRODUCTION","hit_factor":6.6502},{"match_name":"Pelham USPSA 2017-08-20","match_date":"2017-08-20","stage_classifiercode":"99-16","member_number":"A84437","first_name":"SEBASTIAN","last_name":"YORDAN","classification":"A","division":"PRODUCTION","hit_factor":6.6378},{"match_name":"Shasta Shooters September 2016","match_date":"2016-09-10","stage_classifiercode":"99-16","member_number":"A-89662","first_name":"TODD","last_name":"CANCILLA","classification":"C","division":"PRODUCTION","hit_factor":6.6362},{"match_name":"RBGC 2017-10-21","match_date":"2017-10-21","stage_classifiercode":"99-16","member_number":"\"\"","first_name":"WILL","last_name":"HINES","classification":"U","division":"PRODUCTION","hit_factor":6.6339},{"match_name":"SPSA USPSA June 1st Sat Match","match_date":"2021-06-05","stage_classifiercode":"99-16","member_number":"TY108779","first_name":"DARRELL","last_name":"BISHOP","classification":"U","division":"PRODUCTION","hit_factor":6.6176},{"match_name":"BORCC USPSA July 2018 Classifier Match","match_date":"2018-07-02","stage_classifiercode":"99-16","member_number":"A106970","first_name":"JAKE","last_name":"HOLST","classification":"U","division":"PRODUCTION","hit_factor":6.6176},{"match_name":"RBGC 2017-10-21","match_date":"2017-10-21","stage_classifiercode":"99-16","member_number":"A102109","first_name":"JASON","last_name":"CLARK","classification":"U","division":"PRODUCTION","hit_factor":6.6038},{"match_name":"WLPS USPSA Sep 2016","match_date":"2016-09-25","stage_classifiercode":"99-16","member_number":"TY75248","first_name":"STEVEN","last_name":"YEATER","classification":"B","division":"PRODUCTION","hit_factor":6.5903},{"match_name":"LdF USPSA Match September 23 2017","match_date":"2017-09-23","stage_classifiercode":"99-16","member_number":"A59678","first_name":"MILO","last_name":"SANTOS","classification":"B","division":"PRODUCTION","hit_factor":6.5773},{"match_name":"Shongum December 2017 USPSA Match","match_date":"2017-12-02","stage_classifiercode":"99-16","member_number":"Ty22346","first_name":"BUCKY","last_name":"POLLARD","classification":"A","division":"PRODUCTION","hit_factor":6.574},{"match_name":"LGCSEMPS September 2017 Handgun","match_date":"2017-09-10","stage_classifiercode":"99-16","member_number":"A92991","first_name":"MARSON","last_name":"MA","classification":"C","division":"PRODUCTION","hit_factor":6.5693},{"match_name":"BORCC USPSA July 2018 Classifier Match","match_date":"2018-07-02","stage_classifiercode":"99-16","member_number":"A99883","first_name":"ANGELA","last_name":"SPALLA","classification":"B","division":"PRODUCTION","hit_factor":6.5455},{"match_name":"AIPS Weekly USPSA 3 August 2021","match_date":"2021-08-03","stage_classifiercode":"99-16","member_number":"TY23819","first_name":"MIKE","last_name":"CARMONEY","classification":"A","division":"PRODUCTION","hit_factor":6.5242},{"match_name":"MCPSL Pistol 10-9-2021","match_date":"2021-10-09","stage_classifiercode":"99-16","member_number":"FY85914","first_name":"JUSTIN","last_name":"BARDWELL","classification":"B","division":"PRODUCTION","hit_factor":6.5076},{"match_name":"4ta Fecha USPSA","match_date":"2018-04-07","stage_classifiercode":"99-16","member_number":"A85967","first_name":"MANUEL","last_name":"CAMPOS","classification":"C","division":"PRODUCTION","hit_factor":6.506},{"match_name":"USPSA MO21 Special Classifier 2Alpha SBRC February 27 2021","match_date":"2021-02-27","stage_classifiercode":"99-16","member_number":"A110827","first_name":"DREW","last_name":"HICKS","classification":"B","division":"PRODUCTION","hit_factor":6.5022},{"match_name":"Hosemasters 2nd Sunday May 2017","match_date":"2017-05-14","stage_classifiercode":"99-16","member_number":"A88635","first_name":"ROB","last_name":"MCDOWELL","classification":"B","division":"PRODUCTION","hit_factor":6.5022},{"match_name":"Renton USPSA - August 2020 - NW05","match_date":"2020-08-23","stage_classifiercode":"99-16","member_number":"TY86531","first_name":"RUBEN","last_name":"HEIM","classification":"A","division":"PRODUCTION","hit_factor":6.5},{"match_name":"SRAPS Amarillo Action May","match_date":"2016-05-28","stage_classifiercode":"99-16","member_number":"L3708","first_name":"JIM","last_name":"BODKIN","classification":"G","division":"PRODUCTION","hit_factor":6.4953},{"match_name":"TPS USPSA -  January 2017 - Talon Range","match_date":"2017-01-07","stage_classifiercode":"99-16","member_number":"TY86255","first_name":"TODD","last_name":"STOUT","classification":"B","division":"PRODUCTION","hit_factor":6.4757},{"match_name":"GCL June 3-2017","match_date":"2017-06-03","stage_classifiercode":"99-16","member_number":"FY74975","first_name":"BILL","last_name":"STEGER","classification":"C","division":"PRODUCTION","hit_factor":6.4683},{"match_name":"CCPL 02-09-2020","match_date":"2020-02-09","stage_classifiercode":"99-16","member_number":"A125746","first_name":"RYAN","last_name":"SWAIN","classification":"U","division":"PRODUCTION","hit_factor":6.4665},{"match_name":"LdF USPSA Match September 23 2017","match_date":"2017-09-23","stage_classifiercode":"99-16","member_number":"A102779","first_name":"KENNY","last_name":"WEIMAN","classification":"C","division":"PRODUCTION","hit_factor":6.4655},{"match_name":"PCWC USPSA  1 28 17","match_date":"2017-01-28","stage_classifiercode":"99-16","member_number":"L2841","first_name":"CHRIS","last_name":"EDWARDS","classification":"B","division":"PRODUCTION","hit_factor":6.4516},{"match_name":"TPS USPSA -  April 2018 Clone","match_date":"2018-04-08","stage_classifiercode":"99-16","member_number":"ty86255","first_name":"TODD","last_name":"STOUT","classification":"M","division":"PRODUCTION","hit_factor":6.4516},{"match_name":"TPS USPSA -  April 2018 Clone","match_date":"2018-04-08","stage_classifiercode":"99-16","member_number":"fy82088","first_name":"PARKS","last_name":"SMALL","classification":"A","division":"PRODUCTION","hit_factor":6.4444},{"match_name":"CCPL 2 Day Match 2018","match_date":"2018-04-26","stage_classifiercode":"99-16","member_number":"L3706","first_name":"JASON","last_name":"LAIRD","classification":"B","division":"PRODUCTION","hit_factor":6.4433},{"match_name":"DWB - Deadwood Boys USPSA 20 May 2018","match_date":"2018-05-20","stage_classifiercode":"99-16","member_number":"TY106977","first_name":"SHOJI","last_name":"HATTORI","classification":"U","division":"PRODUCTION","hit_factor":6.4368},{"match_name":"DAP December 2015 Classifier match","match_date":"2015-12-12","stage_classifiercode":"99-16","member_number":"A87259","first_name":"YEE-MIN","last_name":"LIN","classification":"C","division":"PRODUCTION","hit_factor":6.4362},{"match_name":"MSSA Uspsa Club Matcg","match_date":"2017-09-24","stage_classifiercode":"99-16","member_number":"\"\"","first_name":"ANTHONY","last_name":"COWDEN","classification":"U","division":"PRODUCTION","hit_factor":6.4246},{"match_name":"BSPSC 2018 August Special Classifier","match_date":"2018-08-12","stage_classifiercode":"99-16","member_number":"A112998","first_name":"MATT","last_name":"WILLIAMS","classification":"U","division":"PRODUCTION","hit_factor":6.4147},{"match_name":"BORCC USPSA July 2018 Classifier Match","match_date":"2018-07-02","stage_classifiercode":"99-16","member_number":"A106367","first_name":"DANIEL","last_name":"MATHIAS","classification":"C","division":"PRODUCTION","hit_factor":6.4133},{"match_name":"USPSA Bass River April 2017","match_date":"2017-04-02","stage_classifiercode":"99-16","member_number":"A90715","first_name":"NICK","last_name":"ORLANDO","classification":"\"\"","division":"PRODUCTION","hit_factor":6.4118},{"match_name":"LdF USPSA Match September 23 2017","match_date":"2017-09-23","stage_classifiercode":"99-16","member_number":"A101894","first_name":"CHASE","last_name":"MAY","classification":"B","division":"PRODUCTION","hit_factor":6.4103},{"match_name":"CIPSC Havana July USPSA","match_date":"2018-07-07","stage_classifiercode":"99-16","member_number":"TY74535","first_name":"THOMAS","last_name":"PIRTLE","classification":"B","division":"PRODUCTION","hit_factor":6.4073226544622},{"match_name":"RCPS USPSA Sep 11","match_date":"2021-09-11","stage_classifiercode":"99-16","member_number":"A83750","first_name":"JONPAUL","last_name":"WISE","classification":"B","division":"PRODUCTION","hit_factor":6.3754},{"match_name":"RBGC 2017-10-21","match_date":"2017-10-21","stage_classifiercode":"99-16","member_number":"\"\"","first_name":"BRETT","last_name":"ROSE","classification":"U","division":"PRODUCTION","hit_factor":6.3709},{"match_name":"CCPL 2 Day Match 2018","match_date":"2018-04-26","stage_classifiercode":"99-16","member_number":"A89166","first_name":"WILLIAM","last_name":"BUCHNOFF","classification":"B","division":"PRODUCTION","hit_factor":6.3527},{"match_name":"4ta Fecha USPSA","match_date":"2018-04-07","stage_classifiercode":"99-16","member_number":"TYF74171","first_name":"MAX","last_name":"RIVERA","classification":"A","division":"PRODUCTION","hit_factor":6.3455},{"match_name":"PCWC USPSA  1 28 17","match_date":"2017-01-28","stage_classifiercode":"99-16","member_number":"a99032","first_name":"DALE","last_name":"MUSSELWHITE","classification":"X","division":"PRODUCTION","hit_factor":6.3452},{"match_name":"RBGC 2017-10-21","match_date":"2017-10-21","stage_classifiercode":"99-16","member_number":"A88177","first_name":"CHRIS","last_name":"SMITH","classification":"A","division":"PRODUCTION","hit_factor":6.3291},{"match_name":"Dundee USPSA Mar 2017","match_date":"2017-03-25","stage_classifiercode":"99-16","member_number":"TY78052","first_name":"SERGE","last_name":"DAVIS","classification":"A","division":"PRODUCTION","hit_factor":6.31},{"match_name":"HSC USPSA April 7th 2018","match_date":"2018-04-07","stage_classifiercode":"99-16","member_number":"L4084","first_name":"KEVIN","last_name":"MCPHEE","classification":"B","division":"PRODUCTION","hit_factor":6.3063},{"match_name":"4ta Fecha USPSA","match_date":"2018-04-07","stage_classifiercode":"99-16","member_number":"A90954","first_name":"ROBERTO","last_name":"MORALES","classification":"A","division":"PRODUCTION","hit_factor":6.2992},{"match_name":"Pinetucky USPSA 02-27-16","match_date":"2016-02-27","stage_classifiercode":"99-16","member_number":"TY-73342","first_name":"CHRIS","last_name":"ANDERSON","classification":"B","division":"PRODUCTION","hit_factor":6.2972},{"match_name":"AIPS Weekly USPSA 3 August 2021","match_date":"2021-08-03","stage_classifiercode":"99-16","member_number":"A51259","first_name":"SKIP","last_name":"AHERN","classification":"B","division":"PRODUCTION","hit_factor":6.271},{"match_name":"Idaho ISPS August 5th Break from the Heat","match_date":"2017-08-05","stage_classifiercode":"99-16","member_number":"TY41041","first_name":"NICK","last_name":"WELCH","classification":"B","division":"PRODUCTION","hit_factor":6.257},{"match_name":"4ta Fecha USPSA","match_date":"2018-04-07","stage_classifiercode":"99-16","member_number":"A86185","first_name":"WILLIE","last_name":"SOTO","classification":"A","division":"PRODUCTION","hit_factor":6.2425},{"match_name":"ARPC USPSA Match 3-26-17","match_date":"2017-03-26","stage_classifiercode":"99-16","member_number":"A88826","first_name":"CHRIS","last_name":"HAASE","classification":"C","division":"PRODUCTION","hit_factor":6.2305},{"match_name":"SWGC USPSA Pistol Match - December","match_date":"2016-12-03","stage_classifiercode":"99-16","member_number":"Fy65456","first_name":"SHAWN","last_name":"POWELL","classification":"B","division":"PRODUCTION","hit_factor":6.2257},{"match_name":"SRAPS Amarillo Action May","match_date":"2016-05-28","stage_classifiercode":"99-16","member_number":"TY69651","first_name":"CODY","last_name":"WILHELM","classification":"\"\"","division":"PRODUCTION","hit_factor":6.2153},{"match_name":"LCSC USPSA 01.14.18","match_date":"2018-01-13","stage_classifiercode":"99-16","member_number":"A97497","first_name":"ROBERT","last_name":"FRESHWATER","classification":"B","division":"PRODUCTION","hit_factor":6.2112},{"match_name":"West Liberty USPSA Oct 2018","match_date":"2018-10-28","stage_classifiercode":"99-16","member_number":"TY99873","first_name":"NATHAN","last_name":"NEALSON","classification":"B","division":"PRODUCTION","hit_factor":6.2084},{"match_name":"USPSA-AB 2018-14 at Brooks Pistol Club -adhoc","match_date":"2018-08-08","stage_classifiercode":"99-16","member_number":"TYF86780","first_name":"DUANE","last_name":"SNIEZEK","classification":"B","division":"PRODUCTION","hit_factor":6.181},{"match_name":"DWB - Deadwood Boys USPSA 20 May 2018","match_date":"2018-05-20","stage_classifiercode":"99-16","member_number":"A107133","first_name":"EL TORO","last_name":"ARROYO","classification":"B","division":"PRODUCTION","hit_factor":6.1728},{"match_name":"4ta Fecha USPSA","match_date":"2018-04-07","stage_classifiercode":"99-16","member_number":"A97082","first_name":"ROBERTO","last_name":"SANCHEZ","classification":"C","division":"PRODUCTION","hit_factor":6.1728},{"match_name":"LdF USPSA Match September 23 2017","match_date":"2017-09-23","stage_classifiercode":"99-16","member_number":"A70847","first_name":"JOHN","last_name":"ACKERMAN","classification":"A","division":"PRODUCTION","hit_factor":6.1644},{"match_name":"Dundee USPSA Mar 2017","match_date":"2017-03-25","stage_classifiercode":"99-16","member_number":"A89859","first_name":"JOHN","last_name":"JUNEMAN","classification":"U","division":"PRODUCTION","hit_factor":6.1441},{"match_name":"ORSA USPSA July 2016 ","match_date":"2016-07-16","stage_classifiercode":"99-16","member_number":"A90145","first_name":"JOEY","last_name":"LIEW","classification":"B","division":"PRODUCTION","hit_factor":6.1425},{"match_name":"TPS USPSA -  January 2017 - Talon Range","match_date":"2017-01-07","stage_classifiercode":"99-16","member_number":"Fy82088","first_name":"PARKS","last_name":"SMALL","classification":"B","division":"PRODUCTION","hit_factor":6.1425},{"match_name":"Hosemasters 2nd Sunday May 2017","match_date":"2017-05-14","stage_classifiercode":"99-16","member_number":"TY82260","first_name":"JEFFREY","last_name":"JAMES","classification":"C","division":"PRODUCTION","hit_factor":6.1404},{"match_name":"RBGC 2017-10-21","match_date":"2017-10-21","stage_classifiercode":"99-16","member_number":"A81982","first_name":"MICAH","last_name":"WAITS","classification":"G","division":"PRODUCTION","hit_factor":6.1286},{"match_name":"ENPS March 2017 USPSA Match","match_date":"2017-03-05","stage_classifiercode":"99-16","member_number":"A94027","first_name":"MITCHELL","last_name":"TRUKA","classification":"U","division":"PRODUCTION","hit_factor":6.1176},{"match_name":"SWGC USPSA Pistol Match - December","match_date":"2016-12-03","stage_classifiercode":"99-16","member_number":"TY83136","first_name":"JOHN","last_name":"FINLEY","classification":"B","division":"PRODUCTION","hit_factor":6.1017},{"match_name":"Shadow Hawk Defense USPSA Special Classifier","match_date":"2020-11-14","stage_classifiercode":"99-16","member_number":"TY114978","first_name":"RHYS","last_name":"WILLIAMS","classification":"C","division":"PRODUCTION","hit_factor":6.089},{"match_name":"CRC_20160514_SuperClassifier","match_date":"2016-05-14","stage_classifiercode":"99-16","member_number":"L3812","first_name":"STEVEN","last_name":"LICHON","classification":"B","division":"PRODUCTION","hit_factor":6.0797},{"match_name":"Idaho ISPS August 5th Break from the Heat","match_date":"2017-08-05","stage_classifiercode":"99-16","member_number":"A98224","first_name":"JUSTIN","last_name":"HASH","classification":"A","division":"PRODUCTION","hit_factor":6.0561},{"match_name":"AIPS Weekly USPSA 3 August 2021","match_date":"2021-08-03","stage_classifiercode":"99-16","member_number":"A68875","first_name":"STACY","last_name":"NIEMANN","classification":"A","division":"PRODUCTION","hit_factor":6.0423},{"match_name":"Dundee USPSA Mar 2017","match_date":"2017-03-25","stage_classifiercode":"99-16","member_number":"TY87796","first_name":"MIKE","last_name":"SMITH","classification":"B","division":"PRODUCTION","hit_factor":6.0268},{"match_name":"SFPS 10-08-2017 USPSA match","match_date":"2017-10-08","stage_classifiercode":"99-16","member_number":"A91633","first_name":"CHANCE","last_name":"ROHLK","classification":"U","division":"PRODUCTION","hit_factor":6.0201},{"match_name":"ENPS March 2017 USPSA Match","match_date":"2017-03-05","stage_classifiercode":"99-16","member_number":"A52576","first_name":"TRAVIS","last_name":"MITCHELL","classification":"C","division":"PRODUCTION","hit_factor":6.0166},{"match_name":"BSPSC 2018 August Special Classifier","match_date":"2018-08-12","stage_classifiercode":"99-16","member_number":"TY53124","first_name":"CARRIE","last_name":"JAMROGOWICZ","classification":"A","division":"PRODUCTION","hit_factor":6.0086},{"match_name":"CRC_20160514_SuperClassifier","match_date":"2016-05-14","stage_classifiercode":"99-16","member_number":"L3812","first_name":"STEVEN","last_name":"LICHON","classification":"B","division":"PRODUCTION","hit_factor":5.988},{"match_name":"CRC_20160514_SuperClassifier","match_date":"2016-05-14","stage_classifiercode":"99-16","member_number":"A95263","first_name":"SIDA","last_name":"SHEN","classification":"C","division":"PRODUCTION","hit_factor":5.9801},{"match_name":"ARPC USPSA Match 3-26-17","match_date":"2017-03-26","stage_classifiercode":"99-16","member_number":"A82327","first_name":"BRIAN","last_name":"SIX","classification":"B","division":"PRODUCTION","hit_factor":5.9794},{"match_name":"CIPSC Havana July USPSA","match_date":"2018-07-07","stage_classifiercode":"99-16","member_number":"A109815","first_name":"JASON","last_name":"BROUGHTON","classification":"B","division":"PRODUCTION","hit_factor":5.9701492537313},{"match_name":"4ta Fecha USPSA","match_date":"2018-04-07","stage_classifiercode":"99-16","member_number":"A89235","first_name":"LUIS A.","last_name":"QUILICHINI-ALBORS","classification":"B","division":"PRODUCTION","hit_factor":5.9595},{"match_name":"CRC_20160514_SuperClassifier","match_date":"2016-05-14","stage_classifiercode":"99-16","member_number":"A88502","first_name":"CHRIS","last_name":"PETERSON","classification":"U","division":"PRODUCTION","hit_factor":5.9524},{"match_name":"Grandbaggers 07/2017","match_date":"2017-07-06","stage_classifiercode":"99-16","member_number":"A81261","first_name":"THOMAS","last_name":"CLYDE","classification":"U","division":"PRODUCTION","hit_factor":5.9361},{"match_name":"DWB - Deadwood Boys USPSA 20 May 2018","match_date":"2018-05-20","stage_classifiercode":"99-16","member_number":"A99889","first_name":"RAYMOND","last_name":"PIEDRA","classification":"C","division":"PRODUCTION","hit_factor":5.9341},{"match_name":"CIPSC Havana July USPSA","match_date":"2018-07-07","stage_classifiercode":"99-16","member_number":"L3333","first_name":"BRIAN","last_name":"GRICE","classification":"B","division":"PRODUCTION","hit_factor":5.9322033898305},{"match_name":"Pinetucky USPSA 02-27-16","match_date":"2016-02-27","stage_classifiercode":"99-16","member_number":"A89335","first_name":"CYRIL","last_name":"FIDER","classification":"C","division":"PRODUCTION","hit_factor":5.9197},{"match_name":"SWGC USPSA Pistol Match - December","match_date":"2016-12-03","stage_classifiercode":"99-16","member_number":"A69177","first_name":"JEFF","last_name":"WHITE","classification":"A","division":"PRODUCTION","hit_factor":5.9186},{"match_name":"SWGC USPSA Pistol Match - December","match_date":"2016-12-03","stage_classifiercode":"99-16","member_number":"TY48498","first_name":"PAUL","last_name":"DEEL","classification":"M","division":"PRODUCTION","hit_factor":5.9134},{"match_name":"Shongum April 2016 Pistol Match","match_date":"2016-04-02","stage_classifiercode":"99-16","member_number":"A88306","first_name":"ZACK","last_name":"BECKER","classification":"C","division":"PRODUCTION","hit_factor":5.8943},{"match_name":"Nampa USPSA May 27th 2020 Classifier Match","match_date":"2020-05-27","stage_classifiercode":"99-16","member_number":"TY63273","first_name":"GREGG","last_name":"HARWOOD","classification":"B","division":"PRODUCTION","hit_factor":5.889},{"match_name":"RBGC 2017-10-21","match_date":"2017-10-21","stage_classifiercode":"99-16","member_number":"A105125","first_name":"JOE","last_name":"GEORGE","classification":"U","division":"PRODUCTION","hit_factor":5.8883},{"match_name":"OK15 USPSA at USSA","match_date":"2016-12-11","stage_classifiercode":"99-16","member_number":"FY48467","first_name":"WARREN","last_name":"BIGELOW","classification":"B","division":"PRODUCTION","hit_factor":5.8764},{"match_name":"RBGC 2017-10-21","match_date":"2017-10-21","stage_classifiercode":"99-16","member_number":"A68985","first_name":"CHRIS","last_name":"FARNAN","classification":"B","division":"PRODUCTION","hit_factor":5.876},{"match_name":"MS06 Team Magnolia USPSA January Match2","match_date":"2016-01-03","stage_classifiercode":"99-16","member_number":"TY56197","first_name":"DANNY","last_name":"WARREN","classification":"C","division":"PRODUCTION","hit_factor":5.8757},{"match_name":"Hosemasters 2nd Sunday May 2017","match_date":"2017-05-14","stage_classifiercode":"99-16","member_number":"A77997","first_name":"TOM","last_name":"MCCONLOGUE","classification":"B","division":"PRODUCTION","hit_factor":5.8704},{"match_name":"Grandbaggers 07/2017","match_date":"2017-07-06","stage_classifiercode":"99-16","member_number":"A77832","first_name":"NICK","last_name":"VERHAEGHE","classification":"A","division":"PRODUCTION","hit_factor":5.868},{"match_name":"CIPSC Havana July USPSA","match_date":"2018-07-07","stage_classifiercode":"99-16","member_number":"A99883","first_name":"ALEX","last_name":"RO","classification":"B","division":"PRODUCTION","hit_factor":5.8645096056623},{"match_name":"ENPS March 2017 USPSA Match","match_date":"2017-03-05","stage_classifiercode":"99-16","member_number":"L3523","first_name":"CHRIS","last_name":"ZEEB","classification":"B","division":"PRODUCTION","hit_factor":5.8568},{"match_name":"BORCC USPSA July 2018 Classifier Match","match_date":"2018-07-02","stage_classifiercode":"99-16","member_number":"A64028","first_name":"JOSEPH","last_name":"MARGHERONE","classification":"M","division":"PRODUCTION","hit_factor":5.8544},{"match_name":"DAP December 2015 Classifier match","match_date":"2015-12-12","stage_classifiercode":"99-16","member_number":"TY87816","first_name":"BRETT","last_name":"EWART","classification":"C","division":"PRODUCTION","hit_factor":5.8505},{"match_name":"LGCSEMPS September 2017 Handgun","match_date":"2017-09-10","stage_classifiercode":"99-16","member_number":"TY61030","first_name":"GERALD","last_name":"MITCHELL","classification":"B","division":"PRODUCTION","hit_factor":5.8455},{"match_name":"BSPSC 2018 August Special Classifier","match_date":"2018-08-12","stage_classifiercode":"99-16","member_number":"A107334","first_name":"KATHERINE","last_name":"LICENCE","classification":"U","division":"PRODUCTION","hit_factor":5.8442},{"match_name":"DAP December 2015 Classifier match","match_date":"2015-12-12","stage_classifiercode":"99-16","member_number":"A84228","first_name":"JOSEPH","last_name":"EMANUEL","classification":"none","division":"PRODUCTION","hit_factor":5.8315},{"match_name":"2da Copa Nacional USPSA ","match_date":"2016-05-22","stage_classifiercode":"99-16","member_number":"A86185","first_name":"WILLIE","last_name":"SOTO","classification":"A","division":"PRODUCTION","hit_factor":5.8275},{"match_name":"APSC USPSA Match 1-6-18","match_date":"2018-01-06","stage_classifiercode":"99-16","member_number":"A94815","first_name":"NICK","last_name":"GILMAN","classification":"A","division":"PRODUCTION","hit_factor":5.8172},{"match_name":"CRC_20160514_SuperClassifier","match_date":"2016-05-14","stage_classifiercode":"99-16","member_number":"A87911","first_name":"KEITH","last_name":"MARKEY","classification":"U","division":"PRODUCTION","hit_factor":5.8127},{"match_name":"WLPS June 2017","match_date":"2017-06-25","stage_classifiercode":"99-16","member_number":"\"\"","first_name":"SEAN","last_name":"KOOPMAN","classification":"C","division":"PRODUCTION","hit_factor":5.8058},{"match_name":"Pelham USPSA 2017-08-20","match_date":"2017-08-20","stage_classifiercode":"99-16","member_number":"TY73663","first_name":"JAY","last_name":"BUCKLEY","classification":"B","division":"PRODUCTION","hit_factor":5.7971},{"match_name":"Pima Pistol Club USPSA Match - May 29 ","match_date":"2016-05-29","stage_classifiercode":"99-16","member_number":"A80678","first_name":"LEX","last_name":"HOFFMAN","classification":"B","division":"PRODUCTION","hit_factor":5.7864},{"match_name":"Shongum December 2017 USPSA Match","match_date":"2017-12-02","stage_classifiercode":"99-16","member_number":"TY76045","first_name":"ELVIN","last_name":"ABORDO","classification":"B","division":"PRODUCTION","hit_factor":5.7851},{"match_name":"MvpNov2015","match_date":"2015-11-06","stage_classifiercode":"99-16","member_number":"A59215","first_name":"RUSS","last_name":"BAISLY","classification":"U","division":"PRODUCTION","hit_factor":5.7716},{"match_name":"DAP December 2015 Classifier match","match_date":"2015-12-12","stage_classifiercode":"99-16","member_number":"A87687","first_name":"FRANCIS","last_name":"FOO","classification":"C","division":"PRODUCTION","hit_factor":5.7623},{"match_name":"DWB - Deadwood Boys USPSA 20 May 2018","match_date":"2018-05-20","stage_classifiercode":"99-16","member_number":"TY102425","first_name":"JAY","last_name":"LIZO","classification":"D","division":"PRODUCTION","hit_factor":5.7537},{"match_name":"USPSA Bass River April 2017","match_date":"2017-04-02","stage_classifiercode":"99-16","member_number":"A91323","first_name":"DOUG","last_name":"FLAVIN","classification":"\"\"","division":"PRODUCTION","hit_factor":5.7522},{"match_name":"Cameo USPSA Match March 20 2021","match_date":"2021-03-20","stage_classifiercode":"99-16","member_number":"A131163","first_name":"KEVIN","last_name":"QUIAMBAO","classification":"U","division":"PRODUCTION","hit_factor":5.7522},{"match_name":"Shadow Hawk Defense USPSA Special Classifier","match_date":"2020-11-14","stage_classifiercode":"99-16","member_number":"A126306","first_name":"AARON","last_name":"KASZA","classification":"U","division":"PRODUCTION","hit_factor":5.7508},{"match_name":"AIPS Weekly USPSA 3 August 2021","match_date":"2021-08-03","stage_classifiercode":"99-16","member_number":"TY98867","first_name":"ASHTON","last_name":"TRENT","classification":"C","division":"PRODUCTION","hit_factor":5.7508},{"match_name":"PTPC May 7th USPSA Match","match_date":"2017-05-07","stage_classifiercode":"99-16","member_number":"FY89656","first_name":"RAY","last_name":"JEZEK","classification":"B","division":"PRODUCTION","hit_factor":5.7483},{"match_name":"PIPS 07-25-2018","match_date":"2018-07-25","stage_classifiercode":"99-16","member_number":"TY67266","first_name":"MARK","last_name":"SLETNER","classification":"C","division":"PRODUCTION","hit_factor":5.7426},{"match_name":"Shongum December 2017 USPSA Match","match_date":"2017-12-02","stage_classifiercode":"99-16","member_number":"A59977","first_name":"LARRY","last_name":"NELSON","classification":"B","division":"PRODUCTION","hit_factor":5.7203},{"match_name":"Rio Grande Practical Shooters - May 2018","match_date":"2018-05-05","stage_classifiercode":"99-16","member_number":"A89711","first_name":"JOHN","last_name":"MALLORY","classification":"C","division":"PRODUCTION","hit_factor":5.7201},{"match_name":"Shadow Hawk Defense USPSA Special Classifier","match_date":"2020-11-14","stage_classifiercode":"99-16","member_number":"A72518","first_name":"TONY","last_name":"OLIVEIRA","classification":"B","division":"PRODUCTION","hit_factor":5.6962},{"match_name":"Sharp Practical Shooters May USPSA Match","match_date":"2018-05-27","stage_classifiercode":"99-16","member_number":"A102801","first_name":"CHRISTOPHER","last_name":"HOWARD","classification":"U","division":"PRODUCTION","hit_factor":5.6944},{"match_name":"ARPC USPSA Match 3-26-17","match_date":"2017-03-26","stage_classifiercode":"99-16","member_number":"A95915","first_name":"WILLIAM","last_name":"BERKEMEIER","classification":"B","division":"PRODUCTION","hit_factor":5.694},{"match_name":"CCPS March 2018 USPSA","match_date":"2018-03-18","stage_classifiercode":"99-16","member_number":"\"\"","first_name":"ZANE","last_name":"WILLARD","classification":"U","division":"PRODUCTION","hit_factor":5.6754},{"match_name":"ARPC USPSA Match 7-26-20","match_date":"2020-07-26","stage_classifiercode":"99-16","member_number":"A89482","first_name":"JUICE","last_name":"REQUENA","classification":"C","division":"PRODUCTION","hit_factor":5.668},{"match_name":"Range E11even October 2017","match_date":"2017-10-28","stage_classifiercode":"99-16","member_number":"TY73390","first_name":"TUDOR","last_name":"STURZU","classification":"C","division":"PRODUCTION","hit_factor":5.6583},{"match_name":"Shongum April 2016 Pistol Match","match_date":"2016-04-02","stage_classifiercode":"99-16","member_number":"A60202","first_name":"JOE","last_name":"ILARDO","classification":"C","division":"PRODUCTION","hit_factor":5.653},{"match_name":"GCL Wed 5-31-17","match_date":"2017-05-31","stage_classifiercode":"99-16","member_number":"FY74975","first_name":"BILL","last_name":"STEGER","classification":"C","division":"PRODUCTION","hit_factor":5.653},{"match_name":"DWB - Deadwood Boys USPSA 20 May 2018","match_date":"2018-05-20","stage_classifiercode":"99-16","member_number":"A69709","first_name":"RAM","last_name":"ZAR","classification":"C","division":"PRODUCTION","hit_factor":5.6452},{"match_name":"TPS USPSA -  April 2018 Clone","match_date":"2018-04-08","stage_classifiercode":"99-16","member_number":"\"\"","first_name":"ERIC","last_name":"PERKINS","classification":"B","division":"PRODUCTION","hit_factor":5.6311},{"match_name":"USPSA Bass River April 2017","match_date":"2017-04-02","stage_classifiercode":"99-16","member_number":"TY81222","first_name":"MASON","last_name":"LANE","classification":"\"\"","division":"PRODUCTION","hit_factor":5.627},{"match_name":"LdF USPSA Match September 23 2017","match_date":"2017-09-23","stage_classifiercode":"99-16","member_number":"PENDING","first_name":"JOHNIE","last_name":"RANDLEAS","classification":"U","division":"PRODUCTION","hit_factor":5.6117},{"match_name":"Hernando Sportsmans Club","match_date":"2017-02-12","stage_classifiercode":"99-16","member_number":"\"\"","first_name":"DON","last_name":"MCINTYRE","classification":"\"\"","division":"PRODUCTION","hit_factor":5.6098},{"match_name":"APSC USPSA Match 1-6-18","match_date":"2018-01-06","stage_classifiercode":"99-16","member_number":"TY106803","first_name":"SHANE","last_name":"STREEPY","classification":"U","division":"PRODUCTION","hit_factor":5.6095},{"match_name":"CCPL 02-09-2020","match_date":"2020-02-09","stage_classifiercode":"99-16","member_number":"TY105155","first_name":"ALBERT","last_name":"COITO","classification":"B","division":"PRODUCTION","hit_factor":5.6034},{"match_name":"PTPC May 7th USPSA Match","match_date":"2017-05-07","stage_classifiercode":"99-16","member_number":"A99834","first_name":"DAVID","last_name":"CIECKO","classification":"A","division":"PRODUCTION","hit_factor":5.5954},{"match_name":"Hosemasters 2nd Sunday May 2017","match_date":"2017-05-14","stage_classifiercode":"99-16","member_number":"A61313","first_name":"BRETT","last_name":"BERG","classification":"M","division":"PRODUCTION","hit_factor":5.5932},{"match_name":"PCWC USPSA  1 28 17","match_date":"2017-01-28","stage_classifiercode":"99-16","member_number":"A69999","first_name":"JEFFREY","last_name":"TERRILL","classification":"B","division":"PRODUCTION","hit_factor":5.5874},{"match_name":"CCPL 02-09-2020","match_date":"2020-02-09","stage_classifiercode":"99-16","member_number":"FY103400","first_name":"SONNIE","last_name":"AVILA","classification":"B","division":"PRODUCTION","hit_factor":5.5843},{"match_name":"BSPSC 2018 August Special Classifier","match_date":"2018-08-12","stage_classifiercode":"99-16","member_number":"A107328","first_name":"IAN","last_name":"LICENCE","classification":"U","division":"PRODUCTION","hit_factor":5.5785},{"match_name":"ARPC USPSA Match 3-26-17","match_date":"2017-03-26","stage_classifiercode":"99-16","member_number":"A88932","first_name":"MARK","last_name":"LUTMAN","classification":"C","division":"PRODUCTION","hit_factor":5.5777},{"match_name":"Shongum April 2016 Pistol Match","match_date":"2016-04-02","stage_classifiercode":"99-16","member_number":"A94689","first_name":"RICH","last_name":"POSLUSZNY","classification":"U","division":"PRODUCTION","hit_factor":5.5769},{"match_name":"TPS USPSA -  April 2018 Clone","match_date":"2018-04-08","stage_classifiercode":"99-16","member_number":"a100154","first_name":"ANDAEW","last_name":"LAU","classification":"C","division":"PRODUCTION","hit_factor":5.5728},{"match_name":"ORSA USPSA August 2020","match_date":"2020-08-15","stage_classifiercode":"99-16","member_number":"A105249","first_name":"MARK","last_name":"MEFFORD","classification":"A","division":"PRODUCTION","hit_factor":5.5679},{"match_name":"Laser Ninja Dragon League MSA USPSA January 8th 2017","match_date":"2017-01-08","stage_classifiercode":"99-16","member_number":"A-99942","first_name":"JOHN","last_name":"MORRISON (PRODUCTION)","classification":"U","division":"PRODUCTION","hit_factor":5.5396},{"match_name":"PIPS 05-25-2016","match_date":"2016-05-24","stage_classifiercode":"99-16","member_number":"TY68444","first_name":"MONTE","last_name":"BRUESEWITZ","classification":"B","division":"PRODUCTION","hit_factor":5.5378},{"match_name":"Emmett March Match","match_date":"2016-03-25","stage_classifiercode":"99-16","member_number":"TY63273","first_name":"GREGG","last_name":"HARWOOD","classification":"C","division":"PRODUCTION","hit_factor":5.5371},{"match_name":"SWGC USPSA Pistol Match - December","match_date":"2016-12-03","stage_classifiercode":"99-16","member_number":"A69999","first_name":"JEFFREY","last_name":"TERRILL","classification":"C","division":"PRODUCTION","hit_factor":5.5363},{"match_name":"RCPS USPSA 12 Nov 2016","match_date":"2016-11-12","stage_classifiercode":"99-16","member_number":"A90642","first_name":"JESSE","last_name":"CHALEUNPHONE","classification":"U","division":"PRODUCTION","hit_factor":5.53},{"match_name":"Hosemasters 2nd Sunday May 2017","match_date":"2017-05-14","stage_classifiercode":"99-16","member_number":"\"\"","first_name":"JAKE","last_name":"ABRIL","classification":"U","division":"PRODUCTION","hit_factor":5.5215},{"match_name":"Cameo USPSA Match March 20 2021","match_date":"2021-03-20","stage_classifiercode":"99-16","member_number":"L4591","first_name":"WILLIAM","last_name":"HOLLENBECK","classification":"C","division":"PRODUCTION","hit_factor":5.5102},{"match_name":"SWGC USPSA Pistol Match - December","match_date":"2016-12-03","stage_classifiercode":"99-16","member_number":"a90147","first_name":"CRIS","last_name":"MERCALDO","classification":"C","division":"PRODUCTION","hit_factor":5.4968},{"match_name":"WLPS June 2017","match_date":"2017-06-25","stage_classifiercode":"99-16","member_number":"\"\"","first_name":"ALAN","last_name":"JOHNSON","classification":"U","division":"PRODUCTION","hit_factor":5.4622},{"match_name":"CCPL 2 Day Match 2018","match_date":"2018-04-26","stage_classifiercode":"99-16","member_number":"A79092","first_name":"RUSTY","last_name":"GERBER","classification":"B","division":"PRODUCTION","hit_factor":5.4591},{"match_name":"Superior Practical Shooters - March Match","match_date":"2017-03-01","stage_classifiercode":"99-16","member_number":"\"\"","first_name":"ROBERT","last_name":"HERRON","classification":"U","division":"PRODUCTION","hit_factor":5.4407},{"match_name":"Shadow Hawk Defense USPSA Special Classifier","match_date":"2020-11-14","stage_classifiercode":"99-16","member_number":"A128660","first_name":"BRIAN","last_name":"COSGRAY","classification":"U","division":"PRODUCTION","hit_factor":5.4397},{"match_name":"4ta Fecha USPSA","match_date":"2018-04-07","stage_classifiercode":"99-16","member_number":"F106795","first_name":"YED","last_name":"DOMINGUEZ-RIVERA","classification":"U","division":"PRODUCTION","hit_factor":5.4326},{"match_name":"Pima Pistol Club USPSA Match - May 29 ","match_date":"2016-05-29","stage_classifiercode":"99-16","member_number":"A53626","first_name":"DAVID","last_name":"KNIGHTON","classification":"\"\"","division":"PRODUCTION","hit_factor":5.4256},{"match_name":"ORSA USPSA August 2020","match_date":"2020-08-15","stage_classifiercode":"99-16","member_number":"A72343","first_name":"PAUL","last_name":"AVERY","classification":"B","division":"PRODUCTION","hit_factor":5.4223},{"match_name":"PIPS 05-25-2016","match_date":"2016-05-24","stage_classifiercode":"99-16","member_number":"A46789","first_name":"JERRY","last_name":"JOHNSON","classification":"B","division":"PRODUCTION","hit_factor":5.4005},{"match_name":"Maine Practical Shooters May 2017","match_date":"2017-05-13","stage_classifiercode":"99-16","member_number":"PEN","first_name":"CODEY","last_name":"FABIAN","classification":"\"\"","division":"PRODUCTION","hit_factor":5.3898},{"match_name":"SFPS 10-08-2017 USPSA match","match_date":"2017-10-08","stage_classifiercode":"99-16","member_number":"A101665","first_name":"THOMAS","last_name":"MCDAVITT","classification":"U","division":"PRODUCTION","hit_factor":5.3872},{"match_name":"DAP December 2015 Classifier match","match_date":"2015-12-12","stage_classifiercode":"99-16","member_number":"A84616","first_name":"MJ","last_name":"FINEZA","classification":"C","division":"PRODUCTION","hit_factor":5.3846},{"match_name":"ORSA USPSA July 2016 ","match_date":"2016-07-16","stage_classifiercode":"99-16","member_number":"A72343","first_name":"PAUL","last_name":"AVERY","classification":"B","division":"PRODUCTION","hit_factor":5.3775},{"match_name":"BSPSC 2018 August Special Classifier","match_date":"2018-08-12","stage_classifiercode":"99-16","member_number":"A101150","first_name":"BYRON","last_name":"WHITNEY","classification":"U","division":"PRODUCTION","hit_factor":5.3704},{"match_name":"BRSP Tuesday Night USPSA Match - June 5","match_date":"2018-06-06","stage_classifiercode":"99-16","member_number":"A110593","first_name":"RAY","last_name":"DELA ROSA","classification":"U","division":"PRODUCTION","hit_factor":5.3571},{"match_name":"Maine Practical Shooters May 2017","match_date":"2017-05-13","stage_classifiercode":"99-16","member_number":"TY89230","first_name":"SCOTT","last_name":"HOSSLER","classification":"D","division":"PRODUCTION","hit_factor":5.3555},{"match_name":"AIPS Weekly USPSA 3 August 2021","match_date":"2021-08-03","stage_classifiercode":"99-16","member_number":"A120534","first_name":"RYAN","last_name":"HOENICKE","classification":"D","division":"PRODUCTION","hit_factor":5.3537},{"match_name":"Shadow Hawk Defense USPSA Special Classifier","match_date":"2020-11-14","stage_classifiercode":"99-16","member_number":"TY91652","first_name":"KENT","last_name":"NORDSTROM","classification":"A","division":"PRODUCTION","hit_factor":5.3512},{"match_name":"Shadow Hawk Defense USPSA Special Classifier","match_date":"2020-11-14","stage_classifiercode":"99-16","member_number":"TY129039","first_name":"CONNOR","last_name":"WALSLEBEN","classification":"U","division":"PRODUCTION","hit_factor":5.3381},{"match_name":"Shongum April 2016 Pistol Match","match_date":"2016-04-02","stage_classifiercode":"99-16","member_number":"A76045","first_name":"ELVIN","last_name":"ABORDO","classification":"C","division":"PRODUCTION","hit_factor":5.3283},{"match_name":"Dundee USPSA Mar 2017","match_date":"2017-03-25","stage_classifiercode":"99-16","member_number":"A93052","first_name":"AREN","last_name":"GONZALEZ","classification":"B","division":"PRODUCTION","hit_factor":5.3283},{"match_name":"MPSA 101720 USPSA","match_date":"2020-10-17","stage_classifiercode":"99-16","member_number":"Pending","first_name":"BRADY","last_name":"MONTGOMERY","classification":"U","division":"PRODUCTION","hit_factor":5.3045},{"match_name":"MS06 Team Magnolia USPSA January Match2","match_date":"2016-01-03","stage_classifiercode":"99-16","member_number":"A74442","first_name":"GEORGE","last_name":"JONES JR","classification":"X","division":"PRODUCTION","hit_factor":5.3016},{"match_name":"CIPSC Havana July USPSA","match_date":"2018-07-07","stage_classifiercode":"99-16","member_number":"A101219","first_name":"CHAD","last_name":"ELLIOTT","classification":"B","division":"PRODUCTION","hit_factor":5.3012048192771},{"match_name":"LGCSEMPS September 2017 Handgun","match_date":"2017-09-10","stage_classifiercode":"99-16","member_number":"A69802","first_name":"PAMELA","last_name":"HASSELBACH","classification":"C","division":"PRODUCTION","hit_factor":5.283},{"match_name":"Shasta Shooters September 2016","match_date":"2016-09-10","stage_classifiercode":"99-16","member_number":"A-88368","first_name":"TOM","last_name":"FULLER","classification":"C","division":"PRODUCTION","hit_factor":5.283},{"match_name":"Shasta Shooters September 2016","match_date":"2016-09-10","stage_classifiercode":"99-16","member_number":"A95105","first_name":"DOUGLAS","last_name":"DALSKE","classification":"C","division":"PRODUCTION","hit_factor":5.278},{"match_name":"GCL Wed 5-31-17","match_date":"2017-05-31","stage_classifiercode":"99-16","member_number":"FY74975","first_name":"BILL","last_name":"STEGER","classification":"C","division":"PRODUCTION","hit_factor":5.2743},{"match_name":"DAP December 2015 Classifier match","match_date":"2015-12-12","stage_classifiercode":"99-16","member_number":"A88874","first_name":"JOHN","last_name":"BREGLIA","classification":"C","division":"PRODUCTION","hit_factor":5.2689},{"match_name":"2da Copa Nacional USPSA ","match_date":"2016-05-22","stage_classifiercode":"99-16","member_number":"A84044","first_name":"KATHIA","last_name":"RIVERA MELENDEZ","classification":"C","division":"PRODUCTION","hit_factor":5.2632},{"match_name":"ORSA USPSA July 2016 ","match_date":"2016-07-16","stage_classifiercode":"99-16","member_number":"A92869","first_name":"CSABA","last_name":"FOLDES","classification":"C","division":"PRODUCTION","hit_factor":5.2632},{"match_name":"SWGC USPSA Pistol Match - December","match_date":"2016-12-03","stage_classifiercode":"99-16","member_number":"A98731","first_name":"MATT","last_name":"GROMADZKI","classification":"U","division":"PRODUCTION","hit_factor":5.2632},{"match_name":"BSPSC 2018 August Special Classifier","match_date":"2018-08-12","stage_classifiercode":"99-16","member_number":"A109920","first_name":"TYLER","last_name":"WARREN","classification":"U","division":"PRODUCTION","hit_factor":5.2529},{"match_name":"FLPSA MN14 USPSA May 17 2018","match_date":"2018-05-17","stage_classifiercode":"99-16","member_number":"A103424","first_name":"ANDY","last_name":"COLLUMBIEN","classification":"U","division":"PRODUCTION","hit_factor":5.2521},{"match_name":"CCPL 02-09-2020","match_date":"2020-02-09","stage_classifiercode":"99-16","member_number":"A107307","first_name":"ALLAN","last_name":"ABREA","classification":"B","division":"PRODUCTION","hit_factor":5.2516},{"match_name":"LGCSEMPS September 2017 Handgun","match_date":"2017-09-10","stage_classifiercode":"99-16","member_number":"TY87402","first_name":"KEVIN","last_name":"KORCHMAROS","classification":"C","division":"PRODUCTION","hit_factor":5.2516},{"match_name":"GCL June 3-2017","match_date":"2017-06-03","stage_classifiercode":"99-16","member_number":"A101231","first_name":"MIKE","last_name":"TALBOT","classification":"U","division":"PRODUCTION","hit_factor":5.2439},{"match_name":"DAP December 2015 Classifier match","match_date":"2015-12-12","stage_classifiercode":"99-16","member_number":"A90099","first_name":"JOHN","last_name":"GOODWIN","classification":"C","division":"PRODUCTION","hit_factor":5.2411},{"match_name":"DAP December 2015 Classifier match","match_date":"2015-12-12","stage_classifiercode":"99-16","member_number":"A93975","first_name":"STEPAN","last_name":"GENERALOV","classification":"none","division":"PRODUCTION","hit_factor":5.2376},{"match_name":"Shadow Hawk Defense USPSA Special Classifier","match_date":"2020-11-14","stage_classifiercode":"99-16","member_number":"A123573","first_name":"JEFF","last_name":"BOSS","classification":"B","division":"PRODUCTION","hit_factor":5.2314},{"match_name":"ARPC USPSA Match 3-26-17","match_date":"2017-03-26","stage_classifiercode":"99-16","member_number":"PENDING","first_name":"DON","last_name":"MCDONALD","classification":"Unclassified","division":"PRODUCTION","hit_factor":5.2252},{"match_name":"GCL Wed 5-31-17","match_date":"2017-05-31","stage_classifiercode":"99-16","member_number":"TY72717","first_name":"TOM","last_name":"SCOTT","classification":"C","division":"PRODUCTION","hit_factor":5.2224},{"match_name":"LGCSEMPS September 2017 Handgun","match_date":"2017-09-10","stage_classifiercode":"99-16","member_number":"A103648","first_name":"JAMES","last_name":"RIVARD","classification":"U","division":"PRODUCTION","hit_factor":5.2209},{"match_name":"2da Copa Nacional USPSA ","match_date":"2016-05-22","stage_classifiercode":"99-16","member_number":"A90954","first_name":"ROBERTO","last_name":"MORALES","classification":"C","division":"PRODUCTION","hit_factor":5.2124},{"match_name":"ENPS March 2017 USPSA Match","match_date":"2017-03-05","stage_classifiercode":"99-16","member_number":"A90721","first_name":"BRANDON","last_name":"SCHULTZ","classification":"B","division":"PRODUCTION","hit_factor":5.2039},{"match_name":"PIPS 05-25-2016","match_date":"2016-05-24","stage_classifiercode":"99-16","member_number":"TY64933","first_name":"STEVEN","last_name":"TRI","classification":"C","division":"PRODUCTION","hit_factor":5.2009},{"match_name":"LCSC USPSA 01.14.18","match_date":"2018-01-13","stage_classifiercode":"99-16","member_number":"A89273","first_name":"STEPHEN","last_name":"BUONOCORE","classification":"B","division":"PRODUCTION","hit_factor":5.1948},{"match_name":"AIPS Weekly USPSA 3 August 2021","match_date":"2021-08-03","stage_classifiercode":"99-16","member_number":"TY68898","first_name":"MARSHALL","last_name":"LITTLE","classification":"B","division":"PRODUCTION","hit_factor":5.1867},{"match_name":"DWB - Deadwood Boys USPSA 20 May 2018","match_date":"2018-05-20","stage_classifiercode":"99-16","member_number":"FY103893","first_name":"CRAIG","last_name":"MOSLEY","classification":"C","division":"PRODUCTION","hit_factor":5.178},{"match_name":"CIPSC Havana July USPSA","match_date":"2018-07-07","stage_classifiercode":"99-16","member_number":"A110160","first_name":"MIKE","last_name":"SPANIER","classification":"C","division":"PRODUCTION","hit_factor":5.1674641148325},{"match_name":"SPSA USPSA December 1st Sat Match","match_date":"2016-12-03","stage_classifiercode":"99-16","member_number":"TY90030","first_name":"DAVID","last_name":"WASCHER","classification":"B","division":"PRODUCTION","hit_factor":5.1661},{"match_name":"MSSA Uspsa Club Matcg","match_date":"2017-09-24","stage_classifiercode":"99-16","member_number":"A102910","first_name":"BRENT","last_name":"ROSS","classification":"C","division":"PRODUCTION","hit_factor":5.1639},{"match_name":"CCPL 2 Day Match 2018","match_date":"2018-04-26","stage_classifiercode":"99-16","member_number":"A107396","first_name":"HUNTER","last_name":"WILLIAMSON","classification":"U","division":"PRODUCTION","hit_factor":5.16},{"match_name":"CRC_20160514_SuperClassifier","match_date":"2016-05-14","stage_classifiercode":"99-16","member_number":"A95263","first_name":"SIDA","last_name":"SHEN","classification":"C","division":"PRODUCTION","hit_factor":5.1565},{"match_name":"Sage Pistol League USPSA August 16 2020","match_date":"2020-08-16","stage_classifiercode":"99-16","member_number":"FY122346","first_name":"JASON","last_name":"WONG","classification":"C","division":"PRODUCTION","hit_factor":5.1374},{"match_name":"CRC_20160514_SuperClassifier","match_date":"2016-05-14","stage_classifiercode":"99-16","member_number":"A87980","first_name":"MICHAEL","last_name":"CROSBY","classification":"U","division":"PRODUCTION","hit_factor":5.1339},{"match_name":"ORSA USPSA July 2016 ","match_date":"2016-07-16","stage_classifiercode":"99-16","member_number":"TY21268","first_name":"MARK","last_name":"LEVY","classification":"B","division":"PRODUCTION","hit_factor":5.1337},{"match_name":"DAP December 2015 Classifier match","match_date":"2015-12-12","stage_classifiercode":"99-16","member_number":"TY69463","first_name":"LUKE","last_name":"HOLWAY","classification":"U","division":"PRODUCTION","hit_factor":5.122},{"match_name":"PIPS 07-25-2018","match_date":"2018-07-25","stage_classifiercode":"99-16","member_number":"A64866","first_name":"MICHAEL","last_name":"HAMILTON","classification":"B","division":"PRODUCTION","hit_factor":5.1111},{"match_name":"MVS ANPRACS Classifier Match 6/3/17","match_date":"2017-05-31","stage_classifiercode":"99-16","member_number":"A88816","first_name":"WILLIAM","last_name":"PEARCH","classification":"C","division":"PRODUCTION","hit_factor":5.102},{"match_name":"4ta Fecha USPSA","match_date":"2018-04-07","stage_classifiercode":"99-16","member_number":"A104070","first_name":"FELIX W.","last_name":"SOTO-CRUZ","classification":"D","division":"PRODUCTION","hit_factor":5.0885},{"match_name":"USPSA MO21 Special Classifier 2Alpha SBRC February 27 2021","match_date":"2021-02-27","stage_classifiercode":"99-16","member_number":"L4301","first_name":"LARRY","last_name":"NELSON","classification":"C","division":"PRODUCTION","hit_factor":5.0881},{"match_name":"Pelham USPSA 2017-08-20","match_date":"2017-08-20","stage_classifiercode":"99-16","member_number":"A101134","first_name":"RICH","last_name":"ENGLISH","classification":"C","division":"PRODUCTION","hit_factor":5.0863},{"match_name":"BSPSC 2018 August Special Classifier","match_date":"2018-08-12","stage_classifiercode":"99-16","member_number":"A109180","first_name":"PATRICK","last_name":"FUREY","classification":"U","division":"PRODUCTION","hit_factor":5.0847},{"match_name":"ENPS March 2017 USPSA Match","match_date":"2017-03-05","stage_classifiercode":"99-16","member_number":"A76775","first_name":"JERRY","last_name":"BORZOBOHATY","classification":"A","division":"PRODUCTION","hit_factor":5.0725},{"match_name":"LdF USPSA Match September 23 2017","match_date":"2017-09-23","stage_classifiercode":"99-16","member_number":"A82644","first_name":"CHRIS","last_name":"FUNG","classification":"B","division":"PRODUCTION","hit_factor":5.0691},{"match_name":"SRAPS Amarillo Action May","match_date":"2016-05-28","stage_classifiercode":"99-16","member_number":"A89689","first_name":"TRENTON","last_name":"GRANT","classification":"U","division":"PRODUCTION","hit_factor":5.0587},{"match_name":"GCL June 3-2017","match_date":"2017-06-03","stage_classifiercode":"99-16","member_number":"TY95151","first_name":"GARY","last_name":"GLEASON","classification":"D","division":"PRODUCTION","hit_factor":5.0548},{"match_name":"PCWC USPSA  1 28 17","match_date":"2017-01-28","stage_classifiercode":"99-16","member_number":"A98348","first_name":"RYAN","last_name":"STEWART","classification":"U","division":"PRODUCTION","hit_factor":5.0496},{"match_name":"CRC_20160514_SuperClassifier","match_date":"2016-05-14","stage_classifiercode":"99-16","member_number":"TY88146","first_name":"RON","last_name":"ROSE","classification":"U","division":"PRODUCTION","hit_factor":5.045},{"match_name":"Shadow Hawk Defense USPSA Special Classifier","match_date":"2020-11-14","stage_classifiercode":"99-16","member_number":"TY107272","first_name":"BRAD","last_name":"FAAS","classification":"C","division":"PRODUCTION","hit_factor":5.0367},{"match_name":"LGCSEMPS September 2017 Handgun","match_date":"2017-09-10","stage_classifiercode":"99-16","member_number":"A104523","first_name":"TONY","last_name":"SNOW","classification":"U","division":"PRODUCTION","hit_factor":5.0304},{"match_name":"SPSA USPSA December 1st Sat Match","match_date":"2016-12-03","stage_classifiercode":"99-16","member_number":"A75957","first_name":"CHUCK","last_name":"SMITH","classification":"B","division":"PRODUCTION","hit_factor":5.029},{"match_name":"MS06 Team Magnolia USPSA January Match2","match_date":"2016-01-03","stage_classifiercode":"99-16","member_number":"A64151","first_name":"DON","last_name":"GRANIER","classification":"U","division":"PRODUCTION","hit_factor":5.0272},{"match_name":"OK15 USPSA at USSA","match_date":"2016-12-11","stage_classifiercode":"99-16","member_number":"a96307","first_name":"JONATHAN","last_name":"FEERO","classification":"B","division":"PRODUCTION","hit_factor":5.0251},{"match_name":"4ta Fecha USPSA","match_date":"2018-04-07","stage_classifiercode":"99-16","member_number":"TY97157","first_name":"REBECCA","last_name":"AGUIRRE-HERNANDEZ","classification":"D","division":"PRODUCTION","hit_factor":5.0193},{"match_name":"Briar Rabbit  June Match 2016 OH 20","match_date":"2016-06-12","stage_classifiercode":"99-16","member_number":"A76425","first_name":"DAN","last_name":"COX","classification":"B","division":"PRODUCTION","hit_factor":5.005},{"match_name":"Pinetucky USPSA 02-27-16","match_date":"2016-02-27","stage_classifiercode":"99-16","member_number":"TY60619","first_name":"JESUS","last_name":"HERNANDEZ","classification":"U","division":"PRODUCTION","hit_factor":4.9911},{"match_name":"OK15 USPSA at USSA","match_date":"2016-12-11","stage_classifiercode":"99-16","member_number":"\"\"","first_name":"STEPHEN","last_name":"YOUNG","classification":"\"\"","division":"PRODUCTION","hit_factor":4.9908},{"match_name":"SWGC USPSA Pistol Match - December","match_date":"2016-12-03","stage_classifiercode":"99-16","member_number":"A84632","first_name":"KEN","last_name":"HAYES","classification":"C","division":"PRODUCTION","hit_factor":4.9751},{"match_name":"Hernando Sportsmans Club","match_date":"2017-02-12","stage_classifiercode":"99-16","member_number":"A68677","first_name":"BILL","last_name":"TRABULSI","classification":"C","division":"PRODUCTION","hit_factor":4.9745},{"match_name":"Sharp Practical Shooters May USPSA Match","match_date":"2018-05-27","stage_classifiercode":"99-16","member_number":"A72053","first_name":"DAVE","last_name":"ZELLMER","classification":"C","division":"PRODUCTION","hit_factor":4.9689},{"match_name":"Hosemasters 2nd Sunday May 2017","match_date":"2017-05-14","stage_classifiercode":"99-16","member_number":"TY65813","first_name":"JOE","last_name":"HANNIS","classification":"C","division":"PRODUCTION","hit_factor":4.9661},{"match_name":"Flagstaff Fun Shoot September 15 2018","match_date":"2018-09-15","stage_classifiercode":"99-16","member_number":"A109264","first_name":"TREVOR","last_name":"SARKOZY","classification":"\"\"","division":"PRODUCTION","hit_factor":4.9603},{"match_name":"Pelham USPSA 2017-08-20","match_date":"2017-08-20","stage_classifiercode":"99-16","member_number":"TY91771","first_name":"JOHN","last_name":"PARKER","classification":"C","division":"PRODUCTION","hit_factor":4.9571},{"match_name":"LGCSEMPS September 2017 Handgun","match_date":"2017-09-10","stage_classifiercode":"99-16","member_number":"TY95962","first_name":"KEVIN","last_name":"DEHL","classification":"C","division":"PRODUCTION","hit_factor":4.9477},{"match_name":"Rio Grande Practical Shooters - May 2018","match_date":"2018-05-05","stage_classifiercode":"99-16","member_number":"A60995","first_name":"KYLE","last_name":"KEY","classification":"C","division":"PRODUCTION","hit_factor":4.9446},{"match_name":"Shadow Hawk Defense USPSA Special Classifier","match_date":"2020-11-14","stage_classifiercode":"99-16","member_number":"L4686","first_name":"RANDY","last_name":"WEEKLEY","classification":"C","division":"PRODUCTION","hit_factor":4.9383},{"match_name":"BSPSC 2018 August Special Classifier","match_date":"2018-08-12","stage_classifiercode":"99-16","member_number":"A35678","first_name":"RUSS","last_name":"MCELYEA","classification":"C","division":"PRODUCTION","hit_factor":4.9278},{"match_name":"Shongum April 2016 Pistol Match","match_date":"2016-04-02","stage_classifiercode":"99-16","member_number":"TY82166","first_name":"HOWARD","last_name":"SCHOENBERGER","classification":"C","division":"PRODUCTION","hit_factor":4.9242},{"match_name":"4ta Fecha USPSA","match_date":"2018-04-07","stage_classifiercode":"99-16","member_number":"A84044","first_name":"KATHIA","last_name":"RIVERA-MELENDEZ","classification":"C","division":"PRODUCTION","hit_factor":4.9217},{"match_name":"FLPSA MN14 USPSA May 17 2018","match_date":"2018-05-17","stage_classifiercode":"99-16","member_number":"A99862","first_name":"RYAN","last_name":"CARLSON","classification":"B","division":"PRODUCTION","hit_factor":4.918},{"match_name":"APSC USPSA Match 1-6-18","match_date":"2018-01-06","stage_classifiercode":"99-16","member_number":"A82746","first_name":"JOHN","last_name":"AUSTRIA","classification":"B","division":"PRODUCTION","hit_factor":4.918},{"match_name":"Shadow Hawk Defense USPSA Special Classifier","match_date":"2020-11-14","stage_classifiercode":"99-16","member_number":"L4686","first_name":"RANDY","last_name":"WEEKLEY","classification":"C","division":"PRODUCTION","hit_factor":4.9166},{"match_name":"RCPS USPSA 12 Nov 2016","match_date":"2016-11-12","stage_classifiercode":"99-16","member_number":"A88203","first_name":"PAT","last_name":"HOWELL","classification":"C","division":"PRODUCTION","hit_factor":4.9149},{"match_name":"PIPS 05-25-2016","match_date":"2016-05-24","stage_classifiercode":"99-16","member_number":"A92523","first_name":"ALLAN","last_name":"JOHNSON","classification":"D","division":"PRODUCTION","hit_factor":4.914},{"match_name":"SRAPS Amarillo Action May","match_date":"2016-05-28","stage_classifiercode":"99-16","member_number":"TY70557","first_name":"GARY","last_name":"WATSON","classification":"B","division":"PRODUCTION","hit_factor":4.9091},{"match_name":"LCSC USPSA 01.14.18","match_date":"2018-01-13","stage_classifiercode":"99-16","member_number":"A74452","first_name":"THEO","last_name":"ARJONA","classification":"B","division":"PRODUCTION","hit_factor":4.9057},{"match_name":"ENPS March 2017 USPSA Match","match_date":"2017-03-05","stage_classifiercode":"99-16","member_number":"A79735","first_name":"ALEXANDER","last_name":"GAC","classification":"A","division":"PRODUCTION","hit_factor":4.9043},{"match_name":"CIPSC Havana July USPSA","match_date":"2018-07-07","stage_classifiercode":"99-16","member_number":"A105910","first_name":"JEFF","last_name":"HOECKER","classification":"C","division":"PRODUCTION","hit_factor":4.8936170212766},{"match_name":"Pima Pistol Club USPSA Match - May 29 ","match_date":"2016-05-29","stage_classifiercode":"99-16","member_number":"FY2823","first_name":"JOHN","last_name":"FRANCE","classification":"M","division":"PRODUCTION","hit_factor":4.8934},{"match_name":"CRC_20160514_SuperClassifier","match_date":"2016-05-14","stage_classifiercode":"99-16","member_number":"a82991","first_name":"DANIEL","last_name":"PUGLIESE","classification":"D","division":"PRODUCTION","hit_factor":4.8918},{"match_name":"NCPL 2016 July","match_date":"2016-07-31","stage_classifiercode":"99-16","member_number":"A15252","first_name":"BOB","last_name":"SAYLOR","classification":"A","division":"PRODUCTION","hit_factor":4.8904},{"match_name":"SFPS 10-08-2017 USPSA match","match_date":"2017-10-08","stage_classifiercode":"99-16","member_number":"TY90733","first_name":"ROBERT","last_name":"OLSON","classification":"C","division":"PRODUCTION","hit_factor":4.878},{"match_name":"SFA USPSA March 2017","match_date":"2017-03-18","stage_classifiercode":"99-16","member_number":"A95766","first_name":"DAVID","last_name":"JUN","classification":"B","division":"PRODUCTION","hit_factor":4.8751},{"match_name":"DWB - Deadwood Boys USPSA 20 May 2018","match_date":"2018-05-20","stage_classifiercode":"99-16","member_number":"TY95244","first_name":"ALEX","last_name":"KO","classification":"B","division":"PRODUCTION","hit_factor":4.875},{"match_name":"ARPC USPSA Match 3-26-17","match_date":"2017-03-26","stage_classifiercode":"99-16","member_number":"A93146","first_name":"DAVE","last_name":"ROSEN","classification":"C","division":"PRODUCTION","hit_factor":4.8731},{"match_name":"MS06 Team Magnolia USPSA January Match2","match_date":"2016-01-03","stage_classifiercode":"99-16","member_number":"TY71066","first_name":"LARRY","last_name":"GOLDSTEIN","classification":"C","division":"PRODUCTION","hit_factor":4.8626},{"match_name":"Shasta Shooters September 2016","match_date":"2016-09-10","stage_classifiercode":"99-16","member_number":"A-95027","first_name":"ZAC","last_name":"MCMORDIE","classification":"C","division":"PRODUCTION","hit_factor":4.8591},{"match_name":"MS06 Team Magnolia USPSA January Match2","match_date":"2016-01-03","stage_classifiercode":"99-16","member_number":"TY88702","first_name":"ARCHIE","last_name":"NICHOLS","classification":"C","division":"PRODUCTION","hit_factor":4.8417},{"match_name":"APSC USPSA Match 1-6-18","match_date":"2018-01-06","stage_classifiercode":"99-16","member_number":"A105318","first_name":"JOHN","last_name":"VOSS","classification":"U","division":"PRODUCTION","hit_factor":4.8319},{"match_name":"ENPS March 2017 USPSA Match","match_date":"2017-03-05","stage_classifiercode":"99-16","member_number":"A68385","first_name":"SEAN","last_name":"GEWECKE","classification":"C","division":"PRODUCTION","hit_factor":4.8246},{"match_name":"PCWC USPSA  1 28 17","match_date":"2017-01-28","stage_classifiercode":"99-16","member_number":"TY71997","first_name":"JIMMIE","last_name":"HONEYCUTT","classification":"C","division":"PRODUCTION","hit_factor":4.8237},{"match_name":"APSC USPSA Match 1-6-18","match_date":"2018-01-06","stage_classifiercode":"99-16","member_number":"\"\"","first_name":"THOMAS","last_name":"DOERING","classification":"U","division":"PRODUCTION","hit_factor":4.8133},{"match_name":"Shongum April 2016 Pistol Match","match_date":"2016-04-02","stage_classifiercode":"99-16","member_number":"L2421","first_name":"GEORGE","last_name":"JONES","classification":"A","division":"PRODUCTION","hit_factor":4.797},{"match_name":"LCSC USPSA 01.14.18","match_date":"2018-01-13","stage_classifiercode":"99-16","member_number":"TY106051","first_name":"BOB","last_name":"SLABAUGH","classification":"U","division":"PRODUCTION","hit_factor":4.7952},{"match_name":"BSPSC 2018 August Special Classifier","match_date":"2018-08-12","stage_classifiercode":"99-16","member_number":"TY89426","first_name":"LARRY","last_name":"SCUSA","classification":"C","division":"PRODUCTION","hit_factor":4.7926},{"match_name":"ARPC USPSA Match 3-26-17","match_date":"2017-03-26","stage_classifiercode":"99-16","member_number":"TY84534","first_name":"DENNIS","last_name":"LAWRENCE","classification":"C","division":"PRODUCTION","hit_factor":4.7838},{"match_name":"USPSA MO21 Special Classifier 2Alpha SBRC February 27 2021","match_date":"2021-02-27","stage_classifiercode":"99-16","member_number":"A124984","first_name":"DARIN","last_name":"ANDREWS","classification":"C","division":"PRODUCTION","hit_factor":4.7815},{"match_name":"GCL Wed 5-31-17","match_date":"2017-05-31","stage_classifiercode":"99-16","member_number":"A85329","first_name":"JIM","last_name":"BROWNE","classification":"C","division":"PRODUCTION","hit_factor":4.775},{"match_name":"Sharp Practical Shooters May USPSA Match","match_date":"2018-05-27","stage_classifiercode":"99-16","member_number":"TY-95955","first_name":"TOM","last_name":"LEACHMAN","classification":"C","division":"PRODUCTION","hit_factor":4.7672},{"match_name":"Pelham USPSA 2017-08-20","match_date":"2017-08-20","stage_classifiercode":"99-16","member_number":"A103818","first_name":"BRAD","last_name":"BOUCHARD","classification":"U","division":"PRODUCTION","hit_factor":4.7619},{"match_name":"SPSA USPSA December 1st Sat Match","match_date":"2016-12-03","stage_classifiercode":"99-16","member_number":"TY85974","first_name":"JIM","last_name":"BASCIO","classification":"A","division":"PRODUCTION","hit_factor":4.7619},{"match_name":"4ta Fecha USPSA","match_date":"2018-04-07","stage_classifiercode":"99-16","member_number":"L4385","first_name":"JOSE R","last_name":"FUENTES-RODRIGUEZ","classification":"C","division":"PRODUCTION","hit_factor":4.7458},{"match_name":"BSPSC 2018 August Special Classifier","match_date":"2018-08-12","stage_classifiercode":"99-16","member_number":"A97228","first_name":"DYLAN","last_name":"NORDELL","classification":"U","division":"PRODUCTION","hit_factor":4.7431},{"match_name":"Laser Ninja Dragon League MSA USPSA January 8th 2017","match_date":"2017-01-08","stage_classifiercode":"99-16","member_number":"NA","first_name":"MATTHEW","last_name":"ST. PIERRE","classification":"C","division":"PRODUCTION","hit_factor":4.7327},{"match_name":"PCWC USPSA  1 28 17","match_date":"2017-01-28","stage_classifiercode":"99-16","member_number":"fy35860","first_name":"JOE","last_name":"SEUK","classification":"A","division":"PRODUCTION","hit_factor":4.7325},{"match_name":"SPSA USPSA July 4th Sat match","match_date":"2018-07-28","stage_classifiercode":"99-16","member_number":"\"\"","first_name":"JOSH","last_name":"CERETON","classification":"U","division":"PRODUCTION","hit_factor":4.7244},{"match_name":"Shongum April 2016 Pistol Match","match_date":"2016-04-02","stage_classifiercode":"99-16","member_number":"TY78830","first_name":"SEAN","last_name":"COLE","classification":"C","division":"PRODUCTION","hit_factor":4.7214},{"match_name":"ENPS March 2017 USPSA Match","match_date":"2017-03-05","stage_classifiercode":"99-16","member_number":"A96780","first_name":"JAREL","last_name":"JENSEN","classification":"D","division":"PRODUCTION","hit_factor":4.7214},{"match_name":"ENPS March 2017 USPSA Match","match_date":"2017-03-05","stage_classifiercode":"99-16","member_number":"TY95674","first_name":"JESS","last_name":"ASCHE","classification":"C","division":"PRODUCTION","hit_factor":4.7059},{"match_name":"West Liberty USPSA Oct 2018","match_date":"2018-10-28","stage_classifiercode":"99-16","member_number":"A100066","first_name":"LANE","last_name":"JENSEN","classification":"C","division":"PRODUCTION","hit_factor":4.6931},{"match_name":"Grandbaggers 07/2017","match_date":"2017-07-06","stage_classifiercode":"99-16","member_number":"TY80622","first_name":"BRADLEY","last_name":"KITCHIN","classification":"B","division":"PRODUCTION","hit_factor":4.6931},{"match_name":"March 2016 USPSA Ponca CityMatch","match_date":"2016-03-12","stage_classifiercode":"99-16","member_number":"A87987","first_name":"AARON","last_name":"BUCHANON","classification":"C","division":"PRODUCTION","hit_factor":4.6843},{"match_name":"MS06 Team Magnolia USPSA January Match2","match_date":"2016-01-03","stage_classifiercode":"99-16","member_number":"A73527","first_name":"STEPHEN","last_name":"SANDRIDGE","classification":"C","division":"PRODUCTION","hit_factor":4.6759},{"match_name":"CCPL 2 Day Match 2018","match_date":"2018-04-26","stage_classifiercode":"99-16","member_number":"A91168","first_name":"DEREK","last_name":"LIU","classification":"C","division":"PRODUCTION","hit_factor":4.6745},{"match_name":"Hosemasters 2nd Sunday May 2017","match_date":"2017-05-14","stage_classifiercode":"99-16","member_number":"TY60458","first_name":"JOHN","last_name":"CATALANO","classification":"B","division":"PRODUCTION","hit_factor":4.6713},{"match_name":"LCSC USPSA 01.14.18","match_date":"2018-01-13","stage_classifiercode":"99-16","member_number":"A91168","first_name":"DEREK","last_name":"LIU","classification":"C","division":"PRODUCTION","hit_factor":4.6679},{"match_name":"USPSA MO21 Special Classifier 2Alpha SBRC February 27 2021","match_date":"2021-02-27","stage_classifiercode":"99-16","member_number":"A113404","first_name":"BRIAN","last_name":"STANEK","classification":"C","division":"PRODUCTION","hit_factor":4.6598},{"match_name":"ORSA USPSA July 2016 ","match_date":"2016-07-16","stage_classifiercode":"99-16","member_number":"A63387","first_name":"FRANK","last_name":"CASTIGLIA","classification":"B","division":"PRODUCTION","hit_factor":4.6592},{"match_name":"4ta Fecha USPSA","match_date":"2018-04-07","stage_classifiercode":"99-16","member_number":"A104070","first_name":"FELIX W.","last_name":"SOTO-CRUZ","classification":"D","division":"PRODUCTION","hit_factor":4.6553},{"match_name":"Maine Practical Shooters May 2017","match_date":"2017-05-13","stage_classifiercode":"99-16","member_number":"A86762","first_name":"NATE","last_name":"LAKE","classification":"B","division":"PRODUCTION","hit_factor":4.6541},{"match_name":"PCWC USPSA  1 28 17","match_date":"2017-01-28","stage_classifiercode":"99-16","member_number":"A90289","first_name":"ARIEL","last_name":"DELA FUENTE","classification":"B","division":"PRODUCTION","hit_factor":4.6512},{"match_name":"Range E11even October 2017","match_date":"2017-10-28","stage_classifiercode":"99-16","member_number":"L2456","first_name":"RHETT","last_name":"TOLER","classification":"B","division":"PRODUCTION","hit_factor":4.6512},{"match_name":"Shongum December 2017 USPSA Match","match_date":"2017-12-02","stage_classifiercode":"99-16","member_number":"TY83306","first_name":"ZACK","last_name":"BECKER","classification":"B","division":"PRODUCTION","hit_factor":4.647},{"match_name":"GCL June 3-2017","match_date":"2017-06-03","stage_classifiercode":"99-16","member_number":"TY72717","first_name":"THOMAS","last_name":"SCOTT","classification":"C","division":"PRODUCTION","hit_factor":4.644},{"match_name":"CRC_20160514_SuperClassifier","match_date":"2016-05-14","stage_classifiercode":"99-16","member_number":"A84725","first_name":"CHRIS","last_name":"BELL","classification":"C","division":"PRODUCTION","hit_factor":4.6436},{"match_name":"Shongum December 2017 USPSA Match","match_date":"2017-12-02","stage_classifiercode":"99-16","member_number":"TY98581","first_name":"CHRIS","last_name":"SENDELSKY","classification":"U","division":"PRODUCTION","hit_factor":4.6419},{"match_name":"CCPS March 2018 USPSA","match_date":"2018-03-18","stage_classifiercode":"99-16","member_number":"\"\"","first_name":"CARY","last_name":"BROSA","classification":"U","division":"PRODUCTION","hit_factor":4.6263},{"match_name":"BSPSC 2018 August Special Classifier","match_date":"2018-08-12","stage_classifiercode":"99-16","member_number":"A97595","first_name":"K J","last_name":"KAHNLE","classification":"C","division":"PRODUCTION","hit_factor":4.6181},{"match_name":"LCSC USPSA 01.14.18","match_date":"2018-01-13","stage_classifiercode":"99-16","member_number":"A107140","first_name":"ROWELL","last_name":"FERRER","classification":"U","division":"PRODUCTION","hit_factor":4.6099},{"match_name":"MCPSL Pistol 10-9-2021","match_date":"2021-10-09","stage_classifiercode":"99-16","member_number":"A126099","first_name":"JESSE","last_name":"LOEWEN","classification":"C","division":"PRODUCTION","hit_factor":4.5855},{"match_name":"5 August - USPSA match - 17 South PSC","match_date":"2017-08-05","stage_classifiercode":"99-16","member_number":"a94094","first_name":"JOSHUA","last_name":"OKINS","classification":"B","division":"PRODUCTION","hit_factor":4.5714},{"match_name":"DAP December 2015 Classifier match","match_date":"2015-12-12","stage_classifiercode":"99-16","member_number":"A67001","first_name":"KENT","last_name":"HIGGINBOTHAM","classification":"M","division":"PRODUCTION","hit_factor":4.5708},{"match_name":"RCPS USPSA 12 Nov 2016","match_date":"2016-11-12","stage_classifiercode":"99-16","member_number":"A91833","first_name":"GREG","last_name":"DEAN","classification":"C","division":"PRODUCTION","hit_factor":4.5608},{"match_name":"2da Copa Nacional USPSA ","match_date":"2016-05-22","stage_classifiercode":"99-16","member_number":"F88166","first_name":"JOSE","last_name":"NAZARIO","classification":"U","division":"PRODUCTION","hit_factor":4.5584},{"match_name":"ShooT GTR USPSA 1/1/17","match_date":"2017-01-01","stage_classifiercode":"99-16","member_number":"PEN","first_name":"CHRIS","last_name":"LANE","classification":"U","division":"PRODUCTION","hit_factor":4.5562},{"match_name":"PCWC USPSA  1 28 17","match_date":"2017-01-28","stage_classifiercode":"99-16","member_number":"A23656","first_name":"RAY","last_name":"WELLS","classification":"A","division":"PRODUCTION","hit_factor":4.5419},{"match_name":"RBGC 2017-10-21","match_date":"2017-10-21","stage_classifiercode":"99-16","member_number":"A83594","first_name":"TIM","last_name":"BOWDEN","classification":"C","division":"PRODUCTION","hit_factor":4.5407},{"match_name":"Shongum April 2016 Pistol Match","match_date":"2016-04-02","stage_classifiercode":"99-16","member_number":"A91953","first_name":"SCOTT","last_name":"SINGERLINE","classification":"U","division":"PRODUCTION","hit_factor":4.5386},{"match_name":"March 2016 USPSA Ponca CityMatch","match_date":"2016-03-12","stage_classifiercode":"99-16","member_number":"A55330","first_name":"DOUGLAS","last_name":"STOVER","classification":"U","division":"PRODUCTION","hit_factor":4.5296},{"match_name":"ORSA USPSA July 2016 ","match_date":"2016-07-16","stage_classifiercode":"99-16","member_number":"A92207","first_name":"TONY","last_name":"JONES","classification":"C","division":"PRODUCTION","hit_factor":4.5249},{"match_name":"TPS USPSA -  January 2017 - Talon Range","match_date":"2017-01-07","stage_classifiercode":"99-16","member_number":"A99139","first_name":"BEN","last_name":"THOMPSON","classification":"U","division":"PRODUCTION","hit_factor":4.5204},{"match_name":"FLPSA MN14 USPSA May 17 2018","match_date":"2018-05-17","stage_classifiercode":"99-16","member_number":"A110693","first_name":"ALEXANDER","last_name":"ABFALTER","classification":"U","division":"PRODUCTION","hit_factor":4.5168},{"match_name":"GCL June 3-2017","match_date":"2017-06-03","stage_classifiercode":"99-16","member_number":"FY74975","first_name":"BILL","last_name":"STEGER","classification":"C","division":"PRODUCTION","hit_factor":4.5131},{"match_name":"OREGON ARPC CC05 USPSA Jan 14 2017","match_date":"2017-01-14","stage_classifiercode":"99-16","member_number":"A67001","first_name":"KENT","last_name":"HIGGINBOTHAM","classification":"M","division":"PRODUCTION","hit_factor":4.4931},{"match_name":"ENPS March 2017 USPSA Match","match_date":"2017-03-05","stage_classifiercode":"99-16","member_number":"TY76958","first_name":"GREG","last_name":"LAMB","classification":"B","division":"PRODUCTION","hit_factor":4.4818},{"match_name":"USPSA MO21 Special Classifier 2Alpha SBRC February 27 2021","match_date":"2021-02-27","stage_classifiercode":"99-16","member_number":"TY108307","first_name":"PATRICK","last_name":"MOYNA","classification":"U","division":"PRODUCTION","hit_factor":4.48},{"match_name":"TPS USPSA -  January 2017 - Talon Range","match_date":"2017-01-07","stage_classifiercode":"99-16","member_number":"A97416","first_name":"BOB","last_name":"PERKINS","classification":"C","division":"PRODUCTION","hit_factor":4.4789},{"match_name":"Superior Practical Shooters - March Match","match_date":"2017-03-01","stage_classifiercode":"99-16","member_number":"A-99905","first_name":"MICHAEL","last_name":"VIVLEMORE","classification":"U","division":"PRODUCTION","hit_factor":4.4788},{"match_name":"2da Copa Nacional USPSA ","match_date":"2016-05-22","stage_classifiercode":"99-16","member_number":"A89226","first_name":"MJ","last_name":"BRENES","classification":"B","division":"PRODUCTION","hit_factor":4.4763},{"match_name":"MS06 Team Magnolia USPSA January Match2","match_date":"2016-01-03","stage_classifiercode":"99-16","member_number":"A88662","first_name":"KEVIN","last_name":"STILL","classification":"U","division":"PRODUCTION","hit_factor":4.4763},{"match_name":"4ta Fecha USPSA","match_date":"2018-04-07","stage_classifiercode":"99-16","member_number":"TY75659","first_name":"PABLO","last_name":"VENEGAS COLON","classification":"C","division":"PRODUCTION","hit_factor":4.4732},{"match_name":"DWB - Deadwood Boys USPSA 20 May 2018","match_date":"2018-05-20","stage_classifiercode":"99-16","member_number":"FY82995","first_name":"JEFFREY","last_name":"HUNT","classification":"B","division":"PRODUCTION","hit_factor":4.4571},{"match_name":"APSC USPSA Match 1-6-18","match_date":"2018-01-06","stage_classifiercode":"99-16","member_number":"A104422","first_name":"ALEXANDER","last_name":"ACOSTA","classification":"C","division":"PRODUCTION","hit_factor":4.4571},{"match_name":"OREGON ARPC CC05 USPSA Jan 14 2017","match_date":"2017-01-14","stage_classifiercode":"99-16","member_number":"TY78052","first_name":"SERGE","last_name":"DAVIS","classification":"A","division":"PRODUCTION","hit_factor":4.4534},{"match_name":"Shongum December 2017 USPSA Match","match_date":"2017-12-02","stage_classifiercode":"99-16","member_number":"A106369","first_name":"EDD","last_name":"DYKSHOORN","classification":"U","division":"PRODUCTION","hit_factor":4.4521},{"match_name":"Shongum December 2017 USPSA Match","match_date":"2017-12-02","stage_classifiercode":"99-16","member_number":"FY74078","first_name":"JAMES","last_name":"GRASSI","classification":"U","division":"PRODUCTION","hit_factor":4.4482},{"match_name":"DAP December 2015 Classifier match","match_date":"2015-12-12","stage_classifiercode":"99-16","member_number":"A84617","first_name":"MIKE","last_name":"FINEZA","classification":"C","division":"PRODUCTION","hit_factor":4.4444},{"match_name":"CRC_20160514_SuperClassifier","match_date":"2016-05-14","stage_classifiercode":"99-16","member_number":"TY89758","first_name":"JOE","last_name":"LUCIANO","classification":"U","division":"PRODUCTION","hit_factor":4.4372},{"match_name":"Shasta Shooters 2020 Dec","match_date":"2020-12-12","stage_classifiercode":"99-16","member_number":"A130544","first_name":"JAY","last_name":"MARKUS","classification":"U","division":"PRODUCTION","hit_factor":4.4372},{"match_name":"TPS USPSA -  April 2018 Clone","match_date":"2018-04-08","stage_classifiercode":"99-16","member_number":"a106226","first_name":"ZACHARY","last_name":"BERLINGHOFF","classification":"U","division":"PRODUCTION","hit_factor":4.4362},{"match_name":"ENPS March 2017 USPSA Match","match_date":"2017-03-05","stage_classifiercode":"99-16","member_number":"A98101","first_name":"MATTHEW","last_name":"GARRED","classification":"U","division":"PRODUCTION","hit_factor":4.4331},{"match_name":"Shadow Hawk Defense USPSA Special Classifier","match_date":"2020-11-14","stage_classifiercode":"99-16","member_number":"TY73589","first_name":"RANDY","last_name":"WOLFORD","classification":"D","division":"PRODUCTION","hit_factor":4.403},{"match_name":"MvpNov2015","match_date":"2015-11-06","stage_classifiercode":"99-16","member_number":"\"\"","first_name":"PAT","last_name":"DOYLE","classification":"G","division":"PRODUCTION","hit_factor":4.3943},{"match_name":"DWB - Deadwood Boys USPSA 20 May 2018","match_date":"2018-05-20","stage_classifiercode":"99-16","member_number":"A79076","first_name":"YURI","last_name":"MANAS","classification":"U","division":"PRODUCTION","hit_factor":4.3868},{"match_name":"ENPS March 2017 USPSA Match","match_date":"2017-03-05","stage_classifiercode":"99-16","member_number":"A99531","first_name":"JEFFERY F","last_name":"NILES JR","classification":"U","division":"PRODUCTION","hit_factor":4.3796},{"match_name":"CRC_20160514_SuperClassifier","match_date":"2016-05-14","stage_classifiercode":"99-16","member_number":"TY92911","first_name":"JOHN","last_name":"COOREMAN","classification":"C","division":"PRODUCTION","hit_factor":4.3676},{"match_name":"PTPC May 7th USPSA Match","match_date":"2017-05-07","stage_classifiercode":"99-16","member_number":"TY94467","first_name":"KEITH","last_name":"KRAUSE","classification":"C","division":"PRODUCTION","hit_factor":4.3557},{"match_name":"PTPC May 7th USPSA Match","match_date":"2017-05-07","stage_classifiercode":"99-16","member_number":"TY75428","first_name":"LARRY","last_name":"MCANARNEY","classification":"C","division":"PRODUCTION","hit_factor":4.3551},{"match_name":"USPSA MO21 Special Classifier 2Alpha SBRC February 27 2021","match_date":"2021-02-27","stage_classifiercode":"99-16","member_number":"A120200","first_name":"MIKE","last_name":"GAWF","classification":"C","division":"PRODUCTION","hit_factor":4.3478},{"match_name":"SFPS 10-08-2017 USPSA match","match_date":"2017-10-08","stage_classifiercode":"99-16","member_number":"TY102237","first_name":"ADAM","last_name":"ACKERMAN","classification":"C","division":"PRODUCTION","hit_factor":4.3421},{"match_name":"OREGON ARPC CC05 USPSA Jan 14 2017","match_date":"2017-01-14","stage_classifiercode":"99-16","member_number":"A68593","first_name":"KELLAR","last_name":"AUTUMN","classification":"A","division":"PRODUCTION","hit_factor":4.3417},{"match_name":"Maine Practical Shooters May 2017","match_date":"2017-05-13","stage_classifiercode":"99-16","member_number":"A91463","first_name":"BRIAN","last_name":"GARDINER","classification":"X","division":"PRODUCTION","hit_factor":4.3261},{"match_name":"USPSA MO21 Special Classifier 2Alpha SBRC February 27 2021","match_date":"2021-02-27","stage_classifiercode":"99-16","member_number":"TY86706","first_name":"CHRIS","last_name":"DEWEY","classification":"A","division":"PRODUCTION","hit_factor":4.321},{"match_name":"CCPL 02-09-2020","match_date":"2020-02-09","stage_classifiercode":"99-16","member_number":"A105543","first_name":"TRENT","last_name":"KING","classification":"C","division":"PRODUCTION","hit_factor":4.3189},{"match_name":"CARO USPSA MATCH NO 3","match_date":"2018-07-28","stage_classifiercode":"99-16","member_number":"A108339","first_name":"BOB","last_name":"LEAVITT","classification":"U","division":"PRODUCTION","hit_factor":4.3103},{"match_name":"WLPS USPSA Sep 2016","match_date":"2016-09-25","stage_classifiercode":"99-16","member_number":"A92447","first_name":"ROB","last_name":"NEWMAN","classification":"C","division":"PRODUCTION","hit_factor":4.3095},{"match_name":"AVAP CLASSIFIER 71418","match_date":"2018-07-14","stage_classifiercode":"99-16","member_number":"TY111293","first_name":"MACKY","last_name":"RUIZ","classification":"U","division":"PRODUCTION","hit_factor":4.3077},{"match_name":"CRC_20160514_SuperClassifier","match_date":"2016-05-14","stage_classifiercode":"99-16","member_number":"A93917","first_name":"JAMES","last_name":"BEEBE","classification":"D","division":"PRODUCTION","hit_factor":4.3059},{"match_name":"CCPL 2 Day Match 2018","match_date":"2018-04-26","stage_classifiercode":"99-16","member_number":"A107307","first_name":"ALLAN","last_name":"ABREA","classification":"U","division":"PRODUCTION","hit_factor":4.2816},{"match_name":"MPSA 101720 USPSA","match_date":"2020-10-17","stage_classifiercode":"99-16","member_number":"A78083","first_name":"JEFFREY","last_name":"BLITCH","classification":"A","division":"PRODUCTION","hit_factor":4.2787},{"match_name":"LdF USPSA Match September 23 2017","match_date":"2017-09-23","stage_classifiercode":"99-16","member_number":"A99995","first_name":"ALAN","last_name":"SHAFRAN","classification":"D","division":"PRODUCTION","hit_factor":4.2781},{"match_name":"ENPS March 2017 USPSA Match","match_date":"2017-03-05","stage_classifiercode":"99-16","member_number":"A93239","first_name":"JOHN","last_name":"COCHRAN","classification":"C","division":"PRODUCTION","hit_factor":4.2781},{"match_name":"SPSA USPSA July 4th Sat match","match_date":"2018-07-28","stage_classifiercode":"99-16","member_number":"A91991","first_name":"GLENN","last_name":"GREEN","classification":"B","division":"PRODUCTION","hit_factor":4.2775},{"match_name":"APSC USPSA Match 1-6-18","match_date":"2018-01-06","stage_classifiercode":"99-16","member_number":"A89189","first_name":"JOHN","last_name":"FRAZELL","classification":"C","division":"PRODUCTION","hit_factor":4.2766},{"match_name":"Shongum December 2017 USPSA Match","match_date":"2017-12-02","stage_classifiercode":"99-16","member_number":"\"\"","first_name":"EVAN","last_name":"DAIRE","classification":"U","division":"PRODUCTION","hit_factor":4.2741},{"match_name":"LCSC USPSA 01.14.18","match_date":"2018-01-13","stage_classifiercode":"99-16","member_number":"TY17315","first_name":"RON","last_name":"NAKABAYASHI","classification":"B","division":"PRODUCTION","hit_factor":4.2722},{"match_name":"MS06 Team Magnolia USPSA January Match2","match_date":"2016-01-03","stage_classifiercode":"99-16","member_number":"A86560","first_name":"DARRELL","last_name":"CAREY","classification":"C","division":"PRODUCTION","hit_factor":4.2629},{"match_name":"DWB - Deadwood Boys USPSA 20 May 2018","match_date":"2018-05-20","stage_classifiercode":"99-16","member_number":"A82246","first_name":"MATTHEW","last_name":"SLOWIK","classification":"C","division":"PRODUCTION","hit_factor":4.2596},{"match_name":"2da Copa Nacional USPSA ","match_date":"2016-05-22","stage_classifiercode":"99-16","member_number":"\"\"","first_name":"EDUARDO","last_name":"ROMAN ADORNO","classification":"U","division":"PRODUCTION","hit_factor":4.2516},{"match_name":"RCPS USPSA 12 Nov 2016","match_date":"2016-11-12","stage_classifiercode":"99-16","member_number":"A92433","first_name":"MIKE","last_name":"LASH","classification":"C","division":"PRODUCTION","hit_factor":4.2489},{"match_name":"ENPS March 2017 USPSA Match","match_date":"2017-03-05","stage_classifiercode":"99-16","member_number":"A100029","first_name":"TREVOR J","last_name":"STUART","classification":"U","division":"PRODUCTION","hit_factor":4.246},{"match_name":"PRG-USPSA - Oh Shoot January 3rd - 1st Sunday","match_date":"2021-01-03","stage_classifiercode":"99-16","member_number":"TY87479","first_name":"KRIS","last_name":"HEAD","classification":"B","division":"PRODUCTION","hit_factor":4.2416},{"match_name":"PIPS 05-25-2016","match_date":"2016-05-24","stage_classifiercode":"99-16","member_number":"A94306","first_name":"KRIS","last_name":"NORMAN","classification":"U","division":"PRODUCTION","hit_factor":4.238},{"match_name":"ARPC USPSA Match 3-26-17","match_date":"2017-03-26","stage_classifiercode":"99-16","member_number":"A102140","first_name":"JERRY","last_name":"ADZIMA","classification":"Unclassified","division":"PRODUCTION","hit_factor":4.2365},{"match_name":"SWGC USPSA Pistol Match - December","match_date":"2016-12-03","stage_classifiercode":"99-16","member_number":"A99682","first_name":"DENIS","last_name":"OLEYNIK","classification":"U","division":"PRODUCTION","hit_factor":4.2084},{"match_name":"DWB - Deadwood Boys USPSA 20 May 2018","match_date":"2018-05-20","stage_classifiercode":"99-16","member_number":"TY102044","first_name":"KEVIN","last_name":"HANLEY","classification":"C","division":"PRODUCTION","hit_factor":4.2068},{"match_name":"FLPSA MN14 USPSA May 17 2018","match_date":"2018-05-17","stage_classifiercode":"99-16","member_number":"A108763","first_name":"MATTHEW","last_name":"SWANSON","classification":"U","division":"PRODUCTION","hit_factor":4.2048},{"match_name":"4ta Fecha USPSA","match_date":"2018-04-07","stage_classifiercode":"99-16","member_number":"TY97157","first_name":"REBECCA","last_name":"AGUIRRE-HERNANDEZ","classification":"D","division":"PRODUCTION","hit_factor":4.2009},{"match_name":"CRC_20160514_SuperClassifier","match_date":"2016-05-14","stage_classifiercode":"99-16","member_number":"A62264","first_name":"JACK","last_name":"CROOM","classification":"C","division":"PRODUCTION","hit_factor":4.1979},{"match_name":"ARPC USPSA Match 3-26-17","match_date":"2017-03-26","stage_classifiercode":"99-16","member_number":"A95505","first_name":"ROB","last_name":"LUTH","classification":"C","division":"PRODUCTION","hit_factor":4.1933},{"match_name":"Laser Ninja Dragon League MSA USPSA January 8th 2017","match_date":"2017-01-08","stage_classifiercode":"99-16","member_number":"A99871","first_name":"DEAN","last_name":"DUNNING","classification":"C","division":"PRODUCTION","hit_factor":4.1801},{"match_name":"GCL June 3-2017","match_date":"2017-06-03","stage_classifiercode":"99-16","member_number":"TY66527","first_name":"ROB","last_name":"RAIMAN","classification":"C","division":"PRODUCTION","hit_factor":4.1771},{"match_name":"MvpNov2015","match_date":"2015-11-06","stage_classifiercode":"99-16","member_number":"\"\"","first_name":"JEREMY A477290","last_name":"STORY","classification":"U","division":"PRODUCTION","hit_factor":4.1752},{"match_name":"ENPS March 2017 USPSA Match","match_date":"2017-03-05","stage_classifiercode":"99-16","member_number":"A80261","first_name":"DMITRI","last_name":"FOMENKO","classification":"B","division":"PRODUCTION","hit_factor":4.1667},{"match_name":"GCL June 3-2017","match_date":"2017-06-03","stage_classifiercode":"99-16","member_number":"A85329","first_name":"JIM","last_name":"BROWNE","classification":"C","division":"PRODUCTION","hit_factor":4.1631},{"match_name":"Shongum April 2016 Pistol Match","match_date":"2016-04-02","stage_classifiercode":"99-16","member_number":"A93770","first_name":"JAMES","last_name":"THEODOROU","classification":"C","division":"PRODUCTION","hit_factor":4.157},{"match_name":"TPS USPSA -  April 2018 Clone","match_date":"2018-04-08","stage_classifiercode":"99-16","member_number":"a97692","first_name":"ALAN","last_name":"BATES","classification":"D","division":"PRODUCTION","hit_factor":4.1547},{"match_name":"GCL June 3-2017","match_date":"2017-06-03","stage_classifiercode":"99-16","member_number":"PEN","first_name":"NICK","last_name":"TASKETT","classification":"U","division":"PRODUCTION","hit_factor":4.1351},{"match_name":"OREGON ARPC CC05 USPSA Jan 14 2017","match_date":"2017-01-14","stage_classifiercode":"99-16","member_number":"A93650","first_name":"GRANT","last_name":"HIGGINBOTHAM","classification":"D","division":"PRODUCTION","hit_factor":4.1268},{"match_name":"Nampa USPSA May 27th 2020 Classifier Match","match_date":"2020-05-27","stage_classifiercode":"99-16","member_number":"A127385","first_name":"EDWARD","last_name":"WUNDER","classification":"U","division":"PRODUCTION","hit_factor":4.1253},{"match_name":"CRC_20160514_SuperClassifier","match_date":"2016-05-14","stage_classifiercode":"99-16","member_number":"A95263","first_name":"SIDA","last_name":"SHEN","classification":"C","division":"PRODUCTION","hit_factor":4.1237},{"match_name":"SWGC USPSA Pistol Match - December","match_date":"2016-12-03","stage_classifiercode":"99-16","member_number":"FY94752","first_name":"CHRIS","last_name":"DEBRUIN","classification":"C","division":"PRODUCTION","hit_factor":4.1202},{"match_name":"LCSC USPSA 01.14.18","match_date":"2018-01-13","stage_classifiercode":"99-16","member_number":"A102844","first_name":"ANDREW","last_name":"SCHUMACHER","classification":"D","division":"PRODUCTION","hit_factor":4.119},{"match_name":"LGCSEMPS September 2017 Handgun","match_date":"2017-09-10","stage_classifiercode":"99-16","member_number":"A105364","first_name":"MICHAEL","last_name":"SU","classification":"U","division":"PRODUCTION","hit_factor":4.1159},{"match_name":"AVAP CLASSIFIER 71418","match_date":"2018-07-14","stage_classifiercode":"99-16","member_number":"\"\"","first_name":"EDDIE","last_name":"CHAN","classification":"D","division":"PRODUCTION","hit_factor":4.1115},{"match_name":"LGCSEMPS September 2017 Handgun","match_date":"2017-09-10","stage_classifiercode":"99-16","member_number":"TY82142","first_name":"DAVID","last_name":"MARSHALL","classification":"C","division":"PRODUCTION","hit_factor":4.1009},{"match_name":"BORCC USPSA July 2018 Classifier Match","match_date":"2018-07-02","stage_classifiercode":"99-16","member_number":"TY79144","first_name":"WAYNE","last_name":"WAGNER","classification":"C","division":"PRODUCTION","hit_factor":4.0966},{"match_name":"SFA USPSA NOVEMBER 14 2020","match_date":"2020-11-14","stage_classifiercode":"99-16","member_number":"A116560","first_name":"MICHAEL","last_name":"MILOVICH","classification":"B","division":"PRODUCTION","hit_factor":4.0816},{"match_name":"PCWC USPSA  1 28 17","match_date":"2017-01-28","stage_classifiercode":"99-16","member_number":"\"\"","first_name":"SKYE","last_name":"STONE","classification":"\"\"","division":"PRODUCTION","hit_factor":4.0673},{"match_name":"LGCSEMPS September 2017 Handgun","match_date":"2017-09-10","stage_classifiercode":"99-16","member_number":"TY96397","first_name":"MICHAEL","last_name":"HALL","classification":"C","division":"PRODUCTION","hit_factor":4.0541},{"match_name":"Hosemasters 2nd Sunday May 2017","match_date":"2017-05-14","stage_classifiercode":"99-16","member_number":"TY80622","first_name":"BRADLEY","last_name":"KITCHIN","classification":"B","division":"PRODUCTION","hit_factor":4.0526},{"match_name":"PIPS 05-25-2016","match_date":"2016-05-24","stage_classifiercode":"99-16","member_number":"TY65394","first_name":"SCOTT","last_name":"HARRISON","classification":"C","division":"PRODUCTION","hit_factor":4.0498},{"match_name":"CRC_20160514_SuperClassifier","match_date":"2016-05-14","stage_classifiercode":"99-16","member_number":"A95263","first_name":"SIDA","last_name":"SHEN","classification":"C","division":"PRODUCTION","hit_factor":4.0498},{"match_name":"ORSA USPSA August 2020","match_date":"2020-08-15","stage_classifiercode":"99-16","member_number":"A103498","first_name":"RONALD","last_name":"REINKE","classification":"U","division":"PRODUCTION","hit_factor":4.0404},{"match_name":"USPSA Bass River April 2017","match_date":"2017-04-02","stage_classifiercode":"99-16","member_number":"A92830","first_name":"CHRIS","last_name":"WHITING","classification":"\"\"","division":"PRODUCTION","hit_factor":4.0394},{"match_name":"GCL Wed 5-31-17","match_date":"2017-05-31","stage_classifiercode":"99-16","member_number":"TY70159","first_name":"JIM","last_name":"CULBERTSON","classification":"C","division":"PRODUCTION","hit_factor":4.0268},{"match_name":"LdF USPSA Match September 23 2017","match_date":"2017-09-23","stage_classifiercode":"99-16","member_number":"A88221","first_name":"JON","last_name":"BAUTISTA","classification":"G","division":"PRODUCTION","hit_factor":4.0258},{"match_name":"Shongum December 2017 USPSA Match","match_date":"2017-12-02","stage_classifiercode":"99-16","member_number":"TY97465","first_name":"RYAN","last_name":"ZAJAC","classification":"C","division":"PRODUCTION","hit_factor":4.0174},{"match_name":"Dundee USPSA Mar 2017","match_date":"2017-03-25","stage_classifiercode":"99-16","member_number":"A9144","first_name":"NICK","last_name":"NIBLER","classification":"C","division":"PRODUCTION","hit_factor":4.0174},{"match_name":"Shasta Shooters September 2016","match_date":"2016-09-10","stage_classifiercode":"99-16","member_number":"A96344","first_name":"RON","last_name":"HILDEBRANT","classification":"C","division":"PRODUCTION","hit_factor":4},{"match_name":"Shasta Shooters 2020 Dec","match_date":"2020-12-12","stage_classifiercode":"99-16","member_number":"Fy89662","first_name":"TODD","last_name":"CANCILLA","classification":"M","division":"PRODUCTION","hit_factor":3.9945},{"match_name":"DAP December 2015 Classifier match","match_date":"2015-12-12","stage_classifiercode":"99-16","member_number":"A92091","first_name":"ADAM","last_name":"FLORENDO","classification":"D","division":"PRODUCTION","hit_factor":3.9933},{"match_name":"Superior Practical Shooters - March Match","match_date":"2017-03-01","stage_classifiercode":"99-16","member_number":"TY-58436","first_name":"ANTHONY","last_name":"FRANCISCO","classification":"C","division":"PRODUCTION","hit_factor":3.9823},{"match_name":"USPSA-AB 2018-14 at Brooks Pistol Club -adhoc","match_date":"2018-08-08","stage_classifiercode":"99-16","member_number":"TYF96121","first_name":"MIKE","last_name":"GIORDANO","classification":"C","division":"PRODUCTION","hit_factor":3.9773},{"match_name":"SWGC USPSA Pistol Match - December","match_date":"2016-12-03","stage_classifiercode":"99-16","member_number":"A75750","first_name":"JEFF","last_name":"ROBERDO","classification":"C","division":"PRODUCTION","hit_factor":3.9664},{"match_name":"Range E11even October 2017","match_date":"2017-10-28","stage_classifiercode":"99-16","member_number":"A77566","first_name":"STEVE","last_name":"ATKINSON","classification":"U","division":"PRODUCTION","hit_factor":3.9648},{"match_name":"RCPS USPSA 12 Nov 2016","match_date":"2016-11-12","stage_classifiercode":"99-16","member_number":"A87161","first_name":"STAN","last_name":"SHERROD","classification":"C","division":"PRODUCTION","hit_factor":3.9604},{"match_name":"OREGON ARPC CC05 USPSA Jan 14 2017","match_date":"2017-01-14","stage_classifiercode":"99-16","member_number":"A76190","first_name":"CALEB","last_name":"WOODROW","classification":"D","division":"PRODUCTION","hit_factor":3.9604},{"match_name":"Grandbaggers 07/2017","match_date":"2017-07-06","stage_classifiercode":"99-16","member_number":"A99490","first_name":"BRYAN","last_name":"DE LA FUENTE","classification":"U","division":"PRODUCTION","hit_factor":3.9574},{"match_name":"WLPS June 2017","match_date":"2017-06-25","stage_classifiercode":"99-16","member_number":"FY79193","first_name":"LELAND","last_name":"BELDING","classification":"C","division":"PRODUCTION","hit_factor":3.9492},{"match_name":"4ta Fecha USPSA","match_date":"2018-04-07","stage_classifiercode":"99-16","member_number":"\"\"","first_name":"ORLANDO A.","last_name":"RAMIREZ-RODRIGUEZ","classification":"U","division":"PRODUCTION","hit_factor":3.9394},{"match_name":"PRG-USPSA - Oh Shoot January 3rd - 1st Sunday","match_date":"2021-01-03","stage_classifiercode":"99-16","member_number":"A131892","first_name":"BRIAN","last_name":"MCCORMICK","classification":"U","division":"PRODUCTION","hit_factor":3.935},{"match_name":"USPSA MO21 Special Classifier 2Alpha SBRC February 27 2021","match_date":"2021-02-27","stage_classifiercode":"99-16","member_number":"TY14961","first_name":"ROY","last_name":"BOWLING","classification":"C","division":"PRODUCTION","hit_factor":3.935},{"match_name":"SPSA USPSA December 1st Sat Match","match_date":"2016-12-03","stage_classifiercode":"99-16","member_number":"A91991","first_name":"GLENN","last_name":"GREEN","classification":"C","division":"PRODUCTION","hit_factor":3.932},{"match_name":"Grandbaggers 07/2017","match_date":"2017-07-06","stage_classifiercode":"99-16","member_number":"A103599","first_name":"BEN","last_name":"KRUSE","classification":"U","division":"PRODUCTION","hit_factor":3.9278},{"match_name":"CCPL 2 Day Match 2018","match_date":"2018-04-26","stage_classifiercode":"99-16","member_number":"A103400","first_name":"SONNIE","last_name":"AVILA","classification":"U","division":"PRODUCTION","hit_factor":3.9249},{"match_name":"APSC USPSA Match 1-6-18","match_date":"2018-01-06","stage_classifiercode":"99-16","member_number":"\"\"","first_name":"MARCELO","last_name":"POCARESSI","classification":"U","division":"PRODUCTION","hit_factor":3.9216},{"match_name":"USPSA-AB 2018-14 at Brooks Pistol Club -adhoc","match_date":"2018-08-08","stage_classifiercode":"99-16","member_number":"F108011","first_name":"STACEY","last_name":"LILLEHEI","classification":"U","division":"PRODUCTION","hit_factor":3.9216},{"match_name":"TPS USPSA -  January 2017 - Talon Range","match_date":"2017-01-07","stage_classifiercode":"99-16","member_number":"A84115","first_name":"ALLIE","last_name":"HOWE","classification":"C","division":"PRODUCTION","hit_factor":3.9189},{"match_name":"TPS USPSA -  January 2017 - Talon Range","match_date":"2017-01-07","stage_classifiercode":"99-16","member_number":"TY68839","first_name":"DAVID","last_name":"SALMON","classification":"C","division":"PRODUCTION","hit_factor":3.9102},{"match_name":"RBGC 2017-10-21","match_date":"2017-10-21","stage_classifiercode":"99-16","member_number":"A105781","first_name":"JONATHAN","last_name":"MCLEOD","classification":"U","division":"PRODUCTION","hit_factor":3.9074},{"match_name":"PCWC USPSA  1 28 17","match_date":"2017-01-28","stage_classifiercode":"99-16","member_number":"FY-94752","first_name":"CHRIS","last_name":"DEBRUIN","classification":"C","division":"PRODUCTION","hit_factor":3.9019},{"match_name":"PIPS 05-25-2016","match_date":"2016-05-24","stage_classifiercode":"99-16","member_number":"TY65888","first_name":"GREG","last_name":"BESTLAND","classification":"B","division":"PRODUCTION","hit_factor":3.8976},{"match_name":"CCPL 2 Day Match 2018","match_date":"2018-04-26","stage_classifiercode":"99-16","member_number":"A107395","first_name":"KIRSTEN","last_name":"WILLIAMSON","classification":"U","division":"PRODUCTION","hit_factor":3.8898},{"match_name":"DAP December 2015 Classifier match","match_date":"2015-12-12","stage_classifiercode":"99-16","member_number":"TY93002","first_name":"ERIC","last_name":"CARGO","classification":"U","division":"PRODUCTION","hit_factor":3.8889},{"match_name":"Shongum April 2016 Pistol Match","match_date":"2016-04-02","stage_classifiercode":"99-16","member_number":"TY88444","first_name":"COLIN","last_name":"MCCARTHY","classification":"D","division":"PRODUCTION","hit_factor":3.888},{"match_name":"GCL June 3-2017","match_date":"2017-06-03","stage_classifiercode":"99-16","member_number":"A96622","first_name":"LARRY","last_name":"STROLLO","classification":"C","division":"PRODUCTION","hit_factor":3.8877},{"match_name":"APSC USPSA Match 1-6-18","match_date":"2018-01-06","stage_classifiercode":"99-16","member_number":"TY17258","first_name":"MARK","last_name":"SAGER","classification":"D","division":"PRODUCTION","hit_factor":3.8849},{"match_name":"Hosemasters 2nd Sunday May 2017","match_date":"2017-05-14","stage_classifiercode":"99-16","member_number":"FY100077","first_name":"YUKI","last_name":"TAKEUCHI","classification":"B","division":"PRODUCTION","hit_factor":3.8847},{"match_name":"Shongum April 2016 Pistol Match","match_date":"2016-04-02","stage_classifiercode":"99-16","member_number":"TY87043","first_name":"JAMES","last_name":"PATERNO","classification":"B","division":"PRODUCTION","hit_factor":3.8825},{"match_name":"Emmett March Match","match_date":"2016-03-25","stage_classifiercode":"99-16","member_number":"a95209","first_name":"GARY","last_name":"MANUEL","classification":"U","division":"PRODUCTION","hit_factor":3.8825},{"match_name":"Shadow Hawk Defense USPSA Special Classifier","match_date":"2020-11-14","stage_classifiercode":"99-16","member_number":"L4433","first_name":"LYNN","last_name":"KASIC","classification":"C","division":"PRODUCTION","hit_factor":3.8719},{"match_name":"LCSC USPSA 01.14.18","match_date":"2018-01-13","stage_classifiercode":"99-16","member_number":"\"\"","first_name":"ERIC","last_name":"ANCHETA","classification":"U","division":"PRODUCTION","hit_factor":3.8641},{"match_name":"BORCC USPSA July 2018 Classifier Match","match_date":"2018-07-02","stage_classifiercode":"99-16","member_number":"PEN","first_name":"NICHOLAS","last_name":"HARIG","classification":"U","division":"PRODUCTION","hit_factor":3.8425},{"match_name":"TPS USPSA -  January 2017 - Talon Range","match_date":"2017-01-07","stage_classifiercode":"99-16","member_number":"A82422","first_name":"LAWTON","last_name":"SEGLER","classification":"B","division":"PRODUCTION","hit_factor":3.8417},{"match_name":"GCL June 3-2017","match_date":"2017-06-03","stage_classifiercode":"99-16","member_number":"TY101742","first_name":"EDSON","last_name":"SAWYERS","classification":"U","division":"PRODUCTION","hit_factor":3.839},{"match_name":"ORSA USPSA July 2016 ","match_date":"2016-07-16","stage_classifiercode":"99-16","member_number":"NONE","first_name":"JOE","last_name":"FLEETWOOD","classification":"U","division":"PRODUCTION","hit_factor":3.831},{"match_name":"ARPC USPSA Match 7-26-20","match_date":"2020-07-26","stage_classifiercode":"99-16","member_number":"A66902","first_name":"JAMES","last_name":"FREEMAN","classification":"C","division":"PRODUCTION","hit_factor":3.8298},{"match_name":"Emmett March Match","match_date":"2016-03-25","stage_classifiercode":"99-16","member_number":"TY71318","first_name":"CLAY","last_name":"MARTIN","classification":"M","division":"PRODUCTION","hit_factor":3.8288},{"match_name":"Sharp Practical Shooters May USPSA Match","match_date":"2018-05-27","stage_classifiercode":"99-16","member_number":"a38038","first_name":"RICK","last_name":"DACAYANAN","classification":"B","division":"PRODUCTION","hit_factor":3.827},{"match_name":"CRC_20160514_SuperClassifier","match_date":"2016-05-14","stage_classifiercode":"99-16","member_number":"A93954","first_name":"JONATHAN","last_name":"ECKLEY","classification":"U","division":"PRODUCTION","hit_factor":3.8194},{"match_name":"Pelham USPSA 2017-08-20","match_date":"2017-08-20","stage_classifiercode":"99-16","member_number":"A101366","first_name":"HENRY","last_name":"POIRIER","classification":"D","division":"PRODUCTION","hit_factor":3.8186},{"match_name":"CCPS March 2018 USPSA","match_date":"2018-03-18","stage_classifiercode":"99-16","member_number":"\"\"","first_name":"CLIPPER","last_name":"GOODRICH","classification":"U","division":"PRODUCTION","hit_factor":3.8183},{"match_name":"ENPS March 2017 USPSA Match","match_date":"2017-03-05","stage_classifiercode":"99-16","member_number":"A96769","first_name":"BILL","last_name":"STEEN","classification":"U","division":"PRODUCTION","hit_factor":3.8173},{"match_name":"LGCSEMPS September 2017 Handgun","match_date":"2017-09-10","stage_classifiercode":"99-16","member_number":"A91361","first_name":"JOE","last_name":"JARSKI","classification":"B","division":"PRODUCTION","hit_factor":3.8168},{"match_name":"ARPC USPSA Match 3-26-17","match_date":"2017-03-26","stage_classifiercode":"99-16","member_number":"A89482","first_name":"JOSEP F","last_name":"REQUENA","classification":"Unclassified","division":"PRODUCTION","hit_factor":3.816},{"match_name":"ORSA USPSA August 2020","match_date":"2020-08-15","stage_classifiercode":"99-16","member_number":"A125741","first_name":"BOB","last_name":"SANDE","classification":"U","division":"PRODUCTION","hit_factor":3.8143},{"match_name":"Briar Rabbit  June Match 2016 OH 20","match_date":"2016-06-12","stage_classifiercode":"99-16","member_number":"A96708","first_name":"YURIY","last_name":"BORZENKO","classification":"U","division":"PRODUCTION","hit_factor":3.8143},{"match_name":"GCL Wed 5-31-17","match_date":"2017-05-31","stage_classifiercode":"99-16","member_number":"TY66527","first_name":"ROB","last_name":"RAIMAN","classification":"C","division":"PRODUCTION","hit_factor":3.8136},{"match_name":"PIPS 07-25-2018","match_date":"2018-07-25","stage_classifiercode":"99-16","member_number":"TY81464","first_name":"BRAD","last_name":"BRECH","classification":"D","division":"PRODUCTION","hit_factor":3.8069},{"match_name":"AVAP CLASSIFIER 71418","match_date":"2018-07-14","stage_classifiercode":"99-16","member_number":"L4431","first_name":"KONRAD","last_name":"BRAUNSCHWEIG","classification":"C","division":"PRODUCTION","hit_factor":3.7963},{"match_name":"SWGC USPSA Pistol Match - December","match_date":"2016-12-03","stage_classifiercode":"99-16","member_number":"TY71997","first_name":"JIMMIE","last_name":"HONEYCUTT","classification":"C","division":"PRODUCTION","hit_factor":3.7945},{"match_name":"2da Copa Nacional USPSA ","match_date":"2016-05-22","stage_classifiercode":"99-16","member_number":"\"\"","first_name":"OSVALDO","last_name":"SANDOVAL","classification":"U","division":"PRODUCTION","hit_factor":3.7868},{"match_name":"CIPSC Havana July USPSA","match_date":"2018-07-07","stage_classifiercode":"99-16","member_number":"A109460","first_name":"DONALD","last_name":"DILLON","classification":"C","division":"PRODUCTION","hit_factor":3.778866340098},{"match_name":"LGCSEMPS September 2017 Handgun","match_date":"2017-09-10","stage_classifiercode":"99-16","member_number":"\"\"","first_name":"JEFFREY","last_name":"MORGAN","classification":"U","division":"PRODUCTION","hit_factor":3.7768},{"match_name":"LdF USPSA Match September 23 2017","match_date":"2017-09-23","stage_classifiercode":"99-16","member_number":"A94509","first_name":"JUSTIN","last_name":"ALLEN","classification":"C","division":"PRODUCTION","hit_factor":3.7763},{"match_name":"CRC_20160514_SuperClassifier","match_date":"2016-05-14","stage_classifiercode":"99-16","member_number":"A93099","first_name":"DAIN","last_name":"CUMMINGS","classification":"U","division":"PRODUCTION","hit_factor":3.772},{"match_name":"Shongum April 2016 Pistol Match","match_date":"2016-04-02","stage_classifiercode":"99-16","member_number":"A83305","first_name":"RUSSELL","last_name":"TAGLIARENI","classification":"C","division":"PRODUCTION","hit_factor":3.7612},{"match_name":"Pelham USPSA 2017-08-20","match_date":"2017-08-20","stage_classifiercode":"99-16","member_number":"A103369","first_name":"GRAHAM","last_name":"LOFF","classification":"U","division":"PRODUCTION","hit_factor":3.7602},{"match_name":"GCL June 3-2017","match_date":"2017-06-03","stage_classifiercode":"99-16","member_number":"TY95151","first_name":"GARY","last_name":"GLEASON","classification":"D","division":"PRODUCTION","hit_factor":3.7344},{"match_name":"GCL Wed 5-31-17","match_date":"2017-05-31","stage_classifiercode":"99-16","member_number":"TY72717","first_name":"TOM","last_name":"SCOTT","classification":"C","division":"PRODUCTION","hit_factor":3.7276},{"match_name":"AVAP CLASSIFIER 71418","match_date":"2018-07-14","stage_classifiercode":"99-16","member_number":"A94308","first_name":"TAKASHI","last_name":"FUJIKAWA","classification":"C","division":"PRODUCTION","hit_factor":3.7273},{"match_name":"TPS USPSA -  January 2017 - Talon Range","match_date":"2017-01-07","stage_classifiercode":"99-16","member_number":"A-87929","first_name":"RICHARD","last_name":"LIGHTSEY","classification":"C","division":"PRODUCTION","hit_factor":3.7223},{"match_name":"MS06 Team Magnolia USPSA January Match2","match_date":"2016-01-03","stage_classifiercode":"99-16","member_number":"TY44848","first_name":"MICHAEL","last_name":"MCARTHUR","classification":"C","division":"PRODUCTION","hit_factor":3.7108},{"match_name":"Shongum April 2016 Pistol Match","match_date":"2016-04-02","stage_classifiercode":"99-16","member_number":"\"\"","first_name":"RYAN","last_name":"ZAJAC","classification":"U","division":"PRODUCTION","hit_factor":3.7037},{"match_name":"USPSA Bass River April 2017","match_date":"2017-04-02","stage_classifiercode":"99-16","member_number":"PEN","first_name":"BRAD","last_name":"BOUCHARD","classification":"\"\"","division":"PRODUCTION","hit_factor":3.6984},{"match_name":"USPSA MO21 Special Classifier 2Alpha SBRC February 27 2021","match_date":"2021-02-27","stage_classifiercode":"99-16","member_number":"A117002","first_name":"CODY","last_name":"AUTRY","classification":"U","division":"PRODUCTION","hit_factor":3.6789},{"match_name":"DWB - Deadwood Boys USPSA 20 May 2018","match_date":"2018-05-20","stage_classifiercode":"99-16","member_number":"FY92802","first_name":"SCOTT","last_name":"CARMODY","classification":"C","division":"PRODUCTION","hit_factor":3.6743},{"match_name":"PIPS 07-25-2018","match_date":"2018-07-25","stage_classifiercode":"99-16","member_number":"A86892","first_name":"KEVIN","last_name":"ARHELGER","classification":"D","division":"PRODUCTION","hit_factor":3.6675},{"match_name":"GCL June 3-2017","match_date":"2017-06-03","stage_classifiercode":"99-16","member_number":"PEN","first_name":"RONALD","last_name":"RAYMOND","classification":"U","division":"PRODUCTION","hit_factor":3.6671},{"match_name":"LGCSEMPS September 2017 Handgun","match_date":"2017-09-10","stage_classifiercode":"99-16","member_number":"A102969","first_name":"DUANE","last_name":"COWGER","classification":"U","division":"PRODUCTION","hit_factor":3.6585},{"match_name":"SPSA USPSA December 1st Sat Match","match_date":"2016-12-03","stage_classifiercode":"99-16","member_number":"A59371","first_name":"WAYNE","last_name":"TROUTMAN","classification":"B","division":"PRODUCTION","hit_factor":3.6585},{"match_name":"PIPS 05-25-2016","match_date":"2016-05-24","stage_classifiercode":"99-16","member_number":"A47736","first_name":"LISA","last_name":"JOHNSON","classification":"D","division":"PRODUCTION","hit_factor":3.6561},{"match_name":"WLPS USPSA Sep 2016","match_date":"2016-09-25","stage_classifiercode":"99-16","member_number":"\"\"","first_name":"LANE","last_name":"JENSEN","classification":"U","division":"PRODUCTION","hit_factor":3.6523},{"match_name":"Sage Pistol League USPSA August 16 2020","match_date":"2020-08-16","stage_classifiercode":"99-16","member_number":"TY74761","first_name":"PHILLIP","last_name":"LAND","classification":"C","division":"PRODUCTION","hit_factor":3.6501},{"match_name":"CIPSC Havana July USPSA","match_date":"2018-07-07","stage_classifiercode":"99-16","member_number":"A110160","first_name":"MIKE","last_name":"SPANIER","classification":"C","division":"PRODUCTION","hit_factor":3.6490008688097},{"match_name":"RBGC 2017-10-21","match_date":"2017-10-21","stage_classifiercode":"99-16","member_number":"TY81668","first_name":"BRENT","last_name":"WILEY","classification":"A","division":"PRODUCTION","hit_factor":3.6478},{"match_name":"CRC_20160514_SuperClassifier","match_date":"2016-05-14","stage_classifiercode":"99-16","member_number":"A96954","first_name":"AUSTIN","last_name":"MORTON","classification":"U","division":"PRODUCTION","hit_factor":3.6364},{"match_name":"MS06 Team Magnolia USPSA January Match2","match_date":"2016-01-03","stage_classifiercode":"99-16","member_number":"TY88750","first_name":"LADONNA","last_name":"NICHOLS","classification":"D","division":"PRODUCTION","hit_factor":3.6266},{"match_name":"HRC Jul 08 2017","match_date":"2017-07-07","stage_classifiercode":"99-16","member_number":"A85131","first_name":"KEITH","last_name":"HOLBROOK","classification":"U","division":"PRODUCTION","hit_factor":3.6036},{"match_name":"SFPS 10-08-2017 USPSA match","match_date":"2017-10-08","stage_classifiercode":"99-16","member_number":"L3584","first_name":"DAVID","last_name":"COLE","classification":"C","division":"PRODUCTION","hit_factor":3.5842},{"match_name":"OK15 USPSA at USSA","match_date":"2016-12-11","stage_classifiercode":"99-16","member_number":"A80515","first_name":"MICAH","last_name":"ROWE","classification":"A","division":"PRODUCTION","hit_factor":3.5817},{"match_name":"EWPSA 2018-09","match_date":"2018-09-16","stage_classifiercode":"99-16","member_number":"A101557","first_name":"CODY","last_name":"CALKINS","classification":"U","division":"PRODUCTION","hit_factor":3.5755},{"match_name":"GCL June 3-2017","match_date":"2017-06-03","stage_classifiercode":"99-16","member_number":"PEN","first_name":"MICHAEL","last_name":"WORBOYS","classification":"U","division":"PRODUCTION","hit_factor":3.5736},{"match_name":"Cameo USPSA Match March 20 2021","match_date":"2021-03-20","stage_classifiercode":"99-16","member_number":"A120478","first_name":"NATHAN","last_name":"ADAMS","classification":"D","division":"PRODUCTION","hit_factor":3.5714},{"match_name":"ENPS March 2017 USPSA Match","match_date":"2017-03-05","stage_classifiercode":"99-16","member_number":"TY95959","first_name":"RODNEY","last_name":"STUART","classification":"U","division":"PRODUCTION","hit_factor":3.5631},{"match_name":"DWB - Deadwood Boys USPSA 20 May 2018","match_date":"2018-05-20","stage_classifiercode":"99-16","member_number":"A107369","first_name":"ROD","last_name":"RADOVANOVIC","classification":"B","division":"PRODUCTION","hit_factor":3.5573},{"match_name":"USPSA MO21 Special Classifier 2Alpha SBRC February 27 2021","match_date":"2021-02-27","stage_classifiercode":"99-16","member_number":"A114202","first_name":"AARON","last_name":"KOHLER","classification":"C","division":"PRODUCTION","hit_factor":3.5569},{"match_name":"FLPSA MN14 USPSA May 17 2018","match_date":"2018-05-17","stage_classifiercode":"99-16","member_number":"a111099","first_name":"LOGAN","last_name":"TOLAND","classification":"U","division":"PRODUCTION","hit_factor":3.5461},{"match_name":"Pima Pistol Club USPSA Match - May 29 ","match_date":"2016-05-29","stage_classifiercode":"99-16","member_number":"A96529","first_name":"JONATHAN","last_name":"NAGY","classification":"Unclassified","division":"PRODUCTION","hit_factor":3.5391},{"match_name":"GCL Wed 5-31-17","match_date":"2017-05-31","stage_classifiercode":"99-16","member_number":"PEN","first_name":"TOM","last_name":"WOOD","classification":"U","division":"PRODUCTION","hit_factor":3.5387},{"match_name":"Pima Pistol Club USPSA Match - May 29 ","match_date":"2016-05-29","stage_classifiercode":"99-16","member_number":"A88974","first_name":"JUSTIN","last_name":"SMITH","classification":"B","division":"PRODUCTION","hit_factor":3.5358},{"match_name":"SPSA USPSA December 1st Sat Match","match_date":"2016-12-03","stage_classifiercode":"99-16","member_number":"A79299","first_name":"ED","last_name":"ROTHSCHILD","classification":"C","division":"PRODUCTION","hit_factor":3.5354},{"match_name":"ENPS March 2017 USPSA Match","match_date":"2017-03-05","stage_classifiercode":"99-16","member_number":"TY87567","first_name":"DOUGLAS","last_name":"TERRY","classification":"C","division":"PRODUCTION","hit_factor":3.5329},{"match_name":"TPS USPSA -  January 2017 - Talon Range","match_date":"2017-01-07","stage_classifiercode":"99-16","member_number":"A95350","first_name":"ERIC","last_name":"PERKINS","classification":"C","division":"PRODUCTION","hit_factor":3.5323},{"match_name":"SPSA USPSA December 1st Sat Match","match_date":"2016-12-03","stage_classifiercode":"99-16","member_number":"A78787","first_name":"RODNEY","last_name":"ROBINSON","classification":"B","division":"PRODUCTION","hit_factor":3.5282},{"match_name":"Shadow Hawk Defense USPSA Special Classifier","match_date":"2020-11-14","stage_classifiercode":"99-16","member_number":"A85783","first_name":"MATTHEW","last_name":"WEILMUENSTER","classification":"U","division":"PRODUCTION","hit_factor":3.5163},{"match_name":"GCL June 3-2017","match_date":"2017-06-03","stage_classifiercode":"99-16","member_number":"PEN","first_name":"SCOTT","last_name":"STEVENS","classification":"U","division":"PRODUCTION","hit_factor":3.5088},{"match_name":"SFA USPSA March 2017","match_date":"2017-03-18","stage_classifiercode":"99-16","member_number":"A95121","first_name":"WENDY","last_name":"DUROS","classification":"D","division":"PRODUCTION","hit_factor":3.5065},{"match_name":"Pinetucky USPSA 02-27-16","match_date":"2016-02-27","stage_classifiercode":"99-16","member_number":"A90844","first_name":"WES","last_name":"DOLLAR","classification":"B","division":"PRODUCTION","hit_factor":3.5019},{"match_name":"Dundee USPSA Mar 2017","match_date":"2017-03-25","stage_classifiercode":"99-16","member_number":"A86707","first_name":"SETH","last_name":"SCHNEIDER","classification":"U","division":"PRODUCTION","hit_factor":3.4985},{"match_name":"Grandbaggers 07/2017","match_date":"2017-07-06","stage_classifiercode":"99-16","member_number":"TY62896","first_name":"JAY","last_name":"DEMPSEY","classification":"B","division":"PRODUCTION","hit_factor":3.4949},{"match_name":"BSPSC 2018 August Special Classifier","match_date":"2018-08-12","stage_classifiercode":"99-16","member_number":"A113292","first_name":"MIKE","last_name":"VANDAM","classification":"U","division":"PRODUCTION","hit_factor":3.4934},{"match_name":"PIPS 07-25-2018","match_date":"2018-07-25","stage_classifiercode":"99-16","member_number":"A112644","first_name":"DEE","last_name":"HAMLIN","classification":"U","division":"PRODUCTION","hit_factor":3.4919},{"match_name":"FLPSA MN14 USPSA May 17 2018","match_date":"2018-05-17","stage_classifiercode":"99-16","member_number":"Ty95926","first_name":"BUG","last_name":"SCHRADER","classification":"C","division":"PRODUCTION","hit_factor":3.491},{"match_name":"SFA USPSA March 2017","match_date":"2017-03-18","stage_classifiercode":"99-16","member_number":"A99017","first_name":"GUY","last_name":"CUNNINGHAM","classification":"C","division":"PRODUCTION","hit_factor":3.4871},{"match_name":"DWB - Deadwood Boys USPSA 20 May 2018","match_date":"2018-05-20","stage_classifiercode":"99-16","member_number":"\"\"","first_name":"JED","last_name":"MARDESICH","classification":"U","division":"PRODUCTION","hit_factor":3.4831},{"match_name":"SPSA USPSA December 1st Sat Match","match_date":"2016-12-03","stage_classifiercode":"99-16","member_number":"TY86022","first_name":"BRIAN","last_name":"SHOPE","classification":"A","division":"PRODUCTION","hit_factor":3.4819},{"match_name":"WLPS USPSA Sep 2016","match_date":"2016-09-25","stage_classifiercode":"99-16","member_number":"TY55423","first_name":"BRUCE","last_name":"GUITHER","classification":"C","division":"PRODUCTION","hit_factor":3.4682},{"match_name":"CRC_20160514_SuperClassifier","match_date":"2016-05-14","stage_classifiercode":"99-16","member_number":"PEN","first_name":"MAUGED","last_name":"MISSIHA","classification":"U","division":"PRODUCTION","hit_factor":3.4625},{"match_name":"DAP December 2015 Classifier match","match_date":"2015-12-12","stage_classifiercode":"99-16","member_number":"FY86066","first_name":"JULES","last_name":"VANFAU","classification":"D","division":"PRODUCTION","hit_factor":3.4597},{"match_name":"PIPS 05-25-2016","match_date":"2016-05-24","stage_classifiercode":"99-16","member_number":"PEN","first_name":"CHAD","last_name":"NIEMANN","classification":"U","division":"PRODUCTION","hit_factor":3.4582},{"match_name":"LCSC USPSA 01.14.18","match_date":"2018-01-13","stage_classifiercode":"99-16","member_number":"A103501","first_name":"DERRICK","last_name":"DECKER","classification":"D","division":"PRODUCTION","hit_factor":3.4554},{"match_name":"Hosemasters 2nd Sunday May 2017","match_date":"2017-05-14","stage_classifiercode":"99-16","member_number":"A83435","first_name":"IRWIN","last_name":"DAUGHERTY","classification":"C","division":"PRODUCTION","hit_factor":3.4506},{"match_name":"AIPS Weekly USPSA 3 August 2021","match_date":"2021-08-03","stage_classifiercode":"99-16","member_number":"TY121982","first_name":"BOB","last_name":"CAMPBELL","classification":"D","division":"PRODUCTION","hit_factor":3.4459},{"match_name":"Pelham USPSA 2017-08-20","match_date":"2017-08-20","stage_classifiercode":"99-16","member_number":"TY18014","first_name":"JOHN","last_name":"KRYGOWSKI","classification":"C","division":"PRODUCTION","hit_factor":3.4454},{"match_name":"ARPC USPSA Match 7-26-20","match_date":"2020-07-26","stage_classifiercode":"99-16","member_number":"A122087","first_name":"GREGORY","last_name":"ABBASS","classification":"C","division":"PRODUCTION","hit_factor":3.4428},{"match_name":"SFA USPSA March 2017","match_date":"2017-03-18","stage_classifiercode":"99-16","member_number":"\"\"","first_name":"JONATHON","last_name":"MCLEOD","classification":"U","division":"PRODUCTION","hit_factor":3.429},{"match_name":"GCL June 3-2017","match_date":"2017-06-03","stage_classifiercode":"99-16","member_number":"A98616","first_name":"RIC","last_name":"BAUSERMAN","classification":"U","division":"PRODUCTION","hit_factor":3.4286},{"match_name":"Pelham USPSA 2017-08-20","match_date":"2017-08-20","stage_classifiercode":"99-16","member_number":"A97999","first_name":"MIC","last_name":"KANE","classification":"D","division":"PRODUCTION","hit_factor":3.4164},{"match_name":"OREGON ARPC CC05 USPSA Jan 14 2017","match_date":"2017-01-14","stage_classifiercode":"99-16","member_number":"A93744","first_name":"WARREN","last_name":"HENCH","classification":"C","division":"PRODUCTION","hit_factor":3.4143},{"match_name":"Shadow Hawk Defense USPSA Special Classifier","match_date":"2020-11-14","stage_classifiercode":"99-16","member_number":"L4322","first_name":"LEONEL","last_name":"TELLER","classification":"U","division":"PRODUCTION","hit_factor":3.407},{"match_name":"Pima Pistol Club USPSA Match - May 29 ","match_date":"2016-05-29","stage_classifiercode":"99-16","member_number":"TY79864","first_name":"ANN","last_name":"HUNTINGTON","classification":"C","division":"PRODUCTION","hit_factor":3.3927},{"match_name":"LdF USPSA Match September 23 2017","match_date":"2017-09-23","stage_classifiercode":"99-16","member_number":"A101894","first_name":"CHASE","last_name":"MAY","classification":"B","division":"PRODUCTION","hit_factor":3.3875},{"match_name":"GCL Wed 5-31-17","match_date":"2017-05-31","stage_classifiercode":"99-16","member_number":"PENDING","first_name":"TONY","last_name":"CENZI","classification":"U","division":"PRODUCTION","hit_factor":3.385},{"match_name":"USPSA MO21 Special Classifier 2Alpha SBRC February 27 2021","match_date":"2021-02-27","stage_classifiercode":"99-16","member_number":"A111008","first_name":"CODY","last_name":"SHERMAN","classification":"B","division":"PRODUCTION","hit_factor":3.3846},{"match_name":"Bass River USPSA September 2018","match_date":"2018-09-02","stage_classifiercode":"99-16","member_number":"\"\"","first_name":"DAVID","last_name":"GUILLEMETTE","classification":"\"\"","division":"PRODUCTION","hit_factor":3.365},{"match_name":"Shadow Hawk Defense USPSA Special Classifier","match_date":"2020-11-14","stage_classifiercode":"99-16","member_number":"A128593","first_name":"PAUL","last_name":"STRAWDERMAN","classification":"U","division":"PRODUCTION","hit_factor":3.3548},{"match_name":"ARPC USPSA Match 3-26-17","match_date":"2017-03-26","stage_classifiercode":"99-16","member_number":"TY84507","first_name":"ANDREA","last_name":"LAWRENCE","classification":"D","division":"PRODUCTION","hit_factor":3.352},{"match_name":"Bass River USPSA September 2018","match_date":"2018-09-02","stage_classifiercode":"99-16","member_number":"ty84608","first_name":"GORDON","last_name":"FRASER","classification":"D","division":"PRODUCTION","hit_factor":3.3413},{"match_name":"Nampa USPSA May 27th 2020 Classifier Match","match_date":"2020-05-27","stage_classifiercode":"99-16","member_number":"A2486","first_name":"PAUL","last_name":"KACZMAREK","classification":"C","division":"PRODUCTION","hit_factor":3.3375},{"match_name":"LdF USPSA Match September 23 2017","match_date":"2017-09-23","stage_classifiercode":"99-16","member_number":"PENDING","first_name":"RYAN","last_name":"TUAZON","classification":"U","division":"PRODUCTION","hit_factor":3.3365},{"match_name":"CRC_20160514_SuperClassifier","match_date":"2016-05-14","stage_classifiercode":"99-16","member_number":"A87980","first_name":"MICHAEL","last_name":"CROSBY","classification":"U","division":"PRODUCTION","hit_factor":3.3363},{"match_name":"2da Copa Nacional USPSA ","match_date":"2016-05-22","stage_classifiercode":"99-16","member_number":"F88165","first_name":"JORGE","last_name":"CLAUDIO  SNCHEZ","classification":"C","division":"PRODUCTION","hit_factor":3.33},{"match_name":"Pima Pistol Club USPSA Match - May 29 ","match_date":"2016-05-29","stage_classifiercode":"99-16","member_number":"A96299","first_name":"JOSHUA","last_name":"MURCHIE","classification":"Unclassified","division":"PRODUCTION","hit_factor":3.3231},{"match_name":"HRC Jul 08 2017","match_date":"2017-07-07","stage_classifiercode":"99-16","member_number":"\"\"","first_name":"DAN","last_name":"JONES","classification":"U","division":"PRODUCTION","hit_factor":3.3172},{"match_name":"CRC_20160514_SuperClassifier","match_date":"2016-05-14","stage_classifiercode":"99-16","member_number":"A91017","first_name":"JON","last_name":"MANNA","classification":"C","division":"PRODUCTION","hit_factor":3.3079},{"match_name":"CCPS March 2018 USPSA","match_date":"2018-03-18","stage_classifiercode":"99-16","member_number":"A109103","first_name":"CAYLA","last_name":"DA GIAU","classification":"U","division":"PRODUCTION","hit_factor":3.3058},{"match_name":"Hernando Sportsmans Club","match_date":"2017-02-12","stage_classifiercode":"99-16","member_number":"TY36511","first_name":"TOM","last_name":"SKUSE","classification":"C","division":"PRODUCTION","hit_factor":3.3003},{"match_name":"USPSA Bass River April 2017","match_date":"2017-04-02","stage_classifiercode":"99-16","member_number":"TY82689","first_name":"SCOTTY","last_name":"MCIVER","classification":"\"\"","division":"PRODUCTION","hit_factor":3.2864},{"match_name":"Rio Grande Practical Shooters - May 2018","match_date":"2018-05-05","stage_classifiercode":"99-16","member_number":"A93205","first_name":"SEAN","last_name":"MALLORY","classification":"U","division":"PRODUCTION","hit_factor":3.2804},{"match_name":"ENPS March 2017 USPSA Match","match_date":"2017-03-05","stage_classifiercode":"99-16","member_number":"PEN","first_name":"WARREN","last_name":"HARBIN","classification":"U","division":"PRODUCTION","hit_factor":3.2744},{"match_name":"Dundee USPSA Mar 2017","match_date":"2017-03-25","stage_classifiercode":"99-16","member_number":"A94976","first_name":"JOHN","last_name":"LONG","classification":"D","division":"PRODUCTION","hit_factor":3.2727},{"match_name":"TPS USPSA -  April 2018 Clone","match_date":"2018-04-08","stage_classifiercode":"99-16","member_number":"a99941","first_name":"LEONARD","last_name":"ZEILER","classification":"D","division":"PRODUCTION","hit_factor":3.2401},{"match_name":"ORSA USPSA August 2020","match_date":"2020-08-15","stage_classifiercode":"99-16","member_number":"A129843","first_name":"NOAH","last_name":"CLARK","classification":"U","division":"PRODUCTION","hit_factor":3.2399},{"match_name":"HRC Jul 08 2017","match_date":"2017-07-07","stage_classifiercode":"99-16","member_number":"\"\"","first_name":"BILL","last_name":"VANWAGNER","classification":"U","division":"PRODUCTION","hit_factor":3.2384},{"match_name":"CRC_20160514_SuperClassifier","match_date":"2016-05-14","stage_classifiercode":"99-16","member_number":"A95538","first_name":"BRUCE","last_name":"WADDLE","classification":"D","division":"PRODUCTION","hit_factor":3.2345},{"match_name":"GCL June 3-2017","match_date":"2017-06-03","stage_classifiercode":"99-16","member_number":"TY70159","first_name":"JIM","last_name":"CULBERTSON","classification":"C","division":"PRODUCTION","hit_factor":3.2258},{"match_name":"TPS USPSA -  January 2017 - Talon Range","match_date":"2017-01-07","stage_classifiercode":"99-16","member_number":"a97654","first_name":"ADAM","last_name":"ORY","classification":"U","division":"PRODUCTION","hit_factor":3.2228},{"match_name":"Maine Practical Shooters May 2017","match_date":"2017-05-13","stage_classifiercode":"99-16","member_number":"\"\"","first_name":"BRITT","last_name":"ANDREWS","classification":"\"\"","division":"PRODUCTION","hit_factor":3.2218},{"match_name":"APSC USPSA Match 1-6-18","match_date":"2018-01-06","stage_classifiercode":"99-16","member_number":"A103542","first_name":"ZACK","last_name":"DARWIN","classification":"B","division":"PRODUCTION","hit_factor":3.1938},{"match_name":"2da Copa Nacional USPSA ","match_date":"2016-05-22","stage_classifiercode":"99-16","member_number":"A91054","first_name":"WILBERTO","last_name":"ALAMO","classification":"D","division":"PRODUCTION","hit_factor":3.1932},{"match_name":"Shongum April 2016 Pistol Match","match_date":"2016-04-02","stage_classifiercode":"99-16","member_number":"\"\"","first_name":"BEN","last_name":"ADAMS","classification":"U","division":"PRODUCTION","hit_factor":3.193},{"match_name":"PCWC USPSA  1 28 17","match_date":"2017-01-28","stage_classifiercode":"99-16","member_number":"a97909","first_name":"MICHAEL","last_name":"OBRIAN","classification":"U","division":"PRODUCTION","hit_factor":3.1843},{"match_name":"4ta Fecha USPSA","match_date":"2018-04-07","stage_classifiercode":"99-16","member_number":"\"\"","first_name":"MIGUEL A.","last_name":"VAZQUEZ-VARGAS","classification":"U","division":"PRODUCTION","hit_factor":3.1826},{"match_name":"MS06 Team Magnolia USPSA January Match2","match_date":"2016-01-03","stage_classifiercode":"99-16","member_number":"A80805","first_name":"JANA","last_name":"SUTTON","classification":"D","division":"PRODUCTION","hit_factor":3.1804},{"match_name":"CCPS March 2018 USPSA","match_date":"2018-03-18","stage_classifiercode":"99-16","member_number":"FY81556","first_name":"BRAD","last_name":"PACEY","classification":"B","division":"PRODUCTION","hit_factor":3.1734},{"match_name":"MS06 Team Magnolia USPSA January Match2","match_date":"2016-01-03","stage_classifiercode":"99-16","member_number":"A86101","first_name":"BERNIE","last_name":"RHINES","classification":"U","division":"PRODUCTION","hit_factor":3.1592},{"match_name":"ENPS March 2017 USPSA Match","match_date":"2017-03-05","stage_classifiercode":"99-16","member_number":"PEN","first_name":"ANDY","last_name":"GOODENBERGER","classification":"U","division":"PRODUCTION","hit_factor":3.1532},{"match_name":"Shasta Shooters 2020 Dec","match_date":"2020-12-12","stage_classifiercode":"99-16","member_number":"A125878","first_name":"HARLEY-GRACE","last_name":"ALLEY","classification":"D","division":"PRODUCTION","hit_factor":3.1532},{"match_name":"Pelham USPSA 2017-08-20","match_date":"2017-08-20","stage_classifiercode":"99-16","member_number":"TY91772","first_name":"LORI","last_name":"BADURA","classification":"D","division":"PRODUCTION","hit_factor":3.1526},{"match_name":"USPSA-AB 2018-14 at Brooks Pistol Club -adhoc","match_date":"2018-08-08","stage_classifiercode":"99-16","member_number":"F108681","first_name":"DON","last_name":"SERRANO","classification":"C","division":"PRODUCTION","hit_factor":3.1429},{"match_name":"OREGON ARPC CC05 USPSA Jan 14 2017","match_date":"2017-01-14","stage_classifiercode":"99-16","member_number":"PEN","first_name":"PAUL","last_name":"JOHNSON","classification":"U","division":"PRODUCTION","hit_factor":3.1414},{"match_name":"CRC_20160514_SuperClassifier","match_date":"2016-05-14","stage_classifiercode":"99-16","member_number":"A95538","first_name":"BRUCE","last_name":"WADDLE","classification":"D","division":"PRODUCTION","hit_factor":3.1401},{"match_name":"CRC_20160514_SuperClassifier","match_date":"2016-05-14","stage_classifiercode":"99-16","member_number":"A70296","first_name":"DANE","last_name":"HARRIS","classification":"C","division":"PRODUCTION","hit_factor":3.1128},{"match_name":"SFA USPSA March 2017","match_date":"2017-03-18","stage_classifiercode":"99-16","member_number":"TY14807","first_name":"KEN","last_name":"JOHNSON","classification":"C","division":"PRODUCTION","hit_factor":3.0957},{"match_name":"GCL June 3-2017","match_date":"2017-06-03","stage_classifiercode":"99-16","member_number":"A79891","first_name":"BRENT","last_name":"WEICHT","classification":"U","division":"PRODUCTION","hit_factor":3.0897},{"match_name":"Superior Practical Shooters - March Match","match_date":"2017-03-01","stage_classifiercode":"99-16","member_number":"A-100203","first_name":"SANDRA","last_name":"HARRINGTON","classification":"U","division":"PRODUCTION","hit_factor":3.0691},{"match_name":"RBGC 2017-10-21","match_date":"2017-10-21","stage_classifiercode":"99-16","member_number":"A105906","first_name":"JASON","last_name":"KNIGHT","classification":"U","division":"PRODUCTION","hit_factor":3.0655},{"match_name":"SPSA USPSA December 1st Sat Match","match_date":"2016-12-03","stage_classifiercode":"99-16","member_number":"TY28632","first_name":"HERB","last_name":"JENSEN","classification":"C","division":"PRODUCTION","hit_factor":3.0618},{"match_name":"HRC Jul 08 2017","match_date":"2017-07-07","stage_classifiercode":"99-16","member_number":"\"\"","first_name":"JAY","last_name":"PARNELL","classification":"U","division":"PRODUCTION","hit_factor":3.0612},{"match_name":"Nampa USPSA May 27th 2020 Classifier Match","match_date":"2020-05-27","stage_classifiercode":"99-16","member_number":"fy81838","first_name":"JIM","last_name":"PARKER","classification":"U","division":"PRODUCTION","hit_factor":3.0579},{"match_name":"CRC_20160514_SuperClassifier","match_date":"2016-05-14","stage_classifiercode":"99-16","member_number":"TY81342","first_name":"JIM","last_name":"WAUGH","classification":"C","division":"PRODUCTION","hit_factor":3.0524},{"match_name":"LCSC USPSA 01.14.18","match_date":"2018-01-13","stage_classifiercode":"99-16","member_number":"A107037","first_name":"JOAHUA","last_name":"ALBERTSON","classification":"\"\"","division":"PRODUCTION","hit_factor":3.0378},{"match_name":"DAP December 2015 Classifier match","match_date":"2015-12-12","stage_classifiercode":"99-16","member_number":"A93937","first_name":"DAVID","last_name":"DEAMICIS","classification":"none","division":"PRODUCTION","hit_factor":3.0371},{"match_name":"DWB - Deadwood Boys USPSA 20 May 2018","match_date":"2018-05-20","stage_classifiercode":"99-16","member_number":"A108993","first_name":"RAYMOND","last_name":"BARRIOS","classification":"U","division":"PRODUCTION","hit_factor":3.0359},{"match_name":"FLPSA MN14 USPSA May 17 2018","match_date":"2018-05-17","stage_classifiercode":"99-16","member_number":"a106134","first_name":"ALAN","last_name":"JOHNSON","classification":"U","division":"PRODUCTION","hit_factor":3.0172},{"match_name":"Idaho ISPS August 5th Break from the Heat","match_date":"2017-08-05","stage_classifiercode":"99-16","member_number":"A98645","first_name":"JIM","last_name":"BUXTON","classification":"U","division":"PRODUCTION","hit_factor":3.0168},{"match_name":"CRC_20160514_SuperClassifier","match_date":"2016-05-14","stage_classifiercode":"99-16","member_number":"\"\"","first_name":"ANDRES","last_name":"PENA","classification":"U","division":"PRODUCTION","hit_factor":3.0012},{"match_name":"Shadow Hawk Defense USPSA Special Classifier","match_date":"2020-11-14","stage_classifiercode":"99-16","member_number":"A107527","first_name":"HUGGY","last_name":"BEAR","classification":"U","division":"PRODUCTION","hit_factor":3.0008},{"match_name":"APSC USPSA Match 1-6-18","match_date":"2018-01-06","stage_classifiercode":"99-16","member_number":"A79268","first_name":"JACK","last_name":"REYNOLDS","classification":"C","division":"PRODUCTION","hit_factor":2.9986},{"match_name":"PIPS 07-25-2018","match_date":"2018-07-25","stage_classifiercode":"99-16","member_number":"A92109","first_name":"HENRY","last_name":"HOCRAFFER","classification":"D","division":"PRODUCTION","hit_factor":2.9971},{"match_name":"DWB - Deadwood Boys USPSA 20 May 2018","match_date":"2018-05-20","stage_classifiercode":"99-16","member_number":"a106220","first_name":"GREG","last_name":"RODA","classification":"G","division":"PRODUCTION","hit_factor":2.9946},{"match_name":"LCSC USPSA 01.14.18","match_date":"2018-01-13","stage_classifiercode":"99-16","member_number":"A105966","first_name":"MICHAEL","last_name":"VITRO","classification":"U","division":"PRODUCTION","hit_factor":2.9895},{"match_name":"TPS USPSA -  April 2018 Clone","match_date":"2018-04-08","stage_classifiercode":"99-16","member_number":"\"\"","first_name":"KEITH","last_name":"IVEY","classification":"U","division":"PRODUCTION","hit_factor":2.9832},{"match_name":"DWB - Deadwood Boys USPSA 20 May 2018","match_date":"2018-05-20","stage_classifiercode":"99-16","member_number":"\"\"","first_name":"JONATHAN","last_name":"CHAN","classification":"U","division":"PRODUCTION","hit_factor":2.9815},{"match_name":"CCPL 02-09-2020","match_date":"2020-02-09","stage_classifiercode":"99-16","member_number":"A107773","first_name":"JAMES","last_name":"THORNBURGH","classification":"C","division":"PRODUCTION","hit_factor":2.975},{"match_name":"TPS USPSA -  April 2018 Clone","match_date":"2018-04-08","stage_classifiercode":"99-16","member_number":"\"\"","first_name":"RICHARD","last_name":"LIGHTSEY","classification":"A","division":"PRODUCTION","hit_factor":2.9727},{"match_name":"WLPS June 2017","match_date":"2017-06-25","stage_classifiercode":"99-16","member_number":"A103197","first_name":"CHAD","last_name":"ALLRED","classification":"D","division":"PRODUCTION","hit_factor":2.963},{"match_name":"LdF USPSA Match September 23 2017","match_date":"2017-09-23","stage_classifiercode":"99-16","member_number":"A92544","first_name":"DEBBIE","last_name":"PAPS","classification":"U","division":"PRODUCTION","hit_factor":2.9611},{"match_name":"BSPSC 2018 August Special Classifier","match_date":"2018-08-12","stage_classifiercode":"99-16","member_number":"A113085","first_name":"ERIN","last_name":"HARAPAT","classification":"U","division":"PRODUCTION","hit_factor":2.9536},{"match_name":"PCWC USPSA  1 28 17","match_date":"2017-01-28","stage_classifiercode":"99-16","member_number":"A-95951","first_name":"JUSTIN","last_name":"SMITH","classification":"C","division":"PRODUCTION","hit_factor":2.9356},{"match_name":"MSSA Uspsa Club Matcg","match_date":"2017-09-24","stage_classifiercode":"99-16","member_number":"\"\"","first_name":"MARK","last_name":"CHRISTOPHER","classification":"U","division":"PRODUCTION","hit_factor":2.9335},{"match_name":"Cameo USPSA Match March 20 2021","match_date":"2021-03-20","stage_classifiercode":"99-16","member_number":"A118215","first_name":"TAMMY","last_name":"SMITH","classification":"C","division":"PRODUCTION","hit_factor":2.9323},{"match_name":"USPSA Bass River April 2017","match_date":"2017-04-02","stage_classifiercode":"99-16","member_number":"\"\"","first_name":"MARK","last_name":"NORRIS","classification":"\"\"","division":"PRODUCTION","hit_factor":2.9172},{"match_name":"APSC USPSA Match 1-6-18","match_date":"2018-01-06","stage_classifiercode":"99-16","member_number":"A59209","first_name":"KIRBY","last_name":"CULP","classification":"C","division":"PRODUCTION","hit_factor":2.9107},{"match_name":"TPS USPSA -  April 2018 Clone","match_date":"2018-04-08","stage_classifiercode":"99-16","member_number":"\"\"","first_name":"CLAY","last_name":"ROBERTS","classification":"D","division":"PRODUCTION","hit_factor":2.9083},{"match_name":"SWGC USPSA Pistol Match - December","match_date":"2016-12-03","stage_classifiercode":"99-16","member_number":"A91376","first_name":"DENNIS","last_name":"PHILLIPS","classification":"U","division":"PRODUCTION","hit_factor":2.9022},{"match_name":"4ta Fecha USPSA","match_date":"2018-04-07","stage_classifiercode":"99-16","member_number":"\"\"","first_name":"ROLY","last_name":"FALGUERAS-MEDERO","classification":"U","division":"PRODUCTION","hit_factor":2.8896},{"match_name":"DWB - Deadwood Boys USPSA 20 May 2018","match_date":"2018-05-20","stage_classifiercode":"99-16","member_number":"a108083","first_name":"RYAN","last_name":"YAMASHIRO","classification":"G","division":"PRODUCTION","hit_factor":2.889},{"match_name":"GCL June 3-2017","match_date":"2017-06-03","stage_classifiercode":"99-16","member_number":"PEN","first_name":"TOM","last_name":"DIPIAZZA JR","classification":"U","division":"PRODUCTION","hit_factor":2.8674},{"match_name":"DAP December 2015 Classifier match","match_date":"2015-12-12","stage_classifiercode":"99-16","member_number":"A82878","first_name":"RICHARD","last_name":"WILLIAMS","classification":"C","division":"PRODUCTION","hit_factor":2.8618},{"match_name":"5 August - USPSA match - 17 South PSC","match_date":"2017-08-05","stage_classifiercode":"99-16","member_number":"\"\"","first_name":"DANNY","last_name":"PUGHSLEY","classification":"M","division":"PRODUCTION","hit_factor":2.8613},{"match_name":"SWGC USPSA Pistol Match - December","match_date":"2016-12-03","stage_classifiercode":"99-16","member_number":"\"\"","first_name":"DAN","last_name":"NOSBUSCH","classification":"U","division":"PRODUCTION","hit_factor":2.8509},{"match_name":"Hernando Sportsmans Club","match_date":"2017-02-12","stage_classifiercode":"99-16","member_number":"\"\"","first_name":"DAVID","last_name":"ROGERS","classification":"U","division":"PRODUCTION","hit_factor":2.8326},{"match_name":"West Liberty USPSA Oct 2018","match_date":"2018-10-28","stage_classifiercode":"99-16","member_number":"TY95875","first_name":"SEAN","last_name":"MCMANN","classification":"C","division":"PRODUCTION","hit_factor":2.8325},{"match_name":"AVAP CLASSIFIER 71418","match_date":"2018-07-14","stage_classifiercode":"99-16","member_number":"A109187","first_name":"NANCY","last_name":"LAM","classification":"D","division":"PRODUCTION","hit_factor":2.8314},{"match_name":"LGCSEMPS September 2017 Handgun","match_date":"2017-09-10","stage_classifiercode":"99-16","member_number":"TY42867","first_name":"LAWRENCE","last_name":"MILLER","classification":"U","division":"PRODUCTION","hit_factor":2.8302},{"match_name":"RCPS USPSA Sep 11","match_date":"2021-09-11","stage_classifiercode":"99-16","member_number":"TY132453","first_name":"JEFF","last_name":"TESTMAN","classification":"","division":"PRODUCTION","hit_factor":2.8281},{"match_name":"GCL Wed 5-31-17","match_date":"2017-05-31","stage_classifiercode":"99-16","member_number":"PEN","first_name":"MICHAEL","last_name":"WORBOYS","classification":"U","division":"PRODUCTION","hit_factor":2.8261},{"match_name":"SWGC USPSA Pistol Match - December","match_date":"2016-12-03","stage_classifiercode":"99-16","member_number":"a63664","first_name":"STEVE","last_name":"WILLIAMS","classification":"B","division":"PRODUCTION","hit_factor":2.8249},{"match_name":"CIPSC Havana July USPSA","match_date":"2018-07-07","stage_classifiercode":"99-16","member_number":"A105858","first_name":"SCOTT","last_name":"HOECKER","classification":"C","division":"PRODUCTION","hit_factor":2.8079710144928},{"match_name":"Bass River USPSA September 2018","match_date":"2018-09-02","stage_classifiercode":"99-16","member_number":"TY82689","first_name":"SCOTTY","last_name":"MCIVER","classification":"\"\"","division":"PRODUCTION","hit_factor":2.8077},{"match_name":"WLPS June 2017","match_date":"2017-06-25","stage_classifiercode":"99-16","member_number":"TY90436","first_name":"JIM","last_name":"ALVAREZ","classification":"B","division":"PRODUCTION","hit_factor":2.7979},{"match_name":"LCSC USPSA 01.14.18","match_date":"2018-01-13","stage_classifiercode":"99-16","member_number":"A107396","first_name":"JACK","last_name":"WILLIAMSON","classification":"U","division":"PRODUCTION","hit_factor":2.7946},{"match_name":"CRC_20160514_SuperClassifier","match_date":"2016-05-14","stage_classifiercode":"99-16","member_number":"A95219","first_name":"LUKE","last_name":"POOLE","classification":"U","division":"PRODUCTION","hit_factor":2.7933},{"match_name":"NCPL 2016 July","match_date":"2016-07-31","stage_classifiercode":"99-16","member_number":"\"\"","first_name":"VINCE","last_name":"CERIANI","classification":"U","division":"PRODUCTION","hit_factor":2.7688},{"match_name":"Shongum December 2017 USPSA Match","match_date":"2017-12-02","stage_classifiercode":"99-16","member_number":"\"\"","first_name":"JOE","last_name":"LI","classification":"U","division":"PRODUCTION","hit_factor":2.7599},{"match_name":"CCPS March 2018 USPSA","match_date":"2018-03-18","stage_classifiercode":"99-16","member_number":"\"\"","first_name":"HUNTER","last_name":"WILLARD","classification":"U","division":"PRODUCTION","hit_factor":2.7592},{"match_name":"MVS ANPRACS Classifier Match 6/3/17","match_date":"2017-05-31","stage_classifiercode":"99-16","member_number":"\"\"","first_name":"ZACH","last_name":"EUNICE","classification":"U","division":"PRODUCTION","hit_factor":2.754},{"match_name":"SFPS 10-08-2017 USPSA match","match_date":"2017-10-08","stage_classifiercode":"99-16","member_number":"PEN","first_name":"NEAL","last_name":"BENALLY","classification":"U","division":"PRODUCTION","hit_factor":2.7491},{"match_name":"Hosemasters 2nd Sunday May 2017","match_date":"2017-05-14","stage_classifiercode":"99-16","member_number":"FY90171","first_name":"PETE","last_name":"UNDLIN","classification":"A","division":"PRODUCTION","hit_factor":2.7417},{"match_name":"LGCSEMPS September 2017 Handgun","match_date":"2017-09-10","stage_classifiercode":"99-16","member_number":"A104524","first_name":"SHAWNA","last_name":"SNOW","classification":"U","division":"PRODUCTION","hit_factor":2.7273},{"match_name":"4ta Fecha USPSA","match_date":"2018-04-07","stage_classifiercode":"99-16","member_number":"A95283","first_name":"JADE","last_name":"OSORIO","classification":"C","division":"PRODUCTION","hit_factor":2.7206},{"match_name":"USPSA Bass River April 2017","match_date":"2017-04-02","stage_classifiercode":"99-16","member_number":"A101971","first_name":"BRANDON","last_name":"BOUCHARD","classification":"\"\"","division":"PRODUCTION","hit_factor":2.7188},{"match_name":"MCPSL Pistol 10-9-2021","match_date":"2021-10-09","stage_classifiercode":"99-16","member_number":"A135406","first_name":"BRETT","last_name":"HAMMOND","classification":"D","division":"PRODUCTION","hit_factor":2.7183},{"match_name":"ORSA USPSA August 2020","match_date":"2020-08-15","stage_classifiercode":"99-16","member_number":"A125128","first_name":"CRAIG","last_name":"MOSS","classification":"C","division":"PRODUCTION","hit_factor":2.717},{"match_name":"Renton USPSA - August 2020 - NW05","match_date":"2020-08-23","stage_classifiercode":"99-16","member_number":"A120199","first_name":"AUSTIN","last_name":"POST","classification":"C","division":"PRODUCTION","hit_factor":2.7136},{"match_name":"LGCSEMPS September 2017 Handgun","match_date":"2017-09-10","stage_classifiercode":"99-16","member_number":"TY93617","first_name":"NATHAN","last_name":"BAKER","classification":"U","division":"PRODUCTION","hit_factor":2.7091},{"match_name":"PIPS 05-25-2016","match_date":"2016-05-24","stage_classifiercode":"99-16","member_number":"A52641","first_name":"GERALD","last_name":"JOHNSON","classification":"D","division":"PRODUCTION","hit_factor":2.7055},{"match_name":"Pelham USPSA 2017-08-20","match_date":"2017-08-20","stage_classifiercode":"99-16","member_number":"\"\"","first_name":"SEAN","last_name":"COLEGROVE","classification":"Unclassified","division":"PRODUCTION","hit_factor":2.7027},{"match_name":"Briar Rabbit  June Match 2016 OH 20","match_date":"2016-06-12","stage_classifiercode":"99-16","member_number":"A15400","first_name":"ROBERT","last_name":"MELICK","classification":"C","division":"PRODUCTION","hit_factor":2.6994},{"match_name":"2da Copa Nacional USPSA ","match_date":"2016-05-22","stage_classifiercode":"99-16","member_number":"A90765","first_name":"HEBER","last_name":"SOTO","classification":"U","division":"PRODUCTION","hit_factor":2.6895},{"match_name":"CIPSC Havana July USPSA","match_date":"2018-07-07","stage_classifiercode":"99-16","member_number":"A103198","first_name":"TAYLOR","last_name":"DANIELS","classification":"D","division":"PRODUCTION","hit_factor":2.6714801444043},{"match_name":"CRC_20160514_SuperClassifier","match_date":"2016-05-14","stage_classifiercode":"99-16","member_number":"A95143","first_name":"NICOLE","last_name":"HULET","classification":"U","division":"PRODUCTION","hit_factor":2.6475},{"match_name":"2da Copa Nacional USPSA ","match_date":"2016-05-22","stage_classifiercode":"99-16","member_number":"A92865","first_name":"MIGUEL","last_name":"AROCHO RODRIGUEZ","classification":"U","division":"PRODUCTION","hit_factor":2.6447},{"match_name":"ENPS March 2017 USPSA Match","match_date":"2017-03-05","stage_classifiercode":"99-16","member_number":"TY92731","first_name":"BONNIE","last_name":"JISA","classification":"D","division":"PRODUCTION","hit_factor":2.6426},{"match_name":"2da Copa Nacional USPSA ","match_date":"2016-05-22","stage_classifiercode":"99-16","member_number":"A88118","first_name":"JOSEPH","last_name":"MELENDEZ REYES","classification":"B","division":"PRODUCTION","hit_factor":2.6423},{"match_name":"Superior Practical Shooters - March Match","match_date":"2017-03-01","stage_classifiercode":"99-16","member_number":"A-99524","first_name":"CHARLES (CHAS)","last_name":"HARTLEY","classification":"U","division":"PRODUCTION","hit_factor":2.6156},{"match_name":"SPSA USPSA December 1st Sat Match","match_date":"2016-12-03","stage_classifiercode":"99-16","member_number":"A88525","first_name":"DAVID","last_name":"ODDO","classification":"C","division":"PRODUCTION","hit_factor":2.6128},{"match_name":"Shongum April 2016 Pistol Match","match_date":"2016-04-02","stage_classifiercode":"99-16","member_number":"A52296","first_name":"BRUCE","last_name":"BRINK","classification":"U","division":"PRODUCTION","hit_factor":2.5794},{"match_name":"GCL Wed 5-31-17","match_date":"2017-05-31","stage_classifiercode":"99-16","member_number":"PEN","first_name":"JEFF","last_name":"ROSE","classification":"U","division":"PRODUCTION","hit_factor":2.5773},{"match_name":"CRC_20160514_SuperClassifier","match_date":"2016-05-14","stage_classifiercode":"99-16","member_number":"\"\"","first_name":"JESSE","last_name":"KIERNAN","classification":"U","division":"PRODUCTION","hit_factor":2.5621},{"match_name":"Pelham USPSA 2017-08-20","match_date":"2017-08-20","stage_classifiercode":"99-16","member_number":"A104218","first_name":"MICHAEL","last_name":"SOULIOS","classification":"U","division":"PRODUCTION","hit_factor":2.5615},{"match_name":"4ta Fecha USPSA","match_date":"2018-04-07","stage_classifiercode":"99-16","member_number":"A104236","first_name":"SANDRO J","last_name":"GONZALEZ-ALVAREZ","classification":"C","division":"PRODUCTION","hit_factor":2.5599},{"match_name":"Dundee USPSA Mar 2017","match_date":"2017-03-25","stage_classifiercode":"99-16","member_number":"ty99479","first_name":"MICHAEL","last_name":"HAVLIK","classification":"U","division":"PRODUCTION","hit_factor":2.5583},{"match_name":"MS06 Team Magnolia USPSA January Match2","match_date":"2016-01-03","stage_classifiercode":"99-16","member_number":"A73959","first_name":"KIRK","last_name":"KLEINPETER","classification":"A","division":"PRODUCTION","hit_factor":2.5562},{"match_name":"Laser Ninja Dragon League MSA USPSA January 8th 2017","match_date":"2017-01-08","stage_classifiercode":"99-16","member_number":"11393","first_name":"MIKE","last_name":"JONES","classification":"U","division":"PRODUCTION","hit_factor":2.5362},{"match_name":"PIPS 07-25-2018","match_date":"2018-07-25","stage_classifiercode":"99-16","member_number":"PEN","first_name":"SCOTT","last_name":"RADDATZ","classification":"U","division":"PRODUCTION","hit_factor":2.5352},{"match_name":"TPS USPSA -  January 2017 - Talon Range","match_date":"2017-01-07","stage_classifiercode":"99-16","member_number":"A86279","first_name":"GEI-NAM","last_name":"LIM","classification":"C","division":"PRODUCTION","hit_factor":2.5342},{"match_name":"GCL June 3-2017","match_date":"2017-06-03","stage_classifiercode":"99-16","member_number":"A96622","first_name":"LARRY","last_name":"STROLLO","classification":"C","division":"PRODUCTION","hit_factor":2.5222},{"match_name":"2da Copa Nacional USPSA ","match_date":"2016-05-22","stage_classifiercode":"99-16","member_number":"TY91989","first_name":"ALFREDO","last_name":"MELENDEZ","classification":"D","division":"PRODUCTION","hit_factor":2.5215},{"match_name":"LdF USPSA Match September 23 2017","match_date":"2017-09-23","stage_classifiercode":"99-16","member_number":"A20277","first_name":"MICHEL","last_name":"RAMEK","classification":"C","division":"PRODUCTION","hit_factor":2.5082},{"match_name":"Shasta Shooters 2020 Dec","match_date":"2020-12-12","stage_classifiercode":"99-16","member_number":"A125815","first_name":"WESLEY","last_name":"HAMBRIGHT","classification":"C","division":"PRODUCTION","hit_factor":2.4922},{"match_name":"Briar Rabbit  June Match 2016 OH 20","match_date":"2016-06-12","stage_classifiercode":"99-16","member_number":"A92530","first_name":"DYLAN","last_name":"MELICK","classification":"U","division":"PRODUCTION","hit_factor":2.4905},{"match_name":"PIPS 05-25-2016","match_date":"2016-05-24","stage_classifiercode":"99-16","member_number":"PEN","first_name":"BRIAN","last_name":"POMERLEAU","classification":"U","division":"PRODUCTION","hit_factor":2.4871},{"match_name":"MS06 Team Magnolia USPSA January Match2","match_date":"2016-01-03","stage_classifiercode":"99-16","member_number":"A82379","first_name":"WAVERLEY","last_name":"ARTZ","classification":"C","division":"PRODUCTION","hit_factor":2.4722},{"match_name":"CCPS March 2018 USPSA","match_date":"2018-03-18","stage_classifiercode":"99-16","member_number":"TY49257","first_name":"JEREMY","last_name":"HALL","classification":"C","division":"PRODUCTION","hit_factor":2.4707},{"match_name":"LdF USPSA Match September 23 2017","match_date":"2017-09-23","stage_classifiercode":"99-16","member_number":"TY96005","first_name":"JOE","last_name":"DRAMMISSI","classification":"C","division":"PRODUCTION","hit_factor":2.4481},{"match_name":"PTPC May 7th USPSA Match","match_date":"2017-05-07","stage_classifiercode":"99-16","member_number":"TY101252","first_name":"MATTHEW","last_name":"BULLARD","classification":"U","division":"PRODUCTION","hit_factor":2.4413},{"match_name":"ORSA USPSA July 2016 ","match_date":"2016-07-16","stage_classifiercode":"99-16","member_number":"NONE","first_name":"TERRY","last_name":"LAMUNYON","classification":"U","division":"PRODUCTION","hit_factor":2.4361},{"match_name":"HRC Jul 08 2017","match_date":"2017-07-07","stage_classifiercode":"99-16","member_number":"\"\"","first_name":"DEB","last_name":"MURRAY","classification":"U","division":"PRODUCTION","hit_factor":2.4267},{"match_name":"GCL Wed 5-31-17","match_date":"2017-05-31","stage_classifiercode":"99-16","member_number":"PEN","first_name":"BOB","last_name":"HOWLAND","classification":"U","division":"PRODUCTION","hit_factor":2.4215},{"match_name":"SFPS 10-08-2017 USPSA match","match_date":"2017-10-08","stage_classifiercode":"99-16","member_number":"TY98101","first_name":"MATTHEW","last_name":"GARRED","classification":"C","division":"PRODUCTION","hit_factor":2.4164},{"match_name":"Renton USPSA - August 2020 - NW05","match_date":"2020-08-23","stage_classifiercode":"99-16","member_number":"PEN","first_name":"EDWARD","last_name":"YIM","classification":"U","division":"PRODUCTION","hit_factor":2.4073},{"match_name":"CCPL 2 Day Match 2018","match_date":"2018-04-26","stage_classifiercode":"99-16","member_number":"A105543","first_name":"TRENT","last_name":"KING","classification":"U","division":"PRODUCTION","hit_factor":2.407},{"match_name":"ENPS March 2017 USPSA Match","match_date":"2017-03-05","stage_classifiercode":"99-16","member_number":"A100293","first_name":"JAMES","last_name":"SYTEK","classification":"U","division":"PRODUCTION","hit_factor":2.4048},{"match_name":"GCL June 3-2017","match_date":"2017-06-03","stage_classifiercode":"99-16","member_number":"TY86744","first_name":"GARY","last_name":"TERRANA","classification":"B","division":"PRODUCTION","hit_factor":2.3923},{"match_name":"GCL Wed 5-31-17","match_date":"2017-05-31","stage_classifiercode":"99-16","member_number":"PEN","first_name":"AMY","last_name":"LONGYEAR","classification":"U","division":"PRODUCTION","hit_factor":2.3862},{"match_name":"USPSA Bass River April 2017","match_date":"2017-04-02","stage_classifiercode":"99-16","member_number":"FY59373","first_name":"PAIGE","last_name":"BUCKLEY","classification":"C","division":"PRODUCTION","hit_factor":2.3723},{"match_name":"DWB - Deadwood Boys USPSA 20 May 2018","match_date":"2018-05-20","stage_classifiercode":"99-16","member_number":"A102027","first_name":"ANTONIO","last_name":"GONELLA","classification":"B","division":"PRODUCTION","hit_factor":2.3656},{"match_name":"MS06 Team Magnolia USPSA January Match2","match_date":"2016-01-03","stage_classifiercode":"99-16","member_number":"A82466","first_name":"THOMAS","last_name":"ARTHUR","classification":"C","division":"PRODUCTION","hit_factor":2.3622},{"match_name":"Maine Practical Shooters May 2017","match_date":"2017-05-13","stage_classifiercode":"99-16","member_number":"A100277","first_name":"CHRISTOPHER","last_name":"MILLS","classification":"U","division":"PRODUCTION","hit_factor":2.3622},{"match_name":"APSC USPSA Match 1-6-18","match_date":"2018-01-06","stage_classifiercode":"99-16","member_number":"TY51648","first_name":"LOUIS","last_name":"WICHERS","classification":"C","division":"PRODUCTION","hit_factor":2.3454},{"match_name":"MvpNov2015","match_date":"2015-11-06","stage_classifiercode":"99-16","member_number":"\"\"","first_name":"TIM","last_name":"MARTIN","classification":"U","division":"PRODUCTION","hit_factor":2.3324},{"match_name":"Grandbaggers 07/2017","match_date":"2017-07-06","stage_classifiercode":"99-16","member_number":"A83435","first_name":"IRWIN","last_name":"DAUGHERTY","classification":"C","division":"PRODUCTION","hit_factor":2.3277},{"match_name":"Hosemasters 2nd Sunday May 2017","match_date":"2017-05-14","stage_classifiercode":"99-16","member_number":"A83982","first_name":"DEBRA","last_name":"SULLIVAN","classification":"U","division":"PRODUCTION","hit_factor":2.3166},{"match_name":"MVS ANPRACS Classifier Match 6/3/17","match_date":"2017-05-31","stage_classifiercode":"99-16","member_number":"A91599","first_name":"ELIZABETH","last_name":"PEARCH","classification":"D","division":"PRODUCTION","hit_factor":2.3137},{"match_name":"DAP December 2015 Classifier match","match_date":"2015-12-12","stage_classifiercode":"99-16","member_number":"A83559","first_name":"JOHN","last_name":"DANPOUR","classification":"D","division":"PRODUCTION","hit_factor":2.3041},{"match_name":"WLPS June 2017","match_date":"2017-06-25","stage_classifiercode":"99-16","member_number":"\"\"","first_name":"DOUG","last_name":"CARDEN","classification":"B","division":"PRODUCTION","hit_factor":2.301},{"match_name":"APSC USPSA Match 1-6-18","match_date":"2018-01-06","stage_classifiercode":"99-16","member_number":"A105062","first_name":"OLIVIA","last_name":"GUTIERREZ","classification":"D","division":"PRODUCTION","hit_factor":2.2989},{"match_name":"MSSA Uspsa Club Matcg","match_date":"2017-09-24","stage_classifiercode":"99-16","member_number":"A99415","first_name":"GENE","last_name":"FAUL","classification":"B","division":"PRODUCTION","hit_factor":2.2968},{"match_name":"GCL June 3-2017","match_date":"2017-06-03","stage_classifiercode":"99-16","member_number":"PEN","first_name":"AMY","last_name":"LONGYEAR","classification":"U","division":"PRODUCTION","hit_factor":2.2938},{"match_name":"Laser Ninja Dragon League MSA USPSA January 8th 2017","match_date":"2017-01-08","stage_classifiercode":"99-16","member_number":"NA","first_name":"BERT","last_name":"GAMBLE","classification":"U","division":"PRODUCTION","hit_factor":2.2924},{"match_name":"2da Copa Nacional USPSA ","match_date":"2016-05-22","stage_classifiercode":"99-16","member_number":"\"\"","first_name":"ROBERTO","last_name":"RIVERA","classification":"U","division":"PRODUCTION","hit_factor":2.2905},{"match_name":"2da Copa Nacional USPSA ","match_date":"2016-05-22","stage_classifiercode":"99-16","member_number":"\"\"","first_name":"JADE","last_name":"OSORIO","classification":"D","division":"PRODUCTION","hit_factor":2.281},{"match_name":"2da Copa Nacional USPSA ","match_date":"2016-05-22","stage_classifiercode":"99-16","member_number":"A89235","first_name":"LUIS ALBERTO","last_name":"QUILICHINI ALBORS","classification":"B","division":"PRODUCTION","hit_factor":2.275},{"match_name":"Flagstaff Fun Shoot September 15 2018","match_date":"2018-09-15","stage_classifiercode":"99-16","member_number":"A84584","first_name":"ALLEN","last_name":"PAPIN","classification":"\"\"","division":"PRODUCTION","hit_factor":2.268},{"match_name":"ENPS March 2017 USPSA Match","match_date":"2017-03-05","stage_classifiercode":"99-16","member_number":"a90496","first_name":"JEREMY","last_name":"SINCEBAUGH","classification":"C","division":"PRODUCTION","hit_factor":2.2594},{"match_name":"Range E11even October 2017","match_date":"2017-10-28","stage_classifiercode":"99-16","member_number":"A100406","first_name":"LORI","last_name":"PATRICK","classification":"D","division":"PRODUCTION","hit_factor":2.2562},{"match_name":"RCPS USPSA 12 Nov 2016","match_date":"2016-11-12","stage_classifiercode":"99-16","member_number":"PEN","first_name":"WILLIAM","last_name":"FARNSWORTH","classification":"U","division":"PRODUCTION","hit_factor":2.2549},{"match_name":"SWGC USPSA Pistol Match - December","match_date":"2016-12-03","stage_classifiercode":"99-16","member_number":"a98023","first_name":"RICHARD","last_name":"MORGAN","classification":"C","division":"PRODUCTION","hit_factor":2.2464},{"match_name":"Maine Practical Shooters May 2017","match_date":"2017-05-13","stage_classifiercode":"99-16","member_number":"A101366","first_name":"HENRY","last_name":"POIRIER","classification":"U","division":"PRODUCTION","hit_factor":2.2273},{"match_name":"2da Copa Nacional USPSA ","match_date":"2016-05-22","stage_classifiercode":"99-16","member_number":"\"\"","first_name":"RICARDO","last_name":"MIRANDA TORRES","classification":"U","division":"PRODUCTION","hit_factor":2.2222},{"match_name":"WLPS June 2017","match_date":"2017-06-25","stage_classifiercode":"99-16","member_number":"\"\"","first_name":"SHAWN","last_name":"NUTT","classification":"U","division":"PRODUCTION","hit_factor":2.2205},{"match_name":"PCWC USPSA  1 28 17","match_date":"2017-01-28","stage_classifiercode":"99-16","member_number":"TY 54012","first_name":"TAMMY","last_name":"BONAS","classification":"C","division":"PRODUCTION","hit_factor":2.2158},{"match_name":"LGCSEMPS September 2017 Handgun","match_date":"2017-09-10","stage_classifiercode":"99-16","member_number":"TY82193","first_name":"BOB","last_name":"MILLER","classification":"D","division":"PRODUCTION","hit_factor":2.2124},{"match_name":"DWB - Deadwood Boys USPSA 20 May 2018","match_date":"2018-05-20","stage_classifiercode":"99-16","member_number":"\"\"","first_name":"MIKE","last_name":"EDISON","classification":"U","division":"PRODUCTION","hit_factor":2.211},{"match_name":"5 August - USPSA match - 17 South PSC","match_date":"2017-08-05","stage_classifiercode":"99-16","member_number":"\"\"","first_name":"CHARLIE","last_name":"HOLIFIELD","classification":"U","division":"PRODUCTION","hit_factor":2.2},{"match_name":"LdF USPSA Match September 23 2017","match_date":"2017-09-23","stage_classifiercode":"99-16","member_number":"PENDING","first_name":"PEDRO","last_name":"ORDONEZ","classification":"U","division":"PRODUCTION","hit_factor":2.196},{"match_name":"SPSA USPSA July 4th Sat match","match_date":"2018-07-28","stage_classifiercode":"99-16","member_number":"A88525","first_name":"DAVID","last_name":"ODDO","classification":"C","division":"PRODUCTION","hit_factor":2.192},{"match_name":"PIPS 05-25-2016","match_date":"2016-05-24","stage_classifiercode":"99-16","member_number":"PEN","first_name":"SCOTT","last_name":"RADDATZ","classification":"U","division":"PRODUCTION","hit_factor":2.1816},{"match_name":"ORSA USPSA July 2016 ","match_date":"2016-07-16","stage_classifiercode":"99-16","member_number":"A94240","first_name":"ANDY","last_name":"WALKER","classification":"U","division":"PRODUCTION","hit_factor":2.1769},{"match_name":"Pima Pistol Club USPSA Match - May 29 ","match_date":"2016-05-29","stage_classifiercode":"99-16","member_number":"\"\"","first_name":"JEREMY","last_name":"HAYES","classification":"\"\"","division":"PRODUCTION","hit_factor":2.1765},{"match_name":"CCPL 2 Day Match 2018","match_date":"2018-04-26","stage_classifiercode":"99-16","member_number":"A110985","first_name":"VIKKIE","last_name":"ABREA","classification":"U","division":"PRODUCTION","hit_factor":2.1505},{"match_name":"TPS USPSA -  January 2017 - Talon Range","match_date":"2017-01-07","stage_classifiercode":"99-16","member_number":"\"\"","first_name":"CLAY","last_name":"ROBERTS","classification":"U","division":"PRODUCTION","hit_factor":2.1463},{"match_name":"CIPSC Havana July USPSA","match_date":"2018-07-07","stage_classifiercode":"99-16","member_number":"A105858","first_name":"SCOTT","last_name":"HOECKER","classification":"C","division":"PRODUCTION","hit_factor":2.109375},{"match_name":"DWB - Deadwood Boys USPSA 20 May 2018","match_date":"2018-05-20","stage_classifiercode":"99-16","member_number":"\"\"","first_name":"JACKIE","last_name":"PALMA","classification":"X","division":"PRODUCTION","hit_factor":2.1078},{"match_name":"Pelham USPSA 2017-08-20","match_date":"2017-08-20","stage_classifiercode":"99-16","member_number":"A101971","first_name":"BRANDON","last_name":"BOUCHARD","classification":"D","division":"PRODUCTION","hit_factor":2.0974},{"match_name":"CIPSC Havana July USPSA","match_date":"2018-07-07","stage_classifiercode":"99-16","member_number":"FY51334","first_name":"JIM","last_name":"STOBAUGH","classification":"A","division":"PRODUCTION","hit_factor":2.07336523126},{"match_name":"SFPS 10-08-2017 USPSA match","match_date":"2017-10-08","stage_classifiercode":"99-16","member_number":"FY91514","first_name":"CHASE","last_name":"CEJKA","classification":"B","division":"PRODUCTION","hit_factor":2.0645},{"match_name":"LGCSEMPS September 2017 Handgun","match_date":"2017-09-10","stage_classifiercode":"99-16","member_number":"\"\"","first_name":"DAVID","last_name":"DETMAN","classification":"U","division":"PRODUCTION","hit_factor":2.0619},{"match_name":"LCSC USPSA 01.14.18","match_date":"2018-01-13","stage_classifiercode":"99-16","member_number":"A107664","first_name":"LEAH","last_name":"ALLEN","classification":"\"\"","division":"PRODUCTION","hit_factor":2.0386},{"match_name":"TPS USPSA -  January 2017 - Talon Range","match_date":"2017-01-07","stage_classifiercode":"99-16","member_number":"A99653","first_name":"ROBERT","last_name":"YOUNG","classification":"U","division":"PRODUCTION","hit_factor":2.0266},{"match_name":"Pinetucky USPSA 02-27-16","match_date":"2016-02-27","stage_classifiercode":"99-16","member_number":"A94453","first_name":"GRANT","last_name":"KASTNER","classification":"U","division":"PRODUCTION","hit_factor":2.0202},{"match_name":"MCPSL Pistol 10-9-2021","match_date":"2021-10-09","stage_classifiercode":"99-16","member_number":"A99468","first_name":"THOMAS","last_name":"ELLIOTT","classification":"D","division":"PRODUCTION","hit_factor":2.0143},{"match_name":"Laser Ninja Dragon League MSA USPSA January 8th 2017","match_date":"2017-01-08","stage_classifiercode":"99-16","member_number":"9188","first_name":"CHRIS","last_name":"JENKINS","classification":"U","division":"PRODUCTION","hit_factor":2.0046},{"match_name":"PTPC May 7th USPSA Match","match_date":"2017-05-07","stage_classifiercode":"99-16","member_number":"A86798","first_name":"NICK","last_name":"NARDIELLO","classification":"B","division":"PRODUCTION","hit_factor":2.0013},{"match_name":"MSSA Uspsa Club Matcg","match_date":"2017-09-24","stage_classifiercode":"99-16","member_number":"A97863","first_name":"WES","last_name":"CARROLL","classification":"C","division":"PRODUCTION","hit_factor":1.9967},{"match_name":"CCPL 2 Day Match 2018","match_date":"2018-04-26","stage_classifiercode":"99-16","member_number":"\"\"","first_name":"BILL","last_name":"PUCKETT","classification":"U","division":"PRODUCTION","hit_factor":1.9957},{"match_name":"Laser Ninja Dragon League MSA USPSA January 8th 2017","match_date":"2017-01-08","stage_classifiercode":"99-16","member_number":"TY76427","first_name":"BILL","last_name":"COLLINS","classification":"D","division":"PRODUCTION","hit_factor":1.9914},{"match_name":"Dundee USPSA Mar 2017","match_date":"2017-03-25","stage_classifiercode":"99-16","member_number":"\"\"","first_name":"BRANDON","last_name":"SITTON","classification":"U","division":"PRODUCTION","hit_factor":1.964},{"match_name":"USPSA","match_date":"2020-07-05","stage_classifiercode":"99-16","member_number":"A128633","first_name":"DAVID","last_name":"CHEEK","classification":"","division":"PRODUCTION","hit_factor":1.9619},{"match_name":"Flagstaff Fun Shoot September 15 2018","match_date":"2018-09-15","stage_classifiercode":"99-16","member_number":"A114032","first_name":"\"EDUARDO \"\"EDDIE\"\"\"","last_name":"PINSON","classification":"\"\"","division":"PRODUCTION","hit_factor":1.9565},{"match_name":"CCPL 02-09-2020","match_date":"2020-02-09","stage_classifiercode":"99-16","member_number":"107815","first_name":"CHARLIE","last_name":"JENSEN","classification":"D","division":"PRODUCTION","hit_factor":1.9361},{"match_name":"Shasta Shooters September 2016","match_date":"2016-09-10","stage_classifiercode":"99-16","member_number":"PEN","first_name":"ANDY","last_name":"NAYLOR","classification":"U","division":"PRODUCTION","hit_factor":1.9169},{"match_name":"DWB - Deadwood Boys USPSA 20 May 2018","match_date":"2018-05-20","stage_classifiercode":"99-16","member_number":"\"\"","first_name":"BRENDA","last_name":"CORTEZ","classification":"X","division":"PRODUCTION","hit_factor":1.9151},{"match_name":"ENPS March 2017 USPSA Match","match_date":"2017-03-05","stage_classifiercode":"99-16","member_number":"PEN","first_name":"ANTHONY","last_name":"DEBOER","classification":"U","division":"PRODUCTION","hit_factor":1.8807},{"match_name":"GCL June 3-2017","match_date":"2017-06-03","stage_classifiercode":"99-16","member_number":"A102561","first_name":"RACHEL","last_name":"WILDE","classification":"U","division":"PRODUCTION","hit_factor":1.8746},{"match_name":"PIPS 05-25-2016","match_date":"2016-05-24","stage_classifiercode":"99-16","member_number":"TY81464","first_name":"BRAD","last_name":"BRECH","classification":"D","division":"PRODUCTION","hit_factor":1.8709},{"match_name":"GCL Wed 5-31-17","match_date":"2017-05-31","stage_classifiercode":"99-16","member_number":"PEN","first_name":"BRENT","last_name":"WEICHT","classification":"U","division":"PRODUCTION","hit_factor":1.8692},{"match_name":"GCL Wed 5-31-17","match_date":"2017-05-31","stage_classifiercode":"99-16","member_number":"PEN","first_name":"ALEX","last_name":"ABLAEV","classification":"U","division":"PRODUCTION","hit_factor":1.8425},{"match_name":"ORSA USPSA July 2016 ","match_date":"2016-07-16","stage_classifiercode":"99-16","member_number":"A94247","first_name":"JACK","last_name":"SUGGS","classification":"D","division":"PRODUCTION","hit_factor":1.8353},{"match_name":"RCPS USPSA Sep 11","match_date":"2021-09-11","stage_classifiercode":"99-16","member_number":"A108714","first_name":"MICHAEL","last_name":"NIX","classification":"U","division":"PRODUCTION","hit_factor":1.8265},{"match_name":"TPS USPSA -  January 2017 - Talon Range","match_date":"2017-01-07","stage_classifiercode":"99-16","member_number":"\"\"","first_name":"KEVIN","last_name":"FAIRCLOTH","classification":"U","division":"PRODUCTION","hit_factor":1.8224},{"match_name":"AVAP CLASSIFIER 71418","match_date":"2018-07-14","stage_classifiercode":"99-16","member_number":"A90398","first_name":"RICHARD","last_name":"MOTTA","classification":"C","division":"PRODUCTION","hit_factor":1.8132},{"match_name":"5 August - USPSA match - 17 South PSC","match_date":"2017-08-05","stage_classifiercode":"99-16","member_number":"a94623","first_name":"VERNON","last_name":"PASCUAL","classification":"C","division":"PRODUCTION","hit_factor":1.8083},{"match_name":"GCL Wed 5-31-17","match_date":"2017-05-31","stage_classifiercode":"99-16","member_number":"PEN","first_name":"RICK","last_name":"CONRAD","classification":"U","division":"PRODUCTION","hit_factor":1.7968},{"match_name":"ORSA USPSA July 2016 ","match_date":"2016-07-16","stage_classifiercode":"99-16","member_number":"NONE","first_name":"BRIAN","last_name":"MORRIS","classification":"U","division":"PRODUCTION","hit_factor":1.7699},{"match_name":"GCL Wed 5-31-17","match_date":"2017-05-31","stage_classifiercode":"99-16","member_number":"PEN","first_name":"DICK","last_name":"MARTINEAU","classification":"U","division":"PRODUCTION","hit_factor":1.7449},{"match_name":"CRC_20160514_SuperClassifier","match_date":"2016-05-14","stage_classifiercode":"99-16","member_number":"A96956","first_name":"ROB","last_name":"LOTT","classification":"U","division":"PRODUCTION","hit_factor":1.7422},{"match_name":"NCPL 2016 July","match_date":"2016-07-31","stage_classifiercode":"99-16","member_number":"\"\"","first_name":"RYAN","last_name":"DEVINNEY","classification":"\"\"","division":"PRODUCTION","hit_factor":1.7412},{"match_name":"USPSA-AB 2018-14 at Brooks Pistol Club -adhoc","match_date":"2018-08-08","stage_classifiercode":"99-16","member_number":"F113311","first_name":"DAVE","last_name":"MERESKI","classification":"C","division":"PRODUCTION","hit_factor":1.7375},{"match_name":"HRC Jul 08 2017","match_date":"2017-07-07","stage_classifiercode":"99-16","member_number":"\"\"","first_name":"DAVID","last_name":"ROOK","classification":"U","division":"PRODUCTION","hit_factor":1.7263},{"match_name":"Dundee USPSA Mar 2017","match_date":"2017-03-25","stage_classifiercode":"99-16","member_number":"A96677","first_name":"PAUL","last_name":"TOUCHTON","classification":"U","division":"PRODUCTION","hit_factor":1.6949},{"match_name":"LCSC USPSA 01.14.18","match_date":"2018-01-13","stage_classifiercode":"99-16","member_number":"TY106439","first_name":"DWAYNE","last_name":"WATASE","classification":"U","division":"PRODUCTION","hit_factor":1.6713},{"match_name":"5 August - USPSA match - 17 South PSC","match_date":"2017-08-05","stage_classifiercode":"99-16","member_number":"A-103807","first_name":"JUSTIN","last_name":"ARNOTT","classification":"U","division":"PRODUCTION","hit_factor":1.6667},{"match_name":"MSSA Uspsa Club Matcg","match_date":"2017-09-24","stage_classifiercode":"99-16","member_number":"A71110","first_name":"DAN","last_name":"KOEPPEL","classification":"C","division":"PRODUCTION","hit_factor":1.6519},{"match_name":"PIPS 05-25-2016","match_date":"2016-05-24","stage_classifiercode":"99-16","member_number":"A91025","first_name":"DICK","last_name":"ANNEKE","classification":"D","division":"PRODUCTION","hit_factor":1.6413},{"match_name":"TPS USPSA -  April 2018 Clone","match_date":"2018-04-08","stage_classifiercode":"99-16","member_number":"\"\"","first_name":"GREG","last_name":"ORFF","classification":"U","division":"PRODUCTION","hit_factor":1.6377},{"match_name":"Bass River USPSA September 2018","match_date":"2018-09-02","stage_classifiercode":"99-16","member_number":"\"\"","first_name":"JOHN","last_name":"MULAK","classification":"U","division":"PRODUCTION","hit_factor":1.6321},{"match_name":"AVAP CLASSIFIER 71418","match_date":"2018-07-14","stage_classifiercode":"99-16","member_number":"A110057","first_name":"BEN","last_name":"CHANDLER","classification":"U","division":"PRODUCTION","hit_factor":1.63},{"match_name":"Pelham USPSA 2017-08-20","match_date":"2017-08-20","stage_classifiercode":"99-16","member_number":"A94392","first_name":"ZACHARY","last_name":"ROBERGE","classification":"C","division":"PRODUCTION","hit_factor":1.6236},{"match_name":"Emmett March Match","match_date":"2016-03-25","stage_classifiercode":"99-16","member_number":"TY81469","first_name":"ERIC","last_name":"STEINER","classification":"A","division":"PRODUCTION","hit_factor":1.6129},{"match_name":"Shasta Shooters 2020 Dec","match_date":"2020-12-12","stage_classifiercode":"99-16","member_number":"A130079","first_name":"STACY","last_name":"LARSON","classification":"D","division":"PRODUCTION","hit_factor":1.6064},{"match_name":"MCPSL Pistol 10-9-2021","match_date":"2021-10-09","stage_classifiercode":"99-16","member_number":"A137416","first_name":"ZANE","last_name":"SWAFFORD","classification":"U","division":"PRODUCTION","hit_factor":1.6046},{"match_name":"BSPSC 2018 August Special Classifier","match_date":"2018-08-12","stage_classifiercode":"99-16","member_number":"A102259","first_name":"KURT","last_name":"LOVE","classification":"C","division":"PRODUCTION","hit_factor":1.5948},{"match_name":"APSC USPSA Match 1-6-18","match_date":"2018-01-06","stage_classifiercode":"99-16","member_number":"\"\"","first_name":"DARRELL","last_name":"ZUROVEC","classification":"U","division":"PRODUCTION","hit_factor":1.5888},{"match_name":"BORCC USPSA July 2018 Classifier Match","match_date":"2018-07-02","stage_classifiercode":"99-16","member_number":"A112630","first_name":"CHAD","last_name":"VEGA","classification":"U","division":"PRODUCTION","hit_factor":1.5805},{"match_name":"HRC Jul 08 2017","match_date":"2017-07-07","stage_classifiercode":"99-16","member_number":"\"\"","first_name":"TIM","last_name":"LAPLANTE","classification":"U","division":"PRODUCTION","hit_factor":1.5758},{"match_name":"CCPL 2 Day Match 2018","match_date":"2018-04-26","stage_classifiercode":"99-16","member_number":"TY106439","first_name":"DWAYNE","last_name":"WATASE","classification":"D","division":"PRODUCTION","hit_factor":1.5748},{"match_name":"SFA USPSA March 2017","match_date":"2017-03-18","stage_classifiercode":"99-16","member_number":"A91924","first_name":"THERESA","last_name":"SKINNER","classification":"D","division":"PRODUCTION","hit_factor":1.553},{"match_name":"4ta Fecha USPSA","match_date":"2018-04-07","stage_classifiercode":"99-16","member_number":"\"\"","first_name":"JOSE","last_name":"CAICEDO-FUENTES","classification":"U","division":"PRODUCTION","hit_factor":1.5509},{"match_name":"NCPL 2016 July","match_date":"2016-07-31","stage_classifiercode":"99-16","member_number":"\"\"","first_name":"CODY","last_name":"ATWATER","classification":"\"\"","division":"PRODUCTION","hit_factor":1.5304},{"match_name":"ENPS March 2017 USPSA Match","match_date":"2017-03-05","stage_classifiercode":"99-16","member_number":"PEN","first_name":"GREG","last_name":"BOONE","classification":"U","division":"PRODUCTION","hit_factor":1.5296},{"match_name":"MVS ANPRACS Classifier Match 6/3/17","match_date":"2017-05-31","stage_classifiercode":"99-16","member_number":"\"\"","first_name":"SAM","last_name":"DRESEL","classification":"\"\"","division":"PRODUCTION","hit_factor":1.5195},{"match_name":"CRC_20160514_SuperClassifier","match_date":"2016-05-14","stage_classifiercode":"99-16","member_number":"\"\"","first_name":"JESSE","last_name":"KIERNAN","classification":"U","division":"PRODUCTION","hit_factor":1.4981},{"match_name":"APSC USPSA Match 1-6-18","match_date":"2018-01-06","stage_classifiercode":"99-16","member_number":"A106022","first_name":"MANIKANDAN","last_name":"NAIR","classification":"U","division":"PRODUCTION","hit_factor":1.4712},{"match_name":"LGCSEMPS September 2017 Handgun","match_date":"2017-09-10","stage_classifiercode":"99-16","member_number":"A104039","first_name":"CHARLES","last_name":"BICIGO","classification":"U","division":"PRODUCTION","hit_factor":1.4629},{"match_name":"SRAPS Amarillo Action May","match_date":"2016-05-28","stage_classifiercode":"99-16","member_number":"TY89170","first_name":"DUDLEY","last_name":"IRBY","classification":"D","division":"PRODUCTION","hit_factor":1.4585},{"match_name":"CIPSC Havana July USPSA","match_date":"2018-07-07","stage_classifiercode":"99-16","member_number":"A87408","first_name":"AUGUST","last_name":"LEE","classification":"B","division":"PRODUCTION","hit_factor":1.4362657091562},{"match_name":"Pima Pistol Club USPSA Match - May 29 ","match_date":"2016-05-29","stage_classifiercode":"99-16","member_number":"A41730","first_name":"MARC","last_name":"BATTAGLINI","classification":"U","division":"PRODUCTION","hit_factor":1.4286},{"match_name":"APSC USPSA Match 1-6-18","match_date":"2018-01-06","stage_classifiercode":"99-16","member_number":"\"\"","first_name":"KARL","last_name":"KEY","classification":"U","division":"PRODUCTION","hit_factor":1.4245},{"match_name":"RBGC 2017-10-21","match_date":"2017-10-21","stage_classifiercode":"99-16","member_number":"TY90524","first_name":"ANDREW","last_name":"LARRIER","classification":"B","division":"PRODUCTION","hit_factor":1.4085},{"match_name":"Shongum April 2016 Pistol Match","match_date":"2016-04-02","stage_classifiercode":"99-16","member_number":"\"\"","first_name":"JOHN","last_name":"CASTIGLIA","classification":"U","division":"PRODUCTION","hit_factor":1.3774},{"match_name":"ARPC USPSA Match 3-26-17","match_date":"2017-03-26","stage_classifiercode":"99-16","member_number":"A95232","first_name":"ANGELA","last_name":"BERRING","classification":"Unclassified","division":"PRODUCTION","hit_factor":1.3661},{"match_name":"5 August - USPSA match - 17 South PSC","match_date":"2017-08-05","stage_classifiercode":"99-16","member_number":"a100885","first_name":"LORENZO","last_name":"BISHOP","classification":"U","division":"PRODUCTION","hit_factor":1.3619},{"match_name":"DAP December 2015 Classifier match","match_date":"2015-12-12","stage_classifiercode":"99-16","member_number":"NA","first_name":"KRISTINA","last_name":"GALVIN","classification":"none","division":"PRODUCTION","hit_factor":1.3542},{"match_name":"CCPL 2 Day Match 2018","match_date":"2018-04-26","stage_classifiercode":"99-16","member_number":"\"\"","first_name":"KEN","last_name":"COPLIN","classification":"U","division":"PRODUCTION","hit_factor":1.3128},{"match_name":"LdF USPSA Match September 23 2017","match_date":"2017-09-23","stage_classifiercode":"99-16","member_number":"PENDING","first_name":"CHRISTOPHER","last_name":"HOLMES","classification":"U","division":"PRODUCTION","hit_factor":1.312},{"match_name":"LCSC USPSA 01.14.18","match_date":"2018-01-13","stage_classifiercode":"99-16","member_number":"A104196","first_name":"BRENDA","last_name":"SANDOVAL","classification":"D","division":"PRODUCTION","hit_factor":1.2935},{"match_name":"Rio Grande Practical Shooters - May 2018","match_date":"2018-05-05","stage_classifiercode":"99-16","member_number":"A99073","first_name":"CLAYTON","last_name":"MALLORY","classification":"U","division":"PRODUCTION","hit_factor":1.2914},{"match_name":"Pinetucky USPSA 02-27-16","match_date":"2016-02-27","stage_classifiercode":"99-16","member_number":"\"\"","first_name":"CHRIS","last_name":"SHIRER","classification":"U","division":"PRODUCTION","hit_factor":1.2809},{"match_name":"PIPS 05-25-2016","match_date":"2016-05-24","stage_classifiercode":"99-16","member_number":"A92109","first_name":"HENRY","last_name":"HOCRAFFER","classification":"U","division":"PRODUCTION","hit_factor":1.2788},{"match_name":"ORSA USPSA August 2020","match_date":"2020-08-15","stage_classifiercode":"99-16","member_number":"0","first_name":"CROCKETT","last_name":"JONES","classification":"U","division":"PRODUCTION","hit_factor":1.2315},{"match_name":"BORCC USPSA July 2018 Classifier Match","match_date":"2018-07-02","stage_classifiercode":"99-16","member_number":"A85291","first_name":"DAVID","last_name":"GERBER","classification":"C","division":"PRODUCTION","hit_factor":1.2163},{"match_name":"5 August - USPSA match - 17 South PSC","match_date":"2017-08-05","stage_classifiercode":"99-16","member_number":"\"\"","first_name":"MIKE","last_name":"COFFIELD","classification":"U","division":"PRODUCTION","hit_factor":1.2123},{"match_name":"ORSA USPSA July 2016 ","match_date":"2016-07-16","stage_classifiercode":"99-16","member_number":"NONE","first_name":"MICHAEL","last_name":"SELCER","classification":"U","division":"PRODUCTION","hit_factor":1.2027},{"match_name":"PIPS 05-25-2016","match_date":"2016-05-24","stage_classifiercode":"99-16","member_number":"PEN","first_name":"TIM","last_name":"HERMAN","classification":"U","division":"PRODUCTION","hit_factor":1.1949},{"match_name":"MVS ANPRACS Classifier Match 6/3/17","match_date":"2017-05-31","stage_classifiercode":"99-16","member_number":"\"\"","first_name":"RICHARD","last_name":"MULLOWNEY","classification":"\"\"","division":"PRODUCTION","hit_factor":1.171},{"match_name":"APSC USPSA Match 1-6-18","match_date":"2018-01-06","stage_classifiercode":"99-16","member_number":"\"\"","first_name":"RUDY","last_name":"LARA","classification":"U","division":"PRODUCTION","hit_factor":1.1709},{"match_name":"USPSA Bass River April 2017","match_date":"2017-04-02","stage_classifiercode":"99-16","member_number":"\"\"","first_name":"BRANDON","last_name":"RIBEIRO","classification":"\"\"","division":"PRODUCTION","hit_factor":1.1628},{"match_name":"Pelham USPSA 2017-08-20","match_date":"2017-08-20","stage_classifiercode":"99-16","member_number":"A102603","first_name":"MARK","last_name":"MACLEOD","classification":"U","division":"PRODUCTION","hit_factor":1.1585},{"match_name":"DWB - Deadwood Boys USPSA 20 May 2018","match_date":"2018-05-20","stage_classifiercode":"99-16","member_number":"\"\"","first_name":"CYNTHIA","last_name":"BUGARIN","classification":"X","division":"PRODUCTION","hit_factor":1.1435},{"match_name":"TPS USPSA -  January 2017 - Talon Range","match_date":"2017-01-07","stage_classifiercode":"99-16","member_number":"N/A","first_name":"JOE","last_name":"BELSON","classification":"U","division":"PRODUCTION","hit_factor":1.1329},{"match_name":"Briar Rabbit  June Match 2016 OH 20","match_date":"2016-06-12","stage_classifiercode":"99-16","member_number":"A97350","first_name":"HOWARD","last_name":"WILLIAMS","classification":"U","division":"PRODUCTION","hit_factor":1.0978},{"match_name":"Dundee USPSA Mar 2017","match_date":"2017-03-25","stage_classifiercode":"99-16","member_number":"\"\"","first_name":"HAILEY","last_name":"ZEMA","classification":"U","division":"PRODUCTION","hit_factor":1.0554},{"match_name":"APSC USPSA Match 1-6-18","match_date":"2018-01-06","stage_classifiercode":"99-16","member_number":"TY91712","first_name":"GEORGE","last_name":"CONWILL","classification":"B","division":"PRODUCTION","hit_factor":1.0526},{"match_name":"PIPS 05-25-2016","match_date":"2016-05-24","stage_classifiercode":"99-16","member_number":"PEN","first_name":"JEFF","last_name":"CANAKES","classification":"U","division":"PRODUCTION","hit_factor":1.05},{"match_name":"NCPL 2016 July","match_date":"2016-07-31","stage_classifiercode":"99-16","member_number":"\"\"","first_name":"JENN","last_name":"WARD","classification":"U","division":"PRODUCTION","hit_factor":0.9845},{"match_name":"LCSC USPSA 01.14.18","match_date":"2018-01-13","stage_classifiercode":"99-16","member_number":"A107395","first_name":"KIRSTEN","last_name":"WILLIAMSON","classification":"U","division":"PRODUCTION","hit_factor":0.9585},{"match_name":"SPSA USPSA December 1st Sat Match","match_date":"2016-12-03","stage_classifiercode":"99-16","member_number":"\"\"","first_name":"TODD","last_name":"HALE","classification":"U","division":"PRODUCTION","hit_factor":0.9551},{"match_name":"Dundee USPSA Mar 2017","match_date":"2017-03-25","stage_classifiercode":"99-16","member_number":"A93092","first_name":"MARK","last_name":"CARLETON","classification":"D","division":"PRODUCTION","hit_factor":0.8895},{"match_name":"OK15 USPSA at USSA","match_date":"2016-12-11","stage_classifiercode":"99-16","member_number":"\"\"","first_name":"DERRICK","last_name":"TANNER","classification":"D","division":"PRODUCTION","hit_factor":0.8816},{"match_name":"Superior Practical Shooters - March Match","match_date":"2017-03-01","stage_classifiercode":"99-16","member_number":"A-101353","first_name":"ADAM","last_name":"WILLIS","classification":"U","division":"PRODUCTION","hit_factor":0.8764},{"match_name":"HRC Jul 08 2017","match_date":"2017-07-07","stage_classifiercode":"99-16","member_number":"\"\"","first_name":"SERGIO","last_name":"HERMENDEZ","classification":"U","division":"PRODUCTION","hit_factor":0.8738},{"match_name":"MS06 Team Magnolia USPSA January Match2","match_date":"2016-01-03","stage_classifiercode":"99-16","member_number":"A73593","first_name":"JASON","last_name":"KEENAN","classification":"B","division":"PRODUCTION","hit_factor":0.8621},{"match_name":"CARO USPSA MATCH NO 3","match_date":"2018-07-28","stage_classifiercode":"99-16","member_number":"A108469","first_name":"ANDREA","last_name":"HARDAKER","classification":"\"\"","division":"PRODUCTION","hit_factor":0.8376},{"match_name":"ENPS March 2017 USPSA Match","match_date":"2017-03-05","stage_classifiercode":"99-16","member_number":"PEN","first_name":"DANIEL","last_name":"RAMIREZ","classification":"U","division":"PRODUCTION","hit_factor":0.8333},{"match_name":"Pelham USPSA 2017-08-20","match_date":"2017-08-20","stage_classifiercode":"99-16","member_number":"A104024","first_name":"BRUCE","last_name":"BOUCHARD","classification":"U","division":"PRODUCTION","hit_factor":0.8158},{"match_name":"PCWC USPSA  1 28 17","match_date":"2017-01-28","stage_classifiercode":"99-16","member_number":"a95168","first_name":"CHRISTOPHER","last_name":"BLACK","classification":"U","division":"PRODUCTION","hit_factor":0.7902},{"match_name":"HRC Jul 08 2017","match_date":"2017-07-07","stage_classifiercode":"99-16","member_number":"\"\"","first_name":"SCOTT","last_name":"KOSAK","classification":"U","division":"PRODUCTION","hit_factor":0.7369},{"match_name":"AVAP CLASSIFIER 71418","match_date":"2018-07-14","stage_classifiercode":"99-16","member_number":"A-104136","first_name":"RICK","last_name":"NAKASHOJI","classification":"U","division":"PRODUCTION","hit_factor":0.7299},{"match_name":"5 August - USPSA match - 17 South PSC","match_date":"2017-08-05","stage_classifiercode":"99-16","member_number":"\"\"","first_name":"MASON","last_name":"ZHANG","classification":"U","division":"PRODUCTION","hit_factor":0.7224},{"match_name":"Briar Rabbit  June Match 2016 OH 20","match_date":"2016-06-12","stage_classifiercode":"99-16","member_number":"A95960","first_name":"RYAN","last_name":"CHERRY","classification":"U","division":"PRODUCTION","hit_factor":0.7128},{"match_name":"BRSP Tuesday Night USPSA Match - June 5","match_date":"2018-06-06","stage_classifiercode":"99-16","member_number":"TY85802","first_name":"JOHN","last_name":"CLER","classification":"D","division":"PRODUCTION","hit_factor":0.7035},{"match_name":"CIPSC Havana July USPSA","match_date":"2018-07-07","stage_classifiercode":"99-16","member_number":"NONE","first_name":"KEVIN","last_name":"BLOOM","classification":"U","division":"PRODUCTION","hit_factor":0.7007007007007},{"match_name":"LCSC USPSA 01.14.18","match_date":"2018-01-13","stage_classifiercode":"99-16","member_number":"A90114","first_name":"SUSAN","last_name":"WILL","classification":"C","division":"PRODUCTION","hit_factor":0.6139},{"match_name":"LdF USPSA Match September 23 2017","match_date":"2017-09-23","stage_classifiercode":"99-16","member_number":"TY37963","first_name":"ED","last_name":"FERRELL","classification":"C","division":"PRODUCTION","hit_factor":0.6104},{"match_name":"GCL Wed 5-31-17","match_date":"2017-05-31","stage_classifiercode":"99-16","member_number":"PEN","first_name":"RANDY","last_name":"SWEENEY","classification":"U","division":"PRODUCTION","hit_factor":0.6008},{"match_name":"Renton USPSA - August 2020 - NW05","match_date":"2020-08-23","stage_classifiercode":"99-16","member_number":"A86884","first_name":"ERIC","last_name":"WHITE","classification":"D","division":"PRODUCTION","hit_factor":0.5988},{"match_name":"Nampa USPSA May 27th 2020 Classifier Match","match_date":"2020-05-27","stage_classifiercode":"99-16","member_number":"A125375","first_name":"TRENT","last_name":"MILLER","classification":"C","division":"PRODUCTION","hit_factor":0.5459},{"match_name":"USPSA Bass River April 2017","match_date":"2017-04-02","stage_classifiercode":"99-16","member_number":"\"\"","first_name":"SEAN","last_name":"MCNEARNEY","classification":"\"\"","division":"PRODUCTION","hit_factor":0.4442},{"match_name":"LdF USPSA Match September 23 2017","match_date":"2017-09-23","stage_classifiercode":"99-16","member_number":"A90290","first_name":"ANTHONY","last_name":"COBOS","classification":"C","division":"PRODUCTION","hit_factor":0.4196},{"match_name":"Pelham USPSA 2017-08-20","match_date":"2017-08-20","stage_classifiercode":"99-16","member_number":"A97144","first_name":"JAMES","last_name":"BUTLER","classification":"C","division":"PRODUCTION","hit_factor":0.4058},{"match_name":"LdF USPSA Match September 23 2017","match_date":"2017-09-23","stage_classifiercode":"99-16","member_number":"TY97709","first_name":"DAVID JR.","last_name":"DEZAN","classification":"D","division":"PRODUCTION","hit_factor":0.3813},{"match_name":"LCSC USPSA 01.14.18","match_date":"2018-01-13","stage_classifiercode":"99-16","member_number":"A102818","first_name":"JALANNBERT","last_name":"MILLENDEZ","classification":"D","division":"PRODUCTION","hit_factor":0.3771},{"match_name":"GCL June 3-2017","match_date":"2017-06-03","stage_classifiercode":"99-16","member_number":"\"\"","first_name":"BRAD","last_name":"BOWEN","classification":"U","division":"PRODUCTION","hit_factor":0.3493},{"match_name":"BSPSC 2018 August Special Classifier","match_date":"2018-08-12","stage_classifiercode":"99-16","member_number":"A111439","first_name":"CHARLENE","last_name":"MARTIN","classification":"B","division":"PRODUCTION","hit_factor":0.3336},{"match_name":"LCSC USPSA 01.14.18","match_date":"2018-01-13","stage_classifiercode":"99-16","member_number":"A103503","first_name":"MICHAEL","last_name":"ELIUM","classification":"U","division":"PRODUCTION","hit_factor":0.3113},{"match_name":"PCWC USPSA  1 28 17","match_date":"2017-01-28","stage_classifiercode":"99-16","member_number":"a-98516","first_name":"ERIC","last_name":"NOEVERE","classification":"U","division":"PRODUCTION","hit_factor":0.3027},{"match_name":"PTPC May 7th USPSA Match","match_date":"2017-05-07","stage_classifiercode":"99-16","member_number":"A102623","first_name":"STEVE","last_name":"BRAGG","classification":"U","division":"PRODUCTION","hit_factor":0.2584},{"match_name":"DAP December 2015 Classifier match","match_date":"2015-12-12","stage_classifiercode":"99-16","member_number":"TY92393","first_name":"ED","last_name":"WHITE","classification":"U","division":"PRODUCTION","hit_factor":0.1295},{"match_name":"Shongum December 2017 USPSA Match","match_date":"2017-12-02","stage_classifiercode":"99-16","member_number":"A105414","first_name":"ROB","last_name":"COSTANZA","classification":"U","division":"PRODUCTION","hit_factor":0.1095},{"match_name":"Shongum April 2016 Pistol Match","match_date":"2016-04-02","stage_classifiercode":"99-16","member_number":"A95737","first_name":"KON","last_name":"ZELDIN","classification":"U","division":"PRODUCTION","hit_factor":0.0955},{"match_name":"Pelham USPSA 2017-08-20","match_date":"2017-08-20","stage_classifiercode":"99-16","member_number":"\"\"","first_name":"JOE","last_name":"MORNEAU","classification":"Unclassified","division":"PRODUCTION","hit_factor":0.04}]