[{"match_name":"MAPSA 2016.05.14","match_date":"2016-05-14","stage_classifiercode":"09-08","member_number":"A78033","first_name":"CASEY","last_name":"REED","classification":"G","division":"PRODUCTION","hit_factor":8.0863},{"match_name":"2017 Arkansas Section Championship","match_date":"2017-06-14","stage_classifiercode":"09-08","member_number":"TY60095","first_name":"MATT","last_name":"HOPKINS","classification":"G","division":"PRODUCTION","hit_factor":8.078},{"match_name":"MCPSL Pistol 4-10-2021 (Classifier)","match_date":"2021-04-10","stage_classifiercode":"09-08","member_number":"A90516","first_name":"JARED","last_name":"FOX","classification":"M","division":"PRODUCTION","hit_factor":7.6316},{"match_name":"OKCGC USPSA Feb 2018","match_date":"2018-02-03","stage_classifiercode":"09-08","member_number":"Ty64463","first_name":"CHAD","last_name":"STANTON","classification":"M","division":"PRODUCTION","hit_factor":7.537},{"match_name":"ENPS May 2018 USPSA Match","match_date":"2018-05-06","stage_classifiercode":"09-08","member_number":"TY50841","first_name":"JOEL","last_name":"PARK","classification":"G","division":"PRODUCTION","hit_factor":7.5145},{"match_name":"MAPSA 2016.05.14","match_date":"2016-05-14","stage_classifiercode":"09-08","member_number":"A72549","first_name":"ANDRE","last_name":"DESAUTEL","classification":"X","division":"PRODUCTION","hit_factor":7.4278},{"match_name":"QPS Quantico Shooting Club August 2021 USPSA   ","match_date":"2021-08-07","stage_classifiercode":"09-08","member_number":"A56938","first_name":"SHAUN","last_name":"HOPKINS","classification":"M","division":"PRODUCTION","hit_factor":7.2165},{"match_name":"GoShoot Outdoor A6 Warm up And Classifier match!","match_date":"2021-04-03","stage_classifiercode":"09-08","member_number":"A123998","first_name":"JOSH","last_name":"MARTIN","classification":"M","division":"PRODUCTION","hit_factor":7.0313},{"match_name":"2016 Tennessee Atomic Blast","match_date":"2016-09-16","stage_classifiercode":"09-08","member_number":"A68246","first_name":"RUSSELL","last_name":"MASKEY","classification":"G","division":"PRODUCTION","hit_factor":7.0126},{"match_name":"SPSA USPSA August 1st Sat Match","match_date":"2018-08-04","stage_classifiercode":"09-08","member_number":"A106222","first_name":"DANIEL","last_name":"LEITH","classification":"A","division":"PRODUCTION","hit_factor":6.9832},{"match_name":"Nampa USPSA June 21st 2020","match_date":"2020-06-21","stage_classifiercode":"09-08","member_number":"TY84532","first_name":"KENNY","last_name":"PLATT","classification":"G","division":"PRODUCTION","hit_factor":6.9612},{"match_name":"PMSC  USPSA JULY 2017","match_date":"2017-07-01","stage_classifiercode":"09-08","member_number":"a65822","first_name":"ERIC","last_name":"MALLABER","classification":"A","division":"PRODUCTION","hit_factor":6.8615},{"match_name":"Shoot GTR USPSA 12/20","match_date":"2016-12-20","stage_classifiercode":"09-08","member_number":"TY69089","first_name":"MATT","last_name":"MITCHELL","classification":"M","division":"PRODUCTION","hit_factor":6.8543},{"match_name":"CRC_20160514_SuperClassifier","match_date":"2016-05-14","stage_classifiercode":"09-08","member_number":"A86605","first_name":"SEM","last_name":"CHIM","classification":"A","division":"PRODUCTION","hit_factor":6.8354},{"match_name":"Pinetucky USPSA 03-20-2021","match_date":"2021-03-20","stage_classifiercode":"09-08","member_number":"Ty53092","first_name":"DEWEY","last_name":"HUTSON","classification":"M","division":"PRODUCTION","hit_factor":6.8044},{"match_name":"USPSA-AB 2018-14 at Brooks Pistol Club -adhoc","match_date":"2018-08-08","stage_classifiercode":"09-08","member_number":"TY24475","first_name":"RICHARD","last_name":"INGRAM","classification":"M","division":"PRODUCTION","hit_factor":6.7797},{"match_name":"CIPSC IL02 Havana June USPSA","match_date":"2020-06-13","stage_classifiercode":"09-08","member_number":"FY87089","first_name":"WILLIS","last_name":"WHEELER","classification":"A","division":"PRODUCTION","hit_factor":6.7551},{"match_name":"2016 Tennessee Atomic Blast","match_date":"2016-09-16","stage_classifiercode":"09-08","member_number":"A58496","first_name":"GREG","last_name":"SMITH","classification":"A","division":"PRODUCTION","hit_factor":6.7295},{"match_name":"MAPSA 2016.05.14","match_date":"2016-05-14","stage_classifiercode":"09-08","member_number":"L2680","first_name":"JOHN","last_name":"KOPPI","classification":"A","division":"PRODUCTION","hit_factor":6.7146},{"match_name":"USPSA-AB 2018-14 at Brooks Pistol Club -adhoc","match_date":"2018-08-08","stage_classifiercode":"09-08","member_number":"TYF86780","first_name":"DUANE","last_name":"SNIEZEK","classification":"B","division":"PRODUCTION","hit_factor":6.6906},{"match_name":"ENPS May 2018 USPSA Match","match_date":"2018-05-06","stage_classifiercode":"09-08","member_number":"A56236","first_name":"JONATHAN","last_name":"ANDERSON","classification":"M","division":"PRODUCTION","hit_factor":6.6759},{"match_name":"Atlanta Practical Shooters March 2017 USPSA - Classifier Match","match_date":"2017-03-05","stage_classifiercode":"09-08","member_number":"A52643","first_name":"STEPHEN","last_name":"LEE","classification":"B","division":"PRODUCTION","hit_factor":6.6581},{"match_name":"2016 Tennessee Atomic Blast","match_date":"2016-09-16","stage_classifiercode":"09-08","member_number":"TY78920","first_name":"MIKE","last_name":"MOSER","classification":"M","division":"PRODUCTION","hit_factor":6.6496},{"match_name":"RPS November 2017 USPSA Match","match_date":"2017-11-11","stage_classifiercode":"09-08","member_number":"L3988","first_name":"BEN","last_name":"STOEGER","classification":"G","division":"PRODUCTION","hit_factor":6.6313},{"match_name":"MCPSL Pistol 7-11-20","match_date":"2020-07-11","stage_classifiercode":"09-08","member_number":"A90516","first_name":"JARED","last_name":"FOX","classification":"M","division":"PRODUCTION","hit_factor":6.6095},{"match_name":"SFPS 5-3-20 USPSA","match_date":"2020-05-03","stage_classifiercode":"09-08","member_number":"A103580","first_name":"TYLER","last_name":"GASSETT","classification":"B","division":"PRODUCTION","hit_factor":6.5906},{"match_name":"Collin County USPSA 05-23-2021","match_date":"2021-05-23","stage_classifiercode":"09-08","member_number":"A99569","first_name":"JUSTIN","last_name":"BOREN","classification":"M","division":"PRODUCTION","hit_factor":6.5789},{"match_name":"WTPS USPSA November Match 11-11-17","match_date":"2017-11-11","stage_classifiercode":"09-08","member_number":"TY86524","first_name":"DOUG","last_name":"SMITH","classification":"B","division":"PRODUCTION","hit_factor":6.5666},{"match_name":"Jamaica Rifle FCA-09 USPSA Weekend Rumble March 12th -13th 2021","match_date":"2021-03-13","stage_classifiercode":"09-08","member_number":"TY93177","first_name":"DARIN","last_name":"RICHARDS","classification":"A","division":"PRODUCTION","hit_factor":6.5476},{"match_name":"NCPS USPSA Handgun Match October 23 2016","match_date":"2016-10-23","stage_classifiercode":"09-08","member_number":"A95999","first_name":"MINH","last_name":"HOANG","classification":"D","division":"PRODUCTION","hit_factor":6.5421},{"match_name":"1a Fecha USPSA 2020","match_date":"2020-01-19","stage_classifiercode":"09-08","member_number":"FL4566","first_name":"MAX","last_name":"RIVERA","classification":"A","division":"PRODUCTION","hit_factor":6.5169},{"match_name":"Collin County USPSA Nov 6 2016","match_date":"2016-11-06","stage_classifiercode":"09-08","member_number":"TY93241","first_name":"DAZHI","last_name":"ZHANG","classification":"M","division":"PRODUCTION","hit_factor":6.4436},{"match_name":"WPS USPSA Monthly Match November 2018","match_date":"2018-11-10","stage_classifiercode":"09-08","member_number":"A95671","first_name":"DUG","last_name":"DUTCHER","classification":"A","division":"PRODUCTION","hit_factor":6.435},{"match_name":"WSPS OCTOBER 2016 SPECIAL CLASSIFIER MATCH","match_date":"2016-10-29","stage_classifiercode":"09-08","member_number":"A71458","first_name":"ALEXANDER","last_name":"BROWN","classification":"B","division":"PRODUCTION","hit_factor":6.4343},{"match_name":"QPS Quantico Shooting Club January USPSA   ","match_date":"2021-01-09","stage_classifiercode":"09-08","member_number":"A96190","first_name":"RYAN","last_name":"LEHMAN2","classification":"M","division":"PRODUCTION","hit_factor":6.4286},{"match_name":"OREGON ARPC CC05 USPSA SEPT 9 2017","match_date":"2017-09-09","stage_classifiercode":"09-08","member_number":"TY64113","first_name":"TOBIAS","last_name":"RICE","classification":"A","division":"PRODUCTION","hit_factor":6.3754},{"match_name":"MAPSA 2016.05.14","match_date":"2016-05-14","stage_classifiercode":"09-08","member_number":"TY83581","first_name":"PAUL","last_name":"WOLLMUTH","classification":"A","division":"PRODUCTION","hit_factor":6.3709},{"match_name":"Alpha Mike August Classifier 2021   ","match_date":"2021-08-15","stage_classifiercode":"09-08","member_number":"A8032","first_name":"WILLIAM","last_name":"GO","classification":"A","division":"PRODUCTION","hit_factor":6.3358},{"match_name":"DWB - Deadwood Boys USPSA 19 July 2020","match_date":"2020-07-19","stage_classifiercode":"09-08","member_number":"A111371","first_name":"WESLEY","last_name":"YIM","classification":"A","division":"PRODUCTION","hit_factor":6.3014},{"match_name":"Strongpoint February 2017 Classifier Match","match_date":"2017-02-04","stage_classifiercode":"09-08","member_number":"A91748","first_name":"DOUG","last_name":"SCOTT","classification":"M","division":"PRODUCTION","hit_factor":6.2635},{"match_name":"QPS Quantico Shooting Club August 2021 USPSA   ","match_date":"2021-08-07","stage_classifiercode":"09-08","member_number":"A66762","first_name":"DEAN","last_name":"WHITELAW 2","classification":"A","division":"PRODUCTION","hit_factor":6.2422},{"match_name":"USPSA MO21 Special Classifier 2Alpha SBRC February 27 2021","match_date":"2021-02-27","stage_classifiercode":"09-08","member_number":"TY86706","first_name":"CHRIS","last_name":"DEWEY","classification":"A","division":"PRODUCTION","hit_factor":6.2422},{"match_name":"1a Fecha USPSA 2020","match_date":"2020-01-19","stage_classifiercode":"09-08","member_number":"A90954","first_name":"ROBERTO","last_name":"MORALES","classification":"A","division":"PRODUCTION","hit_factor":6.2356},{"match_name":"GoShoot Outdoor A6 Warm up And Classifier match!","match_date":"2021-04-03","stage_classifiercode":"09-08","member_number":"A107611","first_name":"RICHARD","last_name":"BANKS","classification":"M","division":"PRODUCTION","hit_factor":6.2338},{"match_name":"Lefthanders Gun Club Practical Shooters March 5 and 6","match_date":"2016-03-05","stage_classifiercode":"09-08","member_number":"a46159","first_name":"JOHN","last_name":"DORSEY","classification":"G","division":"PRODUCTION","hit_factor":6.1684},{"match_name":"NCPS USPSA Handgun Match October 23 2016","match_date":"2016-10-23","stage_classifiercode":"09-08","member_number":"A93504","first_name":"KEVIN","last_name":"NGU","classification":"B","division":"PRODUCTION","hit_factor":6.1652},{"match_name":"TAC2 USPSA October 2017","match_date":"2017-10-07","stage_classifiercode":"09-08","member_number":"A92187","first_name":"CHRIS 2G","last_name":"NELSON","classification":"U","division":"PRODUCTION","hit_factor":6.1364},{"match_name":"QPS Quantico Shooting Club August 2021 USPSA   ","match_date":"2021-08-07","stage_classifiercode":"09-08","member_number":"A104367","first_name":"PAUL","last_name":"WILKERSON","classification":"B","division":"PRODUCTION","hit_factor":6.135},{"match_name":"SFPC October 1 2017 USPSA Match","match_date":"2017-10-01","stage_classifiercode":"09-08","member_number":"A1229","first_name":"JOSEPH","last_name":"HART","classification":"M","division":"PRODUCTION","hit_factor":6.1336},{"match_name":"Payson Practical Shooters - USPSA 2018 05 05","match_date":"2018-05-05","stage_classifiercode":"09-08","member_number":"Fy90171","first_name":"PETE","last_name":"UNDLIN","classification":"M","division":"PRODUCTION","hit_factor":6.1321},{"match_name":"USPSA-AB 2018-14 at Brooks Pistol Club -adhoc","match_date":"2018-08-08","stage_classifiercode":"09-08","member_number":"TYF96121","first_name":"MIKE","last_name":"GIORDANO","classification":"C","division":"PRODUCTION","hit_factor":6.1269},{"match_name":"OREGON ARPC CC05 USPSA SEPT 9 2017","match_date":"2017-09-09","stage_classifiercode":"09-08","member_number":"Ty68705","first_name":"KYLE","last_name":"OSTRANDER","classification":"A","division":"PRODUCTION","hit_factor":6.12},{"match_name":"Pioneer Action Shooters USPSA 5-27-18","match_date":"2018-05-27","stage_classifiercode":"09-08","member_number":"TY79813","first_name":"JOEL","last_name":"PENNEY","classification":"M","division":"PRODUCTION","hit_factor":6.087},{"match_name":"PMSC  USPSA JULY 2017","match_date":"2017-07-01","stage_classifiercode":"09-08","member_number":"A65822","first_name":"ERIC","last_name":"MALLABER","classification":"A","division":"PRODUCTION","hit_factor":6.0753},{"match_name":"CTASA 3rd Sunday USPSA - February 2016","match_date":"2016-02-21","stage_classifiercode":"09-08","member_number":"a69386","first_name":"CAROLL","last_name":"MCKEEVER","classification":"A","division":"PRODUCTION","hit_factor":6.0742},{"match_name":"Alpha Mike August Classifier 2021   ","match_date":"2021-08-15","stage_classifiercode":"09-08","member_number":"L3662","first_name":"MICHAEL","last_name":"GREEN","classification":"M","division":"PRODUCTION","hit_factor":6.068},{"match_name":"Lefthanders Gun Club Practical Shooters March 5 and 6","match_date":"2016-03-05","stage_classifiercode":"09-08","member_number":"A74548","first_name":"BRIAN","last_name":"HAYS","classification":"B","division":"PRODUCTION","hit_factor":6.0465},{"match_name":"2017 Arkansas Section Championship","match_date":"2017-06-14","stage_classifiercode":"09-08","member_number":"TY78645","first_name":"LOREN","last_name":"PENDERGRASS","classification":"M","division":"PRODUCTION","hit_factor":6.0335},{"match_name":"4ta Copa USPSA","match_date":"2016-11-20","stage_classifiercode":"09-08","member_number":"F74171","first_name":"MAX","last_name":"RIVERA","classification":"A","division":"PRODUCTION","hit_factor":6.0185},{"match_name":"WSPS OCTOBER 2016 SPECIAL CLASSIFIER MATCH","match_date":"2016-10-29","stage_classifiercode":"09-08","member_number":"TY97632","first_name":"BEN","last_name":"SIMCOX","classification":"U","division":"PRODUCTION","hit_factor":5.9957},{"match_name":"2016 Tennessee Atomic Blast","match_date":"2016-09-16","stage_classifiercode":"09-08","member_number":"A73808","first_name":"BRYAN","last_name":"HOEFER","classification":"A","division":"PRODUCTION","hit_factor":5.9893},{"match_name":"MAPSA 2016.05.14","match_date":"2016-05-14","stage_classifiercode":"09-08","member_number":"A86153","first_name":"ARIC","last_name":"NILSON","classification":"B","division":"PRODUCTION","hit_factor":5.9867},{"match_name":"SFPC October 1 2017 USPSA Match","match_date":"2017-10-01","stage_classifiercode":"09-08","member_number":"CL132","first_name":"MIKE","last_name":"SCHAEFER","classification":"U","division":"PRODUCTION","hit_factor":5.9701},{"match_name":"SPSA USPSA August 1st Sat Match","match_date":"2018-08-04","stage_classifiercode":"09-08","member_number":"A8318","first_name":"BOB","last_name":"BAILEY","classification":"M","division":"PRODUCTION","hit_factor":5.9669},{"match_name":"Harvard Action Shooters June 2018 USPSA Pistol Match","match_date":"2018-06-10","stage_classifiercode":"09-08","member_number":"A67718","first_name":"CRAIG","last_name":"PHILLIPS","classification":"U","division":"PRODUCTION","hit_factor":5.9259},{"match_name":"MCPSL Pistol 7-11-20","match_date":"2020-07-11","stage_classifiercode":"09-08","member_number":"A114754","first_name":"COREY","last_name":"BIGLER","classification":"B","division":"PRODUCTION","hit_factor":5.9226},{"match_name":"2016 Tennessee Atomic Blast","match_date":"2016-09-16","stage_classifiercode":"09-08","member_number":"A84978","first_name":"TYLER","last_name":"TURNER","classification":"M","division":"PRODUCTION","hit_factor":5.9211},{"match_name":"2016 Tennessee Atomic Blast","match_date":"2016-09-16","stage_classifiercode":"09-08","member_number":"A71260","first_name":"RICH","last_name":"STCLAIR","classification":"B","division":"PRODUCTION","hit_factor":5.9158},{"match_name":"2016 Tennessee Atomic Blast","match_date":"2016-09-16","stage_classifiercode":"09-08","member_number":"A81982","first_name":"MICAH","last_name":"WAITS","classification":"M","division":"PRODUCTION","hit_factor":5.9123},{"match_name":"2017 Arkansas Section Championship","match_date":"2017-06-14","stage_classifiercode":"09-08","member_number":"TY93931","first_name":"DANIEL","last_name":"THOMPSON","classification":"A","division":"PRODUCTION","hit_factor":5.8952},{"match_name":"CGC 100816","match_date":"2016-10-08","stage_classifiercode":"09-08","member_number":"A88177","first_name":"CHRIS","last_name":"SMITH","classification":"B","division":"PRODUCTION","hit_factor":5.8893},{"match_name":"LCSC Linden USPSA 031118","match_date":"2018-03-11","stage_classifiercode":"09-08","member_number":"FY25171","first_name":"KEVIN","last_name":"CHU","classification":"A","division":"PRODUCTION","hit_factor":5.8888},{"match_name":"MASTER BLASTERS & SSFGA USPSA - July","match_date":"2021-07-11","stage_classifiercode":"09-08","member_number":"TY128695","first_name":"RICK","last_name":"BARKER","classification":"A","division":"PRODUCTION","hit_factor":5.8824},{"match_name":"Nampa USPSA June 21st 2020","match_date":"2020-06-21","stage_classifiercode":"09-08","member_number":"A54049","first_name":"RICHARD","last_name":"METTLER","classification":"A","division":"PRODUCTION","hit_factor":5.8754},{"match_name":"MAPSA 2016.05.14","match_date":"2016-05-14","stage_classifiercode":"09-08","member_number":"TY68444","first_name":"MONTE","last_name":"BRUESEWITZ","classification":"B","division":"PRODUCTION","hit_factor":5.8516},{"match_name":"Mesilla Valley P Novemberr 2018","match_date":"2018-11-03","stage_classifiercode":"09-08","member_number":"A100408","first_name":"JAMES","last_name":"HEBERT","classification":"A","division":"PRODUCTION","hit_factor":5.8516},{"match_name":"2017 Arkansas Section Championship","match_date":"2017-06-14","stage_classifiercode":"09-08","member_number":"TY78276","first_name":"CRAIG","last_name":"OKENFUSS","classification":"M","division":"PRODUCTION","hit_factor":5.8182},{"match_name":"WTPS USPSA November Match 11-11-17","match_date":"2017-11-11","stage_classifiercode":"09-08","member_number":"TY76134","first_name":"JOSH","last_name":"REID","classification":"A","division":"PRODUCTION","hit_factor":5.814},{"match_name":"Coastal Area Practical Shooters 7-28-18 Special Classifier with","match_date":"2018-07-28","stage_classifiercode":"09-08","member_number":"A109664","first_name":"SEAN","last_name":"GRIFFITH","classification":"A","division":"PRODUCTION","hit_factor":5.803},{"match_name":"Alpha Mike August Classifier 2021   ","match_date":"2021-08-15","stage_classifiercode":"09-08","member_number":"A135377","first_name":"JESSE","last_name":"BEAMAN","classification":"C","division":"PRODUCTION","hit_factor":5.8},{"match_name":"Central IL Practical Shooters October Match","match_date":"2016-10-09","stage_classifiercode":"09-08","member_number":"FY87089","first_name":"MIKE","last_name":"WHEELER","classification":"C","division":"PRODUCTION","hit_factor":5.794},{"match_name":"PMSC  USPSA JULY 2017","match_date":"2017-07-01","stage_classifiercode":"09-08","member_number":"ty58976","first_name":"ERIC","last_name":"SCHEIRER","classification":"G","division":"PRODUCTION","hit_factor":5.7816},{"match_name":"QPS Quantico Shooting Club August 2021 USPSA   ","match_date":"2021-08-07","stage_classifiercode":"09-08","member_number":"TY77177","first_name":"TIMOTHY","last_name":"HICHAK","classification":"M","division":"PRODUCTION","hit_factor":5.7803},{"match_name":"Shoot GTR USPSA 12/20","match_date":"2016-12-20","stage_classifiercode":"09-08","member_number":"TY94255","first_name":"SHANE","last_name":"BETHEA","classification":"M","division":"PRODUCTION","hit_factor":5.7554},{"match_name":"Whitewater USPSA 3-17-2018","match_date":"2018-03-17","stage_classifiercode":"09-08","member_number":"TY68920","first_name":"TODD","last_name":"RECTOR","classification":"M","division":"PRODUCTION","hit_factor":5.7522},{"match_name":"MAPSA 2016.05.14","match_date":"2016-05-14","stage_classifiercode":"09-08","member_number":"TY82562","first_name":"GUNNAR","last_name":"AN","classification":"B","division":"PRODUCTION","hit_factor":5.7485},{"match_name":"TAC2 USPSA October 2017","match_date":"2017-10-07","stage_classifiercode":"09-08","member_number":"A73254","first_name":"TOM 2G","last_name":"PARDUE","classification":"B","division":"PRODUCTION","hit_factor":5.7471},{"match_name":"LCSC Linden USPSA 031118","match_date":"2018-03-11","stage_classifiercode":"09-08","member_number":"TY87259","first_name":"YEE-MIN","last_name":"LIN","classification":"B","division":"PRODUCTION","hit_factor":5.7386},{"match_name":"Shoot GTR USPA November 2018","match_date":"2018-11-04","stage_classifiercode":"09-08","member_number":"TY88494","first_name":"GEORGE","last_name":"DYSICO","classification":"A","division":"PRODUCTION","hit_factor":5.7143},{"match_name":"Treasure State Championship Hosted By MCAS","match_date":"2020-06-20","stage_classifiercode":"09-08","member_number":"L4483","first_name":"BRENT","last_name":"GAWRYLUK","classification":"M","division":"PRODUCTION","hit_factor":5.7143},{"match_name":"QPS Quantico Shooting Club January USPSA   ","match_date":"2021-01-09","stage_classifiercode":"09-08","member_number":"A96190","first_name":"RYAN","last_name":"LEHMAN","classification":"M","division":"PRODUCTION","hit_factor":5.6921},{"match_name":"2017 Arkansas Section Championship","match_date":"2017-06-14","stage_classifiercode":"09-08","member_number":"TY65873","first_name":"KEVIN","last_name":"SCHARTNER","classification":"B","division":"PRODUCTION","hit_factor":5.6782},{"match_name":"Lefthanders Gun Club Practical Shooters March 5 and 6","match_date":"2016-03-05","stage_classifiercode":"09-08","member_number":"TY70758","first_name":"DAVID","last_name":"HOSKINS","classification":"A","division":"PRODUCTION","hit_factor":5.665},{"match_name":"2da Copa Nacional USPSA ","match_date":"2016-05-22","stage_classifiercode":"09-08","member_number":"F88165","first_name":"JORGE","last_name":"CLAUDIO  SÁNCHEZ","classification":"C","division":"PRODUCTION","hit_factor":5.6367},{"match_name":"Lefthanders Gun Club Practical Shooters March 5 and 6","match_date":"2016-03-05","stage_classifiercode":"09-08","member_number":"TY73933","first_name":"JEFF","last_name":"MEYERS","classification":"A","division":"PRODUCTION","hit_factor":5.6304},{"match_name":"2016 Tennessee Atomic Blast","match_date":"2016-09-16","stage_classifiercode":"09-08","member_number":"A82223","first_name":"BRETT","last_name":"NETTLETON","classification":"M","division":"PRODUCTION","hit_factor":5.6281},{"match_name":"2016 Tennessee Atomic Blast","match_date":"2016-09-16","stage_classifiercode":"09-08","member_number":"A76179","first_name":"WESTON","last_name":"HENSLEY","classification":"G","division":"PRODUCTION","hit_factor":5.6206},{"match_name":"DGC USPSA Classifier Match","match_date":"2017-07-30","stage_classifiercode":"09-08","member_number":"A82422","first_name":"LAWTON","last_name":"SEGLER","classification":"B","division":"PRODUCTION","hit_factor":5.6166},{"match_name":"CCPL 06-27-2020","match_date":"2020-06-27","stage_classifiercode":"09-08","member_number":"A107521","first_name":"MARK","last_name":"MELLO","classification":"B","division":"PRODUCTION","hit_factor":5.6034},{"match_name":"MAPSA 2016.05.14","match_date":"2016-05-14","stage_classifiercode":"09-08","member_number":"A77361","first_name":"CRAIG","last_name":"EVANS","classification":"B","division":"PRODUCTION","hit_factor":5.6017},{"match_name":"OKCGC USPSA Feb 2018","match_date":"2018-02-03","stage_classifiercode":"09-08","member_number":"A91603","first_name":"JOHN PAUL","last_name":"LEFEBVRE","classification":"C","division":"PRODUCTION","hit_factor":5.5959},{"match_name":"USPSA MO21 Special Classifier 2Alpha SBRC February 27 2021","match_date":"2021-02-27","stage_classifiercode":"09-08","member_number":"A104348","first_name":"ROBERT","last_name":"ALGER","classification":"B","division":"PRODUCTION","hit_factor":5.5944},{"match_name":"APSC USPSA Classifier Match 07-01-17","match_date":"2017-07-01","stage_classifiercode":"09-08","member_number":"A89824","first_name":"MIKE","last_name":"WIERDSMA","classification":"B","division":"PRODUCTION","hit_factor":5.5626},{"match_name":"RPS November 2017 USPSA Match","match_date":"2017-11-11","stage_classifiercode":"09-08","member_number":"A79397","first_name":"BEN","last_name":"BERRY","classification":"G","division":"PRODUCTION","hit_factor":5.55},{"match_name":"Danville Rifle And Pistol Club USPSA Classifier Match","match_date":"2017-11-11","stage_classifiercode":"09-08","member_number":"Ty53381","first_name":"ROB","last_name":"KOSACK","classification":"M","division":"PRODUCTION","hit_factor":5.5489},{"match_name":"CRC_20160514_SuperClassifier","match_date":"2016-05-14","stage_classifiercode":"09-08","member_number":"A86605","first_name":"SEM","last_name":"CHIM","classification":"A","division":"PRODUCTION","hit_factor":5.5485},{"match_name":"PIPS 08-08-2018","match_date":"2018-08-07","stage_classifiercode":"09-08","member_number":"TY68444","first_name":"MONTE","last_name":"BRUESEWITZ","classification":"B","division":"PRODUCTION","hit_factor":5.5271},{"match_name":"Lefthanders Gun Club Practical Shooters March 5 and 6","match_date":"2016-03-05","stage_classifiercode":"09-08","member_number":"A70023","first_name":"NICK","last_name":"WEBB","classification":"B","division":"PRODUCTION","hit_factor":5.526},{"match_name":"QPS Quantico Shooting Club January USPSA   ","match_date":"2021-01-09","stage_classifiercode":"09-08","member_number":"FY98445","first_name":"NICK","last_name":"FRALICK","classification":"A","division":"PRODUCTION","hit_factor":5.5156},{"match_name":"USPSA-AB 2018-14 at Brooks Pistol Club -adhoc","match_date":"2018-08-08","stage_classifiercode":"09-08","member_number":"F108011","first_name":"STACEY","last_name":"LILLEHEI","classification":"U","division":"PRODUCTION","hit_factor":5.5066},{"match_name":"Alpha Mike August Classifier 2021   ","match_date":"2021-08-15","stage_classifiercode":"09-08","member_number":"A8032","first_name":"WILLIAM","last_name":"GO","classification":"A","division":"PRODUCTION","hit_factor":5.499},{"match_name":"2016 Tennessee Atomic Blast","match_date":"2016-09-16","stage_classifiercode":"09-08","member_number":"TY82182","first_name":"NORMA","last_name":"LEGADOS","classification":"B","division":"PRODUCTION","hit_factor":5.4795},{"match_name":"2016 Tennessee Atomic Blast","match_date":"2016-09-16","stage_classifiercode":"09-08","member_number":"A60272","first_name":"RICKY","last_name":"HAYES","classification":"B","division":"PRODUCTION","hit_factor":5.4765},{"match_name":"PCSI USPSA 2018 March Match","match_date":"2018-03-03","stage_classifiercode":"09-08","member_number":"A85908","first_name":"BOB","last_name":"LAUER","classification":"B","division":"PRODUCTION","hit_factor":5.4737},{"match_name":"TAC2 USPSA October 2017","match_date":"2017-10-07","stage_classifiercode":"09-08","member_number":"A64798","first_name":"MIKE","last_name":"MAUK","classification":"B","division":"PRODUCTION","hit_factor":5.4711},{"match_name":"Shoot GTR USPSA 12/20","match_date":"2016-12-20","stage_classifiercode":"09-08","member_number":"A87317","first_name":"MICHAEL","last_name":"DUKES","classification":"B","division":"PRODUCTION","hit_factor":5.4656},{"match_name":"MASTER BLASTERS & SSFGA USPSA - July","match_date":"2021-07-11","stage_classifiercode":"09-08","member_number":"A101682","first_name":"AUSTIN","last_name":"BLACKMAN","classification":"M","division":"PRODUCTION","hit_factor":5.4638},{"match_name":"PIPS 08-08-2018","match_date":"2018-08-07","stage_classifiercode":"09-08","member_number":"A90188","first_name":"BLAKE","last_name":"MAMER","classification":"A","division":"PRODUCTION","hit_factor":5.4393},{"match_name":"CCSC USPSA All Classifier Match","match_date":"2021-06-12","stage_classifiercode":"09-08","member_number":"A126736","first_name":"DUSTIN","last_name":"MOWERY","classification":"D","division":"PRODUCTION","hit_factor":5.4358},{"match_name":"Lefthanders Gun Club Practical Shooters March 5 and 6","match_date":"2016-03-05","stage_classifiercode":"09-08","member_number":"Fy59095","first_name":"SHELBY","last_name":"STOCKTON","classification":"M","division":"PRODUCTION","hit_factor":5.4156},{"match_name":"NCPS USPSA Handgun Match October 23 2016","match_date":"2016-10-23","stage_classifiercode":"09-08","member_number":"TY56287","first_name":"CHAD","last_name":"CASE","classification":"M","division":"PRODUCTION","hit_factor":5.4108},{"match_name":"DWB - Deadwood Boys USPSA 19 July 2020","match_date":"2020-07-19","stage_classifiercode":"09-08","member_number":"FY92802","first_name":"SCOTT","last_name":"CARMODY","classification":"B","division":"PRODUCTION","hit_factor":5.4002},{"match_name":"Jamaica Rifle FCA-09 USPSA Weekend Rumble March 12th -13th 2021","match_date":"2021-03-13","stage_classifiercode":"09-08","member_number":"F60671","first_name":"YEONIE","last_name":"CAMPBELL","classification":"C","division":"PRODUCTION","hit_factor":5.3794},{"match_name":"CIPSC IL02 Havana June USPSA","match_date":"2020-06-13","stage_classifiercode":"09-08","member_number":"A40542","first_name":"JOEL","last_name":"RIPPER","classification":"A","division":"PRODUCTION","hit_factor":5.3691},{"match_name":"QPS Quantico Shooting Club January USPSA   ","match_date":"2021-01-09","stage_classifiercode":"09-08","member_number":"A128047","first_name":"JOHN","last_name":"TREAT","classification":"B","division":"PRODUCTION","hit_factor":5.3678},{"match_name":"PCWC USPSA  8-28-2021","match_date":"2021-08-28","stage_classifiercode":"09-08","member_number":"ty62764","first_name":"TIM","last_name":"SELLERS","classification":"A","division":"PRODUCTION","hit_factor":5.3654},{"match_name":"Shoot GTR USPSA 12/20","match_date":"2016-12-20","stage_classifiercode":"09-08","member_number":"A45634","first_name":"MARK","last_name":"NUNNALLY","classification":"B","division":"PRODUCTION","hit_factor":5.3648},{"match_name":"Chillicothe April-2017 USPSA Match","match_date":"2017-04-23","stage_classifiercode":"09-08","member_number":"A99756","first_name":"THORPE","last_name":"FACER","classification":"U","division":"PRODUCTION","hit_factor":5.3604},{"match_name":"QPS Quantico Shooting Club August 2021 USPSA   ","match_date":"2021-08-07","stage_classifiercode":"09-08","member_number":"FY98445","first_name":"NICK","last_name":"FRALICK","classification":"A","division":"PRODUCTION","hit_factor":5.3533},{"match_name":"AREA 59  SPRING ALL CLASSIFIER","match_date":"2018-03-31","stage_classifiercode":"09-08","member_number":"L2998","first_name":"GARY","last_name":"WU","classification":"B","division":"PRODUCTION","hit_factor":5.3476},{"match_name":"RPS October 2018 USPSA Match","match_date":"2018-10-13","stage_classifiercode":"09-08","member_number":"TY71348","first_name":"REGGIE","last_name":"GARMON","classification":"A","division":"PRODUCTION","hit_factor":5.3248},{"match_name":"PIPS 08-08-2018","match_date":"2018-08-07","stage_classifiercode":"09-08","member_number":"TY65888","first_name":"GREG","last_name":"BESTLAND","classification":"B","division":"PRODUCTION","hit_factor":5.3039},{"match_name":"2017 Arkansas Section Championship","match_date":"2017-06-14","stage_classifiercode":"09-08","member_number":"TY16138","first_name":"CARLOS","last_name":"GUZMAN","classification":"A","division":"PRODUCTION","hit_factor":5.2966},{"match_name":"PIPS 08-08-2018","match_date":"2018-08-07","stage_classifiercode":"09-08","member_number":"A74052","first_name":"TED","last_name":"ZWIEG","classification":"A","division":"PRODUCTION","hit_factor":5.2948},{"match_name":"Pioneer Action Shooters USPSA 5-27-18","match_date":"2018-05-27","stage_classifiercode":"09-08","member_number":"FY48411","first_name":"JAMES","last_name":"DAVIS","classification":"B","division":"PRODUCTION","hit_factor":5.2922},{"match_name":"NCPS USPSA Handgun Match October 23 2016","match_date":"2016-10-23","stage_classifiercode":"09-08","member_number":"TY87259","first_name":"YEE-MIN","last_name":"LIN","classification":"B","division":"PRODUCTION","hit_factor":5.283},{"match_name":"Chillicothe April-2017 USPSA Match","match_date":"2017-04-23","stage_classifiercode":"09-08","member_number":"A99814","first_name":"THEODORE","last_name":"FACER","classification":"U","division":"PRODUCTION","hit_factor":5.2792},{"match_name":"QPS Quantico Shooting Club August 2021 USPSA   ","match_date":"2021-08-07","stage_classifiercode":"09-08","member_number":"A109718","first_name":"KYLE","last_name":"WEIR","classification":"B","division":"PRODUCTION","hit_factor":5.2632},{"match_name":"Mesilla Valley P Novemberr 2018","match_date":"2018-11-03","stage_classifiercode":"09-08","member_number":"Ty71940","first_name":"DEREK","last_name":"DRISCOLL","classification":"U","division":"PRODUCTION","hit_factor":5.2632},{"match_name":"Collin County USPSA 05-23-2021","match_date":"2021-05-23","stage_classifiercode":"09-08","member_number":"TY97971","first_name":"AL","last_name":"MATTER","classification":"A","division":"PRODUCTION","hit_factor":5.2521},{"match_name":"2016 Tennessee Atomic Blast","match_date":"2016-09-16","stage_classifiercode":"09-08","member_number":"A94917","first_name":"LUKE","last_name":"MOORE","classification":"A","division":"PRODUCTION","hit_factor":5.2516},{"match_name":"Bossier Parish Practical Shooters September 26 2020","match_date":"2020-09-26","stage_classifiercode":"09-08","member_number":"A102295","first_name":"CLAY","last_name":"JENKINS","classification":"B","division":"PRODUCTION","hit_factor":5.2459},{"match_name":"2017 Arkansas Section Championship","match_date":"2017-06-14","stage_classifiercode":"09-08","member_number":"A86278","first_name":"HWANSIK","last_name":"KIM","classification":"M","division":"PRODUCTION","hit_factor":5.2419},{"match_name":"SPSA USPSA August 1st Sat Match","match_date":"2018-08-04","stage_classifiercode":"09-08","member_number":"TY87299","first_name":"SCOTTY","last_name":"SIMPSON","classification":"A","division":"PRODUCTION","hit_factor":5.2411},{"match_name":"Collin County USPSA 05-23-2021","match_date":"2021-05-23","stage_classifiercode":"09-08","member_number":"A108072","first_name":"CONNER","last_name":"KNUTSON","classification":"M","division":"PRODUCTION","hit_factor":5.2349},{"match_name":"RPS November 2017 USPSA Match","match_date":"2017-11-11","stage_classifiercode":"09-08","member_number":"A95223","first_name":"KEVIN","last_name":"MCGOLDRICK","classification":"B","division":"PRODUCTION","hit_factor":5.2301},{"match_name":"QPS Quantico Shooting Club August 2021 USPSA   ","match_date":"2021-08-07","stage_classifiercode":"09-08","member_number":"A134307","first_name":"JOHN","last_name":"DOELLE III","classification":"U","division":"PRODUCTION","hit_factor":5.2231},{"match_name":"OKCGC 2017 January Classifier Spectacular","match_date":"2017-01-29","stage_classifiercode":"09-08","member_number":"A89709","first_name":"BRIAN","last_name":"SMITH","classification":"B","division":"PRODUCTION","hit_factor":5.2231},{"match_name":"Lefthanders Gun Club Practical Shooters March 5 and 6","match_date":"2016-03-05","stage_classifiercode":"09-08","member_number":"TY77453","first_name":"JOEL","last_name":"GUSTAFSON","classification":"B","division":"PRODUCTION","hit_factor":5.2224},{"match_name":"USPSA MO21 Special Classifier 2Alpha SBRC February 27 2021","match_date":"2021-02-27","stage_classifiercode":"09-08","member_number":"A111008","first_name":"CODY","last_name":"SHERMAN","classification":"B","division":"PRODUCTION","hit_factor":5.2083},{"match_name":"Griffin USPSA Match July 2017","match_date":"2017-07-15","stage_classifiercode":"09-08","member_number":"L628","first_name":"BRUCE","last_name":"BRAXTON","classification":"M","division":"PRODUCTION","hit_factor":5.2029},{"match_name":"RPS November 2017 USPSA Match","match_date":"2017-11-11","stage_classifiercode":"09-08","member_number":"A72513","first_name":"STEPHEN","last_name":"TUCKER","classification":"A","division":"PRODUCTION","hit_factor":5.2},{"match_name":"Pioneer Action Shooters USPSA 5-27-18","match_date":"2018-05-27","stage_classifiercode":"09-08","member_number":"TY104195","first_name":"ALECIA","last_name":"RUSSELL","classification":"B","division":"PRODUCTION","hit_factor":5.19},{"match_name":"MAPSA 2016.05.14","match_date":"2016-05-14","stage_classifiercode":"09-08","member_number":"A83098","first_name":"KRYSTAL","last_name":"DUNN","classification":"C","division":"PRODUCTION","hit_factor":5.1873},{"match_name":"WTPS USPSA November Match 11-11-17","match_date":"2017-11-11","stage_classifiercode":"09-08","member_number":"A53154","first_name":"HADEN","last_name":"HARGUS","classification":"B","division":"PRODUCTION","hit_factor":5.1823},{"match_name":"2021-11-06 USPSA  at Phoenix Rod and Gun Club","match_date":"2021-11-06","stage_classifiercode":"09-08","member_number":"A103714","first_name":"DAN","last_name":"TYLER","classification":"A","division":"PRODUCTION","hit_factor":5.1765},{"match_name":"Collin County USPSA Nov 6 2016","match_date":"2016-11-06","stage_classifiercode":"09-08","member_number":"A79128","first_name":"RYAN","last_name":"WILKS","classification":"A","division":"PRODUCTION","hit_factor":5.1724},{"match_name":"CTASA 3rd Sunday USPSA - February 2016","match_date":"2016-02-21","stage_classifiercode":"09-08","member_number":"A59751","first_name":"KENNETH","last_name":"NAFFZIGER","classification":"U","division":"PRODUCTION","hit_factor":5.157},{"match_name":"Medford USPSA May 2016 Match","match_date":"2016-05-15","stage_classifiercode":"09-08","member_number":"\"\"","first_name":"DAVID","last_name":"ENLOE","classification":"C","division":"PRODUCTION","hit_factor":5.1464},{"match_name":"PIPS 08-05-2020","match_date":"2020-08-05","stage_classifiercode":"09-08","member_number":"TY65888","first_name":"GREG","last_name":"BESTLAND","classification":"B","division":"PRODUCTION","hit_factor":5.1454},{"match_name":"MAPSA 2016.05.14","match_date":"2016-05-14","stage_classifiercode":"09-08","member_number":"A75747","first_name":"CASEY","last_name":"WITTNER","classification":"B","division":"PRODUCTION","hit_factor":5.1434},{"match_name":"2017 Arkansas Section Championship","match_date":"2017-06-14","stage_classifiercode":"09-08","member_number":"A98513","first_name":"JASON","last_name":"BRADLEY","classification":"M","division":"PRODUCTION","hit_factor":5.1387},{"match_name":"Whitewater USPSA 3-17-2018","match_date":"2018-03-17","stage_classifiercode":"09-08","member_number":"A91314","first_name":"CHRIS","last_name":"OLIVER","classification":"B","division":"PRODUCTION","hit_factor":5.123},{"match_name":"CPS USPSA Classifier Match September  2021","match_date":"2021-09-04","stage_classifiercode":"09-08","member_number":"A123812","first_name":"ZACK","last_name":"OLANDER","classification":"A","division":"PRODUCTION","hit_factor":5.1225},{"match_name":"PIPS 08-05-2020","match_date":"2020-08-05","stage_classifiercode":"09-08","member_number":"A92523","first_name":"ALLAN","last_name":"JOHNSON","classification":"C","division":"PRODUCTION","hit_factor":5.1185},{"match_name":"QPS Quantico Shooting Club August 2021 USPSA   ","match_date":"2021-08-07","stage_classifiercode":"09-08","member_number":"A136092","first_name":"PAYTON","last_name":"GARCIA","classification":"U","division":"PRODUCTION","hit_factor":5.1177},{"match_name":"TPS USPSA at CMP Jan 20 2018","match_date":"2018-01-20","stage_classifiercode":"09-08","member_number":"A71770","first_name":"TONY","last_name":"BOONE","classification":"A","division":"PRODUCTION","hit_factor":5.1177},{"match_name":"2017 Arkansas Section Championship","match_date":"2017-06-14","stage_classifiercode":"09-08","member_number":"A73180","first_name":"CHRIS","last_name":"KELLER","classification":"M","division":"PRODUCTION","hit_factor":5.1047},{"match_name":"Prescott 3rd Sunday USPSA 4-18-21 ALL CLASSIFIER","match_date":"2021-04-18","stage_classifiercode":"09-08","member_number":"TY92943","first_name":"JAMIE","last_name":"SHROUFE","classification":"A","division":"PRODUCTION","hit_factor":5.0995},{"match_name":"OREGON ARPC CC05 USPSA SEPT 9 2017","match_date":"2017-09-09","stage_classifiercode":"09-08","member_number":"A17434","first_name":"DAVID","last_name":"SIRIA","classification":"B","division":"PRODUCTION","hit_factor":5.0992},{"match_name":"2da Copa Nacional USPSA ","match_date":"2016-05-22","stage_classifiercode":"09-08","member_number":"F88166","first_name":"JOSE","last_name":"NAZARIO","classification":"U","division":"PRODUCTION","hit_factor":5.0941},{"match_name":"Chillicothe April-2017 USPSA Match","match_date":"2017-04-23","stage_classifiercode":"09-08","member_number":"A81724","first_name":"ROBERT","last_name":"WELCH","classification":"B","division":"PRODUCTION","hit_factor":5.0847},{"match_name":"QPS Quantico Shooting Club January USPSA   ","match_date":"2021-01-09","stage_classifiercode":"09-08","member_number":"A113610","first_name":"KYLE","last_name":"HUTSON","classification":"A","division":"PRODUCTION","hit_factor":5.0771},{"match_name":"Collin County USPSA Nov 6 2016","match_date":"2016-11-06","stage_classifiercode":"09-08","member_number":"A87719","first_name":"CASH","last_name":"BLODGETT","classification":"M","division":"PRODUCTION","hit_factor":5.0708},{"match_name":"QPS Quantico Shooting Club August 2021 USPSA   ","match_date":"2021-08-07","stage_classifiercode":"09-08","member_number":"A114651","first_name":"JIMMY","last_name":"BUNN","classification":"U","division":"PRODUCTION","hit_factor":5.0679},{"match_name":"Coastal Area Practical Shooters 7-28-18 Special Classifier with","match_date":"2018-07-28","stage_classifiercode":"09-08","member_number":"A106481","first_name":"LELAND","last_name":"WILLIS","classification":"C","division":"PRODUCTION","hit_factor":5.0607},{"match_name":"Central IL Practical Shooters October Match","match_date":"2016-10-09","stage_classifiercode":"09-08","member_number":"A91182","first_name":"MATTHEW","last_name":"ACKER","classification":"C","division":"PRODUCTION","hit_factor":5.0569},{"match_name":"AREA 59  SPRING ALL CLASSIFIER","match_date":"2018-03-31","stage_classifiercode":"09-08","member_number":"A76683","first_name":"CALVIN","last_name":"TRUONG","classification":"C","division":"PRODUCTION","hit_factor":5.0473},{"match_name":"MAPSA 2016.05.14","match_date":"2016-05-14","stage_classifiercode":"09-08","member_number":"TY65888","first_name":"GREG","last_name":"BESTLAND","classification":"B","division":"PRODUCTION","hit_factor":5.0454},{"match_name":"DWB - Deadwood Boys USPSA 19 July 2020","match_date":"2020-07-19","stage_classifiercode":"09-08","member_number":"A102027","first_name":"ANTONIO","last_name":"GONELLA","classification":"B","division":"PRODUCTION","hit_factor":5.0439},{"match_name":"CSS March 2018 USPSA Style Match","match_date":"2018-03-10","stage_classifiercode":"09-08","member_number":"\"\"","first_name":"DEREK","last_name":"DESCANT","classification":"B","division":"PRODUCTION","hit_factor":5.0262},{"match_name":"USPSA MO21 Special Classifier 2Alpha SBRC February 27 2021","match_date":"2021-02-27","stage_classifiercode":"09-08","member_number":"TY108307","first_name":"PATRICK","last_name":"MOYNA","classification":"U","division":"PRODUCTION","hit_factor":5.0145},{"match_name":"MAPSA 2016.05.14","match_date":"2016-05-14","stage_classifiercode":"09-08","member_number":"L3008","first_name":"MIKE","last_name":"BOFENKAMP","classification":"A","division":"PRODUCTION","hit_factor":5.0109},{"match_name":"OKCGC USPSA April 2018","match_date":"2018-04-07","stage_classifiercode":"09-08","member_number":"a95184","first_name":"BRADFORD","last_name":"BONAR","classification":"A","division":"PRODUCTION","hit_factor":4.995},{"match_name":"The one where somebody makes GM - Classifier - Renton USPSA - February 2021 - NW05","match_date":"2021-02-28","stage_classifiercode":"09-08","member_number":"A95116","first_name":"STEVE","last_name":"TAYLOR","classification":"U","division":"PRODUCTION","hit_factor":4.985},{"match_name":"Lefthanders Gun Club Practical Shooters March 5 and 6","match_date":"2016-03-05","stage_classifiercode":"09-08","member_number":"A-70136","first_name":"BRENT","last_name":"JACOBER","classification":"B","division":"PRODUCTION","hit_factor":4.9815},{"match_name":"LCSC Linden USPSA 031118","match_date":"2018-03-11","stage_classifiercode":"09-08","member_number":"A83657","first_name":"ROBERT","last_name":"RABINO","classification":"B","division":"PRODUCTION","hit_factor":4.9554},{"match_name":"ENPS May 2018 USPSA Match","match_date":"2018-05-06","stage_classifiercode":"09-08","member_number":"A71916","first_name":"GREG","last_name":"HOLLINS","classification":"M","division":"PRODUCTION","hit_factor":4.9528},{"match_name":"Pima Pistol Club USPSA July 12","match_date":"2020-07-12","stage_classifiercode":"09-08","member_number":"A127410","first_name":"DANIEL","last_name":"PETRO","classification":"U","division":"PRODUCTION","hit_factor":4.9451},{"match_name":"MAPSA 2016.05.14","match_date":"2016-05-14","stage_classifiercode":"09-08","member_number":"A92403","first_name":"BRIAN","last_name":"FABIAN","classification":"B","division":"PRODUCTION","hit_factor":4.9356},{"match_name":"2016 Tennessee Atomic Blast","match_date":"2016-09-16","stage_classifiercode":"09-08","member_number":"A82341","first_name":"DANIEL","last_name":"MEADOWS","classification":"C","division":"PRODUCTION","hit_factor":4.931},{"match_name":"CTASA 3rd Sunday USPSA - February 2016","match_date":"2016-02-21","stage_classifiercode":"09-08","member_number":"a93407","first_name":"KEVIN","last_name":"DODD","classification":"U","division":"PRODUCTION","hit_factor":4.9046},{"match_name":"WPS USPSA Monthly Match November 2018","match_date":"2018-11-10","stage_classifiercode":"09-08","member_number":"A112035","first_name":"JUSTIN","last_name":"KILGORE","classification":"U","division":"PRODUCTION","hit_factor":4.8994},{"match_name":"DWB - Deadwood Boys USPSA 19 July 2020","match_date":"2020-07-19","stage_classifiercode":"09-08","member_number":"TY102044","first_name":"KEVIN","last_name":"HANLEY","classification":"C","division":"PRODUCTION","hit_factor":4.8924},{"match_name":"2017 Arkansas Section Championship","match_date":"2017-06-14","stage_classifiercode":"09-08","member_number":"A92166","first_name":"WILL","last_name":"MORTON","classification":"B","division":"PRODUCTION","hit_factor":4.8924},{"match_name":"SFPC October 1 2017 USPSA Match","match_date":"2017-10-01","stage_classifiercode":"09-08","member_number":"L3969","first_name":"JOHN","last_name":"CICOS","classification":"C","division":"PRODUCTION","hit_factor":4.8913},{"match_name":"Klamath USPSA 08-05-18 JSPS OR09","match_date":"2018-08-05","stage_classifiercode":"09-08","member_number":"A96344","first_name":"RON","last_name":"HILDEBRANT","classification":"M","division":"PRODUCTION","hit_factor":4.8837},{"match_name":"2016 Tennessee Atomic Blast","match_date":"2016-09-16","stage_classifiercode":"09-08","member_number":"TY73254","first_name":"TOM","last_name":"PARDUE","classification":"B","division":"PRODUCTION","hit_factor":4.883},{"match_name":"Jamaica Rifle FCA-09 USPSA Weekend Rumble March 12th -13th 2021","match_date":"2021-03-13","stage_classifiercode":"09-08","member_number":"A93046","first_name":"PAUL","last_name":"SHOUCAIR","classification":"B","division":"PRODUCTION","hit_factor":4.878},{"match_name":"SHFC Action Pistol Sept 16","match_date":"2021-09-16","stage_classifiercode":"09-08","member_number":"A114710","first_name":"ANDREW","last_name":"RODERICK","classification":"B","division":"PRODUCTION","hit_factor":4.8724},{"match_name":"SSFGA & Master Blasters USPSA Classifier","match_date":"2018-11-17","stage_classifiercode":"09-08","member_number":"A113124","first_name":"DANIEL","last_name":"ALLEN","classification":"U","division":"PRODUCTION","hit_factor":4.8685},{"match_name":"Medford USPSA May 2016 Match","match_date":"2016-05-15","stage_classifiercode":"09-08","member_number":"\"\"","first_name":"TOM","last_name":"CAIL","classification":"A","division":"PRODUCTION","hit_factor":4.8644},{"match_name":"Crooked Creek Pistol League - April 2018 - Special Classifier","match_date":"2018-04-14","stage_classifiercode":"09-08","member_number":"A89773","first_name":"ADAM","last_name":"MARSHALL","classification":"B","division":"PRODUCTION","hit_factor":4.8574},{"match_name":"Ghost Town Shooters Special Classifier","match_date":"2018-06-30","stage_classifiercode":"09-08","member_number":"TY107169","first_name":"KYLE","last_name":"KUXHAUSEN","classification":"U","division":"PRODUCTION","hit_factor":4.8443},{"match_name":"SSFGA & Master Blasters USPSA Classifier","match_date":"2018-11-17","stage_classifiercode":"09-08","member_number":"A108076","first_name":"NELSON","last_name":"OCONNOR","classification":"C","division":"PRODUCTION","hit_factor":4.8443},{"match_name":"CCPS May 2016","match_date":"2016-05-15","stage_classifiercode":"09-08","member_number":"L3506","first_name":"DAN","last_name":"MILLER","classification":"C","division":"PRODUCTION","hit_factor":4.8436},{"match_name":"Richmond Boro Gun Club July 2018 Monthly USPSA match","match_date":"2018-07-21","stage_classifiercode":"09-08","member_number":"TY82583","first_name":"MICHAEL","last_name":"CHEN","classification":"C","division":"PRODUCTION","hit_factor":4.8421},{"match_name":"LCSC Linden USPSA 031118","match_date":"2018-03-11","stage_classifiercode":"09-08","member_number":"A89273","first_name":"STEPHEN","last_name":"BUONOCORE","classification":"B","division":"PRODUCTION","hit_factor":4.829},{"match_name":"Collin County USPSA Nov 6 2016","match_date":"2016-11-06","stage_classifiercode":"09-08","member_number":"A97542","first_name":"BROCK","last_name":"JOHNSON","classification":"C","division":"PRODUCTION","hit_factor":4.8263},{"match_name":"AREA 59  SPRING ALL CLASSIFIER","match_date":"2018-03-31","stage_classifiercode":"09-08","member_number":"TY83644","first_name":"BRETT","last_name":"THOMPSON","classification":"U","division":"PRODUCTION","hit_factor":4.8241},{"match_name":"2016 Tennessee Atomic Blast","match_date":"2016-09-16","stage_classifiercode":"09-08","member_number":"A83760","first_name":"KING","last_name":"DRUMMOND","classification":"B","division":"PRODUCTION","hit_factor":4.8193},{"match_name":"MCPSL Pistol 7-11-20","match_date":"2020-07-11","stage_classifiercode":"09-08","member_number":"A56257","first_name":"JOHN","last_name":"PODOLANKO","classification":"B","division":"PRODUCTION","hit_factor":4.8193},{"match_name":"Coastal Bend Shooters - USPSA - August 14 2016","match_date":"2016-08-14","stage_classifiercode":"09-08","member_number":"A95173","first_name":"ALEX","last_name":"LITTLE","classification":"U","division":"PRODUCTION","hit_factor":4.817},{"match_name":"Pioneer Action Shooters USPSA 5-27-18","match_date":"2018-05-27","stage_classifiercode":"09-08","member_number":"TY96968","first_name":"AARON","last_name":"PACYNA","classification":"C","division":"PRODUCTION","hit_factor":4.8128},{"match_name":"PIPS 08-05-2020","match_date":"2020-08-05","stage_classifiercode":"09-08","member_number":"A74052","first_name":"TED","last_name":"ZWIEG","classification":"A","division":"PRODUCTION","hit_factor":4.8114},{"match_name":"CARO USPSA MATCH NO 3","match_date":"2018-07-28","stage_classifiercode":"09-08","member_number":"A113079","first_name":"RENLIN","last_name":"ZHANG","classification":"U","division":"PRODUCTION","hit_factor":4.8104},{"match_name":"Collin County USPSA Nov 6 2016","match_date":"2016-11-06","stage_classifiercode":"09-08","member_number":"A89084","first_name":"KEN","last_name":"ITO","classification":"B","division":"PRODUCTION","hit_factor":4.8087},{"match_name":"CRC_20160514_SuperClassifier","match_date":"2016-05-14","stage_classifiercode":"09-08","member_number":"L3812","first_name":"STEVEN","last_name":"LICHON","classification":"B","division":"PRODUCTION","hit_factor":4.8059},{"match_name":"Treasure State Championship Hosted By MCAS","match_date":"2020-06-20","stage_classifiercode":"09-08","member_number":"A114132","first_name":"MARTIN","last_name":"SMITH","classification":"B","division":"PRODUCTION","hit_factor":4.8},{"match_name":"2017 Arkansas Section Championship","match_date":"2017-06-14","stage_classifiercode":"09-08","member_number":"A98705","first_name":"WESLEY","last_name":"BRITTEN","classification":"B","division":"PRODUCTION","hit_factor":4.8},{"match_name":"Strongpoint February 2017 Classifier Match","match_date":"2017-02-04","stage_classifiercode":"09-08","member_number":"TY84121","first_name":"GABOR","last_name":"MAGONY","classification":"C","division":"PRODUCTION","hit_factor":4.8},{"match_name":"Minot USPSA 10-11-20","match_date":"2020-10-11","stage_classifiercode":"09-08","member_number":"A114132","first_name":"MARTIN","last_name":"SMITH","classification":"B","division":"PRODUCTION","hit_factor":4.7878},{"match_name":"Medford USPSA May 2016 Match","match_date":"2016-05-15","stage_classifiercode":"09-08","member_number":"\"\"","first_name":"DON","last_name":"WOLFE","classification":"B","division":"PRODUCTION","hit_factor":4.7847},{"match_name":"Harvard Action Shooters June 2018 USPSA Pistol Match","match_date":"2018-06-10","stage_classifiercode":"09-08","member_number":"a91465","first_name":"EARL","last_name":"PARADISE","classification":"C","division":"PRODUCTION","hit_factor":4.7809},{"match_name":"Treasure State Championship Hosted By MCAS","match_date":"2020-06-20","stage_classifiercode":"09-08","member_number":"A88899","first_name":"SCOTT","last_name":"MCDOWELL","classification":"B","division":"PRODUCTION","hit_factor":4.7782},{"match_name":"Griffin USPSA Match July 2017","match_date":"2017-07-15","stage_classifiercode":"09-08","member_number":"A50277","first_name":"DAVID","last_name":"KNIGHT","classification":"G","division":"PRODUCTION","hit_factor":4.7666},{"match_name":"Chillicothe April-2018 USPSA Classifier Match","match_date":"2018-04-28","stage_classifiercode":"09-08","member_number":"A90882","first_name":"TODD","last_name":"GUTTSCHOW","classification":"C","division":"PRODUCTION","hit_factor":4.7581},{"match_name":"CGC 100816","match_date":"2016-10-08","stage_classifiercode":"09-08","member_number":"A84202","first_name":"DOUG","last_name":"RUTLEDGE","classification":"B","division":"PRODUCTION","hit_factor":4.7532},{"match_name":"PCSI USPSA 2018 March Match","match_date":"2018-03-03","stage_classifiercode":"09-08","member_number":"A95960","first_name":"RYAN","last_name":"CHERRY","classification":"B","division":"PRODUCTION","hit_factor":4.7516},{"match_name":"Harvard Action Shooters June 2018 USPSA Pistol Match","match_date":"2018-06-10","stage_classifiercode":"09-08","member_number":"A98390","first_name":"MIKE","last_name":"COLE","classification":"U","division":"PRODUCTION","hit_factor":4.7489},{"match_name":"MAPSA 2016.05.14","match_date":"2016-05-14","stage_classifiercode":"09-08","member_number":"A90576","first_name":"CHARLIE","last_name":"ONAN","classification":"C","division":"PRODUCTION","hit_factor":4.7472},{"match_name":"Shoot GTR USPA November 2018","match_date":"2018-11-04","stage_classifiercode":"09-08","member_number":"A45634","first_name":"MARK","last_name":"NUNNALLY","classification":"A","division":"PRODUCTION","hit_factor":4.7461},{"match_name":"2017 Arkansas Section Championship","match_date":"2017-06-14","stage_classifiercode":"09-08","member_number":"TY82278","first_name":"ROWDY","last_name":"BRICCO","classification":"M","division":"PRODUCTION","hit_factor":4.7388},{"match_name":"Pioneer Action Shooters USPSA 5-27-18","match_date":"2018-05-27","stage_classifiercode":"09-08","member_number":"\"\"","first_name":"CHRIS","last_name":"TESSIER","classification":"B","division":"PRODUCTION","hit_factor":4.7327},{"match_name":"NCPS USPSA Handgun Match October 23 2016","match_date":"2016-10-23","stage_classifiercode":"09-08","member_number":"A84616","first_name":"MJ","last_name":"FINEZA","classification":"B","division":"PRODUCTION","hit_factor":4.7244},{"match_name":"Chillicothe April-2018 USPSA Classifier Match","match_date":"2018-04-28","stage_classifiercode":"09-08","member_number":"A109815","first_name":"JASON","last_name":"BROUGHTON","classification":"U","division":"PRODUCTION","hit_factor":4.717},{"match_name":"OREGON ARPC CC05 USPSA SEPT 9 2017","match_date":"2017-09-09","stage_classifiercode":"09-08","member_number":"A96528","first_name":"ANSEL","last_name":"BAILEY","classification":"C","division":"PRODUCTION","hit_factor":4.7151},{"match_name":"2017 Arkansas Section Championship","match_date":"2017-06-14","stage_classifiercode":"09-08","member_number":"A82437","first_name":"STEVE","last_name":"WOLF","classification":"A","division":"PRODUCTION","hit_factor":4.7109},{"match_name":"Piscataqua  Master Blasters USPSA Special Classifier","match_date":"2017-12-03","stage_classifiercode":"09-08","member_number":"A98756","first_name":"TIMOTHY","last_name":"KELLY","classification":"C","division":"PRODUCTION","hit_factor":4.698},{"match_name":"ORSA USPSA January 2021","match_date":"2021-01-16","stage_classifiercode":"09-08","member_number":"A115322","first_name":"PAUL","last_name":"SMITH","classification":"C","division":"PRODUCTION","hit_factor":4.6931},{"match_name":"CIPSC IL02 Havana June USPSA","match_date":"2020-06-13","stage_classifiercode":"09-08","member_number":"A118368","first_name":"PATRICK","last_name":"WETSTEIN","classification":"C","division":"PRODUCTION","hit_factor":4.6891},{"match_name":"Tehama Shooters December 2020 USPSA","match_date":"2020-12-26","stage_classifiercode":"09-08","member_number":"A125815","first_name":"WESLEY","last_name":"HAMBRIGHT","classification":"C","division":"PRODUCTION","hit_factor":4.6816},{"match_name":"PCWC USPSA  8-28-2021","match_date":"2021-08-28","stage_classifiercode":"09-08","member_number":"A101612","first_name":"MATT","last_name":"MADSEN","classification":"M","division":"PRODUCTION","hit_factor":4.6739},{"match_name":"Collin County USPSA Nov 6 2016","match_date":"2016-11-06","stage_classifiercode":"09-08","member_number":"A97263","first_name":"PATRICK","last_name":"TARUC","classification":"U","division":"PRODUCTION","hit_factor":4.6729},{"match_name":"2017 Arkansas Section Championship","match_date":"2017-06-14","stage_classifiercode":"09-08","member_number":"A57012","first_name":"ALBERT","last_name":"SALINAS","classification":"M","division":"PRODUCTION","hit_factor":4.6653},{"match_name":"2da Copa Nacional USPSA ","match_date":"2016-05-22","stage_classifiercode":"09-08","member_number":"A89235","first_name":"LUIS ALBERTO","last_name":"QUILICHINI ALBORS","classification":"B","division":"PRODUCTION","hit_factor":4.6642},{"match_name":"NCPS USPSA Handgun Match October 23 2016","match_date":"2016-10-23","stage_classifiercode":"09-08","member_number":"TY75585","first_name":"AARON","last_name":"FRASER","classification":"B","division":"PRODUCTION","hit_factor":4.6637},{"match_name":"USPSA MO21 Special Classifier 2Alpha SBRC February 27 2021","match_date":"2021-02-27","stage_classifiercode":"09-08","member_number":"A114202","first_name":"AARON","last_name":"KOHLER","classification":"C","division":"PRODUCTION","hit_factor":4.6512},{"match_name":"WTPS USPSA November Match 11-11-17","match_date":"2017-11-11","stage_classifiercode":"09-08","member_number":"A104777","first_name":"RAY","last_name":"GALLARDO","classification":"U","division":"PRODUCTION","hit_factor":4.6371},{"match_name":"2016 Tennessee Atomic Blast","match_date":"2016-09-16","stage_classifiercode":"09-08","member_number":"A87619","first_name":"DANE","last_name":"BEATENBOUGH","classification":"B","division":"PRODUCTION","hit_factor":4.6263},{"match_name":"2016 Tennessee Atomic Blast","match_date":"2016-09-16","stage_classifiercode":"09-08","member_number":"L3192","first_name":"JASON","last_name":"ANGELL","classification":"M","division":"PRODUCTION","hit_factor":4.6231},{"match_name":"2017 Arkansas Section Championship","match_date":"2017-06-14","stage_classifiercode":"09-08","member_number":"TY9387","first_name":"RON","last_name":"HARDEE","classification":"C","division":"PRODUCTION","hit_factor":4.6222},{"match_name":"SPSA USPSA August 1st Sat Match","match_date":"2018-08-04","stage_classifiercode":"09-08","member_number":"TY77861","first_name":"JASON","last_name":"SHEPPARD","classification":"B","division":"PRODUCTION","hit_factor":4.6222},{"match_name":"PMSC  USPSA JULY 2017","match_date":"2017-07-01","stage_classifiercode":"09-08","member_number":"a91964","first_name":"JACOB","last_name":"WILLSON","classification":"B","division":"PRODUCTION","hit_factor":4.6198},{"match_name":"RPS November 2017 USPSA Match","match_date":"2017-11-11","stage_classifiercode":"09-08","member_number":"A85111","first_name":"YEN","last_name":"CHU","classification":"B","division":"PRODUCTION","hit_factor":4.6198},{"match_name":"AREA 59  SPRING ALL CLASSIFIER","match_date":"2018-03-31","stage_classifiercode":"09-08","member_number":"A65453","first_name":"BOB","last_name":"ZELLER","classification":"C","division":"PRODUCTION","hit_factor":4.6154},{"match_name":"AREA 59  SPRING ALL CLASSIFIER","match_date":"2018-03-31","stage_classifiercode":"09-08","member_number":"TY102734","first_name":"CHARLES","last_name":"JACKSON","classification":"G","division":"PRODUCTION","hit_factor":4.6154},{"match_name":"Shoot GTR USPSA 12/20","match_date":"2016-12-20","stage_classifiercode":"09-08","member_number":"A92644","first_name":"LEE","last_name":"TURNER","classification":"C","division":"PRODUCTION","hit_factor":4.6083},{"match_name":"Treasure State Championship Hosted By MCAS","match_date":"2020-06-20","stage_classifiercode":"09-08","member_number":"A41410","first_name":"PAUL","last_name":"NASH","classification":"","division":"PRODUCTION","hit_factor":4.6046},{"match_name":"OKCGC USPSA Feb 2018","match_date":"2018-02-03","stage_classifiercode":"09-08","member_number":"A95184","first_name":"BRADFORD","last_name":"BONAR","classification":"A","division":"PRODUCTION","hit_factor":4.6041},{"match_name":"CCPS May 2016","match_date":"2016-05-15","stage_classifiercode":"09-08","member_number":"TY31475","first_name":"JERRY W","last_name":"NELSON","classification":"B","division":"PRODUCTION","hit_factor":4.5998},{"match_name":"PIPS 08-08-2018","match_date":"2018-08-07","stage_classifiercode":"09-08","member_number":"PEN","first_name":"GUY","last_name":"KOHLNHOFER","classification":"U","division":"PRODUCTION","hit_factor":4.5922},{"match_name":"Pioneer Action Shooters USPSA 5-27-18","match_date":"2018-05-27","stage_classifiercode":"09-08","member_number":"A103580","first_name":"TYLER","last_name":"GASSETT","classification":"C","division":"PRODUCTION","hit_factor":4.5896},{"match_name":"MAPSA 2016.05.14","match_date":"2016-05-14","stage_classifiercode":"09-08","member_number":"A90913","first_name":"DAVID","last_name":"GILBERTSON","classification":"B","division":"PRODUCTION","hit_factor":4.5889},{"match_name":"Danville Rifle And Pistol Club USPSA Classifier Match","match_date":"2017-11-11","stage_classifiercode":"09-08","member_number":"\"\"","first_name":"ANDREW","last_name":"HUA","classification":"U","division":"PRODUCTION","hit_factor":4.5786},{"match_name":"NCPS USPSA Handgun Match October 23 2016","match_date":"2016-10-23","stage_classifiercode":"09-08","member_number":"TY86706","first_name":"CHRIS","last_name":"DEWEY","classification":"A","division":"PRODUCTION","hit_factor":4.5775},{"match_name":"TPS USPSA -  August Classifier Match 2020","match_date":"2020-08-01","stage_classifiercode":"09-08","member_number":"A68727","first_name":"RON","last_name":"OBRIEN","classification":"B","division":"PRODUCTION","hit_factor":4.5708},{"match_name":"2016 Tennessee Atomic Blast","match_date":"2016-09-16","stage_classifiercode":"09-08","member_number":"A63667","first_name":"JIM","last_name":"ELKINS","classification":"B","division":"PRODUCTION","hit_factor":4.562},{"match_name":"ENPS May 2018 USPSA Match","match_date":"2018-05-06","stage_classifiercode":"09-08","member_number":"A110229","first_name":"ANDREW","last_name":"HIPWELL","classification":"U","division":"PRODUCTION","hit_factor":4.5504},{"match_name":"SFPC October 1 2017 USPSA Match","match_date":"2017-10-01","stage_classifiercode":"09-08","member_number":"A99503","first_name":"ROBERT","last_name":"TORRES","classification":"C","division":"PRODUCTION","hit_factor":4.5496},{"match_name":"LCSC Linden USPSA 031118","match_date":"2018-03-11","stage_classifiercode":"09-08","member_number":"TY17315","first_name":"RON","last_name":"NAKABAYASHI","classification":"B","division":"PRODUCTION","hit_factor":4.5369},{"match_name":"Griffin USPSA Match July 2017","match_date":"2017-07-15","stage_classifiercode":"09-08","member_number":"A96933","first_name":"DAVID","last_name":"BLANTON","classification":"A","division":"PRODUCTION","hit_factor":4.5361},{"match_name":"Prescott 3rd Sunday USPSA 09-18-2016","match_date":"2016-09-18","stage_classifiercode":"09-08","member_number":"A85230","first_name":"ROSS","last_name":"DUNBAR","classification":"C","division":"PRODUCTION","hit_factor":4.5344},{"match_name":"Griffin USPSA Match July 2017","match_date":"2017-07-15","stage_classifiercode":"09-08","member_number":"A52643","first_name":"STEPHEN","last_name":"LEE","classification":"A","division":"PRODUCTION","hit_factor":4.532},{"match_name":"Southkent USPSA MAY match","match_date":"2017-05-20","stage_classifiercode":"09-08","member_number":"A52414","first_name":"RICHARD","last_name":"SERRY","classification":"A","division":"PRODUCTION","hit_factor":4.5283},{"match_name":"Treasure State Championship Hosted By MCAS","match_date":"2020-06-20","stage_classifiercode":"09-08","member_number":"A101416","first_name":"SLADE","last_name":"BETTENHAUSEN","classification":"B","division":"PRODUCTION","hit_factor":4.5147},{"match_name":"Wallis Orchard Practical Shooters January 2021 Club Match","match_date":"2021-01-17","stage_classifiercode":"09-08","member_number":"FY87421","first_name":"WALTER","last_name":"KNUR","classification":"B","division":"PRODUCTION","hit_factor":4.5139},{"match_name":"Collin County USPSA 05-23-2021","match_date":"2021-05-23","stage_classifiercode":"09-08","member_number":"TY129294","first_name":"JENNIFER","last_name":"TANG","classification":"C","division":"PRODUCTION","hit_factor":4.5139},{"match_name":"Harvard Action Shooters June 2018 USPSA Pistol Match","match_date":"2018-06-10","stage_classifiercode":"09-08","member_number":"TY77534","first_name":"KIVA","last_name":"SUTTON","classification":"A","division":"PRODUCTION","hit_factor":4.5122},{"match_name":"TPS USPSA at CMP Jan 20 2018","match_date":"2018-01-20","stage_classifiercode":"09-08","member_number":"A99925","first_name":"TYLER","last_name":"NELSON","classification":"A","division":"PRODUCTION","hit_factor":4.5045},{"match_name":"WPS USPSA Monthly Match November 2018","match_date":"2018-11-10","stage_classifiercode":"09-08","member_number":"A81453","first_name":"DENNIS","last_name":"RILEY","classification":"B","division":"PRODUCTION","hit_factor":4.4983},{"match_name":"SPSA USPSA August 1st Sat Match","match_date":"2018-08-04","stage_classifiercode":"09-08","member_number":"A106258","first_name":"DAVID","last_name":"BARKER","classification":"C","division":"PRODUCTION","hit_factor":4.4944},{"match_name":"Chillicothe April-2017 USPSA Match","match_date":"2017-04-23","stage_classifiercode":"09-08","member_number":"A81724","first_name":"ROBERT","last_name":"WELCH","classification":"B","division":"PRODUCTION","hit_factor":4.4931},{"match_name":"Collin County USPSA Nov 6 2016","match_date":"2016-11-06","stage_classifiercode":"09-08","member_number":"A68378","first_name":"MARK","last_name":"THOMPSON","classification":"B","division":"PRODUCTION","hit_factor":4.492},{"match_name":"MAPSA 2016.05.14","match_date":"2016-05-14","stage_classifiercode":"09-08","member_number":"a87600","first_name":"KHAI","last_name":"TRAN","classification":"B","division":"PRODUCTION","hit_factor":4.4883},{"match_name":"Pioneer Action Shooters USPSA 5-27-18","match_date":"2018-05-27","stage_classifiercode":"09-08","member_number":"FY91061","first_name":"JOSEPH","last_name":"FLANAGAN","classification":"B","division":"PRODUCTION","hit_factor":4.4872},{"match_name":"PMSC  USPSA JULY 2017","match_date":"2017-07-01","stage_classifiercode":"09-08","member_number":"L3218","first_name":"ROB","last_name":"EGAR","classification":"A","division":"PRODUCTION","hit_factor":4.4852},{"match_name":"PIPS 08-05-2020","match_date":"2020-08-05","stage_classifiercode":"09-08","member_number":"TY101172","first_name":"SCOTT","last_name":"WESTPHAL","classification":"C","division":"PRODUCTION","hit_factor":4.4734},{"match_name":"Lefthanders Gun Club Practical Shooters March 5 and 6","match_date":"2016-03-05","stage_classifiercode":"09-08","member_number":"A92891","first_name":"DAVE","last_name":"PERDEW","classification":"U","division":"PRODUCTION","hit_factor":4.4723},{"match_name":"TAC2 USPSA October 2017","match_date":"2017-10-07","stage_classifiercode":"09-08","member_number":"A70905","first_name":"DAN","last_name":"KINSLER","classification":"A","division":"PRODUCTION","hit_factor":4.4565},{"match_name":"QPS Quantico Shooting Club January USPSA   ","match_date":"2021-01-09","stage_classifiercode":"09-08","member_number":"TY51119","first_name":"CHRIS","last_name":"MOLNAR","classification":"A","division":"PRODUCTION","hit_factor":4.4524},{"match_name":"Shoot GTR USPSA 12/20","match_date":"2016-12-20","stage_classifiercode":"09-08","member_number":"FY69055","first_name":"YANCIE","last_name":"BRANNEN","classification":"A","division":"PRODUCTION","hit_factor":4.4517},{"match_name":"CGC 100816","match_date":"2016-10-08","stage_classifiercode":"09-08","member_number":"\"\"","first_name":"STEFAN","last_name":"FAULK","classification":"U","division":"PRODUCTION","hit_factor":4.4486},{"match_name":"CIPSC IL02 Havana June USPSA","match_date":"2020-06-13","stage_classifiercode":"09-08","member_number":"TY76538","first_name":"JAMIE","last_name":"DANIELS","classification":"B","division":"PRODUCTION","hit_factor":4.4444},{"match_name":"Wallis Orchard Practical Shooters January 2021 Club Match","match_date":"2021-01-17","stage_classifiercode":"09-08","member_number":"A115982","first_name":"BENJAMIN","last_name":"MICHAEL","classification":"C","division":"PRODUCTION","hit_factor":4.4406},{"match_name":"GAS Special Classifier","match_date":"2016-07-02","stage_classifiercode":"09-08","member_number":"\"\"","first_name":"GRANT","last_name":"WILLARD","classification":"U","division":"PRODUCTION","hit_factor":4.4405},{"match_name":"Hampden RPC July USPSA","match_date":"2017-07-16","stage_classifiercode":"09-08","member_number":"A42330","first_name":"STEPHEN","last_name":"WARD","classification":"B","division":"PRODUCTION","hit_factor":4.4321},{"match_name":"Collin County USPSA 05-23-2021","match_date":"2021-05-23","stage_classifiercode":"09-08","member_number":"FY78664","first_name":"CHARLES","last_name":"SEXTON","classification":"C","division":"PRODUCTION","hit_factor":4.431},{"match_name":"CGC 100816","match_date":"2016-10-08","stage_classifiercode":"09-08","member_number":"\"\"","first_name":"SAMUAL","last_name":"HUBER","classification":"A","division":"PRODUCTION","hit_factor":4.4205},{"match_name":"CCPS May 2016","match_date":"2016-05-15","stage_classifiercode":"09-08","member_number":"TY16176","first_name":"LARRY S","last_name":"CASTRO","classification":"C","division":"PRODUCTION","hit_factor":4.4199},{"match_name":"2016 Tennessee Atomic Blast","match_date":"2016-09-16","stage_classifiercode":"09-08","member_number":"TY73586","first_name":"MIKE","last_name":"CURRIER","classification":"M","division":"PRODUCTION","hit_factor":4.4188},{"match_name":"CRC_20160514_SuperClassifier","match_date":"2016-05-14","stage_classifiercode":"09-08","member_number":"A84725","first_name":"CHRIS","last_name":"BELL","classification":"C","division":"PRODUCTION","hit_factor":4.418},{"match_name":"Lefthanders Gun Club Practical Shooters March 5 and 6","match_date":"2016-03-05","stage_classifiercode":"09-08","member_number":"A79514","first_name":"KIP","last_name":"JACOBSEN","classification":"C","division":"PRODUCTION","hit_factor":4.4131},{"match_name":"CRC_20160514_SuperClassifier","match_date":"2016-05-14","stage_classifiercode":"09-08","member_number":"TY89758","first_name":"JOE","last_name":"LUCIANO","classification":"U","division":"PRODUCTION","hit_factor":4.4118},{"match_name":"1a Fecha USPSA 2020","match_date":"2020-01-19","stage_classifiercode":"09-08","member_number":"FL4595","first_name":"DOMINGO","last_name":"PEREZ","classification":"U","division":"PRODUCTION","hit_factor":4.4105},{"match_name":"MGS  October","match_date":"2016-10-08","stage_classifiercode":"09-08","member_number":"A88026","first_name":"ROLAN","last_name":"OCAMPO","classification":"A","division":"PRODUCTION","hit_factor":4.41},{"match_name":"Griffin USPSA Match July 2017","match_date":"2017-07-15","stage_classifiercode":"09-08","member_number":"ty50998","first_name":"GLEN","last_name":"WEBBER","classification":"A","division":"PRODUCTION","hit_factor":4.4077},{"match_name":"AREA 59  SPRING ALL CLASSIFIER","match_date":"2018-03-31","stage_classifiercode":"09-08","member_number":"A98351","first_name":"EZEKIEL","last_name":"ADACLOG","classification":"C","division":"PRODUCTION","hit_factor":4.4053},{"match_name":"OREGON ARPC CC05 USPSA SEPT 9 2017","match_date":"2017-09-09","stage_classifiercode":"09-08","member_number":"TY68593","first_name":"KELLAR","last_name":"AUTUMN","classification":"M","division":"PRODUCTION","hit_factor":4.397},{"match_name":"WGC WI USPSA Monthly Match 4-16-16","match_date":"2016-04-16","stage_classifiercode":"09-08","member_number":"TY67616","first_name":"DAN","last_name":"PAWLAK","classification":"B","division":"PRODUCTION","hit_factor":4.3935},{"match_name":"Griffin USPSA Match July 2017","match_date":"2017-07-15","stage_classifiercode":"09-08","member_number":"A95112","first_name":"DAVID","last_name":"HOLLAND","classification":"A","division":"PRODUCTION","hit_factor":4.3821},{"match_name":"MCPSL Pistol 7-11-20","match_date":"2020-07-11","stage_classifiercode":"09-08","member_number":"TY61459","first_name":"PHIL","last_name":"MCNAUGHTON","classification":"B","division":"PRODUCTION","hit_factor":4.3821},{"match_name":"Shoot GTR USPSA 12/20","match_date":"2016-12-20","stage_classifiercode":"09-08","member_number":"A60272","first_name":"RICKY","last_name":"HAYES","classification":"B","division":"PRODUCTION","hit_factor":4.3695},{"match_name":"DWB - Deadwood Boys USPSA 19 July 2020","match_date":"2020-07-19","stage_classifiercode":"09-08","member_number":"A114601","first_name":"JACK","last_name":"LATOURETTE","classification":"U","division":"PRODUCTION","hit_factor":4.363},{"match_name":"Chillicothe April-2017 USPSA Match","match_date":"2017-04-23","stage_classifiercode":"09-08","member_number":"TY89535","first_name":"DENNIS","last_name":"RAINVILLE","classification":"C","division":"PRODUCTION","hit_factor":4.3592},{"match_name":"CTASA 3rd Sunday USPSA - February 2016","match_date":"2016-02-21","stage_classifiercode":"09-08","member_number":"A79471","first_name":"FREDDIE","last_name":"DEPEREZ","classification":"B","division":"PRODUCTION","hit_factor":4.3561},{"match_name":"SSFGA & Master Blasters USPSA Classifier","match_date":"2018-11-17","stage_classifiercode":"09-08","member_number":"A111430","first_name":"SEAN","last_name":"MCCLURE","classification":"C","division":"PRODUCTION","hit_factor":4.344},{"match_name":"Strongpoint February 2017 Classifier Match","match_date":"2017-02-04","stage_classifiercode":"09-08","member_number":"A83341","first_name":"HUNTER","last_name":"RYAN","classification":"C","division":"PRODUCTION","hit_factor":4.3435},{"match_name":"QPS Quantico Shooting Club January USPSA   ","match_date":"2021-01-09","stage_classifiercode":"09-08","member_number":"A108822","first_name":"GARTH","last_name":"GRAHAM","classification":"B","division":"PRODUCTION","hit_factor":4.3432},{"match_name":"LCSC Linden USPSA 031118","match_date":"2018-03-11","stage_classifiercode":"09-08","member_number":"A46690","first_name":"GILBERT","last_name":"GEAMUNDO","classification":"B","division":"PRODUCTION","hit_factor":4.3382},{"match_name":"CGC 100816","match_date":"2016-10-08","stage_classifiercode":"09-08","member_number":"A97112","first_name":"BRETT","last_name":"TYLER","classification":"D","division":"PRODUCTION","hit_factor":4.3355},{"match_name":"MAPSA 2016.05.14","match_date":"2016-05-14","stage_classifiercode":"09-08","member_number":"A71454","first_name":"TOM","last_name":"TOLLIVER","classification":"C","division":"PRODUCTION","hit_factor":4.3333},{"match_name":"2016 Tennessee Atomic Blast","match_date":"2016-09-16","stage_classifiercode":"09-08","member_number":"TY80734","first_name":"RICK","last_name":"KYLE","classification":"B","division":"PRODUCTION","hit_factor":4.3265},{"match_name":"Collin County USPSA Nov 6 2016","match_date":"2016-11-06","stage_classifiercode":"09-08","member_number":"A79471","first_name":"FREDDIE","last_name":"DEPEREZ","classification":"B","division":"PRODUCTION","hit_factor":4.3265},{"match_name":"USPSA-AB 2018-14 at Brooks Pistol Club -adhoc","match_date":"2018-08-08","stage_classifiercode":"09-08","member_number":"F113311","first_name":"DAVE","last_name":"MERESKI","classification":"C","division":"PRODUCTION","hit_factor":4.3243},{"match_name":"PCWC USPSA  8-28-2021","match_date":"2021-08-28","stage_classifiercode":"09-08","member_number":"A86310","first_name":"MICHAEL","last_name":"JONES","classification":"A","division":"PRODUCTION","hit_factor":4.3237},{"match_name":"ENPS May 2018 USPSA Match","match_date":"2018-05-06","stage_classifiercode":"09-08","member_number":"A106508","first_name":"KYLE","last_name":"THIES","classification":"U","division":"PRODUCTION","hit_factor":4.3222},{"match_name":"2016 Tennessee Atomic Blast","match_date":"2016-09-16","stage_classifiercode":"09-08","member_number":"A78777","first_name":"EMILY","last_name":"ROBINSON","classification":"B","division":"PRODUCTION","hit_factor":4.3189},{"match_name":"Alpha Mike August Classifier 2021   ","match_date":"2021-08-15","stage_classifiercode":"09-08","member_number":"FY92760","first_name":"MIKE","last_name":"REED","classification":"C","division":"PRODUCTION","hit_factor":4.3189},{"match_name":"Pinetucky USPSA 03-20-2021","match_date":"2021-03-20","stage_classifiercode":"09-08","member_number":"A33671","first_name":"MARK","last_name":"SULLIVAN","classification":"B","division":"PRODUCTION","hit_factor":4.3178},{"match_name":"2017 Arkansas Section Championship","match_date":"2017-06-14","stage_classifiercode":"09-08","member_number":"A95184","first_name":"BRADFORD","last_name":"BONAR","classification":"C","division":"PRODUCTION","hit_factor":4.3165},{"match_name":"ENPS May 2018 USPSA Match","match_date":"2018-05-06","stage_classifiercode":"09-08","member_number":"A76775","first_name":"JERRY","last_name":"BORZOBOHATY","classification":"A","division":"PRODUCTION","hit_factor":4.3124},{"match_name":"ENPS May 2018 USPSA Match","match_date":"2018-05-06","stage_classifiercode":"09-08","member_number":"A108191","first_name":"RYAN","last_name":"AUSTIN","classification":"C","division":"PRODUCTION","hit_factor":4.3121},{"match_name":"Griffin USPSA Match July 2017","match_date":"2017-07-15","stage_classifiercode":"09-08","member_number":"PEN","first_name":"LANE","last_name":"RUTLEDGE","classification":"U","division":"PRODUCTION","hit_factor":4.3118},{"match_name":"Payson Practical Shooters - Action Shooting 2018 04 12","match_date":"2018-04-12","stage_classifiercode":"09-08","member_number":"Fy90171","first_name":"PETE","last_name":"UNDLIN","classification":"M","division":"PRODUCTION","hit_factor":4.3046},{"match_name":"Southkent USPSA MAY match","match_date":"2017-05-20","stage_classifiercode":"09-08","member_number":"\"\"","first_name":"AARON","last_name":"DEHAAN","classification":"U","division":"PRODUCTION","hit_factor":4.2955},{"match_name":"LCSC Linden USPSA 031118","match_date":"2018-03-11","stage_classifiercode":"09-08","member_number":"A93417","first_name":"TONY","last_name":"LE","classification":"C","division":"PRODUCTION","hit_factor":4.2951},{"match_name":"QPS Quantico Shooting Club August 2021 USPSA   ","match_date":"2021-08-07","stage_classifiercode":"09-08","member_number":"A130629","first_name":"JACOB","last_name":"ALDEAN","classification":"D","division":"PRODUCTION","hit_factor":4.2918},{"match_name":"NCPS USPSA Handgun Match October 23 2016","match_date":"2016-10-23","stage_classifiercode":"09-08","member_number":"TY67318","first_name":"TY","last_name":"HAMBY","classification":"B","division":"PRODUCTION","hit_factor":4.2843},{"match_name":"OKCGC USPSA Feb 2018","match_date":"2018-02-03","stage_classifiercode":"09-08","member_number":"a79171","first_name":"TROY","last_name":"BARKER","classification":"C","division":"PRODUCTION","hit_factor":4.2819},{"match_name":"CCSC USPSA All Classifier Match","match_date":"2021-06-12","stage_classifiercode":"09-08","member_number":"A130843","first_name":"PARKER","last_name":"COLE","classification":"U","division":"PRODUCTION","hit_factor":4.2791},{"match_name":"RBGC USPSA 2021-8-15 Special Classifier Match","match_date":"2021-08-15","stage_classifiercode":"09-08","member_number":"A100703","first_name":"PETER","last_name":"MALECKI","classification":"B","division":"PRODUCTION","hit_factor":4.2781},{"match_name":"4ta Copa USPSA","match_date":"2016-11-20","stage_classifiercode":"09-08","member_number":"A84044","first_name":"KATHIA","last_name":"RIVERA MELENDEZ","classification":"C","division":"PRODUCTION","hit_factor":4.2772},{"match_name":"PMSC  USPSA JULY 2017","match_date":"2017-07-01","stage_classifiercode":"09-08","member_number":"A101973","first_name":"CLAY","last_name":"SHERLOCK","classification":"C","division":"PRODUCTION","hit_factor":4.2718},{"match_name":"Sage Pistol League USPSA April 18 2021","match_date":"2021-04-18","stage_classifiercode":"09-08","member_number":"FY122346","first_name":"JASON","last_name":"WONG","classification":"B","division":"PRODUCTION","hit_factor":4.2631},{"match_name":"OREGON ARPC CC05 USPSA SEPT 9 2017","match_date":"2017-09-09","stage_classifiercode":"09-08","member_number":"L4182","first_name":"CHRIS","last_name":"GLANVILLE","classification":"B","division":"PRODUCTION","hit_factor":4.2629},{"match_name":"Chillicothe April-2017 USPSA Match","match_date":"2017-04-23","stage_classifiercode":"09-08","member_number":"TY89535","first_name":"DENNIS","last_name":"RAINVILLE","classification":"C","division":"PRODUCTION","hit_factor":4.2589},{"match_name":"Collin County USPSA Nov 6 2016","match_date":"2016-11-06","stage_classifiercode":"09-08","member_number":"TY-97509","first_name":"HENOCK","last_name":"ABEBE","classification":"B","division":"PRODUCTION","hit_factor":4.2553},{"match_name":"2017 Arkansas Section Championship","match_date":"2017-06-14","stage_classifiercode":"09-08","member_number":"A73992","first_name":"DOUGLAS","last_name":"PISCHKE","classification":"C","division":"PRODUCTION","hit_factor":4.2373},{"match_name":"RPS November 2017 USPSA Match","match_date":"2017-11-11","stage_classifiercode":"09-08","member_number":"A82023","first_name":"MATT","last_name":"PRANKA","classification":"G","division":"PRODUCTION","hit_factor":4.2362},{"match_name":"APSC USPSA Classifier Match 07-01-17","match_date":"2017-07-01","stage_classifiercode":"09-08","member_number":"A88699","first_name":"DEREK","last_name":"GUTHRIE","classification":"A","division":"PRODUCTION","hit_factor":4.2286},{"match_name":"2da Copa Nacional USPSA ","match_date":"2016-05-22","stage_classifiercode":"09-08","member_number":"A86185","first_name":"WILLIE","last_name":"SOTO","classification":"A","division":"PRODUCTION","hit_factor":4.2268},{"match_name":"Chillicothe April-2017 USPSA Match","match_date":"2017-04-23","stage_classifiercode":"09-08","member_number":"A98680","first_name":"MIKE","last_name":"GIBBONS","classification":"D","division":"PRODUCTION","hit_factor":4.2254},{"match_name":"MAPSA 2016.05.14","match_date":"2016-05-14","stage_classifiercode":"09-08","member_number":"A95301","first_name":"MICHAEL","last_name":"MORRIS","classification":"U","division":"PRODUCTION","hit_factor":4.2254},{"match_name":"MCPSL Pistol 7-11-20","match_date":"2020-07-11","stage_classifiercode":"09-08","member_number":"A123810","first_name":"WAYLON","last_name":"STEINMAN","classification":"C","division":"PRODUCTION","hit_factor":4.2241},{"match_name":"Medford USPSA May 2016 Match","match_date":"2016-05-15","stage_classifiercode":"09-08","member_number":"A37359","first_name":"TOM","last_name":"HOWARD","classification":"C","division":"PRODUCTION","hit_factor":4.2208},{"match_name":"Pioneer Action Shooters USPSA 5-27-18","match_date":"2018-05-27","stage_classifiercode":"09-08","member_number":"A111472","first_name":"DAVE","last_name":"MAXWELL","classification":"U","division":"PRODUCTION","hit_factor":4.2174},{"match_name":"BSPSC 2017 April Special Classifier","match_date":"2017-04-09","stage_classifiercode":"09-08","member_number":"NONE","first_name":"JAMES","last_name":"POELSTRA","classification":"U","division":"PRODUCTION","hit_factor":4.2163},{"match_name":"LCSC Linden USPSA 031118","match_date":"2018-03-11","stage_classifiercode":"09-08","member_number":"TY84142","first_name":"CHRISTINE","last_name":"ZADOR","classification":"U","division":"PRODUCTION","hit_factor":4.2142},{"match_name":"EASTER EGG HUNT AREA 59  ALL CLASSFIER MATCH","match_date":"2017-04-15","stage_classifiercode":"09-08","member_number":"fy92765","first_name":"BRANDON","last_name":"FOSS","classification":"U","division":"PRODUCTION","hit_factor":4.2105},{"match_name":"4ta Copa USPSA","match_date":"2016-11-20","stage_classifiercode":"09-08","member_number":"A89235","first_name":"LUIS ALBERTO","last_name":"QUILICHINI ALBORS","classification":"B","division":"PRODUCTION","hit_factor":4.1911},{"match_name":"USPSA MO21 Special Classifier 2Alpha SBRC February 27 2021","match_date":"2021-02-27","stage_classifiercode":"09-08","member_number":"A120200","first_name":"MIKE","last_name":"GAWF","classification":"C","division":"PRODUCTION","hit_factor":4.1885},{"match_name":"QPS Quantico Shooting Club August 2021 USPSA   ","match_date":"2021-08-07","stage_classifiercode":"09-08","member_number":"A136308","first_name":"SCOTT","last_name":"AMBRIDGE","classification":"U","division":"PRODUCTION","hit_factor":4.1825},{"match_name":"Southkent USPSA MAY match","match_date":"2017-05-20","stage_classifiercode":"09-08","member_number":"TY45940","first_name":"BRUCE","last_name":"WARREN","classification":"B","division":"PRODUCTION","hit_factor":4.1818},{"match_name":"Southkent USPSA MAY match","match_date":"2017-05-20","stage_classifiercode":"09-08","member_number":"TY77408","first_name":"DALE","last_name":"WYATT","classification":"C","division":"PRODUCTION","hit_factor":4.1801},{"match_name":"SFPS 5-3-20 USPSA","match_date":"2020-05-03","stage_classifiercode":"09-08","member_number":"A112086","first_name":"TOM","last_name":"MARSH","classification":"C","division":"PRODUCTION","hit_factor":4.1667},{"match_name":"OREGON ARPC CC05 USPSA SEPT 9 2017","match_date":"2017-09-09","stage_classifiercode":"09-08","member_number":"A56751","first_name":"KEVIN","last_name":"ROBY","classification":"C","division":"PRODUCTION","hit_factor":4.1667},{"match_name":"2da Copa Nacional USPSA ","match_date":"2016-05-22","stage_classifiercode":"09-08","member_number":"A89226","first_name":"MJ","last_name":"BRENES","classification":"B","division":"PRODUCTION","hit_factor":4.1597},{"match_name":"EASTER EGG HUNT AREA 59  ALL CLASSFIER MATCH","match_date":"2017-04-15","stage_classifiercode":"09-08","member_number":"TY102399","first_name":"ANTHONY","last_name":"DELACRUZ","classification":"U","division":"PRODUCTION","hit_factor":4.157},{"match_name":"WSPS OCTOBER 2016 SPECIAL CLASSIFIER MATCH","match_date":"2016-10-29","stage_classifiercode":"09-08","member_number":"TY43673","first_name":"DALE","last_name":"MOUNTAIN","classification":"C","division":"PRODUCTION","hit_factor":4.1534},{"match_name":"Maine Practical Shooters May 2021","match_date":"2021-05-08","stage_classifiercode":"09-08","member_number":"A130712","first_name":"LUTHER","last_name":"HYSLOP","classification":"B","division":"PRODUCTION","hit_factor":4.1387},{"match_name":"RBGC USPSA 2021-8-15 Special Classifier Match","match_date":"2021-08-15","stage_classifiercode":"09-08","member_number":"A136123","first_name":"ROBERT","last_name":"JOHNSTON","classification":"U","division":"PRODUCTION","hit_factor":4.1247},{"match_name":"Lefthanders Gun Club Practical Shooters March 5 and 6","match_date":"2016-03-05","stage_classifiercode":"09-08","member_number":"TY50006","first_name":"RANDY","last_name":"VOGEL","classification":"B","division":"PRODUCTION","hit_factor":4.1199},{"match_name":"WPS USPSA Monthly Match November 2018","match_date":"2018-11-10","stage_classifiercode":"09-08","member_number":"A90790","first_name":"JESSICA","last_name":"BRAUN","classification":"C","division":"PRODUCTION","hit_factor":4.1135},{"match_name":"CGC 100816","match_date":"2016-10-08","stage_classifiercode":"09-08","member_number":"A90524","first_name":"ANDREW","last_name":"LARRIER","classification":"C","division":"PRODUCTION","hit_factor":4.1131},{"match_name":"Chillicothe April-2018 USPSA Classifier Match","match_date":"2018-04-28","stage_classifiercode":"09-08","member_number":"A105910","first_name":"JEFF","last_name":"HOECKER","classification":"U","division":"PRODUCTION","hit_factor":4.1085},{"match_name":"OREGON ARPC CC05 USPSA SEPT 9 2017","match_date":"2017-09-09","stage_classifiercode":"09-08","member_number":"PEN","first_name":"CAMERON","last_name":"WILLIS","classification":"U","division":"PRODUCTION","hit_factor":4.1083},{"match_name":"OKCGC USPSA Feb 2018","match_date":"2018-02-03","stage_classifiercode":"09-08","member_number":"TY92780","first_name":"GREGORY","last_name":"GARDNER","classification":"C","division":"PRODUCTION","hit_factor":4.1074},{"match_name":"LCSC Linden USPSA 031118","match_date":"2018-03-11","stage_classifiercode":"09-08","member_number":"A97497","first_name":"ROBERT","last_name":"FRESHWATER","classification":"B","division":"PRODUCTION","hit_factor":4.1056},{"match_name":"Chillicothe April-2018 USPSA Classifier Match","match_date":"2018-04-28","stage_classifiercode":"09-08","member_number":"TY98751","first_name":"AARON","last_name":"HOLLENBECK","classification":"U","division":"PRODUCTION","hit_factor":4.1002},{"match_name":"ENPS May 2018 USPSA Match","match_date":"2018-05-06","stage_classifiercode":"09-08","member_number":"TY100441","first_name":"MICHAEL","last_name":"BOCKMAN","classification":"C","division":"PRODUCTION","hit_factor":4.0959},{"match_name":"SLOSA January 2018 USPSA CLASSIFIER MATCH","match_date":"2018-01-28","stage_classifiercode":"09-08","member_number":"A107773","first_name":"JAMES","last_name":"THORNBURGH","classification":"U","division":"PRODUCTION","hit_factor":4.0956},{"match_name":"RPS November 2017 USPSA Match","match_date":"2017-11-11","stage_classifiercode":"09-08","member_number":"A95222","first_name":"WEI","last_name":"YOUNG","classification":"B","division":"PRODUCTION","hit_factor":4.0956},{"match_name":"PCWC USPSA  8-28-2021","match_date":"2021-08-28","stage_classifiercode":"09-08","member_number":"A71719","first_name":"ED","last_name":"CHASE","classification":"M","division":"PRODUCTION","hit_factor":4.086},{"match_name":"EDPS USPSA October 2 2021","match_date":"2021-10-01","stage_classifiercode":"09-08","member_number":"A132407","first_name":"JUSTIN","last_name":"BRAY","classification":"D","division":"PRODUCTION","hit_factor":4.0853},{"match_name":"WSPS OCTOBER 2016 SPECIAL CLASSIFIER MATCH","match_date":"2016-10-29","stage_classifiercode":"09-08","member_number":"A93608","first_name":"JIM","last_name":"CAMERON","classification":"C","division":"PRODUCTION","hit_factor":4.0816},{"match_name":"NCPS USPSA Handgun Match October 23 2016","match_date":"2016-10-23","stage_classifiercode":"09-08","member_number":"A84617","first_name":"MIKE","last_name":"FINEZA","classification":"C","division":"PRODUCTION","hit_factor":4.0795},{"match_name":"Medford USPSA May 2016 Match","match_date":"2016-05-15","stage_classifiercode":"09-08","member_number":"TY70884","first_name":"TOM","last_name":"FLOWERS","classification":"C","division":"PRODUCTION","hit_factor":4.0602},{"match_name":"2017 Arkansas Section Championship","match_date":"2017-06-14","stage_classifiercode":"09-08","member_number":"A98546","first_name":"BRYAN","last_name":"BROWN","classification":"C","division":"PRODUCTION","hit_factor":4.0593},{"match_name":"Central IL Practical Shooters October Match","match_date":"2016-10-09","stage_classifiercode":"09-08","member_number":"FY51334","first_name":"JAMES","last_name":"STOBAUGH","classification":"A","division":"PRODUCTION","hit_factor":4.0566},{"match_name":"CRC_20160514_SuperClassifier","match_date":"2016-05-14","stage_classifiercode":"09-08","member_number":"A87911","first_name":"KEITH","last_name":"MARKEY","classification":"U","division":"PRODUCTION","hit_factor":4.0541},{"match_name":"USPSA MO21 Special Classifier 2Alpha SBRC February 27 2021","match_date":"2021-02-27","stage_classifiercode":"09-08","member_number":"L4301","first_name":"LARRY","last_name":"NELSON","classification":"C","division":"PRODUCTION","hit_factor":4.0541},{"match_name":"Southkent USPSA MAY match","match_date":"2017-05-20","stage_classifiercode":"09-08","member_number":"A102492","first_name":"TANNER","last_name":"POND","classification":"D","division":"PRODUCTION","hit_factor":4.0456},{"match_name":"CIPSC IL02 Havana June USPSA","match_date":"2020-06-13","stage_classifiercode":"09-08","member_number":"Ty88356","first_name":"MIKE","last_name":"FORTNEY","classification":"B","division":"PRODUCTION","hit_factor":4.0435},{"match_name":"Alpha Mike August Classifier 2021   ","match_date":"2021-08-15","stage_classifiercode":"09-08","member_number":"A126609","first_name":"ED","last_name":"BONAWITZ","classification":"C","division":"PRODUCTION","hit_factor":4.0423},{"match_name":"2016 Tennessee Atomic Blast","match_date":"2016-09-16","stage_classifiercode":"09-08","member_number":"A90145","first_name":"JOEY","last_name":"LIEW","classification":"B","division":"PRODUCTION","hit_factor":4.0415},{"match_name":"TPS USPSA at CMP Jan 20 2018","match_date":"2018-01-20","stage_classifiercode":"09-08","member_number":"a107951","first_name":"CHRIS","last_name":"ZOWODNY","classification":"U","division":"PRODUCTION","hit_factor":4.0389},{"match_name":"SLOSA January 2018 USPSA CLASSIFIER MATCH","match_date":"2018-01-28","stage_classifiercode":"09-08","member_number":"TY92479","first_name":"JOEL","last_name":"GONZALES","classification":"U","division":"PRODUCTION","hit_factor":4.033},{"match_name":"AREA 59  SPRING ALL CLASSIFIER","match_date":"2018-03-31","stage_classifiercode":"09-08","member_number":"A108397","first_name":"JOHN","last_name":"CHI","classification":"U","division":"PRODUCTION","hit_factor":4.0306},{"match_name":"TTS   12DEC2020","match_date":"2020-12-12","stage_classifiercode":"09-08","member_number":"A123884","first_name":"GENNADY","last_name":"KHOKHORIN","classification":"C","division":"PRODUCTION","hit_factor":4.0217},{"match_name":"PMSC  USPSA JULY 2017","match_date":"2017-07-01","stage_classifiercode":"09-08","member_number":"l3048","first_name":"DOUG","last_name":"BRYANT","classification":"A","division":"PRODUCTION","hit_factor":4.0174},{"match_name":"OKCGC 2017 January Classifier Spectacular","match_date":"2017-01-29","stage_classifiercode":"09-08","member_number":"L3603","first_name":"MITCH","last_name":"GIBSON","classification":"A","division":"PRODUCTION","hit_factor":4.0146},{"match_name":"Maine Practical Shooters May 2021","match_date":"2021-05-08","stage_classifiercode":"09-08","member_number":"TY128695","first_name":"RICK","last_name":"BARKER","classification":"B","division":"PRODUCTION","hit_factor":4.0067},{"match_name":"WTPS USPSA November Match 11-11-17","match_date":"2017-11-11","stage_classifiercode":"09-08","member_number":"TY66762","first_name":"DEAN","last_name":"WHITELAW","classification":"A","division":"PRODUCTION","hit_factor":4},{"match_name":"Central IL Practical Shooters October Match","match_date":"2016-10-09","stage_classifiercode":"09-08","member_number":"A63433","first_name":"ROB","last_name":"LEWIS","classification":"C","division":"PRODUCTION","hit_factor":3.9939},{"match_name":"2016 Tennessee Atomic Blast","match_date":"2016-09-16","stage_classifiercode":"09-08","member_number":"A79180","first_name":"SCOTT","last_name":"KATZ","classification":"A","division":"PRODUCTION","hit_factor":3.9936},{"match_name":"ENPS May 2018 USPSA Match","match_date":"2018-05-06","stage_classifiercode":"09-08","member_number":"A79735","first_name":"ALEXANDER","last_name":"GAC","classification":"M","division":"PRODUCTION","hit_factor":3.9909},{"match_name":"Prescott 3rd Sunday USPSA 4-18-21 ALL CLASSIFIER","match_date":"2021-04-18","stage_classifiercode":"09-08","member_number":"TY81201","first_name":"TRENT","last_name":"RUSSELL","classification":"C","division":"PRODUCTION","hit_factor":3.9886},{"match_name":"Lefthanders Gun Club Practical Shooters March 5 and 6","match_date":"2016-03-05","stage_classifiercode":"09-08","member_number":"TY66904","first_name":"KEN","last_name":"RIHANEK","classification":"B","division":"PRODUCTION","hit_factor":3.9841},{"match_name":"Medford USPSA May 2016 Match","match_date":"2016-05-15","stage_classifiercode":"09-08","member_number":"TY15252","first_name":"BOB","last_name":"SAYLOR","classification":"A","division":"PRODUCTION","hit_factor":3.9834},{"match_name":"NCPS USPSA Handgun Match October 23 2016","match_date":"2016-10-23","stage_classifiercode":"09-08","member_number":"A63407","first_name":"MORENO","last_name":"VILLANUEVA","classification":"C","division":"PRODUCTION","hit_factor":3.981},{"match_name":"2017 Arkansas Section Championship","match_date":"2017-06-14","stage_classifiercode":"09-08","member_number":"A96123","first_name":"BRANDON","last_name":"GREEN","classification":"C","division":"PRODUCTION","hit_factor":3.9768},{"match_name":"SPSA USPSA August 1st Sat Match","match_date":"2018-08-04","stage_classifiercode":"09-08","member_number":"A105091","first_name":"MATT","last_name":"GINN","classification":"U","division":"PRODUCTION","hit_factor":3.9755},{"match_name":"RPS November 2017 USPSA Match","match_date":"2017-11-11","stage_classifiercode":"09-08","member_number":"A106222","first_name":"DANIEL","last_name":"LEITH","classification":"U","division":"PRODUCTION","hit_factor":3.9755},{"match_name":"2017 Arkansas Section Championship","match_date":"2017-06-14","stage_classifiercode":"09-08","member_number":"A81036","first_name":"ELI","last_name":"RUSHING","classification":"M","division":"PRODUCTION","hit_factor":3.9728},{"match_name":"Collin County USPSA Nov 6 2016","match_date":"2016-11-06","stage_classifiercode":"09-08","member_number":"A99463","first_name":"NIKOLE","last_name":"THOMPSON","classification":"U","division":"PRODUCTION","hit_factor":3.9706},{"match_name":"QPS Quantico Shooting Club August 2021 USPSA   ","match_date":"2021-08-07","stage_classifiercode":"09-08","member_number":"A129516","first_name":"GARRETT","last_name":"SPANGLER","classification":"C","division":"PRODUCTION","hit_factor":3.9683},{"match_name":"USPSA","match_date":"2018-12-02","stage_classifiercode":"09-08","member_number":"A83862","first_name":"KENEDY","last_name":"NGUYEN","classification":"C","division":"PRODUCTION","hit_factor":3.9618},{"match_name":"Collin County USPSA 05-23-2021","match_date":"2021-05-23","stage_classifiercode":"09-08","member_number":"A76683","first_name":"CALVIN","last_name":"TRUONG","classification":"M","division":"PRODUCTION","hit_factor":3.9568},{"match_name":"WGC WI USPSA Monthly Match 4-16-16","match_date":"2016-04-16","stage_classifiercode":"09-08","member_number":"A86995","first_name":"NEIL","last_name":"KOWALKOWSKI","classification":"A","division":"PRODUCTION","hit_factor":3.9554},{"match_name":"NCPS USPSA Handgun Match October 23 2016","match_date":"2016-10-23","stage_classifiercode":"09-08","member_number":"TY83293","first_name":"MICHAEL","last_name":"MAGEE","classification":"B","division":"PRODUCTION","hit_factor":3.953},{"match_name":"Piscataqua  Master Blasters USPSA Special Classifier","match_date":"2017-12-03","stage_classifiercode":"09-08","member_number":"A96625","first_name":"DAVID","last_name":"MAHER","classification":"C","division":"PRODUCTION","hit_factor":3.9454},{"match_name":"Richmond Boro Gun Club July 2018 Monthly USPSA match","match_date":"2018-07-21","stage_classifiercode":"09-08","member_number":"A77457","first_name":"DRAGON","last_name":"CHOW","classification":"C","division":"PRODUCTION","hit_factor":3.9437},{"match_name":"Jamaica Rifle FCA-09 USPSA Weekend Rumble March 12th -13th 2021","match_date":"2021-03-13","stage_classifiercode":"09-08","member_number":"TY 124356","first_name":"MICHAEL","last_name":"WILKINSON","classification":"D","division":"PRODUCTION","hit_factor":3.9275},{"match_name":"2016 Tennessee Atomic Blast","match_date":"2016-09-16","stage_classifiercode":"09-08","member_number":"A94240","first_name":"ANDY","last_name":"WALKER","classification":"C","division":"PRODUCTION","hit_factor":3.9198},{"match_name":"WSPS OCTOBER 2016 SPECIAL CLASSIFIER MATCH","match_date":"2016-10-29","stage_classifiercode":"09-08","member_number":"A61054","first_name":"HAROLD","last_name":"HAWKINS","classification":"B","division":"PRODUCTION","hit_factor":3.9146},{"match_name":"APSC USPSA Classifier Match 07-01-17","match_date":"2017-07-01","stage_classifiercode":"09-08","member_number":"\"\"","first_name":"ALEX","last_name":"ACOSTA","classification":"U","division":"PRODUCTION","hit_factor":3.9112},{"match_name":"CCPS May 2016","match_date":"2016-05-15","stage_classifiercode":"09-08","member_number":"A64566","first_name":"JAMES","last_name":"THIEL","classification":"U","division":"PRODUCTION","hit_factor":3.9098},{"match_name":"Treasure State Championship Hosted By MCAS","match_date":"2020-06-20","stage_classifiercode":"09-08","member_number":"A100992","first_name":"TYLER","last_name":"AMUNDSON","classification":"A","division":"PRODUCTION","hit_factor":3.9053},{"match_name":"TPS USPSA -  August Classifier Match 2020","match_date":"2020-08-01","stage_classifiercode":"09-08","member_number":"A116040","first_name":"BILL","last_name":"BOWLING","classification":"U","division":"PRODUCTION","hit_factor":3.8933},{"match_name":"NCPS USPSA Handgun Match October 23 2016","match_date":"2016-10-23","stage_classifiercode":"09-08","member_number":"A93293","first_name":"ROSS","last_name":"SAN","classification":"C","division":"PRODUCTION","hit_factor":3.8883},{"match_name":"Richmond Boro Gun Club July 2018 Monthly USPSA match","match_date":"2018-07-21","stage_classifiercode":"09-08","member_number":"A104304","first_name":"DENNIS","last_name":"KHILKEVICH","classification":"D","division":"PRODUCTION","hit_factor":3.8796},{"match_name":"CCSC USPSA All Classifier Match","match_date":"2021-06-12","stage_classifiercode":"09-08","member_number":"A126896","first_name":"STAN","last_name":"BELVILLE","classification":"C","division":"PRODUCTION","hit_factor":3.8776},{"match_name":"PIPS 08-05-2020","match_date":"2020-08-05","stage_classifiercode":"09-08","member_number":"TY101880","first_name":"JOEY","last_name":"BETELAK","classification":"C","division":"PRODUCTION","hit_factor":3.876},{"match_name":"2016 Tennessee Atomic Blast","match_date":"2016-09-16","stage_classifiercode":"09-08","member_number":"A58352","first_name":"KEITH","last_name":"EDWARDS","classification":"C","division":"PRODUCTION","hit_factor":3.8753},{"match_name":"RPS October 2018 USPSA Match","match_date":"2018-10-13","stage_classifiercode":"09-08","member_number":"TY75530","first_name":"DAN","last_name":"AUTRY","classification":"U","division":"PRODUCTION","hit_factor":3.8716},{"match_name":"Central IL Practical Shooters October Match","match_date":"2016-10-09","stage_classifiercode":"09-08","member_number":"L3333","first_name":"BRIAN","last_name":"GRICE","classification":"C","division":"PRODUCTION","hit_factor":3.8704},{"match_name":"Piscataqua  Master Blasters USPSA Special Classifier","match_date":"2017-12-03","stage_classifiercode":"09-08","member_number":"A93445","first_name":"DARREN","last_name":"LANDINO","classification":"B","division":"PRODUCTION","hit_factor":3.869},{"match_name":"MASTER BLASTERS & SSFGA USPSA - July","match_date":"2021-07-11","stage_classifiercode":"09-08","member_number":"A129345","first_name":"TYLER","last_name":"SAVAGE","classification":"C","division":"PRODUCTION","hit_factor":3.8494},{"match_name":"SPSA USPSA August 1st Sat Match","match_date":"2018-08-04","stage_classifiercode":"09-08","member_number":"TY73254","first_name":"THOMAS","last_name":"PARDUE","classification":"B","division":"PRODUCTION","hit_factor":3.8462},{"match_name":"Treasure State Championship Hosted By MCAS","match_date":"2020-06-20","stage_classifiercode":"09-08","member_number":"A73685","first_name":"JASON","last_name":"ANDERSEN","classification":"B","division":"PRODUCTION","hit_factor":3.8422},{"match_name":"MAPSA 2016.05.14","match_date":"2016-05-14","stage_classifiercode":"09-08","member_number":"A47736","first_name":"LISA","last_name":"JOHNSON","classification":"C","division":"PRODUCTION","hit_factor":3.8397},{"match_name":"Lefthanders Gun Club Practical Shooters March 5 and 6","match_date":"2016-03-05","stage_classifiercode":"09-08","member_number":"A89927","first_name":"LUKE","last_name":"PECOR","classification":"U","division":"PRODUCTION","hit_factor":3.8384},{"match_name":"PIPS 08-08-2018","match_date":"2018-08-07","stage_classifiercode":"09-08","member_number":"A92109","first_name":"HENRY","last_name":"HOCRAFFER","classification":"D","division":"PRODUCTION","hit_factor":3.8361},{"match_name":"MCPSL Pistol 7-11-20","match_date":"2020-07-11","stage_classifiercode":"09-08","member_number":"FY85914","first_name":"JUSTIN","last_name":"BARDWELL","classification":"B","division":"PRODUCTION","hit_factor":3.8348},{"match_name":"Whitewater USPSA 3-17-2018","match_date":"2018-03-17","stage_classifiercode":"09-08","member_number":"A73145","first_name":"JASON","last_name":"CURRIE","classification":"B","division":"PRODUCTION","hit_factor":3.8086},{"match_name":"Coastal Area Practical Shooters 8-27-16","match_date":"2016-08-27","stage_classifiercode":"09-08","member_number":"A78387","first_name":"NICHOLAS","last_name":"MARLOW","classification":"U","division":"PRODUCTION","hit_factor":3.7938},{"match_name":"Coastal Area Practical Shooters 7-28-18 Special Classifier with","match_date":"2018-07-28","stage_classifiercode":"09-08","member_number":"TY75789","first_name":"DALE","last_name":"CARPENTER","classification":"U","division":"PRODUCTION","hit_factor":3.7931},{"match_name":"EDPS USPSA October 2 2021","match_date":"2021-10-01","stage_classifiercode":"09-08","member_number":"none","first_name":"SCOTT","last_name":"PIGG","classification":"U","division":"PRODUCTION","hit_factor":3.7891},{"match_name":"Klamath USPSA 08-05-18 JSPS OR09","match_date":"2018-08-05","stage_classifiercode":"09-08","member_number":"L4425","first_name":"MITCH","last_name":"MORA","classification":"M","division":"PRODUCTION","hit_factor":3.7838},{"match_name":"RPS October 2018 USPSA Match","match_date":"2018-10-13","stage_classifiercode":"09-08","member_number":"A104676","first_name":"MARK","last_name":"HAYES","classification":"B","division":"PRODUCTION","hit_factor":3.7838},{"match_name":"QPS Quantico Shooting Club August 2021 USPSA   ","match_date":"2021-08-07","stage_classifiercode":"09-08","member_number":"TY87233","first_name":"ANDREW","last_name":"STEIN","classification":"A","division":"PRODUCTION","hit_factor":3.7832},{"match_name":"Southkent USPSA MAY match","match_date":"2017-05-20","stage_classifiercode":"09-08","member_number":"A71514","first_name":"BOB","last_name":"HANN","classification":"D","division":"PRODUCTION","hit_factor":3.7815},{"match_name":"LCSC Linden USPSA 031118","match_date":"2018-03-11","stage_classifiercode":"09-08","member_number":"TY99258","first_name":"DON","last_name":"MCELHINNEY","classification":"C","division":"PRODUCTION","hit_factor":3.7766},{"match_name":"Chillicothe April-2017 USPSA Match","match_date":"2017-04-23","stage_classifiercode":"09-08","member_number":"FY51334","first_name":"JAMES","last_name":"STOBAUGH","classification":"A","division":"PRODUCTION","hit_factor":3.7755},{"match_name":"LCSC Linden USPSA 031118","match_date":"2018-03-11","stage_classifiercode":"09-08","member_number":"TY107457","first_name":"KANGWEI","last_name":"MAO","classification":"C","division":"PRODUCTION","hit_factor":3.7736},{"match_name":"Ghost Town Shooters Special Classifier","match_date":"2018-06-30","stage_classifiercode":"09-08","member_number":"TY107166","first_name":"KENNETH","last_name":"HILTON","classification":"U","division":"PRODUCTION","hit_factor":3.7736},{"match_name":"ENPS May 2018 USPSA Match","match_date":"2018-05-06","stage_classifiercode":"09-08","member_number":"A99531","first_name":"JEFFERY F","last_name":"NILES JR","classification":"B","division":"PRODUCTION","hit_factor":3.7714},{"match_name":"MCPSL Pistol 7-11-20","match_date":"2020-07-11","stage_classifiercode":"09-08","member_number":"A63252","first_name":"DAVID R.","last_name":"BAKER","classification":"B","division":"PRODUCTION","hit_factor":3.7543},{"match_name":"QPS Quantico Shooting Club August 2021 USPSA   ","match_date":"2021-08-07","stage_classifiercode":"09-08","member_number":"A131928","first_name":"JAMES","last_name":"HALE","classification":"C","division":"PRODUCTION","hit_factor":3.7526},{"match_name":"WGC WI USPSA Monthly Match 4-16-16","match_date":"2016-04-16","stage_classifiercode":"09-08","member_number":"A74858","first_name":"NATE","last_name":"HURLBUT","classification":"U","division":"PRODUCTION","hit_factor":3.75},{"match_name":"OREGON ARPC CC05 USPSA SEPT 9 2017","match_date":"2017-09-09","stage_classifiercode":"09-08","member_number":"A93744","first_name":"WARREN","last_name":"HENCH","classification":"C","division":"PRODUCTION","hit_factor":3.7491},{"match_name":"NCPS USPSA Handgun Match October 23 2016","match_date":"2016-10-23","stage_classifiercode":"09-08","member_number":"A77672","first_name":"JON","last_name":"WHITEHAIR","classification":"B","division":"PRODUCTION","hit_factor":3.7415},{"match_name":"TAC2 USPSA October 2017","match_date":"2017-10-07","stage_classifiercode":"09-08","member_number":"A18438","first_name":"JOHN H III","last_name":"ANDERSON","classification":"U","division":"PRODUCTION","hit_factor":3.7412},{"match_name":"EASTER EGG HUNT AREA 59  ALL CLASSFIER MATCH","match_date":"2017-04-15","stage_classifiercode":"09-08","member_number":"L2998","first_name":"GARY","last_name":"WU","classification":"B","division":"PRODUCTION","hit_factor":3.732},{"match_name":"ENPS May 2018 USPSA Match","match_date":"2018-05-06","stage_classifiercode":"09-08","member_number":"TY46397","first_name":"TIMOTHY","last_name":"MCSHEEHY","classification":"D","division":"PRODUCTION","hit_factor":3.7303},{"match_name":"2017 Arkansas Section Championship","match_date":"2017-06-14","stage_classifiercode":"09-08","member_number":"A79635","first_name":"JAMISON","last_name":"MCCOLLISTER","classification":"A","division":"PRODUCTION","hit_factor":3.7275},{"match_name":"Jamaica Rifle FCA-09 USPSA Weekend Rumble March 12th -13th 2021","match_date":"2021-03-13","stage_classifiercode":"09-08","member_number":"Tyf89979","first_name":"CHRISTOPHER","last_name":"NUNEZ","classification":"B","division":"PRODUCTION","hit_factor":3.7214},{"match_name":"DWB - Deadwood Boys USPSA 19 July 2020","match_date":"2020-07-19","stage_classifiercode":"09-08","member_number":"A125161","first_name":"TONY","last_name":"WANG","classification":"D","division":"PRODUCTION","hit_factor":3.7204},{"match_name":"Alpha Mike August Classifier 2021   ","match_date":"2021-08-15","stage_classifiercode":"09-08","member_number":"FY37818","first_name":"FRANK","last_name":"TOOKER","classification":"B","division":"PRODUCTION","hit_factor":3.7204},{"match_name":"2da Copa Nacional USPSA ","match_date":"2016-05-22","stage_classifiercode":"09-08","member_number":"A90765","first_name":"HEBER","last_name":"SOTO","classification":"U","division":"PRODUCTION","hit_factor":3.7168},{"match_name":"Jamaica Rifle FCA-09 USPSA Weekend Rumble March 12th -13th 2021","match_date":"2021-03-13","stage_classifiercode":"09-08","member_number":"F102-005","first_name":"MICHAEL","last_name":"BRADSHAW","classification":"B","division":"PRODUCTION","hit_factor":3.7162},{"match_name":"2017 Arkansas Section Championship","match_date":"2017-06-14","stage_classifiercode":"09-08","member_number":"L2848","first_name":"CLAY","last_name":"BINYON","classification":"B","division":"PRODUCTION","hit_factor":3.7152},{"match_name":"Nampa USPSA June 21st 2020","match_date":"2020-06-21","stage_classifiercode":"09-08","member_number":"A127385","first_name":"\"EDWARD \"\"JOHN\"\"\"","last_name":"WUNDER","classification":"C","division":"PRODUCTION","hit_factor":3.7149},{"match_name":"RCPS USPSA 8 Apr 2017","match_date":"2017-04-08","stage_classifiercode":"09-08","member_number":"A100860","first_name":"ROBERT","last_name":"HUNTER","classification":"U","division":"PRODUCTION","hit_factor":3.7143},{"match_name":"Maine Practical Shooters May 2021","match_date":"2021-05-08","stage_classifiercode":"09-08","member_number":"A86762","first_name":"NATE","last_name":"LAKE","classification":"A","division":"PRODUCTION","hit_factor":3.7138},{"match_name":"1a Fecha USPSA 2020","match_date":"2020-01-19","stage_classifiercode":"09-08","member_number":"TY90765","first_name":"HEBER","last_name":"SOTO","classification":"D","division":"PRODUCTION","hit_factor":3.7067},{"match_name":"SFPS 5-3-20 USPSA","match_date":"2020-05-03","stage_classifiercode":"09-08","member_number":"ty119416","first_name":"VIC","last_name":"MCKENNA","classification":"U","division":"PRODUCTION","hit_factor":3.7037},{"match_name":"QPS Quantico Shooting Club January USPSA   ","match_date":"2021-01-09","stage_classifiercode":"09-08","member_number":"TY120153","first_name":"MARK","last_name":"O'DRISCOLL","classification":"B","division":"PRODUCTION","hit_factor":3.6954},{"match_name":"RPS November 2017 USPSA Match","match_date":"2017-11-11","stage_classifiercode":"09-08","member_number":"A90156","first_name":"STEVE","last_name":"EVERETT","classification":"A","division":"PRODUCTION","hit_factor":3.6949},{"match_name":"WSPS OCTOBER 2016 SPECIAL CLASSIFIER MATCH","match_date":"2016-10-29","stage_classifiercode":"09-08","member_number":"A98930","first_name":"DAREN","last_name":"STONESIFER","classification":"U","division":"PRODUCTION","hit_factor":3.6889},{"match_name":"2016 Tennessee Atomic Blast","match_date":"2016-09-16","stage_classifiercode":"09-08","member_number":"TY83175","first_name":"JEFF","last_name":"SHANKS","classification":"C","division":"PRODUCTION","hit_factor":3.6889},{"match_name":"EDPS USPSA October 2 2021","match_date":"2021-10-01","stage_classifiercode":"09-08","member_number":"TY120343","first_name":"MICHAEL","last_name":"MORENO","classification":"C","division":"PRODUCTION","hit_factor":3.6853},{"match_name":"EASTER EGG HUNT AREA 59  ALL CLASSFIER MATCH","match_date":"2017-04-15","stage_classifiercode":"09-08","member_number":"ty93922","first_name":"PAT","last_name":"BYRNE","classification":"U","division":"PRODUCTION","hit_factor":3.6853},{"match_name":"Chillicothe April-2017 USPSA Match","match_date":"2017-04-23","stage_classifiercode":"09-08","member_number":"A57074","first_name":"MIKE","last_name":"KOWALSKI","classification":"C","division":"PRODUCTION","hit_factor":3.6851},{"match_name":"Richmond Boro Gun Club July 2018 Monthly USPSA match","match_date":"2018-07-21","stage_classifiercode":"09-08","member_number":"A109627","first_name":"JON-VINCENT","last_name":"TESTACCIO","classification":"U","division":"PRODUCTION","hit_factor":3.6779},{"match_name":"Coastal Area Practical Shooters 8-27-16","match_date":"2016-08-27","stage_classifiercode":"09-08","member_number":"TY37474","first_name":"DARRELL","last_name":"WALKER","classification":"B","division":"PRODUCTION","hit_factor":3.6765},{"match_name":"ENPS May 2018 USPSA Match","match_date":"2018-05-06","stage_classifiercode":"09-08","member_number":"A96783","first_name":"ANDREW","last_name":"FRAZIER","classification":"C","division":"PRODUCTION","hit_factor":3.6728},{"match_name":"QPS Quantico Shooting Club August 2021 USPSA   ","match_date":"2021-08-07","stage_classifiercode":"09-08","member_number":"TY135830","first_name":"MIKE","last_name":"CABUSAO","classification":"U","division":"PRODUCTION","hit_factor":3.6721},{"match_name":"CCPS May 2016","match_date":"2016-05-15","stage_classifiercode":"09-08","member_number":"\"\"","first_name":"ZANE","last_name":"WILLARD","classification":"U","division":"PRODUCTION","hit_factor":3.6713},{"match_name":"Lefthanders Gun Club Practical Shooters March 5 and 6","match_date":"2016-03-05","stage_classifiercode":"09-08","member_number":"A79608","first_name":"DAVE","last_name":"OVERLAND","classification":"U","division":"PRODUCTION","hit_factor":3.6706},{"match_name":"USPSA MO21 Special Classifier 2Alpha SBRC February 27 2021","match_date":"2021-02-27","stage_classifiercode":"09-08","member_number":"A117002","first_name":"CODY","last_name":"AUTRY","classification":"U","division":"PRODUCTION","hit_factor":3.6697},{"match_name":"4ta Copa USPSA","match_date":"2016-11-20","stage_classifiercode":"09-08","member_number":"\"\"","first_name":"PEDRO E.","last_name":"RIVERA","classification":"U","division":"PRODUCTION","hit_factor":3.6547},{"match_name":"PIPS 08-08-2018","match_date":"2018-08-07","stage_classifiercode":"09-08","member_number":"PEN","first_name":"JASON","last_name":"SELNESS","classification":"U","division":"PRODUCTION","hit_factor":3.6472},{"match_name":"DWB - Deadwood Boys USPSA 19 July 2020","match_date":"2020-07-19","stage_classifiercode":"09-08","member_number":"TY110655","first_name":"COSMO","last_name":"WORKS","classification":"U","division":"PRODUCTION","hit_factor":3.6421},{"match_name":"DGC USPSA Classifier Match","match_date":"2017-07-30","stage_classifiercode":"09-08","member_number":"A99192","first_name":"PAUL","last_name":"DILLINGHAM","classification":"U","division":"PRODUCTION","hit_factor":3.6318},{"match_name":"RCPS USPSA 8 Apr 2017","match_date":"2017-04-08","stage_classifiercode":"09-08","member_number":"A87161","first_name":"STAN","last_name":"SHERROD","classification":"C","division":"PRODUCTION","hit_factor":3.6311},{"match_name":"Danville Rifle And Pistol Club USPSA Classifier Match","match_date":"2017-11-11","stage_classifiercode":"09-08","member_number":"TY88356","first_name":"MICHAEL","last_name":"FORTNEY","classification":"B","division":"PRODUCTION","hit_factor":3.6206},{"match_name":"Alpha Mike August Classifier 2021   ","match_date":"2021-08-15","stage_classifiercode":"09-08","member_number":"L4447","first_name":"CLAYTON","last_name":"SPURGEON","classification":"A","division":"PRODUCTION","hit_factor":3.6115},{"match_name":"Chillicothe April-2017 USPSA Match","match_date":"2017-04-23","stage_classifiercode":"09-08","member_number":"FY51334","first_name":"JAMES","last_name":"STOBAUGH","classification":"A","division":"PRODUCTION","hit_factor":3.6111},{"match_name":"Lefthanders Gun Club Practical Shooters March 5 and 6","match_date":"2016-03-05","stage_classifiercode":"09-08","member_number":"A90879","first_name":"JOSEPHU","last_name":"TOOEY","classification":"C","division":"PRODUCTION","hit_factor":3.6063},{"match_name":"2021-11-06 USPSA  at Phoenix Rod and Gun Club","match_date":"2021-11-06","stage_classifiercode":"09-08","member_number":"A130733","first_name":"GENTRY","last_name":"TENNYSON","classification":"D","division":"PRODUCTION","hit_factor":3.6009},{"match_name":"RPS October 2018 USPSA Match","match_date":"2018-10-13","stage_classifiercode":"09-08","member_number":"A60702","first_name":"MICHAEL","last_name":"DENOBLE","classification":"B","division":"PRODUCTION","hit_factor":3.5994},{"match_name":"Chillicothe April-2018 USPSA Classifier Match","match_date":"2018-04-28","stage_classifiercode":"09-08","member_number":"FY87089","first_name":"WILLIS","last_name":"WHEELER","classification":"B","division":"PRODUCTION","hit_factor":3.5909},{"match_name":"OKCGC 2017 January Classifier Spectacular","match_date":"2017-01-29","stage_classifiercode":"09-08","member_number":"A78520","first_name":"KELLY","last_name":"GOODWIN","classification":"C","division":"PRODUCTION","hit_factor":3.5772},{"match_name":"Collin County USPSA Nov 6 2016","match_date":"2016-11-06","stage_classifiercode":"09-08","member_number":"TY83648","first_name":"JERRY","last_name":"WIESE","classification":"B","division":"PRODUCTION","hit_factor":3.5768},{"match_name":"Lefthanders Gun Club Practical Shooters March 5 and 6","match_date":"2016-03-05","stage_classifiercode":"09-08","member_number":"TY76849","first_name":"RYAN","last_name":"CLOUSE","classification":"B","division":"PRODUCTION","hit_factor":3.5656},{"match_name":"Tehama Shooters December 2020 USPSA","match_date":"2020-12-26","stage_classifiercode":"09-08","member_number":"Ty95027","first_name":"ZACHARY","last_name":"MCMORDIE","classification":"B","division":"PRODUCTION","hit_factor":3.5621},{"match_name":"2017-10 Bone Creek USPSA","match_date":"2017-10-01","stage_classifiercode":"09-08","member_number":"\"\"","first_name":"ALEKSANDER","last_name":"ISSA","classification":"U","division":"PRODUCTION","hit_factor":3.5605},{"match_name":"Range 307 USPSA 5/7/2017","match_date":"2017-05-07","stage_classifiercode":"09-08","member_number":"A102188","first_name":"CORY","last_name":"GOFF","classification":"\"\"","division":"PRODUCTION","hit_factor":3.5562},{"match_name":"ENPS May 2018 USPSA Match","match_date":"2018-05-06","stage_classifiercode":"09-08","member_number":"A98857","first_name":"CHANDY","last_name":"SOUVATRAT","classification":"C","division":"PRODUCTION","hit_factor":3.556},{"match_name":"Lefthanders Gun Club Practical Shooters March 5 and 6","match_date":"2016-03-05","stage_classifiercode":"09-08","member_number":"FY87089","first_name":"MIKE","last_name":"WHEELER","classification":"C","division":"PRODUCTION","hit_factor":3.5484},{"match_name":"2016 Tennessee Atomic Blast","match_date":"2016-09-16","stage_classifiercode":"09-08","member_number":"TY82331","first_name":"DREW","last_name":"WALTERS","classification":"B","division":"PRODUCTION","hit_factor":3.5469},{"match_name":"Shoot GTR USPSA 12/20","match_date":"2016-12-20","stage_classifiercode":"09-08","member_number":"A97828","first_name":"LEN","last_name":"WELD","classification":"U","division":"PRODUCTION","hit_factor":3.5461},{"match_name":"LCSC Linden USPSA 031118","match_date":"2018-03-11","stage_classifiercode":"09-08","member_number":"A91168","first_name":"DEREK","last_name":"LIU","classification":"C","division":"PRODUCTION","hit_factor":3.5408},{"match_name":"Mesilla Valley P Novemberr 2018","match_date":"2018-11-03","stage_classifiercode":"09-08","member_number":"A61568","first_name":"WARREN","last_name":"ZEMAN","classification":"C","division":"PRODUCTION","hit_factor":3.5357},{"match_name":"QPS Quantico Shooting Club August 2021 USPSA   ","match_date":"2021-08-07","stage_classifiercode":"09-08","member_number":"TY91652","first_name":"KENT","last_name":"NORDSTROM 2","classification":"A","division":"PRODUCTION","hit_factor":3.5339},{"match_name":"1a Fecha USPSA 2020","match_date":"2020-01-19","stage_classifiercode":"09-08","member_number":"TY84044","first_name":"KATHIA","last_name":"RIVERA-MELENDEZ","classification":"B","division":"PRODUCTION","hit_factor":3.5305},{"match_name":"Collin County USPSA Nov 6 2016","match_date":"2016-11-06","stage_classifiercode":"09-08","member_number":"A98014","first_name":"MARK","last_name":"SHOWAH","classification":"U","division":"PRODUCTION","hit_factor":3.5191},{"match_name":"Chillicothe April-2017 USPSA Match","match_date":"2017-04-23","stage_classifiercode":"09-08","member_number":"A102567","first_name":"MIKE","last_name":"STEELE","classification":"U","division":"PRODUCTION","hit_factor":3.5176},{"match_name":"Collin County USPSA Nov 6 2016","match_date":"2016-11-06","stage_classifiercode":"09-08","member_number":"A99327","first_name":"JERRY","last_name":"ISELI","classification":"U","division":"PRODUCTION","hit_factor":3.5139},{"match_name":"AREA 59  SPRING ALL CLASSIFIER","match_date":"2018-03-31","stage_classifiercode":"09-08","member_number":"TY106228","first_name":"PAGE","last_name":"BRUNKHORST","classification":"U","division":"PRODUCTION","hit_factor":3.5115},{"match_name":"CRC_20160514_SuperClassifier","match_date":"2016-05-14","stage_classifiercode":"09-08","member_number":"A93954","first_name":"JONATHAN","last_name":"ECKLEY","classification":"U","division":"PRODUCTION","hit_factor":3.5068},{"match_name":"CIPSC IL02 Havana June USPSA","match_date":"2020-06-13","stage_classifiercode":"09-08","member_number":"A118368","first_name":"PATRICK","last_name":"WETSTEIN","classification":"C","division":"PRODUCTION","hit_factor":3.504},{"match_name":"SLOSA January 2018 USPSA CLASSIFIER MATCH","match_date":"2018-01-28","stage_classifiercode":"09-08","member_number":"A98002","first_name":"SHANE","last_name":"GOLDMAN","classification":"U","division":"PRODUCTION","hit_factor":3.4949},{"match_name":"Piscataqua  Master Blasters USPSA Special Classifier","match_date":"2017-12-03","stage_classifiercode":"09-08","member_number":"A105613","first_name":"NICHOLAS","last_name":"GABINET","classification":"U","division":"PRODUCTION","hit_factor":3.4946},{"match_name":"2017 Arkansas Section Championship","match_date":"2017-06-14","stage_classifiercode":"09-08","member_number":"A73637","first_name":"JAMES","last_name":"JONES","classification":"C","division":"PRODUCTION","hit_factor":3.4913},{"match_name":"RCPS USPSA 8 Apr 2017","match_date":"2017-04-08","stage_classifiercode":"09-08","member_number":"FY82472","first_name":"JONATHAN","last_name":"JOHANNESMEYER","classification":"B","division":"PRODUCTION","hit_factor":3.4873},{"match_name":"PMSC  USPSA JULY 2017","match_date":"2017-07-01","stage_classifiercode":"09-08","member_number":"fy85192","first_name":"KELLY","last_name":"RADINSKY","classification":"C","division":"PRODUCTION","hit_factor":3.4826},{"match_name":"PIPS 08-05-2020","match_date":"2020-08-05","stage_classifiercode":"09-08","member_number":"TY81464","first_name":"BRAD","last_name":"BRECH","classification":"D","division":"PRODUCTION","hit_factor":3.4795},{"match_name":"4ta Copa USPSA","match_date":"2016-11-20","stage_classifiercode":"09-08","member_number":"TY83937","first_name":"ELIUD","last_name":"DIAZ GONZALEZ","classification":"C","division":"PRODUCTION","hit_factor":3.4751},{"match_name":"AREA 59  SPRING ALL CLASSIFIER","match_date":"2018-03-31","stage_classifiercode":"09-08","member_number":"TY104428","first_name":"SERGIO","last_name":"CORRAL","classification":"U","division":"PRODUCTION","hit_factor":3.4732},{"match_name":"GAS Special Classifier","match_date":"2016-07-02","stage_classifiercode":"09-08","member_number":"A93214","first_name":"BILL","last_name":"JONES","classification":"D","division":"PRODUCTION","hit_factor":3.4674},{"match_name":"LCSC Linden USPSA 031118","match_date":"2018-03-11","stage_classifiercode":"09-08","member_number":"A109207","first_name":"ERIC","last_name":"ANCHETA","classification":"U","division":"PRODUCTION","hit_factor":3.4674},{"match_name":"Southkent USPSA MAY match","match_date":"2017-05-20","stage_classifiercode":"09-08","member_number":"\"\"","first_name":"GARY","last_name":"GIBBONS","classification":"U","division":"PRODUCTION","hit_factor":3.4673},{"match_name":"QPS Quantico Shooting Club January USPSA   ","match_date":"2021-01-09","stage_classifiercode":"09-08","member_number":"TY77177","first_name":"TIMOTHY","last_name":"HICHAK","classification":"M","division":"PRODUCTION","hit_factor":3.4623},{"match_name":"SFPS 5-3-20 USPSA","match_date":"2020-05-03","stage_classifiercode":"09-08","member_number":"A56236","first_name":"JONATHAN","last_name":"ANDERSON","classification":"M","division":"PRODUCTION","hit_factor":3.4582},{"match_name":"GAS Special Classifier","match_date":"2016-07-02","stage_classifiercode":"09-08","member_number":"A30573","first_name":"SAM","last_name":"BUCKMAN","classification":"C","division":"PRODUCTION","hit_factor":3.456},{"match_name":"CRC_20160514_SuperClassifier","match_date":"2016-05-14","stage_classifiercode":"09-08","member_number":"A88502","first_name":"CHRIS","last_name":"PETERSON","classification":"U","division":"PRODUCTION","hit_factor":3.4554},{"match_name":"Collin County USPSA 05-23-2021","match_date":"2021-05-23","stage_classifiercode":"09-08","member_number":"L4567","first_name":"ALEX","last_name":"XI","classification":"B","division":"PRODUCTION","hit_factor":3.4524},{"match_name":"QPS Quantico Shooting Club August 2021 USPSA   ","match_date":"2021-08-07","stage_classifiercode":"09-08","member_number":"TY91652","first_name":"KENT","last_name":"NORDSTROM","classification":"A","division":"PRODUCTION","hit_factor":3.4451},{"match_name":"Maine Practical Shooters May 2021","match_date":"2021-05-08","stage_classifiercode":"09-08","member_number":"Ty101366","first_name":"HANK","last_name":"POIRIER","classification":"B","division":"PRODUCTION","hit_factor":3.444},{"match_name":"RCPS USPSA 8 Apr 2017","match_date":"2017-04-08","stage_classifiercode":"09-08","member_number":"A92433","first_name":"MIKE","last_name":"LASH","classification":"C","division":"PRODUCTION","hit_factor":3.4433},{"match_name":"QPS Quantico Shooting Club January USPSA   ","match_date":"2021-01-09","stage_classifiercode":"09-08","member_number":"A130192","first_name":"KENDON","last_name":"FREEMAN","classification":"C","division":"PRODUCTION","hit_factor":3.4402},{"match_name":"2da Copa Nacional USPSA ","match_date":"2016-05-22","stage_classifiercode":"09-08","member_number":"A90954","first_name":"ROBERTO","last_name":"MORALES","classification":"C","division":"PRODUCTION","hit_factor":3.4361},{"match_name":"MAPSA 2016.05.14","match_date":"2016-05-14","stage_classifiercode":"09-08","member_number":"TY84740","first_name":"ANDRE","last_name":"MITTELMARK","classification":"B","division":"PRODUCTION","hit_factor":3.433},{"match_name":"2da Copa Nacional USPSA ","match_date":"2016-05-22","stage_classifiercode":"09-08","member_number":"TY91989","first_name":"ALFREDO","last_name":"MELENDEZ","classification":"D","division":"PRODUCTION","hit_factor":3.4328},{"match_name":"Danville Rifle And Pistol Club USPSA Classifier Match","match_date":"2017-11-11","stage_classifiercode":"09-08","member_number":"TY98887","first_name":"DAVID","last_name":"MANDROS","classification":"B","division":"PRODUCTION","hit_factor":3.428},{"match_name":"LCSC Linden USPSA 031118","match_date":"2018-03-11","stage_classifiercode":"09-08","member_number":"TY104400","first_name":"REECE","last_name":"PADRIGON","classification":"D","division":"PRODUCTION","hit_factor":3.4268},{"match_name":"CIPSC IL02 Havana June USPSA","match_date":"2020-06-13","stage_classifiercode":"09-08","member_number":"A89535","first_name":"DENNIS","last_name":"RAINVILLE","classification":"B","division":"PRODUCTION","hit_factor":3.423},{"match_name":"2017 Arkansas Section Championship","match_date":"2017-06-14","stage_classifiercode":"09-08","member_number":"TY93835","first_name":"JENNIFER","last_name":"KROLL","classification":"B","division":"PRODUCTION","hit_factor":3.4133},{"match_name":"2017 Arkansas Section Championship","match_date":"2017-06-14","stage_classifiercode":"09-08","member_number":"A96993","first_name":"LUKE","last_name":"THORKILDSEN","classification":"U","division":"PRODUCTION","hit_factor":3.4109},{"match_name":"USPSA MO21 Special Classifier 2Alpha SBRC February 27 2021","match_date":"2021-02-27","stage_classifiercode":"09-08","member_number":"A110827","first_name":"DREW","last_name":"HICKS","classification":"B","division":"PRODUCTION","hit_factor":3.4091},{"match_name":"4ta Copa USPSA","match_date":"2016-11-20","stage_classifiercode":"09-08","member_number":"A86185","first_name":"WILLIE","last_name":"SOTO","classification":"A","division":"PRODUCTION","hit_factor":3.4002},{"match_name":"Coastal Area Practical Shooters 8-27-16","match_date":"2016-08-27","stage_classifiercode":"09-08","member_number":"A70288","first_name":"TED","last_name":"BROCK","classification":"U","division":"PRODUCTION","hit_factor":3.3945},{"match_name":"LCSC Linden USPSA 031118","match_date":"2018-03-11","stage_classifiercode":"09-08","member_number":"TY98407","first_name":"RAZMIK","last_name":"CARAPETIAN","classification":"C","division":"PRODUCTION","hit_factor":3.3882},{"match_name":"NCPS USPSA Handgun Match October 23 2016","match_date":"2016-10-23","stage_classifiercode":"09-08","member_number":"TY68712","first_name":"JOHN","last_name":"SAOB","classification":"B","division":"PRODUCTION","hit_factor":3.3881},{"match_name":"Lefthanders Gun Club Practical Shooters March 5 and 6","match_date":"2016-03-05","stage_classifiercode":"09-08","member_number":"A63424","first_name":"IAN","last_name":"COE","classification":"C","division":"PRODUCTION","hit_factor":3.38},{"match_name":"QPS Quantico Shooting Club August 2021 USPSA   ","match_date":"2021-08-07","stage_classifiercode":"09-08","member_number":"A66762","first_name":"DEAN","last_name":"WHITELAW","classification":"A","division":"PRODUCTION","hit_factor":3.3776},{"match_name":"Shoot GTR USPSA 12/20","match_date":"2016-12-20","stage_classifiercode":"09-08","member_number":"a97296","first_name":"TOM","last_name":"REILLY","classification":"C","division":"PRODUCTION","hit_factor":3.3759},{"match_name":"WPS USPSA Monthly Match November 2018","match_date":"2018-11-10","stage_classifiercode":"09-08","member_number":"A102041","first_name":"JOSHUA","last_name":"BRESETT","classification":"C","division":"PRODUCTION","hit_factor":3.3719},{"match_name":"PIPS 08-08-2018","match_date":"2018-08-07","stage_classifiercode":"09-08","member_number":"TY67266","first_name":"MARK","last_name":"SLETNER","classification":"C","division":"PRODUCTION","hit_factor":3.3592},{"match_name":"2016 Tennessee Atomic Blast","match_date":"2016-09-16","stage_classifiercode":"09-08","member_number":"L2633","first_name":"BRUCE L","last_name":"WALLACE","classification":"M","division":"PRODUCTION","hit_factor":3.3493},{"match_name":"Harvard Action Shooters June 2018 USPSA Pistol Match","match_date":"2018-06-10","stage_classifiercode":"09-08","member_number":"TY45433","first_name":"GARY","last_name":"BARNA","classification":"U","division":"PRODUCTION","hit_factor":3.3362},{"match_name":"Harvard Action Shooters June 2018 USPSA Pistol Match","match_date":"2018-06-10","stage_classifiercode":"09-08","member_number":"Ty73663","first_name":"JAY","last_name":"BUCKLEY","classification":"B","division":"PRODUCTION","hit_factor":3.3359},{"match_name":"QPS Quantico Shooting Club August 2021 USPSA   ","match_date":"2021-08-07","stage_classifiercode":"09-08","member_number":"FY97290","first_name":"DUSTIN","last_name":"POTTER","classification":"B","division":"PRODUCTION","hit_factor":3.3279},{"match_name":"WPS USPSA Monthly Match November 2018","match_date":"2018-11-10","stage_classifiercode":"09-08","member_number":"A114981","first_name":"DAVID","last_name":"BELL SR","classification":"U","division":"PRODUCTION","hit_factor":3.3267},{"match_name":"PCSI USPSA 2018 March Match","match_date":"2018-03-03","stage_classifiercode":"09-08","member_number":"A101631","first_name":"JOHN","last_name":"TONTI","classification":"C","division":"PRODUCTION","hit_factor":3.3248},{"match_name":"Mesilla Valley P Novemberr 2018","match_date":"2018-11-03","stage_classifiercode":"09-08","member_number":"TY101317","first_name":"NORM","last_name":"CROSS","classification":"C","division":"PRODUCTION","hit_factor":3.3243},{"match_name":"Lefthanders Gun Club Practical Shooters March 5 and 6","match_date":"2016-03-05","stage_classifiercode":"09-08","member_number":"A95362","first_name":"BRANDON","last_name":"HORNUNG","classification":"U","division":"PRODUCTION","hit_factor":3.3207},{"match_name":"Payson Practical Shooters - Action Shooting 2018 04 12","match_date":"2018-04-12","stage_classifiercode":"09-08","member_number":"Fy90171","first_name":"PETE","last_name":"UNDLIN","classification":"M","division":"PRODUCTION","hit_factor":3.317},{"match_name":"Salt City practical shooting league 'all classifier match'","match_date":"2020-08-30","stage_classifiercode":"09-08","member_number":"A-101550","first_name":"ERIC","last_name":"SCHNITZER","classification":"U","division":"PRODUCTION","hit_factor":3.3166},{"match_name":"Collin County USPSA Nov 6 2016","match_date":"2016-11-06","stage_classifiercode":"09-08","member_number":"A97971","first_name":"ALLEN","last_name":"MATTER","classification":"C","division":"PRODUCTION","hit_factor":3.3143},{"match_name":"Southkent USPSA MAY match","match_date":"2017-05-20","stage_classifiercode":"09-08","member_number":"A94729","first_name":"CALEB","last_name":"DUMOND","classification":"X","division":"PRODUCTION","hit_factor":3.3113},{"match_name":"2017-10 Bone Creek USPSA","match_date":"2017-10-01","stage_classifiercode":"09-08","member_number":"TY91858","first_name":"CODY","last_name":"HOLLENBECK","classification":"U","division":"PRODUCTION","hit_factor":3.3094},{"match_name":"SPSA USPSA August 1st Sat Match","match_date":"2018-08-04","stage_classifiercode":"09-08","member_number":"TY25081","first_name":"PAUL","last_name":"VALONE","classification":"C","division":"PRODUCTION","hit_factor":3.3088},{"match_name":"Alpha Mike August Classifier 2021   ","match_date":"2021-08-15","stage_classifiercode":"09-08","member_number":"A133208","first_name":"PAUL","last_name":"FITCH","classification":"U","division":"PRODUCTION","hit_factor":3.3072},{"match_name":"Hampden RPC July USPSA","match_date":"2017-07-16","stage_classifiercode":"09-08","member_number":"L3959","first_name":"LEONARD","last_name":"CABANA","classification":"D","division":"PRODUCTION","hit_factor":3.3033},{"match_name":"Southkent USPSA MAY match","match_date":"2017-05-20","stage_classifiercode":"09-08","member_number":"TY61733","first_name":"KEITH","last_name":"HAFER","classification":"A","division":"PRODUCTION","hit_factor":3.2918},{"match_name":"USPSA-AB 2018-14 at Brooks Pistol Club -adhoc","match_date":"2018-08-08","stage_classifiercode":"09-08","member_number":"F108681","first_name":"DON","last_name":"SERRANO","classification":"C","division":"PRODUCTION","hit_factor":3.2834},{"match_name":"MCPSL Pistol 7-11-20","match_date":"2020-07-11","stage_classifiercode":"09-08","member_number":"A123289","first_name":"DAVID","last_name":"SHERMAN","classification":"U","division":"PRODUCTION","hit_factor":3.283},{"match_name":"Cameo USPSA Match December 19 2020","match_date":"2020-12-19","stage_classifiercode":"09-08","member_number":"L4591","first_name":"WILLIAM","last_name":"HOLLENBECK","classification":"C","division":"PRODUCTION","hit_factor":3.2814},{"match_name":"LCSC Linden USPSA 031118","match_date":"2018-03-11","stage_classifiercode":"09-08","member_number":"TY68712","first_name":"JOHN","last_name":"SAOB","classification":"B","division":"PRODUCTION","hit_factor":3.2805},{"match_name":"CIPSC IL02 Havana June USPSA","match_date":"2020-06-13","stage_classifiercode":"09-08","member_number":"a118153","first_name":"MICHAEL","last_name":"KIESEWETTER","classification":"B","division":"PRODUCTION","hit_factor":3.2767},{"match_name":"LCSC Linden USPSA 031118","match_date":"2018-03-11","stage_classifiercode":"09-08","member_number":"A79352","first_name":"HEATHER","last_name":"PRICE","classification":"B","division":"PRODUCTION","hit_factor":3.2706},{"match_name":"Treasure State Championship Hosted By MCAS","match_date":"2020-06-20","stage_classifiercode":"09-08","member_number":"TY96523","first_name":"DAN","last_name":"DOOLEY","classification":"C","division":"PRODUCTION","hit_factor":3.2616},{"match_name":"Richmond Boro Gun Club July 2018 Monthly USPSA match","match_date":"2018-07-21","stage_classifiercode":"09-08","member_number":"A106880","first_name":"ADAM","last_name":"MCNAB","classification":"D","division":"PRODUCTION","hit_factor":3.2581},{"match_name":"Chillicothe April-2017 USPSA Match","match_date":"2017-04-23","stage_classifiercode":"09-08","member_number":"A77099","first_name":"CURT","last_name":"DARLINGTON","classification":"B","division":"PRODUCTION","hit_factor":3.2577},{"match_name":"Richmond Boro Gun Club July 2018 Monthly USPSA match","match_date":"2018-07-21","stage_classifiercode":"09-08","member_number":"TY99029","first_name":"NICK","last_name":"TORRELLI","classification":"D","division":"PRODUCTION","hit_factor":3.2544},{"match_name":"CRC_20160514_SuperClassifier","match_date":"2016-05-14","stage_classifiercode":"09-08","member_number":"TY92911","first_name":"JOHN","last_name":"COOREMAN","classification":"C","division":"PRODUCTION","hit_factor":3.25},{"match_name":"WSPS OCTOBER 2016 SPECIAL CLASSIFIER MATCH","match_date":"2016-10-29","stage_classifiercode":"09-08","member_number":"A99424","first_name":"FANGCHEN","last_name":"LI","classification":"U","division":"PRODUCTION","hit_factor":3.2419},{"match_name":"Payson Practical Shooters - USPSA 2018 05 05","match_date":"2018-05-05","stage_classifiercode":"09-08","member_number":"Fy90171","first_name":"PETE","last_name":"UNDLIN2","classification":"M","division":"PRODUCTION","hit_factor":3.2379},{"match_name":"Richmond Boro Gun Club July 2018 Monthly USPSA match","match_date":"2018-07-21","stage_classifiercode":"09-08","member_number":"A111002","first_name":"FRANK","last_name":"SENZINO","classification":"U","division":"PRODUCTION","hit_factor":3.2258},{"match_name":"RPS November 2017 USPSA Match","match_date":"2017-11-11","stage_classifiercode":"09-08","member_number":"TY71348","first_name":"REGGIE","last_name":"GARMON","classification":"A","division":"PRODUCTION","hit_factor":3.2202},{"match_name":"CGC 100816","match_date":"2016-10-08","stage_classifiercode":"09-08","member_number":"A53630","first_name":"ARTHUR","last_name":"BROWN","classification":"D","division":"PRODUCTION","hit_factor":3.2138},{"match_name":"WGC WI USPSA Monthly Match 4-16-16","match_date":"2016-04-16","stage_classifiercode":"09-08","member_number":"A89958","first_name":"JESSE","last_name":"NEWTON","classification":"B","division":"PRODUCTION","hit_factor":3.2051},{"match_name":"Maine Practical Shooters May 2021","match_date":"2021-05-08","stage_classifiercode":"09-08","member_number":"A101919","first_name":"FRED","last_name":"ROIG","classification":"D","division":"PRODUCTION","hit_factor":3.2039},{"match_name":"PIPS 08-08-2018","match_date":"2018-08-07","stage_classifiercode":"09-08","member_number":"PEN","first_name":"SCOTT","last_name":"RADDATZ","classification":"U","division":"PRODUCTION","hit_factor":3.1936},{"match_name":"Maine Practical Shooters May 2021","match_date":"2021-05-08","stage_classifiercode":"09-08","member_number":"A124495","first_name":"LINDA","last_name":"POOL","classification":"D","division":"PRODUCTION","hit_factor":3.1915},{"match_name":"2da Copa Nacional USPSA ","match_date":"2016-05-22","stage_classifiercode":"09-08","member_number":"A84044","first_name":"KATHIA","last_name":"RIVERA MELENDEZ","classification":"C","division":"PRODUCTION","hit_factor":3.1783},{"match_name":"DGC USPSA Classifier Match","match_date":"2017-07-30","stage_classifiercode":"09-08","member_number":"A101403","first_name":"BOB","last_name":"CURRY","classification":"U","division":"PRODUCTION","hit_factor":3.1758},{"match_name":"MCPSL Pistol 4-10-2021 (Classifier)","match_date":"2021-04-10","stage_classifiercode":"09-08","member_number":"FY85914","first_name":"JUSTIN","last_name":"BARDWELL","classification":"B","division":"PRODUCTION","hit_factor":3.1694},{"match_name":"Collin County USPSA Nov 6 2016","match_date":"2016-11-06","stage_classifiercode":"09-08","member_number":"ty51794","first_name":"BRETT","last_name":"LONG","classification":"A","division":"PRODUCTION","hit_factor":3.1694},{"match_name":"2016 Tennessee Atomic Blast","match_date":"2016-09-16","stage_classifiercode":"09-08","member_number":"A76106","first_name":"KEN","last_name":"HARDIN","classification":"A","division":"PRODUCTION","hit_factor":3.1665},{"match_name":"Collin County USPSA Nov 6 2016","match_date":"2016-11-06","stage_classifiercode":"09-08","member_number":"\"\"","first_name":"STEPHEN","last_name":"SCHULMAN","classification":"U","division":"PRODUCTION","hit_factor":3.1659},{"match_name":"WPS USPSA Monthly Match November 2018","match_date":"2018-11-10","stage_classifiercode":"09-08","member_number":"FY74946","first_name":"WILLIAM","last_name":"LITTS","classification":"C","division":"PRODUCTION","hit_factor":3.1646},{"match_name":"Harvard Action Shooters June 2018 USPSA Pistol Match","match_date":"2018-06-10","stage_classifiercode":"09-08","member_number":"A100683","first_name":"CHRIS","last_name":"DODGE","classification":"B","division":"PRODUCTION","hit_factor":3.1597},{"match_name":"BHPC USPSA Match Classifier IOWA","match_date":"2018-06-16","stage_classifiercode":"09-08","member_number":"ty107850","first_name":"DREW","last_name":"GADBERRY","classification":"UNKNOWN","division":"PRODUCTION","hit_factor":3.1588},{"match_name":"Alpha Mike August Classifier 2021   ","match_date":"2021-08-15","stage_classifiercode":"09-08","member_number":"TY74236","first_name":"PASCALE","last_name":"GREEN","classification":"B","division":"PRODUCTION","hit_factor":3.1588},{"match_name":"CTASA 3rd Sunday USPSA - February 2016","match_date":"2016-02-21","stage_classifiercode":"09-08","member_number":"ty93073","first_name":"TOBY","last_name":"FLORES","classification":"U","division":"PRODUCTION","hit_factor":3.1553},{"match_name":"Coastal Area Practical Shooters 8-27-16","match_date":"2016-08-27","stage_classifiercode":"09-08","member_number":"A86410","first_name":"MARK","last_name":"LANCASTER","classification":"C","division":"PRODUCTION","hit_factor":3.1504},{"match_name":"2da Copa Nacional USPSA ","match_date":"2016-05-22","stage_classifiercode":"09-08","member_number":"\"\"","first_name":"JADE","last_name":"OSORIO","classification":"D","division":"PRODUCTION","hit_factor":3.1489},{"match_name":"CRC_20160514_SuperClassifier","match_date":"2016-05-14","stage_classifiercode":"09-08","member_number":"A95263","first_name":"SIDA","last_name":"SHEN","classification":"C","division":"PRODUCTION","hit_factor":3.1489},{"match_name":"AREA 59  SPRING ALL CLASSIFIER","match_date":"2018-03-31","stage_classifiercode":"09-08","member_number":"A76683","first_name":"CALVIN","last_name":"TRUONG","classification":"C","division":"PRODUCTION","hit_factor":3.1463},{"match_name":"RCPS USPSA 8 Apr 2017","match_date":"2017-04-08","stage_classifiercode":"09-08","member_number":"TY99549","first_name":"JASON","last_name":"HALES","classification":"D","division":"PRODUCTION","hit_factor":3.1447},{"match_name":"Lefthanders Gun Club Practical Shooters March 5 and 6","match_date":"2016-03-05","stage_classifiercode":"09-08","member_number":"A92047","first_name":"KYLE","last_name":"SPENCER","classification":"B","division":"PRODUCTION","hit_factor":3.1329},{"match_name":"APSC USPSA Classifier Match 07-01-17","match_date":"2017-07-01","stage_classifiercode":"09-08","member_number":"A104327","first_name":"GARY","last_name":"SHAW","classification":"U","division":"PRODUCTION","hit_factor":3.1325},{"match_name":"Rio Grande Practical Shooters - August 2016","match_date":"2016-08-06","stage_classifiercode":"09-08","member_number":"TY24322","first_name":"RANDY","last_name":"RYAN","classification":"M","division":"PRODUCTION","hit_factor":3.1284},{"match_name":"SLOSA January 2018 USPSA CLASSIFIER MATCH","match_date":"2018-01-28","stage_classifiercode":"09-08","member_number":"A97718","first_name":"CHRIS","last_name":"NEUWIRTH","classification":"C","division":"PRODUCTION","hit_factor":3.1284},{"match_name":"2017 Arkansas Section Championship","match_date":"2017-06-14","stage_classifiercode":"09-08","member_number":"TY89055","first_name":"JERRY","last_name":"RICHARDS","classification":"C","division":"PRODUCTION","hit_factor":3.1226},{"match_name":"Harvard Action Shooters June 2018 USPSA Pistol Match","match_date":"2018-06-10","stage_classifiercode":"09-08","member_number":"A96968","first_name":"AARON","last_name":"PACYNA","classification":"U","division":"PRODUCTION","hit_factor":3.1191},{"match_name":"CIPSC IL02 Havana June USPSA","match_date":"2020-06-13","stage_classifiercode":"09-08","member_number":"L3231","first_name":"ERIC","last_name":"GRIGGS","classification":"A","division":"PRODUCTION","hit_factor":3.118},{"match_name":"Central IL Practical Shooters October Match","match_date":"2016-10-09","stage_classifiercode":"09-08","member_number":"A88153","first_name":"PAUL","last_name":"NURMI","classification":"C","division":"PRODUCTION","hit_factor":3.1171},{"match_name":"AREA 59  SPRING ALL CLASSIFIER","match_date":"2018-03-31","stage_classifiercode":"09-08","member_number":"A70759","first_name":"MARC","last_name":"DEMEZA","classification":"B","division":"PRODUCTION","hit_factor":3.1167},{"match_name":"PIPS 08-05-2020","match_date":"2020-08-05","stage_classifiercode":"09-08","member_number":"A103082","first_name":"DOUG","last_name":"TAYLOR","classification":"C","division":"PRODUCTION","hit_factor":3.1149},{"match_name":"DWB - Deadwood Boys USPSA 19 July 2020","match_date":"2020-07-19","stage_classifiercode":"09-08","member_number":"TY113109","first_name":"RON","last_name":"SANCHEZ","classification":"U","division":"PRODUCTION","hit_factor":3.1111},{"match_name":"2016 Tennessee Atomic Blast","match_date":"2016-09-16","stage_classifiercode":"09-08","member_number":"TY57804","first_name":"RYAN","last_name":"LEVY","classification":"C","division":"PRODUCTION","hit_factor":3.1103},{"match_name":"Atlanta Practical Shooters March 2017 USPSA - Classifier Match","match_date":"2017-03-05","stage_classifiercode":"09-08","member_number":"A68985","first_name":"CHRIS","last_name":"FARNAN","classification":"B","division":"PRODUCTION","hit_factor":3.1083},{"match_name":"CRC_20160514_SuperClassifier","match_date":"2016-05-14","stage_classifiercode":"09-08","member_number":"A93099","first_name":"DAIN","last_name":"CUMMINGS","classification":"U","division":"PRODUCTION","hit_factor":3.104},{"match_name":"AVAP62318","match_date":"2018-06-23","stage_classifiercode":"09-08","member_number":"L4431","first_name":"KC","last_name":"BRAUNSCHWEIG","classification":"U","division":"PRODUCTION","hit_factor":3.1002},{"match_name":"Griffin USPSA Match July 2017","match_date":"2017-07-15","stage_classifiercode":"09-08","member_number":"L1665","first_name":"HAROLD","last_name":"HAM","classification":"A","division":"PRODUCTION","hit_factor":3.0979},{"match_name":"Southkent USPSA MAY match","match_date":"2017-05-20","stage_classifiercode":"09-08","member_number":"\"\"","first_name":"ALEX","last_name":"AXTELL","classification":"U","division":"PRODUCTION","hit_factor":3.0908},{"match_name":"Harvard Action Shooters June 2018 USPSA Pistol Match","match_date":"2018-06-10","stage_classifiercode":"09-08","member_number":"TY86029","first_name":"PATRICK","last_name":"NIXON","classification":"C","division":"PRODUCTION","hit_factor":3.083},{"match_name":"Crooked Creek Pistol League - July 2020","match_date":"2020-07-18","stage_classifiercode":"09-08","member_number":"TY87114","first_name":"NICK","last_name":"ELLIS","classification":"C","division":"PRODUCTION","hit_factor":3.0785},{"match_name":"Chillicothe April-2018 USPSA Classifier Match","match_date":"2018-04-28","stage_classifiercode":"09-08","member_number":"A57074","first_name":"MIKE","last_name":"KOWALSKI","classification":"C","division":"PRODUCTION","hit_factor":3.0748},{"match_name":"Richmond Boro Gun Club July 2018 Monthly USPSA match","match_date":"2018-07-21","stage_classifiercode":"09-08","member_number":"A100045","first_name":"KYLE","last_name":"KIM","classification":"C","division":"PRODUCTION","hit_factor":3.0705},{"match_name":"TAC2 USPSA October 2017","match_date":"2017-10-07","stage_classifiercode":"09-08","member_number":"\"\"","first_name":"MICHAEL","last_name":"HASTY","classification":"U","division":"PRODUCTION","hit_factor":3.0685},{"match_name":"CRC_20160514_SuperClassifier","match_date":"2016-05-14","stage_classifiercode":"09-08","member_number":"A95263","first_name":"SIDA","last_name":"SHEN","classification":"C","division":"PRODUCTION","hit_factor":3.0648},{"match_name":"2da Copa Nacional USPSA ","match_date":"2016-05-22","stage_classifiercode":"09-08","member_number":"A88118","first_name":"JOSEPH","last_name":"MELENDEZ REYES","classification":"B","division":"PRODUCTION","hit_factor":3.0642},{"match_name":"Central IL Practical Shooters October Match","match_date":"2016-10-09","stage_classifiercode":"09-08","member_number":"L2188","first_name":"BRIAN","last_name":"ROYALTY","classification":"C","division":"PRODUCTION","hit_factor":3.0641},{"match_name":"PMSC  USPSA JULY 2017","match_date":"2017-07-01","stage_classifiercode":"09-08","member_number":"a89315","first_name":"LEE","last_name":"FOLTYN","classification":"B","division":"PRODUCTION","hit_factor":3.0579},{"match_name":"PMSC  USPSA JULY 2017","match_date":"2017-07-01","stage_classifiercode":"09-08","member_number":"A85081","first_name":"ANDREW","last_name":"LOCK","classification":"C","division":"PRODUCTION","hit_factor":3.0574},{"match_name":"2017 Arkansas Section Championship","match_date":"2017-06-14","stage_classifiercode":"09-08","member_number":"A81034","first_name":"TRACIE","last_name":"RUSHING","classification":"A","division":"PRODUCTION","hit_factor":3.0564},{"match_name":"ENPS May 2018 USPSA Match","match_date":"2018-05-06","stage_classifiercode":"09-08","member_number":"FY96780","first_name":"JAREL","last_name":"JENSEN","classification":"C","division":"PRODUCTION","hit_factor":3.0542},{"match_name":"QPS Quantico Shooting Club August 2021 USPSA   ","match_date":"2021-08-07","stage_classifiercode":"09-08","member_number":"A134074","first_name":"MATT","last_name":"HAINES","classification":"C","division":"PRODUCTION","hit_factor":3.0542},{"match_name":"WSPS OCTOBER 2016 SPECIAL CLASSIFIER MATCH","match_date":"2016-10-29","stage_classifiercode":"09-08","member_number":"A93427","first_name":"CRAIG","last_name":"LEWIS","classification":"C","division":"PRODUCTION","hit_factor":3.0395},{"match_name":"Griffin USPSA Match July 2017","match_date":"2017-07-15","stage_classifiercode":"09-08","member_number":"A83594","first_name":"TIM","last_name":"BOWDEN","classification":"C","division":"PRODUCTION","hit_factor":3.0382},{"match_name":"Nampa USPSA June 21st 2020","match_date":"2020-06-21","stage_classifiercode":"09-08","member_number":"A85736","first_name":"DON","last_name":"CROW","classification":"B","division":"PRODUCTION","hit_factor":3.0275},{"match_name":"CCSC USPSA All Classifier Match","match_date":"2021-06-12","stage_classifiercode":"09-08","member_number":"TY124836","first_name":"ROBB","last_name":"MOORE","classification":"C","division":"PRODUCTION","hit_factor":3.0225},{"match_name":"Southkent USPSA MAY match","match_date":"2017-05-20","stage_classifiercode":"09-08","member_number":"A76095","first_name":"JEFF","last_name":"SLUSSER","classification":"B","division":"PRODUCTION","hit_factor":3.0067},{"match_name":"WGC WI USPSA Monthly Match 4-16-16","match_date":"2016-04-16","stage_classifiercode":"09-08","member_number":"ty71474","first_name":"CHUCK","last_name":"WISLER","classification":"C","division":"PRODUCTION","hit_factor":3.0058},{"match_name":"MAPSA 2016.05.14","match_date":"2016-05-14","stage_classifiercode":"09-08","member_number":"A92341","first_name":"DAKOTA","last_name":"OVERLAND","classification":"D","division":"PRODUCTION","hit_factor":3.0038},{"match_name":"2017 Arkansas Section Championship","match_date":"2017-06-14","stage_classifiercode":"09-08","member_number":"A87392","first_name":"SCOTT","last_name":"LEWIS","classification":"U","division":"PRODUCTION","hit_factor":2.9991},{"match_name":"PMSC  USPSA JULY 2017","match_date":"2017-07-01","stage_classifiercode":"09-08","member_number":"\"\"","first_name":"ANTON","last_name":"PLAKSEYCHUK","classification":"U","division":"PRODUCTION","hit_factor":2.9958},{"match_name":"2da Copa Nacional USPSA ","match_date":"2016-05-22","stage_classifiercode":"09-08","member_number":"\"\"","first_name":"RICARDO","last_name":"MIRANDA TORRES","classification":"U","division":"PRODUCTION","hit_factor":2.9945},{"match_name":"Central IL Practical Shooters October Match","match_date":"2016-10-09","stage_classifiercode":"09-08","member_number":"TY72670","first_name":"DALE","last_name":"HARDING","classification":"U","division":"PRODUCTION","hit_factor":2.994},{"match_name":"QPS Quantico Shooting Club January USPSA   ","match_date":"2021-01-09","stage_classifiercode":"09-08","member_number":"A27108","first_name":"RANDY","last_name":"MCFARLAND","classification":"C","division":"PRODUCTION","hit_factor":2.9935},{"match_name":"ORSA USPSA January 2021","match_date":"2021-01-16","stage_classifiercode":"09-08","member_number":"A125128","first_name":"CRAIG","last_name":"MOSS","classification":"D","division":"PRODUCTION","hit_factor":2.9918},{"match_name":"ENPS May 2018 USPSA Match","match_date":"2018-05-06","stage_classifiercode":"09-08","member_number":"A105904","first_name":"ADRIAN","last_name":"LAHS","classification":"U","division":"PRODUCTION","hit_factor":2.9839},{"match_name":"2016 Tennessee Atomic Blast","match_date":"2016-09-16","stage_classifiercode":"09-08","member_number":"A67704","first_name":"MICHAEL","last_name":"MCDONALD","classification":"M","division":"PRODUCTION","hit_factor":2.982},{"match_name":"APSC USPSA Classifier Match 07-01-17","match_date":"2017-07-01","stage_classifiercode":"09-08","member_number":"TY98190","first_name":"DAVID","last_name":"WONGWAI","classification":"U","division":"PRODUCTION","hit_factor":2.9744},{"match_name":"RBGC USPSA 2021-8-15 Special Classifier Match","match_date":"2021-08-15","stage_classifiercode":"09-08","member_number":"A134094","first_name":"MAX","last_name":"LEE","classification":"U","division":"PRODUCTION","hit_factor":2.973},{"match_name":"Coastal Area Practical Shooters 7-28-18 Special Classifier with","match_date":"2018-07-28","stage_classifiercode":"09-08","member_number":"A61889","first_name":"KEVIN","last_name":"HOOVER","classification":"C","division":"PRODUCTION","hit_factor":2.96},{"match_name":"2da Copa Nacional USPSA ","match_date":"2016-05-22","stage_classifiercode":"09-08","member_number":"\"\"","first_name":"EDUARDO","last_name":"ROMAN ADORNO","classification":"U","division":"PRODUCTION","hit_factor":2.9552},{"match_name":"QPS Quantico Shooting Club January USPSA   ","match_date":"2021-01-09","stage_classifiercode":"09-08","member_number":"A132111","first_name":"PARKER","last_name":"TOMASI","classification":"U","division":"PRODUCTION","hit_factor":2.9545},{"match_name":"PMSC  USPSA JULY 2017","match_date":"2017-07-01","stage_classifiercode":"09-08","member_number":"A85081","first_name":"ANDREW","last_name":"LOCK","classification":"C","division":"PRODUCTION","hit_factor":2.9529},{"match_name":"EASTER EGG HUNT AREA 59  ALL CLASSFIER MATCH","match_date":"2017-04-15","stage_classifiercode":"09-08","member_number":"a66852","first_name":"NICK","last_name":"BOLO","classification":"U","division":"PRODUCTION","hit_factor":2.952},{"match_name":"NCPS USPSA Handgun Match October 23 2016","match_date":"2016-10-23","stage_classifiercode":"09-08","member_number":"PEN","first_name":"JOSH","last_name":"FELDMAN","classification":"U","division":"PRODUCTION","hit_factor":2.9487},{"match_name":"TPS USPSA at CMP Jan 20 2018","match_date":"2018-01-20","stage_classifiercode":"09-08","member_number":"TY94006","first_name":"PAUL","last_name":"SIMS","classification":"U","division":"PRODUCTION","hit_factor":2.9437},{"match_name":"1a Fecha USPSA 2020","match_date":"2020-01-19","stage_classifiercode":"09-08","member_number":"A104236","first_name":"SANDRO J.","last_name":"GONZALEZ-ALVAREZ","classification":"B","division":"PRODUCTION","hit_factor":2.9362},{"match_name":"NCPS USPSA Handgun Match October 23 2016","match_date":"2016-10-23","stage_classifiercode":"09-08","member_number":"TY88874","first_name":"A JOHN","last_name":"BREGLIA","classification":"B","division":"PRODUCTION","hit_factor":2.9338},{"match_name":"USPSA MO21 Special Classifier 2Alpha SBRC February 27 2021","match_date":"2021-02-27","stage_classifiercode":"09-08","member_number":"A113404","first_name":"BRIAN","last_name":"STANEK","classification":"C","division":"PRODUCTION","hit_factor":2.9328},{"match_name":"EASTER EGG HUNT AREA 59  ALL CLASSFIER MATCH","match_date":"2017-04-15","stage_classifiercode":"09-08","member_number":"A101399","first_name":"RYAN","last_name":"WARE","classification":"U","division":"PRODUCTION","hit_factor":2.9328},{"match_name":"Chillicothe April-2018 USPSA Classifier Match","match_date":"2018-04-28","stage_classifiercode":"09-08","member_number":"A65773","first_name":"CHUCK","last_name":"HUFF","classification":"C","division":"PRODUCTION","hit_factor":2.9298},{"match_name":"Southkent USPSA MAY match","match_date":"2017-05-20","stage_classifiercode":"09-08","member_number":"\"\"","first_name":"JANE","last_name":"MCCULLOUGH","classification":"U","division":"PRODUCTION","hit_factor":2.9257},{"match_name":"GAS Special Classifier","match_date":"2016-07-02","stage_classifiercode":"09-08","member_number":"\"\"","first_name":"BILL","last_name":"LEWIS","classification":"U","division":"PRODUCTION","hit_factor":2.923},{"match_name":"NCPS USPSA Handgun Match October 23 2016","match_date":"2016-10-23","stage_classifiercode":"09-08","member_number":"TY75501","first_name":"WENDY","last_name":"HAMBY","classification":"C","division":"PRODUCTION","hit_factor":2.9197},{"match_name":"4ta Copa USPSA","match_date":"2016-11-20","stage_classifiercode":"09-08","member_number":"\"\"","first_name":"BERNARDO","last_name":"BRAVO ACOSTA","classification":"U","division":"PRODUCTION","hit_factor":2.9066},{"match_name":"Alpha Mike August Classifier 2021   ","match_date":"2021-08-15","stage_classifiercode":"09-08","member_number":"A132319","first_name":"ROBERT","last_name":"DEARMON","classification":"U","division":"PRODUCTION","hit_factor":2.9065},{"match_name":"2017 Arkansas Section Championship","match_date":"2017-06-14","stage_classifiercode":"09-08","member_number":"A85006","first_name":"MIKE","last_name":"HACKEMEYER","classification":"B","division":"PRODUCTION","hit_factor":2.9029},{"match_name":"Harvard Action Shooters June 2018 USPSA Pistol Match","match_date":"2018-06-10","stage_classifiercode":"09-08","member_number":"A105142","first_name":"ERIC","last_name":"HILL","classification":"U","division":"PRODUCTION","hit_factor":2.8998},{"match_name":"Danville Rifle And Pistol Club USPSA Classifier Match","match_date":"2017-11-11","stage_classifiercode":"09-08","member_number":"A101219","first_name":"CHAD","last_name":"ELLIOTT","classification":"C","division":"PRODUCTION","hit_factor":2.8947},{"match_name":"Alpha Mike August Classifier 2021   ","match_date":"2021-08-15","stage_classifiercode":"09-08","member_number":"A129223","first_name":"JAMES","last_name":"SCHONIAN","classification":"U","division":"PRODUCTION","hit_factor":2.8864},{"match_name":"OKCGC USPSA Feb 2018","match_date":"2018-02-03","stage_classifiercode":"09-08","member_number":"A98670","first_name":"YURY","last_name":"DELENDIK","classification":"D","division":"PRODUCTION","hit_factor":2.8846},{"match_name":"Harvard Action Shooters June 2018 USPSA Pistol Match","match_date":"2018-06-10","stage_classifiercode":"09-08","member_number":"TY54685","first_name":"BRENT","last_name":"CARLTON","classification":"B","division":"PRODUCTION","hit_factor":2.8846},{"match_name":"CRC_20160514_SuperClassifier","match_date":"2016-05-14","stage_classifiercode":"09-08","member_number":"A87980","first_name":"MICHAEL","last_name":"CROSBY","classification":"U","division":"PRODUCTION","hit_factor":2.8802},{"match_name":"2017 Arkansas Section Championship","match_date":"2017-06-14","stage_classifiercode":"09-08","member_number":"A52987","first_name":"JACOB","last_name":"MARTENS","classification":"A","division":"PRODUCTION","hit_factor":2.8769},{"match_name":"USPSA MO21 Special Classifier 2Alpha SBRC February 27 2021","match_date":"2021-02-27","stage_classifiercode":"09-08","member_number":"A124984","first_name":"DARIN","last_name":"ANDREWS","classification":"C","division":"PRODUCTION","hit_factor":2.873},{"match_name":"Mesilla Valley P Novemberr 2018","match_date":"2018-11-03","stage_classifiercode":"09-08","member_number":"A101283","first_name":"HOWARD","last_name":"COTHERN","classification":"D","division":"PRODUCTION","hit_factor":2.8723},{"match_name":"Nampa USPSA August 7th 2021 Classifier Match","match_date":"2021-08-07","stage_classifiercode":"09-08","member_number":"A113753","first_name":"SCOTT","last_name":"CROSWELL","classification":"C","division":"PRODUCTION","hit_factor":2.8621},{"match_name":"Lefthanders Gun Club Practical Shooters March 5 and 6","match_date":"2016-03-05","stage_classifiercode":"09-08","member_number":"ty78203","first_name":"JIM","last_name":"SHURES","classification":"B","division":"PRODUCTION","hit_factor":2.8607},{"match_name":"Pioneer Action Shooters USPSA 5-27-18","match_date":"2018-05-27","stage_classifiercode":"09-08","member_number":"A101134","first_name":"RICH","last_name":"ENGLISH","classification":"C","division":"PRODUCTION","hit_factor":2.8551},{"match_name":"WTPS USPSA November Match 11-11-17","match_date":"2017-11-11","stage_classifiercode":"09-08","member_number":"A97162","first_name":"JOSHUA","last_name":"HOOSE","classification":"U","division":"PRODUCTION","hit_factor":2.8539},{"match_name":"MCPSL Pistol 4-10-2021 (Classifier)","match_date":"2021-04-10","stage_classifiercode":"09-08","member_number":"L4803","first_name":"GARRETT","last_name":"KIRKPATRICK","classification":"D","division":"PRODUCTION","hit_factor":2.8513},{"match_name":"AREA 59  SPRING ALL CLASSIFIER","match_date":"2018-03-31","stage_classifiercode":"09-08","member_number":"A105300","first_name":"OLAYEMI","last_name":"BAKARE","classification":"U","division":"PRODUCTION","hit_factor":2.8459},{"match_name":"Prescott 3rd Sunday USPSA 09-18-2016","match_date":"2016-09-18","stage_classifiercode":"09-08","member_number":"A80228","first_name":"DERRICK","last_name":"ROUSSEAU","classification":"M","division":"PRODUCTION","hit_factor":2.8395},{"match_name":"Southkent USPSA MAY match","match_date":"2017-05-20","stage_classifiercode":"09-08","member_number":"\"\"","first_name":"JAKE","last_name":"GOOSSEN","classification":"U","division":"PRODUCTION","hit_factor":2.8386},{"match_name":"2016 Tennessee Atomic Blast","match_date":"2016-09-16","stage_classifiercode":"09-08","member_number":"FY83899","first_name":"MICHAEL","last_name":"BRESSON","classification":"A","division":"PRODUCTION","hit_factor":2.8376},{"match_name":"CRC_20160514_SuperClassifier","match_date":"2016-05-14","stage_classifiercode":"09-08","member_number":"L3812","first_name":"STEVEN","last_name":"LICHON","classification":"B","division":"PRODUCTION","hit_factor":2.8374},{"match_name":"Coastal Area Practical Shooters 8-27-16","match_date":"2016-08-27","stage_classifiercode":"09-08","member_number":"A61889","first_name":"KEVIN","last_name":"HOOVER","classification":"C","division":"PRODUCTION","hit_factor":2.8244},{"match_name":"TPS USPSA -  August Classifier Match 2020","match_date":"2020-08-01","stage_classifiercode":"09-08","member_number":"A123375","first_name":"TODD","last_name":"OKRAY","classification":"U","division":"PRODUCTION","hit_factor":2.8201},{"match_name":"SLOSA January 2018 USPSA CLASSIFIER MATCH","match_date":"2018-01-28","stage_classifiercode":"09-08","member_number":"A88284","first_name":"MARK","last_name":"DAVIS","classification":"U","division":"PRODUCTION","hit_factor":2.82},{"match_name":"AREA 59  SPRING ALL CLASSIFIER","match_date":"2018-03-31","stage_classifiercode":"09-08","member_number":"A101165","first_name":"HERMAN","last_name":"WADDY","classification":"D","division":"PRODUCTION","hit_factor":2.8179},{"match_name":"APSC USPSA Classifier Match 07-01-17","match_date":"2017-07-01","stage_classifiercode":"09-08","member_number":"A92760","first_name":"MIKE","last_name":"REED","classification":"C","division":"PRODUCTION","hit_factor":2.8135},{"match_name":"Piscataqua  Master Blasters USPSA Special Classifier","match_date":"2017-12-03","stage_classifiercode":"09-08","member_number":"A101830","first_name":"RO-BRIAN","last_name":"CHAREST","classification":"U","division":"PRODUCTION","hit_factor":2.8112},{"match_name":"Harvard Action Shooters June 2018 USPSA Pistol Match","match_date":"2018-06-10","stage_classifiercode":"09-08","member_number":"TY85184","first_name":"HOWARD","last_name":"SIMPSON","classification":"C","division":"PRODUCTION","hit_factor":2.8014},{"match_name":"CARO USPSA MATCH NO 3","match_date":"2018-07-28","stage_classifiercode":"09-08","member_number":"A108339","first_name":"BOB","last_name":"LEAVITT","classification":"U","division":"PRODUCTION","hit_factor":2.7925},{"match_name":"CRC_20160514_SuperClassifier","match_date":"2016-05-14","stage_classifiercode":"09-08","member_number":"A95263","first_name":"SIDA","last_name":"SHEN","classification":"C","division":"PRODUCTION","hit_factor":2.7903},{"match_name":"QPS Quantico Shooting Club January USPSA   ","match_date":"2021-01-09","stage_classifiercode":"09-08","member_number":"A129516","first_name":"GARRETT","last_name":"SPANGLER","classification":"C","division":"PRODUCTION","hit_factor":2.7848},{"match_name":"Range 307 USPSA 5/7/2017","match_date":"2017-05-07","stage_classifiercode":"09-08","member_number":"A101469","first_name":"TOM","last_name":"BYBEE","classification":"A","division":"PRODUCTION","hit_factor":2.7847},{"match_name":"EDPS USPSA October 2 2021","match_date":"2021-10-01","stage_classifiercode":"09-08","member_number":"A133142","first_name":"LOGAN","last_name":"BILA","classification":"U","division":"PRODUCTION","hit_factor":2.7822},{"match_name":"QPS Quantico Shooting Club January USPSA   ","match_date":"2021-01-09","stage_classifiercode":"09-08","member_number":"A130629","first_name":"JACOB","last_name":"ALDEAN","classification":"U","division":"PRODUCTION","hit_factor":2.7778},{"match_name":"OKCGC USPSA April 2018","match_date":"2018-04-07","stage_classifiercode":"09-08","member_number":"A105403","first_name":"MICAH","last_name":"PUCKETT","classification":"U","division":"PRODUCTION","hit_factor":2.7754},{"match_name":"RBGC USPSA 2021-8-15 Special Classifier Match","match_date":"2021-08-15","stage_classifiercode":"09-08","member_number":"A68985","first_name":"CHRIS","last_name":"FARNAN","classification":"U","division":"PRODUCTION","hit_factor":2.7731},{"match_name":"OKCGC 2017 January Classifier Spectacular","match_date":"2017-01-29","stage_classifiercode":"09-08","member_number":"A91228","first_name":"DANIEL","last_name":"KEEF","classification":"U","division":"PRODUCTION","hit_factor":2.7715},{"match_name":"Southkent USPSA MAY match","match_date":"2017-05-20","stage_classifiercode":"09-08","member_number":"A102745","first_name":"CALEB","last_name":"BELTZ","classification":"U","division":"PRODUCTION","hit_factor":2.7714},{"match_name":"Bossier Parish Practical Shooters March 21 2021","match_date":"2021-03-21","stage_classifiercode":"09-08","member_number":"TY105855","first_name":"BARRY","last_name":"BOOKER","classification":"C","division":"PRODUCTION","hit_factor":2.7692},{"match_name":"WSPS OCTOBER 2016 SPECIAL CLASSIFIER MATCH","match_date":"2016-10-29","stage_classifiercode":"09-08","member_number":"TY48291","first_name":"ALBERT","last_name":"LIAO","classification":"B","division":"PRODUCTION","hit_factor":2.7664},{"match_name":"Chillicothe April-2018 USPSA Classifier Match","match_date":"2018-04-28","stage_classifiercode":"09-08","member_number":"A109815","first_name":"JASON","last_name":"BROUGHTON","classification":"U","division":"PRODUCTION","hit_factor":2.7654},{"match_name":"2018-10 Bone Creek USPSA","match_date":"2018-10-07","stage_classifiercode":"09-08","member_number":"FY74277","first_name":"TERRY","last_name":"RATLIFF","classification":"B","division":"PRODUCTION","hit_factor":2.765},{"match_name":"Alpha Mike August Classifier 2021   ","match_date":"2021-08-15","stage_classifiercode":"09-08","member_number":"A135798","first_name":"JOSEPH","last_name":"POMPA SR","classification":"U","division":"PRODUCTION","hit_factor":2.7591},{"match_name":"Danville Rifle And Pistol Club USPSA Classifier Match","match_date":"2017-11-11","stage_classifiercode":"09-08","member_number":"Ty88153","first_name":"PAUL","last_name":"NURMI","classification":"B","division":"PRODUCTION","hit_factor":2.758},{"match_name":"EDPS USPSA October 2 2021","match_date":"2021-10-01","stage_classifiercode":"09-08","member_number":"A131966","first_name":"LARRY","last_name":"SHARP","classification":"U","division":"PRODUCTION","hit_factor":2.7559},{"match_name":"Treasure State Championship Hosted By MCAS","match_date":"2020-06-20","stage_classifiercode":"09-08","member_number":"A126019","first_name":"BRETT","last_name":"LARKINS","classification":"U","division":"PRODUCTION","hit_factor":2.7344},{"match_name":"DGC USPSA Classifier Match","match_date":"2017-07-30","stage_classifiercode":"09-08","member_number":"FY90633","first_name":"BRANT","last_name":"PACE","classification":"B","division":"PRODUCTION","hit_factor":2.7335},{"match_name":"Piscataqua  Master Blasters USPSA Special Classifier","match_date":"2017-12-03","stage_classifiercode":"09-08","member_number":"A37388","first_name":"JAY","last_name":"LONGTIN","classification":"U","division":"PRODUCTION","hit_factor":2.733},{"match_name":"LCSC Linden USPSA 031118","match_date":"2018-03-11","stage_classifiercode":"09-08","member_number":"A102392","first_name":"MATT","last_name":"SCHENE","classification":"U","division":"PRODUCTION","hit_factor":2.7316},{"match_name":"OKCGC 2017 January Classifier Spectacular","match_date":"2017-01-29","stage_classifiercode":"09-08","member_number":"A94824","first_name":"DERRICK","last_name":"TANNER","classification":"D","division":"PRODUCTION","hit_factor":2.7311},{"match_name":"Harvard Action Shooters June 2018 USPSA Pistol Match","match_date":"2018-06-10","stage_classifiercode":"09-08","member_number":"TY80786","first_name":"DANIEL","last_name":"HAYWOOD","classification":"A","division":"PRODUCTION","hit_factor":2.7261},{"match_name":"WSPS OCTOBER 2016 SPECIAL CLASSIFIER MATCH","match_date":"2016-10-29","stage_classifiercode":"09-08","member_number":"A88050","first_name":"PATRICK","last_name":"MCKERNAN","classification":"B","division":"PRODUCTION","hit_factor":2.7245},{"match_name":"2da Copa Nacional USPSA ","match_date":"2016-05-22","stage_classifiercode":"09-08","member_number":"\"\"","first_name":"OSVALDO","last_name":"SANDOVAL","classification":"U","division":"PRODUCTION","hit_factor":2.7097},{"match_name":"QPS Quantico Shooting Club January USPSA   ","match_date":"2021-01-09","stage_classifiercode":"09-08","member_number":"TY77140","first_name":"R","last_name":"ROUNDS","classification":"C","division":"PRODUCTION","hit_factor":2.7027},{"match_name":"AVAP62318","match_date":"2018-06-23","stage_classifiercode":"09-08","member_number":"A109709","first_name":"SONG","last_name":"YAO","classification":"D","division":"PRODUCTION","hit_factor":2.7027},{"match_name":"PCWC USPSA  8-28-2021","match_date":"2021-08-28","stage_classifiercode":"09-08","member_number":"A109928","first_name":"LARRY","last_name":"SMITH","classification":"B","division":"PRODUCTION","hit_factor":2.7},{"match_name":"Treasure State Championship Hosted By MCAS","match_date":"2020-06-20","stage_classifiercode":"09-08","member_number":"A99293","first_name":"ADAM","last_name":"BURT","classification":"C","division":"PRODUCTION","hit_factor":2.6966},{"match_name":"Lefthanders Gun Club Practical Shooters March 5 and 6","match_date":"2016-03-05","stage_classifiercode":"09-08","member_number":"Ty-78829","first_name":"STEFAN","last_name":"BACKHUS","classification":"D","division":"PRODUCTION","hit_factor":2.6853},{"match_name":"ORSA USPSA January 2021","match_date":"2021-01-16","stage_classifiercode":"09-08","member_number":"A124620","first_name":"SEAN","last_name":"HEARNE","classification":"U","division":"PRODUCTION","hit_factor":2.6701},{"match_name":"LCSC Linden USPSA 031118","match_date":"2018-03-11","stage_classifiercode":"09-08","member_number":"A93243","first_name":"TONY","last_name":"LUONG","classification":"C","division":"PRODUCTION","hit_factor":2.6701},{"match_name":"CRC_20160514_SuperClassifier","match_date":"2016-05-14","stage_classifiercode":"09-08","member_number":"A62264","first_name":"JACK","last_name":"CROOM","classification":"C","division":"PRODUCTION","hit_factor":2.6676},{"match_name":"Harvard Action Shooters June 2018 USPSA Pistol Match","match_date":"2018-06-10","stage_classifiercode":"09-08","member_number":"A107735","first_name":"JAMES","last_name":"BOULAY","classification":"C","division":"PRODUCTION","hit_factor":2.6575},{"match_name":"2018-10 Bone Creek USPSA","match_date":"2018-10-07","stage_classifiercode":"09-08","member_number":"A112178","first_name":"EDWARD","last_name":"RANDEL","classification":"U","division":"PRODUCTION","hit_factor":2.6549},{"match_name":"Strongpoint February 2017 Classifier Match","match_date":"2017-02-04","stage_classifiercode":"09-08","member_number":"A99052","first_name":"ISAAC","last_name":"WATERS","classification":"C","division":"PRODUCTION","hit_factor":2.6508},{"match_name":"Coastal Area Practical Shooters 8-27-16","match_date":"2016-08-27","stage_classifiercode":"09-08","member_number":"A98315","first_name":"CHRISTOPHER","last_name":"MCMINN","classification":"U","division":"PRODUCTION","hit_factor":2.6508},{"match_name":"Chillicothe April-2017 USPSA Match","match_date":"2017-04-23","stage_classifiercode":"09-08","member_number":"TY27544","first_name":"DON","last_name":"DANSBY","classification":"B","division":"PRODUCTION","hit_factor":2.6445},{"match_name":"PMSC  USPSA JULY 2017","match_date":"2017-07-01","stage_classifiercode":"09-08","member_number":"A90508","first_name":"JOHN","last_name":"ROVNAN","classification":"D","division":"PRODUCTION","hit_factor":2.6419},{"match_name":"Collin County USPSA Nov 6 2016","match_date":"2016-11-06","stage_classifiercode":"09-08","member_number":"\"\"","first_name":"CHRIS","last_name":"WEATHERS","classification":"C","division":"PRODUCTION","hit_factor":2.6412},{"match_name":"ENPS May 2018 USPSA Match","match_date":"2018-05-06","stage_classifiercode":"09-08","member_number":"A103973","first_name":"STEPHEN","last_name":"HIPPLE","classification":"U","division":"PRODUCTION","hit_factor":2.6361},{"match_name":"The one where somebody makes GM - Classifier - Renton USPSA - February 2021 - NW05","match_date":"2021-02-28","stage_classifiercode":"09-08","member_number":"A131363","first_name":"DON","last_name":"CARROLL","classification":"B","division":"PRODUCTION","hit_factor":2.6347},{"match_name":"PMSC  USPSA JULY 2017","match_date":"2017-07-01","stage_classifiercode":"09-08","member_number":"a102429","first_name":"JASON","last_name":"BURI","classification":"C","division":"PRODUCTION","hit_factor":2.6332},{"match_name":"PMSC  USPSA JULY 2017","match_date":"2017-07-01","stage_classifiercode":"09-08","member_number":"a85227","first_name":"JOHN","last_name":"RADINSKY","classification":"B","division":"PRODUCTION","hit_factor":2.6316},{"match_name":"RCPS USPSA 8 Apr 2017","match_date":"2017-04-08","stage_classifiercode":"09-08","member_number":"TY91979","first_name":"MICHAEL","last_name":"HOTTINGER","classification":"C","division":"PRODUCTION","hit_factor":2.6178},{"match_name":"CTASA 3rd Sunday USPSA - February 2016","match_date":"2016-02-21","stage_classifiercode":"09-08","member_number":"TY83648","first_name":"JERRY","last_name":"WIESE","classification":"C","division":"PRODUCTION","hit_factor":2.6144},{"match_name":"EDPS USPSA October 2 2021","match_date":"2021-10-01","stage_classifiercode":"09-08","member_number":"A123263","first_name":"FRED","last_name":"LIBRACH","classification":"C","division":"PRODUCTION","hit_factor":2.6087},{"match_name":"BSPSC 2017 April Special Classifier","match_date":"2017-04-09","stage_classifiercode":"09-08","member_number":"NONE","first_name":"LARAMIE","last_name":"WOLVERTON","classification":"U","division":"PRODUCTION","hit_factor":2.6077},{"match_name":"USPSA","match_date":"2018-12-02","stage_classifiercode":"09-08","member_number":"A33422","first_name":"DENNIS  E","last_name":"BOSLEY","classification":"U","division":"PRODUCTION","hit_factor":2.6059},{"match_name":"MCPSL Pistol 7-11-20","match_date":"2020-07-11","stage_classifiercode":"09-08","member_number":"Ty113616","first_name":"LEE","last_name":"SEELA","classification":"C","division":"PRODUCTION","hit_factor":2.6042},{"match_name":"Chillicothe April-2018 USPSA Classifier Match","match_date":"2018-04-28","stage_classifiercode":"09-08","member_number":"A99831","first_name":"JASON","last_name":"ANGLIN","classification":"B","division":"PRODUCTION","hit_factor":2.5974},{"match_name":"Southkent USPSA MAY match","match_date":"2017-05-20","stage_classifiercode":"09-08","member_number":"A96360","first_name":"STEVE","last_name":"DUMOND","classification":"D","division":"PRODUCTION","hit_factor":2.5965},{"match_name":"Hampden RPC July USPSA","match_date":"2017-07-16","stage_classifiercode":"09-08","member_number":"A86762","first_name":"NATE","last_name":"LAKE","classification":"B","division":"PRODUCTION","hit_factor":2.5943},{"match_name":"Jamaica Rifle FCA-09 USPSA Weekend Rumble March 12th -13th 2021","match_date":"2021-03-13","stage_classifiercode":"09-08","member_number":"Tyf93178","first_name":"SANJAY","last_name":"WELSH","classification":"B","division":"PRODUCTION","hit_factor":2.5937},{"match_name":"Lefthanders Gun Club Practical Shooters March 5 and 6","match_date":"2016-03-05","stage_classifiercode":"09-08","member_number":"\"\"","first_name":"ROB","last_name":"SANAZARO","classification":"U","division":"PRODUCTION","hit_factor":2.5876},{"match_name":"WSPS OCTOBER 2016 SPECIAL CLASSIFIER MATCH","match_date":"2016-10-29","stage_classifiercode":"09-08","member_number":"A95308","first_name":"DAVID","last_name":"AZZOLI","classification":"U","division":"PRODUCTION","hit_factor":2.5855},{"match_name":"BSPSC 2017 April Special Classifier","match_date":"2017-04-09","stage_classifiercode":"09-08","member_number":"L3552","first_name":"GARY","last_name":"RITTER","classification":"C","division":"PRODUCTION","hit_factor":2.5684},{"match_name":"Chillicothe April-2018 USPSA Classifier Match","match_date":"2018-04-28","stage_classifiercode":"09-08","member_number":"TY88494","first_name":"GEORGE","last_name":"DYSICO","classification":"A","division":"PRODUCTION","hit_factor":2.5668},{"match_name":"EDPS USPSA October 2 2021","match_date":"2021-10-01","stage_classifiercode":"09-08","member_number":"A136274","first_name":"NICK","last_name":"PEARSON","classification":"U","division":"PRODUCTION","hit_factor":2.5621},{"match_name":"AREA 59  SPRING ALL CLASSIFIER","match_date":"2018-03-31","stage_classifiercode":"09-08","member_number":"A99651","first_name":"RIDONG","last_name":"WEN","classification":"D","division":"PRODUCTION","hit_factor":2.5615},{"match_name":"Harvard Action Shooters June 2018 USPSA Pistol Match","match_date":"2018-06-10","stage_classifiercode":"09-08","member_number":"A102752","first_name":"ZIPPORAH","last_name":"DROZDOWICZ","classification":"D","division":"PRODUCTION","hit_factor":2.561},{"match_name":"Chillicothe April-2017 USPSA Match","match_date":"2017-04-23","stage_classifiercode":"09-08","member_number":"A96574","first_name":"JIM","last_name":"SMALL","classification":"D","division":"PRODUCTION","hit_factor":2.5542},{"match_name":"Harvard Action Shooters June 2018 USPSA Pistol Match","match_date":"2018-06-10","stage_classifiercode":"09-08","member_number":"A102748","first_name":"ANDREW","last_name":"GAGNON","classification":"C","division":"PRODUCTION","hit_factor":2.5532},{"match_name":"Chillicothe April-2018 USPSA Classifier Match","match_date":"2018-04-28","stage_classifiercode":"09-08","member_number":"\"\"","first_name":"JERRY","last_name":"STORER","classification":"U","division":"PRODUCTION","hit_factor":2.5496},{"match_name":"Lefthanders Gun Club Practical Shooters March 5 and 6","match_date":"2016-03-05","stage_classifiercode":"09-08","member_number":"Ty72670","first_name":"DALE","last_name":"HARDING","classification":"B","division":"PRODUCTION","hit_factor":2.5472},{"match_name":"QPS Quantico Shooting Club January USPSA   ","match_date":"2021-01-09","stage_classifiercode":"09-08","member_number":"A131928","first_name":"JAMES","last_name":"HALE","classification":"C","division":"PRODUCTION","hit_factor":2.5356},{"match_name":"CRC_20160514_SuperClassifier","match_date":"2016-05-14","stage_classifiercode":"09-08","member_number":"A91017","first_name":"JON","last_name":"MANNA","classification":"C","division":"PRODUCTION","hit_factor":2.535},{"match_name":"USPSA MO21 Special Classifier 2Alpha SBRC February 27 2021","match_date":"2021-02-27","stage_classifiercode":"09-08","member_number":"A113404","first_name":"BRIAN","last_name":"STANEK","classification":"C","division":"PRODUCTION","hit_factor":2.5253},{"match_name":"Nampa USPSA June 21st 2020","match_date":"2020-06-21","stage_classifiercode":"09-08","member_number":"TY116605","first_name":"CARL","last_name":"OLSON","classification":"B","division":"PRODUCTION","hit_factor":2.5239},{"match_name":"Danville Rifle And Pistol Club USPSA Classifier Match","match_date":"2017-11-11","stage_classifiercode":"09-08","member_number":"A90126","first_name":"TOM","last_name":"BURZYNSKI","classification":"B","division":"PRODUCTION","hit_factor":2.521},{"match_name":"Lefthanders Gun Club Practical Shooters March 5 and 6","match_date":"2016-03-05","stage_classifiercode":"09-08","member_number":"A82327","first_name":"BRIAN","last_name":"SIX","classification":"B","division":"PRODUCTION","hit_factor":2.52},{"match_name":"Alpha Mike August Classifier 2021   ","match_date":"2021-08-15","stage_classifiercode":"09-08","member_number":"A127928","first_name":"BRETT","last_name":"MURDOCK","classification":"C","division":"PRODUCTION","hit_factor":2.518},{"match_name":"Salt City practical shooting league 'all classifier match'","match_date":"2020-08-30","stage_classifiercode":"09-08","member_number":"A128171","first_name":"DON","last_name":"SMITH","classification":"U","division":"PRODUCTION","hit_factor":2.5086},{"match_name":"Mesilla Valley P Novemberr 2018","match_date":"2018-11-03","stage_classifiercode":"09-08","member_number":"na","first_name":"KC","last_name":"SCHLOTTERBECK","classification":"U","division":"PRODUCTION","hit_factor":2.4982},{"match_name":"LCSC Linden USPSA 031118","match_date":"2018-03-11","stage_classifiercode":"09-08","member_number":"A107664","first_name":"LEAH","last_name":"ALLEN","classification":"U","division":"PRODUCTION","hit_factor":2.4981},{"match_name":"GoShoot Outdoor A6 Warm up And Classifier match!","match_date":"2021-04-03","stage_classifiercode":"09-08","member_number":"A128084","first_name":"FERNANDO","last_name":"CRUZ","classification":"U","division":"PRODUCTION","hit_factor":2.4981},{"match_name":"Crooked Creek Pistol League - July 2020","match_date":"2020-07-18","stage_classifiercode":"09-08","member_number":"A102352","first_name":"MICHAEL","last_name":"CASSELBERRY","classification":"U","division":"PRODUCTION","hit_factor":2.498},{"match_name":"OKCGC USPSA Feb 2018","match_date":"2018-02-03","stage_classifiercode":"09-08","member_number":"A84245","first_name":"BRYAN","last_name":"HOOVER","classification":"C","division":"PRODUCTION","hit_factor":2.4972},{"match_name":"SPSA USPSA August 1st Sat Match","match_date":"2018-08-04","stage_classifiercode":"09-08","member_number":"A108175","first_name":"EMILY","last_name":"MONTALVO","classification":"D","division":"PRODUCTION","hit_factor":2.4962},{"match_name":"NCPS USPSA Handgun Match October 23 2016","match_date":"2016-10-23","stage_classifiercode":"09-08","member_number":"A89732","first_name":"JONATHAN","last_name":"EBELING","classification":"C","division":"PRODUCTION","hit_factor":2.494},{"match_name":"CIPSC IL02 Havana June USPSA","match_date":"2020-06-13","stage_classifiercode":"09-08","member_number":"A128007","first_name":"JOEL","last_name":"POORBAUGH","classification":"U","division":"PRODUCTION","hit_factor":2.4893},{"match_name":"LCSC Linden USPSA 031118","match_date":"2018-03-11","stage_classifiercode":"09-08","member_number":"A102844","first_name":"ANDREW","last_name":"SCHUMACHER","classification":"C","division":"PRODUCTION","hit_factor":2.4868},{"match_name":"Chillicothe April-2018 USPSA Classifier Match","match_date":"2018-04-28","stage_classifiercode":"09-08","member_number":"A101219","first_name":"CHAD","last_name":"ELLIOTT","classification":"C","division":"PRODUCTION","hit_factor":2.4865},{"match_name":"2016 Tennessee Atomic Blast","match_date":"2016-09-16","stage_classifiercode":"09-08","member_number":"TY90469","first_name":"CHARLES","last_name":"HURSH","classification":"C","division":"PRODUCTION","hit_factor":2.4793},{"match_name":"CRC_20160514_SuperClassifier","match_date":"2016-05-14","stage_classifiercode":"09-08","member_number":"\"\"","first_name":"JESSE","last_name":"KIERNAN","classification":"U","division":"PRODUCTION","hit_factor":2.4716},{"match_name":"Central IL Practical Shooters October Match","match_date":"2016-10-09","stage_classifiercode":"09-08","member_number":"A98780","first_name":"KARL","last_name":"HAGEN","classification":"U","division":"PRODUCTION","hit_factor":2.4684},{"match_name":"2017 Arkansas Section Championship","match_date":"2017-06-14","stage_classifiercode":"09-08","member_number":"TY50501","first_name":"BERNIE","last_name":"MCHUGH","classification":"M","division":"PRODUCTION","hit_factor":2.4666},{"match_name":"WPS USPSA Monthly Match November 2018","match_date":"2018-11-10","stage_classifiercode":"09-08","member_number":"TY76549","first_name":"TOM","last_name":"VENEZIO","classification":"D","division":"PRODUCTION","hit_factor":2.4645},{"match_name":"Chillicothe April-2018 USPSA Classifier Match","match_date":"2018-04-28","stage_classifiercode":"09-08","member_number":"TY9065","first_name":"MIKE","last_name":"MOREHEAD","classification":"U","division":"PRODUCTION","hit_factor":2.4601},{"match_name":"DGC USPSA Classifier Match","match_date":"2017-07-30","stage_classifiercode":"09-08","member_number":"A62296","first_name":"DAVID","last_name":"BRIGHAM","classification":"U","division":"PRODUCTION","hit_factor":2.4535},{"match_name":"Danville Rifle And Pistol Club USPSA Classifier Match","match_date":"2017-11-11","stage_classifiercode":"09-08","member_number":"a-105390","first_name":"SCOTT","last_name":"GIVENS","classification":"U","division":"PRODUCTION","hit_factor":2.439},{"match_name":"Chillicothe April-2018 USPSA Classifier Match","match_date":"2018-04-28","stage_classifiercode":"09-08","member_number":"A87408","first_name":"AUGUST","last_name":"LEE","classification":"B","division":"PRODUCTION","hit_factor":2.4329},{"match_name":"CRC_20160514_SuperClassifier","match_date":"2016-05-14","stage_classifiercode":"09-08","member_number":"A95538","first_name":"BRUCE","last_name":"WADDLE","classification":"D","division":"PRODUCTION","hit_factor":2.4297},{"match_name":"Low Country USPSA October Monthly Match","match_date":"2020-10-24","stage_classifiercode":"09-08","member_number":"A121127","first_name":"THOMAS","last_name":"HOEFLER","classification":"C","division":"PRODUCTION","hit_factor":2.4262},{"match_name":"QPS Quantico Shooting Club January USPSA   ","match_date":"2021-01-09","stage_classifiercode":"09-08","member_number":"A132265","first_name":"JOSHUA","last_name":"KOLARCIK","classification":"U","division":"PRODUCTION","hit_factor":2.4255},{"match_name":"ENPS May 2018 USPSA Match","match_date":"2018-05-06","stage_classifiercode":"09-08","member_number":"TY105204","first_name":"MATTHEW","last_name":"VAN HOOK","classification":"U","division":"PRODUCTION","hit_factor":2.4247},{"match_name":"APSC USPSA Classifier Match 07-01-17","match_date":"2017-07-01","stage_classifiercode":"09-08","member_number":"A89702","first_name":"SCOTT","last_name":"JENNINGS","classification":"B","division":"PRODUCTION","hit_factor":2.4231},{"match_name":"Richmond Boro Gun Club July 2018 Monthly USPSA match","match_date":"2018-07-21","stage_classifiercode":"09-08","member_number":"\"\"","first_name":"MATTHEW","last_name":"ST.DENIS","classification":"U","division":"PRODUCTION","hit_factor":2.4212},{"match_name":"WPS USPSA Monthly Match November 2018","match_date":"2018-11-10","stage_classifiercode":"09-08","member_number":"A61698","first_name":"VINCENT","last_name":"PASCALE","classification":"C","division":"PRODUCTION","hit_factor":2.4187},{"match_name":"Tehama Shooters December 2020 USPSA","match_date":"2020-12-26","stage_classifiercode":"09-08","member_number":"A130079","first_name":"STACY","last_name":"LARSON","classification":"D","division":"PRODUCTION","hit_factor":2.4096},{"match_name":"RCPS USPSA 8 Apr 2017","match_date":"2017-04-08","stage_classifiercode":"09-08","member_number":"\"\"","first_name":"FRED","last_name":"DILDINE","classification":"U","division":"PRODUCTION","hit_factor":2.3977},{"match_name":"EASTER EGG HUNT AREA 59  ALL CLASSFIER MATCH","match_date":"2017-04-15","stage_classifiercode":"09-08","member_number":"A102787","first_name":"LEO","last_name":"BALTAZAR","classification":"U","division":"PRODUCTION","hit_factor":2.3956},{"match_name":"Richmond Boro Gun Club July 2018 Monthly USPSA match","match_date":"2018-07-21","stage_classifiercode":"09-08","member_number":"\"\"","first_name":"ALEX","last_name":"GAS","classification":"U","division":"PRODUCTION","hit_factor":2.3926},{"match_name":"SPSA USPSA August 1st Sat Match","match_date":"2018-08-04","stage_classifiercode":"09-08","member_number":"A91991","first_name":"GLENN","last_name":"GREEN","classification":"B","division":"PRODUCTION","hit_factor":2.3923},{"match_name":"PIPS 08-05-2020","match_date":"2020-08-05","stage_classifiercode":"09-08","member_number":"TY68444","first_name":"MONTE","last_name":"BRUESEWITZ","classification":"B","division":"PRODUCTION","hit_factor":2.392},{"match_name":"Pioneer Action Shooters USPSA 5-27-18","match_date":"2018-05-27","stage_classifiercode":"09-08","member_number":"\"\"","first_name":"BRANDON","last_name":"RIBEIRO","classification":"U","division":"PRODUCTION","hit_factor":2.3849},{"match_name":"2017 Arkansas Section Championship","match_date":"2017-06-14","stage_classifiercode":"09-08","member_number":"A101376","first_name":"SHANE","last_name":"MACON","classification":"C","division":"PRODUCTION","hit_factor":2.381},{"match_name":"EASTER EGG HUNT AREA 59  ALL CLASSFIER MATCH","match_date":"2017-04-15","stage_classifiercode":"09-08","member_number":"a66891","first_name":"RENE","last_name":"ZALAMEA","classification":"U","division":"PRODUCTION","hit_factor":2.381},{"match_name":"NCPS USPSA Handgun Match October 23 2016","match_date":"2016-10-23","stage_classifiercode":"09-08","member_number":"A98114","first_name":"LAWRENCE","last_name":"CHENG","classification":"U","division":"PRODUCTION","hit_factor":2.3758},{"match_name":"Collin County USPSA 05-23-2021","match_date":"2021-05-23","stage_classifiercode":"09-08","member_number":"A78298","first_name":"GRIFFIN","last_name":"PAUL","classification":"U","division":"PRODUCTION","hit_factor":2.3669},{"match_name":"Richmond Boro Gun Club July 2018 Monthly USPSA match","match_date":"2018-07-21","stage_classifiercode":"09-08","member_number":"A106866","first_name":"MIKHAIL","last_name":"OSTROV","classification":"C","division":"PRODUCTION","hit_factor":2.3649},{"match_name":"BSPSC 2017 April Special Classifier","match_date":"2017-04-09","stage_classifiercode":"09-08","member_number":"A82739","first_name":"RANDY","last_name":"HUTCHESON","classification":"C","division":"PRODUCTION","hit_factor":2.3638},{"match_name":"Chillicothe April-2017 USPSA Match","match_date":"2017-04-23","stage_classifiercode":"09-08","member_number":"A102567","first_name":"MIKE","last_name":"STEELE","classification":"U","division":"PRODUCTION","hit_factor":2.3633},{"match_name":"SFPC October 1 2017 USPSA Match","match_date":"2017-10-01","stage_classifiercode":"09-08","member_number":"A97434","first_name":"GONZALO","last_name":"GOMEZ","classification":"C","division":"PRODUCTION","hit_factor":2.361},{"match_name":"Hampden RPC July USPSA","match_date":"2017-07-16","stage_classifiercode":"09-08","member_number":"NONE","first_name":"FRED","last_name":"EDGECOMB","classification":"Unclassified","division":"PRODUCTION","hit_factor":2.3563},{"match_name":"1a Fecha USPSA 2020","match_date":"2020-01-19","stage_classifiercode":"09-08","member_number":"TY91989","first_name":"ALFREDO","last_name":"MELENDEZ-CRUZ","classification":"C","division":"PRODUCTION","hit_factor":2.343},{"match_name":"NCPS USPSA Handgun Match October 23 2016","match_date":"2016-10-23","stage_classifiercode":"09-08","member_number":"L3933","first_name":"DEAN","last_name":"DIPIETRO","classification":"C","division":"PRODUCTION","hit_factor":2.3371},{"match_name":"Bossier Parish Practical Shooters March 21 2021","match_date":"2021-03-21","stage_classifiercode":"09-08","member_number":"A111658","first_name":"ADELAIDE","last_name":"JONES","classification":"C","division":"PRODUCTION","hit_factor":2.3343},{"match_name":"MCPSL Pistol 7-11-20","match_date":"2020-07-11","stage_classifiercode":"09-08","member_number":"TY94822","first_name":"ADAM","last_name":"TRAN","classification":"A","division":"PRODUCTION","hit_factor":2.3121},{"match_name":"CCSC USPSA All Classifier Match","match_date":"2021-06-12","stage_classifiercode":"09-08","member_number":"A116845","first_name":"JUSTIN","last_name":"HENRY","classification":"B","division":"PRODUCTION","hit_factor":2.3109},{"match_name":"Coastal Area Practical Shooters 8-27-16","match_date":"2016-08-27","stage_classifiercode":"09-08","member_number":"A98450","first_name":"GORDON","last_name":"JEFFCOAT","classification":"U","division":"PRODUCTION","hit_factor":2.305},{"match_name":"Lefthanders Gun Club Practical Shooters March 5 and 6","match_date":"2016-03-05","stage_classifiercode":"09-08","member_number":"A86672","first_name":"DON","last_name":"HITCHINGS","classification":"D","division":"PRODUCTION","hit_factor":2.3031},{"match_name":"Chillicothe April-2018 USPSA Classifier Match","match_date":"2018-04-28","stage_classifiercode":"09-08","member_number":"A110160","first_name":"MIKE","last_name":"SPANIER","classification":"U","division":"PRODUCTION","hit_factor":2.3011},{"match_name":"EASTER EGG HUNT AREA 59  ALL CLASSFIER MATCH","match_date":"2017-04-15","stage_classifiercode":"09-08","member_number":"A101006","first_name":"JASON","last_name":"WELLS","classification":"U","division":"PRODUCTION","hit_factor":2.2967},{"match_name":"ENPS May 2018 USPSA Match","match_date":"2018-05-06","stage_classifiercode":"09-08","member_number":"A93239","first_name":"JOHN","last_name":"COCHRAN","classification":"C","division":"PRODUCTION","hit_factor":2.2907},{"match_name":"Atlanta Practical Shooters March 2017 USPSA - Classifier Match","match_date":"2017-03-05","stage_classifiercode":"09-08","member_number":"PEN","first_name":"PATRICK","last_name":"KANE","classification":"U","division":"PRODUCTION","hit_factor":2.2901},{"match_name":"CCPL 06-27-2020","match_date":"2020-06-27","stage_classifiercode":"09-08","member_number":"A125746","first_name":"RYAN","last_name":"SWAIN","classification":"U","division":"PRODUCTION","hit_factor":2.281},{"match_name":"NCPS USPSA Handgun Match October 23 2016","match_date":"2016-10-23","stage_classifiercode":"09-08","member_number":"FY92636","first_name":"JORDAN","last_name":"SU","classification":"A","division":"PRODUCTION","hit_factor":2.2727},{"match_name":"Piscataqua  Master Blasters USPSA Special Classifier","match_date":"2017-12-03","stage_classifiercode":"09-08","member_number":"A101142","first_name":"RO-HARRY","last_name":"WARREN","classification":"U","division":"PRODUCTION","hit_factor":2.251},{"match_name":"WPS USPSA Monthly Match November 2018","match_date":"2018-11-10","stage_classifiercode":"09-08","member_number":"A98519","first_name":"BOB","last_name":"DEVITT","classification":"U","division":"PRODUCTION","hit_factor":2.2491},{"match_name":"CRC_20160514_SuperClassifier","match_date":"2016-05-14","stage_classifiercode":"09-08","member_number":"A87980","first_name":"MICHAEL","last_name":"CROSBY","classification":"U","division":"PRODUCTION","hit_factor":2.2409},{"match_name":"WPS USPSA Monthly Match November 2018","match_date":"2018-11-10","stage_classifiercode":"09-08","member_number":"A113854","first_name":"GERARD","last_name":"MOSER","classification":"U","division":"PRODUCTION","hit_factor":2.2403},{"match_name":"LCSC Linden USPSA 031118","match_date":"2018-03-11","stage_classifiercode":"09-08","member_number":"A93504","first_name":"KEVIN","last_name":"NGU","classification":"A","division":"PRODUCTION","hit_factor":2.2341},{"match_name":"Collin County USPSA Nov 6 2016","match_date":"2016-11-06","stage_classifiercode":"09-08","member_number":"A87668","first_name":"JAMES","last_name":"ACOSTA","classification":"C","division":"PRODUCTION","hit_factor":2.2305},{"match_name":"4ta Copa USPSA","match_date":"2016-11-20","stage_classifiercode":"09-08","member_number":"\"\"","first_name":"JOSE R","last_name":"FUENTES RODRIGUEZ","classification":"U","division":"PRODUCTION","hit_factor":2.2286},{"match_name":"EASTER EGG HUNT AREA 59  ALL CLASSFIER MATCH","match_date":"2017-04-15","stage_classifiercode":"09-08","member_number":"A98117","first_name":"ROLAND","last_name":"VILLAMIN","classification":"U","division":"PRODUCTION","hit_factor":2.2143},{"match_name":"AREA 59  SPRING ALL CLASSIFIER","match_date":"2018-03-31","stage_classifiercode":"09-08","member_number":"A104167","first_name":"JEFFREY","last_name":"POLK","classification":"C","division":"PRODUCTION","hit_factor":2.2111},{"match_name":"Central IL Practical Shooters October Match","match_date":"2016-10-09","stage_classifiercode":"09-08","member_number":"A79514","first_name":"KIP","last_name":"JACOBSEN","classification":"C","division":"PRODUCTION","hit_factor":2.2082},{"match_name":"MAPSA 2016.05.14","match_date":"2016-05-14","stage_classifiercode":"09-08","member_number":"\"\"","first_name":"NGUYEN","last_name":"LE","classification":"U","division":"PRODUCTION","hit_factor":2.2022},{"match_name":"CGC 100816","match_date":"2016-10-08","stage_classifiercode":"09-08","member_number":"\"\"","first_name":"DAVID","last_name":"ODDO","classification":"C","division":"PRODUCTION","hit_factor":2.202},{"match_name":"MCPSL Pistol 7-11-20","match_date":"2020-07-11","stage_classifiercode":"09-08","member_number":"A92348","first_name":"CHARLIE","last_name":"MODEREGER","classification":"A","division":"PRODUCTION","hit_factor":2.1978},{"match_name":"AREA 59  SPRING ALL CLASSIFIER","match_date":"2018-03-31","stage_classifiercode":"09-08","member_number":"TY104740","first_name":"ERIC","last_name":"WU","classification":"D","division":"PRODUCTION","hit_factor":2.1854},{"match_name":"Harvard Action Shooters June 2018 USPSA Pistol Match","match_date":"2018-06-10","stage_classifiercode":"09-08","member_number":"TY56216","first_name":"AL","last_name":"SENESI","classification":"B","division":"PRODUCTION","hit_factor":2.1831},{"match_name":"BHPC USPSA Match Classifier IOWA","match_date":"2018-06-16","stage_classifiercode":"09-08","member_number":"A106659","first_name":"JACOB","last_name":"GEARHART","classification":"C","division":"PRODUCTION","hit_factor":2.1779},{"match_name":"WSPS OCTOBER 2016 SPECIAL CLASSIFIER MATCH","match_date":"2016-10-29","stage_classifiercode":"09-08","member_number":"TY97945","first_name":"SPENCER","last_name":"GAMBLE","classification":"U","division":"PRODUCTION","hit_factor":2.1758},{"match_name":"Prescott 3rd Sunday USPSA 4-18-21 ALL CLASSIFIER","match_date":"2021-04-18","stage_classifiercode":"09-08","member_number":"TY90451","first_name":"JOSEPH","last_name":"APOSTOLIK","classification":"A","division":"PRODUCTION","hit_factor":2.1657},{"match_name":"Strongpoint February 2017 Classifier Match","match_date":"2017-02-04","stage_classifiercode":"09-08","member_number":"\"\"","first_name":"JOSH","last_name":"ADAMS","classification":"U","division":"PRODUCTION","hit_factor":2.1605},{"match_name":"Collin County USPSA 05-23-2021","match_date":"2021-05-23","stage_classifiercode":"09-08","member_number":"A127457","first_name":"RICH","last_name":"JARVIS","classification":"D","division":"PRODUCTION","hit_factor":2.1563},{"match_name":"SFPC October 1 2017 USPSA Match","match_date":"2017-10-01","stage_classifiercode":"09-08","member_number":"\"\"","first_name":"ARTHUR","last_name":"LOBE","classification":"G","division":"PRODUCTION","hit_factor":2.1469},{"match_name":"Treasure State Championship Hosted By MCAS","match_date":"2020-06-20","stage_classifiercode":"09-08","member_number":"TY72873","first_name":"BRICE","last_name":"LIGGET","classification":"","division":"PRODUCTION","hit_factor":2.1468},{"match_name":"Range 307 USPSA 5/7/2017","match_date":"2017-05-07","stage_classifiercode":"09-08","member_number":"\"\"","first_name":"KLAY","last_name":"SABROSKY","classification":"\"\"","division":"PRODUCTION","hit_factor":2.1341},{"match_name":"CTASA 3rd Sunday USPSA - February 2016","match_date":"2016-02-21","stage_classifiercode":"09-08","member_number":"a94264","first_name":"TOM","last_name":"JOHNSON","classification":"U","division":"PRODUCTION","hit_factor":2.1301},{"match_name":"2016 Tennessee Atomic Blast","match_date":"2016-09-16","stage_classifiercode":"09-08","member_number":"FY82156","first_name":"STANLEY","last_name":"HODGIN","classification":"B","division":"PRODUCTION","hit_factor":2.1242},{"match_name":"Pioneer Action Shooters USPSA 5-27-18","match_date":"2018-05-27","stage_classifiercode":"09-08","member_number":"A108985","first_name":"ALEC","last_name":"CARPENTER","classification":"C","division":"PRODUCTION","hit_factor":2.1183},{"match_name":"NCPS USPSA Handgun Match October 23 2016","match_date":"2016-10-23","stage_classifiercode":"09-08","member_number":"TY97490","first_name":"BRENT","last_name":"BURKHART","classification":"D","division":"PRODUCTION","hit_factor":2.114},{"match_name":"Chillicothe April-2018 USPSA Classifier Match","match_date":"2018-04-28","stage_classifiercode":"09-08","member_number":"A105858","first_name":"SCOTT","last_name":"HOECKER","classification":"U","division":"PRODUCTION","hit_factor":2.1044},{"match_name":"2016 Tennessee Atomic Blast","match_date":"2016-09-16","stage_classifiercode":"09-08","member_number":"A63387","first_name":"FRANK","last_name":"CASTIGLIA","classification":"B","division":"PRODUCTION","hit_factor":2.1034},{"match_name":"ORSA USPSA January 2021","match_date":"2021-01-16","stage_classifiercode":"09-08","member_number":"A72343","first_name":"PAUL","last_name":"AVERY","classification":"B","division":"PRODUCTION","hit_factor":2.0952},{"match_name":"RPS October 2018 USPSA Match","match_date":"2018-10-13","stage_classifiercode":"09-08","member_number":"A113959","first_name":"JASON","last_name":"MABE","classification":"U","division":"PRODUCTION","hit_factor":2.0932},{"match_name":"4ta Copa USPSA","match_date":"2016-11-20","stage_classifiercode":"09-08","member_number":"A91054","first_name":"WILBERTO","last_name":"ALAMO","classification":"D","division":"PRODUCTION","hit_factor":2.0908},{"match_name":"SLOSA January 2018 USPSA CLASSIFIER MATCH","match_date":"2018-01-28","stage_classifiercode":"09-08","member_number":"TY99954","first_name":"JOHN","last_name":"HELM","classification":"C","division":"PRODUCTION","hit_factor":2.0893},{"match_name":"Strongpoint February 2017 Classifier Match","match_date":"2017-02-04","stage_classifiercode":"09-08","member_number":"TY83302","first_name":"JAMES","last_name":"FRANKLIN","classification":"D","division":"PRODUCTION","hit_factor":2.0752},{"match_name":"Harvard Action Shooters June 2018 USPSA Pistol Match","match_date":"2018-06-10","stage_classifiercode":"09-08","member_number":"A91772","first_name":"LORI","last_name":"BADURA","classification":"U","division":"PRODUCTION","hit_factor":2.075},{"match_name":"Griffin USPSA Match July 2017","match_date":"2017-07-15","stage_classifiercode":"09-08","member_number":"TY83004","first_name":"CASEY","last_name":"THERIOT","classification":"C","division":"PRODUCTION","hit_factor":2.0664},{"match_name":"PIPS 08-08-2018","match_date":"2018-08-07","stage_classifiercode":"09-08","member_number":"A112644","first_name":"DEE","last_name":"HAMLIN","classification":"U","division":"PRODUCTION","hit_factor":2.0659},{"match_name":"LCSC Linden USPSA 031118","match_date":"2018-03-11","stage_classifiercode":"09-08","member_number":"A103501","first_name":"DERRICK","last_name":"DECKER","classification":"D","division":"PRODUCTION","hit_factor":2.0658},{"match_name":"WSPS OCTOBER 2016 SPECIAL CLASSIFIER MATCH","match_date":"2016-10-29","stage_classifiercode":"09-08","member_number":"TY76759","first_name":"ROBERT","last_name":"MCGINNIS","classification":"D","division":"PRODUCTION","hit_factor":2.058},{"match_name":"RCPS USPSA 8 Apr 2017","match_date":"2017-04-08","stage_classifiercode":"09-08","member_number":"A88203","first_name":"ARTHUR","last_name":"HOWELL","classification":"C","division":"PRODUCTION","hit_factor":2.0535},{"match_name":"TPS USPSA at CMP Jan 20 2018","match_date":"2018-01-20","stage_classifiercode":"09-08","member_number":"A97648","first_name":"ZAC","last_name":"JOINER","classification":"B","division":"PRODUCTION","hit_factor":2.0501},{"match_name":"2016 Tennessee Atomic Blast","match_date":"2016-09-16","stage_classifiercode":"09-08","member_number":"TY75523","first_name":"BILAL","last_name":"SINNO","classification":"A","division":"PRODUCTION","hit_factor":2.0478},{"match_name":"AREA 59  SPRING ALL CLASSIFIER","match_date":"2018-03-31","stage_classifiercode":"09-08","member_number":"A106236","first_name":"POCHOLO","last_name":"DIMAYUGA","classification":"U","division":"PRODUCTION","hit_factor":2.0408},{"match_name":"CIPSC IL02 Havana June USPSA","match_date":"2020-06-13","stage_classifiercode":"09-08","member_number":"ty60499","first_name":"THOMAS","last_name":"CASH","classification":"B","division":"PRODUCTION","hit_factor":2.0342},{"match_name":"APSC USPSA Classifier Match 07-01-17","match_date":"2017-07-01","stage_classifiercode":"09-08","member_number":"A103542","first_name":"ZACK","last_name":"DARWIN","classification":"U","division":"PRODUCTION","hit_factor":2.0293},{"match_name":"Range 307 USPSA 5/7/2017","match_date":"2017-05-07","stage_classifiercode":"09-08","member_number":"A100877","first_name":"RORY","last_name":"MCBRIDE","classification":"\"\"","division":"PRODUCTION","hit_factor":2.0247},{"match_name":"EDPS USPSA October 2 2021","match_date":"2021-10-01","stage_classifiercode":"09-08","member_number":"A113366","first_name":"SHARON","last_name":"DENTON","classification":"D","division":"PRODUCTION","hit_factor":2.0231},{"match_name":"CRC_20160514_SuperClassifier","match_date":"2016-05-14","stage_classifiercode":"09-08","member_number":"\"\"","first_name":"ANDRES","last_name":"PENA","classification":"U","division":"PRODUCTION","hit_factor":2.011},{"match_name":"Chillicothe April-2018 USPSA Classifier Match","match_date":"2018-04-28","stage_classifiercode":"09-08","member_number":"A109460","first_name":"DONALD","last_name":"DILLON","classification":"U","division":"PRODUCTION","hit_factor":2.0038},{"match_name":"Harvard Action Shooters June 2018 USPSA Pistol Match","match_date":"2018-06-10","stage_classifiercode":"09-08","member_number":"A84331","first_name":"SCOTT","last_name":"HARRIS","classification":"C","division":"PRODUCTION","hit_factor":1.9984},{"match_name":"Lefthanders Gun Club Practical Shooters March 5 and 6","match_date":"2016-03-05","stage_classifiercode":"09-08","member_number":"A-78694","first_name":"STEPHEN","last_name":"LUTMAN","classification":"M","division":"PRODUCTION","hit_factor":1.9876},{"match_name":"Pioneer Action Shooters USPSA 5-27-18","match_date":"2018-05-27","stage_classifiercode":"09-08","member_number":"A87902","first_name":"PATRICK","last_name":"VITALE","classification":"C","division":"PRODUCTION","hit_factor":1.9862},{"match_name":"Central IL Practical Shooters October Match","match_date":"2016-10-09","stage_classifiercode":"09-08","member_number":"L4091","first_name":"JOHN","last_name":"BERG","classification":"U","division":"PRODUCTION","hit_factor":1.9836},{"match_name":"Treasure State Championship Hosted By MCAS","match_date":"2020-06-20","stage_classifiercode":"09-08","member_number":"A117570","first_name":"DANIEL","last_name":"BOTZ","classification":"C","division":"PRODUCTION","hit_factor":1.9835},{"match_name":"TAC2 USPSA October 2017","match_date":"2017-10-07","stage_classifiercode":"09-08","member_number":"\"\"","first_name":"BEN","last_name":"MAY","classification":"U","division":"PRODUCTION","hit_factor":1.966},{"match_name":"PIPS 08-05-2020","match_date":"2020-08-05","stage_classifiercode":"09-08","member_number":"A102576","first_name":"MEL","last_name":"BEHNKE","classification":"C","division":"PRODUCTION","hit_factor":1.9591},{"match_name":"SLOSA January 2018 USPSA CLASSIFIER MATCH","match_date":"2018-01-28","stage_classifiercode":"09-08","member_number":"A107126","first_name":"MARK","last_name":"BERRY","classification":"U","division":"PRODUCTION","hit_factor":1.9586},{"match_name":"QPS Quantico Shooting Club August 2021 USPSA   ","match_date":"2021-08-07","stage_classifiercode":"09-08","member_number":"A113858","first_name":"JILLIAN","last_name":"MCALLISTER","classification":"D","division":"PRODUCTION","hit_factor":1.9581},{"match_name":"RBGC USPSA 2021-8-15 Special Classifier Match","match_date":"2021-08-15","stage_classifiercode":"09-08","member_number":"A114462","first_name":"CHRIS","last_name":"PARKER","classification":"B","division":"PRODUCTION","hit_factor":1.9581},{"match_name":"PMSC  USPSA JULY 2017","match_date":"2017-07-01","stage_classifiercode":"09-08","member_number":"ty4704","first_name":"MARK","last_name":"CLEAVER","classification":"U","division":"PRODUCTION","hit_factor":1.9493},{"match_name":"BSPSC 2017 April Special Classifier","match_date":"2017-04-09","stage_classifiercode":"09-08","member_number":"A85904","first_name":"DAVID","last_name":"JESSEN","classification":"U","division":"PRODUCTION","hit_factor":1.9476},{"match_name":"Central IL Practical Shooters October Match","match_date":"2016-10-09","stage_classifiercode":"09-08","member_number":"A87408","first_name":"AUGUST","last_name":"LEE","classification":"C","division":"PRODUCTION","hit_factor":1.9403},{"match_name":"Chillicothe April-2018 USPSA Classifier Match","match_date":"2018-04-28","stage_classifiercode":"09-08","member_number":"A91188","first_name":"MIKE","last_name":"WOLFE","classification":"C","division":"PRODUCTION","hit_factor":1.9361},{"match_name":"Richmond Boro Gun Club July 2018 Monthly USPSA match","match_date":"2018-07-21","stage_classifiercode":"09-08","member_number":"\"\"","first_name":"SS","last_name":"SCARY","classification":"U","division":"PRODUCTION","hit_factor":1.933},{"match_name":"Treasure State Championship Hosted By MCAS","match_date":"2020-06-20","stage_classifiercode":"09-08","member_number":"TY107328","first_name":"IAN","last_name":"LICENCE","classification":"B","division":"PRODUCTION","hit_factor":1.9324},{"match_name":"MAPSA 2016.05.14","match_date":"2016-05-14","stage_classifiercode":"09-08","member_number":"TY71905","first_name":"KYLE","last_name":"TAM","classification":"B","division":"PRODUCTION","hit_factor":1.9313},{"match_name":"4ta Copa USPSA","match_date":"2016-11-20","stage_classifiercode":"09-08","member_number":"\"\"","first_name":"KARLO","last_name":"ROSA VAZQUEZ","classification":"U","division":"PRODUCTION","hit_factor":1.9298},{"match_name":"ET06 USPSA 11-04-2017","match_date":"2017-11-04","stage_classifiercode":"09-08","member_number":"a105855","first_name":"BARRY","last_name":"BOOKER","classification":"U","division":"PRODUCTION","hit_factor":1.9169},{"match_name":"NCPS USPSA Handgun Match October 23 2016","match_date":"2016-10-23","stage_classifiercode":"09-08","member_number":"A91928","first_name":"JONATHAN","last_name":"KELLEY","classification":"C","division":"PRODUCTION","hit_factor":1.9089},{"match_name":"Collin County USPSA Nov 6 2016","match_date":"2016-11-06","stage_classifiercode":"09-08","member_number":"A-99289","first_name":"KAT","last_name":"SILVIA","classification":"U","division":"PRODUCTION","hit_factor":1.8992},{"match_name":"ENPS May 2018 USPSA Match","match_date":"2018-05-06","stage_classifiercode":"09-08","member_number":"TY100802","first_name":"BYRON","last_name":"THOMPSON","classification":"U","division":"PRODUCTION","hit_factor":1.888},{"match_name":"SLOSA January 2018 USPSA CLASSIFIER MATCH","match_date":"2018-01-28","stage_classifiercode":"09-08","member_number":"L4191","first_name":"TERRELL","last_name":"COHEN","classification":"D","division":"PRODUCTION","hit_factor":1.8824},{"match_name":"Whitewater USPSA 3-17-2018","match_date":"2018-03-17","stage_classifiercode":"09-08","member_number":"\"\"","first_name":"J","last_name":"COBURN","classification":"U","division":"PRODUCTION","hit_factor":1.8782},{"match_name":"OKCGC USPSA April 2018","match_date":"2018-04-07","stage_classifiercode":"09-08","member_number":"A91228","first_name":"DANNY","last_name":"KEEF","classification":"C","division":"PRODUCTION","hit_factor":1.8739},{"match_name":"Collin County USPSA Nov 6 2016","match_date":"2016-11-06","stage_classifiercode":"09-08","member_number":"A99279","first_name":"ARTHUR","last_name":"TURNER","classification":"U","division":"PRODUCTION","hit_factor":1.8655},{"match_name":"Harvard Action Shooters June 2018 USPSA Pistol Match","match_date":"2018-06-10","stage_classifiercode":"09-08","member_number":"A105691","first_name":"JOSEPH","last_name":"CATALANO","classification":"U","division":"PRODUCTION","hit_factor":1.8619},{"match_name":"NCPS USPSA Handgun Match October 23 2016","match_date":"2016-10-23","stage_classifiercode":"09-08","member_number":"A86599","first_name":"SEAN","last_name":"AGUAS","classification":"C","division":"PRODUCTION","hit_factor":1.8587},{"match_name":"SPSA USPSA August 1st Sat Match","match_date":"2018-08-04","stage_classifiercode":"09-08","member_number":"\"\"","first_name":"ALEX","last_name":"POOVEY","classification":"U","division":"PRODUCTION","hit_factor":1.8581},{"match_name":"BSPSC 2017 April Special Classifier","match_date":"2017-04-09","stage_classifiercode":"09-08","member_number":"PENDING","first_name":"JOHN","last_name":"BULLEN","classification":"U","division":"PRODUCTION","hit_factor":1.8526},{"match_name":"Tropang Vegas All Classifier Match","match_date":"2020-07-12","stage_classifiercode":"09-08","member_number":"A128377","first_name":"RICHARD","last_name":"ABELLA","classification":"U","division":"PRODUCTION","hit_factor":1.8417},{"match_name":"WGC WI USPSA Monthly Match 4-16-16","match_date":"2016-04-16","stage_classifiercode":"09-08","member_number":"59473","first_name":"BECKY","last_name":"CHRISTENSEN","classification":"D","division":"PRODUCTION","hit_factor":1.8414},{"match_name":"ENPS May 2018 USPSA Match","match_date":"2018-05-06","stage_classifiercode":"09-08","member_number":"A106952","first_name":"STEVE","last_name":"GROF","classification":"U","division":"PRODUCTION","hit_factor":1.8203},{"match_name":"ENPS May 2018 USPSA Match","match_date":"2018-05-06","stage_classifiercode":"09-08","member_number":"TY76927","first_name":"DONALD","last_name":"RUSH","classification":"C","division":"PRODUCTION","hit_factor":1.8182},{"match_name":"CRC_20160514_SuperClassifier","match_date":"2016-05-14","stage_classifiercode":"09-08","member_number":"TY81342","first_name":"JIM","last_name":"WAUGH","classification":"C","division":"PRODUCTION","hit_factor":1.8106},{"match_name":"WSPS OCTOBER 2016 SPECIAL CLASSIFIER MATCH","match_date":"2016-10-29","stage_classifiercode":"09-08","member_number":"A95768","first_name":"TOM","last_name":"COOK","classification":"U","division":"PRODUCTION","hit_factor":1.8051},{"match_name":"Ghost Town Shooters Special Classifier","match_date":"2018-06-30","stage_classifiercode":"09-08","member_number":"\"\"","first_name":"DAVID","last_name":"WIDMER","classification":"U","division":"PRODUCTION","hit_factor":1.8027},{"match_name":"RPS November 2017 USPSA Match","match_date":"2017-11-11","stage_classifiercode":"09-08","member_number":"A40253","first_name":"BERNIE","last_name":"SISSON","classification":"U","division":"PRODUCTION","hit_factor":1.7951},{"match_name":"2017 Arkansas Section Championship","match_date":"2017-06-14","stage_classifiercode":"09-08","member_number":"A69302","first_name":"HEIDI","last_name":"HENDRIX","classification":"C","division":"PRODUCTION","hit_factor":1.7945},{"match_name":"DWB - Deadwood Boys USPSA 19 July 2020","match_date":"2020-07-19","stage_classifiercode":"09-08","member_number":"A127433","first_name":"LE","last_name":"YIN","classification":"U","division":"PRODUCTION","hit_factor":1.7924},{"match_name":"BSPSC 2017 April Special Classifier","match_date":"2017-04-09","stage_classifiercode":"09-08","member_number":"A102396","first_name":"NATHAN","last_name":"TAG","classification":"U","division":"PRODUCTION","hit_factor":1.7739},{"match_name":"Lefthanders Gun Club Practical Shooters March 5 and 6","match_date":"2016-03-05","stage_classifiercode":"09-08","member_number":"A32053","first_name":"MICK","last_name":"SOOS","classification":"U","division":"PRODUCTION","hit_factor":1.7603},{"match_name":"CRC_20160514_SuperClassifier","match_date":"2016-05-14","stage_classifiercode":"09-08","member_number":"A95263","first_name":"SIDA","last_name":"SHEN","classification":"C","division":"PRODUCTION","hit_factor":1.7498},{"match_name":"APSC USPSA Classifier Match 07-01-17","match_date":"2017-07-01","stage_classifiercode":"09-08","member_number":"A87128","first_name":"ROB","last_name":"STINE","classification":"C","division":"PRODUCTION","hit_factor":1.7459},{"match_name":"Lefthanders Gun Club Practical Shooters March 5 and 6","match_date":"2016-03-05","stage_classifiercode":"09-08","member_number":"PEN","first_name":"MICHAEL","last_name":"WATSON","classification":"U","division":"PRODUCTION","hit_factor":1.7419},{"match_name":"PMSC  USPSA JULY 2017","match_date":"2017-07-01","stage_classifiercode":"09-08","member_number":"a94315","first_name":"AMANDA","last_name":"WARZEL","classification":"C","division":"PRODUCTION","hit_factor":1.7405},{"match_name":"2016 Tennessee Atomic Blast","match_date":"2016-09-16","stage_classifiercode":"09-08","member_number":"A78175","first_name":"ERIC","last_name":"WILSON","classification":"B","division":"PRODUCTION","hit_factor":1.7159},{"match_name":"NCPS USPSA Handgun Match October 23 2016","match_date":"2016-10-23","stage_classifiercode":"09-08","member_number":"TY68979","first_name":"GRIFFIN","last_name":"GUMAGAY","classification":"U","division":"PRODUCTION","hit_factor":1.709},{"match_name":"MAPSA 2016.05.14","match_date":"2016-05-14","stage_classifiercode":"09-08","member_number":"TY83255","first_name":"KATE","last_name":"ARNZEN","classification":"B","division":"PRODUCTION","hit_factor":1.7029},{"match_name":"RCPS USPSA 8 Apr 2017","match_date":"2017-04-08","stage_classifiercode":"09-08","member_number":"TY91979","first_name":"MICHAEL","last_name":"HOTTINGER","classification":"C","division":"PRODUCTION","hit_factor":1.7015},{"match_name":"MAPSA 2016.05.14","match_date":"2016-05-14","stage_classifiercode":"09-08","member_number":"A91699","first_name":"SHANE","last_name":"WURST","classification":"U","division":"PRODUCTION","hit_factor":1.6999},{"match_name":"NCPS USPSA Handgun Match October 23 2016","match_date":"2016-10-23","stage_classifiercode":"09-08","member_number":"A98043","first_name":"JERRY","last_name":"KWONG","classification":"D","division":"PRODUCTION","hit_factor":1.6962},{"match_name":"AREA 59  SPRING ALL CLASSIFIER","match_date":"2018-03-31","stage_classifiercode":"09-08","member_number":"A109249","first_name":"YI","last_name":"SHU","classification":"U","division":"PRODUCTION","hit_factor":1.6962},{"match_name":"Rio Grande Practical Shooters - August 2016","match_date":"2016-08-06","stage_classifiercode":"09-08","member_number":"PEN","first_name":"BRAD","last_name":"STREIFF","classification":"U","division":"PRODUCTION","hit_factor":1.6936},{"match_name":"Chillicothe April-2017 USPSA Match","match_date":"2017-04-23","stage_classifiercode":"09-08","member_number":"A74958","first_name":"NICHOLAS","last_name":"PRATT","classification":"C","division":"PRODUCTION","hit_factor":1.6791},{"match_name":"LCSC Linden USPSA 031118","match_date":"2018-03-11","stage_classifiercode":"09-08","member_number":"000000","first_name":"JOHN","last_name":"ORUM","classification":"U","division":"PRODUCTION","hit_factor":1.6781},{"match_name":"OKCGC USPSA April 2018","match_date":"2018-04-07","stage_classifiercode":"09-08","member_number":"A105520","first_name":"KEVIN","last_name":"SUCHER","classification":"U","division":"PRODUCTION","hit_factor":1.6779},{"match_name":"QPS Quantico Shooting Club January USPSA   ","match_date":"2021-01-09","stage_classifiercode":"09-08","member_number":"TY99956","first_name":"RAY","last_name":"HULSMAN","classification":"C","division":"PRODUCTION","hit_factor":1.6734},{"match_name":"Crooked Creek Pistol League - July 2020","match_date":"2020-07-18","stage_classifiercode":"09-08","member_number":"A77829","first_name":"JOHN","last_name":"ELLIS","classification":"C","division":"PRODUCTION","hit_factor":1.6651},{"match_name":"Pioneer Action Shooters USPSA 5-27-18","match_date":"2018-05-27","stage_classifiercode":"09-08","member_number":"A101366","first_name":"HENRY","last_name":"POIRIER","classification":"C","division":"PRODUCTION","hit_factor":1.6625},{"match_name":"Maine Practical Shooters May 2021","match_date":"2021-05-08","stage_classifiercode":"09-08","member_number":"A101724","first_name":"JIM","last_name":"STOUT","classification":"C","division":"PRODUCTION","hit_factor":1.6575},{"match_name":"BSPSC 2017 April Special Classifier","match_date":"2017-04-09","stage_classifiercode":"09-08","member_number":"NONE","first_name":"JAMES","last_name":"STEVENS","classification":"U","division":"PRODUCTION","hit_factor":1.6516},{"match_name":"2017 Arkansas Section Championship","match_date":"2017-06-14","stage_classifiercode":"09-08","member_number":"TY84917","first_name":"LESTER","last_name":"STONE","classification":"C","division":"PRODUCTION","hit_factor":1.6434},{"match_name":"SFPS 5-3-20 USPSA","match_date":"2020-05-03","stage_classifiercode":"09-08","member_number":"A113893","first_name":"JEREMY","last_name":"WILLIAMS","classification":"B","division":"PRODUCTION","hit_factor":1.6355},{"match_name":"Treasure State Championship Hosted By MCAS","match_date":"2020-06-20","stage_classifiercode":"09-08","member_number":"A111012","first_name":"BARRY","last_name":"SCHRECKENGOST","classification":"C","division":"PRODUCTION","hit_factor":1.6349},{"match_name":"APSC USPSA Classifier Match 07-01-17","match_date":"2017-07-01","stage_classifiercode":"09-08","member_number":"TY91712","first_name":"GEORGE","last_name":"CONWILL","classification":"C","division":"PRODUCTION","hit_factor":1.6345},{"match_name":"Shoot GTR USPA November 2018","match_date":"2018-11-04","stage_classifiercode":"09-08","member_number":"\"\"","first_name":"DEBBIE","last_name":"HERRING","classification":"U","division":"PRODUCTION","hit_factor":1.6247},{"match_name":"EASTER EGG HUNT AREA 59  ALL CLASSFIER MATCH","match_date":"2017-04-15","stage_classifiercode":"09-08","member_number":"\"\"","first_name":"JOHN","last_name":"ROBERTS","classification":"U","division":"PRODUCTION","hit_factor":1.624},{"match_name":"OKCGC USPSA April 2018","match_date":"2018-04-07","stage_classifiercode":"09-08","member_number":"PEN","first_name":"FOSTER","last_name":"ALLEY","classification":"U","division":"PRODUCTION","hit_factor":1.6137},{"match_name":"CRC_20160514_SuperClassifier","match_date":"2016-05-14","stage_classifiercode":"09-08","member_number":"A93917","first_name":"JAMES","last_name":"BEEBE","classification":"D","division":"PRODUCTION","hit_factor":1.6054},{"match_name":"PIPS 08-08-2018","match_date":"2018-08-07","stage_classifiercode":"09-08","member_number":"TY81464","first_name":"BRAD","last_name":"BRECH","classification":"D","division":"PRODUCTION","hit_factor":1.6039},{"match_name":"MCPSL Pistol 7-11-20","match_date":"2020-07-11","stage_classifiercode":"09-08","member_number":"A107271","first_name":"JEFF","last_name":"PICKMAN","classification":"B","division":"PRODUCTION","hit_factor":1.5891},{"match_name":"Chillicothe April-2018 USPSA Classifier Match","match_date":"2018-04-28","stage_classifiercode":"09-08","member_number":"A30774","first_name":"RICHARD","last_name":"VARNOLD","classification":"C","division":"PRODUCTION","hit_factor":1.5852},{"match_name":"WPS USPSA Monthly Match November 2018","match_date":"2018-11-10","stage_classifiercode":"09-08","member_number":"A114648","first_name":"MICHAEL","last_name":"CERONE","classification":"U","division":"PRODUCTION","hit_factor":1.5824},{"match_name":"RPS November 2017 USPSA Match","match_date":"2017-11-11","stage_classifiercode":"09-08","member_number":"A85112","first_name":"VICTORIA","last_name":"CHU","classification":"C","division":"PRODUCTION","hit_factor":1.5734},{"match_name":"WSPS OCTOBER 2016 SPECIAL CLASSIFIER MATCH","match_date":"2016-10-29","stage_classifiercode":"09-08","member_number":"TY85668","first_name":"SCOTT","last_name":"APPOLDT","classification":"C","division":"PRODUCTION","hit_factor":1.5564},{"match_name":"2016 Tennessee Atomic Blast","match_date":"2016-09-16","stage_classifiercode":"09-08","member_number":"A63664","first_name":"STEVE","last_name":"WILLIAMS","classification":"B","division":"PRODUCTION","hit_factor":1.554},{"match_name":"TPS USPSA at CMP Jan 20 2018","match_date":"2018-01-20","stage_classifiercode":"09-08","member_number":"L3945","first_name":"ERIC","last_name":"HAGAN","classification":"U","division":"PRODUCTION","hit_factor":1.543},{"match_name":"QPS Quantico Shooting Club August 2021 USPSA   ","match_date":"2021-08-07","stage_classifiercode":"09-08","member_number":"A136045","first_name":"THOMAS","last_name":"DEAN","classification":"U","division":"PRODUCTION","hit_factor":1.5394},{"match_name":"Collin County USPSA Nov 6 2016","match_date":"2016-11-06","stage_classifiercode":"09-08","member_number":"TY-98979","first_name":"LARRY","last_name":"HARRIS","classification":"U","division":"PRODUCTION","hit_factor":1.5373},{"match_name":"Chillicothe April-2017 USPSA Match","match_date":"2017-04-23","stage_classifiercode":"09-08","member_number":"\"\"","first_name":"THORPE","last_name":"FACER II","classification":"U","division":"PRODUCTION","hit_factor":1.5345},{"match_name":"ENPS May 2018 USPSA Match","match_date":"2018-05-06","stage_classifiercode":"09-08","member_number":"A78658","first_name":"SEAN","last_name":"NAYLOR","classification":"A","division":"PRODUCTION","hit_factor":1.519},{"match_name":"RPS October 2018 USPSA Match","match_date":"2018-10-13","stage_classifiercode":"09-08","member_number":"A106222","first_name":"DANIEL","last_name":"LEITH","classification":"M","division":"PRODUCTION","hit_factor":1.5152},{"match_name":"CGC 100816","match_date":"2016-10-08","stage_classifiercode":"09-08","member_number":"TY90546","first_name":"DAVID","last_name":"HOUGHTON","classification":"U","division":"PRODUCTION","hit_factor":1.511},{"match_name":"2016 Tennessee Atomic Blast","match_date":"2016-09-16","stage_classifiercode":"09-08","member_number":"A72343","first_name":"PAUL","last_name":"AVERY","classification":"B","division":"PRODUCTION","hit_factor":1.5027},{"match_name":"Treasure State Championship Hosted By MCAS","match_date":"2020-06-20","stage_classifiercode":"09-08","member_number":"TY84992","first_name":"SHANE","last_name":"BETTENHAUSEN","classification":"B","division":"PRODUCTION","hit_factor":1.4995},{"match_name":"PMSC  USPSA JULY 2017","match_date":"2017-07-01","stage_classifiercode":"09-08","member_number":"ty74142","first_name":"GARY","last_name":"DEAN","classification":"C","division":"PRODUCTION","hit_factor":1.4925},{"match_name":"AREA 59  SPRING ALL CLASSIFIER","match_date":"2018-03-31","stage_classifiercode":"09-08","member_number":"A104927","first_name":"JUN","last_name":"WU","classification":"U","division":"PRODUCTION","hit_factor":1.4913},{"match_name":"MVPSA USPSA February 20th 2021","match_date":"2021-02-20","stage_classifiercode":"09-08","member_number":"FY111341","first_name":"DENE","last_name":"MILLER","classification":"D","division":"PRODUCTION","hit_factor":1.4887},{"match_name":"WTPS USPSA November Match 11-11-17","match_date":"2017-11-11","stage_classifiercode":"09-08","member_number":"\"\"","first_name":"ERIC","last_name":"BOWEN","classification":"U","division":"PRODUCTION","hit_factor":1.4829},{"match_name":"EASTER EGG HUNT AREA 59  ALL CLASSFIER MATCH","match_date":"2017-04-15","stage_classifiercode":"09-08","member_number":"\"\"","first_name":"COLE","last_name":"MUNGER","classification":"U","division":"PRODUCTION","hit_factor":1.4826},{"match_name":"WSPS OCTOBER 2016 SPECIAL CLASSIFIER MATCH","match_date":"2016-10-29","stage_classifiercode":"09-08","member_number":"\"\"","first_name":"KERRY","last_name":"ABEL","classification":"U","division":"PRODUCTION","hit_factor":1.4782},{"match_name":"ENPS May 2018 USPSA Match","match_date":"2018-05-06","stage_classifiercode":"09-08","member_number":"TY95959","first_name":"ROD","last_name":"STUART","classification":"C","division":"PRODUCTION","hit_factor":1.4737},{"match_name":"EASTER EGG HUNT AREA 59  ALL CLASSFIER MATCH","match_date":"2017-04-15","stage_classifiercode":"09-08","member_number":"A98586","first_name":"\"JAMES \"\"JIM\"\"\"","last_name":"SCHULTZ","classification":"U","division":"PRODUCTION","hit_factor":1.4728},{"match_name":"Collin County USPSA Nov 6 2016","match_date":"2016-11-06","stage_classifiercode":"09-08","member_number":"A94264","first_name":"THOMAS","last_name":"JOHNSON","classification":"D","division":"PRODUCTION","hit_factor":1.4716},{"match_name":"RBGC USPSA 2021-8-15 Special Classifier Match","match_date":"2021-08-15","stage_classifiercode":"09-08","member_number":"A136293","first_name":"XI","last_name":"WANG","classification":"U","division":"PRODUCTION","hit_factor":1.4706},{"match_name":"Griffin USPSA Match July 2017","match_date":"2017-07-15","stage_classifiercode":"09-08","member_number":"\"\"","first_name":"ROBERT","last_name":"SOWELL","classification":"U","division":"PRODUCTION","hit_factor":1.4674},{"match_name":"Range 307 USPSA 5/7/2017","match_date":"2017-05-07","stage_classifiercode":"09-08","member_number":"\"\"","first_name":"SHAWN","last_name":"METZ","classification":"\"\"","division":"PRODUCTION","hit_factor":1.4623},{"match_name":"Southkent USPSA MAY match","match_date":"2017-05-20","stage_classifiercode":"09-08","member_number":"\"\"","first_name":"JONATHAN","last_name":"BRAATEN","classification":"U","division":"PRODUCTION","hit_factor":1.4563},{"match_name":"TAC2 USPSA October 2017","match_date":"2017-10-07","stage_classifiercode":"09-08","member_number":"\"\"","first_name":"MAX","last_name":"FAIRCHILD","classification":"U","division":"PRODUCTION","hit_factor":1.4545},{"match_name":"EASTER EGG HUNT AREA 59  ALL CLASSFIER MATCH","match_date":"2017-04-15","stage_classifiercode":"09-08","member_number":"A101402","first_name":"JAMES","last_name":"ROGERS","classification":"U","division":"PRODUCTION","hit_factor":1.4482},{"match_name":"QPS Quantico Shooting Club January USPSA   ","match_date":"2021-01-09","stage_classifiercode":"09-08","member_number":"TY120520","first_name":"ADAM","last_name":"GROSSMAN","classification":"D","division":"PRODUCTION","hit_factor":1.4474},{"match_name":"PIPS 08-08-2018","match_date":"2018-08-07","stage_classifiercode":"09-08","member_number":"PEN","first_name":"DUSTIN","last_name":"WOLLENBURG","classification":"U","division":"PRODUCTION","hit_factor":1.444},{"match_name":"4ta Copa USPSA","match_date":"2016-11-20","stage_classifiercode":"09-08","member_number":"A92865","first_name":"MIGUEL","last_name":"AROCHO RODRIGUEZ","classification":"D","division":"PRODUCTION","hit_factor":1.4354},{"match_name":"QPS Quantico Shooting Club January USPSA   ","match_date":"2021-01-09","stage_classifiercode":"09-08","member_number":"A131920","first_name":"PATRICK","last_name":"FOWLER","classification":"U","division":"PRODUCTION","hit_factor":1.4189},{"match_name":"WPS USPSA Monthly Match November 2018","match_date":"2018-11-10","stage_classifiercode":"09-08","member_number":"A90000","first_name":"PAUL","last_name":"PRIEM","classification":"D","division":"PRODUCTION","hit_factor":1.4181},{"match_name":"AREA 59  SPRING ALL CLASSIFIER","match_date":"2018-03-31","stage_classifiercode":"09-08","member_number":"TY96791","first_name":"SCOTT","last_name":"TAYLOR","classification":"B","division":"PRODUCTION","hit_factor":1.4161},{"match_name":"BHPC USPSA Match Classifier IOWA","match_date":"2018-06-16","stage_classifiercode":"09-08","member_number":"\"\"","first_name":"CHRIS","last_name":"BIENERT","classification":"UNKNOWN","division":"PRODUCTION","hit_factor":1.4116},{"match_name":"RCPS USPSA 8 Apr 2017","match_date":"2017-04-08","stage_classifiercode":"09-08","member_number":"A101676","first_name":"DANIEL","last_name":"KOLENICH","classification":"U","division":"PRODUCTION","hit_factor":1.4114},{"match_name":"EDPS USPSA October 2 2021","match_date":"2021-10-01","stage_classifiercode":"09-08","member_number":"A136776","first_name":"GLEN","last_name":"YORK","classification":"U","division":"PRODUCTION","hit_factor":1.4075},{"match_name":"AVAP62318","match_date":"2018-06-23","stage_classifiercode":"09-08","member_number":"A110057","first_name":"BEN","last_name":"CHANDLER","classification":"U","division":"PRODUCTION","hit_factor":1.3932},{"match_name":"APSC USPSA Classifier Match 07-01-17","match_date":"2017-07-01","stage_classifiercode":"09-08","member_number":"A103908","first_name":"PABLO","last_name":"PAGAN","classification":"U","division":"PRODUCTION","hit_factor":1.3875},{"match_name":"Chillicothe April-2018 USPSA Classifier Match","match_date":"2018-04-28","stage_classifiercode":"09-08","member_number":"A110160","first_name":"MIKE","last_name":"SPANIER","classification":"U","division":"PRODUCTION","hit_factor":1.3865},{"match_name":"Pioneer Action Shooters USPSA 5-27-18","match_date":"2018-05-27","stage_classifiercode":"09-08","member_number":"A106343","first_name":"WILLIAM","last_name":"BLANCHARD","classification":"U","division":"PRODUCTION","hit_factor":1.3855},{"match_name":"2016 Tennessee Atomic Blast","match_date":"2016-09-16","stage_classifiercode":"09-08","member_number":"TY81363","first_name":"JONATHAN","last_name":"PEREZ","classification":"C","division":"PRODUCTION","hit_factor":1.3751},{"match_name":"MCPSL Pistol 7-11-20","match_date":"2020-07-11","stage_classifiercode":"09-08","member_number":"A126099","first_name":"JESSE","last_name":"LOEWEN","classification":"D","division":"PRODUCTION","hit_factor":1.375},{"match_name":"2016 Tennessee Atomic Blast","match_date":"2016-09-16","stage_classifiercode":"09-08","member_number":"A71536","first_name":"DIANE","last_name":"BOLLIG","classification":"C","division":"PRODUCTION","hit_factor":1.3634},{"match_name":"SPSA USPSA August 1st Sat Match","match_date":"2018-08-04","stage_classifiercode":"09-08","member_number":"TY86053","first_name":"LORI","last_name":"VALONE","classification":"D","division":"PRODUCTION","hit_factor":1.3572},{"match_name":"PIPS 08-08-2018","match_date":"2018-08-07","stage_classifiercode":"09-08","member_number":"PEN","first_name":"THERESA","last_name":"ARNETT","classification":"U","division":"PRODUCTION","hit_factor":1.3539},{"match_name":"TAC2 USPSA October 2017","match_date":"2017-10-07","stage_classifiercode":"09-08","member_number":"\"\"","first_name":"DJ","last_name":"LOWERY","classification":"U","division":"PRODUCTION","hit_factor":1.3536},{"match_name":"EASTER EGG HUNT AREA 59  ALL CLASSFIER MATCH","match_date":"2017-04-15","stage_classifiercode":"09-08","member_number":"\"\"","first_name":"DANA","last_name":"ZEITLIN","classification":"U","division":"PRODUCTION","hit_factor":1.3463},{"match_name":"Hampden RPC July USPSA","match_date":"2017-07-16","stage_classifiercode":"09-08","member_number":"A101724","first_name":"JIM","last_name":"STOUT","classification":"Unclassified","division":"PRODUCTION","hit_factor":1.3443},{"match_name":"Treasure State Championship Hosted By MCAS","match_date":"2020-06-20","stage_classifiercode":"09-08","member_number":"A49754","first_name":"STEPHEN","last_name":"DILTS","classification":"","division":"PRODUCTION","hit_factor":1.3353},{"match_name":"2da Copa Nacional USPSA ","match_date":"2016-05-22","stage_classifiercode":"09-08","member_number":"A91054","first_name":"WILBERTO","last_name":"ALAMO","classification":"D","division":"PRODUCTION","hit_factor":1.3263},{"match_name":"Tropang Vegas All Classifier Match","match_date":"2020-07-12","stage_classifiercode":"09-08","member_number":"A99583","first_name":"ERIC","last_name":"SUNIGA","classification":"A","division":"PRODUCTION","hit_factor":1.3245},{"match_name":"NCPS USPSA Handgun Match October 23 2016","match_date":"2016-10-23","stage_classifiercode":"09-08","member_number":"TY87896","first_name":"JOSEPH","last_name":"MAGBITANG","classification":"U","division":"PRODUCTION","hit_factor":1.3235},{"match_name":"Prescott 3rd Sunday USPSA 4-18-21 ALL CLASSIFIER","match_date":"2021-04-18","stage_classifiercode":"09-08","member_number":"FY61488","first_name":"ROBERT C","last_name":"GERENA","classification":"B","division":"PRODUCTION","hit_factor":1.3201},{"match_name":"APSC USPSA Classifier Match 07-01-17","match_date":"2017-07-01","stage_classifiercode":"09-08","member_number":"A79268","first_name":"JACK","last_name":"REYNOLDS","classification":"D","division":"PRODUCTION","hit_factor":1.3197},{"match_name":"CRC_20160514_SuperClassifier","match_date":"2016-05-14","stage_classifiercode":"09-08","member_number":"PEN","first_name":"MAUGED","last_name":"MISSIHA","classification":"U","division":"PRODUCTION","hit_factor":1.318},{"match_name":"WSPS OCTOBER 2016 SPECIAL CLASSIFIER MATCH","match_date":"2016-10-29","stage_classifiercode":"09-08","member_number":"A94749","first_name":"JOHN","last_name":"BURCH","classification":"C","division":"PRODUCTION","hit_factor":1.3096},{"match_name":"2016 Tennessee Atomic Blast","match_date":"2016-09-16","stage_classifiercode":"09-08","member_number":"A90492","first_name":"TRAVIS","last_name":"BOYD","classification":"C","division":"PRODUCTION","hit_factor":1.306},{"match_name":"ENPS May 2018 USPSA Match","match_date":"2018-05-06","stage_classifiercode":"09-08","member_number":"A90496","first_name":"JEREMY","last_name":"SINCEBAUGH","classification":"C","division":"PRODUCTION","hit_factor":1.2998},{"match_name":"CCSC USPSA All Classifier Match","match_date":"2021-06-12","stage_classifiercode":"09-08","member_number":"TY124836","first_name":"ROBB","last_name":"MOORE","classification":"C","division":"PRODUCTION","hit_factor":1.2966},{"match_name":"Salt City practical shooting league 'all classifier match'","match_date":"2020-08-30","stage_classifiercode":"09-08","member_number":"TY128269","first_name":"MATTHEW","last_name":"ADAMS","classification":"U","division":"PRODUCTION","hit_factor":1.2922},{"match_name":"ENPS May 2018 USPSA Match","match_date":"2018-05-06","stage_classifiercode":"09-08","member_number":"A88627","first_name":"JAY","last_name":"ANDERSON","classification":"C","division":"PRODUCTION","hit_factor":1.2862},{"match_name":"4ta Copa USPSA","match_date":"2016-11-20","stage_classifiercode":"09-08","member_number":"TY91989","first_name":"ALFREDO","last_name":"MELENDEZ","classification":"D","division":"PRODUCTION","hit_factor":1.2862},{"match_name":"PIPS 08-05-2020","match_date":"2020-08-05","stage_classifiercode":"09-08","member_number":"TY77132","first_name":"MARK","last_name":"ROEBKE","classification":"B","division":"PRODUCTION","hit_factor":1.2833},{"match_name":"EASTER EGG HUNT AREA 59  ALL CLASSFIER MATCH","match_date":"2017-04-15","stage_classifiercode":"09-08","member_number":"A98263","first_name":"JING","last_name":"BEDRO","classification":"U","division":"PRODUCTION","hit_factor":1.2748},{"match_name":"ET06 USPSA 11-04-2017","match_date":"2017-11-04","stage_classifiercode":"09-08","member_number":"ty97501","first_name":"HEATHER","last_name":"TOLBERT","classification":"D","division":"PRODUCTION","hit_factor":1.2506},{"match_name":"LCSC Linden USPSA 031118","match_date":"2018-03-11","stage_classifiercode":"09-08","member_number":"A104196","first_name":"BRENDA","last_name":"SANDOVAL","classification":"D","division":"PRODUCTION","hit_factor":1.2249},{"match_name":"ENPS May 2018 USPSA Match","match_date":"2018-05-06","stage_classifiercode":"09-08","member_number":"\"\"","first_name":"RYAN","last_name":"DENTON","classification":"U","division":"PRODUCTION","hit_factor":1.2149},{"match_name":"AREA 59  SPRING ALL CLASSIFIER","match_date":"2018-03-31","stage_classifiercode":"09-08","member_number":"a100546","first_name":"WENCY","last_name":"FLORES","classification":"U","division":"PRODUCTION","hit_factor":1.2079},{"match_name":"ORSA USPSA January 2021","match_date":"2021-01-16","stage_classifiercode":"09-08","member_number":"A129770","first_name":"TOMMY","last_name":"CAPPS","classification":"U","division":"PRODUCTION","hit_factor":1.2032},{"match_name":"QPS Quantico Shooting Club January USPSA   ","match_date":"2021-01-09","stage_classifiercode":"09-08","member_number":"A114066","first_name":"SAMUEL","last_name":"LORINO","classification":"M","division":"PRODUCTION","hit_factor":1.1968},{"match_name":"OKCGC 2017 January Classifier Spectacular","match_date":"2017-01-29","stage_classifiercode":"09-08","member_number":"A88692","first_name":"MATTHEW","last_name":"OLLER","classification":"U","division":"PRODUCTION","hit_factor":1.1905},{"match_name":"Sage Pistol League USPSA April 18 2021","match_date":"2021-04-18","stage_classifiercode":"09-08","member_number":"A132860","first_name":"BUTCH","last_name":"ZISSOS","classification":"U","division":"PRODUCTION","hit_factor":1.1757},{"match_name":"Chillicothe April-2018 USPSA Classifier Match","match_date":"2018-04-28","stage_classifiercode":"09-08","member_number":"A110850","first_name":"KYLE","last_name":"KRAUSE","classification":"U","division":"PRODUCTION","hit_factor":1.1636},{"match_name":"CRC_20160514_SuperClassifier","match_date":"2016-05-14","stage_classifiercode":"09-08","member_number":"A70296","first_name":"DANE","last_name":"HARRIS","classification":"C","division":"PRODUCTION","hit_factor":1.1466},{"match_name":"AVAP62318","match_date":"2018-06-23","stage_classifiercode":"09-08","member_number":"A111744","first_name":"STEVEN","last_name":"CABREROS","classification":"U","division":"PRODUCTION","hit_factor":1.1364},{"match_name":"Central IL Practical Shooters October Match","match_date":"2016-10-09","stage_classifiercode":"09-08","member_number":"A96574","first_name":"JIM","last_name":"SMALL","classification":"D","division":"PRODUCTION","hit_factor":1.1315},{"match_name":"CIPSC IL02 Havana June USPSA","match_date":"2020-06-13","stage_classifiercode":"09-08","member_number":"A128007","first_name":"JOEL","last_name":"POORBAUGH","classification":"U","division":"PRODUCTION","hit_factor":1.122},{"match_name":"2017 Arkansas Section Championship","match_date":"2017-06-14","stage_classifiercode":"09-08","member_number":"A95497","first_name":"BRET","last_name":"VORHEES","classification":"U","division":"PRODUCTION","hit_factor":1.1173},{"match_name":"LCSC Linden USPSA 031118","match_date":"2018-03-11","stage_classifiercode":"09-08","member_number":"103841","first_name":"JAMES","last_name":"BYRNE","classification":"U","division":"PRODUCTION","hit_factor":1.1167},{"match_name":"Chillicothe April-2017 USPSA Match","match_date":"2017-04-23","stage_classifiercode":"09-08","member_number":"A91188","first_name":"MIKE","last_name":"WOLFE","classification":"C","division":"PRODUCTION","hit_factor":1.1111},{"match_name":"ENPS May 2018 USPSA Match","match_date":"2018-05-06","stage_classifiercode":"09-08","member_number":"TY94027","first_name":"MITCH","last_name":"TRUKA","classification":"C","division":"PRODUCTION","hit_factor":1.1066},{"match_name":"AREA 59  SPRING ALL CLASSIFIER","match_date":"2018-03-31","stage_classifiercode":"09-08","member_number":"A107586","first_name":"ALBERT","last_name":"MOLINA","classification":"U","division":"PRODUCTION","hit_factor":1.1017},{"match_name":"WSPS OCTOBER 2016 SPECIAL CLASSIFIER MATCH","match_date":"2016-10-29","stage_classifiercode":"09-08","member_number":"A99341","first_name":"MICHAEL","last_name":"DALSKE","classification":"U","division":"PRODUCTION","hit_factor":1.1015},{"match_name":"Treasure State Championship Hosted By MCAS","match_date":"2020-06-20","stage_classifiercode":"09-08","member_number":"A87985","first_name":"TAYLOR","last_name":"BLAESIUS","classification":"C","division":"PRODUCTION","hit_factor":1.0997},{"match_name":"Pioneer Action Shooters USPSA 5-27-18","match_date":"2018-05-27","stage_classifiercode":"09-08","member_number":"\"\"","first_name":"JAMES","last_name":"CHAKUROFF","classification":"U","division":"PRODUCTION","hit_factor":1.0989},{"match_name":"Central IL Practical Shooters October Match","match_date":"2016-10-09","stage_classifiercode":"09-08","member_number":"TY98887","first_name":"DAVID","last_name":"MANDROS","classification":"U","division":"PRODUCTION","hit_factor":1.0895},{"match_name":"LCSC Linden USPSA 031118","match_date":"2018-03-11","stage_classifiercode":"09-08","member_number":"TY106439","first_name":"DWAYNE","last_name":"WATASE","classification":"D","division":"PRODUCTION","hit_factor":1.086},{"match_name":"EASTER EGG HUNT AREA 59  ALL CLASSFIER MATCH","match_date":"2017-04-15","stage_classifiercode":"09-08","member_number":"A100879","first_name":"RAYMOND","last_name":"CLINE","classification":"U","division":"PRODUCTION","hit_factor":1.0852},{"match_name":"Collin County USPSA Nov 6 2016","match_date":"2016-11-06","stage_classifiercode":"09-08","member_number":"A-12630","first_name":"TROY","last_name":"SCOGGINS","classification":"U","division":"PRODUCTION","hit_factor":1.0825},{"match_name":"Lefthanders Gun Club Practical Shooters March 5 and 6","match_date":"2016-03-05","stage_classifiercode":"09-08","member_number":"A63433","first_name":"ROB","last_name":"LEWIS","classification":"C","division":"PRODUCTION","hit_factor":1.0778},{"match_name":"Rio Grande Practical Shooters - August 2016","match_date":"2016-08-06","stage_classifiercode":"09-08","member_number":"A96889","first_name":"GREG","last_name":"MILLER","classification":"U","division":"PRODUCTION","hit_factor":1.0471},{"match_name":"CIPSC IL02 Havana June USPSA","match_date":"2020-06-13","stage_classifiercode":"09-08","member_number":"TY103198","first_name":"TAYLOR","last_name":"DANIELS","classification":"C","division":"PRODUCTION","hit_factor":1.0453},{"match_name":"APSC USPSA Classifier Match 07-01-17","match_date":"2017-07-01","stage_classifiercode":"09-08","member_number":"\"\"","first_name":"DAVID","last_name":"LAWSON","classification":"U","division":"PRODUCTION","hit_factor":1.0152},{"match_name":"EASTER EGG HUNT AREA 59  ALL CLASSFIER MATCH","match_date":"2017-04-15","stage_classifiercode":"09-08","member_number":"A99651","first_name":"RIDONG","last_name":"WEN","classification":"D","division":"PRODUCTION","hit_factor":1.0057},{"match_name":"GAS Special Classifier","match_date":"2016-07-02","stage_classifiercode":"09-08","member_number":"L3479","first_name":"MARY ANNE","last_name":"REID","classification":"D","division":"PRODUCTION","hit_factor":1.0017},{"match_name":"LCSC Linden USPSA 031118","match_date":"2018-03-11","stage_classifiercode":"09-08","member_number":"A106073","first_name":"DAPHNE","last_name":"GRAY","classification":"U","division":"PRODUCTION","hit_factor":1.0017},{"match_name":"ENPS May 2018 USPSA Match","match_date":"2018-05-06","stage_classifiercode":"09-08","member_number":"A99832","first_name":"NICK J","last_name":"GRUBEL","classification":"C","division":"PRODUCTION","hit_factor":0.997},{"match_name":"2017 Arkansas Section Championship","match_date":"2017-06-14","stage_classifiercode":"09-08","member_number":"TY40220","first_name":"ROCKY","last_name":"COLEY","classification":"B","division":"PRODUCTION","hit_factor":0.997},{"match_name":"CRC_20160514_SuperClassifier","match_date":"2016-05-14","stage_classifiercode":"09-08","member_number":"A95219","first_name":"LUKE","last_name":"POOLE","classification":"U","division":"PRODUCTION","hit_factor":0.9926},{"match_name":"2da Copa Nacional USPSA ","match_date":"2016-05-22","stage_classifiercode":"09-08","member_number":"\"\"","first_name":"ROBERTO","last_name":"RIVERA","classification":"U","division":"PRODUCTION","hit_factor":0.9896},{"match_name":"Hampden RPC July USPSA","match_date":"2017-07-16","stage_classifiercode":"09-08","member_number":"A101366","first_name":"HENRY","last_name":"POIRIER","classification":"D","division":"PRODUCTION","hit_factor":0.979},{"match_name":"Collin County USPSA Nov 6 2016","match_date":"2016-11-06","stage_classifiercode":"09-08","member_number":"A99569","first_name":"JUSTIN","last_name":"BOREN","classification":"X","division":"PRODUCTION","hit_factor":0.9732},{"match_name":"CRC_20160514_SuperClassifier","match_date":"2016-05-14","stage_classifiercode":"09-08","member_number":"A95538","first_name":"BRUCE","last_name":"WADDLE","classification":"D","division":"PRODUCTION","hit_factor":0.9703},{"match_name":"Chillicothe April-2018 USPSA Classifier Match","match_date":"2018-04-28","stage_classifiercode":"09-08","member_number":"\"\"","first_name":"ASHLYNN","last_name":"BRADLEY","classification":"\"\"","division":"PRODUCTION","hit_factor":0.9529},{"match_name":"ENPS May 2018 USPSA Match","match_date":"2018-05-06","stage_classifiercode":"09-08","member_number":"TY109159","first_name":"ABBI","last_name":"BOUTWELL","classification":"U","division":"PRODUCTION","hit_factor":0.944},{"match_name":"Rio Grande Practical Shooters - August 2016","match_date":"2016-08-06","stage_classifiercode":"09-08","member_number":"A92318","first_name":"ROBERT","last_name":"PAUL","classification":"D","division":"PRODUCTION","hit_factor":0.9378},{"match_name":"AVAP62318","match_date":"2018-06-23","stage_classifiercode":"09-08","member_number":"TY111293","first_name":"MACKY","last_name":"RUIZ","classification":"U","division":"PRODUCTION","hit_factor":0.9296},{"match_name":"PIPS 08-05-2020","match_date":"2020-08-05","stage_classifiercode":"09-08","member_number":"TY119806","first_name":"VANCE","last_name":"SWISHER","classification":"C","division":"PRODUCTION","hit_factor":0.9288},{"match_name":"Strongpoint February 2017 Classifier Match","match_date":"2017-02-04","stage_classifiercode":"09-08","member_number":"A100536","first_name":"BRYAN","last_name":"FISHER","classification":"U","division":"PRODUCTION","hit_factor":0.9195},{"match_name":"ENPS May 2018 USPSA Match","match_date":"2018-05-06","stage_classifiercode":"09-08","member_number":"A90909","first_name":"ELIZABETH","last_name":"GAC","classification":"B","division":"PRODUCTION","hit_factor":0.9156},{"match_name":"WSPS OCTOBER 2016 SPECIAL CLASSIFIER MATCH","match_date":"2016-10-29","stage_classifiercode":"09-08","member_number":"A98876","first_name":"BOB","last_name":"DILL","classification":"U","division":"PRODUCTION","hit_factor":0.915},{"match_name":"CRC_20160514_SuperClassifier","match_date":"2016-05-14","stage_classifiercode":"09-08","member_number":"TY88146","first_name":"RON","last_name":"ROSE","classification":"U","division":"PRODUCTION","hit_factor":0.899},{"match_name":"USPSA MO21 Special Classifier 2Alpha SBRC February 27 2021","match_date":"2021-02-27","stage_classifiercode":"09-08","member_number":"TY14961","first_name":"ROY","last_name":"BOWLING","classification":"C","division":"PRODUCTION","hit_factor":0.8949},{"match_name":"ET06 USPSA 11-04-2017","match_date":"2017-11-04","stage_classifiercode":"09-08","member_number":"a100666","first_name":"TATE","last_name":"MILLER","classification":"D","division":"PRODUCTION","hit_factor":0.8931},{"match_name":"Richmond Boro Gun Club July 2018 Monthly USPSA match","match_date":"2018-07-21","stage_classifiercode":"09-08","member_number":"A108611","first_name":"CHRISTOPHER","last_name":"ANGELINA","classification":"D","division":"PRODUCTION","hit_factor":0.8918},{"match_name":"WSPS OCTOBER 2016 SPECIAL CLASSIFIER MATCH","match_date":"2016-10-29","stage_classifiercode":"09-08","member_number":"A98427","first_name":"MATTHEW","last_name":"MYERS","classification":"U","division":"PRODUCTION","hit_factor":0.8889},{"match_name":"Atlanta Practical Shooters March 2017 USPSA - Classifier Match","match_date":"2017-03-05","stage_classifiercode":"09-08","member_number":"PEN","first_name":"JORDAN","last_name":"FLORES","classification":"U","division":"PRODUCTION","hit_factor":0.8822},{"match_name":"ENPS May 2018 USPSA Match","match_date":"2018-05-06","stage_classifiercode":"09-08","member_number":"A101977","first_name":"ASHER","last_name":"LANGTON","classification":"C","division":"PRODUCTION","hit_factor":0.8787},{"match_name":"BSPSC 2017 April Special Classifier","match_date":"2017-04-09","stage_classifiercode":"09-08","member_number":"TY64049","first_name":"JIM","last_name":"HASSAN","classification":"D","division":"PRODUCTION","hit_factor":0.8762},{"match_name":"CCSC USPSA All Classifier Match","match_date":"2021-06-12","stage_classifiercode":"09-08","member_number":"A126896","first_name":"STAN","last_name":"BELVILLE","classification":"C","division":"PRODUCTION","hit_factor":0.8662},{"match_name":"Rio Grande Practical Shooters - August 2016","match_date":"2016-08-06","stage_classifiercode":"09-08","member_number":"A90706","first_name":"CHAD","last_name":"WHITE","classification":"B","division":"PRODUCTION","hit_factor":0.8631},{"match_name":"Lefthanders Gun Club Practical Shooters March 5 and 6","match_date":"2016-03-05","stage_classifiercode":"09-08","member_number":"a84207","first_name":"JEFF","last_name":"EMERY","classification":"U","division":"PRODUCTION","hit_factor":0.8598},{"match_name":"Danville Rifle And Pistol Club USPSA Classifier Match","match_date":"2017-11-11","stage_classifiercode":"09-08","member_number":"\"\"","first_name":"SEAN","last_name":"SINDERS","classification":"\"\"","division":"PRODUCTION","hit_factor":0.8419},{"match_name":"WPS USPSA Monthly Match November 2018","match_date":"2018-11-10","stage_classifiercode":"09-08","member_number":"TY61611","first_name":"ANTHONY","last_name":"DORANGRICHIA","classification":"C","division":"PRODUCTION","hit_factor":0.8403},{"match_name":"OKCGC USPSA Feb 2018","match_date":"2018-02-03","stage_classifiercode":"09-08","member_number":"\"\"","first_name":"JOSH","last_name":"LACY","classification":"\"\"","division":"PRODUCTION","hit_factor":0.8346},{"match_name":"BSPSC 2017 April Special Classifier","match_date":"2017-04-09","stage_classifiercode":"09-08","member_number":"PENDING","first_name":"CINDY","last_name":"RUPP","classification":"U","division":"PRODUCTION","hit_factor":0.8345},{"match_name":"Treasure State Championship Hosted By MCAS","match_date":"2020-06-20","stage_classifiercode":"09-08","member_number":"A117313","first_name":"CASEY","last_name":"DOLPH","classification":"C","division":"PRODUCTION","hit_factor":0.8341},{"match_name":"ENPS May 2018 USPSA Match","match_date":"2018-05-06","stage_classifiercode":"09-08","member_number":"A96769","first_name":"WILLIAM","last_name":"STEEN","classification":"C","division":"PRODUCTION","hit_factor":0.8258},{"match_name":"PIPS 08-05-2020","match_date":"2020-08-05","stage_classifiercode":"09-08","member_number":"PEN","first_name":"GUY","last_name":"KOHLNHOFER","classification":"U","division":"PRODUCTION","hit_factor":0.816},{"match_name":"LCSC Linden USPSA 031118","match_date":"2018-03-11","stage_classifiercode":"09-08","member_number":"A106815","first_name":"DAVID","last_name":"LIU","classification":"U","division":"PRODUCTION","hit_factor":0.8137},{"match_name":"Coastal Area Practical Shooters 8-27-16","match_date":"2016-08-27","stage_classifiercode":"09-08","member_number":"PEN","first_name":"KELSEY","last_name":"DUNMAN","classification":"U","division":"PRODUCTION","hit_factor":0.8136},{"match_name":"RCPS USPSA 8 Apr 2017","match_date":"2017-04-08","stage_classifiercode":"09-08","member_number":"A91833","first_name":"GREG","last_name":"DEAN","classification":"C","division":"PRODUCTION","hit_factor":0.8115},{"match_name":"2016 Tennessee Atomic Blast","match_date":"2016-09-16","stage_classifiercode":"09-08","member_number":"A79183","first_name":"TIFFANY","last_name":"KINSLER","classification":"C","division":"PRODUCTION","hit_factor":0.8081},{"match_name":"WPS USPSA Monthly Match November 2018","match_date":"2018-11-10","stage_classifiercode":"09-08","member_number":"TY113031","first_name":"PIA","last_name":"MCFARLAND","classification":"D","division":"PRODUCTION","hit_factor":0.8052},{"match_name":"MAPSA 2016.05.14","match_date":"2016-05-14","stage_classifiercode":"09-08","member_number":"\"\"","first_name":"JOEY","last_name":"BETELAK","classification":"U","division":"PRODUCTION","hit_factor":0.7993},{"match_name":"LCSC Linden USPSA 031118","match_date":"2018-03-11","stage_classifiercode":"09-08","member_number":"A105565","first_name":"JEFF","last_name":"LEE","classification":"U","division":"PRODUCTION","hit_factor":0.795},{"match_name":"Sage Pistol League USPSA April 18 2021","match_date":"2021-04-18","stage_classifiercode":"09-08","member_number":"A132861","first_name":"TRACY","last_name":"ACKERET","classification":"\"\"","division":"PRODUCTION","hit_factor":0.7864},{"match_name":"2016 Tennessee Atomic Blast","match_date":"2016-09-16","stage_classifiercode":"09-08","member_number":"A98647","first_name":"JACOB","last_name":"SUGGS","classification":"U","division":"PRODUCTION","hit_factor":0.7843},{"match_name":"Strongpoint February 2017 Classifier Match","match_date":"2017-02-04","stage_classifiercode":"09-08","member_number":"\"\"","first_name":"KYLE","last_name":"WILSON","classification":"U","division":"PRODUCTION","hit_factor":0.7682},{"match_name":"CTASA 3rd Sunday USPSA - February 2016","match_date":"2016-02-21","stage_classifiercode":"09-08","member_number":"a94970","first_name":"DENNNIS","last_name":"ERWIN","classification":"U","division":"PRODUCTION","hit_factor":0.764},{"match_name":"Strongpoint February 2017 Classifier Match","match_date":"2017-02-04","stage_classifiercode":"09-08","member_number":"\"\"","first_name":"PATRICK","last_name":"RYAN","classification":"U","division":"PRODUCTION","hit_factor":0.7634},{"match_name":"2da Copa Nacional USPSA ","match_date":"2016-05-22","stage_classifiercode":"09-08","member_number":"A92865","first_name":"MIGUEL","last_name":"AROCHO RODRIGUEZ","classification":"U","division":"PRODUCTION","hit_factor":0.7502},{"match_name":"QPS Quantico Shooting Club January USPSA   ","match_date":"2021-01-09","stage_classifiercode":"09-08","member_number":"A129397","first_name":"GEORGETTE","last_name":"PHILLIPS","classification":"D","division":"PRODUCTION","hit_factor":0.7421},{"match_name":"OREGON ARPC CC05 USPSA SEPT 9 2017","match_date":"2017-09-09","stage_classifiercode":"09-08","member_number":"PEN","first_name":"PAUL","last_name":"JOHNSON","classification":"U","division":"PRODUCTION","hit_factor":0.7394},{"match_name":"Central IL Practical Shooters October Match","match_date":"2016-10-09","stage_classifiercode":"09-08","member_number":"A95946","first_name":"PAUL","last_name":"EMERY","classification":"U","division":"PRODUCTION","hit_factor":0.7057},{"match_name":"Coastal Area Practical Shooters 8-27-16","match_date":"2016-08-27","stage_classifiercode":"09-08","member_number":"A70050","first_name":"GLENN","last_name":"MAIER","classification":"U","division":"PRODUCTION","hit_factor":0.7049},{"match_name":"MAPSA 2016.05.14","match_date":"2016-05-14","stage_classifiercode":"09-08","member_number":"TY64933","first_name":"STEVE","last_name":"TRI","classification":"C","division":"PRODUCTION","hit_factor":0.7027},{"match_name":"Hampden RPC July USPSA","match_date":"2017-07-16","stage_classifiercode":"09-08","member_number":"A93192","first_name":"ALAN","last_name":"MACLEAN","classification":"\"\"","division":"PRODUCTION","hit_factor":0.6961},{"match_name":"Chillicothe April-2017 USPSA Match","match_date":"2017-04-23","stage_classifiercode":"09-08","member_number":"A57074","first_name":"MIKE","last_name":"KOWALSKI","classification":"C","division":"PRODUCTION","hit_factor":0.688},{"match_name":"Chillicothe April-2018 USPSA Classifier Match","match_date":"2018-04-28","stage_classifiercode":"09-08","member_number":"TY27544","first_name":"DON","last_name":"DANSBY","classification":"B","division":"PRODUCTION","hit_factor":0.6876},{"match_name":"CTASA 3rd Sunday USPSA - February 2016","match_date":"2016-02-21","stage_classifiercode":"09-08","member_number":"TY79686","first_name":"BOB","last_name":"ROWELL","classification":"U","division":"PRODUCTION","hit_factor":0.6617},{"match_name":"QPS Quantico Shooting Club January USPSA   ","match_date":"2021-01-09","stage_classifiercode":"09-08","member_number":"TY129368","first_name":"\"JAMES \"\"RANDY\"\"\"","last_name":"DRAKE","classification":"C","division":"PRODUCTION","hit_factor":0.6494},{"match_name":"APSC USPSA Classifier Match 07-01-17","match_date":"2017-07-01","stage_classifiercode":"09-08","member_number":"TY74988","first_name":"GREG","last_name":"COOPER","classification":"C","division":"PRODUCTION","hit_factor":0.644},{"match_name":"Low Country USPSA October Monthly Match","match_date":"2020-10-24","stage_classifiercode":"09-08","member_number":"A128726","first_name":"DANIEL","last_name":"RICHARDSON","classification":"U","division":"PRODUCTION","hit_factor":0.6338},{"match_name":"Strongpoint February 2017 Classifier Match","match_date":"2017-02-04","stage_classifiercode":"09-08","member_number":"A93789","first_name":"MATT","last_name":"NICKISCH","classification":"D","division":"PRODUCTION","hit_factor":0.6257},{"match_name":"BSC Brooklyn Classifier Match Oct 17","match_date":"2021-10-17","stage_classifiercode":"09-08","member_number":"A135103","first_name":"ADAM","last_name":"VERSOLA","classification":"U","division":"PRODUCTION","hit_factor":0.6239},{"match_name":"CARO USPSA MATCH NO 3","match_date":"2018-07-28","stage_classifiercode":"09-08","member_number":"A108469","first_name":"ANDREA","last_name":"HARDAKER","classification":"\"\"","division":"PRODUCTION","hit_factor":0.6192},{"match_name":"Pioneer Action Shooters USPSA 5-27-18","match_date":"2018-05-27","stage_classifiercode":"09-08","member_number":"A99442","first_name":"STEVEN","last_name":"RIBEIRO","classification":"C","division":"PRODUCTION","hit_factor":0.6044},{"match_name":"Whitewater USPSA 3-17-2018","match_date":"2018-03-17","stage_classifiercode":"09-08","member_number":"\"\"","first_name":"BRAXTIN","last_name":"PURCELL","classification":"U","division":"PRODUCTION","hit_factor":0.6028},{"match_name":"PMSC  USPSA JULY 2017","match_date":"2017-07-01","stage_classifiercode":"09-08","member_number":"ty72728","first_name":"KIRK","last_name":"SWEGER","classification":"B","division":"PRODUCTION","hit_factor":0.5734},{"match_name":"BSPSC 2017 April Special Classifier","match_date":"2017-04-09","stage_classifiercode":"09-08","member_number":"NONE","first_name":"WYATT","last_name":"HOLZWORTH","classification":"U","division":"PRODUCTION","hit_factor":0.5711},{"match_name":"DGC USPSA Classifier Match","match_date":"2017-07-30","stage_classifiercode":"09-08","member_number":"A101101","first_name":"BERT","last_name":"CHAMPION","classification":"C","division":"PRODUCTION","hit_factor":0.5662},{"match_name":"Coastal Area Practical Shooters 8-27-16","match_date":"2016-08-27","stage_classifiercode":"09-08","member_number":"A97675","first_name":"MIKE","last_name":"SEARS","classification":"U","division":"PRODUCTION","hit_factor":0.5542},{"match_name":"Lefthanders Gun Club Practical Shooters March 5 and 6","match_date":"2016-03-05","stage_classifiercode":"09-08","member_number":"a-95265","first_name":"JOSH","last_name":"WELKER","classification":"U","division":"PRODUCTION","hit_factor":0.5521},{"match_name":"CCPL June 2 Day","match_date":"2020-06-28","stage_classifiercode":"09-08","member_number":"A127032","first_name":"BUCK","last_name":"ARNOLD","classification":"U","division":"PRODUCTION","hit_factor":0.5495},{"match_name":"OKCGC USPSA Feb 2018","match_date":"2018-02-03","stage_classifiercode":"09-08","member_number":"TY75344","first_name":"CARY","last_name":"ROWTON","classification":"U","division":"PRODUCTION","hit_factor":0.5476},{"match_name":"Tropang Vegas All Classifier Match","match_date":"2020-07-12","stage_classifiercode":"09-08","member_number":"A106660","first_name":"JOSEPH","last_name":"DULOS","classification":"D","division":"PRODUCTION","hit_factor":0.5435},{"match_name":"WSPS OCTOBER 2016 SPECIAL CLASSIFIER MATCH","match_date":"2016-10-29","stage_classifiercode":"09-08","member_number":"TY43604","first_name":"JOHN","last_name":"CLARKE","classification":"A","division":"PRODUCTION","hit_factor":0.5388},{"match_name":"Lefthanders Gun Club Practical Shooters March 5 and 6","match_date":"2016-03-05","stage_classifiercode":"09-08","member_number":"A88894","first_name":"CLARK","last_name":"WRIGHT","classification":"A","division":"PRODUCTION","hit_factor":0.5348},{"match_name":"Richmond Boro Gun Club July 2018 Monthly USPSA match","match_date":"2018-07-21","stage_classifiercode":"09-08","member_number":"TY112359","first_name":"CHRISTOPHER","last_name":"MCCABE","classification":"U","division":"PRODUCTION","hit_factor":0.5146},{"match_name":"WSPS OCTOBER 2016 SPECIAL CLASSIFIER MATCH","match_date":"2016-10-29","stage_classifiercode":"09-08","member_number":"\"\"","first_name":"JENIFER","last_name":"SANTO","classification":"U","division":"PRODUCTION","hit_factor":0.514},{"match_name":"OKCGC 2017 January Classifier Spectacular","match_date":"2017-01-29","stage_classifiercode":"09-08","member_number":"A57367","first_name":"SCOTT","last_name":"CLARK","classification":"C","division":"PRODUCTION","hit_factor":0.5072},{"match_name":"CTASA 3rd Sunday USPSA - February 2016","match_date":"2016-02-21","stage_classifiercode":"09-08","member_number":"\"\"","first_name":"MARKUS","last_name":"JOSWIG","classification":"U","division":"PRODUCTION","hit_factor":0.5011},{"match_name":"Strongpoint February 2017 Classifier Match","match_date":"2017-02-04","stage_classifiercode":"09-08","member_number":"A96148","first_name":"RICO","last_name":"REYNA","classification":"B","division":"PRODUCTION","hit_factor":0.4845},{"match_name":"PIPS 08-05-2020","match_date":"2020-08-05","stage_classifiercode":"09-08","member_number":"TY90188","first_name":"BLAKE","last_name":"MAMER","classification":"A","division":"PRODUCTION","hit_factor":0.458},{"match_name":"MAPSA 2016.05.14","match_date":"2016-05-14","stage_classifiercode":"09-08","member_number":"A95257","first_name":"ANDREW","last_name":"TOLLIVER","classification":"U","division":"PRODUCTION","hit_factor":0.4533},{"match_name":"ENPS May 2018 USPSA Match","match_date":"2018-05-06","stage_classifiercode":"09-08","member_number":"A109651","first_name":"RICK","last_name":"KRYSTOF","classification":"U","division":"PRODUCTION","hit_factor":0.434},{"match_name":"NCPS USPSA Handgun Match October 23 2016","match_date":"2016-10-23","stage_classifiercode":"09-08","member_number":"TY93002","first_name":"ERIC","last_name":"CARGO","classification":"C","division":"PRODUCTION","hit_factor":0.4248},{"match_name":"Treasure State Championship Hosted By MCAS","match_date":"2020-06-20","stage_classifiercode":"09-08","member_number":"A118215","first_name":"TAMMY","last_name":"SMITH","classification":"D","division":"PRODUCTION","hit_factor":0.4096},{"match_name":"Coastal Bend Shooters - USPSA - August 14 2016","match_date":"2016-08-14","stage_classifiercode":"09-08","member_number":"\"\"","first_name":"MATTHEW","last_name":"SUTTON","classification":"U","division":"PRODUCTION","hit_factor":0.387},{"match_name":"Southkent USPSA MAY match","match_date":"2017-05-20","stage_classifiercode":"09-08","member_number":"TY98976","first_name":"JUDITH","last_name":"WORDEN","classification":"D","division":"PRODUCTION","hit_factor":0.3802},{"match_name":"NCPS USPSA Handgun Match October 23 2016","match_date":"2016-10-23","stage_classifiercode":"09-08","member_number":"TY76839","first_name":"THOMAS","last_name":"WU","classification":"D","division":"PRODUCTION","hit_factor":0.3776},{"match_name":"RCPS USPSA 8 Apr 2017","match_date":"2017-04-08","stage_classifiercode":"09-08","member_number":"\"\"","first_name":"TIM","last_name":"ARDLEY","classification":"U","division":"PRODUCTION","hit_factor":0.3701},{"match_name":"APSC USPSA Classifier Match 07-01-17","match_date":"2017-07-01","stage_classifiercode":"09-08","member_number":"\"\"","first_name":"JONATHAN","last_name":"YOUNG","classification":"U","division":"PRODUCTION","hit_factor":0.3429},{"match_name":"NCPS USPSA Handgun Match October 23 2016","match_date":"2016-10-23","stage_classifiercode":"09-08","member_number":"A97702","first_name":"ROBERT","last_name":"CONLEY","classification":"D","division":"PRODUCTION","hit_factor":0.3382},{"match_name":"PMSC  USPSA JULY 2017","match_date":"2017-07-01","stage_classifiercode":"09-08","member_number":"A93168","first_name":"ROBERT","last_name":"BODKIN","classification":"C","division":"PRODUCTION","hit_factor":0.3287},{"match_name":"PCWC USPSA  8-28-2021","match_date":"2021-08-28","stage_classifiercode":"09-08","member_number":"A116423","first_name":"JACOB","last_name":"PARKER","classification":"A","division":"PRODUCTION","hit_factor":0.3254},{"match_name":"EASTER EGG HUNT AREA 59  ALL CLASSFIER MATCH","match_date":"2017-04-15","stage_classifiercode":"09-08","member_number":"8675409","first_name":"BRANDON","last_name":"NOWAK","classification":"U","division":"PRODUCTION","hit_factor":0.3193},{"match_name":"Harvard Action Shooters June 2018 USPSA Pistol Match","match_date":"2018-06-10","stage_classifiercode":"09-08","member_number":"A111828","first_name":"BRENDAN","last_name":"CASSIDY","classification":"U","division":"PRODUCTION","hit_factor":0.2899},{"match_name":"DGC USPSA Classifier Match","match_date":"2017-07-30","stage_classifiercode":"09-08","member_number":"A103705","first_name":"BLAKE","last_name":"ARNOLD","classification":"U","division":"PRODUCTION","hit_factor":0.2828},{"match_name":"APSC USPSA Classifier Match 07-01-17","match_date":"2017-07-01","stage_classifiercode":"09-08","member_number":"\"\"","first_name":"GEORGE","last_name":"SONG","classification":"U","division":"PRODUCTION","hit_factor":0.2705},{"match_name":"NCPS USPSA Handgun Match October 23 2016","match_date":"2016-10-23","stage_classifiercode":"09-08","member_number":"A98474","first_name":"TONY","last_name":"PETERSON","classification":"U","division":"PRODUCTION","hit_factor":0.2532},{"match_name":"Strongpoint February 2017 Classifier Match","match_date":"2017-02-04","stage_classifiercode":"09-08","member_number":"\"\"","first_name":"DYLAN","last_name":"HASKE","classification":"U","division":"PRODUCTION","hit_factor":0.2433},{"match_name":"Lefthanders Gun Club Practical Shooters March 5 and 6","match_date":"2016-03-05","stage_classifiercode":"09-08","member_number":"A63433","first_name":"ROB","last_name":"LEWIS","classification":"C","division":"PRODUCTION","hit_factor":0.2151},{"match_name":"OKCGC USPSA April 2018","match_date":"2018-04-07","stage_classifiercode":"09-08","member_number":"A98670","first_name":"YURY","last_name":"DELENDIK","classification":"C","division":"PRODUCTION","hit_factor":0.2123},{"match_name":"CRC_20160514_SuperClassifier","match_date":"2016-05-14","stage_classifiercode":"09-08","member_number":"\"\"","first_name":"JESSE","last_name":"KIERNAN","classification":"U","division":"PRODUCTION","hit_factor":0.2091},{"match_name":"CCSC USPSA All Classifier Match","match_date":"2021-06-12","stage_classifiercode":"09-08","member_number":"A131054","first_name":"JORDAN G.","last_name":"WESTROPP","classification":"D","division":"PRODUCTION","hit_factor":0.1991},{"match_name":"CIPSC IL02 Havana June USPSA","match_date":"2020-06-13","stage_classifiercode":"09-08","member_number":"NA","first_name":"KRISTOPHER","last_name":"LEE","classification":"X","division":"PRODUCTION","hit_factor":0.176},{"match_name":"Richmond Boro Gun Club July 2018 Monthly USPSA match","match_date":"2018-07-21","stage_classifiercode":"09-08","member_number":"\"\"","first_name":"GREGORY","last_name":"LLOYD","classification":"\"\"","division":"PRODUCTION","hit_factor":0.163},{"match_name":"Chillicothe April-2018 USPSA Classifier Match","match_date":"2018-04-28","stage_classifiercode":"09-08","member_number":"TY96200","first_name":"RYAN","last_name":"GEORGE","classification":"B","division":"PRODUCTION","hit_factor":0.1372},{"match_name":"WMPS USPSA  3 Jun 2017","match_date":"2017-06-03","stage_classifiercode":"09-08","member_number":"\"\"","first_name":"KEN","last_name":"LOWELL","classification":"U","division":"PRODUCTION","hit_factor":0.1265},{"match_name":"NCPS USPSA Handgun Match October 23 2016","match_date":"2016-10-23","stage_classifiercode":"09-08","member_number":"A63254","first_name":"EMMANUEL","last_name":"BUENO","classification":"D","division":"PRODUCTION","hit_factor":0.1235},{"match_name":"Ghost Town Shooters Special Classifier","match_date":"2018-06-30","stage_classifiercode":"09-08","member_number":"ty86770","first_name":"BRIAN","last_name":"SHAIN","classification":"C","division":"PRODUCTION","hit_factor":0.1217},{"match_name":"ENPS May 2018 USPSA Match","match_date":"2018-05-06","stage_classifiercode":"09-08","member_number":"A85288","first_name":"JOSHUA","last_name":"URBAN","classification":"C","division":"PRODUCTION","hit_factor":0.1044},{"match_name":"Chillicothe April-2018 USPSA Classifier Match","match_date":"2018-04-28","stage_classifiercode":"09-08","member_number":"FY98680","first_name":"MIKE","last_name":"GIBBONS","classification":"C","division":"PRODUCTION","hit_factor":0.0972},{"match_name":"AREA 59  SPRING ALL CLASSIFIER","match_date":"2018-03-31","stage_classifiercode":"09-08","member_number":"A108828","first_name":"WALTER","last_name":"PASCUA","classification":"U","division":"PRODUCTION","hit_factor":0.0859},{"match_name":"PIPS 08-08-2018","match_date":"2018-08-07","stage_classifiercode":"09-08","member_number":"PEN","first_name":"BERNIE","last_name":"BLOCK","classification":"U","division":"PRODUCTION","hit_factor":0.0724},{"match_name":"WPS USPSA Monthly Match November 2018","match_date":"2018-11-10","stage_classifiercode":"09-08","member_number":"A113212","first_name":"JONATHAN","last_name":"SAVOY","classification":"U","division":"PRODUCTION","hit_factor":0.0687},{"match_name":"TTS   12DEC2020","match_date":"2020-12-12","stage_classifiercode":"09-08","member_number":"L4942","first_name":"MICHAEL","last_name":"MCCRAE","classification":"D","division":"PRODUCTION","hit_factor":0.0675},{"match_name":"Tropang Vegas All Classifier Match","match_date":"2020-07-12","stage_classifiercode":"09-08","member_number":"A128129","first_name":"DALE","last_name":"ABELLA","classification":"U","division":"PRODUCTION","hit_factor":0.0643},{"match_name":"OKCGC 2017 January Classifier Spectacular","match_date":"2017-01-29","stage_classifiercode":"09-08","member_number":"\"\"","first_name":"PATRICK","last_name":"RUNNELS","classification":"U","division":"PRODUCTION","hit_factor":0.0643},{"match_name":"WSPS OCTOBER 2016 SPECIAL CLASSIFIER MATCH","match_date":"2016-10-29","stage_classifiercode":"09-08","member_number":"A94755","first_name":"TREVOR","last_name":"MONN","classification":"D","division":"PRODUCTION","hit_factor":0.0606}]