[{"match_name":"Richmond Hot Shots July 15-16-2017 USPSA Pistol Match","match_date":"2017-07-15","stage_classifiercode":"06-10","member_number":"TY88773","first_name":"EPHRAIM","last_name":"SAN FELIPE","classification":"C","division":"PCC","hit_factor":14.6341},{"match_name":"RBGC USPSA 2021-8-28","match_date":"2021-08-28","stage_classifiercode":"06-10","member_number":"A107497","first_name":"HARLEY","last_name":"WIEGERT","classification":"M","division":"PCC","hit_factor":13.2743},{"match_name":"2020-03-07 USPSA at Phoenix Rod and Gun Club","match_date":"2020-03-07","stage_classifiercode":"06-10","member_number":"A89131","first_name":"RYAN","last_name":"BAYS","classification":"M","division":"PCC","hit_factor":12.8205},{"match_name":"Shoot GTR Classifier Make Up","match_date":"2017-08-20","stage_classifiercode":"06-10","member_number":"A73910","first_name":"JEREMY","last_name":"LIGHTNER","classification":"M","division":"PCC","hit_factor":12.8205},{"match_name":"DWB - Deadwood Boys USPSA 19 January 2020","match_date":"2020-01-19","stage_classifiercode":"06-10","member_number":"A96044","first_name":"SEAN","last_name":"HENSLEY","classification":"M","division":"PCC","hit_factor":12.7119},{"match_name":"Deadwood Boys USPSA All Classifier Match - 29 July 2018","match_date":"2018-07-29","stage_classifiercode":"06-10","member_number":"A73444","first_name":"KYLE","last_name":"FRAZIER","classification":"A","division":"PCC","hit_factor":12.1951},{"match_name":"CCAS December 2017 Special Classifier","match_date":"2017-12-16","stage_classifiercode":"06-10","member_number":"A74344","first_name":"LANCE","last_name":"DEHLER","classification":"U","division":"PCC","hit_factor":12.1951},{"match_name":"WSRC USPSA 7-21/22-2018","match_date":"2018-07-21","stage_classifiercode":"06-10","member_number":"A109616","first_name":"MARK","last_name":"CRIBELAR","classification":"U","division":"PCC","hit_factor":12.1457},{"match_name":"Custer December USPSA","match_date":"2016-12-04","stage_classifiercode":"06-10","member_number":"FY23884","first_name":"GREG","last_name":"PURCELL","classification":"U","division":"PCC","hit_factor":12.1457},{"match_name":"MASTER BLASTERS & SSFGA USPSA - September","match_date":"2021-09-18","stage_classifiercode":"06-10","member_number":"A115431","first_name":"COLIN","last_name":"MACARTHUR","classification":"M","division":"PCC","hit_factor":12.0482},{"match_name":"Pioneer Action Shooters USPSA 5-23-21 Special Classifer","match_date":"2021-05-23","stage_classifiercode":"06-10","member_number":"A115431","first_name":"COLIN","last_name":"MACARTHUR","classification":"M","division":"PCC","hit_factor":12},{"match_name":"Custer December USPSA","match_date":"2016-12-04","stage_classifiercode":"06-10","member_number":"FY75900","first_name":"CHRIS","last_name":"NEVINS","classification":"U","division":"PCC","hit_factor":11.9522},{"match_name":"SWGC USPSA Pistol Match - March 2020","match_date":"2020-03-07","stage_classifiercode":"06-10","member_number":"L2458","first_name":"TODD","last_name":"JARRETT","classification":"GM","division":"PCC","hit_factor":11.7188},{"match_name":"FBURG March 2021 Level I USPSA ","match_date":"2021-03-06","stage_classifiercode":"06-10","member_number":"L2458","first_name":"TODD","last_name":"JARRETT","classification":"G","division":"PCC","hit_factor":11.4943},{"match_name":"GRPC USPSA DO YOU FEEL LUCKY?","match_date":"2021-03-07","stage_classifiercode":"06-10","member_number":"A91497","first_name":"SCOTT","last_name":"REEH","classification":"M","division":"PCC","hit_factor":11.4068},{"match_name":"FBURG June 2018 Level 1 USPSA","match_date":"2018-06-02","stage_classifiercode":"06-10","member_number":"L4331","first_name":"BRANDON","last_name":"HIGBEE","classification":"M","division":"PCC","hit_factor":11.236},{"match_name":"Hosemasters 2nd Sunday August 2017","match_date":"2017-08-13","stage_classifiercode":"06-10","member_number":"\"\"","first_name":"ROB","last_name":"SEWELL","classification":"U","division":"PCC","hit_factor":11.194},{"match_name":"Shadow Hawk Defense USPSA SPECIAL CLASSIFIER","match_date":"2021-11-11","stage_classifiercode":"06-10","member_number":"A114630","first_name":"JOSEPH","last_name":"SANTOS","classification":"A","division":"PCC","hit_factor":11.194},{"match_name":"WSPS OCTOBER 2018 USPSA MATCH","match_date":"2018-10-20","stage_classifiercode":"06-10","member_number":"A82592","first_name":"THOMAS","last_name":"KOH","classification":"G","division":"PCC","hit_factor":11.1524},{"match_name":"Paul Bunyan April 7th-8th All Classifier Match NW01","match_date":"2018-04-07","stage_classifiercode":"06-10","member_number":"a104728","first_name":"SEAN","last_name":"STRADLEY","classification":"U","division":"PCC","hit_factor":11.1111},{"match_name":"DWB - Deadwood Boys USPSA 19 January 2020","match_date":"2020-01-19","stage_classifiercode":"06-10","member_number":"TY103826","first_name":"CHRISPY","last_name":"PARK","classification":"M","division":"PCC","hit_factor":11.1111},{"match_name":"Richmond Hot Shots July 15-16-2017 USPSA Pistol Match","match_date":"2017-07-15","stage_classifiercode":"06-10","member_number":"TY24456","first_name":"RANDY","last_name":"MELTON","classification":"M","division":"PCC","hit_factor":11.0294},{"match_name":"Shadow Hawk Defense USPSA SPECIAL CLASSIFIER","match_date":"2021-11-11","stage_classifiercode":"06-10","member_number":"F137038","first_name":"SANGMIN","last_name":"JEON","classification":"U","division":"PCC","hit_factor":11.0294},{"match_name":"MASTER BLASTERS & SSFGA USPSA - September","match_date":"2021-09-18","stage_classifiercode":"06-10","member_number":"L2187","first_name":"ALLEN","last_name":"LAU","classification":"M","division":"PCC","hit_factor":10.9489},{"match_name":"ORSA USPSA Classifier Side  Match Feb 2017","match_date":"2017-02-18","stage_classifiercode":"06-10","member_number":"TY77301","first_name":"SHANE","last_name":"CHARLES","classification":"U","division":"PCC","hit_factor":10.9091},{"match_name":"Hopkinton August 2016 ","match_date":"2016-08-06","stage_classifiercode":"06-10","member_number":"TY73127","first_name":"SEAN","last_name":"JANICKI","classification":"U","division":"PCC","hit_factor":10.8696},{"match_name":"Shoot GTR Monthly USPSA","match_date":"2018-01-07","stage_classifiercode":"06-10","member_number":"A77998","first_name":"CALVIN","last_name":"CARPENTER","classification":"A","division":"PCC","hit_factor":10.7527},{"match_name":"WGC WI USPSA Monthly Match 10-21-17","match_date":"2017-10-21","stage_classifiercode":"06-10","member_number":"A82468","first_name":"ADAM","last_name":"MAXWELL","classification":"\"\"","division":"PCC","hit_factor":10.7143},{"match_name":"MASTER BLASTERS & SSFGA USPSA - September","match_date":"2021-09-18","stage_classifiercode":"06-10","member_number":"Fy91061","first_name":"JOSEPH","last_name":"FLANAGAN","classification":"M","division":"PCC","hit_factor":10.6383},{"match_name":"MASTER BLASTERS & SSFGA USPSA - September","match_date":"2021-09-18","stage_classifiercode":"06-10","member_number":"Ty90354","first_name":"BRIAN","last_name":"HARRINGTON","classification":"G","division":"PCC","hit_factor":10.6383},{"match_name":"Paul Bunyan April 7th-8th All Classifier Match NW01","match_date":"2018-04-07","stage_classifiercode":"06-10","member_number":"Ty94333","first_name":"JONATHON","last_name":"PORTER","classification":"B","division":"PCC","hit_factor":10.6007},{"match_name":"RBGC USPSA 2021-8-28","match_date":"2021-08-28","stage_classifiercode":"06-10","member_number":"TY106905","first_name":"CHRIS","last_name":"BARRETT","classification":"B","division":"PCC","hit_factor":10.5263},{"match_name":"FBURG USPSA November 2021","match_date":"2021-11-07","stage_classifiercode":"06-10","member_number":"F137038","first_name":"SANGMIN","last_name":"JEON","classification":"U","division":"PCC","hit_factor":10.5263},{"match_name":"GRPC USPSA CINCO DE MAYO","match_date":"2018-05-06","stage_classifiercode":"06-10","member_number":"TY79055","first_name":"WADE","last_name":"PRUETZ","classification":"A","division":"PCC","hit_factor":10.4895},{"match_name":"MPPL 20200301","match_date":"2020-03-01","stage_classifiercode":"06-10","member_number":"TY84441","first_name":"SEAN","last_name":"HATADA","classification":"A","division":"PCC","hit_factor":10.4895},{"match_name":"Rankin Field Sunday USPSA","match_date":"2018-10-21","stage_classifiercode":"06-10","member_number":"\"\"","first_name":"RUSSEL","last_name":"CURTIS","classification":"M","division":"PCC","hit_factor":10.453},{"match_name":"YRPA  9/25/16  USPSA Pistol Match","match_date":"2016-09-23","stage_classifiercode":"06-10","member_number":"A94621","first_name":"BRIAN M","last_name":"PEPPER","classification":"C","division":"PCC","hit_factor":10.453},{"match_name":"Southern Arizona Practical Shooters 09_01_18","match_date":"2018-09-01","stage_classifiercode":"06-10","member_number":"L4432","first_name":"ERIC","last_name":"FRANCE","classification":"M","division":"PCC","hit_factor":10.453},{"match_name":"Collin County USPSA 11-28-2021","match_date":"2021-11-28","stage_classifiercode":"06-10","member_number":"A135603","first_name":"JEFFREY","last_name":"OVIEDO","classification":"A","division":"PCC","hit_factor":10.453},{"match_name":"SLPSA Jan USPSA match 1","match_date":"2020-01-11","stage_classifiercode":"06-10","member_number":"L4146","first_name":"CAREY","last_name":"PALMER","classification":"A","division":"PCC","hit_factor":10.3806},{"match_name":"TAS Classifier 2","match_date":"2017-12-10","stage_classifiercode":"06-10","member_number":"A84376","first_name":"JUSTIN","last_name":"COOPER","classification":"U","division":"PCC","hit_factor":10.3448},{"match_name":"WSPS JUNE 2017 USPSA MATCH","match_date":"2017-06-17","stage_classifiercode":"06-10","member_number":"TY85668","first_name":"SCOTT","last_name":"APPOLDT","classification":"B","division":"PCC","hit_factor":10.3093},{"match_name":"APS August 1st Monthly USPSA Match  Classifier Match","match_date":"2021-08-01","stage_classifiercode":"06-10","member_number":"A130969","first_name":"JOHN","last_name":"RAMIREZ","classification":"C","division":"PCC","hit_factor":10.3093},{"match_name":"OREGON TCGC CC02 USPSA NOV 21 2021","match_date":"2021-11-21","stage_classifiercode":"06-10","member_number":"A102894","first_name":"COBRA","last_name":"JACK","classification":"G","division":"PCC","hit_factor":10.3093},{"match_name":"ORSA USPSA Classifier Side  Match Feb 2017","match_date":"2017-02-18","stage_classifiercode":"06-10","member_number":"A93869","first_name":"MIKE","last_name":"GREEN","classification":"U","division":"PCC","hit_factor":10.3093},{"match_name":"SLPSA Jan USPSA match 1","match_date":"2020-01-11","stage_classifiercode":"06-10","member_number":"A74550","first_name":"KIRBY","last_name":"LUNT","classification":"A","division":"PCC","hit_factor":10.3093},{"match_name":"LCSA USPSA May 2017","match_date":"2017-05-13","stage_classifiercode":"06-10","member_number":"ty81249","first_name":"BRIAN","last_name":"MILLER","classification":"B","division":"PCC","hit_factor":10.274},{"match_name":"OFGC USPSA Match 11-18-17","match_date":"2017-11-18","stage_classifiercode":"06-10","member_number":"TY94217","first_name":"DUSTIN","last_name":"CHAMBERLAIN","classification":"B","division":"PCC","hit_factor":10.274},{"match_name":"Pioneer Action Shooters USPSA 5-23-21 Special Classifer","match_date":"2021-05-23","stage_classifiercode":"06-10","member_number":"L2187","first_name":"ALLEN","last_name":"LAU","classification":"M","division":"PCC","hit_factor":10.274},{"match_name":"LBAS 170819","match_date":"2017-08-19","stage_classifiercode":"06-10","member_number":"L2757","first_name":"RICK","last_name":"PUNU","classification":"M","division":"PCC","hit_factor":10.274},{"match_name":"CCPL - June 2021","match_date":"2021-06-19","stage_classifiercode":"06-10","member_number":"TY92969","first_name":"COREY","last_name":"SCHEEL","classification":"G","division":"PCC","hit_factor":10.2389},{"match_name":"Paul Bunyan April 7th-8th All Classifier Match NW01","match_date":"2018-04-07","stage_classifiercode":"06-10","member_number":"Ty100358","first_name":"KELLY","last_name":"BENNETT","classification":"B","division":"PCC","hit_factor":10.2041},{"match_name":"GRPC USPSA CINCO DE MAYO","match_date":"2018-05-06","stage_classifiercode":"06-10","member_number":"TY86420","first_name":"CHARLES","last_name":"BURTON","classification":"A","division":"PCC","hit_factor":10.2041},{"match_name":"MPPL 20200301","match_date":"2020-03-01","stage_classifiercode":"06-10","member_number":"L4313","first_name":"ART","last_name":"RIVERA","classification":"C","division":"PCC","hit_factor":10.2041},{"match_name":"DWB - Deadwood Boys USPSA 19 January 2020","match_date":"2020-01-19","stage_classifiercode":"06-10","member_number":"A83673","first_name":"REGGIE","last_name":"CATANYAG","classification":"D","division":"PCC","hit_factor":10.1695},{"match_name":"CCPL - June 2021","match_date":"2021-06-19","stage_classifiercode":"06-10","member_number":"A107915","first_name":"KYLE","last_name":"KONOPA","classification":"M","division":"PCC","hit_factor":10.1351},{"match_name":"December 2017 CAS USPSA","match_date":"2017-12-03","stage_classifiercode":"06-10","member_number":"A72544","first_name":"JASON","last_name":"WELCH","classification":"U","division":"PCC","hit_factor":10.1351},{"match_name":"ACPSA March 2017","match_date":"2017-03-25","stage_classifiercode":"06-10","member_number":"A73891","first_name":"TOM","last_name":"CRAWFORD","classification":"A","division":"PCC","hit_factor":10.101},{"match_name":"OFGC USPSA Match 11-18-17","match_date":"2017-11-18","stage_classifiercode":"06-10","member_number":"TY89171","first_name":"AUSTIN KYLE","last_name":"CHAMBERLAIN","classification":"A","division":"PCC","hit_factor":10.101},{"match_name":"DSS - USPSA 18-08-12","match_date":"2018-08-12","stage_classifiercode":"06-10","member_number":"A83704","first_name":"SCOTT","last_name":"BEEBE","classification":"\"\"","division":"PCC","hit_factor":10.101},{"match_name":"WSRC USPSA 7-21/22-2018","match_date":"2018-07-21","stage_classifiercode":"06-10","member_number":"A67446","first_name":"DANIEL","last_name":"SPRAUL","classification":"C","division":"PCC","hit_factor":10.0671},{"match_name":"Gem City Gun Club 9-1 and 9-2-2018","match_date":"2018-09-01","stage_classifiercode":"06-10","member_number":"A108817","first_name":"AARON","last_name":"JOHNSON","classification":"U","division":"PCC","hit_factor":10.0671},{"match_name":"7a Fecha USPSA","match_date":"2020-11-29","stage_classifiercode":"06-10","member_number":"A123317","first_name":"RORY","last_name":"CRAWFORD","classification":"U","division":"PCC","hit_factor":10.0671},{"match_name":"GRPC USPSA DO YOU FEEL LUCKY?","match_date":"2021-03-07","stage_classifiercode":"06-10","member_number":"A81745","first_name":"AJ","last_name":"JACKSON","classification":"A","division":"PCC","hit_factor":10.0671},{"match_name":"CBS March USPSA Steel Match","match_date":"2021-03-07","stage_classifiercode":"06-10","member_number":"L3576","first_name":"TY","last_name":"GENTRY","classification":"M","division":"PCC","hit_factor":10.0671},{"match_name":"SWGC USPSA Pistol Match - December 2018","match_date":"2018-12-01","stage_classifiercode":"06-10","member_number":"TY65342","first_name":"CARLOS","last_name":"GIBSON","classification":"U","division":"PCC","hit_factor":10.0334},{"match_name":"DWB - Deadwood Boys USPSA 19 January 2020","match_date":"2020-01-19","stage_classifiercode":"06-10","member_number":"ty98135","first_name":"PHILLIP","last_name":"HOANG","classification":"B","division":"PCC","hit_factor":10},{"match_name":"APS August 1st Monthly USPSA Match  Classifier Match","match_date":"2021-08-01","stage_classifiercode":"06-10","member_number":"A127606","first_name":"HERNAN","last_name":"DELGADO","classification":"M","division":"PCC","hit_factor":9.9338},{"match_name":"LCSA USPSA May 2017","match_date":"2017-05-13","stage_classifiercode":"06-10","member_number":"A92969","first_name":"COREY","last_name":"SCHEEL","classification":"B","division":"PCC","hit_factor":9.8684},{"match_name":"Nampa USPSA July 31st 2021","match_date":"2021-07-31","stage_classifiercode":"06-10","member_number":"FY82308","first_name":"CURT","last_name":"BERGER","classification":"A","division":"PCC","hit_factor":9.8684},{"match_name":"Shadow Hawk Defense USPSA SPECIAL CLASSIFIER","match_date":"2021-11-11","stage_classifiercode":"06-10","member_number":"Ty83821","first_name":"DEREK","last_name":"EINSIG","classification":"M","division":"PCC","hit_factor":9.8684},{"match_name":"Space Coast Practical Shooters","match_date":"2018-06-02","stage_classifiercode":"06-10","member_number":"A21361","first_name":"JIMMY","last_name":"OWENS","classification":"G","division":"PCC","hit_factor":9.8684},{"match_name":"Richmond March 6-2015 USPSA Pistol Match","match_date":"2016-03-06","stage_classifiercode":"06-10","member_number":"A75591","first_name":"JONATHAN","last_name":"JUNG","classification":"U","division":"PCC","hit_factor":9.8684},{"match_name":"Shadow Hawk Defense USPSA - Aug","match_date":"2021-08-14","stage_classifiercode":"06-10","member_number":"A72727","first_name":"GREG","last_name":"JONES","classification":"M","division":"PCC","hit_factor":9.8361},{"match_name":"Shadow Hawk Defense USPSA SPECIAL CLASSIFIER","match_date":"2021-11-11","stage_classifiercode":"06-10","member_number":"A117088","first_name":"DEREK","last_name":"WILLIAMS","classification":"B","division":"PCC","hit_factor":9.8361},{"match_name":"ORSA USPSA Classifier Side  Match Feb 2017","match_date":"2017-02-18","stage_classifiercode":"06-10","member_number":"A100109","first_name":"FAUSTO","last_name":"VACA","classification":"U","division":"PCC","hit_factor":9.772},{"match_name":"GRPC USPSA CINCO DE MAYO","match_date":"2018-05-06","stage_classifiercode":"06-10","member_number":"A94852","first_name":"RANDY","last_name":"GOODNEY","classification":"M","division":"PCC","hit_factor":9.7403},{"match_name":"GRPC USPSA CINCO DE MAYO","match_date":"2018-05-06","stage_classifiercode":"06-10","member_number":"A87497","first_name":"ERIC","last_name":"CASTILLO","classification":"M","division":"PCC","hit_factor":9.7087},{"match_name":"Benton Gun Club-USPSA April 2017 Classifier","match_date":"2017-04-23","stage_classifiercode":"06-10","member_number":"A56013","first_name":"RUSTY","last_name":"HUBBARD","classification":"U","division":"PCC","hit_factor":9.7087},{"match_name":"Richmond Hot Shots September 1st-2nd 2018 USPSA Pistol Match","match_date":"2018-09-01","stage_classifiercode":"06-10","member_number":"\"\"","first_name":"EDWIN","last_name":"CHANG","classification":"B","division":"PCC","hit_factor":9.7087},{"match_name":"FBURG USPSA November 2021","match_date":"2021-11-07","stage_classifiercode":"06-10","member_number":"TY51119","first_name":"CHRIS","last_name":"MOLNAR","classification":"M","division":"PCC","hit_factor":9.7087},{"match_name":"CAPS 8-28-2021","match_date":"2021-08-28","stage_classifiercode":"06-10","member_number":"A64300","first_name":"JOHN","last_name":"COOK","classification":"X","division":"PCC","hit_factor":9.6774},{"match_name":"FBURG USPSA November 2021","match_date":"2021-11-07","stage_classifiercode":"06-10","member_number":"A77365","first_name":"ANDREW","last_name":"WEMLINGER","classification":"U","division":"PCC","hit_factor":9.6774},{"match_name":"NCPS USPSA Handgun Match March 25 2018z","match_date":"2018-03-25","stage_classifiercode":"06-10","member_number":"TY79621","first_name":"STEPHEN","last_name":"COLLEN","classification":"A","division":"PCC","hit_factor":9.6774},{"match_name":"FLPSA MN14 USPSA April 26 2018","match_date":"2018-04-26","stage_classifiercode":"06-10","member_number":"A86548","first_name":"JOSH","last_name":"EERNISSE","classification":"M","division":"PCC","hit_factor":9.6774},{"match_name":"6ta Fecha USPSA","match_date":"2018-06-24","stage_classifiercode":"06-10","member_number":"F109950","first_name":"FRANCISCO","last_name":"RODRIGUEZ-DIAZ","classification":"U","division":"PCC","hit_factor":9.6463},{"match_name":"Nisa April","match_date":"2021-04-25","stage_classifiercode":"06-10","member_number":"ty73221","first_name":"JAY","last_name":"HOLLINGSWORTH","classification":"B","division":"PCC","hit_factor":9.6154},{"match_name":"SWGC USPSA Pistol Match - December 2018","match_date":"2018-12-01","stage_classifiercode":"06-10","member_number":"TY68347","first_name":"MIKE","last_name":"VALENTINE","classification":"U","division":"PCC","hit_factor":9.6154},{"match_name":"IPSC93 April 2020","match_date":"2020-04-14","stage_classifiercode":"06-10","member_number":"TY51119","first_name":"CHRIS","last_name":"MOLNAR","classification":"U","division":"PCC","hit_factor":9.6154},{"match_name":"LCSC Linden USPSA 120918","match_date":"2018-12-09","stage_classifiercode":"06-10","member_number":"Ty88773","first_name":"EPHRAIM","last_name":"SAN FELIPE","classification":"A","division":"PCC","hit_factor":9.6154},{"match_name":"PTPC November 4th  USPSA Match","match_date":"2018-11-04","stage_classifiercode":"06-10","member_number":"A77281","first_name":"BILL","last_name":"LEWIS","classification":"U","division":"PCC","hit_factor":9.5847},{"match_name":"PMSC USPSA JULY 2018","match_date":"2018-07-01","stage_classifiercode":"06-10","member_number":"TY42401","first_name":"KEVIN","last_name":"BLAKE","classification":"B","division":"PCC","hit_factor":9.5847},{"match_name":"WGC June 2018 USPSA","match_date":"2018-06-10","stage_classifiercode":"06-10","member_number":"TY50501","first_name":"BERNIE","last_name":"MCHUGH","classification":"M","division":"PCC","hit_factor":9.5847},{"match_name":"Shadow Hawk Defense USPSA SPECIAL CLASSIFIER","match_date":"2021-11-11","stage_classifiercode":"06-10","member_number":"TY109443","first_name":"JASON","last_name":"TAJIMA","classification":"A","division":"PCC","hit_factor":9.5541},{"match_name":"RBGC USPSA 2021-8-28","match_date":"2021-08-28","stage_classifiercode":"06-10","member_number":"A124603","first_name":"SCOTT","last_name":"PARMITER","classification":"A","division":"PCC","hit_factor":9.5541},{"match_name":"Nampa USPSA November 7th 2020","match_date":"2020-11-07","stage_classifiercode":"06-10","member_number":"TY124034","first_name":"LYNN","last_name":"SORENSON","classification":"B","division":"PCC","hit_factor":9.5541},{"match_name":"SWGC USPSA Pistol Match - December 2018","match_date":"2018-12-01","stage_classifiercode":"06-10","member_number":"A59220","first_name":"LARRY","last_name":"TALBOTT","classification":"B","division":"PCC","hit_factor":9.5238},{"match_name":"MPPL 20200301","match_date":"2020-03-01","stage_classifiercode":"06-10","member_number":"A112814","first_name":"JOHN MARK","last_name":"GUILLERMO","classification":"B","division":"PCC","hit_factor":9.5238},{"match_name":"Shadow Hawk Defense USPSA SPECIAL CLASSIFIER","match_date":"2021-11-11","stage_classifiercode":"06-10","member_number":"ty49476","first_name":"NORM","last_name":"DIFFENDERFER","classification":"U","division":"PCC","hit_factor":9.5238},{"match_name":"AIPS Weekly USPSA 21 August 2018","match_date":"2018-08-21","stage_classifiercode":"06-10","member_number":"Fy77740","first_name":"KELLY","last_name":"CHRISTIANS","classification":"B","division":"PCC","hit_factor":9.5238},{"match_name":"CFRPC November USPSA","match_date":"2018-11-18","stage_classifiercode":"06-10","member_number":"\"\"","first_name":"PAUL","last_name":"WHITACRE","classification":"U","division":"PCC","hit_factor":9.5238},{"match_name":"EAGC March 2021 USPSA Pistol Match","match_date":"2021-03-21","stage_classifiercode":"06-10","member_number":"A97977","first_name":"MARK","last_name":"VAN NORMAN","classification":"B","division":"PCC","hit_factor":9.4937},{"match_name":"CCPL 12112016","match_date":"2016-12-11","stage_classifiercode":"06-10","member_number":"TY40865","first_name":"STEVE","last_name":"PORTER","classification":"U","division":"PCC","hit_factor":9.4937},{"match_name":"WSPS JUNE 2017 USPSA MATCH","match_date":"2017-06-17","stage_classifiercode":"06-10","member_number":"A98881","first_name":"JIM","last_name":"COOPER","classification":"B","division":"PCC","hit_factor":9.4044},{"match_name":"WGC June 2018 USPSA","match_date":"2018-06-10","stage_classifiercode":"06-10","member_number":"L3696","first_name":"ROBERT","last_name":"HALSELL","classification":"B","division":"PCC","hit_factor":9.4044},{"match_name":"Pioneer Action Shooters USPSA 5-23-21 Special Classifer","match_date":"2021-05-23","stage_classifiercode":"06-10","member_number":"TY76519","first_name":"BRIAN","last_name":"CAIRA","classification":"A","division":"PCC","hit_factor":9.4044},{"match_name":"Fairfax PS USPSA September 2016","match_date":"2016-09-20","stage_classifiercode":"06-10","member_number":"TY83821","first_name":"DEREK","last_name":"EINSIG","classification":"C","division":"PCC","hit_factor":9.4044},{"match_name":"Hopkinton August 2016 ","match_date":"2016-08-06","stage_classifiercode":"06-10","member_number":"TY76424","first_name":"HARRISON","last_name":"SCHMIDT","classification":"U","division":"PCC","hit_factor":9.375},{"match_name":"Custer Uspsa December","match_date":"2018-12-02","stage_classifiercode":"06-10","member_number":"A28558","first_name":"MIKE","last_name":"LEANDER","classification":"M","division":"PCC","hit_factor":9.3458},{"match_name":"Sage USPSA June 17 2018","match_date":"2018-06-17","stage_classifiercode":"06-10","member_number":"A79733","first_name":"SCOTT","last_name":"MAWSON","classification":"GM","division":"PCC","hit_factor":9.3458},{"match_name":"CCPL 12112016","match_date":"2016-12-11","stage_classifiercode":"06-10","member_number":"A84240","first_name":"MIKE","last_name":"KENNEDY","classification":"U","division":"PCC","hit_factor":9.3458},{"match_name":"GRPC USPSA CINCO DE MAYO","match_date":"2018-05-06","stage_classifiercode":"06-10","member_number":"TY40226","first_name":"BRIAN","last_name":"WHELIHAN","classification":"A","division":"PCC","hit_factor":9.3168},{"match_name":"ORSA USPSA October 2020","match_date":"2020-10-17","stage_classifiercode":"06-10","member_number":"A102163","first_name":"JOHNATHON","last_name":"WARD","classification":"M","division":"PCC","hit_factor":9.3168},{"match_name":"FBURG June 2018 Level 1 USPSA","match_date":"2018-06-02","stage_classifiercode":"06-10","member_number":"TY83821","first_name":"DEREK","last_name":"EINSIG","classification":"A","division":"PCC","hit_factor":9.2593},{"match_name":"WSPS JUNE 2017 USPSA MATCH","match_date":"2017-06-17","stage_classifiercode":"06-10","member_number":"TY99410","first_name":"LOU","last_name":"LEVY","classification":"B","division":"PCC","hit_factor":9.2593},{"match_name":"LCSA USPSA May 2017","match_date":"2017-05-13","stage_classifiercode":"06-10","member_number":"A62841","first_name":"THOMAS","last_name":"MCDEVITT","classification":"B","division":"PCC","hit_factor":9.2593},{"match_name":"LBAS170429 Spray-N-Pray Classifier Match","match_date":"2017-04-29","stage_classifiercode":"06-10","member_number":"FY60591","first_name":"LAWRENCE","last_name":"MATTHEWS","classification":"U","division":"PCC","hit_factor":9.2593},{"match_name":"Maine Practical Shooters October 2018","match_date":"2018-10-14","stage_classifiercode":"06-10","member_number":"A98632","first_name":"ZACHARY","last_name":"GREENIER","classification":"U","division":"PCC","hit_factor":9.2308},{"match_name":"HRRB 12-01-2018","match_date":"2018-12-01","stage_classifiercode":"06-10","member_number":"FY61621","first_name":"DERICK","last_name":"HIPOL","classification":"U","division":"PCC","hit_factor":9.2025},{"match_name":"SWGC USPSA Pistol Match - March 2020","match_date":"2020-03-07","stage_classifiercode":"06-10","member_number":"A79827","first_name":"DAVID","last_name":"LANCASTER","classification":"B","division":"PCC","hit_factor":9.2025},{"match_name":"LdF USPSA Match July 11 2021","match_date":"2021-07-11","stage_classifiercode":"06-10","member_number":"A99955","first_name":"RAY","last_name":"PALACIO","classification":"U","division":"PCC","hit_factor":9.1743},{"match_name":"MPPL 20200301","match_date":"2020-03-01","stage_classifiercode":"06-10","member_number":"TY98598","first_name":"MARK","last_name":"PAZ","classification":"U","division":"PCC","hit_factor":9.1743},{"match_name":"WSPS OCTOBER 2018 USPSA MATCH","match_date":"2018-10-20","stage_classifiercode":"06-10","member_number":"A81524","first_name":"TONY","last_name":"ROSENZWEIG","classification":"B","division":"PCC","hit_factor":9.1743},{"match_name":"CIPSC Havana May USPSA","match_date":"2018-05-12","stage_classifiercode":"06-10","member_number":"TY68673","first_name":"NOEL","last_name":"ZARZA","classification":"A","division":"PCC","hit_factor":9.1463414634146},{"match_name":"Fairfax PS USPSA July 2017","match_date":"2017-07-25","stage_classifiercode":"06-10","member_number":"A98777","first_name":"BRANDON","last_name":"HIGBEE","classification":"A","division":"PCC","hit_factor":9.1463},{"match_name":"RangeMasters 9-7-2017","match_date":"2017-09-07","stage_classifiercode":"06-10","member_number":"A87497","first_name":"ERIC","last_name":"CASTILLO","classification":"M","division":"PCC","hit_factor":9.1463},{"match_name":"FBURG March 2021 Level I USPSA ","match_date":"2021-03-06","stage_classifiercode":"06-10","member_number":"TY59220","first_name":"LARRY","last_name":"TALBOTT","classification":"A","division":"PCC","hit_factor":9.1463},{"match_name":"Shoot GTR Monthly USPSA","match_date":"2018-01-07","stage_classifiercode":"06-10","member_number":"A73910","first_name":"JEREMY","last_name":"LIGHTNER","classification":"G","division":"PCC","hit_factor":9.1185},{"match_name":"LCSC Linden USPSA 120918","match_date":"2018-12-09","stage_classifiercode":"06-10","member_number":"A51928","first_name":"CESAR","last_name":"MATA","classification":"G","division":"PCC","hit_factor":9.1185},{"match_name":"Shoot GTR Tuesday USPSA","match_date":"2017-08-08","stage_classifiercode":"06-10","member_number":"A73910","first_name":"JEREMY","last_name":"LIGHTNER","classification":"M","division":"PCC","hit_factor":9.0909},{"match_name":"Pioneer Action Shooters USPSA 5-23-21 Special Classifer","match_date":"2021-05-23","stage_classifiercode":"06-10","member_number":"A104656","first_name":"CRAIG","last_name":"TRAHAN","classification":"A","division":"PCC","hit_factor":9.0909},{"match_name":"Eagles Nest October 16th 2016","match_date":"2016-10-16","stage_classifiercode":"06-10","member_number":"TY81249","first_name":"BRIAN","last_name":"MILLER","classification":"U","division":"PCC","hit_factor":9.0909},{"match_name":"RCPS USPSA 12-12 All Stages","match_date":"2020-12-12","stage_classifiercode":"06-10","member_number":"TY108549","first_name":"MICHAEL","last_name":"COLE","classification":"M","division":"PCC","hit_factor":9.0634},{"match_name":"Hardcore Palooza ISPS DEC 18 2016  ","match_date":"2016-12-18","stage_classifiercode":"06-10","member_number":"L3972","first_name":"EVANS","last_name":"KUO","classification":"B","division":"PCC","hit_factor":9.0634},{"match_name":"ORSA USPSA October 2020","match_date":"2020-10-17","stage_classifiercode":"06-10","member_number":"A121668","first_name":"RYAN","last_name":"CAMPBELL","classification":"M","division":"PCC","hit_factor":9.0634},{"match_name":"Shasta Shooters August  2018","match_date":"2018-08-11","stage_classifiercode":"06-10","member_number":"A100575","first_name":"SCOTT","last_name":"JACKSON","classification":"M","division":"PCC","hit_factor":9.0361},{"match_name":"Nampa USPSA March 15th","match_date":"2020-03-15","stage_classifiercode":"06-10","member_number":"TY91986","first_name":"TRAVIS","last_name":"DEMARAY","classification":"A","division":"PCC","hit_factor":9.009},{"match_name":"RBGC USPSA 2021-8-28","match_date":"2021-08-28","stage_classifiercode":"06-10","member_number":"A132539","first_name":"JUSTIN","last_name":"MANGLITZ","classification":"U","division":"PCC","hit_factor":8.982},{"match_name":"LBAS170429 Spray-N-Pray Classifier Match","match_date":"2017-04-29","stage_classifiercode":"06-10","member_number":"A54861","first_name":"DENNIS","last_name":"WALKER","classification":"U","division":"PCC","hit_factor":8.982},{"match_name":"2020-03-07 USPSA at Phoenix Rod and Gun Club","match_date":"2020-03-07","stage_classifiercode":"06-10","member_number":"TY28855","first_name":"PHILLIP","last_name":"GALLEGOS","classification":"B","division":"PCC","hit_factor":8.9552},{"match_name":"EWPSA 2021-08","match_date":"2021-08-15","stage_classifiercode":"06-10","member_number":"L4822","first_name":"ANN","last_name":"BLOSSER","classification":"M","division":"PCC","hit_factor":8.9552},{"match_name":"Space Coast Practical Shooters","match_date":"2018-06-02","stage_classifiercode":"06-10","member_number":"A69150","first_name":"DERRICK","last_name":"CHEN-LUKE","classification":"A","division":"PCC","hit_factor":8.9552},{"match_name":"Hardcore Palooza ISPS DEC 18 2016  ","match_date":"2016-12-18","stage_classifiercode":"06-10","member_number":"TY85172","first_name":"MIKE","last_name":"O'LEARY","classification":"A","division":"PCC","hit_factor":8.9286},{"match_name":"Gem City Gun Club 9-1 and 9-2-2018","match_date":"2018-09-01","stage_classifiercode":"06-10","member_number":"A10052","first_name":"PAT","last_name":"EAKIN","classification":"U","division":"PCC","hit_factor":8.9286},{"match_name":"Idaho ISPS January 6th 2018","match_date":"2018-01-06","stage_classifiercode":"06-10","member_number":"A79280","first_name":"ERIK","last_name":"SMITH","classification":"A","division":"PCC","hit_factor":8.9286},{"match_name":"PCWC USPSA  9 26 2020","match_date":"2020-09-26","stage_classifiercode":"06-10","member_number":"A104834","first_name":"LOGAN","last_name":"SAUNDERS","classification":"A","division":"PCC","hit_factor":8.9286},{"match_name":"Southern Arizona Practical Shooters 09_01_18","match_date":"2018-09-01","stage_classifiercode":"06-10","member_number":"TY65434","first_name":"GABE","last_name":"CARMEN","classification":"B","division":"PCC","hit_factor":8.9286},{"match_name":"Collin County USPSA 11-28-2021","match_date":"2021-11-28","stage_classifiercode":"06-10","member_number":"TY12021","first_name":"RAGS","last_name":"CONNAWAY","classification":"B","division":"PCC","hit_factor":8.9286},{"match_name":"ORSA USPSA October 2020","match_date":"2020-10-17","stage_classifiercode":"06-10","member_number":"A105258","first_name":"BEN","last_name":"CORRY","classification":"B","division":"PCC","hit_factor":8.9286},{"match_name":"Briar Rabbit October2017","match_date":"2017-10-22","stage_classifiercode":"06-10","member_number":"A96708","first_name":"YURIY","last_name":"BORZENKO","classification":"A","division":"PCC","hit_factor":8.9021},{"match_name":"Shoot GTR Monthly USPSA","match_date":"2018-01-07","stage_classifiercode":"06-10","member_number":"A86924","first_name":"MICHAEL","last_name":"STACK","classification":"M","division":"PCC","hit_factor":8.9021},{"match_name":"Shasta Shooters 2021 Feb","match_date":"2021-02-13","stage_classifiercode":"06-10","member_number":"A130897","first_name":"ATHAN","last_name":"TONKIN","classification":"D","division":"PCC","hit_factor":8.9021},{"match_name":"LBAS170429 Spray-N-Pray Classifier Match","match_date":"2017-04-29","stage_classifiercode":"06-10","member_number":"L2757","first_name":"RICK","last_name":"PUNU","classification":"U","division":"PCC","hit_factor":8.9021},{"match_name":"LBAS170429 Spray-N-Pray Classifier Match","match_date":"2017-04-29","stage_classifiercode":"06-10","member_number":"TY31924","first_name":"OTIS","last_name":"AUSTIN","classification":"A","division":"PCC","hit_factor":8.9021},{"match_name":"FBURG USPSA November 2021","match_date":"2021-11-07","stage_classifiercode":"06-10","member_number":"L4331","first_name":"BRANDON","last_name":"HIGBEE","classification":"G","division":"PCC","hit_factor":8.9021},{"match_name":"CCPL 04-25-2021","match_date":"2021-04-25","stage_classifiercode":"06-10","member_number":"L4994","first_name":"DAVID-+","last_name":"MAYEDA","classification":"A","division":"PCC","hit_factor":8.8757},{"match_name":"SWGC USPSA Pistol Match - December 2018","match_date":"2018-12-01","stage_classifiercode":"06-10","member_number":"TY83717","first_name":"SCOTT","last_name":"BASS","classification":"U","division":"PCC","hit_factor":8.8757},{"match_name":"Whitewater USPSA 3-18-17","match_date":"2017-03-18","stage_classifiercode":"06-10","member_number":"A30546","first_name":"STEVE","last_name":"BURKE","classification":"X","division":"PCC","hit_factor":8.8757},{"match_name":"RangeMasters 9-7-2017","match_date":"2017-09-07","stage_classifiercode":"06-10","member_number":"A94852","first_name":"RANDY","last_name":"GOODNEY","classification":"A","division":"PCC","hit_factor":8.8757},{"match_name":"Hopkinton August 2016 ","match_date":"2016-08-06","stage_classifiercode":"06-10","member_number":"TY71710","first_name":"PETER","last_name":"DOUGENIK","classification":"U","division":"PCC","hit_factor":8.8757},{"match_name":"Richmond March 6-2015 USPSA Pistol Match","match_date":"2016-03-06","stage_classifiercode":"06-10","member_number":"A79956","first_name":"EDWIN","last_name":"CHANG","classification":"U","division":"PCC","hit_factor":8.8757},{"match_name":"TPS USPSA AT CMP OCT 20 2018","match_date":"2018-10-20","stage_classifiercode":"06-10","member_number":"A104245","first_name":"MATT","last_name":"SCOTT","classification":"B","division":"PCC","hit_factor":8.8496},{"match_name":"WELD ECO09 20180617","match_date":"2018-06-17","stage_classifiercode":"06-10","member_number":"A88944","first_name":"FOREST","last_name":"LATHROP","classification":"B","division":"PCC","hit_factor":8.8496},{"match_name":"Shadow Hawk Defense USPSA SPECIAL CLASSIFIER","match_date":"2021-11-11","stage_classifiercode":"06-10","member_number":"Ty74344","first_name":"LANCE","last_name":"DEHLER","classification":"A","division":"PCC","hit_factor":8.8496},{"match_name":"Shadow Hawk Defense USPSA SPECIAL CLASSIFIER","match_date":"2021-11-11","stage_classifiercode":"06-10","member_number":"FY58086","first_name":"LAURA","last_name":"TORRES-REYES","classification":"C","division":"PCC","hit_factor":8.8496},{"match_name":"EWPSA 2021-08","match_date":"2021-08-15","stage_classifiercode":"06-10","member_number":"Fy82308","first_name":"CURT","last_name":"BERGER","classification":"A","division":"PCC","hit_factor":8.8496},{"match_name":"Richmond Hot Shots September 1st-2nd 2018 USPSA Pistol Match","match_date":"2018-09-01","stage_classifiercode":"06-10","member_number":"\"\"","first_name":"JOSEPH","last_name":"AUSTRIA","classification":"A","division":"PCC","hit_factor":8.8496},{"match_name":"HOPS USPSA 1020018 ","match_date":"2018-10-19","stage_classifiercode":"06-10","member_number":"Ty94217","first_name":"DUSTIN","last_name":"CHAMBERLAIN","classification":"A","division":"PCC","hit_factor":8.8235},{"match_name":"Shadow Hawk Defense USPSA - Aug","match_date":"2021-08-14","stage_classifiercode":"06-10","member_number":"Ty83821","first_name":"DEREK","last_name":"EINSIG","classification":"M","division":"PCC","hit_factor":8.8235},{"match_name":"CSA June 10 2018","match_date":"2018-06-10","stage_classifiercode":"06-10","member_number":"A94826","first_name":"JEREMY","last_name":"BLANKENSHIP","classification":"C","division":"PCC","hit_factor":8.8235},{"match_name":"DWB - Deadwood Boys USPSA 19 January 2020","match_date":"2020-01-19","stage_classifiercode":"06-10","member_number":"A104329","first_name":"DAVID","last_name":"KIKUKAWA","classification":"G","division":"PCC","hit_factor":8.7977},{"match_name":"WSPS JUNE 2017 USPSA MATCH","match_date":"2017-06-17","stage_classifiercode":"06-10","member_number":"TY80612","first_name":"FORREST","last_name":"LYSINGER","classification":"B","division":"PCC","hit_factor":8.7719},{"match_name":"OREGON TCGC CC02 USPSA NOV 21 2021","match_date":"2021-11-21","stage_classifiercode":"06-10","member_number":"L4778","first_name":"TODD","last_name":"SCHLENKER","classification":"A","division":"PCC","hit_factor":8.7719},{"match_name":"Rankin Field Sunday USPSA","match_date":"2018-10-21","stage_classifiercode":"06-10","member_number":"A96473","first_name":"ADAM","last_name":"MUTHWILL","classification":"M","division":"PCC","hit_factor":8.7719},{"match_name":"Rankin Field Sunday USPSA","match_date":"2018-10-21","stage_classifiercode":"06-10","member_number":"A113111","first_name":"CHRIS","last_name":"MIRANDA","classification":"U","division":"PCC","hit_factor":8.7719},{"match_name":"Grandbaggers December 2017","match_date":"2017-12-07","stage_classifiercode":"06-10","member_number":"TY85822","first_name":"MATT","last_name":"WERNER","classification":"B","division":"PCC","hit_factor":8.7719},{"match_name":"WGC WI USPSA Monthly Match 10-21-17","match_date":"2017-10-21","stage_classifiercode":"06-10","member_number":"TY96480","first_name":"KEN","last_name":"SCHMIDTCHEN","classification":"A","division":"PCC","hit_factor":8.7464},{"match_name":"Richmond Hot Shots September 1st-2nd 2018 USPSA Pistol Match","match_date":"2018-09-01","stage_classifiercode":"06-10","member_number":"L2859","first_name":"MARK","last_name":"TURRIN","classification":"U","division":"PCC","hit_factor":8.7464},{"match_name":"SWGC USPSA Pistol Match - December 2018","match_date":"2018-12-01","stage_classifiercode":"06-10","member_number":"A93396","first_name":"MICHAEL","last_name":"COSTLEY","classification":"A","division":"PCC","hit_factor":8.7209},{"match_name":"DWB - Deadwood Boys USPSA 19 January 2020","match_date":"2020-01-19","stage_classifiercode":"06-10","member_number":"TY94923","first_name":"WILSON","last_name":"PARK","classification":"A","division":"PCC","hit_factor":8.7209},{"match_name":"RBGC USPSA 2021-8-28","match_date":"2021-08-28","stage_classifiercode":"06-10","member_number":"A105781","first_name":"JONATHAN","last_name":"MCLEOD","classification":"M","division":"PCC","hit_factor":8.7209},{"match_name":"FBURG March 2021 Level I USPSA ","match_date":"2021-03-06","stage_classifiercode":"06-10","member_number":"A75974","first_name":"DANIEL","last_name":"GOODWIN","classification":"A","division":"PCC","hit_factor":8.7209},{"match_name":"SWGC USPSA Pistol Match - March 2020","match_date":"2020-03-07","stage_classifiercode":"06-10","member_number":"TY59220","first_name":"LARRY","last_name":"TALBOTT","classification":"A","division":"PCC","hit_factor":8.7209},{"match_name":"OSC April USPSA","match_date":"2021-04-18","stage_classifiercode":"06-10","member_number":"Ty112144","first_name":"ALEXANDRO","last_name":"TREVINO","classification":"B","division":"PCC","hit_factor":8.6957},{"match_name":"RBGC USPSA 2021-8-28","match_date":"2021-08-28","stage_classifiercode":"06-10","member_number":"A122859","first_name":"JASON","last_name":"CRAVEN","classification":"U","division":"PCC","hit_factor":8.6957},{"match_name":"EHPSA USPSA 27June 2021","match_date":"2021-06-27","stage_classifiercode":"06-10","member_number":"TY127550","first_name":"JAMES","last_name":"ANDERSON","classification":"A","division":"PCC","hit_factor":8.6705},{"match_name":"FBURG March 2021 Level I USPSA ","match_date":"2021-03-06","stage_classifiercode":"06-10","member_number":"A98613","first_name":"GARY","last_name":"SCHOLL","classification":"B","division":"PCC","hit_factor":8.6705},{"match_name":"NCPS USPSA Handgun Match March 25 2018z","match_date":"2018-03-25","stage_classifiercode":"06-10","member_number":"A101829","first_name":"MARC","last_name":"VETOVITZ","classification":"C","division":"PCC","hit_factor":8.6705},{"match_name":"Shadow Hawk Defense USPSA SPECIAL CLASSIFIER","match_date":"2021-11-11","stage_classifiercode":"06-10","member_number":"TY89708","first_name":"DON","last_name":"BAILEY","classification":"B","division":"PCC","hit_factor":8.6455},{"match_name":"MCPSL Pistol 4-10-2021 (Classifier)","match_date":"2021-04-10","stage_classifiercode":"06-10","member_number":"TY568","first_name":"RICK","last_name":"BYFIELD","classification":"M","division":"PCC","hit_factor":8.6455},{"match_name":"NCPS USPSA Handgun Match March 25 2018z","match_date":"2018-03-25","stage_classifiercode":"06-10","member_number":"TY75971","first_name":"GERARD","last_name":"GARCIA","classification":"U","division":"PCC","hit_factor":8.6455},{"match_name":"AGC_20170507","match_date":"2017-05-07","stage_classifiercode":"06-10","member_number":"A61086","first_name":"CY","last_name":"SOTO","classification":"B","division":"PCC","hit_factor":8.6455},{"match_name":"PTPC November 4th  USPSA Match","match_date":"2018-11-04","stage_classifiercode":"06-10","member_number":"FY57913","first_name":"DIRK","last_name":"SCHLUETER","classification":"B","division":"PCC","hit_factor":8.6207},{"match_name":"LBAS170429 Spray-N-Pray Classifier Match","match_date":"2017-04-29","stage_classifiercode":"06-10","member_number":"A54861","first_name":"DENNIS","last_name":"WALKER","classification":"U","division":"PCC","hit_factor":8.6207},{"match_name":"DSS - USPSA 18-08-12","match_date":"2018-08-12","stage_classifiercode":"06-10","member_number":"A80646","first_name":"BOUNTHAVY","last_name":"SOUNGPRADITH","classification":"A","division":"PCC","hit_factor":8.6207},{"match_name":"EHPSA USPSA 27June 2021","match_date":"2021-06-27","stage_classifiercode":"06-10","member_number":"A74936","first_name":"ROGER","last_name":"ELDER","classification":"B","division":"PCC","hit_factor":8.596},{"match_name":"FBURG USPSA November 2021","match_date":"2021-11-07","stage_classifiercode":"06-10","member_number":"A117088","first_name":"DEREK","last_name":"WILLIAMS","classification":"U","division":"PCC","hit_factor":8.596},{"match_name":"AGC_20170507","match_date":"2017-05-07","stage_classifiercode":"06-10","member_number":"TY74682","first_name":"STERLING","last_name":"SEIFERT","classification":"U","division":"PCC","hit_factor":8.596},{"match_name":"Briar Rabbit October2017","match_date":"2017-10-22","stage_classifiercode":"06-10","member_number":"A103243","first_name":"ALAN","last_name":"PFEUFFER","classification":"U","division":"PCC","hit_factor":8.5714},{"match_name":"TPS USPSA AT CMP OCT 20 2018","match_date":"2018-10-20","stage_classifiercode":"06-10","member_number":"a104668","first_name":"TONY","last_name":"CLECKLER","classification":"B","division":"PCC","hit_factor":8.5714},{"match_name":"LBAS 201017 October Practical Match","match_date":"2020-10-17","stage_classifiercode":"06-10","member_number":"L2757","first_name":"RICK","last_name":"PUNU","classification":"G","division":"PCC","hit_factor":8.5714},{"match_name":"Richmond March 6-2015 USPSA Pistol Match","match_date":"2016-03-06","stage_classifiercode":"06-10","member_number":"\"\"","first_name":"MICHAEL","last_name":"CHING","classification":"U","division":"PCC","hit_factor":8.5714},{"match_name":"MPSA 2020-01-02","match_date":"2021-01-02","stage_classifiercode":"06-10","member_number":"A116937","first_name":"CHRIS","last_name":"SAWLSVILLE","classification":"U","division":"PCC","hit_factor":8.547},{"match_name":"TAS Classifier 2","match_date":"2017-12-10","stage_classifiercode":"06-10","member_number":"TY83061","first_name":"ANDY","last_name":"MARTIN","classification":"U","division":"PCC","hit_factor":8.547},{"match_name":"SAPS Match 3/20/2021","match_date":"2021-03-20","stage_classifiercode":"06-10","member_number":"L4455","first_name":"KEVIN","last_name":"LAMB","classification":"G","division":"PCC","hit_factor":8.547},{"match_name":"YRPA  9/25/16  USPSA Pistol Match","match_date":"2016-09-23","stage_classifiercode":"06-10","member_number":"A69094","first_name":"AARON P","last_name":"LAWS","classification":"A","division":"PCC","hit_factor":8.547},{"match_name":"FBURG June 2017 Level I USPSA ","match_date":"2017-06-03","stage_classifiercode":"06-10","member_number":"TY83360","first_name":"JESSE","last_name":"DOVE","classification":"B","division":"PCC","hit_factor":8.5227},{"match_name":"YMM  IPSC 2018_07_08","match_date":"2018-07-08","stage_classifiercode":"06-10","member_number":"A54861","first_name":"DENNIS","last_name":"WALKER","classification":"\"\"","division":"PCC","hit_factor":8.5227},{"match_name":"YMM  IPSC 2018_07_08","match_date":"2018-07-08","stage_classifiercode":"06-10","member_number":"TY87721","first_name":"JIM","last_name":"TAWZER","classification":"B","division":"PCC","hit_factor":8.5227},{"match_name":"Hosemasters 2nd Sunday August 2017","match_date":"2017-08-13","stage_classifiercode":"06-10","member_number":"A58956","first_name":"RICK","last_name":"KORZEP","classification":"A","division":"PCC","hit_factor":8.5227},{"match_name":"Nampa USPSA July 31st 2021","match_date":"2021-07-31","stage_classifiercode":"06-10","member_number":"TY85724","first_name":"JEFF","last_name":"PACKER","classification":"B","division":"PCC","hit_factor":8.5227},{"match_name":"ORSA USPSA Classifier Side  Match Feb 2017","match_date":"2017-02-18","stage_classifiercode":"06-10","member_number":"TY32342","first_name":"GILBERT","last_name":"PEREZ","classification":"U","division":"PCC","hit_factor":8.5227},{"match_name":"Grandbaggers December 2017","match_date":"2017-12-07","stage_classifiercode":"06-10","member_number":"A22810","first_name":"KERRY","last_name":"PEARSON","classification":"M","division":"PCC","hit_factor":8.5227},{"match_name":"FBURG June 2018 Level 1 USPSA","match_date":"2018-06-02","stage_classifiercode":"06-10","member_number":"FY15413","first_name":"TOM","last_name":"SUIT","classification":"A","division":"PCC","hit_factor":8.4986},{"match_name":"Shadow Hawk Defense USPSA SPECIAL CLASSIFIER","match_date":"2021-11-11","stage_classifiercode":"06-10","member_number":"F137034","first_name":"EUNSOO","last_name":"KIM","classification":"U","division":"PCC","hit_factor":8.4986},{"match_name":"TGC USPSA JANUARY 2018","match_date":"2018-01-20","stage_classifiercode":"06-10","member_number":"L3507","first_name":"AARON","last_name":"MARCO","classification":"M","division":"PCC","hit_factor":8.4746},{"match_name":"SFPC SMTCA","match_date":"2017-04-30","stage_classifiercode":"06-10","member_number":"A98748","first_name":"JAMES","last_name":"BEMBANASTE","classification":"C","division":"PCC","hit_factor":8.4746},{"match_name":"LBAS170429 Spray-N-Pray Classifier Match","match_date":"2017-04-29","stage_classifiercode":"06-10","member_number":"A24066","first_name":"GEORGE","last_name":"MANDES","classification":"B","division":"PCC","hit_factor":8.4746},{"match_name":"Pioneer Action Shooters USPSA 5-23-21 Special Classifer","match_date":"2021-05-23","stage_classifiercode":"06-10","member_number":"A110207","first_name":"RICK","last_name":"MELLINO","classification":"A","division":"PCC","hit_factor":8.4746},{"match_name":"Shoot GTR USPSA 12/13","match_date":"2016-12-13","stage_classifiercode":"06-10","member_number":"A21361","first_name":"JIMMY","last_name":"OWENS","classification":"B","division":"PCC","hit_factor":8.4746},{"match_name":"Shadow Hawk Defense USPSA - Aug","match_date":"2021-08-14","stage_classifiercode":"06-10","member_number":"Ty83360","first_name":"JESSE","last_name":"DOVE","classification":"M","division":"PCC","hit_factor":8.4507},{"match_name":"ARPC USPSA Match 8-26-18","match_date":"2018-08-26","stage_classifiercode":"06-10","member_number":"A67446","first_name":"DANIEL","last_name":"SPRAUL","classification":"B","division":"PCC","hit_factor":8.4507},{"match_name":"OREGON ARPC CC05 USPSA JUNE 10 2017","match_date":"2017-06-10","stage_classifiercode":"06-10","member_number":"TY84121","first_name":"GABOR","last_name":"MAGONY","classification":"A","division":"PCC","hit_factor":8.4507},{"match_name":"APSC USPSA Match 10-07-17","match_date":"2017-10-07","stage_classifiercode":"06-10","member_number":"A83285","first_name":"GARY (PCC)","last_name":"AU","classification":"A","division":"PCC","hit_factor":8.4507},{"match_name":"ISPS JULY 2nd 2016","match_date":"2016-07-02","stage_classifiercode":"06-10","member_number":"TY71343","first_name":"JASON","last_name":"JOHNSTON","classification":"U","division":"PCC","hit_factor":8.427},{"match_name":"Shadow Hawk Defense USPSA - Aug","match_date":"2021-08-14","stage_classifiercode":"06-10","member_number":"A41485","first_name":"DJ","last_name":"VIAR","classification":"B","division":"PCC","hit_factor":8.427},{"match_name":"Quantico QPS QSC USPSA Match 9 APR 2017","match_date":"2017-04-09","stage_classifiercode":"06-10","member_number":"A71480","first_name":"DAVID","last_name":"SCORDY","classification":"U","division":"PCC","hit_factor":8.427},{"match_name":"Richmond Hot Shots July 15-16-2017 USPSA Pistol Match","match_date":"2017-07-15","stage_classifiercode":"06-10","member_number":"A51928","first_name":"CESAR","last_name":"MATA","classification":"A","division":"PCC","hit_factor":8.427},{"match_name":"Oxford OHS05 090521","match_date":"2021-09-05","stage_classifiercode":"06-10","member_number":"Ty103337","first_name":"JAMES","last_name":"SCHNEIDER","classification":"B","division":"PCC","hit_factor":8.427},{"match_name":"OREGON ARPC CC05 USPSA JUNE 10 2017","match_date":"2017-06-10","stage_classifiercode":"06-10","member_number":"A68157","first_name":"DARRELL","last_name":"MONK","classification":"U","division":"PCC","hit_factor":8.427},{"match_name":"OFGC USPSA Match 11-18-17","match_date":"2017-11-18","stage_classifiercode":"06-10","member_number":"A82942","first_name":"DUANE","last_name":"CHRISTENSEN","classification":"C","division":"PCC","hit_factor":8.4034},{"match_name":"Richmond Hot Shots September 1st-2nd 2018 USPSA Pistol Match","match_date":"2018-09-01","stage_classifiercode":"06-10","member_number":"A60621","first_name":"JUN","last_name":"AMPIL","classification":"B","division":"PCC","hit_factor":8.4034},{"match_name":"DSS - USPSA 18-08-12","match_date":"2018-08-12","stage_classifiercode":"06-10","member_number":"L3219","first_name":"CALEB","last_name":"SMITH","classification":"B","division":"PCC","hit_factor":8.4034},{"match_name":"OREGON ARPC CC05 USPSA JUNE 10 2017","match_date":"2017-06-10","stage_classifiercode":"06-10","member_number":"A48925","first_name":"TROY","last_name":"MORROW","classification":"U","division":"PCC","hit_factor":8.4034},{"match_name":"FBURG Flood June 3 2018","match_date":"2018-06-03","stage_classifiercode":"06-10","member_number":"A101917","first_name":"MIA","last_name":"FARINELLI","classification":"C","division":"PCC","hit_factor":8.4034},{"match_name":"Eagles Nest October 16th 2016","match_date":"2016-10-16","stage_classifiercode":"06-10","member_number":"TY81249","first_name":"BRIAN","last_name":"MILLER","classification":"U","division":"PCC","hit_factor":8.4034},{"match_name":"Paul Bunyan April 7th-8th All Classifier Match NW01","match_date":"2018-04-07","stage_classifiercode":"06-10","member_number":"TY106641","first_name":"KEVIN","last_name":"JONES","classification":"U","division":"PCC","hit_factor":8.3799},{"match_name":"Nampa USPSA December 20th 2020","match_date":"2020-12-20","stage_classifiercode":"06-10","member_number":"ty52406","first_name":"GARY","last_name":"CHAN","classification":"M","division":"PCC","hit_factor":8.3799},{"match_name":"NCPS USPSA Handgun Match March 25 2018z","match_date":"2018-03-25","stage_classifiercode":"06-10","member_number":"FY33484","first_name":"CARLOS","last_name":"KATALBAS","classification":"M","division":"PCC","hit_factor":8.3799},{"match_name":"SWGC USPSA Pistol Match - March 2020","match_date":"2020-03-07","stage_classifiercode":"06-10","member_number":"A54296","first_name":"ROBERT","last_name":"BOWLES","classification":"B","division":"PCC","hit_factor":8.3799},{"match_name":"PRPS USPSA Jun  24 2018","match_date":"2018-06-17","stage_classifiercode":"06-10","member_number":"A105451","first_name":"BRANDON","last_name":"SVITAK","classification":"U","division":"PCC","hit_factor":8.3565},{"match_name":"WSPS JUNE 2017 USPSA MATCH","match_date":"2017-06-17","stage_classifiercode":"06-10","member_number":"TY58697","first_name":"GARY","last_name":"PARSONS","classification":"U","division":"PCC","hit_factor":8.3565},{"match_name":"Hosemasters 2nd Sunday August 2017","match_date":"2017-08-13","stage_classifiercode":"06-10","member_number":"TY90353","first_name":"TRAVIS","last_name":"MCCAMISH","classification":"U","division":"PCC","hit_factor":8.3565},{"match_name":"Mrpc Minot All Classifier Match","match_date":"2018-07-21","stage_classifiercode":"06-10","member_number":"A87274","first_name":"MARK","last_name":"PADUA","classification":"C","division":"PCC","hit_factor":8.3565},{"match_name":"FBURG USPSA November 2021","match_date":"2021-11-07","stage_classifiercode":"06-10","member_number":"A93396","first_name":"MICHAEL","last_name":"COSTLEY","classification":"A","division":"PCC","hit_factor":8.3565},{"match_name":"SLPSA Jan USPSA","match_date":"2017-01-21","stage_classifiercode":"06-10","member_number":"L4146","first_name":"CAREY","last_name":"PALMER","classification":"A","division":"PCC","hit_factor":8.3565},{"match_name":"YMM  IPSC 2018_07_08","match_date":"2018-07-08","stage_classifiercode":"06-10","member_number":"FY52259","first_name":"TERRANCE","last_name":"SULLIVAN","classification":"\"\"","division":"PCC","hit_factor":8.3333},{"match_name":"Gem City Gun Club 9-1 and 9-2-2018","match_date":"2018-09-01","stage_classifiercode":"06-10","member_number":"\"\"","first_name":"SCOTT","last_name":"STEVENS","classification":"U","division":"PCC","hit_factor":8.3333},{"match_name":"PCWC USPSA  9 26 2020","match_date":"2020-09-26","stage_classifiercode":"06-10","member_number":"TY78922","first_name":"DON","last_name":"ADAM","classification":"B","division":"PCC","hit_factor":8.3102},{"match_name":"FBURG March 2021 Level I USPSA ","match_date":"2021-03-06","stage_classifiercode":"06-10","member_number":"TY51119","first_name":"CHRIS","last_name":"MOLNAR","classification":"A","division":"PCC","hit_factor":8.3102},{"match_name":"FBURG USPSA November 2021","match_date":"2021-11-07","stage_classifiercode":"06-10","member_number":"TY83821","first_name":"DEREK","last_name":"EINSIG","classification":"M","division":"PCC","hit_factor":8.3102},{"match_name":"Deadwood Boys USPSA All Classifier Match - 29 July 2018","match_date":"2018-07-29","stage_classifiercode":"06-10","member_number":"A100144","first_name":"DEREK","last_name":"HAMILTON","classification":"U","division":"PCC","hit_factor":8.2873},{"match_name":"PCWC USPSA  9 26 2020","match_date":"2020-09-26","stage_classifiercode":"06-10","member_number":"A-63269","first_name":"JAY","last_name":"HAGGARD","classification":"A","division":"PCC","hit_factor":8.2873},{"match_name":"Briar Rabbit October2017","match_date":"2017-10-22","stage_classifiercode":"06-10","member_number":"A101393","first_name":"BRANDON","last_name":"PELLETIER","classification":"C","division":"PCC","hit_factor":8.2645},{"match_name":"Sage Pistol League USPSA May 16 2021","match_date":"2021-05-16","stage_classifiercode":"06-10","member_number":"A130523","first_name":"LANDON","last_name":"ZISSOS","classification":"U","division":"PCC","hit_factor":8.2645},{"match_name":"EWPSA 2021-08","match_date":"2021-08-15","stage_classifiercode":"06-10","member_number":"Ty57282","first_name":"JOHN","last_name":"MORGAN","classification":"M","division":"PCC","hit_factor":8.2645},{"match_name":"Richmond Hot Shots September 1st-2nd 2018 USPSA Pistol Match","match_date":"2018-09-01","stage_classifiercode":"06-10","member_number":"A95231","first_name":"ERIK","last_name":"MARSHALL","classification":"B","division":"PCC","hit_factor":8.2645},{"match_name":"Springfield Tactical Shooters 09-07-2017","match_date":"2017-09-07","stage_classifiercode":"06-10","member_number":"FY83614","first_name":"GARY","last_name":"GRAY","classification":"B","division":"PCC","hit_factor":8.2418},{"match_name":"Collin County USPSA 11-28-2021","match_date":"2021-11-28","stage_classifiercode":"06-10","member_number":"L4294","first_name":"ALAN","last_name":"JENKINS","classification":"M","division":"PCC","hit_factor":8.2418},{"match_name":"Minnetonka Game and Fish Special classifier","match_date":"2017-10-07","stage_classifiercode":"06-10","member_number":"TY-94384","first_name":"ROBERT","last_name":"UPEGUI","classification":"B","division":"PCC","hit_factor":8.2192},{"match_name":"ARPC USPSA Match 8-26-18","match_date":"2018-08-26","stage_classifiercode":"06-10","member_number":"A32149","first_name":"LASZLO","last_name":"SZABO","classification":"B","division":"PCC","hit_factor":8.2192},{"match_name":"Salt City practical shooting league 'all classifier match'","match_date":"2020-08-30","stage_classifiercode":"06-10","member_number":"A48869","first_name":"BRIAN","last_name":"GEE","classification":"U","division":"PCC","hit_factor":8.1967},{"match_name":"Deadwood Boys USPSA All Classifier Match - 29 July 2018","match_date":"2018-07-29","stage_classifiercode":"06-10","member_number":"A96044","first_name":"SEAN","last_name":"HENSLEY","classification":"B","division":"PCC","hit_factor":8.1967},{"match_name":"Deadwood Boys USPSA All Classifier Match - 29 July 2018","match_date":"2018-07-29","stage_classifiercode":"06-10","member_number":"A110876","first_name":"MIKE","last_name":"NGUYEN","classification":"U","division":"PCC","hit_factor":8.1967},{"match_name":"OFGC USPSA Match 11-18-17","match_date":"2017-11-18","stage_classifiercode":"06-10","member_number":"A96267","first_name":"MYLEE","last_name":"CHAMBERLAIN","classification":"U","division":"PCC","hit_factor":8.1967},{"match_name":"CCAS December 2017 Special Classifier","match_date":"2017-12-16","stage_classifiercode":"06-10","member_number":"TY71940","first_name":"DEREK","last_name":"DRISCOLL","classification":"A","division":"PCC","hit_factor":8.1967},{"match_name":"LBAS 170819","match_date":"2017-08-19","stage_classifiercode":"06-10","member_number":"L4264","first_name":"BILL","last_name":"MUNGER","classification":"M","division":"PCC","hit_factor":8.1967},{"match_name":"SWGC USPSA Pistol Match - December 2018","match_date":"2018-12-01","stage_classifiercode":"06-10","member_number":"A102011","first_name":"STEVE","last_name":"LUCK","classification":"A","division":"PCC","hit_factor":8.1744},{"match_name":"Shadow Hawk Defense USPSA - Aug","match_date":"2021-08-14","stage_classifiercode":"06-10","member_number":"Ty74344","first_name":"LANCE","last_name":"DEHLER","classification":"M","division":"PCC","hit_factor":8.1744},{"match_name":"PMSC USPSA JULY 2018","match_date":"2018-07-01","stage_classifiercode":"06-10","member_number":"TY81368","first_name":"JEFFREY","last_name":"KILLINGER","classification":"C","division":"PCC","hit_factor":8.1744},{"match_name":"WSPS JUNE 2017 USPSA MATCH","match_date":"2017-06-17","stage_classifiercode":"06-10","member_number":"A102522","first_name":"GARY","last_name":"GUILMETTE","classification":"U","division":"PCC","hit_factor":8.1744},{"match_name":"Pioneer Action Shooters USPSA 5-23-21 Special Classifer","match_date":"2021-05-23","stage_classifiercode":"06-10","member_number":"TY96968","first_name":"AARON","last_name":"PACYNA","classification":"C","division":"PCC","hit_factor":8.1744},{"match_name":"NOCPC May 2018","match_date":"2018-05-13","stage_classifiercode":"06-10","member_number":"\"\"","first_name":"PETER","last_name":"HAYES","classification":"U","division":"PCC","hit_factor":8.1744},{"match_name":"SLPSA Jan USPSA match 1","match_date":"2020-01-11","stage_classifiercode":"06-10","member_number":"TY43912","first_name":"RANDY","last_name":"STEVENS","classification":"B","division":"PCC","hit_factor":8.1744},{"match_name":"LBAS 170819","match_date":"2017-08-19","stage_classifiercode":"06-10","member_number":"L4264","first_name":"BILL","last_name":"MUNGER","classification":"M","division":"PCC","hit_factor":8.1744},{"match_name":"EWPSA 2018-01","match_date":"2018-01-21","stage_classifiercode":"06-10","member_number":"TY49461","first_name":"DAVID","last_name":"BLOSSER","classification":"M","division":"PCC","hit_factor":8.1744},{"match_name":"TPS USPSA -  August 2017 - Talon Range","match_date":"2017-08-05","stage_classifiercode":"06-10","member_number":"Fy69055","first_name":"YANCIE","last_name":"BRANNEN","classification":"U","division":"PCC","hit_factor":8.1744},{"match_name":"OFGC USPSA Match 11-18-17","match_date":"2017-11-18","stage_classifiercode":"06-10","member_number":"A99663","first_name":"MIKE","last_name":"SPEAR","classification":"B","division":"PCC","hit_factor":8.1522},{"match_name":"MISS Toys For Tots 12-16-20","match_date":"2020-12-16","stage_classifiercode":"06-10","member_number":"A124027","first_name":"HEATH","last_name":"KRIER","classification":"U","division":"PCC","hit_factor":8.1522},{"match_name":"Gem City Gun Club 4-7 and 4-8-18","match_date":"2018-04-07","stage_classifiercode":"06-10","member_number":"A55021","first_name":"GARY","last_name":"SCHLICHT","classification":"B","division":"PCC","hit_factor":8.1301},{"match_name":"ARPC USPSA Match 9-24-17","match_date":"2017-09-24","stage_classifiercode":"06-10","member_number":"TY89183","first_name":"STEVE","last_name":"CASH","classification":"B","division":"PCC","hit_factor":8.1301},{"match_name":"Minnetonka Game and Fish Special classifier","match_date":"2017-10-07","stage_classifiercode":"06-10","member_number":"a86132","first_name":"DAN","last_name":"BOYLES","classification":"U","division":"PCC","hit_factor":8.1301},{"match_name":"MASTER BLASTERS & SSFGA USPSA - September","match_date":"2021-09-18","stage_classifiercode":"06-10","member_number":"TY78926","first_name":"BOB","last_name":"DZAMKO","classification":"B","division":"PCC","hit_factor":8.1301},{"match_name":"CFRPC November USPSA","match_date":"2018-11-18","stage_classifiercode":"06-10","member_number":"\"\"","first_name":"EDUARDO","last_name":"IRIZARRY","classification":"U","division":"PCC","hit_factor":8.1301},{"match_name":"LBAS 170819","match_date":"2017-08-19","stage_classifiercode":"06-10","member_number":"A54861","first_name":"DENNIS","last_name":"WALKER","classification":"M","division":"PCC","hit_factor":8.1301},{"match_name":"Shadow Hawk Defense USPSA - Aug","match_date":"2021-08-14","stage_classifiercode":"06-10","member_number":"A107991","first_name":"DOUGLAS","last_name":"GROSS","classification":"U","division":"PCC","hit_factor":8.1081},{"match_name":"LdF USPSA Match July 11 2021","match_date":"2021-07-11","stage_classifiercode":"06-10","member_number":"TY37963","first_name":"ED","last_name":"FERRELL","classification":"B","division":"PCC","hit_factor":8.0863},{"match_name":"GRPC USPSA CINCO DE MAYO","match_date":"2018-05-06","stage_classifiercode":"06-10","member_number":"A40007","first_name":"JOHN","last_name":"NIXON","classification":"U","division":"PCC","hit_factor":8.0863},{"match_name":"LBAS 201017 October Practical Match","match_date":"2020-10-17","stage_classifiercode":"06-10","member_number":"TY120762","first_name":"DAVID","last_name":"WHITE","classification":"B","division":"PCC","hit_factor":8.0863},{"match_name":"SEPSA April 2021 Popup Match","match_date":"2021-04-17","stage_classifiercode":"06-10","member_number":"L144","first_name":"JOHN","last_name":"HARBISON","classification":"U","division":"PCC","hit_factor":8.0863},{"match_name":"PCWC USPSA  9 26 2020","match_date":"2020-09-26","stage_classifiercode":"06-10","member_number":"a112248","first_name":"AARON","last_name":"BUTSKO","classification":"B","division":"PCC","hit_factor":8.0863},{"match_name":"PCWC USPSA  9 26 2020","match_date":"2020-09-26","stage_classifiercode":"06-10","member_number":"L729","first_name":"ROBERT","last_name":"WALKER","classification":"A","division":"PCC","hit_factor":8.0863},{"match_name":"PRPS USPSA Jun  24 2018","match_date":"2018-06-17","stage_classifiercode":"06-10","member_number":"\"\"","first_name":"JIM","last_name":"HUBBELL","classification":"U","division":"PCC","hit_factor":8.0645},{"match_name":"MPPL 20200301","match_date":"2020-03-01","stage_classifiercode":"06-10","member_number":"TY2504","first_name":"KEITH","last_name":"KAWAMOTO","classification":"U","division":"PCC","hit_factor":8.0645},{"match_name":"PTPC November 4th  USPSA Match","match_date":"2018-11-04","stage_classifiercode":"06-10","member_number":"TY85154","first_name":"JAMES","last_name":"JENSEN","classification":"A","division":"PCC","hit_factor":8.0429},{"match_name":"Sharp Practical Shooters August USPSA - Outdoor","match_date":"2021-08-22","stage_classifiercode":"06-10","member_number":"A87873","first_name":"SCOTT","last_name":"MEREDITH","classification":"A","division":"PCC","hit_factor":8.0429},{"match_name":"OREGON TCGC CC02 USPSA NOV 21 2021","match_date":"2021-11-21","stage_classifiercode":"06-10","member_number":"TY37143","first_name":"ROBERT","last_name":"JOHNSON","classification":"M","division":"PCC","hit_factor":8.0429},{"match_name":"Grandbaggers December 2017","match_date":"2017-12-07","stage_classifiercode":"06-10","member_number":"A48182","first_name":"RICH","last_name":"HIGGINS","classification":"B","division":"PCC","hit_factor":8.0429},{"match_name":"PRPS USPSA Jun  24 2018","match_date":"2018-06-17","stage_classifiercode":"06-10","member_number":"TY75700","first_name":"MIKE","last_name":"LUNYOU","classification":"C","division":"PCC","hit_factor":8.0214},{"match_name":"Richmond Hot Shots July 15-16-2017 USPSA Pistol Match","match_date":"2017-07-15","stage_classifiercode":"06-10","member_number":"TY33484","first_name":"CARLOS","last_name":"KATALBAS","classification":"M","division":"PCC","hit_factor":8.0214},{"match_name":"PCWC USPSA  9 26 2020","match_date":"2020-09-26","stage_classifiercode":"06-10","member_number":"Ty23656","first_name":"RAY","last_name":"WELLS","classification":"B","division":"PCC","hit_factor":8.0214},{"match_name":"MCAS June 2018 USPSA Match","match_date":"2018-06-30","stage_classifiercode":"06-10","member_number":"A75842","first_name":"JOE","last_name":"DESSON","classification":"Unclassified","division":"PCC","hit_factor":8.0214},{"match_name":"ARPC USPSA Match 8-26-18","match_date":"2018-08-26","stage_classifiercode":"06-10","member_number":"A84108","first_name":"MIKE","last_name":"WEBB","classification":"C","division":"PCC","hit_factor":8.0214},{"match_name":"FBURG March 2021 Level I USPSA ","match_date":"2021-03-06","stage_classifiercode":"06-10","member_number":"TY82414","first_name":"DAVID","last_name":"ANKENY","classification":"B","division":"PCC","hit_factor":8.0214},{"match_name":"OPSC USPSA  OCTOBER 2017","match_date":"2017-10-07","stage_classifiercode":"06-10","member_number":"A73683","first_name":"BRYAN","last_name":"TECSON","classification":"A","division":"PCC","hit_factor":8},{"match_name":"Ripon USPSA 9-22-18","match_date":"2018-09-22","stage_classifiercode":"06-10","member_number":"A51560","first_name":"MIKE","last_name":"HIMMEL","classification":"B","division":"PCC","hit_factor":7.9787},{"match_name":"Gem City Gun Club 11-4 and 11-5","match_date":"2017-11-04","stage_classifiercode":"06-10","member_number":"\"\"","first_name":"ED","last_name":"NIELSEN","classification":"B","division":"PCC","hit_factor":7.9787},{"match_name":"OREGON TCGC CC02 USPSA NOV 21 2021","match_date":"2021-11-21","stage_classifiercode":"06-10","member_number":"TY121272","first_name":"MICHAEL","last_name":"HENRY","classification":"M","division":"PCC","hit_factor":7.9787},{"match_name":"OFGC USPSA Match Oct 16","match_date":"2016-10-16","stage_classifiercode":"06-10","member_number":"L3030","first_name":"KHAN","last_name":"SCHWANHAUSSER","classification":"U","division":"PCC","hit_factor":7.9787},{"match_name":"FBURG June 2017 Level I USPSA ","match_date":"2017-06-03","stage_classifiercode":"06-10","member_number":"TY83821","first_name":"DEREK","last_name":"EINSIG","classification":"B","division":"PCC","hit_factor":7.9576},{"match_name":"Richmond Hot Shots September 1st-2nd 2018 USPSA Pistol Match","match_date":"2018-09-01","stage_classifiercode":"06-10","member_number":"\"\"","first_name":"LARRY","last_name":"MODELL","classification":"B","division":"PCC","hit_factor":7.9576},{"match_name":"BGSL Classifier Match ","match_date":"2018-10-06","stage_classifiercode":"06-10","member_number":"a98615","first_name":"JOHN","last_name":"HOLBROOK","classification":"B","division":"PCC","hit_factor":7.9365},{"match_name":"Vaxd Retd Master Blasters USPSA","match_date":"2021-09-17","stage_classifiercode":"06-10","member_number":"L4888","first_name":"BRIAN","last_name":"CHAREST","classification":"C","division":"PCC","hit_factor":7.9365},{"match_name":"Chillicothe Sportsmens Club December USPSA","match_date":"2020-12-20","stage_classifiercode":"06-10","member_number":"TY88494","first_name":"GEORGE","last_name":"DYSICO","classification":"B","division":"PCC","hit_factor":7.9365},{"match_name":"SWGC USPSA Pistol Match - December 2018","match_date":"2018-12-01","stage_classifiercode":"06-10","member_number":"TY88724","first_name":"JESSICA","last_name":"DOIRON","classification":"A","division":"PCC","hit_factor":7.9156},{"match_name":"Richmond Hot Shots September 1st-2nd 2018 USPSA Pistol Match","match_date":"2018-09-01","stage_classifiercode":"06-10","member_number":"10079","first_name":"JONATHAN","last_name":"OWYANG","classification":"M","division":"PCC","hit_factor":7.9156},{"match_name":"CIPSC Havana May USPSA","match_date":"2018-05-12","stage_classifiercode":"06-10","member_number":"TY58309","first_name":"ERIC","last_name":"HENSON","classification":"B","division":"PCC","hit_factor":7.8947368421053},{"match_name":"WSRC USPSA 7-21/22-2018","match_date":"2018-07-21","stage_classifiercode":"06-10","member_number":"TY56049","first_name":"KENT","last_name":"CHRISTEN","classification":"C","division":"PCC","hit_factor":7.8947},{"match_name":"Richmond Hot Shots July 15-16-2017 USPSA Pistol Match","match_date":"2017-07-15","stage_classifiercode":"06-10","member_number":"A64053","first_name":"JUDE","last_name":"JAVIER","classification":"C","division":"PCC","hit_factor":7.8947},{"match_name":"Shoot GTR Tuesday USPSA","match_date":"2017-08-08","stage_classifiercode":"06-10","member_number":"TY53290","first_name":"KENT","last_name":"CORI","classification":"A","division":"PCC","hit_factor":7.8947},{"match_name":"Shasta Shooters August  2018","match_date":"2018-08-11","stage_classifiercode":"06-10","member_number":"TY87118","first_name":"STAN","last_name":"CLEWETT","classification":"A","division":"PCC","hit_factor":7.8947},{"match_name":"APSC USPSA Match 10-07-17","match_date":"2017-10-07","stage_classifiercode":"06-10","member_number":"A87434","first_name":"JAMES","last_name":"MCIVER","classification":"U","division":"PCC","hit_factor":7.874},{"match_name":"LBAS 201017 October Practical Match","match_date":"2020-10-17","stage_classifiercode":"06-10","member_number":"A71290","first_name":"JON","last_name":"BREAZEAL","classification":"B","division":"PCC","hit_factor":7.8329},{"match_name":"MPPL 20200301","match_date":"2020-03-01","stage_classifiercode":"06-10","member_number":"FY67177","first_name":"EDGARDO","last_name":"CARAANG","classification":"U","division":"PCC","hit_factor":7.8329},{"match_name":"Quantico QPS QSC USPSA Match 9 APR 2017","match_date":"2017-04-09","stage_classifiercode":"06-10","member_number":"A89471","first_name":"WESLEY","last_name":"KRULLA","classification":"U","division":"PCC","hit_factor":7.8329},{"match_name":"LCSC Linden USPSA 061018","match_date":"2018-06-10","stage_classifiercode":"06-10","member_number":"A87641","first_name":"WENDY","last_name":"WONG","classification":"C","division":"PCC","hit_factor":7.8329},{"match_name":"Shadow Hawk Defense USPSA SPECIAL CLASSIFIER","match_date":"2021-11-11","stage_classifiercode":"06-10","member_number":"A111754","first_name":"GEORGE","last_name":"TAMULA","classification":"B","division":"PCC","hit_factor":7.8329},{"match_name":"Southern Arizona Practical Shooters 09_01_18","match_date":"2018-09-01","stage_classifiercode":"06-10","member_number":"FY42693","first_name":"MIKE","last_name":"PANNONE","classification":"A","division":"PCC","hit_factor":7.8329},{"match_name":"Nisa April","match_date":"2021-04-25","stage_classifiercode":"06-10","member_number":"Ty105933","first_name":"CRAIG","last_name":"SCHROEDER","classification":"B","division":"PCC","hit_factor":7.8125},{"match_name":"MCAS June 2018 USPSA Match","match_date":"2018-06-30","stage_classifiercode":"06-10","member_number":"TY23626","first_name":"SCOTT","last_name":"NIELSEN","classification":"M","division":"PCC","hit_factor":7.8125},{"match_name":"NCPS USPSA Handgun Match March 25 2018z","match_date":"2018-03-25","stage_classifiercode":"06-10","member_number":"TY64320","first_name":"ROBERT","last_name":"SHARP","classification":"B","division":"PCC","hit_factor":7.8125},{"match_name":"SWGC USPSA Pistol Match - December 2018","match_date":"2018-12-01","stage_classifiercode":"06-10","member_number":"TY52476","first_name":"JOHN","last_name":"TISCHLER","classification":"A","division":"PCC","hit_factor":7.7922},{"match_name":"Pioneer Action Shooters USPSA 5-23-21 Special Classifer","match_date":"2021-05-23","stage_classifiercode":"06-10","member_number":"TY94475","first_name":"GLENN","last_name":"STILWELL","classification":"B","division":"PCC","hit_factor":7.7922},{"match_name":"FAS Sunday Outdoor USPSA Match","match_date":"2021-08-01","stage_classifiercode":"06-10","member_number":"TY66411","first_name":"JOHN","last_name":"DYKSTRA","classification":"A","division":"PCC","hit_factor":7.772},{"match_name":"Deadwood Boys USPSA All Classifier Match - 29 July 2018","match_date":"2018-07-29","stage_classifiercode":"06-10","member_number":"A94923","first_name":"WILSON","last_name":"PARK","classification":"B","division":"PCC","hit_factor":7.772},{"match_name":"Richmond Hot Shots July 15-16-2017 USPSA Pistol Match","match_date":"2017-07-15","stage_classifiercode":"06-10","member_number":"A100949","first_name":"MICHAEL","last_name":"CHING","classification":"U","division":"PCC","hit_factor":7.772},{"match_name":"MCPSL Pistol 4-10-2021 (Classifier)","match_date":"2021-04-10","stage_classifiercode":"06-10","member_number":"A38612","first_name":"RANDY","last_name":"ATHERTON","classification":"B","division":"PCC","hit_factor":7.772},{"match_name":"OREGON ARPC CC05 USPSA JUNE 10 2017","match_date":"2017-06-10","stage_classifiercode":"06-10","member_number":"FY80028","first_name":"STAN","last_name":"PROUTY","classification":"U","division":"PCC","hit_factor":7.772},{"match_name":"CFRPC November USPSA","match_date":"2018-11-18","stage_classifiercode":"06-10","member_number":"\"\"","first_name":"JOEY","last_name":"EMPAMANO","classification":"C","division":"PCC","hit_factor":7.772},{"match_name":"Richmond Hot Shots September 1st-2nd 2018 USPSA Pistol Match","match_date":"2018-09-01","stage_classifiercode":"06-10","member_number":"A101137","first_name":"ROBERTO","last_name":"SANCHEZ","classification":"C","division":"PCC","hit_factor":7.7519},{"match_name":"OREGON TCGC CC02 USPSA NOV 21 2021","match_date":"2021-11-21","stage_classifiercode":"06-10","member_number":"TY84121","first_name":"GABOR","last_name":"MAGONY","classification":"G","division":"PCC","hit_factor":7.732},{"match_name":"HRRB 12-01-2018","match_date":"2018-12-01","stage_classifiercode":"06-10","member_number":"A104329","first_name":"DAVID","last_name":"KIKUKAWA","classification":"M","division":"PCC","hit_factor":7.732},{"match_name":"EHPSA USPSA 27June 2021","match_date":"2021-06-27","stage_classifiercode":"06-10","member_number":"TY127550","first_name":"JAMES","last_name":"ANDERSON","classification":"A","division":"PCC","hit_factor":7.732},{"match_name":"OSC April USPSA","match_date":"2021-04-18","stage_classifiercode":"06-10","member_number":"TY102278","first_name":"ELIJAH","last_name":"JAHNS","classification":"M","division":"PCC","hit_factor":7.732},{"match_name":"Richmond Hot Shots September 1st-2nd 2018 USPSA Pistol Match","match_date":"2018-09-01","stage_classifiercode":"06-10","member_number":"9656","first_name":"TONY","last_name":"YEH","classification":"C","division":"PCC","hit_factor":7.732},{"match_name":"LBAS 170819","match_date":"2017-08-19","stage_classifiercode":"06-10","member_number":"L2757","first_name":"RICK","last_name":"PUNU","classification":"M","division":"PCC","hit_factor":7.732},{"match_name":"MCTS USPSA Classifier Match May 2016","match_date":"2016-05-14","stage_classifiercode":"06-10","member_number":"\"\"","first_name":"AARON","last_name":"REDENTE","classification":"X","division":"PCC","hit_factor":7.7121},{"match_name":"OPSC USPSA  OCTOBER 2017","match_date":"2017-10-07","stage_classifiercode":"06-10","member_number":"FY60870","first_name":"MIKE","last_name":"CALDO","classification":"U","division":"PCC","hit_factor":7.7121},{"match_name":"Pioneer Action Shooters USPSA 5-23-21 Special Classifer","match_date":"2021-05-23","stage_classifiercode":"06-10","member_number":"TY78926","first_name":"BOB","last_name":"DZAMKO","classification":"B","division":"PCC","hit_factor":7.7121},{"match_name":"RBGC USPSA 2021-8-28","match_date":"2021-08-28","stage_classifiercode":"06-10","member_number":"FY98974","first_name":"JOHN","last_name":"KUROSKI","classification":"B","division":"PCC","hit_factor":7.6923},{"match_name":"Gem City Gun Club 11-4 and 11-5","match_date":"2017-11-04","stage_classifiercode":"06-10","member_number":"A46120","first_name":"JON","last_name":"NIELSEN","classification":"C","division":"PCC","hit_factor":7.6726},{"match_name":"FAS Sunday Outdoor USPSA Match","match_date":"2021-08-01","stage_classifiercode":"06-10","member_number":"A124509","first_name":"CALEB","last_name":"GOODMAN","classification":"B","division":"PCC","hit_factor":7.6726},{"match_name":"EHPSA USPSA 27June 2021","match_date":"2021-06-27","stage_classifiercode":"06-10","member_number":"TY81368","first_name":"JEFF","last_name":"KILLINGER","classification":"A","division":"PCC","hit_factor":7.6726},{"match_name":"EAGC May 2018 USPSA Pistol Match","match_date":"2018-05-20","stage_classifiercode":"06-10","member_number":"L3733","first_name":"MARK","last_name":"KAUDER","classification":"C","division":"PCC","hit_factor":7.6726},{"match_name":"LPC April 2017 Classifier Special","match_date":"2017-04-02","stage_classifiercode":"06-10","member_number":"A42720","first_name":"ADAM","last_name":"MCINTOSH","classification":"U","division":"PCC","hit_factor":7.6726},{"match_name":"CFRPC November USPSA","match_date":"2018-11-18","stage_classifiercode":"06-10","member_number":"L3973","first_name":"MIKE","last_name":"WILLIAMS","classification":"B","division":"PCC","hit_factor":7.6726},{"match_name":"2021-03 Bone Creek USPSA","match_date":"2021-03-07","stage_classifiercode":"06-10","member_number":"FY36467","first_name":"JAMES","last_name":"POPE","classification":"B","division":"PCC","hit_factor":7.6531},{"match_name":"Shoot GTR Monthly USPSA","match_date":"2018-01-07","stage_classifiercode":"06-10","member_number":"TY53290","first_name":"KENT","last_name":"CORI","classification":"M","division":"PCC","hit_factor":7.6531},{"match_name":"West Liberty USPSA June 2018","match_date":"2018-06-24","stage_classifiercode":"06-10","member_number":"A100066","first_name":"LANE","last_name":"JENSEN","classification":"C","division":"PCC","hit_factor":7.6531},{"match_name":"DSS - USPSA 18-08-12","match_date":"2018-08-12","stage_classifiercode":"06-10","member_number":"A89886","first_name":"DANIEL","last_name":"TUSTIN","classification":"B","division":"PCC","hit_factor":7.6531},{"match_name":"CBS March USPSA Steel Match","match_date":"2021-03-07","stage_classifiercode":"06-10","member_number":"L1930","first_name":"MARK","last_name":"OTTO","classification":"C","division":"PCC","hit_factor":7.6531},{"match_name":"NCPS USPSA Handgun Match March 25 2018z","match_date":"2018-03-25","stage_classifiercode":"06-10","member_number":"A101811","first_name":"BRENT","last_name":"VETOVITZ","classification":"C","division":"PCC","hit_factor":7.6336},{"match_name":"EWPSA 2018-01","match_date":"2018-01-21","stage_classifiercode":"06-10","member_number":"TY61539","first_name":"ANN","last_name":"BLOSSER","classification":"A","division":"PCC","hit_factor":7.6336},{"match_name":"Brothers N Arms August 2017 USPSA Match","match_date":"2017-08-19","stage_classifiercode":"06-10","member_number":"A105060","first_name":"DANIEL","last_name":"HARRIS","classification":"U","division":"PCC","hit_factor":7.6142},{"match_name":"Idaho ISPS January 6th 2018","match_date":"2018-01-06","stage_classifiercode":"06-10","member_number":"A84188","first_name":"LAWRENCE","last_name":"OLETSKI","classification":"C","division":"PCC","hit_factor":7.6142},{"match_name":"GAS July 2020 USPSA Classifier Match","match_date":"2020-07-04","stage_classifiercode":"06-10","member_number":"Ty29750","first_name":"CRAIG","last_name":"BOYD","classification":"M","division":"PCC","hit_factor":7.6142},{"match_name":"LdF USPSA Match May 27 2017","match_date":"2017-05-27","stage_classifiercode":"06-10","member_number":"A81101","first_name":"LES","last_name":"ANDERSON","classification":"B","division":"PCC","hit_factor":7.6142},{"match_name":"YMM  IPSC 2018_07_08","match_date":"2018-07-08","stage_classifiercode":"06-10","member_number":"TY71290","first_name":"JON","last_name":"BREAZEAL","classification":"B","division":"PCC","hit_factor":7.5949},{"match_name":"Richmond Hot Shots July 15-16-2017 USPSA Pistol Match","match_date":"2017-07-15","stage_classifiercode":"06-10","member_number":"TY88318","first_name":"MIKE","last_name":"HALL","classification":"B","division":"PCC","hit_factor":7.5949},{"match_name":"RangeMasters 9-7-2017","match_date":"2017-09-07","stage_classifiercode":"06-10","member_number":"\"\"","first_name":"EDGAR","last_name":"PAZ","classification":"U","division":"PCC","hit_factor":7.5949},{"match_name":"AIPS Weekly USPSA 21 August 2018","match_date":"2018-08-21","stage_classifiercode":"06-10","member_number":"A74374","first_name":"DOUG","last_name":"CATRON","classification":"B","division":"PCC","hit_factor":7.5949},{"match_name":"Eagles Nest July 30th","match_date":"2017-07-30","stage_classifiercode":"06-10","member_number":"A91103","first_name":"DANIEL","last_name":"TOOMBS","classification":"U","division":"PCC","hit_factor":7.5758},{"match_name":"TAS Classifier 2","match_date":"2017-12-10","stage_classifiercode":"06-10","member_number":"A99516","first_name":"MATTHEW","last_name":"PENINGER","classification":"D","division":"PCC","hit_factor":7.5758},{"match_name":"OPSC USPSA  OCTOBER 2017","match_date":"2017-10-07","stage_classifiercode":"06-10","member_number":"PEN","first_name":"DAN","last_name":"VAUGHAN","classification":"U (UNCLASSIFIED)","division":"PCC","hit_factor":7.5567},{"match_name":"MPSA 2020-01-02","match_date":"2021-01-02","stage_classifiercode":"06-10","member_number":"TY98602","first_name":"NEIL","last_name":"DRENNAN","classification":"A","division":"PCC","hit_factor":7.5377},{"match_name":"BORCC USPSA June 2017","match_date":"2017-06-25","stage_classifiercode":"06-10","member_number":"A77486","first_name":"JOHN","last_name":"LOGAN","classification":"C","division":"PCC","hit_factor":7.5377},{"match_name":"DWB - Deadwood Boys USPSA 19 January 2020","match_date":"2020-01-19","stage_classifiercode":"06-10","member_number":"a-98325","first_name":"BRONCO","last_name":"LANE","classification":"B","division":"PCC","hit_factor":7.5377},{"match_name":"Paul Bunyan April 7th-8th All Classifier Match NW01","match_date":"2018-04-07","stage_classifiercode":"06-10","member_number":"A90654","first_name":"RONALD","last_name":"TOLENTINO","classification":"C","division":"PCC","hit_factor":7.5188},{"match_name":"ACPSA March 2017","match_date":"2017-03-25","stage_classifiercode":"06-10","member_number":"A78372","first_name":"BILL","last_name":"HARRIS","classification":"U","division":"PCC","hit_factor":7.5188},{"match_name":"FBURG June 2017 Level I USPSA ","match_date":"2017-06-03","stage_classifiercode":"06-10","member_number":"FY15413","first_name":"TOM","last_name":"SUIT","classification":"B","division":"PCC","hit_factor":7.5188},{"match_name":"NCPS USPSA Handgun Match March 25 2018z","match_date":"2018-03-25","stage_classifiercode":"06-10","member_number":"TY84047","first_name":"ARNOLD","last_name":"CHIN","classification":"B","division":"PCC","hit_factor":7.5188},{"match_name":"EWPSA 2018-01","match_date":"2018-01-21","stage_classifiercode":"06-10","member_number":"TY82326","first_name":"WARREN","last_name":"HARPER","classification":"B","division":"PCC","hit_factor":7.5188},{"match_name":"BORCC USPSA October 2016 Classifier Match","match_date":"2016-10-30","stage_classifiercode":"06-10","member_number":"A98615","first_name":"JOHN","last_name":"HOLBROOK","classification":"B","division":"PCC","hit_factor":7.5188},{"match_name":"Nampa USPSA March 15th","match_date":"2020-03-15","stage_classifiercode":"06-10","member_number":"A84188","first_name":"LARRY","last_name":"OLETSKI","classification":"M","division":"PCC","hit_factor":7.5},{"match_name":"LBAS 201017 October Practical Match","match_date":"2020-10-17","stage_classifiercode":"06-10","member_number":"L2842","first_name":"PAUL","last_name":"CAUDILL","classification":"A","division":"PCC","hit_factor":7.5},{"match_name":"CBS March USPSA Steel Match","match_date":"2021-03-07","stage_classifiercode":"06-10","member_number":"TY2958","first_name":"PETE","last_name":"CARPENTIER JR","classification":"B","division":"PCC","hit_factor":7.5},{"match_name":"Custer December USPSA","match_date":"2016-12-04","stage_classifiercode":"06-10","member_number":"A68387","first_name":"JOHN","last_name":"WILEY","classification":"U","division":"PCC","hit_factor":7.5},{"match_name":"Green Valley March 2017","match_date":"2017-03-25","stage_classifiercode":"06-10","member_number":"A80947","first_name":"PHILIP","last_name":"NEFF","classification":"U","division":"PCC","hit_factor":7.5},{"match_name":"Paul Bunyan April 7th-8th All Classifier Match NW01","match_date":"2018-04-07","stage_classifiercode":"06-10","member_number":"fy27156","first_name":"STEVEN","last_name":"CLEMO","classification":"B","division":"PCC","hit_factor":7.4813},{"match_name":"Gem City Gun Club 11-4 and 11-5","match_date":"2017-11-04","stage_classifiercode":"06-10","member_number":"\"\"","first_name":"JACK","last_name":"JAUCH","classification":"U","division":"PCC","hit_factor":7.4813},{"match_name":"Southern Arizona Practical Shooters 09_01_18","match_date":"2018-09-01","stage_classifiercode":"06-10","member_number":"Fy2823","first_name":"JOHN","last_name":"FRANCE","classification":"A","division":"PCC","hit_factor":7.4813},{"match_name":"ORSA USPSA Classifier Side  Match Feb 2017","match_date":"2017-02-18","stage_classifiercode":"06-10","member_number":"A101184","first_name":"JAMES","last_name":"BREEDEN","classification":"U","division":"PCC","hit_factor":7.4813},{"match_name":"OPSC USPSA  OCTOBER 2017","match_date":"2017-10-07","stage_classifiercode":"06-10","member_number":"FY53778","first_name":"SCOTT","last_name":"BARON","classification":"U","division":"PCC","hit_factor":7.4627},{"match_name":"Idaho ISPS January 6th 2018","match_date":"2018-01-06","stage_classifiercode":"06-10","member_number":"TY94890","first_name":"CHRIS","last_name":"CLARK","classification":"U","division":"PCC","hit_factor":7.4627},{"match_name":"OOPS Three Stage ","match_date":"2017-07-22","stage_classifiercode":"06-10","member_number":"a100542","first_name":"JESSE","last_name":"SMITH","classification":"U","division":"PCC","hit_factor":7.4627},{"match_name":"MPSA 2020-01-02","match_date":"2021-01-02","stage_classifiercode":"06-10","member_number":"A52372","first_name":"HURLEY","last_name":"RIDER","classification":"U","division":"PCC","hit_factor":7.4442},{"match_name":"Ripon USPSA 7-22-17","match_date":"2017-07-22","stage_classifiercode":"06-10","member_number":"TY26422","first_name":"RANDY","last_name":"HEFFNER","classification":"C","division":"PCC","hit_factor":7.4442},{"match_name":"DWB - Deadwood Boys USPSA 19 January 2020","match_date":"2020-01-19","stage_classifiercode":"06-10","member_number":"A113070","first_name":"LARRY","last_name":"CHONG","classification":"C","division":"PCC","hit_factor":7.4442},{"match_name":"MCPSL Pistol 4-10-2021 (Classifier)","match_date":"2021-04-10","stage_classifiercode":"06-10","member_number":"A118402","first_name":"DON","last_name":"SANDBERG","classification":"C","division":"PCC","hit_factor":7.4442},{"match_name":"Collin County USPSA 11-28-2021","match_date":"2021-11-28","stage_classifiercode":"06-10","member_number":"A137091","first_name":"DANIEL","last_name":"JUNG","classification":"U","division":"PCC","hit_factor":7.4442},{"match_name":"Richmond March 6-2015 USPSA Pistol Match","match_date":"2016-03-06","stage_classifiercode":"06-10","member_number":"TY77462","first_name":"LENNIE","last_name":"VILLIADOS","classification":"U","division":"PCC","hit_factor":7.4442},{"match_name":"Custer December USPSA","match_date":"2016-12-04","stage_classifiercode":"06-10","member_number":"TY68271","first_name":"SCOTT","last_name":"MOUILLE","classification":"U","division":"PCC","hit_factor":7.4257},{"match_name":"Springfield Tactical Shooters 09-07-2017","match_date":"2017-09-07","stage_classifiercode":"06-10","member_number":"FY83614","first_name":"GARY","last_name":"GRAY","classification":"B","division":"PCC","hit_factor":7.4074},{"match_name":"Deadwood Boys USPSA All Classifier Match - 29 July 2018","match_date":"2018-07-29","stage_classifiercode":"06-10","member_number":"A110510","first_name":"STEVE","last_name":"MILES","classification":"A","division":"PCC","hit_factor":7.4074},{"match_name":"RBGC USPSA 2021-8-28","match_date":"2021-08-28","stage_classifiercode":"06-10","member_number":"A111089","first_name":"JOEY","last_name":"MILAM","classification":"B","division":"PCC","hit_factor":7.4074},{"match_name":"Nisa April","match_date":"2021-04-25","stage_classifiercode":"06-10","member_number":"a111400","first_name":"ALEX","last_name":"GITZEL","classification":"C","division":"PCC","hit_factor":7.3892},{"match_name":"YMM  IPSC 2018_07_08","match_date":"2018-07-08","stage_classifiercode":"06-10","member_number":"\"\"","first_name":"JOSEPH","last_name":"BARRIOS","classification":"\"\"","division":"PCC","hit_factor":7.3892},{"match_name":"WSPS JUNE 2017 USPSA MATCH","match_date":"2017-06-17","stage_classifiercode":"06-10","member_number":"A70972","first_name":"ROBERT","last_name":"SCHMELZ","classification":"X","division":"PCC","hit_factor":7.3892},{"match_name":"WSRC USPSA 7-21/22-2018","match_date":"2018-07-21","stage_classifiercode":"06-10","member_number":"A69433","first_name":"MEL","last_name":"GAJEWSKI","classification":"U","division":"PCC","hit_factor":7.371},{"match_name":"OPSC USPSA  OCTOBER 2017","match_date":"2017-10-07","stage_classifiercode":"06-10","member_number":"FY62123","first_name":"DOUG","last_name":"FISHER","classification":"U","division":"PCC","hit_factor":7.371},{"match_name":"BGSL Classifier Match ","match_date":"2018-10-06","stage_classifiercode":"06-10","member_number":"a105549","first_name":"DEXTER","last_name":"SPURLOCK","classification":"U","division":"PCC","hit_factor":7.371},{"match_name":"Gem City Gun Club 4-7 and 4-8-18","match_date":"2018-04-07","stage_classifiercode":"06-10","member_number":"\"\"","first_name":"SCOTT","last_name":"STEVENS","classification":"U","division":"PCC","hit_factor":7.371},{"match_name":"MASTER BLASTERS & SSFGA USPSA - September","match_date":"2021-09-18","stage_classifiercode":"06-10","member_number":"A598","first_name":"KEN","last_name":"RUEFFERT","classification":"A","division":"PCC","hit_factor":7.371},{"match_name":"Salt City practical shooting league 'all classifier match'","match_date":"2020-08-30","stage_classifiercode":"06-10","member_number":"A127815","first_name":"AARON","last_name":"JOLLY","classification":"U","division":"PCC","hit_factor":7.3529},{"match_name":"Oxford OHS05 090521","match_date":"2021-09-05","stage_classifiercode":"06-10","member_number":"B82","first_name":"SVEN","last_name":"WAGNER","classification":"C","division":"PCC","hit_factor":7.3529},{"match_name":"FBURG June 2017 Level I USPSA ","match_date":"2017-06-03","stage_classifiercode":"06-10","member_number":"A82592","first_name":"THOMAS","last_name":"KOH","classification":"U","division":"PCC","hit_factor":7.335},{"match_name":"Gem City Gun Club 11-4 and 11-5","match_date":"2017-11-04","stage_classifiercode":"06-10","member_number":"L3880","first_name":"JOE","last_name":"PARADISI","classification":"C","division":"PCC","hit_factor":7.335},{"match_name":"Southern Arizona Practical Shooters 09_01_18","match_date":"2018-09-01","stage_classifiercode":"06-10","member_number":"TY96529","first_name":"JONATHAN","last_name":"NAGY","classification":"B","division":"PCC","hit_factor":7.335},{"match_name":"Eagles Nest July 30th","match_date":"2017-07-30","stage_classifiercode":"06-10","member_number":"\"\"","first_name":"KYLE","last_name":"KONOPA","classification":"U","division":"PCC","hit_factor":7.3171},{"match_name":"CGGR May USPSA Match","match_date":"2017-05-20","stage_classifiercode":"06-10","member_number":"TY85974","first_name":"JAMES","last_name":"BASCIO","classification":"B","division":"PCC","hit_factor":7.3171},{"match_name":"WSPS JUNE 2017 USPSA MATCH","match_date":"2017-06-17","stage_classifiercode":"06-10","member_number":"A98254","first_name":"MARK","last_name":"HARBOLD","classification":"A","division":"PCC","hit_factor":7.2993},{"match_name":"APS August 1st Monthly USPSA Match  Classifier Match","match_date":"2021-08-01","stage_classifiercode":"06-10","member_number":"TY25385","first_name":"MARK","last_name":"STAMPER","classification":"B","division":"PCC","hit_factor":7.2993},{"match_name":"LCSA USPSA May 2017","match_date":"2017-05-13","stage_classifiercode":"06-10","member_number":"ty63048","first_name":"TYRUS","last_name":"NOVAK","classification":"U","division":"PCC","hit_factor":7.2993},{"match_name":"IPSC93 April 2020","match_date":"2020-04-14","stage_classifiercode":"06-10","member_number":"L4686","first_name":"RANDY","last_name":"WEEKLEY","classification":"C","division":"PCC","hit_factor":7.2993},{"match_name":"7a Fecha USPSA","match_date":"2020-11-29","stage_classifiercode":"06-10","member_number":"A97685","first_name":"RAFAEL","last_name":"SILVA-JIMENEZ","classification":"U","division":"PCC","hit_factor":7.2993},{"match_name":"MCPSL Pistol 4-10-2021 (Classifier)","match_date":"2021-04-10","stage_classifiercode":"06-10","member_number":"A111852","first_name":"JOHN","last_name":"MORGAN","classification":"C","division":"PCC","hit_factor":7.2993},{"match_name":"WGC WI USPSA Monthly Match 10-21-17","match_date":"2017-10-21","stage_classifiercode":"06-10","member_number":"PENF","first_name":"STEVEN","last_name":"SCHUMACHER","classification":"U","division":"PCC","hit_factor":7.2816},{"match_name":"OSC April USPSA","match_date":"2021-04-18","stage_classifiercode":"06-10","member_number":"a128706","first_name":"DON","last_name":"MONROE","classification":"C","division":"PCC","hit_factor":7.2816},{"match_name":"SWGC USPSA Pistol Match - March 2020","match_date":"2020-03-07","stage_classifiercode":"06-10","member_number":"A104834","first_name":"LOGAN","last_name":"SAUNDERS","classification":"A","division":"PCC","hit_factor":7.2816},{"match_name":"CGGR May USPSA Match","match_date":"2017-05-20","stage_classifiercode":"06-10","member_number":"A84748","first_name":"JAMES","last_name":"OGLE","classification":"U","division":"PCC","hit_factor":7.2639},{"match_name":"Grandbaggers December 2017","match_date":"2017-12-07","stage_classifiercode":"06-10","member_number":"TY46374","first_name":"LARRY","last_name":"STOKES","classification":"B","division":"PCC","hit_factor":7.2639},{"match_name":"CCPS June 2016","match_date":"2016-06-19","stage_classifiercode":"06-10","member_number":"TY53551","first_name":"JOHN G","last_name":"BILLS","classification":"B","division":"PCC","hit_factor":7.2464},{"match_name":"LdF USPSA Match May 27 2017","match_date":"2017-05-27","stage_classifiercode":"06-10","member_number":"PEN","first_name":"BRIAN","last_name":"DRAKE","classification":"U","division":"PCC","hit_factor":7.2464},{"match_name":"Southern Arizona Practical Shooters 09_01_18","match_date":"2018-09-01","stage_classifiercode":"06-10","member_number":"L4455","first_name":"KEVIN","last_name":"LAMB (2)","classification":"M","division":"PCC","hit_factor":7.2289},{"match_name":"Grandbaggers December 2017","match_date":"2017-12-07","stage_classifiercode":"06-10","member_number":"A47213","first_name":"LARRY","last_name":"DRAKE","classification":"C","division":"PCC","hit_factor":7.2289},{"match_name":"SWGC USPSA Pistol Match - March 2020","match_date":"2020-03-07","stage_classifiercode":"06-10","member_number":"TY23656","first_name":"RAY","last_name":"WELLS","classification":"B","division":"PCC","hit_factor":7.2289},{"match_name":"APS August 1st Monthly USPSA Match  Classifier Match","match_date":"2021-08-01","stage_classifiercode":"06-10","member_number":"TY25385","first_name":"MARK","last_name":"STAMPER2","classification":"B","division":"PCC","hit_factor":7.2115},{"match_name":"LCSC Linden USPSA 061018","match_date":"2018-06-10","stage_classifiercode":"06-10","member_number":"A88783","first_name":"JOHNMAR","last_name":"SAMSON","classification":"B","division":"PCC","hit_factor":7.2115},{"match_name":"Chillicothe Sportsmens Club December USPSA","match_date":"2020-12-20","stage_classifiercode":"06-10","member_number":"FY10528","first_name":"JOHN","last_name":"SMITH","classification":"A","division":"PCC","hit_factor":7.2115},{"match_name":"AIPS Weekly USPSA 21 August 2018","match_date":"2018-08-21","stage_classifiercode":"06-10","member_number":"A53309","first_name":"JESSE","last_name":"PETERSON","classification":"Unclassified","division":"PCC","hit_factor":7.2115},{"match_name":"ARPC USPSA Match 8-26-18","match_date":"2018-08-26","stage_classifiercode":"06-10","member_number":"A92234","first_name":"BOB","last_name":"KOKOTOVICH","classification":"B","division":"PCC","hit_factor":7.1942},{"match_name":"ORSA USPSA Classifier Side  Match Feb 2017","match_date":"2017-02-18","stage_classifiercode":"06-10","member_number":"A100234","first_name":"TONY","last_name":"MARTIN","classification":"U","division":"PCC","hit_factor":7.1942},{"match_name":"December 2017 CAS USPSA","match_date":"2017-12-03","stage_classifiercode":"06-10","member_number":"A104555","first_name":"ALVIN","last_name":"SMITH III","classification":"C","division":"PCC","hit_factor":7.177},{"match_name":"OREGON TCGC CC02 USPSA NOV 21 2021","match_date":"2021-11-21","stage_classifiercode":"06-10","member_number":"FY76099","first_name":"DARYL","last_name":"FITZPATRICK","classification":"C","division":"PCC","hit_factor":7.177},{"match_name":"LBAS 170819","match_date":"2017-08-19","stage_classifiercode":"06-10","member_number":"A54861","first_name":"DENNIS","last_name":"WALKER","classification":"M","division":"PCC","hit_factor":7.177},{"match_name":"ESPS USPSA July 2017","match_date":"2017-07-22","stage_classifiercode":"06-10","member_number":"FY83588","first_name":"IAN","last_name":"MEYERS","classification":"G","division":"PCC","hit_factor":7.1599},{"match_name":"FBURG Flood June 3 2018","match_date":"2018-06-03","stage_classifiercode":"06-10","member_number":"TY82414","first_name":"DAVID","last_name":"ANKENY","classification":"B","division":"PCC","hit_factor":7.1599},{"match_name":"NISA April 2017 - Classifier","match_date":"2017-04-23","stage_classifiercode":"06-10","member_number":"FY73870","first_name":"JEFF","last_name":"CHESNEY","classification":"U","division":"PCC","hit_factor":7.1429},{"match_name":"OSC April USPSA","match_date":"2021-04-18","stage_classifiercode":"06-10","member_number":"FY39325","first_name":"DAVID","last_name":"RICHMAN","classification":"A","division":"PCC","hit_factor":7.1429},{"match_name":"West Liberty USPSA June 2018","match_date":"2018-06-24","stage_classifiercode":"06-10","member_number":"A100305","first_name":"CASEY","last_name":"HUDSON","classification":"D","division":"PCC","hit_factor":7.1429},{"match_name":"Gem City Gun Club 11-4 and 11-5","match_date":"2017-11-04","stage_classifiercode":"06-10","member_number":"TY61270","first_name":"JAMES","last_name":"MCDONOUGH","classification":"U","division":"PCC","hit_factor":7.1259},{"match_name":"Hosemasters 2nd Sunday August 2017","match_date":"2017-08-13","stage_classifiercode":"06-10","member_number":"A77620","first_name":"RON","last_name":"BEDA","classification":"C","division":"PCC","hit_factor":7.1259},{"match_name":"Gem City Gun Club 9-1 and 9-2-2018","match_date":"2018-09-01","stage_classifiercode":"06-10","member_number":"A107915","first_name":"KYLE","last_name":"KONOPA","classification":"B","division":"PCC","hit_factor":7.1259},{"match_name":"PCWC USPSA  9 26 2020","match_date":"2020-09-26","stage_classifiercode":"06-10","member_number":"Ty33364","first_name":"KERT","last_name":"GASKILL","classification":"U","division":"PCC","hit_factor":7.1259},{"match_name":"7a Fecha USPSA","match_date":"2020-11-29","stage_classifiercode":"06-10","member_number":"F109950","first_name":"FRANCISCO","last_name":"RODRIGUEZ-DIAZ","classification":"M","division":"PCC","hit_factor":7.1259},{"match_name":"Sage USPSA June 17 2018","match_date":"2018-06-17","stage_classifiercode":"06-10","member_number":"TY29486","first_name":"KEVIN","last_name":"KING","classification":"B","division":"PCC","hit_factor":7.1259},{"match_name":"Paul Bunyan April 7th-8th All Classifier Match NW01","match_date":"2018-04-07","stage_classifiercode":"06-10","member_number":"TY47022","first_name":"BRUCE","last_name":"WOOD","classification":"U","division":"PCC","hit_factor":7.109},{"match_name":"Deadwood Boys USPSA All Classifier Match - 29 July 2018","match_date":"2018-07-29","stage_classifiercode":"06-10","member_number":"A90455","first_name":"CHEN","last_name":"LEE","classification":"U","division":"PCC","hit_factor":7.0922},{"match_name":"PCWC USPSA  9 26 2020","match_date":"2020-09-26","stage_classifiercode":"06-10","member_number":"Ty52476","first_name":"JOHN","last_name":"TISCHLER","classification":"A","division":"PCC","hit_factor":7.0922},{"match_name":"Shadow Hawk Defense USPSA - Aug","match_date":"2021-08-14","stage_classifiercode":"06-10","member_number":"A115108","first_name":"HAROLD","last_name":"VAUGHN","classification":"C","division":"PCC","hit_factor":7.0755},{"match_name":"PMSC USPSA JULY 2018","match_date":"2018-07-01","stage_classifiercode":"06-10","member_number":"A42456","first_name":"GARRY","last_name":"LITTLE","classification":"B","division":"PCC","hit_factor":7.0755},{"match_name":"OFGC USPSA Match 11-18-17","match_date":"2017-11-18","stage_classifiercode":"06-10","member_number":"A6900","first_name":"BILLY","last_name":"MCCOY","classification":"B","division":"PCC","hit_factor":7.0755},{"match_name":"CGGR May USPSA Match","match_date":"2017-05-20","stage_classifiercode":"06-10","member_number":"A102011","first_name":"STEVE","last_name":"LUCK","classification":"U","division":"PCC","hit_factor":7.0755},{"match_name":"ACPSA March 2017","match_date":"2017-03-25","stage_classifiercode":"06-10","member_number":"A69229","first_name":"CHARLIE","last_name":"NELSON","classification":"C","division":"PCC","hit_factor":7.0588},{"match_name":"IOP Rifle And Pistol Club USPSA Match 6-21","match_date":"2021-06-06","stage_classifiercode":"06-10","member_number":"A16317","first_name":"KENNETH","last_name":"CRAMBERG","classification":"U","division":"PCC","hit_factor":7.0588},{"match_name":"TGC USPSA JANUARY 2018","match_date":"2018-01-20","stage_classifiercode":"06-10","member_number":"a44650","first_name":"DARRELL","last_name":"DAUDE","classification":"U","division":"PCC","hit_factor":7.0588},{"match_name":"HOPS USPSA 081917","match_date":"2017-08-19","stage_classifiercode":"06-10","member_number":"A80947","first_name":"PHILIP","last_name":"NEFF","classification":"U","division":"PCC","hit_factor":7.0588},{"match_name":"Shadow Hawk Defense USPSA SPECIAL CLASSIFIER","match_date":"2021-11-11","stage_classifiercode":"06-10","member_number":"TY85259","first_name":"JOJO RESHOOT","last_name":"SANTOS","classification":"B","division":"PCC","hit_factor":7.0588},{"match_name":"EWPSA 2021-08","match_date":"2021-08-15","stage_classifiercode":"06-10","member_number":"TY120660","first_name":"RICH","last_name":"NELSON","classification":"C","division":"PCC","hit_factor":7.0588},{"match_name":"Richmond Hot Shots September 1st-2nd 2018 USPSA Pistol Match","match_date":"2018-09-01","stage_classifiercode":"06-10","member_number":"\"\"","first_name":"THOMAS","last_name":"CHAN","classification":"U","division":"PCC","hit_factor":7.0588},{"match_name":"Springfield Tactical Shooters 09-07-2017","match_date":"2017-09-07","stage_classifiercode":"06-10","member_number":"TY78203","first_name":"JIM","last_name":"SHURES","classification":"B","division":"PCC","hit_factor":7.0423},{"match_name":"December 2017 CAS USPSA","match_date":"2017-12-03","stage_classifiercode":"06-10","member_number":"L2311","first_name":"BRYAN","last_name":"GUILLORY","classification":"U","division":"PCC","hit_factor":7.0423},{"match_name":"Richmond Hot Shots September 1st-2nd 2018 USPSA Pistol Match","match_date":"2018-09-01","stage_classifiercode":"06-10","member_number":"TY75971","first_name":"GERARD","last_name":"GARCIA","classification":"B","division":"PCC","hit_factor":7.0423},{"match_name":"CIPSC Havana May USPSA","match_date":"2018-05-12","stage_classifiercode":"06-10","member_number":"FY51334","first_name":"JIM","last_name":"STOBAUGH","classification":"U","division":"PCC","hit_factor":7.0422535211268},{"match_name":"Gem City Gun Club 4-7 and 4-8-18","match_date":"2018-04-07","stage_classifiercode":"06-10","member_number":"A18876","first_name":"ED","last_name":"NIELSEN","classification":"B","division":"PCC","hit_factor":7.0258},{"match_name":"EHPSA USPSA 27June 2021","match_date":"2021-06-27","stage_classifiercode":"06-10","member_number":"a42456","first_name":"GARRY","last_name":"LITTLE","classification":"B","division":"PCC","hit_factor":7.0258},{"match_name":"Fairfax PS USPSA July 2017","match_date":"2017-07-25","stage_classifiercode":"06-10","member_number":"A96020","first_name":"SCOTT","last_name":"JEDLINSKI","classification":"U","division":"PCC","hit_factor":7.0093},{"match_name":"WSRC USPSA 7-21/22-2018","match_date":"2018-07-21","stage_classifiercode":"06-10","member_number":"A32149","first_name":"LASZLO","last_name":"SZABO","classification":"B","division":"PCC","hit_factor":7.0093},{"match_name":"WGC June 2018 USPSA","match_date":"2018-06-10","stage_classifiercode":"06-10","member_number":"FY68889","first_name":"CHARLES","last_name":"MORGAN","classification":"U","division":"PCC","hit_factor":7.0093},{"match_name":"SWGC USPSA Pistol Match - March 2020","match_date":"2020-03-07","stage_classifiercode":"06-10","member_number":"TY62418","first_name":"RAY","last_name":"WINKEL","classification":"C","division":"PCC","hit_factor":7.0093},{"match_name":"YMM  IPSC 2018_07_08","match_date":"2018-07-08","stage_classifiercode":"06-10","member_number":"L2757","first_name":"RICK","last_name":"PUNU","classification":"M","division":"PCC","hit_factor":6.993},{"match_name":"LCSC Linden USPSA 120918","match_date":"2018-12-09","stage_classifiercode":"06-10","member_number":"Ty103552","first_name":"JASON","last_name":"GAO","classification":"C","division":"PCC","hit_factor":6.993},{"match_name":"GRPC USPSA CINCO DE MAYO","match_date":"2018-05-06","stage_classifiercode":"06-10","member_number":"A100457","first_name":"ANDRE","last_name":"ROSALES III","classification":"D","division":"PCC","hit_factor":6.9767},{"match_name":"OFGC USPSA Match Oct 16","match_date":"2016-10-16","stage_classifiercode":"06-10","member_number":"NA","first_name":"STEVEN","last_name":"HOUSEMAN","classification":"U","division":"PCC","hit_factor":6.9767},{"match_name":"CFRPC November USPSA","match_date":"2018-11-18","stage_classifiercode":"06-10","member_number":"A10764","first_name":"ISAGANI","last_name":"RIRAO","classification":"U","division":"PCC","hit_factor":6.9767},{"match_name":"Springfield Tactical Shooters 09-07-2017","match_date":"2017-09-07","stage_classifiercode":"06-10","member_number":"\"\"","first_name":"DEREK","last_name":"GUERNSEY","classification":"\"\"","division":"PCC","hit_factor":6.9606},{"match_name":"WELD ECO09 20180617","match_date":"2018-06-17","stage_classifiercode":"06-10","member_number":"A84025","first_name":"ROBERT (BOB)","last_name":"MARKHAM","classification":"C","division":"PCC","hit_factor":6.9606},{"match_name":"Gem City Gun Club 9-1 and 9-2-2018","match_date":"2018-09-01","stage_classifiercode":"06-10","member_number":"L1963","first_name":"DENNY","last_name":"MICHALI","classification":"A","division":"PCC","hit_factor":6.9606},{"match_name":"LdF USPSA Match July 11 2021","match_date":"2021-07-11","stage_classifiercode":"06-10","member_number":"A127498","first_name":"MIKE","last_name":"MRAK","classification":"B","division":"PCC","hit_factor":6.9444},{"match_name":"LCSA USPSA May 2017","match_date":"2017-05-13","stage_classifiercode":"06-10","member_number":"FY39111","first_name":"OLIE","last_name":"ERICKSEN","classification":"B","division":"PCC","hit_factor":6.9444},{"match_name":"LCSC Linden USPSA 061018","match_date":"2018-06-10","stage_classifiercode":"06-10","member_number":"TY88773","first_name":"EPHRAIM","last_name":"SAN FELIPE","classification":"B","division":"PCC","hit_factor":6.9284},{"match_name":"EAGC May 2018 USPSA Pistol Match","match_date":"2018-05-20","stage_classifiercode":"06-10","member_number":"A108487","first_name":"ALLEN","last_name":"HUTCHENSON","classification":"\"\"","division":"PCC","hit_factor":6.9284},{"match_name":"LdF USPSA Match May 27 2017","match_date":"2017-05-27","stage_classifiercode":"06-10","member_number":"A97344","first_name":"DANIEL","last_name":"FRAZIER","classification":"U","division":"PCC","hit_factor":6.9284},{"match_name":"CGGR May USPSA Match","match_date":"2017-05-20","stage_classifiercode":"06-10","member_number":"\"\"","first_name":"KYLE","last_name":"SOLE","classification":"U","division":"PCC","hit_factor":6.9124},{"match_name":"OFGC USPSA Match Oct 16","match_date":"2016-10-16","stage_classifiercode":"06-10","member_number":"TY69238","first_name":"TONY","last_name":"WALL","classification":"U","division":"PCC","hit_factor":6.9124},{"match_name":"Deadwood Boys USPSA All Classifier Match - 29 July 2018","match_date":"2018-07-29","stage_classifiercode":"06-10","member_number":"FY102290","first_name":"PATRICK","last_name":"BAUTISTA","classification":"U","division":"PCC","hit_factor":6.8966},{"match_name":"EHPSA USPSA 27June 2021","match_date":"2021-06-27","stage_classifiercode":"06-10","member_number":"A127596","first_name":"CHRIS","last_name":"CUNNINGHAM","classification":"C","division":"PCC","hit_factor":6.8966},{"match_name":"LBAS 170819","match_date":"2017-08-19","stage_classifiercode":"06-10","member_number":"A34448","first_name":"LARRY","last_name":"LEBEAU","classification":"U","division":"PCC","hit_factor":6.8966},{"match_name":"ISPS JULY 2nd 2016","match_date":"2016-07-02","stage_classifiercode":"06-10","member_number":"A82305","first_name":"J","last_name":"BATES","classification":"U","division":"PCC","hit_factor":6.8807},{"match_name":"WSRC USPSA 7-21/22-2018","match_date":"2018-07-21","stage_classifiercode":"06-10","member_number":"TY82645","first_name":"DARRYL","last_name":"VANCIL","classification":"B","division":"PCC","hit_factor":6.8807},{"match_name":"OREGON TCGC CC02 USPSA NOV 21 2021","match_date":"2021-11-21","stage_classifiercode":"06-10","member_number":"TY44669","first_name":"RICH","last_name":"HALLEY","classification":"U","division":"PCC","hit_factor":6.8807},{"match_name":"PRPS USPSA Nov   26 2017","match_date":"2017-11-01","stage_classifiercode":"06-10","member_number":"\"\"","first_name":"JEFF","last_name":"CHAPMAN","classification":"\"\"","division":"PCC","hit_factor":6.8807},{"match_name":"ORSA USPSA October 2020","match_date":"2020-10-17","stage_classifiercode":"06-10","member_number":"A98757","first_name":"DENNIS","last_name":"KRIEGER","classification":"B","division":"PCC","hit_factor":6.8807},{"match_name":"WSRC USPSA 7-21/22-2018","match_date":"2018-07-21","stage_classifiercode":"06-10","member_number":"A84108","first_name":"MIKE","last_name":"WEBB","classification":"C","division":"PCC","hit_factor":6.865},{"match_name":"Richmond Hot Shots September 1st-2nd 2018 USPSA Pistol Match","match_date":"2018-09-01","stage_classifiercode":"06-10","member_number":"10197","first_name":"DAVE","last_name":"BUNN","classification":"B","division":"PCC","hit_factor":6.865},{"match_name":"Paul Bunyan April 7th-8th All Classifier Match NW01","match_date":"2018-04-07","stage_classifiercode":"06-10","member_number":"A51227","first_name":"KEVIN","last_name":"OLSON","classification":"B","division":"PCC","hit_factor":6.8493},{"match_name":"WGC June 2018 USPSA","match_date":"2018-06-10","stage_classifiercode":"06-10","member_number":"TY65757","first_name":"LIN","last_name":"XIONG","classification":"C","division":"PCC","hit_factor":6.8493},{"match_name":"ORSA USPSA Classifier Side  Match Feb 2017","match_date":"2017-02-18","stage_classifiercode":"06-10","member_number":"TY70657","first_name":"DAVID","last_name":"PEREZ","classification":"U","division":"PCC","hit_factor":6.8493},{"match_name":"NCPS USPSA Handgun Match March 25 2018z","match_date":"2018-03-25","stage_classifiercode":"06-10","member_number":"L4377","first_name":"JIM","last_name":"DUNLAP","classification":"C","division":"PCC","hit_factor":6.8493},{"match_name":"CCPL 04-25-2021","match_date":"2021-04-25","stage_classifiercode":"06-10","member_number":"TY94497","first_name":"RENE","last_name":"FORBES-PFITZER","classification":"C","division":"PCC","hit_factor":6.8337},{"match_name":"OSC April USPSA","match_date":"2021-04-18","stage_classifiercode":"06-10","member_number":"TY117957","first_name":"LINETTE","last_name":"RIZOS","classification":"C","division":"PCC","hit_factor":6.8337},{"match_name":"SWGC USPSA Pistol Match - December 2018","match_date":"2018-12-01","stage_classifiercode":"06-10","member_number":"A95752","first_name":"IVEY","last_name":"SANDERSON","classification":"D","division":"PCC","hit_factor":6.8182},{"match_name":"WGC WI USPSA Monthly Match 10-21-17","match_date":"2017-10-21","stage_classifiercode":"06-10","member_number":"A89059","first_name":"GENE","last_name":"ANANIEV","classification":"U","division":"PCC","hit_factor":6.8027},{"match_name":"TPS USPSA AT CMP OCT 20 2018","match_date":"2018-10-20","stage_classifiercode":"06-10","member_number":"TY78088","first_name":"MIKE","last_name":"GOEBEL","classification":"B","division":"PCC","hit_factor":6.8027},{"match_name":"CCPL - June 2021","match_date":"2021-06-19","stage_classifiercode":"06-10","member_number":"A88144","first_name":"TOM","last_name":"LONG","classification":"U","division":"PCC","hit_factor":6.8027},{"match_name":"BORCC USPSA June 2017","match_date":"2017-06-25","stage_classifiercode":"06-10","member_number":"L3378","first_name":"CHRIS","last_name":"GILSON","classification":"A","division":"PCC","hit_factor":6.8027},{"match_name":"Custer December USPSA","match_date":"2016-12-04","stage_classifiercode":"06-10","member_number":"TY78426","first_name":"MICHAEL","last_name":"BERNER","classification":"U","division":"PCC","hit_factor":6.8027},{"match_name":"2021-03 Bone Creek USPSA","match_date":"2021-03-07","stage_classifiercode":"06-10","member_number":"A117501","first_name":"ROD","last_name":"COLEMAN","classification":"B","division":"PCC","hit_factor":6.7873},{"match_name":"Chillicothe Sportsmens Club December USPSA","match_date":"2020-12-20","stage_classifiercode":"06-10","member_number":"L4958","first_name":"CODY","last_name":"DENGLER","classification":"U","division":"PCC","hit_factor":6.7873},{"match_name":"Custer Uspsa December","match_date":"2018-12-02","stage_classifiercode":"06-10","member_number":"A109299","first_name":"JOSEPH","last_name":"IMPERIO","classification":"U","division":"PCC","hit_factor":6.772},{"match_name":"CGGR May USPSA Match","match_date":"2017-05-20","stage_classifiercode":"06-10","member_number":"A93398","first_name":"DAVID","last_name":"HOHING","classification":"U","division":"PCC","hit_factor":6.772},{"match_name":"Paul Bunyan April 7th-8th All Classifier Match NW01","match_date":"2018-04-07","stage_classifiercode":"06-10","member_number":"TY47022","first_name":"BRUCE","last_name":"WOOD (2)","classification":"U","division":"PCC","hit_factor":6.7568},{"match_name":"OFGC USPSA Match 11-18-17","match_date":"2017-11-18","stage_classifiercode":"06-10","member_number":"A92627","first_name":"CHRIS","last_name":"YATES","classification":"C","division":"PCC","hit_factor":6.7568},{"match_name":"Shadow Hawk Defense USPSA SPECIAL CLASSIFIER","match_date":"2021-11-11","stage_classifiercode":"06-10","member_number":"Ty99998","first_name":"LEONARD","last_name":"ROY","classification":"B","division":"PCC","hit_factor":6.7568},{"match_name":"Green Valley March 2017","match_date":"2017-03-25","stage_classifiercode":"06-10","member_number":"A60217","first_name":"GARY","last_name":"SANDERS","classification":"B","division":"PCC","hit_factor":6.7568},{"match_name":"Oxford OHS05 090521","match_date":"2021-09-05","stage_classifiercode":"06-10","member_number":"a32462","first_name":"BRADLEY","last_name":"BOYD","classification":"C","division":"PCC","hit_factor":6.7265},{"match_name":"Hosemasters 2nd Sunday August 2017","match_date":"2017-08-13","stage_classifiercode":"06-10","member_number":"A58956","first_name":"RICK","last_name":"KORZEP","classification":"A","division":"PCC","hit_factor":6.7114},{"match_name":"PCWC USPSA  9 26 2020","match_date":"2020-09-26","stage_classifiercode":"06-10","member_number":"a65896","first_name":"JON","last_name":"YOUNG","classification":"B","division":"PCC","hit_factor":6.7114},{"match_name":"Pioneer Action Shooters USPSA 5-23-21 Special Classifer","match_date":"2021-05-23","stage_classifiercode":"06-10","member_number":"A93279","first_name":"JONAH","last_name":"COLDWELL","classification":"U","division":"PCC","hit_factor":6.7114},{"match_name":"Deadwood Boys USPSA All Classifier Match - 29 July 2018","match_date":"2018-07-29","stage_classifiercode":"06-10","member_number":"A103826","first_name":"CHRISPY","last_name":"PARK","classification":"U","division":"PCC","hit_factor":6.6964},{"match_name":"Richmond Hot Shots September 1st-2nd 2018 USPSA Pistol Match","match_date":"2018-09-01","stage_classifiercode":"06-10","member_number":"TY88318","first_name":"MIKE","last_name":"HALL","classification":"A","division":"PCC","hit_factor":6.6964},{"match_name":"LCSC Linden USPSA 120918","match_date":"2018-12-09","stage_classifiercode":"06-10","member_number":"A88783","first_name":"JOHNMAR","last_name":"SAMSON","classification":"A","division":"PCC","hit_factor":6.6964},{"match_name":"MASTER BLASTERS & SSFGA USPSA - September","match_date":"2021-09-18","stage_classifiercode":"06-10","member_number":"TY114518","first_name":"RICHARD","last_name":"HOPLEY","classification":"B","division":"PCC","hit_factor":6.6964},{"match_name":"Gem City Gun Club 9-1 and 9-2-2018","match_date":"2018-09-01","stage_classifiercode":"06-10","member_number":"TY102572","first_name":"DAVE","last_name":"WILDE","classification":"U","division":"PCC","hit_factor":6.6815},{"match_name":"OFGC USPSA Match Oct 16","match_date":"2016-10-16","stage_classifiercode":"06-10","member_number":"FY45785","first_name":"BRUCE","last_name":"BETHELL","classification":"D","division":"PCC","hit_factor":6.6815},{"match_name":"LdF USPSA Match May 27 2017","match_date":"2017-05-27","stage_classifiercode":"06-10","member_number":"PEN","first_name":"CHRIS","last_name":"NOSER","classification":"U","division":"PCC","hit_factor":6.6815},{"match_name":"CCPS July 2018 USPSA","match_date":"2018-07-15","stage_classifiercode":"06-10","member_number":"L3506","first_name":"DAN","last_name":"MILLER","classification":"B","division":"PCC","hit_factor":6.6667},{"match_name":"Springfield Tactical Shooters 09-07-2017","match_date":"2017-09-07","stage_classifiercode":"06-10","member_number":"TY78203","first_name":"JIM","last_name":"SHURES","classification":"B","division":"PCC","hit_factor":6.6667},{"match_name":"OSC April USPSA","match_date":"2021-04-18","stage_classifiercode":"06-10","member_number":"A128555","first_name":"MATTHEW","last_name":"BOGUES","classification":"A","division":"PCC","hit_factor":6.6667},{"match_name":"Deadwood Boys USPSA All Classifier Match - 29 July 2018","match_date":"2018-07-29","stage_classifiercode":"06-10","member_number":"TY50983","first_name":"HERMAN","last_name":"BAUTISTA","classification":"U","division":"PCC","hit_factor":6.6519},{"match_name":"December 2017 CAS USPSA","match_date":"2017-12-03","stage_classifiercode":"06-10","member_number":"A103381","first_name":"ROBERT","last_name":"MCNAYLOR","classification":"C","division":"PCC","hit_factor":6.6519},{"match_name":"SWGC USPSA Pistol Match - December 2018","match_date":"2018-12-01","stage_classifiercode":"06-10","member_number":"TY97327","first_name":"TIM","last_name":"WEBSTER","classification":"U","division":"PCC","hit_factor":6.6372},{"match_name":"DWB - Deadwood Boys USPSA 19 January 2020","match_date":"2020-01-19","stage_classifiercode":"06-10","member_number":"A106125","first_name":"DARDANI","last_name":"DAVID","classification":"U","division":"PCC","hit_factor":6.6372},{"match_name":"ORSA USPSA Classifier Side  Match Feb 2017","match_date":"2017-02-18","stage_classifiercode":"06-10","member_number":"ty100944","first_name":"STEVE","last_name":"MARMADUKE","classification":"U","division":"PCC","hit_factor":6.6372},{"match_name":"Custer December USPSA","match_date":"2016-12-04","stage_classifiercode":"06-10","member_number":"TY14867","first_name":"RANDY","last_name":"HESS","classification":"U","division":"PCC","hit_factor":6.6372},{"match_name":"Quantico QPS QSC USPSA Match 9 APR 2017","match_date":"2017-04-09","stage_classifiercode":"06-10","member_number":"A85896","first_name":"JOHN","last_name":"MCQUEEN","classification":"C","division":"PCC","hit_factor":6.6225},{"match_name":"FBURG Flood June 3 2018","match_date":"2018-06-03","stage_classifiercode":"06-10","member_number":"A101908","first_name":"MAURO","last_name":"FARINELLI","classification":"B","division":"PCC","hit_factor":6.6225},{"match_name":"NISA April 2017 - Classifier","match_date":"2017-04-23","stage_classifiercode":"06-10","member_number":"FY91203","first_name":"DOUGLAS","last_name":"QUAMME","classification":"U","division":"PCC","hit_factor":6.6079},{"match_name":"SWGC USPSA Pistol Match - March 2020","match_date":"2020-03-07","stage_classifiercode":"06-10","member_number":"TY39654","first_name":"LEE","last_name":"DENNEY","classification":"C","division":"PCC","hit_factor":6.6079},{"match_name":"GRPC USPSA CINCO DE MAYO","match_date":"2018-05-06","stage_classifiercode":"06-10","member_number":"TY96553","first_name":"DANNY","last_name":"NARAMORE","classification":"C","division":"PCC","hit_factor":6.5934},{"match_name":"YMM  IPSC 2018_07_08","match_date":"2018-07-08","stage_classifiercode":"06-10","member_number":"TY63399","first_name":"JOHNNIE","last_name":"CADY","classification":"D","division":"PCC","hit_factor":6.5934},{"match_name":"Hosemasters 2nd Sunday August 2017","match_date":"2017-08-13","stage_classifiercode":"06-10","member_number":"A91531","first_name":"DIANA","last_name":"BRAFFORD","classification":"U","division":"PCC","hit_factor":6.5934},{"match_name":"MCAS June 2018 USPSA Match","match_date":"2018-06-30","stage_classifiercode":"06-10","member_number":"\"\"","first_name":"ADAM","last_name":"BELL","classification":"Unclassified","division":"PCC","hit_factor":6.5934},{"match_name":"Salt City practical shooting league 'all classifier match'","match_date":"2020-08-30","stage_classifiercode":"06-10","member_number":"a104092","first_name":"CALEB","last_name":"BAILEY","classification":"U","division":"PCC","hit_factor":6.5789},{"match_name":"ORSA USPSA October 2020","match_date":"2020-10-17","stage_classifiercode":"06-10","member_number":"A100234","first_name":"TONY","last_name":"MARTIN","classification":"G","division":"PCC","hit_factor":6.5789},{"match_name":"WGC June 2018 USPSA","match_date":"2018-06-10","stage_classifiercode":"06-10","member_number":"TY80396","first_name":"WILSON","last_name":"BARHAM","classification":"B","division":"PCC","hit_factor":6.5646},{"match_name":"FBURG March 2021 Level I USPSA ","match_date":"2021-03-06","stage_classifiercode":"06-10","member_number":"TY88424","first_name":"CRAIG","last_name":"PETERSON","classification":"C","division":"PCC","hit_factor":6.5646},{"match_name":"RangeMasters 9-7-2017","match_date":"2017-09-07","stage_classifiercode":"06-10","member_number":"\"\"","first_name":"JASON","last_name":"MITCHELL","classification":"U","division":"PCC","hit_factor":6.5502},{"match_name":"RBGC USPSA 2021-8-28","match_date":"2021-08-28","stage_classifiercode":"06-10","member_number":"TY25385","first_name":"MARK","last_name":"STAMPER","classification":"B","division":"PCC","hit_factor":6.5502},{"match_name":"Brothers N Arms August 2017 USPSA Match","match_date":"2017-08-19","stage_classifiercode":"06-10","member_number":"TY3936","first_name":"TOMMY","last_name":"CABELL","classification":"U","division":"PCC","hit_factor":6.5359},{"match_name":"Nampa USPSA July 31st 2021","match_date":"2021-07-31","stage_classifiercode":"06-10","member_number":"TY87846","first_name":"JOHN","last_name":"JENSEN","classification":"B","division":"PCC","hit_factor":6.5359},{"match_name":"Richmond Hot Shots September 1st-2nd 2018 USPSA Pistol Match","match_date":"2018-09-01","stage_classifiercode":"06-10","member_number":"TY97642","first_name":"DANIEL","last_name":"NUNO","classification":"B","division":"PCC","hit_factor":6.5359},{"match_name":"Paul Bunyan April 7th-8th All Classifier Match NW01","match_date":"2018-04-07","stage_classifiercode":"06-10","member_number":"\"\"","first_name":"AARON","last_name":"SCHMITT","classification":"U","division":"PCC","hit_factor":6.5217},{"match_name":"Fairfax PS USPSA July 2017","match_date":"2017-07-25","stage_classifiercode":"06-10","member_number":"a101390","first_name":"WILL","last_name":"TUNG","classification":"U","division":"PCC","hit_factor":6.5217},{"match_name":"Whitewater USPSA 3-18-17","match_date":"2017-03-18","stage_classifiercode":"06-10","member_number":"A43412","first_name":"NATE","last_name":"MELBY","classification":"U","division":"PCC","hit_factor":6.5217},{"match_name":"Richmond Hot Shots July 15-16-2017 USPSA Pistol Match","match_date":"2017-07-15","stage_classifiercode":"06-10","member_number":"A79956","first_name":"EDWIN","last_name":"CHANG","classification":"B","division":"PCC","hit_factor":6.5217},{"match_name":"NISA April 2017 - Classifier","match_date":"2017-04-23","stage_classifiercode":"06-10","member_number":"ty73221","first_name":"JAY","last_name":"HOLLINGSWORTH","classification":"U","division":"PCC","hit_factor":6.5217},{"match_name":"Pioneer Action Shooters USPSA 5-23-21 Special Classifer","match_date":"2021-05-23","stage_classifiercode":"06-10","member_number":"TY44021","first_name":"DON","last_name":"SELESKY","classification":"B","division":"PCC","hit_factor":6.5217},{"match_name":"EWPSA 2018-01","match_date":"2018-01-21","stage_classifiercode":"06-10","member_number":"B6","first_name":"DWIGHT","last_name":"HUGHES","classification":"U","division":"PCC","hit_factor":6.5217},{"match_name":"Quantico QPS QSC USPSA Match 9 APR 2017","match_date":"2017-04-09","stage_classifiercode":"06-10","member_number":"A62028","first_name":"JIM","last_name":"WHEELER","classification":"U","division":"PCC","hit_factor":6.5076},{"match_name":"TAS Classifier 2","match_date":"2017-12-10","stage_classifiercode":"06-10","member_number":"A100690","first_name":"EUGENE","last_name":"YOON","classification":"U","division":"PCC","hit_factor":6.5076},{"match_name":"RBGC USPSA 2021-8-28","match_date":"2021-08-28","stage_classifiercode":"06-10","member_number":"A92921","first_name":"FRED","last_name":"WU","classification":"B","division":"PCC","hit_factor":6.5076},{"match_name":"CBS March USPSA Steel Match","match_date":"2021-03-07","stage_classifiercode":"06-10","member_number":"A98137","first_name":"PHIL","last_name":"UNDERWOOD","classification":"A","division":"PCC","hit_factor":6.5076},{"match_name":"Space Coast Practical Shooters","match_date":"2018-06-02","stage_classifiercode":"06-10","member_number":"A103795","first_name":"MICHELE","last_name":"PRICE","classification":"C","division":"PCC","hit_factor":6.5076},{"match_name":"TPS USPSA AT CMP OCT 20 2018","match_date":"2018-10-20","stage_classifiercode":"06-10","member_number":"A94603","first_name":"RONALDO","last_name":"BORGES","classification":"B","division":"PCC","hit_factor":6.4935},{"match_name":"Gem City Gun Club 4-7 and 4-8-18","match_date":"2018-04-07","stage_classifiercode":"06-10","member_number":"TY95584","first_name":"MICHAEL","last_name":"ORLANDI","classification":"D","division":"PCC","hit_factor":6.4935},{"match_name":"Shasta Shooters August  2018","match_date":"2018-08-11","stage_classifiercode":"06-10","member_number":"FY26846","first_name":"ROCKY","last_name":"EVANS","classification":"B","division":"PCC","hit_factor":6.4935},{"match_name":"OPSC USPSA  OCTOBER 2017","match_date":"2017-10-07","stage_classifiercode":"06-10","member_number":"A70578","first_name":"ED","last_name":"NICHOLS","classification":"C","division":"PCC","hit_factor":6.4795},{"match_name":"Custer December USPSA","match_date":"2016-12-04","stage_classifiercode":"06-10","member_number":"A87880","first_name":"RUSTY","last_name":"SPIKER","classification":"U","division":"PCC","hit_factor":6.4655},{"match_name":"TAS Classifier 2","match_date":"2017-12-10","stage_classifiercode":"06-10","member_number":"A99529","first_name":"KENNETH","last_name":"KLOEPPEL","classification":"\"\"","division":"PCC","hit_factor":6.4516},{"match_name":"Shadow Hawk Defense USPSA SPECIAL CLASSIFIER","match_date":"2021-11-11","stage_classifiercode":"06-10","member_number":"L4677","first_name":"TED","last_name":"MURPHY","classification":"B","division":"PCC","hit_factor":6.4516},{"match_name":"MCAS June 2018 USPSA Match","match_date":"2018-06-30","stage_classifiercode":"06-10","member_number":"Ty29750","first_name":"CRAIG","last_name":"BOYD","classification":"B","division":"PCC","hit_factor":6.4516},{"match_name":"ARPC USPSA Match 8-26-18","match_date":"2018-08-26","stage_classifiercode":"06-10","member_number":"A67988","first_name":"WILLIAM","last_name":"LEMEN","classification":"C","division":"PCC","hit_factor":6.4516},{"match_name":"TPS USPSA AT CMP OCT 20 2018","match_date":"2018-10-20","stage_classifiercode":"06-10","member_number":"TY98974","first_name":"JOHN","last_name":"KUROSKI","classification":"B","division":"PCC","hit_factor":6.4378},{"match_name":"December 2017 CAS USPSA","match_date":"2017-12-03","stage_classifiercode":"06-10","member_number":"A101017","first_name":"LANNY","last_name":"RUSSELL","classification":"U","division":"PCC","hit_factor":6.4378},{"match_name":"Richmond Hot Shots July 15-16-2017 USPSA Pistol Match","match_date":"2017-07-15","stage_classifiercode":"06-10","member_number":"TY93622","first_name":"CARLO","last_name":"PABELICO","classification":"U","division":"PCC","hit_factor":6.4378},{"match_name":"Richmond Hot Shots July 15-16-2017 USPSA Pistol Match","match_date":"2017-07-15","stage_classifiercode":"06-10","member_number":"\"\"","first_name":"CRAIG","last_name":"MORIMOTO","classification":"U","division":"PCC","hit_factor":6.4378},{"match_name":"Southkent USPSA MAY match","match_date":"2017-05-20","stage_classifiercode":"06-10","member_number":"FY76371","first_name":"ROB","last_name":"WOODHOUSE","classification":"U","division":"PCC","hit_factor":6.4378},{"match_name":"LBAS 170819","match_date":"2017-08-19","stage_classifiercode":"06-10","member_number":"TY31924","first_name":"OTIS","last_name":"AUSTIN","classification":"A","division":"PCC","hit_factor":6.4378},{"match_name":"OFGC USPSA Match 11-18-17","match_date":"2017-11-18","stage_classifiercode":"06-10","member_number":"A75896","first_name":"ROBB","last_name":"ELLIOTT","classification":"B","division":"PCC","hit_factor":6.424},{"match_name":"EWPSA 2018-01","match_date":"2018-01-21","stage_classifiercode":"06-10","member_number":"TY51991","first_name":"ROBERT","last_name":"THOMPSON","classification":"U","division":"PCC","hit_factor":6.424},{"match_name":"Custer December USPSA","match_date":"2016-12-04","stage_classifiercode":"06-10","member_number":"TY75331","first_name":"JASON","last_name":"JAMES","classification":"U","division":"PCC","hit_factor":6.424},{"match_name":"PTPC November 4th  USPSA Match","match_date":"2018-11-04","stage_classifiercode":"06-10","member_number":"A73683","first_name":"BRYAN","last_name":"TECSON","classification":"M","division":"PCC","hit_factor":6.4103},{"match_name":"NISA April 2017 - Classifier","match_date":"2017-04-23","stage_classifiercode":"06-10","member_number":"A102816","first_name":"JARED","last_name":"GUILLIEN","classification":"X","division":"PCC","hit_factor":6.4103},{"match_name":"DSS - USPSA 18-08-12","match_date":"2018-08-12","stage_classifiercode":"06-10","member_number":"A88135","first_name":"MARK","last_name":"COLASANTE","classification":"M","division":"PCC","hit_factor":6.4103},{"match_name":"OREGON ARPC CC05 USPSA JUNE 10 2017","match_date":"2017-06-10","stage_classifiercode":"06-10","member_number":"TY82059","first_name":"KRISTINE","last_name":"HAYES","classification":"U","division":"PCC","hit_factor":6.4103},{"match_name":"Pioneer Action Shooters USPSA 5-23-21 Special Classifer","match_date":"2021-05-23","stage_classifiercode":"06-10","member_number":"TY84597","first_name":"NORMAN","last_name":"DAVIS","classification":"C","division":"PCC","hit_factor":6.3966},{"match_name":"HRRB 12-01-2018","match_date":"2018-12-01","stage_classifiercode":"06-10","member_number":"L4313","first_name":"ART","last_name":"RIVERA","classification":"U","division":"PCC","hit_factor":6.383},{"match_name":"SFPC SMTCA","match_date":"2017-04-30","stage_classifiercode":"06-10","member_number":"TY90993","first_name":"WAYNE","last_name":"OWENSBY","classification":"C","division":"PCC","hit_factor":6.383},{"match_name":"Benton Gun Club-USPSA April 2017 Classifier","match_date":"2017-04-23","stage_classifiercode":"06-10","member_number":"Ty 84859","first_name":"ALAN","last_name":"HOLMES","classification":"U","division":"PCC","hit_factor":6.383},{"match_name":"LdF USPSA Match May 27 2017","match_date":"2017-05-27","stage_classifiercode":"06-10","member_number":"TY81857","first_name":"MATT","last_name":"MADDEN","classification":"C","division":"PCC","hit_factor":6.383},{"match_name":"Custer December USPSA","match_date":"2016-12-04","stage_classifiercode":"06-10","member_number":"\"\"","first_name":"BEN","last_name":"QUINN","classification":"U","division":"PCC","hit_factor":6.383},{"match_name":"Eagles Nest July 30th","match_date":"2017-07-30","stage_classifiercode":"06-10","member_number":"TY75462","first_name":"JASON","last_name":"HUGHES","classification":"U","division":"PCC","hit_factor":6.3694},{"match_name":"Custer Uspsa December","match_date":"2018-12-02","stage_classifiercode":"06-10","member_number":"TY68271","first_name":"SCOTT","last_name":"MOUILLE","classification":"B","division":"PCC","hit_factor":6.3694},{"match_name":"Richmond Hot Shots September 1st-2nd 2018 USPSA Pistol Match","match_date":"2018-09-01","stage_classifiercode":"06-10","member_number":"\"\"","first_name":"MICHAEL","last_name":"LOOK","classification":"U","division":"PCC","hit_factor":6.3694},{"match_name":"AGC_20170507","match_date":"2017-05-07","stage_classifiercode":"06-10","member_number":"TY36854","first_name":"KEN","last_name":"KWIAT","classification":"M","division":"PCC","hit_factor":6.3694},{"match_name":"LCSC Linden USPSA 061018","match_date":"2018-06-10","stage_classifiercode":"06-10","member_number":"TY92465","first_name":"JOSE","last_name":"RAPADAS","classification":"B","division":"PCC","hit_factor":6.3559},{"match_name":"Quantico QPS QSC USPSA Match 9 APR 2017","match_date":"2017-04-09","stage_classifiercode":"06-10","member_number":"\"\"","first_name":"CHRISTOPHER","last_name":"HOWSER","classification":"U","division":"PCC","hit_factor":6.3425},{"match_name":"OREGON ARPC CC05 USPSA JUNE 10 2017","match_date":"2017-06-10","stage_classifiercode":"06-10","member_number":"TY91567","first_name":"ADAM","last_name":"BELFUS","classification":"U","division":"PCC","hit_factor":6.3425},{"match_name":"Fairfax PS USPSA July 2017","match_date":"2017-07-25","stage_classifiercode":"06-10","member_number":"TY83821","first_name":"DEREK","last_name":"EINSIG","classification":"A","division":"PCC","hit_factor":6.3291},{"match_name":"YMM  IPSC 2018_07_08","match_date":"2018-07-08","stage_classifiercode":"06-10","member_number":"A48846","first_name":"ALLEN","last_name":"NELSON","classification":"B","division":"PCC","hit_factor":6.3291},{"match_name":"EAGC March 2021 USPSA Pistol Match","match_date":"2021-03-21","stage_classifiercode":"06-10","member_number":"A118987","first_name":"DAVID","last_name":"MARTIN","classification":"D","division":"PCC","hit_factor":6.3158},{"match_name":"RBGC USPSA 2021-8-28","match_date":"2021-08-28","stage_classifiercode":"06-10","member_number":"A102109","first_name":"JASON","last_name":"CLARK","classification":"G","division":"PCC","hit_factor":6.3158},{"match_name":"Gem City Gun Club 4-7 and 4-8-18","match_date":"2018-04-07","stage_classifiercode":"06-10","member_number":"A107915","first_name":"KYLE","last_name":"KONOPA","classification":"U","division":"PCC","hit_factor":6.3025},{"match_name":"CCPL 12112016","match_date":"2016-12-11","stage_classifiercode":"06-10","member_number":"A96473","first_name":"ADAM","last_name":"MUTHWILL","classification":"B","division":"PCC","hit_factor":6.3025},{"match_name":"WSPS OCTOBER 2018 USPSA MATCH","match_date":"2018-10-20","stage_classifiercode":"06-10","member_number":"Fy86391","first_name":"MARK","last_name":"RODRIGUEZ","classification":"B","division":"PCC","hit_factor":6.2893},{"match_name":"Gem City Gun Club 9-1 and 9-2-2018","match_date":"2018-09-01","stage_classifiercode":"06-10","member_number":"A100346","first_name":"JAMES","last_name":"SINGER","classification":"B","division":"PCC","hit_factor":6.2762},{"match_name":"Maine Practical Shooters October 2018","match_date":"2018-10-14","stage_classifiercode":"06-10","member_number":"A54089","first_name":"STEPHEN","last_name":"BADE","classification":"B","division":"PCC","hit_factor":6.263},{"match_name":"Custer December USPSA","match_date":"2016-12-04","stage_classifiercode":"06-10","member_number":"TY90071","first_name":"ZACK","last_name":"MARR","classification":"U","division":"PCC","hit_factor":6.237},{"match_name":"CCPL 12112016","match_date":"2016-12-11","stage_classifiercode":"06-10","member_number":"TY81578","first_name":"BRYAN","last_name":"PORTER","classification":"U","division":"PCC","hit_factor":6.1983},{"match_name":"Paul Bunyan April 7th-8th All Classifier Match NW01","match_date":"2018-04-07","stage_classifiercode":"06-10","member_number":"Ty107432","first_name":"REZNER","last_name":"ABUBAKAR","classification":"C","division":"PCC","hit_factor":6.1856},{"match_name":"OREGON ARPC CC05 USPSA JUNE 10 2017","match_date":"2017-06-10","stage_classifiercode":"06-10","member_number":"87653","first_name":"DENNIS","last_name":"OHEARN","classification":"C","division":"PCC","hit_factor":6.1856},{"match_name":"Eagles Nest July 30th","match_date":"2017-07-30","stage_classifiercode":"06-10","member_number":"A99541","first_name":"WADE","last_name":"SHANER","classification":"U","division":"PCC","hit_factor":6.1728},{"match_name":"Mvpsa USPSA  April 17","match_date":"2021-04-17","stage_classifiercode":"06-10","member_number":"ty108723","first_name":"MERRIDITH","last_name":"JOHNSTON","classification":"D","division":"PCC","hit_factor":6.1728},{"match_name":"MPPL 20200301","match_date":"2020-03-01","stage_classifiercode":"06-10","member_number":"NONE","first_name":"CHRISTOPHER","last_name":"TANOUYE","classification":"X- non USPSA member","division":"PCC","hit_factor":6.1728},{"match_name":"OSC April USPSA","match_date":"2021-04-18","stage_classifiercode":"06-10","member_number":"ty100837","first_name":"WILL","last_name":"MCCLUSKEY","classification":"C","division":"PCC","hit_factor":6.1728},{"match_name":"Deadwood Boys USPSA All Classifier Match - 29 July 2018","match_date":"2018-07-29","stage_classifiercode":"06-10","member_number":"L3260","first_name":"EDWARD","last_name":"SHEN","classification":"U","division":"PCC","hit_factor":6.1602},{"match_name":"MVPSA USPSA 12-01-18","match_date":"2018-12-01","stage_classifiercode":"06-10","member_number":"A61146","first_name":"MARK","last_name":"HOFFMIER","classification":"C","division":"PCC","hit_factor":6.1602},{"match_name":"BORCC USPSA June 2017","match_date":"2017-06-25","stage_classifiercode":"06-10","member_number":"L3568","first_name":"DAVE","last_name":"WARREN","classification":"U","division":"PCC","hit_factor":6.135},{"match_name":"Custer December USPSA","match_date":"2016-12-04","stage_classifiercode":"06-10","member_number":"L2396","first_name":"FLOYD","last_name":"SHOEMAKER","classification":"U","division":"PCC","hit_factor":6.135},{"match_name":"PMSC USPSA JULY 2018","match_date":"2018-07-01","stage_classifiercode":"06-10","member_number":"A103419","first_name":"GEORGE","last_name":"OLSAKOVSKY","classification":"C","division":"PCC","hit_factor":6.11},{"match_name":"SLPSA Jan USPSA match 1","match_date":"2020-01-11","stage_classifiercode":"06-10","member_number":"A87110","first_name":"ERIK","last_name":"SEO","classification":"A","division":"PCC","hit_factor":6.11},{"match_name":"Quantico QPS QSC USPSA Match 9 APR 2017","match_date":"2017-04-09","stage_classifiercode":"06-10","member_number":"A91520","first_name":"JEFF","last_name":"WHEELER","classification":"U","division":"PCC","hit_factor":6.0976},{"match_name":"Rankin Field Sunday USPSA","match_date":"2018-10-21","stage_classifiercode":"06-10","member_number":"FY80861","first_name":"DAVE","last_name":"MAYEDA","classification":"A","division":"PCC","hit_factor":6.0852},{"match_name":"Pioneer Action Shooters USPSA 5-23-21 Special Classifer","match_date":"2021-05-23","stage_classifiercode":"06-10","member_number":"TY656","first_name":"DAVID A","last_name":"TRAHAN","classification":"B","division":"PCC","hit_factor":6.0852},{"match_name":"NOCPC May 2018","match_date":"2018-05-13","stage_classifiercode":"06-10","member_number":"TY48541","first_name":"DOUG","last_name":"OLWICK","classification":"U","division":"PCC","hit_factor":6.0852},{"match_name":"Gem City Gun Club 4-7 and 4-8-18","match_date":"2018-04-07","stage_classifiercode":"06-10","member_number":"L3880","first_name":"JOE","last_name":"PARADISI","classification":"C","division":"PCC","hit_factor":6.0729},{"match_name":"FBURG Flood June 3 2018","match_date":"2018-06-03","stage_classifiercode":"06-10","member_number":"A93396","first_name":"MICHAEL","last_name":"COSTLEY","classification":"B","division":"PCC","hit_factor":6.0729},{"match_name":"Green Valley March 2017","match_date":"2017-03-25","stage_classifiercode":"06-10","member_number":"A50981","first_name":"DAVE","last_name":"MIDDLEMAS","classification":"U","division":"PCC","hit_factor":6.0729},{"match_name":"WSRC USPSA 7-21/22-2018","match_date":"2018-07-21","stage_classifiercode":"06-10","member_number":"A92234","first_name":"BOB","last_name":"KOKOTOVICH","classification":"B","division":"PCC","hit_factor":6.0606},{"match_name":"ORSA USPSA October 2020","match_date":"2020-10-17","stage_classifiercode":"06-10","member_number":"A125125","first_name":"BENJI","last_name":"CLEMMER","classification":"C","division":"PCC","hit_factor":6.0606},{"match_name":"ORSA USPSA Classifier Side  Match Feb 2017","match_date":"2017-02-18","stage_classifiercode":"06-10","member_number":"TY83175","first_name":"JEFF","last_name":"SHANKS","classification":"U","division":"PCC","hit_factor":6.0484},{"match_name":"WSPS JUNE 2017 USPSA MATCH","match_date":"2017-06-17","stage_classifiercode":"06-10","member_number":"A97964","first_name":"DEREK","last_name":"SMITH","classification":"C","division":"PCC","hit_factor":6.0362},{"match_name":"FLPSA MN14 USPSA April 26 2018","match_date":"2018-04-26","stage_classifiercode":"06-10","member_number":"a100853","first_name":"DUSTIN","last_name":"FELIX","classification":"U","division":"PCC","hit_factor":6.0362},{"match_name":"Shadow Hawk Defense USPSA SPECIAL CLASSIFIER","match_date":"2021-11-11","stage_classifiercode":"06-10","member_number":"A110246","first_name":"BEA","last_name":"LE","classification":"C","division":"PCC","hit_factor":6.0241},{"match_name":"Collin County USPSA 11-28-2021","match_date":"2021-11-28","stage_classifiercode":"06-10","member_number":"A134446","first_name":"GREGG","last_name":"EARNHART","classification":"D","division":"PCC","hit_factor":6.0241},{"match_name":"SWGC USPSA Pistol Match - March 2020","match_date":"2020-03-07","stage_classifiercode":"06-10","member_number":"TY97327","first_name":"TIM","last_name":"WEBSTER","classification":"C","division":"PCC","hit_factor":6.0241},{"match_name":"WSRC USPSA 7-21/22-2018","match_date":"2018-07-21","stage_classifiercode":"06-10","member_number":"A83708","first_name":"MARC","last_name":"SILVERMAN","classification":"U","division":"PCC","hit_factor":6.012},{"match_name":"Deadwood Boys USPSA All Classifier Match - 29 July 2018","match_date":"2018-07-29","stage_classifiercode":"06-10","member_number":"TY95542","first_name":"FRITO","last_name":"BANDITO","classification":"C","division":"PCC","hit_factor":6.012},{"match_name":"Deadwood Boys USPSA All Classifier Match - 29 July 2018","match_date":"2018-07-29","stage_classifiercode":"06-10","member_number":"TY109578","first_name":"WILLIAM","last_name":"MEYER","classification":"U","division":"PCC","hit_factor":6.012},{"match_name":"Springfield Tactical Shooters 02/04/2021","match_date":"2021-02-04","stage_classifiercode":"06-10","member_number":"A29017","first_name":"ED","last_name":"ANDERSON","classification":"\"\"","division":"PCC","hit_factor":6.012},{"match_name":"EHPSA USPSA 27June 2021","match_date":"2021-06-27","stage_classifiercode":"06-10","member_number":"TY40651","first_name":"RON","last_name":"RODGERS","classification":"B","division":"PCC","hit_factor":6.012},{"match_name":"Southern Arizona Practical Shooters 09_01_18","match_date":"2018-09-01","stage_classifiercode":"06-10","member_number":"L4455","first_name":"KEVIN","last_name":"LAMB (1)","classification":"M","division":"PCC","hit_factor":6.012},{"match_name":"YRPA  9/25/16  USPSA Pistol Match","match_date":"2016-09-23","stage_classifiercode":"06-10","member_number":"A92411","first_name":"CRAIG","last_name":"WORRELL","classification":"U","division":"PCC","hit_factor":6},{"match_name":"MCPSL Pistol 4-10-2021 (Classifier)","match_date":"2021-04-10","stage_classifiercode":"06-10","member_number":"TY90190","first_name":"STEVEN","last_name":"BEHRENDS","classification":"D","division":"PCC","hit_factor":6},{"match_name":"TPS USPSA -  August 2017 - Talon Range","match_date":"2017-08-05","stage_classifiercode":"06-10","member_number":"ty31007","first_name":"LEE","last_name":"SIIRA","classification":"U","division":"PCC","hit_factor":6},{"match_name":"SWGC USPSA Pistol Match - December 2018","match_date":"2018-12-01","stage_classifiercode":"06-10","member_number":"A82588","first_name":"JUDY","last_name":"MCFARLAND","classification":"C","division":"PCC","hit_factor":5.988},{"match_name":"LdF USPSA Match May 27 2017","match_date":"2017-05-27","stage_classifiercode":"06-10","member_number":"FY62295","first_name":"DAVID","last_name":"MORRIS","classification":"U","division":"PCC","hit_factor":5.988},{"match_name":"Alpha Mike Oct 2017","match_date":"2017-10-15","stage_classifiercode":"06-10","member_number":"\"\"","first_name":"NEIL","last_name":"FANTUS","classification":"U","division":"PCC","hit_factor":5.988},{"match_name":"NCPS USPSA Handgun Match March 25 2018z","match_date":"2018-03-25","stage_classifiercode":"06-10","member_number":"A3501","first_name":"JOHN","last_name":"HERNDON","classification":"U","division":"PCC","hit_factor":5.9642},{"match_name":"EWPSA 2018-01","match_date":"2018-01-21","stage_classifiercode":"06-10","member_number":"A61656","first_name":"BOB","last_name":"HAWKS","classification":"D","division":"PCC","hit_factor":5.9642},{"match_name":"IOP Rifle And Pistol Club USPSA Match 6-21","match_date":"2021-06-06","stage_classifiercode":"06-10","member_number":"A59843","first_name":"RICK","last_name":"SWARTZENDRUBER","classification":"U","division":"PCC","hit_factor":5.9524},{"match_name":"HPS Hot Summer Fun Club Match","match_date":"2017-07-22","stage_classifiercode":"06-10","member_number":"A87865","first_name":"BRUCE","last_name":"YAMAMOTO","classification":"U","division":"PCC","hit_factor":5.9524},{"match_name":"Paul Bunyan April 7th-8th All Classifier Match NW01","match_date":"2018-04-07","stage_classifiercode":"06-10","member_number":"A98674","first_name":"JONATHAN","last_name":"GIESER","classification":"U","division":"PCC","hit_factor":5.9406},{"match_name":"Salt City practical shooting league 'all classifier match'","match_date":"2020-08-30","stage_classifiercode":"06-10","member_number":"A106540","first_name":"CAMERON","last_name":"CAHN","classification":"B","division":"PCC","hit_factor":5.9289},{"match_name":"Deadwood Boys USPSA All Classifier Match - 29 July 2018","match_date":"2018-07-29","stage_classifiercode":"06-10","member_number":"TY95244","first_name":"ALEX","last_name":"KO","classification":"U","division":"PCC","hit_factor":5.9289},{"match_name":"WELD ECO09 20180617","match_date":"2018-06-17","stage_classifiercode":"06-10","member_number":"A60755","first_name":"DOUG","last_name":"MERLE","classification":"U","division":"PCC","hit_factor":5.9172},{"match_name":"Hosemasters 2nd Sunday August 2017","match_date":"2017-08-13","stage_classifiercode":"06-10","member_number":"A84825","first_name":"RONNIE","last_name":"TANNER","classification":"D","division":"PCC","hit_factor":5.9172},{"match_name":"EWPSA 2021-08","match_date":"2021-08-15","stage_classifiercode":"06-10","member_number":"l3238","first_name":"MATT","last_name":"NEWBURN","classification":"M","division":"PCC","hit_factor":5.9172},{"match_name":"NW01 9-20-16","match_date":"2016-09-20","stage_classifiercode":"06-10","member_number":"a76637","first_name":"JEFF","last_name":"SNOPE","classification":"U","division":"PCC","hit_factor":5.9172},{"match_name":"Deadwood Boys USPSA All Classifier Match - 29 July 2018","match_date":"2018-07-29","stage_classifiercode":"06-10","member_number":"TY98956","first_name":"ED","last_name":"HOFILENA","classification":"U","division":"PCC","hit_factor":5.9055},{"match_name":"LdF USPSA Match May 27 2017","match_date":"2017-05-27","stage_classifiercode":"06-10","member_number":"TY83895","first_name":"PATRICK","last_name":"RUNION","classification":"U","division":"PCC","hit_factor":5.9055},{"match_name":"Shadow Hawk Defense USPSA SPECIAL CLASSIFIER","match_date":"2021-11-11","stage_classifiercode":"06-10","member_number":"A120434","first_name":"KAREN","last_name":"ZEIGLER","classification":"C","division":"PCC","hit_factor":5.8939},{"match_name":"PCWC USPSA  9 26 2020","match_date":"2020-09-26","stage_classifiercode":"06-10","member_number":"A25745","first_name":"DAN","last_name":"SANDERS","classification":"B","division":"PCC","hit_factor":5.8939},{"match_name":"PTPC November 4th  USPSA Match","match_date":"2018-11-04","stage_classifiercode":"06-10","member_number":"A77507","first_name":"LARRY","last_name":"HEMMENS","classification":"C","division":"PCC","hit_factor":5.8824},{"match_name":"Gem City Gun Club 11-4 and 11-5","match_date":"2017-11-04","stage_classifiercode":"06-10","member_number":"L1963","first_name":"DENNIS","last_name":"MICHALI","classification":"A","division":"PCC","hit_factor":5.8824},{"match_name":"SFPC SMTCA","match_date":"2017-04-30","stage_classifiercode":"06-10","member_number":"TY70667","first_name":"JORGE","last_name":"RODRIGUEZ","classification":"A","division":"PCC","hit_factor":5.8824},{"match_name":"MCAS June 2018 USPSA Match","match_date":"2018-06-30","stage_classifiercode":"06-10","member_number":"A82360","first_name":"MARK","last_name":"TURNER","classification":"Unclassified","division":"PCC","hit_factor":5.8824},{"match_name":"Alpha Mike Oct 2017","match_date":"2017-10-15","stage_classifiercode":"06-10","member_number":"A28015","first_name":"BRENT","last_name":"CAMPBELL","classification":"A","division":"PCC","hit_factor":5.8708},{"match_name":"Deadwood Boys USPSA All Classifier Match - 29 July 2018","match_date":"2018-07-29","stage_classifiercode":"06-10","member_number":"A27973","first_name":"VINKY","last_name":"CASTILLO","classification":"U","division":"PCC","hit_factor":5.848},{"match_name":"ARPC USPSA Match 8-26-18","match_date":"2018-08-26","stage_classifiercode":"06-10","member_number":"NONE","first_name":"DONOVAN","last_name":"MCDONALD","classification":"Unclassified","division":"PCC","hit_factor":5.848},{"match_name":"Pioneer Action Shooters USPSA 5-23-21 Special Classifer","match_date":"2021-05-23","stage_classifiercode":"06-10","member_number":"A106093","first_name":"DEREK","last_name":"DOWNING","classification":"B","division":"PCC","hit_factor":5.8366},{"match_name":"Richmond Hot Shots September 1st-2nd 2018 USPSA Pistol Match","match_date":"2018-09-01","stage_classifiercode":"06-10","member_number":"Ty68229","first_name":"JC","last_name":"SMITH","classification":"B","division":"PCC","hit_factor":5.8366},{"match_name":"Richmond Hot Shots September 1st-2nd 2018 USPSA Pistol Match","match_date":"2018-09-01","stage_classifiercode":"06-10","member_number":"A88783","first_name":"JOHNMAR","last_name":"SAMSON","classification":"A","division":"PCC","hit_factor":5.8366},{"match_name":"LCSC Linden USPSA 120918","match_date":"2018-12-09","stage_classifiercode":"06-10","member_number":"A 3501","first_name":"JOHN","last_name":"HERNDON","classification":"C","division":"PCC","hit_factor":5.8366},{"match_name":"ISPS JULY 2nd 2016","match_date":"2016-07-02","stage_classifiercode":"06-10","member_number":"TY83544","first_name":"ZACK","last_name":"IRWIN","classification":"U","division":"PCC","hit_factor":5.8252},{"match_name":"TPS USPSA AT CMP OCT 20 2018","match_date":"2018-10-20","stage_classifiercode":"06-10","member_number":"TY94006","first_name":"PAUL","last_name":"SIMS","classification":"U","division":"PCC","hit_factor":5.8252},{"match_name":"Springfield Tactical Shooters 09-07-2017","match_date":"2017-09-07","stage_classifiercode":"06-10","member_number":"A84207","first_name":"JEFF","last_name":"EMERY","classification":"C","division":"PCC","hit_factor":5.8252},{"match_name":"Space Coast Practical Shooters","match_date":"2018-06-02","stage_classifiercode":"06-10","member_number":"A77895","first_name":"LINCOLN","last_name":"SALVADOR","classification":"U","division":"PCC","hit_factor":5.8252},{"match_name":"Gem City Gun Club 9-1 and 9-2-2018","match_date":"2018-09-01","stage_classifiercode":"06-10","member_number":"L2450","first_name":"BUD","last_name":"CONNOLLY","classification":"C","division":"PCC","hit_factor":5.814},{"match_name":"Shadow Hawk Defense USPSA SPECIAL CLASSIFIER","match_date":"2021-11-11","stage_classifiercode":"06-10","member_number":"TY136841","first_name":"TODD","last_name":"MARSHALL","classification":"U","division":"PCC","hit_factor":5.814},{"match_name":"EAGC March 2021 USPSA Pistol Match","match_date":"2021-03-21","stage_classifiercode":"06-10","member_number":"A106403","first_name":"ISIS","last_name":"QUINONES","classification":"B","division":"PCC","hit_factor":5.814},{"match_name":"Fairfax PS USPSA July 2017","match_date":"2017-07-25","stage_classifiercode":"06-10","member_number":"A102542","first_name":"RON","last_name":"JONES","classification":"X","division":"PCC","hit_factor":5.8027},{"match_name":"OFGC USPSA Match 11-18-17","match_date":"2017-11-18","stage_classifiercode":"06-10","member_number":"A101376","first_name":"SHANE","last_name":"MACON","classification":"\"\"","division":"PCC","hit_factor":5.8027},{"match_name":"FBURG March 2021 Level I USPSA ","match_date":"2021-03-06","stage_classifiercode":"06-10","member_number":"A93396","first_name":"MICHAEL","last_name":"COSTLEY","classification":"A","division":"PCC","hit_factor":5.8027},{"match_name":"Gem City Gun Club 4-7 and 4-8-18","match_date":"2018-04-07","stage_classifiercode":"06-10","member_number":"PEN","first_name":"BOB","last_name":"LINK","classification":"U","division":"PCC","hit_factor":5.7915},{"match_name":"CBS March USPSA Steel Match","match_date":"2021-03-07","stage_classifiercode":"06-10","member_number":"TY115659","first_name":"BOOT","last_name":"CHUMBLEY","classification":"C","division":"PCC","hit_factor":5.7915},{"match_name":"AGC_20170507","match_date":"2017-05-07","stage_classifiercode":"06-10","member_number":"TY86616","first_name":"BILL","last_name":"WEEKS","classification":"U","division":"PCC","hit_factor":5.7915},{"match_name":"Paul Bunyan April 7th-8th All Classifier Match NW01","match_date":"2018-04-07","stage_classifiercode":"06-10","member_number":"A96809","first_name":"JUSTIN","last_name":"HILL","classification":"U","division":"PCC","hit_factor":5.7803},{"match_name":"FBURG March 2021 Level I USPSA ","match_date":"2021-03-06","stage_classifiercode":"06-10","member_number":"A120109","first_name":"RICH","last_name":"FLECHTNER","classification":"A","division":"PCC","hit_factor":5.7803},{"match_name":"OPSC USPSA  OCTOBER 2017","match_date":"2017-10-07","stage_classifiercode":"06-10","member_number":"A68902","first_name":"STEVE","last_name":"PARKER","classification":"U","division":"PCC","hit_factor":5.7692},{"match_name":"RBGC USPSA 2021-8-28","match_date":"2021-08-28","stage_classifiercode":"06-10","member_number":"TY117499","first_name":"SCOTT","last_name":"FANN","classification":"U","division":"PCC","hit_factor":5.7692},{"match_name":"HOPS USPSA 1020018 ","match_date":"2018-10-19","stage_classifiercode":"06-10","member_number":"TY104309","first_name":"STEVEN","last_name":"SKAGGS","classification":"U","division":"PCC","hit_factor":5.7582},{"match_name":"Deadwood Boys USPSA All Classifier Match - 29 July 2018","match_date":"2018-07-29","stage_classifiercode":"06-10","member_number":"TY42673","first_name":"CHARLES","last_name":"CHURCH","classification":"U","division":"PCC","hit_factor":5.7582},{"match_name":"Shadow Hawk Defense USPSA SPECIAL CLASSIFIER","match_date":"2021-11-11","stage_classifiercode":"06-10","member_number":"F137034","first_name":"EUNSOO","last_name":"KIM","classification":"U","division":"PCC","hit_factor":5.7582},{"match_name":"Space Coast Practical Shooters","match_date":"2018-06-02","stage_classifiercode":"06-10","member_number":"A56832","first_name":"DONALD","last_name":"PODSIADLO","classification":"U","division":"PCC","hit_factor":5.7582},{"match_name":"PMSC USPSA JULY 2018","match_date":"2018-07-01","stage_classifiercode":"06-10","member_number":"L3026","first_name":"DAVE","last_name":"DORISIO","classification":"A","division":"PCC","hit_factor":5.7471},{"match_name":"Gem City Gun Club 4-7 and 4-8-18","match_date":"2018-04-07","stage_classifiercode":"06-10","member_number":"A46120","first_name":"JON","last_name":"NIELSEN","classification":"B","division":"PCC","hit_factor":5.7252},{"match_name":"CCPL - June 2021","match_date":"2021-06-19","stage_classifiercode":"06-10","member_number":"L2450","first_name":"BUD","last_name":"CONNOLLY","classification":"C","division":"PCC","hit_factor":5.7034},{"match_name":"Gem City Gun Club 4-7 and 4-8-18","match_date":"2018-04-07","stage_classifiercode":"06-10","member_number":"TY42531","first_name":"JOHN","last_name":"MANZELL","classification":"U","division":"PCC","hit_factor":5.7034},{"match_name":"TAS Classifier 2","match_date":"2017-12-10","stage_classifiercode":"06-10","member_number":"A95738","first_name":"DAVID","last_name":"RAGSDALE","classification":"U","division":"PCC","hit_factor":5.6926},{"match_name":"TGC USPSA JANUARY 2018","match_date":"2018-01-20","stage_classifiercode":"06-10","member_number":"A83616","first_name":"LELAND","last_name":"JOHNSON","classification":"U","division":"PCC","hit_factor":5.6711},{"match_name":"Gem City Gun Club 4-7 and 4-8-18","match_date":"2018-04-07","stage_classifiercode":"06-10","member_number":"TY61270","first_name":"JAMIE","last_name":"MC DONOUGH","classification":"U","division":"PCC","hit_factor":5.6604},{"match_name":"HOPS USPSA 081917","match_date":"2017-08-19","stage_classifiercode":"06-10","member_number":"A101516","first_name":"GABRIEL","last_name":"SANCHEZ III","classification":"U","division":"PCC","hit_factor":5.6604},{"match_name":"ORSA USPSA Classifier Side  Match Feb 2017","match_date":"2017-02-18","stage_classifiercode":"06-10","member_number":"TY21268","first_name":"MARK","last_name":"LEVY","classification":"U","division":"PCC","hit_factor":5.6604},{"match_name":"WSRC USPSA 7-21/22-2018","match_date":"2018-07-21","stage_classifiercode":"06-10","member_number":"A111768","first_name":"ERIK","last_name":"BURKHOLDER","classification":"U","division":"PCC","hit_factor":5.6497},{"match_name":"NNRPA USPSA July 2018","match_date":"2018-07-28","stage_classifiercode":"06-10","member_number":"TY74267","first_name":"RICHARD","last_name":"LINDSAY","classification":"C","division":"PCC","hit_factor":5.6497},{"match_name":"Custer Uspsa December","match_date":"2018-12-02","stage_classifiercode":"06-10","member_number":"FY22573","first_name":"JAMES","last_name":"DONG","classification":"B","division":"PCC","hit_factor":5.6391},{"match_name":"CFRPC November USPSA","match_date":"2018-11-18","stage_classifiercode":"06-10","member_number":"A111011","first_name":"RANDY","last_name":"FLORES","classification":"U","division":"PCC","hit_factor":5.6391},{"match_name":"December 2017 CAS USPSA","match_date":"2017-12-03","stage_classifiercode":"06-10","member_number":"TY66899","first_name":"JOHN","last_name":"HOFFMAN","classification":"U","division":"PCC","hit_factor":5.618},{"match_name":"Richmond Hot Shots September 1st-2nd 2018 USPSA Pistol Match","match_date":"2018-09-01","stage_classifiercode":"06-10","member_number":"L3301","first_name":"KEITH","last_name":"MIYASAKI","classification":"B","division":"PCC","hit_factor":5.618},{"match_name":"LdF USPSA Match July 11 2021","match_date":"2021-07-11","stage_classifiercode":"06-10","member_number":"A84256","first_name":"TASSY","last_name":"HENNESSY","classification":"C","division":"PCC","hit_factor":5.6075},{"match_name":"Maine Practical Shooters October 2018","match_date":"2018-10-14","stage_classifiercode":"06-10","member_number":"A65806","first_name":"BRIAN","last_name":"KRAMPERT","classification":"C","division":"PCC","hit_factor":5.6075},{"match_name":"Deadwood Boys USPSA All Classifier Match - 29 July 2018","match_date":"2018-07-29","stage_classifiercode":"06-10","member_number":"A98726","first_name":"CALEB","last_name":"BAER","classification":"M","division":"PCC","hit_factor":5.5866},{"match_name":"RangeMasters 9-7-2017","match_date":"2017-09-07","stage_classifiercode":"06-10","member_number":"A94853","first_name":"BOB","last_name":"ZWECK","classification":"U","division":"PCC","hit_factor":5.5866},{"match_name":"SWGC USPSA Pistol Match - March 2020","match_date":"2020-03-07","stage_classifiercode":"06-10","member_number":"A93396","first_name":"MICHAEL","last_name":"COSTLEY","classification":"A","division":"PCC","hit_factor":5.5762},{"match_name":"TPS USPSA -  August 2017 - Talon Range","match_date":"2017-08-05","stage_classifiercode":"06-10","member_number":"L2734","first_name":"DON","last_name":"GIBSON","classification":"U","division":"PCC","hit_factor":5.5762},{"match_name":"WSRC USPSA 7-21/22-2018","match_date":"2018-07-21","stage_classifiercode":"06-10","member_number":"\"\"","first_name":"JEFF","last_name":"GRAFF","classification":"U","division":"PCC","hit_factor":5.5659},{"match_name":"LBAS 201017 October Practical Match","match_date":"2020-10-17","stage_classifiercode":"06-10","member_number":"A110896","first_name":"RICHARD","last_name":"VAN GORDER","classification":"U","division":"PCC","hit_factor":5.5556},{"match_name":"EWPSA 2018-01","match_date":"2018-01-21","stage_classifiercode":"06-10","member_number":"A104247","first_name":"MATTHEW","last_name":"MAYHAK","classification":"U","division":"PCC","hit_factor":5.5556},{"match_name":"Space Coast Practical Shooters","match_date":"2018-06-02","stage_classifiercode":"06-10","member_number":"A28277","first_name":"BUD","last_name":"EHRMANN","classification":"C","division":"PCC","hit_factor":5.5556},{"match_name":"Nisa April","match_date":"2021-04-25","stage_classifiercode":"06-10","member_number":"A133912","first_name":"AMY","last_name":"SCHROEDER","classification":"C","division":"PCC","hit_factor":5.5453},{"match_name":"CCPL - June 2021","match_date":"2021-06-19","stage_classifiercode":"06-10","member_number":"TY73110","first_name":"PHIL","last_name":"MCKENZIE","classification":"C","division":"PCC","hit_factor":5.5351},{"match_name":"Paul Bunyan April 7th-8th All Classifier Match NW01","match_date":"2018-04-07","stage_classifiercode":"06-10","member_number":"TY72819","first_name":"JASON","last_name":"DINGLEDINE","classification":"U","division":"PCC","hit_factor":5.5249},{"match_name":"PCWC USPSA  9 26 2020","match_date":"2020-09-26","stage_classifiercode":"06-10","member_number":"TY63926","first_name":"WYATT","last_name":"COLTRAIN","classification":"C","division":"PCC","hit_factor":5.5147},{"match_name":"WSPS JUNE 2017 USPSA MATCH","match_date":"2017-06-17","stage_classifiercode":"06-10","member_number":"A713","first_name":"JEFF","last_name":"PATTON","classification":"X","division":"PCC","hit_factor":5.5046},{"match_name":"IPSC93 April 2020","match_date":"2020-04-14","stage_classifiercode":"06-10","member_number":"A127199","first_name":"TALIA","last_name":"MAKAROV","classification":"U","division":"PCC","hit_factor":5.4945},{"match_name":"MASTER BLASTERS & SSFGA USPSA - September","match_date":"2021-09-18","stage_classifiercode":"06-10","member_number":"A-104656","first_name":"CRAIG","last_name":"TRAHAN","classification":"A","division":"PCC","hit_factor":5.4945},{"match_name":"AGC_20170507","match_date":"2017-05-07","stage_classifiercode":"06-10","member_number":"A96539","first_name":"BECKY","last_name":"MUELLER","classification":"U","division":"PCC","hit_factor":5.4945},{"match_name":"PMSC USPSA JULY 2018","match_date":"2018-07-01","stage_classifiercode":"06-10","member_number":"TY23758","first_name":"MATT","last_name":"MASLONEK","classification":"U","division":"PCC","hit_factor":5.4845},{"match_name":"OFGC USPSA Match 11-18-17","match_date":"2017-11-18","stage_classifiercode":"06-10","member_number":"FY45785","first_name":"BRUCE","last_name":"BETHELL","classification":"C","division":"PCC","hit_factor":5.4845},{"match_name":"Brothers N Arms August 2017 USPSA Match","match_date":"2017-08-19","stage_classifiercode":"06-10","member_number":"A99028","first_name":"JOHN","last_name":"CAUSEY","classification":"U","division":"PCC","hit_factor":5.4745},{"match_name":"Shasta Shooters August  2018","match_date":"2018-08-11","stage_classifiercode":"06-10","member_number":"T104197","first_name":"DAHNIA","last_name":"BELL","classification":"U","division":"PCC","hit_factor":5.4745},{"match_name":"DSS - USPSA 18-08-12","match_date":"2018-08-12","stage_classifiercode":"06-10","member_number":"A89773","first_name":"ADAM","last_name":"MARSHALL","classification":"U","division":"PCC","hit_factor":5.4745},{"match_name":"PTPC November 4th  USPSA Match","match_date":"2018-11-04","stage_classifiercode":"06-10","member_number":"TY99780","first_name":"JAIME","last_name":"BUENAVENTURA","classification":"D","division":"PCC","hit_factor":5.4645},{"match_name":"WGC WI USPSA Monthly Match 10-21-17","match_date":"2017-10-21","stage_classifiercode":"06-10","member_number":"CL49","first_name":"RICHARD","last_name":"MOREY","classification":"C","division":"PCC","hit_factor":5.4645},{"match_name":"Deadwood Boys USPSA All Classifier Match - 29 July 2018","match_date":"2018-07-29","stage_classifiercode":"06-10","member_number":"a26171","first_name":"JOEY","last_name":"CASTILO","classification":"U","division":"PCC","hit_factor":5.4645},{"match_name":"Maine Practical Shooters May 2021","match_date":"2021-05-08","stage_classifiercode":"06-10","member_number":"ty65806","first_name":"BRIAN","last_name":"KRAMPERT","classification":"C","division":"PCC","hit_factor":5.4545},{"match_name":"WSRC USPSA 7-21/22-2018","match_date":"2018-07-21","stage_classifiercode":"06-10","member_number":"TY74036","first_name":"SCOTT","last_name":"WILSON","classification":"U","division":"PCC","hit_factor":5.4446},{"match_name":"ACPSA March 2017","match_date":"2017-03-25","stage_classifiercode":"06-10","member_number":"TY83837","first_name":"BOB","last_name":"GUNDEL","classification":"C","division":"PCC","hit_factor":5.4348},{"match_name":"Gem City Gun Club 9-1 and 9-2-2018","match_date":"2018-09-01","stage_classifiercode":"06-10","member_number":"\"\"","first_name":"JOHN","last_name":"KNAUER","classification":"U","division":"PCC","hit_factor":5.4348},{"match_name":"EHPSA USPSA 27June 2021","match_date":"2021-06-27","stage_classifiercode":"06-10","member_number":"A113030","first_name":"KEVIN","last_name":"FISHER","classification":"\"\"","division":"PCC","hit_factor":5.4348},{"match_name":"NW01 9-20-16","match_date":"2016-09-20","stage_classifiercode":"06-10","member_number":"TY83033","first_name":"SCOTT","last_name":"SMITH","classification":"U","division":"PCC","hit_factor":5.4348},{"match_name":"TPS USPSA AT CMP OCT 20 2018","match_date":"2018-10-20","stage_classifiercode":"06-10","member_number":"A113650","first_name":"GARY","last_name":"GAUDIO","classification":"U","division":"PCC","hit_factor":5.4152},{"match_name":"ISPS JULY 2nd 2016","match_date":"2016-07-02","stage_classifiercode":"06-10","member_number":"TY13606","first_name":"PAUL","last_name":"GARCIA","classification":"U","division":"PCC","hit_factor":5.4054},{"match_name":"Richmond Hot Shots July 15-16-2017 USPSA Pistol Match","match_date":"2017-07-15","stage_classifiercode":"06-10","member_number":"A88398","first_name":"DAN","last_name":"PEKNIK","classification":"U","division":"PCC","hit_factor":5.4054},{"match_name":"EHPSA USPSA 27June 2021","match_date":"2021-06-27","stage_classifiercode":"06-10","member_number":"A130665","first_name":"KAYLIE","last_name":"DANIELS","classification":"U","division":"PCC","hit_factor":5.4054},{"match_name":"OREGON ARPC CC05 USPSA JUNE 10 2017","match_date":"2017-06-10","stage_classifiercode":"06-10","member_number":"A90925","first_name":"IAN","last_name":"COLE","classification":"U","division":"PCC","hit_factor":5.4054},{"match_name":"ARPC USPSA Match 9-24-17","match_date":"2017-09-24","stage_classifiercode":"06-10","member_number":"A32149","first_name":"LASZLO","last_name":"SZABO","classification":"B","division":"PCC","hit_factor":5.386},{"match_name":"CAPS 8-28-2021","match_date":"2021-08-28","stage_classifiercode":"06-10","member_number":"A101900","first_name":"DEWEY","last_name":"RICHARDSON","classification":"B","division":"PCC","hit_factor":5.386},{"match_name":"IOP Rifle And Pistol Club USPSA Match 6-21","match_date":"2021-06-06","stage_classifiercode":"06-10","member_number":"Ty54098","first_name":"WAYNE","last_name":"GOULD","classification":"U","division":"PCC","hit_factor":5.3763},{"match_name":"Gem City Gun Club 9-1 and 9-2-2018","match_date":"2018-09-01","stage_classifiercode":"06-10","member_number":"\"\"","first_name":"BOB","last_name":"LINK","classification":"U","division":"PCC","hit_factor":5.3763},{"match_name":"Chillicothe Sportsmens Club December USPSA","match_date":"2020-12-20","stage_classifiercode":"06-10","member_number":"A102630","first_name":"NATE","last_name":"POULSON","classification":"U","division":"PCC","hit_factor":5.3763},{"match_name":"Quantico QPS QSC USPSA Match 9 APR 2017","match_date":"2017-04-09","stage_classifiercode":"06-10","member_number":"L3460","first_name":"TROY","last_name":"HAYES","classification":"C","division":"PCC","hit_factor":5.3667},{"match_name":"MPPL 20200301","match_date":"2020-03-01","stage_classifiercode":"06-10","member_number":"TY49133","first_name":"AARON","last_name":"URASAKI","classification":"C","division":"PCC","hit_factor":5.3571},{"match_name":"ARPC USPSA Match 8-26-18","match_date":"2018-08-26","stage_classifiercode":"06-10","member_number":"L3904","first_name":"ROBERT","last_name":"RUMBLEY","classification":"C","division":"PCC","hit_factor":5.3571},{"match_name":"RBGC USPSA 2021-8-28","match_date":"2021-08-28","stage_classifiercode":"06-10","member_number":"TY41564","first_name":"BRUCE","last_name":"ANDERSON","classification":"C","division":"PCC","hit_factor":5.3476},{"match_name":"APSC USPSA Match 10-07-17","match_date":"2017-10-07","stage_classifiercode":"06-10","member_number":"\"\"","first_name":"JOSEPH","last_name":"GARCIA","classification":"U","division":"PCC","hit_factor":5.3476},{"match_name":"NISA April 2017 - Classifier","match_date":"2017-04-23","stage_classifiercode":"06-10","member_number":"PEN","first_name":"JASON","last_name":"BENJAMIN","classification":"U","division":"PCC","hit_factor":5.3286},{"match_name":"CFRPC November USPSA","match_date":"2018-11-18","stage_classifiercode":"06-10","member_number":"A108216","first_name":"LORETTA","last_name":"GEBOW","classification":"U","division":"PCC","hit_factor":5.3286},{"match_name":"ARPC USPSA Match 9-24-17","match_date":"2017-09-24","stage_classifiercode":"06-10","member_number":"A92234","first_name":"BOB","last_name":"KOKOTOVICH","classification":"C","division":"PCC","hit_factor":5.3191},{"match_name":"OREGON ARPC CC05 USPSA JUNE 10 2017","match_date":"2017-06-10","stage_classifiercode":"06-10","member_number":"L2957","first_name":"BRIAN","last_name":"BERKLEY","classification":"U","division":"PCC","hit_factor":5.3191},{"match_name":"Deadwood Boys USPSA All Classifier Match - 29 July 2018","match_date":"2018-07-29","stage_classifiercode":"06-10","member_number":"TY75469","first_name":"OSCAR","last_name":"ACENCIO","classification":"U","division":"PCC","hit_factor":5.3097},{"match_name":"CCPL 04-25-2021","match_date":"2021-04-25","stage_classifiercode":"06-10","member_number":"TY87403","first_name":"ROD","last_name":"PFITZER","classification":"C","division":"PCC","hit_factor":5.2817},{"match_name":"OREGON ARPC CC05 USPSA JUNE 10 2017","match_date":"2017-06-10","stage_classifiercode":"06-10","member_number":"A-93052","first_name":"AREN","last_name":"GONZALEZ","classification":"B","division":"PCC","hit_factor":5.2817},{"match_name":"IOP Rifle And Pistol Club USPSA Match 6-21","match_date":"2021-06-06","stage_classifiercode":"06-10","member_number":"ty32872","first_name":"JOHN","last_name":"LATTY","classification":"C","division":"PCC","hit_factor":5.2724},{"match_name":"WGC June 2018 USPSA","match_date":"2018-06-10","stage_classifiercode":"06-10","member_number":"\"\"","first_name":"JOHN","last_name":"LUMMUS","classification":"U","division":"PCC","hit_factor":5.2632},{"match_name":"Richmond Hot Shots July 15-16-2017 USPSA Pistol Match","match_date":"2017-07-15","stage_classifiercode":"06-10","member_number":"\"\"","first_name":"MICKY","last_name":"T","classification":"U","division":"PCC","hit_factor":5.2539},{"match_name":"Deadwood Boys USPSA All Classifier Match - 29 July 2018","match_date":"2018-07-29","stage_classifiercode":"06-10","member_number":"A112254","first_name":"JOAQUIN","last_name":"SERRATO","classification":"U","division":"PCC","hit_factor":5.2448},{"match_name":"WSPS JUNE 2017 USPSA MATCH","match_date":"2017-06-17","stage_classifiercode":"06-10","member_number":"TY31530","first_name":"DAVE","last_name":"RAGLAND","classification":"B","division":"PCC","hit_factor":5.2356},{"match_name":"AGC_20170507","match_date":"2017-05-07","stage_classifiercode":"06-10","member_number":"A86256","first_name":"DAVE","last_name":"BENSON","classification":"C","division":"PCC","hit_factor":5.2356},{"match_name":"CCPL - June 2021","match_date":"2021-06-19","stage_classifiercode":"06-10","member_number":"B16","first_name":"EDDIE","last_name":"HENRY","classification":"C","division":"PCC","hit_factor":5.2265},{"match_name":"Maine Practical Shooters October 2018","match_date":"2018-10-14","stage_classifiercode":"06-10","member_number":"A-84597","first_name":"NORMAN","last_name":"DAVIS","classification":"C","division":"PCC","hit_factor":5.2265},{"match_name":"Sharp Practical Shooters August USPSA - Outdoor","match_date":"2021-08-22","stage_classifiercode":"06-10","member_number":"TY48358","first_name":"KEN","last_name":"COOMBS","classification":"B","division":"PCC","hit_factor":5.2174},{"match_name":"Pioneer Action Shooters USPSA 5-23-21 Special Classifer","match_date":"2021-05-23","stage_classifiercode":"06-10","member_number":"A131810","first_name":"MATT","last_name":"LECCACORVI","classification":"U","division":"PCC","hit_factor":5.2174},{"match_name":"Hopkinton August 2016 ","match_date":"2016-08-06","stage_classifiercode":"06-10","member_number":"L3839","first_name":"ROBERT","last_name":"DRAPER","classification":"U","division":"PCC","hit_factor":5.2174},{"match_name":"Springfield Tactical Shooters 09-07-2017","match_date":"2017-09-07","stage_classifiercode":"06-10","member_number":"FY83614","first_name":"GARY","last_name":"GRAY","classification":"B","division":"PCC","hit_factor":5.2083},{"match_name":"Gem City Gun Club 11-4 and 11-5","match_date":"2017-11-04","stage_classifiercode":"06-10","member_number":"TY42531","first_name":"JOHN","last_name":"MANZELL","classification":"U","division":"PCC","hit_factor":5.1993},{"match_name":"NCPS USPSA Handgun Match March 25 2018z","match_date":"2018-03-25","stage_classifiercode":"06-10","member_number":"FY98474","first_name":"TONY","last_name":"PETERSON","classification":"U","division":"PCC","hit_factor":5.1993},{"match_name":"PMSC USPSA JULY 2018","match_date":"2018-07-01","stage_classifiercode":"06-10","member_number":"A82693","first_name":"LINDA","last_name":"DORISIO","classification":"C","division":"PCC","hit_factor":5.1813},{"match_name":"Gem City Gun Club 4-7 and 4-8-18","match_date":"2018-04-07","stage_classifiercode":"06-10","member_number":"A72574","first_name":"DAN","last_name":"SKOCZYLAS","classification":"C","division":"PCC","hit_factor":5.1813},{"match_name":"FLPSA MN14 USPSA April 26 2018","match_date":"2018-04-26","stage_classifiercode":"06-10","member_number":"A103272","first_name":"ERIC","last_name":"SANDSTROM","classification":"U","division":"PCC","hit_factor":5.1724},{"match_name":"TPS USPSA AT CMP OCT 20 2018","match_date":"2018-10-20","stage_classifiercode":"06-10","member_number":"TY97762","first_name":"PAUL","last_name":"HEDGEPATH","classification":"D","division":"PCC","hit_factor":5.137},{"match_name":"CBS GC08 USPSA Pistol","match_date":"2018-07-01","stage_classifiercode":"06-10","member_number":"TY38424","first_name":"BEN","last_name":"CRABTREE","classification":"U","division":"PCC","hit_factor":5.1282},{"match_name":"Grandbaggers December 2017","match_date":"2017-12-07","stage_classifiercode":"06-10","member_number":"CL164","first_name":"BOB","last_name":"RIPPY","classification":"U","division":"PCC","hit_factor":5.1195},{"match_name":"TPS USPSA -  August 2017 - Talon Range","match_date":"2017-08-05","stage_classifiercode":"06-10","member_number":"A99539","first_name":"KALEB","last_name":"CASEY","classification":"U","division":"PCC","hit_factor":5.1107},{"match_name":"Collin County USPSA 11-28-2021","match_date":"2021-11-28","stage_classifiercode":"06-10","member_number":"A131453","first_name":"JACKIE","last_name":"CAO","classification":"U","division":"PCC","hit_factor":5.102},{"match_name":"Chillicothe Sportsmens Club December USPSA","match_date":"2020-12-20","stage_classifiercode":"06-10","member_number":"A74372","first_name":"BRIAN","last_name":"ROWLISON","classification":"B","division":"PCC","hit_factor":5.0761},{"match_name":"Hampden RPC June USPSA Match","match_date":"2018-06-10","stage_classifiercode":"06-10","member_number":"TY61007","first_name":"STEVE","last_name":"RICHENS","classification":"Unclassified","division":"PCC","hit_factor":5.0676},{"match_name":"ARPC USPSA Match 9-24-17","match_date":"2017-09-24","stage_classifiercode":"06-10","member_number":"A32462","first_name":"BRADLEY","last_name":"BOYD","classification":"C","division":"PCC","hit_factor":5.059},{"match_name":"Oxford OHS05 090521","match_date":"2021-09-05","stage_classifiercode":"06-10","member_number":"Ty90291","first_name":"JUSTIN","last_name":"BULTMAN","classification":"U","division":"PCC","hit_factor":5.042},{"match_name":"Hosemasters 2nd Sunday August 2017","match_date":"2017-08-13","stage_classifiercode":"06-10","member_number":"TY45174","first_name":"JIM","last_name":"MANGINI","classification":"C","division":"PCC","hit_factor":5.0251},{"match_name":"EWPSA 2018-01","match_date":"2018-01-21","stage_classifiercode":"06-10","member_number":"TY70904","first_name":"MICHAEL","last_name":"GIMERA","classification":"B","division":"PCC","hit_factor":5.0251},{"match_name":"December 2017 CAS USPSA","match_date":"2017-12-03","stage_classifiercode":"06-10","member_number":"TY75540","first_name":"JAMES","last_name":"MAY","classification":"U","division":"PCC","hit_factor":4.9917},{"match_name":"MASTER BLASTERS & SSFGA USPSA - September","match_date":"2021-09-18","stage_classifiercode":"06-10","member_number":"TY114546","first_name":"DMITRY","last_name":"TELEGANOV","classification":"U","division":"PCC","hit_factor":4.9751},{"match_name":"CFRPC November USPSA","match_date":"2018-11-18","stage_classifiercode":"06-10","member_number":"\"\"","first_name":"DEXTER","last_name":"CRUZ","classification":"U","division":"PCC","hit_factor":4.9751},{"match_name":"WELD ECO09 20180617","match_date":"2018-06-17","stage_classifiercode":"06-10","member_number":"A61086","first_name":"CY","last_name":"SOTO","classification":"M","division":"PCC","hit_factor":4.9505},{"match_name":"ARPC USPSA Match 8-26-18","match_date":"2018-08-26","stage_classifiercode":"06-10","member_number":"TY13859","first_name":"FRANK","last_name":"OBARR","classification":"Unclassified","division":"PCC","hit_factor":4.9505},{"match_name":"Grandbaggers December 2017","match_date":"2017-12-07","stage_classifiercode":"06-10","member_number":"TY50145","first_name":"SUE","last_name":"LITTLE","classification":"U","division":"PCC","hit_factor":4.9505},{"match_name":"2020-03-07 USPSA at Phoenix Rod and Gun Club","match_date":"2020-03-07","stage_classifiercode":"06-10","member_number":"A46504","first_name":"TRISHA","last_name":"DENNETT","classification":"C","division":"PCC","hit_factor":4.9423},{"match_name":"Deadwood Boys USPSA All Classifier Match - 29 July 2018","match_date":"2018-07-29","stage_classifiercode":"06-10","member_number":"TY102425","first_name":"JAY","last_name":"LIZO","classification":"U","division":"PCC","hit_factor":4.9261},{"match_name":"RangeMasters 9-7-2017","match_date":"2017-09-07","stage_classifiercode":"06-10","member_number":"L2710","first_name":"GARY","last_name":"CATALAN","classification":"C","division":"PCC","hit_factor":4.918},{"match_name":"EAGC March 2021 USPSA Pistol Match","match_date":"2021-03-21","stage_classifiercode":"06-10","member_number":"A119961","first_name":"AUGUST","last_name":"OHAERI","classification":"U","division":"PCC","hit_factor":4.918},{"match_name":"ACPSA March 2017","match_date":"2017-03-25","stage_classifiercode":"06-10","member_number":"A69229","first_name":"CHARLIE","last_name":"NELSON","classification":"C","division":"PCC","hit_factor":4.91},{"match_name":"GRPC USPSA CINCO DE MAYO","match_date":"2018-05-06","stage_classifiercode":"06-10","member_number":"TY26527","first_name":"DAVE","last_name":"CAMPBELL","classification":"M","division":"PCC","hit_factor":4.902},{"match_name":"TPS USPSA AT CMP OCT 20 2018","match_date":"2018-10-20","stage_classifiercode":"06-10","member_number":"TY113996","first_name":"LUIS","last_name":"CRESPO","classification":"U","division":"PCC","hit_factor":4.894},{"match_name":"Deadwood Boys USPSA All Classifier Match - 29 July 2018","match_date":"2018-07-29","stage_classifiercode":"06-10","member_number":"A102749","first_name":"ASHLEY","last_name":"YAMAMOTO","classification":"U","division":"PCC","hit_factor":4.878},{"match_name":"EHPSA USPSA 27June 2021","match_date":"2021-06-27","stage_classifiercode":"06-10","member_number":"TY111882","first_name":"HARRY","last_name":"WOLFORD","classification":"C","division":"PCC","hit_factor":4.878},{"match_name":"IOP Rifle And Pistol Club USPSA Match 6-21","match_date":"2021-06-06","stage_classifiercode":"06-10","member_number":"\"\"","first_name":"WILLIAM","last_name":"SHONKA","classification":"U","division":"PCC","hit_factor":4.8622},{"match_name":"Hosemasters 2nd Sunday August 2017","match_date":"2017-08-13","stage_classifiercode":"06-10","member_number":"A55597","first_name":"ANTHONY","last_name":"LUCIANI","classification":"G","division":"PCC","hit_factor":4.8465},{"match_name":"Springfield Tactical Shooters 09-07-2017","match_date":"2017-09-07","stage_classifiercode":"06-10","member_number":"\"\"","first_name":"CHUCK","last_name":"MCLAUGHLIN","classification":"\"\"","division":"PCC","hit_factor":4.8309},{"match_name":"Richmond Hot Shots July 15-16-2017 USPSA Pistol Match","match_date":"2017-07-15","stage_classifiercode":"06-10","member_number":"TY83559","first_name":"JOHN","last_name":"DANPOUR","classification":"D","division":"PCC","hit_factor":4.8077},{"match_name":"HOPS USPSA 081917","match_date":"2017-08-19","stage_classifiercode":"06-10","member_number":"\"\"","first_name":"ROGER","last_name":"ENGELBREKTSON","classification":"U","division":"PCC","hit_factor":4.8077},{"match_name":"Paul Bunyan April 7th-8th All Classifier Match NW01","match_date":"2018-04-07","stage_classifiercode":"06-10","member_number":"TY-81957","first_name":"MARK","last_name":"PLUMMER","classification":"U","division":"PCC","hit_factor":4.8},{"match_name":"LBAS170429 Spray-N-Pray Classifier Match","match_date":"2017-04-29","stage_classifiercode":"06-10","member_number":"A24066","first_name":"GEORGE","last_name":"MANDES","classification":"B","division":"PCC","hit_factor":4.7923},{"match_name":"CCPS July 2018 USPSA","match_date":"2018-07-15","stage_classifiercode":"06-10","member_number":"a104259","first_name":"WADE","last_name":"JONES","classification":"U","division":"PCC","hit_factor":4.7771},{"match_name":"Gem City Gun Club 4-7 and 4-8-18","match_date":"2018-04-07","stage_classifiercode":"06-10","member_number":"\"\"","first_name":"JACK","last_name":"JAUCH","classification":"U","division":"PCC","hit_factor":4.7695},{"match_name":"April 2017 OPSC USPSA","match_date":"2017-04-09","stage_classifiercode":"06-10","member_number":"A81447","first_name":"MIKE","last_name":"JAMES","classification":"X","division":"PCC","hit_factor":4.7695},{"match_name":"WGC WI USPSA Monthly Match 10-21-17","match_date":"2017-10-21","stage_classifiercode":"06-10","member_number":"L312","first_name":"JEFF","last_name":"LOUD","classification":"U","division":"PCC","hit_factor":4.7619},{"match_name":"Collin County USPSA 11-28-2021","match_date":"2021-11-28","stage_classifiercode":"06-10","member_number":"TY101659","first_name":"MARK","last_name":"DRAPER","classification":"C","division":"PCC","hit_factor":4.7544},{"match_name":"Eagles Nest July 30th","match_date":"2017-07-30","stage_classifiercode":"06-10","member_number":"A61469","first_name":"JIM","last_name":"NAGEOTTE","classification":"X","division":"PCC","hit_factor":4.7319},{"match_name":"MPPL 20200301","match_date":"2020-03-01","stage_classifiercode":"06-10","member_number":"NONE","first_name":"MARK","last_name":"TANOUYE","classification":"X- non USPSA member","division":"PCC","hit_factor":4.7319},{"match_name":"6ta Fecha USPSA","match_date":"2018-06-24","stage_classifiercode":"06-10","member_number":"A97126","first_name":"JUDIBELLE","last_name":"MELENDEZ-ALCARAZ","classification":"U","division":"PCC","hit_factor":4.7319},{"match_name":"CFRPC November USPSA","match_date":"2018-11-18","stage_classifiercode":"06-10","member_number":"A100028","first_name":"CHRIS","last_name":"MAGLALANG","classification":"C","division":"PCC","hit_factor":4.717},{"match_name":"MCAS June 2018 USPSA Match","match_date":"2018-06-30","stage_classifiercode":"06-10","member_number":"A112019","first_name":"AME","last_name":"SCHANK NEWMAN","classification":"Unclassified","division":"PCC","hit_factor":4.7096},{"match_name":"SFPC SMTCA","match_date":"2017-04-30","stage_classifiercode":"06-10","member_number":"TY101600","first_name":"JIM","last_name":"ZUEL","classification":"U","division":"PCC","hit_factor":4.7022},{"match_name":"IOP Rifle And Pistol Club USPSA Match 6-21","match_date":"2021-06-06","stage_classifiercode":"06-10","member_number":"\"\"","first_name":"MIKE","last_name":"CREACH","classification":"U","division":"PCC","hit_factor":4.6948},{"match_name":"Grandbaggers December 2017","match_date":"2017-12-07","stage_classifiercode":"06-10","member_number":"FY51387","first_name":"WILLIAM","last_name":"HOLLON","classification":"C","division":"PCC","hit_factor":4.6948},{"match_name":"NISA April 2017 - Classifier","match_date":"2017-04-23","stage_classifiercode":"06-10","member_number":"A65865","first_name":"JOHN","last_name":"ALEXANDER","classification":"X","division":"PCC","hit_factor":4.6729},{"match_name":"Sage USPSA June 17 2018","match_date":"2018-06-17","stage_classifiercode":"06-10","member_number":"\"\"","first_name":"FRANK","last_name":"GONSETH","classification":"\"\"","division":"PCC","hit_factor":4.6584},{"match_name":"Deadwood Boys USPSA All Classifier Match - 29 July 2018","match_date":"2018-07-29","stage_classifiercode":"06-10","member_number":"FY79130","first_name":"ANDREW","last_name":"HERNANDEZ","classification":"U","division":"PCC","hit_factor":4.6512},{"match_name":"Gem City Gun Club 9-1 and 9-2-2018","match_date":"2018-09-01","stage_classifiercode":"06-10","member_number":"A72574","first_name":"DAN","last_name":"SKOCZYLAS","classification":"C","division":"PCC","hit_factor":4.6512},{"match_name":"YMM  IPSC 2018_07_08","match_date":"2018-07-08","stage_classifiercode":"06-10","member_number":"TY63491","first_name":"JOHN","last_name":"SCHROEDER","classification":"U","division":"PCC","hit_factor":4.6368},{"match_name":"Richmond Hot Shots September 1st-2nd 2018 USPSA Pistol Match","match_date":"2018-09-01","stage_classifiercode":"06-10","member_number":"\"\"","first_name":"CRAIG","last_name":"MORIMOTO","classification":"U","division":"PCC","hit_factor":4.6296},{"match_name":"CBS March USPSA Steel Match","match_date":"2021-03-07","stage_classifiercode":"06-10","member_number":"TY103588","first_name":"CHIP","last_name":"MEADOR","classification":"C","division":"PCC","hit_factor":4.6083},{"match_name":"Shadow Hawk Defense USPSA - Aug","match_date":"2021-08-14","stage_classifiercode":"06-10","member_number":"FY58086","first_name":"LAURA","last_name":"TORRES-REYES","classification":"C","division":"PCC","hit_factor":4.5802},{"match_name":"FBURG USPSA November 2021","match_date":"2021-11-07","stage_classifiercode":"06-10","member_number":"A136317","first_name":"RYAN","last_name":"MILLS","classification":"C","division":"PCC","hit_factor":4.5593},{"match_name":"December 2017 CAS USPSA","match_date":"2017-12-03","stage_classifiercode":"06-10","member_number":"A83166","first_name":"CJ","last_name":"WILLIAMS","classification":"D","division":"PCC","hit_factor":4.5455},{"match_name":"CCPL - June 2021","match_date":"2021-06-19","stage_classifiercode":"06-10","member_number":"TY43238","first_name":"RICHARD A","last_name":"KONNERTH","classification":"C","division":"PCC","hit_factor":4.5249},{"match_name":"Eagles Nest July 30th","match_date":"2017-07-30","stage_classifiercode":"06-10","member_number":"TY84357","first_name":"RAY","last_name":"DONCH","classification":"C","division":"PCC","hit_factor":4.4978},{"match_name":"Sharp Practical Shooters August USPSA - Outdoor","match_date":"2021-08-22","stage_classifiercode":"06-10","member_number":"A121962","first_name":"KATIE","last_name":"NICOLINI","classification":"U","division":"PCC","hit_factor":4.4709},{"match_name":"Eagles Nest July 30th","match_date":"2017-07-30","stage_classifiercode":"06-10","member_number":"A78258","first_name":"MATT","last_name":"SMITH","classification":"U","division":"PCC","hit_factor":4.4643},{"match_name":"Hosemasters 2nd Sunday August 2017","match_date":"2017-08-13","stage_classifiercode":"06-10","member_number":"A82150","first_name":"JOSHUA","last_name":"FRY","classification":"U","division":"PCC","hit_factor":4.4643},{"match_name":"OFGC USPSA Match 11-18-17","match_date":"2017-11-18","stage_classifiercode":"06-10","member_number":"\"\"","first_name":"GEOF","last_name":"SCHROEDER","classification":"U","division":"PCC","hit_factor":4.4183},{"match_name":"PCWC USPSA  9 26 2020","match_date":"2020-09-26","stage_classifiercode":"06-10","member_number":"fy-25813","first_name":"WILLIAM","last_name":"BRACEY","classification":"D","division":"PCC","hit_factor":4.4183},{"match_name":"OFGC USPSA Match 11-18-17","match_date":"2017-11-18","stage_classifiercode":"06-10","member_number":"\"\"","first_name":"TEAGAN","last_name":"MACON","classification":"\"\"","division":"PCC","hit_factor":4.3988},{"match_name":"Shadow Hawk Defense USPSA SPECIAL CLASSIFIER","match_date":"2021-11-11","stage_classifiercode":"06-10","member_number":"TY85259","first_name":"JOJO","last_name":"SANTOS","classification":"B","division":"PCC","hit_factor":4.3668},{"match_name":"CCPL - June 2021","match_date":"2021-06-19","stage_classifiercode":"06-10","member_number":"FY65487","first_name":"BRETTON","last_name":"REBOL","classification":"B","division":"PCC","hit_factor":4.3103},{"match_name":"OPSC USPSA  OCTOBER 2017","match_date":"2017-10-07","stage_classifiercode":"06-10","member_number":"TY79144","first_name":"WAYNE","last_name":"WAGNER","classification":"U","division":"PCC","hit_factor":4.298},{"match_name":"Gem City Gun Club 11-4 and 11-5","match_date":"2017-11-04","stage_classifiercode":"06-10","member_number":"\"\"","first_name":"JACK","last_name":"JAUCH","classification":"U","division":"PCC","hit_factor":4.2674},{"match_name":"YMM  IPSC 2018_07_08","match_date":"2018-07-08","stage_classifiercode":"06-10","member_number":"FY61184","first_name":"STEF","last_name":"MASLEN","classification":"C","division":"PCC","hit_factor":4.2254},{"match_name":"OFGC USPSA Match 11-18-17","match_date":"2017-11-18","stage_classifiercode":"06-10","member_number":"A90763","first_name":"DIANE","last_name":"MCCOY","classification":"U","division":"PCC","hit_factor":4.2076},{"match_name":"Collin County USPSA 11-28-2021","match_date":"2021-11-28","stage_classifiercode":"06-10","member_number":"A137472","first_name":"KEVIN TUAN","last_name":"TRAN","classification":"U","division":"PCC","hit_factor":4.2017},{"match_name":"Nampa USPSA December 20th 2020","match_date":"2020-12-20","stage_classifiercode":"06-10","member_number":"A84188","first_name":"LARRY","last_name":"OLETSKI","classification":"M","division":"PCC","hit_factor":4.1667},{"match_name":"Space Coast Practical Shooters","match_date":"2018-06-02","stage_classifiercode":"06-10","member_number":"A107829","first_name":"JOANNA","last_name":"STONE","classification":"U","division":"PCC","hit_factor":4.1551},{"match_name":"IPSC93 April 2020","match_date":"2020-04-14","stage_classifiercode":"06-10","member_number":"A74241","first_name":"KATHRYN","last_name":"MOLNAR","classification":"U","division"