[{"match_name":"Mesquite Mayhem Monthly USPSA Match","match_date":"2021-01-10","stage_classifiercode":"06-05","member_number":"FY89753","first_name":"MAX","last_name":"LEOGRANDIS","classification":"G","division":"PCC","hit_factor":20.4301},{"match_name":"ORPCI USPSA Saturday 2018.08.18","match_date":"2018-08-18","stage_classifiercode":"06-05","member_number":"TY77176","first_name":"DON","last_name":"O'BRADOVICH","classification":"G","division":"PCC","hit_factor":17.8404},{"match_name":"DWB - Deadwood Boys USPSA 01 April 2018","match_date":"2018-04-01","stage_classifiercode":"06-05","member_number":"L2354","first_name":"TARAN","last_name":"BUTLER","classification":"G","division":"PCC","hit_factor":17.5926},{"match_name":"DRRC USPSA May2018","match_date":"2018-05-05","stage_classifiercode":"06-05","member_number":"TY47743","first_name":"NORMAN","last_name":"BRIGHT","classification":"G","division":"PCC","hit_factor":17.4757},{"match_name":"SSS USPSA October 2020 Match","match_date":"2020-10-18","stage_classifiercode":"06-05","member_number":"A122303","first_name":"CODY","last_name":"MCNEELY","classification":"A (A Class)","division":"PCC","hit_factor":17.3913},{"match_name":"DWB - Deadwood Boys USPSA August 6 2017","match_date":"2017-08-06","stage_classifiercode":"06-05","member_number":"A78856","first_name":"CRIS","last_name":"CARPENTER","classification":"M","division":"PCC","hit_factor":17.3077},{"match_name":"LIPSA - November 15th 2020 - USPSA Match ","match_date":"2020-11-15","stage_classifiercode":"06-05","member_number":"L3851","first_name":"JEFF","last_name":"PAULSEN","classification":"G","division":"PCC","hit_factor":17.2727},{"match_name":"CSA Annual Classifier Classic","match_date":"2018-03-18","stage_classifiercode":"06-05","member_number":"TY89288","first_name":"BRUCE","last_name":"TAYLOR","classification":"M","division":"PCC","hit_factor":17.2249},{"match_name":"WGC August 2020 USPSA Classifier","match_date":"2020-08-09","stage_classifiercode":"06-05","member_number":"A72613","first_name":"DONNIE","last_name":"SMITH","classification":"M","division":"PCC","hit_factor":17.1674},{"match_name":"MPPL 9th Annual Monster Match","match_date":"2016-10-22","stage_classifiercode":"06-05","member_number":"FY61621","first_name":"DERICK","last_name":"HIPOL","classification":"U","division":"PCC","hit_factor":16.9312},{"match_name":"Atlanta Practical Shooters October 2017 PCC USPSA Match","match_date":"2017-09-30","stage_classifiercode":"06-05","member_number":"\"\"","first_name":"JOHN","last_name":"STERLING","classification":"U","division":"PCC","hit_factor":16.8889},{"match_name":"Shoot GTR Mini Match 07/10/2018","match_date":"2018-07-10","stage_classifiercode":"06-05","member_number":"A73910","first_name":"JEREMY","last_name":"LIGHTNER","classification":"M","division":"PCC","hit_factor":16.8776},{"match_name":"Rankin Field Sunday USPSA","match_date":"2018-02-18","stage_classifiercode":"06-05","member_number":"A100612","first_name":"ZACK","last_name":"SMITH","classification":"G","division":"PCC","hit_factor":16.8421},{"match_name":"Detroit Sportsmens Congress - May 21 2017","match_date":"2017-05-21","stage_classifiercode":"06-05","member_number":"TY67265","first_name":"JAMES","last_name":"WURM","classification":"U","division":"PCC","hit_factor":16.8067},{"match_name":"HRRB 12-01-2018","match_date":"2018-12-01","stage_classifiercode":"06-05","member_number":"A104329","first_name":"DAVID","last_name":"KIKUKAWA","classification":"M","division":"PCC","hit_factor":16.7364},{"match_name":"SWGC USPSA Pistol Match - October 2018","match_date":"2018-10-06","stage_classifiercode":"06-05","member_number":"L2458","first_name":"TODD","last_name":"JARRETT","classification":"G","division":"PCC","hit_factor":16.309},{"match_name":"Rankin Field Sunday USPSA","match_date":"2018-02-18","stage_classifiercode":"06-05","member_number":"A87706","first_name":"ALEX","last_name":"CHOTVACS","classification":"A","division":"PCC","hit_factor":16.2896},{"match_name":"S&Hs8 22 20 Slot Match","match_date":"2020-08-19","stage_classifiercode":"06-05","member_number":"A111990","first_name":"MASON","last_name":"ZIER","classification":"A","division":"PCC","hit_factor":16.2602},{"match_name":"OFGC USPSA Match 8-15-21","match_date":"2021-08-15","stage_classifiercode":"06-05","member_number":"TY81825","first_name":"IAN","last_name":"ZACHER","classification":"G","division":"PCC","hit_factor":16.1943},{"match_name":"WGC June 2018 USPSA 2","match_date":"2018-06-24","stage_classifiercode":"06-05","member_number":"L1740","first_name":"JOHNNY","last_name":"BRISTER","classification":"M","division":"PCC","hit_factor":16.1137},{"match_name":"LPRGC - Lower Providence USPSA July 2018","match_date":"2018-07-07","stage_classifiercode":"06-05","member_number":"TY85668","first_name":"SCOTT","last_name":"APPOLDT","classification":"A","division":"PCC","hit_factor":16.1017},{"match_name":"Low Country USPSA October All Classifier Match","match_date":"2020-10-31","stage_classifiercode":"06-05","member_number":"A110754","first_name":"AARON","last_name":"SELLERS","classification":"M","division":"PCC","hit_factor":16.0377},{"match_name":"Hopkinton USPSA July 2018","match_date":"2018-07-07","stage_classifiercode":"06-05","member_number":"TY73127","first_name":"SEAN","last_name":"JANICKI","classification":"G","division":"PCC","hit_factor":15.9664},{"match_name":"DSS - USPSA 18-10-14","match_date":"2018-10-14","stage_classifiercode":"06-05","member_number":"A89773","first_name":"ADAM","last_name":"MARSHALL","classification":"U","division":"PCC","hit_factor":15.873},{"match_name":"Rankin Field April (ALL CLASSIFIER) Saturday USPSA","match_date":"2021-04-03","stage_classifiercode":"06-05","member_number":"A85342","first_name":"J.R.","last_name":"GUERRA","classification":"M","division":"PCC","hit_factor":15.859},{"match_name":"CASA USPSA August 2018","match_date":"2018-08-05","stage_classifiercode":"06-05","member_number":"A70740","first_name":"RYAN","last_name":"REED","classification":"C","division":"PCC","hit_factor":15.8103},{"match_name":"CASA USPSA August 2018","match_date":"2018-08-05","stage_classifiercode":"06-05","member_number":"A42354","first_name":"BILLY","last_name":"SMITH","classification":"U","division":"PCC","hit_factor":15.7205},{"match_name":"Klamath USPSA  07/02/17 JSPS OR09","match_date":"2017-07-02","stage_classifiercode":"06-05","member_number":"TY75560","first_name":"JOSH","last_name":"WESLEY","classification":"B","division":"PCC","hit_factor":15.7025},{"match_name":"MPPL 20210807","match_date":"2021-08-07","stage_classifiercode":"06-05","member_number":"TY84441","first_name":"SEAN","last_name":"HATADA","classification":"A","division":"PCC","hit_factor":15.7025},{"match_name":"Rio Salado UPPL July 2020 ALL CLASSIFIER MATCH","match_date":"2020-07-12","stage_classifiercode":"06-05","member_number":"A80318","first_name":"JIM","last_name":"ADAME","classification":"G","division":"PCC","hit_factor":15.6379},{"match_name":"Rankin Field Sunday USPSA","match_date":"2018-02-18","stage_classifiercode":"06-05","member_number":"A96151","first_name":"RUSSEL","last_name":"CURTIS","classification":"B","division":"PCC","hit_factor":15.4639},{"match_name":"OFGC USPSA Match 8-15-21","match_date":"2021-08-15","stage_classifiercode":"06-05","member_number":"A89171","first_name":"AUSTIN","last_name":"CHAMBERLAIN","classification":"G","division":"PCC","hit_factor":15.4506},{"match_name":"Hammer Down USPSA Tue Night April 3 2018","match_date":"2018-04-03","stage_classifiercode":"06-05","member_number":"A96581","first_name":"JOE","last_name":"CARUSO","classification":"M","division":"PCC","hit_factor":15.4472},{"match_name":"HPS All-Classifier  Match","match_date":"2017-10-01","stage_classifiercode":"06-05","member_number":"TY61621","first_name":"DERICK","last_name":"HIPOL","classification":"U","division":"PCC","hit_factor":15.3257},{"match_name":"LIPSA - November 15th 2020 - USPSA Match ","match_date":"2020-11-15","stage_classifiercode":"06-05","member_number":"L4626","first_name":"NICK","last_name":"SCHILLACI","classification":"G","division":"PCC","hit_factor":15.3191},{"match_name":"Competitive Shooters of Lake Norman CORNELIUS Thursday Evening Indoor USPSA Pistol Match North Carolina","match_date":"2020-09-03","stage_classifiercode":"06-05","member_number":"A90559","first_name":"IKE","last_name":"STARNES","classification":"M","division":"PCC","hit_factor":15.2542},{"match_name":"ARPC USPSA Match 7-25-21","match_date":"2021-07-25","stage_classifiercode":"06-05","member_number":"A67446","first_name":"DANIEL","last_name":"SPRAUL","classification":"M","division":"PCC","hit_factor":15.2542},{"match_name":"Strongpoint July USPSA (IPSC Nationals Prep)","match_date":"2018-07-07","stage_classifiercode":"06-05","member_number":"\"\"","first_name":"GRANT","last_name":"ARROWOOD","classification":"A","division":"PCC","hit_factor":15.2},{"match_name":"NAAS 2018-03-18","match_date":"2018-03-18","stage_classifiercode":"06-05","member_number":"A70032","first_name":"JEREMY","last_name":"SIMS","classification":"M","division":"PCC","hit_factor":15.2},{"match_name":"FLPSA MN14 USPSA August 13 2017","match_date":"2017-08-13","stage_classifiercode":"06-05","member_number":"a91806","first_name":"JOSHUA","last_name":"FROELICH","classification":"M","division":"PCC","hit_factor":15.1786},{"match_name":"OKCGC USPSA July 2017","match_date":"2017-07-01","stage_classifiercode":"06-05","member_number":"A30136","first_name":"JERRY","last_name":"QUISENBERRY","classification":"B","division":"PCC","hit_factor":14.9813},{"match_name":"DSS - USPSA 18-10-14","match_date":"2018-10-14","stage_classifiercode":"06-05","member_number":"A83704","first_name":"D. SCOTT","last_name":"BEEBE","classification":"A","division":"PCC","hit_factor":14.9254},{"match_name":"MCAS August 2018 USPSA Match","match_date":"2018-08-18","stage_classifiercode":"06-05","member_number":"TY23626","first_name":"SCOTT","last_name":"NIELSEN","classification":"M","division":"PCC","hit_factor":14.902},{"match_name":"FBURG April 2021 Level I USPSA ","match_date":"2021-04-03","stage_classifiercode":"06-05","member_number":"TY59220","first_name":"LARRY","last_name":"TALBOTT","classification":"A","division":"PCC","hit_factor":14.902},{"match_name":"NAAS 2018-03-18","match_date":"2018-03-18","stage_classifiercode":"06-05","member_number":"A98278","first_name":"JOHN","last_name":"WINDES","classification":"A","division":"PCC","hit_factor":14.8699},{"match_name":"NRG Saturday April 10th Includes a Classifier Stage","match_date":"2021-04-10","stage_classifiercode":"06-05","member_number":"TY85661","first_name":"KEITH","last_name":"SORRELL","classification":"A","division":"PCC","hit_factor":14.8699},{"match_name":"2020-10 USPSA at Shadow Hawk Defense","match_date":"2020-10-10","stage_classifiercode":"06-05","member_number":"TY83821","first_name":"DEREK","last_name":"EINSIG","classification":"M","division":"PCC","hit_factor":14.8699},{"match_name":"LdF USPSA Match September 22 2018","match_date":"2018-09-22","stage_classifiercode":"06-05","member_number":"A38618","first_name":"HENRY","last_name":"TORIBIO","classification":"A","division":"PCC","hit_factor":14.8472},{"match_name":"May 30 2018 A-Zone match","match_date":"2018-05-30","stage_classifiercode":"06-05","member_number":"L3259","first_name":"KARL PCC","last_name":"REHN","classification":"M","division":"PCC","hit_factor":14.8438},{"match_name":"CRGC USPSA Match 10-18-20","match_date":"2020-10-18","stage_classifiercode":"06-05","member_number":"A115431","first_name":"COLIN","last_name":"MACARTHUR","classification":"","division":"PCC","hit_factor":14.7541},{"match_name":"MASTER BLASTERS & SSFGA USPSA - October","match_date":"2021-10-10","stage_classifiercode":"06-05","member_number":"A115431","first_name":"COLIN","last_name":"MACARTHUR","classification":"M","division":"PCC","hit_factor":14.7186},{"match_name":"ACPSA August 2018","match_date":"2018-08-25","stage_classifiercode":"06-05","member_number":"TY86924","first_name":"MICHAEL","last_name":"STACK","classification":"M","division":"PCC","hit_factor":14.7059},{"match_name":"SCCC CLASSIFIER MATCH 7_23_17","match_date":"2017-07-23","stage_classifiercode":"06-05","member_number":"A82559","first_name":"TRAVIS","last_name":"FITZPATRICK","classification":"A","division":"PCC","hit_factor":14.7059},{"match_name":"SCCC CLASSIFIER MATCH 7_23_17","match_date":"2017-07-23","stage_classifiercode":"06-05","member_number":"rd6","first_name":"MIKE","last_name":"FOLEY","classification":"M","division":"PCC","hit_factor":14.6939},{"match_name":"Mesquite Mayhem Monthly USPSA Match","match_date":"2021-01-10","stage_classifiercode":"06-05","member_number":"ty76261","first_name":"DAN","last_name":"LONG","classification":"G","division":"PCC","hit_factor":14.6939},{"match_name":"RPGi Thursday Night USPSA  February 4th 2021","match_date":"2021-02-03","stage_classifiercode":"06-05","member_number":"A118547","first_name":"BRENDAN","last_name":"SOUDER","classification":"B","division":"PCC","hit_factor":14.652},{"match_name":"FLPSA USPSA Pistol Match 10.15.2016","match_date":"2016-10-15","stage_classifiercode":"06-05","member_number":"A91806","first_name":"JOSH","last_name":"FROELICH","classification":"A","division":"PCC","hit_factor":14.5749},{"match_name":"Atlanta Practical Shooters October 2017 USPSA","match_date":"2017-10-01","stage_classifiercode":"06-05","member_number":"A82404","first_name":"JEFF","last_name":"JOHNSTON","classification":"A","division":"PCC","hit_factor":14.5299},{"match_name":"TAC2 USPSA Sept 2018","match_date":"2018-09-01","stage_classifiercode":"06-05","member_number":"A98619","first_name":"ROCCO","last_name":"PRESTON 2G","classification":"M","division":"PCC","hit_factor":14.5161},{"match_name":"CRGC USPSA Match 10-18-20","match_date":"2020-10-18","stage_classifiercode":"06-05","member_number":"A101407","first_name":"JAMES","last_name":"LAROSA","classification":"","division":"PCC","hit_factor":14.5038},{"match_name":"FLPSA USPSA Pistol Match 10.15.2016","match_date":"2016-10-15","stage_classifiercode":"06-05","member_number":"A86797","first_name":"RON","last_name":"ROZESKE","classification":"D","division":"PCC","hit_factor":14.5038},{"match_name":"ACPSA August 2018","match_date":"2018-08-25","stage_classifiercode":"06-05","member_number":"A98953","first_name":"JON","last_name":"OUM","classification":"C","division":"PCC","hit_factor":14.4928},{"match_name":"Triforce Practical Shooters at BigWoodsGoods 3-22-18","match_date":"2018-03-22","stage_classifiercode":"06-05","member_number":"A84201","first_name":"ZANE","last_name":"RUTLEDGE","classification":"G","division":"PCC","hit_factor":14.4578},{"match_name":"Mesquite Mayhem Monthly USPSA Match","match_date":"2021-01-10","stage_classifiercode":"06-05","member_number":"L4618","first_name":"VITEZSLAV","last_name":"BURES","classification":"U","division":"PCC","hit_factor":14.4487},{"match_name":"Richmond Hot Shots December 5-6-2020 USPSA Pistol","match_date":"2020-12-05","stage_classifiercode":"06-05","member_number":"Ty98008","first_name":"JANET","last_name":"TSUI","classification":"A","division":"PCC","hit_factor":14.4404},{"match_name":"EHPSA USPSA 25 July 2021","match_date":"2021-07-25","stage_classifiercode":"06-05","member_number":"A102365","first_name":"AARON","last_name":"DURIKA","classification":"A","division":"PCC","hit_factor":14.4404},{"match_name":"ORPCI USPSA  Friday  2020.03.20","match_date":"2020-03-20","stage_classifiercode":"06-05","member_number":"A99325","first_name":"TREVOR","last_name":"ARMSTRONG","classification":"M","division":"PCC","hit_factor":14.4068},{"match_name":"TPS USPSA at CMP May 19 2018","match_date":"2018-05-19","stage_classifiercode":"06-05","member_number":"A70032","first_name":"JEREMY","last_name":"SIMS","classification":"G","division":"PCC","hit_factor":14.3369},{"match_name":"AREA 59  SPRING ALL CLASSIFIER","match_date":"2018-03-31","stage_classifiercode":"06-05","member_number":"A102564","first_name":"DONALD","last_name":"POWERS","classification":"M","division":"PCC","hit_factor":14.2857},{"match_name":"Atlanta Practical Shooters October 2017 PCC USPSA Match","match_date":"2017-09-30","stage_classifiercode":"06-05","member_number":"A84201","first_name":"ZANE","last_name":"RUTLEDGE","classification":"U","division":"PCC","hit_factor":14.1844},{"match_name":"OREGON ARPC CC05 USPSA JAN 13 2018","match_date":"2018-01-13","stage_classifiercode":"06-05","member_number":"A90941","first_name":"BRENT","last_name":"CRAWFORD","classification":"U","division":"PCC","hit_factor":14.1791},{"match_name":"NRG Saturday March 10th- Includes a Classifier Stage","match_date":"2018-03-10","stage_classifiercode":"06-05","member_number":"A2581","first_name":"ROSS","last_name":"DEANE","classification":"M","division":"PCC","hit_factor":14.1791},{"match_name":"Pioneer Action Shooters USPSA 5-23-21 Special Classifer","match_date":"2021-05-23","stage_classifiercode":"06-05","member_number":"A115431","first_name":"COLIN","last_name":"MACARTHUR","classification":"M","division":"PCC","hit_factor":14.1732},{"match_name":"SAPSA December 2017","match_date":"2017-12-16","stage_classifiercode":"06-05","member_number":"A21361","first_name":"JIMMY","last_name":"OWENS","classification":"G","division":"PCC","hit_factor":14.1667},{"match_name":"Atlanta Practical Shooters October 2017 PCC USPSA Match","match_date":"2017-09-30","stage_classifiercode":"06-05","member_number":"A70169","first_name":"AVERY","last_name":"BISHOP","classification":"B","division":"PCC","hit_factor":14.1176},{"match_name":"ORPCI 2018.03.31 USPSA Special","match_date":"2018-03-31","stage_classifiercode":"06-05","member_number":"A77176","first_name":"DON","last_name":"O'BRADOVICH","classification":"G","division":"PCC","hit_factor":14.0741},{"match_name":"DWB - Deadwood Boys USPSA 01 April 2018","match_date":"2018-04-01","stage_classifiercode":"06-05","member_number":"A78856","first_name":"CRIS","last_name":"CARPENTER","classification":"M","division":"PCC","hit_factor":14.0625},{"match_name":"LRC USPSA October 2020","match_date":"2020-10-03","stage_classifiercode":"06-05","member_number":"TY88318","first_name":"MIKE","last_name":"HALL","classification":"M","division":"PCC","hit_factor":14.0625},{"match_name":"Low Country USPSA January 27th","match_date":"2018-01-27","stage_classifiercode":"06-05","member_number":"A63444","first_name":"DYLAN","last_name":"BACHMAN","classification":"U","division":"PCC","hit_factor":14.0221},{"match_name":"LdF USPSA Match September 22 2018","match_date":"2018-09-22","stage_classifiercode":"06-05","member_number":"FY60951","first_name":"LAWRENCE","last_name":"MATTHEWS","classification":"M","division":"PCC","hit_factor":13.986},{"match_name":"RSPP 3rd Saturday January 2017","match_date":"2017-01-21","stage_classifiercode":"06-05","member_number":"TY92330","first_name":"MATTHEW","last_name":"BHELLA","classification":"U","division":"PCC","hit_factor":13.986},{"match_name":"WGC August 2020 USPSA Classifier","match_date":"2020-08-09","stage_classifiercode":"06-05","member_number":"A93372","first_name":"JAMES","last_name":"LOFTON","classification":"U","division":"PCC","hit_factor":13.9194},{"match_name":"7-30 Match","match_date":"2017-07-30","stage_classifiercode":"06-05","member_number":"A57351","first_name":"COREY","last_name":"ESTILL","classification":"U","division":"PCC","hit_factor":13.9194},{"match_name":"Atlanta Practical Shooters October 2017 PCC USPSA Match","match_date":"2017-09-30","stage_classifiercode":"06-05","member_number":"A86488","first_name":"DEREK","last_name":"GIDDINGS","classification":"A","division":"PCC","hit_factor":13.8996},{"match_name":"Idaho ISPS July 16th Beat the Heat Classifier Match","match_date":"2017-07-16","stage_classifiercode":"06-05","member_number":"A79280","first_name":"ERIK","last_name":"SMITH","classification":"A","division":"PCC","hit_factor":13.8889},{"match_name":"DSS - USPSA - 21-08-08","match_date":"2021-08-08","stage_classifiercode":"06-05","member_number":"A107915","first_name":"KYLE","last_name":"KONOPA","classification":"M","division":"PCC","hit_factor":13.8776},{"match_name":"OFGC USPSA Match 8-15-21","match_date":"2021-08-15","stage_classifiercode":"06-05","member_number":"TY109909","first_name":"SHAWN","last_name":"GARRISON","classification":"B","division":"PCC","hit_factor":13.8408},{"match_name":"S&Hs8 22 20 Slot Match","match_date":"2020-08-19","stage_classifiercode":"06-05","member_number":"TY29750","first_name":"CRAIG","last_name":"BOYD","classification":"M","division":"PCC","hit_factor":13.8182},{"match_name":"2020-10 USPSA at Shadow Hawk Defense","match_date":"2020-10-10","stage_classifiercode":"06-05","member_number":"A72727","first_name":"GREG","last_name":"JONES","classification":"M","division":"PCC","hit_factor":13.8182},{"match_name":"Shasta Shooters 2021 Aug","match_date":"2021-08-14","stage_classifiercode":"06-05","member_number":"A130897","first_name":"ATHAN","last_name":"TONKIN","classification":"B","division":"PCC","hit_factor":13.7681},{"match_name":"Laser Ninja Dragon League USPSA April 2018","match_date":"2018-04-08","stage_classifiercode":"06-05","member_number":"A100220","first_name":"MATTHEW","last_name":"ST. PIERRE","classification":"B","division":"PCC","hit_factor":13.7681},{"match_name":"EWPSA 2020-07","match_date":"2020-07-19","stage_classifiercode":"06-05","member_number":"L4822","first_name":"ANN","last_name":"BLOSSER","classification":"A","division":"PCC","hit_factor":13.7652},{"match_name":"ACPSA August 2018","match_date":"2018-08-25","stage_classifiercode":"06-05","member_number":"A106054","first_name":"CHRIS","last_name":"FOWLER","classification":"M","division":"PCC","hit_factor":13.7405},{"match_name":"RMAP 3rd  Sunday September 2016","match_date":"2016-09-18","stage_classifiercode":"06-05","member_number":"A55597","first_name":"ANTHONY","last_name":"LUCIANI","classification":"U","division":"PCC","hit_factor":13.7097},{"match_name":"Sharp Practical Shooters September Match","match_date":"2017-09-23","stage_classifiercode":"06-05","member_number":"A87913","first_name":"JONATHAN","last_name":"MOORE","classification":"B","division":"PCC","hit_factor":13.6752},{"match_name":"SAPSA December 2017","match_date":"2017-12-16","stage_classifiercode":"06-05","member_number":"TY86924","first_name":"MICHAEL","last_name":"STACK","classification":"M","division":"PCC","hit_factor":13.6519},{"match_name":"WGC June 2018 USPSA 2","match_date":"2018-06-24","stage_classifiercode":"06-05","member_number":"TY48703","first_name":"TERRY","last_name":"JOHNSON","classification":"A","division":"PCC","hit_factor":13.6201},{"match_name":"OFGC USPSA Match 5-20-18","match_date":"2018-05-20","stage_classifiercode":"06-05","member_number":"A81825","first_name":"IAN","last_name":"ZACHER","classification":"M","division":"PCC","hit_factor":13.5849},{"match_name":"EHPSA USPSA 25 July 2021","match_date":"2021-07-25","stage_classifiercode":"06-05","member_number":"TY43465","first_name":"RYAN","last_name":"SNYDER","classification":"M","division":"PCC","hit_factor":13.5593},{"match_name":"CASA USPSA August 2018","match_date":"2018-08-05","stage_classifiercode":"06-05","member_number":"TY53177","first_name":"CLEVE","last_name":"MATHEWS","classification":"B","division":"PCC","hit_factor":13.5593},{"match_name":"NW01 USPSA Aug 16","match_date":"2016-08-16","stage_classifiercode":"06-05","member_number":"a57006","first_name":"SCOTT","last_name":"PRIES","classification":"U","division":"PCC","hit_factor":13.5593},{"match_name":"WGC June 2018 USPSA 2","match_date":"2018-06-24","stage_classifiercode":"06-05","member_number":"TY80396","first_name":"WILSON","last_name":"BARHAM","classification":"C","division":"PCC","hit_factor":13.5231},{"match_name":"CSA Annual Classifier Classic","match_date":"2018-03-18","stage_classifiercode":"06-05","member_number":"A109352","first_name":"NICK","last_name":"MCDONALD","classification":"U","division":"PCC","hit_factor":13.5231},{"match_name":"USPSA MO21 2Alpha SBRC April 2018 Special Classifier","match_date":"2018-04-28","stage_classifiercode":"06-05","member_number":"TY101632","first_name":"GREG","last_name":"YEN","classification":"G","division":"PCC","hit_factor":13.5135},{"match_name":"Steel City USPSA August 4 2018","match_date":"2018-08-04","stage_classifiercode":"06-05","member_number":"A60070","first_name":"ROBERT","last_name":"MOORE","classification":"A","division":"PCC","hit_factor":13.5135},{"match_name":"XMG USPSA   August 07 2021","match_date":"2021-08-07","stage_classifiercode":"06-05","member_number":"TY103871","first_name":"STEVE","last_name":"BURROUGHS","classification":"A","division":"PCC","hit_factor":13.4831},{"match_name":"Klamath USPSA 09-02-18 JSPS OR09","match_date":"2018-09-02","stage_classifiercode":"06-05","member_number":"FY75560","first_name":"JOSH","last_name":"WESLEY","classification":"M","division":"PCC","hit_factor":13.4752},{"match_name":"Deadwood Boys USPSA All Classifier Match","match_date":"2016-08-07","stage_classifiercode":"06-05","member_number":"L2354","first_name":"TARAN","last_name":"BUTLER","classification":"U","division":"PCC","hit_factor":13.4752},{"match_name":"NPS February 2017 Match","match_date":"2017-02-11","stage_classifiercode":"06-05","member_number":"A50568","first_name":"HARMON","last_name":"GREER","classification":"U","division":"PCC","hit_factor":13.4454},{"match_name":"EHPSA USPSA 25 July 2021","match_date":"2021-07-25","stage_classifiercode":"06-05","member_number":"A102365","first_name":"AARON","last_name":"DURIKA","classification":"A","division":"PCC","hit_factor":13.4228},{"match_name":"ARPC USPSA Match 7-26-20","match_date":"2020-07-26","stage_classifiercode":"06-05","member_number":"TY89183","first_name":"STEVE","last_name":"CASH","classification":"A","division":"PCC","hit_factor":13.4228},{"match_name":"Clinton County USPSA Oct 22 2016","match_date":"2016-10-22","stage_classifiercode":"06-05","member_number":"A88135","first_name":"MARK","last_name":"COLASANTE","classification":"C","division":"PCC","hit_factor":13.3858},{"match_name":"2020-10 USPSA at Shadow Hawk Defense","match_date":"2020-10-10","stage_classifiercode":"06-05","member_number":"L4331","first_name":"BRANDON","last_name":"HIGBEE","classification":"G","division":"PCC","hit_factor":13.3858},{"match_name":"Palmetto Gun Club - Late September 2017 USPSA","match_date":"2017-09-30","stage_classifiercode":"06-05","member_number":"FY75827","first_name":"KYLE","last_name":"HOLSCLAW","classification":"M","division":"PCC","hit_factor":13.3803},{"match_name":"SAPSA December 2017","match_date":"2017-12-16","stage_classifiercode":"06-05","member_number":"A77998","first_name":"CALVIN","last_name":"CARPENTER","classification":"A","division":"PCC","hit_factor":13.3779},{"match_name":"WSRC USPSA 8/19-20/2017","match_date":"2017-08-19","stage_classifiercode":"06-05","member_number":"TY82645","first_name":"DARRYL","last_name":"VANCIL","classification":"C","division":"PCC","hit_factor":13.3333},{"match_name":"DSS - USPSA 18-10-14","match_date":"2018-10-14","stage_classifiercode":"06-05","member_number":"A101411","first_name":"JIM","last_name":"PAPPAS","classification":"U","division":"PCC","hit_factor":13.3333},{"match_name":"Richmond Hot Shots December 5-6-2020 USPSA Pistol","match_date":"2020-12-05","stage_classifiercode":"06-05","member_number":"Ty-84211","first_name":"GEORGE","last_name":"TY","classification":"M","division":"PCC","hit_factor":13.2841},{"match_name":"Rio Grande Practical Shooters - January 2017","match_date":"2017-01-07","stage_classifiercode":"06-05","member_number":"L3694","first_name":"CHRIS","last_name":"TAYLOR","classification":"A","division":"PCC","hit_factor":13.2813},{"match_name":"Hopkinton November 2016","match_date":"2016-11-04","stage_classifiercode":"06-05","member_number":"TY73127","first_name":"SEAN","last_name":"JANICKI","classification":"G","division":"PCC","hit_factor":13.2813},{"match_name":"Rio Salado UPPL July 2020 ALL CLASSIFIER MATCH","match_date":"2020-07-12","stage_classifiercode":"06-05","member_number":"L3837","first_name":"NILS","last_name":"JONASSON","classification":"U","division":"PCC","hit_factor":13.278},{"match_name":"Nampa USPSA May 29th 2021","match_date":"2021-05-29","stage_classifiercode":"06-05","member_number":"TY80321","first_name":"DAN","last_name":"HAWKINS","classification":"M","division":"PCC","hit_factor":13.2404},{"match_name":"Mesilla Valley P December 2020","match_date":"2020-12-05","stage_classifiercode":"06-05","member_number":"A124485","first_name":"RICHARD","last_name":"FRAIRE","classification":"M","division":"PCC","hit_factor":13.2404},{"match_name":"EHPSA USPSA 25 July 2021","match_date":"2021-07-25","stage_classifiercode":"06-05","member_number":"TY43465","first_name":"RYAN","last_name":"SNYDER","classification":"M","division":"PCC","hit_factor":13.2353},{"match_name":"DSS - USPSA - 21-08-08","match_date":"2021-08-08","stage_classifiercode":"06-05","member_number":"TY108877","first_name":"ADAM","last_name":"LITKE","classification":"B","division":"PCC","hit_factor":13.2353},{"match_name":"Idaho ISPS July 16th Beat the Heat Classifier Match","match_date":"2017-07-16","stage_classifiercode":"06-05","member_number":"TY83544","first_name":"ZACK","last_name":"IRWIN","classification":"A","division":"PCC","hit_factor":13.2296},{"match_name":"CSA Annual Classifier Classic","match_date":"2018-03-18","stage_classifiercode":"06-05","member_number":"A92696","first_name":"BJ","last_name":"MILLER","classification":"D","division":"PCC","hit_factor":13.2013},{"match_name":"OREGON ARPC CC05 USPSA JAN 13 2018","match_date":"2018-01-13","stage_classifiercode":"06-05","member_number":"TY80327","first_name":"DAVID","last_name":"LUND","classification":"M","division":"PCC","hit_factor":13.1944},{"match_name":"NRG Saturday July 8th - classifier","match_date":"2017-07-08","stage_classifiercode":"06-05","member_number":"A71782","first_name":"JASON","last_name":"HILLS","classification":"U","division":"PCC","hit_factor":13.1944},{"match_name":"Temple Gun Club USPSA Holiday Hosefest 2020","match_date":"2020-12-06","stage_classifiercode":"06-05","member_number":"A95231","first_name":"ERIK","last_name":"MARSHALL","classification":"A","division":"PCC","hit_factor":13.1868},{"match_name":"Rankin Field Sunday USPSA","match_date":"2018-02-18","stage_classifiercode":"06-05","member_number":"A105122","first_name":"CHRIS","last_name":"MIRANDA","classification":"B","division":"PCC","hit_factor":13.1579},{"match_name":"Prescott 1st Saturday USPSA 4-7-18","match_date":"2018-04-07","stage_classifiercode":"06-05","member_number":"TY31924","first_name":"OTIS","last_name":"AUSTIN","classification":"M","division":"PCC","hit_factor":13.1488},{"match_name":"Hopkinton USPSA July 2018","match_date":"2018-07-07","stage_classifiercode":"06-05","member_number":"TY73127","first_name":"SEAN","last_name":"JANICKI","classification":"G","division":"PCC","hit_factor":13.1034},{"match_name":"EHPSA USPSA 25 July 2021","match_date":"2021-07-25","stage_classifiercode":"06-05","member_number":"A74936","first_name":"ROGER","last_name":"ELDER","classification":"B","division":"PCC","hit_factor":13.1034},{"match_name":"INAS USPSA Aug 2017","match_date":"2017-08-12","stage_classifiercode":"06-05","member_number":"A81890","first_name":"DON","last_name":"TRIPPLET","classification":"A","division":"PCC","hit_factor":13.1034},{"match_name":"FBURG April 2021 Level I USPSA ","match_date":"2021-04-03","stage_classifiercode":"06-05","member_number":"A93396","first_name":"MICHAEL","last_name":"COSTLEY","classification":"A","division":"PCC","hit_factor":13.1034},{"match_name":"FBURG April 2021 Level I USPSA ","match_date":"2021-04-03","stage_classifiercode":"06-05","member_number":"TY82414","first_name":"DAVID","last_name":"ANKENY","classification":"B","division":"PCC","hit_factor":13.1034},{"match_name":"Mesquite Mayhem Monthly USPSA Match","match_date":"2021-01-10","stage_classifiercode":"06-05","member_number":"L2702","first_name":"MATTHEW","last_name":"LAMPH","classification":"B","division":"PCC","hit_factor":13.0909},{"match_name":"SWGC USPSA Pistol Match - October 2018","match_date":"2018-10-06","stage_classifiercode":"06-05","member_number":"A93396","first_name":"MICHAEL","last_name":"COSTLEY","classification":"A","division":"PCC","hit_factor":13.0909},{"match_name":"YRPA  September USPSA 2017","match_date":"2017-09-24","stage_classifiercode":"06-05","member_number":"TY76664","first_name":"JEFF","last_name":"WEAVER","classification":"A","division":"PCC","hit_factor":13.0769},{"match_name":"ShooT GTR USPSA 1/1/17","match_date":"2017-01-01","stage_classifiercode":"06-05","member_number":"A86924","first_name":"MICHAEL","last_name":"STACK","classification":"B","division":"PCC","hit_factor":13.0719},{"match_name":"SSS USPSA October 2020 Match","match_date":"2020-10-18","stage_classifiercode":"06-05","member_number":"A120622","first_name":"AARON","last_name":"BANKS","classification":"A (A Class)","division":"PCC","hit_factor":13.0584},{"match_name":"JPPS Club Match 8-4-18","match_date":"2018-08-04","stage_classifiercode":"06-05","member_number":"A23615","first_name":"RODNEY","last_name":"COBB","classification":"A","division":"PCC","hit_factor":13.0584},{"match_name":"Atlanta Practical Shooters October 2017 PCC USPSA Match","match_date":"2017-09-30","stage_classifiercode":"06-05","member_number":"A82404","first_name":"JEFF","last_name":"JOHNSTON","classification":"A","division":"PCC","hit_factor":13.0435},{"match_name":"LIPSA - November 5th 2017 - USPSA Special Classifier Match","match_date":"2017-11-05","stage_classifiercode":"06-05","member_number":"TY76078","first_name":"NICK","last_name":"SCHILLACI","classification":"B","division":"PCC","hit_factor":13.0435},{"match_name":"EWPSA 2020-07","match_date":"2020-07-19","stage_classifiercode":"06-05","member_number":"L4628","first_name":"WARREN","last_name":"HARPER","classification":"G","division":"PCC","hit_factor":13.0293},{"match_name":"MASTER BLASTERS & SSFGA USPSA - October","match_date":"2021-10-10","stage_classifiercode":"06-05","member_number":"Ty78926","first_name":"BOB","last_name":"DZAMKO","classification":"B","division":"PCC","hit_factor":13.0137},{"match_name":"Shoot GTR USPSA Monthly Match November 2017","match_date":"2017-11-05","stage_classifiercode":"06-05","member_number":"A86924","first_name":"MICHAEL","last_name":"STACK","classification":"M","division":"PCC","hit_factor":13.0137},{"match_name":"MPSA 2021-06-05","match_date":"2021-06-05","stage_classifiercode":"06-05","member_number":"TY28619","first_name":"SCOTT","last_name":"JACOB","classification":"A","division":"PCC","hit_factor":12.9771},{"match_name":"Space Coast Practical Shooters","match_date":"2018-09-01","stage_classifiercode":"06-05","member_number":"A69150","first_name":"DERRICK","last_name":"CHEN-LUKE","classification":"A","division":"PCC","hit_factor":12.9693},{"match_name":"TAC2 USPSA Sept 2018","match_date":"2018-09-01","stage_classifiercode":"06-05","member_number":"TY92055","first_name":"BRYAN","last_name":"KISER","classification":"A","division":"PCC","hit_factor":12.9693},{"match_name":"Deadwood Boys USPSA All Classifier Match","match_date":"2016-08-07","stage_classifiercode":"06-05","member_number":"A89753","first_name":"MAX","last_name":"LEOGRANDIS","classification":"U","division":"PCC","hit_factor":12.9555},{"match_name":"ORPCI 2018.03.31 USPSA Special","match_date":"2018-03-31","stage_classifiercode":"06-05","member_number":"A82559","first_name":"TRAVIS","last_name":"FITZPATRICK","classification":"M","division":"PCC","hit_factor":12.9496},{"match_name":"Lafayette Practical Shooters - THURS - Aug 19. (40 rds)","match_date":"2021-08-19","stage_classifiercode":"06-05","member_number":"A121987","first_name":"GLENN","last_name":"ROBICHAUX","classification":"B","division":"PCC","hit_factor":12.945},{"match_name":"SAPSA December 2017","match_date":"2017-12-16","stage_classifiercode":"06-05","member_number":"A77998","first_name":"CALVIN","last_name":"CARPENTER","classification":"A","division":"PCC","hit_factor":12.945},{"match_name":"Laser Ninja Dragon League USPSA April 2018","match_date":"2018-04-08","stage_classifiercode":"06-05","member_number":"A99942","first_name":"JOHN","last_name":"MORRISON (PCC)","classification":"B","division":"PCC","hit_factor":12.9252},{"match_name":"Prescott 1st Saturday USPSA 4-7-18","match_date":"2018-04-07","stage_classifiercode":"06-05","member_number":"L4264","first_name":"BILL","last_name":"MUNGER","classification":"M","division":"PCC","hit_factor":12.8814},{"match_name":"MPSA 2021-06-05","match_date":"2021-06-05","stage_classifiercode":"06-05","member_number":"A78083","first_name":"JEFFREY","last_name":"BLITCH","classification":"B","division":"PCC","hit_factor":12.8814},{"match_name":"Richmond Hot Shots December 5-6-2020 USPSA Pistol","match_date":"2020-12-05","stage_classifiercode":"06-05","member_number":"Ty56081","first_name":"HENRIK","last_name":"BLIXT","classification":"G","division":"PCC","hit_factor":12.8571},{"match_name":"ARPC USPSA Match 3-25-18","match_date":"2018-03-25","stage_classifiercode":"06-05","member_number":"A82327","first_name":"BRIAN","last_name":"SIX","classification":"B","division":"PCC","hit_factor":12.8378},{"match_name":"Clinton County USPSA Oct 22 2016","match_date":"2016-10-22","stage_classifiercode":"06-05","member_number":"A-96581","first_name":"JOE","last_name":"CARUSO","classification":"B","division":"PCC","hit_factor":12.8378},{"match_name":"NRG Saturday March 10th- Includes a Classifier Stage","match_date":"2018-03-10","stage_classifiercode":"06-05","member_number":"A104521","first_name":"ANDREW","last_name":"GENKUONG","classification":"U","division":"PCC","hit_factor":12.8378},{"match_name":"TPS USPSA AT CMP Sunday SEPT 30 2018","match_date":"2018-09-29","stage_classifiercode":"06-05","member_number":"A102109","first_name":"JASON","last_name":"CLARK","classification":"M","division":"PCC","hit_factor":12.8302},{"match_name":"Palmetto Gun Club - Late September 2017 USPSA","match_date":"2017-09-30","stage_classifiercode":"06-05","member_number":"FY75669","first_name":"SCOTT","last_name":"THOMPSON","classification":"G","division":"PCC","hit_factor":12.8302},{"match_name":"Triforce Practical Shooters at BigWoodsGoods 3-22-18","match_date":"2018-03-22","stage_classifiercode":"06-05","member_number":"A98278","first_name":"JACK","last_name":"WINDES","classification":"M","division":"PCC","hit_factor":12.8205},{"match_name":"SCCC CLASSIFIER MATCH 7_23_17","match_date":"2017-07-23","stage_classifiercode":"06-05","member_number":"TY77176","first_name":"DON_1","last_name":"O`BRADOVICH","classification":"U","division":"PCC","hit_factor":12.8114},{"match_name":"Richmond Hot Shots December 5-6-2020 USPSA Pistol","match_date":"2020-12-05","stage_classifiercode":"06-05","member_number":"TY99745","first_name":"JONATHAN","last_name":"OWYANG","classification":"M","division":"PCC","hit_factor":12.8},{"match_name":"Atlanta Practical Shooters October 2017 PCC USPSA Match","match_date":"2017-09-30","stage_classifiercode":"06-05","member_number":"TY57617","first_name":"ERIC","last_name":"DAVIS","classification":"B","division":"PCC","hit_factor":12.7946},{"match_name":"USAH November Covid19 Pistol & PCC Match ","match_date":"2021-11-07","stage_classifiercode":"06-05","member_number":"FY61621","first_name":"DERICK","last_name":"HIPOL","classification":"U","division":"PCC","hit_factor":12.782},{"match_name":"OKCGC USPSA July 2017","match_date":"2017-07-01","stage_classifiercode":"06-05","member_number":"A82757","first_name":"RYAN","last_name":"GROVES","classification":"X","division":"PCC","hit_factor":12.7796},{"match_name":"SWGC USPSA Pistol Match - October 2018","match_date":"2018-10-06","stage_classifiercode":"06-05","member_number":"Ty52476","first_name":"JOHN","last_name":"TISCHLER","classification":"A","division":"PCC","hit_factor":12.7796},{"match_name":"LCHG May USPSA","match_date":"2017-05-21","stage_classifiercode":"06-05","member_number":"A65280","first_name":"TRAVIS","last_name":"MCKLOSKY","classification":"U","division":"PCC","hit_factor":12.7796},{"match_name":"RMAP 3rd  Sunday September 2016","match_date":"2016-09-18","stage_classifiercode":"06-05","member_number":"TY61605","first_name":"HERBERT","last_name":"ABEL","classification":"U","division":"PCC","hit_factor":12.766},{"match_name":"CRGC USPSA Match 10-18-20","match_date":"2020-10-18","stage_classifiercode":"06-05","member_number":"A103354","first_name":"STEVEN","last_name":"CHAET","classification":"","division":"PCC","hit_factor":12.7517},{"match_name":"Rankin Field Sunday USPSA","match_date":"2018-02-18","stage_classifiercode":"06-05","member_number":"A64278","first_name":"JOHN","last_name":"SPIER","classification":"U","division":"PCC","hit_factor":12.7517},{"match_name":"EWPSA 2020-07","match_date":"2020-07-19","stage_classifiercode":"06-05","member_number":"L3238","first_name":"MATT","last_name":"NEWBURN","classification":"M","division":"PCC","hit_factor":12.7389},{"match_name":"MASTER BLASTERS & SSFGA USPSA - October","match_date":"2021-10-10","stage_classifiercode":"06-05","member_number":"A118572","first_name":"SAMUEL","last_name":"CYR","classification":"B","division":"PCC","hit_factor":12.7341},{"match_name":"OKCGC USPSA July 2018","match_date":"2018-07-07","stage_classifiercode":"06-05","member_number":"A89709","first_name":"BRIAN","last_name":"SMITH","classification":"U","division":"PCC","hit_factor":12.7341},{"match_name":"MASTER BLASTERS & SSFGA USPSA - October","match_date":"2021-10-10","stage_classifiercode":"06-05","member_number":"A-104656","first_name":"CRAIG","last_name":"TRAHAN","classification":"A","division":"PCC","hit_factor":12.7208},{"match_name":"Hosemonster Action ","match_date":"2020-11-15","stage_classifiercode":"06-05","member_number":"Ty121838","first_name":"TODD","last_name":"TOENGES","classification":"U","division":"PCC","hit_factor":12.709},{"match_name":"MCAS July 2017 USPSA Match","match_date":"2017-07-15","stage_classifiercode":"06-05","member_number":"TY68596","first_name":"DAVE","last_name":"FOX","classification":"B","division":"PCC","hit_factor":12.709},{"match_name":"SWGC USPSA Pistol Match - October 2018","match_date":"2018-10-06","stage_classifiercode":"06-05","member_number":"TY88724","first_name":"JESSICA","last_name":"DOIRON","classification":"A","division":"PCC","hit_factor":12.709},{"match_name":"Richmond Hot Shots December 5-6-2020 USPSA Pistol","match_date":"2020-12-05","stage_classifiercode":"06-05","member_number":"L3373","first_name":"JAY","last_name":"SAOUD","classification":"M","division":"PCC","hit_factor":12.6866},{"match_name":"August 8 2018 A-Zone match","match_date":"2018-08-08","stage_classifiercode":"06-05","member_number":"A87214","first_name":"CORY","last_name":"KLEMASHEVICH","classification":"X","division":"PCC","hit_factor":12.6761},{"match_name":"DSS - USPSA 18-10-14","match_date":"2018-10-14","stage_classifiercode":"06-05","member_number":"A83704","first_name":"SCOTT","last_name":"BEEBE","classification":"\"\"","division":"PCC","hit_factor":12.6761},{"match_name":"Prescott 1st Saturday USPSA 4-7-18","match_date":"2018-04-07","stage_classifiercode":"06-05","member_number":"TY71570","first_name":"BEN","last_name":"KREUTZBERG","classification":"M","division":"PCC","hit_factor":12.6667},{"match_name":"XMG USPSA   August 07 2021","match_date":"2021-08-07","stage_classifiercode":"06-05","member_number":"A135603","first_name":"JEFFREY","last_name":"OVIEDO","classification":"U","division":"PCC","hit_factor":12.6667},{"match_name":"WAC May 30th (5th Saturday) - USPSA 6 Stage Classifier Match","match_date":"2020-05-30","stage_classifiercode":"06-05","member_number":"a58143","first_name":"WAYNE","last_name":"ACKETT","classification":"U","division":"PCC","hit_factor":12.6582},{"match_name":"Rankin Field April (ALL CLASSIFIER) Saturday USPSA","match_date":"2021-04-03","stage_classifiercode":"06-05","member_number":"A107521","first_name":"MARK","last_name":"MELLO","classification":"U","division":"PCC","hit_factor":12.6394},{"match_name":"GoShoot Outdoors April 5th","match_date":"2020-04-05","stage_classifiercode":"06-05","member_number":"A54296","first_name":"ROBERT","last_name":"BOWLES","classification":"B","division":"PCC","hit_factor":12.6316},{"match_name":"Mesquite Mayhem Monthly USPSA Match","match_date":"2021-01-10","stage_classifiercode":"06-05","member_number":"A57100","first_name":"BRANDON","last_name":"BADGER","classification":"M","division":"PCC","hit_factor":12.6316},{"match_name":"GPS  May 2017","match_date":"2017-05-28","stage_classifiercode":"06-05","member_number":"a87214","first_name":"CORY","last_name":"KLEMSEVICH","classification":"G","division":"PCC","hit_factor":12.6183},{"match_name":"GoShoot Outdoor July 24th","match_date":"2021-07-24","stage_classifiercode":"06-05","member_number":"A57242","first_name":"MORRIS","last_name":"THOMPSON","classification":"B","division":"PCC","hit_factor":12.5926},{"match_name":"GPS  May 2017","match_date":"2017-05-28","stage_classifiercode":"06-05","member_number":"TY79055","first_name":"WADE","last_name":"PRUETZ","classification":"U","division":"PCC","hit_factor":12.5874},{"match_name":"TPS USPSA -  September 2018 USPSA","match_date":"2018-09-01","stage_classifiercode":"06-05","member_number":"A16020","first_name":"A.J.","last_name":"MCCARTNEY","classification":"A","division":"PCC","hit_factor":12.5874},{"match_name":"OFGC USPSA Match 5-20-18","match_date":"2018-05-20","stage_classifiercode":"06-05","member_number":"A96123","first_name":"BRANDON","last_name":"GREEN","classification":"B","division":"PCC","hit_factor":12.5828},{"match_name":"LdF USPSA Match September 22 2018","match_date":"2018-09-22","stage_classifiercode":"06-05","member_number":"L3692","first_name":"ANDREW","last_name":"CATBAGAN","classification":"A","division":"PCC","hit_factor":12.5786},{"match_name":"DSSA 2020-06  USPSA Pistol","match_date":"2020-06-28","stage_classifiercode":"06-05","member_number":"A92067","first_name":"DON","last_name":"ALBARES","classification":"A","division":"PCC","hit_factor":12.5786},{"match_name":"Space Coast Practical Shooters","match_date":"2018-09-01","stage_classifiercode":"06-05","member_number":"Ty97123","first_name":"FERNANDO","last_name":"FERREIRA","classification":"C","division":"PCC","hit_factor":12.5786},{"match_name":"OKCGC USPSA July 2017","match_date":"2017-07-01","stage_classifiercode":"06-05","member_number":"TY78454","first_name":"GRANT","last_name":"GAINES","classification":"U","division":"PCC","hit_factor":12.5436},{"match_name":"SWGC USPSA Pistol Match - October 2018","match_date":"2018-10-06","stage_classifiercode":"06-05","member_number":"A102011","first_name":"STEVE","last_name":"LUCK","classification":"B","division":"PCC","hit_factor":12.5413},{"match_name":"GoShoot Outdoors April 5th","match_date":"2020-04-05","stage_classifiercode":"06-05","member_number":"A115477","first_name":"JOSHUA","last_name":"YOST","classification":"B","division":"PCC","hit_factor":12.5},{"match_name":"FBURG April 2021 Level I USPSA ","match_date":"2021-04-03","stage_classifiercode":"06-05","member_number":"A98613","first_name":"GARY","last_name":"SCHOLL","classification":"B","division":"PCC","hit_factor":12.5},{"match_name":"LPRGC - Lower Providence USPSA July 2018","match_date":"2018-07-07","stage_classifiercode":"06-05","member_number":"A82492","first_name":"JOSE","last_name":"SOUSA","classification":"A","division":"PCC","hit_factor":12.4611},{"match_name":"USPSA MO21 2Alpha SBRC April 2018 Special Classifier","match_date":"2018-04-28","stage_classifiercode":"06-05","member_number":"A101856","first_name":"NICHOLAS","last_name":"GROSS","classification":"C","division":"PCC","hit_factor":12.4611},{"match_name":"Mesilla Valley P December 2020","match_date":"2020-12-05","stage_classifiercode":"06-05","member_number":"L4737","first_name":"DIANA","last_name":"DRISCOLL","classification":"A","division":"PCC","hit_factor":12.459},{"match_name":"Cortland Pistol Club Sept 27 USPSA Classifier Match","match_date":"2020-09-27","stage_classifiercode":"06-05","member_number":"TY116746","first_name":"TIMOTHY","last_name":"MOON","classification":"C","division":"PCC","hit_factor":12.459},{"match_name":"Mesquite Mayhem Shooter Society USPSA 9-23-2017","match_date":"2017-09-23","stage_classifiercode":"06-05","member_number":"ty31924","first_name":"OTIS","last_name":"AUSTIN","classification":"M","division":"PCC","hit_factor":12.4567},{"match_name":"PTPC May 6th  USPSA Match","match_date":"2018-05-06","stage_classifiercode":"06-05","member_number":"A73683","first_name":"BRYAN","last_name":"TECSON","classification":"A","division":"PCC","hit_factor":12.4542},{"match_name":"OFGC USPSA Match 8-15-21","match_date":"2021-08-15","stage_classifiercode":"06-05","member_number":"TY94217","first_name":"DUSTIN","last_name":"CHAMBERLAIN","classification":"A","division":"PCC","hit_factor":12.4224},{"match_name":"WSRC USPSA 8/19-20/2017","match_date":"2017-08-19","stage_classifiercode":"06-05","member_number":"TY105194","first_name":"MATT","last_name":"JAIMES","classification":"U","division":"PCC","hit_factor":12.4224},{"match_name":"JPPS Club Match 5-1-2021","match_date":"2021-05-01","stage_classifiercode":"06-05","member_number":"A23615","first_name":"RODNEY","last_name":"COBB","classification":"A","division":"PCC","hit_factor":12.4224},{"match_name":"Atlanta Practical Shooters October 2017 PCC USPSA Match","match_date":"2017-09-30","stage_classifiercode":"06-05","member_number":"L3384","first_name":"JAMES","last_name":"FROELICH","classification":"U","division":"PCC","hit_factor":12.4183},{"match_name":"PTPC December 3rd USPSA Match","match_date":"2017-12-03","stage_classifiercode":"06-05","member_number":"A73683","first_name":"BRYAN","last_name":"TECSON","classification":"A","division":"PCC","hit_factor":12.4183},{"match_name":"FLPSA MN14 July 2nd USPSA","match_date":"2020-07-02","stage_classifiercode":"06-05","member_number":"A101063","first_name":"NICK","last_name":"DAHLBERG","classification":"U","division":"PCC","hit_factor":12.4138},{"match_name":"DWB - Deadwood Boys USPSA 01 April 2018","match_date":"2018-04-01","stage_classifiercode":"06-05","member_number":"A98726","first_name":"CALEB","last_name":"BAER","classification":"B","division":"PCC","hit_factor":12.4088},{"match_name":"LdF USPSA Match September 22 2018","match_date":"2018-09-22","stage_classifiercode":"06-05","member_number":"TY86247","first_name":"SEAN","last_name":"DAVIS","classification":"U","division":"PCC","hit_factor":12.4088},{"match_name":"SLPSA Jan USPSA match 2","match_date":"2020-01-18","stage_classifiercode":"06-05","member_number":"L3144","first_name":"YANCY","last_name":"KOESTER","classification":"M","division":"PCC","hit_factor":12.3839},{"match_name":"SAPSA December 2017","match_date":"2017-12-16","stage_classifiercode":"06-05","member_number":"A98953","first_name":"JON","last_name":"OUM","classification":"D","division":"PCC","hit_factor":12.3779},{"match_name":"LBAS170429 Spray-N-Pray Classifier Match","match_date":"2017-04-29","stage_classifiercode":"06-05","member_number":"A24066","first_name":"GEORGE","last_name":"MANDES","classification":"B","division":"PCC","hit_factor":12.3779},{"match_name":"YRPA  September USPSA 2017","match_date":"2017-09-24","stage_classifiercode":"06-05","member_number":"TY61539","first_name":"ANN","last_name":"BLOSSER","classification":"A","division":"PCC","hit_factor":12.3711},{"match_name":"Triforce Practical Shooters at BigWoodsGoods 3-22-18","match_date":"2018-03-22","stage_classifiercode":"06-05","member_number":"ty57617","first_name":"ERIC","last_name":"DAVIS","classification":"A","division":"PCC","hit_factor":12.3711},{"match_name":"DWB - Deadwood Boys USPSA 01 April 2018","match_date":"2018-04-01","stage_classifiercode":"06-05","member_number":"A94923","first_name":"WILSON","last_name":"PARK","classification":"C","division":"PCC","hit_factor":12.3457},{"match_name":"LPRGC - Lower Providence USPSA Match July 2021","match_date":"2021-07-03","stage_classifiercode":"06-05","member_number":"TY92719","first_name":"DEAN","last_name":"MIOLI","classification":"B","division":"PCC","hit_factor":12.3377},{"match_name":"SLPSA Jan USPSA match 2","match_date":"2020-01-18","stage_classifiercode":"06-05","member_number":"A74550","first_name":"KIRBY","last_name":"LUNT","classification":"A","division":"PCC","hit_factor":12.3288},{"match_name":"Mesquite Mayhem Monthly USPSA Match","match_date":"2021-01-10","stage_classifiercode":"06-05","member_number":"TY114829","first_name":"ROGER","last_name":"HOLDMAN","classification":"B","division":"PCC","hit_factor":12.3077},{"match_name":"Maryland Practical Shooters Association June 2018","match_date":"2018-06-24","stage_classifiercode":"06-05","member_number":"TY58697","first_name":"GARY","last_name":"PARSONS","classification":"A","division":"PCC","hit_factor":12.2977},{"match_name":"FLPSA MN14 July 2nd USPSA","match_date":"2020-07-02","stage_classifiercode":"06-05","member_number":"A103272","first_name":"ERIC","last_name":"SANDSTROM","classification":"B","division":"PCC","hit_factor":12.2867},{"match_name":"USPSA MO21 2Alpha SBRC April 2018 Special Classifier","match_date":"2018-04-28","stage_classifiercode":"06-05","member_number":"FY70323","first_name":"ROGER","last_name":"SUTTON","classification":"A","division":"PCC","hit_factor":12.2744},{"match_name":"LPRGC - Lower Providence USPSA Match July 2021","match_date":"2021-07-03","stage_classifiercode":"06-05","member_number":"A114630","first_name":"JOSEPH","last_name":"SANTOS","classification":"A","division":"PCC","hit_factor":12.2744},{"match_name":"OKCGC USPSA July 2017","match_date":"2017-07-01","stage_classifiercode":"06-05","member_number":"TY89882","first_name":"TRAVIS","last_name":"LOWRY","classification":"B","division":"PCC","hit_factor":12.2699},{"match_name":"DSS - USPSA - 21-08-08","match_date":"2021-08-08","stage_classifiercode":"06-05","member_number":"A112153","first_name":"DANIEL","last_name":"TOOTHMAN","classification":"B","division":"PCC","hit_factor":12.2699},{"match_name":"WGC August 2020 USPSA Classifier","match_date":"2020-08-09","stage_classifiercode":"06-05","member_number":"TY48703","first_name":"TERRY","last_name":"JOHNSON","classification":"A","division":"PCC","hit_factor":12.2605},{"match_name":"Pioneer Action Shooters USPSA 5-23-21 Special Classifer","match_date":"2021-05-23","stage_classifiercode":"06-05","member_number":"L2187","first_name":"ALLEN","last_name":"LAU","classification":"M","division":"PCC","hit_factor":12.2605},{"match_name":"OKCGC USPSA July 2017","match_date":"2017-07-01","stage_classifiercode":"06-05","member_number":"L3649","first_name":"MIKE","last_name":"PINTO","classification":"A","division":"PCC","hit_factor":12.2581},{"match_name":"EWPSA 2020-07","match_date":"2020-07-19","stage_classifiercode":"06-05","member_number":"L3269","first_name":"BRIAN","last_name":"HUMANN","classification":"A","division":"PCC","hit_factor":12.2581},{"match_name":"SCCC CLASSIFIER MATCH 7_23_17","match_date":"2017-07-23","stage_classifiercode":"06-05","member_number":"a96988","first_name":"CRAIG","last_name":"BENEFIEL","classification":"U","division":"PCC","hit_factor":12.2449},{"match_name":"June   USPSA  2018","match_date":"2018-06-09","stage_classifiercode":"06-05","member_number":"A106211","first_name":"JOHN","last_name":"SLATER","classification":"U","division":"PCC","hit_factor":12.2324},{"match_name":"GoShoot Outdoors April 5th","match_date":"2020-04-05","stage_classifiercode":"06-05","member_number":"A120342","first_name":"GABRIEL","last_name":"BELMARES","classification":"U","division":"PCC","hit_factor":12.2186},{"match_name":"OKCGC USPSA July 2017","match_date":"2017-07-01","stage_classifiercode":"06-05","member_number":"TY69238","first_name":"TONY","last_name":"WALL","classification":"B","division":"PCC","hit_factor":12.2034},{"match_name":"TGC USPSA November 2017","match_date":"2017-11-18","stage_classifiercode":"06-05","member_number":"A83285","first_name":"GARY","last_name":"AU","classification":"A","division":"PCC","hit_factor":12.2034},{"match_name":"ORSA USPSA October 2017","match_date":"2017-10-21","stage_classifiercode":"06-05","member_number":"A102163","first_name":"JOHNATHON","last_name":"WARD","classification":"C","division":"PCC","hit_factor":12.2034},{"match_name":"WSPS OCTOBER 2016 SPECIAL CLASSIFIER MATCH","match_date":"2016-10-29","stage_classifiercode":"06-05","member_number":"A82492","first_name":"JOSE","last_name":"SOUSA","classification":"U","division":"PCC","hit_factor":12.1951},{"match_name":"OK15 USPSA at USSA","match_date":"2016-12-11","stage_classifiercode":"06-05","member_number":"TY69238","first_name":"TONY","last_name":"WALL","classification":"U","division":"PCC","hit_factor":12.1864},{"match_name":"Steel City USPSA September 5 2020","match_date":"2020-09-04","stage_classifiercode":"06-05","member_number":"A123797","first_name":"RON","last_name":"HOLLAND","classification":"B","division":"PCC","hit_factor":12.1622},{"match_name":"Mesquite Mayhem Monthly USPSA Match","match_date":"2021-01-10","stage_classifiercode":"06-05","member_number":"Ty40354","first_name":"JERRY","last_name":"BONURA","classification":"B","division":"PCC","hit_factor":12.1622},{"match_name":"INAS USPSA April 2018","match_date":"2018-04-14","stage_classifiercode":"06-05","member_number":"FY87913","first_name":"JONATHAN","last_name":"MOORE","classification":"M","division":"PCC","hit_factor":12.1429},{"match_name":"Alpha Mike August Classifier 2021   ","match_date":"2021-08-15","stage_classifiercode":"06-05","member_number":"A99599","first_name":"ARNEL","last_name":"UDANI","classification":"U","division":"PCC","hit_factor":12.1406},{"match_name":"June   USPSA  2018","match_date":"2018-06-09","stage_classifiercode":"06-05","member_number":"TY97123","first_name":"FERNANDO","last_name":"FERREIRA","classification":"C","division":"PCC","hit_factor":12.1212},{"match_name":"Belton Gun Club USPSA March Classifier MATCH 3-7-21","match_date":"2021-03-07","stage_classifiercode":"06-05","member_number":"Ty105219","first_name":"ROB","last_name":"RAVINA","classification":"U","division":"PCC","hit_factor":12.1019},{"match_name":"CSA Annual Classifier Classic","match_date":"2018-03-18","stage_classifiercode":"06-05","member_number":"L4135","first_name":"TOM","last_name":"SARGENT","classification":"U","division":"PCC","hit_factor":12.0996},{"match_name":"NRG Saturday July 8th - classifier","match_date":"2017-07-08","stage_classifiercode":"06-05","member_number":"L3692","first_name":"ANDREW","last_name":"CATBAGAN","classification":"B","division":"PCC","hit_factor":12.0996},{"match_name":"Steel City USPSA September 5 2020","match_date":"2020-09-04","stage_classifiercode":"06-05","member_number":"A104668","first_name":"TONY","last_name":"CLECKLER","classification":"A","division":"PCC","hit_factor":12.0805},{"match_name":"DRRC USPSA May2018","match_date":"2018-05-05","stage_classifiercode":"06-05","member_number":"TY47743","first_name":"NORMAN","last_name":"BRIGHT","classification":"G","division":"PCC","hit_factor":12.0755},{"match_name":"Steel City USPSA August 4 2018","match_date":"2018-08-04","stage_classifiercode":"06-05","member_number":"A104668","first_name":"TONY","last_name":"CLECKLER","classification":"B","division":"PCC","hit_factor":12.0635},{"match_name":"NVSA USPSA 2110","match_date":"2021-10-17","stage_classifiercode":"06-05","member_number":"A16730","first_name":"RON","last_name":"SECHLER","classification":"B","division":"PCC","hit_factor":12.0635},{"match_name":"RCPS USPSA October 17","match_date":"2020-10-17","stage_classifiercode":"06-05","member_number":"TY26587","first_name":"MARK","last_name":"RUSCHAK","classification":"M","division":"PCC","hit_factor":12.0635},{"match_name":"ORSA USPSA October 2017","match_date":"2017-10-21","stage_classifiercode":"06-05","member_number":"A100234","first_name":"TONY","last_name":"MARTIN","classification":"B","division":"PCC","hit_factor":12.0635},{"match_name":"DWB - Deadwood Boys USPSA 01 April 2018","match_date":"2018-04-01","stage_classifiercode":"06-05","member_number":"A40050","first_name":"JEFF","last_name":"CHURCH","classification":"A","division":"PCC","hit_factor":12.0567},{"match_name":"Richmond Hot Shots December 5-6-2020 USPSA Pistol","match_date":"2020-12-05","stage_classifiercode":"06-05","member_number":"TY112776","first_name":"JOEY","last_name":"PUNTANILLA","classification":"B","division":"PCC","hit_factor":12.0567},{"match_name":"OKCGC USPSA July 2017","match_date":"2017-07-01","stage_classifiercode":"06-05","member_number":"A93174","first_name":"SCOTT","last_name":"CUDE","classification":"B","division":"PCC","hit_factor":12.0567},{"match_name":"Parma May 2 USPSA","match_date":"2020-05-02","stage_classifiercode":"06-05","member_number":"TY84121","first_name":"GABOR","last_name":"MAGONY","classification":"G","division":"PCC","hit_factor":12.0567},{"match_name":"Pioneer Action Shooters USPSA 5-23-21 Special Classifer","match_date":"2021-05-23","stage_classifiercode":"06-05","member_number":"A110207","first_name":"RICK","last_name":"MELLINO","classification":"A","division":"PCC","hit_factor":12.0567},{"match_name":"S&Hs8 22 20 Slot Match","match_date":"2020-08-19","stage_classifiercode":"06-05","member_number":"TY118032","first_name":"ADAM","last_name":"BELL","classification":"B","division":"PCC","hit_factor":12.0482},{"match_name":"OK15 USPSA at USSA","match_date":"2016-12-11","stage_classifiercode":"06-05","member_number":"a78427","first_name":"DILLEN","last_name":"EASLEY","classification":"U","division":"PCC","hit_factor":12.0482},{"match_name":"WGC June 2018 USPSA 2","match_date":"2018-06-24","stage_classifiercode":"06-05","member_number":"L3696","first_name":"ROBERT","last_name":"HALSELL","classification":"M","division":"PCC","hit_factor":12.0301},{"match_name":"Deadwood Boys USPSA All Classifier Match","match_date":"2016-08-07","stage_classifiercode":"06-05","member_number":"A78856","first_name":"CRIS","last_name":"CARPENTER","classification":"U","division":"PCC","hit_factor":12.0301},{"match_name":"EHPSA USPSA 25 July 2021","match_date":"2021-07-25","stage_classifiercode":"06-05","member_number":"TY81368","first_name":"JEFFREY","last_name":"KILLINGER","classification":"A","division":"PCC","hit_factor":12.0253},{"match_name":"Clinton County USPSA Oct 22 2016","match_date":"2016-10-22","stage_classifiercode":"06-05","member_number":"A-98814","first_name":"COLE","last_name":"TAYLOR","classification":"U","division":"PCC","hit_factor":12.0253},{"match_name":"Atlanta Practical Shooters October 2017 PCC USPSA Match","match_date":"2017-09-30","stage_classifiercode":"06-05","member_number":"A100703","first_name":"PETER","last_name":"MALECKI","classification":"U","division":"PCC","hit_factor":12.0253},{"match_name":"LBAS170429 Spray-N-Pray Classifier Match","match_date":"2017-04-29","stage_classifiercode":"06-05","member_number":"TY31924","first_name":"OTIS","last_name":"AUSTIN","classification":"A","division":"PCC","hit_factor":12.0141},{"match_name":"NAAS 2018-03-18","match_date":"2018-03-18","stage_classifiercode":"06-05","member_number":"A97112","first_name":"BRETT","last_name":"TYLER","classification":"B","division":"PCC","hit_factor":12.0141},{"match_name":"SCAPSA MN05 SPRING LEAGUE 6","match_date":"2017-09-12","stage_classifiercode":"06-05","member_number":"A53828","first_name":"MARK","last_name":"PETERS","classification":"C","division":"PCC","hit_factor":12.012},{"match_name":"WSPS OCTOBER 2016 SPECIAL CLASSIFIER MATCH","match_date":"2016-10-29","stage_classifiercode":"06-05","member_number":"A98254","first_name":"MARK","last_name":"HARBOLD","classification":"U","division":"PCC","hit_factor":11.9874},{"match_name":"OKCGC USPSA July 2017","match_date":"2017-07-01","stage_classifiercode":"06-05","member_number":"TY42278","first_name":"KELLY","last_name":"RAGLIN","classification":"A","division":"PCC","hit_factor":11.9874},{"match_name":"ORPCI 2018.03.31 USPSA Special","match_date":"2018-03-31","stage_classifiercode":"06-05","member_number":"A89356","first_name":"CHASE","last_name":"HARBER","classification":"M","division":"PCC","hit_factor":11.9874},{"match_name":"Cortland Pistol Club June 24 USPSA","match_date":"2018-06-24","stage_classifiercode":"06-05","member_number":"\"\"","first_name":"BRIAN","last_name":"SHATARA","classification":"U","division":"PCC","hit_factor":11.9601},{"match_name":"SAPSA December 2017","match_date":"2017-12-16","stage_classifiercode":"06-05","member_number":"A106054","first_name":"CHRIS","last_name":"FOWLER","classification":"C","division":"PCC","hit_factor":11.9601},{"match_name":"OFGC USPSA Match 5-20-18","match_date":"2018-05-20","stage_classifiercode":"06-05","member_number":"TY89171","first_name":"AUSTIN","last_name":"CHAMBERLAIN","classification":"A","division":"PCC","hit_factor":11.9601},{"match_name":"WSPS OCTOBER 2016 SPECIAL CLASSIFIER MATCH","match_date":"2016-10-29","stage_classifiercode":"06-05","member_number":"A85208","first_name":"BRIAN","last_name":"DAKU","classification":"U","division":"PCC","hit_factor":11.9497},{"match_name":"ORPCI 2018.03.31 USPSA Special","match_date":"2018-03-31","stage_classifiercode":"06-05","member_number":"A78528","first_name":"TIM","last_name":"MEKOSH","classification":"\"\"","division":"PCC","hit_factor":11.9497},{"match_name":"Springfield Tactical Shooters 04/01/2021","match_date":"2021-04-01","stage_classifiercode":"06-05","member_number":"\"\"","first_name":"AARON","last_name":"RENTSCHLER","classification":"\"\"","division":"PCC","hit_factor":11.9497},{"match_name":"Hammer Down USPSA Tue Night April 3 2018","match_date":"2018-04-03","stage_classifiercode":"06-05","member_number":"A102896","first_name":"TIM","last_name":"DUNCAN","classification":"M","division":"PCC","hit_factor":11.9497},{"match_name":"May 30 2018 A-Zone match","match_date":"2018-05-30","stage_classifiercode":"06-05","member_number":"A28015","first_name":"BRENT","last_name":"CAMPBELL","classification":"A","division":"PCC","hit_factor":11.9497},{"match_name":"LBAS170429 Spray-N-Pray Classifier Match","match_date":"2017-04-29","stage_classifiercode":"06-05","member_number":"A54861","first_name":"DENNIS","last_name":"WALKER","classification":"U","division":"PCC","hit_factor":11.9403},{"match_name":"CSA Annual Classifier Classic","match_date":"2018-03-18","stage_classifiercode":"06-05","member_number":"L4135","first_name":"TOM","last_name":"SARGENT","classification":"U","division":"PCC","hit_factor":11.9205},{"match_name":"BORCC USPSA June 2018 Classifer Match","match_date":"2018-06-18","stage_classifiercode":"06-05","member_number":"A101439","first_name":"CHRIS","last_name":"HAVER","classification":"U","division":"PCC","hit_factor":11.9205},{"match_name":"NRG Saturday July 8th - classifier","match_date":"2017-07-08","stage_classifiercode":"06-05","member_number":"A37933","first_name":"CHUCK","last_name":"STRELECKY","classification":"B","division":"PCC","hit_factor":11.9205},{"match_name":"7-30 Match","match_date":"2017-07-30","stage_classifiercode":"06-05","member_number":"A71205","first_name":"JUSTIN","last_name":"SCARBERRY","classification":"U","division":"PCC","hit_factor":11.9122},{"match_name":"DRRC USPSA May2018","match_date":"2018-05-05","stage_classifiercode":"06-05","member_number":"L3012","first_name":"JIM","last_name":"SELL","classification":"C","division":"PCC","hit_factor":11.9048},{"match_name":"Oakdale USPSA MN07 7-22-2021","match_date":"2021-07-22","stage_classifiercode":"06-05","member_number":"TY119536","first_name":"RYAN","last_name":"VOLOVSEK","classification":"M","division":"PCC","hit_factor":11.8959},{"match_name":"LdF USPSA Match September 22 2018","match_date":"2018-09-22","stage_classifiercode":"06-05","member_number":"FY77491","first_name":"TODD","last_name":"MAO2","classification":"C","division":"PCC","hit_factor":11.8881},{"match_name":"Competitive Shooters of Lake Norman CORNELIUS Thursday Evening Indoor USPSA Pistol Match North Carolina","match_date":"2020-09-03","stage_classifiercode":"06-05","member_number":"TY117205","first_name":"JEFF","last_name":"CARRICK","classification":"A","division":"PCC","hit_factor":11.8812},{"match_name":"Prescott 1st Saturday 12-02-17","match_date":"2017-12-02","stage_classifiercode":"06-05","member_number":"A12460","first_name":"ED","last_name":"SERICH","classification":"B","division":"PCC","hit_factor":11.8812},{"match_name":"CFL07 Williston Practical Shooters","match_date":"2018-11-03","stage_classifiercode":"06-05","member_number":"L1240","first_name":"TONY","last_name":"HYATT","classification":"A","division":"PCC","hit_factor":11.8694},{"match_name":"RBGC USPSA 2021-8-15 Special Classifier Match","match_date":"2021-08-15","stage_classifiercode":"06-05","member_number":"TY113813","first_name":"JOE","last_name":"ROUNSEVILLE","classification":"C","division":"PCC","hit_factor":11.8694},{"match_name":"FLPSA MN14 July 2nd USPSA","match_date":"2020-07-02","stage_classifiercode":"06-05","member_number":"A96369","first_name":"JUSTIN","last_name":"BOCK","classification":"A","division":"PCC","hit_factor":11.8467},{"match_name":"DSS - USPSA 20-09-26","match_date":"2020-09-26","stage_classifiercode":"06-05","member_number":"TY108884","first_name":"DAVID","last_name":"WOOD","classification":"A","division":"PCC","hit_factor":11.8467},{"match_name":"NRG Saturday March 10th- Includes a Classifier Stage","match_date":"2018-03-10","stage_classifiercode":"06-05","member_number":"TY55229","first_name":"LUKE","last_name":"AGAJANIAN","classification":"A","division":"PCC","hit_factor":11.8467},{"match_name":"MISS USPSA 5-16-18","match_date":"2018-05-16","stage_classifiercode":"06-05","member_number":"A89151","first_name":"MICHAEL","last_name":"STERN","classification":"C","division":"PCC","hit_factor":11.8421},{"match_name":"Richmond Hot Shots December 5-6-2020 USPSA Pistol","match_date":"2020-12-05","stage_classifiercode":"06-05","member_number":"TY104136","first_name":"RICK","last_name":"NAKASHOJI","classification":"B","division":"PCC","hit_factor":11.8421},{"match_name":"SLPSA Jan USPSA match 2","match_date":"2020-01-18","stage_classifiercode":"06-05","member_number":"A87110","first_name":"ERIK","last_name":"SEO","classification":"A","division":"PCC","hit_factor":11.8421},{"match_name":"TPS USPSA AT CMP Sunday SEPT 30 2018","match_date":"2018-09-29","stage_classifiercode":"06-05","member_number":"TY98974","first_name":"JOHN","last_name":"KUROSKI","classification":"B","division":"PCC","hit_factor":11.838},{"match_name":"Temple Gun Club USPSA Holiday Hosefest 2020","match_date":"2020-12-06","stage_classifiercode":"06-05","member_number":"A118536","first_name":"ALEXANDER","last_name":"BILLS","classification":"B","division":"PCC","hit_factor":11.838},{"match_name":"NRG Saturday April 10th Includes a Classifier Stage","match_date":"2021-04-10","stage_classifiercode":"06-05","member_number":"A34749","first_name":"RON","last_name":"SINGSON","classification":"C","division":"PCC","hit_factor":11.838},{"match_name":"May 30 2018 A-Zone match","match_date":"2018-05-30","stage_classifiercode":"06-05","member_number":"A87214","first_name":"CORY","last_name":"KLEMASHEVICH","classification":"M","division":"PCC","hit_factor":11.811},{"match_name":"CRGC USPSA Match 10-18-20","match_date":"2020-10-18","stage_classifiercode":"06-05","member_number":"A118572","first_name":"SAMUEL","last_name":"CYR","classification":"","division":"PCC","hit_factor":11.8056},{"match_name":"SCPS ECO19 9/25/2020","match_date":"2020-09-25","stage_classifiercode":"06-05","member_number":"TY90095","first_name":"BRETT","last_name":"LOHMAN","classification":"M","division":"PCC","hit_factor":11.8056},{"match_name":"NRG Saturday March 10th- Includes a Classifier Stage","match_date":"2018-03-10","stage_classifiercode":"06-05","member_number":"TY97344","first_name":"DANIEL","last_name":"FRAZIER","classification":"C","division":"PCC","hit_factor":11.8033},{"match_name":"OFGC USPSA Match 5-20-18","match_date":"2018-05-20","stage_classifiercode":"06-05","member_number":"A6900","first_name":"BILLY","last_name":"MCCOY","classification":"A","division":"PCC","hit_factor":11.8033},{"match_name":"SUPS USPSA Special Classifier September 15/16 2018","match_date":"2018-09-15","stage_classifiercode":"06-05","member_number":"L1899","first_name":"GARY","last_name":"POWELL","classification":"U","division":"PCC","hit_factor":11.8012},{"match_name":"WSPS OCTOBER 2016 SPECIAL CLASSIFIER MATCH","match_date":"2016-10-29","stage_classifiercode":"06-05","member_number":"\"\"","first_name":"FORREST","last_name":"LYSINGER","classification":"U","division":"PCC","hit_factor":11.7994},{"match_name":"GoShoot Outdoors April 5th","match_date":"2020-04-05","stage_classifiercode":"06-05","member_number":"A125781","first_name":"ISAAC","last_name":"HANSEN","classification":"B","division":"PCC","hit_factor":11.7647},{"match_name":"CSA Annual Classifier Classic","match_date":"2018-03-18","stage_classifiercode":"06-05","member_number":"TY85570","first_name":"DAVID","last_name":"MILLER","classification":"M","division":"PCC","hit_factor":11.7647},{"match_name":"SCCC CLASSIFIER MATCH 7_23_17","match_date":"2017-07-23","stage_classifiercode":"06-05","member_number":"Ty90556","first_name":"ALVIN","last_name":"LIN","classification":"U","division":"PCC","hit_factor":11.7647},{"match_name":"Nampa USPSA May 29th 2021","match_date":"2021-05-29","stage_classifiercode":"06-05","member_number":"TY85724","first_name":"JEFF","last_name":"PACKER","classification":"B","division":"PCC","hit_factor":11.7647},{"match_name":"DSSA 2020-06  USPSA Pistol","match_date":"2020-06-28","stage_classifiercode":"06-05","member_number":"A78083","first_name":"JEFFREY","last_name":"BLITCH","classification":"B","division":"PCC","hit_factor":11.7647},{"match_name":"SLPSA Dec USPSA","match_date":"2017-12-16","stage_classifiercode":"06-05","member_number":"L4146","first_name":"CAREY","last_name":"PALMER","classification":"U","division":"PCC","hit_factor":11.7647},{"match_name":"LIPSA - November 15th 2020 - USPSA Match ","match_date":"2020-11-15","stage_classifiercode":"06-05","member_number":"L4673","first_name":"DOMENICK","last_name":"MARTINO","classification":"B","division":"PCC","hit_factor":11.7647},{"match_name":"CRGC USPSA Match 10-18-20","match_date":"2020-10-18","stage_classifiercode":"06-05","member_number":"A77713","first_name":"GREGORY","last_name":"SMUSHKIN","classification":"","division":"PCC","hit_factor":11.7647},{"match_name":"NISA March 2018","match_date":"2018-03-25","stage_classifiercode":"06-05","member_number":"A73683","first_name":"BRYAN","last_name":"TECSON","classification":"M","division":"PCC","hit_factor":11.7647},{"match_name":"LCSA USPSA September 2017","match_date":"2017-09-02","stage_classifiercode":"06-05","member_number":"A-101281","first_name":"DIENEZ","last_name":"WOLLET","classification":"U","division":"PCC","hit_factor":11.7647},{"match_name":"TAC2 USPSA Sept 2018","match_date":"2018-09-01","stage_classifiercode":"06-05","member_number":"TY77301","first_name":"SHANE 2G","last_name":"CHARLES","classification":"B","division":"PCC","hit_factor":11.7647},{"match_name":"ARPC USPSA Match 7-26-20","match_date":"2020-07-26","stage_classifiercode":"06-05","member_number":"TY92234","first_name":"BOB","last_name":"KOKOTOVICH","classification":"A","division":"PCC","hit_factor":11.7302},{"match_name":"November 2021 USPSA","match_date":"2021-11-07","stage_classifiercode":"06-05","member_number":"L3576","first_name":"TY","last_name":"GENTRY","classification":"M","division":"PCC","hit_factor":11.7264},{"match_name":"RPGi Thursday Night USPSA  February 4th 2021","match_date":"2021-02-03","stage_classifiercode":"06-05","member_number":"A130030","first_name":"ROB","last_name":"PUGH","classification":"U","division":"PCC","hit_factor":11.7241},{"match_name":"TGC November USPSA","match_date":"2016-11-20","stage_classifiercode":"06-05","member_number":"0","first_name":"SHANE","last_name":"GUINTHER","classification":"X","division":"PCC","hit_factor":11.6959},{"match_name":"Cops September 2016 USPSA CLASSIFIER","match_date":"2016-09-04","stage_classifiercode":"06-05","member_number":"A81279","first_name":"JARROD","last_name":"GROVE","classification":"U","division":"PCC","hit_factor":11.6923},{"match_name":"GPS  May 2017","match_date":"2017-05-28","stage_classifiercode":"06-05","member_number":"A94852","first_name":"RANDY","last_name":"GOODNEY","classification":"U","division":"PCC","hit_factor":11.6883},{"match_name":"Space Coast Practical Shooters","match_date":"2018-09-01","stage_classifiercode":"06-05","member_number":"A98509","first_name":"JOEY","last_name":"EMPAMANO","classification":"U","division":"PCC","hit_factor":11.6838},{"match_name":"WSPS JULY 2016 USPSA","match_date":"2016-07-16","stage_classifiercode":"06-05","member_number":"\"\"","first_name":"MARK","last_name":"HARBOLD","classification":"U","division":"PCC","hit_factor":11.6618},{"match_name":"Steel City USPSA September 5 2020","match_date":"2020-09-04","stage_classifiercode":"06-05","member_number":"TY108549","first_name":"MICHAEL","last_name":"COLE","classification":"A","division":"PCC","hit_factor":11.6618},{"match_name":"RSPP 3rd Saturday January 2017","match_date":"2017-01-21","stage_classifiercode":"06-05","member_number":"L2842","first_name":"PAUL","last_name":"CAUDILL","classification":"U","division":"PCC","hit_factor":11.6618},{"match_name":"EHPSA USPSA 25 July 2021","match_date":"2021-07-25","stage_classifiercode":"06-05","member_number":"A82693","first_name":"LINDA","last_name":"DORISIO","classification":"M","division":"PCC","hit_factor":11.6564},{"match_name":"LPRGC - Lower Providence USPSA Match July 2021","match_date":"2021-07-03","stage_classifiercode":"06-05","member_number":"TY92719","first_name":"DEAN","last_name":"MIOLI","classification":"B","division":"PCC","hit_factor":11.6564},{"match_name":"LBAS170429 Spray-N-Pray Classifier Match","match_date":"2017-04-29","stage_classifiercode":"06-05","member_number":"A24066","first_name":"GEORGE","last_name":"MANDES","classification":"B","division":"PCC","hit_factor":11.6438},{"match_name":"Steel City USPSA September 5 2020","match_date":"2020-09-04","stage_classifiercode":"06-05","member_number":"A125651","first_name":"THOMAS","last_name":"THRIFT","classification":"U","division":"PCC","hit_factor":11.6364},{"match_name":"DWB - Deadwood Boys USPSA August 6 2017","match_date":"2017-08-06","stage_classifiercode":"06-05","member_number":"A2581","first_name":"ROSS","last_name":"DEANE","classification":"A","division":"PCC","hit_factor":11.6364},{"match_name":"CBS October USPSA","match_date":"2020-10-04","stage_classifiercode":"06-05","member_number":"TY19374","first_name":"BENNY","last_name":"HILL","classification":"M","division":"PCC","hit_factor":11.6279},{"match_name":"TGC USPSA November 2017","match_date":"2017-11-18","stage_classifiercode":"06-05","member_number":"A88373","first_name":"RYAN","last_name":"CHAMBERS","classification":"U","division":"PCC","hit_factor":11.6279},{"match_name":"ORPCI USPSA Friday 2021.05.14","match_date":"2021-05-14","stage_classifiercode":"06-05","member_number":"L13863","first_name":"BRIAN","last_name":"SMITH","classification":"","division":"PCC","hit_factor":11.6279},{"match_name":"2020-10 USPSA at Shadow Hawk Defense","match_date":"2020-10-10","stage_classifiercode":"06-05","member_number":"TY-36345","first_name":"\"JOHN \"\"MIG\"\"\"","last_name":"MIGLIACCIO","classification":"A","division":"PCC","hit_factor":11.6208},{"match_name":"USAH May Covid19 Pistol And PCC Match","match_date":"2021-05-15","stage_classifiercode":"06-05","member_number":"FY49431","first_name":"APOLONIO","last_name":"DULATRE","classification":"M","division":"PCC","hit_factor":11.6129},{"match_name":"SWGC USPSA Pistol Match - August 2021","match_date":"2021-08-07","stage_classifiercode":"06-05","member_number":"TY71844","first_name":"THOMAS","last_name":"MCGARITY","classification":"B","division":"PCC","hit_factor":11.5854},{"match_name":"Space Coast Practical Shooters","match_date":"2018-09-01","stage_classifiercode":"06-05","member_number":"A100028","first_name":"CHRIS","last_name":"MAGLALANG","classification":"C","division":"PCC","hit_factor":11.5854},{"match_name":"DSS - USPSA - 21-08-08","match_date":"2021-08-08","stage_classifiercode":"06-05","member_number":"A116426","first_name":"TOM","last_name":"AHOLA","classification":"B","division":"PCC","hit_factor":11.583},{"match_name":"Steel City USPSA September 5 2020","match_date":"2020-09-04","stage_classifiercode":"06-05","member_number":"A95298","first_name":"JAMES","last_name":"PALMER","classification":"A","division":"PCC","hit_factor":11.5756},{"match_name":"MPPL 9th Annual Monster Match","match_date":"2016-10-22","stage_classifiercode":"06-05","member_number":"TY2504","first_name":"KEITH","last_name":"KAWAMOTO","classification":"U","division":"PCC","hit_factor":11.5756},{"match_name":"USAH November Covid19 Pistol & PCC Match ","match_date":"2021-11-07","stage_classifiercode":"06-05","member_number":"FY67177","first_name":"EDGARDO","last_name":"CARAANG","classification":"C","division":"PCC","hit_factor":11.5756},{"match_name":"November 2021 USPSA","match_date":"2021-11-07","stage_classifiercode":"06-05","member_number":"A135940","first_name":"JAKE","last_name":"WILSON","classification":"C","division":"PCC","hit_factor":11.5646},{"match_name":"ARPC USPSA Match 3-25-18","match_date":"2018-03-25","stage_classifiercode":"06-05","member_number":"A102153","first_name":"TIMOTHY","last_name":"STECHER","classification":"Unclassified","division":"PCC","hit_factor":11.5607},{"match_name":"TPS USPSA -  September 2018 USPSA","match_date":"2018-09-01","stage_classifiercode":"06-05","member_number":"TY87135","first_name":"ENVER","last_name":"FOCAKOVIC","classification":"U","division":"PCC","hit_factor":11.5502},{"match_name":"MPSA 090316","match_date":"2016-09-03","stage_classifiercode":"06-05","member_number":"A44284","first_name":"MIKE","last_name":"SETTLE","classification":"U","division":"PCC","hit_factor":11.5385},{"match_name":"NTPS-SE February 2017","match_date":"2017-02-18","stage_classifiercode":"06-05","member_number":"L3863","first_name":"BRIAN","last_name":"SMITH","classification":"U","division":"PCC","hit_factor":11.5385},{"match_name":"YRPA  September USPSA 2017","match_date":"2017-09-24","stage_classifiercode":"06-05","member_number":"A29782","first_name":"RUSS","last_name":"HUNEYWELL","classification":"C","division":"PCC","hit_factor":11.5274},{"match_name":"Augusta USPSA 07-08-18","match_date":"2018-07-08","stage_classifiercode":"06-05","member_number":"A52480","first_name":"RONNIE","last_name":"CASPER","classification":"M","division":"PCC","hit_factor":11.5254},{"match_name":"Prescott 1st Saturday USPSA 4-7-18","match_date":"2018-04-07","stage_classifiercode":"06-05","member_number":"9283790692","first_name":"LARRY","last_name":"FOUTZ","classification":"Unclassified","division":"PCC","hit_factor":11.5152},{"match_name":"WELD ECO09 20180617","match_date":"2018-06-17","stage_classifiercode":"06-05","member_number":"A88944","first_name":"FOREST","last_name":"LATHROP","classification":"B","division":"PCC","hit_factor":11.4943},{"match_name":"DSS - USPSA 20-09-26","match_date":"2020-09-26","stage_classifiercode":"06-05","member_number":"A100953","first_name":"BRETT","last_name":"FRASER","classification":"B","division":"PCC","hit_factor":11.4943},{"match_name":"EHPSA USPSA 25 July 2021","match_date":"2021-07-25","stage_classifiercode":"06-05","member_number":"A105653","first_name":"TRAVIS","last_name":"MIRACLE","classification":"A","division":"PCC","hit_factor":11.4865},{"match_name":"GoShoot Outdoors April 5th","match_date":"2020-04-05","stage_classifiercode":"06-05","member_number":"a25745","first_name":"DAN","last_name":"SANDERS","classification":"B","division":"PCC","hit_factor":11.4804},{"match_name":"LCSA USPSA September 2017","match_date":"2017-09-02","stage_classifiercode":"06-05","member_number":"L3026","first_name":"DAVE","last_name":"DORISIO","classification":"A","division":"PCC","hit_factor":11.4804},{"match_name":"NAAS 2018-03-18","match_date":"2018-03-18","stage_classifiercode":"06-05","member_number":"A80807","first_name":"JON","last_name":"WASHER","classification":"B","division":"PCC","hit_factor":11.4695},{"match_name":"6ta Fecha USPSA","match_date":"2018-06-24","stage_classifiercode":"06-05","member_number":"F109950","first_name":"FRANCISCO","last_name":"RODRIGUEZ-DIAZ","classification":"U","division":"PCC","hit_factor":11.465},{"match_name":"TPS USPSA at CMP May 19 2018","match_date":"2018-05-19","stage_classifiercode":"06-05","member_number":"TY98974","first_name":"JOHN","last_name":"KUROSKI","classification":"C","division":"PCC","hit_factor":11.4613},{"match_name":"OFGC USPSA Match 5-20-18","match_date":"2018-05-20","stage_classifiercode":"06-05","member_number":"A30136","first_name":"JERRY","last_name":"QUISENBERRY","classification":"A","division":"PCC","hit_factor":11.4613},{"match_name":"Richmond Hot Shots December 5-6-2020 USPSA Pistol","match_date":"2020-12-05","stage_classifiercode":"06-05","member_number":"TY95708","first_name":"AARON","last_name":"RUI","classification":"A","division":"PCC","hit_factor":11.4458},{"match_name":"Pioneer Action Shooters USPSA 5-23-21 Special Classifer","match_date":"2021-05-23","stage_classifiercode":"06-05","member_number":"TY96968","first_name":"AARON","last_name":"PACYNA","classification":"C","division":"PCC","hit_factor":11.4286},{"match_name":"2020-10 USPSA at Shadow Hawk Defense","match_date":"2020-10-10","stage_classifiercode":"06-05","member_number":"TY83360","first_name":"JESSE","last_name":"DOVE","classification":"M","division":"PCC","hit_factor":11.4286},{"match_name":"WGC June 2017 USPSA 2","match_date":"2017-06-25","stage_classifiercode":"06-05","member_number":"A72613","first_name":"DONNIE","last_name":"SMITH","classification":"U","division":"PCC","hit_factor":11.4114},{"match_name":"TPS USPSA AT CMP Sunday SEPT 30 2018","match_date":"2018-09-29","stage_classifiercode":"06-05","member_number":"FY-89922","first_name":"CHRIS","last_name":"WORKMAN","classification":"M","division":"PCC","hit_factor":11.396},{"match_name":"Cortland Pistol Club June 24 USPSA","match_date":"2018-06-24","stage_classifiercode":"06-05","member_number":"TY43084","first_name":"HERB","last_name":"TERWILLIGER","classification":"U","division":"PCC","hit_factor":11.396},{"match_name":"Atlanta Practical Shooters October 2017 PCC USPSA Match","match_date":"2017-09-30","stage_classifiercode":"06-05","member_number":"FY65623","first_name":"ERIK","last_name":"KOPP","classification":"C","division":"PCC","hit_factor":11.3924},{"match_name":"RPGi Thursday Night USPSA  February 4th 2021","match_date":"2021-02-03","stage_classifiercode":"06-05","member_number":"TY101981","first_name":"THANA","last_name":"CHAITHA","classification":"U","division":"PCC","hit_factor":11.3924},{"match_name":"Idaho ISPS May 6th 2018","match_date":"2018-05-06","stage_classifiercode":"06-05","member_number":"TY94890","first_name":"CHRIS","last_name":"CLARK","classification":"A","division":"PCC","hit_factor":11.3879},{"match_name":"YMM  IPSC02 2018_02_11","match_date":"2018-02-11","stage_classifiercode":"06-05","member_number":"A87721","first_name":"JIM","last_name":"TAWZER","classification":"U","division":"PCC","hit_factor":11.3772},{"match_name":"DWB - Deadwood Boys USPSA August 6 2017","match_date":"2017-08-06","stage_classifiercode":"06-05","member_number":"ty85661","first_name":"KEITH","last_name":"SORRELL","classification":"A","division":"PCC","hit_factor":11.3772},{"match_name":"Laser Ninja Dragon League USPSA July 2nd Special Classifier","match_date":"2017-07-02","stage_classifiercode":"06-05","member_number":"A99942","first_name":"JOHN","last_name":"MORRISON (PRODUCTION)","classification":"U","division":"PCC","hit_factor":11.3636},{"match_name":"NISA March 2018","match_date":"2018-03-25","stage_classifiercode":"06-05","member_number":"FY73870","first_name":"JEFF","last_name":"CHESNEY","classification":"U","division":"PCC","hit_factor":11.3636},{"match_name":"Alpha Mike August Classifier 2021   ","match_date":"2021-08-15","stage_classifiercode":"06-05","member_number":"FY92760","first_name":"MIKE","last_name":"REED","classification":"C","division":"PCC","hit_factor":11.3636},{"match_name":"USPSA MO21 2Alpha SBRC April 2018 Special Classifier","match_date":"2018-04-28","stage_classifiercode":"06-05","member_number":"A14123","first_name":"BRIAN","last_name":"PAYNE","classification":"A","division":"PCC","hit_factor":11.3565},{"match_name":"Belton Gun Club USPSA March Classifier MATCH 3-7-21","match_date":"2021-03-07","stage_classifiercode":"06-05","member_number":"A88808","first_name":"RICK","last_name":"ROBERTS","classification":"B","division":"PCC","hit_factor":11.3314},{"match_name":"FAS Sunday USPSA Special Classifier Match","match_date":"2020-07-19","stage_classifiercode":"06-05","member_number":"A95711","first_name":"RYAN","last_name":"YURONG","classification":"A","division":"PCC","hit_factor":11.3208},{"match_name":"RMAP 3rd  Sunday September 2016","match_date":"2016-09-18","stage_classifiercode":"06-05","member_number":"TY85822","first_name":"MATT","last_name":"WERNER","classification":"U","division":"PCC","hit_factor":11.3095},{"match_name":"CRGC USPSA Match 10-18-20","match_date":"2020-10-18","stage_classifiercode":"06-05","member_number":"L2187","first_name":"ALLEN","last_name":"LAU","classification":"","division":"PCC","hit_factor":11.3074},{"match_name":"ORPCI USPSA Saturday 21.05.15","match_date":"2021-05-15","stage_classifiercode":"06-05","member_number":"TY13915","first_name":"DARRELL","last_name":"COOMER","classification":"","division":"PCC","hit_factor":11.2994},{"match_name":"Idaho ISPS July 16th Beat the Heat Classifier Match","match_date":"2017-07-16","stage_classifiercode":"06-05","member_number":"TY82305","first_name":"J","last_name":"BATES","classification":"B","division":"PCC","hit_factor":11.2957},{"match_name":"PTPC May 6th  USPSA Match","match_date":"2018-05-06","stage_classifiercode":"06-05","member_number":"TY85154","first_name":"JAMES","last_name":"JENSEN","classification":"A","division":"PCC","hit_factor":11.2853},{"match_name":"Laser Ninja Dragon League USPSA July 2nd Special Classifier","match_date":"2017-07-02","stage_classifiercode":"06-05","member_number":"A94289","first_name":"MAX","last_name":"WALKER","classification":"U","division":"PCC","hit_factor":11.2676},{"match_name":"Mesilla Valley P December 2020","match_date":"2020-12-05","stage_classifiercode":"06-05","member_number":"A121126","first_name":"ALEXANDER","last_name":"ROLDAN","classification":"B","division":"PCC","hit_factor":11.2583},{"match_name":"Cortland Pistol Club June 24 USPSA","match_date":"2018-06-24","stage_classifiercode":"06-05","member_number":"A108164","first_name":"JOE","last_name":"CIRIGLIANO","classification":"U","division":"PCC","hit_factor":11.25},{"match_name":"NPS February 2017 Match","match_date":"2017-02-11","stage_classifiercode":"06-05","member_number":"A68910","first_name":"LINCOLN","last_name":"HASSELL","classification":"U","division":"PCC","hit_factor":11.25},{"match_name":"LIPSA - November 15th 2020 - USPSA Match ","match_date":"2020-11-15","stage_classifiercode":"06-05","member_number":"FY46590","first_name":"KARL","last_name":"BUCHENHAIN","classification":"B","division":"PCC","hit_factor":11.2426},{"match_name":"NPS February 2017 Match","match_date":"2017-02-11","stage_classifiercode":"06-05","member_number":"TY83225","first_name":"BOB","last_name":"SANCHEZ","classification":"U","division":"PCC","hit_factor":11.236},{"match_name":"Palmetto Gun Club - Late September 2017 USPSA","match_date":"2017-09-30","stage_classifiercode":"06-05","member_number":"\"\"","first_name":"RICHARD","last_name":"GUERRERO","classification":"U","division":"PCC","hit_factor":11.2281},{"match_name":"DSS - USPSA 18-10-14","match_date":"2018-10-14","stage_classifiercode":"06-05","member_number":"A102072","first_name":"ANTHONY","last_name":"ZABONIK","classification":"U","division":"PCC","hit_factor":11.2281},{"match_name":"Richmond Hot Shots December 5-6-2020 USPSA Pistol","match_date":"2020-12-05","stage_classifiercode":"06-05","member_number":"TY24456","first_name":"RANDY","last_name":"MELTON","classification":"M","division":"PCC","hit_factor":11.2211},{"match_name":"Danville Rifle and Pistol Club USPSA IL17 June 16 2018","match_date":"2018-06-16","stage_classifiercode":"06-05","member_number":"A109116","first_name":"MATT","last_name":"WELDON","classification":"U","division":"PCC","hit_factor":11.215},{"match_name":"Palmetto Gun Club - Late September 2017 USPSA","match_date":"2017-09-30","stage_classifiercode":"06-05","member_number":"A69787","first_name":"SHANE","last_name":"COX","classification":"A","division":"PCC","hit_factor":11.2045},{"match_name":"MPSA 121518 USPA Classifer Match","match_date":"2018-12-15","stage_classifiercode":"06-05","member_number":"TY82466","first_name":"THOMAS","last_name":"ARTHUR","classification":"U","division":"PCC","hit_factor":11.1888},{"match_name":"USAH May Covid19 Pistol And PCC Match","match_date":"2021-05-15","stage_classifiercode":"06-05","member_number":"FY67177","first_name":"EDGARDO","last_name":"CARAANG","classification":"C","division":"PCC","hit_factor":11.1801},{"match_name":"AGC_20161002","match_date":"2016-10-02","stage_classifiercode":"06-05","member_number":"A86526","first_name":"DOUGLAS","last_name":"NORMAN","classification":"\"\"","division":"PCC","hit_factor":11.1801},{"match_name":"WNPL USPSA - DEC 2016","match_date":"2016-12-04","stage_classifiercode":"06-05","member_number":"\"\"","first_name":"JOSH","last_name":"PERRY","classification":"U","division":"PCC","hit_factor":11.1732},{"match_name":"DWB - Deadwood Boys USPSA 01 April 2018","match_date":"2018-04-01","stage_classifiercode":"06-05","member_number":"A2581","first_name":"ROSS","last_name":"DEANE","classification":"M","division":"PCC","hit_factor":11.1475},{"match_name":"LRC USPSA October 2020","match_date":"2020-10-03","stage_classifiercode":"06-05","member_number":"TY101829","first_name":"MARC","last_name":"VETOVITZ","classification":"B","division":"PCC","hit_factor":11.1475},{"match_name":"ARPC USPSA Match 7-26-20","match_date":"2020-07-26","stage_classifiercode":"06-05","member_number":"A115575","first_name":"DYLAN","last_name":"HARPER","classification":"A","division":"PCC","hit_factor":11.1437},{"match_name":"NISA March 2018","match_date":"2018-03-25","stage_classifiercode":"06-05","member_number":"L2222","first_name":"DAN","last_name":"VESTAL","classification":"U","division":"PCC","hit_factor":11.1421},{"match_name":"Temple Gun Club USPSA Holiday Hosefest 2020","match_date":"2020-12-06","stage_classifiercode":"06-05","member_number":"A101841","first_name":"MICHELLE","last_name":"MARSHALL","classification":"B","division":"PCC","hit_factor":11.1421},{"match_name":"Richmond Hot Shots December 5-6-2020 USPSA Pistol","match_date":"2020-12-05","stage_classifiercode":"06-05","member_number":"a88773","first_name":"EPHRAIM","last_name":"SAN FELIPE","classification":"A","division":"PCC","hit_factor":11.1111},{"match_name":"RDS September 2020 USPSA Match","match_date":"2020-09-05","stage_classifiercode":"06-05","member_number":"A-84493","first_name":"ARCHIE","last_name":"WALL","classification":"C","division":"PCC","hit_factor":11.1111},{"match_name":"TPS USPSA -  September 2018 USPSA","match_date":"2018-09-01","stage_classifiercode":"06-05","member_number":"A91069","first_name":"BRIAN","last_name":"HARLOW","classification":"U","division":"PCC","hit_factor":11.1111},{"match_name":"LPRGC - Lower Providence USPSA Match July 2021","match_date":"2021-07-03","stage_classifiercode":"06-05","member_number":"A27669","first_name":"BILL","last_name":"LEHMAN","classification":"B","division":"PCC","hit_factor":11.0787},{"match_name":"Atlanta Practical Shooters October 2017 PCC USPSA Match","match_date":"2017-09-30","stage_classifiercode":"06-05","member_number":"A97112","first_name":"BRETT","last_name":"TYLER","classification":"U","division":"PCC","hit_factor":11.0769},{"match_name":"HPS All-Classifier  Match","match_date":"2017-10-01","stage_classifiercode":"06-05","member_number":"A104329","first_name":"DAVID","last_name":"KIKUKAWA","classification":"U","division":"PCC","hit_factor":11.0749},{"match_name":"PSOCA USPSA June 27 2020 CAGC","match_date":"2020-06-27","stage_classifiercode":"06-05","member_number":"A106403","first_name":"ISIS","last_name":"QUINONES","classification":"U","division":"PCC","hit_factor":11.0465},{"match_name":"Rio Salado UPPL July 2020 ALL CLASSIFIER MATCH","match_date":"2020-07-12","stage_classifiercode":"06-05","member_number":"TY83533","first_name":"ANDY","last_name":"FEIGIN","classification":"U","division":"PCC","hit_factor":11.0465},{"match_name":"NRG Saturday July 8th - classifier","match_date":"2017-07-08","stage_classifiercode":"06-05","member_number":"TY52406","first_name":"GARY","last_name":"CHAN","classification":"A","division":"PCC","hit_factor":11.0465},{"match_name":"RCPS USPSA October 17","match_date":"2020-10-17","stage_classifiercode":"06-05","member_number":"A54880","first_name":"STEFAN","last_name":"WIGGINS","classification":"GM","division":"PCC","hit_factor":11.039},{"match_name":"2020-10 USPSA at Shadow Hawk Defense","match_date":"2020-10-10","stage_classifiercode":"06-05","member_number":"TY21063","first_name":"CHUCK","last_name":"BOLEN","classification":"A","division":"PCC","hit_factor":11.0193},{"match_name":"LCSC Classifier 042918","match_date":"2018-04-28","stage_classifiercode":"06-05","member_number":"A82878","first_name":"RICHARD","last_name":"WILLIAMS","classification":"B","division":"PCC","hit_factor":11.0145},{"match_name":"SUPS USPSA Special Classifier September 15/16 2018","match_date":"2018-09-15","stage_classifiercode":"06-05","member_number":"L4399","first_name":"JEFF","last_name":"BAILEY","classification":"M","division":"PCC","hit_factor":10.9966},{"match_name":"USPSA MO19 Lamar Mar 25 2028","match_date":"2018-03-25","stage_classifiercode":"06-05","member_number":"TY94217","first_name":"DUSTIN","last_name":"CHAMBERLAIN","classification":"B","division":"PCC","hit_factor":10.9827},{"match_name":"Deadwood Boys USPSA All Classifier Match","match_date":"2016-08-07","stage_classifiercode":"06-05","member_number":"A-2581","first_name":"ROSS","last_name":"DEANE","classification":"U","division":"PCC","hit_factor":10.9756},{"match_name":"WELD ECO09 20180617","match_date":"2018-06-17","stage_classifiercode":"06-05","member_number":"A61086","first_name":"CY","last_name":"SOTO","classification":"M","division":"PCC","hit_factor":10.9589},{"match_name":"Prescott 1st Saturday 12-02-17","match_date":"2017-12-02","stage_classifiercode":"06-05","member_number":"A98325","first_name":"BRONCO","last_name":"LANE","classification":"C","division":"PCC","hit_factor":10.9589},{"match_name":"NRG Saturday March 10th- Includes a Classifier Stage","match_date":"2018-03-10","stage_classifiercode":"06-05","member_number":"\"\"","first_name":"DOUGLAS","last_name":"CHAN","classification":"U","division":"PCC","hit_factor":10.9589},{"match_name":"FAS Sunday USPSA Special Classifier Match","match_date":"2020-07-19","stage_classifiercode":"06-05","member_number":"TY90397","first_name":"JOSEPH","last_name":"MARRAPODI","classification":"B","division":"PCC","hit_factor":10.9589},{"match_name":"Competitive Shooters of Lake Norman CORNELIUS Thursday Evening Indoor USPSA Pistol Match North Carolina","match_date":"2020-09-03","stage_classifiercode":"06-05","member_number":"A93583","first_name":"JEREMY","last_name":"WILLETT","classification":"C","division":"PCC","hit_factor":10.951},{"match_name":"Cortland Pistol Club June 24 USPSA","match_date":"2018-06-24","stage_classifiercode":"06-05","member_number":"A104792","first_name":"JAMES","last_name":"CIRIGLIANO 2","classification":"U","division":"PCC","hit_factor":10.951},{"match_name":"LRC USPSA October 2020","match_date":"2020-10-03","stage_classifiercode":"06-05","member_number":"TY101811","first_name":"BRENT","last_name":"VETOVITZ","classification":"B","division":"PCC","hit_factor":10.9422},{"match_name":"LBAS170429 Spray-N-Pray Classifier Match","match_date":"2017-04-29","stage_classifiercode":"06-05","member_number":"FY60591","first_name":"LAWRENCE","last_name":"MATTHEWS","classification":"U","division":"PCC","hit_factor":10.9422},{"match_name":"FBURG April 2021 Level I USPSA ","match_date":"2021-04-03","stage_classifiercode":"06-05","member_number":"A120109","first_name":"RICH","last_name":"FLECHTNER","classification":"A","division":"PCC","hit_factor":10.9422},{"match_name":"EHPSA USPSA 25 July 2021","match_date":"2021-07-25","stage_classifiercode":"06-05","member_number":"TY127550","first_name":"JAMES","last_name":"ANDERSON","classification":"A","division":"PCC","hit_factor":10.9325},{"match_name":"RSPP 3rd Saturday January 2017","match_date":"2017-01-21","stage_classifiercode":"06-05","member_number":"TY78923","first_name":"JEREMY","last_name":"MULLIGAN","classification":"U","division":"PCC","hit_factor":10.9195},{"match_name":"USPSA Strategic Edge SEGR July 17th 2021 Classifier Match","match_date":"2021-07-17","stage_classifiercode":"06-05","member_number":"ty81802","first_name":"DREW","last_name":"ESTELL","classification":"A","division":"PCC","hit_factor":10.9195},{"match_name":"Pioneer Action Shooters USPSA 5-23-21 Special Classifer","match_date":"2021-05-23","stage_classifiercode":"06-05","member_number":"TY94475","first_name":"GLENN","last_name":"STILWELL","classification":"B","division":"PCC","hit_factor":10.9195},{"match_name":"SSS USPSA October 2020 Match","match_date":"2020-10-18","stage_classifiercode":"06-05","member_number":"A58000","first_name":"JAMES PCC","last_name":"SMITH","classification":"A (A Class)","division":"PCC","hit_factor":10.9091},{"match_name":"Vaxd Retd  USPSA Master Blasters ","match_date":"2021-09-30","stage_classifiercode":"06-05","member_number":"L4888","first_name":"BRIAN","last_name":"CHAREST","classification":"C","division":"PCC","hit_factor":10.8992},{"match_name":"MPPL 9th Annual Monster Match","match_date":"2016-10-22","stage_classifiercode":"06-05","member_number":"TY55365","first_name":"KEALA","last_name":"NAKANELUA","classification":"U","division":"PCC","hit_factor":10.8974},{"match_name":"Belton Gun Club USPSA March Classifier MATCH 3-7-21","match_date":"2021-03-07","stage_classifiercode":"06-05","member_number":"A120622","first_name":"AARON","last_name":"BANKS","classification":"A","division":"PCC","hit_factor":10.8974},{"match_name":"INAS USPSA April 2018","match_date":"2018-04-14","stage_classifiercode":"06-05","member_number":"A84240","first_name":"MICHAEL","last_name":"KENNEDY","classification":"A","division":"PCC","hit_factor":10.8974},{"match_name":"CASA USPSA August 2018","match_date":"2018-08-05","stage_classifiercode":"06-05","member_number":"TY61943","first_name":"DON","last_name":"BAKER","classification":"B","division":"PCC","hit_factor":10.8883},{"match_name":"EHPSA USPSA 25 July 2021","match_date":"2021-07-25","stage_classifiercode":"06-05","member_number":"A82693","first_name":"LINDA","last_name":"DORISIO","classification":"M","division":"PCC","hit_factor":10.8761},{"match_name":"Shasta Shooters 2021 Aug","match_date":"2021-08-14","stage_classifiercode":"06-05","member_number":"A133174","first_name":"CORSON","last_name":"DAVIS","classification":"U","division":"PCC","hit_factor":10.8761},{"match_name":"SCPS ECO19 9/25/2020","match_date":"2020-09-25","stage_classifiercode":"06-05","member_number":"A96935","first_name":"ANNE","last_name":"KONNATH","classification":"A","division":"PCC","hit_factor":10.8696},{"match_name":"NRG Saturday July 8th - classifier","match_date":"2017-07-08","stage_classifiercode":"06-05","member_number":"TY93001","first_name":"HENDRIX","last_name":"DE LEON (MDX ARMS)","classification":"B","division":"PCC","hit_factor":10.8696},{"match_name":"Temple Gun Club USPSA Holiday Hosefest 2020","match_date":"2020-12-06","stage_classifiercode":"06-05","member_number":"A100533","first_name":"CHRISTOPHER","last_name":"THOMAS","classification":"U","division":"PCC","hit_factor":10.8626},{"match_name":"Deadwood Boys USPSA All Classifier Match","match_date":"2016-08-07","stage_classifiercode":"06-05","member_number":"TY22721","first_name":"WAYDE","last_name":"SHIMODA","classification":"U","division":"PCC","hit_factor":10.8571},{"match_name":"YMM  IPSC02 2018_02_11","match_date":"2018-02-11","stage_classifiercode":"06-05","member_number":"A81693","first_name":"JAMES","last_name":"DUGOS","classification":"U","division":"PCC","hit_factor":10.8571},{"match_name":"CSA Aug 2016","match_date":"2016-08-14","stage_classifiercode":"06-05","member_number":"TY85570","first_name":"DAVID","last_name":"MILLER","classification":"U","division":"PCC","hit_factor":10.8434},{"match_name":"LIPSA - November 15th 2020 - USPSA Match ","match_date":"2020-11-15","stage_classifiercode":"06-05","member_number":"A55119","first_name":"NICHOLAS","last_name":"ANDRONICA","classification":"B","division":"PCC","hit_factor":10.8434},{"match_name":"MCAS July 2017 USPSA Match","match_date":"2017-07-15","stage_classifiercode":"06-05","member_number":"A49648","first_name":"ROBERT","last_name":"SELL","classification":"A","division":"PCC","hit_factor":10.8434},{"match_name":"RPGi Thursday Night USPSA  February 4th 2021","match_date":"2021-02-03","stage_classifiercode":"06-05","member_number":"A126018","first_name":"GATLIN","last_name":"JOHNSON","classification":"U","division":"PCC","hit_factor":10.8434},{"match_name":"SAPSC Monthly USPSA Classifier Match at ARO 20170420","match_date":"2017-04-20","stage_classifiercode":"06-05","member_number":"TY71861","first_name":"ED","last_name":"RUSSMAN","classification":"U","division":"PCC","hit_factor":10.8401},{"match_name":"OFGC USPSA Match 8-15-21","match_date":"2021-08-15","stage_classifiercode":"06-05","member_number":"A20546","first_name":"JESS","last_name":"ANDERSON","classification":"M","division":"PCC","hit_factor":10.8262},{"match_name":"Shoot GTR USPSA Monthly Match November 2017","match_date":"2017-11-05","stage_classifiercode":"06-05","member_number":"A91218","first_name":"JOSHUA","last_name":"FLICKINGER","classification":"M","division":"PCC","hit_factor":10.8108},{"match_name":"Temple Gun Club USPSA Holiday Hosefest 2020","match_date":"2020-12-06","stage_classifiercode":"06-05","member_number":"Ty70687","first_name":"ROMMEL","last_name":"MERCADO","classification":"B","division":"PCC","hit_factor":10.8108},{"match_name":"RSPP 3rd Saturday January 2017","match_date":"2017-01-21","stage_classifiercode":"06-05","member_number":"A97240","first_name":"CHRIS","last_name":"TOUNGET","classification":"C","division":"PCC","hit_factor":10.7955},{"match_name":"ORPCI 2018.03.31 USPSA Special","match_date":"2018-03-31","stage_classifiercode":"06-05","member_number":"Ty105883","first_name":"JAMES","last_name":"ARNETT","classification":"U","division":"PCC","hit_factor":10.7817},{"match_name":"NPS February 2017 Match","match_date":"2017-02-11","stage_classifiercode":"06-05","member_number":"\"\"","first_name":"DALE","last_name":"JOWELL","classification":"U","division":"PCC","hit_factor":10.7817},{"match_name":"ACPSA August 2018","match_date":"2018-08-25","stage_classifiercode":"06-05","member_number":"A69229","first_name":"CHARLIE","last_name":"NELSON","classification":"C","division":"PCC","hit_factor":10.7784},{"match_name":"XMG USPSA   August 07 2021","match_date":"2021-08-07","stage_classifiercode":"06-05","member_number":"A135402","first_name":"MITCH","last_name":"CHAPMAN","classification":"U","division":"PCC","hit_factor":10.7784},{"match_name":"MSSA USPSA July 23 2017","match_date":"2017-07-23","stage_classifiercode":"06-05","member_number":"L2056","first_name":"RICK","last_name":"CRAIG","classification":"B","division":"PCC","hit_factor":10.7784},{"match_name":"MPSA 102018 USPSA","match_date":"2018-10-20","stage_classifiercode":"06-05","member_number":"L3885","first_name":"EDWARD","last_name":"CHANCERY","classification":"U","division":"PCC","hit_factor":10.7784},{"match_name":"NRG Saturday July 8th - classifier","match_date":"2017-07-08","stage_classifiercode":"06-05","member_number":"L2678","first_name":"CHRIS","last_name":"ENDERSBY","classification":"A","division":"PCC","hit_factor":10.7744},{"match_name":"NRG Saturday March 10th- Includes a Classifier Stage","match_date":"2018-03-10","stage_classifiercode":"06-05","member_number":"A96678","first_name":"ADRIAN PAUL","last_name":"GOMEZ","classification":"U","division":"PCC","hit_factor":10.7527},{"match_name":"Homestead USPSA October CLASSIFIER Match","match_date":"2018-10-06","stage_classifiercode":"06-05","member_number":"TY78067","first_name":"MICHAEL","last_name":"KREBSBACH","classification":"D","division":"PCC","hit_factor":10.7527},{"match_name":"NRG Saturday July 25th - Includes a Classifier Stage","match_date":"2020-07-25","stage_classifiercode":"06-05","member_number":"A61353","first_name":"ANDIE","last_name":"BUENCAMINO","classification":"U","division":"PCC","hit_factor":10.7463},{"match_name":"CSA Aug 2016","match_date":"2016-08-14","stage_classifiercode":"06-05","member_number":"A85584","first_name":"CHARLES","last_name":"YEAGER","classification":"B","division":"PCC","hit_factor":10.7239},{"match_name":"Danville Rifle and Pistol Club USPSA IL17 June 16 2018","match_date":"2018-06-16","stage_classifiercode":"06-05","member_number":"A79514","first_name":"KIP","last_name":"JACOBSEN","classification":"B","division":"PCC","hit_factor":10.7042},{"match_name":"Rio Salado UPPL July 2020 ALL CLASSIFIER MATCH","match_date":"2020-07-12","stage_classifiercode":"06-05","member_number":"A30968","first_name":"BRUCE","last_name":"BALCOM","classification":"U","division":"PCC","hit_factor":10.7042},{"match_name":"TPS USPSA at CMP May 19 2018","match_date":"2018-05-19","stage_classifiercode":"06-05","member_number":"A25385","first_name":"MARK","last_name":"STAMPER","classification":"C","division":"PCC","hit_factor":10.7042},{"match_name":"ORSA USPSA October 2017","match_date":"2017-10-21","stage_classifiercode":"06-05","member_number":"TY92869","first_name":"CSABA","last_name":"FOLDES","classification":"\"\"","division":"PCC","hit_factor":10.7042},{"match_name":"YMM  IPSC02 2018_02_11","match_date":"2018-02-11","stage_classifiercode":"06-05","member_number":"A48846","first_name":"ALLEN","last_name":"NELSON","classification":"C","division":"PCC","hit_factor":10.7042},{"match_name":"Triforce Practical Shooters at BigWoodsGoods 3-22-18","match_date":"2018-03-22","stage_classifiercode":"06-05","member_number":"Ty85797","first_name":"GARY","last_name":"WILLIAMS","classification":"B","division":"PCC","hit_factor":10.7042},{"match_name":"ARPC USPSA Match 3-25-18","match_date":"2018-03-25","stage_classifiercode":"06-05","member_number":"A82227","first_name":"SCOTT","last_name":"FRANCIS","classification":"Unclassified","division":"PCC","hit_factor":10.6952},{"match_name":"Homestead USPSA October CLASSIFIER Match","match_date":"2018-10-06","stage_classifiercode":"06-05","member_number":"A53891","first_name":"CRAIG","last_name":"MCELHANEY","classification":"U","division":"PCC","hit_factor":10.6952},{"match_name":"ARPC USPSA Match 3-25-18","match_date":"2018-03-25","stage_classifiercode":"06-05","member_number":"TY84079","first_name":"JAMES","last_name":"LILE","classification":"Unclassified","division":"PCC","hit_factor":10.6742},{"match_name":"Belton Gun Club USPSA March Classifier MATCH 3-7-21","match_date":"2021-03-07","stage_classifiercode":"06-05","member_number":"TY108779","first_name":"DARRELL","last_name":"BISHOP","classification":"U","division":"PCC","hit_factor":10.6742},{"match_name":"YMM  IPSC02 2018_02_11","match_date":"2018-02-11","stage_classifiercode":"06-05","member_number":"\"\"","first_name":"MIKE","last_name":"WHITE","classification":"\"\"","division":"PCC","hit_factor":10.6742},{"match_name":"Shoot GTR USPSA Monthly Match November 2017","match_date":"2017-11-05","stage_classifiercode":"06-05","member_number":"TY53290","first_name":"KENT","last_name":"CORI","classification":"M","division":"PCC","hit_factor":10.6583},{"match_name":"ORPCI USPSA Friday 2021.05.14","match_date":"2021-05-14","stage_classifiercode":"06-05","member_number":"TY67575","first_name":"JIM","last_name":"PETER","classification":"A","division":"PCC","hit_factor":10.6583},{"match_name":"DSS - USPSA - 21-08-08","match_date":"2021-08-08","stage_classifiercode":"06-05","member_number":"FY85869","first_name":"KHORY","last_name":"KATZ","classification":"A","division":"PCC","hit_factor":10.6509},{"match_name":"SAPSA December 2017","match_date":"2017-12-16","stage_classifiercode":"06-05","member_number":"L1240","first_name":"TONY","last_name":"HYATT","classification":"B","division":"PCC","hit_factor":10.6443},{"match_name":"Crooked Creek Pistol League - December 2017","match_date":"2017-12-03","stage_classifiercode":"06-05","member_number":"TY84357","first_name":"RAY","last_name":"DONCH","classification":"B","division":"PCC","hit_factor":10.6383},{"match_name":"SLPSA Dec USPSA","match_date":"2017-12-16","stage_classifiercode":"06-05","member_number":"A75031","first_name":"BLAKE","last_name":"KOROUS","classification":"U","division":"PCC","hit_factor":10.6383},{"match_name":"Deadwood Boys USPSA All Classifier Match","match_date":"2016-08-07","stage_classifiercode":"06-05","member_number":"\"\"","first_name":"CORINNE","last_name":"MOSHER","classification":"U","division":"PCC","hit_factor":10.6383},{"match_name":"ARPC USPSA Match 3-25-18","match_date":"2018-03-25","stage_classifiercode":"06-05","member_number":"TY56427","first_name":"STEVE","last_name":"ROESCH","classification":"Unclassified","division":"PCC","hit_factor":10.625},{"match_name":"RSPP 3rd Saturday January 2017","match_date":"2017-01-21","stage_classifiercode":"06-05","member_number":"A48182","first_name":"RICH","last_name":"HIGGINS","classification":"U","division":"PCC","hit_factor":10.625},{"match_name":"Atlanta Practical Shooters October 2017 PCC USPSA Match","match_date":"2017-09-30","stage_classifiercode":"06-05","member_number":"A102340","first_name":"TERRY","last_name":"SHARP","classification":"C","division":"PCC","hit_factor":10.625},{"match_name":"Pioneer Action Shooters USPSA 5-23-21 Special Classifer","match_date":"2021-05-23","stage_classifiercode":"06-05","member_number":"A106093","first_name":"DEREK","last_name":"DOWNING","classification":"B","division":"PCC","hit_factor":10.625},{"match_name":"Prescott 1st Saturday 12-02-17","match_date":"2017-12-02","stage_classifiercode":"06-05","member_number":"TY71570","first_name":"BEN","last_name":"KREUTZBERG","classification":"unclassified","division":"PCC","hit_factor":10.6195},{"match_name":"WSPS OCTOBER 2016 SPECIAL CLASSIFIER MATCH","match_date":"2016-10-29","stage_classifiercode":"06-05","member_number":"A82085","first_name":"DAVE","last_name":"HEALEY SR.","classification":"U","division":"PCC","hit_factor":10.6145},{"match_name":"LdF USPSA Match September 22 2018","match_date":"2018-09-22","stage_classifiercode":"06-05","member_number":"FY89472","first_name":"RYAN","last_name":"BESNEATTE","classification":"U","division":"PCC","hit_factor":10.6101},{"match_name":"RBGC USPSA 2021-8-15 Special Classifier Match","match_date":"2021-08-15","stage_classifiercode":"06-05","member_number":"TY80332","first_name":"REVO","last_name":"MANN","classification":"U","division":"PCC","hit_factor":10.6101},{"match_name":"AREA 59  SPRING ALL CLASSIFIER","match_date":"2018-03-31","stage_classifiercode":"06-05","member_number":"L4452","first_name":"JUSTIN","last_name":"CORONA","classification":"U","division":"PCC","hit_factor":10.6101},{"match_name":"NRG Saturday July 8th - classifier","match_date":"2017-07-08","stage_classifiercode":"06-05","member_number":"\"\"","first_name":"ERIC","last_name":"BENEDICTO","classification":"U","division":"PCC","hit_factor":10.6061},{"match_name":"ShooT GTR USPSA 1/1/17","match_date":"2017-01-01","stage_classifiercode":"06-05","member_number":"A21361","first_name":"JIMMY","last_name":"OWENS","classification":"A","division":"PCC","hit_factor":10.596},{"match_name":"Richmond Hot Shots December 5-6-2020 USPSA Pistol","match_date":"2020-12-05","stage_classifiercode":"06-05","member_number":"FY113836","first_name":"SKY","last_name":"YANG","classification":"U","division":"PCC","hit_factor":10.5882},{"match_name":"WGC WI USPSA Monthly Match 3-18-17","match_date":"2017-03-18","stage_classifiercode":"06-05","member_number":"TY72120","first_name":"DAVE","last_name":"DEYOE","classification":"U","division":"PCC","hit_factor":10.5882},{"match_name":"WSRC USPSA 8/19-20/2017","match_date":"2017-08-19","stage_classifiercode":"06-05","member_number":"TY89183","first_name":"STEVE","last_name":"CASH","classification":"B","division":"PCC","hit_factor":10.585},{"match_name":"DWB - Deadwood Boys USPSA August 6 2017","match_date":"2017-08-06","stage_classifiercode":"06-05","member_number":"A27973","first_name":"VINKY","last_name":"CASTILLO","classification":"D","division":"PCC","hit_factor":10.582},{"match_name":"SUPS USPSA Special Classifier September 15/16 2018","match_date":"2018-09-15","stage_classifiercode":"06-05","member_number":"A82974","first_name":"ERIC","last_name":"STIDHAM","classification":"B","division":"PCC","hit_factor":10.5556},{"match_name":"LCSC Classifier 042918","match_date":"2018-04-28","stage_classifiercode":"06-05","member_number":"A101811","first_name":"BRENT","last_name":"VETOVITZ","classification":"B","division":"PCC","hit_factor":10.5541},{"match_name":"Belton Gun Club USPSA March Classifier MATCH 3-7-21","match_date":"2021-03-07","stage_classifiercode":"06-05","member_number":"A103616","first_name":"RICHARD","last_name":"COLBY","classification":"U","division":"PCC","hit_factor":10.5541},{"match_name":"RMAP 3rd  Sunday September 2016","match_date":"2016-09-18","stage_classifiercode":"06-05","member_number":"L1849","first_name":"PAUL","last_name":"THOMPSON","classification":"U","division":"PCC","hit_factor":10.5263},{"match_name":"GoShoot Outdoors April 5th","match_date":"2020-04-05","stage_classifiercode":"06-05","member_number":"A93396","first_name":"MICHAEL","last_name":"COSTLEY","classification":"A","division":"PCC","hit_factor":10.5263},{"match_name":"LTD Pistol - All Classifier Match","match_date":"2021-08-01","stage_classifiercode":"06-05","member_number":"TY76832","first_name":"JAKE","last_name":"BROWN","classification":"U","division":"PCC","hit_factor":10.5263},{"match_name":"Atlanta Practical Shooters October 2017 PCC USPSA Match","match_date":"2017-09-30","stage_classifiercode":"06-05","member_number":"A94603","first_name":"RONALDO","last_name":"BORGES","classification":"C","division":"PCC","hit_factor":10.5263},{"match_name":"DSS - USPSA 20-09-26","match_date":"2020-09-26","stage_classifiercode":"06-05","member_number":"TY108877","first_name":"ADAM","last_name":"LITKE","classification":"C","division":"PCC","hit_factor":10.4972},{"match_name":"USPSA Strategic Edge SEGR July 17th 2021 Classifier Match","match_date":"2021-07-17","stage_classifiercode":"06-05","member_number":"A133963","first_name":"DON","last_name":"BARNES","classification":"U","division":"PCC","hit_factor":10.4938},{"match_name":"Deadwood Boys USPSA All Classifier Match","match_date":"2016-08-07","stage_classifiercode":"06-05","member_number":"A90612","first_name":"DANE","last_name":"LAZARUS","classification":"U","division":"PCC","hit_factor":10.4938},{"match_name":"Mesquite Mayhem Shooter Society USPSA 9-23-2017","match_date":"2017-09-23","stage_classifiercode":"06-05","member_number":"l4264","first_name":"BILL","last_name":"MUNGER","classification":"M","division":"PCC","hit_factor":10.4938},{"match_name":"NAAS 2018-03-18","match_date":"2018-03-18","stage_classifiercode":"06-05","member_number":"A107729","first_name":"BOBBY","last_name":"DONNELLY","classification":"U","division":"PCC","hit_factor":10.4938},{"match_name":"TPS USPSA at CMP May 19 2018","match_date":"2018-05-19","stage_classifiercode":"06-05","member_number":"A104245","first_name":"MATT","last_name":"SCOTT","classification":"B","division":"PCC","hit_factor":10.4651},{"match_name":"SWGC USPSA Pistol Match - August 2021","match_date":"2021-08-07","stage_classifiercode":"06-05","member_number":"A54296","first_name":"ROBERT","last_name":"BOWLES","classification":"B","division":"PCC","hit_factor":10.4575},{"match_name":"Triforce Practical Shooters at BigWoodsGoods 3-22-18","match_date":"2018-03-22","stage_classifiercode":"06-05","member_number":"A97112","first_name":"BRETT","last_name":"TYLER","classification":"A","division":"PCC","hit_factor":10.4575},{"match_name":"LCSA USPSA September 2017","match_date":"2017-09-02","stage_classifiercode":"06-05","member_number":"TY84357","first_name":"RAY","last_name":"DONCH","classification":"C","division":"PCC","hit_factor":10.4439},{"match_name":"Springfield Tactical Shooters 04/01/2021","match_date":"2021-04-01","stage_classifiercode":"06-05","member_number":"A55905","first_name":"BARRY","last_name":"OLIVER","classification":"B","division":"PCC","hit_factor":10.4439},{"match_name":"2020-10 USPSA at Shadow Hawk Defense","match_date":"2020-10-10","stage_classifiercode":"06-05","member_number":"A111754","first_name":"GEORGE","last_name":"TAMULA","classification":"B","division":"PCC","hit_factor":10.4396},{"match_name":"FAS Sunday USPSA Special Classifier Match","match_date":"2020-07-19","stage_classifiercode":"06-05","member_number":"A126158","first_name":"SAMUEL","last_name":"TERWILLIGER","classification":"B","division":"PCC","hit_factor":10.4348},{"match_name":"USPSA MO19 Lamar Mar 25 2028","match_date":"2018-03-25","stage_classifiercode":"06-05","member_number":"TY74180","first_name":"GIOVANNI","last_name":"BREDICE","classification":"U","division":"PCC","hit_factor":10.4235},{"match_name":"Maryland Practical Shooters Association June 2018","match_date":"2018-06-24","stage_classifiercode":"06-05","member_number":"FY86391","first_name":"MARK","last_name":"RODRIGUEZ","classification":"C","division":"PCC","hit_factor":10.411},{"match_name":"Clinton County USPSA Oct 22 2016","match_date":"2016-10-22","stage_classifiercode":"06-05","member_number":"A-98615","first_name":"JOHN","last_name":"HOLBROOK","classification":"\"\"","division":"PCC","hit_factor":10.4046},{"match_name":"DSSA 2020-06  USPSA Pistol","match_date":"2020-06-28","stage_classifiercode":"06-05","member_number":"TY88701","first_name":"ROBERT","last_name":"CAMPBELL","classification":"C","division":"PCC","hit_factor":10.3825},{"match_name":"USPSA MO19 Lamar September 2017 Special Classifier","match_date":"2017-09-24","stage_classifiercode":"06-05","member_number":"TY48907","first_name":"DAVID","last_name":"LETSCH","classification":"B","division":"PCC","hit_factor":10.3825},{"match_name":"YMM  IPSC02 2018_02_11","match_date":"2018-02-11","stage_classifiercode":"06-05","member_number":"\"\"","first_name":"JOSEPH","last_name":"BARRIOS","classification":"\"\"","division":"PCC","hit_factor":10.3825},{"match_name":"Rio Salado UPPL July 2020 ALL CLASSIFIER MATCH","match_date":"2020-07-12","stage_classifiercode":"06-05","member_number":"A99490","first_name":"BRYAN","last_name":"DE LA FUENTE","classification":"U","division":"PCC","hit_factor":10.3746},{"match_name":"WAC May 30th (5th Saturday) - USPSA 6 Stage Classifier Match","match_date":"2020-05-30","stage_classifiercode":"06-05","member_number":"L3681","first_name":"JOHN","last_name":"BEACH","classification":"A","division":"PCC","hit_factor":10.3746},{"match_name":"SCPS ECO19 9/25/2020","match_date":"2020-09-25","stage_classifiercode":"06-05","member_number":"TY73532","first_name":"STEPHEN","last_name":"CASH","classification":"A","division":"PCC","hit_factor":10.3659},{"match_name":"ORPCI USPSA Saturday 2018.08.18","match_date":"2018-08-18","stage_classifiercode":"06-05","member_number":"A88860","first_name":"JOHN","last_name":"SEEWER","classification":"B","division":"PCC","hit_factor":10.3627},{"match_name":"LCSA USPSA September 2017","match_date":"2017-09-02","stage_classifiercode":"06-05","member_number":"TY84357","first_name":"RAY","last_name":"DONCH","classification":"C","division":"PCC","hit_factor":10.3627},{"match_name":"Richmond Hot Shots December 5-6-2020 USPSA Pistol","match_date":"2020-12-05","stage_classifiercode":"06-05","member_number":"fy68887","first_name":"VENTZISLAV","last_name":"MITKOV","classification":"C","division":"PCC","hit_factor":10.3542},{"match_name":"Richmond Hot Shots December 5-6-2020 USPSA Pistol","match_date":"2020-12-05","stage_classifiercode":"06-05","member_number":"ty100949","first_name":"MICHAEL","last_name":"CHING","classification":"A","division":"PCC","hit_factor":10.3448},{"match_name":"NISA March 2018","match_date":"2018-03-25","stage_classifiercode":"06-05","member_number":"A85284","first_name":"ROMAN","last_name":"HRUSKA","classification":"B","division":"PCC","hit_factor":10.3359},{"match_name":"Palmetto Gun Club - Late September 2017 USPSA","match_date":"2017-09-30","stage_classifiercode":"06-05","member_number":"A92002","first_name":"DAVID","last_name":"REDD","classification":"B","division":"PCC","hit_factor":10.3359},{"match_name":"OKCGC USPSA July 2017","match_date":"2017-07-01","stage_classifiercode":"06-05","member_number":"A87830","first_name":"ANTHONY","last_name":"GATTO","classification":"U","division":"PCC","hit_factor":10.3226},{"match_name":"Prescott 1st Saturday USPSA 4-7-18","match_date":"2018-04-07","stage_classifiercode":"06-05","member_number":"TY79879","first_name":"FRANK","last_name":"BARBARO","classification":"Unclassified","division":"PCC","hit_factor":10.3152},{"match_name":"Laser Ninja Dragon League USPSA April 2018","match_date":"2018-04-08","stage_classifiercode":"06-05","member_number":"TY101554","first_name":"ALBERT","last_name":"MONTANEZ","classification":"U","division":"PCC","hit_factor":10.3152},{"match_name":"LIPSA - November 5th 2017 - USPSA Special Classifier Match","match_date":"2017-11-05","stage_classifiercode":"06-05","member_number":"TY99982","first_name":"ERIC","last_name":"DYRSTAD","classification":"U","division":"PCC","hit_factor":10.3152},{"match_name":"Nampa USPSA November 7th 2020","match_date":"2020-11-07","stage_classifiercode":"06-05","member_number":"TY124034","first_name":"LYNN","last_name":"SORENSON","classification":"B","division":"PCC","hit_factor":10.3093},{"match_name":"INAS USPSA April 2018","match_date":"2018-04-14","stage_classifiercode":"06-05","member_number":"A84525","first_name":"KEVIN","last_name":"VAUGHN","classification":"B","division":"PCC","hit_factor":10.3093},{"match_name":"LCSC Classifier 042918","match_date":"2018-04-28","stage_classifiercode":"06-05","member_number":"A101829","first_name":"MARC","last_name":"VETOVITZ","classification":"C","division":"PCC","hit_factor":10.303},{"match_name":"Homestead USPSA October CLASSIFIER Match","match_date":"2018-10-06","stage_classifiercode":"06-05","member_number":"A54153","first_name":"NATHANIEL","last_name":"HORENSTEIN","classification":"B","division":"PCC","hit_factor":10.2981},{"match_name":"Deadwood Boys USPSA All Classifier Match","match_date":"2016-08-07","stage_classifiercode":"06-05","member_number":"TY-84175","first_name":"SHANNON","last_name":"YAUCHTZEE","classification":"U","division":"PCC","hit_factor":10.2902},{"match_name":"NTPS-SE February 2017","match_date":"2017-02-18","stage_classifiercode":"06-05","member_number":"A83760","first_name":"WILLIAM KING","last_name":"DRUMMOND","classification":"U","division":"PCC","hit_factor":10.2857},{"match_name":"SRAPS Amarillo Action November USPSA","match_date":"2016-11-26","stage_classifiercode":"06-05","member_number":"L3708","first_name":"JIM","last_name":"BODKIN","classification":"G","division":"PCC","hit_factor":10.2857},{"match_name":"YRPA  September USPSA 2017","match_date":"2017-09-24","stage_classifiercode":"06-05","member_number":"A104946","first_name":"DUSTY","last_name":"FERGUSON","classification":"U","division":"PCC","hit_factor":10.2857},{"match_name":"SAPSC Monthly USPSA Classifier Match at ARO 20170420","match_date":"2017-04-20","stage_classifiercode":"06-05","member_number":"A37609","first_name":"TOM","last_name":"MULLIGAN","classification":"C","division":"PCC","hit_factor":10.2828},{"match_name":"EWPSA 2017-04","match_date":"2017-04-16","stage_classifiercode":"06-05","member_number":"L3238","first_name":"MATT","last_name":"NEWBURN","classification":"B","division":"PCC","hit_factor":10.2828},{"match_name":"Atlanta Practical Shooters October 2017 USPSA","match_date":"2017-10-01","stage_classifiercode":"06-05","member_number":"A95338","first_name":"JODY","last_name":"MARSHALL","classification":"B","division":"PCC","hit_factor":10.2828},{"match_name":"BSC USPSA Oct 17 2020 Classifier","match_date":"2020-10-17","stage_classifiercode":"06-05","member_number":"TY85900","first_name":"BRAD","last_name":"NORTON","classification":"B","division":"PCC","hit_factor":10.2719},{"match_name":"OFGC USPSA Match 5-20-18","match_date":"2018-05-20","stage_classifiercode":"06-05","member_number":"A82942","first_name":"DUANE","last_name":"CHRISTENSEN","classification":"C","division":"PCC","hit_factor":10.2703},{"match_name":"Crooked Creek Pistol League - December 2017","match_date":"2017-12-03","stage_classifiercode":"06-05","member_number":"A99895","first_name":"NORMAN","last_name":"DRAGON","classification":"U","division":"PCC","hit_factor":10.2564},{"match_name":"MSSA USPSA July 23 2017","match_date":"2017-07-23","stage_classifiercode":"06-05","member_number":"\"\"","first_name":"WILL","last_name":"GREWE","classification":"U","division":"PCC","hit_factor":10.2564},{"match_name":"CRGC USPSA Match 10-18-20","match_date":"2020-10-18","stage_classifiercode":"06-05","member_number":"TY103356","first_name":"BRYAN","last_name":"CAMPILIO","classification":"","division":"PCC","hit_factor":10.2564},{"match_name":"Springfield Tactical Shooters 04/01/2021","match_date":"2021-04-01","stage_classifiercode":"06-05","member_number":"L3651","first_name":"RYAN","last_name":"BRADLEY","classification":"A","division":"PCC","hit_factor":10.2564},{"match_name":"DRRC USPSA May2018","match_date":"2018-05-05","stage_classifiercode":"06-05","member_number":"TY44559","first_name":"CRAIG","last_name":"SALMAN","classification":"B","division":"PCC","hit_factor":10.2564},{"match_name":"Nampa USPSA May 29th 2021","match_date":"2021-05-29","stage_classifiercode":"06-05","member_number":"TY87846","first_name":"JOHN","last_name":"JENSEN","classification":"B","division":"PCC","hit_factor":10.241},{"match_name":"TPS USPSA at CMP May 19 2018","match_date":"2018-05-19","stage_classifiercode":"06-05","member_number":"TY110009","first_name":"MARTIN","last_name":"TREPTAU","classification":"U","division":"PCC","hit_factor":10.2302},{"match_name":"LCHG NR08 USPSA July 2018","match_date":"2018-07-14","stage_classifiercode":"06-05","member_number":"A29621","first_name":"KEVIN","last_name":"COTTRILL","classification":"U","division":"PCC","hit_factor":10.2302},{"match_name":"ORPCI USPSA Saturday 2018.08.18","match_date":"2018-08-18","stage_classifiercode":"06-05","member_number":"\"\"","first_name":"MICKI","last_name":"PETKOVIC","classification":"\"\"","division":"PCC","hit_factor":10.2273},{"match_name":"FLPSA USPSA Pistol Match 10.15.2016","match_date":"2016-10-15","stage_classifiercode":"06-05","member_number":"TY82562","first_name":"GUNNAR","last_name":"AN","classification":"U","division":"PCC","hit_factor":10.2273},{"match_name":"CRGC USPSA Match 10-18-20","match_date":"2020-10-18","stage_classifiercode":"06-05","member_number":"TY76519","first_name":"BRIAN","last_name":"CAIRA","classification":"","division":"PCC","hit_factor":10.2151},{"match_name":"TPS USPSA AT CMP Sunday SEPT 30 2018","match_date":"2018-09-29","stage_classifiercode":"06-05","member_number":"A104245","first_name":"MATT","last_name":"SCOTT","classification":"B","division":"PCC","hit_factor":10.2041},{"match_name":"OFGC USPSA Match 5-20-18","match_date":"2018-05-20","stage_classifiercode":"06-05","member_number":"A96267","first_name":"MYLEE","last_name":"CHAMBERLAIN","classification":"C","division":"PCC","hit_factor":10.1911},{"match_name":"Alpha Mike August Classifier 2021   ","match_date":"2021-08-15","stage_classifiercode":"06-05","member_number":"A127928","first_name":"BRETT","last_name":"MURDOCK","classification":"C","division":"PCC","hit_factor":10.1877},{"match_name":"Palmetto Gun Club - Late September 2017 USPSA","match_date":"2017-09-30","stage_classifiercode":"06-05","member_number":"\"\"","first_name":"DEREK","last_name":"HICKS","classification":"U","division":"PCC","hit_factor":10.1877},{"match_name":"INAS USPSA Aug 2017","match_date":"2017-08-12","stage_classifiercode":"06-05","member_number":"A87913","first_name":"JONATHAN","last_name":"MOORE","classification":"B","division":"PCC","hit_factor":10.1818},{"match_name":"PTPC October 4th USPSA","match_date":"2020-10-04","stage_classifiercode":"06-05","member_number":"FY57913","first_name":"DIRK","last_name":"SCHLUETER","classification":"B","division":"PCC","hit_factor":10.1781},{"match_name":"Richmond Hot Shots December 5-6-2020 USPSA Pistol","match_date":"2020-12-05","stage_classifiercode":"06-05","member_number":"TY69128","first_name":"TONY","last_name":"YEH","classification":"B","division":"PCC","hit_factor":10.1695},{"match_name":"USPSA Strategic Edge SEGR July 17th 2021 Classifier Match","match_date":"2021-07-17","stage_classifiercode":"06-05","member_number":"L2644","first_name":"ALLAN","last_name":"ZITTA","classification":"M","division":"PCC","hit_factor":10.1695},{"match_name":"Shoot GTR Mini Match 07/10/2018","match_date":"2018-07-10","stage_classifiercode":"06-05","member_number":"TY53290","first_name":"KENT","last_name":"CORI","classification":"M","division":"PCC","hit_factor":10.1695},{"match_name":"ORSA USPSA October 2017","match_date":"2017-10-21","stage_classifiercode":"06-05","member_number":"a105401","first_name":"JHEREMY","last_name":"ZETANS","classification":"U","division":"PCC","hit_factor":10.1523},{"match_name":"Crooked Creek Pistol League - December 2017","match_date":"2017-12-03","stage_classifiercode":"06-05","member_number":"A101281","first_name":"DIENEZ","last_name":"WOLLET","classification":"A","division":"PCC","hit_factor":10.1449},{"match_name":"OK15 USPSA at USSA","match_date":"2016-12-11","stage_classifiercode":"06-05","member_number":"Ty60095","first_name":"MATT","last_name":"HOPKINS","classification":"U","division":"PCC","hit_factor":10.1408},{"match_name":"ARPC USPSA Match 7-26-20","match_date":"2020-07-26","stage_classifiercode":"06-05","member_number":"A67988","first_name":"BILL","last_name":"LEMEN","classification":"C","division":"PCC","hit_factor":10.1408},{"match_name":"WGC WI USPSA Monthly Match 3-18-17","match_date":"2017-03-18","stage_classifiercode":"06-05","member_number":"A19231","first_name":"DARRYL","last_name":"DOUGHERTY","classification":"U","division":"PCC","hit_factor":10.1408},{"match_name":"WAC May 30th (5th Saturday) - USPSA 6 Stage Classifier Match","match_date":"2020-05-30","stage_classifiercode":"06-05","member_number":"A121478","first_name":"DAVE","last_name":"HALL","classification":"D","division":"PCC","hit_factor":10.1408},{"match_name":"LdF USPSA Match September 22 2018","match_date":"2018-09-22","stage_classifiercode":"06-05","member_number":"TY74058","first_name":"BRENT","last_name":"FOSTER","classification":"U","division":"PCC","hit_factor":10.1333},{"match_name":"SLPSA Dec USPSA","match_date":"2017-12-16","stage_classifiercode":"06-05","member_number":"TY43912","first_name":"RANDY","last_name":"STEVENS","classification":"U","division":"PCC","hit_factor":10.1266},{"match_name":"Homestead USPSA October CLASSIFIER Match","match_date":"2018-10-06","stage_classifiercode":"06-05","member_number":"TY83243","first_name":"GIL","last_name":"ELNATAN","classification":"C","division":"PCC","hit_factor":10.1266},{"match_name":"CRGC USPSA Match 10-18-20","match_date":"2020-10-18","stage_classifiercode":"06-05","member_number":"TY78926","first_name":"BOB","last_name":"DZAMKO","classification":"","division":"PCC","hit_factor":10.1064},{"match_name":"SLPSA Jan USPSA match 2","match_date":"2020-01-18","stage_classifiercode":"06-05","member_number":"TY72404","first_name":"DAVE","last_name":"MOORE","classification":"B","division":"PCC","hit_factor":10.1064},{"match_name":"SAPS Match 2/6/2021","match_date":"2021-02-06","stage_classifiercode":"06-05","member_number":"L4455","first_name":"KEVIN","last_name":"LAMB","classification":"G","division":"PCC","hit_factor":10.1064},{"match_name":"NW01 March Madness 17","match_date":"2017-03-12","stage_classifiercode":"06-05","member_number":"TY37515","first_name":"TOD","last_name":"SHERMAN","classification":"B","division":"PCC","hit_factor":10.089},{"match_name":"USPSA MO21 2Alpha SBRC April 2018 Special Classifier","match_date":"2018-04-28","stage_classifiercode":"06-05","member_number":"A110966","first_name":"TROY","last_name":"POTTER","classification":"U","division":"PCC","hit_factor":10.084},{"match_name":"LCSC Classifier 042918","match_date":"2018-04-28","stage_classifiercode":"06-05","member_number":"TY107457","first_name":"KANGWEI","last_name":"MAO","classification":"U","division":"PCC","hit_factor":10.0796},{"match_name":"Hopkinton USPSA July 2018","match_date":"2018-07-07","stage_classifiercode":"06-05","member_number":"FY91061","first_name":"JOSEPH","last_name":"FLANAGAN","classification":"U","division":"PCC","hit_factor":10.0796},{"match_name":"NRG Saturday July 25th - Includes a Classifier Stage","match_date":"2020-07-25","stage_classifiercode":"06-05","member_number":"L4372","first_name":"ZACH","last_name":"ZHAO","classification":"B","division":"PCC","hit_factor":10.0756},{"match_name":"November 2021 USPSA","match_date":"2021-11-07","stage_classifiercode":"06-05","member_number":"A98137","first_name":"PHIL","last_name":"UNDERWOOD","classification":"A","division":"PCC","hit_factor":10.0629},{"match_name":"HRRB 12-01-2018","match_date":"2018-12-01","stage_classifiercode":"06-05","member_number":"L4313","first_name":"ART","last_name":"RIVERA","classification":"U","division":"PCC","hit_factor":10.0559},{"match_name":"Lafayette Practical Shooters - THURS - Aug 19. (40 rds)","match_date":"2021-08-19","stage_classifiercode":"06-05","member_number":"A132762","first_name":"MATTHEW","last_name":"WHITING","classification":"U","division":"PCC","hit_factor":10.0529},{"match_name":"TPS USPSA AT CMP Sunday SEPT 30 2018","match_date":"2018-09-29","stage_classifiercode":"06-05","member_number":"TY85797","first_name":"GARY","last_name":"WILLIAMS","classification":"B","division":"PCC","hit_factor":10.0295},{"match_name":"Hopkinton USPSA July 2018","match_date":"2018-07-07","stage_classifiercode":"06-05","member_number":"FY91061","first_name":"JOSEPH","last_name":"FLANAGAN","classification":"U","division":"PCC","hit_factor":10.0279},{"match_name":"OFGC USPSA Match 8-15-21","match_date":"2021-08-15","stage_classifiercode":"06-05","member_number":"A24950","first_name":"RICK","last_name":"PEELER","classification":"B","division":"PCC","hit_factor":10.0279},{"match_name":"CTASA 3rd Sunday USPSA - March 2018","match_date":"2018-03-18","stage_classifiercode":"06-05","member_number":"FY16877","first_name":"ROGER","last_name":"LISENBEY","classification":"U","division":"PCC","hit_factor":10.0264},{"match_name":"November 2021 USPSA","match_date":"2021-11-07","stage_classifiercode":"06-05","member_number":"A137947","first_name":"BRANDON","last_name":"NGUYEN","classification":"none","division":"PCC","hit_factor":10.0264},{"match_name":"Rankin Field Sunday USPSA","match_date":"2018-02-18","stage_classifiercode":"06-05","member_number":"A107294","first_name":"JAYSON","last_name":"BRYAN","classification":"U","division":"PCC","hit_factor":10.0264},{"match_name":"CFRPC USPSA 2017 JULY","match_date":"2017-07-16","stage_classifiercode":"06-05","member_number":"A101878","first_name":"MICHAEL","last_name":"WARE","classification":"U","division":"PCC","hit_factor":10.0251},{"match_name":"PCSI USPSA September 4th 2021","match_date":"2021-09-04","stage_classifiercode":"06-05","member_number":"A118978","first_name":"DAN","last_name":"GLENN","classification":"A","division":"PCC","hit_factor":10},{"match_name":"June   USPSA  2018","match_date":"2018-06-09","stage_classifiercode":"06-05","member_number":"TY29614","first_name":"JEFF","last_name":"ALLOWAY","classification":"B","division":"PCC","hit_factor":9.9751},{"match_name":"NTPS-SE February 2017","match_date":"2017-02-18","stage_classifiercode":"06-05","member_number":"TY100995","first_name":"REX","last_name":"WHITE","classification":"U","division":"PCC","hit_factor":9.9723},{"match_name":"DSS - USPSA - 21-08-08","match_date":"2021-08-08","stage_classifiercode":"06-05","member_number":"TY75237","first_name":"MIKE","last_name":"HARRISON","classification":"B","division":"PCC","hit_factor":9.9723},{"match_name":"TPS USPSA at CMP May 19 2018","match_date":"2018-05-19","stage_classifiercode":"06-05","member_number":"A14583","first_name":"STEPHEN","last_name":"HORN","classification":"C","division":"PCC","hit_factor":9.9707},{"match_name":"Atlanta Practical Shooters October 2017 PCC USPSA Match","match_date":"2017-09-30","stage_classifiercode":"06-05","member_number":"L4076","first_name":"CHRISTOPHER","last_name":"ANDERSON","classification":"C","division":"PCC","hit_factor":9.9707},{"match_name":"Palmetto Gun Club - Late September 2017 USPSA","match_date":"2017-09-30","stage_classifiercode":"06-05","member_number":"A55997","first_name":"LEE","last_name":"KING","classification":"A","division":"PCC","hit_factor":9.9644},{"match_name":"CTASA 3rd Sunday USPSA - March 2018","match_date":"2018-03-18","stage_classifiercode":"06-05","member_number":"A89688","first_name":"CHUCK","last_name":"PENNY","classification":"D","division":"PCC","hit_factor":9.9502},{"match_name":"INAS USPSA April 2018","match_date":"2018-04-14","stage_classifiercode":"06-05","member_number":"TY21925","first_name":"WILLIAM","last_name":"PARKS III","classification":"B","division":"PCC","hit_factor":9.9502},{"match_name":"PTPC December 3rd USPSA Match","match_date":"2017-12-03","stage_classifiercode":"06-05","member_number":"A77507","first_name":"LARRY","last_name":"HEMMENS","classification":"U","division":"PCC","hit_factor":9.9502},{"match_name":"Danville Rifle and Pistol Club USPSA IL17 June 16 2018","match_date":"2018-06-16","stage_classifiercode":"06-05","member_number":"A79514","first_name":"KIP","last_name":"JACOBSEN","classification":"B","division":"PCC","hit_factor":9.9476},{"match_name":"WNPL USPSA - DEC 2016","match_date":"2016-12-04","stage_classifiercode":"06-05","member_number":"L2391","first_name":"RUSS","last_name":"SPILKER","classification":"B","division":"PCC","hit_factor":9.9476},{"match_name":"LIPSA - November 5th 2017 - USPSA Special Classifier Match","match_date":"2017-11-05","stage_classifiercode":"06-05","member_number":"L4011","first_name":"TOMMY","last_name":"GEORGIOPOULOS","classification":"C","division":"PCC","hit_factor":9.9256},{"match_name":"LBAS170429 Spray-N-Pray Classifier Match","match_date":"2017-04-29","stage_classifiercode":"06-05","member_number":"A54861","first_name":"DENNIS","last_name":"WALKER","classification":"U","division":"PCC","hit_factor":9.9217},{"match_name":"CSA Aug 2016","match_date":"2016-08-14","stage_classifiercode":"06-05","member_number":"TY8880","first_name":"GENE","last_name":"RICHMOND","classification":"U","division":"PCC","hit_factor":9.9125},{"match_name":"TPS USPSA at CMP May 19 2018","match_date":"2018-05-19","stage_classifiercode":"06-05","member_number":"TY41492","first_name":"MARK","last_name":"HEARN","classification":"C","division":"PCC","hit_factor":9.9125},{"match_name":"Springfield Tactical Shooters 04/01/2021","match_date":"2021-04-01","stage_classifiercode":"06-05","member_number":"\"\"","first_name":"AARON","last_name":"RENTSCHLER","classification":"\"\"","division":"PCC","hit_factor":9.9071},{"match_name":"WSPS JULY 2016 USPSA","match_date":"2016-07-16","stage_classifiercode":"06-05","member_number":"A97964","first_name":"DEREK","last_name":"SMITH","classification":"U","division":"PCC","hit_factor":9.901},{"match_name":"Shoot GTR Mini Match 07/10/2018","match_date":"2018-07-10","stage_classifiercode":"06-05","member_number":"ty88497","first_name":"RONDRE","last_name":"BALUYOT","classification":"U","division":"PCC","hit_factor":9.901},{"match_name":"LdF USPSA Match September 22 2018","match_date":"2018-09-22","stage_classifiercode":"06-05","member_number":"TY90077","first_name":"DOUG2","last_name":"TELLEF","classification":"U","division":"PCC","hit_factor":9.8901},{"match_name":"LIPSA - November 15th 2020 - USPSA Match ","match_date":"2020-11-15","stage_classifiercode":"06-05","member_number":"A123907","first_name":"JOHN","last_name":"CALARDO","classification":"C","division":"PCC","hit_factor":9.8901},{"match_name":"BPSA January 2017 USPSA","match_date":"2017-01-22","stage_classifiercode":"06-05","member_number":"TY60857","first_name":"BRYANT","last_name":"WILLETT","classification":"U","division":"PCC","hit_factor":9.8837},{"match_name":"Strongpoint July USPSA (IPSC Nationals Prep)","match_date":"2018-07-07","stage_classifiercode":"06-05","member_number":"\"\"","first_name":"TREVOR","last_name":"BRUNELL","classification":"\"\"","division":"PCC","hit_factor":9.8765},{"match_name":"Detroit Sportsmens Congress - May 21 2017","match_date":"2017-05-21","stage_classifiercode":"06-05","member_number":"A22668","first_name":"BILL","last_name":"CHUNN","classification":"U","division":"PCC","hit_factor":9.8765},{"match_name":"LCSA USPSA June 2017","match_date":"2017-06-10","stage_classifiercode":"06-05","member_number":"L3026","first_name":"DAVE","last_name":"DORISIO","classification":"A","division":"PCC","hit_factor":9.8765},{"match_name":"Pioneer Action Shooters USPSA 5-23-21 Special Classifer","match_date":"2021-05-23","stage_classifiercode":"06-05","member_number":"A104656","first_name":"CRAIG","last_name":"TRAHAN","classification":"A","division":"PCC","hit_factor":9.8765},{"match_name":"YMM  IPSC02 2018_02_11","match_date":"2018-02-11","stage_classifiercode":"06-05","member_number":"A66244","first_name":"JAMES","last_name":"SUMMARELL","classification":"C","division":"PCC","hit_factor":9.863},{"match_name":"MSSA USPSA July 23 2017","match_date":"2017-07-23","stage_classifiercode":"06-05","member_number":"L843","first_name":"LYNN","last_name":"JONES","classification":"A","division":"PCC","hit_factor":9.8551},{"match_name":"LCSC Classifier 042918","match_date":"2018-04-28","stage_classifiercode":"06-05","member_number":"TY92465","first_name":"JOSE","last_name":"RAPADAS","classification":"U","division":"PCC","hit_factor":9.8462},{"match_name":"Maryland Practical Shooters Association June 2018","match_date":"2018-06-24","stage_classifiercode":"06-05","member_number":"TY36345","first_name":"JOHN MIG","last_name":"MIGLIACCIO","classification":"A","division":"PCC","hit_factor":9.828},{"match_name":"DWB - Deadwood Boys USPSA 01 April 2018","match_date":"2018-04-01","stage_classifiercode":"06-05","member_number":"TY93614","first_name":"ANDY","last_name":"BONETTO","classification":"C","division":"PCC","hit_factor":9.8266},{"match_name":"Laser Ninja Dragon League USPSA April 2018","match_date":"2018-04-08","stage_classifiercode":"06-05","member_number":"TY","first_name":"BILLY","last_name":"DODSON","classification":"U","division":"PCC","hit_factor":9.8191},{"match_name":"AREA 59  SPRING ALL CLASSIFIER","match_date":"2018-03-31","stage_classifiercode":"06-05","member_number":"A91320","first_name":"RICKY","last_name":"WILEY","classification":"U","division":"PCC","hit_factor":9.816},{"match_name":"SWGC USPSA Pistol Match - August 2021","match_date":"2021-08-07","stage_classifiercode":"06-05","member_number":"A133034","first_name":"PAULA","last_name":"CEBALLOS","classification":"U","division":"PCC","hit_factor":9.8093},{"match_name":"Mesquite Mayhem Monthly USPSA Match","match_date":"2021-01-10","stage_classifiercode":"06-05","member_number":"A84390","first_name":"JUSTINE","last_name":"WILLIAMS","classification":"G","division":"PCC","hit_factor":9.8093},{"match_name":"FLPSA MN14 July 2nd USPSA","match_date":"2020-07-02","stage_classifiercode":"06-05","member_number":"A68346","first_name":"SHAWN","last_name":"MCKINNEY","classification":"U","division":"PCC","hit_factor":9.7983},{"match_name":"OFGC USPSA Match 8-15-21","match_date":"2021-08-15","stage_classifiercode":"06-05","member_number":"A74027","first_name":"JUNIOR","last_name":"SIMS","classification":"B","division":"PCC","hit_factor":9.7983},{"match_name":"LCSC Classifier 042918","match_date":"2018-04-28","stage_classifiercode":"06-05","member_number":"TY66432","first_name":"DANNY","last_name":"REA","classification":"U","division":"PCC","hit_factor":9.7938},{"match_name":"CFL07 Williston Practical Shooters","match_date":"2018-11-03","stage_classifiercode":"06-05","member_number":"TY46072","first_name":"BOB","last_name":"GOSSELIN","classification":"C","division":"PCC","hit_factor":9.7826},{"match_name":"EAGC April 2016 USPSA Pistol Match","match_date":"2016-04-17","stage_classifiercode":"06-05","member_number":"A4163","first_name":"JACK","last_name":"TAFT","classification":"U","division":"PCC","hit_factor":9.7765},{"match_name":"NRG Saturday March 10th- Includes a Classifier Stage","match_date":"2018-03-10","stage_classifiercode":"06-05","member_number":"TY100298","first_name":"CK","last_name":"HWANG","classification":"C","division":"PCC","hit_factor":9.7701},{"match_name":"LIPSA - November 15th 2020 - USPSA Match ","match_date":"2020-11-15","stage_classifiercode":"06-05","member_number":"FY68191","first_name":"DAVE","last_name":"WISSEMANN","classification":"B","division":"PCC","hit_factor":9.7686},{"match_name":"Klamath USPSA 09-02-18 JSPS OR09","match_date":"2018-09-02","stage_classifiercode":"06-05","member_number":"A88720","first_name":"SCOTT","last_name":"LARSON","classification":"C","division":"PCC","hit_factor":9.7561},{"match_name":"ORPCI 2018.03.31 USPSA Special","match_date":"2018-03-31","stage_classifiercode":"06-05","member_number":"FY80376","first_name":"DAN","last_name":"RAINBOLT","classification":"D","division":"PCC","hit_factor":9.7561},{"match_name":"Pioneer Action Shooters USPSA 5-23-21 Special Classifer","match_date":"2021-05-23","stage_classifiercode":"06-05","member_number":"TY44021","first_name":"DON","last_name":"SELESKY","classification":"B","division":"PCC","hit_factor":9.7561},{"match_name":"LPRGC - Lower Providence USPSA Match July 2021","match_date":"2021-07-03","stage_classifiercode":"06-05","member_number":"TY85259","first_name":"JOJO","last_name":"SANTOS","classification":"B","division":"PCC","hit_factor":9.7561},{"match_name":"DWB - Deadwood Boys USPSA August 6 2017","match_date":"2017-08-06","stage_classifiercode":"06-05","member_number":"l3158","first_name":"LITO","last_name":"ISIDRO","classification":"A","division":"PCC","hit_factor":9.7561},{"match_name":"June USPSA Match at C and C Indoor Range","match_date":"2020-06-16","stage_classifiercode":"06-05","member_number":"A122165","first_name":"GREG","last_name":"LEACH","classification":"U","division":"PCC","hit_factor":9.7436},{"match_name":"ORPCI USPSA Saturday 2018.08.18","match_date":"2018-08-18","stage_classifiercode":"06-05","member_number":"\"\"","first_name":"NATHAN","last_name":"HAMBLEM","classification":"\"\"","division":"PCC","hit_factor":9.7421},{"match_name":"SLPSA Jan USPSA match 2","match_date":"2020-01-18","stage_classifiercode":"06-05","member_number":"TY74311","first_name":"TONIRAE","last_name":"GARDNER","classification":"C","division":"PCC","hit_factor":9.7421},{"match_name":"Atlanta Practical Shooters October 2017 PCC USPSA Match","match_date":"2017-09-30","stage_classifiercode":"06-05","member_number":"TY52571","first_name":"PETER","last_name":"OLIVER","classification":"A","division":"PCC","hit_factor":9.7421},{"match_name":"Rankin Field Sunday USPSA","match_date":"2018-02-18","stage_classifiercode":"06-05","member_number":"A107575","first_name":"DUDLEY","last_name":"BAKER","classification":"U","division":"PCC","hit_factor":9.7143},{"match_name":"NRG Saturday April 10th Includes a Classifier Stage","match_date":"2021-04-10","stage_classifiercode":"06-05","member_number":"A46996","first_name":"REY","last_name":"ATIENZA","classification":"U","division":"PCC","hit_factor":9.7035},{"match_name":"Chillicothe Sportsmens Club September USPSA","match_date":"2021-09-25","stage_classifiercode":"06-05","member_number":"TY58309","first_name":"ERIC","last_name":"HENSON","classification":"B","division":"PCC","hit_factor":9.6852},{"match_name":"RSPP 3rd Saturday January 2017","match_date":"2017-01-21","stage_classifiercode":"06-05","member_number":"FY41475","first_name":"DAVE","last_name":"SABIA","classification":"U","division":"PCC","hit_factor":9.6774},{"match_name":"TGC USPSA November 2017","match_date":"2017-11-18","stage_classifiercode":"06-05","member_number":"ty68041","first_name":"RICHARD","last_name":"BOYES","classification":"U","division":"PCC","hit_factor":9.6677},{"match_name":"DRRC USPSA May2018","match_date":"2018-05-05","stage_classifiercode":"06-05","member_number":"FY80028","first_name":"STAN","last_name":"PROUTY","classification":"B","division":"PCC","hit_factor":9.6677},{"match_name":"Atlanta Practical Shooters October 2017 PCC USPSA Match","match_date":"2017-09-30","stage_classifiercode":"06-05","member_number":"TY87398","first_name":"PHIL","last_name":"DESOUZA","classification":"C","division":"PCC","hit_factor":9.6618},{"match_name":"SUPS USPSA Special Classifier September 15/16 2018","match_date":"2018-09-15","stage_classifiercode":"06-05","member_number":"A90230","first_name":"MIKE","last_name":"WEBB","classification":"U","division":"PCC","hit_factor":9.6618},{"match_name":"PTPC May 6th  USPSA Match","match_date":"2018-05-06","stage_classifiercode":"06-05","member_number":"FY57913","first_name":"DIRK","last_name":"SCHLUETER","classification":"B","division":"PCC","hit_factor":9.6447},{"match_name":"CASA USPSA August 2018","match_date":"2018-08-05","stage_classifiercode":"06-05","member_number":"\"\"","first_name":"TOM","last_name":"FLEMING","classification":"U","division":"PCC","hit_factor":9.6386},{"match_name":"Maryland Practical Shooters Association June 2018","match_date":"2018-06-24","stage_classifiercode":"06-05","member_number":"A97062","first_name":"PAUL","last_name":"MCKEAN","classification":"C","division":"PCC","hit_factor":9.6257},{"match_name":"YMM  IPSC02 2018_02_11","match_date":"2018-02-11","stage_classifiercode":"06-05","member_number":"A54861","first_name":"DENNIS","last_name":"WALKER","classification":"\"\"","division":"PCC","hit_factor":9.6045},{"match_name":"Low Country USPSA October All Classifier Match","match_date":"2020-10-31","stage_classifiercode":"06-05","member_number":"A88984","first_name":"NEREO","last_name":"PARRENO","classification":"A","division":"PCC","hit_factor":9.6045},{"match_name":"SAPSA December 2017","match_date":"2017-12-16","stage_classifiercode":"06-05","member_number":"A25833","first_name":"RICK","last_name":"GRASSIE","classification":"C","division":"PCC","hit_factor":9.6},{"match_name":"ORPCI 2018.03.31 USPSA Special","match_date":"2018-03-31","stage_classifiercode":"06-05","member_number":"A53250","first_name":"DON","last_name":"SLUSHER","classification":"C","division":"PCC","hit_factor":9.6},{"match_name":"Deadwood Boys USPSA All Classifier Match","match_date":"2016-08-07","stage_classifiercode":"06-05","member_number":"A97059","first_name":"MICAH","last_name":"ULRICK","classification":"U","division":"PCC","hit_factor":9.6},{"match_name":"TPS USPSA AT CMP Sunday SEPT 30 2018","match_date":"2018-09-29","stage_classifiercode":"06-05","member_number":"A94603","first_name":"RONALDO","last_name":"BORGES","classification":"B","division":"PCC","hit_factor":9.596},{"match_name":"GoShoot Outdoors April 5th","match_date":"2020-04-05","stage_classifiercode":"06-05","member_number":"l2664","first_name":"JIM","last_name":"HILSENBECK","classification":"M","division":"PCC","hit_factor":9.5847},{"match_name":"Crooked Creek Pistol League - December 2017","match_date":"2017-12-03","stage_classifiercode":"06-05","member_number":"A68311","first_name":"TILL","last_name":"ZIMMERMANN","classification":"U","division":"PCC","hit_factor":9.5775},{"match_name":"Atlanta Practical Shooters October 2017 PCC USPSA Match","match_date":"2017-09-30","stage_classifiercode":"06-05","member_number":"L1028","first_name":"TATA","last_name":"EUSEBIO","classification":"A","division":"PCC","hit_factor":9.5775},{"match_name":"LBAS170429 Spray-N-Pray Classifier Match","match_date":"2017-04-29","stage_classifiercode":"06-05","member_number":"L2757","first_name":"RICK","last_name":"PUNU","classification":"U","division":"PCC","hit_factor":9.5775},{"match_name":"Springfield Tactical Shooters 04/01/2021","match_date":"2021-04-01","stage_classifiercode":"06-05","member_number":"TY107856","first_name":"JESSE","last_name":"BOEHLER","classification":"\"\"","division":"PCC","hit_factor":9.5745},{"match_name":"Steel City USPSA September 5 2020","match_date":"2020-09-04","stage_classifiercode":"06-05","member_number":"A78088","first_name":"MIKE","last_name":"GOEBEL","classification":"A","division":"PCC","hit_factor":9.5718},{"match_name":"OFGC USPSA Match 5-20-18","match_date":"2018-05-20","stage_classifiercode":"06-05","member_number":"FY45785","first_name":"BRUCE H","last_name":"BETHELL","classification":"C","division":"PCC","hit_factor":9.5718},{"match_name":"Hopkinton November 2016","match_date":"2016-11-04","stage_classifiercode":"06-05","member_number":"\"\"","first_name":"SERGEY","last_name":"MONVELDT","classification":"\"\"","division":"PCC","hit_factor":9.5694},{"match_name":"MISS USPSA 5-16-18","match_date":"2018-05-16","stage_classifiercode":"06-05","member_number":"A73683","first_name":"BRYAN","last_name":"TECSON","classification":"A","division":"PCC","hit_factor":9.5541},{"match_name":"FLPSA MN14 July 2nd USPSA","match_date":"2020-07-02","stage_classifiercode":"06-05","member_number":"TY95926","first_name":"BUG","last_name":"SCHRADER","classification":"C","division":"PCC","hit_factor":9.5491},{"match_name":"Danville Rifle and Pistol Club USPSA IL17 June 16 2018","match_date":"2018-06-16","stage_classifiercode":"06-05","member_number":"A109116","first_name":"MATT","last_name":"WELDON","classification":"U","division":"PCC","hit_factor":9.5491},{"match_name":"WNPL USPSA - DEC 2016","match_date":"2016-12-04","stage_classifiercode":"06-05","member_number":"PENDING","first_name":"SERGIO","last_name":"VILLAREAL","classification":"U","division":"PCC","hit_factor":9.5491},{"match_name":"SAPSA December 2017","match_date":"2017-12-16","stage_classifiercode":"06-05","member_number":"TY73281","first_name":"JACK","last_name":"DARTIGALONGUE","classification":"C","division":"PCC","hit_factor":9.5491},{"match_name":"Palmetto Gun Club - Late September 2017 USPSA","match_date":"2017-09-30","stage_classifiercode":"06-05","member_number":"A64374","first_name":"MICHAEL","last_name":"CUTLER","classification":"C","division":"PCC","hit_factor":9.5465},{"match_name":"WGC WI USPSA Monthly Match 3-18-17","match_date":"2017-03-18","stage_classifiercode":"06-05","member_number":"TY96480","first_name":"KEN","last_name":"SCHMIDTCHEN","classification":"U","division":"PCC","hit_factor":9.5238},{"match_name":"ORPCI USPSA Friday 2021.05.14","match_date":"2021-05-14","stage_classifiercode":"06-05","member_number":"A115437","first_name":"STEVEN","last_name":"SCHMITT","classification":"","division":"PCC","hit_factor":9.5238},{"match_name":"CRGC USPSA Match 10-18-20","match_date":"2020-10-18","stage_classifiercode":"06-05","member_number":"TY111428","first_name":"VLAD","last_name":"ZELTSER","classification":"","division":"PCC","hit_factor":9.5},{"match_name":"CFL07 Williston Practical Shooters","match_date":"2018-11-03","stage_classifiercode":"06-05","member_number":"a-54413","first_name":"LAMAR","last_name":"WADE","classification":"C","division":"PCC","hit_factor":9.4987},{"match_name":"RSPP 3rd Saturday January 2017","match_date":"2017-01-21","stage_classifiercode":"06-05","member_number":"TY46992","first_name":"RON","last_name":"ASCHENBACH","classification":"U","division":"PCC","hit_factor":9.4987},{"match_name":"Laser Ninja Dragon League USPSA April 2018","match_date":"2018-04-08","stage_classifiercode":"06-05","member_number":"A104295","first_name":"DARRELL","last_name":"SMITH","classification":"B","division":"PCC","hit_factor":9.4987},{"match_name":"ETRPC-USPSA 10-30-21","match_date":"2021-10-30","stage_classifiercode":"06-05","member_number":"L4553","first_name":"MIKE","last_name":"PIPES","classification":"B","division":"PCC","hit_factor":9.4763},{"match_name":"Prescott 1st Saturday 12-02-17","match_date":"2017-12-02","stage_classifiercode":"06-05","member_number":"A91531","first_name":"DIANA","last_name":"BRAFFORD","classification":"B","division":"PCC","hit_factor":9.4737},{"match_name":"TPS USPSA -  January 2018","match_date":"2018-01-07","stage_classifiercode":"06-05","member_number":"a95513","first_name":"AJ","last_name":"ZOGHBI","classification":"D","division":"PCC","hit_factor":9.4737},{"match_name":"Atlanta Practical Shooters October 2017 PCC USPSA Match","match_date":"2017-09-30","stage_classifiercode":"06-05","member_number":"TY85797","first_name":"GARY","last_name":"WILLIAMS","classification":"C","division":"PCC","hit_factor":9.4737},{"match_name":"Pioneer Action Shooters USPSA 5-23-21 Special Classifer","match_date":"2021-05-23","stage_classifiercode":"06-05","member_number":"TY78926","first_name":"BOB","last_name":"DZAMKO","classification":"B","division":"PCC","hit_factor":9.4737},{"match_name":"LRC USPSA October 2020","match_date":"2020-10-03","stage_classifiercode":"06-05","member_number":"A110613","first_name":"CONRAD","last_name":"GUIANG","classification":"U","division":"PCC","hit_factor":9.4563},{"match_name":"June   USPSA  2018","match_date":"2018-06-09","stage_classifiercode":"06-05","member_number":"A84876","first_name":"BENJIE","last_name":"VILLARRUZ","classification":"U","division":"PCC","hit_factor":9.4563},{"match_name":"OFGC USPSA Match 8-15-21","match_date":"2021-08-15","stage_classifiercode":"06-05","member_number":"A29631","first_name":"RED","last_name":"VEST","classification":"U","division":"PCC","hit_factor":9.4527},{"match_name":"LIPSA - November 15th 2020 - USPSA Match ","match_date":"2020-11-15","stage_classifiercode":"06-05","member_number":"A113634","first_name":"IVAN","last_name":"RAMIREZ","classification":"U","division":"PCC","hit_factor":9.4527},{"match_name":"2020-10 USPSA at Shadow Hawk Defense","match_date":"2020-10-10","stage_classifiercode":"06-05","member_number":"NA","first_name":"CHRISTOPHER","last_name":"RITCHEY","classification":"U","division":"PCC","hit_factor":9.4527},{"match_name":"ORPCI USPSA Saturday 2018.08.18","match_date":"2018-08-18","stage_classifiercode":"06-05","member_number":"A53250","first_name":"DON","last_name":"SLUSHER","classification":"C","division":"PCC","hit_factor":9.4488},{"match_name":"ARPC USPSA Match 7-25-21","match_date":"2021-07-25","stage_classifiercode":"06-05","member_number":"A67988","first_name":"BILL","last_name":"LEMEN","classification":"B","division":"PCC","hit_factor":9.4444},{"match_name":"Pioneer Action Shooters USPSA 5-23-21 Special Classifer","match_date":"2021-05-23","stage_classifiercode":"06-05","member_number":"TY656","first_name":"DAVID A","last_name":"TRAHAN","classification":"B","division":"PCC","hit_factor":9.4444},{"match_name":"WSPS OCTOBER 2016 SPECIAL CLASSIFIER MATCH","match_date":"2016-10-29","stage_classifiercode":"06-05","member_number":"TY99410","first_name":"LOU","last_name":"LEVY","classification":"U","division":"PCC","hit_factor":9.434},{"match_name":"Atlanta Practical Shooters October 2017 PCC USPSA Match","match_date":"2017-09-30","stage_classifiercode":"06-05","member_number":"TY98974","first_name":"JOHN","last_name":"KUROSKI","classification":"U","division":"PCC","hit_factor":9.4293},{"match_name":"Parma May 2 USPSA","match_date":"2020-05-02","stage_classifiercode":"06-05","member_number":"TY46963","first_name":"ALAN","last_name":"BRADEN","classification":"U","division":"PCC","hit_factor":9.4241},{"match_name":"ARPC USPSA Match 3-25-18","match_date":"2018-03-25","stage_classifiercode":"06-05","member_number":"A92234","first_name":"BOB","last_name":"KOKOTOVICH","classification":"C","division":"PCC","hit_factor":9.4183},{"match_name":"Hopkinton USPSA July 2018","match_date":"2018-07-07","stage_classifiercode":"06-05","member_number":"TY62563","first_name":"ANATOLY","last_name":"PODPALY","classification":"C","division":"PCC","hit_factor":9.4118},{"match_name":"WSPS OCTOBER 2016 SPECIAL CLASSIFIER MATCH","match_date":"2016-10-29","stage_classifiercode":"06-05","member_number":"A98777","first_name":"BRANDON","last_name":"HIGBEE","classification":"U","division":"PCC","hit_factor":9.3995},{"match_name":"CCPS June 2018 USPSA","match_date":"2018-06-17","stage_classifiercode":"06-05","member_number":"A110905","first_name":"JW","last_name":"PATTERSON","classification":"U","division":"PCC","hit_factor":9.3995},{"match_name":"November 2021 USPSA","match_date":"2021-11-07","stage_classifiercode":"06-05","member_number":"TY2958","first_name":"PETE","last_name":"CARPENTIER JR","classification":"B","division":"PCC","hit_factor":9.3995},{"match_name":"CASA USPSA August 2018","match_date":"2018-08-05","stage_classifiercode":"06-05","member_number":"TY101764","first_name":"KEITH","last_name":"DE NOBLE","classification":"C","division":"PCC","hit_factor":9.3827},{"match_name":"NPS February 2017 Match","match_date":"2017-02-11","stage_classifiercode":"06-05","member_number":"A100996","first_name":"DAVID","last_name":"THOMAS","classification":"U","division":"PCC","hit_factor":9.3827},{"match_name":"ORPCI 2018.03.31 USPSA Special","match_date":"2018-03-31","stage_classifiercode":"06-05","member_number":"FY43270","first_name":"MIKE","last_name":"DAME","classification":"\"\"","division":"PCC","hit_factor":9.375},{"match_name":"NAAS 2018-03-18","match_date":"2018-03-18","stage_classifiercode":"06-05","member_number":"A107497","first_name":"HARLEY","last_name":"WIEGERT","classification":"U","division":"PCC","hit_factor":9.3664},{"match_name":"Rankin Field April (ALL CLASSIFIER) Saturday USPSA","match_date":"2021-04-03","stage_classifiercode":"06-05","member_number":"A121973","first_name":"RICHARD","last_name":"CASTILLO","classification":"B","division":"PCC","hit_factor":9.3596},{"match_name":"OKCGC USPSA July 2017","match_date":"2017-07-01","stage_classifiercode":"06-05","member_number":"\"\"","first_name":"KEVIN","last_name":"KEEF","classification":"U","division":"PCC","hit_factor":9.3596},{"match_name":"NW01 March Madness 17","match_date":"2017-03-12","stage_classifiercode":"06-05","member_number":"TY53715","first_name":"DAN","last_name":"ORME","classification":"U","division":"PCC","hit_factor":9.3506},{"match_name":"RPGi Thursday Night USPSA  February 4th 2021","match_date":"2021-02-03","stage_classifiercode":"06-05","member_number":"A132653","first_name":"JACK","last_name":"OLIVER","classification":"U","division":"PCC","hit_factor":9.3366},{"match_name":"Smoke & Hope Shooters USPSA Oct 28 2017","match_date":"2017-10-28","stage_classifiercode":"06-05","member_number":"A97062","first_name":"PAUL","last_name":"MCKEAN","classification":"U","division":"PCC","hit_factor":9.3264},{"match_name":"Richmond Hot Shots December 5-6-2020 USPSA Pistol","match_date":"2020-12-05","stage_classifiercode":"06-05","member_number":"L3301","first_name":"KEITH","last_name":"MIYASAKI","classification":"B","division":"PCC","hit_factor":9.3264},{"match_name":"BRSP Tuesday Night USPSA Match - April 10","match_date":"2018-04-11","stage_classifiercode":"06-05","member_number":"\"\"","first_name":"ANTHONY","last_name":"PETERS","classification":"\"\"","division":"PCC","hit_factor":9.3264},{"match_name":"WSRC USPSA 8/19-20/2017","match_date":"2017-08-19","stage_classifiercode":"06-05","member_number":"A98672","first_name":"KRIS","last_name":"DICKSON","classification":"U","division":"PCC","hit_factor":9.324},{"match_name":"SWGC USPSA Pistol Match - August 2021","match_date":"2021-08-07","stage_classifiercode":"06-05","member_number":"L4842","first_name":"JOSH","last_name":"WEEKS","classification":"M","division":"PCC","hit_factor":9.3168},{"match_name":"Homestead USPSA October CLASSIFIER Match","match_date":"2018-10-06","stage_classifiercode":"06-05","member_number":"A113793","first_name":"FRANK","last_name":"VASALLO","classification":"U","division":"PCC","hit_factor":9.3151},{"match_name":"Atlanta Practical Shooters October 2017 PCC USPSA Match","match_date":"2017-09-30","stage_classifiercode":"06-05","member_number":"FY72288","first_name":"SEAN","last_name":"BOWEN","classification":"U","division":"PCC","hit_factor":9.3137},{"match_name":"HPS All-Classifier  Match","match_date":"2017-10-01","stage_classifiercode":"06-05","member_number":"TY87106","first_name":"JAMES","last_name":"HIJII","classification":"U","division":"PCC","hit_factor":9.3023},{"match_name":"INAS USPSA Aug 2017","match_date":"2017-08-12","stage_classifiercode":"06-05","member_number":"TY21925","first_name":"WILLIAM","last_name":"PARKS III","classification":"B","division":"PCC","hit_factor":9.291},{"match_name":"LCSA USPSA September 2017","match_date":"2017-09-02","stage_classifiercode":"06-05","member_number":"A82693","first_name":"LINDA","last_name":"DORISIO","classification":"C","division":"PCC","hit_factor":9.291},{"match_name":"GoShoot Outdoors September 20th","match_date":"2020-09-20","stage_classifiercode":"06-05","member_number":"a25745","first_name":"DAN","last_name":"SANDERS","classification":"B","division":"PCC","hit_factor":9.291},{"match_name":"NRG Saturday March 10th- Includes a Classifier Stage","match_date":"2018-03-10","stage_classifiercode":"06-05","member_number":"\"\"","first_name":"JOEL","last_name":"MANAHAN","classification":"C","division":"PCC","hit_factor":9.2879},{"match_name":"JPPS Club Match 5-1-2021","match_date":"2021-05-01","stage_classifiercode":"06-05","member_number":"A16438","first_name":"BOB","last_name":"ROBERTSON","classification":"C","division":"PCC","hit_factor":9.2807},{"match_name":"OFGC USPSA Match 8-15-21","match_date":"2021-08-15","stage_classifiercode":"06-05","member_number":"FY34677","first_name":"DALE","last_name":"PANKRATZ","classification":"C","division":"PCC","hit_factor":9.2683},{"match_name":"NAAS 2018-03-18","match_date":"2018-03-18","stage_classifiercode":"06-05","member_number":"A25385","first_name":"MARK","last_name":"STAMPER","classification":"U","division":"PCC","hit_factor":9.2683},{"match_name":"USPSA MO21 2Alpha SBRC April 2018 Special Classifier","match_date":"2018-04-28","stage_classifiercode":"06-05","member_number":"A41069","first_name":"JOHN","last_name":"LUNTSFORD","classification":"U","division":"PCC","hit_factor":9.2593},{"match_name":"ORSA USPSA October 2017","match_date":"2017-10-21","stage_classifiercode":"06-05","member_number":"A99451","first_name":"STEVE","last_name":"REDDING","classification":"D","division":"PCC","hit_factor":9.2593},{"match_name":"NRG Saturday April 10th Includes a Classifier Stage","match_date":"2021-04-10","stage_classifiercode":"06-05","member_number":"L3251","first_name":"BUDDY","last_name":"BAUTISTA","classification":"B","division":"PCC","hit_factor":9.2593},{"match_name":"ENPS Late September 2018 USPSA Match","match_date":"2018-09-30","stage_classifiercode":"06-05","member_number":"FY5456","first_name":"MARK","last_name":"RICHARDS","classification":"C","division":"PCC","hit_factor":9.2545},{"match_name":"Prescott 1st Saturday USPSA 4-7-18","match_date":"2018-04-07","stage_classifiercode":"06-05","member_number":"A72103","first_name":"GORDON","last_name":"BASKERVILLE","classification":"Unclassified","division":"PCC","hit_factor":9.2486},{"match_name":"NTPS-SE February 2017","match_date":"2017-02-18","stage_classifiercode":"06-05","member_number":"TY96578","first_name":"ROBERT","last_name":"LEMKE","classification":"U","division":"PCC","hit_factor":9.2486},{"match_name":"ORPCI USPSA Saturday 2018.08.18","match_date":"2018-08-18","stage_classifiercode":"06-05","member_number":"\"\"","first_name":"KEVIN","last_name":"RUSSEL","classification":"\"\"","division":"PCC","hit_factor":9.2391},{"match_name":"Richmond Boro Gun Club December 2018 USPSA Match","match_date":"2018-12-15","stage_classifiercode":"06-05","member_number":"TY91965","first_name":"JOE","last_name":"STEINHAUER","classification":"D","division":"PCC","hit_factor":9.2379},{"match_name":"SCPS ECO19 9/25/2020","match_date":"2020-09-25","stage_classifiercode":"06-05","member_number":"TY119549","first_name":"MARK","last_name":"SWEATT","classification":"C","division":"PCC","hit_factor":9.2379},{"match_name":"OREGON ARPC CC05 USPSA JAN 13 2018","match_date":"2018-01-13","stage_classifiercode":"06-05","member_number":"L3134","first_name":"CARL","last_name":"SCHMIDT","classification":"U","division":"PCC","hit_factor":9.2233},{"match_name":"LCSA USPSA September 2017","match_date":"2017-09-02","stage_classifiercode":"06-05","member_number":"Ty95936","first_name":"DAN","last_name":"HUBERT","classification":"U","division":"PCC","hit_factor":9.2141},{"match_name":"MPSA 102018 USPSA","match_date":"2018-10-20","stage_classifiercode":"06-05","member_number":"L4339","first_name":"COLIN","last_name":"HARTERY","classification":"U","division":"PCC","hit_factor":9.2141},{"match_name":"Homestead USPSA October CLASSIFIER Match","match_date":"2018-10-06","stage_classifiercode":"06-05","member_number":"A97434","first_name":"GONZALO","last_name":"GOMEZ","classification":"U","division":"PCC","hit_factor":9.2141},{"match_name":"YRPA  September USPSA 2017","match_date":"2017-09-24","stage_classifiercode":"06-05","member_number":"TY80395","first_name":"KAJSA","last_name":"WEAVER","classification":"C","division":"PCC","hit_factor":9.2105},{"match_name":"SCCC CLASSIFIER MATCH 7_23_17","match_date":"2017-07-23","stage_classifiercode":"06-05","member_number":"TY96280","first_name":"TY_2","last_name":"O'BRADOVICH","classification":"U","division":"PCC","hit_factor":9.2072},{"match_name":"MASTER BLASTERS & SSFGA USPSA - October","match_date":"2021-10-10","stage_classifiercode":"06-05","member_number":"TY84571","first_name":"WARREN","last_name":"PROUTY","classification":"C","division":"PCC","hit_factor":9.2072},{"match_name":"NRG Saturday April 10th Includes a Classifier Stage","match_date":"2021-04-10","stage_classifiercode":"06-05","member_number":"TY125350","first_name":"EDWIN","last_name":"DE LEON","classification":"C","division":"PCC","hit_factor":9.201},{"match_name":"LCSA USPSA September 2017","match_date":"2017-09-02","stage_classifiercode":"06-05","member_number":"a93486","first_name":"JAMES","last_name":"RAMP","classification":"U","division":"PCC","hit_factor":9.1892},{"match_name":"WGC June 2018 USPSA 2","match_date":"2018-06-24","stage_classifiercode":"06-05","member_number":"TY70973","first_name":"KATHY","last_name":"DYCUS","classification":"C","division":"PCC","hit_factor":9.1837},{"match_name":"Shasta Shooters July 2017","match_date":"2017-07-08","stage_classifiercode":"06-05","member_number":"TY87118","first_name":"STAN","last_name":"CLEWETT","classification":"U","division":"PCC","hit_factor":9.1787},{"match_name":"WSRC USPSA 8/19-20/2017","match_date":"2017-08-19","stage_classifiercode":"06-05","member_number":"A99326","first_name":"TIM","last_name":"ARMSTRONG","classification":"C","division":"PCC","hit_factor":9.1743},{"match_name":"WGC August 2020 USPSA Classifier","match_date":"2020-08-09","stage_classifiercode":"06-05","member_number":"TY70973","first_name":"KATHY","last_name":"DYCUS","classification":"C","division":"PCC","hit_factor":9.1644},{"match_name":"TPS USPSA at CMP May 19 2018","match_date":"2018-05-19","stage_classifiercode":"06-05","member_number":"Ty74047","first_name":"LEE","last_name":"KERR","classification":"C","division":"PCC","hit_factor":9.1603},{"match_name":"TPS USPSA at CMP May 19 2018","match_date":"2018-05-19","stage_classifiercode":"06-05","member_number":"\"\"","first_name":"GRANT","last_name":"SCOTT","classification":"U","division":"PCC","hit_factor":9.1566},{"match_name":"Rio Salado UPPL July 2020 ALL CLASSIFIER MATCH","match_date":"2020-07-12","stage_classifiercode":"06-05","member_number":"A120240","first_name":"JOHN","last_name":"COCHRAN","classification":"U","division":"PCC","hit_factor":9.1429},{"match_name":"ORPCI USPSA  Friday  2020.03.20","match_date":"2020-03-20","stage_classifiercode":"06-05","member_number":"A37756","first_name":"BILL","last_name":"WALKER","classification":"","division":"PCC","hit_factor":9.1371},{"match_name":"LIPSA - November 5th 2017 - USPSA Special Classifier Match","match_date":"2017-11-05","stage_classifiercode":"06-05","member_number":"A49357","first_name":"TONY","last_name":"BYKOV","classification":"C","division":"PCC","hit_factor":9.1346},{"match_name":"USAH November Covid19 Pistol & PCC Match ","match_date":"2021-11-07","stage_classifiercode":"06-05","member_number":"FY87328","first_name":"JIMRIZ","last_name":"ANCHETA","classification":"U","division":"PCC","hit_factor":9.1185},{"match_name":"FAS Sunday USPSA Special Classifier Match","match_date":"2020-07-19","stage_classifiercode":"06-05","member_number":"A124509","first_name":"CALEB","last_name":"GOODMAN","classification":"C","division":"PCC","hit_factor":9.1153},{"match_name":"LdF USPSA Match September 22 2018","match_date":"2018-09-22","stage_classifiercode":"06-05","member_number":"A78429","first_name":"MIKE","last_name":"RUSH","classification":"A","division":"PCC","hit_factor":9.1139},{"match_name":"USPSA","match_date":"2018-02-04","stage_classifiercode":"06-05","member_number":"A98137","first_name":"PHIL","last_name":"UNDERWOOD","classification":"B","division":"PCC","hit_factor":9.1127},{"match_name":"Rio Salado UPPL July 2020 ALL CLASSIFIER MATCH","match_date":"2020-07-12","stage_classifiercode":"06-05","member_number":"A88917","first_name":"MARC","last_name":"CONWAY","classification":"U","division":"PCC","hit_factor":9.1127},{"match_name":"LRC USPSA October 2020","match_date":"2020-10-03","stage_classifiercode":"06-05","member_number":"A97087","first_name":"JOSHUA","last_name":"HEUER","classification":"C","division":"PCC","hit_factor":9.1116},{"match_name":"MPPL 9th Annual Monster Match","match_date":"2016-10-22","stage_classifiercode":"06-05","member_number":"TY84441","first_name":"SEAN","last_name":"HATADA","classification":"U","division":"PCC","hit_factor":9.0909},{"match_name":"Chillicothe Sportsmens Club July USPSA","match_date":"2020-07-25","stage_classifiercode":"06-05","member_number":"A54761","first_name":"JOHN","last_name":"SAMANIEGO","classification":"U","division":"PCC","hit_factor":9.0909},{"match_name":"OFGC USPSA Match 8-15-21","match_date":"2021-08-15","stage_classifiercode":"06-05","member_number":"TY114011","first_name":"DAVID","last_name":"BOONE","classification":"C","division":"PCC","hit_factor":9.0692},{"match_name":"ARPC USPSA Match 3-25-18","match_date":"2018-03-25","stage_classifiercode":"06-05","member_number":"A52438","first_name":"DAVE","last_name":"HARTER","classification":"Unclassified","division":"PCC","hit_factor":9.0615},{"match_name":"USPSA MO21 2Alpha SBRC April 2018 Special Classifier","match_date":"2018-04-28","stage_classifiercode":"06-05","member_number":"A56843","first_name":"JIM","last_name":"EDWARDS","classification":"U","division":"PCC","hit_factor":9.0498},{"match_name":"MPSA 050617 Classifier Match","match_date":"2017-05-06","stage_classifiercode":"06-05","member_number":"A44284","first_name":"MIKE","last_name":"SETTLE","classification":"U","division":"PCC","hit_factor":9.0476},{"match_name":"MPSA 050617 Classifier Match","match_date":"2017-05-06","stage_classifiercode":"06-05","member_number":"TY36282","first_name":"BILL","last_name":"MAHLEY","classification":"C","division":"PCC","hit_factor":9.0476},{"match_name":"ORPCI USPSA Friday 2018.08.17","match_date":"2018-08-17","stage_classifiercode":"06-05","member_number":"A53250","first_name":"DON","last_name":"SLUSHER","classification":"C","division":"PCC","hit_factor":9.0476},{"match_name":"Parma May 2 USPSA","match_date":"2020-05-02","stage_classifiercode":"06-05","member_number":"A99339","first_name":"LOYAL","last_name":"GIBBONS","classification":"B","division":"PCC","hit_factor":9.0476},{"match_name":"NCPL Sept 2018","match_date":"2018-09-23","stage_classifiercode":"06-05","member_number":"TY96822","first_name":"CRAIG","last_name":"CASEY","classification":"U","division":"PCC","hit_factor":9.0452},{"match_name":"OREGON ARPC CC05 USPSA JAN 13 2018","match_date":"2018-01-13","stage_classifiercode":"06-05","member_number":"TY84121","first_name":"GABOR","last_name":"MAGONY","classification":"M","division":"PCC","hit_factor":9.0395},{"match_name":"CRGC USPSA Match 10-18-20","match_date":"2020-10-18","stage_classifiercode":"06-05","member_number":"TY84571","first_name":"WARREN","last_name":"PROUTY","classification":"","division":"PCC","hit_factor":9.0395},{"match_name":"CFL07 Williston Practical Shooters","match_date":"2018-11-03","stage_classifiercode":"06-05","member_number":"a28277","first_name":"BUD","last_name":"EHRMANN","classification":"B","division":"PCC","hit_factor":9.0361},{"match_name":"WY02 GTS 5.26.18","match_date":"2018-05-26","stage_classifiercode":"06-05","member_number":"ty88644","first_name":"CHRIS","last_name":"LAUCK","classification":"U","division":"PCC","hit_factor":9.0261},{"match_name":"FBURG April 2021 Level I USPSA ","match_date":"2021-04-03","stage_classifiercode":"06-05","member_number":"TY88424","first_name":"CRAIG","last_name":"PETERSON","classification":"C","division":"PCC","hit_factor":9.0261},{"match_name":"SCCC CLASSIFIER MATCH 7_23_17","match_date":"2017-07-23","stage_classifiercode":"06-05","member_number":"ty101688","first_name":"DON","last_name":"APPLEGARTH","classification":"U","division":"PCC","hit_factor":9.0226},{"match_name":"GRRC Week 11","match_date":"2020-07-20","stage_classifiercode":"06-05","member_number":"A-36739","first_name":"STEVE","last_name":"SHIMEK","classification":"U","division":"PCC","hit_factor":9.0226},{"match_name":"LCSA USPSA September 2017","match_date":"2017-09-02","stage_classifiercode":"06-05","member_number":"fy39111","first_name":"OLIE","last_name":"ERICKSEN","classification":"C","division":"PCC","hit_factor":9.0141},{"match_name":"SSS USPSA October 2020 Match","match_date":"2020-10-18","stage_classifiercode":"06-05","member_number":"A88808","first_name":"RICK","last_name":"ROBERTS","classification":"B (B Class)","division":"PCC","hit_factor":9.009},{"match_name":"Laser Ninja Dragon League USPSA April 2018","match_date":"2018-04-08","stage_classifiercode":"06-05","member_number":"A104287","first_name":"ALLEN","last_name":"SMITH","classification":"C","division":"PCC","hit_factor":9.0047},{"match_name":"Palmetto Gun Club - Late September 2017 USPSA","match_date":"2017-09-30","stage_classifiercode":"06-05","member_number":"A83814","first_name":"WILL","last_name":"FIELDS","classification":"U","division":"PCC","hit_factor":9.0047},{"match_name":"ORPCI USPSA Saturday 2018.08.18","match_date":"2018-08-18","stage_classifiercode":"06-05","member_number":"A109998","first_name":"DAVID","last_name":"SKELTON","classification":"\"\"","division":"PCC","hit_factor":8.9835},{"match_name":"GRRC By  league #4","match_date":"2017-06-12","stage_classifiercode":"06-05","member_number":"A86797","first_name":"RON","last_name":"ROZESKE","classification":"U","division":"PCC","hit_factor":8.982},{"match_name":"ORSA USPSA October 2017","match_date":"2017-10-21","stage_classifiercode":"06-05","member_number":"A28682","first_name":"DAN","last_name":"FOWLER","classification":"C","division":"PCC","hit_factor":8.9776},{"match_name":"Prescott 1st Saturday USPSA 4-7-18","match_date":"2018-04-07","stage_classifiercode":"06-05","member_number":"TY58975","first_name":"BEN","last_name":"SMITH","classification":"Unclassified","division":"PCC","hit_factor":8.971},{"match_name":"DSS - USPSA - 21-08-08","match_date":"2021-08-08","stage_classifiercode":"06-05","member_number":"A112153","first_name":"DANIEL","last_name":"TOOTHMAN","classification":"B","division":"PCC","hit_factor":8.9636},{"match_name":"MCPSL Pistol 07-14-2018","match_date":"2018-07-14","stage_classifiercode":"06-05","member_number":"A104399","first_name":"DONNIE","last_name":"DUREN","classification":"U","division":"PCC","hit_factor":8.9623},{"match_name":"TPS USPSA at CMP May 19 2018","match_date":"2018-05-19","stage_classifiercode":"06-05","member_number":"A111089","first_name":"JOEY","last_name":"MILAM","classification":"U","division":"PCC","hit_factor":8.9552},{"match_name":"CRGC USPSA Match 10-18-20","match_date":"2020-10-18","stage_classifiercode":"06-05","member_number":"A130692","first_name":"TARIK","last_name":"GHABRA","classification":"","division":"PCC","hit_factor":8.9474},{"match_name":"YRPA  September USPSA 2017","match_date":"2017-09-24","stage_classifiercode":"06-05","member_number":"A103266","first_name":"RICO","last_name":"HAMER-LACSAMANA","classification":"U","division":"PCC","hit_factor":8.9474},{"match_name":"WSRC USPSA 8/19-20/2017","match_date":"2017-08-19","stage_classifiercode":"06-05","member_number":"TY94469","first_name":"CONNOR","last_name":"MOLLOY","classification":"B","division":"PCC","hit_factor":8.9412},{"match_name":"SUPS USPSA Special Classifier September 15/16 2018","match_date":"2018-09-15","stage_classifiercode":"06-05","member_number":"TY33287","first_name":"RANDY","last_name":"COATES","classification":"U","division":"PCC","hit_factor":8.9239},{"match_name":"Klamath USPSA  07/02/17 JSPS OR09","match_date":"2017-07-02","stage_classifiercode":"06-05","member_number":"A77960","first_name":"BUCK","last_name":"DUGGER","classification":"B","division":"PCC","hit_factor":8.9202},{"match_name":"SSS USPSA October 2020 Match","match_date":"2020-10-18","stage_classifiercode":"06-05","member_number":"TY119168","first_name":"MIKE","last_name":"SMYTH","classification":"C (C Class)","division":"PCC","hit_factor":8.9109},{"match_name":"NTPS-SE February 2017","match_date":"2017-02-18","stage_classifiercode":"06-05","member_number":"TY34715","first_name":"TONY","last_name":"ELY","classification":"U","division":"PCC","hit_factor":8.8889},{"match_name":"LRC USPSA October 2020","match_date":"2020-10-03","stage_classifiercode":"06-05","member_number":"TY96443","first_name":"RUSTY","last_name":"WILSON","classification":"U","division":"PCC","hit_factor":8.8785},{"match_name":"TPS USPSA at CMP May 19 2018","match_date":"2018-05-19","stage_classifiercode":"06-05","member_number":"TY78088","first_name":"MIKE","last_name":"GOEBEL","classification":"B","division":"PCC","hit_factor":8.8785},{"match_name":"EWPSA 2017-04","match_date":"2017-04-16","stage_classifiercode":"06-05","member_number":"TY61539","first_name":"ANN","last_name":"BLOSSER","classification":"C","division":"PCC","hit_factor":8.8785},{"match_name":"TPS USPSA AT CMP Sunday SEPT 30 2018","match_date":"2018-09-29","stage_classifiercode":"06-05","member_number":"A110383","first_name":"TYLER","last_name":"HUTTO","classification":"U","division":"PCC","hit_factor":8.8692},{"match_name":"NW01 March Madness 17","match_date":"2017-03-12","stage_classifiercode":"06-05","member_number":"a83609","first_name":"SCOTT","last_name":"WHITING","classification":"U","division":"PCC","hit_factor":8.8692},{"match_name":"LIPSA - November 15th 2020 - USPSA Match ","match_date":"2020-11-15","stage_classifiercode":"06-05","member_number":"TY19188","first_name":"WARREN E","last_name":"SONNER","classification":"C","division":"PCC","hit_factor":8.8496},{"match_name":"TPS USPSA at CMP May 19 2018","match_date":"2018-05-19","stage_classifiercode":"06-05","member_number":"A10076","first_name":"MIKE","last_name":"CAMERON","classification":"D","division":"PCC","hit_factor":8.8496},{"match_name":"NRG Saturday July 25th - Includes a Classifier Stage","match_date":"2020-07-25","stage_classifiercode":"06-05","member_number":"TY104042","first_name":"PHILLIP","last_name":"SANTOS","classification":"U","division":"PCC","hit_factor":8.83},{"match_name":"SFPS 8-26-18 USPSA Match","match_date":"2018-08-26","stage_classifiercode":"06-05","member_number":"TY65769","first_name":"DANIEL","last_name":"NESTHUS","classification":"U","division":"PCC","hit_factor":8.83},{"match_name":"MPSA 2021-06-05","match_date":"2021-06-05","stage_classifiercode":"06-05","member_number":"L4195","first_name":"THOMAS","last_name":"HEARD","classification":"B","division":"PCC","hit_factor":8.8235},{"match_name":"ORSA USPSA October 2017","match_date":"2017-10-21","stage_classifiercode":"06-05","member_number":"PEN","first_name":"SCOTT","last_name":"DURHAM","classification":"U","division":"PCC","hit_factor":8.8235},{"match_name":"USAH May Covid19 Pistol And PCC Match","match_date":"2021-05-15","stage_classifiercode":"06-05","member_number":"TY98598","first_name":"MARK","last_name":"PAZ","classification":"U","division":"PCC","hit_factor":8.8154},{"match_name":"Sharp Practical Shooters September Match","match_date":"2017-09-23","stage_classifiercode":"06-05","member_number":"A100181","first_name":"RON","last_name":"VAUGHN","classification":"U","division":"PCC","hit_factor":8.8106},{"match_name":"LPRGC - Lower Providence USPSA Match July 2021","match_date":"2021-07-03","stage_classifiercode":"06-05","member_number":"A37231","first_name":"RON","last_name":"JONES","classification":"C","division":"PCC","hit_factor":8.8106},{"match_name":"Crooked Creek Pistol League - December 2017","match_date":"2017-12-03","stage_classifiercode":"06-05","member_number":"TY75462","first_name":"JASON","last_name":"HUGHES","classification":"U","division":"PCC","hit_factor":8.8083},{"match_name":"CFRPC USPSA 2017 JULY","match_date":"2017-07-16","stage_classifiercode":"06-05","member_number":"L2821","first_name":"BILL","last_name":"QUINTANA","classification":"U","division":"PCC","hit_factor":8.802},{"match_name":"ORPCI USPSA Friday 2018.08.17","match_date":"2018-08-17","stage_classifiercode":"06-05","member_number":"TY67575","first_name":"JIM","last_name":"PETER","classification":"A","division":"PCC","hit_factor":8.7912},{"match_name":"WSRC USPSA 8/19-20/2017","match_date":"2017-08-19","stage_classifiercode":"06-05","member_number":"A32149","first_name":"LASZLO","last_name":"SZABO","classification":"C","division":"PCC","hit_factor":8.7912},{"match_name":"PTPC May 6th  USPSA Match","match_date":"2018-05-06","stage_classifiercode":"06-05","member_number":"A85291","first_name":"DAVID","last_name":"GERBER","classification":"D","division":"PCC","hit_factor":8.776},{"match_name":"EWPSA 2017-04","match_date":"2017-04-16","stage_classifiercode":"06-05","member_number":"TY70904","first_name":"MIKE","last_name":"GIMERA","classification":"U","division":"PCC","hit_factor":8.7719},{"match_name":"ARPC USPSA Match 7-25-21","match_date":"2021-07-25","stage_classifiercode":"06-05","member_number":"A119255","first_name":"JAMES","last_name":"COLOMBO JR.","classification":"D","division":"PCC","hit_factor":8.7591},{"match_name":"RMAP 3rd  Sunday September 2016","match_date":"2016-09-18","stage_classifiercode":"06-05","member_number":"TY65635","first_name":"CHRIS","last_name":"COLLINS","classification":"U","division":"PCC","hit_factor":8.7527},{"match_name":"OREGON ARPC CC05 USPSA JAN 13 2018","match_date":"2018-01-13","stage_classifiercode":"06-05","member_number":"ty47743","first_name":"NORMAN","last_name":"BRIGHT","classification":"G","division":"PCC","hit_factor":8.75},{"match_name":"NRG Saturday July 25th - Includes a Classifier Stage","match_date":"2020-07-25","stage_classifiercode":"06-05","member_number":"TY117736","first_name":"JIMMY","last_name":"CADE","classification":"U","division":"PCC","hit_factor":8.7464},{"match_name":"Space Coast Practical Shooters","match_date":"2018-09-01","stage_classifiercode":"06-05","member_number":"A106562","first_name":"MARK","last_name":"AVERY","classification":"C","division":"PCC","hit_factor":8.7464},{"match_name":"SCPS ECO19 9/25/2020","match_date":"2020-09-25","stage_classifiercode":"06-05","member_number":"FY112018","first_name":"BRENT","last_name":"VOORHEES","classification":"A","division":"PCC","hit_factor":8.7404},{"match_name":"Sharp Practical Shooters September Match","match_date":"2017-09-23","stage_classifiercode":"06-05","member_number":"A71416","first_name":"BILL","last_name":"HANEY","classification":"X","division":"PCC","hit_factor":8.7404},{"match_name":"CBS October USPSA","match_date":"2020-10-04","stage_classifiercode":"06-05","member_number":"\"\"","first_name":"GABRIEL","last_name":"CLARK","classification":"\"\"","division":"PCC","hit_factor":8.7356},{"match_name":"Augusta USPSA 07-08-18","match_date":"2018-07-08","stage_classifiercode":"06-05","member_number":"A106268","first_name":"ALLEN","last_name":"MINAKER","classification":"C","division":"PCC","hit_factor":8.7356},{"match_name":"GRPC USPSA SOME LIKE IT HOT","match_date":"2021-08-01","stage_classifiercode":"06-05","member_number":"A115127","first_name":"BRYAN","last_name":"FAUSTINO","classification":"D","division":"PCC","hit_factor":8.7336},{"match_name":"CFRPC USPSA 2017 JULY","match_date":"2017-07-16","stage_classifiercode":"06-05","member_number":"Ty52498","first_name":"SCOTTY","last_name":"HUBBARD","classification":"C","division":"PCC","hit_factor":8.7167},{"match_name":"KSA USPSA 7 MARCH 2020","match_date":"2020-03-07","stage_classifiercode":"06-05","member_number":"A93289","first_name":"MIKE","last_name":"ROMIG","classification":"U","division":"PCC","hit_factor":8.7167},{"match_name":"Competitive Shooters of Lake Norman CORNELIUS Thursday Evening Indoor USPSA Pistol Match North Carolina","match_date":"2020-09-03","stage_classifiercode":"06-05","member_number":"TY106507","first_name":"KEITH","last_name":"NAGELSKI","classification":"B","division":"PCC","hit_factor":8.7156},{"match_name":"Richmond Boro Gun Club June 2018 USPSA  Match","match_date":"2018-06-23","stage_classifiercode":"06-05","member_number":"L3967","first_name":"JERRY","last_name":"COLANTONE","classification":"U","division":"PCC","hit_factor":8.7156},{"match_name":"DRRC USPSA May2018","match_date":"2018-05-05","stage_classifiercode":"06-05","member_number":"A44676","first_name":"HEIDI","last_name":"SALMAN","classification":"U","division":"PCC","hit_factor":8.7146},{"match_name":"GoShoot Outdoors April 5th","match_date":"2020-04-05","stage_classifiercode":"06-05","member_number":"A120654","first_name":"KK","last_name":"OLIVER","classification":"U","division":"PCC","hit_factor":8.6957},{"match_name":"SLPSA Dec USPSA","match_date":"2017-12-16","stage_classifiercode":"06-05","member_number":"\"\"","first_name":"DANTE","last_name":"DETTAMANTI","classification":"U","division":"PCC","hit_factor":8.6957},{"match_name":"SLPSA Jan USPSA match 2","match_date":"2020-01-18","stage_classifiercode":"06-05","member_number":"A114853","first_name":"LIAM","last_name":"KRAMER","classification":"B","division":"PCC","hit_factor":8.6957},{"match_name":"LPRGC - Lower Providence USPSA Match July 2021","match_date":"2021-07-03","stage_classifiercode":"06-05","member_number":"A8758","first_name":"STEPHEN","last_name":"MIRANDA","classification":"C","division":"PCC","hit_factor":8.6957},{"match_name":"WAC May 30th (5th Saturday) - USPSA 6 Stage Classifier Match","match_date":"2020-05-30","stage_classifiercode":"06-05","member_number":"A123389","first_name":"BRIAN","last_name":"MITCHELL","classification":"U","division":"PCC","hit_factor":8.6957},{"match_name":"MSSA USPSA July 23 2017","match_date":"2017-07-23","stage_classifiercode":"06-05","member_number":"L2056","first_name":"RICK","last_name":"CRAIG","classification":"B","division":"PCC","hit_factor":8.6768},{"match_name":"Maryland Practical Shooters Association June 2018","match_date":"2018-06-24","stage_classifiercode":"06-05","member_number":"A69569","first_name":"JEFF","last_name":"CUSTER","classification":"C","division":"PCC","hit_factor":8.6747},{"match_name":"MPPL 9th Annual Monster Match","match_date":"2016-10-22","stage_classifiercode":"06-05","member_number":"A74095","first_name":"MYRON","last_name":"HOEFER","classification":"U","division":"PCC","hit_factor":8.656},{"match_name":"SAPSA December 2017","match_date":"2017-12-16","stage_classifiercode":"06-05","member_number":"A55594","first_name":"GENE","last_name":"WILKERSON","classification":"U","division":"PCC","hit_factor":8.6294},{"match_name":"FBURG April 2021 Level I USPSA ","match_date":"2021-04-03","stage_classifiercode":"06-05","member_number":"A120434","first_name":"KAREN","last_name":"ZEIGLER","classification":"C","division":"PCC","hit_factor":8.6253},{"match_name":"OFGC USPSA Match 5-20-18","match_date":"2018-05-20","stage_classifiercode":"06-05","member_number":"TY94217","first_name":"DUSTIN","last_name":"CHAMBERLAIN","classification":"A","division":"PCC","hit_factor":8.6154},{"match_name":"June   USPSA  2018","match_date":"2018-06-09","stage_classifiercode":"06-05","member_number":"A89116","first_name":"GIANNA","last_name":"NUGUIT","classification":"C","division":"PCC","hit_factor":8.6124},{"match_name":"NCPL 2017 October","match_date":"2017-10-22","stage_classifiercode":"06-05","member_number":"TY71659","first_name":"ROSS","last_name":"THOMPSON","classification":"U","division":"PCC","hit_factor":8.6076},{"match_name":"CTASA 3rd Sunday USPSA - March 2018","match_date":"2018-03-18","stage_classifiercode":"06-05","member_number":"TY9766","first_name":"PATRICK","last_name":"BASHFORD","classification":"B","division":"PCC","hit_factor":8.6076},{"match_name":"ORPCI 2018.03.31 USPSA Special","match_date":"2018-03-31","stage_classifiercode":"06-05","member_number":"\"\"","first_name":"KEVIN","last_name":"RUSSELL","classification":"\"\"","division":"PCC","hit_factor":8.6076},{"match_name":"RPGi Thursday Night USPSA  February 4th 2021","match_date":"2021-02-03","stage_classifiercode":"06-05","member_number":"A127667","first_name":"AMY","last_name":"WAY","classification":"U","division":"PCC","hit_factor":8.6022},{"match_name":"NRG Saturday March 10th- Includes a Classifier Stage","match_date":"2018-03-10","stage_classifiercode":"06-05","member_number":"A100144","first_name":"DEREK","last_name":"HAMILTON","classification":"U","division":"PCC","hit_factor":8.596},{"match_name":"ORSA USPSA October 2017","match_date":"2017-10-21","stage_classifiercode":"06-05","member_number":"TY98638","first_name":"WENDY","last_name":"WINE","classification":"D","division":"PCC","hit_factor":8.5837},{"match_name":"ORPCI USPSA Friday 2018.08.17","match_date":"2018-08-17","stage_classifiercode":"06-05","member_number":"\"\"","first_name":"KEVIN","last_name":"ALLCRON","classification":"\"\"","division":"PCC","hit_factor":8.5653},{"match_name":"CTASA 3rd Sunday USPSA - March 2018","match_date":"2018-03-18","stage_classifiercode":"06-05","member_number":"TY108367","first_name":"MAX","last_name":"FELBER","classification":"U","division":"PCC","hit_factor":8.5653},{"match_name":"RCPS USPSA October 17","match_date":"2020-10-17","stage_classifiercode":"06-05","member_number":"A79013","first_name":"LEAH","last_name":"WIGGINS","classification":"C","division":"PCC","hit_factor":8.5642},{"match_name":"Baileys June 2018","match_date":"2018-06-03","stage_classifiercode":"06-05","member_number":"L3738","first_name":"JAY","last_name":"OLMSTEAD","classification":"B","division":"PCC","hit_factor":8.5511},{"match_name":"NISA March 2018","match_date":"2018-03-25","stage_classifiercode":"06-05","member_number":"TY73221","first_name":"JAY","last_name":"HOLLINGSWORTH","classification":"B","division":"PCC","hit_factor":8.547},{"match_name":"Homestead USPSA October CLASSIFIER Match","match_date":"2018-10-06","stage_classifiercode":"06-05","member_number":"A113439","first_name":"LEROY","last_name":"GARCIA","classification":"U","division":"PCC","hit_factor":8.5427},{"match_name":"EHPSA USPSA 25 July 2021","match_date":"2021-07-25","stage_classifiercode":"06-05","member_number":"a42456","first_name":"GARRY","last_name":"LITTLE","classification":"B","division":"PCC","hit_factor":8.5366},{"match_name":"NISA March 2018","match_date":"2018-03-25","stage_classifiercode":"06-05","member_number":"A38939","first_name":"STEVE","last_name":"MAINUS","classification":"U","division":"PCC","hit_factor":8.5308},{"match_name":"WGC WI USPSA Monthly Match 12-15-2018","match_date":"2018-12-15","stage_classifiercode":"06-05","member_number":"L4223","first_name":"DARRYL","last_name":"DOUGHERTY","classification":"M","division":"PCC","hit_factor":8.5213},{"match_name":"Steel City USPSA August 4 2018","match_date":"2018-08-04","stage_classifiercode":"06-05","member_number":"\"\"","first_name":"FRANK","last_name":"BUTCHER","classification":"X","division":"PCC","hit_factor":8.5106},{"match_name":"RSPP 3rd Saturday January 2017","match_date":"2017-01-21","stage_classifiercode":"06-05","member_number":"L3678","first_name":"RICHARD","last_name":"BHELLA","classification":"U","division":"PCC","hit_factor":8.5011},{"match_name":"ARPC USPSA Match 3-25-18","match_date":"2018-03-25","stage_classifiercode":"06-05","member_number":"A67446","first_name":"DAN","last_name":"SPRAUL","classification":"Unclassified","division":"PCC","hit_factor":8.4881},{"match_name":"Shasta Shooters July 2017","match_date":"2017-07-08","stage_classifiercode":"06-05","member_number":"A90623","first_name":"JAY","last_name":"SEDLER","classification":"U","division":"PCC","hit_factor":8.4821},{"match_name":"Springfield Tactical Shooters 04/01/2021","match_date":"2021-04-01","stage_classifiercode":"06-05","member_number":"A55905","first_name":"BARRY","last_name":"OLIVER","classification":"B","division":"PCC","hit_factor":8.4821},{"match_name":"TPS USPSA AT CMP Sunday SEPT 30 2018","match_date":"2018-09-29","stage_classifiercode":"06-05","member_number":"A97343","first_name":"GAGE","last_name":"TUCKER","classification":"C","division":"PCC","hit_factor":8.4746},{"match_name":"MPSA 2021-06-05","match_date":"2021-06-05","stage_classifiercode":"06-05","member_number":"A52372","first_name":"HURLEY","last_name":"RIDER","classification":"B","division":"PCC","hit_factor":8.4746},{"match_name":"DSS - USPSA - 21-08-08","match_date":"2021-08-08","stage_classifiercode":"06-05","member_number":"TV112916","first_name":"ED","last_name":"MONTGOMERY","classification":"\"\"","division":"PCC","hit_factor":8.4746},{"match_name":"LIPSA - November 5th 2017 - USPSA Special Classifier Match","match_date":"2017-11-05","stage_classifiercode":"06-05","member_number":"\"\"","first_name":"CHARLIE","last_name":"ZAMBITO","classification":"U","division":"PCC","hit_factor":8.4746},{"match_name":"OREGON ARPC CC05 USPSA JAN 13 2018","match_date":"2018-01-13","stage_classifiercode":"06-05","member_number":"TY16718","first_name":"MARK","last_name":"O'SHEA","classification":"U","division":"PCC","hit_factor":8.4633},{"match_name":"Hosemonster Action ","match_date":"2020-11-15","stage_classifiercode":"06-05","member_number":"A 3501","first_name":"JOHN","last_name":"HERNDON","classification":"B","division":"PCC","hit_factor":8.4507},{"match_name":"Steel City USPSA August 4 2018","match_date":"2018-08-04","stage_classifiercode":"06-05","member_number":"\"\"","first_name":"GUIDO","last_name":"MASTERS","classification":"X","division":"PCC","hit_factor":8.4367},{"match_name":"CASA USPSA August 2018","match_date":"2018-08-05","stage_classifiercode":"06-05","member_number":"A82964","first_name":"EDWARD","last_name":"EMRICH","classification":"B","division":"PCC","hit_factor":8.4309},{"match_name":"Space Coast Practical Shooters","match_date":"2018-09-01","stage_classifiercode":"06-05","member_number":"Ty91351","first_name":"FERNANDO","last_name":"ALMEIDA","classification":"B","division":"PCC","hit_factor":8.4211},{"match_name":"RSPP 3rd Saturday January 2017","match_date":"2017-01-21","stage_classifiercode":"06-05","member_number":"FY24902","first_name":"KEVIN","last_name":"LAMB","classification":"A","division":"PCC","hit_factor":8.4084},{"match_name":"WPS USPSA Monthly Match May 2018","match_date":"2018-05-05","stage_classifiercode":"06-05","member_number":"A65779","first_name":"JAMES","last_name":"BURNELL","classification":"U","division":"PCC","hit_factor":8.4034},{"match_name":"ARPC USPSA Match 7-25-21","match_date":"2021-07-25","stage_classifiercode":"06-05","member_number":"TY95198","first_name":"RAY","last_name":"YORK","classification":"Unclassified","division":"PCC","hit_factor":8.399},{"match_name":"MPPL 9th Annual Monster Match","match_date":"2016-10-22","stage_classifiercode":"06-05","member_number":"TY78748","first_name":"LEE","last_name":"BARNES","classification":"U","division":"PCC","hit_factor":8.399},{"match_name":"PTPC May 6th  USPSA Match","match_date":"2018-05-06","stage_classifiercode":"06-05","member_number":"A77507","first_name":"LARRY","last_name":"HEMMENS","classification":"C","division":"PCC","hit_factor":8.3885},{"match_name":"Palmetto Gun Club - Late September 2017 USPSA","match_date":"2017-09-30","stage_classifiercode":"06-05","member_number":"L2945","first_name":"LEE","last_name":"ROUSE","classification":"D","division":"PCC","hit_factor":8.3721},{"match_name":"DWB - Deadwood Boys USPSA 01 April 2018","match_date":"2018-04-01","stage_classifiercode":"06-05","member_number":"TY109634","first_name":"MEGAN","last_name":"SWEASEY","classification":"U","division":"PCC","hit_factor":8.3333},{"match_name":"ORPCI USPSA Friday 2021.05.14","match_date":"2021-05-14","stage_classifiercode":"06-05","member_number":"L4156","first_name":"JEFF","last_name":"STONE","classification":"C","division":"PCC","hit_factor":8.3333},{"match_name":"NISA March 2018","match_date":"2018-03-25","stage_classifiercode":"06-05","member_number":"A70578","first_name":"ED","last_name":"NICHOLS","classification":"C","division":"PCC","hit_factor":8.316},{"match_name":"PTPC December 3rd USPSA Match","match_date":"2017-12-03","stage_classifiercode":"06-05","member_number":"TY79144","first_name":"WAYNE","last_name":"WAGNER","classification":"U","division":"PCC","hit_factor":8.3151},{"match_name":"Deadwood Boys USPSA All Classifier Match","match_date":"2016-08-07","stage_classifiercode":"06-05","member_number":"TY85661","first_name":"KEITH","last_name":"SORRELL","classification":"U","division":"PCC","hit_factor":8.3102},{"match_name":"Crooked Creek Pistol League - December 2017","match_date":"2017-12-03","stage_classifiercode":"06-05","member_number":"A75237","first_name":"MIKE","last_name":"HARRISON","classification":"C","division":"PCC","hit_factor":8.2969},{"match_name":"LCSA USPSA September 2017","match_date":"2017-09-02","stage_classifiercode":"06-05","member_number":"A91802","first_name":"STEVE","last_name":"WESCOTT","classification":"U","division":"PCC","hit_factor":8.2969},{"match_name":"ORPCI 2018.03.31 USPSA Special","match_date":"2018-03-31","stage_classifiercode":"06-05","member_number":"TY109432","first_name":"MICKI","last_name":"PETKOVIC","classification":"X","division":"PCC","hit_factor":8.2927},{"match_name":"MPSA 102018 USPSA","match_date":"2018-10-20","stage_classifiercode":"06-05","member_number":"A90846","first_name":"MICHAEL","last_name":"COFER","classification":"B","division":"PCC","hit_factor":8.2902},{"match_name":"CTASA 3rd Sunday USPSA - March 2018","match_date":"2018-03-18","stage_classifiercode":"06-05","member_number":"TY66303","first_name":"BRIAN","last_name":"HURST","classification":"U","division":"PCC","hit_factor":8.2789},{"match_name":"WNPL USPSA - DEC 2016","match_date":"2016-12-04","stage_classifiercode":"06-05","member_number":"A43862","first_name":"THOMAS","last_name":"MCCORMICK","classification":"U","division":"PCC","hit_factor":8.2759},{"match_name":"USPSA MO21 2Alpha SBRC April 2018 Special Classifier","match_date":"2018-04-28","stage_classifiercode":"06-05","member_number":"FY36467","first_name":"JAMES","last_name":"POPE","classification":"U","division":"PCC","hit_factor":8.2645},{"match_name":"USPSA MO21 2Alpha SBRC April 2018 Special Classifier","match_date":"2018-04-28","stage_classifiercode":"06-05","member_number":"A106591","first_name":"AUSTIN","last_name":"HILL","classification":"U","division":"PCC","hit_factor":8.2609},{"match_name":"EWPSA 2020-07","match_date":"2020-07-19","stage_classifiercode":"06-05","member_number":"TY122149","first_name":"MICHELLE","last_name":"HARMON","classification":"D","division":"PCC","hit_factor":8.2609},{"match_name":"WSPS OCTOBER 2016 SPECIAL CLASSIFIER MATCH","match_date":"2016-10-29","stage_classifiercode":"06-05","member_number":"A90864","first_name":"JASON","last_name":"DEVINE","classification":"U","division":"PCC","hit_factor":8.2569},{"match_name":"AGC_20161002","match_date":"2016-10-02","stage_classifiercode":"06-05","member_number":"TY18366","first_name":"RICK","last_name":"HEBERT","classification":"\"\"","division":"PCC","hit_factor":8.2569},{"match_name":"WGC June 2017 USPSA 2","match_date":"2017-06-25","stage_classifiercode":"06-05","member_number":"A84380","first_name":"BRANDON","last_name":"LITTLETON","classification":"U","division":"PCC","hit_factor":8.2474},{"match_name":"ARPC USPSA Match 7-25-21","match_date":"2021-07-25","stage_classifiercode":"06-05","member_number":"A32149","first_name":"LASZLO","last_name":"SZABO","classification":"B","division":"PCC","hit_factor":8.243},{"match_name":"NRG Saturday March 10th- Includes a Classifier Stage","match_date":"2018-03-10","stage_classifiercode":"06-05","member_number":"A58032","first_name":"CHARLES","last_name":"CUTFORTH","classification":"U","division":"PCC","hit_factor":8.238},{"match_name":"Homestead USPSA October CLASSIFIER Match","match_date":"2018-10-06","stage_classifiercode":"06-05","member_number":"A95572","first_name":"CHRIS","last_name":"CAMARGO","classification":"U","division":"PCC","hit_factor":8.238},{"match_name":"NCPL 2017 October","match_date":"2017-10-22","stage_classifiercode":"06-05","member_number":"TY67972","first_name":"SCOTT","last_name":"SAVERCOOL","classification":"U","division":"PCC","hit_factor":8.2324},{"match_name":"FAS Sunday USPSA Special Classifier Match","match_date":"2020-07-19","stage_classifiercode":"06-05","member_number":"A121168","first_name":"LILY ANN","last_name":"REECE","classification":"C","division":"PCC","hit_factor":8.2305},{"match_name":"CBS October USPSA","match_date":"2020-10-04","stage_classifiercode":"06-05","member_number":"A127937","first_name":"BUD","last_name":"SMITH","classification":"D","division":"PCC","hit_factor":8.2262},{"match_name":"Richmond Hot Shots December 5-6-2020 USPSA Pistol","match_date":"2020-12-05","stage_classifiercode":"06-05","member_number":"TY49645","first_name":"ED","last_name":"ESPINOZA","classification":"M","division":"PCC","hit_factor":8.2237},{"match_name":"Laser Ninja Dragon League USPSA April 2018","match_date":"2018-04-08","stage_classifiercode":"06-05","member_number":"\"\"","first_name":"JOSH","last_name":"GONZALES","classification":"U","division":"PCC","hit_factor":8.2192},{"match_name":"WGC WI USPSA Monthly Match 3-18-17","match_date":"2017-03-18","stage_classifiercode":"06-05","member_number":"TY78432","first_name":"OUSMANE","last_name":"DIALLO","classification":"U","division":"PCC","hit_factor":8.2192},{"match_name":"SFPC November Trophy match","match_date":"2016-11-06","stage_classifiercode":"06-05","member_number":"TY70667","first_name":"JORGE","last_name":"RODRIGUEZ","classification":"U","division":"PCC","hit_factor":8.2136},{"match_name":"GPS  May 2017","match_date":"2017-05-28","stage_classifiercode":"06-05","member_number":"a91331","first_name":"DEREK","last_name":"RABUCK","classification":"U","division":"PCC","hit_factor":8.2073},{"match_name":"ARPC USPSA Match 7-26-20","match_date":"2020-07-26","stage_classifiercode":"06-05","member_number":"TY93058","first_name":"BRUCE","last_name":"CURRY","classification":"C","division":"PCC","hit_factor":8.2073},{"match_name":"SWGC USPSA Pistol Match - October 2018","match_date":"2018-10-06","stage_classifiercode":"06-05","member_number":"A23656","first_name":"RAY","last_name":"WELLS","classification":"U","division":"PCC","hit_factor":8.2019},{"match_name":"RSPP 3rd Saturday January 2017","match_date":"2017-01-21","stage_classifiercode":"06-05","member_number":"TY66465","first_name":"JEFF","last_name":"WEGENER","classification":"U","division":"PCC","hit_factor":8.2005},{"match_name":"Richmond Hot Shots December 5-6-2020 USPSA Pistol","match_date":"2020-12-05","stage_classifiercode":"06-05","member_number":"L3415","first_name":"RICKY","last_name":"FONG","classification":"C","division":"PCC","hit_factor":8.1818},{"match_name":"OFGC USPSA Match 8-15-21","match_date":"2021-08-15","stage_classifiercode":"06-05","member_number":"TY89055","first_name":"JERRY","last_name":"RICHARDS","classification":"B","division":"PCC","hit_factor":8.1818},{"match_name":"DRRC USPSA May2018","match_date":"2018-05-05","stage_classifiercode":"06-05","member_number":"A87653","first_name":"DENNIS","last_name":"OHEARN","classification":"B","division":"PCC","hit_factor":8.172},{"match_name":"TGC USPSA November 2017","match_date":"2017-11-18","stage_classifiercode":"06-05","member_number":"a47524","first_name":"LELAND","last_name":"JOHNSON","classification":"U","division":"PCC","hit_factor":8.1633},{"match_name":"Springfield Tactical Shooters 04/01/2021","match_date":"2021-04-01","stage_classifiercode":"06-05","member_number":"FY83614","first_name":"GARY","last_name":"GRAY","classification":"B","division":"PCC","hit_factor":8.1633},{"match_name":"MCPSL Pistol 08-11-2018","match_date":"2018-08-11","stage_classifiercode":"06-05","member_number":"TY37712","first_name":"AUDRA","last_name":"GOYETTE","classification":"D","division":"PCC","hit_factor":8.1633},{"match_name":"RBGC USPSA 2021-8-15 Special Classifier Match","match_date":"2021-08-15","stage_classifiercode":"06-05","member_number":"A136356","first_name":"TEVIN","last_name":"RICHARDSON","classification":"U","division":"PCC","hit_factor":8.1545},{"match_name":"NRG Saturday April 10th Includes a Classifier Stage","match_date":"2021-04-10","stage_classifiercode":"06-05","member_number":"A18725","first_name":"JIM","last_name":"MESSINA","classification":"C","division":"PCC","hit_factor":8.1545},{"match_name":"Richmond Hot Shots December 5-6-2020 USPSA Pistol","match_date":"2020-12-05","stage_classifiercode":"06-05","member_number":"a80595","first_name":"EDGAR","last_name":"ALLAS","classification":"B","division":"PCC","hit_factor":8.1535},{"match_name":"NW01 March Madness 17","match_date":"2017-03-12","stage_classifiercode":"06-05","member_number":"FY27156","first_name":"STEVE","last_name":"CLEMO","classification":"U","division":"PCC","hit_factor":8.1522},{"match_name":"EHPSA USPSA 25 July 2021","match_date":"2021-07-25","stage_classifiercode":"06-05","member_number":"TY111882","first_name":"HARRY","last_name":"WOLFORD","classification":"C","division":"PCC","hit_factor":8.1466},{"match_name":"LCSA USPSA September 2017","match_date":"2017-09-02","stage_classifiercode":"06-05","member_number":"A103419","first_name":"GEORGE","last_name":"OLSAKOVSKY","classification":"U","division":"PCC","hit_factor":8.1466},{"match_name":"TGC November USPSA","match_date":"2016-11-20","stage_classifiercode":"06-05","member_number":"A33170","first_name":"JASON","last_name":"ARMSTRONG","classification":"U","division":"PCC","hit_factor":8.1448},{"match_name":"TGC November USPSA","match_date":"2016-11-20","stage_classifiercode":"06-05","member_number":"A88373","first_name":"RYAN","last_name":"CHAMBERS","classification":"U","division":"PCC","hit_factor":8.1425},{"match_name":"MSSA USPSA","match_date":"2016-10-02","stage_classifiercode":"06-05","member_number":"\"\"","first_name":"SETH","last_name":"MCMAHAN","classification":"\"\"","division":"PCC","hit_factor":8.1264},{"match_name":"WGC August 2020 USPSA Classifier","match_date":"2020-08-09","stage_classifiercode":"06-05","member_number":"L3696","first_name":"ROBERT","last_name":"HALSELL","classification":"M","division":"PCC","hit_factor":8.1159},{"match_name":"ORPCI USPSA Friday 2018.08.17","match_date":"2018-08-17","stage_classifiercode":"06-05","member_number":"\"\"","first_name":"LEWIS","last_name":"HAMBLEN","classification":"\"\"","division":"PCC","hit_factor":8.1023},{"match_name":"WSPS JULY 2016 USPSA","match_date":"2016-07-16","stage_classifiercode":"06-05","member_number":"TY31530","first_name":"DAVID","last_name":"RAGLAND","classification":"U","division":"PCC","hit_factor":8.1013},{"match_name":"NRG Saturday July 8th - classifier","match_date":"2017-07-08","stage_classifiercode":"06-05","member_number":"\"\"","first_name":"BRIAN","last_name":"DRAKE","classification":"U","division":"PCC","hit_factor":8.1013},{"match_name":"ORPCI USPSA Saturday 21.05.15","match_date":"2021-05-15","stage_classifiercode":"06-05","member_number":"AQQ5437","first_name":"STEVE","last_name":"SCHMITT","classification":"","division":"PCC","hit_factor":8.0972},{"match_name":"LRC USPSA October 2020","match_date":"2020-10-03","stage_classifiercode":"06-05","member_number":"A128576","first_name":"TIM","last_name":"CUTTING","classification":"D","division":"PCC","hit_factor":8.0851},{"match_name":"ARPC USPSA Match 3-25-18","match_date":"2018-03-25","stage_classifiercode":"06-05","member_number":"A109692","first_name":"MARCUS","last_name":"TAO","classification":"Unclassified","division":"PCC","hit_factor":8.076},{"match_name":"EWPSA 2020-07","match_date":"2020-07-19","stage_classifiercode":"06-05","member_number":"L4637","first_name":"PAMELA","last_name":"HARPER","classification":"B","division":"PCC","hit_factor":8.0645},{"match_name":"SWGC USPSA Pistol Match - August 2021","match_date":"2021-08-07","stage_classifiercode":"06-05","member_number":"TY39654","first_name":"LEE","last_name":"DENNEY","classification":"B","division":"PCC","hit_factor":8.0569},{"match_name":"SFPS 8-26-18 USPSA Match","match_date":"2018-08-26","stage_classifiercode":"06-05","member_number":"A50695","first_name":"TIM","last_name":"THOMAS","classification":"B","division":"PCC","hit_factor":8.0569},{"match_name":"BHPSC Monthly Match - Aug 2020","match_date":"2020-08-28","stage_classifiercode":"06-05","member_number":"A95470","first_name":"GABRIEL","last_name":"SANCHEZ","classification":"U - Unclassified","division":"PCC","hit_factor":8.0378},{"match_name":"CTASA 3rd Sunday USPSA - March 2018","match_date":"2018-03-18","stage_classifiercode":"06-05","member_number":"TY101659","first_name":"MARK","last_name":"DRAPER","classification":"U","division":"PCC","hit_factor":8.0338},{"match_name":"AAPS AAFG Special Classifier Match - March 31 2018","match_date":"2018-03-31","stage_classifiercode":"06-05","member_number":"TY91875","first_name":"OTHELL","last_name":"MOORE","classification":"U","division":"PCC","hit_factor":8.0321},{"match_name":"Deadwood Boys USPSA All Classifier Match","match_date":"2016-08-07","stage_classifiercode":"06-05","member_number":"A98135","first_name":"PHILLIP","last_name":"HOANG","classification":"U","division":"PCC","hit_factor":8.0178},{"match_name":"Palmetto Gun Club - Late September 2017 USPSA","match_date":"2017-09-30","stage_classifiercode":"06-05","member_number":"L4278","first_name":"JULIE","last_name":"HOLLING","classification":"U","division":"PCC","hit_factor":8.0178},{"match_name":"ENPS Late September 2018 USPSA Match","match_date":"2018-09-30","stage_classifiercode":"06-05","member_number":"A107513","first_name":"ALICIA","last_name":"WATSON","classification":"U","division":"PCC","hit_factor":8.0169},{"match_name":"Pioneer Action Shooters USPSA 5-23-21 Special Classifer","match_date":"2021-05-23","stage_classifiercode":"06-05","member_number":"A93279","first_name":"JONAH","last_name":"COLDWELL","classification":"U","division":"PCC","hit_factor":8},{"match_name":"Space Coast Practical Shooters","match_date":"2018-09-01","stage_classifiercode":"06-05","member_number":"A105052","first_name":"RAY","last_name":"MACKOWSKI","classification":"C","division":"PCC","hit_factor":7.9665},{"match_name":"Springfield Tactical Shooters 04/01/2021","match_date":"2021-04-01","stage_classifiercode":"06-05","member_number":"TY107856","first_name":"JESSE","last_name":"BOEHLER","classification":"\"\"","division":"PCC","hit_factor":7.9646},{"match_name":"LPRGC - Lower Providence USPSA July 2018","match_date":"2018-07-07","stage_classifiercode":"06-05","member_number":"FY44402","first_name":"NOAH","last_name":"GLADSTONE","classification":"C","division":"PCC","hit_factor":7.947},{"match_name":"Steel City USPSA August 4 2018","match_date":"2018-08-04","stage_classifiercode":"06-05","member_number":"A79013","first_name":"LEAH","last_name":"WIGGINS","classification":"C","division":"PCC","hit_factor":7.9404},{"match_name":"August 8 2018 A-Zone match","match_date":"2018-08-08","stage_classifiercode":"06-05","member_number":"NA","first_name":"DEVIN","last_name":"HARRIS","classification":"X","division":"PCC","hit_factor":7.9365},{"match_name":"SCS USPSA Pistol with Classifer - Special Classifier July 31 2016","match_date":"2016-07-31","stage_classifiercode":"06-05","member_number":"TY89917","first_name":"MARK","last_name":"TAYLOR","classification":"U","division":"PCC","hit_factor":7.9332},{"match_name":"SWGC USPSA Pistol Match - August 2021","match_date":"2021-08-07","stage_classifiercode":"06-05","member_number":"A121941","first_name":"SKYLAR","last_name":"LUZON","classification":"U","division":"PCC","hit_factor":7.9295},{"match_name":"EWPSA 2020-07","match_date":"2020-07-19","stage_classifiercode":"06-05","member_number":"B6","first_name":"M DWIGHT","last_name":"HUGHES","classification":"B","division":"PCC","hit_factor":7.9208},{"match_name":"Steel City USPSA August 4 2018","match_date":"2018-08-04","stage_classifiercode":"06-05","member_number":"A96891","first_name":"GEORGE","last_name":"MORRIS","classification":"D","division":"PCC","hit_factor":7.9121},{"match_name":"SAPSC Monthly USPSA Classifier Match at ARO 20170420","match_date":"2017-04-20","stage_classifiercode":"06-05","member_number":"A37609","first_name":"TOM","last_name":"MULLIGAN","classification":"C","division":"PCC","hit_factor":7.9121},{"match_name":"LCSC Classifier 042918","match_date":"2018-04-28","stage_classifiercode":"06-05","member_number":"A103682","first_name":"CARLOS","last_name":"CARRASQUEL","classification":"U","division":"PCC","hit_factor":7.8886},{"match_name":"MPSA 2021-06-05","match_date":"2021-06-05","stage_classifiercode":"06-05","member_number":"A-96501","first_name":"CANDACE","last_name":"ZIMMERMAN","classification":"B","division":"PCC","hit_factor":7.8886},{"match_name":"Steel City USPSA September 5 2020","match_date":"2020-09-04","stage_classifiercode":"06-05","member_number":"A60070","first_name":"ROBERT","last_name":"MOORE","classification":"A","division":"PCC","hit_factor":7.8838},{"match_name":"RPGi Thursday Night USPSA  February 4th 2021","match_date":"2021-02-03","stage_classifiercode":"06-05","member_number":"A6205","first_name":"GREG","last_name":"PATE","classification":"B","division":"PCC","hit_factor":7.8838},{"match_name":"Richmond Hot Shots December 5-6-2020 USPSA Pistol","match_date":"2020-12-05","stage_classifiercode":"06-05","member_number":"TY104400","first_name":"REECE","last_name":"PADRIGON","classification":"B","division":"PCC","hit_factor":7.8775},{"match_name":"Laser Ninja Dragon League USPSA July 2nd Special Classifier","match_date":"2017-07-02","stage_classifiercode":"06-05","member_number":"a104280","first_name":"TIMOTHY","last_name":"SMITH","classification":"U","division":"PCC","hit_factor":7.8775},{"match_name":"NTPS-SE February 2017","match_date":"2017-02-18","stage_classifiercode":"06-05","member_number":"TY64849","first_name":"DAVID","last_name":"PETERSON","classification":"U","division":"PCC","hit_factor":7.8775},{"match_name":"SLPSA Jan USPSA match 2","match_date":"2020-01-18","stage_classifiercode":"06-05","member_number":"A113106","first_name":"DAVID","last_name":"WONG","classification":"C","division":"PCC","hit_factor":7.874},{"match_name":"TGC USPSA November 2017","match_date":"2017-11-18","stage_classifiercode":"06-05","member_number":"A-93750","first_name":"IRA","last_name":"ROYALS","classification":"U","division":"PCC","hit_factor":7.874},{"match_name":"Palmetto Gun Club - Late September 2017 USPSA","match_date":"2017-09-30","stage_classifiercode":"06-05","member_number":"\"\"","first_name":"KENDALL","last_name":"EDSON","classification":"U","division":"PCC","hit_factor":7.8704},{"match_name":"SLPSA Dec USPSA","match_date":"2017-12-16","stage_classifiercode":"06-05","member_number":"\"\"","first_name":"KARSON","last_name":"WELCH","classification":"U","division":"PCC","hit_factor":7.8624},{"match_name":"USPSA MO19 Lamar Mar 25 2028","match_date":"2018-03-25","stage_classifiercode":"06-05","member_number":"TY48907","first_name":"DAVID","last_name":"LETSCH","classification":"A","division":"PCC","hit_factor":7.8624},{"match_name":"NRG Saturday March 10th- Includes a Classifier Stage","match_date":"2018-03-10","stage_classifiercode":"06-05","member_number":"A26320","first_name":"EDUARDO","last_name":"ESGUERRA","classification":"C","division":"PCC","hit_factor":7.8603},{"match_name":"Laser Ninja Dragon League USPSA July 2nd Special Classifier","match_date":"2017-07-02","stage_classifiercode":"06-05","member_number":"A100220","first_name":"MATTHEW","last_name":"ST. PIERRE","classification":"U","division":"PCC","hit_factor":7.8522},{"match_name":"GRPC USPSA SOME LIKE IT HOT","match_date":"2021-08-01","stage_classifiercode":"06-05","member_number":"TY103508","first_name":"JEFF","last_name":"BROWN","classification":"U","division":"PCC","hit_factor":7.8512},{"match_name":"Space Coast Practical Shooters","match_date":"2018-09-01","stage_classifiercode":"06-05","member_number":"A100360","first_name":"BENJAMIN","last_name":"CABRERA","classification":"U","division":"PCC","hit_factor":7.8512},{"match_name":"MPPL 20210807","match_date":"2021-08-07","stage_classifiercode":"06-05","member_number":"FY51827","first_name":"JOSHUA","last_name":"RAPANOT","classification":"U","division":"PCC","hit_factor":7.8512},{"match_name":"Shoot GTR Mini Match 07/10/2018","match_date":"2018-07-10","stage_classifiercode":"06-05","member_number":"a106215","first_name":"SCOTT","last_name":"CRUMPTON","classification":"U","division":"PCC","hit_factor":7.8341},{"match_name":"EHPSA USPSA 25 July 2021","match_date":"2021-07-25","stage_classifiercode":"06-05","member_number":"TY127550","first_name":"JAMES","last_name":"ANDERSON","classification":"A","division":"PCC","hit_factor":7.824},{"match_name":"MPSA 102018 USPSA","match_date":"2018-10-20","stage_classifiercode":"06-05","member_number":"A94953","first_name":"RICCARDO","last_name":"MELCHIOR","classification":"U","division":"PCC","hit_factor":7.8189},{"match_name":"FLPSA MN14 USPSA August 13 2017","match_date":"2017-08-13","stage_classifiercode":"06-05","member_number":"Ty-71905","first_name":"KYLE","last_name":"TAM","classification":"B","division":"PCC","hit_factor":7.8125},{"match_name":"USAH November Covid19 Pistol & PCC Match ","match_date":"2021-11-07","stage_classifiercode":"06-05","member_number":"A117692","first_name":"RODEL","last_name":"BAYSA","classification":"U","division":"PCC","hit_factor":7.8125},{"match_name":"MCAS July 2017 USPSA Match","match_date":"2017-07-15","stage_classifiercode":"06-05","member_number":"A97062","first_name":"PAUL","last_name":"MCKEAN","classification":"U","division":"PCC","hit_factor":7.8125},{"match_name":"MCPSL Pistol 08-11-2018","match_date":"2018-08-11","stage_classifiercode":"06-05","member_number":"A111852","first_name":"JOHN","last_name":"MORGAN","classification":"U","division":"PCC","hit_factor":7.8091},{"match_name":"Hopkinton USPSA July 2018","match_date":"2018-07-07","stage_classifiercode":"06-05","member_number":"TY62563","first_name":"ANATOLY","last_name":"PODPALY","classification":"C","division":"PCC","hit_factor":7.7973},{"match_name":"WGC WI USPSA Monthly Match 3-18-17","match_date":"2017-03-18","stage_classifiercode":"06-05","member_number":"TY26421","first_name":"RANDY","last_name":"HEFFNER","classification":"U","division":"PCC","hit_factor":7.7803},{"match_name":"USPSA MO21 2Alpha SBRC April 2018 Special Classifier","match_date":"2018-04-28","stage_classifiercode":"06-05","member_number":"A99328","first_name":"ED","last_name":"WILSON","classification":"C","division":"PCC","hit_factor":7.767},{"match_name":"YMM  IPSC02 2018_02_11","match_date":"2018-02-11","stage_classifiercode":"06-05","member_number":"A34448","first_name":"LARRY","last_name":"LEBEAU","classification":"B","division":"PCC","hit_factor":7.7562},{"match_name":"Cops September 2016 USPSA CLASSIFIER","match_date":"2016-09-04","stage_classifiercode":"06-05","member_number":"a19657","first_name":"BOB","last_name":"PERRY","classification":"B","division":"PCC","hit_factor":7.7482},{"match_name":"Rankin Field April (ALL CLASSIFIER) Saturday USPSA","match_date":"2021-04-03","stage_classifiercode":"06-05","member_number":"FY100108","first_name":"BRUCE","last_name":"SWANSON","classification":"U","division":"PCC","hit_factor":7.7295},{"match_name":"Steel City USPSA September 5 2020","match_date":"2020-09-04","stage_classifiercode":"06-05","member_number":"A100930","first_name":"DOUG","last_name":"HOLLOWAY","classification":"C","division":"PCC","hit_factor":7.7273},{"match_name":"Detroit Sportsmens Congress - May 21 2017","match_date":"2017-05-21","stage_classifiercode":"06-05","member_number":"PEN","first_name":"BARRETT","last_name":"TARR","classification":"U","division":"PCC","hit_factor":7.7273},{"match_name":"Steel City USPSA September 5 2020","match_date":"2020-09-04","stage_classifiercode":"06-05","member_number":"46679","first_name":"GUIDO","last_name":"MASTERS","classification":"C","division":"PCC","hit_factor":7.7253},{"match_name":"USPSA MO21 2Alpha SBRC April 2018 Special Classifier","match_date":"2018-04-28","stage_classifiercode":"06-05","member_number":"A109971","first_name":"AUSTIN","last_name":"KENNEDY","classification":"U","division":"PCC","hit_factor":7.7236},{"match_name":"NTPS-SE February 2017","match_date":"2017-02-18","stage_classifiercode":"06-05","member_number":"L4156","first_name":"JEFF","last_name":"STONE","classification":"U","division":"PCC","hit_factor":7.7236},{"match_name":"Atlanta Practical Shooters October 2017 PCC USPSA Match","match_date":"2017-09-30","stage_classifiercode":"06-05","member_number":"A83047","first_name":"FRANK","last_name":"POLACK","classification":"U","division":"PCC","hit_factor":7.7108},{"match_name":"WELD ECO09 20180617","match_date":"2018-06-17","stage_classifiercode":"06-05","member_number":"A60755","first_name":"DOUG","last_name":"MERLE","classification":"U","division":"PCC","hit_factor":7.6775},{"match_name":"USPSA MO21 2Alpha SBRC April 2018 Special Classifier","match_date":"2018-04-28","stage_classifiercode":"06-05","member_number":"A97624","first_name":"MIKE","last_name":"MARTIN","classification":"B","division":"PCC","hit_factor":7.6749},{"match_name":"SSS USPSA October 2020 Match","match_date":"2020-10-18","stage_classifiercode":"06-05","member_number":"A114363","first_name":"HOWARD","last_name":"DOCHERTY","classification":"C (C Class)","division":"PCC","hit_factor":7.6596},{"match_name":"YMM  IPSC02 2018_02_11","match_date":"2018-02-11","stage_classifiercode":"06-05","member_number":"\"\"","first_name":"GEORGE","last_name":"WAGNER","classification":"U","division":"PCC","hit_factor":7.6596},{"match_name":"EHPSA USPSA 25 July 2021","match_date":"2021-07-25","stage_classifiercode":"06-05","member_number":"A130665","first_name":"KAYLIE","last_name":"DANIELS","classification":"C","division":"PCC","hit_factor":7.6404},{"match_name":"LIPSA - November 5th 2017 - USPSA Special Classifier Match","match_date":"2017-11-05","stage_classifiercode":"06-05","member_number":"A50486","first_name":"DONG","last_name":"KIM","classification":"C","division":"PCC","hit_factor":7.6336},{"match_name":"SCAPSA MN05 SPRING LEAGUE 6","match_date":"2017-09-12","stage_classifiercode":"06-05","member_number":"L2789","first_name":"BILL","last_name":"MCCARTY","classification":"C","division":"PCC","hit_factor":7.619},{"match_name":"EWPSA 2020-07","match_date":"2020-07-19","stage_classifiercode":"06-05","member_number":"A106857","first_name":"CHRISTINA","last_name":"PAHL","classification":"C","division":"PCC","hit_factor":7.619},{"match_name":"BMRPA IPSC73 Aug 19 2018","match_date":"2018-08-19","stage_classifiercode":"06-05","member_number":"FY10629","first_name":"JIM","last_name":"DUFFY","classification":"U","division":"PCC","hit_factor":7.6152304609218},{"match_name":"Steel City USPSA August 4 2018","match_date":"2018-08-04","stage_classifiercode":"06-05","member_number":"\"\"","first_name":"BLAKE","last_name":"WHELESS","classification":"X","division":"PCC","hit_factor":7.6152},{"match_name":"Alpha Mike August Classifier 2021   ","match_date":"2021-08-15","stage_classifiercode":"06-05","member_number":"A108266","first_name":"JASON","last_name":"PALAFOX","classification":"B","division":"PCC","hit_factor":7.6142},{"match_name":"GRRC By  league #4","match_date":"2017-06-12","stage_classifiercode":"06-05","member_number":"A36739","first_name":"STEVE","last_name":"SHIMEK","classification":"U","division":"PCC","hit_factor":7.601},{"match_name":"NRG Saturday April 10th Includes a Classifier Stage","match_date":"2021-04-10","stage_classifiercode":"06-05","member_number":"A101068","first_name":"KELLI","last_name":"MCKERNAN","classification":"D","division":"PCC","hit_factor":7.6},{"match_name":"WGC June 2017 USPSA 2","match_date":"2017-06-25","stage_classifiercode":"06-05","member_number":"TY70973","first_name":"KATHY","last_name":"DYCUS","classification":"U","division":"PCC","hit_factor":7.5789},{"match_name":"ORPCI USPSA Saturday 21.05.15","match_date":"2021-05-15","stage_classifiercode":"06-05","member_number":"FY80376","first_name":"DAN","last_name":"RAINBOLT","classification":"D","division":"PCC","hit_factor":7.5697},{"match_name":"SAPSA December 2017","match_date":"2017-12-16","stage_classifiercode":"06-05","member_number":"A69229","first_name":"CHARLIE","last_name":"NELSON","classification":"C","division":"PCC","hit_factor":7.5614},{"match_name":"SFPC November Trophy match","match_date":"2016-11-06","stage_classifiercode":"06-05","member_number":"A98748","first_name":"JAMES","last_name":"BEMBANASTE","classification":"U","division":"PCC","hit_factor":7.533},{"match_name":"CSA Annual Classifier Classic","match_date":"2018-03-18","stage_classifiercode":"06-05","member_number":"FY54303","first_name":"DANA","last_name":"CAMPBELL","classification":"U","division":"PCC","hit_factor":7.5294},{"match_name":"2020-10 USPSA at Shadow Hawk Defense","match_date":"2020-10-10","stage_classifiercode":"06-05","member_number":"A120434","first_name":"KAREN","last_name":"ZEIGLER","classification":"C","division":"PCC","hit_factor":7.5294},{"match_name":"Crooked Creek Pistol League - December 2017","match_date":"2017-12-03","stage_classifiercode":"06-05","member_number":"A100346","first_name":"JAMES","last_name":"SINGER","classification":"C","division":"PCC","hit_factor":7.5188},{"match_name":"MPSA 121518 USPA Classifer Match","match_date":"2018-12-15","stage_classifiercode":"06-05","member_number":"A6205","first_name":"GREG","last_name":"PATE","classification":"U","division":"PCC","hit_factor":7.5157},{"match_name":"NISA March 2018","match_date":"2018-03-25","stage_classifiercode":"06-05","member_number":"A43652","first_name":"NATHAN","last_name":"VESTAL","classification":"U","division":"PCC","hit_factor":7.5157},{"match_name":"S&Hs8 22 20 Slot Match","match_date":"2020-08-19","stage_classifiercode":"06-05","member_number":"TY92356","first_name":"JAY","last_name":"SHEARER","classification":"U","division":"PCC","hit_factor":7.5055},{"match_name":"OFGC USPSA Match 8-15-21","match_date":"2021-08-15","stage_classifiercode":"06-05","member_number":"A127912","first_name":"COLBY","last_name":"MAXWELL","classification":"C","division":"PCC","hit_factor":7.5055},{"match_name":"LCSA USPSA September 2017","match_date":"2017-09-02","stage_classifiercode":"06-05","member_number":"A96913","first_name":"CHARLES","last_name":"RODGERS","classification":"C","division":"PCC","hit_factor":7.5},{"match_name":"SWGC USPSA Pistol Match - October 2018","match_date":"2018-10-06","stage_classifiercode":"06-05","member_number":"L3974","first_name":"ANDY","last_name":"KWON","classification":"A","division":"PCC","hit_factor":7.5},{"match_name":"RSPP 3rd Saturday January 2017","match_date":"2017-01-21","stage_classifiercode":"06-05","member_number":"TY77188","first_name":"PAT","last_name":"FISHER","classification":"U","division":"PCC","hit_factor":7.4941},{"match_name":"WNYPPL August 2017 Classifier Match","match_date":"2017-08-27","stage_classifiercode":"06-05","member_number":"TY42276","first_name":"DAVE","last_name":"PRIBEK","classification":"C","division":"PCC","hit_factor":7.4906},{"match_name":"SWGC USPSA Pistol Match - August 2021","match_date":"2021-08-07","stage_classifiercode":"06-05","member_number":"A93396","first_name":"SHIVA","last_name":"ANANDA","classification":"A","division":"PCC","hit_factor":7.4844},{"match_name":"June   USPSA  2018","match_date":"2018-06-09","stage_classifiercode":"06-05","member_number":"A101821","first_name":"RYAN","last_name":"RHODES","classification":"U","division":"PCC","hit_factor":7.4766},{"match_name":"Alpha Mike August Classifier 2021   ","match_date":"2021-08-15","stage_classifiercode":"06-05","member_number":"A37212","first_name":"MARIO","last_name":"HESLES","classification":"G","division":"PCC","hit_factor":7.4725},{"match_name":"Richmond Boro Gun Club December 2018 USPSA Match","match_date":"2018-12-15","stage_classifiercode":"06-05","member_number":"A114142","first_name":"LOU","last_name":"TREDICI","classification":"U","division":"PCC","hit_factor":7.4627},{"match_name":"LPRGC - Lower Providence USPSA Match July 2021","match_date":"2021-07-03","stage_classifiercode":"06-05","member_number":"A114630","first_name":"JOSEPH","last_name":"SANTOS","classification":"A","division":"PCC","hit_factor":7.4627},{"match_name":"S&Hs8 22 20 Slot Match","match_date":"2020-08-19","stage_classifiercode":"06-05","member_number":"A72942","first_name":"REGGIE","last_name":"ANDERSON","classification":"U","division":"PCC","hit_factor":7.4419},{"match_name":"Atlanta Practical Shooters October 2017 PCC USPSA Match","match_date":"2017-09-30","stage_classifiercode":"06-05","member_number":"\"\"","first_name":"CLAIRE","last_name":"GIDDINGS","classification":"U","division":"PCC","hit_factor":7.3913},{"match_name":"2020-10 USPSA at Shadow Hawk Defense","match_date":"2020-10-10","stage_classifiercode":"06-05","member_number":"FY58086","first_name":"LAURA","last_name":"TORRES-REYES","classification":"C","division":"PCC","hit_factor":7.377},{"match_name":"Chillicothe Sportsmens Club September USPSA","match_date":"2021-09-25","stage_classifiercode":"06-05","member_number":"TY58309","first_name":"ERIC","last_name":"HENSON","classification":"A","division":"PCC","hit_factor":7.3733},{"match_name":"Palmetto Gun Club - Late September 2017 USPSA","match_date":"2017-09-30","stage_classifiercode":"06-05","member_number":"\"\"","first_name":"NOAH","last_name":"WHEELER","classification":"U","division":"PCC","hit_factor":7.3665},{"match_name":"CASA USPSA August 2018","match_date":"2018-08-05","stage_classifiercode":"06-05","member_number":"A111360","first_name":"R.L.","last_name":"NIX","classification":"D","division":"PCC","hit_factor":7.362},{"match_name":"LPRGC - Lower Providence USPSA Match July 2021","match_date":"2021-07-03","stage_classifiercode":"06-05","member_number":"TY98673","first_name":"BRIAN","last_name":"ATTENBOROUGH","classification":"C","division":"PCC","hit_factor":7.3501},{"match_name":"EAGC April 2016 USPSA Pistol Match","match_date":"2016-04-17","stage_classifiercode":"06-05","member_number":"PEND","first_name":"GABRIEL","last_name":"REYNOLDS","classification":"D","division":"PCC","hit_factor":7.3394},{"match_name":"MPPL 9th Annual Monster Match","match_date":"2016-10-22","stage_classifiercode":"06-05","member_number":"TY83569","first_name":"PAT","last_name":"MORRISSEY","classification":"U","division":"PCC","hit_factor":7.3359},{"match_name":"Low Country USPSA January 27th","match_date":"2018-01-27","stage_classifiercode":"06-05","member_number":"A103899","first_name":"JENNY","last_name":"COOK","classification":"U","division":"PCC","hit_factor":7.332},{"match_name":"ORPCI USPSA Friday 2018.08.17","match_date":"2018-08-17","stage_classifiercode":"06-05","member_number":"TY13915","first_name":"DARRELL","last_name":"COOMER","classification":"\"\"","division":"PCC","hit_factor":7.326},{"match_name":"Klamath USPSA  07/02/17 JSPS OR09","match_date":"2017-07-02","stage_classifiercode":"06-05","member_number":"\"\"","first_name":"MACKENZIE","last_name":"WESLEY","classification":"U","division":"PCC","hit_factor":7.2961},{"match_name":"OFGC USPSA Match 5-20-18","match_date":"2018-05-20","stage_classifiercode":"06-05","member_number":"A90763","first_name":"DIANE","last_name":"MCCOY","classification":"C","division":"PCC","hit_factor":7.2797},{"match_name":"AAPS AAFG Special Classifier Match - March 31 2018","match_date":"2018-03-31","stage_classifiercode":"06-05","member_number":"TY91090","first_name":"ROBERT","last_name":"SHATROWSKY","classification":"U","division":"PCC","hit_factor":7.2727},{"match_name":"EWPSA 2020-07","match_date":"2020-07-19","stage_classifiercode":"06-05","member_number":"TY120660","first_name":"RICHARD","last_name":"NELSON","classification":"D","division":"PCC","hit_factor":7.2727},{"match_name":"MSSA USPSA July 23 2017","match_date":"2017-07-23","stage_classifiercode":"06-05","member_number":"FY82156","first_name":"STANLEY","last_name":"HODGIN","classification":"U","division":"PCC","hit_factor":7.2658},{"match_name":"Pioneer Action Shooters USPSA 5-23-21 Special Classifer","match_date":"2021-05-23","stage_classifiercode":"06-05","member_number":"TY84597","first_name":"NORMAN","last_name":"DAVIS","classification":"C","division":"PCC","hit_factor":7.2581},{"match_name":"BORCC USPSA June 2018 Classifer Match","match_date":"2018-06-18","stage_classifiercode":"06-05","member_number":"A85291","first_name":"DAVID","last_name":"GERBER","classification":"C","division":"PCC","hit_factor":7.2519},{"match_name":"2020-10 USPSA at Shadow Hawk Defense","match_date":"2020-10-10","stage_classifiercode":"06-05","member_number":"TY99998","first_name":"LEONARD","last_name":"ROY","classification":"C","division":"PCC","hit_factor":7.2144},{"match_name":"OFGC USPSA Match 8-15-21","match_date":"2021-08-15","stage_classifiercode":"06-05","member_number":"FY45785","first_name":"BRUCE","last_name":"BETHELL","classification":"C","division":"PCC","hit_factor":7.2072},{"match_name":"GoShoot Outdoor July 24th","match_date":"2021-07-24","stage_classifiercode":"06-05","member_number":"A125733","first_name":"DEE DEE","last_name":"THOMPSON","classification":"D","division":"PCC","hit_factor":7.2},{"match_name":"Crooked Creek Pistol League - December 2017","match_date":"2017-12-03","stage_classifiercode":"06-05","member_number":"L2450","first_name":"BUD","last_name":"CONNOLLY","classification":"U","division":"PCC","hit_factor":7.191},{"match_name":"Oakdale USPSA MN07 7-22-2021","match_date":"2021-07-22","stage_classifiercode":"06-05","member_number":"L4062","first_name":"KEN","last_name":"SPOONER","classification":"B","division":"PCC","hit_factor":7.173},{"match_name":"ORPCI USPSA Friday 2018.08.17","match_date":"2018-08-17","stage_classifiercode":"06-05","member_number":"\"\"","first_name":"SEAN","last_name":"MANGAN","classification":"\"\"","division":"PCC","hit_factor":7.1563},{"match_name":"DRRC USPSA May2018","match_date":"2018-05-05","stage_classifiercode":"06-05","member_number":"A56751","first_name":"KEVIN","last_name":"ROBY","classification":"U","division":"PCC","hit_factor":7.1563},{"match_name":"Richmond Hot Shots December 5-6-2020 USPSA Pistol","match_date":"2020-12-05","stage_classifiercode":"06-05","member_number":"TY 92295","first_name":"ASHRAF","last_name":"LATIF","classification":"U","division":"PCC","hit_factor":7.1429},{"match_name":"SUPS USPSA Special Classifier September 15/16 2018","match_date":"2018-09-15","stage_classifiercode":"06-05","member_number":"A99206","first_name":"GREG","last_name":"FISCHER","classification":"D","division":"PCC","hit_factor":7.1429},{"match_name":"WSPS JULY 2016 USPSA","match_date":"2016-07-16","stage_classifiercode":"06-05","member_number":"TY88991","first_name":"BRIAN","last_name":"DUGAN","classification":"U","division":"PCC","hit_factor":7.1295},{"match_name":"CSA Annual Classifier Classic","match_date":"2018-03-18","stage_classifiercode":"06-05","member_number":"A98649","first_name":"MATTHEW","last_name":"MOORE","classification":"U","division":"PCC","hit_factor":7.113},{"match_name":"NRG Saturday April 10th Includes a Classifier Stage","match_date":"2021-04-10","stage_classifiercode":"06-05","member_number":"TY6047","first_name":"JIMMY","last_name":"ORDONEZ","classification":"A","division":"PCC","hit_factor":7.109},{"match_name":"CSA Annual Classifier Classic","match_date":"2018-03-18","stage_classifiercode":"06-05","member_number":"\"\"","first_name":"AMBER","last_name":"BRINEGAR","classification":"\"\"","division":"PCC","hit_factor":7.1028},{"match_name":"LdF USPSA Match September 22 2018","match_date":"2018-09-22","stage_classifiercode":"06-05","member_number":"A75516","first_name":"CRAIG","last_name":"NORFLEET","classification":"C","division":"PCC","hit_factor":7.0981},{"match_name":"RPGi Thursday Night USPSA  February 4th 2021","match_date":"2021-02-03","stage_classifiercode":"06-05","member_number":"A92935","first_name":"JOHN","last_name":"JACKSON","classification":"C","division":"PCC","hit_factor":7.0727},{"match_name":"NTPS-SE February 2017","match_date":"2017-02-18","stage_classifiercode":"06-05","member_number":"PEN","first_name":"RAYMOND","last_name":"DIAZ","classification":"U","division":"PCC","hit_factor":7.064},{"match_name":"LdF USPSA Match September 22 2018","match_date":"2018-09-22","stage_classifiercode":"06-05","member_number":"A111060","first_name":"ROBBIE","last_name":"ROBINSON","classification":"C","division":"PCC","hit_factor":7.0632},{"match_name":"WSRC USPSA 8/19-20/2017","match_date":"2017-08-19","stage_classifiercode":"06-05","member_number":"A101579","first_name":"TERRY","last_name":"CREPS","classification":"U","division":"PCC","hit_factor":7.0501},{"match_name":"6ta Fecha USPSA","match_date":"2018-06-24","stage_classifiercode":"06-05","member_number":"A97126","first_name":"JUDIBELLE","last_name":"MELENDEZ-ALCARAZ","classification":"U","division":"PCC","hit_factor":7.0393},{"match_name":"LIPSA - November 5th 2017 - USPSA Special Classifier Match","match_date":"2017-11-05","stage_classifiercode":"06-05","member_number":"A55119","first_name":"NICHOLAS","last_name":"ANDRONICA","classification":"C","division":"PCC","hit_factor":7.0393},{"match_name":"DWB - Deadwood Boys USPSA 01 April 2018","match_date":"2018-04-01","stage_classifiercode":"06-05","member_number":"\"\"","first_name":"LEE","last_name":"EDWARD","classification":"U","division":"PCC","hit_factor":7.033},{"match_name":"DSS - USPSA 20-09-26","match_date":"2020-09-26","stage_classifiercode":"06-05","member_number":"A100496","first_name":"DAVID","last_name":"LILES","classification":"B","division":"PCC","hit_factor":7.0299},{"match_name":"WGC WI USPSA Monthly Match 3-18-17","match_date":"2017-03-18","stage_classifiercode":"06-05","member_number":"FY76269","first_name":"RUSSELL","last_name":"SWIGGUM","classification":"U","division":"PCC","hit_factor":7.0299},{"match_name":"Deadwood Boys USPSA All Classifier Match","match_date":"2016-08-07","stage_classifiercode":"06-05","member_number":"L3810","first_name":"ERIC","last_name":"BERG","classification":"U","division":"PCC","hit_factor":7.0093},{"match_name":"ARPC USPSA Match 3-25-18","match_date":"2018-03-25","stage_classifiercode":"06-05","member_number":"A84108","first_name":"MIKE","last_name":"WEBB","classification":"C","division":"PCC","hit_factor":6.9959},{"match_name":"CRGC USPSA Match 10-18-20","match_date":"2020-10-18","stage_classifiercode":"06-05","member_number":"TY120213","first_name":"GENE","last_name":"ZHITOMIRSKY","classification":"","division":"PCC","hit_factor":6.9869},{"match_name":"ORPCI 2018.03.31 USPSA Special","match_date":"2018-03-31","stage_classifiercode":"06-05","member_number":"A109998","first_name":"DAVE","last_name":"SKELTON","classification":"U","division":"PCC","hit_factor":6.9565},{"match_name":"Pioneer Action Shooters USPSA 5-23-21 Special Classifer","match_date":"2021-05-23","stage_classifiercode":"06-05","member_number":"A131810","first_name":"MATT","last_name":"LECCACORVI","classification":"U","division":"PCC","hit_factor":6.953},{"match_name":"RSPP 3rd Saturday January 2017","match_date":"2017-01-21","stage_classifiercode":"06-05","member_number":"TY65813","first_name":"JOSEPH","last_name":"HANNIS","classification":"D","division":"PCC","hit_factor":6.947},{"match_name":"Steel City USPSA August 4 2018","match_date":"2018-08-04","stage_classifiercode":"06-05","member_number":"TY94006","first_name":"PAUL","last_name":"SIMS","classification":"U","division":"PCC","hit_factor":6.9444},{"match_name":"OREGON ARPC CC05 USPSA JAN 13 2018","match_date":"2018-01-13","stage_classifiercode":"06-05","member_number":"TY80056","first_name":"DAVID","last_name":"SAXON","classification":"U","division":"PCC","hit_factor":6.9324},{"match_name":"DWB - Deadwood Boys USPSA August 6 2017","match_date":"2017-08-06","stage_classifiercode":"06-05","member_number":"a61891","first_name":"PERRY","last_name":"VERZOSA","classification":"U","division":"PCC","hit_factor":6.9324},{"match_name":"June   USPSA  2018","match_date":"2018-06-09","stage_classifiercode":"06-05","member_number":"TY86380","first_name":"JOHN","last_name":"PENNELLA","classification":"A","division":"PCC","hit_factor":6.9124},{"match_name":"INAS USPSA April 2018","match_date":"2018-04-14","stage_classifiercode":"06-05","member_number":"A100181","first_name":"RON","last_name":"VAUGHN","classification":"B","division":"PCC","hit_factor":6.9085},{"match_name":"WSPS OCTOBER 2016 SPECIAL CLASSIFIER MATCH","match_date":"2016-10-29","stage_classifiercode":"06-05","member_number":"A97964","first_name":"DEREK","last_name":"SMITH","classification":"U","division":"PCC","hit_factor":6.8966},{"match_name":"EAGC April 2016 USPSA Pistol Match","match_date":"2016-04-17","stage_classifiercode":"06-05","member_number":"\"\"","first_name":"DAVID","last_name":"CRAWFORD","classification":"U","division":"PCC","hit_factor":6.8847},{"match_name":"AREA 59  SPRING ALL CLASSIFIER","match_date":"2018-03-31","stage_classifiercode":"06-05","member_number":"A104703","first_name":"CARL","last_name":"CHENG","classification":"U","division":"PCC","hit_factor":6.8841},{"match_name":"WAC May 30th (5th Saturday) - USPSA 6 Stage Classifier Match","match_date":"2020-05-30","stage_classifiercode":"06-05","member_number":"A111574","first_name":"MICHELLE","last_name":"CORDRAY","classification":"U","division":"PCC","hit_factor":6.8611},{"match_name":"LCSA USPSA September 2017","match_date":"2017-09-02","stage_classifiercode":"06-05","member_number":"FY90924","first_name":"SOPHIA","last_name":"SMITH","classification":"C","division":"PCC","hit_factor":6.8493},{"match_name":"LCSA USPSA September 2017","match_date":"2017-09-02","stage_classifiercode":"06-05","member_number":"A61469","first_name":"JAMES","last_name":"NAGEOTTE","classification":"C","division":"PCC","hit_factor":6.8182},{"match_name":"WELD ECO09 20180617","match_date":"2018-06-17","stage_classifiercode":"06-05","member_number":"FY62075","first_name":"DAVID","last_name":"SMITH","classification":"B","division":"PCC","hit_factor":6.7912},{"match_name":"LIPSA - November 5th 2017 - USPSA Special Classifier Match","match_date":"2017-11-05","stage_classifiercode":"06-05","member_number":"A104509","first_name":"ANASTASIA","last_name":"GEORGIOPOULOS","classification":"U","division":"PCC","hit_factor":6.7729},{"match_name":"Prescott 1st Saturday 12-02-17","match_date":"2017-12-02","stage_classifiercode":"06-05","member_number":"A72667","first_name":"KEN","last_name":"STUBBE","classification":"D","division":"PCC","hit_factor":6.7653},{"match_name":"LIPSA - November 5th 2017 - USPSA Special Classifier Match","match_date":"2017-11-05","stage_classifiercode":"06-05","member_number":"L3851","first_name":"JEFF","last_name":"PAULSEN","classification":"B","division":"PCC","hit_factor":6.7616},{"match_name":"LIPSA - November 15th 2020 - USPSA Match ","match_date":"2020-11-15","stage_classifiercode":"06-05","member_number":"A128318","first_name":"VAYSA","last_name":"ALIPIO","classification":"D","division":"PCC","hit_factor":6.7368},{"match_name":"HRRB 12-01-2018","match_date":"2018-12-01","stage_classifiercode":"06-05","member_number":"FY61621","first_name":"DERICK","last_name":"HIPOL","classification":"U","division":"PCC","hit_factor":6.7308},{"match_name":"Mesquite Mayhem Monthly USPSA Match","match_date":"2021-01-10","stage_classifiercode":"06-05","member_number":"A88723","first_name":"JEFF","last_name":"JIMENEZ","classification":"C","division":"PCC","hit_factor":6.6879},{"match_name":"CSA Aug 2016","match_date":"2016-08-14","stage_classifiercode":"06-05","member_number":"A89266","first_name":"SCOTT","last_name":"RIDDLE","classification":"U","division":"PCC","hit_factor":6.6667},{"match_name":"Pioneer Action Shooters USPSA 5-23-21 Special Classifer","match_date":"2021-05-23","stage_classifiercode":"06-05","member_number":"TY76519","first_name":"BRIAN","last_name":"CAIRA","classification":"A","division":"PCC","hit_factor":6.6667},{"match_name":"NRG Saturday July 25th - Includes a Classifier Stage","match_date":"2020-07-25","stage_classifiercode":"06-05","member_number":"L3251","first_name":"BUDDY","last_name":"BAUTISTA","classification":"B","division":"PCC","hit_factor":6.6536},{"match_name":"June   USPSA  2018","match_date":"2018-06-09","stage_classifiercode":"06-05","member_number":"A108344","first_name":"STEVE","last_name":"ANDERSON","classification":"U","division":"PCC","hit_factor":6.6406},{"match_name":"CFRPC USPSA 2017 JULY","match_date":"2017-07-16","stage_classifiercode":"06-05","member_number":"A69150","first_name":"DERRICK","last_name":"CHEN-LUKE","classification":"A","division":"PCC","hit_factor":6.6372},{"match_name":"MPPL 20210807","match_date":"2021-08-07","stage_classifiercode":"06-05","member_number":"NA","first_name":"ALBERT","last_name":"FERNANDEZ","classification":"X- non USPSA member","division":"PCC","hit_factor":6.6225},{"match_name":"OREGON ARPC CC05 USPSA JAN 13 2018","match_date":"2018-01-13","stage_classifiercode":"06-05","member_number":"A97334","first_name":"BRET","last_name":"DUNMIRE","classification":"U","division":"PCC","hit_factor":6.6202},{"match_name":"BMRPA IPSC73 Aug 19 2018","match_date":"2018-08-19","stage_classifiercode":"06-05","member_number":"TY83994","first_name":"KIM","last_name":"PARSON","classification":"U","division":"PCC","hit_factor":6.6176470588235},{"match_name":"LCHG May USPSA","match_date":"2017-05-21","stage_classifiercode":"06-05","member_number":"PEN","first_name":"MARK","last_name":"JONES","classification":"U","division":"PCC","hit_factor":6.6176},{"match_name":"Deadwood Boys USPSA All Classifier Match","match_date":"2016-08-07","stage_classifiercode":"06-05","member_number":"\"\"","first_name":"JENNIFER","last_name":"GONZALEZ","classification":"U","division":"PCC","hit_factor":6.6019},{"match_name":"TPS USPSA -  September 2018 USPSA","match_date":"2018-09-01","stage_classifiercode":"06-05","member_number":"A103326","first_name":"WALTER","last_name":"HATHAWAY","classification":"D","division":"PCC","hit_factor":6.6007},{"match_name":"LPRGC - Lower Providence USPSA Match July 2021","match_date":"2021-07-03","stage_classifiercode":"06-05","member_number":"TY85259","first_name":"JOJO","last_name":"SANTOS","classification":"B","division":"PCC","hit_factor":6.599},{"match_name":"CFRPC USPSA 2017 JULY","match_date":"2017-07-16","stage_classifiercode":"06-05","member_number":"a39194","first_name":"WALTER","last_name":"TRAWINSKI","classification":"U","division":"PCC","hit_factor":6.5979},{"match_name":"MPSA 2021-06-05","match_date":"2021-06-05","stage_classifiercode":"06-05","member_number":"A92067","first_name":"DON","last_name":"ALBARES","classification":"A","division":"PCC","hit_factor":6.5934},{"match_name":"CBS October USPSA","match_date":"2020-10-04","stage_classifiercode":"06-05","member_number":"A115659","first_name":"BOOT","last_name":"CHUMBLEY","classification":"C","division":"PCC","hit_factor":6.5823},{"match_name":"Triforce Practical Shooters at BigWoodsGoods 3-22-18","match_date":"2018-03-22","stage_classifiercode":"06-05","member_number":"A104844","first_name":"EDWIN","last_name":"CARILAO","classification":"U","division":"PCC","hit_factor":6.5789},{"match_name":"BPSA January 2017 USPSA","match_date":"2017-01-22","stage_classifiercode":"06-05","member_number":"A100643","first_name":"LLOYD","last_name":"MARINE","classification":"U","division":"PCC","hit_factor":6.563},{"match_name":"MCAS July 2017 USPSA Match","match_date":"2017-07-15","stage_classifiercode":"06-05","member_number":"A103250","first_name":"MITCH","last_name":"BEDFORD","classification":"U","division":"PCC","hit_factor":6.5502},{"match_name":"Mesquite Mayhem Shooter Society USPSA 9-23-2017","match_date":"2017-09-23","stage_classifiercode":"06-05","member_number":"ty57835","first_name":"JOEL","last_name":"DE  LEON","classification":"U","division":"PCC","hit_factor":6.5404},{"match_name":"EHPSA USPSA 25 July 2021","match_date":"2021-07-25","stage_classifiercode":"06-05","member_number":"A134600","first_name":"DIANA","last_name":"FINK","classification":"U","division":"PCC","hit_factor":6.4865},{"match_name":"Richmond Boro Gun Club June 2018 USPSA  Match","match_date":"2018-06-23","stage_classifiercode":"06-05","member_number":"TY91965","first_name":"JOE","last_name":"STEINHAUER","classification":"U","division":"PCC","hit_factor":6.4865},{"match_name":"USPSA MO21 2Alpha SBRC April 2018 Special Classifier","match_date":"2018-04-28","stage_classifiercode":"06-05","member_number":"A107478","first_name":"TEAGAN","last_name":"MACON","classification":"U","division":"PCC","hit_factor":6.4632},{"match_name":"ARPC USPSA Match 3-25-18","match_date":"2018-03-25","stage_classifiercode":"06-05","member_number":"L3904","first_name":"ROBERT","last_name":"RUMBLEY","classification":"Unclassified","division":"PCC","hit_factor":6.4386},{"match_name":"YMM  IPSC02 2018_02_11","match_date":"2018-02-11","stage_classifiercode":"06-05","member_number":"FY66184","first_name":"STEFNIE","last_name":"MASLEN","classification":"\"\"","division":"PCC","hit_factor":6.422},{"match_name":"Low Country USPSA January 27th","match_date":"2018-01-27","stage_classifiercode":"06-05","member_number":"A104258","first_name":"DAVID","last_name":"SMITH","classification":"C","division":"PCC","hit_factor":6.4171},{"match_name":"LCSA USPSA June 2017","match_date":"2017-06-10","stage_classifiercode":"06-05","member_number":"FY-90924","first_name":"SOPHIA","last_name":"SMITH","classification":"C","division":"PCC","hit_factor":6.4128},{"match_name":"WGC WI USPSA Monthly Match 12-15-2018","match_date":"2018-12-15","stage_classifiercode":"06-05","member_number":"TY89958","first_name":"JESSE","last_name":"NEWTON","classification":"A","division":"PCC","hit_factor":6.4103},{"match_name":"Rio Salado UPPL July 2020 ALL CLASSIFIER MATCH","match_date":"2020-07-12","stage_classifiercode":"06-05","member_number":"L2359","first_name":"YVETTE","last_name":"LASS","classification":"U","division":"PCC","hit_factor":6.4},{"match_name":"SUPS USPSA Special Classifier September 15/16 2018","match_date":"2018-09-15","stage_classifiercode":"06-05","member_number":"\"\"","first_name":"LINDA","last_name":"STIDHAM","classification":"U","division":"PCC","hit_factor":6.3973},{"match_name":"NISA March 2018","match_date":"2018-03-25","stage_classifiercode":"06-05","member_number":"TY65726","first_name":"FRANK","last_name":"MITRICK","classification":"U","division":"PCC","hit_factor":6.3898},{"match_name":"SLPSA Dec USPSA","match_date":"2017-12-16","stage_classifiercode":"06-05","member_number":"A83531","first_name":"DAVE","last_name":"BLAISDELL","classification":"U","division":"PCC","hit_factor":6.3725},{"match_name":"Laser Ninja Dragon League USPSA April 2018","match_date":"2018-04-08","stage_classifiercode":"06-05","member_number":"\"\"","first_name":"MIKE","last_name":"AGUERO","classification":"U","division":"PCC","hit_factor":6.3604},{"match_name":"USPSA","match_date":"2018-02-04","stage_classifiercode":"06-05","member_number":"\"\"","first_name":"KATIE","last_name":"UNDERWOOD","classification":"\"\"","division":"PCC","hit_factor":6.3593},{"match_name":"SRAPS Amarillo Action November USPSA","match_date":"2016-11-26","stage_classifiercode":"06-05","member_number":"L4020","first_name":"WAYNE","last_name":"HARDIN","classification":"U","division":"PCC","hit_factor":6.3551},{"match_name":"OFGC USPSA Match 8-15-21","match_date":"2021-08-15","stage_classifiercode":"06-05","member_number":"A117129","first_name":"EITAN","last_name":"GROSS","classification":"C","division":"PCC","hit_factor":6.3492},{"match_name":"LCSA USPSA September 2017","match_date":"2017-09-02","stage_classifiercode":"06-05","member_number":"A104540","first_name":"HEATHER","last_name":"MASLONEK","classification":"U","division":"PCC","hit_factor":6.3269},{"match_name":"MCAS July 2017 USPSA Match","match_date":"2017-07-15","stage_classifiercode":"06-05","member_number":"TY29750","first_name":"CRAIG","last_name":"BOYD","classification":"U","division":"PCC","hit_factor":6.3253},{"match_name":"YMM  IPSC02 2018_02_11","match_date":"2018-02-11","stage_classifiercode":"06-05","member_number":"\"\"","first_name":"JOE","last_name":"COE","classification":"\"\"","division":"PCC","hit_factor":6.2893},{"match_name":"SWGC USPSA Pistol Match - August 2021","match_date":"2021-08-07","stage_classifiercode":"06-05","member_number":"FY88724","first_name":"JESSICA","last_name":"DOIRON","classification":"M","division":"PCC","hit_factor":6.2868},{"match_name":"Prescott 1st Saturday 12-02-17","match_date":"2017-12-02","stage_classifiercode":"06-05","member_number":"A104571","first_name":"MIKE","last_name":"HAYES","classification":"B","division":"PCC","hit_factor":6.2794},{"match_name":"NRG Saturday July 25th - Includes a Classifier Stage","match_date":"2020-07-25","stage_classifiercode":"06-05","member_number":"A101068","first_name":"KELLI","last_name":"MCKERNAN","classification":"D","division":"PCC","hit_factor":6.2745},{"match_name":"ORSA USPSA October 2017","match_date":"2017-10-21","stage_classifiercode":"06-05","member_number":"PEN","first_name":"NICK","last_name":"ALLEN","classification":"U","division":"PCC","hit_factor":6.2731},{"match_name":"Richmond Hot Shots December 5-6-2020 USPSA Pistol","match_date":"2020-12-05","stage_classifiercode":"06-05","member_number":"A114315","first_name":"B. JAMES","last_name":"YEN","classification":"C","division":"PCC","hit_factor":6.2295},{"match_name":"CTASA 3rd Sunday USPSA - March 2018","match_date":"2018-03-18","stage_classifiercode":"06-05","member_number":"A101549","first_name":"KIM","last_name":"HOWERTON","classification":"U","division":"PCC","hit_factor":6.2053},{"match_name":"ORPCI USPSA  Friday  2020.03.20","match_date":"2020-03-20","stage_classifiercode":"06-05","member_number":"FY80376","first_name":"DAN","last_name":"RAINBOLT","classification":"D","division":"PCC","hit_factor":6.1983},{"match_name":"Atlanta Practical Shooters October 2017 USPSA","match_date":"2017-10-01","stage_classifiercode":"06-05","member_number":"TY101602","first_name":"CAROL","last_name":"ODEGAARD","classification":"D","division":"PCC","hit_factor":6.1931},{"match_name":"SWGC USPSA Pistol Match - October 2018","match_date":"2018-10-06","stage_classifiercode":"06-05","member_number":"TY112271","first_name":"NANCY","last_name":"COBERLY","classification":"D","division":"PCC","hit_factor":6.1758},{"match_name":"Idaho ISPS July 16th Beat the Heat Classifier Match","match_date":"2017-07-16","stage_classifiercode":"06-05","member_number":"A95460","first_name":"DAVID","last_name":"CLEVERDON","classification":"D","division":"PCC","hit_factor":6.175},{"match_name":"Laser Ninja Dragon League USPSA April 2018","match_date":"2018-04-08","stage_classifiercode":"06-05","member_number":"A107738","first_name":"VERONICA","last_name":"RODRIGUEZ","classification":"U","division":"PCC","hit_factor":6.1688},{"match_name":"BPSA January 2017 USPSA","match_date":"2017-01-22","stage_classifiercode":"06-05","member_number":"A98482","first_name":"AARON","last_name":"FITZGERALD","classification":"U","division":"PCC","hit_factor":6.1688},{"match_name":"WSPS OCTOBER 2016 SPECIAL CLASSIFIER MATCH","match_date":"2016-10-29","stage_classifiercode":"06-05","member_number":"L3234","first_name":"ROBERT","last_name":"BURKINDINE","classification":"U","division":"PCC","hit_factor":6.135},{"match_name":"USPSA MO19 Lamar September 2017 Special Classifier","match_date":"2017-09-24","stage_classifiercode":"06-05","member_number":"A96267","first_name":"MYLEE","last_name":"CHAMBERLAIN","classification":"D","division":"PCC","hit_factor":6.0837},{"match_name":"WGC WI USPSA Monthly Match 12-15-2018","match_date":"2018-12-15","stage_classifiercode":"06-05","member_number":"TY106771","first_name":"TYRE","last_name":"LUEDKE","classification":"B","division":"PCC","hit_factor":6.08},{"match_name":"WSPS OCTOBER 2016 SPECIAL CLASSIFIER MATCH","match_date":"2016-10-29","stage_classifiercode":"06-05","member_number":"\"\"","first_name":"GRACE","last_name":"LEVY","classification":"U","division":"PCC","hit_factor":6.051},{"match_name":"ARPC USPSA Match 3-25-18","match_date":"2018-03-25","stage_classifiercode":"06-05","member_number":"TY92608","first_name":"JO ANN","last_name":"FISCHER","classification":"Unclassified","division":"PCC","hit_factor":6.0222},{"match_name":"MCAS August 2018 USPSA Match","match_date":"2018-08-18","stage_classifiercode":"06-05","member_number":"TY29750","first_name":"CRAIG","last_name":"BOYD","classification":"B","division":"PCC","hit_factor":5.9937},{"match_name":"WSPS JULY 2016 USPSA","match_date":"2016-07-16","stage_classifiercode":"06-05","member_number":"NA","first_name":"ERIC","last_name":"ROWE","classification":"U","division":"PCC","hit_factor":5.988},{"match_name":"MCPSL Pistol 08-11-2018","match_date":"2018-08-11","stage_classifiercode":"06-05","member_number":"L3778","first_name":"GREG","last_name":"GOYETTE","classification":"U","division":"PCC","hit_factor":5.9574},{"match_name":"RPGi Thursday Night USPSA  February 4th 2021","match_date":"2021-02-03","stage_classifiercode":"06-05","member_number":"A101349","first_name":"DONNA","last_name":"BARNETT","classification":"U","division":"PCC","hit_factor":5.9435},{"match_name":"USPSA MO21 2Alpha SBRC April 2018 Special Classifier","match_date":"2018-04-28","stage_classifiercode":"06-05","member_number":"A22632","first_name":"BILL","last_name":"YEP","classification":"U","division":"PCC","hit_factor":5.9322},{"match_name":"LCSA USPSA June 2017","match_date":"2017-06-10","stage_classifiercode":"06-05","member_number":"a96913","first_name":"CHARLES","last_name":"RODGERS","classification":"U","division":"PCC","hit_factor":5.891},{"match_name":"Chillicothe Sportsmens Club July USPSA","match_date":"2020-07-25","stage_classifiercode":"06-05","member_number":"TY98751","first_name":"AARON","last_name":"HOLLENBECK","classification":"U","division":"PCC","hit_factor":5.8824},{"match_name":"CRGC USPSA Match 10-18-20","match_date":"2020-10-18","stage_classifiercode":"06-05","member_number":"A120101","first_name":"VADIM","last_name":"KOTLYAR","classification":"","division":"PCC","hit_factor":5.8537},{"match_name":"OKCGC USPSA July 2018","match_date":"2018-07-07","stage_classifiercode":"06-05","member_number":"A104670","first_name":"NICK","last_name":"RHOADES","classification":"B","division":"PCC","hit_factor":5.852},{"match_name":"NCPL Sept 2018","match_date":"2018-09-23","stage_classifiercode":"06-05","member_number":"TY109699","first_name":"STEPHANIE","last_name":"CASEY","classification":"U","division":"PCC","hit_factor":5.8347},{"match_name":"TPS USPSA -  September 2018 USPSA","match_date":"2018-09-01","stage_classifiercode":"06-05","member_number":"TY31007","first_name":"LEE","last_name":"SIIRA","classification":"B","division":"PCC","hit_factor":5.8333},{"match_name":"USPSA","match_date":"2018-02-04","stage_classifiercode":"06-05","member_number":"A89904","first_name":"MICHAEL","last_name":"SABIGAN","classification":"D","division":"PCC","hit_factor":5.814},{"match_name":"WSRC USPSA 8/19-20/2017","match_date":"2017-08-19","stage_classifiercode":"06-05","member_number":"a52438","first_name":"DAVE","last_name":"HARTER","classification":"A","division":"PCC","hit_factor":5.7971},{"match_name":"TPS USPSA at CMP May 19 2018","match_date":"2018-05-19","stage_classifiercode":"06-05","member_number":"ty41564","first_name":"ANDERSON","last_name":"BRUCE","classification":"U","division":"PCC","hit_factor":5.7971},{"match_name":"Palmetto Gun Club - Late September 2017 USPSA","match_date":"2017-09-30","stage_classifiercode":"06-05","member_number":"TY70685","first_name":"JOHN","last_name":"RIDGEWAY","classification":"U","division":"PCC","hit_factor":5.7971},{"match_name":"WGC WI USPSA Monthly Match 3-18-17","match_date":"2017-03-18","stage_classifiercode":"06-05","member_number":"A80713","first_name":"SCOTT","last_name":"BRISK","classification":"U","division":"PCC","hit_factor":5.7922},{"match_name":"May 30 2018 A-Zone match","match_date":"2018-05-30","stage_classifiercode":"06-05","member_number":"\"\"","first_name":"KEN PCC","last_name":"RHEE","classification":"\"\"","division":"PCC","hit_factor":5.7065},{"match_name":"Palmetto Gun Club - Late September 2017 USPSA","match_date":"2017-09-30","stage_classifiercode":"06-05","member_number":"\"\"","first_name":"ADAM","last_name":"HUCKABEE","classification":"U","division":"PCC","hit_factor":5.6693},{"match_name":"WGC WI USPSA Monthly Match 12-15-2018","match_date":"2018-12-15","stage_classifiercode":"06-05","member_number":"L4481","first_name":"OUSMANE","last_name":"DIALLO","classification":"C","division":"PCC","hit_factor":5.6478},{"match_name":"Crooked Creek Pistol League - December 2017","match_date":"2017-12-03","stage_classifiercode":"06-05","member_number":"TY75791","first_name":"DAVID","last_name":"GALE","classification":"U","division":"PCC","hit_factor":5.6338},{"match_name":"LdF USPSA Match September 22 2018","match_date":"2018-09-22","stage_classifiercode":"06-05","member_number":"TY46745","first_name":"DANIEL","last_name":"STRAGIER","classification":"U","division":"PCC","hit_factor":5.6239},{"match_name":"OREGON ARPC CC05 USPSA JAN 13 2018","match_date":"2018-01-13","stage_classifiercode":"06-05","member_number":"TY77086","first_name":"AARON","last_name":"GEISLER","classification":"C","division":"PCC","hit_factor":5.6013},{"match_name":"NRG Saturday July 25th - Includes a Classifier Stage","match_date":"2020-07-25","stage_classifiercode":"06-05","member_number":"A125350","first_name":"EDWIN","last_name":"DE LEON","classification":"U","division":"PCC","hit_factor":5.5633},{"match_name":"DSS - USPSA - 21-08-08","match_date":"2021-08-08","stage_classifiercode":"06-05","member_number":"TY108877","first_name":"ADAM","last_name":"LITKE","classification":"B","division":"PCC","hit_factor":5.5409},{"match_name":"CASA USPSA August 2018","match_date":"2018-08-05","stage_classifiercode":"06-05","member_number":"\"\"","first_name":"LOGAN","last_name":"PAYTON","classification":"\"\"","division":"PCC","hit_factor":5.5351},{"match_name":"USPSA","match_date":"2018-02-04","stage_classifiercode":"06-05","member_number":"\"\"","first_name":"CODY","last_name":"UNDERWOOD","classification":"\"\"","division":"PCC","hit_factor":5.5313},{"match_name":"SWGC USPSA Pistol Match - August 2021","match_date":"2021-08-07","stage_classifiercode":"06-05","member_number":"TY106507","first_name":"KEITH","last_name":"NAGELSKI","classification":"B","division":"PCC","hit_factor":5.5288},{"match_name":"USPSA","match_date":"2018-02-04","stage_classifiercode":"06-05","member_number":"A105088","first_name":"JAMES","last_name":"MCKINNY","classification":"U","division":"PCC","hit_factor":5.5096},{"match_name":"ARPC USPSA Match 3-25-18","match_date":"2018-03-25","stage_classifiercode":"06-05","member_number":"A92235","first_name":"BEN","last_name":"KOKOTOVICH","classification":"Unclassified","division":"PCC","hit_factor":5.4795},{"match_name":"ARPC USPSA Match 7-26-20","match_date":"2020-07-26","stage_classifiercode":"06-05","member_number":"TY80998","first_name":"JIM","last_name":"ROTHBARTH","classification":"Unclassified","division":"PCC","hit_factor":5.4363},{"match_name":"RPGi Thursday Night USPSA  February 4th 2021","match_date":"2021-02-03","stage_classifiercode":"06-05","member_number":"A43091","first_name":"DEWAYNE","last_name":"GAINOUS","classification":"C","division":"PCC","hit_factor":5.4226},{"match_name":"SWGC USPSA Pistol Match - August 2021","match_date":"2021-08-07","stage_classifiercode":"06-05","member_number":"TY125781","first_name":"ISAAC","last_name":"HANSEN","classification":"G","division":"PCC","hit_factor":5.3977},{"match_name":"GoShoot Outdoors September 20th","match_date":"2020-09-20","stage_classifiercode":"06-05","member_number":"A78293","first_name":"STEPHEN","last_name":"GENTER","classification":"U","division":"PCC","hit_factor":5.3973},{"match_name":"USPSA MCTS Dickson 01.14.17","match_date":"2017-01-14","stage_classifiercode":"06-05","member_number":"\"\"","first_name":"MARK","last_name":"STEVENS","classification":"U","division":"PCC","hit_factor":5.3748},{"match_name":"MPSA 050617 Classifier Match","match_date":"2017-05-06","stage_classifiercode":"06-05","member_number":"TY78084","first_name":"ROBERT","last_name":"FOIL","classification":"D","division":"PCC","hit_factor":5.3672},{"match_name":"CSA Annual Classifier Classic","match_date":"2018-03-18","stage_classifiercode":"06-05","member_number":"A88677","first_name":"MICHELE","last_name":"SARGENT","classification":"U","division":"PCC","hit_factor":5.3375},{"match_name":"CASA USPSA August 2018","match_date":"2018-08-05","stage_classifiercode":"06-05","member_number":"TY96041","first_name":"ERNIE","last_name":"DECKER","classification":"C","division":"PCC","hit_factor":5.3333},{"match_name":"FBURG April 2021 Level I USPSA ","match_date":"2021-04-03","stage_classifiercode":"06-05","member_number":"L4987","first_name":"SOPHIA","last_name":"BYRUM","classification":"D","division":"PCC","hit_factor":5.3254},{"match_name":"GPS  May 2017","match_date":"2017-05-28","stage_classifiercode":"06-05","member_number":"ty79554","first_name":"MICHAEL","last_name":"YAP","classification":"D","division":"PCC","hit_factor":5.3097},{"match_name":"MCAS August 2018 USPSA Match","match_date":"2018-08-18","stage_classifiercode":"06-05","member_number":"A112019","first_name":"AME","last_name":"SCHANK NEWMAN","classification":"U","division":"PCC","hit_factor":5.2999},{"match_name":"TAC2 USPSA Sept 2018","match_date":"2018-09-01","stage_classifiercode":"06-05","member_number":"A79183","first_name":"TIFFANY","last_name":"KINSLER","classification":"U","division":"PCC","hit_factor":5.2851},{"match_name":"USPSA MO21 2Alpha SBRC April 2018 Special Classifier","match_date":"2018-04-28","stage_classifiercode":"06-05","member_number":"A76279","first_name":"TIM","last_name":"QUIRARTE","classification":"U","division":"PCC","hit_factor":5.2718},{"match_name":"WGC June 2018 USPSA 2","match_date":"2018-06-24","stage_classifiercode":"06-05","member_number":"A80843","first_name":"T.C.","last_name":"TRICHEL","classification":"C","division":"PCC","hit_factor":5.2701},{"match_name":"XMG USPSA   August 07 2021","match_date":"2021-08-07","stage_classifiercode":"06-05","member_number":"A125269","first_name":"SCOTT","last_name":"BROMLEY","classification":"U","division":"PCC","hit_factor":5.2265},{"match_name":"Belton Gun Club USPSA March Classifier MATCH 3-7-21","match_date":"2021-03-07","stage_classifiercode":"06-05","member_number":"A127606","first_name":"HERNAN","last_name":"DELGADO","classification":"A","division":"PCC","hit_factor":5.2083},{"match_name":"Palmetto Gun Club - Late September 2017 USPSA","match_date":"2017-09-30","stage_classifiercode":"06-05","member_number":"A103883","first_name":"ERIC","last_name":"FRIAR","classification":"U","division":"PCC","hit_factor":5.1948},{"match_name":"NW01 March Madness 17","match_date":"2017-03-12","stage_classifiercode":"06-05","member_number":"L465","first_name":"TOM","last_name":"KETTELLS","classification":"U","division":"PCC","hit_factor":5.1802},{"match_name":"ORSA USPSA October 2017","match_date":"2017-10-21","stage_classifiercode":"06-05","member_number":"A23755","first_name":"RAY","last_name":"ZILLICK","classification":"U","division":"PCC","hit_factor":5.1447},{"match_name":"YMM  IPSC02 2018_02_11","match_date":"2018-02-11","stage_classifiercode":"06-05","member_number":"TY63399","first_name":"JOHNNIE","last_name":"CADY","classification":"\"\"","division":"PCC","hit_factor":5.0992},{"match_name":"SCPS ECO19 9/25/2020","match_date":"2020-09-25","stage_classifiercode":"06-05","member_number":"TY41573","first_name":"CRAIG","last_name":"CALKINS","classification":"M","division":"PCC","hit_factor":5.098},{"match_name":"NRG Saturday March 10th- Includes a Classifier Stage","match_date":"2018-03-10","stage_classifiercode":"06-05","member_number":"L3251","first_name":"BUDDY","last_name":"BAUTISTA","classification":"U","division":"PCC","hit_factor":5.0817},{"match_name":"LCSA USPSA June 2017","match_date":"2017-06-10","stage_classifiercode":"06-05","member_number":"a82693","first_name":"LINDA","last_name":"DORISIO","classification":"U","division":"PCC","hit_factor":5.0314},{"match_name":"BPSA January 2017 USPSA","match_date":"2017-01-22","stage_classifiercode":"06-05","member_number":"A99640","first_name":"TREY","last_name":"NICHOLSON","classification":"U","division":"PCC","hit_factor":5.0314},{"match_name":"MPSA 050617 Classifier Match","match_date":"2017-05-06","stage_classifiercode":"06-05","member_number":"TY94846","first_name":"RUTH","last_name":"MAHLEY","classification":"U","division":"PCC","hit_factor":5.0251},{"match_name":"Richmond Hot Shots December 5-6-2020 USPSA Pistol","match_date":"2020-12-05","stage_classifiercode":"06-05","member_number":"FY121894","first_name":"ENG","last_name":"LIM","classification":"U","division":"PCC","hit_factor":4.9875},{"match_name":"LPRGC - Lower Providence USPSA September 2017","match_date":"2017-09-02","stage_classifiercode":"06-05","member_number":"FY44402","first_name":"NOAH","last_name":"GLADSTONE","classification":"U","division":"PCC","hit_factor":4.9869},{"match_name":"Prescott 1st Saturday USPSA 4-7-18","match_date":"2018-04-07","stage_classifiercode":"06-05","member_number":"L3243","first_name":"PETE","last_name":"CONNAL","classification":"C","division":"PCC","hit_factor":4.9793},{"match_name":"Hampden RPC July USPSA Match","match_date":"2018-07-08","stage_classifiercode":"06-05","member_number":"TY84597","first_name":"NORMAN","last_name":"DAVIS","classification":"C","division":"PCC","hit_factor":4.9356},{"match_name":"Laser Ninja Dragon League USPSA April 2018","match_date":"2018-04-08","stage_classifiercode":"06-05","member_number":"\"\"","first_name":"JADEN","last_name":"HAYNES","classification":"U","division":"PCC","hit_factor":4.8855},{"match_name":"WVRPC USPSA 1APR2017 CLASSIFIER","match_date":"2017-04-01","stage_classifiercode":"06-05","member_number":"\"\"","first_name":"DAVID","last_name":"REPPERT","classification":"U","division":"PCC","hit_factor":4.8662},{"match_name":"USPSA MO21 2Alpha SBRC April 2018 Special Classifier","match_date":"2018-04-28","stage_classifiercode":"06-05","member_number":"A98119","first_name":"STEVE","last_name":"VESTAL","classification":"U","division":"PCC","hit_factor":4.8527},{"match_name":"Laser Ninja Dragon League USPSA July 2nd Special Classifier","match_date":"2017-07-02","stage_classifiercode":"06-05","member_number":"A104287","first_name":"ALLEN","last_name":"SMITH","classification":"U","division":"PCC","hit_factor":4.8368},{"match_name":"LIPSA - November 5th 2017 - USPSA Special Classifier Match","match_date":"2017-11-05","stage_classifiercode":"06-05","member_number":"A36143","first_name":"ARTHUR","last_name":"SEARCH","classification":"U","division":"PCC","hit_factor":4.8257},{"match_name":"AREA 59  SPRING ALL CLASSIFIER","match_date":"2018-03-31","stage_classifiercode":"06-05","member_number":"L2998","first_name":"GARY","last_name":"WU","classification":"U","division":"PCC","hit_factor":4.8223},{"match_name":"NRG Saturday April 10th Includes a Classifier Stage","match_date":"2021-04-10","stage_classifiercode":"06-05","member_number":"A79600","first_name":"CYNTHIA","last_name":"HERPIN","classification":"C","division":"PCC","hit_factor":4.8027},{"match_name":"RPGi Thursday Night USPSA  February 4th 2021","match_date":"2021-02-03","stage_classifiercode":"06-05","member_number":"A132560","first_name":"MADELYN","last_name":"ROEDEL","classification":"U","division":"PCC","hit_factor":4.7486},{"match_name":"Danville Rifle and Pistol Club USPSA IL17 June 16 2018","match_date":"2018-06-16","stage_classifiercode":"06-05","member_number":"na","first_name":"MICHAEL","last_name":"PALMER","classification":"U","division":"PCC","hit_factor":4.7091},{"match_name":"Palmetto Gun Club - Late September 2017 USPSA","match_date":"2017-09-30","stage_classifiercode":"06-05","member_number":"\"\"","first_name":"ROY","last_name":"FREEMAN","classification":"U","division":"PCC","hit_factor":4.6243},{"match_name":"RL Classifier","match_date":"2017-04-30","stage_classifiercode":"06-05","member_number":"\"\"","first_name":"JOSE","last_name":"UBINAS","classification":"U","division":"PCC","hit_factor":4.5949},{"match_name":"INAS USPSA Aug 2017","match_date":"2017-08-12","stage_classifiercode":"06-05","member_number":"A12478","first_name":"ROBERT","last_name":"CLAIR","classification":"U","division":"PCC","hit_factor":4.5673},{"match_name":"ARPC USPSA Match 3-25-18","match_date":"2018-03-25","stage_classifiercode":"06-05","member_number":"TY57677","first_name":"JOE","last_name":"SHADDUCK","classification":"Unclassified","division":"PCC","hit_factor":4.5649},{"match_name":"DSSA 2020-06  USPSA Pistol","match_date":"2020-06-28","stage_classifiercode":"06-05","member_number":"A126077","first_name":"JORDAN","last_name":"MARTIN","classification":"D","division":"PCC","hit_factor":4.5519},{"match_name":"RMAP 3rd  Sunday September 2016","match_date":"2016-09-18","stage_classifiercode":"06-05","member_number":"A77620","first_name":"RON","last_name":"BEDA","classification":"U","division":"PCC","hit_factor":4.5455},{"match_name":"FBURG April 2021 Level I USPSA ","match_date":"2021-04-03","stage_classifiercode":"06-05","member_number":"L2985","first_name":"KEVIN","last_name":"GREELEY","classification":"A","division":"PCC","hit_factor":4.5226},{"match_name":"RPGi Thursday Night USPSA  February 4th 2021","match_date":"2021-02-03","stage_classifiercode":"06-05","member_number":"FY97931","first_name":"SCOTT","last_name":"NEWNAM","classification":"B","division":"PCC","hit_factor":4.497},{"match_name":"PTPC October 4th USPSA","match_date":"2020-10-04","stage_classifiercode":"06-05","member_number":"TY99997","first_name":"CULLY","last_name":"POTTS","classification":"C","division":"PCC","hit_factor":4.4386},{"match_name":"WGC June 2018 USPSA 2","match_date":"2018-06-24","stage_classifiercode":"06-05","member_number":"TY50501","first_name":"BERNIE","last_name":"MCHUGH","classification":"M","division":"PCC","hit_factor":4.4177},{"match_name":"CSA Annual Classifier Classic","match_date":"2018-03-18","stage_classifiercode":"06-05","member_number":"A88677","first_name":"MICHELE","last_name":"SARGENT","classification":"U","division":"PCC","hit_factor":4.4164},{"match_name":"USPSA Strategic Edge SEGR July 17th 2021 Classifier Match","match_date":"2021-07-17","stage_classifiercode":"06-05","member_number":"A132716","first_name":"STEVE","last_name":"LEADY","classification":"U","division":"PCC","hit_factor":4.415},{"match_name":"CFRPC USPSA 2017 JULY","match_date":"2017-07-16","stage_classifiercode":"06-05","member_number":"L3973","first_name":"MIKE","last_name":"WILLIAMS","classification":"C","division":"PCC","hit_factor":4.3551},{"match_name":"DWB - Deadwood Boys USPSA August 6 2017","match_date":"2017-08-06","stage_classifiercode":"06-05","member_number":"\"\"","first_name":"EDDIE","last_name":"ESGUERRA","classification":"U","division":"PCC","hit_factor":4.3531},{"match_name":"Springfield Tactical Shooters 04/01/2021","match_date":"2021-04-01","stage_classifiercode":"06-05","member_number":"FY83614","first_name":"GARY","last_name":"GRAY","classification":"B","division":"PCC","hit_factor":4.3367},{"match_name":"OFGC USPSA Match 8-15-21","match_date":"2021-08-15","stage_classifiercode":"06-05","member_number":"A127396","first_name":"JOSHUA","last_name":"SMITH","classification":"B","division":"PCC","hit_factor":4.2649},{"match_name":"ARPC USPSA Match 7-25-21","match_date":"2021-07-25","stage_classifiercode":"06-05","member_number":"FY58864","first_name":"KIMBERLY","last_name":"BAUMAN","classification":"Unclassified","division":"PCC","hit_factor":4.2082},{"match_name":"ORPCI USPSA Saturday 2018.08.18","match_date":"2018-08-18","stage_classifiercode":"06-05","member_number":"\"\"","first_name":"STEVE","last_name":"SCHMITT","classification":"\"\"","division":"PCC","hit_factor":4.1081},{"match_name":"Hopkinton USPSA July 2018","match_date":"2018-07-07","stage_classifiercode":"06-05","member_number":"L4396","first_name":"CURT","last_name":"CASERTA","classification":"A","division":"PCC","hit_factor":4.1026},{"match_name":"YMM  IPSC02 2018_02_11","match_date":"2018-02-11","stage_classifiercode":"06-05","member_number":"L2865","first_name":"EARL","last_name":"JULL","classification":"B","division":"PCC","hit_factor":4.0495},{"match_name":"WAC May 30th (5th Saturday) - USPSA 6 Stage Classifier Match","match_date":"2020-05-30","stage_classifiercode":"06-05","member_number":"A99861","first_name":"ED","last_name":"ALABE","classification":"U","division":"PCC","hit_factor":4.0388},{"match_name":"USPSA MO21 2Alpha SBRC April 2018 Special Classifier","match_date":"2018-04-28","stage_classifiercode":"06-05","member_number":"\"\"","first_name":"ROBERT","last_name":"NORTHCUTT","classification":"U","division":"PCC","hit_factor":4.0084},{"match_name":"AAPS AAFG Special Classifier Match - March 31 2018","match_date":"2018-03-31","stage_classifiercode":"06-05","member_number":"A105504","first_name":"CHRIS","last_name":"SHAFER","classification":"U","division":"PCC","hit_factor":3.9106},{"match_name":"WAC May 30th (5th Saturday) - USPSA 6 Stage Classifier Match","match_date":"2020-05-30","stage_classifiercode":"06-05","member_number":"A122690","first_name":"NESTOR","last_name":"CRUDA","classification":"U","division":"PCC","hit_factor":3.8369},{"match_name":"ENPS Late September 2018 USPSA Match","match_date":"2018-09-30","stage_classifiercode":"06-05","member_number":"A91960","first_name":"RODNEY","last_name":"DEWEY","classification":"U","division":"PCC","hit_factor":3.7627},{"match_name":"NRG Saturday March 10th- Includes a Classifier Stage","match_date":"2018-03-10","stage_classifiercode":"06-05","member_number":"L3692","first_name":"ANDREW","last_name":"CATBAGAN","classification":"A","division":"PCC","hit_factor":3.6965},{"match_name":"RMAP 3rd  Sunday September 2016","match_date":"2016-09-18","stage_classifiercode":"06-05","member_number":"TY63687","first_name":"DAN","last_name":"NEWTON","classification":"U","division":"PCC","hit_factor":3.5789},{"match_name":"DWB - Deadwood Boys USPSA August 6 2017","match_date":"2017-08-06","stage_classifiercode":"06-05","member_number":"a26171","first_name":"JOEY","last_name":"CASTILLO","classification":"C","division":"PCC","hit_factor":3.5305},{"match_name":"RSPP 3rd Saturday January 2017","match_date":"2017-01-21","stage_classifiercode":"06-05","member_number":"TY46374","first_name":"LARRY","last_name":"STOKES","classification":"U","division":"PCC","hit_factor":3.4959},{"match_name":"WSPS JULY 2016 USPSA","match_date":"2016-07-16","stage_classifiercode":"06-05","member_number":"A96485","first_name":"CHRISTOPHER","last_name":"LUCAS","classification":"U","division":"PCC","hit_factor":3.4072},{"match_name":"CSA Annual Classifier Classic","match_date":"2018-03-18","stage_classifiercode":"06-05","member_number":"A92696","first_name":"BJ","last_name":"MILLER","classification":"D","division":"PCC","hit_factor":3.4043},{"match_name":"May 30 2018 A-Zone match","match_date":"2018-05-30","stage_classifiercode":"06-05","member_number":"A95407","first_name":"DEVIN","last_name":"HARRIS","classification":"U","division":"PCC","hit_factor":3.2888},{"match_name":"LdF USPSA Match September 22 2018","match_date":"2018-09-22","stage_classifiercode":"06-05","member_number":"A66294","first_name":"DAVID","last_name":"NUNLEY","classification":"U","division":"PCC","hit_factor":3.1873},{"match_name":"ORPCI 2018.03.31 USPSA Special","match_date":"2018-03-31","stage_classifiercode":"06-05","member_number":"\"\"","first_name":"JEFF","last_name":"RUSSELL","classification":"U","division":"PCC","hit_factor":3.164},{"match_name":"ORSA USPSA October 2017","match_date":"2017-10-21","stage_classifiercode":"06-05","member_number":"NA","first_name":"RUSTY","last_name":"LAVERY","classification":"U","division":"PCC","hit_factor":3.1607},{"match_name":"SAPSA December 2017","match_date":"2017-12-16","stage_classifiercode":"06-05","member_number":"A69229","first_name":"CHARLIE","last_name":"NELSON","classification":"C","division":"PCC","hit_factor":3.0534},{"match_name":"RSPP 3rd Saturday January 2017","match_date":"2017-01-21","stage_classifiercode":"06-05","member_number":"A49709","first_name":"JOHN","last_name":"BRINJAK","classification":"U","division":"PCC","hit_factor":2.8962},{"match_name":"Steel City USPSA September 5 2020","match_date":"2020-09-04","stage_classifiercode":"06-05","member_number":"FY97762","first_name":"PAUL","last_name":"HEDGEPATH","classification":"U","division":"PCC","hit_factor":2.8731},{"match_name":"Atlanta Practical Shooters October 2017 PCC USPSA Match","match_date":"2017-09-30","stage_classifiercode":"06-05","member_number":"A54465","first_name":"ROB","last_name":"ROMERO","classification":"M","division":"PCC","hit_factor":2.8401},{"match_name":"Palmetto Gun Club - Late September 2017 USPSA","match_date":"2017-09-30","stage_classifiercode":"06-05","member_number":"\"\"","first_name":"BRENT","last_name":"STOVER","classification":"U","division":"PCC","hit_factor":2.7907},{"match_name":"LCHG May USPSA","match_date":"2017-05-21","stage_classifiercode":"06-05","member_number":"\"\"","first_name":"COREEN","last_name":"HASH","classification":"U","division":"PCC","hit_factor":2.6393},{"match_name":"Oakdale USPSA MN07 7-22-2021","match_date":"2021-07-22","stage_classifiercode":"06-05","member_number":"A113541","first_name":"DAN","last_name":"LLOYD","classification":"U","division":"PCC","hit_factor":2.5367},{"match_name":"OREGON ARPC CC05 USPSA JAN 13 2018","match_date":"2018-01-13","stage_classifiercode":"06-05","member_number":"A53230","first_name":"WALTER","last_name":"SCHOLL","classification":"U","division":"PCC","hit_factor":2.5341},{"match_name":"USPSA","match_date":"2018-02-04","stage_classifiercode":"06-05","member_number":"\"\"","first_name":"DENISE","last_name":"UNDERWOOD","classification":"\"\"","division":"PCC","hit_factor":2.4708},{"match_name":"RPGi Thursday Night USPSA  February 4th 2021","match_date":"2021-02-03","stage_classifiercode":"06-05","member_number":"TY108019","first_name":"JEFF","last_name":"SCHWARTZ","classification":"U","division":"PCC","hit_factor":2.4555},{"match_name":"LCHG NR08 USPSA July 2018","match_date":"2018-07-14","stage_classifiercode":"06-05","member_number":"A110107","first_name":"JEREMY","last_name":"CHVILICEK","classification":"U","division":"PCC","hit_factor":2.4079},{"match_name":"Chillicothe Sportsmens Club July USPSA","match_date":"2020-07-25","stage_classifiercode":"06-05","member_number":"TY88078","first_name":"JOHN","last_name":"CAGAOAN","classification":"B","division":"PCC","hit_factor":2.3456},{"match_name":"SSS USPSA October 2020 Match","match_date":"2020-10-18","stage_classifiercode":"06-05","member_number":"TY98542","first_name":"BARRON","last_name":"SMITH","classification":"A (A Class)","division":"PCC","hit_factor":2.3447},{"match_name":"TGC November USPSA","match_date":"2016-11-20","stage_classifiercode":"06-05","member_number":"a75201","first_name":"KEN","last_name":"SYDOW","classification":"D","division":"PCC","hit_factor":2.3419},{"match_name":"LCSC Classifier 042918","match_date":"2018-04-28","stage_classifiercode":"06-05","member_number":"A3501","first_name":"JOHN","last_name":"HERNDON","classification":"C","division":"PCC","hit_factor":2.2392},{"match_name":"ORPCI USPSA Saturday 21.05.15","match_date":"2021-05-15","stage_classifiercode":"06-05","member_number":"A108362","first_name":"SCOTT","last_name":"SASSER","classification":"","division":"PCC","hit_factor":2.2222},{"match_name":"Chillicothe Sportsmens Club September USPSA","match_date":"2021-09-25","stage_classifiercode":"06-05","member_number":"A125065","first_name":"REKA","last_name":"NELSON","classification":"D","division":"PCC","hit_factor":2.1906},{"match_name":"CSA Annual Classifier Classic","match_date":"2018-03-18","stage_classifiercode":"06-05","member_number":"TY90467","first_name":"JEFF","last_name":"WOODS","classification":"C","division":"PCC","hit_factor":2.1526},{"match_name":"Space Coast Practical Shooters","match_date":"2018-09-01","stage_classifiercode":"06-05","member_number":"A56832","first_name":"DONALD","last_name":"PODSIADLO","classification":"C","division":"PCC","hit_factor":1.9093},{"match_name":"MPPL 20210807","match_date":"2021-08-07","stage_classifiercode":"06-05","member_number":"FY135601","first_name":"ISAAC","last_name":"YOSHIMORI","classification":"U","division":"PCC","hit_factor":1.8908},{"match_name":"CSA Annual Classifier Classic","match_date":"2018-03-18","stage_classifiercode":"06-05","member_number":"TY8880","first_name":"GENE","last_name":"RICHMOND","classification":"C","division":"PCC","hit_factor":1.7327},{"match_name":"Laser Ninja Dragon League USPSA April 2018","match_date":"2018-04-08","stage_classifiercode":"06-05","member_number":"\"\"","first_name":"DAWN","last_name":"PETRONELLA","classification":"U","division":"PCC","hit_factor":1.703},{"match_name":"GPSL 5-2-2017","match_date":"2017-05-02","stage_classifiercode":"06-05","member_number":"A99407","first_name":"TREY","last_name":"WOOD","classification":"U","division":"PCC","hit_factor":1.6949},{"match_name":"TAC2 USPSA Sept 2018","match_date":"2018-09-01","stage_classifiercode":"06-05","member_number":"TY96579","first_name":"DWIGHT","last_name":"RAINES","classification":"U","division":"PCC","hit_factor":1.6461},{"match_name":"Mesquite Mayhem Monthly USPSA Match","match_date":"2021-01-10","stage_classifiercode":"06-05","member_number":"A78467","first_name":"LYNDA","last_name":"TURNBULL","classification":"A","division":"PCC","hit_factor":1.6447},{"match_name":"MCAS August 2018 USPSA Match","match_date":"2018-08-18","stage_classifiercode":"06-05","member_number":"\"\"","first_name":"ADAM","last_name":"BELL","classification":"U","division":"PCC","hit_factor":1.5267},{"match_name":"ORPCI USPSA Saturday 21.05.15","match_date":"2021-05-15","stage_classifiercode":"06-05","member_number":"TY54870","first_name":"JEFF","last_name":"RUSSEL","classification":"","division":"PCC","hit_factor":1.5086},{"match_name":"RSPP 3rd Saturday January 2017","match_date":"2017-01-21","stage_classifiercode":"06-05","member_number":"TY65635","first_name":"CHRIS","last_name":"COLLINS","classification":"U","division":"PCC","hit_factor":1.2365},{"match_name":"DSS - USPSA - 21-08-08","match_date":"2021-08-08","stage_classifiercode":"06-05","member_number":"A117995","first_name":"CALVIN","last_name":"PACK","classification":"B","division":"PCC","hit_factor":1.0932},{"match_name":"Richmond Hot Shots December 5-6-2020 USPSA Pistol","match_date":"2020-12-05","stage_classifiercode":"06-05","member_number":"FY121417","first_name":"MAKANA","last_name":"ROYAL","classification":"U","division":"PCC","hit_factor":0.7225},{"match_name":"Laser Ninja Dragon League USPSA April 2018","match_date":"2018-04-08","stage_classifiercode":"06-05","member_number":"\"\"","first_name":"CAMERON","last_name":"PETRONELLA","classification":"U","division":"PCC","hit_factor":0.6752},{"match_name":"NW01 March Madness 17","match_date":"2017-03-12","stage_classifiercode":"06-05","member_number":"A42954","first_name":"NEAL","last_name":"KNUDSON","classification":"U","division":"PCC","hit_factor":0.443},{"match_name":"Shoot GTR Mini Match 07/10/2018","match_date":"2018-07-10","stage_classifiercode":"06-05","member_number":"A101882","first_name":"JOHN","last_name":"RYNK","classification":"U","division":"PCC","hit_factor":0.3687}]