[{"match_name":"GMPS 5/7/17","match_date":"2017-05-06","stage_classifiercode":"99-12","member_number":"A67962","first_name":"MAC","last_name":"CASHIN","classification":"M","division":"LIMITED","hit_factor":9.9115},{"match_name":"ORSA USPSA October 2016","match_date":"2016-10-15","stage_classifiercode":"99-12","member_number":"A76603","first_name":"TYLER","last_name":"INGRAM","classification":"M","division":"LIMITED","hit_factor":9.8522},{"match_name":"Emmett September Match","match_date":"2016-09-24","stage_classifiercode":"99-12","member_number":"TY82856","first_name":"JOHN","last_name":"KITSON","classification":"G","division":"LIMITED","hit_factor":9.661},{"match_name":"ECPS February 28th USPSA Pistol Match","match_date":"2016-02-28","stage_classifiercode":"99-12","member_number":"TY39081","first_name":"ROB","last_name":"JESSEE","classification":"G","division":"LIMITED","hit_factor":8.7662},{"match_name":"Richmond Hot Shots February 7-2016 USPSA Match","match_date":"2016-02-07","stage_classifiercode":"99-12","member_number":"L3809","first_name":"GREG","last_name":"FIDDES","classification":"M","division":"LIMITED","hit_factor":8.7097},{"match_name":"ENPS May 2018 USPSA Match","match_date":"2018-05-06","stage_classifiercode":"99-12","member_number":"A98625","first_name":"LANE","last_name":"GRIES","classification":"M","division":"LIMITED","hit_factor":8.6655},{"match_name":"Hosemasters  3rd Sunday Feburary 2017","match_date":"2017-02-12","stage_classifiercode":"99-12","member_number":"A77066","first_name":"MARCELO","last_name":"MARIANO III","classification":"A","division":"LIMITED","hit_factor":8.6207},{"match_name":"Griffin USPSA Match Aug 2017","match_date":"2017-08-19","stage_classifiercode":"99-12","member_number":"L3119","first_name":"JOHN","last_name":"BROWNING","classification":"G","division":"LIMITED","hit_factor":8.5537},{"match_name":"SSP Super Classifier 1-30-16","match_date":"2016-01-30","stage_classifiercode":"99-12","member_number":"A60102","first_name":"JOHN","last_name":"MCCLAIN","classification":"M","division":"LIMITED","hit_factor":8.5496},{"match_name":"Atlanta Practical Shooters March 2016 USPSA - Classifier Match","match_date":"2016-03-06","stage_classifiercode":"99-12","member_number":"TY-54465","first_name":"ROB","last_name":"ROMERO","classification":"G","division":"LIMITED","hit_factor":8.5246},{"match_name":"Richmond Hot Shots USPSA Classifier Match Sat April 8-2017","match_date":"2017-04-08","stage_classifiercode":"99-12","member_number":"TY44130","first_name":"SEBASTIAO","last_name":"FILHO","classification":"M","division":"LIMITED","hit_factor":8.4829},{"match_name":"Richmond Hot Shots February 7-2016 USPSA Match","match_date":"2016-02-07","stage_classifiercode":"99-12","member_number":"TY36021","first_name":"TODD","last_name":"CROW","classification":"M","division":"LIMITED","hit_factor":8.4553},{"match_name":"Payson Practical Pistol Sept 03 2016","match_date":"2016-09-03","stage_classifiercode":"99-12","member_number":"A77066","first_name":"MARCELO","last_name":"MARIANO III","classification":"A","division":"LIMITED","hit_factor":8.4337},{"match_name":"SCCPSA USPSA Mar 17","match_date":"2018-03-17","stage_classifiercode":"99-12","member_number":"TY69262","first_name":"AJ","last_name":"STUART","classification":"M","division":"LIMITED","hit_factor":8.4034},{"match_name":"Collin County USPSA Nov. 27 2016","match_date":"2016-11-25","stage_classifiercode":"99-12","member_number":"TY87720","first_name":"STEPHEN","last_name":"LIMOGES","classification":"M","division":"LIMITED","hit_factor":8.3601},{"match_name":"OFGC USPSA Match Feb 19th 2017","match_date":"2017-02-19","stage_classifiercode":"99-12","member_number":"TY89171","first_name":"AUSTIN","last_name":"CHAMBERLAIN","classification":"A","division":"LIMITED","hit_factor":8.2849},{"match_name":"TAC2 USPSA August 2017","match_date":"2017-08-05","stage_classifiercode":"99-12","member_number":"A76179","first_name":"WESTON 2G","last_name":"HENSLEY","classification":"U","division":"LIMITED","hit_factor":8.2671},{"match_name":"AIPS  USPSA Monthly 12 November 2016","match_date":"2016-11-12","stage_classifiercode":"99-12","member_number":"TY76605","first_name":"MARK","last_name":"MCCARNEY","classification":"A","division":"LIMITED","hit_factor":8.2148},{"match_name":"PIPS 06-14-2017","match_date":"2017-06-14","stage_classifiercode":"99-12","member_number":"A70399","first_name":"BRAD","last_name":"OLSON","classification":"A","division":"LIMITED","hit_factor":8.1994},{"match_name":"FBURG April 2017 Level I USPSA ","match_date":"2017-04-01","stage_classifiercode":"99-12","member_number":"A72195","first_name":"RYAN","last_name":"CLEMENTS","classification":"M","division":"LIMITED","hit_factor":8.1845},{"match_name":"OK15 USPSA at USSA","match_date":"2017-12-10","stage_classifiercode":"99-12","member_number":"TY82278","first_name":"ROWDY","last_name":"BRICCO","classification":"A","division":"LIMITED","hit_factor":8.1241},{"match_name":"Nampa USPSA February 1st","match_date":"2020-02-01","stage_classifiercode":"99-12","member_number":"TY85985","first_name":"CHRISTOPHER","last_name":"COLLINS","classification":"M","division":"LIMITED","hit_factor":8.1123},{"match_name":"Richmond Hot Shots February 7-2016 USPSA Match","match_date":"2016-02-07","stage_classifiercode":"99-12","member_number":"TY61590","first_name":"BRIAN","last_name":"FRENCH","classification":"M","division":"LIMITED","hit_factor":8.0997},{"match_name":"USPSA MO21 Special Classifier 2Alpha SBRC February 27 2021","match_date":"2021-02-27","stage_classifiercode":"99-12","member_number":"A49382","first_name":"BRENDAN","last_name":"NANGLE","classification":"A","division":"LIMITED","hit_factor":8.0952},{"match_name":"Shongum April 2017 USPSA Match","match_date":"2017-04-01","stage_classifiercode":"99-12","member_number":"TY77141","first_name":"KEN (LOUIE)","last_name":"PRIMERO","classification":"A","division":"LIMITED","hit_factor":8.0175},{"match_name":"FBPPC DECEMBER 2016 SPECIAL CLASSIFIER MATCH","match_date":"2016-12-10","stage_classifiercode":"99-12","member_number":"A98343","first_name":"JESUS","last_name":"MUNIZ","classification":"U","division":"LIMITED","hit_factor":7.9764},{"match_name":"Hosemasters  3rd Sunday Feburary 2017","match_date":"2017-02-12","stage_classifiercode":"99-12","member_number":"A35327","first_name":"KELLY","last_name":"NEAL","classification":"GM","division":"LIMITED","hit_factor":7.9491},{"match_name":"EWPSA 2016-04","match_date":"2016-04-17","stage_classifiercode":"99-12","member_number":"ty49461","first_name":"DAVID","last_name":"BLOSSER","classification":"M","division":"LIMITED","hit_factor":7.9288},{"match_name":"USPSA MO21 Special Classifier 2Alpha SBRC February 27 2021","match_date":"2021-02-27","stage_classifiercode":"99-12","member_number":"TY49960","first_name":"SHANE","last_name":"RICHARDS","classification":"B","division":"LIMITED","hit_factor":7.9235},{"match_name":"XMG USPSA   Saturday September  4th 2021","match_date":"2021-09-04","stage_classifiercode":"99-12","member_number":"Ty59751","first_name":"KENNETH","last_name":"NAFFZIGER","classification":"M","division":"LIMITED","hit_factor":7.8621},{"match_name":"OFGC USPSA Match 10-21-18","match_date":"2018-10-21","stage_classifiercode":"99-12","member_number":"A99926","first_name":"CARL","last_name":"CLITES","classification":"A","division":"LIMITED","hit_factor":7.8431},{"match_name":"Richmond Hot Shots February 7-2016 USPSA Match","match_date":"2016-02-07","stage_classifiercode":"99-12","member_number":"TY74150","first_name":"CHRISTOPHER","last_name":"COLRIDGE","classification":"A","division":"LIMITED","hit_factor":7.8303},{"match_name":"Laser Ninja Dragon League USPSA August 2017","match_date":"2017-08-06","stage_classifiercode":"99-12","member_number":"A93137","first_name":"BILLY","last_name":"DODSON","classification":"M","division":"LIMITED","hit_factor":7.7273},{"match_name":"LdF 4th Saturday Match","match_date":"2016-01-23","stage_classifiercode":"99-12","member_number":"FY63382","first_name":"MICHAEL","last_name":"SUEDA","classification":"M","division":"LIMITED","hit_factor":7.7135},{"match_name":"Richmond Hot Shots February 7-2016 USPSA Match","match_date":"2016-02-07","stage_classifiercode":"99-12","member_number":"TY63012","first_name":"MANUEL","last_name":"NEWMAN","classification":"M","division":"LIMITED","hit_factor":7.6923},{"match_name":"Atlanta Practical Shooters March 2016 USPSA - Classifier Match","match_date":"2016-03-06","stage_classifiercode":"99-12","member_number":"L3864","first_name":"VINCENT","last_name":"PAINTER","classification":"B","division":"LIMITED","hit_factor":7.6818},{"match_name":"BRC_20170611","match_date":"2017-06-11","stage_classifiercode":"99-12","member_number":"A67134","first_name":"KIRK","last_name":"WILSON","classification":"A","division":"LIMITED","hit_factor":7.6389},{"match_name":"DWB - Deadwood Boys USPSA 18 February 2018","match_date":"2018-02-18","stage_classifiercode":"99-12","member_number":"a61891","first_name":"PERRY","last_name":"VERZOSA","classification":"A","division":"LIMITED","hit_factor":7.6149},{"match_name":"12-19-18 MISS Match","match_date":"2018-12-19","stage_classifiercode":"99-12","member_number":"FY80219","first_name":"MAX","last_name":"KLATT","classification":"M","division":"LIMITED","hit_factor":7.6106},{"match_name":"TPS USPSA - September 2016 - Talon Range","match_date":"2016-09-03","stage_classifiercode":"99-12","member_number":"n/a","first_name":"SHEPARD","last_name":"BRUNER","classification":"X","division":"LIMITED","hit_factor":7.604},{"match_name":"Laser Ninja Dragon League USPSA August 2017","match_date":"2017-08-06","stage_classifiercode":"99-12","member_number":"A72356","first_name":"CHARLIE","last_name":"BARRY","classification":"B","division":"LIMITED","hit_factor":7.5893},{"match_name":"AAPS AAFG Special Classifier Match - March 31 2018","match_date":"2018-03-31","stage_classifiercode":"99-12","member_number":"A103667","first_name":"KEANU","last_name":"SY","classification":"A","division":"LIMITED","hit_factor":7.5499},{"match_name":"ENPS May 2018 USPSA Match","match_date":"2018-05-06","stage_classifiercode":"99-12","member_number":"A89507","first_name":"JUSTYN","last_name":"RILEY","classification":"B","division":"LIMITED","hit_factor":7.537},{"match_name":"LdF 4th Saturday Match","match_date":"2016-01-23","stage_classifiercode":"99-12","member_number":"A78429","first_name":"MICHAEL","last_name":"RUSH","classification":"A","division":"LIMITED","hit_factor":7.5353},{"match_name":"LdF 4th Saturday Match","match_date":"2016-01-23","stage_classifiercode":"99-12","member_number":"A69003","first_name":"JOHN","last_name":"WOOLFREY","classification":"A","division":"LIMITED","hit_factor":7.5297},{"match_name":"WNPL USPSA - Labour Day Weekend - Sept 2017","match_date":"2017-09-02","stage_classifiercode":"99-12","member_number":"L3657","first_name":"JAMES","last_name":"ONG","classification":"M","division":"LIMITED","hit_factor":7.5269},{"match_name":"Palmetto Gun Club - February 2018 USPSA","match_date":"2018-02-03","stage_classifiercode":"99-12","member_number":"TY66707","first_name":"WALLY","last_name":"BURBAGE","classification":"M","division":"LIMITED","hit_factor":7.511},{"match_name":"DWB - Deadwood Boys USPSA 18 February 2018","match_date":"2018-02-18","stage_classifiercode":"99-12","member_number":"fy51880","first_name":"ARWIN","last_name":"PLETE","classification":"C","division":"LIMITED","hit_factor":7.5},{"match_name":"LIPSA - April 30th 2017 - USPSA Match Special Classifier","match_date":"2017-04-30","stage_classifiercode":"99-12","member_number":"TY77141","first_name":"KEN (LOUIE)","last_name":"PRIMERO","classification":"A","division":"LIMITED","hit_factor":7.485},{"match_name":"Palmetto Gun Club - February 2018 USPSA","match_date":"2018-02-03","stage_classifiercode":"99-12","member_number":"TY79433","first_name":"MARLIN","last_name":"FRY","classification":"A","division":"LIMITED","hit_factor":7.4728},{"match_name":"OK15 USPSA AT USSA","match_date":"2016-07-10","stage_classifiercode":"99-12","member_number":"TY-89171","first_name":"AUSTIN","last_name":"CHAMBERLAIN","classification":"U","division":"LIMITED","hit_factor":7.4646},{"match_name":"XMG USPSA   Saturday September  4th 2021","match_date":"2021-09-04","stage_classifiercode":"99-12","member_number":"Ty107477","first_name":"MATTHEW","last_name":"MORDECAI","classification":"B","division":"LIMITED","hit_factor":7.4586},{"match_name":"Maine Practical Shooters May 2018","match_date":"2018-05-12","stage_classifiercode":"99-12","member_number":"A89748","first_name":"VINCENT","last_name":"DAVIES","classification":"M","division":"LIMITED","hit_factor":7.3611},{"match_name":"OK15 USPSA at USSA","match_date":"2017-12-10","stage_classifiercode":"99-12","member_number":"TY68934","first_name":"TIM","last_name":"HERRON","classification":"M","division":"LIMITED","hit_factor":7.3491},{"match_name":"WSPS OCTOBER 2017 USPSA MATCH","match_date":"2017-10-21","stage_classifiercode":"99-12","member_number":"A82072","first_name":"AL","last_name":"MONCH","classification":"M","division":"LIMITED","hit_factor":7.3353},{"match_name":"MSA USPSA Special Classifier 12-4-16","match_date":"2016-12-04","stage_classifiercode":"99-12","member_number":"A-91002","first_name":"PRESTON","last_name":"CLARK","classification":"A","division":"LIMITED","hit_factor":7.2956},{"match_name":"Laser Ninja Dragon League USPSA August 2017","match_date":"2017-08-06","stage_classifiercode":"99-12","member_number":"A75176","first_name":"TEAK-ALLEN","last_name":"BARRY","classification":"B","division":"LIMITED","hit_factor":7.2423},{"match_name":"RBGC 2018-7-28","match_date":"2018-07-28","stage_classifiercode":"99-12","member_number":"TY105125","first_name":"JOE","last_name":"GEORGE","classification":"U","division":"LIMITED","hit_factor":7.2419},{"match_name":"SSP Super Classifier 1-30-16","match_date":"2016-01-30","stage_classifiercode":"99-12","member_number":"A27294","first_name":"ALLEN","last_name":"ROONEY","classification":"M","division":"LIMITED","hit_factor":7.2386},{"match_name":"MCPSL Pistol 4-8-17","match_date":"2017-04-08","stage_classifiercode":"99-12","member_number":"L3768","first_name":"BOB","last_name":"BARKER","classification":"M","division":"LIMITED","hit_factor":7.2368},{"match_name":"FBPPC DECEMBER 2016 SPECIAL CLASSIFIER MATCH","match_date":"2016-12-10","stage_classifiercode":"99-12","member_number":"TY71940","first_name":"DEREK","last_name":"DRISCOLL","classification":"M","division":"LIMITED","hit_factor":7.2368},{"match_name":"12-19-18 MISS Match","match_date":"2018-12-19","stage_classifiercode":"99-12","member_number":"TY88494","first_name":"GEORGE","last_name":"DYSICO","classification":"B","division":"LIMITED","hit_factor":7.2351},{"match_name":"RBGC 2018-7-28","match_date":"2018-07-28","stage_classifiercode":"99-12","member_number":"TY52643","first_name":"STEPHEN","last_name":"LEE","classification":"B","division":"LIMITED","hit_factor":7.2335},{"match_name":"SCCPSA USPSA Mar 17","match_date":"2018-03-17","stage_classifiercode":"99-12","member_number":"A69256","first_name":"KRAIG","last_name":"BAER","classification":"A","division":"LIMITED","hit_factor":7.2327},{"match_name":"OFGC USPSA Match 10-21-18","match_date":"2018-10-21","stage_classifiercode":"99-12","member_number":"TY78645","first_name":"LOREN","last_name":"PENDERGRASS","classification":"A","division":"LIMITED","hit_factor":7.1964},{"match_name":"Richmond Hot Shots February 7-2016 USPSA Match","match_date":"2016-02-07","stage_classifiercode":"99-12","member_number":"TY70843","first_name":"CHRIS","last_name":"NESSINGER","classification":"B","division":"LIMITED","hit_factor":7.1887},{"match_name":"Triforce Practical Shooters at BigWoodsGoods","match_date":"2016-09-22","stage_classifiercode":"99-12","member_number":"A84201","first_name":"ZANE","last_name":"RUTLEDGE","classification":"B","division":"LIMITED","hit_factor":7.1816},{"match_name":"ECPS February 28th USPSA Pistol Match","match_date":"2016-02-28","stage_classifiercode":"99-12","member_number":"Ty71430","first_name":"JOSH","last_name":"WEEKS","classification":"A","division":"LIMITED","hit_factor":7.1763},{"match_name":"H&H June Match","match_date":"2016-06-26","stage_classifiercode":"99-12","member_number":"TY49733","first_name":"KURT","last_name":"MILLER","classification":"M","division":"LIMITED","hit_factor":7.1618},{"match_name":"MRPC USPSA Mar 2017","match_date":"2017-03-26","stage_classifiercode":"99-12","member_number":"A80011","first_name":"SHANE","last_name":"DILLINGER","classification":"B","division":"LIMITED","hit_factor":7.1429},{"match_name":"TAC2 USPSA August 2017","match_date":"2017-08-05","stage_classifiercode":"99-12","member_number":"A92187","first_name":"CHRIS","last_name":"NELSON","classification":"U","division":"LIMITED","hit_factor":7.1331},{"match_name":"Hosemasters  3rd Sunday Feburary 2017","match_date":"2017-02-12","stage_classifiercode":"99-12","member_number":"FY66994","first_name":"SCOTT","last_name":"BONOMO","classification":"B","division":"LIMITED","hit_factor":7.1237},{"match_name":"Holmen USPSA Mar 26 2017","match_date":"2017-03-26","stage_classifiercode":"99-12","member_number":"TY54308","first_name":"GLEN","last_name":"BICKING","classification":"A","division":"LIMITED","hit_factor":7.1135},{"match_name":"NTPS-SE August 2016","match_date":"2016-08-20","stage_classifiercode":"99-12","member_number":"A69053","first_name":"DARIK","last_name":"BOLLIG","classification":"U","division":"LIMITED","hit_factor":7.0984},{"match_name":"Brothers N Arms February 2018 USPSA Match","match_date":"2018-02-17","stage_classifiercode":"99-12","member_number":"TY94183","first_name":"DAVID","last_name":"PAPE","classification":"A","division":"LIMITED","hit_factor":7.0901},{"match_name":"LdF USPSA Match July 14 2018","match_date":"2018-07-14","stage_classifiercode":"99-12","member_number":"A81018","first_name":"BART","last_name":"DEL RIO","classification":"M","division":"LIMITED","hit_factor":7.0632},{"match_name":"Laser Ninja Dragon League USPSA August 2017","match_date":"2017-08-06","stage_classifiercode":"99-12","member_number":"TY75346","first_name":"CALVIN","last_name":"SMILEY","classification":"B","division":"LIMITED","hit_factor":7.0556},{"match_name":"SPSA USPSA March 4th Sat match","match_date":"2017-03-25","stage_classifiercode":"99-12","member_number":"TY68323","first_name":"JOSH","last_name":"LOTHER","classification":"M","division":"LIMITED","hit_factor":7.0444},{"match_name":"DWB - Deadwood Boys USPSA 18 February 2018","match_date":"2018-02-18","stage_classifiercode":"99-12","member_number":"a96044","first_name":"SEAN","last_name":"HENSLEY","classification":"A","division":"LIMITED","hit_factor":7.044},{"match_name":"Southern Arizona Practical Shooters 05_5_18","match_date":"2018-05-05","stage_classifiercode":"99-12","member_number":"TY72948","first_name":"WILLIAM","last_name":"VANNI","classification":"B","division":"LIMITED","hit_factor":7.0048},{"match_name":"BRC_20170611","match_date":"2017-06-11","stage_classifiercode":"99-12","member_number":"FY72585","first_name":"TRUNG","last_name":"NGUYEN","classification":"A","division":"LIMITED","hit_factor":7.0025},{"match_name":"TAC2 USPSA August 2017","match_date":"2017-08-05","stage_classifiercode":"99-12","member_number":"\"\"","first_name":"JED A 2G","last_name":"MERCER","classification":"U","division":"LIMITED","hit_factor":6.9971},{"match_name":"LdF USPSA Match July 14 2018","match_date":"2018-07-14","stage_classifiercode":"99-12","member_number":"A69003","first_name":"JOHN","last_name":"WOOLFREY","classification":"A","division":"LIMITED","hit_factor":6.9426},{"match_name":"CCPL 04102016","match_date":"2016-04-10","stage_classifiercode":"99-12","member_number":"TY87000","first_name":"GREG","last_name":"VAUGHN","classification":"B","division":"LIMITED","hit_factor":6.9293},{"match_name":"LdF USPSA Match July 14 2018","match_date":"2018-07-14","stage_classifiercode":"99-12","member_number":"A81101","first_name":"LES","last_name":"ANDERSON","classification":"A","division":"LIMITED","hit_factor":6.9095},{"match_name":"ECPS February 28th USPSA Pistol Match","match_date":"2016-02-28","stage_classifiercode":"99-12","member_number":"L729","first_name":"ROBERT","last_name":"WALKER","classification":"M","division":"LIMITED","hit_factor":6.8831},{"match_name":"Shoot GTR USPSA 11/6","match_date":"2016-11-06","stage_classifiercode":"99-12","member_number":"A71248","first_name":"CHAD","last_name":"HYLANDER","classification":"B","division":"LIMITED","hit_factor":6.879},{"match_name":"NISA April Classifer Match 2016","match_date":"2016-04-24","stage_classifiercode":"99-12","member_number":"ty67601","first_name":"RUSSELL","last_name":"DESALVO","classification":"U","division":"LIMITED","hit_factor":6.8702},{"match_name":"USPSA MO21 Special Classifier 2Alpha SBRC February 27 2021","match_date":"2021-02-27","stage_classifiercode":"99-12","member_number":"TY86706","first_name":"CHRIS","last_name":"DEWEY","classification":"B","division":"LIMITED","hit_factor":6.8528},{"match_name":"FBURG April 2017 Level I USPSA ","match_date":"2017-04-01","stage_classifiercode":"99-12","member_number":"A87233","first_name":"ANDREW","last_name":"STEIN","classification":"B","division":"LIMITED","hit_factor":6.8314},{"match_name":"PCGC  June 2017","match_date":"2017-06-25","stage_classifiercode":"99-12","member_number":"A93641","first_name":"JOSEPH","last_name":"KELLEY","classification":"X","division":"LIMITED","hit_factor":6.8063},{"match_name":"Richmond Hot Shots February 7-2016 USPSA Match","match_date":"2016-02-07","stage_classifiercode":"99-12","member_number":"ty69633","first_name":"ALEX","last_name":"MA","classification":"M","division":"LIMITED","hit_factor":6.7974},{"match_name":"Smoke & Hope USPSA Apr 22 2017","match_date":"2017-04-22","stage_classifiercode":"99-12","member_number":"A99618","first_name":"AUGUST","last_name":"DESSON","classification":"U","division":"LIMITED","hit_factor":6.7708},{"match_name":"GMPS 5/7/17","match_date":"2017-05-06","stage_classifiercode":"99-12","member_number":"A75538","first_name":"TONY","last_name":"SCARZELLO","classification":"B","division":"LIMITED","hit_factor":6.7659},{"match_name":"BRC_20170611","match_date":"2017-06-11","stage_classifiercode":"99-12","member_number":"TY86616","first_name":"WILLIAM","last_name":"WEEKS","classification":"B","division":"LIMITED","hit_factor":6.7456},{"match_name":"Danville Rifle and Pistol Club USPSA IL17 April 21 2018","match_date":"2018-04-21","stage_classifiercode":"99-12","member_number":"A93995","first_name":"VINCE","last_name":"STROW","classification":"U","division":"LIMITED","hit_factor":6.743},{"match_name":"RD Shooters May 6th USPSA  match","match_date":"2017-05-06","stage_classifiercode":"99-12","member_number":"A77529","first_name":"JOSH","last_name":"PINCHES","classification":"B","division":"LIMITED","hit_factor":6.74},{"match_name":"Emmett September Match","match_date":"2016-09-24","stage_classifiercode":"99-12","member_number":"a75553","first_name":"MARK","last_name":"WEAVER","classification":"A","division":"LIMITED","hit_factor":6.7164},{"match_name":"Pinetucky USPSA 11-19-16","match_date":"2016-11-19","stage_classifiercode":"99-12","member_number":"TY53092","first_name":"DEWEY","last_name":"HUTSON","classification":"M","division":"LIMITED","hit_factor":6.7097},{"match_name":"PIPS 06-14-2017","match_date":"2017-06-14","stage_classifiercode":"99-12","member_number":"TY66089","first_name":"CHRIS","last_name":"WISNIEWSKI","classification":"A","division":"LIMITED","hit_factor":6.7055},{"match_name":"LdF USPSA Match July 14 2018","match_date":"2018-07-14","stage_classifiercode":"99-12","member_number":"A109851","first_name":"TONY","last_name":"EBITNER","classification":"B","division":"LIMITED","hit_factor":6.7017},{"match_name":"ENPS May 2018 USPSA Match","match_date":"2018-05-06","stage_classifiercode":"99-12","member_number":"A74763","first_name":"JESSE","last_name":"HILGER","classification":"C","division":"LIMITED","hit_factor":6.6991},{"match_name":"TPS USPSA - September 2016 - Talon Range","match_date":"2016-09-03","stage_classifiercode":"99-12","member_number":"TY83671","first_name":"NATHAN","last_name":"BELL","classification":"M","division":"LIMITED","hit_factor":6.6766},{"match_name":"Richmond Hot Shots February 7-2016 USPSA Match","match_date":"2016-02-07","stage_classifiercode":"99-12","member_number":"TY63997","first_name":"DOUG","last_name":"LARSON","classification":"A","division":"LIMITED","hit_factor":6.658},{"match_name":"SSS USPSA February 2020","match_date":"2020-02-16","stage_classifiercode":"99-12","member_number":"A58000","first_name":"JAMES LIM","last_name":"SMITH","classification":"U (Unclassified)","division":"LIMITED","hit_factor":6.6496},{"match_name":"Shongum April 2017 USPSA Match","match_date":"2017-04-01","stage_classifiercode":"99-12","member_number":"TY64352","first_name":"GERRY","last_name":"VELASCO","classification":"U","division":"LIMITED","hit_factor":6.6489},{"match_name":"COPS Feb 2017 USPSA Match","match_date":"2017-02-05","stage_classifiercode":"99-12","member_number":"L3962","first_name":"JIM","last_name":"SHANAHAN","classification":"G","division":"LIMITED","hit_factor":6.6474},{"match_name":"Stock & Barrel MN18 November 2020 USPSA Classifier Match","match_date":"2020-11-01","stage_classifiercode":"99-12","member_number":"A81305","first_name":"DREW","last_name":"BECKMAN","classification":"B","division":"LIMITED","hit_factor":6.6401},{"match_name":"USPSA MO21 Special Classifier 2Alpha SBRC February 27 2021","match_date":"2021-02-27","stage_classifiercode":"99-12","member_number":"TY78370","first_name":"JAMES","last_name":"CHOATE","classification":"B","division":"LIMITED","hit_factor":6.6367},{"match_name":"NTPS-SE August 2016","match_date":"2016-08-20","stage_classifiercode":"99-12","member_number":"NONE","first_name":"KEN","last_name":"ALEXANDROW","classification":"U","division":"LIMITED","hit_factor":6.6339},{"match_name":"Hosemasters  3rd Sunday Feburary 2017","match_date":"2017-02-12","stage_classifiercode":"99-12","member_number":"TY87182","first_name":"MILTON","last_name":"MEANS","classification":"B","division":"LIMITED","hit_factor":6.6272},{"match_name":"Gunsmoke Action Shooters USPSA April 18","match_date":"2018-04-07","stage_classifiercode":"99-12","member_number":"A80553","first_name":"RYAN","last_name":"CALHOON","classification":"A","division":"LIMITED","hit_factor":6.6085},{"match_name":"LPRGC-Lower Providence USPSA May-2 2017","match_date":"2017-05-13","stage_classifiercode":"99-12","member_number":"\"\"","first_name":"KRAIG","last_name":"BAER","classification":"A","division":"LIMITED","hit_factor":6.592},{"match_name":"WNPL USPSA - Labour Day Weekend - Sept 2017","match_date":"2017-09-02","stage_classifiercode":"99-12","member_number":"A36569","first_name":"ERIK","last_name":"WARREN","classification":"GM","division":"LIMITED","hit_factor":6.5854},{"match_name":"Shoot GTR USPSA 11/6","match_date":"2016-11-06","stage_classifiercode":"99-12","member_number":"A65542","first_name":"JAMES","last_name":"RAMOS","classification":"A","division":"LIMITED","hit_factor":6.5844},{"match_name":"2020-03 Bone Creek USPSA","match_date":"2020-03-01","stage_classifiercode":"99-12","member_number":"A101550","first_name":"ERIC","last_name":"SCHNITZER","classification":"C","division":"LIMITED","hit_factor":6.5773},{"match_name":"Brothers N Arms August 2018 USPSA Match","match_date":"2018-08-18","stage_classifiercode":"99-12","member_number":"A105075","first_name":"WILLIAM","last_name":"DAVENPORT","classification":"U","division":"LIMITED","hit_factor":6.5757},{"match_name":"Griffin USPSA Match Aug 2017","match_date":"2017-08-19","stage_classifiercode":"99-12","member_number":"TY101146","first_name":"JUSTIN","last_name":"KRAGE","classification":"B","division":"LIMITED","hit_factor":6.5574},{"match_name":"Powell County Action Shooters July 17 2021","match_date":"2021-07-17","stage_classifiercode":"99-12","member_number":"a43042","first_name":"DAN","last_name":"HASH","classification":"A","division":"LIMITED","hit_factor":6.5553},{"match_name":"LdF USPSA Match July 14 2018","match_date":"2018-07-14","stage_classifiercode":"99-12","member_number":"FY63382","first_name":"MICHAEL","last_name":"SUEDA","classification":"M","division":"LIMITED","hit_factor":6.5527},{"match_name":"Belton Gun Club USPSA January MATCH 1-30-21","match_date":"2021-01-30","stage_classifiercode":"99-12","member_number":"A114127","first_name":"NATHAN","last_name":"MENOVCIK","classification":"B","division":"LIMITED","hit_factor":6.5421},{"match_name":"NVSA USPSA 1711","match_date":"2017-11-05","stage_classifiercode":"99-12","member_number":"A49305","first_name":"MATHEW","last_name":"RACKLEY","classification":"C","division":"LIMITED","hit_factor":6.5409},{"match_name":"LCHG May USPSA","match_date":"2017-05-21","stage_classifiercode":"99-12","member_number":"A65280","first_name":"TRAVIS","last_name":"MCKLOSKY","classification":"C","division":"LIMITED","hit_factor":6.5395},{"match_name":"BRC_20170611","match_date":"2017-06-11","stage_classifiercode":"99-12","member_number":"\"\"","first_name":"ERLEND","last_name":"BERG","classification":"U","division":"LIMITED","hit_factor":6.5389},{"match_name":"Danville Rifle and Pistol Club USPSA IL17 April 21 2018","match_date":"2018-04-21","stage_classifiercode":"99-12","member_number":"TY90126","first_name":"TOM","last_name":"BURZYNSKI","classification":"U","division":"LIMITED","hit_factor":6.5271},{"match_name":"WTPS USPSA April Classifier Match 4-8-17","match_date":"2017-04-08","stage_classifiercode":"99-12","member_number":"A99678","first_name":"LONNY","last_name":"GUPTON","classification":"C","division":"LIMITED","hit_factor":6.5217},{"match_name":"Collin County USPSA Nov. 27 2016","match_date":"2016-11-25","stage_classifiercode":"99-12","member_number":"A99344","first_name":"KEVIN","last_name":"HARDING","classification":"D","division":"LIMITED","hit_factor":6.5192},{"match_name":"SPSA USPSA March 4th Sat match","match_date":"2017-03-25","stage_classifiercode":"99-12","member_number":"A69774","first_name":"DAVID","last_name":"FISCHER","classification":"B","division":"LIMITED","hit_factor":6.5134},{"match_name":"OK15 USPSA at USSA","match_date":"2017-12-10","stage_classifiercode":"99-12","member_number":"TY-78427","first_name":"DILLEN","last_name":"EASLEY","classification":"B","division":"LIMITED","hit_factor":6.4935},{"match_name":"LdF 4th Saturday Match","match_date":"2016-01-23","stage_classifiercode":"99-12","member_number":"A81101","first_name":"LES","last_name":"ANDERSON","classification":"B","division":"LIMITED","hit_factor":6.4851},{"match_name":"Belton Gun Club USPSA January MATCH 1-30-21","match_date":"2021-01-30","stage_classifiercode":"99-12","member_number":"A47844","first_name":"JERRY","last_name":"CHAPMAN","classification":"A","division":"LIMITED","hit_factor":6.4599},{"match_name":"SSFGA & Master Blasters USPSA Classifier","match_date":"2018-11-17","stage_classifiercode":"99-12","member_number":"TY94392","first_name":"ZACK","last_name":"ROBERGE","classification":"B","division":"LIMITED","hit_factor":6.4591},{"match_name":"Shongum Pistol November 2015","match_date":"2015-11-07","stage_classifiercode":"99-12","member_number":"A91710","first_name":"RYAN","last_name":"POBLETE","classification":"B","division":"LIMITED","hit_factor":6.4588},{"match_name":"BRC_20170611","match_date":"2017-06-11","stage_classifiercode":"99-12","member_number":"\"\"","first_name":"ERIC","last_name":"MILLER","classification":"U","division":"LIMITED","hit_factor":6.4516},{"match_name":"Shongum Pistol November 2015","match_date":"2015-11-07","stage_classifiercode":"99-12","member_number":"TY77141","first_name":"LOUIE","last_name":"PRIMERO","classification":"B","division":"LIMITED","hit_factor":6.4436},{"match_name":"OK15 USPSA at USSA","match_date":"2017-12-10","stage_classifiercode":"99-12","member_number":"TY99661","first_name":"LARAMIE","last_name":"FRANK","classification":"U","division":"LIMITED","hit_factor":6.4436},{"match_name":"Shongum Pistol November 2015","match_date":"2015-11-07","stage_classifiercode":"99-12","member_number":"TY20395","first_name":"LEO","last_name":"PRIMERO","classification":"B","division":"LIMITED","hit_factor":6.4343},{"match_name":"SPSA USPSA March 4th Sat match","match_date":"2017-03-25","stage_classifiercode":"99-12","member_number":"A87032","first_name":"TRE","last_name":"ROACH","classification":"B","division":"LIMITED","hit_factor":6.4277},{"match_name":"SPSA USPSA March 4th Sat match","match_date":"2017-03-25","stage_classifiercode":"99-12","member_number":"TY60619","first_name":"JESUS","last_name":"HERNANDEZ","classification":"C","division":"LIMITED","hit_factor":6.4277},{"match_name":"Fairfax PS USPSA  2018 September","match_date":"2018-09-18","stage_classifiercode":"99-12","member_number":"A93612","first_name":"PAUL","last_name":"RANDAZZO","classification":"B","division":"LIMITED","hit_factor":6.4252},{"match_name":"WTPS USPSA April Classifier Match 4-8-17","match_date":"2017-04-08","stage_classifiercode":"99-12","member_number":"TY98496","first_name":"ADRIAN","last_name":"HUBER","classification":"U","division":"LIMITED","hit_factor":6.4117},{"match_name":"CRGC USPSA Special Classifier 08-15-21","match_date":"2021-08-15","stage_classifiercode":"99-12","member_number":"FY111430","first_name":"SEAN","last_name":"MCCLURE","classification":"","division":"LIMITED","hit_factor":6.3927},{"match_name":"RBGC 2018-7-28","match_date":"2018-07-28","stage_classifiercode":"99-12","member_number":"A84202","first_name":"DOUG","last_name":"RUTLEDGE","classification":"B","division":"LIMITED","hit_factor":6.3882},{"match_name":"MSSA Uspsa Match","match_date":"2017-04-08","stage_classifiercode":"99-12","member_number":"TY37118","first_name":"WILLIAM","last_name":"SIGLER","classification":"M","division":"LIMITED","hit_factor":6.3805},{"match_name":"USPSA MO21 Special Classifier 2Alpha SBRC February 27 2021","match_date":"2021-02-27","stage_classifiercode":"99-12","member_number":"A126957","first_name":"JOSHUA","last_name":"WILSON","classification":"C","division":"LIMITED","hit_factor":6.3805},{"match_name":"CASA Classifier match April 2018","match_date":"2018-04-08","stage_classifiercode":"99-12","member_number":"A99926","first_name":"CARL","last_name":"CLITES","classification":"B","division":"LIMITED","hit_factor":6.3694},{"match_name":"CGC 2017_05_13","match_date":"2017-05-13","stage_classifiercode":"99-12","member_number":"A27940","first_name":"RICK","last_name":"DOBBS","classification":"A","division":"LIMITED","hit_factor":6.3687},{"match_name":"MSSA Uspsa Match","match_date":"2017-04-08","stage_classifiercode":"99-12","member_number":"\"\"","first_name":"TONY","last_name":"COWDEN","classification":"\"\"","division":"LIMITED","hit_factor":6.3679},{"match_name":"Palmetto Gun Club - February 2018 USPSA","match_date":"2018-02-03","stage_classifiercode":"99-12","member_number":"A79380","first_name":"DOUGLAS","last_name":"WILTON","classification":"B","division":"LIMITED","hit_factor":6.3584},{"match_name":"USPSA","match_date":"2016-06-04","stage_classifiercode":"99-12","member_number":"\"\"","first_name":"ROD","last_name":"JOHNSON","classification":"U","division":"LIMITED","hit_factor":6.3549},{"match_name":"MPSA USPSA 111817","match_date":"2017-11-18","stage_classifiercode":"99-12","member_number":"A46987","first_name":"PAUL","last_name":"JACCOD","classification":"B","division":"LIMITED","hit_factor":6.3545},{"match_name":"USC August 2016","match_date":"2016-08-13","stage_classifiercode":"99-12","member_number":"A73587","first_name":"COLIN","last_name":"WALTERS","classification":"A","division":"LIMITED","hit_factor":6.3422},{"match_name":"SFPC September USPSA Special Classifier match","match_date":"2016-09-04","stage_classifiercode":"99-12","member_number":"TY68109","first_name":"BEN","last_name":"MIZRAHI","classification":"B","division":"LIMITED","hit_factor":6.338},{"match_name":"Shoot GTR USPSA 11/6","match_date":"2016-11-06","stage_classifiercode":"99-12","member_number":"L3279","first_name":"STEFAN","last_name":"WENDLAND","classification":"B","division":"LIMITED","hit_factor":6.3371},{"match_name":"ECPS February 28th USPSA Pistol Match","match_date":"2016-02-28","stage_classifiercode":"99-12","member_number":"A92146","first_name":"RYAN","last_name":"RASSOULI","classification":"U","division":"LIMITED","hit_factor":6.3232},{"match_name":"LdF 4th Saturday Match","match_date":"2016-01-23","stage_classifiercode":"99-12","member_number":"A78063","first_name":"MIKE","last_name":"PAPS","classification":"B","division":"LIMITED","hit_factor":6.3197},{"match_name":"OFGC USPSA Match Feb 19th 2017","match_date":"2017-02-19","stage_classifiercode":"99-12","member_number":"TY55378","first_name":"TRAVIS","last_name":"THOMPSON","classification":"B","division":"LIMITED","hit_factor":6.3158},{"match_name":"SFPC September USPSA Special Classifier match","match_date":"2016-09-04","stage_classifiercode":"99-12","member_number":"TY68109","first_name":"BEN","last_name":"MIZRAHI","classification":"B","division":"LIMITED","hit_factor":6.31},{"match_name":"Griffin USPSA Match Aug 2017","match_date":"2017-08-19","stage_classifiercode":"99-12","member_number":"A65182","first_name":"BUCK","last_name":"CAMPBELL","classification":"B","division":"LIMITED","hit_factor":6.2972},{"match_name":"DWB - Deadwood Boys USPSA 18 February 2018","match_date":"2018-02-18","stage_classifiercode":"99-12","member_number":"A96882","first_name":"ROMMEL","last_name":"DEL ROSARIO","classification":"D","division":"LIMITED","hit_factor":6.2929},{"match_name":"SSP Super Classifier 1-30-16","match_date":"2016-01-30","stage_classifiercode":"99-12","member_number":"L2702","first_name":"MATT","last_name":"LAMP","classification":"A","division":"LIMITED","hit_factor":6.2893},{"match_name":"Minnetonka Game And Fish May 23","match_date":"2018-05-23","stage_classifiercode":"99-12","member_number":"A7045","first_name":"DAVID","last_name":"HORN","classification":"U","division":"LIMITED","hit_factor":6.2893},{"match_name":"OFGC USPSA Match 10-21-18","match_date":"2018-10-21","stage_classifiercode":"99-12","member_number":"A42354","first_name":"BILLY","last_name":"SMITH","classification":"A","division":"LIMITED","hit_factor":6.2802},{"match_name":"TPS USPSA - September 2016 - Talon Range","match_date":"2016-09-03","stage_classifiercode":"99-12","member_number":"A4564","first_name":"ED","last_name":"FOWLER","classification":"U","division":"LIMITED","hit_factor":6.2703},{"match_name":"SFPC March USPSA Match 2017","match_date":"2017-03-05","stage_classifiercode":"99-12","member_number":"fy57013","first_name":"KFIR","last_name":"LEBOVICH","classification":"A","division":"LIMITED","hit_factor":6.2699},{"match_name":"Medford USPSA April 2018 Match","match_date":"2018-04-15","stage_classifiercode":"99-12","member_number":"\"\"","first_name":"MIKE","last_name":"MCMULLEN","classification":"U","division":"LIMITED","hit_factor":6.2699},{"match_name":"CGC 2017_05_13","match_date":"2017-05-13","stage_classifiercode":"99-12","member_number":"A77450","first_name":"DOUG","last_name":"JONES SR","classification":"B","division":"LIMITED","hit_factor":6.2696},{"match_name":"DRRC Dec2016","match_date":"2016-12-03","stage_classifiercode":"99-12","member_number":"A90908","first_name":"CHRIS","last_name":"STORMS","classification":"B","division":"LIMITED","hit_factor":6.2648},{"match_name":"BRC_20170611","match_date":"2017-06-11","stage_classifiercode":"99-12","member_number":"A91485","first_name":"RYAN","last_name":"EMMITE","classification":"B","division":"LIMITED","hit_factor":6.2581},{"match_name":"Green Valley USPSA May Classifier","match_date":"2018-05-09","stage_classifiercode":"99-12","member_number":"L4224","first_name":"PETER","last_name":"EIBERGER","classification":"A","division":"LIMITED","hit_factor":6.2578},{"match_name":"OK15 USPSA at USSA","match_date":"2017-12-10","stage_classifiercode":"99-12","member_number":"A89709","first_name":"BRIAN","last_name":"SMITH","classification":"B","division":"LIMITED","hit_factor":6.2353},{"match_name":"SCAPSA MN05 Summer League 1","match_date":"2017-06-05","stage_classifiercode":"99-12","member_number":"TY95216","first_name":"JASON","last_name":"BRAUN","classification":"C","division":"LIMITED","hit_factor":6.2127},{"match_name":"Atlanta Practical Shooters March 2016 USPSA - Classifier Match","match_date":"2016-03-06","stage_classifiercode":"99-12","member_number":"A78222","first_name":"BRETT","last_name":"POWELL","classification":"A","division":"LIMITED","hit_factor":6.2112},{"match_name":"Medford USPSA April 2018 Match","match_date":"2018-04-15","stage_classifiercode":"99-12","member_number":"A24497","first_name":"TOM","last_name":"CAIL","classification":"B","division":"LIMITED","hit_factor":6.192},{"match_name":"DWB - Deadwood Boys USPSA 18 February 2018","match_date":"2018-02-18","stage_classifiercode":"99-12","member_number":"TY82298","first_name":"WALTER","last_name":"MICHALOWSKI","classification":"B","division":"LIMITED","hit_factor":6.1916},{"match_name":"Coastal Area Practical Shooters 10-24-20","match_date":"2020-10-24","stage_classifiercode":"99-12","member_number":"TY84112","first_name":"BRAD","last_name":"WALKER","classification":"A","division":"LIMITED","hit_factor":6.1881},{"match_name":"TPS USPSA - September 2016 - Talon Range","match_date":"2016-09-03","stage_classifiercode":"99-12","member_number":"A77700","first_name":"BOB","last_name":"JONES","classification":"C","division":"LIMITED","hit_factor":6.1856},{"match_name":"OK15 USPSA AT USSA","match_date":"2016-07-10","stage_classifiercode":"99-12","member_number":"A84245","first_name":"BRYAN","last_name":"HOOVER","classification":"B","division":"LIMITED","hit_factor":6.1805},{"match_name":"NISA April Classifer Match 2016","match_date":"2016-04-24","stage_classifiercode":"99-12","member_number":"a89213","first_name":"CHIP","last_name":"FATOL","classification":"C","division":"LIMITED","hit_factor":6.1791},{"match_name":"Richmond Hot Shots February 7-2016 USPSA Match","match_date":"2016-02-07","stage_classifiercode":"99-12","member_number":"TY13044","first_name":"SEBASTIAO","last_name":"FILHO","classification":"M","division":"LIMITED","hit_factor":6.1789},{"match_name":"Palmetto Gun Club - February 2018 USPSA","match_date":"2018-02-03","stage_classifiercode":"99-12","member_number":"\"\"","first_name":"BRADY","last_name":"WHITE","classification":"\"\"","division":"LIMITED","hit_factor":6.1785},{"match_name":"LIPSA - April 30th 2017 - USPSA Match Special Classifier","match_date":"2017-04-30","stage_classifiercode":"99-12","member_number":"TY89184","first_name":"ADAM","last_name":"GORDON","classification":"C","division":"LIMITED","hit_factor":6.1772},{"match_name":"SSP Super Classifier 1-30-16","match_date":"2016-01-30","stage_classifiercode":"99-12","member_number":"fy22816","first_name":"ROB","last_name":"WILLOUGHBY","classification":"M","division":"LIMITED","hit_factor":6.1743},{"match_name":"Green Valley USPSA May Classifier","match_date":"2018-05-09","stage_classifiercode":"99-12","member_number":"TY79064","first_name":"SAM","last_name":"BLACK","classification":"B","division":"LIMITED","hit_factor":6.1742},{"match_name":"COPS Feb 2017 USPSA Match","match_date":"2017-02-05","stage_classifiercode":"99-12","member_number":"TY78370","first_name":"JAMIE","last_name":"CHOATE","classification":"B","division":"LIMITED","hit_factor":6.1702},{"match_name":"LdF 4th Saturday Match","match_date":"2016-01-23","stage_classifiercode":"99-12","member_number":"A83494","first_name":"MATT","last_name":"KLIER","classification":"B","division":"LIMITED","hit_factor":6.1697},{"match_name":"SPSA USPSA March 4th Sat match","match_date":"2017-03-25","stage_classifiercode":"99-12","member_number":"L1583","first_name":"EDDIE","last_name":"WAGNER","classification":"B","division":"LIMITED","hit_factor":6.1637},{"match_name":"Chillicothe May-2017 USPSA Match","match_date":"2017-05-28","stage_classifiercode":"99-12","member_number":"A80265","first_name":"ETHAN","last_name":"MOOBERRY","classification":"A","division":"LIMITED","hit_factor":6.1606},{"match_name":"17s PSC - Feb 2017 - USPSA match","match_date":"2017-02-04","stage_classifiercode":"99-12","member_number":"Fy83548","first_name":"JEFF","last_name":"CHU","classification":"B","division":"LIMITED","hit_factor":6.1503},{"match_name":"gun2 sfps20170521 2","match_date":"2017-05-20","stage_classifiercode":"99-12","member_number":"A-65630","first_name":"JOSH","last_name":"KELLOGG","classification":"U","division":"LIMITED","hit_factor":6.1303},{"match_name":"GCL December 12-2-17","match_date":"2017-12-02","stage_classifiercode":"99-12","member_number":"A96946","first_name":"GREG","last_name":"TRASS","classification":"U","division":"LIMITED","hit_factor":6.1269},{"match_name":"XMG USPSA   Saturday September  4th 2021","match_date":"2021-09-04","stage_classifiercode":"99-12","member_number":"TY121136","first_name":"PHILIP","last_name":"FARR","classification":"B","division":"LIMITED","hit_factor":6.1224},{"match_name":"Atlanta Practical Shooters March 2016 USPSA - Classifier Match","match_date":"2016-03-06","stage_classifiercode":"99-12","member_number":"a77450","first_name":"DOUG","last_name":"JONES","classification":"B","division":"LIMITED","hit_factor":6.1202},{"match_name":"Belton Gun Club USPSA January MATCH 1-30-21","match_date":"2021-01-30","stage_classifiercode":"99-12","member_number":"Ty94335","first_name":"CAREY","last_name":"RABIDEAU","classification":"B","division":"LIMITED","hit_factor":6.12},{"match_name":"OFGC USPSA Match 10-21-18","match_date":"2018-10-21","stage_classifiercode":"99-12","member_number":"TY42278","first_name":"KELLY","last_name":"RAGLIN","classification":"M","division":"LIMITED","hit_factor":6.1135},{"match_name":"SPSA USPSA March 4th Sat match","match_date":"2017-03-25","stage_classifiercode":"99-12","member_number":"A33671","first_name":"MARK","last_name":"SULLIVAN","classification":"B","division":"LIMITED","hit_factor":6.1111},{"match_name":"Springfield Tactical Shooters 09/03/2020","match_date":"2020-09-03","stage_classifiercode":"99-12","member_number":"TY107600","first_name":"GEORGE","last_name":"BURNS","classification":"C","division":"LIMITED","hit_factor":6.1105},{"match_name":"MSSA Uspsa Match","match_date":"2017-04-08","stage_classifiercode":"99-12","member_number":"A78771","first_name":"RYAN","last_name":"GRANGER","classification":"C","division":"LIMITED","hit_factor":6.1069},{"match_name":"Payson Practical Pistol Sept 03 2016","match_date":"2016-09-03","stage_classifiercode":"99-12","member_number":"A96575","first_name":"SEAN","last_name":"LYNCH","classification":"U","division":"LIMITED","hit_factor":6.1053},{"match_name":"WNPL USPSA - Labour Day Weekend - Sept 2017","match_date":"2017-09-02","stage_classifiercode":"99-12","member_number":"TY79621","first_name":"STEPHEN","last_name":"COLLEN","classification":"B","division":"LIMITED","hit_factor":6.087},{"match_name":"FBURG April 2017 Level I USPSA ","match_date":"2017-04-01","stage_classifiercode":"99-12","member_number":"60783","first_name":"GUNNAR","last_name":"GRAFF","classification":"B","division":"LIMITED","hit_factor":6.078},{"match_name":"Atlanta Practical Shooters March 2016 USPSA - Classifier Match","match_date":"2016-03-06","stage_classifiercode":"99-12","member_number":"A70474","first_name":"SAL","last_name":"NAPPO","classification":"U","division":"LIMITED","hit_factor":6.0683},{"match_name":"XMG USPSA   Saturday September  4th 2021","match_date":"2021-09-04","stage_classifiercode":"99-12","member_number":"A122137","first_name":"BYRON","last_name":"MAGRUDER","classification":"C","division":"LIMITED","hit_factor":6.0606},{"match_name":"TPS USPSA PISTOL - May 2016 - Talon Range","match_date":"2016-05-07","stage_classifiercode":"99-12","member_number":"a87135","first_name":"ENVER","last_name":"FOCAKOVIC","classification":"U","division":"LIMITED","hit_factor":6.0606},{"match_name":"SCCPSA USPSA Mar 17","match_date":"2018-03-17","stage_classifiercode":"99-12","member_number":"A46862","first_name":"JAMES","last_name":"ELLIS","classification":"B","division":"LIMITED","hit_factor":6.0543},{"match_name":"LCHG May USPSA","match_date":"2017-05-21","stage_classifiercode":"99-12","member_number":"L3409","first_name":"BRUCE","last_name":"REID","classification":"B","division":"LIMITED","hit_factor":6.0538},{"match_name":"YMM IPSC02 2016_09_11","match_date":"2016-09-11","stage_classifiercode":"99-12","member_number":"FY52259","first_name":"TERRANCE","last_name":"SULLIVAN","classification":"B","division":"LIMITED","hit_factor":6.0459},{"match_name":"12-19-18 MISS Match","match_date":"2018-12-19","stage_classifiercode":"99-12","member_number":"A74905","first_name":"ZACK","last_name":"SIMS","classification":"C","division":"LIMITED","hit_factor":6.0459},{"match_name":"Collin County USPSA Nov. 27 2016","match_date":"2016-11-25","stage_classifiercode":"99-12","member_number":"A78806","first_name":"DAVE","last_name":"HUFSTEDLER","classification":"B","division":"LIMITED","hit_factor":6.0395},{"match_name":"NISA April Classifer Match 2016","match_date":"2016-04-24","stage_classifiercode":"99-12","member_number":"A19231","first_name":"DARRYL","last_name":"DOUGHERTY","classification":"M","division":"LIMITED","hit_factor":6.0345},{"match_name":"Springfield Tactical Shooters 09/03/2020","match_date":"2020-09-03","stage_classifiercode":"99-12","member_number":"A106901","first_name":"WILLIAM","last_name":"AMES","classification":"C","division":"LIMITED","hit_factor":6.0314},{"match_name":"Danville Rifle and Pistol Club USPSA IL17 April 21 2018","match_date":"2018-04-21","stage_classifiercode":"99-12","member_number":"Ty88153","first_name":"PAUL","last_name":"NURMI","classification":"B","division":"LIMITED","hit_factor":6.0284},{"match_name":"OK15 USPSA AT USSA","match_date":"2016-07-10","stage_classifiercode":"99-12","member_number":"A67199","first_name":"GREG","last_name":"GOODE","classification":"B","division":"LIMITED","hit_factor":6.0268},{"match_name":"SSS USPSA February 2020","match_date":"2020-02-16","stage_classifiercode":"99-12","member_number":"a115023","first_name":"JEFF","last_name":"HUNTER","classification":"U (Unclassified)","division":"LIMITED","hit_factor":6.0255},{"match_name":"COPS Feb 2017 USPSA Match","match_date":"2017-02-05","stage_classifiercode":"99-12","member_number":"A87686","first_name":"MICHAEL","last_name":"LINDSAY","classification":"U","division":"LIMITED","hit_factor":6.0226},{"match_name":"SFPC March USPSA Match 2017","match_date":"2017-03-05","stage_classifiercode":"99-12","member_number":"TY32540","first_name":"MOSHE","last_name":"MIZRAHI","classification":"B","division":"LIMITED","hit_factor":5.9978},{"match_name":"Richmond Hot Shots February 7-2016 USPSA Match","match_date":"2016-02-07","stage_classifiercode":"99-12","member_number":"A57508","first_name":"PATRICK","last_name":"CLARK","classification":"B","division":"LIMITED","hit_factor":5.9952},{"match_name":"OFGC USPSA Match Feb 19th 2017","match_date":"2017-02-19","stage_classifiercode":"99-12","member_number":"A92527","first_name":"JAKE","last_name":"NOBLE","classification":"C","division":"LIMITED","hit_factor":5.9913},{"match_name":"ECPS USPSA 17 Feb 18","match_date":"2018-02-16","stage_classifiercode":"99-12","member_number":"A107041","first_name":"KACEE","last_name":"HOLMES","classification":"U","division":"LIMITED","hit_factor":5.9896},{"match_name":"North Mountain July ","match_date":"2016-07-17","stage_classifiercode":"99-12","member_number":"A34963","first_name":"MARK","last_name":"YACKLEY","classification":"B","division":"LIMITED","hit_factor":5.9839},{"match_name":"Collin County USPSA Nov. 27 2016","match_date":"2016-11-25","stage_classifiercode":"99-12","member_number":"A75709","first_name":"BRYAN","last_name":"WEBSTER","classification":"B","division":"LIMITED","hit_factor":5.9809},{"match_name":"XMG USPSA   Saturday September  4th 2021","match_date":"2021-09-04","stage_classifiercode":"99-12","member_number":"fy-62076","first_name":"TRIP","last_name":"MCINGVALE","classification":"M","division":"LIMITED","hit_factor":5.9796},{"match_name":"PCGC  June 2017","match_date":"2017-06-25","stage_classifiercode":"99-12","member_number":"A102077","first_name":"SHAWN","last_name":"BASTIN","classification":"U","division":"LIMITED","hit_factor":5.9609},{"match_name":"LdF USPSA Match July 14 2018","match_date":"2018-07-14","stage_classifiercode":"99-12","member_number":"TY80157","first_name":"DAVE","last_name":"DEZAN 2","classification":"U","division":"LIMITED","hit_factor":5.9595},{"match_name":"BRC_20170611","match_date":"2017-06-11","stage_classifiercode":"99-12","member_number":"L329","first_name":"GURNEE","last_name":"MUNN III","classification":"B","division":"LIMITED","hit_factor":5.9375},{"match_name":"OK15 USPSA at USSA","match_date":"2017-12-10","stage_classifiercode":"99-12","member_number":"A20546","first_name":"JESS","last_name":"ANDERSON","classification":"M","division":"LIMITED","hit_factor":5.9361},{"match_name":"ECPS USPSA 17 Feb 18","match_date":"2018-02-16","stage_classifiercode":"99-12","member_number":"A99933","first_name":"DOUG","last_name":"SCOTT","classification":"C","division":"LIMITED","hit_factor":5.9322},{"match_name":"AIPS  USPSA Monthly 12 November 2016","match_date":"2016-11-12","stage_classifiercode":"99-12","member_number":"TY82873","first_name":"BEN","last_name":"OLESON","classification":"B","division":"LIMITED","hit_factor":5.9302},{"match_name":"ECPS USPSA 17 Feb 18","match_date":"2018-02-16","stage_classifiercode":"99-12","member_number":"a52372","first_name":"HURLEY","last_name":"RIDER","classification":"B","division":"LIMITED","hit_factor":5.9242},{"match_name":"TAC2 USPSA August 2017","match_date":"2017-08-05","stage_classifiercode":"99-12","member_number":"A98619","first_name":"ROCCO","last_name":"PRESTON","classification":"U","division":"LIMITED","hit_factor":5.9165},{"match_name":"LdF 4th Saturday Match","match_date":"2016-01-23","stage_classifiercode":"99-12","member_number":"TY82338","first_name":"AL","last_name":"WILLINGHAM","classification":"B","division":"LIMITED","hit_factor":5.9165},{"match_name":"Richmond Hot Shots February 7-2016 USPSA Match","match_date":"2016-02-07","stage_classifiercode":"99-12","member_number":"A78576","first_name":"NICK","last_name":"MERCURIO","classification":"A","division":"LIMITED","hit_factor":5.9102},{"match_name":"ECPS USPSA 17 Feb 18","match_date":"2018-02-16","stage_classifiercode":"99-12","member_number":"A76919","first_name":"TERRY","last_name":"YU","classification":"B","division":"LIMITED","hit_factor":5.9102},{"match_name":"SSS USPSA February 2020","match_date":"2020-02-16","stage_classifiercode":"99-12","member_number":"A93775","first_name":"JOHN","last_name":"WESTBROOK JR","classification":"C (C Class)","division":"LIMITED","hit_factor":5.9006},{"match_name":"LCSA USPSA ALL CLASSIFIER ","match_date":"2018-06-30","stage_classifiercode":"99-12","member_number":"A92139","first_name":"DAVID","last_name":"PALAKOVICH","classification":"B","division":"LIMITED","hit_factor":5.8957},{"match_name":"GAS October 6th Match","match_date":"2018-10-06","stage_classifiercode":"99-12","member_number":"A36277","first_name":"JO","last_name":"ROSENCRANTZ","classification":"B","division":"LIMITED","hit_factor":5.8954},{"match_name":"Chillicothe May-2017 USPSA Match","match_date":"2017-05-28","stage_classifiercode":"99-12","member_number":"A93995","first_name":"VINCENT","last_name":"STROW","classification":"B","division":"LIMITED","hit_factor":5.889},{"match_name":"MSSA Uspsa Match","match_date":"2017-04-08","stage_classifiercode":"99-12","member_number":"A79446","first_name":"BEN","last_name":"BLANKENSHIP","classification":"B","division":"LIMITED","hit_factor":5.8887},{"match_name":"SCAPSA MN05 Summer League 1","match_date":"2017-06-05","stage_classifiercode":"99-12","member_number":"FY65706","first_name":"TIM","last_name":"GASPERLIN","classification":"C","division":"LIMITED","hit_factor":5.8824},{"match_name":"Brothers N Arms February 2018 USPSA Match","match_date":"2018-02-17","stage_classifiercode":"99-12","member_number":"A71620","first_name":"NICK","last_name":"SAUCIER","classification":"B","division":"LIMITED","hit_factor":5.8754},{"match_name":"CVSC 06-25-2017","match_date":"2017-06-25","stage_classifiercode":"99-12","member_number":"\"\"","first_name":"NICK","last_name":"ROBERTS","classification":"B","division":"LIMITED","hit_factor":5.8752},{"match_name":"Southern Arizona Practical Shooters 05_5_18","match_date":"2018-05-05","stage_classifiercode":"99-12","member_number":"A53448","first_name":"NEAL","last_name":"WEGNER","classification":"A","division":"LIMITED","hit_factor":5.8702},{"match_name":"LCSA USPSA ALL CLASSIFIER ","match_date":"2018-06-30","stage_classifiercode":"99-12","member_number":"A91103","first_name":"DANIEL","last_name":"TOOMBS","classification":"C","division":"LIMITED","hit_factor":5.8685},{"match_name":"OFGC USPSA Match 10-21-18","match_date":"2018-10-21","stage_classifiercode":"99-12","member_number":"A107288","first_name":"COREY","last_name":"CHURCHILL","classification":"D","division":"LIMITED","hit_factor":5.8632},{"match_name":"SPSA USPSA March 4th Sat match","match_date":"2017-03-25","stage_classifiercode":"99-12","member_number":"TY70556","first_name":"BRUCE","last_name":"BELVIN","classification":"B","division":"LIMITED","hit_factor":5.8542},{"match_name":"NNRPA USPSA May 2018","match_date":"2018-05-26","stage_classifiercode":"99-12","member_number":"A86242","first_name":"MICHAEL","last_name":"DOWELL","classification":"C","division":"LIMITED","hit_factor":5.8486},{"match_name":"SFPC September USPSA Special Classifier match","match_date":"2016-09-04","stage_classifiercode":"99-12","member_number":"A96881","first_name":"JASON","last_name":"KELLY","classification":"C","division":"LIMITED","hit_factor":5.8455},{"match_name":"North Mountain July ","match_date":"2016-07-17","stage_classifiercode":"99-12","member_number":"a85026","first_name":"EVAN","last_name":"DOSS","classification":"U","division":"LIMITED","hit_factor":5.8385},{"match_name":"OK15 USPSA at USSA","match_date":"2017-12-10","stage_classifiercode":"99-12","member_number":"a-39238","first_name":"CURT","last_name":"NICHOLS","classification":"B","division":"LIMITED","hit_factor":5.8315},{"match_name":"WTPS USPSA April Classifier Match 4-8-17","match_date":"2017-04-08","stage_classifiercode":"99-12","member_number":"TY85410","first_name":"CHAD","last_name":"SANDERS","classification":"C","division":"LIMITED","hit_factor":5.8296},{"match_name":"ENPS May 2018 USPSA Match","match_date":"2018-05-06","stage_classifiercode":"99-12","member_number":"A100267","first_name":"KEVIN","last_name":"BYRD","classification":"U","division":"LIMITED","hit_factor":5.8286},{"match_name":"LdF USPSA Match July 14 2018","match_date":"2018-07-14","stage_classifiercode":"99-12","member_number":"A81093","first_name":"LEX","last_name":"BELTRAN","classification":"B","division":"LIMITED","hit_factor":5.8278},{"match_name":"MRPC USPSA Mar 2017","match_date":"2017-03-26","stage_classifiercode":"99-12","member_number":"A59101","first_name":"DAN","last_name":"DITULLIO","classification":"A","division":"LIMITED","hit_factor":5.8057},{"match_name":"ECPS USPSA 17 Feb 18","match_date":"2018-02-16","stage_classifiercode":"99-12","member_number":"A95090","first_name":"MARK","last_name":"RAMIREZ","classification":"C","division":"LIMITED","hit_factor":5.8005},{"match_name":"USPSA","match_date":"2016-06-04","stage_classifiercode":"99-12","member_number":"A58364","first_name":"LANCE","last_name":"JOSHLIN","classification":"U","division":"LIMITED","hit_factor":5.7953},{"match_name":"Brothers N Arms August 2018 USPSA Match","match_date":"2018-08-18","stage_classifiercode":"99-12","member_number":"A106260","first_name":"HOUSTON","last_name":"BYRNE","classification":"C","division":"LIMITED","hit_factor":5.7889},{"match_name":"WSPS OCTOBER 2017 USPSA MATCH","match_date":"2017-10-21","stage_classifiercode":"99-12","member_number":"TY76695","first_name":"TODD","last_name":"BOYER","classification":"B","division":"LIMITED","hit_factor":5.7882},{"match_name":"SPSA USPSA March 4th Sat match","match_date":"2017-03-25","stage_classifiercode":"99-12","member_number":"TY3777","first_name":"MIKE","last_name":"MORRIS","classification":"A","division":"LIMITED","hit_factor":5.7851},{"match_name":"MCPSL Pistol 4-9-16","match_date":"2016-04-09","stage_classifiercode":"99-12","member_number":"A77880","first_name":"ADAM","last_name":"BALZER","classification":"U","division":"LIMITED","hit_factor":5.7803},{"match_name":"BSTRC Dec 20 2017","match_date":"2017-12-20","stage_classifiercode":"99-12","member_number":"A101138","first_name":"MICHAEL","last_name":"MORRISON","classification":"C","division":"LIMITED","hit_factor":5.7773},{"match_name":"Belton Gun Club USPSA January MATCH 1-30-21","match_date":"2021-01-30","stage_classifiercode":"99-12","member_number":"FY80548","first_name":"DAN","last_name":"DOIRON","classification":"B","division":"LIMITED","hit_factor":5.7604},{"match_name":"Brothers N Arms February 2018 USPSA Match","match_date":"2018-02-17","stage_classifiercode":"99-12","member_number":"A99396","first_name":"SAL","last_name":"LABRUZZA","classification":"U","division":"LIMITED","hit_factor":5.7562},{"match_name":"RD Shooters May 6th USPSA  match","match_date":"2017-05-06","stage_classifiercode":"99-12","member_number":"A77529","first_name":"JOSH","last_name":"PINCHES2","classification":"B","division":"LIMITED","hit_factor":5.7554},{"match_name":"LIPSA - November 4th 2018 - USPSA Classifier Match","match_date":"2018-11-04","stage_classifiercode":"99-12","member_number":"A74383","first_name":"PAUL","last_name":"ROBINSON","classification":"D","division":"LIMITED","hit_factor":5.7546},{"match_name":"RD Shooters May 6th USPSA  match","match_date":"2017-05-06","stage_classifiercode":"99-12","member_number":"A85282","first_name":"RANDEE","last_name":"KAISER","classification":"B","division":"LIMITED","hit_factor":5.7522},{"match_name":"Palmetto Gun Club - February 2018 USPSA","match_date":"2018-02-03","stage_classifiercode":"99-12","member_number":"A62570","first_name":"MICHAEL","last_name":"ADAMS","classification":"B","division":"LIMITED","hit_factor":5.7485},{"match_name":"MCPSL Pistol 4-8-17","match_date":"2017-04-08","stage_classifiercode":"99-12","member_number":"A96146","first_name":"BEN","last_name":"DEHAEMERS","classification":"C","division":"LIMITED","hit_factor":5.7447},{"match_name":"Nampa USPSA February 1st","match_date":"2020-02-01","stage_classifiercode":"99-12","member_number":"A69094","first_name":"AARON","last_name":"LAWS","classification":"M","division":"LIMITED","hit_factor":5.7423},{"match_name":"Ducky Shoot August","match_date":"2018-08-18","stage_classifiercode":"99-12","member_number":"A-113189","first_name":"PATRICK","last_name":"DOWD","classification":"U","division":"LIMITED","hit_factor":5.7386},{"match_name":"Richmond Hot Shots USPSA Classifier Match Sat April 8-2017","match_date":"2017-04-08","stage_classifiercode":"99-12","member_number":"TY87820","first_name":"LOUIE","last_name":"TIRONA","classification":"U","division":"LIMITED","hit_factor":5.7377},{"match_name":"Nampa USPSA February 1st","match_date":"2020-02-01","stage_classifiercode":"99-12","member_number":"A98329","first_name":"TRESA","last_name":"WEAVER","classification":"B","division":"LIMITED","hit_factor":5.7303},{"match_name":"AAPS AAFG Special Classifier Match - March 31 2018","match_date":"2018-03-31","stage_classifiercode":"99-12","member_number":"TY83421","first_name":"TREVOR","last_name":"SCHEUNEMAN","classification":"U","division":"LIMITED","hit_factor":5.7257},{"match_name":"Danville Rifle and Pistol Club USPSA IL17 April 21 2018","match_date":"2018-04-21","stage_classifiercode":"99-12","member_number":"\"\"","first_name":"TERRY","last_name":"EVERINGHAM","classification":"U","division":"LIMITED","hit_factor":5.7217},{"match_name":"SCAPSA MN05 Summer League 1","match_date":"2017-06-05","stage_classifiercode":"99-12","member_number":"TY64275","first_name":"JOE","last_name":"HOUSER","classification":"C","division":"LIMITED","hit_factor":5.7203},{"match_name":"Laser Ninja Dragon League USPSA August 2017","match_date":"2017-08-06","stage_classifiercode":"99-12","member_number":"A98608","first_name":"DANIEL","last_name":"FLOWERS","classification":"C","division":"LIMITED","hit_factor":5.7143},{"match_name":"SFPS 05-21-17 Superclassifier Gun1","match_date":"2017-05-21","stage_classifiercode":"99-12","member_number":"pending","first_name":"NICK","last_name":"HARTIG","classification":"U","division":"LIMITED","hit_factor":5.7143},{"match_name":"MSA USPSA Special Classifier 12-4-16","match_date":"2016-12-04","stage_classifiercode":"99-12","member_number":"A-90978","first_name":"KANE","last_name":"KOLISEK","classification":"U","division":"LIMITED","hit_factor":5.7113},{"match_name":"AIPS  USPSA Monthly 12 November 2016","match_date":"2016-11-12","stage_classifiercode":"99-12","member_number":"A95108","first_name":"EVAN","last_name":"NICHOLS","classification":"U","division":"LIMITED","hit_factor":5.6955},{"match_name":"ECPS USPSA 17 Feb 18","match_date":"2018-02-16","stage_classifiercode":"99-12","member_number":"TY59982","first_name":"ANDY","last_name":"PHILLIPS","classification":"A","division":"LIMITED","hit_factor":5.6832},{"match_name":"SPSA USPSA March 4th Sat match","match_date":"2017-03-25","stage_classifiercode":"99-12","member_number":"A82837","first_name":"DANIEL","last_name":"BOYLSTON","classification":"B","division":"LIMITED","hit_factor":5.683},{"match_name":"MSSA Uspsa Match","match_date":"2017-04-08","stage_classifiercode":"99-12","member_number":"A72997","first_name":"DAVID","last_name":"HARNESS","classification":"\"\"","division":"LIMITED","hit_factor":5.6807},{"match_name":"SCCPSA USPSA Mar 17","match_date":"2018-03-17","stage_classifiercode":"99-12","member_number":"FY66562","first_name":"JONATHAN","last_name":"MARUCOT","classification":"U","division":"LIMITED","hit_factor":5.6795},{"match_name":"Shongum Pistol November 2015","match_date":"2015-11-07","stage_classifiercode":"99-12","member_number":"\"\"","first_name":"RUSS","last_name":"TEITSMA","classification":"U","division":"LIMITED","hit_factor":5.6716},{"match_name":"USPSA","match_date":"2016-06-04","stage_classifiercode":"99-12","member_number":"A58482","first_name":"KELLY","last_name":"MURRAY","classification":"B","division":"LIMITED","hit_factor":5.6701},{"match_name":"SSFGA & Master Blasters USPSA Classifier","match_date":"2018-11-17","stage_classifiercode":"99-12","member_number":"A104916","first_name":"JONATHAN","last_name":"STEVENS","classification":"U","division":"LIMITED","hit_factor":5.6604},{"match_name":"SCAPSA MN05 Summer League 1","match_date":"2017-06-05","stage_classifiercode":"99-12","member_number":"A96503","first_name":"CARL","last_name":"CHRISTENSEN","classification":"U","division":"LIMITED","hit_factor":5.653},{"match_name":"WTPS USPSA April Classifier Match 4-8-17","match_date":"2017-04-08","stage_classifiercode":"99-12","member_number":"A69018","first_name":"DARRYL","last_name":"BOKMAN","classification":"C","division":"LIMITED","hit_factor":5.6522},{"match_name":"PCGC  June 2017","match_date":"2017-06-25","stage_classifiercode":"99-12","member_number":"\"\"","first_name":"MIKE","last_name":"KAUFF","classification":"U","division":"LIMITED","hit_factor":5.6497},{"match_name":"LdF 4th Saturday Match","match_date":"2016-01-23","stage_classifiercode":"99-12","member_number":"A72431","first_name":"SONNY","last_name":"SARTE","classification":"C","division":"LIMITED","hit_factor":5.6471},{"match_name":"Laser Ninja Dragon League USPSA August 2017","match_date":"2017-08-06","stage_classifiercode":"99-12","member_number":"A104211","first_name":"JOSHUA","last_name":"MILLER","classification":"U","division":"LIMITED","hit_factor":5.6442},{"match_name":"MSSA Uspsa Match","match_date":"2017-04-08","stage_classifiercode":"99-12","member_number":"A91827","first_name":"PRESTON","last_name":"KING","classification":"B","division":"LIMITED","hit_factor":5.6281},{"match_name":"Hosemasters  3rd Sunday Feburary 2017","match_date":"2017-02-12","stage_classifiercode":"99-12","member_number":"L2568","first_name":"JAMES","last_name":"NORTZ","classification":"G","division":"LIMITED","hit_factor":5.6277},{"match_name":"GAS October 6th Match","match_date":"2018-10-06","stage_classifiercode":"99-12","member_number":"TY43042","first_name":"DAN","last_name":"HASH","classification":"A","division":"LIMITED","hit_factor":5.6266},{"match_name":"Brothers N Arms August 2018 USPSA Match","match_date":"2018-08-18","stage_classifiercode":"99-12","member_number":"FY95567","first_name":"PAUL","last_name":"HARRIS","classification":"C","division":"LIMITED","hit_factor":5.6263},{"match_name":"Emmett September Match","match_date":"2016-09-24","stage_classifiercode":"99-12","member_number":"a95272","first_name":"WADE","last_name":"MEYER","classification":"C","division":"LIMITED","hit_factor":5.6263},{"match_name":"BSTRC Dec 20 2017","match_date":"2017-12-20","stage_classifiercode":"99-12","member_number":"A62630","first_name":"ROBERT","last_name":"OTIS","classification":"A","division":"LIMITED","hit_factor":5.6243},{"match_name":"NNRPA USPSA May 2018","match_date":"2018-05-26","stage_classifiercode":"99-12","member_number":"TY92480","first_name":"AMOS","last_name":"RADDATZ","classification":"C","division":"LIMITED","hit_factor":5.6235},{"match_name":"Laser Ninja Dragon League USPSA August 2017","match_date":"2017-08-06","stage_classifiercode":"99-12","member_number":"A99942","first_name":"JOHN","last_name":"MORRISON","classification":"B","division":"LIMITED","hit_factor":5.6229},{"match_name":"SSS USPSA February 2020","match_date":"2020-02-16","stage_classifiercode":"99-12","member_number":"A118011","first_name":"ELIE","last_name":"AOUN","classification":"U (Unclassified)","division":"LIMITED","hit_factor":5.6225},{"match_name":"FBURG April 2017 Level I USPSA ","match_date":"2017-04-01","stage_classifiercode":"99-12","member_number":"A89510","first_name":"BRIAN","last_name":"ONG","classification":"C","division":"LIMITED","hit_factor":5.6158},{"match_name":"BRC_20170611","match_date":"2017-06-11","stage_classifiercode":"99-12","member_number":"TY65590","first_name":"STEVE","last_name":"STETLER","classification":"M","division":"LIMITED","hit_factor":5.613},{"match_name":"Chillicothe May-2017 USPSA Match","match_date":"2017-05-28","stage_classifiercode":"99-12","member_number":"A62909","first_name":"TROY","last_name":"NOBLE","classification":"U","division":"LIMITED","hit_factor":5.6085},{"match_name":"Springfield Tactical Shooters 09/03/2020","match_date":"2020-09-03","stage_classifiercode":"99-12","member_number":"\"\"","first_name":"GEORGE","last_name":"EAMES","classification":"\"\"","division":"LIMITED","hit_factor":5.6075},{"match_name":"Triforce Practical Shooters at BigWoodsGoods","match_date":"2016-09-22","stage_classifiercode":"99-12","member_number":"A84202","first_name":"DOUG","last_name":"RUTLEDGE","classification":"B","division":"LIMITED","hit_factor":5.6054},{"match_name":"DCPA USPSA 9-11-2016","match_date":"2016-09-09","stage_classifiercode":"99-12","member_number":"TY52466","first_name":"TODD","last_name":"MILLS","classification":"U","division":"LIMITED","hit_factor":5.6039},{"match_name":"OK15 USPSA at USSA","match_date":"2017-12-10","stage_classifiercode":"99-12","member_number":"A107030","first_name":"MITCHELL","last_name":"GRAF","classification":"U","division":"LIMITED","hit_factor":5.6039},{"match_name":"2020-03 Bone Creek USPSA","match_date":"2020-03-01","stage_classifiercode":"99-12","member_number":"A106540","first_name":"CAMERON","last_name":"CAHN","classification":"C","division":"LIMITED","hit_factor":5.6009},{"match_name":"Stock & Barrel MN18 November 2020 USPSA Classifier Match","match_date":"2020-11-01","stage_classifiercode":"99-12","member_number":"A95574","first_name":"CHARLES","last_name":"KIM","classification":"U","division":"LIMITED","hit_factor":5.6},{"match_name":"Minnetonka Game And Fish May 23","match_date":"2018-05-23","stage_classifiercode":"99-12","member_number":"TY59462","first_name":"RICHARD","last_name":"KAVANAGH","classification":"B","division":"LIMITED","hit_factor":5.599},{"match_name":"NISA April Classifer Match 2016","match_date":"2016-04-24","stage_classifiercode":"99-12","member_number":"A89698","first_name":"ERIC","last_name":"KAMPS","classification":"X","division":"LIMITED","hit_factor":5.5952},{"match_name":"MCPSL Pistol 4-9-16","match_date":"2016-04-09","stage_classifiercode":"99-12","member_number":"TY53551","first_name":"GREG","last_name":"BILLS","classification":"B","division":"LIMITED","hit_factor":5.5914},{"match_name":"gun2 sfps20170521 2","match_date":"2017-05-20","stage_classifiercode":"99-12","member_number":"TY90733","first_name":"ROBERT","last_name":"OLSON","classification":"C","division":"LIMITED","hit_factor":5.5886},{"match_name":"OK15 USPSA at USSA","match_date":"2017-12-10","stage_classifiercode":"99-12","member_number":"\"\"","first_name":"TYLER","last_name":"HAGA","classification":"U","division":"LIMITED","hit_factor":5.5854},{"match_name":"ECPS USPSA 17 Feb 18","match_date":"2018-02-16","stage_classifiercode":"99-12","member_number":"\"\"","first_name":"MATT","last_name":"RUSHTON","classification":"U","division":"LIMITED","hit_factor":5.5825},{"match_name":"LPRGC-Lower Providence USPSA May-2 2017","match_date":"2017-05-13","stage_classifiercode":"99-12","member_number":"TY68809","first_name":"JAMES","last_name":"GRAZIANO SR","classification":"B","division":"LIMITED","hit_factor":5.5823},{"match_name":"Atlanta Practical Shooters March 2016 USPSA - Classifier Match","match_date":"2016-03-06","stage_classifiercode":"99-12","member_number":"A93229","first_name":"JEREMY","last_name":"SWOFFORD","classification":"U","division":"LIMITED","hit_factor":5.5741},{"match_name":"Pelham USPSA 2016-09-18","match_date":"2016-09-18","stage_classifiercode":"99-12","member_number":"A84948","first_name":"ANDREW","last_name":"HOLBROOK","classification":"U","division":"LIMITED","hit_factor":5.5728},{"match_name":"WTPS USPSA April Classifier Match 4-8-17","match_date":"2017-04-08","stage_classifiercode":"99-12","member_number":"A96244","first_name":"MARK","last_name":"SOUTHERLAND","classification":"U","division":"LIMITED","hit_factor":5.5713},{"match_name":"WPS USPSA Monthly Match September 2018","match_date":"2018-09-01","stage_classifiercode":"99-12","member_number":"A81773","first_name":"SHAWN","last_name":"SARLES","classification":"U","division":"LIMITED","hit_factor":5.5629},{"match_name":"Springfield Tactical Shooters 06-07-2018","match_date":"2018-06-07","stage_classifiercode":"99-12","member_number":"\"\"","first_name":"ANDREW","last_name":"CATLIN","classification":"\"\"","division":"LIMITED","hit_factor":5.5556},{"match_name":"GAS October 6th Match","match_date":"2018-10-06","stage_classifiercode":"99-12","member_number":"L3409","first_name":"BRUCE","last_name":"REID","classification":"B","division":"LIMITED","hit_factor":5.5494},{"match_name":"Palmetto Gun Club - February 2018 USPSA","match_date":"2018-02-03","stage_classifiercode":"99-12","member_number":"A69774","first_name":"DAVID","last_name":"FISCHER","classification":"B","division":"LIMITED","hit_factor":5.5432},{"match_name":"LdF 4th Saturday Match","match_date":"2016-01-23","stage_classifiercode":"99-12","member_number":"TY86409","first_name":"BO","last_name":"GIBBONS","classification":"C","division":"LIMITED","hit_factor":5.5427},{"match_name":"MCPSL Pistol 4-8-17","match_date":"2017-04-08","stage_classifiercode":"99-12","member_number":"A96275","first_name":"SCOTT","last_name":"PLACKE","classification":"C","division":"LIMITED","hit_factor":5.5371},{"match_name":"BSTRC Dec 20 2017","match_date":"2017-12-20","stage_classifiercode":"99-12","member_number":"FY91992","first_name":"BRYAN","last_name":"CLARK","classification":"B","division":"LIMITED","hit_factor":5.5271},{"match_name":"NVSA USPSA 1711","match_date":"2017-11-05","stage_classifiercode":"99-12","member_number":"TY86761","first_name":"RYAN","last_name":"ZELACHOSKI","classification":"C","division":"LIMITED","hit_factor":5.526},{"match_name":"MCPSL Pistol 4-8-17","match_date":"2017-04-08","stage_classifiercode":"99-12","member_number":"A96597","first_name":"MATTHEW","last_name":"KRAINBILL","classification":"U","division":"LIMITED","hit_factor":5.5233},{"match_name":"Brothers N Arms February 2018 USPSA Match","match_date":"2018-02-17","stage_classifiercode":"99-12","member_number":"L4158","first_name":"CHRIS","last_name":"BROWN","classification":"B","division":"LIMITED","hit_factor":5.5233},{"match_name":"Pinetucky USPSA 11-19-16","match_date":"2016-11-19","stage_classifiercode":"99-12","member_number":"ty73725","first_name":"ADAM","last_name":"MUELLER","classification":"A","division":"LIMITED","hit_factor":5.5077},{"match_name":"North Mountain July ","match_date":"2016-07-17","stage_classifiercode":"99-12","member_number":"FY20457","first_name":"SCOTT","last_name":"WARREN","classification":"M","division":"LIMITED","hit_factor":5.5069},{"match_name":"RD Shooters May 6th USPSA  match","match_date":"2017-05-06","stage_classifiercode":"99-12","member_number":"A51402","first_name":"DOC","last_name":"WELSHER","classification":"B","division":"LIMITED","hit_factor":5.5046},{"match_name":"Prescott 3rd Sunday USPSA 11-20-2016","match_date":"2016-11-20","stage_classifiercode":"99-12","member_number":"TY15412","first_name":"RON","last_name":"YOUNGER","classification":"A","division":"LIMITED","hit_factor":5.5012},{"match_name":"RBGC 2018-7-28","match_date":"2018-07-28","stage_classifiercode":"99-12","member_number":"\"\"","first_name":"SCOTT","last_name":"PARMITER","classification":"U","division":"LIMITED","hit_factor":5.4983},{"match_name":"Springfield Tactical Shooters 06-07-2018","match_date":"2018-06-07","stage_classifiercode":"99-12","member_number":"TY35016","first_name":"ANDREW","last_name":"CATLIN","classification":"B","division":"LIMITED","hit_factor":5.4983},{"match_name":"Emmett September Match","match_date":"2016-09-24","stage_classifiercode":"99-12","member_number":"a92269","first_name":"SCOTT","last_name":"VICKERS","classification":"B","division":"LIMITED","hit_factor":5.4958},{"match_name":"Hosemasters  3rd Sunday Feburary 2017","match_date":"2017-02-12","stage_classifiercode":"99-12","member_number":"TY63687","first_name":"DAN","last_name":"NEWTON","classification":"B","division":"LIMITED","hit_factor":5.4902},{"match_name":"South Texas Tactical USPSA","match_date":"2017-07-08","stage_classifiercode":"99-12","member_number":"L3849","first_name":"DARRELL","last_name":"HOLLAND","classification":"C","division":"LIMITED","hit_factor":5.4878},{"match_name":"SCCPSA USPSA Mar 17","match_date":"2018-03-17","stage_classifiercode":"99-12","member_number":"FY60892","first_name":"MICHAEL","last_name":"ALEXANDER","classification":"U","division":"LIMITED","hit_factor":5.4765},{"match_name":"OK15 USPSA AT USSA","match_date":"2016-07-10","stage_classifiercode":"99-12","member_number":"a20546","first_name":"JESS","last_name":"ANDERSON","classification":"M","division":"LIMITED","hit_factor":5.4697},{"match_name":"GMPS 5/7/17","match_date":"2017-05-06","stage_classifiercode":"99-12","member_number":"A86813","first_name":"SHAWN","last_name":"DRAGOO","classification":"C","division":"LIMITED","hit_factor":5.4696},{"match_name":"CGC 2017_05_13","match_date":"2017-05-13","stage_classifiercode":"99-12","member_number":"A98278","first_name":"JOHN","last_name":"WINDES","classification":"A","division":"LIMITED","hit_factor":5.4688},{"match_name":"NISA April Classifer Match 2016","match_date":"2016-04-24","stage_classifiercode":"99-12","member_number":"Ty69648","first_name":"STEVEN","last_name":"GALKA","classification":"A","division":"LIMITED","hit_factor":5.4565},{"match_name":"PCGC  June 2017","match_date":"2017-06-25","stage_classifiercode":"99-12","member_number":"TY72738","first_name":"MICHAEL","last_name":"THOMPSON","classification":"B","division":"LIMITED","hit_factor":5.4471},{"match_name":"LCSA USPSA ALL CLASSIFIER ","match_date":"2018-06-30","stage_classifiercode":"99-12","member_number":"TY91700","first_name":"JEFF","last_name":"MORSE","classification":"B","division":"LIMITED","hit_factor":5.4388},{"match_name":"LCSA USPSA ALL CLASSIFIER ","match_date":"2018-06-30","stage_classifiercode":"99-12","member_number":"TY97141","first_name":"BRETT","last_name":"ZWOLENSKY","classification":"C","division":"LIMITED","hit_factor":5.4384},{"match_name":"ENPS May 2018 USPSA Match","match_date":"2018-05-06","stage_classifiercode":"99-12","member_number":"TY44974","first_name":"RICHARD J","last_name":"SIMANDL","classification":"C","division":"LIMITED","hit_factor":5.4381},{"match_name":"ENPS May 2018 USPSA Match","match_date":"2018-05-06","stage_classifiercode":"99-12","member_number":"FY46314","first_name":"GARY","last_name":"SCHENAMAN","classification":"C","division":"LIMITED","hit_factor":5.4326},{"match_name":"RBGC 2018-7-28","match_date":"2018-07-28","stage_classifiercode":"99-12","member_number":"TY75726","first_name":"PEDRO","last_name":"QUINONES","classification":"B","division":"LIMITED","hit_factor":5.4289},{"match_name":"LdF 4th Saturday Match","match_date":"2016-01-23","stage_classifiercode":"99-12","member_number":"A93090","first_name":"RICHARD","last_name":"EZELL","classification":"C","division":"LIMITED","hit_factor":5.423},{"match_name":"Danville Rifle and Pistol Club USPSA IL17 April 21 2018","match_date":"2018-04-21","stage_classifiercode":"99-12","member_number":"a96810","first_name":"JASON","last_name":"PALMER","classification":"B","division":"LIMITED","hit_factor":5.3991},{"match_name":"Range E11even Feb 2018 USPSA","match_date":"2018-02-24","stage_classifiercode":"99-12","member_number":"TY80548","first_name":"DAN","last_name":"DOIRON","classification":"B","division":"LIMITED","hit_factor":5.395},{"match_name":"Collin County USPSA Nov. 27 2016","match_date":"2016-11-25","stage_classifiercode":"99-12","member_number":"A94608","first_name":"ESTUARDO","last_name":"BALDERAS","classification":"U","division":"LIMITED","hit_factor":5.3942},{"match_name":"17s PSC - Feb 2017 - USPSA match","match_date":"2017-02-04","stage_classifiercode":"99-12","member_number":"A95115","first_name":"MARCUS","last_name":"PETERSON","classification":"U","division":"LIMITED","hit_factor":5.3942},{"match_name":"Pelham USPSA 2016-09-18","match_date":"2016-09-18","stage_classifiercode":"99-12","member_number":"TY54685","first_name":"BRENT","last_name":"CARLTON","classification":"U","division":"LIMITED","hit_factor":5.3886},{"match_name":"FBPPC DECEMBER 2016 SPECIAL CLASSIFIER MATCH","match_date":"2016-12-10","stage_classifiercode":"99-12","member_number":"FY80542","first_name":"DIANA","last_name":"DRISCOLL","classification":"B","division":"LIMITED","hit_factor":5.3854},{"match_name":"OFGC USPSA Match Feb 19th 2017","match_date":"2017-02-19","stage_classifiercode":"99-12","member_number":"A5104","first_name":"DOC","last_name":"WELSHER","classification":"B","division":"LIMITED","hit_factor":5.3816},{"match_name":"Chillicothe May-2017 USPSA Match","match_date":"2017-05-28","stage_classifiercode":"99-12","member_number":"A74372","first_name":"BRIAN","last_name":"ROWLISON","classification":"C","division":"LIMITED","hit_factor":5.3763},{"match_name":"ENPS May 2018 USPSA Match","match_date":"2018-05-06","stage_classifiercode":"99-12","member_number":"a104318","first_name":"JIM","last_name":"HOLTMEYER","classification":"U","division":"LIMITED","hit_factor":5.3571},{"match_name":"MSA USPSA Special Classifier 12-4-16","match_date":"2016-12-04","stage_classifiercode":"99-12","member_number":"\"\"","first_name":"JOHN","last_name":"MORRISON","classification":"U","division":"LIMITED","hit_factor":5.3498},{"match_name":"Tangi January 2016 USPSA","match_date":"2016-01-23","stage_classifiercode":"99-12","member_number":"ty62332","first_name":"JOHN","last_name":"HUBER","classification":"D","division":"LIMITED","hit_factor":5.3419},{"match_name":"SCCCJULYCLASSIFIER2016","match_date":"2016-07-30","stage_classifiercode":"99-12","member_number":"\"\"","first_name":"JIM","last_name":"GEIGER","classification":"U","division":"LIMITED","hit_factor":5.3333},{"match_name":"Minnetonka Game And Fish May 23","match_date":"2018-05-23","stage_classifiercode":"99-12","member_number":"A96227","first_name":"KAYLA","last_name":"BARDEN","classification":"C","division":"LIMITED","hit_factor":5.3319},{"match_name":"WTPS USPSA April Classifier Match 4-8-17","match_date":"2017-04-08","stage_classifiercode":"99-12","member_number":"A102382","first_name":"CODY","last_name":"BRESHERS","classification":"U","division":"LIMITED","hit_factor":5.3309},{"match_name":"SSP Super Classifier 1-30-16","match_date":"2016-01-30","stage_classifiercode":"99-12","member_number":"PEN","first_name":"PAUL","last_name":"TAYLOR","classification":"Unclassified","division":"LIMITED","hit_factor":5.3274},{"match_name":"BRC_20170611","match_date":"2017-06-11","stage_classifiercode":"99-12","member_number":"Ty87911","first_name":"KEITH","last_name":"MARKEY","classification":"B","division":"LIMITED","hit_factor":5.3236},{"match_name":"ECPS USPSA 17 Feb 18","match_date":"2018-02-16","stage_classifiercode":"99-12","member_number":"A52486","first_name":"NICK","last_name":"SIESSER","classification":"B","division":"LIMITED","hit_factor":5.3191},{"match_name":"Hosemasters  3rd Sunday Feburary 2017","match_date":"2017-02-12","stage_classifiercode":"99-12","member_number":"A86545","first_name":"JAY","last_name":"WEBB","classification":"A","division":"LIMITED","hit_factor":5.3152},{"match_name":"LdF 4th Saturday Match","match_date":"2016-01-23","stage_classifiercode":"99-12","member_number":"TY63347","first_name":"MICHAEL","last_name":"ZOLEZZI","classification":"A","division":"LIMITED","hit_factor":5.3147},{"match_name":"OK15 USPSA at USSA","match_date":"2017-12-10","stage_classifiercode":"99-12","member_number":"TY96845","first_name":"GARRETT","last_name":"GROVER","classification":"U","division":"LIMITED","hit_factor":5.3147},{"match_name":"Griffin USPSA Match Aug 2017","match_date":"2017-08-19","stage_classifiercode":"99-12","member_number":"A95431","first_name":"JASON","last_name":"BOYD","classification":"U","division":"LIMITED","hit_factor":5.3097},{"match_name":"Pinetucky USPSA 11-19-16","match_date":"2016-11-19","stage_classifiercode":"99-12","member_number":"TY61427","first_name":"MICHAEL","last_name":"NYLAND","classification":"B","division":"LIMITED","hit_factor":5.307},{"match_name":"CVSC 06-25-2017","match_date":"2017-06-25","stage_classifiercode":"99-12","member_number":"A91855","first_name":"PEDRO","last_name":"BRAZ","classification":"C","division":"LIMITED","hit_factor":5.3007},{"match_name":"Brothers N Arms August 2018 USPSA Match","match_date":"2018-08-18","stage_classifiercode":"99-12","member_number":"FY90633","first_name":"BRANT","last_name":"PACE","classification":"B","division":"LIMITED","hit_factor":5.298},{"match_name":"DWB - Deadwood Boys USPSA 18 February 2018","match_date":"2018-02-18","stage_classifiercode":"99-12","member_number":"\"\"","first_name":"STEVEN","last_name":"RUBERT","classification":"U","division":"LIMITED","hit_factor":5.291},{"match_name":"Triforce Practical Shooters at BigWoodsGoods","match_date":"2016-09-22","stage_classifiercode":"99-12","member_number":"TY71518","first_name":"CABOT","last_name":"HARRINGTON","classification":"C","division":"LIMITED","hit_factor":5.2834},{"match_name":"MCPSL Pistol 4-9-16","match_date":"2016-04-09","stage_classifiercode":"99-12","member_number":"PEN","first_name":"RICHARD","last_name":"LANNING","classification":"U","division":"LIMITED","hit_factor":5.2813},{"match_name":"LdF 4th Saturday Match","match_date":"2016-01-23","stage_classifiercode":"99-12","member_number":"A72266","first_name":"MARVIN","last_name":"LIM","classification":"A","division":"LIMITED","hit_factor":5.2774},{"match_name":"Rockcastle USPSA Nov 28 2015","match_date":"2015-11-28","stage_classifiercode":"99-12","member_number":"A6528","first_name":"JERRY","last_name":"DILLARD","classification":"X","division":"LIMITED","hit_factor":5.2747},{"match_name":"TPS USPSA PISTOL - May 2016 - Talon Range","match_date":"2016-05-07","stage_classifiercode":"99-12","member_number":"fy35753","first_name":"DAVE","last_name":"MUELLER","classification":"M","division":"LIMITED","hit_factor":5.2679},{"match_name":"Hosemasters  3rd Sunday Feburary 2017","match_date":"2017-02-12","stage_classifiercode":"99-12","member_number":"FY23839","first_name":"MIKE","last_name":"NASH","classification":"B","division":"LIMITED","hit_factor":5.2578},{"match_name":"WNPL USPSA - Labour Day Weekend - Sept 2017","match_date":"2017-09-02","stage_classifiercode":"99-12","member_number":"A87496","first_name":"BOBBY","last_name":"KOLVET","classification":"C","division":"LIMITED","hit_factor":5.2562},{"match_name":"LdF USPSA Match July 14 2018","match_date":"2018-07-14","stage_classifiercode":"99-12","member_number":"L4372","first_name":"ZACH","last_name":"ZHAO","classification":"C","division":"LIMITED","hit_factor":5.2466},{"match_name":"LdF 4th Saturday Match","match_date":"2016-01-23","stage_classifiercode":"99-12","member_number":"TY77491","first_name":"TODD","last_name":"MAO","classification":"C","division":"LIMITED","hit_factor":5.2419},{"match_name":"Southern Arizona Practical Shooters 05_5_18","match_date":"2018-05-05","stage_classifiercode":"99-12","member_number":"TY65942","first_name":"MARK","last_name":"BOOTH","classification":"B","division":"LIMITED","hit_factor":5.2411},{"match_name":"17s PSC - Feb 2017 - USPSA match","match_date":"2017-02-04","stage_classifiercode":"99-12","member_number":"\"\"","first_name":"JOSH","last_name":"WETZSTEIN","classification":"U","division":"LIMITED","hit_factor":5.2376},{"match_name":"CCPL 04102016","match_date":"2016-04-10","stage_classifiercode":"99-12","member_number":"A86712","first_name":"CHRIS","last_name":"KIMES","classification":"B","division":"LIMITED","hit_factor":5.228},{"match_name":"Pinetucky USPSA 11-19-16","match_date":"2016-11-19","stage_classifiercode":"99-12","member_number":"\"\"","first_name":"JOHN","last_name":"BUCKLEY","classification":"U","division":"LIMITED","hit_factor":5.2273},{"match_name":"Collin County USPSA Nov. 27 2016","match_date":"2016-11-25","stage_classifiercode":"99-12","member_number":"A87668","first_name":"JAMES","last_name":"ACOSTA","classification":"C","division":"LIMITED","hit_factor":5.2261},{"match_name":"LCHG May USPSA","match_date":"2017-05-21","stage_classifiercode":"99-12","member_number":"A9288","first_name":"TROY","last_name":"HOLLOWAY","classification":"U","division":"LIMITED","hit_factor":5.2209},{"match_name":"WNPL USPSA - Labour Day Weekend - Sept 2017","match_date":"2017-09-02","stage_classifiercode":"99-12","member_number":"A99691","first_name":"LARRY","last_name":"RICHARDSON","classification":"U","division":"LIMITED","hit_factor":5.2195},{"match_name":"Richmond Hot Shots February 7-2016 USPSA Match","match_date":"2016-02-07","stage_classifiercode":"99-12","member_number":"A83465","first_name":"MAURICE","last_name":"CORMIER","classification":"B","division":"LIMITED","hit_factor":5.2186},{"match_name":"NNRPA USPSA May 2018","match_date":"2018-05-26","stage_classifiercode":"99-12","member_number":"TY79968","first_name":"TRENT","last_name":"EDWARDS","classification":"C","division":"LIMITED","hit_factor":5.2104},{"match_name":"Pelham USPSA 2016-09-18","match_date":"2016-09-18","stage_classifiercode":"99-12","member_number":"A598","first_name":"KEN","last_name":"RUEFFERT","classification":"A","division":"LIMITED","hit_factor":5.2102},{"match_name":"OK15 USPSA AT USSA","match_date":"2016-07-10","stage_classifiercode":"99-12","member_number":"TY89882","first_name":"TRAVIS","last_name":"LOWRY","classification":"C","division":"LIMITED","hit_factor":5.2102},{"match_name":"Laser Ninja Dragon League USPSA August 2017","match_date":"2017-08-06","stage_classifiercode":"99-12","member_number":"A99880","first_name":"JEREMY","last_name":"LUSTER","classification":"B","division":"LIMITED","hit_factor":5.2071},{"match_name":"OFGC USPSA Match 10-21-18","match_date":"2018-10-21","stage_classifiercode":"99-12","member_number":"A60291","first_name":"ROBERT","last_name":"MCDANIEL","classification":"B","division":"LIMITED","hit_factor":5.2061},{"match_name":"Green Valley USPSA May Classifier","match_date":"2018-05-09","stage_classifiercode":"99-12","member_number":"A73587","first_name":"COLIN","last_name":"WALTERS","classification":"A","division":"LIMITED","hit_factor":5.205},{"match_name":"WNPL USPSA - Labour Day Weekend - Sept 2017","match_date":"2017-09-02","stage_classifiercode":"99-12","member_number":"TY75664","first_name":"GREG","last_name":"BLAIR","classification":"A","division":"LIMITED","hit_factor":5.2023},{"match_name":"Collin County USPSA Nov. 27 2016","match_date":"2016-11-25","stage_classifiercode":"99-12","member_number":"TY92077","first_name":"DONNIE","last_name":"STONE","classification":"C","division":"LIMITED","hit_factor":5.1975},{"match_name":"Palmetto Gun Club - February 2018 USPSA","match_date":"2018-02-03","stage_classifiercode":"99-12","member_number":"TY70556","first_name":"BRUCE","last_name":"BELVIN","classification":"B","division":"LIMITED","hit_factor":5.1948},{"match_name":"ECPS USPSA 17 Feb 18","match_date":"2018-02-16","stage_classifiercode":"99-12","member_number":"\"\"","first_name":"SEAN","last_name":"MCKERREN","classification":"U","division":"LIMITED","hit_factor":5.1935},{"match_name":"Hosemasters  3rd Sunday Feburary 2017","match_date":"2017-02-12","stage_classifiercode":"99-12","member_number":"A89358","first_name":"TOM","last_name":"KELLER","classification":"C","division":"LIMITED","hit_factor":5.1873},{"match_name":"Ducky Shoot August","match_date":"2018-08-18","stage_classifiercode":"99-12","member_number":"A-105297","first_name":"ZACK","last_name":"MARKS","classification":"B","division":"LIMITED","hit_factor":5.1842},{"match_name":"LdF USPSA Match July 14 2018","match_date":"2018-07-14","stage_classifiercode":"99-12","member_number":"TY82338","first_name":"ALBERT 2","last_name":"WILLINGHAM","classification":"B","division":"LIMITED","hit_factor":5.1724},{"match_name":"17s PSC - Feb 2017 - USPSA match","match_date":"2017-02-04","stage_classifiercode":"99-12","member_number":"a94623","first_name":"VERNON","last_name":"PASCUAL","classification":"U","division":"LIMITED","hit_factor":5.1704},{"match_name":"WSPS OCTOBER 2017 USPSA MATCH","match_date":"2017-10-21","stage_classifiercode":"99-12","member_number":"A99330","first_name":"AARON","last_name":"WALTON","classification":"U","division":"LIMITED","hit_factor":5.1675},{"match_name":"USPSA AUG. 26th. TCCC Match","match_date":"2018-08-26","stage_classifiercode":"99-12","member_number":"a104557","first_name":"MAXWELL","last_name":"GALKA","classification":"U","division":"LIMITED","hit_factor":5.1565},{"match_name":"BSTRC Dec 20 2017","match_date":"2017-12-20","stage_classifiercode":"99-12","member_number":"A96535","first_name":"TREVOR","last_name":"ROBINSON","classification":"B","division":"LIMITED","hit_factor":5.1497},{"match_name":"SPSA USPSA March 4th Sat match","match_date":"2017-03-25","stage_classifiercode":"99-12","member_number":"A91720","first_name":"TIM","last_name":"VORAVUDHI","classification":"B","division":"LIMITED","hit_factor":5.148},{"match_name":"WTPS USPSA April Classifier Match 4-8-17","match_date":"2017-04-08","stage_classifiercode":"99-12","member_number":"TY86524","first_name":"DOUG","last_name":"SMITH","classification":"B","division":"LIMITED","hit_factor":5.148},{"match_name":"GMPS 5/7/17","match_date":"2017-05-06","stage_classifiercode":"99-12","member_number":"TY80721","first_name":"ANDREW","last_name":"MORRISON","classification":"U","division":"LIMITED","hit_factor":5.1429},{"match_name":"USPSA","match_date":"2016-06-04","stage_classifiercode":"99-12","member_number":"\"\"","first_name":"CODY","last_name":"BARRETT","classification":"U","division":"LIMITED","hit_factor":5.1208},{"match_name":"MSSA Uspsa Match","match_date":"2017-04-08","stage_classifiercode":"99-12","member_number":"\"\"","first_name":"JOE","last_name":"PHISTER","classification":"\"\"","division":"LIMITED","hit_factor":5.1195},{"match_name":"Prescott 3rd Sunday USPSA 11-20-2016","match_date":"2016-11-20","stage_classifiercode":"99-12","member_number":"TY49570","first_name":"LEO","last_name":"BOUNDS","classification":"B","division":"LIMITED","hit_factor":5.1163},{"match_name":"WNPL USPSA - Labour Day Weekend - Sept 2017","match_date":"2017-09-02","stage_classifiercode":"99-12","member_number":"A76415","first_name":"SHAY","last_name":"MARCY","classification":"D","division":"LIMITED","hit_factor":5.1088},{"match_name":"Green Valley February 2017","match_date":"2017-02-25","stage_classifiercode":"99-12","member_number":"ty81279","first_name":"JARROD","last_name":"GROVE","classification":"B","division":"LIMITED","hit_factor":5.104},{"match_name":"Rendezvous 8-24-16","match_date":"2016-08-25","stage_classifiercode":"99-12","member_number":"\"\"","first_name":"JORDAN","last_name":"H","classification":"U","division":"LIMITED","hit_factor":5.0909},{"match_name":"USPSA","match_date":"2016-06-04","stage_classifiercode":"99-12","member_number":"ty80795","first_name":"DON","last_name":"WATSON JR","classification":"C","division":"LIMITED","hit_factor":5.0877},{"match_name":"USPSA","match_date":"2016-06-04","stage_classifiercode":"99-12","member_number":"ty83225","first_name":"BOB","last_name":"SANCHEZ","classification":"C","division":"LIMITED","hit_factor":5.0872},{"match_name":"USPSA","match_date":"2016-06-04","stage_classifiercode":"99-12","member_number":"\"\"","first_name":"JUSTIN","last_name":"TAYLOR","classification":"A","division":"LIMITED","hit_factor":5.0813},{"match_name":"Richmond Hot Shots February 7-2016 USPSA Match","match_date":"2016-02-07","stage_classifiercode":"99-12","member_number":"A84916","first_name":"JOHN","last_name":"MITCHELL","classification":"C","division":"LIMITED","hit_factor":5.0777},{"match_name":"LdF USPSA Match July 14 2018","match_date":"2018-07-14","stage_classifiercode":"99-12","member_number":"A55599","first_name":"CHARLES","last_name":"DE SALME","classification":"M","division":"LIMITED","hit_factor":5.0767},{"match_name":"Collin County USPSA Nov. 27 2016","match_date":"2016-11-25","stage_classifiercode":"99-12","member_number":"TY71605","first_name":"TOMMY","last_name":"THOMAS","classification":"B","division":"LIMITED","hit_factor":5.0744},{"match_name":"Green Valley USPSA May Classifier","match_date":"2018-05-09","stage_classifiercode":"99-12","member_number":"\"\"","first_name":"JERROD","last_name":"ADAMS","classification":"U","division":"LIMITED","hit_factor":5.0686},{"match_name":"CVSC 06-25-2017","match_date":"2017-06-25","stage_classifiercode":"99-12","member_number":"L3664","first_name":"DOC","last_name":"SCHMEISER","classification":"B","division":"LIMITED","hit_factor":5.068},{"match_name":"SCCPSA USPSA Mar 17","match_date":"2018-03-17","stage_classifiercode":"99-12","member_number":"TY53922","first_name":"RON","last_name":"JONES","classification":"B","division":"LIMITED","hit_factor":5.0648},{"match_name":"Shasta Shooters August 2016","match_date":"2016-08-13","stage_classifiercode":"99-12","member_number":"L2292","first_name":"JOEL","last_name":"NORTHRUP","classification":"M","division":"LIMITED","hit_factor":5.0575},{"match_name":"Smoke & Hope USPSA Apr 22 2017","match_date":"2017-04-22","stage_classifiercode":"99-12","member_number":"L4166","first_name":"MATT","last_name":"WAITE","classification":"A","division":"LIMITED","hit_factor":5.0477},{"match_name":"PCGC  June 2017","match_date":"2017-06-25","stage_classifiercode":"99-12","member_number":"A101083","first_name":"SETH","last_name":"LEWIS","classification":"C","division":"LIMITED","hit_factor":5.0401},{"match_name":"LCSA USPSA ALL CLASSIFIER ","match_date":"2018-06-30","stage_classifiercode":"99-12","member_number":"A96427","first_name":"BRIAN","last_name":"CICCO","classification":"B","division":"LIMITED","hit_factor":5.0398},{"match_name":"MCPSL Pistol 4-9-16","match_date":"2016-04-09","stage_classifiercode":"99-12","member_number":"A86886","first_name":"DAVID","last_name":"JOHNSON","classification":"U","division":"LIMITED","hit_factor":5.0388},{"match_name":"ECPS USPSA 17 Feb 18","match_date":"2018-02-16","stage_classifiercode":"99-12","member_number":"A59817","first_name":"SAMUEL","last_name":"SHEW","classification":"C","division":"LIMITED","hit_factor":5.0326},{"match_name":"LCSA USPSA ALL CLASSIFIER ","match_date":"2018-06-30","stage_classifiercode":"99-12","member_number":"A98121","first_name":"PETE","last_name":"DEFAZIO","classification":"C","division":"LIMITED","hit_factor":5.0302},{"match_name":"Hosemasters  3rd Sunday Feburary 2017","match_date":"2017-02-12","stage_classifiercode":"99-12","member_number":"TY22852","first_name":"DEBBIE","last_name":"KEEHART","classification":"B","division":"LIMITED","hit_factor":5.0245},{"match_name":"WNPL USPSA - Labour Day Weekend - Sept 2017","match_date":"2017-09-02","stage_classifiercode":"99-12","member_number":"PENDING","first_name":"JEREMIAH","last_name":"KIRKLAND","classification":"U","division":"LIMITED","hit_factor":5.0228},{"match_name":"ECPS February 28th USPSA Pistol Match","match_date":"2016-02-28","stage_classifiercode":"99-12","member_number":"A-85896","first_name":"JOHN","last_name":"MCQUEEN","classification":"D","division":"LIMITED","hit_factor":5.0193},{"match_name":"BRC_20170611","match_date":"2017-06-11","stage_classifiercode":"99-12","member_number":"A42083","first_name":"JIMMY","last_name":"HOLDSWORTH","classification":"X","division":"LIMITED","hit_factor":5.0188},{"match_name":"Medford USPSA April 2018 Match","match_date":"2018-04-15","stage_classifiercode":"99-12","member_number":"A106395","first_name":"BOB","last_name":"KELTY","classification":"U","division":"LIMITED","hit_factor":5.0098},{"match_name":"Minnetonka Game And Fish May 23","match_date":"2018-05-23","stage_classifiercode":"99-12","member_number":"\"\"","first_name":"MIKE","last_name":"DAVEY","classification":"U","division":"LIMITED","hit_factor":5.0052},{"match_name":"SCAPSA MN05 Summer League 1","match_date":"2017-06-05","stage_classifiercode":"99-12","member_number":"TY58815","first_name":"MIKE","last_name":"VAN MEETEREN","classification":"U","division":"LIMITED","hit_factor":5.0043},{"match_name":"Hosemasters  3rd Sunday Feburary 2017","match_date":"2017-02-12","stage_classifiercode":"99-12","member_number":"A86012","first_name":"MICHAEL","last_name":"DEBOLT","classification":"C","division":"LIMITED","hit_factor":5},{"match_name":"Range E11even Feb 2018 USPSA","match_date":"2018-02-24","stage_classifiercode":"99-12","member_number":"TY88724","first_name":"JESSICA","last_name":"DOIRON","classification":"B","division":"LIMITED","hit_factor":4.9955},{"match_name":"MSA USPSA Special Classifier 12-4-16","match_date":"2016-12-04","stage_classifiercode":"99-12","member_number":"\"\"","first_name":"TEAK-ALLEN","last_name":"BARRY","classification":"U","division":"LIMITED","hit_factor":4.995},{"match_name":"Danville Rifle and Pistol Club USPSA IL17 April 21 2018","match_date":"2018-04-21","stage_classifiercode":"99-12","member_number":"Ty88153","first_name":"PAUL","last_name":"NURMI","classification":"B","division":"LIMITED","hit_factor":4.9947},{"match_name":"LIPSA - November 4th 2018 - USPSA Classifier Match","match_date":"2018-11-04","stage_classifiercode":"99-12","member_number":"L4222","first_name":"BRADLEY","last_name":"MILLER","classification":"B","division":"LIMITED","hit_factor":4.9914},{"match_name":"Fairfax PS USPSA  2018 September","match_date":"2018-09-18","stage_classifiercode":"99-12","member_number":"A30181","first_name":"JOE","last_name":"STAGNATO","classification":"B","division":"LIMITED","hit_factor":4.9909},{"match_name":"ECPS February 28th USPSA Pistol Match","match_date":"2016-02-28","stage_classifiercode":"99-12","member_number":"A-83668","first_name":"ROBERT","last_name":"KUPPER","classification":"U","division":"LIMITED","hit_factor":4.9909},{"match_name":"Springfield Tactical Shooters 06-07-2018","match_date":"2018-06-07","stage_classifiercode":"99-12","member_number":"\"\"","first_name":"MATT","last_name":"CARVER","classification":"\"\"","division":"LIMITED","hit_factor":4.9909},{"match_name":"DRRC Dec2016","match_date":"2016-12-03","stage_classifiercode":"99-12","member_number":"A67595","first_name":"MARKUS P.","last_name":"WIGLE","classification":"B","division":"LIMITED","hit_factor":4.9906},{"match_name":"NISA April Classifer Match 2016","match_date":"2016-04-24","stage_classifiercode":"99-12","member_number":"A87841","first_name":"MATTHEW","last_name":"STRONG","classification":"U","division":"LIMITED","hit_factor":4.9906},{"match_name":"Sept 3rd Uspsa   Pickaway","match_date":"2016-09-03","stage_classifiercode":"99-12","member_number":"\"\"","first_name":"DAN","last_name":"O'CARROLL","classification":"X","division":"LIMITED","hit_factor":4.99},{"match_name":"CVSC 06-25-2017","match_date":"2017-06-25","stage_classifiercode":"99-12","member_number":"A88830","first_name":"DOUG","last_name":"SCOTT","classification":"B","division":"LIMITED","hit_factor":4.983},{"match_name":"GAS October 6th Match","match_date":"2018-10-06","stage_classifiercode":"99-12","member_number":"\"\"","first_name":"CLINT","last_name":"MARCOTT","classification":"C","division":"LIMITED","hit_factor":4.9808},{"match_name":"USPSA","match_date":"2016-06-04","stage_classifiercode":"99-12","member_number":"\"\"","first_name":"BRENT","last_name":"TYSON","classification":"U","division":"LIMITED","hit_factor":4.9757},{"match_name":"Richmond Hot Shots USPSA Classifier Match Sat April 8-2017","match_date":"2017-04-08","stage_classifiercode":"99-12","member_number":"A83285","first_name":"GARY","last_name":"AU","classification":"B","division":"LIMITED","hit_factor":4.9751},{"match_name":"OK15 USPSA AT USSA","match_date":"2016-07-10","stage_classifiercode":"99-12","member_number":"\"\"","first_name":"KELLEY","last_name":"DYCHE","classification":"U","division":"LIMITED","hit_factor":4.9735},{"match_name":"Stock & Barrel MN18 November 2020 USPSA Classifier Match","match_date":"2020-11-01","stage_classifiercode":"99-12","member_number":"Ty103300","first_name":"CHRIS","last_name":"PEQUIN","classification":"B","division":"LIMITED","hit_factor":4.9731},{"match_name":"Belton Gun Club USPSA January MATCH 1-30-21","match_date":"2021-01-30","stage_classifiercode":"99-12","member_number":"Ty105219","first_name":"ROB","last_name":"RAVINA","classification":"A","division":"LIMITED","hit_factor":4.9718},{"match_name":"DWB - Deadwood Boys USPSA 18 February 2018","match_date":"2018-02-18","stage_classifiercode":"99-12","member_number":"\"\"","first_name":"MIKE","last_name":"LAZARUS","classification":"C","division":"LIMITED","hit_factor":4.9702},{"match_name":"USC August 2016","match_date":"2016-08-13","stage_classifiercode":"99-12","member_number":"A93167","first_name":"CHRIS","last_name":"NEIMAN","classification":"U","division":"LIMITED","hit_factor":4.9696},{"match_name":"FBPPC DECEMBER 2016 SPECIAL CLASSIFIER MATCH","match_date":"2016-12-10","stage_classifiercode":"99-12","member_number":"TY16870","first_name":"RANDY","last_name":"O'CONNOR","classification":"C","division":"LIMITED","hit_factor":4.9689},{"match_name":"17s PSC - Feb 2017 - USPSA match","match_date":"2017-02-04","stage_classifiercode":"99-12","member_number":"A88895","first_name":"DEREK","last_name":"MURPHY","classification":"C","division":"LIMITED","hit_factor":4.9689},{"match_name":"SCCPSA USPSA Mar 17","match_date":"2018-03-17","stage_classifiercode":"99-12","member_number":"A99130","first_name":"AMEET","last_name":"DAS","classification":"C","division":"LIMITED","hit_factor":4.9666},{"match_name":"ENPS May 2018 USPSA Match","match_date":"2018-05-06","stage_classifiercode":"99-12","member_number":"A103094","first_name":"BRIAN","last_name":"DEMBINSKI","classification":"B","division":"LIMITED","hit_factor":4.9645},{"match_name":"ENPS May 2018 USPSA Match","match_date":"2018-05-06","stage_classifiercode":"99-12","member_number":"A90387","first_name":"JOHN","last_name":"GASKO","classification":"B","division":"LIMITED","hit_factor":4.9628},{"match_name":"SPSA USPSA March 4th Sat match","match_date":"2017-03-25","stage_classifiercode":"99-12","member_number":"A97330","first_name":"ZACK","last_name":"PENNY","classification":"C","division":"LIMITED","hit_factor":4.9505},{"match_name":"Tangi January 2016 USPSA","match_date":"2016-01-23","stage_classifiercode":"99-12","member_number":"\"\"","first_name":"TODD","last_name":"DEMPSTER","classification":"U","division":"LIMITED","hit_factor":4.9505},{"match_name":"RD Shooters May 6th USPSA  match","match_date":"2017-05-06","stage_classifiercode":"99-12","member_number":"A92627","first_name":"CHRIS","last_name":"YATES","classification":"C","division":"LIMITED","hit_factor":4.9434},{"match_name":"CRGC USPSA Special Classifier 08-15-21","match_date":"2021-08-15","stage_classifiercode":"99-12","member_number":"TY113469","first_name":"MIAN","last_name":"LIU","classification":"","division":"LIMITED","hit_factor":4.943},{"match_name":"2020-03 Bone Creek USPSA","match_date":"2020-03-01","stage_classifiercode":"99-12","member_number":"A100139","first_name":"JON","last_name":"MAYFIELD","classification":"C","division":"LIMITED","hit_factor":4.9261},{"match_name":"Green Valley USPSA May Classifier","match_date":"2018-05-09","stage_classifiercode":"99-12","member_number":"TY81279","first_name":"JARROD","last_name":"GROVE","classification":"B","division":"LIMITED","hit_factor":4.9209},{"match_name":"Atlanta Practical Shooters March 2016 USPSA - Classifier Match","match_date":"2016-03-06","stage_classifiercode":"99-12","member_number":"A95386","first_name":"GRAHAM","last_name":"PAGE","classification":"U","division":"LIMITED","hit_factor":4.918},{"match_name":"Griffin USPSA Match Aug 2017","match_date":"2017-08-19","stage_classifiercode":"99-12","member_number":"A-102088","first_name":"JEREMY","last_name":"DEAN","classification":"U","division":"LIMITED","hit_factor":4.9046},{"match_name":"DRRC Dec2016","match_date":"2016-12-03","stage_classifiercode":"99-12","member_number":"TY45897","first_name":"LAWRENCE V.","last_name":"MULL","classification":"C","division":"LIMITED","hit_factor":4.9028},{"match_name":"Atlanta Practical Shooters March 2016 USPSA - Classifier Match","match_date":"2016-03-06","stage_classifiercode":"99-12","member_number":"L3384","first_name":"JAMES","last_name":"FROELICH","classification":"B","division":"LIMITED","hit_factor":4.89},{"match_name":"ENPS May 2018 USPSA Match","match_date":"2018-05-06","stage_classifiercode":"99-12","member_number":"A106900","first_name":"ERICH","last_name":"JONES","classification":"U","division":"LIMITED","hit_factor":4.8884},{"match_name":"SCCPSA USPSA Mar 17","match_date":"2018-03-17","stage_classifiercode":"99-12","member_number":"TY88493","first_name":"PETER","last_name":"DIDONATO","classification":"U","division":"LIMITED","hit_factor":4.888},{"match_name":"BHPSC Monthly Match - Feb 2020","match_date":"2020-02-29","stage_classifiercode":"99-12","member_number":"A121434","first_name":"GREG","last_name":"LANGNER","classification":"C","division":"LIMITED","hit_factor":4.878},{"match_name":"SCCCJULYCLASSIFIER2016","match_date":"2016-07-30","stage_classifiercode":"99-12","member_number":"ty80201","first_name":"TOM","last_name":"RAPALA","classification":"U","division":"LIMITED","hit_factor":4.8757},{"match_name":"SFPC September USPSA Special Classifier match","match_date":"2016-09-04","stage_classifiercode":"99-12","member_number":"A32540","first_name":"MOSHE","last_name":"MIZRAHI","classification":"B","division":"LIMITED","hit_factor":4.8757},{"match_name":"DWB - Deadwood Boys USPSA 18 February 2018","match_date":"2018-02-18","stage_classifiercode":"99-12","member_number":"\"\"","first_name":"MIKE","last_name":"NGUYEN","classification":"G","division":"LIMITED","hit_factor":4.8726},{"match_name":"USPSA","match_date":"2016-06-04","stage_classifiercode":"99-12","member_number":"A93367","first_name":"JAY","last_name":"LONG","classification":"U","division":"LIMITED","hit_factor":4.8638},{"match_name":"Minnetonka Game And Fish May 23","match_date":"2018-05-23","stage_classifiercode":"99-12","member_number":"TY88661","first_name":"CHRIS","last_name":"LEHMAN","classification":"C","division":"LIMITED","hit_factor":4.8632},{"match_name":"SSP Super Classifier 1-30-16","match_date":"2016-01-30","stage_classifiercode":"99-12","member_number":"ty65411","first_name":"RICK","last_name":"SCHMALZ","classification":"B","division":"LIMITED","hit_factor":4.8591},{"match_name":"ECPS February 28th USPSA Pistol Match","match_date":"2016-02-28","stage_classifiercode":"99-12","member_number":"\"\"","first_name":"MATT","last_name":"LEVINER","classification":"U","division":"LIMITED","hit_factor":4.8521},{"match_name":"Shoot GTR USPSA 11/6","match_date":"2016-11-06","stage_classifiercode":"99-12","member_number":"TY91423","first_name":"LAURENCE","last_name":"MAT AN","classification":"B","division":"LIMITED","hit_factor":4.849},{"match_name":"DRRC Dec2016","match_date":"2016-12-03","stage_classifiercode":"99-12","member_number":"A87752","first_name":"JOANNE","last_name":"TEGTMEYER","classification":"B","division":"LIMITED","hit_factor":4.845},{"match_name":"Brothers N Arms February 2018 USPSA Match","match_date":"2018-02-17","stage_classifiercode":"99-12","member_number":"TY36956","first_name":"CLIFF","last_name":"GADDIS","classification":"B","division":"LIMITED","hit_factor":4.845},{"match_name":"SCCPSA USPSA Mar 17","match_date":"2018-03-17","stage_classifiercode":"99-12","member_number":"\"\"","first_name":"KEN","last_name":"SHIPMAN","classification":"U","division":"LIMITED","hit_factor":4.843},{"match_name":"BRSP Tuesday Night USPSA Match - Nov 14","match_date":"2017-11-15","stage_classifiercode":"99-12","member_number":"A39514","first_name":"DANIEL","last_name":"CHURCHILL","classification":"\"\"","division":"LIMITED","hit_factor":4.8415},{"match_name":"LdF 4th Saturday Match","match_date":"2016-01-23","stage_classifiercode":"99-12","member_number":"TY78824","first_name":"MATTHEW","last_name":"CLARK","classification":"M","division":"LIMITED","hit_factor":4.8265},{"match_name":"SFPS 05-21-17 Superclassifier Gun1","match_date":"2017-05-21","stage_classifiercode":"99-12","member_number":"A96586","first_name":"CHRIS","last_name":"NISSEN","classification":"U","division":"LIMITED","hit_factor":4.8237},{"match_name":"ECPS USPSA 17 Feb 18","match_date":"2018-02-16","stage_classifiercode":"99-12","member_number":"A97687","first_name":"TOM","last_name":"VILLENEUVE","classification":"C","division":"LIMITED","hit_factor":4.8218},{"match_name":"Green Valley USPSA May Classifier","match_date":"2018-05-09","stage_classifiercode":"99-12","member_number":"TY-87943","first_name":"BRANDON","last_name":"HAFNER","classification":"C","division":"LIMITED","hit_factor":4.8193},{"match_name":"Medford USPSA April 2018 Match","match_date":"2018-04-15","stage_classifiercode":"99-12","member_number":"TY77822","first_name":"DAVID","last_name":"ENLOE","classification":"C","division":"LIMITED","hit_factor":4.8193},{"match_name":"Maine Practical Shooters May 2018","match_date":"2018-05-12","stage_classifiercode":"99-12","member_number":"TY89230","first_name":"SCOTT","last_name":"HOSSLER","classification":"C","division":"LIMITED","hit_factor":4.8144},{"match_name":"SPSA USPSA March 4th Sat match","match_date":"2017-03-25","stage_classifiercode":"99-12","member_number":"A98866","first_name":"TAD","last_name":"BLANCO","classification":"D","division":"LIMITED","hit_factor":4.814},{"match_name":"Ducky Shoot August","match_date":"2018-08-18","stage_classifiercode":"99-12","member_number":"A-104689","first_name":"ERIK","last_name":"CONE","classification":"U","division":"LIMITED","hit_factor":4.8096},{"match_name":"YMM IPSC02 2016_09_11","match_date":"2016-09-11","stage_classifiercode":"99-12","member_number":"A66244","first_name":"JIM","last_name":"SUMMARELL","classification":"C","division":"LIMITED","hit_factor":4.8043},{"match_name":"NISA April Classifer Match 2016","match_date":"2016-04-24","stage_classifiercode":"99-12","member_number":"TY72595","first_name":"JEDIDIAH","last_name":"THOMPSON","classification":"U","division":"LIMITED","hit_factor":4.8039},{"match_name":"Pelham USPSA 2016-09-18","match_date":"2016-09-18","stage_classifiercode":"99-12","member_number":"TY85184","first_name":"HOWARD","last_name":"SIMPSON","classification":"C","division":"LIMITED","hit_factor":4.8023},{"match_name":"Emmett September Match","match_date":"2016-09-24","stage_classifiercode":"99-12","member_number":"A84532","first_name":"KENNY","last_name":"PLATT","classification":"G","division":"LIMITED","hit_factor":4.8023},{"match_name":"FBURG April 2017 Level I USPSA ","match_date":"2017-04-01","stage_classifiercode":"99-12","member_number":"L4084","first_name":"KEVIN","last_name":"MCPHEE","classification":"C","division":"LIMITED","hit_factor":4.8009},{"match_name":"South Texas Tactical USPSA","match_date":"2017-07-08","stage_classifiercode":"99-12","member_number":"\"\"","first_name":"JORDAN","last_name":"ENK","classification":"\"\"","division":"LIMITED","hit_factor":4.8},{"match_name":"Prescott 3rd Sunday USPSA 11-20-2016","match_date":"2016-11-20","stage_classifiercode":"99-12","member_number":"A56116","first_name":"DAVID","last_name":"MONROE","classification":"B","division":"LIMITED","hit_factor":4.7904},{"match_name":"DWB - Deadwood Boys USPSA 18 February 2018","match_date":"2018-02-18","stage_classifiercode":"99-12","member_number":"\"\"","first_name":"D","last_name":"SENSEI","classification":"C","division":"LIMITED","hit_factor":4.7847},{"match_name":"TPS USPSA - September 2016 - Talon Range","match_date":"2016-09-03","stage_classifiercode":"99-12","member_number":"a87135","first_name":"ENVER","last_name":"FOCAKOVIC","classification":"C","division":"LIMITED","hit_factor":4.7842},{"match_name":"BHPSC Monthly Match - Feb 2020","match_date":"2020-02-29","stage_classifiercode":"99-12","member_number":"A107271","first_name":"JEFF","last_name":"PICKMAN","classification":"U","division":"LIMITED","hit_factor":4.7817},{"match_name":"USPSA MO21 Special Classifier 2Alpha SBRC February 27 2021","match_date":"2021-02-27","stage_classifiercode":"99-12","member_number":"A110966","first_name":"TROY","last_name":"POTTER","classification":"B","division":"LIMITED","hit_factor":4.7809},{"match_name":"17s PSC - Feb 2017 - USPSA match","match_date":"2017-02-04","stage_classifiercode":"99-12","member_number":"FY69538","first_name":"ALAN","last_name":"MATTHEWS","classification":"B","division":"LIMITED","hit_factor":4.7799},{"match_name":"MPSA 2021-08-21","match_date":"2021-08-21","stage_classifiercode":"99-12","member_number":"a119434","first_name":"ANTHONY","last_name":"EVANS","classification":"C","division":"LIMITED","hit_factor":4.7798},{"match_name":"17s PSC - Feb 2017 - USPSA match","match_date":"2017-02-04","stage_classifiercode":"99-12","member_number":"TY73725","first_name":"ADAM","last_name":"MUELLER","classification":"A","division":"LIMITED","hit_factor":4.769},{"match_name":"SPSA USPSA March 4th Sat match","match_date":"2017-03-25","stage_classifiercode":"99-12","member_number":"TY96072","first_name":"SCOTT","last_name":"FORTSON","classification":"C","division":"LIMITED","hit_factor":4.766},{"match_name":"17s PSC - Feb 2017 - USPSA match","match_date":"2017-02-04","stage_classifiercode":"99-12","member_number":"\"\"","first_name":"CHRISTIAN","last_name":"EDENS","classification":"U","division":"LIMITED","hit_factor":4.7619},{"match_name":"Pinetucky USPSA 11-19-16","match_date":"2016-11-19","stage_classifiercode":"99-12","member_number":"A92315","first_name":"JEFFREY","last_name":"GARLINGTON","classification":"U","division":"LIMITED","hit_factor":4.7573},{"match_name":"Green Valley USPSA May Classifier","match_date":"2018-05-09","stage_classifiercode":"99-12","member_number":"A106399","first_name":"DALLAS","last_name":"GOOSEMAN","classification":"U","division":"LIMITED","hit_factor":4.7532},{"match_name":"ENPS May 2018 USPSA Match","match_date":"2018-05-06","stage_classifiercode":"99-12","member_number":"A95559","first_name":"ZACH J","last_name":"COLHOUR","classification":"U","division":"LIMITED","hit_factor":4.7516},{"match_name":"Gunsmoke Action Shooters USPSA April 18","match_date":"2018-04-07","stage_classifiercode":"99-12","member_number":"\"\"","first_name":"RAYMOND","last_name":"COMLEY","classification":"U","division":"LIMITED","hit_factor":4.7452},{"match_name":"SFPC March USPSA Match 2017","match_date":"2017-03-05","stage_classifiercode":"99-12","member_number":"A66744","first_name":"JOHN","last_name":"CICATELLO","classification":"C","division":"LIMITED","hit_factor":4.7402},{"match_name":"DRRC Dec2016","match_date":"2016-12-03","stage_classifiercode":"99-12","member_number":"A92536","first_name":"WYN","last_name":"TRISKA","classification":"C","division":"LIMITED","hit_factor":4.7384},{"match_name":"SFPC September USPSA Special Classifier match","match_date":"2016-09-04","stage_classifiercode":"99-12","member_number":"TY83243","first_name":"GIL","last_name":"ELNATAN","classification":"C","division":"LIMITED","hit_factor":4.7357},{"match_name":"RD Shooters May 6th USPSA  match","match_date":"2017-05-06","stage_classifiercode":"99-12","member_number":"A51402","first_name":"DOC","last_name":"WELSHER2","classification":"B","division":"LIMITED","hit_factor":4.7331},{"match_name":"Griffin USPSA Match Aug 2017","match_date":"2017-08-19","stage_classifiercode":"99-12","member_number":"A100051","first_name":"BRIAN","last_name":"SHARP","classification":"C","division":"LIMITED","hit_factor":4.7316},{"match_name":"Range E11even Feb 2018 USPSA","match_date":"2018-02-24","stage_classifiercode":"99-12","member_number":"A100125","first_name":"JOHN","last_name":"EDENS","classification":"B","division":"LIMITED","hit_factor":4.7291},{"match_name":"CGC 2017_05_13","match_date":"2017-05-13","stage_classifiercode":"99-12","member_number":"TY31015","first_name":"BORIS","last_name":"ZARETSKY","classification":"B","division":"LIMITED","hit_factor":4.7291},{"match_name":"SCCPSA USPSA Mar 17","match_date":"2018-03-17","stage_classifiercode":"99-12","member_number":"A105240","first_name":"TOM","last_name":"PARR","classification":"U","division":"LIMITED","hit_factor":4.7281},{"match_name":"LCSA USPSA ALL CLASSIFIER ","match_date":"2018-06-30","stage_classifiercode":"99-12","member_number":"TY97141","first_name":"BRETT","last_name":"ZWOLENSKY","classification":"C","division":"LIMITED","hit_factor":4.7278},{"match_name":"LCSA USPSA ALL CLASSIFIER ","match_date":"2018-06-30","stage_classifiercode":"99-12","member_number":"A97681","first_name":"JAMES","last_name":"DELLINGER","classification":"B","division":"LIMITED","hit_factor":4.7149},{"match_name":"Green Valley February 2017","match_date":"2017-02-25","stage_classifiercode":"99-12","member_number":"A82068","first_name":"DAVID","last_name":"BROWN","classification":"C","division":"LIMITED","hit_factor":4.7037},{"match_name":"ORSA USPSA October 2016","match_date":"2016-10-15","stage_classifiercode":"99-12","member_number":"A92055","first_name":"BRYAN","last_name":"KISER","classification":"C","division":"LIMITED","hit_factor":4.6974},{"match_name":"OFGC USPSA Match Feb 19th 2017","match_date":"2017-02-19","stage_classifiercode":"99-12","member_number":"A82942","first_name":"DUANE","last_name":"CHRISTENSEN","classification":"D","division":"LIMITED","hit_factor":4.6961},{"match_name":"Richmond Hot Shots USPSA Classifier Match Sat April 8-2017","match_date":"2017-04-08","stage_classifiercode":"99-12","member_number":"TY89442","first_name":"JIM","last_name":"SUSOY","classification":"U","division":"LIMITED","hit_factor":4.6935},{"match_name":"CCPL 04102016","match_date":"2016-04-10","stage_classifiercode":"99-12","member_number":"\"\"","first_name":"MIKE","last_name":"KENNEDY","classification":"U","division":"LIMITED","hit_factor":4.6906},{"match_name":"OK15 USPSA at USSA","match_date":"2017-12-10","stage_classifiercode":"99-12","member_number":"A104014","first_name":"AMIE","last_name":"SPURLOCK","classification":"D","division":"LIMITED","hit_factor":4.6891},{"match_name":"ECPS February 28th USPSA Pistol Match","match_date":"2016-02-28","stage_classifiercode":"99-12","member_number":"A69874","first_name":"JOHN","last_name":"WILSON","classification":"U","division":"LIMITED","hit_factor":4.686},{"match_name":"Gunsmoke Action Shooters USPSA April 18","match_date":"2018-04-07","stage_classifiercode":"99-12","member_number":"A107537","first_name":"NICHOLAS","last_name":"LARSEN","classification":"U","division":"LIMITED","hit_factor":4.6859},{"match_name":"SPSA USPSA March 4th Sat match","match_date":"2017-03-25","stage_classifiercode":"99-12","member_number":"TY39820","first_name":"MARK","last_name":"WAGNER","classification":"C","division":"LIMITED","hit_factor":4.6858},{"match_name":"USPSA MO21 Special Classifier 2Alpha SBRC February 27 2021","match_date":"2021-02-27","stage_classifiercode":"99-12","member_number":"A132351","first_name":"SHANNA","last_name":"DUCK","classification":"U","division":"LIMITED","hit_factor":4.6774},{"match_name":"Shasta Shooters August 2016","match_date":"2016-08-13","stage_classifiercode":"99-12","member_number":"A33123","first_name":"DAREN A","last_name":"HUSA","classification":"B","division":"LIMITED","hit_factor":4.6756},{"match_name":"AAPS AAFG Special Classifier Match - March 31 2018","match_date":"2018-03-31","stage_classifiercode":"99-12","member_number":"A103443","first_name":"MARK","last_name":"ROGERS","classification":"C","division":"LIMITED","hit_factor":4.6721},{"match_name":"TAC2 USPSA August 2017","match_date":"2017-08-05","stage_classifiercode":"99-12","member_number":"A97902","first_name":"DAKOTA","last_name":"KENNEDY","classification":"U","division":"LIMITED","hit_factor":4.6701},{"match_name":"17s PSC - Feb 2017 - USPSA match","match_date":"2017-02-04","stage_classifiercode":"99-12","member_number":"L4036","first_name":"MARK","last_name":"COMPTON","classification":"D","division":"LIMITED","hit_factor":4.6667},{"match_name":"SFPS 05-21-17 Superclassifier Gun1","match_date":"2017-05-21","stage_classifiercode":"99-12","member_number":"A96738","first_name":"KEVIN","last_name":"HARTMAN","classification":"U","division":"LIMITED","hit_factor":4.6667},{"match_name":"CGC 2017_05_13","match_date":"2017-05-13","stage_classifiercode":"99-12","member_number":"A24841","first_name":"CARLOS","last_name":"RUBIO","classification":"B","division":"LIMITED","hit_factor":4.6644},{"match_name":"FBPPC DECEMBER 2016 SPECIAL CLASSIFIER MATCH","match_date":"2016-12-10","stage_classifiercode":"99-12","member_number":"A95396","first_name":"ROGER","last_name":"CLAEPS","classification":"C","division":"LIMITED","hit_factor":4.661},{"match_name":"COPS Feb 2017 USPSA Match","match_date":"2017-02-05","stage_classifiercode":"99-12","member_number":"a96841","first_name":"DAN","last_name":"BLACKORBY","classification":"D","division":"LIMITED","hit_factor":4.6602},{"match_name":"SFPC September USPSA Special Classifier match","match_date":"2016-09-04","stage_classifiercode":"99-12","member_number":"TY83243","first_name":"GIL","last_name":"ELNATAN","classification":"C","division":"LIMITED","hit_factor":4.6512},{"match_name":"XMG USPSA   Saturday September  4th 2021","match_date":"2021-09-04","stage_classifiercode":"99-12","member_number":"TY72408","first_name":"JOHN","last_name":"JIANG","classification":"U","division":"LIMITED","hit_factor":4.647},{"match_name":"Hosemasters  3rd Sunday Feburary 2017","match_date":"2017-02-12","stage_classifiercode":"99-12","member_number":"A94645","first_name":"GENE","last_name":"ERICKSON","classification":"D","division":"LIMITED","hit_factor":4.647},{"match_name":"LdF USPSA Match July 14 2018","match_date":"2018-07-14","stage_classifiercode":"99-12","member_number":"A102726","first_name":"TRACY","last_name":"TOMASIAN 2","classification":"D","division":"LIMITED","hit_factor":4.6432},{"match_name":"SPSA USPSA March 4th Sat match","match_date":"2017-03-25","stage_classifiercode":"99-12","member_number":"\"\"","first_name":"MARK","last_name":"STEADMAN","classification":"U","division":"LIMITED","hit_factor":4.6422},{"match_name":"ECPS February 28th USPSA Pistol Match","match_date":"2016-02-28","stage_classifiercode":"99-12","member_number":"A93068","first_name":"JEFF","last_name":"WALLACE","classification":"U","division":"LIMITED","hit_factor":4.6422},{"match_name":"Payson Practical Pistol Sept 03 2016","match_date":"2016-09-03","stage_classifiercode":"99-12","member_number":"TY81620","first_name":"MICHAEL","last_name":"MCCRITE","classification":"C","division":"LIMITED","hit_factor":4.6406},{"match_name":"TAC2 USPSA August 2017","match_date":"2017-08-05","stage_classifiercode":"99-12","member_number":"27803","first_name":"DAVID","last_name":"NOE","classification":"U","division":"LIMITED","hit_factor":4.6377},{"match_name":"Richmond Hot Shots February 7-2016 USPSA Match","match_date":"2016-02-07","stage_classifiercode":"99-12","member_number":"TY38281","first_name":"RON","last_name":"STOLARZ","classification":"B","division":"LIMITED","hit_factor":4.6332},{"match_name":"AIPS  USPSA Monthly 12 November 2016","match_date":"2016-11-12","stage_classifiercode":"99-12","member_number":"A99491","first_name":"BILLY","last_name":"WEIDLDEIN","classification":"U","division":"LIMITED","hit_factor":4.6229},{"match_name":"COPS Feb 2017 USPSA Match","match_date":"2017-02-05","stage_classifiercode":"99-12","member_number":"a98832","first_name":"BRANDON","last_name":"CREPS","classification":"U","division":"LIMITED","hit_factor":4.6226},{"match_name":"LCSA USPSA ALL CLASSIFIER ","match_date":"2018-06-30","stage_classifiercode":"99-12","member_number":"A95579","first_name":"JON","last_name":"SHELDON","classification":"U","division":"LIMITED","hit_factor":4.6154},{"match_name":"EWPSA 2016-04","match_date":"2016-04-17","stage_classifiercode":"99-12","member_number":"TY76664","first_name":"JEFF","last_name":"WEAVER","classification":"A","division":"LIMITED","hit_factor":4.611},{"match_name":"Payson Practical Pistol Sept 03 2016","match_date":"2016-09-03","stage_classifiercode":"99-12","member_number":"A87840","first_name":"MIKE H","last_name":"SEGURA","classification":"C","division":"LIMITED","hit_factor":4.611},{"match_name":"MCPSL Pistol 4-8-17","match_date":"2017-04-08","stage_classifiercode":"99-12","member_number":"A60906","first_name":"JERRY","last_name":"PIERCE","classification":"C","division":"LIMITED","hit_factor":4.6102},{"match_name":"NISA April Classifer Match 2016","match_date":"2016-04-24","stage_classifiercode":"99-12","member_number":"A90595","first_name":"JON","last_name":"MARKING","classification":"U","division":"LIMITED","hit_factor":4.6099},{"match_name":"Rendezvous 8-24-16","match_date":"2016-08-25","stage_classifiercode":"99-12","member_number":"\"\"","first_name":"NATE","last_name":"O.","classification":"U","division":"LIMITED","hit_factor":4.6075},{"match_name":"USPSA","match_date":"2016-06-04","stage_classifiercode":"99-12","member_number":"a95601","first_name":"SAMUAL","last_name":"HAYNIE","classification":"U","division":"LIMITED","hit_factor":4.6058},{"match_name":"OK15 USPSA AT USSA","match_date":"2016-07-10","stage_classifiercode":"99-12","member_number":"A78368","first_name":"GREY","last_name":"LAWSON","classification":"A","division":"LIMITED","hit_factor":4.5991},{"match_name":"WNPL USPSA - Labour Day Weekend - Sept 2017","match_date":"2017-09-02","stage_classifiercode":"99-12","member_number":"L3505","first_name":"WILLIAM (BILL)","last_name":"STEWART","classification":"C","division":"LIMITED","hit_factor":4.5987},{"match_name":"ECPS USPSA 17 Feb 18","match_date":"2018-02-16","stage_classifiercode":"99-12","member_number":"A4564","first_name":"ED","last_name":"FOWLER","classification":"B","division":"LIMITED","hit_factor":4.5933},{"match_name":"OK15 USPSA AT USSA","match_date":"2016-07-10","stage_classifiercode":"99-12","member_number":"A-92527","first_name":"JAKE","last_name":"NOBLE","classification":"C","division":"LIMITED","hit_factor":4.5929},{"match_name":"LdF 4th Saturday Match","match_date":"2016-01-23","stage_classifiercode":"99-12","member_number":"A84071","first_name":"BRENDEN","last_name":"DEGEN","classification":"C","division":"LIMITED","hit_factor":4.5872},{"match_name":"NISA April Classifer Match 2016","match_date":"2016-04-24","stage_classifiercode":"99-12","member_number":"A91307","first_name":"MARK","last_name":"SKORA","classification":"U","division":"LIMITED","hit_factor":4.5855},{"match_name":"SSP Super Classifier 1-30-16","match_date":"2016-01-30","stage_classifiercode":"99-12","member_number":"A93864","first_name":"STEVEN","last_name":"CHAPMAN","classification":"U","division":"LIMITED","hit_factor":4.583},{"match_name":"WNPL USPSA - Labour Day Weekend - Sept 2017","match_date":"2017-09-02","stage_classifiercode":"99-12","member_number":"A91661","first_name":"MATTHEW","last_name":"HORNBACK","classification":"C","division":"LIMITED","hit_factor":4.5828},{"match_name":"Medford USPSA April 2018 Match","match_date":"2018-04-15","stage_classifiercode":"99-12","member_number":"TY108811","first_name":"LOGAN","last_name":"OSHELL","classification":"U","division":"LIMITED","hit_factor":4.5786},{"match_name":"TAC2 USPSA August 2017","match_date":"2017-08-05","stage_classifiercode":"99-12","member_number":"\"\"","first_name":"STEVEN","last_name":"WALKER","classification":"U","division":"LIMITED","hit_factor":4.5752},{"match_name":"MSSA Uspsa Match","match_date":"2017-04-08","stage_classifiercode":"99-12","member_number":"A46855","first_name":"STEPHEN","last_name":"EATON","classification":"B","division":"LIMITED","hit_factor":4.5699},{"match_name":"LCHG May USPSA","match_date":"2017-05-21","stage_classifiercode":"99-12","member_number":"na","first_name":"LUKE","last_name":"ARCHER","classification":"U","division":"LIMITED","hit_factor":4.569},{"match_name":"Hosemasters  3rd Sunday Feburary 2017","match_date":"2017-02-12","stage_classifiercode":"99-12","member_number":"\"\"","first_name":"DAVID","last_name":"BRANDT","classification":"B","division":"LIMITED","hit_factor":4.5681},{"match_name":"CGC 2017_05_13","match_date":"2017-05-13","stage_classifiercode":"99-12","member_number":"A93098","first_name":"TRAVIS","last_name":"ROSE","classification":"C","division":"LIMITED","hit_factor":4.568},{"match_name":"Pinetucky USPSA 11-19-16","match_date":"2016-11-19","stage_classifiercode":"99-12","member_number":"A93151","first_name":"TYLER","last_name":"BUSSEY","classification":"C","division":"LIMITED","hit_factor":4.5666},{"match_name":"Hosemasters  3rd Sunday Feburary 2017","match_date":"2017-02-12","stage_classifiercode":"99-12","member_number":"A61313","first_name":"BRETT","last_name":"BERG","classification":"M","division":"LIMITED","hit_factor":4.5524},{"match_name":"LdF USPSA Match July 14 2018","match_date":"2018-07-14","stage_classifiercode":"99-12","member_number":"A38618","first_name":"HENRY","last_name":"TORIBIO","classification":"M","division":"LIMITED","hit_factor":4.5517},{"match_name":"AIPS  USPSA Monthly 12 November 2016","match_date":"2016-11-12","stage_classifiercode":"99-12","member_number":"A93741","first_name":"CODY","last_name":"PERRY","classification":"C","division":"LIMITED","hit_factor":4.5512},{"match_name":"FBPPC DECEMBER 2016 SPECIAL CLASSIFIER MATCH","match_date":"2016-12-10","stage_classifiercode":"99-12","member_number":"TY71195","first_name":"ADAM","last_name":"HYMAS","classification":"U","division":"LIMITED","hit_factor":4.5512},{"match_name":"SFPS 05-21-17 Superclassifier Gun1","match_date":"2017-05-21","stage_classifiercode":"99-12","member_number":"TY84886","first_name":"STEWART","last_name":"HENDERSON","classification":"C","division":"LIMITED","hit_factor":4.5504},{"match_name":"CCPL 04102016","match_date":"2016-04-10","stage_classifiercode":"99-12","member_number":"\"\"","first_name":"NICK","last_name":"ROBERTS","classification":"U","division":"LIMITED","hit_factor":4.5502},{"match_name":"USPSA MO21 Special Classifier 2Alpha SBRC February 27 2021","match_date":"2021-02-27","stage_classifiercode":"99-12","member_number":"A132351","first_name":"SHANNA","last_name":"DUCK","classification":"U","division":"LIMITED","hit_factor":4.5455},{"match_name":"ENPS May 2018 USPSA Match","match_date":"2018-05-06","stage_classifiercode":"99-12","member_number":"FY70534","first_name":"MICHAEL","last_name":"JARVIS","classification":"C","division":"LIMITED","hit_factor":4.541},{"match_name":"LdF USPSA Match July 14 2018","match_date":"2018-07-14","stage_classifiercode":"99-12","member_number":"A110933","first_name":"ANTHONY","last_name":"WILLIAMS","classification":"U","division":"LIMITED","hit_factor":4.5408},{"match_name":"Green Valley USPSA May Classifier","match_date":"2018-05-09","stage_classifiercode":"99-12","member_number":"a93167","first_name":"CHRIS","last_name":"NEIMAN","classification":"C","division":"LIMITED","hit_factor":4.5337},{"match_name":"Pelham USPSA 2016-09-18","match_date":"2016-09-18","stage_classifiercode":"99-12","member_number":"A85152","first_name":"KIRIN","last_name":"LEVINE","classification":"U","division":"LIMITED","hit_factor":4.5249},{"match_name":"Rockcastle USPSA Nov 28 2015","match_date":"2015-11-28","stage_classifiercode":"99-12","member_number":"\"\"","first_name":"KEVIN","last_name":"SANDERS","classification":"U","division":"LIMITED","hit_factor":4.5244},{"match_name":"CGC 2017_05_13","match_date":"2017-05-13","stage_classifiercode":"99-12","member_number":"TY76209","first_name":"LOUIS","last_name":"SAWYER","classification":"C","division":"LIMITED","hit_factor":4.5236},{"match_name":"SCCPSA USPSA Mar 17","match_date":"2018-03-17","stage_classifiercode":"99-12","member_number":"TY30995","first_name":"JOE","last_name":"GUARINO","classification":"B","division":"LIMITED","hit_factor":4.5202},{"match_name":"Rockcastle USPSA Nov 28 2015","match_date":"2015-11-28","stage_classifiercode":"99-12","member_number":"A85730","first_name":"KYLE","last_name":"LINDSEY","classification":"C","division":"LIMITED","hit_factor":4.5142},{"match_name":"WNPL USPSA - Labour Day Weekend - Sept 2017","match_date":"2017-09-02","stage_classifiercode":"99-12","member_number":"A78446","first_name":"JOHN","last_name":"HITCH","classification":"B","division":"LIMITED","hit_factor":4.5131},{"match_name":"Laser Ninja Dragon League USPSA August 2017","match_date":"2017-08-06","stage_classifiercode":"99-12","member_number":"A100954","first_name":"ALEX","last_name":"BRUNNER","classification":"U","division":"LIMITED","hit_factor":4.5131},{"match_name":"ECPS USPSA 17 Feb 18","match_date":"2018-02-16","stage_classifiercode":"99-12","member_number":"A94722","first_name":"CHAD","last_name":"BENNETT","classification":"C","division":"LIMITED","hit_factor":4.5093},{"match_name":"RBGC 2018-7-28","match_date":"2018-07-28","stage_classifiercode":"99-12","member_number":"A103173","first_name":"RALPH","last_name":"EDWARDS","classification":"C","division":"LIMITED","hit_factor":4.5086},{"match_name":"YMM IPSC02 2016_09_11","match_date":"2016-09-11","stage_classifiercode":"99-12","member_number":"TY85866","first_name":"SHANE","last_name":"SKAGGS","classification":"B","division":"LIMITED","hit_factor":4.5086},{"match_name":"NVSA USPSA 1711","match_date":"2017-11-05","stage_classifiercode":"99-12","member_number":"\"\"","first_name":"SCOTT","last_name":"STEELE","classification":"U","division":"LIMITED","hit_factor":4.5061},{"match_name":"SSFGA & Master Blasters USPSA Classifier","match_date":"2018-11-17","stage_classifiercode":"99-12","member_number":"\"\"","first_name":"PASCAL","last_name":"LAVARTE","classification":"U","division":"LIMITED","hit_factor":4.5054},{"match_name":"BHPSC Monthly Match - Feb 2020","match_date":"2020-02-29","stage_classifiercode":"99-12","member_number":"A106239","first_name":"JOSHUA","last_name":"HALL","classification":"U","division":"LIMITED","hit_factor":4.5045},{"match_name":"FPS USPSA April2017","match_date":"2017-04-02","stage_classifiercode":"99-12","member_number":"A98599","first_name":"MIKE T","last_name":"DIGIOVANNI","classification":"C","division":"LIMITED","hit_factor":4.5035},{"match_name":"Pelham USPSA 2016-09-18","match_date":"2016-09-18","stage_classifiercode":"99-12","member_number":"A96745","first_name":"NATHANIAL","last_name":"BALLEW","classification":"C","division":"LIMITED","hit_factor":4.5024},{"match_name":"EWPSA 2016-04","match_date":"2016-04-17","stage_classifiercode":"99-12","member_number":"54529","first_name":"TIM","last_name":"KING","classification":"B","division":"LIMITED","hit_factor":4.4992},{"match_name":"Gunsmoke Action Shooters USPSA April 18","match_date":"2018-04-07","stage_classifiercode":"99-12","member_number":"A107472","first_name":"KEVIN","last_name":"OMUNDSON","classification":"C","division":"LIMITED","hit_factor":4.4961},{"match_name":"EWPSA 2016-04","match_date":"2016-04-17","stage_classifiercode":"99-12","member_number":"A87989","first_name":"BENJAMIN","last_name":"CHAMBERS","classification":"C","division":"LIMITED","hit_factor":4.4956},{"match_name":"OK15 USPSA AT USSA","match_date":"2016-07-10","stage_classifiercode":"99-12","member_number":"Ty33925","first_name":"ROBAIRE SR","last_name":"PULLICAR","classification":"B","division":"LIMITED","hit_factor":4.4956},{"match_name":"SCAPSA MN05 Summer League 1","match_date":"2017-06-05","stage_classifiercode":"99-12","member_number":"\"\"","first_name":"SAM","last_name":"RYDBERG","classification":"U","division":"LIMITED","hit_factor":4.4902},{"match_name":"MCPSL Pistol 4-9-16","match_date":"2016-04-09","stage_classifiercode":"99-12","member_number":"A94098","first_name":"PETE","last_name":"SCHLEICHER","classification":"U","division":"LIMITED","hit_factor":4.4894},{"match_name":"FBURG April 2017 Level I USPSA ","match_date":"2017-04-01","stage_classifiercode":"99-12","member_number":"A3025","first_name":"JEFF","last_name":"HOGE","classification":"B","division":"LIMITED","hit_factor":4.48},{"match_name":"SPSA USPSA March 4th Sat match","match_date":"2017-03-25","stage_classifiercode":"99-12","member_number":"A47715","first_name":"SCOTT","last_name":"DELUCE","classification":"A","division":"LIMITED","hit_factor":4.4776},{"match_name":"Shasta Shooters August 2016","match_date":"2016-08-13","stage_classifiercode":"99-12","member_number":"\"\"","first_name":"SHAWN","last_name":"ANSTINE","classification":"U","division":"LIMITED","hit_factor":4.4763},{"match_name":"Laser Ninja Dragon League USPSA August 2017","match_date":"2017-08-06","stage_classifiercode":"99-12","member_number":"TY103745","first_name":"JAKE","last_name":"ROWDEN","classification":"U","division":"LIMITED","hit_factor":4.4762},{"match_name":"OFGC USPSA Match Feb 19th 2017","match_date":"2017-02-19","stage_classifiercode":"99-12","member_number":"A98546","first_name":"BRYAN","last_name":"BROWN","classification":"C","division":"LIMITED","hit_factor":4.4747},{"match_name":"MSA USPSA Special Classifier 12-4-16","match_date":"2016-12-04","stage_classifiercode":"99-12","member_number":"A-99689","first_name":"LONNY","last_name":"GUPTON","classification":"U","division":"LIMITED","hit_factor":4.466},{"match_name":"Collin County USPSA Nov. 27 2016","match_date":"2016-11-25","stage_classifiercode":"99-12","member_number":"A97697","first_name":"BRIAN","last_name":"ARTHUR","classification":"U","division":"LIMITED","hit_factor":4.4635},{"match_name":"SFPC September USPSA Special Classifier match","match_date":"2016-09-04","stage_classifiercode":"99-12","member_number":"A4163204","first_name":"JUAN","last_name":"CARRASQUERO","classification":"C","division":"LIMITED","hit_factor":4.4634},{"match_name":"LdF USPSA Match July 14 2018","match_date":"2018-07-14","stage_classifiercode":"99-12","member_number":"TY110175","first_name":"JASON","last_name":"HURST","classification":"C","division":"LIMITED","hit_factor":4.4617},{"match_name":"H&H June Match","match_date":"2016-06-26","stage_classifiercode":"99-12","member_number":"TY75066","first_name":"STEVE","last_name":"MCGINLEY","classification":"C","division":"LIMITED","hit_factor":4.4615},{"match_name":"MSA USPSA Special Classifier 12-4-16","match_date":"2016-12-04","stage_classifiercode":"99-12","member_number":"A-72356","first_name":"CHARLIE","last_name":"BARRY - LIM","classification":"U","division":"LIMITED","hit_factor":4.4601},{"match_name":"Brothers N Arms February 2018 USPSA Match","match_date":"2018-02-17","stage_classifiercode":"99-12","member_number":"A108941","first_name":"ARIN","last_name":"HANOHANO","classification":"U","division":"LIMITED","hit_factor":4.4597},{"match_name":"Payson Practical Pistol Sept 03 2016","match_date":"2016-09-03","stage_classifiercode":"99-12","member_number":"TY89647","first_name":"RANDY","last_name":"BENNETT","classification":"C","division":"LIMITED","hit_factor":4.4592},{"match_name":"Gunsmoke Action Shooters USPSA April 18","match_date":"2018-04-07","stage_classifiercode":"99-12","member_number":"A83760","first_name":"WILLIAM KING","last_name":"DRUMMOND","classification":"B","division":"LIMITED","hit_factor":4.4547},{"match_name":"Richmond Hot Shots February 7-2016 USPSA Match","match_date":"2016-02-07","stage_classifiercode":"99-12","member_number":"TY49645","first_name":"ED","last_name":"ESPINOZA","classification":"B","division":"LIMITED","hit_factor":4.4496},{"match_name":"MSA USPSA Special Classifier 12-4-16","match_date":"2016-12-04","stage_classifiercode":"99-12","member_number":"\"\"","first_name":"PAUL","last_name":"URIAS","classification":"U","division":"LIMITED","hit_factor":4.4481},{"match_name":"LdF 4th Saturday Match","match_date":"2016-01-23","stage_classifiercode":"99-12","member_number":"L3040","first_name":"PJ","last_name":"PAJIMULA","classification":"M","division":"LIMITED","hit_factor":4.4444},{"match_name":"MCPSL Pistol 4-8-17","match_date":"2017-04-08","stage_classifiercode":"99-12","member_number":"A100933","first_name":"RON","last_name":"PATERSON","classification":"U","division":"LIMITED","hit_factor":4.4424},{"match_name":"WTPS USPSA April Classifier Match 4-8-17","match_date":"2017-04-08","stage_classifiercode":"99-12","member_number":"PEN","first_name":"SHANE","last_name":"BRYANT","classification":"U","division":"LIMITED","hit_factor":4.4369},{"match_name":"FBURG April 2017 Level I USPSA ","match_date":"2017-04-01","stage_classifiercode":"99-12","member_number":"TY82648","first_name":"JIM","last_name":"SANTORO","classification":"B","division":"LIMITED","hit_factor":4.4359},{"match_name":"Shoot GTR USPSA 11/6","match_date":"2016-11-06","stage_classifiercode":"99-12","member_number":"A86691","first_name":"JEFF","last_name":"MELING","classification":"C","division":"LIMITED","hit_factor":4.4304},{"match_name":"WSPS OCTOBER 2017 USPSA MATCH","match_date":"2017-10-21","stage_classifiercode":"99-12","member_number":"TY70283","first_name":"RACHAEL","last_name":"GRANICO","classification":"B","division":"LIMITED","hit_factor":4.4257},{"match_name":"TAC2 USPSA August 2017","match_date":"2017-08-05","stage_classifiercode":"99-12","member_number":"A100329","first_name":"JOHN","last_name":"KENNEDY","classification":"U","division":"LIMITED","hit_factor":4.4255},{"match_name":"LCSA USPSA ALL CLASSIFIER ","match_date":"2018-06-30","stage_classifiercode":"99-12","member_number":"A96427","first_name":"BRIAN","last_name":"CICCO","classification":"B","division":"LIMITED","hit_factor":4.4237},{"match_name":"OK15 USPSA at USSA","match_date":"2017-12-10","stage_classifiercode":"99-12","member_number":"A102348","first_name":"JERRY","last_name":"NUNNALLY","classification":"C","division":"LIMITED","hit_factor":4.4226},{"match_name":"SCCCJULYCLASSIFIER2016","match_date":"2016-07-30","stage_classifiercode":"99-12","member_number":"A27728","first_name":"ANDREW","last_name":"GAILOR","classification":"B","division":"LIMITED","hit_factor":4.4209},{"match_name":"FBURG April 2017 Level I USPSA ","match_date":"2017-04-01","stage_classifiercode":"99-12","member_number":"A72195","first_name":"RYAN","last_name":"CLEMENTS","classification":"M","division":"LIMITED","hit_factor":4.4207},{"match_name":"North Mountain July ","match_date":"2016-07-17","stage_classifiercode":"99-12","member_number":"A34963","first_name":"MARK","last_name":"YACKLEY","classification":"B","division":"LIMITED","hit_factor":4.4158},{"match_name":"Belton Gun Club USPSA January MATCH 1-30-21","match_date":"2021-01-30","stage_classifiercode":"99-12","member_number":"A127338","first_name":"DOUGLAS","last_name":"HASSELBRING","classification":"U","division":"LIMITED","hit_factor":4.414},{"match_name":"Castlewood WPA13 Halloween Oct 22 2016","match_date":"2016-10-22","stage_classifiercode":"99-12","member_number":"a93386","first_name":"RYAN","last_name":"SHEWCHUK","classification":"U","division":"LIMITED","hit_factor":4.4082},{"match_name":"SSS USPSA February 2020","match_date":"2020-02-16","stage_classifiercode":"99-12","member_number":"L4350","first_name":"TOM","last_name":"BYRUM","classification":"C (C Class)","division":"LIMITED","hit_factor":4.4049},{"match_name":"TAC2 USPSA August 2017","match_date":"2017-08-05","stage_classifiercode":"99-12","member_number":"A92187","first_name":"CHRIS 2G","last_name":"NELSON","classification":"U","division":"LIMITED","hit_factor":4.3946},{"match_name":"WTPS USPSA April Classifier Match 4-8-17","match_date":"2017-04-08","stage_classifiercode":"99-12","member_number":"A101945","first_name":"VICENTE","last_name":"MARTINEZ","classification":"U","division":"LIMITED","hit_factor":4.3941},{"match_name":"11 March Classifier Match","match_date":"2018-03-10","stage_classifiercode":"99-12","member_number":"A103088","first_name":"TROY","last_name":"JOHNSON","classification":"U","division":"LIMITED","hit_factor":4.3908},{"match_name":"SSP Super Classifier 1-30-16","match_date":"2016-01-30","stage_classifiercode":"99-12","member_number":"A82716","first_name":"DONIEL","last_name":"LEAK","classification":"U","division":"LIMITED","hit_factor":4.3871},{"match_name":"DWB - Deadwood Boys USPSA 18 February 2018","match_date":"2018-02-18","stage_classifiercode":"99-12","member_number":"\"\"","first_name":"HENRY","last_name":"ANG","classification":"D","division":"LIMITED","hit_factor":4.3825},{"match_name":"COPS Feb 2017 USPSA Match","match_date":"2017-02-05","stage_classifiercode":"99-12","member_number":"a81372","first_name":"DON","last_name":"WILSEY","classification":"C","division":"LIMITED","hit_factor":4.3802},{"match_name":"SPSA USPSA March 4th Sat match","match_date":"2017-03-25","stage_classifiercode":"99-12","member_number":"A96050","first_name":"MIKE","last_name":"GINN","classification":"B","division":"LIMITED","hit_factor":4.3796},{"match_name":"ECPS USPSA 17 Feb 18","match_date":"2018-02-16","stage_classifiercode":"99-12","member_number":"A101349","first_name":"DONNA","last_name":"BARNETT","classification":"C","division":"LIMITED","hit_factor":4.375},{"match_name":"Pelham USPSA 2016-09-18","match_date":"2016-09-18","stage_classifiercode":"99-12","member_number":"A77067","first_name":"MATT","last_name":"HOLMES","classification":"B","division":"LIMITED","hit_factor":4.375},{"match_name":"Springfield Tactical Shooters 09/03/2020","match_date":"2020-09-03","stage_classifiercode":"99-12","member_number":"TY35016","first_name":"ANDREW","last_name":"CATLIN","classification":"B","division":"LIMITED","hit_factor":4.3695},{"match_name":"LdF USPSA Match July 14 2018","match_date":"2018-07-14","stage_classifiercode":"99-12","member_number":"\"\"","first_name":"MIKE","last_name":"PAPS","classification":"B","division":"LIMITED","hit_factor":4.3673},{"match_name":"Emmett September Match","match_date":"2016-09-24","stage_classifiercode":"99-12","member_number":"TY80815","first_name":"JOHN","last_name":"DANIELSON","classification":"C","division":"LIMITED","hit_factor":4.3624},{"match_name":"USC August 2016","match_date":"2016-08-13","stage_classifiercode":"99-12","member_number":"A85193","first_name":"JON","last_name":"TESCH","classification":"C","division":"LIMITED","hit_factor":4.3582},{"match_name":"Range E11even Feb 2018 USPSA","match_date":"2018-02-24","stage_classifiercode":"99-12","member_number":"A89585","first_name":"ASHTON","last_name":"JOHNSON","classification":"B","division":"LIMITED","hit_factor":4.3559},{"match_name":"SFPC September USPSA Special Classifier match","match_date":"2016-09-04","stage_classifiercode":"99-12","member_number":"A-98469","first_name":"CRISTIANO","last_name":"SILVA","classification":"U","division":"LIMITED","hit_factor":4.3516},{"match_name":"Springfield Tactical Shooters 06-07-2018","match_date":"2018-06-07","stage_classifiercode":"99-12","member_number":"A107600","first_name":"GEORGE","last_name":"BURNS","classification":"\"\"","division":"LIMITED","hit_factor":4.3478},{"match_name":"GMPS 5/7/17","match_date":"2017-05-06","stage_classifiercode":"99-12","member_number":"A93360","first_name":"MAX","last_name":"GILLIES","classification":"D","division":"LIMITED","hit_factor":4.3441},{"match_name":"OK15 USPSA at USSA","match_date":"2017-12-10","stage_classifiercode":"99-12","member_number":"A88314","first_name":"TIM","last_name":"DOUGLAS","classification":"C","division":"LIMITED","hit_factor":4.3384},{"match_name":"Green Valley February 2017","match_date":"2017-02-25","stage_classifiercode":"99-12","member_number":"PEN","first_name":"SAM","last_name":"WILLIAMS","classification":"U","division":"LIMITED","hit_factor":4.3373},{"match_name":"WNPL USPSA - Labour Day Weekend - Sept 2017","match_date":"2017-09-02","stage_classifiercode":"99-12","member_number":"PENDING","first_name":"MICHAEL","last_name":"CLARK","classification":"U","division":"LIMITED","hit_factor":4.336},{"match_name":"WTPS USPSA April Classifier Match 4-8-17","match_date":"2017-04-08","stage_classifiercode":"99-12","member_number":"A101808","first_name":"TYLER","last_name":"SPINKS","classification":"U","division":"LIMITED","hit_factor":4.333},{"match_name":"SPSA USPSA March 4th Sat match","match_date":"2017-03-25","stage_classifiercode":"99-12","member_number":"\"\"","first_name":"MARK","last_name":"KLEIN","classification":"U","division":"LIMITED","hit_factor":4.3282},{"match_name":"NTPS-SE August 2016","match_date":"2016-08-20","stage_classifiercode":"99-12","member_number":"NONE","first_name":"JORDAN","last_name":"RUSSELL","classification":"U","division":"LIMITED","hit_factor":4.3222},{"match_name":"SCAPSA MN05 Summer League 1","match_date":"2017-06-05","stage_classifiercode":"99-12","member_number":"A100255","first_name":"CHRIS","last_name":"BUDION","classification":"U","division":"LIMITED","hit_factor":4.3154},{"match_name":"Pinetucky USPSA 11-19-16","match_date":"2016-11-19","stage_classifiercode":"99-12","member_number":"A91952","first_name":"PHILIP","last_name":"LEE","classification":"C","division":"LIMITED","hit_factor":4.315},{"match_name":"Emmett September Match","match_date":"2016-09-24","stage_classifiercode":"99-12","member_number":"a83452","first_name":"RYAN","last_name":"LIN","classification":"C","division":"LIMITED","hit_factor":4.3095},{"match_name":"WTPS USPSA April Classifier Match 4-8-17","match_date":"2017-04-08","stage_classifiercode":"99-12","member_number":"A96212","first_name":"BRAD","last_name":"HAVENS","classification":"U","division":"LIMITED","hit_factor":4.3059},{"match_name":"ENPS May 2018 USPSA Match","match_date":"2018-05-06","stage_classifiercode":"99-12","member_number":"\"\"","first_name":"JAIME","last_name":"DESAUTELS","classification":"U","division":"LIMITED","hit_factor":4.3035},{"match_name":"Atlanta Practical Shooters March 2016 USPSA - Classifier Match","match_date":"2016-03-06","stage_classifiercode":"99-12","member_number":"a68886","first_name":"CORY","last_name":"ACKLEY","classification":"D","division":"LIMITED","hit_factor":4.3035},{"match_name":"Chillicothe May-2017 USPSA Match","match_date":"2017-05-28","stage_classifiercode":"99-12","member_number":"A57074","first_name":"MIKE","last_name":"KOWALSKI","classification":"C","division":"LIMITED","hit_factor":4.3029},{"match_name":"Green Valley February 2017","match_date":"2017-02-25","stage_classifiercode":"99-12","member_number":"a100759","first_name":"KEITH","last_name":"CONRAD","classification":"U","division":"LIMITED","hit_factor":4.3011},{"match_name":"Shasta Shooters August 2016","match_date":"2016-08-13","stage_classifiercode":"99-12","member_number":"A30368","first_name":"P WAYNE","last_name":"FACCA","classification":"B","division":"LIMITED","hit_factor":4.3011},{"match_name":"Springfield Tactical Shooters 09/03/2020","match_date":"2020-09-03","stage_classifiercode":"99-12","member_number":"TY35016","first_name":"ANDREW","last_name":"CATLIN","classification":"B","division":"LIMITED","hit_factor":4.2998},{"match_name":"SPSA USPSA March 4th Sat match","match_date":"2017-03-25","stage_classifiercode":"99-12","member_number":"TY66707","first_name":"WALLY","last_name":"BURBAGE","classification":"A","division":"LIMITED","hit_factor":4.2975},{"match_name":"COPS Feb 2017 USPSA Match","match_date":"2017-02-05","stage_classifiercode":"99-12","member_number":"a95809","first_name":"JOE","last_name":"KIMBLE","classification":"D","division":"LIMITED","hit_factor":4.287},{"match_name":"Shasta Shooters August 2016","match_date":"2016-08-13","stage_classifiercode":"99-12","member_number":"A98262","first_name":"CHRIS","last_name":"PETERSON","classification":"U","division":"LIMITED","hit_factor":4.2857},{"match_name":"LCHG May USPSA","match_date":"2017-05-21","stage_classifiercode":"99-12","member_number":"ty43042","first_name":"DAN","last_name":"HASH","classification":"A","division":"LIMITED","hit_factor":4.2843},{"match_name":"Paul Bunyan April 7th-8th All Classifier Match NW01","match_date":"2018-04-07","stage_classifiercode":"99-12","member_number":"A63069","first_name":"RUSTY","last_name":"SANTOS","classification":"U","division":"LIMITED","hit_factor":4.2813},{"match_name":"Palmetto Gun Club - February 2018 USPSA","match_date":"2018-02-03","stage_classifiercode":"99-12","member_number":"A67072","first_name":"BRUCE","last_name":"CYR","classification":"C","division":"LIMITED","hit_factor":4.2813},{"match_name":"CGC 2017_05_13","match_date":"2017-05-13","stage_classifiercode":"99-12","member_number":"A101527","first_name":"TROY","last_name":"WHITE","classification":"U","division":"LIMITED","hit_factor":4.2804},{"match_name":"Sept 3rd Uspsa   Pickaway","match_date":"2016-09-03","stage_classifiercode":"99-12","member_number":"A85908","first_name":"BOB","last_name":"LAUER","classification":"C","division":"LIMITED","hit_factor":4.2642},{"match_name":"ENPS May 2018 USPSA Match","match_date":"2018-05-06","stage_classifiercode":"99-12","member_number":"TY111167","first_name":"JASON","last_name":"WAGNER","classification":"U","division":"LIMITED","hit_factor":4.2636},{"match_name":"OK15 USPSA AT USSA","match_date":"2016-07-10","stage_classifiercode":"99-12","member_number":"A88052","first_name":"JOSH","last_name":"COBB","classification":"B","division":"LIMITED","hit_factor":4.2636},{"match_name":"SSP Super Classifier 1-30-16","match_date":"2016-01-30","stage_classifiercode":"99-12","member_number":"PEN","first_name":"DAVID","last_name":"FERNAANDEZ","classification":"U","division":"LIMITED","hit_factor":4.2593},{"match_name":"LCHG May USPSA","match_date":"2017-05-21","stage_classifiercode":"99-12","member_number":"\"\"","first_name":"STEVEN","last_name":"EGELINE","classification":"B","division":"LIMITED","hit_factor":4.257},{"match_name":"DWB - Deadwood Boys USPSA 18 February 2018","match_date":"2018-02-18","stage_classifiercode":"99-12","member_number":"TY82995","first_name":"JEFFREY","last_name":"HUNT","classification":"B","division":"LIMITED","hit_factor":4.2553},{"match_name":"OK15 USPSA at USSA","match_date":"2017-12-10","stage_classifiercode":"99-12","member_number":"TY96272","first_name":"KELLY","last_name":"BROWN","classification":"D","division":"LIMITED","hit_factor":4.2553},{"match_name":"CGC 2017_05_13","match_date":"2017-05-13","stage_classifiercode":"99-12","member_number":"A90100","first_name":"KAYLA","last_name":"BODRON","classification":"C","division":"LIMITED","hit_factor":4.2553},{"match_name":"APSA February 2017 USPSA Match","match_date":"2017-02-11","stage_classifiercode":"99-12","member_number":"A87382","first_name":"CHRIS","last_name":"BRITT","classification":"C","division":"LIMITED","hit_factor":4.253},{"match_name":"LdF USPSA Match July 14 2018","match_date":"2018-07-14","stage_classifiercode":"99-12","member_number":"A103738","first_name":"KURT","last_name":"SONGCO","classification":"U","division":"LIMITED","hit_factor":4.252},{"match_name":"2020-07 Bone Creek USPSA","match_date":"2020-07-05","stage_classifiercode":"99-12","member_number":"A95318","first_name":"JOSEPH","last_name":"NEWCOMB","classification":"C","division":"LIMITED","hit_factor":4.251},{"match_name":"Rendezvous 8-24-16","match_date":"2016-08-25","stage_classifiercode":"99-12","member_number":"\"\"","first_name":"FRANK","last_name":"K.","classification":"U","division":"LIMITED","hit_factor":4.2429},{"match_name":"TPS USPSA PISTOL - May 2016 - Talon Range","match_date":"2016-05-07","stage_classifiercode":"99-12","member_number":"a6381","first_name":"ROBBY","last_name":"HARRIS","classification":"C","division":"LIMITED","hit_factor":4.2409},{"match_name":"Chillicothe May-2017 USPSA Match","match_date":"2017-05-28","stage_classifiercode":"99-12","member_number":"A103339","first_name":"LEON","last_name":"OLIVER","classification":"\"\"","division":"LIMITED","hit_factor":4.238},{"match_name":"OFGC USPSA Match 10-21-18","match_date":"2018-10-21","stage_classifiercode":"99-12","member_number":"A113711","first_name":"MARK","last_name":"KELLY","classification":"U","division":"LIMITED","hit_factor":4.2279},{"match_name":"SCAPSA MN05 Summer League 1","match_date":"2017-06-05","stage_classifiercode":"99-12","member_number":"A101862","first_name":"DAVID","last_name":"SWEETER","classification":"U","division":"LIMITED","hit_factor":4.2275},{"match_name":"YMM IPSC02 2016_09_11","match_date":"2016-09-11","stage_classifiercode":"99-12","member_number":"\"\"","first_name":"CHASE","last_name":"STEWART","classification":"C","division":"LIMITED","hit_factor":4.2269},{"match_name":"WTPS USPSA April Classifier Match 4-8-17","match_date":"2017-04-08","stage_classifiercode":"99-12","member_number":"a90358","first_name":"MICHAEL","last_name":"STRIPLING","classification":"C","division":"LIMITED","hit_factor":4.2216},{"match_name":"MCPSL Pistol 4-8-17","match_date":"2017-04-08","stage_classifiercode":"99-12","member_number":"A100188","first_name":"SEVERIANO","last_name":"MATA","classification":"C","division":"LIMITED","hit_factor":4.2146},{"match_name":"RD Shooters May 6th USPSA  match","match_date":"2017-05-06","stage_classifiercode":"99-12","member_number":"\"\"","first_name":"IAN","last_name":"GRAY","classification":"U","division":"LIMITED","hit_factor":4.2146},{"match_name":"COPS Feb 2017 USPSA Match","match_date":"2017-02-05","stage_classifiercode":"99-12","member_number":"PEN","first_name":"JOSHUA","last_name":"LARSON","classification":"U","division":"LIMITED","hit_factor":4.2146},{"match_name":"RBGC 2018-7-28","match_date":"2018-07-28","stage_classifiercode":"99-12","member_number":"TY31686","first_name":"JD","last_name":"CLEMINSHAW","classification":"C","division":"LIMITED","hit_factor":4.2068},{"match_name":"Chillicothe May-2017 USPSA Match","match_date":"2017-05-28","stage_classifiercode":"99-12","member_number":"A97039","first_name":"JON","last_name":"BOURNE","classification":"B","division":"LIMITED","hit_factor":4.2068},{"match_name":"DWB - Deadwood Boys USPSA 18 February 2018","match_date":"2018-02-18","stage_classifiercode":"99-12","member_number":"\"\"","first_name":"AARON","last_name":"NAKAYAMA","classification":"U","division":"LIMITED","hit_factor":4.2042},{"match_name":"SFPS 05-21-17 Superclassifier Gun1","match_date":"2017-05-21","stage_classifiercode":"99-12","member_number":"PEN","first_name":"JOSH","last_name":"TWEDT","classification":"U","division":"LIMITED","hit_factor":4.2038},{"match_name":"LdF 4th Saturday Match","match_date":"2016-01-23","stage_classifiercode":"99-12","member_number":"A88518","first_name":"MIKE","last_name":"IBARRA","classification":"D","division":"LIMITED","hit_factor":4.2017},{"match_name":"RD Shooters May 6th USPSA  match","match_date":"2017-05-06","stage_classifiercode":"99-12","member_number":"TY92290","first_name":"STEVEN","last_name":"GRIFE","classification":"D","division":"LIMITED","hit_factor":4.1995},{"match_name":"OFGC USPSA Match Feb 19th 2017","match_date":"2017-02-19","stage_classifiercode":"99-12","member_number":"A92627","first_name":"CHRIS","last_name":"YATES","classification":"C","division":"LIMITED","hit_factor":4.1985},{"match_name":"Danville Rifle and Pistol Club USPSA IL17 April 21 2018","match_date":"2018-04-21","stage_classifiercode":"99-12","member_number":"TY90126","first_name":"TOM","last_name":"BURZYNSKI","classification":"U","division":"LIMITED","hit_factor":4.1964},{"match_name":"Collin County USPSA Nov. 27 2016","match_date":"2016-11-25","stage_classifiercode":"99-12","member_number":"NONE","first_name":"RICHARD","last_name":"SMITH","classification":"U","division":"LIMITED","hit_factor":4.1903},{"match_name":"COPS Feb 2017 USPSA Match","match_date":"2017-02-05","stage_classifiercode":"99-12","member_number":"TY90200","first_name":"CRAIG","last_name":"CASH","classification":"C","division":"LIMITED","hit_factor":4.1879},{"match_name":"Brothers N Arms February 2018 USPSA Match","match_date":"2018-02-17","stage_classifiercode":"99-12","member_number":"A63746","first_name":"ROBERT","last_name":"JONES","classification":"M","division":"LIMITED","hit_factor":4.1866},{"match_name":"Amarillo Action April  USPSA","match_date":"2016-04-23","stage_classifiercode":"99-12","member_number":"\"\"","first_name":"TY","last_name":"CRUM","classification":"U","division":"LIMITED","hit_factor":4.1818},{"match_name":"LCHG May USPSA","match_date":"2017-05-21","stage_classifiercode":"99-12","member_number":"FY89101","first_name":"DAN","last_name":"PRENTICE","classification":"B","division":"LIMITED","hit_factor":4.1812},{"match_name":"USC August 2016","match_date":"2016-08-13","stage_classifiercode":"99-12","member_number":"TY81577","first_name":"HEINZ","last_name":"LEIGH","classification":"B","division":"LIMITED","hit_factor":4.1787},{"match_name":"FBURG April 2017 Level I USPSA ","match_date":"2017-04-01","stage_classifiercode":"99-12","member_number":"\"\"","first_name":"HUNTER","last_name":"ODELL","classification":"U","division":"LIMITED","hit_factor":4.1756},{"match_name":"PIPS 06-14-2017","match_date":"2017-06-14","stage_classifiercode":"99-12","member_number":"FY95176","first_name":"CHRIS","last_name":"BORTON","classification":"C","division":"LIMITED","hit_factor":4.1715},{"match_name":"USC August 2016","match_date":"2016-08-13","stage_classifiercode":"99-12","member_number":"\"\"","first_name":"PETER","last_name":"VANKORT","classification":"U","division":"LIMITED","hit_factor":4.17},{"match_name":"LCSA USPSA ALL CLASSIFIER ","match_date":"2018-06-30","stage_classifiercode":"99-12","member_number":"A110039","first_name":"KRIS","last_name":"RICHARD","classification":"U","division":"LIMITED","hit_factor":4.1667},{"match_name":"BRSP Tuesday Night USPSA Match - Nov 14","match_date":"2017-11-15","stage_classifiercode":"99-12","member_number":"A106443","first_name":"LYLE","last_name":"ROWE","classification":"\"\"","division":"LIMITED","hit_factor":4.1667},{"match_name":"SPSA USPSA March 4th Sat match","match_date":"2017-03-25","stage_classifiercode":"99-12","member_number":"A101365","first_name":"ERICK","last_name":"SWANGER","classification":"U","division":"LIMITED","hit_factor":4.1629},{"match_name":"Shoot GTR USPSA 11/6","match_date":"2016-11-06","stage_classifiercode":"99-12","member_number":"\"\"","first_name":"MIKE","last_name":"MCCANN","classification":"X","division":"LIMITED","hit_factor":4.1597},{"match_name":"FBURG April 2017 Level I USPSA ","match_date":"2017-04-01","stage_classifiercode":"99-12","member_number":"\"\"","first_name":"MARK","last_name":"NEEBE","classification":"U","division":"LIMITED","hit_factor":4.1596},{"match_name":"Springfield Tactical Shooters 09/03/2020","match_date":"2020-09-03","stage_classifiercode":"99-12","member_number":"A126293","first_name":"JAMIE","last_name":"BLAKLEY","classification":"\"\"","division":"LIMITED","hit_factor":4.1591},{"match_name":"Brothers N Arms February 2018 USPSA Match","match_date":"2018-02-17","stage_classifiercode":"99-12","member_number":"PENDING","first_name":"PAUL","last_name":"PAXTON","classification":"C","division":"LIMITED","hit_factor":4.1567},{"match_name":"ECPS February 28th USPSA Pistol Match","match_date":"2016-02-28","stage_classifiercode":"99-12","member_number":"A91756","first_name":"DAVID","last_name":"MARTON","classification":"C","division":"LIMITED","hit_factor":4.1558},{"match_name":"Pinetucky USPSA 11-19-16","match_date":"2016-11-19","stage_classifiercode":"99-12","member_number":"TY67776","first_name":"NICK","last_name":"ORTALAZA","classification":"B","division":"LIMITED","hit_factor":4.1485},{"match_name":"South Texas Tactical USPSA","match_date":"2017-07-08","stage_classifiercode":"99-12","member_number":"\"\"","first_name":"RON","last_name":"WEST","classification":"\"\"","division":"LIMITED","hit_factor":4.1481},{"match_name":"Holmen USPSA Mar 26 2017","match_date":"2017-03-26","stage_classifiercode":"99-12","member_number":"A83117","first_name":"BOB","last_name":"NAVRESTAD","classification":"U","division":"LIMITED","hit_factor":4.1463},{"match_name":"CVSC 06-25-2017","match_date":"2017-06-25","stage_classifiercode":"99-12","member_number":"TY52971","first_name":"BRADLEY","last_name":"HOLT","classification":"M","division":"LIMITED","hit_factor":4.1379},{"match_name":"BHPSC Monthly Match - Feb 2020","match_date":"2020-02-29","stage_classifiercode":"99-12","member_number":"TY34089","first_name":"BILL","last_name":"DUDLEY","classification":"B","division":"LIMITED","hit_factor":4.1359},{"match_name":"17s PSC - Feb 2017 - USPSA match","match_date":"2017-02-04","stage_classifiercode":"99-12","member_number":"\"\"","first_name":"JEFF","last_name":"LAZENBY","classification":"U","division":"LIMITED","hit_factor":4.1344},{"match_name":"APSA February 2017 USPSA Match","match_date":"2017-02-11","stage_classifiercode":"99-12","member_number":"A88172","first_name":"CHAD","last_name":"HOLLIFIELD","classification":"B","division":"LIMITED","hit_factor":4.1322},{"match_name":"Griffin USPSA Match Aug 2017","match_date":"2017-08-19","stage_classifiercode":"99-12","member_number":"A99153","first_name":"STEPHEN","last_name":"NEALE","classification":"U","division":"LIMITED","hit_factor":4.1315},{"match_name":"WPS USPSA Monthly Match September 2018","match_date":"2018-09-01","stage_classifiercode":"99-12","member_number":"A100811","first_name":"PAUL","last_name":"MINNICH","classification":"U","division":"LIMITED","hit_factor":4.1303},{"match_name":"WTPS USPSA April Classifier Match 4-8-17","match_date":"2017-04-08","stage_classifiercode":"99-12","member_number":"A101995","first_name":"DAVID","last_name":"DUCKETT","classification":"U","division":"LIMITED","hit_factor":4.1296},{"match_name":"Prescott 3rd Sunday USPSA 11-20-2016","match_date":"2016-11-20","stage_classifiercode":"99-12","member_number":"\"\"","first_name":"MIKE","last_name":"CHAMBERS","classification":"U","division":"LIMITED","hit_factor":4.1288},{"match_name":"COPS Feb 2017 USPSA Match","match_date":"2017-02-05","stage_classifiercode":"99-12","member_number":"A98728","first_name":"ANDREW","last_name":"KNELL","classification":"U","division":"LIMITED","hit_factor":4.1288},{"match_name":"SFPC September USPSA Special Classifier match","match_date":"2016-09-04","stage_classifiercode":"99-12","member_number":"TY78067","first_name":"MIKE","last_name":"KREBSBACH","classification":"C","division":"LIMITED","hit_factor":4.1284},{"match_name":"SPSA USPSA March 4th Sat match","match_date":"2017-03-25","stage_classifiercode":"99-12","member_number":"\"\"","first_name":"JOSH","last_name":"CHASTAIN","classification":"U","division":"LIMITED","hit_factor":4.1281},{"match_name":"Fairfax PS USPSA  2018 September","match_date":"2018-09-18","stage_classifiercode":"99-12","member_number":"a102413","first_name":"MARK","last_name":"NEEBE","classification":"A","division":"LIMITED","hit_factor":4.1265},{"match_name":"Emmett September Match","match_date":"2016-09-24","stage_classifiercode":"99-12","member_number":"a84188","first_name":"LARRY","last_name":"OLETSKI","classification":"C","division":"LIMITED","hit_factor":4.1257},{"match_name":"GRPC USPSA MARCH MAD HATTER","match_date":"2018-03-02","stage_classifiercode":"99-12","member_number":"TY94575","first_name":"MICHAEL","last_name":"PONTIOUS","classification":"C","division":"LIMITED","hit_factor":4.1247},{"match_name":"gun2 sfps20170521 2","match_date":"2017-05-20","stage_classifiercode":"99-12","member_number":"TY76790","first_name":"BRYAN","last_name":"KINNEY","classification":"C","division":"LIMITED","hit_factor":4.1131},{"match_name":"SLEL October 2017 Match","match_date":"2017-10-19","stage_classifiercode":"99-12","member_number":"A80398","first_name":"RICHARD","last_name":"SCALZO","classification":"C","division":"LIMITED","hit_factor":4.1127},{"match_name":"MSA USPSA Special Classifier 12-4-16","match_date":"2016-12-04","stage_classifiercode":"99-12","member_number":"\"\"","first_name":"ISAAC","last_name":"URIAS","classification":"U","division":"LIMITED","hit_factor":4.1096},{"match_name":"Hosemasters  3rd Sunday Feburary 2017","match_date":"2017-02-12","stage_classifiercode":"99-12","member_number":"TY22856","first_name":"JOE","last_name":"WHEELER","classification":"U","division":"LIMITED","hit_factor":4.1086},{"match_name":"TPS USPSA - September 2016 - Talon Range","match_date":"2016-09-03","stage_classifiercode":"99-12","member_number":"A92644","first_name":"LEE","last_name":"TURNER","classification":"C","division":"LIMITED","hit_factor":4.1083},{"match_name":"SFPS 05-21-17 Superclassifier Gun1","match_date":"2017-05-21","stage_classifiercode":"99-12","member_number":"PEN","first_name":"ED","last_name":"MARHELS","classification":"U","division":"LIMITED","hit_factor":4.1066},{"match_name":"BRSP Tuesday Night USPSA Match - Nov 14","match_date":"2017-11-15","stage_classifiercode":"99-12","member_number":"\"\"","first_name":"CODY","last_name":"HOLLAND","classification":"\"\"","division":"LIMITED","hit_factor":4.1045},{"match_name":"COPS Feb 2017 USPSA Match","match_date":"2017-02-05","stage_classifiercode":"99-12","member_number":"ty82545","first_name":"FRED","last_name":"HOLTSMAN","classification":"U","division":"LIMITED","hit_factor":4.094},{"match_name":"ECPS USPSA 17 Feb 18","match_date":"2018-02-16","stage_classifiercode":"99-12","member_number":"TY100663","first_name":"DAVID","last_name":"ROGERS","classification":"U","division":"LIMITED","hit_factor":4.0878},{"match_name":"ECPS February 28th USPSA Pistol Match","match_date":"2016-02-28","stage_classifiercode":"99-12","member_number":"A92080","first_name":"STEPHANIE","last_name":"LOCKWOOD","classification":"D","division":"LIMITED","hit_factor":4.0851},{"match_name":"MCPSL Pistol 4-8-17","match_date":"2017-04-08","stage_classifiercode":"99-12","member_number":"A100940","first_name":"FRED","last_name":"MCCLENAHAN","classification":"U","division":"LIMITED","hit_factor":4.0845},{"match_name":"NVSA USPSA 1711","match_date":"2017-11-05","stage_classifiercode":"99-12","member_number":"\"\"","first_name":"BEN","last_name":"RETUTAL","classification":"U","division":"LIMITED","hit_factor":4.0816},{"match_name":"LdF 4th Saturday Match","match_date":"2016-01-23","stage_classifiercode":"99-12","member_number":"TY83895","first_name":"PATRICK","last_name":"RUNION","classification":"U","division":"LIMITED","hit_factor":4.0785},{"match_name":"Springfield Tactical Shooters 09/03/2020","match_date":"2020-09-03","stage_classifiercode":"99-12","member_number":"A129727","first_name":"MATHIEU","last_name":"ROBILLARD","classification":"\"\"","division":"LIMITED","hit_factor":4.077},{"match_name":"NTPS-SE August 2016","match_date":"2016-08-20","stage_classifiercode":"99-12","member_number":"\"\"","first_name":"DAVID","last_name":"RAGSDALE","classification":"U","division":"LIMITED","hit_factor":4.0752},{"match_name":"Nampa USPSA February 1st","match_date":"2020-02-01","stage_classifiercode":"99-12","member_number":"FY81838","first_name":"JIM","last_name":"PARKER","classification":"C","division":"LIMITED","hit_factor":4.0747},{"match_name":"OK15 USPSA at USSA","match_date":"2017-12-10","stage_classifiercode":"99-12","member_number":"A91228","first_name":"DANNY","last_name":"KEEF","classification":"C","division":"LIMITED","hit_factor":4.0745},{"match_name":"MSA USPSA Special Classifier 12-4-16","match_date":"2016-12-04","stage_classifiercode":"99-12","member_number":"A93137","first_name":"BILLY","last_name":"DODSON","classification":"B","division":"LIMITED","hit_factor":4.0657},{"match_name":"Hosemasters  3rd Sunday Feburary 2017","match_date":"2017-02-12","stage_classifiercode":"99-12","member_number":"A49739","first_name":"ROBERT","last_name":"THORNE","classification":"B","division":"LIMITED","hit_factor":4.0613},{"match_name":"BSTRC Dec 20 2017","match_date":"2017-12-20","stage_classifiercode":"99-12","member_number":"106755","first_name":"MARC","last_name":"STASIOWSKI","classification":"U","division":"LIMITED","hit_factor":4.0609},{"match_name":"Hosemasters  3rd Sunday Feburary 2017","match_date":"2017-02-12","stage_classifiercode":"99-12","member_number":"A97078","first_name":"JIM","last_name":"CONNER","classification":"C","division":"LIMITED","hit_factor":4.0598},{"match_name":"17s PSC - Feb 2017 - USPSA match","match_date":"2017-02-04","stage_classifiercode":"99-12","member_number":"A60473","first_name":"KEVIN","last_name":"BARNEY","classification":"U","division":"LIMITED","hit_factor":4.0568},{"match_name":"MCPSL Pistol 4-9-16","match_date":"2016-04-09","stage_classifiercode":"99-12","member_number":"A92350","first_name":"LUKE","last_name":"CARVER","classification":"U","division":"LIMITED","hit_factor":4.056},{"match_name":"North Mountain July ","match_date":"2016-07-17","stage_classifiercode":"99-12","member_number":"A95921","first_name":"DAVID","last_name":"SIMANSKI","classification":"U","division":"LIMITED","hit_factor":4.0541},{"match_name":"Green Valley February 2017","match_date":"2017-02-25","stage_classifiercode":"99-12","member_number":"73189","first_name":"BILL","last_name":"CARTER","classification":"C","division":"LIMITED","hit_factor":4.0541},{"match_name":"DWB - Deadwood Boys USPSA 18 February 2018","match_date":"2018-02-18","stage_classifiercode":"99-12","member_number":"a63239","first_name":"MARC","last_name":"GUINO","classification":"U","division":"LIMITED","hit_factor":4.0531},{"match_name":"Atlanta Practical Shooters March 2016 USPSA - Classifier Match","match_date":"2016-03-06","stage_classifiercode":"99-12","member_number":"A91849","first_name":"JOHN","last_name":"FORD","classification":"C","division":"LIMITED","hit_factor":4.0519},{"match_name":"ECPS USPSA 17 Feb 18","match_date":"2018-02-16","stage_classifiercode":"99-12","member_number":"\"\"","first_name":"JOHN","last_name":"WINTER","classification":"U","division":"LIMITED","hit_factor":4.051},{"match_name":"BHPSC Monthly Match - Feb 2020","match_date":"2020-02-29","stage_classifiercode":"99-12","member_number":"A100139","first_name":"JON","last_name":"MAYFIELD","classification":"C","division":"LIMITED","hit_factor":4.0469},{"match_name":"South Texas Tactical USPSA","match_date":"2017-07-08","stage_classifiercode":"99-12","member_number":"\"\"","first_name":"TAYLOR","last_name":"BRYAN","classification":"\"\"","division":"LIMITED","hit_factor":4.0404},{"match_name":"Woodland Heights Practical Shooters USPSA Match","match_date":"2021-09-19","stage_classifiercode":"99-12","member_number":"TY48644","first_name":"JIM","last_name":"WILLIAMS","classification":"C","division":"LIMITED","hit_factor":4.0396},{"match_name":"FBPPC DECEMBER 2016 SPECIAL CLASSIFIER MATCH","match_date":"2016-12-10","stage_classifiercode":"99-12","member_number":"A98445","first_name":"NICHOLAS","last_name":"FRALICK","classification":"U","division":"LIMITED","hit_factor":4.0388},{"match_name":"USPSA MO21 Special Classifier 2Alpha SBRC February 27 2021","match_date":"2021-02-27","stage_classifiercode":"99-12","member_number":"A110827","first_name":"DREW","last_name":"HICKS","classification":"B","division":"LIMITED","hit_factor":4.0297},{"match_name":"NISA April Classifer Match 2016","match_date":"2016-04-24","stage_classifiercode":"99-12","member_number":"a93246","first_name":"MCKENNA","last_name":"BURLESON","classification":"C","division":"LIMITED","hit_factor":4.0282},{"match_name":"SFPS 05-21-17 Superclassifier Gun1","match_date":"2017-05-21","stage_classifiercode":"99-12","member_number":"A96689","first_name":"ANDY","last_name":"ERICKSON","classification":"D","division":"LIMITED","hit_factor":4.0268},{"match_name":"LCHG May USPSA","match_date":"2017-05-21","stage_classifiercode":"99-12","member_number":"A82155","first_name":"BOB","last_name":"EVANS","classification":"U","division":"LIMITED","hit_factor":4.0243},{"match_name":"Brothers N Arms February 2018 USPSA Match","match_date":"2018-02-17","stage_classifiercode":"99-12","member_number":"PENDING","first_name":"GLENN","last_name":"CHAMBLISS","classification":"U","division":"LIMITED","hit_factor":4.0234},{"match_name":"SFPS 05-21-17 Superclassifier Gun1","match_date":"2017-05-21","stage_classifiercode":"99-12","member_number":"TY92585","first_name":"JOHN","last_name":"SHERLOCK","classification":"D","division":"LIMITED","hit_factor":4.0194},{"match_name":"TPS USPSA PISTOL - May 2016 - Talon Range","match_date":"2016-05-07","stage_classifiercode":"99-12","member_number":"ty40498","first_name":"CHERYL","last_name":"FORDYCE","classification":"C","division":"LIMITED","hit_factor":4.0185},{"match_name":"MCPSL Pistol 4-9-16","match_date":"2016-04-09","stage_classifiercode":"99-12","member_number":"PEN","first_name":"CALEB","last_name":"PATERSON","classification":"U","division":"LIMITED","hit_factor":4.0167},{"match_name":"Southern Arizona Practical Shooters 05_5_18","match_date":"2018-05-05","stage_classifiercode":"99-12","member_number":"\"\"","first_name":"DAVE","last_name":"ADAMS","classification":"U","division":"LIMITED","hit_factor":4.0161},{"match_name":"Shongum Pistol November 2015","match_date":"2015-11-07","stage_classifiercode":"99-12","member_number":"A76739","first_name":"EDUARDO","last_name":"BIANZON","classification":"C","division":"LIMITED","hit_factor":4.0146},{"match_name":"Gunsmoke Action Shooters USPSA April 18","match_date":"2018-04-07","stage_classifiercode":"99-12","member_number":"A107538","first_name":"ZAC","last_name":"COCKRELL","classification":"D","division":"LIMITED","hit_factor":4.0142},{"match_name":"FBPPC DECEMBER 2016 SPECIAL CLASSIFIER MATCH","match_date":"2016-12-10","stage_classifiercode":"99-12","member_number":"A95097","first_name":"ALAN","last_name":"DAMIANI","classification":"B","division":"LIMITED","hit_factor":4.0142},{"match_name":"SPSA USPSA March 4th Sat match","match_date":"2017-03-25","stage_classifiercode":"99-12","member_number":"TY81382","first_name":"BRIAN","last_name":"AGNER","classification":"B","division":"LIMITED","hit_factor":4.0137},{"match_name":"17s PSC - Feb 2017 - USPSA match","match_date":"2017-02-04","stage_classifiercode":"99-12","member_number":"\"\"","first_name":"RICH","last_name":"SCHOOLEY","classification":"U","division":"LIMITED","hit_factor":4.0115},{"match_name":"Hosemasters  3rd Sunday Feburary 2017","match_date":"2017-02-12","stage_classifiercode":"99-12","member_number":"A96346","first_name":"CHRIS","last_name":"STADLER","classification":"U","division":"LIMITED","hit_factor":4.0094},{"match_name":"SSS USPSA February 2020","match_date":"2020-02-16","stage_classifiercode":"99-12","member_number":"A110509","first_name":"MATTHEW","last_name":"JACKSON","classification":"C (C Class)","division":"LIMITED","hit_factor":4.0044},{"match_name":"TPS USPSA - September 2016 - Talon Range","match_date":"2016-09-03","stage_classifiercode":"99-12","member_number":"TY 40498","first_name":"CHERYL","last_name":"FORDYCE","classification":"C","division":"LIMITED","hit_factor":4.0036},{"match_name":"SPSA USPSA March 4th Sat match","match_date":"2017-03-25","stage_classifiercode":"99-12","member_number":"100654","first_name":"BRANDON","last_name":"RADER","classification":"U","division":"LIMITED","hit_factor":3.9971},{"match_name":"LdF USPSA Match July 14 2018","match_date":"2018-07-14","stage_classifiercode":"99-12","member_number":"L3960","first_name":"BRIAN","last_name":"GAYNOR","classification":"B","division":"LIMITED","hit_factor":3.9968},{"match_name":"USPSA","match_date":"2016-06-04","stage_classifiercode":"99-12","member_number":"A97279","first_name":"ANDREW","last_name":"WHITEHOUSE","classification":"U","division":"LIMITED","hit_factor":3.9959},{"match_name":"WNPL USPSA - Labour Day Weekend - Sept 2017","match_date":"2017-09-02","stage_classifiercode":"99-12","member_number":"A78463","first_name":"ALEXANDRA","last_name":"HITCH","classification":"C","division":"LIMITED","hit_factor":3.9874},{"match_name":"South Texas Tactical USPSA","match_date":"2017-07-08","stage_classifiercode":"99-12","member_number":"TY85728","first_name":"BOBBI","last_name":"HOLLAND","classification":"D","division":"LIMITED","hit_factor":3.9813},{"match_name":"Griffin USPSA Match Aug 2017","match_date":"2017-08-19","stage_classifiercode":"99-12","member_number":"L1665","first_name":"HAROLD","last_name":"HAM","classification":"A","division":"LIMITED","hit_factor":3.9801},{"match_name":"COPS Feb 2017 USPSA Match","match_date":"2017-02-05","stage_classifiercode":"99-12","member_number":"A99205","first_name":"CHRIS","last_name":"JAMES","classification":"U","division":"LIMITED","hit_factor":3.9801},{"match_name":"Danville Rifle and Pistol Club USPSA IL17 April 21 2018","match_date":"2018-04-21","stage_classifiercode":"99-12","member_number":"A105390","first_name":"SCOTT","last_name":"GIVENS","classification":"U","division":"LIMITED","hit_factor":3.9746},{"match_name":"LCHG May USPSA","match_date":"2017-05-21","stage_classifiercode":"99-12","member_number":"A92874","first_name":"DARIN","last_name":"HOLLAWAY","classification":"C","division":"LIMITED","hit_factor":3.9643},{"match_name":"DWB - Deadwood Boys USPSA 18 February 2018","match_date":"2018-02-18","stage_classifiercode":"99-12","member_number":"A91936","first_name":"CHRISTOPHER","last_name":"GURNETT","classification":"C","division":"LIMITED","hit_factor":3.9642},{"match_name":"Woodland Heights Practical Shooters USPSA Match","match_date":"2021-09-19","stage_classifiercode":"99-12","member_number":"ty-25721","first_name":"MARK","last_name":"VOGEL","classification":"C","division":"LIMITED","hit_factor":3.9597},{"match_name":"Payson Practical Pistol Sept 03 2016","match_date":"2016-09-03","stage_classifiercode":"99-12","member_number":"A92986","first_name":"GARRET","last_name":"WARNER","classification":"C","division":"LIMITED","hit_factor":3.9594},{"match_name":"Brothers N Arms August 2018 USPSA Match","match_date":"2018-08-18","stage_classifiercode":"99-12","member_number":"A105734","first_name":"MICHAEL","last_name":"PHILLIPS","classification":"C","division":"LIMITED","hit_factor":3.9578},{"match_name":"2020-07 Bone Creek USPSA","match_date":"2020-07-05","stage_classifiercode":"99-12","member_number":"A100139","first_name":"JON","last_name":"MAYFIELD","classification":"C","division":"LIMITED","hit_factor":3.9553},{"match_name":"GRPC USPSA MARCH MAD HATTER","match_date":"2018-03-02","stage_classifiercode":"99-12","member_number":"A107568","first_name":"AARON","last_name":"WRITTENBERRY","classification":"U","division":"LIMITED","hit_factor":3.9474},{"match_name":"LdF 4th Saturday Match","match_date":"2016-01-23","stage_classifiercode":"99-12","member_number":"A86631","first_name":"MARK","last_name":"CRAFTS","classification":"C","division":"LIMITED","hit_factor":3.9454},{"match_name":"RBGC 2018-7-28","match_date":"2018-07-28","stage_classifiercode":"99-12","member_number":"TY77118","first_name":"JODY","last_name":"ANN","classification":"U","division":"LIMITED","hit_factor":3.9445},{"match_name":"LdF USPSA Match July 14 2018","match_date":"2018-07-14","stage_classifiercode":"99-12","member_number":"A106518","first_name":"GEORGE","last_name":"MEDLIN","classification":"U","division":"LIMITED","hit_factor":3.9443},{"match_name":"RBGC 2018-7-28","match_date":"2018-07-28","stage_classifiercode":"99-12","member_number":"A71211","first_name":"DEAN","last_name":"COLE","classification":"C","division":"LIMITED","hit_factor":3.9423},{"match_name":"Hosemasters  3rd Sunday Feburary 2017","match_date":"2017-02-12","stage_classifiercode":"99-12","member_number":"A96325","first_name":"STEVE","last_name":"COWELL","classification":"U","division":"LIMITED","hit_factor":3.9387},{"match_name":"North Mountain July ","match_date":"2016-07-17","stage_classifiercode":"99-12","member_number":"A95921","first_name":"DAVID","last_name":"SIMANSKI","classification":"U","division":"LIMITED","hit_factor":3.9331},{"match_name":"GAS October 6th Match","match_date":"2018-10-06","stage_classifiercode":"99-12","member_number":"Y97628","first_name":"TAYLOR","last_name":"JONES","classification":"U","division":"LIMITED","hit_factor":3.9291},{"match_name":"Shongum April 2017 USPSA Match","match_date":"2017-04-01","stage_classifiercode":"99-12","member_number":"A-98580","first_name":"JASON","last_name":"SENDELSKY","classification":"U","division":"LIMITED","hit_factor":3.929},{"match_name":"BGS NORTH  Week 9","match_date":"2016-03-13","stage_classifiercode":"99-12","member_number":"\"\"","first_name":"ISAAC","last_name":"BARDEN","classification":"U","division":"LIMITED","hit_factor":3.9286},{"match_name":"Paul Bunyan April 7th-8th All Classifier Match NW01","match_date":"2018-04-07","stage_classifiercode":"99-12","member_number":"A110310","first_name":"JONATHAN","last_name":"NELSON","classification":"U","division":"LIMITED","hit_factor":3.9269},{"match_name":"SCCPSA USPSA Mar 17","match_date":"2018-03-17","stage_classifiercode":"99-12","member_number":"A106520","first_name":"BEN","last_name":"PLAPPERT","classification":"U","division":"LIMITED","hit_factor":3.9263},{"match_name":"OK15 USPSA AT USSA","match_date":"2016-07-10","stage_classifiercode":"99-12","member_number":"A-92164","first_name":"STEVE","last_name":"NOBLE","classification":"C","division":"LIMITED","hit_factor":3.9261},{"match_name":"H&H June Match","match_date":"2016-06-26","stage_classifiercode":"99-12","member_number":"A91228","first_name":"DANIEL","last_name":"KEEF","classification":"C","division":"LIMITED","hit_factor":3.9216},{"match_name":"Springfield Tactical Shooters 06-07-2018","match_date":"2018-06-07","stage_classifiercode":"99-12","member_number":"A106901","first_name":"WILLIAM","last_name":"AMES","classification":"C","division":"LIMITED","hit_factor":3.9196},{"match_name":"Shongum Pistol November 2015","match_date":"2015-11-07","stage_classifiercode":"99-12","member_number":"A86916","first_name":"JUDE","last_name":"CATRAL","classification":"C","division":"LIMITED","hit_factor":3.9185},{"match_name":"LCSA USPSA ALL CLASSIFIER ","match_date":"2018-06-30","stage_classifiercode":"99-12","member_number":"A102675","first_name":"JAY","last_name":"SLATER","classification":"U","division":"LIMITED","hit_factor":3.9162},{"match_name":"SCCPSA USPSA Mar 17","match_date":"2018-03-17","stage_classifiercode":"99-12","member_number":"A37231","first_name":"RON","last_name":"JONES","classification":"C","division":"LIMITED","hit_factor":3.9149},{"match_name":"MSA USPSA Special Classifier 12-4-16","match_date":"2016-12-04","stage_classifiercode":"99-12","member_number":"2439","first_name":"JOSEPH","last_name":"BELTRAN","classification":"U","division":"LIMITED","hit_factor":3.9127},{"match_name":"MCPSL Pistol 4-8-17","match_date":"2017-04-08","stage_classifiercode":"99-12","member_number":"A99986","first_name":"JORDAN","last_name":"GERBER","classification":"U","division":"LIMITED","hit_factor":3.9088},{"match_name":"SSS USPSA February 2020","match_date":"2020-02-16","stage_classifiercode":"99-12","member_number":"A124048","first_name":"CHRIS","last_name":"BROWN","classification":"U (Unclassified)","division":"LIMITED","hit_factor":3.9052},{"match_name":"SLEL October 2017 Match","match_date":"2017-10-19","stage_classifiercode":"99-12","member_number":"A66526","first_name":"KEVIN","last_name":"ANDERSON","classification":"C","division":"LIMITED","hit_factor":3.9024},{"match_name":"RBGC 2018-7-28","match_date":"2018-07-28","stage_classifiercode":"99-12","member_number":"\"\"","first_name":"TODD","last_name":"W","classification":"U","division":"LIMITED","hit_factor":3.9016},{"match_name":"EASTER EGG HUNT AREA 59  ALL CLASSFIER MATCH","match_date":"2017-04-15","stage_classifiercode":"99-12","member_number":"A98298","first_name":"MICHAEL","last_name":"BENITEZ","classification":"U","division":"LIMITED","hit_factor":3.9007},{"match_name":"MPSA 2021-08-21","match_date":"2021-08-21","stage_classifiercode":"99-12","member_number":"FY39690","first_name":"MCCONNELL","last_name":"HART","classification":"B","division":"LIMITED","hit_factor":3.8972},{"match_name":"OFGC USPSA Match Feb 19th 2017","match_date":"2017-02-19","stage_classifiercode":"99-12","member_number":"89956","first_name":"JEFF","last_name":"GLANTON","classification":"D","division":"LIMITED","hit_factor":3.897},{"match_name":"Payson Practical Pistol Sept 03 2016","match_date":"2016-09-03","stage_classifiercode":"99-12","member_number":"A69191","first_name":"ROBERT","last_name":"MESSENGER","classification":"C","division":"LIMITED","hit_factor":3.8961},{"match_name":"PCGC  June 2017","match_date":"2017-06-25","stage_classifiercode":"99-12","member_number":"\"\"","first_name":"PAUL","last_name":"SITES","classification":"C","division":"LIMITED","hit_factor":3.8941},{"match_name":"EL06 USPSA June 27 2021","match_date":"2021-06-27","stage_classifiercode":"99-12","member_number":"A120020","first_name":"ERIC","last_name":"CRAGLE","classification":"U","division":"LIMITED","hit_factor":3.8914},{"match_name":"Richmond Hot Shots February 7-2016 USPSA Match","match_date":"2016-02-07","stage_classifiercode":"99-12","member_number":"TY32822","first_name":"JERRY","last_name":"YAO","classification":"U","division":"LIMITED","hit_factor":3.8911},{"match_name":"MCPSL Pistol 4-9-16","match_date":"2016-04-09","stage_classifiercode":"99-12","member_number":"A91549","first_name":"CHARLES","last_name":"KUNKEL","classification":"B","division":"LIMITED","hit_factor":3.8872},{"match_name":"FBURG April 2017 Level I USPSA ","match_date":"2017-04-01","stage_classifiercode":"99-12","member_number":"\"\"","first_name":"CHRIS","last_name":"ODELLL","classification":"U","division":"LIMITED","hit_factor":3.8862},{"match_name":"H&H June Match","match_date":"2016-06-26","stage_classifiercode":"99-12","member_number":"A83912","first_name":"MONTY","last_name":"MONTGOMERY","classification":"C","division":"LIMITED","hit_factor":3.8846},{"match_name":"Laser Ninja Dragon League USPSA August 2017","match_date":"2017-08-06","stage_classifiercode":"99-12","member_number":"Ty76427","first_name":"BILL","last_name":"COLLINS","classification":"D","division":"LIMITED","hit_factor":3.8827},{"match_name":"Shongum April 2017 USPSA Match","match_date":"2017-04-01","stage_classifiercode":"99-12","member_number":"TY77141","first_name":"KEN (LOUIE)","last_name":"PRIMERO","classification":"A","division":"LIMITED","hit_factor":3.8822},{"match_name":"TPS USPSA - September 2016 - Talon Range","match_date":"2016-09-03","stage_classifiercode":"99-12","member_number":"A86550","first_name":"KATRINA","last_name":"REED","classification":"D","division":"LIMITED","hit_factor":3.8804},{"match_name":"Brothers N Arms August 2018 USPSA Match","match_date":"2018-08-18","stage_classifiercode":"99-12","member_number":"A113339","first_name":"MICHAEL","last_name":"STOUT","classification":"U","division":"LIMITED","hit_factor":3.8774},{"match_name":"17s PSC - Feb 2017 - USPSA match","match_date":"2017-02-04","stage_classifiercode":"99-12","member_number":"\"\"","first_name":"DANIEL","last_name":"DELO","classification":"U","division":"LIMITED","hit_factor":3.8748},{"match_name":"PCGC  June 2017","match_date":"2017-06-25","stage_classifiercode":"99-12","member_number":"A75127","first_name":"TED","last_name":"PORTERFIELD","classification":"C","division":"LIMITED","hit_factor":3.8688},{"match_name":"Green Valley USPSA May Classifier","match_date":"2018-05-09","stage_classifiercode":"99-12","member_number":"\"\"","first_name":"BEN","last_name":"MARQUIS","classification":"U","division":"LIMITED","hit_factor":3.8596},{"match_name":"BRC_20170611","match_date":"2017-06-11","stage_classifiercode":"99-12","member_number":"ty67471","first_name":"DAN","last_name":"REMPE","classification":"U","division":"LIMITED","hit_factor":3.8582},{"match_name":"LPRGC-Lower Providence USPSA May-2 2017","match_date":"2017-05-13","stage_classifiercode":"99-12","member_number":"\"\"","first_name":"RONALD","last_name":"JONES","classification":"B","division":"LIMITED","hit_factor":3.8549},{"match_name":"Green Valley February 2017","match_date":"2017-02-25","stage_classifiercode":"99-12","member_number":"A92132","first_name":"JIM","last_name":"WHITE","classification":"D","division":"LIMITED","hit_factor":3.8545},{"match_name":"Southern Arizona Practical Shooters 05_5_18","match_date":"2018-05-05","stage_classifiercode":"99-12","member_number":"ty42149","first_name":"GARY","last_name":"FERNS","classification":"B","division":"LIMITED","hit_factor":3.8523},{"match_name":"BRC_20170611","match_date":"2017-06-11","stage_classifiercode":"99-12","member_number":"TY82090","first_name":"MATT","last_name":"GROSJEAN","classification":"C","division":"LIMITED","hit_factor":3.8513},{"match_name":"CGC 2017_05_13","match_date":"2017-05-13","stage_classifiercode":"99-12","member_number":"\"\"","first_name":"PETER","last_name":"TURCOTTE","classification":"U","division":"LIMITED","hit_factor":3.8494},{"match_name":"BHPSC Monthly Match - Feb 2020","match_date":"2020-02-29","stage_classifiercode":"99-12","member_number":"A98798","first_name":"JOHNNY","last_name":"BREWINGTON","classification":"C","division":"LIMITED","hit_factor":3.8462},{"match_name":"Griffin USPSA Match Aug 2017","match_date":"2017-08-19","stage_classifiercode":"99-12","member_number":"A-104160","first_name":"CARSON","last_name":"BROWNING","classification":"U","division":"LIMITED","hit_factor":3.8462},{"match_name":"Chillicothe May-2017 USPSA Match","match_date":"2017-05-28","stage_classifiercode":"99-12","member_number":"TY9065","first_name":"MIKE","last_name":"MOREHEAD","classification":"U","division":"LIMITED","hit_factor":3.8462},{"match_name":"Gunsmoke Action Shooters USPSA April 18","match_date":"2018-04-07","stage_classifiercode":"99-12","member_number":"A107542","first_name":"RICHARD","last_name":"COX","classification":"D","division":"LIMITED","hit_factor":3.84},{"match_name":"RBGC 2018-7-28","match_date":"2018-07-28","stage_classifiercode":"99-12","member_number":"\"\"","first_name":"STEVE","last_name":"JARRELL","classification":"U","division":"LIMITED","hit_factor":3.8348},{"match_name":"BHPSC Monthly Match - Feb 2020","match_date":"2020-02-29","stage_classifiercode":"99-12","member_number":"A112561","first_name":"KIRK","last_name":"REMY","classification":"D","division":"LIMITED","hit_factor":3.8298},{"match_name":"OFGC USPSA Match Feb 19th 2017","match_date":"2017-02-19","stage_classifiercode":"99-12","member_number":"A76879","first_name":"BRIAN","last_name":"OWENS","classification":"C","division":"LIMITED","hit_factor":3.8274},{"match_name":"Holmen USPSA Mar 26 2017","match_date":"2017-03-26","stage_classifiercode":"99-12","member_number":"A98419","first_name":"PATRICK","last_name":"CORR","classification":"U","division":"LIMITED","hit_factor":3.8244},{"match_name":"SPSA USPSA March 4th Sat match","match_date":"2017-03-25","stage_classifiercode":"99-12","member_number":"TY6146","first_name":"DICK","last_name":"COLE","classification":"C","division":"LIMITED","hit_factor":3.8212},{"match_name":"COPS Feb 2017 USPSA Match","match_date":"2017-02-05","stage_classifiercode":"99-12","member_number":"A92448","first_name":"MATTHEW","last_name":"GIFFORD","classification":"U","division":"LIMITED","hit_factor":3.8184},{"match_name":"SPSA USPSA March 4th Sat match","match_date":"2017-03-25","stage_classifiercode":"99-12","member_number":"TY87087","first_name":"KENNETH","last_name":"GUPTON","classification":"D","division":"LIMITED","hit_factor":3.8168},{"match_name":"SFPS 05-21-17 Superclassifier Gun1","match_date":"2017-05-21","stage_classifiercode":"99-12","member_number":"A86629","first_name":"KIRK","last_name":"PEARSON","classification":"C","division":"LIMITED","hit_factor":3.8153},{"match_name":"EIPS  1/19/2017","match_date":"2017-01-19","stage_classifiercode":"99-12","member_number":"\"\"","first_name":"ANDY","last_name":"KIESEY","classification":"\"\"","division":"LIMITED","hit_factor":3.8123},{"match_name":"OK15 USPSA AT USSA","match_date":"2016-07-10","stage_classifiercode":"99-12","member_number":"A-92125","first_name":"MELISSA","last_name":"NOBLE","classification":"D","division":"LIMITED","hit_factor":3.8052},{"match_name":"YMM IPSC02 2016_09_11","match_date":"2016-09-11","stage_classifiercode":"99-12","member_number":"\"\"","first_name":"JOSHUA","last_name":"PHILLIPS","classification":"D","division":"LIMITED","hit_factor":3.8028},{"match_name":"Hosemasters  3rd Sunday Feburary 2017","match_date":"2017-02-12","stage_classifiercode":"99-12","member_number":"A91049","first_name":"KIMBERLY","last_name":"KRAFFT","classification":"C","division":"LIMITED","hit_factor":3.8023},{"match_name":"Green Valley February 2017","match_date":"2017-02-25","stage_classifiercode":"99-12","member_number":"PEN","first_name":"KYLE","last_name":"DWORSKI","classification":"U","division":"LIMITED","hit_factor":3.8001},{"match_name":"OFGC USPSA Match 10-21-18","match_date":"2018-10-21","stage_classifiercode":"99-12","member_number":"TY51402","first_name":"DOC (WAYNE)","last_name":"WELSHER","classification":"B","division":"LIMITED","hit_factor":3.7983},{"match_name":"Griffin USPSA Match Aug 2017","match_date":"2017-08-19","stage_classifiercode":"99-12","member_number":"A82788","first_name":"ROB","last_name":"STROTHER","classification":"C","division":"LIMITED","hit_factor":3.7965},{"match_name":"BRSP Tuesday Night USPSA Match - Nov 14","match_date":"2017-11-15","stage_classifiercode":"99-12","member_number":"FY75508","first_name":"TRACY","last_name":"HARTLESS","classification":"\"\"","division":"LIMITED","hit_factor":3.7946},{"match_name":"MCPSL Pistol 4-9-16","match_date":"2016-04-09","stage_classifiercode":"99-12","member_number":"PEN","first_name":"CODY","last_name":"OWSLEY","classification":"U","division":"LIMITED","hit_factor":3.7903},{"match_name":"Gunsmoke Action Shooters USPSA April 18","match_date":"2018-04-07","stage_classifiercode":"99-12","member_number":"A107557","first_name":"GRANT","last_name":"LAIRD","classification":"U","division":"LIMITED","hit_factor":3.7885},{"match_name":"BHPSC Monthly Match - Feb 2020","match_date":"2020-02-29","stage_classifiercode":"99-12","member_number":"A122315","first_name":"MARK","last_name":"CULL","classification":"C","division":"LIMITED","hit_factor":3.7864},{"match_name":"Richmond Hot Shots February 7-2016 USPSA Match","match_date":"2016-02-07","stage_classifiercode":"99-12","member_number":"TY82728","first_name":"KIRILL","last_name":"FILIMONOV","classification":"B","division":"LIMITED","hit_factor":3.7823},{"match_name":"SCAPSA MN05 Summer League 1","match_date":"2017-06-05","stage_classifiercode":"99-12","member_number":"A38502","first_name":"KEITH","last_name":"ULFERS","classification":"M","division":"LIMITED","hit_factor":3.7783},{"match_name":"OFGC USPSA Match 10-21-18","match_date":"2018-10-21","stage_classifiercode":"99-12","member_number":"PENDING","first_name":"STUART","last_name":"HUTCHINS","classification":"U","division":"LIMITED","hit_factor":3.7767},{"match_name":"Chillicothe May-2017 USPSA Match","match_date":"2017-05-28","stage_classifiercode":"99-12","member_number":"A94427","first_name":"CHRIS","last_name":"SMITH","classification":"D","division":"LIMITED","hit_factor":3.7766},{"match_name":"Minnetonka Game And Fish May 23","match_date":"2018-05-23","stage_classifiercode":"99-12","member_number":"A108483","first_name":"RODD","last_name":"PIERSON","classification":"U","division":"LIMITED","hit_factor":3.7705},{"match_name":"Armory Indoor League","match_date":"2016-08-12","stage_classifiercode":"99-12","member_number":"A94967","first_name":"JARED","last_name":"STEPP","classification":"C","division":"LIMITED","hit_factor":3.77},{"match_name":"Hosemasters  3rd Sunday Feburary 2017","match_date":"2017-02-12","stage_classifiercode":"99-12","member_number":"A100585","first_name":"CARL","last_name":"KING","classification":"C","division":"LIMITED","hit_factor":3.7677},{"match_name":"Springfield Tactical Shooters 06-07-2018","match_date":"2018-06-07","stage_classifiercode":"99-12","member_number":"A99127","first_name":"STEVE","last_name":"FRAZIER","classification":"B","division":"LIMITED","hit_factor":3.7569},{"match_name":"USPSA","match_date":"2016-06-04","stage_classifiercode":"99-12","member_number":"\"\"","first_name":"ADAM","last_name":"JONES","classification":"A","division":"LIMITED","hit_factor":3.7526},{"match_name":"SSS USPSA February 2020","match_date":"2020-02-16","stage_classifiercode":"99-12","member_number":"FY-85092","first_name":"MICHAEL","last_name":"WOODLAND","classification":"B (B Class)","division":"LIMITED","hit_factor":3.7519},{"match_name":"ECPS USPSA 17 Feb 18","match_date":"2018-02-16","stage_classifiercode":"99-12","member_number":"\"\"","first_name":"DANIEL","last_name":"ANDREWS","classification":"U","division":"LIMITED","hit_factor":3.7509},{"match_name":"Sept 3rd Uspsa   Pickaway","match_date":"2016-09-03","stage_classifiercode":"99-12","member_number":"A88135","first_name":"MARK","last_name":"COLASANTE","classification":"C","division":"LIMITED","hit_factor":3.7477},{"match_name":"COPS Feb 2017 USPSA Match","match_date":"2017-02-05","stage_classifiercode":"99-12","member_number":"\"\"","first_name":"SAM","last_name":"BURTON","classification":"U","division":"LIMITED","hit_factor":3.7433},{"match_name":"LPRGC-Lower Providence USPSA May-2 2017","match_date":"2017-05-13","stage_classifiercode":"99-12","member_number":"L3957","first_name":"MARK","last_name":"EVANS","classification":"C","division":"LIMITED","hit_factor":3.7428},{"match_name":"SSFGA & Master Blasters USPSA Classifier","match_date":"2018-11-17","stage_classifiercode":"99-12","member_number":"A111430","first_name":"SEAN","last_name":"MCCLURE","classification":"C","division":"LIMITED","hit_factor":3.7393},{"match_name":"LdF 4th Saturday Match","match_date":"2016-01-23","stage_classifiercode":"99-12","member_number":"TY81857","first_name":"MATT","last_name":"MADDEN","classification":"C","division":"LIMITED","hit_factor":3.7333},{"match_name":"USPSA MO21 Special Classifier 2Alpha SBRC February 27 2021","match_date":"2021-02-27","stage_classifiercode":"99-12","member_number":"A10768","first_name":"JOHN","last_name":"ESLICK","classification":"C","division":"LIMITED","hit_factor":3.7325},{"match_name":"TAC2 USPSA August 2017","match_date":"2017-08-05","stage_classifiercode":"99-12","member_number":"\"\"","first_name":"DENNIS","last_name":"MCMAHAN","classification":"U","division":"LIMITED","hit_factor":3.7267},{"match_name":"DWB - Deadwood Boys USPSA 18 February 2018","match_date":"2018-02-18","stage_classifiercode":"99-12","member_number":"TY96556","first_name":"KEITH","last_name":"JUNG","classification":"C","division":"LIMITED","hit_factor":3.7229},{"match_name":"Richmond Hot Shots February 7-2016 USPSA Match","match_date":"2016-02-07","stage_classifiercode":"99-12","member_number":"FY61207","first_name":"DAVID","last_name":"MISISCO","classification":"C","division":"LIMITED","hit_factor":3.7214},{"match_name":"Castlewood WPA13 Halloween Oct 22 2016","match_date":"2016-10-22","stage_classifiercode":"99-12","member_number":"A95936","first_name":"DAN","last_name":"HUBERT","classification":"C","division":"LIMITED","hit_factor":3.7194},{"match_name":"Ducky Shoot August","match_date":"2018-08-18","stage_classifiercode":"99-12","member_number":"A-111594","first_name":"ANDREW","last_name":"CALVIN","classification":"U","division":"LIMITED","hit_factor":3.719},{"match_name":"SSP Super Classifier 1-30-16","match_date":"2016-01-30","stage_classifiercode":"99-12","member_number":"PEN","first_name":"PAUL","last_name":"TAYLOR2","classification":"Unclassified","division":"LIMITED","hit_factor":3.7162},{"match_name":"BSTRC Dec 20 2017","match_date":"2017-12-20","stage_classifiercode":"99-12","member_number":"A100055","first_name":"HOWARD","last_name":"DE JONG","classification":"D","division":"LIMITED","hit_factor":3.7123},{"match_name":"BRC_20170611","match_date":"2017-06-11","stage_classifiercode":"99-12","member_number":"A103407","first_name":"TIM","last_name":"MONTGOMERY","classification":"U","division":"LIMITED","hit_factor":3.7113},{"match_name":"ECPS USPSA 17 Feb 18","match_date":"2018-02-16","stage_classifiercode":"99-12","member_number":"A108012","first_name":"JASON","last_name":"WOODRUFF","classification":"U","division":"LIMITED","hit_factor":3.7037},{"match_name":"ECPS February 28th USPSA Pistol Match","match_date":"2016-02-28","stage_classifiercode":"99-12","member_number":"Ty83654","first_name":"JASON","last_name":"ROBERTS","classification":"A","division":"LIMITED","hit_factor":3.6977},{"match_name":"EWPSA 2016-04","match_date":"2016-04-17","stage_classifiercode":"99-12","member_number":"A92241","first_name":"JAVIER","last_name":"ROQUE","classification":"U","division":"LIMITED","hit_factor":3.6948},{"match_name":"OFGC USPSA Match 10-21-18","match_date":"2018-10-21","stage_classifiercode":"99-12","member_number":"A77529","first_name":"JOSH","last_name":"PINCHES","classification":"B","division":"LIMITED","hit_factor":3.6943},{"match_name":"Payson Practical Pistol Sept 03 2016","match_date":"2016-09-03","stage_classifiercode":"99-12","member_number":"A92310","first_name":"STACY","last_name":"MISINO","classification":"C","division":"LIMITED","hit_factor":3.6918},{"match_name":"USPSA MO21 Special Classifier 2Alpha SBRC February 27 2021","match_date":"2021-02-27","stage_classifiercode":"99-12","member_number":"A92715","first_name":"J.R.","last_name":"WEBB","classification":"C","division":"LIMITED","hit_factor":3.6915},{"match_name":"SFPC March USPSA Match 2017","match_date":"2017-03-05","stage_classifiercode":"99-12","member_number":"TY68109","first_name":"BEN","last_name":"MIZRAHI","classification":"A","division":"LIMITED","hit_factor":3.6885},{"match_name":"MPSA 2021-08-21","match_date":"2021-08-21","stage_classifiercode":"99-12","member_number":"Fy72883","first_name":"CHRIS","last_name":"ZAMBESI","classification":"C","division":"LIMITED","hit_factor":3.6881},{"match_name":"Medford USPSA April 2018 Match","match_date":"2018-04-15","stage_classifiercode":"99-12","member_number":"TY100069","first_name":"DON","last_name":"LEDBETTER","classification":"U","division":"LIMITED","hit_factor":3.6874},{"match_name":"SPSA USPSA March 4th Sat match","match_date":"2017-03-25","stage_classifiercode":"99-12","member_number":"TY81420","first_name":"TIM","last_name":"AGNER","classification":"C","division":"LIMITED","hit_factor":3.6758},{"match_name":"CVSC 06-25-2017","match_date":"2017-06-25","stage_classifiercode":"99-12","member_number":"TY96859","first_name":"PHYLLIS","last_name":"UPTON","classification":"D","division":"LIMITED","hit_factor":3.675},{"match_name":"Griffin USPSA Match Aug 2017","match_date":"2017-08-19","stage_classifiercode":"99-12","member_number":"A76107","first_name":"GARY","last_name":"GOLDEN","classification":"B","division":"LIMITED","hit_factor":3.6739},{"match_name":"H&H June Match","match_date":"2016-06-26","stage_classifiercode":"99-12","member_number":"A89882","first_name":"TRAVIS","last_name":"LOWRY","classification":"C","division":"LIMITED","hit_factor":3.6713},{"match_name":"Richmond Hot Shots February 7-2016 USPSA Match","match_date":"2016-02-07","stage_classifiercode":"99-12","member_number":"A91389","first_name":"RUSS","last_name":"BRIDGES","classification":"U","division":"LIMITED","hit_factor":3.6706},{"match_name":"LdF 4th Saturday Match","match_date":"2016-01-23","stage_classifiercode":"99-12","member_number":"TY1524","first_name":"BILL","last_name":"KUEHL","classification":"A","division":"LIMITED","hit_factor":3.669},{"match_name":"Springfield Tactical Shooters 09/03/2020","match_date":"2020-09-03","stage_classifiercode":"99-12","member_number":"A106901","first_name":"WILLIAM","last_name":"AMES","classification":"C","division":"LIMITED","hit_factor":3.6657},{"match_name":"COPS Feb 2017 USPSA Match","match_date":"2017-02-05","stage_classifiercode":"99-12","member_number":"\"\"","first_name":"RANDY","last_name":"TIRSELL","classification":"U","division":"LIMITED","hit_factor":3.6598},{"match_name":"Pelham USPSA 2016-09-18","match_date":"2016-09-18","stage_classifiercode":"99-12","member_number":"A68158","first_name":"DENNIS","last_name":"MARAGIOGLIO","classification":"C","division":"LIMITED","hit_factor":3.6585},{"match_name":"Springfield Tactical Shooters 06-07-2018","match_date":"2018-06-07","stage_classifiercode":"99-12","member_number":"\"\"","first_name":"JAMIE","last_name":"BLAKLEY","classification":"\"\"","division":"LIMITED","hit_factor":3.6585},{"match_name":"RBGC 2018-7-28","match_date":"2018-07-28","stage_classifiercode":"99-12","member_number":"\"\"","first_name":"EVAN","last_name":"HAMMAC","classification":"U","division":"LIMITED","hit_factor":3.6507},{"match_name":"WTPS USPSA April Classifier Match 4-8-17","match_date":"2017-04-08","stage_classifiercode":"99-12","member_number":"A15867","first_name":"ALAN W.","last_name":"LAZA","classification":"M","division":"LIMITED","hit_factor":3.6486},{"match_name":"SCAPSA MN05 Summer League 1","match_date":"2017-06-05","stage_classifiercode":"99-12","member_number":"\"\"","first_name":"SHAWN","last_name":"WIDMEIER","classification":"U","division":"LIMITED","hit_factor":3.6472},{"match_name":"Laser Ninja Dragon League USPSA August 2017","match_date":"2017-08-06","stage_classifiercode":"99-12","member_number":"\"\"","first_name":"BRET","last_name":"BAKER","classification":"U","division":"LIMITED","hit_factor":3.6437},{"match_name":"Springfield Tactical Shooters 06-07-2018","match_date":"2018-06-07","stage_classifiercode":"99-12","member_number":"\"\"","first_name":"NATHAN","last_name":"GRIFFEL","classification":"\"\"","division":"LIMITED","hit_factor":3.6364},{"match_name":"Pinetucky USPSA 11-19-16","match_date":"2016-11-19","stage_classifiercode":"99-12","member_number":"Ty63210","first_name":"LARRY","last_name":"LYNN","classification":"D","division":"LIMITED","hit_factor":3.6339},{"match_name":"Brothers N Arms February 2018 USPSA Match","match_date":"2018-02-17","stage_classifiercode":"99-12","member_number":"FY97066","first_name":"CHRIS","last_name":"DAVIS","classification":"C","division":"LIMITED","hit_factor":3.6322},{"match_name":"RBGC 2018-7-28","match_date":"2018-07-28","stage_classifiercode":"99-12","member_number":"A99465","first_name":"JOHN","last_name":"IRIZARRY","classification":"D","division":"LIMITED","hit_factor":3.6318},{"match_name":"BSTRC Dec 20 2017","match_date":"2017-12-20","stage_classifiercode":"99-12","member_number":"A93500","first_name":"WILLFORD","last_name":"STEWART","classification":"C","division":"LIMITED","hit_factor":3.6284},{"match_name":"Collin County USPSA Nov. 27 2016","match_date":"2016-11-25","stage_classifiercode":"99-12","member_number":"TY66303","first_name":"BRIAN","last_name":"HURST","classification":"C","division":"LIMITED","hit_factor":3.6254},{"match_name":"Chillicothe May-2017 USPSA Match","match_date":"2017-05-28","stage_classifiercode":"99-12","member_number":"FY46917","first_name":"TRENT","last_name":"SIMPSON","classification":"C","division":"LIMITED","hit_factor":3.6251},{"match_name":"MVPSA USPSA August 7th Classifier Match","match_date":"2021-08-07","stage_classifiercode":"99-12","member_number":"FY115428","first_name":"JOSEPH","last_name":"ANGELO","classification":"D","division":"LIMITED","hit_factor":3.6214},{"match_name":"ECPS USPSA 17 Feb 18","match_date":"2018-02-16","stage_classifiercode":"99-12","member_number":"A80020","first_name":"STAN","last_name":"GROSSMAN","classification":"D","division":"LIMITED","hit_factor":3.6192},{"match_name":"Pinetucky USPSA 11-19-16","match_date":"2016-11-19","stage_classifiercode":"99-12","member_number":"FY82224","first_name":"WILL","last_name":"PORTER","classification":"C","division":"LIMITED","hit_factor":3.6184},{"match_name":"Gunsmoke Action Shooters USPSA April 18","match_date":"2018-04-07","stage_classifiercode":"99-12","member_number":"A107539","first_name":"DILLON","last_name":"MCNEILL","classification":"C","division":"LIMITED","hit_factor":3.6145},{"match_name":"BSTRC Dec 20 2017","match_date":"2017-12-20","stage_classifiercode":"99-12","member_number":"A96994","first_name":"NORMAN","last_name":"SPAHR","classification":"C","division":"LIMITED","hit_factor":3.609},{"match_name":"SSFGA & Master Blasters USPSA Classifier","match_date":"2018-11-17","stage_classifiercode":"99-12","member_number":"A108317","first_name":"SCOTT","last_name":"LIMONE","classification":"C","division":"LIMITED","hit_factor":3.6088},{"match_name":"SFPC September USPSA Special Classifier match","match_date":"2016-09-04","stage_classifiercode":"99-12","member_number":"A88817","first_name":"JB","last_name":"CREECH","classification":"C","division":"LIMITED","hit_factor":3.6061},{"match_name":"SLEL October 2017 Match","match_date":"2017-10-19","stage_classifiercode":"99-12","member_number":"A98796","first_name":"GREG","last_name":"RUBY","classification":"U","division":"LIMITED","hit_factor":3.6049},{"match_name":"AAPS AAFG Special Classifier Match - March 31 2018","match_date":"2018-03-31","stage_classifiercode":"99-12","member_number":"A44043","first_name":"PETER","last_name":"BAGNELL","classification":"B","division":"LIMITED","hit_factor":3.6036},{"match_name":"MSA USPSA Special Classifier 12-4-16","match_date":"2016-12-04","stage_classifiercode":"99-12","member_number":"\"\"","first_name":"DEREK","last_name":"NEW","classification":"U","division":"LIMITED","hit_factor":3.6023},{"match_name":"EWPSA 2016-04","match_date":"2016-04-17","stage_classifiercode":"99-12","member_number":"A95130","first_name":"NICK","last_name":"GOIT","classification":"U","division":"LIMITED","hit_factor":3.6009},{"match_name":"RBGC 2018-7-28","match_date":"2018-07-28","stage_classifiercode":"99-12","member_number":"TY31015","first_name":"BORIS","last_name":"ZARETSKY","classification":"B","division":"LIMITED","hit_factor":3.5997},{"match_name":"EASTER EGG HUNT AREA 59  ALL CLASSFIER MATCH","match_date":"2017-04-15","stage_classifiercode":"99-12","member_number":"TY102734","first_name":"CHARLES","last_name":"JACKSON","classification":"U","division":"LIMITED","hit_factor":3.5986},{"match_name":"RD Shooters May 6th USPSA  match","match_date":"2017-05-06","stage_classifiercode":"99-12","member_number":"A42354","first_name":"BILLY","last_name":"SMITH","classification":"A","division":"LIMITED","hit_factor":3.5952},{"match_name":"COPS Feb 2017 USPSA Match","match_date":"2017-02-05","stage_classifiercode":"99-12","member_number":"\"\"","first_name":"TONY","last_name":"ALLEN","classification":"U","division":"LIMITED","hit_factor":3.5939},{"match_name":"LCSA USPSA ALL CLASSIFIER ","match_date":"2018-06-30","stage_classifiercode":"99-12","member_number":"TY91802","first_name":"STEVEN","last_name":"WESCOTT","classification":"B","division":"LIMITED","hit_factor":3.5909},{"match_name":"SCAPSA MN05 Summer League 1","match_date":"2017-06-05","stage_classifiercode":"99-12","member_number":"ty36688","first_name":"RICHARD","last_name":"NEWBERRY","classification":"C","division":"LIMITED","hit_factor":3.5892},{"match_name":"CVSC 06-25-2017","match_date":"2017-06-25","stage_classifiercode":"99-12","member_number":"A100105","first_name":"WADE L","last_name":"KAMMER","classification":"D","division":"LIMITED","hit_factor":3.5868},{"match_name":"USC August 2016","match_date":"2016-08-13","stage_classifiercode":"99-12","member_number":"\"\"","first_name":"JERRY","last_name":"GREENE","classification":"U","division":"LIMITED","hit_factor":3.5853},{"match_name":"COPS Feb 2017 USPSA Match","match_date":"2017-02-05","stage_classifiercode":"99-12","member_number":"A75292","first_name":"PATRICIA","last_name":"GRANE-JOHNSON","classification":"C","division":"LIMITED","hit_factor":3.5853},{"match_name":"Emmett September Match","match_date":"2016-09-24","stage_classifiercode":"99-12","member_number":"\"\"","first_name":"DICK","last_name":"LEE","classification":"U","division":"LIMITED","hit_factor":3.5837},{"match_name":"Ducky Shoot August","match_date":"2018-08-18","stage_classifiercode":"99-12","member_number":"A-7552","first_name":"BOB","last_name":"GERAK","classification":"B","division":"LIMITED","hit_factor":3.5831},{"match_name":"SPSA USPSA March 4th Sat match","match_date":"2017-03-25","stage_classifiercode":"99-12","member_number":"A71466","first_name":"JEFF","last_name":"DAMPAC","classification":"C","division":"LIMITED","hit_factor":3.581},{"match_name":"TAC2 USPSA August 2017","match_date":"2017-08-05","stage_classifiercode":"99-12","member_number":"\"\"","first_name":"RON","last_name":"MCINTOSH","classification":"U","division":"LIMITED","hit_factor":3.5788},{"match_name":"TAC2 USPSA August 2017","match_date":"2017-08-05","stage_classifiercode":"99-12","member_number":"\"\"","first_name":"SAM 2G","last_name":"MORELOCK","classification":"U","division":"LIMITED","hit_factor":3.5765},{"match_name":"TPS USPSA - September 2016 - Talon Range","match_date":"2016-09-03","stage_classifiercode":"99-12","member_number":"L4028","first_name":"TIFFANY","last_name":"MOYAL","classification":"C","division":"LIMITED","hit_factor":3.5748},{"match_name":"SSS USPSA February 2020","match_date":"2020-02-16","stage_classifiercode":"99-12","member_number":"A92860","first_name":"CHRIS","last_name":"GAVILAN","classification":"D (D Class)","division":"LIMITED","hit_factor":3.5739},{"match_name":"ORSA USPSA October 2016","match_date":"2016-10-15","stage_classifiercode":"99-12","member_number":"A94247","first_name":"JACK","last_name":"SUGGS","classification":"U","division":"LIMITED","hit_factor":3.569},{"match_name":"LCSA USPSA ALL CLASSIFIER ","match_date":"2018-06-30","stage_classifiercode":"99-12","member_number":"A111550","first_name":"COLE","last_name":"HALEY","classification":"U","division":"LIMITED","hit_factor":3.569},{"match_name":"WNPL USPSA - Labour Day Weekend - Sept 2017","match_date":"2017-09-02","stage_classifiercode":"99-12","member_number":"PENDING","first_name":"MIKE","last_name":"PARMAN","classification":"U","division":"LIMITED","hit_factor":3.5682},{"match_name":"ENPS May 2018 USPSA Match","match_date":"2018-05-06","stage_classifiercode":"99-12","member_number":"A94949","first_name":"RAY","last_name":"LAYNE","classification":"U","division":"LIMITED","hit_factor":3.5669},{"match_name":"EASTER EGG HUNT AREA 59  ALL CLASSFIER MATCH","match_date":"2017-04-15","stage_classifiercode":"99-12","member_number":"A96920","first_name":"SYDNEY","last_name":"JIM","classification":"U","division":"LIMITED","hit_factor":3.5664},{"match_name":"BSTRC Dec 20 2017","match_date":"2017-12-20","stage_classifiercode":"99-12","member_number":"A99331","first_name":"COURTNEY","last_name":"HOUGH","classification":"C","division":"LIMITED","hit_factor":3.5661},{"match_name":"Emmett September Match","match_date":"2016-09-24","stage_classifiercode":"99-12","member_number":"ty91986","first_name":"TRAVIS","last_name":"DEMARAY","classification":"U","division":"LIMITED","hit_factor":3.5578},{"match_name":"Danville Rifle and Pistol Club USPSA IL17 April 21 2018","match_date":"2018-04-21","stage_classifiercode":"99-12","member_number":"A100973","first_name":"RONALD","last_name":"DRAPER","classification":"C","division":"LIMITED","hit_factor":3.557},{"match_name":"Griffin USPSA Match Aug 2017","match_date":"2017-08-19","stage_classifiercode":"99-12","member_number":"PEN","first_name":"TODD","last_name":"WONG","classification":"U","division":"LIMITED","hit_factor":3.5563},{"match_name":"Nampa USPSA February 1st","match_date":"2020-02-01","stage_classifiercode":"99-12","member_number":"A123959","first_name":"JAKE","last_name":"WESTENSKOW","classification":"D","division":"LIMITED","hit_factor":3.5513},{"match_name":"XMG USPSA   Saturday September  4th 2021","match_date":"2021-09-04","stage_classifiercode":"99-12","member_number":"A49813","first_name":"STEPHEN","last_name":"BARRIER","classification":"B","division":"LIMITED","hit_factor":3.5451},{"match_name":"RBGC 2018-7-28","match_date":"2018-07-28","stage_classifiercode":"99-12","member_number":"\"\"","first_name":"ERICA","last_name":"D'AMICO","classification":"U","division":"LIMITED","hit_factor":3.5436},{"match_name":"Atlanta Practical Shooters March 2016 USPSA - Classifier Match","match_date":"2016-03-06","stage_classifiercode":"99-12","member_number":"A95248","first_name":"SEAN","last_name":"FISHER","classification":"U","division":"LIMITED","hit_factor":3.5436},{"match_name":"EASTER EGG HUNT AREA 59  ALL CLASSFIER MATCH","match_date":"2017-04-15","stage_classifiercode":"99-12","member_number":"TY89028","first_name":"HUNG","last_name":"TA","classification":"U","division":"LIMITED","hit_factor":3.543},{"match_name":"Atlanta Practical Shooters March 2016 USPSA - Classifier Match","match_date":"2016-03-06","stage_classifiercode":"99-12","member_number":"\"\"","first_name":"JOHN","last_name":"TILLOTSON","classification":"U","division":"LIMITED","hit_factor":3.5412},{"match_name":"TPS USPSA PISTOL - May 2016 - Talon Range","match_date":"2016-05-07","stage_classifiercode":"99-12","member_number":"a77660","first_name":"RONALD","last_name":"JORDAN","classification":"C","division":"LIMITED","hit_factor":3.5398},{"match_name":"COPS Feb 2017 USPSA Match","match_date":"2017-02-05","stage_classifiercode":"99-12","member_number":"TY78608","first_name":"JONATHAN","last_name":"LUNA","classification":"U","division":"LIMITED","hit_factor":3.5398},{"match_name":"Belton Gun Club USPSA January MATCH 1-30-21","match_date":"2021-01-30","stage_classifiercode":"99-12","member_number":"A-78970","first_name":"GERALD","last_name":"DUNN","classification":"C","division":"LIMITED","hit_factor":3.5336},{"match_name":"ENPS May 2018 USPSA Match","match_date":"2018-05-06","stage_classifiercode":"99-12","member_number":"A101413","first_name":"BROOKS","last_name":"RILEY","classification":"C","division":"LIMITED","hit_factor":3.5332},{"match_name":"USC August 2016","match_date":"2016-08-13","stage_classifiercode":"99-12","member_number":"\"\"","first_name":"BEN","last_name":"PRUETT","classification":"U","division":"LIMITED","hit_factor":3.5294},{"match_name":"LCHG May USPSA","match_date":"2017-05-21","stage_classifiercode":"99-12","member_number":"a102386","first_name":"LLOYD","last_name":"HEFFERNAN","classification":"D","division":"LIMITED","hit_factor":3.5278},{"match_name":"LdF 4th Saturday Match","match_date":"2016-01-23","stage_classifiercode":"99-12","member_number":"TY80157","first_name":"DAVE","last_name":"DEZAN","classification":"B","division":"LIMITED","hit_factor":3.5264},{"match_name":"Piscataqua  Master Blasters USPSA Special Classifier","match_date":"2017-12-03","stage_classifiercode":"99-12","member_number":"TY99763","first_name":"ANDREW","last_name":"CHAN","classification":"U","division":"LIMITED","hit_factor":3.5242},{"match_name":"USPSA","match_date":"2016-06-04","stage_classifiercode":"99-12","member_number":"\"\"","first_name":"CHRIS","last_name":"EKBERG","classification":"U","division":"LIMITED","hit_factor":3.5195},{"match_name":"Paul Bunyan April 7th-8th All Classifier Match NW01","match_date":"2018-04-07","stage_classifiercode":"99-12","member_number":"A108992","first_name":"ERIC","last_name":"PRATT","classification":"U","division":"LIMITED","hit_factor":3.5176},{"match_name":"OFGC USPSA Match 10-21-18","match_date":"2018-10-21","stage_classifiercode":"99-12","member_number":"A111591","first_name":"MARVIN","last_name":"STEWART","classification":"U","division":"LIMITED","hit_factor":3.5168},{"match_name":"North Mountain July ","match_date":"2016-07-17","stage_classifiercode":"99-12","member_number":"A96447","first_name":"JOHN","last_name":"GADDY","classification":"U","division":"LIMITED","hit_factor":3.5146},{"match_name":"Hosemasters  3rd Sunday Feburary 2017","match_date":"2017-02-12","stage_classifiercode":"99-12","member_number":"TY15412","first_name":"RON","last_name":"YOUNGER","classification":"A","division":"LIMITED","hit_factor":3.5132},{"match_name":"Springfield Tactical Shooters 09/03/2020","match_date":"2020-09-03","stage_classifiercode":"99-12","member_number":"\"\"","first_name":"RICK","last_name":"WENNEBORG","classification":"\"\"","division":"LIMITED","hit_factor":3.5113},{"match_name":"MCPSL Pistol 4-9-16","match_date":"2016-04-09","stage_classifiercode":"99-12","member_number":"A90285","first_name":"CHRIS","last_name":"HOOVER","classification":"C","division":"LIMITED","hit_factor":3.5106},{"match_name":"FBURG April 2017 Level I USPSA ","match_date":"2017-04-01","stage_classifiercode":"99-12","member_number":"A95985","first_name":"BENJAMIN","last_name":"COBB","classification":"C","division":"LIMITED","hit_factor":3.5088},{"match_name":"Brothers N Arms February 2018 USPSA Match","match_date":"2018-02-17","stage_classifiercode":"99-12","member_number":"PENDING","first_name":"SIMON","last_name":"RYALS","classification":"U","division":"LIMITED","hit_factor":3.504},{"match_name":"Maine Practical Shooters May 2018","match_date":"2018-05-12","stage_classifiercode":"99-12","member_number":"A104803","first_name":"EDWARD","last_name":"HUKKI","classification":"U","division":"LIMITED","hit_factor":3.496},{"match_name":"WTPS USPSA April Classifier Match 4-8-17","match_date":"2017-04-08","stage_classifiercode":"99-12","member_number":"A95294","first_name":"AARON","last_name":"SUTTON","classification":"C","division":"LIMITED","hit_factor":3.4943},{"match_name":"Griffin USPSA Match Aug 2017","match_date":"2017-08-19","stage_classifiercode":"99-12","member_number":"A104394","first_name":"DAVID","last_name":"RAISSI","classification":"U","division":"LIMITED","hit_factor":3.4833},{"match_name":"Maine Practical Shooters May 2018","match_date":"2018-05-12","stage_classifiercode":"99-12","member_number":"A86070","first_name":"BRYAN","last_name":"SPIVEY","classification":"D","division":"LIMITED","hit_factor":3.4783},{"match_name":"WSPS OCTOBER 2017 USPSA MATCH","match_date":"2017-10-21","stage_classifiercode":"99-12","member_number":"L4044","first_name":"ALEX","last_name":"SAWKA","classification":"U","division":"LIMITED","hit_factor":3.4768},{"match_name":"Richmond Hot Shots February 7-2016 USPSA Match","match_date":"2016-02-07","stage_classifiercode":"99-12","member_number":"A46690","first_name":"GILBERT","last_name":"GESMUNDO","classification":"A","division":"LIMITED","hit_factor":3.4739},{"match_name":"Pelham USPSA 2016-09-18","match_date":"2016-09-18","stage_classifiercode":"99-12","member_number":"\"\"","first_name":"BRIAN","last_name":"BARRY","classification":"Unclassified","division":"LIMITED","hit_factor":3.4632},{"match_name":"TPS USPSA PISTOL - May 2016 - Talon Range","match_date":"2016-05-07","stage_classifiercode":"99-12","member_number":"\"\"","first_name":"EVAN","last_name":"WEEKS","classification":"U","division":"LIMITED","hit_factor":3.4619},{"match_name":"North Mountain July ","match_date":"2016-07-17","stage_classifiercode":"99-12","member_number":"FY81377","first_name":"STEVEN","last_name":"TINTER","classification":"C","division":"LIMITED","hit_factor":3.4608},{"match_name":"North Mountain July ","match_date":"2016-07-17","stage_classifiercode":"99-12","member_number":"\"\"","first_name":"TIM","last_name":"RUPLI","classification":"U","division":"LIMITED","hit_factor":3.4591},{"match_name":"Springfield Tactical Shooters 09/03/2020","match_date":"2020-09-03","stage_classifiercode":"99-12","member_number":"A62932","first_name":"RICHARD","last_name":"LANE","classification":"B","division":"LIMITED","hit_factor":3.4565},{"match_name":"OK15 USPSA at USSA","match_date":"2017-12-10","stage_classifiercode":"99-12","member_number":"A105907","first_name":"ANDREW","last_name":"KARKIEWICZ","classification":"U","division":"LIMITED","hit_factor":3.4545},{"match_name":"SCCPSA USPSA Mar 17","match_date":"2018-03-17","stage_classifiercode":"99-12","member_number":"TY46034","first_name":"JAMES","last_name":"BOWMAN","classification":"D","division":"LIMITED","hit_factor":3.4461},{"match_name":"WSPS OCTOBER 2017 USPSA MATCH","match_date":"2017-10-21","stage_classifiercode":"99-12","member_number":"A94001","first_name":"NICK","last_name":"REYNOLDS","classification":"M","division":"LIMITED","hit_factor":3.4392},{"match_name":"Collin County USPSA Nov. 27 2016","match_date":"2016-11-25","stage_classifiercode":"99-12","member_number":"A57591","first_name":"NICK","last_name":"ANSELMO","classification":"B","division":"LIMITED","hit_factor":3.4384},{"match_name":"OK15 USPSA at USSA","match_date":"2017-12-10","stage_classifiercode":"99-12","member_number":"A101885","first_name":"DANI","last_name":"BAGBY","classification":"U","division":"LIMITED","hit_factor":3.4276},{"match_name":"Green Valley February 2017","match_date":"2017-02-25","stage_classifiercode":"99-12","member_number":"PEN","first_name":"JOE","last_name":"COLLINS","classification":"U","division":"LIMITED","hit_factor":3.4268},{"match_name":"Henry Coumty Gun Club USPSA","match_date":"2021-05-15","stage_classifiercode":"99-12","member_number":"A84875","first_name":"GW","last_name":"AUSTIN","classification":"C","division":"LIMITED","hit_factor":3.4252},{"match_name":"ENPS May 2018 USPSA Match","match_date":"2018-05-06","stage_classifiercode":"99-12","member_number":"TY11475","first_name":"DOUGLAS","last_name":"DAVIS","classification":"C","division":"LIMITED","hit_factor":3.4241},{"match_name":"Palmetto Gun Club - February 2018 USPSA","match_date":"2018-02-03","stage_classifiercode":"99-12","member_number":"\"\"","first_name":"NICHOLAS","last_name":"CALLAHAN","classification":"U","division":"LIMITED","hit_factor":3.4202},{"match_name":"ENPS May 2018 USPSA Match","match_date":"2018-05-06","stage_classifiercode":"99-12","member_number":"TY68981","first_name":"JOEL","last_name":"LUDWIG","classification":"B","division":"LIMITED","hit_factor":3.4169},{"match_name":"2020-03 Bone Creek USPSA","match_date":"2020-03-01","stage_classifiercode":"99-12","member_number":"A125696","first_name":"MICHEAL","last_name":"TATE","classification":"U","division":"LIMITED","hit_factor":3.4166},{"match_name":"CASA Classifier match April 2018","match_date":"2018-04-08","stage_classifiercode":"99-12","member_number":"FY76231","first_name":"BYRON","last_name":"LAWRENCE","classification":"\"\"","division":"LIMITED","hit_factor":3.4161},{"match_name":"Richmond Hot Shots USPSA Classifier Match Sat April 8-2017","match_date":"2017-04-08","stage_classifiercode":"99-12","member_number":"WAITINGONNUMBER","first_name":"HOMA","last_name":"SHAFII","classification":"U","division":"LIMITED","hit_factor":3.4133},{"match_name":"USPSA","match_date":"2018-04-28","stage_classifiercode":"99-12","member_number":"A108339","first_name":"BOB","last_name":"LEAVITT","classification":"U","division":"LIMITED","hit_factor":3.413},{"match_name":"MSA USPSA Special Classifier 12-4-16","match_date":"2016-12-04","stage_classifiercode":"99-12","member_number":"\"\"","first_name":"JEREMY","last_name":"LUSTER","classification":"U","division":"LIMITED","hit_factor":3.4091},{"match_name":"Payson Practical Pistol Sept 03 2016","match_date":"2016-09-03","stage_classifiercode":"99-12","member_number":"A46063","first_name":"TOMMY","last_name":"LAFRANCE","classification":"B","division":"LIMITED","hit_factor":3.4072},{"match_name":"LdF USPSA Match July 14 2018","match_date":"2018-07-14","stage_classifiercode":"99-12","member_number":"A109567","first_name":"PAUL","last_name":"BRETTON","classification":"U","division":"LIMITED","hit_factor":3.4068},{"match_name":"Griffin USPSA Match Aug 2017","match_date":"2017-08-19","stage_classifiercode":"99-12","member_number":"A-102778","first_name":"JASON","last_name":"DEAN","classification":"U","division":"LIMITED","hit_factor":3.4026},{"match_name":"WSPS OCTOBER 2017 USPSA MATCH","match_date":"2017-10-21","stage_classifiercode":"99-12","member_number":"\"\"","first_name":"PATRICK","last_name":"GABRIELE","classification":"X","division":"LIMITED","hit_factor":3.4018},{"match_name":"Fairfax PS USPSA  2018 September","match_date":"2018-09-18","stage_classifiercode":"99-12","member_number":"TY932155","first_name":"JOHN","last_name":"KARANIKAS","classification":"U","division":"LIMITED","hit_factor":3.4008},{"match_name":"RBGC 2018-7-28","match_date":"2018-07-28","stage_classifiercode":"99-12","member_number":"\"\"","first_name":"NICK","last_name":"D'AMICO","classification":"U","division":"LIMITED","hit_factor":3.3965},{"match_name":"Hosemasters  3rd Sunday Feburary 2017","match_date":"2017-02-12","stage_classifiercode":"99-12","member_number":"A76720","first_name":"TIM","last_name":"MUSA","classification":"A","division":"LIMITED","hit_factor":3.3956},{"match_name":"LdF USPSA Match July 14 2018","match_date":"2018-07-14","stage_classifiercode":"99-12","member_number":"A110449","first_name":"STEVE","last_name":"MOSS","classification":"U","division":"LIMITED","hit_factor":3.3932},{"match_name":"RD Shooters May 6th USPSA  match","match_date":"2017-05-06","stage_classifiercode":"99-12","member_number":"\"\"","first_name":"LARRY","last_name":"GRIMES","classification":"X","division":"LIMITED","hit_factor":3.3898},{"match_name":"MCPSL Pistol 4-9-16","match_date":"2016-04-09","stage_classifiercode":"99-12","member_number":"PEN","first_name":"CRAIG","last_name":"OWSLEY","classification":"U","division":"LIMITED","hit_factor":3.3873},{"match_name":"USPSA","match_date":"2016-06-04","stage_classifiercode":"99-12","member_number":"\"\"","first_name":"DAVID","last_name":"MANESS","classification":"U","division":"LIMITED","hit_factor":3.3848},{"match_name":"NVSA USPSA 1711","match_date":"2017-11-05","stage_classifiercode":"99-12","member_number":"\"\"","first_name":"SHANNON","last_name":"CUNHA","classification":"U","division":"LIMITED","hit_factor":3.3829},{"match_name":"Brothers N Arms August 2018 USPSA Match","match_date":"2018-08-18","stage_classifiercode":"99-12","member_number":"A110702","first_name":"CHARLES","last_name":"OSBON","classification":"U","division":"LIMITED","hit_factor":3.3768},{"match_name":"Collin County USPSA Nov. 27 2016","match_date":"2016-11-25","stage_classifiercode":"99-12","member_number":"A91580","first_name":"JAY","last_name":"SMITH","classification":"B","division":"LIMITED","hit_factor":3.375},{"match_name":"Griffin USPSA Match Aug 2017","match_date":"2017-08-19","stage_classifiercode":"99-12","member_number":"\"\"","first_name":"TOM","last_name":"MINKO","classification":"U","division":"LIMITED","hit_factor":3.3732},{"match_name":"Medford USPSA April 2018 Match","match_date":"2018-04-15","stage_classifiercode":"99-12","member_number":"a29540","first_name":"STEVE","last_name":"HALL","classification":"M","division":"LIMITED","hit_factor":3.372},{"match_name":"Belton Gun Club USPSA January MATCH 1-30-21","match_date":"2021-01-30","stage_classifiercode":"99-12","member_number":"ty82683","first_name":"BRIAN","last_name":"WOLFF","classification":"A","division":"LIMITED","hit_factor":3.3708},{"match_name":"17s PSC - Feb 2017 - USPSA match","match_date":"2017-02-04","stage_classifiercode":"99-12","member_number":"\"\"","first_name":"SETH","last_name":"CSAR","classification":"U","division":"LIMITED","hit_factor":3.3647},{"match_name":"APSA February 2017 USPSA Match","match_date":"2017-02-11","stage_classifiercode":"99-12","member_number":"A77506","first_name":"LARRY","last_name":"OHL","classification":"C","division":"LIMITED","hit_factor":3.3647},{"match_name":"Springfield Tactical Shooters 06-07-2018","match_date":"2018-06-07","stage_classifiercode":"99-12","member_number":"\"\"","first_name":"DON","last_name":"DENNING","classification":"\"\"","division":"LIMITED","hit_factor":3.3639},{"match_name":"Gunsmoke Action Shooters USPSA April 18","match_date":"2018-04-07","stage_classifiercode":"99-12","member_number":"A106872","first_name":"CHAD","last_name":"HULSIZER","classification":"U","division":"LIMITED","hit_factor":3.3628},{"match_name":"SFPC September USPSA Special Classifier match","match_date":"2016-09-04","stage_classifiercode":"99-12","member_number":"A76862","first_name":"MARK","last_name":"SHANNON","classification":"C","division":"LIMITED","hit_factor":3.3623},{"match_name":"Green Valley February 2017","match_date":"2017-02-25","stage_classifiercode":"99-12","member_number":"PEN","first_name":"BRIAN","last_name":"FICK","classification":"U","division":"LIMITED","hit_factor":3.3562},{"match_name":"PCGC  June 2017","match_date":"2017-06-25","stage_classifiercode":"99-12","member_number":"TY90829","first_name":"ROBERT","last_name":"AZAR","classification":"D","division":"LIMITED","hit_factor":3.352},{"match_name":"GAS October 6th Match","match_date":"2018-10-06","stage_classifiercode":"99-12","member_number":"TY101587","first_name":"SKEET","last_name":"\"ARCHER \"\"ROOSTER\"\"\"","classification":"B","division":"LIMITED","hit_factor":3.3514},{"match_name":"BRC_20170611","match_date":"2017-06-11","stage_classifiercode":"99-12","member_number":"\"\"","first_name":"JAMES","last_name":"BUTLER","classification":"U","division":"LIMITED","hit_factor":3.3512},{"match_name":"DRRC Dec2016","match_date":"2016-12-03","stage_classifiercode":"99-12","member_number":"A98622","first_name":"DOUGLAS","last_name":"HOBLITT","classification":"U","division":"LIMITED","hit_factor":3.3484},{"match_name":"Minnetonka Game And Fish May 23","match_date":"2018-05-23","stage_classifiercode":"99-12","member_number":"ty95998","first_name":"GREGG","last_name":"STEFFEN","classification":"C","division":"LIMITED","hit_factor":3.3473},{"match_name":"LdF USPSA Match July 14 2018","match_date":"2018-07-14","stage_classifiercode":"99-12","member_number":"\"\"","first_name":"JOHN","last_name":"MULDOON","classification":"U","division":"LIMITED","hit_factor":3.3473},{"match_name":"USC August 2016","match_date":"2016-08-13","stage_classifiercode":"99-12","member_number":"\"\"","first_name":"GREG","last_name":"GILLILAND","classification":"A","division":"LIMITED","hit_factor":3.3422},{"match_name":"Atlanta Practical Shooters March 2016 USPSA - Classifier Match","match_date":"2016-03-06","stage_classifiercode":"99-12","member_number":"A94807","first_name":"JAMES","last_name":"GARNER","classification":"U","division":"LIMITED","hit_factor":3.3401},{"match_name":"Rio Grande Practical Shooters - December 2016","match_date":"2016-12-03","stage_classifiercode":"99-12","member_number":"PEN","first_name":"ANDRES","last_name":"PADILLA","classification":"U","division":"LIMITED","hit_factor":3.3382},{"match_name":"17s PSC - Feb 2017 - USPSA match","match_date":"2017-02-04","stage_classifiercode":"99-12","member_number":"A95602","first_name":"WES","last_name":"MAHR","classification":"U","division":"LIMITED","hit_factor":3.336},{"match_name":"Paul Bunyan April 7th-8th All Classifier Match NW01","match_date":"2018-04-07","stage_classifiercode":"99-12","member_number":"TY108653","first_name":"LUKE","last_name":"SCHWEBKE","classification":"U","division":"LIMITED","hit_factor":3.3356},{"match_name":"Gunsmoke Action Shooters USPSA April 18","match_date":"2018-04-07","stage_classifiercode":"99-12","member_number":"\"\"","first_name":"LANDON","last_name":"WELBORN","classification":"U","division":"LIMITED","hit_factor":3.3306},{"match_name":"Springfield Tactical Shooters 09/03/2020","match_date":"2020-09-03","stage_classifiercode":"99-12","member_number":"TY106677","first_name":"CURT","last_name":"CHRISTENSEN","classification":"C","division":"LIMITED","hit_factor":3.3292},{"match_name":"Atlanta Practical Shooters March 2016 USPSA - Classifier Match","match_date":"2016-03-06","stage_classifiercode":"99-12","member_number":"\"\"","first_name":"SETH","last_name":"HORNE","classification":"U","division":"LIMITED","hit_factor":3.3267},{"match_name":"RBGC 2018-7-28","match_date":"2018-07-28","stage_classifiercode":"99-12","member_number":"\"\"","first_name":"BRIAN","last_name":"HASSEL","classification":"U","division":"LIMITED","hit_factor":3.3264},{"match_name":"BSTRC Dec 20 2017","match_date":"2017-12-20","stage_classifiercode":"99-12","member_number":"\"\"","first_name":"ROBERT","last_name":"EINSPAHR","classification":"U","division":"LIMITED","hit_factor":3.3233},{"match_name":"Hosemasters  3rd Sunday Feburary 2017","match_date":"2017-02-12","stage_classifiercode":"99-12","member_number":"A47027","first_name":"JACK","last_name":"JOHNSTON","classification":"C","division":"LIMITED","hit_factor":3.322},{"match_name":"SPSA USPSA March 4th Sat match","match_date":"2017-03-25","stage_classifiercode":"99-12","member_number":"TY83747","first_name":"TODD","last_name":"HOFFNER","classification":"C","division":"LIMITED","hit_factor":3.3219},{"match_name":"H&H June Match","match_date":"2016-06-26","stage_classifiercode":"99-12","member_number":"A93404","first_name":"DAKOTA","last_name":"POLK","classification":"C","division":"LIMITED","hit_factor":3.3201},{"match_name":"CASA Classifier match April 2018","match_date":"2018-04-08","stage_classifiercode":"99-12","member_number":"TY96041","first_name":"ERNIE","last_name":"DECKER","classification":"C","division":"LIMITED","hit_factor":3.3149},{"match_name":"Maine Practical Shooters May 2018","match_date":"2018-05-12","stage_classifiercode":"99-12","member_number":"\"\"","first_name":"KEVIN","last_name":"SHANLEY","classification":"U","division":"LIMITED","hit_factor":3.3149},{"match_name":"XMG USPSA   Saturday September  4th 2021","match_date":"2021-09-04","stage_classifiercode":"99-12","member_number":"FY105648","first_name":"STEVE","last_name":"ZHANG","classification":"C","division":"LIMITED","hit_factor":3.3113},{"match_name":"Pelham USPSA 2016-09-18","match_date":"2016-09-18","stage_classifiercode":"99-12","member_number":"A97225","first_name":"JUSTIN","last_name":"DOVE","classification":"D","division":"LIMITED","hit_factor":3.3103},{"match_name":"YMM IPSC02 2016_09_11","match_date":"2016-09-11","stage_classifiercode":"99-12","member_number":"\"\"","first_name":"JOSEPH","last_name":"BARRIOS","classification":"C","division":"LIMITED","hit_factor":3.31},{"match_name":"GMPS 5/7/17","match_date":"2017-05-06","stage_classifiercode":"99-12","member_number":"TY66052","first_name":"ADAM","last_name":"NILSON","classification":"A","division":"LIMITED","hit_factor":3.3086},{"match_name":"Chillicothe May-2017 USPSA Match","match_date":"2017-05-28","stage_classifiercode":"99-12","member_number":"\"\"","first_name":"ALLEN","last_name":"SIMMONS","classification":"\"\"","division":"LIMITED","hit_factor":3.301},{"match_name":"ECPS USPSA 17 Feb 18","match_date":"2018-02-16","stage_classifiercode":"99-12","member_number":"\"\"","first_name":"CHAZ","last_name":"MEYER","classification":"U","division":"LIMITED","hit_factor":3.2999},{"match_name":"Pinetucky USPSA 11-19-16","match_date":"2016-11-19","stage_classifiercode":"99-12","member_number":"ty60619","first_name":"JESUS","last_name":"HERNANDEZ","classification":"C","division":"LIMITED","hit_factor":3.2967},{"match_name":"LdF 4th Saturday Match","match_date":"2016-01-23","stage_classifiercode":"99-12","member_number":"A84256","first_name":"TASSY","last_name":"HENNESSY","classification":"D","division":"LIMITED","hit_factor":3.2958},{"match_name":"Paul Bunyan April 7th-8th All Classifier Match NW01","match_date":"2018-04-07","stage_classifiercode":"99-12","member_number":"A88243","first_name":"KRIS","last_name":"MCGAUGHEY","classification":"U","division":"LIMITED","hit_factor":3.2934},{"match_name":"Griffin USPSA Match Aug 2017","match_date":"2017-08-19","stage_classifiercode":"99-12","member_number":"TY78673","first_name":"BRIAN","last_name":"RIVERS","classification":"B","division":"LIMITED","hit_factor":3.2902},{"match_name":"Southern Arizona Practical Shooters 05_5_18","match_date":"2018-05-05","stage_classifiercode":"99-12","member_number":"A105584","first_name":"RON","last_name":"SMITH","classification":"C","division":"LIMITED","hit_factor":3.2787},{"match_name":"Medford USPSA April 2018 Match","match_date":"2018-04-15","stage_classifiercode":"99-12","member_number":"FY97054","first_name":"BRYON","last_name":"CATALANO","classification":"D","division":"LIMITED","hit_factor":3.2787},{"match_name":"PIPS 06-14-2017","match_date":"2017-06-14","stage_classifiercode":"99-12","member_number":"PEN","first_name":"BRAD","last_name":"JACKSON","classification":"U","division":"LIMITED","hit_factor":3.2772},{"match_name":"CVSC 06-25-2017","match_date":"2017-06-25","stage_classifiercode":"99-12","member_number":"A88980","first_name":"GARY","last_name":"LAMB","classification":"D","division":"LIMITED","hit_factor":3.2759},{"match_name":"ECPS February 28th USPSA Pistol Match","match_date":"2016-02-28","stage_classifiercode":"99-12","member_number":"A88693","first_name":"CRAIG","last_name":"POTEAT","classification":"C","division":"LIMITED","hit_factor":3.2715},{"match_name":"AAPS AAFG Special Classifier Match - March 31 2018","match_date":"2018-03-31","stage_classifiercode":"99-12","member_number":"A103634","first_name":"RICHARD","last_name":"SIMMONS","classification":"C","division":"LIMITED","hit_factor":3.2701},{"match_name":"OK15 USPSA AT USSA","match_date":"2016-07-10","stage_classifiercode":"99-12","member_number":"\"\"","first_name":"RICK","last_name":"DEVORE","classification":"\"\"","division":"LIMITED","hit_factor":3.2684},{"match_name":"COPS Feb 2017 USPSA Match","match_date":"2017-02-05","stage_classifiercode":"99-12","member_number":"A75450","first_name":"WILLIAM","last_name":"BLUNT","classification":"C","division":"LIMITED","hit_factor":3.2674},{"match_name":"MCPSL Pistol 4-9-16","match_date":"2016-04-09","stage_classifiercode":"99-12","member_number":"PEN","first_name":"MAX","last_name":"FRANK","classification":"U","division":"LIMITED","hit_factor":3.2631},{"match_name":"South Texas Tactical USPSA","match_date":"2017-07-08","stage_classifiercode":"99-12","member_number":"\"\"","first_name":"BILL","last_name":"RUSHFELDT","classification":"\"\"","division":"LIMITED","hit_factor":3.2628},{"match_name":"FBPPC DECEMBER 2016 SPECIAL CLASSIFIER MATCH","match_date":"2016-12-10","stage_classifiercode":"99-12","member_number":"A93228","first_name":"ROBERT","last_name":"WATSON","classification":"C","division":"LIMITED","hit_factor":3.2625},{"match_name":"Belton Gun Club USPSA January MATCH 1-30-21","match_date":"2021-01-30","stage_classifiercode":"99-12","member_number":"A115797","first_name":"MIKE","last_name":"MCCAULEY","classification":"X","division":"LIMITED","hit_factor":3.2577},{"match_name":"Emmett September Match","match_date":"2016-09-24","stage_classifiercode":"99-12","member_number":"l3771","first_name":"CHUCK","last_name":"GALLOWAY","classification":"C","division":"LIMITED","hit_factor":3.2568},{"match_name":"Castlewood WPA13 Halloween Oct 22 2016","match_date":"2016-10-22","stage_classifiercode":"99-12","member_number":"A96913","first_name":"CHARLES","last_name":"RODGERS","classification":"U","division":"LIMITED","hit_factor":3.255},{"match_name":"MSA USPSA Special Classifier 12-4-16","match_date":"2016-12-04","stage_classifiercode":"99-12","member_number":"A-99597","first_name":"AUSTIN","last_name":"POE","classification":"U","division":"LIMITED","hit_factor":3.2544},{"match_name":"Maine Practical Shooters May 2018","match_date":"2018-05-12","stage_classifiercode":"99-12","member_number":"A109937","first_name":"ADAM","last_name":"GARLAND","classification":"X","division":"LIMITED","hit_factor":3.2531},{"match_name":"BSTRC Dec 20 2017","match_date":"2017-12-20","stage_classifiercode":"99-12","member_number":"107188","first_name":"JEFFREY","last_name":"SIMPSON","classification":"U","division":"LIMITED","hit_factor":3.2531},{"match_name":"NISA April Classifer Match 2016","match_date":"2016-04-24","stage_classifiercode":"99-12","member_number":"A75035","first_name":"DANILO","last_name":"DEANO","classification":"U","division":"LIMITED","hit_factor":3.252},{"match_name":"MCPSL Pistol 4-9-16","match_date":"2016-04-09","stage_classifiercode":"99-12","member_number":"A41374","first_name":"KEITH","last_name":"COBB JR","classification":"X","division":"LIMITED","hit_factor":3.2513},{"match_name":"TAC2 USPSA August 2017","match_date":"2017-08-05","stage_classifiercode":"99-12","member_number":"\"\"","first_name":"ANDREW","last_name":"STANFIELD","classification":"U","division":"LIMITED","hit_factor":3.2508},{"match_name":"WNPL USPSA - Labour Day Weekend - Sept 2017","match_date":"2017-09-02","stage_classifiercode":"99-12","member_number":"PENDING","first_name":"JASON","last_name":"JONES","classification":"U","division":"LIMITED","hit_factor":3.2485},{"match_name":"Pinetucky USPSA 11-19-16","match_date":"2016-11-19","stage_classifiercode":"99-12","member_number":"A90616","first_name":"ERIK","last_name":"JENSEN III","classification":"C","division":"LIMITED","hit_factor":3.2396},{"match_name":"SFPC March USPSA Match 2017","match_date":"2017-03-05","stage_classifiercode":"99-12","member_number":"A97921","first_name":"BOB","last_name":"YOUNGS","classification":"U","division":"LIMITED","hit_factor":3.2377},{"match_name":"Sept 3rd Uspsa   Pickaway","match_date":"2016-09-03","stage_classifiercode":"99-12","member_number":"A91776","first_name":"RANDY","last_name":"TAYLOR","classification":"U","division":"LIMITED","hit_factor":3.2329},{"match_name":"MSSA Uspsa Match","match_date":"2017-04-08","stage_classifiercode":"99-12","member_number":"A91827","first_name":"PRESTON","last_name":"KING","classification":"B","division":"LIMITED","hit_factor":3.2297},{"match_name":"Pinetucky USPSA 11-19-16","match_date":"2016-11-19","stage_classifiercode":"99-12","member_number":"\"\"","first_name":"JONNEY","last_name":"GRUNNET","classification":"U","division":"LIMITED","hit_factor":3.2233},{"match_name":"TAC2 USPSA August 2017","match_date":"2017-08-05","stage_classifiercode":"99-12","member_number":"\"\"","first_name":"BRIAN","last_name":"SIMS","classification":"U","division":"LIMITED","hit_factor":3.2193},{"match_name":"Emmett September Match","match_date":"2016-09-24","stage_classifiercode":"99-12","member_number":"A88427","first_name":"CASEY","last_name":"RYAN","classification":"C","division":"LIMITED","hit_factor":3.2168},{"match_name":"PCGC  June 2017","match_date":"2017-06-25","stage_classifiercode":"99-12","member_number":"\"\"","first_name":"SAM","last_name":"STEARNS","classification":"U","division":"LIMITED","hit_factor":3.2149},{"match_name":"Pelham USPSA 2016-09-18","match_date":"2016-09-18","stage_classifiercode":"99-12","member_number":"L3434","first_name":"JEFF","last_name":"ROSENBERGER","classification":"C","division":"LIMITED","hit_factor":3.2146},{"match_name":"Shasta Shooters August 2016","match_date":"2016-08-13","stage_classifiercode":"99-12","member_number":"PEN","first_name":"JUSTIN","last_name":"NUNES","classification":"\"\"","division":"LIMITED","hit_factor":3.2107},{"match_name":"ECPS February 28th USPSA Pistol Match","match_date":"2016-02-28","stage_classifiercode":"99-12","member_number":"Ty83717","first_name":"SCOTT","last_name":"BASS","classification":"B","division":"LIMITED","hit_factor":3.2103},{"match_name":"PCGC  June 2017","match_date":"2017-06-25","stage_classifiercode":"99-12","member_number":"TY83049","first_name":"STEVEN","last_name":"CODY","classification":"C","division":"LIMITED","hit_factor":3.2086},{"match_name":"Richmond Hot Shots USPSA Classifier Match Sat April 8-2017","match_date":"2017-04-08","stage_classifiercode":"99-12","member_number":"A100378","first_name":"DAVID","last_name":"REYNOLDS","classification":"U","division":"LIMITED","hit_factor":3.2072},{"match_name":"MSSA Uspsa Match","match_date":"2017-04-08","stage_classifiercode":"99-12","member_number":"\"\"","first_name":"JOHN","last_name":"HOLT","classification":"\"\"","division":"LIMITED","hit_factor":3.2058},{"match_name":"Hosemasters  3rd Sunday Feburary 2017","match_date":"2017-02-12","stage_classifiercode":"99-12","member_number":"\"\"","first_name":"GARY","last_name":"MOWERY","classification":"U","division":"LIMITED","hit_factor":3.2051},{"match_name":"Shongum April 2017 USPSA Match","match_date":"2017-04-01","stage_classifiercode":"99-12","member_number":"A52296","first_name":"BRUCE","last_name":"BRINK","classification":"D","division":"LIMITED","hit_factor":3.2024},{"match_name":"Rendezvous 8-24-16","match_date":"2016-08-25","stage_classifiercode":"99-12","member_number":"\"\"","first_name":"ROBERT","last_name":"G","classification":"U","division":"LIMITED","hit_factor":3.2014},{"match_name":"FBURG April 2017 Level I USPSA ","match_date":"2017-04-01","stage_classifiercode":"99-12","member_number":"\"\"","first_name":"RALPH","last_name":"ROGERS","classification":"X","division":"LIMITED","hit_factor":3.1989},{"match_name":"NISA April Classifer Match 2016","match_date":"2016-04-24","stage_classifiercode":"99-12","member_number":"A95902","first_name":"KYLE","last_name":"LAKE","classification":"U","division":"LIMITED","hit_factor":3.1979},{"match_name":"Brothers N Arms February 2018 USPSA Match","match_date":"2018-02-17","stage_classifiercode":"99-12","member_number":"PENDING","first_name":"CHRISTOPHER","last_name":"NIPPER","classification":"U","division":"LIMITED","hit_factor":3.1949},{"match_name":"Maine Practical Shooters May 2018","match_date":"2018-05-12","stage_classifiercode":"99-12","member_number":"A111256","first_name":"TED","last_name":"SNIDER","classification":"\"\"","division":"LIMITED","hit_factor":3.1938},{"match_name":"Chillicothe May-2017 USPSA Match","match_date":"2017-05-28","stage_classifiercode":"99-12","member_number":"A75770","first_name":"WILL","last_name":"FUNG","classification":"C","division":"LIMITED","hit_factor":3.1933},{"match_name":"RD Shooters May 6th USPSA  match","match_date":"2017-05-06","stage_classifiercode":"99-12","member_number":"TY93346","first_name":"GREG","last_name":"FANCHER2","classification":"U","division":"LIMITED","hit_factor":3.1922},{"match_name":"GMPS 5/7/17","match_date":"2017-05-06","stage_classifiercode":"99-12","member_number":"L531","first_name":"JOHN","last_name":"BOWLES","classification":"B","division":"LIMITED","hit_factor":3.1887},{"match_name":"FBURG April 2017 Level I USPSA ","match_date":"2017-04-01","stage_classifiercode":"99-12","member_number":"\"\"","first_name":"KENNY","last_name":"TELLERZ","classification":"X","division":"LIMITED","hit_factor":3.1873},{"match_name":"FBPPC DECEMBER 2016 SPECIAL CLASSIFIER MATCH","match_date":"2016-12-10","stage_classifiercode":"99-12","member_number":"A91713","first_name":"SHAWN","last_name":"SMITH","classification":"C","division":"LIMITED","hit_factor":3.186},{"match_name":"TAC2 USPSA August 2017","match_date":"2017-08-05","stage_classifiercode":"99-12","member_number":"\"\"","first_name":"ROSS","last_name":"WALKER","classification":"U","division":"LIMITED","hit_factor":3.1816},{"match_name":"MSSA Uspsa Match","match_date":"2017-04-08","stage_classifiercode":"99-12","member_number":"A101291","first_name":"TIM","last_name":"CAYET 2ND","classification":"\"\"","division":"LIMITED","hit_factor":3.1746},{"match_name":"SFPC September USPSA Special Classifier match","match_date":"2016-09-04","stage_classifiercode":"99-12","member_number":"TY73854","first_name":"BARRY","last_name":"BERGER","classification":"D","division":"LIMITED","hit_factor":3.1746},{"match_name":"Rendezvous 8-24-16","match_date":"2016-08-25","stage_classifiercode":"99-12","member_number":"\"\"","first_name":"ANDY","last_name":"H","classification":"U","division":"LIMITED","hit_factor":3.1677},{"match_name":"SCAPSA MN05 Summer League 1","match_date":"2017-06-05","stage_classifiercode":"99-12","member_number":"\"\"","first_name":"KEN","last_name":"MOSHER","classification":"U","division":"LIMITED","hit_factor":3.1655},{"match_name":"Griffin USPSA Match Aug 2017","match_date":"2017-08-19","stage_classifiercode":"99-12","member_number":"a90100","first_name":"KAYLA","last_name":"BODRON","classification":"C","division":"LIMITED","hit_factor":3.1633},{"match_name":"NISA April Classifer Match 2016","match_date":"2016-04-24","stage_classifiercode":"99-12","member_number":"A52927","first_name":"DANIEL","last_name":"GUCCIARDI","classification":"U","division":"LIMITED","hit_factor":3.16},{"match_name":"MCPSL Pistol 4-9-16","match_date":"2016-04-09","stage_classifiercode":"99-12","member_number":"Pen","first_name":"RON","last_name":"PATERSON","classification":"U","division":"LIMITED","hit_factor":3.1579},{"match_name":"Laser Ninja Dragon League USPSA August 2017","match_date":"2017-08-06","stage_classifiercode":"99-12","member_number":"A91713","first_name":"SHAWN","last_name":"SMITH","classification":"C","division":"LIMITED","hit_factor":3.1566},{"match_name":"ECPS USPSA 17 Feb 18","match_date":"2018-02-16","stage_classifiercode":"99-12","member_number":"A62497","first_name":"MELINDA","last_name":"HANSEN","classification":"D","division":"LIMITED","hit_factor":3.1564},{"match_name":"PIPS 06-14-2017","match_date":"2017-06-14","stage_classifiercode":"99-12","member_number":"A29923","first_name":"JON","last_name":"HUSPEK","classification":"M","division":"LIMITED","hit_factor":3.1532},{"match_name":"WTPS USPSA April Classifier Match 4-8-17","match_date":"2017-04-08","stage_classifiercode":"99-12","member_number":"A86469","first_name":"CORY","last_name":"WHITTAKER","classification":"U","division":"LIMITED","hit_factor":3.1526},{"match_name":"Brothers N Arms February 2018 USPSA Match","match_date":"2018-02-17","stage_classifiercode":"99-12","member_number":"PENDING","first_name":"AUSTIN","last_name":"KING","classification":"U","division":"LIMITED","hit_factor":3.1516},{"match_name":"Emmett September Match","match_date":"2016-09-24","stage_classifiercode":"99-12","member_number":"a97567","first_name":"JARED","last_name":"FORNACHON","classification":"C","division":"LIMITED","hit_factor":3.1489},{"match_name":"17s PSC - Feb 2017 - USPSA match","match_date":"2017-02-04","stage_classifiercode":"99-12","member_number":"\"\"","first_name":"WESLEY","last_name":"SOROKEN","classification":"U","division":"LIMITED","hit_factor":3.1434},{"match_name":"Griffin USPSA Match Aug 2017","match_date":"2017-08-19","stage_classifiercode":"99-12","member_number":"PEN","first_name":"NICK","last_name":"BEUTELL","classification":"U","division":"LIMITED","hit_factor":3.1399},{"match_name":"FBPPC DECEMBER 2016 SPECIAL CLASSIFIER MATCH","match_date":"2016-12-10","stage_classifiercode":"99-12","member_number":"TY76477","first_name":"JOSE","last_name":"ALEMAN","classification":"B","division":"LIMITED","hit_factor":3.139},{"match_name":"LdF USPSA Match July 14 2018","match_date":"2018-07-14","stage_classifiercode":"99-12","member_number":"A84256","first_name":"TASSY","last_name":"HENNESSY","classification":"C","division":"LIMITED","hit_factor":3.1376},{"match_name":"USPSA","match_date":"2018-04-28","stage_classifiercode":"99-12","member_number":"A73277","first_name":"JASON","last_name":"DEXTER","classification":"\"\"","division":"LIMITED","hit_factor":3.1373},{"match_name":"Rockcastle USPSA Nov 28 2015","match_date":"2015-11-28","stage_classifiercode":"99-12","member_number":"\"\"","first_name":"DEREK","last_name":"LANHAM","classification":"U","division":"LIMITED","hit_factor":3.1368},{"match_name":"LCSA USPSA ALL CLASSIFIER ","match_date":"2018-06-30","stage_classifiercode":"99-12","member_number":"A112488","first_name":"MIKE","last_name":"DUPILKA","classification":"U","division":"LIMITED","hit_factor":3.1327},{"match_name":"LdF 4th Saturday Match","match_date":"2016-01-23","stage_classifiercode":"99-12","member_number":"A86645","first_name":"KELLY","last_name":"ZAMORA","classification":"D","division":"LIMITED","hit_factor":3.1291},{"match_name":"Emmett September Match","match_date":"2016-09-24","stage_classifiercode":"99-12","member_number":"a84481","first_name":"DEREK","last_name":"POLLARD","classification":"A","division":"LIMITED","hit_factor":3.1289},{"match_name":"Payson Practical Pistol Sept 03 2016","match_date":"2016-09-03","stage_classifiercode":"99-12","member_number":"A84474","first_name":"BOB","last_name":"WHEELER","classification":"U","division":"LIMITED","hit_factor":3.1274},{"match_name":"SSP Super Classifier 1-30-16","match_date":"2016-01-30","stage_classifiercode":"99-12","member_number":"\"\"","first_name":"MICHAEL","last_name":"DERRICK","classification":"U","division":"LIMITED","hit_factor":3.125},{"match_name":"GMPS 5/7/17","match_date":"2017-05-06","stage_classifiercode":"99-12","member_number":"TY65975","first_name":"MORGAN","last_name":"LAMPHERE","classification":"X","division":"LIMITED","hit_factor":3.125},{"match_name":"OK15 USPSA at USSA","match_date":"2017-12-10","stage_classifiercode":"99-12","member_number":"A104749","first_name":"CHARLES","last_name":"GLENN","classification":"U","division":"LIMITED","hit_factor":3.125},{"match_name":"YMM IPSC02 2016_09_11","match_date":"2016-09-11","stage_classifiercode":"99-12","member_number":"\"\"","first_name":"KEN","last_name":"CARVER","classification":"C","division":"LIMITED","hit_factor":3.1216},{"match_name":"SFPC March USPSA Match 2017","match_date":"2017-03-05","stage_classifiercode":"99-12","member_number":"\"\"","first_name":"JOHN","last_name":"PERRY","classification":"U","division":"LIMITED","hit_factor":3.1191},{"match_name":"Griffin USPSA Match Aug 2017","match_date":"2017-08-19","stage_classifiercode":"99-12","member_number":"PEN","first_name":"KYLE","last_name":"WALKER","classification":"U","division":"LIMITED","hit_factor":3.1165},{"match_name":"SSP Super Classifier 1-30-16","match_date":"2016-01-30","stage_classifiercode":"99-12","member_number":"Fy33392","first_name":"GORDON","last_name":"OELKERS2","classification":"B","division":"LIMITED","hit_factor":3.1128},{"match_name":"Collin County USPSA Nov. 27 2016","match_date":"2016-11-25","stage_classifiercode":"99-12","member_number":"A89688","first_name":"CHUCK","last_name":"PENNY","classification":"D","division":"LIMITED","hit_factor":3.1128},{"match_name":"OK15 USPSA at USSA","match_date":"2017-12-10","stage_classifiercode":"99-12","member_number":"\"\"","first_name":"JAMES","last_name":"CLUTTER","classification":"U","division":"LIMITED","hit_factor":3.1119},{"match_name":"COPS Feb 2017 USPSA Match","match_date":"2017-02-05","stage_classifiercode":"99-12","member_number":"\"\"","first_name":"AARON","last_name":"CALLWAY","classification":"U","division":"LIMITED","hit_factor":3.1095},{"match_name":"RD Shooters May 6th USPSA  match","match_date":"2017-05-06","stage_classifiercode":"99-12","member_number":"A92125","first_name":"MELISSA","last_name":"FACKELMAN","classification":"C","division":"LIMITED","hit_factor":3.1079},{"match_name":"WTPS USPSA April Classifier Match 4-8-17","match_date":"2017-04-08","stage_classifiercode":"99-12","member_number":"A102129","first_name":"TRAVIS","last_name":"CLEMENTS","classification":"U","division":"LIMITED","hit_factor":3.1062},{"match_name":"Laser Ninja Dragon League USPSA August 2017","match_date":"2017-08-06","stage_classifiercode":"99-12","member_number":"TY 78654","first_name":"EDDIE","last_name":"SOSAYA","classification":"C","division":"LIMITED","hit_factor":3.1056},{"match_name":"OK15 USPSA at USSA","match_date":"2017-12-10","stage_classifiercode":"99-12","member_number":"L3603","first_name":"MITCH","last_name":"GIBSON","classification":"B","division":"LIMITED","hit_factor":3.1046},{"match_name":"OK15 USPSA at USSA","match_date":"2017-12-10","stage_classifiercode":"99-12","member_number":"TY77717","first_name":"ROBERT","last_name":"HAAS","classification":"B","division":"LIMITED","hit_factor":3.1017},{"match_name":"Collin County USPSA Nov. 27 2016","match_date":"2016-11-25","stage_classifiercode":"99-12","member_number":"A40272","first_name":"GEORGE","last_name":"TOON","classification":"C","division":"LIMITED","hit_factor":3.1008},{"match_name":"Green Valley USPSA May Classifier","match_date":"2018-05-09","stage_classifiercode":"99-12","member_number":"A110974","first_name":"JEREMIAH","last_name":"WADE","classification":"U","division":"LIMITED","hit_factor":3.0998},{"match_name":"Springfield Tactical Shooters 06-07-2018","match_date":"2018-06-07","stage_classifiercode":"99-12","member_number":"\"\"","first_name":"DON","last_name":"DENNING","classification":"\"\"","division":"LIMITED","hit_factor":3.0965},{"match_name":"BRC_20170611","match_date":"2017-06-11","stage_classifiercode":"99-12","member_number":"\"\"","first_name":"PAUL","last_name":"KRUSEE","classification":"U","division":"LIMITED","hit_factor":3.0963},{"match_name":"Shoot GTR USPSA 11/6","match_date":"2016-11-06","stage_classifiercode":"99-12","member_number":"\"\"","first_name":"MATT","last_name":"WEBB","classification":"X","division":"LIMITED","hit_factor":3.0956},{"match_name":"MCPSL Pistol 4-9-16","match_date":"2016-04-09","stage_classifiercode":"99-12","member_number":"TY31475","first_name":"JERRY","last_name":"NELSON","classification":"B","division":"LIMITED","hit_factor":3.095},{"match_name":"Springfield Tactical Shooters 06-07-2018","match_date":"2018-06-07","stage_classifiercode":"99-12","member_number":"A106901","first_name":"WILLIAM","last_name":"AMES","classification":"C","division":"LIMITED","hit_factor":3.095},{"match_name":"Palmetto Gun Club - February 2018 USPSA","match_date":"2018-02-03","stage_classifiercode":"99-12","member_number":"A105685","first_name":"TERRY","last_name":"PRINCE","classification":"C","division":"LIMITED","hit_factor":3.0938},{"match_name":"USPSA","match_date":"2016-06-04","stage_classifiercode":"99-12","member_number":"a89703","first_name":"JOHN","last_name":"FERGUSON","classification":"U","division":"LIMITED","hit_factor":3.0928},{"match_name":"Springfield Tactical Shooters 09/03/2020","match_date":"2020-09-03","stage_classifiercode":"99-12","member_number":"A126293","first_name":"JAMIE","last_name":"BLAKLEY","classification":"\"\"","division":"LIMITED","hit_factor":3.0921},{"match_name":"DRRC Dec2016","match_date":"2016-12-03","stage_classifiercode":"99-12","member_number":"A85075","first_name":"BENJAMIN","last_name":"DAVID","classification":"U","division":"LIMITED","hit_factor":3.091},{"match_name":"Green Valley February 2017","match_date":"2017-02-25","stage_classifiercode":"99-12","member_number":"A75292","first_name":"PATRICIA","last_name":"GRANE-JOHNSON","classification":"C","division":"LIMITED","hit_factor":3.0902},{"match_name":"Smoke & Hope USPSA Apr 22 2017","match_date":"2017-04-22","stage_classifiercode":"99-12","member_number":"\"\"","first_name":"BILL","last_name":"LEWIS","classification":"U","division":"LIMITED","hit_factor":3.0726},{"match_name":"17s PSC - Feb 2017 - USPSA match","match_date":"2017-02-04","stage_classifiercode":"99-12","member_number":"\"\"","first_name":"RONALD","last_name":"ALMAND","classification":"U","division":"LIMITED","hit_factor":3.0719},{"match_name":"RBGC 2018-7-28","match_date":"2018-07-28","stage_classifiercode":"99-12","member_number":"\"\"","first_name":"ALAN","last_name":"FARMER","classification":"U","division":"LIMITED","hit_factor":3.067},{"match_name":"LdF 4th Saturday Match","match_date":"2016-01-23","stage_classifiercode":"99-12","member_number":"L3960","first_name":"BRIAN","last_name":"GAYNOR","classification":"C","division":"LIMITED","hit_factor":3.0621},{"match_name":"Griffin USPSA Match Aug 2017","match_date":"2017-08-19","stage_classifiercode":"99-12","member_number":"PEN","first_name":"JOSH","last_name":"MARICH","classification":"U","division":"LIMITED","hit_factor":3.0568},{"match_name":"BHPSC Monthly Match - Feb 2020","match_date":"2020-02-29","stage_classifiercode":"99-12","member_number":"A107271","first_name":"JEFF","last_name":"PICKMAN","classification":"U","division":"LIMITED","hit_factor":3.0562},{"match_name":"Richmond Hot Shots February 7-2016 USPSA Match","match_date":"2016-02-07","stage_classifiercode":"99-12","member_number":"TY85663","first_name":"JASON","last_name":"YU","classification":"C","division":"LIMITED","hit_factor":3.0552},{"match_name":"OK15 USPSA at USSA","match_date":"2017-12-10","stage_classifiercode":"99-12","member_number":"A106925","first_name":"JORDAN","last_name":"SHORT","classification":"U","division":"LIMITED","hit_factor":3.0534},{"match_name":"APSA February 2017 USPSA Match","match_date":"2017-02-11","stage_classifiercode":"99-12","member_number":"A85996","first_name":"KEITH","last_name":"CASHION","classification":"D","division":"LIMITED","hit_factor":3.0524},{"match_name":"Piscataqua  Master Blasters USPSA Special Classifier","match_date":"2017-12-03","stage_classifiercode":"99-12","member_number":"A94392","first_name":"ZACHARY","last_name":"ROBERGE","classification":"C","division":"LIMITED","hit_factor":3.0511},{"match_name":"Palmetto Gun Club - February 2018 USPSA","match_date":"2018-02-03","stage_classifiercode":"99-12","member_number":"A63611","first_name":"DIANA","last_name":"ADAMS","classification":"B","division":"LIMITED","hit_factor":3.0508},{"match_name":"SCCCJULYCLASSIFIER2016","match_date":"2016-07-30","stage_classifiercode":"99-12","member_number":"a96988","first_name":"CRAIG","last_name":"BENEFIEL","classification":"U","division":"LIMITED","hit_factor":3.0506},{"match_name":"CGC 2017_05_13","match_date":"2017-05-13","stage_classifiercode":"99-12","member_number":"TY89180","first_name":"CHARLES","last_name":"HOLLANDS","classification":"D","division":"LIMITED","hit_factor":3.0493},{"match_name":"LPRGC-Lower Providence USPSA May-2 2017","match_date":"2017-05-13","stage_classifiercode":"99-12","member_number":"TY72492","first_name":"BRUCE","last_name":"CRAWFORD","classification":"U","division":"LIMITED","hit_factor":3.0492},{"match_name":"TPS USPSA PISTOL - May 2016 - Talon Range","match_date":"2016-05-07","stage_classifiercode":"99-12","member_number":"\"\"","first_name":"CJ","last_name":"SCROGGINS","classification":"U","division":"LIMITED","hit_factor":3.0482},{"match_name":"SCAPSA MN05 Summer League 1","match_date":"2017-06-05","stage_classifiercode":"99-12","member_number":"A102398","first_name":"JESSE","last_name":"MEDALEN","classification":"U","division":"LIMITED","hit_factor":3.043},{"match_name":"Springfield Tactical Shooters 06-07-2018","match_date":"2018-06-07","stage_classifiercode":"99-12","member_number":"\"\"","first_name":"RICK","last_name":"WENNEBORG","classification":"\"\"","division":"LIMITED","hit_factor":3.0429},{"match_name":"Collin County USPSA Nov. 27 2016","match_date":"2016-11-25","stage_classifiercode":"99-12","member_number":"A97657","first_name":"CHRISTIAN","last_name":"FISCHER","classification":"C","division":"LIMITED","hit_factor":3.0424},{"match_name":"GMPS 5/7/17","match_date":"2017-05-06","stage_classifiercode":"99-12","member_number":"\"\"","first_name":"TORIN","last_name":"CRANDALL","classification":"\"\"","division":"LIMITED","hit_factor":3.0423},{"match_name":"SFPC September USPSA Special Classifier match","match_date":"2016-09-04","stage_classifiercode":"99-12","member_number":"\"\"","first_name":"JAMES","last_name":"BEMBANASTE","classification":"U","division":"LIMITED","hit_factor":3.0402},{"match_name":"Pinetucky USPSA 11-19-16","match_date":"2016-11-19","stage_classifiercode":"99-12","member_number":"A96072","first_name":"SCOTT","last_name":"FORTSON","classification":"C","division":"LIMITED","hit_factor":3.0395},{"match_name":"CRGC USPSA Special Classifier 08-15-21","match_date":"2021-08-15","stage_classifiercode":"99-12","member_number":"A97999","first_name":"MIC","last_name":"KANE","classification":"","division":"LIMITED","hit_factor":3.0372},{"match_name":"OK15 USPSA at USSA","match_date":"2017-12-10","stage_classifiercode":"99-12","member_number":"A106835","first_name":"PANSY","last_name":"STEELE","classification":"U","division":"LIMITED","hit_factor":3.0324},{"match_name":"Brothers N Arms August 2018 USPSA Match","match_date":"2018-08-18","stage_classifiercode":"99-12","member_number":"A110726","first_name":"GARY","last_name":"DEDEAUX","classification":"U","division":"LIMITED","hit_factor":3.0283},{"match_name":"LdF USPSA Match July 14 2018","match_date":"2018-07-14","stage_classifiercode":"99-12","member_number":"L2320","first_name":"WALT","last_name":"SCHMIDTKE","classification":"C","division":"LIMITED","hit_factor":3.0272},{"match_name":"WSPS OCTOBER 2017 USPSA MATCH","match_date":"2017-10-21","stage_classifiercode":"99-12","member_number":"A99004","first_name":"BUDDY","last_name":"SMITH","classification":"D","division":"LIMITED","hit_factor":3.0269},{"match_name":"RD Shooters May 6th USPSA  match","match_date":"2017-05-06","stage_classifiercode":"99-12","member_number":"NA","first_name":"JEFF","last_name":"SPENCER","classification":"\"\"","division":"LIMITED","hit_factor":3.0165},{"match_name":"Griffin USPSA Match Aug 2017","match_date":"2017-08-19","stage_classifiercode":"99-12","member_number":"PEN","first_name":"JAMES","last_name":"WATSON","classification":"U","division":"LIMITED","hit_factor":3.0151},{"match_name":"RBGC 2018-7-28","match_date":"2018-07-28","stage_classifiercode":"99-12","member_number":"A83594","first_name":"TIM","last_name":"BOWDEN","classification":"C","division":"LIMITED","hit_factor":3.012},{"match_name":"Paul Bunyan April 7th-8th All Classifier Match NW01","match_date":"2018-04-07","stage_classifiercode":"99-12","member_number":"A98674","first_name":"JONATHAN","last_name":"GIESER","classification":"D","division":"LIMITED","hit_factor":3.0058},{"match_name":"TAC2 USPSA August 2017","match_date":"2017-08-05","stage_classifiercode":"99-12","member_number":"\"\"","first_name":"PAUL","last_name":"SHEFFIELD","classification":"U","division":"LIMITED","hit_factor":3.0056},{"match_name":"WNPL USPSA - Labour Day Weekend - Sept 2017","match_date":"2017-09-02","stage_classifiercode":"99-12","member_number":"A29919","first_name":"DAN","last_name":"TURNER","classification":"A","division":"LIMITED","hit_factor":3.0046},{"match_name":"ECPS USPSA 17 Feb 18","match_date":"2018-02-16","stage_classifiercode":"99-12","member_number":"A102827","first_name":"MIKE","last_name":"RILEY","classification":"D","division":"LIMITED","hit_factor":2.9921},{"match_name":"Brothers N Arms February 2018 USPSA Match","match_date":"2018-02-17","stage_classifiercode":"99-12","member_number":"A108757","first_name":"BRANDON","last_name":"GARNER","classification":"U","division":"LIMITED","hit_factor":2.9888},{"match_name":"Gunsmoke Action Shooters USPSA April 18","match_date":"2018-04-07","stage_classifiercode":"99-12","member_number":"\"\"","first_name":"JASON","last_name":"HOHNBERGER","classification":"U","division":"LIMITED","hit_factor":2.9812},{"match_name":"CVSC 06-25-2017","match_date":"2017-06-25","stage_classifiercode":"99-12","member_number":"\"\"","first_name":"JASON","last_name":"PIERCE","classification":"U","division":"LIMITED","hit_factor":2.9795},{"match_name":"NTPS-SE August 2016","match_date":"2016-08-20","stage_classifiercode":"99-12","member_number":"A98458","first_name":"ERIK","last_name":"SCHALL","classification":"U","division":"LIMITED","hit_factor":2.9774},{"match_name":"EIPS  1/19/2017","match_date":"2017-01-19","stage_classifiercode":"99-12","member_number":"A84539","first_name":"JUSTIN","last_name":"ADAMS","classification":"C","division":"LIMITED","hit_factor":2.968},{"match_name":"ECPS February 28th USPSA Pistol Match","match_date":"2016-02-28","stage_classifiercode":"99-12","member_number":"A-87132","first_name":"ANTHONY","last_name":"BICHLER","classification":"D","division":"LIMITED","hit_factor":2.9573},{"match_name":"ECPS February 28th USPSA Pistol Match","match_date":"2016-02-28","stage_classifiercode":"99-12","member_number":"A90780","first_name":"RYAN","last_name":"CARVER","classification":"B","division":"LIMITED","hit_factor":2.9491},{"match_name":"17s PSC - Feb 2017 - USPSA match","match_date":"2017-02-04","stage_classifiercode":"99-12","member_number":"\"\"","first_name":"VERNON","last_name":"GANDY","classification":"U","division":"LIMITED","hit_factor":2.9461},{"match_name":"BSTRC Dec 20 2017","match_date":"2017-12-20","stage_classifiercode":"99-12","member_number":"A102094","first_name":"TONI","last_name":"BOETTCHER","classification":"U","division":"LIMITED","hit_factor":2.9412},{"match_name":"17s PSC - Feb 2017 - USPSA match","match_date":"2017-02-04","stage_classifiercode":"99-12","member_number":"\"\"","first_name":"AARON","last_name":"MCKEITHAN","classification":"U","division":"LIMITED","hit_factor":2.9396},{"match_name":"Springfield Tactical Shooters 06-07-2018","match_date":"2018-06-07","stage_classifiercode":"99-12","member_number":"A99127","first_name":"STEVE","last_name":"FRAZIER","classification":"B","division":"LIMITED","hit_factor":2.9343},{"match_name":"Griffin USPSA Match Aug 2017","match_date":"2017-08-19","stage_classifiercode":"99-12","member_number":"PEN","first_name":"ROBERT","last_name":"STRINGER","classification":"U","division":"LIMITED","hit_factor":2.9322},{"match_name":"TAC2 USPSA August 2017","match_date":"2017-08-05","stage_classifiercode":"99-12","member_number":"A934531","first_name":"GARY","last_name":"HESS","classification":"U","division":"LIMITED","hit_factor":2.9293},{"match_name":"Pinetucky USPSA 11-19-16","match_date":"2016-11-19","stage_classifiercode":"99-12","member_number":"\"\"","first_name":"JOSH","last_name":"HODGES","classification":"U","division":"LIMITED","hit_factor":2.9243},{"match_name":"Belton Gun Club USPSA January MATCH 1-30-21","match_date":"2021-01-30","stage_classifiercode":"99-12","member_number":"A90054","first_name":"DOUG","last_name":"LOWE","classification":"C","division":"LIMITED","hit_factor":2.9172},{"match_name":"SFPC September USPSA Special Classifier match","match_date":"2016-09-04","stage_classifiercode":"99-12","member_number":"A-98469","first_name":"CRISTIANO","last_name":"SILVA","classification":"U","division":"LIMITED","hit_factor":2.9135},{"match_name":"SSP Super Classifier 1-30-16","match_date":"2016-01-30","stage_classifiercode":"99-12","member_number":"TY81025","first_name":"DEWANE","last_name":"FERRIN","classification":"U","division":"LIMITED","hit_factor":2.9126},{"match_name":"17s PSC - Feb 2017 - USPSA match","match_date":"2017-02-04","stage_classifiercode":"99-12","member_number":"\"\"","first_name":"JOSH","last_name":"COFFIELD","classification":"U","division":"LIMITED","hit_factor":2.9126},{"match_name":"ECPS USPSA 17 Feb 18","match_date":"2018-02-16","stage_classifiercode":"99-12","member_number":"A107002","first_name":"THOMAS","last_name":"CHURCH","classification":"U","division":"LIMITED","hit_factor":2.9114},{"match_name":"Laser Ninja Dragon League USPSA August 2017","match_date":"2017-08-06","stage_classifiercode":"99-12","member_number":"A99597","first_name":"AUSTIN","last_name":"POE","classification":"C","division":"LIMITED","hit_factor":2.9114},{"match_name":"MCPSL Pistol 4-9-16","match_date":"2016-04-09","stage_classifiercode":"99-12","member_number":"A93369","first_name":"BRANDON","last_name":"PRENTISS","classification":"U","division":"LIMITED","hit_factor":2.911},{"match_name":"NVSA USPSA 1711","match_date":"2017-11-05","stage_classifiercode":"99-12","member_number":"TY85274","first_name":"AARON","last_name":"MOE","classification":"B","division":"LIMITED","hit_factor":2.9087},{"match_name":"USC August 2016","match_date":"2016-08-13","stage_classifiercode":"99-12","member_number":"A96841","first_name":"DAN","last_name":"BLACKORBY","classification":"U","division":"LIMITED","hit_factor":2.9087},{"match_name":"OK15 USPSA at USSA","match_date":"2017-12-10","stage_classifiercode":"99-12","member_number":"A104239","first_name":"JASON","last_name":"QUALLS","classification":"C","division":"LIMITED","hit_factor":2.907},{"match_name":"Nampa USPSA February 1st","match_date":"2020-02-01","stage_classifiercode":"99-12","member_number":"L4248","first_name":"RYAN","last_name":"LIN","classification":"C","division":"LIMITED","hit_factor":2.9064},{"match_name":"Gunsmoke Action Shooters USPSA April 18","match_date":"2018-04-07","stage_classifiercode":"99-12","member_number":"\"\"","first_name":"PATRICK","last_name":"BAUK","classification":"U","division":"LIMITED","hit_factor":2.9018},{"match_name":"MCPSL Pistol 4-8-17","match_date":"2017-04-08","stage_classifiercode":"99-12","member_number":"A96196","first_name":"RICHARD","last_name":"LANNING","classification":"B","division":"LIMITED","hit_factor":2.9002},{"match_name":"SPSA USPSA March 4th Sat match","match_date":"2017-03-25","stage_classifiercode":"99-12","member_number":"A100744","first_name":"CODY","last_name":"BIGGERSTAFF","classification":"U","division":"LIMITED","hit_factor":2.8939},{"match_name":"Powell County Action Shooters July 17 2021","match_date":"2021-07-17","stage_classifiercode":"99-12","member_number":"A102386","first_name":"LLOYD","last_name":"HEFFERNAN","classification":"C","division":"LIMITED","hit_factor":2.8936},{"match_name":"NISA April Classifer Match 2016","match_date":"2016-04-24","stage_classifiercode":"99-12","member_number":"A85721","first_name":"DONN","last_name":"ANDERSON","classification":"X","division":"LIMITED","hit_factor":2.8876},{"match_name":"WTPS USPSA April Classifier Match 4-8-17","match_date":"2017-04-08","stage_classifiercode":"99-12","member_number":"\"\"","first_name":"JESSE","last_name":"DE LA ROSA","classification":"U","division":"LIMITED","hit_factor":2.8866},{"match_name":"WTPS USPSA April Classifier Match 4-8-17","match_date":"2017-04-08","stage_classifiercode":"99-12","member_number":"A73724","first_name":"TERRY","last_name":"GILBERT","classification":"U","division":"LIMITED","hit_factor":2.883},{"match_name":"MSA USPSA Special Classifier 12-4-16","match_date":"2016-12-04","stage_classifiercode":"99-12","member_number":"\"\"","first_name":"URIAS","last_name":"HALEY","classification":"U","division":"LIMITED","hit_factor":2.8804},{"match_name":"OFGC USPSA Match Feb 19th 2017","match_date":"2017-02-19","stage_classifiercode":"99-12","member_number":"A92125","first_name":"MELISSA","last_name":"NOBLE","classification":"C","division":"LIMITED","hit_factor":2.8784},{"match_name":"COPS Feb 2017 USPSA Match","match_date":"2017-02-05","stage_classifiercode":"99-12","member_number":"A59509","first_name":"J. J.","last_name":"BRADSHAW","classification":"C","division":"LIMITED","hit_factor":2.8758},{"match_name":"Rio Grande Practical Shooters - December 2016","match_date":"2016-12-03","stage_classifiercode":"99-12","member_number":"PEN","first_name":"JASON","last_name":"LAUTERBACH","classification":"U","division":"LIMITED","hit_factor":2.8678},{"match_name":"Pinetucky USPSA 11-19-16","match_date":"2016-11-19","stage_classifiercode":"99-12","member_number":"A98319","first_name":"RACHEL","last_name":"MYERS","classification":"D","division":"LIMITED","hit_factor":2.8653},{"match_name":"OK15 USPSA at USSA","match_date":"2017-12-10","stage_classifiercode":"99-12","member_number":"A101350","first_name":"JOSHUA","last_name":"GILES","classification":"U","division":"LIMITED","hit_factor":2.8621},{"match_name":"Atlanta Practical Shooters March 2016 USPSA - Classifier Match","match_date":"2016-03-06","stage_classifiercode":"99-12","member_number":"A87166","first_name":"KATHLEEN","last_name":"FALLIN","classification":"C","division":"LIMITED","hit_factor":2.8536},{"match_name":"Green Valley USPSA May Classifier","match_date":"2018-05-09","stage_classifiercode":"99-12","member_number":"\"\"","first_name":"TYLER","last_name":"NEEL","classification":"U","division":"LIMITED","hit_factor":2.8515},{"match_name":"OFGC USPSA Match Feb 19th 2017","match_date":"2017-02-19","stage_classifiercode":"99-12","member_number":"A100831","first_name":"JENNIFER","last_name":"WILLROTH","classification":"U","division":"LIMITED","hit_factor":2.8486},{"match_name":"COPS Feb 2017 USPSA Match","match_date":"2017-02-05","stage_classifiercode":"99-12","member_number":"a94538","first_name":"KYLE","last_name":"COOK","classification":"C","division":"LIMITED","hit_factor":2.8415},{"match_name":"CASA Classifier match April 2018","match_date":"2018-04-08","stage_classifiercode":"99-12","member_number":"\"\"","first_name":"R.L.","last_name":"NIX","classification":"U","division":"LIMITED","hit_factor":2.8409},{"match_name":"PIPS 06-14-2017","match_date":"2017-06-14","stage_classifiercode":"99-12","member_number":"A17334","first_name":"BRAD","last_name":"MATTISON","classification":"M","division":"LIMITED","hit_factor":2.8333},{"match_name":"RBGC 2018-7-28","match_date":"2018-07-28","stage_classifiercode":"99-12","member_number":"\"\"","first_name":"AL","last_name":"D'AMICO","classification":"U","division":"LIMITED","hit_factor":2.8322},{"match_name":"USPSA","match_date":"2018-04-28","stage_classifiercode":"99-12","member_number":"\"\"","first_name":"KEN","last_name":"EDWARDS","classification":"U","division":"LIMITED","hit_factor":2.8292},{"match_name":"Shongum Pistol November 2015","match_date":"2015-11-07","stage_classifiercode":"99-12","member_number":"TY77457","first_name":"DRAGON","last_name":"CHOW","classification":"C","division":"LIMITED","hit_factor":2.8249},{"match_name":"Brothers N Arms August 2018 USPSA Match","match_date":"2018-08-18","stage_classifiercode":"99-12","member_number":"A113484","first_name":"SCOTT","last_name":"BURNSIDE","classification":"U","division":"LIMITED","hit_factor":2.8249},{"match_name":"WTPS USPSA April Classifier Match 4-8-17","match_date":"2017-04-08","stage_classifiercode":"99-12","member_number":"A101952","first_name":"THOMAS","last_name":"BIVONA","classification":"U","division":"LIMITED","hit_factor":2.8229},{"match_name":"RBGC 2018-7-28","match_date":"2018-07-28","stage_classifiercode":"99-12","member_number":"A105018","first_name":"LANE","last_name":"RUTLEDGE","classification":"D","division":"LIMITED","hit_factor":2.819},{"match_name":"LdF USPSA Match July 14 2018","match_date":"2018-07-14","stage_classifiercode":"99-12","member_number":"\"\"","first_name":"BEN","last_name":"WALKER","classification":"U","division":"LIMITED","hit_factor":2.8158},{"match_name":"SPSA USPSA March 4th Sat match","match_date":"2017-03-25","stage_classifiercode":"99-12","member_number":"\"\"","first_name":"BUSTER","last_name":"COCHRANE","classification":"C","division":"LIMITED","hit_factor":2.8112},{"match_name":"TPS USPSA - September 2016 - Talon Range","match_date":"2016-09-03","stage_classifiercode":"99-12","member_number":"Not member","first_name":"MIKE","last_name":"REED","classification":"U","division":"LIMITED","hit_factor":2.8094},{"match_name":"ECPS USPSA 17 Feb 18","match_date":"2018-02-16","stage_classifiercode":"99-12","member_number":"\"\"","first_name":"CALEB","last_name":"LEDBETTER","classification":"U","division":"LIMITED","hit_factor":2.8059},{"match_name":"LCHG May USPSA","match_date":"2017-05-21","stage_classifiercode":"99-12","member_number":"\"\"","first_name":"AURIANA","last_name":"KENT","classification":"U","division":"LIMITED","hit_factor":2.8037},{"match_name":"Green Valley February 2017","match_date":"2017-02-25","stage_classifiercode":"99-12","member_number":"PEN","first_name":"CLYDE","last_name":"CACHERO","classification":"U","division":"LIMITED","hit_factor":2.8027},{"match_name":"Stock & Barrel MN18 November 2020 USPSA Classifier Match","match_date":"2020-11-01","stage_classifiercode":"99-12","member_number":"A117775","first_name":"RENEE","last_name":"MAASS","classification":"D","division":"LIMITED","hit_factor":2.7972},{"match_name":"Triforce Practical Shooters at BigWoodsGoods","match_date":"2016-09-22","stage_classifiercode":"99-12","member_number":"A-91113","first_name":"JOHN","last_name":"LYONS","classification":"U","division":"LIMITED","hit_factor":2.7964},{"match_name":"Collin County USPSA Nov. 27 2016","match_date":"2016-11-25","stage_classifiercode":"99-12","member_number":"\"\"","first_name":"DAVID","last_name":"CRAFT","classification":"\"\"","division":"LIMITED","hit_factor":2.7954},{"match_name":"Griffin USPSA Match Aug 2017","match_date":"2017-08-19","stage_classifiercode":"99-12","member_number":"a90102","first_name":"ROBERT","last_name":"BODRON","classification":"B","division":"LIMITED","hit_factor":2.7953},{"match_name":"CCPL 04102016","match_date":"2016-04-10","stage_classifiercode":"99-12","member_number":"A 65481","first_name":"KEVIN","last_name":"DORAN","classification":"U","division":"LIMITED","hit_factor":2.7939},{"match_name":"Hosemasters  3rd Sunday Feburary 2017","match_date":"2017-02-12","stage_classifiercode":"99-12","member_number":"A83982","first_name":"DEBRA","last_name":"SULLIVAN","classification":"D","division":"LIMITED","hit_factor":2.7926},{"match_name":"2020-07 Bone Creek USPSA","match_date":"2020-07-05","stage_classifiercode":"99-12","member_number":"A122559","first_name":"THOMAS","last_name":"TEATER","classification":"C","division":"LIMITED","hit_factor":2.7923},{"match_name":"BGS NORTH  Week 9","match_date":"2016-03-13","stage_classifiercode":"99-12","member_number":"\"\"","first_name":"BILL","last_name":"HALL","classification":"U","division":"LIMITED","hit_factor":2.7917},{"match_name":"LCSA USPSA ALL CLASSIFIER ","match_date":"2018-06-30","stage_classifiercode":"99-12","member_number":"A96427","first_name":"BRIAN","last_name":"CICCO","classification":"B","division":"LIMITED","hit_factor":2.7902},{"match_name":"Ducky Shoot August","match_date":"2018-08-18","stage_classifiercode":"99-12","member_number":"A-112915","first_name":"BRIAN","last_name":"DAWSON","classification":"U","division":"LIMITED","hit_factor":2.7885},{"match_name":"EWPSA 2016-04","match_date":"2016-04-17","stage_classifiercode":"99-12","member_number":"A68799","first_name":"KEITH","last_name":"GOODENOUGH","classification":"U","division":"LIMITED","hit_factor":2.787},{"match_name":"DRRC Dec2016","match_date":"2016-12-03","stage_classifiercode":"99-12","member_number":"A76099","first_name":"DARYL","last_name":"FITZPATRICK","classification":"\"\"","division":"LIMITED","hit_factor":2.7853},{"match_name":"PCGC  June 2017","match_date":"2017-06-25","stage_classifiercode":"99-12","member_number":"\"\"","first_name":"JOE","last_name":"BURGE","classification":"U","division":"LIMITED","hit_factor":2.783},{"match_name":"GMPS 5/7/17","match_date":"2017-05-06","stage_classifiercode":"99-12","member_number":"A95793","first_name":"MIKE","last_name":"MILLER","classification":"U","division":"LIMITED","hit_factor":2.7778},{"match_name":"GRPC USPSA MARCH MAD HATTER","match_date":"2018-03-02","stage_classifiercode":"99-12","member_number":"A102903","first_name":"EDWIN","last_name":"BUCHWALTER","classification":"C","division":"LIMITED","hit_factor":2.7744},{"match_name":"Gunsmoke Action Shooters USPSA April 18","match_date":"2018-04-07","stage_classifiercode":"99-12","member_number":"\"\"","first_name":"CLAYTON","last_name":"HAWKINS","classification":"\"\"","division":"LIMITED","hit_factor":2.7725},{"match_name":"Laser Ninja Dragon League USPSA August 2017","match_date":"2017-08-06","stage_classifiercode":"99-12","member_number":"11668","first_name":"BERT","last_name":"GAMBLE","classification":"U","division":"LIMITED","hit_factor":2.772},{"match_name":"LIPSA - April 30th 2017 - USPSA Match Special Classifier","match_date":"2017-04-30","stage_classifiercode":"99-12","member_number":"A91847","first_name":"AYTON","last_name":"ELLER","classification":"U","division":"LIMITED","hit_factor":2.7643},{"match_name":"AIPS  USPSA Monthly 12 November 2016","match_date":"2016-11-12","stage_classifiercode":"99-12","member_number":"A81278","first_name":"DANIELLE","last_name":"EGANHOUSE-CLOE","classification":"D","division":"LIMITED","hit_factor":2.7586},{"match_name":"SCCPSA USPSA Mar 17","match_date":"2018-03-17","stage_classifiercode":"99-12","member_number":"A72786","first_name":"JON","last_name":"HODGES","classification":"D","division":"LIMITED","hit_factor":2.7552},{"match_name":"EWPSA 2016-04","match_date":"2016-04-17","stage_classifiercode":"99-12","member_number":"TY82308","first_name":"CURT","last_name":"BERGER","classification":"B","division":"LIMITED","hit_factor":2.7534},{"match_name":"17s PSC - Feb 2017 - USPSA match","match_date":"2017-02-04","stage_classifiercode":"99-12","member_number":"\"\"","first_name":"GEORGE","last_name":"WALKER","classification":"U","division":"LIMITED","hit_factor":2.7488},{"match_name":"BSTRC Dec 20 2017","match_date":"2017-12-20","stage_classifiercode":"99-12","member_number":"A101955","first_name":"JOHN","last_name":"BOETTCHER","classification":"U","division":"LIMITED","hit_factor":2.7487},{"match_name":"SPSA USPSA March 4th Sat match","match_date":"2017-03-25","stage_classifiercode":"99-12","member_number":"TY78711","first_name":"JON","last_name":"WAKEMAN","classification":"D","division":"LIMITED","hit_factor":2.7473},{"match_name":"Atlanta Practical Shooters March 2016 USPSA - Classifier Match","match_date":"2016-03-06","stage_classifiercode":"99-12","member_number":"TY85712","first_name":"MANDI","last_name":"MACDONALD","classification":"B","division":"LIMITED","hit_factor":2.7455},{"match_name":"LdF USPSA Match July 14 2018","match_date":"2018-07-14","stage_classifiercode":"99-12","member_number":"A102726","first_name":"TRACY","last_name":"TOMASIAN","classification":"C","division":"LIMITED","hit_factor":2.737},{"match_name":"OFGC USPSA Match Feb 19th 2017","match_date":"2017-02-19","stage_classifiercode":"99-12","member_number":"\"\"","first_name":"MARTIN","last_name":"HAMBY","classification":"U","division":"LIMITED","hit_factor":2.7322},{"match_name":"OK15 USPSA AT USSA","match_date":"2016-07-10","stage_classifiercode":"99-12","member_number":"A83912","first_name":"MONTY","last_name":"MONTGOMERY","classification":"C","division":"LIMITED","hit_factor":2.7322},{"match_name":"Griffin USPSA Match Aug 2017","match_date":"2017-08-19","stage_classifiercode":"99-12","member_number":"PEN","first_name":"DAVID","last_name":"LOCKHART","classification":"U","division":"LIMITED","hit_factor":2.7255},{"match_name":"FBURG April 2017 Level I USPSA ","match_date":"2017-04-01","stage_classifiercode":"99-12","member_number":"\"\"","first_name":"DREW","last_name":"HOLSENBACK","classification":"X","division":"LIMITED","hit_factor":2.7245},{"match_name":"YMM IPSC02 2016_09_11","match_date":"2016-09-11","stage_classifiercode":"99-12","member_number":"FY56992","first_name":"JOHN","last_name":"GLOVER","classification":"A","division":"LIMITED","hit_factor":2.7123},{"match_name":"Emmett September Match","match_date":"2016-09-24","stage_classifiercode":"99-12","member_number":"\"\"","first_name":"RANDY","last_name":"ANDERSON","classification":"U","division":"LIMITED","hit_factor":2.7102},{"match_name":"Rendezvous 8-24-16","match_date":"2016-08-25","stage_classifiercode":"99-12","member_number":"\"\"","first_name":"ALEX","last_name":"W","classification":"U","division":"LIMITED","hit_factor":2.6972},{"match_name":"WSPS OCTOBER 2017 USPSA MATCH","match_date":"2017-10-21","stage_classifiercode":"99-12","member_number":"A104471","first_name":"JEFF","last_name":"EMRICH","classification":"U","division":"LIMITED","hit_factor":2.6946},{"match_name":"TPS USPSA PISTOL - May 2016 - Talon Range","match_date":"2016-05-07","stage_classifiercode":"99-12","member_number":"\"\"","first_name":"BRIAN","last_name":"GURR","classification":"U","division":"LIMITED","hit_factor":2.6944},{"match_name":"APSA February 2017 USPSA Match","match_date":"2017-02-11","stage_classifiercode":"99-12","member_number":"TY97554","first_name":"SCOTT","last_name":"SPENCE","classification":"C","division":"LIMITED","hit_factor":2.6906},{"match_name":"SCAPSA MN05 Summer League 1","match_date":"2017-06-05","stage_classifiercode":"99-12","member_number":"TY102238","first_name":"SHAWN","last_name":"KUPERUS","classification":"U","division":"LIMITED","hit_factor":2.6897},{"match_name":"Richmond Hot Shots February 7-2016 USPSA Match","match_date":"2016-02-07","stage_classifiercode":"99-12","member_number":"A88773","first_name":"EPHRAIM","last_name":"SAN FELIPE","classification":"C","division":"LIMITED","hit_factor":2.6886},{"match_name":"Gunsmoke Action Shooters USPSA April 18","match_date":"2018-04-07","stage_classifiercode":"99-12","member_number":"\"\"","first_name":"DAN","last_name":"CAIN","classification":"U","division":"LIMITED","hit_factor":2.6874},{"match_name":"Sept 3rd Uspsa   Pickaway","match_date":"2016-09-03","stage_classifiercode":"99-12","member_number":"\"\"","first_name":"GARY","last_name":"ROUBINEK","classification":"\"\"","division":"LIMITED","hit_factor":2.6864},{"match_name":"BSTRC Dec 20 2017","match_date":"2017-12-20","stage_classifiercode":"99-12","member_number":"\"\"","first_name":"SHELBY","last_name":"DICK","classification":"U","division":"LIMITED","hit_factor":2.6812},{"match_name":"LCSA USPSA ALL CLASSIFIER ","match_date":"2018-06-30","stage_classifiercode":"99-12","member_number":"A99060","first_name":"FRANK","last_name":"EIDENS","classification":"C","division":"LIMITED","hit_factor":2.6786},{"match_name":"RD Shooters May 6th USPSA  match","match_date":"2017-05-06","stage_classifiercode":"99-12","member_number":"TY93348","first_name":"BILL","last_name":"HAMMOND","classification":"D","division":"LIMITED","hit_factor":2.6686},{"match_name":"RD Shooters May 6th USPSA  match","match_date":"2017-05-06","stage_classifiercode":"99-12","member_number":"\"\"","first_name":"SETH","last_name":"HANE","classification":"U","division":"LIMITED","hit_factor":2.6667},{"match_name":"Prescott 3rd Sunday USPSA 11-20-2016","match_date":"2016-11-20","stage_classifiercode":"99-12","member_number":"CL46","first_name":"ROSCOE","last_name":"LIVINGSTON","classification":"B","division":"LIMITED","hit_factor":2.6655},{"match_name":"Emmett September Match","match_date":"2016-09-24","stage_classifiercode":"99-12","member_number":"a97864","first_name":"JAMES","last_name":"DERRICK","classification":"U","division":"LIMITED","hit_factor":2.6637},{"match_name":"Payson Practical Pistol Sept 03 2016","match_date":"2016-09-03","stage_classifiercode":"99-12","member_number":"A96728","first_name":"JOHN","last_name":"RAVEN","classification":"U","division":"LIMITED","hit_factor":2.6621},{"match_name":"Pinetucky USPSA 11-19-16","match_date":"2016-11-19","stage_classifiercode":"99-12","member_number":"\"\"","first_name":"DAVID","last_name":"NELSON","classification":"U","division":"LIMITED","hit_factor":2.6535},{"match_name":"Palmetto Gun Club - February 2018 USPSA","match_date":"2018-02-03","stage_classifiercode":"99-12","member_number":"TY54598","first_name":"PAUL","last_name":"RICHARDSON","classification":"B","division":"LIMITED","hit_factor":2.6519},{"match_name":"BSTRC Dec 20 2017","match_date":"2017-12-20","stage_classifiercode":"99-12","member_number":"106934","first_name":"JOHN","last_name":"RAY","classification":"U","division":"LIMITED","hit_factor":2.6465},{"match_name":"Medford USPSA April 2018 Match","match_date":"2018-04-15","stage_classifiercode":"99-12","member_number":"A78709","first_name":"BRETT","last_name":"STEWART","classification":"B","division":"LIMITED","hit_factor":2.6432},{"match_name":"Laser Ninja Dragon League USPSA August 2017","match_date":"2017-08-06","stage_classifiercode":"99-12","member_number":"A99711","first_name":"JASON","last_name":"HENRY","classification":"D","division":"LIMITED","hit_factor":2.6407},{"match_name":"BRC_20170611","match_date":"2017-06-11","stage_classifiercode":"99-12","member_number":"A63705","first_name":"MIKE","last_name":"COLBERT","classification":"C","division":"LIMITED","hit_factor":2.6385},{"match_name":"COPS Feb 2017 USPSA Match","match_date":"2017-02-05","stage_classifiercode":"99-12","member_number":"ty94033","first_name":"BRYAN","last_name":"WILLIAMS","classification":"C","division":"LIMITED","hit_factor":2.6344},{"match_name":"Fairfax PS USPSA  2018 September","match_date":"2018-09-18","stage_classifiercode":"99-12","member_number":"a92862","first_name":"DAVID","last_name":"THRIFT","classification":"U","division":"LIMITED","hit_factor":2.6316},{"match_name":"EWPSA 2016-04","match_date":"2016-04-17","stage_classifiercode":"99-12","member_number":"A80821","first_name":"KIRK","last_name":"ZIMMER","classification":"C","division":"LIMITED","hit_factor":2.6291},{"match_name":"Hosemasters  3rd Sunday Feburary 2017","match_date":"2017-02-12","stage_classifiercode":"99-12","member_number":"A12636","first_name":"BILL","last_name":"HILL","classification":"A","division":"LIMITED","hit_factor":2.629},{"match_name":"USPSA MO21 Special Classifier 2Alpha SBRC February 27 2021","match_date":"2021-02-27","stage_classifiercode":"99-12","member_number":"A132761","first_name":"NATHAN","last_name":"BURTON","classification":"U","division":"LIMITED","hit_factor":2.6279},{"match_name":"Atlanta Practical Shooters March 2016 USPSA - Classifier Match","match_date":"2016-03-06","stage_classifiercode":"99-12","member_number":"A80906","first_name":"HOWARD","last_name":"HORNE","classification":"U","division":"LIMITED","hit_factor":2.6261},{"match_name":"Nampa USPSA February 1st","match_date":"2020-02-01","stage_classifiercode":"99-12","member_number":"TY114812","first_name":"TONY","last_name":"KENDALL","classification":"C","division":"LIMITED","hit_factor":2.6196},{"match_name":"Maine Practical Shooters May 2018","match_date":"2018-05-12","stage_classifiercode":"99-12","member_number":"A90785","first_name":"AUSTIN","last_name":"DENIS","classification":"C","division":"LIMITED","hit_factor":2.6151},{"match_name":"Pinetucky USPSA 11-19-16","match_date":"2016-11-19","stage_classifiercode":"99-12","member_number":"\"\"","first_name":"JOEL","last_name":"CLARK","classification":"U","division":"LIMITED","hit_factor":2.6082},{"match_name":"EWPSA 2016-04","match_date":"2016-04-17","stage_classifiercode":"99-12","member_number":"TY80395","first_name":"KAJSA","last_name":"WEAVER","classification":"C","division":"LIMITED","hit_factor":2.6022},{"match_name":"RBGC 2018-7-28","match_date":"2018-07-28","stage_classifiercode":"99-12","member_number":"\"\"","first_name":"ROBERT","last_name":"D'URSO","classification":"U","division":"LIMITED","hit_factor":2.6005},{"match_name":"Springfield Tactical Shooters 09/03/2020","match_date":"2020-09-03","stage_classifiercode":"99-12","member_number":"\"\"","first_name":"GENE","last_name":"MINER","classification":"\"\"","division":"LIMITED","hit_factor":2.5974},{"match_name":"Minnetonka Game And Fish May 23","match_date":"2018-05-23","stage_classifiercode":"99-12","member_number":"\"\"","first_name":"TJ","last_name":"JORGENSEN","classification":"U","division":"LIMITED","hit_factor":2.5959},{"match_name":"Minnetonka Game And Fish May 23","match_date":"2018-05-23","stage_classifiercode":"99-12","member_number":"A26232","first_name":"JOHN","last_name":"BURNIECE","classification":"U","division":"LIMITED","hit_factor":2.5934},{"match_name":"ENPS May 2018 USPSA Match","match_date":"2018-05-06","stage_classifiercode":"99-12","member_number":"A52576","first_name":"TRAVIS","last_name":"MITCHELL","classification":"U","division":"LIMITED","hit_factor":2.5922},{"match_name":"USPSA MO21 Special Classifier 2Alpha SBRC February 27 2021","match_date":"2021-02-27","stage_classifiercode":"99-12","member_number":"A107973","first_name":"GARY","last_name":"NEUBAUM","classification":"C","division":"LIMITED","hit_factor":2.592},{"match_name":"Maine Practical Shooters May 2018","match_date":"2018-05-12","stage_classifiercode":"99-12","member_number":"A111274","first_name":"BRIAN","last_name":"SNIDER","classification":"U","division":"LIMITED","hit_factor":2.5899},{"match_name":"Piscataqua  Master Blasters USPSA Special Classifier","match_date":"2017-12-03","stage_classifiercode":"99-12","member_number":"A103578","first_name":"RONALD","last_name":"JACOBSEN","classification":"D","division":"LIMITED","hit_factor":2.5876},{"match_name":"TAC2 USPSA August 2017","match_date":"2017-08-05","stage_classifiercode":"99-12","member_number":"\"\"","first_name":"KIM","last_name":"SIMS","classification":"U","division":"LIMITED","hit_factor":2.5852},{"match_name":"Ducky Shoot August","match_date":"2018-08-18","stage_classifiercode":"99-12","member_number":"A-92730","first_name":"BRENDA","last_name":"MINNERICK","classification":"D","division":"LIMITED","hit_factor":2.5847},{"match_name":"COPS Feb 2017 USPSA Match","match_date":"2017-02-05","stage_classifiercode":"99-12","member_number":"a91525","first_name":"MIKE","last_name":"HORNSEY","classification":"U","division":"LIMITED","hit_factor":2.5761},{"match_name":"PCGC  June 2017","match_date":"2017-06-25","stage_classifiercode":"99-12","member_number":"A40040","first_name":"JOHN","last_name":"BOOTH","classification":"C","division":"LIMITED","hit_factor":2.5755},{"match_name":"LIPSA - April 30th 2017 - USPSA Match Special Classifier","match_date":"2017-04-30","stage_classifiercode":"99-12","member_number":"A101584","first_name":"MICHAEL","last_name":"RUSSELL","classification":"U","division":"LIMITED","hit_factor":2.5703},{"match_name":"gun2 sfps20170521 2","match_date":"2017-05-20","stage_classifiercode":"99-12","member_number":"A50695","first_name":"TIM","last_name":"THOMAS","classification":"C","division":"LIMITED","hit_factor":2.5668},{"match_name":"TPS USPSA PISTOL - May 2016 - Talon Range","match_date":"2016-05-07","stage_classifiercode":"99-12","member_number":"fy40497","first_name":"MICHAEL","last_name":"FORDYCE","classification":"M","division":"LIMITED","hit_factor":2.5666},{"match_name":"17s PSC - Feb 2017 - USPSA match","match_date":"2017-02-04","stage_classifiercode":"99-12","member_number":"\"\"","first_name":"BRIAN","last_name":"HAYMAN","classification":"U","division":"LIMITED","hit_factor":2.5621},{"match_name":"TPS USPSA - September 2016 - Talon Range","match_date":"2016-09-03","stage_classifiercode":"99-12","member_number":"A6381","first_name":"ROBBY","last_name":"HARRIS","classification":"C","division":"LIMITED","hit_factor":2.5617},{"match_name":"LdF USPSA Match July 14 2018","match_date":"2018-07-14","stage_classifiercode":"99-12","member_number":"\"\"","first_name":"NATALIE","last_name":"GARZA","classification":"U","division":"LIMITED","hit_factor":2.5526},{"match_name":"GRPC USPSA MARCH MAD HATTER","match_date":"2018-03-02","stage_classifiercode":"99-12","member_number":"A108823","first_name":"STEPHEN","last_name":"MORENO","classification":"U","division":"LIMITED","hit_factor":2.5516},{"match_name":"Laser Ninja Dragon League USPSA August 2017","match_date":"2017-08-06","stage_classifiercode":"99-12","member_number":"N/A","first_name":"DIRON","last_name":"ROTAN","classification":"U","division":"LIMITED","hit_factor":2.5486},{"match_name":"USPSA","match_date":"2016-06-04","stage_classifiercode":"99-12","member_number":"\"\"","first_name":"THOMAS","last_name":"LONG","classification":"U","division":"LIMITED","hit_factor":2.5429},{"match_name":"Springfield Tactical Shooters 09/03/2020","match_date":"2020-09-03","stage_classifiercode":"99-12","member_number":"\"\"","first_name":"JIM","last_name":"HARTWIG","classification":"\"\"","division":"LIMITED","hit_factor":2.5413},{"match_name":"ENPS May 2018 USPSA Match","match_date":"2018-05-06","stage_classifiercode":"99-12","member_number":"TY92585","first_name":"JOHN","last_name":"SHERLOCK","classification":"C","division":"LIMITED","hit_factor":2.537},{"match_name":"USPSA MO21 Special Classifier 2Alpha SBRC February 27 2021","match_date":"2021-02-27","stage_classifiercode":"99-12","member_number":"A92707","first_name":"NOAH","last_name":"WEBB","classification":"U","division":"LIMITED","hit_factor":2.5332},{"match_name":"Rio Grande Practical Shooters - December 2016","match_date":"2016-12-03","stage_classifiercode":"99-12","member_number":"FY69551","first_name":"MIKE","last_name":"WHITTET","classification":"B","division":"LIMITED","hit_factor":2.5316},{"match_name":"USC August 2016","match_date":"2016-08-13","stage_classifiercode":"99-12","member_number":"A87738","first_name":"ERIK","last_name":"HARDING","classification":"D","division":"LIMITED","hit_factor":2.5301},{"match_name":"MCPSL Pistol 4-9-16","match_date":"2016-04-09","stage_classifiercode":"99-12","member_number":"PEN","first_name":"SCOTT","last_name":"PLACKE","classification":"U","division":"LIMITED","hit_factor":2.5172},{"match_name":"Green Valley February 2017","match_date":"2017-02-25","stage_classifiercode":"99-12","member_number":"PEN","first_name":"SEAN","last_name":"LAFOND","classification":"U","division":"LIMITED","hit_factor":2.515},{"match_name":"Rockcastle USPSA Nov 28 2015","match_date":"2015-11-28","stage_classifiercode":"99-12","member_number":"A93648","first_name":"WILLIAM","last_name":"TYREE","classification":"U","division":"LIMITED","hit_factor":2.5107},{"match_name":"Green Valley USPSA May Classifier","match_date":"2018-05-09","stage_classifiercode":"99-12","member_number":"A-92132","first_name":"JIM","last_name":"WHITE","classification":"C","division":"LIMITED","hit_factor":2.5071},{"match_name":"FBPPC DECEMBER 2016 SPECIAL CLASSIFIER MATCH","match_date":"2016-12-10","stage_classifiercode":"99-12","member_number":"A80392","first_name":"KEITH","last_name":"CAVE","classification":"D","division":"LIMITED","hit_factor":2.5045},{"match_name":"WNPL USPSA - Labour Day Weekend - Sept 2017","match_date":"2017-09-02","stage_classifiercode":"99-12","member_number":"PENDING","first_name":"DUSTY","last_name":"BLACK","classification":"U","division":"LIMITED","hit_factor":2.503},{"match_name":"CVSC 06-25-2017","match_date":"2017-06-25","stage_classifiercode":"99-12","member_number":"A94128","first_name":"CURTIS","last_name":"SISK","classification":"C","division":"LIMITED","hit_factor":2.4975},{"match_name":"Medford USPSA April 2018 Match","match_date":"2018-04-15","stage_classifiercode":"99-12","member_number":"\"\"","first_name":"TORREN","last_name":"MCMULLEN","classification":"U","division":"LIMITED","hit_factor":2.494},{"match_name":"EWPSA 2016-04","match_date":"2016-04-17","stage_classifiercode":"99-12","member_number":"A90534","first_name":"MITCH","last_name":"GIDDENS","classification":"U","division":"LIMITED","hit_factor":2.4913},{"match_name":"CCPL 04102016","match_date":"2016-04-10","stage_classifiercode":"99-12","member_number":"\"\"","first_name":"PAUL","last_name":"CHETWOOD","classification":"U","division":"LIMITED","hit_factor":2.4887},{"match_name":"Chillicothe May-2017 USPSA Match","match_date":"2017-05-28","stage_classifiercode":"99-12","member_number":"A90362","first_name":"ALLISON","last_name":"MOOBERRY","classification":"C","division":"LIMITED","hit_factor":2.4862},{"match_name":"MCPSL Pistol 4-8-17","match_date":"2017-04-08","stage_classifiercode":"99-12","member_number":"PEN","first_name":"CHAD","last_name":"VAN BRUNT","classification":"U","division":"LIMITED","hit_factor":2.4829},{"match_name":"LPRGC-Lower Providence USPSA May-2 2017","match_date":"2017-05-13","stage_classifiercode":"99-12","member_number":"TY29481","first_name":"WILLIAM","last_name":"EVANS","classification":"C","division":"LIMITED","hit_factor":2.4829},{"match_name":"Atlanta Practical Shooters March 2016 USPSA - Classifier Match","match_date":"2016-03-06","stage_classifiercode":"99-12","member_number":"A78544","first_name":"TREVOR","last_name":"JILES","classification":"U","division":"LIMITED","hit_factor":2.4783},{"match_name":"Maine Practical Shooters May 2018","match_date":"2018-05-12","stage_classifiercode":"99-12","member_number":"TY101923","first_name":"CHRISTINA","last_name":"BAKER","classification":"D","division":"LIMITED","hit_factor":2.4737},{"match_name":"SFPS 05-21-17 Superclassifier Gun1","match_date":"2017-05-21","stage_classifiercode":"99-12","member_number":"PEN","first_name":"STEVE","last_name":"LAWSON","classification":"U","division":"LIMITED","hit_factor":2.4697},{"match_name":"LCSA USPSA ALL CLASSIFIER ","match_date":"2018-06-30","stage_classifiercode":"99-12","member_number":"A91103","first_name":"DANIEL","last_name":"TOOMBS","classification":"C","division":"LIMITED","hit_factor":2.4611},{"match_name":"RBGC 2018-7-28","match_date":"2018-07-28","stage_classifiercode":"99-12","member_number":"A111254","first_name":"STEVE","last_name":"PETRAKOVICH","classification":"U","division":"LIMITED","hit_factor":2.4597},{"match_name":"SSP Super Classifier 1-30-16","match_date":"2016-01-30","stage_classifiercode":"99-12","member_number":"\"\"","first_name":"SEVAK","last_name":"HAKOBYAN","classification":"Unclassified","division":"LIMITED","hit_factor":2.458},{"match_name":"Pelham USPSA 2016-09-18","match_date":"2016-09-18","stage_classifiercode":"99-12","member_number":"\"\"","first_name":"SEAN","last_name":"STORY","classification":"\"\"","division":"LIMITED","hit_factor":2.4479},{"match_name":"MRPC USPSA Mar 2017","match_date":"2017-03-26","stage_classifiercode":"99-12","member_number":"A70562","first_name":"JAY","last_name":"WEBER JR.","classification":"U","division":"LIMITED","hit_factor":2.4473},{"match_name":"USC August 2016","match_date":"2016-08-13","stage_classifiercode":"99-12","member_number":"\"\"","first_name":"EMILY","last_name":"JOHNSON","classification":"U","division":"LIMITED","hit_factor":2.447},{"match_name":"LdF USPSA Match July 14 2018","match_date":"2018-07-14","stage_classifiercode":"99-12","member_number":"TY82338","first_name":"ALBERT","last_name":"WILLINGHAM","classification":"B","division":"LIMITED","hit_factor":2.4447},{"match_name":"Brothers N Arms February 2018 USPSA Match","match_date":"2018-02-17","stage_classifiercode":"99-12","member_number":"PENDING","first_name":"TJ","last_name":"DYE","classification":"U","division":"LIMITED","hit_factor":2.4378},{"match_name":"Griffin USPSA Match Aug 2017","match_date":"2017-08-19","stage_classifiercode":"99-12","member_number":"PEN","first_name":"TOMMY","last_name":"MCCLENDON","classification":"U","division":"LIMITED","hit_factor":2.4353},{"match_name":"SSP Super Classifier 1-30-16","match_date":"2016-01-30","stage_classifiercode":"99-12","member_number":"A93716","first_name":"JEREMY","last_name":"WEST","classification":"U","division":"LIMITED","hit_factor":2.4334},{"match_name":"USPSA MO21 Special Classifier 2Alpha SBRC February 27 2021","match_date":"2021-02-27","stage_classifiercode":"99-12","member_number":"A130070","first_name":"CHRIS","last_name":"SHORT","classification":"C","division":"LIMITED","hit_factor":2.4316},{"match_name":"Atlanta Practical Shooters March 2016 USPSA - Classifier Match","match_date":"2016-03-06","stage_classifiercode":"99-12","member_number":"\"\"","first_name":"ZACK","last_name":"TILLOTSON","classification":"U","division":"LIMITED","hit_factor":2.4313},{"match_name":"Springfield Tactical Shooters 09/03/2020","match_date":"2020-09-03","stage_classifiercode":"99-12","member_number":"A129727","first_name":"MATHIEU","last_name":"ROBILLARD","classification":"\"\"","division":"LIMITED","hit_factor":2.4272},{"match_name":"Pinetucky USPSA 11-19-16","match_date":"2016-11-19","stage_classifiercode":"99-12","member_number":"T93173","first_name":"CAROL","last_name":"CAMPBELL","classification":"D","division":"LIMITED","hit_factor":2.4249},{"match_name":"PIPS 06-14-2017","match_date":"2017-06-14","stage_classifiercode":"99-12","member_number":"A89742","first_name":"JOSH","last_name":"GERNENTZ","classification":"C","division":"LIMITED","hit_factor":2.4242},{"match_name":"SSP Super Classifier 1-30-16","match_date":"2016-01-30","stage_classifiercode":"99-12","member_number":"Fy33392","first_name":"GORDON","last_name":"OELKERS","classification":"B","division":"LIMITED","hit_factor":2.4217},{"match_name":"DRRC Dec2016","match_date":"2016-12-03","stage_classifiercode":"99-12","member_number":"\"\"","first_name":"ADAM","last_name":"KAUTH","classification":"\"\"","division":"LIMITED","hit_factor":2.4198},{"match_name":"Gunsmoke Action Shooters USPSA April 18","match_date":"2018-04-07","stage_classifiercode":"99-12","member_number":"A89678","first_name":"JOEL","last_name":"VALLEJO","classification":"D","division":"LIMITED","hit_factor":2.4187},{"match_name":"LdF USPSA Match July 14 2018","match_date":"2018-07-14","stage_classifiercode":"99-12","member_number":"A110933","first_name":"ANTHONY","last_name":"WILLIAMS","classification":"U","division":"LIMITED","hit_factor":2.4123},{"match_name":"Hosemasters  3rd Sunday Feburary 2017","match_date":"2017-02-12","stage_classifiercode":"99-12","member_number":"TY89504","first_name":"ANISSA","last_name":"SCHULTZ","classification":"D","division":"LIMITED","hit_factor":2.4113},{"match_name":"EWPSA 2016-04","match_date":"2016-04-17","stage_classifiercode":"99-12","member_number":"TY5401","first_name":"MIKE","last_name":"ENSMINGER","classification":"B","division":"LIMITED","hit_factor":2.411},{"match_name":"LPRGC-Lower Providence USPSA May-2 2017","match_date":"2017-05-13","stage_classifiercode":"99-12","member_number":"A95496","first_name":"PETER","last_name":"CARROLL","classification":"U","division":"LIMITED","hit_factor":2.4096},{"match_name":"CRGC USPSA Special Classifier 08-15-21","match_date":"2021-08-15","stage_classifiercode":"99-12","member_number":"A134828","first_name":"MICHELE","last_name":"MOORE","classification":"","division":"LIMITED","hit_factor":2.4096},{"match_name":"OK15 USPSA at USSA","match_date":"2017-12-10","stage_classifiercode":"99-12","member_number":"A-90065","first_name":"MICHELLE","last_name":"WALDRAN","classification":"D","division":"LIMITED","hit_factor":2.4046},{"match_name":"AAPS AAFG Special Classifier Match - March 31 2018","match_date":"2018-03-31","stage_classifiercode":"99-12","member_number":"A91553","first_name":"CRAIG","last_name":"FLOYD","classification":"C","division":"LIMITED","hit_factor":2.4031},{"match_name":"BSTRC Dec 20 2017","match_date":"2017-12-20","stage_classifiercode":"99-12","member_number":"A104718","first_name":"FRANCIS","last_name":"MCCULLA","classification":"D","division":"LIMITED","hit_factor":2.4007},{"match_name":"FBURG April 2017 Level I USPSA ","match_date":"2017-04-01","stage_classifiercode":"99-12","member_number":"\"\"","first_name":"CHRIS","last_name":"GAULDIN","classification":"U","division":"LIMITED","hit_factor":2.4},{"match_name":"GAS October 6th Match","match_date":"2018-10-06","stage_classifiercode":"99-12","member_number":"A114282","first_name":"DUSTIN","last_name":"INGERSOLL","classification":"C","division":"LIMITED","hit_factor":2.3969},{"match_name":"17s PSC - Feb 2017 - USPSA match","match_date":"2017-02-04","stage_classifiercode":"99-12","member_number":"\"\"","first_name":"LANCE","last_name":"GROOMS","classification":"U","division":"LIMITED","hit_factor":2.391},{"match_name":"TAC2 USPSA August 2017","match_date":"2017-08-05","stage_classifiercode":"99-12","member_number":"A92064","first_name":"SAM","last_name":"MORELOCK","classification":"D","division":"LIMITED","hit_factor":2.3893},{"match_name":"BSTRC Dec 20 2017","match_date":"2017-12-20","stage_classifiercode":"99-12","member_number":"\"\"","first_name":"ROBERT","last_name":"KRAUTER","classification":"U","division":"LIMITED","hit_factor":2.3839},{"match_name":"Ducky Shoot August","match_date":"2018-08-18","stage_classifiercode":"99-12","member_number":"A-98394","first_name":"JIM","last_name":"MONFORTON","classification":"U","division":"LIMITED","hit_factor":2.3825},{"match_name":"South Texas Tactical USPSA","match_date":"2017-07-08","stage_classifiercode":"99-12","member_number":"\"\"","first_name":"LARRY","last_name":"DOXSEE","classification":"\"\"","division":"LIMITED","hit_factor":2.3797},{"match_name":"NTPS-SE August 2016","match_date":"2016-08-20","stage_classifiercode":"99-12","member_number":"NONE","first_name":"KENT","last_name":"BRADFORD","classification":"U","division":"LIMITED","hit_factor":2.3788},{"match_name":"COPS Feb 2017 USPSA Match","match_date":"2017-02-05","stage_classifiercode":"99-12","member_number":"a99425","first_name":"RICH","last_name":"FOOTE","classification":"U","division":"LIMITED","hit_factor":2.3783},{"match_name":"ENPS May 2018 USPSA Match","match_date":"2018-05-06","stage_classifiercode":"99-12","member_number":"ty96763","first_name":"BENJAMIN","last_name":"STARITS","classification":"C","division":"LIMITED","hit_factor":2.375},{"match_name":"AIPS  USPSA Monthly 12 November 2016","match_date":"2016-11-12","stage_classifiercode":"99-12","member_number":"L3842","first_name":"MARK","last_name":"WIEDENFELD","classification":"B","division":"LIMITED","hit_factor":2.3653},{"match_name":"OFGC USPSA Match Feb 19th 2017","match_date":"2017-02-19","stage_classifiercode":"99-12","member_number":"\"\"","first_name":"RICK","last_name":"LAMBERT","classification":"U","division":"LIMITED","hit_factor":2.3649},{"match_name":"SPSA USPSA March 4th Sat match","match_date":"2017-03-25","stage_classifiercode":"99-12","member_number":"A98920","first_name":"CHRIS","last_name":"SHIRER","classification":"C","division":"LIMITED","hit_factor":2.3632},{"match_name":"Emmett September Match","match_date":"2016-09-24","stage_classifiercode":"99-12","member_number":"\"\"","first_name":"GRAHAM","last_name":"KEARNS","classification":"U","division":"LIMITED","hit_factor":2.3617},{"match_name":"EWPSA 2016-04","match_date":"2016-04-17","stage_classifiercode":"99-12","member_number":"5766","first_name":"MICHAEL","last_name":"EFF","classification":"U","division":"LIMITED","hit_factor":2.3536},{"match_name":"Springfield Tactical Shooters 06-07-2018","match_date":"2018-06-07","stage_classifiercode":"99-12","member_number":"A107857","first_name":"MADISON","last_name":"BOEHLER","classification":"\"\"","division":"LIMITED","hit_factor":2.3529},{"match_name":"GMPS 5/7/17","match_date":"2017-05-06","stage_classifiercode":"99-12","member_number":"A92498","first_name":"BILL","last_name":"MARTIN","classification":"D","division":"LIMITED","hit_factor":2.3511},{"match_name":"OFGC USPSA Match 10-21-18","match_date":"2018-10-21","stage_classifiercode":"99-12","member_number":"A109162","first_name":"CODY","last_name":"HUGHES","classification":"U","division":"LIMITED","hit_factor":2.3496},{"match_name":"AIPS  USPSA Monthly 12 November 2016","match_date":"2016-11-12","stage_classifiercode":"99-12","member_number":"A97332","first_name":"CLIFFORD","last_name":"SCOTT","classification":"D","division":"LIMITED","hit_factor":2.3406},{"match_name":"PIPS 06-14-2017","match_date":"2017-06-14","stage_classifiercode":"99-12","member_number":"A96507","first_name":"BRENT","last_name":"DAHL","classification":"C","division":"LIMITED","hit_factor":2.3385},{"match_name":"Paul Bunyan April 7th-8th All Classifier Match NW01","match_date":"2018-04-07","stage_classifiercode":"99-12","member_number":"Ty100358","first_name":"KELLY","last_name":"BENNETT","classification":"U","division":"LIMITED","hit_factor":2.3331},{"match_name":"CCPL 04102016","match_date":"2016-04-10","stage_classifiercode":"99-12","member_number":"TY 78865","first_name":"DANIEL","last_name":"BRUCE","classification":"C","division":"LIMITED","hit_factor":2.3327},{"match_name":"Henry Coumty Gun Club USPSA","match_date":"2021-05-15","stage_classifiercode":"99-12","member_number":"A53795","first_name":"GENE","last_name":"NORMAN","classification":"U","division":"LIMITED","hit_factor":2.3307},{"match_name":"RBGC 2018-7-28","match_date":"2018-07-28","stage_classifiercode":"99-12","member_number":"A113019","first_name":"JOHN","last_name":"OCONNOR","classification":"U","division":"LIMITED","hit_factor":2.3285},{"match_name":"FBPPC DECEMBER 2016 SPECIAL CLASSIFIER MATCH","match_date":"2016-12-10","stage_classifiercode":"99-12","member_number":"PEN","first_name":"RON","last_name":"ROBERTSON","classification":"U","division":"LIMITED","hit_factor":2.3256},{"match_name":"EASTER EGG HUNT AREA 59  ALL CLASSFIER MATCH","match_date":"2017-04-15","stage_classifiercode":"99-12","member_number":"TY58743","first_name":"FERNIE","last_name":"AVELINO","classification":"U","division":"LIMITED","hit_factor":2.3256},{"match_name":"TAC2 USPSA August 2017","match_date":"2017-08-05","stage_classifiercode":"99-12","member_number":"\"\"","first_name":"RICHARD","last_name":"FOSTER","classification":"C","division":"LIMITED","hit_factor":2.3211},{"match_name":"North Mountain July ","match_date":"2016-07-17","stage_classifiercode":"99-12","member_number":"\"\"","first_name":"SHELTON","last_name":"LITTLE","classification":"M","division":"LIMITED","hit_factor":2.3188},{"match_name":"SFPC September USPSA Special Classifier match","match_date":"2016-09-04","stage_classifiercode":"99-12","member_number":"A84805","first_name":"ENRICO","last_name":"NUNEZ","classification":"C","division":"LIMITED","hit_factor":2.3182},{"match_name":"Pinetucky USPSA 11-19-16","match_date":"2016-11-19","stage_classifiercode":"99-12","member_number":"A-96278","first_name":"NANCY","last_name":"GRUNNET","classification":"D","division":"LIMITED","hit_factor":2.3129},{"match_name":"AIPS  USPSA Monthly 12 November 2016","match_date":"2016-11-12","stage_classifiercode":"99-12","member_number":"PEN","first_name":"KURT","last_name":"KNESS","classification":"\"\"","division":"LIMITED","hit_factor":2.3066},{"match_name":"PCGC  June 2017","match_date":"2017-06-25","stage_classifiercode":"99-12","member_number":"\"\"","first_name":"COLTEN","last_name":"BLEDSOE","classification":"U","division":"LIMITED","hit_factor":2.3055},{"match_name":"LCSA USPSA ALL CLASSIFIER ","match_date":"2018-06-30","stage_classifiercode":"99-12","member_number":"A112330","first_name":"THOMAS","last_name":"PARKS","classification":"\"\"","division":"LIMITED","hit_factor":2.3041},{"match_name":"MCPSL Pistol 4-9-16","match_date":"2016-04-09","stage_classifiercode":"99-12","member_number":"PEN","first_name":"BRENT","last_name":"DRINGENBERG","classification":"U","division":"LIMITED","hit_factor":2.2958},{"match_name":"ECPS USPSA 17 Feb 18","match_date":"2018-02-16","stage_classifiercode":"99-12","member_number":"\"\"","first_name":"JONATHAN","last_name":"WOOD","classification":"U","division":"LIMITED","hit_factor":2.2931},{"match_name":"OK15 USPSA at USSA","match_date":"2017-12-10","stage_classifiercode":"99-12","member_number":"A88881","first_name":"WILLIAM","last_name":"DICKINSON","classification":"C","division":"LIMITED","hit_factor":2.2886},{"match_name":"FBPPC DECEMBER 2016 SPECIAL CLASSIFIER MATCH","match_date":"2016-12-10","stage_classifiercode":"99-12","member_number":"A79216","first_name":"ENOCH","last_name":"SMITH","classification":"U","division":"LIMITED","hit_factor":2.2876},{"match_name":"LCHG May USPSA","match_date":"2017-05-21","stage_classifiercode":"99-12","member_number":"A101628","first_name":"CLINT","last_name":"MARCOTT","classification":"U","division":"LIMITED","hit_factor":2.2876},{"match_name":"Hosemasters  3rd Sunday Feburary 2017","match_date":"2017-02-12","stage_classifiercode":"99-12","member_number":"A98617","first_name":"BILLY","last_name":"BEECHER","classification":"C","division":"LIMITED","hit_factor":2.2852},{"match_name":"Springfield Tactical Shooters 06-07-2018","match_date":"2018-06-07","stage_classifiercode":"99-12","member_number":"\"\"","first_name":"JAMIE","last_name":"BLAKLEY","classification":"\"\"","division":"LIMITED","hit_factor":2.2799},{"match_name":"ECPS USPSA 17 Feb 18","match_date":"2018-02-16","stage_classifiercode":"99-12","member_number":"\"\"","first_name":"CAMILO","last_name":"CARRION","classification":"U","division":"LIMITED","hit_factor":2.2789},{"match_name":"BRSP Tuesday Night USPSA Match - Nov 14","match_date":"2017-11-15","stage_classifiercode":"99-12","member_number":"\"\"","first_name":"BRYAN","last_name":"TAPPEN","classification":"\"\"","division":"LIMITED","hit_factor":2.2785},{"match_name":"Colonial Rifle and Pistol Club June 2018 Special Classifier","match_date":"2018-06-02","stage_classifiercode":"99-12","member_number":"A109529","first_name":"JUAN","last_name":"FERNANDEZ","classification":"U","division":"LIMITED","hit_factor":2.276},{"match_name":"PIPS 06-14-2017","match_date":"2017-06-14","stage_classifiercode":"99-12","member_number":"FY58623","first_name":"MATT","last_name":"WEAVER","classification":"D","division":"LIMITED","hit_factor":2.2755},{"match_name":"North Mountain July ","match_date":"2016-07-17","stage_classifiercode":"99-12","member_number":"FY83924","first_name":"ARON","last_name":"TINTER","classification":"C","division":"LIMITED","hit_factor":2.2754},{"match_name":"BRSP Tuesday Night USPSA Match - Nov 14","match_date":"2017-11-15","stage_classifiercode":"99-12","member_number":"A106003","first_name":"ROGER","last_name":"CHAMPLIN","classification":"\"\"","division":"LIMITED","hit_factor":2.2713},{"match_name":"Rendezvous 8-24-16","match_date":"2016-08-25","stage_classifiercode":"99-12","member_number":"\"\"","first_name":"DEWEY","last_name":"R.","classification":"U","division":"LIMITED","hit_factor":2.2704},{"match_name":"Laser Ninja Dragon League USPSA August 2017","match_date":"2017-08-06","stage_classifiercode":"99-12","member_number":"\"\"","first_name":"CAIN","last_name":"ABALOS","classification":"U","division":"LIMITED","hit_factor":2.2674},{"match_name":"WTPS USPSA April Classifier Match 4-8-17","match_date":"2017-04-08","stage_classifiercode":"99-12","member_number":"TY90615","first_name":"RAY","last_name":"KEITH","classification":"C","division":"LIMITED","hit_factor":2.2673},{"match_name":"North Mountain July ","match_date":"2016-07-17","stage_classifiercode":"99-12","member_number":"TY83821","first_name":"DEREK","last_name":"EINSIG","classification":"C","division":"LIMITED","hit_factor":2.2634},{"match_name":"ECPS February 28th USPSA Pistol Match","match_date":"2016-02-28","stage_classifiercode":"99-12","member_number":"\"\"","first_name":"MEL","last_name":"MCLAUREN","classification":"U","division":"LIMITED","hit_factor":2.2612},{"match_name":"Payson Practical Pistol Sept 03 2016","match_date":"2016-09-03","stage_classifiercode":"99-12","member_number":"A14855","first_name":"FRANK","last_name":"LUCERO","classification":"U","division":"LIMITED","hit_factor":2.2533},{"match_name":"OFGC USPSA Match Feb 19th 2017","match_date":"2017-02-19","stage_classifiercode":"99-12","member_number":"TY92057","first_name":"CAMERON","last_name":"DASSO","classification":"C","division":"LIMITED","hit_factor":2.2505},{"match_name":"Hosemasters  3rd Sunday Feburary 2017","match_date":"2017-02-12","stage_classifiercode":"99-12","member_number":"TY92968","first_name":"SANDY","last_name":"BROADFOOT","classification":"C","division":"LIMITED","hit_factor":2.2483},{"match_name":"OK15 USPSA AT USSA","match_date":"2016-07-10","stage_classifiercode":"99-12","member_number":"A-92526","first_name":"BREANNA","last_name":"NOBLE","classification":"C","division":"LIMITED","hit_factor":2.2483},{"match_name":"Laser Ninja Dragon League USPSA August 2017","match_date":"2017-08-06","stage_classifiercode":"99-12","member_number":"\"\"","first_name":"ERIC","last_name":"ROTAN","classification":"U","division":"LIMITED","hit_factor":2.2459},{"match_name":"Paul Bunyan April 7th-8th All Classifier Match NW01","match_date":"2018-04-07","stage_classifiercode":"99-12","member_number":"\"\"","first_name":"MATTHEW","last_name":"NELSON","classification":"U","division":"LIMITED","hit_factor":2.2435},{"match_name":"WTPS USPSA April Classifier Match 4-8-17","match_date":"2017-04-08","stage_classifiercode":"99-12","member_number":"A96168","first_name":"TOM","last_name":"EVANS","classification":"U","division":"LIMITED","hit_factor":2.2388},{"match_name":"WNPL USPSA - Labour Day Weekend - Sept 2017","match_date":"2017-09-02","stage_classifiercode":"99-12","member_number":"PENDING","first_name":"BRANDON","last_name":"KITAOKA","classification":"U","division":"LIMITED","hit_factor":2.2381},{"match_name":"ECPS USPSA 17 Feb 18","match_date":"2018-02-16","stage_classifiercode":"99-12","member_number":"A106081","first_name":"CASEY","last_name":"DENNIS","classification":"D","division":"LIMITED","hit_factor":2.2364},{"match_name":"PCGC  June 2017","match_date":"2017-06-25","stage_classifiercode":"99-12","member_number":"\"\"","first_name":"MAC","last_name":"DAVIDSON","classification":"D","division":"LIMITED","hit_factor":2.2356},{"match_name":"FBURG April 2017 Level I USPSA ","match_date":"2017-04-01","stage_classifiercode":"99-12","member_number":"\"\"","first_name":"CHRIS","last_name":"O'DELL","classification":"U","division":"LIMITED","hit_factor":2.2339},{"match_name":"Chillicothe May-2017 USPSA Match","match_date":"2017-05-28","stage_classifiercode":"99-12","member_number":"A93135","first_name":"TODD","last_name":"SPURGEON","classification":"X","division":"LIMITED","hit_factor":2.23},{"match_name":"Minnetonka Game And Fish May 23","match_date":"2018-05-23","stage_classifiercode":"99-12","member_number":"\"\"","first_name":"TRAVIS","last_name":"WELLS","classification":"U","division":"LIMITED","hit_factor":2.2291},{"match_name":"ENPS May 2018 USPSA Match","match_date":"2018-05-06","stage_classifiercode":"99-12","member_number":"A16178","first_name":"DANNY","last_name":"MILAN","classification":"C","division":"LIMITED","hit_factor":2.2222},{"match_name":"Armory Indoor League","match_date":"2016-08-12","stage_classifiercode":"99-12","member_number":"L3660","first_name":"BURTON","last_name":"SMITH","classification":"B","division":"LIMITED","hit_factor":2.2163},{"match_name":"SSFGA & Master Blasters USPSA Classifier","match_date":"2018-11-17","stage_classifiercode":"99-12","member_number":"\"\"","first_name":"DEREK","last_name":"CHRISTERPHORSON","classification":"U","division":"LIMITED","hit_factor":2.215},{"match_name":"MCPSL Pistol 4-8-17","match_date":"2017-04-08","stage_classifiercode":"99-12","member_number":"A98364","first_name":"ERIK","last_name":"STONE","classification":"U","division":"LIMITED","hit_factor":2.2109},{"match_name":"Pinetucky USPSA 11-19-16","match_date":"2016-11-19","stage_classifiercode":"99-12","member_number":"A-94459","first_name":"DANNY","last_name":"OWENS","classification":"U","division":"LIMITED","hit_factor":2.2036},{"match_name":"Griffin USPSA Match Aug 2017","match_date":"2017-08-19","stage_classifiercode":"99-12","member_number":"A101297","first_name":"SANJA","last_name":"PADOLE","classification":"U","division":"LIMITED","hit_factor":2.2011},{"match_name":"Sept 3rd Uspsa   Pickaway","match_date":"2016-09-03","stage_classifiercode":"99-12","member_number":"\"\"","first_name":"SCOTT","last_name":"SPEAKMAN","classification":"\"\"","division":"LIMITED","hit_factor":2.2001},{"match_name":"APSA February 2017 USPSA Match","match_date":"2017-02-11","stage_classifiercode":"99-12","member_number":"\"\"","first_name":"CHRISTINA","last_name":"T","classification":"U","division":"LIMITED","hit_factor":2.1965},{"match_name":"MRPC USPSA Mar 2017","match_date":"2017-03-26","stage_classifiercode":"99-12","member_number":"A96252","first_name":"STEVE","last_name":"FISCHER","classification":"C","division":"LIMITED","hit_factor":2.1958},{"match_name":"RBGC 2018-7-28","match_date":"2018-07-28","stage_classifiercode":"99-12","member_number":"A100132","first_name":"CLINT","last_name":"BARNETT","classification":"B","division":"LIMITED","hit_factor":2.1954},{"match_name":"MSSA Uspsa Match","match_date":"2017-04-08","stage_classifiercode":"99-12","member_number":"\"\"","first_name":"LEE","last_name":"MCKNIGHT","classification":"\"\"","division":"LIMITED","hit_factor":2.1894},{"match_name":"YMM IPSC02 2016_09_11","match_date":"2016-09-11","stage_classifiercode":"99-12","member_number":"\"\"","first_name":"MATTHEW","last_name":"WOLTMAN","classification":"D","division":"LIMITED","hit_factor":2.1839},{"match_name":"Nampa USPSA February 1st","match_date":"2020-02-01","stage_classifiercode":"99-12","member_number":"A124366","first_name":"STEVEN","last_name":"BLAKESLEE","classification":"U","division":"LIMITED","hit_factor":2.1809},{"match_name":"Collin County USPSA Nov. 27 2016","match_date":"2016-11-25","stage_classifiercode":"99-12","member_number":"\"\"","first_name":"BLAKE","last_name":"MORRIS","classification":"U","division":"LIMITED","hit_factor":2.1721},{"match_name":"MSSA Uspsa Match","match_date":"2017-04-08","stage_classifiercode":"99-12","member_number":"A89751","first_name":"TONY","last_name":"TENNEY","classification":"C","division":"LIMITED","hit_factor":2.1704},{"match_name":"PCGC  June 2017","match_date":"2017-06-25","stage_classifiercode":"99-12","member_number":"A90756","first_name":"RON","last_name":"AYLESTOCK","classification":"D","division":"LIMITED","hit_factor":2.1652},{"match_name":"RBGC 2018-7-28","match_date":"2018-07-28","stage_classifiercode":"99-12","member_number":"\"\"","first_name":"LARRY","last_name":"CALDWELL","classification":"U","division":"LIMITED","hit_factor":2.1553},{"match_name":"LdF USPSA Match July 14 2018","match_date":"2018-07-14","stage_classifiercode":"99-12","member_number":"TY80157","first_name":"DAVE","last_name":"DEZAN","classification":"M","division":"LIMITED","hit_factor":2.1546},{"match_name":"Prescott 3rd Sunday USPSA 11-20-2016","match_date":"2016-11-20","stage_classifiercode":"99-12","member_number":"L1016","first_name":"ALLEN","last_name":"BAUDER","classification":"C","division":"LIMITED","hit_factor":2.145},{"match_name":"USC August 2016","match_date":"2016-08-13","stage_classifiercode":"99-12","member_number":"\"\"","first_name":"PAYTON","last_name":"BROWN","classification":"U","division":"LIMITED","hit_factor":2.1441},{"match_name":"AAPS AAFG Special Classifier Match - March 31 2018","match_date":"2018-03-31","stage_classifiercode":"99-12","member_number":"A102397","first_name":"JIM","last_name":"GIVENS","classification":"D","division":"LIMITED","hit_factor":2.1438},{"match_name":"Atlanta Practical Shooters March 2016 USPSA - Classifier Match","match_date":"2016-03-06","stage_classifiercode":"99-12","member_number":"\"\"","first_name":"ERIC","last_name":"PUTNAM","classification":"U","division":"LIMITED","hit_factor":2.1416},{"match_name":"SFPS 05-21-17 Superclassifier Gun1","match_date":"2017-05-21","stage_classifiercode":"99-12","member_number":"A86861","first_name":"KING","last_name":"CAVALIER","classification":"U","division":"LIMITED","hit_factor":2.1402},{"match_name":"YMM IPSC02 2016_09_11","match_date":"2016-09-11","stage_classifiercode":"99-12","member_number":"\"\"","first_name":"CALEB","last_name":"FITSCHEN","classification":"D","division":"LIMITED","hit_factor":2.1386},{"match_name":"PCGC  June 2017","match_date":"2017-06-25","stage_classifiercode":"99-12","member_number":"\"\"","first_name":"JIM","last_name":"THAXTON","classification":"U","division":"LIMITED","hit_factor":2.1384},{"match_name":"Minnetonka Game And Fish May 23","match_date":"2018-05-23","stage_classifiercode":"99-12","member_number":"\"\"","first_name":"STEVE","last_name":"LUBERS","classification":"U","division":"LIMITED","hit_factor":2.1349},{"match_name":"OFGC USPSA Match 10-21-18","match_date":"2018-10-21","stage_classifiercode":"99-12","member_number":"A92125","first_name":"MELISSA","last_name":"NOBLE","classification":"C","division":"LIMITED","hit_factor":2.1248},{"match_name":"ECPS USPSA 17 Feb 18","match_date":"2018-02-16","stage_classifiercode":"99-12","member_number":"A107791","first_name":"KENNETH","last_name":"GASCOIGNE","classification":"U","division":"LIMITED","hit_factor":2.1245},{"match_name":"Griffin USPSA Match Aug 2017","match_date":"2017-08-19","stage_classifiercode":"99-12","member_number":"\"\"","first_name":"GLENN","last_name":"MARSHALL","classification":"U","division":"LIMITED","hit_factor":2.1239},{"match_name":"Atlanta Practical Shooters March 2016 USPSA - Classifier Match","match_date":"2016-03-06","stage_classifiercode":"99-12","member_number":"\"\"","first_name":"KARON","last_name":"PETERS","classification":"U","division":"LIMITED","hit_factor":2.1226},{"match_name":"Pinetucky USPSA 11-19-16","match_date":"2016-11-19","stage_classifiercode":"99-12","member_number":"PEN","first_name":"JOEY","last_name":"HODGE","classification":"U","division":"LIMITED","hit_factor":2.1189},{"match_name":"Triforce Practical Shooters at BigWoodsGoods","match_date":"2016-09-22","stage_classifiercode":"99-12","member_number":"TY89180","first_name":"CHARLES","last_name":"HOLLANDS","classification":"D","division":"LIMITED","hit_factor":2.1179},{"match_name":"WNPL USPSA - Labour Day Weekend - Sept 2017","match_date":"2017-09-02","stage_classifiercode":"99-12","member_number":"A26514","first_name":"CHRISTOPHER","last_name":"NYBERG","classification":"U","division":"LIMITED","hit_factor":2.1135},{"match_name":"Brothers N Arms February 2018 USPSA Match","match_date":"2018-02-17","stage_classifiercode":"99-12","member_number":"TY79996","first_name":"ROBERT","last_name":"BAUCUM","classification":"U","division":"LIMITED","hit_factor":2.1108},{"match_name":"Pinetucky USPSA 11-19-16","match_date":"2016-11-19","stage_classifiercode":"99-12","member_number":"A99641","first_name":"DENISE","last_name":"NICODEMUS","classification":"U","division":"LIMITED","hit_factor":2.1082},{"match_name":"SSP Super Classifier 1-30-16","match_date":"2016-01-30","stage_classifiercode":"99-12","member_number":"A88500","first_name":"ADAM","last_name":"DAVINO","classification":"C","division":"LIMITED","hit_factor":2.103},{"match_name":"LdF USPSA Match July 14 2018","match_date":"2018-07-14","stage_classifiercode":"99-12","member_number":"TY1524","first_name":"WILLIAM","last_name":"KUEHL","classification":"A","division":"LIMITED","hit_factor":2.0992},{"match_name":"TPS USPSA - September 2016 - Talon Range","match_date":"2016-09-03","stage_classifiercode":"99-12","member_number":"\"\"","first_name":"BRIAN","last_name":"WOOD","classification":"U","division":"LIMITED","hit_factor":2.0962},{"match_name":"2020-03 Bone Creek USPSA","match_date":"2020-03-01","stage_classifiercode":"99-12","member_number":"A95318","first_name":"JOSEPH","last_name":"NEWCOMB","classification":"D","division":"LIMITED","hit_factor":2.0938},{"match_name":"TPS USPSA PISTOL - May 2016 - Talon Range","match_date":"2016-05-07","stage_classifiercode":"99-12","member_number":"\"\"","first_name":"THOMAS","last_name":"HITT","classification":"U","division":"LIMITED","hit_factor":2.0848},{"match_name":"WSPS OCTOBER 2017 USPSA MATCH","match_date":"2017-10-21","stage_classifiercode":"99-12","member_number":"\"\"","first_name":"KEVIN","last_name":"MCNAMARA","classification":"X","division":"LIMITED","hit_factor":2.0819},{"match_name":"USPSA","match_date":"2016-06-04","stage_classifiercode":"99-12","member_number":"ty57936","first_name":"JAY","last_name":"TUCKER","classification":"C","division":"LIMITED","hit_factor":2.0758},{"match_name":"USPSA","match_date":"2018-04-28","stage_classifiercode":"99-12","member_number":"\"\"","first_name":"KENNY","last_name":"THORSTENSON 2","classification":"\"\"","division":"LIMITED","hit_factor":2.071},{"match_name":"TPS USPSA PISTOL - May 2016 - Talon Range","match_date":"2016-05-07","stage_classifiercode":"99-12","member_number":"\"\"","first_name":"ADAM","last_name":"ORY","classification":"U","division":"LIMITED","hit_factor":2.0684},{"match_name":"EIPS  1/19/2017","match_date":"2017-01-19","stage_classifiercode":"99-12","member_number":"A100000","first_name":"PAULA","last_name":"ROSS","classification":"U","division":"LIMITED","hit_factor":2.0649},{"match_name":"SSFGA & Master Blasters USPSA Classifier","match_date":"2018-11-17","stage_classifiercode":"99-12","member_number":"A106906","first_name":"KENNETH","last_name":"SLIGAR","classification":"D","division":"LIMITED","hit_factor":2.0646},{"match_name":"MCPSL Pistol 4-9-16","match_date":"2016-04-09","stage_classifiercode":"99-12","member_number":"Ty37712","first_name":"AUDRA","last_name":"GOYETTE","classification":"D","division":"LIMITED","hit_factor":2.0612},{"match_name":"ECPS USPSA 17 Feb 18","match_date":"2018-02-16","stage_classifiercode":"99-12","member_number":"A105257","first_name":"JULIE","last_name":"HARRISON","classification":"D","division":"LIMITED","hit_factor":2.0611},{"match_name":"CCPL 04102016","match_date":"2016-04-10","stage_classifiercode":"99-12","member_number":"A92260","first_name":"LAURI","last_name":"VAUGHN","classification":"D","division":"LIMITED","hit_factor":2.0579},{"match_name":"Rendezvous 8-24-16","match_date":"2016-08-25","stage_classifiercode":"99-12","member_number":"\"\"","first_name":"LOGAN","last_name":"H.","classification":"U","division":"LIMITED","hit_factor":2.0571},{"match_name":"ECPS February 28th USPSA Pistol Match","match_date":"2016-02-28","stage_classifiercode":"99-12","member_number":"Pen","first_name":"JASON","last_name":"HEDRICK","classification":"U","division":"LIMITED","hit_factor":2.0498},{"match_name":"ECPS USPSA 17 Feb 18","match_date":"2018-02-16","stage_classifiercode":"99-12","member_number":"\"\"","first_name":"BRIAN","last_name":"WOOD","classification":"U","division":"LIMITED","hit_factor":2.0492},{"match_name":"SFPS 05-21-17 Superclassifier Gun1","match_date":"2017-05-21","stage_classifiercode":"99-12","member_number":"A97353","first_name":"MATT","last_name":"STEFFES","classification":"U","division":"LIMITED","hit_factor":2.0488},{"match_name":"FBPPC DECEMBER 2016 SPECIAL CLASSIFIER MATCH","match_date":"2016-12-10","stage_classifiercode":"99-12","member_number":"PEN","first_name":"HECTOR","last_name":"BLANCO","classification":"U","division":"LIMITED","hit_factor":2.0457},{"match_name":"Ducky Shoot August","match_date":"2018-08-18","stage_classifiercode":"99-12","member_number":"A-112881","first_name":"RICK","last_name":"TROJANWSKI","classification":"U","division":"LIMITED","hit_factor":2.0339},{"match_name":"GAS October 6th Match","match_date":"2018-10-06","stage_classifiercode":"99-12","member_number":"A113975","first_name":"GEORGE","last_name":"JOUFLAS","classification":"U","division":"LIMITED","hit_factor":2.0329},{"match_name":"OFGC USPSA Match Feb 19th 2017","match_date":"2017-02-19","stage_classifiercode":"99-12","member_number":"TY72859","first_name":"CAROL","last_name":"STRIPLIN","classification":"D","division":"LIMITED","hit_factor":2.0325},{"match_name":"USPSA","match_date":"2016-06-04","stage_classifiercode":"99-12","member_number":"\"\"","first_name":"JASON","last_name":"BARENTINE","classification":"U","division":"LIMITED","hit_factor":2.0309},{"match_name":"OFGC USPSA Match 10-21-18","match_date":"2018-10-21","stage_classifiercode":"99-12","member_number":"\"\"","first_name":"WES","last_name":"YOUNG","classification":"U","division":"LIMITED","hit_factor":2.0302},{"match_name":"LIPSA - November 4th 2018 - USPSA Classifier Match","match_date":"2018-11-04","stage_classifiercode":"99-12","member_number":"TY84200","first_name":"PAUL","last_name":"MARTELLO","classification":"B","division":"LIMITED","hit_factor":2.0216},{"match_name":"MSSA Uspsa Match","match_date":"2017-04-08","stage_classifiercode":"99-12","member_number":"A97297","first_name":"MATTHEW","last_name":"EATON","classification":"D","division":"LIMITED","hit_factor":2.014},{"match_name":"WNPL USPSA - Labour Day Weekend - Sept 2017","match_date":"2017-09-02","stage_classifiercode":"99-12","member_number":"A104368","first_name":"MELANIE","last_name":"BRANTINGHAM","classification":"U","division":"LIMITED","hit_factor":2.0089},{"match_name":"Henry Coumty Gun Club USPSA","match_date":"2021-05-15","stage_classifiercode":"99-12","member_number":"A132716","first_name":"STEVE","last_name":"LEADY","classification":"U","division":"LIMITED","hit_factor":2.008},{"match_name":"SSFGA & Master Blasters USPSA Classifier","match_date":"2018-11-17","stage_classifiercode":"99-12","member_number":"TY101830","first_name":"BRIAN","last_name":"CHAREST","classification":"U","division":"LIMITED","hit_factor":2.0013},{"match_name":"WNPL USPSA - Labour Day Weekend - Sept 2017","match_date":"2017-09-02","stage_classifiercode":"99-12","member_number":"PENDING","first_name":"REY","last_name":"SORIANO","classification":"U","division":"LIMITED","hit_factor":1.9856},{"match_name":"ECPS USPSA 17 Feb 18","match_date":"2018-02-16","stage_classifiercode":"99-12","member_number":"\"\"","first_name":"MICAH","last_name":"SIBERT","classification":"U","division":"LIMITED","hit_factor":1.9838},{"match_name":"Griffin USPSA Match Aug 2017","match_date":"2017-08-19","stage_classifiercode":"99-12","member_number":"PEN","first_name":"ANTHONY","last_name":"JOHNSON","classification":"U","division":"LIMITED","hit_factor":1.9828},{"match_name":"Green Valley February 2017","match_date":"2017-02-25","stage_classifiercode":"99-12","member_number":"A-91866","first_name":"MICHAEL","last_name":"HUGHES","classification":"C","division":"LIMITED","hit_factor":1.9826},{"match_name":"APSA February 2017 USPSA Match","match_date":"2017-02-11","stage_classifiercode":"99-12","member_number":"TY78711","first_name":"JON","last_name":"WAKEMAN","classification":"D","division":"LIMITED","hit_factor":1.9812},{"match_name":"OK15 USPSA AT USSA","match_date":"2016-07-10","stage_classifiercode":"99-12","member_number":"A96272","first_name":"KELLY","last_name":"BROWN","classification":"U","division":"LIMITED","hit_factor":1.9778},{"match_name":"Shasta Shooters August 2016","match_date":"2016-08-13","stage_classifiercode":"99-12","member_number":"ty21065","first_name":"PETE","last_name":"RAY","classification":"C","division":"LIMITED","hit_factor":1.9744},{"match_name":"EL06 USPSA June 27 2021","match_date":"2021-06-27","stage_classifiercode":"99-12","member_number":"TY-14667","first_name":"DAVID","last_name":"MARTIN","classification":"B","division":"LIMITED","hit_factor":1.9718},{"match_name":"Chillicothe May-2017 USPSA Match","match_date":"2017-05-28","stage_classifiercode":"99-12","member_number":"\"\"","first_name":"JEREMY","last_name":"BRAKEMAN","classification":"U","division":"LIMITED","hit_factor":1.9625},{"match_name":"OK15 USPSA AT USSA","match_date":"2016-07-10","stage_classifiercode":"99-12","member_number":"A-96266","first_name":"HAILEY","last_name":"CHAMBERLAIN","classification":"U","division":"LIMITED","hit_factor":1.9544},{"match_name":"DWB - Deadwood Boys USPSA 18 February 2018","match_date":"2018-02-18","stage_classifiercode":"99-12","member_number":"a10228","first_name":"DENNIS","last_name":"MANALO","classification":"U","division":"LIMITED","hit_factor":1.9517},{"match_name":"Brothers N Arms August 2018 USPSA Match","match_date":"2018-08-18","stage_classifiercode":"99-12","member_number":"A112715","first_name":"TERRY","last_name":"ST.GERMAIN","classification":"U","division":"LIMITED","hit_factor":1.9517},{"match_name":"FBURG April 2017 Level I USPSA ","match_date":"2017-04-01","stage_classifiercode":"99-12","member_number":"A94856","first_name":"MIKE","last_name":"VARGESKO","classification":"D","division":"LIMITED","hit_factor":1.9489},{"match_name":"OK15 USPSA AT USSA","match_date":"2016-07-10","stage_classifiercode":"99-12","member_number":"TY92057","first_name":"CAMERON","last_name":"DASSO","classification":"C","division":"LIMITED","hit_factor":1.9319},{"match_name":"WTPS USPSA April Classifier Match 4-8-17","match_date":"2017-04-08","stage_classifiercode":"99-12","member_number":"A97201","first_name":"KATY","last_name":"HARKEY","classification":"D","division":"LIMITED","hit_factor":1.93},{"match_name":"Springfield Tactical Shooters 06-07-2018","match_date":"2018-06-07","stage_classifiercode":"99-12","member_number":"A107625","first_name":"CHUCK","last_name":"MCLAUGHLIN","classification":"\"\"","division":"LIMITED","hit_factor":1.9231},{"match_name":"GAS October 6th Match","match_date":"2018-10-06","stage_classifiercode":"99-12","member_number":"\"\"","first_name":"EVAN","last_name":"KELLY","classification":"U","division":"LIMITED","hit_factor":1.9218},{"match_name":"Pinetucky USPSA 11-19-16","match_date":"2016-11-19","stage_classifiercode":"99-12","member_number":"\"\"","first_name":"MARTIN","last_name":"MORRIS","classification":"U","division":"LIMITED","hit_factor":1.9194},{"match_name":"SPSA USPSA March 4th Sat match","match_date":"2017-03-25","stage_classifiercode":"99-12","member_number":"\"\"","first_name":"MEGAN","last_name":"KLEIN","classification":"U","division":"LIMITED","hit_factor":1.9115},{"match_name":"Powell County Action Shooters July 17 2021","match_date":"2021-07-17","stage_classifiercode":"99-12","member_number":"a135749","first_name":"ASHLEY","last_name":"HASH","classification":"U","division":"LIMITED","hit_factor":1.9101},{"match_name":"Ducky Shoot August","match_date":"2018-08-18","stage_classifiercode":"99-12","member_number":"A-58214","first_name":"ELDON","last_name":"MCPHERSON","classification":"C","division":"LIMITED","hit_factor":1.8882},{"match_name":"Griffin USPSA Match Aug 2017","match_date":"2017-08-19","stage_classifiercode":"99-12","member_number":"PEN","first_name":"CARLOS","last_name":"LAYSON","classification":"B","division":"LIMITED","hit_factor":1.8843},{"match_name":"SFPC September USPSA Special Classifier match","match_date":"2016-09-04","stage_classifiercode":"99-12","member_number":"A74826","first_name":"ANTHONY","last_name":"YEBER","classification":"B","division":"LIMITED","hit_factor":1.8828},{"match_name":"OFGC USPSA Match 10-21-18","match_date":"2018-10-21","stage_classifiercode":"99-12","member_number":"A72859","first_name":"CAROL","last_name":"STRIPLIN","classification":"D","division":"LIMITED","hit_factor":1.882},{"match_name":"TPS USPSA PISTOL - May 2016 - Talon Range","match_date":"2016-05-07","stage_classifiercode":"99-12","member_number":"\"\"","first_name":"PETER","last_name":"WESTRICH","classification":"U","division":"LIMITED","hit_factor":1.8759},{"match_name":"Fairfax PS USPSA  2018 September","match_date":"2018-09-18","stage_classifiercode":"99-12","member_number":"A97496","first_name":"FREDA","last_name":"ELLINGHAUS","classification":"U","division":"LIMITED","hit_factor":1.875},{"match_name":"LCHG May USPSA","match_date":"2017-05-21","stage_classifiercode":"99-12","member_number":"\"\"","first_name":"LEATA","last_name":"ENGLISH","classification":"D","division":"LIMITED","hit_factor":1.8692},{"match_name":"FBURG April 2017 Level I USPSA ","match_date":"2017-04-01","stage_classifiercode":"99-12","member_number":"NA","first_name":"NICHOLAS","last_name":"SCHUETTER","classification":"X","division":"LIMITED","hit_factor":1.8685},{"match_name":"Range E11even Feb 2018 USPSA","match_date":"2018-02-24","stage_classifiercode":"99-12","member_number":"TY82683","first_name":"BRIAN","last_name":"WOLFF","classification":"B","division":"LIMITED","hit_factor":1.8667},{"match_name":"TAC2 USPSA August 2017","match_date":"2017-08-05","stage_classifiercode":"99-12","member_number":"\"\"","first_name":"ROB","last_name":"HALL","classification":"U","division":"LIMITED","hit_factor":1.8519},{"match_name":"ECPS USPSA 17 Feb 18","match_date":"2018-02-16","stage_classifiercode":"99-12","member_number":"A106630","first_name":"TAMMY","last_name":"PRELL","classification":"U","division":"LIMITED","hit_factor":1.8452},{"match_name":"2020-03 Bone Creek USPSA","match_date":"2020-03-01","stage_classifiercode":"99-12","member_number":"A107973","first_name":"GARY","last_name":"NEUBAUM","classification":"D","division":"LIMITED","hit_factor":1.8437},{"match_name":"Rockcastle USPSA Nov 28 2015","match_date":"2015-11-28","stage_classifiercode":"99-12","member_number":"\"\"","first_name":"KEVIN","last_name":"MORGAN","classification":"U","division":"LIMITED","hit_factor":1.842},{"match_name":"OFGC USPSA Match Feb 19th 2017","match_date":"2017-02-19","stage_classifiercode":"99-12","member_number":"A92526","first_name":"BREANNA","last_name":"NOBLE","classification":"C","division":"LIMITED","hit_factor":1.8341},{"match_name":"NISA April Classifer Match 2016","match_date":"2016-04-24","stage_classifiercode":"99-12","member_number":"a92117","first_name":"CHRISTOPHER","last_name":"THIES","classification":"U","division":"LIMITED","hit_factor":1.832},{"match_name":"PIPS 06-14-2017","match_date":"2017-06-14","stage_classifiercode":"99-12","member_number":"PEN","first_name":"CARL","last_name":"SZCZEPANSKI","classification":"U","division":"LIMITED","hit_factor":1.8297},{"match_name":"LCHG May USPSA","match_date":"2017-05-21","stage_classifiercode":"99-12","member_number":"A102922","first_name":"TONY","last_name":"REBO","classification":"U","division":"LIMITED","hit_factor":1.8219},{"match_name":"Griffin USPSA Match Aug 2017","match_date":"2017-08-19","stage_classifiercode":"99-12","member_number":"Fy5264","first_name":"BILL","last_name":"COX","classification":"C","division":"LIMITED","hit_factor":1.8202},{"match_name":"FBURG April 2017 Level I USPSA ","match_date":"2017-04-01","stage_classifiercode":"99-12","member_number":"TY76353","first_name":"GARY","last_name":"WOTRING","classification":"D","division":"LIMITED","hit_factor":1.8197},{"match_name":"Gunsmoke Action Shooters USPSA April 18","match_date":"2018-04-07","stage_classifiercode":"99-12","member_number":"\"\"","first_name":"DAVE","last_name":"EUBANKS","classification":"U","division":"LIMITED","hit_factor":1.8194},{"match_name":"ENPS May 2018 USPSA Match","match_date":"2018-05-06","stage_classifiercode":"99-12","member_number":"A103513","first_name":"JEFFORY","last_name":"STUMPF","classification":"U","division":"LIMITED","hit_factor":1.8153},{"match_name":"CVSC 06-25-2017","match_date":"2017-06-25","stage_classifiercode":"99-12","member_number":"\"\"","first_name":"MARVIN","last_name":"ALDRICH","classification":"U","division":"LIMITED","hit_factor":1.8075},{"match_name":"PCGC  June 2017","match_date":"2017-06-25","stage_classifiercode":"99-12","member_number":"\"\"","first_name":"NICK","last_name":"ALBAMONT","classification":"U","division":"LIMITED","hit_factor":1.7949},{"match_name":"BRC_20170611","match_date":"2017-06-11","stage_classifiercode":"99-12","member_number":"A91619","first_name":"SONNY","last_name":"CHAN","classification":"B","division":"LIMITED","hit_factor":1.7884},{"match_name":"BSTRC Dec 20 2017","match_date":"2017-12-20","stage_classifiercode":"99-12","member_number":"\"\"","first_name":"ALEX","last_name":"WISE","classification":"U","division":"LIMITED","hit_factor":1.7826},{"match_name":"NTPS-SE August 2016","match_date":"2016-08-20","stage_classifiercode":"99-12","member_number":"NONE","first_name":"JASON","last_name":"JUDGE","classification":"U","division":"LIMITED","hit_factor":1.7781},{"match_name":"Piscataqua  Master Blasters USPSA Special Classifier","match_date":"2017-12-03","stage_classifiercode":"99-12","member_number":"A106906","first_name":"KENNETH","last_name":"SLIGAR","classification":"U","division":"LIMITED","hit_factor":1.7744},{"match_name":"Green Valley USPSA May Classifier","match_date":"2018-05-09","stage_classifiercode":"99-12","member_number":"A83936","first_name":"MATT","last_name":"GUNDLACH","classification":"U","division":"LIMITED","hit_factor":1.7736},{"match_name":"MSA USPSA Special Classifier 12-4-16","match_date":"2016-12-04","stage_classifiercode":"99-12","member_number":"A-95342","first_name":"ROLAND","last_name":"WOLF","classification":"U","division":"LIMITED","hit_factor":1.7724},{"match_name":"MPSA USPSA 111817","match_date":"2017-11-18","stage_classifiercode":"99-12","member_number":"A90846","first_name":"MICHAEL","last_name":"COFER","classification":"C","division":"LIMITED","hit_factor":1.7699},{"match_name":"MSA USPSA Special Classifier 12-4-16","match_date":"2016-12-04","stage_classifiercode":"99-12","member_number":"A83731","first_name":"ALEXANDER","last_name":"HALE - LIM","classification":"U","division":"LIMITED","hit_factor":1.767},{"match_name":"USC August 2016","match_date":"2016-08-13","stage_classifiercode":"99-12","member_number":"A92647","first_name":"RICK","last_name":"HARDING","classification":"U","division":"LIMITED","hit_factor":1.7571},{"match_name":"SSS USPSA February 2020","match_date":"2020-02-16","stage_classifiercode":"99-12","member_number":"A124744","first_name":"SHARIF","last_name":"PRYCE","classification":"U (Unclassified)","division":"LIMITED","hit_factor":1.7472},{"match_name":"DWB - Deadwood Boys USPSA 18 February 2018","match_date":"2018-02-18","stage_classifiercode":"99-12","member_number":"\"\"","first_name":"JOHN VELOSO","last_name":"OUANO","classification":"U","division":"LIMITED","hit_factor":1.747},{"match_name":"CCPL 04102016","match_date":"2016-04-10","stage_classifiercode":"99-12","member_number":"\"\"","first_name":"JIM","last_name":"ADLER","classification":"B","division":"LIMITED","hit_factor":1.7435},{"match_name":"Minnetonka Game And Fish May 23","match_date":"2018-05-23","stage_classifiercode":"99-12","member_number":"\"\"","first_name":"KIRK","last_name":"HUGHES","classification":"U","division":"LIMITED","hit_factor":1.7357},{"match_name":"2020-03 Bone Creek USPSA","match_date":"2020-03-01","stage_classifiercode":"99-12","member_number":"A80501","first_name":"JON-LUC","last_name":"RUBEN","classification":"C","division":"LIMITED","hit_factor":1.7341},{"match_name":"USPSA MO21 Special Classifier 2Alpha SBRC February 27 2021","match_date":"2021-02-27","stage_classifiercode":"99-12","member_number":"A51402","first_name":"DOC (WAYNE)","last_name":"WELSHER","classification":"B","division":"LIMITED","hit_factor":1.7309},{"match_name":"Springfield Tactical Shooters 06-07-2018","match_date":"2018-06-07","stage_classifiercode":"99-12","member_number":"A107857","first_name":"MADISON","last_name":"BOEHLER","classification":"\"\"","division":"LIMITED","hit_factor":1.7306},{"match_name":"WNPL USPSA - Labour Day Weekend - Sept 2017","match_date":"2017-09-02","stage_classifiercode":"99-12","member_number":"FY95291","first_name":"AUSTIN","last_name":"HULL","classification":"U","division":"LIMITED","hit_factor":1.7256},{"match_name":"H&H June Match","match_date":"2016-06-26","stage_classifiercode":"99-12","member_number":"\"\"","first_name":"KENNY","last_name":"SHROPSHIRE","classification":"U","division":"LIMITED","hit_factor":1.7222},{"match_name":"Emmett September Match","match_date":"2016-09-24","stage_classifiercode":"99-12","member_number":"a45803","first_name":"DANNY","last_name":"QUINTANA","classification":"D","division":"LIMITED","hit_factor":1.7198},{"match_name":"LdF 4th Saturday Match","match_date":"2016-01-23","stage_classifiercode":"99-12","member_number":"PEN","first_name":"MARIO","last_name":"HALE","classification":"U","division":"LIMITED","hit_factor":1.7178},{"match_name":"17s PSC - Feb 2017 - USPSA match","match_date":"2017-02-04","stage_classifiercode":"99-12","member_number":"\"\"","first_name":"IAN","last_name":"MERCER","classification":"U","division":"LIMITED","hit_factor":1.7112},{"match_name":"ORSA USPSA October 2016","match_date":"2016-10-15","stage_classifiercode":"99-12","member_number":"PEN","first_name":"DAVE","last_name":"MOTT","classification":"U","division":"LIMITED","hit_factor":1.7087},{"match_name":"MPSA USPSA 111817","match_date":"2017-11-18","stage_classifiercode":"99-12","member_number":"A90453","first_name":"JASON","last_name":"PETRO","classification":"C","division":"LIMITED","hit_factor":1.7039},{"match_name":"CASA Classifier match April 2018","match_date":"2018-04-08","stage_classifiercode":"99-12","member_number":"TY101764","first_name":"KEITH","last_name":"DE NOBLE","classification":"U","division":"LIMITED","hit_factor":1.7036},{"match_name":"MPSA 2021-08-21","match_date":"2021-08-21","stage_classifiercode":"99-12","member_number":"L4339","first_name":"COLIN","last_name":"HARTERY","classification":"C","division":"LIMITED","hit_factor":1.6949},{"match_name":"Richmond Hot Shots USPSA Classifier Match Sat April 8-2017","match_date":"2017-04-08","stage_classifiercode":"99-12","member_number":"TY63012","first_name":"MANUEL","last_name":"NEWMAN","classification":"M","division":"LIMITED","hit_factor":1.6923},{"match_name":"Palmetto Gun Club - February 2018 USPSA","match_date":"2018-02-03","stage_classifiercode":"99-12","member_number":"FY81806","first_name":"ANDREW","last_name":"CRENSHAW","classification":"B","division":"LIMITED","hit_factor":1.6915},{"match_name":"Griffin USPSA Match Aug 2017","match_date":"2017-08-19","stage_classifiercode":"99-12","member_number":"PEN","first_name":"TODD","last_name":"MCGAHEE","classification":"U","division":"LIMITED","hit_factor":1.6854},{"match_name":"EASTER EGG HUNT AREA 59  ALL CLASSFIER MATCH","match_date":"2017-04-15","stage_classifiercode":"99-12","member_number":"A97402","first_name":"STEVEN","last_name":"ROLAND","classification":"U","division":"LIMITED","hit_factor":1.6854},{"match_name":"Springfield Tactical Shooters 06-07-2018","match_date":"2018-06-07","stage_classifiercode":"99-12","member_number":"A95946","first_name":"PAUL","last_name":"EMERY","classification":"C","division":"LIMITED","hit_factor":1.6848},{"match_name":"North Mountain July ","match_date":"2016-07-17","stage_classifiercode":"99-12","member_number":"A91520","first_name":"JEFF","last_name":"WHEELER","classification":"C","division":"LIMITED","hit_factor":1.6832},{"match_name":"Powell County Action Shooters July 17 2021","match_date":"2021-07-17","stage_classifiercode":"99-12","member_number":"A-101014","first_name":"LEATA","last_name":"ENGLISH","classification":"D","division":"LIMITED","hit_factor":1.6692},{"match_name":"RBGC 2018-7-28","match_date":"2018-07-28","stage_classifiercode":"99-12","member_number":"A106074","first_name":"ANTHONY","last_name":"JOHNSON","classification":"D","division":"LIMITED","hit_factor":1.6682},{"match_name":"USPSA MO21 Special Classifier 2Alpha SBRC February 27 2021","match_date":"2021-02-27","stage_classifiercode":"99-12","member_number":"A117501","first_name":"ROD","last_name":"COLEMAN","classification":"C","division":"LIMITED","hit_factor":1.6639},{"match_name":"Danville Rifle and Pistol Club USPSA IL17 April 21 2018","match_date":"2018-04-21","stage_classifiercode":"99-12","member_number":"A100973","first_name":"RONALD","last_name":"DRAPER","classification":"C","division":"LIMITED","hit_factor":1.6299},{"match_name":"APSA February 2017 USPSA Match","match_date":"2017-02-11","stage_classifiercode":"99-12","member_number":"\"\"","first_name":"LESLEY","last_name":"BRATRO","classification":"U","division":"LIMITED","hit_factor":1.6279},{"match_name":"LdF 4th Saturday Match","match_date":"2016-01-23","stage_classifiercode":"99-12","member_number":"A81018","first_name":"BART","last_name":"DEL RIO","classification":"A","division":"LIMITED","hit_factor":1.6153},{"match_name":"Springfield Tactical Shooters 09/03/2020","match_date":"2020-09-03","stage_classifiercode":"99-12","member_number":"A124709","first_name":"GREG","last_name":"HUDSPETH","classification":"\"\"","division":"LIMITED","hit_factor":1.6143},{"match_name":"Paul Bunyan April 7th-8th All Classifier Match NW01","match_date":"2018-04-07","stage_classifiercode":"99-12","member_number":"TY-98701","first_name":"ADRIAN","last_name":"MA","classification":"U","division":"LIMITED","hit_factor":1.6057},{"match_name":"Atlanta Practical Shooters March 2016 USPSA - Classifier Match","match_date":"2016-03-06","stage_classifiercode":"99-12","member_number":"\"\"","first_name":"LEO","last_name":"FORD","classification":"U","division":"LIMITED","hit_factor":1.605},{"match_name":"SFPC September USPSA Special Classifier match","match_date":"2016-09-04","stage_classifiercode":"99-12","member_number":"TY90993","first_name":"WAYNE","last_name":"OWENSBY","classification":"D","division":"LIMITED","hit_factor":1.6036},{"match_name":"Richmond Hot Shots USPSA Classifier Match Sat April 8-2017","match_date":"2017-04-08","stage_classifiercode":"99-12","member_number":"A94643","first_name":"CARLSON","last_name":"SETO","classification":"D","division":"LIMITED","hit_factor":1.59},{"match_name":"H&H June Match","match_date":"2016-06-26","stage_classifiercode":"99-12","member_number":"A84245","first_name":"BRYAN","last_name":"HOOVER","classification":"B","division":"LIMITED","hit_factor":1.5852},{"match_name":"Palmetto Gun Club - February 2018 USPSA","match_date":"2018-02-03","stage_classifiercode":"99-12","member_number":"\"\"","first_name":"RANDY","last_name":"CONE","classification":"U","division":"LIMITED","hit_factor":1.585},{"match_name":"MRPC USPSA Mar 2017","match_date":"2017-03-26","stage_classifiercode":"99-12","member_number":"\"\"","first_name":"SHANE","last_name":"SWEATT","classification":"\"\"","division":"LIMITED","hit_factor":1.581},{"match_name":"ORSA USPSA October 2016","match_date":"2016-10-15","stage_classifiercode":"99-12","member_number":"A21270","first_name":"BRUCE","last_name":"IHLENFELD","classification":"C","division":"LIMITED","hit_factor":1.5753},{"match_name":"Collin County USPSA Nov. 27 2016","match_date":"2016-11-25","stage_classifiercode":"99-12","member_number":"\"\"","first_name":"MARK","last_name":"FOWLER","classification":"\"\"","division":"LIMITED","hit_factor":1.5753},{"match_name":"WTPS USPSA April Classifier Match 4-8-17","match_date":"2017-04-08","stage_classifiercode":"99-12","member_number":"A94866","first_name":"WARREN","last_name":"BRITT","classification":"D","division":"LIMITED","hit_factor":1.5637},{"match_name":"AAPS AAFG Special Classifier Match - March 31 2018","match_date":"2018-03-31","stage_classifiercode":"99-12","member_number":"A86535","first_name":"RICK","last_name":"PAUKSTITUS","classification":"C","division":"LIMITED","hit_factor":1.5633},{"match_name":"EIPS  1/19/2017","match_date":"2017-01-19","stage_classifiercode":"99-12","member_number":"\"\"","first_name":"DAVE","last_name":"CHARLSON","classification":"\"\"","division":"LIMITED","hit_factor":1.5597},{"match_name":"SFPC March USPSA Match 2017","match_date":"2017-03-05","stage_classifiercode":"99-12","member_number":"\"\"","first_name":"ANDREW","last_name":"FORTNER","classification":"U","division":"LIMITED","hit_factor":1.5489},{"match_name":"EIPS  1/19/2017","match_date":"2017-01-19","stage_classifiercode":"99-12","member_number":"A74933","first_name":"JEFF","last_name":"CORY","classification":"U","division":"LIMITED","hit_factor":1.5413},{"match_name":"Brothers N Arms February 2018 USPSA Match","match_date":"2018-02-17","stage_classifiercode":"99-12","member_number":"PENDING","first_name":"RAY","last_name":"GRABERT","classification":"U","division":"LIMITED","hit_factor":1.5402},{"match_name":"Springfield Tactical Shooters 09/03/2020","match_date":"2020-09-03","stage_classifiercode":"99-12","member_number":"A62932","first_name":"RICHARD","last_name":"LANE","classification":"B","division":"LIMITED","hit_factor":1.5288},{"match_name":"RBGC 2018-7-28","match_date":"2018-07-28","stage_classifiercode":"99-12","member_number":"A84201","first_name":"ZANE","last_name":"RUTLEDGE","classification":"M","division":"LIMITED","hit_factor":1.5106},{"match_name":"Springfield Tactical Shooters 06-07-2018","match_date":"2018-06-07","stage_classifiercode":"99-12","member_number":"\"\"","first_name":"DONNIE","last_name":"DENNING","classification":"U","division":"LIMITED","hit_factor":1.4848},{"match_name":"Collin County USPSA Nov. 27 2016","match_date":"2016-11-25","stage_classifiercode":"99-12","member_number":"L3324","first_name":"TONY","last_name":"GLENNON","classification":"U","division":"LIMITED","hit_factor":1.4837},{"match_name":"DRRC Dec2016","match_date":"2016-12-03","stage_classifiercode":"99-12","member_number":"A92536","first_name":"WYN","last_name":"TRISKA","classification":"C","division":"LIMITED","hit_factor":1.4832},{"match_name":"Richmond Hot Shots February 7-2016 USPSA Match","match_date":"2016-02-07","stage_classifiercode":"99-12","member_number":"A82061","first_name":"APOLONIO","last_name":"PADRON","classification":"C","division":"LIMITED","hit_factor":1.4829},{"match_name":"Pinetucky USPSA 11-19-16","match_date":"2016-11-19","stage_classifiercode":"99-12","member_number":"\"\"","first_name":"SHAWN","last_name":"LIES","classification":"U","division":"LIMITED","hit_factor":1.4686},{"match_name":"COPS Feb 2017 USPSA Match","match_date":"2017-02-05","stage_classifiercode":"99-12","member_number":"A64553","first_name":"DAVID","last_name":"MARLOW","classification":"U","division":"LIMITED","hit_factor":1.4684},{"match_name":"USC August 2016","match_date":"2016-08-13","stage_classifiercode":"99-12","member_number":"\"\"","first_name":"DON","last_name":"BROERMANN","classification":"U","division":"LIMITED","hit_factor":1.4592},{"match_name":"LCSA USPSA ALL CLASSIFIER ","match_date":"2018-06-30","stage_classifiercode":"99-12","member_number":"A111561","first_name":"MARTIN","last_name":"SEDILKO","classification":"U","division":"LIMITED","hit_factor":1.4463},{"match_name":"USPSA MO21 Special Classifier 2Alpha SBRC February 27 2021","match_date":"2021-02-27","stage_classifiercode":"99-12","member_number":"A117002","first_name":"CODY","last_name":"AUTRY","classification":"C","division":"LIMITED","hit_factor":1.4362},{"match_name":"Smoke & Hope USPSA Apr 22 2017","match_date":"2017-04-22","stage_classifiercode":"99-12","member_number":"A101587","first_name":"SKEET","last_name":"ARCHER","classification":"U","division":"LIMITED","hit_factor":1.433},{"match_name":"ENPS May 2018 USPSA Match","match_date":"2018-05-06","stage_classifiercode":"99-12","member_number":"A98540","first_name":"NICHOLAS","last_name":"LUCART","classification":"B","division":"LIMITED","hit_factor":1.4239},{"match_name":"FBURG April 2017 Level I USPSA ","match_date":"2017-04-01","stage_classifiercode":"99-12","member_number":"\"\"","first_name":"BRIAN","last_name":"BALES","classification":"X","division":"LIMITED","hit_factor":1.417},{"match_name":"Springfield Tactical Shooters 06-07-2018","match_date":"2018-06-07","stage_classifiercode":"99-12","member_number":"\"\"","first_name":"RICK","last_name":"WENNEBORG","classification":"\"\"","division":"LIMITED","hit_factor":1.4158},{"match_name":"APSA February 2017 USPSA Match","match_date":"2017-02-11","stage_classifiercode":"99-12","member_number":"\"\"","first_name":"JOHN","last_name":"HUNT","classification":"\"\"","division":"LIMITED","hit_factor":1.4151},{"match_name":"Danville Rifle and Pistol Club USPSA IL17 April 21 2018","match_date":"2018-04-21","stage_classifiercode":"99-12","member_number":"\"\"","first_name":"MONICA","last_name":"DORSEY","classification":"X","division":"LIMITED","hit_factor":1.414},{"match_name":"MCPSL Pistol 4-8-17","match_date":"2017-04-08","stage_classifiercode":"99-12","member_number":"A98798","first_name":"JOHNNY","last_name":"BREWINGTON","classification":"D","division":"LIMITED","hit_factor":1.4126},{"match_name":"Atlanta Practical Shooters March 2016 USPSA - Classifier Match","match_date":"2016-03-06","stage_classifiercode":"99-12","member_number":"\"\"","first_name":"TOM","last_name":"BOAN","classification":"U","division":"LIMITED","hit_factor":1.4108},{"match_name":"MCPSL Pistol 4-8-17","match_date":"2017-04-08","stage_classifiercode":"99-12","member_number":"A90285","first_name":"CHRIS","last_name":"HOOVER","classification":"B","division":"LIMITED","hit_factor":1.4066},{"match_name":"ECPS USPSA 17 Feb 18","match_date":"2018-02-16","stage_classifiercode":"99-12","member_number":"\"\"","first_name":"JIMMY","last_name":"WOODLEY","classification":"U","division":"LIMITED","hit_factor":1.4052},{"match_name":"LCSA USPSA ALL CLASSIFIER ","match_date":"2018-06-30","stage_classifiercode":"99-12","member_number":"A98880","first_name":"JENN","last_name":"DEFAZIO","classification":"C","division":"LIMITED","hit_factor":1.4009},{"match_name":"CVSC 06-25-2017","match_date":"2017-06-25","stage_classifiercode":"99-12","member_number":"\"\"","first_name":"BRANDON","last_name":"PIERCE","classification":"U","division":"LIMITED","hit_factor":1.3911},{"match_name":"LCHG May USPSA","match_date":"2017-05-21","stage_classifiercode":"99-12","member_number":"A101587","first_name":"SKEET","last_name":"ARCHER","classification":"C","division":"LIMITED","hit_factor":1.3834},{"match_name":"LIPSA - November 4th 2018 - USPSA Classifier Match","match_date":"2018-11-04","stage_classifiercode":"99-12","member_number":"TY104475","first_name":"ED","last_name":"GOTTLIEB","classification":"D","division":"LIMITED","hit_factor":1.3832},{"match_name":"ECPS USPSA 17 Feb 18","match_date":"2018-02-16","stage_classifiercode":"99-12","member_number":"\"\"","first_name":"JAMES","last_name":"COZINE","classification":"U","division":"LIMITED","hit_factor":1.3797},{"match_name":"Griffin USPSA Match Aug 2017","match_date":"2017-08-19","stage_classifiercode":"99-12","member_number":"PEN","first_name":"LISA","last_name":"MCCLENDON","classification":"U","division":"LIMITED","hit_factor":1.3732},{"match_name":"Smoke & Hope USPSA Apr 22 2017","match_date":"2017-04-22","stage_classifiercode":"99-12","member_number":"\"\"","first_name":"SCOT","last_name":"BLOOMFIELD","classification":"U","division":"LIMITED","hit_factor":1.3582},{"match_name":"Payson Practical Pistol Sept 03 2016","match_date":"2016-09-03","stage_classifiercode":"99-12","member_number":"A98579","first_name":"TONY","last_name":"ALEXANDER","classification":"U","division":"LIMITED","hit_factor":1.3557},{"match_name":"COPS Feb 2017 USPSA Match","match_date":"2017-02-05","stage_classifiercode":"99-12","member_number":"TY93949","first_name":"KEITH","last_name":"SHORT","classification":"U","division":"LIMITED","hit_factor":1.3521},{"match_name":"COPS Feb 2017 USPSA Match","match_date":"2017-02-05","stage_classifiercode":"99-12","member_number":"\"\"","first_name":"SCOTT","last_name":"CORRIGAN","classification":"U","division":"LIMITED","hit_factor":1.3483},{"match_name":"Green Valley February 2017","match_date":"2017-02-25","stage_classifiercode":"99-12","member_number":"PEN","first_name":"ARNOLD","last_name":"RIVERA","classification":"U","division":"LIMITED","hit_factor":1.3468},{"match_name":"Holmen USPSA Mar 26 2017","match_date":"2017-03-26","stage_classifiercode":"99-12","member_number":"A101958","first_name":"JOE","last_name":"SCAFFIDI","classification":"U","division":"LIMITED","hit_factor":1.3369},{"match_name":"Chillicothe May-2017 USPSA Match","match_date":"2017-05-28","stage_classifiercode":"99-12","member_number":"\"\"","first_name":"ASHTON","last_name":"DOTY","classification":"U","division":"LIMITED","hit_factor":1.3343},{"match_name":"Danville Rifle and Pistol Club USPSA IL17 April 21 2018","match_date":"2018-04-21","stage_classifiercode":"99-12","member_number":"\"\"","first_name":"MIKE","last_name":"CROSS","classification":"U","division":"LIMITED","hit_factor":1.326},{"match_name":"ECPS USPSA 17 Feb 18","match_date":"2018-02-16","stage_classifiercode":"99-12","member_number":"A97438","first_name":"VIC","last_name":"EVERETT","classification":"D","division":"LIMITED","hit_factor":1.3251},{"match_name":"Piscataqua  Master Blasters USPSA Special Classifier","match_date":"2017-12-03","stage_classifiercode":"99-12","member_number":"A101160","first_name":"JOHN","last_name":"HOYT","classification":"U","division":"LIMITED","hit_factor":1.301},{"match_name":"Chillicothe May-2017 USPSA Match","match_date":"2017-05-28","stage_classifiercode":"99-12","member_number":"\"\"","first_name":"JOE","last_name":"MILLER","classification":"\"\"","division":"LIMITED","hit_factor":1.2987},{"match_name":"H&H June Match","match_date":"2016-06-26","stage_classifiercode":"99-12","member_number":"\"\"","first_name":"JEREMY","last_name":"OSTERCAMP","classification":"U","division":"LIMITED","hit_factor":1.2898},{"match_name":"WNPL USPSA - Labour Day Weekend - Sept 2017","match_date":"2017-09-02","stage_classifiercode":"99-12","member_number":"TY33800","first_name":"MICHAEL","last_name":"GLASS","classification":"C","division":"LIMITED","hit_factor":1.2891},{"match_name":"Brothers N Arms August 2018 USPSA Match","match_date":"2018-08-18","stage_classifiercode":"99-12","member_number":"A113187","first_name":"KENT","last_name":"GRAHAM","classification":"U","division":"LIMITED","hit_factor":1.2828},{"match_name":"CCPL 04102016","match_date":"2016-04-10","stage_classifiercode":"99-12","member_number":"A-73219","first_name":"JESSIE","last_name":"SIERRA","classification":"X","division":"LIMITED","hit_factor":1.2821},{"match_name":"WTPS USPSA April Classifier Match 4-8-17","match_date":"2017-04-08","stage_classifiercode":"99-12","member_number":"\"\"","first_name":"MICHAEL","last_name":"RAUSCHUBER","classification":"U","division":"LIMITED","hit_factor":1.2769},{"match_name":"PCGC  June 2017","match_date":"2017-06-25","stage_classifiercode":"99-12","member_number":"A94826","first_name":"JEREMY","last_name":"BLANKENSHIP","classification":"C","division":"LIMITED","hit_factor":1.2758},{"match_name":"USPSA","match_date":"2018-04-28","stage_classifiercode":"99-12","member_number":"\"\"","first_name":"ROB","last_name":"COLEMAN","classification":"\"\"","division":"LIMITED","hit_factor":1.2755},{"match_name":"Shoot GTR USPSA 11/6","match_date":"2016-11-06","stage_classifiercode":"99-12","member_number":"A94831","first_name":"DAVID","last_name":"KOPERA","classification":"D","division":"LIMITED","hit_factor":1.2689},{"match_name":"PIPS 06-14-2017","match_date":"2017-06-14","stage_classifiercode":"99-12","member_number":"A87198","first_name":"ALAN","last_name":"HETER","classification":"D","division":"LIMITED","hit_factor":1.2675},{"match_name":"SCCPSA USPSA Mar 17","match_date":"2018-03-17","stage_classifiercode":"99-12","member_number":"A94376","first_name":"MARTIN","last_name":"NAUGHTON","classification":"C","division":"LIMITED","hit_factor":1.2647},{"match_name":"Atlanta Practical Shooters March 2016 USPSA - Classifier Match","match_date":"2016-03-06","stage_classifiercode":"99-12","member_number":"\"\"","first_name":"JUDY","last_name":"LAMB","classification":"D","division":"LIMITED","hit_factor":1.248},{"match_name":"Palmetto Gun Club - February 2018 USPSA","match_date":"2018-02-03","stage_classifiercode":"99-12","member_number":"\"\"","first_name":"SAMUEL","last_name":"CIOCCO","classification":"U","division":"LIMITED","hit_factor":1.2418},{"match_name":"MCPSL Pistol 4-8-17","match_date":"2017-04-08","stage_classifiercode":"99-12","member_number":"PEN","first_name":"DON","last_name":"FRANCIS","classification":"U","division":"LIMITED","hit_factor":1.2395},{"match_name":"XMG USPSA   Saturday September  4th 2021","match_date":"2021-09-04","stage_classifiercode":"99-12","member_number":"FY133867","first_name":"JAMES","last_name":"ROEBUCK","classification":"U","division":"LIMITED","hit_factor":1.2371},{"match_name":"Collin County USPSA Nov. 27 2016","match_date":"2016-11-25","stage_classifiercode":"99-12","member_number":"A98609","first_name":"JENNIFER","last_name":"GASPARAS","classification":"D","division":"LIMITED","hit_factor":1.2363},{"match_name":"FBURG April 2017 Level I USPSA ","match_date":"2017-04-01","stage_classifiercode":"99-12","member_number":"A95351","first_name":"CHRISTOPHER","last_name":"HUIE","classification":"C","division":"LIMITED","hit_factor":1.2276},{"match_name":"Collin County USPSA Nov. 27 2016","match_date":"2016-11-25","stage_classifiercode":"99-12","member_number":"\"\"","first_name":"EDWARD","last_name":"MORRIS","classification":"U","division":"LIMITED","hit_factor":1.2204},{"match_name":"EWPSA 2016-04","match_date":"2016-04-17","stage_classifiercode":"99-12","member_number":"A79976","first_name":"MIKE","last_name":"MCDOWELL","classification":"C","division":"LIMITED","hit_factor":1.2184},{"match_name":"Brothers N Arms February 2018 USPSA Match","match_date":"2018-02-17","stage_classifiercode":"99-12","member_number":"PENDING","first_name":"SHAY","last_name":"GIPSON","classification":"U","division":"LIMITED","hit_factor":1.2097},{"match_name":"Griffin USPSA Match Aug 2017","match_date":"2017-08-19","stage_classifiercode":"99-12","member_number":"A29593","first_name":"RICHARD","last_name":"SELLERS","classification":"B","division":"LIMITED","hit_factor":1.2072},{"match_name":"Brothers N Arms February 2018 USPSA Match","match_date":"2018-02-17","stage_classifiercode":"99-12","member_number":"A37113","first_name":"JOE","last_name":"TOUCHTON","classification":"B","division":"LIMITED","hit_factor":1.2071},{"match_name":"RBGC 2018-7-28","match_date":"2018-07-28","stage_classifiercode":"99-12","member_number":"TY89023","first_name":"JERRY","last_name":"TAYLOR","classification":"C","division":"LIMITED","hit_factor":1.1878},{"match_name":"RBGC 2018-7-28","match_date":"2018-07-28","stage_classifiercode":"99-12","member_number":"\"\"","first_name":"JOE","last_name":"WOODS","classification":"\"\"","division":"LIMITED","hit_factor":1.1806},{"match_name":"PCGC  June 2017","match_date":"2017-06-25","stage_classifiercode":"99-12","member_number":"\"\"","first_name":"HUNTER","last_name":"HOFFMAN","classification":"C","division":"LIMITED","hit_factor":1.1786},{"match_name":"MRPC USPSA Mar 2017","match_date":"2017-03-26","stage_classifiercode":"99-12","member_number":"\"\"","first_name":"JASON","last_name":"FOSNAUGHT","classification":"\"\"","division":"LIMITED","hit_factor":1.1719},{"match_name":"Atlanta Practical Shooters March 2016 USPSA - Classifier Match","match_date":"2016-03-06","stage_classifiercode":"99-12","member_number":"A92600","first_name":"CHRISTI","last_name":"TATE","classification":"U","division":"LIMITED","hit_factor":1.17},{"match_name":"LdF USPSA Match July 14 2018","match_date":"2018-07-14","stage_classifiercode":"99-12","member_number":"\"\"","first_name":"DANIEL","last_name":"LU","classification":"U","division":"LIMITED","hit_factor":1.1676},{"match_name":"Shasta Shooters August 2016","match_date":"2016-08-13","stage_classifiercode":"99-12","member_number":"PEN","first_name":"KARI","last_name":"HYATT","classification":"U","division":"LIMITED","hit_factor":1.1536},{"match_name":"Payson Practical Pistol Sept 03 2016","match_date":"2016-09-03","stage_classifiercode":"99-12","member_number":"A84050","first_name":"DONNA","last_name":"HANCOCK","classification":"D","division":"LIMITED","hit_factor":1.1516},{"match_name":"MCPSL Pistol 4-9-16","match_date":"2016-04-09","stage_classifiercode":"99-12","member_number":"PEN","first_name":"TERI","last_name":"ATWELL","classification":"U","division":"LIMITED","hit_factor":1.1367},{"match_name":"APSA February 2017 USPSA Match","match_date":"2017-02-11","stage_classifiercode":"99-12","member_number":"\"\"","first_name":"MIKE","last_name":"PRIVETTE","classification":"U","division":"LIMITED","hit_factor":1.1304},{"match_name":"SCCCJULYCLASSIFIER2016","match_date":"2016-07-30","stage_classifiercode":"99-12","member_number":"a97681","first_name":"JAMES","last_name":"DELLINGER","classification":"U","division":"LIMITED","hit_factor":1.1145},{"match_name":"OK15 USPSA at USSA","match_date":"2017-12-10","stage_classifiercode":"99-12","member_number":"TY102186","first_name":"SEAN","last_name":"MOORE","classification":"U","division":"LIMITED","hit_factor":1.1101},{"match_name":"Prescott 3rd Sunday USPSA 11-20-2016","match_date":"2016-11-20","stage_classifiercode":"99-12","member_number":"A93043","first_name":"BILL","last_name":"GREENLAND","classification":"C","division":"LIMITED","hit_factor":1.1091},{"match_name":"BRC_20170611","match_date":"2017-06-11","stage_classifiercode":"99-12","member_number":"Ty84025","first_name":"BOB","last_name":"MARKHAM","classification":"C","division":"LIMITED","hit_factor":1.1091},{"match_name":"Griffin USPSA Match Aug 2017","match_date":"2017-08-19","stage_classifiercode":"99-12","member_number":"PEN","first_name":"JOSEPH","last_name":"ARTHUR","classification":"U","division":"LIMITED","hit_factor":1.101},{"match_name":"Collin County USPSA Nov. 27 2016","match_date":"2016-11-25","stage_classifiercode":"99-12","member_number":"\"\"","first_name":"EASTON","last_name":"HARDING","classification":"U","division":"LIMITED","hit_factor":1.0896},{"match_name":"Rockcastle USPSA Nov 28 2015","match_date":"2015-11-28","stage_classifiercode":"99-12","member_number":"A93039","first_name":"KURT","last_name":"TYREE","classification":"U","division":"LIMITED","hit_factor":1.0844},{"match_name":"RBGC 2018-7-28","match_date":"2018-07-28","stage_classifiercode":"99-12","member_number":"\"\"","first_name":"MAMIKO","last_name":"PEHRSON","classification":"U","division":"LIMITED","hit_factor":1.0813},{"match_name":"Laser Ninja Dragon League USPSA August 2017","match_date":"2017-08-06","stage_classifiercode":"99-12","member_number":"A104204","first_name":"SUSAN","last_name":"MILLER","classification":"U","division":"LIMITED","hit_factor":1.0638},{"match_name":"RBGC 2018-7-28","match_date":"2018-07-28","stage_classifiercode":"99-12","member_number":"\"\"","first_name":"MARC","last_name":"KNAPP","classification":"U","division":"LIMITED","hit_factor":1.0601},{"match_name":"MCPSL Pistol 4-8-17","match_date":"2017-04-08","stage_classifiercode":"99-12","member_number":"TY92350","first_name":"LUKE","last_name":"CARVER","classification":"C","division":"LIMITED","hit_factor":1.0577},{"match_name":"NISA April Classifer Match 2016","match_date":"2016-04-24","stage_classifiercode":"99-12","member_number":"TY85482","first_name":"MIKE","last_name":"SCHROEDL","classification":"C","division":"LIMITED","hit_factor":1.056},{"match_name":"Shongum Pistol November 2015","match_date":"2015-11-07","stage_classifiercode":"99-12","member_number":"\"\"","first_name":"DANIEL","last_name":"SOLOMON","classification":"U","division":"LIMITED","hit_factor":1.0407},{"match_name":"DWB - Deadwood Boys USPSA 18 February 2018","match_date":"2018-02-18","stage_classifiercode":"99-12","member_number":"a74750","first_name":"JUSTIN","last_name":"TAYLOR","classification":"B","division":"LIMITED","hit_factor":1.0234},{"match_name":"Chillicothe May-2017 USPSA Match","match_date":"2017-05-28","stage_classifiercode":"99-12","member_number":"TY87586","first_name":"MICHAEL","last_name":"JEFFERS","classification":"C","division":"LIMITED","hit_factor":1.0215},{"match_name":"RBGC 2018-7-28","match_date":"2018-07-28","stage_classifiercode":"99-12","member_number":"A112172","first_name":"DAVID","last_name":"BICE","classification":"U","division":"LIMITED","hit_factor":1.0197},{"match_name":"Springfield Tactical Shooters 06-07-2018","match_date":"2018-06-07","stage_classifiercode":"99-12","member_number":"\"\"","first_name":"FRANK","last_name":"NATALE","classification":"\"\"","division":"LIMITED","hit_factor":1.0053},{"match_name":"LCHG May USPSA","match_date":"2017-05-21","stage_classifiercode":"99-12","member_number":"A97733","first_name":"MARY","last_name":"PRENTICE","classification":"D","division":"LIMITED","hit_factor":0.9972},{"match_name":"OFGC USPSA Match Feb 19th 2017","match_date":"2017-02-19","stage_classifiercode":"99-12","member_number":"\"\"","first_name":"ROBB","last_name":"ELLIOTT","classification":"C","division":"LIMITED","hit_factor":0.994},{"match_name":"OFGC USPSA Match Feb 19th 2017","match_date":"2017-02-19","stage_classifiercode":"99-12","member_number":"TY72436","first_name":"ROBERT","last_name":"TERBIETEN","classification":"B","division":"LIMITED","hit_factor":0.9901},{"match_name":"Hosemasters  3rd Sunday Feburary 2017","match_date":"2017-02-12","stage_classifiercode":"99-12","member_number":"TY100430","first_name":"JENNY","last_name":"DEBOLT","classification":"D","division":"LIMITED","hit_factor":0.9891},{"match_name":"ORSA USPSA October 2016","match_date":"2016-10-15","stage_classifiercode":"99-12","member_number":"\"\"","first_name":"WES","last_name":"NELLIS","classification":"\"\"","division":"LIMITED","hit_factor":0.9804},{"match_name":"Brothers N Arms February 2018 USPSA Match","match_date":"2018-02-17","stage_classifiercode":"99-12","member_number":"A108491","first_name":"CHRISTOPHER","last_name":"WILKES","classification":"U","division":"LIMITED","hit_factor":0.9789},{"match_name":"APSA February 2017 USPSA Match","match_date":"2017-02-11","stage_classifiercode":"99-12","member_number":"TY92045","first_name":"RICHARD","last_name":"HIPP","classification":"B","division":"LIMITED","hit_factor":0.9763},{"match_name":"COPS Feb 2017 USPSA Match","match_date":"2017-02-05","stage_classifiercode":"99-12","member_number":"\"\"","first_name":"SAM","last_name":"JAMES","classification":"U","division":"LIMITED","hit_factor":0.9585},{"match_name":"Danville Rifle and Pistol Club USPSA IL17 April 21 2018","match_date":"2018-04-21","stage_classifiercode":"99-12","member_number":"\"\"","first_name":"CROSS","last_name":"ANN MARIE","classification":"U","division":"LIMITED","hit_factor":0.9365},{"match_name":"Griffin USPSA Match Aug 2017","match_date":"2017-08-19","stage_classifiercode":"99-12","member_number":"A104363","first_name":"JARED","last_name":"DEAN","classification":"U","division":"LIMITED","hit_factor":0.9292},{"match_name":"RBGC 2018-7-28","match_date":"2018-07-28","stage_classifiercode":"99-12","member_number":"\"\"","first_name":"BRUCE","last_name":"JORDAN","classification":"D","division":"LIMITED","hit_factor":0.9251},{"match_name":"Shoot GTR USPSA 11/6","match_date":"2016-11-06","stage_classifiercode":"99-12","member_number":"TY42315","first_name":"ROD","last_name":"CASSIDY","classification":"A","division":"LIMITED","hit_factor":0.9185},{"match_name":"Richmond Hot Shots USPSA Classifier Match Sat April 8-2017","match_date":"2017-04-08","stage_classifiercode":"99-12","member_number":"A95141","first_name":"IRIS","last_name":"OTT","classification":"U","division":"LIMITED","hit_factor":0.9119},{"match_name":"Rio Grande Practical Shooters - December 2016","match_date":"2016-12-03","stage_classifiercode":"99-12","member_number":"PEN","first_name":"CORLYN","last_name":"BURKETT","classification":"U","division":"LIMITED","hit_factor":0.9103},{"match_name":"BRC_20170611","match_date":"2017-06-11","stage_classifiercode":"99-12","member_number":"A89748","first_name":"VINCENT","last_name":"DAVIES","classification":"A","division":"LIMITED","hit_factor":0.9091},{"match_name":"FBURG April 2017 Level I USPSA ","match_date":"2017-04-01","stage_classifiercode":"99-12","member_number":"\"\"","first_name":"BRYAN","last_name":"CASTELLANO","classification":"U","division":"LIMITED","hit_factor":0.8718},{"match_name":"USPSA","match_date":"2016-06-04","stage_classifiercode":"99-12","member_number":"A95751","first_name":"JEFF","last_name":"CLIFTON","classification":"U","division":"LIMITED","hit_factor":0.8706},{"match_name":"Rendezvous 8-24-16","match_date":"2016-08-25","stage_classifiercode":"99-12","member_number":"\"\"","first_name":"KLAY","last_name":".","classification":"U","division":"LIMITED","hit_factor":0.8701},{"match_name":"SPSA USPSA March 4th Sat match","match_date":"2017-03-25","stage_classifiercode":"99-12","member_number":"\"\"","first_name":"TREVON","last_name":"BARBER","classification":"U","division":"LIMITED","hit_factor":0.8673},{"match_name":"Atlanta Practical Shooters March 2016 USPSA - Classifier Match","match_date":"2016-03-06","stage_classifiercode":"99-12","member_number":"\"\"","first_name":"LINDA","last_name":"HORNE","classification":"U","division":"LIMITED","hit_factor":0.8667},{"match_name":"EASTER EGG HUNT AREA 59  ALL CLASSFIER MATCH","match_date":"2017-04-15","stage_classifiercode":"99-12","member_number":"a27564","first_name":"RENATO","last_name":"MALAPITAN","classification":"U","division":"LIMITED","hit_factor":0.8578},{"match_name":"Gunsmoke Action Shooters USPSA April 18","match_date":"2018-04-07","stage_classifiercode":"99-12","member_number":"\"\"","first_name":"PETER","last_name":"EUBANKS","classification":"U","division":"LIMITED","hit_factor":0.855},{"match_name":"WTPS USPSA April Classifier Match 4-8-17","match_date":"2017-04-08","stage_classifiercode":"99-12","member_number":"A95075","first_name":"MICHAEL","last_name":"PRIEST","classification":"C","division":"LIMITED","hit_factor":0.8538},{"match_name":"USPSA","match_date":"2018-04-28","stage_classifiercode":"99-12","member_number":"\"\"","first_name":"SHANE","last_name":"SPURLING","classification":"\"\"","division":"LIMITED","hit_factor":0.8516},{"match_name":"CVSC 06-25-2017","match_date":"2017-06-25","stage_classifiercode":"99-12","member_number":"TY77209","first_name":"NATE","last_name":"SCHMEISER","classification":"D","division":"LIMITED","hit_factor":0.8505},{"match_name":"Triforce Practical Shooters at BigWoodsGoods","match_date":"2016-09-22","stage_classifiercode":"99-12","member_number":"A97282","first_name":"RAY","last_name":"RUTLEDGE","classification":"U","division":"LIMITED","hit_factor":0.8397},{"match_name":"WTPS USPSA April Classifier Match 4-8-17","match_date":"2017-04-08","stage_classifiercode":"99-12","member_number":"TY76134","first_name":"JOSH","last_name":"REID","classification":"M","division":"LIMITED","hit_factor":0.8375},{"match_name":"Brothers N Arms February 2018 USPSA Match","match_date":"2018-02-17","stage_classifiercode":"99-12","member_number":"A95567","first_name":"PAUL","last_name":"HARRIS","classification":"C","division":"LIMITED","hit_factor":0.8325},{"match_name":"ORSA USPSA October 2016","match_date":"2016-10-15","stage_classifiercode":"99-12","member_number":"TY30290","first_name":"RICK","last_name":"DIXON","classification":"C","division":"LIMITED","hit_factor":0.8322},{"match_name":"BSTRC Dec 20 2017","match_date":"2017-12-20","stage_classifiercode":"99-12","member_number":"107069","first_name":"TRISTAN","last_name":"WELCH","classification":"U","division":"LIMITED","hit_factor":0.8299},{"match_name":"ORSA USPSA October 2016","match_date":"2016-10-15","stage_classifiercode":"99-12","member_number":"A98757","first_name":"DENNIS","last_name":"KRIEGER","classification":"U","division":"LIMITED","hit_factor":0.8264},{"match_name":"USC August 2016","match_date":"2016-08-13","stage_classifiercode":"99-12","member_number":"\"\"","first_name":"TREVOR","last_name":"CLATTERBUCK","classification":"U","division":"LIMITED","hit_factor":0.8041},{"match_name":"AIPS  USPSA Monthly 12 November 2016","match_date":"2016-11-12","stage_classifiercode":"99-12","member_number":"PEN","first_name":"JAMES","last_name":"CORBETT","classification":"\"\"","division":"LIMITED","hit_factor":0.7942},{"match_name":"Gunsmoke Action Shooters USPSA April 18","match_date":"2018-04-07","stage_classifiercode":"99-12","member_number":"FY110329","first_name":"JESSICA","last_name":"SPEARS","classification":"\"\"","division":"LIMITED","hit_factor":0.7882},{"match_name":"Powell County Action Shooters July 17 2021","match_date":"2021-07-17","stage_classifiercode":"99-12","member_number":"TY115798","first_name":"VIRGINIA","last_name":"HARRISON","classification":"D","division":"LIMITED","hit_factor":0.7866},{"match_name":"MRPC USPSA Mar 2017","match_date":"2017-03-26","stage_classifiercode":"99-12","member_number":"A64325","first_name":"KENNETH","last_name":"WILLIAMS","classification":"X","division":"LIMITED","hit_factor":0.7752},{"match_name":"BSTRC Dec 20 2017","match_date":"2017-12-20","stage_classifiercode":"99-12","member_number":"A103800","first_name":"JANET","last_name":"LEHMAN","classification":"U","division":"LIMITED","hit_factor":0.7568},{"match_name":"Springfield Tactical Shooters 09/03/2020","match_date":"2020-09-03","stage_classifiercode":"99-12","member_number":"\"\"","first_name":"GEORGE","last_name":"EAMES","classification":"\"\"","division":"LIMITED","hit_factor":0.7472},{"match_name":"MSA USPSA Special Classifier 12-4-16","match_date":"2016-12-04","stage_classifiercode":"99-12","member_number":"A96168","first_name":"TOM","last_name":"EVANS","classification":"D","division":"LIMITED","hit_factor":0.7453},{"match_name":"Triforce Practical Shooters at BigWoodsGoods","match_date":"2016-09-22","stage_classifiercode":"99-12","member_number":"\"\"","first_name":"MICAH","last_name":"NEIDHART","classification":"U","division":"LIMITED","hit_factor":0.7299},{"match_name":"FBURG April 2017 Level I USPSA ","match_date":"2017-04-01","stage_classifiercode":"99-12","member_number":"A87275","first_name":"SCOTT","last_name":"MAHL","classification":"B","division":"LIMITED","hit_factor":0.7266},{"match_name":"South Texas Tactical USPSA","match_date":"2017-07-08","stage_classifiercode":"99-12","member_number":"\"\"","first_name":"ALEK","last_name":"GALONSKY","classification":"\"\"","division":"LIMITED","hit_factor":0.7055},{"match_name":"LCSA USPSA ALL CLASSIFIER ","match_date":"2018-06-30","stage_classifiercode":"99-12","member_number":"A112499","first_name":"BRIAN","last_name":"CRIADO","classification":"U","division":"LIMITED","hit_factor":0.7055},{"match_name":"FBURG April 2017 Level I USPSA ","match_date":"2017-04-01","stage_classifiercode":"99-12","member_number":"TY94766","first_name":"RICK","last_name":"CASAREZ","classification":"U","division":"LIMITED","hit_factor":0.7038},{"match_name":"WTPS USPSA April Classifier Match 4-8-17","match_date":"2017-04-08","stage_classifiercode":"99-12","member_number":"A99187","first_name":"BILLY","last_name":"DRUMMA","classification":"U","division":"LIMITED","hit_factor":0.6999},{"match_name":"Armory Indoor League","match_date":"2016-08-12","stage_classifiercode":"99-12","member_number":"\"\"","first_name":"LYNN","last_name":"BIGELOW","classification":"U","division":"LIMITED","hit_factor":0.6926},{"match_name":"Springfield Tactical Shooters 06-07-2018","match_date":"2018-06-07","stage_classifiercode":"99-12","member_number":"A107856","first_name":"JESSE","last_name":"BOEHLER","classification":"\"\"","division":"LIMITED","hit_factor":0.6873},{"match_name":"Shasta Shooters August 2016","match_date":"2016-08-13","stage_classifiercode":"99-12","member_number":"PEN","first_name":"JASON","last_name":"MOORE","classification":"\"\"","division":"LIMITED","hit_factor":0.6867},{"match_name":"Paul Bunyan April 7th-8th All Classifier Match NW01","match_date":"2018-04-07","stage_classifiercode":"99-12","member_number":"A85106","first_name":"BRYAN","last_name":"ADAMS","classification":"C","division":"LIMITED","hit_factor":0.6834},{"match_name":"ECPS USPSA 17 Feb 18","match_date":"2018-02-16","stage_classifiercode":"99-12","member_number":"\"\"","first_name":"TONYA","last_name":"HAYES","classification":"U","division":"LIMITED","hit_factor":0.6783},{"match_name":"EWPSA 2016-04","match_date":"2016-04-17","stage_classifiercode":"99-12","member_number":"TY68374","first_name":"MIKAYLA","last_name":"BLOSSER","classification":"B","division":"LIMITED","hit_factor":0.6757},{"match_name":"SFPC September USPSA Special Classifier match","match_date":"2016-09-04","stage_classifiercode":"99-12","member_number":"A-87923","first_name":"DALE","last_name":"CLARKE","classification":"U","division":"LIMITED","hit_factor":0.6381},{"match_name":"Richmond Hot Shots February 7-2016 USPSA Match","match_date":"2016-02-07","stage_classifiercode":"99-12","member_number":"TY88001","first_name":"ELITO","last_name":"LELINA","classification":"D","division":"LIMITED","hit_factor":0.6289},{"match_name":"WTPS USPSA April Classifier Match 4-8-17","match_date":"2017-04-08","stage_classifiercode":"99-12","member_number":"A101672","first_name":"DANNY","last_name":"GREGG","classification":"U","division":"LIMITED","hit_factor":0.597},{"match_name":"FBURG April 2017 Level I USPSA ","match_date":"2017-04-01","stage_classifiercode":"99-12","member_number":"L3460","first_name":"TROY","last_name":"HAYES","classification":"C","division":"LIMITED","hit_factor":0.5955},{"match_name":"SSFGA & Master Blasters USPSA Classifier","match_date":"2018-11-17","stage_classifiercode":"99-12","member_number":"A108239","first_name":"SUSAN","last_name":"GIONET","classification":"D","division":"LIMITED","hit_factor":0.5931},{"match_name":"WTPS USPSA April Classifier Match 4-8-17","match_date":"2017-04-08","stage_classifiercode":"99-12","member_number":"\"\"","first_name":"CHAD","last_name":"FARR","classification":"U","division":"LIMITED","hit_factor":0.572},{"match_name":"WTPS USPSA April Classifier Match 4-8-17","match_date":"2017-04-08","stage_classifiercode":"99-12","member_number":"A102026","first_name":"DEON","last_name":"CLEMENTS","classification":"U","division":"LIMITED","hit_factor":0.5708},{"match_name":"SFPC March USPSA Match 2017","match_date":"2017-03-05","stage_classifiercode":"99-12","member_number":"\"\"","first_name":"TIMOTHY","last_name":"LANDON","classification":"U","division":"LIMITED","hit_factor":0.5634},{"match_name":"Payson Practical Pistol Sept 03 2016","match_date":"2016-09-03","stage_classifiercode":"99-12","member_number":"A96462","first_name":"BRANDON","last_name":"JOHNSON","classification":"U","division":"LIMITED","hit_factor":0.5594},{"match_name":"SSFGA & Master Blasters USPSA Classifier","match_date":"2018-11-17","stage_classifiercode":"99-12","member_number":"A111945","first_name":"THOMAS","last_name":"PETERS","classification":"D","division":"LIMITED","hit_factor":0.5489},{"match_name":"PCGC  June 2017","match_date":"2017-06-25","stage_classifiercode":"99-12","member_number":"\"\"","first_name":"SAM","last_name":"STEARNS","classification":"U","division":"LIMITED","hit_factor":0.5414},{"match_name":"GAS October 6th Match","match_date":"2018-10-06","stage_classifiercode":"99-12","member_number":"A101014","first_name":"LEATA","last_name":"ENGLISH","classification":"D","division":"LIMITED","hit_factor":0.5341},{"match_name":"GMPS 5/7/17","match_date":"2017-05-06","stage_classifiercode":"99-12","member_number":"A85922","first_name":"ERIC","last_name":"BURDITT","classification":"D","division":"LIMITED","hit_factor":0.5268},{"match_name":"Gunsmoke Action Shooters USPSA April 18","match_date":"2018-04-07","stage_classifiercode":"99-12","member_number":"\"\"","first_name":"COLEMAN","last_name":"TAYLOR","classification":"U","division":"LIMITED","hit_factor":0.5219},{"match_name":"GAS October 6th Match","match_date":"2018-10-06","stage_classifiercode":"99-12","member_number":"A113371","first_name":"VINCENT","last_name":"MUGGLI","classification":"U","division":"LIMITED","hit_factor":0.5214},{"match_name":"USC August 2016","match_date":"2016-08-13","stage_classifiercode":"99-12","member_number":"\"\"","first_name":"TANNER","last_name":"BROWN","classification":"U","division":"LIMITED","hit_factor":0.5145},{"match_name":"ORSA USPSA October 2016","match_date":"2016-10-15","stage_classifiercode":"99-12","member_number":"\"\"","first_name":"STEPHAN","last_name":"CORTEL","classification":"\"\"","division":"LIMITED","hit_factor":0.5134},{"match_name":"South Texas Tactical USPSA","match_date":"2017-07-08","stage_classifiercode":"99-12","member_number":"\"\"","first_name":"DANIEL","last_name":"GONZALEZ","classification":"\"\"","division":"LIMITED","hit_factor":0.5095},{"match_name":"EASTER EGG HUNT AREA 59  ALL CLASSFIER MATCH","match_date":"2017-04-15","stage_classifiercode":"99-12","member_number":"A97451","first_name":"WILSON","last_name":"MAGUIGAD","classification":"U","division":"LIMITED","hit_factor":0.5068},{"match_name":"SFPC September USPSA Special Classifier match","match_date":"2016-09-04","stage_classifiercode":"99-12","member_number":"A90385","first_name":"MONICA","last_name":"CREECH","classification":"U","division":"LIMITED","hit_factor":0.4913},{"match_name":"SFPS 05-21-17 Superclassifier Gun1","match_date":"2017-05-21","stage_classifiercode":"99-12","member_number":"FY65949","first_name":"GARY","last_name":"STEWART","classification":"D","division":"LIMITED","hit_factor":0.4827},{"match_name":"SFPC September USPSA Special Classifier match","match_date":"2016-09-04","stage_classifiercode":"99-12","member_number":"TY90993","first_name":"WAYNE","last_name":"OWENSBY","classification":"D","division":"LIMITED","hit_factor":0.4765},{"match_name":"Gunsmoke Action Shooters USPSA April 18","match_date":"2018-04-07","stage_classifiercode":"99-12","member_number":"\"\"","first_name":"RICKY","last_name":"TAYLOR","classification":"U","division":"LIMITED","hit_factor":0.4666},{"match_name":"Laser Ninja Dragon League USPSA August 2017","match_date":"2017-08-06","stage_classifiercode":"99-12","member_number":"\"\"","first_name":"VERONICA","last_name":"RODRIGUEZ","classification":"U","division":"LIMITED","hit_factor":0.454},{"match_name":"Tangi January 2016 USPSA","match_date":"2016-01-23","stage_classifiercode":"99-12","member_number":"a89919","first_name":"JOAN","last_name":"HOFFMAN","classification":"D","division":"LIMITED","hit_factor":0.4425},{"match_name":"SFPS 05-21-17 Superclassifier Gun1","match_date":"2017-05-21","stage_classifiercode":"99-12","member_number":"pending","first_name":"RICHARD","last_name":"WOLFE","classification":"U","division":"LIMITED","hit_factor":0.4416},{"match_name":"COPS Feb 2017 USPSA Match","match_date":"2017-02-05","stage_classifiercode":"99-12","member_number":"a98786","first_name":"CHELSEA","last_name":"KEENE","classification":"U","division":"LIMITED","hit_factor":0.4334},{"match_name":"H&H June Match","match_date":"2016-06-26","stage_classifiercode":"99-12","member_number":"A93213","first_name":"KEITH","last_name":"STEWART","classification":"C","division":"LIMITED","hit_factor":0.4324},{"match_name":"WTPS USPSA April Classifier Match 4-8-17","match_date":"2017-04-08","stage_classifiercode":"99-12","member_number":"\"\"","first_name":"JERRY","last_name":"SAYSON","classification":"D","division":"LIMITED","hit_factor":0.4088},{"match_name":"LPRGC-Lower Providence USPSA May-2 2017","match_date":"2017-05-13","stage_classifiercode":"99-12","member_number":"\"\"","first_name":"WILLIAM","last_name":"SHANLEY IV","classification":"X","division":"LIMITED","hit_factor":0.393},{"match_name":"Paul Bunyan April 7th-8th All Classifier Match NW01","match_date":"2018-04-07","stage_classifiercode":"99-12","member_number":"\"\"","first_name":"HAROLD","last_name":"MARTINEZ","classification":"U","division":"LIMITED","hit_factor":0.3906},{"match_name":"BRC_20170611","match_date":"2017-06-11","stage_classifiercode":"99-12","member_number":"PEN","first_name":"SIMON","last_name":"ROBERTS","classification":"U","division":"LIMITED","hit_factor":0.3897},{"match_name":"COPS Feb 2017 USPSA Match","match_date":"2017-02-05","stage_classifiercode":"99-12","member_number":"\"\"","first_name":"BILL","last_name":"COOK","classification":"U","division":"LIMITED","hit_factor":0.3883},{"match_name":"Colonial Rifle and Pistol Club June 2018 Special Classifier","match_date":"2018-06-02","stage_classifiercode":"99-12","member_number":"A111470","first_name":"JONALD ZON","last_name":"EVANGELISTA","classification":"U","division":"LIMITED","hit_factor":0.3452},{"match_name":"DWB - Deadwood Boys USPSA 18 February 2018","match_date":"2018-02-18","stage_classifiercode":"99-12","member_number":"A103718","first_name":"ARIES","last_name":"ALMAZAN","classification":"D","division":"LIMITED","hit_factor":0.3439},{"match_name":"NISA April Classifer Match 2016","match_date":"2016-04-24","stage_classifiercode":"99-12","member_number":"A34442","first_name":"JAMES","last_name":"CARR","classification":"D","division":"LIMITED","hit_factor":0.3359},{"match_name":"BGS NORTH  Week 9","match_date":"2016-03-13","stage_classifiercode":"99-12","member_number":"\"\"","first_name":"ISAAC","last_name":"BARDEN","classification":"U","division":"LIMITED","hit_factor":0.3347},{"match_name":"BGS NORTH  Week 9","match_date":"2016-03-13","stage_classifiercode":"99-12","member_number":"\"\"","first_name":"GREGG","last_name":"STEFFEN","classification":"U","division":"LIMITED","hit_factor":0.3308},{"match_name":"SSP Super Classifier 1-30-16","match_date":"2016-01-30","stage_classifiercode":"99-12","member_number":"\"\"","first_name":"KEITHA","last_name":"DAVIS","classification":"U","division":"LIMITED","hit_factor":0.33},{"match_name":"NTPS-SE August 2016","match_date":"2016-08-20","stage_classifiercode":"99-12","member_number":"NONE","first_name":"JOSH","last_name":"HENRY","classification":"U","division":"LIMITED","hit_factor":0.3212},{"match_name":"LCSA USPSA ALL CLASSIFIER ","match_date":"2018-06-30","stage_classifiercode":"99-12","member_number":"A101625","first_name":"STEPHEN","last_name":"ASCIOLLA","classification":"U","division":"LIMITED","hit_factor":0.2976},{"match_name":"Springfield Tactical Shooters 09/03/2020","match_date":"2020-09-03","stage_classifiercode":"99-12","member_number":"\"\"","first_name":"JIM","last_name":"HARTWIG","classification":"\"\"","division":"LIMITED","hit_factor":0.2948},{"match_name":"LPRGC-Lower Providence USPSA May-2 2017","match_date":"2017-05-13","stage_classifiercode":"99-12","member_number":"\"\"","first_name":"ZACHARY","last_name":"SEIDENBERG","classification":"U","division":"LIMITED","hit_factor":0.2918},{"match_name":"CCPL 04102016","match_date":"2016-04-10","stage_classifiercode":"99-12","member_number":"\"\"","first_name":"NICK","last_name":"HARRISON","classification":"U","division":"LIMITED","hit_factor":0.27},{"match_name":"BRC_20170611","match_date":"2017-06-11","stage_classifiercode":"99-12","member_number":"\"\"","first_name":"MATT","last_name":"LEDMAN","classification":"U","division":"LIMITED","hit_factor":0.2698},{"match_name":"CCPL 04102016","match_date":"2016-04-10","stage_classifiercode":"99-12","member_number":"\"\"","first_name":"STEVE","last_name":"CORNER","classification":"U","division":"LIMITED","hit_factor":0.2595},{"match_name":"Brothers N Arms February 2018 USPSA Match","match_date":"2018-02-17","stage_classifiercode":"99-12","member_number":"TY105250","first_name":"NATALIE","last_name":"ROBERTSON","classification":"D","division":"LIMITED","hit_factor":0.2069},{"match_name":"South Texas Tactical USPSA","match_date":"2017-07-08","stage_classifiercode":"99-12","member_number":"A89314","first_name":"ERNIE","last_name":"ONG","classification":"C","division":"LIMITED","hit_factor":0.2006},{"match_name":"SSS USPSA February 2020","match_date":"2020-02-16","stage_classifiercode":"99-12","member_number":"A107536","first_name":"KEVIN","last_name":"HOPWOOD","classification":"C (C Class)","division":"LIMITED","hit_factor":0.1854},{"match_name":"ECPS USPSA 17 Feb 18","match_date":"2018-02-16","stage_classifiercode":"99-12","member_number":"A107459","first_name":"JONATHAN","last_name":"DENNIS","classification":"U","division":"LIMITED","hit_factor":0.1588},{"match_name":"Tangi January 2016 USPSA","match_date":"2016-01-23","stage_classifiercode":"99-12","member_number":"A92205","first_name":"ARCHIE","last_name":"THOMAS","classification":"U","division":"LIMITED","hit_factor":0.1444},{"match_name":"BSTRC Dec 20 2017","match_date":"2017-12-20","stage_classifiercode":"99-12","member_number":"\"\"","first_name":"DEANNA","last_name":"PICKMAN","classification":"U","division":"LIMITED","hit_factor":0.14},{"match_name":"GRPC USPSA MARCH MAD HATTER","match_date":"2018-03-02","stage_classifiercode":"99-12","member_number":"\"\"","first_name":"ZACK","last_name":"ZWICKY","classification":"U","division":"LIMITED","hit_factor":0.1272},{"match_name":"FBPPC DECEMBER 2016 SPECIAL CLASSIFIER MATCH","match_date":"2016-12-10","stage_classifiercode":"99-12","member_number":"PEN","first_name":"COOPER","last_name":"SPEER","classification":"U","division":"LIMITED","hit_factor":0.1241},{"match_name":"Gunsmoke Action Shooters USPSA April 18","match_date":"2018-04-07","stage_classifiercode":"99-12","member_number":"\"\"","first_name":"SCOTT","last_name":"KIBBY","classification":"U","division":"LIMITED","hit_factor":0.1213},{"match_name":"Collin County USPSA Nov. 27 2016","match_date":"2016-11-25","stage_classifiercode":"99-12","member_number":"NONE","first_name":"JULIE","last_name":"SMITH","classification":"U","division":"LIMITED","hit_factor":0.1145},{"match_name":"TPS USPSA PISTOL - May 2016 - Talon Range","match_date":"2016-05-07","stage_classifiercode":"99-12","member_number":"\"\"","first_name":"JASON","last_name":"REVELL","classification":"U","division":"LIMITED","hit_factor":0.1065},{"match_name":"FBPPC DECEMBER 2016 SPECIAL CLASSIFIER MATCH","match_date":"2016-12-10","stage_classifiercode":"99-12","member_number":"A95598","first_name":"DANE","last_name":"SPEER","classification":"U","division":"LIMITED","hit_factor":0.0978},{"match_name":"LPRGC-Lower Providence USPSA May-2 2017","match_date":"2017-05-13","stage_classifiercode":"99-12","member_number":"\"\"","first_name":"JEFF","last_name":"HEWES","classification":"U","division":"LIMITED","hit_factor":0.0951},{"match_name":"Springfield Tactical Shooters 09/03/2020","match_date":"2020-09-03","stage_classifiercode":"99-12","member_number":"\"\"","first_name":"GENE","last_name":"MINER","classification":"\"\"","division":"LIMITED","hit_factor":0.0771},{"match_name":"Atlanta Practical Shooters March 2016 USPSA - Classifier Match","match_date":"2016-03-06","stage_classifiercode":"99-12","member_number":"A93978","first_name":"EMILIA","last_name":"OGLES","classification":"U","division":"LIMITED","hit_factor":0.0769},{"match_name":"Brothers N Arms February 2018 USPSA Match","match_date":"2018-02-17","stage_classifiercode":"99-12","member_number":"A85066","first_name":"MORGAN","last_name":"BROWN","classification":"D","division":"LIMITED","hit_factor":0.0615},{"match_name":"NISA April Classifer Match 2016","match_date":"2016-04-24","stage_classifiercode":"99-12","member_number":"A86238","first_name":"FRANK","last_name":"KOSKOTAS","classification":"D","division":"LIMITED","hit_factor":0.06},{"match_name":"Prescott 3rd Sunday USPSA 11-20-2016","match_date":"2016-11-20","stage_classifiercode":"99-12","member_number":"\"\"","first_name":"JIM","last_name":"DOZIER","classification":"U","division":"LIMITED","hit_factor":0.0573},{"match_name":"Laser Ninja Dragon League USPSA August 2017","match_date":"2017-08-06","stage_classifiercode":"99-12","member_number":"A104508","first_name":"CHARITY","last_name":"TAYLOR","classification":"U","division":"LIMITED","hit_factor":0.0295}]