[{"match_name":"CVSC 07-29-2018","match_date":"2018-07-29","stage_classifiercode":"99-11","member_number":"A100612","first_name":"ZACK","last_name":"SMITH","classification":"U","division":"PCC","hit_factor":14.4928},{"match_name":"November USPSA All-Classifier Match at C and C Indoor Range","match_date":"2018-11-20","stage_classifiercode":"99-11","member_number":"FY104127","first_name":"RYAN","last_name":"FLOWERS","classification":"M","division":"PCC","hit_factor":14.3223},{"match_name":"YRPA USPSA MARCH  2018","match_date":"2018-03-25","stage_classifiercode":"99-11","member_number":"TY49461","first_name":"DAVID","last_name":"BLOSSER","classification":"M","division":"PCC","hit_factor":13.8462},{"match_name":"CFRPC December USPSA (Classifier)","match_date":"2018-12-16","stage_classifiercode":"99-11","member_number":"TY106150","first_name":"TOM","last_name":"CASTRO","classification":"A","division":"PCC","hit_factor":13.7615},{"match_name":"WNPL USPSA - REDEMPTION - NOVEMBER 2016","match_date":"2016-11-06","stage_classifiercode":"99-11","member_number":"A87948","first_name":"SCOTT","last_name":"GREENE","classification":"U","division":"PCC","hit_factor":13.602},{"match_name":"USPSA MO21 2Alpha SBRC December 22 2018","match_date":"2018-12-22","stage_classifiercode":"99-11","member_number":"TY101632","first_name":"GREG","last_name":"YEN","classification":"G","division":"PCC","hit_factor":13.5514},{"match_name":"Rio Salado Hosemasters February 2021","match_date":"2021-02-27","stage_classifiercode":"99-11","member_number":"A80318","first_name":"JIM","last_name":"ADAME","classification":"G","division":"PCC","hit_factor":13.4831},{"match_name":"PSS USPSA Classifier Match August 14 2021","match_date":"2021-08-14","stage_classifiercode":"99-11","member_number":"A73910","first_name":"JEREMY","last_name":"LIGHTNER","classification":"G","division":"PCC","hit_factor":13.2388},{"match_name":"Hammer Down USPSA Tue Night","match_date":"2017-11-07","stage_classifiercode":"99-11","member_number":"A104366","first_name":"ALAN","last_name":"SAUL","classification":"U","division":"PCC","hit_factor":13.1222},{"match_name":"WVPPS November 2018","match_date":"2018-11-18","stage_classifiercode":"99-11","member_number":"TY77176","first_name":"DON","last_name":"OBRADOVICH","classification":"G","division":"PCC","hit_factor":13.0926},{"match_name":"Nampa USPSA May 29th 2021","match_date":"2021-05-29","stage_classifiercode":"99-11","member_number":"TY52406","first_name":"GARY","last_name":"CHAN","classification":"G","division":"PCC","hit_factor":12.9496},{"match_name":"Nampa USPSA December 4th 2021","match_date":"2021-12-04","stage_classifiercode":"99-11","member_number":"TY85985","first_name":"CHRISTOPHER","last_name":"COLLINS","classification":"G","division":"PCC","hit_factor":12.9032},{"match_name":"CRCPS 2021-08-14","match_date":"2021-08-14","stage_classifiercode":"99-11","member_number":"Ty59267","first_name":"BRAD","last_name":"MCKIERNAN","classification":"M","division":"PCC","hit_factor":12.8889},{"match_name":"Hopkinton USPSA July 2018","match_date":"2018-07-07","stage_classifiercode":"99-11","member_number":"TY73127","first_name":"SEAN","last_name":"JANICKI","classification":"G","division":"PCC","hit_factor":12.6984},{"match_name":"Rio Salado Hosemasters February 2021","match_date":"2021-02-27","stage_classifiercode":"99-11","member_number":"TY117413","first_name":"CHRIS","last_name":"LEGATT","classification":"M","division":"PCC","hit_factor":12.5813},{"match_name":"SUPS All Classifier Match March 1718 2018","match_date":"2018-03-17","stage_classifiercode":"99-11","member_number":"L3578","first_name":"BRIAN","last_name":"NELSON","classification":"U","division":"PCC","hit_factor":12.47},{"match_name":"SMPS USPSA Feb 9 2020 AM Classifier","match_date":"2020-02-05","stage_classifiercode":"99-11","member_number":"A72727","first_name":"GREG","last_name":"JONES","classification":"M","division":"PCC","hit_factor":12.4224},{"match_name":"Pardoe Sportsmens Association- USPSA Saturday 4-3-21","match_date":"2021-04-03","stage_classifiercode":"99-11","member_number":"TY92969","first_name":"COREY","last_name":"SCHEEL","classification":"M","division":"PCC","hit_factor":12.2881},{"match_name":"Grandbaggers September 2018","match_date":"2018-09-06","stage_classifiercode":"99-11","member_number":"A80318","first_name":"JIM","last_name":"ADAME","classification":"M","division":"PCC","hit_factor":12.2807},{"match_name":"Custer USPSA Mar 7th 2021","match_date":"2021-03-07","stage_classifiercode":"99-11","member_number":"A86278","first_name":"HWANSIK","last_name":"KIM","classification":"M","division":"PCC","hit_factor":12.2353},{"match_name":"Bare Arms Indoo 12/08/18","match_date":"2018-12-08","stage_classifiercode":"99-11","member_number":"TY42975","first_name":"JASON","last_name":"RATLIFF","classification":"M","division":"PCC","hit_factor":12.2016},{"match_name":"SLPSA August USPSA Match 2","match_date":"2020-08-15","stage_classifiercode":"99-11","member_number":"A64300","first_name":"JOHN","last_name":"COOK","classification":"M","division":"PCC","hit_factor":12.1739},{"match_name":"EWPSA 2018-10","match_date":"2018-10-20","stage_classifiercode":"99-11","member_number":"TY82326","first_name":"WARREN","last_name":"HARPER","classification":"M","division":"PCC","hit_factor":12.1475},{"match_name":"STAGE ZERO SHOOTING SUPPLY USPSA","match_date":"2020-07-16","stage_classifiercode":"99-11","member_number":"A78661","first_name":"JESSICA","last_name":"HOOK","classification":"M","division":"PCC","hit_factor":12.1212},{"match_name":"Collin County USPSA 04-25-2021","match_date":"2021-04-24","stage_classifiercode":"99-11","member_number":"A62405","first_name":"MATT","last_name":"SMITH","classification":"M","division":"PCC","hit_factor":12.0833},{"match_name":"Pardoe Sportsmens Association- USPSA Saturday 4-3-21","match_date":"2021-04-03","stage_classifiercode":"99-11","member_number":"TY92969","first_name":"COREY","last_name":"SCHEEL","classification":"M","division":"PCC","hit_factor":12.0172},{"match_name":"Shot Through The Heart Classifiers","match_date":"2018-02-04","stage_classifiercode":"99-11","member_number":"L4081","first_name":"CHRISTOPHER","last_name":"CULPEPPER","classification":"U","division":"PCC","hit_factor":12.0172},{"match_name":"Hammer Down USPSA Tue Night","match_date":"2017-11-07","stage_classifiercode":"99-11","member_number":"A57378","first_name":"RYAN","last_name":"ZAMBERLAN","classification":"M","division":"PCC","hit_factor":11.9835},{"match_name":"Free State PCC Match 8-29","match_date":"2020-08-29","stage_classifiercode":"99-11","member_number":"TY109169","first_name":"COLTER","last_name":"O'DELL","classification":"M","division":"PCC","hit_factor":11.8681},{"match_name":"Pardoe Sportsmens Association-WPA14-2017-10-01","match_date":"2017-10-01","stage_classifiercode":"99-11","member_number":"A92969","first_name":"COREY","last_name":"SCHEEL","classification":"B","division":"PCC","hit_factor":11.8367},{"match_name":"Oakdale USPSA MN07 8-12-2021","match_date":"2021-08-12","stage_classifiercode":"99-11","member_number":"TY119536","first_name":"RYAN","last_name":"VOLOVSEK","classification":"M","division":"PCC","hit_factor":11.7914},{"match_name":"RBGC 2017-06-24","match_date":"2017-06-24","stage_classifiercode":"99-11","member_number":"TY54465","first_name":"ROBERT","last_name":"ROMERO","classification":"M","division":"PCC","hit_factor":11.7878},{"match_name":"FAS Sunday Indoors USPSA","match_date":"2021-10-17","stage_classifiercode":"99-11","member_number":"A95711","first_name":"RYAN","last_name":"YURONG","classification":"M","division":"PCC","hit_factor":11.7155},{"match_name":"PPPS 11-13-16","match_date":"2016-11-13","stage_classifiercode":"99-11","member_number":"TY61531","first_name":"CURTIS","last_name":"BROTHERSTON","classification":"M","division":"PCC","hit_factor":11.7137},{"match_name":"Deadwood Boys USPSA All Classifier Match - 29 July 2018","match_date":"2018-07-29","stage_classifiercode":"99-11","member_number":"A98726","first_name":"CALEB","last_name":"BAER","classification":"M","division":"PCC","hit_factor":11.7117},{"match_name":"NCPS USPSA Handgun Match June 24 2018","match_date":"2018-06-24","stage_classifiercode":"99-11","member_number":"TY88318","first_name":"MIKE","last_name":"HALL","classification":"A","division":"PCC","hit_factor":11.6732},{"match_name":"OK15 USPSA at USSA","match_date":"2017-12-10","stage_classifiercode":"99-11","member_number":"Ty78454","first_name":"GRANT","last_name":"GAINES","classification":"M","division":"PCC","hit_factor":11.67},{"match_name":"WGC August 2018 USPSA Classifier","match_date":"2018-08-12","stage_classifiercode":"99-11","member_number":"L1740","first_name":"JOHNNY","last_name":"BRISTER","classification":"M","division":"PCC","hit_factor":11.655},{"match_name":"Hopkinton USPSA July 2018","match_date":"2018-07-07","stage_classifiercode":"99-11","member_number":"TY73127","first_name":"SEAN","last_name":"JANICKI","classification":"G","division":"PCC","hit_factor":11.6379},{"match_name":"FAS Sunday Indoors USPSA Match","match_date":"2021-02-07","stage_classifiercode":"99-11","member_number":"A95711","first_name":"RYAN","last_name":"YURONG","classification":"M","division":"PCC","hit_factor":11.6232},{"match_name":"MPPL 08052018 Summer Fun","match_date":"2018-08-05","stage_classifiercode":"99-11","member_number":"A104329","first_name":"DAVID","last_name":"KIKUKAWA","classification":"A","division":"PCC","hit_factor":11.6183},{"match_name":"HPPS 1-16-2021","match_date":"2021-01-16","stage_classifiercode":"99-11","member_number":"TY90386","first_name":"ALEX","last_name":"IGLESIAS","classification":"M","division":"PCC","hit_factor":11.6129},{"match_name":"Ontelaunee USPSA  July 2018","match_date":"2018-07-29","stage_classifiercode":"99-11","member_number":"FY43854","first_name":"JIMMY","last_name":"SHEU","classification":"B","division":"PCC","hit_factor":11.6},{"match_name":"OK15 USPSA at USSA May 6th 2018","match_date":"2018-05-06","stage_classifiercode":"99-11","member_number":"A81825","first_name":"IAN","last_name":"ZACHER","classification":"M","division":"PCC","hit_factor":11.583},{"match_name":"Rio Salado UPPL September 2020","match_date":"2020-09-13","stage_classifiercode":"99-11","member_number":"A80318","first_name":"JIM","last_name":"ADAME","classification":"G","division":"PCC","hit_factor":11.5288},{"match_name":"WGC August 2018 USPSA Classifier","match_date":"2018-08-12","stage_classifiercode":"99-11","member_number":"TY50501","first_name":"BERNIE","last_name":"MCHUGH","classification":"M","division":"PCC","hit_factor":11.5044},{"match_name":"Ontelaunee USPSA  July 2018","match_date":"2018-07-29","stage_classifiercode":"99-11","member_number":"TY76078","first_name":"NICK","last_name":"SCHILLACI","classification":"G","division":"PCC","hit_factor":11.4851},{"match_name":"Maryland Practical Shooters Association July 2018","match_date":"2018-07-22","stage_classifiercode":"99-11","member_number":"TY58697","first_name":"GARY","last_name":"PARSONS","classification":"A","division":"PCC","hit_factor":11.4286},{"match_name":"Oakdale USPSA MN07 6-25-2020","match_date":"2020-06-25","stage_classifiercode":"99-11","member_number":"TY119536","first_name":"RYAN","last_name":"VOLOVSEK","classification":"A","division":"PCC","hit_factor":11.4165},{"match_name":"Nampa USPSA May 29th 2021","match_date":"2021-05-29","stage_classifiercode":"99-11","member_number":"TY80321","first_name":"DAN","last_name":"HAWKINS","classification":"M","division":"PCC","hit_factor":11.359},{"match_name":"WELD ECO09 20180916","match_date":"2018-09-16","stage_classifiercode":"99-11","member_number":"A61086","first_name":"CY","last_name":"SOTO","classification":"M","division":"PCC","hit_factor":11.3537},{"match_name":"SAPSA January 2020 Match","match_date":"2020-01-18","stage_classifiercode":"99-11","member_number":"TY53290","first_name":"KENT","last_name":"CORI","classification":"M","division":"PCC","hit_factor":11.2994},{"match_name":"Deadwood Boys USPSA All Classifier Match","match_date":"2016-08-07","stage_classifiercode":"99-11","member_number":"A89753","first_name":"MAX","last_name":"LEOGRANDIS","classification":"U","division":"PCC","hit_factor":11.2994},{"match_name":"CRCPS 2021-08-14","match_date":"2021-08-14","stage_classifiercode":"99-11","member_number":"Ty59267","first_name":"BRAD","last_name":"MCKIERNAN","classification":"M","division":"PCC","hit_factor":11.2903},{"match_name":"GoShoot Outdoor January 10th","match_date":"2021-01-10","stage_classifiercode":"99-11","member_number":"A73267","first_name":"MATT","last_name":"MARTINI","classification":"A","division":"PCC","hit_factor":11.2621},{"match_name":"ORPCI 2018.03.31 USPSA Special","match_date":"2018-03-31","stage_classifiercode":"99-11","member_number":"A82559","first_name":"TRAVIS","last_name":"FITZPATRICK","classification":"M","division":"PCC","hit_factor":11.2554},{"match_name":"FBURG July 2018 Level I USPSA ","match_date":"2018-07-01","stage_classifiercode":"99-11","member_number":"FY83588","first_name":"IAN","last_name":"MEYERS","classification":"G","division":"PCC","hit_factor":11.2412},{"match_name":"Competitive Shooters of Lake Norman CORNELIUS Thursday Evening Indoor USPSA Pistol Match North Carolina","match_date":"2020-09-17","stage_classifiercode":"99-11","member_number":"A90559","first_name":"IKE","last_name":"STARNES","classification":"M","division":"PCC","hit_factor":11.2186},{"match_name":"SSS USPSA February 2020","match_date":"2020-02-16","stage_classifiercode":"99-11","member_number":"A58000","first_name":"JAMES PCC","last_name":"SMITH","classification":"U (Unclassified)","division":"PCC","hit_factor":11.1801},{"match_name":"Brazosland Pistoleros USPSA - Sunday August 8th","match_date":"2021-08-08","stage_classifiercode":"99-11","member_number":"A87214","first_name":"CORY","last_name":"KLEMASHEVICH","classification":"G","division":"PCC","hit_factor":11.1776},{"match_name":"IN19 ACC USPSA September 23","match_date":"2018-09-23","stage_classifiercode":"99-11","member_number":"A88985","first_name":"GREG","last_name":"HERRELL","classification":"G","division":"PCC","hit_factor":11.1607},{"match_name":"Benton Gun Club-USPSA June 28  9AM","match_date":"2020-06-28","stage_classifiercode":"99-11","member_number":"23689","first_name":"LENA","last_name":"MICULEK","classification":"G","division":"PCC","hit_factor":11.1588},{"match_name":"MCAS March 2021 USPSA","match_date":"2021-03-28","stage_classifiercode":"99-11","member_number":"TY75842","first_name":"JOE","last_name":"DESSON","classification":"A","division":"PCC","hit_factor":11.1349},{"match_name":"LdF USPSA Match January 25 2020","match_date":"2020-01-25","stage_classifiercode":"99-11","member_number":"TY68331","first_name":"AZIZ","last_name":"BROU","classification":"A","division":"PCC","hit_factor":11.1332},{"match_name":"Shoot GTR 05/07/17","match_date":"2017-05-07","stage_classifiercode":"99-11","member_number":"A73891","first_name":"TOM","last_name":"CRAWFORD","classification":"M","division":"PCC","hit_factor":11.1332},{"match_name":"STAGE ZERO SHOOTING SUPPLY USPSA","match_date":"2020-07-16","stage_classifiercode":"99-11","member_number":"A125781","first_name":"ISAAC","last_name":"HANSEN","classification":"A","division":"PCC","hit_factor":11.0855},{"match_name":"Custer USPSA Mar 7th 2021","match_date":"2021-03-07","stage_classifiercode":"99-11","member_number":"A28558","first_name":"MIKE","last_name":"LEANDER","classification":"M","division":"PCC","hit_factor":11.0672},{"match_name":"Strategic Edge July 2018 USPSA","match_date":"2018-07-21","stage_classifiercode":"99-11","member_number":"\"\"","first_name":"JUSTIN","last_name":"COOPER","classification":"M","division":"PCC","hit_factor":11.0476},{"match_name":"HPS April Tax Time Fun Shoot","match_date":"2017-04-22","stage_classifiercode":"99-11","member_number":"FY49431","first_name":"APOLONIO","last_name":"DULATRE","classification":"U","division":"PCC","hit_factor":10.9804},{"match_name":"USPSA MO21 2Alpha SBRC March 2018","match_date":"2018-03-24","stage_classifiercode":"99-11","member_number":"A101632","first_name":"GREG","last_name":"YEN","classification":"M","division":"PCC","hit_factor":10.9756},{"match_name":"Shadow Hawk Defense USPSA Special Classifier","match_date":"2020-11-14","stage_classifiercode":"99-11","member_number":"TY36345","first_name":"\"JOHN \"\"MIG\"\"\"","last_name":"MIGLIACCIO","classification":"A","division":"PCC","hit_factor":10.9689},{"match_name":"Devil Dog USPSA Classifier Match-Saturday Session","match_date":"2018-03-10","stage_classifiercode":"99-11","member_number":"A78407","first_name":"TODD","last_name":"JESSEE","classification":"M","division":"PCC","hit_factor":10.9589},{"match_name":"SLPSA July USPSA match","match_date":"2018-07-21","stage_classifiercode":"99-11","member_number":"A70490","first_name":"JOSH","last_name":"WAKAMATSU","classification":"M","division":"PCC","hit_factor":10.9434},{"match_name":"Applied IN25 USPSA August 15th 2018","match_date":"2018-08-15","stage_classifiercode":"99-11","member_number":"TY102132","first_name":"DAN","last_name":"QUESENBERY","classification":"A","division":"PCC","hit_factor":10.929},{"match_name":"TBAS USPSA Match 2/21/21","match_date":"2021-02-21","stage_classifiercode":"99-11","member_number":"A114253","first_name":"ZACH","last_name":"PARKER","classification":"U","division":"PCC","hit_factor":10.9015},{"match_name":"LCSC Linden USPSA 092621","match_date":"2021-09-25","stage_classifiercode":"99-11","member_number":"Ty44154","first_name":"KEITH","last_name":"GARCIA","classification":"G","division":"PCC","hit_factor":10.8527},{"match_name":"Payson Practical Shooters - USPSA 2018 01 06","match_date":"2018-01-06","stage_classifiercode":"99-11","member_number":"TY61938","first_name":"TIM","last_name":"SMITH","classification":"U","division":"PCC","hit_factor":10.8434},{"match_name":"NW01 April da Turd","match_date":"2018-04-04","stage_classifiercode":"99-11","member_number":"A108597","first_name":"JP","last_name":"SULLIVAN","classification":"U","division":"PCC","hit_factor":10.8108},{"match_name":"WSPS JUNE 2018 USPSA MATCH","match_date":"2018-06-16","stage_classifiercode":"99-11","member_number":"TY85668","first_name":"SCOTT","last_name":"APPOLDT","classification":"A","division":"PCC","hit_factor":10.8},{"match_name":"SCCC CLASSIFIER MATCH 7_23_17","match_date":"2017-07-23","stage_classifiercode":"99-11","member_number":"rd6","first_name":"MIKE","last_name":"FOLEY","classification":"M","division":"PCC","hit_factor":10.7884},{"match_name":"Grandbaggers August 2017","match_date":"2017-08-03","stage_classifiercode":"99-11","member_number":"A49393","first_name":"NAIM","last_name":"SAITI","classification":"M","division":"PCC","hit_factor":10.7865},{"match_name":"Rio Salado RSPP 3rd Saturday February 2020","match_date":"2020-02-15","stage_classifiercode":"99-11","member_number":"TY91008","first_name":"KARL","last_name":"ROBINSON","classification":"A","division":"PCC","hit_factor":10.7807},{"match_name":"WGC August 2018 USPSA Classifier","match_date":"2018-08-12","stage_classifiercode":"99-11","member_number":"L3696","first_name":"ROBERT","last_name":"HALSELL","classification":"M","division":"PCC","hit_factor":10.7807},{"match_name":"Pardoe Sportsmens Association- USPSA Saturday 4-3-21","match_date":"2021-04-03","stage_classifiercode":"99-11","member_number":"TY51935","first_name":"RICH","last_name":"DAUGHERTY","classification":"A","division":"PCC","hit_factor":10.7607},{"match_name":"SSS USPSA June 2020 FATHERS DAY Match","match_date":"2020-06-21","stage_classifiercode":"99-11","member_number":"TY93719","first_name":"JOHN","last_name":"WESTBROOK","classification":"A (A Class)","division":"PCC","hit_factor":10.7607},{"match_name":"SCCC CLASSIFIER MATCH 7_23_17","match_date":"2017-07-23","stage_classifiercode":"99-11","member_number":"Ty90556","first_name":"ALVIN","last_name":"LIN","classification":"U","division":"PCC","hit_factor":10.7527},{"match_name":"Afternoon SMPS 09 February 2020 USPSA Classifier Match","match_date":"2020-02-09","stage_classifiercode":"99-11","member_number":"A101908","first_name":"MAURO","last_name":"FARINELLI","classification":"B","division":"PCC","hit_factor":10.7075},{"match_name":"AGC_20170903","match_date":"2017-09-03","stage_classifiercode":"99-11","member_number":"TY58112","first_name":"MITCH","last_name":"MORA","classification":"M","division":"PCC","hit_factor":10.6931},{"match_name":"OFGC Practical Pistol Match 01-19-2020","match_date":"2020-01-19","stage_classifiercode":"99-11","member_number":"TY81825","first_name":"IAN","last_name":"ZACHER","classification":"G","division":"PCC","hit_factor":10.6329},{"match_name":"SRSC USPSA 8-29-20","match_date":"2020-08-29","stage_classifiercode":"99-11","member_number":"A115927","first_name":"GRAF","last_name":"RONNIE","classification":"B","division":"PCC","hit_factor":10.6299},{"match_name":"APSC 4th Annual Holiday Hosefest USPSA Match 12-02-17","match_date":"2017-12-02","stage_classifiercode":"99-11","member_number":"A87214","first_name":"CORY","last_name":"KLEMASHEVICH","classification":"G","division":"PCC","hit_factor":10.6262},{"match_name":"Prescott Action Shooters 1st Saturday USPSA 6-2-2018 ","match_date":"2018-06-03","stage_classifiercode":"99-11","member_number":"L2757","first_name":"RICK","last_name":"PUNU","classification":"M","division":"PCC","hit_factor":10.6262},{"match_name":"STAGE ZERO SHOOTING SUPPLY USPSA","match_date":"2020-07-16","stage_classifiercode":"99-11","member_number":"A115477","first_name":"JOSHUA","last_name":"YOST","classification":"A","division":"PCC","hit_factor":10.6061},{"match_name":"Grandbaggers 07-05-2018","match_date":"2018-07-05","stage_classifiercode":"99-11","member_number":"A111792","first_name":"CHRIS","last_name":"PAVEK","classification":"U","division":"PCC","hit_factor":10.6007},{"match_name":"2020-03 Bone Creek USPSA","match_date":"2020-03-01","stage_classifiercode":"99-11","member_number":"A101550","first_name":"ERIC","last_name":"SCHNITZER","classification":"B","division":"PCC","hit_factor":10.5991},{"match_name":"Hammer Down USPSA Tue Night","match_date":"2017-11-07","stage_classifiercode":"99-11","member_number":"a95630","first_name":"DERRICK","last_name":"ALLEN","classification":"M","division":"PCC","hit_factor":10.5906},{"match_name":"Shoot GTR 05/07/17","match_date":"2017-05-07","stage_classifiercode":"99-11","member_number":"A73910","first_name":"JEREMY","last_name":"LIGHTNER","classification":"U","division":"PCC","hit_factor":10.5906},{"match_name":"Shadow Hawk Defense USPSA Special Classifier","match_date":"2020-11-14","stage_classifiercode":"99-11","member_number":"TY21063","first_name":"CHUCK","last_name":"BOLEN","classification":"A","division":"PCC","hit_factor":10.566},{"match_name":"Ontelaunee USPSA  July 2018","match_date":"2018-07-29","stage_classifiercode":"99-11","member_number":"TY85668","first_name":"SCOTT","last_name":"APPOLDT","classification":"A","division":"PCC","hit_factor":10.5505},{"match_name":"APSC 4th Annual Holiday Hosefest USPSA Match 12-02-17","match_date":"2017-12-02","stage_classifiercode":"99-11","member_number":"A83285","first_name":"GARY PCC","last_name":"AU","classification":"A","division":"PCC","hit_factor":10.5263},{"match_name":"CRCPS 2020-08-08","match_date":"2020-08-08","stage_classifiercode":"99-11","member_number":"A102318","first_name":"TED (2ND GUN)","last_name":"NISCHAN","classification":"U","division":"PCC","hit_factor":10.5263},{"match_name":"SCCC CLASSIFIER MATCH 7_23_17","match_date":"2017-07-23","stage_classifiercode":"99-11","member_number":"A82559","first_name":"TRAVIS","last_name":"FITZPATRICK","classification":"A","division":"PCC","hit_factor":10.5263},{"match_name":"FBURG July 2018 Level I USPSA ","match_date":"2018-07-01","stage_classifiercode":"99-11","member_number":"A94295","first_name":"KEATON","last_name":"PEARSON","classification":"U","division":"PCC","hit_factor":10.5263},{"match_name":"Grandbaggers September 2018","match_date":"2018-09-06","stage_classifiercode":"99-11","member_number":"TY35327","first_name":"KELLY","last_name":"NEAL","classification":"M","division":"PCC","hit_factor":10.5263},{"match_name":"LPRGC-Lower Providence USPSA May-1 2017","match_date":"2017-05-05","stage_classifiercode":"99-11","member_number":"A52782","first_name":"MATT","last_name":"OLINCHAK","classification":"U","division":"PCC","hit_factor":10.4673},{"match_name":"Castlewood USPSA Sept 2020 shoot","match_date":"2020-09-26","stage_classifiercode":"99-11","member_number":"TY-51935","first_name":"RICH","last_name":"DAUGHERTY","classification":"A","division":"PCC","hit_factor":10.4505},{"match_name":"Pardoe Sportsmens Association- USPSA Saturday 4-3-21","match_date":"2021-04-03","stage_classifiercode":"99-11","member_number":"Ty85173","first_name":"RYAN","last_name":"ZAMBRZYCKI","classification":"U","division":"PCC","hit_factor":10.4478},{"match_name":"Free State PCC Match 8-29","match_date":"2020-08-29","stage_classifiercode":"99-11","member_number":"TY568","first_name":"RICK","last_name":"BYFIELD","classification":"M","division":"PCC","hit_factor":10.4449},{"match_name":"FBURG July 2018 Level I USPSA ","match_date":"2018-07-01","stage_classifiercode":"99-11","member_number":"FY15413","first_name":"TOM","last_name":"SUIT","classification":"A","division":"PCC","hit_factor":10.4449},{"match_name":"Extreme GM","match_date":"2020-06-12","stage_classifiercode":"99-11","member_number":"A62670","first_name":"DARREN","last_name":"SCHNEIDR","classification":"M","division":"PCC","hit_factor":10.4089},{"match_name":"ACPSA November 2018","match_date":"2018-11-24","stage_classifiercode":"99-11","member_number":"A106054","first_name":"CHRIS","last_name":"FOWLER","classification":"M","division":"PCC","hit_factor":10.4046},{"match_name":"Baileys July 2017","match_date":"2017-07-02","stage_classifiercode":"99-11","member_number":"a69840","first_name":"JOSHUA","last_name":"MAZZOLA","classification":"M","division":"PCC","hit_factor":10.4046},{"match_name":"Grandbaggers August 2017","match_date":"2017-08-03","stage_classifiercode":"99-11","member_number":"TY90353","first_name":"TRAVIS","last_name":"MCCAMISH","classification":"U","division":"PCC","hit_factor":10.3896},{"match_name":"BTSA USPSA 2021-7 Aug 7","match_date":"2021-08-07","stage_classifiercode":"99-11","member_number":"F128383","first_name":"MITCHELL","last_name":"MCQUIGGIN","classification":"U","division":"PCC","hit_factor":10.3647},{"match_name":"PCSI USPSA March 6th 2021","match_date":"2020-11-28","stage_classifiercode":"99-11","member_number":"A102072","first_name":"ANTHONY","last_name":"ZABONIK","classification":"A","division":"PCC","hit_factor":10.3571},{"match_name":"June 2018 CAS USPSA","match_date":"2018-06-03","stage_classifiercode":"99-11","member_number":"TY75540","first_name":"JAMES","last_name":"MAY","classification":"A","division":"PCC","hit_factor":10.3512},{"match_name":"Pardoe Sportsmens Association- USPSA Saturday 4-3-21","match_date":"2021-04-03","stage_classifiercode":"99-11","member_number":"Ty85173","first_name":"RYAN","last_name":"ZAMBRZYCKI","classification":"M","division":"PCC","hit_factor":10.3448},{"match_name":"HTF Practical Shooters","match_date":"2017-11-30","stage_classifiercode":"99-11","member_number":"A54880","first_name":"STEFAN","last_name":"WIGGINS","classification":"G","division":"PCC","hit_factor":10.3448},{"match_name":"Deadwood Boys USPSA All Classifier Match - 29 July 2018","match_date":"2018-07-29","stage_classifiercode":"99-11","member_number":"A96044","first_name":"SEAN","last_name":"HENSLEY","classification":"B","division":"PCC","hit_factor":10.3131},{"match_name":"7-30 Match","match_date":"2017-07-30","stage_classifiercode":"99-11","member_number":"A57351","first_name":"COREY","last_name":"ESTILL","classification":"U","division":"PCC","hit_factor":10.302},{"match_name":"Holmen USPSA 10/30/16","match_date":"2016-10-30","stage_classifiercode":"99-11","member_number":"A91806","first_name":"JOSH","last_name":"FROELICH","classification":"U","division":"PCC","hit_factor":10.2857},{"match_name":"MPPL 11042018 Hoser Heaven","match_date":"2018-11-04","stage_classifiercode":"99-11","member_number":"TY84441","first_name":"SEAN","last_name":"HATADA","classification":"B","division":"PCC","hit_factor":10.2767},{"match_name":"Prescott Action Shooters 1st Saturday USPSA 6-2-2018 ","match_date":"2018-06-03","stage_classifiercode":"99-11","member_number":"TY31924","first_name":"OTIS","last_name":"AUSTIN","classification":"G","division":"PCC","hit_factor":10.2767},{"match_name":"Deadwood Boys USPSA All Classifier Match","match_date":"2016-08-07","stage_classifiercode":"99-11","member_number":"L2354","first_name":"TARAN","last_name":"BUTLER","classification":"U","division":"PCC","hit_factor":10.2564},{"match_name":"HOPS USPSA 072118","match_date":"2018-07-21","stage_classifiercode":"99-11","member_number":"TY87848","first_name":"MATT","last_name":"FOX","classification":"U","division":"PCC","hit_factor":10.2273},{"match_name":"ORPCI 2018.03.31 USPSA Special","match_date":"2018-03-31","stage_classifiercode":"99-11","member_number":"A89356","first_name":"CHASE","last_name":"HARBER","classification":"M","division":"PCC","hit_factor":10.2273},{"match_name":"Hopkinton USPSA October 2018","match_date":"2018-10-06","stage_classifiercode":"99-11","member_number":"L4396","first_name":"CURT","last_name":"CASERTA","classification":"M","division":"PCC","hit_factor":10.2273},{"match_name":"Shasta Shooters 2018 June Special Classifier","match_date":"2018-06-09","stage_classifiercode":"99-11","member_number":"L4425","first_name":"MITCH","last_name":"MORA","classification":"M","division":"PCC","hit_factor":10.2249},{"match_name":"MCRC USPSA August 2018","match_date":"2018-08-11","stage_classifiercode":"99-11","member_number":"A102564","first_name":"DONALD","last_name":"POWERS","classification":"G","division":"PCC","hit_factor":10.2222},{"match_name":"WVRPC USPSA 1SEPT2018","match_date":"2018-09-01","stage_classifiercode":"99-11","member_number":"A88985","first_name":"GREG","last_name":"HERRELL","classification":"G","division":"PCC","hit_factor":10.2128},{"match_name":"USPSA MO21 2Alpha SBRC December 22 2018","match_date":"2018-12-22","stage_classifiercode":"99-11","member_number":"A101856","first_name":"NICHOLAS","last_name":"GROSS","classification":"B","division":"PCC","hit_factor":10.2113},{"match_name":"Grandbaggers 07-05-2018","match_date":"2018-07-05","stage_classifiercode":"99-11","member_number":"A48182","first_name":"RICH","last_name":"HIGGINS","classification":"M","division":"PCC","hit_factor":10.2113},{"match_name":"BA USPSA Sep  23/2017","match_date":"2017-09-23","stage_classifiercode":"99-11","member_number":"TY42975","first_name":"JASON","last_name":"RATLIFF","classification":"U","division":"PCC","hit_factor":10.1996},{"match_name":"PRG 2017 Classifier Match","match_date":"2017-02-19","stage_classifiercode":"99-11","member_number":"TY85661","first_name":"KEITH","last_name":"SORRELL","classification":"A","division":"PCC","hit_factor":10.1887},{"match_name":"USPSA MO21 2Alpha SBRC March 2018","match_date":"2018-03-24","stage_classifiercode":"99-11","member_number":"TY89171","first_name":"AUSTIN KYLE","last_name":"CHAMBERLAIN","classification":"A","division":"PCC","hit_factor":10.1695},{"match_name":"INAS USPSA Nov 2017","match_date":"2017-11-12","stage_classifiercode":"99-11","member_number":"FY87913","first_name":"JONATHAN","last_name":"MOORE","classification":"B","division":"PCC","hit_factor":10.1695},{"match_name":"Deadwood Boys USPSA All Classifier Match - 29 July 2018","match_date":"2018-07-29","stage_classifiercode":"99-11","member_number":"A110510","first_name":"STEVE","last_name":"MILES","classification":"A","division":"PCC","hit_factor":10.1695},{"match_name":"Benton Gun Club-USPSA September 27","match_date":"2020-09-27","stage_classifiercode":"99-11","member_number":"a81036","first_name":"ELI","last_name":"RUSHING","classification":"A","division":"PCC","hit_factor":10.1633},{"match_name":"USPSA CM99 Special Classifier MO19 Lamar October 9 2016","match_date":"2016-10-09","stage_classifiercode":"99-11","member_number":"a78550","first_name":"BILLY","last_name":"YORK","classification":"U","division":"PCC","hit_factor":10.1633},{"match_name":"Bayou City USPSA Weekly June 4","match_date":"2020-06-04","stage_classifiercode":"99-11","member_number":"A81745","first_name":"AJ","last_name":"JACKSON","classification":"A","division":"PCC","hit_factor":10.1633},{"match_name":"STAGE ZERO SHOOTING SUPPLY USPSA","match_date":"2020-07-16","stage_classifiercode":"99-11","member_number":"A120941","first_name":"LIZZIE","last_name":"DAVIS","classification":"C","division":"PCC","hit_factor":10.1576},{"match_name":"Richmond Hot Shots April 14-15-2018 USPSA Pistol Match","match_date":"2018-04-14","stage_classifiercode":"99-11","member_number":"A51928","first_name":"CESAR","last_name":"MATA","classification":"M","division":"PCC","hit_factor":10.1365},{"match_name":"ANPRACS USPSA 6-3-18","match_date":"2018-06-03","stage_classifiercode":"99-11","member_number":"A73074","first_name":"STEVE","last_name":"COULTER","classification":"G","division":"PCC","hit_factor":10.1365},{"match_name":"WSPS JUNE 2018 USPSA MATCH","match_date":"2018-06-16","stage_classifiercode":"99-11","member_number":"TY58697","first_name":"GARY","last_name":"PARSONS","classification":"A","division":"PCC","hit_factor":10.1167},{"match_name":"PSAC 20171028","match_date":"2017-10-28","stage_classifiercode":"99-11","member_number":"TY55863","first_name":"SEAN","last_name":"MYHRE","classification":"M","division":"PCC","hit_factor":10.101},{"match_name":"November 2016 PCSI USPSA Monster Match","match_date":"2016-11-05","stage_classifiercode":"99-11","member_number":"\"\"","first_name":"CLEMENT","last_name":"HO","classification":"U","division":"PCC","hit_factor":10.0971},{"match_name":"2020-03 Bone Creek USPSA","match_date":"2020-03-01","stage_classifiercode":"99-11","member_number":"A108675","first_name":"JERRY","last_name":"MCCULLICK","classification":"M","division":"PCC","hit_factor":10.0775},{"match_name":"HPPS 1-16-2021","match_date":"2021-01-16","stage_classifiercode":"99-11","member_number":"L3719","first_name":"MATTHEW","last_name":"HESS","classification":"M","division":"PCC","hit_factor":10.0719},{"match_name":"Prescott 1st Saturday 8-05-17","match_date":"2017-08-05","stage_classifiercode":"99-11","member_number":"TY31924","first_name":"OTIS","last_name":"AUSTIN","classification":"A","division":"PCC","hit_factor":10.0539},{"match_name":"Grandbaggers September 2018","match_date":"2018-09-06","stage_classifiercode":"99-11","member_number":"A48182","first_name":"RICH","last_name":"HIGGINS","classification":"M","division":"PCC","hit_factor":10.052},{"match_name":"GoShoot Outdoor January 10th","match_date":"2021-01-10","stage_classifiercode":"99-11","member_number":"FY105635","first_name":"JACK","last_name":"MURRAY","classification":"U","division":"PCC","hit_factor":10.0503},{"match_name":"LdF USPSA Match May 12 2018","match_date":"2018-05-12","stage_classifiercode":"99-11","member_number":"A38618","first_name":"HENRY","last_name":"TORIBIO","classification":"A","division":"PCC","hit_factor":10.0402},{"match_name":"SMPS USPSA Feb 9 2020 AM Classifier","match_date":"2020-02-05","stage_classifiercode":"99-11","member_number":"A47067","first_name":"AL","last_name":"REALUYO","classification":"U","division":"PCC","hit_factor":10.0334},{"match_name":"Campeonato USPSA 2020","match_date":"2020-05-30","stage_classifiercode":"99-11","member_number":"F109950","first_name":"FRANCISCO","last_name":"RODRIGUEZ-DIAZ","classification":"M","division":"PCC","hit_factor":10.02},{"match_name":"Pardoe Sportsmens Association-WPA14-2017-10-01","match_date":"2017-10-01","stage_classifiercode":"99-11","member_number":"TY81249","first_name":"BRIAN","last_name":"MILLER","classification":"B","division":"PCC","hit_factor":10.0173},{"match_name":"RangeMasters 5-31-2018","match_date":"2018-05-31","stage_classifiercode":"99-11","member_number":"A94852","first_name":"RANDY","last_name":"GOODNEY","classification":"A","division":"PCC","hit_factor":10},{"match_name":"MPSA 07182020 USPSA","match_date":"2020-07-18","stage_classifiercode":"99-11","member_number":"A76040","first_name":"TROY","last_name":"MOSHER","classification":"B","division":"PCC","hit_factor":10},{"match_name":"The Hollow 20 Aug 2018","match_date":"2018-08-20","stage_classifiercode":"99-11","member_number":"TY70663","first_name":"NIC","last_name":"SCHEUFLER","classification":"U","division":"PCC","hit_factor":9.9834},{"match_name":"Douglas Ridge USPSA March 7","match_date":"2020-03-07","stage_classifiercode":"99-11","member_number":"A102894","first_name":"JACK","last_name":"LAPHAM","classification":"M","division":"PCC","hit_factor":9.9834},{"match_name":"PSAC 20171028","match_date":"2017-10-28","stage_classifiercode":"99-11","member_number":"A87706","first_name":"ALEX","last_name":"CHOTVACS","classification":"B","division":"PCC","hit_factor":9.9822},{"match_name":"Richmond Hot Shots October 6-7 USPSA Pistol Match","match_date":"2018-10-06","stage_classifiercode":"99-11","member_number":"A51928","first_name":"CESAR","last_name":"MATA","classification":"G","division":"PCC","hit_factor":9.9808},{"match_name":"Steel City USPSA December 2 2017","match_date":"2017-12-02","stage_classifiercode":"99-11","member_number":"L3655","first_name":"DARREN","last_name":"MULFORD","classification":"U","division":"PCC","hit_factor":9.9656},{"match_name":"Ontelaunee USPSA  July 2018","match_date":"2018-07-29","stage_classifiercode":"99-11","member_number":"TY58697","first_name":"GARY","last_name":"PARSONS","classification":"A","division":"PCC","hit_factor":9.9602},{"match_name":"LCHG May USPSA","match_date":"2017-05-21","stage_classifiercode":"99-11","member_number":"A65280","first_name":"TRAVIS","last_name":"MCKLOSKY","classification":"U","division":"PCC","hit_factor":9.9502},{"match_name":"ARPC USPSA Match 8-23-20","match_date":"2020-08-23","stage_classifiercode":"99-11","member_number":"TY89183","first_name":"STEVE","last_name":"CASH","classification":"A","division":"PCC","hit_factor":9.9265},{"match_name":"NAAS 03-05-2016","match_date":"2017-03-05","stage_classifiercode":"99-11","member_number":"A82223","first_name":"BRETT","last_name":"NETTLETON","classification":"U","division":"PCC","hit_factor":9.9206},{"match_name":"APSC USPSA 10-06-18","match_date":"2018-10-06","stage_classifiercode":"99-11","member_number":"\"\"","first_name":"GRADY","last_name":"STIEREN","classification":"M","division":"PCC","hit_factor":9.9138},{"match_name":"BRSP Tuesday Night USPSA Match - Oct 31","match_date":"2017-11-01","stage_classifiercode":"99-11","member_number":"A73074","first_name":"STEVE","last_name":"COULTER","classification":"\"\"","division":"PCC","hit_factor":9.9083},{"match_name":"ARPC USPSA Match 5-27-18","match_date":"2018-05-27","stage_classifiercode":"99-11","member_number":"A92235","first_name":"BENJAMIN","last_name":"KOKOTOVICH","classification":"C","division":"PCC","hit_factor":9.9048},{"match_name":"Ontelaunee USPSA Hose Fest","match_date":"2021-01-02","stage_classifiercode":"99-11","member_number":"L3851","first_name":"JEFF","last_name":"PAULSEN","classification":"G","division":"PCC","hit_factor":9.8712},{"match_name":"Prescott 1st Saturday 8-05-17","match_date":"2017-08-05","stage_classifiercode":"99-11","member_number":"L2757","first_name":"RICK","last_name":"PUNU","classification":"M","division":"PCC","hit_factor":9.854},{"match_name":"WELD ECO09 20180916","match_date":"2018-09-16","stage_classifiercode":"99-11","member_number":"A111409","first_name":"GEOFF","last_name":"WATERS","classification":"A","division":"PCC","hit_factor":9.8305},{"match_name":"STAGE ZERO SHOOTING SUPPLY USPSA","match_date":"2020-07-16","stage_classifiercode":"99-11","member_number":"A120853","first_name":"BRYCE","last_name":"LAEMMLEN","classification":"A","division":"PCC","hit_factor":9.8246},{"match_name":"Prescott Action Shooters 1st Saturday USPSA 6-2-2018 ","match_date":"2018-06-03","stage_classifiercode":"99-11","member_number":"L1828","first_name":"OMAR","last_name":"NEWBURY","classification":"M","division":"PCC","hit_factor":9.8232},{"match_name":"Almaden Valley Action Pistol 5-26-18","match_date":"2018-05-26","stage_classifiercode":"99-11","member_number":"A101653","first_name":"JONATHAN","last_name":"DIAZ","classification":"B","division":"PCC","hit_factor":9.8182},{"match_name":"Lafayette Practical Shooters - WED-THUR - Dec 19-20 - CLASSIFIER MATCH","match_date":"2018-12-20","stage_classifiercode":"99-11","member_number":"A108876","first_name":"ERIK","last_name":"BELSOM","classification":"U","division":"PCC","hit_factor":9.8113},{"match_name":"MPPL 11042018 Hoser Heaven","match_date":"2018-11-04","stage_classifiercode":"99-11","member_number":"FY49431","first_name":"APOLONIO","last_name":"DULATRE","classification":"M","division":"PCC","hit_factor":9.8004},{"match_name":"SFPC June 7 2020 AM     USPSA Monthly Match","match_date":"2020-06-07","stage_classifiercode":"99-11","member_number":"TY89888","first_name":"EDWARD","last_name":"SMITH","classification":"A","division":"PCC","hit_factor":9.7928},{"match_name":"ARPC USPSA Match 8-23-20","match_date":"2020-08-23","stage_classifiercode":"99-11","member_number":"A90200","first_name":"CRAIG","last_name":"CASH","classification":"B","division":"PCC","hit_factor":9.7902},{"match_name":"APS August 1st Monthly USPSA Match  Classifier Match","match_date":"2021-08-01","stage_classifiercode":"99-11","member_number":"A127606","first_name":"HERNAN","last_name":"DELGADO","classification":"M","division":"PCC","hit_factor":9.776},{"match_name":"WSPS JUNE 2018 USPSA MATCH","match_date":"2018-06-16","stage_classifiercode":"99-11","member_number":"TY80612","first_name":"FORREST","last_name":"LYSINGER","classification":"A","division":"PCC","hit_factor":9.772},{"match_name":"SMPS USPSA Match - May 8th 2021 (Note this is a Saturday Match)","match_date":"2021-05-08","stage_classifiercode":"99-11","member_number":"A75974","first_name":"DANIEL","last_name":"GOODWIN","classification":"A","division":"PCC","hit_factor":9.7649},{"match_name":"MISS Match 10-4-17","match_date":"2017-10-04","stage_classifiercode":"99-11","member_number":"A73683","first_name":"BRYAN","last_name":"TECSON","classification":"B","division":"PCC","hit_factor":9.7561},{"match_name":"Prescott Action Shooters 1st Saturday USPSA 7-7-2018","match_date":"2018-07-07","stage_classifiercode":"99-11","member_number":"L2757","first_name":"RICK","last_name":"PUNU","classification":"M","division":"PCC","hit_factor":9.7479},{"match_name":"OK15 USPSA at USSA","match_date":"2017-12-10","stage_classifiercode":"99-11","member_number":"A30136","first_name":"JERRY","last_name":"QUISENBERRY","classification":"A","division":"PCC","hit_factor":9.7391},{"match_name":"SUPS All Classifier Match March 1718 2018","match_date":"2018-03-17","stage_classifiercode":"99-11","member_number":"L3992","first_name":"TIM","last_name":"YACKLEY","classification":"A","division":"PCC","hit_factor":9.7378},{"match_name":"Maryland Practical Shooters Association July 2018","match_date":"2018-07-22","stage_classifiercode":"99-11","member_number":"A82592","first_name":"THOMAS","last_name":"KOH","classification":"M","division":"PCC","hit_factor":9.7315},{"match_name":"LCSA USPSA July Classifier Match","match_date":"2016-07-30","stage_classifiercode":"99-11","member_number":"L1205","first_name":"STEVE","last_name":"MARTIN","classification":"U","division":"PCC","hit_factor":9.7222},{"match_name":"2017 Bay bridge Charity Classic - Richmond October 14-15-2017","match_date":"2017-10-14","stage_classifiercode":"99-11","member_number":"FY33484","first_name":"CARLOS","last_name":"KATALBAS","classification":"M","division":"PCC","hit_factor":9.7222},{"match_name":"Competitive Shooters of Lake Norman CORNELIUS Thursday Evening Indoor USPSA Pistol Match North Carolina","match_date":"2020-09-17","stage_classifiercode":"99-11","member_number":"A96421","first_name":"BRANDON","last_name":"RATLIFF","classification":"A","division":"PCC","hit_factor":9.7196},{"match_name":"FBURG July 2018 Level I USPSA ","match_date":"2018-07-01","stage_classifiercode":"99-11","member_number":"FY62313","first_name":"TONY","last_name":"GIMMELLIE","classification":"G","division":"PCC","hit_factor":9.7196},{"match_name":"Richmond Hot Shots April 30-May 1st USPSA Pistol Match","match_date":"2016-04-30","stage_classifiercode":"99-11","member_number":"\"\"","first_name":"JOSEPH","last_name":"AUSTRIA","classification":"C","division":"PCC","hit_factor":9.7196},{"match_name":"SFPS 8-5-18 USPSA Match","match_date":"2018-08-05","stage_classifiercode":"99-11","member_number":"A111589","first_name":"STEVE","last_name":"NEWMAN","classification":"A","division":"PCC","hit_factor":9.7087},{"match_name":"SKSC USPSA April 2018 Match","match_date":"2018-04-21","stage_classifiercode":"99-11","member_number":"A95856","first_name":"DAVID","last_name":"HOEKSEMA","classification":"B","division":"PCC","hit_factor":9.7054},{"match_name":"Shadow Hawk Defense USPSA Special Classifier","match_date":"2020-11-14","stage_classifiercode":"99-11","member_number":"TY109443","first_name":"JASON","last_name":"TAJIMA","classification":"B","division":"PCC","hit_factor":9.7015},{"match_name":"Collin County USPSA 04-25-2021","match_date":"2021-04-24","stage_classifiercode":"99-11","member_number":"TY66303","first_name":"BRIAN","last_name":"HURST","classification":"B","division":"PCC","hit_factor":9.699},{"match_name":"Collin County USPSA 04-25-2021","match_date":"2021-04-24","stage_classifiercode":"99-11","member_number":"TY103871","first_name":"STEVE","last_name":"BURROUGHS","classification":"A","division":"PCC","hit_factor":9.699},{"match_name":"MRPC OHS02 042218","match_date":"2018-04-21","stage_classifiercode":"99-11","member_number":"A96252","first_name":"STEVE","last_name":"FISCHER","classification":"A","division":"PCC","hit_factor":9.6948},{"match_name":"WVRPC USPSA 1APR2017 CLASSIFIER","match_date":"2017-04-01","stage_classifiercode":"99-11","member_number":"TY86867","first_name":"ANDREW","last_name":"HEATH1","classification":"M","division":"PCC","hit_factor":9.6834},{"match_name":"LA05 Tangi USPSA 4th Sunday May 2021","match_date":"2021-05-23","stage_classifiercode":"99-11","member_number":"A129325","first_name":"JASON","last_name":"WONG","classification":"U","division":"PCC","hit_factor":9.6834},{"match_name":"RSPP 3rd Saturday November 2016","match_date":"2016-11-19","stage_classifiercode":"99-11","member_number":"\"\"","first_name":"KERRY","last_name":"PEARSON","classification":"M","division":"PCC","hit_factor":9.6774},{"match_name":"CGGR July USPSA Match","match_date":"2018-07-21","stage_classifiercode":"99-11","member_number":"A102011","first_name":"STEVEN","last_name":"LUCK","classification":"B","division":"PCC","hit_factor":9.6618},{"match_name":"BORCC USPSA May 2018","match_date":"2018-05-26","stage_classifiercode":"99-11","member_number":"\"\"","first_name":"JOHN","last_name":"WILSON","classification":"U","division":"PCC","hit_factor":9.6618},{"match_name":"Bossier Parish Practical Shooters August 16 2020","match_date":"2020-08-16","stage_classifiercode":"99-11","member_number":"TY116299","first_name":"JUSTIN","last_name":"HEATON","classification":"U","division":"PCC","hit_factor":9.6579},{"match_name":"The Hollow 6 June 2018","match_date":"2018-08-06","stage_classifiercode":"99-11","member_number":"TY70663","first_name":"NIC","last_name":"SCHEUFLER","classification":"U","division":"PCC","hit_factor":9.6552},{"match_name":"PCPS Classifier and Slot Match Jan 2020","match_date":"2020-01-12","stage_classifiercode":"99-11","member_number":"A110112","first_name":"SHINE","last_name":"TAYLOR","classification":"U","division":"PCC","hit_factor":9.6506},{"match_name":"SLPSA August USPSA Match 2","match_date":"2020-08-15","stage_classifiercode":"99-11","member_number":"A74550","first_name":"KIRBY","last_name":"LUNT","classification":"B","division":"PCC","hit_factor":9.6346},{"match_name":"FSA USPSA 01-26-20","match_date":"2020-01-27","stage_classifiercode":"99-11","member_number":"A51560","first_name":"MIKE","last_name":"HIMMEL","classification":"B","division":"PCC","hit_factor":9.6257},{"match_name":"Fairfax PS USPSA  2018 October","match_date":"2018-10-16","stage_classifiercode":"99-11","member_number":"TY83821","first_name":"DEREK","last_name":"EINSIG","classification":"M","division":"PCC","hit_factor":9.6186},{"match_name":"HPS All-Classifier  Match","match_date":"2017-10-01","stage_classifiercode":"99-11","member_number":"A104329","first_name":"DAVID","last_name":"KIKUKAWA","classification":"U","division":"PCC","hit_factor":9.6026},{"match_name":"Benton Gun Club-USPSA June 27  9AM","match_date":"2021-06-27","stage_classifiercode":"99-11","member_number":"A81036","first_name":"ELI","last_name":"RUSHING","classification":"A","division":"PCC","hit_factor":9.6},{"match_name":"Richmond Hot Shots April 14-15-2018 USPSA Pistol Match","match_date":"2018-04-14","stage_classifiercode":"99-11","member_number":"TY84211","first_name":"GEORGE","last_name":"TY","classification":"B","division":"PCC","hit_factor":9.589},{"match_name":"2017 Bay bridge Charity Classic - Richmond October 14-15-2017","match_date":"2017-10-14","stage_classifiercode":"99-11","member_number":"A85917","first_name":"JOHN","last_name":"RICCHIUTO","classification":"D","division":"PCC","hit_factor":9.5868},{"match_name":"ShooT GTR USPSA 1/1/17","match_date":"2017-01-01","stage_classifiercode":"99-11","member_number":"A86924","first_name":"MICHAEL","last_name":"STACK","classification":"B","division":"PCC","hit_factor":9.5868},{"match_name":"NHRPC - March 2021 USPSA","match_date":"2021-03-14","stage_classifiercode":"99-11","member_number":"Ty106397","first_name":"BRIAN","last_name":"VEISZ","classification":"A","division":"PCC","hit_factor":9.5785},{"match_name":"Brazosland Pistoleros August 20 2017","match_date":"2017-08-20","stage_classifiercode":"99-11","member_number":"A87214","first_name":"CORY","last_name":"KLEMASHEVICH","classification":"M","division":"PCC","hit_factor":9.5785},{"match_name":"NW01 April da Turd","match_date":"2018-04-04","stage_classifiercode":"99-11","member_number":"A100482","first_name":"TIM","last_name":"NOVASKY","classification":"B","division":"PCC","hit_factor":9.5745},{"match_name":"Rio Salado RSPP 3rd Saturday February 2020","match_date":"2020-02-15","stage_classifiercode":"99-11","member_number":"TY83533","first_name":"ANDY","last_name":"FEIGIN","classification":"U","division":"PCC","hit_factor":9.5694},{"match_name":"NW01 Paul Bunyan CS Series May 9 2021","match_date":"2021-05-09","stage_classifiercode":"99-11","member_number":"Fy23884","first_name":"GREG","last_name":"PURCELL","classification":"G","division":"PCC","hit_factor":9.5634},{"match_name":"MCRC USPSA August 2018","match_date":"2018-08-11","stage_classifiercode":"99-11","member_number":"A105091","first_name":"MATT","last_name":"GINN","classification":"B","division":"PCC","hit_factor":9.5575},{"match_name":"November 2016 PCSI USPSA Monster Match","match_date":"2016-11-05","stage_classifiercode":"99-11","member_number":"A83752","first_name":"LUKE","last_name":"GOSNELL","classification":"U","division":"PCC","hit_factor":9.5238},{"match_name":"Prescott 1st Saturday 8-05-17","match_date":"2017-08-05","stage_classifiercode":"99-11","member_number":"L4264","first_name":"BILL","last_name":"MUNGER","classification":"M","division":"PCC","hit_factor":9.5238},{"match_name":"West Coast IPSC","match_date":"2018-07-22","stage_classifiercode":"99-11","member_number":"A38618","first_name":"HENRY","last_name":"TORIBIO","classification":"A","division":"PCC","hit_factor":9.5238},{"match_name":"Heritage March 2021 USPSA","match_date":"2021-03-13","stage_classifiercode":"99-11","member_number":"TY54880","first_name":"STEFAN","last_name":"WIGGINS","classification":"G","division":"PCC","hit_factor":9.5238},{"match_name":"Hopkinton June  2016","match_date":"2016-06-04","stage_classifiercode":"99-11","member_number":"\"\"","first_name":"SCOTT","last_name":"WIMBERLY","classification":"\"\"","division":"PCC","hit_factor":9.4903},{"match_name":"Bayou City USPSA Weekly Dec 17","match_date":"2020-12-18","stage_classifiercode":"99-11","member_number":"TY79434","first_name":"GARRY","last_name":"NEWTON","classification":"M","division":"PCC","hit_factor":9.4771},{"match_name":"The Hollow 6 June 2018","match_date":"2018-08-06","stage_classifiercode":"99-11","member_number":"TY70663","first_name":"NIC","last_name":"SCHEUFLER","classification":"U","division":"PCC","hit_factor":9.4718},{"match_name":"July 2016 H&H Match","match_date":"2016-07-24","stage_classifiercode":"99-11","member_number":"A66108","first_name":"ERIC","last_name":"CROTSLEY","classification":"M","division":"PCC","hit_factor":9.4374},{"match_name":"Rankin Field Sunday USPSA","match_date":"2018-04-15","stage_classifiercode":"99-11","member_number":"A96473","first_name":"ADAM","last_name":"MUTHWILL","classification":"A","division":"PCC","hit_factor":9.4241},{"match_name":"USPSA MO21 2Alpha SBRC December 22 2018","match_date":"2018-12-22","stage_classifiercode":"99-11","member_number":"A99663","first_name":"MIKE K","last_name":"SPEAR","classification":"M","division":"PCC","hit_factor":9.4203},{"match_name":"CFRPC April USPSA Match","match_date":"2018-04-15","stage_classifiercode":"99-11","member_number":"\"\"","first_name":"NICK","last_name":"DEFILE","classification":"U","division":"PCC","hit_factor":9.4178},{"match_name":"Chillicothe February 2021 USPSA Match","match_date":"2021-02-28","stage_classifiercode":"99-11","member_number":"A62909","first_name":"TROY","last_name":"NOBLE","classification":"B","division":"PCC","hit_factor":9.4156},{"match_name":"RBGC 2017-06-24","match_date":"2017-06-24","stage_classifiercode":"99-11","member_number":"A86488","first_name":"DEREK","last_name":"GIDDINGS","classification":"B","division":"PCC","hit_factor":9.4077},{"match_name":"MCPSL Pistol 8-12-17","match_date":"2017-08-12","stage_classifiercode":"99-11","member_number":"A96146","first_name":"BEN","last_name":"DEHAEMERS","classification":"U","division":"PCC","hit_factor":9.407},{"match_name":"GRPC USPSA TAX REFUND ","match_date":"2018-04-15","stage_classifiercode":"99-11","member_number":"A87497","first_name":"ERIC","last_name":"CASTILLO","classification":"M","division":"PCC","hit_factor":9.4017},{"match_name":"Brazosland Pistoleros August 20 2017","match_date":"2017-08-20","stage_classifiercode":"99-11","member_number":"A94852","first_name":"RANDY","last_name":"GOODNEY","classification":"A","division":"PCC","hit_factor":9.3913},{"match_name":"OK15 USPSA at USSA May 6th 2018","match_date":"2018-05-06","stage_classifiercode":"99-11","member_number":"Fy69238","first_name":"TONY","last_name":"WALL","classification":"M","division":"PCC","hit_factor":9.3878},{"match_name":"SAPSA January 2020 Match","match_date":"2020-01-18","stage_classifiercode":"99-11","member_number":"A110524","first_name":"LITO","last_name":"LUCAS","classification":"M","division":"PCC","hit_factor":9.3851},{"match_name":"FBURG July 2018 Level I USPSA ","match_date":"2018-07-01","stage_classifiercode":"99-11","member_number":"TY66458","first_name":"ERIC","last_name":"EVANS","classification":"U","division":"PCC","hit_factor":9.3817},{"match_name":"Deadwood Boys USPSA All Classifier Match - 29 July 2018","match_date":"2018-07-29","stage_classifiercode":"99-11","member_number":"A94923","first_name":"WILSON","last_name":"PARK","classification":"B","division":"PCC","hit_factor":9.3802},{"match_name":"Richmond Hot Shots October 6-7 USPSA Pistol Match","match_date":"2018-10-06","stage_classifiercode":"99-11","member_number":"L2859","first_name":"MARK","last_name":"TURRIN","classification":"U","division":"PCC","hit_factor":9.3802},{"match_name":"LdF USPSA Match May 12 2018","match_date":"2018-05-12","stage_classifiercode":"99-11","member_number":"FY60951","first_name":"LAWRENCE","last_name":"MATTHEWS","classification":"M","division":"PCC","hit_factor":9.375},{"match_name":"Bossier Parish Practical Shooters August 16 2020","match_date":"2020-08-16","stage_classifiercode":"99-11","member_number":"Ty71839","first_name":"JONATHAN","last_name":"COWEN","classification":"U","division":"PCC","hit_factor":9.37},{"match_name":"CCPL 12102017","match_date":"2017-12-08","stage_classifiercode":"99-11","member_number":"A84240","first_name":"MIKE","last_name":"KENNEDY","classification":"A","division":"PCC","hit_factor":9.3694},{"match_name":"SMPS USPSA Feb 9 2020 AM Classifier","match_date":"2020-02-05","stage_classifiercode":"99-11","member_number":"A86774","first_name":"NICHOLAS","last_name":"REALUYO","classification":"U","division":"PCC","hit_factor":9.3567},{"match_name":"Applied IN25 USPSA August 15th 2018","match_date":"2018-08-15","stage_classifiercode":"99-11","member_number":"Ty86867","first_name":"ANDREW","last_name":"HEATH","classification":"M","division":"PCC","hit_factor":9.3548},{"match_name":"Shadow Hawk Defense USPSA Special Classifier","match_date":"2020-11-14","stage_classifiercode":"99-11","member_number":"TY98618","first_name":"WILLIAM","last_name":"PATTERSON","classification":"U","division":"PCC","hit_factor":9.3458},{"match_name":"Shot Through The Heart Classifiers","match_date":"2018-02-04","stage_classifiercode":"99-11","member_number":"A101875","first_name":"MARCO","last_name":"CABAHUG","classification":"U","division":"PCC","hit_factor":9.3458},{"match_name":"ShooT GTR USPSA 1/1/17","match_date":"2017-01-01","stage_classifiercode":"99-11","member_number":"A21361","first_name":"JIMMY","last_name":"OWENS","classification":"A","division":"PCC","hit_factor":9.3458},{"match_name":"Rio Salado RSPP 3rd Saturday February 2020","match_date":"2020-02-15","stage_classifiercode":"99-11","member_number":"A103575","first_name":"STEVE","last_name":"SCACCIA (2)","classification":"B","division":"PCC","hit_factor":9.3426},{"match_name":"Douglas Ridge USPSA March 7","match_date":"2020-03-07","stage_classifiercode":"99-11","member_number":"TY84121","first_name":"GABOR","last_name":"MAGONY","classification":"G","division":"PCC","hit_factor":9.3333},{"match_name":"Castlewood USPSA Sept 2020 shoot","match_date":"2020-09-26","stage_classifiercode":"99-11","member_number":"TY114374","first_name":"JONATHAN","last_name":"MINTEER","classification":"A","division":"PCC","hit_factor":9.3313},{"match_name":"LCSC Linden USPSA 092621","match_date":"2021-09-25","stage_classifiercode":"99-11","member_number":"TY49645","first_name":"ED","last_name":"ESPINOZA","classification":"M","division":"PCC","hit_factor":9.3264},{"match_name":"Extreme GM USPSA  November","match_date":"2020-11-27","stage_classifiercode":"99-11","member_number":"A28277","first_name":"BUD","last_name":"EHRMANN","classification":"A","division":"PCC","hit_factor":9.3264},{"match_name":"Richmond Hot Shots April 14-15-2018 USPSA Pistol Match","match_date":"2018-04-14","stage_classifiercode":"99-11","member_number":"A88783","first_name":"JOHNMAR","last_name":"SAMSON","classification":"B","division":"PCC","hit_factor":9.3248},{"match_name":"MCPSL Pistol 3-10-18","match_date":"2018-03-10","stage_classifiercode":"99-11","member_number":"A83752","first_name":"LUKE","last_name":"GOSNELL","classification":"A","division":"PCC","hit_factor":9.3248},{"match_name":"YRPA USPSA MARCH  2018","match_date":"2018-03-25","stage_classifiercode":"99-11","member_number":"TY76664","first_name":"JEFF","last_name":"WEAVER","classification":"A","division":"PCC","hit_factor":9.322},{"match_name":"ORPCI 2018.03.31 USPSA Special","match_date":"2018-03-31","stage_classifiercode":"99-11","member_number":"Ty105883","first_name":"JAMES","last_name":"ARNETT","classification":"U","division":"PCC","hit_factor":9.3023},{"match_name":"RPS December 2017 USPSA Match","match_date":"2017-12-09","stage_classifiercode":"99-11","member_number":"FY85974","first_name":"JAMES","last_name":"BASCIO","classification":"A","division":"PCC","hit_factor":9.2869},{"match_name":"CRCPS 2021-08-14","match_date":"2021-08-14","stage_classifiercode":"99-11","member_number":"TY99488","first_name":"KIRT","last_name":"MCKENNA","classification":"A","division":"PCC","hit_factor":9.2869},{"match_name":"MCAS March 2021 USPSA","match_date":"2021-03-28","stage_classifiercode":"99-11","member_number":"A111990","first_name":"MASON","last_name":"ZIER","classification":"M","division":"PCC","hit_factor":9.2843},{"match_name":"CGC 03-10-2018","match_date":"2018-03-10","stage_classifiercode":"99-11","member_number":"A97112","first_name":"BRETT","last_name":"TYLER","classification":"A","division":"PCC","hit_factor":9.2784},{"match_name":"Pinetucky USPSA 06-16-18","match_date":"2018-06-16","stage_classifiercode":"99-11","member_number":"A108656","first_name":"NELSON","last_name":"BERMAS","classification":"B","division":"PCC","hit_factor":9.2784},{"match_name":"PCPS Classifier and Slot Match Jan 2020","match_date":"2020-01-12","stage_classifiercode":"99-11","member_number":"A100557","first_name":"THOMAS","last_name":"QUERRY","classification":"U","division":"PCC","hit_factor":9.2764},{"match_name":"Richmond Hot Shots April 14-15-2018 USPSA Pistol Match","match_date":"2018-04-14","stage_classifiercode":"99-11","member_number":"FY81272","first_name":"GAYLORD","last_name":"GABRIEL","classification":"B","division":"PCC","hit_factor":9.2736},{"match_name":"Triforce Practical Shooters at BigWoodsGoods 11-30-17","match_date":"2017-12-01","stage_classifiercode":"99-11","member_number":"A84201","first_name":"ZANE","last_name":"RUTLEDGE","classification":"M","division":"PCC","hit_factor":9.2692},{"match_name":"Coyote USPSA match 4-21-18","match_date":"2018-04-21","stage_classifiercode":"99-11","member_number":"TY-92997","first_name":"ARMANDO","last_name":"HERRERA","classification":"A","division":"PCC","hit_factor":9.2593},{"match_name":"FBURG July 2018 Level I USPSA ","match_date":"2018-07-01","stage_classifiercode":"99-11","member_number":"TY36345","first_name":"JOHN MIG","last_name":"MIGLIACCIO","classification":"A","division":"PCC","hit_factor":9.2527},{"match_name":"Competitive Shooters of Lake Norman CORNELIUS Thursday Evening Indoor USPSA Pistol Match North Carolina","match_date":"2020-09-17","stage_classifiercode":"99-11","member_number":"TY117205","first_name":"JEFF","last_name":"CARRICK","classification":"A","division":"PCC","hit_factor":9.2466},{"match_name":"MSSA USPSA June  10 2017","match_date":"2017-06-10","stage_classifiercode":"99-11","member_number":"\"\"","first_name":"SETH","last_name":"MCMAHAN","classification":"\"\"","division":"PCC","hit_factor":9.2409},{"match_name":"APSC USPSA 10-06-18","match_date":"2018-10-06","stage_classifiercode":"99-11","member_number":"A52499","first_name":"JAKOB","last_name":"DAUDE","classification":"U","division":"PCC","hit_factor":9.2308},{"match_name":"Griffin USPSA Match Dec 2017","match_date":"2017-12-16","stage_classifiercode":"99-11","member_number":"Ty71861","first_name":"ED","last_name":"RUSSMAN","classification":"B","division":"PCC","hit_factor":9.2257},{"match_name":"Rio Salado UPPL September 2020","match_date":"2020-09-13","stage_classifiercode":"99-11","member_number":"L3678","first_name":"RICHARD","last_name":"BHELLA","classification":"A","division":"PCC","hit_factor":9.221},{"match_name":"Prescott Action Shooters 1st Saturday USPSA 7-7-2018","match_date":"2018-07-07","stage_classifiercode":"99-11","member_number":"A6671","first_name":"MICHAEL","last_name":"CHAMBERS","classification":"A","division":"PCC","hit_factor":9.215},{"match_name":"SEPSA July 2017","match_date":"2017-07-08","stage_classifiercode":"99-11","member_number":"A86924","first_name":"MICHAEL","last_name":"STACK","classification":"A","division":"PCC","hit_factor":9.2105},{"match_name":"Veterans 3 Gun AM Classifier Benefit Match","match_date":"2020-02-22","stage_classifiercode":"99-11","member_number":"A97425","first_name":"JORDAN","last_name":"PARKER","classification":"U","division":"PCC","hit_factor":9.2025},{"match_name":"WI21 June 24 2018 Points Match","match_date":"2018-06-06","stage_classifiercode":"99-11","member_number":"A52480","first_name":"RONNIE","last_name":"CASPER","classification":"M","division":"PCC","hit_factor":9.1993},{"match_name":"Hawkeye Gun Club July 2016 Match","match_date":"2016-07-16","stage_classifiercode":"99-11","member_number":"A-6712","first_name":"PHILIP","last_name":"DEDMON","classification":"A","division":"PCC","hit_factor":9.1803},{"match_name":"APSC USPSA 02-15-20","match_date":"2020-02-15","stage_classifiercode":"99-11","member_number":"A118536","first_name":"ALEXANDER","last_name":"BILLS","classification":"B","division":"PCC","hit_factor":9.1772},{"match_name":"Richmond Hot Shots October 6-7 USPSA Pistol Match","match_date":"2018-10-06","stage_classifiercode":"99-11","member_number":"A88783","first_name":"JOHNMAR","last_name":"SAMSON","classification":"A","division":"PCC","hit_factor":9.1772},{"match_name":"Tidewater Practical Shooter August 9th Match","match_date":"2021-08-09","stage_classifiercode":"99-11","member_number":"A73910","first_name":"JEREMY","last_name":"LIGHTNER","classification":"G","division":"PCC","hit_factor":9.1667},{"match_name":"West Coast IPSC","match_date":"2018-07-22","stage_classifiercode":"99-11","member_number":"A108505","first_name":"DANIEL","last_name":"WOLF","classification":"U","division":"PCC","hit_factor":9.1633},{"match_name":"Shadow Hawk Defense USPSA Special Classifier","match_date":"2020-11-14","stage_classifiercode":"99-11","member_number":"A111754","first_name":"GEORGE","last_name":"TAMULA","classification":"B","division":"PCC","hit_factor":9.1603},{"match_name":"CJR&PC USPSA  June 10","match_date":"2018-06-10","stage_classifiercode":"99-11","member_number":"TY72481","first_name":"JON","last_name":"FUTEY","classification":"\"\"","division":"PCC","hit_factor":9.1575},{"match_name":"RBGC 2017-06-24","match_date":"2017-06-24","stage_classifiercode":"99-11","member_number":"A70169","first_name":"AVERY","last_name":"BISHOP","classification":"B","division":"PCC","hit_factor":9.1525},{"match_name":"Richmond Hot Shots October 6-7 USPSA Pistol Match","match_date":"2018-10-06","stage_classifiercode":"99-11","member_number":"L3373","first_name":"JAY","last_name":"SAOUD","classification":"A","division":"PCC","hit_factor":9.1525},{"match_name":"Shasta Shooters 2021 Nov","match_date":"2021-11-13","stage_classifiercode":"99-11","member_number":"A77906","first_name":"JASON","last_name":"CHIPLEY","classification":"U","division":"PCC","hit_factor":9.1503},{"match_name":"Richmond Hot Shots October 6-7 USPSA Pistol Match","match_date":"2018-10-06","stage_classifiercode":"99-11","member_number":"A89510","first_name":"JOHN","last_name":"RICCHIUTO","classification":"C","division":"PCC","hit_factor":9.1371},{"match_name":"OREGON ARPC CC05 USPSA AUGUST 12 2017","match_date":"2017-08-12","stage_classifiercode":"99-11","member_number":"L2525","first_name":"KEITH","last_name":"TYLER","classification":"M","division":"PCC","hit_factor":9.1354},{"match_name":"Shadow Hawk Defense USPSA Special Classifier","match_date":"2020-11-14","stage_classifiercode":"99-11","member_number":"A120109","first_name":"RICH","last_name":"FLECHTNER","classification":"B","division":"PCC","hit_factor":9.1324},{"match_name":"OKCGC USPSA June 2018","match_date":"2018-06-02","stage_classifiercode":"99-11","member_number":"FY69238","first_name":"TONY","last_name":"WALL","classification":"M","division":"PCC","hit_factor":9.1286},{"match_name":"FBURG USPSA November 2020","match_date":"2020-11-01","stage_classifiercode":"99-11","member_number":"A108471","first_name":"MARIO","last_name":"MARTINEZ","classification":"B","division":"PCC","hit_factor":9.1062},{"match_name":"CFRPC April USPSA Match","match_date":"2018-04-15","stage_classifiercode":"99-11","member_number":"A107043","first_name":"KRIS","last_name":"HAMMERSTROM","classification":"B","division":"PCC","hit_factor":9.1057},{"match_name":"MCRC USPSA August 2018","match_date":"2018-08-11","stage_classifiercode":"99-11","member_number":"A86799","first_name":"BILL","last_name":"ROACH","classification":"B","division":"PCC","hit_factor":9.1052},{"match_name":"Free State PCC Match 8-29","match_date":"2020-08-29","stage_classifiercode":"99-11","member_number":"A38612","first_name":"RANDY","last_name":"ATHERTON","classification":"B","division":"PCC","hit_factor":9.1052},{"match_name":"WNPL USPSA - Nov 2017","match_date":"2017-11-05","stage_classifiercode":"99-11","member_number":"L2391","first_name":"RUSS","last_name":"SPILKER","classification":"B","division":"PCC","hit_factor":9.0909},{"match_name":"NHRPC - March 2021 USPSA","match_date":"2021-03-14","stage_classifiercode":"99-11","member_number":"TY92719","first_name":"DEAN","last_name":"MIOLI","classification":"B","division":"PCC","hit_factor":9.0756},{"match_name":"Extreme GM","match_date":"2020-06-12","stage_classifiercode":"99-11","member_number":"TY65542","first_name":"JAMES","last_name":"RAMOS","classification":"A","division":"PCC","hit_factor":9.075},{"match_name":"SCCC CLASSIFIER MATCH 7_23_17","match_date":"2017-07-23","stage_classifiercode":"99-11","member_number":"TY77176","first_name":"DON_1","last_name":"O`BRADOVICH","classification":"U","division":"PCC","hit_factor":9.075},{"match_name":"Extreme GM","match_date":"2020-06-12","stage_classifiercode":"99-11","member_number":"A106562","first_name":"MARK","last_name":"AVERY","classification":"B","division":"PCC","hit_factor":9.0615},{"match_name":"DPSL July 22 2018 All Classifier","match_date":"2018-07-22","stage_classifiercode":"99-11","member_number":"L3364","first_name":"SEAN","last_name":"JACKSON","classification":"U","division":"PCC","hit_factor":9.0604},{"match_name":"Prescott Action Shooters 1st Saturday USPSA 6-2-2018 ","match_date":"2018-06-03","stage_classifiercode":"99-11","member_number":"TY71570","first_name":"BEN","last_name":"KREUTZBERG","classification":"M","division":"PCC","hit_factor":9.0517},{"match_name":"TBAS USPSA Match 2/23/20","match_date":"2020-02-23","stage_classifiercode":"99-11","member_number":"FY102188","first_name":"CORY","last_name":"GOFF","classification":"B","division":"PCC","hit_factor":9.0468},{"match_name":"YRPA USPSA MARCH  2018","match_date":"2018-03-25","stage_classifiercode":"99-11","member_number":"TY61539","first_name":"ANN","last_name":"BLOSSER","classification":"A","division":"PCC","hit_factor":9.0435},{"match_name":"SCAPSA MN05 Summer League 8","match_date":"2017-08-01","stage_classifiercode":"99-11","member_number":"\"\"","first_name":"MATT","last_name":"UBL","classification":"U","division":"PCC","hit_factor":9.0416},{"match_name":"Springfield Tactical Shooters 04/05/2018","match_date":"2018-04-05","stage_classifiercode":"99-11","member_number":"A70758","first_name":"DAVID","last_name":"HOSKINS","classification":"B","division":"PCC","hit_factor":9.0301},{"match_name":"2020-03 Bone Creek USPSA","match_date":"2020-03-01","stage_classifiercode":"99-11","member_number":"A116852","first_name":"ZACHARY","last_name":"WHITAKER","classification":"U","division":"PCC","hit_factor":9.0278},{"match_name":"Bossier Parish Practical Shooters August 16 2020","match_date":"2020-08-16","stage_classifiercode":"99-11","member_number":"A105855","first_name":"BARRY","last_name":"BOOKER","classification":"C","division":"PCC","hit_factor":9.0202},{"match_name":"FAS Tuesday Night Indoors Match","match_date":"2021-03-17","stage_classifiercode":"99-11","member_number":"TY128939","first_name":"JACOB","last_name":"SANDERS","classification":"B","division":"PCC","hit_factor":9.0202},{"match_name":"Deadwood Boys USPSA All Classifier Match","match_date":"2016-08-07","stage_classifiercode":"99-11","member_number":"A78856","first_name":"CRIS","last_name":"CARPENTER","classification":"U","division":"PCC","hit_factor":9.0177},{"match_name":"HPS All-Classifier  Match","match_date":"2017-10-01","stage_classifiercode":"99-11","member_number":"TY61621","first_name":"DERICK","last_name":"HIPOL","classification":"U","division":"PCC","hit_factor":9.0032},{"match_name":"ENPS December 2020 USPSA Match","match_date":"2020-12-06","stage_classifiercode":"99-11","member_number":"TY22456","first_name":"TIM","last_name":"KLEPPER","classification":"B","division":"PCC","hit_factor":9},{"match_name":"Hammer Down USPSA Tue Night","match_date":"2017-11-07","stage_classifiercode":"99-11","member_number":"A102896","first_name":"TIM","last_name":"DUNCAN","classification":"U","division":"PCC","hit_factor":8.9965},{"match_name":"SAGC CTX04 Monthly USPSA Match - June USPSA Match","match_date":"2018-06-24","stage_classifiercode":"99-11","member_number":"L2181","first_name":"DALE","last_name":"ALCORN","classification":"B","division":"PCC","hit_factor":8.9955},{"match_name":"SUPS All Classifier Match March 1718 2018","match_date":"2018-03-17","stage_classifiercode":"99-11","member_number":"TY78912","first_name":"JEREMY","last_name":"DUNN","classification":"\"\"","division":"PCC","hit_factor":8.9955},{"match_name":"SKSC USPSA April 2018 Match","match_date":"2018-04-21","stage_classifiercode":"99-11","member_number":"L3378","first_name":"CHRISTOPHER","last_name":"GILSON","classification":"A","division":"PCC","hit_factor":8.985},{"match_name":"YVPS Feb 2020","match_date":"2020-02-08","stage_classifiercode":"99-11","member_number":"TY109639","first_name":"YOSHI","last_name":"YONEKAWA","classification":"M","division":"PCC","hit_factor":8.9844},{"match_name":"LPRGC - Lower Providence USPSA Match November 2021","match_date":"2021-11-06","stage_classifiercode":"99-11","member_number":"TY92719","first_name":"DEAN","last_name":"MIOLI","classification":"B","division":"PCC","hit_factor":8.9783},{"match_name":"Holmen USPSA 10/30/16","match_date":"2016-10-30","stage_classifiercode":"99-11","member_number":"A67626","first_name":"CHRIS","last_name":"CAZIN","classification":"U","division":"PCC","hit_factor":8.9669},{"match_name":"PPPS 11-13-16","match_date":"2016-11-13","stage_classifiercode":"99-11","member_number":"FY48570","first_name":"MATT","last_name":"HESS","classification":"A","division":"PCC","hit_factor":8.9655},{"match_name":"SAPSC Special Classifier Match","match_date":"2018-04-26","stage_classifiercode":"99-11","member_number":"A83950","first_name":"BRANDON","last_name":"REYNOLDS","classification":"U","division":"PCC","hit_factor":8.9645},{"match_name":"2020-03 Bone Creek USPSA","match_date":"2020-03-01","stage_classifiercode":"99-11","member_number":"A106540","first_name":"CAMERON","last_name":"CAHN","classification":"U","division":"PCC","hit_factor":8.9552},{"match_name":"USPSA MO21 2Alpha SBRC October 2017","match_date":"2017-10-21","stage_classifiercode":"99-11","member_number":"L2515","first_name":"JEFF","last_name":"COCKRUM","classification":"A","division":"PCC","hit_factor":8.9506},{"match_name":"Triforce Practical Shooters at BigWoodsGoods 11-30-17","match_date":"2017-12-01","stage_classifiercode":"99-11","member_number":"A82223","first_name":"BRETT","last_name":"NETTLETON","classification":"M","division":"PCC","hit_factor":8.9412},{"match_name":"MCRC USPSA August 2018","match_date":"2018-08-11","stage_classifiercode":"99-11","member_number":"A69787","first_name":"SHANE","last_name":"COX","classification":"A","division":"PCC","hit_factor":8.9404},{"match_name":"FBURG USPSA November 2020","match_date":"2020-11-01","stage_classifiercode":"99-11","member_number":"TY83821","first_name":"DEREK","last_name":"EINSIG","classification":"M","division":"PCC","hit_factor":8.9368},{"match_name":"SAGC CTX04 Monthly USPSA Match - September 2020","match_date":"2020-09-27","stage_classifiercode":"99-11","member_number":"A127725","first_name":"DAN","last_name":"NGUYEN","classification":"C","division":"PCC","hit_factor":8.9314},{"match_name":"CVSC 07-29-2018","match_date":"2018-07-29","stage_classifiercode":"99-11","member_number":"TY87404","first_name":"MARIO","last_name":"RODRIGUEZ","classification":"U","division":"PCC","hit_factor":8.9286},{"match_name":"Bailey's March 2020","match_date":"2020-03-03","stage_classifiercode":"99-11","member_number":"A50232","first_name":"MARK","last_name":"MEYERS","classification":"B","division":"PCC","hit_factor":8.9219},{"match_name":"Kettlefoot May 2021 USPSA","match_date":"2021-05-15","stage_classifiercode":"99-11","member_number":"A78175","first_name":"ERIC","last_name":"WILSON","classification":"M","division":"PCC","hit_factor":8.9069},{"match_name":"Shasta Shooters 2018 June Special Classifier","match_date":"2018-06-09","stage_classifiercode":"99-11","member_number":"A100575","first_name":"SCOTT","last_name":"JACKSON","classification":"M","division":"PCC","hit_factor":8.9054},{"match_name":"PPPS 11-13-16","match_date":"2016-11-13","stage_classifiercode":"99-11","member_number":"A56290","first_name":"FRANK","last_name":"WINN","classification":"A","division":"PCC","hit_factor":8.8889},{"match_name":"AGC_20170903","match_date":"2017-09-03","stage_classifiercode":"99-11","member_number":"A87706","first_name":"ALEX","last_name":"CHOTVACS","classification":"C","division":"PCC","hit_factor":8.8816},{"match_name":"RPS November 2018 USPSA Match","match_date":"2018-11-10","stage_classifiercode":"99-11","member_number":"TY84324","first_name":"CRAIG","last_name":"CANELLA","classification":"M","division":"PCC","hit_factor":8.8725},{"match_name":"Coyote USPSA match 4-21-18","match_date":"2018-04-21","stage_classifiercode":"99-11","member_number":"a97187","first_name":"LORENZO","last_name":"RODRGUEZ","classification":"A","division":"PCC","hit_factor":8.8685},{"match_name":"OFGC USPSA Match Feb 19th 2017","match_date":"2017-02-19","stage_classifiercode":"99-11","member_number":"TY42278","first_name":"KELLY","last_name":"RAGLIN","classification":"U","division":"PCC","hit_factor":8.8685},{"match_name":"Hopkinton USPSA October 2018","match_date":"2018-10-06","stage_classifiercode":"99-11","member_number":"A111538","first_name":"JOHN","last_name":"ZELEK","classification":"A","division":"PCC","hit_factor":8.867},{"match_name":"Collin County USPSA 04-25-2021","match_date":"2021-04-24","stage_classifiercode":"99-11","member_number":"TY94928","first_name":"KEVIN","last_name":"LAWSON","classification":"U","division":"PCC","hit_factor":8.867},{"match_name":"Custer USPSA Mar 7th 2021","match_date":"2021-03-07","stage_classifiercode":"99-11","member_number":"TY77726","first_name":"JAMES","last_name":"FENLIN","classification":"B","division":"PCC","hit_factor":8.8626},{"match_name":"Nampa USPSA December 4th 2021","match_date":"2021-12-04","stage_classifiercode":"99-11","member_number":"TY85724","first_name":"JEFF","last_name":"PACKER","classification":"A","division":"PCC","hit_factor":8.8608},{"match_name":"Competitive Shooters of Lake Norman CORNELIUS Thursday Evening Indoor USPSA Pistol Match North Carolina","match_date":"2021-09-16","stage_classifiercode":"99-11","member_number":"TY98866","first_name":"TAD","last_name":"BLANCO","classification":"B","division":"PCC","hit_factor":8.8468},{"match_name":"Square Deal Sportsmen September USPSA match","match_date":"2018-09-02","stage_classifiercode":"99-11","member_number":"ty43084","first_name":"HERB","last_name":"TERWILLEGER","classification":"B","division":"PCC","hit_factor":8.8415},{"match_name":"BORCC USPSA May 2018","match_date":"2018-05-26","stage_classifiercode":"99-11","member_number":"\"\"","first_name":"KENNY","last_name":"HUNT","classification":"C","division":"PCC","hit_factor":8.8415},{"match_name":"RPS December 2017 USPSA Match","match_date":"2017-12-09","stage_classifiercode":"99-11","member_number":"TY84324","first_name":"CRAIG","last_name":"CANELLA","classification":"A","division":"PCC","hit_factor":8.838},{"match_name":"Rio Salado RSPP 3rd Saturday February 2020","match_date":"2020-02-15","stage_classifiercode":"99-11","member_number":"A58956","first_name":"RICK","last_name":"KORZEP","classification":"M","division":"PCC","hit_factor":8.8365},{"match_name":"USPSA MO21 2Alpha SBRC June 2017","match_date":"2017-06-17","stage_classifiercode":"99-11","member_number":"L2515","first_name":"JEFF","last_name":"COCKRUM","classification":"B","division":"PCC","hit_factor":8.8365},{"match_name":"GWPP December 2020 Pistol","match_date":"2020-12-12","stage_classifiercode":"99-11","member_number":"A50232","first_name":"MARK","last_name":"MEYERS","classification":"B","division":"PCC","hit_factor":8.8339},{"match_name":"Pardoe Sportsmens Association-WPA14-2017-10-01","match_date":"2017-10-01","stage_classifiercode":"99-11","member_number":"\"\"","first_name":"MATT","last_name":"BROM","classification":"\"\"","division":"PCC","hit_factor":8.8328},{"match_name":"WPGC 8-7-2017","match_date":"2017-08-07","stage_classifiercode":"99-11","member_number":"A56290","first_name":"FRANK","last_name":"WINN","classification":"A","division":"PCC","hit_factor":8.8292},{"match_name":"NNRPA USPSA November 2020","match_date":"2020-11-28","stage_classifiercode":"99-11","member_number":"TY29032","first_name":"THOMAS","last_name":"STANNARD","classification":"B","division":"PCC","hit_factor":8.8235},{"match_name":"Richmond Hot Shots April 14-15-2018 USPSA Pistol Match","match_date":"2018-04-14","stage_classifiercode":"99-11","member_number":"A79956","first_name":"EDWIN","last_name":"CHANG","classification":"B","division":"PCC","hit_factor":8.8189},{"match_name":"PSAC 20171028","match_date":"2017-10-28","stage_classifiercode":"99-11","member_number":"A96539","first_name":"BECKY","last_name":"MUELLER","classification":"C","division":"PCC","hit_factor":8.8189},{"match_name":"Oakdale USPSA MN07 8-12-2021","match_date":"2021-08-12","stage_classifiercode":"99-11","member_number":"L4062","first_name":"KEN","last_name":"SPOONER","classification":"B","division":"PCC","hit_factor":8.8136},{"match_name":"AGC_20170903","match_date":"2017-09-03","stage_classifiercode":"99-11","member_number":"A61086","first_name":"CY","last_name":"SOTO","classification":"M","division":"PCC","hit_factor":8.8123},{"match_name":"Clinton County USPSA July 23 2016","match_date":"2016-07-23","stage_classifiercode":"99-11","member_number":"A-96581","first_name":"JOE","last_name":"CARUSO","classification":"U","division":"PCC","hit_factor":8.8012},{"match_name":"WVRPC Speed Shoot Spectacular Dec 2017","match_date":"2017-12-16","stage_classifiercode":"99-11","member_number":"A86158","first_name":"JOHNNY","last_name":"MAGS","classification":"Unclassified","division":"PCC","hit_factor":8.7948},{"match_name":"Deadwood Boys USPSA All Classifier Match - 29 July 2018","match_date":"2018-07-29","stage_classifiercode":"99-11","member_number":"TY102425","first_name":"JAY","last_name":"LIZO","classification":"U","division":"PCC","hit_factor":8.7912},{"match_name":"17s PSC - Go Fast Dont Suck 2020 Spring Postal Match (USPSA)","match_date":"2020-05-16","stage_classifiercode":"99-11","member_number":"A90693","first_name":"MIKE","last_name":"WILKERSON","classification":"A","division":"PCC","hit_factor":8.7805},{"match_name":"SFPC Aug 8 2021 USPSA Classifier match","match_date":"2021-08-08","stage_classifiercode":"99-11","member_number":"A83243","first_name":"GIL","last_name":"ELNATAN","classification":"A","division":"PCC","hit_factor":8.7805},{"match_name":"HPS March 2020 Club Fun Match","match_date":"2020-03-07","stage_classifiercode":"99-11","member_number":"TY98598","first_name":"MARK","last_name":"PAZ","classification":"U","division":"PCC","hit_factor":8.7805},{"match_name":"Richmond Hot Shots April 14-15-2018 USPSA Pistol Match","match_date":"2018-04-14","stage_classifiercode":"99-11","member_number":"TY73903","first_name":"JOSEPH","last_name":"AUSTRIA","classification":"A","division":"PCC","hit_factor":8.7774},{"match_name":"SSS USPSA February 2020","match_date":"2020-02-16","stage_classifiercode":"99-11","member_number":"Ty45621","first_name":"CRAIG","last_name":"AUMAN","classification":"M (Master)","division":"PCC","hit_factor":8.7774},{"match_name":"LPRGC - Lower Providence USPSA Match November 2021","match_date":"2021-11-06","stage_classifiercode":"99-11","member_number":"TY793","first_name":"GENE","last_name":"SUTTON","classification":"B","division":"PCC","hit_factor":8.7746},{"match_name":"Brazosland Pistoleros USPSA - Sunday August 8th","match_date":"2021-08-08","stage_classifiercode":"99-11","member_number":"A115204","first_name":"LARRY","last_name":"THOMAS","classification":"B","division":"PCC","hit_factor":8.7637},{"match_name":"Brazosland Pistoleros USPSA - Sunday January 19th","match_date":"2020-01-19","stage_classifiercode":"99-11","member_number":"Ty87515","first_name":"HOLDON","last_name":"PEREZ","classification":"U","division":"PCC","hit_factor":8.7613},{"match_name":"PPPS 11-13-16","match_date":"2016-11-13","stage_classifiercode":"99-11","member_number":"A89870","first_name":"BEAU","last_name":"JUDGE","classification":"U","division":"PCC","hit_factor":8.7591},{"match_name":"Afternoon SMPS 09 February 2020 USPSA Classifier Match","match_date":"2020-02-09","stage_classifiercode":"99-11","member_number":"A44903","first_name":"BILL","last_name":"SCHWAB","classification":"M","division":"PCC","hit_factor":8.7566},{"match_name":"MVPSA USPSA 9-15-18","match_date":"2018-09-15","stage_classifiercode":"99-11","member_number":"A102491","first_name":"CARL","last_name":"JOHNSTON","classification":"C","division":"PCC","hit_factor":8.752},{"match_name":"Parabellum USPSA May 10 2017","match_date":"2017-05-10","stage_classifiercode":"99-11","member_number":"A76158","first_name":"BRIAN","last_name":"CAMPBELL","classification":"U","division":"PCC","hit_factor":8.75},{"match_name":"Emmett July Match","match_date":"2017-07-21","stage_classifiercode":"99-11","member_number":"\"\"","first_name":"ERIK","last_name":"SMITH","classification":"A","division":"PCC","hit_factor":8.75},{"match_name":"USPSA BGSL Jan 4th Weekend ","match_date":"2020-01-25","stage_classifiercode":"99-11","member_number":"A79180","first_name":"SCOTT","last_name":"KATZ","classification":"A","division":"PCC","hit_factor":8.7481},{"match_name":"MPPL 08052018 Summer Fun","match_date":"2018-08-05","stage_classifiercode":"99-11","member_number":"A104329","first_name":"DAVID","last_name":"KIKUKAWA","classification":"A","division":"PCC","hit_factor":8.7481},{"match_name":"SMPSA 2018-01 Pistol","match_date":"2018-01-14","stage_classifiercode":"99-11","member_number":"L3707","first_name":"WOODY","last_name":"LANDRY","classification":"U","division":"PCC","hit_factor":8.7395},{"match_name":"NVSA USPSA 2106","match_date":"2021-06-20","stage_classifiercode":"99-11","member_number":"A11035","first_name":"JOE","last_name":"MORROW","classification":"A","division":"PCC","hit_factor":8.7395},{"match_name":"NAAS 2018-01-21 Special Classifier Match","match_date":"2018-01-21","stage_classifiercode":"99-11","member_number":"A97112","first_name":"BRETT","last_name":"TYLER","classification":"B","division":"PCC","hit_factor":8.7108},{"match_name":"HPS March 2020 Club Fun Match","match_date":"2020-03-07","stage_classifiercode":"99-11","member_number":"TY87106","first_name":"JAMES","last_name":"HIJII","classification":"U","division":"PCC","hit_factor":8.7108},{"match_name":"WPGC 8-7-2017","match_date":"2017-08-07","stage_classifiercode":"99-11","member_number":"FY86526","first_name":"DOUGLAS","last_name":"NORMAN","classification":"M","division":"PCC","hit_factor":8.7092},{"match_name":"WSRC USPSA","match_date":"2016-10-22","stage_classifiercode":"99-11","member_number":"A82327","first_name":"BRIAN","last_name":"SIX","classification":"U","division":"PCC","hit_factor":8.7092},{"match_name":"LdF USPSA Match May 12 2018","match_date":"2018-05-12","stage_classifiercode":"99-11","member_number":"A68331","first_name":"AZIZ","last_name":"BROU","classification":"B","division":"PCC","hit_factor":8.7087},{"match_name":"GRPC USPSA WE STOP FOR NO STORM","match_date":"2017-09-03","stage_classifiercode":"99-11","member_number":"A94852","first_name":"RANDY","last_name":"GOODNEY","classification":"A","division":"PCC","hit_factor":8.6957},{"match_name":"MSSA Uspsa Club Match","match_date":"2017-08-27","stage_classifiercode":"99-11","member_number":"L2056","first_name":"RICK","last_name":"CRAIG","classification":"B","division":"PCC","hit_factor":8.6957},{"match_name":"ORSA USPSA October 2017","match_date":"2017-10-21","stage_classifiercode":"99-11","member_number":"A102163","first_name":"JOHNATHON","last_name":"WARD","classification":"C","division":"PCC","hit_factor":8.6957},{"match_name":"NW01 April da Turd","match_date":"2018-04-04","stage_classifiercode":"99-11","member_number":"A84578","first_name":"WILL","last_name":"MILLER","classification":"U","division":"PCC","hit_factor":8.6831},{"match_name":"PPPS 11-13-16","match_date":"2016-11-13","stage_classifiercode":"99-11","member_number":"TY50508","first_name":"CHRIS","last_name":"MARSH","classification":"A","division":"PCC","hit_factor":8.6822},{"match_name":"DWB - Deadwood Boys USPSA 20 September 2020  Classifier Match Makeup","match_date":"2020-09-20","stage_classifiercode":"99-11","member_number":"TY98956","first_name":"ED","last_name":"HOFILENA","classification":"B","division":"PCC","hit_factor":8.6806},{"match_name":"OK15 USPSA at USSA May 6th 2018","match_date":"2018-05-06","stage_classifiercode":"99-11","member_number":"A104670","first_name":"NICK","last_name":"RHOADES","classification":"B","division":"PCC","hit_factor":8.6643},{"match_name":"Target  Sports Central Indiana Championship","match_date":"2020-08-22","stage_classifiercode":"99-11","member_number":"FY54293","first_name":"JACOB","last_name":"FEARNOW","classification":"A","division":"PCC","hit_factor":8.6629},{"match_name":"Campeonato USPSA 2020","match_date":"2020-05-30","stage_classifiercode":"99-11","member_number":"A122146","first_name":"ANDRES G.","last_name":"REYES-RIVERA","classification":"U","division":"PCC","hit_factor":8.6629},{"match_name":"USPSA CM99 Special Classifier MO19 Lamar October 9 2016","match_date":"2016-10-09","stage_classifiercode":"99-11","member_number":"L3506","first_name":"DAN","last_name":"MILLER","classification":"U","division":"PCC","hit_factor":8.6567},{"match_name":"Richmond Hot Shots October 6-7 USPSA Pistol Match","match_date":"2018-10-06","stage_classifiercode":"99-11","member_number":"L2249","first_name":"NORBERT","last_name":"BARAOIDAN","classification":"A","division":"PCC","hit_factor":8.6553},{"match_name":"Benton Gun Club-USPSA June 28  9AM","match_date":"2020-06-28","stage_classifiercode":"99-11","member_number":"ty96041","first_name":"ERNIE","last_name":"DECKER","classification":"B","division":"PCC","hit_factor":8.6553},{"match_name":"ORSA USPSA October 2017","match_date":"2017-10-21","stage_classifiercode":"99-11","member_number":"A100234","first_name":"TONY","last_name":"MARTIN","classification":"B","division":"PCC","hit_factor":8.6438},{"match_name":"Richmond Hot Shots April 14-15-2018 USPSA Pistol Match","match_date":"2018-04-14","stage_classifiercode":"99-11","member_number":"\"\"","first_name":"JOHN","last_name":"RICCHIUTO","classification":"\"\"","division":"PCC","hit_factor":8.642},{"match_name":"Brazosland Pistoleros August 20 2017","match_date":"2017-08-20","stage_classifiercode":"99-11","member_number":"A2369","first_name":"SCOTT","last_name":"YORK","classification":"U","division":"PCC","hit_factor":8.6379},{"match_name":"FBURG July 2018 Level I USPSA ","match_date":"2018-07-01","stage_classifiercode":"99-11","member_number":"L4331","first_name":"BRANDON","last_name":"HIGBEE","classification":"G","division":"PCC","hit_factor":8.6331},{"match_name":"Coyote USPSA match 4-21-18","match_date":"2018-04-21","stage_classifiercode":"99-11","member_number":"A83214","first_name":"ETHAN","last_name":"INOCANDO","classification":"U","division":"PCC","hit_factor":8.6316},{"match_name":"Grandbaggers 07-05-2018","match_date":"2018-07-05","stage_classifiercode":"99-11","member_number":"FY42693","first_name":"MIKE","last_name":"PANNONE","classification":"U","division":"PCC","hit_factor":8.6262},{"match_name":"PPS CLASSIFIER MATCH 2020-01-28","match_date":"2020-01-29","stage_classifiercode":"99-11","member_number":"FY111150","first_name":"ANDREW","last_name":"KOPPE","classification":"C","division":"PCC","hit_factor":8.6207},{"match_name":"West Coast IPSC","match_date":"2018-07-22","stage_classifiercode":"99-11","member_number":"TY91039","first_name":"PAUL","last_name":"CRAWFORD","classification":"B","division":"PCC","hit_factor":8.6207},{"match_name":"Afternoon SMPS 09 February 2020 USPSA Classifier Match","match_date":"2020-02-09","stage_classifiercode":"99-11","member_number":"L4049","first_name":"CHRISTIAN VET","last_name":"VIVERETTE","classification":"B","division":"PCC","hit_factor":8.6181},{"match_name":"Rankin Field Sunday USPSA","match_date":"2018-04-15","stage_classifiercode":"99-11","member_number":"A96151","first_name":"RUSSEL","last_name":"CURTIS","classification":"B","division":"PCC","hit_factor":8.6154},{"match_name":"FBURG USPSA November 2020","match_date":"2020-11-01","stage_classifiercode":"99-11","member_number":"A120109","first_name":"RICH","last_name":"FLECHTNER","classification":"B","division":"PCC","hit_factor":8.6083},{"match_name":"LCSC Linden USPSA 092621","match_date":"2021-09-25","stage_classifiercode":"99-11","member_number":"A51928","first_name":"CESAR","last_name":"MATA","classification":"G","division":"PCC","hit_factor":8.6059},{"match_name":"Springfield Tactical Shooters 05/06/2021","match_date":"2021-05-06","stage_classifiercode":"99-11","member_number":"A55905","first_name":"BARRY","last_name":"OLIVER","classification":"B","division":"PCC","hit_factor":8.6053},{"match_name":"Bossier Parish Practical Shooters August 16 2020","match_date":"2020-08-16","stage_classifiercode":"99-11","member_number":"TY48703","first_name":"TERRY","last_name":"JOHNSON","classification":"A","division":"PCC","hit_factor":8.595},{"match_name":"WPGC 10-1-18","match_date":"2018-10-01","stage_classifiercode":"99-11","member_number":"TY73532","first_name":"STEPHEN","last_name":"CASH","classification":"A","division":"PCC","hit_factor":8.5926},{"match_name":"APSC USPSA 02-15-20","match_date":"2020-02-15","stage_classifiercode":"99-11","member_number":"A110067","first_name":"GREG","last_name":"HESCH","classification":"B","division":"PCC","hit_factor":8.5763},{"match_name":"Rio Salado UPPL September 2020","match_date":"2020-09-13","stage_classifiercode":"99-11","member_number":"L3417","first_name":"JAMES","last_name":"ROBERTS","classification":"A","division":"PCC","hit_factor":8.5758},{"match_name":"Hopkinton USPSA July 2018","match_date":"2018-07-07","stage_classifiercode":"99-11","member_number":"L4396","first_name":"CURT","last_name":"CASERTA","classification":"A","division":"PCC","hit_factor":8.5714},{"match_name":"LPRGC - Lower Providence USPSA October 2018","match_date":"2018-10-06","stage_classifiercode":"99-11","member_number":"A82492","first_name":"JOSE","last_name":"SOUSA","classification":"A","division":"PCC","hit_factor":8.5667},{"match_name":"Oakdale USPSA MN07 8-12-2021","match_date":"2021-08-12","stage_classifiercode":"99-11","member_number":"L3067","first_name":"JOHN","last_name":"PAUL","classification":"B","division":"PCC","hit_factor":8.5661},{"match_name":"PRG - Oh Shoot USPSA February 21st - 3rd Sunday Match","match_date":"2021-02-21","stage_classifiercode":"99-11","member_number":"A2581","first_name":"ROSS","last_name":"DEANE","classification":"M","division":"PCC","hit_factor":8.5603},{"match_name":"Ontelaunee USPSA  July 2018","match_date":"2018-07-29","stage_classifiercode":"99-11","member_number":"FY86391","first_name":"MARK","last_name":"RODRIGUEZ","classification":"B","division":"PCC","hit_factor":8.5592},{"match_name":"SMPS USPSA Feb 9 2020 AM Classifier","match_date":"2020-02-05","stage_classifiercode":"99-11","member_number":"A44903","first_name":"BILL","last_name":"SCHWAB","classification":"M","division":"PCC","hit_factor":8.547},{"match_name":"Richmond Hot Shots April 14-15-2018 USPSA Pistol Match","match_date":"2018-04-14","stage_classifiercode":"99-11","member_number":"TY104839","first_name":"DUNCAN","last_name":"CLINE","classification":"A","division":"PCC","hit_factor":8.547},{"match_name":"SLPSA August USPSA Match 2","match_date":"2020-08-15","stage_classifiercode":"99-11","member_number":"TY72404","first_name":"DAVE","last_name":"MOORE","classification":"B","division":"PCC","hit_factor":8.542},{"match_name":"CRCPS 2021-08-14","match_date":"2021-08-14","stage_classifiercode":"99-11","member_number":"TY96994","first_name":"NORM","last_name":"SPAHR","classification":"C","division":"PCC","hit_factor":8.5386},{"match_name":"West Coast IPSC","match_date":"2018-07-22","stage_classifiercode":"99-11","member_number":"L2678","first_name":"CHRIS","last_name":"ENDERSBY","classification":"M","division":"PCC","hit_factor":8.5294},{"match_name":"OREGON ARPC CC05 USPSA AUGUST 12 2017","match_date":"2017-08-12","stage_classifiercode":"99-11","member_number":"TY84121","first_name":"GABOR","last_name":"MAGONY","classification":"A","division":"PCC","hit_factor":8.5246},{"match_name":"USPSA MO21 2Alpha SBRC March 2018","match_date":"2018-03-24","stage_classifiercode":"99-11","member_number":"A101856","first_name":"NICK","last_name":"GROSS","classification":"U","division":"PCC","hit_factor":8.5236},{"match_name":"LCSC Linden USPSA 092621","match_date":"2021-09-25","stage_classifiercode":"99-11","member_number":"A134112","first_name":"ROMMEL","last_name":"BALILO","classification":"B","division":"PCC","hit_factor":8.5236},{"match_name":"SAPSC Monthly USPSA Classifier Match at ARO 20180215","match_date":"2018-02-16","stage_classifiercode":"99-11","member_number":"A92805","first_name":"DAVID","last_name":"MAYS","classification":"U","division":"PCC","hit_factor":8.5174},{"match_name":"LIPSA  December 11th 2016 - USPSA Match","match_date":"2016-12-11","stage_classifiercode":"99-11","member_number":"L3570","first_name":"KEVIN","last_name":"DRISCOLL","classification":"U","division":"PCC","hit_factor":8.5169},{"match_name":"Cameo USPSA Match February 20 2021","match_date":"2021-02-20","stage_classifiercode":"99-11","member_number":"TY117902","first_name":"TODD","last_name":"DEJONG","classification":"B","division":"PCC","hit_factor":8.5106},{"match_name":"FBURG July 2018 Level I USPSA ","match_date":"2018-07-01","stage_classifiercode":"99-11","member_number":"TY92038","first_name":"AARON","last_name":"SAULLS","classification":"U","division":"PCC","hit_factor":8.5039},{"match_name":"BGSL Classifier Match ","match_date":"2018-10-06","stage_classifiercode":"99-11","member_number":"a98615","first_name":"JOHN","last_name":"HOLBROOK","classification":"B","division":"PCC","hit_factor":8.4956},{"match_name":"RangeMasters 9-27-2018","match_date":"2018-09-27","stage_classifiercode":"99-11","member_number":"A87497","first_name":"ERIC","last_name":"CASTILLO","classification":"G","division":"PCC","hit_factor":8.4956},{"match_name":"PCSI USPSA March 6th 2021","match_date":"2020-11-28","stage_classifiercode":"99-11","member_number":"A77486","first_name":"JOHN","last_name":"LOGAN","classification":"A","division":"PCC","hit_factor":8.4906},{"match_name":"Range E11even January 2018","match_date":"2018-01-27","stage_classifiercode":"99-11","member_number":"A92146","first_name":"RYAN","last_name":"RASSOULI","classification":"U","division":"PCC","hit_factor":8.4848},{"match_name":"Grandbaggers 07-05-2018","match_date":"2018-07-05","stage_classifiercode":"99-11","member_number":"A105604","first_name":"NATHAN","last_name":"INGRAO","classification":"B","division":"PCC","hit_factor":8.4829},{"match_name":"2017 Bay bridge Charity Classic - Richmond October 14-15-2017","match_date":"2017-10-14","stage_classifiercode":"99-11","member_number":"TY73903","first_name":"JOSEPH","last_name":"AUSTRIA","classification":"B","division":"PCC","hit_factor":8.4829},{"match_name":"USPSA MO21 2Alpha SBRC March 2018","match_date":"2018-03-24","stage_classifiercode":"99-11","member_number":"FY58129","first_name":"DARREN","last_name":"LESKIW","classification":"U","division":"PCC","hit_factor":8.4806},{"match_name":"ORPCI 2017 June USPSA Classifer Match","match_date":"2017-06-25","stage_classifiercode":"99-11","member_number":"TY77176","first_name":"DON","last_name":"O'BRADOVICH","classification":"U","division":"PCC","hit_factor":8.4746},{"match_name":"Hallstead July 18th PCC","match_date":"2020-07-18","stage_classifiercode":"99-11","member_number":"Ty90513","first_name":"MARK","last_name":"NOVAKOWSKI","classification":"U","division":"PCC","hit_factor":8.472},{"match_name":"WNPL USPSA - REDEMPTION - NOVEMBER 2016","match_date":"2016-11-06","stage_classifiercode":"99-11","member_number":"A83271","first_name":"JOSH","last_name":"PERRY","classification":"U","division":"PCC","hit_factor":8.472},{"match_name":"BHPSC Monthy World Championship 12-29-2017","match_date":"2017-12-30","stage_classifiercode":"99-11","member_number":"A96146","first_name":"BEN","last_name":"DEHAEMERS","classification":"B","division":"PCC","hit_factor":8.4656},{"match_name":" IPSC93 Oct 2021","match_date":"2021-10-29","stage_classifiercode":"99-11","member_number":"TY51119","first_name":"CHRIS","last_name":"MOLNAR","classification":"M","division":"PCC","hit_factor":8.4639},{"match_name":"Total Defense 3-7-18 Points Series 4","match_date":"2018-03-07","stage_classifiercode":"99-11","member_number":"\"\"","first_name":"JON","last_name":"OSTROM","classification":"U","division":"PCC","hit_factor":8.4602},{"match_name":"BHPSC Monthly Match - Jul 2020","match_date":"2020-07-31","stage_classifiercode":"99-11","member_number":"A110679","first_name":"BRYANT","last_name":"HUDSON","classification":"U - Unclassified","division":"PCC","hit_factor":8.4559},{"match_name":"SFPC June 7 2020 AM     USPSA Monthly Match","match_date":"2020-06-07","stage_classifiercode":"99-11","member_number":"TY82866","first_name":"GARY","last_name":"BRILL","classification":"B","division":"PCC","hit_factor":8.4548},{"match_name":"MPSA 07182020 USPSA","match_date":"2020-07-18","stage_classifiercode":"99-11","member_number":"A6205","first_name":"GREG","last_name":"PATE","classification":"B","division":"PCC","hit_factor":8.4465},{"match_name":"NW01 April da Turd","match_date":"2018-04-04","stage_classifiercode":"99-11","member_number":"TY100358","first_name":"KELLY","last_name":"BENNETT","classification":"C","division":"PCC","hit_factor":8.4465},{"match_name":"Bossier Parish Practical Shooters August 16 2020","match_date":"2020-08-16","stage_classifiercode":"99-11","member_number":"ty97639","first_name":"JASON","last_name":"WATTS","classification":"B","division":"PCC","hit_factor":8.4453},{"match_name":"TBAS USPSA Match 2/21/21","match_date":"2021-02-21","stage_classifiercode":"99-11","member_number":"A111791","first_name":"JOHN","last_name":"DANIELSON","classification":"","division":"PCC","hit_factor":8.4425},{"match_name":"Granby Action Shooters Oct 2016","match_date":"2016-10-02","stage_classifiercode":"99-11","member_number":"TY35185","first_name":"MATT","last_name":"JOE","classification":"U","division":"PCC","hit_factor":8.4388},{"match_name":"MCRC USPSA August 2018","match_date":"2018-08-11","stage_classifiercode":"99-11","member_number":"A8700","first_name":"MICHAEL","last_name":"HOWARD","classification":"B","division":"PCC","hit_factor":8.4359},{"match_name":"Extreme GM","match_date":"2020-06-12","stage_classifiercode":"99-11","member_number":"TY27735","first_name":"BOB","last_name":"MILLS","classification":"B","division":"PCC","hit_factor":8.4302},{"match_name":"NW01 April da Turd","match_date":"2018-04-04","stage_classifiercode":"99-11","member_number":"A76637","first_name":"JEFF","last_name":"SNOPE","classification":"M","division":"PCC","hit_factor":8.4291},{"match_name":"USPSA BGSL Jan 4th Weekend ","match_date":"2020-01-25","stage_classifiercode":"99-11","member_number":"a37438","first_name":"BARRY","last_name":"WEST","classification":"A","division":"PCC","hit_factor":8.4243},{"match_name":"CFRPC December USPSA (Classifier)","match_date":"2018-12-16","stage_classifiercode":"99-11","member_number":"A100028","first_name":"CHRIS","last_name":"MAGLALANG","classification":"B","division":"PCC","hit_factor":8.4211},{"match_name":"2017 Bay bridge Charity Classic - Richmond October 14-15-2017","match_date":"2017-10-14","stage_classifiercode":"99-11","member_number":"TY24456","first_name":"RANDY","last_name":"MELTON","classification":"M","division":"PCC","hit_factor":8.4211},{"match_name":"SMPS USPSA Match - May 8th 2021 (Note this is a Saturday Match)","match_date":"2021-05-08","stage_classifiercode":"99-11","member_number":"TY115166","first_name":"DAVID","last_name":"METCALFE","classification":"U","division":"PCC","hit_factor":8.418},{"match_name":"TGC USPSA JANUARY 2018","match_date":"2018-01-20","stage_classifiercode":"99-11","member_number":"L3507","first_name":"AARON","last_name":"MARCO","classification":"M","division":"PCC","hit_factor":8.4151},{"match_name":"IN19 ACC USPSA September 23","match_date":"2018-09-23","stage_classifiercode":"99-11","member_number":"A99001","first_name":"MATT","last_name":"SPANNAN","classification":"U","division":"PCC","hit_factor":8.4034},{"match_name":"DWB - Deadwood Boys USPSA 20 September 2020  Classifier Match Makeup","match_date":"2020-09-20","stage_classifiercode":"99-11","member_number":"fy-82995","first_name":"JEFFREY","last_name":"HUNT","classification":"A","division":"PCC","hit_factor":8.3958},{"match_name":"2017 Bay bridge Charity Classic - Richmond October 14-15-2017","match_date":"2017-10-14","stage_classifiercode":"99-11","member_number":"A95231","first_name":"ERIK","last_name":"MARSHALL","classification":"U","division":"PCC","hit_factor":8.3958},{"match_name":"Springfield Tactical Shooters 04/05/2018","match_date":"2018-04-05","stage_classifiercode":"99-11","member_number":"A70758","first_name":"DAVID","last_name":"HOSKINS","classification":"B","division":"PCC","hit_factor":8.3942},{"match_name":"DPSL July 22 2018 All Classifier","match_date":"2018-07-22","stage_classifiercode":"99-11","member_number":"L3376","first_name":"GLENN","last_name":"SHELBY","classification":"U","division":"PCC","hit_factor":8.3936},{"match_name":"GRPC USPSA TAX REFUND ","match_date":"2018-04-15","stage_classifiercode":"99-11","member_number":"A40007","first_name":"JOHN","last_name":"NIXON","classification":"U","division":"PCC","hit_factor":8.3893},{"match_name":"Deadwood Boys USPSA All Classifier Match","match_date":"2016-08-07","stage_classifiercode":"99-11","member_number":"A-2581","first_name":"ROSS","last_name":"DEANE","classification":"U","division":"PCC","hit_factor":8.3871},{"match_name":"Bossier Parish Practical Shooters August 16 2020","match_date":"2020-08-16","stage_classifiercode":"99-11","member_number":"A120065","first_name":"FRANK","last_name":"MARULLI","classification":"U","division":"PCC","hit_factor":8.3832},{"match_name":"CSA Coalfield Shooters Association USPSA March 2020","match_date":"2020-03-08","stage_classifiercode":"99-11","member_number":"TY72738","first_name":"MICHAEL","last_name":"THOMPSON","classification":"M","division":"PCC","hit_factor":8.3752},{"match_name":"USPSA MO21 2Alpha SBRC October 2017","match_date":"2017-10-21","stage_classifiercode":"99-11","member_number":"A82858","first_name":"RICHARD","last_name":"ZARCONE","classification":"B","division":"PCC","hit_factor":8.3636},{"match_name":"LdF USPSA Match January 25 2020","match_date":"2020-01-25","stage_classifiercode":"99-11","member_number":"L3832","first_name":"JONG","last_name":"RAMOS","classification":"C","division":"PCC","hit_factor":8.3601},{"match_name":"2017 Bay bridge Charity Classic - Richmond October 14-15-2017","match_date":"2017-10-14","stage_classifiercode":"99-11","member_number":"TY88318","first_name":"MIKE","last_name":"HALL","classification":"B","division":"PCC","hit_factor":8.3582},{"match_name":"CRCPS 2021-08-14","match_date":"2021-08-14","stage_classifiercode":"99-11","member_number":"TY99488","first_name":"KIRT","last_name":"MCKENNA 2ND","classification":"A","division":"PCC","hit_factor":8.3499},{"match_name":"SAPSC Weekly USPSA Classifier Match 20170221","match_date":"2017-02-22","stage_classifiercode":"99-11","member_number":"TY84121","first_name":"GABOR","last_name":"MAGONY","classification":"B","division":"PCC","hit_factor":8.3491},{"match_name":"NW01 Paul Bunyan CS Series May 9 2021","match_date":"2021-05-09","stage_classifiercode":"99-11","member_number":"FY89148","first_name":"DAVID","last_name":"DUPREE","classification":"B","division":"PCC","hit_factor":8.3472},{"match_name":"Total Defense 3-7-18 Points Series 4","match_date":"2018-03-07","stage_classifiercode":"99-11","member_number":"A84170","first_name":"CHRIS","last_name":"VANDENBERG","classification":"B","division":"PCC","hit_factor":8.3449},{"match_name":"Richmond Hot Shots April 14-15-2018 USPSA Pistol Match","match_date":"2018-04-14","stage_classifiercode":"99-11","member_number":"A82878","first_name":"RICHARD","last_name":"WILLIAMS","classification":"B","division":"PCC","hit_factor":8.3333},{"match_name":"NCPS USPSA Handgun Match June 24 2018","match_date":"2018-06-24","stage_classifiercode":"99-11","member_number":"FY98474","first_name":"TONY","last_name":"PETERSON","classification":"C","division":"PCC","hit_factor":8.3333},{"match_name":"IN19 ACC USPSA September 23","match_date":"2018-09-23","stage_classifiercode":"99-11","member_number":"TY90274","first_name":"MICHAEL","last_name":"CONROY","classification":"B","division":"PCC","hit_factor":8.3333},{"match_name":"West Coast IPSC","match_date":"2018-07-22","stage_classifiercode":"99-11","member_number":"A110510","first_name":"SUPER STEVE","last_name":"MILES","classification":"A","division":"PCC","hit_factor":8.3333},{"match_name":"Palmetto Gun Club - April 2017 USPSA","match_date":"2017-04-08","stage_classifiercode":"99-11","member_number":"A69787","first_name":"SHANE","last_name":"COX","classification":"A","division":"PCC","hit_factor":8.3214},{"match_name":"GRB JAN USPSA  at Cav","match_date":"2017-01-21","stage_classifiercode":"99-11","member_number":"A98777","first_name":"BRANDON","last_name":"HIGBEE","classification":"B","division":"PCC","hit_factor":8.3214},{"match_name":"Grandbaggers August 2017","match_date":"2017-08-03","stage_classifiercode":"99-11","member_number":"FY77868","first_name":"MICHAEL","last_name":"AUTUORI","classification":"U","division":"PCC","hit_factor":8.321},{"match_name":"BSC USPSA Oct 17 2020 Classifier","match_date":"2020-10-17","stage_classifiercode":"99-11","member_number":"TY85900","first_name":"BRAD","last_name":"NORTON","classification":"B","division":"PCC","hit_factor":8.32},{"match_name":"MPPL 11042018 Hoser Heaven","match_date":"2018-11-04","stage_classifiercode":"99-11","member_number":"TY84441","first_name":"SEAN","last_name":"HATADA","classification":"B","division":"PCC","hit_factor":8.32},{"match_name":"NW01 April da Turd","match_date":"2018-04-04","stage_classifiercode":"99-11","member_number":"TY94333","first_name":"JONATHON","last_name":"PORTER","classification":"B","division":"PCC","hit_factor":8.32},{"match_name":"LPRGC - Lower Providence USPSA October 2018","match_date":"2018-10-06","stage_classifiercode":"99-11","member_number":"TY85668","first_name":"SCOTT","last_name":"APPOLDT","classification":"M","division":"PCC","hit_factor":8.3176},{"match_name":"WSPS AUGUST 2016 USPSA","match_date":"2016-08-20","stage_classifiercode":"99-11","member_number":"A98254","first_name":"MARK","last_name":"HARBOLD","classification":"U","division":"PCC","hit_factor":8.3095},{"match_name":"Bossier Parish Practical Shooters August 16 2020","match_date":"2020-08-16","stage_classifiercode":"99-11","member_number":"L4553","first_name":"MIKE","last_name":"PIPES","classification":"B","division":"PCC","hit_factor":8.3086},{"match_name":"Triforce Practical Shooters at BigWoodsGoods 11-30-17","match_date":"2017-12-01","stage_classifiercode":"99-11","member_number":"A97112","first_name":"BRETT","last_name":"TYLER","classification":"C","division":"PCC","hit_factor":8.3077},{"match_name":"CGC 03-10-2018","match_date":"2018-03-10","stage_classifiercode":"99-11","member_number":"A70169","first_name":"AVERY","last_name":"BISHOP","classification":"M","division":"PCC","hit_factor":8.3077},{"match_name":"SWGC USPSA Pistol Match - November 2021","match_date":"2021-11-06","stage_classifiercode":"99-11","member_number":"A93396","first_name":"SHIVA","last_name":"ANANDA","classification":"A","division":"PCC","hit_factor":8.3067},{"match_name":"SUPS USPSA 20-21 October 2018","match_date":"2018-10-20","stage_classifiercode":"99-11","member_number":"TY90230","first_name":"MICHAEL","last_name":"WEBB","classification":"C","division":"PCC","hit_factor":8.2976},{"match_name":"LCHG September 2018 USPSA Special Classifier","match_date":"2018-09-08","stage_classifiercode":"99-11","member_number":"A35678","first_name":"RUSS","last_name":"MCELYEA","classification":"U","division":"PCC","hit_factor":8.2963},{"match_name":"Nampa USPSA May 29th 2021","match_date":"2021-05-29","stage_classifiercode":"99-11","member_number":"TY85724","first_name":"JEFF","last_name":"PACKER","classification":"B","division":"PCC","hit_factor":8.2949},{"match_name":"CGGR July USPSA Match","match_date":"2018-07-21","stage_classifiercode":"99-11","member_number":"TY88724","first_name":"JESSICA","last_name":"DOIRON","classification":"A","division":"PCC","hit_factor":8.284},{"match_name":"EWPSA 2018-10","match_date":"2018-10-20","stage_classifiercode":"99-11","member_number":"A104247","first_name":"MATTHEW","last_name":"MAYHAK","classification":"B","division":"PCC","hit_factor":8.2822},{"match_name":"Brazosland Pistoleros August 20 2017","match_date":"2017-08-20","stage_classifiercode":"99-11","member_number":"A81359","first_name":"LAN","last_name":"NGUYEN","classification":"U","division":"PCC","hit_factor":8.2822},{"match_name":"Richmond Hot Shots October 6-7 USPSA Pistol Match","match_date":"2018-10-06","stage_classifiercode":"99-11","member_number":"FY81272","first_name":"GAYLORD","last_name":"GABRIEL","classification":"B","division":"PCC","hit_factor":8.2759},{"match_name":"NW01 Paul Bunyan CS Series May 9 2021","match_date":"2021-05-09","stage_classifiercode":"99-11","member_number":"ty63903","first_name":"BILL","last_name":"JOHNSTON","classification":"B","division":"PCC","hit_factor":8.2718},{"match_name":"Grandbaggers August 2017","match_date":"2017-08-03","stage_classifiercode":"99-11","member_number":"A80603","first_name":"CALEB","last_name":"HIGBY","classification":"M","division":"PCC","hit_factor":8.2671},{"match_name":"LGCSEMPS April 2018 Special Classifier","match_date":"2018-04-08","stage_classifiercode":"99-11","member_number":"FY81965","first_name":"DAVID","last_name":"BECKER","classification":"U","division":"PCC","hit_factor":8.2645},{"match_name":"Springfield Tactical Shooters 04/05/2018","match_date":"2018-04-05","stage_classifiercode":"99-11","member_number":"A55905","first_name":"BARRY","last_name":"OLIVER","classification":"C","division":"PCC","hit_factor":8.2596},{"match_name":"RPS December 2017 USPSA Match","match_date":"2017-12-09","stage_classifiercode":"99-11","member_number":"TY88592","first_name":"PHILLIP","last_name":"WEAVER","classification":"U","division":"PCC","hit_factor":8.2569},{"match_name":"Richmond Hot Shots October 6-7 USPSA Pistol Match","match_date":"2018-10-06","stage_classifiercode":"99-11","member_number":"TY75971","first_name":"GERARD","last_name":"GARCIA","classification":"B","division":"PCC","hit_factor":8.254},{"match_name":"Springfield Tactical Shooters 04/05/2018","match_date":"2018-04-05","stage_classifiercode":"99-11","member_number":"TY87747","first_name":"BARRY","last_name":"ROWE","classification":"U","division":"PCC","hit_factor":8.2508},{"match_name":"PRG 2017 Classifier Match","match_date":"2017-02-19","stage_classifiercode":"99-11","member_number":"A75568","first_name":"MEL","last_name":"LLIDO","classification":"U","division":"PCC","hit_factor":8.2504},{"match_name":"Prescott 1st Saturday 8-05-17","match_date":"2017-08-05","stage_classifiercode":"99-11","member_number":"A6671","first_name":"MIKE","last_name":"CHAMBERS","classification":"B","division":"PCC","hit_factor":8.2443},{"match_name":"FBURG July 2018 Level I USPSA ","match_date":"2018-07-01","stage_classifiercode":"99-11","member_number":"A102210","first_name":"BRYAN","last_name":"CASTELLANO","classification":"B","division":"PCC","hit_factor":8.2386},{"match_name":"Grandbaggers August 2017","match_date":"2017-08-03","stage_classifiercode":"99-11","member_number":"TY87182","first_name":"MILTON","last_name":"MEANS","classification":"B","division":"PCC","hit_factor":8.2353},{"match_name":"ORPCI 2018.03.31 USPSA Special","match_date":"2018-03-31","stage_classifiercode":"99-11","member_number":"A78528","first_name":"TIM","last_name":"MEKOSH","classification":"\"\"","division":"PCC","hit_factor":8.2353},{"match_name":"LCSC Linden USPSA 092621","match_date":"2021-09-25","stage_classifiercode":"99-11","member_number":"A55099","first_name":"MATTHEW","last_name":"LEONG","classification":"B","division":"PCC","hit_factor":8.227},{"match_name":"CSA Coalfield Shooters Association USPSA March 2020","match_date":"2020-03-08","stage_classifiercode":"99-11","member_number":"A117555","first_name":"RAYMOND","last_name":"OSBORNE","classification":"\"\"","division":"PCC","hit_factor":8.2192},{"match_name":"Parabellum USPSA May 10 2017","match_date":"2017-05-10","stage_classifiercode":"99-11","member_number":"A99585","first_name":"JAMES","last_name":"PETERS","classification":"B","division":"PCC","hit_factor":8.2148},{"match_name":"OKCGC USPSA June 2018","match_date":"2018-06-02","stage_classifiercode":"99-11","member_number":"L3603","first_name":"MITCH","last_name":"GIBSON","classification":"A","division":"PCC","hit_factor":8.2102},{"match_name":"PRG 2017 Classifier Match","match_date":"2017-02-19","stage_classifiercode":"99-11","member_number":"A40807","first_name":"NOEL","last_name":"WILTERDING","classification":"U","division":"PCC","hit_factor":8.1996},{"match_name":"Bossier Parish Practical Shooters August 16 2020","match_date":"2020-08-16","stage_classifiercode":"99-11","member_number":"A118326","first_name":"RODNEY","last_name":"BLACK","classification":"U","division":"PCC","hit_factor":8.1967},{"match_name":"CGGR July USPSA Match","match_date":"2018-07-21","stage_classifiercode":"99-11","member_number":"A105522","first_name":"SAL","last_name":"GUTIERREZ","classification":"U","division":"PCC","hit_factor":8.1967},{"match_name":"Brazosland Pistoleros USPSA - Sunday January 19th","match_date":"2020-01-19","stage_classifiercode":"99-11","member_number":"a110188","first_name":"JULIANN","last_name":"MILKS","classification":"C","division":"PCC","hit_factor":8.1818},{"match_name":"TPS USPSA -  August Classifier Match 2020","match_date":"2020-08-01","stage_classifiercode":"99-11","member_number":"FY97931","first_name":"SCOTT","last_name":"NEWNAM","classification":"U","division":"PCC","hit_factor":8.1818},{"match_name":"Hammer Down USPSA Tue Night","match_date":"2017-11-07","stage_classifiercode":"99-11","member_number":"A87603","first_name":"CHRISTOPHER","last_name":"COPLEY","classification":"B","division":"PCC","hit_factor":8.1805},{"match_name":"LCSA  USPSA April 2017","match_date":"2017-04-08","stage_classifiercode":"99-11","member_number":"ty81249","first_name":"BRIAN","last_name":"MILLER","classification":"U","division":"PCC","hit_factor":8.1805},{"match_name":"SMPS USPSA Feb 9 2020 AM Classifier","match_date":"2020-02-05","stage_classifiercode":"99-11","member_number":"FY79231","first_name":"GREGORY","last_name":"BANTA","classification":"B","division":"PCC","hit_factor":8.1633},{"match_name":"Triforce Practical Shooters at BigWoodsGoods 11-30-17","match_date":"2017-12-01","stage_classifiercode":"99-11","member_number":"Ty85797","first_name":"GARY","last_name":"WILLIAMS","classification":"B","division":"PCC","hit_factor":8.1633},{"match_name":"ORPCI USPSA Saturday 2021.07.17","match_date":"2021-07-17","stage_classifiercode":"99-11","member_number":"L4763","first_name":"RICHARD","last_name":"HIBBS","classification":"","division":"PCC","hit_factor":8.1633},{"match_name":"OFGC USPSA Match Feb 19th 2017","match_date":"2017-02-19","stage_classifiercode":"99-11","member_number":"TY34745","first_name":"KEITH","last_name":"HAMMOND","classification":"U","division":"PCC","hit_factor":8.1575},{"match_name":"CGC 03-10-2018","match_date":"2018-03-10","stage_classifiercode":"99-11","member_number":"TY57617","first_name":"ERIC","last_name":"DAVIS","classification":"A","division":"PCC","hit_factor":8.1571},{"match_name":"West Coast IPSC","match_date":"2018-07-22","stage_classifiercode":"99-11","member_number":"\"\"","first_name":"ENA","last_name":"MOTORS","classification":"C","division":"PCC","hit_factor":8.1505},{"match_name":"IOP Rifle And Pistol Club USPSA Match March 2020","match_date":"2020-03-01","stage_classifiercode":"99-11","member_number":"A50981","first_name":"DAVE","last_name":"MIDDLEMAS","classification":"B","division":"PCC","hit_factor":8.1461},{"match_name":"Hopkinton USPSA July 2018","match_date":"2018-07-07","stage_classifiercode":"99-11","member_number":"TY62563","first_name":"ANATOLY","last_name":"PODPALY","classification":"C","division":"PCC","hit_factor":8.1411},{"match_name":"Blackstone Shooting Sports Snow Days January 2017 USPSA Level  1","match_date":"2017-01-08","stage_classifiercode":"99-11","member_number":"A94200","first_name":"HAROLD","last_name":"PRESSLEY","classification":"D","division":"PCC","hit_factor":8.1395},{"match_name":"TMGN April 5 USPSA Classifiers Match","match_date":"2018-04-05","stage_classifiercode":"99-11","member_number":"A98248","first_name":"ERIC","last_name":"WONG","classification":"\"\"","division":"PCC","hit_factor":8.1377},{"match_name":"LA05 Tangi USPSA 4th Sunday May 2021","match_date":"2021-05-23","stage_classifiercode":"99-11","member_number":"A123903","first_name":"DAVID","last_name":"GOOCH","classification":"A","division":"PCC","hit_factor":8.1377},{"match_name":"HOPS USPSA 072118","match_date":"2018-07-21","stage_classifiercode":"99-11","member_number":"L2745","first_name":"ALLAN","last_name":"PORTING","classification":"B","division":"PCC","hit_factor":8.1346},{"match_name":"SFPC Aug 8 2021 USPSA Classifier match","match_date":"2021-08-08","stage_classifiercode":"99-11","member_number":"TY101923","first_name":"CHRISTINA","last_name":"BAKER","classification":"U","division":"PCC","hit_factor":8.1277},{"match_name":"Richmond Hot Shots October 6-7 USPSA Pistol Match","match_date":"2018-10-06","stage_classifiercode":"99-11","member_number":"A19219","first_name":"EDGAR","last_name":"BOND","classification":"U","division":"PCC","hit_factor":8.1218},{"match_name":"Castlewood USPSA Sept 2020 shoot","match_date":"2020-09-26","stage_classifiercode":"99-11","member_number":"A110098","first_name":"ADAM","last_name":"KNOX","classification":"U","division":"PCC","hit_factor":8.1037},{"match_name":"WSPS AUGUST 2016 USPSA","match_date":"2016-08-20","stage_classifiercode":"99-11","member_number":"\"\"","first_name":"FORREST","last_name":"LYSINGER","classification":"U","division":"PCC","hit_factor":8.1006},{"match_name":"Grandbaggers 07-05-2018","match_date":"2018-07-05","stage_classifiercode":"99-11","member_number":"18L1849","first_name":"PAUL","last_name":"THOMPSON","classification":"U","division":"PCC","hit_factor":8.0944},{"match_name":"Applied IN25 USPSA January 17th 2018","match_date":"2018-01-17","stage_classifiercode":"99-11","member_number":"A78635","first_name":"ROB","last_name":"MCGUIRE","classification":"A","division":"PCC","hit_factor":8.0925},{"match_name":"USPSA BGSL Jan 4th Weekend ","match_date":"2020-01-25","stage_classifiercode":"99-11","member_number":"A55906","first_name":"TREY","last_name":"AHLGRIM","classification":"B","division":"PCC","hit_factor":8.0808},{"match_name":"Pardoe Sportsmens Association- USPSA Saturday 4-3-21","match_date":"2021-04-03","stage_classifiercode":"99-11","member_number":"A74936","first_name":"ROGER","last_name":"ELDER","classification":"B","division":"PCC","hit_factor":8.078},{"match_name":"ORPCI 2017 June USPSA Classifer Match","match_date":"2017-06-25","stage_classifiercode":"99-11","member_number":"A96280","first_name":"TY","last_name":"O'BRADOVICH","classification":"U","division":"PCC","hit_factor":8.0775},{"match_name":"LCSA USPSA July Classifier Match","match_date":"2016-07-30","stage_classifiercode":"99-11","member_number":"a62841","first_name":"THOMAS","last_name":"MCDEVITT","classification":"U","division":"PCC","hit_factor":8.0745},{"match_name":"CCC Shooting Complex October 2016","match_date":"2016-10-02","stage_classifiercode":"99-11","member_number":"\"\"","first_name":"ROGER","last_name":"LEE","classification":"U","division":"PCC","hit_factor":8.0692},{"match_name":"NCPS USPSA Handgun Match June 24 2018","match_date":"2018-06-24","stage_classifiercode":"99-11","member_number":"TY92465","first_name":"JOSE","last_name":"RAPADAS","classification":"B","division":"PCC","hit_factor":8.0668},{"match_name":"Baileys January 2018","match_date":"2018-01-07","stage_classifiercode":"99-11","member_number":"L3738","first_name":"JAY","last_name":"OLMSTEAD","classification":"B","division":"PCC","hit_factor":8.0645},{"match_name":"ARPC USPSA Match 5-27-18","match_date":"2018-05-27","stage_classifiercode":"99-11","member_number":"A92234","first_name":"BOB","last_name":"KOKOTOVICH","classification":"B","division":"PCC","hit_factor":8.062},{"match_name":"USPSA MO21 2Alpha SBRC Classifier 2016","match_date":"2016-11-26","stage_classifiercode":"99-11","member_number":"A71962","first_name":"BRIAN","last_name":"CALLAHAN","classification":"U","division":"PCC","hit_factor":8.0576},{"match_name":"PCSI - September 2017 USPSA","match_date":"2017-09-02","stage_classifiercode":"99-11","member_number":"A88135","first_name":"MARK","last_name":"COLASANTE","classification":"M","division":"PCC","hit_factor":8.0576},{"match_name":"2020-03 Bone Creek USPSA","match_date":"2020-03-01","stage_classifiercode":"99-11","member_number":"FY36467","first_name":"JAMES","last_name":"POPE","classification":"B","division":"PCC","hit_factor":8.0576},{"match_name":"SFPC Oct 3 2021   USPSA Monthly Match","match_date":"2021-10-03","stage_classifiercode":"99-11","member_number":"A105315","first_name":"GIANCARLO","last_name":"PELOSI","classification":"B","division":"PCC","hit_factor":8.0576},{"match_name":"Target  Sports Central Indiana Championship","match_date":"2020-08-22","stage_classifiercode":"99-11","member_number":"TY53701","first_name":"RON","last_name":"COOPER","classification":"B","division":"PCC","hit_factor":8.0477},{"match_name":"BORCC USPSA May 2018","match_date":"2018-05-26","stage_classifiercode":"99-11","member_number":"A77486","first_name":"JOHN","last_name":"LOGAN","classification":"B","division":"PCC","hit_factor":8.046},{"match_name":"Nampa USPSA May 29th 2021","match_date":"2021-05-29","stage_classifiercode":"99-11","member_number":"TY87846","first_name":"JOHN","last_name":"JENSEN","classification":"B","division":"PCC","hit_factor":8.042},{"match_name":"Ontelaunee USPSA  July 2018","match_date":"2018-07-29","stage_classifiercode":"99-11","member_number":"TY99982","first_name":"ERIC","last_name":"DYRSTAD","classification":"M","division":"PCC","hit_factor":8.0321},{"match_name":"WSRC USPSA 11/19/2017","match_date":"2017-11-19","stage_classifiercode":"99-11","member_number":"A99326","first_name":"TIM","last_name":"ARMSTRONG","classification":"B","division":"PCC","hit_factor":8.0257},{"match_name":"NAAS 03-05-2016","match_date":"2017-03-05","stage_classifiercode":"99-11","member_number":"A98278","first_name":"JACK","last_name":"WINDES","classification":"U","division":"PCC","hit_factor":8.0221},{"match_name":"HAS Classifier Match January 2020","match_date":"2020-01-15","stage_classifiercode":"99-11","member_number":"A110207","first_name":"RICK","last_name":"MELLINO","classification":"A","division":"PCC","hit_factor":8.0221},{"match_name":"Firing Line Classifier","match_date":"2018-01-26","stage_classifiercode":"99-11","member_number":"ty94384","first_name":"ROBERT","last_name":"UPEGUI","classification":"B","division":"PCC","hit_factor":8.0146},{"match_name":"HPS All-Classifier  Match","match_date":"2017-10-01","stage_classifiercode":"99-11","member_number":"TY87106","first_name":"JAMES","last_name":"HIJII","classification":"U","division":"PCC","hit_factor":8.0139},{"match_name":"Custer USPSA Mar 7th 2021","match_date":"2021-03-07","stage_classifiercode":"99-11","member_number":"FY22573","first_name":"JAMES","last_name":"DONG","classification":"A","division":"PCC","hit_factor":8.0119},{"match_name":"APSC 4th Annual Holiday Hosefest USPSA Match 12-02-17","match_date":"2017-12-02","stage_classifiercode":"99-11","member_number":"A90423","first_name":"MIKE","last_name":"PIETERSZ","classification":"U","division":"PCC","hit_factor":8},{"match_name":"AGC_20170903","match_date":"2017-09-03","stage_classifiercode":"99-11","member_number":"TY55863","first_name":"SEAN","last_name":"MYHRE","classification":"A","division":"PCC","hit_factor":8},{"match_name":"ITPSC January USPSA","match_date":"2017-01-21","stage_classifiercode":"99-11","member_number":"A80515","first_name":"MICAH","last_name":"ROWE","classification":"U","division":"PCC","hit_factor":8},{"match_name":"Competitive Shooters of Lake Norman CORNELIUS Thursday Evening Indoor USPSA Pistol Match North Carolina","match_date":"2021-09-16","stage_classifiercode":"99-11","member_number":"TY106507","first_name":"KEITH","last_name":"NAGELSKI","classification":"B","division":"PCC","hit_factor":8},{"match_name":"HPS April Tax Time Fun Shoot","match_date":"2017-04-22","stage_classifiercode":"99-11","member_number":"TY61132","first_name":"FRANCIS","last_name":"FONTANILLA","classification":"U","division":"PCC","hit_factor":8},{"match_name":"HTF Practical Shooters","match_date":"2017-11-30","stage_classifiercode":"99-11","member_number":"A106631","first_name":"JOEY","last_name":"TOMLINSON","classification":"U","division":"PCC","hit_factor":8},{"match_name":"Fairfax PS USPSA  2018 October","match_date":"2018-10-16","stage_classifiercode":"99-11","member_number":"TY83821","first_name":"DEREK","last_name":"EINSIG","classification":"M","division":"PCC","hit_factor":8},{"match_name":"MS06 Team Magnolia February 2018 USPSA Match","match_date":"2018-02-03","stage_classifiercode":"99-11","member_number":"TY3936","first_name":"TOMMY","last_name":"CABELL","classification":"B","division":"PCC","hit_factor":8},{"match_name":"PRG 2017 Classifier Match","match_date":"2017-02-19","stage_classifiercode":"99-11","member_number":"TY93001","first_name":"HENDRIX","last_name":"DELEON","classification":"U","division":"PCC","hit_factor":7.9893},{"match_name":"PRG - Oh Shoot USPSA February 21st - 3rd Sunday Match","match_date":"2021-02-21","stage_classifiercode":"99-11","member_number":"A103718","first_name":"ARIES","last_name":"ALMAZAN","classification":"C","division":"PCC","hit_factor":7.9886},{"match_name":"Quantico Shooting Club Mar USPSA","match_date":"2020-03-08","stage_classifiercode":"99-11","member_number":"A121819","first_name":"JASON","last_name":"VAUGHN","classification":"C","division":"PCC","hit_factor":7.9882},{"match_name":"Castlewood July 2017 USPSA Match","match_date":"2017-07-22","stage_classifiercode":"99-11","member_number":"A-101281","first_name":"DIENEZ","last_name":"WOLLET","classification":"U","division":"PCC","hit_factor":7.9861},{"match_name":"GRPC USPSA TAX REFUND ","match_date":"2018-04-15","stage_classifiercode":"99-11","member_number":"FY36295","first_name":"PAUL","last_name":"VAN WYK","classification":"B","division":"PCC","hit_factor":7.9855},{"match_name":"Hallstead July 18th PCC","match_date":"2020-07-18","stage_classifiercode":"99-11","member_number":"A125448","first_name":"JOHN","last_name":"THOMPSON","classification":"B","division":"PCC","hit_factor":7.9772},{"match_name":"RPS December 2017 USPSA Match","match_date":"2017-12-09","stage_classifiercode":"99-11","member_number":"A72553","first_name":"BRIAN","last_name":"DEMMA","classification":"B","division":"PCC","hit_factor":7.9764},{"match_name":"HTF Practical Shooters Classifier","match_date":"2017-12-07","stage_classifiercode":"99-11","member_number":"A106160","first_name":"JOSH","last_name":"BREWER","classification":"C","division":"PCC","hit_factor":7.9755},{"match_name":"USPSA","match_date":"2017-09-03","stage_classifiercode":"99-11","member_number":"TY89752","first_name":"JD","last_name":"FAIRCHILD","classification":"\"\"","division":"PCC","hit_factor":7.9734},{"match_name":"Palmetto Gun Club - April 2017 USPSA","match_date":"2017-04-08","stage_classifiercode":"99-11","member_number":"TY22192","first_name":"ART","last_name":"BROWN","classification":"C","division":"PCC","hit_factor":7.9659},{"match_name":"TPS USPSA -  August Classifier Match 2020","match_date":"2020-08-01","stage_classifiercode":"99-11","member_number":"A101403","first_name":"BOB","last_name":"CURRY","classification":"U","division":"PCC","hit_factor":7.9646},{"match_name":"APS August 1st Monthly USPSA Match  Classifier Match","match_date":"2021-08-01","stage_classifiercode":"99-11","member_number":"TY25385","first_name":"MARK","last_name":"STAMPER","classification":"B","division":"PCC","hit_factor":7.9632},{"match_name":"Free State PCC Match 8-29","match_date":"2020-08-29","stage_classifiercode":"99-11","member_number":"A124830","first_name":"CHRIS","last_name":"MOORE","classification":"U","division":"PCC","hit_factor":7.9632},{"match_name":"Shadow Hawk Defense USPSA Special Classifier","match_date":"2020-11-14","stage_classifiercode":"99-11","member_number":"A119295","first_name":"TONY","last_name":"CLARK","classification":"B","division":"PCC","hit_factor":7.9602},{"match_name":"Cameo USPSA Match February 20 2021","match_date":"2021-02-20","stage_classifiercode":"99-11","member_number":"TY85389","first_name":"RUSS","last_name":"HASSINGER","classification":"B","division":"PCC","hit_factor":7.9602},{"match_name":"BRSP Tuesday Night USPSA Match - Sept 11","match_date":"2018-09-12","stage_classifiercode":"99-11","member_number":"A110231","first_name":"GREG","last_name":"SWANSON","classification":"U","division":"PCC","hit_factor":7.9566},{"match_name":"Ontelaunee USPSA Hose Fest","match_date":"2021-01-02","stage_classifiercode":"99-11","member_number":"A105042","first_name":"SHAUN","last_name":"TAYLOR","classification":"B","division":"PCC","hit_factor":7.9566},{"match_name":"Brazosland Pistoleros USPSA - Sunday January 19th","match_date":"2020-01-19","stage_classifiercode":"99-11","member_number":"A118075","first_name":"SAM","last_name":"PRUETT","classification":"B","division":"PCC","hit_factor":7.9529},{"match_name":"PCPS Classifier and Slot Match Jan 2020","match_date":"2020-01-12","stage_classifiercode":"99-11","member_number":"A110090","first_name":"NICK","last_name":"SPRAGUE","classification":"U","division":"PCC","hit_factor":7.9433},{"match_name":"CJR&PC USPSA  June 10","match_date":"2018-06-10","stage_classifiercode":"99-11","member_number":"TY81486","first_name":"ADAM","last_name":"MCINNIS","classification":"\"\"","division":"PCC","hit_factor":7.9412},{"match_name":"Deadwood Boys USPSA All Classifier Match - 29 July 2018","match_date":"2018-07-29","stage_classifiercode":"99-11","member_number":"A103826","first_name":"CHRISPY","last_name":"PARK","classification":"U","division":"PCC","hit_factor":7.9339},{"match_name":"INAS USPSA Nov 2017","match_date":"2017-11-12","stage_classifiercode":"99-11","member_number":"A81890","first_name":"DONOVAN","last_name":"TRIPPLET","classification":"A","division":"PCC","hit_factor":7.9279},{"match_name":"FAS Sunday Indoors USPSA","match_date":"2021-10-17","stage_classifiercode":"99-11","member_number":"A124509","first_name":"CALEB","last_name":"GOODMAN","classification":"B","division":"PCC","hit_factor":7.9268},{"match_name":"USPSA MO21 2Alpha SBRC Classifier 2016","match_date":"2016-11-26","stage_classifiercode":"99-11","member_number":"fy70323","first_name":"LEE","last_name":"SUTTON","classification":"U","division":"PCC","hit_factor":7.9268},{"match_name":"TPS USPSA -  August Classifier Match 2020","match_date":"2020-08-01","stage_classifiercode":"99-11","member_number":"A29708","first_name":"JOHN","last_name":"RASMUSSEN","classification":"A","division":"PCC","hit_factor":7.9239},{"match_name":"Benton Gun Club-USPSA May27 2018 CLASIFIER","match_date":"2018-05-27","stage_classifiercode":"99-11","member_number":"TY82278","first_name":"ROWDY","last_name":"BRICCO","classification":"A","division":"PCC","hit_factor":7.9235},{"match_name":"ENPS 2018 June USPSA Match","match_date":"2018-06-03","stage_classifiercode":"99-11","member_number":"A49306","first_name":"LESLIE","last_name":"NIELSON","classification":"B","division":"PCC","hit_factor":7.9208},{"match_name":"Richmond Hot Shots October 6-7 USPSA Pistol Match","match_date":"2018-10-06","stage_classifiercode":"99-11","member_number":"A60621","first_name":"JUN","last_name":"AMPIL","classification":"B","division":"PCC","hit_factor":7.9208},{"match_name":"WVRPC Speed Shoot Spectacular Dec 2017","match_date":"2017-12-16","stage_classifiercode":"99-11","member_number":"A88985","first_name":"GREG","last_name":"HERRELL","classification":"M","division":"PCC","hit_factor":7.9179},{"match_name":"SAGC CTX04 Monthly USPSA Match - November 2018","match_date":"2018-11-25","stage_classifiercode":"99-11","member_number":"ty96408","first_name":"LARRY","last_name":"ZIENTEK","classification":"C","division":"PCC","hit_factor":7.9077},{"match_name":"MRPC OHS02 042218","match_date":"2018-04-21","stage_classifiercode":"99-11","member_number":"TY101482","first_name":"MIKE","last_name":"FLORA","classification":"C","division":"PCC","hit_factor":7.9027},{"match_name":"PSAC 20171028","match_date":"2017-10-28","stage_classifiercode":"99-11","member_number":"\"\"","first_name":"SEAN","last_name":"KELLEJIAN","classification":"U","division":"PCC","hit_factor":7.9019},{"match_name":"PRG 2017 Classifier Match","match_date":"2017-02-19","stage_classifiercode":"99-11","member_number":"A37933","first_name":"CHUCK","last_name":"STRELECKY","classification":"U","division":"PCC","hit_factor":7.8989},{"match_name":"SCCC CLASSIFIER MATCH 7_23_17","match_date":"2017-07-23","stage_classifiercode":"99-11","member_number":"TY96280","first_name":"TY_2","last_name":"O'BRADOVICH","classification":"U","division":"PCC","hit_factor":7.8984},{"match_name":"CBS USPSA Mar  2018","match_date":"2018-03-21","stage_classifiercode":"99-11","member_number":"A89904","first_name":"MIKE","last_name":"SAB","classification":"U","division":"PCC","hit_factor":7.8984},{"match_name":"CRCPS 2021-08-14","match_date":"2021-08-14","stage_classifiercode":"99-11","member_number":"TY81342","first_name":"JIM","last_name":"WAUGH","classification":"C","division":"PCC","hit_factor":7.8947},{"match_name":"BPSA January 2017 USPSA","match_date":"2017-01-22","stage_classifiercode":"99-11","member_number":"TY60857","first_name":"BRYANT","last_name":"WILLETT","classification":"U","division":"PCC","hit_factor":7.8947},{"match_name":"PSS USPSA Classifier Match August 14 2021","match_date":"2021-08-14","stage_classifiercode":"99-11","member_number":"A120538","first_name":"JAMES","last_name":"HYSONG","classification":"B","division":"PCC","hit_factor":7.8907},{"match_name":"Rio Salado Hosemasters February 2021","match_date":"2021-02-27","stage_classifiercode":"99-11","member_number":"TY95703","first_name":"GEORGE","last_name":"LOVE","classification":"C","division":"PCC","hit_factor":7.8873},{"match_name":"PRG - Oh Shoot USPSA February 21st - 3rd Sunday Match","match_date":"2021-02-21","stage_classifiercode":"99-11","member_number":"TY129989","first_name":"JASON","last_name":"JOVES","classification":"C","division":"PCC","hit_factor":7.8818},{"match_name":"June 22 2016 A Zone","match_date":"2016-06-22","stage_classifiercode":"99-11","member_number":"L3082","first_name":"ROY","last_name":"STEDMAN","classification":"G","division":"PCC","hit_factor":7.874},{"match_name":"USPSA - Bridgeville DE - lvl 1 Clone","match_date":"2018-07-01","stage_classifiercode":"99-11","member_number":"A82344","first_name":"RICK","last_name":"TORRES","classification":"U","division":"PCC","hit_factor":7.8717},{"match_name":"PCSI - September 2017 USPSA","match_date":"2017-09-02","stage_classifiercode":"99-11","member_number":"A101010","first_name":"JUSTIN","last_name":"ROGERS2","classification":"C","division":"PCC","hit_factor":7.8712},{"match_name":"2017 Bay bridge Charity Classic - Richmond October 14-15-2017","match_date":"2017-10-14","stage_classifiercode":"99-11","member_number":"TY88773","first_name":"EPHRAIM","last_name":"SAN FELIPE","classification":"C","division":"PCC","hit_factor":7.8712},{"match_name":"Rio Salado UPPL September 2020","match_date":"2020-09-13","stage_classifiercode":"99-11","member_number":"A121959","first_name":"KEN","last_name":"ORGERON","classification":"C","division":"PCC","hit_factor":7.8697},{"match_name":"Ontelaunee USPSA  July 2018","match_date":"2018-07-29","stage_classifiercode":"99-11","member_number":"A108164","first_name":"JOE","last_name":"CIRIGLIANO","classification":"B","division":"PCC","hit_factor":7.8652},{"match_name":"CAPS USPSA June 2021","match_date":"2021-06-05","stage_classifiercode":"99-11","member_number":"Fy91643","first_name":"KENNETH","last_name":"CLAYTON","classification":"B","division":"PCC","hit_factor":7.8652},{"match_name":"HPS March 2020 Club Fun Match","match_date":"2020-03-07","stage_classifiercode":"99-11","member_number":"FY61621","first_name":"DERICK","last_name":"HIPOL","classification":"U","division":"PCC","hit_factor":7.8632},{"match_name":"ORPCI 2017 June USPSA Classifer Match","match_date":"2017-06-25","stage_classifiercode":"99-11","member_number":"A101096","first_name":"ADRIAN","last_name":"REENOCK","classification":"U","division":"PCC","hit_factor":7.8616},{"match_name":"SFPC Aug 8 2021 USPSA Classifier match","match_date":"2021-08-08","stage_classifiercode":"99-11","member_number":"A95572","first_name":"CHRIS","last_name":"CAMARGO","classification":"C","division":"PCC","hit_factor":7.8591},{"match_name":"Custer USPSA Mar 7th 2021","match_date":"2021-03-07","stage_classifiercode":"99-11","member_number":"TY93287","first_name":"CHRIS","last_name":"ORR","classification":"B","division":"PCC","hit_factor":7.8591},{"match_name":"2017 Bay bridge Charity Classic - Richmond October 14-15-2017","match_date":"2017-10-14","stage_classifiercode":"99-11","member_number":"A16730","first_name":"RON","last_name":"SECHLER","classification":"B","division":"PCC","hit_factor":7.8591},{"match_name":"FAS Tuesday Night Indoors Match","match_date":"2021-03-17","stage_classifiercode":"99-11","member_number":"A124509","first_name":"CALEB","last_name":"GOODMAN","classification":"B","division":"PCC","hit_factor":7.8493},{"match_name":"Richmond Hot Shots October 6-7 USPSA Pistol Match","match_date":"2018-10-06","stage_classifiercode":"99-11","member_number":"A79956","first_name":"EDWIN","last_name":"CHANG","classification":"B","division":"PCC","hit_factor":7.8488},{"match_name":"APSC USPSA 02-15-20","match_date":"2020-02-15","stage_classifiercode":"99-11","member_number":"TY38202","first_name":"GARRETT","last_name":"JACKSON","classification":"","division":"PCC","hit_factor":7.8484},{"match_name":"CRCPS 2020-08-08","match_date":"2020-08-08","stage_classifiercode":"99-11","member_number":"A102318","first_name":"TED","last_name":"NISCHAN","classification":"U","division":"PCC","hit_factor":7.8475},{"match_name":"Pardoe Sportsmens Association- USPSA Saturday 4-3-21","match_date":"2021-04-03","stage_classifiercode":"99-11","member_number":"Ty69964","first_name":"JEFF","last_name":"BATTY","classification":"B","division":"PCC","hit_factor":7.8431},{"match_name":"Pitcairn-Monroeville Sportsmens Club USPSA August 2017","match_date":"2017-08-05","stage_classifiercode":"99-11","member_number":"TY42401","first_name":"KEVIN","last_name":"BLAKE","classification":"B","division":"PCC","hit_factor":7.8378},{"match_name":"MPPL 11042018 Hoser Heaven","match_date":"2018-11-04","stage_classifiercode":"99-11","member_number":"TY47994","first_name":"PETER","last_name":"ABRAHAM","classification":"U","division":"PCC","hit_factor":7.837},{"match_name":"PCSI - September 2017 USPSA","match_date":"2017-09-02","stage_classifiercode":"99-11","member_number":"A103243","first_name":"ALAN","last_name":"PFEUFFER 2","classification":"C","division":"PCC","hit_factor":7.8365},{"match_name":"INAS May 2020 USPSA","match_date":"2020-05-09","stage_classifiercode":"99-11","member_number":"A115585","first_name":"DARRELL","last_name":"CASTLEBERRY","classification":"A","division":"PCC","hit_factor":7.8247},{"match_name":"LCSC Linden USPSA 092621","match_date":"2021-09-25","stage_classifiercode":"99-11","member_number":"Ty110656","first_name":"ANTHONY","last_name":"ORUM","classification":"B","division":"PCC","hit_factor":7.8247},{"match_name":"ITPSC January USPSA","match_date":"2017-01-21","stage_classifiercode":"99-11","member_number":"A80515","first_name":"MICAH","last_name":"ROWE","classification":"U","division":"PCC","hit_factor":7.8195},{"match_name":"MCRC USPSA August 2018","match_date":"2018-08-11","stage_classifiercode":"99-11","member_number":"A108656","first_name":"NELSON","last_name":"BERMAS","classification":"B","division":"PCC","hit_factor":7.8148},{"match_name":"CCC Shooting Complex November 2017","match_date":"2017-11-05","stage_classifiercode":"99-11","member_number":"\"\"","first_name":"MICHAEL","last_name":"KELLETT","classification":"U","division":"PCC","hit_factor":7.8148},{"match_name":"WPGC 8-7-2017","match_date":"2017-08-07","stage_classifiercode":"99-11","member_number":"A73532","first_name":"STEPHEN","last_name":"CASH","classification":"C","division":"PCC","hit_factor":7.8078},{"match_name":"MSSA Uspsa Club Match","match_date":"2017-08-27","stage_classifiercode":"99-11","member_number":"A104151","first_name":"SETH","last_name":"MCMAHAN","classification":"B","division":"PCC","hit_factor":7.8062},{"match_name":"Shadow Hawk Defense USPSA Special Classifier","match_date":"2020-11-14","stage_classifiercode":"99-11","member_number":"A86940","first_name":"ROBERT","last_name":"LEWIS","classification":"U","division":"PCC","hit_factor":7.8049},{"match_name":"ORPCI 2018.03.31 USPSA Special","match_date":"2018-03-31","stage_classifiercode":"99-11","member_number":"\"\"","first_name":"KEVIN","last_name":"RUSSELL","classification":"\"\"","division":"PCC","hit_factor":7.8035},{"match_name":"USPSA MO21 2Alpha SBRC December 22 2018","match_date":"2018-12-22","stage_classifiercode":"99-11","member_number":"TY94217","first_name":"DUSTIN","last_name":"CHAMBERLAIN","classification":"A","division":"PCC","hit_factor":7.8003},{"match_name":"Baileys July 2017","match_date":"2017-07-02","stage_classifiercode":"99-11","member_number":"L3738","first_name":"JAY","last_name":"OLMSTEAD","classification":"B","division":"PCC","hit_factor":7.7957},{"match_name":"GRPC USPSA WE STOP FOR NO STORM","match_date":"2017-09-03","stage_classifiercode":"99-11","member_number":"A94853","first_name":"BOB","last_name":"ZWECK","classification":"U","division":"PCC","hit_factor":7.7852},{"match_name":"EAPS July 2017 USPSA","match_date":"2017-07-16","stage_classifiercode":"99-11","member_number":"TY94451","first_name":"TODD","last_name":"DEMPSTER","classification":"U","division":"PCC","hit_factor":7.7852},{"match_name":"Pardoe Sportsmens Association-WPA14-2017-10-01","match_date":"2017-10-01","stage_classifiercode":"99-11","member_number":"L3860","first_name":"DAVID","last_name":"SNETHKAMP","classification":"A","division":"PCC","hit_factor":7.7852},{"match_name":"LGCSEMPS April 2018 Special Classifier","match_date":"2018-04-08","stage_classifiercode":"99-11","member_number":"A103105","first_name":"DANIEL","last_name":"DUROCHER","classification":"C","division":"PCC","hit_factor":7.7821},{"match_name":"PRG 2017 Classifier Match","match_date":"2017-02-19","stage_classifiercode":"99-11","member_number":"A78607","first_name":"AKITA","last_name":"YASUNARI","classification":"B","division":"PCC","hit_factor":7.7778},{"match_name":"NAAS 03-05-2016","match_date":"2017-03-05","stage_classifiercode":"99-11","member_number":"TY70025","first_name":"DAN","last_name":"WIELEBA","classification":"U","division":"PCC","hit_factor":7.776},{"match_name":"MSSA Uspsa Club Match","match_date":"2017-08-27","stage_classifiercode":"99-11","member_number":"L843","first_name":"LYNN","last_name":"JONES","classification":"A","division":"PCC","hit_factor":7.7728},{"match_name":"DWB - Deadwood Boys USPSA 20 September 2020  Classifier Match Makeup","match_date":"2020-09-20","stage_classifiercode":"99-11","member_number":"A112254","first_name":"JOAQUIN","last_name":"SERRATO","classification":"A","division":"PCC","hit_factor":7.7703},{"match_name":"WPGC 10-1-18","match_date":"2018-10-01","stage_classifiercode":"99-11","member_number":"A112018","first_name":"BRENT","last_name":"VOORHEES","classification":"B","division":"PCC","hit_factor":7.7644},{"match_name":"GWPP December 2020 Pistol","match_date":"2020-12-12","stage_classifiercode":"99-11","member_number":"L3738","first_name":"JAY","last_name":"OLMSTEAD","classification":"B","division":"PCC","hit_factor":7.762},{"match_name":"WILLISTON PRACTICAL SHOOTERS CLUB","match_date":"2020-10-03","stage_classifiercode":"99-11","member_number":"A106216","first_name":"PAUL","last_name":"CARPINONE","classification":"C","division":"PCC","hit_factor":7.7586},{"match_name":"OKCGC USPSA June 2018","match_date":"2018-06-02","stage_classifiercode":"99-11","member_number":"A88692","first_name":"MATTHEW","last_name":"OLLER","classification":"C","division":"PCC","hit_factor":7.7544},{"match_name":"Rankin Field June Sunday USPSA","match_date":"2020-06-21","stage_classifiercode":"99-11","member_number":"FY80861","first_name":"DAVE","last_name":"MAYEDA","classification":"A","division":"PCC","hit_factor":7.7544},{"match_name":"TBAS USPSA Match 2/23/20","match_date":"2020-02-23","stage_classifiercode":"99-11","member_number":"TY88333","first_name":"JACK","last_name":"DOUTHIT","classification":"","division":"PCC","hit_factor":7.7544},{"match_name":"Hopkinton USPSA May 2017","match_date":"2017-05-06","stage_classifiercode":"99-11","member_number":"TY62105","first_name":"CURT","last_name":"CASERTA","classification":"B","division":"PCC","hit_factor":7.7496},{"match_name":"SCCC CLASSIFIER MATCH 7_23_17","match_date":"2017-07-23","stage_classifiercode":"99-11","member_number":"ty101688","first_name":"DON","last_name":"APPLEGARTH","classification":"U","division":"PCC","hit_factor":7.7496},{"match_name":"Springfield Tactical Shooters 04/05/2018","match_date":"2018-04-05","stage_classifiercode":"99-11","member_number":"A55905","first_name":"BARRY","last_name":"OLIVER","classification":"C","division":"PCC","hit_factor":7.7475},{"match_name":"2017 Bay bridge Charity Classic - Richmond October 14-15-2017","match_date":"2017-10-14","stage_classifiercode":"99-11","member_number":"A87650","first_name":"ALEX","last_name":"GOETZE","classification":"B","division":"PCC","hit_factor":7.7475},{"match_name":"CCC Shooting Complex November 2017","match_date":"2017-11-05","stage_classifiercode":"99-11","member_number":"TY3880","first_name":"BILL","last_name":"MURRAY","classification":"M","division":"PCC","hit_factor":7.7369},{"match_name":"Brazosland Pistoleros USPSA - Sunday August 8th","match_date":"2021-08-08","stage_classifiercode":"99-11","member_number":"TY81983","first_name":"MATT","last_name":"HAWES","classification":"U","division":"PCC","hit_factor":7.7364},{"match_name":"SUPS USPSA 20-21 October 2018","match_date":"2018-10-20","stage_classifiercode":"99-11","member_number":"A82974","first_name":"ERIC","last_name":"STIDHAM","classification":"B","division":"PCC","hit_factor":7.7364},{"match_name":"ARPC USPSA Match 5-27-18","match_date":"2018-05-27","stage_classifiercode":"99-11","member_number":"A32149","first_name":"LASZLO","last_name":"SZABO","classification":"B","division":"PCC","hit_factor":7.7348},{"match_name":"Wvpps Nov. 2017","match_date":"2017-11-19","stage_classifiercode":"99-11","member_number":"TY13915","first_name":"DARRELL","last_name":"COOMER","classification":"B","division":"PCC","hit_factor":7.7333},{"match_name":"YRPA USPSA MARCH  2018","match_date":"2018-03-25","stage_classifiercode":"99-11","member_number":"L3238","first_name":"MATT","last_name":"NEWBURN","classification":"A","division":"PCC","hit_factor":7.7295},{"match_name":"Deadwood Boys USPSA All Classifier Match - 29 July 2018","match_date":"2018-07-29","stage_classifiercode":"99-11","member_number":"A73444","first_name":"KYLE","last_name":"FRAZIER","classification":"A","division":"PCC","hit_factor":7.7295},{"match_name":"ARPC USPSA Match 3-26-17","match_date":"2017-03-26","stage_classifiercode":"99-11","member_number":"A78034","first_name":"JEFF","last_name":"EISENHART","classification":"Unclassified","division":"PCC","hit_factor":7.728},{"match_name":"TCGC September 2020","match_date":"2020-09-24","stage_classifiercode":"99-11","member_number":"TY99997","first_name":"CULLY","last_name":"POTTS","classification":"C","division":"PCC","hit_factor":7.7266},{"match_name":"ETRPC-USPSA","match_date":"2021-03-27","stage_classifiercode":"99-11","member_number":"L4553","first_name":"MIKE","last_name":"PIPES","classification":"B","division":"PCC","hit_factor":7.7266},{"match_name":"LCHG May USPSA","match_date":"2017-05-21","stage_classifiercode":"99-11","member_number":"\"\"","first_name":"COREEN","last_name":"HASH","classification":"U","division":"PCC","hit_factor":7.7266},{"match_name":"Springfield Tactical Shooters 04/05/2018","match_date":"2018-04-05","stage_classifiercode":"99-11","member_number":"FY83614","first_name":"GARY","last_name":"GRAY","classification":"B","division":"PCC","hit_factor":7.7253},{"match_name":"SSS Pistol Match March 2017","match_date":"2017-03-12","stage_classifiercode":"99-11","member_number":"TY85974","first_name":"JAMES","last_name":"BASCIO","classification":"B (B Class)","division":"PCC","hit_factor":7.722},{"match_name":"Pardoe Sportsmens Association- USPSA Saturday 4-3-21","match_date":"2021-04-03","stage_classifiercode":"99-11","member_number":"A118278","first_name":"ANTHONY","last_name":"VENDITTI","classification":"\"\"","division":"PCC","hit_factor":7.716},{"match_name":"RISE INDOOR CLASSIFIER","match_date":"2018-12-15","stage_classifiercode":"99-11","member_number":"Ty83328","first_name":"GIAN","last_name":"GIACINTO","classification":"U","division":"PCC","hit_factor":7.716},{"match_name":"GWPP August 2018 Pistol","match_date":"2018-08-11","stage_classifiercode":"99-11","member_number":"L3738","first_name":"JAY","last_name":"OLMSTEAD","classification":"B","division":"PCC","hit_factor":7.7151},{"match_name":"Shasta Shooters 2018 June Special Classifier","match_date":"2018-06-09","stage_classifiercode":"99-11","member_number":"FY26846","first_name":"ROCKY","last_name":"EVANS","classification":"B","division":"PCC","hit_factor":7.7143},{"match_name":"Omaha Gun Club USPSA February 28th 2018","match_date":"2018-03-01","stage_classifiercode":"99-11","member_number":"FY5456","first_name":"MARK","last_name":"RICHARDS","classification":"C","division":"PCC","hit_factor":7.7135},{"match_name":"Wvpps Nov. 2017","match_date":"2017-11-19","stage_classifiercode":"99-11","member_number":"fy28709","first_name":"GARY","last_name":"CHANEY","classification":"B","division":"PCC","hit_factor":7.7128},{"match_name":"ARPC USPSA Match 8-23-20","match_date":"2020-08-23","stage_classifiercode":"99-11","member_number":"TY93949","first_name":"KEITH","last_name":"SHORT","classification":"C","division":"PCC","hit_factor":7.7121},{"match_name":"OK15 USPSA at USSA","match_date":"2017-12-10","stage_classifiercode":"99-11","member_number":"A81825","first_name":"IAN","last_name":"ZACHER","classification":"U","division":"PCC","hit_factor":7.7042},{"match_name":"Lefthanders Gun Club Practical Shooters October","match_date":"2017-09-30","stage_classifiercode":"99-11","member_number":"L3651","first_name":"RYAN","last_name":"BRADLEY","classification":"B","division":"PCC","hit_factor":7.7037},{"match_name":"INAS May 2020 USPSA","match_date":"2020-05-09","stage_classifiercode":"99-11","member_number":"TY48358","first_name":"KEN","last_name":"COOMBS","classification":"B","division":"PCC","hit_factor":7.6923},{"match_name":"VISSC Ray Will Have a Coke","match_date":"2020-09-27","stage_classifiercode":"99-11","member_number":"A111650","first_name":"ERNESTO","last_name":"NOBLEJAS","classification":"C","division":"PCC","hit_factor":7.6923},{"match_name":"EAPS July 2017 USPSA","match_date":"2017-07-16","stage_classifiercode":"99-11","member_number":"\"\"","first_name":"AARON","last_name":"JANDLE","classification":"U","division":"PCC","hit_factor":7.6923},{"match_name":"Target  Sports Central Indiana Championship","match_date":"2020-08-22","stage_classifiercode":"99-11","member_number":"TY119289","first_name":"ALEX","last_name":"MORALES","classification":"U","division":"PCC","hit_factor":7.6809},{"match_name":"Grandbaggers 07-05-2018","match_date":"2018-07-05","stage_classifiercode":"99-11","member_number":"A111995","first_name":"LEE","last_name":"WEINSTEIN","classification":"U","division":"PCC","hit_factor":7.672},{"match_name":"VISSC Ray Will Have a Coke","match_date":"2020-09-27","stage_classifiercode":"99-11","member_number":"FY5322","first_name":"BARRY","last_name":"AOKI","classification":"U","division":"PCC","hit_factor":7.672},{"match_name":"FAS Sunday Indoors USPSA Match","match_date":"2021-02-07","stage_classifiercode":"99-11","member_number":"TY128939","first_name":"JACOB","last_name":"SANDERS","classification":"U","division":"PCC","hit_factor":7.6607},{"match_name":"SMPS USPSA Match - May 8th 2021 (Note this is a Saturday Match)","match_date":"2021-05-08","stage_classifiercode":"99-11","member_number":"TY37097","first_name":"TIM","last_name":"DUEHRING","classification":"A","division":"PCC","hit_factor":7.6517},{"match_name":"CFRPC April USPSA Match","match_date":"2018-04-15","stage_classifiercode":"99-11","member_number":"a109525","first_name":"BUTCH","last_name":"STARNES","classification":"C","division":"PCC","hit_factor":7.6487},{"match_name":"Target  Sports Central Indiana Championship","match_date":"2020-08-22","stage_classifiercode":"99-11","member_number":"A88985","first_name":"GREG","last_name":"HERRELL","classification":"G","division":"PCC","hit_factor":7.6471},{"match_name":"West Coast IPSC","match_date":"2018-07-22","stage_classifiercode":"99-11","member_number":"\"\"","first_name":"BRIAN","last_name":"DRAKE","classification":"U","division":"PCC","hit_factor":7.6471},{"match_name":"USPSA MO21 2Alpha SBRC Classifier 2016","match_date":"2016-11-26","stage_classifiercode":"99-11","member_number":"A14123","first_name":"BRIAN","last_name":"PAYNE","classification":"U","division":"PCC","hit_factor":7.6416},{"match_name":"Winona 7/25/17","match_date":"2017-07-25","stage_classifiercode":"99-11","member_number":"A84364","first_name":"LEN","last_name":"WUNDERLY","classification":"U","division":"PCC","hit_factor":7.6412},{"match_name":"Custer Feb USPSA","match_date":"2018-02-04","stage_classifiercode":"99-11","member_number":"TY41784","first_name":"RICK","last_name":"NASLUND","classification":"A","division":"PCC","hit_factor":7.6398},{"match_name":"USPSA MO21 2Alpha SBRC March 2018","match_date":"2018-03-24","stage_classifiercode":"99-11","member_number":"TY94217","first_name":"DUSTIN","last_name":"CHAMBERLAIN","classification":"B","division":"PCC","hit_factor":7.6379},{"match_name":"Richmond Hot Shots April 14-15-2018 USPSA Pistol Match","match_date":"2018-04-14","stage_classifiercode":"99-11","member_number":"TY32985","first_name":"DAVID","last_name":"PONCE","classification":"A","division":"PCC","hit_factor":7.6358},{"match_name":"Prescott 1st Saturday 8-05-17","match_date":"2017-08-05","stage_classifiercode":"99-11","member_number":"A54861","first_name":"DENNIS","last_name":"WALKER","classification":"M","division":"PCC","hit_factor":7.6271},{"match_name":"Custer USPSA Mar 7th 2021","match_date":"2021-03-07","stage_classifiercode":"99-11","member_number":"FY23884","first_name":"GREG","last_name":"PURCELL","classification":"G","division":"PCC","hit_factor":7.6172},{"match_name":"Springfield Tactical Shooters 05/06/2021","match_date":"2021-05-06","stage_classifiercode":"99-11","member_number":"FY83614","first_name":"GARY","last_name":"GRAY","classification":"B","division":"PCC","hit_factor":7.6056},{"match_name":"Blackstone Shooting Sports Snow Days January 2017 USPSA Level  1","match_date":"2017-01-08","stage_classifiercode":"99-11","member_number":"TY72553","first_name":"BRIAN","last_name":"DEMMA","classification":"C","division":"PCC","hit_factor":7.6056},{"match_name":"HSC USPSA October 7th 2017","match_date":"2017-10-06","stage_classifiercode":"99-11","member_number":"A75245","first_name":"JEFFERY","last_name":"FLETCHER","classification":"U","division":"PCC","hit_factor":7.6046},{"match_name":"Laser Ninja Dragon League USPSA July 2nd Special Classifier","match_date":"2017-07-02","stage_classifiercode":"99-11","member_number":"A94289","first_name":"MAX","last_name":"WALKER","classification":"U","division":"PCC","hit_factor":7.6023},{"match_name":"RBGC 2017-06-24","match_date":"2017-06-24","stage_classifiercode":"99-11","member_number":"L1028","first_name":"TATA","last_name":"EUSEBIO","classification":"A","division":"PCC","hit_factor":7.6016},{"match_name":"ORSA USPSA October 2017","match_date":"2017-10-21","stage_classifiercode":"99-11","member_number":"TY92869","first_name":"CSABA","last_name":"FOLDES","classification":"\"\"","division":"PCC","hit_factor":7.5984},{"match_name":"CASA USPSA December 3  2017","match_date":"2017-12-03","stage_classifiercode":"99-11","member_number":"TY34745","first_name":"KEITH","last_name":"HAMMOND","classification":"B","division":"PCC","hit_factor":7.5949},{"match_name":"PCSI - September 2017 USPSA","match_date":"2017-09-02","stage_classifiercode":"99-11","member_number":"A101393","first_name":"BRANDON","last_name":"PELLETIER2","classification":"U","division":"PCC","hit_factor":7.5881},{"match_name":"Brazosland Pistoleros USPSA - Sunday January 19th","match_date":"2020-01-19","stage_classifiercode":"99-11","member_number":"a67608","first_name":"GERRIT","last_name":"MILKS","classification":"A","division":"PCC","hit_factor":7.5829},{"match_name":"BA USPSA Jun 17-2017","match_date":"2017-06-11","stage_classifiercode":"99-11","member_number":"A62480","first_name":"GREG","last_name":"THOMAS","classification":"U","division":"PCC","hit_factor":7.5736},{"match_name":"ARPC USPSA Match 5-27-18","match_date":"2018-05-27","stage_classifiercode":"99-11","member_number":"A32462","first_name":"BRADLEY","last_name":"BOYD","classification":"C","division":"PCC","hit_factor":7.571},{"match_name":"Shadow Hawk Defense USPSA Special Classifier","match_date":"2020-11-14","stage_classifiercode":"99-11","member_number":"TY51119","first_name":"CHRIS","last_name":"MOLNAR","classification":"B","division":"PCC","hit_factor":7.563},{"match_name":"Rio Salado Hosemasters February 2021","match_date":"2021-02-27","stage_classifiercode":"99-11","member_number":"TY83533","first_name":"ANDY","last_name":"FEIGIN","classification":"A","division":"PCC","hit_factor":7.5581},{"match_name":"Tidewater Practical Shooter August 9th Match","match_date":"2021-08-09","stage_classifiercode":"99-11","member_number":"A112248","first_name":"AARON","last_name":"BUTSKO","classification":"B","division":"PCC","hit_factor":7.5581},{"match_name":"Hopkinton USPSA July 2018","match_date":"2018-07-07","stage_classifiercode":"99-11","member_number":"FY91061","first_name":"JOSEPH","last_name":"FLANAGAN","classification":"U","division":"PCC","hit_factor":7.5567},{"match_name":"Bailey's March 2020","match_date":"2020-03-03","stage_classifiercode":"99-11","member_number":"L3738","first_name":"JAY","last_name":"OLMSTEAD","classification":"B","division":"PCC","hit_factor":7.5472},{"match_name":"Nampa USPSA December 4th 2021","match_date":"2021-12-04","stage_classifiercode":"99-11","member_number":"TY87846","first_name":"JOHN","last_name":"JENSEN","classification":"B","division":"PCC","hit_factor":7.5404},{"match_name":"SAGC CTX04 Monthly USPSA Match - November 2018","match_date":"2018-11-25","stage_classifiercode":"99-11","member_number":"L2181","first_name":"DALE","last_name":"ALCORN","classification":"A","division":"PCC","hit_factor":7.5362},{"match_name":"CCPL May  Day Match","match_date":"2021-05-23","stage_classifiercode":"99-11","member_number":"TY87403","first_name":"ROD","last_name":"PFITZER","classification":"C","division":"PCC","hit_factor":7.5325},{"match_name":"RDS USPSA 8.13.16","match_date":"2016-08-13","stage_classifiercode":"99-11","member_number":"A6900","first_name":"BILLY","last_name":"MCCOY","classification":"A","division":"PCC","hit_factor":7.5325},{"match_name":"USPSA MO21 2Alpha SBRC March 2018","match_date":"2018-03-24","stage_classifiercode":"99-11","member_number":"TY50973","first_name":"DAVE","last_name":"WILSON","classification":"B","division":"PCC","hit_factor":7.5314},{"match_name":"Richmond Hot Shots October 6-7 USPSA Pistol Match","match_date":"2018-10-06","stage_classifiercode":"99-11","member_number":"TY109994","first_name":"MICHAEL","last_name":"LOOK","classification":"U","division":"PCC","hit_factor":7.5301},{"match_name":"INAS May 2020 USPSA","match_date":"2020-05-09","stage_classifiercode":"99-11","member_number":"A115931","first_name":"KAHLAN","last_name":"DAVIS","classification":"B","division":"PCC","hit_factor":7.5209},{"match_name":"Coastal Area Practical Shooters 7-22-17 Special Classifier","match_date":"2017-07-22","stage_classifiercode":"99-11","member_number":"A68296","first_name":"TIM","last_name":"CURRIE","classification":"C","division":"PCC","hit_factor":7.5209},{"match_name":"ORPCI 2017 June USPSA Classifer Match","match_date":"2017-06-25","stage_classifiercode":"99-11","member_number":"A104138","first_name":"KEVIN","last_name":"FARRAR","classification":"U","division":"PCC","hit_factor":7.5188},{"match_name":"ORPCI USPSA Saturday 2021.07.17","match_date":"2021-07-17","stage_classifiercode":"99-11","member_number":"TY13915","first_name":"DARRELL","last_name":"COOMER","classification":"","division":"PCC","hit_factor":7.5168},{"match_name":"SAPSA January 2020 Match","match_date":"2020-01-18","stage_classifiercode":"99-11","member_number":"A114953","first_name":"ELENA","last_name":"FOWLER","classification":"B","division":"PCC","hit_factor":7.5168},{"match_name":"GRB JAN USPSA  at Cav","match_date":"2017-01-21","stage_classifiercode":"99-11","member_number":"PENDING","first_name":"KEVIN","last_name":"SCHUNK","classification":"U","division":"PCC","hit_factor":7.5075},{"match_name":"Bossier Parish Practical Shooters August 16 2020","match_date":"2020-08-16","stage_classifiercode":"99-11","member_number":"A34831","first_name":"ERROL","last_name":"SHARP","classification":"U","division":"PCC","hit_factor":7.5067},{"match_name":"NCPS USPSA Handgun Match June 24 2018","match_date":"2018-06-24","stage_classifiercode":"99-11","member_number":"TY105459","first_name":"KEVIN","last_name":"BALLMENT","classification":"U","division":"PCC","hit_factor":7.5},{"match_name":"Grandbaggers August 2017","match_date":"2017-08-03","stage_classifiercode":"99-11","member_number":"A77066","first_name":"MARCELO","last_name":"MARIANO","classification":"B","division":"PCC","hit_factor":7.4963},{"match_name":"APSC USPSA 10-06-18","match_date":"2018-10-06","stage_classifiercode":"99-11","member_number":"\"\"","first_name":"TOM","last_name":"HEMKER","classification":"A","division":"PCC","hit_factor":7.4963},{"match_name":"ANPRACS USPSA 6-3-18","match_date":"2018-06-03","stage_classifiercode":"99-11","member_number":"A96203","first_name":"GENE","last_name":"VANNI","classification":"C","division":"PCC","hit_factor":7.4896},{"match_name":"WVPPS May 2021","match_date":"2021-05-16","stage_classifiercode":"99-11","member_number":"A52987","first_name":"JAKE","last_name":"MARTENS","classification":"A","division":"PCC","hit_factor":7.4896},{"match_name":"PSAC 20171028","match_date":"2017-10-28","stage_classifiercode":"99-11","member_number":"TY90095","first_name":"BRETT","last_name":"LOHMAN","classification":"B","division":"PCC","hit_factor":7.4896},{"match_name":"Campeonato USPSA 2020","match_date":"2020-05-30","stage_classifiercode":"99-11","member_number":"A97685","first_name":"RAFAEL","last_name":"SILVA-JIMENEZ","classification":"U","division":"PCC","hit_factor":7.4883},{"match_name":"Bayou City USPSA Weekly Dec 17","match_date":"2020-12-18","stage_classifiercode":"99-11","member_number":"A92443","first_name":"RAY","last_name":"FISHEL","classification":"B","division":"PCC","hit_factor":7.485},{"match_name":"CCSC USPSA Match","match_date":"2021-09-11","stage_classifiercode":"99-11","member_number":"A129203","first_name":"MATTHEW","last_name":"MIKULIN","classification":"B","division":"PCC","hit_factor":7.485},{"match_name":"Shadow Hawk Defense USPSA Special Classifier","match_date":"2020-11-14","stage_classifiercode":"99-11","member_number":"TY99998","first_name":"LEONARD","last_name":"ROY","classification":"U","division":"PCC","hit_factor":7.482},{"match_name":"WSRC USPSA 11/19/2017","match_date":"2017-11-19","stage_classifiercode":"99-11","member_number":"TY82645","first_name":"DARRYL","last_name":"VANCIL","classification":"B","division":"PCC","hit_factor":7.4818},{"match_name":"MPSA 07182020 USPSA","match_date":"2020-07-18","stage_classifiercode":"99-11","member_number":"A78083","first_name":"JEFFREY","last_name":"BLITCH","classification":"B","division":"PCC","hit_factor":7.4803},{"match_name":"Deadwood Boys USPSA All Classifier Match","match_date":"2016-08-07","stage_classifiercode":"99-11","member_number":"A90612","first_name":"DANE","last_name":"LAZARUS","classification":"U","division":"PCC","hit_factor":7.4766},{"match_name":"Rio Salado UPPL September 2020","match_date":"2020-09-13","stage_classifiercode":"99-11","member_number":"TY","first_name":"SAL","last_name":"WONG","classification":"B","division":"PCC","hit_factor":7.4742},{"match_name":"USPSA MO21 2Alpha SBRC June 2017","match_date":"2017-06-17","stage_classifiercode":"99-11","member_number":"L2880","first_name":"ANDREW","last_name":"BARKSDALE","classification":"C","division":"PCC","hit_factor":7.472},{"match_name":"RDS November 2020 USPSA","match_date":"2020-11-07","stage_classifiercode":"99-11","member_number":"A-84493","first_name":"ARCHIE","last_name":"WALL","classification":"C","division":"PCC","hit_factor":7.4689},{"match_name":"ITPSC January USPSA","match_date":"2017-01-21","stage_classifiercode":"99-11","member_number":"L3603","first_name":"MITCH","last_name":"GIBSON","classification":"U","division":"PCC","hit_factor":7.465},{"match_name":"Pinetucky USPSA 06-16-18","match_date":"2018-06-16","stage_classifiercode":"99-11","member_number":"TY103899","first_name":"JENNY","last_name":"COOK","classification":"C","division":"PCC","hit_factor":7.465},{"match_name":"Palmetto Gun Club - April 2017 USPSA","match_date":"2017-04-08","stage_classifiercode":"99-11","member_number":"FY71390","first_name":"ROBERT","last_name":"THORNTON","classification":"B","division":"PCC","hit_factor":7.4646},{"match_name":"CFRPC December USPSA (Classifier)","match_date":"2018-12-16","stage_classifiercode":"99-11","member_number":"A115501","first_name":"KENDALL","last_name":"EDSON","classification":"U","division":"PCC","hit_factor":7.4627},{"match_name":"Brazosland Pistoleros August 20 2017","match_date":"2017-08-20","stage_classifiercode":"99-11","member_number":"TY56894","first_name":"CHRIS","last_name":"PEDUTO","classification":"U","division":"PCC","hit_factor":7.4627},{"match_name":"LCSA USPSA July Classifier Match","match_date":"2016-07-30","stage_classifiercode":"99-11","member_number":"a69964","first_name":"JEFF","last_name":"BATTY","classification":"U","division":"PCC","hit_factor":7.4627},{"match_name":"SMPSA 2018-01 Pistol","match_date":"2018-01-14","stage_classifiercode":"99-11","member_number":"TY28619","first_name":"SCOTT","last_name":"JACOB","classification":"U","division":"PCC","hit_factor":7.4605},{"match_name":"SCCC CLASSIFIER MATCH 7_23_17","match_date":"2017-07-23","stage_classifiercode":"99-11","member_number":"a96988","first_name":"CRAIG","last_name":"BENEFIEL","classification":"U","division":"PCC","hit_factor":7.4586},{"match_name":"Ontelaunee USPSA  July 2018","match_date":"2018-07-29","stage_classifiercode":"99-11","member_number":"TY72492","first_name":"BRUCE","last_name":"CRAWFORD","classification":"U","division":"PCC","hit_factor":7.4586},{"match_name":"JPPS Club Match","match_date":"2018-04-21","stage_classifiercode":"99-11","member_number":"L2056","first_name":"RICKEY","last_name":"CRAIG","classification":"A","division":"PCC","hit_factor":7.455},{"match_name":"ARPC USPSA Match 3-26-17","match_date":"2017-03-26","stage_classifiercode":"99-11","member_number":"PEN","first_name":"TIMOTHY","last_name":"STECHER","classification":"Unclassified","division":"PCC","hit_factor":7.4534},{"match_name":"Coyote USPSA match 4-21-18","match_date":"2018-04-21","stage_classifiercode":"99-11","member_number":"A97187","first_name":"LORENZO","last_name":"RODRIGUEZ","classification":"B","division":"PCC","hit_factor":7.4483},{"match_name":"NAAS 03-05-2016","match_date":"2017-03-05","stage_classifiercode":"99-11","member_number":"A79673","first_name":"DANIELL","last_name":"RICHARDSON","classification":"U","division":"PCC","hit_factor":7.4468},{"match_name":"Free State PCC Match 8-29","match_date":"2020-08-29","stage_classifiercode":"99-11","member_number":"L3506","first_name":"DAN","last_name":"MILLER","classification":"B","division":"PCC","hit_factor":7.4454},{"match_name":"CCPL 12102017","match_date":"2017-12-08","stage_classifiercode":"99-11","member_number":"FY80861","first_name":"DAVE (PCC)","last_name":"MAYEDA","classification":"B","division":"PCC","hit_factor":7.4419},{"match_name":"BGSL Classifier Match ","match_date":"2018-10-06","stage_classifiercode":"99-11","member_number":"a105549","first_name":"DEXTER","last_name":"SPURLOCK","classification":"U","division":"PCC","hit_factor":7.4271},{"match_name":"NW01 April da Turd","match_date":"2018-04-04","stage_classifiercode":"99-11","member_number":"TY92838","first_name":"GREG","last_name":"BECK","classification":"B","division":"PCC","hit_factor":7.4199},{"match_name":"PTPC April 2nd USPSA Match","match_date":"2017-04-02","stage_classifiercode":"99-11","member_number":"A73683","first_name":"BRYAN","last_name":"TECSON","classification":"U","division":"PCC","hit_factor":7.4189},{"match_name":"Oakdale USPSA MN07 8-12-2021","match_date":"2021-08-12","stage_classifiercode":"99-11","member_number":"A113541","first_name":"DAN","last_name":"LLOYD","classification":"U","division":"PCC","hit_factor":7.4176},{"match_name":"ARPC USPSA Match 3-26-17","match_date":"2017-03-26","stage_classifiercode":"99-11","member_number":"A84182","first_name":"ROB","last_name":"SMITH","classification":"Unclassified","division":"PCC","hit_factor":7.4176},{"match_name":"LPRGC - Lower Providence USPSA October 2018","match_date":"2018-10-06","stage_classifiercode":"99-11","member_number":"A108419","first_name":"ANDREW","last_name":"LATYSZONEK","classification":"U","division":"PCC","hit_factor":7.4176},{"match_name":"Grandbaggers August 2017","match_date":"2017-08-03","stage_classifiercode":"99-11","member_number":"A98334","first_name":"MATT","last_name":"CHUEY","classification":"U","division":"PCC","hit_factor":7.4169},{"match_name":"SUPS USPSA 20-21 October 2018","match_date":"2018-10-20","stage_classifiercode":"99-11","member_number":"TY33287","first_name":"RANDY","last_name":"COATES","classification":"C","division":"PCC","hit_factor":7.4169},{"match_name":"ORGC CLASSIFIER 07-04-2017","match_date":"2017-07-04","stage_classifiercode":"99-11","member_number":"TY78149","first_name":"ELI","last_name":"SABER","classification":"U","division":"PCC","hit_factor":7.4074},{"match_name":"USPSA - Bridgeville DE - lvl 1 Clone","match_date":"2018-07-01","stage_classifiercode":"99-11","member_number":"A82492","first_name":"JOSE","last_name":"SOUSA","classification":"A","division":"PCC","hit_factor":7.4074},{"match_name":"HPS April Tax Time Fun Shoot","match_date":"2017-04-22","stage_classifiercode":"99-11","member_number":"TY84441","first_name":"SEAN","last_name":"HATADA","classification":"C","division":"PCC","hit_factor":7.4074},{"match_name":"NW01 April da Turd","match_date":"2018-04-04","stage_classifiercode":"99-11","member_number":"A51227","first_name":"KEVIN","last_name":"OLSON","classification":"B","division":"PCC","hit_factor":7.4074},{"match_name":"ITPSC January USPSA","match_date":"2017-01-21","stage_classifiercode":"99-11","member_number":"TY58871","first_name":"HEATH","last_name":"VINCENT","classification":"U","division":"PCC","hit_factor":7.3973},{"match_name":"Hopkinton USPSA July 2018","match_date":"2018-07-07","stage_classifiercode":"99-11","member_number":"TY62563","first_name":"ANATOLY","last_name":"PODPALY","classification":"C","division":"PCC","hit_factor":7.3973},{"match_name":"MPSA 07182020 USPSA","match_date":"2020-07-18","stage_classifiercode":"99-11","member_number":"L3885","first_name":"EDWARD","last_name":"CHANCERY","classification":"B","division":"PCC","hit_factor":7.3973},{"match_name":"Blackstone Shooting Sports Snow Days January 2017 USPSA Level  1","match_date":"2017-01-08","stage_classifiercode":"99-11","member_number":"fy75827","first_name":"KYLE","last_name":"HOLSCLAW","classification":"C","division":"PCC","hit_factor":7.3973},{"match_name":"LPRGC-Lower Providence USPSA May-1 2017","match_date":"2017-05-05","stage_classifiercode":"99-11","member_number":"TY54330","first_name":"VICTOR","last_name":"GRILLETTO","classification":"U","division":"PCC","hit_factor":7.3964},{"match_name":"NCPS USPSA Handgun Match June 24 2018","match_date":"2018-06-24","stage_classifiercode":"99-11","member_number":"TY64320","first_name":"ROBERT","last_name":"SHARP","classification":"A","division":"PCC","hit_factor":7.396},{"match_name":"CRCPS 2021-08-14","match_date":"2021-08-14","stage_classifiercode":"99-11","member_number":"TY96577","first_name":"JAMES","last_name":"DOMENICO","classification":"A","division":"PCC","hit_factor":7.393},{"match_name":"DAPS USPSA at ETTS 7-8-17","match_date":"2017-07-08","stage_classifiercode":"99-11","member_number":"TY12021","first_name":"RAGS","last_name":"CONNAWAY","classification":"B","division":"PCC","hit_factor":7.3892},{"match_name":"MSSA USPSA June  10 2017","match_date":"2017-06-10","stage_classifiercode":"99-11","member_number":"L2056","first_name":"RICK","last_name":"CRAIG 2","classification":"B","division":"PCC","hit_factor":7.3879},{"match_name":"November 2016 PCSI USPSA Monster Match","match_date":"2016-11-05","stage_classifiercode":"99-11","member_number":"A88135","first_name":"MARK","last_name":"COLASANTE","classification":"B","division":"PCC","hit_factor":7.3855},{"match_name":"Cactus USPSA ALL CLASSIFIER August 2020","match_date":"2020-08-02","stage_classifiercode":"99-11","member_number":"A107632","first_name":"CODY","last_name":"PACE","classification":"B","division":"PCC","hit_factor":7.3855},{"match_name":"GRPC USPSA TAX REFUND ","match_date":"2018-04-15","stage_classifiercode":"99-11","member_number":"FY69009","first_name":"TOM","last_name":"DONAHUE","classification":"C","division":"PCC","hit_factor":7.3791},{"match_name":"Pathfinder July USPSA Match","match_date":"2018-07-15","stage_classifiercode":"99-11","member_number":"TY43084","first_name":"HERB","last_name":"TERWILLIGER","classification":"none","division":"PCC","hit_factor":7.3698},{"match_name":"BHPSC Weekly Match 2-24-2017 Special Classifier Match","match_date":"2017-02-25","stage_classifiercode":"99-11","member_number":"A79477","first_name":"RYAN","last_name":"STRAYER","classification":"U","division":"PCC","hit_factor":7.3698},{"match_name":"SAPSC Special Classifier Match","match_date":"2018-04-26","stage_classifiercode":"99-11","member_number":"A97343","first_name":"GAGE","last_name":"TUCKER","classification":"C","division":"PCC","hit_factor":7.3698},{"match_name":"Maryland Practical Shooters Association July 2018","match_date":"2018-07-22","stage_classifiercode":"99-11","member_number":"86391","first_name":"MARK","last_name":"RODRIGUEZ","classification":"C","division":"PCC","hit_factor":7.3698},{"match_name":"WSPS JUNE 2018 USPSA MATCH","match_date":"2018-06-16","stage_classifiercode":"99-11","member_number":"FY86391","first_name":"MARK","last_name":"RODRIGUEZ","classification":"C","division":"PCC","hit_factor":7.3654},{"match_name":"DWB - Deadwood Boys USPSA 20 September 2020  Classifier Match Makeup","match_date":"2020-09-20","stage_classifiercode":"99-11","member_number":"TY-94897","first_name":"SHAWN","last_name":"WALTERS","classification":"U","division":"PCC","hit_factor":7.3654},{"match_name":"WSPS AUGUST 2016 USPSA","match_date":"2016-08-20","stage_classifiercode":"99-11","member_number":"A85208","first_name":"BRIAN","last_name":"DAKU","classification":"U","division":"PCC","hit_factor":7.3587},{"match_name":"WSPS JUNE 2018 USPSA MATCH","match_date":"2018-06-16","stage_classifiercode":"99-11","member_number":"FY90864","first_name":"JASON","last_name":"DEVINE","classification":"C","division":"PCC","hit_factor":7.3587},{"match_name":"WVPPS November 2018","match_date":"2018-11-18","stage_classifiercode":"99-11","member_number":"TY93659","first_name":"CRAIG","last_name":"LEHMAN","classification":"U","division":"PCC","hit_factor":7.355},{"match_name":"Ontelaunee USPSA Hose Fest","match_date":"2021-01-02","stage_classifiercode":"99-11","member_number":"FY117388","first_name":"GERALD","last_name":"SARMIENTO","classification":"C","division":"PCC","hit_factor":7.3491},{"match_name":"BHPC USPSA Monthly Match 9-10-17 IOWA","match_date":"2017-09-10","stage_classifiercode":"99-11","member_number":"A71452","first_name":"JON","last_name":"FISHER","classification":"Master","division":"PCC","hit_factor":7.3456},{"match_name":"Devil Dog USPSA Classifier Match-Saturday Session","match_date":"2018-03-10","stage_classifiercode":"99-11","member_number":"TY64132","first_name":"MIKE","last_name":"KERR","classification":"B","division":"PCC","hit_factor":7.3446},{"match_name":"Extreme GM USPSA  November","match_date":"2020-11-27","stage_classifiercode":"99-11","member_number":"FY33658","first_name":"CHRISTOPHER","last_name":"KOERNER","classification":"U","division":"PCC","hit_factor":7.3418},{"match_name":"TPS USPSA at CMP March 18 2017","match_date":"2017-03-18","stage_classifiercode":"99-11","member_number":"A71589","first_name":"SCOTTIE","last_name":"ROBERSON","classification":"U","division":"PCC","hit_factor":7.3394},{"match_name":"Brothers N Arms September 2017 USPSA Match","match_date":"2017-09-16","stage_classifiercode":"99-11","member_number":"A46930","first_name":"GERALD","last_name":"BENTON","classification":"U","division":"PCC","hit_factor":7.3394},{"match_name":"Strategic Edge July 2018 USPSA","match_date":"2018-07-21","stage_classifiercode":"99-11","member_number":"A97088","first_name":"CHRISTOPHER","last_name":"WELBORN","classification":"C","division":"PCC","hit_factor":7.3394},{"match_name":"November 2016 PCSI USPSA Monster Match","match_date":"2016-11-05","stage_classifiercode":"99-11","member_number":"A89563","first_name":"THOMAS","last_name":"CHAMBERS","classification":"U","division":"PCC","hit_factor":7.3298},{"match_name":"Benton Gun Club-USPSA March 25 2018","match_date":"2018-03-25","stage_classifiercode":"99-11","member_number":"\"\"","first_name":"DON","last_name":"BAKER","classification":"U","division":"PCC","hit_factor":7.326},{"match_name":"CASA USPSA  Feb 17","match_date":"2017-02-05","stage_classifiercode":"99-11","member_number":"A82570","first_name":"LARRY","last_name":"VINT","classification":"U","division":"PCC","hit_factor":7.3206},{"match_name":"Douglas Ridge USPSA March 7","match_date":"2020-03-07","stage_classifiercode":"99-11","member_number":"A121272","first_name":"MICHAEL","last_name":"HENRY","classification":"U","division":"PCC","hit_factor":7.3206},{"match_name":"MCPSL Pistol 3-10-18","match_date":"2018-03-10","stage_classifiercode":"99-11","member_number":"A77647","first_name":"CLINT","last_name":"SEALOCK","classification":"U","division":"PCC","hit_factor":7.3203},{"match_name":"SAPSA January 2020 Match","match_date":"2020-01-18","stage_classifiercode":"99-11","member_number":"A69229","first_name":"CHARLIE","last_name":"NELSON","classification":"B","division":"PCC","hit_factor":7.3203},{"match_name":"2017 Bay bridge Charity Classic - Richmond October 14-15-2017","match_date":"2017-10-14","stage_classifiercode":"99-11","member_number":"TY11898","first_name":"NOLAN","last_name":"SMYTH","classification":"M","division":"PCC","hit_factor":7.3203},{"match_name":"AAPS AAFG Level 1 Match - May 5 2018","match_date":"2018-05-05","stage_classifiercode":"99-11","member_number":"TY91875","first_name":"OTHELL","last_name":"MOORE","classification":"B","division":"PCC","hit_factor":7.3171},{"match_name":"Prescott Action Shooters 1st Saturday USPSA 6-2-2018 ","match_date":"2018-06-03","stage_classifiercode":"99-11","member_number":"A104571","first_name":"MIKE","last_name":"HAYES","classification":"\"\"","division":"PCC","hit_factor":7.3171},{"match_name":"CASA USPSA December 3  2017","match_date":"2017-12-03","stage_classifiercode":"99-11","member_number":"TY61943","first_name":"DON","last_name":"BAKER","classification":"C","division":"PCC","hit_factor":7.3171},{"match_name":"NHRPC - March 2021 USPSA","match_date":"2021-03-14","stage_classifiercode":"99-11","member_number":"Ty85259","first_name":"JOJO","last_name":"SANTOS","classification":"B","division":"PCC","hit_factor":7.3016},{"match_name":"ORPCI 2018.03.31 USPSA Special","match_date":"2018-03-31","stage_classifiercode":"99-11","member_number":"FY43270","first_name":"MIKE","last_name":"DAME","classification":"\"\"","division":"PCC","hit_factor":7.3012},{"match_name":"Prescott Action Shooters 1st Saturday USPSA 6-2-2018 ","match_date":"2018-06-03","stage_classifiercode":"99-11","member_number":"A98325","first_name":"BRONCO","last_name":"LANE","classification":"C","division":"PCC","hit_factor":7.2973},{"match_name":"CCC Shooting Complex November 2017","match_date":"2017-11-05","stage_classifiercode":"99-11","member_number":"\"\"","first_name":"BENSON","last_name":"KILGORE","classification":"U","division":"PCC","hit_factor":7.2956},{"match_name":"Range E11even January 2018","match_date":"2018-01-27","stage_classifiercode":"99-11","member_number":"A103235","first_name":"SAM","last_name":"HEWITT","classification":"U","division":"PCC","hit_factor":7.2917},{"match_name":"November 2016 PCSI USPSA Monster Match","match_date":"2016-11-05","stage_classifiercode":"99-11","member_number":"L3777","first_name":"CESAR","last_name":"HO","classification":"B","division":"PCC","hit_factor":7.29},{"match_name":"Omaha Gun Club USPSA February 28th 2018","match_date":"2018-03-01","stage_classifiercode":"99-11","member_number":"L3077","first_name":"SHAWN","last_name":"KNIGHT","classification":"U","division":"PCC","hit_factor":7.2886},{"match_name":"Sharp Practical Shooters November  USPSA - Indoor","match_date":"2021-11-28","stage_classifiercode":"99-11","member_number":"TY48358","first_name":"KEN","last_name":"COOMBS","classification":"B","division":"PCC","hit_factor":7.286},{"match_name":"CCC Shooting Complex November 2017","match_date":"2017-11-05","stage_classifiercode":"99-11","member_number":"\"\"","first_name":"ROGER","last_name":"LEE","classification":"U","division":"PCC","hit_factor":7.2727},{"match_name":"Prescott Action Shooters 1st Saturday USPSA 7-7-2018","match_date":"2018-07-07","stage_classifiercode":"99-11","member_number":"A98325","first_name":"BRONCO","last_name":"LANE","classification":"C","division":"PCC","hit_factor":7.2682},{"match_name":"APSC USPSA 10-06-18","match_date":"2018-10-06","stage_classifiercode":"99-11","member_number":"TY74988","first_name":"GREG","last_name":"COOPER","classification":"C","division":"PCC","hit_factor":7.2639},{"match_name":"2017 Bay bridge Charity Classic - Richmond October 14-15-2017","match_date":"2017-10-14","stage_classifiercode":"99-11","member_number":"A101653","first_name":"JONATHAN","last_name":"DIAZ","classification":"U","division":"PCC","hit_factor":7.2626},{"match_name":"LPRGC - Lower Providence USPSA October 2018","match_date":"2018-10-06","stage_classifiercode":"99-11","member_number":"A8835","first_name":"ROBERT","last_name":"BARRY","classification":"U","division":"PCC","hit_factor":7.2617},{"match_name":"Hose Monster Action ","match_date":"2020-07-19","stage_classifiercode":"99-11","member_number":"A 3501","first_name":"JOHN","last_name":"HERNDON","classification":"B","division":"PCC","hit_factor":7.2591},{"match_name":"Brothers N Arms September 2017 USPSA Match","match_date":"2017-09-16","stage_classifiercode":"99-11","member_number":"A99028","first_name":"JOHN","last_name":"CAUSEY","classification":"C","division":"PCC","hit_factor":7.2591},{"match_name":"Springfield Tactical Shooters 05/06/2021","match_date":"2021-05-06","stage_classifiercode":"99-11","member_number":"A55905","first_name":"BARRY","last_name":"OLIVER","classification":"B","division":"PCC","hit_factor":7.2539},{"match_name":"Rio Salado UPPL September 2020","match_date":"2020-09-13","stage_classifiercode":"99-11","member_number":"L3475","first_name":"MICHAEL","last_name":"MAYMAN","classification":"B","division":"PCC","hit_factor":7.2539},{"match_name":"Deadwood Boys USPSA All Classifier Match - 29 July 2018","match_date":"2018-07-29","stage_classifiercode":"99-11","member_number":"A102749","first_name":"ASHLEY","last_name":"YAMAMOTO","classification":"U","division":"PCC","hit_factor":7.2483},{"match_name":"LCSA  USPSA April 2017","match_date":"2017-04-08","stage_classifiercode":"99-11","member_number":"a62841","first_name":"THOMAS","last_name":"MCDEVITT","classification":"B","division":"PCC","hit_factor":7.2464},{"match_name":"YRPA USPSA MARCH  2018","match_date":"2018-03-25","stage_classifiercode":"99-11","member_number":"TY70904","first_name":"MICHAEL","last_name":"GIMERA","classification":"B","division":"PCC","hit_factor":7.2409},{"match_name":"APSC 4th Annual Holiday Hosefest USPSA Match 12-02-17","match_date":"2017-12-02","stage_classifiercode":"99-11","member_number":"TY77111","first_name":"DAVID","last_name":"REICHEK","classification":"U","division":"PCC","hit_factor":7.2398},{"match_name":"NCPS USPSA Handgun Match June 24 2018","match_date":"2018-06-24","stage_classifiercode":"99-11","member_number":"TY76839","first_name":"THOMAS","last_name":"WU","classification":"B","division":"PCC","hit_factor":7.2398},{"match_name":"USPSA MO21 2Alpha SBRC March 2018","match_date":"2018-03-24","stage_classifiercode":"99-11","member_number":"A97624","first_name":"MIKE","last_name":"MARTIN","classification":"C","division":"PCC","hit_factor":7.2386},{"match_name":"Pardoe Sportsmens Association- USPSA Saturday 4-3-21","match_date":"2021-04-03","stage_classifiercode":"99-11","member_number":"CA240","first_name":"DAN","last_name":"SMITH","classification":"X","division":"PCC","hit_factor":7.2376},{"match_name":"Bossier Parish Practical Shooters August 16 2020","match_date":"2020-08-16","stage_classifiercode":"99-11","member_number":"A122214","first_name":"CARLOS","last_name":"PERAZZA","classification":"B","division":"PCC","hit_factor":7.2359},{"match_name":"Deadwood Boys USPSA All Classifier Match","match_date":"2016-08-07","stage_classifiercode":"99-11","member_number":"\"\"","first_name":"CORINNE","last_name":"MOSHER","classification":"U","division":"PCC","hit_factor":7.2319},{"match_name":"TBAS USPSA Match 2/23/20","match_date":"2020-02-23","stage_classifiercode":"99-11","member_number":"L4796","first_name":"ALEC","last_name":"LAUB","classification":"U","division":"PCC","hit_factor":7.2319},{"match_name":"SSS USPSA February 2020","match_date":"2020-02-16","stage_classifiercode":"99-11","member_number":"Na","first_name":"RYAN","last_name":"WINDE","classification":"U (Unclassified)","division":"PCC","hit_factor":7.2254},{"match_name":"Richmond Hot Shots October 6-7 USPSA Pistol Match","match_date":"2018-10-06","stage_classifiercode":"99-11","member_number":"A100949","first_name":"MICHAEL","last_name":"CHING","classification":"B","division":"PCC","hit_factor":7.225},{"match_name":"GRB JAN USPSA  at Cav","match_date":"2017-01-21","stage_classifiercode":"99-11","member_number":"TY75733","first_name":"ALEX","last_name":"MELNICHAK","classification":"U","division":"PCC","hit_factor":7.2229},{"match_name":"Hopkinton USPSA July 2018","match_date":"2018-07-07","stage_classifiercode":"99-11","member_number":"FY91061","first_name":"JOSEPH","last_name":"FLANAGAN","classification":"U","division":"PCC","hit_factor":7.2139},{"match_name":"Deadwood Boys USPSA All Classifier Match - 29 July 2018","match_date":"2018-07-29","stage_classifiercode":"99-11","member_number":"A112254","first_name":"JOAQUIN","last_name":"SERRATO","classification":"U","division":"PCC","hit_factor":7.2122},{"match_name":"NAAS 2018-01-21 Special Classifier Match","match_date":"2018-01-21","stage_classifiercode":"99-11","member_number":"TY94807","first_name":"JAMES M","last_name":"GARNER","classification":"B","division":"PCC","hit_factor":7.205},{"match_name":"Grandbaggers August 2017","match_date":"2017-08-03","stage_classifiercode":"99-11","member_number":"A91531","first_name":"DIANA","last_name":"BRAFFORD","classification":"U","division":"PCC","hit_factor":7.2046},{"match_name":"Tidewater Practical Shooters February Match","match_date":"2020-02-17","stage_classifiercode":"99-11","member_number":"A120487","first_name":"COLLIN","last_name":"HETHERINGTON","classification":"","division":"PCC","hit_factor":7.2022},{"match_name":"WNPL USPSA - Nov 2017","match_date":"2017-11-05","stage_classifiercode":"99-11","member_number":"A103102","first_name":"PETE","last_name":"RUSSELL","classification":"C","division":"PCC","hit_factor":7.2},{"match_name":"Free State PCC Match 8-29","match_date":"2020-08-29","stage_classifiercode":"99-11","member_number":"A107631","first_name":"MYCHAL","last_name":"JOHNSON","classification":"U","division":"PCC","hit_factor":7.2},{"match_name":"ENPS 2018 June USPSA Match","match_date":"2018-06-03","stage_classifiercode":"99-11","member_number":"FY5456","first_name":"MARK","last_name":"RICHARDS","classification":"C","division":"PCC","hit_factor":7.1942},{"match_name":"NHRPC - March 2021 USPSA","match_date":"2021-03-14","stage_classifiercode":"99-11","member_number":"A114630","first_name":"JOSEPH","last_name":"SANTOS","classification":"A","division":"PCC","hit_factor":7.1926},{"match_name":"PSAC 20171028","match_date":"2017-10-28","stage_classifiercode":"99-11","member_number":"TY56017","first_name":"JOHN","last_name":"BEAZLEY","classification":"M","division":"PCC","hit_factor":7.1887},{"match_name":"GWPP December 2020 Pistol","match_date":"2020-12-12","stage_classifiercode":"99-11","member_number":"TY16696","first_name":"SCOTT","last_name":"MILLER","classification":"B","division":"PCC","hit_factor":7.1871},{"match_name":"Richmond Hot Shots April 14-15-2018 USPSA Pistol Match","match_date":"2018-04-14","stage_classifiercode":"99-11","member_number":"TY69128","first_name":"TONY","last_name":"YEH","classification":"C","division":"PCC","hit_factor":7.1823},{"match_name":"Pitcairn-Monroeville Sportsmens Club USPSA August 2017","match_date":"2017-08-05","stage_classifiercode":"99-11","member_number":"L3026","first_name":"DAVE","last_name":"DORISIO","classification":"A","division":"PCC","hit_factor":7.1795},{"match_name":"Deadwood Boys USPSA All Classifier Match - 29 July 2018","match_date":"2018-07-29","stage_classifiercode":"99-11","member_number":"TY75469","first_name":"OSCAR","last_name":"ACENCIO","classification":"U","division":"PCC","hit_factor":7.1782},{"match_name":"OK Corral USPSA Classifier Match Feb 18 2017","match_date":"2017-02-18","stage_classifiercode":"99-11","member_number":"A69760","first_name":"STEPHEN","last_name":"STOCK","classification":"\"\"","division":"PCC","hit_factor":7.1703},{"match_name":"HTF Practical Shooters","match_date":"2017-11-30","stage_classifiercode":"99-11","member_number":"A54880","first_name":"STEFAN","last_name":"WIGGINS","classification":"G","division":"PCC","hit_factor":7.1685},{"match_name":"SUPS All Classifier Match March 1718 2018","match_date":"2018-03-17","stage_classifiercode":"99-11","member_number":"A84409","first_name":"JALISE","last_name":"WILLIAMS","classification":"U","division":"PCC","hit_factor":7.1633},{"match_name":"HTF Practical Shooters","match_date":"2017-11-30","stage_classifiercode":"99-11","member_number":"A106160","first_name":"JOSH","last_name":"BREWER","classification":"C","division":"PCC","hit_factor":7.154},{"match_name":"Cactus USPSA ALL CLASSIFIER August 2020","match_date":"2020-08-02","stage_classifiercode":"99-11","member_number":"A123752","first_name":"BRANDON","last_name":"HEGRENESS","classification":"U","division":"PCC","hit_factor":7.152},{"match_name":"Extreme GM USPSA  November","match_date":"2020-11-27","stage_classifiercode":"99-11","member_number":"A114121","first_name":"ZAVI","last_name":"COHEN","classification":"B","division":"PCC","hit_factor":7.1429},{"match_name":"SFPC Oct 3 2021   USPSA Monthly Match","match_date":"2021-10-03","stage_classifiercode":"99-11","member_number":"A95572","first_name":"CHRIS","last_name":"CAMARGO","classification":"B","division":"PCC","hit_factor":7.1429},{"match_name":"Collin County USPSA 04-25-2021","match_date":"2021-04-24","stage_classifiercode":"99-11","member_number":"TY111352","first_name":"TADD","last_name":"MAASS","classification":"C","division":"PCC","hit_factor":7.1341},{"match_name":"TBAS USPSA Match 2/23/20","match_date":"2020-02-23","stage_classifiercode":"99-11","member_number":"A111791","first_name":"JOHN","last_name":"DANIELSON","classification":"","division":"PCC","hit_factor":7.1247},{"match_name":"Strategic Edge July 2018 USPSA","match_date":"2018-07-21","stage_classifiercode":"99-11","member_number":"FY66087","first_name":"ALLAN","last_name":"BIEDA","classification":"B","division":"PCC","hit_factor":7.1247},{"match_name":"EAPS July 2017 USPSA","match_date":"2017-07-16","stage_classifiercode":"99-11","member_number":"A103381","first_name":"ROBERT","last_name":"MCNAYLOR","classification":"U","division":"PCC","hit_factor":7.1233},{"match_name":"HTF Practical Shooters","match_date":"2017-11-30","stage_classifiercode":"99-11","member_number":"A106160","first_name":"JOSH","last_name":"BREWER","classification":"C","division":"PCC","hit_factor":7.1197},{"match_name":"LPRGC - Lower Providence USPSA October 2018","match_date":"2018-10-06","stage_classifiercode":"99-11","member_number":"FY44402","first_name":"NOAH","last_name":"GLADSTONE","classification":"C","division":"PCC","hit_factor":7.1166},{"match_name":"FAS USPSA   One Small Step","match_date":"2018-10-07","stage_classifiercode":"99-11","member_number":"A112345","first_name":"ZACHARY","last_name":"MCLAUGHLIN","classification":"B","division":"PCC","hit_factor":7.1156},{"match_name":"LCSC Linden USPSA 092621","match_date":"2021-09-25","stage_classifiercode":"99-11","member_number":"A514503","first_name":"GENER","last_name":"GASPAR","classification":"C","division":"PCC","hit_factor":7.1146},{"match_name":"Hallstead July 18th PCC","match_date":"2020-07-18","stage_classifiercode":"99-11","member_number":"TY75879","first_name":"SCOTT","last_name":"WEISENFLUH","classification":"U","division":"PCC","hit_factor":7.1135},{"match_name":"ENPS December 2020 USPSA Match","match_date":"2020-12-06","stage_classifiercode":"99-11","member_number":"FY81857","first_name":"MATT","last_name":"MADDEN","classification":"B","division":"PCC","hit_factor":7.1124},{"match_name":"Baileys July 2017","match_date":"2017-07-02","stage_classifiercode":"99-11","member_number":"a77156","first_name":"JAY","last_name":"BENNETT","classification":"U","division":"PCC","hit_factor":7.109},{"match_name":"Bossier Parish Practical Shooters August 16 2020","match_date":"2020-08-16","stage_classifiercode":"99-11","member_number":"A117525","first_name":"JUSTIN","last_name":"MCDONNELL","classification":"U","division":"PCC","hit_factor":7.1066},{"match_name":"GWPP Pistol December 2027","match_date":"2017-12-08","stage_classifiercode":"99-11","member_number":"L3738","first_name":"JAY","last_name":"OLMSTEAD","classification":"B","division":"PCC","hit_factor":7.1066},{"match_name":"BRSP Tuesday Night USPSA Match - May 15","match_date":"2018-05-16","stage_classifiercode":"99-11","member_number":"A104784","first_name":"CODY","last_name":"HOLLAND","classification":"C","division":"PCC","hit_factor":7.1053},{"match_name":"LGCSEMPS April 2018 Special Classifier","match_date":"2018-04-08","stage_classifiercode":"99-11","member_number":"L3371","first_name":"GREG","last_name":"PANZL","classification":"A","division":"PCC","hit_factor":7.1023},{"match_name":"RSPP 3rd Saturday November 2016","match_date":"2016-11-19","stage_classifiercode":"99-11","member_number":"2653","first_name":"NEIL","last_name":"SORENSEN","classification":"U","division":"PCC","hit_factor":7.1006},{"match_name":"TPS USPSA -  August Classifier Match 2020","match_date":"2020-08-01","stage_classifiercode":"99-11","member_number":"A105556","first_name":"MCKENZIE","last_name":"FITZPATRICK","classification":"U","division":"PCC","hit_factor":7.0905},{"match_name":"GRPC USPSA TAX REFUND ","match_date":"2018-04-15","stage_classifiercode":"99-11","member_number":"TY79055","first_name":"WADE","last_name":"PRUETZ","classification":"A","division":"PCC","hit_factor":7.0886},{"match_name":"EAPS July 2017 USPSA","match_date":"2017-07-16","stage_classifiercode":"99-11","member_number":"A101141","first_name":"MATHEW","last_name":"DOZIER","classification":"U","division":"PCC","hit_factor":7.0886},{"match_name":"SSS USPSA February 2020","match_date":"2020-02-16","stage_classifiercode":"99-11","member_number":"A120622","first_name":"AARON","last_name":"BANKS","classification":"B (B Class)","division":"PCC","hit_factor":7.0886},{"match_name":"PSAC 20171028","match_date":"2017-10-28","stage_classifiercode":"99-11","member_number":"A73532","first_name":"STEPHEN","last_name":"CASH","classification":"U","division":"PCC","hit_factor":7.0878},{"match_name":"RSPP 3rd Saturday November 2016","match_date":"2016-11-19","stage_classifiercode":"99-11","member_number":"L3678","first_name":"RICHARD","last_name":"BHELLA","classification":"U","division":"PCC","hit_factor":7.0838},{"match_name":"Free State PCC Match 8-29","match_date":"2020-08-29","stage_classifiercode":"99-11","member_number":"A118402","first_name":"DON","last_name":"SANDBERG","classification":"U","division":"PCC","hit_factor":7.0796},{"match_name":"CCPL 12102017","match_date":"2017-12-08","stage_classifiercode":"99-11","member_number":"L3301","first_name":"KEITH","last_name":"MIYASAKI","classification":"C","division":"PCC","hit_factor":7.0773},{"match_name":"Pinetucky USPSA 06-16-18","match_date":"2018-06-16","stage_classifiercode":"99-11","member_number":"A78661","first_name":"JESSICA","last_name":"HOOK","classification":"U","division":"PCC","hit_factor":7.074},{"match_name":"HTF Practical Shooters","match_date":"2017-11-30","stage_classifiercode":"99-11","member_number":"A106631","first_name":"JOEY","last_name":"TOMLINSON","classification":"U","division":"PCC","hit_factor":7.0707},{"match_name":"SKSC USPSA April 2018 Match","match_date":"2018-04-21","stage_classifiercode":"99-11","member_number":"TY54487","first_name":"DAVE","last_name":"GROVER","classification":"A","division":"PCC","hit_factor":7.0671},{"match_name":"BORCC USPSA August 2017","match_date":"2017-08-27","stage_classifiercode":"99-11","member_number":"A77486","first_name":"JOHN","last_name":"LOGAN","classification":"B","division":"PCC","hit_factor":7.0671},{"match_name":"Extreme GM","match_date":"2020-06-12","stage_classifiercode":"99-11","member_number":"A114121","first_name":"ZAVI","last_name":"COHEN","classification":"U","division":"PCC","hit_factor":7.0652},{"match_name":"RDS November 2020 USPSA","match_date":"2020-11-07","stage_classifiercode":"99-11","member_number":"TY84917","first_name":"LESTER","last_name":"STONE","classification":"C","division":"PCC","hit_factor":7.0652},{"match_name":"MVPSA USPSA 9-15-18","match_date":"2018-09-15","stage_classifiercode":"99-11","member_number":"A96807","first_name":"RYAN","last_name":"KELSO","classification":"C","division":"PCC","hit_factor":7.0588},{"match_name":"INAS USPSA Nov 2017","match_date":"2017-11-12","stage_classifiercode":"99-11","member_number":"TY21925","first_name":"WILLIAM","last_name":"PARKS III","classification":"C","division":"PCC","hit_factor":7.0556},{"match_name":"DPSL July 22 2018 All Classifier","match_date":"2018-07-22","stage_classifiercode":"99-11","member_number":"TY84666","first_name":"ADAM","last_name":"KELLY","classification":"\"\"","division":"PCC","hit_factor":7.0529},{"match_name":"Deadwood Boys USPSA All Classifier Match - 29 July 2018","match_date":"2018-07-29","stage_classifiercode":"99-11","member_number":"A90455","first_name":"CHEN","last_name":"LEE","classification":"U","division":"PCC","hit_factor":7.0496},{"match_name":"MS06 Team Magnolia February 2018 USPSA Match","match_date":"2018-02-03","stage_classifiercode":"99-11","member_number":"A92067","first_name":"DON","last_name":"ALBARES","classification":"B","division":"PCC","hit_factor":7.0496},{"match_name":"Collin County USPSA 04-25-2021","match_date":"2021-04-24","stage_classifiercode":"99-11","member_number":"A111461","first_name":"MICHAEL","last_name":"KING","classification":"B","division":"PCC","hit_factor":7.0474},{"match_name":"NHRPC - March 2021 USPSA","match_date":"2021-03-14","stage_classifiercode":"99-11","member_number":"A131587","first_name":"BRIAN","last_name":"BRATHOVD","classification":"U","division":"PCC","hit_factor":7.0423},{"match_name":"CRCPS 2020-08-08","match_date":"2020-08-08","stage_classifiercode":"99-11","member_number":"TY103254","first_name":"REGIS","last_name":"FRANK","classification":"B","division":"PCC","hit_factor":7.0423},{"match_name":"Competitive Shooters of Lake Norman CORNELIUS Thursday Evening Indoor USPSA Pistol Match North Carolina","match_date":"2020-09-17","stage_classifiercode":"99-11","member_number":"A93583","first_name":"JEREMY","last_name":"WILLETT","classification":"C","division":"PCC","hit_factor":7.0381},{"match_name":"TBAS USPSA Match 2/23/20","match_date":"2020-02-23","stage_classifiercode":"99-11","member_number":"A116613","first_name":"TRAVIS","last_name":"GEDROSE","classification":"","division":"PCC","hit_factor":7.0381},{"match_name":"LGCSEMPS April 2018 Special Classifier","match_date":"2018-04-08","stage_classifiercode":"99-11","member_number":"TY80233","first_name":"BRIAN","last_name":"POPELAS","classification":"U","division":"PCC","hit_factor":7.0365},{"match_name":"OK15 USPSA at USSA","match_date":"2017-12-10","stage_classifiercode":"99-11","member_number":"A57933","first_name":"LANCE","last_name":"JENSEN","classification":"U","division":"PCC","hit_factor":7.0342},{"match_name":"WNPL USPSA - Nov 2017","match_date":"2017-11-05","stage_classifiercode":"99-11","member_number":"A43862","first_name":"TOM","last_name":"MCCORMICK","classification":"B","division":"PCC","hit_factor":7.034},{"match_name":"LGCSEMPS April 2018 Special Classifier","match_date":"2018-04-08","stage_classifiercode":"99-11","member_number":"TY21120","first_name":"ERIC","last_name":"LARSEN","classification":"U","division":"PCC","hit_factor":7.0336},{"match_name":"San Juan Shooters ","match_date":"2017-07-08","stage_classifiercode":"99-11","member_number":"TY15995","first_name":"RON","last_name":"HANSEN","classification":"U","division":"PCC","hit_factor":7.0313},{"match_name":"NCPS USPSA Handgun Match June 24 2018","match_date":"2018-06-24","stage_classifiercode":"99-11","member_number":"A98745","first_name":"DAVID","last_name":"NIDETZ","classification":"C","division":"PCC","hit_factor":7.0313},{"match_name":"PRG - Oh Shoot USPSA February 21st - 3rd Sunday Match","match_date":"2021-02-21","stage_classifiercode":"99-11","member_number":"TY104042","first_name":"PHILLIP","last_name":"SANTOS","classification":"C","division":"PCC","hit_factor":7.027},{"match_name":"Deadwood Boys USPSA All Classifier Match","match_date":"2016-08-07","stage_classifiercode":"99-11","member_number":"TY-84175","first_name":"SHANNON","last_name":"YAUCHTZEE","classification":"U","division":"PCC","hit_factor":7.0238},{"match_name":"March 2018 USPSA Classifier Special","match_date":"2018-03-17","stage_classifiercode":"99-11","member_number":"F100662","first_name":"ADAM","last_name":"CARL","classification":"\"\"","division":"PCC","hit_factor":7.0221},{"match_name":"Custer USPSA Mar 7th 2021","match_date":"2021-03-07","stage_classifiercode":"99-11","member_number":"TY39942","first_name":"ROGER","last_name":"ARCOITE","classification":"C","division":"PCC","hit_factor":7.0218},{"match_name":"LGCSEMPS April 2018 Special Classifier","match_date":"2018-04-08","stage_classifiercode":"99-11","member_number":"A82371","first_name":"JOHN","last_name":"DESZELL","classification":"U","division":"PCC","hit_factor":7.0175},{"match_name":"Extreme GM","match_date":"2020-06-12","stage_classifiercode":"99-11","member_number":"TY93457","first_name":"JOE","last_name":"BARTOLOTTA","classification":"C","division":"PCC","hit_factor":7.0126},{"match_name":"Deadwood Boys USPSA All Classifier Match - 29 July 2018","match_date":"2018-07-29","stage_classifiercode":"99-11","member_number":"A104633","first_name":"ROBERT","last_name":"GOOD","classification":"U","division":"PCC","hit_factor":7.0088},{"match_name":"ORPCI 2018.03.31 USPSA Special","match_date":"2018-03-31","stage_classifiercode":"99-11","member_number":"TY109432","first_name":"MICKI","last_name":"PETKOVIC","classification":"X","division":"PCC","hit_factor":7.0064},{"match_name":"Brazosland Pistoleros USPSA - Sunday August 8th","match_date":"2021-08-08","stage_classifiercode":"99-11","member_number":"A45421","first_name":"WILLIAM","last_name":"CONLAN","classification":"U","division":"PCC","hit_factor":7.0039},{"match_name":"PRG 2017 Classifier Match","match_date":"2017-02-19","stage_classifiercode":"99-11","member_number":"A101129","first_name":"EMMANUAL","last_name":"CORDERO","classification":"U","division":"PCC","hit_factor":7},{"match_name":"Ontelaunee USPSA  July 2018","match_date":"2018-07-29","stage_classifiercode":"99-11","member_number":"FY44402","first_name":"NOAH","last_name":"GLADSTONE","classification":"C","division":"PCC","hit_factor":6.9964},{"match_name":"Winter League # 6","match_date":"2018-01-05","stage_classifiercode":"99-11","member_number":"L2719","first_name":"TIM","last_name":"EGAN","classification":"U","division":"PCC","hit_factor":6.9948},{"match_name":"USPSA MO21 2Alpha SBRC March 2018","match_date":"2018-03-24","stage_classifiercode":"99-11","member_number":"A109365","first_name":"DANNY","last_name":"CLEVENGER","classification":"U","division":"PCC","hit_factor":6.988},{"match_name":"TCGC September 2020","match_date":"2020-09-24","stage_classifiercode":"99-11","member_number":"TY85154","first_name":"JAMES","last_name":"JENSEN","classification":"A","division":"PCC","hit_factor":6.982},{"match_name":"WGC WI USPSA League 11-8-2016","match_date":"2016-11-09","stage_classifiercode":"99-11","member_number":"A91093","first_name":"MIKE","last_name":"MOHR","classification":"U","division":"PCC","hit_factor":6.9799},{"match_name":"CGC 03-10-2018","match_date":"2018-03-10","stage_classifiercode":"99-11","member_number":"TY75767","first_name":"BUDDY","last_name":"BRIDWELL","classification":"C","division":"PCC","hit_factor":6.9795},{"match_name":"ORPCI USPSA Friday 2021.07.16","match_date":"2021-07-16","stage_classifiercode":"99-11","member_number":"TY60003","first_name":"NATHAN","last_name":"HAMBLEN","classification":"U","division":"PCC","hit_factor":6.9767},{"match_name":"Castlewood USPSA Sept 2020 shoot","match_date":"2020-09-26","stage_classifiercode":"99-11","member_number":"Fy39111","first_name":"OLIE","last_name":"ERICKSEN","classification":"B","division":"PCC","hit_factor":6.9731},{"match_name":"Rio Salado Hosemasters February 2021","match_date":"2021-02-27","stage_classifiercode":"99-11","member_number":"CL164","first_name":"BOB","last_name":"RIPPY","classification":"B","division":"PCC","hit_factor":6.9677},{"match_name":"TCGC September 2020","match_date":"2020-09-24","stage_classifiercode":"99-11","member_number":"TY101888","first_name":"NICK","last_name":"HOWLAND","classification":"U","division":"PCC","hit_factor":6.9628},{"match_name":"Collin County USPSA 04-25-2021","match_date":"2021-04-24","stage_classifiercode":"99-11","member_number":"TY9766","first_name":"PATRICK","last_name":"BASHFORD","classification":"B","division":"PCC","hit_factor":6.962},{"match_name":"Brazosland Pistoleros August 20 2017","match_date":"2017-08-20","stage_classifiercode":"99-11","member_number":"L3935","first_name":"DANIEL","last_name":"DUBUISSON","classification":"C","division":"PCC","hit_factor":6.9588},{"match_name":"RPS November 2018 USPSA Match","match_date":"2018-11-10","stage_classifiercode":"99-11","member_number":"TY88724","first_name":"JESSICA","last_name":"DOIRON","classification":"A","division":"PCC","hit_factor":6.9519},{"match_name":"LCSC Linden USPSA 092621","match_date":"2021-09-25","stage_classifiercode":"99-11","member_number":"TY88866","first_name":"CHARLIE","last_name":"MENDOZA","classification":"A","division":"PCC","hit_factor":6.951},{"match_name":"FBURG USPSA November 2020","match_date":"2020-11-01","stage_classifiercode":"99-11","member_number":"A120434","first_name":"KAREN","last_name":"ZEIGLER","classification":"C","division":"PCC","hit_factor":6.9461},{"match_name":"PRG - Oh Shoot USPSA February 21st - 3rd Sunday Match","match_date":"2021-02-21","stage_classifiercode":"99-11","member_number":"Ty107199","first_name":"ROBIN","last_name":"TORRES","classification":"U","division":"PCC","hit_factor":6.9461},{"match_name":"Deadwood Boys USPSA All Classifier Match - 29 July 2018","match_date":"2018-07-29","stage_classifiercode":"99-11","member_number":"FY79130","first_name":"ANDREW","last_name":"HERNANDEZ","classification":"U","division":"PCC","hit_factor":6.9426},{"match_name":"Marc-On Shooting USPSA January 26th","match_date":"2020-01-26","stage_classifiercode":"99-11","member_number":"A105557","first_name":"ELLIOTT","last_name":"WATKINS","classification":"B","division":"PCC","hit_factor":6.9364},{"match_name":"LdF USPSA Match May 12 2018","match_date":"2018-05-12","stage_classifiercode":"99-11","member_number":"A76488","first_name":"MELINDA","last_name":"HENNESSEY","classification":"C","division":"PCC","hit_factor":6.9264},{"match_name":"APSC USPSA 02-15-20","match_date":"2020-02-15","stage_classifiercode":"99-11","member_number":"PENDING","first_name":"MARC","last_name":"DZIAK","classification":"U","division":"PCC","hit_factor":6.9231},{"match_name":"Deadwood Boys USPSA All Classifier Match - 29 July 2018","match_date":"2018-07-29","stage_classifiercode":"99-11","member_number":"TY95542","first_name":"FRITO","last_name":"BANDITO","classification":"C","division":"PCC","hit_factor":6.9212},{"match_name":"OREGON ARPC CC05 USPSA AUGUST 12 2017","match_date":"2017-08-12","stage_classifiercode":"99-11","member_number":"FY80028","first_name":"STAN","last_name":"PROUTY","classification":"U","division":"PCC","hit_factor":6.9142},{"match_name":"Rio Salado UPPL September 2020","match_date":"2020-09-13","stage_classifiercode":"99-11","member_number":"B73","first_name":"JOHN","last_name":"CATTERALL","classification":"C","division":"PCC","hit_factor":6.9142},{"match_name":"Benton Gun Club-USPSA June 28  9AM","match_date":"2020-06-28","stage_classifiercode":"99-11","member_number":"A81036","first_name":"ELI","last_name":"RUSHING","classification":"A","division":"PCC","hit_factor":6.914},{"match_name":"USPSA BGSL Jan 4th Weekend ","match_date":"2020-01-25","stage_classifiercode":"99-11","member_number":"TY101688","first_name":"DONALD","last_name":"APPLEGARTH","classification":"A","division":"PCC","hit_factor":6.9136},{"match_name":"Pardoe Sportsmens Association- USPSA Saturday 4-3-21","match_date":"2021-04-03","stage_classifiercode":"99-11","member_number":"FY99541","first_name":"WADE","last_name":"SHANER","classification":"\"\"","division":"PCC","hit_factor":6.913},{"match_name":"CAPS USPSA June 2021","match_date":"2021-06-05","stage_classifiercode":"99-11","member_number":"TY58309","first_name":"ERIC","last_name":"HENSON","classification":"A","division":"PCC","hit_factor":6.9069},{"match_name":"NAAS 2018-01-21 Special Classifier Match","match_date":"2018-01-21","stage_classifiercode":"99-11","member_number":"TY57617","first_name":"ERIC","last_name":"DAVIS","classification":"A","division":"PCC","hit_factor":6.9057},{"match_name":"EAPS July 2017 USPSA","match_date":"2017-07-16","stage_classifiercode":"99-11","member_number":"A104391","first_name":"C J","last_name":"SINGLETON","classification":"U","division":"PCC","hit_factor":6.8884},{"match_name":"Deadwood Boys USPSA All Classifier Match - 29 July 2018","match_date":"2018-07-29","stage_classifiercode":"99-11","member_number":"TY98956","first_name":"ED","last_name":"HOFILENA","classification":"U","division":"PCC","hit_factor":6.8878},{"match_name":"Bayou City USPSA Weekly June 4","match_date":"2020-06-04","stage_classifiercode":"99-11","member_number":"A107489","first_name":"CHARLES","last_name":"BRADBURY","classification":"C","division":"PCC","hit_factor":6.872},{"match_name":"EWPSA 2018-10","match_date":"2018-10-20","stage_classifiercode":"99-11","member_number":"FY39579","first_name":"ROBERT","last_name":"SPANGLER","classification":"U","division":"PCC","hit_factor":6.8692},{"match_name":"Cameo USPSA Match February 20 2021","match_date":"2021-02-20","stage_classifiercode":"99-11","member_number":"A3244","first_name":"PAUL","last_name":"DIMARCHI","classification":"C","division":"PCC","hit_factor":6.8587},{"match_name":"2017 Bay bridge Charity Classic - Richmond October 14-15-2017","match_date":"2017-10-14","stage_classifiercode":"99-11","member_number":"TY97642","first_name":"DANIEL","last_name":"NUNO","classification":"B","division":"PCC","hit_factor":6.8558},{"match_name":"2017 Bay bridge Charity Classic - Richmond October 14-15-2017","match_date":"2017-10-14","stage_classifiercode":"99-11","member_number":"TY89750","first_name":"JOHN","last_name":"CENDANA","classification":"C","division":"PCC","hit_factor":6.8474},{"match_name":"Richmond Hot Shots October 6-7 USPSA Pistol Match","match_date":"2018-10-06","stage_classifiercode":"99-11","member_number":"TY84211","first_name":"GEORGE","last_name":"TY","classification":"A","division":"PCC","hit_factor":6.8471},{"match_name":"Springfield Tactical Shooters 04/05/2018","match_date":"2018-04-05","stage_classifiercode":"99-11","member_number":"FY83614","first_name":"GARY","last_name":"GRAY","classification":"B","division":"PCC","hit_factor":6.8452},{"match_name":"Extreme GM PCC only ","match_date":"2020-07-12","stage_classifiercode":"99-11","member_number":"A123508","first_name":"JIM","last_name":"MCKEE","classification":"U","division":"PCC","hit_factor":6.8441},{"match_name":"ORPCI USPSA Saturday 2021.07.17","match_date":"2021-07-17","stage_classifiercode":"99-11","member_number":"A57495","first_name":"LEWIS","last_name":"HAMBLIN","classification":"","division":"PCC","hit_factor":6.8376},{"match_name":"Pitcairn-Monroeville Sportsmens Club USPSA August 2017","match_date":"2017-08-05","stage_classifiercode":"99-11","member_number":"A82693","first_name":"LINDA","last_name":"DORISIO","classification":"C","division":"PCC","hit_factor":6.8376},{"match_name":"2017 Bay bridge Charity Classic - Richmond October 14-15-2017","match_date":"2017-10-14","stage_classifiercode":"99-11","member_number":"A79956","first_name":"EDWIN","last_name":"CHANG","classification":"B","division":"PCC","hit_factor":6.8337},{"match_name":"PRG - Oh Shoot USPSA February 21st - 3rd Sunday Match","match_date":"2021-02-21","stage_classifiercode":"99-11","member_number":"TY85661","first_name":"KEITH","last_name":"SORRELL","classification":"A","division":"PCC","hit_factor":6.8306},{"match_name":"Hose Monster Action ","match_date":"2020-07-19","stage_classifiercode":"99-11","member_number":"FY95503","first_name":"KEVIN","last_name":"ALLISON","classification":"U","division":"PCC","hit_factor":6.8293},{"match_name":"USPSA BGSL Jan 4th Weekend ","match_date":"2020-01-25","stage_classifiercode":"99-11","member_number":"A67120","first_name":"ALLEN","last_name":"CARMICAL","classification":"A","division":"PCC","hit_factor":6.8279},{"match_name":"PSAC 20171028","match_date":"2017-10-28","stage_classifiercode":"99-11","member_number":"TY43263","first_name":"GENE","last_name":"BRAY","classification":"C","division":"PCC","hit_factor":6.8241},{"match_name":"SFPC Oct 3 2021   USPSA Monthly Match","match_date":"2021-10-03","stage_classifiercode":"99-11","member_number":"A133248","first_name":"DAVID","last_name":"KLEINMAN","classification":"U","division":"PCC","hit_factor":6.8235},{"match_name":"RangeMasters 9-27-2018","match_date":"2018-09-27","stage_classifiercode":"99-11","member_number":"L3738","first_name":"JAY","last_name":"OLMSTEAD","classification":"B","division":"PCC","hit_factor":6.8235},{"match_name":"Lefthanders Gun Club Practical Shooters October","match_date":"2017-09-30","stage_classifiercode":"99-11","member_number":"TY70023","first_name":"NICK","last_name":"WEBB","classification":"U","division":"PCC","hit_factor":6.8182},{"match_name":"WSPS JUNE 2018 USPSA MATCH","match_date":"2018-06-16","stage_classifiercode":"99-11","member_number":"A81524","first_name":"TONY","last_name":"ROSENZWEIG","classification":"B","division":"PCC","hit_factor":6.8182},{"match_name":"Rio Salado RSPP 3rd Saturday February 2020","match_date":"2020-02-15","stage_classifiercode":"99-11","member_number":"L1697","first_name":"DENNY","last_name":"SHADEL","classification":"C","division":"PCC","hit_factor":6.8155},{"match_name":"Competitive Shooters of Lake Norman CORNELIUS Thursday Evening Indoor USPSA Pistol Match North Carolina","match_date":"2020-09-17","stage_classifiercode":"99-11","member_number":"A126177","first_name":"JAMAR","last_name":"YEADON","classification":"U","division":"PCC","hit_factor":6.812},{"match_name":"Grandbaggers September 2018","match_date":"2018-09-06","stage_classifiercode":"99-11","member_number":"A34501","first_name":"RON","last_name":"FUCHS","classification":"A","division":"PCC","hit_factor":6.8104},{"match_name":"Richmond Hot Shots April 14-15-2018 USPSA Pistol Match","match_date":"2018-04-14","stage_classifiercode":"99-11","member_number":"TY24456","first_name":"RANDY","last_name":"MELTON","classification":"M","division":"PCC","hit_factor":6.8063},{"match_name":"CCC Shooting Complex October 2016","match_date":"2016-10-02","stage_classifiercode":"99-11","member_number":"A10536","first_name":"CHARLES","last_name":"THOMASON","classification":"U","division":"PCC","hit_factor":6.8063},{"match_name":"Fairfax PS USPSA  2018 October","match_date":"2018-10-16","stage_classifiercode":"99-11","member_number":"A100256","first_name":"CALEB","last_name":"FITZGERALD","classification":"B","division":"PCC","hit_factor":6.8027},{"match_name":"NAAS 2018-01-21 Special Classifier Match","match_date":"2018-01-21","stage_classifiercode":"99-11","member_number":"L1028","first_name":"SANCHO","last_name":"EUSEBIO","classification":"A","division":"PCC","hit_factor":6.7989},{"match_name":"ORPCI 2018.03.31 USPSA Special","match_date":"2018-03-31","stage_classifiercode":"99-11","member_number":"\"\"","first_name":"JEFF","last_name":"RUSSELL","classification":"U","division":"PCC","hit_factor":6.7901},{"match_name":"MSSA USPSA June  10 2017","match_date":"2017-06-10","stage_classifiercode":"99-11","member_number":"A101639","first_name":"PHILIP","last_name":"COX - 2ND","classification":"U","division":"PCC","hit_factor":6.7873},{"match_name":"GWPP December 2020 Pistol","match_date":"2020-12-12","stage_classifiercode":"99-11","member_number":"TY41987","first_name":"FRED","last_name":"CANNATA","classification":"C","division":"PCC","hit_factor":6.7836},{"match_name":"HOPS USPSA 072118","match_date":"2018-07-21","stage_classifiercode":"99-11","member_number":"FY111150","first_name":"ANDREW","last_name":"KOPPE","classification":"U","division":"PCC","hit_factor":6.7797},{"match_name":"Richmond Hot Shots April 14-15-2018 USPSA Pistol Match","match_date":"2018-04-14","stage_classifiercode":"99-11","member_number":"A88607","first_name":"FRANCO","last_name":"GESMUNDO","classification":"U","division":"PCC","hit_factor":6.7797},{"match_name":"MISS Match 10-4-17","match_date":"2017-10-04","stage_classifiercode":"99-11","member_number":"A89163","first_name":"MARTY","last_name":"SCHANER","classification":"C","division":"PCC","hit_factor":6.7754},{"match_name":"ORSA USPSA October 2017","match_date":"2017-10-21","stage_classifiercode":"99-11","member_number":"PEN","first_name":"SCOTT","last_name":"DURHAM","classification":"U","division":"PCC","hit_factor":6.7747},{"match_name":"Shasta Shooters 2018 June Special Classifier","match_date":"2018-06-09","stage_classifiercode":"99-11","member_number":"TY87118","first_name":"STAN","last_name":"CLEWETT","classification":"A","division":"PCC","hit_factor":6.7701},{"match_name":"Tidewater Practical Shooters February Match","match_date":"2020-02-17","stage_classifiercode":"99-11","member_number":"A115914","first_name":"ERIC","last_name":"WILSON","classification":"U","division":"PCC","hit_factor":6.7647},{"match_name":"MVPSA USPSA 9-15-18","match_date":"2018-09-15","stage_classifiercode":"99-11","member_number":"A103837","first_name":"NORMAN","last_name":"HATKE","classification":"C","division":"PCC","hit_factor":6.762},{"match_name":"Range 54 USPSA","match_date":"2017-03-10","stage_classifiercode":"99-11","member_number":"\"\"","first_name":"JOSH","last_name":"LUINSTRA","classification":"U","division":"PCC","hit_factor":6.752},{"match_name":"Shadow Hawk Defense USPSA Special Classifier","match_date":"2020-11-14","stage_classifiercode":"99-11","member_number":"A77140","first_name":"R","last_name":"ROUNDS","classification":"C","division":"PCC","hit_factor":6.75},{"match_name":"Pardoe Sportsmens Association-WPA14-2017-10-01","match_date":"2017-10-01","stage_classifiercode":"99-11","member_number":"A91103","first_name":"DANIEL","last_name":"TOOMBS","classification":"U","division":"PCC","hit_factor":6.75},{"match_name":"USPSA-Alberta 2018-01 Indoor Classifier 1","match_date":"2018-02-26","stage_classifiercode":"99-11","member_number":"F108679","first_name":"NICK","last_name":"LUI","classification":"U","division":"PCC","hit_factor":6.75},{"match_name":"2020-03 Bone Creek USPSA","match_date":"2020-03-01","stage_classifiercode":"99-11","member_number":"A117501","first_name":"ROD","last_name":"COLEMAN","classification":"C","division":"PCC","hit_factor":6.747},{"match_name":"HSC USPSA May 5th 2018","match_date":"2018-05-05","stage_classifiercode":"99-11","member_number":"ty40651","first_name":"RON","last_name":"RODGERS","classification":"C","division":"PCC","hit_factor":6.7442},{"match_name":"Lafayette Practical Shooters - WED-THUR - Dec 19-20 - CLASSIFIER MATCH","match_date":"2018-12-20","stage_classifiercode":"99-11","member_number":"A111463","first_name":"REESE","last_name":"HAWLEY","classification":"U","division":"PCC","hit_factor":6.7416},{"match_name":"Omaha Gun Club USPSA February 28th 2018","match_date":"2018-03-01","stage_classifiercode":"99-11","member_number":"A101489","first_name":"TODD","last_name":"WOITZEL","classification":"U","division":"PCC","hit_factor":6.7416},{"match_name":"OKCGC USPSA June 2018","match_date":"2018-06-02","stage_classifiercode":"99-11","member_number":"A93174","first_name":"SCOTT","last_name":"CUDE","classification":"A","division":"PCC","hit_factor":6.7395},{"match_name":"Afternoon SMPS 09 February 2020 USPSA Classifier Match","match_date":"2020-02-09","stage_classifiercode":"99-11","member_number":"A101917","first_name":"MIA","last_name":"FARINELLI","classification":"A","division":"PCC","hit_factor":6.7308},{"match_name":"OFGC USPSA Match Feb 19th 2017","match_date":"2017-02-19","stage_classifiercode":"99-11","member_number":"A82942","first_name":"DUANE","last_name":"CHRISTENSEN","classification":"U","division":"PCC","hit_factor":6.7285},{"match_name":"Prescott 1st Saturday 8-05-17","match_date":"2017-08-05","stage_classifiercode":"99-11","member_number":"A104571","first_name":"MIKE","last_name":"HAYES","classification":"unclassified","division":"PCC","hit_factor":6.727},{"match_name":"Springfield Tactical Shooters 04/05/2018","match_date":"2018-04-05","stage_classifiercode":"99-11","member_number":"TY87747","first_name":"BARRY","last_name":"ROWE","classification":"U","division":"PCC","hit_factor":6.7251},{"match_name":"PRG 2017 Classifier Match","match_date":"2017-02-19","stage_classifiercode":"99-11","member_number":"A98143","first_name":"REX","last_name":"HO","classification":"U","division":"PCC","hit_factor":6.7248},{"match_name":"Classifier Match","match_date":"2020-05-29","stage_classifiercode":"99-11","member_number":"A91855","first_name":"PEDRO","last_name":"BRAZ","classification":"B","division":"PCC","hit_factor":6.7204},{"match_name":"Custer USPSA Mar 7th 2021","match_date":"2021-03-07","stage_classifiercode":"99-11","member_number":"L2396","first_name":"FLOYD","last_name":"SHOEMAKER","classification":"A","division":"PCC","hit_factor":6.7183},{"match_name":"WVRPC Speed Shoot Spectacular Dec 2017","match_date":"2017-12-16","stage_classifiercode":"99-11","member_number":"FY98750","first_name":"VAN","last_name":"GURLEY","classification":"B","division":"PCC","hit_factor":6.7183},{"match_name":"CAPS USPSA June 2021","match_date":"2021-06-05","stage_classifiercode":"99-11","member_number":"Ty89183","first_name":"STEVE","last_name":"CASH","classification":"A","division":"PCC","hit_factor":6.7164},{"match_name":"MSSA USPSA June  10 2017","match_date":"2017-06-10","stage_classifiercode":"99-11","member_number":"L2056","first_name":"RICK","last_name":"CRAIG","classification":"B","division":"PCC","hit_factor":6.7133},{"match_name":"Hopkinton USPSA October 2018","match_date":"2018-10-06","stage_classifiercode":"99-11","member_number":"A111186","first_name":"MIKE","last_name":"TOMOVICH","classification":"\"\"","division":"PCC","hit_factor":6.7055},{"match_name":"Prescott Action Shooters 1st Saturday USPSA 6-2-2018 ","match_date":"2018-06-03","stage_classifiercode":"99-11","member_number":"A12460","first_name":"ED","last_name":"SERICH","classification":"G","division":"PCC","hit_factor":6.7019},{"match_name":"WVPPS May 2021","match_date":"2021-05-16","stage_classifiercode":"99-11","member_number":"A77176","first_name":"DON","last_name":"O'BRADOVICH","classification":"G","division":"PCC","hit_factor":6.701},{"match_name":"2017 Bay bridge Charity Classic - Richmond October 14-15-2017","match_date":"2017-10-14","stage_classifiercode":"99-11","member_number":"TY68229","first_name":"JC","last_name":"SMITH","classification":"U","division":"PCC","hit_factor":6.6986},{"match_name":"Heritage March 2021 USPSA","match_date":"2021-03-13","stage_classifiercode":"99-11","member_number":"Fy78117","first_name":"DEAN","last_name":"BLACK","classification":"B","division":"PCC","hit_factor":6.6975},{"match_name":"TCGC Polo July 2017","match_date":"2017-07-23","stage_classifiercode":"99-11","member_number":"A48165","first_name":"BOB","last_name":"HALE","classification":"C","division":"PCC","hit_factor":6.6946},{"match_name":"Rio Salado UPPL September 2020","match_date":"2020-09-13","stage_classifiercode":"99-11","member_number":"A89861","first_name":"LEON","last_name":"SMITH","classification":"C","division":"PCC","hit_factor":6.6893},{"match_name":"Richmond Hot Shots October 6-7 USPSA Pistol Match","match_date":"2018-10-06","stage_classifiercode":"99-11","member_number":"TY88773","first_name":"EPHRAIM","last_name":"SAN FELIPE","classification":"B","division":"PCC","hit_factor":6.6852},{"match_name":"Nampa USPSA December 4th 2021","match_date":"2021-12-04","stage_classifiercode":"99-11","member_number":"TY46963","first_name":"ALAN","last_name":"BRADEN","classification":"C","division":"PCC","hit_factor":6.6845},{"match_name":"PRG 2017 Classifier Match","match_date":"2017-02-19","stage_classifiercode":"99-11","member_number":"A87556","first_name":"ROB","last_name":"CHOI","classification":"U","division":"PCC","hit_factor":6.6832},{"match_name":"Brothers N Arms December 2018 USPSA Match","match_date":"2018-12-15","stage_classifiercode":"99-11","member_number":"A92067","first_name":"DON","last_name":"ALBARES","classification":"A","division":"PCC","hit_factor":6.6826},{"match_name":"OFGC USPSA Match Feb 19th 2017","match_date":"2017-02-19","stage_classifiercode":"99-11","member_number":"A73637","first_name":"JAMES","last_name":"JONES","classification":"U","division":"PCC","hit_factor":6.6826},{"match_name":"Extreme GM PCC only ","match_date":"2020-07-12","stage_classifiercode":"99-11","member_number":"TY79847","first_name":"ROBERT","last_name":"SETTLE","classification":"B","division":"PCC","hit_factor":6.6826},{"match_name":"MSSA USPSA June  10 2017","match_date":"2017-06-10","stage_classifiercode":"99-11","member_number":"FY64244","first_name":"TOM","last_name":"ROSS","classification":"U","division":"PCC","hit_factor":6.6815},{"match_name":"USPSA MO21 2Alpha SBRC December 22 2018","match_date":"2018-12-22","stage_classifiercode":"99-11","member_number":"A103980","first_name":"WALT","last_name":"COLTRIN","classification":"A","division":"PCC","hit_factor":6.6763},{"match_name":"MRPC OHS02 042218","match_date":"2018-04-21","stage_classifiercode":"99-11","member_number":"A27102","first_name":"DAVID","last_name":"CALLAHAN","classification":"C","division":"PCC","hit_factor":6.6763},{"match_name":"SMPS USPSA Feb 9 2020 AM Classifier","match_date":"2020-02-05","stage_classifiercode":"99-11","member_number":"TY37097","first_name":"TIM","last_name":"DUEHRING","classification":"A","division":"PCC","hit_factor":6.6746},{"match_name":"WVPPS November 2018","match_date":"2018-11-18","stage_classifiercode":"99-11","member_number":"TY17278","first_name":"STEVEN","last_name":"WRIGHT","classification":"B","division":"PCC","hit_factor":6.6743},{"match_name":"APSC 4th Annual Holiday Hosefest USPSA Match 12-02-17","match_date":"2017-12-02","stage_classifiercode":"99-11","member_number":"TY55326","first_name":"NATE","last_name":"HEINRICHS","classification":"U","division":"PCC","hit_factor":6.6667},{"match_name":"June 2018 CAS USPSA","match_date":"2018-06-03","stage_classifiercode":"99-11","member_number":"FY53269","first_name":"FORREST","last_name":"BOUDREAUX","classification":"U","division":"PCC","hit_factor":6.6667},{"match_name":"USPSA MO21 2Alpha SBRC March 2018","match_date":"2018-03-24","stage_classifiercode":"99-11","member_number":"A101376","first_name":"SHANE","last_name":"MACON","classification":"B","division":"PCC","hit_factor":6.6667},{"match_name":"RISE INDOOR CLASSIFIER","match_date":"2018-12-15","stage_classifiercode":"99-11","member_number":"A79300","first_name":"ROBERT","last_name":"RAMBIN","classification":"U","division":"PCC","hit_factor":6.6667},{"match_name":"WNPL USPSA - Nov 2017","match_date":"2017-11-05","stage_classifiercode":"99-11","member_number":"TY83039","first_name":"STEVE","last_name":"LEYDECKER","classification":"U","division":"PCC","hit_factor":6.659},{"match_name":"CASA USPSA December 3  2017","match_date":"2017-12-03","stage_classifiercode":"99-11","member_number":"TY53177","first_name":"CLEVE","last_name":"MATHEWS","classification":"B","division":"PCC","hit_factor":6.659},{"match_name":"APS August 1st Monthly USPSA Match  Classifier Match","match_date":"2021-08-01","stage_classifiercode":"99-11","member_number":"A130969","first_name":"JOHN","last_name":"RAMIREZ","classification":"C","division":"PCC","hit_factor":6.6566},{"match_name":"USPSA - Bridgeville DE - lvl 1 Clone","match_date":"2018-07-01","stage_classifiercode":"99-11","member_number":"\"\"","first_name":"JEREMY","last_name":"GRESHAM","classification":"U","division":"PCC","hit_factor":6.6508},{"match_name":"PRG - Oh Shoot USPSA February 21st - 3rd Sunday Match","match_date":"2021-02-21","stage_classifiercode":"99-11","member_number":"A106125","first_name":"DANI","last_name":"DAVID","classification":"C","division":"PCC","hit_factor":6.6465},{"match_name":"CCPL 12102017","match_date":"2017-12-08","stage_classifiercode":"99-11","member_number":"A105122","first_name":"CHRIS","last_name":"MIRANDA","classification":"U","division":"PCC","hit_factor":6.6421},{"match_name":"GRB JAN USPSA  at Cav","match_date":"2017-01-21","stage_classifiercode":"99-11","member_number":"FY71201","first_name":"BARRON","last_name":"ROPER","classification":"U","division":"PCC","hit_factor":6.6411},{"match_name":"WSRC USPSA 11/19/2017","match_date":"2017-11-19","stage_classifiercode":"99-11","member_number":"A99325","first_name":"TREVOR","last_name":"ARMSTRONG","classification":"U","division":"PCC","hit_factor":6.6398},{"match_name":"MPSA 050617 Classifier Match","match_date":"2017-05-06","stage_classifiercode":"99-11","member_number":"TY36282","first_name":"BILL","last_name":"MAHLEY","classification":"C","division":"PCC","hit_factor":6.6362},{"match_name":"USPSA MO21 2Alpha SBRC December 22 2018","match_date":"2018-12-22","stage_classifiercode":"99-11","member_number":"A101335","first_name":"TONY","last_name":"ALLEN","classification":"U","division":"PCC","hit_factor":6.6351},{"match_name":"2017 Bay bridge Charity Classic - Richmond October 14-15-2017","match_date":"2017-10-14","stage_classifiercode":"99-11","member_number":"TY79457","first_name":"LARRY","last_name":"MODELL","classification":"C","division":"PCC","hit_factor":6.6225},{"match_name":"SUPS All Classifier Match March 1718 2018","match_date":"2018-03-17","stage_classifiercode":"99-11","member_number":"A107132","first_name":"KABER","last_name":"ESPLIN","classification":"New","division":"PCC","hit_factor":6.621},{"match_name":"Lafayette Practical Shooters - WED - Nov 4","match_date":"2020-11-05","stage_classifiercode":"99-11","member_number":"TY114438","first_name":"STAN","last_name":"UHLIN","classification":"C","division":"PCC","hit_factor":6.6194},{"match_name":"Laser Ninja Dragon League USPSA July 2nd Special Classifier","match_date":"2017-07-02","stage_classifiercode":"99-11","member_number":"A99942","first_name":"JOHN","last_name":"MORRISON (PRODUCTION)","classification":"U","division":"PCC","hit_factor":6.6194},{"match_name":"PCSI - September 2017 USPSA","match_date":"2017-09-02","stage_classifiercode":"99-11","member_number":"A96708","first_name":"YURIY","last_name":"BORZENKO2","classification":"U","division":"PCC","hit_factor":6.6135},{"match_name":"FBURG July 2018 Level I USPSA ","match_date":"2018-07-01","stage_classifiercode":"99-11","member_number":"A9542","first_name":"DON","last_name":"FENTON","classification":"A","division":"PCC","hit_factor":6.6066},{"match_name":"CAPS USPSA June 2021","match_date":"2021-06-05","stage_classifiercode":"99-11","member_number":"Fy91643","first_name":"KENNETH","last_name":"CLAYTON","classification":"B","division":"PCC","hit_factor":6.5963},{"match_name":"PRG - Oh Shoot USPSA February 21st - 3rd Sunday Match","match_date":"2021-02-21","stage_classifiercode":"99-11","member_number":"TY112872","first_name":"ROBERT","last_name":"CAVAZOS","classification":"B","division":"PCC","hit_factor":6.596},{"match_name":"YRPA USPSA MARCH  2018","match_date":"2018-03-25","stage_classifiercode":"99-11","member_number":"A104247","first_name":"MATT","last_name":"MAYHAK","classification":"C","division":"PCC","hit_factor":6.5934},{"match_name":"WSPS JUNE 2018 USPSA MATCH","match_date":"2018-06-16","stage_classifiercode":"99-11","member_number":"TY713","first_name":"JEFF","last_name":"PATTON","classification":"C","division":"PCC","hit_factor":6.5934},{"match_name":"FBURG USPSA November 2020","match_date":"2020-11-01","stage_classifiercode":"99-11","member_number":"A130384","first_name":"JASON","last_name":"DILLON","classification":"U","division":"PCC","hit_factor":6.5934},{"match_name":"RISE USPSA PAULS MATCH","match_date":"2020-09-19","stage_classifiercode":"99-11","member_number":"A98471","first_name":"GENE","last_name":"GENKIN","classification":"C","division":"PCC","hit_factor":6.5903},{"match_name":"Bossier Parish Practical Shooters August 16 2020","match_date":"2020-08-16","stage_classifiercode":"99-11","member_number":"TY112434","first_name":"BILL","last_name":"CARROLL","classification":"U","division":"PCC","hit_factor":6.5882},{"match_name":"MRPC OHS02 042218","match_date":"2018-04-21","stage_classifiercode":"99-11","member_number":"L3088","first_name":"RALPH M.","last_name":"LOPEZ","classification":"U","division":"PCC","hit_factor":6.5808},{"match_name":"DAPS USPSA at ETTS 7-8-17","match_date":"2017-07-08","stage_classifiercode":"99-11","member_number":"TY64983","first_name":"NEIL","last_name":"ERASMUS","classification":"C","division":"PCC","hit_factor":6.5789},{"match_name":"Pinetucky USPSA 06-16-18","match_date":"2018-06-16","stage_classifiercode":"99-11","member_number":"A50849","first_name":"DERRICK","last_name":"HERNANDEZ","classification":"C","division":"PCC","hit_factor":6.5773},{"match_name":"Rio Salado UPPL September 2020","match_date":"2020-09-13","stage_classifiercode":"99-11","member_number":"A114163","first_name":"STEVEN","last_name":"MERLA","classification":"C","division":"PCC","hit_factor":6.5703},{"match_name":"MSSA USPSA June  10 2017","match_date":"2017-06-10","stage_classifiercode":"99-11","member_number":"A101639","first_name":"PHILIP","last_name":"COX","classification":"U","division":"PCC","hit_factor":6.5614},{"match_name":"Cameo USPSA Match February 20 2021","match_date":"2021-02-20","stage_classifiercode":"99-11","member_number":"TY126739","first_name":"TED","last_name":"MOE","classification":"C","division":"PCC","hit_factor":6.5611},{"match_name":"LIPSA  December 11th 2016 - USPSA Match","match_date":"2016-12-11","stage_classifiercode":"99-11","member_number":"A49357","first_name":"TONY","last_name":"BYKOV","classification":"U","division":"PCC","hit_factor":6.5574},{"match_name":"USPSA MO21 2Alpha SBRC December 22 2018","match_date":"2018-12-22","stage_classifiercode":"99-11","member_number":"L1536","first_name":"CRAIG","last_name":"NORDGREN","classification":"B","division":"PCC","hit_factor":6.5534},{"match_name":"Custer USPSA Mar 7th 2021","match_date":"2021-03-07","stage_classifiercode":"99-11","member_number":"A130178","first_name":"RAIANA","last_name":"ABUBAKAR","classification":"U","division":"PCC","hit_factor":6.5531},{"match_name":"MPPL 11042018 Hoser Heaven","match_date":"2018-11-04","stage_classifiercode":"99-11","member_number":"TY49133","first_name":"AARON","last_name":"URASAKI","classification":"U","division":"PCC","hit_factor":6.5466},{"match_name":"SLOSA NOVEMBER 2017 USPSA MATCH","match_date":"2017-11-11","stage_classifiercode":"99-11","member_number":"TY97989","first_name":"MELISSA","last_name":"CABREROS","classification":"C","division":"PCC","hit_factor":6.5375},{"match_name":"CGC 03-10-2018","match_date":"2018-03-10","stage_classifiercode":"99-11","member_number":"A94603","first_name":"RONALDO","last_name":"BORGES","classification":"C","division":"PCC","hit_factor":6.5375},{"match_name":"CFRPC April USPSA Match","match_date":"2018-04-15","stage_classifiercode":"99-11","member_number":"A79407","first_name":"CHARLES","last_name":"BALDRIDGE","classification":"A","division":"PCC","hit_factor":6.5344},{"match_name":"Prescott Action Shooters 1st Saturday USPSA 7-7-2018","match_date":"2018-07-07","stage_classifiercode":"99-11","member_number":"A72667","first_name":"KEN","last_name":"STUBBE","classification":"C","division":"PCC","hit_factor":6.5315},{"match_name":"SWGC USPSA Pistol Match - November 2021","match_date":"2021-11-06","stage_classifiercode":"99-11","member_number":"TY39654","first_name":"LEE","last_name":"DENNEY","classification":"B","division":"PCC","hit_factor":6.5274},{"match_name":"CASA USPSA December 3  2017","match_date":"2017-12-03","stage_classifiercode":"99-11","member_number":"TY55378","first_name":"TRAVIS","last_name":"THOMPSON","classification":"B","division":"PCC","hit_factor":6.5274},{"match_name":"SAGC CTX04 Monthly USPSA Match - June USPSA Match","match_date":"2018-06-24","stage_classifiercode":"99-11","member_number":"TY55560","first_name":"LARRY","last_name":"HILL","classification":"C","division":"PCC","hit_factor":6.5268},{"match_name":"SKSC USPSA April 2018 Match","match_date":"2018-04-21","stage_classifiercode":"99-11","member_number":"A105863","first_name":"PHILIP","last_name":"STRAATSMA","classification":"U","division":"PCC","hit_factor":6.5248},{"match_name":"OFGC USPSA Match Feb 19th 2017","match_date":"2017-02-19","stage_classifiercode":"99-11","member_number":"\"\"","first_name":"ROBB","last_name":"ELLIOTT","classification":"B","division":"PCC","hit_factor":6.5169},{"match_name":"SWGC USPSA Pistol Match - November 2021","match_date":"2021-11-06","stage_classifiercode":"99-11","member_number":"A54296","first_name":"ROBERT","last_name":"BOWLES","classification":"B","division":"PCC","hit_factor":6.5141},{"match_name":"MESQUITE MAYHEM SEPT 10TH USPSA","match_date":"2017-09-10","stage_classifiercode":"99-11","member_number":"A86699","first_name":"BRUCE","last_name":"LANDVIK","classification":"C","division":"PCC","hit_factor":6.5139},{"match_name":"Richmond Hot Shots April 14-15-2018 USPSA Pistol Match","match_date":"2018-04-14","stage_classifiercode":"99-11","member_number":"TY70843","first_name":"CHRISTIAN","last_name":"NESSINGER","classification":"B","division":"PCC","hit_factor":6.5116},{"match_name":"DPSL July 22 2018 All Classifier","match_date":"2018-07-22","stage_classifiercode":"99-11","member_number":"TY78761","first_name":"KALUB","last_name":"JACKSON","classification":"U","division":"PCC","hit_factor":6.5104},{"match_name":"MSSA USPSA June  10 2017","match_date":"2017-06-10","stage_classifiercode":"99-11","member_number":"A101291","first_name":"TIM","last_name":"CAYET","classification":"U","division":"PCC","hit_factor":6.5095},{"match_name":"SAPSA January 2020 Match","match_date":"2020-01-18","stage_classifiercode":"99-11","member_number":"TY73281","first_name":"JACK","last_name":"DARTIGALONGUE","classification":"B","division":"PCC","hit_factor":6.5089},{"match_name":"Rankin Field June Sunday USPSA","match_date":"2020-06-21","stage_classifiercode":"99-11","member_number":"FY103400","first_name":"SONNIE","last_name":"AVILA","classification":"U","division":"PCC","hit_factor":6.5089},{"match_name":"TBAS USPSA Match 2/21/21","match_date":"2021-02-21","stage_classifiercode":"99-11","member_number":"A100877","first_name":"RORY","last_name":"MCBRIDE","classification":"C","division":"PCC","hit_factor":6.5064},{"match_name":"Brothers N Arms December 2018 USPSA Match","match_date":"2018-12-15","stage_classifiercode":"99-11","member_number":"L1670","first_name":"TOM","last_name":"DUCHMAN","classification":"C","division":"PCC","hit_factor":6.5041},{"match_name":"PCPS Classifier and Slot Match Jan 2020","match_date":"2020-01-12","stage_classifiercode":"99-11","member_number":"A107558","first_name":"STUART","last_name":"FITZGERALD","classification":"C","division":"PCC","hit_factor":6.502},{"match_name":"2017-10-07 USPSA at Phoenix Rod and Gun Club","match_date":"2017-10-07","stage_classifiercode":"99-11","member_number":"TY57085","first_name":"DAVID","last_name":"HOPSON","classification":"U","division":"PCC","hit_factor":6.5005},{"match_name":"LIPSA  December 11th 2016 - USPSA Match","match_date":"2016-12-11","stage_classifiercode":"99-11","member_number":"A55119","first_name":"NICHOLAS","last_name":"ANDRONICA","classification":"C","division":"PCC","hit_factor":6.5},{"match_name":"DPSL July 22 2018 All Classifier","match_date":"2018-07-22","stage_classifiercode":"99-11","member_number":"FY80542","first_name":"DIANA","last_name":"DRISCOLL","classification":"U","division":"PCC","hit_factor":6.4935},{"match_name":"Rankin Field Sunday USPSA","match_date":"2018-04-15","stage_classifiercode":"99-11","member_number":"FY80861","first_name":"DAVE (PCC)","last_name":"MAYEDA","classification":"B","division":"PCC","hit_factor":6.4935},{"match_name":"June 2018 CAS USPSA","match_date":"2018-06-03","stage_classifiercode":"99-11","member_number":"L2311","first_name":"BRYAN","last_name":"GUILLORY","classification":"A","division":"PCC","hit_factor":6.4897},{"match_name":"Free State PCC Match 8-29","match_date":"2020-08-29","stage_classifiercode":"99-11","member_number":"A106239","first_name":"JOSHUA","last_name":"HALL","classification":"U","division":"PCC","hit_factor":6.4877},{"match_name":"MCRC USPSA August 2018","match_date":"2018-08-11","stage_classifiercode":"99-11","member_number":"TY64374","first_name":"MICHAEL","last_name":"CUTLER","classification":"B","division":"PCC","hit_factor":6.4826},{"match_name":"Grandbaggers August 2017","match_date":"2017-08-03","stage_classifiercode":"99-11","member_number":"TY65635","first_name":"CHRIS","last_name":"COLLINS","classification":"B","division":"PCC","hit_factor":6.4815},{"match_name":"SSS USPSA June 2020 FATHERS DAY Match","match_date":"2020-06-21","stage_classifiercode":"99-11","member_number":"a120622","first_name":"AARON","last_name":"BANKS","classification":"B (B Class)","division":"PCC","hit_factor":6.4725},{"match_name":"GRPC USPSA WE STOP FOR NO STORM","match_date":"2017-09-03","stage_classifiercode":"99-11","member_number":"A102760","first_name":"CHASE","last_name":"ZWECK","classification":"U","division":"PCC","hit_factor":6.4671},{"match_name":"Richmond Hot Shots April 14-15-2018 USPSA Pistol Match","match_date":"2018-04-14","stage_classifiercode":"99-11","member_number":"TY88773","first_name":"EPHRAIM","last_name":"SAN FELIPE","classification":"B","division":"PCC","hit_factor":6.4593},{"match_name":"LCSA USPSA July Classifier Match","match_date":"2016-07-30","stage_classifiercode":"99-11","member_number":"A78253","first_name":"NICK","last_name":"CHEN","classification":"U","division":"PCC","hit_factor":6.4593},{"match_name":"MCAS March 2021 USPSA","match_date":"2021-03-28","stage_classifiercode":"99-11","member_number":"TY77982","first_name":"NICK","last_name":"TIBESAR","classification":"C","division":"PCC","hit_factor":6.4516},{"match_name":"Castlewood July 2017 USPSA Match","match_date":"2017-07-22","stage_classifiercode":"99-11","member_number":"TY84357","first_name":"RAY","last_name":"DONCH","classification":"C","division":"PCC","hit_factor":6.4516},{"match_name":"USPSA MO21 Mini Match 2Alpha SBRC July 1 2021","match_date":"2021-07-01","stage_classifiercode":"99-11","member_number":"A65240","first_name":"JERRY","last_name":"GARRISON","classification":"U","division":"PCC","hit_factor":6.4516},{"match_name":"SAPSC Weekly USPSA Classifier Match 20170221","match_date":"2017-02-22","stage_classifiercode":"99-11","member_number":"A85815","first_name":"TODD","last_name":"KELLAR","classification":"U","division":"PCC","hit_factor":6.4447},{"match_name":"GRB JAN USPSA  at Cav","match_date":"2017-01-21","stage_classifiercode":"99-11","member_number":"A66693","first_name":"MICHAEL","last_name":"BUTCH","classification":"U","division":"PCC","hit_factor":6.4378},{"match_name":"Deadwood Boys USPSA All Classifier Match - 29 July 2018","match_date":"2018-07-29","stage_classifiercode":"99-11","member_number":"L3260","first_name":"EDWARD","last_name":"SHEN","classification":"U","division":"PCC","hit_factor":6.4373},{"match_name":"DCPA USPSA 10-11-2020","match_date":"2020-10-11","stage_classifiercode":"99-11","member_number":"A73234","first_name":"STEPHEN","last_name":"SPINELLA","classification":"U","division":"PCC","hit_factor":6.435},{"match_name":"GRB JAN USPSA  at Cav","match_date":"2017-01-21","stage_classifiercode":"99-11","member_number":"A72727","first_name":"GREG","last_name":"JONES","classification":"U","division":"PCC","hit_factor":6.4267},{"match_name":"2017 Bay bridge Charity Classic - Richmond October 14-15-2017","match_date":"2017-10-14","stage_classifiercode":"99-11","member_number":"TY73966","first_name":"CARLYANN","last_name":"KATALBAS","classification":"C","division":"PCC","hit_factor":6.4185},{"match_name":"USPSA MO21 2Alpha SBRC March 2018","match_date":"2018-03-24","stage_classifiercode":"99-11","member_number":"A10768","first_name":"JOHN","last_name":"ESLICK","classification":"B","division":"PCC","hit_factor":6.4147},{"match_name":"USPSA MO21 2Alpha SBRC March 2018","match_date":"2018-03-24","stage_classifiercode":"99-11","member_number":"\"\"","first_name":"AUSTIN","last_name":"KENNEDY","classification":"U","division":"PCC","hit_factor":6.4133},{"match_name":"Bayou City USPSA Weekly Dec 17","match_date":"2020-12-18","stage_classifiercode":"99-11","member_number":"TY105098","first_name":"DON","last_name":"SAME","classification":"C","division":"PCC","hit_factor":6.4118},{"match_name":"SAGC CTX04 Monthly USPSA Match - September 2020","match_date":"2020-09-27","stage_classifiercode":"99-11","member_number":"fy96408","first_name":"LARRY","last_name":"ZIENTEK","classification":"B","division":"PCC","hit_factor":6.4103},{"match_name":"LIPSA  December 11th 2016 - USPSA Match","match_date":"2016-12-11","stage_classifiercode":"99-11","member_number":"\"\"","first_name":"CHARLIE","last_name":"ZAMBITO","classification":"U","division":"PCC","hit_factor":6.4103},{"match_name":"ORPCI 2017 June USPSA Classifer Match","match_date":"2017-06-25","stage_classifiercode":"99-11","member_number":"TY78679","first_name":"RICHARD","last_name":"HIBBS","classification":"U","division":"PCC","hit_factor":6.4039},{"match_name":"TPS USPSA at CMP March 18 2017","match_date":"2017-03-18","stage_classifiercode":"99-11","member_number":"A95298","first_name":"JAMES","last_name":"PALMER","classification":"D","division":"PCC","hit_factor":6.3978},{"match_name":"PSAC 20171028","match_date":"2017-10-28","stage_classifiercode":"99-11","member_number":"A61086","first_name":"CY","last_name":"SOTO","classification":"M","division":"PCC","hit_factor":6.3943},{"match_name":"Brazosland Pistoleros August 20 2017","match_date":"2017-08-20","stage_classifiercode":"99-11","member_number":"A65587","first_name":"AARON","last_name":"VEZORAK","classification":"U","division":"PCC","hit_factor":6.3939},{"match_name":"SSS USPSA February 2020","match_date":"2020-02-16","stage_classifiercode":"99-11","member_number":"A73893","first_name":"MICHAEL","last_name":"ROGERS","classification":"A (A Class)","division":"PCC","hit_factor":6.3882},{"match_name":"AGC_20170903","match_date":"2017-09-03","stage_classifiercode":"99-11","member_number":"TY43263","first_name":"GENE","last_name":"BRAY","classification":"C","division":"PCC","hit_factor":6.3806},{"match_name":"DAPS USPSA at ETTS 7-8-17","match_date":"2017-07-08","stage_classifiercode":"99-11","member_number":"FY78343","first_name":"KURT","last_name":"KAUTH","classification":"C","division":"PCC","hit_factor":6.3781},{"match_name":"APSC 4th Annual Holiday Hosefest USPSA Match 12-02-17","match_date":"2017-12-02","stage_classifiercode":"99-11","member_number":"A100402","first_name":"SHANE","last_name":"GUINTHER","classification":"U","division":"PCC","hit_factor":6.3764},{"match_name":"Shot Through The Heart Classifiers","match_date":"2018-02-04","stage_classifiercode":"99-11","member_number":"A93299","first_name":"EDWARD","last_name":"REYES","classification":"C","division":"PCC","hit_factor":6.3754},{"match_name":"BLUE RIDGE ARSENAL July 6 Classifier Match","match_date":"2018-07-06","stage_classifiercode":"99-11","member_number":"A104540","first_name":"HEATHER","last_name":"MASLONEK","classification":"B","division":"PCC","hit_factor":6.3676},{"match_name":"Marc-On Shooting USPSA January 26th","match_date":"2020-01-26","stage_classifiercode":"99-11","member_number":"TY33072","first_name":"TED","last_name":"MILLER","classification":"C","division":"PCC","hit_factor":6.366},{"match_name":"17 South - April 2017","match_date":"2017-04-10","stage_classifiercode":"99-11","member_number":"TY102372","first_name":"TYRONE","last_name":"LEE","classification":"U","division":"PCC","hit_factor":6.3636},{"match_name":"Free State PCC Match 8-29","match_date":"2020-08-29","stage_classifiercode":"99-11","member_number":"A84551","first_name":"DAN","last_name":"REVELLE","classification":"U","division":"PCC","hit_factor":6.3636},{"match_name":"YRPA USPSA MARCH  2018","match_date":"2018-03-25","stage_classifiercode":"99-11","member_number":"TY82326","first_name":"WARREN","last_name":"HARPER","classification":"B","division":"PCC","hit_factor":6.3622},{"match_name":"MRPC OHS02 042218","match_date":"2018-04-21","stage_classifiercode":"99-11","member_number":"TY89068","first_name":"OLAF","last_name":"RASK","classification":"C","division":"PCC","hit_factor":6.3604},{"match_name":"USPSA MO21 2Alpha SBRC March 2018","match_date":"2018-03-24","stage_classifiercode":"99-11","member_number":"A99663","first_name":"MIKE","last_name":"SPEAR","classification":"A","division":"PCC","hit_factor":6.3564},{"match_name":"Granby Action Shooters Oct 2016","match_date":"2016-10-02","stage_classifiercode":"99-11","member_number":"TY88472","first_name":"JIM","last_name":"HOULE","classification":"U","division":"PCC","hit_factor":6.3457},{"match_name":"Benton Gun Club-USPSA September 27","match_date":"2020-09-27","stage_classifiercode":"99-11","member_number":"Ty101764","first_name":"KEITH","last_name":"DE NOBLE","classification":"B","division":"PCC","hit_factor":6.338},{"match_name":"GRB JAN USPSA  at Cav","match_date":"2017-01-21","stage_classifiercode":"99-11","member_number":"A87953","first_name":"CHARLES","last_name":"BAJER","classification":"U","division":"PCC","hit_factor":6.3358},{"match_name":"Palmetto Gun Club - April 2017 USPSA","match_date":"2017-04-08","stage_classifiercode":"99-11","member_number":"A92002","first_name":"DAVID","last_name":"REDD","classification":"B","division":"PCC","hit_factor":6.3319},{"match_name":"DWB - Deadwood Boys USPSA 20 September 2020  Classifier Match Makeup","match_date":"2020-09-20","stage_classifiercode":"99-11","member_number":"TY-93265","first_name":"BILL","last_name":"DUNN","classification":"D","division":"PCC","hit_factor":6.3291},{"match_name":"NCPS USPSA Handgun Match June 24 2018","match_date":"2018-06-24","stage_classifiercode":"99-11","member_number":"A88344","first_name":"CHRISTIAN","last_name":"ESPIRITU","classification":"U","division":"PCC","hit_factor":6.3274},{"match_name":"HPSP Heartland Practical Shooters June USPSA Shoot","match_date":"2018-06-24","stage_classifiercode":"99-11","member_number":"A109388","first_name":"TYSON","last_name":"SEKUTERA","classification":"Unclassified","division":"PCC","hit_factor":6.326},{"match_name":"Hopkinton June  2016","match_date":"2016-06-04","stage_classifiercode":"99-11","member_number":"A70318","first_name":"JOE","last_name":"DEMAGGIO","classification":"C","division":"PCC","hit_factor":6.325},{"match_name":"OFGC Practical Pistol Match 01-19-2020","match_date":"2020-01-19","stage_classifiercode":"99-11","member_number":"TY89055","first_name":"JERRY","last_name":"RICHARDS","classification":"C","division":"PCC","hit_factor":6.3241},{"match_name":"EAPS July 2017 USPSA","match_date":"2017-07-16","stage_classifiercode":"99-11","member_number":"A92067","first_name":"DON","last_name":"ALBARES","classification":"U","division":"PCC","hit_factor":6.3241},{"match_name":"SLPSA July USPSA match","match_date":"2018-07-21","stage_classifiercode":"99-11","member_number":"A109324","first_name":"ERYN","last_name":"WILKINS","classification":"U","division":"PCC","hit_factor":6.3232},{"match_name":"HPS March 2020 Club Fun Match","match_date":"2020-03-07","stage_classifiercode":"99-11","member_number":"NA","first_name":"TRAVIS","last_name":"DUNCAN","classification":"X","division":"PCC","hit_factor":6.3211},{"match_name":"ORPCI 2017 June USPSA Classifer Match","match_date":"2017-06-25","stage_classifiercode":"99-11","member_number":"TY67575","first_name":"JIM","last_name":"PETER","classification":"U","division":"PCC","hit_factor":6.3187},{"match_name":"Wvpps Nov. 2016","match_date":"2016-11-20","stage_classifiercode":"99-11","member_number":"TY17278","first_name":"STEVEN","last_name":"WRIGHT","classification":"U","division":"PCC","hit_factor":6.3183},{"match_name":"TCGC September 2020","match_date":"2020-09-24","stage_classifiercode":"99-11","member_number":"L1697","first_name":"DENNY","last_name":"SHADEL","classification":"C","division":"PCC","hit_factor":6.2864},{"match_name":"WSRC USPSA","match_date":"2016-10-22","stage_classifiercode":"99-11","member_number":"Ty56049","first_name":"KENT","last_name":"CHRISTEN","classification":"U","division":"PCC","hit_factor":6.2851},{"match_name":"Brazosland Pistoleros USPSA - Sunday August 8th","match_date":"2021-08-08","stage_classifiercode":"99-11","member_number":"FY2227","first_name":"TOMMY","last_name":"TEAS","classification":"U","division":"PCC","hit_factor":6.2842},{"match_name":"NW01 Paul Bunyan CS Series May 9 2021","match_date":"2021-05-09","stage_classifiercode":"99-11","member_number":"ty92214","first_name":"STEVE","last_name":"PARKISON","classification":"B","division":"PCC","hit_factor":6.2839},{"match_name":"USPSA MO21 2Alpha SBRC March 2018","match_date":"2018-03-24","stage_classifiercode":"99-11","member_number":"L1536","first_name":"CRAIG","last_name":"NORDGREN","classification":"C","division":"PCC","hit_factor":6.2827},{"match_name":"WGC April 2017 USPSA","match_date":"2017-04-23","stage_classifiercode":"99-11","member_number":"TY48703","first_name":"TERRY","last_name":"JOHNSON","classification":"U","division":"PCC","hit_factor":6.2771},{"match_name":"SKSC USPSA April 2018 Match","match_date":"2018-04-21","stage_classifiercode":"99-11","member_number":"fy-14034","first_name":"MARK","last_name":"KATT","classification":"C","division":"PCC","hit_factor":6.271},{"match_name":"MVPSA USPSA 9-15-18","match_date":"2018-09-15","stage_classifiercode":"99-11","member_number":"A84593","first_name":"JESSE","last_name":"POSELEY","classification":"U","division":"PCC","hit_factor":6.2682},{"match_name":"Hose Monster Action ","match_date":"2020-07-19","stage_classifiercode":"99-11","member_number":"Ty86621","first_name":"RICK","last_name":"SERVANDO","classification":"U","division":"PCC","hit_factor":6.2678},{"match_name":"SAGC CTX04 Monthly USPSA Match - September 2020","match_date":"2020-09-27","stage_classifiercode":"99-11","member_number":"A117202","first_name":"STACEY","last_name":"CALDER","classification":"C","division":"PCC","hit_factor":6.2663},{"match_name":"WNPL USPSA - Nov 2017","match_date":"2017-11-05","stage_classifiercode":"99-11","member_number":"A17426","first_name":"PAUL","last_name":"TESSIER","classification":"C","division":"PCC","hit_factor":6.2657},{"match_name":"CCPL May  Day Match","match_date":"2021-05-23","stage_classifiercode":"99-11","member_number":"TY94497","first_name":"RENE","last_name":"FORBES-PFITZER","classification":"C","division":"PCC","hit_factor":6.263},{"match_name":"West Coast IPSC","match_date":"2018-07-22","stage_classifiercode":"99-11","member_number":"\"\"","first_name":"HENDRIX","last_name":"DE LEON","classification":"A","division":"PCC","hit_factor":6.2606},{"match_name":"USPSA MO21 2Alpha SBRC June 2017","match_date":"2017-06-17","stage_classifiercode":"99-11","member_number":"\"\"","first_name":"WALT","last_name":"COLTRIN","classification":"U","division":"PCC","hit_factor":6.2575},{"match_name":"NCPS USPSA Handgun Match June 24 2018","match_date":"2018-06-24","stage_classifiercode":"99-11","member_number":"A81430","first_name":"PAUL","last_name":"VALMORES","classification":"C","division":"PCC","hit_factor":6.2575},{"match_name":"WSRC USPSA 11/19/2017","match_date":"2017-11-19","stage_classifiercode":"99-11","member_number":"A98672","first_name":"KRIS","last_name":"DICKSON","classification":"U","division":"PCC","hit_factor":6.25},{"match_name":"ECPS USPSA 19 May 18","match_date":"2018-05-19","stage_classifiercode":"99-11","member_number":"A102822","first_name":"JERAD","last_name":"MULLINNIX","classification":"U","division":"PCC","hit_factor":6.2433},{"match_name":"Veterans 3 Gun PM Classifier Benefit Match","match_date":"2020-02-22","stage_classifiercode":"99-11","member_number":"TY106753","first_name":"JC","last_name":"SCHUMACHER","classification":"U","division":"PCC","hit_factor":6.243},{"match_name":"GRPC USPSA TAX REFUND ","match_date":"2018-04-15","stage_classifiercode":"99-11","member_number":"\"\"","first_name":"AMANDA","last_name":"MORRIS","classification":"C","division":"PCC","hit_factor":6.2422},{"match_name":"PRG 2017 Classifier Match","match_date":"2017-02-19","stage_classifiercode":"99-11","member_number":"A100335","first_name":"SANTIAGO","last_name":"LABOS","classification":"U","division":"PCC","hit_factor":6.2338},{"match_name":"2017 Bay bridge Charity Classic - Richmond October 14-15-2017","match_date":"2017-10-14","stage_classifiercode":"99-11","member_number":"TY69128","first_name":"TONY","last_name":"YEH","classification":"U","division":"PCC","hit_factor":6.2338},{"match_name":"Competitive Shooters of Lake Norman CORNELIUS Thursday Evening Indoor USPSA Pistol Match North Carolina","match_date":"2020-09-17","stage_classifiercode":"99-11","member_number":"TY106507","first_name":"KEITH","last_name":"NAGELSKI","classification":"B","division":"PCC","hit_factor":6.2235},{"match_name":"EWPSA 2018-10","match_date":"2018-10-20","stage_classifiercode":"99-11","member_number":"TY70904","first_name":"MICHAEL","last_name":"GIMERA","classification":"B","division":"PCC","hit_factor":6.2189},{"match_name":"FSA USPSA 01-26-20","match_date":"2020-01-27","stage_classifiercode":"99-11","member_number":"A99053","first_name":"DAVID","last_name":"GOFF","classification":"C","division":"PCC","hit_factor":6.2153},{"match_name":"SSS Pistol Match March 2017","match_date":"2017-03-12","stage_classifiercode":"99-11","member_number":"\"\"","first_name":"KENNETH","last_name":"CASH","classification":"U (Unclassified)","division":"PCC","hit_factor":6.2112},{"match_name":"MPSA 021817","match_date":"2017-02-18","stage_classifiercode":"99-11","member_number":"A79649","first_name":"JOHNNY","last_name":"TURNER","classification":"B","division":"PCC","hit_factor":6.2069},{"match_name":"ORPCI 2018.03.31 USPSA Special","match_date":"2018-03-31","stage_classifiercode":"99-11","member_number":"FY80376","first_name":"DAN","last_name":"RAINBOLT","classification":"D","division":"PCC","hit_factor":6.2053},{"match_name":"Custer USPSA Mar 7th 2021","match_date":"2021-03-07","stage_classifiercode":"99-11","member_number":"L4924","first_name":"KEVIN","last_name":"ROBERTS","classification":"B","division":"PCC","hit_factor":6.2032},{"match_name":"PRG 2017 Classifier Match","match_date":"2017-02-19","stage_classifiercode":"99-11","member_number":"L4112","first_name":"JAY","last_name":"HU","classification":"U","division":"PCC","hit_factor":6.2016},{"match_name":"Bayou City USPSA Weekly June 4","match_date":"2020-06-04","stage_classifiercode":"99-11","member_number":"TY87973","first_name":"WALDO","last_name":"SAMANO","classification":"U","division":"PCC","hit_factor":6.1979},{"match_name":"Castlewood USPSA Sept 2020 shoot","match_date":"2020-09-26","stage_classifiercode":"99-11","member_number":"CA240","first_name":"DAN","last_name":"SMITH","classification":"U","division":"PCC","hit_factor":6.1947},{"match_name":"Deadwood Boys USPSA All Classifier Match","match_date":"2016-08-07","stage_classifiercode":"99-11","member_number":"TY22721","first_name":"WAYDE","last_name":"SHIMODA","classification":"U","division":"PCC","hit_factor":6.1947},{"match_name":"SFPC June 7 2020 AM     USPSA Monthly Match","match_date":"2020-06-07","stage_classifiercode":"99-11","member_number":"A106034","first_name":"CHARLE","last_name":"DE MICHELE","classification":"B","division":"PCC","hit_factor":6.192},{"match_name":"Hammer Down USPSA Tue Night","match_date":"2017-11-07","stage_classifiercode":"99-11","member_number":"A96581","first_name":"JOE","last_name":"CARUSO","classification":"M","division":"PCC","hit_factor":6.1873},{"match_name":"June 2018 CAS USPSA","match_date":"2018-06-03","stage_classifiercode":"99-11","member_number":"TY23125","first_name":"GARY","last_name":"THIBODAUX","classification":"A","division":"PCC","hit_factor":6.1856},{"match_name":"CRCPS 2021-08-14","match_date":"2021-08-14","stage_classifiercode":"99-11","member_number":"TY81342","first_name":"JIM","last_name":"WAUGH","classification":"C","division":"PCC","hit_factor":6.1856},{"match_name":"Rio Salado UPPL September 2020","match_date":"2020-09-13","stage_classifiercode":"99-11","member_number":"A120402","first_name":"JOHN","last_name":"COCHRAN","classification":"C","division":"PCC","hit_factor":6.1792},{"match_name":"Extreme GM PCC only ","match_date":"2020-07-12","stage_classifiercode":"99-11","member_number":"A101475","first_name":"LEE","last_name":"COLLINS","classification":"D","division":"PCC","hit_factor":6.1785},{"match_name":"TPS USPSA -  August Classifier Match 2020","match_date":"2020-08-01","stage_classifiercode":"99-11","member_number":"A128492","first_name":"MIKE","last_name":"MARTIN","classification":"U","division":"PCC","hit_factor":6.1776},{"match_name":"MCRC USPSA August 2018","match_date":"2018-08-11","stage_classifiercode":"99-11","member_number":"A90693","first_name":"MIKE","last_name":"WILKERSON","classification":"U","division":"PCC","hit_factor":6.1758},{"match_name":"CFRPC December USPSA (Classifier)","match_date":"2018-12-16","stage_classifiercode":"99-11","member_number":"TY98638","first_name":"WENDY","last_name":"ENGLE WINE","classification":"C","division":"PCC","hit_factor":6.1611},{"match_name":"USPSA MO21 2Alpha SBRC March 2018","match_date":"2018-03-24","stage_classifiercode":"99-11","member_number":"A96267","first_name":"MYLEE RYAN","last_name":"CHAMBERLAIN","classification":"C","division":"PCC","hit_factor":6.1574},{"match_name":"MPPL 08052018 Summer Fun","match_date":"2018-08-05","stage_classifiercode":"99-11","member_number":"TY49133","first_name":"AARON","last_name":"URASAKI","classification":"U","division":"PCC","hit_factor":6.1538},{"match_name":"NW01 April da Turd","match_date":"2018-04-04","stage_classifiercode":"99-11","member_number":"A96809","first_name":"JUSTIN","last_name":"HILL","classification":"U","division":"PCC","hit_factor":6.1538},{"match_name":"WSPS JUNE 2018 USPSA MATCH","match_date":"2018-06-16","stage_classifiercode":"99-11","member_number":"\"\"","first_name":"THOMAS","last_name":"COOK","classification":"U","division":"PCC","hit_factor":6.1433},{"match_name":"APSC 4th Annual Holiday Hosefest USPSA Match 12-02-17","match_date":"2017-12-02","stage_classifiercode":"99-11","member_number":"100519","first_name":"ERIC","last_name":"DEWBERRY","classification":"U","division":"PCC","hit_factor":6.1415},{"match_name":"EAPS July 2017 USPSA","match_date":"2017-07-16","stage_classifiercode":"99-11","member_number":"A99640","first_name":"TREY","last_name":"NICHOLSON","classification":"C","division":"PCC","hit_factor":6.1404},{"match_name":"BRSP Tuesday Night USPSA Match - Oct 31","match_date":"2017-11-01","stage_classifiercode":"99-11","member_number":"A96203","first_name":"GENE","last_name":"VANNI","classification":"\"\"","division":"PCC","hit_factor":6.1404},{"match_name":"CBS USPSA Mar  2018","match_date":"2018-03-21","stage_classifiercode":"99-11","member_number":"A98137","first_name":"PHIL","last_name":"UNDERWOOD","classification":"D","division":"PCC","hit_factor":6.1393},{"match_name":"June 2018 CAS USPSA","match_date":"2018-06-03","stage_classifiercode":"99-11","member_number":"A102093","first_name":"CHIP","last_name":"NOEL","classification":"C","division":"PCC","hit_factor":6.1336},{"match_name":"KSA USPSA March 2017","match_date":"2017-03-04","stage_classifiercode":"99-11","member_number":"TY80612","first_name":"FORREST","last_name":"LYSINGER","classification":"B","division":"PCC","hit_factor":6.1275},{"match_name":"PCPS Classifier and Slot Match Jan 2020","match_date":"2020-01-12","stage_classifiercode":"99-11","member_number":"A125130","first_name":"BRAD","last_name":"BODE","classification":"U","division":"PCC","hit_factor":6.1275},{"match_name":"CJR&PC USPSA  June 10","match_date":"2018-06-10","stage_classifiercode":"99-11","member_number":"A96872","first_name":"JEFFREY","last_name":"KORNBLATT","classification":"\"\"","division":"PCC","hit_factor":6.1252},{"match_name":"ARPC USPSA Match 5-27-18","match_date":"2018-05-27","stage_classifiercode":"99-11","member_number":"TY89183","first_name":"STEVE","last_name":"CASH","classification":"B","division":"PCC","hit_factor":6.1202},{"match_name":"CGC 03-10-2018","match_date":"2018-03-10","stage_classifiercode":"99-11","member_number":"\"\"","first_name":"GRANT","last_name":"SCOTT","classification":"X","division":"PCC","hit_factor":6.1202},{"match_name":"Strategic Edge July 2018 USPSA","match_date":"2018-07-21","stage_classifiercode":"99-11","member_number":"A106644","first_name":"MAT","last_name":"PITMAN","classification":"U","division":"PCC","hit_factor":6.1181},{"match_name":"HSC USPSA October 7th 2017","match_date":"2017-10-06","stage_classifiercode":"99-11","member_number":"ty81368","first_name":"JEFFREY","last_name":"KILLINGER","classification":"U","division":"PCC","hit_factor":6.1176},{"match_name":"OREGON ARPC CC05 USPSA AUGUST 12 2017","match_date":"2017-08-12","stage_classifiercode":"99-11","member_number":"ty47743","first_name":"NORMAN","last_name":"BRIGHT","classification":"M","division":"PCC","hit_factor":6.1151},{"match_name":"Grandbaggers August 2017","match_date":"2017-08-03","stage_classifiercode":"99-11","member_number":"L1849","first_name":"PAUL","last_name":"THOMPSON","classification":"A","division":"PCC","hit_factor":6.1089},{"match_name":"WVRPC USPSA 1SEPT2018","match_date":"2018-09-01","stage_classifiercode":"99-11","member_number":"\"\"","first_name":"MARCELL","last_name":"WATSON","classification":"X - Not USPSA Member","division":"PCC","hit_factor":6.105},{"match_name":"The Hollow 20 Aug 2018","match_date":"2018-08-20","stage_classifiercode":"99-11","member_number":"\"\"","first_name":"ROD","last_name":"LEAR","classification":"U","division":"PCC","hit_factor":6.1038},{"match_name":"CVSC 07-29-2018","match_date":"2018-07-29","stage_classifiercode":"99-11","member_number":"A96473","first_name":"ADAM","last_name":"MUTHWILL","classification":"A","division":"PCC","hit_factor":6.1024},{"match_name":"2020-03 Bone Creek USPSA","match_date":"2020-03-01","stage_classifiercode":"99-11","member_number":"A109656","first_name":"JOE","last_name":"MISTEK","classification":"U","division":"PCC","hit_factor":6.1002},{"match_name":"West Coast IPSC","match_date":"2018-07-22","stage_classifiercode":"99-11","member_number":"A2581","first_name":"ROSS","last_name":"DEANE","classification":"M","division":"PCC","hit_factor":6.0976},{"match_name":"Cameo USPSA Match February 20 2021","match_date":"2021-02-20","stage_classifiercode":"99-11","member_number":"A106234","first_name":"FRANK","last_name":"GODEL","classification":"B","division":"PCC","hit_factor":6.0961},{"match_name":"Cactus USPSA ALL CLASSIFIER August 2020","match_date":"2020-08-02","stage_classifiercode":"99-11","member_number":"A120402","first_name":"JOHN","last_name":"COCHRAN","classification":"U","division":"PCC","hit_factor":6.0961},{"match_name":"SMPSA 2018-01 Pistol","match_date":"2018-01-14","stage_classifiercode":"99-11","member_number":"FY81419","first_name":"JOHN","last_name":"NGUYEN","classification":"U","division":"PCC","hit_factor":6.0942},{"match_name":"Richmond Hot Shots April 14-15-2018 USPSA Pistol Match","match_date":"2018-04-14","stage_classifiercode":"99-11","member_number":"A93937","first_name":"DAVID","last_name":"DEAMICIS","classification":"U","division":"PCC","hit_factor":6.0936},{"match_name":"NCPS USPSA Handgun Match June 24 2018","match_date":"2018-06-24","stage_classifiercode":"99-11","member_number":"L4377","first_name":"JIM","last_name":"DUNLAP","classification":"B","division":"PCC","hit_factor":6.0936},{"match_name":"CGC 03-10-2018","match_date":"2018-03-10","stage_classifiercode":"99-11","member_number":"TY89180","first_name":"CHARLES","last_name":"HOLLANDS","classification":"D","division":"PCC","hit_factor":6.0914},{"match_name":"ACPSA November 2018","match_date":"2018-11-24","stage_classifiercode":"99-11","member_number":"TY73281","first_name":"JACK","last_name":"DARTIGALONGUE","classification":"B","division":"PCC","hit_factor":6.0907},{"match_name":"Square Deal Sportsmen September USPSA match","match_date":"2018-09-02","stage_classifiercode":"99-11","member_number":"A11613","first_name":"GERRY","last_name":"SEAMANS","classification":"U","division":"PCC","hit_factor":6.0901},{"match_name":"Springfield Tactical Shooters 04/05/2018","match_date":"2018-04-05","stage_classifiercode":"99-11","member_number":"A107625","first_name":"CHUCK","last_name":"MCLAUGHLIN","classification":"\"\"","division":"PCC","hit_factor":6.089},{"match_name":"Shot Through The Heart Classifiers","match_date":"2018-02-04","stage_classifiercode":"99-11","member_number":"A103075","first_name":"PATRICK","last_name":"ENRIGHT","classification":"U","division":"PCC","hit_factor":6.089},{"match_name":"LCHG September 2018 USPSA Special Classifier","match_date":"2018-09-08","stage_classifiercode":"99-11","member_number":"A29621","first_name":"KEVIN","last_name":"COTTRILL","classification":"U","division":"PCC","hit_factor":6.0762},{"match_name":"Applied IN25 USPSA April Classifier 2018","match_date":"2018-04-17","stage_classifiercode":"99-11","member_number":"TY90274","first_name":"MICHAEL","last_name":"CONROY","classification":"B","division":"PCC","hit_factor":6.0742},{"match_name":"WGC April 2017 USPSA","match_date":"2017-04-23","stage_classifiercode":"99-11","member_number":"FY68889","first_name":"CHARLES","last_name":"MORGAN","classification":"U","division":"PCC","hit_factor":6.0738},{"match_name":"Richmond Hot Shots October 6-7 USPSA Pistol Match","match_date":"2018-10-06","stage_classifiercode":"99-11","member_number":"L3301","first_name":"KEITH","last_name":"MIYASAKI","classification":"B","division":"PCC","hit_factor":6.0677},{"match_name":"USPSA-Alberta 2018-01 Indoor Classifier 1","match_date":"2018-02-26","stage_classifiercode":"99-11","member_number":"F88800","first_name":"GORD","last_name":"NOLAN","classification":"U","division":"PCC","hit_factor":6.0674},{"match_name":"Applied IN25 USPSA January 17th 2018","match_date":"2018-01-17","stage_classifiercode":"99-11","member_number":"L4004","first_name":"AARON","last_name":"LORTON","classification":"M","division":"PCC","hit_factor":6.0662},{"match_name":"USPSA BGSL Jan 4th Weekend ","match_date":"2020-01-25","stage_classifiercode":"99-11","member_number":"A104827","first_name":"MIKE","last_name":"ARNOLD","classification":"U","division":"PCC","hit_factor":6.0606},{"match_name":"Griffin USPSA Match Jan 21 2017","match_date":"2017-01-21","stage_classifiercode":"99-11","member_number":"a95386","first_name":"GRAHAM","last_name":"PAGE","classification":"U","division":"PCC","hit_factor":6.0606},{"match_name":"G2G Practical Shooters 10-16-2018","match_date":"2018-10-16","stage_classifiercode":"99-11","member_number":"A42337","first_name":"MIKE","last_name":"MANSILLA","classification":"A","division":"PCC","hit_factor":6.0606},{"match_name":"AAPS AAFG Level 1 Match - May 5 2018","match_date":"2018-05-05","stage_classifiercode":"99-11","member_number":"PENDING","first_name":"STEVE","last_name":"WADDELL","classification":"U","division":"PCC","hit_factor":6.0538},{"match_name":"OREGON ARPC CC05 USPSA AUGUST 12 2017","match_date":"2017-08-12","stage_classifiercode":"99-11","member_number":"TY-77086","first_name":"AARON","last_name":"GEISLER","classification":"U","division":"PCC","hit_factor":6.0538},{"match_name":"OREGON ARPC CC05 USPSA AUGUST 12 2017","match_date":"2017-08-12","stage_classifiercode":"99-11","member_number":"L2957","first_name":"BRIAN","last_name":"BERKLEY","classification":"U","division":"PCC","hit_factor":6.0533},{"match_name":"LIPSA  December 11th 2016 - USPSA Match","match_date":"2016-12-11","stage_classifiercode":"99-11","member_number":"L3851","first_name":"JEFF","last_name":"PAULSEN","classification":"U","division":"PCC","hit_factor":6.047},{"match_name":"USPSA MO21 2Alpha SBRC October 2017","match_date":"2017-10-21","stage_classifiercode":"99-11","member_number":"TY94217","first_name":"DUSTIN","last_name":"CHAMBERLAIN","classification":"B","division":"PCC","hit_factor":6.0377},{"match_name":"Clinton County USPSA July 23 2016","match_date":"2016-07-23","stage_classifiercode":"99-11","member_number":"PEN","first_name":"COLE","last_name":"TAYLOR","classification":"U","division":"PCC","hit_factor":6.0354},{"match_name":"PRG 2017 Classifier Match","match_date":"2017-02-19","stage_classifiercode":"99-11","member_number":"A99955","first_name":"RAY","last_name":"PALACIO","classification":"U","division":"PCC","hit_factor":6.0345},{"match_name":"Deadwood Boys USPSA All Classifier Match - 29 July 2018","match_date":"2018-07-29","stage_classifiercode":"99-11","member_number":"TY95244","first_name":"ALEX","last_name":"KO","classification":"U","division":"PCC","hit_factor":6.0335},{"match_name":"LIPSA  December 11th 2016 - USPSA Match","match_date":"2016-12-11","stage_classifiercode":"99-11","member_number":"A94344","first_name":"FRANK","last_name":"HORAN","classification":"U","division":"PCC","hit_factor":6.0325},{"match_name":"Coastal Area Practical Shooters 7-22-17 Special Classifier","match_date":"2017-07-22","stage_classifiercode":"99-11","member_number":"TY83837","first_name":"BOB","last_name":"GUNDEL","classification":"C","division":"PCC","hit_factor":6.0302},{"match_name":"Holmen USPSA 10/30/16","match_date":"2016-10-30","stage_classifiercode":"99-11","member_number":"A90179","first_name":"MICHAEL","last_name":"HALL","classification":"U","division":"PCC","hit_factor":6.0288},{"match_name":"USPSA MO21 2Alpha SBRC Classifier 2016","match_date":"2016-11-26","stage_classifiercode":"99-11","member_number":"TY72757","first_name":"MARK","last_name":"CRABTREE","classification":"U","division":"PCC","hit_factor":6.028},{"match_name":"March 2018 USPSA Classifier Special","match_date":"2018-03-17","stage_classifiercode":"99-11","member_number":"F98084","first_name":"LARRY","last_name":"CARL","classification":"\"\"","division":"PCC","hit_factor":6.0268},{"match_name":"HPSP Heartland Practical Shooters June USPSA Shoot","match_date":"2018-06-24","stage_classifiercode":"99-11","member_number":"TY84939","first_name":"WAYLAN","last_name":"MORAN","classification":"B","division":"PCC","hit_factor":6.0215},{"match_name":"WGC August 2018 USPSA Classifier","match_date":"2018-08-12","stage_classifiercode":"99-11","member_number":"TY70973","first_name":"KATHY","last_name":"DYCUS","classification":"C","division":"PCC","hit_factor":6.0185},{"match_name":"TCGC Polo July 2017","match_date":"2017-07-23","stage_classifiercode":"99-11","member_number":"A73683","first_name":"BRYAN","last_name":"TECSON","classification":"B","division":"PCC","hit_factor":6.0163},{"match_name":"PCSI - September 2017 USPSA","match_date":"2017-09-02","stage_classifiercode":"99-11","member_number":"A101393","first_name":"BRANDON","last_name":"PELLETIER","classification":"U","division":"PCC","hit_factor":6.015},{"match_name":"Richmond Hot Shots October 6-7 USPSA Pistol Match","match_date":"2018-10-06","stage_classifiercode":"99-11","member_number":"A46690","first_name":"GILBERT","last_name":"GESMUNDO","classification":"U","division":"PCC","hit_factor":6.0086},{"match_name":"GWPP August 2018 Pistol","match_date":"2018-08-11","stage_classifiercode":"99-11","member_number":"TY16696","first_name":"SCOTT","last_name":"MILLER","classification":"U","division":"PCC","hit_factor":5.9957},{"match_name":"TPS USPSA at CMP March 18 2017","match_date":"2017-03-18","stage_classifiercode":"99-11","member_number":"TY57617","first_name":"ERIC","last_name":"DAVIS","classification":"B","division":"PCC","hit_factor":5.9957},{"match_name":"Bayou City USPSA Weekly Dec 17","match_date":"2020-12-18","stage_classifiercode":"99-11","member_number":"TY83291","first_name":"RONALD","last_name":"GILLORY JR","classification":"C","division":"PCC","hit_factor":5.9957},{"match_name":"ACPSA November 2018","match_date":"2018-11-24","stage_classifiercode":"99-11","member_number":"A69229","first_name":"CHARLIE","last_name":"NELSON","classification":"C","division":"PCC","hit_factor":5.9893},{"match_name":"Rio Salado Hosemasters February 2021","match_date":"2021-02-27","stage_classifiercode":"99-11","member_number":"A47027","first_name":"JACK","last_name":"JOHNSTON","classification":"C","division":"PCC","hit_factor":5.9839},{"match_name":"Pitcairn-Monroeville Sportsmens Club USPSA August 2017","match_date":"2017-08-05","stage_classifiercode":"99-11","member_number":"a93386","first_name":"RYAN","last_name":"SHEWCHUK","classification":"U","division":"PCC","hit_factor":5.9839},{"match_name":"Hallstead July 18th PCC","match_date":"2020-07-18","stage_classifiercode":"99-11","member_number":"A116509","first_name":"JACK","last_name":"REVIE","classification":"\"\"","division":"PCC","hit_factor":5.9794},{"match_name":"WNPL USPSA - Nov 2017","match_date":"2017-11-05","stage_classifiercode":"99-11","member_number":"A29487","first_name":"BILL","last_name":"BOWERS","classification":"U","division":"PCC","hit_factor":5.9732},{"match_name":"Palmetto Gun Club - April 2017 USPSA","match_date":"2017-04-08","stage_classifiercode":"99-11","member_number":"A64374","first_name":"MICHAEL","last_name":"CUTLER","classification":"U","division":"PCC","hit_factor":5.9732},{"match_name":"NAAS 03-05-2016","match_date":"2017-03-05","stage_classifiercode":"99-11","member_number":"A81982","first_name":"MICAH","last_name":"WAITS","classification":"M","division":"PCC","hit_factor":5.9701},{"match_name":"LGCSEMPS April 2018 Special Classifier","match_date":"2018-04-08","stage_classifiercode":"99-11","member_number":"A108645","first_name":"JOEL","last_name":"SWEEZEA","classification":"U","division":"PCC","hit_factor":5.9583},{"match_name":"November 2016 PCSI USPSA Monster Match","match_date":"2016-11-05","stage_classifiercode":"99-11","member_number":"A34758","first_name":"RON","last_name":"IDEN","classification":"U","division":"PCC","hit_factor":5.9524},{"match_name":"The Hollow 20 Aug 2018","match_date":"2018-08-20","stage_classifiercode":"99-11","member_number":"\"\"","first_name":"MIKE","last_name":"HARVEY","classification":"U","division":"PCC","hit_factor":5.9511},{"match_name":"ORSA USPSA October 2017","match_date":"2017-10-21","stage_classifiercode":"99-11","member_number":"PEN","first_name":"NICK","last_name":"ALLEN","classification":"U","division":"PCC","hit_factor":5.9497},{"match_name":"AIPS  USPSA Monthly CrossRoads Match 16 November 2016","match_date":"2016-11-16","stage_classifiercode":"99-11","member_number":"A23819","first_name":"MIKE","last_name":"CARMONEY","classification":"A","division":"PCC","hit_factor":5.948},{"match_name":"HPSP Heartland Practical Shooters June USPSA Shoot","match_date":"2018-06-24","stage_classifiercode":"99-11","member_number":"A98894","first_name":"THOMAS","last_name":"CROSS","classification":"C","division":"PCC","hit_factor":5.9432},{"match_name":"SMPSA 2018-01 Pistol","match_date":"2018-01-14","stage_classifiercode":"99-11","member_number":"A92067","first_name":"DON","last_name":"ALBARES","classification":"B","division":"PCC","hit_factor":5.9355},{"match_name":"LGCSEMPS April 2018 Special Classifier","match_date":"2018-04-08","stage_classifiercode":"99-11","member_number":"A80457","first_name":"JOE","last_name":"WEBER","classification":"C","division":"PCC","hit_factor":5.9341},{"match_name":"Clinton County USPSA July 23 2016","match_date":"2016-07-23","stage_classifiercode":"99-11","member_number":"L3777","first_name":"CESAR","last_name":"HO","classification":"U","division":"PCC","hit_factor":5.9333},{"match_name":"ARPC USPSA Match 3-26-17","match_date":"2017-03-26","stage_classifiercode":"99-11","member_number":"A67988","first_name":"BILL","last_name":"LEMEN","classification":"Unclassified","division":"PCC","hit_factor":5.9322},{"match_name":"SFPC Oct 3 2021   USPSA Monthly Match","match_date":"2021-10-03","stage_classifiercode":"99-11","member_number":"TY86206","first_name":"EVAN","last_name":"KRAUS","classification":"C","division":"PCC","hit_factor":5.9305},{"match_name":"Bgs Hudson Week 6","match_date":"2017-02-19","stage_classifiercode":"99-11","member_number":"\"\"","first_name":"JEFF","last_name":"BIHNER","classification":"U","division":"PCC","hit_factor":5.9276},{"match_name":"AGC_20170903","match_date":"2017-09-03","stage_classifiercode":"99-11","member_number":"A96539","first_name":"BECKY","last_name":"MUELLER","classification":"C","division":"PCC","hit_factor":5.9259},{"match_name":"2017 Bay bridge Charity Classic - Richmond October 14-15-2017","match_date":"2017-10-14","stage_classifiercode":"99-11","member_number":"FY36880","first_name":"SUZANNE","last_name":"CHEN","classification":"C","division":"PCC","hit_factor":5.9226},{"match_name":"Richmond Hot Shots October 6-7 USPSA Pistol Match","match_date":"2018-10-06","stage_classifiercode":"99-11","member_number":"Ty68229","first_name":"JC","last_name":"SMITH","classification":"B","division":"PCC","hit_factor":5.9211},{"match_name":"Richmond Hot Shots April 14-15-2018 USPSA Pistol Match","match_date":"2018-04-14","stage_classifiercode":"99-11","member_number":"A60621","first_name":"JUN","last_name":"AMPIL","classification":"U","division":"PCC","hit_factor":5.9186},{"match_name":"Brazosland Pistoleros USPSA - Sunday January 19th","match_date":"2020-01-19","stage_classifiercode":"99-11","member_number":"A102903","first_name":"EDWIN","last_name":"BUCHWALTER","classification":"U","division":"PCC","hit_factor":5.9158},{"match_name":"Veterans 3 Gun PM Classifier Benefit Match","match_date":"2020-02-22","stage_classifiercode":"99-11","member_number":"TY95469","first_name":"MARK","last_name":"PRICKETT","classification":"U","division":"PCC","hit_factor":5.9024},{"match_name":"Bayou City USPSA Weekly June 4","match_date":"2020-06-04","stage_classifiercode":"99-11","member_number":"TY83291","first_name":"RONALD","last_name":"GILLORYJR","classification":"C","division":"PCC","hit_factor":5.9016},{"match_name":"CFRPC December USPSA (Classifier)","match_date":"2018-12-16","stage_classifiercode":"99-11","member_number":"\"\"","first_name":"EDUARDO","last_name":"IRIZARRY","classification":"U","division":"PCC","hit_factor":5.9006},{"match_name":"Brazosland Pistoleros August 20 2017","match_date":"2017-08-20","stage_classifiercode":"99-11","member_number":"\"\"","first_name":"MICHAEL","last_name":"KELLETT","classification":"C","division":"PCC","hit_factor":5.8968},{"match_name":"PRG 2017 Classifier Match","match_date":"2017-02-19","stage_classifiercode":"99-11","member_number":"L2080","first_name":"ERIC","last_name":"GANAC","classification":"U","division":"PCC","hit_factor":5.8962},{"match_name":"TGC USPSA JANUARY 2018","match_date":"2018-01-20","stage_classifiercode":"99-11","member_number":"a44650","first_name":"DARRELL","last_name":"DAUDE","classification":"U","division":"PCC","hit_factor":5.8947},{"match_name":"CFRPC USPSA 2020-09-13","match_date":"2020-09-13","stage_classifiercode":"99-11","member_number":"A47568","first_name":"JOHN","last_name":"BATTISTA","classification":"C","division":"PCC","hit_factor":5.8939},{"match_name":"CFRPC USPSA 2020-09-13","match_date":"2020-09-13","stage_classifiercode":"99-11","member_number":"A130100","first_name":"ANTHONY","last_name":"DUCOS","classification":"U","division":"PCC","hit_factor":5.8893},{"match_name":"OREGON ARPC CC05 USPSA AUGUST 12 2017","match_date":"2017-08-12","stage_classifiercode":"99-11","member_number":"A68157","first_name":"DARRELL","last_name":"MONK","classification":"U","division":"PCC","hit_factor":5.8824},{"match_name":"SKSC USPSA April 2018 Match","match_date":"2018-04-21","stage_classifiercode":"99-11","member_number":"TY49380","first_name":"SHANNAN","last_name":"CHADA","classification":"C","division":"PCC","hit_factor":5.8824},{"match_name":"Brazosland Pistoleros USPSA - Sunday August 8th","match_date":"2021-08-08","stage_classifiercode":"99-11","member_number":"A14418","first_name":"RANDY","last_name":"CALLISON","classification":"A","division":"PCC","hit_factor":5.8824},{"match_name":"SWGC USPSA Pistol Match - November 2021","match_date":"2021-11-06","stage_classifiercode":"99-11","member_number":"A79827","first_name":"DAVID","last_name":"LANCASTER","classification":"A","division":"PCC","hit_factor":5.8824},{"match_name":"PCPS Classifier and Slot Match Jan 2020","match_date":"2020-01-12","stage_classifiercode":"99-11","member_number":"FY65849","first_name":"BRUCE","last_name":"ROSENTHAL","classification":"C","division":"PCC","hit_factor":5.8757},{"match_name":"RPS December 2017 USPSA Match","match_date":"2017-12-09","stage_classifiercode":"99-11","member_number":"TY78983","first_name":"CHUCK","last_name":"FOGLE","classification":"B","division":"PCC","hit_factor":5.8741},{"match_name":"MVPSA USPSA 9-15-18","match_date":"2018-09-15","stage_classifiercode":"99-11","member_number":"A61146","first_name":"MARK","last_name":"HOFFMIER","classification":"C","division":"PCC","hit_factor":5.87},{"match_name":"LGCSEMPS April 2018 Special Classifier","match_date":"2018-04-08","stage_classifiercode":"99-11","member_number":"TY53760","first_name":"DAVID","last_name":"LEE","classification":"U","division":"PCC","hit_factor":5.868},{"match_name":"SSS USPSA October 2018","match_date":"2018-10-21","stage_classifiercode":"99-11","member_number":"A50849","first_name":"DERRICK","last_name":"HERNANDEZ","classification":"C (C Class)","division":"PCC","hit_factor":5.8667},{"match_name":"BORCC USPSA August 2017","match_date":"2017-08-27","stage_classifiercode":"99-11","member_number":"L324","first_name":"MIKE","last_name":"BACA","classification":"U","division":"PCC","hit_factor":5.8639},{"match_name":"NWAS Special Classifier Night 11/28/2018","match_date":"2018-11-29","stage_classifiercode":"99-11","member_number":"A101382","first_name":"ANDREW","last_name":"MCDOUGALL","classification":"U","division":"PCC","hit_factor":5.8625},{"match_name":"SCAPSA MN05 Summer League 8","match_date":"2017-08-01","stage_classifiercode":"99-11","member_number":"L2789","first_name":"BILL","last_name":"MCCARTY","classification":"C","division":"PCC","hit_factor":5.8608},{"match_name":"WSRC USPSA","match_date":"2016-10-22","stage_classifiercode":"99-11","member_number":"\"\"","first_name":"KOLLIN","last_name":"STEUBER","classification":"U","division":"PCC","hit_factor":5.8608},{"match_name":"TriggerGuard USPSA","match_date":"2017-05-06","stage_classifiercode":"99-11","member_number":"\"\"","first_name":"JEREMY","last_name":"HARDIN","classification":"U","division":"PCC","hit_factor":5.8594},{"match_name":"TPS USPSA -  August Classifier Match 2020","match_date":"2020-08-01","stage_classifiercode":"99-11","member_number":"A129056","first_name":"JON","last_name":"HENSON","classification":"U","division":"PCC","hit_factor":5.8505},{"match_name":"LPRGC-Lower Providence USPSA May-1 2017","match_date":"2017-05-05","stage_classifiercode":"99-11","member_number":"TY69262","first_name":"AJ","last_name":"STUART","classification":"U","division":"PCC","hit_factor":5.8501},{"match_name":"MCRC USPSA August 2018","match_date":"2018-08-11","stage_classifiercode":"99-11","member_number":"A60939","first_name":"MICHAEL","last_name":"HAYES","classification":"U","division":"PCC","hit_factor":5.8394},{"match_name":"USPSA MO21 2Alpha SBRC December 22 2018","match_date":"2018-12-22","stage_classifiercode":"99-11","member_number":"A84493","first_name":"ARCHIE","last_name":"WALL","classification":"U","division":"PCC","hit_factor":5.8361},{"match_name":"Shadow Hawk Defense USPSA Special Classifier","match_date":"2020-11-14","stage_classifiercode":"99-11","member_number":"L4358","first_name":"RAYMOND","last_name":"DAVIS","classification":"U","division":"PCC","hit_factor":5.835},{"match_name":"BGS Hudson Week 1","match_date":"2017-11-26","stage_classifiercode":"99-11","member_number":"TY57145","first_name":"DARREN","last_name":"CASTER","classification":"U","division":"PCC","hit_factor":5.8291},{"match_name":"HPSP Heartland Practical Shooters June USPSA Shoot","match_date":"2018-06-24","stage_classifiercode":"99-11","member_number":"A109387","first_name":"CURTIS","last_name":"HEUERMANN","classification":"Unclassified","division":"PCC","hit_factor":5.8252},{"match_name":"FSA USPSA 01-26-20","match_date":"2020-01-27","stage_classifiercode":"99-11","member_number":"a97671","first_name":"MIKE","last_name":"EYGENDAAL","classification":"B","division":"PCC","hit_factor":5.8252},{"match_name":"VISSC Ray Will Have a Coke","match_date":"2020-09-27","stage_classifiercode":"99-11","member_number":"L4306","first_name":"EDWARD","last_name":"MACUGAY","classification":"C","division":"PCC","hit_factor":5.8228},{"match_name":"USPSA MO21 2Alpha SBRC October 2017","match_date":"2017-10-21","stage_classifiercode":"99-11","member_number":"A10768","first_name":"JOHN","last_name":"ESLICK","classification":"B","division":"PCC","hit_factor":5.819},{"match_name":"DWB - Deadwood Boys USPSA 20 September 2020  Classifier Match Makeup","match_date":"2020-09-20","stage_classifiercode":"99-11","member_number":"TY120064","first_name":"JEFF","last_name":"SHLAKMAN","classification":"U","division":"PCC","hit_factor":5.8152},{"match_name":"NHRPC - March 2021 USPSA","match_date":"2021-03-14","stage_classifiercode":"99-11","member_number":"TY793","first_name":"GENE","last_name":"SUTTON","classification":"B","division":"PCC","hit_factor":5.814},{"match_name":"Castlewood USPSA Sept 2020 shoot","match_date":"2020-09-26","stage_classifiercode":"99-11","member_number":"A129887","first_name":"JOHNNY","last_name":"WOLFE","classification":"U","division":"PCC","hit_factor":5.8111},{"match_name":"Shadow Hawk Defense USPSA Special Classifier","match_date":"2020-11-14","stage_classifiercode":"99-11","member_number":"L4686","first_name":"RANDY","last_name":"WEEKLEY","classification":"C","division":"PCC","hit_factor":5.8101},{"match_name":"APSC USPSA 10-06-18","match_date":"2018-10-06","stage_classifiercode":"99-11","member_number":"TY76826","first_name":"JAIME","last_name":"KARPINSKI","classification":"C","division":"PCC","hit_factor":5.8065},{"match_name":"MPPL 08052018 Summer Fun","match_date":"2018-08-05","stage_classifiercode":"99-11","member_number":"FY49431","first_name":"APOLONIO","last_name":"DULATRE","classification":"M","division":"PCC","hit_factor":5.8047},{"match_name":"USPSA MO21 2Alpha SBRC March 2018","match_date":"2018-03-24","stage_classifiercode":"99-11","member_number":"A15991","first_name":"DARRELL","last_name":"RADER","classification":"C","division":"PCC","hit_factor":5.8031},{"match_name":"HPSP Heartland Practical Shooters June USPSA Shoot","match_date":"2018-06-24","stage_classifiercode":"99-11","member_number":"A-92144","first_name":"DALTON","last_name":"BODEN","classification":"Unclassified","division":"PCC","hit_factor":5.8005},{"match_name":"Target  Sports Central Indiana Championship","match_date":"2020-08-22","stage_classifiercode":"99-11","member_number":"A122335","first_name":"PAUL","last_name":"SPRANGER","classification":"U","division":"PCC","hit_factor":5.7971},{"match_name":"RPS November 2018 USPSA Match","match_date":"2018-11-10","stage_classifiercode":"99-11","member_number":"A113454","first_name":"ZACH","last_name":"BEALL","classification":"U","division":"PCC","hit_factor":5.7971},{"match_name":"PCSI - September 2017 USPSA","match_date":"2017-09-02","stage_classifiercode":"99-11","member_number":"TY81742","first_name":"BEN","last_name":"WEST 2","classification":"U","division":"PCC","hit_factor":5.7971},{"match_name":"WGC April 2017 USPSA","match_date":"2017-04-23","stage_classifiercode":"99-11","member_number":"A72613","first_name":"DONNIE","last_name":"SMITH","classification":"U","division":"PCC","hit_factor":5.7971},{"match_name":"WELD ECO09 20180916","match_date":"2018-09-16","stage_classifiercode":"99-11","member_number":"A52572","first_name":"DAN","last_name":"TROXEL","classification":"B","division":"PCC","hit_factor":5.7971},{"match_name":"Fairfax PS USPSA September 2017","match_date":"2017-09-19","stage_classifiercode":"99-11","member_number":"A-100356","first_name":"CALEB","last_name":"FITZGERALD","classification":"U","division":"PCC","hit_factor":5.7906},{"match_name":"SKSC USPSA April 2018 Match","match_date":"2018-04-21","stage_classifiercode":"99-11","member_number":"A77486","first_name":"JOHN","last_name":"LOGAN","classification":"B","division":"PCC","hit_factor":5.7901},{"match_name":"Armory Indoor League","match_date":"2017-10-12","stage_classifiercode":"99-11","member_number":"\"\"","first_name":"SETH","last_name":"YOUNG","classification":"U","division":"PCC","hit_factor":5.7859},{"match_name":"GRPC USPSA TAX REFUND ","match_date":"2018-04-15","stage_classifiercode":"99-11","member_number":"TY5063","first_name":"DAVE","last_name":"EICKHOFF","classification":"B","division":"PCC","hit_factor":5.7842},{"match_name":"Custer USPSA Mar 7th 2021","match_date":"2021-03-07","stage_classifiercode":"99-11","member_number":"TY86951","first_name":"EMILIO","last_name":"DOMINGO","classification":"U","division":"PCC","hit_factor":5.7813},{"match_name":"NW01 Paul Bunyan CS Series May 9 2021","match_date":"2021-05-09","stage_classifiercode":"99-11","member_number":"fy22573","first_name":"JAMES","last_name":"DONG","classification":"A","division":"PCC","hit_factor":5.7692},{"match_name":"Deadwood Boys USPSA All Classifier Match - 29 July 2018","match_date":"2018-07-29","stage_classifiercode":"99-11","member_number":"a26171","first_name":"JOEY","last_name":"CASTILO","classification":"U","division":"PCC","hit_factor":5.7692},{"match_name":"GRB JAN USPSA  at Cav","match_date":"2017-01-21","stage_classifiercode":"99-11","member_number":"TY88718","first_name":"GREGORY","last_name":"LENNON","classification":"U","division":"PCC","hit_factor":5.7692},{"match_name":"SCAPSA MN05 Summer League 8","match_date":"2017-08-01","stage_classifiercode":"99-11","member_number":"\"\"","first_name":"TIM","last_name":"UBL","classification":"U","division":"PCC","hit_factor":5.767},{"match_name":"Winter League # 6","match_date":"2018-01-05","stage_classifiercode":"99-11","member_number":"A99904","first_name":"SHANE","last_name":"FREDRICKSON","classification":"U","division":"PCC","hit_factor":5.7631},{"match_name":"Afternoon SMPS 09 February 2020 USPSA Classifier Match","match_date":"2020-02-09","stage_classifiercode":"99-11","member_number":"A83203","first_name":"PAUL","last_name":"HURTT","classification":"D","division":"PCC","hit_factor":5.7631},{"match_name":"Superior Practical Shooters May 2018 Match","match_date":"2018-05-02","stage_classifiercode":"99-11","member_number":"A-92935","first_name":"JOHN","last_name":"JACKSON","classification":"D","division":"PCC","hit_factor":5.7597},{"match_name":"NAAS 2018-01-21 Special Classifier Match","match_date":"2018-01-21","stage_classifiercode":"99-11","member_number":"A67690","first_name":"TED","last_name":"PESTA","classification":"U","division":"PCC","hit_factor":5.7554},{"match_name":"Prescott 1 st Saturday 12-03-2016","match_date":"2016-12-03","stage_classifiercode":"99-11","member_number":"\"\"","first_name":"GEORGE","last_name":"MANDES","classification":"\"\"","division":"PCC","hit_factor":5.7522},{"match_name":"PPPS 11-13-16","match_date":"2016-11-13","stage_classifiercode":"99-11","member_number":"L2598","first_name":"HOSER","last_name":"FREEMAN","classification":"G","division":"PCC","hit_factor":5.7491},{"match_name":"USPSA MO21 2Alpha SBRC March 2018","match_date":"2018-03-24","stage_classifiercode":"99-11","member_number":"L2515","first_name":"JEFF","last_name":"COCKRUM","classification":"A","division":"PCC","hit_factor":5.7485},{"match_name":"USPSA MO21 2Alpha SBRC March 2018","match_date":"2018-03-24","stage_classifiercode":"99-11","member_number":"A6900","first_name":"BILLY","last_name":"MCCOY","classification":"B","division":"PCC","hit_factor":5.7471},{"match_name":"Blackstone Shooting Sports Snow Days January 2017 USPSA Level  1","match_date":"2017-01-08","stage_classifiercode":"99-11","member_number":"A84320","first_name":"MIKE","last_name":"WEGNER","classification":"B","division":"PCC","hit_factor":5.7447},{"match_name":"Fairfax PS USPSA September 2017","match_date":"2017-09-19","stage_classifiercode":"99-11","member_number":"TY83821","first_name":"DEREK","last_name":"EINSIG","classification":"A","division":"PCC","hit_factor":5.7441},{"match_name":"Richmond Hot Shots October 6-7 USPSA Pistol Match","match_date":"2018-10-06","stage_classifiercode":"99-11","member_number":"TY63230","first_name":"MIGUEL","last_name":"JABAGAT","classification":"C","division":"PCC","hit_factor":5.7416},{"match_name":"SKSC USPSA April 2018 Match","match_date":"2018-04-21","stage_classifiercode":"99-11","member_number":"TY 77343","first_name":"JENNIFER","last_name":"WYATT","classification":"C","division":"PCC","hit_factor":5.726},{"match_name":"EWPSA 2018-10","match_date":"2018-10-20","stage_classifiercode":"99-11","member_number":"A54667","first_name":"MIKE","last_name":"GOOD","classification":"C","division":"PCC","hit_factor":5.726},{"match_name":"Bridgeville - USPSA - Dec","match_date":"2020-12-06","stage_classifiercode":"99-11","member_number":"A100280","first_name":"JOE","last_name":"SANTOS","classification":"U","division":"PCC","hit_factor":5.726},{"match_name":"RISE INDOOR CLASSIFIER","match_date":"2018-12-15","stage_classifiercode":"99-11","member_number":"Ty75676","first_name":"DON","last_name":"NOLASCO","classification":"U","division":"PCC","hit_factor":5.7217},{"match_name":"PRG 2017 Classifier Match","match_date":"2017-02-19","stage_classifiercode":"99-11","member_number":"A88977","first_name":"CHAD","last_name":"CHEUNG","classification":"U","division":"PCC","hit_factor":5.7143},{"match_name":"LA05 Tangi June USPSA 2020","match_date":"2020-06-28","stage_classifiercode":"99-11","member_number":"TY66899","first_name":"JOHN","last_name":"HOFFMAN","classification":"C","division":"PCC","hit_factor":5.7082},{"match_name":"Hallstead July 18th PCC","match_date":"2020-07-18","stage_classifiercode":"99-11","member_number":"Ty104413","first_name":"LEE","last_name":"CANFIELD","classification":"C","division":"PCC","hit_factor":5.708},{"match_name":"GAS July 7th Special Classifier","match_date":"2018-07-07","stage_classifiercode":"99-11","member_number":"A97062","first_name":"PAUL","last_name":"MCKEAN","classification":"C","division":"PCC","hit_factor":5.7069},{"match_name":"MSSA USPSA June  10 2017","match_date":"2017-06-10","stage_classifiercode":"99-11","member_number":"\"\"","first_name":"GARY","last_name":"CARR","classification":"U","division":"PCC","hit_factor":5.7034},{"match_name":"Castlewood USPSA Sept 2020 shoot","match_date":"2020-09-26","stage_classifiercode":"99-11","member_number":"FY85746","first_name":"JIMW","last_name":"LASKOWSKI","classification":"B","division":"PCC","hit_factor":5.7001},{"match_name":"Free State PCC Match 8-29","match_date":"2020-08-29","stage_classifiercode":"99-11","member_number":"TY89044","first_name":"MARK","last_name":"MERRILL","classification":"B","division":"PCC","hit_factor":5.698},{"match_name":"CVSC 10-28-2018 (6 Stage All Classifier Match)","match_date":"2018-10-28","stage_classifiercode":"99-11","member_number":"A112745","first_name":"NICK","last_name":"HARRISON","classification":"U","division":"PCC","hit_factor":5.6968},{"match_name":"7-30 Match","match_date":"2017-07-30","stage_classifiercode":"99-11","member_number":"A71205","first_name":"JUSTIN","last_name":"SCARBERRY","classification":"U","division":"PCC","hit_factor":5.6911},{"match_name":"USPSA MO21 2Alpha SBRC October 2017","match_date":"2017-10-21","stage_classifiercode":"99-11","member_number":"A103980","first_name":"WALT","last_name":"COLTRIN","classification":"B","division":"PCC","hit_factor":5.6899},{"match_name":"TPS USPSA -  August Classifier Match 2020","match_date":"2020-08-01","stage_classifiercode":"99-11","member_number":"A84976","first_name":"JARED","last_name":"DEWEY","classification":"U","division":"PCC","hit_factor":5.6853},{"match_name":"PRG - Oh Shoot USPSA February 21st - 3rd Sunday Match","match_date":"2021-02-21","stage_classifiercode":"99-11","member_number":"a34749","first_name":"RON","last_name":"SINGSON","classification":"C","division":"PCC","hit_factor":5.6834},{"match_name":"LPRGC - Lower Providence USPSA October 2018","match_date":"2018-10-06","stage_classifiercode":"99-11","member_number":"TY8758","first_name":"STEPHEN","last_name":"MIRANDA","classification":"U","division":"PCC","hit_factor":5.6831},{"match_name":"JPPS Club Match","match_date":"2018-04-21","stage_classifiercode":"99-11","member_number":"A58787","first_name":"JOHN","last_name":"SPRINGLE","classification":"U","division":"PCC","hit_factor":5.6807},{"match_name":"WNPL USPSA - Nov 2017","match_date":"2017-11-05","stage_classifiercode":"99-11","member_number":"A6778","first_name":"JOHN","last_name":"MCKEAN","classification":"C","division":"PCC","hit_factor":5.6769},{"match_name":"Pardoe Sportsmens Association-WPA14-2017-10-01","match_date":"2017-10-01","stage_classifiercode":"99-11","member_number":"A61469","first_name":"JAMES","last_name":"NAGEOTTE","classification":"C","division":"PCC","hit_factor":5.6769},{"match_name":"LGCSEMPS April 2018 Special Classifier","match_date":"2018-04-08","stage_classifiercode":"99-11","member_number":"TY59102","first_name":"RON","last_name":"LAWLER","classification":"U","division":"PCC","hit_factor":5.6751},{"match_name":"BHPSC Weekly Match 2-24-2017 Special Classifier Match","match_date":"2017-02-25","stage_classifiercode":"99-11","member_number":"A96788","first_name":"NIKOLOS","last_name":"FORD","classification":"U","division":"PCC","hit_factor":5.6711},{"match_name":"Hopkinton June  2016","match_date":"2016-06-04","stage_classifiercode":"99-11","member_number":"A96844","first_name":"KERRI  L","last_name":"WIMBERLY","classification":"\"\"","division":"PCC","hit_factor":5.668},{"match_name":"BORCC USPSA May 2018","match_date":"2018-05-26","stage_classifiercode":"99-11","member_number":"A107259","first_name":"CULLEN","last_name":"COOKE","classification":"U","division":"PCC","hit_factor":5.6657},{"match_name":"Coyote USPSA match 4-21-18","match_date":"2018-04-21","stage_classifiercode":"99-11","member_number":"L4452","first_name":"JUSTIN","last_name":"CORONA","classification":"A","division":"PCC","hit_factor":5.663},{"match_name":"LdF USPSA Match May 12 2018","match_date":"2018-05-12","stage_classifiercode":"99-11","member_number":"\"\"","first_name":"ARNEL","last_name":"ARCAL","classification":"U","division":"PCC","hit_factor":5.6604},{"match_name":"Rio Salado UPPL September 2020","match_date":"2020-09-13","stage_classifiercode":"99-11","member_number":"A25647","first_name":"MIKE","last_name":"JOHANSEN","classification":"C","division":"PCC","hit_factor":5.6552},{"match_name":"FBURG USPSA November 2020","match_date":"2020-11-01","stage_classifiercode":"99-11","member_number":"TY88424","first_name":"CRAIG","last_name":"PETERSON","classification":"C","division":"PCC","hit_factor":5.653},{"match_name":"WVPPS November 2018","match_date":"2018-11-18","stage_classifiercode":"99-11","member_number":"TY53701","first_name":"RON","last_name":"COOPER","classification":"B","division":"PCC","hit_factor":5.646},{"match_name":"OFGC USPSA Match Feb 19th 2017","match_date":"2017-02-19","stage_classifiercode":"99-11","member_number":"\"\"","first_name":"WILLIAM","last_name":"STRIPLIN","classification":"D","division":"PCC","hit_factor":5.6433},{"match_name":"Strategic Edge July 2018 USPSA","match_date":"2018-07-21","stage_classifiercode":"99-11","member_number":"\"\"","first_name":"RAY","last_name":"BRASSER","classification":"U","division":"PCC","hit_factor":5.642},{"match_name":"LGCSEMPS April 2018 Special Classifier","match_date":"2018-04-08","stage_classifiercode":"99-11","member_number":"A101956","first_name":"XAVIER","last_name":"FAJARDO","classification":"U","division":"PCC","hit_factor":5.6399},{"match_name":"MRPC OHS02 042218","match_date":"2018-04-21","stage_classifiercode":"99-11","member_number":"\"\"","first_name":"TODD","last_name":"PRICKETT","classification":"U","division":"PCC","hit_factor":5.6391},{"match_name":"ORGC Tuesday classifier August-21-2018","match_date":"2018-08-21","stage_classifiercode":"99-11","member_number":"A106570","first_name":"NICHOLAS","last_name":"COLOMBAI","classification":"\"\"","division":"PCC","hit_factor":5.6373},{"match_name":"SFPC Aug 8 2021 USPSA Classifier match","match_date":"2021-08-08","stage_classifiercode":"99-11","member_number":"TY33862","first_name":"JON","last_name":"KENNETH","classification":"C","division":"PCC","hit_factor":5.6338},{"match_name":"CRC/SVPS AUGUST  2018","match_date":"2018-08-17","stage_classifiercode":"99-11","member_number":"A53378","first_name":"KEITH","last_name":"SANBORN","classification":"U","division":"PCC","hit_factor":5.6306},{"match_name":"NAAS 2018-01-21 Special Classifier Match","match_date":"2018-01-21","stage_classifiercode":"99-11","member_number":"A107497","first_name":"HARLEY","last_name":"WIEGERT","classification":"U","division":"PCC","hit_factor":5.6277},{"match_name":"Denali Practical Pistol April","match_date":"2017-04-08","stage_classifiercode":"99-11","member_number":"TY46275","first_name":"ROBERT","last_name":"SPICER","classification":"U","division":"PCC","hit_factor":5.6266},{"match_name":"Chillicothe February 2021 USPSA Match","match_date":"2021-02-28","stage_classifiercode":"99-11","member_number":"A132848","first_name":"CHRISTOPHER","last_name":"KORGER","classification":"U","division":"PCC","hit_factor":5.6232},{"match_name":"2020-03 Bone Creek USPSA","match_date":"2020-03-01","stage_classifiercode":"99-11","member_number":"A102504","first_name":"JAVIS","last_name":"MCGEE","classification":"U","division":"PCC","hit_factor":5.6166},{"match_name":"USPSA MO21 2Alpha SBRC October 2017","match_date":"2017-10-21","stage_classifiercode":"99-11","member_number":"TY89171","first_name":"AUSTIN KYLE","last_name":"CHAMBERLAIN","classification":"A","division":"PCC","hit_factor":5.6133},{"match_name":"Denali Practical Pistol April","match_date":"2017-04-08","stage_classifiercode":"99-11","member_number":"A96258","first_name":"ELVIS","last_name":"CERNJUL","classification":"U","division":"PCC","hit_factor":5.6117},{"match_name":"CCC Shooting Complex November 2017","match_date":"2017-11-05","stage_classifiercode":"99-11","member_number":"\"\"","first_name":"CHARLES","last_name":"MORRIS","classification":"U","division":"PCC","hit_factor":5.598},{"match_name":"BORCC USPSA May 2018","match_date":"2018-05-26","stage_classifiercode":"99-11","member_number":"L3568","first_name":"DAVE","last_name":"WARREN","classification":"C","division":"PCC","hit_factor":5.597},{"match_name":"NAAS 03-05-2016","match_date":"2017-03-05","stage_classifiercode":"99-11","member_number":"TY73586","first_name":"MIKE","last_name":"CURRIER","classification":"U","division":"PCC","hit_factor":5.5829},{"match_name":"SFPC June 7 2020 AM     USPSA Monthly Match","match_date":"2020-06-07","stage_classifiercode":"99-11","member_number":"FY109406","first_name":"MAXIMO","last_name":"ALBORNETT","classification":"B","division":"PCC","hit_factor":5.5772},{"match_name":"NPCCC 05-07-2017 USPSA","match_date":"2017-05-07","stage_classifiercode":"99-11","member_number":"\"\"","first_name":"BOB","last_name":"WIESMAN","classification":"U","division":"PCC","hit_factor":5.5769},{"match_name":"2017 Bay bridge Charity Classic - Richmond October 14-15-2017","match_date":"2017-10-14","stage_classifiercode":"99-11","member_number":"A101137","first_name":"ROBERTO","last_name":"SANCHEZ","classification":"U","division":"PCC","hit_factor":5.5762},{"match_name":"MRPC OHS02 042218","match_date":"2018-04-21","stage_classifiercode":"99-11","member_number":"TY30950","first_name":"JERRY","last_name":"MCCORD","classification":"C","division":"PCC","hit_factor":5.569},{"match_name":"ORPCI USPSA Saturday 2020.07.18","match_date":"2020-07-18","stage_classifiercode":"99-11","member_number":"TY38798","first_name":"JASON","last_name":"ROGERS","classification":"B","division":"PCC","hit_factor":5.569},{"match_name":"LGCSEMPS April 2018 Special Classifier","match_date":"2018-04-08","stage_classifiercode":"99-11","member_number":"TY70812","first_name":"RICK","last_name":"BIRDSALL","classification":"A","division":"PCC","hit_factor":5.5684},{"match_name":"SSS USPSA February 2020","match_date":"2020-02-16","stage_classifiercode":"99-11","member_number":"F118207","first_name":"TYLER","last_name":"QUANCE - PCC","classification":"U (Unclassified)","division":"PCC","hit_factor":5.5666},{"match_name":"GRB JAN USPSA  at Cav","match_date":"2017-01-21","stage_classifiercode":"99-11","member_number":"A71480","first_name":"DAVID","last_name":"SCORDY","classification":"U","division":"PCC","hit_factor":5.5556},{"match_name":"MS06 Team Magnolia February 2018 USPSA Match","match_date":"2018-02-03","stage_classifiercode":"99-11","member_number":"A99640","first_name":"TREY","last_name":"NICHOLSON","classification":"B","division":"PCC","hit_factor":5.5494},{"match_name":"Coyote USPSA match 4-21-18","match_date":"2018-04-21","stage_classifiercode":"99-11","member_number":"TY85728","first_name":"BOBBI","last_name":"HOLLAND","classification":"C","division":"PCC","hit_factor":5.5432},{"match_name":"GRB JAN USPSA  at Cav","match_date":"2017-01-21","stage_classifiercode":"99-11","member_number":"A27108","first_name":"RANDY","last_name":"MCFARLAND","classification":"U","division":"PCC","hit_factor":5.5427},{"match_name":"Wvpps Nov. 2016","match_date":"2016-11-20","stage_classifiercode":"99-11","member_number":"A81004","first_name":"JIM","last_name":"KOUTSOUMPAS","classification":"U","division":"PCC","hit_factor":5.5396},{"match_name":"Grandbaggers August 2017","match_date":"2017-08-03","stage_classifiercode":"99-11","member_number":"TY85183","first_name":"DANNY","last_name":"D'ANGELO","classification":"A","division":"PCC","hit_factor":5.5394},{"match_name":"ORPCI USPSA Saturday 2021.07.17","match_date":"2021-07-17","stage_classifiercode":"99-11","member_number":"FY80376","first_name":"DAN","last_name":"RAINBOLT","classification":"D","division":"PCC","hit_factor":5.5328},{"match_name":"RBGC 2017-06-24","match_date":"2017-06-24","stage_classifiercode":"99-11","member_number":"A56839","first_name":"BARRY","last_name":"HENLEY","classification":"U","division":"PCC","hit_factor":5.531},{"match_name":"Hallstead USPSA  July Match","match_date":"2020-07-25","stage_classifiercode":"99-11","member_number":"A101634","first_name":"PHILLIP","last_name":"LEARY","classification":"U","division":"PCC","hit_factor":5.5291},{"match_name":"Hallstead July 18th PCC","match_date":"2020-07-18","stage_classifiercode":"99-11","member_number":"A95285","first_name":"DAVID","last_name":"PHILLIPS","classification":"U","division":"PCC","hit_factor":5.5281},{"match_name":"OK15 USPSA at USSA May 6th 2018","match_date":"2018-05-06","stage_classifiercode":"99-11","member_number":"a-102945","first_name":"THEODORE","last_name":"KENWORTHY","classification":"U","division":"PCC","hit_factor":5.5249},{"match_name":"USPSA AR02 North Arkansas Action Pistol Feb 9th 2020","match_date":"2020-02-09","stage_classifiercode":"99-11","member_number":"A117129","first_name":"EITAN","last_name":"GROSS","classification":"C","division":"PCC","hit_factor":5.5227},{"match_name":"SLPSA July USPSA match","match_date":"2018-07-21","stage_classifiercode":"99-11","member_number":"TY74311","first_name":"TONIRAE","last_name":"GARDNER","classification":"U","division":"PCC","hit_factor":5.5188},{"match_name":"Bayou City USPSA Weekly Dec 17","match_date":"2020-12-18","stage_classifiercode":"99-11","member_number":"A107489","first_name":"CHARLES","last_name":"BRADBURY","classification":"C","division":"PCC","hit_factor":5.5158},{"match_name":"WSRC USPSA","match_date":"2016-10-22","stage_classifiercode":"99-11","member_number":"A98885","first_name":"BART","last_name":"CARSON","classification":"U","division":"PCC","hit_factor":5.5147},{"match_name":"Richmond Hot Shots April 30-May 1st USPSA Pistol Match","match_date":"2016-04-30","stage_classifiercode":"99-11","member_number":"TY69128","first_name":"TONY","last_name":"YEH","classification":"C","division":"PCC","hit_factor":5.509},{"match_name":"PRG - Oh Shoot USPSA February 21st - 3rd Sunday Match","match_date":"2021-02-21","stage_classifiercode":"99-11","member_number":"A118119","first_name":"ENRIQUE","last_name":"DONDONAY","classification":"C","division":"PCC","hit_factor":5.5085},{"match_name":"November 2016 PCSI USPSA Monster Match","match_date":"2016-11-05","stage_classifiercode":"99-11","member_number":"A91422","first_name":"LONNIE","last_name":"MORTENSEN","classification":"U","division":"PCC","hit_factor":5.5069},{"match_name":"RCPS USPSA March 10","match_date":"2018-03-10","stage_classifiercode":"99-11","member_number":"\"\"","first_name":"TIM","last_name":"ARDLEY","classification":"U","division":"PCC","hit_factor":5.506},{"match_name":"BORCC USPSA May 2018","match_date":"2018-05-26","stage_classifiercode":"99-11","member_number":"A107723","first_name":"AVERY","last_name":"MOLDEN","classification":"U","division":"PCC","hit_factor":5.5046},{"match_name":"PCPS Classifier and Slot Match Jan 2020","match_date":"2020-01-12","stage_classifiercode":"99-11","member_number":"A125100","first_name":"JESSE","last_name":"VERBUNKER","classification":"U","division":"PCC","hit_factor":5.4983},{"match_name":"PRG 2017 Classifier Match","match_date":"2017-02-19","stage_classifiercode":"99-11","member_number":"\"\"","first_name":"DANIEL","last_name":"LYONS","classification":"U","division":"PCC","hit_factor":5.4976},{"match_name":"APSC 4th Annual Holiday Hosefest USPSA Match 12-02-17","match_date":"2017-12-02","stage_classifiercode":"99-11","member_number":"A102843","first_name":"AARON","last_name":"LAFARY","classification":"U","division":"PCC","hit_factor":5.4934},{"match_name":"WPGC 8-7-2017","match_date":"2017-08-07","stage_classifiercode":"99-11","member_number":"TY70548","first_name":"CHARLENE","last_name":"JONES","classification":"D","division":"PCC","hit_factor":5.491},{"match_name":"Hallstead July 18th PCC","match_date":"2020-07-18","stage_classifiercode":"99-11","member_number":"A-95971","first_name":"JESSE","last_name":"SHAFFER","classification":"U","division":"PCC","hit_factor":5.4902},{"match_name":"Benton Gun Club-USPSA June 27  9AM","match_date":"2021-06-27","stage_classifiercode":"99-11","member_number":"A117129","first_name":"EITAN","last_name":"GROSS","classification":"C","division":"PCC","hit_factor":5.4822},{"match_name":"Deadwood Boys USPSA All Classifier Match - 29 July 2018","match_date":"2018-07-29","stage_classifiercode":"99-11","member_number":"A27973","first_name":"VINKY","last_name":"CASTILLO","classification":"U","division":"PCC","hit_factor":5.4795},{"match_name":"OFGC USPSA Match Feb 19th 2017","match_date":"2017-02-19","stage_classifiercode":"99-11","member_number":"\"\"","first_name":"MELISSA","last_name":"FACKELMAN","classification":"U","division":"PCC","hit_factor":5.4795},{"match_name":"Shadow Hawk Defense USPSA Special Classifier","match_date":"2020-11-14","stage_classifiercode":"99-11","member_number":"A108940","first_name":"LARRY","last_name":"KNOSP","classification":"C","division":"PCC","hit_factor":5.4759},{"match_name":"DAPS USPSA at ETTS 7-8-17","match_date":"2017-07-08","stage_classifiercode":"99-11","member_number":"TY9766","first_name":"PATRICK","last_name":"BASHFORD","classification":"B","division":"PCC","hit_factor":5.4732},{"match_name":"MCPSL Pistol 3-10-18","match_date":"2018-03-10","stage_classifiercode":"99-11","member_number":"A83751","first_name":"ASHLEIGH","last_name":"GOSNELL","classification":"U","division":"PCC","hit_factor":5.4697},{"match_name":"SWGC USPSA Pistol Match - November 2021","match_date":"2021-11-06","stage_classifiercode":"99-11","member_number":"TY97327","first_name":"TIM","last_name":"WEBSTER","classification":"B","division":"PCC","hit_factor":5.467},{"match_name":"USPSA MO21 2Alpha SBRC March 2018","match_date":"2018-03-24","stage_classifiercode":"99-11","member_number":"A76279","first_name":"TIM","last_name":"QUIRARTE","classification":"U","division":"PCC","hit_factor":5.4622},{"match_name":"ORSA USPSA October 2017","match_date":"2017-10-21","stage_classifiercode":"99-11","member_number":"a105401","first_name":"JHEREMY","last_name":"ZETANS","classification":"U","division":"PCC","hit_factor":5.4608},{"match_name":"SSS USPSA February 2020","match_date":"2020-02-16","stage_classifiercode":"99-11","member_number":"A122303","first_name":"CODY","last_name":"MCNEELY","classification":"A (A Class)","division":"PCC","hit_factor":5.4602},{"match_name":"DCPA USPSA 10-11-2020","match_date":"2020-10-11","stage_classifiercode":"99-11","member_number":"A123716","first_name":"NELCH","last_name":"PRINCIVIL","classification":"D","division":"PCC","hit_factor":5.4595},{"match_name":"BSPSC 2017 April Special Classifier","match_date":"2017-04-09","stage_classifiercode":"99-11","member_number":"TY43523","first_name":"JASON","last_name":"RITTER","classification":"U","division":"PCC","hit_factor":5.4585},{"match_name":"SSS USPSA June 2020 FATHERS DAY Match","match_date":"2020-06-21","stage_classifiercode":"99-11","member_number":"A114363","first_name":"HOWARD","last_name":"DOCHERTY","classification":"U (Unclassified)","division":"PCC","hit_factor":5.4567},{"match_name":"SFPC Aug 8 2021 USPSA Classifier match","match_date":"2021-08-08","stage_classifiercode":"99-11","member_number":"TY101600","first_name":"JIM","last_name":"ZUEL","classification":"B","division":"PCC","hit_factor":5.4565},{"match_name":"2017 Bay bridge Charity Classic - Richmond October 14-15-2017","match_date":"2017-10-14","stage_classifiercode":"99-11","member_number":"A22479","first_name":"PAUL","last_name":"GHENT","classification":"A","division":"PCC","hit_factor":5.4565},{"match_name":"Benton Gun Club-USPSA May27 2018 CLASIFIER","match_date":"2018-05-27","stage_classifiercode":"99-11","member_number":"ty96041","first_name":"ERNIE","last_name":"DECKER","classification":"C","division":"PCC","hit_factor":5.4502},{"match_name":"Ontelaunee USPSA  July 2018","match_date":"2018-07-29","stage_classifiercode":"99-11","member_number":"TY91481","first_name":"CONNOR","last_name":"CRAWFORD","classification":"U","division":"PCC","hit_factor":5.4455},{"match_name":"HSC USPSA October 7th 2017","match_date":"2017-10-06","stage_classifiercode":"99-11","member_number":"Ty77032","first_name":"TYLER","last_name":"COKE","classification":"B","division":"PCC","hit_factor":5.4422},{"match_name":"CFRPC April USPSA Match","match_date":"2018-04-15","stage_classifiercode":"99-11","member_number":"A93249","first_name":"CHARLIE","last_name":"RODZ","classification":"D","division":"PCC","hit_factor":5.4358},{"match_name":"ECPS USPSA 19 May 18","match_date":"2018-05-19","stage_classifiercode":"99-11","member_number":"TY101981","first_name":"THANA","last_name":"CHAITHA","classification":"U","division":"PCC","hit_factor":5.4358},{"match_name":"Bossier Parish Practical Shooters August 16 2020","match_date":"2020-08-16","stage_classifiercode":"99-11","member_number":"TY116349","first_name":"OWEN","last_name":"MCDONNELL","classification":"U","division":"PCC","hit_factor":5.4348},{"match_name":"BLUE RIDGE ARSENAL July 6 Classifier Match","match_date":"2018-07-06","stage_classifiercode":"99-11","member_number":"TY92038","first_name":"AARON","last_name":"SAULLS","classification":"U","division":"PCC","hit_factor":5.4299},{"match_name":"PRG - Oh Shoot USPSA February 21st - 3rd Sunday Match","match_date":"2021-02-21","stage_classifiercode":"99-11","member_number":"A68341","first_name":"AMADOR","last_name":"MASCARINA","classification":"D","division":"PCC","hit_factor":5.4299},{"match_name":"Devil Dog USPSA Classifier Match-Sunday Session","match_date":"2018-03-11","stage_classifiercode":"99-11","member_number":"A93396","first_name":"MICHAEL","last_name":"COSTLEY","classification":"B","division":"PCC","hit_factor":5.4299},{"match_name":"FBURG July 2018 Level I USPSA ","match_date":"2018-07-01","stage_classifiercode":"99-11","member_number":"A72727","first_name":"GREG","last_name":"JONES","classification":"U","division":"PCC","hit_factor":5.4276},{"match_name":"SLPSA July USPSA match","match_date":"2018-07-21","stage_classifiercode":"99-11","member_number":"A109045","first_name":"RYAN","last_name":"HOUTS","classification":"U","division":"PCC","hit_factor":5.4124},{"match_name":"Shasta Shooters 2021 Nov","match_date":"2021-11-13","stage_classifiercode":"99-11","member_number":"A1234","first_name":"BRYCE","last_name":"HENDERSON","classification":"U","division":"PCC","hit_factor":5.4104},{"match_name":"2017-10-07 USPSA at Phoenix Rod and Gun Club","match_date":"2017-10-07","stage_classifiercode":"99-11","member_number":"A77997","first_name":"TOM","last_name":"MCCONLOGUE","classification":"U","division":"PCC","hit_factor":5.4054},{"match_name":"ETRPC-USPSA","match_date":"2021-03-27","stage_classifiercode":"99-11","member_number":"L4911","first_name":"CARLOS","last_name":"PERAZZA","classification":"B","division":"PCC","hit_factor":5.4054},{"match_name":"Chillicothe February 2021 USPSA Match","match_date":"2021-02-28","stage_classifiercode":"99-11","member_number":"A74372","first_name":"BRIAN","last_name":"ROWLISON","classification":"B","division":"PCC","hit_factor":5.4054},{"match_name":"Strategic Edge July 2018 USPSA","match_date":"2018-07-21","stage_classifiercode":"99-11","member_number":"A84875","first_name":"GW","last_name":"AUSTIN","classification":"C","division":"PCC","hit_factor":5.4054},{"match_name":"Free State PCC Match 8-29","match_date":"2020-08-29","stage_classifiercode":"99-11","member_number":"A129993","first_name":"DICK","last_name":"GIBSON","classification":"U","division":"PCC","hit_factor":5.4004},{"match_name":"LCSC Linden USPSA 092621","match_date":"2021-09-25","stage_classifiercode":"99-11","member_number":"A110038","first_name":"MACHELLE","last_name":"HUNTER","classification":"C","division":"PCC","hit_factor":5.4},{"match_name":"MPSA 070718 USPSA","match_date":"2018-07-07","stage_classifiercode":"99-11","member_number":"TY96306","first_name":"KYLE","last_name":"WATKINS","classification":"C","division":"PCC","hit_factor":5.3927},{"match_name":"SCAPSA MN05 Summer League 8","match_date":"2017-08-01","stage_classifiercode":"99-11","member_number":"TY70118","first_name":"NOEL","last_name":"PILLMAN","classification":"U","division":"PCC","hit_factor":5.3846},{"match_name":"Winona 7/25/17","match_date":"2017-07-25","stage_classifiercode":"99-11","member_number":"TY78898","first_name":"NATHAN","last_name":"HARVEY","classification":"B","division":"PCC","hit_factor":5.379},{"match_name":"Castlewood USPSA Sept 2020 shoot","match_date":"2020-09-26","stage_classifiercode":"99-11","member_number":"not a member","first_name":"ROBERT","last_name":"MOLNAR","classification":"U","division":"PCC","hit_factor":5.3785},{"match_name":"NHRPC - March 2021 USPSA","match_date":"2021-03-14","stage_classifiercode":"99-11","member_number":"None","first_name":"PAUL","last_name":"BONARGO","classification":"X","division":"PCC","hit_factor":5.3763},{"match_name":"HSC USPSA May 5th 2018","match_date":"2018-05-05","stage_classifiercode":"99-11","member_number":"A95768","first_name":"THOMAS","last_name":"COOK","classification":"U","division":"PCC","hit_factor":5.3691},{"match_name":"CFRPC December USPSA (Classifier)","match_date":"2018-12-16","stage_classifiercode":"99-11","member_number":"A115455","first_name":"DEXTER","last_name":"CRUZ","classification":"U","division":"PCC","hit_factor":5.3678},{"match_name":"NW01 April da Turd","match_date":"2018-04-04","stage_classifiercode":"99-11","member_number":"FY88208","first_name":"DREW","last_name":"PARROTT","classification":"D","division":"PCC","hit_factor":5.3672},{"match_name":"BPSA January 2017 USPSA","match_date":"2017-01-22","stage_classifiercode":"99-11","member_number":"A98482","first_name":"AARON","last_name":"FITZGERALD","classification":"U","division":"PCC","hit_factor":5.3667},{"match_name":"SUPS USPSA 20-21 October 2018","match_date":"2018-10-20","stage_classifiercode":"99-11","member_number":"\"\"","first_name":"LINDA","last_name":"STIDHAM","classification":"U","division":"PCC","hit_factor":5.3619},{"match_name":"2020-03 Bone Creek USPSA","match_date":"2020-03-01","stage_classifiercode":"99-11","member_number":"TY104525","first_name":"STEVE","last_name":"GROSHONG","classification":"U","division":"PCC","hit_factor":5.3604},{"match_name":"The Hollow 6 June 2018","match_date":"2018-08-06","stage_classifiercode":"99-11","member_number":"\"\"","first_name":"SEBASTIAN","last_name":"RODRIGUEZ","classification":"U","division":"PCC","hit_factor":5.3593},{"match_name":"ORPCI 2018.03.31 USPSA Special","match_date":"2018-03-31","stage_classifiercode":"99-11","member_number":"A53250","first_name":"DON","last_name":"SLUSHER","classification":"C","division":"PCC","hit_factor":5.3571},{"match_name":"OK15 USPSA at USSA May 6th 2018","match_date":"2018-05-06","stage_classifiercode":"99-11","member_number":"A82757","first_name":"RYAN","last_name":"GROVES","classification":"U","division":"PCC","hit_factor":5.3537},{"match_name":" IPSC93 Oct 2021","match_date":"2021-10-29","stage_classifiercode":"99-11","member_number":"A136267","first_name":"BRIAN","last_name":"ROBERTS","classification":"","division":"PCC","hit_factor":5.3524},{"match_name":"RDS Dec 2nd 2017 USPSA Classifier Match","match_date":"2017-12-02","stage_classifiercode":"99-11","member_number":"A92627","first_name":"CHRIS","last_name":"YATES","classification":"C","division":"PCC","hit_factor":5.3465},{"match_name":"June 2018 CAS USPSA","match_date":"2018-06-03","stage_classifiercode":"99-11","member_number":"TY74045","first_name":"STEPHEN","last_name":"RUSSO","classification":"U","division":"PCC","hit_factor":5.3435},{"match_name":"11 March Classifier Match","match_date":"2018-03-10","stage_classifiercode":"99-11","member_number":"A106268","first_name":"ALLEN","last_name":"MINAKER","classification":"\"\"","division":"PCC","hit_factor":5.336},{"match_name":"WNYPPL August 2017 Classifier Match","match_date":"2017-08-27","stage_classifiercode":"99-11","member_number":"TY42276","first_name":"DAVE","last_name":"PRIBEK","classification":"C","division":"PCC","hit_factor":5.3309},{"match_name":"HPS March 2020 Club Fun Match","match_date":"2020-03-07","stage_classifiercode":"99-11","member_number":"A107594","first_name":"DANNY","last_name":"TRAN","classification":"U","division":"PCC","hit_factor":5.3274},{"match_name":"RDS Dec 2nd 2017 USPSA Classifier Match","match_date":"2017-12-02","stage_classifiercode":"99-11","member_number":"A76879","first_name":"BRIAN","last_name":"OWENS","classification":"C","division":"PCC","hit_factor":5.326},{"match_name":"Brazosland Pistoleros USPSA - Sunday August 8th","match_date":"2021-08-08","stage_classifiercode":"99-11","member_number":"L3935","first_name":"DANNY","last_name":"DUBUISSON","classification":"C","division":"PCC","hit_factor":5.3254},{"match_name":"OFGC Practical Pistol Match 01-19-2020","match_date":"2020-01-19","stage_classifiercode":"99-11","member_number":"FY45785","first_name":"BRUCE","last_name":"BETHELL","classification":"C","division":"PCC","hit_factor":5.3162},{"match_name":"WVRPC Speed Shoot Spectacular Dec 2017","match_date":"2017-12-16","stage_classifiercode":"99-11","member_number":"A106525","first_name":"GENO","last_name":"HESSION","classification":"Unclassified","division":"PCC","hit_factor":5.3144},{"match_name":"Castlewood USPSA Sept 2020 shoot","match_date":"2020-09-26","stage_classifiercode":"99-11","member_number":"FY85746","first_name":"JIM","last_name":"LASKOWSKI","classification":"B","division":"PCC","hit_factor":5.314},{"match_name":"EAPS July 2017 USPSA","match_date":"2017-07-16","stage_classifiercode":"99-11","member_number":"PENDING","first_name":"ROBERT","last_name":"WESTFALL","classification":"U","division":"PCC","hit_factor":5.314},{"match_name":"CASA USPSA December 3  2017","match_date":"2017-12-03","stage_classifiercode":"99-11","member_number":"A101764","first_name":"KEITH","last_name":"DE NOBLE","classification":"U","division":"PCC","hit_factor":5.3131},{"match_name":"WPGC 10-1-18","match_date":"2018-10-01","stage_classifiercode":"99-11","member_number":"TY73532","first_name":"STEPHEN","last_name":"CASH","classification":"A","division":"PCC","hit_factor":5.3097},{"match_name":"West Coast IPSC","match_date":"2018-07-22","stage_classifiercode":"99-11","member_number":"TY45256","first_name":"GORDON","last_name":"CAMERON","classification":"U","division":"PCC","hit_factor":5.3065},{"match_name":"Benton Gun Club-USPSA March 25 2018","match_date":"2018-03-25","stage_classifiercode":"99-11","member_number":"FY90735","first_name":"STEPHEN","last_name":"FITZSIMMONS","classification":"U","division":"PCC","hit_factor":5.305},{"match_name":"NVSA USPSA 1609","match_date":"2016-09-04","stage_classifiercode":"99-11","member_number":"XXX","first_name":"JAY","last_name":"KUCA","classification":"U","division":"PCC","hit_factor":5.3004},{"match_name":"Deadwood Boys USPSA All Classifier Match - 29 July 2018","match_date":"2018-07-29","stage_classifiercode":"99-11","member_number":"TY109578","first_name":"WILLIAM","last_name":"MEYER","classification":"U","division":"PCC","hit_factor":5.298},{"match_name":"Danville Rifle and Pistol Club USPSA IL17 July 7 2018","match_date":"2018-07-07","stage_classifiercode":"99-11","member_number":"\"\"","first_name":"SAM","last_name":"SCHIFO","classification":"\"\"","division":"PCC","hit_factor":5.2957},{"match_name":"Emmett July Match","match_date":"2017-07-21","stage_classifiercode":"99-11","member_number":"TY83544","first_name":"ZACK","last_name":"IRWIN","classification":"M","division":"PCC","hit_factor":5.2893},{"match_name":"PRG - Oh Shoot USPSA February 21st - 3rd Sunday Match","match_date":"2021-02-21","stage_classifiercode":"99-11","member_number":"A18725","first_name":"JIM","last_name":"MESSINA","classification":"C","division":"PCC","hit_factor":5.2863},{"match_name":"Douglas Ridge USPSA March 7","match_date":"2020-03-07","stage_classifiercode":"99-11","member_number":"L4778","first_name":"TODD","last_name":"SCHLENKER","classification":"U","division":"PCC","hit_factor":5.2743},{"match_name":"Prescott Action Shooters 1st Saturday USPSA 6-2-2018 ","match_date":"2018-06-03","stage_classifiercode":"99-11","member_number":"A72667","first_name":"KEN","last_name":"STUBBE","classification":"C","division":"PCC","hit_factor":5.2738},{"match_name":"TGC USPSA JANUARY 2018","match_date":"2018-01-20","stage_classifiercode":"99-11","member_number":"A83616","first_name":"LELAND","last_name":"JOHNSON","classification":"U","division":"PCC","hit_factor":5.2727},{"match_name":"EAPS July 2017 USPSA","match_date":"2017-07-16","stage_classifiercode":"99-11","member_number":"A104212","first_name":"JERRELL N","last_name":"HORAIST","classification":"U","division":"PCC","hit_factor":5.2727},{"match_name":"Blackstone Shooting Sports Snow Days January 2017 USPSA Level  1","match_date":"2017-01-08","stage_classifiercode":"99-11","member_number":"A94309","first_name":"CHRIS","last_name":"LOVETT","classification":"D","division":"PCC","hit_factor":5.2705},{"match_name":"USPSA MO21 2Alpha SBRC March 2018","match_date":"2018-03-24","stage_classifiercode":"99-11","member_number":"A106591","first_name":"AUSTIN","last_name":"HILL","classification":"U","division":"PCC","hit_factor":5.2632},{"match_name":"USPSA AR02 North Arkansas Action Pistol Feb 9th 2020","match_date":"2020-02-09","stage_classifiercode":"99-11","member_number":"a115608","first_name":"MIKE. JR","last_name":"WALDEN","classification":"U","division":"PCC","hit_factor":5.2632},{"match_name":"RSPP 3rd Saturday November 2016","match_date":"2016-11-19","stage_classifiercode":"99-11","member_number":"A58956","first_name":"RICK","last_name":"KORZEP","classification":"U","division":"PCC","hit_factor":5.2632},{"match_name":"Bailey's March 2020","match_date":"2020-03-03","stage_classifiercode":"99-11","member_number":"TY41987","first_name":"FRED","last_name":"CANNATA","classification":"C","division":"PCC","hit_factor":5.2584},{"match_name":"Baileys July 2017","match_date":"2017-07-02","stage_classifiercode":"99-11","member_number":"A13721","first_name":"BILL","last_name":"HUNTER","classification":"U","division":"PCC","hit_factor":5.2578},{"match_name":"LGCSEMPS April 2018 Special Classifier","match_date":"2018-04-08","stage_classifiercode":"99-11","member_number":"A104912","first_name":"WILLIAM","last_name":"SMITH","classification":"U","division":"PCC","hit_factor":5.2539},{"match_name":"Bgs Hudson Week 6","match_date":"2017-02-19","stage_classifiercode":"99-11","member_number":"\"\"","first_name":"JEFF","last_name":"BIHNER","classification":"U","division":"PCC","hit_factor":5.2521},{"match_name":"Castlewood USPSA Sept 2020 shoot","match_date":"2020-09-26","stage_classifiercode":"99-11","member_number":"A129887","first_name":"JOHNNYW","last_name":"WOLFE","classification":"U","division":"PCC","hit_factor":5.2493},{"match_name":"Richmond Hot Shots October 6-7 USPSA Pistol Match","match_date":"2018-10-06","stage_classifiercode":"99-11","member_number":"TY67525","first_name":"HERBERT","last_name":"CEGUERRA","classification":"U","division":"PCC","hit_factor":5.2472},{"match_name":"PRG 2017 Classifier Match","match_date":"2017-02-19","stage_classifiercode":"99-11","member_number":"TY73536","first_name":"LIEF","last_name":"RUTZBECK","classification":"U","division":"PCC","hit_factor":5.2411},{"match_name":"MCAS March 2021 USPSA","match_date":"2021-03-28","stage_classifiercode":"99-11","member_number":"A65854","first_name":"TAMMY","last_name":"NIELSEN","classification":"C","division":"PCC","hit_factor":5.2402},{"match_name":"ETRPC-USPSA","match_date":"2021-03-27","stage_classifiercode":"99-11","member_number":"A58201","first_name":"JOHN","last_name":"RAINEY","classification":"U","division":"PCC","hit_factor":5.2392},{"match_name":"Applied IN25 USPSA April Classifier 2018","match_date":"2018-04-17","stage_classifiercode":"99-11","member_number":"a78635","first_name":"ROB","last_name":"MCGUIRE","classification":"A","division":"PCC","hit_factor":5.2367},{"match_name":"OFGC USPSA Match Feb 19th 2017","match_date":"2017-02-19","stage_classifiercode":"99-11","member_number":"\"\"","first_name":"JASON","last_name":"COLE","classification":"U","division":"PCC","hit_factor":5.2326},{"match_name":"Steel City USPSA December 2 2017","match_date":"2017-12-02","stage_classifiercode":"99-11","member_number":"FY39604","first_name":"PETER","last_name":"ADAMS","classification":"U","division":"PCC","hit_factor":5.2304},{"match_name":"2016-07 Bone Creek USPSA","match_date":"2016-07-03","stage_classifiercode":"99-11","member_number":"52261","first_name":"KURT","last_name":"SAGEHORN","classification":"U","division":"PCC","hit_factor":5.2224},{"match_name":"MRPC OHS02 042218","match_date":"2018-04-21","stage_classifiercode":"99-11","member_number":"L4273","first_name":"JEFF","last_name":"SHANKS","classification":"C","division":"PCC","hit_factor":5.2117},{"match_name":"SLPSA July USPSA match","match_date":"2018-07-21","stage_classifiercode":"99-11","member_number":"\"\"","first_name":"LIAM","last_name":"KRAMER","classification":"U","division":"PCC","hit_factor":5.1996},{"match_name":"CASA USPSA December 3  2017","match_date":"2017-12-03","stage_classifiercode":"99-11","member_number":"\"\"","first_name":"TOM","last_name":"FLEMING","classification":"U","division":"PCC","hit_factor":5.1973},{"match_name":"IN19 ACC USPSA September 23","match_date":"2018-09-23","stage_classifiercode":"99-11","member_number":"TY74696","first_name":"MICHAEL","last_name":"SNOW","classification":"U","division":"PCC","hit_factor":5.1932},{"match_name":"SSS Pistol Match March 2017","match_date":"2017-03-12","stage_classifiercode":"99-11","member_number":"A88500","first_name":"ADAM","last_name":"DAVINO","classification":"C (C Class)","division":"PCC","hit_factor":5.1893},{"match_name":"TriggerGuard USPSA","match_date":"2017-05-06","stage_classifiercode":"99-11","member_number":"L3354","first_name":"RYAN","last_name":"DOLL","classification":"U","division":"PCC","hit_factor":5.1873},{"match_name":"PRG - Oh Shoot USPSA February 21st - 3rd Sunday Match","match_date":"2021-02-21","stage_classifiercode":"99-11","member_number":"A129907","first_name":"DONG","last_name":"PADING","classification":"D","division":"PCC","hit_factor":5.1813},{"match_name":"SWGC USPSA Pistol Match - November 2021","match_date":"2021-11-06","stage_classifiercode":"99-11","member_number":"A108049","first_name":"ICE T","last_name":"DEROUSSE","classification":"A","division":"PCC","hit_factor":5.1804},{"match_name":"IN19 ACC USPSA September 23","match_date":"2018-09-23","stage_classifiercode":"99-11","member_number":"TY53701","first_name":"RON","last_name":"COOPER","classification":"B","division":"PCC","hit_factor":5.1748},{"match_name":"PRG - Oh Shoot USPSA February 21st - 3rd Sunday Match","match_date":"2021-02-21","stage_classifiercode":"99-11","member_number":"TY127703","first_name":"MARC","last_name":"MAGLINTE","classification":"A","division":"PCC","hit_factor":5.1724},{"match_name":"Target  Sports Central Indiana Championship","match_date":"2020-08-22","stage_classifiercode":"99-11","member_number":"A128646","first_name":"ERIC","last_name":"GRUMBLES","classification":"U","division":"PCC","hit_factor":5.1639},{"match_name":"WGC August 2018 USPSA Classifier","match_date":"2018-08-12","stage_classifiercode":"99-11","member_number":"FY77820","first_name":"SCOTTY","last_name":"MEADOR","classification":"U","division":"PCC","hit_factor":5.1625},{"match_name":"PSAC_20161022","match_date":"2016-10-22","stage_classifiercode":"99-11","member_number":"A86526","first_name":"DOUGLAS","last_name":"NORMAN","classification":"\"\"","division":"PCC","hit_factor":5.156},{"match_name":"WSPS AUGUST 2016 USPSA","match_date":"2016-08-20","stage_classifiercode":"99-11","member_number":"\"\"","first_name":"JAMES","last_name":"COOPER","classification":"U","division":"PCC","hit_factor":5.1556},{"match_name":"Springfield Tactical Shooters 04/05/2018","match_date":"2018-04-05","stage_classifiercode":"99-11","member_number":"A107856","first_name":"JESSE","last_name":"BOEHLER","classification":"\"\"","division":"PCC","hit_factor":5.1536},{"match_name":"TriggerGuard USPSA Classifier Match","match_date":"2018-03-24","stage_classifiercode":"99-11","member_number":"A-104092","first_name":"CALEB","last_name":"BAILEY","classification":"U","division":"PCC","hit_factor":5.1536},{"match_name":"PRPS USPSA Nov   26 2017","match_date":"2017-11-01","stage_classifiercode":"99-11","member_number":"\"\"","first_name":"JEFF","last_name":"CHAPMAN","classification":"\"\"","division":"PCC","hit_factor":5.144},{"match_name":"2017 Bay bridge Charity Classic - Richmond October 14-15-2017","match_date":"2017-10-14","stage_classifiercode":"99-11","member_number":"\"\"","first_name":"CRAIG","last_name":"MORIMOTO","classification":"U","division":"PCC","hit_factor":5.1387},{"match_name":"2017 Bay bridge Charity Classic - Richmond October 14-15-2017","match_date":"2017-10-14","stage_classifiercode":"99-11","member_number":"L3301","first_name":"KEITH","last_name":"MIYASAKI","classification":"C","division":"PCC","hit_factor":5.1339},{"match_name":" IPSC93 Oct 2021","match_date":"2021-10-29","stage_classifiercode":"99-11","member_number":"A136283","first_name":"TODD","last_name":"BENSON","classification":"U","division":"PCC","hit_factor":5.1282},{"match_name":"WSPS AUGUST 2016 USPSA","match_date":"2016-08-20","stage_classifiercode":"99-11","member_number":"TY88991","first_name":"BRIAN","last_name":"DUGAN","classification":"U","division":"PCC","hit_factor":5.1237},{"match_name":"PRG - Oh Shoot USPSA February 21st - 3rd Sunday Match","match_date":"2021-02-21","stage_classifiercode":"99-11","member_number":"TY125350","first_name":"EDWIN","last_name":"DE LEON","classification":"D","division":"PCC","hit_factor":5.1233},{"match_name":"North Mountain PS April","match_date":"2016-04-15","stage_classifiercode":"99-11","member_number":"\"\"","first_name":"JOHN","last_name":"NORTON MILES","classification":"U","division":"PCC","hit_factor":5.1142},{"match_name":"Free State PCC Match 8-29","match_date":"2020-08-29","stage_classifiercode":"99-11","member_number":"TY97338","first_name":"SHAWN","last_name":"VADNAIS","classification":"C","division":"PCC","hit_factor":5.1088},{"match_name":"FSA USPSA 12/16/2018 WI 22","match_date":"2018-12-16","stage_classifiercode":"99-11","member_number":"A97671","first_name":"MIKE","last_name":"EYGENDAAL","classification":"B","division":"PCC","hit_factor":5.1084},{"match_name":"ARPC USPSA Match 5-27-18","match_date":"2018-05-27","stage_classifiercode":"99-11","member_number":"TY83599","first_name":"TIM","last_name":"OELKLAUS","classification":"C","division":"PCC","hit_factor":5.102},{"match_name":"IN19 ACC USPSA September 23","match_date":"2018-09-23","stage_classifiercode":"99-11","member_number":"TY93659","first_name":"CRAIG","last_name":"LEHMAN","classification":"U","division":"PCC","hit_factor":5.1011},{"match_name":"RangeMasters 5-31-2018","match_date":"2018-05-31","stage_classifiercode":"99-11","member_number":"A97357","first_name":"JIM","last_name":"DIECKOW","classification":"D","division":"PCC","hit_factor":5.0992},{"match_name":"CCPL 12102017","match_date":"2017-12-08","stage_classifiercode":"99-11","member_number":"\"\"","first_name":"JIMMY","last_name":"CHINN","classification":"U","division":"PCC","hit_factor":5.0847},{"match_name":"MS06 Team Magnolia February 2018 USPSA Match","match_date":"2018-02-03","stage_classifiercode":"99-11","member_number":"A80843","first_name":"T.C.","last_name":"TRICHEL","classification":"U","division":"PCC","hit_factor":5.0847},{"match_name":"HSC USPSA May 5th 2018","match_date":"2018-05-05","stage_classifiercode":"99-11","member_number":"L3045","first_name":"DOUG","last_name":"SESTOCK","classification":"U","division":"PCC","hit_factor":5.0813},{"match_name":"MPPL 11042018 Hoser Heaven","match_date":"2018-11-04","stage_classifiercode":"99-11","member_number":"A85841","first_name":"KIT","last_name":"YIU","classification":"U","division":"PCC","hit_factor":5.0804},{"match_name":"Bailey's March 2020","match_date":"2020-03-03","stage_classifiercode":"99-11","member_number":"TY13721","first_name":"BILL","last_name":"HUNTER","classification":"C","division":"PCC","hit_factor":5.0794},{"match_name":"CRC/SVPS AUGUST  2018","match_date":"2018-08-17","stage_classifiercode":"99-11","member_number":"TY46397","first_name":"TIMOTHY","last_name":"MCSHEEHY","classification":"D","division":"PCC","hit_factor":5.0781},{"match_name":"Applied IN25 USPSA January 17th 2018","match_date":"2018-01-17","stage_classifiercode":"99-11","member_number":"A-101157","first_name":"LEIF","last_name":"OBRIEN","classification":"U","division":"PCC","hit_factor":5.0771},{"match_name":"USPSA MO21 2Alpha SBRC March 2018","match_date":"2018-03-24","stage_classifiercode":"99-11","member_number":"TY73021","first_name":"LEON","last_name":"GREGSTON","classification":"C","division":"PCC","hit_factor":5.0752},{"match_name":"AAPS AAFG Level 1 Match - May 5 2018","match_date":"2018-05-05","stage_classifiercode":"99-11","member_number":"A109337","first_name":"ZACKERY","last_name":"CRESPO","classification":"D","division":"PCC","hit_factor":5.0704},{"match_name":"RCPS USPSA March 10","match_date":"2018-03-10","stage_classifiercode":"99-11","member_number":"TY46885","first_name":"WAYNE","last_name":"BECKER","classification":"D","division":"PCC","hit_factor":5.0691},{"match_name":"Castlewood USPSA Sept 2020 shoot","match_date":"2020-09-26","stage_classifiercode":"99-11","member_number":"A46243","first_name":"JEFFW","last_name":"WOLFE","classification":"M","division":"PCC","hit_factor":5.0633},{"match_name":"SUPS USPSA 20-21 October 2018","match_date":"2018-10-20","stage_classifiercode":"99-11","member_number":"\"\"","first_name":"ROGER","last_name":"HOLDMAN","classification":"U","division":"PCC","hit_factor":5.058},{"match_name":"Bossier Parish Practical Shooters August 16 2020","match_date":"2020-08-16","stage_classifiercode":"99-11","member_number":"A129971","first_name":"ADEN","last_name":"MONTOYA","classification":"U","division":"PCC","hit_factor":5.0548},{"match_name":"SKSC USPSA April 2018 Match","match_date":"2018-04-21","stage_classifiercode":"99-11","member_number":"TY78136","first_name":"MICAH","last_name":"DOUBLESTEIN","classification":"C","division":"PCC","hit_factor":5.0493},{"match_name":"GTS WY02 USPSA Special Classifier","match_date":"2017-07-08","stage_classifiercode":"99-11","member_number":"A104520","first_name":"LEE","last_name":"WILSON","classification":"U","division":"PCC","hit_factor":5.0493},{"match_name":"Pardoe Sportsmens Association-WPA14-2017-10-01","match_date":"2017-10-01","stage_classifiercode":"99-11","member_number":"\"\"","first_name":"DAVE","last_name":"PALAKOVICH","classification":"\"\"","division":"PCC","hit_factor":5.0467},{"match_name":"Grandbaggers August 2017","match_date":"2017-08-03","stage_classifiercode":"99-11","member_number":"TY80124","first_name":"MATT","last_name":"MISINO","classification":"U","division":"PCC","hit_factor":5.0441},{"match_name":"SLPSA July USPSA match","match_date":"2018-07-21","stage_classifiercode":"99-11","member_number":"A104870","first_name":"ANDY","last_name":"ARNN","classification":"U","division":"PCC","hit_factor":5.0391},{"match_name":"USPSA MO21 2Alpha SBRC Classifier 2016","match_date":"2016-11-26","stage_classifiercode":"99-11","member_number":"L2880","first_name":"ANDREW","last_name":"BARKSDALE","classification":"U","division":"PCC","hit_factor":5.0269},{"match_name":"Blackstone Shooting Sports Snow Days January 2017 USPSA Level  1","match_date":"2017-01-08","stage_classifiercode":"99-11","member_number":"A88500","first_name":"ADAM","last_name":"DAVINO","classification":"C","division":"PCC","hit_factor":5.0224},{"match_name":"Campeonato USPSA 2020","match_date":"2020-05-30","stage_classifiercode":"99-11","member_number":"F123075","first_name":"JORGE","last_name":"CRUZ-FLORES","classification":"C","division":"PCC","hit_factor":5.0171},{"match_name":"CRCPS 2020-08-08","match_date":"2020-08-08","stage_classifiercode":"99-11","member_number":"A129706","first_name":"SEAN","last_name":"HEWITT","classification":"U","division":"PCC","hit_factor":5.005},{"match_name":"IOP Rifle And Pistol Club USPSA Match March 2020","match_date":"2020-03-01","stage_classifiercode":"99-11","member_number":"Life 1936","first_name":"AL","last_name":"NIELSEN","classification":"C","division":"PCC","hit_factor":5.0046},{"match_name":"Rio Salado RSPP 3rd Saturday February 2020","match_date":"2020-02-15","stage_classifiercode":"99-11","member_number":"TY89813","first_name":"GARY","last_name":"SIELER","classification":"U","division":"PCC","hit_factor":5},{"match_name":"G2G Practical Shooters 10-16-2018","match_date":"2018-10-16","stage_classifiercode":"99-11","member_number":"A114636","first_name":"JIM","last_name":"HAVENS","classification":"U","division":"PCC","hit_factor":4.9914},{"match_name":"Richmond Hot Shots April 14-15-2018 USPSA Pistol Match","match_date":"2018-04-14","stage_classifiercode":"99-11","member_number":"\"\"","first_name":"AARON","last_name":"RUI","classification":"U","division":"PCC","hit_factor":4.9889},{"match_name":"ORPCI USPSA Friday 2021.07.16","match_date":"2021-07-16","stage_classifiercode":"99-11","member_number":"A37756","first_name":"BILL","last_name":"WALKER","classification":"","division":"PCC","hit_factor":4.9875},{"match_name":"Brazosland Pistoleros August 20 2017","match_date":"2017-08-20","stage_classifiercode":"99-11","member_number":"TY3880","first_name":"BILL","last_name":"MURRAY","classification":"A","division":"PCC","hit_factor":4.9801},{"match_name":"OFGC Practical Pistol Match 01-19-2020","match_date":"2020-01-19","stage_classifiercode":"99-11","member_number":"TY70040","first_name":"BEN","last_name":"TERBIETEN","classification":"U","division":"PCC","hit_factor":4.97},{"match_name":"SFPC Aug 8 2021 USPSA Classifier match","match_date":"2021-08-08","stage_classifiercode":"99-11","member_number":"A132163","first_name":"JANELY","last_name":"LOPEZ","classification":"U","division":"PCC","hit_factor":4.9689},{"match_name":"Brazosland Pistoleros August 20 2017","match_date":"2017-08-20","stage_classifiercode":"99-11","member_number":"TY97196","first_name":"DALE","last_name":"HAMM","classification":"U","division":"PCC","hit_factor":4.9658},{"match_name":"SMPS USPSA Match - May 8th 2021 (Note this is a Saturday Match)","match_date":"2021-05-08","stage_classifiercode":"99-11","member_number":"TY61811","first_name":"JARED","last_name":"WOOD","classification":"C","division":"PCC","hit_factor":4.9628},{"match_name":"Pardoe Sportsmens Association-WPA14-2017-10-01","match_date":"2017-10-01","stage_classifiercode":"99-11","member_number":"A90170","first_name":"JAMES","last_name":"REAGLE","classification":"X","division":"PCC","hit_factor":4.9618},{"match_name":"HPPS 1-16-2021","match_date":"2021-01-16","stage_classifiercode":"99-11","member_number":"A104773","first_name":"MATT","last_name":"GALLANT","classification":"M","division":"PCC","hit_factor":4.9587},{"match_name":"WILLISTON PRACTICAL SHOOTERS CLUB","match_date":"2020-10-03","stage_classifiercode":"99-11","member_number":"TY46072","first_name":"BOB","last_name":"GOSSELIN","classification":"C","division":"PCC","hit_factor":4.9541},{"match_name":"OFGC Practical Pistol Match 01-19-2020","match_date":"2020-01-19","stage_classifiercode":"99-11","member_number":"A117129","first_name":"EITAN","last_name":"GROSS","classification":"C","division":"PCC","hit_factor":4.9496},{"match_name":"SFPC Oct 3 2021   USPSA Monthly Match","match_date":"2021-10-03","stage_classifiercode":"99-11","member_number":"TY101923","first_name":"CHRISTINA","last_name":"BAKER","classification":"B","division":"PCC","hit_factor":4.9459},{"match_name":"Lefthanders Gun Club Practical Shooters October","match_date":"2017-09-30","stage_classifiercode":"99-11","member_number":"FY59095","first_name":"SHELBY","last_name":"STOCKTON","classification":"U","division":"PCC","hit_factor":4.9451},{"match_name":"Wvpps Nov. 2016","match_date":"2016-11-20","stage_classifiercode":"99-11","member_number":"FY28709","first_name":"GARY","last_name":"CHANEY","classification":"U","division":"PCC","hit_factor":4.9438},{"match_name":"Brothers N Arms September 2017 USPSA Match","match_date":"2017-09-16","stage_classifiercode":"99-11","member_number":"A96287","first_name":"NICK","last_name":"BRANDT","classification":"U","division":"PCC","hit_factor":4.9426},{"match_name":"GFDS 2021 POSTAL MATCH at 17s PSC ","match_date":"2021-10-16","stage_classifiercode":"99-11","member_number":"A125897","first_name":"KELVIN","last_name":"MELARA","classification":"C","division":"PCC","hit_factor":4.9383},{"match_name":"Grandbaggers August 2017","match_date":"2017-08-03","stage_classifiercode":"99-11","member_number":"L2842","first_name":"PAUL","last_name":"CAUDILL","classification":"A","division":"PCC","hit_factor":4.9336},{"match_name":"CCPL May  Day Match","match_date":"2021-05-23","stage_classifiercode":"99-11","member_number":"A65481","first_name":"KEVIN","last_name":"DORAN","classification":"C","division":"PCC","hit_factor":4.9327},{"match_name":"Wvpps Nov. 2017","match_date":"2017-11-19","stage_classifiercode":"99-11","member_number":"TY17278","first_name":"STEVEN","last_name":"WRIGHT","classification":"B","division":"PCC","hit_factor":4.9303},{"match_name":"Richmond Hot Shots April 14-15-2018 USPSA Pistol Match","match_date":"2018-04-14","stage_classifiercode":"99-11","member_number":"TY83559","first_name":"JOHN","last_name":"DANPOUR","classification":"D","division":"PCC","hit_factor":4.9225},{"match_name":"IOP Rifle And Pistol Club USPSA Match March 2020","match_date":"2020-03-01","stage_classifiercode":"99-11","member_number":"A100305","first_name":"CASEY","last_name":"HUDSON","classification":"C","division":"PCC","hit_factor":4.9223},{"match_name":"RBGC 2017-06-24","match_date":"2017-06-24","stage_classifiercode":"99-11","member_number":"TY73586","first_name":"MIKE","last_name":"CURRIER","classification":"A","division":"PCC","hit_factor":4.9213},{"match_name":"PRG 2017 Classifier Match","match_date":"2017-02-19","stage_classifiercode":"99-11","member_number":"L3950","first_name":"BO","last_name":"WANG","classification":"U","division":"PCC","hit_factor":4.9206},{"match_name":"LCSC Linden USPSA 092621","match_date":"2021-09-25","stage_classifiercode":"99-11","member_number":"A114231","first_name":"ROGELIO","last_name":"SURBAN","classification":"C","division":"PCC","hit_factor":4.9153},{"match_name":"PRG 2017 Classifier Match","match_date":"2017-02-19","stage_classifiercode":"99-11","member_number":"A91972","first_name":"TOM","last_name":"HAGAN","classification":"U","division":"PCC","hit_factor":4.9136},{"match_name":"Winter League # 6","match_date":"2018-01-05","stage_classifiercode":"99-11","member_number":"TY100432","first_name":"ROB","last_name":"SCARR","classification":"U","division":"PCC","hit_factor":4.913},{"match_name":"ORSA USPSA October 2017","match_date":"2017-10-21","stage_classifiercode":"99-11","member_number":"A28682","first_name":"DAN","last_name":"FOWLER","classification":"C","division":"PCC","hit_factor":4.9123},{"match_name":"2018-05 Bone Creek USPSA","match_date":"2018-05-06","stage_classifiercode":"99-11","member_number":"FY36467","first_name":"JAMES","last_name":"POPE","classification":"B","division":"PCC","hit_factor":4.91},{"match_name":"OFGC USPSA Match Feb 19th 2017","match_date":"2017-02-19","stage_classifiercode":"99-11","member_number":"\"\"","first_name":"HANEESH","last_name":"BAGGA","classification":"U","division":"PCC","hit_factor":4.908},{"match_name":"TPS USPSA at CMP March 18 2017","match_date":"2017-03-18","stage_classifiercode":"99-11","member_number":"A100076","first_name":"MIKE","last_name":"CAMERON","classification":"U","division":"PCC","hit_factor":4.9028},{"match_name":"SSS USPSA February 2020","match_date":"2020-02-16","stage_classifiercode":"99-11","member_number":"A119168","first_name":"MIKE","last_name":"SMYTH","classification":"U (Unclassified)","division":"PCC","hit_factor":4.8945},{"match_name":"GRB JAN USPSA  at Cav","match_date":"2017-01-21","stage_classifiercode":"99-11","member_number":"A66709","first_name":"LARRY","last_name":"BLACKMON","classification":"U","division":"PCC","hit_factor":4.878},{"match_name":"Free State PCC Match 8-29","match_date":"2020-08-29","stage_classifiercode":"99-11","member_number":"TY90190","first_name":"STEVEN","last_name":"BEHRENDS","classification":"D","division":"PCC","hit_factor":4.8701},{"match_name":"ETRPC-USPSA","match_date":"2021-03-27","stage_classifiercode":"99-11","member_number":"A53979","first_name":"PATTY","last_name":"HALL-TAYLOR","classification":"U","division":"PCC","hit_factor":4.8649},{"match_name":"ARPC USPSA Match 3-26-17","match_date":"2017-03-26","stage_classifiercode":"99-11","member_number":"PENDING","first_name":"DWIGHT","last_name":"WATSON","classification":"Unclassified","division":"PCC","hit_factor":4.8632},{"match_name":"Brazosland Pistoleros August 20 2017","match_date":"2017-08-20","stage_classifiercode":"99-11","member_number":"\"\"","first_name":"DOUGLAS","last_name":"CAMPBELL","classification":"U","division":"PCC","hit_factor":4.8536},{"match_name":"Deadwood Boys USPSA All Classifier Match","match_date":"2016-08-07","stage_classifiercode":"99-11","member_number":"A97059","first_name":"MICAH","last_name":"ULRICK","classification":"U","division":"PCC","hit_factor":4.8507},{"match_name":"HAS Classifier Match January 2020","match_date":"2020-01-15","stage_classifiercode":"99-11","member_number":"A112393","first_name":"LEON","last_name":"PIASECKI","classification":"U","division":"PCC","hit_factor":4.8495},{"match_name":"USPSA-Alberta 2018-01 Indoor Classifier 1","match_date":"2018-02-26","stage_classifiercode":"99-11","member_number":"F61754","first_name":"JERRY","last_name":"ALVAREZ","classification":"U","division":"PCC","hit_factor":4.8462},{"match_name":"Deadwood Boys USPSA All Classifier Match","match_date":"2016-08-07","stage_classifiercode":"99-11","member_number":"TY85661","first_name":"KEITH","last_name":"SORRELL","classification":"U","division":"PCC","hit_factor":4.8414},{"match_name":"Bgs Hudson Week 6","match_date":"2017-02-19","stage_classifiercode":"99-11","member_number":"TY57145","first_name":"DARREN","last_name":"CASTER","classification":"U","division":"PCC","hit_factor":4.8387},{"match_name":"Brazosland Pistoleros August 20 2017","match_date":"2017-08-20","stage_classifiercode":"99-11","member_number":"A77442","first_name":"MARY","last_name":"DUBUISSON","classification":"C","division":"PCC","hit_factor":4.8372},{"match_name":"SFPC Aug 8 2021 USPSA Classifier match","match_date":"2021-08-08","stage_classifiercode":"99-11","member_number":"A131398","first_name":"CINDY","last_name":"LI","classification":"U","division":"PCC","hit_factor":4.837},{"match_name":"WPGC 8-7-2017","match_date":"2017-08-07","stage_classifiercode":"99-11","member_number":"TY84020","first_name":"RICK","last_name":"WALFORD","classification":"U","division":"PCC","hit_factor":4.8246},{"match_name":"Tidewater Practical Shooters February Match","match_date":"2020-02-17","stage_classifiercode":"99-11","member_number":"A112248","first_name":"AARON","last_name":"BUTSKO","classification":"B","division":"PCC","hit_factor":4.8212},{"match_name":"INAS May 2020 USPSA","match_date":"2020-05-09","stage_classifiercode":"99-11","member_number":"TY69078","first_name":"LORI","last_name":"COOK","classification":"","division":"PCC","hit_factor":4.8148},{"match_name":"CCC Shooting Complex November 2017","match_date":"2017-11-05","stage_classifiercode":"99-11","member_number":"\"\"","first_name":"BOB","last_name":"BUCKBEE","classification":"U","division":"PCC","hit_factor":4.8069},{"match_name":"GRB JAN USPSA  at Cav","match_date":"2017-01-21","stage_classifiercode":"99-11","member_number":"L3413","first_name":"CLAY","last_name":"KLEMM","classification":"U","division":"PCC","hit_factor":4.8013},{"match_name":"USPSA MO21 2Alpha SBRC Classifier 2016","match_date":"2016-11-26","stage_classifiercode":"99-11","member_number":"L1536","first_name":"CRAIG","last_name":"NORDGREN","classification":"U","division":"PCC","hit_factor":4.7893},{"match_name":"Cactus USPSA ALL CLASSIFIER August 2020","match_date":"2020-08-02","stage_classifiercode":"99-11","member_number":"A102092","first_name":"MICHAEL","last_name":"COLANTONE","classification":"B","division":"PCC","hit_factor":4.7865},{"match_name":"SFPC Aug 8 2021 USPSA Classifier match","match_date":"2021-08-08","stage_classifiercode":"99-11","member_number":"A125066","first_name":"LEO","last_name":"GARCIA","classification":"C","division":"PCC","hit_factor":4.7863},{"match_name":"GWPP December 2020 Pistol","match_date":"2020-12-12","stage_classifiercode":"99-11","member_number":"TY13721","first_name":"BILL","last_name":"HUNTER","classification":"C","division":"PCC","hit_factor":4.7826},{"match_name":"Free State PCC Match 8-29","match_date":"2020-08-29","stage_classifiercode":"99-11","member_number":"A129273","first_name":"CHRIS","last_name":"PEEL","classification":"U","division":"PCC","hit_factor":4.7801},{"match_name":"Laser Ninja Dragon League USPSA July 2nd Special Classifier","match_date":"2017-07-02","stage_classifiercode":"99-11","member_number":"A100220","first_name":"MATTHEW","last_name":"ST. PIERRE","classification":"U","division":"PCC","hit_factor":4.7776},{"match_name":"RDS Dec 2nd 2017 USPSA Classifier Match","match_date":"2017-12-02","stage_classifiercode":"99-11","member_number":"A99663","first_name":"MIKE","last_name":"SPEAR","classification":"B","division":"PCC","hit_factor":4.7697},{"match_name":"Grandbaggers August 2017","match_date":"2017-08-03","stage_classifiercode":"99-11","member_number":"A90727","first_name":"DANYELA","last_name":"D'ANGELO","classification":"B","division":"PCC","hit_factor":4.7676},{"match_name":"Laser Ninja Dragon League USPSA July 2nd Special Classifier","match_date":"2017-07-02","stage_classifiercode":"99-11","member_number":"A104287","first_name":"ALLEN","last_name":"SMITH","classification":"U","division":"PCC","hit_factor":4.7668},{"match_name":"ENPS 2018 June USPSA Match","match_date":"2018-06-03","stage_classifiercode":"99-11","member_number":"PEN","first_name":"ALLEN","last_name":"MCCREA","classification":"U","division":"PCC","hit_factor":4.7661},{"match_name":"NCPS USPSA Handgun Match June 24 2018","match_date":"2018-06-24","stage_classifiercode":"99-11","member_number":"TY87896","first_name":"JOSEPH","last_name":"MAGBITANG","classification":"C","division":"PCC","hit_factor":4.7619},{"match_name":"MS06 Team Magnolia June 2017 USPSA Match","match_date":"2017-06-04","stage_classifiercode":"99-11","member_number":"TY70489","first_name":"RICK","last_name":"KWACZ","classification":"U","division":"PCC","hit_factor":4.7581},{"match_name":"Devil Dog USPSA Classifier Match-Saturday Session","match_date":"2018-03-10","stage_classifiercode":"99-11","member_number":"A109463","first_name":"MAX","last_name":"SEDA","classification":"U","division":"PCC","hit_factor":4.7544},{"match_name":"USPSA MO21 2Alpha SBRC October 2017","match_date":"2017-10-21","stage_classifiercode":"99-11","member_number":"A22632","first_name":"WILLIAM","last_name":"YEP","classification":"U","division":"PCC","hit_factor":4.7478},{"match_name":"HSC USPSA May 5th 2018","match_date":"2018-05-05","stage_classifiercode":"99-11","member_number":"ty77032","first_name":"TYLER","last_name":"COKE","classification":"U","division":"PCC","hit_factor":4.7441},{"match_name":"Tidewater Practical Shooters February Match","match_date":"2020-02-17","stage_classifiercode":"99-11","member_number":"TY121363","first_name":"DAVID","last_name":"EKKER","classification":"U","division":"PCC","hit_factor":4.7431},{"match_name":"NW01 Paul Bunyan CS Series May 9 2021","match_date":"2021-05-09","stage_classifiercode":"99-11","member_number":"FY77755","first_name":"PASCUAL (LITO)","last_name":"SERIO","classification":"D","division":"PCC","hit_factor":4.7359},{"match_name":"SLPSA July USPSA match","match_date":"2018-07-21","stage_classifiercode":"99-11","member_number":"L4146","first_name":"CAREY","last_name":"PALMER","classification":"A","division":"PCC","hit_factor":4.7244},{"match_name":"Richmond Hot Shots April 30-May 1st USPSA Pistol Match","match_date":"2016-04-30","stage_classifiercode":"99-11","member_number":"TY-83559","first_name":"JOHN","last_name":"DANPOUR","classification":"U","division":"PCC","hit_factor":4.7162},{"match_name":"CASA USPSA December 3  2017","match_date":"2017-12-03","stage_classifiercode":"99-11","member_number":"TY53176","first_name":"BARRY","last_name":"ROBINSON","classification":"U","division":"PCC","hit_factor":4.7043},{"match_name":"TriggerGuard USPSA","match_date":"2017-05-06","stage_classifiercode":"99-11","member_number":"A89295","first_name":"CHASE","last_name":"FARKAS","classification":"U","division":"PCC","hit_factor":4.7037},{"match_name":"LPRGC - Lower Providence USPSA Match November 2021","match_date":"2021-11-06","stage_classifiercode":"99-11","member_number":"TY106069","first_name":"ERNESTO","last_name":"FIGUEROA","classification":"U","division":"PCC","hit_factor":4.7013},{"match_name":"HAS Classifier Match January 2020","match_date":"2020-01-15","stage_classifiercode":"99-11","member_number":"A96968","first_name":"AARON","last_name":"PACYNA","classification":"\"\"","division":"PCC","hit_factor":4.6931},{"match_name":"ARPC USPSA Match 8-23-20","match_date":"2020-08-23","stage_classifiercode":"99-11","member_number":"L3904","first_name":"ROBERT","last_name":"RUMBLEY","classification":"C","division":"PCC","hit_factor":4.6901},{"match_name":"PRG 2017 Classifier Match","match_date":"2017-02-19","stage_classifiercode":"99-11","member_number":"TY88518","first_name":"MICHAEL","last_name":"IBARRA","classification":"U","division":"PCC","hit_factor":4.6889},{"match_name":"Richmond Hot Shots October 6-7 USPSA Pistol Match","match_date":"2018-10-06","stage_classifiercode":"99-11","member_number":"TY99745","first_name":"JONATHAN","last_name":"OWYANG","classification":"M","division":"PCC","hit_factor":4.6814},{"match_name":"ORPCI USPSA Saturday 2021.07.17","match_date":"2021-07-17","stage_classifiercode":"99-11","member_number":"TY54870","first_name":"JEFF","last_name":"RUSSEL","classification":"","division":"PCC","hit_factor":4.6794},{"match_name":"SKSC USPSA April 2018 Match","match_date":"2018-04-21","stage_classifiercode":"99-11","member_number":"A109117","first_name":"BEN","last_name":"HARRINGTON","classification":"U","division":"PCC","hit_factor":4.6784},{"match_name":"Extreme GM","match_date":"2020-06-12","stage_classifiercode":"99-11","member_number":"A111011","first_name":"RANDZFLO","last_name":"FLORES","classification":"C","division":"PCC","hit_factor":4.6719},{"match_name":"USPSA MO21 2Alpha SBRC March 2018","match_date":"2018-03-24","stage_classifiercode":"99-11","member_number":"A90763","first_name":"DIANE","last_name":"MCCOY","classification":"C","division":"PCC","hit_factor":4.6706},{"match_name":"SLPSA August USPSA Match 2","match_date":"2020-08-15","stage_classifiercode":"99-11","member_number":"FY81047","first_name":"JIM","last_name":"LARSON","classification":"U","division":"PCC","hit_factor":4.6693},{"match_name":"Wvpps Nov. 2017","match_date":"2017-11-19","stage_classifiercode":"99-11","member_number":"TY69656","first_name":"JEFF","last_name":"STRAUCH","classification":"D","division":"PCC","hit_factor":4.6632},{"match_name":"Omaha Gun Club USPSA February 28th 2018","match_date":"2018-03-01","stage_classifiercode":"99-11","member_number":"TY46397","first_name":"TIMOTHY","last_name":"MCSHEEHY","classification":"U","division":"PCC","hit_factor":4.6628},{"match_name":"Blackstone Shooting Sports Snow Days January 2017 USPSA Level  1","match_date":"2017-01-08","stage_classifiercode":"99-11","member_number":"a98352","first_name":"WILL","last_name":"COATS","classification":"U","division":"PCC","hit_factor":4.6602},{"match_name":"Crooked Creek Pistol League - June 2017","match_date":"2017-06-24","stage_classifiercode":"99-11","member_number":"\"\"","first_name":"JACK","last_name":"JAUCH","classification":"U","division":"PCC","hit_factor":4.655},{"match_name":"Coyote USPSA match 4-21-18","match_date":"2018-04-21","stage_classifiercode":"99-11","member_number":"L4452","first_name":"JUSTIN","last_name":"CORONA","classification":"A","division":"PCC","hit_factor":4.6407},{"match_name":"Target  Sports Central Indiana Championship","match_date":"2020-08-22","stage_classifiercode":"99-11","member_number":"TY103337","first_name":"JAMES","last_name":"SCHNEIDER","classification":"B","division":"PCC","hit_factor":4.6377},{"match_name":"Coyote USPSA match 4-21-18","match_date":"2018-04-21","stage_classifiercode":"99-11","member_number":"A104864","first_name":"DINA","last_name":"TUNBERG","classification":"C","division":"PCC","hit_factor":4.6346},{"match_name":"Rankin Field June Sunday USPSA","match_date":"2020-06-21","stage_classifiercode":"99-11","member_number":"FY7035","first_name":"BILL","last_name":"LUPER","classification":"A","division":"PCC","hit_factor":4.6185},{"match_name":"2017 Bay bridge Charity Classic - Richmond October 14-15-2017","match_date":"2017-10-14","stage_classifiercode":"99-11","member_number":"TY98176","first_name":"TERI","last_name":"DEMMON","classification":"U","division":"PCC","hit_factor":4.6154},{"match_name":"Springfield Tactical Shooters 04/05/2018","match_date":"2018-04-05","stage_classifiercode":"99-11","member_number":"\"\"","first_name":"RICK","last_name":"WENNEBORG","classification":"\"\"","division":"PCC","hit_factor":4.6142},{"match_name":"APSC 4th Annual Holiday Hosefest USPSA Match 12-02-17","match_date":"2017-12-02","stage_classifiercode":"99-11","member_number":"A28015","first_name":"BRENT","last_name":"CAMPBELL","classification":"A","division":"PCC","hit_factor":4.6129},{"match_name":"PRG - Oh Shoot USPSA February 21st - 3rd Sunday Match","match_date":"2021-02-21","stage_classifiercode":"99-11","member_number":"A68860","first_name":"DAVID ALLAN","last_name":"CHUA","classification":"U","division":"PCC","hit_factor":4.5957},{"match_name":"HSC USPSA May 5th 2018","match_date":"2018-05-05","stage_classifiercode":"99-11","member_number":"L1063","first_name":"CHUCK","last_name":"BROOKS","classification":"A","division":"PCC","hit_factor":4.5949},{"match_name":"Deadwood Boys USPSA All Classifier Match - 29 July 2018","match_date":"2018-07-29","stage_classifiercode":"99-11","member_number":"A110876","first_name":"MIKE","last_name":"NGUYEN","classification":"U","division":"PCC","hit_factor":4.5946},{"match_name":"LA05 Tangi June USPSA 2020","match_date":"2020-06-28","stage_classifiercode":"99-11","member_number":"A123903","first_name":"DAVID","last_name":"GOOCH","classification":"U","division":"PCC","hit_factor":4.5922},{"match_name":"LCHG May USPSA","match_date":"2017-05-21","stage_classifiercode":"99-11","member_number":"PEN","first_name":"MARK","last_name":"JONES","classification":"U","division":"PCC","hit_factor":4.5771},{"match_name":"A Very 'Merica Match","match_date":"2018-07-05","stage_classifiercode":"99-11","member_number":"\"\"","first_name":"MACK","last_name":"KINSEY","classification":"U","division":"PCC","hit_factor":4.5724},{"match_name":"MPSA 070718 USPSA","match_date":"2018-07-07","stage_classifiercode":"99-11","member_number":"FY75736","first_name":"STEVE","last_name":"DELAGE","classification":"U","division":"PCC","hit_factor":4.562},{"match_name":"Rio Salado UPPL September 2020","match_date":"2020-09-13","stage_classifiercode":"99-11","member_number":"A30968","first_name":"BRUCE","last_name":"BALCOM","classification":"B","division":"PCC","hit_factor":4.5455},{"match_name":"WI21 June 24 2018 Points Match","match_date":"2018-06-06","stage_classifiercode":"99-11","member_number":"\"\"","first_name":"DOUGLAS","last_name":"GUSTAFSON","classification":"D","division":"PCC","hit_factor":4.5242},{"match_name":"CCC Shooting Complex November 2017","match_date":"2017-11-05","stage_classifiercode":"99-11","member_number":"\"\"","first_name":"CLINT","last_name":"DAVIS","classification":"U","division":"PCC","hit_factor":4.5198},{"match_name":"Richmond Hot Shots April 14-15-2018 USPSA Pistol Match","match_date":"2018-04-14","stage_classifiercode":"99-11","member_number":"FY61488","first_name":"ROBERT","last_name":"GERENA","classification":"C","division":"PCC","hit_factor":4.5153},{"match_name":"West Coast IPSC","match_date":"2018-07-22","stage_classifiercode":"99-11","member_number":"TY90077","first_name":"DOUGLAS","last_name":"PCC TELLEF","classification":"U","division":"PCC","hit_factor":4.5128},{"match_name":"Deadwood Boys USPSA All Classifier Match - 29 July 2018","match_date":"2018-07-29","stage_classifiercode":"99-11","member_number":"TY42673","first_name":"CHARLES","last_name":"CHURCH","classification":"U","division":"PCC","hit_factor":4.5126},{"match_name":"Free State PCC Match 8-29","match_date":"2020-08-29","stage_classifiercode":"99-11","member_number":"A123593","first_name":"JERRY","last_name":"CONNER","classification":"U","division":"PCC","hit_factor":4.5126},{"match_name":"Richmond Hot Shots April 14-15-2018 USPSA Pistol Match","match_date":"2018-04-14","stage_classifiercode":"99-11","member_number":"A107946","first_name":"DAVID","last_name":"WEST","classification":"C","division":"PCC","hit_factor":4.4898},{"match_name":"MPPL 08052018 Summer Fun","match_date":"2018-08-05","stage_classifiercode":"99-11","member_number":"A85841","first_name":"KIT","last_name":"YIU","classification":"C","division":"PCC","hit_factor":4.4818},{"match_name":"NPS  May Match","match_date":"2016-05-14","stage_classifiercode":"99-11","member_number":"\"\"","first_name":"H","last_name":"GREER","classification":"U","division":"PCC","hit_factor":4.4761},{"match_name":"LdF USPSA Match January 25 2020","match_date":"2020-01-25","stage_classifiercode":"99-11","member_number":"TY74058","first_name":"BRENT","last_name":"FOSTER","classification":"C","division":"PCC","hit_factor":4.4719},{"match_name":"ECPS USPSA 19 May 18","match_date":"2018-05-19","stage_classifiercode":"99-11","member_number":"\"\"","first_name":"JOHN","last_name":"WINTER","classification":"U","division":"PCC","hit_factor":4.461},{"match_name":"Springfield Tactical Shooters 05/06/2021","match_date":"2021-05-06","stage_classifiercode":"99-11","member_number":"FY83614","first_name":"GARY","last_name":"GRAY","classification":"B","division":"PCC","hit_factor":4.4601},{"match_name":"OFGC Practical Pistol Match 01-19-2020","match_date":"2020-01-19","stage_classifiercode":"99-11","member_number":"A107478","first_name":"TEAGAN","last_name":"MACON","classification":"C","division":"PCC","hit_factor":4.4578},{"match_name":"ECPS USPSA 19 May 18","match_date":"2018-05-19","stage_classifiercode":"99-11","member_number":"A92492","first_name":"TODD","last_name":"SEARS","classification":"U","division":"PCC","hit_factor":4.4543},{"match_name":"Sharp Practical Shooters November  USPSA - Indoor","match_date":"2021-11-28","stage_classifiercode":"99-11","member_number":"A121962","first_name":"KATIE","last_name":"NICOLINI","classification":"D","division":"PCC","hit_factor":4.4444},{"match_name":"SAPSA January 2020 Match","match_date":"2020-01-18","stage_classifiercode":"99-11","member_number":"A106054","first_name":"CHRIS","last_name":"FOWLER","classification":"M","division":"PCC","hit_factor":4.4408},{"match_name":"LIPSA  December 11th 2016 - USPSA Match","match_date":"2016-12-11","stage_classifiercode":"99-11","member_number":"TY76078","first_name":"NICK","last_name":"SCHILLACI","classification":"U","division":"PCC","hit_factor":4.4402},{"match_name":"ENPS 2018 June USPSA Match","match_date":"2018-06-03","stage_classifiercode":"99-11","member_number":"A92144","first_name":"DALTON","last_name":"BODEN","classification":"U","division":"PCC","hit_factor":4.4355},{"match_name":"BSPSC 2017 April Special Classifier","match_date":"2017-04-09","stage_classifiercode":"99-11","member_number":"B44","first_name":"SCOTT","last_name":"BAIR","classification":"U","division":"PCC","hit_factor":4.418},{"match_name":"CCC Shooting Complex October 2016","match_date":"2016-10-02","stage_classifiercode":"99-11","member_number":"TY58003","first_name":"BRIAN","last_name":"HAGEN","classification":"U","division":"PCC","hit_factor":4.417},{"match_name":"Laser Ninja Dragon League USPSA July 2nd Special Classifier","match_date":"2017-07-02","stage_classifiercode":"99-11","member_number":"a104280","first_name":"TIMOTHY","last_name":"SMITH","classification":"U","division":"PCC","hit_factor":4.4132},{"match_name":"Benton Gun Club-USPSA September 27","match_date":"2020-09-27","stage_classifiercode":"99-11","member_number":"A115055","first_name":"CHRIS","last_name":"DE NOBLE","classification":"B","division":"PCC","hit_factor":4.4104},{"match_name":"Brazosland Pistoleros USPSA - Sunday January 19th","match_date":"2020-01-19","stage_classifiercode":"99-11","member_number":"A98356","first_name":"CARL","last_name":"RUGG","classification":"D","division":"PCC","hit_factor":4.4094},{"match_name":"USPSA MO21 2Alpha SBRC March 2018","match_date":"2018-03-24","stage_classifiercode":"99-11","member_number":"L2880","first_name":"ANDREW","last_name":"BARKSDALE","classification":"B","division":"PCC","hit_factor":4.4017},{"match_name":"PRG - Oh Shoot USPSA February 21st - 3rd Sunday Match","match_date":"2021-02-21","stage_classifiercode":"99-11","member_number":"A101068","first_name":"KELLI","last_name":"MCKERNAN","classification":"D","division":"PCC","hit_factor":4.3974},{"match_name":"OFGC USPSA Match Feb 19th 2017","match_date":"2017-02-19","stage_classifiercode":"99-11","member_number":"FY42421","first_name":"DEBBY","last_name":"PANKRATZ","classification":"U","division":"PCC","hit_factor":4.3906},{"match_name":"June 2018 CAS USPSA","match_date":"2018-06-03","stage_classifiercode":"99-11","member_number":"A101017","first_name":"LANNY","last_name":"RUSSELL","classification":"C","division":"PCC","hit_factor":4.3893},{"match_name":"Rio Salado UPPL September 2020","match_date":"2020-09-13","stage_classifiercode":"99-11","member_number":"A47027","first_name":"JACK","last_name":"JOHNSTON","classification":"C","division":"PCC","hit_factor":4.384},{"match_name":"Firing Line Classifier","match_date":"2018-01-26","stage_classifiercode":"99-11","member_number":"A102438","first_name":"NEIL","last_name":"BRUCHU","classification":"U","division":"PCC","hit_factor":4.3831},{"match_name":"BPSA January 2017 USPSA","match_date":"2017-01-22","stage_classifiercode":"99-11","member_number":"A99640","first_name":"TREY","last_name":"NICHOLSON","classification":"U","division":"PCC","hit_factor":4.37},{"match_name":"Coyote USPSA match 4-21-18","match_date":"2018-04-21","stage_classifiercode":"99-11","member_number":"A109595","first_name":"TIMOTHY","last_name":"GUERRERO","classification":"U","division":"PCC","hit_factor":4.3668},{"match_name":"Grandbaggers August 2017","match_date":"2017-08-03","stage_classifiercode":"99-11","member_number":"TY65813","first_name":"JOE","last_name":"HANNIS","classification":"D","division":"PCC","hit_factor":4.3573},{"match_name":"Castlewood USPSA Sept 2020 shoot","match_date":"2020-09-26","stage_classifiercode":"99-11","member_number":"L-1919","first_name":"WILLIAM","last_name":"TRACY","classification":"U","division":"PCC","hit_factor":4.3516},{"match_name":"Extreme GM","match_date":"2020-06-12","stage_classifiercode":"99-11","member_number":"A102166","first_name":"MICHAEL","last_name":"GEE","classification":"B","division":"PCC","hit_factor":4.3408},{"match_name":"Hallstead July 18th PCC","match_date":"2020-07-18","stage_classifiercode":"99-11","member_number":"A117393","first_name":"THOMAS","last_name":"KUTZ","classification":"U","division":"PCC","hit_factor":4.336},{"match_name":"Benton Gun Club-USPSA May27 2018 CLASIFIER","match_date":"2018-05-27","stage_classifiercode":"99-11","member_number":"ty67885","first_name":"TED","last_name":"SMETHERS","classification":"U","division":"PCC","hit_factor":4.3251},{"match_name":"LdF USPSA Match January 25 2020","match_date":"2020-01-25","stage_classifiercode":"99-11","member_number":"A81018","first_name":"BART","last_name":"DEL RIO","classification":"A","division":"PCC","hit_factor":4.3243},{"match_name":"HSC USPSA May 5th 2018","match_date":"2018-05-05","stage_classifiercode":"99-11","member_number":"A109559","first_name":"JOE","last_name":"CARO","classification":"U","division":"PCC","hit_factor":4.32},{"match_name":"November 2016 PCSI USPSA Monster Match","match_date":"2016-11-05","stage_classifiercode":"99-11","member_number":"\"\"","first_name":"MATT","last_name":"WUNDERLE","classification":"U","division":"PCC","hit_factor":4.3147},{"match_name":"SKSC USPSA April 2018 Match","match_date":"2018-04-21","stage_classifiercode":"99-11","member_number":"TY13544","first_name":"EUGENE","last_name":"VANTLUKA","classification":"\"\"","division":"PCC","hit_factor":4.3131},{"match_name":"NCPS USPSA Handgun Match June 24 2018","match_date":"2018-06-24","stage_classifiercode":"99-11","member_number":"TY5906","first_name":"JOHN","last_name":"HARTSOCK","classification":"U","division":"PCC","hit_factor":4.3044},{"match_name":"USPSA MO21 2Alpha SBRC Classifier 2016","match_date":"2016-11-26","stage_classifiercode":"99-11","member_number":"TY-94217","first_name":"DUSTIN","last_name":"CHAMBERLAIN","classification":"U","division":"PCC","hit_factor":4.2994},{"match_name":"CSA Coalfield Shooters Association USPSA March 2020","match_date":"2020-03-08","stage_classifiercode":"99-11","member_number":"TY126000","first_name":"LARRY","last_name":"PARSONS","classification":"\"\"","division":"PCC","hit_factor":4.2899},{"match_name":"HAS Classifier Match January 2020","match_date":"2020-01-15","stage_classifiercode":"99-11","member_number":"ty49725","first_name":"DAN","last_name":"GRECOE","classification":"U","division":"PCC","hit_factor":4.2857},{"match_name":"Deadwood Boys USPSA All Classifier Match - 29 July 2018","match_date":"2018-07-29","stage_classifiercode":"99-11","member_number":"A100144","first_name":"DEREK","last_name":"HAMILTON","classification":"U","division":"PCC","hit_factor":4.2843},{"match_name":"2017 Bay bridge Charity Classic - Richmond October 14-15-2017","match_date":"2017-10-14","stage_classifiercode":"99-11","member_number":"A104089","first_name":"BASIL","last_name":"GRACE","classification":"U","division":"PCC","hit_factor":4.2831},{"match_name":"GRB JAN USPSA  at Cav","match_date":"2017-01-21","stage_classifiercode":"99-11","member_number":"A82588","first_name":"JUDY","last_name":"MCFARLAND","classification":"U","division":"PCC","hit_factor":4.2755},{"match_name":"USPSA MO21 2Alpha SBRC March 2018","match_date":"2018-03-24","stage_classifiercode":"99-11","member_number":"A99328","first_name":"ED","last_name":"WILSON","classification":"C","division":"PCC","hit_factor":4.2735},{"match_name":"NVSA USPSA 1811","match_date":"2018-11-04","stage_classifiercode":"99-11","member_number":"\"\"","first_name":"ROBERT","last_name":"MCCONNELL","classification":"U","division":"PCC","hit_factor":4.2705},{"match_name":"SLPSA July USPSA match","match_date":"2018-07-21","stage_classifiercode":"99-11","member_number":"A111471","first_name":"KEEGAN","last_name":"TODD","classification":"U","division":"PCC","hit_factor":4.2688},{"match_name":"Benton Gun Club-USPSA May27 2018 CLASIFIER","match_date":"2018-05-27","stage_classifiercode":"99-11","member_number":"FY90735","first_name":"STEPHEN","last_name":"FITZSIMMONS","classification":"U","division":"PCC","hit_factor":4.2623},{"match_name":"USPSA MO21 2Alpha SBRC Classifier 2016","match_date":"2016-11-26","stage_classifiercode":"99-11","member_number":"A50973","first_name":"DAVE","last_name":"WILSON","classification":"U","division":"PCC","hit_factor":4.2521},{"match_name":"Steel City USPSA December 2 2017","match_date":"2017-12-02","stage_classifiercode":"99-11","member_number":"A96891","first_name":"GEORGE","last_name":"MORRIS","classification":"U","division":"PCC","hit_factor":4.2491},{"match_name":"WSRC USPSA 11/19/2017","match_date":"2017-11-19","stage_classifiercode":"99-11","member_number":"TY-103831","first_name":"DUSTIN","last_name":"PLUTH","classification":"U","division":"PCC","hit_factor":4.236},{"match_name":"Afternoon SMPS 09 February 2020 USPSA Classifier Match","match_date":"2020-02-09","stage_classifiercode":"99-11","member_number":"A125495","first_name":"DERRICK","last_name":"WEAVER","classification":"U","division":"PCC","hit_factor":4.2336},{"match_name":"Benton Gun Club-USPSA April 25","match_date":"2021-04-25","stage_classifiercode":"99-11","member_number":"a56013","first_name":"RUSTY","last_name":"HUBBARD","classification":"A","division":"PCC","hit_factor":4.2301},{"match_name":"Custer USPSA Mar 7th 2021","match_date":"2021-03-07","stage_classifiercode":"99-11","member_number":"FY76563","first_name":"SORIDA","last_name":"EAP","classification":"U","division":"PCC","hit_factor":4.2279},{"match_name":"MS06 Team Magnolia June 2017 USPSA Match","match_date":"2017-06-04","stage_classifiercode":"99-11","member_number":"\"\"","first_name":"PAUL","last_name":"GARRISON","classification":"U","division":"PCC","hit_factor":4.2155},{"match_name":"RISE INDOOR CLASSIFIER","match_date":"2018-12-15","stage_classifiercode":"99-11","member_number":"A46464","first_name":"NICHOLAS","last_name":"PERRICELLI","classification":"U","division":"PCC","hit_factor":4.2155},{"match_name":"ARPC USPSA Match 8-23-20","match_date":"2020-08-23","stage_classifiercode":"99-11","member_number":"TY95198","first_name":"RAY","last_name":"YORK","classification":"Unclassified","division":"PCC","hit_factor":4.2056},{"match_name":"CSA Coalfield Shooters Association USPSA March 2020","match_date":"2020-03-08","stage_classifiercode":"99-11","member_number":"TY126000","first_name":"LARRY","last_name":"PARSONS","classification":"\"\"","division":"PCC","hit_factor":4.2046},{"match_name":"Custer USPSA Mar 7th 2021","match_date":"2021-03-07","stage_classifiercode":"99-11","member_number":"A110099","first_name":"HAROLD","last_name":"MARTINEZ","classification":"U","division":"PCC","hit_factor":4.1958},{"match_name":" IPSC93 Oct 2021","match_date":"2021-10-29","stage_classifiercode":"99-11","member_number":"A136928","first_name":"JONNY","last_name":"SPITZER","classification":"U","division":"PCC","hit_factor":4.1828},{"match_name":"March 2018 USPSA Classifier Special","match_date":"2018-03-17","stage_classifiercode":"99-11","member_number":"F107405","first_name":"RICK","last_name":"TEPER","classification":"\"\"","division":"PCC","hit_factor":4.1783},{"match_name":"Winona 7/25/17","match_date":"2017-07-25","stage_classifiercode":"99-11","member_number":"\"\"","first_name":"CHRIS","last_name":"SCHULTZ","classification":"\"\"","division":"PCC","hit_factor":4.1708},{"match_name":"SWGC USPSA Pistol Match - November 2021","match_date":"2021-11-06","stage_classifiercode":"99-11","member_number":"TY47034","first_name":"\"BUDDY \"\"BADASS\"\"\"","last_name":"PITTMAN","classification":"C","division":"PCC","hit_factor":4.1633},{"match_name":"MPSA 121518 USPA Classifer Match","match_date":"2018-12-15","stage_classifiercode":"99-11","member_number":"TY82466","first_name":"THOMAS","last_name":"ARTHUR","classification":"U","division":"PCC","hit_factor":4.16},{"match_name":"KSA USPSA  3 April 2021","match_date":"2021-04-03","stage_classifiercode":"99-11","member_number":"A99004","first_name":"BUDDY","last_name":"SMITH","classification":"U","division":"PCC","hit_factor":4.1551},{"match_name":"PSAC_20161022","match_date":"2016-10-22","stage_classifiercode":"99-11","member_number":"\"\"","first_name":"DAVE","last_name":"GALEGOR","classification":"\"\"","division":"PCC","hit_factor":4.1534},{"match_name":"PRG 2017 Classifier Match","match_date":"2017-02-19","stage_classifiercode":"99-11","member_number":"\"\"","first_name":"DESI","last_name":"LOPEZ","classification":"U","division":"PCC","hit_factor":4.1176},{"match_name":"BLUE RIDGE ARSENAL July 6 Classifier Match","match_date":"2018-07-06","stage_classifiercode":"99-11","member_number":"A72727","first_name":"GREG","last_name":"JONES","classification":"U","division":"PCC","hit_factor":4.1145},{"match_name":"WVRPC USPSA 1APR2017 CLASSIFIER","match_date":"2017-04-01","stage_classifiercode":"99-11","member_number":"\"\"","first_name":"DAVID","last_name":"REPPERT","classification":"U","division":"PCC","hit_factor":4.1135},{"match_name":"YRPA USPSA MARCH  2018","match_date":"2018-03-25","stage_classifiercode":"99-11","member_number":"NONE","first_name":"MICHELLE","last_name":"HARMON","classification":"U","division":"PCC","hit_factor":4.111},{"match_name":"AAPS AAFG Level 1 Match - May 5 2018","match_date":"2018-05-05","stage_classifiercode":"99-11","member_number":"TY91875","first_name":"OTHELL","last_name":"MOORE","classification":"B","division":"PCC","hit_factor":4.0989},{"match_name":"DAPS USPSA at ETTS 7-8-17","match_date":"2017-07-08","stage_classifiercode":"99-11","member_number":"A80629","first_name":"RYAN","last_name":"KILLIAN","classification":"U","division":"PCC","hit_factor":4.0966},{"match_name":"HSA USPSA March 2020","match_date":"2020-03-04","stage_classifiercode":"99-11","member_number":"A63094","first_name":"VINCENT","last_name":"HLAVINKA SR.","classification":"U","division":"PCC","hit_factor":4.0913},{"match_name":"SAGC CTX04 Monthly USPSA Match - November 2018","match_date":"2018-11-25","stage_classifiercode":"99-11","member_number":"None","first_name":"TERRY","last_name":"ASHTON","classification":"U","division":"PCC","hit_factor":4.0896},{"match_name":"GRB JAN USPSA  at Cav","match_date":"2017-01-21","stage_classifiercode":"99-11","member_number":"PEN","first_name":"CURTIS","last_name":"SALTER","classification":"U","division":"PCC","hit_factor":4.0645},{"match_name":"Richmond Hot Shots April 14-15-2018 USPSA Pistol Match","match_date":"2018-04-14","stage_classifiercode":"99-11","member_number":"L3301","first_name":"KEITH","last_name":"MIYASAKI","classification":"C","division":"PCC","hit_factor":4.0552},{"match_name":"YRPA USPSA MARCH  2018","match_date":"2018-03-25","stage_classifiercode":"99-11","member_number":"TY80395","first_name":"KAJSA","last_name":"WEAVER","classification":"C","division":"PCC","hit_factor":4.0523},{"match_name":"APS August 1st Monthly USPSA Match  Classifier Match","match_date":"2021-08-01","stage_classifiercode":"99-11","member_number":"A133888","first_name":"CHARLENE","last_name":"SILVA","classification":"U","division":"PCC","hit_factor":4.0498},{"match_name":"MCRC USPSA August 2018","match_date":"2018-08-11","stage_classifiercode":"99-11","member_number":"L2945","first_name":"LEE","last_name":"ROUSE","classification":"C","division":"PCC","hit_factor":4.0486},{"match_name":"WILLISTON PRACTICAL SHOOTERS CLUB","match_date":"2020-10-03","stage_classifiercode":"99-11","member_number":"A124236","first_name":"WILLIAM","last_name":"BROOKS","classification":"U","division":"PCC","hit_factor":4.0486},{"match_name":"Shot Through The Heart Classifiers","match_date":"2018-02-04","stage_classifiercode":"99-11","member_number":"TY69715","first_name":"MIKE","last_name":"GARDNER","classification":"C","division":"PCC","hit_factor":4.039},{"match_name":"WSPS AUGUST 2016 USPSA","match_date":"2016-08-20","stage_classifiercode":"99-11","member_number":"TY31530","first_name":"DAVID","last_name":"RAGLAND","classification":"U","division":"PCC","hit_factor":4.0323},{"match_name":"Shasta Shooters 2017 June Classifier Match","match_date":"2017-06-10","stage_classifiercode":"99-11","member_number":"A72030","first_name":"JASON","last_name":"LUTHER","classification":"U","division":"PCC","hit_factor":4.0167},{"match_name":"USPSA MO21 2Alpha SBRC March 2018","match_date":"2018-03-24","stage_classifiercode":"99-11","member_number":"TY48907","first_name":"DAVID","last_name":"LETSCH","classification":"A","division":"PCC","hit_factor":4.01},{"match_name":"LCSA  USPSA April 2017","match_date":"2017-04-08","stage_classifiercode":"99-11","member_number":"\"\"","first_name":"ROSS","last_name":"SHANER","classification":"U","division":"PCC","hit_factor":4.01},{"match_name":"Shadow Hawk Defense USPSA Special Classifier","match_date":"2020-11-14","stage_classifiercode":"99-11","member_number":"A97515","first_name":"JOHN","last_name":"YUN","classification":"U","division":"PCC","hit_factor":4.008},{"match_name":"Brazosland Pistoleros August 20 2017","match_date":"2017-08-20","stage_classifiercode":"99-11","member_number":"A104379","first_name":"ALEX","last_name":"YORK","classification":"U","division":"PCC","hit_factor":4.0062},{"match_name":"RDS Dec 2nd 2017 USPSA Classifier Match","match_date":"2017-12-02","stage_classifiercode":"99-11","member_number":"A90763","first_name":"DIANE","last_name":"MCCOY","classification":"U","division":"PCC","hit_factor":4.0028},{"match_name":"SAPSA January 2020 Match","match_date":"2020-01-18","stage_classifiercode":"99-11","member_number":"A25833","first_name":"RICK","last_name":"GRASSIE","classification":"B","division":"PCC","hit_factor":3.9945},{"match_name":"ECPS USPSA 19 May 18","match_date":"2018-05-19","stage_classifiercode":"99-11","member_number":"A110388","first_name":"ZACH","last_name":"PUTNAM","classification":"U","division":"PCC","hit_factor":3.9886},{"match_name":"GWPP December 2020 Pistol","match_date":"2020-12-12","stage_classifiercode":"99-11","member_number":"A107004","first_name":"TRAVIS","last_name":"EDWARDS","classification":"U","division":"PCC","hit_factor":3.9766},{"match_name":"MPSA 050617 Classifier Match","match_date":"2017-05-06","stage_classifiercode":"99-11","member_number":"TY94846","first_name":"RUTH","last_name":"MAHLEY","classification":"U","division":"PCC","hit_factor":3.9735},{"match_name":"Pinetucky USPSA 06-16-18","match_date":"2018-06-16","stage_classifiercode":"99-11","member_number":"A109238","first_name":"BRANDON","last_name":"COOK","classification":"U","division":"PCC","hit_factor":3.9724},{"match_name":"BPSA January 2017 USPSA","match_date":"2017-01-22","stage_classifiercode":"99-11","member_number":"A100643","first_name":"LLOYD","last_name":"MARINE","classification":"U","division":"PCC","hit_factor":3.9672},{"match_name":"GRPC USPSA WE STOP FOR NO STORM","match_date":"2017-09-03","stage_classifiercode":"99-11","member_number":"PEN","first_name":"TOM","last_name":"DONAHUE","classification":"U","division":"PCC","hit_factor":3.959},{"match_name":"Shoot Gtr USPSA 10/18","match_date":"2016-10-18","stage_classifiercode":"99-11","member_number":"L1240","first_name":"TONY","last_name":"HYATT","classification":"U","division":"PCC","hit_factor":3.9536},{"match_name":"Ontelaunee USPSA  July 2018","match_date":"2018-07-29","stage_classifiercode":"99-11","member_number":"L3851","first_name":"JEFF","last_name":"PAULSEN","classification":"M","division":"PCC","hit_factor":3.9378},{"match_name":"DWB - Deadwood Boys USPSA 20 September 2020  Classifier Match Makeup","match_date":"2020-09-20","stage_classifiercode":"99-11","member_number":"A91936","first_name":"CHRISTOPHER","last_name":"GURNETT","classification":"D","division":"PCC","hit_factor":3.9318},{"match_name":"Crooked Creek Pistol League - June 2016","match_date":"2016-06-25","stage_classifiercode":"99-11","member_number":"A43229","first_name":"RICK","last_name":"BAUER","classification":"U","division":"PCC","hit_factor":3.9216},{"match_name":"Marc-On Shooting USPSA January 26th","match_date":"2020-01-26","stage_classifiercode":"99-11","member_number":"A95574","first_name":"CHARLES","last_name":"KIM","classification":"U","division":"PCC","hit_factor":3.9187},{"match_name":"TBAS USPSA Match 2/23/20","match_date":"2020-02-23","stage_classifiercode":"99-11","member_number":"A117925","first_name":"HEIDI","last_name":"CONLON","classification":"U","division":"PCC","hit_factor":3.9098},{"match_name":"HOPS USPSA 072118","match_date":"2018-07-21","stage_classifiercode":"99-11","member_number":"TY99272","first_name":"ANDREW","last_name":"SPARKS","classification":"U","division":"PCC","hit_factor":3.9031},{"match_name":"ECPS USPSA 19 May 18","match_date":"2018-05-19","stage_classifiercode":"99-11","member_number":"A34304","first_name":"DON","last_name":"DUBOSE","classification":"A","division":"PCC","hit_factor":3.9031},{"match_name":"SLOSA NOVEMBER 2017 USPSA MATCH","match_date":"2017-11-11","stage_classifiercode":"99-11","member_number":"T18538","first_name":"RICH","last_name":"RICHARDS","classification":"U","division":"PCC","hit_factor":3.8989},{"match_name":"HPSP Heartland Practical Shooters June USPSA Shoot","match_date":"2018-06-24","stage_classifiercode":"99-11","member_number":"A106092","first_name":"JO","last_name":"CROSS","classification":"Unclassified","division":"PCC","hit_factor":3.8905},{"match_name":"Grandbaggers August 2017","match_date":"2017-08-03","stage_classifiercode":"99-11","member_number":"TY50145","first_name":"SUE","last_name":"LITTLE","classification":"U","division":"PCC","hit_factor":3.8866},{"match_name":"LCSA  USPSA April 2017","match_date":"2017-04-08","stage_classifiercode":"99-11","member_number":"\"\"","first_name":"WADE","last_name":"SHANER","classification":"U","division":"PCC","hit_factor":3.8753},{"match_name":"November 2016 PCSI USPSA Monster Match","match_date":"2016-11-05","stage_classifiercode":"99-11","member_number":"A58105","first_name":"BRIAN","last_name":"STEWART","classification":"U","division":"PCC","hit_factor":3.858},{"match_name":"RBGC 2017-06-24","match_date":"2017-06-24","stage_classifiercode":"99-11","member_number":"FY72784","first_name":"BILLY","last_name":"CHAU","classification":"U","division":"PCC","hit_factor":3.8356},{"match_name":"Shadow Hawk Defense USPSA Special Classifier","match_date":"2020-11-14","stage_classifiercode":"99-11","member_number":"A127538","first_name":"LONNIE","last_name":"COURTNEY","classification":"U","division":"PCC","hit_factor":3.8225},{"match_name":"PRPSA USPSA CHALLENGE PAN AMERICAN","match_date":"2021-07-11","stage_classifiercode":"99-11","member_number":"JUDYPR","first_name":"JUDIBELLE","last_name":"MELENDEZ-ALCARAZ","classification":"","division":"PCC","hit_factor":3.7873},{"match_name":"Deadwood Boys USPSA All Classifier Match","match_date":"2016-08-07","stage_classifiercode":"99-11","member_number":"L3810","first_name":"ERIC","last_name":"BERG","classification":"U","division":"PCC","hit_factor":3.7825},{"match_name":"WPGC 10-1-18","match_date":"2018-10-01","stage_classifiercode":"99-11","member_number":"TY70548","first_name":"CHARLENE","last_name":"JONES","classification":"C","division":"PCC","hit_factor":3.7787},{"match_name":"AAPS AAFG Level 1 Match - May 5 2018","match_date":"2018-05-05","stage_classifiercode":"99-11","member_number":"TY90942","first_name":"SEAN","last_name":"ANDERSON","classification":"B","division":"PCC","hit_factor":3.766},{"match_name":"Grandbaggers September 2018","match_date":"2018-09-06","stage_classifiercode":"99-11","member_number":"A110134","first_name":"WAYNE","last_name":"ULLRICH","classification":"U","division":"PCC","hit_factor":3.7643},{"match_name":"ARPC USPSA Match 3-26-17","match_date":"2017-03-26","stage_classifiercode":"99-11","member_number":"TY56049","first_name":"KENT","last_name":"CHRISTEN","classification":"Unclassified","division":"PCC","hit_factor":3.7607},{"match_name":"SB Action Pistol Match Classifier","match_date":"2017-12-14","stage_classifiercode":"99-11","member_number":"\"\"","first_name":"BRIAN","last_name":"CRIPE","classification":"\"\"","division":"PCC","hit_factor":3.7516},{"match_name":"ORSA USPSA October 2017","match_date":"2017-10-21","stage_classifiercode":"99-11","member_number":"TY98638","first_name":"WENDY","last_name":"WINE","classification":"D","division":"PCC","hit_factor":3.7511},{"match_name":"PBR USPSA Classifier Match","match_date":"2018-06-11","stage_classifiercode":"99-11","member_number":"A107408","first_name":"DALE","last_name":"WOLFF","classification":"D","division":"PCC","hit_factor":3.7475},{"match_name":"CFRPC December USPSA (Classifier)","match_date":"2018-12-16","stage_classifiercode":"99-11","member_number":"TY106150","first_name":"TOM","last_name":"CASTRO","classification":"A","division":"PCC","hit_factor":3.7448},{"match_name":"USPSA MO21 2Alpha SBRC March 2018","match_date":"2018-03-24","stage_classifiercode":"99-11","member_number":"A22632","first_name":"BILL","last_name":"YEP","classification":"U","division":"PCC","hit_factor":3.7415},{"match_name":"WSPS JUNE 2018 USPSA MATCH","match_date":"2018-06-16","stage_classifiercode":"99-11","member_number":"\"\"","first_name":"DEREK","last_name":"SMITH","classification":"U","division":"PCC","hit_factor":3.7383},{"match_name":"SKSC USPSA April 2018 Match","match_date":"2018-04-21","stage_classifiercode":"99-11","member_number":"FY 49403","first_name":"RICK","last_name":"SIEGERS","classification":"U","division":"PCC","hit_factor":3.7307},{"match_name":"SMPS USPSA Feb 9 2020 AM Classifier","match_date":"2020-02-05","stage_classifiercode":"99-11","member_number":"A86775","first_name":"ALEXANDER","last_name":"REALUYO","classification":"U","division":"PCC","hit_factor":3.7244},{"match_name":"West Coast IPSC","match_date":"2018-07-22","stage_classifiercode":"99-11","member_number":"TY52406","first_name":"GARY","last_name":"CHAN","classification":"M","division":"PCC","hit_factor":3.7162},{"match_name":"Grandbaggers September 2018","match_date":"2018-09-06","stage_classifiercode":"99-11","member_number":"TY48432","first_name":"KEVIN","last_name":"ARQUETTE","classification":"U","division":"PCC","hit_factor":3.7116},{"match_name":"Hopkinton USPSA May 2017","match_date":"2017-05-06","stage_classifiercode":"99-11","member_number":"\"\"","first_name":"SERGEY","last_name":"MONVELDT","classification":"\"\"","division":"PCC","hit_factor":3.7077},{"match_name":"HPS March 2020 Club Fun Match","match_date":"2020-03-07","stage_classifiercode":"99-11","member_number":"NA","first_name":"PIERRE","last_name":"NABONNE","classification":"X","division":"PCC","hit_factor":3.6872},{"match_name":"SAPSC Weekly USPSA Classifier Match 20170221","match_date":"2017-02-22","stage_classifiercode":"99-11","member_number":"A37609","first_name":"TOM","last_name":"MULLIGAN","classification":"U","division":"PCC","hit_factor":3.6794},{"match_name":"LPRGC - Lower Providence USPSA October 2018","match_date":"2018-10-06","stage_classifiercode":"99-11","member_number":"L1476","first_name":"JAMES","last_name":"CHESTNUT","classification":"U","division":"PCC","hit_factor":3.667},{"match_name":"Baileys July 2017","match_date":"2017-07-02","stage_classifiercode":"99-11","member_number":"A104248","first_name":"KATHERINE","last_name":"MAZZOLA","classification":"U","division":"PCC","hit_factor":3.6543},{"match_name":"Free State PCC Match 8-29","match_date":"2020-08-29","stage_classifiercode":"99-11","member_number":"TY112604","first_name":"MARK","last_name":"SHUMATE","classification":"U","division":"PCC","hit_factor":3.6437},{"match_name":"ORPCI 2018.03.31 USPSA Special","match_date":"2018-03-31","stage_classifiercode":"99-11","member_number":"A109998","first_name":"DAVE","last_name":"SKELTON","classification":"U","division":"PCC","hit_factor":3.6364},{"match_name":"WPS USPSA Monthly Match November 2020","match_date":"2020-11-14","stage_classifiercode":"99-11","member_number":"PENDING","first_name":"PETER","last_name":"GRAVES","classification":"D","division":"PCC","hit_factor":3.6145},{"match_name":"Lafayette Practical Shooters - THURS - Jun 25 - Big Squads","match_date":"2020-06-25","stage_classifiercode":"99-11","member_number":"A120002","first_name":"CAITLIN","last_name":"GAUB","classification":"C","division":"PCC","hit_factor":3.5952},{"match_name":"PCPS Classifier and Slot Match Jan 2020","match_date":"2020-01-12","stage_classifiercode":"99-11","member_number":"A110112","first_name":"SHINE","last_name":"TAYLOR","classification":"U","division":"PCC","hit_factor":3.5903},{"match_name":"CCPL 12102017","match_date":"2017-12-08","stage_classifiercode":"99-11","member_number":"A88732","first_name":"TIGER","last_name":"NGUYEN","classification":"M","division":"PCC","hit_factor":3.5794},{"match_name":"USPSA-Alberta 2018-01 Indoor Classifier 1","match_date":"2018-02-26","stage_classifiercode":"99-11","member_number":"F108681","first_name":"DON","last_name":"SERRANO","classification":"U","division":"PCC","hit_factor":3.5738},{"match_name":"USPSA MO21 2Alpha SBRC October 2017","match_date":"2017-10-21","stage_classifiercode":"99-11","member_number":"A99328","first_name":"ED","last_name":"WILSON","classification":"D","division":"PCC","hit_factor":3.5672},{"match_name":"CCPL 12102017","match_date":"2017-12-08","stage_classifiercode":"99-11","member_number":"A94497","first_name":"RENE","last_name":"FORBES/PFITZER","classification":"U","division":"PCC","hit_factor":3.5648},{"match_name":"Campeonato USPSA 2020","match_date":"2020-05-30","stage_classifiercode":"99-11","member_number":"TY124656","first_name":"WALTER J","last_name":"PEREZ-MARTINEZ","classification":"D","division":"PCC","hit_factor":3.562},{"match_name":"Superior Practical Shooters May 2018 Match","match_date":"2018-05-02","stage_classifiercode":"99-11","member_number":"A-6226","first_name":"JUDE","last_name":"AURILIO","classification":"U","division":"PCC","hit_factor":3.5566},{"match_name":"WVRPC USPSA 1SEPT2018","match_date":"2018-09-01","stage_classifiercode":"99-11","member_number":"L4004","first_name":"AARON","last_name":"LORTON","classification":"G","division":"PCC","hit_factor":3.5441},{"match_name":"USPSA MO21 2Alpha SBRC June 2017","match_date":"2017-06-17","stage_classifiercode":"99-11","member_number":"A99328","first_name":"ED","last_name":"WILSON","classification":"U","division":"PCC","hit_factor":3.5357},{"match_name":"SFPC June 7 2020 AM     USPSA Monthly Match","match_date":"2020-06-07","stage_classifiercode":"99-11","member_number":"A53891","first_name":"CRAIG","last_name":"MCELHANEY","classification":"B","division":"PCC","hit_factor":3.5294},{"match_name":"Ontelaunee USPSA Hose Fest","match_date":"2021-01-02","stage_classifiercode":"99-11","member_number":"A107606","first_name":"JOHN","last_name":"KOREA","classification":"U","division":"PCC","hit_factor":3.5264},{"match_name":"BHPSC Weekly Match 2-24-2017 Special Classifier Match","match_date":"2017-02-25","stage_classifiercode":"99-11","member_number":"A78427","first_name":"DILLEN","last_name":"EASLEY","classification":"A","division":"PCC","hit_factor":3.5205},{"match_name":"Pardoe Sportsmens Association- USPSA Saturday 4-3-21","match_date":"2021-04-03","stage_classifiercode":"99-11","member_number":"Fy85869","first_name":"KHORY","last_name":"KATZ","classification":"A","division":"PCC","hit_factor":3.5088},{"match_name":"MPSA 121518 USPA Classifer Match","match_date":"2018-12-15","stage_classifiercode":"99-11","member_number":"A6205","first_name":"GREG","last_name":"PATE","classification":"U","division":"PCC","hit_factor":3.5017},{"match_name":"PRG 2017 Classifier Match","match_date":"2017-02-19","stage_classifiercode":"99-11","member_number":"A91926","first_name":"AMIE","last_name":"HAGAN","classification":"U","division":"PCC","hit_factor":3.4941},{"match_name":"Pitcairn-Monroeville Sportsmens Club USPSA August 2017","match_date":"2017-08-05","stage_classifiercode":"99-11","member_number":"a42456","first_name":"GARRY","last_name":"LITTLE","classification":"B","division":"PCC","hit_factor":3.4692},{"match_name":"ITPSC January USPSA","match_date":"2017-01-21","stage_classifiercode":"99-11","member_number":"A41980","first_name":"ERIC","last_name":"GAMBILL","classification":"U","division":"PCC","hit_factor":3.4621},{"match_name":"Rio Salado UPPL September 2020","match_date":"2020-09-13","stage_classifiercode":"99-11","member_number":"L2359","first_name":"YVETTE","last_name":"LASS","classification":"D","division":"PCC","hit_factor":3.4621},{"match_name":"West Coast IPSC","match_date":"2018-07-22","stage_classifiercode":"99-11","member_number":"A100422","first_name":"TOMIE","last_name":"LIM","classification":"U","division":"PCC","hit_factor":3.4606},{"match_name":"Richmond Hot Shots April 14-15-2018 USPSA Pistol Match","match_date":"2018-04-14","stage_classifiercode":"99-11","member_number":"TY88866","first_name":"CHARLIE","last_name":"MENDOZA","classification":"D","division":"PCC","hit_factor":3.4483},{"match_name":"ORPCI 2018.03.31 USPSA Special","match_date":"2018-03-31","stage_classifiercode":"99-11","member_number":"A77176","first_name":"DON","last_name":"O'BRADOVICH","classification":"G","division":"PCC","hit_factor":3.4483},{"match_name":"Winona 7/25/17","match_date":"2017-07-25","stage_classifiercode":"99-11","member_number":"\"\"","first_name":"KEVIN","last_name":"BOLAND","classification":"U","division":"PCC","hit_factor":3.4483},{"match_name":"Prescott 1st Saturday 8-05-17","match_date":"2017-08-05","stage_classifiercode":"99-11","member_number":"A104571","first_name":"MIKE","last_name":"HAYES","classification":"unclassified","division":"PCC","hit_factor":3.445},{"match_name":"Bossier Parish Practical Shooters August 16 2020","match_date":"2020-08-16","stage_classifiercode":"99-11","member_number":"A121184","first_name":"CYNTHIA","last_name":"ROWELL","classification":"D","division":"PCC","hit_factor":3.444},{"match_name":"SSS USPSA February 2020","match_date":"2020-02-16","stage_classifiercode":"99-11","member_number":"A103849","first_name":"JENNIFER","last_name":"CHAMPION","classification":"B (B Class)","division":"PCC","hit_factor":3.442},{"match_name":"Prescott Action Shooters 1st Saturday USPSA 6-2-2018 ","match_date":"2018-06-03","stage_classifiercode":"99-11","member_number":"L4264","first_name":"BILL","last_name":"MUNGER","classification":"G","division":"PCC","hit_factor":3.4364},{"match_name":"The Hollow 20 Aug 2018","match_date":"2018-08-20","stage_classifiercode":"99-11","member_number":"\"\"","first_name":"RICHARD","last_name":"WEAKLEY","classification":"U","division":"PCC","hit_factor":3.4169},{"match_name":"Benton Gun Club-USPSA June 28  9AM","match_date":"2020-06-28","stage_classifiercode":"99-11","member_number":"A117129","first_name":"EITAN","last_name":"GROSS","classification":"C","division":"PCC","hit_factor":3.397},{"match_name":"Bgs Hudson Week 6","match_date":"2017-02-19","stage_classifiercode":"99-11","member_number":"TY57145","first_name":"DARREN","last_name":"CASTER","classification":"U","division":"PCC","hit_factor":3.3919},{"match_name":"ARPC USPSA Match 8-23-20","match_date":"2020-08-23","stage_classifiercode":"99-11","member_number":"A67988","first_name":"BILL","last_name":"LEMEN","classification":"B","division":"PCC","hit_factor":3.3898},{"match_name":"USPSA MO21 2Alpha SBRC December 22 2018","match_date":"2018-12-22","stage_classifiercode":"99-11","member_number":"A98119","first_name":"STEVE","last_name":"VESTAL","classification":"C","division":"PCC","hit_factor":3.3857},{"match_name":"SKSC USPSA April 2018 Match","match_date":"2018-04-21","stage_classifiercode":"99-11","member_number":"TY85900","first_name":"BRAD","last_name":"NORTON","classification":"U","division":"PCC","hit_factor":3.385},{"match_name":"Free State PCC Match 8-29","match_date":"2020-08-29","stage_classifiercode":"99-11","member_number":"A104630","first_name":"PATRICK","last_name":"MITCHELL","classification":"B","division":"PCC","hit_factor":3.3832},{"match_name":"OFGC USPSA Match Feb 19th 2017","match_date":"2017-02-19","stage_classifiercode":"99-11","member_number":"\"\"","first_name":"CAROL","last_name":"STRIPLIN","classification":"D","division":"PCC","hit_factor":3.378},{"match_name":"Prescott Action Shooters 1st Saturday USPSA 7-7-2018","match_date":"2018-07-07","stage_classifiercode":"99-11","member_number":"TY24273","first_name":"GREGORY","last_name":"DUST","classification":"Unclassified","division":"PCC","hit_factor":3.3693},{"match_name":"Shadow Hawk Defense USPSA Special Classifier","match_date":"2020-11-14","stage_classifiercode":"99-11","member_number":"TY130941","first_name":"AARON","last_name":"BOLEN","classification":"U","division":"PCC","hit_factor":3.3613},{"match_name":"Free State PCC Match 8-29","match_date":"2020-08-29","stage_classifiercode":"99-11","member_number":"TY104399","first_name":"DONNIE","last_name":"DUREN","classification":"U","division":"PCC","hit_factor":3.3613},{"match_name":"OREGON ARPC CC05 USPSA AUGUST 12 2017","match_date":"2017-08-12","stage_classifiercode":"99-11","member_number":"TY82059","first_name":"KRISTINE","last_name":"HAYES","classification":"U","division":"PCC","hit_factor":3.3593},{"match_name":"PRG - Oh Shoot USPSA February 21st - 3rd Sunday Match","match_date":"2021-02-21","stage_classifiercode":"99-11","member_number":"A114513","first_name":"EDGAR","last_name":"LAGUILLES","classification":"U","division":"PCC","hit_factor":3.3493},{"match_name":"Richmond Hot Shots April 14-15-2018 USPSA Pistol Match","match_date":"2018-04-14","stage_classifiercode":"99-11","member_number":"FY59179","first_name":"DAVE","last_name":"BUNN","classification":"C","division":"PCC","hit_factor":3.3445},{"match_name":"BSPSC 2017 April Special Classifier","match_date":"2017-04-09","stage_classifiercode":"99-11","member_number":"A4995","first_name":"JOEL","last_name":"PETERS","classification":"U","division":"PCC","hit_factor":3.3435},{"match_name":"TCGC Polo July 2017","match_date":"2017-07-23","stage_classifiercode":"99-11","member_number":"TY55629","first_name":"ROGER","last_name":"GRIFFIN","classification":"U","division":"PCC","hit_factor":3.3077},{"match_name":"Deadwood Boys USPSA All Classifier Match - 29 July 2018","match_date":"2018-07-29","stage_classifiercode":"99-11","member_number":"FY102290","first_name":"PATRICK","last_name":"BAUTISTA","classification":"U","division":"PCC","hit_factor":3.3045},{"match_name":"NAAS 03-05-2016","match_date":"2017-03-05","stage_classifiercode":"99-11","member_number":"A92457","first_name":"JILL","last_name":"MONGATO","classification":"U","division":"PCC","hit_factor":3.3019},{"match_name":"NW01 April da Turd","match_date":"2018-04-04","stage_classifiercode":"99-11","member_number":"A84564","first_name":"RYAN","last_name":"REIBMAN","classification":"B","division":"PCC","hit_factor":3.299},{"match_name":"Shoot GTR 05/07/17","match_date":"2017-05-07","stage_classifiercode":"99-11","member_number":"TY53290","first_name":"KENT","last_name":"CORI","classification":"B","division":"PCC","hit_factor":3.2916},{"match_name":"Hopkinton USPSA May 2017","match_date":"2017-05-06","stage_classifiercode":"99-11","member_number":"TY73127","first_name":"SEAN","last_name":"JANICKI","classification":"G","division":"PCC","hit_factor":3.2787},{"match_name":"OKCGC USPSA June 2018","match_date":"2018-06-02","stage_classifiercode":"99-11","member_number":"TY71153","first_name":"PHILLIP","last_name":"BRANDT","classification":"C","division":"PCC","hit_factor":3.2767},{"match_name":"West Coast IPSC","match_date":"2018-07-22","stage_classifiercode":"99-11","member_number":"\"\"","first_name":"ERIK","last_name":"FRIAS","classification":"U","division":"PCC","hit_factor":3.2747},{"match_name":"GTS Indoor USPSA February 27 2020","match_date":"2020-02-28","stage_classifiercode":"99-11","member_number":"A121745","first_name":"ASHLEY","last_name":"ARMENTROUT","classification":"U","division":"PCC","hit_factor":3.2589},{"match_name":"DAPS USPSA at ETTS 7-8-17","match_date":"2017-07-08","stage_classifiercode":"99-11","member_number":"A78835","first_name":"ALDEN","last_name":"THOMPSON","classification":"U","division":"PCC","hit_factor":3.2566},{"match_name":"MCRC USPSA August 2018","match_date":"2018-08-11","stage_classifiercode":"99-11","member_number":"A88808","first_name":"RICK","last_name":"ROBERTS","classification":"B","division":"PCC","hit_factor":3.2529},{"match_name":"Shasta Shooters 2017 June Classifier Match","match_date":"2017-06-10","stage_classifiercode":"99-11","member_number":"FY26846","first_name":"ROCKY","last_name":"EVANS","classification":"U","division":"PCC","hit_factor":3.2343},{"match_name":"DWB - Deadwood Boys USPSA 20 September 2020  Classifier Match Makeup","match_date":"2020-09-20","stage_classifiercode":"99-11","member_number":"A122400","first_name":"HENRY","last_name":"KIM","classification":"C","division":"PCC","hit_factor":3.2164},{"match_name":"ACPSA November 2018","match_date":"2018-11-24","stage_classifiercode":"99-11","member_number":"TY53290","first_name":"KENT","last_name":"CORI","classification":"M","division":"PCC","hit_factor":3.2151},{"match_name":"WVRPC Speed Shoot Spectacular Dec 2017","match_date":"2017-12-16","stage_classifiercode":"99-11","member_number":"A78635","first_name":"ROB","last_name":"MCGUIRE","classification":"B","division":"PCC","hit_factor":3.2042},{"match_name":"CGC 03-10-2018","match_date":"2018-03-10","stage_classifiercode":"99-11","member_number":"A52754","first_name":"TEDDY","last_name":"ROBERTS","classification":"U","division":"PCC","hit_factor":3.1991},{"match_name":"EAPS July 2017 USPSA","match_date":"2017-07-16","stage_classifiercode":"99-11","member_number":"A27201","first_name":"KEITH","last_name":"LEMOINE","classification":"U","division":"PCC","hit_factor":3.1884},{"match_name":"Wvpps Nov. 2017","match_date":"2017-11-19","stage_classifiercode":"99-11","member_number":"ty99798","first_name":"ROBERT","last_name":"VAN SICKLE","classification":"U","division":"PCC","hit_factor":3.18},{"match_name":"Free State PCC Match 8-29","match_date":"2020-08-29","stage_classifiercode":"99-11","member_number":"A111852","first_name":"JOHN","last_name":"MORGAN","classification":"C","division":"PCC","hit_factor":3.1764},{"match_name":"CFRPC December USPSA (Classifier)","match_date":"2018-12-16","stage_classifiercode":"99-11","member_number":"NA","first_name":"JOSEPH","last_name":"BIVINS","classification":"U","division":"PCC","hit_factor":3.1763},{"match_name":"SUPS All Classifier Match March 1718 2018","match_date":"2018-03-17","stage_classifiercode":"99-11","member_number":"TY85084","first_name":"DAWN","last_name":"DERLIGHTER","classification":"C","division":"PCC","hit_factor":3.1746},{"match_name":"CRCPS 2020-08-08","match_date":"2020-08-08","stage_classifiercode":"99-11","member_number":"TY99488","first_name":"KIRT","last_name":"MCKENNA","classification":"A","division":"PCC","hit_factor":3.1703},{"match_name":"Griffin USPSA Match Jan 21 2017","match_date":"2017-01-21","stage_classifiercode":"99-11","member_number":"\"\"","first_name":"CRAIG","last_name":"HEISEY","classification":"U","division":"PCC","hit_factor":3.1646},{"match_name":"17s PSC - Go Fast Dont Suck 2020 Spring Postal Match (USPSA)","match_date":"2020-05-16","stage_classifiercode":"99-11","member_number":"a108175","first_name":"EMILY","last_name":"MONTALVO","classification":"D","division":"PCC","hit_factor":3.1573},{"match_name":"USPSA MO21 2Alpha SBRC June 2017","match_date":"2017-06-17","stage_classifiercode":"99-11","member_number":"A10768","first_name":"JOHN","last_name":"ESLICK","classification":"U","division":"PCC","hit_factor":3.1573},{"match_name":"Extreme GM","match_date":"2020-06-12","stage_classifiercode":"99-11","member_number":"A115625","first_name":"RAFAEL","last_name":"SERRANO","classification":"C","division":"PCC","hit_factor":3.1339},{"match_name":"Grandbaggers September 2018","match_date":"2018-09-06","stage_classifiercode":"99-11","member_number":"A97078","first_name":"JIM","last_name":"CONNER","classification":"U","division":"PCC","hit_factor":3.1189},{"match_name":"Holmen USPSA 10/30/16","match_date":"2016-10-30","stage_classifiercode":"99-11","member_number":"A84364","first_name":"LEN","last_name":"WUNDERLY","classification":"U","division":"PCC","hit_factor":3.0908},{"match_name":"CASA USPSA  Feb 17","match_date":"2017-02-05","stage_classifiercode":"99-11","member_number":"A96041","first_name":"ERNIE","last_name":"DECKER","classification":"U","division":"PCC","hit_factor":3.0888},{"match_name":"Steel City USPSA December 2 2017","match_date":"2017-12-02","stage_classifiercode":"99-11","member_number":"a104668","first_name":"TONY","last_name":"CLECKLER","classification":"U","division":"PCC","hit_factor":3.0882},{"match_name":"MCPSL Pistol 3-10-18","match_date":"2018-03-10","stage_classifiercode":"99-11","member_number":"TY37712","first_name":"AUDRA","last_name":"GOYETTE","classification":"U","division":"PCC","hit_factor":3.0468},{"match_name":"CCC Shooting Complex November 2017","match_date":"2017-11-05","stage_classifiercode":"99-11","member_number":"TY58003","first_name":"BRIAN","last_name":"HAGEN","classification":"U","division":"PCC","hit_factor":3.018},{"match_name":"West Coast IPSC","match_date":"2018-07-22","stage_classifiercode":"99-11","member_number":"A99077","first_name":"DANTE","last_name":"CABELINO","classification":"U","division":"PCC","hit_factor":3.0006},{"match_name":"USPSA MO21 2Alpha SBRC March 2018","match_date":"2018-03-24","stage_classifiercode":"99-11","member_number":"\"\"","first_name":"ALLEN","last_name":"BROWN","classification":"U","division":"PCC","hit_factor":2.9907},{"match_name":"RDS November 2020 USPSA","match_date":"2020-11-07","stage_classifiercode":"99-11","member_number":"A117501","first_name":"ROD","last_name":"COLEMAN","classification":"B","division":"PCC","hit_factor":2.9851},{"match_name":"CGGR July USPSA Match","match_date":"2018-07-21","stage_classifiercode":"99-11","member_number":"A74950","first_name":"KERRY","last_name":"YOUNG","classification":"C","division":"PCC","hit_factor":2.977},{"match_name":"RBGC 2017-06-24","match_date":"2017-06-24","stage_classifiercode":"99-11","member_number":"\"\"","first_name":"DAVID","last_name":"KELLEY","classification":"X","division":"PCC","hit_factor":2.9762},{"match_name":"USPSA MO21 2Alpha SBRC March 2018","match_date":"2018-03-24","stage_classifiercode":"99-11","member_number":"A98119","first_name":"STEVE","last_name":"VESTAL","classification":"U","division":"PCC","hit_factor":2.9562},{"match_name":"ORSA USPSA October 2017","match_date":"2017-10-21","stage_classifiercode":"99-11","member_number":"NA","first_name":"RUSTY","last_name":"LAVERY","classification":"U","division":"PCC","hit_factor":2.9197},{"match_name":"CBS USPSA Mar  2018","match_date":"2018-03-21","stage_classifiercode":"99-11","member_number":"A103588","first_name":"CHIP","last_name":"MEADOR","classification":"U","division":"PCC","hit_factor":2.9185},{"match_name":"Richmond Hot Shots April 14-15-2018 USPSA Pistol Match","match_date":"2018-04-14","stage_classifiercode":"99-11","member_number":"TY99745","first_name":"JONATHAN","last_name":"OWYANG","classification":"A","division":"PCC","hit_factor":2.9034},{"match_name":"LGCSEMPS April 2018 Special Classifier","match_date":"2018-04-08","stage_classifiercode":"99-11","member_number":"TY77087","first_name":"RICK","last_name":"LOVELY","classification":"U","division":"PCC","hit_factor":2.8852},{"match_name":"OREGON ARPC CC05 USPSA AUGUST 12 2017","match_date":"2017-08-12","stage_classifiercode":"99-11","member_number":"FY70699","first_name":"DARYL","last_name":"FITZPATRICK","classification":"U","division":"PCC","hit_factor":2.8784},{"match_name":"Shoot GTR 05/07/17","match_date":"2017-05-07","stage_classifiercode":"99-11","member_number":"\"\"","first_name":"PETER","last_name":"ATKINS","classification":"\"\"","division":"PCC","hit_factor":2.8546},{"match_name":"RPS November 2018 USPSA Match","match_date":"2018-11-10","stage_classifiercode":"99-11","member_number":"A114071","first_name":"ERIN","last_name":"MILLER","classification":"U","division":"PCC","hit_factor":2.8513},{"match_name":"OFGC Practical Pistol Match 01-19-2020","match_date":"2020-01-19","stage_classifiercode":"99-11","member_number":"A101376","first_name":"SHANE","last_name":"MACON","classification":"M","division":"PCC","hit_factor":2.8401},{"match_name":"Extreme GM PCC only ","match_date":"2020-07-12","stage_classifiercode":"99-11","member_number":"TY48243","first_name":"NICK","last_name":"URSO","classification":"U","division":"PCC","hit_factor":2.8358},{"match_name":"SLPSA July USPSA match","match_date":"2018-07-21","stage_classifiercode":"99-11","member_number":"\"\"","first_name":"MARK","last_name":"BURRUP","classification":"U","division":"PCC","hit_factor":2.8325},{"match_name":"Deadwood Boys USPSA All Classifier Match - 29 July 2018","match_date":"2018-07-29","stage_classifiercode":"99-11","member_number":"TY50983","first_name":"HERMAN","last_name":"BAUTISTA","classification":"U","division":"PCC","hit_factor":2.8107},{"match_name":"USPSA MO21 2Alpha SBRC October 2017","match_date":"2017-10-21","stage_classifiercode":"99-11","member_number":"A97624","first_name":"MIKE","last_name":"MARTIN","classification":"U","division":"PCC","hit_factor":2.8096},{"match_name":"Castlewood USPSA Sept 2020 shoot","match_date":"2020-09-26","stage_classifiercode":"99-11","member_number":"A46243","first_name":"JEFFREY","last_name":"WOLFE","classification":"A","division":"PCC","hit_factor":2.7972},{"match_name":"The Hollow 6 June 2018","match_date":"2018-08-06","stage_classifiercode":"99-11","member_number":"\"\"","first_name":"ADAM","last_name":"PINE","classification":"U","division":"PCC","hit_factor":2.7738},{"match_name":"DAPS USPSA at ETTS 7-8-17","match_date":"2017-07-08","stage_classifiercode":"99-11","member_number":"A103871","first_name":"STEVE","last_name":"BURROUGHS","classification":"U","division":"PCC","hit_factor":2.7528},{"match_name":"Fairfax PS USPSA September 2017","match_date":"2017-09-19","stage_classifiercode":"99-11","member_number":"A102542","first_name":"RON","last_name":"JONES","classification":"U","division":"PCC","hit_factor":2.7421},{"match_name":"ARPC USPSA Match 5-27-18","match_date":"2018-05-27","stage_classifiercode":"99-11","member_number":"A67988","first_name":"BILL","last_name":"LEMEN","classification":"C","division":"PCC","hit_factor":2.7295},{"match_name":"The Hollow 6 June 2018","match_date":"2018-08-06","stage_classifiercode":"99-11","member_number":"\"\"","first_name":"ADAM","last_name":"PINE","classification":"U","division":"PCC","hit_factor":2.7284},{"match_name":"PRG - Oh Shoot USPSA February 21st - 3rd Sunday Match","match_date":"2021-02-21","stage_classifiercode":"99-11","member_number":"A53107","first_name":"ROMIE","last_name":"OGALINO","classification":"D","division":"PCC","hit_factor":2.7181},{"match_name":"March 2018 USPSA Classifier Special","match_date":"2018-03-17","stage_classifiercode":"99-11","member_number":"F79951","first_name":"ROY","last_name":"FALCON","classification":"\"\"","division":"PCC","hit_factor":2.7076},{"match_name":"SKSC USPSA April 2018 Match","match_date":"2018-04-21","stage_classifiercode":"99-11","member_number":"Ty45940","first_name":"BRUCE","last_name":"WARREN","classification":"U","division":"PCC","hit_factor":2.6987},{"match_name":"PCSI - September 2017 USPSA","match_date":"2017-09-02","stage_classifiercode":"99-11","member_number":"A84225","first_name":"MIKE","last_name":"WEST","classification":"U","division":"PCC","hit_factor":2.6971},{"match_name":"SMPS USPSA Feb 9 2020 AM Classifier","match_date":"2020-02-05","stage_classifiercode":"99-11","member_number":"TY102317","first_name":"PAUL","last_name":"EARP","classification":"U","division":"PCC","hit_factor":2.6942},{"match_name":"LCHG September 2018 USPSA Special Classifier","match_date":"2018-09-08","stage_classifiercode":"99-11","member_number":"NONE","first_name":"DAVID","last_name":"SCHNEIDER","classification":"\"\"","division":"PCC","hit_factor":2.6894},{"match_name":"CCC Shooting Complex October 2016","match_date":"2016-10-02","stage_classifiercode":"99-11","member_number":"TY58599","first_name":"BEVERLY","last_name":"HUGGINS","classification":"U","division":"PCC","hit_factor":2.6838},{"match_name":"FBURG USPSA November 2020","match_date":"2020-11-01","stage_classifiercode":"99-11","member_number":"FY88516","first_name":"SEAN","last_name":"KELLNER","classification":"U","division":"PCC","hit_factor":2.6694},{"match_name":"LGCSEMPS April 2018 Special Classifier","match_date":"2018-04-08","stage_classifiercode":"99-11","member_number":"A104581","first_name":"JERRY","last_name":"BEAUDET","classification":"U","division":"PCC","hit_factor":2.6679},{"match_name":"OK Corral USPSA Classifier Match Feb 18 2017","match_date":"2017-02-18","stage_classifiercode":"99-11","member_number":"FY78513","first_name":"SUSAN","last_name":"BRENNAN","classification":"\"\"","division":"PCC","hit_factor":2.6634},{"match_name":"APSC USPSA 02-15-20","match_date":"2020-02-15","stage_classifiercode":"99-11","member_number":"A120451","first_name":"JAMIE","last_name":"JENNINGS","classification":"D","division":"PCC","hit_factor":2.6578},{"match_name":"Steel City USPSA December 2 2017","match_date":"2017-12-02","stage_classifiercode":"99-11","member_number":"TY97762","first_name":"PAUL","last_name":"HEDGEPATH","classification":"U","division":"PCC","hit_factor":2.6444},{"match_name":"OFGC USPSA Match Feb 19th 2017","match_date":"2017-02-19","stage_classifiercode":"99-11","member_number":"\"\"","first_name":"JAMES","last_name":"CONNOR","classification":"D","division":"PCC","hit_factor":2.6391},{"match_name":"BHPC USPSA Monthly Match 9-10-17 IOWA","match_date":"2017-09-10","stage_classifiercode":"99-11","member_number":"A49307","first_name":"JEFF","last_name":"CORY","classification":"D","division":"PCC","hit_factor":2.6091},{"match_name":"Omaha Gun Club USPSA February 28th 2018","match_date":"2018-03-01","stage_classifiercode":"99-11","member_number":"A93819","first_name":"JOAN","last_name":"EMOND","classification":"U","division":"PCC","hit_factor":2.6019},{"match_name":"Almaden Valley Action Pistol 5-26-18","match_date":"2018-05-26","stage_classifiercode":"99-11","member_number":"Fy59179","first_name":"DAVE","last_name":"BUNN","classification":"C","division":"PCC","hit_factor":2.5773},{"match_name":"Grandbaggers August 2017","match_date":"2017-08-03","stage_classifiercode":"99-11","member_number":"TY69261","first_name":"DANIEL","last_name":"COON","classification":"U","division":"PCC","hit_factor":2.5738},{"match_name":"HSC USPSA May 5th 2018","match_date":"2018-05-05","stage_classifiercode":"99-11","member_number":"\"\"","first_name":"SCOTT","last_name":"COKE","classification":"U","division":"PCC","hit_factor":2.5601},{"match_name":"OFGC USPSA Match Feb 19th 2017","match_date":"2017-02-19","stage_classifiercode":"99-11","member_number":"TY89171","first_name":"AUSTIN","last_name":"CHAMBERLAIN","classification":"U","division":"PCC","hit_factor":2.5551},{"match_name":"Competitive Shooters of Lake Norman CORNELIUS Thursday Evening Indoor USPSA Pistol Match North Carolina","match_date":"2020-09-17","stage_classifiercode":"99-11","member_number":"PEN","first_name":"PAULA","last_name":"CEBALLOS","classification":"U","division":"PCC","hit_factor":2.5453},{"match_name":"Richmond Hot Shots April 14-15-2018 USPSA Pistol Match","match_date":"2018-04-14","stage_classifiercode":"99-11","member_number":"A53296","first_name":"DONALD","last_name":"WYMAN","classification":"U","division":"PCC","hit_factor":2.5273},{"match_name":"Shot Through The Heart Classifiers","match_date":"2018-02-04","stage_classifiercode":"99-11","member_number":"A101544","first_name":"DENNIS","last_name":"GALVEZ","classification":"U","division":"PCC","hit_factor":2.5063},{"match_name":"Hose Monster Action ","match_date":"2020-07-19","stage_classifiercode":"99-11","member_number":"Ty121838","first_name":"TODD","last_name":"TOENGES","classification":"U","division":"PCC","hit_factor":2.4961},{"match_name":"USPSA BGSL Jan 4th Weekend ","match_date":"2020-01-25","stage_classifiercode":"99-11","member_number":"A69114","first_name":"SUSAN","last_name":"CARMICAL","classification":"U","division":"PCC","hit_factor":2.4805},{"match_name":"Brothers N Arms September 2017 USPSA Match","match_date":"2017-09-16","stage_classifiercode":"99-11","member_number":"PENDING","first_name":"BRANDON","last_name":"KOONCE","classification":"U","division":"PCC","hit_factor":2.4793},{"match_name":"GAS July 7th Special Classifier","match_date":"2018-07-07","stage_classifiercode":"99-11","member_number":"\"\"","first_name":"DAVID","last_name":"SCHNEIDER","classification":"U","division":"PCC","hit_factor":2.4626},{"match_name":"TBAS USPSA Match 2/21/21","match_date":"2021-02-21","stage_classifiercode":"99-11","member_number":"A107819","first_name":"RITCHIE","last_name":"HOY","classification":"","division":"PCC","hit_factor":2.4417},{"match_name":"CVSC 07-29-2018","match_date":"2018-07-29","stage_classifiercode":"99-11","member_number":"\"\"","first_name":"DAVE","last_name":"SIMPSON","classification":"U","division":"PCC","hit_factor":2.4378},{"match_name":"PRG 2017 Classifier Match","match_date":"2017-02-19","stage_classifiercode":"99-11","member_number":"PEN","first_name":"KELLI","last_name":"MCKERNAN","classification":"U","division":"PCC","hit_factor":2.4157},{"match_name":"WNPL USPSA - Nov 2017","match_date":"2017-11-05","stage_classifiercode":"99-11","member_number":"A100873","first_name":"SERGIO","last_name":"VILLAREAL","classification":"C","division":"PCC","hit_factor":2.3715},{"match_name":"DPSL July 22 2018 All Classifier","match_date":"2018-07-22","stage_classifiercode":"99-11","member_number":"\"\"","first_name":"BARRY","last_name":"DYAR","classification":"U","division":"PCC","hit_factor":2.3596},{"match_name":"OREGON ARPC CC05 USPSA AUGUST 12 2017","match_date":"2017-08-12","stage_classifiercode":"99-11","member_number":"PEN","first_name":"MARIE","last_name":"CAINE","classification":"U","division":"PCC","hit_factor":2.3476},{"match_name":"LGCSEMPS April 2018 Special Classifier","match_date":"2018-04-08","stage_classifiercode":"99-11","member_number":"L2461","first_name":"PETE","last_name":"MOODY","classification":"U","division":"PCC","hit_factor":2.3458},{"match_name":"Steel City USPSA December 2 2017","match_date":"2017-12-02","stage_classifiercode":"99-11","member_number":"\"\"","first_name":"JAY","last_name":"TOMLIN","classification":"X ","division":"PCC","hit_factor":2.3452},{"match_name":"Grandbaggers September 2018","match_date":"2018-09-06","stage_classifiercode":"99-11","member_number":"A64045","first_name":"ALEX","last_name":"LIM","classification":"U","division":"PCC","hit_factor":2.3413},{"match_name":"Extreme GM","match_date":"2020-06-12","stage_classifiercode":"99-11","member_number":"A69150","first_name":"DERRICK","last_name":"CHEN LUKE","classification":"A","division":"PCC","hit_factor":2.3392},{"match_name":"WSRC USPSA","match_date":"2016-10-22","stage_classifiercode":"99-11","member_number":"\"\"","first_name":"TIM","last_name":"ARMSTRONG","classification":"U","division":"PCC","hit_factor":2.315},{"match_name":"Granby Action Shooters Oct 2016","match_date":"2016-10-02","stage_classifiercode":"99-11","member_number":"TY73127","first_name":"SEAN","last_name":"JANICKI","classification":"M","division":"PCC","hit_factor":2.3062},{"match_name":"ARPC USPSA Match 5-27-18","match_date":"2018-05-27","stage_classifiercode":"99-11","member_number":"TY92608","first_name":"JO ANN","last_name":"FISCHER","classification":"D","division":"PCC","hit_factor":2.2998},{"match_name":"Oakdale USPSA MN07 8-12-2021","match_date":"2021-08-12","stage_classifiercode":"99-11","member_number":"A134517","first_name":"NATHAN","last_name":"WIEBE","classification":"U","division":"PCC","hit_factor":2.2976},{"match_name":"Deadwood Boys USPSA All Classifier Match","match_date":"2016-08-07","stage_classifiercode":"99-11","member_number":"\"\"","first_name":"JENNIFER","last_name":"GONZALEZ","classification":"U","division":"PCC","hit_factor":2.2683},{"match_name":"SSS USPSA February 2020","match_date":"2020-02-16","stage_classifiercode":"99-11","member_number":"A116789","first_name":"SOPHIA","last_name":"BYRUM","classification":"U (Unclassified)","division":"PCC","hit_factor":2.265},{"match_name":"Lafayette Practical Shooters - WED- June 20","match_date":"2018-06-20","stage_classifiercode":"99-11","member_number":"A53214","first_name":"CURTIS","last_name":"DARRAH","classification":"U","division":"PCC","hit_factor":2.2538},{"match_name":"Blackstone Shooting Sports Snow Days January 2017 USPSA Level  1","match_date":"2017-01-08","stage_classifiercode":"99-11","member_number":"Unk","first_name":"KEITH","last_name":"DEMMA","classification":"U","division":"PCC","hit_factor":2.2407},{"match_name":"NHRPC - March 2021 USPSA","match_date":"2021-03-14","stage_classifiercode":"99-11","member_number":"TY28452","first_name":"ROB","last_name":"HARPER","classification":"U","division":"PCC","hit_factor":2.236},{"match_name":"CFRPC December USPSA (Classifier)","match_date":"2018-12-16","stage_classifiercode":"99-11","member_number":"NA","first_name":"PEGGY","last_name":"BIVINS","classification":"U","division":"PCC","hit_factor":2.1152},{"match_name":"GRB JAN USPSA  at Cav","match_date":"2017-01-21","stage_classifiercode":"99-11","member_number":"TY72189","first_name":"KELLY","last_name":"COBEAN","classification":"U","division":"PCC","hit_factor":2.1117},{"match_name":"HPSP Heartland Practical Shooters June USPSA Shoot","match_date":"2018-06-24","stage_classifiercode":"99-11","member_number":"Pen","first_name":"HEATHER","last_name":"BAYLESS","classification":"Unclassified","division":"PCC","hit_factor":2.0985},{"match_name":"USPSA CM99 Special Classifier MO19 Lamar October 9 2016","match_date":"2016-10-09","stage_classifiercode":"99-11","member_number":"TY48907","first_name":"DAVID","last_name":"LETSCH","classification":"U","division":"PCC","hit_factor":2.0666},{"match_name":"ORSA USPSA October 2017","match_date":"2017-10-21","stage_classifiercode":"99-11","member_number":"A99451","first_name":"STEVE","last_name":"REDDING","classification":"D","division":"PCC","hit_factor":2.0546},{"match_name":"Benton Gun Club-USPSA April 25","match_date":"2021-04-25","stage_classifiercode":"99-11","member_number":"TY118388","first_name":"LES","last_name":"JAMES","classification":"C","division":"PCC","hit_factor":2.0084},{"match_name":"Brothers N Arms December 2018 USPSA Match","match_date":"2018-12-15","stage_classifiercode":"99-11","member_number":"TY49396","first_name":"ROGER","last_name":"FOLLETTE","classification":"B","division":"PCC","hit_factor":1.9967},{"match_name":"AAPS AAFG Level 1 Match - May 5 2018","match_date":"2018-05-05","stage_classifiercode":"99-11","member_number":"PENDING","first_name":"MAURICE","last_name":"JOY","classification":"U","division":"PCC","hit_factor":1.9578},{"match_name":"OFGC USPSA Match Feb 19th 2017","match_date":"2017-02-19","stage_classifiercode":"99-11","member_number":"A96267","first_name":"MYLEE","last_name":"CHAMBERLAIN","classification":"U","division":"PCC","hit_factor":1.9191},{"match_name":"Strategic Edge July 2018 USPSA","match_date":"2018-07-21","stage_classifiercode":"99-11","member_number":"\"\"","first_name":"KARL","last_name":"KING","classification":"U","division":"PCC","hit_factor":1.9169},{"match_name":"PRPSA USPSA CHALLENGE PAN AMERICAN","match_date":"2021-07-11","stage_classifiercode":"99-11","member_number":"F135688","first_name":"JOSE L.","last_name":"FRAGOSO SERRANO","classification":"U","division":"PCC","hit_factor":1.8189},{"match_name":"Hopkinton USPSA May 2017","match_date":"2017-05-06","stage_classifiercode":"99-11","member_number":"A96789","first_name":"SCOTT","last_name":"WIMBERLY","classification":"U","division":"PCC","hit_factor":1.8174},{"match_name":"SFPC June 7 2020 AM     USPSA Monthly Match","match_date":"2020-06-07","stage_classifiercode":"99-11","member_number":"TY70667","first_name":"JORGE","last_name":"RODRIGUEZ","classification":"A","division":"PCC","hit_factor":1.7958},{"match_name":"Prescott Action Shooters 1st Saturday USPSA 7-7-2018","match_date":"2018-07-07","stage_classifiercode":"99-11","member_number":"\"\"","first_name":"GARY","last_name":"LISCOMBE","classification":"Unclassified","division":"PCC","hit_factor":1.7844},{"match_name":"The Hollow 6 June 2018","match_date":"2018-08-06","stage_classifiercode":"99-11","member_number":"\"\"","first_name":"SEBASTIAN","last_name":"RODRIGUEZ","classification":"U","division":"PCC","hit_factor":1.6667},{"match_name":"HPS March 2020 Club Fun Match","match_date":"2020-03-07","stage_classifiercode":"99-11","member_number":"A104329","first_name":"DAVID","last_name":"KIKUKAWA","classification":"G","division":"PCC","hit_factor":1.6588},{"match_name":"Superior Practical Shooters May 2018 Match","match_date":"2018-05-02","stage_classifiercode":"99-11","member_number":"A109463","first_name":"MAX","last_name":"SEDA","classification":"C","division":"PCC","hit_factor":1.6235},{"match_name":"Marc-On Shooting USPSA January 26th","match_date":"2020-01-26","stage_classifiercode":"99-11","member_number":"A122657","first_name":"HENRY","last_name":"BURNS","classification":"U","division":"PCC","hit_factor":1.6221},{"match_name":"2017 Bay bridge Charity Classic - Richmond October 14-15-2017","match_date":"2017-10-14","stage_classifiercode":"99-11","member_number":"A103780","first_name":"ALLEN","last_name":"RODIL","classification":"U","division":"PCC","hit_factor":1.6194},{"match_name":"Shasta Shooters 2021 Nov","match_date":"2021-11-13","stage_classifiercode":"99-11","member_number":"Ty126795","first_name":"JOHN","last_name":"HEATH","classification":"U","division":"PCC","hit_factor":1.618},{"match_name":"SKSC USPSA April 2018 Match","match_date":"2018-04-21","stage_classifiercode":"99-11","member_number":"ty11389","first_name":"JEFF","last_name":"BING","classification":"U","division":"PCC","hit_factor":1.6062},{"match_name":"FBURG July 2018 Level I USPSA ","match_date":"2018-07-01","stage_classifiercode":"99-11","member_number":"A98070","first_name":"STEVE","last_name":"GREGORY","classification":"U","division":"PCC","hit_factor":1.5779},{"match_name":"CVSC 07-29-2018","match_date":"2018-07-29","stage_classifiercode":"99-11","member_number":"\"\"","first_name":"NICHOLAS","last_name":"TRAN","classification":"U","division":"PCC","hit_factor":1.563},{"match_name":"CCPL 12102017","match_date":"2017-12-08","stage_classifiercode":"99-11","member_number":"A34139","first_name":"LEE","last_name":"ROWE","classification":"A","division":"PCC","hit_factor":1.5461},{"match_name":"SAGC CTX04 Monthly USPSA Match - November 2018","match_date":"2018-11-25","stage_classifiercode":"99-11","member_number":"A109558","first_name":"BLAKE","last_name":"PATTERSON","classification":"U","division":"PCC","hit_factor":1.4485},{"match_name":"Superior Practical Shooters May 2018 Match","match_date":"2018-05-02","stage_classifiercode":"99-11","member_number":"\"\"","first_name":"CHRISTINE","last_name":"LIVI","classification":"U","division":"PCC","hit_factor":1.4116},{"match_name":"Bills Baxter 12-10-20","match_date":"2020-12-11","stage_classifiercode":"99-11","member_number":"A128569","first_name":"STEVE","last_name":"HIX","classification":"U","division":"PCC","hit_factor":1.3478},{"match_name":"USPSA MO21 Mini Match 2Alpha SBRC July 1 2021","match_date":"2021-07-01","stage_classifiercode":"99-11","member_number":"A131746","first_name":"ROBERT","last_name":"NORTHCUTT","classification":"C","division":"PCC","hit_factor":1.2834},{"match_name":"HPPS 1-16-2021","match_date":"2021-01-16","stage_classifiercode":"99-11","member_number":"ty77793","first_name":"ROBERT","last_name":"CHRISTIE","classification":"A","division":"PCC","hit_factor":1.1709},{"match_name":"SLPSA July USPSA match","match_date":"2018-07-21","stage_classifiercode":"99-11","member_number":"A103853","first_name":"TRENTON","last_name":"KELLER","classification":"U","division":"PCC","hit_factor":1.1444},{"match_name":"PRG 2017 Classifier Match","match_date":"2017-02-19","stage_classifiercode":"99-11","member_number":"TY85661","first_name":"KEITH","last_name":"SORRELL","classification":"A","division":"PCC","hit_factor":1.1384},{"match_name":"Deadwood Boys USPSA All Classifier Match - 29 July 2018","match_date":"2018-07-29","stage_classifiercode":"99-11","member_number":"TY93265","first_name":"BILL","last_name":"DUNN","classification":"D","division":"PCC","hit_factor":1.0532},{"match_name":"USPSA MO21 2Alpha SBRC March 2018","match_date":"2018-03-24","stage_classifiercode":"99-11","member_number":"\"\"","first_name":"JOSH","last_name":"LUINSTRA","classification":"U","division":"PCC","hit_factor":0.9685},{"match_name":"HAS Classifier Match January 2020","match_date":"2020-01-15","stage_classifiercode":"99-11","member_number":"Ty49724","first_name":"BETSY","last_name":"GRECOE","classification":"U","division":"PCC","hit_factor":0.9337},{"match_name":"LIPSA  December 11th 2016 - USPSA Match","match_date":"2016-12-11","stage_classifiercode":"99-11","member_number":"FY62975","first_name":"SALVATORE","last_name":"WYSZOMIERSKI","classification":"U","division":"PCC","hit_factor":0.9245},{"match_name":"APSC USPSA 10-06-18","match_date":"2018-10-06","stage_classifiercode":"99-11","member_number":"A44650","first_name":"DARRELL","last_name":"DAUDE","classification":"C","division":"PCC","hit_factor":0.8998},{"match_name":"CCC Shooting Complex October 2016","match_date":"2016-10-02","stage_classifiercode":"99-11","member_number":"A77442","first_name":"MARY","last_name":"DUBUISSON","classification":"U","division":"PCC","hit_factor":0.8871},{"match_name":"NCPS USPSA Handgun Match June 24 2018","match_date":"2018-06-24","stage_classifiercode":"99-11","member_number":"TY85413","first_name":"PAOLO","last_name":"TANDOC","classification":"U","division":"PCC","hit_factor":0.8121},{"match_name":"Crooked Creek Pistol League - June 2017","match_date":"2017-06-24","stage_classifiercode":"99-11","member_number":"A43229","first_name":"RICK","last_name":"BAUER","classification":"D","division":"PCC","hit_factor":0.6989},{"match_name":"Ontelaunee USPSA  July 2018","match_date":"2018-07-29","stage_classifiercode":"99-11","member_number":"TY97520","first_name":"BRAYDEN","last_name":"CRAWFORD","classification":"U","division":"PCC","hit_factor":0.5943},{"match_name":"LCSC Linden USPSA 092621","match_date":"2021-09-25","stage_classifiercode":"99-11","member_number":"A133971","first_name":"ROBERT","last_name":"VALENZUELA","classification":"U","division":"PCC","hit_factor":0.5085},{"match_name":"ORPCI USPSA Saturday 2020.07.18","match_date":"2020-07-18","stage_classifiercode":"99-11","member_number":"A43878","first_name":"JIM","last_name":"HORNE","classification":"","division":"PCC","hit_factor":0.4876},{"match_name":"SKSC USPSA April 2018 Match","match_date":"2018-04-21","stage_classifiercode":"99-11","member_number":"TY15000","first_name":"JOHN","last_name":"TRAUTMANN","classification":"U","division":"PCC","hit_factor":0.476},{"match_name":"ORSA USPSA October 2017","match_date":"2017-10-21","stage_classifiercode":"99-11","member_number":"A23755","first_name":"RAY","last_name":"ZILLICK","classification":"U","division":"PCC","hit_factor":0.4759},{"match_name":"IN19 ACC USPSA September 23","match_date":"2018-09-23","stage_classifiercode":"99-11","member_number":"FY54293","first_name":"JAKE","last_name":"FEARNOW","classification":"U","division":"PCC","hit_factor":0.0453}]