[{"match_name":"Briar Rabbit May 2016 Match OH20","match_date":"2016-05-22","stage_classifiercode":"03-04","member_number":"A68907","first_name":"ANDREW","last_name":"HYDER","classification":"G","division":"OPEN","hit_factor":12.1723},{"match_name":"RCPS USPSA Nov 14","match_date":"2020-11-14","stage_classifiercode":"03-04","member_number":"A87604","first_name":"ETHAN","last_name":"HOWELL","classification":"GM","division":"OPEN","hit_factor":12.0504},{"match_name":"RCSC USPSA 24 July 2016","match_date":"2016-07-24","stage_classifiercode":"03-04","member_number":"A82591","first_name":"WADE","last_name":"WHETSTONE","classification":"M","division":"OPEN","hit_factor":11.9093},{"match_name":"RMAP 3rd Sunday Marh 2016","match_date":"2016-03-20","stage_classifiercode":"03-04","member_number":"A49393","first_name":"\"NAIM \"\"NICK\"\"\"","last_name":"SAITI","classification":"G","division":"OPEN","hit_factor":11.8397},{"match_name":"HPPS 2-18-2017","match_date":"2017-02-16","stage_classifiercode":"03-04","member_number":"L3320","first_name":"CHARLIE","last_name":"PEREZ","classification":"M","division":"OPEN","hit_factor":11.5318},{"match_name":"USPSA stx","match_date":"2017-03-04","stage_classifiercode":"03-04","member_number":"A83214","first_name":"ETHAN","last_name":"INOCANDO","classification":"M","division":"OPEN","hit_factor":11.4236},{"match_name":"EAGC Classifier Match 1 February","match_date":"2020-02-02","stage_classifiercode":"03-04","member_number":"TY106020","first_name":"JACOB","last_name":"TAYLOR","classification":"M","division":"OPEN","hit_factor":11.4082},{"match_name":"USPSA stx","match_date":"2017-03-04","stage_classifiercode":"03-04","member_number":"A86283","first_name":"MEL","last_name":"RODERO","classification":"M","division":"OPEN","hit_factor":11.3594},{"match_name":"MCPSL Pistol 5-8-2021","match_date":"2021-05-08","stage_classifiercode":"03-04","member_number":"TY95238","first_name":"JUSTIN","last_name":"MCELROY","classification":"A","division":"OPEN","hit_factor":11.1111},{"match_name":"Maine Practical Shooters June 2016","match_date":"2016-06-04","stage_classifiercode":"03-04","member_number":"A92399","first_name":"JUSTIN","last_name":"LANDRY","classification":"A","division":"OPEN","hit_factor":11.0048},{"match_name":"Pelham USPSA 2018-08-19","match_date":"2018-08-19","stage_classifiercode":"03-04","member_number":"A28945","first_name":"SCOTT","last_name":"BOTELHO","classification":"G","division":"OPEN","hit_factor":10.9635},{"match_name":"LIPSA - April 29th 2018 - USPSA Special Classifier Match","match_date":"2018-04-29","stage_classifiercode":"03-04","member_number":"L3463","first_name":"DEMETRI","last_name":"KATOS","classification":"A","division":"OPEN","hit_factor":10.9121},{"match_name":"PCWC USPSA  4 23 2016","match_date":"2016-04-23","stage_classifiercode":"03-04","member_number":"L2664","first_name":"JIM","last_name":"HILSENBECK","classification":"M","division":"OPEN","hit_factor":10.8108},{"match_name":"MvpFeb2016","match_date":"2016-02-06","stage_classifiercode":"03-04","member_number":"TY3959","first_name":"FRANCIS","last_name":"LIVINGSTON","classification":"G","division":"OPEN","hit_factor":10.7023},{"match_name":"EAGC March 2017 USPSA Pistol Match","match_date":"2017-03-19","stage_classifiercode":"03-04","member_number":"A70326","first_name":"KEN","last_name":"ROSE","classification":"A","division":"OPEN","hit_factor":10.6416},{"match_name":"RCSC USPSA 24 July 2016","match_date":"2016-07-24","stage_classifiercode":"03-04","member_number":"A72605","first_name":"RORI","last_name":"SONGCO","classification":"U","division":"OPEN","hit_factor":10.5348},{"match_name":"Cactus USPSA November 2021","match_date":"2021-11-07","stage_classifiercode":"03-04","member_number":"F68512","first_name":"MUNEKI","last_name":"SAMEJIMA","classification":"G","division":"OPEN","hit_factor":10.3789},{"match_name":"PCWC USPSA  4 23 2016","match_date":"2016-04-23","stage_classifiercode":"03-04","member_number":"TY 36459","first_name":"EDDIE","last_name":"GAMMONS","classification":"M","division":"OPEN","hit_factor":10.3759},{"match_name":"May 8 2021 The Range At True North USPSA Match","match_date":"2021-05-08","stage_classifiercode":"03-04","member_number":"TY83654","first_name":"JASON","last_name":"ROBERTS","classification":"M","division":"OPEN","hit_factor":10.2837},{"match_name":"Maine Practical Shooters June 2016","match_date":"2016-06-04","stage_classifiercode":"03-04","member_number":"TY49143","first_name":"TAD","last_name":"DAVIDSON","classification":"M","division":"OPEN","hit_factor":10.2773},{"match_name":"EAGC March 2017 USPSA Pistol Match","match_date":"2017-03-19","stage_classifiercode":"03-04","member_number":"A79844","first_name":"JAKE","last_name":"REED","classification":"A","division":"OPEN","hit_factor":10.2719},{"match_name":"LIPSA - April 29th 2018 - USPSA Special Classifier Match","match_date":"2018-04-29","stage_classifiercode":"03-04","member_number":"L3463","first_name":"DEMETRI","last_name":"KATOS","classification":"A","division":"OPEN","hit_factor":10.2446},{"match_name":"DGC USPSA 05-13-18","match_date":"2018-05-13","stage_classifiercode":"03-04","member_number":"A81428","first_name":"TY","last_name":"COBB","classification":"M","division":"OPEN","hit_factor":10.1721},{"match_name":"Bass River USPSA August 2020","match_date":"2020-08-02","stage_classifiercode":"03-04","member_number":"A28945","first_name":"SCOTT","last_name":"BOTELHO","classification":"G","division":"OPEN","hit_factor":10.0917},{"match_name":"ORSA USPSA January 2020","match_date":"2020-01-18","stage_classifiercode":"03-04","member_number":"A45411","first_name":"JASON","last_name":"EDWARDS","classification":"M","division":"OPEN","hit_factor":10.0601},{"match_name":"JCSSA NOV 6 2021","match_date":"2021-11-06","stage_classifiercode":"03-04","member_number":"A76773","first_name":"ZACK","last_name":"CAM","classification":"M","division":"OPEN","hit_factor":9.9424},{"match_name":"April 2018 Match","match_date":"2018-05-01","stage_classifiercode":"03-04","member_number":"ty85379","first_name":"JOE","last_name":"TOLENO","classification":"\"\"","division":"OPEN","hit_factor":9.9398},{"match_name":"MVPSA USPSA  6-16-18","match_date":"2018-06-16","stage_classifiercode":"03-04","member_number":"TY89492","first_name":"JESSE","last_name":"CLAUSSE","classification":"A","division":"OPEN","hit_factor":9.7633},{"match_name":"MCPSL Pistol 6-13-20","match_date":"2020-06-13","stage_classifiercode":"03-04","member_number":"TY100931","first_name":"CALEB","last_name":"PATERSON","classification":"M","division":"OPEN","hit_factor":9.7561},{"match_name":"RCSC USPSA 24 July 2016","match_date":"2016-07-24","stage_classifiercode":"03-04","member_number":"TY40917","first_name":"DAVID","last_name":"WARREN","classification":"G","division":"OPEN","hit_factor":9.7451},{"match_name":"Renton USPSA August 2016 - NW05","match_date":"2016-08-28","stage_classifiercode":"03-04","member_number":"TY66256","first_name":"LOKE","last_name":"TAN","classification":"M","division":"OPEN","hit_factor":9.6979},{"match_name":"MCRC USPSA March 2020","match_date":"2020-03-14","stage_classifiercode":"03-04","member_number":"A8166","first_name":"JIM","last_name":"JOYCE","classification":"M","division":"OPEN","hit_factor":9.635},{"match_name":"EAGC Classifier Match 1 February","match_date":"2020-02-02","stage_classifiercode":"03-04","member_number":"FY89922","first_name":"CHRIS","last_name":"WORKMAN","classification":"M","division":"OPEN","hit_factor":9.6273},{"match_name":"SWGC USPSA Pistol Match - July","match_date":"2016-07-02","stage_classifiercode":"03-04","member_number":"Ty74628","first_name":"BEN","last_name":"WALSH","classification":"M","division":"OPEN","hit_factor":9.6012},{"match_name":"TAC2 USPSA Dec 2017","match_date":"2017-12-02","stage_classifiercode":"03-04","member_number":"A73262","first_name":"KEVIN","last_name":"SUFFRIDGE","classification":"U","division":"OPEN","hit_factor":9.591},{"match_name":"Laser Ninja Dragon League USPSA September 2017 fixed","match_date":"2017-09-03","stage_classifiercode":"03-04","member_number":"A46707","first_name":"COLT","last_name":"WILKINSON","classification":"M","division":"OPEN","hit_factor":9.589},{"match_name":"SWGC USPSA Pistol Match - July","match_date":"2016-07-02","stage_classifiercode":"03-04","member_number":"Ty35186","first_name":"LEE","last_name":"KISER","classification":"G","division":"OPEN","hit_factor":9.5652},{"match_name":"DGC USPSA 05-13-18","match_date":"2018-05-13","stage_classifiercode":"03-04","member_number":"FY28307","first_name":"DAN","last_name":"MITCHELL","classification":"M","division":"OPEN","hit_factor":9.5},{"match_name":"SWGC USPSA Pistol Match - July","match_date":"2016-07-02","stage_classifiercode":"03-04","member_number":"A73332","first_name":"BRENT","last_name":"LORTON","classification":"M","division":"OPEN","hit_factor":9.4972},{"match_name":"FVPS November USPSA Match","match_date":"2018-11-03","stage_classifiercode":"03-04","member_number":"L4223","first_name":"DARRYL","last_name":"DOUGHERTY","classification":"M","division":"OPEN","hit_factor":9.4964},{"match_name":"Laser Ninja Dragon League USPSA September 2017 fixed","match_date":"2017-09-03","stage_classifiercode":"03-04","member_number":"Ty64204","first_name":"BLAKE","last_name":"LILES","classification":"G","division":"OPEN","hit_factor":9.4946},{"match_name":"SMPS June 2016","match_date":"2016-06-12","stage_classifiercode":"03-04","member_number":"TY92299","first_name":"BOB","last_name":"ROSEBROUGH","classification":"B","division":"OPEN","hit_factor":9.4477},{"match_name":"Lafayette Practical Shooters - SUN - Aug 8","match_date":"2021-08-08","stage_classifiercode":"03-04","member_number":"Fy101141","first_name":"MATHEW","last_name":"DOZIER","classification":"A","division":"OPEN","hit_factor":9.4281},{"match_name":"MCAS USPSA October 2016","match_date":"2016-10-15","stage_classifiercode":"03-04","member_number":"TY66387","first_name":"MIKE","last_name":"ROGERS","classification":"A","division":"OPEN","hit_factor":9.4067},{"match_name":"WGC WI USPSA Monthly Match 12-17-16","match_date":"2016-12-17","stage_classifiercode":"03-04","member_number":"A19231","first_name":"DARRYL","last_name":"DOUGHERTY","classification":"M","division":"OPEN","hit_factor":9.4005},{"match_name":"Pelham USPSA 2018-08-19","match_date":"2018-08-19","stage_classifiercode":"03-04","member_number":"TY49143","first_name":"TAD","last_name":"DAVIDSON","classification":"M","division":"OPEN","hit_factor":9.3969},{"match_name":"Fernan USPSA October 2021","match_date":"2021-10-16","stage_classifiercode":"03-04","member_number":"TY123772","first_name":"JOHN","last_name":"HEDLUND","classification":"U","division":"OPEN","hit_factor":9.3704},{"match_name":"AIPS Weekly USPSA 24 July 2018","match_date":"2018-07-24","stage_classifiercode":"03-04","member_number":"TY81149","first_name":"BRAD","last_name":"POLAND","classification":"B","division":"OPEN","hit_factor":9.3023},{"match_name":"PMRPC September 2018 USPSA","match_date":"2018-09-08","stage_classifiercode":"03-04","member_number":"Ty89423","first_name":"MARCUS","last_name":"COSTA","classification":"A","division":"OPEN","hit_factor":9.2992},{"match_name":"SPSA USPSA October 4th Sat match","match_date":"2016-10-22","stage_classifiercode":"03-04","member_number":"TY90226","first_name":"JAMES","last_name":"TURNURE","classification":"M","division":"OPEN","hit_factor":9.2676},{"match_name":"RCSC USPSA 24 July 2016","match_date":"2016-07-24","stage_classifiercode":"03-04","member_number":"A86283","first_name":"MEL","last_name":"RODERO","classification":"A","division":"OPEN","hit_factor":9.2669},{"match_name":"RCSC USPSA 24 July 2016","match_date":"2016-07-24","stage_classifiercode":"03-04","member_number":"A37285","first_name":"KYLE","last_name":"RIOJAS","classification":"M","division":"OPEN","hit_factor":9.2466},{"match_name":"CIPSC IL02 Havana June USPSA","match_date":"2021-06-12","stage_classifiercode":"03-04","member_number":"L4807","first_name":"ROB","last_name":"KOSACK","classification":"G","division":"OPEN","hit_factor":9.245},{"match_name":"Cactus USPSA ALL CLASSIFIER September 2020","match_date":"2020-09-06","stage_classifiercode":"03-04","member_number":"A122959","first_name":"BRANDON","last_name":"ENGBRECHT","classification":"M","division":"OPEN","hit_factor":9.2375},{"match_name":"Dundee USPSA Feb 2016","match_date":"2016-02-27","stage_classifiercode":"03-04","member_number":"TY61952","first_name":"JOHN","last_name":"MCCLELLAND","classification":"B","division":"OPEN","hit_factor":9.2266},{"match_name":"SLOSA FEBRUARY 2020 USPSA MATCH","match_date":"2020-02-08","stage_classifiercode":"03-04","member_number":"A84627","first_name":"DANIEL","last_name":"CHARBONNEAU","classification":"A","division":"OPEN","hit_factor":9.2105},{"match_name":"ORSA USPSA February 2020 ","match_date":"2020-02-15","stage_classifiercode":"03-04","member_number":"L4738","first_name":"BROOK","last_name":"WILLIS","classification":"A","division":"OPEN","hit_factor":9.1884},{"match_name":"MCPSL Pistol 5-8-2021","match_date":"2021-05-08","stage_classifiercode":"03-04","member_number":"TY65499","first_name":"JASON","last_name":"WARD","classification":"M","division":"OPEN","hit_factor":9.1794},{"match_name":"LIPSA - April 29th 2018 - USPSA Special Classifier Match","match_date":"2018-04-29","stage_classifiercode":"03-04","member_number":"TY90280","first_name":"ANTHONY","last_name":"BRUNO","classification":"A","division":"OPEN","hit_factor":9.1757},{"match_name":"Collin County USPSA July 30th 2017","match_date":"2017-07-30","stage_classifiercode":"03-04","member_number":"TY55323","first_name":"NIC","last_name":"NEEL","classification":"GM","division":"OPEN","hit_factor":9.1667},{"match_name":"Dundee USPSA Feb 2016","match_date":"2016-02-27","stage_classifiercode":"03-04","member_number":"A84371","first_name":"RYAN","last_name":"GOOLD","classification":"A","division":"OPEN","hit_factor":9.1324},{"match_name":"LCSC USPSA   8-13-17","match_date":"2017-08-08","stage_classifiercode":"03-04","member_number":"A85939","first_name":"NILO","last_name":"NUNEZ II","classification":"M","division":"OPEN","hit_factor":9.1317},{"match_name":"Collin County USPSA July 30th 2017","match_date":"2017-07-30","stage_classifiercode":"03-04","member_number":"TY53799","first_name":"LEE","last_name":"NEEL","classification":"GM","division":"OPEN","hit_factor":9.1292},{"match_name":"EAGC Classifier Match 1 February","match_date":"2020-02-02","stage_classifiercode":"03-04","member_number":"A111317","first_name":"JUN","last_name":"CHANG","classification":"U","division":"OPEN","hit_factor":9.1292},{"match_name":"JCSSA NOV 6 2021","match_date":"2021-11-06","stage_classifiercode":"03-04","member_number":"A79128","first_name":"RYAN","last_name":"WILKS","classification":"A","division":"OPEN","hit_factor":9.1286},{"match_name":"NRG April 23 2016","match_date":"2016-04-23","stage_classifiercode":"03-04","member_number":"TY33599","first_name":"WILLIAM","last_name":"PAOLINO","classification":"M","division":"OPEN","hit_factor":9.1176},{"match_name":"Pinetucky USPSA 03-18-17","match_date":"2017-03-18","stage_classifiercode":"03-04","member_number":"fy75669","first_name":"SCOTT","last_name":"THOMPSON","classification":"M","division":"OPEN","hit_factor":9.1043},{"match_name":"WGC WI USPSA Monthly Match 5-19-18","match_date":"2018-05-19","stage_classifiercode":"03-04","member_number":"A55556","first_name":"\"RON \"\"THE RIM JOB\"\"\"","last_name":"EVANS","classification":"B","division":"OPEN","hit_factor":9.0786},{"match_name":"LTD Pistol - August 2018","match_date":"2018-08-04","stage_classifiercode":"03-04","member_number":"TY53120","first_name":"BRANDON","last_name":"FARR","classification":"M","division":"OPEN","hit_factor":9.0433},{"match_name":"Hosemonster Action  ","match_date":"2021-05-16","stage_classifiercode":"03-04","member_number":"TY115042","first_name":"JACOB","last_name":"TURNER","classification":"A","division":"OPEN","hit_factor":9.0343},{"match_name":"CGGR  APRIL USPSA MATCH","match_date":"2018-04-20","stage_classifiercode":"03-04","member_number":"A31524","first_name":"COUNCIL","last_name":"BRADSHAW","classification":"GM","division":"OPEN","hit_factor":9.0153},{"match_name":"GPS OCTOBER 2018","match_date":"2018-10-28","stage_classifiercode":"03-04","member_number":"l3674","first_name":"AUGUST","last_name":"BALAGTAS","classification":"M","division":"OPEN","hit_factor":8.9532},{"match_name":"Hampden RPC June USPSA Match","match_date":"2021-06-13","stage_classifiercode":"03-04","member_number":"A98632","first_name":"ZACHARY","last_name":"GREENIER","classification":"M","division":"OPEN","hit_factor":8.931},{"match_name":"Dundee USPSA Feb 2016","match_date":"2016-02-27","stage_classifiercode":"03-04","member_number":"TY47743","first_name":"NORMAN","last_name":"BRIGHT","classification":"M","division":"OPEN","hit_factor":8.9109},{"match_name":"SPSA USPSA October 4th Sat match","match_date":"2016-10-22","stage_classifiercode":"03-04","member_number":"A31524","first_name":"COUNCIL","last_name":"BRADSHAW","classification":"G","division":"OPEN","hit_factor":8.8918},{"match_name":"Gps   November 2015","match_date":"2015-11-22","stage_classifiercode":"03-04","member_number":"A52066","first_name":"ROGELIO","last_name":"DELAROSA","classification":"A","division":"OPEN","hit_factor":8.872},{"match_name":"Collin County USPSA July 30th 2017","match_date":"2017-07-30","stage_classifiercode":"03-04","member_number":"TY47162","first_name":"SCOTT","last_name":"STOCKTON","classification":"G","division":"OPEN","hit_factor":8.871},{"match_name":"Dundee USPSA Feb 2016","match_date":"2016-02-27","stage_classifiercode":"03-04","member_number":"L2525","first_name":"KEITH","last_name":"TYLER","classification":"G","division":"OPEN","hit_factor":8.8698},{"match_name":"USAH New Years Pistol & PCC Match","match_date":"2020-01-19","stage_classifiercode":"03-04","member_number":"TY92048","first_name":"HAROLD","last_name":"DOMINGO","classification":"C","division":"OPEN","hit_factor":8.8435},{"match_name":"G2G September 28th USPSA Match","match_date":"2021-09-28","stage_classifiercode":"03-04","member_number":"L3674","first_name":"AUGUST","last_name":"BALAGTAS","classification":"M","division":"OPEN","hit_factor":8.7927},{"match_name":"Blackstone Shooting Sports July 2017 USPSA Pistol Level 1","match_date":"2017-07-11","stage_classifiercode":"03-04","member_number":"A91357","first_name":"BEN","last_name":"LANGFORD","classification":"A","division":"OPEN","hit_factor":8.7898},{"match_name":"DGC USPSA 05-13-18","match_date":"2018-05-13","stage_classifiercode":"03-04","member_number":"A87894","first_name":"DEVEN","last_name":"WAGNER","classification":"B","division":"OPEN","hit_factor":8.75},{"match_name":"FVPS July Point Series Match","match_date":"2017-07-01","stage_classifiercode":"03-04","member_number":"TY29443","first_name":"NICK","last_name":"KALISHEK","classification":"G","division":"OPEN","hit_factor":8.7218},{"match_name":"PMRPC USPSA 11Sep21","match_date":"2021-09-11","stage_classifiercode":"03-04","member_number":"A16652","first_name":"GREG","last_name":"FRIEDMAN","classification":"M","division":"OPEN","hit_factor":8.7186},{"match_name":"ISPS 4/17/2016 USPSA","match_date":"2016-04-17","stage_classifiercode":"03-04","member_number":"A58360","first_name":"BEAU","last_name":"BROWN","classification":"M","division":"OPEN","hit_factor":8.7087},{"match_name":"WPS USPSA Monthly Match April 2018","match_date":"2018-04-07","stage_classifiercode":"03-04","member_number":"A68001","first_name":"GUS","last_name":"VANETTEN","classification":"A","division":"OPEN","hit_factor":8.6957},{"match_name":"Idaho ISPS October 7th 2017","match_date":"2017-10-07","stage_classifiercode":"03-04","member_number":"A79438","first_name":"KOLBY","last_name":"PAVLOCK","classification":"G","division":"OPEN","hit_factor":8.6957},{"match_name":"OREGON ARPC CC05 USPSA JULY 14 2018","match_date":"2018-07-14","stage_classifiercode":"03-04","member_number":"L3775","first_name":"GENE","last_name":"MORIN","classification":"M","division":"OPEN","hit_factor":8.6957},{"match_name":"SWGC USPSA Pistol Match - July","match_date":"2016-07-02","stage_classifiercode":"03-04","member_number":"L2664","first_name":"JIM","last_name":"HILSENBECK","classification":"M","division":"OPEN","hit_factor":8.6957},{"match_name":"LGRPC Oct  2016","match_date":"2016-10-09","stage_classifiercode":"03-04","member_number":"A54549","first_name":"ROBERT","last_name":"BARNES","classification":"A","division":"OPEN","hit_factor":8.6842},{"match_name":"SPSA USPSA June 1st Sat Match","match_date":"2018-06-02","stage_classifiercode":"03-04","member_number":"TY90226","first_name":"JAMES","last_name":"TURNURE","classification":"G","division":"OPEN","hit_factor":8.6765},{"match_name":"SMPS March 2018","match_date":"2018-03-11","stage_classifiercode":"03-04","member_number":"FY80177","first_name":"PAUL","last_name":"DIERICKX","classification":"B","division":"OPEN","hit_factor":8.6728},{"match_name":"MVPSA USPSA  6-16-18","match_date":"2018-06-16","stage_classifiercode":"03-04","member_number":"A103560","first_name":"RILEY","last_name":"COOPER","classification":"A","division":"OPEN","hit_factor":8.6728},{"match_name":"CGGR  APRIL USPSA MATCH","match_date":"2018-04-20","stage_classifiercode":"03-04","member_number":"L3838","first_name":"NATHAN","last_name":"THOMPSON","classification":"M","division":"OPEN","hit_factor":8.6675},{"match_name":"Lefthanders Gun Club Practical Shooters September 2 and 3","match_date":"2017-09-02","stage_classifiercode":"03-04","member_number":"L2281","first_name":"J","last_name":"GRIFFIN","classification":"A","division":"OPEN","hit_factor":8.6563},{"match_name":"CSA  COALFIELDS SHOOTERS ASSOCIATION USPSA JULY 2020","match_date":"2020-07-12","stage_classifiercode":"03-04","member_number":"TY104241","first_name":"DAVID","last_name":"BOWEN","classification":"A","division":"OPEN","hit_factor":8.651},{"match_name":"SFPS 9-23-18 USPSA Match","match_date":"2018-09-23","stage_classifiercode":"03-04","member_number":"a111589","first_name":"STEVE","last_name":"NEWMAN","classification":"U","division":"OPEN","hit_factor":8.637},{"match_name":"HPPS 2-18-2017","match_date":"2017-02-16","stage_classifiercode":"03-04","member_number":"A59267","first_name":"BRAD","last_name":"MCKIERNAN","classification":"M","division":"OPEN","hit_factor":8.628},{"match_name":"MCPSL Pistol 6-11-16","match_date":"2016-06-11","stage_classifiercode":"03-04","member_number":"A35986","first_name":"YUTH","last_name":"J","classification":"M","division":"OPEN","hit_factor":8.6207},{"match_name":"OREGON ARPC CC05 USPSA JULY 14 2018","match_date":"2018-07-14","stage_classifiercode":"03-04","member_number":"TY80149","first_name":"JIM","last_name":"BOONE","classification":"A","division":"OPEN","hit_factor":8.6118},{"match_name":"Hopkinton August 2017","match_date":"2017-08-05","stage_classifiercode":"03-04","member_number":"TY79508","first_name":"SHANE","last_name":"FUNGAFAT","classification":"A","division":"OPEN","hit_factor":8.6093},{"match_name":"CCAS December 2018 Special Classifier","match_date":"2018-12-15","stage_classifiercode":"03-04","member_number":"TY101554","first_name":"ALBERT","last_name":"MONTANEZ","classification":"A","division":"OPEN","hit_factor":8.5938},{"match_name":"PRG October 2018 Match","match_date":"2018-10-07","stage_classifiercode":"03-04","member_number":"A78607","first_name":"AKITA","last_name":"YASUNARI","classification":"A","division":"OPEN","hit_factor":8.5926},{"match_name":"PRG October 2018 Match","match_date":"2018-10-07","stage_classifiercode":"03-04","member_number":"TY33599","first_name":"WILLIAM","last_name":"PAOLINO","classification":"M","division":"OPEN","hit_factor":8.5915},{"match_name":"April 2018 Match","match_date":"2018-05-01","stage_classifiercode":"03-04","member_number":"TY93363","first_name":"DEAN","last_name":"CHASSE","classification":"\"\"","division":"OPEN","hit_factor":8.5865},{"match_name":"SCS USPSA Pistol Match with Classifier - November 6 2016","match_date":"2016-11-06","stage_classifiercode":"03-04","member_number":"Ty37520","first_name":"JR","last_name":"RAMIREZ","classification":"M","division":"OPEN","hit_factor":8.5752},{"match_name":"CSA  COALFIELDS SHOOTERS ASSOCIATION USPSA JULY 2020","match_date":"2020-07-12","stage_classifiercode":"03-04","member_number":"A100644","first_name":"SETH","last_name":"LEWIS","classification":"A","division":"OPEN","hit_factor":8.5434},{"match_name":"AIPS Weekly USPSA 24 July 2018","match_date":"2018-07-24","stage_classifiercode":"03-04","member_number":"A65348","first_name":"CRAIG","last_name":"HABEL","classification":"B","division":"OPEN","hit_factor":8.5366},{"match_name":"MS06 Team Magnolia USPSA October Match","match_date":"2015-10-04","stage_classifiercode":"03-04","member_number":"TY34618","first_name":"BUD","last_name":"BERTHOLD","classification":"A","division":"OPEN","hit_factor":8.5161},{"match_name":"SFPS 9-23-18 USPSA Match","match_date":"2018-09-23","stage_classifiercode":"03-04","member_number":"b58","first_name":"SHERWYN","last_name":"GREENFIELD","classification":"M","division":"OPEN","hit_factor":8.5075},{"match_name":"Mesilla Valley P October 2020","match_date":"2020-10-18","stage_classifiercode":"03-04","member_number":"L2570","first_name":"DON","last_name":"BEDNORZ","classification":"G","division":"OPEN","hit_factor":8.5048},{"match_name":"Idaho ISPS October 7th 2017","match_date":"2017-10-07","stage_classifiercode":"03-04","member_number":"A99310","first_name":"JIM","last_name":"HICKS","classification":"C","division":"OPEN","hit_factor":8.4881},{"match_name":"ORSA USPSA February 2020 ","match_date":"2020-02-15","stage_classifiercode":"03-04","member_number":"A73262","first_name":"KEVIN","last_name":"SUFFRIDGE","classification":"A","division":"OPEN","hit_factor":8.4746},{"match_name":"LIPSA - April 29th 2018 - USPSA Special Classifier Match","match_date":"2018-04-29","stage_classifiercode":"03-04","member_number":"TY90280","first_name":"ANTHONY","last_name":"BRUNO","classification":"A","division":"OPEN","hit_factor":8.4722},{"match_name":"Renton USPSA August 2016 - NW05","match_date":"2016-08-28","stage_classifiercode":"03-04","member_number":"A71578","first_name":"KEITH","last_name":"TSANG","classification":"B","division":"OPEN","hit_factor":8.4433},{"match_name":"Prescott 1st Saturday 3-04-2017","match_date":"2017-03-04","stage_classifiercode":"03-04","member_number":"A54668","first_name":"DAVE","last_name":"ZINK","classification":"unclassified","division":"OPEN","hit_factor":8.4416},{"match_name":"Dundee USPSA Feb 2016","match_date":"2016-02-27","stage_classifiercode":"03-04","member_number":"TY63731","first_name":"JAN","last_name":"HASE","classification":"M","division":"OPEN","hit_factor":8.4225},{"match_name":"HPPS 10-16-2021","match_date":"2021-10-16","stage_classifiercode":"03-04","member_number":"A131376","first_name":"JAEDYN","last_name":"KINTER","classification":"B","division":"OPEN","hit_factor":8.4184},{"match_name":"MRPC OHS02 72218","match_date":"2018-07-22","stage_classifiercode":"03-04","member_number":"A46956","first_name":"CHRIS","last_name":"KEEN","classification":"G","division":"OPEN","hit_factor":8.4098},{"match_name":"RMAP 3rd Sunday Marh 2016","match_date":"2016-03-20","stage_classifiercode":"03-04","member_number":"TY85183","first_name":"DANNY","last_name":"D'ANGELO","classification":"A","division":"OPEN","hit_factor":8.396},{"match_name":"GPS OCTOBER 2018","match_date":"2018-10-28","stage_classifiercode":"03-04","member_number":"A82591","first_name":"WADE","last_name":"WHETSTONE","classification":"G","division":"OPEN","hit_factor":8.3916},{"match_name":"Feb Uspsa H&H Match","match_date":"2017-02-26","stage_classifiercode":"03-04","member_number":"A71435","first_name":"FEGEE","last_name":"MATLOCK","classification":"A","division":"OPEN","hit_factor":8.3784},{"match_name":"Hampden RPC July USPSA","match_date":"2017-07-16","stage_classifiercode":"03-04","member_number":"TY87309","first_name":"ANTHONY","last_name":"CHASE","classification":"B","division":"OPEN","hit_factor":8.377},{"match_name":"LTD Pistol - August 2018","match_date":"2018-08-04","stage_classifiercode":"03-04","member_number":"TY99820","first_name":"KLAY","last_name":"GROVER","classification":"A","division":"OPEN","hit_factor":8.3665},{"match_name":"SWGC USPSA Pistol Match - July","match_date":"2016-07-02","stage_classifiercode":"03-04","member_number":"A73345","first_name":"GARY","last_name":"CROUCH","classification":"M","division":"OPEN","hit_factor":8.3645},{"match_name":"MCRC USPSA March 2020","match_date":"2020-03-14","stage_classifiercode":"03-04","member_number":"A102564","first_name":"\"DONALD \"\"THOM\"\"\"","last_name":"POWERS","classification":"M","division":"OPEN","hit_factor":8.3478},{"match_name":"Mesilla Valley P October 2020","match_date":"2020-10-18","stage_classifiercode":"03-04","member_number":"TY111488","first_name":"GARRETT","last_name":"SCHUTZ","classification":"A","division":"OPEN","hit_factor":8.3333},{"match_name":"EAGC Classifier Match 1 February","match_date":"2020-02-02","stage_classifiercode":"03-04","member_number":"TY106020","first_name":"JACOB","last_name":"TAYLOR","classification":"M","division":"OPEN","hit_factor":8.3333},{"match_name":"OREGON ARPC CC05 USPSA JULY 14 2018","match_date":"2018-07-14","stage_classifiercode":"03-04","member_number":"L3893","first_name":"MIKE","last_name":"BURGESS","classification":"A","division":"OPEN","hit_factor":8.2921},{"match_name":"G2G September 28th USPSA Match","match_date":"2021-09-28","stage_classifiercode":"03-04","member_number":"TY101554","first_name":"ALBERT","last_name":"MONTANEZ","classification":"M","division":"OPEN","hit_factor":8.2474},{"match_name":"NRG April 23 2016","match_date":"2016-04-23","stage_classifiercode":"03-04","member_number":"\"\"","first_name":"JUN","last_name":"AGUILERA","classification":"M","division":"OPEN","hit_factor":8.2424},{"match_name":"HPPS 2-18-2017","match_date":"2017-02-16","stage_classifiercode":"03-04","member_number":"FY49558","first_name":"JOHN","last_name":"ARENAS","classification":"G","division":"OPEN","hit_factor":8.2232},{"match_name":"DGC USPSA 05-13-18","match_date":"2018-05-13","stage_classifiercode":"03-04","member_number":"A106020","first_name":"JACOB","last_name":"TAYLOR","classification":"B","division":"OPEN","hit_factor":8.2174},{"match_name":"BGSL First Sunday USPSA Match","match_date":"2016-02-07","stage_classifiercode":"03-04","member_number":"RD6","first_name":"MIKE","last_name":"FOLEY","classification":"A","division":"OPEN","hit_factor":8.2079},{"match_name":"Minnetonka game and fish June 30","match_date":"2021-06-30","stage_classifiercode":"03-04","member_number":"l2680","first_name":"JOHN","last_name":"KOPPI","classification":"A","division":"OPEN","hit_factor":8.1818},{"match_name":"SUPS USPSA 18-19 August 2018","match_date":"2018-08-18","stage_classifiercode":"03-04","member_number":"A69834","first_name":"DONOVAN","last_name":"MONTROSS","classification":"G","division":"OPEN","hit_factor":8.169},{"match_name":"RCPS USPSA Nov 14","match_date":"2020-11-14","stage_classifiercode":"03-04","member_number":"L4274","first_name":"JOHN","last_name":"TAYLOR","classification":"A","division":"OPEN","hit_factor":8.168},{"match_name":"MCRC USPSA September 2017","match_date":"2017-09-09","stage_classifiercode":"03-04","member_number":"A98916","first_name":"DILON","last_name":"PRICE","classification":"A","division":"OPEN","hit_factor":8.1657},{"match_name":"OREGON ARPC CC05 USPSA JULY 14 2018","match_date":"2018-07-14","stage_classifiercode":"03-04","member_number":"L4215","first_name":"MARK","last_name":"MCDONALD","classification":"A","division":"OPEN","hit_factor":8.1556},{"match_name":"BSPSC 2018 June MT Glock Match","match_date":"2018-06-10","stage_classifiercode":"03-04","member_number":"TY12199","first_name":"NEAL","last_name":"HANSEN","classification":"A","division":"OPEN","hit_factor":8.1509},{"match_name":"TAC2 USPSA Dec 2017","match_date":"2017-12-02","stage_classifiercode":"03-04","member_number":"A77313","first_name":"DAVID 2G","last_name":"STRUCKOFF","classification":"U","division":"OPEN","hit_factor":8.1481},{"match_name":"Idaho ISPS October 7th 2017","match_date":"2017-10-07","stage_classifiercode":"03-04","member_number":"TY94890","first_name":"CHRIS","last_name":"CLARK","classification":"B","division":"OPEN","hit_factor":8.1395},{"match_name":"Blackstone Shooting Sports July 2017 USPSA Pistol Level 1","match_date":"2017-07-11","stage_classifiercode":"03-04","member_number":"L3906","first_name":"ARIC","last_name":"COWART","classification":"A","division":"OPEN","hit_factor":8.1126},{"match_name":"PMRPC September 2018 USPSA","match_date":"2018-09-08","stage_classifiercode":"03-04","member_number":"TY46304","first_name":"JAMES","last_name":"SALINGER","classification":"C","division":"OPEN","hit_factor":8.1114},{"match_name":"PMRPC September 2018 USPSA","match_date":"2018-09-08","stage_classifiercode":"03-04","member_number":"L4276","first_name":"PAUL","last_name":"SMITH","classification":"C","division":"OPEN","hit_factor":8.0946},{"match_name":"SPSA USPSA October 4th Sat match","match_date":"2016-10-22","stage_classifiercode":"03-04","member_number":"TY66249","first_name":"BILL","last_name":"ROBERTS","classification":"A","division":"OPEN","hit_factor":8.082},{"match_name":"EAPS February 2018 USPSA","match_date":"2018-02-18","stage_classifiercode":"03-04","member_number":"L4169","first_name":"JP","last_name":"GARCIA","classification":"B","division":"OPEN","hit_factor":8.0605},{"match_name":"Low Country USPSA  March 24th","match_date":"2018-03-24","stage_classifiercode":"03-04","member_number":"A104727","first_name":"KEVIN","last_name":"STICKLEY","classification":"M","division":"OPEN","hit_factor":8.0477},{"match_name":"NRG April 23 2016","match_date":"2016-04-23","stage_classifiercode":"03-04","member_number":"Ty24813","first_name":"RALPH","last_name":"ARREDONDO","classification":"M","division":"OPEN","hit_factor":8.0446},{"match_name":"SCCPSA USPSA Jul 17 2021","match_date":"2021-07-17","stage_classifiercode":"03-04","member_number":"FY100686","first_name":"SEAN","last_name":"COLLINS","classification":"A","division":"OPEN","hit_factor":8.0311},{"match_name":"CGGR  APRIL USPSA MATCH","match_date":"2018-04-20","stage_classifiercode":"03-04","member_number":"A63410","first_name":"EDDIE","last_name":"HUGHES","classification":"B","division":"OPEN","hit_factor":8.0103},{"match_name":"OREGON ARPC CC05 USPSA JULY 14 2018","match_date":"2018-07-14","stage_classifiercode":"03-04","member_number":"a-4993","first_name":"BUTCH","last_name":"MASSONI","classification":"M","division":"OPEN","hit_factor":8.01},{"match_name":"ORSA USPSA February 2020 ","match_date":"2020-02-15","stage_classifiercode":"03-04","member_number":"TY92055","first_name":"BRYAN","last_name":"KISER","classification":"B","division":"OPEN","hit_factor":8.0051},{"match_name":"RMAP 3rd Sunday Marh 2016","match_date":"2016-03-20","stage_classifiercode":"03-04","member_number":"TY83533","first_name":"ANDY","last_name":"FEIGIN","classification":"B","division":"OPEN","hit_factor":8.0048},{"match_name":"Quantico QPS December 13 USPSA","match_date":"2015-12-13","stage_classifiercode":"03-04","member_number":"L750","first_name":"MIKE","last_name":"SPENCER","classification":"A","division":"OPEN","hit_factor":8.0048},{"match_name":"LCSC USPSA   8-13-17","match_date":"2017-08-08","stage_classifiercode":"03-04","member_number":"Fy81272","first_name":"GAYLORD","last_name":"GABRIEL","classification":"A","division":"OPEN","hit_factor":8},{"match_name":"HPPS 2-18-2017","match_date":"2017-02-16","stage_classifiercode":"03-04","member_number":"A69423","first_name":"JOSH","last_name":"HORNER","classification":"M","division":"OPEN","hit_factor":7.9949},{"match_name":"OREGON ARPC CC05 USPSA JULY 14 2018","match_date":"2018-07-14","stage_classifiercode":"03-04","member_number":"Ty85507","first_name":"JONATHAN","last_name":"PURTZER","classification":"M","division":"OPEN","hit_factor":7.9857},{"match_name":"July USPSA","match_date":"2021-07-25","stage_classifiercode":"03-04","member_number":"A128035","first_name":"TAYLOR","last_name":"LATHAM","classification":"B","division":"OPEN","hit_factor":7.9794},{"match_name":"Springfield Tactical Shooters 11/01/2018","match_date":"2018-11-01","stage_classifiercode":"03-04","member_number":"L2281","first_name":"J","last_name":"GRIFFIN","classification":"A","division":"OPEN","hit_factor":7.973},{"match_name":"PRG October 2018 Match","match_date":"2018-10-07","stage_classifiercode":"03-04","member_number":"A87556","first_name":"ROB","last_name":"CHOI","classification":"M","division":"OPEN","hit_factor":7.9602},{"match_name":"Lefthanders Gun Club Practical Shooters September 2 and 3","match_date":"2017-09-02","stage_classifiercode":"03-04","member_number":"TY78405","first_name":"SEAN","last_name":"ROLEN","classification":"B","division":"OPEN","hit_factor":7.9595},{"match_name":"USPSA","match_date":"2021-06-06","stage_classifiercode":"03-04","member_number":"A128035","first_name":"TAYLOR","last_name":"LATHAM","classification":"B","division":"OPEN","hit_factor":7.9518},{"match_name":"SSS USPSA May 2020","match_date":"2020-05-17","stage_classifiercode":"03-04","member_number":"A104744","first_name":"DAVID","last_name":"LYELL","classification":"M (Master)","division":"OPEN","hit_factor":7.9518},{"match_name":"CGGR  APRIL USPSA MATCH","match_date":"2018-04-20","stage_classifiercode":"03-04","member_number":"A104727","first_name":"KEVIN","last_name":"STICKLEY","classification":"M","division":"OPEN","hit_factor":7.9462},{"match_name":"FVPS July Point Series Match","match_date":"2017-07-01","stage_classifiercode":"03-04","member_number":"TY72120","first_name":"DAVE","last_name":"DEYOE","classification":"M","division":"OPEN","hit_factor":7.9327},{"match_name":"Prescott 1st Saturday 3-04-2017","match_date":"2017-03-04","stage_classifiercode":"03-04","member_number":"TY79879","first_name":"FRANK","last_name":"BARBARO","classification":"B","division":"OPEN","hit_factor":7.9075},{"match_name":"Gem City Gun Club 5-5 and 5-6-18","match_date":"2018-05-05","stage_classifiercode":"03-04","member_number":"A55013","first_name":"RICHARD","last_name":"GENNARO","classification":"A","division":"OPEN","hit_factor":7.9046},{"match_name":"CSA  COALFIELDS SHOOTERS ASSOCIATION USPSA JULY 2020","match_date":"2020-07-12","stage_classifiercode":"03-04","member_number":"A89266","first_name":"SCOTT","last_name":"RIDDLE","classification":"B","division":"OPEN","hit_factor":7.8979},{"match_name":"Gps   November 2015","match_date":"2015-11-22","stage_classifiercode":"03-04","member_number":"TY46456","first_name":"ALEX","last_name":"CASIS","classification":"A","division":"OPEN","hit_factor":7.8978},{"match_name":"DGC USPSA 05-13-18","match_date":"2018-05-13","stage_classifiercode":"03-04","member_number":"TY87135","first_name":"ENVER","last_name":"FOCAKOVIC","classification":"A","division":"OPEN","hit_factor":7.8902},{"match_name":"Cactus USPSA ALL CLASSIFIER September 2020","match_date":"2020-09-06","stage_classifiercode":"03-04","member_number":"A113308","first_name":"ADAM","last_name":"JOHNSTON","classification":"B","division":"OPEN","hit_factor":7.8818},{"match_name":"Hopkinton August 2017","match_date":"2017-08-05","stage_classifiercode":"03-04","member_number":"L4262","first_name":"STEWART","last_name":"GINSBERG","classification":"B","division":"OPEN","hit_factor":7.8795},{"match_name":"NRG April 23 2016","match_date":"2016-04-23","stage_classifiercode":"03-04","member_number":"A26171","first_name":"JOEY","last_name":"CASTILLO","classification":"B","division":"OPEN","hit_factor":7.875},{"match_name":"Dundee USPSA Feb 2016","match_date":"2016-02-27","stage_classifiercode":"03-04","member_number":"A89438","first_name":"NICHOLAS","last_name":"STOCKWELL","classification":"M","division":"OPEN","hit_factor":7.8652},{"match_name":"MPSA USPSA 021718","match_date":"2018-02-17","stage_classifiercode":"03-04","member_number":"A-92885","first_name":"TAYLOR","last_name":"ZIMMERMAN","classification":"B","division":"OPEN","hit_factor":7.8522},{"match_name":"LCSC USPSA   8-13-17","match_date":"2017-08-08","stage_classifiercode":"03-04","member_number":"A63834","first_name":"EDWIN","last_name":"CUCIO","classification":"B","division":"OPEN","hit_factor":7.8335},{"match_name":"SAPSC Monthly USPSA Classifier Match at Autreys Armory 20180612","match_date":"2018-06-12","stage_classifiercode":"03-04","member_number":"A79845","first_name":"JOHNNY","last_name":"REED","classification":"A","division":"OPEN","hit_factor":7.8322},{"match_name":"MCPSL Pistol 5-8-2021","match_date":"2021-05-08","stage_classifiercode":"03-04","member_number":"A90285","first_name":"CHRIS","last_name":"HOOVER","classification":"A","division":"OPEN","hit_factor":7.8273},{"match_name":"SCCPSA USPSA SEPTEMBER 15 MATCH","match_date":"2018-09-15","stage_classifiercode":"03-04","member_number":"A102632","first_name":"BILL","last_name":"COLEMAN","classification":"C","division":"OPEN","hit_factor":7.8251},{"match_name":"Richmond Hot Shots February 20 and 21 - 2016 USPSA Match","match_date":"2016-02-20","stage_classifiercode":"03-04","member_number":"A51918","first_name":"TIM","last_name":"BOFMAN","classification":"A","division":"OPEN","hit_factor":7.8205},{"match_name":"MCPSL Pistol 12-9-17","match_date":"2017-12-09","stage_classifiercode":"03-04","member_number":"TY29453","first_name":"JD","last_name":"SMITH","classification":"M","division":"OPEN","hit_factor":7.8144},{"match_name":"RMAP 3rd Sunday Marh 2016","match_date":"2016-03-20","stage_classifiercode":"03-04","member_number":"TY92648","first_name":"E.T.","last_name":"SAFFON","classification":"B","division":"OPEN","hit_factor":7.8067},{"match_name":"WTPS USPSA October Match 10-8-16","match_date":"2016-10-08","stage_classifiercode":"03-04","member_number":"TY4180","first_name":"JAY","last_name":"TAPPE","classification":"A","division":"OPEN","hit_factor":7.7907},{"match_name":"Custer USPSA Mar 7th 2021","match_date":"2021-03-07","stage_classifiercode":"03-04","member_number":"TY114649","first_name":"JORDAN","last_name":"ROGERS","classification":"M","division":"OPEN","hit_factor":7.7764},{"match_name":"LdF 2nd Saturday Match","match_date":"2016-01-09","stage_classifiercode":"03-04","member_number":"FY39124","first_name":"RAMIRO","last_name":"REYES","classification":"M","division":"OPEN","hit_factor":7.753},{"match_name":"MRPC OHS02 72218","match_date":"2018-07-22","stage_classifiercode":"03-04","member_number":"FY64885","first_name":"KEVIN","last_name":"SANDERS","classification":"A","division":"OPEN","hit_factor":7.7491},{"match_name":"PRG October 2018 Match","match_date":"2018-10-07","stage_classifiercode":"03-04","member_number":"A79771","first_name":"RANDALL","last_name":"NG","classification":"M","division":"OPEN","hit_factor":7.7409},{"match_name":"Collin County USPSA July 30th 2017","match_date":"2017-07-30","stage_classifiercode":"03-04","member_number":"TY85507","first_name":"JONATHAN","last_name":"PURTZER","classification":"A","division":"OPEN","hit_factor":7.7348},{"match_name":"MCPSL Pistol 6-11-16","match_date":"2016-06-11","stage_classifiercode":"03-04","member_number":"A66504","first_name":"HARRISON","last_name":"BOATRIGHT","classification":"B","division":"OPEN","hit_factor":7.7263},{"match_name":"Richmond Hot Shots February 20 and 21 - 2016 USPSA Match","match_date":"2016-02-20","stage_classifiercode":"03-04","member_number":"TY76701","first_name":"GLENN","last_name":"FANNIN","classification":"A","division":"OPEN","hit_factor":7.7215},{"match_name":"SFPS 9-23-18 USPSA Match","match_date":"2018-09-23","stage_classifiercode":"03-04","member_number":"a36760","first_name":"TOM","last_name":"BALKO","classification":"M","division":"OPEN","hit_factor":7.721},{"match_name":"Maine Practical Shooters September 2018","match_date":"2018-09-22","stage_classifiercode":"03-04","member_number":"A98632","first_name":"ZACHARY","last_name":"GREENIER","classification":"B","division":"OPEN","hit_factor":7.7197},{"match_name":"Pelham USPSA 2018-08-19","match_date":"2018-08-19","stage_classifiercode":"03-04","member_number":"TY79508","first_name":"SHANE","last_name":"FUNGAFAT","classification":"A","division":"OPEN","hit_factor":7.7189},{"match_name":"SLOSA FEBRUARY 2020 USPSA MATCH","match_date":"2020-02-08","stage_classifiercode":"03-04","member_number":"TY87459","first_name":"AARON","last_name":"RUNYAN","classification":"B","division":"OPEN","hit_factor":7.7185},{"match_name":"Low Country USPSA  March 24th","match_date":"2018-03-24","stage_classifiercode":"03-04","member_number":"A88984","first_name":"NEREO","last_name":"PARRENO","classification":"B","division":"OPEN","hit_factor":7.7135},{"match_name":"EAPS July 2016 USPSA","match_date":"2016-07-17","stage_classifiercode":"03-04","member_number":"A68960","first_name":"TYLER","last_name":"HUFF","classification":"B","division":"OPEN","hit_factor":7.6923},{"match_name":"Cactus USPSA ALL CLASSIFIER September 2020","match_date":"2020-09-06","stage_classifiercode":"03-04","member_number":"A104053","first_name":"RAYMOND","last_name":"GALLEGOS","classification":"B","division":"OPEN","hit_factor":7.6923},{"match_name":"TAC2 USPSA Dec 2017","match_date":"2017-12-02","stage_classifiercode":"03-04","member_number":"TY62447","first_name":"ADRIAN 2G","last_name":"COBB","classification":"U","division":"OPEN","hit_factor":7.6832},{"match_name":"Shoot GTR Monthly USPSA April Classifier Side Match","match_date":"2018-04-09","stage_classifiercode":"03-04","member_number":"A66327","first_name":"JULIO","last_name":"SALADO","classification":"B","division":"OPEN","hit_factor":7.6744},{"match_name":"Gem City Gun Club 8-5 and 6th 2017","match_date":"2017-08-05","stage_classifiercode":"03-04","member_number":"L2551","first_name":"DEREK","last_name":"ZMOZYNSKI","classification":"M","division":"OPEN","hit_factor":7.6741},{"match_name":"PRG October 2018 Match","match_date":"2018-10-07","stage_classifiercode":"03-04","member_number":"\"\"","first_name":"BRETT","last_name":"HEITMANN","classification":"U","division":"OPEN","hit_factor":7.6397},{"match_name":"USAH New Years Pistol & PCC Match","match_date":"2020-01-19","stage_classifiercode":"03-04","member_number":"L2624","first_name":"MARIO","last_name":"LAYUGAN","classification":"A","division":"OPEN","hit_factor":7.6381},{"match_name":"SWGC USPSA Pistol Match - July","match_date":"2016-07-02","stage_classifiercode":"03-04","member_number":"TY39085","first_name":"MARTIN","last_name":"LITTLE","classification":"M","division":"OPEN","hit_factor":7.631},{"match_name":"Shoot GTR Monthly USPSA April Classifier Side Match","match_date":"2018-04-09","stage_classifiercode":"03-04","member_number":"TY91472","first_name":"BRUCE","last_name":"STEIN","classification":"B","division":"OPEN","hit_factor":7.6271},{"match_name":"Custer USPSA May","match_date":"2018-05-06","stage_classifiercode":"03-04","member_number":"TY96141","first_name":"JAIMEE","last_name":"MENDOZA","classification":"A","division":"OPEN","hit_factor":7.625},{"match_name":"Gem City Gun Club 8-5 and 6th 2017","match_date":"2017-08-05","stage_classifiercode":"03-04","member_number":"L2450","first_name":"BUD","last_name":"CONNOLLY","classification":"B","division":"OPEN","hit_factor":7.6212},{"match_name":"SSS USPSA May 2020","match_date":"2020-05-17","stage_classifiercode":"03-04","member_number":"A104252","first_name":"ROB","last_name":"TEAGUE","classification":"B (B Class)","division":"OPEN","hit_factor":7.6112},{"match_name":"Shoot GTR USPSA 2/5","match_date":"2017-02-04","stage_classifiercode":"03-04","member_number":"TY34497","first_name":"PATRICK","last_name":"GAUVIN","classification":"A","division":"OPEN","hit_factor":7.605},{"match_name":"IN18 SCGC USPSA 06 June 2021","match_date":"2021-06-06","stage_classifiercode":"03-04","member_number":"TY115405","first_name":"JAMES","last_name":"COCKING","classification":"B","division":"OPEN","hit_factor":7.5904},{"match_name":"ORSA USPSA March 2017 Shaken Not Stirred Special","match_date":"2017-03-18","stage_classifiercode":"03-04","member_number":"A87894","first_name":"DEVEN","last_name":"WAGNER","classification":"B","division":"OPEN","hit_factor":7.5853},{"match_name":"SPSA USPSA December 4th Sat match","match_date":"2018-12-22","stage_classifiercode":"03-04","member_number":"FY65656","first_name":"GARRIS","last_name":"MERCER","classification":"A","division":"OPEN","hit_factor":7.5846},{"match_name":"MCPSL Pistol 12-9-17","match_date":"2017-12-09","stage_classifiercode":"03-04","member_number":"A72049","first_name":"MARK","last_name":"KLINEFELTER","classification":"C","division":"OPEN","hit_factor":7.5758},{"match_name":"EDPS USPSA Sept 5","match_date":"2020-09-05","stage_classifiercode":"03-04","member_number":"A11035","first_name":"JOE","last_name":"MORROW","classification":"M","division":"OPEN","hit_factor":7.5621},{"match_name":"JCSSA Mar3 2018","match_date":"2018-03-03","stage_classifiercode":"03-04","member_number":"A69625","first_name":"KEITH","last_name":"GYGER","classification":"A","division":"OPEN","hit_factor":7.5601},{"match_name":"LIPSA - April 29th 2018 - USPSA Special Classifier Match","match_date":"2018-04-29","stage_classifiercode":"03-04","member_number":"A81323","first_name":"JOE","last_name":"DRAGHI","classification":"A","division":"OPEN","hit_factor":7.5574},{"match_name":"SMPS March 2018","match_date":"2018-03-11","stage_classifiercode":"03-04","member_number":"FY15413","first_name":"THOMAS","last_name":"SUIT","classification":"A","division":"OPEN","hit_factor":7.5107},{"match_name":"SPSA USPSA October 4th Sat match","match_date":"2016-10-22","stage_classifiercode":"03-04","member_number":"A91357","first_name":"BEN","last_name":"LANGFORD","classification":"A","division":"OPEN","hit_factor":7.5104},{"match_name":"WVRPC USPSA 2APR2016","match_date":"2016-04-02","stage_classifiercode":"03-04","member_number":"L2755","first_name":"LINCOLN","last_name":"CARR","classification":"A","division":"OPEN","hit_factor":7.5058},{"match_name":"CSA  COALFIELDS SHOOTERS ASSOCIATION USPSA JULY 2020","match_date":"2020-07-12","stage_classifiercode":"03-04","member_number":"A110946","first_name":"BRIAN","last_name":"KELLER","classification":"A","division":"OPEN","hit_factor":7.4939},{"match_name":"EAPS February 2018 USPSA","match_date":"2018-02-18","stage_classifiercode":"03-04","member_number":"TY63532","first_name":"GEORGE","last_name":"HEMSTAD","classification":"M","division":"OPEN","hit_factor":7.4906},{"match_name":"SPSA USPSA June 1st Sat Match","match_date":"2018-06-02","stage_classifiercode":"03-04","member_number":"A67648","first_name":"ROBERT","last_name":"HOLLEMAN","classification":"B","division":"OPEN","hit_factor":7.489},{"match_name":"Shoot GTR USPSA 2/5","match_date":"2017-02-04","stage_classifiercode":"03-04","member_number":"TY27735","first_name":"BOB","last_name":"MILLS","classification":"A","division":"OPEN","hit_factor":7.4661},{"match_name":"Pelham USPSA 2018-08-19","match_date":"2018-08-19","stage_classifiercode":"03-04","member_number":"A34817","first_name":"DANIEL","last_name":"DIGIOVINE JR","classification":"A","division":"OPEN","hit_factor":7.4627},{"match_name":"May 8 2021 The Range At True North USPSA Match","match_date":"2021-05-08","stage_classifiercode":"03-04","member_number":"L729","first_name":"ROBERT","last_name":"WALKER","classification":"A","division":"OPEN","hit_factor":7.4541},{"match_name":"CCAS April 2017","match_date":"2017-04-15","stage_classifiercode":"03-04","member_number":"L3620","first_name":"STEVE","last_name":"FOUTZ","classification":"B","division":"OPEN","hit_factor":7.4519},{"match_name":"BSPSC 2018 June MT Glock Match","match_date":"2018-06-10","stage_classifiercode":"03-04","member_number":"A82330","first_name":"DAVID","last_name":"WILLIAMS","classification":"A","division":"OPEN","hit_factor":7.4362},{"match_name":"WGC WI USPSA Monthly Match 5-19-18","match_date":"2018-05-19","stage_classifiercode":"03-04","member_number":"A68824","first_name":"KELSEY","last_name":"SCHAEFER","classification":"B","division":"OPEN","hit_factor":7.4279},{"match_name":"Shot Through The Heart","match_date":"2017-02-26","stage_classifiercode":"03-04","member_number":"a87962","first_name":"DANIEL","last_name":"SIMPLICIANO","classification":"B","division":"OPEN","hit_factor":7.4197},{"match_name":"SWGC USPSA Pistol Match - July","match_date":"2016-07-02","stage_classifiercode":"03-04","member_number":"L3974","first_name":"ANDY","last_name":"KWON","classification":"A","division":"OPEN","hit_factor":7.4163},{"match_name":"SCS USPSA Pistol Match with Classifier - November 6 2016","match_date":"2016-11-06","stage_classifiercode":"03-04","member_number":"TY71969","first_name":"ZELJKO","last_name":"LUCIC","classification":"M","division":"OPEN","hit_factor":7.4032},{"match_name":"SPSA USPSA June 1st Sat Match","match_date":"2018-06-02","stage_classifiercode":"03-04","member_number":"A93370","first_name":"CRAIG","last_name":"HOOKS","classification":"M","division":"OPEN","hit_factor":7.3983},{"match_name":"Custer USPSA May","match_date":"2018-05-06","stage_classifiercode":"03-04","member_number":"TY76563","first_name":"SORIDA","last_name":"EAP","classification":"A","division":"OPEN","hit_factor":7.3944},{"match_name":"SLOSA FEBRUARY 2020 USPSA MATCH","match_date":"2020-02-08","stage_classifiercode":"03-04","member_number":"L1620","first_name":"THOMAS","last_name":"CHAN","classification":"A","division":"OPEN","hit_factor":7.3897},{"match_name":"Parma 2018 April USPSA","match_date":"2018-04-21","stage_classifiercode":"03-04","member_number":"TY99310","first_name":"JIM","last_name":"HICKS","classification":"C","division":"OPEN","hit_factor":7.387},{"match_name":"Low Country USPSA  March 24th","match_date":"2018-03-24","stage_classifiercode":"03-04","member_number":"FY96230","first_name":"DALE","last_name":"COBERLY","classification":"C","division":"OPEN","hit_factor":7.3826},{"match_name":"Portage-Summit Field and Stream - OH17 - 2015-10-17","match_date":"2015-10-17","stage_classifiercode":"03-04","member_number":"TY66305","first_name":"HERB","last_name":"SMITH","classification":"B","division":"OPEN","hit_factor":7.3801},{"match_name":"Laser Ninja Dragon League USPSA September 2017 fixed","match_date":"2017-09-03","stage_classifiercode":"03-04","member_number":"A101336","first_name":"BOBBY","last_name":"IVESTER","classification":"B","division":"OPEN","hit_factor":7.378},{"match_name":"Gem City Gun Club 8-5 and 6th 2017","match_date":"2017-08-05","stage_classifiercode":"03-04","member_number":"A37984","first_name":"JEFF","last_name":"WALTERS","classification":"C","division":"OPEN","hit_factor":7.3613},{"match_name":"Richmond Hot Shots February 20 and 21 - 2016 USPSA Match","match_date":"2016-02-20","stage_classifiercode":"03-04","member_number":"A38711","first_name":"KENNETH","last_name":"MELTON","classification":"B","division":"OPEN","hit_factor":7.3494},{"match_name":"May 8 2021 The Range At True North USPSA Match","match_date":"2021-05-08","stage_classifiercode":"03-04","member_number":"L4056","first_name":"DILLION","last_name":"WALKER","classification":"M","division":"OPEN","hit_factor":7.3427},{"match_name":"WGC WI USPSA Monthly Match 5-19-18","match_date":"2018-05-19","stage_classifiercode":"03-04","member_number":"FY104506","first_name":"KEVIN","last_name":"OWENS","classification":"C","division":"OPEN","hit_factor":7.3415},{"match_name":"PRG October 2018 Match","match_date":"2018-10-07","stage_classifiercode":"03-04","member_number":"\"\"","first_name":"ANDREW","last_name":"GOLEZ","classification":"U","division":"OPEN","hit_factor":7.3384},{"match_name":"Cactus USPSA November 2021","match_date":"2021-11-07","stage_classifiercode":"03-04","member_number":"ty85183","first_name":"DANNY","last_name":"D'ANGELO","classification":"A","division":"OPEN","hit_factor":7.3373},{"match_name":"ISPS CLASSIFIER 07/30/16 ","match_date":"2016-07-30","stage_classifiercode":"03-04","member_number":"TY85305","first_name":"ROBERT","last_name":"FLINT","classification":"U","division":"OPEN","hit_factor":7.3355},{"match_name":"Gem City Gun Club 5-5 and 5-6-18","match_date":"2018-05-05","stage_classifiercode":"03-04","member_number":"A55013","first_name":"RICHARD","last_name":"GENNARO","classification":"A","division":"OPEN","hit_factor":7.3252},{"match_name":"SAPSC Monthly USPSA Classifier Match 20161011","match_date":"2016-10-11","stage_classifiercode":"03-04","member_number":"A93439","first_name":"CHRIS","last_name":"ELLIS","classification":"B","division":"OPEN","hit_factor":7.3197},{"match_name":"WVPPS September 2018","match_date":"2018-09-16","stage_classifiercode":"03-04","member_number":"A99001","first_name":"MATT","last_name":"SPANNAN","classification":"B","division":"OPEN","hit_factor":7.3059},{"match_name":"MCPSL Pistol 6-11-16","match_date":"2016-06-11","stage_classifiercode":"03-04","member_number":"L1870","first_name":"LES","last_name":"COX","classification":"M","division":"OPEN","hit_factor":7.2952},{"match_name":"Parma 2018 April USPSA","match_date":"2018-04-21","stage_classifiercode":"03-04","member_number":"ty85172","first_name":"MIKE","last_name":"O'LEARY","classification":"M","division":"OPEN","hit_factor":7.2857},{"match_name":"Shot Through The Heart","match_date":"2017-02-26","stage_classifiercode":"03-04","member_number":"Ty88904","first_name":"JOHN","last_name":"SIMS","classification":"A","division":"OPEN","hit_factor":7.2748},{"match_name":"SMPS June 2016","match_date":"2016-06-12","stage_classifiercode":"03-04","member_number":"A82592","first_name":"THOMAS","last_name":"KOH","classification":"A","division":"OPEN","hit_factor":7.2707},{"match_name":"NRG April 23 2016","match_date":"2016-04-23","stage_classifiercode":"03-04","member_number":"fy18903","first_name":"PHIL","last_name":"JOHNSON","classification":"A","division":"OPEN","hit_factor":7.2664},{"match_name":"Pelham USPSA 2018-08-19","match_date":"2018-08-19","stage_classifiercode":"03-04","member_number":"TY63853","first_name":"DAVE","last_name":"GIRARDIN","classification":"M","division":"OPEN","hit_factor":7.2655},{"match_name":"Cactus USPSA February 2021","match_date":"2021-02-07","stage_classifiercode":"03-04","member_number":"A122959","first_name":"BRANDON","last_name":"ENGBRECHT","classification":"M","division":"OPEN","hit_factor":7.248},{"match_name":"SUPS USPSA 18-19 August 2018","match_date":"2018-08-18","stage_classifiercode":"03-04","member_number":"L4218","first_name":"RON","last_name":"SILVERIO","classification":"A","division":"OPEN","hit_factor":7.2345},{"match_name":"Collin County USPSA July 30th 2017","match_date":"2017-07-30","stage_classifiercode":"03-04","member_number":"TY56332","first_name":"DERON","last_name":"WOOD","classification":"A","division":"OPEN","hit_factor":7.2345},{"match_name":"CGGR  APRIL USPSA MATCH","match_date":"2018-04-20","stage_classifiercode":"03-04","member_number":"FY96230","first_name":"DALE","last_name":"COBERLY","classification":"B","division":"OPEN","hit_factor":7.2264},{"match_name":"OREGON ARPC CC05 USPSA JULY 14 2018","match_date":"2018-07-14","stage_classifiercode":"03-04","member_number":"A81898","first_name":"JIM","last_name":"BREEN","classification":"B","division":"OPEN","hit_factor":7.1966},{"match_name":"Springfield Tactical Shooters 03/05/2020","match_date":"2020-03-05","stage_classifiercode":"03-04","member_number":"FY59095","first_name":"SHELBY","last_name":"STOCKTON","classification":"\"\"","division":"OPEN","hit_factor":7.1888},{"match_name":"Pathfinder July 2021 USPSA","match_date":"2021-07-18","stage_classifiercode":"03-04","member_number":"A83981","first_name":"ADAM","last_name":"HARRIS","classification":"B","division":"OPEN","hit_factor":7.1875},{"match_name":"CSA  COALFIELDS SHOOTERS ASSOCIATION USPSA JULY 2020","match_date":"2020-07-12","stage_classifiercode":"03-04","member_number":"TY103689","first_name":"BOBBY","last_name":"LEWIS","classification":"B","division":"OPEN","hit_factor":7.1817},{"match_name":"NRG April 23 2016","match_date":"2016-04-23","stage_classifiercode":"03-04","member_number":"A64201","first_name":"CLAUDIA","last_name":"VIDANES","classification":"B","division":"OPEN","hit_factor":7.1749},{"match_name":"EAGC March 2017 USPSA Pistol Match","match_date":"2017-03-19","stage_classifiercode":"03-04","member_number":"FY28307","first_name":"DAN","last_name":"MITCHELL","classification":"M","division":"OPEN","hit_factor":7.1749},{"match_name":"August 2018 CAS USPSA","match_date":"2018-08-05","stage_classifiercode":"03-04","member_number":"A98482","first_name":"AARON","last_name":"FITZGERALD","classification":"B","division":"OPEN","hit_factor":7.1739},{"match_name":"ACPSA January 2017","match_date":"2017-01-28","stage_classifiercode":"03-04","member_number":"A92025","first_name":"MATT","last_name":"MORRISON","classification":"U","division":"OPEN","hit_factor":7.1661},{"match_name":"Collin County USPSA July 30th 2017","match_date":"2017-07-30","stage_classifiercode":"03-04","member_number":"TY36494","first_name":"ROBERT","last_name":"PORTER","classification":"B","division":"OPEN","hit_factor":7.1651},{"match_name":"Springfield Tactical Shooters 11/01/2018","match_date":"2018-11-01","stage_classifiercode":"03-04","member_number":"L3651","first_name":"RYAN","last_name":"BRADLEY","classification":"A","division":"OPEN","hit_factor":7.1591},{"match_name":"SAPS Match 5/1/2021","match_date":"2021-05-01","stage_classifiercode":"03-04","member_number":"A93152","first_name":"DAN","last_name":"SIMMONS","classification":"U","division":"OPEN","hit_factor":7.1579},{"match_name":"SMPS March 2018","match_date":"2018-03-11","stage_classifiercode":"03-04","member_number":"FY62313","first_name":"TONY","last_name":"GIMMELLIE","classification":"U","division":"OPEN","hit_factor":7.1577},{"match_name":"FVPS July Point Series Match","match_date":"2017-07-01","stage_classifiercode":"03-04","member_number":"A74632","first_name":"SETH","last_name":"GYLDENVAND","classification":"B","division":"OPEN","hit_factor":7.1514},{"match_name":"Gem City Gun Club 5-5 and 5-6-18","match_date":"2018-05-05","stage_classifiercode":"03-04","member_number":"L2450","first_name":"BUD","last_name":"CONNOLLY","classification":"B","division":"OPEN","hit_factor":7.1507},{"match_name":"LCSC USPSA   8-13-17","match_date":"2017-08-08","stage_classifiercode":"03-04","member_number":"FY69835","first_name":"JEREMY","last_name":"JAVIER","classification":"B","division":"OPEN","hit_factor":7.1503},{"match_name":"Laser Ninja Dragon League USPSA September 2017 fixed","match_date":"2017-09-03","stage_classifiercode":"03-04","member_number":"L3620","first_name":"STEVE","last_name":"FOUTZ","classification":"B","division":"OPEN","hit_factor":7.1429},{"match_name":"Gem City Gun Club 5-5 and 5-6-18","match_date":"2018-05-05","stage_classifiercode":"03-04","member_number":"A37984","first_name":"JEFF","last_name":"WALTERS","classification":"B","division":"OPEN","hit_factor":7.1429},{"match_name":"PRG October 2018 Match","match_date":"2018-10-07","stage_classifiercode":"03-04","member_number":"FY24813","first_name":"RALPH","last_name":"ARREDONDO","classification":"U","division":"OPEN","hit_factor":7.1429},{"match_name":"Springfield Tactical Shooters 03/05/2020","match_date":"2020-03-05","stage_classifiercode":"03-04","member_number":"A123212","first_name":"JEREMY","last_name":"SHURES","classification":"\"\"","division":"OPEN","hit_factor":7.1338},{"match_name":"PRPS USPSA Apr  29 2018","match_date":"2018-04-15","stage_classifiercode":"03-04","member_number":"A84438","first_name":"TYSON","last_name":"DIXON","classification":"A","division":"OPEN","hit_factor":7.1277},{"match_name":"FVPS November USPSA Match","match_date":"2018-11-03","stage_classifiercode":"03-04","member_number":"L4481","first_name":"OUSMANE","last_name":"DIALLO","classification":"B","division":"OPEN","hit_factor":7.1267},{"match_name":"Dundee USPSA Feb 2016","match_date":"2016-02-27","stage_classifiercode":"03-04","member_number":"TY58134","first_name":"DAN","last_name":"CARPENTER","classification":"B","division":"OPEN","hit_factor":7.1201},{"match_name":"SCCPSA USPSA Jul 17 2021","match_date":"2021-07-17","stage_classifiercode":"03-04","member_number":"L1158","first_name":"JIM","last_name":"HAND","classification":"M","division":"OPEN","hit_factor":7.0981},{"match_name":"Minot USPSA 2-18-18","match_date":"2018-02-18","stage_classifiercode":"03-04","member_number":"A103957","first_name":"TAYLOR","last_name":"BURACZEWSKI","classification":"U","division":"OPEN","hit_factor":7.0959},{"match_name":"Shoot GTR Monthly USPSA April Classifier Side Match","match_date":"2018-04-09","stage_classifiercode":"03-04","member_number":"A44363","first_name":"COLLIN","last_name":"SMITH","classification":"A","division":"OPEN","hit_factor":7.0856},{"match_name":"NISA April Classifer Match 2016","match_date":"2016-04-24","stage_classifiercode":"03-04","member_number":"ty8469","first_name":"ISIAH","last_name":"STROUD","classification":"A","division":"OPEN","hit_factor":7.0806},{"match_name":"Custer USPSA May","match_date":"2018-05-06","stage_classifiercode":"03-04","member_number":"L2396","first_name":"FLOYD","last_name":"SHOEMAKER","classification":"M","division":"OPEN","hit_factor":7.0806},{"match_name":"PMRPC September 2018 USPSA","match_date":"2018-09-08","stage_classifiercode":"03-04","member_number":"A20339","first_name":"FRED","last_name":"RIOS","classification":"B","division":"OPEN","hit_factor":7.0766},{"match_name":"Colonial Rifle and Pistol Club September 2020","match_date":"2020-09-05","stage_classifiercode":"03-04","member_number":"TY83520","first_name":"JAMES","last_name":"MARQUEZ","classification":"C","division":"OPEN","hit_factor":7.0697},{"match_name":"Maine Practical Shooters June 2016","match_date":"2016-06-04","stage_classifiercode":"03-04","member_number":"A49110","first_name":"SHANE","last_name":"AUBUCHON","classification":"C","division":"OPEN","hit_factor":7.0664},{"match_name":"SWGC USPSA Pistol Match - July","match_date":"2016-07-02","stage_classifiercode":"03-04","member_number":"\"\"","first_name":"DAVID","last_name":"MCMORRIS","classification":"B","division":"OPEN","hit_factor":7.0601},{"match_name":"Richmond Hot Shots February 20 and 21 - 2016 USPSA Match","match_date":"2016-02-20","stage_classifiercode":"03-04","member_number":"A85939","first_name":"NILO","last_name":"NUNEZ II","classification":"M","division":"OPEN","hit_factor":7.0588},{"match_name":"HPPS 2-18-2017","match_date":"2017-02-16","stage_classifiercode":"03-04","member_number":"A85028","first_name":"ANDREW","last_name":"REISBECK","classification":"A","division":"OPEN","hit_factor":7.0496},{"match_name":"MCPSL Pistol 6-13-20","match_date":"2020-06-13","stage_classifiercode":"03-04","member_number":"A104630","first_name":"PATRICK","last_name":"MITCHELL","classification":"B","division":"OPEN","hit_factor":7.0439},{"match_name":"NRG April 23 2016","match_date":"2016-04-23","stage_classifiercode":"03-04","member_number":"TY68524","first_name":"ZVI","last_name":"DAVIDOFF","classification":"A","division":"OPEN","hit_factor":7.0301},{"match_name":"Pathfinder July 2021 USPSA","match_date":"2021-07-18","stage_classifiercode":"03-04","member_number":"FY45777","first_name":"THEODORE","last_name":"FIRNSTEIN","classification":"A","division":"OPEN","hit_factor":7.0252},{"match_name":"Shot Through The Heart","match_date":"2017-02-26","stage_classifiercode":"03-04","member_number":"L2757","first_name":"RICK","last_name":"PUNU","classification":"M","division":"OPEN","hit_factor":7.0248},{"match_name":"May 8 2021 The Range At True North USPSA Match","match_date":"2021-05-08","stage_classifiercode":"03-04","member_number":"A63374","first_name":"JIM","last_name":"SYKES","classification":"B","division":"OPEN","hit_factor":7.0234},{"match_name":"Richmond Boro Gun Club September 2020 USPSA Match","match_date":"2020-09-12","stage_classifiercode":"03-04","member_number":"TY83520","first_name":"JAMES","last_name":"MARQUEZ","classification":"C","division":"OPEN","hit_factor":7.0122},{"match_name":"Richmond Hot Shots February 20 and 21 - 2016 USPSA Match","match_date":"2016-02-20","stage_classifiercode":"03-04","member_number":"A33147","first_name":"VINCE","last_name":"DIONISIO","classification":"B","division":"OPEN","hit_factor":7.0064},{"match_name":"Ripon USPSA 4-22-17","match_date":"2017-04-22","stage_classifiercode":"03-04","member_number":"A68824","first_name":"KELSEY","last_name":"SCHAEFER","classification":"B","division":"OPEN","hit_factor":7.0056},{"match_name":"Renton USPSA August 2016 - NW05","match_date":"2016-08-28","stage_classifiercode":"03-04","member_number":"TY47022","first_name":"BRUCE","last_name":"WOOD","classification":"A","division":"OPEN","hit_factor":7.0043},{"match_name":"CRGC USPSA Match 07-19-20","match_date":"2020-07-19","stage_classifiercode":"03-04","member_number":"TY110530","first_name":"BRIAN","last_name":"WHITNEY","classification":"B","division":"OPEN","hit_factor":6.9735},{"match_name":"CSA  COALFIELDS SHOOTERS ASSOCIATION USPSA JULY 2020","match_date":"2020-07-12","stage_classifiercode":"03-04","member_number":"TY103689","first_name":"BOBBY","last_name":"LEWIS2","classification":"B","division":"OPEN","hit_factor":6.9714},{"match_name":"Cactus USPSA February 2021","match_date":"2021-02-07","stage_classifiercode":"03-04","member_number":"L4468","first_name":"RAYMOND","last_name":"ENG","classification":"A","division":"OPEN","hit_factor":6.9694},{"match_name":"WVPPS Feb. 2018","match_date":"2018-02-25","stage_classifiercode":"03-04","member_number":"TY96280","first_name":"TY","last_name":"O'BRADOVICH","classification":"A","division":"OPEN","hit_factor":6.9579},{"match_name":"WVPPS September 2018","match_date":"2018-09-16","stage_classifiercode":"03-04","member_number":"A26597","first_name":"MAX","last_name":"BEDWELL","classification":"G","division":"OPEN","hit_factor":6.9541},{"match_name":"SAPSC Monthly USPSA Classifier Match 20151110","match_date":"2015-11-11","stage_classifiercode":"03-04","member_number":"TY60177","first_name":"CARL","last_name":"RAINEY","classification":"C","division":"OPEN","hit_factor":6.949},{"match_name":"Fernan USPSA October 2021","match_date":"2021-10-16","stage_classifiercode":"03-04","member_number":"TY105651","first_name":"DALE","last_name":"FORREST","classification":"C","division":"OPEN","hit_factor":6.9351},{"match_name":"PRG October 2018 Match","match_date":"2018-10-07","stage_classifiercode":"03-04","member_number":"\"\"","first_name":"JAY","last_name":"HU","classification":"U","division":"OPEN","hit_factor":6.9307},{"match_name":"Idaho ISPS October 7th 2017","match_date":"2017-10-07","stage_classifiercode":"03-04","member_number":"A84438","first_name":"TYSON","last_name":"DIXON","classification":"B","division":"OPEN","hit_factor":6.9231},{"match_name":"HPPS 2-18-2017","match_date":"2017-02-16","stage_classifiercode":"03-04","member_number":"A71925","first_name":"LAUREN","last_name":"CANNON","classification":"U","division":"OPEN","hit_factor":6.9182},{"match_name":"MCPSL Pistol 6-13-20","match_date":"2020-06-13","stage_classifiercode":"03-04","member_number":"TY110474","first_name":"MARC","last_name":"SMITH","classification":"C","division":"OPEN","hit_factor":6.9176},{"match_name":"GPS OCTOBER 2018","match_date":"2018-10-28","stage_classifiercode":"03-04","member_number":"A14869","first_name":"EDDIE","last_name":"JIMENEA","classification":"M","division":"OPEN","hit_factor":6.9155},{"match_name":"CSS July Classifier 2017","match_date":"2017-07-15","stage_classifiercode":"03-04","member_number":"\"\"","first_name":"HENRY","last_name":"THIELS","classification":"B","division":"OPEN","hit_factor":6.9143},{"match_name":"CGGR  APRIL USPSA MATCH","match_date":"2018-04-20","stage_classifiercode":"03-04","member_number":"L4056","first_name":"DILLION","last_name":"WALKER","classification":"B","division":"OPEN","hit_factor":6.904},{"match_name":"ISPS 4/17/2016 USPSA","match_date":"2016-04-17","stage_classifiercode":"03-04","member_number":"A85172","first_name":"MIKE","last_name":"O'LEARY","classification":"A","division":"OPEN","hit_factor":6.9016},{"match_name":"USPSA stx","match_date":"2017-03-04","stage_classifiercode":"03-04","member_number":"L4116","first_name":"HENRY","last_name":"RUIZ","classification":"B","division":"OPEN","hit_factor":6.8966},{"match_name":"Wvpps August 2016","match_date":"2016-08-21","stage_classifiercode":"03-04","member_number":"a26597","first_name":"MAX","last_name":"BEDWELL","classification":"G","division":"OPEN","hit_factor":6.8966},{"match_name":"NISA September 2018","match_date":"2018-09-23","stage_classifiercode":"03-04","member_number":"A55556","first_name":"RON","last_name":"EVANS","classification":"A","division":"OPEN","hit_factor":6.8966},{"match_name":"PCWC USPSA  4 23 2016","match_date":"2016-04-23","stage_classifiercode":"03-04","member_number":"FY25745","first_name":"DAN","last_name":"SANDERS","classification":"B","division":"OPEN","hit_factor":6.8966},{"match_name":"Pinetucky USPSA 07-15-17","match_date":"2017-07-15","stage_classifiercode":"03-04","member_number":"Ty61426","first_name":"THOMAS","last_name":"NYLAND","classification":"C","division":"OPEN","hit_factor":6.8898},{"match_name":"Lefthanders Gun Club Practical Shooters September 2 and 3","match_date":"2017-09-02","stage_classifiercode":"03-04","member_number":"TY72670","first_name":"DALE","last_name":"HARDING","classification":"C","division":"OPEN","hit_factor":6.8891},{"match_name":"EIPS Classifier Match 3/18/18","match_date":"2018-03-18","stage_classifiercode":"03-04","member_number":"TY57269","first_name":"CRAIG","last_name":"TAPPE","classification":"G","division":"OPEN","hit_factor":6.8724},{"match_name":"RMAP 3rd Sunday Marh 2016","match_date":"2016-03-20","stage_classifiercode":"03-04","member_number":"TY47460","first_name":"STEVE","last_name":"LEACH","classification":"A","division":"OPEN","hit_factor":6.871},{"match_name":"SLOSA January 2016 USPSA","match_date":"2016-01-09","stage_classifiercode":"03-04","member_number":"\"\"","first_name":"ADRIAN","last_name":"COBB 2","classification":"M","division":"OPEN","hit_factor":6.8493},{"match_name":"Minot USPSA 2-18-18","match_date":"2018-02-18","stage_classifiercode":"03-04","member_number":"L4255","first_name":"ELTON","last_name":"COLEMAN","classification":"U","division":"OPEN","hit_factor":6.8449},{"match_name":"AIPS Weekly USPSA 24 July 2018","match_date":"2018-07-24","stage_classifiercode":"03-04","member_number":"TY67341","first_name":"AARON","last_name":"MILLER","classification":"B","division":"OPEN","hit_factor":6.8404},{"match_name":"NRG April 23 2016","match_date":"2016-04-23","stage_classifiercode":"03-04","member_number":"\"\"","first_name":"KEITH","last_name":"HOLLAND","classification":"G","division":"OPEN","hit_factor":6.8241},{"match_name":"Gem City Gun Club 8-5 and 6th 2017","match_date":"2017-08-05","stage_classifiercode":"03-04","member_number":"A102935","first_name":"MIKE","last_name":"DAUENHAUER","classification":"C","division":"OPEN","hit_factor":6.8182},{"match_name":"Parma 2018 April USPSA","match_date":"2018-04-21","stage_classifiercode":"03-04","member_number":"L2117","first_name":"LARRY","last_name":"ALBAUGH","classification":"A","division":"OPEN","hit_factor":6.8182},{"match_name":"August 2018 CAS USPSA","match_date":"2018-08-05","stage_classifiercode":"03-04","member_number":"L2725","first_name":"CHARLES","last_name":"BLACK","classification":"M","division":"OPEN","hit_factor":6.8158},{"match_name":"SUPS USPSA 18-19 August 2018","match_date":"2018-08-18","stage_classifiercode":"03-04","member_number":"TY88904","first_name":"JOHN","last_name":"SIMS","classification":"A","division":"OPEN","hit_factor":6.8056},{"match_name":"OREGON ARPC CC05 USPSA JULY 14 2018","match_date":"2018-07-14","stage_classifiercode":"03-04","member_number":"L3292","first_name":"BILL","last_name":"MARRS","classification":"B","division":"OPEN","hit_factor":6.8035},{"match_name":"Pinetucky USPSA 07-15-17","match_date":"2017-07-15","stage_classifiercode":"03-04","member_number":"A91952","first_name":"PHILIP","last_name":"LEE","classification":"U","division":"OPEN","hit_factor":6.8013},{"match_name":"WTPS USPSA October Match 10-8-16","match_date":"2016-10-08","stage_classifiercode":"03-04","member_number":"\"\"","first_name":"GARY","last_name":"VAUGHT","classification":"B","division":"OPEN","hit_factor":6.7971},{"match_name":"Custer USPSA Mar 7th 2021","match_date":"2021-03-07","stage_classifiercode":"03-04","member_number":"A83018","first_name":"RAE ARSEN","last_name":"BALEROS","classification":"B","division":"OPEN","hit_factor":6.7961},{"match_name":"FVPS July Point Series Match","match_date":"2017-07-01","stage_classifiercode":"03-04","member_number":"a71862","first_name":"JOE","last_name":"SINYAKOVICH","classification":"B","division":"OPEN","hit_factor":6.7908},{"match_name":"SLOSA January 2016 USPSA","match_date":"2016-01-09","stage_classifiercode":"03-04","member_number":"L1620","first_name":"THOMAS","last_name":"CHAN","classification":"A","division":"OPEN","hit_factor":6.7894},{"match_name":"LIPSA - April 29th 2018 - USPSA Special Classifier Match","match_date":"2018-04-29","stage_classifiercode":"03-04","member_number":"A81323","first_name":"JOE","last_name":"DRAGHI","classification":"A","division":"OPEN","hit_factor":6.7873},{"match_name":"Feb Uspsa H&H Match","match_date":"2017-02-26","stage_classifiercode":"03-04","member_number":"A64990","first_name":"CHRIS","last_name":"GOBER","classification":"A","division":"OPEN","hit_factor":6.7869},{"match_name":"MS06 Team Magnolia USPSA October Match","match_date":"2015-10-04","stage_classifiercode":"03-04","member_number":"TY28590","first_name":"TIM","last_name":"FRANK","classification":"B","division":"OPEN","hit_factor":6.785},{"match_name":"Pioneer Action Shooters USPSA 5-23-21 Special Classifer","match_date":"2021-05-23","stage_classifiercode":"03-04","member_number":"A122355","first_name":"JOE","last_name":"SHEPARD","classification":"U","division":"OPEN","hit_factor":6.7831},{"match_name":"FBPPC JUNE 2016 IPSC MATCH","match_date":"2016-06-12","stage_classifiercode":"03-04","member_number":"TY61480","first_name":"STEVE","last_name":"SELIGMAN","classification":"B","division":"OPEN","hit_factor":6.7797},{"match_name":"RMAP 3rd Sunday Marh 2016","match_date":"2016-03-20","stage_classifiercode":"03-04","member_number":"TY65635","first_name":"CHRIS","last_name":"COLLINS","classification":"B","division":"OPEN","hit_factor":6.7762},{"match_name":"Mesilla Valley P October 2020","match_date":"2020-10-18","stage_classifiercode":"03-04","member_number":"A89655","first_name":"FERMIN","last_name":"TRUJILLO","classification":"A","division":"OPEN","hit_factor":6.7612},{"match_name":"Custer USPSA Mar 7th 2021","match_date":"2021-03-07","stage_classifiercode":"03-04","member_number":"A110185","first_name":"RYAN","last_name":"HALWICK","classification":"B","division":"OPEN","hit_factor":6.7586},{"match_name":"USAH New Years Pistol & PCC Match","match_date":"2020-01-19","stage_classifiercode":"03-04","member_number":"TY26523","first_name":"STEVE","last_name":"RIBAO","classification":"B","division":"OPEN","hit_factor":6.7581},{"match_name":"Ripon USPSA 4-22-17","match_date":"2017-04-22","stage_classifiercode":"03-04","member_number":"L3619","first_name":"MARK","last_name":"ROTH","classification":"C","division":"OPEN","hit_factor":6.7554},{"match_name":"USAH New Years Pistol & PCC Match","match_date":"2020-01-19","stage_classifiercode":"03-04","member_number":"A88485","first_name":"BHONG","last_name":"DELOS SANTOS","classification":"C","division":"OPEN","hit_factor":6.754},{"match_name":"WSPS NOVEMBER 2020 USPSA PROTEST","match_date":"2020-11-21","stage_classifiercode":"03-04","member_number":"Ty104882","first_name":"CHRIS","last_name":"GELNETT","classification":"M","division":"OPEN","hit_factor":6.7476},{"match_name":"TAC2 USPSA Dec 2017","match_date":"2017-12-02","stage_classifiercode":"03-04","member_number":"A85473","first_name":"NATHAN","last_name":"DIVELY","classification":"U","division":"OPEN","hit_factor":6.7327},{"match_name":"Texarkana Gun Club USPSA Match - Level 1 for May 2021","match_date":"2021-05-01","stage_classifiercode":"03-04","member_number":"A106355","first_name":"RYAN","last_name":"ALICAYA","classification":"C","division":"OPEN","hit_factor":6.7288},{"match_name":"LIPSA - April 29th 2018 - USPSA Special Classifier Match","match_date":"2018-04-29","stage_classifiercode":"03-04","member_number":"L3570","first_name":"KEVIN","last_name":"DRISCOLL","classification":"C","division":"OPEN","hit_factor":6.7245},{"match_name":"Richmond Boro Gun Club December 2018 USPSA Match","match_date":"2018-12-15","stage_classifiercode":"03-04","member_number":"FY92927","first_name":"ANTHONY","last_name":"MAINOLFI","classification":"B","division":"OPEN","hit_factor":6.7218},{"match_name":"Ripon USPSA 4-22-17","match_date":"2017-04-22","stage_classifiercode":"03-04","member_number":"A71862","first_name":"JOSEPH","last_name":"SINYAKOVICH","classification":"B","division":"OPEN","hit_factor":6.7164},{"match_name":"CRGC USPSA Match 07-19-20","match_date":"2020-07-19","stage_classifiercode":"03-04","member_number":"A76272","first_name":"NICK","last_name":"BEDIO","classification":"A","division":"OPEN","hit_factor":6.7121},{"match_name":"Richmond Boro Gun Club September 2020 USPSA Match","match_date":"2020-09-12","stage_classifiercode":"03-04","member_number":"TY123181","first_name":"JUN","last_name":"DE ASIS","classification":"C","division":"OPEN","hit_factor":6.7079},{"match_name":"SPSA USPSA June 1st Sat Match","match_date":"2018-06-02","stage_classifiercode":"03-04","member_number":"A101972","first_name":"KENNETH","last_name":"MESSER","classification":"C","division":"OPEN","hit_factor":6.7039},{"match_name":"MCPSL Pistol 6-11-16","match_date":"2016-06-11","stage_classifiercode":"03-04","member_number":"FY78165","first_name":"BILL","last_name":"JOHNSON","classification":"B","division":"OPEN","hit_factor":6.6941},{"match_name":"PCWC USPSA  4 23 2016","match_date":"2016-04-23","stage_classifiercode":"03-04","member_number":"ty39085","first_name":"MARTIN","last_name":"LITTLE","classification":"M","division":"OPEN","hit_factor":6.6866},{"match_name":"SCS USPSA Pistol Match with Classifier - November 6 2016","match_date":"2016-11-06","stage_classifiercode":"03-04","member_number":"A27294","first_name":"ALLEN","last_name":"ROONEY","classification":"A","division":"OPEN","hit_factor":6.6845},{"match_name":"MS06 Team Magnolia USPSA October Match","match_date":"2015-10-04","stage_classifiercode":"03-04","member_number":"A84392","first_name":"JAMES","last_name":"TEDFORD","classification":"B","division":"OPEN","hit_factor":6.681},{"match_name":"EAGC Classifier Match 1 February","match_date":"2020-02-02","stage_classifiercode":"03-04","member_number":"A116198","first_name":"ETHAN","last_name":"FOSHEE","classification":"U","division":"OPEN","hit_factor":6.6806},{"match_name":"LCSC USPSA   8-13-17","match_date":"2017-08-08","stage_classifiercode":"03-04","member_number":"A85957","first_name":"TRISTAN","last_name":"TOLENTINO","classification":"B","division":"OPEN","hit_factor":6.6735},{"match_name":"Maine Practical Shooters November 2020","match_date":"2020-11-01","stage_classifiercode":"03-04","member_number":"A128615","first_name":"JOE","last_name":"BUSQUE","classification":"C","division":"OPEN","hit_factor":6.6596},{"match_name":"H&H easter Classifier","match_date":"2016-03-27","stage_classifiercode":"03-04","member_number":"A71435","first_name":"FEGEE","last_name":"MATLOCK","classification":"A","division":"OPEN","hit_factor":6.6591},{"match_name":"Springfield Tactical Shooters 11/01/2018","match_date":"2018-11-01","stage_classifiercode":"03-04","member_number":"A30365","first_name":"ED","last_name":"TRIBBLE","classification":"A","division":"OPEN","hit_factor":6.6584},{"match_name":"Blackstone Shooting Sports July 2017 USPSA Pistol Level 1","match_date":"2017-07-11","stage_classifiercode":"03-04","member_number":"A31525","first_name":"COUNCIL","last_name":"BRADSHAW","classification":"G","division":"OPEN","hit_factor":6.6568},{"match_name":"Cactus USPSA ALL CLASSIFIER September 2020","match_date":"2020-09-06","stage_classifiercode":"03-04","member_number":"A123432","first_name":"JAY","last_name":"FIELDER","classification":"U","division":"OPEN","hit_factor":6.6532},{"match_name":"Cactus USPSA November 2021","match_date":"2021-11-07","stage_classifiercode":"03-04","member_number":"l4302","first_name":"JOHN","last_name":"VILLARINO","classification":"C","division":"OPEN","hit_factor":6.653},{"match_name":"Gps   November 2015","match_date":"2015-11-22","stage_classifiercode":"03-04","member_number":"FY63040","first_name":"HENRY","last_name":"MORENO","classification":"B","division":"OPEN","hit_factor":6.641},{"match_name":"Pioneer Action Shooters USPSA 5-23-21 Special Classifer","match_date":"2021-05-23","stage_classifiercode":"03-04","member_number":"TY111079","first_name":"MIKE","last_name":"PAN","classification":"M","division":"OPEN","hit_factor":6.6365},{"match_name":"Pinetucky USPSA 03-18-17","match_date":"2017-03-18","stage_classifiercode":"03-04","member_number":"L3724","first_name":"JACK","last_name":"SUBER","classification":"A","division":"OPEN","hit_factor":6.6316},{"match_name":"BSPSC 2018 June MT Glock Match","match_date":"2018-06-10","stage_classifiercode":"03-04","member_number":"TY78558","first_name":"JOEL","last_name":"MUDRI","classification":"D","division":"OPEN","hit_factor":6.6271},{"match_name":"Cactus USPSA November 2021","match_date":"2021-11-07","stage_classifiercode":"03-04","member_number":"A125698","first_name":"TIMOTHY","last_name":"BUSBY","classification":"C","division":"OPEN","hit_factor":6.6176},{"match_name":"MS06 Team Magnolia USPSA October Match","match_date":"2015-10-04","stage_classifiercode":"03-04","member_number":"L3696","first_name":"ROBERT","last_name":"HALSELL","classification":"A","division":"OPEN","hit_factor":6.6132},{"match_name":"Gps   November 2015","match_date":"2015-11-22","stage_classifiercode":"03-04","member_number":"A74722","first_name":"ALBERT","last_name":"CALDERON","classification":"D","division":"OPEN","hit_factor":6.6107},{"match_name":"Springfield Tactical Shooters 03/05/2020","match_date":"2020-03-05","stage_classifiercode":"03-04","member_number":"FY99127","first_name":"STEVE","last_name":"FRAZIER","classification":"B","division":"OPEN","hit_factor":6.6057},{"match_name":"-Triforce Practical Shooters at BigWoodsGoods 11-1-18","match_date":"2018-11-01","stage_classifiercode":"03-04","member_number":"A27940","first_name":"RICK","last_name":"DOBBS","classification":"A","division":"OPEN","hit_factor":6.5934},{"match_name":"Homestead USPSA July Match","match_date":"2018-07-07","stage_classifiercode":"03-04","member_number":"A60831","first_name":"MARCO","last_name":"ROMERO","classification":"C","division":"OPEN","hit_factor":6.5903},{"match_name":"MCPSL Pistol 12-9-17","match_date":"2017-12-09","stage_classifiercode":"03-04","member_number":"L1870","first_name":"LES","last_name":"COX","classification":"M","division":"OPEN","hit_factor":6.5891},{"match_name":"SFPS 9-23-18 USPSA Match","match_date":"2018-09-23","stage_classifiercode":"03-04","member_number":"TY65769","first_name":"DANIEL","last_name":"NESTHUS","classification":"B","division":"OPEN","hit_factor":6.5868},{"match_name":"JCSSA Mar3 2018","match_date":"2018-03-03","stage_classifiercode":"03-04","member_number":"TY85507","first_name":"JONATHAN","last_name":"PURTZER","classification":"M","division":"OPEN","hit_factor":6.586},{"match_name":"LdF 2nd Saturday Match","match_date":"2016-01-09","stage_classifiercode":"03-04","member_number":"FY62295","first_name":"DAVE","last_name":"MORRIS","classification":"B","division":"OPEN","hit_factor":6.5817},{"match_name":"PMRPC September 2018 USPSA","match_date":"2018-09-08","stage_classifiercode":"03-04","member_number":"TY96611","first_name":"KRYS","last_name":"KLOCZKO","classification":"A","division":"OPEN","hit_factor":6.5789},{"match_name":"Gem City Gun Club 8-5 and 6th 2017","match_date":"2017-08-05","stage_classifiercode":"03-04","member_number":"L1963","first_name":"DENNIS","last_name":"MICHALI","classification":"A","division":"OPEN","hit_factor":6.576},{"match_name":"Gem City Gun Club 8-5 and 6th 2017","match_date":"2017-08-05","stage_classifiercode":"03-04","member_number":"TY40183","first_name":"DAN","last_name":"BEDELL","classification":"X","division":"OPEN","hit_factor":6.5744},{"match_name":"GPS OCTOBER 2018","match_date":"2018-10-28","stage_classifiercode":"03-04","member_number":"FY101331","first_name":"GARY","last_name":"OWENS","classification":"C","division":"OPEN","hit_factor":6.5737},{"match_name":"ORSA USPSA February 2020 ","match_date":"2020-02-15","stage_classifiercode":"03-04","member_number":"A95076","first_name":"GORDON","last_name":"ENGLE","classification":"C","division":"OPEN","hit_factor":6.5737},{"match_name":"Woodland Heights Practical Shooters USPSA Match 4-21","match_date":"2021-04-18","stage_classifiercode":"03-04","member_number":"A76791","first_name":"COREY","last_name":"CRONBAUGH","classification":"B","division":"OPEN","hit_factor":6.5728},{"match_name":"May 8 2021 The Range At True North USPSA Match","match_date":"2021-05-08","stage_classifiercode":"03-04","member_number":"TY39085","first_name":"MARTIN","last_name":"LITTLE","classification":"M","division":"OPEN","hit_factor":6.5717},{"match_name":"Idaho ISPS August 4th 2018","match_date":"2018-08-04","stage_classifiercode":"03-04","member_number":"A530","first_name":"JERRY","last_name":"DIX","classification":"M","division":"OPEN","hit_factor":6.5657},{"match_name":"Collin County USPSA July 30th 2017","match_date":"2017-07-30","stage_classifiercode":"03-04","member_number":"A65248","first_name":"JR","last_name":"ERASMUS","classification":"A","division":"OPEN","hit_factor":6.5651},{"match_name":"July USPSA","match_date":"2021-07-25","stage_classifiercode":"03-04","member_number":"A76617","first_name":"SERGIO","last_name":"DE LEON","classification":"U","division":"OPEN","hit_factor":6.5641},{"match_name":"ISPS CLASSIFIER 07/30/16 ","match_date":"2016-07-30","stage_classifiercode":"03-04","member_number":"A94890","first_name":"CHRIS","last_name":"CLARK","classification":"C","division":"OPEN","hit_factor":6.5625},{"match_name":"WTPS USPSA October Match 10-8-16","match_date":"2016-10-08","stage_classifiercode":"03-04","member_number":"\"\"","first_name":"RON","last_name":"WEAVER","classification":"M","division":"OPEN","hit_factor":6.5574},{"match_name":"CSA  COALFIELDS SHOOTERS ASSOCIATION USPSA JULY 2020","match_date":"2020-07-12","stage_classifiercode":"03-04","member_number":"A100644","first_name":"SETH","last_name":"LEWIS","classification":"A","division":"OPEN","hit_factor":6.5531},{"match_name":"CIPSC Havana May USPSA","match_date":"2018-05-12","stage_classifiercode":"03-04","member_number":"TY72670","first_name":"DALE","last_name":"HARDING","classification":"B","division":"OPEN","hit_factor":6.5392354124748},{"match_name":"Springfield Tactical Shooters 11/01/2018","match_date":"2018-11-01","stage_classifiercode":"03-04","member_number":"A30365","first_name":"ED","last_name":"TRIBBLE","classification":"A","division":"OPEN","hit_factor":6.5245},{"match_name":"HPPS 2-18-2017","match_date":"2017-02-16","stage_classifiercode":"03-04","member_number":"A47982","first_name":"DON","last_name":"DOBYNS","classification":"U","division":"OPEN","hit_factor":6.524},{"match_name":"USAH New Years Pistol & PCC Match","match_date":"2020-01-19","stage_classifiercode":"03-04","member_number":"A45196","first_name":"NESTOR","last_name":"TANI","classification":"M","division":"OPEN","hit_factor":6.5239},{"match_name":"GPS OCTOBER 2018","match_date":"2018-10-28","stage_classifiercode":"03-04","member_number":"FY26952","first_name":"JOHN","last_name":"GRIMM","classification":"A","division":"OPEN","hit_factor":6.5193},{"match_name":"Springfield Tactical Shooters 11/01/2018","match_date":"2018-11-01","stage_classifiercode":"03-04","member_number":"A99127","first_name":"STEVE","last_name":"FRAZIER","classification":"C","division":"OPEN","hit_factor":6.5153},{"match_name":"LTD Pistol - August 2018","match_date":"2018-08-04","stage_classifiercode":"03-04","member_number":"A74550","first_name":"KIRBY","last_name":"LUNT","classification":"B","division":"OPEN","hit_factor":6.5012},{"match_name":"GPS OCTOBER 2018","match_date":"2018-10-28","stage_classifiercode":"03-04","member_number":"Ty46456","first_name":"ALEX","last_name":"CASIS","classification":"A","division":"OPEN","hit_factor":6.5},{"match_name":"Jan  28 Classifier Match","match_date":"2018-01-28","stage_classifiercode":"03-04","member_number":"A105266","first_name":"ERIC","last_name":"FORREST","classification":"B","division":"OPEN","hit_factor":6.4975},{"match_name":"Quantico QPS December 13 USPSA","match_date":"2015-12-13","stage_classifiercode":"03-04","member_number":"A89294","first_name":"JORDAN","last_name":"MOELLENDICK","classification":"U","division":"OPEN","hit_factor":6.4935},{"match_name":"August 2018 CAS USPSA","match_date":"2018-08-05","stage_classifiercode":"03-04","member_number":"Ty84389","first_name":"ETHAN","last_name":"BOUDREAUX","classification":"A","division":"OPEN","hit_factor":6.4865},{"match_name":"PCWC USPSA  4 23 2016","match_date":"2016-04-23","stage_classifiercode":"03-04","member_number":"L-3042","first_name":"CHRIS","last_name":"TILLEY","classification":"G","division":"OPEN","hit_factor":6.4777},{"match_name":"SPSA USPSA October 4th Sat match","match_date":"2016-10-22","stage_classifiercode":"03-04","member_number":"A63410","first_name":"EDDIE","last_name":"HUGHES","classification":"B","division":"OPEN","hit_factor":6.466},{"match_name":"ISPS CLASSIFIER 07/30/16 ","match_date":"2016-07-30","stage_classifiercode":"03-04","member_number":"TY30712","first_name":"DENNIS","last_name":"WILSON","classification":"B","division":"OPEN","hit_factor":6.4646},{"match_name":"SCCPSA USPSA SEPTEMBER 15 MATCH","match_date":"2018-09-15","stage_classifiercode":"03-04","member_number":"A65858","first_name":"VICTOR","last_name":"KHOMENKO","classification":"B","division":"OPEN","hit_factor":6.4612},{"match_name":"MVPSA USPSA  6-16-18","match_date":"2018-06-16","stage_classifiercode":"03-04","member_number":"A89186","first_name":"JACK","last_name":"COOPER","classification":"B","division":"OPEN","hit_factor":6.4609},{"match_name":"BGSL First Sunday Uspsa","match_date":"2016-08-07","stage_classifiercode":"03-04","member_number":"TY79620","first_name":"DAVID","last_name":"BLAIR","classification":"C","division":"OPEN","hit_factor":6.4607},{"match_name":"EAPS February 2018 USPSA","match_date":"2018-02-18","stage_classifiercode":"03-04","member_number":"TY94451","first_name":"TODD","last_name":"DEMPSTER","classification":"B","division":"OPEN","hit_factor":6.4586},{"match_name":"Richmond Hot Shots February 20 and 21 - 2016 USPSA Match","match_date":"2016-02-20","stage_classifiercode":"03-04","member_number":"A88783","first_name":"JOHNMAR","last_name":"SAMSON","classification":"B","division":"OPEN","hit_factor":6.4455},{"match_name":"RCSC USPSA 24 July 2016","match_date":"2016-07-24","stage_classifiercode":"03-04","member_number":"TY11882","first_name":"MICHAEL","last_name":"KANE","classification":"C","division":"OPEN","hit_factor":6.4397},{"match_name":"SCCPSA USPSA Jul 17 2021","match_date":"2021-07-17","stage_classifiercode":"03-04","member_number":"TY103917","first_name":"PHIL","last_name":"GRAY","classification":"C","division":"OPEN","hit_factor":6.4356},{"match_name":"Low Country USPSA  March 24th","match_date":"2018-03-24","stage_classifiercode":"03-04","member_number":"A88596","first_name":"EDDY VIC","last_name":"TAN","classification":"C","division":"OPEN","hit_factor":6.4322},{"match_name":"DSC August 2016","match_date":"2016-08-21","stage_classifiercode":"03-04","member_number":"A74270","first_name":"JEFF","last_name":"LARSEN","classification":"B","division":"OPEN","hit_factor":6.4265},{"match_name":"Pinetucky USPSA 03-18-17","match_date":"2017-03-18","stage_classifiercode":"03-04","member_number":"A93098","first_name":"TRAVIS","last_name":"ROSE","classification":"B","division":"OPEN","hit_factor":6.4166},{"match_name":"SCCPSA USPSA SEPTEMBER 15 MATCH","match_date":"2018-09-15","stage_classifiercode":"03-04","member_number":"TY93356","first_name":"DOMINICK","last_name":"GATTUSO","classification":"C","division":"OPEN","hit_factor":6.4103},{"match_name":"SCCPSA USPSA SEPTEMBER 15 MATCH","match_date":"2018-09-15","stage_classifiercode":"03-04","member_number":"TY100686","first_name":"SEAN","last_name":"COLLINS","classification":"B","division":"OPEN","hit_factor":6.405},{"match_name":"HPPS 2-18-2017","match_date":"2017-02-16","stage_classifiercode":"03-04","member_number":"A47982","first_name":"DON","last_name":"DOBYNS","classification":"U","division":"OPEN","hit_factor":6.4039},{"match_name":"Fernan USPSA October 2021","match_date":"2021-10-16","stage_classifiercode":"03-04","member_number":"TY118820","first_name":"RYAN","last_name":"QUIRK","classification":"B","division":"OPEN","hit_factor":6.402},{"match_name":"Custer USPSA Mar 7th 2021","match_date":"2021-03-07","stage_classifiercode":"03-04","member_number":"A44141","first_name":"STEVEN","last_name":"ROESSEL","classification":"A","division":"OPEN","hit_factor":6.397},{"match_name":"Mesilla Valley P Nov2017","match_date":"2017-11-04","stage_classifiercode":"03-04","member_number":"ty61480","first_name":"STEVE","last_name":"SELIGMAN","classification":"B","division":"OPEN","hit_factor":6.3931},{"match_name":"CGGR  APRIL USPSA MATCH","match_date":"2018-04-20","stage_classifiercode":"03-04","member_number":"L729","first_name":"ROBERT","last_name":"WALKER","classification":"A","division":"OPEN","hit_factor":6.385},{"match_name":"SCCPSA USPSA Jul 17 2021","match_date":"2021-07-17","stage_classifiercode":"03-04","member_number":"TY117640","first_name":"CARL","last_name":"ANDERSON JR","classification":"B","division":"OPEN","hit_factor":6.381},{"match_name":"Homestead USPSA July Match","match_date":"2018-07-07","stage_classifiercode":"03-04","member_number":"A84805","first_name":"ENRICO","last_name":"NUNEZ","classification":"U","division":"OPEN","hit_factor":6.3752},{"match_name":"NRG April 23 2016","match_date":"2016-04-23","stage_classifiercode":"03-04","member_number":"a17682","first_name":"PETER","last_name":"DIAZ","classification":"M","division":"OPEN","hit_factor":6.373},{"match_name":"RMAP 3rd Sunday Marh 2016","match_date":"2016-03-20","stage_classifiercode":"03-04","member_number":"L1849","first_name":"PAUL","last_name":"THOMPSON","classification":"M","division":"OPEN","hit_factor":6.3702},{"match_name":"NRG April 23 2016","match_date":"2016-04-23","stage_classifiercode":"03-04","member_number":"A62838","first_name":"AL","last_name":"MINICOLA","classification":"B","division":"OPEN","hit_factor":6.3701},{"match_name":"JCSSA Mar3 2018","match_date":"2018-03-03","stage_classifiercode":"03-04","member_number":"TY12021","first_name":"RAGS","last_name":"CONNAWAY","classification":"A","division":"OPEN","hit_factor":6.3694},{"match_name":"SAPSC Monthly USPSA Classifier Match at Autreys Armory 20180612","match_date":"2018-06-12","stage_classifiercode":"03-04","member_number":"A66318","first_name":"BARRY","last_name":"PEPPERS","classification":"B","division":"OPEN","hit_factor":6.3688},{"match_name":"SPSA USPSA June 1st Sat Match","match_date":"2018-06-02","stage_classifiercode":"03-04","member_number":"A110753","first_name":"AARON","last_name":"ENGLISH","classification":"C","division":"OPEN","hit_factor":6.3679},{"match_name":"ISPS 4/17/2016 USPSA","match_date":"2016-04-17","stage_classifiercode":"03-04","member_number":"L2026","first_name":"DEAN","last_name":"BARTON","classification":"B","division":"OPEN","hit_factor":6.3663},{"match_name":"Clinton County USPSA Oct 22 2016","match_date":"2016-10-22","stage_classifiercode":"03-04","member_number":"5","first_name":"PHILLIP","last_name":"IVERSEN","classification":"U","division":"OPEN","hit_factor":6.3611},{"match_name":"Cactus USPSA November 2021","match_date":"2021-11-07","stage_classifiercode":"03-04","member_number":"ty90727","first_name":"MISS DANYELA","last_name":"D'ANGELO","classification":"B","division":"OPEN","hit_factor":6.3591},{"match_name":"May 8 2021 The Range At True North USPSA Match","match_date":"2021-05-08","stage_classifiercode":"03-04","member_number":"XXXX","first_name":"TONY","last_name":"NORTON","classification":"U","division":"OPEN","hit_factor":6.3555},{"match_name":"RCSC USPSA 24 July 2016","match_date":"2016-07-24","stage_classifiercode":"03-04","member_number":"A85604","first_name":"NICK","last_name":"GUTIERREZ","classification":"D","division":"OPEN","hit_factor":6.3545},{"match_name":"NRG April 23 2016","match_date":"2016-04-23","stage_classifiercode":"03-04","member_number":"TY60747","first_name":"JIMMY","last_name":"ORDONEZ","classification":"M","division":"OPEN","hit_factor":6.3527},{"match_name":"Dundee USPSA Feb 2016","match_date":"2016-02-27","stage_classifiercode":"03-04","member_number":"TY45892","first_name":"RICHARD","last_name":"BROWNING","classification":"B","division":"OPEN","hit_factor":6.3521},{"match_name":"Hosemonster Action  ","match_date":"2021-05-16","stage_classifiercode":"03-04","member_number":"A59813","first_name":"CINDY","last_name":"TUCKER","classification":"A","division":"OPEN","hit_factor":6.3492},{"match_name":"JCSSA Mar3 2018","match_date":"2018-03-03","stage_classifiercode":"03-04","member_number":"TY63123","first_name":"KENDALL","last_name":"WADE","classification":"A","division":"OPEN","hit_factor":6.341},{"match_name":"DGC USPSA 05-13-18","match_date":"2018-05-13","stage_classifiercode":"03-04","member_number":"TY87135","first_name":"ENVER","last_name":"FOCAKOVIC","classification":"A","division":"OPEN","hit_factor":6.3328},{"match_name":"MVPSA USPSA  6-16-18","match_date":"2018-06-16","stage_classifiercode":"03-04","member_number":"A95520","first_name":"JOHN","last_name":"WISNIEWSKI","classification":"B","division":"OPEN","hit_factor":6.3317},{"match_name":"Ripon USPSA 4-22-17","match_date":"2017-04-22","stage_classifiercode":"03-04","member_number":"FY53791","first_name":"MICHAEL","last_name":"OLSON","classification":"C","division":"OPEN","hit_factor":6.3304},{"match_name":"WSPS NOVEMBER 2020 USPSA PROTEST","match_date":"2020-11-21","stage_classifiercode":"03-04","member_number":"Ty123298","first_name":"CHRISTIAN","last_name":"RODRIGUEZ","classification":"U","division":"OPEN","hit_factor":6.3218},{"match_name":"PCSI USPSA 2018   April Classifier Match 2","match_date":"2018-04-07","stage_classifiercode":"03-04","member_number":"A100061","first_name":"JASON","last_name":"HOLLEY","classification":"B","division":"OPEN","hit_factor":6.3168},{"match_name":"Richmond Hot Shots February 20 and 21 - 2016 USPSA Match","match_date":"2016-02-20","stage_classifiercode":"03-04","member_number":"B45","first_name":"LARRY","last_name":"CHAN","classification":"C","division":"OPEN","hit_factor":6.3037},{"match_name":"EAGC March 2017 USPSA Pistol Match","match_date":"2017-03-19","stage_classifiercode":"03-04","member_number":"L3510","first_name":"KEN","last_name":"WILCOX","classification":"B","division":"OPEN","hit_factor":6.3025},{"match_name":"Prescott 1st Saturday 3-04-2017","match_date":"2017-03-04","stage_classifiercode":"03-04","member_number":"A12460","first_name":"ED","last_name":"SERICH","classification":"A","division":"OPEN","hit_factor":6.302},{"match_name":"MCRC USPSA September 2017","match_date":"2017-09-09","stage_classifiercode":"03-04","member_number":"A101792","first_name":"ROBERT","last_name":"PRICE","classification":"B","division":"OPEN","hit_factor":6.3014},{"match_name":"TPS USPSA at CMP March 17 2018","match_date":"2018-03-17","stage_classifiercode":"03-04","member_number":"A106491","first_name":"AUSTIN","last_name":"COCK","classification":"B","division":"OPEN","hit_factor":6.288},{"match_name":"WSPS NOVEMBER 2020 USPSA PROTEST","match_date":"2020-11-21","stage_classifiercode":"03-04","member_number":"a101299","first_name":"BILL","last_name":"ROMIG","classification":"B","division":"OPEN","hit_factor":6.2847},{"match_name":"NISA April Classifer Match 2016","match_date":"2016-04-24","stage_classifiercode":"03-04","member_number":"A55556","first_name":"RON","last_name":"EVANS","classification":"B","division":"OPEN","hit_factor":6.2821},{"match_name":"LdF 2nd Saturday Match","match_date":"2016-01-09","stage_classifiercode":"03-04","member_number":"A74054","first_name":"EMIL","last_name":"DABU","classification":"A","division":"OPEN","hit_factor":6.2745},{"match_name":"WGC WI USPSA Monthly Match 5-19-18","match_date":"2018-05-19","stage_classifiercode":"03-04","member_number":"TY72120","first_name":"DAVE","last_name":"DEYOE","classification":"M","division":"OPEN","hit_factor":6.2696},{"match_name":"Prescott 1st Saturday 3-04-2017","match_date":"2017-03-04","stage_classifiercode":"03-04","member_number":"A56187","first_name":"MICHAEL","last_name":"FILOSOFO","classification":"C","division":"OPEN","hit_factor":6.267},{"match_name":"USPSA","match_date":"2021-06-06","stage_classifiercode":"03-04","member_number":"TY78363","first_name":"BOB","last_name":"FISHER","classification":"C","division":"OPEN","hit_factor":6.2622},{"match_name":"Griffin USPSA Match March 2018","match_date":"2018-03-17","stage_classifiercode":"03-04","member_number":"TY102149","first_name":"GREG","last_name":"CANNON","classification":"C","division":"OPEN","hit_factor":6.2622},{"match_name":"MCRC USPSA September 2017","match_date":"2017-09-09","stage_classifiercode":"03-04","member_number":"A80405","first_name":"LINDA","last_name":"DISCHE","classification":"C","division":"OPEN","hit_factor":6.2558},{"match_name":"Cactus USPSA November 2021","match_date":"2021-11-07","stage_classifiercode":"03-04","member_number":"TY116032","first_name":"JEFF","last_name":"STANLEY","classification":"B","division":"OPEN","hit_factor":6.25},{"match_name":"CCAS December 2018 Special Classifier","match_date":"2018-12-15","stage_classifiercode":"03-04","member_number":"A92463","first_name":"DAN","last_name":"STABER","classification":"C","division":"OPEN","hit_factor":6.2435},{"match_name":"EAPS July 2016 USPSA","match_date":"2016-07-17","stage_classifiercode":"03-04","member_number":"A66934","first_name":"ELIZABETH","last_name":"YOUNG","classification":"C","division":"OPEN","hit_factor":6.2323},{"match_name":"Idaho ISPS October 7th 2017","match_date":"2017-10-07","stage_classifiercode":"03-04","member_number":"A84188","first_name":"LARRY","last_name":"OLETSKI","classification":"C","division":"OPEN","hit_factor":6.2262},{"match_name":"FVPS November USPSA Match","match_date":"2018-11-03","stage_classifiercode":"03-04","member_number":"TY99422","first_name":"CORY","last_name":"TUCHSCHERER","classification":"B","division":"OPEN","hit_factor":6.2192},{"match_name":"Maine Practical Shooters June 2016","match_date":"2016-06-04","stage_classifiercode":"03-04","member_number":"TY23169","first_name":"TED","last_name":"KAVAGE","classification":"B","division":"OPEN","hit_factor":6.2062},{"match_name":"ACPSA January 2017","match_date":"2017-01-28","stage_classifiercode":"03-04","member_number":"TY94255","first_name":"SHANE","last_name":"BETHEA","classification":"U","division":"OPEN","hit_factor":6.1966},{"match_name":"August 2018 CAS USPSA","match_date":"2018-08-05","stage_classifiercode":"03-04","member_number":"L2100","first_name":"MAX","last_name":"MICHEL SR.","classification":"M","division":"OPEN","hit_factor":6.1938},{"match_name":"MCPSL Pistol 12-9-17","match_date":"2017-12-09","stage_classifiercode":"03-04","member_number":"FY48525","first_name":"DAVID","last_name":"KOVAC","classification":"B","division":"OPEN","hit_factor":6.1762},{"match_name":"Cactus USPSA ALL CLASSIFIER September 2020","match_date":"2020-09-06","stage_classifiercode":"03-04","member_number":"TY114245","first_name":"EUGENE","last_name":"OH","classification":"B","division":"OPEN","hit_factor":6.1697},{"match_name":"Prescott 1st Saturday 3-04-2017","match_date":"2017-03-04","stage_classifiercode":"03-04","member_number":"A97237","first_name":"JARRETT","last_name":"TARVER","classification":"C","division":"OPEN","hit_factor":6.1558},{"match_name":"Minnetonka game and fish June 30","match_date":"2021-06-30","stage_classifiercode":"03-04","member_number":"TY29847","first_name":"ROSS","last_name":"ROSENBERG","classification":"A","division":"OPEN","hit_factor":6.1492},{"match_name":"ORSA USPSA January 2020","match_date":"2020-01-18","stage_classifiercode":"03-04","member_number":"A115017","first_name":"BRUCE","last_name":"ERLINGER","classification":"B","division":"OPEN","hit_factor":6.1367},{"match_name":"RCPS USPSA Nov 14","match_date":"2020-11-14","stage_classifiercode":"03-04","member_number":"TY128327","first_name":"NICHOLAS","last_name":"BARNETT","classification":"U","division":"OPEN","hit_factor":6.1269},{"match_name":"FVPS November USPSA Match","match_date":"2018-11-03","stage_classifiercode":"03-04","member_number":"A102155","first_name":"BENJAMIN","last_name":"KELM","classification":"U","division":"OPEN","hit_factor":6.1224},{"match_name":"Hopkinton August 2017","match_date":"2017-08-05","stage_classifiercode":"03-04","member_number":"A92915","first_name":"DUSTIN","last_name":"BRISSON","classification":"B","division":"OPEN","hit_factor":6.1194},{"match_name":"Hosemonster Action  ","match_date":"2021-05-16","stage_classifiercode":"03-04","member_number":"Ty98251","first_name":"SCOTT","last_name":"SEABOURN","classification":"C","division":"OPEN","hit_factor":6.1144},{"match_name":"ORSA USPSA March 2017 Shaken Not Stirred Special","match_date":"2017-03-18","stage_classifiercode":"03-04","member_number":"A55824","first_name":"JEFF","last_name":"GORDON","classification":"B","division":"OPEN","hit_factor":6.1135},{"match_name":"SFPS 9-23-18 USPSA Match","match_date":"2018-09-23","stage_classifiercode":"03-04","member_number":"TY72577","first_name":"RANDY","last_name":"BALLARD","classification":"B","division":"OPEN","hit_factor":6.1097},{"match_name":"RMAP 3rd Sunday Marh 2016","match_date":"2016-03-20","stage_classifiercode":"03-04","member_number":"A89861","first_name":"LEON","last_name":"SMITH","classification":"C","division":"OPEN","hit_factor":6.1082},{"match_name":"NISA April Classifer Match 2016","match_date":"2016-04-24","stage_classifiercode":"03-04","member_number":"a71862","first_name":"JOSEPH","last_name":"SINYAKOVICH","classification":"B","division":"OPEN","hit_factor":6.1077},{"match_name":"CCAS April 2017","match_date":"2017-04-15","stage_classifiercode":"03-04","member_number":"A73178","first_name":"JOE","last_name":"WILLIS","classification":"A","division":"OPEN","hit_factor":6.0976},{"match_name":"Idaho ISPS August 4th 2018","match_date":"2018-08-04","stage_classifiercode":"03-04","member_number":"A84438","first_name":"TYSON","last_name":"DIXON","classification":"A","division":"OPEN","hit_factor":6.092},{"match_name":"PMRPC September 2018 USPSA","match_date":"2018-09-08","stage_classifiercode":"03-04","member_number":"A41739","first_name":"MARIO E.","last_name":"FARRULLA","classification":"A","division":"OPEN","hit_factor":6.0914},{"match_name":"MISS USPSA 4-5-17","match_date":"2017-04-05","stage_classifiercode":"03-04","member_number":"A91934","first_name":"ALFRED","last_name":"LADORES","classification":"M","division":"OPEN","hit_factor":6.0855},{"match_name":"Lefthanders Gun Club Practical Shooters September 2 and 3","match_date":"2017-09-02","stage_classifiercode":"03-04","member_number":"TY91334","first_name":"BILL","last_name":"SIDELL","classification":"B","division":"OPEN","hit_factor":6.0829},{"match_name":"MCRC USPSA March 2020","match_date":"2020-03-14","stage_classifiercode":"03-04","member_number":"A115803","first_name":"MATTHEW","last_name":"STUGART","classification":"X","division":"OPEN","hit_factor":6.0811},{"match_name":"GPS OCTOBER 2018","match_date":"2018-10-28","stage_classifiercode":"03-04","member_number":"A30373","first_name":"TONY","last_name":"DE VEGA","classification":"B","division":"OPEN","hit_factor":6.0784},{"match_name":"WTPS USPSA October Match 10-8-16","match_date":"2016-10-08","stage_classifiercode":"03-04","member_number":"\"\"","first_name":"MAX","last_name":"WALKER","classification":"U","division":"OPEN","hit_factor":6.0733},{"match_name":"CCAS December 2018 Special Classifier","match_date":"2018-12-15","stage_classifiercode":"03-04","member_number":"A11195","first_name":"DAVE","last_name":"MOODY","classification":"M","division":"OPEN","hit_factor":6.0688},{"match_name":"PRG October 2018 Match","match_date":"2018-10-07","stage_classifiercode":"03-04","member_number":"\"\"","first_name":"LEI","last_name":"XU","classification":"U","division":"OPEN","hit_factor":6.0645},{"match_name":"Minot USPSA 2-18-18","match_date":"2018-02-18","stage_classifiercode":"03-04","member_number":"TY51500","first_name":"DOUG","last_name":"STELTZER","classification":"B","division":"OPEN","hit_factor":6.0635},{"match_name":"SWGC USPSA Pistol Match - July","match_date":"2016-07-02","stage_classifiercode":"03-04","member_number":"A31524","first_name":"COUNCIL","last_name":"BRADSHAW","classification":"G","division":"OPEN","hit_factor":6.0519},{"match_name":"RCSC USPSA 24 July 2016","match_date":"2016-07-24","stage_classifiercode":"03-04","member_number":"TY81163","first_name":"HENRY","last_name":"RUIZ","classification":"B","division":"OPEN","hit_factor":6.0456},{"match_name":"BGSL First Sunday Uspsa","match_date":"2016-08-07","stage_classifiercode":"03-04","member_number":"A85085","first_name":"RICK","last_name":"NEASE","classification":"B","division":"OPEN","hit_factor":6.044},{"match_name":"Hosemonster Action  ","match_date":"2021-05-16","stage_classifiercode":"03-04","member_number":"L1350","first_name":"GARY","last_name":"ORR","classification":"A","division":"OPEN","hit_factor":6.0384},{"match_name":"WVPPS September 2018","match_date":"2018-09-16","stage_classifiercode":"03-04","member_number":"L4304","first_name":"NEIL","last_name":"DAVIS","classification":"B","division":"OPEN","hit_factor":6.0362},{"match_name":"Lefthanders Gun Club Practical Shooters September 2 and 3","match_date":"2017-09-02","stage_classifiercode":"03-04","member_number":"A69428","first_name":"CARTER","last_name":"JONES","classification":"C","division":"OPEN","hit_factor":6.0329},{"match_name":"SPSA USPSA June 1st Sat Match","match_date":"2018-06-02","stage_classifiercode":"03-04","member_number":"A106620","first_name":"CR","last_name":"GITTERE","classification":"C","division":"OPEN","hit_factor":6.032},{"match_name":"EAPS February 2018 USPSA","match_date":"2018-02-18","stage_classifiercode":"03-04","member_number":"TY84389","first_name":"ETHAN","last_name":"BOUDREAUX","classification":"U","division":"OPEN","hit_factor":6.015},{"match_name":"G2G September 28th USPSA Match","match_date":"2021-09-28","stage_classifiercode":"03-04","member_number":"TY7309","first_name":"STEPHEN","last_name":"JACK","classification":"M","division":"OPEN","hit_factor":6.0105},{"match_name":"Custer USPSA Mar 7th 2021","match_date":"2021-03-07","stage_classifiercode":"03-04","member_number":"FY107432","first_name":"REZNER","last_name":"ABUBAKAR","classification":"U","division":"OPEN","hit_factor":6.0094},{"match_name":"Pinetucky USPSA 03-18-17","match_date":"2017-03-18","stage_classifiercode":"03-04","member_number":"TY61426","first_name":"THOMAS","last_name":"NYLAND","classification":"C","division":"OPEN","hit_factor":6.0019},{"match_name":"MvpFeb2016","match_date":"2016-02-06","stage_classifiercode":"03-04","member_number":"\"\"","first_name":"RICHARD","last_name":"TANAKA","classification":"U","division":"OPEN","hit_factor":6},{"match_name":"USAH New Years Pistol & PCC Match","match_date":"2020-01-19","stage_classifiercode":"03-04","member_number":"TY94537","first_name":"BUTCHIE","last_name":"BATANGAN","classification":"D","division":"OPEN","hit_factor":6},{"match_name":"CCPL 10112015","match_date":"2015-10-11","stage_classifiercode":"03-04","member_number":"A34139","first_name":"LEE","last_name":"ROWE","classification":"A","division":"OPEN","hit_factor":5.9982},{"match_name":"SSS USPSA May 2020","match_date":"2020-05-17","stage_classifiercode":"03-04","member_number":"A102564","first_name":"DONALD","last_name":"POWERS","classification":"M (Master)","division":"OPEN","hit_factor":5.9848},{"match_name":"Custer USPSA Mar 7th 2021","match_date":"2021-03-07","stage_classifiercode":"03-04","member_number":"TY103985","first_name":"CHRIS","last_name":"TEDFORD","classification":"U","division":"OPEN","hit_factor":5.9757},{"match_name":"DSC August 2016","match_date":"2016-08-21","stage_classifiercode":"03-04","member_number":"TY53760","first_name":"DAVE","last_name":"LEE","classification":"U","division":"OPEN","hit_factor":5.9737},{"match_name":"Dundee USPSA Feb 2016","match_date":"2016-02-27","stage_classifiercode":"03-04","member_number":"A70998","first_name":"JAKE","last_name":"DYER","classification":"M","division":"OPEN","hit_factor":5.9724},{"match_name":"Springfield Tactical Shooters 11/01/2018","match_date":"2018-11-01","stage_classifiercode":"03-04","member_number":"L3651","first_name":"RYAN","last_name":"BRADLEY","classification":"A","division":"OPEN","hit_factor":5.9701},{"match_name":"Colonial Rifle and Pistol Club September 2020","match_date":"2020-09-05","stage_classifiercode":"03-04","member_number":"Fy92927","first_name":"ANTHONY","last_name":"MAINOLFI","classification":"B","division":"OPEN","hit_factor":5.9671},{"match_name":"EAPS February 2018 USPSA","match_date":"2018-02-18","stage_classifiercode":"03-04","member_number":"A92150","first_name":"JAMES","last_name":"NELSON","classification":"U","division":"OPEN","hit_factor":5.9662},{"match_name":"TPS USPSA at CMP March 17 2018","match_date":"2018-03-17","stage_classifiercode":"03-04","member_number":"A94603","first_name":"RONALDO","last_name":"BORGES","classification":"B","division":"OPEN","hit_factor":5.9649},{"match_name":"SMPS June 2016","match_date":"2016-06-12","stage_classifiercode":"03-04","member_number":"FY72075","first_name":"DAVID","last_name":"MCMORRIS","classification":"B","division":"OPEN","hit_factor":5.9588},{"match_name":"Richmond Hot Shots February 20 and 21 - 2016 USPSA Match","match_date":"2016-02-20","stage_classifiercode":"03-04","member_number":"A86599","first_name":"SEAN","last_name":"AGUAS","classification":"C","division":"OPEN","hit_factor":5.9501},{"match_name":"YRPA JULY USPA 2017","match_date":"2017-07-23","stage_classifiercode":"03-04","member_number":"TY42863","first_name":"MIKE D","last_name":"MCCARTY","classification":"B","division":"OPEN","hit_factor":5.9459},{"match_name":"MCPSL Pistol 6-11-16","match_date":"2016-06-11","stage_classifiercode":"03-04","member_number":"A72049","first_name":"MARK","last_name":"KLINEFELTER","classification":"C","division":"OPEN","hit_factor":5.9434},{"match_name":"RCSC USPSA 24 July 2016","match_date":"2016-07-24","stage_classifiercode":"03-04","member_number":"PEND","first_name":"MICHAEL","last_name":"WALSH","classification":"U","division":"OPEN","hit_factor":5.9372},{"match_name":"FVPS July Point Series Match","match_date":"2017-07-01","stage_classifiercode":"03-04","member_number":"TY78432","first_name":"OUSMANE","last_name":"DIALLO","classification":"C","division":"OPEN","hit_factor":5.933},{"match_name":"Gem City Gun Club 8-5 and 6th 2017","match_date":"2017-08-05","stage_classifiercode":"03-04","member_number":"\"\"","first_name":"BILL","last_name":"MASLER","classification":"B","division":"OPEN","hit_factor":5.9329},{"match_name":"SAPSC Monthly USPSA Classifier Match at Autreys Armory 20180612","match_date":"2018-06-12","stage_classifiercode":"03-04","member_number":"A88793","first_name":"RACHEL","last_name":"SMITH","classification":"C","division":"OPEN","hit_factor":5.9307},{"match_name":"Ripon USPSA 4-22-17","match_date":"2017-04-22","stage_classifiercode":"03-04","member_number":"FY29442","first_name":"ROB","last_name":"KALISHEK","classification":"A","division":"OPEN","hit_factor":5.9199},{"match_name":"HPPS 2-18-2017","match_date":"2017-02-16","stage_classifiercode":"03-04","member_number":"L3985","first_name":"FRANK","last_name":"JOHNSON","classification":"C","division":"OPEN","hit_factor":5.9182},{"match_name":"EAPS February 2018 USPSA","match_date":"2018-02-18","stage_classifiercode":"03-04","member_number":"\"\"","first_name":"CHRISTOPHER","last_name":"JUE","classification":"U","division":"OPEN","hit_factor":5.9113},{"match_name":"Gps   November 2015","match_date":"2015-11-22","stage_classifiercode":"03-04","member_number":"A42440","first_name":"KELTON","last_name":"CASEY","classification":"B","division":"OPEN","hit_factor":5.9086},{"match_name":"Springfield Tactical Shooters 03/05/2020","match_date":"2020-03-05","stage_classifiercode":"03-04","member_number":"A30365","first_name":"ED","last_name":"TRIBBLE","classification":"A","division":"OPEN","hit_factor":5.9067},{"match_name":"TPS USPSA at CMP March 17 2018","match_date":"2018-03-17","stage_classifiercode":"03-04","member_number":"L3945","first_name":"ERIC","last_name":"HAGAN","classification":"B","division":"OPEN","hit_factor":5.9066},{"match_name":"Renton USPSA August 2016 - NW05","match_date":"2016-08-28","stage_classifiercode":"03-04","member_number":"L2335","first_name":"ENRIQUE","last_name":"CHEESMAN","classification":"G","division":"OPEN","hit_factor":5.9041},{"match_name":"WPS USPSA Monthly Match April 2018","match_date":"2018-04-07","stage_classifiercode":"03-04","member_number":"FY38874","first_name":"ALDO","last_name":"GONZALEZ","classification":"B","division":"OPEN","hit_factor":5.9037},{"match_name":"LGCSEMPS April 2018 Special Classifier","match_date":"2018-04-08","stage_classifiercode":"03-04","member_number":"A104695","first_name":"BRAD","last_name":"RAINEY","classification":"U","division":"OPEN","hit_factor":5.9031},{"match_name":"SPSA USPSA October 4th Sat match","match_date":"2016-10-22","stage_classifiercode":"03-04","member_number":"A39246","first_name":"FEDERICO","last_name":"MINLOS","classification":"B","division":"OPEN","hit_factor":5.8981},{"match_name":"LCSC USPSA   8-13-17","match_date":"2017-08-08","stage_classifiercode":"03-04","member_number":"TY85663","first_name":"JASON","last_name":"YU","classification":"B","division":"OPEN","hit_factor":5.8981},{"match_name":"GRPC USPSA MARDI GRAS MADNESS","match_date":"2018-02-04","stage_classifiercode":"03-04","member_number":"A94852","first_name":"RANDY","last_name":"GOODNEY","classification":"A","division":"OPEN","hit_factor":5.8974},{"match_name":"Richmond Boro Gun Club December 2018 USPSA Match","match_date":"2018-12-15","stage_classifiercode":"03-04","member_number":"A109268","first_name":"ALAIN","last_name":"RMAND","classification":"D","division":"OPEN","hit_factor":5.8824},{"match_name":"EAGC March 2017 USPSA Pistol Match","match_date":"2017-03-19","stage_classifiercode":"03-04","member_number":"A88793","first_name":"RACHEL","last_name":"SMITH","classification":"C","division":"OPEN","hit_factor":5.8768},{"match_name":"Richmond Hot Shots February 20 and 21 - 2016 USPSA Match","match_date":"2016-02-20","stage_classifiercode":"03-04","member_number":"A61934","first_name":"WILLIAM","last_name":"TIU","classification":"B","division":"OPEN","hit_factor":5.8719},{"match_name":"SCS USPSA Pistol Match with Classifier - November 6 2016","match_date":"2016-11-06","stage_classifiercode":"03-04","member_number":"A88904","first_name":"JOHN","last_name":"SIMS","classification":"A","division":"OPEN","hit_factor":5.8599},{"match_name":"NVGC Centerfire Match April 8 2017","match_date":"2017-04-08","stage_classifiercode":"03-04","member_number":"A9542","first_name":"DON","last_name":"FENTON","classification":"\"\"","division":"OPEN","hit_factor":5.8577},{"match_name":"Collin County USPSA July 30th 2017","match_date":"2017-07-30","stage_classifiercode":"03-04","member_number":"A75681","first_name":"CHRISTINE","last_name":"WEBSTER","classification":"C","division":"OPEN","hit_factor":5.8496},{"match_name":"MCPSL Pistol 6-13-20","match_date":"2020-06-13","stage_classifiercode":"03-04","member_number":"TY104399","first_name":"DONNIE","last_name":"DUREN","classification":"U","division":"OPEN","hit_factor":5.8468},{"match_name":"USAH New Years Pistol & PCC Match","match_date":"2020-01-19","stage_classifiercode":"03-04","member_number":"FY66771","first_name":"ORLINO","last_name":"CARDENAS","classification":"C","division":"OPEN","hit_factor":5.8435},{"match_name":"Mesilla Valley P October 2020","match_date":"2020-10-18","stage_classifiercode":"03-04","member_number":"a100381","first_name":"JUSTIN","last_name":"MARTINEZ","classification":"U","division":"OPEN","hit_factor":5.8394},{"match_name":"Springfield Tactical Shooters 03/05/2020","match_date":"2020-03-05","stage_classifiercode":"03-04","member_number":"A95946","first_name":"PAUL","last_name":"EMERY","classification":"B","division":"OPEN","hit_factor":5.8394},{"match_name":"CSA  COALFIELDS SHOOTERS ASSOCIATION USPSA JULY 2020","match_date":"2020-07-12","stage_classifiercode":"03-04","member_number":"A89266","first_name":"SCOTT","last_name":"RIDDLE2","classification":"B","division":"OPEN","hit_factor":5.8366},{"match_name":"July USPSA","match_date":"2021-07-25","stage_classifiercode":"03-04","member_number":"A98137","first_name":"PHIL","last_name":"UNDERWOOD","classification":"B","division":"OPEN","hit_factor":5.8341},{"match_name":"CRGC USPSA Match 07-19-20","match_date":"2020-07-19","stage_classifiercode":"03-04","member_number":"A101407","first_name":"JAMES","last_name":"LAROSA","classification":"B","division":"OPEN","hit_factor":5.8333},{"match_name":"Springfield Tactical Shooters 03/05/2020","match_date":"2020-03-05","stage_classifiercode":"03-04","member_number":"FY59095","first_name":"SHELBY","last_name":"STOCKTON","classification":"\"\"","division":"OPEN","hit_factor":5.8252},{"match_name":"NPCCC November USPSA","match_date":"2015-11-01","stage_classifiercode":"03-04","member_number":"\"\"","first_name":"REPETE","last_name":"BRIGGS","classification":"none","division":"OPEN","hit_factor":5.8228},{"match_name":"GPS OCTOBER 2018","match_date":"2018-10-28","stage_classifiercode":"03-04","member_number":"TY76330","first_name":"MARLON","last_name":"PORALAN","classification":"D","division":"OPEN","hit_factor":5.8129},{"match_name":"FVPS November USPSA Match","match_date":"2018-11-03","stage_classifiercode":"03-04","member_number":"A107715","first_name":"JAMES","last_name":"NIEDT","classification":"B","division":"OPEN","hit_factor":5.8109},{"match_name":"WVPPS September 2018","match_date":"2018-09-16","stage_classifiercode":"03-04","member_number":"A69428","first_name":"CARTER","last_name":"JONES","classification":"C","division":"OPEN","hit_factor":5.8036},{"match_name":"SWGC USPSA Pistol Match - July","match_date":"2016-07-02","stage_classifiercode":"03-04","member_number":"A85896","first_name":"JOHN","last_name":"MCQUEEN","classification":"C","division":"OPEN","hit_factor":5.8036},{"match_name":"SPSA USPSA December 4th Sat match","match_date":"2018-12-22","stage_classifiercode":"03-04","member_number":"A100654","first_name":"BRANDON","last_name":"RADER","classification":"B","division":"OPEN","hit_factor":5.8014},{"match_name":"FVPS July Point Series Match","match_date":"2017-07-01","stage_classifiercode":"03-04","member_number":"TY26421","first_name":"RANDY","last_name":"HEFFNER","classification":"B","division":"OPEN","hit_factor":5.7908},{"match_name":"Lafayette Practical Shooters - WED - May 16","match_date":"2018-05-17","stage_classifiercode":"03-04","member_number":"L4169","first_name":"JOHN PAUL","last_name":"GARCIA","classification":"B","division":"OPEN","hit_factor":5.7851},{"match_name":"Richmond Boro Gun Club December 2018 USPSA Match","match_date":"2018-12-15","stage_classifiercode":"03-04","member_number":"TY83520","first_name":"JAMES","last_name":"MARQUEZ","classification":"C","division":"OPEN","hit_factor":5.7843},{"match_name":"Pioneer Action Shooters USPSA 5-23-21 Special Classifer","match_date":"2021-05-23","stage_classifiercode":"03-04","member_number":"TY110530","first_name":"BRIAN","last_name":"WHITNEY","classification":"B","division":"OPEN","hit_factor":5.7647},{"match_name":"JCSSA Mar3 2018","match_date":"2018-03-03","stage_classifiercode":"03-04","member_number":"A75681","first_name":"CHRISTINE","last_name":"WEBSTER","classification":"U","division":"OPEN","hit_factor":5.764},{"match_name":"WVPPS September 2018","match_date":"2018-09-16","stage_classifiercode":"03-04","member_number":"TY69656","first_name":"JEFF","last_name":"STRAUCH","classification":"C","division":"OPEN","hit_factor":5.7602},{"match_name":"LTD Pistol - August 2018","match_date":"2018-08-04","stage_classifiercode":"03-04","member_number":"L3007","first_name":"FARLEY","last_name":"COLLINS","classification":"B","division":"OPEN","hit_factor":5.7602},{"match_name":"WI21 Sep 27 2020","match_date":"2020-09-27","stage_classifiercode":"03-04","member_number":"Ty90917","first_name":"MICHAEL","last_name":"ROUSE","classification":"U","division":"OPEN","hit_factor":5.7578},{"match_name":"NW15 Port Townsend Practical Pistol USPSA November 7 2020","match_date":"2020-11-07","stage_classifiercode":"03-04","member_number":"A111193","first_name":"TODD","last_name":"JOHANSSON","classification":"U","division":"OPEN","hit_factor":5.7514},{"match_name":"Springfield Tactical Shooters 11/01/2018","match_date":"2018-11-01","stage_classifiercode":"03-04","member_number":"A95946","first_name":"PAUL","last_name":"EMERY","classification":"C","division":"OPEN","hit_factor":5.75},{"match_name":"CIPSC IL02 Havana June USPSA","match_date":"2021-06-12","stage_classifiercode":"03-04","member_number":"A125064","first_name":"RYAN","last_name":"NELSON","classification":"C","division":"OPEN","hit_factor":5.7391},{"match_name":"CCAS December 2018 Special Classifier","match_date":"2018-12-15","stage_classifiercode":"03-04","member_number":"A97207","first_name":"DON","last_name":"REYNOLDS","classification":"C","division":"OPEN","hit_factor":5.7307},{"match_name":"SWGC USPSA Pistol Match - July","match_date":"2016-07-02","stage_classifiercode":"03-04","member_number":"A95072","first_name":"JOSE","last_name":"MAGANA","classification":"U","division":"OPEN","hit_factor":5.7287},{"match_name":"Lefthanders Gun Club Practical Shooters September 2 and 3","match_date":"2017-09-02","stage_classifiercode":"03-04","member_number":"TY33410","first_name":"JEFF","last_name":"MATSCHE","classification":"M","division":"OPEN","hit_factor":5.7232},{"match_name":"Dundee USPSA Feb 2016","match_date":"2016-02-27","stage_classifiercode":"03-04","member_number":"TY57679","first_name":"KEN","last_name":"KING","classification":"C","division":"OPEN","hit_factor":5.7216},{"match_name":"Bass River USPSA August 2020","match_date":"2020-08-02","stage_classifiercode":"03-04","member_number":"L3199","first_name":"TIMOTHY","last_name":"KENT","classification":"B","division":"OPEN","hit_factor":5.7199},{"match_name":"Griffin USPSA Match March 2018","match_date":"2018-03-17","stage_classifiercode":"03-04","member_number":"A38371","first_name":"TERRY","last_name":"CHENEY","classification":"B","division":"OPEN","hit_factor":5.7169},{"match_name":"HPPS 2-18-2017","match_date":"2017-02-16","stage_classifiercode":"03-04","member_number":"TY18366","first_name":"RICK","last_name":"HEBERT","classification":"M","division":"OPEN","hit_factor":5.7044},{"match_name":"RMAP 3rd Sunday Marh 2016","match_date":"2016-03-20","stage_classifiercode":"03-04","member_number":"TY46968","first_name":"STEVEN","last_name":"REDIES","classification":"A","division":"OPEN","hit_factor":5.703},{"match_name":"FVPS November USPSA Match","match_date":"2018-11-03","stage_classifiercode":"03-04","member_number":"TY26421","first_name":"RANDY","last_name":"HEFFNER","classification":"B","division":"OPEN","hit_factor":5.6999},{"match_name":"WSPS NOVEMBER 2020 USPSA PROTEST","match_date":"2020-11-21","stage_classifiercode":"03-04","member_number":"ty49476","first_name":"NORM","last_name":"DIFFENDERFER","classification":"C","division":"OPEN","hit_factor":5.6983},{"match_name":"CSA  COALFIELDS SHOOTERS ASSOCIATION USPSA JULY 2020","match_date":"2020-07-12","stage_classifiercode":"03-04","member_number":"A110946","first_name":"BRIAN","last_name":"KELLER","classification":"A","division":"OPEN","hit_factor":5.698},{"match_name":"Dundee USPSA Feb 2016","match_date":"2016-02-27","stage_classifiercode":"03-04","member_number":"A38510","first_name":"ERIC","last_name":"FALKNER","classification":"B","division":"OPEN","hit_factor":5.6931},{"match_name":"SPSA USPSA October 4th Sat match","match_date":"2016-10-22","stage_classifiercode":"03-04","member_number":"L1700","first_name":"BOB","last_name":"WRIGHT","classification":"M","division":"OPEN","hit_factor":5.6911},{"match_name":"Cactus USPSA November 2021","match_date":"2021-11-07","stage_classifiercode":"03-04","member_number":"a21152","first_name":"BRIAN","last_name":"MUEGGE","classification":"A","division":"OPEN","hit_factor":5.6893},{"match_name":"Ripon USPSA 4-22-17","match_date":"2017-04-22","stage_classifiercode":"03-04","member_number":"A69727","first_name":"JARED","last_name":"LOWE","classification":"U","division":"OPEN","hit_factor":5.6864},{"match_name":"July USPSA","match_date":"2021-07-25","stage_classifiercode":"03-04","member_number":"A98137","first_name":"PHIL","last_name":"UNDERWOOD","classification":"B","division":"OPEN","hit_factor":5.6863},{"match_name":"Colonial Rifle and Pistol Club September 2020","match_date":"2020-09-05","stage_classifiercode":"03-04","member_number":"L3570","first_name":"KEVIN","last_name":"DRISCOLL","classification":"B","division":"OPEN","hit_factor":5.6838},{"match_name":"SSS USPSA May 2020","match_date":"2020-05-17","stage_classifiercode":"03-04","member_number":"A81735","first_name":"BUDDY","last_name":"BROWN","classification":"U (Unclassified)","division":"OPEN","hit_factor":5.6687},{"match_name":"Griffin USPSA Match March 2018","match_date":"2018-03-17","stage_classifiercode":"03-04","member_number":"Pen","first_name":"ADAM","last_name":"REAMES","classification":"B","division":"OPEN","hit_factor":5.6604},{"match_name":"Richmond Hot Shots February 20 and 21 - 2016 USPSA Match","match_date":"2016-02-20","stage_classifiercode":"03-04","member_number":"TY77462","first_name":"LENNIE","last_name":"VILLIADOS","classification":"C","division":"OPEN","hit_factor":5.6588},{"match_name":"Richmond Hot Shots February 20 and 21 - 2016 USPSA Match","match_date":"2016-02-20","stage_classifiercode":"03-04","member_number":"A80595","first_name":"EDGAR","last_name":"ALLAS","classification":"C","division":"OPEN","hit_factor":5.6555},{"match_name":"Shoot GTR USPSA 2/5","match_date":"2017-02-04","stage_classifiercode":"03-04","member_number":"FY29424","first_name":"JIM","last_name":"FESSLER","classification":"B","division":"OPEN","hit_factor":5.6537},{"match_name":"Idaho ISPS October 7th 2017","match_date":"2017-10-07","stage_classifiercode":"03-04","member_number":"L2026","first_name":"DEAN","last_name":"BARTON","classification":"B","division":"OPEN","hit_factor":5.6465},{"match_name":"MS06 Team Magnolia USPSA October Match","match_date":"2015-10-04","stage_classifiercode":"03-04","member_number":"A36282","first_name":"WILLIAM","last_name":"MAHLEY","classification":"B","division":"OPEN","hit_factor":5.615},{"match_name":"Hopkinton August 2017","match_date":"2017-08-05","stage_classifiercode":"03-04","member_number":"TY93513","first_name":"MICHAEL","last_name":"KANE","classification":"C","division":"OPEN","hit_factor":5.6047},{"match_name":"BGSL First Sunday USPSA Match","match_date":"2016-02-07","stage_classifiercode":"03-04","member_number":"TY79986","first_name":"TOM","last_name":"SARGENT","classification":"A","division":"OPEN","hit_factor":5.6009},{"match_name":"PCSI USPSA 2018   April Classifier Match 2","match_date":"2018-04-07","stage_classifiercode":"03-04","member_number":"A80646","first_name":"BOUNTHAVY","last_name":"SOUNGPRADITH","classification":"U","division":"OPEN","hit_factor":5.598},{"match_name":"OREGON ARPC CC05 USPSA JULY 14 2018","match_date":"2018-07-14","stage_classifiercode":"03-04","member_number":"A81899","first_name":"TANNER","last_name":"BREEN","classification":"B","division":"OPEN","hit_factor":5.5954},{"match_name":"May 8 2021 The Range At True North USPSA Match","match_date":"2021-05-08","stage_classifiercode":"03-04","member_number":"A134392","first_name":"MIKE","last_name":"AYCOCK","classification":"U","division":"OPEN","hit_factor":5.5794},{"match_name":"USAH New Years Pistol & PCC Match","match_date":"2020-01-19","stage_classifiercode":"03-04","member_number":"FY113223","first_name":"TONY","last_name":"ABITONG","classification":"C","division":"OPEN","hit_factor":5.5705},{"match_name":"ORSA USPSA February 2020 ","match_date":"2020-02-15","stage_classifiercode":"03-04","member_number":"TY92869","first_name":"CSABA","last_name":"FOLDES","classification":"U","division":"OPEN","hit_factor":5.5662},{"match_name":"Bayou City USPSA Weekly Dec 27","match_date":"2018-12-28","stage_classifiercode":"03-04","member_number":"A94852","first_name":"RANDY","last_name":"GOODNEY","classification":"A","division":"OPEN","hit_factor":5.566},{"match_name":"EAPS February 2018 USPSA","match_date":"2018-02-18","stage_classifiercode":"03-04","member_number":"FY101141","first_name":"MATHEW","last_name":"DOZIER","classification":"U","division":"OPEN","hit_factor":5.5646},{"match_name":"DSC August 2016","match_date":"2016-08-21","stage_classifiercode":"03-04","member_number":"A72473","first_name":"FRANK","last_name":"NILO","classification":"C","division":"OPEN","hit_factor":5.5602},{"match_name":"RCSC USPSA 24 July 2016","match_date":"2016-07-24","stage_classifiercode":"03-04","member_number":"TY63497","first_name":"STEVE","last_name":"SCHUMACHER","classification":"B","division":"OPEN","hit_factor":5.56},{"match_name":"Lefthanders Gun Club Practical Shooters September 2 and 3","match_date":"2017-09-02","stage_classifiercode":"03-04","member_number":"A92230","first_name":"LELAND","last_name":"CLAYTON","classification":"U","division":"OPEN","hit_factor":5.5556},{"match_name":"PCWC USPSA  4 23 2016","match_date":"2016-04-23","stage_classifiercode":"03-04","member_number":"TY61514","first_name":"HARRY","last_name":"MATHIAS","classification":"B","division":"OPEN","hit_factor":5.5451},{"match_name":"RMAP 3rd Sunday Marh 2016","match_date":"2016-03-20","stage_classifiercode":"03-04","member_number":"A18698","first_name":"MICHAEL","last_name":"DALE","classification":"A","division":"OPEN","hit_factor":5.5422},{"match_name":"INAS AM January 2017 USPSA","match_date":"2017-01-07","stage_classifiercode":"03-04","member_number":"A28492","first_name":"DAVE","last_name":"MARCIN","classification":"U","division":"OPEN","hit_factor":5.5323},{"match_name":"BGSL First Sunday USPSA Match","match_date":"2016-02-07","stage_classifiercode":"03-04","member_number":"A87894","first_name":"DEVEN","last_name":"WAGNER","classification":"C","division":"OPEN","hit_factor":5.5249},{"match_name":"Maine Practical Shooters November 2020","match_date":"2020-11-01","stage_classifiercode":"03-04","member_number":"TY93799","first_name":"JONATHAN","last_name":"WHEATON","classification":"C","division":"OPEN","hit_factor":5.516},{"match_name":"WGC WI USPSA Monthly Match 12-17-16","match_date":"2016-12-17","stage_classifiercode":"03-04","member_number":"TY72120","first_name":"DAVE","last_name":"DEYOE","classification":"M","division":"OPEN","hit_factor":5.5105},{"match_name":"ISPS 4/17/2016 USPSA","match_date":"2016-04-17","stage_classifiercode":"03-04","member_number":"A2666","first_name":"MIKE","last_name":"JONES","classification":"A","division":"OPEN","hit_factor":5.5096},{"match_name":"Richmond Hot Shots February 20 and 21 - 2016 USPSA Match","match_date":"2016-02-20","stage_classifiercode":"03-04","member_number":"TY24456","first_name":"RANDY","last_name":"MELTON","classification":"M","division":"OPEN","hit_factor":5.508},{"match_name":"MCAS USPSA October 2016","match_date":"2016-10-15","stage_classifiercode":"03-04","member_number":"PEN","first_name":"ROGER","last_name":"HARDING","classification":"U","division":"OPEN","hit_factor":5.508},{"match_name":"Ripon USPSA 4-22-17","match_date":"2017-04-22","stage_classifiercode":"03-04","member_number":"TY26421","first_name":"RANDY","last_name":"HEFFNER","classification":"B","division":"OPEN","hit_factor":5.5077},{"match_name":"Pinetucky USPSA 03-18-17","match_date":"2017-03-18","stage_classifiercode":"03-04","member_number":"TY93235","first_name":"JENNIFER","last_name":"PETTY","classification":"C","division":"OPEN","hit_factor":5.5005},{"match_name":"SLOSA FEBRUARY 2020 USPSA MATCH","match_date":"2020-02-08","stage_classifiercode":"03-04","member_number":"A93117","first_name":"WARREN","last_name":"SMALL","classification":"C","division":"OPEN","hit_factor":5.4772},{"match_name":"Defense In Depth D.I.D USPSA 11-23-21","match_date":"2021-11-23","stage_classifiercode":"03-04","member_number":"A138267","first_name":"HAROLD","last_name":"FORMAN","classification":"U","division":"OPEN","hit_factor":5.475},{"match_name":"Homestead USPSA July Match","match_date":"2018-07-07","stage_classifiercode":"03-04","member_number":"TY70648","first_name":"CRISTOBALERNESTO","last_name":"ACOSTA","classification":"B","division":"OPEN","hit_factor":5.4618},{"match_name":"DSC August 2016","match_date":"2016-08-21","stage_classifiercode":"03-04","member_number":"A40780","first_name":"JIM","last_name":"DUVALL","classification":"B","division":"OPEN","hit_factor":5.4583},{"match_name":"Cactus USPSA ALL CLASSIFIER September 2020","match_date":"2020-09-06","stage_classifiercode":"03-04","member_number":"A100726","first_name":"DOMINIC","last_name":"NAPOLITANO","classification":"B","division":"OPEN","hit_factor":5.4484},{"match_name":"NISA September 2018","match_date":"2018-09-23","stage_classifiercode":"03-04","member_number":"TY85482","first_name":"MIKE","last_name":"SCHROEDL","classification":"B","division":"OPEN","hit_factor":5.4479},{"match_name":"Renton USPSA August 2016 - NW05","match_date":"2016-08-28","stage_classifiercode":"03-04","member_number":"L4061","first_name":"BART","last_name":"SKUBI","classification":"C","division":"OPEN","hit_factor":5.4455},{"match_name":"MvpFeb2016","match_date":"2016-02-06","stage_classifiercode":"03-04","member_number":"TY12239","first_name":"TONY","last_name":"BACA","classification":"B","division":"OPEN","hit_factor":5.4434},{"match_name":"SPSA USPSA June 1st Sat Match","match_date":"2018-06-02","stage_classifiercode":"03-04","member_number":"A100654","first_name":"BRANDON","last_name":"RADER","classification":"C","division":"OPEN","hit_factor":5.44},{"match_name":"Pinetucky USPSA 07-15-17","match_date":"2017-07-15","stage_classifiercode":"03-04","member_number":"TY-51383","first_name":"JOSHUA","last_name":"SIGHTLER","classification":"M","division":"OPEN","hit_factor":5.4329},{"match_name":"AIPS Weekly USPSA 24 July 2018","match_date":"2018-07-24","stage_classifiercode":"03-04","member_number":"A63023","first_name":"WENDY","last_name":"ARNBURG","classification":"C","division":"OPEN","hit_factor":5.427},{"match_name":"Ripon USPSA 4-22-17","match_date":"2017-04-22","stage_classifiercode":"03-04","member_number":"A99422","first_name":"CORY","last_name":"TUCHSCHERER","classification":"C","division":"OPEN","hit_factor":5.4103},{"match_name":"MCRC USPSA September 2017","match_date":"2017-09-09","stage_classifiercode":"03-04","member_number":"A86799","first_name":"BILL","last_name":"ROACH","classification":"C","division":"OPEN","hit_factor":5.4011},{"match_name":"FVPS July Point Series Match","match_date":"2017-07-01","stage_classifiercode":"03-04","member_number":"A69727","first_name":"JARED","last_name":"LOWE","classification":"U","division":"OPEN","hit_factor":5.3883},{"match_name":"EAPS February 2018 USPSA","match_date":"2018-02-18","stage_classifiercode":"03-04","member_number":"L2725","first_name":"CHARLIE","last_name":"BLACK","classification":"M","division":"OPEN","hit_factor":5.3839},{"match_name":"USAH New Years Pistol & PCC Match","match_date":"2020-01-19","stage_classifiercode":"03-04","member_number":"L3487","first_name":"ALEXANDER","last_name":"PATINO II","classification":"C","division":"OPEN","hit_factor":5.3744},{"match_name":"WSPS NOVEMBER 2020 USPSA PROTEST","match_date":"2020-11-21","stage_classifiercode":"03-04","member_number":"TY101530","first_name":"JEROME","last_name":"HOY","classification":"C","division":"OPEN","hit_factor":5.3684},{"match_name":"Richmond Boro Gun Club September 2020 USPSA Match","match_date":"2020-09-12","stage_classifiercode":"03-04","member_number":"TY10355","first_name":"JOHN","last_name":"FEVELO","classification":"C","division":"OPEN","hit_factor":5.3675},{"match_name":"August 2018 CAS USPSA","match_date":"2018-08-05","stage_classifiercode":"03-04","member_number":"L3707","first_name":"WOODY","last_name":"LANDRY","classification":"A","division":"OPEN","hit_factor":5.3672},{"match_name":"WGC WI USPSA Monthly Match 5-19-18","match_date":"2018-05-19","stage_classifiercode":"03-04","member_number":"TY81721","first_name":"STEVE","last_name":"MORTON","classification":"C","division":"OPEN","hit_factor":5.3514},{"match_name":"LCSC USPSA   8-13-17","match_date":"2017-08-08","stage_classifiercode":"03-04","member_number":"A32749","first_name":"BRYAN","last_name":"LARSON","classification":"A","division":"OPEN","hit_factor":5.3444},{"match_name":"CCAS April 2017","match_date":"2017-04-15","stage_classifiercode":"03-04","member_number":"L3773","first_name":"DEBBIE","last_name":"FOUTZ","classification":"C","division":"OPEN","hit_factor":5.3428},{"match_name":"MVPSA USPSA  6-16-18","match_date":"2018-06-16","stage_classifiercode":"03-04","member_number":"L4137","first_name":"STEVE","last_name":"PEACOCK","classification":"C","division":"OPEN","hit_factor":5.3313},{"match_name":"USAH New Years Pistol & PCC Match","match_date":"2020-01-19","stage_classifiercode":"03-04","member_number":"A119844","first_name":"REUBEN","last_name":"PILAR","classification":"U","division":"OPEN","hit_factor":5.3245},{"match_name":"Dundee USPSA Feb 2016","match_date":"2016-02-27","stage_classifiercode":"03-04","member_number":"TY45897","first_name":"LARRY","last_name":"MULL","classification":"C","division":"OPEN","hit_factor":5.3077},{"match_name":"HPPS 2-18-2017","match_date":"2017-02-16","stage_classifiercode":"03-04","member_number":"TY69978","first_name":"DOMINIC","last_name":"KOH","classification":"A","division":"OPEN","hit_factor":5.3073},{"match_name":"SPSA USPSA December 4th Sat match","match_date":"2018-12-22","stage_classifiercode":"03-04","member_number":"L4170","first_name":"STEVE","last_name":"COX","classification":"C","division":"OPEN","hit_factor":5.3071},{"match_name":"WI21 Sep 27 2020","match_date":"2020-09-27","stage_classifiercode":"03-04","member_number":"TY117620","first_name":"JIM","last_name":"ERICKSON","classification":"C","division":"OPEN","hit_factor":5.3043},{"match_name":"MRPC OHS02 092720","match_date":"2020-09-27","stage_classifiercode":"03-04","member_number":"FY64885","first_name":"KEVIN","last_name":"SANDERS","classification":"A","division":"OPEN","hit_factor":5.3001},{"match_name":"SAPSC Monthly USPSA Classifier Match 20161011","match_date":"2016-10-11","stage_classifiercode":"03-04","member_number":"A79845","first_name":"JOHNNY","last_name":"REED","classification":"B","division":"OPEN","hit_factor":5.2975},{"match_name":"Springfield Tactical Shooters 03/05/2020","match_date":"2020-03-05","stage_classifiercode":"03-04","member_number":"FY99127","first_name":"STEVE","last_name":"FRAZIER","classification":"B","division":"OPEN","hit_factor":5.296},{"match_name":"MPSA USPSA 021718","match_date":"2018-02-17","stage_classifiercode":"03-04","member_number":"A-96501","first_name":"CANDACE","last_name":"CALLOWAY","classification":"D","division":"OPEN","hit_factor":5.2932},{"match_name":"Colonial Rifle and Pistol Club September 2020","match_date":"2020-09-05","stage_classifiercode":"03-04","member_number":"FY92775","first_name":"CLIFFORD","last_name":"AVERSANO","classification":"C","division":"OPEN","hit_factor":5.2881},{"match_name":"CRGC USPSA Match 07-19-20","match_date":"2020-07-19","stage_classifiercode":"03-04","member_number":"A123654","first_name":"HUNTER","last_name":"MANSON","classification":"U","division":"OPEN","hit_factor":5.278},{"match_name":"Mesilla Valley P October 2020","match_date":"2020-10-18","stage_classifiercode":"03-04","member_number":"A12239","first_name":"TONY","last_name":"BACA","classification":"B","division":"OPEN","hit_factor":5.2674},{"match_name":"RMAP 3rd Sunday Marh 2016","match_date":"2016-03-20","stage_classifiercode":"03-04","member_number":"TY72239","first_name":"CINDY","last_name":"REDIES","classification":"C","division":"OPEN","hit_factor":5.2632},{"match_name":"LIPSA - April 29th 2018 - USPSA Special Classifier Match","match_date":"2018-04-29","stage_classifiercode":"03-04","member_number":"TY93363","first_name":"DEAN","last_name":"CHASSE","classification":"U","division":"OPEN","hit_factor":5.2632},{"match_name":"Custer USPSA May","match_date":"2018-05-06","stage_classifiercode":"03-04","member_number":"B52","first_name":"BRUCE","last_name":"GARY","classification":"B","division":"OPEN","hit_factor":5.2632},{"match_name":"RMAP 3rd Sunday Marh 2016","match_date":"2016-03-20","stage_classifiercode":"03-04","member_number":"CL67","first_name":"ROGER","last_name":"F","classification":"M","division":"OPEN","hit_factor":5.2591},{"match_name":"SPSA USPSA October 4th Sat match","match_date":"2016-10-22","stage_classifiercode":"03-04","member_number":"A94155","first_name":"DANNY","last_name":"BRITT","classification":"C","division":"OPEN","hit_factor":5.2591},{"match_name":"MCPSL Pistol 12-9-17","match_date":"2017-12-09","stage_classifiercode":"03-04","member_number":"A95470","first_name":"GABRIEL","last_name":"SANCHEZ","classification":"C","division":"OPEN","hit_factor":5.2536},{"match_name":"Colonial Rifle and Pistol Club September 2020","match_date":"2020-09-05","stage_classifiercode":"03-04","member_number":"Fy83515","first_name":"JAMES","last_name":"VALERIANO","classification":"C","division":"OPEN","hit_factor":5.2308},{"match_name":"MCRC USPSA September 2017","match_date":"2017-09-09","stage_classifiercode":"03-04","member_number":"A8166","first_name":"JIM","last_name":"JOYCE","classification":"M","division":"OPEN","hit_factor":5.2109},{"match_name":"MCPSL Pistol 6-11-16","match_date":"2016-06-11","stage_classifiercode":"03-04","member_number":"TY29453","first_name":"JD","last_name":"SMITH","classification":"M","division":"OPEN","hit_factor":5.2009},{"match_name":"SPSA USPSA October 4th Sat match","match_date":"2016-10-22","stage_classifiercode":"03-04","member_number":"A89491","first_name":"STEVEN","last_name":"COX","classification":"C","division":"OPEN","hit_factor":5.1997},{"match_name":"Idaho ISPS October 7th 2017","match_date":"2017-10-07","stage_classifiercode":"03-04","member_number":"A69178","first_name":"JASON","last_name":"PRICE","classification":"B","division":"OPEN","hit_factor":5.1948},{"match_name":"Jan  28 Classifier Match","match_date":"2018-01-28","stage_classifiercode":"03-04","member_number":"\"\"","first_name":"GREG","last_name":"ALDRIDGE","classification":"\"\"","division":"OPEN","hit_factor":5.1928},{"match_name":"Briar Rabbit May 2016 Match OH20","match_date":"2016-05-22","stage_classifiercode":"03-04","member_number":"TY56088","first_name":"MIKE","last_name":"SCOTT","classification":"C","division":"OPEN","hit_factor":5.1876},{"match_name":"Gem City Gun Club 5-5 and 5-6-18","match_date":"2018-05-05","stage_classifiercode":"03-04","member_number":"A7695","first_name":"ANDREW","last_name":"DIBARTOLOMEO","classification":"C","division":"OPEN","hit_factor":5.18},{"match_name":"PMRPC September 2018 USPSA","match_date":"2018-09-08","stage_classifiercode":"03-04","member_number":"A106202","first_name":"CLAUDIA","last_name":"MCCASKILL","classification":"D","division":"OPEN","hit_factor":5.1765},{"match_name":"Low Country USPSA  March 24th","match_date":"2018-03-24","stage_classifiercode":"03-04","member_number":"A63410","first_name":"EDDIE","last_name":"HUGHES","classification":"B","division":"OPEN","hit_factor":5.1748},{"match_name":"Renton USPSA August 2016 - NW05","match_date":"2016-08-28","stage_classifiercode":"03-04","member_number":"ty86951","first_name":"EMILIO","last_name":"DOMINGO","classification":"B","division":"OPEN","hit_factor":5.1741},{"match_name":"SMPS June 2016","match_date":"2016-06-12","stage_classifiercode":"03-04","member_number":"FY66562","first_name":"JONATHAN","last_name":"MARUCOT","classification":"B","division":"OPEN","hit_factor":5.1738},{"match_name":"NRG April 23 2016","match_date":"2016-04-23","stage_classifiercode":"03-04","member_number":"TY45256","first_name":"GORDON","last_name":"CAMERON","classification":"C","division":"OPEN","hit_factor":5.1696},{"match_name":"Springfield Tactical Shooters 03/05/2020","match_date":"2020-03-05","stage_classifiercode":"03-04","member_number":"\"\"","first_name":"JON","last_name":"PURVIANCE","classification":"\"\"","division":"OPEN","hit_factor":5.1683},{"match_name":"Renton USPSA August 2016 - NW05","match_date":"2016-08-28","stage_classifiercode":"03-04","member_number":"FY22573","first_name":"JAMES","last_name":"DONG","classification":"B","division":"OPEN","hit_factor":5.1619},{"match_name":"Richmond Boro Gun Club December 2018 USPSA Match","match_date":"2018-12-15","stage_classifiercode":"03-04","member_number":"TY103555","first_name":"JOHN","last_name":"FEVELO","classification":"C","division":"OPEN","hit_factor":5.1608},{"match_name":"Springfield Tactical Shooters 03/05/2020","match_date":"2020-03-05","stage_classifiercode":"03-04","member_number":"\"\"","first_name":"JON","last_name":"PURVIANCE","classification":"\"\"","division":"OPEN","hit_factor":5.1584},{"match_name":"Dundee USPSA Feb 2016","match_date":"2016-02-27","stage_classifiercode":"03-04","member_number":"TY13319","first_name":"SHIRLEY","last_name":"ANGELL","classification":"C","division":"OPEN","hit_factor":5.1584},{"match_name":"Colonial Rifle and Pistol Club September 2020","match_date":"2020-09-05","stage_classifiercode":"03-04","member_number":"Ty103555","first_name":"JOHN","last_name":"FEVELO","classification":"C","division":"OPEN","hit_factor":5.1499},{"match_name":"BSTRC May 31 2018","match_date":"2018-05-31","stage_classifiercode":"03-04","member_number":"A96535","first_name":"TREVOR","last_name":"ROBINSON","classification":"U","division":"OPEN","hit_factor":5.1418},{"match_name":"NRG April 23 2016","match_date":"2016-04-23","stage_classifiercode":"03-04","member_number":"A90084","first_name":"JAMES","last_name":"HASHIMOTO","classification":"U","division":"OPEN","hit_factor":5.1347},{"match_name":"Gps   November 2015","match_date":"2015-11-22","stage_classifiercode":"03-04","member_number":"A77597","first_name":"JANICE","last_name":"PACLEB","classification":"B","division":"OPEN","hit_factor":5.1343},{"match_name":"Richmond Hot Shots February 20 and 21 - 2016 USPSA Match","match_date":"2016-02-20","stage_classifiercode":"03-04","member_number":"TY79640","first_name":"ELPIDIO (PETE)","last_name":"CORPUZ","classification":"B","division":"OPEN","hit_factor":5.1308},{"match_name":"G2G September 28th USPSA Match","match_date":"2021-09-28","stage_classifiercode":"03-04","member_number":"1334","first_name":"MARLON","last_name":"PORALAN","classification":"D","division":"OPEN","hit_factor":5.1282},{"match_name":"Colonial Rifle and Pistol Club September 2020","match_date":"2020-09-05","stage_classifiercode":"03-04","member_number":"TY31444","first_name":"JOSE","last_name":"OCAMPO","classification":"B","division":"OPEN","hit_factor":5.1243},{"match_name":"RCSC USPSA 24 July 2016","match_date":"2016-07-24","stage_classifiercode":"03-04","member_number":"A43805","first_name":"ROBERT","last_name":"JIMENEZ","classification":"A","division":"OPEN","hit_factor":5.1222},{"match_name":"Wvpps August 2016","match_date":"2016-08-21","stage_classifiercode":"03-04","member_number":"fy28709","first_name":"GARY","last_name":"CHANEY","classification":"A","division":"OPEN","hit_factor":5.1173},{"match_name":"SCCPSA USPSA SEPTEMBER 15 MATCH","match_date":"2018-09-15","stage_classifiercode":"03-04","member_number":"TY103194","first_name":"KYLE","last_name":"SAMS","classification":"B","division":"OPEN","hit_factor":5.1143},{"match_name":"PCSI USPSA 2018   April Classifier Match 2","match_date":"2018-04-07","stage_classifiercode":"03-04","member_number":"A100958","first_name":"TYLER","last_name":"TALMADGE","classification":"U","division":"OPEN","hit_factor":5.1053},{"match_name":"Colonial Rifle and Pistol Club September 2020","match_date":"2020-09-05","stage_classifiercode":"03-04","member_number":"ty123181","first_name":"JUN","last_name":"DE ASIS","classification":"C","division":"OPEN","hit_factor":5.0938},{"match_name":"SMPS June 2016","match_date":"2016-06-12","stage_classifiercode":"03-04","member_number":"L4026","first_name":"CHRIS","last_name":"JACKSON","classification":"U","division":"OPEN","hit_factor":5.0865},{"match_name":"LGRPC Oct  2016","match_date":"2016-10-09","stage_classifiercode":"03-04","member_number":"TY42863","first_name":"MIKE","last_name":"MCARTY","classification":"B","division":"OPEN","hit_factor":5.083},{"match_name":"G2G September 28th USPSA Match","match_date":"2021-09-28","stage_classifiercode":"03-04","member_number":"TY131774","first_name":"DON","last_name":"MILLER","classification":"C","division":"OPEN","hit_factor":5.0715},{"match_name":"Gem City Gun Club 5-5 and 5-6-18","match_date":"2018-05-05","stage_classifiercode":"03-04","member_number":"A92216","first_name":"BENJAMIN","last_name":"BABCOCK","classification":"U","division":"OPEN","hit_factor":5.0524},{"match_name":"AVAP CLASSIFIER 71418","match_date":"2018-07-14","stage_classifiercode":"03-04","member_number":"TY 94643","first_name":"CARLSON","last_name":"SETO","classification":"D","division":"OPEN","hit_factor":5.0475},{"match_name":"Jan  28 Classifier Match","match_date":"2018-01-28","stage_classifiercode":"03-04","member_number":"A103088","first_name":"TROY","last_name":"JOHNSON","classification":"C","division":"OPEN","hit_factor":5.0473},{"match_name":"Dundee USPSA Feb 2016","match_date":"2016-02-27","stage_classifiercode":"03-04","member_number":"TY7127","first_name":"TOM","last_name":"ANGELL","classification":"B","division":"OPEN","hit_factor":5.0459},{"match_name":"Pinetucky USPSA 03-18-17","match_date":"2017-03-18","stage_classifiercode":"03-04","member_number":"L3945","first_name":"ERIC","last_name":"HAGAN","classification":"C","division":"OPEN","hit_factor":5.0445},{"match_name":"MCPSL Pistol 6-13-20","match_date":"2020-06-13","stage_classifiercode":"03-04","member_number":"TY78821","first_name":"STEVE","last_name":"GIRARD","classification":"C","division":"OPEN","hit_factor":5.0445},{"match_name":"Gem City Gun Club 5-5 and 5-6-18","match_date":"2018-05-05","stage_classifiercode":"03-04","member_number":"A108817","first_name":"AARON","last_name":"JOHNSON","classification":"U","division":"OPEN","hit_factor":5.0373},{"match_name":"MRPC OHS02 092720","match_date":"2020-09-27","stage_classifiercode":"03-04","member_number":"L3632","first_name":"JOHN","last_name":"GOSS","classification":"B","division":"OPEN","hit_factor":5.0296},{"match_name":"Custer USPSA May","match_date":"2018-05-06","stage_classifiercode":"03-04","member_number":"A42864","first_name":"NICK","last_name":"MINZGHOR","classification":"A","division":"OPEN","hit_factor":5.0223},{"match_name":"May 8 2021 The Range At True North USPSA Match","match_date":"2021-05-08","stage_classifiercode":"03-04","member_number":"A116868","first_name":"MICHAEL","last_name":"MADUSKE","classification":"U","division":"OPEN","hit_factor":5.0205},{"match_name":"CGGR  APRIL USPSA MATCH","match_date":"2018-04-20","stage_classifiercode":"03-04","member_number":"TY99801","first_name":"GREG","last_name":"MANNY","classification":"C","division":"OPEN","hit_factor":5.0196},{"match_name":"RMAP 3rd Sunday Marh 2016","match_date":"2016-03-20","stage_classifiercode":"03-04","member_number":"FY35146","first_name":"RAY","last_name":"SOLOMON","classification":"M","division":"OPEN","hit_factor":5.0117},{"match_name":"ECPS USPSA 17 Dec 16","match_date":"2016-12-17","stage_classifiercode":"03-04","member_number":"A95504","first_name":"TANNER","last_name":"CARROLL","classification":"C","division":"OPEN","hit_factor":5.0116},{"match_name":"DSC August 2016","match_date":"2016-08-21","stage_classifiercode":"03-04","member_number":"A22668","first_name":"BILL","last_name":"CHUNN","classification":"B","division":"OPEN","hit_factor":5.0111},{"match_name":"HPPS 2-18-2017","match_date":"2017-02-16","stage_classifiercode":"03-04","member_number":"L2744","first_name":"RICK","last_name":"BITTLE","classification":"B","division":"OPEN","hit_factor":5},{"match_name":"CCAS December 2018 Special Classifier","match_date":"2018-12-15","stage_classifiercode":"03-04","member_number":"A73178","first_name":"JOE","last_name":"WILLIS","classification":"A","division":"OPEN","hit_factor":5},{"match_name":"JCSSA NOV 6 2021","match_date":"2021-11-06","stage_classifiercode":"03-04","member_number":"Ty36494","first_name":"ROBERT","last_name":"PORTER","classification":"B","division":"OPEN","hit_factor":4.9959},{"match_name":"MS06 Team Magnolia USPSA October Match","match_date":"2015-10-04","stage_classifiercode":"03-04","member_number":"A85357","first_name":"DRAKE","last_name":"BAYLES","classification":"U","division":"OPEN","hit_factor":4.9957},{"match_name":"MCAS USPSA October 2016","match_date":"2016-10-15","stage_classifiercode":"03-04","member_number":"FL3702","first_name":"WALTER","last_name":"HORNBY","classification":"C","division":"OPEN","hit_factor":4.9877},{"match_name":"MS06 Team Magnolia USPSA October Match","match_date":"2015-10-04","stage_classifiercode":"03-04","member_number":"A65599","first_name":"GALE","last_name":"BUTLER","classification":"B","division":"OPEN","hit_factor":4.9808},{"match_name":"Benton Gun Club-USPSA May27 2018 CLASIFIER","match_date":"2018-05-27","stage_classifiercode":"03-04","member_number":"A96123","first_name":"BRANDON","last_name":"GREEN","classification":"U","division":"OPEN","hit_factor":4.9787},{"match_name":"CAS classifier match","match_date":"2021-08-01","stage_classifiercode":"03-04","member_number":"L4979","first_name":"CHRIS","last_name":"SAWLSVILLE","classification":"B","division":"OPEN","hit_factor":4.9732},{"match_name":"-Triforce Practical Shooters at BigWoodsGoods 11-1-18","match_date":"2018-11-01","stage_classifiercode":"03-04","member_number":"A80964","first_name":"MICHAEL","last_name":"DUPUIS","classification":"C","division":"OPEN","hit_factor":4.9612},{"match_name":"Briar Rabbit May 2016 Match OH20","match_date":"2016-05-22","stage_classifiercode":"03-04","member_number":"A84904","first_name":"CHUCK","last_name":"RUCKER","classification":"\"\"","division":"OPEN","hit_factor":4.9601},{"match_name":"Custer USPSA May","match_date":"2018-05-06","stage_classifiercode":"03-04","member_number":"A68387","first_name":"JOHN","last_name":"WILEY","classification":"A","division":"OPEN","hit_factor":4.9559},{"match_name":"Hopkinton August 2017","match_date":"2017-08-05","stage_classifiercode":"03-04","member_number":"TY83661","first_name":"BOB","last_name":"YOUNG","classification":"\"\"","division":"OPEN","hit_factor":4.9533},{"match_name":"Renton USPSA August 2016 - NW05","match_date":"2016-08-28","stage_classifiercode":"03-04","member_number":"A61323","first_name":"EDWARD","last_name":"GALINO","classification":"C","division":"OPEN","hit_factor":4.9498},{"match_name":"FVPS July Point Series Match","match_date":"2017-07-01","stage_classifiercode":"03-04","member_number":"FY29442","first_name":"ROB","last_name":"KALISHEK","classification":"A","division":"OPEN","hit_factor":4.9491},{"match_name":"CIPSC IL02 Havana June USPSA","match_date":"2021-06-12","stage_classifiercode":"03-04","member_number":"A83660","first_name":"MATT","last_name":"LEE","classification":"B","division":"OPEN","hit_factor":4.9398},{"match_name":"ORSA USPSA January 2016","match_date":"2016-01-16","stage_classifiercode":"03-04","member_number":"a85866","first_name":"DAN","last_name":"OLIVER","classification":"D","division":"OPEN","hit_factor":4.9383},{"match_name":"Pinetucky USPSA 03-18-17","match_date":"2017-03-18","stage_classifiercode":"03-04","member_number":"TY67776","first_name":"NICK","last_name":"ORTALAZA","classification":"B","division":"OPEN","hit_factor":4.9369},{"match_name":"BRSP Tuesday Night USPSA Match - May 29","match_date":"2018-05-30","stage_classifiercode":"03-04","member_number":"\"\"","first_name":"GREG","last_name":"SWANSON","classification":"\"\"","division":"OPEN","hit_factor":4.9367},{"match_name":"MRPC OHS02 72218","match_date":"2018-07-22","stage_classifiercode":"03-04","member_number":"L3632","first_name":"JOHN","last_name":"GOSS","classification":"B","division":"OPEN","hit_factor":4.9342},{"match_name":"WTPS USPSA October Match 10-8-16","match_date":"2016-10-08","stage_classifiercode":"03-04","member_number":"TY57268","first_name":"PHILLIP","last_name":"TAPPE","classification":"A","division":"OPEN","hit_factor":4.9288},{"match_name":"Pathfinder July 2021 USPSA","match_date":"2021-07-18","stage_classifiercode":"03-04","member_number":"A72840","first_name":"DAVID","last_name":"VANSANFORD","classification":"C","division":"OPEN","hit_factor":4.9254},{"match_name":"PCSI USPSA 2018   April Classifier Match 2","match_date":"2018-04-07","stage_classifiercode":"03-04","member_number":"TY101519","first_name":"JOSHUA","last_name":"HOY","classification":"C","division":"OPEN","hit_factor":4.9035},{"match_name":"Homestead USPSA July Match","match_date":"2018-07-07","stage_classifiercode":"03-04","member_number":"TY45606","first_name":"LESGAR","last_name":"MURDOCK","classification":"GM","division":"OPEN","hit_factor":4.9007},{"match_name":"Richmond Boro Gun Club December 2018 USPSA Match","match_date":"2018-12-15","stage_classifiercode":"03-04","member_number":"TY82663","first_name":"KEVIN","last_name":"O'BRIEN","classification":"B","division":"OPEN","hit_factor":4.8951},{"match_name":"DSC August 2016","match_date":"2016-08-21","stage_classifiercode":"03-04","member_number":"TY80894","first_name":"VINCE","last_name":"PALAZZOLO","classification":"C","division":"OPEN","hit_factor":4.8901},{"match_name":"Richmond Boro Gun Club December 2018 USPSA Match","match_date":"2018-12-15","stage_classifiercode":"03-04","member_number":"A100045","first_name":"KYLE","last_name":"KIM","classification":"U","division":"OPEN","hit_factor":4.89},{"match_name":"WSPS NOVEMBER 2020 USPSA PROTEST","match_date":"2020-11-21","stage_classifiercode":"03-04","member_number":"A94749","first_name":"JOHN","last_name":"BURCH","classification":"B","division":"OPEN","hit_factor":4.89},{"match_name":"May 8 2021 The Range At True North USPSA Match","match_date":"2021-05-08","stage_classifiercode":"03-04","member_number":"A107525","first_name":"BRIAN","last_name":"HONEYCUTT","classification":"D","division":"OPEN","hit_factor":4.8876},{"match_name":"PMRPC September 2018 USPSA","match_date":"2018-09-08","stage_classifiercode":"03-04","member_number":"ty51017","first_name":"BILL","last_name":"HENLEY","classification":"B","division":"OPEN","hit_factor":4.8837},{"match_name":"SSS USPSA March 2020 - All Classifier","match_date":"2020-03-22","stage_classifiercode":"03-04","member_number":"A115803","first_name":"MATTHEW","last_name":"STUGART","classification":"C (C Class)","division":"OPEN","hit_factor":4.8726},{"match_name":"Richmond Boro Gun Club March 2017 USPSA Pistol Match","match_date":"2017-03-25","stage_classifiercode":"03-04","member_number":"TY92927","first_name":"ANTHONY","last_name":"MAINOLFI","classification":"B","division":"OPEN","hit_factor":4.8686},{"match_name":"NRG April 23 2016","match_date":"2016-04-23","stage_classifiercode":"03-04","member_number":"\"\"","first_name":"TIM","last_name":"MOROSCO2","classification":"B","division":"OPEN","hit_factor":4.8626},{"match_name":"WGC WI USPSA Monthly Match 5-19-18","match_date":"2018-05-19","stage_classifiercode":"03-04","member_number":"L4071","first_name":"RAY","last_name":"FEGER","classification":"C","division":"OPEN","hit_factor":4.8435},{"match_name":"Custer USPSA Mar 7th 2021","match_date":"2021-03-07","stage_classifiercode":"03-04","member_number":"FY103459","first_name":"MELISSA","last_name":"WILSON","classification":"D","division":"OPEN","hit_factor":4.8399},{"match_name":"Low Country USPSA  March 24th","match_date":"2018-03-24","stage_classifiercode":"03-04","member_number":"A80405","first_name":"LINDA","last_name":"DISCHE","classification":"C","division":"OPEN","hit_factor":4.8203},{"match_name":"MPSA USPSA 021718","match_date":"2018-02-17","stage_classifiercode":"03-04","member_number":"a42317","first_name":"RANDY","last_name":"MCDILL","classification":"X","division":"OPEN","hit_factor":4.8202},{"match_name":"FVPS November USPSA Match","match_date":"2018-11-03","stage_classifiercode":"03-04","member_number":"TY54308","first_name":"GLEN","last_name":"BICKING","classification":"B","division":"OPEN","hit_factor":4.8193},{"match_name":"LGRPC Oct  2016","match_date":"2016-10-09","stage_classifiercode":"03-04","member_number":"TY70904","first_name":"MIKE","last_name":"GIMERA","classification":"C","division":"OPEN","hit_factor":4.811},{"match_name":"WVPPS September 2018","match_date":"2018-09-16","stage_classifiercode":"03-04","member_number":"L2755","first_name":"LINCOLN","last_name":"CARR","classification":"A","division":"OPEN","hit_factor":4.8062},{"match_name":"CIPSC Havana May USPSA","match_date":"2018-05-12","stage_classifiercode":"03-04","member_number":"A83660","first_name":"MATT","last_name":"LEE","classification":"C","division":"OPEN","hit_factor":4.8039215686275},{"match_name":"SPSA USPSA December 4th Sat match","match_date":"2018-12-22","stage_classifiercode":"03-04","member_number":"L1700","first_name":"ROBERT","last_name":"WRIGHT","classification":"M","division":"OPEN","hit_factor":4.7847},{"match_name":"RMAP 3rd Sunday Marh 2016","match_date":"2016-03-20","stage_classifiercode":"03-04","member_number":"TY6397","first_name":"TONY","last_name":"BARONE","classification":"M","division":"OPEN","hit_factor":4.7805},{"match_name":"G2G September 28th USPSA Match","match_date":"2021-09-28","stage_classifiercode":"03-04","member_number":"Ty134553","first_name":"MARK","last_name":"HOPMANN","classification":"C","division":"OPEN","hit_factor":4.7749},{"match_name":"Minnetonka game and fish June 30","match_date":"2021-06-30","stage_classifiercode":"03-04","member_number":"TY59462","first_name":"RICHARD","last_name":"KAVANAGH","classification":"U","division":"OPEN","hit_factor":4.7677},{"match_name":"Pelham USPSA 2018-08-19","match_date":"2018-08-19","stage_classifiercode":"03-04","member_number":"TY49725","first_name":"DANIEL","last_name":"GRECOE","classification":"C","division":"OPEN","hit_factor":4.7619},{"match_name":"LTD Pistol - August 2018","match_date":"2018-08-04","stage_classifiercode":"03-04","member_number":"TY74321","first_name":"STEPHEN","last_name":"PRICE","classification":"B","division":"OPEN","hit_factor":4.7619},{"match_name":"Gem City Gun Club 5-5 and 5-6-18","match_date":"2018-05-05","stage_classifiercode":"03-04","member_number":"A108817","first_name":"AARON","last_name":"JOHNSON","classification":"U","division":"OPEN","hit_factor":4.7554},{"match_name":"Prescott 1st Saturday 3-04-2017","match_date":"2017-03-04","stage_classifiercode":"03-04","member_number":"TAY52269","first_name":"STEVE","last_name":"KEENER","classification":"B","division":"OPEN","hit_factor":4.7458},{"match_name":"G2G Practical Shooters 04-17-2018","match_date":"2018-04-17","stage_classifiercode":"03-04","member_number":"FY103687","first_name":"STEVE","last_name":"KEMPE","classification":"U","division":"OPEN","hit_factor":4.7453},{"match_name":"DGC USPSA 05-13-18","match_date":"2018-05-13","stage_classifiercode":"03-04","member_number":"FY15086","first_name":"JAMIE","last_name":"CRAIG","classification":"GM","division":"OPEN","hit_factor":4.7368},{"match_name":"SMPS March 2018","match_date":"2018-03-11","stage_classifiercode":"03-04","member_number":"A105990","first_name":"TIM","last_name":"STEDMAN","classification":"U","division":"OPEN","hit_factor":4.7337},{"match_name":"ORSA USPSA February 2020 ","match_date":"2020-02-15","stage_classifiercode":"03-04","member_number":"A119853","first_name":"HOLLY","last_name":"TOMPKINS","classification":"U","division":"OPEN","hit_factor":4.7319},{"match_name":"LIPSA - April 29th 2018 - USPSA Special Classifier Match","match_date":"2018-04-29","stage_classifiercode":"03-04","member_number":"TY85379","first_name":"JOE","last_name":"TOLENO","classification":"A","division":"OPEN","hit_factor":4.7226},{"match_name":"Richmond Boro Gun Club June 2018 USPSA  Match","match_date":"2018-06-23","stage_classifiercode":"03-04","member_number":"TY103555","first_name":"JOHN","last_name":"FEVELO","classification":"C","division":"OPEN","hit_factor":4.7222},{"match_name":"Dundee USPSA Feb 2016","match_date":"2016-02-27","stage_classifiercode":"03-04","member_number":"\"\"","first_name":"SHAWN","last_name":"DUNIGAN","classification":"U","division":"OPEN","hit_factor":4.7075},{"match_name":"SAPSC Monthly USPSA Classifier Match 20151110","match_date":"2015-11-11","stage_classifiercode":"03-04","member_number":"TY87266","first_name":"KYLE","last_name":"MAPP","classification":"U","division":"OPEN","hit_factor":4.7047},{"match_name":"MvpFeb2016","match_date":"2016-02-06","stage_classifiercode":"03-04","member_number":"TY61480","first_name":"STEVE","last_name":"SELIGMAN","classification":"B","division":"OPEN","hit_factor":4.6948},{"match_name":"WVPPS Feb. 2018","match_date":"2018-02-25","stage_classifiercode":"03-04","member_number":"FY72183","first_name":"JANICE","last_name":"POWER-WRIGHT","classification":"C","division":"OPEN","hit_factor":4.6929},{"match_name":"WPS USPSA Monthly Match October 2016","match_date":"2016-10-22","stage_classifiercode":"03-04","member_number":"TY52466","first_name":"TODD","last_name":"MILLS","classification":"U","division":"OPEN","hit_factor":4.6892},{"match_name":"Richmond Boro Gun Club December 2018 USPSA Match","match_date":"2018-12-15","stage_classifiercode":"03-04","member_number":"FY92775","first_name":"CLIFFORD","last_name":"AVERSANO SR.","classification":"D","division":"OPEN","hit_factor":4.683},{"match_name":"RCSC USPSA 24 July 2016","match_date":"2016-07-24","stage_classifiercode":"03-04","member_number":"A67581","first_name":"ROBERT","last_name":"BOYD","classification":"C","division":"OPEN","hit_factor":4.6628},{"match_name":"Hosemonster Action  ","match_date":"2021-05-16","stage_classifiercode":"03-04","member_number":"A61463","first_name":"DAVID","last_name":"HILLERMAN","classification":"B","division":"OPEN","hit_factor":4.6351},{"match_name":"Idaho ISPS August 4th 2018","match_date":"2018-08-04","stage_classifiercode":"03-04","member_number":"A80359","first_name":"JD","last_name":"MCCORD","classification":"C","division":"OPEN","hit_factor":4.6322},{"match_name":"BHPSC Classifer Match 5-26-2017","match_date":"2017-05-26","stage_classifiercode":"03-04","member_number":"L1870","first_name":"LES","last_name":"COX","classification":"M","division":"OPEN","hit_factor":4.6318},{"match_name":"IN18 SCGC USPSA 06 June 2021","match_date":"2021-06-06","stage_classifiercode":"03-04","member_number":"Fy48388","first_name":"SUE","last_name":"VANBLARICUM","classification":"B","division":"OPEN","hit_factor":4.6316},{"match_name":"CCAS December 2018 Special Classifier","match_date":"2018-12-15","stage_classifiercode":"03-04","member_number":"TY92650","first_name":"THOMAS","last_name":"GILES","classification":"B","division":"OPEN","hit_factor":4.6218},{"match_name":"MCPSL Pistol 12-9-17","match_date":"2017-12-09","stage_classifiercode":"03-04","member_number":"TY43257","first_name":"FRED","last_name":"NOBLE","classification":"C","division":"OPEN","hit_factor":4.6154},{"match_name":"SPSA USPSA June 1st Sat Match","match_date":"2018-06-02","stage_classifiercode":"03-04","member_number":"L4170","first_name":"STEVE","last_name":"COX","classification":"C","division":"OPEN","hit_factor":4.6076},{"match_name":"Cactus USPSA February 2021","match_date":"2021-02-07","stage_classifiercode":"03-04","member_number":"Ty28855","first_name":"PHILLIP","last_name":"GALLEGOS","classification":"A","division":"OPEN","hit_factor":4.6073},{"match_name":"EAPS February 2018 USPSA","match_date":"2018-02-18","stage_classifiercode":"03-04","member_number":"A93349","first_name":"JONATHAN","last_name":"PARKER","classification":"U","division":"OPEN","hit_factor":4.607},{"match_name":"July USPSA","match_date":"2021-07-25","stage_classifiercode":"03-04","member_number":"TY2958","first_name":"PETE","last_name":"CARPENTIER JR","classification":"A","division":"OPEN","hit_factor":4.6034},{"match_name":"WSPS NOVEMBER 2020 USPSA PROTEST","match_date":"2020-11-21","stage_classifiercode":"03-04","member_number":"A123368","first_name":"SETH","last_name":"EVERHART","classification":"U","division":"OPEN","hit_factor":4.6012},{"match_name":"GAS Special Classifier","match_date":"2016-07-02","stage_classifiercode":"03-04","member_number":"FY65812","first_name":"TAMI","last_name":"WAITE","classification":"U","division":"OPEN","hit_factor":4.6009},{"match_name":"MPSA USPSA 021718","match_date":"2018-02-17","stage_classifiercode":"03-04","member_number":"A21224","first_name":"LOREN","last_name":"BAKER","classification":"D","division":"OPEN","hit_factor":4.596},{"match_name":"ACPSA January 2017","match_date":"2017-01-28","stage_classifiercode":"03-04","member_number":"TY73281","first_name":"JACK","last_name":"DARTIGALONGUE","classification":"C","division":"OPEN","hit_factor":4.5734},{"match_name":"Renton USPSA August 2016 - NW05","match_date":"2016-08-28","stage_classifiercode":"03-04","member_number":"A83018","first_name":"RAE ARSEN","last_name":"BALEROS","classification":"B","division":"OPEN","hit_factor":4.5587},{"match_name":"Springfield Tactical Shooters 03/05/2020","match_date":"2020-03-05","stage_classifiercode":"03-04","member_number":"\"\"","first_name":"JACOB","last_name":"DISTLEHORST","classification":"\"\"","division":"OPEN","hit_factor":4.5586},{"match_name":"NRG April 23 2016","match_date":"2016-04-23","stage_classifiercode":"03-04","member_number":"L3822","first_name":"LEO","last_name":"SOLOVEICHIK","classification":"B","division":"OPEN","hit_factor":4.5515},{"match_name":"Richmond Boro Gun Club September 2020 USPSA Match","match_date":"2020-09-12","stage_classifiercode":"03-04","member_number":"FY92927","first_name":"ANTHONY","last_name":"MAINOLFI","classification":"B","division":"OPEN","hit_factor":4.5503},{"match_name":"Pioneer Action Shooters USPSA 5-23-21 Special Classifer","match_date":"2021-05-23","stage_classifiercode":"03-04","member_number":"A70161","first_name":"ROGER","last_name":"BINKERD","classification":"C","division":"OPEN","hit_factor":4.5486},{"match_name":"Gem City Gun Club 5-5 and 5-6-18","match_date":"2018-05-05","stage_classifiercode":"03-04","member_number":"A97294","first_name":"EDWARD","last_name":"WAGNER","classification":"U","division":"OPEN","hit_factor":4.5385},{"match_name":"Gem City Gun Club 5-5 and 5-6-18","match_date":"2018-05-05","stage_classifiercode":"03-04","member_number":"A85868","first_name":"SHELDON","last_name":"KATZ","classification":"D","division":"OPEN","hit_factor":4.5307},{"match_name":"RMAP 3rd Sunday Marh 2016","match_date":"2016-03-20","stage_classifiercode":"03-04","member_number":"TY58233","first_name":"AL","last_name":"BARR","classification":"C","division":"OPEN","hit_factor":4.5208},{"match_name":"Lefthanders Gun Club Practical Shooters September 2 and 3","match_date":"2017-09-02","stage_classifiercode":"03-04","member_number":"TY24585","first_name":"DON","last_name":"STEELE","classification":"B","division":"OPEN","hit_factor":4.5198},{"match_name":"Briar Rabbit May 2016 Match OH20","match_date":"2016-05-22","stage_classifiercode":"03-04","member_number":"TY66305","first_name":"HERB","last_name":"SMITH","classification":"B","division":"OPEN","hit_factor":4.5093},{"match_name":"NPCCC November USPSA","match_date":"2015-11-01","stage_classifiercode":"03-04","member_number":"\"\"","first_name":"JOHN","last_name":"ORNELAS","classification":"none","division":"OPEN","hit_factor":4.5026},{"match_name":"FVPS July Point Series Match","match_date":"2017-07-01","stage_classifiercode":"03-04","member_number":"A99422","first_name":"CORY","last_name":"TUCHSCHERER","classification":"C","division":"OPEN","hit_factor":4.5},{"match_name":"MCPSL Pistol 6-11-16","match_date":"2016-06-11","stage_classifiercode":"03-04","member_number":"FY72619","first_name":"JIM","last_name":"THOMAS","classification":"D","division":"OPEN","hit_factor":4.4786},{"match_name":"Laser Ninja Dragon League USPSA September 2017 fixed","match_date":"2017-09-03","stage_classifiercode":"03-04","member_number":"Ty21646","first_name":"JAMES","last_name":"JONES","classification":"B","division":"OPEN","hit_factor":4.4704},{"match_name":"Lefthanders Gun Club Practical Shooters September 2 and 3","match_date":"2017-09-02","stage_classifiercode":"03-04","member_number":"TY72670","first_name":"DALE","last_name":"HARDING","classification":"C","division":"OPEN","hit_factor":4.4687},{"match_name":"Cactus USPSA February 2021","match_date":"2021-02-07","stage_classifiercode":"03-04","member_number":"A100726","first_name":"DOMINIC","last_name":"NAPOLITANO","classification":"B","division":"OPEN","hit_factor":4.4674},{"match_name":"Pinetucky USPSA 03-18-17","match_date":"2017-03-18","stage_classifiercode":"03-04","member_number":"TY100721","first_name":"JOHN","last_name":"BUCKLEY","classification":"U","division":"OPEN","hit_factor":4.461},{"match_name":"Whitewater USPSA 2-20-16","match_date":"2016-02-17","stage_classifiercode":"03-04","member_number":"A85301","first_name":"MATT","last_name":"PHILLIPS","classification":"U","division":"OPEN","hit_factor":4.4487},{"match_name":"Lefthanders Gun Club Practical Shooters September 2 and 3","match_date":"2017-09-02","stage_classifiercode":"03-04","member_number":"PEN","first_name":"LUCIAN","last_name":"NORTON","classification":"U","division":"OPEN","hit_factor":4.4444},{"match_name":"LCSC USPSA   8-13-17","match_date":"2017-08-08","stage_classifiercode":"03-04","member_number":"fy84555","first_name":"RON","last_name":"DEL MAR","classification":"C","division":"OPEN","hit_factor":4.4384},{"match_name":"ISPS 4/17/2016 USPSA","match_date":"2016-04-17","stage_classifiercode":"03-04","member_number":"TY30712","first_name":"DENNIS","last_name":"WILSON","classification":"B","division":"OPEN","hit_factor":4.4349},{"match_name":"Wvpps August 2016","match_date":"2016-08-21","stage_classifiercode":"03-04","member_number":"ty69656","first_name":"JEFF","last_name":"STRAUCH","classification":"C","division":"OPEN","hit_factor":4.4235},{"match_name":"SCCPSA USPSA Jul 17 2021","match_date":"2021-07-17","stage_classifiercode":"03-04","member_number":"TY22346","first_name":"BUCKY","last_name":"POLLARD","classification":"M","division":"OPEN","hit_factor":4.4193},{"match_name":"WSPS NOVEMBER 2020 USPSA PROTEST","match_date":"2020-11-21","stage_classifiercode":"03-04","member_number":"ty101519","first_name":"JOSHUA","last_name":"HOY","classification":"B","division":"OPEN","hit_factor":4.4177},{"match_name":"G2G Practical Shooters 12-18-2018","match_date":"2018-12-18","stage_classifiercode":"03-04","member_number":"A21017","first_name":"DAVID","last_name":"KONG","classification":"C","division":"OPEN","hit_factor":4.416},{"match_name":"Wvpps August 2016","match_date":"2016-08-21","stage_classifiercode":"03-04","member_number":"ty91334","first_name":"BILL","last_name":"SIDELL","classification":"C","division":"OPEN","hit_factor":4.415},{"match_name":"Dundee USPSA Feb 2016","match_date":"2016-02-27","stage_classifiercode":"03-04","member_number":"FY58474","first_name":"JAN","last_name":"MCDONALD","classification":"C","division":"OPEN","hit_factor":4.4065},{"match_name":"WGC WI USPSA Monthly Match 5-19-18","match_date":"2018-05-19","stage_classifiercode":"03-04","member_number":"FY53791","first_name":"MICHAEL","last_name":"OLSON","classification":"B","division":"OPEN","hit_factor":4.3876},{"match_name":"WGC WI USPSA Monthly Match 5-19-18","match_date":"2018-05-19","stage_classifiercode":"03-04","member_number":"TY78531","first_name":"ROBERT","last_name":"DEFEVER","classification":"C","division":"OPEN","hit_factor":4.3712},{"match_name":"ECPS USPSA 17 Dec 16","match_date":"2016-12-17","stage_classifiercode":"03-04","member_number":"A94653","first_name":"SHAWN","last_name":"REISS","classification":"C","division":"OPEN","hit_factor":4.3712},{"match_name":"TPS USPSA at CMP March 17 2018","match_date":"2018-03-17","stage_classifiercode":"03-04","member_number":"TY93235","first_name":"JENNIFER","last_name":"PETTY","classification":"B","division":"OPEN","hit_factor":4.3663},{"match_name":"WGC WI USPSA Monthly Match 5-19-18","match_date":"2018-05-19","stage_classifiercode":"03-04","member_number":"\"\"","first_name":"PIERRE","last_name":"MUNSON","classification":"B","division":"OPEN","hit_factor":4.3587},{"match_name":"Gem City Gun Club 5-5 and 5-6-18","match_date":"2018-05-05","stage_classifiercode":"03-04","member_number":"A102572","first_name":"DAVE","last_name":"WILDE","classification":"B","division":"OPEN","hit_factor":4.3575},{"match_name":"HPPS 10-16-2021","match_date":"2021-10-16","stage_classifiercode":"03-04","member_number":"TY92674","first_name":"BEN","last_name":"TARVER","classification":"A","division":"OPEN","hit_factor":4.3539},{"match_name":"SPSA USPSA October 4th Sat match","match_date":"2016-10-22","stage_classifiercode":"03-04","member_number":"A86799","first_name":"BILL","last_name":"ROACH","classification":"C","division":"OPEN","hit_factor":4.3478},{"match_name":"DSC August 2016","match_date":"2016-08-21","stage_classifiercode":"03-04","member_number":"TY88205","first_name":"WARD","last_name":"MILLER","classification":"C","division":"OPEN","hit_factor":4.3381},{"match_name":"CCPL 10112015","match_date":"2015-10-11","stage_classifiercode":"03-04","member_number":"A72602","first_name":"STEVE","last_name":"MURRAY","classification":"C","division":"OPEN","hit_factor":4.3367},{"match_name":"Richmond Boro Gun Club September 2020 USPSA Match","match_date":"2020-09-12","stage_classifiercode":"03-04","member_number":"FY92775","first_name":"CLIFFORD","last_name":"AVERSANO","classification":"C","division":"OPEN","hit_factor":4.336},{"match_name":"SAPS Match 2/1/2020","match_date":"2020-02-01","stage_classifiercode":"03-04","member_number":"A105584","first_name":"RON","last_name":"SMITH","classification":"U","division":"OPEN","hit_factor":4.3177},{"match_name":"MS06 Team Magnolia USPSA October Match","match_date":"2015-10-04","stage_classifiercode":"03-04","member_number":"A72671","first_name":"JIMMY","last_name":"WILKINSON SR","classification":"C","division":"OPEN","hit_factor":4.3152},{"match_name":"MRPC OHS02 72218","match_date":"2018-07-22","stage_classifiercode":"03-04","member_number":"L3088","first_name":"RALPH M.","last_name":"LOPEZ","classification":"A","division":"OPEN","hit_factor":4.3134},{"match_name":"WTPS USPSA October Match 10-8-16","match_date":"2016-10-08","stage_classifiercode":"03-04","member_number":"A95627","first_name":"RYNN","last_name":"SMITH","classification":"U","division":"OPEN","hit_factor":4.3125},{"match_name":"Custer USPSA Mar 7th 2021","match_date":"2021-03-07","stage_classifiercode":"03-04","member_number":"TY14867","first_name":"RANDALL","last_name":"HESS","classification":"U","division":"OPEN","hit_factor":4.3123},{"match_name":"SLOSA FEBRUARY 2020 USPSA MATCH","match_date":"2020-02-08","stage_classifiercode":"03-04","member_number":"TY121213","first_name":"LUCA","last_name":"BENEDETTI","classification":"U","division":"OPEN","hit_factor":4.3},{"match_name":"Gem City Gun Club 8-5 and 6th 2017","match_date":"2017-08-05","stage_classifiercode":"03-04","member_number":"A7695","first_name":"ANDREW","last_name":"DIBARTOLOMEO","classification":"C","division":"OPEN","hit_factor":4.2895},{"match_name":"PMRPC September 2018 USPSA","match_date":"2018-09-08","stage_classifiercode":"03-04","member_number":"A83715","first_name":"STEPHEN","last_name":"THOMAS","classification":"U","division":"OPEN","hit_factor":4.2831},{"match_name":"EIPS Classifier Match 3/18/18","match_date":"2018-03-18","stage_classifiercode":"03-04","member_number":"A101705","first_name":"JOHN","last_name":"RIGGS","classification":"D","division":"OPEN","hit_factor":4.2678},{"match_name":"FVPS November USPSA Match","match_date":"2018-11-03","stage_classifiercode":"03-04","member_number":"FY53791","first_name":"MICHAEL","last_name":"OLSON","classification":"B","division":"OPEN","hit_factor":4.2672},{"match_name":"WHPS May Tactical Rifle Match","match_date":"2018-05-20","stage_classifiercode":"03-04","member_number":"A91043","first_name":"DAVID","last_name":"MURPHY","classification":"U","division":"OPEN","hit_factor":4.2607},{"match_name":"Cactus USPSA February 2021","match_date":"2021-02-07","stage_classifiercode":"03-04","member_number":"A104053","first_name":"RAYMOND","last_name":"GALLEGOS","classification":"B","division":"OPEN","hit_factor":4.2514},{"match_name":"MCRC USPSA March 2020","match_date":"2020-03-14","stage_classifiercode":"03-04","member_number":"TY94159","first_name":"LINDEN","last_name":"BURNSTEIN","classification":"C","division":"OPEN","hit_factor":4.2488},{"match_name":"Richmond Hot Shots February 20 and 21 - 2016 USPSA Match","match_date":"2016-02-20","stage_classifiercode":"03-04","member_number":"A16297","first_name":"BERNARD","last_name":"VELASCO","classification":"C","division":"OPEN","hit_factor":4.2461},{"match_name":"SAPSC Monthly USPSA Classifier Match at Autreys Armory 20180612","match_date":"2018-06-12","stage_classifiercode":"03-04","member_number":"A101980","first_name":"KAYLA","last_name":"WILCOX","classification":"U","division":"OPEN","hit_factor":4.2401},{"match_name":"Prescott 1st Saturday 3-04-2017","match_date":"2017-03-04","stage_classifiercode":"03-04","member_number":"TY2268","first_name":"DEBBIE","last_name":"KEENER","classification":"C","division":"OPEN","hit_factor":4.2389},{"match_name":"DGC USPSA 05-13-18","match_date":"2018-05-13","stage_classifiercode":"03-04","member_number":"A81428","first_name":"TY","last_name":"COBB","classification":"M","division":"OPEN","hit_factor":4.2328},{"match_name":"FVPS November USPSA Match","match_date":"2018-11-03","stage_classifiercode":"03-04","member_number":"A20556","first_name":"DON","last_name":"ZIMMERMSN","classification":"B","division":"OPEN","hit_factor":4.2276},{"match_name":"Bayou City USPSA Weekly Dec 27","match_date":"2018-12-28","stage_classifiercode":"03-04","member_number":"A93310","first_name":"JON","last_name":"MARINO","classification":"B","division":"OPEN","hit_factor":4.2276},{"match_name":"GAS July 7th Special Classifier","match_date":"2018-07-07","stage_classifiercode":"03-04","member_number":"\"\"","first_name":"JONATHAN","last_name":"SCHULTE","classification":"U","division":"OPEN","hit_factor":4.2262},{"match_name":"SLOSA FEBRUARY 2020 USPSA MATCH","match_date":"2020-02-08","stage_classifiercode":"03-04","member_number":"A101938","first_name":"LOYD","last_name":"WENZEL","classification":"U","division":"OPEN","hit_factor":4.2173},{"match_name":"WGC WI USPSA Monthly Match 12-17-16","match_date":"2016-12-17","stage_classifiercode":"03-04","member_number":"TY78432","first_name":"OUSMANE","last_name":"DIALLO","classification":"C","division":"OPEN","hit_factor":4.2164},{"match_name":"NRG April 23 2016","match_date":"2016-04-23","stage_classifiercode":"03-04","member_number":"TY78091","first_name":"ANGEL","last_name":"DE LEON","classification":"C","division":"OPEN","hit_factor":4.2157},{"match_name":"USPSA","match_date":"2018-04-28","stage_classifiercode":"03-04","member_number":"\"\"","first_name":"KENNY","last_name":"THORSTENSON","classification":"\"\"","division":"OPEN","hit_factor":4.2071},{"match_name":"Griffin USPSA Match March 2018","match_date":"2018-03-17","stage_classifiercode":"03-04","member_number":"TY60177","first_name":"CARL","last_name":"RAINEY","classification":"C","division":"OPEN","hit_factor":4.205},{"match_name":"Springfield Tactical Shooters 11/01/2018","match_date":"2018-11-01","stage_classifiercode":"03-04","member_number":"TY69724","first_name":"CRAIG","last_name":"HANSEN","classification":"\"\"","division":"OPEN","hit_factor":4.2017},{"match_name":"Pathfinder July 2021 USPSA","match_date":"2021-07-18","stage_classifiercode":"03-04","member_number":"fy29046","first_name":"DEAN","last_name":"BROWN","classification":"B","division":"OPEN","hit_factor":4.1958},{"match_name":"SWGC USPSA Pistol Match - July","match_date":"2016-07-02","stage_classifiercode":"03-04","member_number":"A78407","first_name":"TODD","last_name":"JESSE","classification":"A","division":"OPEN","hit_factor":4.182},{"match_name":"Custer USPSA Mar 7th 2021","match_date":"2021-03-07","stage_classifiercode":"03-04","member_number":"A63830","first_name":"DERI","last_name":"HELTERLINE","classification":"C","division":"OPEN","hit_factor":4.1817},{"match_name":"Springfield Tactical Shooters 03/05/2020","match_date":"2020-03-05","stage_classifiercode":"03-04","member_number":"A95946","first_name":"PAUL","last_name":"EMERY","classification":"B","division":"OPEN","hit_factor":4.1631},{"match_name":"SSS USPSA March 2020 - All Classifier","match_date":"2020-03-22","stage_classifiercode":"03-04","member_number":"A102564","first_name":"DONALD","last_name":"POWERS","classification":"M (Master)","division":"OPEN","hit_factor":4.1602},{"match_name":"Custer USPSA May","match_date":"2018-05-06","stage_classifiercode":"03-04","member_number":"B60","first_name":"MARK","last_name":"MCCALLISTER","classification":"B","division":"OPEN","hit_factor":4.1594},{"match_name":"IN18 SCGC USPSA 06 June 2021","match_date":"2021-06-06","stage_classifiercode":"03-04","member_number":"TY69656","first_name":"JEFF","last_name":"STRAUCH","classification":"C","division":"OPEN","hit_factor":4.1566},{"match_name":"Prescott 1st Saturday 3-04-2017","match_date":"2017-03-04","stage_classifiercode":"03-04","member_number":"A100087","first_name":"LUEL","last_name":"BAYLON","classification":"unclassified","division":"OPEN","hit_factor":4.1509},{"match_name":"Cactus USPSA February 2021","match_date":"2021-02-07","stage_classifiercode":"03-04","member_number":"A123174","first_name":"RYAN","last_name":"MCMAKEN","classification":"A","division":"OPEN","hit_factor":4.1289},{"match_name":"MS06 Team Magnolia USPSA October Match","match_date":"2015-10-04","stage_classifiercode":"03-04","member_number":"A80452","first_name":"ERNIE","last_name":"MATTINGLY","classification":"C","division":"OPEN","hit_factor":4.1207},{"match_name":"Pelham USPSA 2018-08-19","match_date":"2018-08-19","stage_classifiercode":"03-04","member_number":"L1876","first_name":"SIMEON","last_name":"GOUROUSIS","classification":"B","division":"OPEN","hit_factor":4.1115},{"match_name":"Pathfinder July 2021 USPSA","match_date":"2021-07-18","stage_classifiercode":"03-04","member_number":"A112888","first_name":"JOHN","last_name":"HUBBARD","classification":"D","division":"OPEN","hit_factor":4.1088},{"match_name":"Minot USPSA 2-18-18","match_date":"2018-02-18","stage_classifiercode":"03-04","member_number":"A52173","first_name":"WESLEY","last_name":"THOMAS","classification":"B","division":"OPEN","hit_factor":4.0923},{"match_name":"WGC WI USPSA Monthly Match 5-19-18","match_date":"2018-05-19","stage_classifiercode":"03-04","member_number":"\"\"","first_name":"MERLIN","last_name":"KOTAJARVI","classification":"\"\"","division":"OPEN","hit_factor":4.09},{"match_name":"Minnetonka game and fish June 30","match_date":"2021-06-30","stage_classifiercode":"03-04","member_number":"L4355","first_name":"JEFF","last_name":"PINKERTON","classification":"B","division":"OPEN","hit_factor":4.0881},{"match_name":"JCSSA Mar3 2018","match_date":"2018-03-03","stage_classifiercode":"03-04","member_number":"A43366","first_name":"TIM","last_name":"CAVAZOS","classification":"C","division":"OPEN","hit_factor":4.0872},{"match_name":"NRG April 23 2016","match_date":"2016-04-23","stage_classifiercode":"03-04","member_number":"A79600","first_name":"CYNTHIA","last_name":"HERPIN","classification":"C","division":"OPEN","hit_factor":4.0867},{"match_name":"Gem City Gun Club 5-5 and 5-6-18","match_date":"2018-05-05","stage_classifiercode":"03-04","member_number":"A60389","first_name":"RON","last_name":"SCHRAY","classification":"C","division":"OPEN","hit_factor":4.0816},{"match_name":"RMAP 3rd Sunday Marh 2016","match_date":"2016-03-20","stage_classifiercode":"03-04","member_number":"TY50145","first_name":"SUE","last_name":"LITTLE","classification":"C","division":"OPEN","hit_factor":4.0803},{"match_name":"MCAS USPSA October 2016","match_date":"2016-10-15","stage_classifiercode":"03-04","member_number":"TY49680","first_name":"JEN","last_name":"ADAMS","classification":"B","division":"OPEN","hit_factor":4.0719},{"match_name":"ORSA USPSA February 2020 ","match_date":"2020-02-15","stage_classifiercode":"03-04","member_number":"A21860","first_name":"LARRY","last_name":"WEBER","classification":"B","division":"OPEN","hit_factor":4.0707},{"match_name":"CCAS December 2018 Special Classifier","match_date":"2018-12-15","stage_classifiercode":"03-04","member_number":"FY66814","first_name":"ROY","last_name":"WILLIS","classification":"D","division":"OPEN","hit_factor":4.0593},{"match_name":"Low Country USPSA  March 24th","match_date":"2018-03-24","stage_classifiercode":"03-04","member_number":"A16580","first_name":"MARK","last_name":"STEINLE","classification":"B","division":"OPEN","hit_factor":4.0554},{"match_name":"PCWC USPSA  4 23 2016","match_date":"2016-04-23","stage_classifiercode":"03-04","member_number":"A95103","first_name":"SHANE","last_name":"ZELAZO","classification":"U","division":"OPEN","hit_factor":4.0513},{"match_name":"Renton USPSA August 2016 - NW05","match_date":"2016-08-28","stage_classifiercode":"03-04","member_number":"ty44166","first_name":"DANIEL","last_name":"LAI","classification":"B","division":"OPEN","hit_factor":4.0505},{"match_name":"Colonial Rifle and Pistol Club September 2020","match_date":"2020-09-05","stage_classifiercode":"03-04","member_number":"A111224","first_name":"ALEX","last_name":"JAVELLANA","classification":"U","division":"OPEN","hit_factor":4.0423},{"match_name":"Low Country USPSA  March 24th","match_date":"2018-03-24","stage_classifiercode":"03-04","member_number":"A90134","first_name":"CHASE","last_name":"WHEELER","classification":"B","division":"OPEN","hit_factor":4.0221},{"match_name":"PMRPC September 2018 USPSA","match_date":"2018-09-08","stage_classifiercode":"03-04","member_number":"ty23169","first_name":"TED","last_name":"KAVAGE","classification":"B","division":"OPEN","hit_factor":4.0206},{"match_name":"Briar Rabbit May 2016 Match OH20","match_date":"2016-05-22","stage_classifiercode":"03-04","member_number":"A50721","first_name":"NIK","last_name":"REPASKY","classification":"B","division":"OPEN","hit_factor":4.0039},{"match_name":"JCSSA NOV 6 2021","match_date":"2021-11-06","stage_classifiercode":"03-04","member_number":"A43366","first_name":"TIM","last_name":"CAVAZOS","classification":"C","division":"OPEN","hit_factor":4.0036},{"match_name":"MCRC USPSA September 2017","match_date":"2017-09-09","stage_classifiercode":"03-04","member_number":"A103849","first_name":"JENNIFER","last_name":"CHAMPION","classification":"D","division":"OPEN","hit_factor":3.9953},{"match_name":"Fort Wayne USPSA April 2021","match_date":"2021-04-18","stage_classifiercode":"03-04","member_number":"A133491","first_name":"MIKE","last_name":"PALICTE","classification":"U","division":"OPEN","hit_factor":3.9852},{"match_name":"Richmond Boro Gun Club March 2017 USPSA Pistol Match","match_date":"2017-03-25","stage_classifiercode":"03-04","member_number":"GUEST","first_name":"JOHN","last_name":"FEVELO","classification":"U","division":"OPEN","hit_factor":3.9769},{"match_name":"TGR Practical Pistol Match","match_date":"2017-07-12","stage_classifiercode":"03-04","member_number":"\"\"","first_name":"THOMAS","last_name":"NYLAND","classification":"C","division":"OPEN","hit_factor":3.9725},{"match_name":"Hosemonster Action  ","match_date":"2021-05-16","stage_classifiercode":"03-04","member_number":"Ty123909","first_name":"DAWN","last_name":"ASTORINO","classification":"D","division":"OPEN","hit_factor":3.9683},{"match_name":"WSPS NOVEMBER 2020 USPSA PROTEST","match_date":"2020-11-21","stage_classifiercode":"03-04","member_number":"A120840","first_name":"BOBBY","last_name":"ZINK","classification":"U","division":"OPEN","hit_factor":3.9596},{"match_name":"Idaho ISPS October 7th 2017","match_date":"2017-10-07","stage_classifiercode":"03-04","member_number":"A71703","first_name":"DONALD","last_name":"MARTIN","classification":"B","division":"OPEN","hit_factor":3.9526},{"match_name":"MCPSL Pistol 6-11-16","match_date":"2016-06-11","stage_classifiercode":"03-04","member_number":"TY78821","first_name":"STEVE","last_name":"GIRARD","classification":"C","division":"OPEN","hit_factor":3.9423},{"match_name":"RMAP 3rd Sunday Marh 2016","match_date":"2016-03-20","stage_classifiercode":"03-04","member_number":"TY33569","first_name":"WALTER","last_name":"KRADIN","classification":"C","division":"OPEN","hit_factor":3.9384},{"match_name":"ORSA USPSA February 2020 ","match_date":"2020-02-15","stage_classifiercode":"03-04","member_number":"A45411","first_name":"JASON","last_name":"EDWARDS","classification":"M","division":"OPEN","hit_factor":3.9329},{"match_name":"SAPS Match 2/1/2020","match_date":"2020-02-01","stage_classifiercode":"03-04","member_number":"TY74063","first_name":"DOUG","last_name":"HATFIELD","classification":"C","division":"OPEN","hit_factor":3.9155},{"match_name":"Renton USPSA August 2016 - NW05","match_date":"2016-08-28","stage_classifiercode":"03-04","member_number":"a28492","first_name":"DAVID","last_name":"MARCIN","classification":"C","division":"OPEN","hit_factor":3.8986},{"match_name":"Richmond Boro Gun Club September 2020 USPSA Match","match_date":"2020-09-12","stage_classifiercode":"03-04","member_number":"A111239","first_name":"GENE","last_name":"RAGUCCI","classification":"D","division":"OPEN","hit_factor":3.8926},{"match_name":"EAGC Classifier Match 1 February","match_date":"2020-02-02","stage_classifiercode":"03-04","member_number":"A117500","first_name":"SHANE","last_name":"GREENE","classification":"U","division":"OPEN","hit_factor":3.8883},{"match_name":"Cactus USPSA ALL CLASSIFIER September 2020","match_date":"2020-09-06","stage_classifiercode":"03-04","member_number":"A130181","first_name":"NEIL","last_name":"VERMILLION","classification":"U","division":"OPEN","hit_factor":3.8809},{"match_name":"Fernan USPSA October 2021","match_date":"2021-10-16","stage_classifiercode":"03-04","member_number":"TY59595","first_name":"CATHERINE","last_name":"HOFFMAN","classification":"C","division":"OPEN","hit_factor":3.875},{"match_name":"AIPS  USPSA Weekly 18  April 2017","match_date":"2017-04-18","stage_classifiercode":"03-04","member_number":"PEN","first_name":"GLENN","last_name":"LEWIS","classification":"Unclassified","division":"OPEN","hit_factor":3.8739},{"match_name":"Hosemonster Action  ","match_date":"2021-05-16","stage_classifiercode":"03-04","member_number":"A131027","first_name":"TERA","last_name":"FARRIS","classification":"U","division":"OPEN","hit_factor":3.8728},{"match_name":"RMAP 3rd Sunday Marh 2016","match_date":"2016-03-20","stage_classifiercode":"03-04","member_number":"A74253","first_name":"LESLIE","last_name":"KORZEP","classification":"C","division":"OPEN","hit_factor":3.8462},{"match_name":"GAS Special Classifier","match_date":"2016-07-02","stage_classifiercode":"03-04","member_number":"TY78129","first_name":"SHARON","last_name":"ELIASSON","classification":"D","division":"OPEN","hit_factor":3.8375},{"match_name":"H&H easter Classifier","match_date":"2016-03-27","stage_classifiercode":"03-04","member_number":"TY75066","first_name":"STEVE","last_name":"MCGINLEY","classification":"U","division":"OPEN","hit_factor":3.828},{"match_name":"Green Valley USPSA August 2021 Match","match_date":"2021-08-28","stage_classifiercode":"03-04","member_number":"A123453","first_name":"KYLIE","last_name":"WELLS","classification":"U","division":"OPEN","hit_factor":3.8256},{"match_name":"NISA September 2018","match_date":"2018-09-23","stage_classifiercode":"03-04","member_number":"A71862","first_name":"JOSEPH","last_name":"SINYAKOVICH","classification":"B","division":"OPEN","hit_factor":3.8239},{"match_name":"SMPS June 2016","match_date":"2016-06-12","stage_classifiercode":"03-04","member_number":"FY15413","first_name":"TOM","last_name":"SUIT","classification":"A","division":"OPEN","hit_factor":3.8156},{"match_name":"SAPSC Monthly USPSA Classifier Match 20161011","match_date":"2016-10-11","stage_classifiercode":"03-04","member_number":"A79845","first_name":"JOHNNY","last_name":"REED","classification":"B","division":"OPEN","hit_factor":3.8088},{"match_name":"SPSA USPSA June 1st Sat Match","match_date":"2018-06-02","stage_classifiercode":"03-04","member_number":"L1700","first_name":"ROBERT","last_name":"WRIGHT","classification":"M","division":"OPEN","hit_factor":3.8037},{"match_name":"SCCPSA USPSA Jul 17 2021","match_date":"2021-07-17","stage_classifiercode":"03-04","member_number":"TY90680","first_name":"BARBARA","last_name":"BOYCE","classification":"C","division":"OPEN","hit_factor":3.8034},{"match_name":"Briar Rabbit May 2016 Match OH20","match_date":"2016-05-22","stage_classifiercode":"03-04","member_number":"A88623","first_name":"JAN","last_name":"CRAWMER","classification":"U","division":"OPEN","hit_factor":3.7982},{"match_name":"Shot Through The Heart","match_date":"2017-02-26","stage_classifiercode":"03-04","member_number":"A16788","first_name":"EMILIO","last_name":"AGUINALDO","classification":"A","division":"OPEN","hit_factor":3.7975},{"match_name":"WHPS May Tactical Rifle Match","match_date":"2018-05-20","stage_classifiercode":"03-04","member_number":"L-1936","first_name":"AL","last_name":"NIELSEN","classification":"B","division":"OPEN","hit_factor":3.7885},{"match_name":"Woodland Heights Practical Shooters Tactical Rifle Match","match_date":"2021-04-18","stage_classifiercode":"03-04","member_number":"Life 1936","first_name":"AL","last_name":"NIELSEN","classification":"B","division":"OPEN","hit_factor":3.7718},{"match_name":"NRG April 23 2016","match_date":"2016-04-23","stage_classifiercode":"03-04","member_number":"\"\"","first_name":"ISA","last_name":"VIDANES","classification":"U","division":"OPEN","hit_factor":3.7585},{"match_name":"SCCPSA USPSA SEPTEMBER 15 MATCH","match_date":"2018-09-15","stage_classifiercode":"03-04","member_number":"A106069","first_name":"ERNESTO","last_name":"FIGUEROA","classification":"D","division":"OPEN","hit_factor":3.7492},{"match_name":"Lefthanders Gun Club Practical Shooters September 2 and 3","match_date":"2017-09-02","stage_classifiercode":"03-04","member_number":"L3265","first_name":"DIRK","last_name":"ROOT","classification":"B","division":"OPEN","hit_factor":3.7489},{"match_name":"Gem City Gun Club 8-5 and 6th 2017","match_date":"2017-08-05","stage_classifiercode":"03-04","member_number":"\"\"","first_name":"SETH","last_name":"LUCAS","classification":"U","division":"OPEN","hit_factor":3.7459},{"match_name":"WGC WI USPSA Monthly Match 12-17-16","match_date":"2016-12-17","stage_classifiercode":"03-04","member_number":"FY76269","first_name":"RUSSELL","last_name":"SWIGGUM","classification":"D","division":"OPEN","hit_factor":3.7459},{"match_name":"Richmond Boro Gun Club June 2018 USPSA  Match","match_date":"2018-06-23","stage_classifiercode":"03-04","member_number":"TY91913","first_name":"LANCE","last_name":"COLLO","classification":"D","division":"OPEN","hit_factor":3.7436},{"match_name":"ISPS 4/17/2016 USPSA","match_date":"2016-04-17","stage_classifiercode":"03-04","member_number":"L3500","first_name":"RHONDA","last_name":"GIBSON","classification":"C","division":"OPEN","hit_factor":3.7415},{"match_name":"Green Valley USPSA August 2021 Match","match_date":"2021-08-28","stage_classifiercode":"03-04","member_number":"A78543","first_name":"WILLIAM","last_name":"SIMPSON","classification":"C","division":"OPEN","hit_factor":3.7371},{"match_name":"EAGC March 2017 USPSA Pistol Match","match_date":"2017-03-19","stage_classifiercode":"03-04","member_number":"A93701","first_name":"DARYL","last_name":"SHIRAH","classification":"U","division":"OPEN","hit_factor":3.7369},{"match_name":"DSC August 2016","match_date":"2016-08-21","stage_classifiercode":"03-04","member_number":"PEND","first_name":"BILL","last_name":"SAPORITO","classification":"U","division":"OPEN","hit_factor":3.7361},{"match_name":"WPS USPSA Monthly Match April 2018","match_date":"2018-04-07","stage_classifiercode":"03-04","member_number":"TY92889","first_name":"FRANK","last_name":"HILL","classification":"C","division":"OPEN","hit_factor":3.7078},{"match_name":"Cactus USPSA November 2021","match_date":"2021-11-07","stage_classifiercode":"03-04","member_number":"A91055","first_name":"BOB","last_name":"WAGNER","classification":"B","division":"OPEN","hit_factor":3.7077},{"match_name":"Richmond Boro Gun Club December 2018 USPSA Match","match_date":"2018-12-15","stage_classifiercode":"03-04","member_number":"A107578","first_name":"JOSE","last_name":"SANTIAGO","classification":"D","division":"OPEN","hit_factor":3.7017},{"match_name":"GAS July 7th Special Classifier","match_date":"2018-07-07","stage_classifiercode":"03-04","member_number":"A104679","first_name":"LUKE","last_name":"ARCHER","classification":"C","division":"OPEN","hit_factor":3.7007},{"match_name":"Richmond Hot Shots February 20 and 21 - 2016 USPSA Match","match_date":"2016-02-20","stage_classifiercode":"03-04","member_number":"A64949","first_name":"HIROSHI","last_name":"TAKAMA","classification":"C","division":"OPEN","hit_factor":3.6994},{"match_name":"EAPS July 2016 USPSA","match_date":"2016-07-17","stage_classifiercode":"03-04","member_number":"PEN","first_name":"DARREN","last_name":"BARRINGER","classification":"U","division":"OPEN","hit_factor":3.6874},{"match_name":"Fort Wayne USPSA April 2021","match_date":"2021-04-18","stage_classifiercode":"03-04","member_number":"A110587","first_name":"JAY","last_name":"WEHRLE","classification":"U","division":"OPEN","hit_factor":3.6853},{"match_name":"Idaho ISPS October 7th 2017","match_date":"2017-10-07","stage_classifiercode":"03-04","member_number":"A98224","first_name":"JUSTIN","last_name":"HASH","classification":"U","division":"OPEN","hit_factor":3.6842},{"match_name":"LdF 2nd Saturday Match","match_date":"2016-01-09","stage_classifiercode":"03-04","member_number":"\"\"","first_name":"LUIS","last_name":"PAZ","classification":"A","division":"OPEN","hit_factor":3.6738},{"match_name":"SMPS March 2018","match_date":"2018-03-11","stage_classifiercode":"03-04","member_number":"FY15413","first_name":"TOM","last_name":"SUIT","classification":"A","division":"OPEN","hit_factor":3.6644},{"match_name":"WPS USPSA Monthly Match April 2018","match_date":"2018-04-07","stage_classifiercode":"03-04","member_number":"A101569","first_name":"VINCENT","last_name":"PERRONE","classification":"C","division":"OPEN","hit_factor":3.6566},{"match_name":"BGSL First Sunday Uspsa","match_date":"2016-08-07","stage_classifiercode":"03-04","member_number":"A68840","first_name":"TESS","last_name":"NASH","classification":"D","division":"OPEN","hit_factor":3.6496},{"match_name":"MCPSL Pistol 6-11-16","match_date":"2016-06-11","stage_classifiercode":"03-04","member_number":"TY86727","first_name":"GEORGE","last_name":"MORASCH II","classification":"U","division":"OPEN","hit_factor":3.6442},{"match_name":"CIPSC Havana May USPSA","match_date":"2018-05-12","stage_classifiercode":"03-04","member_number":"TY53381","first_name":"ROB","last_name":"KOSACK","classification":"A","division":"OPEN","hit_factor":3.637713437268},{"match_name":"Hampden RPC July USPSA","match_date":"2017-07-16","stage_classifiercode":"03-04","member_number":"TY23169","first_name":"TED","last_name":"KAVAGE","classification":"B","division":"OPEN","hit_factor":3.6348},{"match_name":"AVAP CLASSIFIER 71418","match_date":"2018-07-14","stage_classifiercode":"03-04","member_number":"A72042","first_name":"MARK","last_name":"CACHERO","classification":"B","division":"OPEN","hit_factor":3.6347},{"match_name":"Richmond Boro Gun Club September 2020 USPSA Match","match_date":"2020-09-12","stage_classifiercode":"03-04","member_number":"A111002","first_name":"FRANK","last_name":"SENZINO","classification":"U","division":"OPEN","hit_factor":3.632},{"match_name":"NRG April 23 2016","match_date":"2016-04-23","stage_classifiercode":"03-04","member_number":"L3958","first_name":"LEI","last_name":"XU","classification":"U","division":"OPEN","hit_factor":3.6278},{"match_name":"DSC August 2016","match_date":"2016-08-21","stage_classifiercode":"03-04","member_number":"A46718","first_name":"JAKE","last_name":"DI VITA","classification":"G","division":"OPEN","hit_factor":3.6232},{"match_name":"CGGR  APRIL USPSA MATCH","match_date":"2018-04-20","stage_classifiercode":"03-04","member_number":"A99924","first_name":"CLAYTON","last_name":"RUTAN","classification":"U","division":"OPEN","hit_factor":3.6204},{"match_name":"CIPSC Havana May USPSA","match_date":"2018-05-12","stage_classifiercode":"03-04","member_number":"A95946","first_name":"PAUL","last_name":"EMERY","classification":"D","division":"OPEN","hit_factor":3.6108324974925},{"match_name":"NRG April 23 2016","match_date":"2016-04-23","stage_classifiercode":"03-04","member_number":"L3942","first_name":"NGONG (LEON)","last_name":"SUNG","classification":"C","division":"OPEN","hit_factor":3.6093},{"match_name":"Gem City Gun Club 8-5 and 6th 2017","match_date":"2017-08-05","stage_classifiercode":"03-04","member_number":"TY43238","first_name":"RICHARD","last_name":"KONNERTH","classification":"C","division":"OPEN","hit_factor":3.6036},{"match_name":"Richmond Boro Gun Club December 2018 USPSA Match","match_date":"2018-12-15","stage_classifiercode":"03-04","member_number":"A108539","first_name":"LOUIS","last_name":"SEGGIO","classification":"D","division":"OPEN","hit_factor":3.599},{"match_name":"ECPS USPSA 17 Dec 16","match_date":"2016-12-17","stage_classifiercode":"03-04","member_number":"A92492","first_name":"TODD","last_name":"SEARS","classification":"U","division":"OPEN","hit_factor":3.5931},{"match_name":"Minnetonka game and fish June 30","match_date":"2021-06-30","stage_classifiercode":"03-04","member_number":"FY35127","first_name":"JOHN","last_name":"WARNEST","classification":"C","division":"OPEN","hit_factor":3.5692},{"match_name":"Shoot GTR USPSA 2/5","match_date":"2017-02-04","stage_classifiercode":"03-04","member_number":"TY73281","first_name":"JACK","last_name":"DARTIGALONGUE","classification":"C","division":"OPEN","hit_factor":3.5533},{"match_name":"SCCPSA USPSA Jul 17 2021","match_date":"2021-07-17","stage_classifiercode":"03-04","member_number":"TY106069","first_name":"ERNESTO","last_name":"FIGUEROA","classification":"B","division":"OPEN","hit_factor":3.5514},{"match_name":"TGR Practical Pistol Match","match_date":"2017-07-12","stage_classifiercode":"03-04","member_number":"\"\"","first_name":"DAN","last_name":"DOUGHTON","classification":"U","division":"OPEN","hit_factor":3.5465},{"match_name":"Springfield Tactical Shooters 03/05/2020","match_date":"2020-03-05","stage_classifiercode":"03-04","member_number":"\"\"","first_name":"JACOB","last_name":"DISTLEHORST","classification":"\"\"","division":"OPEN","hit_factor":3.5354},{"match_name":"LGRPC Oct  2016","match_date":"2016-10-09","stage_classifiercode":"03-04","member_number":"A56478","first_name":"BILL","last_name":"COOPER","classification":"X","division":"OPEN","hit_factor":3.5256},{"match_name":"MCPSL Pistol 5-8-2021","match_date":"2021-05-08","stage_classifiercode":"03-04","member_number":"TY110474","first_name":"MARC","last_name":"SMITH","classification":"B","division":"OPEN","hit_factor":3.5129},{"match_name":"SPSA USPSA October 4th Sat match","match_date":"2016-10-22","stage_classifiercode":"03-04","member_number":"A84265","first_name":"ROD","last_name":"GOFORTH","classification":"U","division":"OPEN","hit_factor":3.4843},{"match_name":"AIPS  USPSA Weekly 18  April 2017","match_date":"2017-04-18","stage_classifiercode":"03-04","member_number":"A23819","first_name":"MIKE","last_name":"CARMONEY","classification":"A","division":"OPEN","hit_factor":3.481},{"match_name":"Dundee USPSA Feb 2016","match_date":"2016-02-27","stage_classifiercode":"03-04","member_number":"TY76563","first_name":"SORIDA","last_name":"EAP","classification":"A","division":"OPEN","hit_factor":3.4729},{"match_name":"Ripon USPSA 4-22-17","match_date":"2017-04-22","stage_classifiercode":"03-04","member_number":"TY29443","first_name":"NICK","last_name":"KALISHEK","classification":"G","division":"OPEN","hit_factor":3.4713},{"match_name":"EAPS February 2018 USPSA","match_date":"2018-02-18","stage_classifiercode":"03-04","member_number":"A66934","first_name":"ELIZABETH","last_name":"YOUNG","classification":"C","division":"OPEN","hit_factor":3.4653},{"match_name":"Fernan USPSA October 2021","match_date":"2021-10-16","stage_classifiercode":"03-04","member_number":"TY132856","first_name":"JON","last_name":"FRIESE","classification":"U","division":"OPEN","hit_factor":3.4539},{"match_name":"LGCSEMPS April 2018 Special Classifier","match_date":"2018-04-08","stage_classifiercode":"03-04","member_number":"TY 80894","first_name":"VINCE","last_name":"PALAZZOLO","classification":"C","division":"OPEN","hit_factor":3.4483},{"match_name":"WPS USPSA Monthly Match April 2018","match_date":"2018-04-07","stage_classifiercode":"03-04","member_number":"A102251","first_name":"TYLER","last_name":"WEATHERWAX","classification":"U","division":"OPEN","hit_factor":3.4398},{"match_name":"PCWC USPSA  4 23 2016","match_date":"2016-04-23","stage_classifiercode":"03-04","member_number":"A78407","first_name":"TODD","last_name":"JESSEE","classification":"A","division":"OPEN","hit_factor":3.4346},{"match_name":"MCPSL Pistol 12-9-17","match_date":"2017-12-09","stage_classifiercode":"03-04","member_number":"TY78821","first_name":"STEVE","last_name":"GIRARD","classification":"C","division":"OPEN","hit_factor":3.4268},{"match_name":"SCS USPSA Pistol Match with Classifier - November 6 2016","match_date":"2016-11-06","stage_classifiercode":"03-04","member_number":"0","first_name":"KETZU","last_name":"FLORES","classification":"U","division":"OPEN","hit_factor":3.4252},{"match_name":"Renton USPSA August 2016 - NW05","match_date":"2016-08-28","stage_classifiercode":"03-04","member_number":"PEN","first_name":"JONATHAN","last_name":"BLUER","classification":"U","division":"OPEN","hit_factor":3.4208},{"match_name":"CCAS April 2017","match_date":"2017-04-15","stage_classifiercode":"03-04","member_number":"A92463","first_name":"DAN","last_name":"STABER","classification":"U","division":"OPEN","hit_factor":3.4164},{"match_name":"EDPS USPSA Sept 5","match_date":"2020-09-05","stage_classifiercode":"03-04","member_number":"A124748","first_name":"JOHNNY","last_name":"SMITH","classification":"C","division":"OPEN","hit_factor":3.4146},{"match_name":"Springfield Tactical Shooters 11/01/2018","match_date":"2018-11-01","stage_classifiercode":"03-04","member_number":"A99127","first_name":"STEVE","last_name":"FRAZIER","classification":"C","division":"OPEN","hit_factor":3.405},{"match_name":"OGCIDPA10/1/15","match_date":"2015-10-01","stage_classifiercode":"03-04","member_number":"\"\"","first_name":"SCOTT","last_name":"ROSTEET","classification":"\"\"","division":"OPEN","hit_factor":3.3935},{"match_name":"AIPS  USPSA Weekly 18  April 2017","match_date":"2017-04-18","stage_classifiercode":"03-04","member_number":"FY72636","first_name":"ANDREW","last_name":"SMITHSON","classification":"Unclassified","division":"OPEN","hit_factor":3.3883},{"match_name":"Collin County USPSA July 30th 2017","match_date":"2017-07-30","stage_classifiercode":"03-04","member_number":"A57591","first_name":"NICK","last_name":"ANSELMO","classification":"B","division":"OPEN","hit_factor":3.3868},{"match_name":"SPSA USPSA June 1st Sat Match","match_date":"2018-06-02","stage_classifiercode":"03-04","member_number":"TY88617","first_name":"JESSE","last_name":"BLANKENSHIP","classification":"B","division":"OPEN","hit_factor":3.3831},{"match_name":"NRG April 23 2016","match_date":"2016-04-23","stage_classifiercode":"03-04","member_number":"\"\"","first_name":"BRIAN","last_name":"URBANO","classification":"B","division":"OPEN","hit_factor":3.3738},{"match_name":"Richmond Hot Shots February 20 and 21 - 2016 USPSA Match","match_date":"2016-02-20","stage_classifiercode":"03-04","member_number":"A88607","first_name":"FRANCO","last_name":"GESMUNDO","classification":"A","division":"OPEN","hit_factor":3.3708},{"match_name":"SPSA USPSA October 4th Sat match","match_date":"2016-10-22","stage_classifiercode":"03-04","member_number":"A64790","first_name":"DAN","last_name":"GIRVAN","classification":"C","division":"OPEN","hit_factor":3.37},{"match_name":"LTD Pistol - August 2018","match_date":"2018-08-04","stage_classifiercode":"03-04","member_number":"FY63927","first_name":"INEZ","last_name":"COLLINS","classification":"D","division":"OPEN","hit_factor":3.3531},{"match_name":"GPS OCTOBER 2018","match_date":"2018-10-28","stage_classifiercode":"03-04","member_number":"ty26527","first_name":"DAVE","last_name":"CAMPBELL","classification":"M","division":"OPEN","hit_factor":3.3498},{"match_name":"MRPC OHS02 092720","match_date":"2020-09-27","stage_classifiercode":"03-04","member_number":"TY59608","first_name":"KIMBERLY","last_name":"RUSS","classification":"C","division":"OPEN","hit_factor":3.3433},{"match_name":"NISA April Classifer Match 2016","match_date":"2016-04-24","stage_classifiercode":"03-04","member_number":"A91934","first_name":"ALFRED","last_name":"LADORES","classification":"B","division":"OPEN","hit_factor":3.3248},{"match_name":"TAC2 USPSA Dec 2017","match_date":"2017-12-02","stage_classifiercode":"03-04","member_number":"A85473","first_name":"NATHAN 2G","last_name":"DIVELY","classification":"U","division":"OPEN","hit_factor":3.3175},{"match_name":"WTPS USPSA October Match 10-8-16","match_date":"2016-10-08","stage_classifiercode":"03-04","member_number":"TY51517","first_name":"STEVE","last_name":"AZZINARO","classification":"C","division":"OPEN","hit_factor":3.3145},{"match_name":"Maine Practical Shooters June 2016","match_date":"2016-06-04","stage_classifiercode":"03-04","member_number":"A87906","first_name":"TIM","last_name":"LECLAIR","classification":"D","division":"OPEN","hit_factor":3.3109},{"match_name":"SCS USPSA Pistol Match with Classifier - November 6 2016","match_date":"2016-11-06","stage_classifiercode":"03-04","member_number":"L1681","first_name":"DENNIS","last_name":"DELHAIE","classification":"C","division":"OPEN","hit_factor":3.3011},{"match_name":"MPSA USPSA 021718","match_date":"2018-02-17","stage_classifiercode":"03-04","member_number":"L4195","first_name":"THOMAS","last_name":"HEARD","classification":"C","division":"OPEN","hit_factor":3.2775},{"match_name":"USPSA","match_date":"2018-04-28","stage_classifiercode":"03-04","member_number":"\"\"","first_name":"ROBERT","last_name":"WESTENDORF","classification":"\"\"","division":"OPEN","hit_factor":3.2751},{"match_name":"JCSSA Mar3 2018","match_date":"2018-03-03","stage_classifiercode":"03-04","member_number":"FY16877","first_name":"ROGER","last_name":"LISENBY","classification":"B","division":"OPEN","hit_factor":3.2684},{"match_name":"Number 12 at DECAP","match_date":"2020-07-05","stage_classifiercode":"03-04","member_number":"A128615","first_name":"JOE","last_name":"BUSQUE","classification":"U","division":"OPEN","hit_factor":3.266},{"match_name":"May 8 2021 The Range At True North USPSA Match","match_date":"2021-05-08","stage_classifiercode":"03-04","member_number":"A110621","first_name":"JAMES","last_name":"ALEXANDER","classification":"U","division":"OPEN","hit_factor":3.2514},{"match_name":"Wvpps August 2016","match_date":"2016-08-21","stage_classifiercode":"03-04","member_number":"a78441","first_name":"BILL","last_name":"TUGGLE","classification":"C","division":"OPEN","hit_factor":3.2429},{"match_name":"Matamoras USPSA March 2017","match_date":"2017-04-02","stage_classifiercode":"03-04","member_number":"TY101373","first_name":"JOSEPH","last_name":"JUAREZ","classification":"U","division":"OPEN","hit_factor":3.238},{"match_name":"Hampden RPC June USPSA Match","match_date":"2021-06-13","stage_classifiercode":"03-04","member_number":"TY112187","first_name":"CHRIS","last_name":"AUSTIN","classification":"B","division":"OPEN","hit_factor":3.2353},{"match_name":"SPSA USPSA June 1st Sat Match","match_date":"2018-06-02","stage_classifiercode":"03-04","member_number":"A67641","first_name":"SUZANNE","last_name":"HOLLEMAN","classification":"C","division":"OPEN","hit_factor":3.2306},{"match_name":"-Triforce Practical Shooters at BigWoodsGoods 11-1-18","match_date":"2018-11-01","stage_classifiercode":"03-04","member_number":"\"\"","first_name":"LORING","last_name":"RUTLEDGE","classification":"D","division":"OPEN","hit_factor":3.2223},{"match_name":"FVPS July Point Series Match","match_date":"2017-07-01","stage_classifiercode":"03-04","member_number":"FY53791","first_name":"MICHAEL","last_name":"OLSON","classification":"B","division":"OPEN","hit_factor":3.2186},{"match_name":"SCCPSA USPSA Jul 17 2021","match_date":"2021-07-17","stage_classifiercode":"03-04","member_number":"A96961","first_name":"STEPHEN","last_name":"THOMER","classification":"C","division":"OPEN","hit_factor":3.2072},{"match_name":"MCPSL Pistol 6-13-20","match_date":"2020-06-13","stage_classifiercode":"03-04","member_number":"TY15566","first_name":"KEN","last_name":"RICKEY","classification":"C","division":"OPEN","hit_factor":3.2067},{"match_name":"WGC WI USPSA Monthly Match 12-17-16","match_date":"2016-12-17","stage_classifiercode":"03-04","member_number":"TY67616","first_name":"DAN","last_name":"PAWLAK","classification":"C","division":"OPEN","hit_factor":3.1915},{"match_name":"WSPS NOVEMBER 2020 USPSA PROTEST","match_date":"2020-11-21","stage_classifiercode":"03-04","member_number":"A103523","first_name":"RAY","last_name":"SWANK","classification":"C","division":"OPEN","hit_factor":3.1669},{"match_name":"RCSC USPSA 24 July 2016","match_date":"2016-07-24","stage_classifiercode":"03-04","member_number":"A96876","first_name":"KORT","last_name":"WALTHER","classification":"U","division":"OPEN","hit_factor":3.1611},{"match_name":"Woodland Heights Practical Shooters Tactical Rifle Match","match_date":"2021-04-18","stage_classifiercode":"03-04","member_number":"TY91043","first_name":"DAVID","last_name":"MURPHY","classification":"U","division":"OPEN","hit_factor":3.1491},{"match_name":"Cactus USPSA ALL CLASSIFIER September 2020","match_date":"2020-09-06","stage_classifiercode":"03-04","member_number":"FY74995","first_name":"CHUCK","last_name":"EMERY","classification":"D","division":"OPEN","hit_factor":3.1455},{"match_name":"Briar Rabbit May 2016 Match OH20","match_date":"2016-05-22","stage_classifiercode":"03-04","member_number":"A96942","first_name":"RICK","last_name":"RUGGLES","classification":"U","division":"OPEN","hit_factor":3.1373},{"match_name":"Cactus USPSA February 2021","match_date":"2021-02-07","stage_classifiercode":"03-04","member_number":"ty114245","first_name":"EUGENE","last_name":"OH","classification":"B","division":"OPEN","hit_factor":3.1284},{"match_name":"GAS July 7th Special Classifier","match_date":"2018-07-07","stage_classifiercode":"03-04","member_number":"TY97094","first_name":"TOMMY","last_name":"MCCULLOUGH","classification":"C","division":"OPEN","hit_factor":3.1228},{"match_name":"Cactus USPSA February 2021","match_date":"2021-02-07","stage_classifiercode":"03-04","member_number":"A131779","first_name":"SCOTT","last_name":"ROWE","classification":"D","division":"OPEN","hit_factor":3.121},{"match_name":"EAPS February 2018 USPSA","match_date":"2018-02-18","stage_classifiercode":"03-04","member_number":"L1796","first_name":"BOBBY","last_name":"MCKEE","classification":"U","division":"OPEN","hit_factor":3.12},{"match_name":"JCSSA Mar3 2018","match_date":"2018-03-03","stage_classifiercode":"03-04","member_number":"A28492","first_name":"DAVE","last_name":"MARCIN","classification":"C","division":"OPEN","hit_factor":3.0737},{"match_name":"Renton USPSA August 2016 - NW05","match_date":"2016-08-28","stage_classifiercode":"03-04","member_number":"PEN","first_name":"LEROY","last_name":"OLSEN","classification":"U","division":"OPEN","hit_factor":3.0726},{"match_name":"MCRC USPSA September 2017","match_date":"2017-09-09","stage_classifiercode":"03-04","member_number":"A33652","first_name":"BENNY","last_name":"YUMOL","classification":"C","division":"OPEN","hit_factor":3.0675},{"match_name":"Green Valley USPSA August 2021 Match","match_date":"2021-08-28","stage_classifiercode":"03-04","member_number":"TY110363","first_name":"JERROD","last_name":"BRYAN","classification":"U","division":"OPEN","hit_factor":3.0568},{"match_name":"EAGC March 2017 USPSA Pistol Match","match_date":"2017-03-19","stage_classifiercode":"03-04","member_number":"FY5264","first_name":"BILL","last_name":"COX","classification":"C","division":"OPEN","hit_factor":3.0446},{"match_name":"May 8 2021 The Range At True North USPSA Match","match_date":"2021-05-08","stage_classifiercode":"03-04","member_number":"A104834","first_name":"LOGAN","last_name":"SAUNDERS","classification":"B","division":"OPEN","hit_factor":3.034},{"match_name":"Maine Practical Shooters September 2018","match_date":"2018-09-22","stage_classifiercode":"03-04","member_number":"\"\"","first_name":"NICHOLAS","last_name":"GIRARDIN","classification":"U","division":"OPEN","hit_factor":3.0303},{"match_name":"Cactus USPSA February 2021","match_date":"2021-02-07","stage_classifiercode":"03-04","member_number":"a21152","first_name":"BRIAN","last_name":"MUEGGE","classification":"A","division":"OPEN","hit_factor":3.0303},{"match_name":"LdF 2nd Saturday Match","match_date":"2016-01-09","stage_classifiercode":"03-04","member_number":"TY91328","first_name":"ROLLY","last_name":"ABADA","classification":"D","division":"OPEN","hit_factor":3.0289},{"match_name":"SAPS Match 2/1/2020","match_date":"2020-02-01","stage_classifiercode":"03-04","member_number":"A99787","first_name":"SCOTT","last_name":"BERGEN","classification":"B","division":"OPEN","hit_factor":3.0268},{"match_name":"Briar Rabbit May 2016 Match OH20","match_date":"2016-05-22","stage_classifiercode":"03-04","member_number":"A67357","first_name":"DAVE","last_name":"BONE","classification":"C","division":"OPEN","hit_factor":3.0261},{"match_name":"Wvpps August 2016","match_date":"2016-08-21","stage_classifiercode":"03-04","member_number":"a33002","first_name":"STEVE","last_name":"CRICHFIELD","classification":"B","division":"OPEN","hit_factor":3.0082},{"match_name":"SPSA USPSA June 1st Sat Match","match_date":"2018-06-02","stage_classifiercode":"03-04","member_number":"TY75767","first_name":"BUDDY","last_name":"BRIDWELL","classification":"D","division":"OPEN","hit_factor":3.0005},{"match_name":"Pelham USPSA 2018-08-19","match_date":"2018-08-19","stage_classifiercode":"03-04","member_number":"TY49724","first_name":"BETSY","last_name":"GRECOE","classification":"C","division":"OPEN","hit_factor":2.9893},{"match_name":"SUPS USPSA 18-19 August 2018","match_date":"2018-08-18","stage_classifiercode":"03-04","member_number":"L3286","first_name":"DANIEL","last_name":"PELAEZ","classification":"C","division":"OPEN","hit_factor":2.983},{"match_name":"LCSC USPSA   8-13-17","match_date":"2017-08-08","stage_classifiercode":"03-04","member_number":"Ty88773","first_name":"EPHRAIM","last_name":"SAN FELIPE","classification":"C","division":"OPEN","hit_factor":2.9794},{"match_name":"BSTRC May 31 2018","match_date":"2018-05-31","stage_classifiercode":"03-04","member_number":"A99120","first_name":"CHRIS","last_name":"GEORGE","classification":"U","division":"OPEN","hit_factor":2.9777},{"match_name":"Portage-Summit Field and Stream - OH17 - 2015-10-17","match_date":"2015-10-17","stage_classifiercode":"03-04","member_number":"A32195","first_name":"GLENN","last_name":"TOKOS","classification":"C","division":"OPEN","hit_factor":2.974},{"match_name":"RMAP 3rd Sunday Marh 2016","match_date":"2016-03-20","stage_classifiercode":"03-04","member_number":"TY46991","first_name":"RON","last_name":"ASCHENBACH","classification":"B","division":"OPEN","hit_factor":2.9553},{"match_name":"Laser Ninja Dragon League USPSA September 2017 fixed","match_date":"2017-09-03","stage_classifiercode":"03-04","member_number":"\"\"","first_name":"TIFFANY","last_name":"BEEMAN","classification":"U","division":"OPEN","hit_factor":2.9478},{"match_name":"Clinton County USPSA Oct 22 2016","match_date":"2016-10-22","stage_classifiercode":"03-04","member_number":"6","first_name":"LISA","last_name":"TRIPP","classification":"U","division":"OPEN","hit_factor":2.9326},{"match_name":"Bayou City USPSA Weekly Dec 27","match_date":"2018-12-28","stage_classifiercode":"03-04","member_number":"A107489","first_name":"CHARLES","last_name":"BRADBURY","classification":"U","division":"OPEN","hit_factor":2.9323},{"match_name":"Collin County USPSA July 30th 2017","match_date":"2017-07-30","stage_classifiercode":"03-04","member_number":"TY100943","first_name":"JAMES","last_name":"LAYA","classification":"C","division":"OPEN","hit_factor":2.9314},{"match_name":"Gem City Gun Club 5-5 and 5-6-18","match_date":"2018-05-05","stage_classifiercode":"03-04","member_number":"A43231","first_name":"VERN","last_name":"MOORE","classification":"B","division":"OPEN","hit_factor":2.9247},{"match_name":"Richmond Hot Shots February 20 and 21 - 2016 USPSA Match","match_date":"2016-02-20","stage_classifiercode":"03-04","member_number":"A85957","first_name":"TRISTAN","last_name":"TOLENTINO","classification":"B","division":"OPEN","hit_factor":2.9093},{"match_name":"PCWC USPSA  4 23 2016","match_date":"2016-04-23","stage_classifiercode":"03-04","member_number":"TY68577","first_name":"DENNIS","last_name":"JOHNSON","classification":"C","division":"OPEN","hit_factor":2.9049},{"match_name":"ACPSA January 2017","match_date":"2017-01-28","stage_classifiercode":"03-04","member_number":"\"\"","first_name":"BILL","last_name":"CREWS","classification":"U","division":"OPEN","hit_factor":2.9},{"match_name":"CGGR  APRIL USPSA MATCH","match_date":"2018-04-20","stage_classifiercode":"03-04","member_number":"A88984","first_name":"NEREO","last_name":"PARRENO","classification":"B","division":"OPEN","hit_factor":2.8834},{"match_name":"SPSA USPSA December 4th Sat match","match_date":"2018-12-22","stage_classifiercode":"03-04","member_number":"L3896","first_name":"CHRIS","last_name":"WILLAUER","classification":"C","division":"OPEN","hit_factor":2.8801},{"match_name":"RMAP 3rd Sunday Marh 2016","match_date":"2016-03-20","stage_classifiercode":"03-04","member_number":"TY19233","first_name":"TROY","last_name":"HUMPERT","classification":"M","division":"OPEN","hit_factor":2.8694},{"match_name":"NPCCC November USPSA","match_date":"2015-11-01","stage_classifiercode":"03-04","member_number":"A93362","first_name":"APRIL","last_name":"TOOSOVICH","classification":"U","division":"OPEN","hit_factor":2.8623},{"match_name":"Hosemonster Action  ","match_date":"2021-05-16","stage_classifiercode":"03-04","member_number":"A129147","first_name":"RUGENE","last_name":"CABANTING","classification":"C","division":"OPEN","hit_factor":2.8493},{"match_name":"Pinetucky USPSA 01-24-16","match_date":"2016-01-24","stage_classifiercode":"03-04","member_number":"A82404","first_name":"JEFF","last_name":"JOHNSTON","classification":"C","division":"OPEN","hit_factor":2.8436},{"match_name":"PMRPC September 2018 USPSA","match_date":"2018-09-08","stage_classifiercode":"03-04","member_number":"Fy91472","first_name":"BRUCE","last_name":"STEIN","classification":"B","division":"OPEN","hit_factor":2.8417},{"match_name":"MVPSA USPSA  6-16-18","match_date":"2018-06-16","stage_classifiercode":"03-04","member_number":"A93448","first_name":"BOB","last_name":"BEER","classification":"C","division":"OPEN","hit_factor":2.8221},{"match_name":"PRG October 2018 Match","match_date":"2018-10-07","stage_classifiercode":"03-04","member_number":"\"\"","first_name":"CYNTHIA","last_name":"HERPIN","classification":"U","division":"OPEN","hit_factor":2.8169},{"match_name":"WTPS USPSA October Match 10-8-16","match_date":"2016-10-08","stage_classifiercode":"03-04","member_number":"A28359","first_name":"MIKE","last_name":"FOSTER","classification":"B","division":"OPEN","hit_factor":2.8141},{"match_name":"GPS OCTOBER 2018","match_date":"2018-10-28","stage_classifiercode":"03-04","member_number":"TY97870","first_name":"WILLIAM","last_name":"CHAN","classification":"\"\"","division":"OPEN","hit_factor":2.8129},{"match_name":"MCAS USPSA October 2016","match_date":"2016-10-15","stage_classifiercode":"03-04","member_number":"TY25701","first_name":"ANDY","last_name":"ADAMS","classification":"C","division":"OPEN","hit_factor":2.7957},{"match_name":"OREGON ARPC CC05 USPSA JULY 14 2018","match_date":"2018-07-14","stage_classifiercode":"03-04","member_number":"L4199","first_name":"JAN","last_name":"MCDONALD","classification":"C","division":"OPEN","hit_factor":2.7821},{"match_name":"Lefthanders Gun Club Practical Shooters September 2 and 3","match_date":"2017-09-02","stage_classifiercode":"03-04","member_number":"A30365","first_name":"ED","last_name":"TRIBBLE","classification":"A","division":"OPEN","hit_factor":2.7805},{"match_name":"Renton USPSA August 2016 - NW05","match_date":"2016-08-28","stage_classifiercode":"03-04","member_number":"A90654","first_name":"RONALD","last_name":"TOLENTINO","classification":"C","division":"OPEN","hit_factor":2.7778},{"match_name":"Colonial Rifle and Pistol Club September 2020","match_date":"2020-09-05","stage_classifiercode":"03-04","member_number":"TY109268","first_name":"ALAIN","last_name":"RMAND","classification":"U","division":"OPEN","hit_factor":2.7616},{"match_name":"SPSA USPSA December 4th Sat match","match_date":"2018-12-22","stage_classifiercode":"03-04","member_number":"L3906","first_name":"ARIC","last_name":"COWART","classification":"A","division":"OPEN","hit_factor":2.7556},{"match_name":"NRG April 23 2016","match_date":"2016-04-23","stage_classifiercode":"03-04","member_number":"\"\"","first_name":"DAVID","last_name":"YEP","classification":"\"\"","division":"OPEN","hit_factor":2.7507},{"match_name":"SCS USPSA Pistol Match with Classifier - November 6 2016","match_date":"2016-11-06","stage_classifiercode":"03-04","member_number":"A17372","first_name":"ERIC","last_name":"RONNING","classification":"C","division":"OPEN","hit_factor":2.7484},{"match_name":"Gem City Gun Club 8-5 and 6th 2017","match_date":"2017-08-05","stage_classifiercode":"03-04","member_number":"TY43238","first_name":"RICHARD","last_name":"KONNERTH","classification":"C","division":"OPEN","hit_factor":2.7397},{"match_name":"Richmond Boro Gun Club June 2018 USPSA  Match","match_date":"2018-06-23","stage_classifiercode":"03-04","member_number":"A111239","first_name":"GENE","last_name":"RAGUCCI","classification":"D","division":"OPEN","hit_factor":2.7224},{"match_name":"AIPS Weekly USPSA 24 July 2018","match_date":"2018-07-24","stage_classifiercode":"03-04","member_number":"PEN","first_name":"JOHN","last_name":"TEMPLE","classification":"Unclassified","division":"OPEN","hit_factor":2.7171},{"match_name":"LGRPC Oct  2016","match_date":"2016-10-09","stage_classifiercode":"03-04","member_number":"\"\"","first_name":"JOHN","last_name":"SHOWN","classification":"U","division":"OPEN","hit_factor":2.7098},{"match_name":"SAPSC Monthly USPSA Classifier Match 20151110","match_date":"2015-11-11","stage_classifiercode":"03-04","member_number":"PEN","first_name":"JOSEPH","last_name":"SIMONEAU","classification":"U","division":"OPEN","hit_factor":2.7083},{"match_name":"TGR Practical Pistol Match","match_date":"2017-07-12","stage_classifiercode":"03-04","member_number":"\"\"","first_name":"ROB","last_name":"DOUGHTON","classification":"U","division":"OPEN","hit_factor":2.7061},{"match_name":"Wvpps August 2016","match_date":"2016-08-21","stage_classifiercode":"03-04","member_number":"a81684","first_name":"CHLOE","last_name":"KOUTSOUMPAS","classification":"C","division":"OPEN","hit_factor":2.7027},{"match_name":"HPPS 2-18-2017","match_date":"2017-02-16","stage_classifiercode":"03-04","member_number":"A85028","first_name":"ANDREW","last_name":"REISBECK","classification":"A","division":"OPEN","hit_factor":2.6992},{"match_name":"OREGON ARPC CC05 USPSA JULY 14 2018","match_date":"2018-07-14","stage_classifiercode":"03-04","member_number":"ty45897","first_name":"LARRY","last_name":"MULL","classification":"C","division":"OPEN","hit_factor":2.6846},{"match_name":"SPSA USPSA October 4th Sat match","match_date":"2016-10-22","stage_classifiercode":"03-04","member_number":"\"\"","first_name":"HEIDI","last_name":"THOMSON","classification":"U","division":"OPEN","hit_factor":2.6727},{"match_name":"EAGC March 2017 USPSA Pistol Match","match_date":"2017-03-19","stage_classifiercode":"03-04","member_number":"A89173","first_name":"KYLE","last_name":"ADOMAVICIUS","classification":"U","division":"OPEN","hit_factor":2.6718},{"match_name":"RDS USPSA Dec 10 2016 classifier Match","match_date":"2016-12-10","stage_classifiercode":"03-04","member_number":"\"\"","first_name":"DIANE","last_name":"MCCOY","classification":"U","division":"OPEN","hit_factor":2.6706},{"match_name":"LGCSEMPS April 2018 Special Classifier","match_date":"2018-04-08","stage_classifiercode":"03-04","member_number":"A105280","first_name":"DANA","last_name":"WELCH","classification":"U","division":"OPEN","hit_factor":2.6538},{"match_name":"LTD Pistol - August 2018","match_date":"2018-08-04","stage_classifiercode":"03-04","member_number":"L3808","first_name":"MARK","last_name":"BROWN","classification":"B","division":"OPEN","hit_factor":2.6467},{"match_name":"Bayou City USPSA Weekly Nov 11","match_date":"2021-11-12","stage_classifiercode":"03-04","member_number":"A107489","first_name":"CHARLES","last_name":"BRADBURY","classification":"U","division":"OPEN","hit_factor":2.6337},{"match_name":"PMRPC September 2018 USPSA","match_date":"2018-09-08","stage_classifiercode":"03-04","member_number":"A44363","first_name":"COLLIN","last_name":"SMITH","classification":"A","division":"OPEN","hit_factor":2.6263},{"match_name":"Hosemonster Action  ","match_date":"2021-05-16","stage_classifiercode":"03-04","member_number":"L3390","first_name":"JOHN","last_name":"WHEELER","classification":"A","division":"OPEN","hit_factor":2.5959},{"match_name":"Cactus USPSA February 2021","match_date":"2021-02-07","stage_classifiercode":"03-04","member_number":"FY74995","first_name":"CHUCK","last_name":"EMERY","classification":"D","division":"OPEN","hit_factor":2.5782},{"match_name":"HPPS 2-18-2017","match_date":"2017-02-16","stage_classifiercode":"03-04","member_number":"A87194","first_name":"GARRETT","last_name":"MCKIERNAN","classification":"U","division":"OPEN","hit_factor":2.5606},{"match_name":"Mesilla Valley P October 2020","match_date":"2020-10-18","stage_classifiercode":"03-04","member_number":"A124420","first_name":"TERILYN","last_name":"WOOD","classification":"D","division":"OPEN","hit_factor":2.5478},{"match_name":"Feb Uspsa H&H Match","match_date":"2017-02-26","stage_classifiercode":"03-04","member_number":"A65023","first_name":"JOHN","last_name":"GOBER","classification":"C","division":"OPEN","hit_factor":2.5244},{"match_name":"WVPPS Feb. 2018","match_date":"2018-02-25","stage_classifiercode":"03-04","member_number":"A33002","first_name":"STEVE","last_name":"CRICHFIELD","classification":"B","division":"OPEN","hit_factor":2.5176},{"match_name":"NISA April Classifer Match 2016","match_date":"2016-04-24","stage_classifiercode":"03-04","member_number":"A76615","first_name":"VIRGIL","last_name":"CORRO","classification":"U","division":"OPEN","hit_factor":2.4718},{"match_name":"MCAS USPSA October 2016","match_date":"2016-10-15","stage_classifiercode":"03-04","member_number":"FY69896","first_name":"JIM","last_name":"SANDERS","classification":"B","division":"OPEN","hit_factor":2.4624},{"match_name":"EAGC March 2017 USPSA Pistol Match","match_date":"2017-03-19","stage_classifiercode":"03-04","member_number":"\"\"","first_name":"C.Y.","last_name":"DODD","classification":"U","division":"OPEN","hit_factor":2.449},{"match_name":"MISS USPSA 4-5-17","match_date":"2017-04-05","stage_classifiercode":"03-04","member_number":"A73683","first_name":"BRYAN","last_name":"TECSON","classification":"B","division":"OPEN","hit_factor":2.439},{"match_name":"Clinton County USPSA Oct 22 2016","match_date":"2016-10-22","stage_classifiercode":"03-04","member_number":"PEN","first_name":"BRUCE","last_name":"WILLIAMSON","classification":"\"\"","division":"OPEN","hit_factor":2.4364},{"match_name":"July USPSA","match_date":"2021-07-25","stage_classifiercode":"03-04","member_number":"TY78363","first_name":"BOB","last_name":"FISHER","classification":"C","division":"OPEN","hit_factor":2.381},{"match_name":"Parma 2018 April USPSA","match_date":"2018-04-21","stage_classifiercode":"03-04","member_number":"ty80321","first_name":"DAN","last_name":"HAWKINS","classification":"A","division":"OPEN","hit_factor":2.381},{"match_name":"TAC2 USPSA Dec 2017","match_date":"2017-12-02","stage_classifiercode":"03-04","member_number":"A98619","first_name":"ROCCO","last_name":"PRESTON","classification":"U","division":"OPEN","hit_factor":2.3769},{"match_name":"CCPL 10112015","match_date":"2015-10-11","stage_classifiercode":"03-04","member_number":"A83627","first_name":"HAL","last_name":"ROBERTS","classification":"D","division":"OPEN","hit_factor":2.336},{"match_name":"SPSA USPSA October 4th Sat match","match_date":"2016-10-22","stage_classifiercode":"03-04","member_number":"L3986","first_name":"CHRIS","last_name":"WILLAUER","classification":"C","division":"OPEN","hit_factor":2.3349},{"match_name":"Quantico QPS December 13 USPSA","match_date":"2015-12-13","stage_classifiercode":"03-04","member_number":"TY77564","first_name":"KEVIN","last_name":"MCPHEE","classification":"C","division":"OPEN","hit_factor":2.3316},{"match_name":"PCSI USPSA 2018   April Classifier Match 2","match_date":"2018-04-07","stage_classifiercode":"03-04","member_number":"A16885","first_name":"MIKE","last_name":"CARNEY","classification":"D","division":"OPEN","hit_factor":2.3124},{"match_name":"HPPS 10-16-2021","match_date":"2021-10-16","stage_classifiercode":"03-04","member_number":"A91619","first_name":"SONNY","last_name":"CHAN","classification":"B","division":"OPEN","hit_factor":2.3107},{"match_name":"Idaho ISPS August 4th 2018","match_date":"2018-08-04","stage_classifiercode":"03-04","member_number":"TY99310","first_name":"JIM","last_name":"HICKS","classification":"B","division":"OPEN","hit_factor":2.3022},{"match_name":"Custer USPSA Mar 7th 2021","match_date":"2021-03-07","stage_classifiercode":"03-04","member_number":"L4865","first_name":"CLIFFORD","last_name":"AGUILAR","classification":"C","division":"OPEN","hit_factor":2.2863},{"match_name":"Pelham USPSA 2018-08-19","match_date":"2018-08-19","stage_classifiercode":"03-04","member_number":"A103354","first_name":"STEVEN","last_name":"CHAET","classification":"C","division":"OPEN","hit_factor":2.265},{"match_name":"PIPS 06-28-2017","match_date":"2017-06-28","stage_classifiercode":"03-04","member_number":"A81396","first_name":"TERRY","last_name":"ESTREM","classification":"C","division":"OPEN","hit_factor":2.2537},{"match_name":"SSS USPSA March 2020 - All Classifier","match_date":"2020-03-22","stage_classifiercode":"03-04","member_number":"A116907","first_name":"JUSTIN","last_name":"MARTIN","classification":"U (Unclassified)","division":"OPEN","hit_factor":2.2265},{"match_name":"Gem City Gun Club 5-5 and 5-6-18","match_date":"2018-05-05","stage_classifiercode":"03-04","member_number":"A102935","first_name":"MIKE","last_name":"DAUENHAUER","classification":"B","division":"OPEN","hit_factor":2.2059},{"match_name":"Wvpps August 2016","match_date":"2016-08-21","stage_classifiercode":"03-04","member_number":"ty84708","first_name":"GALE","last_name":"BRIGHT","classification":"D","division":"OPEN","hit_factor":2.1978},{"match_name":"-Triforce Practical Shooters at BigWoodsGoods 11-1-18","match_date":"2018-11-01","stage_classifiercode":"03-04","member_number":"A97282","first_name":"RAY","last_name":"RUTLEDGE","classification":"D","division":"OPEN","hit_factor":2.1907},{"match_name":"RMAP 3rd Sunday Marh 2016","match_date":"2016-03-20","stage_classifiercode":"03-04","member_number":"\"\"","first_name":"BEN","last_name":"MCDONALD","classification":"U","division":"OPEN","hit_factor":2.1864},{"match_name":"Colonial Rifle and Pistol Club September 2020","match_date":"2020-09-05","stage_classifiercode":"03-04","member_number":"A107578","first_name":"JOSE","last_name":"SANTIAGO","classification":"U","division":"OPEN","hit_factor":2.1861},{"match_name":"LTD Pistol - August 2018","match_date":"2018-08-04","stage_classifiercode":"03-04","member_number":"TY78631","first_name":"KENNETH","last_name":"WRIGHT","classification":"C","division":"OPEN","hit_factor":2.1847},{"match_name":"Texarkana Gun Club USPSA Match - Level 1 for May 2021","match_date":"2021-05-01","stage_classifiercode":"03-04","member_number":"A85485","first_name":"ART","last_name":"SKUPIEN","classification":"D","division":"OPEN","hit_factor":2.1675},{"match_name":"ACPSA January 2017","match_date":"2017-01-28","stage_classifiercode":"03-04","member_number":"\"\"","first_name":"CURTIS","last_name":"SPAULDING","classification":"U","division":"OPEN","hit_factor":2.1431},{"match_name":"Cactus USPSA February 2021","match_date":"2021-02-07","stage_classifiercode":"03-04","member_number":"A108405","first_name":"DON","last_name":"PUCHATY","classification":"U","division":"OPEN","hit_factor":2.1205},{"match_name":"YRPA JULY USPA 2017","match_date":"2017-07-23","stage_classifiercode":"03-04","member_number":"A61656","first_name":"ROBERT","last_name":"HAWKS","classification":"D","division":"OPEN","hit_factor":2.1182},{"match_name":"MS06 Team Magnolia USPSA October Match","match_date":"2015-10-04","stage_classifiercode":"03-04","member_number":"A77783","first_name":"GREG","last_name":"GREENE","classification":"B","division":"OPEN","hit_factor":2.1005},{"match_name":"Gem City Gun Club 5-5 and 5-6-18","match_date":"2018-05-05","stage_classifiercode":"03-04","member_number":"TY91700","first_name":"JEFF","last_name":"MORSE","classification":"B","division":"OPEN","hit_factor":2.0633},{"match_name":"SPSA USPSA December 4th Sat match","match_date":"2018-12-22","stage_classifiercode":"03-04","member_number":"A100238","first_name":"ROBERT","last_name":"HUMPHRIES","classification":"U","division":"OPEN","hit_factor":2.0583},{"match_name":"Laser Ninja Dragon League USPSA September 2017 fixed","match_date":"2017-09-03","stage_classifiercode":"03-04","member_number":"A101554","first_name":"ALBERT","last_name":"MONTANEZ","classification":"C","division":"OPEN","hit_factor":2.0548},{"match_name":"Laser Ninja Dragon League USPSA September 2017 fixed","match_date":"2017-09-03","stage_classifiercode":"03-04","member_number":"\"\"","first_name":"MOE","last_name":"GOURRIER","classification":"U","division":"OPEN","hit_factor":2.0475},{"match_name":"RCSC USPSA 24 July 2016","match_date":"2016-07-24","stage_classifiercode":"03-04","member_number":"PEND","first_name":"JASON","last_name":"CAHILL","classification":"U","division":"OPEN","hit_factor":2.0418},{"match_name":"ISPS 4/17/2016 USPSA","match_date":"2016-04-17","stage_classifiercode":"03-04","member_number":"A89072","first_name":"CODY","last_name":"KROPP","classification":"B","division":"OPEN","hit_factor":2.0408},{"match_name":"Gem City Gun Club 5-5 and 5-6-18","match_date":"2018-05-05","stage_classifiercode":"03-04","member_number":"TY37593","first_name":"JOSHUA","last_name":"BLAZEK","classification":"B","division":"OPEN","hit_factor":2.0298},{"match_name":"OGCIDPA10/1/15","match_date":"2015-10-01","stage_classifiercode":"03-04","member_number":"TY688896","first_name":"CHESTER","last_name":"ROSS","classification":"\"\"","division":"OPEN","hit_factor":2.0217},{"match_name":"Richmond Boro Gun Club March 2017 USPSA Pistol Match","match_date":"2017-03-25","stage_classifiercode":"03-04","member_number":"FY92775","first_name":"CLIFFORD","last_name":"AVERSANO","classification":"D","division":"OPEN","hit_factor":2.0134},{"match_name":"NRG April 23 2016","match_date":"2016-04-23","stage_classifiercode":"03-04","member_number":"TY53764","first_name":"ART","last_name":"FUENTES","classification":"C","division":"OPEN","hit_factor":1.9967},{"match_name":"Maine Practical Shooters November 2020","match_date":"2020-11-01","stage_classifiercode":"03-04","member_number":"TY85228","first_name":"BILL","last_name":"LAFRENIERE","classification":"U","division":"OPEN","hit_factor":1.9963},{"match_name":"SCCPSA USPSA Jul 17 2021","match_date":"2021-07-17","stage_classifiercode":"03-04","member_number":"87210","first_name":"ERINN","last_name":"O'DONNELL","classification":"D","division":"OPEN","hit_factor":1.9903},{"match_name":"Parma 2018 April USPSA","match_date":"2018-04-21","stage_classifiercode":"03-04","member_number":"A84438","first_name":"TYSON","last_name":"DIXON","classification":"A","division":"OPEN","hit_factor":1.9824},{"match_name":"EAPS July 2016 USPSA","match_date":"2016-07-17","stage_classifiercode":"03-04","member_number":"PEN","first_name":"SAM","last_name":"ACOSTA","classification":"U","division":"OPEN","hit_factor":1.938},{"match_name":"Shot Through The Heart","match_date":"2017-02-26","stage_classifiercode":"03-04","member_number":"A-89574","first_name":"MARNINO","last_name":"PARAS","classification":"D","division":"OPEN","hit_factor":1.9194},{"match_name":"Griffin USPSA Match March 2018","match_date":"2018-03-17","stage_classifiercode":"03-04","member_number":"A109161","first_name":"ROY","last_name":"SCHWARZ","classification":"\"\"","division":"OPEN","hit_factor":1.9178},{"match_name":"YRPA JULY USPA 2017","match_date":"2017-07-23","stage_classifiercode":"03-04","member_number":"FY80708","first_name":"DON","last_name":"BROWN","classification":"B","division":"OPEN","hit_factor":1.907},{"match_name":"Pathfinder July 2021 USPSA","match_date":"2021-07-18","stage_classifiercode":"03-04","member_number":"a30863","first_name":"DAN","last_name":"CASE","classification":"B","division":"OPEN","hit_factor":1.8734},{"match_name":"Richmond Boro Gun Club June 2018 USPSA  Match","match_date":"2018-06-23","stage_classifiercode":"03-04","member_number":"A105434","first_name":"FRED","last_name":"LAFEMINA","classification":"D","division":"OPEN","hit_factor":1.8226},{"match_name":"SPSA USPSA June 1st Sat Match","match_date":"2018-06-02","stage_classifiercode":"03-04","member_number":"\"\"","first_name":"MICHAEL","last_name":"SEYMOUR","classification":"none","division":"OPEN","hit_factor":1.8094},{"match_name":"RCSC USPSA 24 July 2016","match_date":"2016-07-24","stage_classifiercode":"03-04","member_number":"PEND","first_name":"JARED","last_name":"ANTHONY","classification":"U","division":"OPEN","hit_factor":1.8062},{"match_name":"EAPS February 2018 USPSA","match_date":"2018-02-18","stage_classifiercode":"03-04","member_number":"TY94846","first_name":"RUTH","last_name":"MAHLEY","classification":"C","division":"OPEN","hit_factor":1.8026},{"match_name":"WPS USPSA Monthly Match April 2018","match_date":"2018-04-07","stage_classifiercode":"03-04","member_number":"FY29046","first_name":"DEAN","last_name":"BROWN","classification":"B","division":"OPEN","hit_factor":1.8},{"match_name":"OREGON ARPC CC05 USPSA JULY 14 2018","match_date":"2018-07-14","stage_classifiercode":"03-04","member_number":"TY45892","first_name":"RICHARD","last_name":"BROWNING","classification":"B","division":"OPEN","hit_factor":1.7723},{"match_name":"AIPS  USPSA Weekly 18  April 2017","match_date":"2017-04-18","stage_classifiercode":"03-04","member_number":"A53309","first_name":"JESSE","last_name":"PETERSON","classification":"B","division":"OPEN","hit_factor":1.7579},{"match_name":"BRSP Tuesday Night USPSA Match - Jan 2","match_date":"2018-01-03","stage_classifiercode":"03-04","member_number":"A104411","first_name":"TANK","last_name":"ALBANIL","classification":"U","division":"OPEN","hit_factor":1.7418},{"match_name":"SAPSC Monthly USPSA Classifier Match 20151110","match_date":"2015-11-11","stage_classifiercode":"03-04","member_number":"TY60177","first_name":"CARL","last_name":"RAINEY","classification":"C","division":"OPEN","hit_factor":1.7372},{"match_name":"CIPSC Havana May USPSA","match_date":"2018-05-12","stage_classifiercode":"03-04","member_number":"A99127","first_name":"STEVE","last_name":"FRAZIER","classification":"U","division":"OPEN","hit_factor":1.7333333333333},{"match_name":"GAS July 7th Special Classifier","match_date":"2018-07-07","stage_classifiercode":"03-04","member_number":"A98106","first_name":"JOE","last_name":"HUPTON","classification":"U","division":"OPEN","hit_factor":1.7249},{"match_name":"Fernan USPSA October 2021","match_date":"2021-10-16","stage_classifiercode":"03-04","member_number":"A126674","first_name":"JOSH","last_name":"THIRIOT","classification":"C","division":"OPEN","hit_factor":1.6838},{"match_name":"MPSA USPSA 021718","match_date":"2018-02-17","stage_classifiercode":"03-04","member_number":"L4105","first_name":"GREG","last_name":"HAMMER","classification":"C","division":"OPEN","hit_factor":1.641},{"match_name":"-Triforce Practical Shooters at BigWoodsGoods 11-1-18","match_date":"2018-11-01","stage_classifiercode":"03-04","member_number":"\"\"","first_name":"THORM","last_name":"TURNER","classification":"\"\"","division":"OPEN","hit_factor":1.6376},{"match_name":"GRPC USPSA MARDI GRAS MADNESS","match_date":"2018-02-04","stage_classifiercode":"03-04","member_number":"A56629","first_name":"ROMAN","last_name":"GWISCZ","classification":"B","division":"OPEN","hit_factor":1.6005},{"match_name":"SCCPSA USPSA SEPTEMBER 15 MATCH","match_date":"2018-09-15","stage_classifiercode":"03-04","member_number":"A96961","first_name":"STEPHEN","last_name":"THOMER","classification":"C","division":"OPEN","hit_factor":1.5949},{"match_name":"NPCCC November USPSA","match_date":"2015-11-01","stage_classifiercode":"03-04","member_number":"\"\"","first_name":"JAYSON","last_name":"GAMBOA","classification":"none","division":"OPEN","hit_factor":1.5861},{"match_name":"SSS USPSA May 2020","match_date":"2020-05-17","stage_classifiercode":"03-04","member_number":"TY94159","first_name":"LINDEN","last_name":"BURNSTEIN","classification":"C (C Class)","division":"OPEN","hit_factor":1.5674},{"match_name":"OREGON ARPC CC05 USPSA JULY 14 2018","match_date":"2018-07-14","stage_classifiercode":"03-04","member_number":"L3676","first_name":"BILL","last_name":"LOUIS","classification":"C","division":"OPEN","hit_factor":1.5651},{"match_name":"YRPA JULY USPA 2017","match_date":"2017-07-23","stage_classifiercode":"03-04","member_number":"a100682","first_name":"VICTORIA","last_name":"SCHMIDT","classification":"U","division":"OPEN","hit_factor":1.519},{"match_name":"GAS Special Classifier","match_date":"2016-07-02","stage_classifiercode":"03-04","member_number":"PEN","first_name":"MARY","last_name":"PRENTICE","classification":"U","division":"OPEN","hit_factor":1.5103},{"match_name":"Cactus USPSA February 2021","match_date":"2021-02-07","stage_classifiercode":"03-04","member_number":"a88737","first_name":"GEORGE","last_name":"VESELY","classification":"C","division":"OPEN","hit_factor":1.4717},{"match_name":"NVGC Centerfire Match April 8 2017","match_date":"2017-04-08","stage_classifiercode":"03-04","member_number":"\"\"","first_name":"ALLEN","last_name":"ESTES","classification":"\"\"","division":"OPEN","hit_factor":1.4593},{"match_name":"Laser Ninja Dragon League USPSA September 2017 fixed","match_date":"2017-09-03","stage_classifiercode":"03-04","member_number":"TY92650","first_name":"THOMAS","last_name":"GILES","classification":"U","division":"OPEN","hit_factor":1.4366},{"match_name":"MS06 Team Magnolia USPSA October Match","match_date":"2015-10-04","stage_classifiercode":"03-04","member_number":"A75410","first_name":"SHARON","last_name":"WOMACK","classification":"D","division":"OPEN","hit_factor":1.4278},{"match_name":"EAPS February 2018 USPSA","match_date":"2018-02-18","stage_classifiercode":"03-04","member_number":"TY91659","first_name":"PETER","last_name":"KEOLA","classification":"B","division":"OPEN","hit_factor":1.383},{"match_name":"RDS USPSA Dec 10 2016 classifier Match","match_date":"2016-12-10","stage_classifiercode":"03-04","member_number":"\"\"","first_name":"CHRIS","last_name":"YATES","classification":"U","division":"OPEN","hit_factor":1.3784},{"match_name":"SLOSA January 2016 USPSA","match_date":"2016-01-09","stage_classifiercode":"03-04","member_number":"FY77664","first_name":"BRIAN","last_name":"STURGEON","classification":"A","division":"OPEN","hit_factor":1.2903},{"match_name":"Benton Gun Club-USPSA May27 2018 CLASIFIER","match_date":"2018-05-27","stage_classifiercode":"03-04","member_number":"A82964","first_name":"EDWARD","last_name":"EMRICH","classification":"U","division":"OPEN","hit_factor":1.278},{"match_name":"SAPSC Monthly USPSA Classifier Match 20151110","match_date":"2015-11-11","stage_classifiercode":"03-04","member_number":"\"\"","first_name":"JOSEPH","last_name":"SIMONEAU","classification":"U","division":"OPEN","hit_factor":1.2749},{"match_name":"SCS USPSA Pistol Match with Classifier - November 6 2016","match_date":"2016-11-06","stage_classifiercode":"03-04","member_number":"Fy83606","first_name":"RYAN","last_name":"LUCY","classification":"C","division":"OPEN","hit_factor":1.2673},{"match_name":"Lefthanders Gun Club Practical Shooters September 2 and 3","match_date":"2017-09-02","stage_classifiercode":"03-04","member_number":"TY60499","first_name":"TOM","last_name":"CASH","classification":"B","division":"OPEN","hit_factor":1.257},{"match_name":"RMAP 3rd Sunday Marh 2016","match_date":"2016-03-20","stage_classifiercode":"03-04","member_number":"TY69350","first_name":"TERRY","last_name":"THOMPSON","classification":"D","division":"OPEN","hit_factor":1.2491},{"match_name":"AIPS Weekly USPSA 24 July 2018","match_date":"2018-07-24","stage_classifiercode":"03-04","member_number":"TY97332","first_name":"CLIFFORD","last_name":"SCOTT","classification":"C","division":"OPEN","hit_factor":1.2081},{"match_name":"ACPSA January 2017","match_date":"2017-01-28","stage_classifiercode":"03-04","member_number":"\"\"","first_name":"MIKE","last_name":"HICKS","classification":"U","division":"OPEN","hit_factor":1.2059},{"match_name":"Richmond Boro Gun Club March 2017 USPSA Pistol Match","match_date":"2017-03-25","stage_classifiercode":"03-04","member_number":"TY97124","first_name":"JOE","last_name":"SANTACROCE","classification":"U","division":"OPEN","hit_factor":1.199},{"match_name":"WGC WI USPSA Monthly Match 5-19-18","match_date":"2018-05-19","stage_classifiercode":"03-04","member_number":"A20556","first_name":"DON","last_name":"ZIMMERMAN","classification":"B","division":"OPEN","hit_factor":1.1472},{"match_name":"Richmond Hot Shots February 20 and 21 - 2016 USPSA Match","match_date":"2016-02-20","stage_classifiercode":"03-04","member_number":"A88773","first_name":"EPHRAIM","last_name":"SAN FELIPE","classification":"C","division":"OPEN","hit_factor":1.1454},{"match_name":"OREGON ARPC CC05 USPSA JULY 14 2018","match_date":"2018-07-14","stage_classifiercode":"03-04","member_number":"FY51479","first_name":"NANCY","last_name":"MARRS","classification":"D","division":"OPEN","hit_factor":1.1429},{"match_name":"HPPS 10-16-2021","match_date":"2021-10-16","stage_classifiercode":"03-04","member_number":"A105529","first_name":"STEVE","last_name":"BERGUM","classification":"A","division":"OPEN","hit_factor":1.0929},{"match_name":"Gem City Gun Club 5-5 and 5-6-18","match_date":"2018-05-05","stage_classifiercode":"03-04","member_number":"A97690","first_name":"WALTER","last_name":"ZIMMER","classification":"U","division":"OPEN","hit_factor":1.0807},{"match_name":"FVPS November USPSA Match","match_date":"2018-11-03","stage_classifiercode":"03-04","member_number":"A98718","first_name":"DENISE","last_name":"PLESETZ","classification":"D","division":"OPEN","hit_factor":1.0638},{"match_name":"ASC USPSA ","match_date":"2017-04-15","stage_classifiercode":"03-04","member_number":"A99920","first_name":"FREDDY","last_name":"LADORES","classification":"D","division":"OPEN","hit_factor":1.0464},{"match_name":"Low Country USPSA  March 24th","match_date":"2018-03-24","stage_classifiercode":"03-04","member_number":"A99924","first_name":"CLAYTON","last_name":"RUTAN","classification":"U","division":"OPEN","hit_factor":1.0417},{"match_name":"Hampden RPC July USPSA","match_date":"2017-07-16","stage_classifiercode":"03-04","member_number":"TY69081","first_name":"ROGER","last_name":"GOODE","classification":"\"\"","division":"OPEN","hit_factor":1.0402},{"match_name":"May 8 2021 The Range At True North USPSA Match","match_date":"2021-05-08","stage_classifiercode":"03-04","member_number":"A129373","first_name":"RON","last_name":"BRASWELL","classification":"U","division":"OPEN","hit_factor":1.036},{"match_name":"GPS OCTOBER 2018","match_date":"2018-10-28","stage_classifiercode":"03-04","member_number":"TY103519","first_name":"ARNOLD","last_name":"GEE","classification":"C","division":"OPEN","hit_factor":1.023},{"match_name":"Richmond Boro Gun Club June 2018 USPSA  Match","match_date":"2018-06-23","stage_classifiercode":"03-04","member_number":"A107578","first_name":"JOSE","last_name":"SANTIAGO","classification":"U","division":"OPEN","hit_factor":1.022},{"match_name":"CCAS April 2017","match_date":"2017-04-15","stage_classifiercode":"03-04","member_number":"TY3959","first_name":"FRANCIS","last_name":"LIVINGSTON","classification":"G","division":"OPEN","hit_factor":1.016},{"match_name":"EAPS July 2016 USPSA","match_date":"2016-07-17","stage_classifiercode":"03-04","member_number":"TY95757","first_name":"NICOLE","last_name":"CHAMBERS","classification":"U","division":"OPEN","hit_factor":1.0076},{"match_name":"Richmond Boro Gun Club June 2018 USPSA  Match","match_date":"2018-06-23","stage_classifiercode":"03-04","member_number":"TY92021","first_name":"PETER","last_name":"CRISTALLI","classification":"U","division":"OPEN","hit_factor":0.9668},{"match_name":"ORSA USPSA March 2017 Shaken Not Stirred Special","match_date":"2017-03-18","stage_classifiercode":"03-04","member_number":"L1789","first_name":"ROBERT","last_name":"BALLARD","classification":"C","division":"OPEN","hit_factor":0.9569},{"match_name":"Custer USPSA May","match_date":"2018-05-06","stage_classifiercode":"03-04","member_number":"TY97470","first_name":"DENNIS","last_name":"MAHLE","classification":"B","division":"OPEN","hit_factor":0.9302},{"match_name":"AVAP CLASSIFIER 71418","match_date":"2018-07-14","stage_classifiercode":"03-04","member_number":"L4383","first_name":"BRYAN","last_name":"LARSON","classification":"A","division":"OPEN","hit_factor":0.8973},{"match_name":"EAGC March 2017 USPSA Pistol Match","match_date":"2017-03-19","stage_classifiercode":"03-04","member_number":"TY19303","first_name":"BRAD","last_name":"GRIFFIN","classification":"G","division":"OPEN","hit_factor":0.885},{"match_name":"CCPL 10112015","match_date":"2015-10-11","stage_classifiercode":"03-04","member_number":"L3390","first_name":"JOHN","last_name":"WHEELER","classification":"A","division":"OPEN","hit_factor":0.8485},{"match_name":"CIPSC IL02 Havana June USPSA","match_date":"2021-06-12","stage_classifiercode":"03-04","member_number":"TY58309","first_name":"ERIC","last_name":"HENSON","classification":"B","division":"OPEN","hit_factor":0.8371},{"match_name":"ACPSA January 2017","match_date":"2017-01-28","stage_classifiercode":"03-04","member_number":"TY34497","first_name":"PATRICK","last_name":"GAUVIN","classification":"A","division":"OPEN","hit_factor":0.8368},{"match_name":"Homestead USPSA July Match","match_date":"2018-07-07","stage_classifiercode":"03-04","member_number":"\"\"","first_name":"LEROY","last_name":"GARCIA","classification":"U","division":"OPEN","hit_factor":0.779},{"match_name":"Minnetonka game and fish June 30","match_date":"2021-06-30","stage_classifiercode":"03-04","member_number":"Fy51432","first_name":"FRANK","last_name":"SKOG","classification":"C","division":"OPEN","hit_factor":0.7772},{"match_name":"Colonial Rifle and Pistol Club September 2020","match_date":"2020-09-05","stage_classifiercode":"03-04","member_number":"A119395","first_name":"ROD","last_name":"ALIPIO","classification":"U","division":"OPEN","hit_factor":0.7},{"match_name":"RCPS USPSA Nov 14","match_date":"2020-11-14","stage_classifiercode":"03-04","member_number":"TY100969","first_name":"DAVID","last_name":"BARNES","classification":"C","division":"OPEN","hit_factor":0.6856},{"match_name":"LCSC USPSA   8-13-17","match_date":"2017-08-08","stage_classifiercode":"03-04","member_number":"TY17701","first_name":"BERNARDO","last_name":"DIONISIO","classification":"B","division":"OPEN","hit_factor":0.6764},{"match_name":"SPSA USPSA December 4th Sat match","match_date":"2018-12-22","stage_classifiercode":"03-04","member_number":"TY90226","first_name":"JAMES","last_name":"TURNURE","classification":"G","division":"OPEN","hit_factor":0.6443},{"match_name":"Minot USPSA 2-18-18","match_date":"2018-02-18","stage_classifiercode":"03-04","member_number":"A71597","first_name":"DEANE","last_name":"GRAVES","classification":"M","division":"OPEN","hit_factor":0.639},{"match_name":"CIPSC IL02 Havana June USPSA","match_date":"2021-06-12","stage_classifiercode":"03-04","member_number":"FY95946","first_name":"PAUL","last_name":"EMERY","classification":"B","division":"OPEN","hit_factor":0.6346},{"match_name":"Richmond Hot Shots February 20 and 21 - 2016 USPSA Match","match_date":"2016-02-20","stage_classifiercode":"03-04","member_number":"A92465","first_name":"JOSE","last_name":"RAPADAS","classification":"C","division":"OPEN","hit_factor":0.6044},{"match_name":"Pathfinder July 2021 USPSA","match_date":"2021-07-18","stage_classifiercode":"03-04","member_number":"L3604","first_name":"JIM","last_name":"WHEELER","classification":"A","division":"OPEN","hit_factor":0.6008},{"match_name":"Briar Rabbit May 2016 Match OH20","match_date":"2016-05-22","stage_classifiercode":"03-04","member_number":"A80746","first_name":"MIKE","last_name":"WILSON","classification":"C","division":"OPEN","hit_factor":0.5941},{"match_name":"Pinetucky USPSA 03-18-17","match_date":"2017-03-18","stage_classifiercode":"03-04","member_number":"\"\"","first_name":"JOHN","last_name":"MARTIN","classification":"U","division":"OPEN","hit_factor":0.5915},{"match_name":"Portage-Summit Field and Stream - OH17 - 2015-10-17","match_date":"2015-10-17","stage_classifiercode":"03-04","member_number":"A81835","first_name":"DON","last_name":"MAHER","classification":"C","division":"OPEN","hit_factor":0.578},{"match_name":"Dundee USPSA Feb 2016","match_date":"2016-02-27","stage_classifiercode":"03-04","member_number":"TY82604","first_name":"LISA","last_name":"RYAN","classification":"D","division":"OPEN","hit_factor":0.5376},{"match_name":"CSA  COALFIELDS SHOOTERS ASSOCIATION USPSA JULY 2020","match_date":"2020-07-12","stage_classifiercode":"03-04","member_number":"TY104241","first_name":"DAVID","last_name":"BOWEN 2","classification":"A","division":"OPEN","hit_factor":0.5254},{"match_name":"Briar Rabbit May 2016 Match OH20","match_date":"2016-05-22","stage_classifiercode":"03-04","member_number":"A91663","first_name":"DEREK","last_name":"MARTIN","classification":"U","division":"OPEN","hit_factor":0.4119},{"match_name":"Custer USPSA Mar 7th 2021","match_date":"2021-03-07","stage_classifiercode":"03-04","member_number":"FY122523","first_name":"WISLY","last_name":"MARTINEZ","classification":"D","division":"OPEN","hit_factor":0.4032},{"match_name":"MCRC USPSA March 2020","match_date":"2020-03-14","stage_classifiercode":"03-04","member_number":"TY98542","first_name":"BARRON","last_name":"SMITH","classification":"B","division":"OPEN","hit_factor":0.3891},{"match_name":"MCAS USPSA October 2016","match_date":"2016-10-15","stage_classifiercode":"03-04","member_number":"A95730","first_name":"PATTI","last_name":"LAHAIE","classification":"D","division":"OPEN","hit_factor":0.3843},{"match_name":"TPS USPSA at CMP March 17 2018","match_date":"2018-03-17","stage_classifiercode":"03-04","member_number":"A-106412","first_name":"STEVE","last_name":"WEBB","classification":"U","division":"OPEN","hit_factor":0.3776},{"match_name":"Richmond Boro Gun Club March 2017 USPSA Pistol Match","match_date":"2017-03-25","stage_classifiercode":"03-04","member_number":"\"\"","first_name":"QUILBVIO","last_name":"ESPINAL","classification":"U","division":"OPEN","hit_factor":0.3723},{"match_name":"ECPS USPSA 17 Dec 16","match_date":"2016-12-17","stage_classifiercode":"03-04","member_number":"A99144","first_name":"CADYN","last_name":"CARROLL","classification":"U","division":"OPEN","hit_factor":0.3697},{"match_name":"BRSP Tuesday Night USPSA Match - Jan 2","match_date":"2018-01-03","stage_classifiercode":"03-04","member_number":"\"\"","first_name":"TR","last_name":"BRAKAHAUGEN","classification":"\"\"","division":"OPEN","hit_factor":0.3552},{"match_name":"SAPSC Monthly USPSA Classifier Match 20161011","match_date":"2016-10-11","stage_classifiercode":"03-04","member_number":"L3208","first_name":"RANDY","last_name":"ARROWOOD","classification":"M","division":"OPEN","hit_factor":0.3311},{"match_name":"MCAS USPSA October 2016","match_date":"2016-10-15","stage_classifiercode":"03-04","member_number":"TY78129","first_name":"SHARON","last_name":"ELIASSON","classification":"D","division":"OPEN","hit_factor":0.1943},{"match_name":"SPSA USPSA December 4th Sat match","match_date":"2018-12-22","stage_classifiercode":"03-04","member_number":"A82536","first_name":"BRAD","last_name":"BANKS","classification":"B","division":"OPEN","hit_factor":0.1901},{"match_name":"NRG April 23 2016","match_date":"2016-04-23","stage_classifiercode":"03-04","member_number":"\"\"","first_name":"CHRISTINA","last_name":"GUILLEN","classification":"\"\"","division":"OPEN","hit_factor":0.188},{"match_name":"Dundee USPSA Feb 2016","match_date":"2016-02-27","stage_classifiercode":"03-04","member_number":"L3346","first_name":"FRED","last_name":"FAGUE","classification":"C","division":"OPEN","hit_factor":0.1451},{"match_name":"Dundee USPSA Feb 2016","match_date":"2016-02-27","stage_classifiercode":"03-04","member_number":"\"\"","first_name":"LANI","last_name":"KUANONI","classification":"U","division":"OPEN","hit_factor":0.1232},{"match_name":"TPS USPSA at CMP March 17 2018","match_date":"2018-03-17","stage_classifiercode":"03-04","member_number":"\"\"","first_name":"AL","last_name":"SARRO","classification":"U","division":"OPEN","hit_factor":0.0942},{"match_name":"JCSSA Mar3 2018","match_date":"2018-03-03","stage_classifiercode":"03-04","member_number":"L3175","first_name":"JERRY","last_name":"WAGER","classification":"U","division":"OPEN","hit_factor":0.0711},{"match_name":"Pinetucky USPSA 07-15-17","match_date":"2017-07-15","stage_classifiercode":"03-04","member_number":"A99641","first_name":"DENISE","last_name":"NICODEMUS","classification":"U","division":"OPEN","hit_factor":0.0537}]