[{"match_name":"SWGC USPSA Pistol Match - December 2018","match_date":"2018-12-01","stage_classifiercode":"06-10","member_number":"TY40238","first_name":"SCOTT","last_name":"GASKINS","classification":"M","division":"OPEN","hit_factor":10.7527},{"match_name":"Hosemasters 2nd Sunday August 2017","match_date":"2017-08-13","stage_classifiercode":"06-10","member_number":"TY92648","first_name":"E.T.","last_name":"SAFFON","classification":"M","division":"OPEN","hit_factor":10.453},{"match_name":"EAGC May 2018 USPSA Pistol Match","match_date":"2018-05-20","stage_classifiercode":"06-10","member_number":"A87894","first_name":"DEVEN","last_name":"WAGNER","classification":"A","division":"OPEN","hit_factor":10.2389},{"match_name":"Richmond Hot Shots September 1st-2nd 2018 USPSA Pistol Match","match_date":"2018-09-01","stage_classifiercode":"06-10","member_number":"\"\"","first_name":"GAYLORD","last_name":"GABRIEL","classification":"A","division":"OPEN","hit_factor":10.2041},{"match_name":"Sharp practical shooters March 27 match","match_date":"2016-03-27","stage_classifiercode":"06-10","member_number":"A72358","first_name":"GRANT","last_name":"BRESHEARS","classification":"U","division":"OPEN","hit_factor":10.0671},{"match_name":"Richmond March 6-2015 USPSA Pistol Match","match_date":"2016-03-06","stage_classifiercode":"06-10","member_number":"A92636","first_name":"JORDAN","last_name":"SU","classification":"U","division":"OPEN","hit_factor":10.0671},{"match_name":"CCPL 04-25-2021","match_date":"2021-04-25","stage_classifiercode":"06-10","member_number":"A127522","first_name":"TYLER","last_name":"LUPER","classification":"A","division":"OPEN","hit_factor":9.9338},{"match_name":"OFGC USPSA Match Oct 16","match_date":"2016-10-16","stage_classifiercode":"06-10","member_number":"A79174","first_name":"BRIXEY","last_name":"NELSON","classification":"A","division":"OPEN","hit_factor":9.9338},{"match_name":"CPS USPSA May 2017","match_date":"2017-05-06","stage_classifiercode":"06-10","member_number":"A84371","first_name":"RYAN","last_name":"GOOLD","classification":"G","division":"OPEN","hit_factor":9.8684},{"match_name":"Collin County USPSA 11-28-2021","match_date":"2021-11-28","stage_classifiercode":"06-10","member_number":"A83433","first_name":"KEN","last_name":"YANG","classification":"M","division":"OPEN","hit_factor":9.8684},{"match_name":"OREGON ARPC CC05 USPSA JUNE 10 2017","match_date":"2017-06-10","stage_classifiercode":"06-10","member_number":"A84371","first_name":"RYAN","last_name":"GOOLD","classification":"G","division":"OPEN","hit_factor":9.8361},{"match_name":"EWPSA 2021-08","match_date":"2021-08-15","stage_classifiercode":"06-10","member_number":"TY35490","first_name":"MARK","last_name":"BRADLEY","classification":"M","division":"OPEN","hit_factor":9.772},{"match_name":"FBURG June 2017 Level I USPSA ","match_date":"2017-06-03","stage_classifiercode":"06-10","member_number":"L3617","first_name":"STEVEN","last_name":"THOMAS","classification":"M","division":"OPEN","hit_factor":9.7403},{"match_name":"CCPL - June 2021","match_date":"2021-06-19","stage_classifiercode":"06-10","member_number":"L3289","first_name":"JEREMIAH","last_name":"SHAFER","classification":"A","division":"OPEN","hit_factor":9.7403},{"match_name":"FBURG March 2021 Level I USPSA ","match_date":"2021-03-06","stage_classifiercode":"06-10","member_number":"L4625","first_name":"ANTHONY","last_name":"BRUNO","classification":"M","division":"OPEN","hit_factor":9.7403},{"match_name":"Nisa April","match_date":"2021-04-25","stage_classifiercode":"06-10","member_number":"Fy80219","first_name":"MAX","last_name":"KLATT","classification":"G","division":"OPEN","hit_factor":9.6774},{"match_name":"APSC USPSA Match 10-07-17","match_date":"2017-10-07","stage_classifiercode":"06-10","member_number":"A82591","first_name":"WADE","last_name":"W","classification":"G","division":"OPEN","hit_factor":9.6774},{"match_name":"GRPC USPSA DO YOU FEEL LUCKY?","match_date":"2021-03-07","stage_classifiercode":"06-10","member_number":"A107262","first_name":"CHRIS","last_name":"SNOW","classification":"A","division":"OPEN","hit_factor":9.6774},{"match_name":"PCWC USPSA  9 26 2020","match_date":"2020-09-26","stage_classifiercode":"06-10","member_number":"ty91756","first_name":"DAVID","last_name":"MARTON","classification":"A","division":"OPEN","hit_factor":9.6463},{"match_name":"Hopkinton August 2016 ","match_date":"2016-08-06","stage_classifiercode":"06-10","member_number":"TY65772","first_name":"STEVE","last_name":"PICHE","classification":"A","division":"OPEN","hit_factor":9.6463},{"match_name":"SAPS Match 3/20/2021","match_date":"2021-03-20","stage_classifiercode":"06-10","member_number":"a121607","first_name":"TJ","last_name":"RISEN 2","classification":"A","division":"OPEN","hit_factor":9.6154},{"match_name":"AIPS Weekly USPSA 21 August 2018","match_date":"2018-08-21","stage_classifiercode":"06-10","member_number":"TY57269","first_name":"CRAIG","last_name":"TAPPE","classification":"G","division":"OPEN","hit_factor":9.6154},{"match_name":"SWGC USPSA Pistol Match - March 2020","match_date":"2020-03-07","stage_classifiercode":"06-10","member_number":"TY104682","first_name":"KEVIN","last_name":"GOROSPE","classification":"M","division":"OPEN","hit_factor":9.6154},{"match_name":"PMSC USPSA JULY 2018","match_date":"2018-07-01","stage_classifiercode":"06-10","member_number":"\"\"","first_name":"WILLIAM","last_name":"DRUMMOND","classification":"\"\"","division":"OPEN","hit_factor":9.5541},{"match_name":"Monson April 2017 USPSA","match_date":"2017-04-23","stage_classifiercode":"06-10","member_number":"TY49143","first_name":"TAD","last_name":"DAVIDSON","classification":"M","division":"OPEN","hit_factor":9.5238},{"match_name":"MCAS USPSA March 2016","match_date":"2016-03-19","stage_classifiercode":"06-10","member_number":"TY23626","first_name":"SCOTT","last_name":"NIELSEN","classification":"G","division":"OPEN","hit_factor":9.4937},{"match_name":"Monson April 2017 USPSA","match_date":"2017-04-23","stage_classifiercode":"06-10","member_number":"A92399","first_name":"JUSTIN","last_name":"LANDRY","classification":"G","division":"OPEN","hit_factor":9.4637},{"match_name":"Pima Pistol Club October 9th USPSA w\\Classifier","match_date":"2016-10-09","stage_classifiercode":"06-10","member_number":"A4064","first_name":"GEOFF","last_name":"RALLINO","classification":"G","division":"OPEN","hit_factor":9.434},{"match_name":"FLPSA MN14 USPSA April 26 2018","match_date":"2018-04-26","stage_classifiercode":"06-10","member_number":"Fy78025","first_name":"ROBERT","last_name":"STRANGE","classification":"U","division":"OPEN","hit_factor":9.434},{"match_name":"Deadwood Boys USPSA All Classifier Match - 29 July 2018","match_date":"2018-07-29","stage_classifiercode":"06-10","member_number":"A103847","first_name":"CHRIS","last_name":"CORCINO","classification":"U","division":"OPEN","hit_factor":9.375},{"match_name":"Nampa USPSA July 31st 2021","match_date":"2021-07-31","stage_classifiercode":"06-10","member_number":"TY106643","first_name":"EUGENE","last_name":"DINA","classification":"A","division":"OPEN","hit_factor":9.375},{"match_name":"OFGC USPSA Match Oct 16","match_date":"2016-10-16","stage_classifiercode":"06-10","member_number":"TY42278","first_name":"KELLY","last_name":"RAGLIN","classification":"M","division":"OPEN","hit_factor":9.375},{"match_name":"WSRC USPSA 7-21/22-2018","match_date":"2018-07-21","stage_classifiercode":"06-10","member_number":"L4272","first_name":"ALEX","last_name":"MAY","classification":"U","division":"OPEN","hit_factor":9.3458},{"match_name":"SWGC USPSA Pistol Match - December 2018","match_date":"2018-12-01","stage_classifiercode":"06-10","member_number":"TY39081","first_name":"ROB","last_name":"JESSEE","classification":"M","division":"OPEN","hit_factor":9.3458},{"match_name":"Shadow Hawk Defense USPSA - Aug","match_date":"2021-08-14","stage_classifiercode":"06-10","member_number":"A103386","first_name":"CESAR","last_name":"SANCHEZ","classification":"B","division":"OPEN","hit_factor":9.3458},{"match_name":"Pioneer Action Shooters USPSA 5-23-21 Special Classifer","match_date":"2021-05-23","stage_classifiercode":"06-10","member_number":"TY111079","first_name":"MIKE","last_name":"PAN","classification":"M","division":"OPEN","hit_factor":9.3168},{"match_name":"PTPC November 4th  USPSA Match","match_date":"2018-11-04","stage_classifiercode":"06-10","member_number":"A30996","first_name":"MIKE","last_name":"BYTNAR","classification":"A","division":"OPEN","hit_factor":9.2879},{"match_name":"Hampden RPC May USPSA","match_date":"2016-05-01","stage_classifiercode":"06-10","member_number":"A92399","first_name":"JUSTIN","last_name":"LANDRY","classification":"B","division":"OPEN","hit_factor":9.2879},{"match_name":"ISPS JULY 2nd 2016","match_date":"2016-07-02","stage_classifiercode":"06-10","member_number":"A85172","first_name":"MIKE","last_name":"O'LEARY","classification":"M","division":"OPEN","hit_factor":9.2593},{"match_name":"NCPS USPSA Handgun Match March 25 2018z","match_date":"2018-03-25","stage_classifiercode":"06-10","member_number":"L3657","first_name":"JAMES","last_name":"ONG","classification":"G","division":"OPEN","hit_factor":9.2593},{"match_name":"LCSC Linden USPSA 120918","match_date":"2018-12-09","stage_classifiercode":"06-10","member_number":"Fy81272","first_name":"GAYLORD","last_name":"GABRIEL","classification":"A","division":"OPEN","hit_factor":9.2308},{"match_name":"ORSA USPSA October 2020","match_date":"2020-10-17","stage_classifiercode":"06-10","member_number":"TY87361","first_name":"PAUL","last_name":"KERR","classification":"M","division":"OPEN","hit_factor":9.2308},{"match_name":"September CAS Match","match_date":"2015-09-06","stage_classifiercode":"06-10","member_number":"FY81419","first_name":"JOHN","last_name":"NGUYEN","classification":"A","division":"OPEN","hit_factor":9.2025},{"match_name":"MASTER BLASTERS & SSFGA USPSA - September","match_date":"2021-09-18","stage_classifiercode":"06-10","member_number":"Ty111079","first_name":"MIKE","last_name":"PAN","classification":"M","division":"OPEN","hit_factor":9.2025},{"match_name":"Richmond hotshots April 16-17 2016 USPSA Pistol match","match_date":"2016-04-16","stage_classifiercode":"06-10","member_number":"L3657","first_name":"JAMES","last_name":"ONG","classification":"G","division":"OPEN","hit_factor":9.2025},{"match_name":"DGC USPSA 01-14-18","match_date":"2018-01-14","stage_classifiercode":"06-10","member_number":"A81428","first_name":"TY","last_name":"COBB","classification":"B","division":"OPEN","hit_factor":9.1743},{"match_name":"CCPL - June 2021","match_date":"2021-06-19","stage_classifiercode":"06-10","member_number":"L3289","first_name":"JEREMIAH","last_name":"SHAFER","classification":"A","division":"OPEN","hit_factor":9.1743},{"match_name":"Oregon ARPC November Match","match_date":"2015-11-14","stage_classifiercode":"06-10","member_number":"TY63731","first_name":"JAN","last_name":"HASE","classification":"M","division":"OPEN","hit_factor":9.1463},{"match_name":"SPSA USPSA March 4th Sat match","match_date":"2021-03-27","stage_classifiercode":"06-10","member_number":"L2568","first_name":"JAMES","last_name":"NORTZ","classification":"G","division":"OPEN","hit_factor":9.1463},{"match_name":"Sandbagger Classic 2021","match_date":"2021-07-31","stage_classifiercode":"06-10","member_number":"A121487","first_name":"JESSE","last_name":"RAY","classification":"B","division":"OPEN","hit_factor":9.0361},{"match_name":"EAGC May 2018 USPSA Pistol Match","match_date":"2018-05-20","stage_classifiercode":"06-10","member_number":"TY87135","first_name":"ENVER","last_name":"FOCAKOVIC","classification":"A","division":"OPEN","hit_factor":8.982},{"match_name":"Green Valley March 2017","match_date":"2017-03-25","stage_classifiercode":"06-10","member_number":"A47787","first_name":"SCOTT","last_name":"LANE","classification":"M","division":"OPEN","hit_factor":8.982},{"match_name":"MPSA 2020-01-02","match_date":"2021-01-02","stage_classifiercode":"06-10","member_number":"A92317","first_name":"KYLE","last_name":"HUFF","classification":"B","division":"OPEN","hit_factor":8.9552},{"match_name":"Monson April 2017 USPSA","match_date":"2017-04-23","stage_classifiercode":"06-10","member_number":"TY90354","first_name":"BRIAN","last_name":"HARRINGTON","classification":"B","division":"OPEN","hit_factor":8.9552},{"match_name":"Richmond Hot Shots September 1st-2nd 2018 USPSA Pistol Match","match_date":"2018-09-01","stage_classifiercode":"06-10","member_number":"A85939","first_name":"NILO","last_name":"NUNEZ II","classification":"G","division":"OPEN","hit_factor":8.9552},{"match_name":"OFGC USPSA Match 11-18-17","match_date":"2017-11-18","stage_classifiercode":"06-10","member_number":"TY42278","first_name":"KELLY","last_name":"RAGLIN","classification":"M","division":"OPEN","hit_factor":8.9286},{"match_name":"Nampa USPSA July 31st 2021","match_date":"2021-07-31","stage_classifiercode":"06-10","member_number":"TY85985","first_name":"CHRISTOPHER","last_name":"COLLINS","classification":"M","division":"OPEN","hit_factor":8.9286},{"match_name":"Sharp Practical Shooters August USPSA - Outdoor","match_date":"2021-08-22","stage_classifiercode":"06-10","member_number":"L4257","first_name":"SHANE","last_name":"HILL","classification":"G","division":"OPEN","hit_factor":8.9021},{"match_name":"SAPSA May 2016","match_date":"2016-05-21","stage_classifiercode":"06-10","member_number":"B50","first_name":"LUIGI","last_name":"LI","classification":"B","division":"OPEN","hit_factor":8.9021},{"match_name":"Richmond Boro Gun Club October 2017","match_date":"2017-10-21","stage_classifiercode":"06-10","member_number":"TY90280","first_name":"ANTHONY","last_name":"BRUNO","classification":"A","division":"OPEN","hit_factor":8.9021},{"match_name":"EAGC March 2021 USPSA Pistol Match","match_date":"2021-03-21","stage_classifiercode":"06-10","member_number":"A79845","first_name":"JOHNNY","last_name":"REED","classification":"M","division":"OPEN","hit_factor":8.9021},{"match_name":"HRRB 12-01-2018","match_date":"2018-12-01","stage_classifiercode":"06-10","member_number":"A55833","first_name":"FROILAN","last_name":"RIVERO","classification":"GM","division":"OPEN","hit_factor":8.8757},{"match_name":"Hosemasters 2nd Sunday August 2017","match_date":"2017-08-13","stage_classifiercode":"06-10","member_number":"TY72937","first_name":"CHRISTOPHER","last_name":"OOSTHUISEN","classification":"G","division":"OPEN","hit_factor":8.8496},{"match_name":"EAGC May 2018 USPSA Pistol Match","match_date":"2018-05-20","stage_classifiercode":"06-10","member_number":"A106020","first_name":"JACOB","last_name":"TAYLOR","classification":"B","division":"OPEN","hit_factor":8.8496},{"match_name":"EAGC March 2021 USPSA Pistol Match","match_date":"2021-03-21","stage_classifiercode":"06-10","member_number":"A79844","first_name":"JAKE","last_name":"REED","classification":"G","division":"OPEN","hit_factor":8.8496},{"match_name":"Hopkinton August 2016 ","match_date":"2016-08-06","stage_classifiercode":"06-10","member_number":"TY79508","first_name":"SHANE","last_name":"FUNGAFAT","classification":"B","division":"OPEN","hit_factor":8.8496},{"match_name":"Richmond Hot Shots September 1st-2nd 2018 USPSA Pistol Match","match_date":"2018-09-01","stage_classifiercode":"06-10","member_number":"\"\"","first_name":"KENNETH","last_name":"MELTON","classification":"B","division":"OPEN","hit_factor":8.8235},{"match_name":"CSA June 10 2018","match_date":"2018-06-10","stage_classifiercode":"06-10","member_number":"TY85570","first_name":"DAVID","last_name":"MILLER","classification":"U","division":"OPEN","hit_factor":8.8235},{"match_name":"Chillicothe Sportsmens Club December USPSA","match_date":"2020-12-20","stage_classifiercode":"06-10","member_number":"L4807","first_name":"ROB","last_name":"KOSACK","classification":"G","division":"OPEN","hit_factor":8.7719},{"match_name":"FBURG March 2021 Level I USPSA ","match_date":"2021-03-06","stage_classifiercode":"06-10","member_number":"TY88350","first_name":"DAVID","last_name":"WAMPLER","classification":"G","division":"OPEN","hit_factor":8.7719},{"match_name":"OREGON ARPC CC05 USPSA JUNE 10 2017","match_date":"2017-06-10","stage_classifiercode":"06-10","member_number":"A70998","first_name":"JAKE","last_name":"DYER","classification":"M","division":"OPEN","hit_factor":8.7719},{"match_name":"FLPSA MN14 USPSA April 26 2018","match_date":"2018-04-26","stage_classifiercode":"06-10","member_number":"A90179","first_name":"MICHAEL","last_name":"HALL","classification":"G","division":"OPEN","hit_factor":8.7719},{"match_name":"Hosemasters 2nd Sunday August 2017","match_date":"2017-08-13","stage_classifiercode":"06-10","member_number":"A49035","first_name":"EDDIE","last_name":"GARCIA","classification":"G","division":"OPEN","hit_factor":8.7464},{"match_name":"WTPS USPSA September Match 9-9-17","match_date":"2017-09-09","stage_classifiercode":"06-10","member_number":"A101554","first_name":"ALBERT","last_name":"MONTANEZ","classification":"C","division":"OPEN","hit_factor":8.7209},{"match_name":"Nampa USPSA November 7th 2020","match_date":"2020-11-07","stage_classifiercode":"06-10","member_number":"A530","first_name":"JERRY","last_name":"DIX","classification":"M","division":"OPEN","hit_factor":8.7209},{"match_name":"Harvard Action Shooters August 2016 USPSA Pistol","match_date":"2016-08-14","stage_classifiercode":"06-10","member_number":"TY60000","first_name":"GREG","last_name":"SOUCIE","classification":"A","division":"OPEN","hit_factor":8.6957},{"match_name":"SFPC SMTCA","match_date":"2017-04-30","stage_classifiercode":"06-10","member_number":"TY36452","first_name":"SERGIO","last_name":"NUNEZ`","classification":"A","division":"OPEN","hit_factor":8.6957},{"match_name":"FAS Sunday Outdoor USPSA Match","match_date":"2021-08-01","stage_classifiercode":"06-10","member_number":"A115534","first_name":"TONY","last_name":"GREENE","classification":"B","division":"OPEN","hit_factor":8.6705},{"match_name":"LdF USPSA Match May 27 2017","match_date":"2017-05-27","stage_classifiercode":"06-10","member_number":"FY93402","first_name":"GENG","last_name":"NIE","classification":"A","division":"OPEN","hit_factor":8.6705},{"match_name":"EWPSA 2018-01","match_date":"2018-01-21","stage_classifiercode":"06-10","member_number":"A65135","first_name":"DEX","last_name":"BRADLEY","classification":"G","division":"OPEN","hit_factor":8.6705},{"match_name":"YRPA  9/25/16  USPSA Pistol Match","match_date":"2016-09-23","stage_classifiercode":"06-10","member_number":"TY35490","first_name":"MARK C","last_name":"BRADLEY","classification":"M","division":"OPEN","hit_factor":8.6455},{"match_name":"Richmond Hot Shots September 1st-2nd 2018 USPSA Pistol Match","match_date":"2018-09-01","stage_classifiercode":"06-10","member_number":"9826","first_name":"DAVID","last_name":"GEORGE","classification":"M","division":"OPEN","hit_factor":8.6455},{"match_name":"Nampa USPSA November 7th 2020","match_date":"2020-11-07","stage_classifiercode":"06-10","member_number":"TY85985","first_name":"CHRISTOPHER","last_name":"COLLINS","classification":"M","division":"OPEN","hit_factor":8.6455},{"match_name":"DGC USPSA 01-14-18","match_date":"2018-01-14","stage_classifiercode":"06-10","member_number":"A87135","first_name":"ENVER","last_name":"FOCAKOVIC","classification":"A","division":"OPEN","hit_factor":8.6207},{"match_name":"December 2017 CAS USPSA","match_date":"2017-12-03","stage_classifiercode":"06-10","member_number":"TY44221","first_name":"BRANDON","last_name":"GUILLORY","classification":"M","division":"OPEN","hit_factor":8.6207},{"match_name":"Shoot GTR USPSA Classifier 06-10","match_date":"2018-01-03","stage_classifiercode":"06-10","member_number":"TY34497","first_name":"PAT","last_name":"GAUVIN","classification":"A","division":"OPEN","hit_factor":8.596},{"match_name":"MCPSL Pistol 4-10-2021 (Classifier)","match_date":"2021-04-10","stage_classifiercode":"06-10","member_number":"TY100931","first_name":"CALEB","last_name":"PATERSON","classification":"M","division":"OPEN","hit_factor":8.596},{"match_name":"FBURG March 2021 Level I USPSA ","match_date":"2021-03-06","stage_classifiercode":"06-10","member_number":"L4464","first_name":"ERIC","last_name":"WONG","classification":"A","division":"OPEN","hit_factor":8.596},{"match_name":"Richmond March 6-2015 USPSA Pistol Match","match_date":"2016-03-06","stage_classifiercode":"06-10","member_number":"A88783","first_name":"JOHNMAR","last_name":"SAMSON","classification":"B","division":"OPEN","hit_factor":8.596},{"match_name":"Ontelaunee USPSA September 2016","match_date":"2016-09-24","stage_classifiercode":"06-10","member_number":"TY16248","first_name":"BARRY","last_name":"RUANE","classification":"M","division":"OPEN","hit_factor":8.5714},{"match_name":"LCSC Linden USPSA 061018","match_date":"2018-06-10","stage_classifiercode":"06-10","member_number":"A96836","first_name":"JOSEF","last_name":"RAPADAS","classification":"M","division":"OPEN","hit_factor":8.5714},{"match_name":"OOPS May 8th Match","match_date":"2016-05-08","stage_classifiercode":"06-10","member_number":"A89172","first_name":"CASSIE","last_name":"BEAHR","classification":"U","division":"OPEN","hit_factor":8.5714},{"match_name":"Custer December USPSA","match_date":"2016-12-04","stage_classifiercode":"06-10","member_number":"A83199","first_name":"ANDREW","last_name":"HONG","classification":"M","division":"OPEN","hit_factor":8.5714},{"match_name":"WGC WI USPSA Monthly Match 10-21-17","match_date":"2017-10-21","stage_classifiercode":"06-10","member_number":"FY104506","first_name":"KEVIN","last_name":"OWENS","classification":"U","division":"OPEN","hit_factor":8.547},{"match_name":"Steel City USPSA September 3 2016","match_date":"2016-09-03","stage_classifiercode":"06-10","member_number":"TY53706","first_name":"RANDAL","last_name":"WEBB","classification":"M","division":"OPEN","hit_factor":8.547},{"match_name":"SPSA USPSA March 4th Sat match","match_date":"2021-03-27","stage_classifiercode":"06-10","member_number":"TY115432","first_name":"KYLE","last_name":"LEITE","classification":"A","division":"OPEN","hit_factor":8.547},{"match_name":"FBURG March 2021 Level I USPSA ","match_date":"2021-03-06","stage_classifiercode":"06-10","member_number":"A77657","first_name":"JON","last_name":"SARDINA","classification":"B","division":"OPEN","hit_factor":8.547},{"match_name":"Briar Rabbit October2017","match_date":"2017-10-22","stage_classifiercode":"06-10","member_number":"TY76812","first_name":"MIKE","last_name":"WEAVER","classification":"M","division":"OPEN","hit_factor":8.5227},{"match_name":"OKCGC USPSA October 2018","match_date":"2018-10-06","stage_classifiercode":"06-10","member_number":"A71435","first_name":"FEEGEE","last_name":"MATLOCK","classification":"A","division":"OPEN","hit_factor":8.5227},{"match_name":"December 2017 CAS USPSA","match_date":"2017-12-03","stage_classifiercode":"06-10","member_number":"TY63532","first_name":"GEORGE","last_name":"HEMSTAD","classification":"M","division":"OPEN","hit_factor":8.5227},{"match_name":"Richmond Hot Shots July 15-16-2017 USPSA Pistol Match","match_date":"2017-07-15","stage_classifiercode":"06-10","member_number":"A84616","first_name":"MJ","last_name":"FINEZA","classification":"A","division":"OPEN","hit_factor":8.5227},{"match_name":"SPSA USPSA March 4th Sat match","match_date":"2021-03-27","stage_classifiercode":"06-10","member_number":"L4897","first_name":"PATRICK","last_name":"CHAMBERLAIN","classification":"A","division":"OPEN","hit_factor":8.5227},{"match_name":"BGSL First Sunday Match","match_date":"2016-06-05","stage_classifiercode":"06-10","member_number":"A81837","first_name":"CODY","last_name":"BAKER","classification":"G","division":"OPEN","hit_factor":8.5227},{"match_name":"Maine Practical Shooters May 2021","match_date":"2021-05-08","stage_classifiercode":"06-10","member_number":"A98632","first_name":"ZACHARY","last_name":"GREENIER","classification":"M","division":"OPEN","hit_factor":8.4986},{"match_name":"FBURG USPSA November 2021","match_date":"2021-11-07","stage_classifiercode":"06-10","member_number":"A75059","first_name":"JENU RHODE","last_name":"TOMAS","classification":"B","division":"OPEN","hit_factor":8.4986},{"match_name":"SLPSA Jan USPSA","match_date":"2017-01-21","stage_classifiercode":"06-10","member_number":"TY53120","first_name":"BRANDON","last_name":"FARR","classification":"M","division":"OPEN","hit_factor":8.4986},{"match_name":"Salt City practical shooting league 'all classifier match'","match_date":"2020-08-30","stage_classifiercode":"06-10","member_number":"A128171","first_name":"DON","last_name":"SMITH","classification":"U","division":"OPEN","hit_factor":8.4746},{"match_name":"Nampa USPSA March 15th","match_date":"2020-03-15","stage_classifiercode":"06-10","member_number":"A108060","first_name":"LUCAS","last_name":"DINA","classification":"B","division":"OPEN","hit_factor":8.4746},{"match_name":"MPPL 20200301","match_date":"2020-03-01","stage_classifiercode":"06-10","member_number":"NA","first_name":"BRANDON","last_name":"LEHNER","classification":"X- non USPSA member","division":"OPEN","hit_factor":8.4746},{"match_name":"APS August 1st Monthly USPSA Match  Classifier Match","match_date":"2021-08-01","stage_classifiercode":"06-10","member_number":"A114462","first_name":"CHRIS","last_name":"PARKER","classification":"U","division":"OPEN","hit_factor":8.4746},{"match_name":"GCL Saturday 3-6-2021","match_date":"2021-03-06","stage_classifiercode":"06-10","member_number":"a80418","first_name":"ALVA","last_name":"ENGLISH","classification":"A","division":"OPEN","hit_factor":8.4746},{"match_name":"CFRPC November USPSA","match_date":"2018-11-18","stage_classifiercode":"06-10","member_number":"A94563","first_name":"LAMAR","last_name":"STANDISH","classification":"A","division":"OPEN","hit_factor":8.4746},{"match_name":"CGGR May USPSA Match","match_date":"2017-05-20","stage_classifiercode":"06-10","member_number":"L3838","first_name":"NATHAN","last_name":"THOMPSON","classification":"M","division":"OPEN","hit_factor":8.4507},{"match_name":"Nisa April","match_date":"2021-04-25","stage_classifiercode":"06-10","member_number":"Ty98078","first_name":"ALBERT","last_name":"YAU","classification":"A","division":"OPEN","hit_factor":8.427},{"match_name":"FBURG June 2018 Level 1 USPSA","match_date":"2018-06-02","stage_classifiercode":"06-10","member_number":"L4443","first_name":"PAUL","last_name":"WILLIAMS","classification":"B","division":"OPEN","hit_factor":8.4034},{"match_name":"SAPSA May 2016","match_date":"2016-05-21","stage_classifiercode":"06-10","member_number":"TY34497","first_name":"PATRICK","last_name":"GAUVIN","classification":"A","division":"OPEN","hit_factor":8.4034},{"match_name":"LBAS 201017 October Practical Match","match_date":"2020-10-17","stage_classifiercode":"06-10","member_number":"TY88904","first_name":"JOHN","last_name":"SIMS","classification":"A","division":"OPEN","hit_factor":8.4034},{"match_name":"EAGC March 2021 USPSA Pistol Match","match_date":"2021-03-21","stage_classifiercode":"06-10","member_number":"FY89922","first_name":"CHRIS","last_name":"WORKMAN","classification":"M","division":"OPEN","hit_factor":8.3565},{"match_name":"SFPS 05-15-2016 SuperClassifier - First Division","match_date":"2016-05-15","stage_classifiercode":"06-10","member_number":"L3177","first_name":"SHERWYN","last_name":"GREENFIELD","classification":"M","division":"OPEN","hit_factor":8.3565},{"match_name":"Eagles Nest October 16th 2016","match_date":"2016-10-16","stage_classifiercode":"06-10","member_number":"L1963","first_name":"DENNY","last_name":"MICHALI","classification":"A","division":"OPEN","hit_factor":8.3565},{"match_name":"Monson April 2017 USPSA","match_date":"2017-04-23","stage_classifiercode":"06-10","member_number":"A34817","first_name":"DAN","last_name":"DIGIOVINE","classification":"A","division":"OPEN","hit_factor":8.3333},{"match_name":"SWGC USPSA Pistol Match - March 2020","match_date":"2020-03-07","stage_classifiercode":"06-10","member_number":"A90953","first_name":"DAVID","last_name":"CLAY","classification":"A","division":"OPEN","hit_factor":8.3102},{"match_name":"December 2017 CAS USPSA","match_date":"2017-12-03","stage_classifiercode":"06-10","member_number":"A86980","first_name":"BRYAN","last_name":"TULLOS","classification":"A","division":"OPEN","hit_factor":8.2645},{"match_name":"EAGC March 2021 USPSA Pistol Match","match_date":"2021-03-21","stage_classifiercode":"06-10","member_number":"A65135","first_name":"DEXTER","last_name":"BRADLEY","classification":"G","division":"OPEN","hit_factor":8.2645},{"match_name":"Richmond hotshots April 16-17 2016 USPSA Pistol match","match_date":"2016-04-16","stage_classifiercode":"06-10","member_number":"\"\"","first_name":"DEREK","last_name":"KAHOALII","classification":"B","division":"OPEN","hit_factor":8.2418},{"match_name":"Ontelaunee USPSA September 2016","match_date":"2016-09-24","stage_classifiercode":"06-10","member_number":"L2483","first_name":"BRYAN","last_name":"JONES","classification":"G","division":"OPEN","hit_factor":8.2192},{"match_name":"APS August 1st Monthly USPSA Match  Classifier Match","match_date":"2021-08-01","stage_classifiercode":"06-10","member_number":"A131354","first_name":"MIKE","last_name":"ULLOA","classification":"A","division":"OPEN","hit_factor":8.2192},{"match_name":"Hosemasters 2nd Sunday August 2017","match_date":"2017-08-13","stage_classifiercode":"06-10","member_number":"FL3478","first_name":"FRANK","last_name":"KOCH","classification":"M","division":"OPEN","hit_factor":8.2192},{"match_name":"WGC June 2018 USPSA","match_date":"2018-06-10","stage_classifiercode":"06-10","member_number":"TY97639","first_name":"JASON","last_name":"WATTS","classification":"\"\"","division":"OPEN","hit_factor":8.1967},{"match_name":"MS06 Team Magnolia USPSA November Match","match_date":"2016-11-06","stage_classifiercode":"06-10","member_number":"A93372","first_name":"JAMES","last_name":"LOFTON","classification":"B","division":"OPEN","hit_factor":8.1967},{"match_name":"BGSL First Sunday Match","match_date":"2016-06-05","stage_classifiercode":"06-10","member_number":"TY79986","first_name":"TOM","last_name":"SARGENT","classification":"A","division":"OPEN","hit_factor":8.1967},{"match_name":"SWGC USPSA Pistol Match - December 2018","match_date":"2018-12-01","stage_classifiercode":"06-10","member_number":"A97425","first_name":"JORDAN","last_name":"PARKER","classification":"B","division":"OPEN","hit_factor":8.1744},{"match_name":"HRRB 12-01-2018","match_date":"2018-12-01","stage_classifiercode":"06-10","member_number":"L2624","first_name":"MARIO","last_name":"LAYUGAN","classification":"A","division":"OPEN","hit_factor":8.1744},{"match_name":"LCSC Linden USPSA 120918","match_date":"2018-12-09","stage_classifiercode":"06-10","member_number":"FY69835","first_name":"JEREMY","last_name":"JAVIER","classification":"A","division":"OPEN","hit_factor":8.1744},{"match_name":"6ta Fecha USPSA","match_date":"2018-06-24","stage_classifiercode":"06-10","member_number":"TYF88122","first_name":"JOEY","last_name":"RODRIGUEZ","classification":"B","division":"OPEN","hit_factor":8.1522},{"match_name":"Richmond Hot Shots September 1st-2nd 2018 USPSA Pistol Match","match_date":"2018-09-01","stage_classifiercode":"06-10","member_number":"FY18635","first_name":"JAMES Y","last_name":"SABUROMARU","classification":"M","division":"OPEN","hit_factor":8.1522},{"match_name":"Salt City practical shooting league 'all classifier match'","match_date":"2020-08-30","stage_classifiercode":"06-10","member_number":"A48869","first_name":"BRIAN","last_name":"GEE","classification":"M","division":"OPEN","hit_factor":8.1301},{"match_name":"December 2017 CAS USPSA","match_date":"2017-12-03","stage_classifiercode":"06-10","member_number":"L2688","first_name":"STEPHEN","last_name":"LASAVIA","classification":"M","division":"OPEN","hit_factor":8.1301},{"match_name":"Springfield Tactical Shooters 09-07-2017","match_date":"2017-09-07","stage_classifiercode":"06-10","member_number":"L1467","first_name":"CHARLES","last_name":"MORSE","classification":"U","division":"OPEN","hit_factor":8.1081},{"match_name":"ARPC USPSA Match 8-26-18","match_date":"2018-08-26","stage_classifiercode":"06-10","member_number":"L3047","first_name":"HIRO","last_name":"YAMAGUCHI","classification":"M","division":"OPEN","hit_factor":8.1081},{"match_name":"DAP December 2015 Classifier match","match_date":"2015-12-12","stage_classifiercode":"06-10","member_number":"TY74322","first_name":"ANDRE","last_name":"TAUBE","classification":"A","division":"OPEN","hit_factor":8.1081},{"match_name":"Custer December USPSA","match_date":"2016-12-04","stage_classifiercode":"06-10","member_number":"A86982","first_name":"CHRISTIAN","last_name":"SAILER","classification":"B","division":"OPEN","hit_factor":8.1081},{"match_name":"Shasta Shooters 2021 Feb","match_date":"2021-02-13","stage_classifiercode":"06-10","member_number":"TY86827","first_name":"IAN","last_name":"PRINCE","classification":"M","division":"OPEN","hit_factor":8.0863},{"match_name":"Nampa USPSA July 31st 2021","match_date":"2021-07-31","stage_classifiercode":"06-10","member_number":"TY85172","first_name":"MIKE","last_name":"O'LEARY","classification":"M","division":"OPEN","hit_factor":8.0863},{"match_name":"TAP USPSA February 28 2016 (28Feb16-01:01:53)","match_date":"2016-02-28","stage_classifiercode":"06-10","member_number":"TY74322","first_name":"ANDRE","last_name":"TAUBE","classification":"A","division":"OPEN","hit_factor":8.0863},{"match_name":"Richmond Hot Shots September 1st-2nd 2018 USPSA Pistol Match","match_date":"2018-09-01","stage_classifiercode":"06-10","member_number":"\"\"","first_name":"CESAR","last_name":"MATA","classification":"M","division":"OPEN","hit_factor":8.0863},{"match_name":"PTPC November 4th  USPSA Match","match_date":"2018-11-04","stage_classifiercode":"06-10","member_number":"L4223","first_name":"DARRYL","last_name":"DOUGHERTY","classification":"M","division":"OPEN","hit_factor":8.0429},{"match_name":"December 2017 CAS USPSA","match_date":"2017-12-03","stage_classifiercode":"06-10","member_number":"FY52014","first_name":"BRIAN","last_name":"DOLLY","classification":"A","division":"OPEN","hit_factor":8.0429},{"match_name":"WSPS JUNE 2017 USPSA MATCH","match_date":"2017-06-17","stage_classifiercode":"06-10","member_number":"A33985","first_name":"DONALD","last_name":"SEIGLE","classification":"M","division":"OPEN","hit_factor":8.0214},{"match_name":"OSC April USPSA","match_date":"2021-04-18","stage_classifiercode":"06-10","member_number":"A103957","first_name":"TAYLOR","last_name":"BURACZEWSKI","classification":"A","division":"OPEN","hit_factor":8.0214},{"match_name":"Sage USPSA June 17 2018","match_date":"2018-06-17","stage_classifiercode":"06-10","member_number":"TY30717","first_name":"GARY","last_name":"TILLEY","classification":"A","division":"OPEN","hit_factor":8.0214},{"match_name":"CFRPC November USPSA","match_date":"2018-11-18","stage_classifiercode":"06-10","member_number":"FY91472","first_name":"BRUCE","last_name":"STEIN","classification":"B","division":"OPEN","hit_factor":8.0214},{"match_name":"LdF USPSA Match May 27 2017","match_date":"2017-05-27","stage_classifiercode":"06-10","member_number":"TY16393","first_name":"JIM","last_name":"BUCCELLATO","classification":"M","division":"OPEN","hit_factor":8},{"match_name":"Ontelaunee USPSA September 2016","match_date":"2016-09-24","stage_classifiercode":"06-10","member_number":"TY90280","first_name":"ANTHONY","last_name":"BRUNO","classification":"B","division":"OPEN","hit_factor":7.9787},{"match_name":"SAPS Match 3/20/2021","match_date":"2021-03-20","stage_classifiercode":"06-10","member_number":"A121607","first_name":"TJ","last_name":"RISEN","classification":"A","division":"OPEN","hit_factor":7.9787},{"match_name":"Hopkinton August 2016 ","match_date":"2016-08-06","stage_classifiercode":"06-10","member_number":"A34817","first_name":"DANIEL","last_name":"DIGIOVINE","classification":"A","division":"OPEN","hit_factor":7.9787},{"match_name":"WSPS JUNE 2017 USPSA MATCH","match_date":"2017-06-17","stage_classifiercode":"06-10","member_number":"TY39983","first_name":"BRETT","last_name":"BUCHANAN","classification":"M","division":"OPEN","hit_factor":7.9576},{"match_name":"LCSC Linden USPSA 120918","match_date":"2018-12-09","stage_classifiercode":"06-10","member_number":"L4383","first_name":"BRYAN","last_name":"LARSON","classification":"A","division":"OPEN","hit_factor":7.9576},{"match_name":"Eagles Nest October 16th 2016","match_date":"2016-10-16","stage_classifiercode":"06-10","member_number":"A23146","first_name":"MIKE","last_name":"KAMENSKY","classification":"M","division":"OPEN","hit_factor":7.9576},{"match_name":"CAPS 8-28-2021","match_date":"2021-08-28","stage_classifiercode":"06-10","member_number":"PEN","first_name":"JARED","last_name":"CLAWSON","classification":"U","division":"OPEN","hit_factor":7.9365},{"match_name":"Monson April 2017 USPSA","match_date":"2017-04-23","stage_classifiercode":"06-10","member_number":"A27309","first_name":"TERRANCE","last_name":"ROBERTSON","classification":"B","division":"OPEN","hit_factor":7.9156},{"match_name":"WGC WI USPSA Monthly Match 10-21-17","match_date":"2017-10-21","stage_classifiercode":"06-10","member_number":"TY72120","first_name":"DAVE","last_name":"DEYOE","classification":"M","division":"OPEN","hit_factor":7.8947},{"match_name":"Steel City USPSA September 3 2016","match_date":"2016-09-03","stage_classifiercode":"06-10","member_number":"FY39604","first_name":"PETER","last_name":"ADAMS","classification":"M","division":"OPEN","hit_factor":7.8947},{"match_name":"Hosemasters 2nd Sunday August 2017","match_date":"2017-08-13","stage_classifiercode":"06-10","member_number":"L1849","first_name":"PAUL","last_name":"THOMPSON","classification":"M","division":"OPEN","hit_factor":7.8947},{"match_name":"Briar Rabbit October2017","match_date":"2017-10-22","stage_classifiercode":"06-10","member_number":"TY76812","first_name":"MIKE","last_name":"WEAVER","classification":"M","division":"OPEN","hit_factor":7.874},{"match_name":"MPSA 2020-01-02","match_date":"2021-01-02","stage_classifiercode":"06-10","member_number":"TY103705","first_name":"BLAKE","last_name":"ARNOLD","classification":"U","division":"OPEN","hit_factor":7.874},{"match_name":"Richmond Hot Shots July 15-16-2017 USPSA Pistol Match","match_date":"2017-07-15","stage_classifiercode":"06-10","member_number":"A85939","first_name":"NILO","last_name":"NUNEZ II","classification":"M","division":"OPEN","hit_factor":7.874},{"match_name":"PRPS USPSA Nov   26 2017","match_date":"2017-11-01","stage_classifiercode":"06-10","member_number":"A99310","first_name":"JIM","last_name":"HICKS","classification":"C","division":"OPEN","hit_factor":7.874},{"match_name":"GCL December 5-2020","match_date":"2020-12-05","stage_classifiercode":"06-10","member_number":"A80418","first_name":"ALVA","last_name":"ENGLISH","classification":"A","division":"OPEN","hit_factor":7.874},{"match_name":"SLPSA Jan USPSA","match_date":"2017-01-21","stage_classifiercode":"06-10","member_number":"\"\"","first_name":"ZACHARY","last_name":"REED","classification":"U","division":"OPEN","hit_factor":7.874},{"match_name":"GCL Saturday 3-6-2021","match_date":"2021-03-06","stage_classifiercode":"06-10","member_number":"ty95157","first_name":"JIM","last_name":"CIVITELLO","classification":"A","division":"OPEN","hit_factor":7.8534},{"match_name":"GCL Saturday 3-6-2021","match_date":"2021-03-06","stage_classifiercode":"06-10","member_number":"FY45990","first_name":"JOHN","last_name":"MARCAIDA","classification":"M","division":"OPEN","hit_factor":7.8534},{"match_name":"TAP USPSA February 28 2016 (28Feb16-01:01:53)","match_date":"2016-02-28","stage_classifiercode":"06-10","member_number":"FY81272","first_name":"GAYLORD","last_name":"GABRIEL","classification":"B","division":"OPEN","hit_factor":7.8534},{"match_name":"FBURG USPSA November 2021","match_date":"2021-11-07","stage_classifiercode":"06-10","member_number":"FY42385","first_name":"JOHN","last_name":"HILL","classification":"A","division":"OPEN","hit_factor":7.8534},{"match_name":"AGC_20170507","match_date":"2017-05-07","stage_classifiercode":"06-10","member_number":"TY69978","first_name":"DOMINIC","last_name":"KOH","classification":"M","division":"OPEN","hit_factor":7.8534},{"match_name":"LdF USPSA Match July 11 2021","match_date":"2021-07-11","stage_classifiercode":"06-10","member_number":"TY81018","first_name":"BART","last_name":"DEL RIO","classification":"A","division":"OPEN","hit_factor":7.8329},{"match_name":"MPSA 2020-01-02","match_date":"2021-01-02","stage_classifiercode":"06-10","member_number":"A107778","first_name":"TIM","last_name":"PATTERSON","classification":"B","division":"OPEN","hit_factor":7.8329},{"match_name":"Pioneer Action Shooters USPSA 5-23-21 Special Classifer","match_date":"2021-05-23","stage_classifiercode":"06-10","member_number":"TY110530","first_name":"BRIAN","last_name":"WHITNEY","classification":"B","division":"OPEN","hit_factor":7.8329},{"match_name":"Hampden RPC June USPSA Match","match_date":"2018-06-10","stage_classifiercode":"06-10","member_number":"TY87309","first_name":"ANTHONY","last_name":"CHASE","classification":"A","division":"OPEN","hit_factor":7.8329},{"match_name":"OREGON ARPC CC05 USPSA JUNE 10 2017","match_date":"2017-06-10","stage_classifiercode":"06-10","member_number":"A95617","first_name":"JOSEPH","last_name":"TYLER","classification":"B","division":"OPEN","hit_factor":7.8125},{"match_name":"Space Coast Practical Shooters","match_date":"2018-06-02","stage_classifiercode":"06-10","member_number":"Fy89495","first_name":"MIGUEL","last_name":"PLATINO","classification":"A","division":"OPEN","hit_factor":7.8125},{"match_name":"Sharp Practical Shooters August USPSA - Outdoor","match_date":"2021-08-22","stage_classifiercode":"06-10","member_number":"A81890","first_name":"DON","last_name":"TRIPPLET","classification":"B","division":"OPEN","hit_factor":7.7922},{"match_name":"LCSC Linden USPSA 120918","match_date":"2018-12-09","stage_classifiercode":"06-10","member_number":"TY85663","first_name":"JASON","last_name":"YU","classification":"B","division":"OPEN","hit_factor":7.7922},{"match_name":"WSRC USPSA 7-21/22-2018","match_date":"2018-07-21","stage_classifiercode":"06-10","member_number":"L4272","first_name":"ALEX","last_name":"MAY","classification":"U","division":"OPEN","hit_factor":7.772},{"match_name":"SWGC USPSA Pistol Match - December 2018","match_date":"2018-12-01","stage_classifiercode":"06-10","member_number":"TY36459","first_name":"EDDIE","last_name":"GAMMONS","classification":"M","division":"OPEN","hit_factor":7.772},{"match_name":"PIPS 05-18-2016","match_date":"2016-05-17","stage_classifiercode":"06-10","member_number":"TY44744","first_name":"LARRY","last_name":"SITTER","classification":"M","division":"OPEN","hit_factor":7.772},{"match_name":"LCSC Linden USPSA 061018","match_date":"2018-06-10","stage_classifiercode":"06-10","member_number":"FY62950","first_name":"DARRELL","last_name":"INOUYE","classification":"A","division":"OPEN","hit_factor":7.772},{"match_name":"Shoot GTR USPSA June 7","match_date":"2016-06-07","stage_classifiercode":"06-10","member_number":"TY27735","first_name":"BOB","last_name":"MILLS","classification":"A","division":"OPEN","hit_factor":7.7519},{"match_name":"ARPC USPSA Match 8-26-18","match_date":"2018-08-26","stage_classifiercode":"06-10","member_number":"TY33410","first_name":"JEFF","last_name":"MATSCHE","classification":"M","division":"OPEN","hit_factor":7.7519},{"match_name":"AGC_20170507","match_date":"2017-05-07","stage_classifiercode":"06-10","member_number":"A69423","first_name":"JOSH","last_name":"HORNER","classification":"X","division":"OPEN","hit_factor":7.7519},{"match_name":"TAS Classifier 2","match_date":"2017-12-10","stage_classifiercode":"06-10","member_number":"TY83061","first_name":"ANDY","last_name":"MARTIN","classification":"U","division":"OPEN","hit_factor":7.732},{"match_name":"Collin County USPSA 11-28-2021","match_date":"2021-11-28","stage_classifiercode":"06-10","member_number":"A76773","first_name":"ZACK","last_name":"CAM","classification":"M","division":"OPEN","hit_factor":7.732},{"match_name":"Richmond Hot Shots September 1st-2nd 2018 USPSA Pistol Match","match_date":"2018-09-01","stage_classifiercode":"06-10","member_number":"TY85663","first_name":"JASON","last_name":"YU","classification":"B","division":"OPEN","hit_factor":7.732},{"match_name":"CAPS 8-28-2021","match_date":"2021-08-28","stage_classifiercode":"06-10","member_number":"TY99820","first_name":"KLAY","last_name":"GROVER","classification":"A","division":"OPEN","hit_factor":7.732},{"match_name":"Oxford OHS05 090521","match_date":"2021-09-05","stage_classifiercode":"06-10","member_number":"A119451","first_name":"JAMES","last_name":"PETERS","classification":"B","division":"OPEN","hit_factor":7.7121},{"match_name":"Pima Pistol Club October 9th USPSA w\\Classifier","match_date":"2016-10-09","stage_classifiercode":"06-10","member_number":"A20965","first_name":"BOB","last_name":"MOLNAR","classification":"M","division":"OPEN","hit_factor":7.7121},{"match_name":"WPS USPSA Monthly Match May 2016","match_date":"2016-05-07","stage_classifiercode":"06-10","member_number":"A68001","first_name":"GUS","last_name":"VANETTEN","classification":"B","division":"OPEN","hit_factor":7.7121},{"match_name":"AGC_20160403","match_date":"2016-04-03","stage_classifiercode":"06-10","member_number":"\"\"","first_name":"BRAD","last_name":"MCKIERNAN","classification":"X","division":"OPEN","hit_factor":7.7121},{"match_name":"Hopkinton August 2016 ","match_date":"2016-08-06","stage_classifiercode":"06-10","member_number":"TY60000","first_name":"GREG","last_name":"SOUCIE","classification":"A","division":"OPEN","hit_factor":7.7121},{"match_name":"FBURG June 2018 Level 1 USPSA","match_date":"2018-06-02","stage_classifiercode":"06-10","member_number":"A89294","first_name":"JORDAN","last_name":"MOELLENDICK","classification":"A","division":"OPEN","hit_factor":7.6923},{"match_name":"RBGC USPSA 2021-8-28","match_date":"2021-08-28","stage_classifiercode":"06-10","member_number":"A131354","first_name":"MIKE","last_name":"ULLOA","classification":"A","division":"OPEN","hit_factor":7.6923},{"match_name":"Sharp practical shooters March 27 match","match_date":"2016-03-27","stage_classifiercode":"06-10","member_number":"A87873","first_name":"SCOTT","last_name":"MEREDITH","classification":"B","division":"OPEN","hit_factor":7.6726},{"match_name":"SMPS March 2016","match_date":"2016-03-13","stage_classifiercode":"06-10","member_number":"TY80177","first_name":"PAUL","last_name":"DIERICKX","classification":"U","division":"OPEN","hit_factor":7.6726},{"match_name":"ENPS May 2016 Classifier Match","match_date":"2016-05-01","stage_classifiercode":"06-10","member_number":"TY81403","first_name":"BEN","last_name":"HARPER","classification":"B","division":"OPEN","hit_factor":7.6531},{"match_name":"Gem City Gun Club 9-1 and 9-2-2018","match_date":"2018-09-01","stage_classifiercode":"06-10","member_number":"L2551","first_name":"DEREK","last_name":"ZMOZYNSKI","classification":"M","division":"OPEN","hit_factor":7.6531},{"match_name":"Chillicothe Sportsmens Club December USPSA","match_date":"2020-12-20","stage_classifiercode":"06-10","member_number":"TY100795","first_name":"JOHN","last_name":"KLENDWORTH","classification":"B","division":"OPEN","hit_factor":7.6531},{"match_name":"CSA June 10 2018","match_date":"2018-06-10","stage_classifiercode":"06-10","member_number":"TY85570","first_name":"DAVID","last_name":"MILLER","classification":"U","division":"OPEN","hit_factor":7.6531},{"match_name":"OREGON ARPC CC05 USPSA JUNE 10 2017","match_date":"2017-06-10","stage_classifiercode":"06-10","member_number":"A88441","first_name":"KYLE","last_name":"SAYEG","classification":"B","division":"OPEN","hit_factor":7.6531},{"match_name":"AGC_20170507","match_date":"2017-05-07","stage_classifiercode":"06-10","member_number":"A59267","first_name":"BRAD","last_name":"MCKIERNAN","classification":"M","division":"OPEN","hit_factor":7.6531},{"match_name":"WSPS JUNE 2017 USPSA MATCH","match_date":"2017-06-17","stage_classifiercode":"06-10","member_number":"TY16248","first_name":"BARRY","last_name":"RUANE","classification":"M","division":"OPEN","hit_factor":7.6336},{"match_name":"MASTER BLASTERS & SSFGA USPSA - September","match_date":"2021-09-18","stage_classifiercode":"06-10","member_number":"TY110530","first_name":"BRIAN","last_name":"WHITNEY","classification":"B","division":"OPEN","hit_factor":7.6336},{"match_name":"LCSA USPSA May 2017","match_date":"2017-05-13","stage_classifiercode":"06-10","member_number":"\"\"","first_name":"BILL","last_name":"IGO","classification":"U","division":"OPEN","hit_factor":7.6142},{"match_name":"NVSA USPSA 1712","match_date":"2017-12-03","stage_classifiercode":"06-10","member_number":"A59813","first_name":"CINDY","last_name":"TUCKER","classification":"A","division":"OPEN","hit_factor":7.6142},{"match_name":"MASTER BLASTERS & SSFGA USPSA - September","match_date":"2021-09-18","stage_classifiercode":"06-10","member_number":"FY45824","first_name":"JEFF","last_name":"FRAHM","classification":"A","division":"OPEN","hit_factor":7.6142},{"match_name":"Sandbagger Classic 2021","match_date":"2021-07-31","stage_classifiercode":"06-10","member_number":"A122174","first_name":"BRANDON","last_name":"TORRES","classification":"U","division":"OPEN","hit_factor":7.5949},{"match_name":"DAP December 2015 Classifier match","match_date":"2015-12-12","stage_classifiercode":"06-10","member_number":"A88607","first_name":"FRANCO","last_name":"GESMUNDO","classification":"B","division":"OPEN","hit_factor":7.5949},{"match_name":"Deadwood Boys USPSA All Classifier Match - 29 July 2018","match_date":"2018-07-29","stage_classifiercode":"06-10","member_number":"a78856","first_name":"CRIS","last_name":"CARPENTER","classification":"A","division":"OPEN","hit_factor":7.5758},{"match_name":"Eagles Nest October 16th 2016","match_date":"2016-10-16","stage_classifiercode":"06-10","member_number":"TY66305","first_name":"HERB","last_name":"SMITH","classification":"B","division":"OPEN","hit_factor":7.5758},{"match_name":"DAP December 2015 Classifier match","match_date":"2015-12-12","stage_classifiercode":"06-10","member_number":"A85939","first_name":"NILO","last_name":"NUNEZ II","classification":"A","division":"OPEN","hit_factor":7.5758},{"match_name":"Sharp Practical Shooters August USPSA - Outdoor","match_date":"2021-08-22","stage_classifiercode":"06-10","member_number":"L3511","first_name":"JIM","last_name":"BALDREE","classification":"A","division":"OPEN","hit_factor":7.5567},{"match_name":"2020-03-07 USPSA at Phoenix Rod and Gun Club","match_date":"2020-03-07","stage_classifiercode":"06-10","member_number":"A97078","first_name":"JIM","last_name":"CONNER","classification":"B","division":"OPEN","hit_factor":7.5567},{"match_name":"Nampa USPSA March 15th","match_date":"2020-03-15","stage_classifiercode":"06-10","member_number":"A106643","first_name":"EUGENE","last_name":"DINA","classification":"B","division":"OPEN","hit_factor":7.5567},{"match_name":"Monson April 2017 USPSA","match_date":"2017-04-23","stage_classifiercode":"06-10","member_number":"TY63853","first_name":"DAVID","last_name":"GIRARDIN","classification":"A","division":"OPEN","hit_factor":7.5567},{"match_name":"TPS USPSA -  August 2017 - Talon Range","match_date":"2017-08-05","stage_classifiercode":"06-10","member_number":"Fy82088","first_name":"PARKS","last_name":"SMALL","classification":"U","division":"OPEN","hit_factor":7.5567},{"match_name":"Hosemasters 2nd Sunday August 2017","match_date":"2017-08-13","stage_classifiercode":"06-10","member_number":"L4092","first_name":"LEIGHTON","last_name":"OOSTHUISEN","classification":"G","division":"OPEN","hit_factor":7.5377},{"match_name":"OFGC USPSA Match 11-18-17","match_date":"2017-11-18","stage_classifiercode":"06-10","member_number":"TY54207","first_name":"JAY SR","last_name":"MACKEY","classification":"M","division":"OPEN","hit_factor":7.5377},{"match_name":"CRC / SVPS June USPSA","match_date":"2020-06-12","stage_classifiercode":"06-10","member_number":"L3232","first_name":"THOMAS","last_name":"HOWARD","classification":"A","division":"OPEN","hit_factor":7.5377},{"match_name":"EHPSA USPSA 27June 2021","match_date":"2021-06-27","stage_classifiercode":"06-10","member_number":"Ty109715","first_name":"PATCHES","last_name":"REEDER","classification":"M","division":"OPEN","hit_factor":7.5377},{"match_name":"Deadwood Boys USPSA All Classifier Match - 29 July 2018","match_date":"2018-07-29","stage_classifiercode":"06-10","member_number":"A98726","first_name":"CALEB","last_name":"BAER","classification":"A","division":"OPEN","hit_factor":7.5},{"match_name":"LCSA USPSA May 2017","match_date":"2017-05-13","stage_classifiercode":"06-10","member_number":"l3218","first_name":"ROB","last_name":"EGER","classification":"M","division":"OPEN","hit_factor":7.5},{"match_name":"FBURG March 2021 Level I USPSA ","match_date":"2021-03-06","stage_classifiercode":"06-10","member_number":"A83654","first_name":"JASON","last_name":"ROBERTS","classification":"M","division":"OPEN","hit_factor":7.5},{"match_name":"AGC_20170507","match_date":"2017-05-07","stage_classifiercode":"06-10","member_number":"A49558","first_name":"JOHN","last_name":"ARENAS","classification":"U","division":"OPEN","hit_factor":7.5},{"match_name":"Green Valley March 2017","match_date":"2017-03-25","stage_classifiercode":"06-10","member_number":"\"\"","first_name":"PAUL","last_name":"EGGEMAN","classification":"U","division":"OPEN","hit_factor":7.5},{"match_name":"Ontelaunee USPSA September 2016","match_date":"2016-09-24","stage_classifiercode":"06-10","member_number":"A82014","first_name":"ANTHONY","last_name":"SPINILLO","classification":"B","division":"OPEN","hit_factor":7.4813},{"match_name":"FBURG June 2017 Level I USPSA ","match_date":"2017-06-03","stage_classifiercode":"06-10","member_number":"A88350","first_name":"DAVID","last_name":"WAMPLER","classification":"G","division":"OPEN","hit_factor":7.4813},{"match_name":"PSAC_20160227","match_date":"2016-02-27","stage_classifiercode":"06-10","member_number":"A59267","first_name":"BRAD","last_name":"MCKIERNAN","classification":"\"\"","division":"OPEN","hit_factor":7.4813},{"match_name":"PSAC_20160227","match_date":"2016-02-27","stage_classifiercode":"06-10","member_number":"TY10704","first_name":"BOB","last_name":"HUGHES","classification":"\"\"","division":"OPEN","hit_factor":7.4813},{"match_name":"Hosemasters 2nd Sunday August 2017","match_date":"2017-08-13","stage_classifiercode":"06-10","member_number":"FY95577","first_name":"MATTHEW","last_name":"KITZMILLER","classification":"B","division":"OPEN","hit_factor":7.4813},{"match_name":"Hosemasters 2nd Sunday August 2017","match_date":"2017-08-13","stage_classifiercode":"06-10","member_number":"TY83533","first_name":"ANDY","last_name":"FEIGIN","classification":"A","division":"OPEN","hit_factor":7.4813},{"match_name":"EHPSA USPSA 27June 2021","match_date":"2021-06-27","stage_classifiercode":"06-10","member_number":"fy90731","first_name":"MICHAEL","last_name":"FORD","classification":"A","division":"OPEN","hit_factor":7.4813},{"match_name":"FLPSA MN14 USPSA April 26 2018","match_date":"2018-04-26","stage_classifiercode":"06-10","member_number":"TY-41080","first_name":"JOHN","last_name":"BUEHLER","classification":"B","division":"OPEN","hit_factor":7.4813},{"match_name":"PRPS USPSA Jun  24 2018","match_date":"2018-06-17","stage_classifiercode":"06-10","member_number":"A530","first_name":"JERRY","last_name":"DIX","classification":"M","division":"OPEN","hit_factor":7.4627},{"match_name":"Shadow Hawk Defense USPSA - Aug","match_date":"2021-08-14","stage_classifiercode":"06-10","member_number":"Ty88350","first_name":"DAVID","last_name":"WAMPLER","classification":"G","division":"OPEN","hit_factor":7.4627},{"match_name":"December 2017 CAS USPSA","match_date":"2017-12-03","stage_classifiercode":"06-10","member_number":"A71384","first_name":"JIM","last_name":"HALL","classification":"C","division":"OPEN","hit_factor":7.4627},{"match_name":"OFGC USPSA Match 11-18-17","match_date":"2017-11-18","stage_classifiercode":"06-10","member_number":"TY55378","first_name":"TRAVIS","last_name":"THOMPSON","classification":"A","division":"OPEN","hit_factor":7.4627},{"match_name":"Idaho ISPS January 6th 2018","match_date":"2018-01-06","stage_classifiercode":"06-10","member_number":"TY91986","first_name":"TRAVIS","last_name":"DEMARAY","classification":"B","division":"OPEN","hit_factor":7.4627},{"match_name":"OSC April USPSA","match_date":"2021-04-18","stage_classifiercode":"06-10","member_number":"TY54308","first_name":"GLEN","last_name":"BICKING","classification":"B","division":"OPEN","hit_factor":7.4627},{"match_name":"OFGC USPSA Match Oct 16","match_date":"2016-10-16","stage_classifiercode":"06-10","member_number":"A79715","first_name":"MICHAEL","last_name":"NELSON","classification":"B","division":"OPEN","hit_factor":7.4627},{"match_name":"MCAS USPSA March 2016","match_date":"2016-03-19","stage_classifiercode":"06-10","member_number":"FY20463","first_name":"DENNIS","last_name":"BAUER","classification":"M","division":"OPEN","hit_factor":7.4442},{"match_name":"PMSC USPSA JULY 2018","match_date":"2018-07-01","stage_classifiercode":"06-10","member_number":"A24039","first_name":"ALAN","last_name":"MASLONEK","classification":"B","division":"OPEN","hit_factor":7.4442},{"match_name":"Hosemasters 2nd Sunday August 2017","match_date":"2017-08-13","stage_classifiercode":"06-10","member_number":"A80318","first_name":"JIM","last_name":"ADAME","classification":"G","division":"OPEN","hit_factor":7.4442},{"match_name":"September CAS Match","match_date":"2015-09-06","stage_classifiercode":"06-10","member_number":"A90671","first_name":"COREY","last_name":"YATES","classification":"B","division":"OPEN","hit_factor":7.4442},{"match_name":"CFRPC November USPSA","match_date":"2018-11-18","stage_classifiercode":"06-10","member_number":"A44363","first_name":"COLLIN","last_name":"SMITH","classification":"A","division":"OPEN","hit_factor":7.4442},{"match_name":"Shoot GTR USPSA June 7","match_date":"2016-06-07","stage_classifiercode":"06-10","member_number":"TY34497","first_name":"PATRICK","last_name":"GAUVIN","classification":"A","division":"OPEN","hit_factor":7.4257},{"match_name":"GCL Saturday 3-6-2021","match_date":"2021-03-06","stage_classifiercode":"06-10","member_number":"FY105696","first_name":"STUART","last_name":"WEAVER","classification":"B","division":"OPEN","hit_factor":7.4257},{"match_name":"Southkent USPSA MAY match","match_date":"2017-05-20","stage_classifiercode":"06-10","member_number":"A81117","first_name":"ERIC","last_name":"WALLACE","classification":"M","division":"OPEN","hit_factor":7.4257},{"match_name":"FBURG March 2021 Level I USPSA ","match_date":"2021-03-06","stage_classifiercode":"06-10","member_number":"TY104682","first_name":"KEVIN","last_name":"GOROSPE","classification":"G","division":"OPEN","hit_factor":7.4257},{"match_name":"CCPL 04-25-2021","match_date":"2021-04-25","stage_classifiercode":"06-10","member_number":"A100211","first_name":"PAUL","last_name":"CHETWOOD","classification":"B","division":"OPEN","hit_factor":7.4074},{"match_name":"LA05  Tangi November USPSA 2020","match_date":"2020-11-20","stage_classifiercode":"06-10","member_number":"FY101141","first_name":"MATHEW","last_name":"DOZIER","classification":"A","division":"OPEN","hit_factor":7.4074},{"match_name":"Oxford OHS05 090521","match_date":"2021-09-05","stage_classifiercode":"06-10","member_number":"A118246","first_name":"MATTHEW","last_name":"TURNER","classification":"B","division":"OPEN","hit_factor":7.4074},{"match_name":"TAP USPSA February 28 2016 (28Feb16-01:01:53)","match_date":"2016-02-28","stage_classifiercode":"06-10","member_number":"A85939","first_name":"NILO","last_name":"NUNEZ II","classification":"M","division":"OPEN","hit_factor":7.4074},{"match_name":"Shoot GTR USPSA 12/13","match_date":"2016-12-13","stage_classifiercode":"06-10","member_number":"TY27735","first_name":"BOB","last_name":"MILLS","classification":"A","division":"OPEN","hit_factor":7.3892},{"match_name":"Space Coast Practical Shooters","match_date":"2018-06-02","stage_classifiercode":"06-10","member_number":"A44363","first_name":"COLLIN","last_name":"SMITH","classification":"A","division":"OPEN","hit_factor":7.3892},{"match_name":"MVPSA USPSA  6-2-18","match_date":"2018-06-02","stage_classifiercode":"06-10","member_number":"L3033","first_name":"LARRY","last_name":"AOKI","classification":"A","division":"OPEN","hit_factor":7.371},{"match_name":"Hosemasters 2nd Sunday August 2017","match_date":"2017-08-13","stage_classifiercode":"06-10","member_number":"A55530","first_name":"TIM","last_name":"HIBBS","classification":"M","division":"OPEN","hit_factor":7.371},{"match_name":"OFGC USPSA Match 11-18-17","match_date":"2017-11-18","stage_classifiercode":"06-10","member_number":"A81825","first_name":"IAN","last_name":"ZACHER","classification":"B","division":"OPEN","hit_factor":7.371},{"match_name":"Alpha Mike Oct 2017","match_date":"2017-10-15","stage_classifiercode":"06-10","member_number":"a37212","first_name":"MARIO","last_name":"HESLES","classification":"M","division":"OPEN","hit_factor":7.371},{"match_name":"MCAS June 2018 USPSA Match","match_date":"2018-06-30","stage_classifiercode":"06-10","member_number":"Fy69896","first_name":"JIM","last_name":"SANDERS","classification":"A","division":"OPEN","hit_factor":7.3529},{"match_name":"Richmond Hot Shots September 1st-2nd 2018 USPSA Pistol Match","match_date":"2018-09-01","stage_classifiercode":"06-10","member_number":"A88607","first_name":"FRANCO","last_name":"GESMUNDO","classification":"A","division":"OPEN","hit_factor":7.3529},{"match_name":"GCL Saturday 3-6-2021","match_date":"2021-03-06","stage_classifiercode":"06-10","member_number":"Ty31907","first_name":"JEFF","last_name":"CURTS","classification":"A","division":"OPEN","hit_factor":7.335},{"match_name":"GRPC USPSA DO YOU FEEL LUCKY?","match_date":"2021-03-07","stage_classifiercode":"06-10","member_number":"TY101554","first_name":"ALBERT","last_name":"MONTANEZ","classification":"M","division":"OPEN","hit_factor":7.335},{"match_name":"CCPL 04-25-2021","match_date":"2021-04-25","stage_classifiercode":"06-10","member_number":"TY109346","first_name":"MADDUX","last_name":"LE","classification":"M","division":"OPEN","hit_factor":7.3171},{"match_name":"Harvard Action Shooters August 2016 USPSA Pistol","match_date":"2016-08-14","stage_classifiercode":"06-10","member_number":"TY82118","first_name":"PETER","last_name":"GILBERT","classification":"B","division":"OPEN","hit_factor":7.3171},{"match_name":"LCSC Linden USPSA 061018","match_date":"2018-06-10","stage_classifiercode":"06-10","member_number":"TY85663","first_name":"JASON","last_name":"YU","classification":"B","division":"OPEN","hit_factor":7.3171},{"match_name":"SPSA USPSA March 4th Sat match","match_date":"2021-03-27","stage_classifiercode":"06-10","member_number":"TY91263","first_name":"MATTHEW","last_name":"WOLFF","classification":"M","division":"OPEN","hit_factor":7.3171},{"match_name":"Steel City USPSA September 3 2016","match_date":"2016-09-03","stage_classifiercode":"06-10","member_number":"TY88155","first_name":"TYLER","last_name":"GREEN","classification":"B","division":"OPEN","hit_factor":7.2993},{"match_name":"Shongum October 2017 Match","match_date":"2017-10-07","stage_classifiercode":"06-10","member_number":"L2421","first_name":"GEORGE","last_name":"JONES","classification":"A","division":"OPEN","hit_factor":7.2993},{"match_name":"APS August 1st Monthly USPSA Match  Classifier Match","match_date":"2021-08-01","stage_classifiercode":"06-10","member_number":"TY106854","first_name":"ODED","last_name":"ZYSSMAN2","classification":"B","division":"OPEN","hit_factor":7.2993},{"match_name":"DWB - Deadwood Boys USPSA 19 January 2020","match_date":"2020-01-19","stage_classifiercode":"06-10","member_number":"A37333","first_name":"ERIC","last_name":"BENEDICTO","classification":"B","division":"OPEN","hit_factor":7.2993},{"match_name":"Collin County USPSA 11-28-2021","match_date":"2021-11-28","stage_classifiercode":"06-10","member_number":"L4883","first_name":"DAVID","last_name":"VALDEZ","classification":"U","division":"OPEN","hit_factor":7.2993},{"match_name":"Richmond hotshots April 16-17 2016 USPSA Pistol match","match_date":"2016-04-16","stage_classifiercode":"06-10","member_number":"A92636","first_name":"JORDAN","last_name":"SU","classification":"U","division":"OPEN","hit_factor":7.2993},{"match_name":"ARPC USPSA Match 9-24-17","match_date":"2017-09-24","stage_classifiercode":"06-10","member_number":"A67446","first_name":"DAN","last_name":"SPRAUL","classification":"C","division":"OPEN","hit_factor":7.2816},{"match_name":"AGC_20160403","match_date":"2016-04-03","stage_classifiercode":"06-10","member_number":"TY10704","first_name":"BOB","last_name":"HUGHES","classification":"M","division":"OPEN","hit_factor":7.2816},{"match_name":"Collin County USPSA 11-28-2021","match_date":"2021-11-28","stage_classifiercode":"06-10","member_number":"TY47162","first_name":"SCOTT","last_name":"STOCKTON","classification":"G","division":"OPEN","hit_factor":7.2816},{"match_name":"SWGC USPSA Pistol Match - December 2018","match_date":"2018-12-01","stage_classifiercode":"06-10","member_number":"L4056","first_name":"DILLION","last_name":"WALKER","classification":"B","division":"OPEN","hit_factor":7.2639},{"match_name":"TPS USPSA AT CMP OCT 20 2018","match_date":"2018-10-20","stage_classifiercode":"06-10","member_number":"FY39604","first_name":"PETER","last_name":"ADAMS","classification":"M","division":"OPEN","hit_factor":7.2639},{"match_name":"TAP USPSA February 28 2016 (28Feb16-01:01:53)","match_date":"2016-02-28","stage_classifiercode":"06-10","member_number":"TY77462","first_name":"LENNIE","last_name":"VILLIADOS","classification":"C","division":"OPEN","hit_factor":7.2639},{"match_name":"TAP USPSA February 28 2016 (28Feb16-01:01:53)","match_date":"2016-02-28","stage_classifiercode":"06-10","member_number":"A84616","first_name":"MJ","last_name":"FINEZA","classification":"B","division":"OPEN","hit_factor":7.2639},{"match_name":"Richmond Hot Shots September 1st-2nd 2018 USPSA Pistol Match","match_date":"2018-09-01","stage_classifiercode":"06-10","member_number":"\"\"","first_name":"RICKY","last_name":"FONG","classification":"B","division":"OPEN","hit_factor":7.2639},{"match_name":"CBS March USPSA Steel Match","match_date":"2021-03-07","stage_classifiercode":"06-10","member_number":"A128035","first_name":"TAYLOR","last_name":"LATHAM","classification":"B","division":"OPEN","hit_factor":7.2639},{"match_name":"Shoot GTR USPSA 12/13","match_date":"2016-12-13","stage_classifiercode":"06-10","member_number":"TY34497","first_name":"PATRICK","last_name":"GAUVIN","classification":"A","division":"OPEN","hit_factor":7.2639},{"match_name":"FAS Sunday Outdoor USPSA Match","match_date":"2021-08-01","stage_classifiercode":"06-10","member_number":"TY90397","first_name":"JOEY","last_name":"MARRAPODI","classification":"","division":"OPEN","hit_factor":7.2464},{"match_name":"Chillicothe Sportsmens Club December USPSA","match_date":"2020-12-20","stage_classifiercode":"06-10","member_number":"A83660","first_name":"MATT","last_name":"LEE","classification":"B","division":"OPEN","hit_factor":7.2464},{"match_name":"Fall Madness - UPSA Match","match_date":"2017-10-07","stage_classifiercode":"06-10","member_number":"A81629","first_name":"PHILLIP","last_name":"REDDY","classification":"M","division":"OPEN","hit_factor":7.2464},{"match_name":"MPSA 2020-01-02","match_date":"2021-01-02","stage_classifiercode":"06-10","member_number":"TY98602","first_name":"NEIL","last_name":"DRENNAN","classification":"B","division":"OPEN","hit_factor":7.2289},{"match_name":"SAPSA May 2016","match_date":"2016-05-21","stage_classifiercode":"06-10","member_number":"A30555","first_name":"DAVE","last_name":"WILDS","classification":"M","division":"OPEN","hit_factor":7.2289},{"match_name":"Hosemasters 2nd Sunday August 2017","match_date":"2017-08-13","stage_classifiercode":"06-10","member_number":"TY65635","first_name":"CHRIS","last_name":"COLLINS","classification":"B","division":"OPEN","hit_factor":7.2289},{"match_name":"TAS Classifier 2","match_date":"2017-12-10","stage_classifiercode":"06-10","member_number":"A99529","first_name":"KENNETH","last_name":"KLOEPPEL","classification":"\"\"","division":"OPEN","hit_factor":7.2289},{"match_name":"NW01 9-20-16","match_date":"2016-09-20","stage_classifiercode":"06-10","member_number":"TY47022","first_name":"BRUCE","last_name":"WOOD","classification":"A","division":"OPEN","hit_factor":7.2289},{"match_name":"Monson April 2017 USPSA","match_date":"2017-04-23","stage_classifiercode":"06-10","member_number":"A39028","first_name":"JOHN","last_name":"SARDINA","classification":"A","division":"OPEN","hit_factor":7.2115},{"match_name":"GCL Saturday 3-6-2021","match_date":"2021-03-06","stage_classifiercode":"06-10","member_number":"FY45990","first_name":"JOHN. 2","last_name":"MARCAIDA","classification":"M","division":"OPEN","hit_factor":7.2115},{"match_name":"DSS - USPSA 18-08-12","match_date":"2018-08-12","stage_classifiercode":"06-10","member_number":"A55013","first_name":"RICHARD","last_name":"GENNARO","classification":"A","division":"OPEN","hit_factor":7.2115},{"match_name":"Grandbaggers December 2017","match_date":"2017-12-07","stage_classifiercode":"06-10","member_number":"A103575","first_name":"STEVEN","last_name":"SCACCIA","classification":"C","division":"OPEN","hit_factor":7.2115},{"match_name":"Eagles Nest July 30th","match_date":"2017-07-30","stage_classifiercode":"06-10","member_number":"A23146","first_name":"MIKE","last_name":"KAMENSKY","classification":"M","division":"OPEN","hit_factor":7.1942},{"match_name":"NCPS USPSA Handgun Match March 25 2018z","match_date":"2018-03-25","stage_classifiercode":"06-10","member_number":"A63834","first_name":"EDWIN","last_name":"CUCIO","classification":"B","division":"OPEN","hit_factor":7.1942},{"match_name":"Alpha Mike Oct 2017","match_date":"2017-10-15","stage_classifiercode":"06-10","member_number":"\"\"","first_name":"MICHAEL","last_name":"WALSH","classification":"U","division":"OPEN","hit_factor":7.1942},{"match_name":"SEPSA April 2021 Popup Match","match_date":"2021-04-17","stage_classifiercode":"06-10","member_number":"A32792","first_name":"TOM","last_name":"STIDHAM","classification":"U","division":"OPEN","hit_factor":7.177},{"match_name":"Hosemasters 2nd Sunday August 2017","match_date":"2017-08-13","stage_classifiercode":"06-10","member_number":"\"\"","first_name":"PAUL","last_name":"NOVAK","classification":"D","division":"OPEN","hit_factor":7.177},{"match_name":"HRRB 12-01-2018","match_date":"2018-12-01","stage_classifiercode":"06-10","member_number":"FY42988","first_name":"\"HERMAN \"\"BOBOT \"\"\"","last_name":"DUQUEZ","classification":"C","division":"OPEN","hit_factor":7.177},{"match_name":"Maine Practical Shooters October 2018","match_date":"2018-10-14","stage_classifiercode":"06-10","member_number":"A96126","first_name":"LUKE","last_name":"HILTON","classification":"C","division":"OPEN","hit_factor":7.177},{"match_name":"Richmond hotshots April 16-17 2016 USPSA Pistol match","match_date":"2016-04-16","stage_classifiercode":"06-10","member_number":"Ty72664","first_name":"ROMIL","last_name":"JIMENEZ","classification":"B","division":"OPEN","hit_factor":7.177},{"match_name":"DAP December 2015 Classifier match","match_date":"2015-12-12","stage_classifiercode":"06-10","member_number":"A51918","first_name":"TIM","last_name":"BOFMAN","classification":"A","division":"OPEN","hit_factor":7.177},{"match_name":"ISPS JULY 2nd 2016","match_date":"2016-07-02","stage_classifiercode":"06-10","member_number":"TY80321","first_name":"DAN","last_name":"HAWKINS","classification":"B","division":"OPEN","hit_factor":7.1599},{"match_name":"Briar Rabbit October2017","match_date":"2017-10-22","stage_classifiercode":"06-10","member_number":"TY81742","first_name":"BEN","last_name":"WEST","classification":"A","division":"OPEN","hit_factor":7.1599},{"match_name":"Richmond Hot Shots July 15-16-2017 USPSA Pistol Match","match_date":"2017-07-15","stage_classifiercode":"06-10","member_number":"TY91248","first_name":"DAVID","last_name":"GEORGE","classification":"B","division":"OPEN","hit_factor":7.1599},{"match_name":"AIPS Weekly USPSA 21 August 2018","match_date":"2018-08-21","stage_classifiercode":"06-10","member_number":"A65348","first_name":"CRAIG","last_name":"HABEL","classification":"B","division":"OPEN","hit_factor":7.1599},{"match_name":"OFGC USPSA Match Oct 16","match_date":"2016-10-16","stage_classifiercode":"06-10","member_number":"A81825","first_name":"IAN","last_name":"ZACHER","classification":"B","division":"OPEN","hit_factor":7.1599},{"match_name":"FBURG March 2021 Level I USPSA ","match_date":"2021-03-06","stage_classifiercode":"06-10","member_number":"L3535","first_name":"TAK 2AE","last_name":"ONG","classification":"B","division":"OPEN","hit_factor":7.1599},{"match_name":"PMSC USPSA JULY 2018","match_date":"2018-07-01","stage_classifiercode":"06-10","member_number":"FY90731","first_name":"MICHAEL","last_name":"FORD","classification":"\"\"","division":"OPEN","hit_factor":7.1429},{"match_name":"CGGR May USPSA Match","match_date":"2017-05-20","stage_classifiercode":"06-10","member_number":"A31524","first_name":"COUNCIL","last_name":"BRADSHAW","classification":"G","division":"OPEN","hit_factor":7.1429},{"match_name":"LdF USPSA Match May 27 2017","match_date":"2017-05-27","stage_classifiercode":"06-10","member_number":"A18808","first_name":"LOU","last_name":"PAZ","classification":"A","division":"OPEN","hit_factor":7.1429},{"match_name":"LCSA USPSA May 2017","match_date":"2017-05-13","stage_classifiercode":"06-10","member_number":"FY39111","first_name":"OLIE","last_name":"ERICKSEN","classification":"B","division":"OPEN","hit_factor":7.1259},{"match_name":"DWB - Deadwood Boys USPSA 19 January 2020","match_date":"2020-01-19","stage_classifiercode":"06-10","member_number":"TY104561","first_name":"HENRY","last_name":"ANG","classification":"C","division":"OPEN","hit_factor":7.1259},{"match_name":"Fall Madness - UPSA Match","match_date":"2017-10-07","stage_classifiercode":"06-10","member_number":"F98158","first_name":"ROBERT","last_name":"STUVE","classification":"U","division":"OPEN","hit_factor":7.1259},{"match_name":"Richmond hotshots April 16-17 2016 USPSA Pistol match","match_date":"2016-04-16","stage_classifiercode":"06-10","member_number":"A33147","first_name":"VINCE","last_name":"DIONISIO","classification":"B","division":"OPEN","hit_factor":7.1259},{"match_name":"Eagles Nest July 30th","match_date":"2017-07-30","stage_classifiercode":"06-10","member_number":"TY81249","first_name":"BRIAN","last_name":"MILLER","classification":"B","division":"OPEN","hit_factor":7.109},{"match_name":"CCPL - June 2021","match_date":"2021-06-19","stage_classifiercode":"06-10","member_number":"A114861","first_name":"JOSHUA","last_name":"DAWSON","classification":"A","division":"OPEN","hit_factor":7.109},{"match_name":"EHPSA USPSA 27June 2021","match_date":"2021-06-27","stage_classifiercode":"06-10","member_number":"Ty84357","first_name":"RAY","last_name":"DONCH","classification":"B","division":"OPEN","hit_factor":7.109},{"match_name":"WGC June 2018 USPSA","match_date":"2018-06-10","stage_classifiercode":"06-10","member_number":"TY34082","first_name":"ADELO","last_name":"AQUINO","classification":"A","division":"OPEN","hit_factor":7.109},{"match_name":"HSC USPSA October 2016","match_date":"2016-10-01","stage_classifiercode":"06-10","member_number":"A77032","first_name":"TYLER","last_name":"COKE","classification":"B","division":"OPEN","hit_factor":7.109},{"match_name":"Monson April 2017 USPSA","match_date":"2017-04-23","stage_classifiercode":"06-10","member_number":"TY82118","first_name":"PETE","last_name":"GILBERT","classification":"B","division":"OPEN","hit_factor":7.0922},{"match_name":"GCL December 5-2020","match_date":"2020-12-05","stage_classifiercode":"06-10","member_number":"ty95157","first_name":"JIM","last_name":"CIVITELLO","classification":"A","division":"OPEN","hit_factor":7.0922},{"match_name":"TAP USPSA February 28 2016 (28Feb16-01:01:53)","match_date":"2016-02-28","stage_classifiercode":"06-10","member_number":"TY79640","first_name":"ELPIDIO (PETE)","last_name":"CORPUZ","classification":"B","division":"OPEN","hit_factor":7.0922},{"match_name":"SWGC USPSA Pistol Match - March 2020","match_date":"2020-03-07","stage_classifiercode":"06-10","member_number":"TY91756","first_name":"DAVID","last_name":"MARTON","classification":"A","division":"OPEN","hit_factor":7.0922},{"match_name":"HOPS USPSA 1020018 ","match_date":"2018-10-19","stage_classifiercode":"06-10","member_number":"A79715","first_name":"MICHAEL","last_name":"NELSON","classification":"B","division":"OPEN","hit_factor":7.0755},{"match_name":"Shoot GTR USPSA June 7","match_date":"2016-06-07","stage_classifiercode":"06-10","member_number":"A27184","first_name":"MIKE","last_name":"EHRMANN","classification":"A","division":"OPEN","hit_factor":7.0755},{"match_name":"LCSC Linden USPSA 120918","match_date":"2018-12-09","stage_classifiercode":"06-10","member_number":"A92599","first_name":"JEREMY","last_name":"CHEUNG","classification":"B","division":"OPEN","hit_factor":7.0755},{"match_name":"AGC_20170507","match_date":"2017-05-07","stage_classifiercode":"06-10","member_number":"A47982","first_name":"DON","last_name":"DOBYNS","classification":"U","division":"OPEN","hit_factor":7.0755},{"match_name":"Custer December USPSA","match_date":"2016-12-04","stage_classifiercode":"06-10","member_number":"TY90071","first_name":"ZACK","last_name":"MARR","classification":"B","division":"OPEN","hit_factor":7.0755},{"match_name":"LCSC Linden USPSA 061018","match_date":"2018-06-10","stage_classifiercode":"06-10","member_number":"A88607","first_name":"FRANCO","last_name":"GESMUNDO","classification":"A","division":"OPEN","hit_factor":7.0588},{"match_name":"EWPSA 2018-01","match_date":"2018-01-21","stage_classifiercode":"06-10","member_number":"L3269","first_name":"BRIAN","last_name":"HUMANN","classification":"B","division":"OPEN","hit_factor":7.0588},{"match_name":"Nisa April","match_date":"2021-04-25","stage_classifiercode":"06-10","member_number":"ty85482","first_name":"MIKE","last_name":"SCHROEDL","classification":"B","division":"OPEN","hit_factor":7.0423},{"match_name":"Sage Pistol League USPSA May 16 2021","match_date":"2021-05-16","stage_classifiercode":"06-10","member_number":"TY 30717","first_name":"GARY","last_name":"TILLEY","classification":"M","division":"OPEN","hit_factor":7.0423},{"match_name":"ARPC USPSA Match 8-26-18","match_date":"2018-08-26","stage_classifiercode":"06-10","member_number":"A44819","first_name":"JIM","last_name":"KOETTING","classification":"B","division":"OPEN","hit_factor":7.0423},{"match_name":"YMM  IPSC 2018_07_08","match_date":"2018-07-08","stage_classifiercode":"06-10","member_number":"A86470","first_name":"RICHARD","last_name":"FRASER","classification":"\"\"","division":"OPEN","hit_factor":7.0258},{"match_name":"BGSL Classifier Match ","match_date":"2018-10-06","stage_classifiercode":"06-10","member_number":"a100918","first_name":"MATT","last_name":"GREEN","classification":"B","division":"OPEN","hit_factor":7.0258},{"match_name":"LBAS 201017 October Practical Match","match_date":"2020-10-17","stage_classifiercode":"06-10","member_number":"A121487","first_name":"JESSE","last_name":"RAY","classification":"B","division":"OPEN","hit_factor":7.0258},{"match_name":"Gem City Gun Club 4-7 and 4-8-18","match_date":"2018-04-07","stage_classifiercode":"06-10","member_number":"L1963","first_name":"DENNY","last_name":"MICHALI","classification":"A","division":"OPEN","hit_factor":7.0258},{"match_name":"Richmond Hot Shots July 15-16-2017 USPSA Pistol Match","match_date":"2017-07-15","stage_classifiercode":"06-10","member_number":"TY79640","first_name":"ELPIDIO","last_name":"CORPUZ","classification":"B","division":"OPEN","hit_factor":7.0258},{"match_name":"CRC / SVPS June USPSA","match_date":"2020-06-12","stage_classifiercode":"06-10","member_number":"TY108035","first_name":"BILLY","last_name":"BAXTER","classification":"C","division":"OPEN","hit_factor":7.0258},{"match_name":"DSS - USPSA 18-08-12","match_date":"2018-08-12","stage_classifiercode":"06-10","member_number":"TY76812","first_name":"MIKE","last_name":"WEAVER","classification":"M","division":"OPEN","hit_factor":7.0258},{"match_name":"FBURG USPSA November 2021","match_date":"2021-11-07","stage_classifiercode":"06-10","member_number":"TY97341","first_name":"JAMES","last_name":"HAN","classification":"M","division":"OPEN","hit_factor":7.0258},{"match_name":"Richmond March 6-2015 USPSA Pistol Match","match_date":"2016-03-06","stage_classifiercode":"06-10","member_number":"A33147","first_name":"VINCE","last_name":"DIONISIO","classification":"B","division":"OPEN","hit_factor":7.0258},{"match_name":"Eagles Nest July 30th","match_date":"2017-07-30","stage_classifiercode":"06-10","member_number":"L2450","first_name":"BUD","last_name":"CONNOLLY","classification":"B","division":"OPEN","hit_factor":7.0093},{"match_name":"LdF USPSA Match May 27 2017","match_date":"2017-05-27","stage_classifiercode":"06-10","member_number":"A87556","first_name":"ROB","last_name":"CHOI","classification":"M","division":"OPEN","hit_factor":7.0093},{"match_name":"CFRPC November USPSA","match_date":"2018-11-18","stage_classifiercode":"06-10","member_number":"TY89423","first_name":"MARCUS","last_name":"COSTA","classification":"A","division":"OPEN","hit_factor":7.0093},{"match_name":"HOPS USPSA 1020018 ","match_date":"2018-10-19","stage_classifiercode":"06-10","member_number":"FY29453","first_name":"JD","last_name":"SMITH","classification":"U","division":"OPEN","hit_factor":6.993},{"match_name":"Steel City USPSA September 3 2016","match_date":"2016-09-03","stage_classifiercode":"06-10","member_number":"A92947","first_name":"JAYSON","last_name":"FRIEDMAN","classification":"C","division":"OPEN","hit_factor":6.993},{"match_name":"FBURG USPSA November 2021","match_date":"2021-11-07","stage_classifiercode":"06-10","member_number":"TY97341","first_name":"JAMES","last_name":"HAN","classification":"M","division":"OPEN","hit_factor":6.993},{"match_name":"Ontelaunee USPSA September 2016","match_date":"2016-09-24","stage_classifiercode":"06-10","member_number":"L3851","first_name":"JEFF","last_name":"PAULSEN","classification":"B","division":"OPEN","hit_factor":6.9767},{"match_name":"TGC USPSA JANUARY 2018","match_date":"2018-01-20","stage_classifiercode":"06-10","member_number":"A82591","first_name":"WADE","last_name":"WHETSTONE","classification":"G","division":"OPEN","hit_factor":6.9767},{"match_name":"SPSA USPSA March 4th Sat match","match_date":"2021-03-27","stage_classifiercode":"06-10","member_number":"A87382","first_name":"CHRIS","last_name":"BRITT","classification":"B","division":"OPEN","hit_factor":6.9767},{"match_name":"MASTER BLASTERS & SSFGA USPSA - September","match_date":"2021-09-18","stage_classifiercode":"06-10","member_number":"A54034","first_name":"NEIL","last_name":"VAUGHAN","classification":"B","division":"OPEN","hit_factor":6.9767},{"match_name":"NCPS USPSA Handgun Match March 25 2018z","match_date":"2018-03-25","stage_classifiercode":"06-10","member_number":"A51918","first_name":"TIM","last_name":"BOFMAN","classification":"A","division":"OPEN","hit_factor":6.9767},{"match_name":"Richmond hotshots April 16-17 2016 USPSA Pistol match","match_date":"2016-04-16","stage_classifiercode":"06-10","member_number":"A38711","first_name":"KENNETH","last_name":"MELTON","classification":"B","division":"OPEN","hit_factor":6.9767},{"match_name":"DGC USPSA 01-14-18","match_date":"2018-01-14","stage_classifiercode":"06-10","member_number":"FY28307","first_name":"DAN","last_name":"MITCHELL","classification":"M","division":"OPEN","hit_factor":6.9606},{"match_name":"Springfield Tactical Shooters 12-3-15","match_date":"2015-12-03","stage_classifiercode":"06-10","member_number":"L2281","first_name":"J","last_name":"GRIFFIN","classification":"A","division":"OPEN","hit_factor":6.9606},{"match_name":"Richmond Hot Shots July 15-16-2017 USPSA Pistol Match","match_date":"2017-07-15","stage_classifiercode":"06-10","member_number":"A96836","first_name":"JOSEF","last_name":"RAPADAS","classification":"A","division":"OPEN","hit_factor":6.9606},{"match_name":"PCWC USPSA  9 26 2020","match_date":"2020-09-26","stage_classifiercode":"06-10","member_number":"A122278","first_name":"VINCENT","last_name":"PALMIERI","classification":"M","division":"OPEN","hit_factor":6.9606},{"match_name":"MS06 Team Magnolia USPSA November Match","match_date":"2016-11-06","stage_classifiercode":"06-10","member_number":"L3696","first_name":"ROBERT","last_name":"HALSELL","classification":"A","division":"OPEN","hit_factor":6.9606},{"match_name":"OREGON ARPC CC05 USPSA JUNE 10 2017","match_date":"2017-06-10","stage_classifiercode":"06-10","member_number":"L3292","first_name":"BILL","last_name":"MARRS","classification":"B","division":"OPEN","hit_factor":6.9606},{"match_name":"Richmond hotshots April 16-17 2016 USPSA Pistol match","match_date":"2016-04-16","stage_classifiercode":"06-10","member_number":"A84616","first_name":"MJ","last_name":"FINEZA","classification":"A","division":"OPEN","hit_factor":6.9606},{"match_name":"Sharp Practical Shooters August USPSA - Outdoor","match_date":"2021-08-22","stage_classifiercode":"06-10","member_number":"A136580","first_name":"DYLAN","last_name":"SHIREY","classification":"X","division":"OPEN","hit_factor":6.9444},{"match_name":"PRPS USPSA Jun  24 2018","match_date":"2018-06-17","stage_classifiercode":"06-10","member_number":"A54549","first_name":"ROBERT","last_name":"BARNES","classification":"A","division":"OPEN","hit_factor":6.9284},{"match_name":"APS August 1st Monthly USPSA Match  Classifier Match","match_date":"2021-08-01","stage_classifiercode":"06-10","member_number":"TY119222","first_name":"CLARK","last_name":"DARLEY","classification":"C","division":"OPEN","hit_factor":6.9284},{"match_name":"OFGC USPSA Match 11-18-17","match_date":"2017-11-18","stage_classifiercode":"06-10","member_number":"A50566","first_name":"NICK","last_name":"GOLDEN","classification":"C","division":"OPEN","hit_factor":6.9284},{"match_name":"SWGC USPSA Pistol Match - March 2020","match_date":"2020-03-07","stage_classifiercode":"06-10","member_number":"FY96230","first_name":"DALE","last_name":"COBERLY","classification":"A","division":"OPEN","hit_factor":6.9284},{"match_name":"CCAS December 2017 Special Classifier","match_date":"2017-12-16","stage_classifiercode":"06-10","member_number":"FY80542","first_name":"DIANA","last_name":"DRISCOLL","classification":"B","division":"OPEN","hit_factor":6.9124},{"match_name":"NOCPC May 2018","match_date":"2018-05-13","stage_classifiercode":"06-10","member_number":"A58061","first_name":"JEFF","last_name":"KATAKIS","classification":"B","division":"OPEN","hit_factor":6.9124},{"match_name":"MASTER BLASTERS & SSFGA USPSA - September","match_date":"2021-09-18","stage_classifiercode":"06-10","member_number":"Ty82118","first_name":"PETER","last_name":"GILBERT","classification":"A","division":"OPEN","hit_factor":6.9124},{"match_name":"MPSA 2020-01-02","match_date":"2021-01-02","stage_classifiercode":"06-10","member_number":"TY42086","first_name":"BILL","last_name":"JACKSON","classification":"A","division":"OPEN","hit_factor":6.8966},{"match_name":"RangeMasters 9-29-2016","match_date":"2016-09-29","stage_classifiercode":"06-10","member_number":"A94852","first_name":"RANDY","last_name":"GOODNEY","classification":"C","division":"OPEN","hit_factor":6.8966},{"match_name":"HOPS USPSA 081917","match_date":"2017-08-19","stage_classifiercode":"06-10","member_number":"L1870","first_name":"LES","last_name":"COX","classification":"M","division":"OPEN","hit_factor":6.8966},{"match_name":"LdF USPSA Match May 27 2017","match_date":"2017-05-27","stage_classifiercode":"06-10","member_number":"A83348","first_name":"GABRIEL","last_name":"ESTRADA","classification":"C","division":"OPEN","hit_factor":6.8966},{"match_name":"Alpha Mike Oct 2017","match_date":"2017-10-15","stage_classifiercode":"06-10","member_number":"TY81213","first_name":"TOM","last_name":"HEFNER","classification":"C","division":"OPEN","hit_factor":6.8966},{"match_name":"ESPS USPSA July 2017","match_date":"2017-07-22","stage_classifiercode":"06-10","member_number":"A82429","first_name":"DAVID","last_name":"HEALEY 2","classification":"A","division":"OPEN","hit_factor":6.8807},{"match_name":"Ontelaunee USPSA September 2016","match_date":"2016-09-24","stage_classifiercode":"06-10","member_number":"A93363","first_name":"DEAN","last_name":"CHASSE","classification":"C","division":"OPEN","hit_factor":6.8807},{"match_name":"Deadwood Boys USPSA All Classifier Match - 29 July 2018","match_date":"2018-07-29","stage_classifiercode":"06-10","member_number":"A112576","first_name":"KHOI","last_name":"PHAM","classification":"U","division":"OPEN","hit_factor":6.8807},{"match_name":"HPS Hot Summer Fun Club Match","match_date":"2017-07-22","stage_classifiercode":"06-10","member_number":"FY45196","first_name":"NESTOR","last_name":"TANI","classification":"A","division":"OPEN","hit_factor":6.8807},{"match_name":"AIPS Weekly USPSA 21 August 2018","match_date":"2018-08-21","stage_classifiercode":"06-10","member_number":"TY4180","first_name":"JAY","last_name":"TAPPE","classification":"A","division":"OPEN","hit_factor":6.8807},{"match_name":"ARPC USPSA Match 8-26-18","match_date":"2018-08-26","stage_classifiercode":"06-10","member_number":"A66661","first_name":"CHRISTINE","last_name":"GUINN","classification":"B","division":"OPEN","hit_factor":6.8807},{"match_name":"Salt City practical shooting league 'all classifier match'","match_date":"2020-08-30","stage_classifiercode":"06-10","member_number":"A129181","first_name":"SAMUEL","last_name":"FERRIS","classification":"U","division":"OPEN","hit_factor":6.865},{"match_name":"CCPL - June 2021","match_date":"2021-06-19","stage_classifiercode":"06-10","member_number":"TY91802","first_name":"STEVEN","last_name":"WESCOTT","classification":"B","division":"OPEN","hit_factor":6.865},{"match_name":"Oregon ARPC November Match","match_date":"2015-11-14","stage_classifiercode":"06-10","member_number":"TY45892","first_name":"RICHARD","last_name":"BROWNING","classification":"B","division":"OPEN","hit_factor":6.865},{"match_name":"RBGC 2016-10-22","match_date":"2016-10-22","stage_classifiercode":"06-10","member_number":"TY49008","first_name":"MOON","last_name":"JEONG","classification":"A","division":"OPEN","hit_factor":6.865},{"match_name":"ESPS USPSA July 2017","match_date":"2017-07-22","stage_classifiercode":"06-10","member_number":"TY68347","first_name":"MIKE","last_name":"VALENTINE","classification":"A","division":"OPEN","hit_factor":6.8493},{"match_name":"Shadow Hawk Defense USPSA - Aug","match_date":"2021-08-14","stage_classifiercode":"06-10","member_number":"TY104682","first_name":"KEVIN","last_name":"GOROSPE","classification":"G","division":"OPEN","hit_factor":6.8493},{"match_name":"LCSC Linden USPSA 061018","match_date":"2018-06-10","stage_classifiercode":"06-10","member_number":"TY11898","first_name":"NOLAN","last_name":"SMYTH","classification":"M","division":"OPEN","hit_factor":6.8493},{"match_name":"EHPSA USPSA 27June 2021","match_date":"2021-06-27","stage_classifiercode":"06-10","member_number":"TY87293","first_name":"EARL","last_name":"COWHER","classification":"B","division":"OPEN","hit_factor":6.8493},{"match_name":"LCSC Linden USPSA 120918","match_date":"2018-12-09","stage_classifiercode":"06-10","member_number":"A93293","first_name":"ROSS","last_name":"SAN","classification":"B","division":"OPEN","hit_factor":6.8493},{"match_name":"Hampden RPC June USPSA Match","match_date":"2018-06-10","stage_classifiercode":"06-10","member_number":"A105968","first_name":"JAY","last_name":"BEAL","classification":"M","division":"OPEN","hit_factor":6.8493},{"match_name":"NCPS USPSA Handgun Match March 25 2018z","match_date":"2018-03-25","stage_classifiercode":"06-10","member_number":"TY91248","first_name":"DAVID","last_name":"GEORGE","classification":"A","division":"OPEN","hit_factor":6.8337},{"match_name":"Harvard Action Shooters August 2016 USPSA Pistol","match_date":"2016-08-14","stage_classifiercode":"06-10","member_number":"A39028","first_name":"JOHN","last_name":"SARDINA","classification":"A","division":"OPEN","hit_factor":6.8182},{"match_name":"Richmond Hot Shots July 15-16-2017 USPSA Pistol Match","match_date":"2017-07-15","stage_classifiercode":"06-10","member_number":"TY74322","first_name":"ANDRE","last_name":"TAUBE","classification":"A","division":"OPEN","hit_factor":6.8182},{"match_name":"Mrpc Minot All Classifier Match","match_date":"2018-07-21","stage_classifiercode":"06-10","member_number":"A103957","first_name":"TAYLOR","last_name":"BURACZEWSKI","classification":"B","division":"OPEN","hit_factor":6.8182},{"match_name":"OSC April USPSA","match_date":"2021-04-18","stage_classifiercode":"06-10","member_number":"A91860","first_name":"COLE","last_name":"HORNBACK","classification":"A","division":"OPEN","hit_factor":6.8182},{"match_name":"FBURG March 2021 Level I USPSA ","match_date":"2021-03-06","stage_classifiercode":"06-10","member_number":"TY97341","first_name":"JAMES","last_name":"HAN","classification":"A","division":"OPEN","hit_factor":6.8182},{"match_name":"NCPS USPSA Handgun Match March 25 2018z","match_date":"2018-03-25","stage_classifiercode":"06-10","member_number":"TY46152","first_name":"ALLEN","last_name":"LOWE","classification":"M","division":"OPEN","hit_factor":6.8182},{"match_name":"Shadow Hawk Defense USPSA - Aug","match_date":"2021-08-14","stage_classifiercode":"06-10","member_number":"TY109443","first_name":"JASON","last_name":"TAJIMA 2","classification":"A","division":"OPEN","hit_factor":6.8027},{"match_name":"Gem City Gun Club 9-1 and 9-2-2018","match_date":"2018-09-01","stage_classifiercode":"06-10","member_number":"TY70258","first_name":"WILSON","last_name":"CURRY","classification":"C","division":"OPEN","hit_factor":6.8027},{"match_name":"Richmond Hot Shots September 1st-2nd 2018 USPSA Pistol Match","match_date":"2018-09-01","stage_classifiercode":"06-10","member_number":"TY79640","first_name":"ELPIDIO","last_name":"CORPUZ","classification":"A","division":"OPEN","hit_factor":6.8027},{"match_name":"OREGON ARPC CC05 USPSA JUNE 10 2017","match_date":"2017-06-10","stage_classifiercode":"06-10","member_number":"L4199","first_name":"JAN","last_name":"MCDONALD","classification":"C","division":"OPEN","hit_factor":6.8027},{"match_name":"CCPS June 2016","match_date":"2016-06-19","stage_classifiercode":"06-10","member_number":"FY78165","first_name":"BILL","last_name":"JOHNSON IV","classification":"\"\"","division":"OPEN","hit_factor":6.7873},{"match_name":"WSPS JUNE 2017 USPSA MATCH","match_date":"2017-06-17","stage_classifiercode":"06-10","member_number":"A82014","first_name":"TONY","last_name":"SPINILLO","classification":"B","division":"OPEN","hit_factor":6.7873},{"match_name":"APS August 1st Monthly USPSA Match  Classifier Match","match_date":"2021-08-01","stage_classifiercode":"06-10","member_number":"TY106854","first_name":"ODED","last_name":"ZYSSMAN","classification":"B","division":"OPEN","hit_factor":6.7873},{"match_name":"LCSA USPSA May 2017","match_date":"2017-05-13","stage_classifiercode":"06-10","member_number":"fy83046","first_name":"THOMAS","last_name":"GILLECE","classification":"B","division":"OPEN","hit_factor":6.7873},{"match_name":"Quantico QPS QSC USPSA Match 9 APR 2017","match_date":"2017-04-09","stage_classifiercode":"06-10","member_number":"A81138","first_name":"CHRISTOPHER","last_name":"GARRETT","classification":"C","division":"OPEN","hit_factor":6.7873},{"match_name":"OFGC USPSA Match Oct 16","match_date":"2016-10-16","stage_classifiercode":"06-10","member_number":"TY34745","first_name":"KEITH","last_name":"HAMMOND","classification":"B","division":"OPEN","hit_factor":6.7873},{"match_name":"AGC_20170507","match_date":"2017-05-07","stage_classifiercode":"06-10","member_number":"TY18366","first_name":"RICK","last_name":"HEBERT","classification":"M","division":"OPEN","hit_factor":6.7873},{"match_name":"SWGC USPSA Pistol Match - March 2020","match_date":"2020-03-07","stage_classifiercode":"06-10","member_number":"A107282","first_name":"AARON","last_name":"EDDINS","classification":"GM","division":"OPEN","hit_factor":6.7873},{"match_name":"CIPSC Havana May USPSA","match_date":"2018-05-12","stage_classifiercode":"06-10","member_number":"TY72670","first_name":"DALE","last_name":"HARDING","classification":"B","division":"OPEN","hit_factor":6.7720090293454},{"match_name":"Hosemasters 2nd Sunday August 2017","match_date":"2017-08-13","stage_classifiercode":"06-10","member_number":"TY18698","first_name":"MICHAEL","last_name":"DALE","classification":"M","division":"OPEN","hit_factor":6.772},{"match_name":"Oxford OHS05 090521","match_date":"2021-09-05","stage_classifiercode":"06-10","member_number":"A57378","first_name":"RYAN","last_name":"ZAMBERLAN","classification":"M","division":"OPEN","hit_factor":6.772},{"match_name":"GRPC USPSA DO YOU FEEL LUCKY?","match_date":"2021-03-07","stage_classifiercode":"06-10","member_number":"A75212","first_name":"STEVEN","last_name":"MCNAMARA","classification":"B","division":"OPEN","hit_factor":6.772},{"match_name":"HOPS USPSA 1020018 ","match_date":"2018-10-19","stage_classifiercode":"06-10","member_number":"A100931","first_name":"CALEB","last_name":"PATERSON","classification":"A","division":"OPEN","hit_factor":6.7568},{"match_name":"Custer Uspsa December","match_date":"2018-12-02","stage_classifiercode":"06-10","member_number":"FY23884","first_name":"GREG","last_name":"PURCELL","classification":"A","division":"OPEN","hit_factor":6.7568},{"match_name":"Springfield Tactical Shooters 12-3-15","match_date":"2015-12-03","stage_classifiercode":"06-10","member_number":"L1467","first_name":"CHARLIE","last_name":"MORSE","classification":"B","division":"OPEN","hit_factor":6.7568},{"match_name":"LCSA USPSA May 2017","match_date":"2017-05-13","stage_classifiercode":"06-10","member_number":"ty77032","first_name":"TYLER","last_name":"COKE","classification":"B","division":"OPEN","hit_factor":6.7568},{"match_name":"OFGC USPSA Match Oct 16","match_date":"2016-10-16","stage_classifiercode":"06-10","member_number":"TY55378","first_name":"TRAVIS","last_name":"THOMPSON","classification":"A","division":"OPEN","hit_factor":6.7568},{"match_name":"LdF USPSA Match May 27 2017","match_date":"2017-05-27","stage_classifiercode":"06-10","member_number":"TY67966","first_name":"MIKE","last_name":"HOLLINGSWORTH","classification":"M","division":"OPEN","hit_factor":6.7568},{"match_name":"Richmond Hot Shots July 15-16-2017 USPSA Pistol Match","match_date":"2017-07-15","stage_classifiercode":"06-10","member_number":"L2191","first_name":"STEVE","last_name":"WONG","classification":"M","division":"OPEN","hit_factor":6.7416},{"match_name":"ORSA USPSA Classifier Side  Match Feb 2017","match_date":"2017-02-18","stage_classifiercode":"06-10","member_number":"A88965","first_name":"JOSHUA","last_name":"VELEZ","classification":"C","division":"OPEN","hit_factor":6.7416},{"match_name":"SPSA September USPSA 1st Sat Match","match_date":"2015-09-05","stage_classifiercode":"06-10","member_number":"TY66249","first_name":"BILL","last_name":"ROBERTS","classification":"A","division":"OPEN","hit_factor":6.7265},{"match_name":"CCPS July 2018 USPSA","match_date":"2018-07-15","stage_classifiercode":"06-10","member_number":"Fy29453","first_name":"JD","last_name":"SMITH","classification":"U","division":"OPEN","hit_factor":6.7265},{"match_name":"Springfield Tactical Shooters 09-07-2017","match_date":"2017-09-07","stage_classifiercode":"06-10","member_number":"L1467","first_name":"CHARLES","last_name":"MORSE","classification":"U","division":"OPEN","hit_factor":6.7265},{"match_name":"December 2017 CAS USPSA","match_date":"2017-12-03","stage_classifiercode":"06-10","member_number":"FY81419","first_name":"JOHN","last_name":"NGUYEN","classification":"M","division":"OPEN","hit_factor":6.7265},{"match_name":"Oregon ARPC November Match","match_date":"2015-11-14","stage_classifiercode":"06-10","member_number":"A4993","first_name":"BUTCH","last_name":"MASSONI","classification":"M","division":"OPEN","hit_factor":6.7265},{"match_name":"Collin County USPSA 11-28-2021","match_date":"2021-11-28","stage_classifiercode":"06-10","member_number":"A129293","first_name":"\"THY (\"\"TEE\"\")\"","last_name":"NGO","classification":"B","division":"OPEN","hit_factor":6.7265},{"match_name":"LdF USPSA Match May 27 2017","match_date":"2017-05-27","stage_classifiercode":"06-10","member_number":"FY51774","first_name":"ED","last_name":"CHINCHILLA","classification":"M","division":"OPEN","hit_factor":6.7265},{"match_name":"NCPS USPSA Handgun Match March 25 2018z","match_date":"2018-03-25","stage_classifiercode":"06-10","member_number":"FY62950","first_name":"DARRELL","last_name":"INOUYE","classification":"A","division":"OPEN","hit_factor":6.7265},{"match_name":"Richmond hotshots April 16-17 2016 USPSA Pistol match","match_date":"2016-04-16","stage_classifiercode":"06-10","member_number":"L2249","first_name":"NORBERT","last_name":"BARAOIDAN","classification":"M","division":"OPEN","hit_factor":6.7265},{"match_name":"CGC 2016-01-09","match_date":"2016-01-09","stage_classifiercode":"06-10","member_number":"TY52571","first_name":"PETER","last_name":"OLIVER","classification":"M","division":"OPEN","hit_factor":6.7114},{"match_name":"Gem City Gun Club 11-4 and 11-5","match_date":"2017-11-04","stage_classifiercode":"06-10","member_number":"A93980","first_name":"KENNETH","last_name":"LALIBERTE","classification":"B","division":"OPEN","hit_factor":6.6964},{"match_name":"Gem City Gun Club 4-7 and 4-8-18","match_date":"2018-04-07","stage_classifiercode":"06-10","member_number":"L2450","first_name":"BUD","last_name":"CONNOLLY","classification":"B","division":"OPEN","hit_factor":6.6964},{"match_name":"RBGC 2016-10-22","match_date":"2016-10-22","stage_classifiercode":"06-10","member_number":"L1028","first_name":"TATA","last_name":"EUSEBIO","classification":"M","division":"OPEN","hit_factor":6.6964},{"match_name":"LdF USPSA Match July 11 2021","match_date":"2021-07-11","stage_classifiercode":"06-10","member_number":"TY17381","first_name":"JOHN","last_name":"HURST","classification":"A","division":"OPEN","hit_factor":6.6815},{"match_name":"Richmond Hot Shots July 15-16-2017 USPSA Pistol Match","match_date":"2017-07-15","stage_classifiercode":"06-10","member_number":"L3415","first_name":"RICKY","last_name":"FONG","classification":"C","division":"OPEN","hit_factor":6.6815},{"match_name":"WSPS OCTOBER 2018 USPSA MATCH","match_date":"2018-10-20","stage_classifiercode":"06-10","member_number":"L3202","first_name":"RUSSELL","last_name":"FORTNEY","classification":"A","division":"OPEN","hit_factor":6.6815},{"match_name":"MVPSA USPSA 12-01-18","match_date":"2018-12-01","stage_classifiercode":"06-10","member_number":"a103560","first_name":"RILEY","last_name":"COOPER","classification":"A","division":"OPEN","hit_factor":6.6815},{"match_name":"Collin County USPSA 11-28-2021","match_date":"2021-11-28","stage_classifiercode":"06-10","member_number":"TY82289","first_name":"JEREMY","last_name":"DYER","classification":"B","division":"OPEN","hit_factor":6.6815},{"match_name":"2021-03 Bone Creek USPSA","match_date":"2021-03-07","stage_classifiercode":"06-10","member_number":"A106540","first_name":"CAMERON","last_name":"CAHN","classification":"U","division":"OPEN","hit_factor":6.6667},{"match_name":"SWGC USPSA Pistol Match - December 2018","match_date":"2018-12-01","stage_classifiercode":"06-10","member_number":"FY96230","first_name":"DALE","last_name":"COBERLY","classification":"B","division":"OPEN","hit_factor":6.6667},{"match_name":"Nampa USPSA December 20th 2020","match_date":"2020-12-20","stage_classifiercode":"06-10","member_number":"A530","first_name":"JERRY","last_name":"DIX","classification":"M","division":"OPEN","hit_factor":6.6667},{"match_name":"WVRPC USPSA 4 JUNE 2016","match_date":"2016-06-04","stage_classifiercode":"06-10","member_number":"TY86867","first_name":"ANDREW","last_name":"HEATH","classification":"U","division":"OPEN","hit_factor":6.6667},{"match_name":"EWPSA 2018-01","match_date":"2018-01-21","stage_classifiercode":"06-10","member_number":"TY42863","first_name":"MIKE","last_name":"MCCARTY","classification":"B","division":"OPEN","hit_factor":6.6667},{"match_name":"AGC_20170507","match_date":"2017-05-07","stage_classifiercode":"06-10","member_number":"A71925","first_name":"LAUREN","last_name":"CANNON","classification":"U","division":"OPEN","hit_factor":6.6667},{"match_name":"CIPSC Havana May USPSA","match_date":"2018-05-12","stage_classifiercode":"06-10","member_number":"TY53381","first_name":"ROB","last_name":"KOSACK","classification":"A","division":"OPEN","hit_factor":6.6666666666667},{"match_name":"Gem City Gun Club 11-4 and 11-5","match_date":"2017-11-04","stage_classifiercode":"06-10","member_number":"L1963","first_name":"DENNIS","last_name":"MICHALI","classification":"A","division":"OPEN","hit_factor":6.6519},{"match_name":"SAPSA May 2016","match_date":"2016-05-21","stage_classifiercode":"06-10","member_number":"A89495","first_name":"MIGUEL","last_name":"PLATINO","classification":"B","division":"OPEN","hit_factor":6.6519},{"match_name":"NVSA USPSA 1712","match_date":"2017-12-03","stage_classifiercode":"06-10","member_number":"TY64320","first_name":"ROBERT","last_name":"SHARP","classification":"B","division":"OPEN","hit_factor":6.6519},{"match_name":"SMPS March 2016","match_date":"2016-03-13","stage_classifiercode":"06-10","member_number":"L2902","first_name":"ROBERT","last_name":"KING","classification":"A","division":"OPEN","hit_factor":6.6519},{"match_name":"Richmond March 6-2015 USPSA Pistol Match","match_date":"2016-03-06","stage_classifiercode":"06-10","member_number":"A25441","first_name":"WALTER","last_name":"HASHIMOTO","classification":"A","division":"OPEN","hit_factor":6.6519},{"match_name":"OFGC USPSA Match 11-18-17","match_date":"2017-11-18","stage_classifiercode":"06-10","member_number":"A79174","first_name":"BRIXEY","last_name":"NELSON","classification":"M","division":"OPEN","hit_factor":6.6372},{"match_name":"Vaxd Retd Master Blasters USPSA","match_date":"2021-09-17","stage_classifiercode":"06-10","member_number":"A4665","first_name":"LIGHTNIN LARRY","last_name":"HUSSEY","classification":"A","division":"OPEN","hit_factor":6.6372},{"match_name":"Warsaw USPSA 5-8-2021 -SATURDAY- IN21 WRPC","match_date":"2021-05-08","stage_classifiercode":"06-10","member_number":"L5008","first_name":"ANDREW","last_name":"HEATH","classification":"M","division":"OPEN","hit_factor":6.6225},{"match_name":"SWGC USPSA Pistol Match - December 2018","match_date":"2018-12-01","stage_classifiercode":"06-10","member_number":"TY39085","first_name":"MARTIN","last_name":"LITTLE","classification":"M","division":"OPEN","hit_factor":6.6225},{"match_name":"GCL Saturday 3-6-2021","match_date":"2021-03-06","stage_classifiercode":"06-10","member_number":"FY39257","first_name":"PAUL","last_name":"ROBERTS","classification":"M","division":"OPEN","hit_factor":6.6225},{"match_name":"WVPPS October 2015","match_date":"2015-10-18","stage_classifiercode":"06-10","member_number":"TY17278","first_name":"STEVE","last_name":"WRIGHT","classification":"B","division":"OPEN","hit_factor":6.6225},{"match_name":"Richmond hotshots April 16-17 2016 USPSA Pistol match","match_date":"2016-04-16","stage_classifiercode":"06-10","member_number":"A88783","first_name":"JOHNMAR","last_name":"SAMSON","classification":"B","division":"OPEN","hit_factor":6.6225},{"match_name":"AGC_20160403","match_date":"2016-04-03","stage_classifiercode":"06-10","member_number":"A76192","first_name":"CARLOS","last_name":"SANCHEZ","classification":"X","division":"OPEN","hit_factor":6.6079},{"match_name":"PTPC November 4th  USPSA Match","match_date":"2018-11-04","stage_classifiercode":"06-10","member_number":"A78070","first_name":"MARK","last_name":"SORENSEN","classification":"A","division":"OPEN","hit_factor":6.5934},{"match_name":"Pima Pistol Club October 9th USPSA w\\Classifier","match_date":"2016-10-09","stage_classifiercode":"06-10","member_number":"TY76764","first_name":"CHARLES","last_name":"PHILPOT","classification":"C","division":"OPEN","hit_factor":6.5934},{"match_name":"Oregon ARPC November Match","match_date":"2015-11-14","stage_classifiercode":"06-10","member_number":"FY58474","first_name":"JAN","last_name":"MCDONALD","classification":"C","division":"OPEN","hit_factor":6.5934},{"match_name":"RBGC USPSA 2021-8-28","match_date":"2021-08-28","stage_classifiercode":"06-10","member_number":"A120007","first_name":"DIMA","last_name":"ULBERG","classification":"B","division":"OPEN","hit_factor":6.5934},{"match_name":"CCPL 04-25-2021","match_date":"2021-04-25","stage_classifiercode":"06-10","member_number":"A88732","first_name":"TIGER","last_name":"NGUYEN","classification":"M","division":"OPEN","hit_factor":6.5789},{"match_name":"Ontelaunee USPSA September 2016","match_date":"2016-09-24","stage_classifiercode":"06-10","member_number":"A33985","first_name":"DONALD","last_name":"SEIGLE","classification":"M","division":"OPEN","hit_factor":6.5789},{"match_name":"Steel City USPSA September 3 2016","match_date":"2016-09-03","stage_classifiercode":"06-10","member_number":"TY82463","first_name":"DAVID","last_name":"MARTIAN","classification":"C","division":"OPEN","hit_factor":6.5789},{"match_name":"LCSA USPSA May 2017","match_date":"2017-05-13","stage_classifiercode":"06-10","member_number":"A80108","first_name":"KEN","last_name":"DITTIG","classification":"C","division":"OPEN","hit_factor":6.5789},{"match_name":"Oregon ARPC November Match","match_date":"2015-11-14","stage_classifiercode":"06-10","member_number":"ty85507","first_name":"JONATHAN","last_name":"PURTZER","classification":"U","division":"OPEN","hit_factor":6.5789},{"match_name":"WVRPC USPSA 4 JUNE 2016","match_date":"2016-06-04","stage_classifiercode":"06-10","member_number":"\"\"","first_name":"ROD","last_name":"SHURMAN","classification":"\"\"","division":"OPEN","hit_factor":6.5646},{"match_name":"Oxford OHS05 090521","match_date":"2021-09-05","stage_classifiercode":"06-10","member_number":"A68907","first_name":"ANDREW","last_name":"HYDER","classification":"G","division":"OPEN","hit_factor":6.5502},{"match_name":"Monson April 2017 USPSA","match_date":"2017-04-23","stage_classifiercode":"06-10","member_number":"A28945","first_name":"SCOTT","last_name":"BOTELHO","classification":"G","division":"OPEN","hit_factor":6.5502},{"match_name":"Collin County USPSA 11-28-2021","match_date":"2021-11-28","stage_classifiercode":"06-10","member_number":"TY72510","first_name":"MICHAEL","last_name":"BATHON","classification":"B","division":"OPEN","hit_factor":6.5502},{"match_name":"WGC WI USPSA Monthly Match 10-21-17","match_date":"2017-10-21","stage_classifiercode":"06-10","member_number":"A71862","first_name":"JOSEPH","last_name":"SINYAKOVICH","classification":"B","division":"OPEN","hit_factor":6.5359},{"match_name":"CGGR May USPSA Match","match_date":"2017-05-20","stage_classifiercode":"06-10","member_number":"L729","first_name":"ROBERT","last_name":"WALKER","classification":"A","division":"OPEN","hit_factor":6.5359},{"match_name":"LdF USPSA Match May 27 2017","match_date":"2017-05-27","stage_classifiercode":"06-10","member_number":"TY99494","first_name":"RUI","last_name":"LIU","classification":"B","division":"OPEN","hit_factor":6.5359},{"match_name":"AGC_20170507","match_date":"2017-05-07","stage_classifiercode":"06-10","member_number":"A74075","first_name":"KAIDEN","last_name":"DOBYNS","classification":"U","division":"OPEN","hit_factor":6.5359},{"match_name":"ESPS USPSA July 2017","match_date":"2017-07-22","stage_classifiercode":"06-10","member_number":"A88350","first_name":"DAVID","last_name":"WAMPLER","classification":"G","division":"OPEN","hit_factor":6.5217},{"match_name":"MPPL 20200301","match_date":"2020-03-01","stage_classifiercode":"06-10","member_number":"TY116351","first_name":"EDISON","last_name":"BRONOLA","classification":"C","division":"OPEN","hit_factor":6.5217},{"match_name":"AGC_20160403","match_date":"2016-04-03","stage_classifiercode":"06-10","member_number":"A69423","first_name":"JOSH","last_name":"HORNER","classification":"M","division":"OPEN","hit_factor":6.5217},{"match_name":"SFPS 05-15-2016 SuperClassifier - First Division","match_date":"2016-05-15","stage_classifiercode":"06-10","member_number":"A27012","first_name":"TERRY","last_name":"GOEHRING","classification":"C","division":"OPEN","hit_factor":6.5217},{"match_name":"CCPL - June 2021","match_date":"2021-06-19","stage_classifiercode":"06-10","member_number":"TY84357","first_name":"RAY","last_name":"DONCH","classification":"B","division":"OPEN","hit_factor":6.5076},{"match_name":"HRRB 12-01-2018","match_date":"2018-12-01","stage_classifiercode":"06-10","member_number":"FY85757","first_name":"EDGAR","last_name":"VICENTE","classification":"C","division":"OPEN","hit_factor":6.5076},{"match_name":"AIPS Weekly USPSA 21 August 2018","match_date":"2018-08-21","stage_classifiercode":"06-10","member_number":"TY97332","first_name":"CLIFFORD","last_name":"SCOTT","classification":"C","division":"OPEN","hit_factor":6.5076},{"match_name":"GCL December 5-2020","match_date":"2020-12-05","stage_classifiercode":"06-10","member_number":"FY39257","first_name":"PAUL","last_name":"ROBERTS","classification":"M","division":"OPEN","hit_factor":6.5076},{"match_name":"Shadow Hawk Defense USPSA - Aug","match_date":"2021-08-14","stage_classifiercode":"06-10","member_number":"A72815","first_name":"BRETT","last_name":"DAVENPORT","classification":"A","division":"OPEN","hit_factor":6.4935},{"match_name":"ITPSC September USPSA Match","match_date":"2015-09-19","stage_classifiercode":"06-10","member_number":"A71435","first_name":"FEEGEE","last_name":"MATLOCK","classification":"A","division":"OPEN","hit_factor":6.4935},{"match_name":"Hampden RPC May USPSA","match_date":"2016-05-01","stage_classifiercode":"06-10","member_number":"A54181","first_name":"ED","last_name":"LEE","classification":"B","division":"OPEN","hit_factor":6.4935},{"match_name":"YRPA  9/25/16  USPSA Pistol Match","match_date":"2016-09-23","stage_classifiercode":"06-10","member_number":"A80666","first_name":"SHANE","last_name":"HILL","classification":"G","division":"OPEN","hit_factor":6.4935},{"match_name":"LdF 4th Saturday Match","match_date":"2015-11-28","stage_classifiercode":"06-10","member_number":"A87556","first_name":"ROB","last_name":"CHOI","classification":"B","division":"OPEN","hit_factor":6.4935},{"match_name":"WELD ECO09 20180617","match_date":"2018-06-17","stage_classifiercode":"06-10","member_number":"TY61523","first_name":"DAVE","last_name":"MILLER","classification":"A","division":"OPEN","hit_factor":6.4795},{"match_name":"WSPS OCTOBER 2018 USPSA MATCH","match_date":"2018-10-20","stage_classifiercode":"06-10","member_number":"TY-101530","first_name":"JEROME","last_name":"HOY","classification":"C","division":"OPEN","hit_factor":6.4795},{"match_name":"PCWC USPSA  9 26 2020","match_date":"2020-09-26","stage_classifiercode":"06-10","member_number":"TY83654","first_name":"JASON","last_name":"ROBERTS","classification":"M","division":"OPEN","hit_factor":6.4795},{"match_name":"APSC USPSA Match 10-07-17","match_date":"2017-10-07","stage_classifiercode":"06-10","member_number":"A12134","first_name":"PAUL","last_name":"PAYNE","classification":"C","division":"OPEN","hit_factor":6.4795},{"match_name":"Richmond hotshots April 16-17 2016 USPSA Pistol match","match_date":"2016-04-16","stage_classifiercode":"06-10","member_number":"TY74322","first_name":"ANDRE","last_name":"TAUBE","classification":"A","division":"OPEN","hit_factor":6.4795},{"match_name":"Shoot GTR Monthly USPSA","match_date":"2018-01-07","stage_classifiercode":"06-10","member_number":"A91218","first_name":"JOSHUA","last_name":"FLICKINGER","classification":"M","division":"OPEN","hit_factor":6.4655},{"match_name":"MPPL 20200301","match_date":"2020-03-01","stage_classifiercode":"06-10","member_number":"L2624","first_name":"MARIO","last_name":"LAYUGAN","classification":"A","division":"OPEN","hit_factor":6.4655},{"match_name":"OFGC USPSA Match 11-18-17","match_date":"2017-11-18","stage_classifiercode":"06-10","member_number":"A79715","first_name":"MICHAEL","last_name":"NELSON","classification":"B","division":"OPEN","hit_factor":6.4655},{"match_name":"DWB - Deadwood Boys USPSA 19 January 2020","match_date":"2020-01-19","stage_classifiercode":"06-10","member_number":"TY88653","first_name":"JAMES","last_name":"PARK","classification":"U","division":"OPEN","hit_factor":6.4655},{"match_name":"Pioneer Action Shooters USPSA 5-23-21 Special Classifer","match_date":"2021-05-23","stage_classifiercode":"06-10","member_number":"A122355","first_name":"JOE","last_name":"SHEPARD","classification":"U","division":"OPEN","hit_factor":6.4655},{"match_name":"SWGC USPSA Pistol Match - March 2020","match_date":"2020-03-07","stage_classifiercode":"06-10","member_number":"TY83654","first_name":"JASON","last_name":"ROBERTS","classification":"M","division":"OPEN","hit_factor":6.4655},{"match_name":"Eagles Nest July 30th","match_date":"2017-07-30","stage_classifiercode":"06-10","member_number":"\"\"","first_name":"RANDY","last_name":"ZONNA","classification":"U","division":"OPEN","hit_factor":6.4516},{"match_name":"CPS USPSA May 2017","match_date":"2017-05-06","stage_classifiercode":"06-10","member_number":"A92410","first_name":"TOM","last_name":"SAYEG","classification":"C","division":"OPEN","hit_factor":6.4516},{"match_name":"Oxford OHS05 090521","match_date":"2021-09-05","stage_classifiercode":"06-10","member_number":"A31894","first_name":"BOB","last_name":"STOUFFER","classification":"A","division":"OPEN","hit_factor":6.4516},{"match_name":"LCSC Linden USPSA 061018","match_date":"2018-06-10","stage_classifiercode":"06-10","member_number":"TY79621","first_name":"STEPHEN","last_name":"COLLEN","classification":"A","division":"OPEN","hit_factor":6.4516},{"match_name":"Gem City Gun Club 4-2-16  and 4-3-16","match_date":"2016-04-02","stage_classifiercode":"06-10","member_number":"L2450","first_name":"BUD","last_name":"CONNOLLY","classification":"B","division":"OPEN","hit_factor":6.4516},{"match_name":"Richmond hotshots April 16-17 2016 USPSA Pistol match","match_date":"2016-04-16","stage_classifiercode":"06-10","member_number":"L1620","first_name":"THOMAS","last_name":"CHAN","classification":"A","division":"OPEN","hit_factor":6.4516},{"match_name":"HOPS USPSA 1020018 ","match_date":"2018-10-19","stage_classifiercode":"06-10","member_number":"TY108017","first_name":"DONNIE","last_name":"SIMPSON","classification":"C","division":"OPEN","hit_factor":6.4378},{"match_name":"Gem City Gun Club 11-4 and 11-5","match_date":"2017-11-04","stage_classifiercode":"06-10","member_number":"A102935","first_name":"MIKE","last_name":"DAUENHAUER","classification":"B","division":"OPEN","hit_factor":6.4378},{"match_name":"HRRB 12-01-2018","match_date":"2018-12-01","stage_classifiercode":"06-10","member_number":"A91552","first_name":"AUREL","last_name":"TEMPORAL","classification":"B","division":"OPEN","hit_factor":6.4378},{"match_name":"PCWC USPSA  9 26 2020","match_date":"2020-09-26","stage_classifiercode":"06-10","member_number":"L4056","first_name":"DILLION","last_name":"WALKER","classification":"A","division":"OPEN","hit_factor":6.4378},{"match_name":"DWB - Deadwood Boys USPSA 19 January 2020","match_date":"2020-01-19","stage_classifiercode":"06-10","member_number":"A114126","first_name":"STEVEN","last_name":"RUBERT","classification":"U","division":"OPEN","hit_factor":6.4378},{"match_name":"EWPSA 2021-08","match_date":"2021-08-15","stage_classifiercode":"06-10","member_number":"A108720","first_name":"JOEL","last_name":"MCBREAIRTY","classification":"C","division":"OPEN","hit_factor":6.4378},{"match_name":"Richmond March 6-2015 USPSA Pistol Match","match_date":"2016-03-06","stage_classifiercode":"06-10","member_number":"FY18635","first_name":"JAMES","last_name":"SABUROMARU","classification":"M","division":"OPEN","hit_factor":6.4378},{"match_name":"Paul Bunyan April 7th-8th All Classifier Match NW01","match_date":"2018-04-07","stage_classifiercode":"06-10","member_number":"L3001","first_name":"LARRY","last_name":"LEONE","classification":"B","division":"OPEN","hit_factor":6.424},{"match_name":"ESPS USPSA July 2017","match_date":"2017-07-22","stage_classifiercode":"06-10","member_number":"FY72075","first_name":"\"DAVID \"\"DUCTTAPE\"\"\"","last_name":"MCMORRIS","classification":"B","division":"OPEN","hit_factor":6.424},{"match_name":"TAP USPSA February 28 2016 (28Feb16-01:01:53)","match_date":"2016-02-28","stage_classifiercode":"06-10","member_number":"A38711","first_name":"KENNETH","last_name":"MELTON","classification":"B","division":"OPEN","hit_factor":6.424},{"match_name":"Hopkinton August 2016 ","match_date":"2016-08-06","stage_classifiercode":"06-10","member_number":"TY81500","first_name":"STEWART","last_name":"GINSBERG","classification":"B","division":"OPEN","hit_factor":6.424},{"match_name":"Sharp Practical Shooters August USPSA - Outdoor","match_date":"2021-08-22","stage_classifiercode":"06-10","member_number":"A100340","first_name":"THOMAS","last_name":"MICHAELS","classification":"C","division":"OPEN","hit_factor":6.4103},{"match_name":"LBAS 201017 October Practical Match","match_date":"2020-10-17","stage_classifiercode":"06-10","member_number":"TY75163","first_name":"MIKE","last_name":"LILJEROOS","classification":"B","division":"OPEN","hit_factor":6.4103},{"match_name":"Collin County USPSA 11-28-2021","match_date":"2021-11-28","stage_classifiercode":"06-10","member_number":"TY36494","first_name":"ROBERT","last_name":"PORTER","classification":"B","division":"OPEN","hit_factor":6.4103},{"match_name":"Richmond Hot Shots September 1st-2nd 2018 USPSA Pistol Match","match_date":"2018-09-01","stage_classifiercode":"06-10","member_number":"9434","first_name":"JONATHAN","last_name":"JUNG","classification":"B","division":"OPEN","hit_factor":6.4103},{"match_name":"FBURG USPSA November 2021","match_date":"2021-11-07","stage_classifiercode":"06-10","member_number":"A133094","first_name":"PHON","last_name":"JANGTRAKOOL","classification":"U","division":"OPEN","hit_factor":6.4103},{"match_name":"September CAS Match","match_date":"2015-09-06","stage_classifiercode":"06-10","member_number":"L3707","first_name":"WOODY","last_name":"LANDRY","classification":"B","division":"OPEN","hit_factor":6.3966},{"match_name":"Monson April 2017 USPSA","match_date":"2017-04-23","stage_classifiercode":"06-10","member_number":"TY45337","first_name":"ROBERT","last_name":"POWELL","classification":"X","division":"OPEN","hit_factor":6.3966},{"match_name":"MVPSA USPSA  6-2-18","match_date":"2018-06-02","stage_classifiercode":"06-10","member_number":"A103560","first_name":"RILEY","last_name":"COOPER","classification":"B","division":"OPEN","hit_factor":6.383},{"match_name":"Hopkinton August 2016 ","match_date":"2016-08-06","stage_classifiercode":"06-10","member_number":"TY79508","first_name":"SHANE","last_name":"FUNGAFAT","classification":"B","division":"OPEN","hit_factor":6.383},{"match_name":"LBAS 201017 October Practical Match","match_date":"2020-10-17","stage_classifiercode":"06-10","member_number":"A54659","first_name":"THOMAS","last_name":"SCHILLER","classification":"A","division":"OPEN","hit_factor":6.3694},{"match_name":"Gem City Gun Club 4-7 and 4-8-18","match_date":"2018-04-07","stage_classifiercode":"06-10","member_number":"TY91700","first_name":"JEFF","last_name":"MORSE","classification":"B","division":"OPEN","hit_factor":6.3694},{"match_name":"MS06 Team Magnolia USPSA November Match","match_date":"2016-11-06","stage_classifiercode":"06-10","member_number":"FY70934","first_name":"BETTY J","last_name":"WILSON","classification":"C","division":"OPEN","hit_factor":6.3694},{"match_name":"Richmond Hot Shots September 1st-2nd 2018 USPSA Pistol Match","match_date":"2018-09-01","stage_classifiercode":"06-10","member_number":"10648","first_name":"CARLSON","last_name":"SETO","classification":"D","division":"OPEN","hit_factor":6.3694},{"match_name":"GRPC USPSA DO YOU FEEL LUCKY?","match_date":"2021-03-07","stage_classifiercode":"06-10","member_number":"A111091","first_name":"MICHAEL","last_name":"WHITLEY","classification":"B","division":"OPEN","hit_factor":6.3694},{"match_name":"Hosemasters 2nd Sunday August 2017","match_date":"2017-08-13","stage_classifiercode":"06-10","member_number":"TY18312","first_name":"GEORGE","last_name":"WAGNER","classification":"B","division":"OPEN","hit_factor":6.3559},{"match_name":"April 2017 OPSC USPSA","match_date":"2017-04-09","stage_classifiercode":"06-10","member_number":"A88494","first_name":"GEORGE","last_name":"DYSICO","classification":"U","division":"OPEN","hit_factor":6.3559},{"match_name":"Monson April 2017 USPSA","match_date":"2017-04-23","stage_classifiercode":"06-10","member_number":"A92915","first_name":"DUSTIN","last_name":"BRISSON","classification":"U","division":"OPEN","hit_factor":6.3559},{"match_name":"OSC April USPSA","match_date":"2021-04-18","stage_classifiercode":"06-10","member_number":"L4223","first_name":"DARRYL","last_name":"DOUGHERTY","classification":"M","division":"OPEN","hit_factor":6.3559},{"match_name":"Brothers N Arms August 2017 USPSA Match","match_date":"2017-08-19","stage_classifiercode":"06-10","member_number":"A91377","first_name":"TRENT","last_name":"CLIBURN","classification":"U","division":"OPEN","hit_factor":6.3425},{"match_name":"OFGC USPSA Match 11-18-17","match_date":"2017-11-18","stage_classifiercode":"06-10","member_number":"TY72436","first_name":"ROBERT","last_name":"TERBIETEN","classification":"B","division":"OPEN","hit_factor":6.3425},{"match_name":"SFPC SMTCA","match_date":"2017-04-30","stage_classifiercode":"06-10","member_number":"TY59666","first_name":"NESTOR","last_name":"SANCHEZ","classification":"B","division":"OPEN","hit_factor":6.3425},{"match_name":"TAP USPSA February 28 2016 (28Feb16-01:01:53)","match_date":"2016-02-28","stage_classifiercode":"06-10","member_number":"A86599","first_name":"SEAN","last_name":"AGUAS","classification":"C","division":"OPEN","hit_factor":6.3425},{"match_name":"LCSC Linden USPSA 120918","match_date":"2018-12-09","stage_classifiercode":"06-10","member_number":"A88607","first_name":"FRANCO","last_name":"GESMUNDO","classification":"A","division":"OPEN","hit_factor":6.3425},{"match_name":"NCPS USPSA Handgun Match March 25 2018z","match_date":"2018-03-25","stage_classifiercode":"06-10","member_number":"TY76701","first_name":"GLENN","last_name":"FANNIN","classification":"A","division":"OPEN","hit_factor":6.3425},{"match_name":"Grandbaggers December 2017","match_date":"2017-12-07","stage_classifiercode":"06-10","member_number":"L1189","first_name":"JOHN","last_name":"LAMARCA","classification":"A","division":"OPEN","hit_factor":6.3425},{"match_name":"Salt City practical shooting league 'all classifier match'","match_date":"2020-08-30","stage_classifiercode":"06-10","member_number":"L1224","first_name":"BILL","last_name":"GEE","classification":"M","division":"OPEN","hit_factor":6.3291},{"match_name":"Ontelaunee USPSA September 2016","match_date":"2016-09-24","stage_classifiercode":"06-10","member_number":"TY67325","first_name":"BRIAN","last_name":"SHANK","classification":"B","division":"OPEN","hit_factor":6.3291},{"match_name":"Gem City Gun Club 11-4 and 11-5","match_date":"2017-11-04","stage_classifiercode":"06-10","member_number":"A93980","first_name":"KENNETH","last_name":"LALIBERTE","classification":"B","division":"OPEN","hit_factor":6.3291},{"match_name":"HRRB 12-01-2018","match_date":"2018-12-01","stage_classifiercode":"06-10","member_number":"TY92048","first_name":"HAROLD","last_name":"DOMINGO","classification":"C","division":"OPEN","hit_factor":6.3291},{"match_name":"NISA April 2017 - Classifier","match_date":"2017-04-23","stage_classifiercode":"06-10","member_number":"TY85482","first_name":"MIKE","last_name":"SCHROEDL","classification":"U","division":"OPEN","hit_factor":6.3291},{"match_name":"LdF 4th Saturday Match","match_date":"2015-11-28","stage_classifiercode":"06-10","member_number":"FY39124","first_name":"RAMIRO","last_name":"REYES","classification":"M","division":"OPEN","hit_factor":6.3291},{"match_name":"MASTER BLASTERS & SSFGA USPSA - September","match_date":"2021-09-18","stage_classifiercode":"06-10","member_number":"Ty82118","first_name":"PETER","last_name":"GILBERT","classification":"A","division":"OPEN","hit_factor":6.3291},{"match_name":"SWGC USPSA Pistol Match - March 2020","match_date":"2020-03-07","stage_classifiercode":"06-10","member_number":"TY89408","first_name":"CHRISTOPHER","last_name":"AN","classification":"A","division":"OPEN","hit_factor":6.3291},{"match_name":"OKCGC USPSA October 2018","match_date":"2018-10-06","stage_classifiercode":"06-10","member_number":"FY95123","first_name":"BRYAN","last_name":"TAYLOR","classification":"C","division":"OPEN","hit_factor":6.3158},{"match_name":"Idaho ISPS January 6th 2018","match_date":"2018-01-06","stage_classifiercode":"06-10","member_number":"TY99310","first_name":"JIM","last_name":"HICKS","classification":"B","division":"OPEN","hit_factor":6.3158},{"match_name":"HOPS USPSA 081917","match_date":"2017-08-19","stage_classifiercode":"06-10","member_number":"A90516","first_name":"JARED","last_name":"FOX","classification":"A","division":"OPEN","hit_factor":6.3158},{"match_name":"OFGC USPSA Match Oct 16","match_date":"2016-10-16","stage_classifiercode":"06-10","member_number":"A73637","first_name":"JAMES","last_name":"JONES","classification":"U","division":"OPEN","hit_factor":6.3158},{"match_name":"ISPS JULY 2nd 2016","match_date":"2016-07-02","stage_classifiercode":"06-10","member_number":"A71703","first_name":"DON","last_name":"MARTIN","classification":"B","division":"OPEN","hit_factor":6.3025},{"match_name":"Oregon ARPC November Match","match_date":"2015-11-14","stage_classifiercode":"06-10","member_number":"A81437","first_name":"RYAN","last_name":"GOOLD","classification":"B","division":"OPEN","hit_factor":6.3025},{"match_name":"WGC June 2018 USPSA","match_date":"2018-06-10","stage_classifiercode":"06-10","member_number":"A93372","first_name":"JAMES","last_name":"LOFTON","classification":"G","division":"OPEN","hit_factor":6.3025},{"match_name":"Collin County USPSA 11-28-2021","match_date":"2021-11-28","stage_classifiercode":"06-10","member_number":"A106827","first_name":"EDWIN","last_name":"DE JESUS","classification":"U","division":"OPEN","hit_factor":6.3025},{"match_name":"CCPL 12112016","match_date":"2016-12-11","stage_classifiercode":"06-10","member_number":"TY77402","first_name":"BRIAN","last_name":"LUM","classification":"B","division":"OPEN","hit_factor":6.3025},{"match_name":"Ripon USPSA 9-22-18","match_date":"2018-09-22","stage_classifiercode":"06-10","member_number":"L4223","first_name":"DARRYL","last_name":"DOUGHERTY","classification":"M","division":"OPEN","hit_factor":6.2893},{"match_name":"December 2017 CAS USPSA","match_date":"2017-12-03","stage_classifiercode":"06-10","member_number":"FY101141","first_name":"MATHEW","last_name":"DOZIER","classification":"U","division":"OPEN","hit_factor":6.2893},{"match_name":"Oxford OHS05 090521","match_date":"2021-09-05","stage_classifiercode":"06-10","member_number":"TY81742","first_name":"BEN","last_name":"WEST","classification":"M","division":"OPEN","hit_factor":6.2893},{"match_name":"ORSA USPSA October 2020","match_date":"2020-10-17","stage_classifiercode":"06-10","member_number":"A97514","first_name":"BRADY","last_name":"HARDIN","classification":"U","division":"OPEN","hit_factor":6.2893},{"match_name":"PSAC_20160227","match_date":"2016-02-27","stage_classifiercode":"06-10","member_number":"L3762","first_name":"LANCE","last_name":"FOSTER","classification":"\"\"","division":"OPEN","hit_factor":6.2762},{"match_name":"Springfield Tactical Shooters 09-07-2017","match_date":"2017-09-07","stage_classifiercode":"06-10","member_number":"A30365","first_name":"ED","last_name":"TRIBBLE","classification":"\"\"","division":"OPEN","hit_factor":6.263},{"match_name":"OPSC USPSA  OCTOBER 2017","match_date":"2017-10-07","stage_classifiercode":"06-10","member_number":"TY8469","first_name":"ISIAH","last_name":"STROUD","classification":"A","division":"OPEN","hit_factor":6.263},{"match_name":"CCPL 12112016","match_date":"2016-12-11","stage_classifiercode":"06-10","member_number":"A88732","first_name":"THI","last_name":"NGUYEN","classification":"A","division":"OPEN","hit_factor":6.263},{"match_name":"LdF USPSA Match July 11 2021","match_date":"2021-07-11","stage_classifiercode":"06-10","member_number":"A130339","first_name":"MARK","last_name":"MASANGKAY","classification":"C","division":"OPEN","hit_factor":6.25},{"match_name":"TAP USPSA February 28 2016 (28Feb16-01:01:53)","match_date":"2016-02-28","stage_classifiercode":"06-10","member_number":"TY24456","first_name":"RANDY","last_name":"MELTON","classification":"M","division":"OPEN","hit_factor":6.25},{"match_name":"CBS March USPSA Steel Match","match_date":"2021-03-07","stage_classifiercode":"06-10","member_number":"A76617","first_name":"SERGIO","last_name":"DE LEON","classification":"U","division":"OPEN","hit_factor":6.25},{"match_name":"MCAS USPSA March 2016","match_date":"2016-03-19","stage_classifiercode":"06-10","member_number":"A75842","first_name":"JOE","last_name":"DESSON","classification":"C","division":"OPEN","hit_factor":6.237},{"match_name":"Ripon USPSA 7-22-17","match_date":"2017-07-22","stage_classifiercode":"06-10","member_number":"A68824","first_name":"KELSEY","last_name":"SCHAEFER","classification":"B","division":"OPEN","hit_factor":6.237},{"match_name":"Richmond Hot Shots July 15-16-2017 USPSA Pistol Match","match_date":"2017-07-15","stage_classifiercode":"06-10","member_number":"TY83436","first_name":"\"MOACIR \"\" MO \"\"\"","last_name":"RAMOS","classification":"C","division":"OPEN","hit_factor":6.237},{"match_name":"DSS - USPSA 18-08-12","match_date":"2018-08-12","stage_classifiercode":"06-10","member_number":"TY93980","first_name":"KEN","last_name":"LALIBERTE","classification":"B","division":"OPEN","hit_factor":6.237},{"match_name":"LCSA USPSA May 2017","match_date":"2017-05-13","stage_classifiercode":"06-10","member_number":"a65297","first_name":"DAN","last_name":"HEITZENRATER","classification":"U","division":"OPEN","hit_factor":6.2241},{"match_name":"NISA April 2017 - Classifier","match_date":"2017-04-23","stage_classifiercode":"06-10","member_number":"A71862","first_name":"JOSEPH","last_name":"SINYAKOVICH","classification":"B","division":"OPEN","hit_factor":6.2241},{"match_name":"MS06 Team Magnolia USPSA November Match","match_date":"2016-11-06","stage_classifiercode":"06-10","member_number":"TY97639","first_name":"JASON","last_name":"WATTS","classification":"B","division":"OPEN","hit_factor":6.2241},{"match_name":"MS06 Team Magnolia USPSA November Match","match_date":"2016-11-06","stage_classifiercode":"06-10","member_number":"A52191","first_name":"SLOAN","last_name":"SANDERS","classification":"M","division":"OPEN","hit_factor":6.2241},{"match_name":"GCL December 5-2020","match_date":"2020-12-05","stage_classifiercode":"06-10","member_number":"A123135","first_name":"SAM","last_name":"SDOIA","classification":"B","division":"OPEN","hit_factor":6.2241},{"match_name":"December 2017 CAS USPSA","match_date":"2017-12-03","stage_classifiercode":"06-10","member_number":"TY84389","first_name":"ETHAN","last_name":"BOUDREAUX","classification":"U","division":"OPEN","hit_factor":6.2112},{"match_name":"Richmond Hot Shots July 15-16-2017 USPSA Pistol Match","match_date":"2017-07-15","stage_classifiercode":"06-10","member_number":"A25441","first_name":"WALTER K","last_name":"HASHIMOTO","classification":"A","division":"OPEN","hit_factor":6.2112},{"match_name":"MS06 Team Magnolia USPSA November Match","match_date":"2016-11-06","stage_classifiercode":"06-10","member_number":"A80452","first_name":"ERNIE","last_name":"MATTINGLY","classification":"C","division":"OPEN","hit_factor":6.2112},{"match_name":"Richmond hotshots April 16-17 2016 USPSA Pistol match","match_date":"2016-04-16","stage_classifiercode":"06-10","member_number":"A85939","first_name":"NILO","last_name":"NUNEZ II","classification":"M","division":"OPEN","hit_factor":6.2112},{"match_name":"Monson April 2017 USPSA","match_date":"2017-04-23","stage_classifiercode":"06-10","member_number":"TY11901","first_name":"DAVE","last_name":"LOPEZ","classification":"A","division":"OPEN","hit_factor":6.1983},{"match_name":"Minnetonka Game and Fish Special classifier","match_date":"2017-10-07","stage_classifiercode":"06-10","member_number":"TY-94384","first_name":"ROBERT","last_name":"UPEGUI","classification":"B","division":"OPEN","hit_factor":6.1983},{"match_name":"GCL December 5-2020","match_date":"2020-12-05","stage_classifiercode":"06-10","member_number":"a80418","first_name":"ALVA","last_name":"ENGLISH","classification":"A","division":"OPEN","hit_factor":6.1983},{"match_name":"AGC_20170507","match_date":"2017-05-07","stage_classifiercode":"06-10","member_number":"TY5392","first_name":"ROGER","last_name":"BRIDEN","classification":"B","division":"OPEN","hit_factor":6.1983},{"match_name":"DAP December 2015 Classifier match","match_date":"2015-12-12","stage_classifiercode":"06-10","member_number":"A83502","first_name":"PAUL","last_name":"CLANTON","classification":"U","division":"OPEN","hit_factor":6.1983},{"match_name":"MCAS USPSA March 2016","match_date":"2016-03-19","stage_classifiercode":"06-10","member_number":"TY12199","first_name":"NEAL","last_name":"HANSEN","classification":"A","division":"OPEN","hit_factor":6.1856},{"match_name":"PMSC USPSA JULY 2018","match_date":"2018-07-01","stage_classifiercode":"06-10","member_number":"TY93980","first_name":"KEN","last_name":"LALIBERTE","classification":"B","division":"OPEN","hit_factor":6.1856},{"match_name":"Gem City Gun Club 4-7 and 4-8-18","match_date":"2018-04-07","stage_classifiercode":"06-10","member_number":"A37984","first_name":"JEFF","last_name":"WALTERS","classification":"B","division":"OPEN","hit_factor":6.1856},{"match_name":"CPS USPSA May 2017","match_date":"2017-05-06","stage_classifiercode":"06-10","member_number":"ty75795","first_name":"DUANE","last_name":"KLASSEN","classification":"B","division":"OPEN","hit_factor":6.1856},{"match_name":"YRPA  9/25/16  USPSA Pistol Match","match_date":"2016-09-23","stage_classifiercode":"06-10","member_number":"A65135","first_name":"DEXTER","last_name":"BRADLEY","classification":"G","division":"OPEN","hit_factor":6.1856},{"match_name":"Collin County USPSA 11-28-2021","match_date":"2021-11-28","stage_classifiercode":"06-10","member_number":"TY56332","first_name":"DERON","last_name":"WOOD","classification":"A","division":"OPEN","hit_factor":6.1856},{"match_name":"FBURG March 2021 Level I USPSA ","match_date":"2021-03-06","stage_classifiercode":"06-10","member_number":"FY15413","first_name":"TOM","last_name":"SUIT","classification":"M","division":"OPEN","hit_factor":6.1856},{"match_name":"GRPC USPSA DO YOU FEEL LUCKY?","match_date":"2021-03-07","stage_classifiercode":"06-10","member_number":"TY79055","first_name":"WADE","last_name":"PRUETZ","classification":"A","division":"OPEN","hit_factor":6.1856},{"match_name":"DGC USPSA 01-14-18","match_date":"2018-01-14","stage_classifiercode":"06-10","member_number":"A100062","first_name":"BRIAN","last_name":"MORAN","classification":"C","division":"OPEN","hit_factor":6.1728},{"match_name":"Rankin Field Sunday USPSA","match_date":"2018-10-21","stage_classifiercode":"06-10","member_number":"FY29119","first_name":"EDDY","last_name":"DICE","classification":"B","division":"OPEN","hit_factor":6.1728},{"match_name":"TAP USPSA February 28 2016 (28Feb16-01:01:53)","match_date":"2016-02-28","stage_classifiercode":"06-10","member_number":"A84617","first_name":"MIKE","last_name":"FINEZA","classification":"U","division":"OPEN","hit_factor":6.1728},{"match_name":"SPSA USPSA March 4th Sat match","match_date":"2021-03-27","stage_classifiercode":"06-10","member_number":"L4473","first_name":"ULRICH","last_name":"BABSAAY","classification":"B","division":"OPEN","hit_factor":6.1728},{"match_name":"LCSC Linden USPSA 120918","match_date":"2018-12-09","stage_classifiercode":"06-10","member_number":"L4510","first_name":"ERIC","last_name":"GAO","classification":"U","division":"OPEN","hit_factor":6.1728},{"match_name":"Gem City Gun Club 9-1 and 9-2-2018","match_date":"2018-09-01","stage_classifiercode":"06-10","member_number":"TY102572","first_name":"DAVE","last_name":"WILDE","classification":"B","division":"OPEN","hit_factor":6.1602},{"match_name":"Richmond March 6-2015 USPSA Pistol Match","match_date":"2016-03-06","stage_classifiercode":"06-10","member_number":"A88607","first_name":"FRANCO","last_name":"GESMUNDO","classification":"A","division":"OPEN","hit_factor":6.1602},{"match_name":"OKCGC USPSA October 2018","match_date":"2018-10-06","stage_classifiercode":"06-10","member_number":"Fy69238","first_name":"TONY","last_name":"WALL","classification":"A","division":"OPEN","hit_factor":6.1475},{"match_name":"Springfield Tactical Shooters 02/04/2021","match_date":"2021-02-04","stage_classifiercode":"06-10","member_number":"FY95946","first_name":"PAUL","last_name":"EMERY","classification":"B","division":"OPEN","hit_factor":6.1475},{"match_name":"CGC 2016-01-09","match_date":"2016-01-09","stage_classifiercode":"06-10","member_number":"A53510","first_name":"BRIAN","last_name":"HICKS","classification":"A","division":"OPEN","hit_factor":6.1475},{"match_name":"Monson April 2017 USPSA","match_date":"2017-04-23","stage_classifiercode":"06-10","member_number":"TY93513","first_name":"MIKE","last_name":"KANE","classification":"C","division":"OPEN","hit_factor":6.1475},{"match_name":"MCAS June 2018 USPSA Match","match_date":"2018-06-30","stage_classifiercode":"06-10","member_number":"TY-49680","first_name":"JEN","last_name":"ADAMS","classification":"B","division":"OPEN","hit_factor":6.1475},{"match_name":"AGC_20160403","match_date":"2016-04-03","stage_classifiercode":"06-10","member_number":"A71925","first_name":"LAUREN","last_name":"CANNON","classification":"B","division":"OPEN","hit_factor":6.1475},{"match_name":"Minnetonka Game and Fish Special classifier","match_date":"2017-10-07","stage_classifiercode":"06-10","member_number":"l-4043","first_name":"THOMAS","last_name":"KREBSBACH","classification":"C","division":"OPEN","hit_factor":6.1475},{"match_name":"DSS - USPSA 18-08-12","match_date":"2018-08-12","stage_classifiercode":"06-10","member_number":"A85984","first_name":"DARREN","last_name":"RAY","classification":"U","division":"OPEN","hit_factor":6.1475},{"match_name":"SWGC USPSA Pistol Match - December 2018","match_date":"2018-12-01","stage_classifiercode":"06-10","member_number":"A90156","first_name":"STEVE","last_name":"EVERETT","classification":"A","division":"OPEN","hit_factor":6.135},{"match_name":"September CAS Match","match_date":"2015-09-06","stage_classifiercode":"06-10","member_number":"A85466","first_name":"CHRIS","last_name":"CARNEY","classification":"A","division":"OPEN","hit_factor":6.135},{"match_name":"RBGC USPSA 2021-8-28","match_date":"2021-08-28","stage_classifiercode":"06-10","member_number":"TY81668","first_name":"BRENT","last_name":"WILEY","classification":"A","division":"OPEN","hit_factor":6.135},{"match_name":"SMPS March 2016","match_date":"2016-03-13","stage_classifiercode":"06-10","member_number":"FY15413","first_name":"TOM","last_name":"SUIT","classification":"A","division":"OPEN","hit_factor":6.135},{"match_name":"Richmond Hot Shots September 1st-2nd 2018 USPSA Pistol Match","match_date":"2018-09-01","stage_classifiercode":"06-10","member_number":"A51918","first_name":"TIM","last_name":"BOFMAN","classification":"A","division":"OPEN","hit_factor":6.135},{"match_name":"DSS - USPSA 18-08-12","match_date":"2018-08-12","stage_classifiercode":"06-10","member_number":"A104325","first_name":"JEFFERY","last_name":"WARWICK","classification":"B","division":"OPEN","hit_factor":6.135},{"match_name":"PTPC November 4th  USPSA Match","match_date":"2018-11-04","stage_classifiercode":"06-10","member_number":"FY60870","first_name":"MICHAEL","last_name":"CALDERISI","classification":"B","division":"OPEN","hit_factor":6.1224},{"match_name":"Richmond hotshots April 16-17 2016 USPSA Pistol match","match_date":"2016-04-16","stage_classifiercode":"06-10","member_number":"TY79640","first_name":"ELPIDIO (PETE)","last_name":"CORPUZ","classification":"B","division":"OPEN","hit_factor":6.1224},{"match_name":"Paul Bunyan April 7th-8th All Classifier Match NW01","match_date":"2018-04-07","stage_classifiercode":"06-10","member_number":"TY70115","first_name":"DUSTIN","last_name":"TAWATAO","classification":"U","division":"OPEN","hit_factor":6.11},{"match_name":"Lefthanders Gun Club Practical Shooters November","match_date":"2017-11-04","stage_classifiercode":"06-10","member_number":"A92230","first_name":"LELAND","last_name":"CLAYTON","classification":"U","division":"OPEN","hit_factor":6.11},{"match_name":"CGC 2016-01-09","match_date":"2016-01-09","stage_classifiercode":"06-10","member_number":"A93098","first_name":"TRAVIS","last_name":"ROSE","classification":"C","division":"OPEN","hit_factor":6.11},{"match_name":"Sage USPSA June 17 2018","match_date":"2018-06-17","stage_classifiercode":"06-10","member_number":"A34748","first_name":"BENNIE","last_name":"DUNN III","classification":"B","division":"OPEN","hit_factor":6.11},{"match_name":"MPPL 20200301","match_date":"2020-03-01","stage_classifiercode":"06-10","member_number":"A88485","first_name":"BHONG","last_name":"DELOS SANTOS","classification":"C","division":"OPEN","hit_factor":6.0976},{"match_name":"December 2017 CAS USPSA","match_date":"2017-12-03","stage_classifiercode":"06-10","member_number":"A66934","first_name":"ELIZABETH","last_name":"YOUNG","classification":"C","division":"OPEN","hit_factor":6.0976},{"match_name":"EHPSA USPSA 27June 2021","match_date":"2021-06-27","stage_classifiercode":"06-10","member_number":"TY99321","first_name":"CLIFF","last_name":"PINSENT","classification":"C","division":"OPEN","hit_factor":6.0976},{"match_name":"Oregon ARPC November Match","match_date":"2015-11-14","stage_classifiercode":"06-10","member_number":"ty61701","first_name":"BILL","last_name":"JOHNSON","classification":"B","division":"OPEN","hit_factor":6.0976},{"match_name":"OSC April USPSA","match_date":"2021-04-18","stage_classifiercode":"06-10","member_number":"A75338","first_name":"KEITH","last_name":"BRADEN","classification":"C","division":"OPEN","hit_factor":6.0976},{"match_name":"RBGC 2016-10-22","match_date":"2016-10-22","stage_classifiercode":"06-10","member_number":"\"\"","first_name":"RICK","last_name":"DOBBS","classification":"A","division":"OPEN","hit_factor":6.0976},{"match_name":"FBURG June 2017 Level I USPSA ","match_date":"2017-06-03","stage_classifiercode":"06-10","member_number":"TY66449","first_name":"LEE","last_name":"WILLS","classification":"G","division":"OPEN","hit_factor":6.0852},{"match_name":"Springfield Tactical Shooters 12-3-15","match_date":"2015-12-03","stage_classifiercode":"06-10","member_number":"A30365","first_name":"ED","last_name":"TRIBBLE","classification":"A","division":"OPEN","hit_factor":6.0852},{"match_name":"Grandbaggers December 2017","match_date":"2017-12-07","stage_classifiercode":"06-10","member_number":"FL3478","first_name":"FRANK","last_name":"KOCH","classification":"M","division":"OPEN","hit_factor":6.0852},{"match_name":"Salt City practical shooting league 'all classifier match'","match_date":"2020-08-30","stage_classifiercode":"06-10","member_number":"A122839","first_name":"MARK","last_name":"HUNT","classification":"U","division":"OPEN","hit_factor":6.0729},{"match_name":"HOPS USPSA 081917","match_date":"2017-08-19","stage_classifiercode":"06-10","member_number":"A47787","first_name":"SCOTT","last_name":"LANE","classification":"M","division":"OPEN","hit_factor":6.0729},{"match_name":"Oregon ARPC November Match","match_date":"2015-11-14","stage_classifiercode":"06-10","member_number":"a79225","first_name":"DAN","last_name":"PHILLIPS","classification":"B","division":"OPEN","hit_factor":6.0729},{"match_name":"WVPPS October 2015","match_date":"2015-10-18","stage_classifiercode":"06-10","member_number":"A26597","first_name":"MAX","last_name":"BEDWELL","classification":"G","division":"OPEN","hit_factor":6.0729},{"match_name":"SFPS 05-15-2016 SuperClassifier - First Division","match_date":"2016-05-15","stage_classifiercode":"06-10","member_number":"TY62740","first_name":"DAVE","last_name":"SOMMERS","classification":"U","division":"OPEN","hit_factor":6.0729},{"match_name":"WGC WI USPSA Monthly Match 10-21-17","match_date":"2017-10-21","stage_classifiercode":"06-10","member_number":"TY86866","first_name":"JIM","last_name":"KAVANAGH","classification":"C","division":"OPEN","hit_factor":6.0606},{"match_name":"Steel City USPSA September 3 2016","match_date":"2016-09-03","stage_classifiercode":"06-10","member_number":"L2723","first_name":"ROBERT","last_name":"ADAMS","classification":"B","division":"OPEN","hit_factor":6.0606},{"match_name":"Shoot GTR USPSA Aug 16","match_date":"2016-08-16","stage_classifiercode":"06-10","member_number":"TY27735","first_name":"BOB","last_name":"MILLS","classification":"A","division":"OPEN","hit_factor":6.0606},{"match_name":"RBGC 2016-10-22","match_date":"2016-10-22","stage_classifiercode":"06-10","member_number":"A82223","first_name":"BRETT","last_name":"NETTLETON","classification":"U","division":"OPEN","hit_factor":6.0606},{"match_name":"GRPC USPSA DO YOU FEEL LUCKY?","match_date":"2021-03-07","stage_classifiercode":"06-10","member_number":"TY26527","first_name":"DAVE","last_name":"CAMPBELL","classification":"M","division":"OPEN","hit_factor":6.0606},{"match_name":"FLPSA MN14 USPSA April 26 2018","match_date":"2018-04-26","stage_classifiercode":"06-10","member_number":"A86548","first_name":"JOSH","last_name":"EERNISSE","classification":"A","division":"OPEN","hit_factor":6.0606},{"match_name":"Harvard Action Shooters August 2016 USPSA Pistol","match_date":"2016-08-14","stage_classifiercode":"06-10","member_number":"A34817","first_name":"DAN","last_name":"DIGIOVINE JR.","classification":"A","division":"OPEN","hit_factor":6.0484},{"match_name":"Nampa USPSA July 31st 2021","match_date":"2021-07-31","stage_classifiercode":"06-10","member_number":"A530","first_name":"JERRY","last_name":"DIX","classification":"M","division":"OPEN","hit_factor":6.0484},{"match_name":"FBURG March 2021 Level I USPSA ","match_date":"2021-03-06","stage_classifiercode":"06-10","member_number":"A119044","first_name":"JEFFREY","last_name":"ALBRIGHT","classification":"B","division":"OPEN","hit_factor":6.0484},{"match_name":"LdF USPSA Match May 27 2017","match_date":"2017-05-27","stage_classifiercode":"06-10","member_number":"A99082","first_name":"LUKE","last_name":"WANG","classification":"C","division":"OPEN","hit_factor":6.0484},{"match_name":"Harvard Action Shooters August 2016 USPSA Pistol","match_date":"2016-08-14","stage_classifiercode":"06-10","member_number":"A92399","first_name":"JUSTIN","last_name":"LANDRY","classification":"M","division":"OPEN","hit_factor":6.0362},{"match_name":"WVPPS October 2015","match_date":"2015-10-18","stage_classifiercode":"06-10","member_number":"FY28709","first_name":"GARY","last_name":"CHANEY","classification":"A","division":"OPEN","hit_factor":6.0362},{"match_name":"CGGR May USPSA Match","match_date":"2017-05-20","stage_classifiercode":"06-10","member_number":"A73345","first_name":"GARY","last_name":"CROUCH","classification":"M","division":"OPEN","hit_factor":6.0241},{"match_name":"GCL Saturday 3-6-2021","match_date":"2021-03-06","stage_classifiercode":"06-10","member_number":"A35723","first_name":"DAVE","last_name":"HAVASI","classification":"B","division":"OPEN","hit_factor":6.0241},{"match_name":"BGSL First Sunday Match","match_date":"2016-06-05","stage_classifiercode":"06-10","member_number":"L3642","first_name":"STEVE","last_name":"UMANSKY","classification":"B","division":"OPEN","hit_factor":6.0241},{"match_name":"CBS March USPSA Steel Match","match_date":"2021-03-07","stage_classifiercode":"06-10","member_number":"TY2958","first_name":"PETE","last_name":"CARPENTIER JR","classification":"A","division":"OPEN","hit_factor":6.0241},{"match_name":"FBURG June 2017 Level I USPSA ","match_date":"2017-06-03","stage_classifiercode":"06-10","member_number":"A40401","first_name":"DENNIS","last_name":"VIAR","classification":"M","division":"OPEN","hit_factor":6.012},{"match_name":"Shasta Shooters 2021 Feb","match_date":"2021-02-13","stage_classifiercode":"06-10","member_number":"TY87118","first_name":"STAN","last_name":"CLEWETT","classification":"B","division":"OPEN","hit_factor":6.012},{"match_name":"NISA April 2017 - Classifier","match_date":"2017-04-23","stage_classifiercode":"06-10","member_number":"A55556","first_name":"RON","last_name":"EVANS","classification":"B","division":"OPEN","hit_factor":6.012},{"match_name":"OSC April USPSA","match_date":"2021-04-18","stage_classifiercode":"06-10","member_number":"Fy104506","first_name":"KEVIN","last_name":"OWENS","classification":"B","division":"OPEN","hit_factor":6.012},{"match_name":"WTPS USPSA September Match 9-9-17","match_date":"2017-09-09","stage_classifiercode":"06-10","member_number":"TY92650","first_name":"THOMAS","last_name":"GILES","classification":"U","division":"OPEN","hit_factor":6.012},{"match_name":"CCPL 04-25-2021","match_date":"2021-04-25","stage_classifiercode":"06-10","member_number":"A72602","first_name":"STEVEN","last_name":"MURRAY","classification":"B","division":"OPEN","hit_factor":6},{"match_name":"Lefthanders Gun Club Practical Shooters November","match_date":"2017-11-04","stage_classifiercode":"06-10","member_number":"A30365","first_name":"ED","last_name":"TRIBBLE","classification":"A","division":"OPEN","hit_factor":6},{"match_name":"Shoot GTR Monthly USPSA","match_date":"2018-01-07","stage_classifiercode":"06-10","member_number":"TY34497","first_name":"PAT","last_name":"GAUVIN","classification":"A","division":"OPEN","hit_factor":6},{"match_name":"LCSA USPSA May 2017","match_date":"2017-05-13","stage_classifiercode":"06-10","member_number":"ty84298","first_name":"JUSTIN","last_name":"MILLER","classification":"D","division":"OPEN","hit_factor":6},{"match_name":"EHPSA USPSA 27June 2021","match_date":"2021-06-27","stage_classifiercode":"06-10","member_number":"TY87293","first_name":"EARL","last_name":"COWHER","classification":"B","division":"OPEN","hit_factor":6},{"match_name":"EHPSA USPSA 27June 2021","match_date":"2021-06-27","stage_classifiercode":"06-10","member_number":"A60017","first_name":"JOSEPH","last_name":"HOUDA","classification":"B","division":"OPEN","hit_factor":6},{"match_name":"WVRPC USPSA 4 JUNE 2016","match_date":"2016-06-04","stage_classifiercode":"06-10","member_number":"L2755","first_name":"LINCOLN","last_name":"CARR","classification":"A","division":"OPEN","hit_factor":6},{"match_name":"Richmond hotshots April 16-17 2016 USPSA Pistol match","match_date":"2016-04-16","stage_classifiercode":"06-10","member_number":"A88607","first_name":"FRANCO","last_name":"GESMUNDO","classification":"A","division":"OPEN","hit_factor":6},{"match_name":"ORSA USPSA October 2020","match_date":"2020-10-17","stage_classifiercode":"06-10","member_number":"A131110","first_name":"AUSTIN","last_name":"ROBERTS","classification":"","division":"OPEN","hit_factor":6},{"match_name":"FBURG June 2017 Level I USPSA ","match_date":"2017-06-03","stage_classifiercode":"06-10","member_number":"L4026","first_name":"CHRIS","last_name":"JACKSON","classification":"B","division":"OPEN","hit_factor":5.988},{"match_name":"Whitewater USPSA 3-18-17","match_date":"2017-03-18","stage_classifiercode":"06-10","member_number":"\"\"","first_name":"ALAN","last_name":"WHEELER","classification":"\"\"","division":"OPEN","hit_factor":5.988},{"match_name":"Harvard Action Shooters August 2016 USPSA Pistol","match_date":"2016-08-14","stage_classifiercode":"06-10","member_number":"TY49724","first_name":"BETSY","last_name":"GRECOE","classification":"C","division":"OPEN","hit_factor":5.988},{"match_name":"West Liberty USPSA June 2018","match_date":"2018-06-24","stage_classifiercode":"06-10","member_number":"A55262","first_name":"DEAN","last_name":"GOMEZ","classification":"B","division":"OPEN","hit_factor":5.988},{"match_name":"CBS March USPSA Steel Match","match_date":"2021-03-07","stage_classifiercode":"06-10","member_number":"L3576","first_name":"TY","last_name":"GENTRY","classification":"M","division":"OPEN","hit_factor":5.988},{"match_name":"ESPS USPSA July 2017","match_date":"2017-07-22","stage_classifiercode":"06-10","member_number":"TY49832","first_name":"ARTIE","last_name":"HAGLICH","classification":"B","division":"OPEN","hit_factor":5.9761},{"match_name":"OFGC USPSA Match Oct 16","match_date":"2016-10-16","stage_classifiercode":"06-10","member_number":"A77565","first_name":"JASON","last_name":"GRANT","classification":"D","division":"OPEN","hit_factor":5.9761},{"match_name":"GAS July 2020 USPSA Classifier Match","match_date":"2020-07-04","stage_classifiercode":"06-10","member_number":"A104679","first_name":"LUKE","last_name":"ARCHER","classification":"C","division":"OPEN","hit_factor":5.9761},{"match_name":"MCAS USPSA March 2016","match_date":"2016-03-19","stage_classifiercode":"06-10","member_number":"TY49680","first_name":"JEN","last_name":"ADAMS","classification":"C","division":"OPEN","hit_factor":5.9642},{"match_name":"Springfield Tactical Shooters 12-3-15","match_date":"2015-12-03","stage_classifiercode":"06-10","member_number":"A30365","first_name":"ED","last_name":"TRIBBLE","classification":"A","division":"OPEN","hit_factor":5.9642},{"match_name":"Gem City Gun Club 9-1 and 9-2-2018","match_date":"2018-09-01","stage_classifiercode":"06-10","member_number":"A102935","first_name":"MICHAEL","last_name":"DAUENHAUER","classification":"B","division":"OPEN","hit_factor":5.9642},{"match_name":"EHPSA USPSA 27June 2021","match_date":"2021-06-27","stage_classifiercode":"06-10","member_number":"A33435","first_name":"MARK","last_name":"BRAHAM","classification":"\"\"","division":"OPEN","hit_factor":5.9642},{"match_name":"Fall Madness - UPSA Match","match_date":"2017-10-07","stage_classifiercode":"06-10","member_number":"F89074","first_name":"KEITH","last_name":"ADVICE","classification":"B","division":"OPEN","hit_factor":5.9642},{"match_name":"Hampden RPC June USPSA Match","match_date":"2018-06-10","stage_classifiercode":"06-10","member_number":"A98632","first_name":"ZAC","last_name":"GREENIER","classification":"B","division":"OPEN","hit_factor":5.9642},{"match_name":"FLPSA MN14 USPSA April 26 2018","match_date":"2018-04-26","stage_classifiercode":"06-10","member_number":"A97255","first_name":"DARIN","last_name":"MAGER","classification":"U","division":"OPEN","hit_factor":5.9642},{"match_name":"Space Coast Practical Shooters","match_date":"2018-06-02","stage_classifiercode":"06-10","member_number":"Ty79847","first_name":"ROBERT","last_name":"SETTLE","classification":"U","division":"OPEN","hit_factor":5.9642},{"match_name":"OKCGC USPSA October 2018","match_date":"2018-10-06","stage_classifiercode":"06-10","member_number":"TY96272","first_name":"KELLY","last_name":"BROWN","classification":"C","division":"OPEN","hit_factor":5.9524},{"match_name":"CRC / SVPS June USPSA","match_date":"2020-06-12","stage_classifiercode":"06-10","member_number":"TY105518","first_name":"NICHOLAS","last_name":"BLASER","classification":"C","division":"OPEN","hit_factor":5.9524},{"match_name":"CGGR May USPSA Match","match_date":"2017-05-20","stage_classifiercode":"06-10","member_number":"A88634","first_name":"KEN","last_name":"KILLI","classification":"B","division":"OPEN","hit_factor":5.9524},{"match_name":"WPS USPSA Monthly Match May 2016","match_date":"2016-05-07","stage_classifiercode":"06-10","member_number":"TY11901`","first_name":"DAVID","last_name":"LOPEZ","classification":"A","division":"OPEN","hit_factor":5.9524},{"match_name":"RBGC 2016-10-22","match_date":"2016-10-22","stage_classifiercode":"06-10","member_number":"FY73238","first_name":"RANDY","last_name":"GAMBLE","classification":"B","division":"OPEN","hit_factor":5.9524},{"match_name":"LCSC Linden USPSA 120918","match_date":"2018-12-09","stage_classifiercode":"06-10","member_number":"TY66432","first_name":"DANNY","last_name":"REA","classification":"B","division":"OPEN","hit_factor":5.9524},{"match_name":"Maine Practical Shooters October 2018","match_date":"2018-10-14","stage_classifiercode":"06-10","member_number":"A98632","first_name":"ZACHARY","last_name":"GREENIER","classification":"B","division":"OPEN","hit_factor":5.9524},{"match_name":"Shadow Hawk Defense USPSA - Aug","match_date":"2021-08-14","stage_classifiercode":"06-10","member_number":"Ty89408","first_name":"CHRISTOPHER","last_name":"AN","classification":"A","division":"OPEN","hit_factor":5.9406},{"match_name":"Sharp practical shooters March 27 match","match_date":"2016-03-27","stage_classifiercode":"06-10","member_number":"64342","first_name":"SEAN","last_name":"SMITH","classification":"B","division":"OPEN","hit_factor":5.9406},{"match_name":"SPSA USPSA March 4th Sat match","match_date":"2021-03-27","stage_classifiercode":"06-10","member_number":"TY60473","first_name":"KEVIN","last_name":"BARNEY","classification":"C","division":"OPEN","hit_factor":5.9406},{"match_name":"Gem City Gun Club 9-1 and 9-2-2018","match_date":"2018-09-01","stage_classifiercode":"06-10","member_number":"L2450","first_name":"BUD","last_name":"CONNOLLY","classification":"B","division":"OPEN","hit_factor":5.9289},{"match_name":"Southkent USPSA MAY match","match_date":"2017-05-20","stage_classifiercode":"06-10","member_number":"\"\"","first_name":"JAMES","last_name":"BAUCHMAN","classification":"U","division":"OPEN","hit_factor":5.9289},{"match_name":"Richmond hotshots April 16-17 2016 USPSA Pistol match","match_date":"2016-04-16","stage_classifiercode":"06-10","member_number":"A64949","first_name":"HIROSHI","last_name":"TAKAMA","classification":"C","division":"OPEN","hit_factor":5.9289},{"match_name":"WSRC USPSA 7-21/22-2018","match_date":"2018-07-21","stage_classifiercode":"06-10","member_number":"A7424","first_name":"MARTY","last_name":"GERINGER","classification":"A","division":"OPEN","hit_factor":5.9172},{"match_name":"ACPSA March 2017","match_date":"2017-03-25","stage_classifiercode":"06-10","member_number":"A58329","first_name":"JERWIN","last_name":"CAYONTE","classification":"A","division":"OPEN","hit_factor":5.9172},{"match_name":"Hampden RPC May USPSA","match_date":"2016-05-01","stage_classifiercode":"06-10","member_number":"A54402","first_name":"NATE","last_name":"WADE","classification":"Unclassified","division":"OPEN","hit_factor":5.9172},{"match_name":"Richmond hotshots April 16-17 2016 USPSA Pistol match","match_date":"2016-04-16","stage_classifiercode":"06-10","member_number":"A85957","first_name":"TRISTAN","last_name":"TOLENTINO","classification":"B","division":"OPEN","hit_factor":5.9172},{"match_name":"LCSA USPSA May 2017","match_date":"2017-05-13","stage_classifiercode":"06-10","member_number":"ty81249","first_name":"BRIAN","last_name":"MILLER","classification":"B","division":"OPEN","hit_factor":5.9055},{"match_name":"Oxford OHS05 090521","match_date":"2021-09-05","stage_classifiercode":"06-10","member_number":"TY59101","first_name":"DAN","last_name":"DITULLIO","classification":"B","division":"OPEN","hit_factor":5.9055},{"match_name":"EHPSA USPSA 27June 2021","match_date":"2021-06-27","stage_classifiercode":"06-10","member_number":"A109635","first_name":"JENNIFER","last_name":"HOUDA","classification":"C","division":"OPEN","hit_factor":5.9055},{"match_name":"ISPS JULY 2nd 2016","match_date":"2016-07-02","stage_classifiercode":"06-10","member_number":"A68354","first_name":"DAVID","last_name":"WALL","classification":"D","division":"OPEN","hit_factor":5.8939},{"match_name":"GCL December 5-2020","match_date":"2020-12-05","stage_classifiercode":"06-10","member_number":"ty107787","first_name":"ROB","last_name":"KENDALL","classification":"C","division":"OPEN","hit_factor":5.8939},{"match_name":"LdF 4th Saturday Match","match_date":"2015-11-28","stage_classifiercode":"06-10","member_number":"A55017","first_name":"DANGIE","last_name":"NAZARENO","classification":"A","division":"OPEN","hit_factor":5.8939},{"match_name":"Ontelaunee USPSA September 2016","match_date":"2016-09-24","stage_classifiercode":"06-10","member_number":"TY75267","first_name":"TROY","last_name":"WEISENFLUH","classification":"B","division":"OPEN","hit_factor":5.8824},{"match_name":"CGGR May USPSA Match","match_date":"2017-05-20","stage_classifiercode":"06-10","member_number":"L2664","first_name":"JIM","last_name":"HILSENBECK","classification":"M","division":"OPEN","hit_factor":5.8824},{"match_name":"GCL Saturday 3-6-2021","match_date":"2021-03-06","stage_classifiercode":"06-10","member_number":"L3750","first_name":"MIKE","last_name":"COLE","classification":"M","division":"OPEN","hit_factor":5.8824},{"match_name":"FBURG June 2017 Level I USPSA ","match_date":"2017-06-03","stage_classifiercode":"06-10","member_number":"FY15413","first_name":"TOM","last_name":"SUIT","classification":"A","division":"OPEN","hit_factor":5.8708},{"match_name":"HPS Hot Summer Fun Club Match","match_date":"2017-07-22","stage_classifiercode":"06-10","member_number":"FY85757","first_name":"EDGAR","last_name":"VICENTE","classification":"C","division":"OPEN","hit_factor":5.8708},{"match_name":"PCWC USPSA  9 26 2020","match_date":"2020-09-26","stage_classifiercode":"06-10","member_number":"TY126071","first_name":"JOSHUA","last_name":"SCHROEPFER","classification":"C","division":"OPEN","hit_factor":5.8708},{"match_name":"WVPPS October 2015","match_date":"2015-10-18","stage_classifiercode":"06-10","member_number":"TY61081","first_name":"TOM","last_name":"SCHWENN","classification":"C","division":"OPEN","hit_factor":5.8708},{"match_name":"Quantico QPS QSC USPSA Match 9 APR 2017","match_date":"2017-04-09","stage_classifiercode":"06-10","member_number":"A95349","first_name":"NATHAN","last_name":"HEVNER","classification":"U","division":"OPEN","hit_factor":5.8594},{"match_name":"Hosemasters 2nd Sunday August 2017","match_date":"2017-08-13","stage_classifiercode":"06-10","member_number":"TY46968","first_name":"STEVEN","last_name":"REDIES","classification":"A","division":"OPEN","hit_factor":5.8594},{"match_name":"Southkent USPSA MAY match","match_date":"2017-05-20","stage_classifiercode":"06-10","member_number":"TY18713","first_name":"DALE","last_name":"VANDERZEE","classification":"B","division":"OPEN","hit_factor":5.8594},{"match_name":"Eagles Nest July 30th","match_date":"2017-07-30","stage_classifiercode":"06-10","member_number":"L1963","first_name":"DENNY","last_name":"MICHALI","classification":"A","division":"OPEN","hit_factor":5.848},{"match_name":"ACPSA March 2017","match_date":"2017-03-25","stage_classifiercode":"06-10","member_number":"FY29424","first_name":"JIM","last_name":"FESSLER","classification":"B","division":"OPEN","hit_factor":5.848},{"match_name":"Gem City Gun Club 9-1 and 9-2-2018","match_date":"2018-09-01","stage_classifiercode":"06-10","member_number":"A10052","first_name":"PAT","last_name":"EAKIN","classification":"U","division":"OPEN","hit_factor":5.848},{"match_name":"Gem City Gun Club 4-2-16  and 4-3-16","match_date":"2016-04-02","stage_classifiercode":"06-10","member_number":"A7695","first_name":"ANDY","last_name":"DIBARTOLOMEO","classification":"C","division":"OPEN","hit_factor":5.848},{"match_name":"Springfield Tactical Shooters 09-07-2017","match_date":"2017-09-07","stage_classifiercode":"06-10","member_number":"A30365","first_name":"ED","last_name":"TRIBBLE","classification":"\"\"","division":"OPEN","hit_factor":5.8366},{"match_name":"PMSC USPSA JULY 2018","match_date":"2018-07-01","stage_classifiercode":"06-10","member_number":"L4413","first_name":"GREG","last_name":"ZOMBEK","classification":"B","division":"OPEN","hit_factor":5.8366},{"match_name":"Oregon ARPC November Match","match_date":"2015-11-14","stage_classifiercode":"06-10","member_number":"TY58134","first_name":"DAN","last_name":"CARPENTER","classification":"B","division":"OPEN","hit_factor":5.8366},{"match_name":"FBURG USPSA November 2021","match_date":"2021-11-07","stage_classifiercode":"06-10","member_number":"A136567","first_name":"JOHN","last_name":"FOWLER","classification":"U","division":"OPEN","hit_factor":5.8366},{"match_name":"PMSC USPSA JULY 2018","match_date":"2018-07-01","stage_classifiercode":"06-10","member_number":"A101973","first_name":"CLAY","last_name":"SHARLOCK","classification":"\"\"","division":"OPEN","hit_factor":5.8252},{"match_name":"Richmond Hot Shots September 1st-2nd 2018 USPSA Pistol Match","match_date":"2018-09-01","stage_classifiercode":"06-10","member_number":"TY89750","first_name":"JOHN","last_name":"CENDANA","classification":"C","division":"OPEN","hit_factor":5.8252},{"match_name":"Richmond hotshots April 16-17 2016 USPSA Pistol match","match_date":"2016-04-16","stage_classifiercode":"06-10","member_number":"A51896","first_name":"LORI","last_name":"BOFMAN","classification":"B","division":"OPEN","hit_factor":5.8252},{"match_name":"ISPS JULY 2nd 2016","match_date":"2016-07-02","stage_classifiercode":"06-10","member_number":"TY30712","first_name":"DENNIS","last_name":"WILSON","classification":"B","division":"OPEN","hit_factor":5.814},{"match_name":"Deadwood Boys USPSA All Classifier Match - 29 July 2018","match_date":"2018-07-29","stage_classifiercode":"06-10","member_number":"A106671","first_name":"CHRIS","last_name":"ILLIANO","classification":"B","division":"OPEN","hit_factor":5.814},{"match_name":"Grandbaggers December 2017","match_date":"2017-12-07","stage_classifiercode":"06-10","member_number":"A34501","first_name":"RON","last_name":"FUCHS","classification":"C","division":"OPEN","hit_factor":5.814},{"match_name":"HPS Hot Summer Fun Club Match","match_date":"2017-07-22","stage_classifiercode":"06-10","member_number":"\"\"","first_name":"ALLEN","last_name":"LOWE","classification":"M","division":"OPEN","hit_factor":5.8027},{"match_name":"LdF 4th Saturday Match","match_date":"2015-11-28","stage_classifiercode":"06-10","member_number":"TY17381","first_name":"JOHN","last_name":"HURST","classification":"M","division":"OPEN","hit_factor":5.8027},{"match_name":"December 2017 CAS USPSA","match_date":"2017-12-03","stage_classifiercode":"06-10","member_number":"TY28619","first_name":"SCOTT","last_name":"JACOB","classification":"A","division":"OPEN","hit_factor":5.7915},{"match_name":"GAS July 2020 USPSA Classifier Match","match_date":"2020-07-04","stage_classifiercode":"06-10","member_number":"A110775","first_name":"JACK","last_name":"CROWLEY","classification":"D","division":"OPEN","hit_factor":5.7915},{"match_name":"Richmond hotshots April 16-17 2016 USPSA Pistol match","match_date":"2016-04-16","stage_classifiercode":"06-10","member_number":"9412","first_name":"\"MOACIR  \"\" MO \"\"\"","last_name":"RAMOS","classification":"C","division":"OPEN","hit_factor":5.7915},{"match_name":"PTPC November 4th  USPSA Match","match_date":"2018-11-04","stage_classifiercode":"06-10","member_number":"TY56517","first_name":"DAVE","last_name":"SHARP","classification":"A","division":"OPEN","hit_factor":5.7803},{"match_name":"OKCGC USPSA October 2018","match_date":"2018-10-06","stage_classifiercode":"06-10","member_number":"A107288","first_name":"COREY","last_name":"CHURCHILL","classification":"C","division":"OPEN","hit_factor":5.7803},{"match_name":"CRC / SVPS June USPSA","match_date":"2020-06-12","stage_classifiercode":"06-10","member_number":"A122338","first_name":"ANDREW","last_name":"BUCKMASTER","classification":"C","division":"OPEN","hit_factor":5.7803},{"match_name":"Hampden RPC June USPSA Match","match_date":"2018-06-10","stage_classifiercode":"06-10","member_number":"A106194","first_name":"NICK","last_name":"BEAL","classification":"B","division":"OPEN","hit_factor":5.7803},{"match_name":"Ontelaunee USPSA September 2016","match_date":"2016-09-24","stage_classifiercode":"06-10","member_number":"A66127","first_name":"KENNY","last_name":"LEE","classification":"B","division":"OPEN","hit_factor":5.7692},{"match_name":"OSC April USPSA","match_date":"2021-04-18","stage_classifiercode":"06-10","member_number":"A87778","first_name":"WILLIAM","last_name":"HATFIELD","classification":"B","division":"OPEN","hit_factor":5.7692},{"match_name":"Southkent USPSA MAY match","match_date":"2017-05-20","stage_classifiercode":"06-10","member_number":"A77983","first_name":"GARY","last_name":"ROLLENHAGEN","classification":"B","division":"OPEN","hit_factor":5.7692},{"match_name":"SLPSA Jan USPSA match 1","match_date":"2020-01-11","stage_classifiercode":"06-10","member_number":"L3900","first_name":"STEVE","last_name":"TERRY","classification":"B","division":"OPEN","hit_factor":5.7692},{"match_name":"Custer December USPSA","match_date":"2016-12-04","stage_classifiercode":"06-10","member_number":"TY86951","first_name":"EMILIO","last_name":"DOMINGO","classification":"B","division":"OPEN","hit_factor":5.7692},{"match_name":"CGC 2016-01-09","match_date":"2016-01-09","stage_classifiercode":"06-10","member_number":"A27940","first_name":"RICK","last_name":"DOBBS","classification":"A","division":"OPEN","hit_factor":5.7582},{"match_name":"April 2017 OPSC USPSA","match_date":"2017-04-09","stage_classifiercode":"06-10","member_number":"L2281","first_name":"J","last_name":"GRIFFIN","classification":"A","division":"OPEN","hit_factor":5.7582},{"match_name":"Gem City Gun Club 4-2-16  and 4-3-16","match_date":"2016-04-02","stage_classifiercode":"06-10","member_number":"a-37984","first_name":"JEFF","last_name":"WALTERS","classification":"C","division":"OPEN","hit_factor":5.7582},{"match_name":"Southkent USPSA MAY match","match_date":"2017-05-20","stage_classifiercode":"06-10","member_number":"A90859","first_name":"TERRY","last_name":"FLOWERS","classification":"C","division":"OPEN","hit_factor":5.7582},{"match_name":"Hopkinton August 2016 ","match_date":"2016-08-06","stage_classifiercode":"06-10","member_number":"A93513","first_name":"MICHAEL","last_name":"KANE","classification":"U","division":"OPEN","hit_factor":5.7471},{"match_name":"LdF USPSA Match May 27 2017","match_date":"2017-05-27","stage_classifiercode":"06-10","member_number":"TY94265","first_name":"STEVE","last_name":"BENCE","classification":"C","division":"OPEN","hit_factor":5.7471},{"match_name":"Richmond hotshots April 16-17 2016 USPSA Pistol match","match_date":"2016-04-16","stage_classifiercode":"06-10","member_number":"FY18635","first_name":"JAMES","last_name":"SABUROMARU","classification":"M","division":"OPEN","hit_factor":5.7471},{"match_name":"nocpc october 2016","match_date":"2016-10-09","stage_classifiercode":"06-10","member_number":"A36085","first_name":"TOM","last_name":"FREDERICK","classification":"B","division":"OPEN","hit_factor":5.7471},{"match_name":"CGGR May USPSA Match","match_date":"2017-05-20","stage_classifiercode":"06-10","member_number":"A71693","first_name":"CHRIS","last_name":"KOZELL","classification":"M","division":"OPEN","hit_factor":5.7361},{"match_name":"NOCPC May 2018","match_date":"2018-05-13","stage_classifiercode":"06-10","member_number":"L4212","first_name":"MIKE","last_name":"LAMPHIER","classification":"C","division":"OPEN","hit_factor":5.7361},{"match_name":"FBURG March 2021 Level I USPSA ","match_date":"2021-03-06","stage_classifiercode":"06-10","member_number":"L3535","first_name":"TAK","last_name":"ONG","classification":"B","division":"OPEN","hit_factor":5.7361},{"match_name":"HOPS USPSA 1020018 ","match_date":"2018-10-19","stage_classifiercode":"06-10","member_number":"TY107304","first_name":"TRENT","last_name":"SIMPSON","classification":"C","division":"OPEN","hit_factor":5.7252},{"match_name":"Ripon USPSA 7-22-17","match_date":"2017-07-22","stage_classifiercode":"06-10","member_number":"A74632","first_name":"SETH","last_name":"GYLDENVAND","classification":"B","division":"OPEN","hit_factor":5.7252},{"match_name":"HPS Hot Summer Fun Club Match","match_date":"2017-07-22","stage_classifiercode":"06-10","member_number":"A95612","first_name":"NICK","last_name":"DOMINGO","classification":"C","division":"OPEN","hit_factor":5.7252},{"match_name":"LdF 4th Saturday Match","match_date":"2015-11-28","stage_classifiercode":"06-10","member_number":"\"\"","first_name":"MARTIN","last_name":"CHRISTENSEN","classification":"U","division":"OPEN","hit_factor":5.7252},{"match_name":"Eagles Nest July 30th","match_date":"2017-07-30","stage_classifiercode":"06-10","member_number":"TY91700","first_name":"JEFFREY","last_name":"MORSE","classification":"B","division":"OPEN","hit_factor":5.7143},{"match_name":"Lefthanders Gun Club Practical Shooters November","match_date":"2017-11-04","stage_classifiercode":"06-10","member_number":"Ty72670","first_name":"DALE","last_name":"HARDING","classification":"B","division":"OPEN","hit_factor":5.7143},{"match_name":"GCL December 5-2020","match_date":"2020-12-05","stage_classifiercode":"06-10","member_number":"A61412","first_name":"KEITH","last_name":"BOURGEOIS","classification":"A","division":"OPEN","hit_factor":5.7143},{"match_name":"Grandbaggers December 2017","match_date":"2017-12-07","stage_classifiercode":"06-10","member_number":"A79494","first_name":"ROBB","last_name":"ASHCROFT","classification":"U","division":"OPEN","hit_factor":5.7143},{"match_name":"Eagles Nest October 16th 2016","match_date":"2016-10-16","stage_classifiercode":"06-10","member_number":"A7695","first_name":"ANDREW","last_name":"DIBARTOLOMEO","classification":"C","division":"OPEN","hit_factor":5.7143},{"match_name":"TPS USPSA AT CMP OCT 20 2018","match_date":"2018-10-20","stage_classifiercode":"06-10","member_number":"A100867","first_name":"GRANT","last_name":"ANDREWS","classification":"U","division":"OPEN","hit_factor":5.6818},{"match_name":"Gem City Gun Club 4-7 and 4-8-18","match_date":"2018-04-07","stage_classifiercode":"06-10","member_number":"TY70258","first_name":"WILSON","last_name":"CURRY","classification":"U","division":"OPEN","hit_factor":5.6818},{"match_name":"HPS Hot Summer Fun Club Match","match_date":"2017-07-22","stage_classifiercode":"06-10","member_number":"ty50135","first_name":"HEHERSON","last_name":"LUNA","classification":"B","division":"OPEN","hit_factor":5.6818},{"match_name":"OFGC USPSA Match Oct 16","match_date":"2016-10-16","stage_classifiercode":"06-10","member_number":"A84245","first_name":"BRYAN","last_name":"HOOVER","classification":"U","division":"OPEN","hit_factor":5.6818},{"match_name":"WGC WI USPSA Monthly Match 10-21-17","match_date":"2017-10-21","stage_classifiercode":"06-10","member_number":"TY81721","first_name":"STEVE","last_name":"MORTON","classification":"D","division":"OPEN","hit_factor":5.6711},{"match_name":"MCAS USPSA March 2016","match_date":"2016-03-19","stage_classifiercode":"06-10","member_number":"TY41721","first_name":"TY","last_name":"ADAMS","classification":"A","division":"OPEN","hit_factor":5.6711},{"match_name":"Harvard Action Shooters August 2016 USPSA Pistol","match_date":"2016-08-14","stage_classifiercode":"06-10","member_number":"A68130","first_name":"STEVE","last_name":"LAWRENCE","classification":"U","division":"OPEN","hit_factor":5.6711},{"match_name":"Richmond Hot Shots July 15-16-2017 USPSA Pistol Match","match_date":"2017-07-15","stage_classifiercode":"06-10","member_number":"L1620","first_name":"THOMAS","last_name":"CHAN","classification":"A","division":"OPEN","hit_factor":5.6711},{"match_name":"Gem City Gun Club 4-2-16  and 4-3-16","match_date":"2016-04-02","stage_classifiercode":"06-10","member_number":"l1963","first_name":"DENNY","last_name":"MICHALI","classification":"A","division":"OPEN","hit_factor":5.6711},{"match_name":"MCAS June 2018 USPSA Match","match_date":"2018-06-30","stage_classifiercode":"06-10","member_number":"Ty25701","first_name":"ANDY","last_name":"ADAMS","classification":"C","division":"OPEN","hit_factor":5.6711},{"match_name":"YRPA  9/25/16  USPSA Pistol Match","match_date":"2016-09-23","stage_classifiercode":"06-10","member_number":"TY42863","first_name":"MIKE D","last_name":"MCCARTY","classification":"B","division":"OPEN","hit_factor":5.6711},{"match_name":"Ontelaunee USPSA September 2016","match_date":"2016-09-24","stage_classifiercode":"06-10","member_number":"L3280","first_name":"JOSEPH","last_name":"ROBERTS","classification":"A","division":"OPEN","hit_factor":5.6604},{"match_name":"Nisa April","match_date":"2021-04-25","stage_classifiercode":"06-10","member_number":"Ty78070","first_name":"MARK","last_name":"SORENSEN","classification":"M","division":"OPEN","hit_factor":5.6604},{"match_name":"LCSA USPSA May 2017","match_date":"2017-05-13","stage_classifiercode":"06-10","member_number":"a93980","first_name":"KENNETH","last_name":"LALIBERTE","classification":"C","division":"OPEN","hit_factor":5.6604},{"match_name":"OFGC USPSA Match 11-18-17","match_date":"2017-11-18","stage_classifiercode":"06-10","member_number":"FY42421","first_name":"DEBBY","last_name":"PANKRATZ","classification":"C","division":"OPEN","hit_factor":5.6604},{"match_name":"WSPS OCTOBER 2018 USPSA MATCH","match_date":"2018-10-20","stage_classifiercode":"06-10","member_number":"A112593","first_name":"BEN","last_name":"BOYER","classification":"U","division":"OPEN","hit_factor":5.6604},{"match_name":"EWPSA 2018-01","match_date":"2018-01-21","stage_classifiercode":"06-10","member_number":"TY88365","first_name":"DON","last_name":"AMAN","classification":"U","division":"OPEN","hit_factor":5.6604},{"match_name":"WGC WI USPSA Monthly Match 10-21-17","match_date":"2017-10-21","stage_classifiercode":"06-10","member_number":"A68824","first_name":"KELSEY","last_name":"SCHAEFER","classification":"B","division":"OPEN","hit_factor":5.6497},{"match_name":"Gem City Gun Club 9-1 and 9-2-2018","match_date":"2018-09-01","stage_classifiercode":"06-10","member_number":"A37984","first_name":"JEFF","last_name":"WALTERS","classification":"B","division":"OPEN","hit_factor":5.6497},{"match_name":"6ta Fecha USPSA","match_date":"2018-06-24","stage_classifiercode":"06-10","member_number":"A97369","first_name":"JULIANA","last_name":"ROSADO","classification":"B","division":"OPEN","hit_factor":5.6497},{"match_name":"Shadow Hawk Defense USPSA SPECIAL CLASSIFIER","match_date":"2021-11-11","stage_classifiercode":"06-10","member_number":"A127524","first_name":"ANTHONY","last_name":"ALONGI","classification":"U","division":"OPEN","hit_factor":5.6497},{"match_name":"FBURG March 2021 Level I USPSA ","match_date":"2021-03-06","stage_classifiercode":"06-10","member_number":"TY109301","first_name":"DAVID","last_name":"THOMPSON","classification":"B","division":"OPEN","hit_factor":5.6497},{"match_name":"NCPS USPSA Handgun Match March 25 2018z","match_date":"2018-03-25","stage_classifiercode":"06-10","member_number":"TY79640","first_name":"ELPIDIO","last_name":"CORPUZ","classification":"A","division":"OPEN","hit_factor":5.6497},{"match_name":"MCAS USPSA March 2016","match_date":"2016-03-19","stage_classifiercode":"06-10","member_number":"TY43042","first_name":"DAN","last_name":"HASH","classification":"G","division":"OPEN","hit_factor":5.6391},{"match_name":"CPS USPSA May 2017","match_date":"2017-05-06","stage_classifiercode":"06-10","member_number":"Fy58474","first_name":"JAN","last_name":"MCDONALD","classification":"C","division":"OPEN","hit_factor":5.6391},{"match_name":"EHPSA USPSA 27June 2021","match_date":"2021-06-27","stage_classifiercode":"06-10","member_number":"FY90924","first_name":"SOPHIA","last_name":"SMITH","classification":"B","division":"OPEN","hit_factor":5.6391},{"match_name":"GRB USPSA Sept @ CAV","match_date":"2015-09-19","stage_classifiercode":"06-10","member_number":"A87953","first_name":"CHARLES","last_name":"BAJER","classification":"U","division":"OPEN","hit_factor":5.6391},{"match_name":"Richmond Hot Shots July 15-16-2017 USPSA Pistol Match","match_date":"2017-07-15","stage_classifiercode":"06-10","member_number":"A80595","first_name":"EDGAR","last_name":"ALLAS","classification":"C","division":"OPEN","hit_factor":5.6285},{"match_name":"7a Fecha USPSA","match_date":"2020-11-29","stage_classifiercode":"06-10","member_number":"TY91054","first_name":"WILBERTO","last_name":"ALAMO","classification":"B","division":"OPEN","hit_factor":5.6285},{"match_name":"LdF 4th Saturday Match","match_date":"2015-11-28","stage_classifiercode":"06-10","member_number":"A84087","first_name":"BIANCA","last_name":"MACASAET","classification":"C","division":"OPEN","hit_factor":5.6285},{"match_name":"Eagles Nest July 30th","match_date":"2017-07-30","stage_classifiercode":"06-10","member_number":"\"\"","first_name":"BILL","last_name":"MASLER","classification":"B","division":"OPEN","hit_factor":5.618},{"match_name":"TPS USPSA AT CMP OCT 20 2018","match_date":"2018-10-20","stage_classifiercode":"06-10","member_number":"A14583","first_name":"STEPHEN","last_name":"HORN","classification":"B","division":"OPEN","hit_factor":5.618},{"match_name":"WELD ECO09 20180617","match_date":"2018-06-17","stage_classifiercode":"06-10","member_number":"TY16618","first_name":"JEFF","last_name":"MEYER","classification":"A","division":"OPEN","hit_factor":5.618},{"match_name":"Targetmasters USPSA Handgun Match March 13 2016","match_date":"2016-03-13","stage_classifiercode":"06-10","member_number":"L3567","first_name":"RON","last_name":"SELBY","classification":"A","division":"OPEN","hit_factor":5.618},{"match_name":"Eagles Nest July 30th","match_date":"2017-07-30","stage_classifiercode":"06-10","member_number":"A7695","first_name":"ANDREW","last_name":"DIBARTOLOMEO","classification":"C","division":"OPEN","hit_factor":5.6075},{"match_name":"Mvpsa USPSA  April 17","match_date":"2021-04-17","stage_classifiercode":"06-10","member_number":"A133673","first_name":"JACKSON","last_name":"BURNS","classification":"U","division":"OPEN","hit_factor":5.6075},{"match_name":"YMM  IPSC 2018_07_08","match_date":"2018-07-08","stage_classifiercode":"06-10","member_number":"A34448","first_name":"LARRY","last_name":"LEBEAU","classification":"A","division":"OPEN","hit_factor":5.6075},{"match_name":"Richmond Hot Shots July 15-16-2017 USPSA Pistol Match","match_date":"2017-07-15","stage_classifiercode":"06-10","member_number":"A84617","first_name":"MIKE","last_name":"FINEZA","classification":"B","division":"OPEN","hit_factor":5.6075},{"match_name":"Richmond Hot Shots September 1st-2nd 2018 USPSA Pistol Match","match_date":"2018-09-01","stage_classifiercode":"06-10","member_number":"\"\"","first_name":"CARLO","last_name":"PABELICO","classification":"C","division":"OPEN","hit_factor":5.6075},{"match_name":"WSRC USPSA 7-21/22-2018","match_date":"2018-07-21","stage_classifiercode":"06-10","member_number":"A99326","first_name":"TIM","last_name":"ARMSTRONG","classification":"U","division":"OPEN","hit_factor":5.597},{"match_name":"Briar Rabbit October2017","match_date":"2017-10-22","stage_classifiercode":"06-10","member_number":"TY81742","first_name":"BEN","last_name":"WEST","classification":"A","division":"OPEN","hit_factor":5.597},{"match_name":"LdF USPSA Match July 11 2021","match_date":"2021-07-11","stage_classifiercode":"06-10","member_number":"TY43291","first_name":"WILLIAM","last_name":"JEHL","classification":"B","division":"OPEN","hit_factor":5.597},{"match_name":"CCPL - June 2021","match_date":"2021-06-19","stage_classifiercode":"06-10","member_number":"FY39111","first_name":"OLIE","last_name":"ERICKSEN","classification":"B","division":"OPEN","hit_factor":5.597},{"match_name":"Gem City Gun Club 9-1 and 9-2-2018","match_date":"2018-09-01","stage_classifiercode":"06-10","member_number":"TY70258","first_name":"WILSON","last_name":"CURRY","classification":"C","division":"OPEN","hit_factor":5.597},{"match_name":"WSPS OCTOBER 2018 USPSA MATCH","match_date":"2018-10-20","stage_classifiercode":"06-10","member_number":"ty101519","first_name":"JOSHUA","last_name":"HOY","classification":"B","division":"OPEN","hit_factor":5.597},{"match_name":"PCWC USPSA  9 26 2020","match_date":"2020-09-26","stage_classifiercode":"06-10","member_number":"Ty67051","first_name":"GENE","last_name":"SHACKLEY","classification":"B","division":"OPEN","hit_factor":5.597},{"match_name":"OSC April USPSA","match_date":"2021-04-18","stage_classifiercode":"06-10","member_number":"TY85482","first_name":"MIKE","last_name":"SCHROEDL","classification":"B","division":"OPEN","hit_factor":5.597},{"match_name":"Ripon USPSA 9-22-18","match_date":"2018-09-22","stage_classifiercode":"06-10","member_number":"A107715","first_name":"JAMES","last_name":"NIEDT","classification":"B","division":"OPEN","hit_factor":5.5866},{"match_name":"LdF USPSA Match July 11 2021","match_date":"2021-07-11","stage_classifiercode":"06-10","member_number":"A129700","first_name":"ALLAN","last_name":"FELICANO","classification":"D","division":"OPEN","hit_factor":5.5866},{"match_name":"Ripon USPSA 9-22-18","match_date":"2018-09-22","stage_classifiercode":"06-10","member_number":"TY26421","first_name":"RANDY","last_name":"HEFFNER","classification":"B","division":"OPEN","hit_factor":5.5762},{"match_name":"HOPS USPSA 1020018 ","match_date":"2018-10-19","stage_classifiercode":"06-10","member_number":"A96146","first_name":"BEN","last_name":"DEHAEMERS","classification":"B","division":"OPEN","hit_factor":5.5762},{"match_name":"WGC WI USPSA Monthly Match 10-21-17","match_date":"2017-10-21","stage_classifiercode":"06-10","member_number":"A55556","first_name":"RON","last_name":"EVANS","classification":"B","division":"OPEN","hit_factor":5.5762},{"match_name":"Briar Rabbit October2017","match_date":"2017-10-22","stage_classifiercode":"06-10","member_number":"L2137","first_name":"RICK","last_name":"STEELE","classification":"B","division":"OPEN","hit_factor":5.5762},{"match_name":"Gem City Gun Club 11-4 and 11-5","match_date":"2017-11-04","stage_classifiercode":"06-10","member_number":"\"\"","first_name":"DAVE","last_name":"WILDE","classification":"C","division":"OPEN","hit_factor":5.5762},{"match_name":"April 2017 OPSC USPSA","match_date":"2017-04-09","stage_classifiercode":"06-10","member_number":"TY8469","first_name":"ISIAH","last_name":"STROUD","classification":"A","division":"OPEN","hit_factor":5.5762},{"match_name":"WGC June 2018 USPSA","match_date":"2018-06-10","stage_classifiercode":"06-10","member_number":"A104650","first_name":"RICHARD","last_name":"SHARP","classification":"C","division":"OPEN","hit_factor":5.5762},{"match_name":"Chillicothe Sportsmens Club December USPSA","match_date":"2020-12-20","stage_classifiercode":"06-10","member_number":"TY58309","first_name":"ERIC","last_name":"HENSON","classification":"B","division":"OPEN","hit_factor":5.5659},{"match_name":"NOCPC May 2018","match_date":"2018-05-13","stage_classifiercode":"06-10","member_number":"Ty69893","first_name":"GARY","last_name":"KIRSCH","classification":"C","division":"OPEN","hit_factor":5.5659},{"match_name":"CFRPC November USPSA","match_date":"2018-11-18","stage_classifiercode":"06-10","member_number":"\"\"","first_name":"MEL","last_name":"CACHUELA","classification":"U","division":"OPEN","hit_factor":5.5659},{"match_name":"GRPC USPSA DO YOU FEEL LUCKY?","match_date":"2021-03-07","stage_classifiercode":"06-10","member_number":"TY98162","first_name":"DUANE","last_name":"MENDOZA","classification":"B","division":"OPEN","hit_factor":5.5659},{"match_name":"Ontelaunee USPSA September 2016","match_date":"2016-09-24","stage_classifiercode":"06-10","member_number":"FY83386","first_name":"PAUL","last_name":"ZEBRO","classification":"C","division":"OPEN","hit_factor":5.5556},{"match_name":"ACPSA March 2017","match_date":"2017-03-25","stage_classifiercode":"06-10","member_number":"A95304","first_name":"JOEL","last_name":"EDWARDS","classification":"U","division":"OPEN","hit_factor":5.5556},{"match_name":"WGC June 2018 USPSA","match_date":"2018-06-10","stage_classifiercode":"06-10","member_number":"A17864","first_name":"HENRY","last_name":"THIELS","classification":"B","division":"OPEN","hit_factor":5.5556},{"match_name":"Chillicothe Sportsmens Club December USPSA","match_date":"2020-12-20","stage_classifiercode":"06-10","member_number":"TY88087","first_name":"JOHN","last_name":"CAGAOAN","classification":"A","division":"OPEN","hit_factor":5.5453},{"match_name":"Richmond Hot Shots September 1st-2nd 2018 USPSA Pistol Match","match_date":"2018-09-01","stage_classifiercode":"06-10","member_number":"A33147","first_name":"VINCENT","last_name":"DIONISIO","classification":"B","division":"OPEN","hit_factor":5.5453},{"match_name":"DSS - USPSA 18-08-12","match_date":"2018-08-12","stage_classifiercode":"06-10","member_number":"A85868","first_name":"SHELDON","last_name":"KATZ","classification":"C","division":"OPEN","hit_factor":5.5351},{"match_name":"Paul Bunyan April 7th-8th All Classifier Match NW01","match_date":"2018-04-07","stage_classifiercode":"06-10","member_number":"A88243","first_name":"KRIS","last_name":"MCGAUGHEY","classification":"C","division":"OPEN","hit_factor":5.5249},{"match_name":"LA05  Tangi November USPSA 2020","match_date":"2020-11-20","stage_classifiercode":"06-10","member_number":"TY34618","first_name":"BUD","last_name":"BERTHOLD","classification":"A","division":"OPEN","hit_factor":5.5249},{"match_name":"PMSC USPSA JULY 2018","match_date":"2018-07-01","stage_classifiercode":"06-10","member_number":"FY90924","first_name":"SOPHIA","last_name":"SMITH","classification":"C","division":"OPEN","hit_factor":5.5249},{"match_name":"WSPS JUNE 2017 USPSA MATCH","match_date":"2017-06-17","stage_classifiercode":"06-10","member_number":"\"\"","first_name":"DAVID","last_name":"HORAN","classification":"X","division":"OPEN","hit_factor":5.5249},{"match_name":"Pima Pistol Club October 9th USPSA w\\Classifier","match_date":"2016-10-09","stage_classifiercode":"06-10","member_number":"A87313","first_name":"JUAN","last_name":"SANCHEZ","classification":"C","division":"OPEN","hit_factor":5.5249},{"match_name":"YRPA  9/25/16  USPSA Pistol Match","match_date":"2016-09-23","stage_classifiercode":"06-10","member_number":"A85264","first_name":"SPENCER","last_name":"MORENO","classification":"A","division":"OPEN","hit_factor":5.5249},{"match_name":"EAGC March 2021 USPSA Pistol Match","match_date":"2021-03-21","stage_classifiercode":"06-10","member_number":"PENDING","first_name":"ADAM","last_name":"REAMES","classification":"U","division":"OPEN","hit_factor":5.5249},{"match_name":"MCPSL Pistol 4-10-2021 (Classifier)","match_date":"2021-04-10","stage_classifiercode":"06-10","member_number":"TY78821","first_name":"STEVE","last_name":"GIRARD","classification":"C","division":"OPEN","hit_factor":5.5249},{"match_name":"December 2017 CAS USPSA","match_date":"2017-12-03","stage_classifiercode":"06-10","member_number":"TY94451","first_name":"TODD","last_name":"DEMPSTER","classification":"B","division":"OPEN","hit_factor":5.5147},{"match_name":"Harvard Action Shooters August 2016 USPSA Pistol","match_date":"2016-08-14","stage_classifiercode":"06-10","member_number":"\"\"","first_name":"JEFF","last_name":"BRENNAN","classification":"U","division":"OPEN","hit_factor":5.5147},{"match_name":"Ripon USPSA 7-22-17","match_date":"2017-07-22","stage_classifiercode":"06-10","member_number":"TY72120","first_name":"DAVE","last_name":"DEYOE","classification":"M","division":"OPEN","hit_factor":5.5046},{"match_name":"MPPL 20200301","match_date":"2020-03-01","stage_classifiercode":"06-10","member_number":"A113375","first_name":"BRANDON","last_name":"NAVAL","classification":"C","division":"OPEN","hit_factor":5.5046},{"match_name":"September CAS Match","match_date":"2015-09-06","stage_classifiercode":"06-10","member_number":"A76149","first_name":"DARREN","last_name":"CHAMBERS","classification":"C","division":"OPEN","hit_factor":5.5046},{"match_name":"LCSC Linden USPSA 120918","match_date":"2018-12-09","stage_classifiercode":"06-10","member_number":"TY98008","first_name":"JANET","last_name":"TSUI","classification":"B","division":"OPEN","hit_factor":5.5046},{"match_name":"Mvpsa USPSA  April 17","match_date":"2021-04-17","stage_classifiercode":"06-10","member_number":"A102491","first_name":"CARL","last_name":"JOHNSTON","classification":"U","division":"OPEN","hit_factor":5.4945},{"match_name":"RangeMasters 1-28-2016","match_date":"2016-01-28","stage_classifiercode":"06-10","member_number":"L3738","first_name":"JAY","last_name":"OLMSTEAD","classification":"C","division":"OPEN","hit_factor":5.4945},{"match_name":"West Liberty USPSA June 2018","match_date":"2018-06-24","stage_classifiercode":"06-10","member_number":"A76791","first_name":"COREY","last_name":"CRONBAUGH","classification":"C","division":"OPEN","hit_factor":5.4945},{"match_name":"Deadwood Boys USPSA All Classifier Match - 29 July 2018","match_date":"2018-07-29","stage_classifiercode":"06-10","member_number":"A93071","first_name":"BRYAN","last_name":"BROCKWAY","classification":"U","division":"OPEN","hit_factor":5.4845},{"match_name":"AGC_20160403","match_date":"2016-04-03","stage_classifiercode":"06-10","member_number":"A49558","first_name":"JOHN","last_name":"ARENAS","classification":"M","division":"OPEN","hit_factor":5.4845},{"match_name":"Custer December USPSA","match_date":"2016-12-04","stage_classifiercode":"06-10","member_number":"A83018","first_name":"RAE ARSEN","last_name":"BALEROS","classification":"B","division":"OPEN","hit_factor":5.4745},{"match_name":"Lefthanders Gun Club Practical Shooters November","match_date":"2017-11-04","stage_classifiercode":"06-10","member_number":"Ty78405","first_name":"SEAN","last_name":"ROLEN","classification":"B","division":"OPEN","hit_factor":5.4645},{"match_name":"DGC USPSA 01-14-18","match_date":"2018-01-14","stage_classifiercode":"06-10","member_number":"A100062","first_name":"BRIAN","last_name":"MORAN","classification":"C","division":"OPEN","hit_factor":5.4645},{"match_name":"CGC 2016-01-09","match_date":"2016-01-09","stage_classifiercode":"06-10","member_number":"L3945","first_name":"ERIC","last_name":"HAGAN","classification":"D","division":"OPEN","hit_factor":5.4645},{"match_name":"LdF 4th Saturday Match","match_date":"2015-11-28","stage_classifiercode":"06-10","member_number":"FY62295","first_name":"DAVE","last_name":"MORRIS","classification":"B","division":"OPEN","hit_factor":5.4645},{"match_name":"BGSL First Sunday Match","match_date":"2016-06-05","stage_classifiercode":"06-10","member_number":"A60496","first_name":"RYAN","last_name":"DAVIS","classification":"A","division":"OPEN","hit_factor":5.4645},{"match_name":"CCPL - June 2021","match_date":"2021-06-19","stage_classifiercode":"06-10","member_number":"B62","first_name":"BILL","last_name":"MASLER","classification":"B","division":"OPEN","hit_factor":5.4545},{"match_name":"MPPL 20200301","match_date":"2020-03-01","stage_classifiercode":"06-10","member_number":"TY95612","first_name":"NICK","last_name":"DOMINGO","classification":"C","division":"OPEN","hit_factor":5.4545},{"match_name":"Harvard Action Shooters August 2016 USPSA Pistol","match_date":"2016-08-14","stage_classifiercode":"06-10","member_number":"A72803","first_name":"RICHARD","last_name":"ZYDAVICIUS","classification":"B","division":"OPEN","hit_factor":5.4545},{"match_name":"September CAS Match","match_date":"2015-09-06","stage_classifiercode":"06-10","member_number":"TY28619","first_name":"SCOTT","last_name":"JACOB","classification":"A","division":"OPEN","hit_factor":5.4545},{"match_name":"Collin County USPSA 11-28-2021","match_date":"2021-11-28","stage_classifiercode":"06-10","member_number":"A111440","first_name":"ALEX","last_name":"COSTA","classification":"U","division":"OPEN","hit_factor":5.4545},{"match_name":"Colonial Rifle And Pistol Club Novermer Match","match_date":"2018-11-03","stage_classifiercode":"06-10","member_number":"FY92927","first_name":"ANTHONY","last_name":"MAINOLFI","classification":"B","division":"OPEN","hit_factor":5.4446},{"match_name":"LCSA USPSA May 2017","match_date":"2017-05-13","stage_classifiercode":"06-10","member_number":"A-90924","first_name":"SOPHIA","last_name":"SMITH","classification":"C","division":"OPEN","hit_factor":5.4446},{"match_name":"BORCC USPSA June 2017","match_date":"2017-06-25","stage_classifiercode":"06-10","member_number":"TY49380","first_name":"SHANNAN","last_name":"CHADA","classification":"B","division":"OPEN","hit_factor":5.4446},{"match_name":"HRRB 12-01-2018","match_date":"2018-12-01","stage_classifiercode":"06-10","member_number":"TY80437","first_name":"ERIC","last_name":"CAMPOS","classification":"B","division":"OPEN","hit_factor":5.4446},{"match_name":"7a Fecha USPSA","match_date":"2020-11-29","stage_classifiercode":"06-10","member_number":"A123317","first_name":"RORY","last_name":"CRAWFORD","classification":"U","division":"OPEN","hit_factor":5.4446},{"match_name":"Richmond hotshots April 16-17 2016 USPSA Pistol match","match_date":"2016-04-16","stage_classifiercode":"06-10","member_number":"A51918","first_name":"TIM","last_name":"BOFMAN","classification":"A","division":"OPEN","hit_factor":5.4446},{"match_name":"HPS Hot Summer Fun Club Match","match_date":"2017-07-22","stage_classifiercode":"06-10","member_number":"TY38050","first_name":"PAT","last_name":"ACACIO","classification":"B","division":"OPEN","hit_factor":5.4348},{"match_name":"ESPS USPSA July 2017","match_date":"2017-07-22","stage_classifiercode":"06-10","member_number":"L3617","first_name":"STEVEN","last_name":"THOMAS","classification":"M","division":"OPEN","hit_factor":5.425},{"match_name":"Briar Rabbit October2017","match_date":"2017-10-22","stage_classifiercode":"06-10","member_number":"A80746","first_name":"MIKE","last_name":"WILSON","classification":"C","division":"OPEN","hit_factor":5.425},{"match_name":"MPSA 2020-01-02","match_date":"2021-01-02","stage_classifiercode":"06-10","member_number":"TY76693","first_name":"LEE","last_name":"FRAISER","classification":"B","division":"OPEN","hit_factor":5.4152},{"match_name":"CIPSC Havana May USPSA","match_date":"2018-05-12","stage_classifiercode":"06-10","member_number":"A83660","first_name":"MATT","last_name":"LEE","classification":"C","division":"OPEN","hit_factor":5.4054054054054},{"match_name":"Gem City Gun Club 4-7 and 4-8-18","match_date":"2018-04-07","stage_classifiercode":"06-10","member_number":"A102935","first_name":"MIKE","last_name":"DAUENHAUER","classification":"B","division":"OPEN","hit_factor":5.4054},{"match_name":"CPS USPSA May 2017","match_date":"2017-05-06","stage_classifiercode":"06-10","member_number":"A86086","first_name":"JEFF","last_name":"ASHWORTH","classification":"C","division":"OPEN","hit_factor":5.4054},{"match_name":"PCWC USPSA  9 26 2020","match_date":"2020-09-26","stage_classifiercode":"06-10","member_number":"A121806","first_name":"PHILIP","last_name":"HUDOCK","classification":"B","division":"OPEN","hit_factor":5.4054},{"match_name":"West Liberty USPSA June 2018","match_date":"2018-06-24","stage_classifiercode":"06-10","member_number":"Ty45596","first_name":"BILL","last_name":"BEEM","classification":"A","division":"OPEN","hit_factor":5.4054},{"match_name":"LdF 4th Saturday Match","match_date":"2015-11-28","stage_classifiercode":"06-10","member_number":"TY43291","first_name":"WILLIAM","last_name":"JEHL","classification":"B","division":"OPEN","hit_factor":5.4054},{"match_name":"NCPS USPSA Handgun Match March 25 2018z","match_date":"2018-03-25","stage_classifiercode":"06-10","member_number":"A80595","first_name":"EDGAR","last_name":"ALLAS","classification":"C","division":"OPEN","hit_factor":5.4054},{"match_name":"Gem City Gun Club 11-4 and 11-5","match_date":"2017-11-04","stage_classifiercode":"06-10","member_number":"A37984","first_name":"JEFF","last_name":"WALTERS","classification":"C","division":"OPEN","hit_factor":5.3957},{"match_name":"WSPS JUNE 2017 USPSA MATCH","match_date":"2017-06-17","stage_classifiercode":"06-10","member_number":"TY99269","first_name":"TREVOR","last_name":"GAMBLE","classification":"C","division":"OPEN","hit_factor":5.3957},{"match_name":"ARPC USPSA Match 9-24-17","match_date":"2017-09-24","stage_classifiercode":"06-10","member_number":"A93058","first_name":"BRUCE","last_name":"CURRY","classification":"C","division":"OPEN","hit_factor":5.3957},{"match_name":"Monson April 2017 USPSA","match_date":"2017-04-23","stage_classifiercode":"06-10","member_number":"A44762","first_name":"MICHAEL D.","last_name":"PALUMBO","classification":"A","division":"OPEN","hit_factor":5.3957},{"match_name":"SLPSA Jan USPSA match 1","match_date":"2020-01-11","stage_classifiercode":"06-10","member_number":"TY78631","first_name":"KENNETH","last_name":"WRIGHT","classification":"C","division":"OPEN","hit_factor":5.3957},{"match_name":"Shoot GTR USPSA 12/13","match_date":"2016-12-13","stage_classifiercode":"06-10","member_number":"TY53290","first_name":"KENT","last_name":"CORI","classification":"A","division":"OPEN","hit_factor":5.3957},{"match_name":"SPSA September USPSA 1st Sat Match","match_date":"2015-09-05","stage_classifiercode":"06-10","member_number":"A56727","first_name":"TRACY","last_name":"DELUCE","classification":"B","division":"OPEN","hit_factor":5.386},{"match_name":"PTPC November 4th  USPSA Match","match_date":"2018-11-04","stage_classifiercode":"06-10","member_number":"A44074","first_name":"DONNA","last_name":"BUNTON","classification":"C","division":"OPEN","hit_factor":5.386},{"match_name":"PMSC USPSA JULY 2018","match_date":"2018-07-01","stage_classifiercode":"06-10","member_number":"TY93980","first_name":"KENNETH","last_name":"LALIBERTE","classification":"B","division":"OPEN","hit_factor":5.386},{"match_name":"EHPSA USPSA 27June 2021","match_date":"2021-06-27","stage_classifiercode":"06-10","member_number":"Ty84357","first_name":"RAY","last_name":"DONCH","classification":"B","division":"OPEN","hit_factor":5.386},{"match_name":"Monson April 2017 USPSA","match_date":"2017-04-23","stage_classifiercode":"06-10","member_number":"L1876","first_name":"SIMEON","last_name":"GOUROUSIS","classification":"B","division":"OPEN","hit_factor":5.386},{"match_name":"WGC June 2018 USPSA","match_date":"2018-06-10","stage_classifiercode":"06-10","member_number":"A84392","first_name":"JAMES","last_name":"TEDFORD","classification":"B","division":"OPEN","hit_factor":5.386},{"match_name":"SLPSA Jan USPSA","match_date":"2017-01-21","stage_classifiercode":"06-10","member_number":"L3808","first_name":"MARK","last_name":"BROWN","classification":"B","division":"OPEN","hit_factor":5.386},{"match_name":"Richmond hotshots April 16-17 2016 USPSA Pistol match","match_date":"2016-04-16","stage_classifiercode":"06-10","member_number":"\"\"","first_name":"CARLO","last_name":"PRINCIPE","classification":"C","division":"OPEN","hit_factor":5.386},{"match_name":"LdF USPSA Match July 11 2021","match_date":"2021-07-11","stage_classifiercode":"06-10","member_number":"L5072","first_name":"TODD","last_name":"MAO","classification":"B","division":"OPEN","hit_factor":5.3763},{"match_name":"OFGC USPSA Match Oct 16","match_date":"2016-10-16","stage_classifiercode":"06-10","member_number":"FY42421","first_name":"DEBBY","last_name":"PANKRATZ","classification":"C","division":"OPEN","hit_factor":5.3763},{"match_name":"SLPSA Jan USPSA","match_date":"2017-01-21","stage_classifiercode":"06-10","member_number":"\"\"","first_name":"KLAYTON","last_name":"GROVER","classification":"U","division":"OPEN","hit_factor":5.3763},{"match_name":"ESPS USPSA July 2017","match_date":"2017-07-22","stage_classifiercode":"06-10","member_number":"TY83654","first_name":"JASON","last_name":"ROBERTS","classification":"A","division":"OPEN","hit_factor":5.3667},{"match_name":"WELD ECO09 20180617","match_date":"2018-06-17","stage_classifiercode":"06-10","member_number":"TY53294","first_name":"RICHARD","last_name":"HOOVER","classification":"C","division":"OPEN","hit_factor":5.3667},{"match_name":"RangeMasters 1-28-2016","match_date":"2016-01-28","stage_classifiercode":"06-10","member_number":"\"\"","first_name":"RANDY","last_name":"GOODNEY","classification":"U","division":"OPEN","hit_factor":5.3667},{"match_name":"MVPSA USPSA 12-01-18","match_date":"2018-12-01","stage_classifiercode":"06-10","member_number":"a95520","first_name":"JOHN","last_name":"WISNIEWSKI","classification":"B","division":"OPEN","hit_factor":5.3667},{"match_name":"CCPS July 2018 USPSA","match_date":"2018-07-15","stage_classifiercode":"06-10","member_number":"A100931","first_name":"CALEB","last_name":"PATERSON","classification":"A","division":"OPEN","hit_factor":5.3571},{"match_name":"Shadow Hawk Defense USPSA SPECIAL CLASSIFIER","match_date":"2021-11-11","stage_classifiercode":"06-10","member_number":"A128022","first_name":"JONATHAN","last_name":"DUKE","classification":"U","division":"OPEN","hit_factor":5.3571},{"match_name":"TAP USPSA February 28 2016 (28Feb16-01:01:53)","match_date":"2016-02-28","stage_classifiercode":"06-10","member_number":"A90183","first_name":"GABRIELLE","last_name":"LOPEZ","classification":"B","division":"OPEN","hit_factor":5.3571},{"match_name":"Space Coast Practical Shooters","match_date":"2018-06-02","stage_classifiercode":"06-10","member_number":"TY27735","first_name":"BOB","last_name":"MILLS","classification":"A","division":"OPEN","hit_factor":5.3571},{"match_name":"Oxford OHS05 090521","match_date":"2021-09-05","stage_classifiercode":"06-10","member_number":"A24498","first_name":"LON","last_name":"ETCHISON","classification":"B","division":"OPEN","hit_factor":5.3476},{"match_name":"GCL Saturday 3-6-2021","match_date":"2021-03-06","stage_classifiercode":"06-10","member_number":"TY107787","first_name":"ROB","last_name":"KENDALL","classification":"C","division":"OPEN","hit_factor":5.3476},{"match_name":"PTPC November 4th  USPSA Match","match_date":"2018-11-04","stage_classifiercode":"06-10","member_number":"TY85482","first_name":"MIKE","last_name":"SCHROEDL","classification":"B","division":"OPEN","hit_factor":5.3381},{"match_name":"Colonial Rifle And Pistol Club Novermer Match","match_date":"2018-11-03","stage_classifiercode":"06-10","member_number":"TY31444","first_name":"JOSE","last_name":"OCAMPO","classification":"B","division":"OPEN","hit_factor":5.3286},{"match_name":"MPPL 20200301","match_date":"2020-03-01","stage_classifiercode":"06-10","member_number":"L2787","first_name":"JESSIE","last_name":"FLORES","classification":"C","division":"OPEN","hit_factor":5.3286},{"match_name":"AIPS Weekly USPSA 21 August 2018","match_date":"2018-08-21","stage_classifiercode":"06-10","member_number":"TY81149","first_name":"BRAD","last_name":"POLAND","classification":"B","division":"OPEN","hit_factor":5.3286},{"match_name":"OFGC USPSA Match Oct 16","match_date":"2016-10-16","stage_classifiercode":"06-10","member_number":"FY34677","first_name":"DALE","last_name":"PANKRATZ","classification":"C","division":"OPEN","hit_factor":5.3286},{"match_name":"Richmond hotshots April 16-17 2016 USPSA Pistol match","match_date":"2016-04-16","stage_classifiercode":"06-10","member_number":"A88866","first_name":"CHARLIE","last_name":"MENDOZA","classification":"D","division":"OPEN","hit_factor":5.3286},{"match_name":"AGC_20170507","match_date":"2017-05-07","stage_classifiercode":"06-10","member_number":"A61105","first_name":"SANDRA","last_name":"SOTO","classification":"C","division":"OPEN","hit_factor":5.3286},{"match_name":"CCPL - June 2021","match_date":"2021-06-19","stage_classifiercode":"06-10","member_number":"A127858","first_name":"RICK","last_name":"KOELLNER","classification":"U","division":"OPEN","hit_factor":5.3191},{"match_name":"PIPS 05-18-2016","match_date":"2016-05-17","stage_classifiercode":"06-10","member_number":"A26121","first_name":"VAN","last_name":"PACEY","classification":"C","division":"OPEN","hit_factor":5.3191},{"match_name":"LCSA USPSA May 2017","match_date":"2017-05-13","stage_classifiercode":"06-10","member_number":"ty84298","first_name":"JUSTIN","last_name":"MILLER","classification":"D","division":"OPEN","hit_factor":5.3191},{"match_name":"OFGC USPSA Match Oct 16","match_date":"2016-10-16","stage_classifiercode":"06-10","member_number":"TY72436","first_name":"ROBERT","last_name":"TERBIETEN","classification":"C","division":"OPEN","hit_factor":5.3191},{"match_name":"Richmond March 6-2015 USPSA Pistol Match","match_date":"2016-03-06","stage_classifiercode":"06-10","member_number":"TY88651","first_name":"ULYSSES","last_name":"VILLANUEVA","classification":"U","division":"OPEN","hit_factor":5.3191},{"match_name":"7a Fecha USPSA","match_date":"2020-11-29","stage_classifiercode":"06-10","member_number":"F131633","first_name":"DANIEL","last_name":"PLACERES-ORTIZ","classification":"U","division":"OPEN","hit_factor":5.3097},{"match_name":"Shadow Hawk Defense USPSA SPECIAL CLASSIFIER","match_date":"2021-11-11","stage_classifiercode":"06-10","member_number":"A125143","first_name":"KEITH","last_name":"SCHLESINGER","classification":"U","division":"OPEN","hit_factor":5.3004},{"match_name":"Richmond Hot Shots September 1st-2nd 2018 USPSA Pistol Match","match_date":"2018-09-01","stage_classifiercode":"06-10","member_number":"A85957","first_name":"TRISTAN","last_name":"TOLENTINO","classification":"B","division":"OPEN","hit_factor":5.3004},{"match_name":"AGC_20170507","match_date":"2017-05-07","stage_classifiercode":"06-10","member_number":"TY10704","first_name":"BOB","last_name":"HUGHES","classification":"M","division":"OPEN","hit_factor":5.291},{"match_name":"Richmond March 6-2015 USPSA Pistol Match","match_date":"2016-03-06","stage_classifiercode":"06-10","member_number":"A92465","first_name":"JOSE","last_name":"RAPADAS","classification":"C","division":"OPEN","hit_factor":5.291},{"match_name":"Ontelaunee USPSA September 2016","match_date":"2016-09-24","stage_classifiercode":"06-10","member_number":"L1158","first_name":"JIM","last_name":"HAND","classification":"M","division":"OPEN","hit_factor":5.2724},{"match_name":"FBURG June 2017 Level I USPSA ","match_date":"2017-06-03","stage_classifiercode":"06-10","member_number":"FY80523","first_name":"JERRY","last_name":"SITEK","classification":"C","division":"OPEN","hit_factor":5.2724},{"match_name":"RangeMasters 9-29-2016","match_date":"2016-09-29","stage_classifiercode":"06-10","member_number":"A94853","first_name":"BOB","last_name":"ZWECK","classification":"C","division":"OPEN","hit_factor":5.2724},{"match_name":"Gem City Gun Club 4-2-16  and 4-3-16","match_date":"2016-04-02","stage_classifiercode":"06-10","member_number":"TY87723","first_name":"JOHN","last_name":"LEARN","classification":"C","division":"OPEN","hit_factor":5.2724},{"match_name":"Nisa April","match_date":"2021-04-25","stage_classifiercode":"06-10","member_number":"a71862","first_name":"JOSEPH","last_name":"SINYAKOVICH","classification":"A","division":"OPEN","hit_factor":5.2632},{"match_name":"LCSA USPSA May 2017","match_date":"2017-05-13","stage_classifiercode":"06-10","member_number":"A-90924","first_name":"SOPHIA","last_name":"SMITH","classification":"C","division":"OPEN","hit_factor":5.2632},{"match_name":"Richmond Hot Shots July 15-16-2017 USPSA Pistol Match","match_date":"2017-07-15","stage_classifiercode":"06-10","member_number":"TY97642","first_name":"DANIEL","last_name":"NUNO","classification":"C","division":"OPEN","hit_factor":5.2632},{"match_name":"EAGC March 2021 USPSA Pistol Match","match_date":"2021-03-21","stage_classifiercode":"06-10","member_number":"A123913","first_name":"ERIC","last_name":"WHITE","classification":"C","division":"OPEN","hit_factor":5.2632},{"match_name":"Alpha Mike Oct 2017","match_date":"2017-10-15","stage_classifiercode":"06-10","member_number":"TY52866","first_name":"STUART","last_name":"BROWNE","classification":"B","division":"OPEN","hit_factor":5.2632},{"match_name":"ESPS USPSA July 2017","match_date":"2017-07-22","stage_classifiercode":"06-10","member_number":"L3202","first_name":"RUSSELL","last_name":"FORTNEY","classification":"A","division":"OPEN","hit_factor":5.2539},{"match_name":"Sage Pistol League USPSA May 16 2021","match_date":"2021-05-16","stage_classifiercode":"06-10","member_number":"TY107066","first_name":"STEVE","last_name":"SVEJDA","classification":"B","division":"OPEN","hit_factor":5.2539},{"match_name":"Mvpsa Fall Week 2 ","match_date":"2016-08-17","stage_classifiercode":"06-10","member_number":"\"\"","first_name":"RYAN","last_name":"KELSO","classification":"U","division":"OPEN","hit_factor":5.2539},{"match_name":"Harvard Action Shooters August 2016 USPSA Pistol","match_date":"2016-08-14","stage_classifiercode":"06-10","member_number":"A93513","first_name":"MICHAEL","last_name":"KANE","classification":"U","division":"OPEN","hit_factor":5.2448},{"match_name":"LdF 4th Saturday Match","match_date":"2015-11-28","stage_classifiercode":"06-10","member_number":"A29001","first_name":"TONY","last_name":"BANTA","classification":"X","division":"OPEN","hit_factor":5.2448},{"match_name":"Alpha Mike Oct 2017","match_date":"2017-10-15","stage_classifiercode":"06-10","member_number":"A67581","first_name":"ROBERT","last_name":"BOYD","classification":"C","division":"OPEN","hit_factor":5.2448},{"match_name":"HOPS USPSA 1020018 ","match_date":"2018-10-19","stage_classifiercode":"06-10","member_number":"L1870","first_name":"LES","last_name":"COX","classification":"M","division":"OPEN","hit_factor":5.2356},{"match_name":"FAS Sunday Outdoor USPSA Match","match_date":"2021-08-01","stage_classifiercode":"06-10","member_number":"TY87343","first_name":"KEITH","last_name":"BERRIAN","classification":"B","division":"OPEN","hit_factor":5.2356},{"match_name":"MCTS USPSA Classifier Match May 2016","match_date":"2016-05-14","stage_classifiercode":"06-10","member_number":"\"\"","first_name":"FLETCHER","last_name":"VALENTINE","classification":"X","division":"OPEN","hit_factor":5.2356},{"match_name":"SPSA USPSA March 4th Sat match","match_date":"2021-03-27","stage_classifiercode":"06-10","member_number":"L1700","first_name":"ROBERT","last_name":"WRIGHT","classification":"M","division":"OPEN","hit_factor":5.2356},{"match_name":"Mvpsa USPSA  April 17","match_date":"2021-04-17","stage_classifiercode":"06-10","member_number":"A119870","first_name":"CODY","last_name":"KING","classification":"U","division":"OPEN","hit_factor":5.2265},{"match_name":"Oxford OHS05 090521","match_date":"2021-09-05","stage_classifiercode":"06-10","member_number":"TY90792","first_name":"BRAD","last_name":"KRUMME","classification":"A","division":"OPEN","hit_factor":5.2265},{"match_name":"Richmond Boro Gun Club October 2017","match_date":"2017-10-21","stage_classifiercode":"06-10","member_number":"A83520","first_name":"JAMES","last_name":"MARQUEZ","classification":"C","division":"OPEN","hit_factor":5.2265},{"match_name":"WVPPS October 2015","match_date":"2015-10-18","stage_classifiercode":"06-10","member_number":"TY81817","first_name":"ALLEN","last_name":"TOWLES","classification":"C","division":"OPEN","hit_factor":5.2265},{"match_name":"GAS July 2020 USPSA Classifier Match","match_date":"2020-07-04","stage_classifiercode":"06-10","member_number":"A127843","first_name":"CHANCE","last_name":"GILLETTE","classification":"U","division":"OPEN","hit_factor":5.2265},{"match_name":"2020-03-07 USPSA at Phoenix Rod and Gun Club","match_date":"2020-03-07","stage_classifiercode":"06-10","member_number":"TY72239","first_name":"CINDY","last_name":"REDIES","classification":"C","division":"OPEN","hit_factor":5.2174},{"match_name":"CCPL - June 2021","match_date":"2021-06-19","stage_classifiercode":"06-10","member_number":"A92861","first_name":"RUSSELL","last_name":"DEMERCADO","classification":"C","division":"OPEN","hit_factor":5.2174},{"match_name":"CRC / SVPS June USPSA","match_date":"2020-06-12","stage_classifiercode":"06-10","member_number":"TY114012","first_name":"BILL","last_name":"JACOBS","classification":"C","division":"OPEN","hit_factor":5.2174},{"match_name":"Gem City Gun Club 9-1 and 9-2-2018","match_date":"2018-09-01","stage_classifiercode":"06-10","member_number":"L1963","first_name":"DENNY","last_name":"MICHALI","classification":"A","division":"OPEN","hit_factor":5.2174},{"match_name":"Chillicothe Sportsmens Club December USPSA","match_date":"2020-12-20","stage_classifiercode":"06-10","member_number":"A125064","first_name":"RYAN","last_name":"NELSON","classification":"C","division":"OPEN","hit_factor":5.2083},{"match_name":"DSS - USPSA 18-08-12","match_date":"2018-08-12","stage_classifiercode":"06-10","member_number":"A104325","first_name":"JEFF","last_name":"WARWICK","classification":"B","division":"OPEN","hit_factor":5.2083},{"match_name":"Hosemasters 2nd Sunday August 2017","match_date":"2017-08-13","stage_classifiercode":"06-10","member_number":"A101820","first_name":"DAVID","last_name":"LARSON","classification":"U","division":"OPEN","hit_factor":5.1993},{"match_name":"CGGR May USPSA Match","match_date":"2017-05-20","stage_classifiercode":"06-10","member_number":"L4056","first_name":"DILLION","last_name":"WALKER","classification":"U","division":"OPEN","hit_factor":5.1993},{"match_name":"Gem City Gun Club 4-2-16  and 4-3-16","match_date":"2016-04-02","stage_classifiercode":"06-10","member_number":"TY43238","first_name":"RICHARD","last_name":"KONNERTH","classification":"C","division":"OPEN","hit_factor":5.1993},{"match_name":"Southkent USPSA MAY match","match_date":"2017-05-20","stage_classifiercode":"06-10","member_number":"TY78136","first_name":"MICAH","last_name":"DOUBLESTEIN","classification":"D","division":"OPEN","hit_factor":5.1993},{"match_name":"Richmond March 6-2015 USPSA Pistol Match","match_date":"2016-03-06","stage_classifiercode":"06-10","member_number":"TY81715","first_name":"ARNEL","last_name":"BAGGAO","classification":"C","division":"OPEN","hit_factor":5.1993},{"match_name":"2020-03-07 USPSA at Phoenix Rod and Gun Club","match_date":"2020-03-07","stage_classifiercode":"06-10","member_number":"A11151","first_name":"KIRBY","last_name":"GOODMAN","classification":"M","division":"OPEN","hit_factor":5.1813},{"match_name":"MPPL 20200301","match_date":"2020-03-01","stage_classifiercode":"06-10","member_number":"L4727","first_name":"EDGAR (ALOHA)","last_name":"VICENTE","classification":"C","division":"OPEN","hit_factor":5.1813},{"match_name":"Richmond Hot Shots July 15-16-2017 USPSA Pistol Match","match_date":"2017-07-15","stage_classifiercode":"06-10","member_number":"A33147","first_name":"VINCENT","last_name":"DIONISIO","classification":"B","division":"OPEN","hit_factor":5.1813},{"match_name":"Gem City Gun Club 4-2-16  and 4-3-16","match_date":"2016-04-02","stage_classifiercode":"06-10","member_number":"TY43238","first_name":"DICK","last_name":"KONNERTH","classification":"C","division":"OPEN","hit_factor":5.1813},{"match_name":"CCPL - June 2021","match_date":"2021-06-19","stage_classifiercode":"06-10","member_number":"A66305","first_name":"HERB","last_name":"SMITH","classification":"B","division":"OPEN","hit_factor":5.1724},{"match_name":"LCSC Linden USPSA 061018","match_date":"2018-06-10","stage_classifiercode":"06-10","member_number":"TY89750","first_name":"JOHN","last_name":"CENDANA","classification":"C","division":"OPEN","hit_factor":5.1724},{"match_name":"GCL Saturday 3-6-2021","match_date":"2021-03-06","stage_classifiercode":"06-10","member_number":"A110729","first_name":"RUSS","last_name":"MARCHESE JR","classification":"U","division":"OPEN","hit_factor":5.1724},{"match_name":"EAGC March 2021 USPSA Pistol Match","match_date":"2021-03-21","stage_classifiercode":"06-10","member_number":"FY66318","first_name":"BARRY","last_name":"PEPPERS","classification":"B","division":"OPEN","hit_factor":5.1724},{"match_name":"CRC / SVPS June USPSA","match_date":"2020-06-12","stage_classifiercode":"06-10","member_number":"A101489","first_name":"TODD","last_name":"WOITZEL","classification":"B","division":"OPEN","hit_factor":5.1635},{"match_name":"EHPSA USPSA 27June 2021","match_date":"2021-06-27","stage_classifiercode":"06-10","member_number":"L1063","first_name":"CHUCK","last_name":"BROOKS","classification":"A","division":"OPEN","hit_factor":5.1635},{"match_name":"MS06 Team Magnolia USPSA November Match","match_date":"2016-11-06","stage_classifiercode":"06-10","member_number":"TY34618","first_name":"BUD","last_name":"BERTHOLD","classification":"A","division":"OPEN","hit_factor":5.1635},{"match_name":"TAP USPSA February 28 2016 (28Feb16-01:01:53)","match_date":"2016-02-28","stage_classifiercode":"06-10","member_number":"A-83191","first_name":"MANUEL","last_name":"SARMIENTO","classification":"B","division":"OPEN","hit_factor":5.1635},{"match_name":"Richmond hotshots April 16-17 2016 USPSA Pistol match","match_date":"2016-04-16","stage_classifiercode":"06-10","member_number":"TY76701","first_name":"GLENN","last_name":"FANNIN","classification":"A","division":"OPEN","hit_factor":5.1635},{"match_name":"Richmond Hot Shots July 15-16-2017 USPSA Pistol Match","match_date":"2017-07-15","stage_classifiercode":"06-10","member_number":"A88783","first_name":"JOHNMAR","last_name":"SAMSON","classification":"A","division":"OPEN","hit_factor":5.1546},{"match_name":"HPS Hot Summer Fun Club Match","match_date":"2017-07-22","stage_classifiercode":"06-10","member_number":"A88485","first_name":"BAYANI","last_name":"DELOS SANTOS","classification":"C","division":"OPEN","hit_factor":5.1546},{"match_name":"OREGON ARPC CC05 USPSA JUNE 10 2017","match_date":"2017-06-10","stage_classifiercode":"06-10","member_number":"Ty45897","first_name":"LAWRENCE","last_name":"MULL","classification":"C","division":"OPEN","hit_factor":5.1546},{"match_name":"Eagles Nest July 30th","match_date":"2017-07-30","stage_classifiercode":"06-10","member_number":"FY39111","first_name":"OLIE","last_name":"ERICKSEN","classification":"B","division":"OPEN","hit_factor":5.1458},{"match_name":"Ontelaunee USPSA September 2016","match_date":"2016-09-24","stage_classifiercode":"06-10","member_number":"TY85379","first_name":"JOE","last_name":"TOLENO","classification":"A","division":"OPEN","hit_factor":5.1458},{"match_name":"Ontelaunee USPSA September 2016","match_date":"2016-09-24","stage_classifiercode":"06-10","member_number":"FY72075","first_name":"DAVID","last_name":"MCMORRIS","classification":"B","division":"OPEN","hit_factor":5.1458},{"match_name":"WGC WI USPSA Monthly Match 10-21-17","match_date":"2017-10-21","stage_classifiercode":"06-10","member_number":"TY78531","first_name":"ROBERT","last_name":"DEFEVER","classification":"C","division":"OPEN","hit_factor":5.1458},{"match_name":"CGC 2016-01-09","match_date":"2016-01-09","stage_classifiercode":"06-10","member_number":"A88793","first_name":"RACHEL","last_name":"SMITH","classification":"C","division":"OPEN","hit_factor":5.1458},{"match_name":"September CAS Match","match_date":"2015-09-06","stage_classifiercode":"06-10","member_number":"TY69922","first_name":"DALE","last_name":"CRAIG","classification":"U","division":"OPEN","hit_factor":5.1458},{"match_name":"OSC April USPSA","match_date":"2021-04-18","stage_classifiercode":"06-10","member_number":"L4071","first_name":"RAY","last_name":"FEGER","classification":"B","division":"OPEN","hit_factor":5.1458},{"match_name":"WSPS JUNE 2017 USPSA MATCH","match_date":"2017-06-17","stage_classifiercode":"06-10","member_number":"A95768","first_name":"THOMAS","last_name":"COOK","classification":"U","division":"OPEN","hit_factor":5.137},{"match_name":"DAP December 2015 Classifier match","match_date":"2015-12-12","stage_classifiercode":"06-10","member_number":"A51896","first_name":"LORI","last_name":"BOFMAN","classification":"B","division":"OPEN","hit_factor":5.137},{"match_name":"LA05  Tangi November USPSA 2020","match_date":"2020-11-20","stage_classifiercode":"06-10","member_number":"43937","first_name":"ROBERT","last_name":"BRENNAN","classification":"B","division":"OPEN","hit_factor":5.1195},{"match_name":"CIPSC Havana May USPSA","match_date":"2018-05-12","stage_classifiercode":"06-10","member_number":"A95946","first_name":"PAUL","last_name":"EMERY","classification":"D","division":"OPEN","hit_factor":5.1194539249147},{"match_name":"WTPS USPSA September Match 9-9-17","match_date":"2017-09-09","stage_classifiercode":"06-10","member_number":"TY95627","first_name":"RYNN","last_name":"SMITH","classification":"C","division":"OPEN","hit_factor":5.1107},{"match_name":"LCSC Linden USPSA 120918","match_date":"2018-12-09","stage_classifiercode":"06-10","member_number":"Ty79621","first_name":"STEVE","last_name":"COLLEN","classification":"A","division":"OPEN","hit_factor":5.1107},{"match_name":"AGC_20170507","match_date":"2017-05-07","stage_classifiercode":"06-10","member_number":"L3985","first_name":"FRANK","last_name":"JOHNSON","classification":"C","division":"OPEN","hit_factor":5.1107},{"match_name":"Ripon USPSA 9-22-18","match_date":"2018-09-22","stage_classifiercode":"06-10","member_number":"A108074","first_name":"TREVOR","last_name":"KNUTSON","classification":"B","division":"OPEN","hit_factor":5.102},{"match_name":"Ripon USPSA 9-22-18","match_date":"2018-09-22","stage_classifiercode":"06-10","member_number":"TY72120","first_name":"DAVE","last_name":"DEYOE","classification":"M","division":"OPEN","hit_factor":5.102},{"match_name":"Lefthanders Gun Club Practical Shooters November","match_date":"2017-11-04","stage_classifiercode":"06-10","member_number":"a22222","first_name":"LUCIAN","last_name":"NORTON","classification":"U","division":"OPEN","hit_factor":5.102},{"match_name":"Harvard Action Shooters August 2016 USPSA Pistol","match_date":"2016-08-14","stage_classifiercode":"06-10","member_number":"TY49725","first_name":"DAN","last_name":"GRECOE","classification":"C","division":"OPEN","hit_factor":5.102},{"match_name":"EHPSA USPSA 27June 2021","match_date":"2021-06-27","stage_classifiercode":"06-10","member_number":"FY90924","first_name":"SOPHIA","last_name":"SMITH","classification":"B","division":"OPEN","hit_factor":5.102},{"match_name":"DSS - USPSA 18-08-12","match_date":"2018-08-12","stage_classifiercode":"06-10","member_number":"TY93980","first_name":"KENNETH","last_name":"LALIBERTE","classification":"B","division":"OPEN","hit_factor":5.102},{"match_name":"Alpha Mike Oct 2017","match_date":"2017-10-15","stage_classifiercode":"06-10","member_number":"A37741","first_name":"DUANE","last_name":"HEMPHILL","classification":"B","division":"OPEN","hit_factor":5.102},{"match_name":"Briar Rabbit October2017","match_date":"2017-10-22","stage_classifiercode":"06-10","member_number":"TY56088","first_name":"MIKE","last_name":"SCOTT","classification":"B","division":"OPEN","hit_factor":5.0934},{"match_name":"AGC_20170507","match_date":"2017-05-07","stage_classifiercode":"06-10","member_number":"A80049","first_name":"RONALD","last_name":"NG","classification":"C","division":"OPEN","hit_factor":5.0934},{"match_name":"Oxford OHS05 090521","match_date":"2021-09-05","stage_classifiercode":"06-10","member_number":"a64452","first_name":"DAVID","last_name":"KIWACKA","classification":"U","division":"OPEN","hit_factor":5.0847},{"match_name":"EHPSA USPSA 27June 2021","match_date":"2021-06-27","stage_classifiercode":"06-10","member_number":"A112503","first_name":"CHAD","last_name":"MOYER","classification":"B","division":"OPEN","hit_factor":5.0847},{"match_name":"PCWC USPSA  9 26 2020","match_date":"2020-09-26","stage_classifiercode":"06-10","member_number":"ty39085","first_name":"MARTIN","last_name":"LITTLE","classification":"M","division":"OPEN","hit_factor":5.0847},{"match_name":"Richmond Hot Shots September 1st-2nd 2018 USPSA Pistol Match","match_date":"2018-09-01","stage_classifiercode":"06-10","member_number":"\"\"","first_name":"CYRUS WAI HO","last_name":"YU","classification":"U","division":"OPEN","hit_factor":5.0847},{"match_name":"Hopkinton August 2016 ","match_date":"2016-08-06","stage_classifiercode":"06-10","member_number":"A36777","first_name":"GREGORY","last_name":"STUDLEY","classification":"B","division":"OPEN","hit_factor":5.0847},{"match_name":"December 2017 CAS USPSA","match_date":"2017-12-03","stage_classifiercode":"06-10","member_number":"FY81006","first_name":"BRYAN","last_name":"BAGNELL","classification":"U","division":"OPEN","hit_factor":5.0761},{"match_name":"Richmond Hot Shots September 1st-2nd 2018 USPSA Pistol Match","match_date":"2018-09-01","stage_classifiercode":"06-10","member_number":"A80595","first_name":"EDGAR","last_name":"ALLAS","classification":"C","division":"OPEN","hit_factor":5.0761},{"match_name":"nocpc october 2016","match_date":"2016-10-09","stage_classifiercode":"06-10","member_number":"\"\"","first_name":"GARY","last_name":"KIRSCH","classification":"C","division":"OPEN","hit_factor":5.0761},{"match_name":"LA05  Tangi November USPSA 2020","match_date":"2020-11-20","stage_classifiercode":"06-10","member_number":"L4343","first_name":"EDWARD M.","last_name":"LISTER","classification":"C","division":"OPEN","hit_factor":5.0676},{"match_name":"PMSC USPSA JULY 2018","match_date":"2018-07-01","stage_classifiercode":"06-10","member_number":"TY84357","first_name":"RAY","last_name":"DONCH","classification":"C","division":"OPEN","hit_factor":5.0676},{"match_name":"CCAS December 2017 Special Classifier","match_date":"2017-12-16","stage_classifiercode":"06-10","member_number":"A101554","first_name":"ALBERT","last_name":"MONTANEZ","classification":"A","division":"OPEN","hit_factor":5.0676},{"match_name":"AGC_20170507","match_date":"2017-05-07","stage_classifiercode":"06-10","member_number":"A56905","first_name":"BLAIR","last_name":"HANSEN","classification":"B","division":"OPEN","hit_factor":5.0676},{"match_name":"FBURG June 2017 Level I USPSA ","match_date":"2017-06-03","stage_classifiercode":"06-10","member_number":"TY71480","first_name":"DAVID","last_name":"SCORDY","classification":"B","division":"OPEN","hit_factor":5.059},{"match_name":"LCSC Linden USPSA 061018","match_date":"2018-06-10","stage_classifiercode":"06-10","member_number":"L3390","first_name":"JOHN","last_name":"WHEELER","classification":"A","division":"OPEN","hit_factor":5.0505},{"match_name":"LdF 4th Saturday Match","match_date":"2015-11-28","stage_classifiercode":"06-10","member_number":"A74054","first_name":"EMIL","last_name":"DABU","classification":"A","division":"OPEN","hit_factor":5.0505},{"match_name":"NCPS USPSA Handgun Match March 25 2018z","match_date":"2018-03-25","stage_classifiercode":"06-10","member_number":"A18729","first_name":"STEVEN","last_name":"MCCORMICK","classification":"A","division":"OPEN","hit_factor":5.042},{"match_name":"Shadow Hawk Defense USPSA SPECIAL CLASSIFIER","match_date":"2021-11-11","stage_classifiercode":"06-10","member_number":"TY102542","first_name":"RON","last_name":"JONES","classification":"A","division":"OPEN","hit_factor":5.0336},{"match_name":"GCL Saturday 3-6-2021","match_date":"2021-03-06","stage_classifiercode":"06-10","member_number":"ty30343","first_name":"BILL","last_name":"KRYSTAN","classification":"B","division":"OPEN","hit_factor":5.0336},{"match_name":"NCPS USPSA Handgun Match March 25 2018z","match_date":"2018-03-25","stage_classifiercode":"06-10","member_number":"A109794","first_name":"KRISTOFFERSON","last_name":"SANCHEZ","classification":"U","division":"OPEN","hit_factor":5.0336},{"match_name":"CCAS December 2017 Special Classifier","match_date":"2017-12-16","stage_classifiercode":"06-10","member_number":"A92463","first_name":"DAN","last_name":"STABER","classification":"C","division":"OPEN","hit_factor":5.0251},{"match_name":"NW01 9-20-16","match_date":"2016-09-20","stage_classifiercode":"06-10","member_number":"A89438","first_name":"NICHOLAS","last_name":"STOCKWELL","classification":"M","division":"OPEN","hit_factor":5.0251},{"match_name":"Custer December USPSA","match_date":"2016-12-04","stage_classifiercode":"06-10","member_number":"A96141","first_name":"JAIMEE","last_name":"MENDOZA","classification":"U","division":"OPEN","hit_factor":5.0251},{"match_name":"BTSA USPSA 2020-5 Oct 11 2020","match_date":"2020-10-11","stage_classifiercode":"06-10","member_number":"F106330","first_name":"AMANDA","last_name":"FISHER","classification":"U","division":"OPEN","hit_factor":5.0167},{"match_name":"PMSC USPSA JULY 2018","match_date":"2018-07-01","stage_classifiercode":"06-10","member_number":"L4413","first_name":"GREG","last_name":"ZOMBEK","classification":"B","division":"OPEN","hit_factor":5.0167},{"match_name":"PMSC USPSA JULY 2018","match_date":"2018-07-01","stage_classifiercode":"06-10","member_number":"FY90731","first_name":"MICHAEL","last_name":"FORD","classification":"\"\"","division":"OPEN","hit_factor":5.0167},{"match_name":"FBURG March 2021 Level I USPSA ","match_date":"2021-03-06","stage_classifiercode":"06-10","member_number":"A103386","first_name":"CESAR","last_name":"SANCHEZ","classification":"B","division":"OPEN","hit_factor":5.0167},{"match_name":"Oxford OHS05 090521","match_date":"2021-09-05","stage_classifiercode":"06-10","member_number":"FY17553","first_name":"BILL","last_name":"SEEVERS","classification":"M","division":"OPEN","hit_factor":5.0083},{"match_name":"Richmond March 6-2015 USPSA Pistol Match","match_date":"2016-03-06","stage_classifiercode":"06-10","member_number":"A88866","first_name":"CHARLIE","last_name":"MENDOZA","classification":"D","division":"OPEN","hit_factor":5.0083},{"match_name":"OREGON TCGC CC02 USPSA NOV 21 2021","match_date":"2021-11-21","stage_classifiercode":"06-10","member_number":"A133944","first_name":"TOM","last_name":"AGOSTI","classification":"C","division":"OPEN","hit_factor":5},{"match_name":"Grandbaggers December 2017","match_date":"2017-12-07","stage_classifiercode":"06-10","member_number":"A86545","first_name":"JAY","last_name":"WEBB","classification":"B","division":"OPEN","hit_factor":4.9917},{"match_name":"April 2017 OPSC USPSA","match_date":"2017-04-09","stage_classifiercode":"06-10","member_number":"A91934","first_name":"ALFRED","last_name":"LADORES","classification":"M","division":"OPEN","hit_factor":4.9875},{"match_name":"Ripon USPSA 9-22-18","match_date":"2018-09-22","stage_classifiercode":"06-10","member_number":"FY104506","first_name":"KEVIN","last_name":"OWENS","classification":"B","division":"OPEN","hit_factor":4.9834},{"match_name":"LCSA USPSA May 2017","match_date":"2017-05-13","stage_classifiercode":"06-10","member_number":"A-90924","first_name":"SOPHIA","last_name":"SMITH","classification":"C","division":"OPEN","hit_factor":4.9834},{"match_name":"RBGC 2016-10-22","match_date":"2016-10-22","stage_classifiercode":"06-10","member_number":"TY57617","first_name":"ERIC","last_name":"DAVIS","classification":"B","division":"OPEN","hit_factor":4.9834},{"match_name":"LdF 4th Saturday Match","match_date":"2015-11-28","stage_classifiercode":"06-10","member_number":"A84088","first_name":"TIARA","last_name":"MACASAET","classification":"B","division":"OPEN","hit_factor":4.9834},{"match_name":"LCSC Linden USPSA 120918","match_date":"2018-12-09","stage_classifiercode":"06-10","member_number":"A98006","first_name":"REBECCA","last_name":"KWONG","classification":"U","division":"OPEN","hit_factor":4.9834},{"match_name":"Space Coast Practical Shooters","match_date":"2018-06-02","stage_classifiercode":"06-10","member_number":"A82594","first_name":"JUDY","last_name":"MACKOWSKI","classification":"C","division":"OPEN","hit_factor":4.9834},{"match_name":"OREGON TCGC CC02 USPSA NOV 21 2021","match_date":"2021-11-21","stage_classifiercode":"06-10","member_number":"A87752","first_name":"JOANNE","last_name":"TEGTMEYER","classification":"B","division":"OPEN","hit_factor":4.9751},{"match_name":"DSS - USPSA 18-08-12","match_date":"2018-08-12","stage_classifiercode":"06-10","member_number":"A101396","first_name":"RYAN","last_name":"HOFFMAN","classification":"D","division":"OPEN","hit_factor":4.9751},{"match_name":"HOPS USPSA 1020018 ","match_date":"2018-10-19","stage_classifiercode":"06-10","member_number":"TY97332","first_name":"CLIFFORD","last_name":"SCOTT","classification":"C","division":"OPEN","hit_factor":4.9587},{"match_name":"EWPSA 2016-01","match_date":"2016-01-17","stage_classifiercode":"06-10","member_number":"FY39579","first_name":"ROBERT","last_name":"SPANGLER","classification":"B","division":"OPEN","hit_factor":4.9505},{"match_name":"Deadwood Boys USPSA All Classifier Match - 29 July 2018","match_date":"2018-07-29","stage_classifiercode":"06-10","member_number":"A107066","first_name":"STEVE","last_name":"SVEJDA","classification":"U","division":"OPEN","hit_factor":4.9505},{"match_name":"HPS Hot Summer Fun Club Match","match_date":"2017-07-22","stage_classifiercode":"06-10","member_number":"L4210","first_name":"BONG","last_name":"BARRANCO","classification":"B","division":"OPEN","hit_factor":4.9505},{"match_name":"Sage Pistol League USPSA May 16 2021","match_date":"2021-05-16","stage_classifiercode":"06-10","member_number":"A79733","first_name":"SCOTT","last_name":"MAWSON","classification":"M","division":"OPEN","hit_factor":4.9505},{"match_name":"Mvpsa USPSA  April 17","match_date":"2021-04-17","stage_classifiercode":"06-10","member_number":"A93448","first_name":"BOB","last_name":"BEER","classification":"C","division":"OPEN","hit_factor":4.9423},{"match_name":"Targetmasters USPSA Handgun Match March 13 2016","match_date":"2016-03-13","stage_classifiercode":"06-10","member_number":"TY46152","first_name":"ALLEN","last_name":"LOWE","classification":"M","division":"OPEN","hit_factor":4.9423},{"match_name":"HRRB 12-01-2018","match_date":"2018-12-01","stage_classifiercode":"06-10","member_number":"A77755","first_name":"PASCUAL LITO","last_name":"SERIO","classification":"D","division":"OPEN","hit_factor":4.9423},{"match_name":"HPS Hot Summer Fun Club Match","match_date":"2017-07-22","stage_classifiercode":"06-10","member_number":"A55833","first_name":"FROILAN","last_name":"RIVERO","classification":"G","division":"OPEN","hit_factor":4.9423},{"match_name":"RangeMasters 9-29-2016","match_date":"2016-09-29","stage_classifiercode":"06-10","member_number":"A33941","first_name":"JACK","last_name":"HERSHBERGER","classification":"A","division":"OPEN","hit_factor":4.9342},{"match_name":"PCWC USPSA  9 26 2020","match_date":"2020-09-26","stage_classifiercode":"06-10","member_number":"A110035","first_name":"TERRY","last_name":"THROWER","classification":"B","division":"OPEN","hit_factor":4.9342},{"match_name":"CCPL 12112016","match_date":"2016-12-11","stage_classifiercode":"06-10","member_number":"A83627","first_name":"HAL","last_name":"ROBERTS","classification":"C","division":"OPEN","hit_factor":4.9342},{"match_name":"SLPSA Jan USPSA","match_date":"2017-01-21","stage_classifiercode":"06-10","member_number":"L3900","first_name":"STEVE","last_name":"TERRY","classification":"C","division":"OPEN","hit_factor":4.9342},{"match_name":"LA05  Tangi November USPSA 2020","match_date":"2020-11-20","stage_classifiercode":"06-10","member_number":"L2725","first_name":"CHARLES","last_name":"BLACK","classification":"M","division":"OPEN","hit_factor":4.9261},{"match_name":"Gem City Gun Club 4-7 and 4-8-18","match_date":"2018-04-07","stage_classifiercode":"06-10","member_number":"A7695","first_name":"ANDREW","last_name":"DIBARTOLOMEO","classification":"C","division":"OPEN","hit_factor":4.9261},{"match_name":"Nampa USPSA July 31st 2021","match_date":"2021-07-31","stage_classifiercode":"06-10","member_number":"A108060","first_name":"LUCAS","last_name":"DINA","classification":"A","division":"OPEN","hit_factor":4.9261},{"match_name":"RBGC USPSA 2021-8-28","match_date":"2021-08-28","stage_classifiercode":"06-10","member_number":"TY119222","first_name":"CLARK","last_name":"DARLEY","classification":"C","division":"OPEN","hit_factor":4.9261},{"match_name":"Ripon USPSA 9-22-18","match_date":"2018-09-22","stage_classifiercode":"06-10","member_number":"A20556","first_name":"DON","last_name":"ZIMMERMAN","classification":"B","division":"OPEN","hit_factor":4.918},{"match_name":"WSRC USPSA 7-21/22-2018","match_date":"2018-07-21","stage_classifiercode":"06-10","member_number":"\"\"","first_name":"JEFF","last_name":"MAY","classification":"U","division":"OPEN","hit_factor":4.91},{"match_name":"HRRB 12-01-2018","match_date":"2018-12-01","stage_classifiercode":"06-10","member_number":"L4313","first_name":"ART","last_name":"RIVERA","classification":"U","division":"OPEN","hit_factor":4.91},{"match_name":"FLPSA MN14 USPSA April 26 2018","match_date":"2018-04-26","stage_classifiercode":"06-10","member_number":"A100450","first_name":"MARK","last_name":"TUTILA","classification":"U","division":"OPEN","hit_factor":4.91},{"match_name":"Custer December USPSA","match_date":"2016-12-04","stage_classifiercode":"06-10","member_number":"A90654","first_name":"RONALD","last_name":"TOLENTINO","classification":"C","division":"OPEN","hit_factor":4.91},{"match_name":"OFGC USPSA Match 11-18-17","match_date":"2017-11-18","stage_classifiercode":"06-10","member_number":"FY34677","first_name":"DALE","last_name":"PANKRATZ","classification":"C","division":"OPEN","hit_factor":4.9069},{"match_name":"OSC April USPSA","match_date":"2021-04-18","stage_classifiercode":"06-10","member_number":"L4969","first_name":"JOSEPH","last_name":"STEVEN","classification":"B","division":"OPEN","hit_factor":4.902},{"match_name":"CCPL - June 2021","match_date":"2021-06-19","stage_classifiercode":"06-10","member_number":"A134220","first_name":"DARIN","last_name":"SMITH","classification":"U","division":"OPEN","hit_factor":4.894},{"match_name":"Richmond Hot Shots September 1st-2nd 2018 USPSA Pistol Match","match_date":"2018-09-01","stage_classifiercode":"06-10","member_number":"10174","first_name":"JANET","last_name":"TSUI","classification":"B","division":"OPEN","hit_factor":4.894},{"match_name":"GCL Saturday 3-6-2021","match_date":"2021-03-06","stage_classifiercode":"06-10","member_number":"A120844","first_name":"PAUL","last_name":"HUDSON","classification":"B","division":"OPEN","hit_factor":4.886},{"match_name":"OPSC USPSA  OCTOBER 2017","match_date":"2017-10-07","stage_classifiercode":"06-10","member_number":"A71723","first_name":"JERRY","last_name":"SOLOMON","classification":"D","division":"OPEN","hit_factor":4.878},{"match_name":"Hosemasters 2nd Sunday August 2017","match_date":"2017-08-13","stage_classifiercode":"06-10","member_number":"TY52840","first_name":"DANNY","last_name":"PHIPPS","classification":"C","division":"OPEN","hit_factor":4.878},{"match_name":"Maine Practical Shooters May 2021","match_date":"2021-05-08","stage_classifiercode":"06-10","member_number":"Ty112187","first_name":"CHRIS","last_name":"AUSTIN","classification":"B","division":"OPEN","hit_factor":4.8701},{"match_name":"Quantico QPS QSC USPSA Match 9 APR 2017","match_date":"2017-04-09","stage_classifiercode":"06-10","member_number":"L3535","first_name":"TAK","last_name":"ONG","classification":"U","division":"OPEN","hit_factor":4.8622},{"match_name":"TAP USPSA February 28 2016 (28Feb16-01:01:53)","match_date":"2016-02-28","stage_classifiercode":"06-10","member_number":"a80595","first_name":"EDGAR","last_name":"ALLAS","classification":"C","division":"OPEN","hit_factor":4.8622},{"match_name":"SFPS 05-15-2016 SuperClassifier - First Division","match_date":"2016-05-15","stage_classifiercode":"06-10","member_number":"L4010","first_name":"RICHARD","last_name":"LAUCK","classification":"C","division":"OPEN","hit_factor":4.8622},{"match_name":"2020-03-07 USPSA at Phoenix Rod and Gun Club","match_date":"2020-03-07","stage_classifiercode":"06-10","member_number":"A105744","first_name":"KRISTIAN","last_name":"BAYLON","classification":"C","division":"OPEN","hit_factor":4.8544},{"match_name":"Nisa April","match_date":"2021-04-25","stage_classifiercode":"06-10","member_number":"A91860","first_name":"COLE","last_name":"HORNBACK","classification":"A","division":"OPEN","hit_factor":4.8544},{"match_name":"Ripon USPSA 7-22-17","match_date":"2017-07-22","stage_classifiercode":"06-10","member_number":"TY78432","first_name":"OUSMANE","last_name":"DIALLO","classification":"C","division":"OPEN","hit_factor":4.8544},{"match_name":"CRC / SVPS June USPSA","match_date":"2020-06-12","stage_classifiercode":"06-10","member_number":"A101681","first_name":"MICHELLE","last_name":"WOITZEL","classification":"C","division":"OPEN","hit_factor":4.8544},{"match_name":"GCL Saturday 3-6-2021","match_date":"2021-03-06","stage_classifiercode":"06-10","member_number":"TY5421","first_name":"TOM","last_name":"BECK","classification":"B","division":"OPEN","hit_factor":4.8544},{"match_name":"Idaho ISPS January 6th 2018","match_date":"2018-01-06","stage_classifiercode":"06-10","member_number":"FY80359","first_name":"JOHN D","last_name":"MCCORD","classification":"\"\"","division":"OPEN","hit_factor":4.8465},{"match_name":"Collin County USPSA 11-28-2021","match_date":"2021-11-28","stage_classifiercode":"06-10","member_number":"A115790","first_name":"CHRISTINE","last_name":"KILLEN (LM)","classification":"C","division":"OPEN","hit_factor":4.8465},{"match_name":"nocpc october 2016","match_date":"2016-10-09","stage_classifiercode":"06-10","member_number":"A58441","first_name":"MICHAEL","last_name":"LAMPHIER","classification":"C","division":"OPEN","hit_factor":4.8465},{"match_name":"Minnetonka Game and Fish Special classifier","match_date":"2017-10-07","stage_classifiercode":"06-10","member_number":"l2942","first_name":"ERIC","last_name":"HILL","classification":"B","division":"OPEN","hit_factor":4.8387},{"match_name":"Paul Bunyan April 7th-8th All Classifier Match NW01","match_date":"2018-04-07","stage_classifiercode":"06-10","member_number":"TY97470","first_name":"DENNIS","last_name":"MAHLE","classification":"B","division":"OPEN","hit_factor":4.8309},{"match_name":"Mvpsa USPSA  April 17","match_date":"2021-04-17","stage_classifiercode":"06-10","member_number":"a129778","first_name":"EMILY","last_name":"HUGHSTON","classification":"U","division":"OPEN","hit_factor":4.8309},{"match_name":"Rankin Field Sunday USPSA","match_date":"2018-10-21","stage_classifiercode":"06-10","member_number":"A88732","first_name":"TIGER","last_name":"NGUYEN","classification":"M","division":"OPEN","hit_factor":4.8309},{"match_name":"DSS - USPSA 18-08-12","match_date":"2018-08-12","stage_classifiercode":"06-10","member_number":"TY91700","first_name":"JEFF","last_name":"MORSE","classification":"\"\"","division":"OPEN","hit_factor":4.8309},{"match_name":"SWGC USPSA Pistol Match - March 2020","match_date":"2020-03-07","stage_classifiercode":"06-10","member_number":"TY39085","first_name":"MARTIN","last_name":"LITTLE","classification":"M","division":"OPEN","hit_factor":4.8309},{"match_name":"SWGC USPSA Pistol Match - December 2018","match_date":"2018-12-01","stage_classifiercode":"06-10","member_number":"A99924","first_name":"CLAYTON","last_name":"RUTAN","classification":"C","division":"OPEN","hit_factor":4.8232},{"match_name":"RBGC USPSA 2021-8-28","match_date":"2021-08-28","stage_classifiercode":"06-10","member_number":"TY114935","first_name":"MARY","last_name":"STEWART","classification":"C","division":"OPEN","hit_factor":4.8232},{"match_name":"Richmond Hot Shots September 1st-2nd 2018 USPSA Pistol Match","match_date":"2018-09-01","stage_classifiercode":"06-10","member_number":"TY93022","first_name":"BONG","last_name":"BALOMADRES","classification":"D","division":"OPEN","hit_factor":4.8232},{"match_name":"Hopkinton August 2016 ","match_date":"2016-08-06","stage_classifiercode":"06-10","member_number":"TY81500","first_name":"STEWART","last_name":"GINSBERG","classification":"B","division":"OPEN","hit_factor":4.8232},{"match_name":"AGC_20170507","match_date":"2017-05-07","stage_classifiercode":"06-10","member_number":"TY75570","first_name":"BILL","last_name":"LHOTTA","classification":"U","division":"OPEN","hit_factor":4.8232},{"match_name":"Nisa April","match_date":"2021-04-25","stage_classifiercode":"06-10","member_number":"Fy104506","first_name":"KEVIN","last_name":"OWENS","classification":"B","division":"OPEN","hit_factor":4.8154},{"match_name":"Springfield Tactical Shooters 09-07-2017","match_date":"2017-09-07","stage_classifiercode":"06-10","member_number":"L1467","first_name":"CHARLES","last_name":"MORSE","classification":"U","division":"OPEN","hit_factor":4.8154},{"match_name":"Harvard Action Shooters August 2016 USPSA Pistol","match_date":"2016-08-14","stage_classifiercode":"06-10","member_number":"TY45433","first_name":"GARY","last_name":"BARNA","classification":"B","division":"OPEN","hit_factor":4.8154},{"match_name":"Richmond Hot Shots September 1st-2nd 2018 USPSA Pistol Match","match_date":"2018-09-01","stage_classifiercode":"06-10","member_number":"9933","first_name":"MARK","last_name":"VAN ZEVERN","classification":"B","division":"OPEN","hit_factor":4.8154},{"match_name":"Ontelaunee USPSA September 2016","match_date":"2016-09-24","stage_classifiercode":"06-10","member_number":"TY82399","first_name":"JAMES","last_name":"BYRNE","classification":"C","division":"OPEN","hit_factor":4.8077},{"match_name":"WELD ECO09 20180617","match_date":"2018-06-17","stage_classifiercode":"06-10","member_number":"TY87911","first_name":"KEITH","last_name":"MARKEY","classification":"U","division":"OPEN","hit_factor":4.8077},{"match_name":"MVPSA USPSA 12-01-18","match_date":"2018-12-01","stage_classifiercode":"06-10","member_number":"L4137","first_name":"STEVE","last_name":"PEACOCK","classification":"C","division":"OPEN","hit_factor":4.8077},{"match_name":"NW01 9-20-16","match_date":"2016-09-20","stage_classifiercode":"06-10","member_number":"a97606","first_name":"BOB","last_name":"KOLITZ","classification":"U","division":"OPEN","hit_factor":4.8077},{"match_name":"Ontelaunee USPSA September 2016","match_date":"2016-09-24","stage_classifiercode":"06-10","member_number":"TY58697","first_name":"GARY","last_name":"PARSONS","classification":"B","division":"OPEN","hit_factor":4.8},{"match_name":"Hosemasters 2nd Sunday August 2017","match_date":"2017-08-13","stage_classifiercode":"06-10","member_number":"A101208","first_name":"CLAY","last_name":"THORMODSGARD","classification":"C","division":"OPEN","hit_factor":4.8},{"match_name":"HOPS USPSA 081917","match_date":"2017-08-19","stage_classifiercode":"06-10","member_number":"A86398","first_name":"GREG","last_name":"GILLILAND","classification":"U","division":"OPEN","hit_factor":4.8},{"match_name":"NCPS USPSA Handgun Match March 25 2018z","match_date":"2018-03-25","stage_classifiercode":"06-10","member_number":"TY89750","first_name":"JOHN","last_name":"CENDANA","classification":"C","division":"OPEN","hit_factor":4.7923},{"match_name":"Brothers N Arms August 2017 USPSA Match","match_date":"2017-08-19","stage_classifiercode":"06-10","member_number":"A99599","first_name":"ARNEL","last_name":"UDANI","classification":"U","division":"OPEN","hit_factor":4.7847},{"match_name":"LdF USPSA Match July 11 2021","match_date":"2021-07-11","stage_classifiercode":"06-10","member_number":"A108080","first_name":"STERLYN","last_name":"RIGSBY","classification":"C","division":"OPEN","hit_factor":4.7847},{"match_name":"Shasta Shooters 2021 Feb","match_date":"2021-02-13","stage_classifiercode":"06-10","member_number":"A100377","first_name":"TIM","last_name":"MCMAHON","classification":"C","division":"OPEN","hit_factor":4.7847},{"match_name":"ARPC USPSA Match 9-24-17","match_date":"2017-09-24","stage_classifiercode":"06-10","member_number":"FY53427","first_name":"ANTHONY","last_name":"FRIEDRICH","classification":"B","division":"OPEN","hit_factor":4.7847},{"match_name":"Brothers N Arms August 2017 USPSA Match","match_date":"2017-08-19","stage_classifiercode":"06-10","member_number":"TY78444","first_name":"LARRY","last_name":"SIVILS","classification":"D","division":"OPEN","hit_factor":4.7771},{"match_name":"CCPS June 2016","match_date":"2016-06-19","stage_classifiercode":"06-10","member_number":"L3806","first_name":"DENNIS","last_name":"TOUGAW E","classification":"B","division":"OPEN","hit_factor":4.7771},{"match_name":"PSAC_20160227","match_date":"2016-02-27","stage_classifiercode":"06-10","member_number":"A49558","first_name":"JOHN","last_name":"ARENAS","classification":"\"\"","division":"OPEN","hit_factor":4.7695},{"match_name":"RangeMasters 9-29-2016","match_date":"2016-09-29","stage_classifiercode":"06-10","member_number":"\"\"","first_name":"KEITH","last_name":"CRUZ","classification":"U","division":"OPEN","hit_factor":4.7695},{"match_name":"Shadow Hawk Defense USPSA SPECIAL CLASSIFIER","match_date":"2021-11-11","stage_classifiercode":"06-10","member_number":"A135309","first_name":"RANDY","last_name":"KOUNS","classification":"U","division":"OPEN","hit_factor":4.7695},{"match_name":"Oxford OHS05 090521","match_date":"2021-09-05","stage_classifiercode":"06-10","member_number":"L4418","first_name":"MIKE","last_name":"GIVEN","classification":"C","division":"OPEN","hit_factor":4.7619},{"match_name":"NOCPC May 2018","match_date":"2018-05-13","stage_classifiercode":"06-10","member_number":"L4213","first_name":"TOM","last_name":"FREDERICK","classification":"B","division":"OPEN","hit_factor":4.7619},{"match_name":"RBGC 2016-10-22","match_date":"2016-10-22","stage_classifiercode":"06-10","member_number":"A94603","first_name":"RONALDO","last_name":"BORGES","classification":"U","division":"OPEN","hit_factor":4.7544},{"match_name":"NNRPA USPSA July 2018","match_date":"2018-07-28","stage_classifiercode":"06-10","member_number":"TY74321","first_name":"STEPHEN","last_name":"PRICE","classification":"B","division":"OPEN","hit_factor":4.7468},{"match_name":"LCSA USPSA May 2017","match_date":"2017-05-13","stage_classifiercode":"06-10","member_number":"a93980","first_name":"KEN","last_name":"LALIBERTE","classification":"C","division":"OPEN","hit_factor":4.7468},{"match_name":"CRC / SVPS June USPSA","match_date":"2020-06-12","stage_classifiercode":"06-10","member_number":"L2900","first_name":"WILLIAM","last_name":"ABRAHAMS","classification":"A","division":"OPEN","hit_factor":4.7468},{"match_name":"EAGC March 2021 USPSA Pistol Match","match_date":"2021-03-21","stage_classifiercode":"06-10","member_number":"L3733","first_name":"MARK","last_name":"KAUDER","classification":"C","division":"OPEN","hit_factor":4.7468},{"match_name":"FBURG June 2017 Level I USPSA ","match_date":"2017-06-03","stage_classifiercode":"06-10","member_number":"L3202","first_name":"RUSSELL","last_name":"FORTNEY","classification":"A","division":"OPEN","hit_factor":4.7393},{"match_name":"Hosemasters 2nd Sunday August 2017","match_date":"2017-08-13","stage_classifiercode":"06-10","member_number":"A91055","first_name":"BOB","last_name":"WAGNER","classification":"B","division":"OPEN","hit_factor":4.7393},{"match_name":"Hosemasters 2nd Sunday August 2017","match_date":"2017-08-13","stage_classifiercode":"06-10","member_number":"CL67","first_name":"ROGER","last_name":"F","classification":"M","division":"OPEN","hit_factor":4.7393},{"match_name":"WSRC USPSA 7-21/22-2018","match_date":"2018-07-21","stage_classifiercode":"06-10","member_number":"TY95742","first_name":"CAMDEN","last_name":"LEE","classification":"C","division":"OPEN","hit_factor":4.7244},{"match_name":"OPSC USPSA  OCTOBER 2017","match_date":"2017-10-07","stage_classifiercode":"06-10","member_number":"L1371","first_name":"RICHARD","last_name":"KIESER","classification":"C","division":"OPEN","hit_factor":4.7244},{"match_name":"RBGC USPSA 2021-8-28","match_date":"2021-08-28","stage_classifiercode":"06-10","member_number":"A130687","first_name":"LEE","last_name":"HENDERSON","classification":"B","division":"OPEN","hit_factor":4.7244},{"match_name":"ORSA USPSA October 2020","match_date":"2020-10-17","stage_classifiercode":"06-10","member_number":"A28262","first_name":"DANIEL","last_name":"FOWLER","classification":"B","division":"OPEN","hit_factor":4.717},{"match_name":"ORSA USPSA October 2020","match_date":"2020-10-17","stage_classifiercode":"06-10","member_number":"TY114533","first_name":"MARK","last_name":"BECKMANN","classification":"U","division":"OPEN","hit_factor":4.717},{"match_name":"WGC WI USPSA Monthly Match 10-21-17","match_date":"2017-10-21","stage_classifiercode":"06-10","member_number":"A99422","first_name":"CORY","last_name":"TUCHSCHERER","classification":"C","division":"OPEN","hit_factor":4.7096},{"match_name":"AGC_20170507","match_date":"2017-05-07","stage_classifiercode":"06-10","member_number":"FY28961","first_name":"BONNIE","last_name":"RYDER","classification":"B","division":"OPEN","hit_factor":4.7096},{"match_name":"Salt City practical shooting league 'all classifier match'","match_date":"2020-08-30","stage_classifiercode":"06-10","member_number":"A111177","first_name":"SCOTT","last_name":"PATTERSON","classification":"C","division":"OPEN","hit_factor":4.7022},{"match_name":"Custer Uspsa December","match_date":"2018-12-02","stage_classifiercode":"06-10","member_number":"A110099","first_name":"HAROLD","last_name":"MARTINEZ","classification":"C","division":"OPEN","hit_factor":4.7022},{"match_name":"OOPS May 8th Match","match_date":"2016-05-08","stage_classifiercode":"06-10","member_number":"A96186","first_name":"BRYAN","last_name":"CHANCE","classification":"U","division":"OPEN","hit_factor":4.6948},{"match_name":"CFRPC November USPSA","match_date":"2018-11-18","stage_classifiercode":"06-10","member_number":"TY97123","first_name":"FERNANDO","last_name":"FERREIRA","classification":"D","division":"OPEN","hit_factor":4.6948},{"match_name":"ISPS JULY 2nd 2016","match_date":"2016-07-02","stage_classifiercode":"06-10","member_number":"A94890","first_name":"CHRIS","last_name":"CLARK","classification":"U","division":"OPEN","hit_factor":4.6875},{"match_name":"Sharp Practical Shooters August USPSA - Outdoor","match_date":"2021-08-22","stage_classifiercode":"06-10","member_number":"L3876","first_name":"JODI","last_name":"HUMANN","classification":"C","division":"OPEN","hit_factor":4.6875},{"match_name":"Shoot GTR USPSA Classifier 06-10","match_date":"2018-01-03","stage_classifiercode":"06-10","member_number":"A104397","first_name":"DARYL","last_name":"JOHNSTON","classification":"U","division":"OPEN","hit_factor":4.6875},{"match_name":"Hosemasters 2nd Sunday August 2017","match_date":"2017-08-13","stage_classifiercode":"06-10","member_number":"TY69261","first_name":"DANIEL","last_name":"COON","classification":"C","division":"OPEN","hit_factor":4.6875},{"match_name":"DSS - USPSA 18-08-12","match_date":"2018-08-12","stage_classifiercode":"06-10","member_number":"A81835","first_name":"DON","last_name":"MAHER","classification":"\"\"","division":"OPEN","hit_factor":4.6875},{"match_name":"NVSA USPSA 1712","match_date":"2017-12-03","stage_classifiercode":"06-10","member_number":"A14162","first_name":"RUSS","last_name":"HOLETZ","classification":"U","division":"OPEN","hit_factor":4.6802},{"match_name":"OOPS Three Stage ","match_date":"2017-07-22","stage_classifiercode":"06-10","member_number":"TY97332","first_name":"CLIFFORD","last_name":"SCOTT","classification":"U","division":"OPEN","hit_factor":4.6729},{"match_name":"TAP USPSA February 28 2016 (28Feb16-01:01:53)","match_date":"2016-02-28","stage_classifiercode":"06-10","member_number":"A85957","first_name":"TRISTAN","last_name":"TOLENTINO","classification":"B","division":"OPEN","hit_factor":4.6729},{"match_name":"FBURG June 2018 Level 1 USPSA","match_date":"2018-06-02","stage_classifiercode":"06-10","member_number":"L3535","first_name":"TAK","last_name":"ONG","classification":"B","division":"OPEN","hit_factor":4.6656},{"match_name":"PIPS 05-18-2016","match_date":"2016-05-17","stage_classifiercode":"06-10","member_number":"TY3634","first_name":"GREG","last_name":"THOMAS","classification":"B","division":"OPEN","hit_factor":4.6656},{"match_name":"SAPSA May 2016","match_date":"2016-05-21","stage_classifiercode":"06-10","member_number":"A89495","first_name":"MIGUEL","last_name":"PLATINO","classification":"B","division":"OPEN","hit_factor":4.6584},{"match_name":"December 2017 CAS USPSA","match_date":"2017-12-03","stage_classifiercode":"06-10","member_number":"A81207","first_name":"CECIL","last_name":"JANISE","classification":"C","division":"OPEN","hit_factor":4.6584},{"match_name":"Custer December USPSA","match_date":"2016-12-04","stage_classifiercode":"06-10","member_number":"FY49188","first_name":"DAVE","last_name":"BULLOCK","classification":"A","division":"OPEN","hit_factor":4.6584},{"match_name":"MCAS USPSA March 2016","match_date":"2016-03-19","stage_classifiercode":"06-10","member_number":"TY25701","first_name":"ANDY","last_name":"ADAMS","classification":"C","division":"OPEN","hit_factor":4.644},{"match_name":"Monson April 2017 USPSA","match_date":"2017-04-23","stage_classifiercode":"06-10","member_number":"A87563","first_name":"TOBY","last_name":"WESKOSKY","classification":"X","division":"OPEN","hit_factor":4.644},{"match_name":"PIPS 05-18-2016","match_date":"2016-05-17","stage_classifiercode":"06-10","member_number":"FY69138","first_name":"JOHN","last_name":"CEDARBERG","classification":"B","division":"OPEN","hit_factor":4.6368},{"match_name":"OREGON ARPC CC05 USPSA JUNE 10 2017","match_date":"2017-06-10","stage_classifiercode":"06-10","member_number":"TY81959","first_name":"BILL","last_name":"RYAN","classification":"C","division":"OPEN","hit_factor":4.6368},{"match_name":"Ripon USPSA 7-22-17","match_date":"2017-07-22","stage_classifiercode":"06-10","member_number":"FY53791","first_name":"MICHAEL","last_name":"OLSON","classification":"B","division":"OPEN","hit_factor":4.6296},{"match_name":"Quantico QPS QSC USPSA Match 9 APR 2017","match_date":"2017-04-09","stage_classifiercode":"06-10","member_number":"TY41485","first_name":"DJ","last_name":"VIAR","classification":"B","division":"OPEN","hit_factor":4.6296},{"match_name":"CPS USPSA May 2017","match_date":"2017-05-06","stage_classifiercode":"06-10","member_number":"TY96965","first_name":"FREDERICK","last_name":"BENNETT","classification":"U","division":"OPEN","hit_factor":4.6296},{"match_name":"Oxford OHS05 090521","match_date":"2021-09-05","stage_classifiercode":"06-10","member_number":"Ty101296","first_name":"BEN","last_name":"WENNING","classification":"C","division":"OPEN","hit_factor":4.6296},{"match_name":"WSRC USPSA 7-21/22-2018","match_date":"2018-07-21","stage_classifiercode":"06-10","member_number":"\"\"","first_name":"JANICE","last_name":"DEES","classification":"U","division":"OPEN","hit_factor":4.6225},{"match_name":"LCSA USPSA May 2017","match_date":"2017-05-13","stage_classifiercode":"06-10","member_number":"ty77032","first_name":"TYLER","last_name":"COKE","classification":"B","division":"OPEN","hit_factor":4.6154},{"match_name":"Richmond Hot Shots September 1st-2nd 2018 USPSA Pistol Match","match_date":"2018-09-01","stage_classifiercode":"06-10","member_number":"A25441","first_name":"WALTER K","last_name":"HASHIMOTO","classification":"A","division":"OPEN","hit_factor":4.6154},{"match_name":"Space Coast Practical Shooters","match_date":"2018-06-02","stage_classifiercode":"06-10","member_number":"fy71093","first_name":"BRAD","last_name":"STEIMEL","classification":"A","division":"OPEN","hit_factor":4.6154},{"match_name":"Eagles Nest July 30th","match_date":"2017-07-30","stage_classifiercode":"06-10","member_number":"FY90924","first_name":"SOPHIA","last_name":"SMITH","classification":"C","division":"OPEN","hit_factor":4.6083},{"match_name":"EAGC May 2018 USPSA Pistol Match","match_date":"2018-05-20","stage_classifiercode":"06-10","member_number":"A100062","first_name":"BRIAN","last_name":"MORAN","classification":"C","division":"OPEN","hit_factor":4.6083},{"match_name":"LdF 4th Saturday Match","match_date":"2015-11-28","stage_classifiercode":"06-10","member_number":"A37333","first_name":"ERIC","last_name":"BENEDICTO","classification":"X","division":"OPEN","hit_factor":4.6083},{"match_name":"Hosemasters 2nd Sunday August 2017","match_date":"2017-08-13","stage_classifiercode":"06-10","member_number":"\"\"","first_name":"ALEX","last_name":"FLOTTO","classification":"U","division":"OPEN","hit_factor":4.6012},{"match_name":"September CAS Match","match_date":"2015-09-06","stage_classifiercode":"06-10","member_number":"A81207","first_name":"CECIL","last_name":"JANISE","classification":"C","division":"OPEN","hit_factor":4.6012},{"match_name":"MCAS June 2018 USPSA Match","match_date":"2018-06-30","stage_classifiercode":"06-10","member_number":"Fy20463","first_name":"DENNIS","last_name":"BAUER","classification":"M","division":"OPEN","hit_factor":4.6012},{"match_name":"RBGC USPSA 2021-8-28","match_date":"2021-08-28","stage_classifiercode":"06-10","member_number":"A114462","first_name":"CHRIS","last_name":"PARKER","classification":"B","division":"OPEN","hit_factor":4.6012},{"match_name":"DWB - Deadwood Boys USPSA 19 January 2020","match_date":"2020-01-19","stage_classifiercode":"06-10","member_number":"TY102749","first_name":"ASHLEY","last_name":"CHURCH","classification":"C","division":"OPEN","hit_factor":4.5942},{"match_name":"GRPC USPSA DO YOU FEEL LUCKY?","match_date":"2021-03-07","stage_classifiercode":"06-10","member_number":"TY96553","first_name":"DANNY","last_name":"NARAMORE","classification":"C","division":"OPEN","hit_factor":4.5942},{"match_name":"CCPL - June 2021","match_date":"2021-06-19","stage_classifiercode":"06-10","member_number":"TY91802","first_name":"STEVEN","last_name":"WESCOTT","classification":"B","division":"OPEN","hit_factor":4.5872},{"match_name":"MVPSA USPSA  6-2-18","match_date":"2018-06-02","stage_classifiercode":"06-10","member_number":"A89186","first_name":"JACK","last_name":"COOPER","classification":"B","division":"OPEN","hit_factor":4.5872},{"match_name":"PTPC November 4th  USPSA Match","match_date":"2018-11-04","stage_classifiercode":"06-10","member_number":"TY98078","first_name":"ALBERT","last_name":"YAU","classification":"C","division":"OPEN","hit_factor":4.5802},{"match_name":"WPS USPSA Monthly Match May 2016","match_date":"2016-05-07","stage_classifiercode":"06-10","member_number":"FY8825","first_name":"JOHN","last_name":"HABERERN","classification":"M","division":"OPEN","hit_factor":4.5802},{"match_name":"MASTER BLASTERS & SSFGA USPSA - September","match_date":"2021-09-18","stage_classifiercode":"06-10","member_number":"TY85228","first_name":"BILL","last_name":"LAFRENIERE","classification":"C","division":"OPEN","hit_factor":4.5802},{"match_name":"Hosemasters 2nd Sunday August 2017","match_date":"2017-08-13","stage_classifiercode":"06-10","member_number":"TY16908","first_name":"SPENCE","last_name":"CUTRELL","classification":"A","division":"OPEN","hit_factor":4.5732},{"match_name":"SFPC SMTCA","match_date":"2017-04-30","stage_classifiercode":"06-10","member_number":"A93782","first_name":"JORGE","last_name":"PITA","classification":"C","division":"OPEN","hit_factor":4.5732},{"match_name":"GCL December 5-2020","match_date":"2020-12-05","stage_classifiercode":"06-10","member_number":"ty31907","first_name":"JEFF","last_name":"CURTS","classification":"A","division":"OPEN","hit_factor":4.5732},{"match_name":"ESPS USPSA July 2017","match_date":"2017-07-22","stage_classifiercode":"06-10","member_number":"A85259","first_name":"JOSELITO","last_name":"SANTOS","classification":"C","division":"OPEN","hit_factor":4.5662},{"match_name":"HOPS USPSA 081917","match_date":"2017-08-19","stage_classifiercode":"06-10","member_number":"A65240","first_name":"JERRY","last_name":"GARRISON","classification":"U","division":"OPEN","hit_factor":4.5662},{"match_name":"EHPSA USPSA 27June 2021","match_date":"2021-06-27","stage_classifiercode":"06-10","member_number":"FY90924","first_name":"SOPHIA","last_name":"SMITH","classification":"B","division":"OPEN","hit_factor":4.5593},{"match_name":"Monson April 2017 USPSA","match_date":"2017-04-23","stage_classifiercode":"06-10","member_number":"TY45333","first_name":"CHRIS","last_name":"COLOMBO","classification":"C","division":"OPEN","hit_factor":4.5593},{"match_name":"Richmond hotshots April 16-17 2016 USPSA Pistol match","match_date":"2016-04-16","stage_classifiercode":"06-10","member_number":"fy81272","first_name":"GAYLORD","last_name":"GABRIEL","classification":"B","division":"OPEN","hit_factor":4.5593},{"match_name":"SWGC USPSA Pistol Match - March 2020","match_date":"2020-03-07","stage_classifiercode":"06-10","member_number":"A99924","first_name":"CLAYTON","last_name":"RUTAN","classification":"B","division":"OPEN","hit_factor":4.5593},{"match_name":"Lefthanders Gun Club Practical Shooters November","match_date":"2017-11-04","stage_classifiercode":"06-10","member_number":"TY72670","first_name":"DALE","last_name":"HARDING","classification":"B","division":"OPEN","hit_factor":4.5524},{"match_name":"Springfield Tactical Shooters 12-3-15","match_date":"2015-12-03","stage_classifiercode":"06-10","member_number":"L1467","first_name":"CHARLIE","last_name":"MORSE","classification":"B","division":"OPEN","hit_factor":4.5317},{"match_name":"FBURG March 2021 Level I USPSA ","match_date":"2021-03-06","stage_classifiercode":"06-10","member_number":"A34991","first_name":"ZACH","last_name":"TEICH","classification":"A","division":"OPEN","hit_factor":4.5317},{"match_name":"Shoot GTR Monthly USPSA","match_date":"2018-01-07","stage_classifiercode":"06-10","member_number":"A97997","first_name":"JOE","last_name":"CAMPAGNA","classification":"D","division":"OPEN","hit_factor":4.5249},{"match_name":"AGC_20160403","match_date":"2016-04-03","stage_classifiercode":"06-10","member_number":"\"\"","first_name":"TYLER","last_name":"RICO","classification":"X","division":"OPEN","hit_factor":4.5181},{"match_name":"WSRC USPSA 7-21/22-2018","match_date":"2018-07-21","stage_classifiercode":"06-10","member_number":"\"\"","first_name":"MATT","last_name":"GRABANSKI","classification":"U","division":"OPEN","hit_factor":4.5113},{"match_name":"PMSC USPSA JULY 2018","match_date":"2018-07-01","stage_classifiercode":"06-10","member_number":"TY84357","first_name":"RAY","last_name":"DONCH","classification":"C","division":"OPEN","hit_factor":4.5113},{"match_name":"EHPSA USPSA 27June 2021","match_date":"2021-06-27","stage_classifiercode":"06-10","member_number":"L2555","first_name":"TERRY","last_name":"HALDIN","classification":"C","division":"OPEN","hit_factor":4.5113},{"match_name":"OSC April USPSA","match_date":"2021-04-18","stage_classifiercode":"06-10","member_number":"L4558","first_name":"MICHAEL","last_name":"OLSON","classification":"B","division":"OPEN","hit_factor":4.5113},{"match_name":"LBAS170429 Spray-N-Pray Classifier Match","match_date":"2017-04-29","stage_classifiercode":"06-10","member_number":"FY60230","first_name":"ROBERT","last_name":"BALES","classification":"C","division":"OPEN","hit_factor":4.5113},{"match_name":"Harvard Action Shooters August 2016 USPSA Pistol","match_date":"2016-08-14","stage_classifiercode":"06-10","member_number":"L1876","first_name":"SIMEON","last_name":"GOUROUSIS","classification":"B","division":"OPEN","hit_factor":4.5045},{"match_name":"YRPA  9/25/16  USPSA Pistol Match","match_date":"2016-09-23","stage_classifiercode":"06-10","member_number":"A41768","first_name":"ED","last_name":"BOTTINO","classification":"C","division":"OPEN","hit_factor":4.5045},{"match_name":"RBGC USPSA 2021-8-28","match_date":"2021-08-28","stage_classifiercode":"06-10","member_number":"TY106854","first_name":"ODED","last_name":"ZYSSMAN","classification":"B","division":"OPEN","hit_factor":4.5045},{"match_name":"Eagles Nest October 16th 2016","match_date":"2016-10-16","stage_classifiercode":"06-10","member_number":"TY91700","first_name":"JEFF","last_name":"MORSE","classification":"C","division":"OPEN","hit_factor":4.5045},{"match_name":"MCAS June 2018 USPSA Match","match_date":"2018-06-30","stage_classifiercode":"06-10","member_number":"FY99175","first_name":"ROGER","last_name":"HARDING","classification":"C","division":"OPEN","hit_factor":4.4978},{"match_name":"LCSC Linden USPSA 120918","match_date":"2018-12-09","stage_classifiercode":"06-10","member_number":"Fy59179","first_name":"DAVE","last_name":"BUNN","classification":"B","division":"OPEN","hit_factor":4.4978},{"match_name":"MCTS USPSA Classifier Match May 2016","match_date":"2016-05-14","stage_classifiercode":"06-10","member_number":"TY84386","first_name":"MARK","last_name":"STEVENS","classification":"U","division":"OPEN","hit_factor":4.491},{"match_name":"PMSC USPSA JULY 2018","match_date":"2018-07-01","stage_classifiercode":"06-10","member_number":"A80108","first_name":"KEN","last_name":"DITTIG","classification":"C","division":"OPEN","hit_factor":4.491},{"match_name":"Space Coast Practical Shooters","match_date":"2018-06-02","stage_classifiercode":"06-10","member_number":"TY23169","first_name":"TED","last_name":"KAVAGE","classification":"B","division":"OPEN","hit_factor":4.491},{"match_name":"Monson April 2017 USPSA","match_date":"2017-04-23","stage_classifiercode":"06-10","member_number":"A91323","first_name":"DOUG","last_name":"FLAVIN","classification":"U","division":"OPEN","hit_factor":4.4843},{"match_name":"CAPS 8-28-2021","match_date":"2021-08-28","stage_classifiercode":"06-10","member_number":"A74797","first_name":"CHRIS OPEN","last_name":"LARSEN","classification":"B","division":"OPEN","hit_factor":4.4843},{"match_name":"DSS - USPSA 18-08-12","match_date":"2018-08-12","stage_classifiercode":"06-10","member_number":"A102834","first_name":"DAVID","last_name":"CONLEY","classification":"C","division":"OPEN","hit_factor":4.4843},{"match_name":"Lefthanders Gun Club Practical Shooters November","match_date":"2017-11-04","stage_classifiercode":"06-10","member_number":"L2188","first_name":"BRIAN","last_name":"ROYALTY","classification":"C","division":"OPEN","hit_factor":4.4776},{"match_name":"Richmond Hot Shots July 15-16-2017 USPSA Pistol Match","match_date":"2017-07-15","stage_classifiercode":"06-10","member_number":"TY88866","first_name":"CHARLIE","last_name":"MENDOZA","classification":"C","division":"OPEN","hit_factor":4.4776},{"match_name":"BORCC USPSA October 2016 Classifier Match","match_date":"2016-10-30","stage_classifiercode":"06-10","member_number":"A93362","first_name":"APRIL","last_name":"TOOSOVICH","classification":"U","division":"OPEN","hit_factor":4.4776},{"match_name":"CGGR May USPSA Match","match_date":"2017-05-20","stage_classifiercode":"06-10","member_number":"A25745","first_name":"DAN","last_name":"SANDERS","classification":"B","division":"OPEN","hit_factor":4.4709},{"match_name":"FBURG March 2021 Level I USPSA ","match_date":"2021-03-06","stage_classifiercode":"06-10","member_number":"TY126071","first_name":"JOSHUA","last_name":"SCHROEPFER","classification":"C","division":"OPEN","hit_factor":4.4709},{"match_name":"WSPS JUNE 2017 USPSA MATCH","match_date":"2017-06-17","stage_classifiercode":"06-10","member_number":"A88350","first_name":"DAVID","last_name":"WAMPLER","classification":"G","division":"OPEN","hit_factor":4.4643},{"match_name":"Richmond Boro Gun Club October 2017","match_date":"2017-10-21","stage_classifiercode":"06-10","member_number":"TY103555","first_name":"JOHN","last_name":"FEVELO","classification":"U","division":"OPEN","hit_factor":4.4643},{"match_name":"MCAS June 2018 USPSA Match","match_date":"2018-06-30","stage_classifiercode":"06-10","member_number":"A104679","first_name":"LUKE","last_name":"ARCHER","classification":"C","division":"OPEN","hit_factor":4.4643},{"match_name":"AGC_20160403","match_date":"2016-04-03","stage_classifiercode":"06-10","member_number":"A56905","first_name":"BLAIR","last_name":"HANSEN","classification":"\u0000","division":"OPEN","hit_factor":4.4577},{"match_name":"NCPS USPSA Handgun Match March 25 2018z","match_date":"2018-03-25","stage_classifiercode":"06-10","member_number":"A82754","first_name":"JONATHAN","last_name":"AURIGUI","classification":"U","division":"OPEN","hit_factor":4.4577},{"match_name":"Alpha Mike Oct 2017","match_date":"2017-10-15","stage_classifiercode":"06-10","member_number":"A71930","first_name":"JEROME","last_name":"HANSEN","classification":"C","division":"OPEN","hit_factor":4.4577},{"match_name":"Colonial Rifle And Pistol Club Novermer Match","match_date":"2018-11-03","stage_classifiercode":"06-10","member_number":"FY92775","first_name":"CLIFFORD","last_name":"AVERSANO SR.","classification":"D","division":"OPEN","hit_factor":4.451},{"match_name":"Alpha Mike Oct 2017","match_date":"2017-10-15","stage_classifiercode":"06-10","member_number":"a90282","first_name":"MICHAEL","last_name":"MADDOX","classification":"U","division":"OPEN","hit_factor":4.451},{"match_name":"ENPS May 2016 Classifier Match","match_date":"2016-05-01","stage_classifiercode":"06-10","member_number":"a7755","first_name":"GEORGE","last_name":"LEITH","classification":"A","division":"OPEN","hit_factor":4.4444},{"match_name":"WSRC USPSA 7-21/22-2018","match_date":"2018-07-21","stage_classifiercode":"06-10","member_number":"A110822","first_name":"ED","last_name":"DEES","classification":"U","division":"OPEN","hit_factor":4.4379},{"match_name":"FAS Sunday Outdoor USPSA Match","match_date":"2021-08-01","stage_classifiercode":"06-10","member_number":"A126158","first_name":"SAMUEL","last_name":"TERWILLIGER","classification":"A","division":"OPEN","hit_factor":4.4379},{"match_name":"HOPS USPSA 081917","match_date":"2017-08-19","stage_classifiercode":"06-10","member_number":"FY72619","first_name":"JIM","last_name":"THOMAS","classification":"C","division":"OPEN","hit_factor":4.4379},{"match_name":"GRB USPSA Sept @ CAV","match_date":"2015-09-19","stage_classifiercode":"06-10","member_number":"A85896","first_name":"JOHN","last_name":"MCQUEEN","classification":"D","division":"OPEN","hit_factor":4.4379},{"match_name":"Colonial Rifle And Pistol Club Novermer Match","match_date":"2018-11-03","stage_classifiercode":"06-10","member_number":"A107578","first_name":"JOSE","last_name":"SANTIAGO","classification":"U","division":"OPEN","hit_factor":4.4313},{"match_name":"LCSC Linden USPSA 061018","match_date":"2018-06-10","stage_classifiercode":"06-10","member_number":"TY66432","first_name":"DANNY","last_name":"REA","classification":"B","division":"OPEN","hit_factor":4.4313},{"match_name":"CFRPC November USPSA","match_date":"2018-11-18","stage_classifiercode":"06-10","member_number":"A109427","first_name":"GREGG","last_name":"BAJAMUNDE","classification":"U","division":"OPEN","hit_factor":4.4313},{"match_name":"TPS USPSA -  August 2017 - Talon Range","match_date":"2017-08-05","stage_classifiercode":"06-10","member_number":"A-103704","first_name":"JOSEPH","last_name":"KING","classification":"A","division":"OPEN","hit_factor":4.4313},{"match_name":"GRPC USPSA DO YOU FEEL LUCKY?","match_date":"2021-03-07","stage_classifiercode":"06-10","member_number":"TY104508","first_name":"CHARITY","last_name":"TAYLOR","classification":"D","division":"OPEN","hit_factor":4.4248},{"match_name":"ORSA USPSA October 2020","match_date":"2020-10-17","stage_classifiercode":"06-10","member_number":"L4850","first_name":"BRYAN","last_name":"KISER","classification":"B","division":"OPEN","hit_factor":4.4248},{"match_name":"ARPC USPSA Match 8-26-18","match_date":"2018-08-26","stage_classifiercode":"06-10","member_number":"A87386","first_name":"MATT","last_name":"OPFER","classification":"B","division":"OPEN","hit_factor":4.4118},{"match_name":"Richmond Boro Gun Club October 2017","match_date":"2017-10-21","stage_classifiercode":"06-10","member_number":"TY92927","first_name":"ANTHONY","last_name":"MAINOLFI","classification":"B","division":"OPEN","hit_factor":4.4053},{"match_name":"LdF USPSA Match July 11 2021","match_date":"2021-07-11","stage_classifiercode":"06-10","member_number":"TY127183","first_name":"BRAD","last_name":"OLSHEN","classification":"B","division":"OPEN","hit_factor":4.3988},{"match_name":"SLPSA Jan USPSA","match_date":"2017-01-21","stage_classifiercode":"06-10","member_number":"TY81047","first_name":"JIM","last_name":"LARSON","classification":"C","division":"OPEN","hit_factor":4.3924},{"match_name":"Ripon USPSA 9-22-18","match_date":"2018-09-22","stage_classifiercode":"06-10","member_number":"TY99422","first_name":"CORY","last_name":"TUCHSCHERER","classification":"B","division":"OPEN","hit_factor":4.386},{"match_name":"WELD ECO09 20180617","match_date":"2018-06-17","stage_classifiercode":"06-10","member_number":"A61105","first_name":"SANDRA","last_name":"SOTO","classification":"C","division":"OPEN","hit_factor":4.386},{"match_name":"GCL December 5-2020","match_date":"2020-12-05","stage_classifiercode":"06-10","member_number":"TY5421","first_name":"TOM","last_name":"BECK","classification":"B","division":"OPEN","hit_factor":4.3796},{"match_name":"September CAS Match","match_date":"2015-09-06","stage_classifiercode":"06-10","member_number":"TY63532","first_name":"GEORGE","last_name":"HEMSTAD","classification":"M","division":"OPEN","hit_factor":4.3732},{"match_name":"ARPC USPSA Match 8-26-18","match_date":"2018-08-26","stage_classifiercode":"06-10","member_number":"TY93058","first_name":"BRUCE","last_name":"CURRY","classification":"C","division":"OPEN","hit_factor":4.3732},{"match_name":"LdF USPSA Match May 27 2017","match_date":"2017-05-27","stage_classifiercode":"06-10","member_number":"L3958","first_name":"LEI","last_name":"XU","classification":"C","division":"OPEN","hit_factor":4.3732},{"match_name":"Deadwood Boys USPSA All Classifier Match - 29 July 2018","match_date":"2018-07-29","stage_classifiercode":"06-10","member_number":"A102749","first_name":"ASHLEY","last_name":"YAMAMOTO","classification":"C","division":"OPEN","hit_factor":4.3668},{"match_name":"Harvard Action Shooters August 2016 USPSA Pistol","match_date":"2016-08-14","stage_classifiercode":"06-10","member_number":"TY23169","first_name":"TED","last_name":"KAVAGE","classification":"B","division":"OPEN","hit_factor":4.3668},{"match_name":"ESPS USPSA July 2017","match_date":"2017-07-22","stage_classifiercode":"06-10","member_number":"TY58056","first_name":"NOEL","last_name":"MARUCUT","classification":"B","division":"OPEN","hit_factor":4.3605},{"match_name":"MCAS June 2018 USPSA Match","match_date":"2018-06-30","stage_classifiercode":"06-10","member_number":"l3916","first_name":"TAMI","last_name":"WAITE","classification":"B","division":"OPEN","hit_factor":4.3541},{"match_name":"Green Valley March 2017","match_date":"2017-03-25","stage_classifiercode":"06-10","member_number":"\"\"","first_name":"JAYDEN","last_name":"BENNETT","classification":"U","division":"OPEN","hit_factor":4.3541},{"match_name":"PMSC USPSA JULY 2018","match_date":"2018-07-01","stage_classifiercode":"06-10","member_number":"TY93980","first_name":"KEN","last_name":"LALIBERTE","classification":"B","division":"OPEN","hit_factor":4.3478},{"match_name":"CIPSC Havana May USPSA","match_date":"2018-05-12","stage_classifiercode":"06-10","member_number":"A99127","first_name":"STEVE","last_name":"FRAZIER","classification":"U","division":"OPEN","hit_factor":4.3415340086831},{"match_name":"ESPS USPSA July 2017","match_date":"2017-07-22","stage_classifiercode":"06-10","member_number":"A82596","first_name":"MIKE","last_name":"KNORR","classification":"C","division":"OPEN","hit_factor":4.3415},{"match_name":"OKCGC USPSA October 2018","match_date":"2018-10-06","stage_classifiercode":"06-10","member_number":"A74860","first_name":"CHUCK","last_name":"HYDE","classification":"C","division":"OPEN","hit_factor":4.3415},{"match_name":"Shoot GTR USPSA June 7","match_date":"2016-06-07","stage_classifiercode":"06-10","member_number":"TY53290","first_name":"KENT","last_name":"CORI","classification":"A","division":"OPEN","hit_factor":4.3353},{"match_name":"PCWC USPSA  9 26 2020","match_date":"2020-09-26","stage_classifiercode":"06-10","member_number":"A31378","first_name":"BOB","last_name":"CHERRY","classification":"B","division":"OPEN","hit_factor":4.3353},{"match_name":"GRB USPSA Sept @ CAV","match_date":"2015-09-19","stage_classifiercode":"06-10","member_number":"A38495","first_name":"SCOT","last_name":"COOK","classification":"C","division":"OPEN","hit_factor":4.3353},{"match_name":"EHPSA USPSA 27June 2021","match_date":"2021-06-27","stage_classifiercode":"06-10","member_number":"TY99321","first_name":"CLIFF","last_name":"PINSENT","classification":"C","division":"OPEN","hit_factor":4.3228},{"match_name":"FLPSA MN14 USPSA April 26 2018","match_date":"2018-04-26","stage_classifiercode":"06-10","member_number":"TY87600","first_name":"KHAI","last_name":"TRAN","classification":"U","division":"OPEN","hit_factor":4.3228},{"match_name":"Ontelaunee USPSA September 2016","match_date":"2016-09-24","stage_classifiercode":"06-10","member_number":"A30857","first_name":"GIANLUIGI","last_name":"VALERI","classification":"B","division":"OPEN","hit_factor":4.3165},{"match_name":"Shasta Shooters 2021 Feb","match_date":"2021-02-13","stage_classifiercode":"06-10","member_number":"A116178","first_name":"\"ALLEN \"\"SMASH\"\"\"","last_name":"PATCHETT","classification":"B","division":"OPEN","hit_factor":4.3165},{"match_name":"Mvpsa Fall Week 2 ","match_date":"2016-08-17","stage_classifiercode":"06-10","member_number":"\"\"","first_name":"JUSTIN","last_name":"HOPKINS","classification":"\"\"","division":"OPEN","hit_factor":4.3165},{"match_name":"Eagles Nest July 30th","match_date":"2017-07-30","stage_classifiercode":"06-10","member_number":"\"\"","first_name":"ROB","last_name":"BROWN","classification":"X","division":"OPEN","hit_factor":4.3103},{"match_name":"Hampden RPC May USPSA","match_date":"2016-05-01","stage_classifiercode":"06-10","member_number":"A69081","first_name":"ROGER","last_name":"GOODE","classification":"C","division":"OPEN","hit_factor":4.3042},{"match_name":"Collin County USPSA 11-28-2021","match_date":"2021-11-28","stage_classifiercode":"06-10","member_number":"A58583","first_name":"GLENN","last_name":"GANAC","classification":"A","division":"OPEN","hit_factor":4.3042},{"match_name":"CAPS 8-28-2021","match_date":"2021-08-28","stage_classifiercode":"06-10","member_number":"FY129778","first_name":"EMILY","last_name":"HUGHSTON","classification":"C","division":"OPEN","hit_factor":4.3042},{"match_name":"GRB USPSA Sept @ CAV","match_date":"2015-09-19","stage_classifiercode":"06-10","member_number":"\"\"","first_name":"MIKE","last_name":"KACZMAR","classification":"U","division":"OPEN","hit_factor":4.3042},{"match_name":"Richmond Boro Gun Club October 2017","match_date":"2017-10-21","stage_classifiercode":"06-10","member_number":"TY91913","first_name":"LANCE","last_name":"COLLO","classification":"\"\"","division":"OPEN","hit_factor":4.298},{"match_name":"MCAS June 2018 USPSA Match","match_date":"2018-06-30","stage_classifiercode":"06-10","member_number":"A110107","first_name":"JEREMY","last_name":"CHVILICEK","classification":"Unclassified","division":"OPEN","hit_factor":4.298},{"match_name":"RangeMasters 1-28-2016","match_date":"2016-01-28","stage_classifiercode":"06-10","member_number":"A33941","first_name":"JACK","last_name":"HERSHBERGER","classification":"A","division":"OPEN","hit_factor":4.2918},{"match_name":"Space Coast Practical Shooters","match_date":"2018-06-02","stage_classifiercode":"06-10","member_number":"A97382","first_name":"BRYAN","last_name":"WILMOT","classification":"B","division":"OPEN","hit_factor":4.2918},{"match_name":"RangeMasters 9-7-2017","match_date":"2017-09-07","stage_classifiercode":"06-10","member_number":"\"\"","first_name":"KEITH","last_name":"CRUSE","classification":"U","division":"OPEN","hit_factor":4.2857},{"match_name":"OREGON ARPC CC05 USPSA JUNE 10 2017","match_date":"2017-06-10","stage_classifiercode":"06-10","member_number":"L3676","first_name":"BILL","last_name":"LOUIS","classification":"D","division":"OPEN","hit_factor":4.2796},{"match_name":"HRRB 12-01-2018","match_date":"2018-12-01","stage_classifiercode":"06-10","member_number":"FY87328","first_name":"JIMRIZ","last_name":"ANCHETA","classification":"U","division":"OPEN","hit_factor":4.2735},{"match_name":"WSPS OCTOBER 2018 USPSA MATCH","match_date":"2018-10-20","stage_classifiercode":"06-10","member_number":"TY49476","first_name":"NORM","last_name":"DIFFENDERFER","classification":"U","division":"OPEN","hit_factor":4.2735},{"match_name":"GCL December 5-2020","match_date":"2020-12-05","stage_classifiercode":"06-10","member_number":"FY105696","first_name":"STUART","last_name":"WEAVER","classification":"B","division":"OPEN","hit_factor":4.2735},{"match_name":"SWGC USPSA Pistol Match - March 2020","match_date":"2020-03-07","stage_classifiercode":"06-10","member_number":"TY95749","first_name":"PAYTON","last_name":"SAUTER","classification":"B","division":"OPEN","hit_factor":4.2735},{"match_name":"SWGC USPSA Pistol Match - December 2018","match_date":"2018-12-01","stage_classifiercode":"06-10","member_number":"TY92384","first_name":"JOSEPH","last_name":"TURNER","classification":"U","division":"OPEN","hit_factor":4.2674},{"match_name":"Springfield Tactical Shooters 02/04/2021","match_date":"2021-02-04","stage_classifiercode":"06-10","member_number":"\"\"","first_name":"JON","last_name":"PURVIANCE","classification":"\"\"","division":"OPEN","hit_factor":4.2614},{"match_name":"BORCC USPSA June 2017","match_date":"2017-06-25","stage_classifiercode":"06-10","member_number":"A90859","first_name":"TERRY","last_name":"FLOWERS","classification":"C","division":"OPEN","hit_factor":4.2553},{"match_name":"CRC / SVPS June USPSA","match_date":"2020-06-12","stage_classifiercode":"06-10","member_number":"TY46397","first_name":"TIMOTHY","last_name":"MCSHEEHY","classification":"C","division":"OPEN","hit_factor":4.2553},{"match_name":"2020-03-07 USPSA at Phoenix Rod and Gun Club","match_date":"2020-03-07","stage_classifiercode":"06-10","member_number":"A2576","first_name":"BOB","last_name":"BORDER","classification":"C","division":"OPEN","hit_factor":4.2493},{"match_name":"MASTER BLASTERS & SSFGA USPSA - September","match_date":"2021-09-18","stage_classifiercode":"06-10","member_number":"ty125068","first_name":"MARK","last_name":"QUEIROS","classification":"C","division":"OPEN","hit_factor":4.2493},{"match_name":"Grandbaggers December 2017","match_date":"2017-12-07","stage_classifiercode":"06-10","member_number":"A103229","first_name":"STEPHANIE","last_name":"THOME","classification":"D","division":"OPEN","hit_factor":4.2493},{"match_name":"MVPSA USPSA 12-01-18","match_date":"2018-12-01","stage_classifiercode":"06-10","member_number":"A114793","first_name":"CODY","last_name":"CUNNINGHAM","classification":"C","division":"OPEN","hit_factor":4.2433},{"match_name":"Colonial Rifle And Pistol Club Novermer Match","match_date":"2018-11-03","stage_classifiercode":"06-10","member_number":"A105434","first_name":"FRED","last_name":"LAFEMINA","classification":"D","division":"OPEN","hit_factor":4.2373},{"match_name":"Quantico QPS QSC USPSA Match 9 APR 2017","match_date":"2017-04-09","stage_classifiercode":"06-10","member_number":"L3535","first_name":"TAK","last_name":"ONG","classification":"U","division":"OPEN","hit_factor":4.2373},{"match_name":"LdF USPSA Match May 27 2017","match_date":"2017-05-27","stage_classifiercode":"06-10","member_number":"A59678","first_name":"MILO","last_name":"SANTOS","classification":"A","division":"OPEN","hit_factor":4.2373},{"match_name":"APSC USPSA Match 10-07-17","match_date":"2017-10-07","stage_classifiercode":"06-10","member_number":"A34650","first_name":"BRUCE","last_name":"BRITAIN","classification":"B","division":"OPEN","hit_factor":4.2373},{"match_name":"Springfield Tactical Shooters 02/04/2021","match_date":"2021-02-04","stage_classifiercode":"06-10","member_number":"FY95946","first_name":"PAUL","last_name":"EMERY","classification":"B","division":"OPEN","hit_factor":4.2313},{"match_name":"CPS USPSA May 2017","match_date":"2017-05-06","stage_classifiercode":"06-10","member_number":"ty86587","first_name":"STEVE","last_name":"PETERS","classification":"C","division":"OPEN","hit_factor":4.2254},{"match_name":"BGSL First Sunday Match","match_date":"2016-06-05","stage_classifiercode":"06-10","member_number":"A81586","first_name":"LARRY","last_name":"BAKER","classification":"U","division":"OPEN","hit_factor":4.2194},{"match_name":"ESPS USPSA July 2017","match_date":"2017-07-22","stage_classifiercode":"06-10","member_number":"FY56443","first_name":"ART","last_name":"LEE","classification":"C","division":"OPEN","hit_factor":4.2135},{"match_name":"Sage USPSA June 17 2018","match_date":"2018-06-17","stage_classifiercode":"06-10","member_number":"A107066","first_name":"STEVE","last_name":"SVEJDA","classification":"U","division":"OPEN","hit_factor":4.2135},{"match_name":"Springfield Tactical Shooters 12-3-15","match_date":"2015-12-03","stage_classifiercode":"06-10","member_number":"L2281","first_name":"J","last_name":"GRIFFIN","classification":"A","division":"OPEN","hit_factor":4.2076},{"match_name":"RBGC 2016-10-22","match_date":"2016-10-22","stage_classifiercode":"06-10","member_number":"TY85797","first_name":"GARY","last_name":"WILLIAMS","classification":"C","division":"OPEN","hit_factor":4.2076},{"match_name":"2020-03-07 USPSA at Phoenix Rod and Gun Club","match_date":"2020-03-07","stage_classifiercode":"06-10","member_number":"A100726","first_name":"DOMINIC","last_name":"NAPOLITANO","classification":"B","division":"OPEN","hit_factor":4.2017},{"match_name":"PMSC USPSA JULY 2018","match_date":"2018-07-01","stage_classifiercode":"06-10","member_number":"FY90924","first_name":"SOPHIA","last_name":"SMITH","classification":"C","division":"OPEN","hit_factor":4.2017},{"match_name":"GCL Saturday 3-6-2021","match_date":"2021-03-06","stage_classifiercode":"06-10","member_number":"Ty125632","first_name":"JASON","last_name":"MARKEL","classification":"U","division":"OPEN","hit_factor":4.2017},{"match_name":"TPS USPSA AT CMP OCT 20 2018","match_date":"2018-10-20","stage_classifiercode":"06-10","member_number":"L2723","first_name":"ROBERT","last_name":"ADAMS","classification":"B","division":"OPEN","hit_factor":4.1958},{"match_name":"Salt City practical shooting league 'all classifier match'","match_date":"2020-08-30","stage_classifiercode":"06-10","member_number":"A129492","first_name":"LISA","last_name":"SUPON","classification":"\"\"","division":"OPEN","hit_factor":4.1899},{"match_name":"HRRB 12-01-2018","match_date":"2018-12-01","stage_classifiercode":"06-10","member_number":"B33","first_name":"ROBERT","last_name":"NIERENBERG","classification":"A","division":"OPEN","hit_factor":4.1899},{"match_name":"EAGC March 2021 USPSA Pistol Match","match_date":"2021-03-21","stage_classifiercode":"06-10","member_number":"FY28307","first_name":"DAN","last_name":"MITCHELL","classification":"M","division":"OPEN","hit_factor":4.1899},{"match_name":"MCAS June 2018 USPSA Match","match_date":"2018-06-30","stage_classifiercode":"06-10","member_number":"A81166","first_name":"KEVIN","last_name":"CARPENTER","classification":"C","division":"OPEN","hit_factor":4.1841},{"match_name":"WVPPS October 2015","match_date":"2015-10-18","stage_classifiercode":"06-10","member_number":"A81684","first_name":"CHLOE","last_name":"KOUTSOUMPAS","classification":"C","division":"OPEN","hit_factor":4.1783},{"match_name":"December 2017 CAS USPSA","match_date":"2017-12-03","stage_classifiercode":"06-10","member_number":"A92067","first_name":"DON","last_name":"ALBARES","classification":"C","division":"OPEN","hit_factor":4.1725},{"match_name":"AGC_20170507","match_date":"2017-05-07","stage_classifiercode":"06-10","member_number":"\"\"","first_name":"GARRETT","last_name":"MCKIERNAN","classification":"U","division":"OPEN","hit_factor":4.1725},{"match_name":"CCPL - June 2021","match_date":"2021-06-19","stage_classifiercode":"06-10","member_number":"TY84357","first_name":"RAY","last_name":"DONCH","classification":"B","division":"OPEN","hit_factor":4.1667},{"match_name":"Richmond March 6-2015 USPSA Pistol Match","match_date":"2016-03-06","stage_classifiercode":"06-10","member_number":"Ty80794","first_name":"ALAIN","last_name":"RAMIREZ","classification":"C","division":"OPEN","hit_factor":4.1667},{"match_name":"SFPS 05-15-2016 SuperClassifier - Second Division","match_date":"2016-05-15","stage_classifiercode":"06-10","member_number":"A82205","first_name":"DALE","last_name":"CLELLAND","classification":"U","division":"OPEN","hit_factor":4.1551},{"match_name":"Collin County USPSA 11-28-2021","match_date":"2021-11-28","stage_classifiercode":"06-10","member_number":"TY71602","first_name":"GREG","last_name":"KINDL","classification":"C","division":"OPEN","hit_factor":4.1551},{"match_name":"SAPS Match 3/20/2021","match_date":"2021-03-20","stage_classifiercode":"06-10","member_number":"Ty47022","first_name":"BRUCE","last_name":"WOOD","classification":"A","division":"OPEN","hit_factor":4.1494},{"match_name":"Ontelaunee USPSA September 2016","match_date":"2016-09-24","stage_classifiercode":"06-10","member_number":"\"\"","first_name":"DAVID","last_name":"FIGLER","classification":"U","division":"OPEN","hit_factor":4.1379},{"match_name":"DAP December 2015 Classifier match","match_date":"2015-12-12","stage_classifiercode":"06-10","member_number":"TY81715","first_name":"ARNEL","last_name":"BAGGAO","classification":"U","division":"OPEN","hit_factor":4.1379},{"match_name":"Eagles Nest July 30th","match_date":"2017-07-30","stage_classifiercode":"06-10","member_number":"A99541","first_name":"WADE","last_name":"SHANER","classification":"U","division":"OPEN","hit_factor":4.1322},{"match_name":"CCPL - June 2021","match_date":"2021-06-19","stage_classifiercode":"06-10","member_number":"TY85868","first_name":"SHELDON","last_name":"KATZ","classification":"B","division":"OPEN","hit_factor":4.1265},{"match_name":"Hopkinton August 2016 ","match_date":"2016-08-06","stage_classifiercode":"06-10","member_number":"A93513","first_name":"MICHAEL","last_name":"KANE","classification":"U","division":"OPEN","hit_factor":4.1152},{"match_name":"MPSA 2020-01-02","match_date":"2021-01-02","stage_classifiercode":"06-10","member_number":"L4195","first_name":"THOMAS","last_name":"HEARD","classification":"C","division":"OPEN","hit_factor":4.1096},{"match_name":"Hampden RPC May USPSA","match_date":"2016-05-01","stage_classifiercode":"06-10","member_number":"A49110","first_name":"SHANE","last_name":"AUBUCHON","classification":"B","division":"OPEN","hit_factor":4.1096},{"match_name":"TPS USPSA -  August 2017 - Talon Range","match_date":"2017-08-05","stage_classifiercode":"06-10","member_number":"A35057","first_name":"DAN","last_name":"EDMUNDS","classification":"U","division":"OPEN","hit_factor":4.1096},{"match_name":"Ripon USPSA 7-22-17","match_date":"2017-07-22","stage_classifiercode":"06-10","member_number":"A99422","first_name":"CORY","last_name":"TUCHSCHERER","classification":"C","division":"OPEN","hit_factor":4.104},{"match_name":"GCL Saturday 3-6-2021","match_date":"2021-03-06","stage_classifiercode":"06-10","member_number":"A114897","first_name":"SCOTT","last_name":"TURCOTTE","classification":"D","division":"OPEN","hit_factor":4.0928},{"match_name":"MCAS June 2018 USPSA Match","match_date":"2018-06-30","stage_classifiercode":"06-10","member_number":"A102797","first_name":"ASHLEY","last_name":"BELL","classification":"Unclassified","division":"OPEN","hit_factor":4.0872},{"match_name":"SPSA USPSA March 4th Sat match","match_date":"2021-03-27","stage_classifiercode":"06-10","member_number":"L4170","first_name":"STEVE","last_name":"COX","classification":"C","division":"OPEN","hit_factor":4.0816},{"match_name":"CCPL 12112016","match_date":"2016-12-11","stage_classifiercode":"06-10","member_number":"A72602","first_name":"STEVE","last_name":"MURRAY","classification":"B","division":"OPEN","hit_factor":4.0761},{"match_name":"Oregon ARPC November Match","match_date":"2015-11-14","stage_classifiercode":"06-10","member_number":"TY34264","first_name":"GARY","last_name":"FISH","classification":"B","division":"OPEN","hit_factor":4.0706},{"match_name":"LdF USPSA Match May 27 2017","match_date":"2017-05-27","stage_classifiercode":"06-10","member_number":"L3347","first_name":"GLENN","last_name":"SEKI","classification":"A","division":"OPEN","hit_factor":4.0706},{"match_name":"Gem City Gun Club 4-7 and 4-8-18","match_date":"2018-04-07","stage_classifiercode":"06-10","member_number":"A85868","first_name":"SHELDON","last_name":"KATZ","classification":"D","division":"OPEN","hit_factor":4.065},{"match_name":"Ontelaunee USPSA September 2016","match_date":"2016-09-24","stage_classifiercode":"06-10","member_number":"TY70694","first_name":"ALEX","last_name":"SALAZAR","classification":"B","division":"OPEN","hit_factor":4.0595},{"match_name":"TPS USPSA AT CMP OCT 20 2018","match_date":"2018-10-20","stage_classifiercode":"06-10","member_number":"A94603","first_name":"RONALDO","last_name":"BORGES","classification":"B","division":"OPEN","hit_factor":4.0595},{"match_name":"SPSA USPSA March 4th Sat match","match_date":"2021-03-27","stage_classifiercode":"06-10","member_number":"A102564","first_name":"DONALD","last_name":"POWERS","classification":"G","division":"OPEN","hit_factor":4.0595},{"match_name":"Salt City practical shooting league 'all classifier match'","match_date":"2020-08-30","stage_classifiercode":"06-10","member_number":"a104092","first_name":"CALEB","last_name":"BAILEY","classification":"U","division":"OPEN","hit_factor":4.0541},{"match_name":"Richmond Hot Shots July 15-16-2017 USPSA Pistol Match","match_date":"2017-07-15","stage_classifiercode":"06-10","member_number":"A98008","first_name":"JANET","last_name":"TSUI","classification":"C","division":"OPEN","hit_factor":4.0541},{"match_name":"SFPS 05-15-2016 SuperClassifier - First Division","match_date":"2016-05-15","stage_classifiercode":"06-10","member_number":"A91120","first_name":"JASON","last_name":"BENNETT","classification":"U","division":"OPEN","hit_factor":4.0486},{"match_name":"Ontelaunee USPSA September 2016","match_date":"2016-09-24","stage_classifiercode":"06-10","member_number":"\"\"","first_name":"MICHAEL","last_name":"ROMIG","classification":"U","division":"OPEN","hit_factor":4.0431},{"match_name":"FBURG March 2021 Level I USPSA ","match_date":"2021-03-06","stage_classifiercode":"06-10","member_number":"A109831","first_name":"CHRISTINE","last_name":"BRADFORD","classification":"D","division":"OPEN","hit_factor":4.0431},{"match_name":"FBURG March 2021 Level I USPSA ","match_date":"2021-03-06","stage_classifiercode":"06-10","member_number":"A91691","first_name":"ENOCH","last_name":"YANG","classification":"B","division":"OPEN","hit_factor":4.0214},{"match_name":"Richmond hotshots April 16-17 2016 USPSA Pistol match","match_date":"2016-04-16","stage_classifiercode":"06-10","member_number":"A86599","first_name":"SEAN PATRICK","last_name":"AGUAS","classification":"B","division":"OPEN","hit_factor":4.0214},{"match_name":"Shongum October 2017 Match","match_date":"2017-10-07","stage_classifiercode":"06-10","member_number":"A105348","first_name":"ROBERT","last_name":"CURTIS","classification":"U","division":"OPEN","hit_factor":4.0161},{"match_name":"SHONGUM MARCH 2016 PISTOL MATCH","match_date":"2016-03-05","stage_classifiercode":"06-10","member_number":"A89847","first_name":"MICHAEL","last_name":"CONNOLLY","classification":"U","division":"OPEN","hit_factor":4.0161},{"match_name":"LdF USPSA Match May 27 2017","match_date":"2017-05-27","stage_classifiercode":"06-10","member_number":"TY91328","first_name":"ROLANDO","last_name":"ABADA","classification":"D","division":"OPEN","hit_factor":4.0053},{"match_name":"Mvpsa USPSA  April 17","match_date":"2021-04-17","stage_classifiercode":"06-10","member_number":"L4137","first_name":"STEVE","last_name":"PEACOCK","classification":"C","division":"OPEN","hit_factor":3.9947},{"match_name":"December 2017 CAS USPSA","match_date":"2017-12-03","stage_classifiercode":"06-10","member_number":"A93997","first_name":"JIM","last_name":"RAMOIN","classification":"C","division":"OPEN","hit_factor":3.9947},{"match_name":"WTPS USPSA September Match 9-9-17","match_date":"2017-09-09","stage_classifiercode":"06-10","member_number":"A101801","first_name":"JEREMY","last_name":"SERVANTEZ","classification":"U","division":"OPEN","hit_factor":3.9947},{"match_name":"OSC April USPSA","match_date":"2021-04-18","stage_classifiercode":"06-10","member_number":"Ty100498","first_name":"SAMANTHA","last_name":"TUCHSCHERER","classification":"C","division":"OPEN","hit_factor":3.9894},{"match_name":"HRRB 12-01-2018","match_date":"2018-12-01","stage_classifiercode":"06-10","member_number":"A113332","first_name":"MARIA","last_name":"DUMBRIQUE","classification":"C","division":"OPEN","hit_factor":3.9841},{"match_name":"ISPS JULY 2nd 2016","match_date":"2016-07-02","stage_classifiercode":"06-10","member_number":"FY80359","first_name":"JD","last_name":"MCCORD","classification":"C","division":"OPEN","hit_factor":3.9788},{"match_name":"NISA April 2017 - Classifier","match_date":"2017-04-23","stage_classifiercode":"06-10","member_number":"A100840","first_name":"JONAH","last_name":"BUCKLEY","classification":"U","division":"OPEN","hit_factor":3.9788},{"match_name":"OFGC USPSA Match Oct 16","match_date":"2016-10-16","stage_classifiercode":"06-10","member_number":"TY69238","first_name":"TONY","last_name":"WALL","classification":"B","division":"OPEN","hit_factor":3.9683},{"match_name":"SLPSA Jan USPSA match 1","match_date":"2020-01-11","stage_classifiercode":"06-10","member_number":"A123987","first_name":"JON","last_name":"TEA","classification":"U","division":"OPEN","hit_factor":3.9683},{"match_name":"WSPS JUNE 2017 USPSA MATCH","match_date":"2017-06-17","stage_classifiercode":"06-10","member_number":"TY69953","first_name":"COLIN","last_name":"WYNNE","classification":"U","division":"OPEN","hit_factor":3.963},{"match_name":"HPS Hot Summer Fun Club Match","match_date":"2017-07-22","stage_classifiercode":"06-10","member_number":"FY49431","first_name":"APOLONIO","last_name":"DULATRE","classification":"A","division":"OPEN","hit_factor":3.963},{"match_name":"OFGC USPSA Match Oct 16","match_date":"2016-10-16","stage_classifiercode":"06-10","member_number":"TY50326","first_name":"ROB","last_name":"ELSTON","classification":"B","division":"OPEN","hit_factor":3.963},{"match_name":"FLPSA MN14 USPSA April 26 2018","match_date":"2018-04-26","stage_classifiercode":"06-10","member_number":"A-105972","first_name":"BEN","last_name":"MOORE","classification":"B","division":"OPEN","hit_factor":3.963},{"match_name":"Ontelaunee USPSA September 2016","match_date":"2016-09-24","stage_classifiercode":"06-10","member_number":"TY77141","first_name":"KEN (LOUIE)","last_name":"PRIMERO","classification":"U","division":"OPEN","hit_factor":3.9578},{"match_name":"YRPA  9/25/16  USPSA Pistol Match","match_date":"2016-09-23","stage_classifiercode":"06-10","member_number":"A61656","first_name":"BOB","last_name":"HAWKS","classification":"D","division":"OPEN","hit_factor":3.9578},{"match_name":"NW01 9-20-16","match_date":"2016-09-20","stage_classifiercode":"06-10","member_number":"a88243","first_name":"KRIS","last_name":"MCGAUGHEY","classification":"C","division":"OPEN","hit_factor":3.9578},{"match_name":"CFRPC November USPSA","match_date":"2018-11-18","stage_classifiercode":"06-10","member_number":"A112161","first_name":"FRED","last_name":"GATES","classification":"U","division":"OPEN","hit_factor":3.9578},{"match_name":"Richmond Boro Gun Club October 2017","match_date":"2017-10-21","stage_classifiercode":"06-10","member_number":"A105434","first_name":"FRED","last_name":"LAFEMINA","classification":"\"\"","division":"OPEN","hit_factor":3.9563},{"match_name":"HPS Hot Summer Fun Club Match","match_date":"2017-07-22","stage_classifiercode":"06-10","member_number":"TY67177","first_name":"EDGAR","last_name":"CARAANG","classification":"C","division":"OPEN","hit_factor":3.9526},{"match_name":"HPS Hot Summer Fun Club Match","match_date":"2017-07-22","stage_classifiercode":"06-10","member_number":"TY88006","first_name":"BOBBY","last_name":"REGALARIO","classification":"D","division":"OPEN","hit_factor":3.9474},{"match_name":"Southkent USPSA MAY match","match_date":"2017-05-20","stage_classifiercode":"06-10","member_number":"\"\"","first_name":"GEOFF","last_name":"DEVRIES","classification":"U","division":"OPEN","hit_factor":3.9422},{"match_name":"Custer Uspsa December","match_date":"2018-12-02","stage_classifiercode":"06-10","member_number":"L4252","first_name":"GALE","last_name":"BREITKREUTZ","classification":"C","division":"OPEN","hit_factor":3.9318},{"match_name":"SMPS March 2016","match_date":"2016-03-13","stage_classifiercode":"06-10","member_number":"A81062","first_name":"MICHAEL","last_name":"ENNIS","classification":"M","division":"OPEN","hit_factor":3.9318},{"match_name":"GCL December 5-2020","match_date":"2020-12-05","stage_classifiercode":"06-10","member_number":"A103919","first_name":"JUSTIN","last_name":"HENDERSON","classification":"B","division":"OPEN","hit_factor":3.9267},{"match_name":"CFRPC November USPSA","match_date":"2018-11-18","stage_classifiercode":"06-10","member_number":"NA","first_name":"ROBERT","last_name":"KECHEJIAN","classification":"U","division":"OPEN","hit_factor":3.9267},{"match_name":"Richmond hotshots April 16-17 2016 USPSA Pistol match","match_date":"2016-04-16","stage_classifiercode":"06-10","member_number":"a80595","first_name":"EDGAR","last_name":"ALLAS","classification":"C","division":"OPEN","hit_factor":3.9267},{"match_name":"NNRPA USPSA July 2018","match_date":"2018-07-28","stage_classifiercode":"06-10","member_number":"TY51797","first_name":"DENNIS","last_name":"MARSH","classification":"D","division":"OPEN","hit_factor":3.9216},{"match_name":"2020-03-07 USPSA at Phoenix Rod and Gun Club","match_date":"2020-03-07","stage_classifiercode":"06-10","member_number":"A113530","first_name":"SILAS","last_name":"RASH","classification":"D","division":"OPEN","hit_factor":3.9216},{"match_name":"HPSP Heartland Practical Shooters October 2015 USPSA Handgun Shoot","match_date":"2015-10-25","stage_classifiercode":"06-10","member_number":"PEN","first_name":"TAYLOR","last_name":"SMITH","classification":"Unclassified","division":"OPEN","hit_factor":3.9164},{"match_name":"RangeMasters 1-28-2016","match_date":"2016-01-28","stage_classifiercode":"06-10","member_number":"\"\"","first_name":"BOB","last_name":"ZWECK","classification":"U","division":"OPEN","hit_factor":3.9113},{"match_name":"Eagles Nest July 30th","match_date":"2017-07-30","stage_classifiercode":"06-10","member_number":"FY90924","first_name":"SOPHIA","last_name":"SMITH","classification":"C","division":"OPEN","hit_factor":3.9012},{"match_name":"CGGR May USPSA Match","match_date":"2017-05-20","stage_classifiercode":"06-10","member_number":"A101087","first_name":"ZACHARY","last_name":"STAFFORD","classification":"U","division":"OPEN","hit_factor":3.9012},{"match_name":"Deadwood Boys USPSA All Classifier Match - 29 July 2018","match_date":"2018-07-29","stage_classifiercode":"06-10","member_number":"TY50983","first_name":"HERMAN","last_name":"BAUTISTA","classification":"D","division":"OPEN","hit_factor":3.8961},{"match_name":"CCPL 12112016","match_date":"2016-12-11","stage_classifiercode":"06-10","member_number":"\"\"","first_name":"JOE","last_name":"NISHIMOTO","classification":"U","division":"OPEN","hit_factor":3.8961},{"match_name":"GAS July 2020 USPSA Classifier Match","match_date":"2020-07-04","stage_classifiercode":"06-10","member_number":"TY23538","first_name":"BRYAN","last_name":"GILLETTE","classification":"M","division":"OPEN","hit_factor":3.8961},{"match_name":"Rankin Field Sunday USPSA","match_date":"2018-10-21","stage_classifiercode":"06-10","member_number":"\"\"","first_name":"JEFFERSON","last_name":"CAMARCE","classification":"U","division":"OPEN","hit_factor":3.8911},{"match_name":"WELD ECO09 20180617","match_date":"2018-06-17","stage_classifiercode":"06-10","member_number":"A84025","first_name":"ROBERT (BOB)","last_name":"MARKHAM","classification":"C","division":"OPEN","hit_factor":3.886},{"match_name":"Gem City Gun Club 4-2-16  and 4-3-16","match_date":"2016-04-02","stage_classifiercode":"06-10","member_number":"A7695","first_name":"ANDREW","last_name":"DIBARTOLOMEO","classification":"C","division":"OPEN","hit_factor":3.886},{"match_name":"AGC_20160403","match_date":"2016-04-03","stage_classifiercode":"06-10","member_number":"TY18366","first_name":"RICK","last_name":"HEBERT","classification":"M","division":"OPEN","hit_factor":3.886},{"match_name":"WPS USPSA Monthly Match May 2016","match_date":"2016-05-07","stage_classifiercode":"06-10","member_number":"TY29046","first_name":"DEAN","last_name":"BROWN","classification":"B","division":"OPEN","hit_factor":3.881},{"match_name":"TAP USPSA February 28 2016 (28Feb16-01:01:53)","match_date":"2016-02-28","stage_classifiercode":"06-10","member_number":"A83501","first_name":"OLIVER","last_name":"PASUELO","classification":"U","division":"OPEN","hit_factor":3.871},{"match_name":"Monson April 2017 USPSA","match_date":"2017-04-23","stage_classifiercode":"06-10","member_number":"TY65772","first_name":"STEVE","last_name":"PICHE","classification":"M","division":"OPEN","hit_factor":3.861},{"match_name":"December 2017 CAS USPSA","match_date":"2017-12-03","stage_classifiercode":"06-10","member_number":"A43937","first_name":"ROBERT","last_name":"BRENNAN","classification":"C","division":"OPEN","hit_factor":3.8412},{"match_name":"CGGR May USPSA Match","match_date":"2017-05-20","stage_classifiercode":"06-10","member_number":"A90156","first_name":"STEVE","last_name":"EVERETT","classification":"U","division":"OPEN","hit_factor":3.8265},{"match_name":"Ripon USPSA 9-22-18","match_date":"2018-09-22","stage_classifiercode":"06-10","member_number":"L4481","first_name":"OUSMANE","last_name":"DIALLO","classification":"B","division":"OPEN","hit_factor":3.8217},{"match_name":"Harvard Action Shooters August 2016 USPSA Pistol","match_date":"2016-08-14","stage_classifiercode":"06-10","member_number":"A36777","first_name":"GREG","last_name":"STUDLEY","classification":"B","division":"OPEN","hit_factor":3.8217},{"match_name":"SAPSA May 2016","match_date":"2016-05-21","stage_classifiercode":"06-10","member_number":"TY73281","first_name":"JACK","last_name":"DARTIGALONGUE","classification":"C","division":"OPEN","hit_factor":3.8168},{"match_name":"RBGC 2016-10-22","match_date":"2016-10-22","stage_classifiercode":"06-10","member_number":"A94721","first_name":"BOB","last_name":"MCCOLL","classification":"D","division":"OPEN","hit_factor":3.8168},{"match_name":"WVPPS October 2015","match_date":"2015-10-18","stage_classifiercode":"06-10","member_number":"TY69656","first_name":"JEFF","last_name":"STRAUCH","classification":"C","division":"OPEN","hit_factor":3.8168},{"match_name":"Quantico QPS QSC USPSA Match 9 APR 2017","match_date":"2017-04-09","stage_classifiercode":"06-10","member_number":"\"\"","first_name":"RUSSELL","last_name":"FORTNEY","classification":"M","division":"OPEN","hit_factor":3.8119},{"match_name":"Sage Pistol League USPSA May 16 2021","match_date":"2021-05-16","stage_classifiercode":"06-10","member_number":"Ty29486","first_name":"KEVIN","last_name":"KING","classification":"B","division":"OPEN","hit_factor":3.8119},{"match_name":"Colonial Rifle And Pistol Club Novermer Match","match_date":"2018-11-03","stage_classifiercode":"06-10","member_number":"A109304","first_name":"ROBERT","last_name":"AGOGLIA","classification":"D","division":"OPEN","hit_factor":3.7879},{"match_name":"HPSP Heartland Practical Shooters October 2015 USPSA Handgun Shoot","match_date":"2015-10-25","stage_classifiercode":"06-10","member_number":"FY65523","first_name":"JEREMY","last_name":"MILLARD","classification":"C","division":"OPEN","hit_factor":3.7831},{"match_name":"Richmond Boro Gun Club October 2017","match_date":"2017-10-21","stage_classifiercode":"06-10","member_number":"TY31444","first_name":"JOSE","last_name":"OCAMPO","classification":"B","division":"OPEN","hit_factor":3.7736},{"match_name":"ENPS May 2016 Classifier Match","match_date":"2016-05-01","stage_classifiercode":"06-10","member_number":"TY46397","first_name":"TIMOTHY","last_name":"MCSHEEHY","classification":"U","division":"OPEN","hit_factor":3.7688},{"match_name":"CBS March USPSA Steel Match","match_date":"2021-03-07","stage_classifiercode":"06-10","member_number":"A98137","first_name":"PHIL","last_name":"UNDERWOOD","classification":"U","division":"OPEN","hit_factor":3.7688},{"match_name":"LBAS 170819","match_date":"2017-08-19","stage_classifiercode":"06-10","member_number":"FY60230","first_name":"ROBERT","last_name":"BALES","classification":"C","division":"OPEN","hit_factor":3.7688},{"match_name":"Gem City Gun Club 4-7 and 4-8-18","match_date":"2018-04-07","stage_classifiercode":"06-10","member_number":"A106514","first_name":"BRIAN","last_name":"WADDINGTON","classification":"U","division":"OPEN","hit_factor":3.7641},{"match_name":"APSC USPSA Match 10-07-17","match_date":"2017-10-07","stage_classifiercode":"06-10","member_number":"TY63497","first_name":"STEVE","last_name":"SCHUMACHER","classification":"B","division":"OPEN","hit_factor":3.7641},{"match_name":"FLPSA MN14 USPSA April 26 2018","match_date":"2018-04-26","stage_classifiercode":"06-10","member_number":"FY51432","first_name":"FRANK","last_name":"SKOG","classification":"U","division":"OPEN","hit_factor":3.7641},{"match_name":"Shoot GTR USPSA 12/13","match_date":"2016-12-13","stage_classifiercode":"06-10","member_number":"A88497","first_name":"RONDRE","last_name":"BALUYOT","classification":"U","division":"OPEN","hit_factor":3.7641},{"match_name":"WGC WI USPSA Monthly Match 10-21-17","match_date":"2017-10-21","stage_classifiercode":"06-10","member_number":"TY54308","first_name":"GLEN","last_name":"BICKING","classification":"B","division":"OPEN","hit_factor":3.7594},{"match_name":"WVPPS October 2015","match_date":"2015-10-18","stage_classifiercode":"06-10","member_number":"TY70204","first_name":"DAN","last_name":"IRELAND","classification":"C","division":"OPEN","hit_factor":3.7594},{"match_name":"Colonial Rifle And Pistol Club Novermer Match","match_date":"2018-11-03","stage_classifiercode":"06-10","member_number":"A109293","first_name":"DANNY","last_name":"LEE","classification":"D","division":"OPEN","hit_factor":3.75},{"match_name":"LCSA USPSA May 2017","match_date":"2017-05-13","stage_classifiercode":"06-10","member_number":"A99541","first_name":"WADE","last_name":"SHANER","classification":"U","division":"OPEN","hit_factor":3.7313},{"match_name":"MS06 Team Magnolia USPSA November Match","match_date":"2016-11-06","stage_classifiercode":"06-10","member_number":"TY82660","first_name":"GERALD","last_name":"PATCH","classification":"C","division":"OPEN","hit_factor":3.7083},{"match_name":"AGC_20160403","match_date":"2016-04-03","stage_classifiercode":"06-10","member_number":"TY81999","first_name":"JOHN","last_name":"ADAMS","classification":"U","division":"OPEN","hit_factor":3.7037},{"match_name":"AGC_20160403","match_date":"2016-04-03","stage_classifiercode":"06-10","member_number":"L3985","first_name":"FRANK","last_name":"JOHNSON","classification":"C","division":"OPEN","hit_factor":3.7037},{"match_name":"Hopkinton August 2016 ","match_date":"2016-08-06","stage_classifiercode":"06-10","member_number":"A36777","first_name":"GREGORY","last_name":"STUDLEY","classification":"B","division":"OPEN","hit_factor":3.7037},{"match_name":"FBURG June 2017 Level I USPSA ","match_date":"2017-06-03","stage_classifiercode":"06-10","member_number":"L3535","first_name":"TAK","last_name":"ONG","classification":"U","division":"OPEN","hit_factor":3.6855},{"match_name":"Pima Pistol Club October 9th USPSA w\\Classifier","match_date":"2016-10-09","stage_classifiercode":"06-10","member_number":"TY74063","first_name":"DOUG","last_name":"HATFIELD","classification":"C","division":"OPEN","hit_factor":3.6855},{"match_name":"RangeMasters 9-7-2017","match_date":"2017-09-07","stage_classifiercode":"06-10","member_number":"L3738","first_name":"JAY","last_name":"OLMSTEAD","classification":"C","division":"OPEN","hit_factor":3.6765},{"match_name":"LCSC Linden USPSA 061018","match_date":"2018-06-10","stage_classifiercode":"06-10","member_number":"TY87650","first_name":"ALEX","last_name":"GOETZE","classification":"C","division":"OPEN","hit_factor":3.6675},{"match_name":"Richmond Hot Shots September 1st-2nd 2018 USPSA Pistol Match","match_date":"2018-09-01","stage_classifiercode":"06-10","member_number":"A82754","first_name":"JONATHON","last_name":"AURIGUI","classification":"D","division":"OPEN","hit_factor":3.6585},{"match_name":"Shoot GTR USPSA 12/13","match_date":"2016-12-13","stage_classifiercode":"06-10","member_number":"A98681","first_name":"JASON","last_name":"PERCY","classification":"U","division":"OPEN","hit_factor":3.6585},{"match_name":"PMSC USPSA JULY 2018","match_date":"2018-07-01","stage_classifiercode":"06-10","member_number":"A101973","first_name":"CLAY","last_name":"SHERLOCK","classification":"C","division":"OPEN","hit_factor":3.6541},{"match_name":"Space Coast Practical Shooters","match_date":"2018-06-02","stage_classifiercode":"06-10","member_number":"Ty89423","first_name":"MARCUS","last_name":"COSTA","classification":"A","division":"OPEN","hit_factor":3.6496},{"match_name":"April 2017 OPSC USPSA","match_date":"2017-04-09","stage_classifiercode":"06-10","member_number":"A99920","first_name":"FREDDY","last_name":"LADORES","classification":"D","division":"OPEN","hit_factor":3.6452},{"match_name":"RangeMasters 1-28-2016","match_date":"2016-01-28","stage_classifiercode":"06-10","member_number":"FY71894","first_name":"NEAL","last_name":"NANDIN","classification":"C","division":"OPEN","hit_factor":3.6408},{"match_name":"EWPSA 2021-08","match_date":"2021-08-15","stage_classifiercode":"06-10","member_number":"L3876","first_name":"JODI","last_name":"HUMANN","classification":"C","division":"OPEN","hit_factor":3.6408},{"match_name":"HOPS USPSA 1020018 ","match_date":"2018-10-19","stage_classifiercode":"06-10","member_number":"A90285","first_name":"CHRIS","last_name":"HOOVER","classification":"B","division":"OPEN","hit_factor":3.6188},{"match_name":"GRPC USPSA DO YOU FEEL LUCKY?","match_date":"2021-03-07","stage_classifiercode":"06-10","member_number":"FY69009","first_name":"TOM","last_name":"DONAHUE","classification":"C","division":"OPEN","hit_factor":3.6188},{"match_name":"ESPS USPSA July 2017","match_date":"2017-07-22","stage_classifiercode":"06-10","member_number":"\"\"","first_name":"MICHAEL","last_name":"GRIER","classification":"U","division":"OPEN","hit_factor":3.6145},{"match_name":"CGGR May USPSA Match","match_date":"2017-05-20","stage_classifiercode":"06-10","member_number":"FY96230","first_name":"DALE","last_name":"COBERLY","classification":"U","division":"OPEN","hit_factor":3.6014},{"match_name":"OSC April USPSA","match_date":"2021-04-18","stage_classifiercode":"06-10","member_number":"Ty99422","first_name":"CORY","last_name":"TUCHSCHERER","classification":"B","division":"OPEN","hit_factor":3.6014},{"match_name":"SEPSA April 2021 Popup Match","match_date":"2021-04-17","stage_classifiercode":"06-10","member_number":"A132794","first_name":"JAMES","last_name":"VANDYKE","classification":"U","division":"OPEN","hit_factor":3.5885},{"match_name":"PMSC USPSA JULY 2018","match_date":"2018-07-01","stage_classifiercode":"06-10","member_number":"L4327","first_name":"RICK","last_name":"KALYN","classification":"B","division":"OPEN","hit_factor":3.58},{"match_name":"2020-03-07 USPSA at Phoenix Rod and Gun Club","match_date":"2020-03-07","stage_classifiercode":"06-10","member_number":"FY74995","first_name":"CHUCK","last_name":"EMERY","classification":"D","division":"OPEN","hit_factor":3.5757},{"match_name":"HPSP Heartland Practical Shooters October 2015 USPSA Handgun Shoot","match_date":"2015-10-25","stage_classifiercode":"06-10","member_number":"A68670","first_name":"STEPHEN","last_name":"HAYES","classification":"C","division":"OPEN","hit_factor":3.5757},{"match_name":"Ripon USPSA 9-22-18","match_date":"2018-09-22","stage_classifiercode":"06-10","member_number":"FY53791","first_name":"MICHAEL","last_name":"OLSON","classification":"B","division":"OPEN","hit_factor":3.5503},{"match_name":"Custer Uspsa December","match_date":"2018-12-02","stage_classifiercode":"06-10","member_number":"TY41784","first_name":"RICK","last_name":"NASLUND","classification":"M","division":"OPEN","hit_factor":3.5419},{"match_name":"ARPC USPSA Match 8-26-18","match_date":"2018-08-26","stage_classifiercode":"06-10","member_number":"A1249","first_name":"JIM","last_name":"COLOMBO","classification":"B","division":"OPEN","hit_factor":3.5419},{"match_name":"OREGON ARPC CC05 USPSA JUNE 10 2017","match_date":"2017-06-10","stage_classifiercode":"06-10","member_number":"FY51479","first_name":"NANCY","last_name":"MARRS","classification":"D","division":"OPEN","hit_factor":3.5377},{"match_name":"HOPS USPSA 081917","match_date":"2017-08-19","stage_classifiercode":"06-10","member_number":"\"\"","first_name":"TRENT","last_name":"SIMPSON","classification":"U","division":"OPEN","hit_factor":3.5336},{"match_name":"SLPSA Jan USPSA","match_date":"2017-01-21","stage_classifiercode":"06-10","member_number":"\"\"","first_name":"STEVEN","last_name":"CRAWFORD","classification":"U","division":"OPEN","hit_factor":3.5211},{"match_name":"LCSC Linden USPSA 120918","match_date":"2018-12-09","stage_classifiercode":"06-10","member_number":"L1620","first_name":"THOMAS","last_name":"CHAN","classification":"A","division":"OPEN","hit_factor":3.517},{"match_name":"MCAS USPSA March 2016","match_date":"2016-03-19","stage_classifiercode":"06-10","member_number":"PEN","first_name":"CODY","last_name":"DELUCA","classification":"U","division":"OPEN","hit_factor":3.5129},{"match_name":"Hampden RPC June USPSA Match","match_date":"2018-06-10","stage_classifiercode":"06-10","member_number":"TY69081","first_name":"ROGER","last_name":"GOODE","classification":"C","division":"OPEN","hit_factor":3.5129},{"match_name":"APSC USPSA Match 10-07-17","match_date":"2017-10-07","stage_classifiercode":"06-10","member_number":"A87891","first_name":"JAY","last_name":"JOSE","classification":"B","division":"OPEN","hit_factor":3.5129},{"match_name":"Maine Practical Shooters May 2021","match_date":"2021-05-08","stage_classifiercode":"06-10","member_number":"Fy117361","first_name":"PETER","last_name":"TERLESKY","classification":"U","division":"OPEN","hit_factor":3.5006},{"match_name":"AGC_20160403","match_date":"2016-04-03","stage_classifiercode":"06-10","member_number":"A94379","first_name":"LINDA","last_name":"SCOTT","classification":"U","division":"OPEN","hit_factor":3.5006},{"match_name":"7a Fecha USPSA","match_date":"2020-11-29","stage_classifiercode":"06-10","member_number":"F116122","first_name":"JOSE","last_name":"ORTIZ-LEON","classification":"C","division":"OPEN","hit_factor":3.4843},{"match_name":"FBURG March 2021 Level I USPSA ","match_date":"2021-03-06","stage_classifiercode":"06-10","member_number":"A110246","first_name":"BEA","last_name":"L","classification":"C","division":"OPEN","hit_factor":3.4803},{"match_name":"WSPS JUNE 2017 USPSA MATCH","match_date":"2017-06-17","stage_classifiercode":"06-10","member_number":"\"\"","first_name":"LARRY","last_name":"STRUCK","classification":"X","division":"OPEN","hit_factor":3.4722},{"match_name":"Space Coast Practical Shooters","match_date":"2018-06-02","stage_classifiercode":"06-10","member_number":"L2837","first_name":"DAVID","last_name":"PAGE","classification":"C","division":"OPEN","hit_factor":3.4682},{"match_name":"Mvpsa Fall Week 2 ","match_date":"2016-08-17","stage_classifiercode":"06-10","member_number":"\"\"","first_name":"ARES","last_name":"SURBER","classification":"\"\"","division":"OPEN","hit_factor":3.4562},{"match_name":"RangeMasters 9-29-2016","match_date":"2016-09-29","stage_classifiercode":"06-10","member_number":"\"\"","first_name":"VINH","last_name":"LAM","classification":"U","division":"OPEN","hit_factor":3.4404},{"match_name":"Steel City USPSA September 3 2016","match_date":"2016-09-03","stage_classifiercode":"06-10","member_number":"L2368","first_name":"BILL","last_name":"MCDONALD","classification":"C","division":"OPEN","hit_factor":3.4364},{"match_name":"Monson April 2017 USPSA","match_date":"2017-04-23","stage_classifiercode":"06-10","member_number":"A96720","first_name":"SARAH","last_name":"SMITH","classification":"U","division":"OPEN","hit_factor":3.4364},{"match_name":"PSAC_20160227","match_date":"2016-02-27","stage_classifiercode":"06-10","member_number":"A69880","first_name":"RICHARD","last_name":"SEALS","classification":"\"\"","division":"OPEN","hit_factor":3.4325},{"match_name":"FBURG June 2018 Level 1 USPSA","match_date":"2018-06-02","stage_classifiercode":"06-10","member_number":"FY80523","first_name":"JERRY","last_name":"SITEK","classification":"C","division":"OPEN","hit_factor":3.4286},{"match_name":"DWB - Deadwood Boys USPSA 19 January 2020","match_date":"2020-01-19","stage_classifiercode":"06-10","member_number":"TY101479","first_name":"NEIL","last_name":"LASPINAS","classification":"C","division":"OPEN","hit_factor":3.4247},{"match_name":"RangeMasters 9-7-2017","match_date":"2017-09-07","stage_classifiercode":"06-10","member_number":"PEN","first_name":"MIKE","last_name":"MILLER","classification":"U","division":"OPEN","hit_factor":3.4208},{"match_name":"Ontelaunee USPSA September 2016","match_date":"2016-09-24","stage_classifiercode":"06-10","member_number":"\"\"","first_name":"BILL","last_name":"ROMIG","classification":"U","division":"OPEN","hit_factor":3.4052},{"match_name":"December 2017 CAS USPSA","match_date":"2017-12-03","stage_classifiercode":"06-10","member_number":"A60170","first_name":"DAVE","last_name":"DELGER","classification":"C","division":"OPEN","hit_factor":3.3975},{"match_name":"Alpha Mike Oct 2017","match_date":"2017-10-15","stage_classifiercode":"06-10","member_number":"A103548","first_name":"LARRY","last_name":"ESPARZA","classification":"U","division":"OPEN","hit_factor":3.3975},{"match_name":"Oregon ARPC November Match","match_date":"2015-11-14","stage_classifiercode":"06-10","member_number":"TY45897","first_name":"LAWRENCE","last_name":"MULL","classification":"C","division":"OPEN","hit_factor":3.3937},{"match_name":"Ontelaunee USPSA September 2016","match_date":"2016-09-24","stage_classifiercode":"06-10","member_number":"A82780","first_name":"JEANNE","last_name":"RUANE","classification":"U","division":"OPEN","hit_factor":3.3822},{"match_name":"ARPC USPSA Match 9-24-17","match_date":"2017-09-24","stage_classifiercode":"06-10","member_number":"A39965","first_name":"CHITO","last_name":"TAGAYUN","classification":"B","division":"OPEN","hit_factor":3.3482},{"match_name":"RBGC 2016-10-22","match_date":"2016-10-22","stage_classifiercode":"06-10","member_number":"A97367","first_name":"JOHN","last_name":"FABIAN","classification":"U","division":"OPEN","hit_factor":3.3408},{"match_name":"LCSA USPSA May 2017","match_date":"2017-05-13","stage_classifiercode":"06-10","member_number":"A-90924","first_name":"SOPHIA","last_name":"SMITH","classification":"C","division":"OPEN","hit_factor":3.337},{"match_name":"Richmond hotshots April 16-17 2016 USPSA Pistol match","match_date":"2016-04-16","stage_classifiercode":"06-10","member_number":"A45431","first_name":"MERWIN","last_name":"LAI","classification":"A","division":"OPEN","hit_factor":3.337},{"match_name":"HOPS USPSA 081917","match_date":"2017-08-19","stage_classifiercode":"06-10","member_number":"A95470","first_name":"GABRIEL","last_name":"SANCHEZ","classification":"U","division":"OPEN","hit_factor":3.3149},{"match_name":"FLPSA MN14 USPSA April 26 2018","match_date":"2018-04-26","stage_classifiercode":"06-10","member_number":"L4062","first_name":"KEN","last_name":"SPOONER","classification":"B","division":"OPEN","hit_factor":3.3149},{"match_name":"Harvard Action Shooters August 2016 USPSA Pistol","match_date":"2016-08-14","stage_classifiercode":"06-10","member_number":"A27309","first_name":"TERRANCE","last_name":"ROBERTSON","classification":"U","division":"OPEN","hit_factor":3.2931},{"match_name":"Ontelaunee USPSA September 2016","match_date":"2016-09-24","stage_classifiercode":"06-10","member_number":"A93288","first_name":"DONNA","last_name":"ROMIG","classification":"U","division":"OPEN","hit_factor":3.2751},{"match_name":"Hosemasters 2nd Sunday August 2017","match_date":"2017-08-13","stage_classifiercode":"06-10","member_number":"A74253","first_name":"LESLIE","last_name":"KORZEP","classification":"X","division":"OPEN","hit_factor":3.2751},{"match_name":"Colonial Rifle And Pistol Club Novermer Match","match_date":"2018-11-03","stage_classifiercode":"06-10","member_number":"A35208","first_name":"AL","last_name":"GARGANO","classification":"D","division":"OPEN","hit_factor":3.2644},{"match_name":"SWGC USPSA Pistol Match - March 2020","match_date":"2020-03-07","stage_classifiercode":"06-10","member_number":"L4464","first_name":"ERIC","last_name":"WONG","classification":"A","division":"OPEN","hit_factor":3.2644},{"match_name":"Grandbaggers December 2017","match_date":"2017-12-07","stage_classifiercode":"06-10","member_number":"TY83533","first_name":"ANDY","last_name":"FEIGIN","classification":"A","division":"OPEN","hit_factor":3.2432},{"match_name":"FAS Sunday Outdoor USPSA Match","match_date":"2021-08-01","stage_classifiercode":"06-10","member_number":"A133287","first_name":"NICK","last_name":"COLEMAN","classification":"C","division":"OPEN","hit_factor":3.2397},{"match_name":"Steel City USPSA September 3 2016","match_date":"2016-09-03","stage_classifiercode":"06-10","member_number":"A92796","first_name":"MICHAEL","last_name":"WRAY","classification":"C","division":"OPEN","hit_factor":3.2293},{"match_name":"PSAC_20160227","match_date":"2016-02-27","stage_classifiercode":"06-10","member_number":"A43008","first_name":"LELAND","last_name":"BIRD","classification":"\"\"","division":"OPEN","hit_factor":3.2258},{"match_name":"MVPSA USPSA  6-2-18","match_date":"2018-06-02","stage_classifiercode":"06-10","member_number":"A107640","first_name":"RALPH","last_name":"HOPKINS","classification":"D","division":"OPEN","hit_factor":3.2189},{"match_name":"ESPS USPSA July 2017","match_date":"2017-07-22","stage_classifiercode":"06-10","member_number":"A18571","first_name":"KENNY","last_name":"DANZ","classification":"B","division":"OPEN","hit_factor":3.2051},{"match_name":"RBGC 2016-10-22","match_date":"2016-10-22","stage_classifiercode":"06-10","member_number":"A98026","first_name":"PAUL","last_name":"VANOUDHEUSDEN","classification":"U","division":"OPEN","hit_factor":3.2017},{"match_name":"Hopkinton August 2016 ","match_date":"2016-08-06","stage_classifiercode":"06-10","member_number":"TY65772","first_name":"STEVE","last_name":"PICHE","classification":"A","division":"OPEN","hit_factor":3.1949},{"match_name":"Pioneer Action Shooters USPSA 5-23-21 Special Classifer","match_date":"2021-05-23","stage_classifiercode":"06-10","member_number":"A70161","first_name":"ROGER","last_name":"BINKERD","classification":"C","division":"OPEN","hit_factor":3.1847},{"match_name":"Springfield Tactical Shooters 02/04/2021","match_date":"2021-02-04","stage_classifiercode":"06-10","member_number":"\"\"","first_name":"TONY","last_name":"NUDO","classification":"\"\"","division":"OPEN","hit_factor":3.1746},{"match_name":"WGC June 2018 USPSA","match_date":"2018-06-10","stage_classifiercode":"06-10","member_number":"TY77781","first_name":"ROXANE","last_name":"MCHUGH","classification":"\"\"","division":"OPEN","hit_factor":3.1746},{"match_name":"DWB - Deadwood Boys USPSA 19 January 2020","match_date":"2020-01-19","stage_classifiercode":"06-10","member_number":"TY104560","first_name":"DEXTER","last_name":"RINGPIS","classification":"D","division":"OPEN","hit_factor":3.1646},{"match_name":"Ripon USPSA 9-22-18","match_date":"2018-09-22","stage_classifiercode":"06-10","member_number":"A98718","first_name":"DENISE","last_name":"PLESETZ","classification":"D","division":"OPEN","hit_factor":3.1283},{"match_name":"Custer December USPSA","match_date":"2016-12-04","stage_classifiercode":"06-10","member_number":"A85321","first_name":"DEAN","last_name":"CLARK","classification":"U","division":"OPEN","hit_factor":3.1217},{"match_name":"MVPSA USPSA  6-2-18","match_date":"2018-06-02","stage_classifiercode":"06-10","member_number":"L4137","first_name":"STEVE","last_name":"PEACOCK","classification":"C","division":"OPEN","hit_factor":3.1185},{"match_name":"RangeMasters 1-28-2016","match_date":"2016-01-28","stage_classifiercode":"06-10","member_number":"\"\"","first_name":"DANNY","last_name":"NARAMORE","classification":"U","division":"OPEN","hit_factor":3.1153},{"match_name":"SWGC USPSA Pistol Match - December 2018","match_date":"2018-12-01","stage_classifiercode":"06-10","member_number":"TY62418","first_name":"RAY","last_name":"WINKEL","classification":"C","division":"OPEN","hit_factor":3.112},{"match_name":"BGSL First Sunday Match","match_date":"2016-06-05","stage_classifiercode":"06-10","member_number":"L3600","first_name":"CAROLE","last_name":"BRYANT","classification":"C","division":"OPEN","hit_factor":3.1088},{"match_name":"GRB USPSA Sept @ CAV","match_date":"2015-09-19","stage_classifiercode":"06-10","member_number":"A81138","first_name":"CHRISTOPHER","last_name":"GARRETT","classification":"C","division":"OPEN","hit_factor":3.1056},{"match_name":"CCAS December 2017 Special Classifier","match_date":"2017-12-16","stage_classifiercode":"06-10","member_number":"TY51639","first_name":"TOM","last_name":"LAIRSON","classification":"C","division":"OPEN","hit_factor":3.0928},{"match_name":"Shoot GTR USPSA Aug 16","match_date":"2016-08-16","stage_classifiercode":"06-10","member_number":"A98016","first_name":"FRED","last_name":"JOHNSON","classification":"U","division":"OPEN","hit_factor":3.0896},{"match_name":"MVPSA USPSA  6-2-18","match_date":"2018-06-02","stage_classifiercode":"06-10","member_number":"TY89492","first_name":"JESSE","last_name":"CLAUSSE","classification":"A","division":"OPEN","hit_factor":3.0832},{"match_name":"Gem City Gun Club 4-7 and 4-8-18","match_date":"2018-04-07","stage_classifiercode":"06-10","member_number":"TY70258","first_name":"WILSON","last_name":"CURRY","classification":"U","division":"OPEN","hit_factor":3.0801},{"match_name":"OKCGC USPSA October 2018","match_date":"2018-10-06","stage_classifiercode":"06-10","member_number":"\"\"","first_name":"SHAUN","last_name":"FLOYD","classification":"U","division":"OPEN","hit_factor":3.0706},{"match_name":"WVPPS October 2015","match_date":"2015-10-18","stage_classifiercode":"06-10","member_number":"FY72183","first_name":"JANICE","last_name":"POWER-WRIGHT","classification":"C","division":"OPEN","hit_factor":3.0706},{"match_name":"WVPPS October 2015","match_date":"2015-10-18","stage_classifiercode":"06-10","member_number":"A78441","first_name":"BILL","last_name":"TUGGLE","classification":"C","division":"OPEN","hit_factor":3.0644},{"match_name":"FBURG USPSA November 2021","match_date":"2021-11-07","stage_classifiercode":"06-10","member_number":"TY104678","first_name":"JOSEPH","last_name":"LIVI","classification":"B","division":"OPEN","hit_factor":3.0457},{"match_name":"Southkent USPSA MAY match","match_date":"2017-05-20","stage_classifiercode":"06-10","member_number":"A93121","first_name":"LOUANN","last_name":"RUITER","classification":"D","division":"OPEN","hit_factor":3.0364},{"match_name":"AGC_20160403","match_date":"2016-04-03","stage_classifiercode":"06-10","member_number":"A85926","first_name":"JAY","last_name":"EVANS","classification":"D","division":"OPEN","hit_factor":3.0242},{"match_name":"TAP USPSA February 28 2016 (28Feb16-01:01:53)","match_date":"2016-02-28","stage_classifiercode":"06-10","member_number":"A83436","first_name":"\"MOACIR.  \"\"MO\"\"\"","last_name":"RAMOS","classification":"C","division":"OPEN","hit_factor":3.0181},{"match_name":"LBAS170429 Spray-N-Pray Classifier Match","match_date":"2017-04-29","stage_classifiercode":"06-10","member_number":"TY71290","first_name":"JON","last_name":"BREAZEAL","classification":"C","division":"OPEN","hit_factor":2.997},{"match_name":"Sharp Practical Shooters August USPSA - Outdoor","match_date":"2021-08-22","stage_classifiercode":"06-10","member_number":"TY105651","first_name":"DALE","last_name":"FORREST","classification":"C","division":"OPEN","hit_factor":2.9821},{"match_name":"HRRB 12-01-2018","match_date":"2018-12-01","stage_classifiercode":"06-10","member_number":"FY66771","first_name":"ORLINO","last_name":"CARDENAS","classification":"C","division":"OPEN","hit_factor":2.9644},{"match_name":"FLPSA MN14 USPSA April 26 2018","match_date":"2018-04-26","stage_classifiercode":"06-10","member_number":"\"\"","first_name":"TOM","last_name":"GREGERSON","classification":"U","division":"OPEN","hit_factor":2.9557},{"match_name":"Hampden RPC June USPSA Match","match_date":"2018-06-10","stage_classifiercode":"06-10","member_number":"TY57316","first_name":"RON","last_name":"BARON","classification":"C","division":"OPEN","hit_factor":2.9268},{"match_name":"Springfield Tactical Shooters 09-07-2017","match_date":"2017-09-07","stage_classifiercode":"06-10","member_number":"TY24585","first_name":"DON","last_name":"STEELE","classification":"B","division":"OPEN","hit_factor":2.9211},{"match_name":"MCAS June 2018 USPSA Match","match_date":"2018-06-30","stage_classifiercode":"06-10","member_number":"TY78129","first_name":"SHARON","last_name":"ELIASSON","classification":"C","division":"OPEN","hit_factor":2.9155},{"match_name":"OREGON ARPC CC05 USPSA JUNE 10 2017","match_date":"2017-06-10","stage_classifiercode":"06-10","member_number":"PEN","first_name":"NICK","last_name":"SMITH","classification":"U","division":"OPEN","hit_factor":2.907},{"match_name":"Collin County USPSA 11-28-2021","match_date":"2021-11-28","stage_classifiercode":"06-10","member_number":"TY109764","first_name":"DAN","last_name":"AUTON","classification":"C","division":"OPEN","hit_factor":2.9014},{"match_name":"Chillicothe Sportsmens Club December USPSA","match_date":"2020-12-20","stage_classifiercode":"06-10","member_number":"A101591","first_name":"DANIELA","last_name":"DIBENNARDI","classification":"C","division":"OPEN","hit_factor":2.893},{"match_name":"MPSA 101715","match_date":"2015-10-17","stage_classifiercode":"06-10","member_number":"L3885","first_name":"ED","last_name":"CHANCERY","classification":"B","division":"OPEN","hit_factor":2.8846},{"match_name":"2020-03-07 USPSA at Phoenix Rod and Gun Club","match_date":"2020-03-07","stage_classifiercode":"06-10","member_number":"A18801","first_name":"MARK","last_name":"MARCIN","classification":"C","division":"OPEN","hit_factor":2.8708},{"match_name":"Briar Rabbit October2017","match_date":"2017-10-22","stage_classifiercode":"06-10","member_number":"\"\"","first_name":"DAVE","last_name":"BONE","classification":"C","division":"OPEN","hit_factor":2.8681},{"match_name":"Oxford OHS05 090521","match_date":"2021-09-05","stage_classifiercode":"06-10","member_number":"A95630","first_name":"DERRICK","last_name":"ALLEN","classification":"M","division":"OPEN","hit_factor":2.8681},{"match_name":"Ontelaunee USPSA September 2016","match_date":"2016-09-24","stage_classifiercode":"06-10","member_number":"\"\"","first_name":"JOEL","last_name":"ROMIG","classification":"U","division":"OPEN","hit_factor":2.8571},{"match_name":"BTSA USPSA 2020-5 Oct 11 2020","match_date":"2020-10-11","stage_classifiercode":"06-10","member_number":"F130108","first_name":"GAVIN","last_name":"HAMILTON","classification":"U","division":"OPEN","hit_factor":2.8355},{"match_name":"HPSP Heartland Practical Shooters October 2015 USPSA Handgun Shoot","match_date":"2015-10-25","stage_classifiercode":"06-10","member_number":"A89017","first_name":"JOHN","last_name":"PETERSEN","classification":"Unclassified","division":"OPEN","hit_factor":2.8329},{"match_name":"MS06 Team Magnolia USPSA November Match","match_date":"2016-11-06","stage_classifiercode":"06-10","member_number":"A81881","first_name":"BARBARA","last_name":"WATTS","classification":"C","division":"OPEN","hit_factor":2.8195},{"match_name":"NNRPA USPSA July 2018","match_date":"2018-07-28","stage_classifiercode":"06-10","member_number":"TY51797","first_name":"DENNIS","last_name":"MARSH","classification":"D","division":"OPEN","hit_factor":2.7933},{"match_name":"MCAS USPSA March 2016","match_date":"2016-03-19","stage_classifiercode":"06-10","member_number":"CL118","first_name":"FRANK","last_name":"COOK","classification":"A","division":"OPEN","hit_factor":2.7675},{"match_name":"MCAS June 2018 USPSA Match","match_date":"2018-06-30","stage_classifiercode":"06-10","member_number":"A79648","first_name":"SHARON","last_name":"SCHRUMPF","classification":"D","division":"OPEN","hit_factor":2.7624},{"match_name":"OREGON ARPC CC05 USPSA JUNE 10 2017","match_date":"2017-06-10","stage_classifiercode":"06-10","member_number":"TY-102587","first_name":"RODERICK","last_name":"BOTHMAN","classification":"U","division":"OPEN","hit_factor":2.7574},{"match_name":"Hosemasters 2nd Sunday August 2017","match_date":"2017-08-13","stage_classifiercode":"06-10","member_number":"TY72239","first_name":"CINDY","last_name":"REDIES","classification":"C","division":"OPEN","hit_factor":2.7498},{"match_name":"NOCPC May 2018","match_date":"2018-05-13","stage_classifiercode":"06-10","member_number":"A48821","first_name":"SCOTT","last_name":"BOSTELMAN","classification":"U","division":"OPEN","hit_factor":2.7498},{"match_name":"CBS March USPSA Steel Match","match_date":"2021-03-07","stage_classifiercode":"06-10","member_number":"TY78363","first_name":"BOB","last_name":"FISHER","classification":"C","division":"OPEN","hit_factor":2.7347},{"match_name":"Lefthanders Gun Club Practical Shooters November","match_date":"2017-11-04","stage_classifiercode":"06-10","member_number":"TY24585","first_name":"DON","last_name":"STEELE","classification":"B","division":"OPEN","hit_factor":2.7322},{"match_name":"Briar Rabbit October2017","match_date":"2017-10-22","stage_classifiercode":"06-10","member_number":"A61046","first_name":"BETH","last_name":"BAKER","classification":"D","division":"OPEN","hit_factor":2.7149},{"match_name":"Gem City Gun Club 4-7 and 4-8-18","match_date":"2018-04-07","stage_classifiercode":"06-10","member_number":"PEN","first_name":"RICK","last_name":"MORAN","classification":"U","division":"OPEN","hit_factor":2.7051},{"match_name":"MPPL 20200301","match_date":"2020-03-01","stage_classifiercode":"06-10","member_number":"A63942","first_name":"CHRISTOPHER","last_name":"FONTANILLA","classification":"U","division":"OPEN","hit_factor":2.7027},{"match_name":"GRPC USPSA DO YOU FEEL LUCKY?","match_date":"2021-03-07","stage_classifiercode":"06-10","member_number":"TY40226","first_name":"BRIAN","last_name":"WHELIHAN","classification":"A","division":"OPEN","hit_factor":2.7027},{"match_name":"LdF 4th Saturday Match","match_date":"2015-11-28","stage_classifiercode":"06-10","member_number":"L2639","first_name":"STEVE","last_name":"CHILDRESS","classification":"D","division":"OPEN","hit_factor":2.6882},{"match_name":"CCPL - June 2021","match_date":"2021-06-19","stage_classifiercode":"06-10","member_number":"TY67910","first_name":"CAROL","last_name":"MASLER","classification":"D","division":"OPEN","hit_factor":2.669},{"match_name":"CFRPC November USPSA","match_date":"2018-11-18","stage_classifiercode":"06-10","member_number":"00","first_name":"MARK","last_name":"USSEGLIO","classification":"U","division":"OPEN","hit_factor":2.6667},{"match_name":"CBS GC08 USPSA Pistol","match_date":"2018-07-01","stage_classifiercode":"06-10","member_number":"\"\"","first_name":"LUCAS","last_name":"RUIZ","classification":"U","division":"OPEN","hit_factor":2.627},{"match_name":"CFRPC November USPSA","match_date":"2018-11-18","stage_classifiercode":"06-10","member_number":"\"\"","first_name":"KAR","last_name":"BAR","classification":"U","division":"OPEN","hit_factor":2.6155},{"match_name":"ACPSA March 2017","match_date":"2017-03-25","stage_classifiercode":"06-10","member_number":"TY73281","first_name":"JACK","last_name":"DARTIGALONGUE","classification":"C","division":"OPEN","hit_factor":2.6064},{"match_name":"NCPS USPSA Handgun Match March 25 2018z","match_date":"2018-03-25","stage_classifiercode":"06-10","member_number":"TY100628","first_name":"TONY","last_name":"SICA","classification":"U","division":"OPEN","hit_factor":2.6064},{"match_name":"ENPS May 2016 Classifier Match","match_date":"2016-05-01","stage_classifiercode":"06-10","member_number":"PEN","first_name":"THOMAS","last_name":"BRODER","classification":"U","division":"OPEN","hit_factor":2.5795},{"match_name":"Sharp Practical Shooters August USPSA - Outdoor","match_date":"2021-08-22","stage_classifiercode":"06-10","member_number":"TY118820","first_name":"RYAN","last_name":"QUIRK","classification":"B","division":"OPEN","hit_factor":2.5729},{"match_name":"MCAS USPSA March 2016","match_date":"2016-03-19","stage_classifiercode":"06-10","member_number":"TY78129","first_name":"SHARON","last_name":"ELIASSON","classification":"U","division":"OPEN","hit_factor":2.5575},{"match_name":"Gem City Gun Club 4-2-16  and 4-3-16","match_date":"2016-04-02","stage_classifiercode":"06-10","member_number":"A43231","first_name":"VERN","last_name":"MOORE","classification":"X","division":"OPEN","hit_factor":2.5532},{"match_name":"Ontelaunee USPSA September 2016","match_date":"2016-09-24","stage_classifiercode":"06-10","member_number":"A35577","first_name":"RIO","last_name":"PANGILINAN","classification":"D","division":"OPEN","hit_factor":2.5338},{"match_name":"AAFG USPSA Special Classifier April 29  2017","match_date":"2017-04-23","stage_classifiercode":"06-10","member_number":"A81446","first_name":"RANDY","last_name":"RONZITTI","classification":"D","division":"OPEN","hit_factor":2.5105},{"match_name":"WVPPS October 2015","match_date":"2015-10-18","stage_classifiercode":"06-10","member_number":"TY84708","first_name":"GALE","last_name":"BRIGHT","classification":"U","division":"OPEN","hit_factor":2.5042},{"match_name":"Springfield Tactical Shooters 02/04/2021","match_date":"2021-02-04","stage_classifiercode":"06-10","member_number":"\"\"","first_name":"TONY","last_name":"NUDO","classification":"\"\"","division":"OPEN","hit_factor":2.5021},{"match_name":"AGC_20170507","match_date":"2017-05-07","stage_classifiercode":"06-10","member_number":"A100990","first_name":"DAVID","last_name":"WILSON","classification":"U","division":"OPEN","hit_factor":2.4855},{"match_name":"RangeMasters 9-29-2016","match_date":"2016-09-29","stage_classifiercode":"06-10","member_number":"A96553","first_name":"DANNY","last_name":"NARAMORE","classification":"C","division":"OPEN","hit_factor":2.4793},{"match_name":"YRPA  9/25/16  USPSA Pistol Match","match_date":"2016-09-23","stage_classifiercode":"06-10","member_number":"A80665","first_name":"SAMANTHA","last_name":"JOYNER","classification":"C","division":"OPEN","hit_factor":2.4732},{"match_name":"MS06 Team Magnolia USPSA November Match","match_date":"2016-11-06","stage_classifiercode":"06-10","member_number":"A72671","first_name":"JIMMY","last_name":"WILKINSON SR","classification":"C","division":"OPEN","hit_factor":2.4732},{"match_name":"FAS Sunday Outdoor USPSA Match","match_date":"2021-08-01","stage_classifiercode":"06-10","member_number":"TY125541","first_name":"TILDEN","last_name":"MORGAN","classification":"U","division":"OPEN","hit_factor":2.4651},{"match_name":"OREGON ARPC CC05 USPSA JUNE 10 2017","match_date":"2017-06-10","stage_classifiercode":"06-10","member_number":"TY82604","first_name":"LISA","last_name":"RYAN","classification":"D","division":"OPEN","hit_factor":2.441},{"match_name":"LCSA USPSA May 2017","match_date":"2017-05-13","stage_classifiercode":"06-10","member_number":"L1063","first_name":"CHUCK","last_name":"BROOKS","classification":"A","division":"OPEN","hit_factor":2.4252},{"match_name":"GRB USPSA Sept @ CAV","match_date":"2015-09-19","stage_classifiercode":"06-10","member_number":"TY77564","first_name":"KEVIN","last_name":"MCPHEE","classification":"C","division":"OPEN","hit_factor":2.4058},{"match_name":"AGC_20170507","match_date":"2017-05-07","stage_classifiercode":"06-10","member_number":"L4245","first_name":"JOHN","last_name":"ADAMS","classification":"D","division":"OPEN","hit_factor":2.3885},{"match_name":"Richmond Hot Shots July 15-16-2017 USPSA Pistol Match","match_date":"2017-07-15","stage_classifiercode":"06-10","member_number":"A61934","first_name":"WILLIAM","last_name":"TIU","classification":"C","division":"OPEN","hit_factor":2.3659},{"match_name":"SPSA USPSA March 4th Sat match","match_date":"2021-03-27","stage_classifiercode":"06-10","member_number":"A60872","first_name":"KELSEY","last_name":"PRICE","classification":"B","division":"OPEN","hit_factor":2.3548},{"match_name":"AGC_20170507","match_date":"2017-05-07","stage_classifiercode":"06-10","member_number":"L657","first_name":"JIM","last_name":"FRANCIS","classification":"C","division":"OPEN","hit_factor":2.3493},{"match_name":"Briar Rabbit October2017","match_date":"2017-10-22","stage_classifiercode":"06-10","member_number":"\"\"","first_name":"NICK","last_name":"REPASKY","classification":"C","division":"OPEN","hit_factor":2.3456},{"match_name":"ENPS May 2016 Classifier Match","match_date":"2016-05-01","stage_classifiercode":"06-10","member_number":"A91511","first_name":"DANIEL","last_name":"WIDMAN","classification":"U","division":"OPEN","hit_factor":2.3419},{"match_name":"Idaho ISPS January 6th 2018","match_date":"2018-01-06","stage_classifiercode":"06-10","member_number":"A106643","first_name":"EUGENE","last_name":"DINA","classification":"U","division":"OPEN","hit_factor":2.3364},{"match_name":"FBURG March 2021 Level I USPSA ","match_date":"2021-03-06","stage_classifiercode":"06-10","member_number":"FY82185","first_name":"MARK","last_name":"TURES","classification":"U","division":"OPEN","hit_factor":2.3328},{"match_name":"MPSA 2020-01-02","match_date":"2021-01-02","stage_classifiercode":"06-10","member_number":"A122536","first_name":"JONATHAN","last_name":"PAYNE","classification":"B","division":"OPEN","hit_factor":2.3095},{"match_name":"2020-03-07 USPSA at Phoenix Rod and Gun Club","match_date":"2020-03-07","stage_classifiercode":"06-10","member_number":"TY98350","first_name":"ERIC","last_name":"HAGBERG","classification":"C","division":"OPEN","hit_factor":2.3024},{"match_name":"FBURG June 2017 Level I USPSA ","match_date":"2017-06-03","stage_classifiercode":"06-10","member_number":"A99554","first_name":"SASHA","last_name":"DANJCZEK","classification":"D","division":"OPEN","hit_factor":2.3024},{"match_name":"FBURG USPSA November 2021","match_date":"2021-11-07","stage_classifiercode":"06-10","member_number":"A127859","first_name":"THOMAS","last_name":"READER","classification":"U","division":"OPEN","hit_factor":2.2953},{"match_name":"Richmond hotshots April 16-17 2016 USPSA Pistol match","match_date":"2016-04-16","stage_classifiercode":"06-10","member_number":"A25441","first_name":"WALTER","last_name":"HASHIMOTO","classification":"A","division":"OPEN","hit_factor":2.2936},{"match_name":"Richmond Boro Gun Club October 2017","match_date":"2017-10-21","stage_classifiercode":"06-10","member_number":"\"\"","first_name":"JASON","last_name":"MOSTOFF","classification":"U","division":"OPEN","hit_factor":2.2676},{"match_name":"OREGON ARPC CC05 USPSA JUNE 10 2017","match_date":"2017-06-10","stage_classifiercode":"06-10","member_number":"A-101846","first_name":"JEREMY","last_name":"LADIGES","classification":"U","division":"OPEN","hit_factor":2.1898},{"match_name":"SPSA September USPSA 1st Sat Match","match_date":"2015-09-05","stage_classifiercode":"06-10","member_number":"L1700","first_name":"BOB","last_name":"WRIGHT","classification":"M","division":"OPEN","hit_factor":2.185},{"match_name":"LdF 4th Saturday Match","match_date":"2015-11-28","stage_classifiercode":"06-10","member_number":"TY91328","first_name":"ROLLY","last_name":"ABADA","classification":"D","division":"OPEN","hit_factor":2.1723},{"match_name":"TMGN USPSA May 4th Pistol Match","match_date":"2017-05-04","stage_classifiercode":"06-10","member_number":"A101182","first_name":"TOMMERBOMMER","last_name":"CUPETA","classification":"X","division":"OPEN","hit_factor":2.1708},{"match_name":"EHPSA USPSA 27June 2021","match_date":"2021-06-27","stage_classifiercode":"06-10","member_number":"A104782","first_name":"JOHN","last_name":"CRAMER","classification":"U","division":"OPEN","hit_factor":2.1521},{"match_name":"Alpha Mike Oct 2017","match_date":"2017-10-15","stage_classifiercode":"06-10","member_number":"\"\"","first_name":"DOMONIC","last_name":"LOFLAND","classification":"U","division":"OPEN","hit_factor":2.1521},{"match_name":"CPS USPSA May 2017","match_date":"2017-05-06","stage_classifiercode":"06-10","member_number":"A88441","first_name":"KYLE","last_name":"SAYEG","classification":"B","division":"OPEN","hit_factor":2.1337},{"match_name":"Richmond hotshots April 16-17 2016 USPSA Pistol match","match_date":"2016-04-16","stage_classifiercode":"06-10","member_number":"A77883","first_name":"EPHRAIM","last_name":"SAN FELIPE","classification":"C","division":"OPEN","hit_factor":2.1246},{"match_name":"Springfield Tactical Shooters 12-3-15","match_date":"2015-12-03","stage_classifiercode":"06-10","member_number":"TY24585","first_name":"DON","last_name":"STEELE","classification":"B","division":"OPEN","hit_factor":2.1216},{"match_name":"LA05  Tangi November USPSA 2020","match_date":"2020-11-20","stage_classifiercode":"06-10","member_number":"A60170","first_name":"DAVE","last_name":"DELGER","classification":"C","division":"OPEN","hit_factor":2.1171},{"match_name":"TMGN USPSA May 4th Pistol Match","match_date":"2017-05-04","stage_classifiercode":"06-10","member_number":"FY101286","first_name":"MARTIN","last_name":"SANDERS","classification":"U","division":"OPEN","hit_factor":2.1038},{"match_name":"SMPS March 2016","match_date":"2016-03-13","stage_classifiercode":"06-10","member_number":"TY92389","first_name":"DAVID","last_name":"HARRELL","classification":"U","division":"OPEN","hit_factor":2.0994},{"match_name":"ORSA USPSA October 2020","match_date":"2020-10-17","stage_classifiercode":"06-10","member_number":"125167","first_name":"RYAN","last_name":"JUDD","classification":"U","division":"OPEN","hit_factor":2.0994},{"match_name":"SPSA September USPSA 1st Sat Match","match_date":"2015-09-05","stage_classifiercode":"06-10","member_number":"A39246","first_name":"FEDERICO","last_name":"MINLOS","classification":"D","division":"OPEN","hit_factor":2.0877},{"match_name":"MASTER BLASTERS & SSFGA USPSA - September","match_date":"2021-09-18","stage_classifiercode":"06-10","member_number":"TY115219","first_name":"JOSHUA","last_name":"RICH","classification":"C","division":"OPEN","hit_factor":2.0848},{"match_name":"Colonial Rifle And Pistol Club Novermer Match","match_date":"2018-11-03","stage_classifiercode":"06-10","member_number":"\"\"","first_name":"MIKE","last_name":"TROMBETTA","classification":"X","division":"OPEN","hit_factor":2.0747},{"match_name":"CFRPC November USPSA","match_date":"2018-11-18","stage_classifiercode":"06-10","member_number":"\"\"","first_name":"CHRIS","last_name":"PIESER","classification":"U","division":"OPEN","hit_factor":2.0704},{"match_name":"CFRPC November USPSA","match_date":"2018-11-18","stage_classifiercode":"06-10","member_number":"\"\"","first_name":"TROY","last_name":"BUI","classification":"G","division":"OPEN","hit_factor":2.0478},{"match_name":"MPPL 20200301","match_date":"2020-03-01","stage_classifiercode":"06-10","member_number":"FY42988","first_name":"HERMENEGILDO","last_name":"DUQUEZ","classification":"C","division":"OPEN","hit_factor":2.0422},{"match_name":"AGC_20160403","match_date":"2016-04-03","stage_classifiercode":"06-10","member_number":"\"\"","first_name":"DAVE","last_name":"GALEGOR","classification":"X","division":"OPEN","hit_factor":2.0367},{"match_name":"SFPS 05-15-2016 SuperClassifier - Second Division","match_date":"2016-05-15","stage_classifiercode":"06-10","member_number":"A95779","first_name":"SHEVVONNA","last_name":"BENNETT","classification":"U","division":"OPEN","hit_factor":2.0339},{"match_name":"DAP December 2015 Classifier match","match_date":"2015-12-12","stage_classifiercode":"06-10","member_number":"A67589","first_name":"DEXTER","last_name":"LOPEZ","classification":"C","division":"OPEN","hit_factor":2.0067},{"match_name":"OREGON ARPC CC05 USPSA JUNE 10 2017","match_date":"2017-06-10","stage_classifiercode":"06-10","member_number":"A-103092","first_name":"MARK","last_name":"BRADLEY","classification":"U","division":"OPEN","hit_factor":1.9698},{"match_name":"WSPS OCTOBER 2018 USPSA MATCH","match_date":"2018-10-20","stage_classifiercode":"06-10","member_number":"A106161","first_name":"MICHEAL","last_name":"MCNAIR","classification":"U","division":"OPEN","hit_factor":1.9255},{"match_name":"Springfield Tactical Shooters 12-3-15","match_date":"2015-12-03","stage_classifiercode":"06-10","member_number":"TY24585","first_name":"DON","last_name":"STEELE","classification":"B","division":"OPEN","hit_factor":1.9157},{"match_name":"CBS March USPSA Steel Match","match_date":"2021-03-07","stage_classifiercode":"06-10","member_number":"\"\"","first_name":"CAMERON","last_name":"CONVERSE","classification":"\"\"","division":"OPEN","hit_factor":1.9157},{"match_name":"AGC_20160403","match_date":"2016-04-03","stage_classifiercode":"06-10","member_number":"A43008","first_name":"LELAND","last_name":"BIRD","classification":"D","division":"OPEN","hit_factor":1.912},{"match_name":"LdF USPSA Match July 11 2021","match_date":"2021-07-11","stage_classifiercode":"06-10","member_number":"TY124283","first_name":"MARTY","last_name":"WEXLER","classification":"U","division":"OPEN","hit_factor":1.8844},{"match_name":"LCSC Linden USPSA 061018","match_date":"2018-06-10","stage_classifiercode":"06-10","member_number":"A82754","first_name":"JONATHAN","last_name":"AURIGUI","classification":"D","division":"OPEN","hit_factor":1.8727},{"match_name":"HPSP Heartland Practical Shooters October 2015 USPSA Handgun Shoot","match_date":"2015-10-25","stage_classifiercode":"06-10","member_number":"PEN","first_name":"GARNER","last_name":"JOHNSON","classification":"Unclassified","division":"OPEN","hit_factor":1.8564},{"match_name":"Richmond Hot Shots July 15-16-2017 USPSA Pistol Match","match_date":"2017-07-15","stage_classifiercode":"06-10","member_number":"TY77462","first_name":"LENNIE","last_name":"VILLIADOS","classification":"B","division":"OPEN","hit_factor":1.8072},{"match_name":"December 2017 CAS USPSA","match_date":"2017-12-03","stage_classifiercode":"06-10","member_number":"PENDING","first_name":"PRISCILLA","last_name":"RAMOIN","classification":"U","division":"OPEN","hit_factor":1.7825},{"match_name":"TPS USPSA -  August 2017 - Talon Range","match_date":"2017-08-05","stage_classifiercode":"06-10","member_number":"TY83546","first_name":"DANNY","last_name":"ENGLE","classification":"B","division":"OPEN","hit_factor":1.7493},{"match_name":"Mvpsa Fall Week 2 ","match_date":"2016-08-17","stage_classifiercode":"06-10","member_number":"\"\"","first_name":"CHRISTIAN","last_name":"LANTER","classification":"U","division":"OPEN","hit_factor":1.7391},{"match_name":"Mvpsa Fall Week 2 ","match_date":"2016-08-17","stage_classifiercode":"06-10","member_number":"\"\"","first_name":"AMBER","last_name":"BLINCOE","classification":"U","division":"OPEN","hit_factor":1.7291},{"match_name":"Hampden RPC May USPSA","match_date":"2016-05-01","stage_classifiercode":"06-10","member_number":"A87906","first_name":"TIM","last_name":"LECLAIR","classification":"D","division":"OPEN","hit_factor":1.676},{"match_name":"APSC USPSA Match 10-07-17","match_date":"2017-10-07","stage_classifiercode":"06-10","member_number":"A52499","first_name":"JAKOB","last_name":"DAUDE","classification":"M","division":"OPEN","hit_factor":1.6722},{"match_name":"DAP December 2015 Classifier match","match_date":"2015-12-12","stage_classifiercode":"06-10","member_number":"A94093","first_name":"AARON","last_name":"ANDRADE","classification":"none","division":"OPEN","hit_factor":1.6367},{"match_name":"Eagles Nest July 30th","match_date":"2017-07-30","stage_classifiercode":"06-10","member_number":"L3520","first_name":"NATE","last_name":"GRAHAM","classification":"C","division":"OPEN","hit_factor":1.6243},{"match_name":"EWPSA 2016-01","match_date":"2016-01-17","stage_classifiercode":"06-10","member_number":"A54667","first_name":"MIKE","last_name":"GOOD","classification":"B","division":"OPEN","hit_factor":1.6034},{"match_name":"BORCC USPSA October 2016 Classifier Match","match_date":"2016-10-30","stage_classifiercode":"06-10","member_number":"PEN","first_name":"GENE","last_name":"HAYS","classification":"U","division":"OPEN","hit_factor":1.5625},{"match_name":"Richmond Boro Gun Club October 2017","match_date":"2017-10-21","stage_classifiercode":"06-10","member_number":"\"\"","first_name":"MIKE","last_name":"TROMBETTA","classification":"U","division":"OPEN","hit_factor":1.5601},{"match_name":"DAP December 2015 Classifier match","match_date":"2015-12-12","stage_classifiercode":"06-10","member_number":"A90183","first_name":"GABRIELLE","last_name":"LOPEZ","classification":"C","division":"OPEN","hit_factor":1.5236},{"match_name":"2020-03-07 USPSA at Phoenix Rod and Gun Club","match_date":"2020-03-07","stage_classifiercode":"06-10","member_number":"A72793","first_name":"LYNETTE","last_name":"MARCIN","classification":"C","division":"OPEN","hit_factor":1.4896},{"match_name":"HOPS USPSA 1020018 ","match_date":"2018-10-19","stage_classifiercode":"06-10","member_number":"A74312","first_name":"JAN","last_name":"CONLEY","classification":"U","division":"OPEN","hit_factor":1.4599},{"match_name":"YRPA  9/25/16  USPSA Pistol Match","match_date":"2016-09-23","stage_classifiercode":"06-10","member_number":"A67259","first_name":"CHAD","last_name":"SHUMAN","classification":"C","division":"OPEN","hit_factor":1.3743},{"match_name":"Mvpsa Fall Week 2 ","match_date":"2016-08-17","stage_classifiercode":"06-10","member_number":"\"\"","first_name":"KEVIN","last_name":"PARMA","classification":"U","division":"OPEN","hit_factor":1.3158},{"match_name":"Green Valley March 2017","match_date":"2017-03-25","stage_classifiercode":"06-10","member_number":"\"\"","first_name":"TERRY","last_name":"MEEK","classification":"U","division":"OPEN","hit_factor":1.2909},{"match_name":"Richmond Boro Gun Club October 2017","match_date":"2017-10-21","stage_classifiercode":"06-10","member_number":"TY92431","first_name":"BORIS","last_name":"LITVAK","classification":"U","division":"OPEN","hit_factor":1.2247},{"match_name":"Richmond Boro Gun Club October 2017","match_date":"2017-10-21","stage_classifiercode":"06-10","member_number":"TY92021","first_name":"PETER","last_name":"CRISTALLI","classification":"U","division":"OPEN","hit_factor":1.0722},{"match_name":"Whitewater USPSA 3-18-17","match_date":"2017-03-18","stage_classifiercode":"06-10","member_number":"\"\"","first_name":"ED","last_name":"KOLH","classification":"U","division":"OPEN","hit_factor":1.0267},{"match_name":"Oregon ARPC November Match","match_date":"2015-11-14","stage_classifiercode":"06-10","member_number":"Ty51479","first_name":"NANCY","last_name":"MARRS","classification":"D","division":"OPEN","hit_factor":0.9588},{"match_name":"WVRPC USPSA 4 JUNE 2016","match_date":"2016-06-04","stage_classifiercode":"06-10","member_number":"\"\"","first_name":"CHRIS","last_name":"ADAMS","classification":"\"\"","division":"OPEN","hit_factor":0.8729},{"match_name":"Colonial Rifle And Pistol Club Novermer Match","match_date":"2018-11-03","stage_classifiercode":"06-10","member_number":"A108539","first_name":"LOUIS","last_name":"SEGGIO","classification":"D","division":"OPEN","hit_factor":0.8606},{"match_name":"LdF 4th Saturday Match","match_date":"2015-11-28","stage_classifiercode":"06-10","member_number":"PEN","first_name":"LONNIE","last_name":"BARBANI","classification":"U","division":"OPEN","hit_factor":0.762},{"match_name":"HPSP Heartland Practical Shooters October 2015 USPSA Handgun Shoot","match_date":"2015-10-25","stage_classifiercode":"06-10","member_number":"PEN","first_name":"ROCHELLE","last_name":"DVORAK","classification":"Unclassified","division":"OPEN","hit_factor":0.6849},{"match_name":"FBURG March 2021 Level I USPSA ","match_date":"2021-03-06","stage_classifiercode":"06-10","member_number":"A108310","first_name":"ROSENDO","last_name":"DOMINGO","classification":"C","division":"OPEN","hit_factor":0.6579},{"match_name":"MPSA 101715","match_date":"2015-10-17","stage_classifiercode":"06-10","member_number":"TY75388","first_name":"THOMAS","last_name":"HEARD","classification":"D","division":"OPEN","hit_factor":0.4555}]