[{"match_name":"WSPS AUGUST 2017 USPSA MATCH","match_date":"2017-08-16","stage_classifiercode":"06-03","member_number":"A52782","first_name":"MATT","last_name":"OLINCHAK","classification":"G","division":"PRODUCTION","hit_factor":15.8833},{"match_name":"CRGC USPSA Match 04-18-21","match_date":"2021-04-18","stage_classifiercode":"06-03","member_number":"RD5","first_name":"PHIL","last_name":"STRADER","classification":"G","division":"PRODUCTION","hit_factor":15.7729},{"match_name":"STAGE ZERO USPSA","match_date":"2021-08-14","stage_classifiercode":"06-03","member_number":"TY35970","first_name":"JERRY","last_name":"NGUYEN99","classification":"M","division":"PRODUCTION","hit_factor":15.0376},{"match_name":"WSRC USPSA 7/15/2017","match_date":"2017-07-15","stage_classifiercode":"06-03","member_number":"A78694","first_name":"STEPHEN","last_name":"LUTMAN","classification":"G","division":"PRODUCTION","hit_factor":14.9477},{"match_name":"EWPSA 2018-07","match_date":"2018-07-14","stage_classifiercode":"06-03","member_number":"L4257","first_name":"SHANE","last_name":"HILL","classification":"M","division":"PRODUCTION","hit_factor":14.9444},{"match_name":"BTSA USPSA 2016-8","match_date":"2016-08-28","stage_classifiercode":"06-03","member_number":"F87845","first_name":"TRENTON","last_name":"SUKOVIEFF","classification":"M","division":"PRODUCTION","hit_factor":14.9254},{"match_name":"WVPPS May 2017","match_date":"2017-05-21","stage_classifiercode":"06-03","member_number":"A77328","first_name":"ZACH","last_name":"YOUNG","classification":"G","division":"PRODUCTION","hit_factor":14.9163},{"match_name":"TASC 4-16-16 (15Apr16-10:27:18)","match_date":"2016-04-16","stage_classifiercode":"06-03","member_number":"TY76892","first_name":"BRYAN","last_name":"LUM","classification":"A","division":"PRODUCTION","hit_factor":14.6843},{"match_name":"Spsa Uspsa  1st Sat","match_date":"2016-01-02","stage_classifiercode":"06-03","member_number":"A77838","first_name":"NICK","last_name":"YANUTOLA","classification":"G","division":"PRODUCTION","hit_factor":14.6628},{"match_name":"MAPSA 2016.04.09","match_date":"2016-04-09","stage_classifiercode":"06-03","member_number":"A78033","first_name":"CASEY","last_name":"REED","classification":"M","division":"PRODUCTION","hit_factor":14.556},{"match_name":"2015 Ontelaunee Holiday Hosefest","match_date":"2015-12-26","stage_classifiercode":"06-03","member_number":"\"\"","first_name":"MATT","last_name":"OLINCHAK","classification":"G","division":"PRODUCTION","hit_factor":14.556},{"match_name":"SMPS USPSA Special Classifier Match - July 11th 2021","match_date":"2021-07-11","stage_classifiercode":"06-03","member_number":"TY97341","first_name":"JAMES","last_name":"HAN","classification":"A","division":"PRODUCTION","hit_factor":14.3472},{"match_name":"Shasta Shooters 2018 June Special Classifier","match_date":"2018-06-09","stage_classifiercode":"06-03","member_number":"TY94941","first_name":"JEREMY","last_name":"BAKER","classification":"M","division":"PRODUCTION","hit_factor":14.3472},{"match_name":"A3G-APS October 13th USPSA Match","match_date":"2018-10-13","stage_classifiercode":"06-03","member_number":"A80656","first_name":"ANDREAS","last_name":"YANKOPOLUS","classification":"G","division":"PRODUCTION","hit_factor":14.3062},{"match_name":"Brothers N Arms August 2016 USPSA Match","match_date":"2016-08-27","stage_classifiercode":"06-03","member_number":"A82324","first_name":"COREY","last_name":"MITCHELL","classification":"A","division":"PRODUCTION","hit_factor":14.2222},{"match_name":"Space Coast March 2021","match_date":"2021-03-06","stage_classifiercode":"06-03","member_number":"a88252","first_name":"MARK","last_name":"HILLIARD","classification":"M","division":"PRODUCTION","hit_factor":14.1823},{"match_name":"RBGC 2016-07-23","match_date":"2016-07-23","stage_classifiercode":"06-03","member_number":"TY54348","first_name":"JOEL","last_name":"THOMAS","classification":"A","division":"PRODUCTION","hit_factor":14.1643},{"match_name":"ORSA USPSA April 2016","match_date":"2016-04-16","stage_classifiercode":"06-03","member_number":"A76179","first_name":"WESTON","last_name":"HENSLEY","classification":"GM","division":"PRODUCTION","hit_factor":14.1243},{"match_name":"The Armory Indoor League","match_date":"2016-06-24","stage_classifiercode":"06-03","member_number":"A88381","first_name":"WYATT","last_name":"MCNEILL","classification":"G","division":"PRODUCTION","hit_factor":14.1176},{"match_name":"ORPCI 2018.03.31 USPSA Special","match_date":"2018-03-31","stage_classifiercode":"06-03","member_number":"Ty88974","first_name":"JUSTIN","last_name":"SMITH","classification":"A","division":"PRODUCTION","hit_factor":14.1176},{"match_name":"Richmond Hot Shots October 17-18-2020 USPSA Pistol","match_date":"2020-10-17","stage_classifiercode":"06-03","member_number":"TY80590","first_name":"STEVE","last_name":"DITTMANN","classification":"M","division":"PRODUCTION","hit_factor":14.0845},{"match_name":"Richmond October 17-18-2015","match_date":"2015-10-17","stage_classifiercode":"06-03","member_number":"A86033","first_name":"JOSEPH","last_name":"GARCIA","classification":"G","division":"PRODUCTION","hit_factor":14.0401},{"match_name":"Schultz September 2018","match_date":"2018-09-09","stage_classifiercode":"06-03","member_number":"Ty89698","first_name":"ERIC","last_name":"KAMPS","classification":"G","division":"PRODUCTION","hit_factor":14.0401},{"match_name":"Richmond October 17-18-2015","match_date":"2015-10-17","stage_classifiercode":"06-03","member_number":"TY76892","first_name":"BRYAN","last_name":"LUM","classification":"B","division":"PRODUCTION","hit_factor":14.0299},{"match_name":"NOCPC Oct 2017","match_date":"2017-10-08","stage_classifiercode":"06-03","member_number":"A77110","first_name":"JIM","last_name":"BRONSON","classification":"U","division":"PRODUCTION","hit_factor":14.0056},{"match_name":"C&C Indoor Range August 2021 USPSA Match","match_date":"2021-08-17","stage_classifiercode":"06-03","member_number":"A100099","first_name":"TYLER","last_name":"MEISENHEIMER","classification":"M","division":"PRODUCTION","hit_factor":14},{"match_name":"Shoot GTR USPSA 1/23","match_date":"2017-01-23","stage_classifiercode":"06-03","member_number":"TY94255","first_name":"SHANE","last_name":"BETHEA","classification":"M","division":"PRODUCTION","hit_factor":13.9535},{"match_name":"FSTC USPSA 10-22-2017","match_date":"2017-10-22","stage_classifiercode":"06-03","member_number":"A86995","first_name":"NEIL","last_name":"KOWALKOWSKI","classification":"A","division":"PRODUCTION","hit_factor":13.8889},{"match_name":"MISS Match 12-7-16","match_date":"2016-12-06","stage_classifiercode":"06-03","member_number":"L3857","first_name":"LES","last_name":"KISMARTONI","classification":"G","division":"PRODUCTION","hit_factor":13.8889},{"match_name":"APSC USPSA 7-7-2018","match_date":"2018-07-07","stage_classifiercode":"06-03","member_number":"FY75134","first_name":"RYAN","last_name":"BANKS","classification":"U","division":"PRODUCTION","hit_factor":13.8696},{"match_name":"EWPSA 2018-07 -M","match_date":"2018-07-15","stage_classifiercode":"06-03","member_number":"TY49461","first_name":"DAVID","last_name":"BLOSSER","classification":"M","division":"PRODUCTION","hit_factor":13.8528},{"match_name":"WSRC USPSA 7/15/2017","match_date":"2017-07-15","stage_classifiercode":"06-03","member_number":"A46159","first_name":"JOHN","last_name":"DORSEY","classification":"G","division":"PRODUCTION","hit_factor":13.8418},{"match_name":"MASTER BLASTERS & SSFGA USPSA - September","match_date":"2020-09-19","stage_classifiercode":"06-03","member_number":"A42007","first_name":"EDWARD","last_name":"STETTMEIER","classification":"G","division":"PRODUCTION","hit_factor":13.7741},{"match_name":"SCCCJULYCLASSIFIER2016","match_date":"2016-07-30","stage_classifiercode":"06-03","member_number":"A82558","first_name":"LOGAN","last_name":"FITZPATRICK","classification":"B","division":"PRODUCTION","hit_factor":13.7741},{"match_name":"GRPC USPSA DOG DAYS OF SUMMER","match_date":"2017-08-06","stage_classifiercode":"06-03","member_number":"L4029","first_name":"JAMES","last_name":"BESHADA","classification":"B","division":"PRODUCTION","hit_factor":13.7552},{"match_name":"APSC USPSA  3-7-20","match_date":"2020-03-06","stage_classifiercode":"06-03","member_number":"L4511","first_name":"ALEX","last_name":"ACOSTA","classification":"M","division":"PRODUCTION","hit_factor":13.7536},{"match_name":"Richmond October 17-18-2015","match_date":"2015-10-17","stage_classifiercode":"06-03","member_number":"A80323","first_name":"JEREMY","last_name":"NUNES","classification":"M","division":"PRODUCTION","hit_factor":13.7536},{"match_name":"WELD ECO09 20181021","match_date":"2018-10-21","stage_classifiercode":"06-03","member_number":"A90694","first_name":"JONAH","last_name":"PRES","classification":"B","division":"PRODUCTION","hit_factor":13.7447},{"match_name":"OKCGC February USPSA Match","match_date":"2017-02-04","stage_classifiercode":"06-03","member_number":"A62501","first_name":"ROBBIE","last_name":"DAUGHERTY","classification":"A","division":"PRODUCTION","hit_factor":13.7255},{"match_name":"COPS Sept 2020 USPSA Match","match_date":"2020-09-06","stage_classifiercode":"06-03","member_number":"A101290","first_name":"AUSTIN","last_name":"RIST","classification":"A","division":"PRODUCTION","hit_factor":13.7174},{"match_name":"COPS May 2017 USPSA Match","match_date":"2017-05-07","stage_classifiercode":"06-03","member_number":"A92034","first_name":"DEREK","last_name":"PARKER","classification":"A","division":"PRODUCTION","hit_factor":13.7109},{"match_name":"Nampa USPSA September 5th 2020","match_date":"2020-09-05","stage_classifiercode":"06-03","member_number":"TY84532","first_name":"KENNY","last_name":"PLATT","classification":"G","division":"PRODUCTION","hit_factor":13.6986},{"match_name":"A3G-APS October 13th USPSA Match","match_date":"2018-10-13","stage_classifiercode":"06-03","member_number":"L4113","first_name":"SAL","last_name":"LUNA","classification":"G","division":"PRODUCTION","hit_factor":13.6799},{"match_name":"PSAC 20180922","match_date":"2018-09-22","stage_classifiercode":"06-03","member_number":"A85424","first_name":"RICHARD","last_name":"CLARE","classification":"M","division":"PRODUCTION","hit_factor":13.6681},{"match_name":"NCPS USPSA Handgun Match November 29 2015","match_date":"2015-11-29","stage_classifiercode":"06-03","member_number":"A80323","first_name":"JEREMY","last_name":"NUNES","classification":"M","division":"PRODUCTION","hit_factor":13.63},{"match_name":"SCS USPSA Pistol with Classifer - Special Classifier July 31 2016","match_date":"2016-07-31","stage_classifiercode":"06-03","member_number":"A93508","first_name":"WOODROW","last_name":"LE","classification":"C","division":"PRODUCTION","hit_factor":13.6095},{"match_name":"Benton Gun Club-USPSA October 28 2018","match_date":"2018-10-28","stage_classifiercode":"06-03","member_number":"a81036","first_name":"ELI","last_name":"RUSHING","classification":"U","division":"PRODUCTION","hit_factor":13.6054},{"match_name":"PRG July 2017 Match","match_date":"2017-07-02","stage_classifiercode":"06-03","member_number":"A88221","first_name":"JON","last_name":"BAUTISTA","classification":"M","division":"PRODUCTION","hit_factor":13.5922},{"match_name":"USPSA AR16 The Ancient and Honorable Pistol and Rifle Society of Baxter 8/7/21","match_date":"2021-08-07","stage_classifiercode":"06-03","member_number":"A44292","first_name":"RICHARD","last_name":"WATKINS","classification":"G","division":"PRODUCTION","hit_factor":13.5501},{"match_name":"XMG USPSA July 10 2021","match_date":"2021-07-10","stage_classifiercode":"06-03","member_number":"ty48838","first_name":"TING","last_name":"SUN","classification":"U","division":"PRODUCTION","hit_factor":13.5318},{"match_name":"EAPS July 2016 USPSA","match_date":"2016-07-17","stage_classifiercode":"06-03","member_number":"TY57997","first_name":"ALVA","last_name":"STUARD","classification":"M","division":"PRODUCTION","hit_factor":13.5211},{"match_name":"MISS Match 12-7-16","match_date":"2016-12-06","stage_classifiercode":"06-03","member_number":"L4109","first_name":"MATT","last_name":"LITTLE","classification":"M","division":"PRODUCTION","hit_factor":13.5211},{"match_name":"Southern Maryland Practical Shooters 14 October 2018 USPSA","match_date":"2018-10-14","stage_classifiercode":"06-03","member_number":"TY82414","first_name":"DAVID","last_name":"ANKENY","classification":"A","division":"PRODUCTION","hit_factor":13.4831},{"match_name":"FMM USPSA","match_date":"2017-03-19","stage_classifiercode":"06-03","member_number":"A77838","first_name":"NICK","last_name":"YANUTOLA","classification":"G","division":"PRODUCTION","hit_factor":13.4642},{"match_name":"AREA 59  SPRING ALL CLASSIFIER","match_date":"2018-03-31","stage_classifiercode":"06-03","member_number":"A76683","first_name":"CALVIN","last_name":"TRUONG","classification":"C","division":"PRODUCTION","hit_factor":13.4615},{"match_name":"Tropang Vegas All Classifier Match","match_date":"2021-07-11","stage_classifiercode":"06-03","member_number":"A107523","first_name":"ANTHONY","last_name":"VILLANUEVA","classification":"B","division":"PRODUCTION","hit_factor":13.459},{"match_name":"ORPCI 2016.10.15 Pistol","match_date":"2016-10-15","stage_classifiercode":"06-03","member_number":"A96280","first_name":"TY","last_name":"O'BRADOVICH","classification":"B","division":"PRODUCTION","hit_factor":13.4454},{"match_name":"FLPSA MN14 USPSA July 13 2017","match_date":"2017-07-13","stage_classifiercode":"06-03","member_number":"L3008","first_name":"MIKE","last_name":"BOFENKAMP","classification":"A","division":"PRODUCTION","hit_factor":13.4431},{"match_name":"Richmond Hot Shots February 20-21-2021 USPSA Pistol","match_date":"2021-02-20","stage_classifiercode":"06-03","member_number":"TY71640","first_name":"JAMES","last_name":"YEOM","classification":"M","division":"PRODUCTION","hit_factor":13.4431},{"match_name":"NW01 Tuesday Sectional","match_date":"2017-08-01","stage_classifiercode":"06-03","member_number":"a71021","first_name":"ARRUN","last_name":"OUCH","classification":"M","division":"PRODUCTION","hit_factor":13.4409},{"match_name":"2016 Columbia Cascade Section Championship","match_date":"2016-08-12","stage_classifiercode":"06-03","member_number":"A68593","first_name":"KELLAR","last_name":"AUTUMN","classification":"A","division":"PRODUCTION","hit_factor":13.4409},{"match_name":"MAPSA  2017 05 13","match_date":"2017-05-10","stage_classifiercode":"06-03","member_number":"A78033","first_name":"CASEY","last_name":"REED","classification":"G","division":"PRODUCTION","hit_factor":13.4063},{"match_name":"NHRPC - February 2020 USPSA","match_date":"2020-02-09","stage_classifiercode":"06-03","member_number":"A103188","first_name":"TOM","last_name":"NGUYEN","classification":"B","division":"PRODUCTION","hit_factor":13.4048},{"match_name":"Rio Salado UPPL June 2021","match_date":"2021-06-13","stage_classifiercode":"06-03","member_number":"TY80590","first_name":"STEVE","last_name":"DITTMANN","classification":"M","division":"PRODUCTION","hit_factor":13.3869},{"match_name":"Richmond Hot Shots October 17-18-2020 USPSA Pistol","match_date":"2020-10-17","stage_classifiercode":"06-03","member_number":"A100099","first_name":"TYLER","last_name":"MEISENHEIMER","classification":"M","division":"PRODUCTION","hit_factor":13.3869},{"match_name":"SCAPSA MN05 USPSA Fall League 3","match_date":"2018-08-14","stage_classifiercode":"06-03","member_number":"A90576","first_name":"CHARLIE","last_name":"ONAN","classification":"A","division":"PRODUCTION","hit_factor":13.3869},{"match_name":"Devil Dog USPSA Classifier Match-Saturday Session","match_date":"2018-03-10","stage_classifiercode":"06-03","member_number":"A86310","first_name":"MIKE","last_name":"JONES","classification":"A","division":"PRODUCTION","hit_factor":13.3869},{"match_name":"MPPL 09022018","match_date":"2018-09-02","stage_classifiercode":"06-03","member_number":"TY75784","first_name":"TREVOR","last_name":"WOLD","classification":"G","division":"PRODUCTION","hit_factor":13.3721},{"match_name":"EAPS July 2016 USPSA","match_date":"2016-07-17","stage_classifiercode":"06-03","member_number":"A72544","first_name":"JASON","last_name":"WELCH","classification":"M","division":"PRODUCTION","hit_factor":13.3705},{"match_name":"DR&PC  5th Saturday Afternoon USPSA ","match_date":"2020-02-23","stage_classifiercode":"06-03","member_number":"A99204","first_name":"DAVID","last_name":"JACKSON","classification":"A","division":"PRODUCTION","hit_factor":13.3511},{"match_name":"Schultz September 2018","match_date":"2018-09-09","stage_classifiercode":"06-03","member_number":"A81938","first_name":"ALEX","last_name":"SLIVINSKI","classification":"A","division":"PRODUCTION","hit_factor":13.3511},{"match_name":"OFGC Practical Pistol Match Feb 21 2016","match_date":"2016-02-21","stage_classifiercode":"06-03","member_number":"A64463","first_name":"CHAD","last_name":"STANTON","classification":"M","division":"PRODUCTION","hit_factor":13.3333},{"match_name":"WNYPPL July 2020 USPSA","match_date":"2020-07-26","stage_classifiercode":"06-03","member_number":"a97616","first_name":"NICK","last_name":"MUSCARELLA","classification":"B","division":"PRODUCTION","hit_factor":13.3156},{"match_name":"MAPSA  2017 05 13","match_date":"2017-05-10","stage_classifiercode":"06-03","member_number":"A97572","first_name":"TONY","last_name":"STOCKEY","classification":"A","division":"PRODUCTION","hit_factor":13.3156},{"match_name":"PPS USPSA 2018-09-22","match_date":"2018-09-22","stage_classifiercode":"06-03","member_number":"TY60095","first_name":"MATT","last_name":"HOPKINS","classification":"G","division":"PRODUCTION","hit_factor":13.2979},{"match_name":"OFGC Practical Pistol Match Feb 21 2016","match_date":"2016-02-21","stage_classifiercode":"06-03","member_number":"TY78645","first_name":"LOREN","last_name":"PENDERGRASS","classification":"M","division":"PRODUCTION","hit_factor":13.2972},{"match_name":"NPCCC 9-4-16 USPSA","match_date":"2016-09-04","stage_classifiercode":"06-03","member_number":"a73672","first_name":"MICHAEL","last_name":"GELOBTER","classification":"A","division":"PRODUCTION","hit_factor":13.2964},{"match_name":"NPCCC 9-4-16 USPSA","match_date":"2016-09-04","stage_classifiercode":"06-03","member_number":"L3857","first_name":"LES","last_name":"PEPPERONI","classification":"G","division":"PRODUCTION","hit_factor":13.2791},{"match_name":"RBGC 2016-07-23","match_date":"2016-07-23","stage_classifiercode":"06-03","member_number":"A84978","first_name":"W. TYLER","last_name":"TURNER","classification":"U","division":"PRODUCTION","hit_factor":13.278},{"match_name":"Shoot GTR USPSA Classifier 06-03","match_date":"2018-01-05","stage_classifiercode":"06-03","member_number":"A88003","first_name":"RICH","last_name":"OTT","classification":"A","division":"PRODUCTION","hit_factor":13.2565},{"match_name":"BORCC USPSA July 2016","match_date":"2016-07-24","stage_classifiercode":"06-03","member_number":"TY81670","first_name":"DAVID","last_name":"MILLER","classification":"B","division":"PRODUCTION","hit_factor":13.245},{"match_name":"Uspsa Classifier","match_date":"2018-05-06","stage_classifiercode":"06-03","member_number":"F107645","first_name":"KEVIN","last_name":"DOUBT","classification":"U","division":"PRODUCTION","hit_factor":13.2176},{"match_name":"TPS USPSA -  September 2018 USPSA","match_date":"2018-09-01","stage_classifiercode":"06-03","member_number":"A82422","first_name":"LAWTON","last_name":"SEGLER","classification":"A","division":"PRODUCTION","hit_factor":13.21},{"match_name":"AREA 59  SPRING ALL CLASSIFIER","match_date":"2018-03-31","stage_classifiercode":"06-03","member_number":"TY96791","first_name":"SCOTT","last_name":"TAYLOR","classification":"B","division":"PRODUCTION","hit_factor":13.1926},{"match_name":"Crooked Creek Pistol League - August 2017","match_date":"2017-08-26","stage_classifiercode":"06-03","member_number":"A36953","first_name":"RYAN","last_name":"RAINES","classification":"A","division":"PRODUCTION","hit_factor":13.1752},{"match_name":"EAGC September 2016 USPSA Pistol Match","match_date":"2016-09-18","stage_classifiercode":"06-03","member_number":"A91748","first_name":"DOUG","last_name":"SCOTT","classification":"A","division":"PRODUCTION","hit_factor":13.172},{"match_name":"APSA June 2016 USPSA Match","match_date":"2016-06-11","stage_classifiercode":"06-03","member_number":"TY81220","first_name":"ED","last_name":"SHULMAN","classification":"A","division":"PRODUCTION","hit_factor":13.1687},{"match_name":"SCCC CLASSIFIER MATCH 7_23_17","match_date":"2017-07-23","stage_classifiercode":"06-03","member_number":"TY89356","first_name":"CHASE_2","last_name":"HARBER","classification":"M","division":"PRODUCTION","hit_factor":13.1653},{"match_name":"MAPSA  2017 05 13","match_date":"2017-05-10","stage_classifiercode":"06-03","member_number":"A90576","first_name":"CHARLIE","last_name":"ONAN","classification":"B","division":"PRODUCTION","hit_factor":13.1406},{"match_name":"SUPS All Classifier Match March 1718 2018","match_date":"2018-03-17","stage_classifiercode":"06-03","member_number":"A91529","first_name":"ROSSEN","last_name":"HRISTOV2","classification":"GM","division":"PRODUCTION","hit_factor":13.1406},{"match_name":"Htf Practical Shooters All Classifier","match_date":"2017-10-29","stage_classifiercode":"06-03","member_number":"A81425","first_name":"CHASE","last_name":"LANE","classification":"M","division":"PRODUCTION","hit_factor":13.1016},{"match_name":"OPSC USPSA 8-14-2016","match_date":"2016-08-14","stage_classifiercode":"06-03","member_number":"A79265","first_name":"PETE","last_name":"HALL","classification":"A","division":"PRODUCTION","hit_factor":13.1016},{"match_name":"OREGON ARPC CC05 USPSA - Classifier Match - APR 10 2021","match_date":"2021-04-10","stage_classifiercode":"06-03","member_number":"TY68593","first_name":"KELLAR","last_name":"AUTUMN","classification":"M","division":"PRODUCTION","hit_factor":13.1016},{"match_name":"Henry County Gun Club USPSA","match_date":"2021-10-09","stage_classifiercode":"06-03","member_number":"A123351","first_name":"CALVIN","last_name":"CRANOR","classification":"B","division":"PRODUCTION","hit_factor":13.1016},{"match_name":"MCTS - USPSA July 2020 #2","match_date":"2020-07-25","stage_classifiercode":"06-03","member_number":"A112410","first_name":"MASON","last_name":"WORTHAM","classification":"A","division":"PRODUCTION","hit_factor":13.089},{"match_name":"BORCC USPSA July 2016","match_date":"2016-07-24","stage_classifiercode":"06-03","member_number":"TY64028","first_name":"JOSEPH","last_name":"MARGHERONE","classification":"M","division":"PRODUCTION","hit_factor":13.0719},{"match_name":"SAPS USPSA May 2017","match_date":"2017-05-20","stage_classifiercode":"06-03","member_number":"A78921","first_name":"CHRIS","last_name":"CHAPMAN","classification":"B","division":"PRODUCTION","hit_factor":13.0612},{"match_name":"Dundee Practical Shooters - March 24 2018 - Points","match_date":"2018-03-24","stage_classifiercode":"06-03","member_number":"TY64113","first_name":"TOBIAS","last_name":"RICE","classification":"M","division":"PRODUCTION","hit_factor":13.0556},{"match_name":"LdF USPSA Match May 13 2017","match_date":"2017-05-13","stage_classifiercode":"06-03","member_number":"TY50681","first_name":"SHINNOSUKE","last_name":"TANAKA","classification":"M","division":"PRODUCTION","hit_factor":13.0548},{"match_name":"BORCC USPSA March 2018 Classifier Match","match_date":"2018-03-24","stage_classifiercode":"06-03","member_number":"FY87630","first_name":"MINGRAN","last_name":"QIAN","classification":"M","division":"PRODUCTION","hit_factor":13.0493},{"match_name":"Hawkeye Gun Club February 2016","match_date":"2016-02-20","stage_classifiercode":"06-03","member_number":"A84963","first_name":"JOSHUA","last_name":"MORRIS","classification":"B","division":"PRODUCTION","hit_factor":13.0378},{"match_name":"Moss Branch USPSA September 22nd Match","match_date":"2018-09-22","stage_classifiercode":"06-03","member_number":"A102213","first_name":"MYKEL","last_name":"STOREY","classification":"B","division":"PRODUCTION","hit_factor":13.0258},{"match_name":"HOPS USPSA 051620","match_date":"2020-05-16","stage_classifiercode":"06-03","member_number":"A90516","first_name":"JARED","last_name":"FOX","classification":"M","division":"PRODUCTION","hit_factor":13.0208},{"match_name":"GTR USPSA Tues April 19","match_date":"2016-04-19","stage_classifiercode":"06-03","member_number":"A69089","first_name":"MATT","last_name":"MITCHELL","classification":"M","division":"PRODUCTION","hit_factor":13.0208},{"match_name":"ORSA USPSA October 2020","match_date":"2020-10-17","stage_classifiercode":"06-03","member_number":"A126431","first_name":"JACOB","last_name":"TEFFETELLER","classification":"B","division":"PRODUCTION","hit_factor":13.0208},{"match_name":"BSC USPSA Oct 17 2020 Classifier","match_date":"2020-10-17","stage_classifiercode":"06-03","member_number":"A89401","first_name":"BEN","last_name":"TURNER","classification":"A","division":"PRODUCTION","hit_factor":13.0146},{"match_name":"RBGC 2016-07-23","match_date":"2016-07-23","stage_classifiercode":"06-03","member_number":"TY73586","first_name":"MIKE","last_name":"CURRIER","classification":"M","division":"PRODUCTION","hit_factor":13.0146},{"match_name":"LCSA USPSA AUGUST 2018","match_date":"2018-08-12","stage_classifiercode":"06-03","member_number":"TY109715","first_name":"PATCHES","last_name":"REEDER","classification":"B","division":"PRODUCTION","hit_factor":13.0039},{"match_name":"HTF Practical Shooter Classifer","match_date":"2017-11-02","stage_classifiercode":"06-03","member_number":"A97852","first_name":"ALEX","last_name":"JOINEE","classification":"A","division":"PRODUCTION","hit_factor":13.0039},{"match_name":"BRC_20180311","match_date":"2018-03-11","stage_classifiercode":"06-03","member_number":"A25335","first_name":"HENNING","last_name":"WALLGREN","classification":"G","division":"PRODUCTION","hit_factor":12.9973},{"match_name":"PRG July 2017 Match","match_date":"2017-07-02","stage_classifiercode":"06-03","member_number":"A94726","first_name":"EDOARDO","last_name":"ROSSI","classification":"M","division":"PRODUCTION","hit_factor":12.9973},{"match_name":"Brazosland Pistoleros September 17 2017 USPSA","match_date":"2017-09-17","stage_classifiercode":"06-03","member_number":"A105318","first_name":"JOHN","last_name":"VOSS","classification":"U","division":"PRODUCTION","hit_factor":12.9973},{"match_name":"Shasta Shooters 2018 June Special Classifier","match_date":"2018-06-09","stage_classifiercode":"06-03","member_number":"A96344","first_name":"RON","last_name":"HILDEBRANT","classification":"M","division":"PRODUCTION","hit_factor":12.9905},{"match_name":"Richmond October 17-18-2015","match_date":"2015-10-17","stage_classifiercode":"06-03","member_number":"TY80590","first_name":"STEVE","last_name":"DITTMANN","classification":"A","division":"PRODUCTION","hit_factor":12.987},{"match_name":"DRRC  Mar2017","match_date":"2017-03-04","stage_classifiercode":"06-03","member_number":"TY78052","first_name":"SERGE","last_name":"DAVIS","classification":"A","division":"PRODUCTION","hit_factor":12.9702},{"match_name":"2016 Columbia Cascade Section Championship","match_date":"2016-08-12","stage_classifiercode":"06-03","member_number":"A81147","first_name":"FRANK","last_name":"DECASTRO","classification":"B","division":"PRODUCTION","hit_factor":12.9702},{"match_name":"MPSA 070117","match_date":"2017-07-01","stage_classifiercode":"06-03","member_number":"A78083","first_name":"JEFFREY","last_name":"BLITCH","classification":"A","division":"PRODUCTION","hit_factor":12.963},{"match_name":"SCS USPSA Pistol with Classifer - Special Classifier July 31 2016","match_date":"2016-07-31","stage_classifiercode":"06-03","member_number":"TY59522","first_name":"AKOS","last_name":"MESTER","classification":"A","division":"PRODUCTION","hit_factor":12.963},{"match_name":"WNPL USPSA  - October HoseFest 2021","match_date":"2021-10-09","stage_classifiercode":"06-03","member_number":"A116560","first_name":"MICHAEL","last_name":"MILOVICH","classification":"B","division":"PRODUCTION","hit_factor":12.9458},{"match_name":"WVPPS May 2017","match_date":"2017-05-21","stage_classifiercode":"06-03","member_number":"FY83753","first_name":"JONEL","last_name":"YAP","classification":"B","division":"PRODUCTION","hit_factor":12.9458},{"match_name":"MISS Match 12-7-16","match_date":"2016-12-06","stage_classifiercode":"06-03","member_number":"A89698","first_name":"ERIC","last_name":"KAMPS","classification":"M","division":"PRODUCTION","hit_factor":12.938},{"match_name":"NCPS USPSA Handgun Match November 29 2015","match_date":"2015-11-29","stage_classifiercode":"06-03","member_number":"A87948","first_name":"SCOTT","last_name":"GREENE","classification":"M","division":"PRODUCTION","hit_factor":12.9366},{"match_name":"FSA USPSA Spring Classifier","match_date":"2018-03-18","stage_classifiercode":"06-03","member_number":"A86995","first_name":"NEIL","last_name":"KOWALKOWSKI","classification":"A","division":"PRODUCTION","hit_factor":12.9288},{"match_name":"WSPS AUGUST 2017 USPSA MATCH","match_date":"2017-08-16","stage_classifiercode":"06-03","member_number":"TY43604","first_name":"JOHN","last_name":"CLARKE","classification":"A","division":"PRODUCTION","hit_factor":12.9199},{"match_name":"EWPSA 2021-01","match_date":"2021-01-17","stage_classifiercode":"06-03","member_number":"a82297","first_name":"GENJURO","last_name":"QUALE","classification":"B","division":"PRODUCTION","hit_factor":12.9032},{"match_name":"HOPS USPSA 051620","match_date":"2020-05-16","stage_classifiercode":"06-03","member_number":"A85006","first_name":"MIKE","last_name":"HACKEMEYER","classification":"B","division":"PRODUCTION","hit_factor":12.9032},{"match_name":"RBGC 2016-07-23","match_date":"2016-07-23","stage_classifiercode":"06-03","member_number":"A86759","first_name":"CANDICE","last_name":"JULIANO","classification":"G","division":"PRODUCTION","hit_factor":12.9032},{"match_name":"Oakland County Sportsman's Club June 2021","match_date":"2021-06-05","stage_classifiercode":"06-03","member_number":"Ty100622","first_name":"SHAWN","last_name":"STALLARD","classification":"B","division":"PRODUCTION","hit_factor":12.9032},{"match_name":"MPPL 09022018","match_date":"2018-09-02","stage_classifiercode":"06-03","member_number":"A110695","first_name":"BRETT","last_name":"TANCHICO","classification":"U","division":"PRODUCTION","hit_factor":12.8947},{"match_name":"Rankin Field April (ALL CLASSIFIER) Saturday USPSA","match_date":"2021-04-03","stage_classifiercode":"06-03","member_number":"A89166","first_name":"WILLIAM","last_name":"BUCHNOFF","classification":"A","division":"PRODUCTION","hit_factor":12.8778},{"match_name":"MCPSL Pistol 4-8-17","match_date":"2017-04-08","stage_classifiercode":"06-03","member_number":"A92541","first_name":"MIKE","last_name":"TOFARI","classification":"C","division":"PRODUCTION","hit_factor":12.87},{"match_name":"HOPS USPSA 051521","match_date":"2021-05-15","stage_classifiercode":"06-03","member_number":"A90516","first_name":"JARED","last_name":"FOX","classification":"G","division":"PRODUCTION","hit_factor":12.87},{"match_name":"Custer March Classifier Match","match_date":"2018-03-04","stage_classifiercode":"06-03","member_number":"A97885","first_name":"TODD","last_name":"ANDERSON","classification":"A","division":"PRODUCTION","hit_factor":12.87},{"match_name":"MAPSA  2017 05 13","match_date":"2017-05-10","stage_classifiercode":"06-03","member_number":"A92403","first_name":"BRIAN","last_name":"FABIAN","classification":"A","division":"PRODUCTION","hit_factor":12.8609},{"match_name":"Devil Dog USPSA Classifier Match-Saturday Session","match_date":"2018-03-10","stage_classifiercode":"06-03","member_number":"A96541","first_name":"TRAVIS","last_name":"BEAL","classification":"M","division":"PRODUCTION","hit_factor":12.8535},{"match_name":"EHPSA USPSA 27 May 2018","match_date":"2018-05-27","stage_classifiercode":"06-03","member_number":"TY109715","first_name":"PATCHES","last_name":"REEDER","classification":"B","division":"PRODUCTION","hit_factor":12.8514},{"match_name":"Benton Gun Club-USPSA January 28 2018","match_date":"2018-01-28","stage_classifiercode":"06-03","member_number":"A81036","first_name":"ELI","last_name":"RUSHING","classification":"M","division":"PRODUCTION","hit_factor":12.8514},{"match_name":"OFGC USPSA August Match 8-20-2017","match_date":"2017-08-20","stage_classifiercode":"06-03","member_number":"TY98513","first_name":"JASON","last_name":"BRADLEY","classification":"M","division":"PRODUCTION","hit_factor":12.8312},{"match_name":"HOPS USPSA 051620","match_date":"2020-05-16","stage_classifiercode":"06-03","member_number":"TY94822","first_name":"ADAM","last_name":"TRAN","classification":"A","division":"PRODUCTION","hit_factor":12.8205},{"match_name":"HOPS USPSA 051620","match_date":"2020-05-16","stage_classifiercode":"06-03","member_number":"A107271","first_name":"JEFF","last_name":"PICKMAN","classification":"B","division":"PRODUCTION","hit_factor":12.8171},{"match_name":"BHPSC Monthy Match September 2018","match_date":"2018-09-28","stage_classifiercode":"06-03","member_number":"A85006","first_name":"MIKE","last_name":"HACKEMEYER","classification":"B","division":"PRODUCTION","hit_factor":12.8041},{"match_name":"Dundee Practical Shooters - March 24 2018 - Points","match_date":"2018-03-24","stage_classifiercode":"06-03","member_number":"TY78052","first_name":"SERGE","last_name":"DAVIS","classification":"M","division":"PRODUCTION","hit_factor":12.8},{"match_name":"ORGC Independance Day  2018 Pistol Match","match_date":"2018-07-01","stage_classifiercode":"06-03","member_number":"A94414","first_name":"JAMES","last_name":"DICKINSON","classification":"B","division":"PRODUCTION","hit_factor":12.7937},{"match_name":"Triforce Practical Shooters at BigWoodsGoods 12-21-17","match_date":"2017-12-22","stage_classifiercode":"06-03","member_number":"A96933","first_name":"DAVID","last_name":"BLANTON","classification":"B","division":"PRODUCTION","hit_factor":12.7937},{"match_name":"GRPC USPSA DOG DAYS OF SUMMER","match_date":"2017-08-06","stage_classifiercode":"06-03","member_number":"TY80518","first_name":"BRANDON","last_name":"HILL","classification":"A","division":"PRODUCTION","hit_factor":12.7877},{"match_name":"WGC August 2017 USPSA Classifier","match_date":"2017-08-13","stage_classifiercode":"06-03","member_number":"A82324","first_name":"COREY","last_name":"MITCHELL","classification":"A","division":"PRODUCTION","hit_factor":12.7877},{"match_name":"WSRC USPSA 7/15/2017","match_date":"2017-07-15","stage_classifiercode":"06-03","member_number":"TY73933","first_name":"JEFF","last_name":"MEYERS","classification":"M","division":"PRODUCTION","hit_factor":12.783},{"match_name":"MPSA 070117","match_date":"2017-07-01","stage_classifiercode":"06-03","member_number":"TY82331","first_name":"DREW","last_name":"WALTERS","classification":"A","division":"PRODUCTION","hit_factor":12.7771},{"match_name":"A3G-APS October 13th USPSA Match","match_date":"2018-10-13","stage_classifiercode":"06-03","member_number":"Ty86759","first_name":"CANDICE","last_name":"JULIANO","classification":"G","division":"PRODUCTION","hit_factor":12.7717},{"match_name":"CFRPC USPSA 2016 DECEMBER","match_date":"2016-12-18","stage_classifiercode":"06-03","member_number":"L3615","first_name":"BOBBY","last_name":"RIVERA","classification":"M","division":"PRODUCTION","hit_factor":12.7714},{"match_name":"WSPS AUGUST 2017 USPSA MATCH","match_date":"2017-08-16","stage_classifiercode":"06-03","member_number":"A61054","first_name":"HAROLD","last_name":"HAWKINS","classification":"A","division":"PRODUCTION","hit_factor":12.7714},{"match_name":"Richmond Hot Shots October 17-18-2020 USPSA Pistol","match_date":"2020-10-17","stage_classifiercode":"06-03","member_number":"Ty88744","first_name":"KIRK","last_name":"BOZIN","classification":"M","division":"PRODUCTION","hit_factor":12.7714},{"match_name":"USPSA Strategic Edge October 2018","match_date":"2018-10-20","stage_classifiercode":"06-03","member_number":"A92541","first_name":"MIKE","last_name":"TOFARI","classification":"A","division":"PRODUCTION","hit_factor":12.766},{"match_name":"AAFG USPSA July 30 Pistol  Classifier","match_date":"2016-07-30","stage_classifiercode":"06-03","member_number":"L3662","first_name":"MICHAEL","last_name":"GREEN","classification":"M","division":"PRODUCTION","hit_factor":12.7604},{"match_name":"Brothers N Arms August 2017 USPSA Match","match_date":"2017-08-19","stage_classifiercode":"06-03","member_number":"A82324","first_name":"COREY","last_name":"MITCHELL","classification":"A","division":"PRODUCTION","hit_factor":12.7551},{"match_name":"SUPS All Classifier Match March 1718 2018","match_date":"2018-03-17","stage_classifiercode":"06-03","member_number":"A84390","first_name":"JUSTINE","last_name":"WILLIAMS","classification":"M","division":"PRODUCTION","hit_factor":12.7551},{"match_name":"WAC February(4th Sunday) - USPSA 6 Classifier Match","match_date":"2020-02-23","stage_classifiercode":"06-03","member_number":"Fy71784","first_name":"CRAIG","last_name":"MEDVETZ","classification":"A","division":"PRODUCTION","hit_factor":12.7389},{"match_name":"USPSA MO21 2Alpha SBRC July 2017 Special Classifier","match_date":"2017-07-15","stage_classifiercode":"06-03","member_number":"A92034","first_name":"DEREK","last_name":"PARKER","classification":"A","division":"PRODUCTION","hit_factor":12.7371},{"match_name":"NW01 Tuesday Sectional","match_date":"2017-08-01","stage_classifiercode":"06-03","member_number":"A85544","first_name":"JASON","last_name":"HALL","classification":"B","division":"PRODUCTION","hit_factor":12.7226},{"match_name":"EAPS July 2016 USPSA","match_date":"2016-07-17","stage_classifiercode":"06-03","member_number":"PENDING","first_name":"THOMAS","last_name":"NOTO","classification":"U","division":"PRODUCTION","hit_factor":12.7226},{"match_name":"Richmond Hot Shots October 17-18-2020 USPSA Pistol","match_date":"2020-10-17","stage_classifiercode":"06-03","member_number":"A106663","first_name":"RICKEY","last_name":"INGRASSIA","classification":"M","division":"PRODUCTION","hit_factor":12.7226},{"match_name":"OFGC Practical Pistol Match Feb 21 2016","match_date":"2016-02-21","stage_classifiercode":"06-03","member_number":"A80515","first_name":"MICAH","last_name":"ROWE","classification":"A","division":"PRODUCTION","hit_factor":12.7108},{"match_name":"MAPSA 2016.04.09","match_date":"2016-04-09","stage_classifiercode":"06-03","member_number":"L3008","first_name":"MIKE","last_name":"BOFENKAMP","classification":"B","division":"PRODUCTION","hit_factor":12.7065},{"match_name":"MAPSA  2017 05 13","match_date":"2017-05-10","stage_classifiercode":"06-03","member_number":"TY84740","first_name":"ANDRE","last_name":"MITTELMARK","classification":"B","division":"PRODUCTION","hit_factor":12.7065},{"match_name":"A3G-APS October 13th USPSA Match","match_date":"2018-10-13","stage_classifiercode":"06-03","member_number":"TY89704","first_name":"ROB","last_name":"MOORE","classification":"B","division":"PRODUCTION","hit_factor":12.6904},{"match_name":"Pathfinder July USPSA Match","match_date":"2018-07-15","stage_classifiercode":"06-03","member_number":"TY23199","first_name":"DAN","last_name":"VAILLANCOURT","classification":"none","division":"PRODUCTION","hit_factor":12.6816},{"match_name":"2016 Columbia Cascade Section Championship","match_date":"2016-08-12","stage_classifiercode":"06-03","member_number":"A71593","first_name":"MATTHEW","last_name":"SWANSON","classification":"M","division":"PRODUCTION","hit_factor":12.6743},{"match_name":"WSRC USPSA 7/15/2017","match_date":"2017-07-15","stage_classifiercode":"06-03","member_number":"A99325","first_name":"TREVOR","last_name":"ARMSTRONG","classification":"C","division":"PRODUCTION","hit_factor":12.6743},{"match_name":"NCPS USPSA Handgun Match November 29 2015","match_date":"2015-11-29","stage_classifiercode":"06-03","member_number":"TY56287","first_name":"CHAD","last_name":"CASE","classification":"M","division":"PRODUCTION","hit_factor":12.6582},{"match_name":"Judes Peanut Butter Scissorhands","match_date":"2016-06-01","stage_classifiercode":"06-03","member_number":"a82831","first_name":"MATT","last_name":"BABB","classification":"A","division":"PRODUCTION","hit_factor":12.6582},{"match_name":"Detroit Sportsmens Congress - May 21 2017","match_date":"2017-05-21","stage_classifiercode":"06-03","member_number":"A91361","first_name":"JOE","last_name":"JARSKI","classification":"B","division":"PRODUCTION","hit_factor":12.6482},{"match_name":"FAS Sunday Outdoor USPSA Match","match_date":"2021-06-20","stage_classifiercode":"06-03","member_number":"A106432","first_name":"JASON","last_name":"PARRISH","classification":"A","division":"PRODUCTION","hit_factor":12.6289},{"match_name":"Central IL Practical Shooters IL02 Havana April USPSA","match_date":"2017-04-08","stage_classifiercode":"06-03","member_number":"A91182","first_name":"MATTHEW","last_name":"ACKER","classification":"B","division":"PRODUCTION","hit_factor":12.6289},{"match_name":"Pelham USPSA 2018-08-19","match_date":"2018-08-19","stage_classifiercode":"06-03","member_number":"TY67718","first_name":"CRAIG","last_name":"PHILLIPS","classification":"M","division":"PRODUCTION","hit_factor":12.6263},{"match_name":"Baileys July 2017","match_date":"2017-07-02","stage_classifiercode":"06-03","member_number":"a69840","first_name":"JOSHUA","last_name":"MAZZOLA","classification":"A","division":"PRODUCTION","hit_factor":12.6126},{"match_name":"MAPSA  2017 05 13","match_date":"2017-05-10","stage_classifiercode":"06-03","member_number":"A91699","first_name":"SHANE","last_name":"WURST","classification":"B","division":"PRODUCTION","hit_factor":12.6103},{"match_name":"Richmond Hot Shots October 17-18-2020 USPSA Pistol","match_date":"2020-10-17","stage_classifiercode":"06-03","member_number":"A84913","first_name":"ANDREW","last_name":"LY","classification":"M","division":"PRODUCTION","hit_factor":12.5964},{"match_name":"EHPSA USPSA 27 May 2018","match_date":"2018-05-27","stage_classifiercode":"06-03","member_number":"A85227","first_name":"JOHN","last_name":"RADINSKY","classification":"A","division":"PRODUCTION","hit_factor":12.5945},{"match_name":"Benton Gun Club-USPSA May 24","match_date":"2020-05-24","stage_classifiercode":"06-03","member_number":"a98705","first_name":"WES","last_name":"BRITTEN","classification":"A","division":"PRODUCTION","hit_factor":12.5945},{"match_name":"Rankin Field Sunday USPSA","match_date":"2017-11-19","stage_classifiercode":"06-03","member_number":"A94432","first_name":"GRANT","last_name":"SCOTT","classification":"B","division":"PRODUCTION","hit_factor":12.5945},{"match_name":"Shoot GTR USPSA Sep 6","match_date":"2016-09-06","stage_classifiercode":"06-03","member_number":"TY69089","first_name":"MATT","last_name":"MITCHELL","classification":"M","division":"PRODUCTION","hit_factor":12.5802},{"match_name":"WTPS USPSA Match 3-12-16","match_date":"2016-03-12","stage_classifiercode":"06-03","member_number":"a61662","first_name":"JORDAN","last_name":"OHLMANN","classification":"G","division":"PRODUCTION","hit_factor":12.5802},{"match_name":"WSRC USPSA 7/15/2017","match_date":"2017-07-15","stage_classifiercode":"06-03","member_number":"TY66904","first_name":"KENNETH","last_name":"RIHANEK","classification":"A","division":"PRODUCTION","hit_factor":12.5802},{"match_name":"Richmond Hot Shots February 20-21-2021 USPSA Pistol","match_date":"2021-02-20","stage_classifiercode":"06-03","member_number":"A107805","first_name":"HAL","last_name":"KO","classification":"A","division":"PRODUCTION","hit_factor":12.5802},{"match_name":"2016 Columbia Cascade Section Championship","match_date":"2016-08-12","stage_classifiercode":"06-03","member_number":"A88441","first_name":"KYLE","last_name":"SAYEG","classification":"A","division":"PRODUCTION","hit_factor":12.5786},{"match_name":"Competitive Shooters of Lake Norman CORNELIUS Thursday Evening Indoor USPSA Pistol Match North Carolina","match_date":"2018-11-01","stage_classifiercode":"06-03","member_number":"A106222","first_name":"DANIEL","last_name":"LEITH","classification":"M","division":"PRODUCTION","hit_factor":12.5654},{"match_name":"Eagles Nest August 20th","match_date":"2017-08-20","stage_classifiercode":"06-03","member_number":"A36953","first_name":"RYAN","last_name":"RAINES","classification":"A","division":"PRODUCTION","hit_factor":12.5654},{"match_name":"2016 Columbia Cascade Section Championship","match_date":"2016-08-12","stage_classifiercode":"06-03","member_number":"TY68705","first_name":"KYLE","last_name":"OSTRANDER","classification":"B","division":"PRODUCTION","hit_factor":12.5641},{"match_name":"Bitterroot Blasters September 2021 USPSA","match_date":"2021-09-26","stage_classifiercode":"06-03","member_number":"A126648","first_name":"TIMOTHY","last_name":"DOEPKER","classification":"B","division":"PRODUCTION","hit_factor":12.548},{"match_name":"SEPSA April 2017","match_date":"2017-04-08","stage_classifiercode":"06-03","member_number":"A88003","first_name":"RICH","last_name":"OTT","classification":"A","division":"PRODUCTION","hit_factor":12.5341},{"match_name":"OKCGC February USPSA Match","match_date":"2017-02-04","stage_classifiercode":"06-03","member_number":"a95184","first_name":"BRADFORD","last_name":"BONAR","classification":"C","division":"PRODUCTION","hit_factor":12.532},{"match_name":"PCSI - July 2018 USPSA","match_date":"2018-07-07","stage_classifiercode":"06-03","member_number":"A74935","first_name":"MASON","last_name":"MICHELSON","classification":"M","division":"PRODUCTION","hit_factor":12.532},{"match_name":"RBGC 2016-07-23","match_date":"2016-07-23","stage_classifiercode":"06-03","member_number":"A82223","first_name":"BRETT","last_name":"NETTLETON","classification":"M","division":"PRODUCTION","hit_factor":12.5313},{"match_name":"NPCCC 9-4-16 USPSA","match_date":"2016-09-04","stage_classifiercode":"06-03","member_number":"A92936","first_name":"MATT","last_name":"LITTLE","classification":"A","division":"PRODUCTION","hit_factor":12.5166},{"match_name":"Alpha Mike July 2021   ","match_date":"2021-07-18","stage_classifiercode":"06-03","member_number":"L4447","first_name":"CLAYTON","last_name":"SPURGEON","classification":"A","division":"PRODUCTION","hit_factor":12.5163},{"match_name":"2016 Memphis Charity Challenge","match_date":"2016-10-23","stage_classifiercode":"06-03","member_number":"A79635","first_name":"JAMISON","last_name":"MCCOLLISTER","classification":"B","division":"PRODUCTION","hit_factor":12.516},{"match_name":"MRPC USPSA July 2017","match_date":"2017-07-23","stage_classifiercode":"06-03","member_number":"\"\"","first_name":"ADRIAN","last_name":"SORAH","classification":"M","division":"PRODUCTION","hit_factor":12.516},{"match_name":"Atlanta Practical Shooters March 2016 USPSA - Classifier Match","match_date":"2016-03-06","stage_classifiercode":"06-03","member_number":"A86556","first_name":"KEVIN","last_name":"DEASE","classification":"A","division":"PRODUCTION","hit_factor":12.516},{"match_name":"Devil Dog USPSA Classifier Match-Saturday Session","match_date":"2018-03-10","stage_classifiercode":"06-03","member_number":"A71719","first_name":"ED","last_name":"CHASE","classification":"A","division":"PRODUCTION","hit_factor":12.516},{"match_name":"FAS Sunday Outdoor USPSA Match","match_date":"2021-06-20","stage_classifiercode":"06-03","member_number":"A126325","first_name":"CONNER","last_name":"STROCK","classification":"U","division":"PRODUCTION","hit_factor":12.5},{"match_name":"YRPA USPSA Classifier match January 2018 (resubmission)","match_date":"2018-01-28","stage_classifiercode":"06-03","member_number":"A92411","first_name":"CRAIG","last_name":"WORRELL","classification":"B","division":"PRODUCTION","hit_factor":12.5},{"match_name":"SFPC October 7 2018 USPSA Match","match_date":"2018-10-07","stage_classifiercode":"06-03","member_number":"B50","first_name":"LUIGI","last_name":"LI","classification":"B","division":"PRODUCTION","hit_factor":12.5},{"match_name":"PPS USPSA 2018-09-22","match_date":"2018-09-22","stage_classifiercode":"06-03","member_number":"A85006","first_name":"MIKE","last_name":"HACKEMEYER","classification":"B","division":"PRODUCTION","hit_factor":12.5},{"match_name":"PPPS 9-10-17","match_date":"2017-09-10","stage_classifiercode":"06-03","member_number":"A88502","first_name":"CHRIS","last_name":"PETERSON","classification":"C","division":"PRODUCTION","hit_factor":12.4688},{"match_name":"A3G-APS October 13th USPSA Match","match_date":"2018-10-13","stage_classifiercode":"06-03","member_number":"Ty87080","first_name":"SAMUEL","last_name":"HUBER","classification":"A","division":"PRODUCTION","hit_factor":12.4688},{"match_name":"Space Coast Practical Shooters","match_date":"2017-12-02","stage_classifiercode":"06-03","member_number":"A73571","first_name":"TONY","last_name":"VICHITTRA","classification":"M","division":"PRODUCTION","hit_factor":12.4682},{"match_name":"TMGN April 5 USPSA Classifiers Match","match_date":"2018-04-05","stage_classifiercode":"06-03","member_number":"\"\"","first_name":"JOHN","last_name":"CLARKE","classification":"\"\"","division":"PRODUCTION","hit_factor":12.4682},{"match_name":"Klamath USPSA 10-07-18 JSPS OR09","match_date":"2018-10-07","stage_classifiercode":"06-03","member_number":"L4425","first_name":"MITCH","last_name":"MORA","classification":"M","division":"PRODUCTION","hit_factor":12.4682},{"match_name":"APSC USPSA 7-7-2018","match_date":"2018-07-07","stage_classifiercode":"06-03","member_number":"A104422","first_name":"ALEX","last_name":"ACOSTA","classification":"B","division":"PRODUCTION","hit_factor":12.4533},{"match_name":"RCSC USPSA 26 June 16","match_date":"2016-06-26","stage_classifiercode":"06-03","member_number":"A64856","first_name":"DALE","last_name":"HUNTER","classification":"M","division":"PRODUCTION","hit_factor":12.4533},{"match_name":"AAFG USPSA July 30 Pistol  Classifier","match_date":"2016-07-30","stage_classifiercode":"06-03","member_number":"TY83421","first_name":"TREVOR","last_name":"SCHEUNEMAN","classification":"U","division":"PRODUCTION","hit_factor":12.4378},{"match_name":"SFPS 10-4-20 USPSA","match_date":"2020-10-04","stage_classifiercode":"06-03","member_number":"A56236","first_name":"JONATHAN","last_name":"ANDERSON","classification":"M","division":"PRODUCTION","hit_factor":12.4224},{"match_name":"TMGN December 21 Practical Shooter Match","match_date":"2017-12-22","stage_classifiercode":"06-03","member_number":"FY63108","first_name":"JUSTIN","last_name":"TITUS","classification":"\"\"","division":"PRODUCTION","hit_factor":12.4224},{"match_name":"NRG Saturday March 28th - Includes a Classifier Stage","match_date":"2020-03-28","stage_classifiercode":"06-03","member_number":"TY75431","first_name":"SIDNEY","last_name":"ABRAHAM","classification":"M","division":"PRODUCTION","hit_factor":12.4191},{"match_name":"LPRGC - Lower Providence USPSA October 2016","match_date":"2016-10-01","stage_classifiercode":"06-03","member_number":"TY72496","first_name":"ERIC","last_name":"KOSTERICH","classification":"B","division":"PRODUCTION","hit_factor":12.4069},{"match_name":"LdF 4th Saturday Match","match_date":"2015-12-26","stage_classifiercode":"06-03","member_number":"TY82278","first_name":"ROWDY","last_name":"BRICCO","classification":"M","division":"PRODUCTION","hit_factor":12.4051},{"match_name":"Pelham USPSA 2018-08-19","match_date":"2018-08-19","stage_classifiercode":"06-03","member_number":"TY76786","first_name":"ROBERT","last_name":"LACROIX","classification":"G","division":"PRODUCTION","hit_factor":12.4051},{"match_name":"D.I.D USPSA 11-8-20","match_date":"2020-11-07","stage_classifiercode":"06-03","member_number":"a113663","first_name":"LAWRENCE","last_name":"DANIELS","classification":"B","division":"PRODUCTION","hit_factor":12.4051},{"match_name":"DCPA USPSA 11- 20-2016","match_date":"2016-11-20","stage_classifiercode":"06-03","member_number":"TY77534","first_name":"KIVA","last_name":"SUTTON","classification":"U","division":"PRODUCTION","hit_factor":12.4051},{"match_name":"Chillicothe April-2018 USPSA Classifier Match","match_date":"2018-04-28","stage_classifiercode":"06-03","member_number":"A99831","first_name":"JASON","last_name":"ANGLIN","classification":"B","division":"PRODUCTION","hit_factor":12.3916},{"match_name":"Pioneer Action Shooters May 2017","match_date":"2017-05-28","stage_classifiercode":"06-03","member_number":"TY93368","first_name":"ALFRED","last_name":"BLAIS","classification":"B","division":"PRODUCTION","hit_factor":12.3916},{"match_name":"SCCCJULYCLASSIFIER2016","match_date":"2016-07-30","stage_classifiercode":"06-03","member_number":"ty80411","first_name":"MIKE","last_name":"ASAM","classification":"U","division":"PRODUCTION","hit_factor":12.3894},{"match_name":"BHPSC 11-20-2020","match_date":"2020-11-21","stage_classifiercode":"06-03","member_number":"A107271","first_name":"JEFF","last_name":"PICKMAN","classification":"U","division":"PRODUCTION","hit_factor":12.3894},{"match_name":"SCAPSA MN05 Fall League 4","match_date":"2017-08-29","stage_classifiercode":"06-03","member_number":"FY62355","first_name":"JUSTIN","last_name":"JOHNSON","classification":"B","division":"PRODUCTION","hit_factor":12.3894},{"match_name":"2016 Memphis Charity Challenge","match_date":"2016-10-23","stage_classifiercode":"06-03","member_number":"A95225","first_name":"GARRAN","last_name":"SINGLETON","classification":"M","division":"PRODUCTION","hit_factor":12.3871},{"match_name":"Tropang Vegas All Classifier Match","match_date":"2020-12-06","stage_classifiercode":"06-03","member_number":"TY114349","first_name":"CHARLIE","last_name":"WARD","classification":"U","division":"PRODUCTION","hit_factor":12.3762},{"match_name":"Square Deal Sportsmen November USPSA Match 2021","match_date":"2021-11-07","stage_classifiercode":"06-03","member_number":"A115000","first_name":"NIKOLAI","last_name":"LOPATOFSKY","classification":"M","division":"PRODUCTION","hit_factor":12.3762},{"match_name":"Repeat CSA Classifier Classic 040917","match_date":"2017-04-09","stage_classifiercode":"06-03","member_number":"TY85570","first_name":"DAVID","last_name":"MILLER","classification":"M","division":"PRODUCTION","hit_factor":12.3737},{"match_name":"Dundee Practical Shooters - March 24 2018 - Points","match_date":"2018-03-24","stage_classifiercode":"06-03","member_number":"A96364","first_name":"MICAH","last_name":"SWAN","classification":"B","division":"PRODUCTION","hit_factor":12.3737},{"match_name":"Uspsa Classifier","match_date":"2018-05-06","stage_classifiercode":"06-03","member_number":"TYF107866","first_name":"JOHN","last_name":"CUBBERLEY","classification":"U","division":"PRODUCTION","hit_factor":12.3609},{"match_name":"USPSA AR16 The Ancient and Honorable Pistol and Rifle Society of Baxter 8/7/21","match_date":"2021-08-07","stage_classifiercode":"06-03","member_number":"A44292","first_name":"RICHARD","last_name":"WATKINS","classification":"G","division":"PRODUCTION","hit_factor":12.3609},{"match_name":"NOCPC Oct 2017","match_date":"2017-10-08","stage_classifiercode":"06-03","member_number":"A68246","first_name":"RUSSELL","last_name":"MASKEY","classification":"G","division":"PRODUCTION","hit_factor":12.3522},{"match_name":"Space Coast Practical Shooters","match_date":"2017-12-02","stage_classifiercode":"06-03","member_number":"A14932","first_name":"DANNY","last_name":"CLIFTON","classification":"M","division":"PRODUCTION","hit_factor":12.3457},{"match_name":"RCPS USPSA November 17","match_date":"2018-11-17","stage_classifiercode":"06-03","member_number":"A106515","first_name":"JASON","last_name":"GILLIAM","classification":"B","division":"PRODUCTION","hit_factor":12.3426},{"match_name":"ALL CLASSIFIER SUMMERSLAM  -  AREA 59 2018","match_date":"2018-06-30","stage_classifiercode":"06-03","member_number":"A105891","first_name":"TIMOTHY","last_name":"SANDER","classification":"B","division":"PRODUCTION","hit_factor":12.3305},{"match_name":"RCSC USPSA 26 June 16","match_date":"2016-06-26","stage_classifiercode":"06-03","member_number":"a-57012","first_name":"ALBERT","last_name":"SALINAS","classification":"A","division":"PRODUCTION","hit_factor":12.327},{"match_name":"KSA USPSA May 2018","match_date":"2018-05-05","stage_classifiercode":"06-03","member_number":"TY91857","first_name":"THOMAS","last_name":"RICHARDSON","classification":"B","division":"PRODUCTION","hit_factor":12.3116},{"match_name":"NRG Saturday March 28th - Includes a Classifier Stage","match_date":"2020-03-28","stage_classifiercode":"06-03","member_number":"FY112947","first_name":"LENNY","last_name":"MAGILL","classification":"B","division":"PRODUCTION","hit_factor":12.2961},{"match_name":"SLOSA September 2018 USPSA Match","match_date":"2018-09-08","stage_classifiercode":"06-03","member_number":"\"\"","first_name":"JUSTIN","last_name":"ALVAREZ","classification":"A","division":"PRODUCTION","hit_factor":12.2951},{"match_name":"Shasta Shooters 2018 June Special Classifier","match_date":"2018-06-09","stage_classifiercode":"06-03","member_number":"TY86706","first_name":"CHRIS","last_name":"DEWEY","classification":"A","division":"PRODUCTION","hit_factor":12.285},{"match_name":"ASC USPSA Apr. 18","match_date":"2021-04-18","stage_classifiercode":"06-03","member_number":"TY92671","first_name":"ANDREW","last_name":"CAPOZZI","classification":"C","division":"PRODUCTION","hit_factor":12.285},{"match_name":"GTR USPSA Tues April 19","match_date":"2016-04-19","stage_classifiercode":"06-03","member_number":"A87746","first_name":"WILL","last_name":"HERRING","classification":"B","division":"PRODUCTION","hit_factor":12.285},{"match_name":"SCCC CLASSIFIER MATCH 7_23_17","match_date":"2017-07-23","stage_classifiercode":"06-03","member_number":"A100918","first_name":"MATT","last_name":"GREEN","classification":"B","division":"PRODUCTION","hit_factor":12.2699},{"match_name":"SAPSA July 2016","match_date":"2016-07-16","stage_classifiercode":"06-03","member_number":"L2633","first_name":"BRUCE","last_name":"WALLACE","classification":"M","division":"PRODUCTION","hit_factor":12.2699},{"match_name":"WVPPS May 2017","match_date":"2017-05-21","stage_classifiercode":"06-03","member_number":"A95783","first_name":"ROSS","last_name":"ROBERTSON","classification":"B","division":"PRODUCTION","hit_factor":12.2699},{"match_name":"MPPL 09022018","match_date":"2018-09-02","stage_classifiercode":"06-03","member_number":"TY84441","first_name":"SEAN","last_name":"HATADA","classification":"B","division":"PRODUCTION","hit_factor":12.2653},{"match_name":"Dundee Practical Shooters - March 24 2018 - Points","match_date":"2018-03-24","stage_classifiercode":"06-03","member_number":"TY68593","first_name":"KELLAR","last_name":"AUTUMN","classification":"M","division":"PRODUCTION","hit_factor":12.2653},{"match_name":"ACC July 26th USPSA","match_date":"2020-07-26","stage_classifiercode":"06-03","member_number":"L4784","first_name":"JONEL","last_name":"YAP","classification":"B","division":"PRODUCTION","hit_factor":12.2605},{"match_name":"Dundee Practical Shooters - March 24 2018 - Points","match_date":"2018-03-24","stage_classifiercode":"06-03","member_number":"TY81147","first_name":"FRANK","last_name":"DECASTRO","classification":"A","division":"PRODUCTION","hit_factor":12.2605},{"match_name":"Shoot GTR USPSA Sep 6","match_date":"2016-09-06","stage_classifiercode":"06-03","member_number":"TY94255","first_name":"SHANE","last_name":"BETHEA","classification":"A","division":"PRODUCTION","hit_factor":12.2549},{"match_name":"GoShoot Outdoors March 14th","match_date":"2020-03-14","stage_classifiercode":"06-03","member_number":"A109602","first_name":"BROCK","last_name":"THEENER","classification":"A","division":"PRODUCTION","hit_factor":12.2549},{"match_name":"WNPL USPSA Feb 2021","match_date":"2021-02-06","stage_classifiercode":"06-03","member_number":"TY95061","first_name":"JOHN","last_name":"WOOTEN","classification":"A","division":"PRODUCTION","hit_factor":12.2549},{"match_name":"BORCC USPSA July 2016","match_date":"2016-07-24","stage_classifiercode":"06-03","member_number":"A52548","first_name":"TERRY","last_name":"WASKUL","classification":"M","division":"PRODUCTION","hit_factor":12.25},{"match_name":"BRRC USPSA MAY 14 2016","match_date":"2016-05-14","stage_classifiercode":"06-03","member_number":"A92034","first_name":"DEREK","last_name":"PARKER","classification":"B","division":"PRODUCTION","hit_factor":12.25},{"match_name":"Piscataqua Master Blasters USPSA","match_date":"2018-09-02","stage_classifiercode":"06-03","member_number":"RD5","first_name":"PHIL","last_name":"STRADER","classification":"G","division":"PRODUCTION","hit_factor":12.25},{"match_name":"LdF 4th Saturday Match","match_date":"2015-12-26","stage_classifiercode":"06-03","member_number":"L3802","first_name":"JIM","last_name":"LEVIS","classification":"M","division":"PRODUCTION","hit_factor":12.2399},{"match_name":"Tropang Vegas All Classifier Match","match_date":"2020-12-06","stage_classifiercode":"06-03","member_number":"Ty59522","first_name":"AKOS","last_name":"MESTER","classification":"M","division":"PRODUCTION","hit_factor":12.2399},{"match_name":"SCAPSA MN05 Fall League 4","match_date":"2017-08-29","stage_classifiercode":"06-03","member_number":"A51907","first_name":"KERRY","last_name":"HODGES","classification":"A","division":"PRODUCTION","hit_factor":12.2399},{"match_name":"Triforce Practical Shooters at BigWoodsGoods 12-21-17","match_date":"2017-12-22","stage_classifiercode":"06-03","member_number":"A83187","first_name":"KEVIN","last_name":"BEARD","classification":"A","division":"PRODUCTION","hit_factor":12.2347},{"match_name":"OPSA November 2017","match_date":"2017-11-26","stage_classifiercode":"06-03","member_number":"A100381","first_name":"JUSTIN","last_name":"MARTINEZ","classification":"A","division":"PRODUCTION","hit_factor":12.2249},{"match_name":"Benton Gun Club-USPSA January 28 2018","match_date":"2018-01-28","stage_classifiercode":"06-03","member_number":"TY82278","first_name":"ROWDY","last_name":"BRICCO","classification":"M","division":"PRODUCTION","hit_factor":12.2249},{"match_name":"Strongpoint March 2017 Match","match_date":"2017-03-04","stage_classifiercode":"06-03","member_number":"A91748","first_name":"DOUG","last_name":"SCOTT","classification":"M","division":"PRODUCTION","hit_factor":12.2178},{"match_name":"Oakland County Sportsman's Club June 2021","match_date":"2021-06-05","stage_classifiercode":"06-03","member_number":"TY72326","first_name":"MATTHEW","last_name":"DECKER","classification":"M","division":"PRODUCTION","hit_factor":12.2137},{"match_name":"SLOSA JANUARY 2020 USPSA MATCH","match_date":"2020-01-11","stage_classifiercode":"06-03","member_number":"A107521","first_name":"MARK","last_name":"MELLO","classification":"B","division":"PRODUCTION","hit_factor":12.21},{"match_name":"Rankin Field Sunday USPSA","match_date":"2016-10-16","stage_classifiercode":"06-03","member_number":"A94432","first_name":"GRANT","last_name":"SCOTT","classification":"C","division":"PRODUCTION","hit_factor":12.2042},{"match_name":"APSC USPSA 7-7-2018","match_date":"2018-07-07","stage_classifiercode":"06-03","member_number":"TY77711","first_name":"DAVID","last_name":"REICHEK","classification":"M","division":"PRODUCTION","hit_factor":12.1951},{"match_name":"EHPSA USPSA 27 May 2018","match_date":"2018-05-27","stage_classifiercode":"06-03","member_number":"A75245","first_name":"JEFFERY","last_name":"FLETCHER","classification":"B","division":"PRODUCTION","hit_factor":12.1891},{"match_name":"Grandbaggers 07/2017","match_date":"2017-07-06","stage_classifiercode":"06-03","member_number":"TY84457","first_name":"CALEB","last_name":"TILLERY","classification":"A","division":"PRODUCTION","hit_factor":12.1891},{"match_name":"LIPSA - April 30th 2017 - USPSA Match Special Classifier","match_date":"2017-04-30","stage_classifiercode":"06-03","member_number":"A97814","first_name":"JUSTIN","last_name":"WONG","classification":"C","division":"PRODUCTION","hit_factor":12.1891},{"match_name":"SMPS USPSA Special Classifier Match - July 11th 2021","match_date":"2021-07-11","stage_classifiercode":"06-03","member_number":"TY130315","first_name":"DIEGO","last_name":"SANCHEZ LOPEZ","classification":"A","division":"PRODUCTION","hit_factor":12.1803},{"match_name":"ORPCI 2018.03.31 USPSA Special","match_date":"2018-03-31","stage_classifiercode":"06-03","member_number":"A95284","first_name":"JOHNATHAN","last_name":"PARKER","classification":"B","division":"PRODUCTION","hit_factor":12.1803},{"match_name":"Bayou City USPSA Weekly Mar 1","match_date":"2018-03-02","stage_classifiercode":"06-03","member_number":"TY87973","first_name":"WALDO","last_name":"SAMANO","classification":"B","division":"PRODUCTION","hit_factor":12.1762},{"match_name":"ANPRACS Classifier  Match 6-19-16","match_date":"2016-06-19","stage_classifiercode":"06-03","member_number":"\"\"","first_name":"KELLY","last_name":"MEARS","classification":"\"\"","division":"PRODUCTION","hit_factor":12.1739},{"match_name":"HRPC USPSA MAY 2017","match_date":"2017-05-13","stage_classifiercode":"06-03","member_number":"TY84186","first_name":"CHRIS","last_name":"MAGYAR","classification":"B","division":"PRODUCTION","hit_factor":12.1739},{"match_name":"WPS USPSA Special Classifier October 2017","match_date":"2017-10-28","stage_classifiercode":"06-03","member_number":"A72159","first_name":"TRAVIS","last_name":"LITTS","classification":"A","division":"PRODUCTION","hit_factor":12.1739},{"match_name":"BRC_20170409","match_date":"2017-04-09","stage_classifiercode":"06-03","member_number":"TY88502","first_name":"CHRIS","last_name":"PETERSON","classification":"B","division":"PRODUCTION","hit_factor":12.1673},{"match_name":"MISS Match 1/3/18","match_date":"2018-01-03","stage_classifiercode":"06-03","member_number":"a99834","first_name":"DAVID","last_name":"CIECKO","classification":"A","division":"PRODUCTION","hit_factor":12.1673},{"match_name":"Springfield Tactical Shooters 03/012018","match_date":"2018-03-01","stage_classifiercode":"06-03","member_number":"TY87747","first_name":"BARRY","last_name":"ROWE","classification":"B","division":"PRODUCTION","hit_factor":12.1673},{"match_name":"CCPL 02142016","match_date":"2016-02-14","stage_classifiercode":"06-03","member_number":"TY84531","first_name":"ERIC","last_name":"SWISHER","classification":"B","division":"PRODUCTION","hit_factor":12.1673},{"match_name":"APSA August 2020 USPSA match","match_date":"2020-08-08","stage_classifiercode":"06-03","member_number":"A125779","first_name":"ERIC","last_name":"WOOD","classification":"B","division":"PRODUCTION","hit_factor":12.1655},{"match_name":"ORSA USPSA April 2016","match_date":"2016-04-16","stage_classifiercode":"06-03","member_number":"A76106","first_name":"KEN","last_name":"HARDIN","classification":"A","division":"PRODUCTION","hit_factor":12.1655},{"match_name":"APSA June 2016 USPSA Match","match_date":"2016-06-11","stage_classifiercode":"06-03","member_number":"l4002","first_name":"STUART","last_name":"MURRAY","classification":"B","division":"PRODUCTION","hit_factor":12.1655},{"match_name":"NRG September 10th 2016","match_date":"2016-09-10","stage_classifiercode":"06-03","member_number":"a15883","first_name":"EDRICK","last_name":"ASUNCION","classification":"M","division":"PRODUCTION","hit_factor":12.1519},{"match_name":"DWB - Deadwood Boys USPSA 15 July 2018","match_date":"2018-07-15","stage_classifiercode":"06-03","member_number":"TY95244","first_name":"ALEX","last_name":"KO","classification":"A","division":"PRODUCTION","hit_factor":12.1507},{"match_name":"AIPS Weekly USPSA 29 June 2021","match_date":"2021-06-29","stage_classifiercode":"06-03","member_number":"A68875","first_name":"STACY","last_name":"NIEMANN","classification":"A","division":"PRODUCTION","hit_factor":12.1437},{"match_name":"Henry County Gun Club USPSA","match_date":"2021-10-09","stage_classifiercode":"06-03","member_number":"A123817","first_name":"JUSTIN","last_name":"KING","classification":"C","division":"PRODUCTION","hit_factor":12.1437},{"match_name":"LCSC Classifier 042918","match_date":"2018-04-28","stage_classifiercode":"06-03","member_number":"A110522","first_name":"JAKE","last_name":"MERTZ","classification":"U","division":"PRODUCTION","hit_factor":12.1359},{"match_name":"DWB - Deadwood Boys USPSA 18 October 2020","match_date":"2020-10-18","stage_classifiercode":"06-03","member_number":"A127013","first_name":"BRYCE","last_name":"EDWARDS","classification":"B","division":"PRODUCTION","hit_factor":12.1359},{"match_name":"OFGC Practical Pistol Match Feb 21 2016","match_date":"2016-02-21","stage_classifiercode":"06-03","member_number":"A89171","first_name":"AUSTIN","last_name":"CHAMBERLAIN","classification":"B","division":"PRODUCTION","hit_factor":12.1359},{"match_name":"AGC_20170205","match_date":"2017-02-05","stage_classifiercode":"06-03","member_number":"A85424","first_name":"RICHARD","last_name":"CLARE","classification":"A","division":"PRODUCTION","hit_factor":12.129},{"match_name":"LdF USPSA Match May 13 2017","match_date":"2017-05-13","stage_classifiercode":"06-03","member_number":"A88221","first_name":"JON","last_name":"BAUTISTA","classification":"M","division":"PRODUCTION","hit_factor":12.129},{"match_name":"ECPS USPSA 19 Aug 17","match_date":"2017-08-19","stage_classifiercode":"06-03","member_number":"TY103744","first_name":"DAN","last_name":"MCGRAW","classification":"U","division":"PRODUCTION","hit_factor":12.1287},{"match_name":"The Great Wet Classifier - Renton USPSA - November 2020 - NW05","match_date":"2020-11-22","stage_classifiercode":"06-03","member_number":"L4898","first_name":"MARCEL","last_name":"ENGLMAIER","classification":"U","division":"PRODUCTION","hit_factor":12.1287},{"match_name":"RPS May 2018 USPSA Match","match_date":"2018-05-12","stage_classifiercode":"06-03","member_number":"A98327","first_name":"ANGUS","last_name":"THOMAS","classification":"C","division":"PRODUCTION","hit_factor":12.1287},{"match_name":"2015 Ontelaunee Holiday Hosefest","match_date":"2015-12-26","stage_classifiercode":"06-03","member_number":"\"\"","first_name":"AL","last_name":"MONCH","classification":"B","division":"PRODUCTION","hit_factor":12.1287},{"match_name":"Space Coast Practical Shooters","match_date":"2017-12-02","stage_classifiercode":"06-03","member_number":"F89345","first_name":"GERARDO","last_name":"HIDALGO","classification":"A","division":"PRODUCTION","hit_factor":12.1212},{"match_name":"LCHG September 2018 USPSA Special Classifier","match_date":"2018-09-08","stage_classifiercode":"06-03","member_number":"A101416","first_name":"SLADE","last_name":"BETTENHAUSEN","classification":"C","division":"PRODUCTION","hit_factor":12.1212},{"match_name":"WSRC USPSA 7/15/2017","match_date":"2017-07-15","stage_classifiercode":"06-03","member_number":"A95915","first_name":"WILLIAM","last_name":"BERKEMEIER SUNDAY","classification":"B","division":"PRODUCTION","hit_factor":12.1212},{"match_name":"HTF Practical Shooter Classifer","match_date":"2017-11-02","stage_classifiercode":"06-03","member_number":"A81425","first_name":"CHASE","last_name":"LANE","classification":"M","division":"PRODUCTION","hit_factor":12.1212},{"match_name":"MS06 Team Magnolia USPSA","match_date":"2017-03-05","stage_classifiercode":"06-03","member_number":"A82324","first_name":"COREY","last_name":"MITCHELL","classification":"A","division":"PRODUCTION","hit_factor":12.1134},{"match_name":"SCCC CLASSIFIER MATCH 7_23_17","match_date":"2017-07-23","stage_classifiercode":"06-03","member_number":"A92832","first_name":"JEFF","last_name":"PERDUE","classification":"A","division":"PRODUCTION","hit_factor":12.1065},{"match_name":"Benton Gun Club-USPSA January 28 2018","match_date":"2018-01-28","stage_classifiercode":"06-03","member_number":"A98705","first_name":"WES","last_name":"BRITTEN","classification":"B","division":"PRODUCTION","hit_factor":12.1065},{"match_name":"WSRC USPSA 7/15/2017","match_date":"2017-07-15","stage_classifiercode":"06-03","member_number":"a52438","first_name":"DAVE","last_name":"HARTER","classification":"A","division":"PRODUCTION","hit_factor":12.1059},{"match_name":"RBGC 2016-07-23","match_date":"2016-07-23","stage_classifiercode":"06-03","member_number":"TY75523","first_name":"BILAL","last_name":"SINNO","classification":"A","division":"PRODUCTION","hit_factor":12.1053},{"match_name":"bgs Hudson Week 1","match_date":"2016-11-27","stage_classifiercode":"06-03","member_number":"A86153","first_name":"ARIC","last_name":"NILSON","classification":"B","division":"PRODUCTION","hit_factor":12.0988},{"match_name":"MASTER BLASTERS & SSFGA USPSA - September","match_date":"2020-09-19","stage_classifiercode":"06-03","member_number":"TY101366","first_name":"HANK","last_name":"POIRIER","classification":"B","division":"PRODUCTION","hit_factor":12.0978},{"match_name":"Fort Wayne USPSA September 2020","match_date":"2020-09-20","stage_classifiercode":"06-03","member_number":"TY121041","first_name":"CHASE","last_name":"WILLIAMS","classification":"B","division":"PRODUCTION","hit_factor":12.0919},{"match_name":"MCTS @ Rattlesnake Ridge USPSA 11/2017","match_date":"2017-11-10","stage_classifiercode":"06-03","member_number":"FY83899","first_name":"MICHAEL","last_name":"BRESSON","classification":"A","division":"PRODUCTION","hit_factor":12.0838},{"match_name":"GRPC USPSA DOG DAYS OF SUMMER","match_date":"2017-08-06","stage_classifiercode":"06-03","member_number":"A100819","first_name":"ROBERTO","last_name":"CIFUENTES","classification":"B","division":"PRODUCTION","hit_factor":12.0773},{"match_name":"LPRGC - Lower Providence USPSA October 2016","match_date":"2016-10-01","stage_classifiercode":"06-03","member_number":"FY81518","first_name":"ANTHONY","last_name":"CAPONIGRO","classification":"B","division":"PRODUCTION","hit_factor":12.0773},{"match_name":"Hammer Down USPSA Tue Night","match_date":"2017-11-22","stage_classifiercode":"06-03","member_number":"A57378","first_name":"RYAN","last_name":"ZAMBERLAN","classification":"M","division":"PRODUCTION","hit_factor":12.0773},{"match_name":"Brothers N Arms August 2016 USPSA Match","match_date":"2016-08-27","stage_classifiercode":"06-03","member_number":"A72544","first_name":"JASON","last_name":"WELCH","classification":"M","division":"PRODUCTION","hit_factor":12.0773},{"match_name":"Pelham USPSA 2018-08-19","match_date":"2018-08-19","stage_classifiercode":"06-03","member_number":"TY98390","first_name":"MIKE","last_name":"COLE","classification":"B","division":"PRODUCTION","hit_factor":12.069},{"match_name":"BRC_20170409","match_date":"2017-04-09","stage_classifiercode":"06-03","member_number":"A101238","first_name":"RYAN","last_name":"BERTRAND","classification":"U","division":"PRODUCTION","hit_factor":12.069},{"match_name":"EWPSA 2018-07 -M","match_date":"2018-07-15","stage_classifiercode":"06-03","member_number":"A102902","first_name":"JORDAN","last_name":"GODWIN","classification":"B","division":"PRODUCTION","hit_factor":12.069},{"match_name":"Rankin Field April (ALL CLASSIFIER) Saturday USPSA","match_date":"2021-04-03","stage_classifiercode":"06-03","member_number":"TY94432","first_name":"GRANT","last_name":"SCOTT","classification":"A","division":"PRODUCTION","hit_factor":12.0627},{"match_name":"SCS USPSA Pistol with Classifer - Special Classifier July 31 2016","match_date":"2016-07-31","stage_classifiercode":"06-03","member_number":"A-91529","first_name":"HRISTOV","last_name":"ROSSEN","classification":"M","division":"PRODUCTION","hit_factor":12.0627},{"match_name":"ORPCI 2016.10.15 Pistol","match_date":"2016-10-15","stage_classifiercode":"06-03","member_number":"A79180","first_name":"SCOTT","last_name":"KATZ","classification":"A","division":"PRODUCTION","hit_factor":12.0627},{"match_name":"RBGC 2016-07-23","match_date":"2016-07-23","stage_classifiercode":"06-03","member_number":"A94675","first_name":"RICK","last_name":"THOMPSON","classification":"C","division":"PRODUCTION","hit_factor":12.0541},{"match_name":"Pioneer Action Shooters May 2017","match_date":"2017-05-28","stage_classifiercode":"06-03","member_number":"A79813","first_name":"JOEL","last_name":"PENNEY","classification":"M","division":"PRODUCTION","hit_factor":12.0541},{"match_name":"Springfield Tactical Shooters 04-07-2016","match_date":"2016-04-07","stage_classifiercode":"06-03","member_number":"FY59095","first_name":"SHELBY","last_name":"STOCKTON","classification":"M","division":"PRODUCTION","hit_factor":12.0482},{"match_name":"RBGC 2016-07-23","match_date":"2016-07-23","stage_classifiercode":"06-03","member_number":"A76603","first_name":"TYLER","last_name":"INGRAM","classification":"G","division":"PRODUCTION","hit_factor":12.0464},{"match_name":"KSA USPSA June 2017","match_date":"2017-06-03","stage_classifiercode":"06-03","member_number":"A94749","first_name":"JOHN","last_name":"BURCH","classification":"C","division":"PRODUCTION","hit_factor":12.0393},{"match_name":"STAGE ZERO USPSA","match_date":"2021-08-14","stage_classifiercode":"06-03","member_number":"A116423","first_name":"JACOB","last_name":"PARKER","classification":"A","division":"PRODUCTION","hit_factor":12.0393},{"match_name":"ALL CLASSIFIER SUMMERSLAM  -  AREA 59 2018","match_date":"2018-06-30","stage_classifiercode":"06-03","member_number":"A105111","first_name":"KEVIN","last_name":"BUNURAI","classification":"C","division":"PRODUCTION","hit_factor":12.0393},{"match_name":"SCCCJULYCLASSIFIER2016","match_date":"2016-07-30","stage_classifiercode":"06-03","member_number":"ty89356","first_name":"CHASE","last_name":"HARBER","classification":"M","division":"PRODUCTION","hit_factor":12.0393},{"match_name":"Shasta Shooters 2020 Jun","match_date":"2020-06-13","stage_classifiercode":"06-03","member_number":"TY86706","first_name":"CHRIS","last_name":"DEWEY","classification":"A","division":"PRODUCTION","hit_factor":12.0337},{"match_name":"SAPSA July 2016","match_date":"2016-07-16","stage_classifiercode":"06-03","member_number":"A95648","first_name":"BLAINE","last_name":"DAPRA","classification":"U","division":"PRODUCTION","hit_factor":12.0337},{"match_name":"BHPSC Monthy Match September 2018","match_date":"2018-09-28","stage_classifiercode":"06-03","member_number":"TY94822","first_name":"ADAM","last_name":"TRAN","classification":"A","division":"PRODUCTION","hit_factor":12.0337},{"match_name":"TTS OUTLAW PISTOL 8SEP2018","match_date":"2018-09-08","stage_classifiercode":"06-03","member_number":"TY99638","first_name":"JAMES","last_name":"AMBERG","classification":"B","division":"PRODUCTION","hit_factor":12.0337},{"match_name":"FBPPC JULY 2021 USPSA SPECIAL CLASSIFIER MATCH","match_date":"2021-07-10","stage_classifiercode":"06-03","member_number":"TY26269","first_name":"ALLEN","last_name":"PARSONS","classification":"A","division":"PRODUCTION","hit_factor":12.0245},{"match_name":"Bayou City Weekly","match_date":"2016-01-28","stage_classifiercode":"06-03","member_number":"A84205","first_name":"ARON","last_name":"GIVELBER","classification":"B","division":"PRODUCTION","hit_factor":12.0245},{"match_name":"MRPC USPSA July 2017","match_date":"2017-07-23","stage_classifiercode":"06-03","member_number":"TY71809","first_name":"JOHN","last_name":"SMITH","classification":"A","division":"PRODUCTION","hit_factor":12.0205},{"match_name":"Shasta Shooters 2020 Jun","match_date":"2020-06-13","stage_classifiercode":"06-03","member_number":"Fy89662","first_name":"TODD","last_name":"CANCILLA","classification":"A","division":"PRODUCTION","hit_factor":12.0192},{"match_name":"Nampa USPSA June 26th 2021","match_date":"2021-06-26","stage_classifiercode":"06-03","member_number":"L3972","first_name":"EVANS","last_name":"KUO","classification":"A","division":"PRODUCTION","hit_factor":12.0192},{"match_name":"MS06 Team Magnolia USPSA","match_date":"2017-03-05","stage_classifiercode":"06-03","member_number":"A81552","first_name":"RUSS","last_name":"SMITH","classification":"B","division":"PRODUCTION","hit_factor":12.015},{"match_name":"WLPS USPSA August 2020","match_date":"2020-08-23","stage_classifiercode":"06-03","member_number":"A107679","first_name":"SAMUEL","last_name":"COWAN","classification":"U","division":"PRODUCTION","hit_factor":12.0098},{"match_name":"MRCPS  USPSA MARCH","match_date":"2017-03-19","stage_classifiercode":"06-03","member_number":"TY67558","first_name":"JOSHUA","last_name":"GLASTRA","classification":"B","division":"PRODUCTION","hit_factor":12.0051},{"match_name":"XMG USPSA 2nd Saturday Match","match_date":"2020-11-14","stage_classifiercode":"06-03","member_number":"ty48838","first_name":"TING","last_name":"SUN","classification":"A","division":"PRODUCTION","hit_factor":12.0048},{"match_name":"NRG September 10th 2016","match_date":"2016-09-10","stage_classifiercode":"06-03","member_number":"\"\"","first_name":"ANDREW","last_name":"WRIGHT","classification":"U","division":"PRODUCTION","hit_factor":12.0048},{"match_name":"SAPSA July 2016","match_date":"2016-07-16","stage_classifiercode":"06-03","member_number":"TY62017","first_name":"STEVEN","last_name":"LOH","classification":"B","division":"PRODUCTION","hit_factor":12.0048},{"match_name":"SMPSA 2016-07 Pistol","match_date":"2016-07-10","stage_classifiercode":"06-03","member_number":"FY90633","first_name":"BRANT","last_name":"PACE","classification":"B","division":"PRODUCTION","hit_factor":11.9951},{"match_name":"Uspsa Classifier","match_date":"2018-05-06","stage_classifiercode":"06-03","member_number":"F108937","first_name":"RYAN","last_name":"DOBBS","classification":"B","division":"PRODUCTION","hit_factor":11.9951},{"match_name":"BPSA April 2017 USPSA","match_date":"2017-04-23","stage_classifiercode":"06-03","member_number":"A76040","first_name":"STEVEN","last_name":"MOSHER","classification":"A","division":"PRODUCTION","hit_factor":11.9951},{"match_name":"WTPS June 26th USPSA","match_date":"2021-06-26","stage_classifiercode":"06-03","member_number":"A119863","first_name":"BRETT","last_name":"THOMAS","classification":"A","division":"PRODUCTION","hit_factor":11.9904},{"match_name":"NWAS Special Classifier Night 11/28/2018","match_date":"2018-11-29","stage_classifiercode":"06-03","member_number":"A112998","first_name":"MATT","last_name":"WILLIAMS","classification":"B","division":"PRODUCTION","hit_factor":11.9904},{"match_name":"Hose Monster Action","match_date":"2020-02-16","stage_classifiercode":"06-03","member_number":"a97497","first_name":"ROBERT","last_name":"FRESHWATER","classification":"A","division":"PRODUCTION","hit_factor":11.9904},{"match_name":"Magnolia Rifle and Pistol Club July classifier match","match_date":"2021-07-03","stage_classifiercode":"06-03","member_number":"A126604","first_name":"JEFF","last_name":"STEWART","classification":"B","division":"PRODUCTION","hit_factor":11.985},{"match_name":"BGS  Hudson Week 2","match_date":"2018-12-10","stage_classifiercode":"06-03","member_number":"A86153","first_name":"ARIC","last_name":"NILSON","classification":"B","division":"PRODUCTION","hit_factor":11.9804},{"match_name":"MAPSA  2017 05 13","match_date":"2017-05-10","stage_classifiercode":"06-03","member_number":"A72549","first_name":"ANDRE","last_name":"DESAUTEL","classification":"M","division":"PRODUCTION","hit_factor":11.976},{"match_name":"Shoot GTR USPSA 1/23","match_date":"2017-01-23","stage_classifiercode":"06-03","member_number":"TY69089","first_name":"MATT","last_name":"MITCHELL","classification":"G","division":"PRODUCTION","hit_factor":11.9745},{"match_name":"Sharp Practical Shooters November USPSA Match","match_date":"2017-11-26","stage_classifiercode":"06-03","member_number":"a102801","first_name":"CHRISTOPHER","last_name":"HOWARD","classification":"X","division":"PRODUCTION","hit_factor":11.9745},{"match_name":"Tidewater Practical Shooter April 26th Uspsa Match","match_date":"2021-04-26","stage_classifiercode":"06-03","member_number":"A132073","first_name":"NICK","last_name":"NITTOLO","classification":"U","division":"PRODUCTION","hit_factor":11.9701},{"match_name":"SOAP April 2021 USPSA Match","match_date":"2021-04-10","stage_classifiercode":"06-03","member_number":"A68712","first_name":"JOHN","last_name":"SAOB","classification":"A","division":"PRODUCTION","hit_factor":11.9658},{"match_name":"Richmond October 17-18-2015","match_date":"2015-10-17","stage_classifiercode":"06-03","member_number":"TY71640","first_name":"JAMES","last_name":"YEOM","classification":"M","division":"PRODUCTION","hit_factor":11.9617},{"match_name":"Brothers N Arms August 2016 USPSA Match","match_date":"2016-08-27","stage_classifiercode":"06-03","member_number":"A82466","first_name":"THOMAS","last_name":"ARTHUR","classification":"B","division":"PRODUCTION","hit_factor":11.9617},{"match_name":"HRPC USPSA MAY 2017","match_date":"2017-05-13","stage_classifiercode":"06-03","member_number":"A96937","first_name":"JEREMY","last_name":"PETIX","classification":"C","division":"PRODUCTION","hit_factor":11.9474},{"match_name":"BUAS January Match","match_date":"2018-01-14","stage_classifiercode":"06-03","member_number":"ty79508","first_name":"SHANE","last_name":"FUNGAFAT","classification":"A","division":"PRODUCTION","hit_factor":11.9474},{"match_name":"MPPL USPSA Match  11062016","match_date":"2016-11-06","stage_classifiercode":"06-03","member_number":"TY84441","first_name":"SEAN","last_name":"HATADA","classification":"B","division":"PRODUCTION","hit_factor":11.9403},{"match_name":"Baghdad IPSC Match 8-5-2017","match_date":"2017-08-05","stage_classifiercode":"06-03","member_number":"L4193","first_name":"PAUL","last_name":"PERKERSON","classification":"\"\"","division":"PRODUCTION","hit_factor":11.9367},{"match_name":"GTR USPSA Tues April 19","match_date":"2016-04-19","stage_classifiercode":"06-03","member_number":"A21361","first_name":"JIMMY","last_name":"OWENS","classification":"B","division":"PRODUCTION","hit_factor":11.9367},{"match_name":"FBPPC JULY 2021 USPSA SPECIAL CLASSIFIER MATCH","match_date":"2021-07-10","stage_classifiercode":"06-03","member_number":"TY71195","first_name":"ADAM","last_name":"HYMAS","classification":"A","division":"PRODUCTION","hit_factor":11.9332},{"match_name":"NW01 Tuesday Sectional","match_date":"2017-08-01","stage_classifiercode":"06-03","member_number":"A85001","first_name":"MATTHEW","last_name":"CARLSON","classification":"A","division":"PRODUCTION","hit_factor":11.9332},{"match_name":"GoShoot Outdoors February  6th","match_date":"2021-02-06","stage_classifiercode":"06-03","member_number":"L4978","first_name":"SCOTT","last_name":"THOMAS","classification":"B","division":"PRODUCTION","hit_factor":11.9332},{"match_name":"MISS Match 12-7-16","match_date":"2016-12-06","stage_classifiercode":"06-03","member_number":"TY67601","first_name":"RUSSEL","last_name":"DESALVO","classification":"A","division":"PRODUCTION","hit_factor":11.9255},{"match_name":"PSAC 20180922","match_date":"2018-09-22","stage_classifiercode":"06-03","member_number":"TY88502","first_name":"CHRISTIAN","last_name":"PETERSON","classification":"A","division":"PRODUCTION","hit_factor":11.9255},{"match_name":"Brothers N Arms August 2016 USPSA Match","match_date":"2016-08-27","stage_classifiercode":"06-03","member_number":"A78083","first_name":"JEFFREY","last_name":"BLITCH","classification":"B","division":"PRODUCTION","hit_factor":11.9221},{"match_name":"FBPPC October 2021 USPSA MATCH","match_date":"2021-10-09","stage_classifiercode":"06-03","member_number":"TY71195","first_name":"ADAM","last_name":"HYMAS","classification":"A","division":"PRODUCTION","hit_factor":11.9221},{"match_name":"BRRC USPSA MAY 14 2016","match_date":"2016-05-14","stage_classifiercode":"06-03","member_number":"A82327","first_name":"BRIAN","last_name":"SIX","classification":"B","division":"PRODUCTION","hit_factor":11.9048},{"match_name":"\"","match_date":"2018-08-11","stage_classifiercode":"06-03","member_number":"A108184","first_name":"SUNG","last_name":"HONG","classification":"B","division":"PRODUCTION","hit_factor":11.8987},{"match_name":"Richmond Hot Shots October 17-18-2020 USPSA Pistol","match_date":"2020-10-17","stage_classifiercode":"06-03","member_number":"A107805","first_name":"HAL","last_name":"KO","classification":"B","division":"PRODUCTION","hit_factor":11.8932},{"match_name":"Richmond Hot Shots February 20-21-2021 USPSA Pistol","match_date":"2021-02-20","stage_classifiercode":"06-03","member_number":"A68712","first_name":"JOHN","last_name":"SAOB","classification":"A","division":"PRODUCTION","hit_factor":11.8906},{"match_name":"WSRC USPSA 7/15/2017","match_date":"2017-07-15","stage_classifiercode":"06-03","member_number":"A52438","first_name":"DAVID","last_name":"HARTER","classification":"A","division":"PRODUCTION","hit_factor":11.889},{"match_name":"CCPL 02142016","match_date":"2016-02-14","stage_classifiercode":"06-03","member_number":"A77402","first_name":"BRIAN","last_name":"LUM","classification":"B","division":"PRODUCTION","hit_factor":11.8837},{"match_name":"USPSA AR02 North Arkansas Action Pistol July 12th","match_date":"2020-07-12","stage_classifiercode":"06-03","member_number":"a44292","first_name":"RICHARD","last_name":"WATKINS","classification":"U","division":"PRODUCTION","hit_factor":11.8788},{"match_name":"Richmond October 17-18-2015","match_date":"2015-10-17","stage_classifiercode":"06-03","member_number":"A54989","first_name":"JOHN","last_name":"PRALL","classification":"M","division":"PRODUCTION","hit_factor":11.8788},{"match_name":"March 2017 PCSI USPSA","match_date":"2017-03-04","stage_classifiercode":"06-03","member_number":"A79476","first_name":"SCOTT","last_name":"PIRAINO","classification":"M","division":"PRODUCTION","hit_factor":11.8788},{"match_name":"MCTS @ Rattlesnake Ridge USPSA 11/2017","match_date":"2017-11-10","stage_classifiercode":"06-03","member_number":"TY91554","first_name":"MICHAEL","last_name":"ISHIDA","classification":"B","division":"PRODUCTION","hit_factor":11.8788},{"match_name":"OFGC Practical Pistol Match Feb 21 2016","match_date":"2016-02-21","stage_classifiercode":"06-03","member_number":"fy65816","first_name":"WILLIAM","last_name":"CHANGOSE","classification":"A","division":"PRODUCTION","hit_factor":11.8788},{"match_name":"BRRC USPSA MAY 14 2016","match_date":"2016-05-14","stage_classifiercode":"06-03","member_number":"A89578","first_name":"DENNIS","last_name":"DOZA","classification":"B","division":"PRODUCTION","hit_factor":11.8765},{"match_name":"Southern Maryland Practical Shooters 14 October 2018 USPSA","match_date":"2018-10-14","stage_classifiercode":"06-03","member_number":"TY87233","first_name":"ANDREW","last_name":"STEIN","classification":"A","division":"PRODUCTION","hit_factor":11.8765},{"match_name":"Pinetucky USPSA 07-15-17","match_date":"2017-07-15","stage_classifiercode":"06-03","member_number":"A88177","first_name":"CHRIS","last_name":"SMITH","classification":"B","division":"PRODUCTION","hit_factor":11.871},{"match_name":"\"","match_date":"2018-08-11","stage_classifiercode":"06-03","member_number":"A97885","first_name":"TODD","last_name":"ANDERSON","classification":"M","division":"PRODUCTION","hit_factor":11.8644},{"match_name":"EAGC September 2016 USPSA Pistol Match","match_date":"2016-09-18","stage_classifiercode":"06-03","member_number":"\"\"","first_name":"MATTHEW","last_name":"ANSLEY","classification":"U","division":"PRODUCTION","hit_factor":11.8644},{"match_name":"Coastal Area Practical Shooters  12-26-15","match_date":"2015-12-26","stage_classifiercode":"06-03","member_number":"A62597","first_name":"TANNER","last_name":"TRUNNELL","classification":"B","division":"PRODUCTION","hit_factor":11.8644},{"match_name":"STAGE ZERO SHOOTING SUPPLY USPSA","match_date":"2020-07-16","stage_classifiercode":"06-03","member_number":"TY35970","first_name":"JERRY","last_name":"NGUYEN","classification":"C","division":"PRODUCTION","hit_factor":11.8644},{"match_name":"MISS Match 1/3/18","match_date":"2018-01-03","stage_classifiercode":"06-03","member_number":"A95068","first_name":"PETE","last_name":"CARLSON","classification":"C","division":"PRODUCTION","hit_factor":11.8644},{"match_name":"WVPPS June 2018","match_date":"2018-06-17","stage_classifiercode":"06-03","member_number":"A86158","first_name":"JONATHAN","last_name":"MAGALLANES","classification":"M","division":"PRODUCTION","hit_factor":11.8644},{"match_name":"GoShoot Outdoors March 14th","match_date":"2020-03-14","stage_classifiercode":"06-03","member_number":"A123998","first_name":"JOSH","last_name":"MARTIN","classification":"A","division":"PRODUCTION","hit_factor":11.8624},{"match_name":"2016 Memphis Charity Challenge","match_date":"2016-10-23","stage_classifiercode":"06-03","member_number":"TY82278","first_name":"ROWDY","last_name":"BRICCO","classification":"M","division":"PRODUCTION","hit_factor":11.8624},{"match_name":"MRPC USPSA July 2017","match_date":"2017-07-23","stage_classifiercode":"06-03","member_number":"TY92693","first_name":"ANDREW","last_name":"DURKEE","classification":"U","division":"PRODUCTION","hit_factor":11.8624},{"match_name":"Custer March Classifier Match","match_date":"2018-03-04","stage_classifiercode":"06-03","member_number":"A80160","first_name":"JORDON","last_name":"CASTRO","classification":"A","division":"PRODUCTION","hit_factor":11.8624},{"match_name":"Eagles Nest August 20th","match_date":"2017-08-20","stage_classifiercode":"06-03","member_number":"A97336","first_name":"JOHN","last_name":"TURNER","classification":"B","division":"PRODUCTION","hit_factor":11.8624},{"match_name":"SCCCJULYCLASSIFIER2016","match_date":"2016-07-30","stage_classifiercode":"06-03","member_number":"ty78920","first_name":"MIKE","last_name":"MOSER","classification":"M","division":"PRODUCTION","hit_factor":11.8501},{"match_name":"Baghdad IPSC Match 8-5-2017","match_date":"2017-08-05","stage_classifiercode":"06-03","member_number":"A57959","first_name":"SCOTT","last_name":"MCGRATH","classification":"\"\"","division":"PRODUCTION","hit_factor":11.8501},{"match_name":"MRCPS  USPSA MARCH","match_date":"2017-03-19","stage_classifiercode":"06-03","member_number":"FY71021","first_name":"ARRUN","last_name":"OUCH","classification":"M","division":"PRODUCTION","hit_factor":11.8501},{"match_name":"ALL CLASSIFIER SUMMERSLAM  -  AREA 59 2018","match_date":"2018-06-30","stage_classifiercode":"06-03","member_number":"A102227","first_name":"BEN","last_name":"BLACKSTONE","classification":"C","division":"PRODUCTION","hit_factor":11.8483},{"match_name":"Uspsa Classifier","match_date":"2018-05-06","stage_classifiercode":"06-03","member_number":"F102832","first_name":"JOHN","last_name":"LOSTRACCO","classification":"B","division":"PRODUCTION","hit_factor":11.8483},{"match_name":"DWB - Deadwood Boys USPSA 15 July 2018","match_date":"2018-07-15","stage_classifiercode":"06-03","member_number":"L2660","first_name":"MARTIN","last_name":"CATUNGAL","classification":"C","division":"PRODUCTION","hit_factor":11.8483},{"match_name":"WLPS USPSA August 2020","match_date":"2020-08-23","stage_classifiercode":"06-03","member_number":"A116317","first_name":"RICK","last_name":"MCBRIDE","classification":"C","division":"PRODUCTION","hit_factor":11.8483},{"match_name":"MCRC USPSA July 2018","match_date":"2018-07-14","stage_classifiercode":"06-03","member_number":"TY87299","first_name":"SCOTTY","last_name":"SIMPSON","classification":"A","division":"PRODUCTION","hit_factor":11.8483},{"match_name":"OOPS February 2016","match_date":"2016-02-27","stage_classifiercode":"06-03","member_number":"A86347","first_name":"DUSTIN","last_name":"HOUGHTON","classification":"B","division":"PRODUCTION","hit_factor":11.8483},{"match_name":"MRCPS  USPSA MARCH","match_date":"2017-03-19","stage_classifiercode":"06-03","member_number":"A85001","first_name":"MATTHEW","last_name":"CARLSON","classification":"A","division":"PRODUCTION","hit_factor":11.8483},{"match_name":"\"","match_date":"2018-08-11","stage_classifiercode":"06-03","member_number":"A108054","first_name":"MYRON","last_name":"CHIU","classification":"C","division":"PRODUCTION","hit_factor":11.8357},{"match_name":"March 2017 PCSI USPSA","match_date":"2017-03-04","stage_classifiercode":"06-03","member_number":"TY79620","first_name":"DAVID","last_name":"BLAIR","classification":"B","division":"PRODUCTION","hit_factor":11.8357},{"match_name":"BTSA USPSA 2016-8","match_date":"2016-08-28","stage_classifiercode":"06-03","member_number":"F88608","first_name":"STEVE","last_name":"HESTER","classification":"A","division":"PRODUCTION","hit_factor":11.8357},{"match_name":"RBGC 2016-07-23","match_date":"2016-07-23","stage_classifiercode":"06-03","member_number":"FY56598","first_name":"KEVIN","last_name":"ALLEN","classification":"A","division":"PRODUCTION","hit_factor":11.8343},{"match_name":"WAC August 22nd (4th Sunday) - ALL CLASSIFIER USPSA 6 Stage Match","match_date":"2021-08-22","stage_classifiercode":"06-03","member_number":"A102045","first_name":"ZAC","last_name":"GAILEY","classification":"U","division":"PRODUCTION","hit_factor":11.8343},{"match_name":"TCGC Polo August 2017","match_date":"2017-08-20","stage_classifiercode":"06-03","member_number":"TY90211","first_name":"JASON","last_name":"DOWNS","classification":"B","division":"PRODUCTION","hit_factor":11.8252},{"match_name":"STAGE ZERO SHOOTING SUPPLY USPSA","match_date":"2020-07-16","stage_classifiercode":"06-03","member_number":"A116423","first_name":"JACOB","last_name":"PARKER","classification":"B","division":"PRODUCTION","hit_factor":11.8239},{"match_name":"AGC_20170205","match_date":"2017-02-05","stage_classifiercode":"06-03","member_number":"A88502","first_name":"CHRIS","last_name":"PETERSON","classification":"U","division":"PRODUCTION","hit_factor":11.8227},{"match_name":"Triforce Practical Shooters at BigWoodsGoods 6-22-17","match_date":"2017-06-22","stage_classifiercode":"06-03","member_number":"A83187","first_name":"KEVIN","last_name":"BEARD","classification":"A","division":"PRODUCTION","hit_factor":11.8203},{"match_name":"Tehama Shooters August 2020 USPSA Classifier Match","match_date":"2020-08-22","stage_classifiercode":"06-03","member_number":"TY95027","first_name":"ZACHARY","last_name":"MCMORDIE","classification":"B","division":"PRODUCTION","hit_factor":11.8203},{"match_name":"ACC July 26th USPSA","match_date":"2020-07-26","stage_classifiercode":"06-03","member_number":"TY104115","first_name":"TRAVIS","last_name":"WEDDLE","classification":"B","division":"PRODUCTION","hit_factor":11.8203},{"match_name":"Springfield Tactical Shooters 04-07-2016","match_date":"2016-04-07","stage_classifiercode":"06-03","member_number":"A95725","first_name":"NEIL","last_name":"JOHNSON","classification":"\"\"","division":"PRODUCTION","hit_factor":11.8203},{"match_name":"EHPSA USPSA 27 May 2018","match_date":"2018-05-27","stage_classifiercode":"06-03","member_number":"FY85192","first_name":"KELLY","last_name":"RADINSKY","classification":"B","division":"PRODUCTION","hit_factor":11.8081},{"match_name":"APSC USPSA 7-7-2018","match_date":"2018-07-07","stage_classifiercode":"06-03","member_number":"A78421","first_name":"BEN","last_name":"GILMAN","classification":"M","division":"PRODUCTION","hit_factor":11.8072},{"match_name":"MAPSA  2017 05 13","match_date":"2017-05-10","stage_classifiercode":"06-03","member_number":"A72016","first_name":"SAMUEL","last_name":"SCHMITT","classification":"B","division":"PRODUCTION","hit_factor":11.8072},{"match_name":"RBGC 2016-07-23","match_date":"2016-07-23","stage_classifiercode":"06-03","member_number":"A84201","first_name":"ZANE","last_name":"RUTLEDGE","classification":"B","division":"PRODUCTION","hit_factor":11.8064},{"match_name":"MPSA 061618 USPSA","match_date":"2018-06-16","stage_classifiercode":"06-03","member_number":"A78083","first_name":"JEFFREY","last_name":"BLITCH","classification":"A","division":"PRODUCTION","hit_factor":11.8064},{"match_name":"BORCC USPSA July 2016","match_date":"2016-07-24","stage_classifiercode":"06-03","member_number":"TY89120","first_name":"KEVIN","last_name":"MILLER","classification":"C","division":"PRODUCTION","hit_factor":11.793},{"match_name":"WLPS USPSA August 2020","match_date":"2020-08-23","stage_classifiercode":"06-03","member_number":"A119795","first_name":"KEVIN","last_name":"FAN","classification":"B","division":"PRODUCTION","hit_factor":11.793},{"match_name":"HOPS USPSA 081917","match_date":"2017-08-19","stage_classifiercode":"06-03","member_number":"A97597","first_name":"BRIAN","last_name":"BANGS","classification":"C","division":"PRODUCTION","hit_factor":11.7925},{"match_name":"Southkent USPSA June match","match_date":"2017-06-17","stage_classifiercode":"06-03","member_number":"A76095","first_name":"JEFF","last_name":"SLUSSER","classification":"B","division":"PRODUCTION","hit_factor":11.7925},{"match_name":"WSPS AUGUST 2017 USPSA MATCH","match_date":"2017-08-16","stage_classifiercode":"06-03","member_number":"TY86959","first_name":"MATT","last_name":"SCHWARTZ","classification":"A","division":"PRODUCTION","hit_factor":11.7925},{"match_name":"MCAS USPSA October 2016","match_date":"2016-10-15","stage_classifiercode":"06-03","member_number":"A81795","first_name":"C.J.","last_name":"SCHOCK","classification":"B","division":"PRODUCTION","hit_factor":11.7925},{"match_name":"WSPS AUGUST 2017 USPSA MATCH","match_date":"2017-08-16","stage_classifiercode":"06-03","member_number":"A94749","first_name":"JOHN","last_name":"BURCH","classification":"B","division":"PRODUCTION","hit_factor":11.7794},{"match_name":"LdF 4th Saturday Match","match_date":"2015-12-26","stage_classifiercode":"06-03","member_number":"A88221","first_name":"JON","last_name":"BAUTISTA","classification":"B","division":"PRODUCTION","hit_factor":11.7791},{"match_name":"March 2017 PCSI USPSA","match_date":"2017-03-04","stage_classifiercode":"06-03","member_number":"A78797","first_name":"RYAN","last_name":"MCGLOTHEN","classification":"B","division":"PRODUCTION","hit_factor":11.7791},{"match_name":"BRC_20180311","match_date":"2018-03-11","stage_classifiercode":"06-03","member_number":"L4033","first_name":"JERRY","last_name":"WESTCOTT","classification":"M","division":"PRODUCTION","hit_factor":11.7786},{"match_name":"RBGC 2016-07-23","match_date":"2016-07-23","stage_classifiercode":"06-03","member_number":"TY81668","first_name":"BRENT","last_name":"WILEY","classification":"A","division":"PRODUCTION","hit_factor":11.7786},{"match_name":"ORSA USPSA May 2018","match_date":"2018-05-19","stage_classifiercode":"06-03","member_number":"A100796","first_name":"JUSTIN","last_name":"JOHNSON","classification":"M","division":"PRODUCTION","hit_factor":11.7786},{"match_name":"GRPC USPSA DOG DAYS OF SUMMER","match_date":"2017-08-06","stage_classifiercode":"06-03","member_number":"TY93835","first_name":"JEN","last_name":"KROLL","classification":"B","division":"PRODUCTION","hit_factor":11.7647},{"match_name":"RPS May 2018 USPSA Match","match_date":"2018-05-12","stage_classifiercode":"06-03","member_number":"TY71348","first_name":"REGGIE","last_name":"GARMON","classification":"A","division":"PRODUCTION","hit_factor":11.7647},{"match_name":"BRRC USPSA MAY 14 2016","match_date":"2016-05-14","stage_classifiercode":"06-03","member_number":"A89927","first_name":"LUKE","last_name":"PECOR","classification":"C","division":"PRODUCTION","hit_factor":11.7509},{"match_name":"WSRC USPSA 7/15/2017","match_date":"2017-07-15","stage_classifiercode":"06-03","member_number":"A82327","first_name":"BRIAN","last_name":"SIX","classification":"B","division":"PRODUCTION","hit_factor":11.7509},{"match_name":"Tehama Shooters July 2021 USPSA","match_date":"2021-07-24","stage_classifiercode":"06-03","member_number":"Ty95027","first_name":"ZACHARY","last_name":"MCMORDIE","classification":"B","division":"PRODUCTION","hit_factor":11.7509},{"match_name":"Sage Pistol League USPSA January 17 2021","match_date":"2021-01-17","stage_classifiercode":"06-03","member_number":"FY122346","first_name":"JASON","last_name":"WONG","classification":"B","division":"PRODUCTION","hit_factor":11.7506},{"match_name":"MISS Match 1/3/18","match_date":"2018-01-03","stage_classifiercode":"06-03","member_number":"A71047","first_name":"ANTHONY","last_name":"AMICI","classification":"B","division":"PRODUCTION","hit_factor":11.7503},{"match_name":"Southern Maryland Practical Shooters 14 October 2018 USPSA","match_date":"2018-10-14","stage_classifiercode":"06-03","member_number":"TY31868","first_name":"DENNIS","last_name":"BOYLE","classification":"B","division":"PRODUCTION","hit_factor":11.7503},{"match_name":"EWPSA 2018-07","match_date":"2018-07-14","stage_classifiercode":"06-03","member_number":"A102902","first_name":"JORDAN","last_name":"GODWIN","classification":"B","division":"PRODUCTION","hit_factor":11.7371},{"match_name":"Rio Salado UPPL June 2021","match_date":"2021-06-13","stage_classifiercode":"06-03","member_number":"A21582","first_name":"JOHN","last_name":"MURRAY","classification":"M","division":"PRODUCTION","hit_factor":11.7365},{"match_name":"Deep 50 USPSA  July 24th 2 Classifiers","match_date":"2021-07-24","stage_classifiercode":"06-03","member_number":"Ty112587","first_name":"RICK","last_name":"BRYANT","classification":"B","division":"PRODUCTION","hit_factor":11.7359},{"match_name":"ORSA USPSA October 2020","match_date":"2020-10-17","stage_classifiercode":"06-03","member_number":"A105249","first_name":"MARK","last_name":"MEFFORD","classification":"A","division":"PRODUCTION","hit_factor":11.7347},{"match_name":"APSC USPSA Classifier Match 07-01-17","match_date":"2017-07-01","stage_classifiercode":"06-03","member_number":"A88699","first_name":"DEREK","last_name":"GUTHRIE","classification":"A","division":"PRODUCTION","hit_factor":11.7233},{"match_name":"Competitive Shooters of Lake Norman CORNELIUS Thursday Evening Indoor USPSA Pistol Match North Carolina","match_date":"2021-03-04","stage_classifiercode":"06-03","member_number":"A119795","first_name":"KEVIN","last_name":"FAN","classification":"A","division":"PRODUCTION","hit_factor":11.7233},{"match_name":"BORCC USPSA March 2018 Classifier Match","match_date":"2018-03-24","stage_classifiercode":"06-03","member_number":"TY89120","first_name":"KEVIN","last_name":"MILLER","classification":"B","division":"PRODUCTION","hit_factor":11.7233},{"match_name":"Griffin USPSA Match May 2017","match_date":"2017-05-20","stage_classifiercode":"06-03","member_number":"ty90102","first_name":"ROBERT","last_name":"BODRON","classification":"U","division":"PRODUCTION","hit_factor":11.7225},{"match_name":"BGS Hudson Week 3","match_date":"2018-01-07","stage_classifiercode":"06-03","member_number":"A86153","first_name":"ARIC","last_name":"NILSON","classification":"B","division":"PRODUCTION","hit_factor":11.7216},{"match_name":"GMPS 7/16/17","match_date":"2017-07-16","stage_classifiercode":"06-03","member_number":"L3118","first_name":"ELYE","last_name":"ALEXANDER","classification":"M","division":"PRODUCTION","hit_factor":11.7216},{"match_name":"Emmett June Match","match_date":"2018-06-23","stage_classifiercode":"06-03","member_number":"A103720","first_name":"MIKE","last_name":"AUSTIN","classification":"B","division":"PRODUCTION","hit_factor":11.7096},{"match_name":"Benton Gun Club-USPSA April 2017 Classifier","match_date":"2017-04-23","stage_classifiercode":"06-03","member_number":"A98705","first_name":"WES","last_name":"BRITTEN","classification":"B","division":"PRODUCTION","hit_factor":11.7085},{"match_name":"Chillicothe April-2018 USPSA Classifier Match","match_date":"2018-04-28","stage_classifiercode":"06-03","member_number":"TY96200","first_name":"RYAN","last_name":"GEORGE","classification":"B","division":"PRODUCTION","hit_factor":11.6959},{"match_name":"RPS May 2018 USPSA Match","match_date":"2018-05-12","stage_classifiercode":"06-03","member_number":"A63389","first_name":"TOM","last_name":"THOMPSON","classification":"M","division":"PRODUCTION","hit_factor":11.6959},{"match_name":"Homestead September Classifier Match","match_date":"2020-09-20","stage_classifiercode":"06-03","member_number":"TY112587","first_name":"RICK","last_name":"BRYANT","classification":"C","division":"PRODUCTION","hit_factor":11.6945},{"match_name":"Jan 14 Classifier Match","match_date":"2018-01-14","stage_classifiercode":"06-03","member_number":"TY94704","first_name":"JOHN","last_name":"BUDNAITIS","classification":"\"\"","division":"PRODUCTION","hit_factor":11.6915},{"match_name":"Moss Branch USPSA September 22nd Match","match_date":"2018-09-22","stage_classifiercode":"06-03","member_number":"A97648","first_name":"ZAC","last_name":"JOINER","classification":"A","division":"PRODUCTION","hit_factor":11.6915},{"match_name":"OOPS February 2016","match_date":"2016-02-27","stage_classifiercode":"06-03","member_number":"A68875","first_name":"STACY","last_name":"NIEMANN","classification":"A","division":"PRODUCTION","hit_factor":11.6883},{"match_name":"NHRPC - February 2020 USPSA","match_date":"2020-02-09","stage_classifiercode":"06-03","member_number":"A119880","first_name":"WILLIAM","last_name":"ROBINSON","classification":"B","division":"PRODUCTION","hit_factor":11.6822},{"match_name":"SCAPSA MN05 Fall League 4","match_date":"2017-08-29","stage_classifiercode":"06-03","member_number":"\"\"","first_name":"BEN","last_name":"IRWIN","classification":"U","division":"PRODUCTION","hit_factor":11.6822},{"match_name":"WSRC USPSA 7/15/2017","match_date":"2017-07-15","stage_classifiercode":"06-03","member_number":"TY94469","first_name":"CONNOR","last_name":"MOLLOY","classification":"B","division":"PRODUCTION","hit_factor":11.6751},{"match_name":"The Armory Indoor League","match_date":"2016-06-24","stage_classifiercode":"06-03","member_number":"A90644","first_name":"THOMAS","last_name":"NELSON","classification":"A","division":"PRODUCTION","hit_factor":11.6686},{"match_name":"MRPC USPSA July 2017","match_date":"2017-07-23","stage_classifiercode":"06-03","member_number":"A98812","first_name":"LUKE","last_name":"CAO","classification":"C","division":"PRODUCTION","hit_factor":11.6686},{"match_name":"SCCCJULYCLASSIFIER2016","match_date":"2016-07-30","stage_classifiercode":"06-03","member_number":"A60004","first_name":"MIKE","last_name":"ARMBUST","classification":"A","division":"PRODUCTION","hit_factor":11.6686},{"match_name":"LBAS151219","match_date":"2015-12-19","stage_classifiercode":"06-03","member_number":"A24066","first_name":"GEORGE","last_name":"MANDES","classification":"A","division":"PRODUCTION","hit_factor":11.6686},{"match_name":"NCPS USPSA Handgun Match November 29 2015","match_date":"2015-11-29","stage_classifiercode":"06-03","member_number":"A54989","first_name":"JOHN","last_name":"PRALL","classification":"M","division":"PRODUCTION","hit_factor":11.6646},{"match_name":"RSPP 3rd Saturday September 2016","match_date":"2016-09-17","stage_classifiercode":"06-03","member_number":"A77832","first_name":"NICK","last_name":"VERHAEGHE","classification":"A","division":"PRODUCTION","hit_factor":11.6625},{"match_name":"Homestead USPSA Match","match_date":"2016-09-17","stage_classifiercode":"06-03","member_number":"A74746","first_name":"ARIK","last_name":"LEVY","classification":"A","division":"PRODUCTION","hit_factor":11.6603},{"match_name":"Salt City practical shooting league 'all classifier match'","match_date":"2020-08-30","stage_classifiercode":"06-03","member_number":"A-101550","first_name":"ERIC","last_name":"SCHNITZER","classification":"U","division":"PRODUCTION","hit_factor":11.655},{"match_name":"Pathfinder July USPSA Match","match_date":"2018-07-15","stage_classifiercode":"06-03","member_number":"A1037","first_name":"ALBERT","last_name":"DESIDERIO","classification":"none","division":"PRODUCTION","hit_factor":11.655},{"match_name":"Cortland Pistol Club Sept 27 USPSA Classifier Match","match_date":"2020-09-27","stage_classifiercode":"06-03","member_number":"A115000","first_name":"NIKOLAI","last_name":"LOPATOFSKY","classification":"A","division":"PRODUCTION","hit_factor":11.655},{"match_name":"Richmond Hot Shots February 20-21-2021 USPSA Pistol","match_date":"2021-02-20","stage_classifiercode":"06-03","member_number":"Ty54422","first_name":"STEPHEN","last_name":"BELLINGHAM","classification":"A","division":"PRODUCTION","hit_factor":11.655},{"match_name":"SCCCJULYCLASSIFIER2016","match_date":"2016-07-30","stage_classifiercode":"06-03","member_number":"A92832","first_name":"JEFF","last_name":"PERDUE","classification":"C","division":"PRODUCTION","hit_factor":11.6528},{"match_name":"BPSA April 2017 USPSA","match_date":"2017-04-23","stage_classifiercode":"06-03","member_number":"A67704","first_name":"MICHAEL","last_name":"MCDONALD","classification":"M","division":"PRODUCTION","hit_factor":11.6414},{"match_name":"DWB - Deadwood Boys USPSA 15 July 2018","match_date":"2018-07-15","stage_classifiercode":"06-03","member_number":"L4342","first_name":"RICK","last_name":"MACE","classification":"C","division":"PRODUCTION","hit_factor":11.639},{"match_name":"AIPS Weekly USPSA 29 June 2021","match_date":"2021-06-29","stage_classifiercode":"06-03","member_number":"A133215","first_name":"AUGUST","last_name":"HADENFELDT","classification":"B","division":"PRODUCTION","hit_factor":11.6364},{"match_name":"Grandbaggers 07/2017","match_date":"2017-07-06","stage_classifiercode":"06-03","member_number":"FY72117","first_name":"MARK","last_name":"GARDNER","classification":"A","division":"PRODUCTION","hit_factor":11.6364},{"match_name":"BORCC USPSA July 2016","match_date":"2016-07-24","stage_classifiercode":"06-03","member_number":"\"\"","first_name":"JAMES","last_name":"BUNKLEY","classification":"U","division":"PRODUCTION","hit_factor":11.6279},{"match_name":"Lafayette Practical Shooters - THURS - Jul 8","match_date":"2021-07-08","stage_classifiercode":"06-03","member_number":"A100186","first_name":"SCOT","last_name":"JONES","classification":"A","division":"PRODUCTION","hit_factor":11.6279},{"match_name":"BSPSC 2018 October Fred Jacobi Concealed Carry Match","match_date":"2018-10-07","stage_classifiercode":"06-03","member_number":"A101416","first_name":"SLADE","last_name":"BETTENHAUSEN","classification":"B","division":"PRODUCTION","hit_factor":11.6223},{"match_name":"LCSA USPSA AUGUST 2018","match_date":"2018-08-12","stage_classifiercode":"06-03","member_number":"L3048","first_name":"DOUG","last_name":"BRYANT","classification":"A","division":"PRODUCTION","hit_factor":11.6144},{"match_name":"Detroit Sportsmens Congress - May 21 2017","match_date":"2017-05-21","stage_classifiercode":"06-03","member_number":"A81280","first_name":"JAYJAY","last_name":"LIMBO","classification":"B","division":"PRODUCTION","hit_factor":11.6144},{"match_name":"SEPSA April 2017","match_date":"2017-04-08","stage_classifiercode":"06-03","member_number":"TY84112","first_name":"BRAD","last_name":"WALKER","classification":"A","division":"PRODUCTION","hit_factor":11.6144},{"match_name":"PCGC October 2016","match_date":"2016-10-23","stage_classifiercode":"06-03","member_number":"A78797","first_name":"RYAN","last_name":"MCGLOTHEN","classification":"C","division":"PRODUCTION","hit_factor":11.6129},{"match_name":"MPSA 061618 USPSA","match_date":"2018-06-16","stage_classifiercode":"06-03","member_number":"L4120","first_name":"MICHAEL","last_name":"RAMOS","classification":"C","division":"PRODUCTION","hit_factor":11.6114},{"match_name":"Rio Salado Dirtbaggers June 2021 -ALL CLASSIFIER MATCH-","match_date":"2021-06-03","stage_classifiercode":"06-03","member_number":"A108151","first_name":"ROBERT","last_name":"LANGE","classification":"B","division":"PRODUCTION","hit_factor":11.6082},{"match_name":"ASC USPSA Apr. 18","match_date":"2021-04-18","stage_classifiercode":"06-03","member_number":"A114989","first_name":"DAN","last_name":"SIM","classification":"C","division":"PRODUCTION","hit_factor":11.6049},{"match_name":"Southern Maryland Practical Shooters 14 October 2018 USPSA","match_date":"2018-10-14","stage_classifiercode":"06-03","member_number":"FY66562","first_name":"JONATHAN","last_name":"MARUCOT","classification":"A","division":"PRODUCTION","hit_factor":11.6009},{"match_name":"Pioneer Action Shooters APR 2016","match_date":"2016-04-24","stage_classifiercode":"06-03","member_number":"A60707","first_name":"DAVE","last_name":"SOLIMINI","classification":"M","division":"PRODUCTION","hit_factor":11.6009},{"match_name":"PSAC 20180922","match_date":"2018-09-22","stage_classifiercode":"06-03","member_number":"A79038","first_name":"COLE","last_name":"JAMES","classification":"A","division":"PRODUCTION","hit_factor":11.6009},{"match_name":"GRPC USPSA DOG DAYS OF SUMMER","match_date":"2017-08-06","stage_classifiercode":"06-03","member_number":"A74846","first_name":"KYLE","last_name":"POST","classification":"B","division":"PRODUCTION","hit_factor":11.5976},{"match_name":"GRB USPSA AUGUST CLASSIFIER  MATCH 2021 AT CAVALIER","match_date":"2021-08-14","stage_classifiercode":"06-03","member_number":"TY 51119","first_name":"CHRIS","last_name":"MOLNAR","classification":"A","division":"PRODUCTION","hit_factor":11.5976},{"match_name":"Kidlat  May Club Match","match_date":"2017-05-06","stage_classifiercode":"06-03","member_number":"A96791","first_name":"SCOTT","last_name":"TAYLOR","classification":"B","division":"PRODUCTION","hit_factor":11.5976},{"match_name":"March 2017 PCSI USPSA","match_date":"2017-03-04","stage_classifiercode":"06-03","member_number":"A96708","first_name":"YURIY","last_name":"BORZENKO","classification":"C","division":"PRODUCTION","hit_factor":11.5875},{"match_name":"Inner 10 USPSA December 14th Match - Maybe","match_date":"2020-12-15","stage_classifiercode":"06-03","member_number":"TY123292","first_name":"STEPHEN","last_name":"TOMILSON","classification":"C","division":"PRODUCTION","hit_factor":11.5875},{"match_name":"Trigger Guard USPSA","match_date":"2016-04-02","stage_classifiercode":"06-03","member_number":"A91554","first_name":"MICHAEL","last_name":"ISHIDA","classification":"C","division":"PRODUCTION","hit_factor":11.5875},{"match_name":"MCTS - USPSA July 2020 #2","match_date":"2020-07-25","stage_classifiercode":"06-03","member_number":"FY83899","first_name":"MICHAEL","last_name":"BRESSON","classification":"A","division":"PRODUCTION","hit_factor":11.5875},{"match_name":"OFGC Practical Pistol Match Feb 21 2016","match_date":"2016-02-21","stage_classifiercode":"06-03","member_number":"L3603","first_name":"MITCH","last_name":"GIBSON","classification":"B","division":"PRODUCTION","hit_factor":11.5875},{"match_name":"HAS April 2016 Pistol Match","match_date":"2016-04-10","stage_classifiercode":"06-03","member_number":"FY48411","first_name":"JAMES","last_name":"DAVIS","classification":"B","division":"PRODUCTION","hit_factor":11.5839},{"match_name":"Schultz September 2018","match_date":"2018-09-09","stage_classifiercode":"06-03","member_number":"A101734","first_name":"ROBBY","last_name":"SCHWANZ","classification":"C","division":"PRODUCTION","hit_factor":11.5839},{"match_name":"NRG September 10th 2016","match_date":"2016-09-10","stage_classifiercode":"06-03","member_number":"A90801","first_name":"SEAN","last_name":"REIDY","classification":"U","division":"PRODUCTION","hit_factor":11.5802},{"match_name":"OPSC USPSA 8-14-2016","match_date":"2016-08-14","stage_classifiercode":"06-03","member_number":"A94234","first_name":"HRISTO","last_name":"DOUHALOV","classification":"U","division":"PRODUCTION","hit_factor":11.5741},{"match_name":"SCCCJULYCLASSIFIER2016","match_date":"2016-07-30","stage_classifiercode":"06-03","member_number":"ty75615","first_name":"SID","last_name":"NELSON","classification":"A","division":"PRODUCTION","hit_factor":11.5702},{"match_name":"Strongpoint March 2017 Match","match_date":"2017-03-04","stage_classifiercode":"06-03","member_number":"A58496","first_name":"GREG","last_name":"SMITH","classification":"M","division":"PRODUCTION","hit_factor":11.5702},{"match_name":"BTSA USPSA 2021-7 Aug 7 part two","match_date":"2021-08-07","stage_classifiercode":"06-03","member_number":"TYF128865","first_name":"DEVON","last_name":"SEITZ","classification":"C","division":"PRODUCTION","hit_factor":11.5702},{"match_name":"DRRC  Mar2017","match_date":"2017-03-04","stage_classifiercode":"06-03","member_number":"TY78052","first_name":"SERGE","last_name":"DAVIS","classification":"A","division":"PRODUCTION","hit_factor":11.5663},{"match_name":"Range E11even March 2017","match_date":"2017-03-25","stage_classifiercode":"06-03","member_number":"\"\"","first_name":"ERIC","last_name":"SIMPSON","classification":"U","division":"PRODUCTION","hit_factor":11.5607},{"match_name":"Richmond Hot Shots February 20-21-2021 USPSA Pistol","match_date":"2021-02-20","stage_classifiercode":"06-03","member_number":"A106663","first_name":"RICKEY","last_name":"INGRASSIA","classification":"M","division":"PRODUCTION","hit_factor":11.5607},{"match_name":"Coastal Area Practical Shooters  12-26-15","match_date":"2015-12-26","stage_classifiercode":"06-03","member_number":"\"\"","first_name":"DAVID","last_name":"WILLIAMS","classification":"X","division":"PRODUCTION","hit_factor":11.5566},{"match_name":"CAS 09-06-20","match_date":"2020-09-06","stage_classifiercode":"06-03","member_number":"A111160","first_name":"PRZEMEK","last_name":"LUBECKI","classification":"B","division":"PRODUCTION","hit_factor":11.5473},{"match_name":"Gem City Gun Club 7-3 and 7-4","match_date":"2021-07-03","stage_classifiercode":"06-03","member_number":"TY41710","first_name":"CHRIS","last_name":"HANES","classification":"B","division":"PRODUCTION","hit_factor":11.5473},{"match_name":"Rio Salado UPPL June 2021","match_date":"2021-06-13","stage_classifiercode":"06-03","member_number":"A108151","first_name":"ROBERT","last_name":"LANGE","classification":"B","division":"PRODUCTION","hit_factor":11.5473},{"match_name":"Benton Gun Club-USPSA April 2017 Classifier","match_date":"2017-04-23","stage_classifiercode":"06-03","member_number":"FY65816","first_name":"GOOSE","last_name":"CHANGOSE","classification":"A","division":"PRODUCTION","hit_factor":11.5433},{"match_name":"RBGC 2016-07-23","match_date":"2016-07-23","stage_classifiercode":"06-03","member_number":"A85054","first_name":"ROB","last_name":"CHAVOUS","classification":"A","division":"PRODUCTION","hit_factor":11.5385},{"match_name":"WNYPPL July 2020 USPSA","match_date":"2020-07-26","stage_classifiercode":"06-03","member_number":"TY97749","first_name":"JOSEPH","last_name":"MUSCARELLA","classification":"A","division":"PRODUCTION","hit_factor":11.534},{"match_name":"April 2018 CAS USPSA","match_date":"2018-04-01","stage_classifiercode":"06-03","member_number":"TY55093","first_name":"MIKE","last_name":"PIZZOLATTO","classification":"M","division":"PRODUCTION","hit_factor":11.5294},{"match_name":"NHRPC - February 2020 USPSA","match_date":"2020-02-09","stage_classifiercode":"06-03","member_number":"a81859","first_name":"JEFF","last_name":"BISSONETTE","classification":"B","division":"PRODUCTION","hit_factor":11.5246},{"match_name":"BHPC USPSA Monthly Match 6-14-2020","match_date":"2020-06-14","stage_classifiercode":"06-03","member_number":"a119729","first_name":"STEVE","last_name":"DIETZ","classification":"B","division":"PRODUCTION","hit_factor":11.5196},{"match_name":"2016 Memphis Charity Challenge","match_date":"2016-10-23","stage_classifiercode":"06-03","member_number":"TY65445","first_name":"PAGE","last_name":"VANCE","classification":"B","division":"PRODUCTION","hit_factor":11.5159},{"match_name":"SAPSA January 2018","match_date":"2018-01-20","stage_classifiercode":"06-03","member_number":"A102193","first_name":"PHIL","last_name":"VINEYARD","classification":"U","division":"PRODUCTION","hit_factor":11.5159},{"match_name":"Strongpoint March 2017 Match","match_date":"2017-03-04","stage_classifiercode":"06-03","member_number":"A94003","first_name":"MATHEW","last_name":"ANSLEY","classification":"A","division":"PRODUCTION","hit_factor":11.5075},{"match_name":"Kidlat  May Club Match","match_date":"2017-05-06","stage_classifiercode":"06-03","member_number":"PEN","first_name":"PAUL","last_name":"BARREIRO","classification":"U","division":"PRODUCTION","hit_factor":11.5075},{"match_name":"Schultz July USPSA- all classifier match","match_date":"2021-07-11","stage_classifiercode":"06-03","member_number":"Ty74021","first_name":"MICHAEL","last_name":"BLYAKHER","classification":"M","division":"PRODUCTION","hit_factor":11.5075},{"match_name":"VISSC Bono","match_date":"2020-10-25","stage_classifiercode":"06-03","member_number":"A88581","first_name":"RAMIRO","last_name":"NOGUEROL","classification":"A","division":"PRODUCTION","hit_factor":11.5075},{"match_name":"2015 Ontelaunee Holiday Hosefest","match_date":"2015-12-26","stage_classifiercode":"06-03","member_number":"\"\"","first_name":"THOMAS","last_name":"BARTIROMO","classification":"A","division":"PRODUCTION","hit_factor":11.5075},{"match_name":"MPSA 030516","match_date":"2016-03-05","stage_classifiercode":"06-03","member_number":"A65800","first_name":"TODD","last_name":"PUGH","classification":"B","division":"PRODUCTION","hit_factor":11.5023},{"match_name":"Richmond October 17-18-2015","match_date":"2015-10-17","stage_classifiercode":"06-03","member_number":"FY25171","first_name":"KEVIN","last_name":"CHU","classification":"A","division":"PRODUCTION","hit_factor":11.5},{"match_name":"Griffin USPSA Match May 2017","match_date":"2017-05-20","stage_classifiercode":"06-03","member_number":"A83594","first_name":"TIM","last_name":"BOWDEN","classification":"C","division":"PRODUCTION","hit_factor":11.497},{"match_name":"BPSA April 2017 USPSA","match_date":"2017-04-23","stage_classifiercode":"06-03","member_number":"A78083","first_name":"JEFFREY","last_name":"BLITCH","classification":"A","division":"PRODUCTION","hit_factor":11.497},{"match_name":"Augusta USPSA 04-11-21","match_date":"2021-04-11","stage_classifiercode":"06-03","member_number":"A59716","first_name":"JEFFREY","last_name":"BOLIER","classification":"B","division":"PRODUCTION","hit_factor":11.4943},{"match_name":"MS06 Team Magnolia USPSA","match_date":"2017-03-05","stage_classifiercode":"06-03","member_number":"TY79594","first_name":"JOHN","last_name":"BIDDLE","classification":"C","division":"PRODUCTION","hit_factor":11.4889},{"match_name":"PCGC October 2016","match_date":"2016-10-23","stage_classifiercode":"06-03","member_number":"A78797","first_name":"RYAN","last_name":"MCGLOTHEN","classification":"C","division":"PRODUCTION","hit_factor":11.4889},{"match_name":"Tehama Shooters August 2020 USPSA Classifier Match","match_date":"2020-08-22","stage_classifiercode":"06-03","member_number":"TY86706","first_name":"CHRIS","last_name":"DEWEY","classification":"A","division":"PRODUCTION","hit_factor":11.4889},{"match_name":"2015 Ontelaunee Holiday Hosefest","match_date":"2015-12-26","stage_classifiercode":"06-03","member_number":"\"\"","first_name":"ANNETTE","last_name":"EVANS","classification":"B","division":"PRODUCTION","hit_factor":11.4889},{"match_name":"Detroit Sportsmens Congress - May 21 2017","match_date":"2017-05-21","stage_classifiercode":"06-03","member_number":"TY75117","first_name":"JEFF","last_name":"SHOTWELL","classification":"A","division":"PRODUCTION","hit_factor":11.4856},{"match_name":"OPSA November 2017","match_date":"2017-11-26","stage_classifiercode":"06-03","member_number":"A100408","first_name":"JAMES","last_name":"HEBERT","classification":"B","division":"PRODUCTION","hit_factor":11.4833},{"match_name":"SFA USPSA August 2017","match_date":"2017-08-19","stage_classifiercode":"06-03","member_number":"A99017","first_name":"GUY","last_name":"CUNNINGHAM","classification":"C","division":"PRODUCTION","hit_factor":11.4811},{"match_name":"BGS Hudson Week 10","match_date":"2020-02-16","stage_classifiercode":"06-03","member_number":"A86153","first_name":"ARIC","last_name":"NILSON","classification":"B","division":"PRODUCTION","hit_factor":11.4754},{"match_name":"MASTER BLASTERS & SSFGA USPSA - September","match_date":"2020-09-19","stage_classifiercode":"06-03","member_number":"A104407","first_name":"RESHOOT","last_name":"LALLY","classification":"B","division":"PRODUCTION","hit_factor":11.4695},{"match_name":"SCCC CLASSIFIER MATCH 7_23_17","match_date":"2017-07-23","stage_classifiercode":"06-03","member_number":"ty75615","first_name":"SID","last_name":"NELSON","classification":"A","division":"PRODUCTION","hit_factor":11.4634},{"match_name":"NW01 Tuesday Sectional","match_date":"2017-08-01","stage_classifiercode":"06-03","member_number":"A98512","first_name":"THOMAS","last_name":"EISENBREI","classification":"U","division":"PRODUCTION","hit_factor":11.462},{"match_name":"NISA April Classifer Match 2016","match_date":"2016-04-24","stage_classifiercode":"06-03","member_number":"A81606","first_name":"JOSEPH","last_name":"MCHUGH","classification":"M","division":"PRODUCTION","hit_factor":11.462},{"match_name":"Springfield Tactical Shooters 04-07-2016","match_date":"2016-04-07","stage_classifiercode":"06-03","member_number":"TY78203","first_name":"JIM","last_name":"SHURES","classification":"B","division":"PRODUCTION","hit_factor":11.462},{"match_name":"BHPC USPSA Monthly Match 6-14-2020","match_date":"2020-06-14","stage_classifiercode":"06-03","member_number":"A71452","first_name":"JONATHAN","last_name":"FISHER","classification":"U","division":"PRODUCTION","hit_factor":11.4548},{"match_name":"BRC_20180311","match_date":"2018-03-11","stage_classifiercode":"06-03","member_number":"L4407","first_name":"JOE","last_name":"TREGENZA","classification":"B","division":"PRODUCTION","hit_factor":11.4495},{"match_name":"SLOSA JAN 2021 USPSA MATCH","match_date":"2021-01-09","stage_classifiercode":"06-03","member_number":"A90454","first_name":"JUSTIN","last_name":"ALVAREZ","classification":"A","division":"PRODUCTION","hit_factor":11.4495},{"match_name":"CFRPC USPSA 2016 DECEMBER","match_date":"2016-12-18","stage_classifiercode":"06-03","member_number":"A83725","first_name":"RAFY","last_name":"RIJOS","classification":"B","division":"PRODUCTION","hit_factor":11.4495},{"match_name":"EHPSA USPSA 27 May 2018","match_date":"2018-05-27","stage_classifiercode":"06-03","member_number":"A85227","first_name":"JOHN","last_name":"RADINSKY","classification":"A","division":"PRODUCTION","hit_factor":11.4486},{"match_name":"RBPS April Pistol Match","match_date":"2017-04-15","stage_classifiercode":"06-03","member_number":"A84868","first_name":"KEVIN","last_name":"BOCK","classification":"M","division":"PRODUCTION","hit_factor":11.4422},{"match_name":"LCSA USPSA September 2017","match_date":"2017-09-02","stage_classifiercode":"06-03","member_number":"ty97350","first_name":"HOWARD","last_name":"WILLIAMS","classification":"B","division":"PRODUCTION","hit_factor":11.4422},{"match_name":"Brothers N Arms August 2017 USPSA Match","match_date":"2017-08-19","stage_classifiercode":"06-03","member_number":"A67704","first_name":"MICHAEL","last_name":"MCDONALD","classification":"M","division":"PRODUCTION","hit_factor":11.4416},{"match_name":"Grandbaggers 07/2017","match_date":"2017-07-06","stage_classifiercode":"06-03","member_number":"TY62896","first_name":"JAY","last_name":"DEMPSEY","classification":"B","division":"PRODUCTION","hit_factor":11.4416},{"match_name":"MCPSL Pistol 4-8-17","match_date":"2017-04-08","stage_classifiercode":"06-03","member_number":"FY85914","first_name":"JUSTIN","last_name":"BARDWELL","classification":"B","division":"PRODUCTION","hit_factor":11.4286},{"match_name":"RBGC 2016-07-23","match_date":"2016-07-23","stage_classifiercode":"06-03","member_number":"L3963","first_name":"CK","last_name":"PANTER","classification":"B","division":"PRODUCTION","hit_factor":11.4286},{"match_name":"APS August 1st Monthly USPSA Match  Classifier Match","match_date":"2021-08-01","stage_classifiercode":"06-03","member_number":"A100703","first_name":"PETER","last_name":"MALECKI","classification":"B","division":"PRODUCTION","hit_factor":11.4286},{"match_name":"STAGE ZERO SHOOTING SUPPLY USPSA","match_date":"2020-07-16","stage_classifiercode":"06-03","member_number":"A121584","first_name":"DAVID","last_name":"BUCHANAN","classification":"U","division":"PRODUCTION","hit_factor":11.4286},{"match_name":"PTPC June 4th USPSA Match","match_date":"2017-06-04","stage_classifiercode":"06-03","member_number":"TY90211","first_name":"JASON","last_name":"DOWNS","classification":"B","division":"PRODUCTION","hit_factor":11.4219},{"match_name":"Richmond Hot Shots April 15-16-2017 USPSA Pistol Match","match_date":"2017-04-15","stage_classifiercode":"06-03","member_number":"\"\"","first_name":"JEFF","last_name":"REED","classification":"U","division":"PRODUCTION","hit_factor":11.4219},{"match_name":"Shoot GTR USPSA Sep 6","match_date":"2016-09-06","stage_classifiercode":"06-03","member_number":"A89762","first_name":"NICK","last_name":"CUMMINGS","classification":"B","division":"PRODUCTION","hit_factor":11.4155},{"match_name":"Springfield Tactical Shooters 04-07-2016","match_date":"2016-04-07","stage_classifiercode":"06-03","member_number":"A95721","first_name":"CORY","last_name":"LYONS","classification":"U","division":"PRODUCTION","hit_factor":11.4155},{"match_name":"LdF USPSA Match May 13 2017","match_date":"2017-05-13","stage_classifiercode":"06-03","member_number":"PENDING","first_name":"KEVIN","last_name":"MCCLUSKEY","classification":"U","division":"PRODUCTION","hit_factor":11.415},{"match_name":"Blue Ridge Arsenal Nov 8 All Classifier match","match_date":"2018-11-08","stage_classifiercode":"06-03","member_number":"FY63108","first_name":"JUSTIN","last_name":"TITUS","classification":"M","division":"PRODUCTION","hit_factor":11.4086},{"match_name":"Hawkeye Gun Club February 2016","match_date":"2016-02-20","stage_classifiercode":"06-03","member_number":"A86022","first_name":"BRIAN","last_name":"SHOPE","classification":"B","division":"PRODUCTION","hit_factor":11.4086},{"match_name":"Idaho ISPS September 16th 2018","match_date":"2018-09-16","stage_classifiercode":"06-03","member_number":"A111211","first_name":"BRYAN","last_name":"MONTGOMERY","classification":"D","division":"PRODUCTION","hit_factor":11.4025},{"match_name":"MPSA 061618 USPSA","match_date":"2018-06-16","stage_classifiercode":"06-03","member_number":"A58560","first_name":"THOMAS","last_name":"KNIGHT","classification":"A","division":"PRODUCTION","hit_factor":11.4025},{"match_name":"WSPS AUGUST 2017 USPSA MATCH","match_date":"2017-08-16","stage_classifiercode":"06-03","member_number":"TY75668","first_name":"JIM","last_name":"LIANG","classification":"C","division":"PRODUCTION","hit_factor":11.4025},{"match_name":"APSC USPSA  3-7-20","match_date":"2020-03-06","stage_classifiercode":"06-03","member_number":"A94815","first_name":"NICK","last_name":"GILMAN","classification":"A","division":"PRODUCTION","hit_factor":11.3939},{"match_name":"EAGC September 2016 USPSA Pistol Match","match_date":"2016-09-18","stage_classifiercode":"06-03","member_number":"A85139","first_name":"PAYTON","last_name":"SIDES","classification":"M","division":"PRODUCTION","hit_factor":11.3895},{"match_name":"ECPS USPSA 20 Feb 16","match_date":"2016-02-20","stage_classifiercode":"06-03","member_number":"\"\"","first_name":"PHIL","last_name":"BOZZA","classification":"U","division":"PRODUCTION","hit_factor":11.3879},{"match_name":"MPSA 061618 USPSA","match_date":"2018-06-16","stage_classifiercode":"06-03","member_number":"A79833","first_name":"STEVEN","last_name":"TAYLOR","classification":"M","division":"PRODUCTION","hit_factor":11.3821},{"match_name":"SAPSA July 2016","match_date":"2016-07-16","stage_classifiercode":"06-03","member_number":"A69089","first_name":"MATT","last_name":"MITCHELL","classification":"M","division":"PRODUCTION","hit_factor":11.3821},{"match_name":"NVSA USPSA Classifer Match 1605-2","match_date":"2016-05-21","stage_classifiercode":"06-03","member_number":"FY83788","first_name":"ROBERT","last_name":"WARN","classification":"U","division":"PRODUCTION","hit_factor":11.3821},{"match_name":"DCPA USPSA 11- 20-2016","match_date":"2016-11-20","stage_classifiercode":"06-03","member_number":"TY80786","first_name":"DAN","last_name":"HAYWOOD","classification":"A","division":"PRODUCTION","hit_factor":11.3821},{"match_name":"Emmett June Match","match_date":"2018-06-23","stage_classifiercode":"06-03","member_number":"A98224","first_name":"JUSTIN","last_name":"HASH","classification":"A","division":"PRODUCTION","hit_factor":11.3821},{"match_name":"AIPS Weekly USPSA 29 June 2021","match_date":"2021-06-29","stage_classifiercode":"06-03","member_number":"TY23819","first_name":"MIKE","last_name":"CARMONEY","classification":"A","division":"PRODUCTION","hit_factor":11.3766},{"match_name":"WNYPPL July 2020 USPSA","match_date":"2020-07-26","stage_classifiercode":"06-03","member_number":"A95097","first_name":"ALAN","last_name":"DAMIANI","classification":"B","division":"PRODUCTION","hit_factor":11.3766},{"match_name":"Cortland Pistol Club Sept 27 USPSA Classifier Match","match_date":"2020-09-27","stage_classifiercode":"06-03","member_number":"A38675","first_name":"MICHAEL","last_name":"POLAND","classification":"B","division":"PRODUCTION","hit_factor":11.3766},{"match_name":"STAGE ZERO SHOOTING SUPPLY USPSA","match_date":"2020-07-16","stage_classifiercode":"06-03","member_number":"TY94292","first_name":"THOMAS (TJ)","last_name":"MEYERS","classification":"B","division":"PRODUCTION","hit_factor":11.3689},{"match_name":"Pioneer Action Shooters USPSA 5-27-18","match_date":"2018-05-27","stage_classifiercode":"06-03","member_number":"A103580","first_name":"TYLER","last_name":"GASSETT","classification":"C","division":"PRODUCTION","hit_factor":11.3689},{"match_name":"USPSA Strategic Edge October 2018","match_date":"2018-10-20","stage_classifiercode":"06-03","member_number":"A95163","first_name":"BEN","last_name":"BROWN","classification":"B","division":"PRODUCTION","hit_factor":11.3689},{"match_name":"2016 Memphis Charity Challenge","match_date":"2016-10-23","stage_classifiercode":"06-03","member_number":"A81425","first_name":"CHASE","last_name":"LANE","classification":"M","division":"PRODUCTION","hit_factor":11.3636},{"match_name":"WGC May 2016 USPSA","match_date":"2016-05-15","stage_classifiercode":"06-03","member_number":"TY78023","first_name":"BRUCE","last_name":"BARTLEY","classification":"A","division":"PRODUCTION","hit_factor":11.3636},{"match_name":"Eaps August match","match_date":"2021-08-15","stage_classifiercode":"06-03","member_number":"ty55093","first_name":"MIKE","last_name":"PIZZOLATTO","classification":"M","division":"PRODUCTION","hit_factor":11.358},{"match_name":"PPPS 9-10-17","match_date":"2017-09-10","stage_classifiercode":"06-03","member_number":"A105529","first_name":"STEVE","last_name":"BERGUM","classification":"\"\"","division":"PRODUCTION","hit_factor":11.3507},{"match_name":"MCTS -  USPSA March 2021 Classifier Match","match_date":"2021-03-21","stage_classifiercode":"06-03","member_number":"A122337","first_name":"LINH","last_name":"TRAN","classification":"U","division":"PRODUCTION","hit_factor":11.3507},{"match_name":"AAFG USPSA July 30 Pistol  Classifier","match_date":"2016-07-30","stage_classifiercode":"06-03","member_number":"A91652","first_name":"KENT","last_name":"NORDSTROM","classification":"C","division":"PRODUCTION","hit_factor":11.3507},{"match_name":"RSPP 3rd Saturday July 2018","match_date":"2018-07-20","stage_classifiercode":"06-03","member_number":"FY73383","first_name":"SANDY","last_name":"RUTHVEN","classification":"M","division":"PRODUCTION","hit_factor":11.3507},{"match_name":"CSA March 2016","match_date":"2016-03-13","stage_classifiercode":"06-03","member_number":"A85584","first_name":"CHARLES","last_name":"YEAGER","classification":"B","division":"PRODUCTION","hit_factor":11.3426},{"match_name":"Rankin Field April (ALL CLASSIFIER) Saturday USPSA","match_date":"2021-04-03","stage_classifiercode":"06-03","member_number":"TY87085","first_name":"JESUS","last_name":"GALLARDO","classification":"C","division":"PRODUCTION","hit_factor":11.3379},{"match_name":"Brazosland Pistoleros September 17 2017 USPSA","match_date":"2017-09-17","stage_classifiercode":"06-03","member_number":"\"\"","first_name":"JENNIFER","last_name":"KROLL","classification":"B","division":"PRODUCTION","hit_factor":11.3379},{"match_name":"MASTER BLASTERS & SSFGA USPSA - September","match_date":"2020-09-19","stage_classifiercode":"06-03","member_number":"l1439","first_name":"JACK","last_name":"BARNES","classification":"M","division":"PRODUCTION","hit_factor":11.3341},{"match_name":"NRG September 10th 2016","match_date":"2016-09-10","stage_classifiercode":"06-03","member_number":"\"\"","first_name":"KEVIN","last_name":"MCCLUSKEY","classification":"U","division":"PRODUCTION","hit_factor":11.3295},{"match_name":"CFRPC USPSA 2016 DECEMBER","match_date":"2016-12-18","stage_classifiercode":"06-03","member_number":"A90959","first_name":"WILL","last_name":"OWENS","classification":"C","division":"PRODUCTION","hit_factor":11.3295},{"match_name":"August 14 2021 The Range At True North USPSA Match","match_date":"2021-08-14","stage_classifiercode":"06-03","member_number":"A101612","first_name":"MATT","last_name":"MADSEN","classification":"M","division":"PRODUCTION","hit_factor":11.325},{"match_name":"Springfield Tactical Shooters 03/012018","match_date":"2018-03-01","stage_classifiercode":"06-03","member_number":"TY77453","first_name":"JOEL","last_name":"GUSTAFSON","classification":"B","division":"PRODUCTION","hit_factor":11.325},{"match_name":"Cactus Match USPSA ALL CLASSIFIER July 2018","match_date":"2018-07-01","stage_classifiercode":"06-03","member_number":"A111003","first_name":"MATTHEW","last_name":"CZUZAK","classification":"U","division":"PRODUCTION","hit_factor":11.325},{"match_name":"WVPPS May 2017","match_date":"2017-05-21","stage_classifiercode":"06-03","member_number":"A73787","first_name":"KEVIN","last_name":"WRIGHT","classification":"B","division":"PRODUCTION","hit_factor":11.3208},{"match_name":"Richmond Hot Shots October 17-18-2020 USPSA Pistol","match_date":"2020-10-17","stage_classifiercode":"06-03","member_number":"A98526","first_name":"JOHN SIMON","last_name":"DATOR","classification":"C","division":"PRODUCTION","hit_factor":11.3164},{"match_name":"SFA USPSA August 2017","match_date":"2017-08-19","stage_classifiercode":"06-03","member_number":"A81703","first_name":"DAVID","last_name":"BORWICK","classification":"B","division":"PRODUCTION","hit_factor":11.3122},{"match_name":"January 9  2021 The Range At True North USPSA Match","match_date":"2021-01-09","stage_classifiercode":"06-03","member_number":"A109209","first_name":"IAN","last_name":"WILLMS","classification":"B","division":"PRODUCTION","hit_factor":11.3122},{"match_name":"GoShoot Outdoors March 14th","match_date":"2020-03-14","stage_classifiercode":"06-03","member_number":"A115058","first_name":"MARKUS","last_name":"STOBBE","classification":"B","division":"PRODUCTION","hit_factor":11.3033},{"match_name":"Tropang Vegas All Classifier Match","match_date":"2021-07-11","stage_classifiercode":"06-03","member_number":"TY59522","first_name":"AKOS","last_name":"MESTER","classification":"M","division":"PRODUCTION","hit_factor":11.3033},{"match_name":"Parma 2018 July USPSA","match_date":"2018-07-21","stage_classifiercode":"06-03","member_number":"A103720","first_name":"MIKE","last_name":"AUSTIN","classification":"B","division":"PRODUCTION","hit_factor":11.3033},{"match_name":"Schultz September 2018","match_date":"2018-09-09","stage_classifiercode":"06-03","member_number":"ty90211","first_name":"JASON","last_name":"DOWNS","classification":"B","division":"PRODUCTION","hit_factor":11.3033},{"match_name":"SSPSC  USPSA 4-3&4 -21","match_date":"2021-04-01","stage_classifiercode":"06-03","member_number":"TY98102","first_name":"JOHN","last_name":"LARA","classification":"B","division":"PRODUCTION","hit_factor":11.2994},{"match_name":"SSPSC  USPSA 4-3&4 -21","match_date":"2021-04-01","stage_classifiercode":"06-03","member_number":"TY59522","first_name":"AKOS","last_name":"MESTER","classification":"\"\"","division":"PRODUCTION","hit_factor":11.2994},{"match_name":"HSC USPSA June 2016","match_date":"2016-06-04","stage_classifiercode":"06-03","member_number":"ty9602","first_name":"CHAD","last_name":"BOYER","classification":"U","division":"PRODUCTION","hit_factor":11.2994},{"match_name":"A3G-APS October 13th USPSA Match","match_date":"2018-10-13","stage_classifiercode":"06-03","member_number":"TY75726","first_name":"PEDRO","last_name":"QUINONES","classification":"B","division":"PRODUCTION","hit_factor":11.2994},{"match_name":"SCCC CLASSIFIER MATCH 7_23_17","match_date":"2017-07-23","stage_classifiercode":"06-03","member_number":"A86735","first_name":"JOHN","last_name":"COURIS","classification":"B","division":"PRODUCTION","hit_factor":11.2903},{"match_name":"RBGC 2016-07-23","match_date":"2016-07-23","stage_classifiercode":"06-03","member_number":"A92805","first_name":"DAVID","last_name":"MAYS","classification":"C","division":"PRODUCTION","hit_factor":11.2903},{"match_name":"Strongpoint March 2017 Match","match_date":"2017-03-04","stage_classifiercode":"06-03","member_number":"A99052","first_name":"ISAAC","last_name":"WATERS","classification":"C","division":"PRODUCTION","hit_factor":11.2903},{"match_name":"Grandbaggers Jan 2018","match_date":"2018-01-04","stage_classifiercode":"06-03","member_number":"A103714","first_name":"DANIEL","last_name":"TYLER","classification":"C","division":"PRODUCTION","hit_factor":11.2867},{"match_name":"EIPS 11/5/2016","match_date":"2016-11-05","stage_classifiercode":"06-03","member_number":"A71452","first_name":"JON","last_name":"FISHER","classification":"G","division":"PRODUCTION","hit_factor":11.2845},{"match_name":"Springfield Tactical Shooters 03/012018","match_date":"2018-03-01","stage_classifiercode":"06-03","member_number":"TY78203","first_name":"JIM","last_name":"SHURES","classification":"B","division":"PRODUCTION","hit_factor":11.2808},{"match_name":"TAP USPSA Pistol Match Aug 28 2016 (27Aug16-10:07:04)","match_date":"2016-08-28","stage_classifiercode":"06-03","member_number":"A67001","first_name":"KENT","last_name":"HIGGINBOTHAM","classification":"M","division":"PRODUCTION","hit_factor":11.2773},{"match_name":"NCPS USPSA Handgun Match November 29 2015","match_date":"2015-11-29","stage_classifiercode":"06-03","member_number":"A67001","first_name":"KENT","last_name":"HIGGINBOTHAM","classification":"M","division":"PRODUCTION","hit_factor":11.274},{"match_name":"DSSA 2018-09 USPSA Pistol","match_date":"2018-09-23","stage_classifiercode":"06-03","member_number":"TY66456","first_name":"KEN","last_name":"HABLITZEL","classification":"B","division":"PRODUCTION","hit_factor":11.274},{"match_name":"SMPS March 2016","match_date":"2016-03-13","stage_classifiercode":"06-03","member_number":"A86288","first_name":"BENNETT","last_name":"BOYER","classification":"B","division":"PRODUCTION","hit_factor":11.274},{"match_name":"ORSA USPSA April 2016","match_date":"2016-04-16","stage_classifiercode":"06-03","member_number":"A64179","first_name":"JASON","last_name":"STANLEY","classification":"B","division":"PRODUCTION","hit_factor":11.274},{"match_name":"OVSC CLASSIFIER PRACTICE","match_date":"2018-08-19","stage_classifiercode":"06-03","member_number":"ty77598","first_name":"SCOTT","last_name":"GRUENBERG","classification":"A","division":"PRODUCTION","hit_factor":11.274},{"match_name":"Shoot GTR Monthly Match September","match_date":"2017-09-02","stage_classifiercode":"06-03","member_number":"A71248","first_name":"CHAD","last_name":"HYLANDER","classification":"\"\"","division":"PRODUCTION","hit_factor":11.274},{"match_name":"Minnetonka Game And Fish Sept 5","match_date":"2018-09-05","stage_classifiercode":"06-03","member_number":"L3008","first_name":"MIKE","last_name":"BOFENKAMP","classification":"M","division":"PRODUCTION","hit_factor":11.271},{"match_name":"DWB - Deadwood Boys USPSA 15 July 2018","match_date":"2018-07-15","stage_classifiercode":"06-03","member_number":"TY103010","first_name":"TACTICAL","last_name":"STEVE","classification":"B","division":"PRODUCTION","hit_factor":11.2676},{"match_name":"The Irbil Open","match_date":"2017-05-14","stage_classifiercode":"06-03","member_number":"\"\"","first_name":"AARON","last_name":"ROTH","classification":"U","division":"PRODUCTION","hit_factor":11.2613},{"match_name":"March 2017 PCSI USPSA","match_date":"2017-03-04","stage_classifiercode":"06-03","member_number":"A87413","first_name":"JEFF","last_name":"ADKINS","classification":"B","division":"PRODUCTION","hit_factor":11.2613},{"match_name":"GA Firing Line USPSA 2021-01-14","match_date":"2021-01-15","stage_classifiercode":"06-03","member_number":"TY81601","first_name":"CARLTON","last_name":"JONES","classification":"A","division":"PRODUCTION","hit_factor":11.2613},{"match_name":"RSPP 3rd Saturday July 2018","match_date":"2018-07-20","stage_classifiercode":"06-03","member_number":"A55572","first_name":"SHANE","last_name":"CELINO","classification":"A","division":"PRODUCTION","hit_factor":11.2613},{"match_name":"WAC August 22nd (4th Sunday) - ALL CLASSIFIER USPSA 6 Stage Match","match_date":"2021-08-22","stage_classifiercode":"06-03","member_number":"A40964","first_name":"THOMAS","last_name":"GAILEY","classification":"M","division":"PRODUCTION","hit_factor":11.2514},{"match_name":"Minot USPSA 1-14-18","match_date":"2018-01-14","stage_classifiercode":"06-03","member_number":"A103063","first_name":"NICK","last_name":"SWENSON","classification":"C","division":"PRODUCTION","hit_factor":11.2486},{"match_name":"RBGC 2016-07-23","match_date":"2016-07-23","stage_classifiercode":"06-03","member_number":"A93731","first_name":"WILL","last_name":"HINES","classification":"A","division":"PRODUCTION","hit_factor":11.2486},{"match_name":"BHPC USPSA Match Classifier IOWA","match_date":"2018-06-16","stage_classifiercode":"06-03","member_number":"A106659","first_name":"JACOB","last_name":"GEARHART","classification":"C","division":"PRODUCTION","hit_factor":11.2486},{"match_name":"MISS Match 1/3/18","match_date":"2018-01-03","stage_classifiercode":"06-03","member_number":"TY67601","first_name":"RUSSELL","last_name":"DESALVO","classification":"M","division":"PRODUCTION","hit_factor":11.2486},{"match_name":"Baghdad IPSC Match 8-5-2017","match_date":"2017-08-05","stage_classifiercode":"06-03","member_number":"\"\"","first_name":"PERRY","last_name":"SILVERLAKE","classification":"\"\"","division":"PRODUCTION","hit_factor":11.2486},{"match_name":"WLPS USPSA August 2020","match_date":"2020-08-23","stage_classifiercode":"06-03","member_number":"A71452","first_name":"JONATHAN","last_name":"FISHER","classification":"U","division":"PRODUCTION","hit_factor":11.2385},{"match_name":"Springfield Tactical Shooters 03/012018","match_date":"2018-03-01","stage_classifiercode":"06-03","member_number":"TY78203","first_name":"JIM","last_name":"SHURES","classification":"B","division":"PRODUCTION","hit_factor":11.236},{"match_name":"BORCC USPSA March 2018 Classifier Match","match_date":"2018-03-24","stage_classifiercode":"06-03","member_number":"TY81670","first_name":"DAVID","last_name":"MILLER","classification":"A","division":"PRODUCTION","hit_factor":11.236},{"match_name":"Rankin Field Sunday USPSA","match_date":"2016-10-16","stage_classifiercode":"06-03","member_number":"TY77402","first_name":"BRIAN","last_name":"LUM","classification":"X","division":"PRODUCTION","hit_factor":11.2306},{"match_name":"Kabul 25 May 2018","match_date":"2018-05-25","stage_classifiercode":"06-03","member_number":"TY62777","first_name":"JAMES","last_name":"HALL","classification":"U","division":"PRODUCTION","hit_factor":11.2257},{"match_name":"Shoot GTR USPSA Sep 6","match_date":"2016-09-06","stage_classifiercode":"06-03","member_number":"\"\"","first_name":"DANIEL","last_name":"WENTWORTH","classification":"X","division":"PRODUCTION","hit_factor":11.2257},{"match_name":"GoShoot Outdoors March 14th","match_date":"2020-03-14","stage_classifiercode":"06-03","member_number":"A72513","first_name":"STEPHEN","last_name":"TUCKER","classification":"A","division":"PRODUCTION","hit_factor":11.2257},{"match_name":"The Irbil Open","match_date":"2017-05-14","stage_classifiercode":"06-03","member_number":"\"\"","first_name":"JOSE","last_name":"MEJIA","classification":"U","division":"PRODUCTION","hit_factor":11.2233},{"match_name":"NPCCC 9-4-16 USPSA","match_date":"2016-09-04","stage_classifiercode":"06-03","member_number":"L3746","first_name":"MOHD","last_name":"ABUALSAYYED","classification":"B","division":"PRODUCTION","hit_factor":11.2233},{"match_name":"DRRC  Mar2017","match_date":"2017-03-04","stage_classifiercode":"06-03","member_number":"A93052","first_name":"AREN","last_name":"GONZALEZ","classification":"B","division":"PRODUCTION","hit_factor":11.2128},{"match_name":"WSPS AUGUST 2017 USPSA MATCH","match_date":"2017-08-16","stage_classifiercode":"06-03","member_number":"A86288","first_name":"BENNETT","last_name":"BOYER","classification":"M","division":"PRODUCTION","hit_factor":11.2128},{"match_name":"Grandbaggers September 2018","match_date":"2018-09-06","stage_classifiercode":"06-03","member_number":"L2820","first_name":"KYLE","last_name":"SCHMIDT","classification":"M","division":"PRODUCTION","hit_factor":11.2128},{"match_name":"ORSA USPSA October 2020","match_date":"2020-10-17","stage_classifiercode":"06-03","member_number":"A72343","first_name":"PAUL","last_name":"AVERY","classification":"B","division":"PRODUCTION","hit_factor":11.2108},{"match_name":"Flagstaff Fun Shoot July 8 2017","match_date":"2017-07-08","stage_classifiercode":"06-03","member_number":"A88990","first_name":"AUSTIN","last_name":"FAULKNER","classification":"U","division":"PRODUCTION","hit_factor":11.2094},{"match_name":"2016 Columbia Cascade Section Championship","match_date":"2016-08-12","stage_classifiercode":"06-03","member_number":"A81899","first_name":"TANNER","last_name":"BREEN","classification":"B","division":"PRODUCTION","hit_factor":11.2058},{"match_name":"PSAC 20180922","match_date":"2018-09-22","stage_classifiercode":"06-03","member_number":"A86605","first_name":"SEM","last_name":"CHIM","classification":"M","division":"PRODUCTION","hit_factor":11.2},{"match_name":"Competitive Shooters of Lake Norman CORNELIUS Thursday Evening Indoor USPSA Pistol Match North Carolina","match_date":"2018-03-01","stage_classifiercode":"06-03","member_number":"A106222","first_name":"DANIEL","last_name":"LEITH","classification":"B","division":"PRODUCTION","hit_factor":11.1982},{"match_name":"Southern Maryland Practical Shooters 14 October 2018 USPSA","match_date":"2018-10-14","stage_classifiercode":"06-03","member_number":"NONE","first_name":"RYAN","last_name":"STANLEY","classification":"U","division":"PRODUCTION","hit_factor":11.1982},{"match_name":"USPSA - Bridgeville DE - lvl 1","match_date":"2018-11-04","stage_classifiercode":"06-03","member_number":"A111018","first_name":"BILLY","last_name":"SARGENT","classification":"U","division":"PRODUCTION","hit_factor":11.1872},{"match_name":"Sizzling Summer Shootfest by Tropang Vegas","match_date":"2017-06-25","stage_classifiercode":"06-03","member_number":"TY59522","first_name":"AKOS","last_name":"MESTER","classification":"A","division":"PRODUCTION","hit_factor":11.1872},{"match_name":"OPSC USPSA 8-14-2016","match_date":"2016-08-14","stage_classifiercode":"06-03","member_number":"L3746","first_name":"MOHD","last_name":"ABUALSAYYED","classification":"B","division":"PRODUCTION","hit_factor":11.1857},{"match_name":"Pinetucky USPSA 02-17-18","match_date":"2018-02-17","stage_classifiercode":"06-03","member_number":"TY100721","first_name":"JOHN","last_name":"BUCKLEY","classification":"U","division":"PRODUCTION","hit_factor":11.1857},{"match_name":"Castlewood June 2017 USPSA Match","match_date":"2017-06-24","stage_classifiercode":"06-03","member_number":"A89315","first_name":"LEE","last_name":"FOLTYN","classification":"B","division":"PRODUCTION","hit_factor":11.1857},{"match_name":"CCPL 02142016","match_date":"2016-02-14","stage_classifiercode":"06-03","member_number":"A89166","first_name":"WILL","last_name":"BUCHNOFF","classification":"B","division":"PRODUCTION","hit_factor":11.1857},{"match_name":"CSA March 2016","match_date":"2016-03-13","stage_classifiercode":"06-03","member_number":"A78797","first_name":"RYAN","last_name":"MCGLOTHEN","classification":"B","division":"PRODUCTION","hit_factor":11.1745},{"match_name":"The Great Wet Classifier - Renton USPSA - November 2020 - NW05","match_date":"2020-11-22","stage_classifiercode":"06-03","member_number":"A86887","first_name":"ALEX","last_name":"WHITE","classification":"U","division":"PRODUCTION","hit_factor":11.1732},{"match_name":"HSC USPSA June 2016","match_date":"2016-06-04","stage_classifiercode":"06-03","member_number":"a53555","first_name":"COREY","last_name":"MURPHY","classification":"A","division":"PRODUCTION","hit_factor":11.1732},{"match_name":"AAFG USPSA July 30 Pistol  Classifier","match_date":"2016-07-30","stage_classifiercode":"06-03","member_number":"A92120","first_name":"ALTON","last_name":"TURNER","classification":"B","division":"PRODUCTION","hit_factor":11.1732},{"match_name":"WPS USPSA Special Classifier October 2017","match_date":"2017-10-28","stage_classifiercode":"06-03","member_number":"PEN","first_name":"JEFF","last_name":"KELLY","classification":"U","division":"PRODUCTION","hit_factor":11.1607},{"match_name":"BRC_20170409","match_date":"2017-04-09","stage_classifiercode":"06-03","member_number":"TY78764","first_name":"STEVEN","last_name":"LIERMAN","classification":"B","division":"PRODUCTION","hit_factor":11.1607},{"match_name":"Richmond October 17-18-2015","match_date":"2015-10-17","stage_classifiercode":"06-03","member_number":"TY70680","first_name":"SERGE","last_name":"LUBATINSKY","classification":"M","division":"PRODUCTION","hit_factor":11.1607},{"match_name":"Richmond Hot Shots April 15-16-2017 USPSA Pistol Match","match_date":"2017-04-15","stage_classifiercode":"06-03","member_number":"\"\"","first_name":"TIM","last_name":"PASHOIAN","classification":"M","division":"PRODUCTION","hit_factor":11.1607},{"match_name":"Briar Rabbit July 2021","match_date":"2021-07-25","stage_classifiercode":"06-03","member_number":"A103657","first_name":"JOE","last_name":"FINCK","classification":"C","division":"PRODUCTION","hit_factor":11.1607},{"match_name":"Gem City Gun Club 1-20 And 1-21-18","match_date":"2018-01-21","stage_classifiercode":"06-03","member_number":"TY61270","first_name":"JAMIE","last_name":"MC DONOUGH","classification":"B","division":"PRODUCTION","hit_factor":11.149},{"match_name":"SMPS March 2016","match_date":"2016-03-13","stage_classifiercode":"06-03","member_number":"L3413","first_name":"CLAY","last_name":"KLEMM","classification":"A","division":"PRODUCTION","hit_factor":11.1483},{"match_name":"April 2016 Rio Grande Practical Shooting Club","match_date":"2016-04-02","stage_classifiercode":"06-03","member_number":"A90706","first_name":"CHAD","last_name":"WHITE","classification":"U","division":"PRODUCTION","hit_factor":11.138},{"match_name":"MS06 Team Magnolia USPSA","match_date":"2017-03-05","stage_classifiercode":"06-03","member_number":"A73527","first_name":"STEPHEN","last_name":"SANDRIDGE","classification":"C","division":"PRODUCTION","hit_factor":11.138},{"match_name":"Grandbaggers 07/2017","match_date":"2017-07-06","stage_classifiercode":"06-03","member_number":"A77832","first_name":"NICK","last_name":"VERHAEGHE","classification":"A","division":"PRODUCTION","hit_factor":11.1374},{"match_name":"MASTER BLASTERS & SSFGA USPSA - September","match_date":"2020-09-19","stage_classifiercode":"06-03","member_number":"A99324","first_name":"ANDREW","last_name":"DANIKAS","classification":"B","division":"PRODUCTION","hit_factor":11.1364},{"match_name":"HRPC USPSA MAY 2017","match_date":"2017-05-13","stage_classifiercode":"06-03","member_number":"FY64995","first_name":"KEN","last_name":"DOWDY","classification":"B","division":"PRODUCTION","hit_factor":11.1359},{"match_name":"ORPCI 2018.03.31 USPSA Special","match_date":"2018-03-31","stage_classifiercode":"06-03","member_number":"A109486","first_name":"BRAD","last_name":"HUEBNER","classification":"U","division":"PRODUCTION","hit_factor":11.1359},{"match_name":"Moss Branch USPSA September 22nd Match","match_date":"2018-09-22","stage_classifiercode":"06-03","member_number":"a78544","first_name":"JILES","last_name":"TREVOR","classification":"A","division":"PRODUCTION","hit_factor":11.1359},{"match_name":"Eaps August match","match_date":"2021-08-15","stage_classifiercode":"06-03","member_number":"TY108640","first_name":"MARK","last_name":"GIARDINA","classification":"B","division":"PRODUCTION","hit_factor":11.124},{"match_name":"Palmetto Gun Club - November 2016 USPSA","match_date":"2016-11-05","stage_classifiercode":"06-03","member_number":"A69787","first_name":"SHANE","last_name":"COX","classification":"B","division":"PRODUCTION","hit_factor":11.124},{"match_name":"March 2017 PCSI USPSA","match_date":"2017-03-04","stage_classifiercode":"06-03","member_number":"A89946","first_name":"JOSH","last_name":"WILCOXON","classification":"U","division":"PRODUCTION","hit_factor":11.1237},{"match_name":"Devil Dog USPSA Classifier Match-Saturday Session","match_date":"2018-03-10","stage_classifiercode":"06-03","member_number":"A80893","first_name":"LUCAS","last_name":"APPS","classification":"A","division":"PRODUCTION","hit_factor":11.1237},{"match_name":"TGR Practical Pistol Match","match_date":"2017-07-12","stage_classifiercode":"06-03","member_number":"\"\"","first_name":"JOHN","last_name":"BUCKLEY","classification":"U","division":"PRODUCTION","hit_factor":11.1235},{"match_name":"TASC 4-16-16 (15Apr16-10:27:18)","match_date":"2016-04-16","stage_classifiercode":"06-03","member_number":"A67001","first_name":"KENT","last_name":"HIGGINBOTHAM","classification":"M","division":"PRODUCTION","hit_factor":11.1235},{"match_name":"MAPSA 2016.04.09","match_date":"2016-04-09","stage_classifiercode":"06-03","member_number":"A75747","first_name":"CASEY","last_name":"WITTNER","classification":"C","division":"PRODUCTION","hit_factor":11.1111},{"match_name":"PRG July 2017 Match","match_date":"2017-07-02","stage_classifiercode":"06-03","member_number":"TY97344","first_name":"DANIEL","last_name":"FRAZIER","classification":"U","division":"PRODUCTION","hit_factor":11.1111},{"match_name":"HOPS USPSA 051620","match_date":"2020-05-16","stage_classifiercode":"06-03","member_number":"A114754","first_name":"COREY","last_name":"BIGLER","classification":"C","division":"PRODUCTION","hit_factor":11.1111},{"match_name":"TMGN April 5 USPSA Classifiers Match","match_date":"2018-04-05","stage_classifiercode":"06-03","member_number":"A101936","first_name":"WILL","last_name":"DOLAN","classification":"\"\"","division":"PRODUCTION","hit_factor":11.1111},{"match_name":"RBGC 2016-07-23","match_date":"2016-07-23","stage_classifiercode":"06-03","member_number":"A73808","first_name":"BRYAN","last_name":"HOEFER","classification":"A","division":"PRODUCTION","hit_factor":11.1111},{"match_name":"ORSA USPSA May 2018","match_date":"2018-05-19","stage_classifiercode":"06-03","member_number":"A73254","first_name":"TOM","last_name":"PARDUE","classification":"B","division":"PRODUCTION","hit_factor":11.1111},{"match_name":"WSPS AUGUST 2017 USPSA MATCH","match_date":"2017-08-16","stage_classifiercode":"06-03","member_number":"FY63352","first_name":"CINDI","last_name":"THOMAS","classification":"B","division":"PRODUCTION","hit_factor":11.1111},{"match_name":"Springfield Tactical Shooters 03/012018","match_date":"2018-03-01","stage_classifiercode":"06-03","member_number":"TY77453","first_name":"JOEL","last_name":"GUSTAFSON","classification":"B","division":"PRODUCTION","hit_factor":11.1111},{"match_name":"USPSA BDSC Baghdad Practical Shooters","match_date":"2017-01-21","stage_classifiercode":"06-03","member_number":"\"\"","first_name":"ROB","last_name":"ORGEL","classification":"U","division":"PRODUCTION","hit_factor":11.1111},{"match_name":"ORSA USPSA October 2020","match_date":"2020-10-17","stage_classifiercode":"06-03","member_number":"TY102283","first_name":"SHERWIN","last_name":"OCAMPO","classification":"B","division":"PRODUCTION","hit_factor":11.1111},{"match_name":"MRCPS  USPSA MARCH","match_date":"2017-03-19","stage_classifiercode":"06-03","member_number":"A85658","first_name":"NICK","last_name":"BERGER","classification":"A","division":"PRODUCTION","hit_factor":11.1111},{"match_name":"Htf Practical Shooters All Classifier","match_date":"2017-10-29","stage_classifiercode":"06-03","member_number":"A86204","first_name":"JOHN","last_name":"LANE","classification":"B","division":"PRODUCTION","hit_factor":11.0988},{"match_name":"Range E11even June 25th 2016 USPSA Match","match_date":"2016-06-25","stage_classifiercode":"06-03","member_number":"A87685","first_name":"BARRY","last_name":"SOCIA","classification":"C","division":"PRODUCTION","hit_factor":11.0988},{"match_name":"AGC_20170205","match_date":"2017-02-05","stage_classifiercode":"06-03","member_number":"L3719","first_name":"MATTHEW","last_name":"HESS","classification":"A","division":"PRODUCTION","hit_factor":11.0983},{"match_name":"MASTER BLASTERS & SSFGA USPSA - September","match_date":"2020-09-19","stage_classifiercode":"06-03","member_number":"TY103290","first_name":"DEVIN","last_name":"MCMANUS","classification":"B","division":"PRODUCTION","hit_factor":11.0963},{"match_name":"TAP USPSA Pistol Match Aug 28 2016 (27Aug16-10:07:04)","match_date":"2016-08-28","stage_classifiercode":"06-03","member_number":"FY81956","first_name":"KEN","last_name":"RICHARSON","classification":"B","division":"PRODUCTION","hit_factor":11.0865},{"match_name":"Southern Maryland Practical Shooters 14 October 2018 USPSA","match_date":"2018-10-14","stage_classifiercode":"06-03","member_number":"PENDING","first_name":"NESTOR","last_name":"LASERNA","classification":"U","division":"PRODUCTION","hit_factor":11.0865},{"match_name":"Schultz March USPSA","match_date":"2021-03-14","stage_classifiercode":"06-03","member_number":"L-3746","first_name":"MOHD","last_name":"ABUALSAYYED","classification":"G","division":"PRODUCTION","hit_factor":11.086},{"match_name":"MPSA 030516","match_date":"2016-03-05","stage_classifiercode":"06-03","member_number":"A78083","first_name":"JEFFREY","last_name":"BLITCH","classification":"B","division":"PRODUCTION","hit_factor":11.086},{"match_name":"Atlanta Practical Shooters March 2016 USPSA - Classifier Match","match_date":"2016-03-06","stage_classifiercode":"06-03","member_number":"A90194","first_name":"DARRELL","last_name":"WILSON","classification":"C","division":"PRODUCTION","hit_factor":11.086},{"match_name":"WINTER ALL CLASSIFIER","match_date":"2020-01-02","stage_classifiercode":"06-03","member_number":"TY112550","first_name":"CHANDLER","last_name":"BASSETT","classification":"C","division":"PRODUCTION","hit_factor":11.086},{"match_name":"NCPS USPSA Handgun Match November 29 2015","match_date":"2015-11-29","stage_classifiercode":"06-03","member_number":"A92636","first_name":"JORDAN","last_name":"SU","classification":"U","division":"PRODUCTION","hit_factor":11.0855},{"match_name":"DCPA USPSA 11- 20-2016","match_date":"2016-11-20","stage_classifiercode":"06-03","member_number":"TY73201","first_name":"JASON","last_name":"LINN","classification":"B","division":"PRODUCTION","hit_factor":11.0855},{"match_name":"Rankin Field Sunday USPSA","match_date":"2017-11-19","stage_classifiercode":"06-03","member_number":"A86712","first_name":"CHRIS","last_name":"KIMES","classification":"B","division":"PRODUCTION","hit_factor":11.0849},{"match_name":"FAS Sunday Outdoor USPSA Match","match_date":"2021-06-20","stage_classifiercode":"06-03","member_number":"A126325","first_name":"CONNER","last_name":"STROCK","classification":"U","division":"PRODUCTION","hit_factor":11.0742},{"match_name":"RCSC USPSA 26 June 16","match_date":"2016-06-26","stage_classifiercode":"06-03","member_number":"TY92791","first_name":"BEN","last_name":"REYNOLDS","classification":"C","division":"PRODUCTION","hit_factor":11.0742},{"match_name":"The Great Wet Classifier - Renton USPSA - November 2020 - NW05","match_date":"2020-11-22","stage_classifiercode":"06-03","member_number":"A131363","first_name":"DON","last_name":"CARROLL","classification":"U","division":"PRODUCTION","hit_factor":11.0734},{"match_name":"MASTER BLASTERS & SSFGA USPSA - September","match_date":"2020-09-19","stage_classifiercode":"06-03","member_number":"A104407","first_name":"KEVIN","last_name":"LALLY","classification":"B","division":"PRODUCTION","hit_factor":11.0727},{"match_name":"Richmond October 17-18-2015","match_date":"2015-10-17","stage_classifiercode":"06-03","member_number":"L3373","first_name":"JAY","last_name":"SAOUD","classification":"M","division":"PRODUCTION","hit_factor":11.0727},{"match_name":"GAS USPSA at BRRC  November 11th 2017","match_date":"2017-11-11","stage_classifiercode":"06-03","member_number":"A98333","first_name":"KEITH","last_name":"LICHAY","classification":"B","division":"PRODUCTION","hit_factor":11.0619},{"match_name":"NRG September 10th 2016","match_date":"2016-09-10","stage_classifiercode":"06-03","member_number":"A75431","first_name":"SIDNEY","last_name":"ABRAHAM","classification":"M","division":"PRODUCTION","hit_factor":11.0619},{"match_name":"Atlanta Practical Shooters March 2016 USPSA - Classifier Match","match_date":"2016-03-06","stage_classifiercode":"06-03","member_number":"A85628","first_name":"CHRIS","last_name":"MOORE","classification":"B","division":"PRODUCTION","hit_factor":11.0609},{"match_name":"WSPS AUGUST 2017 USPSA MATCH","match_date":"2017-08-16","stage_classifiercode":"06-03","member_number":"FY81518","first_name":"ANTHONY","last_name":"CAPONIGRO","classification":"A","division":"PRODUCTION","hit_factor":11.0599},{"match_name":"The Armory Indoor League","match_date":"2016-06-24","stage_classifiercode":"06-03","member_number":"TY87879","first_name":"ROBERT","last_name":"WYATT","classification":"B","division":"PRODUCTION","hit_factor":11.0497},{"match_name":"WVPPS June 2018","match_date":"2018-06-17","stage_classifiercode":"06-03","member_number":"TY93647","first_name":"JAMES","last_name":"MITCHELL","classification":"B","division":"PRODUCTION","hit_factor":11.0497},{"match_name":"TASC 4-16-16 (15Apr16-10:27:18)","match_date":"2016-04-16","stage_classifiercode":"06-03","member_number":"A86059","first_name":"JOSH","last_name":"LEONG","classification":"U","division":"PRODUCTION","hit_factor":11.0485},{"match_name":"USPSA - Bridgeville DE - lvl 1","match_date":"2018-11-04","stage_classifiercode":"06-03","member_number":"TY58056","first_name":"NOEL","last_name":"MARUCUT","classification":"A","division":"PRODUCTION","hit_factor":11.0375},{"match_name":"NISA April Classifer Match 2016","match_date":"2016-04-24","stage_classifiercode":"06-03","member_number":"TY90211","first_name":"JASON","last_name":"DOWNS","classification":"C","division":"PRODUCTION","hit_factor":11.0375},{"match_name":"Pioneer Action Shooters APR 2016","match_date":"2016-04-24","stage_classifiercode":"06-03","member_number":"A79813","first_name":"JOEL","last_name":"PENNEY","classification":"B","division":"PRODUCTION","hit_factor":11.0375},{"match_name":"SPSA USPSA April 4th Sat match","match_date":"2017-04-22","stage_classifiercode":"06-03","member_number":"TY83413","first_name":"DOUG","last_name":"HARDING","classification":"B","division":"PRODUCTION","hit_factor":11.0375},{"match_name":"Devil Dog USPSA Classifier Match-Saturday Session","match_date":"2018-03-10","stage_classifiercode":"06-03","member_number":"A106616","first_name":"BASILIO","last_name":"KEMBLE","classification":"C","division":"PRODUCTION","hit_factor":11.0375},{"match_name":"Chillicothe April-2018 USPSA Classifier Match","match_date":"2018-04-28","stage_classifiercode":"06-03","member_number":"FY87089","first_name":"WILLIS","last_name":"WHEELER","classification":"B","division":"PRODUCTION","hit_factor":11.036},{"match_name":"Griffin USPSA Match May 2017","match_date":"2017-05-20","stage_classifiercode":"06-03","member_number":"A95112","first_name":"DAVID","last_name":"HOLLAND","classification":"A","division":"PRODUCTION","hit_factor":11.0329},{"match_name":"Kidlat  May Club Match","match_date":"2017-05-06","stage_classifiercode":"06-03","member_number":"A72560","first_name":"VITAN","last_name":"GOTSEV","classification":"B","division":"PRODUCTION","hit_factor":11.0329},{"match_name":"Magnolia Rifle and Pistol Club July classifier match","match_date":"2021-07-03","stage_classifiercode":"06-03","member_number":"A75028","first_name":"TYLER","last_name":"THARP","classification":"B","division":"PRODUCTION","hit_factor":11.0312},{"match_name":"AREA 59  SPRING ALL CLASSIFIER","match_date":"2018-03-31","stage_classifiercode":"06-03","member_number":"A70759","first_name":"MARC","last_name":"DEMEZA","classification":"B","division":"PRODUCTION","hit_factor":11.0236},{"match_name":"2016 BSPSC Fred Jacobi CCW Match","match_date":"2016-10-09","stage_classifiercode":"06-03","member_number":"\"\"","first_name":"TIM","last_name":"THOMAS","classification":"M","division":"PRODUCTION","hit_factor":11.0236},{"match_name":"CAS 09-06-20","match_date":"2020-09-06","stage_classifiercode":"06-03","member_number":"A100186","first_name":"SCOT","last_name":"JONES","classification":"A","division":"PRODUCTION","hit_factor":11.0218},{"match_name":"USPSA Strategic Edge October 2018","match_date":"2018-10-20","stage_classifiercode":"06-03","member_number":"A98348","first_name":"RYAN","last_name":"STEWART","classification":"B","division":"PRODUCTION","hit_factor":11.0218},{"match_name":"WVPPS June 2018","match_date":"2018-06-17","stage_classifiercode":"06-03","member_number":"TY80388","first_name":"MATT","last_name":"DENNIS","classification":"B","division":"PRODUCTION","hit_factor":11.0199},{"match_name":"Judes Peanut Butter Scissorhands","match_date":"2016-06-01","stage_classifiercode":"06-03","member_number":"L3496","first_name":"ROB","last_name":"HALE","classification":"B","division":"PRODUCTION","hit_factor":11.0199},{"match_name":"Dawg Valley USPSA Sept 8 2018","match_date":"2018-09-08","stage_classifiercode":"06-03","member_number":"A90105","first_name":"CHRIS","last_name":"MULFORD","classification":"A","division":"PRODUCTION","hit_factor":11.018},{"match_name":"Fort Wayne USPSA April 2021","match_date":"2021-04-18","stage_classifiercode":"06-03","member_number":"TY119289","first_name":"ALEX","last_name":"MORALES","classification":"C","division":"PRODUCTION","hit_factor":11.0132},{"match_name":"SSPSC  USPSA 4-3&4 -21","match_date":"2021-04-01","stage_classifiercode":"06-03","member_number":"A130633","first_name":"JOHN","last_name":"GABRIEL","classification":"\"\"","division":"PRODUCTION","hit_factor":11.0112},{"match_name":"MPSA 030516","match_date":"2016-03-05","stage_classifiercode":"06-03","member_number":"A92885","first_name":"TAYLOR","last_name":"ZIMMERMAN","classification":"U","division":"PRODUCTION","hit_factor":11.0112},{"match_name":"Richmond October 17-18-2015","match_date":"2015-10-17","stage_classifiercode":"06-03","member_number":"TY52002","first_name":"DOUG","last_name":"WADE","classification":"B","division":"PRODUCTION","hit_factor":11.0092},{"match_name":"Minot USPSA 1-14-18","match_date":"2018-01-14","stage_classifiercode":"06-03","member_number":"A87274","first_name":"MARK","last_name":"PADUA","classification":"B","division":"PRODUCTION","hit_factor":11.0011},{"match_name":"Schultz March USPSA","match_date":"2021-03-14","stage_classifiercode":"06-03","member_number":"TY102728","first_name":"LARRY","last_name":"DAMORE","classification":"B","division":"PRODUCTION","hit_factor":11.0011},{"match_name":"WVRPC USPSA 5 AUGUST 2017","match_date":"2017-08-05","stage_classifiercode":"06-03","member_number":"TY60062","first_name":"JONATHAN","last_name":"RHOADES","classification":"B","division":"PRODUCTION","hit_factor":11.0011},{"match_name":"WSRC USPSA 7/15/2017","match_date":"2017-07-15","stage_classifiercode":"06-03","member_number":"A95915","first_name":"WILLIAM","last_name":"BERKEMEIER","classification":"B","division":"PRODUCTION","hit_factor":10.9966},{"match_name":"MPSA 101516","match_date":"2016-10-15","stage_classifiercode":"06-03","member_number":"A37163","first_name":"LARRY","last_name":"HUFF","classification":"A","division":"PRODUCTION","hit_factor":10.989},{"match_name":"APSC USPSA  3-7-20","match_date":"2020-03-06","stage_classifiercode":"06-03","member_number":"A111836","first_name":"JOSHUA","last_name":"BAUMAN","classification":"U","division":"PRODUCTION","hit_factor":10.989},{"match_name":"MPSA 070117","match_date":"2017-07-01","stage_classifiercode":"06-03","member_number":"A92885","first_name":"TAYLOR","last_name":"ZIMMERMAN","classification":"B","division":"PRODUCTION","hit_factor":10.989},{"match_name":"ORGC Independance Day  2018 Pistol Match","match_date":"2018-07-01","stage_classifiercode":"06-03","member_number":"A84868","first_name":"KEVIN","last_name":"BOCK","classification":"M","division":"PRODUCTION","hit_factor":10.9865},{"match_name":"WVPPS June 2018","match_date":"2018-06-17","stage_classifiercode":"06-03","member_number":"TY82031","first_name":"JEFF","last_name":"JONES","classification":"B","division":"PRODUCTION","hit_factor":10.9865},{"match_name":"Moss Branch USPSA September 22nd Match","match_date":"2018-09-22","stage_classifiercode":"06-03","member_number":"A107041","first_name":"KACEE","last_name":"HOLMES","classification":"U","division":"PRODUCTION","hit_factor":10.984},{"match_name":"LCSC Classifier 042918","match_date":"2018-04-28","stage_classifiercode":"06-03","member_number":"TY17315","first_name":"RON","last_name":"NAKABAYASHI","classification":"B","division":"PRODUCTION","hit_factor":10.9769},{"match_name":"WELD ECO09 20181021","match_date":"2018-10-21","stage_classifiercode":"06-03","member_number":"A83596","first_name":"JAY","last_name":"WHITTAKER","classification":"G","division":"PRODUCTION","hit_factor":10.9769},{"match_name":"OPSA November 2017","match_date":"2017-11-26","stage_classifiercode":"06-03","member_number":"TY26269","first_name":"ALLEN","last_name":"PARSONS","classification":"A","division":"PRODUCTION","hit_factor":10.9742},{"match_name":"Armory Indoor League","match_date":"2020-03-12","stage_classifiercode":"06-03","member_number":"TY87879","first_name":"ROBERT","last_name":"WYATT","classification":"M","division":"PRODUCTION","hit_factor":10.9742},{"match_name":"RBPS April Pistol Match","match_date":"2017-04-15","stage_classifiercode":"06-03","member_number":"A94414","first_name":"JAMES","last_name":"DICKINSON","classification":"C","division":"PRODUCTION","hit_factor":10.9742},{"match_name":"Pathfinder July USPSA Match","match_date":"2016-07-17","stage_classifiercode":"06-03","member_number":"A83981","first_name":"ADAM","last_name":"HARRIS2","classification":"U","division":"PRODUCTION","hit_factor":10.9714},{"match_name":"MISS Match 1/3/18","match_date":"2018-01-03","stage_classifiercode":"06-03","member_number":"A105985","first_name":"MATT","last_name":"HEISER","classification":"C","division":"PRODUCTION","hit_factor":10.9685},{"match_name":"HSC USPSA June 2016","match_date":"2016-06-04","stage_classifiercode":"06-03","member_number":"Ty83667","first_name":"DARREN","last_name":"RASH","classification":"B","division":"PRODUCTION","hit_factor":10.9649},{"match_name":"Pioneer Action Shooters APR 2016","match_date":"2016-04-24","stage_classifiercode":"06-03","member_number":"Ty76786","first_name":"ROB","last_name":"LACROIX","classification":"M","division":"PRODUCTION","hit_factor":10.9649},{"match_name":"SCCCJULYCLASSIFIER2016","match_date":"2016-07-30","stage_classifiercode":"06-03","member_number":"a93567","first_name":"GREG","last_name":"REDDEN","classification":"U","division":"PRODUCTION","hit_factor":10.9557},{"match_name":"APSC USPSA 7-7-2018","match_date":"2018-07-07","stage_classifiercode":"06-03","member_number":"TY70687","first_name":"ROMMEL","last_name":"MERCADO","classification":"B","division":"PRODUCTION","hit_factor":10.9529},{"match_name":"SAPSA July 2016","match_date":"2016-07-16","stage_classifiercode":"06-03","member_number":"A45634","first_name":"MARK","last_name":"NUNNALLY","classification":"B","division":"PRODUCTION","hit_factor":10.9529},{"match_name":"GTR USPSA Tues April 19","match_date":"2016-04-19","stage_classifiercode":"06-03","member_number":"A89113","first_name":"CORTLAND","last_name":"BAILEY","classification":"B","division":"PRODUCTION","hit_factor":10.9529},{"match_name":"GPSL 11-6-2018","match_date":"2018-11-06","stage_classifiercode":"06-03","member_number":"A112107","first_name":"BLAKE","last_name":"UNGER","classification":"\"\"","division":"PRODUCTION","hit_factor":10.9529},{"match_name":"CFRPC USPSA 2016 DECEMBER","match_date":"2016-12-18","stage_classifiercode":"06-03","member_number":"TY67110","first_name":"SEAN","last_name":"WHITAKER","classification":"C","division":"PRODUCTION","hit_factor":10.9497},{"match_name":"RSPP 3rd Saturday September 2016","match_date":"2016-09-17","stage_classifiercode":"06-03","member_number":"A77832","first_name":"NICK","last_name":"VERHAEGHE","classification":"A","division":"PRODUCTION","hit_factor":10.9464},{"match_name":"Schultz September 2018","match_date":"2018-09-09","stage_classifiercode":"06-03","member_number":"TY31733","first_name":"NEIL","last_name":"SANTIAGO","classification":"B","division":"PRODUCTION","hit_factor":10.9409},{"match_name":"AREA 59  BIG BANG ALL CLASSIFIER","match_date":"2017-12-30","stage_classifiercode":"06-03","member_number":"A105891","first_name":"TIMOTHY","last_name":"SANDER","classification":"U","division":"PRODUCTION","hit_factor":10.9409},{"match_name":"BTSA USPSA 2021-7 Aug 7 part two","match_date":"2021-08-07","stage_classifiercode":"06-03","member_number":"0000","first_name":"SCOTT","last_name":"CUTHBERT","classification":"U","division":"PRODUCTION","hit_factor":10.9375},{"match_name":"Homestead September Classifier Match","match_date":"2020-09-20","stage_classifiercode":"06-03","member_number":"A122824","first_name":"JOYCE","last_name":"HERNANDEZ","classification":"U","division":"PRODUCTION","hit_factor":10.9302},{"match_name":"LCHG September 2018 USPSA Special Classifier","match_date":"2018-09-08","stage_classifiercode":"06-03","member_number":"A35678","first_name":"RUSS","last_name":"MCELYEA","classification":"B","division":"PRODUCTION","hit_factor":10.929},{"match_name":"CGC CTX02 Monthly USPSA Match - December 2017","match_date":"2017-12-17","stage_classifiercode":"06-03","member_number":"A102062","first_name":"TAYLOR","last_name":"PHILLIPS","classification":"D","division":"PRODUCTION","hit_factor":10.929},{"match_name":"OPSC USPSA 8-14-2016","match_date":"2016-08-14","stage_classifiercode":"06-03","member_number":"A91501","first_name":"NATHAN","last_name":"KNUTSON","classification":"C","division":"PRODUCTION","hit_factor":10.9253},{"match_name":"Southkent USPSA June match","match_date":"2017-06-17","stage_classifiercode":"06-03","member_number":"A52414","first_name":"RICHARD","last_name":"SERRY","classification":"A","division":"PRODUCTION","hit_factor":10.9253},{"match_name":"LCSC Classifier 042918","match_date":"2018-04-28","stage_classifiercode":"06-03","member_number":"TY86621","first_name":"RICK","last_name":"SERVANDO","classification":"A","division":"PRODUCTION","hit_factor":10.9215},{"match_name":"WSPS AUGUST 2017 USPSA MATCH","match_date":"2017-08-16","stage_classifiercode":"06-03","member_number":"A71669","first_name":"BRIAN","last_name":"KESTER","classification":"C","division":"PRODUCTION","hit_factor":10.9215},{"match_name":"FSTC USPSA 10-22-2017","match_date":"2017-10-22","stage_classifiercode":"06-03","member_number":"TY96001","first_name":"BRANDON","last_name":"POWERS","classification":"A","division":"PRODUCTION","hit_factor":10.9175},{"match_name":"Brock's Gap USPSA March 6 2021","match_date":"2021-03-06","stage_classifiercode":"06-03","member_number":"ty102553","first_name":"FRANK","last_name":"SWEET","classification":"U","division":"PRODUCTION","hit_factor":10.917},{"match_name":"WELD ECO09 20181021","match_date":"2018-10-21","stage_classifiercode":"06-03","member_number":"A95219","first_name":"LUKE","last_name":"POOLE","classification":"C","division":"PRODUCTION","hit_factor":10.917},{"match_name":"Chillicothe April-2018 USPSA Classifier Match","match_date":"2018-04-28","stage_classifiercode":"06-03","member_number":"A109815","first_name":"JASON","last_name":"BROUGHTON","classification":"U","division":"PRODUCTION","hit_factor":10.9131},{"match_name":"Mssa Uspsa 05-28-17","match_date":"2017-05-28","stage_classifiercode":"06-03","member_number":"A99850","first_name":"BRAD","last_name":"WARD2","classification":"C","division":"PRODUCTION","hit_factor":10.9091},{"match_name":"BLUE RIDGE ARSENAL July 6 Classifier Match","match_date":"2018-07-06","stage_classifiercode":"06-03","member_number":"A109718","first_name":"KYLE","last_name":"WEIR","classification":"B","division":"PRODUCTION","hit_factor":10.9051},{"match_name":"NRG September 10th 2016","match_date":"2016-09-10","stage_classifiercode":"06-03","member_number":"TY87942","first_name":"RANDY","last_name":"BUNDALIAN","classification":"B","division":"PRODUCTION","hit_factor":10.9051},{"match_name":"WSPS AUGUST 2017 USPSA MATCH","match_date":"2017-08-16","stage_classifiercode":"06-03","member_number":"FY82148","first_name":"CLYDE","last_name":"FORMILLEZA","classification":"B","division":"PRODUCTION","hit_factor":10.9051},{"match_name":"Schultz September 2018","match_date":"2018-09-09","stage_classifiercode":"06-03","member_number":"FY76052","first_name":"JOHN","last_name":"MEREDITH","classification":"C","division":"PRODUCTION","hit_factor":10.9051},{"match_name":"SCAPSA MN05 Fall League 4","match_date":"2017-08-29","stage_classifiercode":"06-03","member_number":"A92123","first_name":"JEFF","last_name":"GRIMM","classification":"U","division":"PRODUCTION","hit_factor":10.9051},{"match_name":"NPCCC 9-4-16 USPSA","match_date":"2016-09-04","stage_classifiercode":"06-03","member_number":"A95237","first_name":"NICK","last_name":"AMADIO","classification":"U","division":"PRODUCTION","hit_factor":10.9049},{"match_name":"BORCC USPSA Classifier Match January 2017","match_date":"2017-01-22","stage_classifiercode":"06-03","member_number":"TY54487","first_name":"DAVID","last_name":"GROVER","classification":"A","division":"PRODUCTION","hit_factor":10.901},{"match_name":"BHPC USPSA Match Classifier IOWA","match_date":"2018-06-16","stage_classifiercode":"06-03","member_number":"ty107850","first_name":"DREW","last_name":"GADBERRY","classification":"UNKNOWN","division":"PRODUCTION","hit_factor":10.901},{"match_name":"NPCCC 04-01-2018 USPSA","match_date":"2018-04-01","stage_classifiercode":"06-03","member_number":"A84247","first_name":"ELI","last_name":"BARROWS","classification":"A","division":"PRODUCTION","hit_factor":10.9005},{"match_name":"EHPSA USPSA 27 May 2018","match_date":"2018-05-27","stage_classifiercode":"06-03","member_number":"A74977","first_name":"ETHAN","last_name":"CESSNA","classification":"B","division":"PRODUCTION","hit_factor":10.8932},{"match_name":"NPCCC 04-01-2018 USPSA","match_date":"2018-04-01","stage_classifiercode":"06-03","member_number":"TY94234","first_name":"HRISTO","last_name":"DOUHALOV","classification":"C","division":"PRODUCTION","hit_factor":10.8932},{"match_name":"WNPL USPSA  - October HoseFest 2021","match_date":"2021-10-09","stage_classifiercode":"06-03","member_number":"PENDNG","first_name":"PAUL","last_name":"SOO","classification":"U","division":"PRODUCTION","hit_factor":10.8932},{"match_name":"Cactus Match USPSA ALL CLASSIFIER July 2018","match_date":"2018-07-01","stage_classifiercode":"06-03","member_number":"TY97641","first_name":"SHANE","last_name":"SMITH","classification":"C","division":"PRODUCTION","hit_factor":10.8922},{"match_name":"Eagles Nest August 20th","match_date":"2017-08-20","stage_classifiercode":"06-03","member_number":"TY85173","first_name":"RYAN","last_name":"ZAMBRZYCKI","classification":"A","division":"PRODUCTION","hit_factor":10.8922},{"match_name":"Uspsa Classifier","match_date":"2018-05-06","stage_classifiercode":"06-03","member_number":"Tyf-93988","first_name":"OSCAR","last_name":"TRACHMANN","classification":"U","division":"PRODUCTION","hit_factor":10.8889},{"match_name":"OOPS February 2016","match_date":"2016-02-27","stage_classifiercode":"06-03","member_number":"a23819","first_name":"MIKE","last_name":"CARMONEY","classification":"A","division":"PRODUCTION","hit_factor":10.8876},{"match_name":"Richmond Hot Shots April 15-16-2017 USPSA Pistol Match","match_date":"2017-04-15","stage_classifiercode":"06-03","member_number":"FY25171","first_name":"KEVIN","last_name":"CHU","classification":"A","division":"PRODUCTION","hit_factor":10.8844},{"match_name":"EHPSA USPSA 27 May 2018","match_date":"2018-05-27","stage_classifiercode":"06-03","member_number":"A109739","first_name":"TAYLOR","last_name":"SOVASTION","classification":"U","division":"PRODUCTION","hit_factor":10.8814},{"match_name":"Htf Practical Shooters All Classifier","match_date":"2017-10-29","stage_classifiercode":"06-03","member_number":"a102213","first_name":"MYKEL","last_name":"STOREY","classification":"U","division":"PRODUCTION","hit_factor":10.8814},{"match_name":"WLPS November 2017","match_date":"2017-11-19","stage_classifiercode":"06-03","member_number":"A81724","first_name":"ROBERT","last_name":"WELCH","classification":"A","division":"PRODUCTION","hit_factor":10.8814},{"match_name":"FVPS June Match","match_date":"2016-06-04","stage_classifiercode":"06-03","member_number":"\"\"","first_name":"JUSTIN","last_name":"KILEY","classification":"C","division":"PRODUCTION","hit_factor":10.8768},{"match_name":"Tropang Vegas All Classifier Match","match_date":"2021-07-11","stage_classifiercode":"06-03","member_number":"Ty98102","first_name":"JOHN","last_name":"LARA","classification":"B","division":"PRODUCTION","hit_factor":10.8768},{"match_name":"LdF USPSA Classifier Match December 12 2020","match_date":"2020-12-12","stage_classifiercode":"06-03","member_number":"L3621","first_name":"PETE","last_name":"CORKERY","classification":"B","division":"PRODUCTION","hit_factor":10.8696},{"match_name":"SOAP April 2021 USPSA Match","match_date":"2021-04-10","stage_classifiercode":"06-03","member_number":"Ty56287","first_name":"CHAD","last_name":"CASE","classification":"M","division":"PRODUCTION","hit_factor":10.8696},{"match_name":"2018-03-02 USPSA at Phoenix Rod and Gun Club","match_date":"2018-03-03","stage_classifiercode":"06-03","member_number":"A83624","first_name":"BYRON","last_name":"AYLE","classification":"B","division":"PRODUCTION","hit_factor":10.8696},{"match_name":"SAPSA July 2016","match_date":"2016-07-16","stage_classifiercode":"06-03","member_number":"A88003","first_name":"RICH","last_name":"OTT","classification":"B","division":"PRODUCTION","hit_factor":10.8696},{"match_name":"SCS USPSA Pistol with Classifer - Special Classifier July 31 2016","match_date":"2016-07-31","stage_classifiercode":"06-03","member_number":"A88026","first_name":"ROLAN","last_name":"OCAMPO","classification":"B","division":"PRODUCTION","hit_factor":10.8696},{"match_name":"ASC USPSA Apr. 18","match_date":"2021-04-18","stage_classifiercode":"06-03","member_number":"TY94467","first_name":"KEITH","last_name":"KRAUSE","classification":"B","division":"PRODUCTION","hit_factor":10.8696},{"match_name":"Henry County Gun Club USPSA","match_date":"2021-10-09","stage_classifiercode":"06-03","member_number":"A112410","first_name":"MASON","last_name":"WORTHAM","classification":"M","division":"PRODUCTION","hit_factor":10.8696},{"match_name":"BSPSC 2017 October Jacobi Concealed Carry","match_date":"2017-10-08","stage_classifiercode":"06-03","member_number":"A99632","first_name":"RENALDO","last_name":"PHILLIPS","classification":"C","division":"PRODUCTION","hit_factor":10.8696},{"match_name":"SEPSA April 2017","match_date":"2017-04-08","stage_classifiercode":"06-03","member_number":"L3439","first_name":"AL","last_name":"WILLIAMSON","classification":"B","division":"PRODUCTION","hit_factor":10.8647},{"match_name":"BRRC USPSA MAY 14 2016","match_date":"2016-05-14","stage_classifiercode":"06-03","member_number":"TY86060","first_name":"NANCHO","last_name":"RODRIGUEZ","classification":"C","division":"PRODUCTION","hit_factor":10.8597},{"match_name":"Gem City Gun Club 7-3 and 7-4","match_date":"2021-07-03","stage_classifiercode":"06-03","member_number":"A114683","first_name":"MIKE","last_name":"WEHRER","classification":"C","division":"PRODUCTION","hit_factor":10.8578},{"match_name":"Prescott 3rd Sunday USPSA 4-18-21 ALL CLASSIFIER","match_date":"2021-04-18","stage_classifiercode":"06-03","member_number":"TY92943","first_name":"JAMIE","last_name":"SHROUFE","classification":"A","division":"PRODUCTION","hit_factor":10.8527},{"match_name":"ORPCI 2018.03.31 USPSA Special","match_date":"2018-03-31","stage_classifiercode":"06-03","member_number":"A106367","first_name":"DANIEL","last_name":"MATHIAS","classification":"C","division":"PRODUCTION","hit_factor":10.8527},{"match_name":"Central IL Practical Shooters IL02 Havana April USPSA","match_date":"2017-04-08","stage_classifiercode":"06-03","member_number":"A90126","first_name":"TOM","last_name":"BURZYNSKI","classification":"C","division":"PRODUCTION","hit_factor":10.8475},{"match_name":"SPSA USPSA April 4th Sat match","match_date":"2017-04-22","stage_classifiercode":"06-03","member_number":"TY85974","first_name":"JIM","last_name":"BASCIO","classification":"A","division":"PRODUCTION","hit_factor":10.8475},{"match_name":"Hose Monster Action","match_date":"2020-02-16","stage_classifiercode":"06-03","member_number":"a83657","first_name":"ROBERT","last_name":"RABINO","classification":"B","division":"PRODUCTION","hit_factor":10.8475},{"match_name":"LCHG September 2018 USPSA Special Classifier","match_date":"2018-09-08","stage_classifiercode":"06-03","member_number":"none","first_name":"RICHARD","last_name":"STRANIERE","classification":"X","division":"PRODUCTION","hit_factor":10.846},{"match_name":"Htf Practical Shooters All Classifier","match_date":"2017-10-29","stage_classifiercode":"06-03","member_number":"TY84186","first_name":"CHRIS","last_name":"MAGYAR","classification":"B","division":"PRODUCTION","hit_factor":10.846},{"match_name":"Veterans 3 Gun AM Classifier Benefit Match","match_date":"2020-02-22","stage_classifiercode":"06-03","member_number":"A123998","first_name":"JOSH","last_name":"MARTIN","classification":"A","division":"PRODUCTION","hit_factor":10.846},{"match_name":"Richmond Hot Shots April 15-16-2017 USPSA Pistol Match","match_date":"2017-04-15","stage_classifiercode":"06-03","member_number":"A73996","first_name":"VER","last_name":"CORNELIO","classification":"B","division":"PRODUCTION","hit_factor":10.846},{"match_name":"NOCPC Oct 2017","match_date":"2017-10-08","stage_classifiercode":"06-03","member_number":"a103608","first_name":"BRANDON","last_name":"MILLER","classification":"U","division":"PRODUCTION","hit_factor":10.846},{"match_name":"VISSC Bono","match_date":"2020-10-25","stage_classifiercode":"06-03","member_number":"A113546","first_name":"JOHN","last_name":"BOWKER","classification":"B","division":"PRODUCTION","hit_factor":10.846},{"match_name":"APS August 1st Monthly USPSA Match  Classifier Match","match_date":"2021-08-01","stage_classifiercode":"06-03","member_number":"A116095","first_name":"COLE","last_name":"SIMMONS 2","classification":"U","division":"PRODUCTION","hit_factor":10.8407},{"match_name":"Cortland Pistol Club Sept 27 USPSA Classifier Match","match_date":"2020-09-27","stage_classifiercode":"06-03","member_number":"A118294","first_name":"ANDREW","last_name":"PEARCE","classification":"C","division":"PRODUCTION","hit_factor":10.8407},{"match_name":"PPS USPSA 2018-09-22","match_date":"2018-09-22","stage_classifiercode":"06-03","member_number":"TY75997","first_name":"BRIAN","last_name":"STOKER","classification":"B","division":"PRODUCTION","hit_factor":10.8407},{"match_name":"BRC_20170409","match_date":"2017-04-09","stage_classifiercode":"06-03","member_number":"A93979","first_name":"ERIC","last_name":"BUTLER","classification":"C","division":"PRODUCTION","hit_factor":10.8352},{"match_name":"2015 Ontelaunee Holiday Hosefest","match_date":"2015-12-26","stage_classifiercode":"06-03","member_number":"\"\"","first_name":"ERIC","last_name":"KOSTERICH","classification":"B","division":"PRODUCTION","hit_factor":10.8352},{"match_name":"RSPP 3rd Saturday September 2016","match_date":"2016-09-17","stage_classifiercode":"06-03","member_number":"FY73383","first_name":"SANDY","last_name":"RUTHVEN","classification":"M","division":"PRODUCTION","hit_factor":10.8342},{"match_name":"Crooked Creek Pistol League - October 2020","match_date":"2020-10-17","stage_classifiercode":"06-03","member_number":"A78470","first_name":"JASON","last_name":"CALVERT","classification":"B","division":"PRODUCTION","hit_factor":10.8342},{"match_name":"SUPS All Classifier Match March 1718 2018","match_date":"2018-03-17","stage_classifiercode":"06-03","member_number":"TY10571","first_name":"GLENFRED","last_name":"WONG","classification":"A","division":"PRODUCTION","hit_factor":10.8342},{"match_name":"NCPS USPSA Handgun Match November 29 2015","match_date":"2015-11-29","stage_classifiercode":"06-03","member_number":"A92599","first_name":"JEREMY","last_name":"CHEUNG","classification":"U","division":"PRODUCTION","hit_factor":10.8287},{"match_name":"SMPS March 2016","match_date":"2016-03-13","stage_classifiercode":"06-03","member_number":"A90562","first_name":"CHRIS","last_name":"JACKSON","classification":"B","division":"PRODUCTION","hit_factor":10.8287},{"match_name":"SEPSA April 2017","match_date":"2017-04-08","stage_classifiercode":"06-03","member_number":"A89082","first_name":"MIGUEL","last_name":"COLES","classification":"A","division":"PRODUCTION","hit_factor":10.8287},{"match_name":"GTR USPSA Tues April 19","match_date":"2016-04-19","stage_classifiercode":"06-03","member_number":"A90959","first_name":"WILL","last_name":"OWENS","classification":"C","division":"PRODUCTION","hit_factor":10.823},{"match_name":"NPCCC 9-4-16 USPSA","match_date":"2016-09-04","stage_classifiercode":"06-03","member_number":"A68159","first_name":"ANTHONY","last_name":"ALTERIO","classification":"A","division":"PRODUCTION","hit_factor":10.823},{"match_name":"RSPP 3rd Saturday July 2018","match_date":"2018-07-20","stage_classifiercode":"06-03","member_number":"A110708","first_name":"TIM","last_name":"SINOGO","classification":"U","division":"PRODUCTION","hit_factor":10.823},{"match_name":"MCPSL Pistol 4-8-17","match_date":"2017-04-08","stage_classifiercode":"06-03","member_number":"TY95742","first_name":"CAMDEN","last_name":"LEE","classification":"C","division":"PRODUCTION","hit_factor":10.8168},{"match_name":"LCSC Classifier 042918","match_date":"2018-04-28","stage_classifiercode":"06-03","member_number":"A104343","first_name":"RICHARD","last_name":"BYRD","classification":"C","division":"PRODUCTION","hit_factor":10.8108},{"match_name":"BRC_20180311","match_date":"2018-03-11","stage_classifiercode":"06-03","member_number":"A59168","first_name":"PETER","last_name":"PRES","classification":"B","division":"PRODUCTION","hit_factor":10.8108},{"match_name":"PCSI - July 2018 USPSA","match_date":"2018-07-07","stage_classifiercode":"06-03","member_number":"TY77132","first_name":"MARK","last_name":"ROEBKE","classification":"B","division":"PRODUCTION","hit_factor":10.8108},{"match_name":"Fairfax PS USPSA June 2017","match_date":"2017-06-27","stage_classifiercode":"06-03","member_number":"A101236","first_name":"ISAAC","last_name":"GROSFELD-KATZ","classification":"C","division":"PRODUCTION","hit_factor":10.8108},{"match_name":"WELD ECO09 20181021","match_date":"2018-10-21","stage_classifiercode":"06-03","member_number":"A84857","first_name":"SCOTT","last_name":"LAPAGLIA","classification":"C","division":"PRODUCTION","hit_factor":10.8108},{"match_name":"Moss Branch USPSA September 22nd Match","match_date":"2018-09-22","stage_classifiercode":"06-03","member_number":"\"\"","first_name":"HAKIM","last_name":"SATTERFIELD","classification":"B","division":"PRODUCTION","hit_factor":10.8108},{"match_name":"Chillicothe April-2018 USPSA Classifier Match","match_date":"2018-04-28","stage_classifiercode":"06-03","member_number":"A101219","first_name":"CHAD","last_name":"ELLIOTT","classification":"C","division":"PRODUCTION","hit_factor":10.8049},{"match_name":"WVPPS May 2017","match_date":"2017-05-21","stage_classifiercode":"06-03","member_number":"TY66824","first_name":"MICHAEL","last_name":"MCCAULEY","classification":"B","division":"PRODUCTION","hit_factor":10.8049},{"match_name":"BRC_20180311","match_date":"2018-03-11","stage_classifiercode":"06-03","member_number":"TY90153","first_name":"GEORGE","last_name":"SHORTER","classification":"A","division":"PRODUCTION","hit_factor":10.7991},{"match_name":"Tidewater Practical Shooter October 12th Uspsa Match","match_date":"2020-10-12","stage_classifiercode":"06-03","member_number":"TY109964","first_name":"SMUND","last_name":"HANEVIK","classification":"C","division":"PRODUCTION","hit_factor":10.7991},{"match_name":"CSA Sept 2016","match_date":"2016-09-11","stage_classifiercode":"06-03","member_number":"A85582","first_name":"BRADLEY","last_name":"PERRY","classification":"B","division":"PRODUCTION","hit_factor":10.7991},{"match_name":"Richmond Hot Shots October 17-18-2020 USPSA Pistol","match_date":"2020-10-17","stage_classifiercode":"06-03","member_number":"A90398","first_name":"RICHARD","last_name":"MOTTA","classification":"B","division":"PRODUCTION","hit_factor":10.7991},{"match_name":"Springfield Tactical Shooters 04-07-2016","match_date":"2016-04-07","stage_classifiercode":"06-03","member_number":"TY78203","first_name":"JIM","last_name":"SHURES","classification":"B","division":"PRODUCTION","hit_factor":10.7991},{"match_name":"MAPSA 2016.04.09","match_date":"2016-04-09","stage_classifiercode":"06-03","member_number":"TY68358","first_name":"MICHEAL","last_name":"DAHL","classification":"B","division":"PRODUCTION","hit_factor":10.7987},{"match_name":"LIPSA - April 30th 2017 - USPSA Match Special Classifier","match_date":"2017-04-30","stage_classifiercode":"06-03","member_number":"L3915","first_name":"SALVATORE","last_name":"RUSSO","classification":"C","division":"PRODUCTION","hit_factor":10.7981},{"match_name":"LCSA USPSA AUGUST 2018","match_date":"2018-08-12","stage_classifiercode":"06-03","member_number":"A89315","first_name":"LEE","last_name":"FOLTYN","classification":"B","division":"PRODUCTION","hit_factor":10.793},{"match_name":"ORPCI 2018.03.31 USPSA Special","match_date":"2018-03-31","stage_classifiercode":"06-03","member_number":"TY78679","first_name":"RICHARD","last_name":"HIBBS","classification":"D","division":"PRODUCTION","hit_factor":10.793},{"match_name":"Brazosland Pistoleros September 17 2017 USPSA","match_date":"2017-09-17","stage_classifiercode":"06-03","member_number":"A74846","first_name":"KYLE","last_name":"POST","classification":"A","division":"PRODUCTION","hit_factor":10.7922},{"match_name":"NHRPC - February 2020 USPSA","match_date":"2020-02-09","stage_classifiercode":"06-03","member_number":"L3957","first_name":"MARK","last_name":"EVANS","classification":"C","division":"PRODUCTION","hit_factor":10.7922},{"match_name":"AIPS Weekly USPSA 29 June 2021","match_date":"2021-06-29","stage_classifiercode":"06-03","member_number":"TY91881","first_name":"BRIAN","last_name":"LARSON","classification":"B","division":"PRODUCTION","hit_factor":10.7875},{"match_name":"Pelham USPSA 2018-08-19","match_date":"2018-08-19","stage_classifiercode":"06-03","member_number":"A112285","first_name":"DAVID","last_name":"HRUBIEC","classification":"U","division":"PRODUCTION","hit_factor":10.7875},{"match_name":"The Great Wet Classifier - Renton USPSA - November 2020 - NW05","match_date":"2020-11-22","stage_classifiercode":"06-03","member_number":"FY108575","first_name":"ERIC","last_name":"BEERBAUM","classification":"M","division":"PRODUCTION","hit_factor":10.7875},{"match_name":"SMPS March 2016","match_date":"2016-03-13","stage_classifiercode":"06-03","member_number":"TY83136","first_name":"JOHN","last_name":"FINLEY","classification":"B","division":"PRODUCTION","hit_factor":10.7875},{"match_name":"SAPSC Monthly USPSA Classifier Match 20160112","match_date":"2016-01-12","stage_classifiercode":"06-03","member_number":"A87619","first_name":"DANE","last_name":"BEATENBOUGH","classification":"C","division":"PRODUCTION","hit_factor":10.7865},{"match_name":"D.I.D USPSA 11-8-20","match_date":"2020-11-07","stage_classifiercode":"06-03","member_number":"ty95969","first_name":"ROBERT","last_name":"DUNLEVY","classification":"A","division":"PRODUCTION","hit_factor":10.7865},{"match_name":"JCSSA MAR 6 2021","match_date":"2021-03-06","stage_classifiercode":"06-03","member_number":"A111440","first_name":"ALEX","last_name":"COSTA","classification":"C","division":"PRODUCTION","hit_factor":10.7759},{"match_name":"Gem City Gun Club 1-20 And 1-21-18","match_date":"2018-01-21","stage_classifiercode":"06-03","member_number":"TY42276","first_name":"DAVID","last_name":"PREBEK","classification":"B","division":"PRODUCTION","hit_factor":10.7759},{"match_name":"GPSL 11-6-2018","match_date":"2018-11-06","stage_classifiercode":"06-03","member_number":"A110068","first_name":"SEAN","last_name":"PHAM","classification":"D","division":"PRODUCTION","hit_factor":10.7759},{"match_name":"FSA USPSA Spring Classifier","match_date":"2018-03-18","stage_classifiercode":"06-03","member_number":"a87778","first_name":"WILLIAM","last_name":"HATFIELD","classification":"A","division":"PRODUCTION","hit_factor":10.7744},{"match_name":"CVSC  07-31-2016","match_date":"2016-07-31","stage_classifiercode":"06-03","member_number":"A93562","first_name":"NICHOLAS","last_name":"BRANTLEY","classification":"C","division":"PRODUCTION","hit_factor":10.7744},{"match_name":"Colonial Rifle and Pistol Club June 2018 Special Classifier","match_date":"2018-06-02","stage_classifiercode":"06-03","member_number":"L3570","first_name":"KEVIN","last_name":"DRISCOLL","classification":"C","division":"PRODUCTION","hit_factor":10.7728},{"match_name":"Brothers N Arms August 2017 USPSA Match","match_date":"2017-08-19","stage_classifiercode":"06-03","member_number":"A102073","first_name":"WILLIAM","last_name":"WALKER","classification":"U","division":"PRODUCTION","hit_factor":10.7692},{"match_name":"Mvpsa  Points Match","match_date":"2016-10-01","stage_classifiercode":"06-03","member_number":"A85911","first_name":"NICK","last_name":"STAVROS","classification":"U","division":"PRODUCTION","hit_factor":10.7692},{"match_name":"Mvpsa  Points Match","match_date":"2016-10-01","stage_classifiercode":"06-03","member_number":"A90710","first_name":"RICHARD","last_name":"PURCELL","classification":"B","division":"PRODUCTION","hit_factor":10.7692},{"match_name":"Lafayette Practical Shooters - THURS - Mar 4","match_date":"2021-03-05","stage_classifiercode":"06-03","member_number":"TY76050","first_name":"STEPHEN","last_name":"WILLIAMS","classification":"U","division":"PRODUCTION","hit_factor":10.7692},{"match_name":"Kabul 25 May 2018","match_date":"2018-05-25","stage_classifiercode":"06-03","member_number":"TY51119","first_name":"CHRIS","last_name":"MOLNAR","classification":"A","division":"PRODUCTION","hit_factor":10.7643},{"match_name":"EWPSA 2021-01","match_date":"2021-01-17","stage_classifiercode":"06-03","member_number":"L4628","first_name":"WARREN","last_name":"HARPER","classification":"M","division":"PRODUCTION","hit_factor":10.7643},{"match_name":"MISS Match 1/3/18","match_date":"2018-01-03","stage_classifiercode":"06-03","member_number":"TY88494","first_name":"GEORGE","last_name":"DYSICO","classification":"B","division":"PRODUCTION","hit_factor":10.7643},{"match_name":"WSPS AUGUST 2017 USPSA MATCH","match_date":"2017-08-16","stage_classifiercode":"06-03","member_number":"TY85668","first_name":"SCOTT","last_name":"APPOLDT","classification":"B","division":"PRODUCTION","hit_factor":10.7643},{"match_name":"Baghdad IPSC Match 8-5-2017","match_date":"2017-08-05","stage_classifiercode":"06-03","member_number":"A100606","first_name":"MARK","last_name":"HARDY","classification":"\"\"","division":"PRODUCTION","hit_factor":10.7643},{"match_name":"Uspsa Classifier","match_date":"2018-05-06","stage_classifiercode":"06-03","member_number":"TYF85185","first_name":"MATHEW","last_name":"ROBERTSON","classification":"U","division":"PRODUCTION","hit_factor":10.7623},{"match_name":"WSPS AUGUST 2017 USPSA MATCH","match_date":"2017-08-16","stage_classifiercode":"06-03","member_number":"A99341","first_name":"MICHAEL","last_name":"DALSKE","classification":"C","division":"PRODUCTION","hit_factor":10.7623},{"match_name":"BRC_20170409","match_date":"2017-04-09","stage_classifiercode":"06-03","member_number":"TY74682","first_name":"STERLING","last_name":"SEIFERT","classification":"C","division":"PRODUCTION","hit_factor":10.7551},{"match_name":"CRGC USPSA Match 04-18-21","match_date":"2021-04-18","stage_classifiercode":"06-03","member_number":"A122881","first_name":"MIKE","last_name":"CANTRELL","classification":"B","division":"PRODUCTION","hit_factor":10.7527},{"match_name":"Lafayette Practical Shooters - Apr 4","match_date":"2018-04-04","stage_classifiercode":"06-03","member_number":"A100186","first_name":"SCOT","last_name":"JONES","classification":"B","division":"PRODUCTION","hit_factor":10.7503},{"match_name":"OK Corral USPSA Classifier Match Feb 18 2017","match_date":"2017-02-18","stage_classifiercode":"06-03","member_number":"\"\"","first_name":"JEFF","last_name":"BRENNAN","classification":"\"\"","division":"PRODUCTION","hit_factor":10.7456},{"match_name":"Kettlefoot USPSA Classifier Match","match_date":"2017-07-15","stage_classifiercode":"06-03","member_number":"A18438","first_name":"JOHN","last_name":"ANDERSON 2G","classification":"U","division":"PRODUCTION","hit_factor":10.7456},{"match_name":"Htf Practical Shooters All Classifier","match_date":"2017-10-29","stage_classifiercode":"06-03","member_number":"A97648","first_name":"ZAC","last_name":"JOINER","classification":"B","division":"PRODUCTION","hit_factor":10.7456},{"match_name":"WVPPS May 2017","match_date":"2017-05-21","stage_classifiercode":"06-03","member_number":"A88739","first_name":"BRIAN","last_name":"BRUMBAUGH","classification":"B","division":"PRODUCTION","hit_factor":10.7456},{"match_name":"Pioneer Action Shooters USPSA 5-27-18","match_date":"2018-05-27","stage_classifiercode":"06-03","member_number":"TY79813","first_name":"JOEL","last_name":"PENNEY","classification":"M","division":"PRODUCTION","hit_factor":10.7456},{"match_name":"Colonial Rifle and Pistol Club June 2018 Special Classifier","match_date":"2018-06-02","stage_classifiercode":"06-03","member_number":"A100170","first_name":"RYAN","last_name":"CHAN","classification":"C","division":"PRODUCTION","hit_factor":10.7456},{"match_name":"Baghdad IPSC Match 8-5-2017","match_date":"2017-08-05","stage_classifiercode":"06-03","member_number":"A99458","first_name":"BILLY","last_name":"MORRIS","classification":"\"\"","division":"PRODUCTION","hit_factor":10.7429},{"match_name":"USPSA BDSC Baghdad Practical Shooters","match_date":"2017-01-21","stage_classifiercode":"06-03","member_number":"TY51119","first_name":"CHRIS","last_name":"MOLNAR","classification":"A","division":"PRODUCTION","hit_factor":10.7411},{"match_name":"FSTC USPSA 1-29-16","match_date":"2017-01-29","stage_classifiercode":"06-03","member_number":"A96001","first_name":"BRANDON","last_name":"POWERS","classification":"C","division":"PRODUCTION","hit_factor":10.7383},{"match_name":"HOPS USPSA 051521","match_date":"2021-05-15","stage_classifiercode":"06-03","member_number":"A114754","first_name":"COREY","last_name":"BIGLER","classification":"B","division":"PRODUCTION","hit_factor":10.7351},{"match_name":"HTF Practical Shooter Classifer","match_date":"2017-11-02","stage_classifiercode":"06-03","member_number":"A103282","first_name":"KURT","last_name":"GLASER","classification":"C","division":"PRODUCTION","hit_factor":10.7338},{"match_name":"BHPC USPSA Monthly Match 6-14-2020","match_date":"2020-06-14","stage_classifiercode":"06-03","member_number":"A100066","first_name":"LANE","last_name":"JENSEN","classification":"B","division":"PRODUCTION","hit_factor":10.7306},{"match_name":"Eaps August match","match_date":"2021-08-15","stage_classifiercode":"06-03","member_number":"FY92673","first_name":"WILLIAM","last_name":"ANDERSON","classification":"B","division":"PRODUCTION","hit_factor":10.7296},{"match_name":"Mssa Uspsa 05-28-17","match_date":"2017-05-28","stage_classifiercode":"06-03","member_number":"A102910","first_name":"BRENT","last_name":"ROSS","classification":"U","division":"PRODUCTION","hit_factor":10.7296},{"match_name":"Richmond Hot Shots February 20-21-2021 USPSA Pistol","match_date":"2021-02-20","stage_classifiercode":"06-03","member_number":"TY91483","first_name":"MICHAEL","last_name":"NEUBAUER","classification":"C","division":"PRODUCTION","hit_factor":10.7296},{"match_name":"RPS May 2018 USPSA Match","match_date":"2018-05-12","stage_classifiercode":"06-03","member_number":"A95223","first_name":"KEVIN","last_name":"MCGOLDRICK","classification":"B","division":"PRODUCTION","hit_factor":10.7263},{"match_name":"NISA April Classifer Match 2016","match_date":"2016-04-24","stage_classifiercode":"06-03","member_number":"A81938","first_name":"ALEX","last_name":"SLIVINSKI","classification":"B","division":"PRODUCTION","hit_factor":10.7184},{"match_name":"Deep 50 USPSA  July 24th 2 Classifiers","match_date":"2021-07-24","stage_classifiercode":"06-03","member_number":"A122824","first_name":"JOYCE","last_name":"HERNANDEZ","classification":"B","division":"PRODUCTION","hit_factor":10.7181},{"match_name":"ASC USPSA Apr. 18","match_date":"2021-04-18","stage_classifiercode":"06-03","member_number":"TY118067","first_name":"EUGENE","last_name":"CHOI","classification":"A","division":"PRODUCTION","hit_factor":10.7181},{"match_name":"Range E11even June 25th 2016 USPSA Match","match_date":"2016-06-25","stage_classifiercode":"06-03","member_number":"\"\"","first_name":"JASON","last_name":"TOLER","classification":"U","division":"PRODUCTION","hit_factor":10.7181},{"match_name":"PCSI - July 2018 USPSA","match_date":"2018-07-07","stage_classifiercode":"06-03","member_number":"TY95960","first_name":"RYAN","last_name":"CHERRY","classification":"B","division":"PRODUCTION","hit_factor":10.7143},{"match_name":"Dundee Practical Shooters - March 24 2018 - Points","match_date":"2018-03-24","stage_classifiercode":"06-03","member_number":"TY89859","first_name":"JOHN","last_name":"JUNEMAN","classification":"C","division":"PRODUCTION","hit_factor":10.7143},{"match_name":"GRPC USPSA DOG DAYS OF SUMMER","match_date":"2017-08-06","stage_classifiercode":"06-03","member_number":"L3711","first_name":"MARK","last_name":"PORRETTO","classification":"M","division":"PRODUCTION","hit_factor":10.7104},{"match_name":"The Irbil Open","match_date":"2017-05-14","stage_classifiercode":"06-03","member_number":"A77139","first_name":"CHRIS","last_name":"THOMPSON","classification":"C","division":"PRODUCTION","hit_factor":10.7104},{"match_name":"CSA Annual Classifier Classic","match_date":"2018-03-18","stage_classifiercode":"06-03","member_number":"A87413","first_name":"JEFF","last_name":"ADKINS","classification":"B","division":"PRODUCTION","hit_factor":10.7066},{"match_name":"PSGC   IPSC November","match_date":"2016-11-27","stage_classifiercode":"06-03","member_number":"A76130","first_name":"GABE","last_name":"REYES","classification":"U","division":"PRODUCTION","hit_factor":10.7066},{"match_name":"STAGE ZERO SHOOTING SUPPLY USPSA","match_date":"2020-07-16","stage_classifiercode":"06-03","member_number":"TY120144","first_name":"FRANK","last_name":"GAP RESHOOT","classification":"C","division":"PRODUCTION","hit_factor":10.7066},{"match_name":"Crooked Creek Pistol League - August 2017","match_date":"2017-08-26","stage_classifiercode":"06-03","member_number":"A103740","first_name":"ZACHARY","last_name":"BURCH","classification":"C","division":"PRODUCTION","hit_factor":10.7066},{"match_name":"Benton Gun Club-USPSA October 28 2018","match_date":"2018-10-28","stage_classifiercode":"06-03","member_number":"TY65816","first_name":"GOOSE","last_name":"CHANGOSE","classification":"A","division":"PRODUCTION","hit_factor":10.7062},{"match_name":"DWB - Deadwood Boys USPSA 18 October 2020","match_date":"2020-10-18","stage_classifiercode":"06-03","member_number":"A111371","first_name":"WESLEY","last_name":"YIM","classification":"A","division":"PRODUCTION","hit_factor":10.705},{"match_name":"Southern Maryland Practical Shooters 14 October 2018 USPSA","match_date":"2018-10-14","stage_classifiercode":"06-03","member_number":"TY58056","first_name":"NOEL","last_name":"MARUCUT","classification":"A","division":"PRODUCTION","hit_factor":10.7023},{"match_name":"Custer March Classifier Match","match_date":"2018-03-04","stage_classifiercode":"06-03","member_number":"TY86040","first_name":"HEATHER","last_name":"HARDING","classification":"B","division":"PRODUCTION","hit_factor":10.6987},{"match_name":"OK Corral USPSA Classifier Match Feb 18 2017","match_date":"2017-02-18","stage_classifiercode":"06-03","member_number":"A96611","first_name":"KRYS","last_name":"KLOCZKO","classification":"\"\"","division":"PRODUCTION","hit_factor":10.6952},{"match_name":"Brazosland Pistoleros September 17 2017 USPSA","match_date":"2017-09-17","stage_classifiercode":"06-03","member_number":"TY74796","first_name":"SETH","last_name":"CLAGG","classification":"M","division":"PRODUCTION","hit_factor":10.691},{"match_name":"Richmond October 17-18-2015","match_date":"2015-10-17","stage_classifiercode":"06-03","member_number":"TY57776","first_name":"BRAD","last_name":"ENGMANN","classification":"G","division":"PRODUCTION","hit_factor":10.6904},{"match_name":"SMPS March 2016","match_date":"2016-03-13","stage_classifiercode":"06-03","member_number":"TY80223","first_name":"TONY","last_name":"PINK","classification":"B","division":"PRODUCTION","hit_factor":10.687},{"match_name":"RCSC USPSA 26 June 16","match_date":"2016-06-26","stage_classifiercode":"06-03","member_number":"A83119","first_name":"MIKE","last_name":"RICKMAN","classification":"C","division":"PRODUCTION","hit_factor":10.6838},{"match_name":"AIPS Weekly USPSA 29 June 2021","match_date":"2021-06-29","stage_classifiercode":"06-03","member_number":"FY72636","first_name":"ANDREW","last_name":"SMITHSON","classification":"B","division":"PRODUCTION","hit_factor":10.6754},{"match_name":"Springfield Tactical Shooters 04-07-2016","match_date":"2016-04-07","stage_classifiercode":"06-03","member_number":"TY78203","first_name":"JIM","last_name":"SHURES","classification":"B","division":"PRODUCTION","hit_factor":10.6754},{"match_name":"NVSA USPSA Classifer Match 1605-2","match_date":"2016-05-21","stage_classifiercode":"06-03","member_number":"A77672","first_name":"JON","last_name":"WHITEHAIR","classification":"B","division":"PRODUCTION","hit_factor":10.6729},{"match_name":"CAS 09-06-20","match_date":"2020-09-06","stage_classifiercode":"06-03","member_number":"A73959","first_name":"KIRK","last_name":"KLEINPETER","classification":"A","division":"PRODUCTION","hit_factor":10.6724},{"match_name":"RCSC USPSA 26 June 16","match_date":"2016-06-26","stage_classifiercode":"06-03","member_number":"A89824","first_name":"MIKE","last_name":"WIERDSMA","classification":"C","division":"PRODUCTION","hit_factor":10.6724},{"match_name":"ORPCI 2018.03.31 USPSA Special","match_date":"2018-03-31","stage_classifiercode":"06-03","member_number":"A109934","first_name":"DAVID","last_name":"GONTARTK","classification":"U","division":"PRODUCTION","hit_factor":10.6724},{"match_name":"Alpha Mike March 2017","match_date":"2017-03-19","stage_classifiercode":"06-03","member_number":"\"\"","first_name":"MIKE","last_name":"DAVIS","classification":"U","division":"PRODUCTION","hit_factor":10.6724},{"match_name":"ACC July 26th USPSA","match_date":"2020-07-26","stage_classifiercode":"06-03","member_number":"A119715","first_name":"BRANDON","last_name":"WHITTON","classification":"C","division":"PRODUCTION","hit_factor":10.6724},{"match_name":"Hose Monster Action","match_date":"2020-02-16","stage_classifiercode":"06-03","member_number":"ty17315","first_name":"RON","last_name":"NAKABAYASHI","classification":"B","division":"PRODUCTION","hit_factor":10.6724},{"match_name":"HRPC USPSA MAY 2017","match_date":"2017-05-13","stage_classifiercode":"06-03","member_number":"TY84186","first_name":"CHRIS","last_name":"MAGYAR","classification":"B","division":"PRODUCTION","hit_factor":10.6684},{"match_name":"2016 Columbia Cascade Section Championship","match_date":"2016-08-12","stage_classifiercode":"06-03","member_number":"TY82059","first_name":"KRISTINE","last_name":"HAYES","classification":"C","division":"PRODUCTION","hit_factor":10.6667},{"match_name":"Homestead September Classifier Match","match_date":"2020-09-20","stage_classifiercode":"06-03","member_number":"B69","first_name":"JAIME","last_name":"CALAF","classification":"B","division":"PRODUCTION","hit_factor":10.6667},{"match_name":"PRG July 2017 Match","match_date":"2017-07-02","stage_classifiercode":"06-03","member_number":"\"\"","first_name":"DON L.","last_name":"STANLEY","classification":"U","division":"PRODUCTION","hit_factor":10.6638},{"match_name":"CFRPC USPSA 2016 DECEMBER","match_date":"2016-12-18","stage_classifiercode":"06-03","member_number":"A88251","first_name":"LINDA","last_name":"HILTON","classification":"B","division":"PRODUCTION","hit_factor":10.6638},{"match_name":"LdF 4th Saturday Match","match_date":"2015-12-26","stage_classifiercode":"06-03","member_number":"A88717","first_name":"CURTIS","last_name":"RANDALL","classification":"C","division":"PRODUCTION","hit_factor":10.661},{"match_name":"Brazosland Pistoleros September 17 2017 USPSA","match_date":"2017-09-17","stage_classifiercode":"06-03","member_number":"A104958","first_name":"SETH","last_name":"ABBOTT","classification":"U","division":"PRODUCTION","hit_factor":10.661},{"match_name":"ALL CLASSIFIER SUMMERSLAM  -  AREA 59 2018","match_date":"2018-06-30","stage_classifiercode":"06-03","member_number":"TY72560","first_name":"VITAN","last_name":"GOTSEV","classification":"B","division":"PRODUCTION","hit_factor":10.661},{"match_name":"SFPC May 2  2021   USPSA Monthly Match","match_date":"2021-05-02","stage_classifiercode":"06-03","member_number":"TY101923","first_name":"CHRISTINA","last_name":"BAKER","classification":"B","division":"PRODUCTION","hit_factor":10.661},{"match_name":"2015 Ontelaunee Holiday Hosefest","match_date":"2015-12-26","stage_classifiercode":"06-03","member_number":"\"\"","first_name":"JASON","last_name":"BEDIONES","classification":"B","division":"PRODUCTION","hit_factor":10.661},{"match_name":"Springfield Tactical Shooters 04-07-2016","match_date":"2016-04-07","stage_classifiercode":"06-03","member_number":"A95721","first_name":"CORY","last_name":"LYONS","classification":"U","division":"PRODUCTION","hit_factor":10.6576},{"match_name":"Mssa Uspsa 05-28-17","match_date":"2017-05-28","stage_classifiercode":"06-03","member_number":"A102910","first_name":"BRENT","last_name":"ROSS","classification":"U","division":"PRODUCTION","hit_factor":10.6548},{"match_name":"LCSA USPSA Special Classifier Match","match_date":"2016-03-24","stage_classifiercode":"06-03","member_number":"TY85681","first_name":"ROBERT","last_name":"MCCLAIN","classification":"U","division":"PRODUCTION","hit_factor":10.6522},{"match_name":"The Irbil Open","match_date":"2017-05-14","stage_classifiercode":"06-03","member_number":"A100606","first_name":"MARK","last_name":"HARDY","classification":"C","division":"PRODUCTION","hit_factor":10.6496},{"match_name":"Crooked Creek Pistol League - October 2020","match_date":"2020-10-17","stage_classifiercode":"06-03","member_number":"TY87114","first_name":"NICK","last_name":"ELLIS","classification":"C","division":"PRODUCTION","hit_factor":10.6496},{"match_name":"Armory Indoor League","match_date":"2017-04-13","stage_classifiercode":"06-03","member_number":"A90155","first_name":"LEX","last_name":"KONISHI","classification":"B","division":"PRODUCTION","hit_factor":10.643},{"match_name":"LCSA USPSA Special Classifier Match","match_date":"2016-03-24","stage_classifiercode":"06-03","member_number":"fy90019","first_name":"NICK","last_name":"BROWN","classification":"B","division":"PRODUCTION","hit_factor":10.6406},{"match_name":"Rankin Field Sunday USPSA","match_date":"2018-07-15","stage_classifiercode":"06-03","member_number":"A94718","first_name":"NICK","last_name":"ROBERTS","classification":"B","division":"PRODUCTION","hit_factor":10.6406},{"match_name":"Pathfinder July USPSA Match","match_date":"2018-07-15","stage_classifiercode":"06-03","member_number":"A83981","first_name":"ADAM","last_name":"HARRIS","classification":"none","division":"PRODUCTION","hit_factor":10.6406},{"match_name":"WELD ECO09 20181021","match_date":"2018-10-21","stage_classifiercode":"06-03","member_number":"TY112573","first_name":"TODD","last_name":"MORI","classification":"C","division":"PRODUCTION","hit_factor":10.6406},{"match_name":"RBGC 2016-07-23","match_date":"2016-07-23","stage_classifiercode":"06-03","member_number":"A86303","first_name":"RYAN","last_name":"REID","classification":"B","division":"PRODUCTION","hit_factor":10.6312},{"match_name":"DSSA 2018-09 USPSA Pistol","match_date":"2018-09-23","stage_classifiercode":"06-03","member_number":"TY100555","first_name":"TOMMY","last_name":"MCGUIRE","classification":"B","division":"PRODUCTION","hit_factor":10.6312},{"match_name":"The Irbil Open","match_date":"2017-05-14","stage_classifiercode":"06-03","member_number":"TY51119","first_name":"CHRIS","last_name":"MOLNAR","classification":"A","division":"PRODUCTION","hit_factor":10.6291},{"match_name":"TAS Classifier 2","match_date":"2017-12-10","stage_classifiercode":"06-03","member_number":"A100690","first_name":"EUGENE","last_name":"YOON","classification":"U","division":"PRODUCTION","hit_factor":10.627},{"match_name":"ORSA USPSA July Match Dang Its Hot Out There","match_date":"2018-07-19","stage_classifiercode":"06-03","member_number":"A108666","first_name":"DAVID","last_name":"FRAZIER","classification":"B","division":"PRODUCTION","hit_factor":10.6176},{"match_name":"Pelham USPSA 2018-08-19","match_date":"2018-08-19","stage_classifiercode":"06-03","member_number":"TY73663","first_name":"JAY","last_name":"BUCKLEY","classification":"B","division":"PRODUCTION","hit_factor":10.6157},{"match_name":"Custer March Classifier Match","match_date":"2018-03-04","stage_classifiercode":"06-03","member_number":"A80693","first_name":"JUSTIN","last_name":"HODGES","classification":"C","division":"PRODUCTION","hit_factor":10.6157},{"match_name":"Gem City Gun Club 1-20 And 1-21-18","match_date":"2018-01-21","stage_classifiercode":"06-03","member_number":"A100926","first_name":"CHARLES","last_name":"KELKENBURG","classification":"U","division":"PRODUCTION","hit_factor":10.6157},{"match_name":"Brazosland Pistoleros November 20 2016--USPSA","match_date":"2016-11-20","stage_classifiercode":"06-03","member_number":"\"\"","first_name":"NICHOLAS","last_name":"MRAK","classification":"U","division":"PRODUCTION","hit_factor":10.6157},{"match_name":"Springfield Tactical Shooters 04-07-2016","match_date":"2016-04-07","stage_classifiercode":"06-03","member_number":"A95725","first_name":"NEIL","last_name":"JOHNSON","classification":"\"\"","division":"PRODUCTION","hit_factor":10.6113},{"match_name":"PSAC 20200705","match_date":"2020-07-05","stage_classifiercode":"06-03","member_number":"TY111623","first_name":"RODNEY","last_name":"LIM","classification":"B","division":"PRODUCTION","hit_factor":10.6095},{"match_name":"WVRPC USPSA 5 AUGUST 2017","match_date":"2017-08-05","stage_classifiercode":"06-03","member_number":"TY104115","first_name":"TRAVIS","last_name":"WEDDLE","classification":"U","division":"PRODUCTION","hit_factor":10.6077},{"match_name":"\"","match_date":"2018-08-11","stage_classifiercode":"06-03","member_number":"TY86531","first_name":"RUBEN","last_name":"HEIM","classification":"A","division":"PRODUCTION","hit_factor":10.6061},{"match_name":"Baghdad IPSC Match 8-5-2017","match_date":"2017-08-05","stage_classifiercode":"06-03","member_number":"\"\"","first_name":"BENJAMIN","last_name":"STAMETZ","classification":"\"\"","division":"PRODUCTION","hit_factor":10.6061},{"match_name":"USPSA MO21 2Alpha SBRC July 2017 Special Classifier","match_date":"2017-07-15","stage_classifiercode":"06-03","member_number":"A101290","first_name":"AUSTIN","last_name":"RIST","classification":"C","division":"PRODUCTION","hit_factor":10.6061},{"match_name":"MPSA 101516","match_date":"2016-10-15","stage_classifiercode":"06-03","member_number":"A65800","first_name":"TODD","last_name":"PUGH","classification":"B","division":"PRODUCTION","hit_factor":10.6045},{"match_name":"WSRC USPSA 7/15/2017","match_date":"2017-07-15","stage_classifiercode":"06-03","member_number":"A95932","first_name":"ROBERT","last_name":"TURNER","classification":"B","division":"PRODUCTION","hit_factor":10.6045},{"match_name":"Shasta Shooters 2018 June Special Classifier","match_date":"2018-06-09","stage_classifiercode":"06-03","member_number":"Fy89662","first_name":"TODD","last_name":"CANCILLA","classification":"A","division":"PRODUCTION","hit_factor":10.6045},{"match_name":"Pinetucky USPSA 02-17-18","match_date":"2018-02-17","stage_classifiercode":"06-03","member_number":"A93151","first_name":"TYLER","last_name":"BUSSEY","classification":"U","division":"PRODUCTION","hit_factor":10.6045},{"match_name":"PCAS USPSA Practice Match","match_date":"2018-08-04","stage_classifiercode":"06-03","member_number":"a58756","first_name":"OSCAR","last_name":"INDRELAND","classification":"B","division":"PRODUCTION","hit_factor":10.5991},{"match_name":"PSAC 20200705","match_date":"2020-07-05","stage_classifiercode":"06-03","member_number":"L3928","first_name":"BENJAMIN","last_name":"GO","classification":"B","division":"PRODUCTION","hit_factor":10.596},{"match_name":"WSRC USPSA 7/15/2017","match_date":"2017-07-15","stage_classifiercode":"06-03","member_number":"A94394","first_name":"PAUL","last_name":"STODGELL","classification":"C","division":"PRODUCTION","hit_factor":10.596},{"match_name":"NRG September 10th 2016","match_date":"2016-09-10","stage_classifiercode":"06-03","member_number":"TY93936","first_name":"BILL","last_name":"URQUHART","classification":"B","division":"PRODUCTION","hit_factor":10.5946},{"match_name":"BPSA April 2017 USPSA","match_date":"2017-04-23","stage_classifiercode":"06-03","member_number":"TY66456","first_name":"KEN","last_name":"HABLITZEL","classification":"B","division":"PRODUCTION","hit_factor":10.5946},{"match_name":"AREA 59  BIG BANG ALL CLASSIFIER","match_date":"2017-12-30","stage_classifiercode":"06-03","member_number":"L2998","first_name":"GARY","last_name":"WU","classification":"B","division":"PRODUCTION","hit_factor":10.5946},{"match_name":"LCSC Classifier 042918","match_date":"2018-04-28","stage_classifiercode":"06-03","member_number":"A93243","first_name":"TONY","last_name":"LUONG","classification":"B","division":"PRODUCTION","hit_factor":10.5932},{"match_name":"SEPSA April 2017","match_date":"2017-04-08","stage_classifiercode":"06-03","member_number":"A97675","first_name":"MICHAEL","last_name":"SEARS","classification":"C","division":"PRODUCTION","hit_factor":10.5932},{"match_name":"PCGC October 2016","match_date":"2016-10-23","stage_classifiercode":"06-03","member_number":"A87413","first_name":"JEFF","last_name":"ADKINS","classification":"B","division":"PRODUCTION","hit_factor":10.5843},{"match_name":"GPSL 12-6-2016","match_date":"2016-12-05","stage_classifiercode":"06-03","member_number":"A90924","first_name":"ANDREW","last_name":"LARRIER","classification":"C","division":"PRODUCTION","hit_factor":10.5843},{"match_name":"LdF USPSA Match May 13 2017","match_date":"2017-05-13","stage_classifiercode":"06-03","member_number":"A78877","first_name":"TOMMY","last_name":"HANDOJO","classification":"B","division":"PRODUCTION","hit_factor":10.5843},{"match_name":"HPSP Heartland Practical Shooters August USPSA Handgun Shoot","match_date":"2016-08-14","stage_classifiercode":"06-03","member_number":"A95674","first_name":"JESS","last_name":"ASCHE","classification":"C","division":"PRODUCTION","hit_factor":10.5832},{"match_name":"WNPL USPSA - Oktober HoseFest 2018","match_date":"2018-10-07","stage_classifiercode":"06-03","member_number":"A108026","first_name":"MARTIN","last_name":"KWONG","classification":"C","division":"PRODUCTION","hit_factor":10.582},{"match_name":"USPSA AR02 North Arkansas Action Pistol Oct 8th 2017","match_date":"2017-10-08","stage_classifiercode":"06-03","member_number":"\"\"","first_name":"ALEXANDER","last_name":"ISSA","classification":"U","division":"PRODUCTION","hit_factor":10.582},{"match_name":"SMPS March 2016","match_date":"2016-03-13","stage_classifiercode":"06-03","member_number":"TY31868","first_name":"DENNIS","last_name":"BOYLE","classification":"B","division":"PRODUCTION","hit_factor":10.582},{"match_name":"SMD USPSA at VIR November 2018","match_date":"2018-11-04","stage_classifiercode":"06-03","member_number":"A113752","first_name":"BOBBY","last_name":"WADE","classification":"U","division":"PRODUCTION","hit_factor":10.582},{"match_name":"SEPSA April 2017","match_date":"2017-04-08","stage_classifiercode":"06-03","member_number":"A97295","first_name":"CHRIS","last_name":"EWEN","classification":"C","division":"PRODUCTION","hit_factor":10.582},{"match_name":"SCS USPSA Pistol with Classifer - Special Classifier July 31 2016","match_date":"2016-07-31","stage_classifiercode":"06-03","member_number":"A91604","first_name":"IAN","last_name":"YAGER","classification":"U","division":"PRODUCTION","hit_factor":10.5769},{"match_name":"Cactus USPSA June 2021","match_date":"2021-06-06","stage_classifiercode":"06-03","member_number":"FY87889","first_name":"GANNON","last_name":"BURLEIGH","classification":"B","division":"PRODUCTION","hit_factor":10.5758},{"match_name":"SAPSA January 2018","match_date":"2018-01-20","stage_classifiercode":"06-03","member_number":"A92665","first_name":"CHRIS","last_name":"BROCKMAN","classification":"B","division":"PRODUCTION","hit_factor":10.5727},{"match_name":"Shasta Shooters 2018 June Special Classifier","match_date":"2018-06-09","stage_classifiercode":"06-03","member_number":"Ty95027","first_name":"ZACHARY","last_name":"MCMORDIE","classification":"C","division":"PRODUCTION","hit_factor":10.5717},{"match_name":"Eaps August match","match_date":"2021-08-15","stage_classifiercode":"06-03","member_number":"TY61337","first_name":"BEN","last_name":"HARANG","classification":"B","division":"PRODUCTION","hit_factor":10.5708},{"match_name":"Armory Indoor League","match_date":"2017-04-13","stage_classifiercode":"06-03","member_number":"TY87879","first_name":"ROBERT","last_name":"WYATT","classification":"A","division":"PRODUCTION","hit_factor":10.5708},{"match_name":"Nampa USPSA March 7th","match_date":"2020-03-07","stage_classifiercode":"06-03","member_number":"A125375","first_name":"TRENT","last_name":"MILLER","classification":"U","division":"PRODUCTION","hit_factor":10.5708},{"match_name":"Crooked Creek Pistol League - May 21-22_2016","match_date":"2016-05-21","stage_classifiercode":"06-03","member_number":"A79857","first_name":"KEVEN","last_name":"HEIL","classification":"A","division":"PRODUCTION","hit_factor":10.5708},{"match_name":"bgs Hudson Week 1","match_date":"2016-11-27","stage_classifiercode":"06-03","member_number":"A86153","first_name":"ARIC","last_name":"NILSON","classification":"B","division":"PRODUCTION","hit_factor":10.5618},{"match_name":"Hawkeye Gun Club February 2016","match_date":"2016-02-20","stage_classifiercode":"06-03","member_number":"A75957","first_name":"CHUCK","last_name":"SMITH","classification":"B","division":"PRODUCTION","hit_factor":10.5611},{"match_name":"BGS Hudson Week 3","match_date":"2018-01-07","stage_classifiercode":"06-03","member_number":"TY74329","first_name":"KITA","last_name":"STOEGER","classification":"B","division":"PRODUCTION","hit_factor":10.5603},{"match_name":"LdF USPSA Match May 13 2017","match_date":"2017-05-13","stage_classifiercode":"06-03","member_number":"TY95244","first_name":"ALEX","last_name":"KO","classification":"B","division":"PRODUCTION","hit_factor":10.5603},{"match_name":"IN18 SCGC USPSA 02 May 2021","match_date":"2021-05-02","stage_classifiercode":"06-03","member_number":"TY76067","first_name":"AARON","last_name":"HUTCHINSON","classification":"B","division":"PRODUCTION","hit_factor":10.5597},{"match_name":"VISSC Bono","match_date":"2020-10-25","stage_classifiercode":"06-03","member_number":"Ty68142","first_name":"DAN","last_name":"CLEGG","classification":"B","division":"PRODUCTION","hit_factor":10.5597},{"match_name":"PCGC October 2016","match_date":"2016-10-23","stage_classifiercode":"06-03","member_number":"TY85570","first_name":"DAVID","last_name":"MILLER","classification":"M","division":"PRODUCTION","hit_factor":10.5516},{"match_name":"MISS Match 1/3/18","match_date":"2018-01-03","stage_classifiercode":"06-03","member_number":"ty93313","first_name":"JON","last_name":"OWENS","classification":"D","division":"PRODUCTION","hit_factor":10.5495},{"match_name":"CSA Sept 2016","match_date":"2016-09-11","stage_classifiercode":"06-03","member_number":"A85582","first_name":"BRADLEY","last_name":"PERRY","classification":"B","division":"PRODUCTION","hit_factor":10.549},{"match_name":"ACC July 26th USPSA","match_date":"2020-07-26","stage_classifiercode":"06-03","member_number":"TY121041","first_name":"CHASE","last_name":"WILLIAMS","classification":"B","division":"PRODUCTION","hit_factor":10.5485},{"match_name":"WSRC USPSA 7/15/2017","match_date":"2017-07-15","stage_classifiercode":"06-03","member_number":"A100787","first_name":"AARON","last_name":"KOCH","classification":"U","division":"PRODUCTION","hit_factor":10.5384},{"match_name":"NCPS USPSA Handgun Match November 29 2015","match_date":"2015-11-29","stage_classifiercode":"06-03","member_number":"A80659","first_name":"MIKE","last_name":"FULLMORE","classification":"C","division":"PRODUCTION","hit_factor":10.5379},{"match_name":"PSAC 20180922","match_date":"2018-09-22","stage_classifiercode":"06-03","member_number":"A100974","first_name":"JAMES","last_name":"LUTTER","classification":"C","division":"PRODUCTION","hit_factor":10.5379},{"match_name":"KSA USPSA June 2017","match_date":"2017-06-03","stage_classifiercode":"06-03","member_number":"A93857","first_name":"CHRISTIAN","last_name":"PARR","classification":"B","division":"PRODUCTION","hit_factor":10.5376},{"match_name":"DWB - Deadwood Boys USPSA 18 October 2020","match_date":"2020-10-18","stage_classifiercode":"06-03","member_number":"a98127","first_name":"MYRO","last_name":"CABAONG","classification":"C","division":"PRODUCTION","hit_factor":10.5376},{"match_name":"MISS Match 12-7-16","match_date":"2016-12-06","stage_classifiercode":"06-03","member_number":"A76607","first_name":"TERRY","last_name":"BROWN","classification":"B","division":"PRODUCTION","hit_factor":10.5376},{"match_name":"KSA USPSA June 2017","match_date":"2017-06-03","stage_classifiercode":"06-03","member_number":"A91857","first_name":"THOMAS","last_name":"RICHARDSON","classification":"C","division":"PRODUCTION","hit_factor":10.5374},{"match_name":"WAC August 22nd (4th Sunday) - ALL CLASSIFIER USPSA 6 Stage Match","match_date":"2021-08-22","stage_classifiercode":"06-03","member_number":"A122877","first_name":"JOSEPH","last_name":"MCMAHAN","classification":"B","division":"PRODUCTION","hit_factor":10.5374},{"match_name":"XMG USPSA 2nd Saturday Match","match_date":"2020-11-14","stage_classifiercode":"06-03","member_number":"A111440","first_name":"ALEX","last_name":"COSTA","classification":"C","division":"PRODUCTION","hit_factor":10.5263},{"match_name":"WAC February(4th Sunday) - USPSA 6 Classifier Match","match_date":"2020-02-23","stage_classifiercode":"06-03","member_number":"A90789","first_name":"MICHAEL","last_name":"WALL","classification":"B","division":"PRODUCTION","hit_factor":10.5263},{"match_name":"LCAS March 2020 USPSA","match_date":"2020-03-07","stage_classifiercode":"06-03","member_number":"A91713","first_name":"SHAWN","last_name":"SMITH","classification":"B","division":"PRODUCTION","hit_factor":10.5263},{"match_name":"APSC USPSA Classifier Match 07-01-17","match_date":"2017-07-01","stage_classifiercode":"06-03","member_number":"\"\"","first_name":"ALEX","last_name":"ACOSTA","classification":"U","division":"PRODUCTION","hit_factor":10.5263},{"match_name":"Springfield Tactical Shooters 04-07-2016","match_date":"2016-04-07","stage_classifiercode":"06-03","member_number":"A92047","first_name":"KYLE","last_name":"SPENCER","classification":"B","division":"PRODUCTION","hit_factor":10.5263},{"match_name":"MSA USPSA Special Classifier 12-4-16","match_date":"2016-12-04","stage_classifiercode":"06-03","member_number":"Ty66762","first_name":"DEAN","last_name":"WHITELAW","classification":"B","division":"PRODUCTION","hit_factor":10.5263},{"match_name":"MISS Match 12-7-16","match_date":"2016-12-06","stage_classifiercode":"06-03","member_number":"A83493","first_name":"SCOTT","last_name":"ALBERT","classification":"C","division":"PRODUCTION","hit_factor":10.5263},{"match_name":"Payson Practical Shooters - USPSA 2018 07 07","match_date":"2018-07-07","stage_classifiercode":"06-03","member_number":"A93834","first_name":"TOM","last_name":"SMITH","classification":"C","division":"PRODUCTION","hit_factor":10.5152},{"match_name":"GWPP Pistol October 2016","match_date":"2016-10-07","stage_classifiercode":"06-03","member_number":"\"\"","first_name":"JOHATHAN","last_name":"KIRK","classification":"U","division":"PRODUCTION","hit_factor":10.5152},{"match_name":"Grandbaggers September 2018","match_date":"2018-09-06","stage_classifiercode":"06-03","member_number":"TY98002","first_name":"SHANE","last_name":"GOLDMAN","classification":"B","division":"PRODUCTION","hit_factor":10.5152},{"match_name":"AIPS Weekly USPSA 29 June 2021","match_date":"2021-06-29","stage_classifiercode":"06-03","member_number":"A95178","first_name":"DANIEL","last_name":"BRINKHEIDE","classification":"C","division":"PRODUCTION","hit_factor":10.515},{"match_name":"Henry County Gun Club USPSA","match_date":"2021-10-09","stage_classifiercode":"06-03","member_number":"TY84721","first_name":"MATT","last_name":"STEWART","classification":"U","division":"PRODUCTION","hit_factor":10.515},{"match_name":"CSA Annual Classifier Classic","match_date":"2018-03-18","stage_classifiercode":"06-03","member_number":"A105549","first_name":"DEXTER","last_name":"SPURLOCK","classification":"U","division":"PRODUCTION","hit_factor":10.5148},{"match_name":"TTS OUTLAW PISTOL 8SEP2018","match_date":"2018-09-08","stage_classifiercode":"06-03","member_number":"Ty100128","first_name":"KYLE","last_name":"MCCORD","classification":"B","division":"PRODUCTION","hit_factor":10.5148},{"match_name":"NCPS USPSA Handgun Match November 29 2015","match_date":"2015-11-29","stage_classifiercode":"06-03","member_number":"A87259","first_name":"YEE-MIN","last_name":"LIN","classification":"C","division":"PRODUCTION","hit_factor":10.5042},{"match_name":"MPPL 09022018","match_date":"2018-09-02","stage_classifiercode":"06-03","member_number":"A112814","first_name":"JOHN MARK","last_name":"GUILLERMO","classification":"U","division":"PRODUCTION","hit_factor":10.5042},{"match_name":"RPS May 2018 USPSA Match","match_date":"2018-05-12","stage_classifiercode":"06-03","member_number":"A99996","first_name":"JAMIE","last_name":"BELK","classification":"B","division":"PRODUCTION","hit_factor":10.5042},{"match_name":"PSAC 20180922","match_date":"2018-09-22","stage_classifiercode":"06-03","member_number":"A85935","first_name":"DEAN","last_name":"WOLLAM","classification":"B","division":"PRODUCTION","hit_factor":10.5042},{"match_name":"MS06 Team Magnolia USPSA","match_date":"2017-03-05","stage_classifiercode":"06-03","member_number":"TY88702","first_name":"ARCHIE","last_name":"NICHOLS","classification":"C","division":"PRODUCTION","hit_factor":10.4925},{"match_name":"NHRPC - February 2020 USPSA","match_date":"2020-02-09","stage_classifiercode":"06-03","member_number":"A78623","first_name":"OLEG","last_name":"AKSENOV","classification":"A","division":"PRODUCTION","hit_factor":10.4925},{"match_name":"NISA April Classifer Match 2016","match_date":"2016-04-24","stage_classifiercode":"06-03","member_number":"TY94513","first_name":"TONY","last_name":"SALLIS","classification":"U","division":"PRODUCTION","hit_factor":10.4925},{"match_name":"Richmond Hot Shots February 20-21-2021 USPSA Pistol","match_date":"2021-02-20","stage_classifiercode":"06-03","member_number":"A98526","first_name":"JOHN SIMON","last_name":"DATOR","classification":"B","division":"PRODUCTION","hit_factor":10.4925},{"match_name":"BRC_20180311","match_date":"2018-03-11","stage_classifiercode":"06-03","member_number":"A90694","first_name":"JONAH","last_name":"PRES","classification":"C","division":"PRODUCTION","hit_factor":10.4918},{"match_name":"TASC 4-16-16 (15Apr16-10:27:18)","match_date":"2016-04-16","stage_classifiercode":"06-03","member_number":"TY90099","first_name":"JOHN","last_name":"GOODWIN","classification":"C","division":"PRODUCTION","hit_factor":10.4911},{"match_name":"MCAS 2020 Classifier League","match_date":"2020-05-27","stage_classifiercode":"06-03","member_number":"L4166","first_name":"MATT","last_name":"WAITE","classification":"A","division":"PRODUCTION","hit_factor":10.4903},{"match_name":"Brothers N Arms August 2017 USPSA Match","match_date":"2017-08-19","stage_classifiercode":"06-03","member_number":"A64744","first_name":"KALYN","last_name":"ULMER","classification":"C","division":"PRODUCTION","hit_factor":10.4822},{"match_name":"SAPS Match 1/16/2021","match_date":"2021-01-16","stage_classifiercode":"06-03","member_number":"A-41730","first_name":"MARC","last_name":"BATTAGLINI","classification":"B","division":"PRODUCTION","hit_factor":10.4822},{"match_name":"BUAS January Match","match_date":"2018-01-14","stage_classifiercode":"06-03","member_number":"a87150","first_name":"CODY","last_name":"LANDRY","classification":"B","division":"PRODUCTION","hit_factor":10.4822},{"match_name":"Pioneer Action Shooters APR 2016","match_date":"2016-04-24","stage_classifiercode":"06-03","member_number":"TY96116","first_name":"ROSS","last_name":"WOOD","classification":"U","division":"PRODUCTION","hit_factor":10.4822},{"match_name":"Patriot Action Shooters 2016 Special Classifier","match_date":"2016-03-19","stage_classifiercode":"06-03","member_number":"A84801","first_name":"LARRY","last_name":"THOMPSON","classification":"C","division":"PRODUCTION","hit_factor":10.4813},{"match_name":"MPPL 09022018","match_date":"2018-09-02","stage_classifiercode":"06-03","member_number":"A110989","first_name":"JACOB","last_name":"GUIMOND","classification":"U","division":"PRODUCTION","hit_factor":10.4803},{"match_name":"NPCCC 9-4-16 USPSA","match_date":"2016-09-04","stage_classifiercode":"06-03","member_number":"A83864","first_name":"TILL","last_name":"GROB","classification":"B","division":"PRODUCTION","hit_factor":10.4803},{"match_name":"CRGC USPSA Match 7-22-18","match_date":"2018-07-22","stage_classifiercode":"06-03","member_number":"\"\"","first_name":"DAT","last_name":"TRAN","classification":"\"\"","division":"PRODUCTION","hit_factor":10.4794},{"match_name":"Central IL Practical Shooters IL02 Havana April USPSA","match_date":"2017-04-08","stage_classifiercode":"06-03","member_number":"A92047","first_name":"KYLE","last_name":"SPENCER","classification":"B","division":"PRODUCTION","hit_factor":10.4794},{"match_name":"Pioneer Action Shooters May 2017","match_date":"2017-05-28","stage_classifiercode":"06-03","member_number":"A101456","first_name":"MICHAEL","last_name":"NGUYEN","classification":"B","division":"PRODUCTION","hit_factor":10.4712},{"match_name":"Hawkeye Gun Club February 2016","match_date":"2016-02-20","stage_classifiercode":"06-03","member_number":"TY77861","first_name":"JASON","last_name":"SHEPPARD","classification":"B","division":"PRODUCTION","hit_factor":10.4712},{"match_name":"Southern Maryland Practical Shooters 14 October 2018 USPSA","match_date":"2018-10-14","stage_classifiercode":"06-03","member_number":"L4181","first_name":"MIKE","last_name":"HASKIN","classification":"A","division":"PRODUCTION","hit_factor":10.4712},{"match_name":"LCSA USPSA September 2017","match_date":"2017-09-02","stage_classifiercode":"06-03","member_number":"A89315","first_name":"LEE","last_name":"FOLTYN","classification":"B","division":"PRODUCTION","hit_factor":10.4712},{"match_name":"Baghdad IPSC Match 8-5-2017","match_date":"2017-08-05","stage_classifiercode":"06-03","member_number":"L4189","first_name":"JONATHAN","last_name":"GONZALES","classification":"\"\"","division":"PRODUCTION","hit_factor":10.4712},{"match_name":"DWB - Deadwood Boys USPSA 18 October 2020","match_date":"2020-10-18","stage_classifiercode":"06-03","member_number":"a102027","first_name":"ANTONIO","last_name":"GONELLA","classification":"B","division":"PRODUCTION","hit_factor":10.4712},{"match_name":"Brazosland Pistoleros November 20 2016--USPSA","match_date":"2016-11-20","stage_classifiercode":"06-03","member_number":"\"\"","first_name":"STEVEN","last_name":"BARTLETT","classification":"U","division":"PRODUCTION","hit_factor":10.4712},{"match_name":"Atlanta Practical Shooters March 2016 USPSA - Classifier Match","match_date":"2016-03-06","stage_classifiercode":"06-03","member_number":"A88177","first_name":"CHRIS","last_name":"SMITH","classification":"B","division":"PRODUCTION","hit_factor":10.4701},{"match_name":"Coastal Area Practical Shooters  12-26-15","match_date":"2015-12-26","stage_classifiercode":"06-03","member_number":"L2633","first_name":"BRUCE","last_name":"WALLACE","classification":"M","division":"PRODUCTION","hit_factor":10.4689},{"match_name":"Patriot Action Shooters 2016 Special Classifier","match_date":"2016-03-19","stage_classifiercode":"06-03","member_number":"Ty66762","first_name":"DEAN","last_name":"WHITELAW","classification":"B","division":"PRODUCTION","hit_factor":10.4689},{"match_name":"Pioneer Action Shooters APR 2016","match_date":"2016-04-24","stage_classifiercode":"06-03","member_number":"A72743","first_name":"KEN","last_name":"LAMBERT","classification":"B","division":"PRODUCTION","hit_factor":10.4603},{"match_name":"Devil Dog USPSA Classifier Match-Saturday Session","match_date":"2018-03-10","stage_classifiercode":"06-03","member_number":"A101914","first_name":"SEAN","last_name":"NATUZZI","classification":"U","division":"PRODUCTION","hit_factor":10.4603},{"match_name":"Spsa Uspsa  1st Sat","match_date":"2016-01-02","stage_classifiercode":"06-03","member_number":"A75957","first_name":"CHUCK","last_name":"SMITH","classification":"B","division":"PRODUCTION","hit_factor":10.4589},{"match_name":"Central IL Practical Shooters IL02 Havana April USPSA","match_date":"2017-04-08","stage_classifiercode":"06-03","member_number":"FY51334","first_name":"JAMES","last_name":"STOBAUGH","classification":"A","division":"PRODUCTION","hit_factor":10.4589},{"match_name":"Inner 10 USPSA December 14th Match - Maybe","match_date":"2020-12-15","stage_classifiercode":"06-03","member_number":"TY113179","first_name":"RUSSELL","last_name":"SINGLETON","classification":"B","division":"PRODUCTION","hit_factor":10.4589},{"match_name":"Atlanta Practical Shooters March 2016 USPSA - Classifier Match","match_date":"2016-03-06","stage_classifiercode":"06-03","member_number":"A68985","first_name":"CHRIS","last_name":"FARNAN","classification":"B","division":"PRODUCTION","hit_factor":10.4589},{"match_name":"WELD ECO09 20181021","match_date":"2018-10-21","stage_classifiercode":"06-03","member_number":"A70801","first_name":"GLENN","last_name":"SULLIVAN","classification":"B","division":"PRODUCTION","hit_factor":10.4589},{"match_name":"TCGC Polo August 2017","match_date":"2017-08-20","stage_classifiercode":"06-03","member_number":"A54665","first_name":"HAL","last_name":"LENNON","classification":"B","division":"PRODUCTION","hit_factor":10.4575},{"match_name":"Space Coast Practical Shooters","match_date":"2017-12-02","stage_classifiercode":"06-03","member_number":"A104892","first_name":"JEAN","last_name":"GOSS","classification":"U","division":"PRODUCTION","hit_factor":10.4493},{"match_name":"NW01 Tuesday Sectional","match_date":"2017-08-01","stage_classifiercode":"06-03","member_number":"A79746","first_name":"CHARIS","last_name":"DENTON","classification":"B","division":"PRODUCTION","hit_factor":10.4493},{"match_name":"RDS August 2021 USPSA Match","match_date":"2021-08-07","stage_classifiercode":"06-03","member_number":"a110827","first_name":"DREW","last_name":"HICKS","classification":"B","division":"PRODUCTION","hit_factor":10.4493},{"match_name":"GoShoot Outdoors March 14th","match_date":"2020-03-14","stage_classifiercode":"06-03","member_number":"A126955","first_name":"CALEB","last_name":"VANVOORHIS","classification":"U","division":"PRODUCTION","hit_factor":10.4478},{"match_name":"EAPS July 2017 USPSA","match_date":"2017-07-16","stage_classifiercode":"06-03","member_number":"TY61337","first_name":"BEN","last_name":"HARANG","classification":"B","division":"PRODUCTION","hit_factor":10.4478},{"match_name":"ORSA USPSA July Match Dang Its Hot Out There","match_date":"2018-07-19","stage_classifiercode":"06-03","member_number":"A72343","first_name":"PAUL","last_name":"AVERY","classification":"B","division":"PRODUCTION","hit_factor":10.4478},{"match_name":"WVPPS May 2017","match_date":"2017-05-21","stage_classifiercode":"06-03","member_number":"TY82031","first_name":"JEFF","last_name":"JONES","classification":"B","division":"PRODUCTION","hit_factor":10.4461},{"match_name":"2016 Columbia Cascade Section Championship","match_date":"2016-08-12","stage_classifiercode":"06-03","member_number":"TY87796","first_name":"MICHAEL","last_name":"SMITH","classification":"B","division":"PRODUCTION","hit_factor":10.4384},{"match_name":"RSPP 3rd Saturday September 2016","match_date":"2016-09-17","stage_classifiercode":"06-03","member_number":"FY60505","first_name":"DON","last_name":"DIMAANO","classification":"C","division":"PRODUCTION","hit_factor":10.4384},{"match_name":"SSFGA & Master Blasters USPSA Classifier","match_date":"2018-11-17","stage_classifiercode":"06-03","member_number":"A108076","first_name":"NELSON","last_name":"OCONNOR","classification":"C","division":"PRODUCTION","hit_factor":10.4384},{"match_name":"Pinetucky USPSA 02-17-18","match_date":"2018-02-17","stage_classifiercode":"06-03","member_number":"A104558","first_name":"ALAN","last_name":"COLEMAN","classification":"U","division":"PRODUCTION","hit_factor":10.4366},{"match_name":"Strongpoint March 2017 Match","match_date":"2017-03-04","stage_classifiercode":"06-03","member_number":"TY84121","first_name":"GABOR","last_name":"MAGONY","classification":"B","division":"PRODUCTION","hit_factor":10.4366},{"match_name":"WSPS AUGUST 2017 USPSA MATCH","match_date":"2017-08-16","stage_classifiercode":"06-03","member_number":"A85450","first_name":"ANDY","last_name":"PERSHALL","classification":"C","division":"PRODUCTION","hit_factor":10.4366},{"match_name":"LCSA USPSA Special Classifier Match","match_date":"2016-03-24","stage_classifiercode":"06-03","member_number":"A95550","first_name":"BOB","last_name":"DEAN","classification":"U","division":"PRODUCTION","hit_factor":10.4348},{"match_name":"LCSA USPSA Special Classifier Match","match_date":"2016-03-24","stage_classifiercode":"06-03","member_number":"95550","first_name":"BOB","last_name":"DEAN","classification":"U","division":"PRODUCTION","hit_factor":10.4348},{"match_name":"MISS Match 1/3/18","match_date":"2018-01-03","stage_classifiercode":"06-03","member_number":"A94870","first_name":"BILL","last_name":"HOWARD","classification":"C","division":"PRODUCTION","hit_factor":10.4348},{"match_name":"The Great Wet Classifier - Renton USPSA - November 2020 - NW05","match_date":"2020-11-22","stage_classifiercode":"06-03","member_number":"A79746","first_name":"CHARIS","last_name":"DENTON","classification":"A","division":"PRODUCTION","hit_factor":10.4275},{"match_name":"NPCCC 9-4-16 USPSA","match_date":"2016-09-04","stage_classifiercode":"06-03","member_number":"B55","first_name":"CHRISTOPHER","last_name":"OAKES","classification":"C","division":"PRODUCTION","hit_factor":10.4275},{"match_name":"RPS May 2018 USPSA Match","match_date":"2018-05-12","stage_classifiercode":"06-03","member_number":"A110024","first_name":"CARTER","last_name":"WISE","classification":"U","division":"PRODUCTION","hit_factor":10.4235},{"match_name":"Piscataqua Master Blasters USPSA","match_date":"2018-09-02","stage_classifiercode":"06-03","member_number":"A101366","first_name":"HANK","last_name":"POIRIER","classification":"C","division":"PRODUCTION","hit_factor":10.4235},{"match_name":"NRG Saturday March 28th - Includes a Classifier Stage","match_date":"2020-03-28","stage_classifiercode":"06-03","member_number":"A98783","first_name":"MIKE","last_name":"CHANG","classification":"B","division":"PRODUCTION","hit_factor":10.4213},{"match_name":"TASC 4-16-16 (15Apr16-10:27:18)","match_date":"2016-04-16","stage_classifiercode":"06-03","member_number":"A91583","first_name":"RAYMOND","last_name":"MACH","classification":"D","division":"PRODUCTION","hit_factor":10.4167},{"match_name":"EAPS July 2017 USPSA","match_date":"2017-07-16","stage_classifiercode":"06-03","member_number":"TY55093","first_name":"MIKE","last_name":"PIZZOLATTO","classification":"M","division":"PRODUCTION","hit_factor":10.4167},{"match_name":"FSTC USPSA 1-29-16","match_date":"2017-01-29","stage_classifiercode":"06-03","member_number":"A90619","first_name":"JUSTIN","last_name":"KILEY","classification":"B","division":"PRODUCTION","hit_factor":10.4167},{"match_name":"Rankin Field Sunday USPSA","match_date":"2018-07-15","stage_classifiercode":"06-03","member_number":"A85342","first_name":"J.R.","last_name":"GUERRA","classification":"B","division":"PRODUCTION","hit_factor":10.4145},{"match_name":"NISA April Classifer Match 2016","match_date":"2016-04-24","stage_classifiercode":"06-03","member_number":"ty74021","first_name":"MICHAEL","last_name":"BLYAKHER","classification":"M","division":"PRODUCTION","hit_factor":10.4145},{"match_name":"Nampa USPSA September 5th 2020","match_date":"2020-09-05","stage_classifiercode":"06-03","member_number":"TY116605","first_name":"CARL","last_name":"OLSON","classification":"B","division":"PRODUCTION","hit_factor":10.4121},{"match_name":"Benton Gun Club-USPSA April 2017 Classifier","match_date":"2017-04-23","stage_classifiercode":"06-03","member_number":"A96080","first_name":"JAMES","last_name":"GREGORY","classification":"U","division":"PRODUCTION","hit_factor":10.4121},{"match_name":"USPSA MO21 2Alpha SBRC July 2017 Special Classifier","match_date":"2017-07-15","stage_classifiercode":"06-03","member_number":"A99964","first_name":"DAVID","last_name":"WARD","classification":"U","division":"PRODUCTION","hit_factor":10.4121},{"match_name":"Pinetucky USPSA 02-17-18","match_date":"2018-02-17","stage_classifiercode":"06-03","member_number":"TY78960","first_name":"TIM","last_name":"FRITZ","classification":"C","division":"PRODUCTION","hit_factor":10.4097},{"match_name":"Homestead USPSA Match","match_date":"2016-09-17","stage_classifiercode":"06-03","member_number":"A89812","first_name":"MICHAEL","last_name":"BARBE","classification":"U","division":"PRODUCTION","hit_factor":10.4058},{"match_name":"KSA USPSA May 2018","match_date":"2018-05-05","stage_classifiercode":"06-03","member_number":"A92566","first_name":"STEVE","last_name":"BEYER","classification":"B","division":"PRODUCTION","hit_factor":10.4058},{"match_name":"Devil Dog USPSA Classifier Match-Saturday Session","match_date":"2018-03-10","stage_classifiercode":"06-03","member_number":"A101612","first_name":"MATT","last_name":"MADSEN","classification":"\"\"","division":"PRODUCTION","hit_factor":10.4058},{"match_name":"CAS 09-06-20","match_date":"2020-09-06","stage_classifiercode":"06-03","member_number":"A104612","first_name":"STEPHEN","last_name":"MADUELL","classification":"B","division":"PRODUCTION","hit_factor":10.4034},{"match_name":"AREA 59 ALL CLASSIFIER MATCH","match_date":"2017-01-29","stage_classifiercode":"06-03","member_number":"A72560","first_name":"VITAN","last_name":"GOTSEV","classification":"B","division":"PRODUCTION","hit_factor":10.4034},{"match_name":"ALL CLASSIFIER SUMMERSLAM  -  AREA 59 2018","match_date":"2018-06-30","stage_classifiercode":"06-03","member_number":"A65453","first_name":"BOB","last_name":"ZELLER","classification":"B","division":"PRODUCTION","hit_factor":10.4034},{"match_name":"NPCCC 9-4-16 USPSA","match_date":"2016-09-04","stage_classifiercode":"06-03","member_number":"A80686","first_name":"MATT","last_name":"MERSMAN","classification":"B","division":"PRODUCTION","hit_factor":10.4034},{"match_name":"Crooked Creek Pistol League - May 21-22_2016","match_date":"2016-05-21","stage_classifiercode":"06-03","member_number":"A83391","first_name":"BRIAN","last_name":"BOEHRINGER","classification":"B","division":"PRODUCTION","hit_factor":10.4034},{"match_name":"SEPSA April 2017","match_date":"2017-04-08","stage_classifiercode":"06-03","member_number":"A68933","first_name":"JEFF","last_name":"BILOTTI","classification":"B","division":"PRODUCTION","hit_factor":10.4034},{"match_name":"MASTER BLASTERS & SSFGA USPSA - September","match_date":"2020-09-19","stage_classifiercode":"06-03","member_number":"A101682","first_name":"AUSTIN","last_name":"BLACKMAN","classification":"M","division":"PRODUCTION","hit_factor":10.401},{"match_name":"SPSA USPSA April 4th Sat match","match_date":"2017-04-22","stage_classifiercode":"06-03","member_number":"A102687","first_name":"TREVON","last_name":"BARBER","classification":"U","division":"PRODUCTION","hit_factor":10.4009},{"match_name":"LCSA USPSA AUGUST 2018","match_date":"2018-08-12","stage_classifiercode":"06-03","member_number":"TY101538","first_name":"SIMON","last_name":"COTE","classification":"B","division":"PRODUCTION","hit_factor":10.395},{"match_name":"Coastal Area Practical Shooters  12-26-15","match_date":"2015-12-26","stage_classifiercode":"06-03","member_number":"A78372","first_name":"BILL","last_name":"HARRIS","classification":"C","division":"PRODUCTION","hit_factor":10.395},{"match_name":"Benton Gun Club-USPSA April 2017 Classifier","match_date":"2017-04-23","stage_classifiercode":"06-03","member_number":"A92383","first_name":"GABRIEL","last_name":"BRUCE","classification":"U","division":"PRODUCTION","hit_factor":10.395},{"match_name":"BHPSC Weekly Match 9-30-2016","match_date":"2016-09-30","stage_classifiercode":"06-03","member_number":"\"\"","first_name":"TODD","last_name":"TUSCHHOFF","classification":"U","division":"PRODUCTION","hit_factor":10.395},{"match_name":"Cactus Match USPSA ALL CLASSIFIER July 2018","match_date":"2018-07-01","stage_classifiercode":"06-03","member_number":"TY56540","first_name":"DAVE","last_name":"JONES","classification":"B","division":"PRODUCTION","hit_factor":10.395},{"match_name":"LCSC Classifier 042918","match_date":"2018-04-28","stage_classifiercode":"06-03","member_number":"A110518","first_name":"NILE","last_name":"HENDERSON","classification":"U","division":"PRODUCTION","hit_factor":10.3924},{"match_name":"OPSC USPSA 8-14-2016","match_date":"2016-08-14","stage_classifiercode":"06-03","member_number":"A83864","first_name":"TILL","last_name":"GROB","classification":"B","division":"PRODUCTION","hit_factor":10.3924},{"match_name":"Cactus Match USPSA ALL CLASSIFIER July 2018","match_date":"2018-07-01","stage_classifiercode":"06-03","member_number":"A89131","first_name":"RYAN","last_name":"BAYS","classification":"A","division":"PRODUCTION","hit_factor":10.3924},{"match_name":"Nampa USPSA September 5th 2020","match_date":"2020-09-05","stage_classifiercode":"06-03","member_number":"fy81838","first_name":"JIM","last_name":"PARKER","classification":"C","division":"PRODUCTION","hit_factor":10.3842},{"match_name":"Patriot Action Shooters 2016 Special Classifier","match_date":"2016-03-19","stage_classifiercode":"06-03","member_number":"Ty57870","first_name":"GREG","last_name":"PRIVETT","classification":"B","division":"PRODUCTION","hit_factor":10.3842},{"match_name":"USPSA At ETTS Saturday","match_date":"2018-02-10","stage_classifiercode":"06-03","member_number":"TY93241","first_name":"DAZHI","last_name":"ZHANG","classification":"M","division":"PRODUCTION","hit_factor":10.3842},{"match_name":"Richmond Hot Shots October 17-18-2020 USPSA Pistol","match_date":"2020-10-17","stage_classifiercode":"06-03","member_number":"A113130","first_name":"SCOTT","last_name":"ALBRECHT","classification":"C","division":"PRODUCTION","hit_factor":10.3842},{"match_name":"Fairfax PS USPSA June 2017","match_date":"2017-06-27","stage_classifiercode":"06-03","member_number":"a91652","first_name":"KENT","last_name":"NORDSTROM","classification":"B","division":"PRODUCTION","hit_factor":10.3774},{"match_name":"Brazosland Pistoleros September 17 2017 USPSA","match_date":"2017-09-17","stage_classifiercode":"06-03","member_number":"\"\"","first_name":"DANIEL","last_name":"THOMPSON","classification":"U","division":"PRODUCTION","hit_factor":10.3734},{"match_name":"Pathfinder July USPSA Match","match_date":"2017-07-16","stage_classifiercode":"06-03","member_number":"TY88063","first_name":"SCOTT","last_name":"SALLADIN","classification":"C","division":"PRODUCTION","hit_factor":10.3734},{"match_name":"NPS April 2017 Match 2","match_date":"2017-04-08","stage_classifiercode":"06-03","member_number":"\"\"","first_name":"KYLE","last_name":"FENDER","classification":"U","division":"PRODUCTION","hit_factor":10.372},{"match_name":"Range E11even December 2018","match_date":"2018-12-22","stage_classifiercode":"06-03","member_number":"L4174","first_name":"BARRY","last_name":"SOCIA","classification":"C","division":"PRODUCTION","hit_factor":10.3704},{"match_name":"JCSSA Aug2017","match_date":"2017-08-04","stage_classifiercode":"06-03","member_number":"A86941","first_name":"MIKE","last_name":"NAKPAIRAT","classification":"B","division":"PRODUCTION","hit_factor":10.3704},{"match_name":"DSSA 2018-09 USPSA Pistol","match_date":"2018-09-23","stage_classifiercode":"06-03","member_number":"A99829","first_name":"JOHN","last_name":"MARTIN","classification":"C","division":"PRODUCTION","hit_factor":10.3704},{"match_name":"Custer March Classifier Match","match_date":"2018-03-04","stage_classifiercode":"06-03","member_number":"A84276","first_name":"JAKE","last_name":"OVERSTREET","classification":"U","division":"PRODUCTION","hit_factor":10.3704},{"match_name":"USPSA MO21 2Alpha SBRC July 2017 Special Classifier","match_date":"2017-07-15","stage_classifiercode":"06-03","member_number":"L2666","first_name":"MATTHEW","last_name":"FACAS","classification":"C","division":"PRODUCTION","hit_factor":10.3704},{"match_name":"Atlanta Practical Shooters March 2016 USPSA - Classifier Match","match_date":"2016-03-06","stage_classifiercode":"06-03","member_number":"A80656","first_name":"ANDREAS","last_name":"YANKOPOLUS","classification":"M","division":"PRODUCTION","hit_factor":10.3672},{"match_name":"Pinetucky USPSA 07-15-17","match_date":"2017-07-15","stage_classifiercode":"06-03","member_number":"A97645","first_name":"JED","last_name":"DALTON","classification":"U","division":"PRODUCTION","hit_factor":10.3638},{"match_name":"BHPC USPSA Match Classifier IOWA","match_date":"2018-06-16","stage_classifiercode":"06-03","member_number":"A109623","first_name":"JONATHAN","last_name":"PICKRELL","classification":"UNKNOWN","division":"PRODUCTION","hit_factor":10.3627},{"match_name":"EAPS July 2017 USPSA","match_date":"2017-07-16","stage_classifiercode":"06-03","member_number":"A102564","first_name":"DONALD","last_name":"POWERS","classification":"U","division":"PRODUCTION","hit_factor":10.3627},{"match_name":"SLPSA Dec USPSA","match_date":"2016-12-17","stage_classifiercode":"06-03","member_number":"A95093","first_name":"TYLER","last_name":"THOMPSON","classification":"U","division":"PRODUCTION","hit_factor":10.3627},{"match_name":"Competitive Shooters of Lake Norman CORNELIUS Thursday Evening Indoor USPSA Pistol Match North Carolina","match_date":"2018-11-01","stage_classifiercode":"06-03","member_number":"TY95614","first_name":"MITCH","last_name":"NICHOLS","classification":"C","division":"PRODUCTION","hit_factor":10.3594},{"match_name":"Parma 2018 July USPSA","match_date":"2018-07-21","stage_classifiercode":"06-03","member_number":"a111273","first_name":"MATTHEW","last_name":"KOEHLER","classification":"U","division":"PRODUCTION","hit_factor":10.3594},{"match_name":"FMM USPSA","match_date":"2017-03-19","stage_classifiercode":"06-03","member_number":"\"\"","first_name":"CHRISTOPHER","last_name":"WETTINGFELD","classification":"U","division":"PRODUCTION","hit_factor":10.3567},{"match_name":"NVSA USPSA 1610","match_date":"2016-10-02","stage_classifiercode":"06-03","member_number":"TY86706","first_name":"CHRIS","last_name":"DEWEY","classification":"A","division":"PRODUCTION","hit_factor":10.356},{"match_name":"NW01 Tuesday Sectional","match_date":"2017-08-01","stage_classifiercode":"06-03","member_number":"A101646","first_name":"NEIL","last_name":"MAMARIL","classification":"B","division":"PRODUCTION","hit_factor":10.3485},{"match_name":"ESPS USPSA OCT","match_date":"2016-10-22","stage_classifiercode":"06-03","member_number":"FY66562","first_name":"JONATHAN","last_name":"MARUCOT","classification":"A","division":"PRODUCTION","hit_factor":10.3485},{"match_name":"Uspsa Classifier","match_date":"2018-05-06","stage_classifiercode":"06-03","member_number":"F99914","first_name":"MATTHEW","last_name":"SCOTT","classification":"C","division":"PRODUCTION","hit_factor":10.3485},{"match_name":"MPSA 030516","match_date":"2016-03-05","stage_classifiercode":"06-03","member_number":"A79649","first_name":"JOHNNY","last_name":"TURNER","classification":"B","division":"PRODUCTION","hit_factor":10.3485},{"match_name":"Pioneer Action Shooters APR 2016","match_date":"2016-04-24","stage_classifiercode":"06-03","member_number":"TY-93368","first_name":"ALFRED","last_name":"BLAIS","classification":"U","division":"PRODUCTION","hit_factor":10.3485},{"match_name":"USPSA BDSC Baghdad Practical Shooters","match_date":"2017-01-21","stage_classifiercode":"06-03","member_number":"A99956","first_name":"RAY","last_name":"HULSMAN","classification":"U","division":"PRODUCTION","hit_factor":10.3485},{"match_name":"NPCCC 04-01-2018 USPSA","match_date":"2018-04-01","stage_classifiercode":"06-03","member_number":"TY90126","first_name":"TOM","last_name":"BURZYNSKI","classification":"B","division":"PRODUCTION","hit_factor":10.3448},{"match_name":"BPSA April 2017 USPSA","match_date":"2017-04-23","stage_classifiercode":"06-03","member_number":"A65429","first_name":"KEN","last_name":"CORNWELL","classification":"B","division":"PRODUCTION","hit_factor":10.3448},{"match_name":"OPSC USPSA 8-14-2016","match_date":"2016-08-14","stage_classifiercode":"06-03","member_number":"FY489656","first_name":"RAY","last_name":"JEZEK","classification":"X","division":"PRODUCTION","hit_factor":10.3413},{"match_name":"LIPSA - April 30th 2017 - USPSA Match Special Classifier","match_date":"2017-04-30","stage_classifiercode":"06-03","member_number":"TY76590","first_name":"AMANTE","last_name":"MARINAS","classification":"C","division":"PRODUCTION","hit_factor":10.3413},{"match_name":"NPCCC 9-4-16 USPSA","match_date":"2016-09-04","stage_classifiercode":"06-03","member_number":"A59961","first_name":"VINCE","last_name":"JAMISON","classification":"C","division":"PRODUCTION","hit_factor":10.3413},{"match_name":"Dundee Practical Shooters - March 24 2018 - Points","match_date":"2018-03-24","stage_classifiercode":"06-03","member_number":"L4182","first_name":"CHRIS","last_name":"GLANVILLE","classification":"B","division":"PRODUCTION","hit_factor":10.341},{"match_name":"SMPS USPSA Special Classifier Match - July 11th 2021","match_date":"2021-07-11","stage_classifiercode":"06-03","member_number":"TY123675","first_name":"HENRY","last_name":"LIANG","classification":"B","division":"PRODUCTION","hit_factor":10.3376},{"match_name":"Coastal Area Practical Shooters  12-26-15","match_date":"2015-12-26","stage_classifiercode":"06-03","member_number":"TY80524","first_name":"STUART","last_name":"MURRAY","classification":"B","division":"PRODUCTION","hit_factor":10.3376},{"match_name":"Custer March Classifier Match","match_date":"2018-03-04","stage_classifiercode":"06-03","member_number":"A80680","first_name":"PALMER","last_name":"HODGES","classification":"B","division":"PRODUCTION","hit_factor":10.3376},{"match_name":"Flagstaff Fun Shoot April 22 2017","match_date":"2017-04-22","stage_classifiercode":"06-03","member_number":"A55525","first_name":"MICHAEL","last_name":"MCDANNELL","classification":"\"\"","division":"PRODUCTION","hit_factor":10.3376},{"match_name":"MAPSA  2017 05 13","match_date":"2017-05-10","stage_classifiercode":"06-03","member_number":"A86153","first_name":"ARIC","last_name":"NILSON","classification":"B","division":"PRODUCTION","hit_factor":10.3321},{"match_name":"MPSA 101516","match_date":"2016-10-15","stage_classifiercode":"06-03","member_number":"A79649","first_name":"JOHNNY","last_name":"TURNER","classification":"B","division":"PRODUCTION","hit_factor":10.3306},{"match_name":"RBGC 2016-07-23","match_date":"2016-07-23","stage_classifiercode":"06-03","member_number":"A96933","first_name":"DAVID","last_name":"BLANTON","classification":"C","division":"PRODUCTION","hit_factor":10.3306},{"match_name":"Crooked Creek Pistol League - August 2017","match_date":"2017-08-26","stage_classifiercode":"06-03","member_number":"TY84504","first_name":"DON","last_name":"HERRERO","classification":"C","division":"PRODUCTION","hit_factor":10.3306},{"match_name":"Crooked Creek Pistol League - August 2017","match_date":"2017-08-26","stage_classifiercode":"06-03","member_number":"A103870","first_name":"MIKE","last_name":"ZUPANCIC","classification":"C","division":"PRODUCTION","hit_factor":10.3267},{"match_name":"EAPS July 2016 USPSA","match_date":"2016-07-17","stage_classifiercode":"06-03","member_number":"TY55093","first_name":"MIKE","last_name":"PIZZOLATTO","classification":"M","division":"PRODUCTION","hit_factor":10.3199},{"match_name":"SMD USPSA at VIR November 2018","match_date":"2018-11-04","stage_classifiercode":"06-03","member_number":"A109209","first_name":"IAN","last_name":"WILLMS","classification":"U","division":"PRODUCTION","hit_factor":10.3199},{"match_name":"BUAS January Match","match_date":"2018-01-14","stage_classifiercode":"06-03","member_number":"ty18014","first_name":"JOHN","last_name":"KRYGOWSKI","classification":"C","division":"PRODUCTION","hit_factor":10.3199},{"match_name":"MRPC USPSA July 2017","match_date":"2017-07-23","stage_classifiercode":"06-03","member_number":"A95521","first_name":"FRANK","last_name":"POSTLE","classification":"C","division":"PRODUCTION","hit_factor":10.3183},{"match_name":"BORCC USPSA March 2018 Classifier Match","match_date":"2018-03-24","stage_classifiercode":"06-03","member_number":"A64028","first_name":"JOSEPH","last_name":"MARGHERONE","classification":"M","division":"PRODUCTION","hit_factor":10.3183},{"match_name":"BORCC USPSA Classifier Match January 2017","match_date":"2017-01-22","stage_classifiercode":"06-03","member_number":"TY89120","first_name":"KEVIN","last_name":"MILLER","classification":"B","division":"PRODUCTION","hit_factor":10.3158},{"match_name":"SAGC CTX04 Monthly USPSA Match - February 2020","match_date":"2020-02-23","stage_classifiercode":"06-03","member_number":"A53154","first_name":"HADEN","last_name":"HARGUS","classification":"B","division":"PRODUCTION","hit_factor":10.3158},{"match_name":"Richmond October 17-18-2015","match_date":"2015-10-17","stage_classifiercode":"06-03","member_number":"A80489","first_name":"ESTHER","last_name":"TSAI","classification":"B","division":"PRODUCTION","hit_factor":10.3158},{"match_name":"Minot USPSA 3/14/21","match_date":"2021-03-14","stage_classifiercode":"06-03","member_number":"A114132","first_name":"MARTIN","last_name":"SMITH","classification":"B","division":"PRODUCTION","hit_factor":10.3158},{"match_name":"Uspsa Classifier","match_date":"2018-05-06","stage_classifiercode":"06-03","member_number":"TYF87401","first_name":"MICHAEL","last_name":"MAHONEY","classification":"U","division":"PRODUCTION","hit_factor":10.3093},{"match_name":"Shoot GTR USPSA Classifier 06-03","match_date":"2018-01-05","stage_classifiercode":"06-03","member_number":"ty106011","first_name":"CALVIN","last_name":"BRANDT","classification":"U","division":"PRODUCTION","hit_factor":10.3093},{"match_name":"AREA 59  BIG BANG ALL CLASSIFIER","match_date":"2017-12-30","stage_classifiercode":"06-03","member_number":"A98351","first_name":"EZEKIEL","last_name":"ADACLOG","classification":"C","division":"PRODUCTION","hit_factor":10.3093},{"match_name":"FMM USPSA","match_date":"2017-03-19","stage_classifiercode":"06-03","member_number":"TY86022","first_name":"BRIAN","last_name":"SHOPE","classification":"A","division":"PRODUCTION","hit_factor":10.3024},{"match_name":"The Irbil Open","match_date":"2017-05-14","stage_classifiercode":"06-03","member_number":"\"\"","first_name":"MIKE","last_name":"KEENAN","classification":"\"\"","division":"PRODUCTION","hit_factor":10.3004},{"match_name":"Hammer Down USPSA Tue Night","match_date":"2017-11-22","stage_classifiercode":"06-03","member_number":"A-103034","first_name":"HEATH","last_name":"MCDONALD","classification":"U","division":"PRODUCTION","hit_factor":10.3004},{"match_name":"COPS Sept 2020 USPSA Match","match_date":"2020-09-06","stage_classifiercode":"06-03","member_number":"TY122087","first_name":"GREGORY","last_name":"ABBASS","classification":"B","division":"PRODUCTION","hit_factor":10.2975},{"match_name":"LPC October 2016 Classifier Special","match_date":"2016-10-02","stage_classifiercode":"06-03","member_number":"L2776","first_name":"JOE","last_name":"DURNBAUGH","classification":"B","division":"PRODUCTION","hit_factor":10.2957},{"match_name":"WNYPPL July 2020 USPSA","match_date":"2020-07-26","stage_classifiercode":"06-03","member_number":"FY103226","first_name":"DAVID","last_name":"VERNER","classification":"C","division":"PRODUCTION","hit_factor":10.2941},{"match_name":"SAPSC Monthly USPSA Classifier Match 20160112","match_date":"2016-01-12","stage_classifiercode":"06-03","member_number":"A92805","first_name":"DAVID","last_name":"MAYS","classification":"U","division":"PRODUCTION","hit_factor":10.2894},{"match_name":"Chillicothe April-2018 USPSA Classifier Match","match_date":"2018-04-28","stage_classifiercode":"06-03","member_number":"TY88494","first_name":"GEORGE","last_name":"DYSICO","classification":"A","division":"PRODUCTION","hit_factor":10.2881},{"match_name":"DWB - Deadwood Boys USPSA 15 July 2018","match_date":"2018-07-15","stage_classifiercode":"06-03","member_number":"FY100803","first_name":"KENJI","last_name":"IWAMIZU","classification":"B","division":"PRODUCTION","hit_factor":10.2881},{"match_name":"PSAC 20180922","match_date":"2018-09-22","stage_classifiercode":"06-03","member_number":"L3928","first_name":"BENJAMIN","last_name":"GO","classification":"B","division":"PRODUCTION","hit_factor":10.2833},{"match_name":"EHPSA USPSA 27 May 2018","match_date":"2018-05-27","stage_classifiercode":"06-03","member_number":"TY72728","first_name":"KIRK","last_name":"SWEGER","classification":"B","division":"PRODUCTION","hit_factor":10.2775},{"match_name":"Strongpoint March 2017 Match","match_date":"2017-03-04","stage_classifiercode":"06-03","member_number":"\"\"","first_name":"JOHN","last_name":"RAMSEY","classification":"U","division":"PRODUCTION","hit_factor":10.2775},{"match_name":"Richmond Hot Shots February 20-21-2021 USPSA Pistol","match_date":"2021-02-20","stage_classifiercode":"06-03","member_number":"TY128570","first_name":"LOGAN","last_name":"YEOM","classification":"C","division":"PRODUCTION","hit_factor":10.2775},{"match_name":"Kabul 25 May 2018","match_date":"2018-05-25","stage_classifiercode":"06-03","member_number":"\"\"","first_name":"JED","last_name":"MORGAN","classification":"U","division":"PRODUCTION","hit_factor":10.2679},{"match_name":"ASC USPSA Apr. 18","match_date":"2021-04-18","stage_classifiercode":"06-03","member_number":"TY94513","first_name":"TONY","last_name":"SALLIS","classification":"A","division":"PRODUCTION","hit_factor":10.2674},{"match_name":"Rio Salado UPPL June 2021","match_date":"2021-06-13","stage_classifiercode":"06-03","member_number":"TY87182","first_name":"MILTON","last_name":"MEANS","classification":"B","division":"PRODUCTION","hit_factor":10.2669},{"match_name":"NPCCC 9-4-16 USPSA","match_date":"2016-09-04","stage_classifiercode":"06-03","member_number":"A87448","first_name":"RYAN","last_name":"ROOT","classification":"B","division":"PRODUCTION","hit_factor":10.2662},{"match_name":"CAS 09-06-20","match_date":"2020-09-06","stage_classifiercode":"06-03","member_number":"A109825","first_name":"ROBI","last_name":"SANDOZ","classification":"A","division":"PRODUCTION","hit_factor":10.2618},{"match_name":"BHPSC Weekly Match 2-24-2017 Special Classifier Match","match_date":"2017-02-25","stage_classifiercode":"06-03","member_number":"A94822","first_name":"ADAM","last_name":"TRAN","classification":"C","division":"PRODUCTION","hit_factor":10.2564},{"match_name":"Tropang Vegas All Classifier Match","match_date":"2020-12-06","stage_classifiercode":"06-03","member_number":"A87432","first_name":"JASON","last_name":"GUERRERO","classification":"D","division":"PRODUCTION","hit_factor":10.2508},{"match_name":"SAPSA July 2016","match_date":"2016-07-16","stage_classifiercode":"06-03","member_number":"89082","first_name":"MIGUEL","last_name":"COLES","classification":"B","division":"PRODUCTION","hit_factor":10.2506},{"match_name":"Crooked Creek Pistol League - August 2017","match_date":"2017-08-26","stage_classifiercode":"06-03","member_number":"A59597","first_name":"GREG","last_name":"PLATT","classification":"B","division":"PRODUCTION","hit_factor":10.2459},{"match_name":"Inner 10 USPSA December 14th Match - Maybe","match_date":"2020-12-15","stage_classifiercode":"06-03","member_number":"A88627","first_name":"JAY","last_name":"ANDERSON","classification":"B","division":"PRODUCTION","hit_factor":10.2455},{"match_name":"FSA USPSA Spring Classifier","match_date":"2018-03-18","stage_classifiercode":"06-03","member_number":"A88889","first_name":"MARK","last_name":"TUMPACH","classification":"C","division":"PRODUCTION","hit_factor":10.2403},{"match_name":"2016 Memphis Charity Challenge","match_date":"2016-10-23","stage_classifiercode":"06-03","member_number":"A64013","first_name":"EVAN","last_name":"MILLS","classification":"B","division":"PRODUCTION","hit_factor":10.2354},{"match_name":"AREA 59 ALL CLASSIFIER MATCH","match_date":"2017-01-29","stage_classifiercode":"06-03","member_number":"L2998","first_name":"GARY","last_name":"WU","classification":"C","division":"PRODUCTION","hit_factor":10.2345},{"match_name":"TMGN April 5 USPSA Classifiers Match","match_date":"2018-04-05","stage_classifiercode":"06-03","member_number":"a103386","first_name":"CESAR","last_name":"SANCHEZ","classification":"\"\"","division":"PRODUCTION","hit_factor":10.2345},{"match_name":"Devil Dog USPSA Classifier Match-Sunday Session","match_date":"2018-03-11","stage_classifiercode":"06-03","member_number":"A108026","first_name":"MARTIN","last_name":"KWONG","classification":"U","division":"PRODUCTION","hit_factor":10.2249},{"match_name":"WSPS AUGUST 2017 USPSA MATCH","match_date":"2017-08-16","stage_classifiercode":"06-03","member_number":"A98427","first_name":"MATT","last_name":"MYERS","classification":"C","division":"PRODUCTION","hit_factor":10.2249},{"match_name":"Pinetucky USPSA 07-15-17","match_date":"2017-07-15","stage_classifiercode":"06-03","member_number":"A98983","first_name":"JAMES","last_name":"POOLE","classification":"C","division":"PRODUCTION","hit_factor":10.2236},{"match_name":"Hawkeye Gun Club February 2016","match_date":"2016-02-20","stage_classifiercode":"06-03","member_number":"A83594","first_name":"TIM","last_name":"BOWDEN","classification":"C","division":"PRODUCTION","hit_factor":10.2236},{"match_name":"Range E11even March 2017","match_date":"2017-03-25","stage_classifiercode":"06-03","member_number":"A99996","first_name":"JAMIE","last_name":"BELK","classification":"C","division":"PRODUCTION","hit_factor":10.219},{"match_name":"PPPS 9-10-17","match_date":"2017-09-10","stage_classifiercode":"06-03","member_number":"TY78764","first_name":"STEVE","last_name":"LIERMAN","classification":"B","division":"PRODUCTION","hit_factor":10.2174},{"match_name":"Competitive Shooters of Lake Norman CORNELIUS Thursday Evening Indoor USPSA Pistol Match North Carolina","match_date":"2017-12-07","stage_classifiercode":"06-03","member_number":"A106222","first_name":"DANIEL","last_name":"LEITH","classification":"U","division":"PRODUCTION","hit_factor":10.2145},{"match_name":"RBGC 2016-07-23","match_date":"2016-07-23","stage_classifiercode":"06-03","member_number":"TY86488","first_name":"DEREK","last_name":"GIDDINGS","classification":"A","division":"PRODUCTION","hit_factor":10.2128},{"match_name":"Richmond Hot Shots October 17-18-2020 USPSA Pistol","match_date":"2020-10-17","stage_classifiercode":"06-03","member_number":"A129642","first_name":"ANDREW","last_name":"MIN","classification":"D","division":"PRODUCTION","hit_factor":10.2128},{"match_name":"Shoot GTR USPSA Sep 6","match_date":"2016-09-06","stage_classifiercode":"06-03","member_number":"A87317","first_name":"MICHAEL","last_name":"DUKES","classification":"B","division":"PRODUCTION","hit_factor":10.2041},{"match_name":"BHPC USPSA Monthly Match 9-11","match_date":"2016-09-11","stage_classifiercode":"06-03","member_number":"ty74015","first_name":"MIKE","last_name":"TANGEMAN","classification":"UNKNOWN","division":"PRODUCTION","hit_factor":10.2041},{"match_name":"2016 Memphis Charity Challenge","match_date":"2016-10-23","stage_classifiercode":"06-03","member_number":"A97863","first_name":"WES","last_name":"CARROLL","classification":"U","division":"PRODUCTION","hit_factor":10.2019},{"match_name":"March 2017 PCSI USPSA","match_date":"2017-03-04","stage_classifiercode":"06-03","member_number":"A74935","first_name":"MASON","last_name":"MICHELSON","classification":"B","division":"PRODUCTION","hit_factor":10.1977},{"match_name":"HSC USPSA June 2016","match_date":"2016-06-04","stage_classifiercode":"06-03","member_number":"\"\"","first_name":"DOUG","last_name":"BRYANT","classification":"A","division":"PRODUCTION","hit_factor":10.1925},{"match_name":"PTPC June 4th USPSA Match","match_date":"2017-06-04","stage_classifiercode":"06-03","member_number":"TY79628","first_name":"LUKE","last_name":"IRLACHER","classification":"C","division":"PRODUCTION","hit_factor":10.1911},{"match_name":"FBPPC JULY IPSC MATCH","match_date":"2016-07-09","stage_classifiercode":"06-03","member_number":"A44808","first_name":"BILL","last_name":"MILLER","classification":"A","division":"PRODUCTION","hit_factor":10.1833},{"match_name":"Patriot Action Shooters 2016 Special Classifier","match_date":"2016-03-19","stage_classifiercode":"06-03","member_number":"PEN","first_name":"MATTHEW","last_name":"LEE","classification":"\"\"","division":"PRODUCTION","hit_factor":10.1833},{"match_name":"Pioneer Action Shooters USPSA 5-27-18","match_date":"2018-05-27","stage_classifiercode":"06-03","member_number":"FY48411","first_name":"JAMES","last_name":"DAVIS","classification":"B","division":"PRODUCTION","hit_factor":10.1833},{"match_name":"NPCCC 9-4-16 USPSA","match_date":"2016-09-04","stage_classifiercode":"06-03","member_number":"\"\"","first_name":"NATE","last_name":"GOMBUS","classification":"U","division":"PRODUCTION","hit_factor":10.1803},{"match_name":"JCSSA MAR 6 2021","match_date":"2021-03-06","stage_classifiercode":"06-03","member_number":"Ty129294","first_name":"JENNIFER","last_name":"TANG","classification":"C","division":"PRODUCTION","hit_factor":10.1765},{"match_name":"BORCC USPSA Classifier Match January 2017","match_date":"2017-01-22","stage_classifiercode":"06-03","member_number":"TY61733","first_name":"KEITH","last_name":"HAFER","classification":"A","division":"PRODUCTION","hit_factor":10.1729},{"match_name":"SLOSA JAN 2021 USPSA MATCH","match_date":"2021-01-09","stage_classifiercode":"06-03","member_number":"TY113729","first_name":"JIMMY","last_name":"HOUGH","classification":"C","division":"PRODUCTION","hit_factor":10.1729},{"match_name":"Brazosland Pistoleros November 20 2016--USPSA","match_date":"2016-11-20","stage_classifiercode":"06-03","member_number":"\"\"","first_name":"JOHN","last_name":"VOSS","classification":"U","division":"PRODUCTION","hit_factor":10.1729},{"match_name":"Brothers N Arms August 2017 USPSA Match","match_date":"2017-08-19","stage_classifiercode":"06-03","member_number":"TY88701","first_name":"ROBERT","last_name":"CAMPBELL","classification":"C","division":"PRODUCTION","hit_factor":10.1695},{"match_name":"WPS USPSA Monthly Match","match_date":"2020-10-31","stage_classifiercode":"06-03","member_number":"A90790","first_name":"JESSICA","last_name":"BRAUN","classification":"C","division":"PRODUCTION","hit_factor":10.1695},{"match_name":"WPGC 6-20-16","match_date":"2016-06-14","stage_classifiercode":"06-03","member_number":"A89758","first_name":"JOE","last_name":"LUCIANO","classification":"U","division":"PRODUCTION","hit_factor":10.1626},{"match_name":"Competitive Shooters of Lake Norman CORNELIUS Thursday Evening Indoor USPSA Pistol Match North Carolina","match_date":"2020-01-02","stage_classifiercode":"06-03","member_number":"A107054","first_name":"DAVID","last_name":"LADIEU","classification":"C","division":"PRODUCTION","hit_factor":10.1587},{"match_name":"SEPSA April 2017","match_date":"2017-04-08","stage_classifiercode":"06-03","member_number":"L2633","first_name":"BRUCE","last_name":"WALLACE","classification":"M","division":"PRODUCTION","hit_factor":10.1587},{"match_name":"TASC 4-16-16 (15Apr16-10:27:18)","match_date":"2016-04-16","stage_classifiercode":"06-03","member_number":"A86599","first_name":"SEAN","last_name":"AGUAS","classification":"U","division":"PRODUCTION","hit_factor":10.1554},{"match_name":"GAS May 5th Match","match_date":"2018-05-05","stage_classifiercode":"06-03","member_number":"A90239","first_name":"KYNAN","last_name":"SUTTER","classification":"C","division":"PRODUCTION","hit_factor":10.1523},{"match_name":"ORPCI 2018.03.31 USPSA Special","match_date":"2018-03-31","stage_classifiercode":"06-03","member_number":"TY82031","first_name":"JEFF","last_name":"JONES","classification":"B","division":"PRODUCTION","hit_factor":10.1523},{"match_name":"SEPSA April 2017","match_date":"2017-04-08","stage_classifiercode":"06-03","member_number":"A100741","first_name":"MICHAEL","last_name":"MCCANN","classification":"U","division":"PRODUCTION","hit_factor":10.1523},{"match_name":"CCPL 02142016","match_date":"2016-02-14","stage_classifiercode":"06-03","member_number":"A79092","first_name":"RUSTY","last_name":"GERBER","classification":"B","division":"PRODUCTION","hit_factor":10.148},{"match_name":"TMGN December 21 Practical Shooter Match","match_date":"2017-12-22","stage_classifiercode":"06-03","member_number":"A101364","first_name":"DOC","last_name":"WILLOUGHBY","classification":"\"\"","division":"PRODUCTION","hit_factor":10.1466},{"match_name":"OKCGC February USPSA Match","match_date":"2017-02-04","stage_classifiercode":"06-03","member_number":"TY94798","first_name":"RICKEY","last_name":"HOWELL","classification":"C","division":"PRODUCTION","hit_factor":10.1449},{"match_name":"BLUE RIDGE ARSENAL July 6 Classifier Match","match_date":"2018-07-06","stage_classifiercode":"06-03","member_number":"TY108301","first_name":"CODY","last_name":"BRESNAK","classification":"U","division":"PRODUCTION","hit_factor":10.142},{"match_name":"ESPS USPSA OCT","match_date":"2016-10-22","stage_classifiercode":"06-03","member_number":"TY58056","first_name":"NOEL","last_name":"MARUCUT","classification":"A","division":"PRODUCTION","hit_factor":10.142},{"match_name":"Homestead USPSA Match","match_date":"2016-09-17","stage_classifiercode":"06-03","member_number":"\"\"","first_name":"HERNAN","last_name":"QUINTERO","classification":"U","division":"PRODUCTION","hit_factor":10.142},{"match_name":"CFRPC USPSA 2016 DECEMBER","match_date":"2016-12-18","stage_classifiercode":"06-03","member_number":"PEN","first_name":"JAMES","last_name":"GIBSON","classification":"B","division":"PRODUCTION","hit_factor":10.142},{"match_name":"Homestead September Classifier Match","match_date":"2020-09-20","stage_classifiercode":"06-03","member_number":"A72048","first_name":"RENE","last_name":"GARCIA","classification":"B","division":"PRODUCTION","hit_factor":10.142},{"match_name":"WELD ECO09 20181021","match_date":"2018-10-21","stage_classifiercode":"06-03","member_number":"A112784","first_name":"DEREK","last_name":"BECKWITH","classification":"U","division":"PRODUCTION","hit_factor":10.142},{"match_name":"Grandbaggers 07/2017","match_date":"2017-07-06","stage_classifiercode":"06-03","member_number":"A91531","first_name":"DIANA","last_name":"BRAFFORD","classification":"C","division":"PRODUCTION","hit_factor":10.1373},{"match_name":"Freeport March 13-2021","match_date":"2021-03-12","stage_classifiercode":"06-03","member_number":"L3915","first_name":"SALVATORE","last_name":"RUSSO","classification":"B","division":"PRODUCTION","hit_factor":10.1373},{"match_name":"BUAS January Match","match_date":"2018-01-14","stage_classifiercode":"06-03","member_number":"a98390","first_name":"MIKE","last_name":"COLE","classification":"B","division":"PRODUCTION","hit_factor":10.1373},{"match_name":"EAPS July 2017 USPSA","match_date":"2017-07-16","stage_classifiercode":"06-03","member_number":"TY86902","first_name":"ALAN","last_name":"LEMMI","classification":"C","division":"PRODUCTION","hit_factor":10.1351},{"match_name":"Pelham USPSA 2018-08-19","match_date":"2018-08-19","stage_classifiercode":"06-03","member_number":"A112192","first_name":"ALEX","last_name":"LUND","classification":"U","division":"PRODUCTION","hit_factor":10.1344},{"match_name":"APSC USPSA Classifier Match 07-01-17","match_date":"2017-07-01","stage_classifiercode":"06-03","member_number":"TY91712","first_name":"GEORGE","last_name":"CONWILL","classification":"C","division":"PRODUCTION","hit_factor":10.1344},{"match_name":"Fairfax PS USPSA June 2017","match_date":"2017-06-27","stage_classifiercode":"06-03","member_number":"A101953","first_name":"ANDONI","last_name":"GIBB","classification":"B","division":"PRODUCTION","hit_factor":10.1344},{"match_name":"LRC USPSA 2016-5-18","match_date":"2016-05-18","stage_classifiercode":"06-03","member_number":"\"\"","first_name":"MATT","last_name":"TAYLOR","classification":"U","division":"PRODUCTION","hit_factor":10.1344},{"match_name":"MISS Match 12-7-16","match_date":"2016-12-06","stage_classifiercode":"06-03","member_number":"A70713","first_name":"CHRIS","last_name":"JACOBS","classification":"C","division":"PRODUCTION","hit_factor":10.1344},{"match_name":"MCPSL Pistol 4-8-17","match_date":"2017-04-08","stage_classifiercode":"06-03","member_number":"CL164","first_name":"BOB","last_name":"RIPPY","classification":"C","division":"PRODUCTION","hit_factor":10.1317},{"match_name":"NISA April Classifer Match 2016","match_date":"2016-04-24","stage_classifiercode":"06-03","member_number":"A85072","first_name":"FRANK","last_name":"VALY","classification":"C","division":"PRODUCTION","hit_factor":10.1317},{"match_name":"WNYPPL August 2017 Classifier Match","match_date":"2017-08-27","stage_classifiercode":"06-03","member_number":"A97616","first_name":"NICHOLAS","last_name":"MUSCARELLA","classification":"C","division":"PRODUCTION","hit_factor":10.1317},{"match_name":"Springfield Tactical Shooters 03/012018","match_date":"2018-03-01","stage_classifiercode":"06-03","member_number":"TY76538","first_name":"JAMIE","last_name":"DANIELS","classification":"C","division":"PRODUCTION","hit_factor":10.1317},{"match_name":"RBGC 2016-07-23","match_date":"2016-07-23","stage_classifiercode":"06-03","member_number":"A68985","first_name":"CHRIS","last_name":"FARNAN","classification":"B","division":"PRODUCTION","hit_factor":10.124},{"match_name":"ORSA USPSA May 2018","match_date":"2018-05-19","stage_classifiercode":"06-03","member_number":"TY21268","first_name":"MARK","last_name":"LEVY","classification":"B","division":"PRODUCTION","hit_factor":10.1237},{"match_name":"USPSA BDSC Baghdad Practical Shooters","match_date":"2017-01-21","stage_classifiercode":"06-03","member_number":"FY67053","first_name":"KEN","last_name":"ROBERTS","classification":"U","division":"PRODUCTION","hit_factor":10.1215},{"match_name":"Blackstone Shooting Sports USPSA October 2016","match_date":"2016-10-11","stage_classifiercode":"06-03","member_number":"ty90030","first_name":"DAVID","last_name":"WASCHER","classification":"C","division":"PRODUCTION","hit_factor":10.1184},{"match_name":"NW01 Tuesday Sectional","match_date":"2017-08-01","stage_classifiercode":"06-03","member_number":"TY67558","first_name":"JOSH","last_name":"GLASTRA","classification":"B","division":"PRODUCTION","hit_factor":10.1183},{"match_name":"WPS USPSA Monthly Match","match_date":"2020-10-31","stage_classifiercode":"06-03","member_number":"A100811","first_name":"PAUL","last_name":"MINNICH","classification":"U","division":"PRODUCTION","hit_factor":10.1135},{"match_name":"Richmond Hot Shots October 17-18-2020 USPSA Pistol","match_date":"2020-10-17","stage_classifiercode":"06-03","member_number":"A105170","first_name":"KHAMISI","last_name":"NORWOOD","classification":"C","division":"PRODUCTION","hit_factor":10.1135},{"match_name":"Springfield Tactical Shooters 03/012018","match_date":"2018-03-01","stage_classifiercode":"06-03","member_number":"A104414","first_name":"STEVE","last_name":"EDGE","classification":"\"\"","division":"PRODUCTION","hit_factor":10.1135},{"match_name":"Richmond Hot Shots October 17-18-2020 USPSA Pistol","match_date":"2020-10-17","stage_classifiercode":"06-03","member_number":"A79352","first_name":"HEATHER","last_name":"PRICE","classification":"B","division":"PRODUCTION","hit_factor":10.1112},{"match_name":"WNYPPL August 2017 Classifier Match","match_date":"2017-08-27","stage_classifiercode":"06-03","member_number":"A88067","first_name":"CHARLES","last_name":"FRITZ II","classification":"C","division":"PRODUCTION","hit_factor":10.1031},{"match_name":"TPS USPSA -  September 2018 USPSA","match_date":"2018-09-01","stage_classifiercode":"06-03","member_number":"55550001111","first_name":"PETER","last_name":"WESTRICH","classification":"U","division":"PRODUCTION","hit_factor":10.1031},{"match_name":"ORSA USPSA July Match Dang Its Hot Out There","match_date":"2018-07-19","stage_classifiercode":"06-03","member_number":"A73387","first_name":"FRANK","last_name":"CASTIGLIA","classification":"B","division":"PRODUCTION","hit_factor":10.1031},{"match_name":"SOAP April 2021 USPSA Match","match_date":"2021-04-10","stage_classifiercode":"06-03","member_number":"A123627","first_name":"MICHAEL","last_name":"ISHERWOOD","classification":"C","division":"PRODUCTION","hit_factor":10.101},{"match_name":"BRRC USPSA MAY 14 2016","match_date":"2016-05-14","stage_classifiercode":"06-03","member_number":"PENDING","first_name":"STEVE","last_name":"KELLY","classification":"U","division":"PRODUCTION","hit_factor":10.101},{"match_name":"2015 Ontelaunee Holiday Hosefest","match_date":"2015-12-26","stage_classifiercode":"06-03","member_number":"\"\"","first_name":"ILYA","last_name":"SEMENOV","classification":"C","division":"PRODUCTION","hit_factor":10.101},{"match_name":"AGC_20170205","match_date":"2017-02-05","stage_classifiercode":"06-03","member_number":"TY78764","first_name":"STEVE","last_name":"LIERMAN","classification":"B","division":"PRODUCTION","hit_factor":10.0967},{"match_name":"Hose Monster Action","match_date":"2020-02-16","stage_classifiercode":"06-03","member_number":"a104950","first_name":"LUCAS","last_name":"COFFEY","classification":"X","division":"PRODUCTION","hit_factor":10.0967},{"match_name":"Grandbaggers September 2018","match_date":"2018-09-06","stage_classifiercode":"06-03","member_number":"A109126","first_name":"JOHN","last_name":"BOWERS","classification":"C","division":"PRODUCTION","hit_factor":10.0946},{"match_name":"USPSA MO21 2Alpha SBRC July 2017 Special Classifier","match_date":"2017-07-15","stage_classifiercode":"06-03","member_number":"TY78276","first_name":"CRAIG","last_name":"OKENFUSS","classification":"M","division":"PRODUCTION","hit_factor":10.0946},{"match_name":"GoShoot Outdoors March 14th","match_date":"2020-03-14","stage_classifiercode":"06-03","member_number":"TY70604","first_name":"RYAN","last_name":"FRANCIA","classification":"B","division":"PRODUCTION","hit_factor":10.0908},{"match_name":"Richmond  Boro Gun Club December 2017 USPSA Pistol Match","match_date":"2017-12-02","stage_classifiercode":"06-03","member_number":"A72865","first_name":"ROB","last_name":"LEVEROCK","classification":"X","division":"PRODUCTION","hit_factor":10.0908},{"match_name":"2015 Ontelaunee Holiday Hosefest","match_date":"2015-12-26","stage_classifiercode":"06-03","member_number":"\"\"","first_name":"JAMES","last_name":"OBORNE","classification":"C","division":"PRODUCTION","hit_factor":10.0908},{"match_name":"Benton Gun Club-USPSA January 28 2018","match_date":"2018-01-28","stage_classifiercode":"06-03","member_number":"A100439","first_name":"DREW","last_name":"WARWICK","classification":"U","division":"PRODUCTION","hit_factor":10.0897},{"match_name":"WSRC USPSA 7/15/2017","match_date":"2017-07-15","stage_classifiercode":"06-03","member_number":"A101790","first_name":"SCOTT","last_name":"CORRIGAN","classification":"U","division":"PRODUCTION","hit_factor":10.0877},{"match_name":"LIPSA - April 30th 2017 - USPSA Match Special Classifier","match_date":"2017-04-30","stage_classifiercode":"06-03","member_number":"FY79274","first_name":"WILLIAM","last_name":"PEARSON","classification":"C","division":"PRODUCTION","hit_factor":10.084},{"match_name":"EAGC September 2016 USPSA Pistol Match","match_date":"2016-09-18","stage_classifiercode":"06-03","member_number":"A96638","first_name":"SANGDO","last_name":"CHOI","classification":"U","division":"PRODUCTION","hit_factor":10.0823},{"match_name":"Homestead USPSA April 2021","match_date":"2021-04-18","stage_classifiercode":"06-03","member_number":"TY101923","first_name":"CHRISTINA","last_name":"BAKER","classification":"B","division":"PRODUCTION","hit_factor":10.0823},{"match_name":"FSTC USPSA 10-22-2017","match_date":"2017-10-22","stage_classifiercode":"06-03","member_number":"A87778","first_name":"BILL","last_name":"HATFIELD","classification":"B","division":"PRODUCTION","hit_factor":10.0806},{"match_name":"OFGC Practical Pistol Match Feb 21 2016","match_date":"2016-02-21","stage_classifiercode":"06-03","member_number":"A87859","first_name":"DAVID","last_name":"KEELING","classification":"B","division":"PRODUCTION","hit_factor":10.0806},{"match_name":"WSPS AUGUST 2017 USPSA MATCH","match_date":"2017-08-16","stage_classifiercode":"06-03","member_number":"A101236","first_name":"ISAAC","last_name":"GROSFELD-KATZ","classification":"B","division":"PRODUCTION","hit_factor":10.075},{"match_name":"MAPSA 2016.04.09","match_date":"2016-04-09","stage_classifiercode":"06-03","member_number":"A77361","first_name":"CRAIG","last_name":"EVANS","classification":"B","division":"PRODUCTION","hit_factor":10.0719},{"match_name":"GRPC USPSA DOG DAYS OF SUMMER","match_date":"2017-08-06","stage_classifiercode":"06-03","member_number":"A95439","first_name":"KEVIN","last_name":"BAKER","classification":"C","division":"PRODUCTION","hit_factor":10.0719},{"match_name":"ALL CLASSIFIER SUMMERSLAM  -  AREA 59 2018","match_date":"2018-06-30","stage_classifiercode":"06-03","member_number":"A103016","first_name":"ROBERT","last_name":"BUI","classification":"C","division":"PRODUCTION","hit_factor":10.0719},{"match_name":"SAPSA July 2016","match_date":"2016-07-16","stage_classifiercode":"06-03","member_number":"A62597","first_name":"TANNER","last_name":"TRUNNELL","classification":"A","division":"PRODUCTION","hit_factor":10.0719},{"match_name":"TPS USPSA -  September 2018 USPSA","match_date":"2018-09-01","stage_classifiercode":"06-03","member_number":"A95350","first_name":"ERIC","last_name":"PERKINS","classification":"B","division":"PRODUCTION","hit_factor":10.0719},{"match_name":"Brothers N Arms August 2016 USPSA Match","match_date":"2016-08-27","stage_classifiercode":"06-03","member_number":"PENDING","first_name":"STEVEN","last_name":"STELK","classification":"U","division":"PRODUCTION","hit_factor":10.0719},{"match_name":"2015 Ontelaunee Holiday Hosefest","match_date":"2015-12-26","stage_classifiercode":"06-03","member_number":"\"\"","first_name":"JASON","last_name":"LINN","classification":"B","division":"PRODUCTION","hit_factor":10.0719},{"match_name":"LCSC Classifier 042918","match_date":"2018-04-28","stage_classifiercode":"06-03","member_number":"A110660","first_name":"STEVEN","last_name":"TREBBE","classification":"U","division":"PRODUCTION","hit_factor":10.0705},{"match_name":"Coastal Area Practical Shooters  12-26-15","match_date":"2015-12-26","stage_classifiercode":"06-03","member_number":"A86410","first_name":"MARK","last_name":"LANCASTER","classification":"C","division":"PRODUCTION","hit_factor":10.0705},{"match_name":"EWPSA 2018-07 -M","match_date":"2018-07-15","stage_classifiercode":"06-03","member_number":"A90657","first_name":"KENDALL","last_name":"GUSTAFSON","classification":"C","division":"PRODUCTION","hit_factor":10.0705},{"match_name":"Brock's Gap USPSA March 6 2021","match_date":"2021-03-06","stage_classifiercode":"06-03","member_number":"ty105922","first_name":"DAVID","last_name":"BERTANZETTI","classification":"C","division":"PRODUCTION","hit_factor":10.0705},{"match_name":"BUAS January Match","match_date":"2018-01-14","stage_classifiercode":"06-03","member_number":"a60707","first_name":"DAVE","last_name":"SOLIMINI","classification":"M","division":"PRODUCTION","hit_factor":10.0705},{"match_name":"Hose Monster Action","match_date":"2020-02-16","stage_classifiercode":"06-03","member_number":"Ty111313","first_name":"JASON","last_name":"BRYNGELSON","classification":"C","division":"PRODUCTION","hit_factor":10.0705},{"match_name":"LBAS151219","match_date":"2015-12-19","stage_classifiercode":"06-03","member_number":"A83985","first_name":"STEVEN","last_name":"NOVELL","classification":"B","division":"PRODUCTION","hit_factor":10.0642},{"match_name":"OPSA November 2017","match_date":"2017-11-26","stage_classifiercode":"06-03","member_number":"A44808","first_name":"WILLIAM","last_name":"MILLER","classification":"A","division":"PRODUCTION","hit_factor":10.0616},{"match_name":"Chillicothe April-2018 USPSA Classifier Match","match_date":"2018-04-28","stage_classifiercode":"06-03","member_number":"FY98680","first_name":"MIKE","last_name":"GIBBONS","classification":"C","division":"PRODUCTION","hit_factor":10.0616},{"match_name":"Pioneer Action Shooters May 2017","match_date":"2017-05-28","stage_classifiercode":"06-03","member_number":"A103375","first_name":"MATTHEW","last_name":"DITULLIO","classification":"C","division":"PRODUCTION","hit_factor":10.0616},{"match_name":"Grandbaggers 07/2017","match_date":"2017-07-06","stage_classifiercode":"06-03","member_number":"A103599","first_name":"BEN","last_name":"KRUSE","classification":"U","division":"PRODUCTION","hit_factor":10.0616},{"match_name":"ARPC USPSA 4-19-21 Super Classifier","match_date":"2021-04-20","stage_classifiercode":"06-03","member_number":"A131470","first_name":"TYLER","last_name":"LIVELY","classification":"U","division":"PRODUCTION","hit_factor":10.0616},{"match_name":"GTR USPSA Tues April 19","match_date":"2016-04-19","stage_classifiercode":"06-03","member_number":"A89762","first_name":"NICK","last_name":"CUMMINGS","classification":"C","division":"PRODUCTION","hit_factor":10.0604},{"match_name":"Benton Gun Club-USPSA May 24","match_date":"2020-05-24","stage_classifiercode":"06-03","member_number":"TY114200","first_name":"BILL","last_name":"GODBOLD","classification":"C","division":"PRODUCTION","hit_factor":10.0535},{"match_name":"BGS Hudson Week 10","match_date":"2020-02-16","stage_classifiercode":"06-03","member_number":"A45546","first_name":"DAVID","last_name":"GUNDERSON","classification":"C","division":"PRODUCTION","hit_factor":10.0524},{"match_name":"Crooked Creek Pistol League - May 21-22_2016","match_date":"2016-05-21","stage_classifiercode":"06-03","member_number":"A82711","first_name":"TIM","last_name":"LOGAN","classification":"B","division":"PRODUCTION","hit_factor":10.0503},{"match_name":"BGS Hudson Week 10","match_date":"2020-02-16","stage_classifiercode":"06-03","member_number":"TY119445","first_name":"GRAYDON","last_name":"VOGT","classification":"C","division":"PRODUCTION","hit_factor":10.0427},{"match_name":"SCS USPSA Pistol with Classifer - Special Classifier July 31 2016","match_date":"2016-07-31","stage_classifiercode":"06-03","member_number":"A-95006","first_name":"JOE","last_name":"PATTI","classification":"U","division":"PRODUCTION","hit_factor":10.0427},{"match_name":"LCSC Classifier 042918","match_date":"2018-04-28","stage_classifiercode":"06-03","member_number":"A82878","first_name":"RICHARD","last_name":"WILLIAMS","classification":"B","division":"PRODUCTION","hit_factor":10.0418},{"match_name":"Trigger Guard USPSA","match_date":"2016-04-02","stage_classifiercode":"06-03","member_number":"A89295","first_name":"CHASE","last_name":"FARKAS","classification":"U","division":"PRODUCTION","hit_factor":10.0418},{"match_name":"Schultz September 2018","match_date":"2018-09-09","stage_classifiercode":"06-03","member_number":"A108812","first_name":"DUSTIN","last_name":"LOBNER","classification":"C","division":"PRODUCTION","hit_factor":10.0418},{"match_name":"WSPS AUGUST 2017 USPSA MATCH","match_date":"2017-08-16","stage_classifiercode":"06-03","member_number":"A103615","first_name":"CODY","last_name":"WERTZ","classification":"U","division":"PRODUCTION","hit_factor":10.041},{"match_name":"SMPS March 2016","match_date":"2016-03-13","stage_classifiercode":"06-03","member_number":"A93371","first_name":"MIKE","last_name":"SOMERS","classification":"U","division":"PRODUCTION","hit_factor":10.0402},{"match_name":"SAPSA January 2018","match_date":"2018-01-20","stage_classifiercode":"06-03","member_number":"A21833","first_name":"DAVID","last_name":"WILLIAMS","classification":"A","division":"PRODUCTION","hit_factor":10.0307},{"match_name":"APSC USPSA Classifier Match 07-01-17","match_date":"2017-07-01","stage_classifiercode":"06-03","member_number":"A103542","first_name":"ZACK","last_name":"DARWIN","classification":"U","division":"PRODUCTION","hit_factor":10.0301},{"match_name":"Schultz March USPSA","match_date":"2021-03-14","stage_classifiercode":"06-03","member_number":"L4345","first_name":"JOE","last_name":"SANCHEZ","classification":"B","division":"PRODUCTION","hit_factor":10.0209},{"match_name":"LPRGC - Lower Providence USPSA October 2016","match_date":"2016-10-01","stage_classifiercode":"06-03","member_number":"A93036","first_name":"MIKE","last_name":"REESE","classification":"C","division":"PRODUCTION","hit_factor":10.0209},{"match_name":"Heartland Practical Shooters USPSA League","match_date":"2018-04-05","stage_classifiercode":"06-03","member_number":"Ty84939","first_name":"WAYLAN","last_name":"MORAN","classification":"U","division":"PRODUCTION","hit_factor":10.02},{"match_name":"Hawkeye Gun Club February 2016","match_date":"2016-02-20","stage_classifiercode":"06-03","member_number":"A-93660","first_name":"THOMAS","last_name":"PICKRAL","classification":"U","division":"PRODUCTION","hit_factor":10.02},{"match_name":"Cactus Match USPSA ALL CLASSIFIER July 2018","match_date":"2018-07-01","stage_classifiercode":"06-03","member_number":"FY62896","first_name":"J.","last_name":"DEMPSEY","classification":"B","division":"PRODUCTION","hit_factor":10.02},{"match_name":"WSRC USPSA 7/15/2017","match_date":"2017-07-15","stage_classifiercode":"06-03","member_number":"A95314","first_name":"MICHAEL","last_name":"WATSON","classification":"C","division":"PRODUCTION","hit_factor":10.0109},{"match_name":"TPS USPSA -  September 2018 USPSA","match_date":"2018-09-01","stage_classifiercode":"06-03","member_number":"A106226","first_name":"ZACH","last_name":"BERLINGHOFF","classification":"U","division":"PRODUCTION","hit_factor":10.0109},{"match_name":"Benton Gun Club-USPSA January 28 2018","match_date":"2018-01-28","stage_classifiercode":"06-03","member_number":"\"\"","first_name":"DALE","last_name":"COLLINS","classification":"U","division":"PRODUCTION","hit_factor":10.0106},{"match_name":"BHPSC Weekly Match 2-24-2017 Special Classifier Match","match_date":"2017-02-25","stage_classifiercode":"06-03","member_number":"A50587","first_name":"RIICHIRO","last_name":"SUZUKI","classification":"C","division":"PRODUCTION","hit_factor":10.0102},{"match_name":"Colonial Rifle and Pistol Club June 2018 Special Classifier","match_date":"2018-06-02","stage_classifiercode":"06-03","member_number":"A100045","first_name":"KYLE","last_name":"KIM","classification":"C","division":"PRODUCTION","hit_factor":10.0102},{"match_name":"LCSC Classifier 042918","match_date":"2018-04-28","stage_classifiercode":"06-03","member_number":"TY107457","first_name":"KANGWEI","last_name":"MAO","classification":"C","division":"PRODUCTION","hit_factor":10.01},{"match_name":"NCPS USPSA Handgun Match November 29 2015","match_date":"2015-11-29","stage_classifiercode":"06-03","member_number":"A88656","first_name":"BENJAMIN","last_name":"SANTA MARIA","classification":"C","division":"PRODUCTION","hit_factor":10.01},{"match_name":"NITE OWLS AREA 59 ALL CLASSIFIER","match_date":"2020-07-29","stage_classifiercode":"06-03","member_number":"A106456","first_name":"DAVID","last_name":"DUFFY","classification":"B","division":"PRODUCTION","hit_factor":10.01},{"match_name":"Minnetonka Game and Fish Sept 2 Match","match_date":"2020-09-02","stage_classifiercode":"06-03","member_number":"A119929","first_name":"RYAN","last_name":"SKARDA","classification":"C","division":"PRODUCTION","hit_factor":10.01},{"match_name":"Judes Peanut Butter Scissorhands","match_date":"2016-06-01","stage_classifiercode":"06-03","member_number":"A95948","first_name":"BENJAMIN","last_name":"BERNARD","classification":"U","division":"PRODUCTION","hit_factor":10.01},{"match_name":"Pioneer Action Shooters APR 2016","match_date":"2016-04-24","stage_classifiercode":"06-03","member_number":"\"\"","first_name":"ERIK","last_name":"GUDMUNDSEN","classification":"U","division":"PRODUCTION","hit_factor":10.01},{"match_name":"CAS 09-06-20","match_date":"2020-09-06","stage_classifiercode":"06-03","member_number":"TY108640","first_name":"MARK","last_name":"GIARDINA","classification":"C","division":"PRODUCTION","hit_factor":10},{"match_name":"MS06 Team Magnolia USPSA","match_date":"2017-03-05","stage_classifiercode":"06-03","member_number":"A98139","first_name":"CARL","last_name":"BERNSTEIN","classification":"C","division":"PRODUCTION","hit_factor":10},{"match_name":"EAGC September 2016 USPSA Pistol Match","match_date":"2016-09-18","stage_classifiercode":"06-03","member_number":"A95688","first_name":"MICHAEL","last_name":"SMITH","classification":"U","division":"PRODUCTION","hit_factor":10},{"match_name":"TMGN April 5 USPSA Classifiers Match","match_date":"2018-04-05","stage_classifiercode":"06-03","member_number":"A109718","first_name":"KYLE","last_name":"WEIR","classification":"\"\"","division":"PRODUCTION","hit_factor":10},{"match_name":"Uspsa Classifier","match_date":"2018-05-06","stage_classifiercode":"06-03","member_number":"F109868","first_name":"NICHOLAS","last_name":"VANROOTSELAAR","classification":"U","division":"PRODUCTION","hit_factor":10},{"match_name":"WSRC USPSA 7/15/2017","match_date":"2017-07-15","stage_classifiercode":"06-03","member_number":"A104056","first_name":"TIM","last_name":"PELUDAT","classification":"U","division":"PRODUCTION","hit_factor":10},{"match_name":"Shasta Shooters 2018 June Special Classifier","match_date":"2018-06-09","stage_classifiercode":"06-03","member_number":"TY94338","first_name":"RON","last_name":"HARDIN","classification":"B","division":"PRODUCTION","hit_factor":10},{"match_name":"FLPSA MN14 USPSA July 13 2017","match_date":"2017-07-13","stage_classifiercode":"06-03","member_number":"A91699","first_name":"SHANE","last_name":"WURST","classification":"B","division":"PRODUCTION","hit_factor":9.99},{"match_name":"SCS USPSA Pistol with Classifer - Special Classifier July 31 2016","match_date":"2016-07-31","stage_classifiercode":"06-03","member_number":"FY64186","first_name":"CHRIS","last_name":"MULLINS","classification":"C","division":"PRODUCTION","hit_factor":9.99},{"match_name":"ORSA USPSA October 2020","match_date":"2020-10-17","stage_classifiercode":"06-03","member_number":"A64179","first_name":"JASON","last_name":"STANLEY","classification":"B","division":"PRODUCTION","hit_factor":9.99},{"match_name":"ORSA USPSA October 2020","match_date":"2020-10-17","stage_classifiercode":"06-03","member_number":"A72787","first_name":"PERRY","last_name":"JOHNSON","classification":"A","division":"PRODUCTION","hit_factor":9.99},{"match_name":"APSC USPSA  3-7-20","match_date":"2020-03-06","stage_classifiercode":"06-03","member_number":"TY123701","first_name":"MARC","last_name":"SPEED","classification":"U","division":"PRODUCTION","hit_factor":9.9898},{"match_name":"BRSP Tuesday Night USPSA Match - March 13","match_date":"2018-03-14","stage_classifiercode":"06-03","member_number":"A88816","first_name":"WILLIAM","last_name":"PEARCH","classification":"B","division":"PRODUCTION","hit_factor":9.9896},{"match_name":"PRG July 2017 Match","match_date":"2017-07-02","stage_classifiercode":"06-03","member_number":"\"\"","first_name":"JONATHAN","last_name":"KIM","classification":"U","division":"PRODUCTION","hit_factor":9.98},{"match_name":"Homestead USPSA April 2021","match_date":"2021-04-18","stage_classifiercode":"06-03","member_number":"TY113767","first_name":"ELNAR","last_name":"SAFAR","classification":"B","division":"PRODUCTION","hit_factor":9.98},{"match_name":"FVPS June Match","match_date":"2016-06-04","stage_classifiercode":"06-03","member_number":"\"\"","first_name":"KEN","last_name":"SCHMIDTCHEN","classification":"U","division":"PRODUCTION","hit_factor":9.9796},{"match_name":"FBPPC FEBRUARY 2016 MATCH","match_date":"2016-02-13","stage_classifiercode":"06-03","member_number":"PEN","first_name":"JASON","last_name":"SALAZAR","classification":"U","division":"PRODUCTION","hit_factor":9.9796},{"match_name":"VISSC Bono","match_date":"2020-10-25","stage_classifiercode":"06-03","member_number":"TY99389","first_name":"PHILLIP","last_name":"PARANADA","classification":"C","division":"PRODUCTION","hit_factor":9.9796},{"match_name":"Range E11even October 2017","match_date":"2017-10-28","stage_classifiercode":"06-03","member_number":"L2456","first_name":"RHETT","last_name":"TOLER","classification":"B","division":"PRODUCTION","hit_factor":9.9792},{"match_name":"BRC_20170409","match_date":"2017-04-09","stage_classifiercode":"06-03","member_number":"A70801","first_name":"GLENN","last_name":"SULLIVAN","classification":"C","division":"PRODUCTION","hit_factor":9.9788},{"match_name":"ALL CLASSIFIER SUMMERSLAM  -  AREA 59 2018","match_date":"2018-06-30","stage_classifiercode":"06-03","member_number":"TY104401","first_name":"TERRY","last_name":"MU","classification":"U","division":"PRODUCTION","hit_factor":9.9783},{"match_name":"USPSA-AB 2018-15 at Brooks Pistol Club - adhoc","match_date":"2018-09-09","stage_classifiercode":"06-03","member_number":"f102497","first_name":"WADE","last_name":"ZAWADZKI","classification":"U","division":"PRODUCTION","hit_factor":9.9701},{"match_name":"Idaho ISPS September 16th 2018","match_date":"2018-09-16","stage_classifiercode":"06-03","member_number":"TY41041","first_name":"NICK","last_name":"WELCH","classification":"B","division":"PRODUCTION","hit_factor":9.9701},{"match_name":"BPSA April 2017 USPSA","match_date":"2017-04-23","stage_classifiercode":"06-03","member_number":"A98845","first_name":"BLAYNE","last_name":"DUPUY","classification":"C","division":"PRODUCTION","hit_factor":9.9701},{"match_name":"Piscataqua Master Blasters USPSA","match_date":"2018-09-02","stage_classifiercode":"06-03","member_number":"A87902","first_name":"PATRICK","last_name":"VITALE","classification":"C","division":"PRODUCTION","hit_factor":9.9701},{"match_name":"TASC 4-16-16 (15Apr16-10:27:18)","match_date":"2016-04-16","stage_classifiercode":"06-03","member_number":"A82878","first_name":"RICHARD","last_name":"WILLIAMS","classification":"C","division":"PRODUCTION","hit_factor":9.9695},{"match_name":"WSRC USPSA 7/15/2017","match_date":"2017-07-15","stage_classifiercode":"06-03","member_number":"A98260","first_name":"JOHNNY","last_name":"SCOTT","classification":"C","division":"PRODUCTION","hit_factor":9.9695},{"match_name":"BRC_20170409","match_date":"2017-04-09","stage_classifiercode":"06-03","member_number":"A94589","first_name":"JOE","last_name":"TREGENZA","classification":"B","division":"PRODUCTION","hit_factor":9.9675},{"match_name":"Smoke & Hope Shooters USPSA June 24 2017","match_date":"2017-06-24","stage_classifiercode":"06-03","member_number":"A92168","first_name":"JOHN","last_name":"TAFOYA","classification":"B","division":"PRODUCTION","hit_factor":9.9652},{"match_name":"Armory Indoor League","match_date":"2020-03-12","stage_classifiercode":"06-03","member_number":"A114995","first_name":"TYREL","last_name":"KELSEY","classification":"C","division":"PRODUCTION","hit_factor":9.9602},{"match_name":"SAPSC Monthly USPSA Classifier Match 20160112","match_date":"2016-01-12","stage_classifiercode":"06-03","member_number":"A85628","first_name":"CHRIS","last_name":"MOORE","classification":"B","division":"PRODUCTION","hit_factor":9.9602},{"match_name":"Central IL Practical Shooters IL02 Havana April USPSA","match_date":"2017-04-08","stage_classifiercode":"06-03","member_number":"A83660","first_name":"MATT","last_name":"LEE","classification":"B","division":"PRODUCTION","hit_factor":9.9602},{"match_name":"Hammer Down USPSA Tue Night","match_date":"2017-11-22","stage_classifiercode":"06-03","member_number":"a91933","first_name":"CHRIS","last_name":"HITMAN","classification":"C","division":"PRODUCTION","hit_factor":9.9602},{"match_name":"SSFGA & Master Blasters USPSA Classifier","match_date":"2018-11-17","stage_classifiercode":"06-03","member_number":"A111430","first_name":"SEAN","last_name":"MCCLURE","classification":"C","division":"PRODUCTION","hit_factor":9.9602},{"match_name":"LCHG May 2018 USPSA Special Classifier","match_date":"2018-05-12","stage_classifiercode":"06-03","member_number":"A96894","first_name":"COLT","last_name":"HUBBS","classification":"U","division":"PRODUCTION","hit_factor":9.9602},{"match_name":"LdF 4th Saturday Match","match_date":"2015-12-26","stage_classifiercode":"06-03","member_number":"A38439","first_name":"GREGG","last_name":"BAUER","classification":"U","division":"PRODUCTION","hit_factor":9.9593},{"match_name":"BTSA USPSA 2016-8","match_date":"2016-08-28","stage_classifiercode":"06-03","member_number":"PEN","first_name":"BRUCE","last_name":"GIACCHETTA","classification":"C","division":"PRODUCTION","hit_factor":9.9593},{"match_name":"BHPSC Monthy Match September 2018","match_date":"2018-09-28","stage_classifiercode":"06-03","member_number":"A107271","first_name":"JEFF","last_name":"PICKMAN","classification":"D","division":"PRODUCTION","hit_factor":9.9593},{"match_name":"Shoot GTR USPSA Sep 6","match_date":"2016-09-06","stage_classifiercode":"06-03","member_number":"A91927","first_name":"JOJO","last_name":"GAYO","classification":"C","division":"PRODUCTION","hit_factor":9.9585},{"match_name":"MCPSL Pistol 4-8-17","match_date":"2017-04-08","stage_classifiercode":"06-03","member_number":"A50587","first_name":"RIICHIRO","last_name":"SUZUKI","classification":"C","division":"PRODUCTION","hit_factor":9.9567},{"match_name":"MASTER BLASTERS & SSFGA USPSA - September","match_date":"2020-09-19","stage_classifiercode":"06-03","member_number":"A77713","first_name":"GREGORY","last_name":"SMUSHKIN","classification":"B","division":"PRODUCTION","hit_factor":9.9502},{"match_name":"HAS April 2016 Pistol Match","match_date":"2016-04-10","stage_classifiercode":"06-03","member_number":"TY73574","first_name":"MICHAEL","last_name":"LABOSSIERE","classification":"B","division":"PRODUCTION","hit_factor":9.9502},{"match_name":"HAS April 2016 Pistol Match","match_date":"2016-04-10","stage_classifiercode":"06-03","member_number":"A81222","first_name":"MASON","last_name":"LANE","classification":"U","division":"PRODUCTION","hit_factor":9.9502},{"match_name":"SMPS March 2016","match_date":"2016-03-13","stage_classifiercode":"06-03","member_number":"A79248","first_name":"WILLIAM","last_name":"BROADUS","classification":"B","division":"PRODUCTION","hit_factor":9.9502},{"match_name":"Devil Dog USPSA Classifier Match-Saturday Session","match_date":"2018-03-10","stage_classifiercode":"06-03","member_number":"A107892","first_name":"CHAD","last_name":"PRATER","classification":"U","division":"PRODUCTION","hit_factor":9.9502},{"match_name":"MPPL 09022018","match_date":"2018-09-02","stage_classifiercode":"06-03","member_number":"A27035","first_name":"HEITH","last_name":"KANESHIGE","classification":"U","division":"PRODUCTION","hit_factor":9.9482},{"match_name":"Baghdad IPSC Match 8-5-2017","match_date":"2017-08-05","stage_classifiercode":"06-03","member_number":"FY104263","first_name":"SHAWN","last_name":"ALLEN","classification":"\"\"","division":"PRODUCTION","hit_factor":9.9482},{"match_name":"Homestead USPSA Match","match_date":"2016-09-17","stage_classifiercode":"06-03","member_number":"A74400","first_name":"ANDREW","last_name":"MEDINA","classification":"C","division":"PRODUCTION","hit_factor":9.9448},{"match_name":"March 2017 PCSI USPSA","match_date":"2017-03-04","stage_classifiercode":"06-03","member_number":"TY27846","first_name":"LYLE","last_name":"HERMAN","classification":"A","division":"PRODUCTION","hit_factor":9.9404},{"match_name":"FMM USPSA","match_date":"2017-03-19","stage_classifiercode":"06-03","member_number":"A100063","first_name":"ROBBIE","last_name":"GLEATON","classification":"C","division":"PRODUCTION","hit_factor":9.9404},{"match_name":"AGC_20170205","match_date":"2017-02-05","stage_classifiercode":"06-03","member_number":"A93979","first_name":"ERIC","last_name":"BUTLER","classification":"C","division":"PRODUCTION","hit_factor":9.9391},{"match_name":"RCSC USPSA 26 June 16","match_date":"2016-06-26","stage_classifiercode":"06-03","member_number":"TY61627","first_name":"CHRIS","last_name":"GOURLEY","classification":"B","division":"PRODUCTION","hit_factor":9.9391},{"match_name":"NPCCC 04-01-2018 USPSA","match_date":"2018-04-01","stage_classifiercode":"06-03","member_number":"L3746","first_name":"MOHD","last_name":"ABUALSAYYED","classification":"A","division":"PRODUCTION","hit_factor":9.9379},{"match_name":"LdF USPSA Match May 13 2017","match_date":"2017-05-13","stage_classifiercode":"06-03","member_number":"A38618","first_name":"HENRY","last_name":"TORIBIO","classification":"M","division":"PRODUCTION","hit_factor":9.9379},{"match_name":"NISA April Classifer Match 2016","match_date":"2016-04-24","stage_classifiercode":"06-03","member_number":"A88494","first_name":"GEORGE","last_name":"DYSICO","classification":"C","division":"PRODUCTION","hit_factor":9.9305},{"match_name":"Pioneer Action Shooters APR 2016","match_date":"2016-04-24","stage_classifiercode":"06-03","member_number":"A93279","first_name":"JONAH","last_name":"COLDWELL","classification":"U","division":"PRODUCTION","hit_factor":9.9305},{"match_name":"The Irbil Open","match_date":"2017-05-14","stage_classifiercode":"06-03","member_number":"\"\"","first_name":"ROBERT","last_name":"PHIPPS","classification":"U","division":"PRODUCTION","hit_factor":9.9291},{"match_name":"CSA March 2016","match_date":"2016-03-13","stage_classifiercode":"06-03","member_number":"A87413","first_name":"JEFF","last_name":"ADKINS","classification":"C","division":"PRODUCTION","hit_factor":9.9291},{"match_name":"Schultz September 2018","match_date":"2018-09-09","stage_classifiercode":"06-03","member_number":"FY87841","first_name":"MATTHEW","last_name":"STRONG","classification":"C","division":"PRODUCTION","hit_factor":9.9291},{"match_name":"Homestead USPSA Match","match_date":"2016-09-17","stage_classifiercode":"06-03","member_number":"A1229","first_name":"JOSEPH","last_name":"HART","classification":"M","division":"PRODUCTION","hit_factor":9.9256},{"match_name":"LBAS151219","match_date":"2015-12-19","stage_classifiercode":"06-03","member_number":"PEN","first_name":"ALVIN","last_name":"RODGERS","classification":"U","division":"PRODUCTION","hit_factor":9.9228},{"match_name":"MAPSA 2016.04.09","match_date":"2016-04-09","stage_classifiercode":"06-03","member_number":"A86132","first_name":"DAN","last_name":"BOYLES","classification":"C","division":"PRODUCTION","hit_factor":9.9206},{"match_name":"BORCC USPSA July 2016","match_date":"2016-07-24","stage_classifiercode":"06-03","member_number":"TY61733","first_name":"KEITH","last_name":"HAFER","classification":"A","division":"PRODUCTION","hit_factor":9.9206},{"match_name":"MS06 Team Magnolia USPSA","match_date":"2017-03-05","stage_classifiercode":"06-03","member_number":"A77468","first_name":"PHILLIP","last_name":"PERKINS","classification":"D","division":"PRODUCTION","hit_factor":9.919},{"match_name":"CRGC USPSA Match 7-22-18","match_date":"2018-07-22","stage_classifiercode":"06-03","member_number":"A112285","first_name":"DAVID","last_name":"HRUBIEC","classification":"\"\"","division":"PRODUCTION","hit_factor":9.919},{"match_name":"NRG Saturday March 28th - Includes a Classifier Stage","match_date":"2020-03-28","stage_classifiercode":"06-03","member_number":"TY78877","first_name":"TOMMY","last_name":"HANDOJO","classification":"B","division":"PRODUCTION","hit_factor":9.9174},{"match_name":"Tropang Vegas All Classifier Match","match_date":"2021-07-11","stage_classifiercode":"06-03","member_number":"A45204","first_name":"RJ","last_name":"JANOLINO","classification":"Unclassified","division":"PRODUCTION","hit_factor":9.9108},{"match_name":"ACC July 26th USPSA","match_date":"2020-07-26","stage_classifiercode":"06-03","member_number":"TY80201","first_name":"TOM S","last_name":"RAPALA","classification":"A","division":"PRODUCTION","hit_factor":9.9108},{"match_name":"MCRC USPSA July 2018","match_date":"2018-07-14","stage_classifiercode":"06-03","member_number":"A59371","first_name":"THOMAS","last_name":"TROUTMAN","classification":"B","division":"PRODUCTION","hit_factor":9.9108},{"match_name":"KSA USPSA October 2021","match_date":"2021-10-02","stage_classifiercode":"06-03","member_number":"A105808","first_name":"BRENDAN","last_name":"GLICA","classification":"B","division":"PRODUCTION","hit_factor":9.9108},{"match_name":"Schultz September 2018","match_date":"2018-09-09","stage_classifiercode":"06-03","member_number":"A96799","first_name":"JEFF","last_name":"WEBER","classification":"D","division":"PRODUCTION","hit_factor":9.909},{"match_name":"KSA USPSA June 2017","match_date":"2017-06-03","stage_classifiercode":"06-03","member_number":"A101455","first_name":"JONATHAN","last_name":"GILBERT","classification":"U","division":"PRODUCTION","hit_factor":9.899},{"match_name":"MCPSL Pistol 4-8-17","match_date":"2017-04-08","stage_classifiercode":"06-03","member_number":"A94098","first_name":"PETE","last_name":"SCHLEICHER","classification":"U","division":"PRODUCTION","hit_factor":9.899},{"match_name":"Moss Branch USPSA September 22nd Match","match_date":"2018-09-22","stage_classifiercode":"06-03","member_number":"A100599","first_name":"JOSE","last_name":"RODRIGUEZ","classification":"C","division":"PRODUCTION","hit_factor":9.899},{"match_name":"BTSA USPSA 2020-5 Oct 11 2020","match_date":"2020-10-11","stage_classifiercode":"06-03","member_number":"F26576","first_name":"NICK","last_name":"DRAZENOVICH","classification":"D","division":"PRODUCTION","hit_factor":9.8912},{"match_name":"DWB - Deadwood Boys USPSA 15 July 2018","match_date":"2018-07-15","stage_classifiercode":"06-03","member_number":"A102027","first_name":"ANTONIO","last_name":"GONELLA","classification":"B","division":"PRODUCTION","hit_factor":9.8912},{"match_name":"FLPSA MN14 USPSA July 13 2017","match_date":"2017-07-13","stage_classifiercode":"06-03","member_number":"A97255","first_name":"DARIN","last_name":"MAGER","classification":"C","division":"PRODUCTION","hit_factor":9.889},{"match_name":"Uspsa Classifier","match_date":"2018-05-06","stage_classifiercode":"06-03","member_number":"F110760","first_name":"MICHAEL","last_name":"MITYUSHKIN","classification":"U","division":"PRODUCTION","hit_factor":9.889},{"match_name":"Magnolia Rifle and Pistol Club July classifier match","match_date":"2021-07-03","stage_classifiercode":"06-03","member_number":"TY110243","first_name":"SHAN","last_name":"SMITH","classification":"C","division":"PRODUCTION","hit_factor":9.889},{"match_name":"RBPS April Pistol Match","match_date":"2017-04-15","stage_classifiercode":"06-03","member_number":"\"\"","first_name":"SCOTT","last_name":"STEVENS","classification":"U","division":"PRODUCTION","hit_factor":9.889},{"match_name":"BORCC USPSA Classifier Match January 2017","match_date":"2017-01-22","stage_classifiercode":"06-03","member_number":"A95950","first_name":"MIKE","last_name":"SCHUTT","classification":"U","division":"PRODUCTION","hit_factor":9.8739},{"match_name":"Piscataqua  Master Blasters USPSA Special Classifier","match_date":"2017-12-03","stage_classifiercode":"06-03","member_number":"A96625","first_name":"DAVID","last_name":"MAHER","classification":"C","division":"PRODUCTION","hit_factor":9.8717},{"match_name":"2015 Ontelaunee Holiday Hosefest","match_date":"2015-12-26","stage_classifiercode":"06-03","member_number":"\"\"","first_name":"BENNETT","last_name":"BOYER","classification":"B","division":"PRODUCTION","hit_factor":9.8717},{"match_name":"SFPC October 7 2018 USPSA Match","match_date":"2018-10-07","stage_classifiercode":"06-03","member_number":"A96827","first_name":"VERNON","last_name":"JULIAN","classification":"C","division":"PRODUCTION","hit_factor":9.8691},{"match_name":"NOCPC Oct 2017","match_date":"2017-10-08","stage_classifiercode":"06-03","member_number":"L4176","first_name":"BRUCE","last_name":"SCHRADER","classification":"B","division":"PRODUCTION","hit_factor":9.8691},{"match_name":"EWPSA 2018-07","match_date":"2018-07-14","stage_classifiercode":"06-03","member_number":"A55355","first_name":"RANDY","last_name":"BAYUK","classification":"B","division":"PRODUCTION","hit_factor":9.8636},{"match_name":"DGC Jan Classifier","match_date":"2016-01-17","stage_classifiercode":"06-03","member_number":"\"\"","first_name":"RANDY","last_name":"GROB","classification":"U","division":"PRODUCTION","hit_factor":9.8619},{"match_name":"BORCC USPSA July 2016","match_date":"2016-07-24","stage_classifiercode":"06-03","member_number":"A95856","first_name":"DAVID","last_name":"HOEKSEMA","classification":"C","division":"PRODUCTION","hit_factor":9.8619},{"match_name":"Rio Salado UPPL June 2021","match_date":"2021-06-13","stage_classifiercode":"06-03","member_number":"L4342","first_name":"RICHARD","last_name":"MACE","classification":"B","division":"PRODUCTION","hit_factor":9.8619},{"match_name":"SAPSA January 2018","match_date":"2018-01-20","stage_classifiercode":"06-03","member_number":"A92232","first_name":"DARREN","last_name":"CRIBBS","classification":"B","division":"PRODUCTION","hit_factor":9.8619},{"match_name":"AREA 59  SPRING ALL CLASSIFIER","match_date":"2018-03-31","stage_classifiercode":"06-03","member_number":"A65453","first_name":"BOB","last_name":"ZELLER","classification":"C","division":"PRODUCTION","hit_factor":9.8619},{"match_name":"NHRPC - February 2020 USPSA","match_date":"2020-02-09","stage_classifiercode":"06-03","member_number":"A125748","first_name":"PETER","last_name":"GRAHAM","classification":"U","division":"PRODUCTION","hit_factor":9.8619},{"match_name":"Gem City Gun Club 1-20 And 1-21-18","match_date":"2018-01-21","stage_classifiercode":"06-03","member_number":"A44774","first_name":"SEAN","last_name":"MAHAN","classification":"U","division":"PRODUCTION","hit_factor":9.8619},{"match_name":"PSAC 20200705","match_date":"2020-07-05","stage_classifiercode":"06-03","member_number":"A85424","first_name":"RICHARD","last_name":"CLARE","classification":"M","division":"PRODUCTION","hit_factor":9.8592},{"match_name":"MISS Match 12-7-16","match_date":"2016-12-06","stage_classifiercode":"06-03","member_number":"TY75796","first_name":"JIM","last_name":"HAZEN","classification":"C","division":"PRODUCTION","hit_factor":9.8592},{"match_name":"WLPS USPSA August 2020","match_date":"2020-08-23","stage_classifiercode":"06-03","member_number":"A120025","first_name":"NICHOLAS","last_name":"GRADY","classification":"C","division":"PRODUCTION","hit_factor":9.8563},{"match_name":"ORSA USPSA July Match Dang Its Hot Out There","match_date":"2018-07-19","stage_classifiercode":"06-03","member_number":"A44959","first_name":"KYLE","last_name":"KIRSCHENMANN","classification":"A","division":"PRODUCTION","hit_factor":9.8544},{"match_name":"WLPS USPSA August 2020","match_date":"2020-08-23","stage_classifiercode":"06-03","member_number":"Ty74015","first_name":"MIKE","last_name":"TANGEMAN","classification":"C","division":"PRODUCTION","hit_factor":9.8532},{"match_name":"Blackstone Shooting Sports USPSA October 2016","match_date":"2016-10-11","stage_classifiercode":"06-03","member_number":"\"\"","first_name":"JOHN","last_name":"EERENBERG","classification":"U","division":"PRODUCTION","hit_factor":9.8522},{"match_name":"BHPC USPSA Monthly Match 6-14-2020","match_date":"2020-06-14","stage_classifiercode":"06-03","member_number":"Ty74015","first_name":"MIKE","last_name":"TANGEMAN","classification":"C","division":"PRODUCTION","hit_factor":9.8522},{"match_name":"WSRC USPSA 7/15/2017","match_date":"2017-07-15","stage_classifiercode":"06-03","member_number":"A94394","first_name":"PAUL","last_name":"STODGELL","classification":"C","division":"PRODUCTION","hit_factor":9.8462},{"match_name":"FLPSA MN14 USPSA July 13 2017","match_date":"2017-07-13","stage_classifiercode":"06-03","member_number":"TY96283","first_name":"NOAH","last_name":"LANDERS","classification":"U","division":"PRODUCTION","hit_factor":9.8425},{"match_name":"BRRC USPSA MAY 14 2016","match_date":"2016-05-14","stage_classifiercode":"06-03","member_number":"A91175","first_name":"JEFF","last_name":"LEMKE","classification":"U","division":"PRODUCTION","hit_factor":9.8425},{"match_name":"SMD USPSA at VIR November 2018","match_date":"2018-11-04","stage_classifiercode":"06-03","member_number":"A115031","first_name":"ERIN","last_name":"GARVIN","classification":"U","division":"PRODUCTION","hit_factor":9.8425},{"match_name":"ORGC Independance Day  2018 Pistol Match","match_date":"2018-07-01","stage_classifiercode":"06-03","member_number":"A110900","first_name":"ERIC","last_name":"TANCK","classification":"U","division":"PRODUCTION","hit_factor":9.8394},{"match_name":"FSA - USPSA  9","match_date":"2017-02-26","stage_classifiercode":"06-03","member_number":"A88889","first_name":"MARK","last_name":"TUMPACH","classification":"C","division":"PRODUCTION","hit_factor":9.8361},{"match_name":"Pioneer Action Shooters USPSA 5-27-18","match_date":"2018-05-27","stage_classifiercode":"06-03","member_number":"\"\"","first_name":"BRANDON","last_name":"RIBEIRO","classification":"U","division":"PRODUCTION","hit_factor":9.8361},{"match_name":"GMPS 7/16/17","match_date":"2017-07-16","stage_classifiercode":"06-03","member_number":"A33626","first_name":"ED","last_name":"BOADWAY","classification":"B","division":"PRODUCTION","hit_factor":9.8361},{"match_name":"WSRC USPSA 7/15/2017","match_date":"2017-07-15","stage_classifiercode":"06-03","member_number":"A86039","first_name":"MICHAEL","last_name":"SIMONS","classification":"C","division":"PRODUCTION","hit_factor":9.8328},{"match_name":"BTSA USPSA 2016-8","match_date":"2016-08-28","stage_classifiercode":"06-03","member_number":"F97983","first_name":"ROJIN","last_name":"ALTARES","classification":"Unclassified","division":"PRODUCTION","hit_factor":9.8328},{"match_name":"SEPSA April 2017","match_date":"2017-04-08","stage_classifiercode":"06-03","member_number":"TY55534","first_name":"DANNY","last_name":"PUGHSLEY","classification":"M","division":"PRODUCTION","hit_factor":9.8328},{"match_name":"WELD ECO09 20181021","match_date":"2018-10-21","stage_classifiercode":"06-03","member_number":"A102443","first_name":"JASON","last_name":"STRECK","classification":"U","division":"PRODUCTION","hit_factor":9.8328},{"match_name":"Benton Gun Club-USPSA January 28 2018","match_date":"2018-01-28","stage_classifiercode":"06-03","member_number":"A96080","first_name":"JAMES","last_name":"GREGORY","classification":"B","division":"PRODUCTION","hit_factor":9.8326},{"match_name":"USPSA-AB 2018-15 at Brooks Pistol Club - adhoc","match_date":"2018-09-09","stage_classifiercode":"06-03","member_number":"F114074","first_name":"EVELINA","last_name":"MANNARINO","classification":"U","division":"PRODUCTION","hit_factor":9.8295},{"match_name":"MCPSL Pistol 4-8-17","match_date":"2017-04-08","stage_classifiercode":"06-03","member_number":"A96264","first_name":"THOMAS","last_name":"HEILMAN","classification":"D","division":"PRODUCTION","hit_factor":9.8295},{"match_name":"BRC_20170409","match_date":"2017-04-09","stage_classifiercode":"06-03","member_number":"PEN","first_name":"DAVE","last_name":"EAST","classification":"U","division":"PRODUCTION","hit_factor":9.8295},{"match_name":"EAPS July 2017 USPSA","match_date":"2017-07-16","stage_classifiercode":"06-03","member_number":"A99446","first_name":"STEVE","last_name":"RICHARDSON","classification":"U","division":"PRODUCTION","hit_factor":9.8295},{"match_name":"BORCC USPSA Classifier Match January 2017","match_date":"2017-01-22","stage_classifiercode":"06-03","member_number":"A76095","first_name":"JEFF","last_name":"SLUSSER","classification":"B","division":"PRODUCTION","hit_factor":9.826},{"match_name":"Coyote Tuesday USPSA match 6-6-17 Classifier Match","match_date":"2017-06-07","stage_classifiercode":"06-03","member_number":"TY16138","first_name":"CARLOS","last_name":"GUZMAN","classification":"A","division":"PRODUCTION","hit_factor":9.826},{"match_name":"MASTER BLASTERS & SSFGA USPSA - September","match_date":"2020-09-19","stage_classifiercode":"06-03","member_number":"TY101923","first_name":"CHRISTINA","last_name":"BAKER","classification":"C","division":"PRODUCTION","hit_factor":9.8224},{"match_name":"Richmond  Boro Gun Club December 2017 USPSA Pistol Match","match_date":"2017-12-02","stage_classifiercode":"06-03","member_number":"A106880","first_name":"ADAM","last_name":"MCNAB","classification":"\"\"","division":"PRODUCTION","hit_factor":9.8224},{"match_name":"Idaho ISPS April 7th 2018","match_date":"2018-04-07","stage_classifiercode":"06-03","member_number":"A41179","first_name":"DUTCH","last_name":"BROGOITTI","classification":"B","division":"PRODUCTION","hit_factor":9.8224},{"match_name":"Nampa USPSA March 7th","match_date":"2020-03-07","stage_classifiercode":"06-03","member_number":"TY116605","first_name":"CARL","last_name":"OLSON","classification":"B","division":"PRODUCTION","hit_factor":9.8196},{"match_name":"Rankin Field Sunday USPSA","match_date":"2017-11-19","stage_classifiercode":"06-03","member_number":"A88899","first_name":"SCOTT","last_name":"MCDOWELL","classification":"B","division":"PRODUCTION","hit_factor":9.8135},{"match_name":"Square Deal Sportsmen November USPSA Match 2021","match_date":"2021-11-07","stage_classifiercode":"06-03","member_number":"A120532","first_name":"MATTHEW","last_name":"HOGUE","classification":"B","division":"PRODUCTION","hit_factor":9.8135},{"match_name":"NPCCC 04-01-2018 USPSA","match_date":"2018-04-01","stage_classifiercode":"06-03","member_number":"A83864","first_name":"TILL","last_name":"GROB","classification":"B","division":"PRODUCTION","hit_factor":9.8098},{"match_name":"PCPS Classifier and Slot Match Jan 2020","match_date":"2020-01-12","stage_classifiercode":"06-03","member_number":"A106211","first_name":"JOHN","last_name":"SLATER","classification":"B","division":"PRODUCTION","hit_factor":9.8098},{"match_name":"ANPRACS USPSA 7-15-18","match_date":"2018-07-15","stage_classifiercode":"06-03","member_number":"A100319","first_name":"TIM","last_name":"LEZAMA","classification":"C","division":"PRODUCTION","hit_factor":9.8081},{"match_name":"Crooked Creek Pistol League - October 2020","match_date":"2020-10-17","stage_classifiercode":"06-03","member_number":"A77829","first_name":"JOHN","last_name":"ELLIS","classification":"C","division":"PRODUCTION","hit_factor":9.8059},{"match_name":"LCSC Classifier 042918","match_date":"2018-04-28","stage_classifiercode":"06-03","member_number":"A106815","first_name":"DAVID","last_name":"LIU","classification":"D","division":"PRODUCTION","hit_factor":9.8039},{"match_name":"PSGC   IPSC November","match_date":"2016-11-27","stage_classifiercode":"06-03","member_number":"A84453","first_name":"WES","last_name":"STROTHERS","classification":"C","division":"PRODUCTION","hit_factor":9.8039},{"match_name":"MCTS -  USPSA March 2021 Classifier Match","match_date":"2021-03-21","stage_classifiercode":"06-03","member_number":"A130704","first_name":"MATT","last_name":"RUOTSI","classification":"U","division":"PRODUCTION","hit_factor":9.8039},{"match_name":"Southkent USPSA June match","match_date":"2017-06-17","stage_classifiercode":"06-03","member_number":"\"\"","first_name":"JAKE","last_name":"GOOSSEN","classification":"U","division":"PRODUCTION","hit_factor":9.8039},{"match_name":"LCSC Classifier 042918","match_date":"2018-04-28","stage_classifiercode":"06-03","member_number":"TY84142","first_name":"CHRISTINE","last_name":"ZADOR","classification":"U","division":"PRODUCTION","hit_factor":9.7977},{"match_name":"ORSA USPSA May 2018","match_date":"2018-05-19","stage_classifiercode":"06-03","member_number":"A72343","first_name":"PAUL","last_name":"AVERY","classification":"B","division":"PRODUCTION","hit_factor":9.7959},{"match_name":"Springfield Tactical Shooters 04-07-2016","match_date":"2016-04-07","stage_classifiercode":"06-03","member_number":"FY59095","first_name":"SHELBY","last_name":"STOCKTON","classification":"M","division":"PRODUCTION","hit_factor":9.7959},{"match_name":"Veterans 3 Gun PM Classifier Benefit Match","match_date":"2020-02-22","stage_classifiercode":"06-03","member_number":"F121764","first_name":"HONGLI","last_name":"QUAN","classification":"U","division":"PRODUCTION","hit_factor":9.7943},{"match_name":"BORCC USPSA July 2016","match_date":"2016-07-24","stage_classifiercode":"06-03","member_number":"A81794","first_name":"ED","last_name":"VERVILLE","classification":"C","division":"PRODUCTION","hit_factor":9.7943},{"match_name":"March 2017 PCSI USPSA","match_date":"2017-03-04","stage_classifiercode":"06-03","member_number":"\"\"","first_name":"JASON","last_name":"CONRAD","classification":"B","division":"PRODUCTION","hit_factor":9.7943},{"match_name":"Pioneer Action Shooters May 2017","match_date":"2017-05-28","stage_classifiercode":"06-03","member_number":"A87902","first_name":"PATRICK","last_name":"VITALE","classification":"C","division":"PRODUCTION","hit_factor":9.7943},{"match_name":"SAPS USPSA May 2017","match_date":"2017-05-20","stage_classifiercode":"06-03","member_number":"A73718","first_name":"ROBERT","last_name":"HARDY","classification":"C","division":"PRODUCTION","hit_factor":9.7943},{"match_name":"Space Coast March 2021","match_date":"2021-03-06","stage_classifiercode":"06-03","member_number":"a88251","first_name":"LINDA","last_name":"HILTON","classification":"A","division":"PRODUCTION","hit_factor":9.7859},{"match_name":"NW01 Tuesday Sectional","match_date":"2017-08-01","stage_classifiercode":"06-03","member_number":"a102641","first_name":"RYAN","last_name":"SCHWARZ","classification":"C","division":"PRODUCTION","hit_factor":9.7847},{"match_name":"BRC_20180311","match_date":"2018-03-11","stage_classifiercode":"06-03","member_number":"L3812","first_name":"STEVEN","last_name":"LICHON","classification":"B","division":"PRODUCTION","hit_factor":9.7847},{"match_name":"ESPS USPSA OCT","match_date":"2016-10-22","stage_classifiercode":"06-03","member_number":"A88050","first_name":"PATRICK","last_name":"MCKERNAN","classification":"B","division":"PRODUCTION","hit_factor":9.7847},{"match_name":"Devil Dog USPSA Classifier Match-Saturday Session","match_date":"2018-03-10","stage_classifiercode":"06-03","member_number":"A105217","first_name":"JAMIE","last_name":"WELLS","classification":"U","division":"PRODUCTION","hit_factor":9.7847},{"match_name":"Grandbaggers September 2018","match_date":"2018-09-06","stage_classifiercode":"06-03","member_number":"TY85346","first_name":"DAVID","last_name":"BAKER","classification":"B","division":"PRODUCTION","hit_factor":9.7804},{"match_name":"RCSC USPSA 26 June 16","match_date":"2016-06-26","stage_classifiercode":"06-03","member_number":"TY71873","first_name":"JASON","last_name":"MIWA","classification":"A","division":"PRODUCTION","hit_factor":9.7768},{"match_name":"BLUE RIDGE ARSENAL July 6 Classifier Match","match_date":"2018-07-06","stage_classifiercode":"06-03","member_number":"A89090","first_name":"BOBBY","last_name":"YI","classification":"C","division":"PRODUCTION","hit_factor":9.7752},{"match_name":"LCSA USPSA September 2017","match_date":"2017-09-02","stage_classifiercode":"06-03","member_number":"ty72627","first_name":"JOE","last_name":"PERRI","classification":"B","division":"PRODUCTION","hit_factor":9.7752},{"match_name":"Spsa Uspsa  1st Sat","match_date":"2016-01-02","stage_classifiercode":"06-03","member_number":"TY85974","first_name":"JAMES","last_name":"BASCIO","classification":"B","division":"PRODUCTION","hit_factor":9.772},{"match_name":"NOCPC Oct 2017","match_date":"2017-10-08","stage_classifiercode":"06-03","member_number":"A89013","first_name":"ALEX","last_name":"STARK","classification":"C","division":"PRODUCTION","hit_factor":9.7713},{"match_name":"TCGC Polo August 2017","match_date":"2017-08-20","stage_classifiercode":"06-03","member_number":"TY94870","first_name":"BILL","last_name":"HOWARD","classification":"C","division":"PRODUCTION","hit_factor":9.7707},{"match_name":"ASC USPSA Apr. 18","match_date":"2021-04-18","stage_classifiercode":"06-03","member_number":"L4345","first_name":"JOE","last_name":"SANCHEZ","classification":"B","division":"PRODUCTION","hit_factor":9.7707},{"match_name":"STAGE ZERO USPSA JUNE","match_date":"2021-06-10","stage_classifiercode":"06-03","member_number":"A131597","first_name":"EVAN","last_name":"SINGLETON","classification":"U","division":"PRODUCTION","hit_factor":9.7707},{"match_name":"EAGC September 2016 USPSA Pistol Match","match_date":"2016-09-18","stage_classifiercode":"06-03","member_number":"A96831","first_name":"DAVID","last_name":"OLGUIN","classification":"U","division":"PRODUCTION","hit_factor":9.7669},{"match_name":"ORSA USPSA April 2016","match_date":"2016-04-16","stage_classifiercode":"06-03","member_number":"PEN","first_name":"BRENT","last_name":"FRENCH","classification":"U","division":"PRODUCTION","hit_factor":9.766},{"match_name":"EDPS USPSA November 7","match_date":"2020-11-07","stage_classifiercode":"06-03","member_number":"TY-97744","first_name":"SHAWN","last_name":"WARING","classification":"C","division":"PRODUCTION","hit_factor":9.7656},{"match_name":"Springfield Tactical Shooters 04-07-2016","match_date":"2016-04-07","stage_classifiercode":"06-03","member_number":"A92047","first_name":"KYLE","last_name":"SPENCER","classification":"B","division":"PRODUCTION","hit_factor":9.761},{"match_name":"EWPSA 2021-01","match_date":"2021-01-17","stage_classifiercode":"06-03","member_number":"A55355","first_name":"RANDALL","last_name":"BAYUK","classification":"B","division":"PRODUCTION","hit_factor":9.7561},{"match_name":"APSC USPSA 7-7-2018","match_date":"2018-07-07","stage_classifiercode":"06-03","member_number":"A111460","first_name":"BENJAMIN","last_name":"COLLINS","classification":"U","division":"PRODUCTION","hit_factor":9.7561},{"match_name":"Homestead USPSA Match","match_date":"2016-09-17","stage_classifiercode":"06-03","member_number":"\"\"","first_name":"DAVID","last_name":"MURPHY","classification":"U","division":"PRODUCTION","hit_factor":9.7561},{"match_name":"MISS Match 1/3/18","match_date":"2018-01-03","stage_classifiercode":"06-03","member_number":"L4109","first_name":"MATT","last_name":"LITTLE","classification":"M","division":"PRODUCTION","hit_factor":9.7561},{"match_name":"MCTS - USPSA July 2020 #2","match_date":"2020-07-25","stage_classifiercode":"06-03","member_number":"A128441","first_name":"JOSHUA","last_name":"REECE","classification":"U","division":"PRODUCTION","hit_factor":9.7561},{"match_name":"MCAS USPSA October 2016","match_date":"2016-10-15","stage_classifiercode":"06-03","member_number":"A73685","first_name":"JASON","last_name":"ANDERSEN","classification":"C","division":"PRODUCTION","hit_factor":9.7512},{"match_name":"Richmond Hot Shots October 17-18-2020 USPSA Pistol","match_date":"2020-10-17","stage_classifiercode":"06-03","member_number":"a107109","first_name":"CHRISTOPHER","last_name":"DASILVA","classification":"B","division":"PRODUCTION","hit_factor":9.7477},{"match_name":"Eastern Iowa  Practical Shooters","match_date":"2016-10-20","stage_classifiercode":"06-03","member_number":"TY74015","first_name":"MIKE","last_name":"TANGEMAN","classification":"C","division":"PRODUCTION","hit_factor":9.7466},{"match_name":"Spsa Uspsa  1st Sat","match_date":"2016-01-02","stage_classifiercode":"06-03","member_number":"A80548","first_name":"DAN","last_name":"DOIRON","classification":"C","division":"PRODUCTION","hit_factor":9.7466},{"match_name":"GCL Wed 9-30-20","match_date":"2020-09-30","stage_classifiercode":"06-03","member_number":"A109844","first_name":"DANIEL","last_name":"CIGNARALE","classification":"U","division":"PRODUCTION","hit_factor":9.7466},{"match_name":"WNYPPL August 2017 Classifier Match","match_date":"2017-08-27","stage_classifiercode":"06-03","member_number":"A97749","first_name":"JOSEPH","last_name":"MUSCARELLA","classification":"C","division":"PRODUCTION","hit_factor":9.7466},{"match_name":"AGC_20170205","match_date":"2017-02-05","stage_classifiercode":"06-03","member_number":"A94957","first_name":"ADAM","last_name":"CONSALVO","classification":"C","division":"PRODUCTION","hit_factor":9.7462},{"match_name":"SSFGA & Master Blasters USPSA Classifier","match_date":"2018-11-17","stage_classifiercode":"06-03","member_number":"A113124","first_name":"DANIEL","last_name":"ALLEN","classification":"U","division":"PRODUCTION","hit_factor":9.7462},{"match_name":"AGC_20170205","match_date":"2017-02-05","stage_classifiercode":"06-03","member_number":"A85935","first_name":"PATRICK D","last_name":"WOLLAM","classification":"B","division":"PRODUCTION","hit_factor":9.7416},{"match_name":"Dawg Valley USPSA Sept 8 2018","match_date":"2018-09-08","stage_classifiercode":"06-03","member_number":"A112450","first_name":"DOUGLAS","last_name":"HOFF","classification":"C","division":"PRODUCTION","hit_factor":9.7416},{"match_name":"Pathfinder July USPSA Match","match_date":"2018-07-15","stage_classifiercode":"06-03","member_number":"FY23055","first_name":"DOUG","last_name":"HAGUE","classification":"none","division":"PRODUCTION","hit_factor":9.7416},{"match_name":"Veterans 3 Gun AM Classifier Benefit Match","match_date":"2020-02-22","stage_classifiercode":"06-03","member_number":"TY106753","first_name":"JC","last_name":"SCHUMACHER","classification":"C","division":"PRODUCTION","hit_factor":9.7416},{"match_name":"PPS USPSA 2018-09-22","match_date":"2018-09-22","stage_classifiercode":"06-03","member_number":"A94862","first_name":"TROY","last_name":"CHAMBERLAIN","classification":"C","division":"PRODUCTION","hit_factor":9.7416},{"match_name":"PSGC   IPSC November","match_date":"2016-11-27","stage_classifiercode":"06-03","member_number":"\"\"","first_name":"CARY","last_name":"MILLER","classification":"U","division":"PRODUCTION","hit_factor":9.7371},{"match_name":"Pima Pistol Club USPSA September 12th USE THIS ONE","match_date":"2021-09-12","stage_classifiercode":"06-03","member_number":"L4499","first_name":"BOB","last_name":"ZELLER","classification":"B","division":"PRODUCTION","hit_factor":9.7371},{"match_name":"Pioneer Action Shooters APR 2016","match_date":"2016-04-24","stage_classifiercode":"06-03","member_number":"FY48411","first_name":"JAMES","last_name":"DAVIS","classification":"B","division":"PRODUCTION","hit_factor":9.7371},{"match_name":"Richmond Hot Shots April 15-16-2017 USPSA Pistol Match","match_date":"2017-04-15","stage_classifiercode":"06-03","member_number":"A93243","first_name":"TONY","last_name":"LUONG","classification":"C","division":"PRODUCTION","hit_factor":9.7363},{"match_name":"Blue Ridge Arsenal Nov 8 All Classifier match","match_date":"2018-11-08","stage_classifiercode":"06-03","member_number":"A109392","first_name":"SCOTT","last_name":"HINES","classification":"D","division":"PRODUCTION","hit_factor":9.7319},{"match_name":"LdF USPSA Classifier Match December 12 2020","match_date":"2020-12-12","stage_classifiercode":"06-03","member_number":"L4587","first_name":"STEPHANIE","last_name":"NGUYEN-LIEU","classification":"C","division":"PRODUCTION","hit_factor":9.7319},{"match_name":"Richmond Hot Shots October 17-18-2020 USPSA Pistol","match_date":"2020-10-17","stage_classifiercode":"06-03","member_number":"Ty94860","first_name":"ROBERT","last_name":"JAHN","classification":"C","division":"PRODUCTION","hit_factor":9.7319},{"match_name":"GRPC USPSA DOG DAYS OF SUMMER","match_date":"2017-08-06","stage_classifiercode":"06-03","member_number":"TY100679","first_name":"JACOB","last_name":"ROBBINS","classification":"U","division":"PRODUCTION","hit_factor":9.7276},{"match_name":"Chillicothe April-2018 USPSA Classifier Match","match_date":"2018-04-28","stage_classifiercode":"06-03","member_number":"A105910","first_name":"JEFF","last_name":"HOECKER","classification":"U","division":"PRODUCTION","hit_factor":9.7276},{"match_name":"DRRC  Mar2017","match_date":"2017-03-04","stage_classifiercode":"06-03","member_number":"TY99479","first_name":"MICHAEL","last_name":"HAVLIK","classification":"U","division":"PRODUCTION","hit_factor":9.7264},{"match_name":"NISA April Classifer Match 2016","match_date":"2016-04-24","stage_classifiercode":"06-03","member_number":"Ty73221","first_name":"JAY","last_name":"HOLLINGSWORTH","classification":"B","division":"PRODUCTION","hit_factor":9.7264},{"match_name":"WSPS AUGUST 2017 USPSA MATCH","match_date":"2017-08-16","stage_classifiercode":"06-03","member_number":"A99697","first_name":"ROBERT","last_name":"HOMAN","classification":"U","division":"PRODUCTION","hit_factor":9.7252},{"match_name":"NCPS USPSA Handgun Match November 29 2015","match_date":"2015-11-29","stage_classifiercode":"06-03","member_number":"TY17315","first_name":"RON","last_name":"NAKABAYASHI","classification":"B","division":"PRODUCTION","hit_factor":9.7222},{"match_name":"AREA 59  SPRING ALL CLASSIFIER","match_date":"2018-03-31","stage_classifiercode":"06-03","member_number":"A76683","first_name":"CALVIN","last_name":"TRUONG","classification":"C","division":"PRODUCTION","hit_factor":9.7222},{"match_name":"Devil Dog USPSA Classifier Match-Saturday Session","match_date":"2018-03-10","stage_classifiercode":"06-03","member_number":"A98772","first_name":"JUSTIN","last_name":"KRAFT","classification":"B","division":"PRODUCTION","hit_factor":9.7187},{"match_name":"RSPP 3rd Saturday September 2016","match_date":"2016-09-17","stage_classifiercode":"06-03","member_number":"TY60458","first_name":"JOHN","last_name":"CATALANO","classification":"B","division":"PRODUCTION","hit_factor":9.7182},{"match_name":"Pioneer Action Shooters May 2017","match_date":"2017-05-28","stage_classifiercode":"06-03","member_number":"A97260","first_name":"THOMAS","last_name":"BAGROWSKI","classification":"C","division":"PRODUCTION","hit_factor":9.7182},{"match_name":"Mssa Uspsa 05-28-17","match_date":"2017-05-28","stage_classifiercode":"06-03","member_number":"A97863","first_name":"WES","last_name":"CARROLL 2","classification":"C","division":"PRODUCTION","hit_factor":9.7166},{"match_name":"Homestead USPSA Match","match_date":"2016-09-17","stage_classifiercode":"06-03","member_number":"\"\"","first_name":"PEDRO","last_name":"LOZANO","classification":"U","division":"PRODUCTION","hit_factor":9.7126},{"match_name":"Grandbaggers September 2018","match_date":"2018-09-06","stage_classifiercode":"06-03","member_number":"A108151","first_name":"ROBERT","last_name":"LANGE","classification":"C","division":"PRODUCTION","hit_factor":9.7126},{"match_name":"Richmond October 17-18-2015","match_date":"2015-10-17","stage_classifiercode":"06-03","member_number":"A87259","first_name":"YEE-MIN","last_name":"LIN","classification":"C","division":"PRODUCTION","hit_factor":9.7107},{"match_name":"NW01 Tuesday Sectional","match_date":"2017-08-01","stage_classifiercode":"06-03","member_number":"\"\"","first_name":"JONATHAN","last_name":"WALLE","classification":"U","division":"PRODUCTION","hit_factor":9.7087},{"match_name":"COPS May 2017 USPSA Match","match_date":"2017-05-07","stage_classifiercode":"06-03","member_number":"A101290","first_name":"AUSTIN","last_name":"RIST","classification":"U","division":"PRODUCTION","hit_factor":9.7087},{"match_name":"Devil Dog USPSA Classifier Match-Saturday Session","match_date":"2018-03-10","stage_classifiercode":"06-03","member_number":"TY91883","first_name":"DAREN","last_name":"MARCEAU","classification":"C","division":"PRODUCTION","hit_factor":9.7087},{"match_name":"AIPS Weekly USPSA 29 June 2021","match_date":"2021-06-29","stage_classifiercode":"06-03","member_number":"A113146","first_name":"BRANDON","last_name":"KOWALSKY","classification":"Unclassified","division":"PRODUCTION","hit_factor":9.7046},{"match_name":"FAS Sunday Outdoor USPSA Match","match_date":"2021-06-20","stage_classifiercode":"06-03","member_number":"TY128938","first_name":"MIKE","last_name":"SANDERS","classification":"C","division":"PRODUCTION","hit_factor":9.703},{"match_name":"CRGC USPSA Match 04-18-21","match_date":"2021-04-18","stage_classifiercode":"06-03","member_number":"A130634","first_name":"KEVIN","last_name":"LEDOUX","classification":"U","division":"PRODUCTION","hit_factor":9.703},{"match_name":"WNYPPL August 2017 Classifier Match","match_date":"2017-08-27","stage_classifiercode":"06-03","member_number":"A97749","first_name":"JOSEPH","last_name":"MUSCARELLA","classification":"C","division":"PRODUCTION","hit_factor":9.703},{"match_name":"Pioneer Action Shooters USPSA 5-27-18","match_date":"2018-05-27","stage_classifiercode":"06-03","member_number":"A111472","first_name":"DAVE","last_name":"MAXWELL","classification":"U","division":"PRODUCTION","hit_factor":9.703},{"match_name":"NOCPC Oct 2017","match_date":"2017-10-08","stage_classifiercode":"06-03","member_number":"\"\"","first_name":"LEE","last_name":"MCKINNEY","classification":"U","division":"PRODUCTION","hit_factor":9.703},{"match_name":"BSTRC Jun 21 2017","match_date":"2017-06-21","stage_classifiercode":"06-03","member_number":"TY92911","first_name":"JOHN","last_name":"COOREMAN","classification":"C","division":"PRODUCTION","hit_factor":9.6993},{"match_name":"Devil Dog USPSA Classifier Match-Saturday Session","match_date":"2018-03-10","stage_classifiercode":"06-03","member_number":"104699","first_name":"TRAVIS","last_name":"KERR","classification":"U","division":"PRODUCTION","hit_factor":9.6993},{"match_name":"LCSA USPSA AUGUST 2018","match_date":"2018-08-12","stage_classifiercode":"06-03","member_number":"TY72728","first_name":"KIRK","last_name":"SWEGER","classification":"B","division":"PRODUCTION","hit_factor":9.6983},{"match_name":"FSA - USPSA  9","match_date":"2017-02-26","stage_classifiercode":"06-03","member_number":"A87778","first_name":"WILLIAM","last_name":"HATFIELD","classification":"C","division":"PRODUCTION","hit_factor":9.6934},{"match_name":"Custer March Classifier Match","match_date":"2018-03-04","stage_classifiercode":"06-03","member_number":"A108184","first_name":"SUNG","last_name":"HONG","classification":"U","division":"PRODUCTION","hit_factor":9.6934},{"match_name":"Tidewater Practical Shooter October 12th Uspsa Match","match_date":"2020-10-12","stage_classifiercode":"06-03","member_number":"A128609","first_name":"ZACHARY","last_name":"CARTWRIGHT","classification":"D","division":"PRODUCTION","hit_factor":9.6899},{"match_name":"\"","match_date":"2018-08-11","stage_classifiercode":"06-03","member_number":"A113524","first_name":"ERIC","last_name":"FLYNN","classification":"U","division":"PRODUCTION","hit_factor":9.6872},{"match_name":"Nampa USPSA March 7th","match_date":"2020-03-07","stage_classifiercode":"06-03","member_number":"a85736","first_name":"DON","last_name":"CROW","classification":"B","division":"PRODUCTION","hit_factor":9.6807},{"match_name":"MAPSA 2016.04.09","match_date":"2016-04-09","stage_classifiercode":"06-03","member_number":"A92403","first_name":"BRIAN","last_name":"FABIAN","classification":"U","division":"PRODUCTION","hit_factor":9.6805},{"match_name":"Salt City practical shooting league 'all classifier match'","match_date":"2020-08-30","stage_classifiercode":"06-03","member_number":"A128171","first_name":"DON","last_name":"SMITH","classification":"U","division":"PRODUCTION","hit_factor":9.6805},{"match_name":"ALL CLASSIFIER SUMMERSLAM  -  AREA 59 2018","match_date":"2018-06-30","stage_classifiercode":"06-03","member_number":"L2998","first_name":"GARY","last_name":"WU","classification":"B","division":"PRODUCTION","hit_factor":9.6805},{"match_name":"MPSA 030516","match_date":"2016-03-05","stage_classifiercode":"06-03","member_number":"A46987","first_name":"PAUL","last_name":"JACCOD","classification":"B","division":"PRODUCTION","hit_factor":9.6774},{"match_name":"PTPC June 4th USPSA Match","match_date":"2017-06-04","stage_classifiercode":"06-03","member_number":"TY94467","first_name":"KEITH","last_name":"KRAUSE","classification":"C","division":"PRODUCTION","hit_factor":9.6774},{"match_name":"Piscataqua Master Blasters USPSA","match_date":"2018-09-02","stage_classifiercode":"06-03","member_number":"A112285","first_name":"DAVID","last_name":"HRUBIEC","classification":"C","division":"PRODUCTION","hit_factor":9.6774},{"match_name":"Gem City Gun Club 7-3 and 7-4","match_date":"2021-07-03","stage_classifiercode":"06-03","member_number":"TY129602","first_name":"JOHN","last_name":"KELLY","classification":"C","division":"PRODUCTION","hit_factor":9.6742},{"match_name":"SAPSC Monthly USPSA Classifier Match 20160112","match_date":"2016-01-12","stage_classifiercode":"06-03","member_number":"A90166","first_name":"JACK","last_name":"LARSH","classification":"U","division":"PRODUCTION","hit_factor":9.6742},{"match_name":"Armory Indoor League","match_date":"2017-04-13","stage_classifiercode":"06-03","member_number":"A101443","first_name":"JASON","last_name":"JOHNSON","classification":"U","division":"PRODUCTION","hit_factor":9.6742},{"match_name":"BTSA USPSA 2021-7 Aug 7 part two","match_date":"2021-08-07","stage_classifiercode":"06-03","member_number":"TYF128866","first_name":"LAURA","last_name":"SEITZ","classification":"C","division":"PRODUCTION","hit_factor":9.6742},{"match_name":"LPRGC - Lower Providence USPSA October 2016","match_date":"2016-10-01","stage_classifiercode":"06-03","member_number":"A81859","first_name":"JEFF","last_name":"BISSONETTE","classification":"B","division":"PRODUCTION","hit_factor":9.6677},{"match_name":"AGC_20170205","match_date":"2017-02-05","stage_classifiercode":"06-03","member_number":"A98694","first_name":"DEREK","last_name":"PERRAULT","classification":"D","division":"PRODUCTION","hit_factor":9.667},{"match_name":"EAPS July 2017 USPSA","match_date":"2017-07-16","stage_classifiercode":"06-03","member_number":"A104555","first_name":"ALVIN","last_name":"SMITH III","classification":"U","division":"PRODUCTION","hit_factor":9.6647},{"match_name":"NPCCC 9-4-16 USPSA","match_date":"2016-09-04","stage_classifiercode":"06-03","member_number":"A82857","first_name":"CHRIS","last_name":"SEAVER","classification":"C","division":"PRODUCTION","hit_factor":9.6647},{"match_name":"BPSA April 2017 USPSA","match_date":"2017-04-23","stage_classifiercode":"06-03","member_number":"A93267","first_name":"HARRY","last_name":"WILLIAMS","classification":"C","division":"PRODUCTION","hit_factor":9.6647},{"match_name":"Southern Maryland Practical Shooters 14 October 2018 USPSA","match_date":"2018-10-14","stage_classifiercode":"06-03","member_number":"L4049","first_name":"CHRISTIAN VET","last_name":"VIVERETTE","classification":"B","division":"PRODUCTION","hit_factor":9.6618},{"match_name":"PSAC 20180922","match_date":"2018-09-22","stage_classifiercode":"06-03","member_number":"TY112573","first_name":"TODD","last_name":"MORI (REENTRY)","classification":"U","division":"PRODUCTION","hit_factor":9.6618},{"match_name":"ORGC Independance Day  2018 Pistol Match","match_date":"2018-07-01","stage_classifiercode":"06-03","member_number":"TY72717","first_name":"THOMAS","last_name":"SCOTT","classification":"B","division":"PRODUCTION","hit_factor":9.6579},{"match_name":"Jan 14 Classifier Match","match_date":"2018-01-14","stage_classifiercode":"06-03","member_number":"A107734","first_name":"TRISTAN","last_name":"COLONNA","classification":"\"\"","division":"PRODUCTION","hit_factor":9.6579},{"match_name":"Lafayette Practical Shooters - Apr 4","match_date":"2018-04-04","stage_classifiercode":"06-03","member_number":"A109825","first_name":"ROBERT","last_name":"SANDOZ","classification":"U","division":"PRODUCTION","hit_factor":9.6525},{"match_name":"BSTRC Jun 21 2017","match_date":"2017-06-21","stage_classifiercode":"06-03","member_number":"A94734","first_name":"NICHOLAS","last_name":"PARKER","classification":"C","division":"PRODUCTION","hit_factor":9.6525},{"match_name":"Pioneer Action Shooters May 2017","match_date":"2017-05-28","stage_classifiercode":"06-03","member_number":"TY91507","first_name":"LISA","last_name":"VANBIENE","classification":"D","division":"PRODUCTION","hit_factor":9.6525},{"match_name":"Gem City Gun Club 1-20 And 1-21-18","match_date":"2018-01-21","stage_classifiercode":"06-03","member_number":"A74501","first_name":"BERNIE","last_name":"CAGE","classification":"C","division":"PRODUCTION","hit_factor":9.6525},{"match_name":"Shoot GTR Monthly Match September","match_date":"2017-09-02","stage_classifiercode":"06-03","member_number":"A104639","first_name":"LEM","last_name":"CAPILI","classification":"\"\"","division":"PRODUCTION","hit_factor":9.6525},{"match_name":"Range E11even March 2017","match_date":"2017-03-25","stage_classifiercode":"06-03","member_number":"A96541","first_name":"TRAVIS","last_name":"BEAL","classification":"B","division":"PRODUCTION","hit_factor":9.6521},{"match_name":"Kabul 25 May 2018","match_date":"2018-05-25","stage_classifiercode":"06-03","member_number":"\"\"","first_name":"JESSE","last_name":"MCDONALD","classification":"U","division":"PRODUCTION","hit_factor":9.6457},{"match_name":"Space Coast Practical Shooters","match_date":"2017-12-02","stage_classifiercode":"06-03","member_number":"\"\"","first_name":"TOURE'","last_name":"RANDOLPH","classification":"U","division":"PRODUCTION","hit_factor":9.6432},{"match_name":"WPS USPSA Special Classifier October 2017","match_date":"2017-10-28","stage_classifiercode":"06-03","member_number":"TY81485","first_name":"RICH","last_name":"VIZZINI","classification":"B","division":"PRODUCTION","hit_factor":9.6432},{"match_name":"SMPS March 2016","match_date":"2016-03-13","stage_classifiercode":"06-03","member_number":"TY61811","first_name":"JARED","last_name":"WOOD","classification":"C","division":"PRODUCTION","hit_factor":9.6432},{"match_name":"LCSC Classifier 042918","match_date":"2018-04-28","stage_classifiercode":"06-03","member_number":"A97497","first_name":"ROBERT","last_name":"FRESHWATER","classification":"B","division":"PRODUCTION","hit_factor":9.6372},{"match_name":"PCSI - July 2018 USPSA","match_date":"2018-07-07","stage_classifiercode":"06-03","member_number":"A110722","first_name":"MITCHELL","last_name":"HOFF","classification":"C","division":"PRODUCTION","hit_factor":9.6362},{"match_name":"SCCCJULYCLASSIFIER2016","match_date":"2016-07-30","stage_classifiercode":"06-03","member_number":"A59483","first_name":"OTIS","last_name":"FOX","classification":"U","division":"PRODUCTION","hit_factor":9.6362},{"match_name":"DSSA 2018-09 USPSA Pistol","match_date":"2018-09-23","stage_classifiercode":"06-03","member_number":"A108640","first_name":"MARK","last_name":"GIARDINA","classification":"C","division":"PRODUCTION","hit_factor":9.6339},{"match_name":"APSC USPSA Classifier Match 07-01-17","match_date":"2017-07-01","stage_classifiercode":"06-03","member_number":"TY74988","first_name":"GREG","last_name":"COOPER","classification":"C","division":"PRODUCTION","hit_factor":9.6339},{"match_name":"ACC July 26th USPSA","match_date":"2020-07-26","stage_classifiercode":"06-03","member_number":"A128085","first_name":"ETHAN","last_name":"HUNT","classification":"U","division":"PRODUCTION","hit_factor":9.6335},{"match_name":"Pathfinder July USPSA Match","match_date":"2016-07-17","stage_classifiercode":"06-03","member_number":"FY23055","first_name":"DOUGLAS","last_name":"HAGUE","classification":"B","division":"PRODUCTION","hit_factor":9.6311},{"match_name":"EAPS July 2016 USPSA","match_date":"2016-07-17","stage_classifiercode":"06-03","member_number":"A81333","first_name":"GUMP","last_name":"BROWN","classification":"C","division":"PRODUCTION","hit_factor":9.6311},{"match_name":"Prescott 1st Saturday USPSA 4-7-18","match_date":"2018-04-07","stage_classifiercode":"06-03","member_number":"L1828","first_name":"OMAR","last_name":"NEWBURY","classification":"A","division":"PRODUCTION","hit_factor":9.628},{"match_name":"GCL October 6-2018","match_date":"2018-10-06","stage_classifiercode":"06-03","member_number":"A111304","first_name":"BILL","last_name":"PULVER","classification":"C","division":"PRODUCTION","hit_factor":9.628},{"match_name":"TMGN December 21 Practical Shooter Match","match_date":"2017-12-22","stage_classifiercode":"06-03","member_number":"A101390","first_name":"WILL","last_name":"TUNG","classification":"\"\"","division":"PRODUCTION","hit_factor":9.6267},{"match_name":"Htf Practical Shooters All Classifier","match_date":"2017-10-29","stage_classifiercode":"06-03","member_number":"a101864","first_name":"DONNY","last_name":"HUDGINS","classification":"U","division":"PRODUCTION","hit_factor":9.6246},{"match_name":"Htf Practical Shooters All Classifier","match_date":"2017-10-29","stage_classifiercode":"06-03","member_number":"A100382","first_name":"CHRIS","last_name":"WILLIAMSON","classification":"C","division":"PRODUCTION","hit_factor":9.6246},{"match_name":"BHPSC Weekly Match 2-24-2017 Special Classifier Match","match_date":"2017-02-25","stage_classifiercode":"06-03","member_number":"A94770","first_name":"VANDY","last_name":"THOMSEN","classification":"U","division":"PRODUCTION","hit_factor":9.6246},{"match_name":"EAPS July 2017 USPSA","match_date":"2017-07-16","stage_classifiercode":"06-03","member_number":"TY104075","first_name":"JEFF","last_name":"MOTICHEK","classification":"U","division":"PRODUCTION","hit_factor":9.6246},{"match_name":"HTF Practical Shooter Classifer","match_date":"2017-11-02","stage_classifiercode":"06-03","member_number":"A100991","first_name":"ZAC","last_name":"MEADOWS","classification":"U","division":"PRODUCTION","hit_factor":9.6246},{"match_name":"SFA USPSA August 2017","match_date":"2017-08-19","stage_classifiercode":"06-03","member_number":"TY91924","first_name":"THERESA","last_name":"SKINNER","classification":"C","division":"PRODUCTION","hit_factor":9.6234},{"match_name":"Hose Monster Action","match_date":"2020-02-16","stage_classifiercode":"06-03","member_number":"fy122762","first_name":"BRIAN","last_name":"SANDERS","classification":"C","division":"PRODUCTION","hit_factor":9.6234},{"match_name":"AGC_20170205","match_date":"2017-02-05","stage_classifiercode":"06-03","member_number":"A78191","first_name":"MIKE","last_name":"MORGAN","classification":"U","division":"PRODUCTION","hit_factor":9.6192},{"match_name":"MCPSL Pistol 4-8-17","match_date":"2017-04-08","stage_classifiercode":"06-03","member_number":"A63252","first_name":"DAVID","last_name":"BAKER","classification":"B","division":"PRODUCTION","hit_factor":9.6192},{"match_name":"Detroit Sportsmens Congress - May 21 2017","match_date":"2017-05-21","stage_classifiercode":"06-03","member_number":"PEN","first_name":"HARRISON","last_name":"TARR","classification":"U","division":"PRODUCTION","hit_factor":9.6173},{"match_name":"WNPL USPSA Feb 2021","match_date":"2021-02-06","stage_classifiercode":"06-03","member_number":"A116560","first_name":"MICHAEL","last_name":"MILOVICH","classification":"B","division":"PRODUCTION","hit_factor":9.6173},{"match_name":"GCL October 6-2018","match_date":"2018-10-06","stage_classifiercode":"06-03","member_number":"A108746","first_name":"STEVEN","last_name":"BOKOR","classification":"C","division":"PRODUCTION","hit_factor":9.6173},{"match_name":"FVPS October USPSA Match","match_date":"2018-10-06","stage_classifiercode":"06-03","member_number":"TY88223","first_name":"RICK","last_name":"HAGEMAN","classification":"D","division":"PRODUCTION","hit_factor":9.6154},{"match_name":"CFRPC USPSA 2016 DECEMBER","match_date":"2016-12-18","stage_classifiercode":"06-03","member_number":"A88252","first_name":"MARK","last_name":"HILLIARD","classification":"M","division":"PRODUCTION","hit_factor":9.6154},{"match_name":"Southern Maryland Practical Shooters 14 October 2018 USPSA","match_date":"2018-10-14","stage_classifiercode":"06-03","member_number":"TY99998","first_name":"LEONARD","last_name":"ROY","classification":"C","division":"PRODUCTION","hit_factor":9.6154},{"match_name":"Southkent USPSA June match","match_date":"2017-06-17","stage_classifiercode":"06-03","member_number":"TY45940","first_name":"BRUCE","last_name":"WARREN","classification":"B","division":"PRODUCTION","hit_factor":9.6078},{"match_name":"Springfield Tactical Shooters 04-07-2016","match_date":"2016-04-07","stage_classifiercode":"06-03","member_number":"FY83614","first_name":"GARY","last_name":"GRAY","classification":"D","division":"PRODUCTION","hit_factor":9.6016},{"match_name":"Pioneer Action Shooters USPSA 5-27-18","match_date":"2018-05-27","stage_classifiercode":"06-03","member_number":"A87902","first_name":"PATRICK","last_name":"VITALE","classification":"C","division":"PRODUCTION","hit_factor":9.5984},{"match_name":"AGC_20170205","match_date":"2017-02-05","stage_classifiercode":"06-03","member_number":"A94589","first_name":"JOE","last_name":"TREGENZA","classification":"B","division":"PRODUCTION","hit_factor":9.5969},{"match_name":"2015 Ontelaunee Holiday Hosefest","match_date":"2015-12-26","stage_classifiercode":"06-03","member_number":"\"\"","first_name":"RYAN","last_name":"FRANCIA","classification":"C","division":"PRODUCTION","hit_factor":9.5969},{"match_name":"Bayou City USPSA Weekly Mar 1","match_date":"2018-03-02","stage_classifiercode":"06-03","member_number":"A89242","first_name":"DESMOND","last_name":"JACKSON","classification":"C","division":"PRODUCTION","hit_factor":9.5904},{"match_name":"USPSA BDSC Baghdad Practical Shooters","match_date":"2017-01-21","stage_classifiercode":"06-03","member_number":"\"\"","first_name":"MARK","last_name":"HARDY","classification":"U","division":"PRODUCTION","hit_factor":9.589},{"match_name":"BPSA April 2017 USPSA","match_date":"2017-04-23","stage_classifiercode":"06-03","member_number":"A100555","first_name":"TOMMY","last_name":"MCGUIRE","classification":"C","division":"PRODUCTION","hit_factor":9.5877},{"match_name":"Fort Wayne USPSA April 2021","match_date":"2021-04-18","stage_classifiercode":"06-03","member_number":"A119715","first_name":"BRANDON","last_name":"WHITTON","classification":"C","division":"PRODUCTION","hit_factor":9.5808},{"match_name":"Blue Ridge Arsenal Nov 8 All Classifier match","match_date":"2018-11-08","stage_classifiercode":"06-03","member_number":"Ty99998","first_name":"LEONARD","last_name":"ROY","classification":"C","division":"PRODUCTION","hit_factor":9.5797},{"match_name":"Atlanta Practical Shooters March 2016 USPSA - Classifier Match","match_date":"2016-03-06","stage_classifiercode":"06-03","member_number":"L","first_name":"CHRIS","last_name":"PALMER","classification":"C","division":"PRODUCTION","hit_factor":9.5797},{"match_name":"RangeMasters 6-29-17","match_date":"2017-06-29","stage_classifiercode":"06-03","member_number":"A79973","first_name":"GREGG","last_name":"MCHENRY","classification":"C","division":"PRODUCTION","hit_factor":9.5785},{"match_name":"BPSA April 2017 USPSA","match_date":"2017-04-23","stage_classifiercode":"06-03","member_number":"A96286","first_name":"PAUL","last_name":"MACE","classification":"C","division":"PRODUCTION","hit_factor":9.5785},{"match_name":"USPSA MO21 2Alpha SBRC July 2017 Special Classifier","match_date":"2017-07-15","stage_classifiercode":"06-03","member_number":"A98118","first_name":"JORDAN","last_name":"EPPS","classification":"U","division":"PRODUCTION","hit_factor":9.5785},{"match_name":"PSAC 20180922","match_date":"2018-09-22","stage_classifiercode":"06-03","member_number":"A112529","first_name":"DOMINIC","last_name":"SMALL","classification":"U","division":"PRODUCTION","hit_factor":9.5785},{"match_name":"ORPCI 2018.03.31 USPSA Special","match_date":"2018-03-31","stage_classifiercode":"06-03","member_number":"FY48392","first_name":"RICK","last_name":"VANBLARICUM","classification":"A","division":"PRODUCTION","hit_factor":9.5745},{"match_name":"HOPS USPSA 081917","match_date":"2017-08-19","stage_classifiercode":"06-03","member_number":"TY58129","first_name":"DARREN","last_name":"LESKIW","classification":"B","division":"PRODUCTION","hit_factor":9.5723},{"match_name":"Springfield Tactical Shooters 04-07-2016","match_date":"2016-04-07","stage_classifiercode":"06-03","member_number":"FY83614","first_name":"GARY","last_name":"GRAY","classification":"D","division":"PRODUCTION","hit_factor":9.5723},{"match_name":"EAGC September 2016 USPSA Pistol Match","match_date":"2016-09-18","stage_classifiercode":"06-03","member_number":"\"\"","first_name":"ISAAC","last_name":"WATERS","classification":"U","division":"PRODUCTION","hit_factor":9.5713},{"match_name":"LdF USPSA Classifier Match December 12 2020","match_date":"2020-12-12","stage_classifiercode":"06-03","member_number":"TY88977","first_name":"CALIFORNIA","last_name":"CHAD","classification":"B","division":"PRODUCTION","hit_factor":9.5703},{"match_name":"MAPSA 2016.04.09","match_date":"2016-04-09","stage_classifiercode":"06-03","member_number":"A90188","first_name":"BLAKE","last_name":"MAMER","classification":"B","division":"PRODUCTION","hit_factor":9.5694},{"match_name":"EWPSA 2015-12","match_date":"2015-12-20","stage_classifiercode":"06-03","member_number":"A55355","first_name":"RANDY","last_name":"BAYUK","classification":"B","division":"PRODUCTION","hit_factor":9.5694},{"match_name":"SCAPSA MN05 USPSA Fall League 3","match_date":"2018-08-14","stage_classifiercode":"06-03","member_number":"A111099","first_name":"LOGAN","last_name":"TOLAND","classification":"C","division":"PRODUCTION","hit_factor":9.5694},{"match_name":"Pioneer Action Shooters APR 2016","match_date":"2016-04-24","stage_classifiercode":"06-03","member_number":"A69159","first_name":"AARON","last_name":"HAINES","classification":"C","division":"PRODUCTION","hit_factor":9.5626},{"match_name":"OFGC Practical Pistol Match Feb 21 2016","match_date":"2016-02-21","stage_classifiercode":"06-03","member_number":"A 50566","first_name":"NICK","last_name":"GOLDEN","classification":"B","division":"PRODUCTION","hit_factor":9.561},{"match_name":"Grandbaggers 07/2017","match_date":"2017-07-06","stage_classifiercode":"06-03","member_number":"A81261","first_name":"THOMAS","last_name":"CLYDE","classification":"U","division":"PRODUCTION","hit_factor":9.5602},{"match_name":"A3G-APS October 13th USPSA Match","match_date":"2018-10-13","stage_classifiercode":"06-03","member_number":"A107412","first_name":"TERRY","last_name":"WALKER","classification":"C","division":"PRODUCTION","hit_factor":9.5602},{"match_name":"AGC_20170205","match_date":"2017-02-05","stage_classifiercode":"06-03","member_number":"A79592","first_name":"PATRICK","last_name":"JONES","classification":"B","division":"PRODUCTION","hit_factor":9.5556},{"match_name":"Richmond October 17-18-2015","match_date":"2015-10-17","stage_classifiercode":"06-03","member_number":"TY77672","first_name":"JON G","last_name":"WHITEHAIR","classification":"B","division":"PRODUCTION","hit_factor":9.5541},{"match_name":"WTPS USPSA Match 3-12-16","match_date":"2016-03-12","stage_classifiercode":"06-03","member_number":"A73310","first_name":"BRIAN","last_name":"GILBERT","classification":"B","division":"PRODUCTION","hit_factor":9.5535},{"match_name":"MASTER BLASTERS & SSFGA USPSA - September","match_date":"2020-09-19","stage_classifiercode":"06-03","member_number":"Ty91611","first_name":"ANDREW","last_name":"LUNEAU","classification":"B","division":"PRODUCTION","hit_factor":9.5528},{"match_name":"Inner 10 USPSA December 14th Match - Maybe","match_date":"2020-12-15","stage_classifiercode":"06-03","member_number":"ty76927","first_name":"DONALD","last_name":"RUSH","classification":"C","division":"PRODUCTION","hit_factor":9.5522},{"match_name":"2016 Columbia Cascade Section Championship","match_date":"2016-08-12","stage_classifiercode":"06-03","member_number":"L3349","first_name":"BILL","last_name":"MUNCY","classification":"B","division":"PRODUCTION","hit_factor":9.5511},{"match_name":"USPSA","match_date":"2017-09-03","stage_classifiercode":"06-03","member_number":"A103696","first_name":"SHAWN","last_name":"CAMPBELL","classification":"\"\"","division":"PRODUCTION","hit_factor":9.5511},{"match_name":"Brazosland Pistoleros November 20 2016--USPSA","match_date":"2016-11-20","stage_classifiercode":"06-03","member_number":"\"\"","first_name":"SETH","last_name":"ABBOTT","classification":"U","division":"PRODUCTION","hit_factor":9.5511},{"match_name":"MRCPS  USPSA MARCH","match_date":"2017-03-19","stage_classifiercode":"06-03","member_number":"TY100358","first_name":"KELLY","last_name":"BENNETT","classification":"C","division":"PRODUCTION","hit_factor":9.5511},{"match_name":"Alpha Mike July 2021   ","match_date":"2021-07-18","stage_classifiercode":"06-03","member_number":"A99506","first_name":"JEFF","last_name":"ROCKWELL","classification":"A","division":"PRODUCTION","hit_factor":9.5465},{"match_name":"Trigger Guard USPSA","match_date":"2016-04-02","stage_classifiercode":"06-03","member_number":"A89295","first_name":"CHASE","last_name":"FARKAS","classification":"U","division":"PRODUCTION","hit_factor":9.544},{"match_name":"USPSA-AB 2018-15 at Brooks Pistol Club - adhoc","match_date":"2018-09-09","stage_classifiercode":"06-03","member_number":"F113356","first_name":"DAVID","last_name":"UY","classification":"U","division":"PRODUCTION","hit_factor":9.5436},{"match_name":"BSPSC 2017 October Jacobi Concealed Carry","match_date":"2017-10-08","stage_classifiercode":"06-03","member_number":"L4136","first_name":"STEVE","last_name":"BANKS","classification":"C","division":"PRODUCTION","hit_factor":9.5431},{"match_name":"WGC August 2017 USPSA Classifier","match_date":"2017-08-13","stage_classifiercode":"06-03","member_number":"A50849","first_name":"DERRICK","last_name":"HERNANDEZ","classification":"U","division":"PRODUCTION","hit_factor":9.5424},{"match_name":"TCGC Polo August 2017","match_date":"2017-08-20","stage_classifiercode":"06-03","member_number":"TY94467","first_name":"KEITH","last_name":"KRAUSE","classification":"C","division":"PRODUCTION","hit_factor":9.542},{"match_name":"The Irbil Open","match_date":"2017-05-14","stage_classifiercode":"06-03","member_number":"\"\"","first_name":"ADAM","last_name":"CLACK","classification":"U","division":"PRODUCTION","hit_factor":9.542},{"match_name":"Richmond Hot Shots February 20-21-2021 USPSA Pistol","match_date":"2021-02-20","stage_classifiercode":"06-03","member_number":"L3870","first_name":"JOHN","last_name":"HAUGRUD","classification":"C","division":"PRODUCTION","hit_factor":9.5333},{"match_name":"Gem City Gun Club 1-20 And 1-21-18","match_date":"2018-01-21","stage_classifiercode":"06-03","member_number":"TY41710","first_name":"CHRIS","last_name":"HANES","classification":"B","division":"PRODUCTION","hit_factor":9.5333},{"match_name":"Griffin USPSA Match May 2017","match_date":"2017-05-20","stage_classifiercode":"06-03","member_number":"A39297","first_name":"BRIAN","last_name":"THOMPSON","classification":"B","division":"PRODUCTION","hit_factor":9.5331},{"match_name":"BGS  Hudson Week 2","match_date":"2018-12-10","stage_classifiercode":"06-03","member_number":"TY95926","first_name":"BUG","last_name":"SCHRADER","classification":"C","division":"PRODUCTION","hit_factor":9.5331},{"match_name":"NPCCC 04-01-2018 USPSA","match_date":"2018-04-01","stage_classifiercode":"06-03","member_number":"TY102728","first_name":"LARRY","last_name":"DAMORE","classification":"C","division":"PRODUCTION","hit_factor":9.5238},{"match_name":"Rankin Field Sunday USPSA","match_date":"2017-11-19","stage_classifiercode":"06-03","member_number":"\"\"","first_name":"ALLAN","last_name":"ABREA","classification":"U","division":"PRODUCTION","hit_factor":9.5238},{"match_name":"OKCGC February USPSA Match","match_date":"2017-02-04","stage_classifiercode":"06-03","member_number":"A61442","first_name":"SHANNON","last_name":"CONLEY","classification":"B","division":"PRODUCTION","hit_factor":9.5238},{"match_name":"WNPL USPSA  - October HoseFest 2021","match_date":"2021-10-09","stage_classifiercode":"06-03","member_number":"A123413","first_name":"SHERWIN","last_name":"IBAY","classification":"B","division":"PRODUCTION","hit_factor":9.5238},{"match_name":"SLOSA JAN 2021 USPSA MATCH","match_date":"2021-01-09","stage_classifiercode":"06-03","member_number":"L4191","first_name":"TERRELL","last_name":"COHEN","classification":"C","division":"PRODUCTION","hit_factor":9.5238},{"match_name":"Devil Dog USPSA Classifier Match-Sunday Session","match_date":"2018-03-11","stage_classifiercode":"06-03","member_number":"A109442","first_name":"AARON","last_name":"BYRD","classification":"\"\"","division":"PRODUCTION","hit_factor":9.5238},{"match_name":"WSPS AUGUST 2017 USPSA MATCH","match_date":"2017-08-16","stage_classifiercode":"06-03","member_number":"A103332","first_name":"ZACHARY","last_name":"HUFF","classification":"U","division":"PRODUCTION","hit_factor":9.5238},{"match_name":"USPSA BDSC Baghdad Practical Shooters","match_date":"2017-01-21","stage_classifiercode":"06-03","member_number":"A100383","first_name":"STEVEN","last_name":"WHITAKER","classification":"U","division":"PRODUCTION","hit_factor":9.5238},{"match_name":"Cactus Match USPSA ALL CLASSIFIER July 2018","match_date":"2018-07-01","stage_classifiercode":"06-03","member_number":"A111614","first_name":"ALAN","last_name":"PAPP","classification":"U","division":"PRODUCTION","hit_factor":9.5238},{"match_name":"Eagles Nest August 20th","match_date":"2017-08-20","stage_classifiercode":"06-03","member_number":"A37872","first_name":"DAVE","last_name":"MOORE","classification":"C","division":"PRODUCTION","hit_factor":9.5238},{"match_name":"CRGC USPSA Match 7-22-18","match_date":"2018-07-22","stage_classifiercode":"06-03","member_number":"A111145","first_name":"PETER","last_name":"ADAMS","classification":"\"\"","division":"PRODUCTION","hit_factor":9.5147},{"match_name":"Tehama Shooters August 2020 USPSA Classifier Match","match_date":"2020-08-22","stage_classifiercode":"06-03","member_number":"Fy89662","first_name":"TODD","last_name":"CANCILLA","classification":"A","division":"PRODUCTION","hit_factor":9.5147},{"match_name":"Richmond October 17-18-2015","match_date":"2015-10-17","stage_classifiercode":"06-03","member_number":"A82878","first_name":"RICHARD","last_name":"WILLIAMS","classification":"C","division":"PRODUCTION","hit_factor":9.5147},{"match_name":"SUPS All Classifier Match March 1718 2018","match_date":"2018-03-17","stage_classifiercode":"06-03","member_number":"A109647","first_name":"DUSTIN","last_name":"ROCK","classification":"U","division":"PRODUCTION","hit_factor":9.5147},{"match_name":"Judes Peanut Butter Scissorhands","match_date":"2016-06-01","stage_classifiercode":"06-03","member_number":"\"\"","first_name":"NICK","last_name":"NORFLEET","classification":"U","division":"PRODUCTION","hit_factor":9.5146},{"match_name":"The Irbil Open","match_date":"2017-05-14","stage_classifiercode":"06-03","member_number":"A63469","first_name":"BRIAN","last_name":"JOHNSON","classification":"X","division":"PRODUCTION","hit_factor":9.5142},{"match_name":"USPSA MO21 2Alpha SBRC July 2017 Special Classifier","match_date":"2017-07-15","stage_classifiercode":"06-03","member_number":"TY82312","first_name":"RICHARD","last_name":"HOLLAND","classification":"C","division":"PRODUCTION","hit_factor":9.5142},{"match_name":"FBPPC JULY IPSC MATCH","match_date":"2016-07-09","stage_classifiercode":"06-03","member_number":"A90674","first_name":"NICHOLAS","last_name":"STANZIONE","classification":"U","division":"PRODUCTION","hit_factor":9.5057},{"match_name":"NISA April Classifer Match 2016","match_date":"2016-04-24","stage_classifiercode":"06-03","member_number":"A65543","first_name":"SCOTT","last_name":"CALLAHAN","classification":"C","division":"PRODUCTION","hit_factor":9.5057},{"match_name":"WNYPPL August 2017 Classifier Match","match_date":"2017-08-27","stage_classifiercode":"06-03","member_number":"A76657","first_name":"JOE","last_name":"KOPEC","classification":"C","division":"PRODUCTION","hit_factor":9.5057},{"match_name":"NPCCC 04-01-2018 USPSA","match_date":"2018-04-01","stage_classifiercode":"06-03","member_number":"\"\"","first_name":"DAVID","last_name":"TYSSEN","classification":"U","division":"PRODUCTION","hit_factor":9.4967},{"match_name":"Grandbaggers December 2017","match_date":"2017-12-07","stage_classifiercode":"06-03","member_number":"A103714","first_name":"DON","last_name":"TYLER","classification":"U","division":"PRODUCTION","hit_factor":9.4967},{"match_name":"WSRC USPSA 7/15/2017","match_date":"2017-07-15","stage_classifiercode":"06-03","member_number":"A80578","first_name":"DENNIS","last_name":"PARHAM","classification":"C","division":"PRODUCTION","hit_factor":9.4961},{"match_name":"ORSA USPSA July Match Dang Its Hot Out There","match_date":"2018-07-19","stage_classifiercode":"06-03","member_number":"TY21268","first_name":"MARK","last_name":"LEVY","classification":"B","division":"PRODUCTION","hit_factor":9.4961},{"match_name":"Tehama Shooters August 2020 USPSA Classifier Match","match_date":"2020-08-22","stage_classifiercode":"06-03","member_number":"A125815","first_name":"WESLEY","last_name":"HAMBRIGHT","classification":"C","division":"PRODUCTION","hit_factor":9.4955},{"match_name":"NISA April Classifer Match 2016","match_date":"2016-04-24","stage_classifiercode":"06-03","member_number":"A86466","first_name":"BEN","last_name":"HOLSEN","classification":"U","division":"PRODUCTION","hit_factor":9.4955},{"match_name":"BORCC USPSA Classifier Match January 2017","match_date":"2017-01-22","stage_classifiercode":"06-03","member_number":"TY81670","first_name":"DAVID","last_name":"MILLER","classification":"A","division":"PRODUCTION","hit_factor":9.4937},{"match_name":"CSA Annual Classifier Classic","match_date":"2018-03-18","stage_classifiercode":"06-03","member_number":"A88347","first_name":"MATT","last_name":"BOWEN","classification":"U","division":"PRODUCTION","hit_factor":9.4877},{"match_name":"RBPS April Pistol Match","match_date":"2017-04-15","stage_classifiercode":"06-03","member_number":"TY70159","first_name":"JIM","last_name":"CULBERTSON","classification":"C","division":"PRODUCTION","hit_factor":9.4877},{"match_name":"Pioneer Action Shooters APR 2016","match_date":"2016-04-24","stage_classifiercode":"06-03","member_number":"\"\"","first_name":"DAVID","last_name":"MAHER","classification":"U","division":"PRODUCTION","hit_factor":9.4877},{"match_name":"USPSA Strategic Edge October 2018","match_date":"2018-10-20","stage_classifiercode":"06-03","member_number":"TY63873","first_name":"GREG","last_name":"BELL","classification":"B","division":"PRODUCTION","hit_factor":9.4877},{"match_name":"Pathfinder July USPSA Match","match_date":"2016-07-17","stage_classifiercode":"06-03","member_number":"A59003","first_name":"MICHAEL","last_name":"HOURIHAN","classification":"C","division":"PRODUCTION","hit_factor":9.4787},{"match_name":"BORCC USPSA July 2016","match_date":"2016-07-24","stage_classifiercode":"06-03","member_number":"A92784","first_name":"JAMES","last_name":"KINYON","classification":"C","division":"PRODUCTION","hit_factor":9.4787},{"match_name":"SMPS March 2016","match_date":"2016-03-13","stage_classifiercode":"06-03","member_number":"A86959","first_name":"MATT","last_name":"SCHWARTZ","classification":"B","division":"PRODUCTION","hit_factor":9.4787},{"match_name":"2018-03-02 USPSA at Phoenix Rod and Gun Club","match_date":"2018-03-03","stage_classifiercode":"06-03","member_number":"A77997","first_name":"TOM","last_name":"MCCONLOGUE","classification":"B","division":"PRODUCTION","hit_factor":9.4778},{"match_name":"Competitive Shooters of Lake Norman CORNELIUS Thursday Evening Indoor USPSA Pistol Match North Carolina","match_date":"2020-09-17","stage_classifiercode":"06-03","member_number":"A93583","first_name":"JEREMY","last_name":"WILLETT","classification":"C","division":"PRODUCTION","hit_factor":9.4768},{"match_name":"WSRC USPSA 7/15/2017","match_date":"2017-07-15","stage_classifiercode":"06-03","member_number":"A95232","first_name":"ANGELA","last_name":"BERRING","classification":"C","division":"PRODUCTION","hit_factor":9.4768},{"match_name":"CSA Annual Classifier Classic","match_date":"2018-03-18","stage_classifiercode":"06-03","member_number":"A105549","first_name":"DEXTER","last_name":"SPURLOCK","classification":"U","division":"PRODUCTION","hit_factor":9.4758},{"match_name":"Baghdad IPSC Match 8-5-2017","match_date":"2017-08-05","stage_classifiercode":"06-03","member_number":"NONE","first_name":"CHARLES","last_name":"INGENERI","classification":"\"\"","division":"PRODUCTION","hit_factor":9.4737},{"match_name":"SAPSA July 2016","match_date":"2016-07-16","stage_classifiercode":"06-03","member_number":"A92232","first_name":"DARREN","last_name":"CRIBBS","classification":"B","division":"PRODUCTION","hit_factor":9.4697},{"match_name":"SMPS March 2016","match_date":"2016-03-13","stage_classifiercode":"06-03","member_number":"A85450","first_name":"ANDY","last_name":"PERSHALL","classification":"D","division":"PRODUCTION","hit_factor":9.4686},{"match_name":"RBGC 2016-07-23","match_date":"2016-07-23","stage_classifiercode":"06-03","member_number":"TY69676","first_name":"RAYMOND","last_name":"TAN","classification":"B","division":"PRODUCTION","hit_factor":9.4663},{"match_name":"SAPSA January 2018","match_date":"2018-01-20","stage_classifiercode":"06-03","member_number":"A107270","first_name":"MATT","last_name":"RINALDO","classification":"U","division":"PRODUCTION","hit_factor":9.465},{"match_name":"NW01 Tuesday Sectional","match_date":"2017-08-01","stage_classifiercode":"06-03","member_number":"B49","first_name":"DAVID","last_name":"FARROW","classification":"B","division":"PRODUCTION","hit_factor":9.4607},{"match_name":"DWB - Deadwood Boys USPSA 15 July 2018","match_date":"2018-07-15","stage_classifiercode":"06-03","member_number":"A69709","first_name":"RAM","last_name":"ZAR","classification":"B","division":"PRODUCTION","hit_factor":9.4607},{"match_name":"APSA June 2016 USPSA Match","match_date":"2016-06-11","stage_classifiercode":"06-03","member_number":"A88525","first_name":"DAVID","last_name":"ODDO","classification":"D","division":"PRODUCTION","hit_factor":9.4607},{"match_name":"WVRPC USPSA 5 AUGUST 2017","match_date":"2017-08-05","stage_classifiercode":"06-03","member_number":"\"\"","first_name":"JOHN","last_name":"KENSINGER","classification":"U","division":"PRODUCTION","hit_factor":9.4595},{"match_name":"OFGC Practical Pistol Match Feb 21 2016","match_date":"2016-02-21","stage_classifiercode":"06-03","member_number":"A79509","first_name":"LUIS","last_name":"RENOVA","classification":"B","division":"PRODUCTION","hit_factor":9.4567},{"match_name":"PSAC 20200705","match_date":"2020-07-05","stage_classifiercode":"06-03","member_number":"A98459","first_name":"MAYLI","last_name":"PERKINS","classification":"C","division":"PRODUCTION","hit_factor":9.4503},{"match_name":"Baghdad IPSC Match 8-5-2017","match_date":"2017-08-05","stage_classifiercode":"06-03","member_number":"A99956","first_name":"RAY","last_name":"HULSMAN","classification":"\"\"","division":"PRODUCTION","hit_factor":9.4439},{"match_name":"RBGC 2016-07-23","match_date":"2016-07-23","stage_classifiercode":"06-03","member_number":"A84202","first_name":"DOUG","last_name":"RUTLEDGE","classification":"B","division":"PRODUCTION","hit_factor":9.4429},{"match_name":"Pathfinder July USPSA Match","match_date":"2017-07-16","stage_classifiercode":"06-03","member_number":"A59003","first_name":"MICHAEL","last_name":"HOURIHAN","classification":"B","division":"PRODUCTION","hit_factor":9.4429},{"match_name":"ESPS USPSA OCT","match_date":"2016-10-22","stage_classifiercode":"06-03","member_number":"\"\"","first_name":"JAMES","last_name":"DAVIS","classification":"U","division":"PRODUCTION","hit_factor":9.4412},{"match_name":"SLOSA JANUARY 2020 USPSA MATCH","match_date":"2020-01-11","stage_classifiercode":"06-03","member_number":"A90454","first_name":"JUSTIN","last_name":"ALVAREZ","classification":"A","division":"PRODUCTION","hit_factor":9.4412},{"match_name":"LdF USPSA Match May 13 2017","match_date":"2017-05-13","stage_classifiercode":"06-03","member_number":"A73599","first_name":"DAVID","last_name":"PRICE","classification":"C","division":"PRODUCTION","hit_factor":9.4412},{"match_name":"Chillicothe April-2018 USPSA Classifier Match","match_date":"2018-04-28","stage_classifiercode":"06-03","member_number":"TY27544","first_name":"DON","last_name":"DANSBY","classification":"B","division":"PRODUCTION","hit_factor":9.4395},{"match_name":"MPPL 09022018","match_date":"2018-09-02","stage_classifiercode":"06-03","member_number":"L3487","first_name":"ALEX","last_name":"PATINO II","classification":"C","division":"PRODUCTION","hit_factor":9.4395},{"match_name":"ORGC Independance Day  2018 Pistol Match","match_date":"2018-07-01","stage_classifiercode":"06-03","member_number":"A112397","first_name":"MARTIN","last_name":"VONGPHACHANH","classification":"U","division":"PRODUCTION","hit_factor":9.434},{"match_name":"Brazosland Pistoleros September 17 2017 USPSA","match_date":"2017-09-17","stage_classifiercode":"06-03","member_number":"\"\"","first_name":"CHRISTOPHER","last_name":"HOOG","classification":"U","division":"PRODUCTION","hit_factor":9.434},{"match_name":"USPSA BDSC Baghdad Practical Shooters","match_date":"2017-01-21","stage_classifiercode":"06-03","member_number":"\"\"","first_name":"ROBERT","last_name":"RHODEBACK","classification":"U","division":"PRODUCTION","hit_factor":9.4321},{"match_name":"ANPRACS USPSA 7-15-18","match_date":"2018-07-15","stage_classifiercode":"06-03","member_number":"TY91250","first_name":"ED","last_name":"JACKSON","classification":"U","division":"PRODUCTION","hit_factor":9.4321},{"match_name":"WVPPS May 2017","match_date":"2017-05-21","stage_classifiercode":"06-03","member_number":"TY80201","first_name":"TOM","last_name":"RAPALA","classification":"B","division":"PRODUCTION","hit_factor":9.4251},{"match_name":"RSPP 3rd Saturday July 2018","match_date":"2018-07-20","stage_classifiercode":"06-03","member_number":"FY71052","first_name":"NEIL","last_name":"SORENSEN","classification":"B","division":"PRODUCTION","hit_factor":9.4251},{"match_name":"Rankin Field Sunday USPSA","match_date":"2016-10-16","stage_classifiercode":"06-03","member_number":"A96216","first_name":"MATT","last_name":"FEAVER","classification":"C","division":"PRODUCTION","hit_factor":9.4241},{"match_name":"LCSA USPSA September 2017","match_date":"2017-09-02","stage_classifiercode":"06-03","member_number":"ty-103451","first_name":"ANTHONY","last_name":"NUCCIO","classification":"B","division":"PRODUCTION","hit_factor":9.4241},{"match_name":"WNPL USPSA  - October HoseFest 2021","match_date":"2021-10-09","stage_classifiercode":"06-03","member_number":"TY83101","first_name":"ROBERT","last_name":"WIECZOREK","classification":"C","division":"PRODUCTION","hit_factor":9.4231},{"match_name":"Detroit Sportsmens Congress - May 21 2017","match_date":"2017-05-21","stage_classifiercode":"06-03","member_number":"A103121","first_name":"KYLE","last_name":"EVANS","classification":"U","division":"PRODUCTION","hit_factor":9.4231},{"match_name":"Competitive Shooters of Lake Norman CORNELIUS Thursday Evening Indoor USPSA Pistol Match North Carolina","match_date":"2018-03-01","stage_classifiercode":"06-03","member_number":"A81356","first_name":"GARY","last_name":"PREZIOSI","classification":"C","division":"PRODUCTION","hit_factor":9.4231},{"match_name":"WVPPS May 2017","match_date":"2017-05-21","stage_classifiercode":"06-03","member_number":"A80429","first_name":"JOHN","last_name":"WILSON","classification":"B","division":"PRODUCTION","hit_factor":9.4231},{"match_name":"RangeMasters 6-29-17","match_date":"2017-06-29","stage_classifiercode":"06-03","member_number":"A100642","first_name":"MICAH","last_name":"TIEMANN","classification":"U","division":"PRODUCTION","hit_factor":9.4229},{"match_name":"2016 Columbia Cascade Section Championship","match_date":"2016-08-12","stage_classifiercode":"06-03","member_number":"A9144","first_name":"NICHOLAS","last_name":"NIBLER","classification":"C","division":"PRODUCTION","hit_factor":9.4162},{"match_name":"Matamoras USPSA March 2017","match_date":"2017-04-02","stage_classifiercode":"06-03","member_number":"A101692","first_name":"SAL","last_name":"PINZONE","classification":"U","division":"PRODUCTION","hit_factor":9.4162},{"match_name":"FBPPC FEBRUARY 2016 MATCH","match_date":"2016-02-13","stage_classifiercode":"06-03","member_number":"PEN","first_name":"DAVID","last_name":"WOODRUFF JR","classification":"U","division":"PRODUCTION","hit_factor":9.414},{"match_name":"ACC July 26th USPSA","match_date":"2020-07-26","stage_classifiercode":"06-03","member_number":"TY119289","first_name":"ALEX","last_name":"MORALES","classification":"C","division":"PRODUCTION","hit_factor":9.414},{"match_name":"TASC 4-16-16 (15Apr16-10:27:18)","match_date":"2016-04-16","stage_classifiercode":"06-03","member_number":"A94841","first_name":"STEVE","last_name":"HARTUNG","classification":"U","division":"PRODUCTION","hit_factor":9.4094},{"match_name":"GAS May 5th Match","match_date":"2018-05-05","stage_classifiercode":"06-03","member_number":"A96628","first_name":"CALEB","last_name":"HORNER","classification":"C","division":"PRODUCTION","hit_factor":9.4094},{"match_name":"Lafayette Practical Shooters - WEDNESDAY - Oct 10","match_date":"2018-10-10","stage_classifiercode":"06-03","member_number":"A109826","first_name":"ROBERT","last_name":"SANDOZ","classification":"C","division":"PRODUCTION","hit_factor":9.4094},{"match_name":"Benton Gun Club-USPSA April 2017 Classifier","match_date":"2017-04-23","stage_classifiercode":"06-03","member_number":"A-94781","first_name":"ROY","last_name":"GOODWIN","classification":"C","division":"PRODUCTION","hit_factor":9.4073},{"match_name":"Richmond Hot Shots April 15-16-2017 USPSA Pistol Match","match_date":"2017-04-15","stage_classifiercode":"06-03","member_number":"TY88874","first_name":"A JOHN","last_name":"BREGLIA","classification":"B","division":"PRODUCTION","hit_factor":9.4073},{"match_name":"PRG July 2017 Match","match_date":"2017-07-02","stage_classifiercode":"06-03","member_number":"\"\"","first_name":"JARED","last_name":"YUE","classification":"U","division":"PRODUCTION","hit_factor":9.405},{"match_name":"Nampa USPSA September 5th 2020","match_date":"2020-09-05","stage_classifiercode":"06-03","member_number":"TY63273","first_name":"GREGG","last_name":"HARWOOD","classification":"B","division":"PRODUCTION","hit_factor":9.405},{"match_name":"BHPC USPSA Monthly Match 9-11","match_date":"2016-09-11","stage_classifiercode":"06-03","member_number":"TY90436","first_name":"JIM","last_name":"ALVAREZ","classification":"B","division":"PRODUCTION","hit_factor":9.4044},{"match_name":"MRPC USPSA July 2017","match_date":"2017-07-23","stage_classifiercode":"06-03","member_number":"\"\"","first_name":"CHRIS","last_name":"HITEMAN","classification":"U","division":"PRODUCTION","hit_factor":9.4017},{"match_name":"BORCC USPSA July 2016","match_date":"2016-07-24","stage_classifiercode":"06-03","member_number":"\"\"","first_name":"RANDY","last_name":"JOHNSON","classification":"U","division":"PRODUCTION","hit_factor":9.4},{"match_name":"Piscataqua  Master Blasters USPSA Special Classifier","match_date":"2017-12-03","stage_classifiercode":"06-03","member_number":"A98756","first_name":"TIMOTHY","last_name":"KELLY","classification":"C","division":"PRODUCTION","hit_factor":9.4},{"match_name":"April 2018 CAS USPSA","match_date":"2018-04-01","stage_classifiercode":"06-03","member_number":"FY69322","first_name":"MARA","last_name":"WANDERER","classification":"\"\"","division":"PRODUCTION","hit_factor":9.3985},{"match_name":"Spsa Uspsa  1st Sat","match_date":"2016-01-02","stage_classifiercode":"06-03","member_number":"A79299","first_name":"ED","last_name":"ROTHSCHILD","classification":"C","division":"PRODUCTION","hit_factor":9.3985},{"match_name":"Brazosland Pistoleros September 17 2017 USPSA","match_date":"2017-09-17","stage_classifiercode":"06-03","member_number":"\"\"","first_name":"SAMUEL","last_name":"SLICHTER","classification":"U","division":"PRODUCTION","hit_factor":9.3985},{"match_name":"Richmond October 17-18-2015","match_date":"2015-10-17","stage_classifiercode":"06-03","member_number":"A79352","first_name":"HEATHER","last_name":"PRICE","classification":"C","division":"PRODUCTION","hit_factor":9.3985},{"match_name":"WGC USPSA  August 2017 Classifier 2","match_date":"2017-08-12","stage_classifiercode":"06-03","member_number":"A98139","first_name":"CARL","last_name":"BERNSTEIN","classification":"B","division":"PRODUCTION","hit_factor":9.396},{"match_name":"Springfield Tactical Shooters 03/012018","match_date":"2018-03-01","stage_classifiercode":"06-03","member_number":"A99127","first_name":"STEVE","last_name":"FRAZIER","classification":"C","division":"PRODUCTION","hit_factor":9.396},{"match_name":"TPS USPSA -  September Match 2021","match_date":"2021-09-04","stage_classifiercode":"06-03","member_number":"A134177","first_name":"JASON","last_name":"SELL","classification":"U","division":"PRODUCTION","hit_factor":9.3897},{"match_name":"Richmond Hot Shots February 20-21-2021 USPSA Pistol","match_date":"2021-02-20","stage_classifiercode":"06-03","member_number":"A128825","first_name":"BEN","last_name":"LAZARUS","classification":"C","division":"PRODUCTION","hit_factor":9.3848},{"match_name":"EWPSA 2018-07","match_date":"2018-07-14","stage_classifiercode":"06-03","member_number":"A105870","first_name":"ERIK","last_name":"BECK","classification":"C","division":"PRODUCTION","hit_factor":9.3842},{"match_name":"The Great Wet Classifier - Renton USPSA - November 2020 - NW05","match_date":"2020-11-22","stage_classifiercode":"06-03","member_number":"A119223","first_name":"SCOTT","last_name":"STEVENS","classification":"U","division":"PRODUCTION","hit_factor":9.3842},{"match_name":"PSAC 20200705","match_date":"2020-07-05","stage_classifiercode":"06-03","member_number":"A70801","first_name":"GLENN","last_name":"SULLIVAN","classification":"B","division":"PRODUCTION","hit_factor":9.3842},{"match_name":"MPSA 030516","match_date":"2016-03-05","stage_classifiercode":"06-03","member_number":"A93231","first_name":"VITTORIO","last_name":"COTTINI","classification":"B","division":"PRODUCTION","hit_factor":9.3842},{"match_name":"EHPSA USPSA 27 May 2018","match_date":"2018-05-27","stage_classifiercode":"06-03","member_number":"A60017","first_name":"JOSEPH","last_name":"HOUDA","classification":"C","division":"PRODUCTION","hit_factor":9.3812},{"match_name":"EDPS USPSA November 7","match_date":"2020-11-07","stage_classifiercode":"06-03","member_number":"A131425","first_name":"ANDREW","last_name":"PHILLIPS","classification":"U","division":"PRODUCTION","hit_factor":9.3812},{"match_name":"LCSA USPSA AUGUST 2018","match_date":"2018-08-12","stage_classifiercode":"06-03","member_number":"A112330","first_name":"THOMAS","last_name":"PARKS","classification":"\"\"","division":"PRODUCTION","hit_factor":9.3812},{"match_name":"bgs Hudson Week 1","match_date":"2016-11-27","stage_classifiercode":"06-03","member_number":"\"\"","first_name":"KEVIN","last_name":"HARTMAN","classification":"U","division":"PRODUCTION","hit_factor":9.3812},{"match_name":"bgs Hudson Week 1","match_date":"2016-11-27","stage_classifiercode":"06-03","member_number":"\"\"","first_name":"DOUG","last_name":"FLETCHER","classification":"U","division":"PRODUCTION","hit_factor":9.3809},{"match_name":"BUAS January Match","match_date":"2018-01-14","stage_classifiercode":"06-03","member_number":"ty91772","first_name":"LORI","last_name":"BADURA","classification":"D","division":"PRODUCTION","hit_factor":9.3809},{"match_name":"Schultz July USPSA- all classifier match","match_date":"2021-07-11","stage_classifiercode":"06-03","member_number":"A131471","first_name":"SCOTT","last_name":"PRISKE","classification":"C","division":"PRODUCTION","hit_factor":9.3809},{"match_name":"GAS USPSA at BRRC  November 11th 2017","match_date":"2017-11-11","stage_classifiercode":"06-03","member_number":"PEN","first_name":"RYAN","last_name":"CLASPILLE","classification":"U","division":"PRODUCTION","hit_factor":9.378},{"match_name":"COPS Sept 2020 USPSA Match","match_date":"2020-09-06","stage_classifiercode":"06-03","member_number":"A126957","first_name":"JOSHUA","last_name":"WILSON","classification":"D","division":"PRODUCTION","hit_factor":9.3721},{"match_name":"AREA 59  SPRING ALL CLASSIFIER","match_date":"2018-03-31","stage_classifiercode":"06-03","member_number":"L2998","first_name":"GARY","last_name":"WU","classification":"B","division":"PRODUCTION","hit_factor":9.3721},{"match_name":"Grandbaggers 07/2017","match_date":"2017-07-06","stage_classifiercode":"06-03","member_number":"A99490","first_name":"BRYAN","last_name":"DE LA FUENTE","classification":"U","division":"PRODUCTION","hit_factor":9.3719},{"match_name":"WVRPC USPSA 5 AUGUST 2017","match_date":"2017-08-05","stage_classifiercode":"06-03","member_number":"\"\"","first_name":"ALEX","last_name":"KUBIAK","classification":"U","division":"PRODUCTION","hit_factor":9.3633},{"match_name":"Detroit Sportsmens Congress - May 21 2017","match_date":"2017-05-21","stage_classifiercode":"06-03","member_number":"TY61030","first_name":"GERALD","last_name":"MITCHELL III","classification":"B","division":"PRODUCTION","hit_factor":9.3601},{"match_name":"Coastal Area Practical Shooters  12-26-15","match_date":"2015-12-26","stage_classifiercode":"06-03","member_number":"A68933","first_name":"JEFF","last_name":"BILOTTI","classification":"B","division":"PRODUCTION","hit_factor":9.3567},{"match_name":"Competitive Shooters of Lake Norman CORNELIUS Thursday Evening Indoor USPSA Pistol Match North Carolina","match_date":"2018-03-01","stage_classifiercode":"06-03","member_number":"A107054","first_name":"DAVID","last_name":"LADIEU","classification":"C","division":"PRODUCTION","hit_factor":9.3567},{"match_name":"BTSA USPSA 2016-8","match_date":"2016-08-28","stage_classifiercode":"06-03","member_number":"F-91205","first_name":"DEREK","last_name":"BANERA","classification":"C","division":"PRODUCTION","hit_factor":9.3567},{"match_name":"Richmond October 17-18-2015","match_date":"2015-10-17","stage_classifiercode":"06-03","member_number":"A88291","first_name":"CAL","last_name":"CHAN","classification":"D","division":"PRODUCTION","hit_factor":9.3545},{"match_name":"Nampa USPSA March 7th","match_date":"2020-03-07","stage_classifiercode":"06-03","member_number":"TY63273","first_name":"GREGG","last_name":"HARWOOD","classification":"B","division":"PRODUCTION","hit_factor":9.3545},{"match_name":"USPSA At ETTS Saturday","match_date":"2018-02-10","stage_classifiercode":"06-03","member_number":"TY95918","first_name":"RUSSELL","last_name":"PARKS","classification":"B","division":"PRODUCTION","hit_factor":9.3545},{"match_name":"SCCC CLASSIFIER MATCH 7_23_17","match_date":"2017-07-23","stage_classifiercode":"06-03","member_number":"A103214","first_name":"BRANDON","last_name":"JACKSON","classification":"U","division":"PRODUCTION","hit_factor":9.3511},{"match_name":"Coastal Area Practical Shooters  12-26-15","match_date":"2015-12-26","stage_classifiercode":"06-03","member_number":"A70752","first_name":"RICKY","last_name":"ANDERSON","classification":"A","division":"PRODUCTION","hit_factor":9.3511},{"match_name":"NISA April Classifer Match 2016","match_date":"2016-04-24","stage_classifiercode":"06-03","member_number":"TY30874","first_name":"DAVE","last_name":"MELLON","classification":"U","division":"PRODUCTION","hit_factor":9.3511},{"match_name":"MRPC USPSA July 2017","match_date":"2017-07-23","stage_classifiercode":"06-03","member_number":"A76290","first_name":"KURT","last_name":"SCHULZ","classification":"B","division":"PRODUCTION","hit_factor":9.3511},{"match_name":"Atlanta Practical Shooters March 2016 USPSA - Classifier Match","match_date":"2016-03-06","stage_classifiercode":"06-03","member_number":"A35948","first_name":"SHANE","last_name":"ALRED","classification":"U","division":"PRODUCTION","hit_factor":9.3511},{"match_name":"BRC_20180311","match_date":"2018-03-11","stage_classifiercode":"06-03","member_number":"A70801","first_name":"GLENN","last_name":"SULLIVAN","classification":"C","division":"PRODUCTION","hit_factor":9.3476},{"match_name":"MAPSA 2016.04.09","match_date":"2016-04-09","stage_classifiercode":"06-03","member_number":"A90913","first_name":"DAVID","last_name":"GILBERTSON","classification":"U","division":"PRODUCTION","hit_factor":9.3458},{"match_name":"Shasta Shooters 2020 Jun","match_date":"2020-06-13","stage_classifiercode":"06-03","member_number":"A127853","first_name":"CHAD","last_name":"RUSSELL","classification":"U","division":"PRODUCTION","hit_factor":9.3458},{"match_name":"CCPL 02142016","match_date":"2016-02-14","stage_classifiercode":"06-03","member_number":"A77571","first_name":"JULIAN","last_name":"DELGADO","classification":"B","division":"PRODUCTION","hit_factor":9.3458},{"match_name":"AREA 59  BIG BANG ALL CLASSIFIER","match_date":"2017-12-30","stage_classifiercode":"06-03","member_number":"A75504","first_name":"CLARK","last_name":"CONEBY","classification":"A","division":"PRODUCTION","hit_factor":9.3458},{"match_name":"MAPSA  2017 05 13","match_date":"2017-05-10","stage_classifiercode":"06-03","member_number":"A95926","first_name":"RICHARD","last_name":"SCHRADER","classification":"C","division":"PRODUCTION","hit_factor":9.3422},{"match_name":"Pioneer Action Shooters APR 2016","match_date":"2016-04-24","stage_classifiercode":"06-03","member_number":"L2161","first_name":"LOUIS","last_name":"CAMBRE","classification":"B","division":"PRODUCTION","hit_factor":9.3422},{"match_name":"OFGC Practical Pistol Match Feb 21 2016","match_date":"2016-02-21","stage_classifiercode":"06-03","member_number":"\"\"","first_name":"DAN","last_name":"GRIGGS","classification":"U","division":"PRODUCTION","hit_factor":9.3422},{"match_name":"BSPSC 2017 October Jacobi Concealed Carry","match_date":"2017-10-08","stage_classifiercode":"06-03","member_number":"A101416","first_name":"SLADE","last_name":"BETTENHAUSEN","classification":"U","division":"PRODUCTION","hit_factor":9.3401},{"match_name":"LCHG May 2018 USPSA Special Classifier","match_date":"2018-05-12","stage_classifiercode":"06-03","member_number":"A101416","first_name":"SLADE","last_name":"BETTENHAUSEN","classification":"C","division":"PRODUCTION","hit_factor":9.3385},{"match_name":"Griffin USPSA Match May 2017","match_date":"2017-05-20","stage_classifiercode":"06-03","member_number":"A77761","first_name":"BRIAN","last_name":"BILSKIE","classification":"B","division":"PRODUCTION","hit_factor":9.3371},{"match_name":"PCSI - July 2018 USPSA","match_date":"2018-07-07","stage_classifiercode":"06-03","member_number":"TY85908","first_name":"BOB","last_name":"LAUER","classification":"B","division":"PRODUCTION","hit_factor":9.3371},{"match_name":"Hampden RPC April USPSA Match","match_date":"2018-04-08","stage_classifiercode":"06-03","member_number":"A99037","first_name":"KIM","last_name":"DRINKWATER","classification":"D","division":"PRODUCTION","hit_factor":9.3371},{"match_name":"Richmond October 17-18-2015","match_date":"2015-10-17","stage_classifiercode":"06-03","member_number":"A86665","first_name":"RAYMOND","last_name":"CASTILLO","classification":"C","division":"PRODUCTION","hit_factor":9.3347},{"match_name":"BGS Hudson Week 3","match_date":"2018-01-07","stage_classifiercode":"06-03","member_number":"A92007","first_name":"DOUG","last_name":"FLETCHER","classification":"U","division":"PRODUCTION","hit_factor":9.3333},{"match_name":"LCSA USPSA Special Classifier Match","match_date":"2016-03-24","stage_classifiercode":"06-03","member_number":"a85192","first_name":"KELLY","last_name":"RADINSKY","classification":"C","division":"PRODUCTION","hit_factor":9.3294},{"match_name":"SCCC CLASSIFIER MATCH 7_23_17","match_date":"2017-07-23","stage_classifiercode":"06-03","member_number":"ty75615","first_name":"NELSON 2","last_name":"SID","classification":"A","division":"PRODUCTION","hit_factor":9.3284},{"match_name":"BORCC USPSA Classifier Match January 2017","match_date":"2017-01-22","stage_classifiercode":"06-03","member_number":"A91438","first_name":"ROB","last_name":"MILLS","classification":"D","division":"PRODUCTION","hit_factor":9.3284},{"match_name":"RBGC 2016-07-23","match_date":"2016-07-23","stage_classifiercode":"06-03","member_number":"FY70014","first_name":"KEITH","last_name":"HUNTER","classification":"B","division":"PRODUCTION","hit_factor":9.3284},{"match_name":"The Great Wet Classifier - Renton USPSA - November 2020 - NW05","match_date":"2020-11-22","stage_classifiercode":"06-03","member_number":"A111489","first_name":"SAUL","last_name":"CLINE","classification":"C","division":"PRODUCTION","hit_factor":9.3284},{"match_name":"Oakland County Sportsman's Club June 2021","match_date":"2021-06-05","stage_classifiercode":"06-03","member_number":"fy70358","first_name":"RONALD","last_name":"MOBLEY","classification":"C","division":"PRODUCTION","hit_factor":9.3284},{"match_name":"Moss Branch USPSA September 22nd Match","match_date":"2018-09-22","stage_classifiercode":"06-03","member_number":"A107951","first_name":"CHRIS","last_name":"ZOWODNY","classification":"B","division":"PRODUCTION","hit_factor":9.3284},{"match_name":"NHRPC - February 2020 USPSA","match_date":"2020-02-09","stage_classifiercode":"06-03","member_number":"A116304","first_name":"MARK","last_name":"GRAHAM","classification":"D","division":"PRODUCTION","hit_factor":9.3245},{"match_name":"WNPL USPSA Feb 2021","match_date":"2021-02-06","stage_classifiercode":"06-03","member_number":"A123413","first_name":"SHERWIN","last_name":"IBAY","classification":"C","division":"PRODUCTION","hit_factor":9.3245},{"match_name":"USPSA BDSC Baghdad Practical Shooters","match_date":"2017-01-21","stage_classifiercode":"06-03","member_number":"A100595","first_name":"RYAN","last_name":"TRIM","classification":"U","division":"PRODUCTION","hit_factor":9.3245},{"match_name":"AREA 59  SPRING ALL CLASSIFIER","match_date":"2018-03-31","stage_classifiercode":"06-03","member_number":"A98549","first_name":"KEVIN","last_name":"CHU","classification":"U","division":"PRODUCTION","hit_factor":9.3212},{"match_name":"Piscataqua  Master Blasters USPSA Special Classifier","match_date":"2017-12-03","stage_classifiercode":"06-03","member_number":"A93445","first_name":"DARREN","last_name":"LANDINO","classification":"B","division":"PRODUCTION","hit_factor":9.3197},{"match_name":"Piscataqua Master Blasters USPSA","match_date":"2018-09-02","stage_classifiercode":"06-03","member_number":"A77713","first_name":"GREGORY","last_name":"SMUSHKIN","classification":"B","division":"PRODUCTION","hit_factor":9.3197},{"match_name":"Judes Peanut Butter Scissorhands","match_date":"2016-06-01","stage_classifiercode":"06-03","member_number":"A96188","first_name":"GRANT","last_name":"BOYLES","classification":"U","division":"PRODUCTION","hit_factor":9.3174},{"match_name":"2016 Columbia Cascade Section Championship","match_date":"2016-08-12","stage_classifiercode":"06-03","member_number":"TY67840","first_name":"MARC","last_name":"ROCQUE","classification":"C","division":"PRODUCTION","hit_factor":9.3162},{"match_name":"SOAP April 2021 USPSA Match","match_date":"2021-04-10","stage_classifiercode":"06-03","member_number":"A131150","first_name":"RICH","last_name":"JUINIO","classification":"D","division":"PRODUCTION","hit_factor":9.3156},{"match_name":"Pioneer Action Shooters APR 2016","match_date":"2016-04-24","stage_classifiercode":"06-03","member_number":"A90491","first_name":"WESLEY","last_name":"MILLER","classification":"U","division":"PRODUCTION","hit_factor":9.3156},{"match_name":"NVSA USPSA Classifer Match 1605-2","match_date":"2016-05-21","stage_classifiercode":"06-03","member_number":"A82162","first_name":"WILLIAM","last_name":"NITTO","classification":"C","division":"PRODUCTION","hit_factor":9.311},{"match_name":"OPSC USPSA 8-14-2016","match_date":"2016-08-14","stage_classifiercode":"06-03","member_number":"A2320","first_name":"JOE","last_name":"CERVERA","classification":"D","division":"PRODUCTION","hit_factor":9.311},{"match_name":"ORPCI 2016.10.15 Pistol","match_date":"2016-10-15","stage_classifiercode":"06-03","member_number":"TY82031","first_name":"JEFF","last_name":"JONES","classification":"B","division":"PRODUCTION","hit_factor":9.3103},{"match_name":"3rd Annual CSA Classifier Classic","match_date":"2017-03-12","stage_classifiercode":"06-03","member_number":"A87413","first_name":"JEFF","last_name":"ADKINS","classification":"B","division":"PRODUCTION","hit_factor":9.3069},{"match_name":"MPSA 101516","match_date":"2016-10-15","stage_classifiercode":"06-03","member_number":"A90453","first_name":"JASON","last_name":"PETRO","classification":"C","division":"PRODUCTION","hit_factor":9.3023},{"match_name":"ORGC Independance Day  2018 Pistol Match","match_date":"2018-07-01","stage_classifiercode":"06-03","member_number":"A107768","first_name":"STEVE","last_name":"VERDI","classification":"U","division":"PRODUCTION","hit_factor":9.3023},{"match_name":"The Irbil Open","match_date":"2017-05-14","stage_classifiercode":"06-03","member_number":"\"\"","first_name":"GARY","last_name":"KEENEY","classification":"C","division":"PRODUCTION","hit_factor":9.3023},{"match_name":"RBGC 2016-07-23","match_date":"2016-07-23","stage_classifiercode":"06-03","member_number":"A90273","first_name":"ISMAEL","last_name":"VEGA","classification":"B","division":"PRODUCTION","hit_factor":9.3023},{"match_name":"BGS  Hudson Week 2","match_date":"2018-12-10","stage_classifiercode":"06-03","member_number":"A96369","first_name":"JUSTIN","last_name":"BOCK","classification":"U","division":"PRODUCTION","hit_factor":9.3023},{"match_name":"Detroit Sportsmens Congress - May 21 2017","match_date":"2017-05-21","stage_classifiercode":"06-03","member_number":"A65724","first_name":"ROB","last_name":"DEGRYSE","classification":"C","division":"PRODUCTION","hit_factor":9.3023},{"match_name":"PCSI - July 2018 USPSA","match_date":"2018-07-07","stage_classifiercode":"06-03","member_number":"A78380","first_name":"PAUL","last_name":"MORETTI","classification":"C","division":"PRODUCTION","hit_factor":9.3023},{"match_name":"Alpha Mike March 2017","match_date":"2017-03-19","stage_classifiercode":"06-03","member_number":"A91712","first_name":"GEORGE","last_name":"CONWILL","classification":"C","division":"PRODUCTION","hit_factor":9.3023},{"match_name":"SPSA USPSA April 4th Sat match","match_date":"2017-04-22","stage_classifiercode":"06-03","member_number":"TY32558","first_name":"KEN","last_name":"TISDALE","classification":"A","division":"PRODUCTION","hit_factor":9.3023},{"match_name":"MRCPS  USPSA MARCH","match_date":"2017-03-19","stage_classifiercode":"06-03","member_number":"A94334","first_name":"NOLAN","last_name":"ROTHFUS","classification":"X","division":"PRODUCTION","hit_factor":9.3023},{"match_name":"SAPSA July 2016","match_date":"2016-07-16","stage_classifiercode":"06-03","member_number":"A68933","first_name":"JEFF","last_name":"BILOTTI","classification":"B","division":"PRODUCTION","hit_factor":9.2977},{"match_name":"DRRC  Mar2017","match_date":"2017-03-04","stage_classifiercode":"06-03","member_number":"TY91567","first_name":"ADAM","last_name":"BELFUS","classification":"U","division":"PRODUCTION","hit_factor":9.2937},{"match_name":"Rankin Field Sunday USPSA","match_date":"2017-11-19","stage_classifiercode":"06-03","member_number":"\"\"","first_name":"JEFFERSON","last_name":"CAMARCE","classification":"U","division":"PRODUCTION","hit_factor":9.2937},{"match_name":"Detroit Sportsmens Congress - May 21 2017","match_date":"2017-05-21","stage_classifiercode":"06-03","member_number":"A102292","first_name":"FRANK","last_name":"MAROTTA","classification":"U","division":"PRODUCTION","hit_factor":9.2937},{"match_name":"Richmond Hot Shots February 20-21-2021 USPSA Pistol","match_date":"2021-02-20","stage_classifiercode":"06-03","member_number":"A129642","first_name":"ANDREW","last_name":"MIN","classification":"C","division":"PRODUCTION","hit_factor":9.2937},{"match_name":"OVSC CLASSIFIER PRACTICE","match_date":"2018-08-19","stage_classifiercode":"06-03","member_number":"ty77598","first_name":"SCOTT","last_name":"GRUENBERG","classification":"A","division":"PRODUCTION","hit_factor":9.2937},{"match_name":"Hopkinton August 2017","match_date":"2017-08-05","stage_classifiercode":"06-03","member_number":"TY79215","first_name":"GENE","last_name":"KIM","classification":"C","division":"PRODUCTION","hit_factor":9.2929},{"match_name":"CVSC  07-31-2016","match_date":"2016-07-31","stage_classifiercode":"06-03","member_number":"\"\"","first_name":"JEFFREY","last_name":"LUM","classification":"U","division":"PRODUCTION","hit_factor":9.292},{"match_name":"Devil Dog USPSA Classifier Match-Saturday Session","match_date":"2018-03-10","stage_classifiercode":"06-03","member_number":"A99682","first_name":"DENIS","last_name":"OLEYNIK","classification":"A","division":"PRODUCTION","hit_factor":9.2915},{"match_name":"FBPPC FEBRUARY 2016 MATCH","match_date":"2016-02-13","stage_classifiercode":"06-03","member_number":"PEN","first_name":"BARNABIE","last_name":"MEJIA","classification":"U","division":"PRODUCTION","hit_factor":9.2891},{"match_name":"Richmond October 17-18-2015","match_date":"2015-10-17","stage_classifiercode":"06-03","member_number":"A86976","first_name":"MICHAEL","last_name":"BOUVIER","classification":"C","division":"PRODUCTION","hit_factor":9.2851},{"match_name":"Lafayette Practical Shooters - WEDNESDAY - Oct 10","match_date":"2018-10-10","stage_classifiercode":"06-03","member_number":"A109832","first_name":"KYLE","last_name":"PIRTLE","classification":"C","division":"PRODUCTION","hit_factor":9.2851},{"match_name":"BORCC USPSA July 2016","match_date":"2016-07-24","stage_classifiercode":"06-03","member_number":"A81616","first_name":"PAM","last_name":"VERVILLE","classification":"C","division":"PRODUCTION","hit_factor":9.2843},{"match_name":"Triforce Practical Shooters at BigWoodsGoods 6-22-17","match_date":"2017-06-22","stage_classifiercode":"06-03","member_number":"A48682","first_name":"PAUL","last_name":"SMITH","classification":"C","division":"PRODUCTION","hit_factor":9.2803},{"match_name":"RCPS USPSA November 17","match_date":"2018-11-17","stage_classifiercode":"06-03","member_number":"\"\"","first_name":"ROBERT","last_name":"OWENS","classification":"U","division":"PRODUCTION","hit_factor":9.2803},{"match_name":"PSAC 20200705","match_date":"2020-07-05","stage_classifiercode":"06-03","member_number":"L4490","first_name":"GENE","last_name":"BRAY","classification":"B","division":"PRODUCTION","hit_factor":9.2784},{"match_name":"USPSA BDSC Baghdad Practical Shooters","match_date":"2017-01-21","stage_classifiercode":"06-03","member_number":"\"\"","first_name":"CRAIG","last_name":"JORDAN","classification":"U","division":"PRODUCTION","hit_factor":9.2784},{"match_name":"SOAP April 2021 USPSA Match","match_date":"2021-04-10","stage_classifiercode":"06-03","member_number":"A103694","first_name":"GEORGE","last_name":"WAGNER","classification":"C","division":"PRODUCTION","hit_factor":9.2764},{"match_name":"Fairfax PS USPSA June 2017","match_date":"2017-06-27","stage_classifiercode":"06-03","member_number":"L4266","first_name":"RICK","last_name":"CASAREZ","classification":"C","division":"PRODUCTION","hit_factor":9.2764},{"match_name":"USPSA AR16 The Ancient and Honorable Pistol and Rifle Society of Baxter 8/7/21","match_date":"2021-08-07","stage_classifiercode":"06-03","member_number":"A136265","first_name":"JEREMY","last_name":"SMITH","classification":"\"\"","division":"PRODUCTION","hit_factor":9.2764},{"match_name":"SPSA USPSA April 4th Sat match","match_date":"2017-04-22","stage_classifiercode":"06-03","member_number":"A91991","first_name":"GLENN","last_name":"GREEN","classification":"C","division":"PRODUCTION","hit_factor":9.2764},{"match_name":"Richmond Hot Shots February 20-21-2021 USPSA Pistol","match_date":"2021-02-20","stage_classifiercode":"06-03","member_number":"A132722","first_name":"CHRISTIAN","last_name":"LEGASPI","classification":"U","division":"PRODUCTION","hit_factor":9.2754},{"match_name":"Emmett June Match","match_date":"2018-06-23","stage_classifiercode":"06-03","member_number":"A111211","first_name":"BRYAN","last_name":"MONTGOMERY","classification":"U","division":"PRODUCTION","hit_factor":9.2754},{"match_name":"EWPSA 2018-07","match_date":"2018-07-14","stage_classifiercode":"06-03","member_number":"TY49461","first_name":"DAVID","last_name":"BLOSSER","classification":"M","division":"PRODUCTION","hit_factor":9.2742},{"match_name":"HOPS USPSA 081917","match_date":"2017-08-19","stage_classifiercode":"06-03","member_number":"A85006","first_name":"MIKE","last_name":"HACKEMEYER","classification":"B","division":"PRODUCTION","hit_factor":9.2715},{"match_name":"WINTER ALL CLASSIFIER","match_date":"2020-01-02","stage_classifiercode":"06-03","member_number":"TY123776","first_name":"PAUL","last_name":"BEAVERS","classification":"U","division":"PRODUCTION","hit_factor":9.2715},{"match_name":"Range E11even March 2017","match_date":"2017-03-25","stage_classifiercode":"06-03","member_number":"A97069","first_name":"JUSTIN","last_name":"JOHNSON","classification":"C","division":"PRODUCTION","hit_factor":9.2702},{"match_name":"RBPS April Pistol Match","match_date":"2017-04-15","stage_classifiercode":"06-03","member_number":"A84691","first_name":"MIKE","last_name":"ATKINS","classification":"C","division":"PRODUCTION","hit_factor":9.2678},{"match_name":"BUAS January Match","match_date":"2018-01-14","stage_classifiercode":"06-03","member_number":"ty73663","first_name":"JAY","last_name":"BUCKLEY","classification":"B","division":"PRODUCTION","hit_factor":9.2678},{"match_name":"ECPS USPSA 19 Aug 17","match_date":"2017-08-19","stage_classifiercode":"06-03","member_number":"A87651","first_name":"JONATHAN","last_name":"NEELY","classification":"U","division":"PRODUCTION","hit_factor":9.2672},{"match_name":"FBPPC FEBRUARY 2016 MATCH","match_date":"2016-02-13","stage_classifiercode":"06-03","member_number":"A92593","first_name":"TIM","last_name":"MARTIN","classification":"B","division":"PRODUCTION","hit_factor":9.2628},{"match_name":"RBPS April Pistol Match","match_date":"2017-04-15","stage_classifiercode":"06-03","member_number":"A101231","first_name":"MIKE","last_name":"TALBOT","classification":"U","division":"PRODUCTION","hit_factor":9.2628},{"match_name":"Palmetto Gun Club - November 2016 USPSA","match_date":"2016-11-05","stage_classifiercode":"06-03","member_number":"A90054","first_name":"DOUG","last_name":"LOWE","classification":"D","division":"PRODUCTION","hit_factor":9.2628},{"match_name":"Brazosland Pistoleros September 17 2017 USPSA","match_date":"2017-09-17","stage_classifiercode":"06-03","member_number":"\"\"","first_name":"CHRIS","last_name":"HERNANDEZ","classification":"U","division":"PRODUCTION","hit_factor":9.2593},{"match_name":"AAFG USPSA July 30 Pistol  Classifier","match_date":"2016-07-30","stage_classifiercode":"06-03","member_number":"PEN","first_name":"ZAK","last_name":"SPICER","classification":"U","division":"PRODUCTION","hit_factor":9.2593},{"match_name":"PCSI - July 2018 USPSA","match_date":"2018-07-07","stage_classifiercode":"06-03","member_number":"A111855","first_name":"ZIYI","last_name":"SONG","classification":"U","division":"PRODUCTION","hit_factor":9.2575},{"match_name":"Springfield Tactical Shooters 03/012018","match_date":"2018-03-01","stage_classifiercode":"06-03","member_number":"A99127","first_name":"STEVE","last_name":"FRAZIER","classification":"C","division":"PRODUCTION","hit_factor":9.2555},{"match_name":"Kabul 25 May 2018","match_date":"2018-05-25","stage_classifiercode":"06-03","member_number":"\"\"","first_name":"YETI","last_name":"YETI","classification":"U","division":"PRODUCTION","hit_factor":9.254},{"match_name":"Nampa USPSA March 7th","match_date":"2020-03-07","stage_classifiercode":"06-03","member_number":"A113753","first_name":"SCOTT","last_name":"CROSWELL","classification":"C","division":"PRODUCTION","hit_factor":9.254},{"match_name":"APSC USPSA  3-7-20","match_date":"2020-03-06","stage_classifiercode":"06-03","member_number":"A126692","first_name":"SEAN","last_name":"YATES","classification":"U","division":"PRODUCTION","hit_factor":9.2507},{"match_name":"SOAP April 2021 USPSA Match","match_date":"2021-04-10","stage_classifiercode":"06-03","member_number":"L1350","first_name":"GARY","last_name":"ORR","classification":"B","division":"PRODUCTION","hit_factor":9.2507},{"match_name":"OPSC USPSA 8-14-2016","match_date":"2016-08-14","stage_classifiercode":"06-03","member_number":"A74905","first_name":"ZACK","last_name":"SIMS","classification":"C","division":"PRODUCTION","hit_factor":9.2486},{"match_name":"Parma 2018 July USPSA","match_date":"2018-07-21","stage_classifiercode":"06-03","member_number":"A111211","first_name":"BRYAN","last_name":"MONTGOMERY","classification":"D","division":"PRODUCTION","hit_factor":9.2486},{"match_name":"Richmond  Boro Gun Club December 2017 USPSA Pistol Match","match_date":"2017-12-02","stage_classifiercode":"06-03","member_number":"A100170","first_name":"RYAN","last_name":"CHAN","classification":"D","division":"PRODUCTION","hit_factor":9.2486},{"match_name":"FVPS October USPSA Match","match_date":"2018-10-06","stage_classifiercode":"06-03","member_number":"A106704","first_name":"CHAD","last_name":"SINKLER","classification":"C","division":"PRODUCTION","hit_factor":9.2421},{"match_name":"TPS USPSA -  September Match 2021","match_date":"2021-09-04","stage_classifiercode":"06-03","member_number":"A134176","first_name":"JOSHUA","last_name":"BEIZER","classification":"U","division":"PRODUCTION","hit_factor":9.2421},{"match_name":"HSC USPSA June 2016","match_date":"2016-06-04","stage_classifiercode":"06-03","member_number":"\"\"","first_name":"BOBBY","last_name":"HARGROVE","classification":"C","division":"PRODUCTION","hit_factor":9.2421},{"match_name":"TriggerGuard USPSA Classifier Match","match_date":"2018-03-24","stage_classifiercode":"06-03","member_number":"TY94567","first_name":"CHRIS","last_name":"KRUEGER","classification":"U","division":"PRODUCTION","hit_factor":9.2421},{"match_name":"WSRC USPSA 7/15/2017","match_date":"2017-07-15","stage_classifiercode":"06-03","member_number":"A101790","first_name":"SCOTT","last_name":"CORRIGAN","classification":"U","division":"PRODUCTION","hit_factor":9.2402},{"match_name":"Detroit Sportsmens Congress - May 21 2017","match_date":"2017-05-21","stage_classifiercode":"06-03","member_number":"PEN","first_name":"DANIELLE","last_name":"ROSEBROOK","classification":"U","division":"PRODUCTION","hit_factor":9.2397},{"match_name":"Benton Gun Club-USPSA Classifier Match","match_date":"2016-04-10","stage_classifiercode":"06-03","member_number":"\"\"","first_name":"SHAUN","last_name":"ROBERSON","classification":"X","division":"PRODUCTION","hit_factor":9.2366},{"match_name":"BRC_20170409","match_date":"2017-04-09","stage_classifiercode":"06-03","member_number":"\"\"","first_name":"STEVE","last_name":"BERGUM","classification":"U","division":"PRODUCTION","hit_factor":9.2336},{"match_name":"Rankin Field Sunday USPSA","match_date":"2018-07-15","stage_classifiercode":"06-03","member_number":"A82654","first_name":"JIMMIE","last_name":"RABINA","classification":"C","division":"PRODUCTION","hit_factor":9.2336},{"match_name":"Parma 2018 July USPSA","match_date":"2018-07-21","stage_classifiercode":"06-03","member_number":"A103721","first_name":"KYLA","last_name":"AUSTIN","classification":"C","division":"PRODUCTION","hit_factor":9.2336},{"match_name":"Oakland County Sportsman's Club June 2021","match_date":"2021-06-05","stage_classifiercode":"06-03","member_number":"TY84334","first_name":"JIM","last_name":"GUTHEIL","classification":"C","division":"PRODUCTION","hit_factor":9.2336},{"match_name":"Bass River May 1  2016","match_date":"2016-05-01","stage_classifiercode":"06-03","member_number":"A90715","first_name":"NICHOLAS","last_name":"ORLANDO","classification":"U","division":"PRODUCTION","hit_factor":9.2308},{"match_name":"BHPC USPSA Monthly Match 9-11","match_date":"2016-09-11","stage_classifiercode":"06-03","member_number":"\"\"","first_name":"JEREMY","last_name":"DUVEL","classification":"U","division":"PRODUCTION","hit_factor":9.2308},{"match_name":"MAPSA 2016.04.09","match_date":"2016-04-09","stage_classifiercode":"06-03","member_number":"a71454","first_name":"TOM","last_name":"TOLLIVER","classification":"C","division":"PRODUCTION","hit_factor":9.2279},{"match_name":"Crooked Creek Pistol League - May 21-22_2016","match_date":"2016-05-21","stage_classifiercode":"06-03","member_number":"A93643","first_name":"IAN","last_name":"CONANT","classification":"C","division":"PRODUCTION","hit_factor":9.2279},{"match_name":"APSC USPSA 7-7-2018","match_date":"2018-07-07","stage_classifiercode":"06-03","member_number":"A84413","first_name":"JASON","last_name":"ARMSTRONG","classification":"B","division":"PRODUCTION","hit_factor":9.2251},{"match_name":"Laser Ninja Dragon League July Special Classifier","match_date":"2018-07-01","stage_classifiercode":"06-03","member_number":"TY99871","first_name":"ROBERT","last_name":"DUNNING","classification":"C","division":"PRODUCTION","hit_factor":9.2251},{"match_name":"HAS April 2016 Pistol Match","match_date":"2016-04-10","stage_classifiercode":"06-03","member_number":"TY18014","first_name":"JOHN","last_name":"KRYGOWSKI","classification":"U","division":"PRODUCTION","hit_factor":9.2251},{"match_name":"HOPS USPSA 081917","match_date":"2017-08-19","stage_classifiercode":"06-03","member_number":"TY85409","first_name":"CHRIS","last_name":"KAISER","classification":"C","division":"PRODUCTION","hit_factor":9.2251},{"match_name":"Emmett June Match","match_date":"2018-06-23","stage_classifiercode":"06-03","member_number":"A108234","first_name":"ALEXANDRA","last_name":"DEES","classification":"D","division":"PRODUCTION","hit_factor":9.2247},{"match_name":"ESPS USPSA OCT","match_date":"2016-10-22","stage_classifiercode":"06-03","member_number":"A82429","first_name":"DAVID","last_name":"HEALEY 2","classification":"A","division":"PRODUCTION","hit_factor":9.2166},{"match_name":"Pioneer Action Shooters May 2017","match_date":"2017-05-28","stage_classifiercode":"06-03","member_number":"A101134","first_name":"RICH","last_name":"ENGLISH","classification":"C","division":"PRODUCTION","hit_factor":9.2166},{"match_name":"SPSA USPSA April 4th Sat match","match_date":"2017-04-22","stage_classifiercode":"06-03","member_number":"TY60702","first_name":"MICHAEL","last_name":"DENOBLE","classification":"C","division":"PRODUCTION","hit_factor":9.2166},{"match_name":"NRG September 10th 2016","match_date":"2016-09-10","stage_classifiercode":"06-03","member_number":"A94556","first_name":"DEREK","last_name":"MCDONALD","classification":"U","division":"PRODUCTION","hit_factor":9.2157},{"match_name":"RPS May 2018 USPSA Match","match_date":"2018-05-12","stage_classifiercode":"06-03","member_number":"\"\"","first_name":"JASON","last_name":"HUNNICUTT","classification":"U","division":"PRODUCTION","hit_factor":9.2119},{"match_name":"Brazosland Pistoleros 2016-05-15 USPSA","match_date":"2016-05-15","stage_classifiercode":"06-03","member_number":"A87414","first_name":"TOM","last_name":"ECHOLS","classification":"C","division":"PRODUCTION","hit_factor":9.2105},{"match_name":"Matamoras USPSA March 2017","match_date":"2017-04-02","stage_classifiercode":"06-03","member_number":"A101478","first_name":"RICHARD S","last_name":"BAUM","classification":"U","division":"PRODUCTION","hit_factor":9.2081},{"match_name":"NVSA USPSA 1710","match_date":"2017-10-01","stage_classifiercode":"06-03","member_number":"TY85343","first_name":"ALAN","last_name":"WONG","classification":"C","division":"PRODUCTION","hit_factor":9.2042},{"match_name":"Hopkinton August 2017","match_date":"2017-08-05","stage_classifiercode":"06-03","member_number":"A87150","first_name":"CODY","last_name":"LANDRY","classification":"B","division":"PRODUCTION","hit_factor":9.2025},{"match_name":"MAPSA 2016.04.09","match_date":"2016-04-09","stage_classifiercode":"06-03","member_number":"A72016","first_name":"SAMUEL","last_name":"SCHMITT","classification":"C","division":"PRODUCTION","hit_factor":9.2019},{"match_name":"SLOSA September 2018 USPSA Match","match_date":"2018-09-08","stage_classifiercode":"06-03","member_number":"\"\"","first_name":"CLAUDIO","last_name":"ANISCO","classification":"\"\"","division":"PRODUCTION","hit_factor":9.2019},{"match_name":"ORPCI 2018.03.31 USPSA Special","match_date":"2018-03-31","stage_classifiercode":"06-03","member_number":"A71260","first_name":"RICH","last_name":"ST. CLAIR","classification":"A","division":"PRODUCTION","hit_factor":9.2019},{"match_name":"ACC July 26th USPSA","match_date":"2020-07-26","stage_classifiercode":"06-03","member_number":"TY74696","first_name":"MICHAEL","last_name":"SNOW","classification":"C","division":"PRODUCTION","hit_factor":9.2019},{"match_name":"SFPS 10-4-20 USPSA","match_date":"2020-10-04","stage_classifiercode":"06-03","member_number":"FY66155","first_name":"PETE","last_name":"HEINTZ","classification":"B","division":"PRODUCTION","hit_factor":9.1996},{"match_name":"SFPS 10-4-20 USPSA","match_date":"2020-10-04","stage_classifiercode":"06-03","member_number":"A112086","first_name":"TOM","last_name":"MARSH","classification":"C","division":"PRODUCTION","hit_factor":9.1996},{"match_name":"March 2017 PCSI USPSA","match_date":"2017-03-04","stage_classifiercode":"06-03","member_number":"A98812","first_name":"LUKE","last_name":"CAO","classification":"C","division":"PRODUCTION","hit_factor":9.1996},{"match_name":"Pioneer Action Shooters USPSA 5-27-18","match_date":"2018-05-27","stage_classifiercode":"06-03","member_number":"FY91061","first_name":"JOSEPH","last_name":"FLANAGAN","classification":"B","division":"PRODUCTION","hit_factor":9.1996},{"match_name":"Crooked Creek Pistol League - October 2020","match_date":"2020-10-17","stage_classifiercode":"06-03","member_number":"TY71574","first_name":"DAVID","last_name":"SERKSNYS","classification":"C","division":"PRODUCTION","hit_factor":9.1995},{"match_name":"CRGC USPSA Match 7-22-18","match_date":"2018-07-22","stage_classifiercode":"06-03","member_number":"A109705","first_name":"JASON","last_name":"CHAMPAGNE","classification":"\"\"","division":"PRODUCTION","hit_factor":9.1977},{"match_name":"Dundee Practical Shooters - March 24 2018 - Points","match_date":"2018-03-24","stage_classifiercode":"06-03","member_number":"L3882","first_name":"TONY","last_name":"FUNG","classification":"D","division":"PRODUCTION","hit_factor":9.1954},{"match_name":"GoShoot Outdoors March 14th","match_date":"2020-03-14","stage_classifiercode":"06-03","member_number":"A125069","first_name":"BENJAMIN","last_name":"HUMPHRIES","classification":"D","division":"PRODUCTION","hit_factor":9.1932},{"match_name":"Richmond Hot Shots October 17-18-2020 USPSA Pistol","match_date":"2020-10-17","stage_classifiercode":"06-03","member_number":"FY112519","first_name":"CYRUS","last_name":"YU","classification":"C","division":"PRODUCTION","hit_factor":9.1932},{"match_name":"NRG September 10th 2016","match_date":"2016-09-10","stage_classifiercode":"06-03","member_number":"TY70633","first_name":"VAN","last_name":"DUNCAN","classification":"C","division":"PRODUCTION","hit_factor":9.1912},{"match_name":"WGC August 2017 USPSA Classifier","match_date":"2017-08-13","stage_classifiercode":"06-03","member_number":"A80843","first_name":"T.C.","last_name":"TRICHEL","classification":"D","division":"PRODUCTION","hit_factor":9.1912},{"match_name":"Detroit Sportsmens Congress - May 21 2017","match_date":"2017-05-21","stage_classifiercode":"06-03","member_number":"A102556","first_name":"ZACHARY","last_name":"COOPER","classification":"U","division":"PRODUCTION","hit_factor":9.1912},{"match_name":"BUAS January Match","match_date":"2018-01-14","stage_classifiercode":"06-03","member_number":"a99324","first_name":"ANDREW","last_name":"DANIKAS","classification":"U","division":"PRODUCTION","hit_factor":9.1912},{"match_name":"AREA 59  BIG BANG ALL CLASSIFIER","match_date":"2017-12-30","stage_classifiercode":"06-03","member_number":"\"\"","first_name":"ROBERT","last_name":"FRAZIER","classification":"U","division":"PRODUCTION","hit_factor":9.1908},{"match_name":"HOPS USPSA 081917","match_date":"2017-08-19","stage_classifiercode":"06-03","member_number":"A63252","first_name":"DAVID","last_name":"BAKER","classification":"B","division":"PRODUCTION","hit_factor":9.1846},{"match_name":"BHPSC Weekly Match 9-30-2016","match_date":"2016-09-30","stage_classifiercode":"06-03","member_number":"\"\"","first_name":"RIICHIRO","last_name":"SUZUKI","classification":"C","division":"PRODUCTION","hit_factor":9.1837},{"match_name":"Griffin USPSA Match May 2017","match_date":"2017-05-20","stage_classifiercode":"06-03","member_number":"A97938","first_name":"BRIAN","last_name":"HARRIS","classification":"C","division":"PRODUCTION","hit_factor":9.1827},{"match_name":"BRRC USPSA MAY 14 2016","match_date":"2016-05-14","stage_classifiercode":"06-03","member_number":"TY94469","first_name":"CONNOR","last_name":"MOLLOY","classification":"C","division":"PRODUCTION","hit_factor":9.1827},{"match_name":"MAPSA 2016.04.09","match_date":"2016-04-09","stage_classifiercode":"06-03","member_number":"A83098","first_name":"KRYSTAL","last_name":"DUNN","classification":"C","division":"PRODUCTION","hit_factor":9.1797},{"match_name":"Space Coast Practical Shooters","match_date":"2017-12-02","stage_classifiercode":"06-03","member_number":"A106843","first_name":"BRETT","last_name":"ALT","classification":"U","division":"PRODUCTION","hit_factor":9.176},{"match_name":"Rankin Field February Sunday USPSA","match_date":"2020-02-16","stage_classifiercode":"06-03","member_number":"TY105155","first_name":"ALBERT","last_name":"COITO","classification":"B","division":"PRODUCTION","hit_factor":9.176},{"match_name":"OK Corral USPSA Classifier Match Feb 18 2017","match_date":"2017-02-18","stage_classifiercode":"06-03","member_number":"A72578","first_name":"MARIO","last_name":"OJEDA","classification":"\"\"","division":"PRODUCTION","hit_factor":9.1743},{"match_name":"MCPSL Pistol 4-8-17","match_date":"2017-04-08","stage_classifiercode":"06-03","member_number":"TY83224","first_name":"DEAN","last_name":"STRANSKY","classification":"C","division":"PRODUCTION","hit_factor":9.1743},{"match_name":"GTR USPSA Tues April 19","match_date":"2016-04-19","stage_classifiercode":"06-03","member_number":"A77144","first_name":"ALEXANDRA","last_name":"FERRIS","classification":"C","division":"PRODUCTION","hit_factor":9.1743},{"match_name":"USPSA BDSC Baghdad Practical Shooters","match_date":"2017-01-21","stage_classifiercode":"06-03","member_number":"\"\"","first_name":"MIKE","last_name":"REAGAN","classification":"U","division":"PRODUCTION","hit_factor":9.1743},{"match_name":"Bayou City USPSA Weekly Mar 18","match_date":"2021-03-18","stage_classifiercode":"06-03","member_number":"A61565","first_name":"GREG","last_name":"WHITE","classification":"C","division":"PRODUCTION","hit_factor":9.1703},{"match_name":"APS August 1st Monthly USPSA Match  Classifier Match","match_date":"2021-08-01","stage_classifiercode":"06-03","member_number":"A129664","first_name":"JERMAINE","last_name":"BROWN","classification":"C","division":"PRODUCTION","hit_factor":9.1659},{"match_name":"Crooked Creek Pistol League - October 2020","match_date":"2020-10-17","stage_classifiercode":"06-03","member_number":"A60495","first_name":"JEFF","last_name":"LAFLAME","classification":"B","division":"PRODUCTION","hit_factor":9.1659},{"match_name":"Strongpoint March 2017 Match","match_date":"2017-03-04","stage_classifiercode":"06-03","member_number":"A96831","first_name":"DAVID","last_name":"OLGUIN","classification":"B","division":"PRODUCTION","hit_factor":9.1629},{"match_name":"CSS July Classifier 2017","match_date":"2017-07-15","stage_classifiercode":"06-03","member_number":"\"\"","first_name":"JAMES","last_name":"BIBLE","classification":"U","division":"PRODUCTION","hit_factor":9.1603},{"match_name":"NVSA USPSA Classifer Match 1605-2","match_date":"2016-05-21","stage_classifiercode":"06-03","member_number":"TY88318","first_name":"MIKE","last_name":"HALL","classification":"D","division":"PRODUCTION","hit_factor":9.1589},{"match_name":"HOPS USPSA 081917","match_date":"2017-08-19","stage_classifiercode":"06-03","member_number":"\"\"","first_name":"CRAIG","last_name":"ADAMS","classification":"B","division":"PRODUCTION","hit_factor":9.1589},{"match_name":"SCCCJULYCLASSIFIER2016","match_date":"2016-07-30","stage_classifiercode":"06-03","member_number":"a86735","first_name":"JOHN","last_name":"COURIS","classification":"U","division":"PRODUCTION","hit_factor":9.1571},{"match_name":"Uspsa Classifier","match_date":"2018-05-06","stage_classifiercode":"06-03","member_number":"TYF88338","first_name":"LISE","last_name":"MAHONEY","classification":"C","division":"PRODUCTION","hit_factor":9.1516},{"match_name":"Shasta Shooters 2020 Jun","match_date":"2020-06-13","stage_classifiercode":"06-03","member_number":"A102631","first_name":"RICK","last_name":"FREITAS","classification":"C","division":"PRODUCTION","hit_factor":9.1516},{"match_name":"Shoot GTR USPSA Sep 6","match_date":"2016-09-06","stage_classifiercode":"06-03","member_number":"A95691","first_name":"BENETT","last_name":"KEITH","classification":"U","division":"PRODUCTION","hit_factor":9.1503},{"match_name":"ALL CLASSIFIER SUMMERSLAM  -  AREA 59 2018","match_date":"2018-06-30","stage_classifiercode":"06-03","member_number":"TY93921","first_name":"PAT","last_name":"BYRNE","classification":"U","division":"PRODUCTION","hit_factor":9.1503},{"match_name":"Homestead USPSA Match","match_date":"2016-09-17","stage_classifiercode":"06-03","member_number":"\"\"","first_name":"LISANDRO","last_name":"DE MAYO","classification":"X","division":"PRODUCTION","hit_factor":9.1503},{"match_name":"SMPS March 2016","match_date":"2016-03-13","stage_classifiercode":"06-03","member_number":"TY77488","first_name":"OLEG","last_name":"SHEIN","classification":"B","division":"PRODUCTION","hit_factor":9.1491},{"match_name":"WNPL USPSA Feb 2021","match_date":"2021-02-06","stage_classifiercode":"06-03","member_number":"A81703","first_name":"DAVE","last_name":"BORWICK","classification":"B","division":"PRODUCTION","hit_factor":9.1451},{"match_name":"EDPS USPSA November 7","match_date":"2020-11-07","stage_classifiercode":"06-03","member_number":"TY116069","first_name":"PAUL","last_name":"QUERIN","classification":"U","division":"PRODUCTION","hit_factor":9.1418},{"match_name":"USPSA BDSC Baghdad Practical Shooters","match_date":"2017-01-21","stage_classifiercode":"06-03","member_number":"F100143","first_name":"ODIS","last_name":"GOODNIGHT","classification":"U","division":"PRODUCTION","hit_factor":9.1408},{"match_name":"SAPSA January 2018","match_date":"2018-01-20","stage_classifiercode":"06-03","member_number":"TY62017","first_name":"STEVEN","last_name":"LOH","classification":"B","division":"PRODUCTION","hit_factor":9.1351},{"match_name":"Springfield Tactical Shooters 04-07-2016","match_date":"2016-04-07","stage_classifiercode":"06-03","member_number":"A63433","first_name":"ROB","last_name":"LEWIS","classification":"C","division":"PRODUCTION","hit_factor":9.1351},{"match_name":"MRCPS  USPSA MARCH","match_date":"2017-03-19","stage_classifiercode":"06-03","member_number":"TY94144","first_name":"JACOB","last_name":"ZIELIE","classification":"C","division":"PRODUCTION","hit_factor":9.1342},{"match_name":"Central IL Practical Shooters IL02 Havana April USPSA","match_date":"2017-04-08","stage_classifiercode":"06-03","member_number":"A88356","first_name":"MICHAEL","last_name":"FORTNEY","classification":"C","division":"PRODUCTION","hit_factor":9.1333},{"match_name":"SFPC May 2  2021   USPSA Monthly Match","match_date":"2021-05-02","stage_classifiercode":"06-03","member_number":"L3969","first_name":"JOHN","last_name":"CICOS","classification":"C","division":"PRODUCTION","hit_factor":9.1333},{"match_name":"Devil Dog USPSA Classifier Match-Saturday Session","match_date":"2018-03-10","stage_classifiercode":"06-03","member_number":"A108541","first_name":"MICHAEL","last_name":"WILSON","classification":"U","division":"PRODUCTION","hit_factor":9.1333},{"match_name":"NCPS USPSA Handgun Match November 29 2015","match_date":"2015-11-29","stage_classifiercode":"06-03","member_number":"A88874","first_name":"JOHN","last_name":"BREGLIA","classification":"C","division":"PRODUCTION","hit_factor":9.1324},{"match_name":"CRGC USPSA Match 04-18-21","match_date":"2021-04-18","stage_classifiercode":"06-03","member_number":"A116688","first_name":"JOE","last_name":"DEL TUFO","classification":"C","division":"PRODUCTION","hit_factor":9.1324},{"match_name":"2015 Ontelaunee Holiday Hosefest","match_date":"2015-12-26","stage_classifiercode":"06-03","member_number":"\"\"","first_name":"PATRICK","last_name":"MCKERNAN","classification":"B","division":"PRODUCTION","hit_factor":9.1248},{"match_name":"MAPSA 2016.04.09","match_date":"2016-04-09","stage_classifiercode":"06-03","member_number":"A93422","first_name":"STUART","last_name":"CLEVELAND","classification":"U","division":"PRODUCTION","hit_factor":9.1241},{"match_name":"Shoot GTR USPSA 1/23","match_date":"2017-01-23","stage_classifiercode":"06-03","member_number":"TY77144","first_name":"ALEXANDRA","last_name":"FERRIS","classification":"B","division":"PRODUCTION","hit_factor":9.1241},{"match_name":"MS06 Team Magnolia USPSA","match_date":"2017-03-05","stage_classifiercode":"06-03","member_number":"A73593","first_name":"JASON","last_name":"KEENAN","classification":"B","division":"PRODUCTION","hit_factor":9.1241},{"match_name":"LdF 4th Saturday Match","match_date":"2015-12-26","stage_classifiercode":"06-03","member_number":"TY78715","first_name":"KEVIN","last_name":"RATLIFF","classification":"U","division":"PRODUCTION","hit_factor":9.1241},{"match_name":"Brazosland Pistoleros September 17 2017 USPSA","match_date":"2017-09-17","stage_classifiercode":"06-03","member_number":"A95439","first_name":"KEVIN","last_name":"BAKER","classification":"C","division":"PRODUCTION","hit_factor":9.1241},{"match_name":"Hammer Down USPSA Tue Night","match_date":"2017-11-22","stage_classifiercode":"06-03","member_number":"a106748","first_name":"KEN","last_name":"TURNER","classification":"U","division":"PRODUCTION","hit_factor":9.1241},{"match_name":"BHPSC Weekly Match 9-30-2016","match_date":"2016-09-30","stage_classifiercode":"06-03","member_number":"A92460","first_name":"TOM","last_name":"SAUNDERS","classification":"U","division":"PRODUCTION","hit_factor":9.1241},{"match_name":"The Irbil Open","match_date":"2017-05-14","stage_classifiercode":"06-03","member_number":"\"\"","first_name":"GABRIEL","last_name":"DAVID","classification":"U","division":"PRODUCTION","hit_factor":9.1224},{"match_name":"BUAS January Match","match_date":"2018-01-14","stage_classifiercode":"06-03","member_number":"ty91771","first_name":"JOHN","last_name":"PARKER","classification":"C","division":"PRODUCTION","hit_factor":9.1163},{"match_name":"OPSC USPSA 8-14-2016","match_date":"2016-08-14","stage_classifiercode":"06-03","member_number":"A46066","first_name":"RAY","last_name":"PEREZ","classification":"C","division":"PRODUCTION","hit_factor":9.1158},{"match_name":"Lafayette Practical Shooters - WEDNESDAY - Oct 10","match_date":"2018-10-10","stage_classifiercode":"06-03","member_number":"A113046","first_name":"BRANDON","last_name":"ELIAS","classification":"U","division":"PRODUCTION","hit_factor":9.1158},{"match_name":"Pathfinder July USPSA Match","match_date":"2017-07-16","stage_classifiercode":"06-03","member_number":"L3604","first_name":"JIM","last_name":"WHEELER","classification":"B","division":"PRODUCTION","hit_factor":9.1158},{"match_name":"APSC USPSA Classifier Match 07-01-17","match_date":"2017-07-01","stage_classifiercode":"06-03","member_number":"A89824","first_name":"MIKE","last_name":"WIERDSMA","classification":"B","division":"PRODUCTION","hit_factor":9.1102},{"match_name":"RangeMasters 10-26-2017","match_date":"2017-10-26","stage_classifiercode":"06-03","member_number":"a65453","first_name":"BOB","last_name":"ZELLER","classification":"C","division":"PRODUCTION","hit_factor":9.1078},{"match_name":"WSRC USPSA 7/15/2017","match_date":"2017-07-15","stage_classifiercode":"06-03","member_number":"A98885","first_name":"BART","last_name":"CARSON","classification":"U","division":"PRODUCTION","hit_factor":9.1075},{"match_name":"MRPC USPSA July 2017","match_date":"2017-07-23","stage_classifiercode":"06-03","member_number":"L4273","first_name":"JEFF","last_name":"SHANKS","classification":"C","division":"PRODUCTION","hit_factor":9.1075},{"match_name":"NPCCC 9-4-16 USPSA","match_date":"2016-09-04","stage_classifiercode":"06-03","member_number":"A73672","first_name":"MICHAEL","last_name":"GELOBTER","classification":"A","division":"PRODUCTION","hit_factor":9.1024},{"match_name":"2015 Ontelaunee Holiday Hosefest","match_date":"2015-12-26","stage_classifiercode":"06-03","member_number":"\"\"","first_name":"MAX","last_name":"BLOEMENDAAL","classification":"U","division":"PRODUCTION","hit_factor":9.0999},{"match_name":"APSC USPSA 7-7-2018","match_date":"2018-07-07","stage_classifiercode":"06-03","member_number":"A108716","first_name":"BRIAN","last_name":"MOON","classification":"B","division":"PRODUCTION","hit_factor":9.0995},{"match_name":"CRGC USPSA Match 04-18-21","match_date":"2021-04-18","stage_classifiercode":"06-03","member_number":"L1439","first_name":"JACK","last_name":"BARNES","classification":"M","division":"PRODUCTION","hit_factor":9.0994},{"match_name":"Crooked Creek Pistol League - October 2020","match_date":"2020-10-17","stage_classifiercode":"06-03","member_number":"FY10096","first_name":"PETE","last_name":"PERKINS","classification":"C","division":"PRODUCTION","hit_factor":9.0994},{"match_name":"Devil Dog USPSA Classifier Match-Sunday Session","match_date":"2018-03-11","stage_classifiercode":"06-03","member_number":"A99730","first_name":"TONY","last_name":"GARDNER","classification":"B","division":"PRODUCTION","hit_factor":9.0994},{"match_name":"Trigger Guard USPSA","match_date":"2016-04-02","stage_classifiercode":"06-03","member_number":"A91554","first_name":"MICHAEL","last_name":"ISHIDA","classification":"C","division":"PRODUCTION","hit_factor":9.0909},{"match_name":"RangeMasters 6-29-17","match_date":"2017-06-29","stage_classifiercode":"06-03","member_number":"A103016","first_name":"ROBERT","last_name":"BUI","classification":"U","division":"PRODUCTION","hit_factor":9.0909},{"match_name":"ORSA USPSA April 2016","match_date":"2016-04-16","stage_classifiercode":"06-03","member_number":"A94902","first_name":"DON","last_name":"REAGAN","classification":"U","division":"PRODUCTION","hit_factor":9.0909},{"match_name":"ORPCI 2016.10.15 Pistol","match_date":"2016-10-15","stage_classifiercode":"06-03","member_number":"FY95623","first_name":"JOSH","last_name":"NICKENS","classification":"U","division":"PRODUCTION","hit_factor":9.0827},{"match_name":"Richmond Hot Shots April 15-16-2017 USPSA Pistol Match","match_date":"2017-04-15","stage_classifiercode":"06-03","member_number":"A100923","first_name":"DAVID","last_name":"BELL","classification":"U","division":"PRODUCTION","hit_factor":9.0827},{"match_name":"Shasta Shooters 2018 June Special Classifier","match_date":"2018-06-09","stage_classifiercode":"06-03","member_number":"PEN","first_name":"AARON","last_name":"RODRIGUES","classification":"U","division":"PRODUCTION","hit_factor":9.0825},{"match_name":"Nampa USPSA September 5th 2020","match_date":"2020-09-05","stage_classifiercode":"06-03","member_number":"A89800","first_name":"RICKY","last_name":"VARELA","classification":"U","division":"PRODUCTION","hit_factor":9.0823},{"match_name":"MISS Match 12-7-16","match_date":"2016-12-06","stage_classifiercode":"06-03","member_number":"A83394","first_name":"SEAN","last_name":"JACOBS","classification":"C","division":"PRODUCTION","hit_factor":9.0821},{"match_name":"The Great Wet Classifier - Renton USPSA - November 2020 - NW05","match_date":"2020-11-22","stage_classifiercode":"06-03","member_number":"A120199","first_name":"AUSTIN","last_name":"POST","classification":"C","division":"PRODUCTION","hit_factor":9.0815},{"match_name":"Competitive Shooters of Lake Norman CORNELIUS Thursday Evening Indoor USPSA Pistol Match North Carolina","match_date":"2018-03-01","stage_classifiercode":"06-03","member_number":"A90914","first_name":"TONY","last_name":"SINCLAIR","classification":"B","division":"PRODUCTION","hit_factor":9.081},{"match_name":"BUAS January Match","match_date":"2018-01-14","stage_classifiercode":"06-03","member_number":"fy66178","first_name":"DARRIN","last_name":"HAUG","classification":"C","division":"PRODUCTION","hit_factor":9.0744},{"match_name":"SPSA USPSA April 4th Sat match","match_date":"2017-04-22","stage_classifiercode":"06-03","member_number":"A79299","first_name":"ED","last_name":"ROTHSCHILD","classification":"B","division":"PRODUCTION","hit_factor":9.0744},{"match_name":"2021-10-02 USPSA  at Phoenix Rod and Gun Club","match_date":"2021-10-02","stage_classifiercode":"06-03","member_number":"TY91051","first_name":"RHONIEL","last_name":"DUMAGPI","classification":"U","division":"PRODUCTION","hit_factor":9.0741},{"match_name":"OFGC USPSA August Match 8-20-2017","match_date":"2017-08-20","stage_classifiercode":"06-03","member_number":"A92527","first_name":"JAKE","last_name":"NOBLE","classification":"U","division":"PRODUCTION","hit_factor":9.0722},{"match_name":"FBPPC FEBRUARY 2016 MATCH","match_date":"2016-02-13","stage_classifiercode":"06-03","member_number":"L909","first_name":"BEN","last_name":"CHENG","classification":"A","division":"PRODUCTION","hit_factor":9.0662},{"match_name":"WGC August 2017 USPSA Classifier","match_date":"2017-08-13","stage_classifiercode":"06-03","member_number":"TY50501","first_name":"BERNIE","last_name":"MCHUGH","classification":"M","division":"PRODUCTION","hit_factor":9.0662},{"match_name":"Pioneer Action Shooters May 2017","match_date":"2017-05-28","stage_classifiercode":"06-03","member_number":"TY85184","first_name":"HOWARD","last_name":"SIMPSON","classification":"C","division":"PRODUCTION","hit_factor":9.0662},{"match_name":"Deep 50 USPSA  July 24th 2 Classifiers","match_date":"2021-07-24","stage_classifiercode":"06-03","member_number":"A132427","first_name":"VINCENT","last_name":"GOURMET","classification":"C","division":"PRODUCTION","hit_factor":9.0662},{"match_name":"WAC February(4th Sunday) - USPSA 6 Classifier Match","match_date":"2020-02-23","stage_classifiercode":"06-03","member_number":"A123784","first_name":"TIM","last_name":"OWEN","classification":"U","division":"PRODUCTION","hit_factor":9.0657},{"match_name":"Bayou City Weekly Match","match_date":"2016-01-07","stage_classifiercode":"06-03","member_number":"\"\"","first_name":"CLARK","last_name":"CONEBY","classification":"X","division":"PRODUCTION","hit_factor":9.0652},{"match_name":"CVSC  07-31-2016","match_date":"2016-07-31","stage_classifiercode":"06-03","member_number":"\"\"","first_name":"ROB","last_name":"DAVEY","classification":"U","division":"PRODUCTION","hit_factor":9.058},{"match_name":"Baghdad IPSC Match 8-5-2017","match_date":"2017-08-05","stage_classifiercode":"06-03","member_number":"108701","first_name":"KYLE","last_name":"BORHAM","classification":"\"\"","division":"PRODUCTION","hit_factor":9.058},{"match_name":"SMPS March 2016","match_date":"2016-03-13","stage_classifiercode":"06-03","member_number":"TY80604","first_name":"ROBERT","last_name":"DELAWDER","classification":"D","division":"PRODUCTION","hit_factor":9.058},{"match_name":"Homestead September Classifier Match","match_date":"2020-09-20","stage_classifiercode":"06-03","member_number":"A104856","first_name":"GUS","last_name":"PARERA","classification":"U","division":"PRODUCTION","hit_factor":9.058},{"match_name":"Detroit Sportsmens Congress - May 21 2017","match_date":"2017-05-21","stage_classifiercode":"06-03","member_number":"A91125","first_name":"PAWEL","last_name":"CICHOWLAS","classification":"C","division":"PRODUCTION","hit_factor":9.0573},{"match_name":"PCGC October 2016","match_date":"2016-10-23","stage_classifiercode":"06-03","member_number":"TY85527","first_name":"STEPHEN","last_name":"LOVISA","classification":"C","division":"PRODUCTION","hit_factor":9.0566},{"match_name":"ECPS USPSA 19 Aug 17","match_date":"2017-08-19","stage_classifiercode":"06-03","member_number":"\"\"","first_name":"TRAVIS","last_name":"SCHRINER","classification":"U","division":"PRODUCTION","hit_factor":9.0566},{"match_name":"ORGC Tuesday classifier August-07-2018","match_date":"2018-08-07","stage_classifiercode":"06-03","member_number":"A106662","first_name":"GARY","last_name":"SALVIONE","classification":"U","division":"PRODUCTION","hit_factor":9.0543},{"match_name":"Pathfinder July USPSA Match","match_date":"2018-07-15","stage_classifiercode":"06-03","member_number":"A61473","first_name":"BRUCE","last_name":"ROWE","classification":"none","division":"PRODUCTION","hit_factor":9.0498},{"match_name":"MISS Match 12-7-16","match_date":"2016-12-06","stage_classifiercode":"06-03","member_number":"A99280","first_name":"MAREK","last_name":"DUDEK","classification":"U","division":"PRODUCTION","hit_factor":9.0498},{"match_name":"BTSA USPSA 2020-5 Oct 11 2020","match_date":"2020-10-11","stage_classifiercode":"06-03","member_number":"F128866","first_name":"LAURA","last_name":"SEITZ","classification":"C","division":"PRODUCTION","hit_factor":9.0481},{"match_name":"LdF 4th Saturday Match","match_date":"2015-12-26","stage_classifiercode":"06-03","member_number":"TY67188","first_name":"IVAN","last_name":"GARCIA","classification":"C","division":"PRODUCTION","hit_factor":9.0431},{"match_name":"Pioneer Action Shooters May 2017","match_date":"2017-05-28","stage_classifiercode":"06-03","member_number":"A86058","first_name":"KEVIN","last_name":"WAGNER","classification":"C","division":"PRODUCTION","hit_factor":9.0416},{"match_name":"Pioneer Action Shooters APR 2016","match_date":"2016-04-24","stage_classifiercode":"06-03","member_number":"A95077","first_name":"MICHAEL","last_name":"KLINKER","classification":"U","division":"PRODUCTION","hit_factor":9.0416},{"match_name":"MS06 Team Magnolia USPSA","match_date":"2017-03-05","stage_classifiercode":"06-03","member_number":"L1670","first_name":"TOM","last_name":"DUCHMANN JR.","classification":"C","division":"PRODUCTION","hit_factor":9.0406},{"match_name":"Central IL Practical Shooters IL02 Havana April USPSA","match_date":"2017-04-08","stage_classifiercode":"06-03","member_number":"A86672","first_name":"DONALD","last_name":"HITCHINGS","classification":"C","division":"PRODUCTION","hit_factor":9.0406},{"match_name":"Richmond October 17-18-2015","match_date":"2015-10-17","stage_classifiercode":"06-03","member_number":"A55099","first_name":"MATTHEW","last_name":"LEONG","classification":"C","division":"PRODUCTION","hit_factor":9.0406},{"match_name":"Range E11even October 2017","match_date":"2017-10-28","stage_classifiercode":"06-03","member_number":"TY73390","first_name":"TUDOR","last_name":"STURZU","classification":"C","division":"PRODUCTION","hit_factor":9.0406},{"match_name":"GAS USPSA at BRRC  November 11th 2017","match_date":"2017-11-11","stage_classifiercode":"06-03","member_number":"A105814","first_name":"SHANE","last_name":"BERNSKOETTER","classification":"U","division":"PRODUCTION","hit_factor":9.0395},{"match_name":"NRG Saturday March 28th - Includes a Classifier Stage","match_date":"2020-03-28","stage_classifiercode":"06-03","member_number":"A116020","first_name":"KOSEI","last_name":"KOBAYASHI","classification":"C","division":"PRODUCTION","hit_factor":9.0373},{"match_name":"Rio Salado UPPL June 2021","match_date":"2021-06-13","stage_classifiercode":"06-03","member_number":"A125760","first_name":"MATTHEW","last_name":"MAGYAR","classification":"A","division":"PRODUCTION","hit_factor":9.0361},{"match_name":"WNYPPL August 2017 Classifier Match","match_date":"2017-08-27","stage_classifiercode":"06-03","member_number":"F99914","first_name":"MATTHEW","last_name":"SCOTT","classification":"D","division":"PRODUCTION","hit_factor":9.0334},{"match_name":"Hawkeye Gun Club February 2016","match_date":"2016-02-20","stage_classifiercode":"06-03","member_number":"A-89457","first_name":"IVAN","last_name":"RODRIGUEZ","classification":"D","division":"PRODUCTION","hit_factor":9.0323},{"match_name":"AREA 59  SPRING ALL CLASSIFIER","match_date":"2018-03-31","stage_classifiercode":"06-03","member_number":"A106236","first_name":"POCHOLO","last_name":"DIMAYUGA","classification":"U","division":"PRODUCTION","hit_factor":9.0285},{"match_name":"Castlewood June 2017 USPSA Match","match_date":"2017-06-24","stage_classifiercode":"06-03","member_number":"TY36264","first_name":"ED","last_name":"BELLA","classification":"C","division":"PRODUCTION","hit_factor":9.0271},{"match_name":"CSA Annual Classifier Classic","match_date":"2018-03-18","stage_classifiercode":"06-03","member_number":"TY8880","first_name":"GENE","last_name":"RICHMOND","classification":"B","division":"PRODUCTION","hit_factor":9.0253},{"match_name":"Pathfinder July USPSA Match","match_date":"2018-07-15","stage_classifiercode":"06-03","member_number":"A16340","first_name":"TONY","last_name":"BLANEY","classification":"none","division":"PRODUCTION","hit_factor":9.0253},{"match_name":"PTPC June 4th USPSA Match","match_date":"2017-06-04","stage_classifiercode":"06-03","member_number":"TY94870","first_name":"BILL","last_name":"HOWARD","classification":"C","division":"PRODUCTION","hit_factor":9.0253},{"match_name":"BPSA April 2017 USPSA","match_date":"2017-04-23","stage_classifiercode":"06-03","member_number":"A100941","first_name":"JAY","last_name":"MERRITT","classification":"U","division":"PRODUCTION","hit_factor":9.0253},{"match_name":"NCPS USPSA Handgun Match November 29 2015","match_date":"2015-11-29","stage_classifiercode":"06-03","member_number":"A63724","first_name":"CHRISTINE","last_name":"RIVLIN","classification":"C","division":"PRODUCTION","hit_factor":9.0239},{"match_name":"Brazosland Pistoleros September 17 2017 USPSA","match_date":"2017-09-17","stage_classifiercode":"06-03","member_number":"\"\"","first_name":"BRANDON","last_name":"BYARS","classification":"U","division":"PRODUCTION","hit_factor":9.0239},{"match_name":"RSPP 3rd Saturday July 2018","match_date":"2018-07-20","stage_classifiercode":"06-03","member_number":"TY60458","first_name":"JOHN","last_name":"CATALANO","classification":"B","division":"PRODUCTION","hit_factor":9.0239},{"match_name":"Homestead USPSA April 2021","match_date":"2021-04-18","stage_classifiercode":"06-03","member_number":"A132427","first_name":"VINCENT","last_name":"GOURMET","classification":"D","division":"PRODUCTION","hit_factor":9.0226},{"match_name":"ORSA USPSA October 2020","match_date":"2020-10-17","stage_classifiercode":"06-03","member_number":"A112653","first_name":"JORDAN","last_name":"SUGGS","classification":"U","division":"PRODUCTION","hit_factor":9.0211},{"match_name":"Spsa Uspsa  1st Sat","match_date":"2016-01-02","stage_classifiercode":"06-03","member_number":"A83077","first_name":"ROBERT","last_name":"SCHULTZ","classification":"D","division":"PRODUCTION","hit_factor":9.0171},{"match_name":"BGS  Hudson Week 2","match_date":"2018-12-10","stage_classifiercode":"06-03","member_number":"a92007","first_name":"DOUG","last_name":"FLETCHER","classification":"U","division":"PRODUCTION","hit_factor":9.0171},{"match_name":"Piscataqua  Master Blasters USPSA Special Classifier","match_date":"2017-12-03","stage_classifiercode":"06-03","member_number":"A105613","first_name":"NICHOLAS","last_name":"GABINET","classification":"U","division":"PRODUCTION","hit_factor":9.0171},{"match_name":"FSTC USPSA 1-29-16","match_date":"2017-01-29","stage_classifiercode":"06-03","member_number":"\"\"","first_name":"MIKE","last_name":"OSTRANDER","classification":"U","division":"PRODUCTION","hit_factor":9.0171},{"match_name":"Homestead September Classifier Match","match_date":"2020-09-20","stage_classifiercode":"06-03","member_number":"TY90993","first_name":"WAYNE","last_name":"OWENSBY","classification":"D","division":"PRODUCTION","hit_factor":9.0156},{"match_name":"Brazosland Pistoleros September 17 2017 USPSA","match_date":"2017-09-17","stage_classifiercode":"06-03","member_number":"A104390","first_name":"ALEXANDER","last_name":"RIHOVSKY","classification":"B","division":"PRODUCTION","hit_factor":9.0144},{"match_name":"ORGC Independance Day  2018 Pistol Match","match_date":"2018-07-01","stage_classifiercode":"06-03","member_number":"A111304","first_name":"WILLIAM","last_name":"PULVER","classification":"U","division":"PRODUCTION","hit_factor":9.0141},{"match_name":"SAPSC Monthly USPSA Classifier Match 20160112","match_date":"2016-01-12","stage_classifiercode":"06-03","member_number":"TY47931","first_name":"LAWRENCE","last_name":"OTWELL","classification":"C","division":"PRODUCTION","hit_factor":9.0141},{"match_name":"Minnetonka Game And Fish Sept 5","match_date":"2018-09-05","stage_classifiercode":"06-03","member_number":"Ty95926","first_name":"BUG","last_name":"SCHRADER","classification":"C","division":"PRODUCTION","hit_factor":9.0141},{"match_name":"MRCPS  USPSA MARCH","match_date":"2017-03-19","stage_classifiercode":"06-03","member_number":"A79746","first_name":"CHARIS","last_name":"DENTON","classification":"B","division":"PRODUCTION","hit_factor":9.0141},{"match_name":"NVSA USPSA Classifer Match 1605-2","match_date":"2016-05-21","stage_classifiercode":"06-03","member_number":"A77668","first_name":"KAREN","last_name":"WHITEHAIR","classification":"C","division":"PRODUCTION","hit_factor":9.0125},{"match_name":"2015 Ontelaunee Holiday Hosefest","match_date":"2015-12-26","stage_classifiercode":"06-03","member_number":"\"\"","first_name":"MATTHEW","last_name":"HILL","classification":"B","division":"PRODUCTION","hit_factor":9.0125},{"match_name":"LdF USPSA Classifier Match December 12 2020","match_date":"2020-12-12","stage_classifiercode":"06-03","member_number":"A92561","first_name":"MARC","last_name":"ZIMPELMANN","classification":"C","division":"PRODUCTION","hit_factor":9.009},{"match_name":"TPS USPSA -  September Match 2021","match_date":"2021-09-04","stage_classifiercode":"06-03","member_number":"A104272","first_name":"RICHARD","last_name":"GILL","classification":"C","division":"PRODUCTION","hit_factor":9.009},{"match_name":"Briar Rabbit July 2021","match_date":"2021-07-25","stage_classifiercode":"06-03","member_number":"A50424","first_name":"BILL","last_name":"GARDNER","classification":"C","division":"PRODUCTION","hit_factor":9.0074},{"match_name":"Rankin Field Sunday USPSA","match_date":"2018-07-15","stage_classifiercode":"06-03","member_number":"\"\"","first_name":"JEFF","last_name":"ANDERSEN","classification":"U","division":"PRODUCTION","hit_factor":9.0072},{"match_name":"SOAP April 2021 USPSA Match","match_date":"2021-04-10","stage_classifiercode":"06-03","member_number":"FY115826","first_name":"MANUEL","last_name":"CORNEJO","classification":"C","division":"PRODUCTION","hit_factor":9.0056},{"match_name":"WVPPS May 2017","match_date":"2017-05-21","stage_classifiercode":"06-03","member_number":"A99128","first_name":"MICHAEL","last_name":"APKING","classification":"C","division":"PRODUCTION","hit_factor":9.0056},{"match_name":"GMPS 7/16/17","match_date":"2017-07-16","stage_classifiercode":"06-03","member_number":"TY62473","first_name":"JEFF","last_name":"LAFOND","classification":"B","division":"PRODUCTION","hit_factor":9.002},{"match_name":"BRC_20180311","match_date":"2018-03-11","stage_classifiercode":"06-03","member_number":"A79592","first_name":"PATRICK","last_name":"JONES","classification":"A","division":"PRODUCTION","hit_factor":9.0009},{"match_name":"B&R July 2020 USPSA Match","match_date":"2020-07-18","stage_classifiercode":"06-03","member_number":"A61476","first_name":"CHIP","last_name":"COBLE","classification":"C","division":"PRODUCTION","hit_factor":9.0009},{"match_name":"Fairfax PS USPSA June 2017","match_date":"2017-06-27","stage_classifiercode":"06-03","member_number":"A101673","first_name":"LEVON","last_name":"STILSON","classification":"D","division":"PRODUCTION","hit_factor":9.0009},{"match_name":"USPSA MO21 2Alpha SBRC July 2017 Special Classifier","match_date":"2017-07-15","stage_classifiercode":"06-03","member_number":"A98150","first_name":"JASON","last_name":"BRIGHT","classification":"D","division":"PRODUCTION","hit_factor":9.0009},{"match_name":"NITE OWLS AREA 59 ALL CLASSIFIER","match_date":"2020-07-29","stage_classifiercode":"06-03","member_number":"A115982","first_name":"BENJAMIN","last_name":"MICHAEL","classification":"U","division":"PRODUCTION","hit_factor":9},{"match_name":"Matamoras USPSA March 2017","match_date":"2017-04-02","stage_classifiercode":"06-03","member_number":"A101635","first_name":"JC","last_name":"BLAUVELT","classification":"U","division":"PRODUCTION","hit_factor":8.9991},{"match_name":"Bayou City USPSA Weekly Mar 1","match_date":"2018-03-02","stage_classifiercode":"06-03","member_number":"TY83291","first_name":"RONALD","last_name":"GILLORY JR.","classification":"C","division":"PRODUCTION","hit_factor":8.9991},{"match_name":"ORPCI 2018.03.31 USPSA Special","match_date":"2018-03-31","stage_classifiercode":"06-03","member_number":"A109784","first_name":"MARK","last_name":"HAYMOND","classification":"U","division":"PRODUCTION","hit_factor":8.9928},{"match_name":"Pioneer Action Shooters May 2017","match_date":"2017-05-28","stage_classifiercode":"06-03","member_number":"A101933","first_name":"PAUL","last_name":"STINSON","classification":"C","division":"PRODUCTION","hit_factor":8.9908},{"match_name":"Triforce Practical Shooters at BigWoodsGoods 12-21-17","match_date":"2017-12-22","stage_classifiercode":"06-03","member_number":"\"\"","first_name":"LUIS","last_name":"ORTIZ","classification":"U","division":"PRODUCTION","hit_factor":8.9796},{"match_name":"2015 Ontelaunee Holiday Hosefest","match_date":"2015-12-26","stage_classifiercode":"06-03","member_number":"\"\"","first_name":"JOHN","last_name":"CHILELLI","classification":"U","division":"PRODUCTION","hit_factor":8.978},{"match_name":"SOAP April 2021 USPSA Match","match_date":"2021-04-10","stage_classifiercode":"06-03","member_number":"a90270","first_name":"DAVID","last_name":"HONG","classification":"C","division":"PRODUCTION","hit_factor":8.9767},{"match_name":"ORPCI 2016.10.15 Pistol","match_date":"2016-10-15","stage_classifiercode":"06-03","member_number":"\"\"","first_name":"JARED","last_name":"CAVETT","classification":"U","division":"PRODUCTION","hit_factor":8.9767},{"match_name":"Atlanta Practical Shooters March 2016 USPSA - Classifier Match","match_date":"2016-03-06","stage_classifiercode":"06-03","member_number":"\"\"","first_name":"JASON","last_name":"BOYD","classification":"U","division":"PRODUCTION","hit_factor":8.9744},{"match_name":"Patriot Action Shooters 2016 Special Classifier","match_date":"2016-03-19","stage_classifiercode":"06-03","member_number":"TY81199","first_name":"PETER","last_name":"PFAU","classification":"U","division":"PRODUCTION","hit_factor":8.9731},{"match_name":"Shasta Shooters 2020 Jun","match_date":"2020-06-13","stage_classifiercode":"06-03","member_number":"N/a","first_name":"SETH","last_name":"WARFIELD","classification":"C","division":"PRODUCTION","hit_factor":8.9686},{"match_name":"BTSA USPSA 2016-8","match_date":"2016-08-28","stage_classifiercode":"06-03","member_number":"F26576","first_name":"NICK","last_name":"DRAZENOVICH","classification":"C","division":"PRODUCTION","hit_factor":8.9686},{"match_name":"Emmett June Match","match_date":"2018-06-23","stage_classifiercode":"06-03","member_number":"A103721","first_name":"KYLA","last_name":"AUSTIN","classification":"D","division":"PRODUCTION","hit_factor":8.9669},{"match_name":"LdF 4th Saturday Match","match_date":"2015-12-26","stage_classifiercode":"06-03","member_number":"\"\"","first_name":"MARK","last_name":"SASS","classification":"U","division":"PRODUCTION","hit_factor":8.9661},{"match_name":"Bass River May 1  2016","match_date":"2016-05-01","stage_classifiercode":"06-03","member_number":"TY66111","first_name":"DARIO","last_name":"LILLI","classification":"B","division":"PRODUCTION","hit_factor":8.9661},{"match_name":"MAPSA  2017 05 13","match_date":"2017-05-10","stage_classifiercode":"06-03","member_number":"A64866","first_name":"MIKE","last_name":"HAMILTON","classification":"C","division":"PRODUCTION","hit_factor":8.9661},{"match_name":"WVPPS May 2017","match_date":"2017-05-21","stage_classifiercode":"06-03","member_number":"PEN","first_name":"ANDRIY","last_name":"LEKHNYAK","classification":"U","division":"PRODUCTION","hit_factor":8.9661},{"match_name":"Hopkinton August 2017","match_date":"2017-08-05","stage_classifiercode":"06-03","member_number":"A100683","first_name":"CHRIS","last_name":"DODGE","classification":"U","division":"PRODUCTION","hit_factor":8.9661},{"match_name":"SAPSA July 2016","match_date":"2016-07-16","stage_classifiercode":"06-03","member_number":"A87317","first_name":"MICHAEL","last_name":"DUKES","classification":"B","division":"PRODUCTION","hit_factor":8.9606},{"match_name":"LIPSA - April 30th 2017 - USPSA Match Special Classifier","match_date":"2017-04-30","stage_classifiercode":"06-03","member_number":"A85779","first_name":"SCOTT","last_name":"DIRUSSO","classification":"C","division":"PRODUCTION","hit_factor":8.9606},{"match_name":"YRPA USPSA Classifier match January 2018 (resubmission)","match_date":"2018-01-28","stage_classifiercode":"06-03","member_number":"A106883","first_name":"RICHARD","last_name":"IVERSON","classification":"U","division":"PRODUCTION","hit_factor":8.958},{"match_name":"Pelham USPSA 2018-08-19","match_date":"2018-08-19","stage_classifiercode":"06-03","member_number":"A112189","first_name":"CODY","last_name":"NESBIT","classification":"U","division":"PRODUCTION","hit_factor":8.958},{"match_name":"Pioneer Action Shooters May 2017","match_date":"2017-05-28","stage_classifiercode":"06-03","member_number":"TY91161","first_name":"PATRICE","last_name":"CASIAN","classification":"C","division":"PRODUCTION","hit_factor":8.958},{"match_name":"RCPS USPSA November 17","match_date":"2018-11-17","stage_classifiercode":"06-03","member_number":"A90642","first_name":"JESSE","last_name":"CHALEUNPHONE","classification":"C","division":"PRODUCTION","hit_factor":8.958},{"match_name":"NISA April Classifer Match 2016","match_date":"2016-04-24","stage_classifiercode":"06-03","member_number":"A84247","first_name":"ELI","last_name":"BARROWS","classification":"B","division":"PRODUCTION","hit_factor":8.9552},{"match_name":"Atlanta Practical Shooters March 2016 USPSA - Classifier Match","match_date":"2016-03-06","stage_classifiercode":"06-03","member_number":"A91281","first_name":"SABRINA","last_name":"MCAFFIE","classification":"U","division":"PRODUCTION","hit_factor":8.9552},{"match_name":"SMPS March 2016","match_date":"2016-03-13","stage_classifiercode":"06-03","member_number":"TY91090","first_name":"ROBERT","last_name":"SHATROWSKY","classification":"C","division":"PRODUCTION","hit_factor":8.9552},{"match_name":"SAPSA July 2016","match_date":"2016-07-16","stage_classifiercode":"06-03","member_number":"TY77144","first_name":"ALEXANDRA","last_name":"FERRIS","classification":"B","division":"PRODUCTION","hit_factor":8.9526},{"match_name":"Shasta Shooters 2018 June Special Classifier","match_date":"2018-06-09","stage_classifiercode":"06-03","member_number":"A105166","first_name":"RICHARD","last_name":"KING","classification":"U","division":"PRODUCTION","hit_factor":8.9498},{"match_name":"OFGC USPSA August Match 8-20-2017","match_date":"2017-08-20","stage_classifiercode":"06-03","member_number":"A95497","first_name":"BRET","last_name":"VORHEES","classification":"U","division":"PRODUCTION","hit_factor":8.9498},{"match_name":"HSC USPSA June 2016","match_date":"2016-06-04","stage_classifiercode":"06-03","member_number":"PEN","first_name":"PIERRE","last_name":"LECLAIR","classification":"C","division":"PRODUCTION","hit_factor":8.9485},{"match_name":"PSAC 20180922","match_date":"2018-09-22","stage_classifiercode":"06-03","member_number":"TY83699","first_name":"DIRK","last_name":"BRADLEY","classification":"B","division":"PRODUCTION","hit_factor":8.9445},{"match_name":"LCSC Classifier 042918","match_date":"2018-04-28","stage_classifiercode":"06-03","member_number":"A105565","first_name":"JEFF","last_name":"LEE","classification":"D","division":"PRODUCTION","hit_factor":8.9416},{"match_name":"WNPL USPSA  - October HoseFest 2021","match_date":"2021-10-09","stage_classifiercode":"06-03","member_number":"PENDING","first_name":"TONY","last_name":"ATELLA","classification":"U","division":"PRODUCTION","hit_factor":8.9416},{"match_name":"GCL October 6-2018","match_date":"2018-10-06","stage_classifiercode":"06-03","member_number":"TY107802","first_name":"AMY","last_name":"LONGYEAR","classification":"D","division":"PRODUCTION","hit_factor":8.9366},{"match_name":"Shoot GTR USPSA Sep 6","match_date":"2016-09-06","stage_classifiercode":"06-03","member_number":"A89761","first_name":"CHELSEY","last_name":"CUMMINGS","classification":"U","division":"PRODUCTION","hit_factor":8.9354},{"match_name":"NPCCC 9-4-16 USPSA","match_date":"2016-09-04","stage_classifiercode":"06-03","member_number":"\"\"","first_name":"ZACK","last_name":"HAGENSEKER","classification":"U","division":"PRODUCTION","hit_factor":8.934},{"match_name":"NVSA USPSA Classifer Match 1605-2","match_date":"2016-05-21","stage_classifiercode":"06-03","member_number":"A78995","first_name":"DON","last_name":"HAFICH","classification":"C","division":"PRODUCTION","hit_factor":8.9335},{"match_name":"NPCCC 9-4-16 USPSA","match_date":"2016-09-04","stage_classifiercode":"06-03","member_number":"\"\"","first_name":"RICK","last_name":"BLANCHARD","classification":"U","division":"PRODUCTION","hit_factor":8.9335},{"match_name":"2015 Ontelaunee Holiday Hosefest","match_date":"2015-12-26","stage_classifiercode":"06-03","member_number":"\"\"","first_name":"KYLE","last_name":"WICK","classification":"B","division":"PRODUCTION","hit_factor":8.932},{"match_name":"OK Corral USPSA Classifier Match Feb 18 2017","match_date":"2017-02-18","stage_classifiercode":"06-03","member_number":"A46279","first_name":"STEPHEN","last_name":"GRASSO","classification":"\"\"","division":"PRODUCTION","hit_factor":8.9302},{"match_name":"BTSA USPSA 2020-5 Oct 11 2020","match_date":"2020-10-11","stage_classifiercode":"06-03","member_number":"F131037","first_name":"JESSE","last_name":"KOZINA","classification":"U","division":"PRODUCTION","hit_factor":8.9302},{"match_name":"EWPSA 2018-07","match_date":"2018-07-14","stage_classifiercode":"06-03","member_number":"A80667","first_name":"OLIVIA","last_name":"BAYUK","classification":"B","division":"PRODUCTION","hit_factor":8.9302},{"match_name":"Kabul USPSA 10Aug2018","match_date":"2018-08-10","stage_classifiercode":"06-03","member_number":"\"\"","first_name":"BERG","last_name":"BERG","classification":"U","division":"PRODUCTION","hit_factor":8.9286},{"match_name":"Range E11even October 2017","match_date":"2017-10-28","stage_classifiercode":"06-03","member_number":"A77566","first_name":"STEVE","last_name":"ATKINSON","classification":"U","division":"PRODUCTION","hit_factor":8.9253},{"match_name":"Crooked Creek Pistol League - August 2017","match_date":"2017-08-26","stage_classifiercode":"06-03","member_number":"\"\"","first_name":"JOHN","last_name":"SHEPARD","classification":"U","division":"PRODUCTION","hit_factor":8.9253},{"match_name":"Detroit Sportsmens Congress - May 21 2017","match_date":"2017-05-21","stage_classifiercode":"06-03","member_number":"PEN","first_name":"CAMERON","last_name":"BELAVEK","classification":"U","division":"PRODUCTION","hit_factor":8.9212},{"match_name":"BRC_20180311","match_date":"2018-03-11","stage_classifiercode":"06-03","member_number":"A88662","first_name":"KEVIN","last_name":"STILL","classification":"C","division":"PRODUCTION","hit_factor":8.9206},{"match_name":"WGC July 2020 USPSA 2","match_date":"2020-07-26","stage_classifiercode":"06-03","member_number":"A104487","first_name":"PAUL","last_name":"SMALLEY","classification":"C","division":"PRODUCTION","hit_factor":8.9206},{"match_name":"COPS May 2017 USPSA Match","match_date":"2017-05-07","stage_classifiercode":"06-03","member_number":"A75450","first_name":"WILLIAM","last_name":"BLUNT","classification":"U","division":"PRODUCTION","hit_factor":8.9184},{"match_name":"Space Coast Practical Shooters","match_date":"2017-12-02","stage_classifiercode":"06-03","member_number":"TY93457","first_name":"JOE","last_name":"BARTOLOTTA","classification":"D","division":"PRODUCTION","hit_factor":8.9172},{"match_name":"YRPA USPSA Classifier match January 2018 (resubmission)","match_date":"2018-01-28","stage_classifiercode":"06-03","member_number":"A105870","first_name":"ERIK","last_name":"BECK","classification":"U","division":"PRODUCTION","hit_factor":8.9172},{"match_name":"NVSA USPSA Classifer Match 1605-2","match_date":"2016-05-21","stage_classifiercode":"06-03","member_number":"A84345","first_name":"JIM","last_name":"BROOKS","classification":"C","division":"PRODUCTION","hit_factor":8.9136},{"match_name":"BRC_20180311","match_date":"2018-03-11","stage_classifiercode":"06-03","member_number":"A102192","first_name":"SCOTT","last_name":"LONG","classification":"C","division":"PRODUCTION","hit_factor":8.9127},{"match_name":"FSA - USPSA  9","match_date":"2017-02-26","stage_classifiercode":"06-03","member_number":"Ty-95610","first_name":"CHAD","last_name":"MOLL","classification":"C","division":"PRODUCTION","hit_factor":8.9091},{"match_name":"Competitive Shooters of Lake Norman CORNELIUS Thursday Evening Indoor USPSA Pistol Match North Carolina","match_date":"2018-03-01","stage_classifiercode":"06-03","member_number":"TY95614","first_name":"MITCH","last_name":"NICHOLS","classification":"C","division":"PRODUCTION","hit_factor":8.9091},{"match_name":"OKCGC February USPSA Match","match_date":"2017-02-04","stage_classifiercode":"06-03","member_number":"A82757","first_name":"RYAN","last_name":"GROVES","classification":"B","division":"PRODUCTION","hit_factor":8.9087},{"match_name":"CRGC USPSA Match 04-18-21","match_date":"2021-04-18","stage_classifiercode":"06-03","member_number":"TY106343","first_name":"WILLIAM","last_name":"BLANCHARD","classification":"D","division":"PRODUCTION","hit_factor":8.9047},{"match_name":"SMPS March 2016","match_date":"2016-03-13","stage_classifiercode":"06-03","member_number":"\"\"","first_name":"DANIEL","last_name":"DAVIS","classification":"U","division":"PRODUCTION","hit_factor":8.9047},{"match_name":"SMPS March 2016","match_date":"2016-03-13","stage_classifiercode":"06-03","member_number":"TY86179","first_name":"PAUL","last_name":"SIKORA","classification":"C","division":"PRODUCTION","hit_factor":8.901},{"match_name":"Kidlat  May Club Match","match_date":"2017-05-06","stage_classifiercode":"06-03","member_number":"A95439","first_name":"KEVIN","last_name":"BAKER","classification":"D","division":"PRODUCTION","hit_factor":8.901},{"match_name":"KSA USPSA October 2021","match_date":"2021-10-02","stage_classifiercode":"06-03","member_number":"A59063","first_name":"ANDREW","last_name":"WHELAN","classification":"C","division":"PRODUCTION","hit_factor":8.901},{"match_name":"SCS USPSA Pistol with Classifer - Special Classifier July 31 2016","match_date":"2016-07-31","stage_classifiercode":"06-03","member_number":"A96051","first_name":"MARK","last_name":"FINES","classification":"C","division":"PRODUCTION","hit_factor":8.8979},{"match_name":"RPS May 2018 USPSA Match","match_date":"2018-05-12","stage_classifiercode":"06-03","member_number":"A107722","first_name":"SABIAN","last_name":"TOUSSAINT","classification":"U","division":"PRODUCTION","hit_factor":8.8979},{"match_name":"March 2017 PCSI USPSA","match_date":"2017-03-04","stage_classifiercode":"06-03","member_number":"A95263","first_name":"SIDA","last_name":"SHEN","classification":"B","division":"PRODUCTION","hit_factor":8.8968},{"match_name":"AREA 59  SPRING ALL CLASSIFIER","match_date":"2018-03-31","stage_classifiercode":"06-03","member_number":"TY83644","first_name":"BRETT","last_name":"THOMPSON","classification":"U","division":"PRODUCTION","hit_factor":8.8968},{"match_name":"Smoke & Hope Shooters USPSA June 24 2017","match_date":"2017-06-24","stage_classifiercode":"06-03","member_number":"\"\"","first_name":"COLTON","last_name":"GILMAN","classification":"U","division":"PRODUCTION","hit_factor":8.8968},{"match_name":"Brothers N Arms August 2016 USPSA Match","match_date":"2016-08-27","stage_classifiercode":"06-03","member_number":"PENDING","first_name":"CHARLIE","last_name":"CONNELL","classification":"U","division":"PRODUCTION","hit_factor":8.8849},{"match_name":"USPSA MO21 2Alpha SBRC July 2017 Special Classifier","match_date":"2017-07-15","stage_classifie