[{"match_name":"PCWC USPSA  5 27 2017","match_date":"2017-05-27","stage_classifiercode":"03-07","member_number":"L3042","first_name":"CHRIS","last_name":"TILLEY","classification":"GM","division":"OPEN","hit_factor":8.6022},{"match_name":"OREGON ARPC CC05 USPSA Feb 11 2017","match_date":"2017-02-11","stage_classifiercode":"03-07","member_number":"A84371","first_name":"RYAN","last_name":"GOOLD","classification":"G","division":"OPEN","hit_factor":7.8818},{"match_name":"GoShoot Outdoor October 17th","match_date":"2021-10-17","stage_classifiercode":"03-07","member_number":"L3042","first_name":"CHRIS","last_name":"TILLEY","classification":"G","division":"OPEN","hit_factor":7.8773},{"match_name":"EAGC September 2015 USPSA Pistol Match","match_date":"2015-09-20","stage_classifiercode":"03-07","member_number":"TY19303","first_name":"BRAD","last_name":"GRIFFIN","classification":"G","division":"OPEN","hit_factor":7.7985},{"match_name":"GoShoot Outdoors April 19th reshoot","match_date":"2020-04-19","stage_classifiercode":"03-07","member_number":"A107282","first_name":"AARON","last_name":"EDDINS","classification":"G","division":"OPEN","hit_factor":7.7239},{"match_name":"RSPP 3rd Saturday April 2016","match_date":"2016-04-16","stage_classifiercode":"03-07","member_number":"FYF68512","first_name":"MUNEKI","last_name":"SAMEJIMA","classification":"G","division":"OPEN","hit_factor":7.7049},{"match_name":"DAPS USPSA at ETTS 4-9-2016","match_date":"2016-04-09","stage_classifiercode":"03-07","member_number":"A46707","first_name":"COLT","last_name":"WILKINSON","classification":"M","division":"OPEN","hit_factor":7.6923},{"match_name":"GoShoot Indoors","match_date":"2017-08-13","stage_classifiercode":"03-07","member_number":"L3042","first_name":"CHRIS","last_name":"TILLEY","classification":"G","division":"OPEN","hit_factor":7.3625},{"match_name":"Dundee Practical Shooters - June 27 2020 - Points for Pistol","match_date":"2020-06-27","stage_classifiercode":"03-07","member_number":"A95617","first_name":"JOSEPH","last_name":"TYLER","classification":"M","division":"OPEN","hit_factor":7.3408},{"match_name":"Monday Rematch","match_date":"2017-08-14","stage_classifiercode":"03-07","member_number":"l3042","first_name":"CHRIS","last_name":"TILLEY","classification":"G","division":"OPEN","hit_factor":7.2684},{"match_name":"CGGR November USPSA Match","match_date":"2017-11-18","stage_classifiercode":"03-07","member_number":"TY90226","first_name":"JAMES","last_name":"TURNURE","classification":"GM","division":"OPEN","hit_factor":7.2531},{"match_name":"Emmett USPSA November 28th","match_date":"2020-11-28","stage_classifiercode":"03-07","member_number":"TY85985","first_name":"CHRISTOPHER","last_name":"COLLINS","classification":"M","division":"OPEN","hit_factor":7.2243},{"match_name":"OFGC USPSA Match 7/15/2018","match_date":"2018-07-15","stage_classifiercode":"03-07","member_number":"TY54207","first_name":"JAY","last_name":"MACKEY SR","classification":"M","division":"OPEN","hit_factor":7.0751},{"match_name":"LIPSA - November 4th 2018 - USPSA Classifier Match","match_date":"2018-11-04","stage_classifiercode":"03-07","member_number":"A81323","first_name":"JOE","last_name":"DRAGHI","classification":"A","division":"OPEN","hit_factor":7.0381},{"match_name":"BHPSC Weekly Match 1-29-2016","match_date":"2016-01-30","stage_classifiercode":"03-07","member_number":"\"\"","first_name":"RICK","last_name":"BYFIELD","classification":"none","division":"OPEN","hit_factor":7.0227},{"match_name":"Ontelaunee USPSA September 2015","match_date":"2015-09-27","stage_classifiercode":"03-07","member_number":"TY16248","first_name":"BARRY","last_name":"RUANE","classification":"M","division":"OPEN","hit_factor":7.0111},{"match_name":"NRG September 24th 2016","match_date":"2016-09-24","stage_classifiercode":"03-07","member_number":"L1993","first_name":"JOJO","last_name":"VIDANES","classification":"G","division":"OPEN","hit_factor":6.9924},{"match_name":"CGGR November USPSA Match","match_date":"2017-11-18","stage_classifiercode":"03-07","member_number":"L3042","first_name":"CHRIS","last_name":"TILLEY","classification":"GM","division":"OPEN","hit_factor":6.9787},{"match_name":"2017 Hawktech Arms Idaho Section Hi-cap Match","match_date":"2017-10-21","stage_classifiercode":"03-07","member_number":"TY85172","first_name":"MIKE","last_name":"O'LEARY","classification":"M","division":"OPEN","hit_factor":6.9413},{"match_name":"GRRC Week 8 2020","match_date":"2020-06-29","stage_classifiercode":"03-07","member_number":"A86548","first_name":"JOSH","last_name":"EERNISSE","classification":"M","division":"OPEN","hit_factor":6.9096},{"match_name":"WAC August 22nd (4th Sunday) - ALL CLASSIFIER USPSA 6 Stage Match","match_date":"2021-08-22","stage_classifiercode":"03-07","member_number":"fy49558","first_name":"JOHN","last_name":"ARENAS","classification":"G","division":"OPEN","hit_factor":6.8887},{"match_name":"RSPP 3rd Saturday April 2016","match_date":"2016-04-16","stage_classifiercode":"03-07","member_number":"L1849","first_name":"PAUL","last_name":"THOMPSON","classification":"M","division":"OPEN","hit_factor":6.862},{"match_name":"OREGON ARPC CC05 USPSA Feb 11 2017","match_date":"2017-02-11","stage_classifiercode":"03-07","member_number":"L3775","first_name":"GENE","last_name":"MORIN","classification":"M","division":"OPEN","hit_factor":6.8522},{"match_name":"RSPP 3rd Saturday April 2016","match_date":"2016-04-16","stage_classifiercode":"03-07","member_number":"A49035","first_name":"EDDIE","last_name":"GARCIA","classification":"G","division":"OPEN","hit_factor":6.8296},{"match_name":"June 12 2021 The Range At True North USPSA Match","match_date":"2021-06-12","stage_classifiercode":"03-07","member_number":"L2458","first_name":"TODD","last_name":"JARRETT","classification":"G","division":"OPEN","hit_factor":6.8092},{"match_name":"Pioneer Action Shooters Aug 2017 Match","match_date":"2017-08-13","stage_classifiercode":"03-07","member_number":"A92399","first_name":"JUSTIN","last_name":"LANDRY","classification":"G","division":"OPEN","hit_factor":6.7887},{"match_name":"OREGON ARPC CC05 USPSA Feb 11 2017","match_date":"2017-02-11","stage_classifiercode":"03-07","member_number":"A70998","first_name":"JAKE","last_name":"DYER","classification":"M","division":"OPEN","hit_factor":6.7558},{"match_name":"SPSA USPSA December 4th Sat match","match_date":"2017-12-23","stage_classifiercode":"03-07","member_number":"A104127","first_name":"RYAN","last_name":"FLOWERS","classification":"U","division":"OPEN","hit_factor":6.7529},{"match_name":"LIPSA - November 4th 2018 - USPSA Classifier Match","match_date":"2018-11-04","stage_classifiercode":"03-07","member_number":"TY90280","first_name":"ANTHONY","last_name":"BRUNO","classification":"M","division":"OPEN","hit_factor":6.7529},{"match_name":"HLSL 12-09-2018","match_date":"2018-12-09","stage_classifiercode":"03-07","member_number":"L4015","first_name":"MARK ANGELO","last_name":"BARRANCO","classification":"B","division":"OPEN","hit_factor":6.7433},{"match_name":"May 2017 USPSA Classifier Special","match_date":"2017-05-13","stage_classifiercode":"03-07","member_number":"FYF29266","first_name":"PAT","last_name":"HARRISON","classification":"M","division":"OPEN","hit_factor":6.7185},{"match_name":"GoShoot Outdoor October 17th","match_date":"2021-10-17","stage_classifiercode":"03-07","member_number":"FYF98408","first_name":"CLEMENTE","last_name":"WAGNER","classification":"M","division":"OPEN","hit_factor":6.7124},{"match_name":"JCSSA NOV 7 2020","match_date":"2020-11-07","stage_classifiercode":"03-07","member_number":"A79128","first_name":"RYAN","last_name":"WILKS","classification":"A","division":"OPEN","hit_factor":6.6943},{"match_name":"MPPL 07012017  We the People","match_date":"2017-07-01","stage_classifiercode":"03-07","member_number":"A55833","first_name":"FROILAN","last_name":"RIVERO","classification":"G","division":"OPEN","hit_factor":6.6943},{"match_name":"Richmond Hot Shots Oct 16-17-2021 USPSA","match_date":"2021-10-16","stage_classifiercode":"03-07","member_number":"l3657","first_name":"JAMES","last_name":"ONG","classification":"G","division":"OPEN","hit_factor":6.676},{"match_name":"Prescott Action Shooters 1st Saturday USPSA 08-07-21","match_date":"2021-08-07","stage_classifiercode":"03-07","member_number":"FY18395","first_name":"DAVID","last_name":"BRIDGMAN","classification":"G","division":"OPEN","hit_factor":6.6618},{"match_name":"OFGC USPSA Match 8-15-21","match_date":"2021-08-15","stage_classifiercode":"03-07","member_number":"TY98513","first_name":"JASON","last_name":"BRADLEY","classification":"M","division":"OPEN","hit_factor":6.661},{"match_name":"SAPSA February 2020 Match","match_date":"2020-02-15","stage_classifiercode":"03-07","member_number":"A30555","first_name":"DAVID","last_name":"WILDS","classification":"M","division":"OPEN","hit_factor":6.6528},{"match_name":"WGC WI USPSA Monthly Match 12-16-17","match_date":"2017-12-16","stage_classifiercode":"03-07","member_number":"L4223","first_name":"DARRYL","last_name":"DOUGHERTY","classification":"M","division":"OPEN","hit_factor":6.6341},{"match_name":"Richmond Hot Shots August 4th-5th USPSA Pistol Match","match_date":"2018-08-04","stage_classifiercode":"03-07","member_number":"A96836","first_name":"JOSEF","last_name":"RAPADAS","classification":"M","division":"OPEN","hit_factor":6.623},{"match_name":"Minot USPSA 2-18-18","match_date":"2018-02-18","stage_classifiercode":"03-07","member_number":"A71597","first_name":"DEANE","last_name":"GRAVES","classification":"M","division":"OPEN","hit_factor":6.5495},{"match_name":"NCPS USPSA Handgun Match August 28 2016","match_date":"2016-08-28","stage_classifiercode":"03-07","member_number":"L3567","first_name":"RON","last_name":"SELBY","classification":"A","division":"OPEN","hit_factor":6.5306},{"match_name":"NRG September 24th 2016","match_date":"2016-09-24","stage_classifiercode":"03-07","member_number":"L3347","first_name":"GLENN","last_name":"SEKI","classification":"A","division":"OPEN","hit_factor":6.5247},{"match_name":"SCCCMAY2016","match_date":"2016-05-08","stage_classifiercode":"03-07","member_number":"A26597","first_name":"MAX","last_name":"BEDWELL","classification":"G","division":"OPEN","hit_factor":6.5158},{"match_name":"LA05 Tangi September 2nd USPSA Match 2017","match_date":"2017-09-24","stage_classifiercode":"03-07","member_number":"L2100","first_name":"MAXIENT","last_name":"MICHEL","classification":"M","division":"OPEN","hit_factor":6.4644},{"match_name":"Prescott Action Shooters 1st Saturday USPSA 4-3-21","match_date":"2021-04-03","stage_classifiercode":"03-07","member_number":"FY90353","first_name":"TRAVIS","last_name":"MCCAMISH","classification":"M","division":"OPEN","hit_factor":6.4624},{"match_name":"October 2015 CAS Match","match_date":"2015-10-04","stage_classifiercode":"03-07","member_number":"L2100","first_name":"MAX","last_name":"MICHEL SR.","classification":"M","division":"OPEN","hit_factor":6.456},{"match_name":"CGGR September USPSA Match","match_date":"2016-09-17","stage_classifiercode":"03-07","member_number":"L2664","first_name":"JIM","last_name":"HILSENBECK","classification":"M","division":"OPEN","hit_factor":6.4339},{"match_name":"Ontelaunee USPSA April 2017","match_date":"2017-04-22","stage_classifiercode":"03-07","member_number":"TY16248","first_name":"BARRY","last_name":"RUANE","classification":"M","division":"OPEN","hit_factor":6.4281},{"match_name":"2017 Hawktech Arms Idaho Section Hi-cap Match","match_date":"2017-10-21","stage_classifiercode":"03-07","member_number":"A87873","first_name":"SCOTT","last_name":"MEREDITH","classification":"M","division":"OPEN","hit_factor":6.3844},{"match_name":"PSOCA USPSA May 23 2020 CAGC","match_date":"2020-05-23","stage_classifiercode":"03-07","member_number":"fy89922","first_name":"CHRIS","last_name":"WORKMAN","classification":"A","division":"OPEN","hit_factor":6.366},{"match_name":"GCL Wed 5-3-17","match_date":"2017-05-03","stage_classifiercode":"03-07","member_number":"A11416","first_name":"DENNIS","last_name":"BECK","classification":"M","division":"OPEN","hit_factor":6.3395},{"match_name":"OFGC USPSA Match 7/15/2018","match_date":"2018-07-15","stage_classifiercode":"03-07","member_number":"TY42278","first_name":"KELLY","last_name":"RAGLIN","classification":"M","division":"OPEN","hit_factor":6.3158},{"match_name":"2017 Hawktech Arms Idaho Section Hi-cap Match","match_date":"2017-10-21","stage_classifiercode":"03-07","member_number":"L3657","first_name":"JAMES","last_name":"ONG","classification":"G","division":"OPEN","hit_factor":6.2942},{"match_name":"NISA July 2017","match_date":"2017-07-23","stage_classifiercode":"03-07","member_number":"TY68791","first_name":"MICHAEL","last_name":"GNYRA","classification":"M","division":"OPEN","hit_factor":6.2832},{"match_name":"LTD Pistol - October 2017","match_date":"2017-10-07","stage_classifiercode":"03-07","member_number":"A51363","first_name":"KENNY","last_name":"TERRY","classification":"M","division":"OPEN","hit_factor":6.2827},{"match_name":"Richmond Hot Shots Oct 16-17-2021 USPSA","match_date":"2021-10-16","stage_classifiercode":"03-07","member_number":"TY91248","first_name":"DAVID","last_name":"GEORGE","classification":"M","division":"OPEN","hit_factor":6.2824},{"match_name":"Shoot GTR USPSA 11/29","match_date":"2016-11-29","stage_classifiercode":"03-07","member_number":"TY34497","first_name":"PATRICK","last_name":"GAUVIN","classification":"A","division":"OPEN","hit_factor":6.2786},{"match_name":"NCPS USPSA Handgun Match August 28 2016","match_date":"2016-08-28","stage_classifiercode":"03-07","member_number":"L3657","first_name":"JAMES","last_name":"ONG","classification":"G","division":"OPEN","hit_factor":6.2764},{"match_name":"Rankin Field November Saturday USPSA","match_date":"2021-11-06","stage_classifiercode":"03-07","member_number":"TY109346","first_name":"MADDUX","last_name":"LE","classification":"M","division":"OPEN","hit_factor":6.2702},{"match_name":"BSP ANPRACS 8-20-17","match_date":"2017-08-20","stage_classifiercode":"03-07","member_number":"A27383","first_name":"MANNY","last_name":"AURIGUE","classification":"A","division":"OPEN","hit_factor":6.266},{"match_name":"Springfield Tactical Shooters 08/02/2018","match_date":"2018-08-02","stage_classifiercode":"03-07","member_number":"L2281","first_name":"J","last_name":"GRIFFIN","classification":"A","division":"OPEN","hit_factor":6.25},{"match_name":"Rankin Field Sunday USPSA","match_date":"2017-10-15","stage_classifiercode":"03-07","member_number":"A88732","first_name":"TIGER","last_name":"NGUYEN","classification":"A","division":"OPEN","hit_factor":6.25},{"match_name":"Ontelaunee USPSA April 2017","match_date":"2017-04-22","stage_classifiercode":"03-07","member_number":"TY9036","first_name":"STANLEY","last_name":"DOROSKI","classification":"A","division":"OPEN","hit_factor":6.25},{"match_name":"EAGC September 2018 USPSA Pistol Match","match_date":"2018-09-16","stage_classifiercode":"03-07","member_number":"A79845","first_name":"JOHNNY","last_name":"REED","classification":"A","division":"OPEN","hit_factor":6.2334},{"match_name":"Oxford OHS05 100321","match_date":"2021-10-03","stage_classifiercode":"03-07","member_number":"Ty90792","first_name":"BRAD","last_name":"KRUMME","classification":"A","division":"OPEN","hit_factor":6.2295},{"match_name":"G2G July 27th USPSA Match","match_date":"2021-07-27","stage_classifiercode":"03-07","member_number":"TY101554","first_name":"ALBERT","last_name":"MONTANEZ","classification":"M","division":"OPEN","hit_factor":6.2288},{"match_name":"Fall Madness - UPSA Match","match_date":"2017-10-07","stage_classifiercode":"03-07","member_number":"F89074","first_name":"KEITH","last_name":"ADVICE","classification":"B","division":"OPEN","hit_factor":6.2219},{"match_name":"GoShoot Outdoors April 19th reshoot","match_date":"2020-04-19","stage_classifiercode":"03-07","member_number":"ty91756","first_name":"DAVID","last_name":"MARTON","classification":"A","division":"OPEN","hit_factor":6.2056},{"match_name":"WNPL USPSA Feb 2021","match_date":"2021-02-06","stage_classifiercode":"03-07","member_number":"TY79621","first_name":"STEVE","last_name":"COLLEN","classification":"M","division":"OPEN","hit_factor":6.2051},{"match_name":"Prescott Action Shooters 1st Saturday USPSA 4-3-21","match_date":"2021-04-03","stage_classifiercode":"03-07","member_number":"A49035","first_name":"EDDIE","last_name":"GARCIA","classification":"G","division":"OPEN","hit_factor":6.1989},{"match_name":"NRG September 24th 2016","match_date":"2016-09-24","stage_classifiercode":"03-07","member_number":"FY93402","first_name":"GENG","last_name":"NIE","classification":"U","division":"OPEN","hit_factor":6.1856},{"match_name":"Volusia County Gun and Hunt Club","match_date":"2021-09-18","stage_classifiercode":"03-07","member_number":"A110109","first_name":"MICHAEL","last_name":"GARRO","classification":"A","division":"OPEN","hit_factor":6.1728},{"match_name":"LA05 Tangi September 2nd USPSA Match 2017","match_date":"2017-09-24","stage_classifiercode":"03-07","member_number":"TY28619","first_name":"SCOTT","last_name":"JACOB","classification":"A","division":"OPEN","hit_factor":6.1666},{"match_name":"SAPSA February 2020 Match","match_date":"2020-02-15","stage_classifiercode":"03-07","member_number":"TY60272","first_name":"RICKY","last_name":"HAYES","classification":"C","division":"OPEN","hit_factor":6.1538},{"match_name":"RDS June 2020 USPSA Match","match_date":"2020-06-13","stage_classifiercode":"03-07","member_number":"A79174","first_name":"BRIXEY","last_name":"NELSON","classification":"M","division":"OPEN","hit_factor":6.1517},{"match_name":"Richmond Hot Shots August 4th-5th USPSA Pistol Match","match_date":"2018-08-04","stage_classifiercode":"03-07","member_number":"FY82686","first_name":"CASEY","last_name":"RYAN","classification":"M","division":"OPEN","hit_factor":6.124},{"match_name":"EAGC September 2015 USPSA Pistol Match","match_date":"2015-09-20","stage_classifiercode":"03-07","member_number":"A52706","first_name":"RANDAL","last_name":"WEBB","classification":"M","division":"OPEN","hit_factor":6.1195},{"match_name":"CAPS 9-23-2017","match_date":"2017-09-23","stage_classifiercode":"03-07","member_number":"TY53120","first_name":"BRANDON","last_name":"FARR","classification":"M","division":"OPEN","hit_factor":6.1184},{"match_name":"DSSA 2021-05 USPSA Pistol","match_date":"2021-05-15","stage_classifiercode":"03-07","member_number":"A107778","first_name":"TIM","last_name":"PATTERSON","classification":"A","division":"OPEN","hit_factor":6.1054},{"match_name":"LdF 2nd Saturday USPSA Match","match_date":"2016-12-10","stage_classifiercode":"03-07","member_number":"FY39124","first_name":"RAMIRO","last_name":"REYES","classification":"M","division":"OPEN","hit_factor":6.1006},{"match_name":"DAPS USPSA at ETTS 4-9-2016","match_date":"2016-04-09","stage_classifiercode":"03-07","member_number":"A63662","first_name":"CRAIG","last_name":"STEFFEK","classification":"B","division":"OPEN","hit_factor":6.0886},{"match_name":"RSPP 3rd Saturday April 2016","match_date":"2016-04-16","stage_classifiercode":"03-07","member_number":"TY6397","first_name":"TONY","last_name":"BARONE","classification":"M","division":"OPEN","hit_factor":6.0858},{"match_name":"JCSSA NOV 7 2020","match_date":"2020-11-07","stage_classifiercode":"03-07","member_number":"A76773","first_name":"ZACK","last_name":"CAM","classification":"M","division":"OPEN","hit_factor":6.0815},{"match_name":"Mesilla Valley P November 2021 USPSA match","match_date":"2021-11-21","stage_classifiercode":"03-07","member_number":"L4939","first_name":"GARRETT","last_name":"SCHUTZ","classification":"M","division":"OPEN","hit_factor":6.0709},{"match_name":"Dundee Practical Shooters - June 27 2020 - Points for Pistol","match_date":"2020-06-27","stage_classifiercode":"03-07","member_number":"81899","first_name":"TANNER","last_name":"BREEN","classification":"A","division":"OPEN","hit_factor":6.0606},{"match_name":"PMSC May 2017","match_date":"2017-05-07","stage_classifiercode":"03-07","member_number":"l1205","first_name":"STEVE","last_name":"MARTIN","classification":"G","division":"OPEN","hit_factor":6.0606},{"match_name":"GoShoot Outdoors April 19th reshoot","match_date":"2020-04-19","stage_classifiercode":"03-07","member_number":"TY120968","first_name":"NICK","last_name":"YOUNG","classification":"B","division":"OPEN","hit_factor":6.053},{"match_name":"LTD Pistol - October 2017","match_date":"2017-10-07","stage_classifiercode":"03-07","member_number":"TY53120","first_name":"BRANDON","last_name":"FARR","classification":"M","division":"OPEN","hit_factor":6.035},{"match_name":"2017 Hawktech Arms Idaho Section Hi-cap Match","match_date":"2017-10-21","stage_classifiercode":"03-07","member_number":"A79438","first_name":"KOLBY","last_name":"PAVLOCK","classification":"G","division":"OPEN","hit_factor":6.0284},{"match_name":"SAPSA September 2018","match_date":"2018-09-15","stage_classifiercode":"03-07","member_number":"TY34497","first_name":"PATRICK","last_name":"GAUVIN","classification":"M","division":"OPEN","hit_factor":6.0271},{"match_name":"DSSA 2021-05 USPSA Pistol","match_date":"2021-05-15","stage_classifiercode":"03-07","member_number":"TY42086","first_name":"BILL","last_name":"JACKSON","classification":"A","division":"OPEN","hit_factor":6.0265},{"match_name":"2017 Hawktech Arms Idaho Section Hi-cap Match","match_date":"2017-10-21","stage_classifiercode":"03-07","member_number":"A89492","first_name":"JESSE","last_name":"CLAUSSE","classification":"A","division":"OPEN","hit_factor":6.0264},{"match_name":"Medford USPSA June 2016 Match","match_date":"2016-06-19","stage_classifiercode":"03-07","member_number":"L1828","first_name":"OMAR","last_name":"NEWBURY","classification":"A","division":"OPEN","hit_factor":6.0218},{"match_name":"NRG Saturday November 13th Includes a Classifier Stage","match_date":"2021-11-13","stage_classifiercode":"03-07","member_number":"L1102","first_name":"TOM","last_name":"FACE","classification":"M","division":"OPEN","hit_factor":6.0209},{"match_name":"CGC 2016-05-14","match_date":"2016-05-14","stage_classifiercode":"03-07","member_number":"TY52571","first_name":"PETER","last_name":"OLIVER","classification":"M","division":"OPEN","hit_factor":6.0201},{"match_name":"DSSA 2021-05 USPSA Pistol","match_date":"2021-05-15","stage_classifiercode":"03-07","member_number":"TY64738","first_name":"GERWIN","last_name":"HENN","classification":"M","division":"OPEN","hit_factor":6.0188},{"match_name":"Mn16 FIRING LINE USPSA 03-03-20","match_date":"2020-03-03","stage_classifiercode":"03-07","member_number":"a115493","first_name":"AARON","last_name":"EHALT","classification":"U","division":"OPEN","hit_factor":6.0095},{"match_name":"Oxford OHS05 100321","match_date":"2021-10-03","stage_classifiercode":"03-07","member_number":"A119451","first_name":"JAMES","last_name":"PETERS","classification":"B","division":"OPEN","hit_factor":6.0095},{"match_name":"October 2015 CAS Match","match_date":"2015-10-04","stage_classifiercode":"03-07","member_number":"TY63532","first_name":"GEORGE","last_name":"HEMSTAD","classification":"M","division":"OPEN","hit_factor":6.006},{"match_name":"NTPS-SE January 2017","match_date":"2017-01-21","stage_classifiercode":"03-07","member_number":"TY82182","first_name":"NORMA","last_name":"LEGADOS","classification":"B","division":"OPEN","hit_factor":6.0039},{"match_name":"JPPS USPSA Club Match 6-2-18","match_date":"2018-06-02","stage_classifiercode":"03-07","member_number":"A23320","first_name":"JOHN","last_name":"STIEDLE","classification":"M","division":"OPEN","hit_factor":5.9807},{"match_name":"Sage Pistol League USPSA  August 15 2021","match_date":"2021-08-15","stage_classifiercode":"03-07","member_number":"A79733","first_name":"SCOTT","last_name":"MAWSON","classification":"M","division":"OPEN","hit_factor":5.9701},{"match_name":"Richmond Hot Shots Oct 16-17-2021 USPSA","match_date":"2021-10-16","stage_classifiercode":"03-07","member_number":"Ty73903","first_name":"JOSEPH","last_name":"AUSTRIA","classification":"A","division":"OPEN","hit_factor":5.9664},{"match_name":"Ontelaunee USPSA April 2017","match_date":"2017-04-22","stage_classifiercode":"03-07","member_number":"L3463","first_name":"DEMETRI","last_name":"KATOS","classification":"A","division":"OPEN","hit_factor":5.9524},{"match_name":"LBAS160820","match_date":"2016-08-20","stage_classifiercode":"03-07","member_number":"TY31924","first_name":"OTIS","last_name":"AUSTIN","classification":"M","division":"OPEN","hit_factor":5.9467},{"match_name":"Prescott Action Shooters 1st Saturday USPSA 08-07-21","match_date":"2021-08-07","stage_classifiercode":"03-07","member_number":"TY25586","first_name":"JOE","last_name":"BRIDGMAN","classification":"G","division":"OPEN","hit_factor":5.9441},{"match_name":"NRG September 24th 2016","match_date":"2016-09-24","stage_classifiercode":"03-07","member_number":"\"\"","first_name":"KEITH","last_name":"HOLLAND","classification":"G","division":"OPEN","hit_factor":5.9393},{"match_name":"Fall Madness - UPSA Match","match_date":"2017-10-07","stage_classifiercode":"03-07","member_number":"A81629","first_name":"PHILLIP","last_name":"REDDY","classification":"M","division":"OPEN","hit_factor":5.9354},{"match_name":"RSPP 3rd Saturday April 2016","match_date":"2016-04-16","stage_classifiercode":"03-07","member_number":"TY85183","first_name":"DANNY","last_name":"D'ANGELO","classification":"A","division":"OPEN","hit_factor":5.9333},{"match_name":"GCL May 6-2017","match_date":"2017-05-06","stage_classifiercode":"03-07","member_number":"FY39257","first_name":"PAUL","last_name":"ROBERTS","classification":"M","division":"OPEN","hit_factor":5.9273},{"match_name":"October 2015 CAS Match","match_date":"2015-10-04","stage_classifiercode":"03-07","member_number":"FY81419","first_name":"JOHN","last_name":"NGUYEN","classification":"A","division":"OPEN","hit_factor":5.9264},{"match_name":"Griffin USPSA AUG 2018","match_date":"2018-08-18","stage_classifiercode":"03-07","member_number":"A79845","first_name":"JOHNNY","last_name":"REED","classification":"A","division":"OPEN","hit_factor":5.9215},{"match_name":"Oxford OHS05 100321","match_date":"2021-10-03","stage_classifiercode":"03-07","member_number":"A24498","first_name":"LON","last_name":"ETCHISON","classification":"B","division":"OPEN","hit_factor":5.9202},{"match_name":"Volusia County Gun and Hunt Club","match_date":"2021-09-18","stage_classifiercode":"03-07","member_number":"FY91472","first_name":"BRUCE","last_name":"STEIN","classification":"A","division":"OPEN","hit_factor":5.9097},{"match_name":"2017 Hawktech Arms Idaho Section Hi-cap Match","match_date":"2017-10-21","stage_classifiercode":"03-07","member_number":"A84287","first_name":"SHANE","last_name":"STEUBE","classification":"A","division":"OPEN","hit_factor":5.9012},{"match_name":"Morning SMPS 12 July 2020 USPSA Classifier Match","match_date":"2020-07-12","stage_classifiercode":"03-07","member_number":"FY15413","first_name":"TOM","last_name":"SUIT","classification":"M","division":"OPEN","hit_factor":5.8938},{"match_name":"SCCCMAY2016","match_date":"2016-05-08","stage_classifiercode":"03-07","member_number":"a83157","first_name":"PATRICK","last_name":"RAFFERTY","classification":"B","division":"OPEN","hit_factor":5.8861},{"match_name":"Ontelaunee USPSA April 2017","match_date":"2017-04-22","stage_classifiercode":"03-07","member_number":"A33985","first_name":"DONALD","last_name":"SEIGLE","classification":"M","division":"OPEN","hit_factor":5.8859},{"match_name":"RSPP 3rd Saturday April 2016","match_date":"2016-04-16","stage_classifiercode":"03-07","member_number":"A88480","first_name":"DANIEL","last_name":"LINDEGREN","classification":"A","division":"OPEN","hit_factor":5.8613},{"match_name":"TAC2 USPSA AUGUST 2018","match_date":"2018-08-04","stage_classifiercode":"03-07","member_number":"TY62447","first_name":"ADRIAN 2G","last_name":"COBB","classification":"U","division":"OPEN","hit_factor":5.8601},{"match_name":"Nampa USPSA May 17th","match_date":"2020-05-17","stage_classifiercode":"03-07","member_number":"A106643","first_name":"EUGENE","last_name":"DINA","classification":"B","division":"OPEN","hit_factor":5.8534},{"match_name":"WTPS USPSA March Classifier 3-10-18","match_date":"2018-03-10","stage_classifiercode":"03-07","member_number":"TY101554","first_name":"ALBERT","last_name":"MONTANEZ","classification":"A","division":"OPEN","hit_factor":5.8527},{"match_name":"Prescott Action Shooters 1st Saturday USPSA 08-07-21","match_date":"2021-08-07","stage_classifiercode":"03-07","member_number":"TY54668","first_name":"DAVE","last_name":"ZINK","classification":"M","division":"OPEN","hit_factor":5.8501},{"match_name":"2017 Hawktech Arms Idaho Section Hi-cap Match","match_date":"2017-10-21","stage_classifiercode":"03-07","member_number":"A89438","first_name":"NICHOLAS","last_name":"STOCKWELL","classification":"G","division":"OPEN","hit_factor":5.8413},{"match_name":"Minnetonka Game And Fish July 25","match_date":"2018-07-25","stage_classifiercode":"03-07","member_number":"Ty91806","first_name":"JOSH","last_name":"FROELICH","classification":"G","division":"OPEN","hit_factor":5.8374},{"match_name":"NRG Saturday November 13th Includes a Classifier Stage","match_date":"2021-11-13","stage_classifiercode":"03-07","member_number":"A50487","first_name":"ED","last_name":"BENEDETTO","classification":"M","division":"OPEN","hit_factor":5.824},{"match_name":"Richmond Hot Shots Oct 16-17-2021 USPSA","match_date":"2021-10-16","stage_classifiercode":"03-07","member_number":"L2908","first_name":"JOHNNY","last_name":"LIM","classification":"A","division":"OPEN","hit_factor":5.8228},{"match_name":"October 2015 CAS Match","match_date":"2015-10-04","stage_classifiercode":"03-07","member_number":"A85466","first_name":"CHRIS","last_name":"CARNEY","classification":"A","division":"OPEN","hit_factor":5.8168},{"match_name":"July 6 2016 A Zone","match_date":"2016-07-06","stage_classifiercode":"03-07","member_number":"L3082","first_name":"ROY","last_name":"STEDMAN","classification":"G","division":"OPEN","hit_factor":5.8166},{"match_name":"DAPS USPSA @ ETTS 10-14-17","match_date":"2017-10-14","stage_classifiercode":"03-07","member_number":"TY47162","first_name":"SCOTT","last_name":"STOCKTON","classification":"G","division":"OPEN","hit_factor":5.8153},{"match_name":"Oxford OHS05 100321","match_date":"2021-10-03","stage_classifiercode":"03-07","member_number":"TY54513","first_name":"CHRIS","last_name":"OLKA","classification":"B","division":"OPEN","hit_factor":5.8116},{"match_name":"Mesilla Valley P November 2021 USPSA match","match_date":"2021-11-21","stage_classifiercode":"03-07","member_number":"L4919","first_name":"DEREK","last_name":"DRISCOLL","classification":"M","division":"OPEN","hit_factor":5.7935},{"match_name":"JCSSA NOV 7 2020","match_date":"2020-11-07","stage_classifiercode":"03-07","member_number":"TY12021","first_name":"RAGS","last_name":"CONNAWAY","classification":"A","division":"OPEN","hit_factor":5.7904},{"match_name":"TPS USPSA AT CMP MARCH 20 2021","match_date":"2021-03-20","stage_classifiercode":"03-07","member_number":"A118815","first_name":"MICHAEL","last_name":"HWANG","classification":"G","division":"OPEN","hit_factor":5.7741},{"match_name":"GoShoot Outdoor October 17th","match_date":"2021-10-17","stage_classifiercode":"03-07","member_number":"TY91756","first_name":"DAVID","last_name":"MARTON","classification":"A","division":"OPEN","hit_factor":5.7692},{"match_name":"SPSA USPSA February 4th Sat match","match_date":"2020-02-22","stage_classifiercode":"03-07","member_number":"A102564","first_name":"DONALD","last_name":"POWERS","classification":"M","division":"OPEN","hit_factor":5.7667},{"match_name":"PCWC USPSA  5 27 2017","match_date":"2017-05-27","stage_classifiercode":"03-07","member_number":"L2664","first_name":"JIM","last_name":"HILSENBECK","classification":"M","division":"OPEN","hit_factor":5.761},{"match_name":"June 12 2021 The Range At True North USPSA Match","match_date":"2021-06-12","stage_classifiercode":"03-07","member_number":"L729","first_name":"ROBERT","last_name":"WALKER","classification":"A","division":"OPEN","hit_factor":5.7576},{"match_name":"Renton USPSA - April 2021 - NW05","match_date":"2021-04-25","stage_classifiercode":"03-07","member_number":"TY98462","first_name":"PETER","last_name":"RYAKHOVSKIY","classification":"M","division":"OPEN","hit_factor":5.754},{"match_name":"ORPCI USPSA Saturday 2021.10.16","match_date":"2021-10-16","stage_classifiercode":"03-07","member_number":"A120666","first_name":"PATRICK","last_name":"EAMES","classification":"B","division":"OPEN","hit_factor":5.7528},{"match_name":"Ontelaunee USPSA September 2015","match_date":"2015-09-27","stage_classifiercode":"03-07","member_number":"L1158","first_name":"JIM","last_name":"HAND","classification":"M","division":"OPEN","hit_factor":5.7449},{"match_name":"SPSA USPSA December 4th Sat match","match_date":"2017-12-23","stage_classifiercode":"03-07","member_number":"L3906","first_name":"ARIC","last_name":"COWART","classification":"A","division":"OPEN","hit_factor":5.7416},{"match_name":"PGC May 2021 USPSA ","match_date":"2021-04-30","stage_classifiercode":"03-07","member_number":"A94517","first_name":"CORY","last_name":"FRIEDMAN","classification":"A","division":"OPEN","hit_factor":5.7367},{"match_name":"Renton USPSA - April 2021 - NW05","match_date":"2021-04-25","stage_classifiercode":"03-07","member_number":"Ty66256","first_name":"LOKE","last_name":"TAN","classification":"G","division":"OPEN","hit_factor":5.7325},{"match_name":"FVPS September USPSA Match","match_date":"2016-09-03","stage_classifiercode":"03-07","member_number":"TY72120","first_name":"DAVE","last_name":"DEYOE","classification":"M","division":"OPEN","hit_factor":5.7292},{"match_name":"Nampa USPSA May 17th","match_date":"2020-05-17","stage_classifiercode":"03-07","member_number":"TY85172","first_name":"MIKE","last_name":"O'LEARY","classification":"M","division":"OPEN","hit_factor":5.7249},{"match_name":"NRG Saturday November 13th Includes a Classifier Stage","match_date":"2021-11-13","stage_classifiercode":"03-07","member_number":"A87556","first_name":"ROB","last_name":"CHOI","classification":"GM","division":"OPEN","hit_factor":5.7235},{"match_name":"TPS USPSA AT CMP MARCH 20 2021","match_date":"2021-03-20","stage_classifiercode":"03-07","member_number":"L3655","first_name":"DARREN","last_name":"MULFORD","classification":"M","division":"OPEN","hit_factor":5.7217},{"match_name":"SPSA USPSA February 4th Sat match","match_date":"2020-02-22","stage_classifiercode":"03-07","member_number":"A21860","first_name":"LARRY","last_name":"WEBER","classification":"B","division":"OPEN","hit_factor":5.7091},{"match_name":"DRRC USPSA Mar2018","match_date":"2018-03-03","stage_classifiercode":"03-07","member_number":"L3893","first_name":"MICHAEL","last_name":"BURGESS","classification":"B","division":"OPEN","hit_factor":5.6973},{"match_name":"FLPSA USPSA 04.23.2016","match_date":"2016-04-23","stage_classifiercode":"03-07","member_number":"A92806","first_name":"JOSH","last_name":"FROELICH","classification":"B","division":"OPEN","hit_factor":5.697},{"match_name":"Renton USPSA - April 2021 - NW05","match_date":"2021-04-25","stage_classifiercode":"03-07","member_number":"TY96141","first_name":"JAIMEE","last_name":"MENDOZA","classification":"M","division":"OPEN","hit_factor":5.6931},{"match_name":"Richmond Hot Shots Oct 16-17-2021 USPSA","match_date":"2021-10-16","stage_classifiercode":"03-07","member_number":"TY96836","first_name":"JOSEF","last_name":"RAPADAS","classification":"M","division":"OPEN","hit_factor":5.6895},{"match_name":"Mesilla Valley P November 2021 USPSA match","match_date":"2021-11-21","stage_classifiercode":"03-07","member_number":"TY119661","first_name":"ROBERT","last_name":"WILSON","classification":"A","division":"OPEN","hit_factor":5.6872},{"match_name":"BHPSC Weekly Match 1-29-2016","match_date":"2016-01-30","stage_classifiercode":"03-07","member_number":"L1870","first_name":"LES","last_name":"COX","classification":"M","division":"OPEN","hit_factor":5.6769},{"match_name":"Extreme GM USPSA 5-8","match_date":"2021-05-05","stage_classifiercode":"03-07","member_number":"FY91472","first_name":"BRUCE","last_name":"STEIN","classification":"A","division":"OPEN","hit_factor":5.6742},{"match_name":"G2G July 27th USPSA Match","match_date":"2021-07-27","stage_classifiercode":"03-07","member_number":"L3674","first_name":"AUGUST","last_name":"BALAGTAS","classification":"M","division":"OPEN","hit_factor":5.6695},{"match_name":"Dundee Practical Shooters - June 27 2020 - Points for Pistol","match_date":"2020-06-27","stage_classifiercode":"03-07","member_number":"A81898","first_name":"JIM","last_name":"BREEN","classification":"B","division":"OPEN","hit_factor":5.6695},{"match_name":"NRG Saturday December 22nd - Includes a Classifier Stage","match_date":"2018-12-22","stage_classifiercode":"03-07","member_number":"\"\"","first_name":"JUN","last_name":"AGUILERA","classification":"M","division":"OPEN","hit_factor":5.6673},{"match_name":"SFPS 8-23-20 USPSA","match_date":"2020-08-23","stage_classifiercode":"03-07","member_number":"b58","first_name":"SHERWYN","last_name":"GREENFIELD","classification":"M","division":"OPEN","hit_factor":5.6576},{"match_name":"2017 Hawktech Arms Idaho Section Hi-cap Match","match_date":"2017-10-21","stage_classifiercode":"03-07","member_number":"A84371","first_name":"RYAN","last_name":"GOOLD","classification":"G","division":"OPEN","hit_factor":5.6569},{"match_name":"Richmond Hot Shots August 4th-5th USPSA Pistol Match","match_date":"2018-08-04","stage_classifiercode":"03-07","member_number":"TY79640","first_name":"ELPIDIO","last_name":"CORPUZ","classification":"A","division":"OPEN","hit_factor":5.6569},{"match_name":"Ontelaunee USPSA April 2017","match_date":"2017-04-22","stage_classifiercode":"03-07","member_number":"A82014","first_name":"TONY","last_name":"SPINILLO","classification":"B","division":"OPEN","hit_factor":5.6522},{"match_name":"Richmond Hot Shots Oct 16-17-2021 USPSA","match_date":"2021-10-16","stage_classifiercode":"03-07","member_number":"Ty98008","first_name":"JANET","last_name":"TSUI","classification":"A","division":"OPEN","hit_factor":5.6389},{"match_name":"Klamath USPSA 05/01/16 JSPS OR09","match_date":"2016-05-01","stage_classifiercode":"03-07","member_number":"A85507","first_name":"JONATHAN H","last_name":"PURTZER","classification":"B","division":"OPEN","hit_factor":5.6364},{"match_name":"CGC CTX02 Monthly USPSA Match - August 2021","match_date":"2021-08-29","stage_classifiercode":"03-07","member_number":"A46707","first_name":"COLT","last_name":"WILKINSON","classification":"M","division":"OPEN","hit_factor":5.6354},{"match_name":"Mesilla Valley P November 2021 USPSA match","match_date":"2021-11-21","stage_classifiercode":"03-07","member_number":"A89655","first_name":"FERMIN","last_name":"TRUJILLO","classification":"A","division":"OPEN","hit_factor":5.6265},{"match_name":"CAPS 9-23-2017","match_date":"2017-09-23","stage_classifiercode":"03-07","member_number":"A99820","first_name":"KLAY","last_name":"GROVER","classification":"B","division":"OPEN","hit_factor":5.6257},{"match_name":"EAGC September 2018 USPSA Pistol Match","match_date":"2018-09-16","stage_classifiercode":"03-07","member_number":"A106020","first_name":"JACOB","last_name":"TAYLOR","classification":"A","division":"OPEN","hit_factor":5.6239},{"match_name":"NRG Saturday December 22nd - Includes a Classifier Stage","match_date":"2018-12-22","stage_classifiercode":"03-07","member_number":"L1993","first_name":"JOJO","last_name":"VIDANES","classification":"G","division":"OPEN","hit_factor":5.6222},{"match_name":"MCAS USPSA October 2016","match_date":"2016-10-15","stage_classifiercode":"03-07","member_number":"FY69896","first_name":"JIM","last_name":"SANDERS","classification":"B","division":"OPEN","hit_factor":5.6147},{"match_name":"CGC 2016-05-14","match_date":"2016-05-14","stage_classifiercode":"03-07","member_number":"TY57617","first_name":"ERIC","last_name":"DAVIS","classification":"B","division":"OPEN","hit_factor":5.6132},{"match_name":"Emmett May  Match","match_date":"2016-05-28","stage_classifiercode":"03-07","member_number":"a79280","first_name":"ERIK","last_name":"SMITH","classification":"A","division":"OPEN","hit_factor":5.6019},{"match_name":"2017 Hawktech Arms Idaho Section Hi-cap Match","match_date":"2017-10-21","stage_classifiercode":"03-07","member_number":"TY75664","first_name":"GREG","last_name":"BLAIR","classification":"B","division":"OPEN","hit_factor":5.597},{"match_name":"PMRPC USPSA 12Dec20 - all Classifier","match_date":"2020-12-12","stage_classifiercode":"03-07","member_number":"A78915","first_name":"STEVE","last_name":"KAWASMY","classification":"B","division":"OPEN","hit_factor":5.5961},{"match_name":"Fairfax PS USPSA 2020 March","match_date":"2020-03-17","stage_classifiercode":"03-07","member_number":"TY97341","first_name":"JAMES","last_name":"HAN","classification":"\"\"","division":"OPEN","hit_factor":5.5882},{"match_name":"Richmond Hot Shots Oct 16-17-2021 USPSA","match_date":"2021-10-16","stage_classifiercode":"03-07","member_number":"TY94643","first_name":"CARLSON","last_name":"SETO","classification":"B","division":"OPEN","hit_factor":5.5853},{"match_name":"Ontelaunee USPSA April 2017","match_date":"2017-04-22","stage_classifiercode":"03-07","member_number":"L1476","first_name":"JAMES","last_name":"CHESTNUT","classification":"A","division":"OPEN","hit_factor":5.585},{"match_name":"TPS USPSA -  December","match_date":"2017-12-09","stage_classifiercode":"03-07","member_number":"A87135","first_name":"ENVER","last_name":"FOCAKOVIC","classification":"A","division":"OPEN","hit_factor":5.5814},{"match_name":"SLOSA March 2018 USPSA MATCH","match_date":"2018-03-10","stage_classifiercode":"03-07","member_number":"TY87459","first_name":"AARON","last_name":"RUNYAN","classification":"B","division":"OPEN","hit_factor":5.5811},{"match_name":"GRRC Week 8 2020","match_date":"2020-06-29","stage_classifiercode":"03-07","member_number":"A91806","first_name":"JOSHUA","last_name":"FROELICH","classification":"M","division":"OPEN","hit_factor":5.5591},{"match_name":"GCL Wed 5-3-17","match_date":"2017-05-03","stage_classifiercode":"03-07","member_number":"TY21034","first_name":"BOB","last_name":"URBAN","classification":"M","division":"OPEN","hit_factor":5.5556},{"match_name":"FLPSA USPSA 04.23.2016","match_date":"2016-04-23","stage_classifiercode":"03-07","member_number":"TY29847","first_name":"ROSS","last_name":"ROSENBERG","classification":"A","division":"OPEN","hit_factor":5.5457},{"match_name":"LdF USPSA Match January 13 2018","match_date":"2018-01-13","stage_classifiercode":"03-07","member_number":"TY67281","first_name":"RYAN","last_name":"MCNAMARA","classification":"M","division":"OPEN","hit_factor":5.5426},{"match_name":"March 13 2021 The Range At True North USPSA Match","match_date":"2021-03-13","stage_classifiercode":"03-07","member_number":"TY83654","first_name":"JASON","last_name":"ROBERTS","classification":"M","division":"OPEN","hit_factor":5.5422},{"match_name":"PCWC USPSA  5 27 2017","match_date":"2017-05-27","stage_classifiercode":"03-07","member_number":"A90156","first_name":"STEVE","last_name":"EVERETT","classification":"U","division":"OPEN","hit_factor":5.5395},{"match_name":"LCSC Linden USPSA 082221","match_date":"2021-08-21","stage_classifiercode":"03-07","member_number":"ty91248","first_name":"DAVID","last_name":"GEORGE","classification":"M","division":"OPEN","hit_factor":5.5385},{"match_name":"Midwest Shooting Center April 15th","match_date":"2021-04-15","stage_classifiercode":"03-07","member_number":"A46956","first_name":"CHRIS","last_name":"KEEN","classification":"G","division":"OPEN","hit_factor":5.5327},{"match_name":"Ontelaunee USPSA April 2017","match_date":"2017-04-22","stage_classifiercode":"03-07","member_number":"FY73439","first_name":"CHRIS","last_name":"OLSZEWSKI","classification":"A","division":"OPEN","hit_factor":5.5283},{"match_name":"OFGC USPSA Match 8-15-21","match_date":"2021-08-15","stage_classifiercode":"03-07","member_number":"TY80501","first_name":"JON-LUC","last_name":"RUBEN","classification":"U","division":"OPEN","hit_factor":5.527},{"match_name":"AL20","match_date":"2021-04-14","stage_classifiercode":"03-07","member_number":"a115017","first_name":"BRUCE","last_name":"ERLINGER","classification":"A","division":"OPEN","hit_factor":5.5262},{"match_name":"CGC 2016-05-14","match_date":"2016-05-14","stage_classifiercode":"03-07","member_number":"L1020","first_name":"TATA","last_name":"EUSIBIO","classification":"C","division":"OPEN","hit_factor":5.5258},{"match_name":"ORSA USPSA August 2017 Match","match_date":"2017-08-16","stage_classifiercode":"03-07","member_number":"A76106","first_name":"KEN","last_name":"HARDIN","classification":"U","division":"OPEN","hit_factor":5.5249},{"match_name":"RSPP 3rd Saturday April 2016","match_date":"2016-04-16","stage_classifiercode":"03-07","member_number":"FY24902","first_name":"KEVIN","last_name":"LAMB","classification":"A","division":"OPEN","hit_factor":5.52},{"match_name":"MCPSL Pistol 3-12-16","match_date":"2016-03-12","stage_classifiercode":"03-07","member_number":"TY29453","first_name":"JD","last_name":"SMITH","classification":"M","division":"OPEN","hit_factor":5.5193},{"match_name":"DAPS USPSA @ ETTS 10-14-17","match_date":"2017-10-14","stage_classifiercode":"03-07","member_number":"TY53799","first_name":"LEE","last_name":"NEEL","classification":"G","division":"OPEN","hit_factor":5.5149},{"match_name":"SAPSC Monthly USPSA Classifier Match 20160913","match_date":"2016-09-13","stage_classifiercode":"03-07","member_number":"A79845","first_name":"JOHNNY","last_name":"REED","classification":"B","division":"OPEN","hit_factor":5.5145},{"match_name":"GCL May 6-2017","match_date":"2017-05-06","stage_classifiercode":"03-07","member_number":"TY21034","first_name":"BOB","last_name":"URBAN","classification":"M","division":"OPEN","hit_factor":5.509},{"match_name":"2018-10-06 USPSA at Phoenix Rod and Gun Club","match_date":"2018-10-06","stage_classifiercode":"03-07","member_number":"FY10574","first_name":"RICH","last_name":"REED","classification":"A","division":"OPEN","hit_factor":5.5072},{"match_name":"Richmond Hot Shots August 4th-5th USPSA Pistol Match","match_date":"2018-08-04","stage_classifiercode":"03-07","member_number":"TY91248","first_name":"DAVID","last_name":"GEORGE","classification":"M","division":"OPEN","hit_factor":5.5046},{"match_name":"NCPS USPSA Handgun Match August 28 2016","match_date":"2016-08-28","stage_classifiercode":"03-07","member_number":"TY46152","first_name":"ALLEN","last_name":"LOWE","classification":"M","division":"OPEN","hit_factor":5.4932},{"match_name":"Mapsa 2017 O8 12","match_date":"2017-08-11","stage_classifiercode":"03-07","member_number":"FY69138","first_name":"JOHN","last_name":"CEDARBERG","classification":"A","division":"OPEN","hit_factor":5.4931},{"match_name":"Volusia County Gun and Hunt Club","match_date":"2021-09-18","stage_classifiercode":"03-07","member_number":"a83270","first_name":"LEE","last_name":"NUGUIT","classification":"A","division":"OPEN","hit_factor":5.4847},{"match_name":"HOPS USPSA 052116","match_date":"2016-05-21","stage_classifiercode":"03-07","member_number":"L1870","first_name":"LES","last_name":"COX","classification":"M","division":"OPEN","hit_factor":5.4802},{"match_name":"SPSA USPSA February 4th Sat match","match_date":"2020-02-22","stage_classifiercode":"03-07","member_number":"A122649","first_name":"PATRICK","last_name":"CHAMBERLAIN","classification":"A","division":"OPEN","hit_factor":5.4795},{"match_name":"Medford USPSA June 2016 Match","match_date":"2016-06-19","stage_classifiercode":"03-07","member_number":"\"\"","first_name":"ED","last_name":"BOENING","classification":"M","division":"OPEN","hit_factor":5.4724},{"match_name":"Ontelaunee USPSA September 2015","match_date":"2015-09-27","stage_classifiercode":"03-07","member_number":"A30857","first_name":"GIANLUIGI","last_name":"VALERI","classification":"B","division":"OPEN","hit_factor":5.4674},{"match_name":"SCCCMAY2016","match_date":"2016-05-08","stage_classifiercode":"03-07","member_number":"a75113","first_name":"BILLY","last_name":"EMBERTON","classification":"B","division":"OPEN","hit_factor":5.4651},{"match_name":"BPSA September 2016 USPSA","match_date":"2016-09-25","stage_classifiercode":"03-07","member_number":"A77322","first_name":"ROGER","last_name":"HENN","classification":"A","division":"OPEN","hit_factor":5.4589},{"match_name":"MPPL 07012017  We the People","match_date":"2017-07-01","stage_classifiercode":"03-07","member_number":"L4210","first_name":"BONG","last_name":"BARRANCO","classification":"B","division":"OPEN","hit_factor":5.4524},{"match_name":"OREGON ARPC CC05 USPSA Feb 11 2017","match_date":"2017-02-11","stage_classifiercode":"03-07","member_number":"A88441","first_name":"KYLE","last_name":"SAYEG","classification":"B","division":"OPEN","hit_factor":5.4502},{"match_name":"2017 Hawktech Arms Idaho Section Hi-cap Match","match_date":"2017-10-21","stage_classifiercode":"03-07","member_number":"L2719","first_name":"TIM","last_name":"EGAN","classification":"A","division":"OPEN","hit_factor":5.4493},{"match_name":"Space Coast Practical Shooters","match_date":"2017-04-01","stage_classifiercode":"03-07","member_number":"A82476","first_name":"DUSTIN","last_name":"ROBSON","classification":"A","division":"OPEN","hit_factor":5.4433},{"match_name":"LIPSA - November 4th 2018 - USPSA Classifier Match","match_date":"2018-11-04","stage_classifiercode":"03-07","member_number":"L3463","first_name":"DEMETRI","last_name":"KATOS","classification":"A","division":"OPEN","hit_factor":5.4422},{"match_name":"LCAS April 2017 USPSA","match_date":"2017-04-01","stage_classifiercode":"03-07","member_number":"A73178","first_name":"JOE","last_name":"WILLIS","classification":"A","division":"OPEN","hit_factor":5.4422},{"match_name":"Minot All Classifier Match","match_date":"2017-03-12","stage_classifiercode":"03-07","member_number":"A52173","first_name":"WESLEY","last_name":"THOMAS","classification":"B","division":"OPEN","hit_factor":5.4422},{"match_name":"WNPL USPSA Feb 2021","match_date":"2021-02-06","stage_classifiercode":"03-07","member_number":"A112952","first_name":"CYLE","last_name":"FISCHER","classification":"B","division":"OPEN","hit_factor":5.4396},{"match_name":"Dundee Practical Shooters - June 27 2020 - Points for Pistol","match_date":"2020-06-27","stage_classifiercode":"03-07","member_number":"A101001","first_name":"TIM","last_name":"AUSTIN","classification":"A","division":"OPEN","hit_factor":5.4335},{"match_name":"LGCSEMPS AUGUST 2020 HANDGUN","match_date":"2020-08-08","stage_classifiercode":"03-07","member_number":"A54446","first_name":"WILLIAM","last_name":"MONTGOMERY","classification":"B","division":"OPEN","hit_factor":5.4299},{"match_name":"MAPSA June Special Classifier","match_date":"2018-06-09","stage_classifiercode":"03-07","member_number":"FY69138","first_name":"JOHN","last_name":"CEDARBERG","classification":"A","division":"OPEN","hit_factor":5.4287},{"match_name":"Ontelaunee USPSA April 2017","match_date":"2017-04-22","stage_classifiercode":"03-07","member_number":"A68001","first_name":"GUS","last_name":"VANETTEN","classification":"B","division":"OPEN","hit_factor":5.4259},{"match_name":"NRG Saturday December 22nd - Includes a Classifier Stage","match_date":"2018-12-22","stage_classifiercode":"03-07","member_number":"TY71742","first_name":"OLIVER","last_name":"PADIOS","classification":"B","division":"OPEN","hit_factor":5.4245},{"match_name":"SAPSC Weekly USPSA Fun Match at Autreys Armory 20170919","match_date":"2017-09-19","stage_classifiercode":"03-07","member_number":"A79845","first_name":"JOHNNY","last_name":"REED","classification":"A","division":"OPEN","hit_factor":5.4234},{"match_name":"HPSP Heartland Practical Shooters June USPSA Shoot","match_date":"2018-06-24","stage_classifiercode":"03-07","member_number":"A81355","first_name":"MATT","last_name":"SEIDEL","classification":"Unclassified","division":"OPEN","hit_factor":5.4224},{"match_name":"OREGON ARPC CC05 USPSA Feb 11 2017","match_date":"2017-02-11","stage_classifiercode":"03-07","member_number":"l3432","first_name":"AL","last_name":"SUH","classification":"A","division":"OPEN","hit_factor":5.4221},{"match_name":"Monday Rematch","match_date":"2017-08-14","stage_classifiercode":"03-07","member_number":"ty88829","first_name":"DRSPRR","last_name":"STEVE","classification":"A","division":"OPEN","hit_factor":5.4196},{"match_name":"FVPS September USPSA Match","match_date":"2016-09-03","stage_classifiercode":"03-07","member_number":"A71862","first_name":"JOSEPH","last_name":"SINYAKOVICH","classification":"B","division":"OPEN","hit_factor":5.4179},{"match_name":"SAPSA September 2018","match_date":"2018-09-15","stage_classifiercode":"03-07","member_number":"A30555","first_name":"DAVID","last_name":"WILDS","classification":"M","division":"OPEN","hit_factor":5.4136},{"match_name":"CGGR November USPSA Match","match_date":"2017-11-18","stage_classifiercode":"03-07","member_number":"TY88829","first_name":"STEVE","last_name":"DRAPER","classification":"A","division":"OPEN","hit_factor":5.4069},{"match_name":"PTPC May 2nd USPSA Match","match_date":"2021-05-02","stage_classifiercode":"03-07","member_number":"TY43340","first_name":"MARTIN","last_name":"GUTT","classification":"M","division":"OPEN","hit_factor":5.4054},{"match_name":"Ontelaunee USPSA September 2015","match_date":"2015-09-27","stage_classifiercode":"03-07","member_number":"A70990","first_name":"STACEY","last_name":"BORGIA","classification":"M","division":"OPEN","hit_factor":5.4016},{"match_name":"RSPP 3rd Saturday April 2016","match_date":"2016-04-16","stage_classifiercode":"03-07","member_number":"A18698","first_name":"MICHAEL","last_name":"DALE","classification":"A","division":"OPEN","hit_factor":5.3957},{"match_name":"DSSA 2021-05 USPSA Pistol","match_date":"2021-05-15","stage_classifiercode":"03-07","member_number":"FY101141","first_name":"MATHEW","last_name":"DOZIER","classification":"A","division":"OPEN","hit_factor":5.3916},{"match_name":"WNPL USPSA Feb 2021","match_date":"2021-02-06","stage_classifiercode":"03-07","member_number":"A36569","first_name":"ERIK","last_name":"WARREN","classification":"M","division":"OPEN","hit_factor":5.3769},{"match_name":"Rankin Field Sunday USPSA","match_date":"2017-10-15","stage_classifiercode":"03-07","member_number":"TY87000","first_name":"GREG","last_name":"VAUGHN","classification":"A","division":"OPEN","hit_factor":5.3751},{"match_name":"BPSA September 2016 USPSA","match_date":"2016-09-25","stage_classifiercode":"03-07","member_number":"TY42086","first_name":"BILL","last_name":"JACKSON","classification":"B","division":"OPEN","hit_factor":5.375},{"match_name":"JPPS Club Match 9-5-2020","match_date":"2020-09-05","stage_classifiercode":"03-07","member_number":"A23320","first_name":"JOHN","last_name":"STIEDLE","classification":"M","division":"OPEN","hit_factor":5.3733},{"match_name":"Emmett USPSA November 28th","match_date":"2020-11-28","stage_classifiercode":"03-07","member_number":"A106643","first_name":"EUGENE","last_name":"DINA","classification":"A","division":"OPEN","hit_factor":5.3721},{"match_name":"Dundee Practical Shooters - June 27 2020 - Points for Pistol","match_date":"2020-06-27","stage_classifiercode":"03-07","member_number":"L3292","first_name":"BILL","last_name":"MARRS","classification":"B","division":"OPEN","hit_factor":5.371},{"match_name":"NRG Saturday December 22nd - Includes a Classifier Stage","match_date":"2018-12-22","stage_classifiercode":"03-07","member_number":"TY97525","first_name":"LIANG","last_name":"GUO","classification":"A","division":"OPEN","hit_factor":5.3691},{"match_name":"LIPSA - November 4th 2018 - USPSA Classifier Match","match_date":"2018-11-04","stage_classifiercode":"03-07","member_number":"TY93363","first_name":"DEAN","last_name":"CHASSE","classification":"A","division":"OPEN","hit_factor":5.3671},{"match_name":"XMG USPSA   Saturday November 6th 2021","match_date":"2021-11-06","stage_classifiercode":"03-07","member_number":"A106102","first_name":"SEAN","last_name":"SUNGLAO","classification":"A","division":"OPEN","hit_factor":5.3667},{"match_name":"SLOSA March 2018 USPSA MATCH","match_date":"2018-03-10","stage_classifiercode":"03-07","member_number":"A84627","first_name":"DANIEL","last_name":"CHARBONNEAU","classification":"A","division":"OPEN","hit_factor":5.3603},{"match_name":"GoShoot Indoors","match_date":"2017-08-13","stage_classifiercode":"03-07","member_number":"Ty88829","first_name":"STEVE","last_name":"DRAPER","classification":"A","division":"OPEN","hit_factor":5.3601},{"match_name":"OREGON ARPC CC05 USPSA Feb 11 2017","match_date":"2017-02-11","stage_classifiercode":"03-07","member_number":"ty-58134","first_name":"DAN","last_name":"CARPENTER","classification":"B","division":"OPEN","hit_factor":5.3601},{"match_name":"Fall Madness - UPSA Match","match_date":"2017-10-07","stage_classifiercode":"03-07","member_number":"F98158","first_name":"ROBERT","last_name":"STUVE","classification":"U","division":"OPEN","hit_factor":5.3512},{"match_name":"SFA USPSA FEBRUARY 2018","match_date":"2018-02-17","stage_classifiercode":"03-07","member_number":"TY76701","first_name":"GLENN","last_name":"FANNIN","classification":"A","division":"OPEN","hit_factor":5.3452},{"match_name":"SPSA USPSA December 4th Sat match","match_date":"2017-12-23","stage_classifiercode":"03-07","member_number":"A97527","first_name":"JED","last_name":"MERCER","classification":"B","division":"OPEN","hit_factor":5.3371},{"match_name":"PSOCA USPSA May 23 2020 CAGC","match_date":"2020-05-23","stage_classifiercode":"03-07","member_number":"a123912","first_name":"JOHN","last_name":"HELD","classification":"U","division":"OPEN","hit_factor":5.3348},{"match_name":"Richmond Classifier Match January 24-2016","match_date":"2016-01-24","stage_classifiercode":"03-07","member_number":"L3567","first_name":"RON","last_name":"SELBY","classification":"A","division":"OPEN","hit_factor":5.3319},{"match_name":"Rankin Field November Saturday USPSA","match_date":"2021-11-06","stage_classifiercode":"03-07","member_number":"L4505","first_name":"GREG","last_name":"VAUGHN","classification":"A","division":"OPEN","hit_factor":5.3304},{"match_name":"June 12 2021 The Range At True North USPSA Match","match_date":"2021-06-12","stage_classifiercode":"03-07","member_number":"A95951","first_name":"JUSTIN","last_name":"SMITH","classification":"U","division":"OPEN","hit_factor":5.3265},{"match_name":"LA05 Tangi September 2nd USPSA Match 2017","match_date":"2017-09-24","stage_classifiercode":"03-07","member_number":"L2725","first_name":"CHARLIE","last_name":"BLACK","classification":"M","division":"OPEN","hit_factor":5.3251},{"match_name":"Prescott Action Shooters 1st Saturday USPSA 08-07-21","match_date":"2021-08-07","stage_classifiercode":"03-07","member_number":"A124445","first_name":"BLAKE","last_name":"WALTERS","classification":"Unclassified","division":"OPEN","hit_factor":5.3169},{"match_name":"AL20","match_date":"2021-04-14","stage_classifiercode":"03-07","member_number":"a130687","first_name":"MANLEY","last_name":"HENDERSON","classification":"B","division":"OPEN","hit_factor":5.3143},{"match_name":"DAPS USPSA @ ETTS 10-14-17","match_date":"2017-10-14","stage_classifiercode":"03-07","member_number":"TY85507","first_name":"JONATHAN","last_name":"PURTZER","classification":"M","division":"OPEN","hit_factor":5.3113},{"match_name":"Richmond Hot Shots Oct 16-17-2021 USPSA","match_date":"2021-10-16","stage_classifiercode":"03-07","member_number":"TY79640","first_name":"ELPIDIO","last_name":"CORPUZ","classification":"A","division":"OPEN","hit_factor":5.3073},{"match_name":"JCSSA NOV3 2018","match_date":"2018-11-03","stage_classifiercode":"03-07","member_number":"A106102","first_name":"SEAN","last_name":"SUNGLAO","classification":"U","division":"OPEN","hit_factor":5.3026},{"match_name":"Dundee Practical Shooters - June 27 2020 - Points for Pistol","match_date":"2020-06-27","stage_classifiercode":"03-07","member_number":"TY80149","first_name":"JIM","last_name":"BOONE","classification":"A","division":"OPEN","hit_factor":5.2977},{"match_name":"PMSC May 2017","match_date":"2017-05-07","stage_classifiercode":"03-07","member_number":"A82941","first_name":"DARREN","last_name":"HEROLD","classification":"B","division":"OPEN","hit_factor":5.2965},{"match_name":"NW05 Renton USPSA April 2016","match_date":"2016-04-24","stage_classifiercode":"03-07","member_number":"TY67040","first_name":"PETER","last_name":"MORRIS","classification":"B","division":"OPEN","hit_factor":5.2904},{"match_name":"Medford USPSA June 2016 Match","match_date":"2016-06-19","stage_classifiercode":"03-07","member_number":"L2214","first_name":"LARRY","last_name":"WATSON","classification":"A","division":"OPEN","hit_factor":5.2901},{"match_name":"OK15 USPSA at USSA","match_date":"2016-12-11","stage_classifiercode":"03-07","member_number":"FY69155","first_name":"WES","last_name":"BOLES","classification":"B","division":"OPEN","hit_factor":5.2882},{"match_name":"CGGR November USPSA Match","match_date":"2017-11-18","stage_classifiercode":"03-07","member_number":"A63410","first_name":"EDDIE","last_name":"HUGHES","classification":"B","division":"OPEN","hit_factor":5.2866},{"match_name":"SFA USPSA FEBRUARY 2018","match_date":"2018-02-17","stage_classifiercode":"03-07","member_number":"A89126","first_name":"RON","last_name":"WAGNER","classification":"C","division":"OPEN","hit_factor":5.2846},{"match_name":"DSSA 2021-05 USPSA Pistol","match_date":"2021-05-15","stage_classifiercode":"03-07","member_number":"TY76693","first_name":"LEE","last_name":"FRAISER","classification":"B","division":"OPEN","hit_factor":5.2809},{"match_name":"RSPP 3rd Saturday April 2016","match_date":"2016-04-16","stage_classifiercode":"03-07","member_number":"TY47460","first_name":"STEVE","last_name":"LEACH","classification":"A","division":"OPEN","hit_factor":5.269},{"match_name":"CGGR November USPSA Match","match_date":"2017-11-18","stage_classifiercode":"03-07","member_number":"A91357","first_name":"BEN","last_name":"LANGFORD","classification":"A","division":"OPEN","hit_factor":5.2669},{"match_name":"ORSA USPSA August 2017 Match","match_date":"2017-08-16","stage_classifiercode":"03-07","member_number":"A97527","first_name":"JED","last_name":"MERCER","classification":"C","division":"OPEN","hit_factor":5.2662},{"match_name":"Rio Grande Practical Shooters - September 2016","match_date":"2016-09-03","stage_classifiercode":"03-07","member_number":"L3694","first_name":"CHRIS","last_name":"TAYLOR","classification":"A","division":"OPEN","hit_factor":5.2601},{"match_name":"Pathfinder June USPSA Match","match_date":"2020-06-21","stage_classifiercode":"03-07","member_number":"FY45990","first_name":"JOHN","last_name":"MARCAIDA","classification":"M","division":"OPEN","hit_factor":5.2601},{"match_name":"WGC WI USPSA Monthly Match 12-16-17","match_date":"2017-12-16","stage_classifiercode":"03-07","member_number":"A68824","first_name":"KELSEY","last_name":"SCHAEFER","classification":"B","division":"OPEN","hit_factor":5.26},{"match_name":"Caja del Rio - March 2016","match_date":"2016-03-19","stage_classifiercode":"03-07","member_number":"TY24322","first_name":"RANDY","last_name":"RYAN","classification":"M","division":"OPEN","hit_factor":5.2599},{"match_name":"PCSI - July 2017 USPSA","match_date":"2017-07-01","stage_classifiercode":"03-07","member_number":"TY79620","first_name":"DAVID","last_name":"BLAIR","classification":"B","division":"OPEN","hit_factor":5.2576},{"match_name":"ORPCI USPSA Saturday 2021.10.16","match_date":"2021-10-16","stage_classifiercode":"03-07","member_number":"TY12160","first_name":"JOE","last_name":"EAMES","classification":"","division":"OPEN","hit_factor":5.2573},{"match_name":"GCL May 6-2017","match_date":"2017-05-06","stage_classifiercode":"03-07","member_number":"FY45990","first_name":"JOHN","last_name":"MARCAIDA","classification":"M","division":"OPEN","hit_factor":5.2543},{"match_name":"2017 Hawktech Arms Idaho Section Hi-cap Match","match_date":"2017-10-21","stage_classifiercode":"03-07","member_number":"A84438","first_name":"TYSON","last_name":"DIXON","classification":"B","division":"OPEN","hit_factor":5.2542},{"match_name":"Ontelaunee USPSA September 2015","match_date":"2015-09-27","stage_classifiercode":"03-07","member_number":"TY58697","first_name":"GARY","last_name":"PARSONS","classification":"B","division":"OPEN","hit_factor":5.2537},{"match_name":"LIPSA - November 4th 2018 - USPSA Classifier Match","match_date":"2018-11-04","stage_classifiercode":"03-07","member_number":"TY82399","first_name":"JAMES","last_name":"BYRNE","classification":"B","division":"OPEN","hit_factor":5.2511},{"match_name":"CCPS 20170625","match_date":"2017-06-25","stage_classifiercode":"03-07","member_number":"A69423","first_name":"JOSH","last_name":"HORNER","classification":"M","division":"OPEN","hit_factor":5.2509},{"match_name":"Richmond Hot Shots August 4th-5th USPSA Pistol Match","match_date":"2018-08-04","stage_classifiercode":"03-07","member_number":"10204","first_name":"STEVE","last_name":"COLLEN","classification":"A","division":"OPEN","hit_factor":5.248},{"match_name":"CAPS Club July 24 USPSA","match_date":"2021-07-24","stage_classifiercode":"03-07","member_number":"TY85663","first_name":"JASON","last_name":"YU","classification":"A","division":"OPEN","hit_factor":5.2441},{"match_name":"ECPS USPSA 15 SEP 18","match_date":"2018-09-15","stage_classifiercode":"03-07","member_number":"TY87135","first_name":"ENVER","last_name":"FOCAKOVIC","classification":"A","division":"OPEN","hit_factor":5.2402},{"match_name":"March 13 2021 The Range At True North USPSA Match","match_date":"2021-03-13","stage_classifiercode":"03-07","member_number":"TY39085","first_name":"MARTIN","last_name":"LITTLE","classification":"M","division":"OPEN","hit_factor":5.2295},{"match_name":"Richmond Hot Shots August 4th-5th USPSA Pistol Match","match_date":"2018-08-04","stage_classifiercode":"03-07","member_number":"A33147","first_name":"VINCENT","last_name":"DIONISIO","classification":"B","division":"OPEN","hit_factor":5.2288},{"match_name":"Dundee Practical Shooters - June 27 2020 - Points for Pistol","match_date":"2020-06-27","stage_classifiercode":"03-07","member_number":"A95958","first_name":"LANI","last_name":"KUANONI","classification":"B","division":"OPEN","hit_factor":5.228},{"match_name":"Richmond Hot Shots Oct 16-17-2021 USPSA","match_date":"2021-10-16","stage_classifiercode":"03-07","member_number":"Ty38711","first_name":"KENNETH","last_name":"MELTON","classification":"A","division":"OPEN","hit_factor":5.2269},{"match_name":"GRRC Week 8 2020","match_date":"2020-06-29","stage_classifiercode":"03-07","member_number":"a97255","first_name":"DARIN","last_name":"MAGER","classification":"B","division":"OPEN","hit_factor":5.2267},{"match_name":"KIdlat September Club Match","match_date":"2018-09-01","stage_classifiercode":"03-07","member_number":"FY26952","first_name":"JOHN","last_name":"GRIMM","classification":"A","division":"OPEN","hit_factor":5.223},{"match_name":"CGGR November USPSA Match","match_date":"2017-11-18","stage_classifiercode":"03-07","member_number":"L3838","first_name":"NATHAN","last_name":"THOMPSON","classification":"M","division":"OPEN","hit_factor":5.2198},{"match_name":"Richmond Hot Shots August 4th-5th USPSA Pistol Match","match_date":"2018-08-04","stage_classifiercode":"03-07","member_number":"10174","first_name":"JANET","last_name":"TSUI","classification":"B","division":"OPEN","hit_factor":5.2179},{"match_name":"LCSC Linden USPSA 082221","match_date":"2021-08-21","stage_classifiercode":"03-07","member_number":"L1620","first_name":"THOMAS","last_name":"CHAN","classification":"A","division":"OPEN","hit_factor":5.2159},{"match_name":"NRG Saturday December 22nd - Includes a Classifier Stage","match_date":"2018-12-22","stage_classifiercode":"03-07","member_number":"\"\"","first_name":"BO","last_name":"WANG","classification":"B","division":"OPEN","hit_factor":5.2135},{"match_name":"Cactus USPSA April 2021","match_date":"2021-04-04","stage_classifiercode":"03-07","member_number":"Ty48933","first_name":"SCOTT","last_name":"SRIPAPATTANAVONG","classification":"A","division":"OPEN","hit_factor":5.2096},{"match_name":"NRG Saturday December 22nd - Includes a Classifier Stage","match_date":"2018-12-22","stage_classifiercode":"03-07","member_number":"TY63363","first_name":"MATT","last_name":"BUNNING","classification":"U","division":"OPEN","hit_factor":5.2065},{"match_name":"DAPS USPSA @ ETTS 10-14-17","match_date":"2017-10-14","stage_classifiercode":"03-07","member_number":"A65248","first_name":"JR","last_name":"ERASMUS","classification":"A","division":"OPEN","hit_factor":5.2033},{"match_name":"PMRPC USPSA  10Apr21","match_date":"2021-04-10","stage_classifiercode":"03-07","member_number":"FL2659","first_name":"RYAN","last_name":"GOURZONG","classification":"B","division":"OPEN","hit_factor":5.2013},{"match_name":"October 2015 CAS Match","match_date":"2015-10-04","stage_classifiercode":"03-07","member_number":"L3395","first_name":"GEOFFREY","last_name":"BRANTNER","classification":"A","division":"OPEN","hit_factor":5.2013},{"match_name":"NRG Saturday November 13th Includes a Classifier Stage","match_date":"2021-11-13","stage_classifiercode":"03-07","member_number":"A118103","first_name":"JOREL","last_name":"MARIANO","classification":"U","division":"OPEN","hit_factor":5.1989},{"match_name":"Minot All Classifier Match","match_date":"2017-03-12","stage_classifiercode":"03-07","member_number":"A71597","first_name":"DEANE","last_name":"GRAVES","classification":"M","division":"OPEN","hit_factor":5.1986},{"match_name":"Rankin Field November Saturday USPSA","match_date":"2021-11-06","stage_classifiercode":"03-07","member_number":"A115731","first_name":"DONALD","last_name":"DIAZ","classification":"C","division":"OPEN","hit_factor":5.1948},{"match_name":"WSRC USPSA 5-19-2018","match_date":"2018-05-19","stage_classifiercode":"03-07","member_number":"L4272","first_name":"ALEX","last_name":"MAY","classification":"U","division":"OPEN","hit_factor":5.1905},{"match_name":"NRG September 24th 2016","match_date":"2016-09-24","stage_classifiercode":"03-07","member_number":"fy44282","first_name":"MICHAEL","last_name":"PELISSIER","classification":"M","division":"OPEN","hit_factor":5.1897},{"match_name":"OFGC USPSA Match 7/15/2018","match_date":"2018-07-15","stage_classifiercode":"03-07","member_number":"TY72436","first_name":"ROBERT","last_name":"TERBIETEN","classification":"B","division":"OPEN","hit_factor":5.1848},{"match_name":"Prescott Action Shooters 1st Saturday USPSA 4-3-21","match_date":"2021-04-03","stage_classifiercode":"03-07","member_number":"TY18698","first_name":"MICHAEL","last_name":"DALE","classification":"M","division":"OPEN","hit_factor":5.1848},{"match_name":"NRG Saturday November 13th Includes a Classifier Stage","match_date":"2021-11-13","stage_classifiercode":"03-07","member_number":"FY84506","first_name":"MARC","last_name":"BARBANI","classification":"B","division":"OPEN","hit_factor":5.1848},{"match_name":"NRG Saturday December 22nd - Includes a Classifier Stage","match_date":"2018-12-22","stage_classifiercode":"03-07","member_number":"A112576","first_name":"KHOI","last_name":"PHAM","classification":"B","division":"OPEN","hit_factor":5.1836},{"match_name":"2017 Hawktech Arms Idaho Section Hi-cap Match","match_date":"2017-10-21","stage_classifiercode":"03-07","member_number":"A97226","first_name":"RON","last_name":"RITCHIE","classification":"A","division":"OPEN","hit_factor":5.1797},{"match_name":"GCL Wed 5-3-17","match_date":"2017-05-03","stage_classifiercode":"03-07","member_number":"A80418","first_name":"ALVA","last_name":"ENGLISH","classification":"B","division":"OPEN","hit_factor":5.1761},{"match_name":"LdF USPSA Match January 13 2018","match_date":"2018-01-13","stage_classifiercode":"03-07","member_number":"A18808","first_name":"LOU","last_name":"PAZ","classification":"A","division":"OPEN","hit_factor":5.1734},{"match_name":"XMG USPSA   Saturday November 6th 2021","match_date":"2021-11-06","stage_classifiercode":"03-07","member_number":"ty82289","first_name":"JEREMY","last_name":"DYER","classification":"B","division":"OPEN","hit_factor":5.1598},{"match_name":"GCL May 6-2017","match_date":"2017-05-06","stage_classifiercode":"03-07","member_number":"A80418","first_name":"ALVA","last_name":"ENGLISH","classification":"B","division":"OPEN","hit_factor":5.1592},{"match_name":"Oxford OHS05 100321","match_date":"2021-10-03","stage_classifiercode":"03-07","member_number":"TY44916","first_name":"MARK","last_name":"ANDERSON","classification":"A","division":"OPEN","hit_factor":5.1585},{"match_name":"OFGC USPSA Match 7/15/2018","match_date":"2018-07-15","stage_classifiercode":"03-07","member_number":"A79715","first_name":"MICHAEL","last_name":"NELSON","classification":"B","division":"OPEN","hit_factor":5.1579},{"match_name":"OK15 USPSA at USSA","match_date":"2016-12-11","stage_classifiercode":"03-07","member_number":"TY75344","first_name":"CARY","last_name":"ROWTON","classification":"B","division":"OPEN","hit_factor":5.1564},{"match_name":"WNPL USPSA Feb 2021","match_date":"2021-02-06","stage_classifiercode":"03-07","member_number":"A47970","first_name":"DAVE","last_name":"ABELOE","classification":"A","division":"OPEN","hit_factor":5.1502},{"match_name":"Minnetonka Game And Fish July 25","match_date":"2018-07-25","stage_classifiercode":"03-07","member_number":"TY59462","first_name":"RICHARD","last_name":"KAVANAGH","classification":"C","division":"OPEN","hit_factor":5.1495},{"match_name":"JCSSA NOV3 2018","match_date":"2018-11-03","stage_classifiercode":"03-07","member_number":"ty63123","first_name":"KENDELL","last_name":"WADE","classification":"A","division":"OPEN","hit_factor":5.1483},{"match_name":"RPGi USPSA Last Minute Match! 18 July 2021","match_date":"2021-07-18","stage_classifiercode":"03-07","member_number":"TY118547","first_name":"BRENDAN","last_name":"SOUDER","classification":"A","division":"OPEN","hit_factor":5.1475},{"match_name":"ARPC USPSA Match 5-28-17","match_date":"2017-05-28","stage_classifiercode":"03-07","member_number":"TY78305","first_name":"SEAN","last_name":"ROLEN","classification":"B","division":"OPEN","hit_factor":5.1475},{"match_name":"WGC WI USPSA Monthly Match 12-16-17","match_date":"2017-12-16","stage_classifiercode":"03-07","member_number":"TY72120","first_name":"DAVE","last_name":"DEYOE","classification":"M","division":"OPEN","hit_factor":5.1471},{"match_name":"October 2015 CAS Match","match_date":"2015-10-04","stage_classifiercode":"03-07","member_number":"A64151","first_name":"DON","last_name":"GRANIER","classification":"A","division":"OPEN","hit_factor":5.1467},{"match_name":"OK15 USPSA at USSA","match_date":"2016-12-11","stage_classifiercode":"03-07","member_number":"\"\"","first_name":"IAN","last_name":"ZACHER","classification":"B","division":"OPEN","hit_factor":5.1466},{"match_name":"SCS USPSA Oct 25 2015","match_date":"2015-10-24","stage_classifiercode":"03-07","member_number":"TY37520","first_name":"ROBERT","last_name":"RAMIREZ JR","classification":"M","division":"OPEN","hit_factor":5.1381},{"match_name":"RSPP 3rd Saturday April 2016","match_date":"2016-04-16","stage_classifiercode":"03-07","member_number":"FY46196","first_name":"DALE","last_name":"CALVERT","classification":"A","division":"OPEN","hit_factor":5.1309},{"match_name":"Richmond Hot Shots August 4th-5th USPSA Pistol Match","match_date":"2018-08-04","stage_classifiercode":"03-07","member_number":"FY62950","first_name":"DARRELL","last_name":"INOUYE","classification":"A","division":"OPEN","hit_factor":5.124},{"match_name":"CGGR September USPSA Match","match_date":"2016-09-17","stage_classifiercode":"03-07","member_number":"A25745","first_name":"DAN","last_name":"SANDERS","classification":"B","division":"OPEN","hit_factor":5.1225},{"match_name":"SCRAP USPSA Match - July 2016","match_date":"2016-07-17","stage_classifiercode":"03-07","member_number":"A38147","first_name":"JACK","last_name":"DUMAS","classification":"A","division":"OPEN","hit_factor":5.116},{"match_name":"Prescott Action Shooters 1st Saturday USPSA 08-07-21","match_date":"2021-08-07","stage_classifiercode":"03-07","member_number":"TY18698","first_name":"MICHAEL","last_name":"DALE","classification":"M","division":"OPEN","hit_factor":5.1143},{"match_name":"Richmond Hot Shots Oct 16-17-2021 USPSA","match_date":"2021-10-16","stage_classifiercode":"03-07","member_number":"FY81272","first_name":"GAYLORD","last_name":"GABRIEL","classification":"A","division":"OPEN","hit_factor":5.1143},{"match_name":"2017 Hawktech Arms Idaho Section Hi-cap Match","match_date":"2017-10-21","stage_classifiercode":"03-07","member_number":"A77818","first_name":"ANDREW","last_name":"JOHNSON","classification":"B","division":"OPEN","hit_factor":5.113},{"match_name":"OREGON ARPC CC05 USPSA Feb 11 2017","match_date":"2017-02-11","stage_classifiercode":"03-07","member_number":"fy44882","first_name":"MARK","last_name":"MCDONALD","classification":"A","division":"OPEN","hit_factor":5.1059},{"match_name":"MCAS USPSA October 2016","match_date":"2016-10-15","stage_classifiercode":"03-07","member_number":"TY66387","first_name":"MIKE","last_name":"ROGERS","classification":"A","division":"OPEN","hit_factor":5.1037},{"match_name":"CCPS 20170625","match_date":"2017-06-25","stage_classifiercode":"03-07","member_number":"TY16618","first_name":"JEFF","last_name":"MEYER","classification":"A","division":"OPEN","hit_factor":5.1032},{"match_name":"PCWC USPSA  5 27 2017","match_date":"2017-05-27","stage_classifiercode":"03-07","member_number":"A31378","first_name":"BOB","last_name":"CHERRY","classification":"B","division":"OPEN","hit_factor":5.0945},{"match_name":"Ontelaunee USPSA April 2017","match_date":"2017-04-22","stage_classifiercode":"03-07","member_number":"A74881","first_name":"FRANK","last_name":"FUMANTI","classification":"C","division":"OPEN","hit_factor":5.0937},{"match_name":"GCL Wed 5-3-17","match_date":"2017-05-03","stage_classifiercode":"03-07","member_number":"FY45990","first_name":"JOHN","last_name":"MARCAIDA","classification":"M","division":"OPEN","hit_factor":5.0866},{"match_name":"TAC2 USPSA AUGUST 2018","match_date":"2018-08-04","stage_classifiercode":"03-07","member_number":"A77313","first_name":"DAVID 2G","last_name":"STRUCKOFF","classification":"U","division":"OPEN","hit_factor":5.0804},{"match_name":"October 2015 CAS Match","match_date":"2015-10-04","stage_classifiercode":"03-07","member_number":"A90671","first_name":"COREY","last_name":"YATES","classification":"B","division":"OPEN","hit_factor":5.0802},{"match_name":"Cactus USPSA April 2021","match_date":"2021-04-04","stage_classifiercode":"03-07","member_number":"l4468","first_name":"RAYMOND","last_name":"ENG","classification":"A","division":"OPEN","hit_factor":5.0799},{"match_name":"Ontelaunee USPSA April 2017","match_date":"2017-04-22","stage_classifiercode":"03-07","member_number":"L3352","first_name":"SEAN","last_name":"ROBERTS","classification":"B","division":"OPEN","hit_factor":5.0748},{"match_name":"NRG Saturday December 22nd - Includes a Classifier Stage","match_date":"2018-12-22","stage_classifiercode":"03-07","member_number":"FY18903","first_name":"PHILIP","last_name":"JOHNSON","classification":"A","division":"OPEN","hit_factor":5.0647},{"match_name":"May 2017 USPSA Classifier Special","match_date":"2017-05-13","stage_classifiercode":"03-07","member_number":"F35840","first_name":"TOM","last_name":"YARDY","classification":"C","division":"OPEN","hit_factor":5.0639},{"match_name":"NRG Saturday November 13th Includes a Classifier Stage","match_date":"2021-11-13","stage_classifiercode":"03-07","member_number":"FY18903","first_name":"PHILIP","last_name":"JOHNSON","classification":"A","division":"OPEN","hit_factor":5.0526},{"match_name":"DSSA 2021-05 USPSA Pistol","match_date":"2021-05-15","stage_classifiercode":"03-07","member_number":"A93997","first_name":"JIM","last_name":"RAMOIN","classification":"B","division":"OPEN","hit_factor":5.0489},{"match_name":"PTPC May 2nd USPSA Match","match_date":"2021-05-02","stage_classifiercode":"03-07","member_number":"A30996","first_name":"MIKE","last_name":"BYTNAR","classification":"A","division":"OPEN","hit_factor":5.0478},{"match_name":"NRG September 24th 2016","match_date":"2016-09-24","stage_classifiercode":"03-07","member_number":"A64201","first_name":"CLAUDIA","last_name":"VIDANES","classification":"B","division":"OPEN","hit_factor":5.043},{"match_name":"NISA July 2017","match_date":"2017-07-23","stage_classifiercode":"03-07","member_number":"A71862","first_name":"JOSEPH","last_name":"SINYAKOVICH","classification":"B","division":"OPEN","hit_factor":5.0352},{"match_name":"2018-10-06 USPSA at Phoenix Rod and Gun Club","match_date":"2018-10-06","stage_classifiercode":"03-07","member_number":"\"\"","first_name":"JAY","last_name":"WEBB","classification":"B","division":"OPEN","hit_factor":5.0299},{"match_name":"NCPS USPSA Handgun Match August 28 2016","match_date":"2016-08-28","stage_classifiercode":"03-07","member_number":"A63834","first_name":"EDWIN","last_name":"CUCIO","classification":"B","division":"OPEN","hit_factor":5.0276},{"match_name":"Klamath USPSA 05/01/16 JSPS OR09","match_date":"2016-05-01","stage_classifiercode":"03-07","member_number":"L2214","first_name":"LARRY","last_name":"WATSON","classification":"A","division":"OPEN","hit_factor":5.0216},{"match_name":"Caja del Rio - March 2016","match_date":"2016-03-19","stage_classifiercode":"03-07","member_number":"PEN","first_name":"JIMMY","last_name":"CREED","classification":"none","division":"OPEN","hit_factor":5.0195},{"match_name":"January Match","match_date":"2017-01-22","stage_classifiercode":"03-07","member_number":"TY75344","first_name":"CARY","last_name":"ROWTON","classification":"B","division":"OPEN","hit_factor":5.0187},{"match_name":"DAPS USPSA @ ETTS 10-14-17","match_date":"2017-10-14","stage_classifiercode":"03-07","member_number":"TY69625","first_name":"KEITH","last_name":"GYGER","classification":"A","division":"OPEN","hit_factor":5.0183},{"match_name":"Richmond Hot Shots August 4th-5th USPSA Pistol Match","match_date":"2018-08-04","stage_classifiercode":"03-07","member_number":"A51918","first_name":"TIM","last_name":"BOFMAN","classification":"A","division":"OPEN","hit_factor":5.0133},{"match_name":"DAPS USPSA @ ETTS 10-14-17","match_date":"2017-10-14","stage_classifiercode":"03-07","member_number":"TY56332","first_name":"DERON","last_name":"WOOD","classification":"A","division":"OPEN","hit_factor":5.0131},{"match_name":"EAGC September 2018 USPSA Pistol Match","match_date":"2018-09-16","stage_classifiercode":"03-07","member_number":"TY19303","first_name":"BRAD","last_name":"GRIFFIN","classification":"G","division":"OPEN","hit_factor":5.007},{"match_name":"Briar  Rabbit July Match 2016 OH20","match_date":"2016-07-24","stage_classifiercode":"03-07","member_number":"A91663","first_name":"DEREK","last_name":"MARTIN","classification":"U","division":"OPEN","hit_factor":5.0029},{"match_name":"NCPS USPSA Handgun Match August 28 2016","match_date":"2016-08-28","stage_classifiercode":"03-07","member_number":"TY33484","first_name":"CARLOS","last_name":"KATALBAS","classification":"G","division":"OPEN","hit_factor":5.0026},{"match_name":"Richmond Hot Shots August 4th-5th USPSA Pistol Match","match_date":"2018-08-04","stage_classifiercode":"03-07","member_number":"A88607","first_name":"FRANCO","last_name":"GESMUNDO","classification":"A","division":"OPEN","hit_factor":5.0025},{"match_name":"LdF 2nd Saturday USPSA Match","match_date":"2016-12-10","stage_classifiercode":"03-07","member_number":"TY43291","first_name":"WILLIAM","last_name":"JEHL","classification":"B","division":"OPEN","hit_factor":5},{"match_name":"SCAPSA MN05 SUMMER WEEK 7","match_date":"2021-07-20","stage_classifiercode":"03-07","member_number":"a109338","first_name":"LOUIE","last_name":"WINSKOWSKI","classification":"B","division":"OPEN","hit_factor":4.9946},{"match_name":"CAPS 9-23-2017","match_date":"2017-09-23","stage_classifiercode":"03-07","member_number":"L3033","first_name":"LARRY","last_name":"AOKI","classification":"A","division":"OPEN","hit_factor":4.9892},{"match_name":"NRG Saturday November 13th Includes a Classifier Stage","match_date":"2021-11-13","stage_classifiercode":"03-07","member_number":"TY6047","first_name":"JIMMY","last_name":"ORDONEZ","classification":"M","division":"OPEN","hit_factor":4.9873},{"match_name":"Richmond Hot Shots Oct 16-17-2021 USPSA","match_date":"2021-10-16","stage_classifiercode":"03-07","member_number":"L1620","first_name":"THOMAS","last_name":"CHAN","classification":"A","division":"OPEN","hit_factor":4.9866},{"match_name":"SFPS 8-23-20 USPSA","match_date":"2020-08-23","stage_classifiercode":"03-07","member_number":"A85909","first_name":"MIKE","last_name":"ROLLAND","classification":"A","division":"OPEN","hit_factor":4.9855},{"match_name":"Prescott Action Shooters 1st Saturday USPSA 08-07-21","match_date":"2021-08-07","stage_classifiercode":"03-07","member_number":"A122959","first_name":"BRANDON","last_name":"ENGBRECHT","classification":"M","division":"OPEN","hit_factor":4.9836},{"match_name":"Emmett USPSA November 28th","match_date":"2020-11-28","stage_classifiercode":"03-07","member_number":"A530","first_name":"JERRY","last_name":"DIX","classification":"M","division":"OPEN","hit_factor":4.9785},{"match_name":"RSPP 3rd Saturday April 2016","match_date":"2016-04-16","stage_classifiercode":"03-07","member_number":"TY16908","first_name":"SPENCE","last_name":"CUTRELL","classification":"A","division":"OPEN","hit_factor":4.9774},{"match_name":"PMSC May 2017","match_date":"2017-05-07","stage_classifiercode":"03-07","member_number":"ty77032","first_name":"TYLER","last_name":"COKE","classification":"B","division":"OPEN","hit_factor":4.9754},{"match_name":"SAPSA February 2020 Match","match_date":"2020-02-15","stage_classifiercode":"03-07","member_number":"FY29424","first_name":"JIM","last_name":"FESSLER","classification":"B","division":"OPEN","hit_factor":4.9749},{"match_name":"NW05 Renton USPSA April 2016","match_date":"2016-04-24","stage_classifiercode":"03-07","member_number":"TY76563","first_name":"SORIDA","last_name":"EAP","classification":"A","division":"OPEN","hit_factor":4.9742},{"match_name":"Coastal Area Practical Shooters 7-28-18 Special Classifier with","match_date":"2018-07-28","stage_classifiercode":"03-07","member_number":"A59053","first_name":"CHIP","last_name":"SAFFERY","classification":"B","division":"OPEN","hit_factor":4.9733},{"match_name":"SCCCMAY2016","match_date":"2016-05-08","stage_classifiercode":"03-07","member_number":"a85354","first_name":"JAY","last_name":"GRAHAM","classification":"C","division":"OPEN","hit_factor":4.9667},{"match_name":"NW05 Renton USPSA April 2016","match_date":"2016-04-24","stage_classifiercode":"03-07","member_number":"A89438","first_name":"NICHOLAS","last_name":"STOCKWELL","classification":"M","division":"OPEN","hit_factor":4.9667},{"match_name":"Marc-On Shooting USPSA January 12th","match_date":"2020-01-12","stage_classifiercode":"03-07","member_number":"L4481","first_name":"OUSMANE","last_name":"DIALLO","classification":"B","division":"OPEN","hit_factor":4.9649},{"match_name":"Volusia County Gun and Hunt Club","match_date":"2021-09-18","stage_classifiercode":"03-07","member_number":"A82594","first_name":"JUDY","last_name":"MACKOWSKI","classification":"B","division":"OPEN","hit_factor":4.9649},{"match_name":"RSPP 3rd Saturday April 2016","match_date":"2016-04-16","stage_classifiercode":"03-07","member_number":"A56540","first_name":"DAVE","last_name":"JONES","classification":"B","division":"OPEN","hit_factor":4.9649},{"match_name":"MAPSA June Special Classifier","match_date":"2018-06-09","stage_classifiercode":"03-07","member_number":"L4062","first_name":"KEN","last_name":"SPOONER","classification":"B","division":"OPEN","hit_factor":4.9618},{"match_name":"Ontelaunee USPSA April 2017","match_date":"2017-04-22","stage_classifiercode":"03-07","member_number":"TY85379","first_name":"JOE","last_name":"TOLENO","classification":"A","division":"OPEN","hit_factor":4.9616},{"match_name":"NRG Saturday December 22nd - Includes a Classifier Stage","match_date":"2018-12-22","stage_classifiercode":"03-07","member_number":"A55456","first_name":"JOSEPH","last_name":"SY","classification":"A","division":"OPEN","hit_factor":4.9603},{"match_name":"SLOSA March 2018 USPSA MATCH","match_date":"2018-03-10","stage_classifiercode":"03-07","member_number":"L1620","first_name":"THOMAS","last_name":"CHAN","classification":"A","division":"OPEN","hit_factor":4.9596},{"match_name":"SFPS 8-23-20 USPSA","match_date":"2020-08-23","stage_classifiercode":"03-07","member_number":"TY109377","first_name":"STEVE","last_name":"PORTER","classification":"B","division":"OPEN","hit_factor":4.9447},{"match_name":"WSRC USPSA 5-19-2018","match_date":"2018-05-19","stage_classifiercode":"03-07","member_number":"A67446","first_name":"DAN","last_name":"SPRAUL","classification":"B","division":"OPEN","hit_factor":4.942},{"match_name":"NRG Saturday December 22nd - Includes a Classifier Stage","match_date":"2018-12-22","stage_classifiercode":"03-07","member_number":"\"\"","first_name":"LEI","last_name":"XU","classification":"B","division":"OPEN","hit_factor":4.942},{"match_name":"Ontelaunee USPSA September 2015","match_date":"2015-09-27","stage_classifiercode":"03-07","member_number":"A66127","first_name":"KENNY","last_name":"LEE","classification":"B","division":"OPEN","hit_factor":4.9402},{"match_name":"MCPSL Pistol 3-12-16","match_date":"2016-03-12","stage_classifiercode":"03-07","member_number":"A568","first_name":"RICK","last_name":"BYFIELD","classification":"G","division":"OPEN","hit_factor":4.9399},{"match_name":"WGC WI USPSA Monthly Match 12-16-17","match_date":"2017-12-16","stage_classifiercode":"03-07","member_number":"TY78432","first_name":"OUSMANE","last_name":"DIALLO","classification":"C","division":"OPEN","hit_factor":4.9376},{"match_name":"NHRPC - October 2020 USPSA","match_date":"2020-10-10","stage_classifiercode":"03-07","member_number":"A102632","first_name":"BILL","last_name":"COLEMAN","classification":"B","division":"OPEN","hit_factor":4.9376},{"match_name":"October 2015 CAS Match","match_date":"2015-10-04","stage_classifiercode":"03-07","member_number":"A48274","first_name":"AL","last_name":"CAZALOT","classification":"B","division":"OPEN","hit_factor":4.937},{"match_name":"Fairfax PS USPSA 2020 March","match_date":"2020-03-17","stage_classifiercode":"03-07","member_number":"a103386","first_name":"CESAR","last_name":"SANCHEZ","classification":"B","division":"OPEN","hit_factor":4.9361},{"match_name":"DAPS USPSA at ETTS 4-9-2016","match_date":"2016-04-09","stage_classifiercode":"03-07","member_number":"TY12021","first_name":"RAGS","last_name":"CONNAWAY","classification":"A","division":"OPEN","hit_factor":4.9296},{"match_name":"JCSSA NOV3 2018","match_date":"2018-11-03","stage_classifiercode":"03-07","member_number":"TY-9766","first_name":"PATRICK","last_name":"BASHFORD","classification":"B","division":"OPEN","hit_factor":4.9171},{"match_name":"Volusia County Gun and Hunt Club","match_date":"2021-09-18","stage_classifiercode":"03-07","member_number":"TY27735","first_name":"BOB","last_name":"MILLS","classification":"A","division":"OPEN","hit_factor":4.9163},{"match_name":"LCSC Linden USPSA 082221","match_date":"2021-08-21","stage_classifiercode":"03-07","member_number":"FY88773","first_name":"EPHRAIM","last_name":"SAN FELIPE","classification":"B","division":"OPEN","hit_factor":4.9125},{"match_name":"SCCCMAY2016","match_date":"2016-05-08","stage_classifiercode":"03-07","member_number":"L2615","first_name":"STEVEN","last_name":"MARSDEN","classification":"M","division":"OPEN","hit_factor":4.9091},{"match_name":"Richmond Hot Shots August 4th-5th USPSA Pistol Match","match_date":"2018-08-04","stage_classifiercode":"03-07","member_number":"A25441","first_name":"WALTER K","last_name":"HASHIMOTO","classification":"A","division":"OPEN","hit_factor":4.907},{"match_name":"WGC WI USPSA Monthly Match 12-16-17","match_date":"2017-12-16","stage_classifiercode":"03-07","member_number":"A71862","first_name":"JOSEPH","last_name":"SINYAKOVICH","classification":"B","division":"OPEN","hit_factor":4.9051},{"match_name":"Space Coast Practical Shooters","match_date":"2017-04-01","stage_classifiercode":"03-07","member_number":"A16778","first_name":"PAUL","last_name":"RENFRO","classification":"B","division":"OPEN","hit_factor":4.9051},{"match_name":"PCSI - July 2017 USPSA","match_date":"2017-07-01","stage_classifiercode":"03-07","member_number":"A100061","first_name":"JASON","last_name":"HOLLEY","classification":"B","division":"OPEN","hit_factor":4.8962},{"match_name":"GCL Wed 5-3-17","match_date":"2017-05-03","stage_classifiercode":"03-07","member_number":"A80418","first_name":"ALVA","last_name":"ENGLISH","classification":"B","division":"OPEN","hit_factor":4.8944},{"match_name":"Griffin USPSA Jan 2020","match_date":"2020-01-17","stage_classifiercode":"03-07","member_number":"A102088","first_name":"JEREMY","last_name":"DEAN","classification":"","division":"OPEN","hit_factor":4.891},{"match_name":"LTD Pistol - October 2017","match_date":"2017-10-07","stage_classifiercode":"03-07","member_number":"L3144","first_name":"YANCY","last_name":"KOESTER","classification":"A","division":"OPEN","hit_factor":4.8901},{"match_name":"NW05 Renton USPSA April 2016","match_date":"2016-04-24","stage_classifiercode":"03-07","member_number":"A86982","first_name":"CHRISTIAN","last_name":"SAILER","classification":"U","division":"OPEN","hit_factor":4.8872},{"match_name":"XMG USPSA   Saturday November 6th 2021","match_date":"2021-11-06","stage_classifiercode":"03-07","member_number":"l3611","first_name":"RAYMOND","last_name":"VAN VALKENBURG","classification":"A","division":"OPEN","hit_factor":4.8846},{"match_name":"October 2015 CAS Match","match_date":"2015-10-04","stage_classifiercode":"03-07","member_number":"A76145","first_name":"CURT","last_name":"BOURGEOIS","classification":"B","division":"OPEN","hit_factor":4.8843},{"match_name":"SCAPSA MN05 SUMMER WEEK 7","match_date":"2021-07-20","stage_classifiercode":"03-07","member_number":"A105972","first_name":"BEN","last_name":"MOORE","classification":"B","division":"OPEN","hit_factor":4.8739},{"match_name":"DSSA 2021-05 USPSA Pistol","match_date":"2021-05-15","stage_classifiercode":"03-07","member_number":"A77322","first_name":"ROGER","last_name":"HENN","classification":"M","division":"OPEN","hit_factor":4.8665},{"match_name":"LdF 2nd Saturday USPSA Match","match_date":"2016-12-10","stage_classifiercode":"03-07","member_number":"TY63365","first_name":"COREY","last_name":"MAGERS","classification":"B","division":"OPEN","hit_factor":4.8657},{"match_name":"RDS June 2020 USPSA Match","match_date":"2020-06-13","stage_classifiercode":"03-07","member_number":"A79715","first_name":"MICHAEL","last_name":"NELSON","classification":"B","division":"OPEN","hit_factor":4.8646},{"match_name":"GoShoot Outdoors April 19th reshoot","match_date":"2020-04-19","stage_classifiercode":"03-07","member_number":"A121806","first_name":"PHILIP","last_name":"HUDOCK","classification":"U","division":"OPEN","hit_factor":4.85},{"match_name":"EAGC September 2018 USPSA Pistol Match","match_date":"2018-09-16","stage_classifiercode":"03-07","member_number":"A70326","first_name":"KEN","last_name":"ROSE","classification":"M","division":"OPEN","hit_factor":4.8485},{"match_name":"OREGON ARPC CC05 USPSA Feb 11 2017","match_date":"2017-02-11","stage_classifiercode":"03-07","member_number":"L2214","first_name":"LARRY","last_name":"WATSON","classification":"A","division":"OPEN","hit_factor":4.8454},{"match_name":"JCSSA NOV 7 2020","match_date":"2020-11-07","stage_classifiercode":"03-07","member_number":"TY90631","first_name":"DREW","last_name":"CHUMLEY","classification":"C","division":"OPEN","hit_factor":4.8379},{"match_name":"2017 Hawktech Arms Idaho Section Hi-cap Match","match_date":"2017-10-21","stage_classifiercode":"03-07","member_number":"L3033","first_name":"LARRY","last_name":"AOKI","classification":"A","division":"OPEN","hit_factor":4.8297},{"match_name":"RSPP 3rd Saturday April 2016","match_date":"2016-04-16","stage_classifiercode":"03-07","member_number":"A891 69","first_name":"PHIL","last_name":"GRUBBS","classification":"C","division":"OPEN","hit_factor":4.8276},{"match_name":"RSPP 3rd Saturday April 2016","match_date":"2016-04-16","stage_classifiercode":"03-07","member_number":"\"\"","first_name":"MARVIN","last_name":"INSCHO","classification":"U","division":"OPEN","hit_factor":4.8217},{"match_name":"CGGR November USPSA Match","match_date":"2017-11-18","stage_classifiercode":"03-07","member_number":"A31524","first_name":"COUNCIL","last_name":"BRADSHAW","classification":"GM","division":"OPEN","hit_factor":4.8193},{"match_name":"HLSL 12-09-2018","match_date":"2018-12-09","stage_classifiercode":"03-07","member_number":"TY47994","first_name":"PETER","last_name":"ABRAHAM","classification":"B","division":"OPEN","hit_factor":4.8181},{"match_name":"DAPS USPSA @ ETTS 10-14-17","match_date":"2017-10-14","stage_classifiercode":"03-07","member_number":"A57591","first_name":"NICK","last_name":"ANSELMO","classification":"B","division":"OPEN","hit_factor":4.8181},{"match_name":"RSPP 3rd Saturday April 2016","match_date":"2016-04-16","stage_classifiercode":"03-07","member_number":"TY65635","first_name":"CHRIS","last_name":"COLLINS","classification":"B","division":"OPEN","hit_factor":4.8175},{"match_name":"LCSC Linden USPSA 082221","match_date":"2021-08-21","stage_classifiercode":"03-07","member_number":"A115731","first_name":"DONALD","last_name":"DIAZ","classification":"C","division":"OPEN","hit_factor":4.8169},{"match_name":"LA05 Tangi September 2nd USPSA Match 2017","match_date":"2017-09-24","stage_classifiercode":"03-07","member_number":"\"\"","first_name":"JON","last_name":"MARINO","classification":"X","division":"OPEN","hit_factor":4.8144},{"match_name":"GCL Wed 5-3-17","match_date":"2017-05-03","stage_classifiercode":"03-07","member_number":"FY39257","first_name":"PAUL","last_name":"ROBERTS","classification":"M","division":"OPEN","hit_factor":4.8137},{"match_name":"North East Ohio Shooters - OH19 - 2016-08-13","match_date":"2016-08-13","stage_classifiercode":"03-07","member_number":"TY66305","first_name":"HERB","last_name":"SMITH","classification":"B","division":"OPEN","hit_factor":4.8112},{"match_name":"OREGON ARPC CC05 USPSA Feb 11 2017","match_date":"2017-02-11","stage_classifiercode":"03-07","member_number":"L3292","first_name":"BILL","last_name":"MARRS","classification":"B","division":"OPEN","hit_factor":4.8091},{"match_name":"Pathfinder June USPSA Match","match_date":"2020-06-21","stage_classifiercode":"03-07","member_number":"A124135","first_name":"LEW","last_name":"WARNER","classification":"U","division":"OPEN","hit_factor":4.8082},{"match_name":"Ontelaunee USPSA April 2017","match_date":"2017-04-22","stage_classifiercode":"03-07","member_number":"TY93363","first_name":"DEAN","last_name":"CHASSE","classification":"C","division":"OPEN","hit_factor":4.7938},{"match_name":"Ontelaunee USPSA September 2015","match_date":"2015-09-27","stage_classifiercode":"03-07","member_number":"L3280","first_name":"JOSEPH","last_name":"ROBERTS","classification":"A","division":"OPEN","hit_factor":4.7904},{"match_name":"LTD Pistol - October 2017","match_date":"2017-10-07","stage_classifiercode":"03-07","member_number":"TY74321","first_name":"STEPHEN","last_name":"PRICE","classification":"B","division":"OPEN","hit_factor":4.7904},{"match_name":"LCAS April 2017 USPSA","match_date":"2017-04-01","stage_classifiercode":"03-07","member_number":"PEN","first_name":"RON","last_name":"WEAVER","classification":"U","division":"OPEN","hit_factor":4.7761},{"match_name":"HOPS USPSA 052116","match_date":"2016-05-21","stage_classifiercode":"03-07","member_number":"A47787","first_name":"SCOTT","last_name":"LANE","classification":"M","division":"OPEN","hit_factor":4.7751},{"match_name":"Renton USPSA - April 2021 - NW05","match_date":"2021-04-25","stage_classifiercode":"03-07","member_number":"TY47022","first_name":"BRUCE","last_name":"WOOD","classification":"A","division":"OPEN","hit_factor":4.7733},{"match_name":"Extreme GM USPSA 5-8","match_date":"2021-05-05","stage_classifiercode":"03-07","member_number":"ty27735","first_name":"BOB","last_name":"MILLS","classification":"A","division":"OPEN","hit_factor":4.7714},{"match_name":"ARPC USPSA Match 5-28-17","match_date":"2017-05-28","stage_classifiercode":"03-07","member_number":"A87386","first_name":"MATT","last_name":"OPFER","classification":"C","division":"OPEN","hit_factor":4.7712},{"match_name":"Ontelaunee USPSA April 2017","match_date":"2017-04-22","stage_classifiercode":"03-07","member_number":"TY67325","first_name":"BRIAN","last_name":"SHANK","classification":"B","division":"OPEN","hit_factor":4.767},{"match_name":"LA05 Tangi September 2nd USPSA Match 2017","match_date":"2017-09-24","stage_classifiercode":"03-07","member_number":"TY63532","first_name":"GEORGE","last_name":"HEMSTAD","classification":"M","division":"OPEN","hit_factor":4.7667},{"match_name":"Cactus USPSA April 2021","match_date":"2021-04-04","stage_classifiercode":"03-07","member_number":"ty114245","first_name":"EUGENE","last_name":"OH","classification":"B","division":"OPEN","hit_factor":4.7648},{"match_name":"Ontelaunee USPSA September 2015","match_date":"2015-09-27","stage_classifiercode":"03-07","member_number":"FY73439","first_name":"CHRIS","last_name":"OLSZEWSKI","classification":"A","division":"OPEN","hit_factor":4.7648},{"match_name":"Oxford OHS05 100321","match_date":"2021-10-03","stage_classifiercode":"03-07","member_number":"A102896","first_name":"TIM","last_name":"DUNCAN","classification":"A","division":"OPEN","hit_factor":4.7595},{"match_name":"CCPS 20170625","match_date":"2017-06-25","stage_classifiercode":"03-07","member_number":"TY71925","first_name":"LAUREN","last_name":"CANNON","classification":"A","division":"OPEN","hit_factor":4.7594},{"match_name":"North East Ohio Shooters - OH19 - 2016-08-13","match_date":"2016-08-13","stage_classifiercode":"03-07","member_number":"FY83046","first_name":"THOMAS","last_name":"GILLECE","classification":"B","division":"OPEN","hit_factor":4.7572},{"match_name":"Volusia County Gun and Hunt Club","match_date":"2021-09-18","stage_classifiercode":"03-07","member_number":"A107644","first_name":"ISAGANI","last_name":"RIRAO","classification":"C","division":"OPEN","hit_factor":4.7501},{"match_name":"LBAS180217","match_date":"2018-02-17","stage_classifiercode":"03-07","member_number":"TY43564","first_name":"BRIAN","last_name":"WILLIAMSON","classification":"G","division":"OPEN","hit_factor":4.7427},{"match_name":"EAGC September 2018 USPSA Pistol Match","match_date":"2018-09-16","stage_classifiercode":"03-07","member_number":"A111822","first_name":"CORBIN","last_name":"FOUQUET","classification":"B","division":"OPEN","hit_factor":4.7418},{"match_name":"SCS USPSA Oct 25 2015","match_date":"2015-10-24","stage_classifiercode":"03-07","member_number":"L1899","first_name":"GARY","last_name":"POWELL","classification":"B","division":"OPEN","hit_factor":4.7414},{"match_name":"Nampa USPSA May 17th","match_date":"2020-05-17","stage_classifiercode":"03-07","member_number":"TY81469","first_name":"ERIC","last_name":"STEINER","classification":"M","division":"OPEN","hit_factor":4.7326},{"match_name":"RSPP 3rd Saturday April 2016","match_date":"2016-04-16","stage_classifiercode":"03-07","member_number":"TY92648","first_name":"E.T.","last_name":"SAFFON","classification":"B","division":"OPEN","hit_factor":4.7273},{"match_name":"NW05 Renton USPSA April 2016","match_date":"2016-04-24","stage_classifiercode":"03-07","member_number":"FY22573","first_name":"JAMES","last_name":"DONG","classification":"B","division":"OPEN","hit_factor":4.7236},{"match_name":"Rankin Field Sunday USPSA","match_date":"2017-10-15","stage_classifiercode":"03-07","member_number":"FY29119","first_name":"EDDY","last_name":"DICE","classification":"B","division":"OPEN","hit_factor":4.7217},{"match_name":"SPSA USPSA February 4th Sat match","match_date":"2020-02-22","stage_classifiercode":"03-07","member_number":"A122481","first_name":"MARK","last_name":"LENCHUK","classification":"C","division":"OPEN","hit_factor":4.7151},{"match_name":"PMSC May 2017","match_date":"2017-05-07","stage_classifiercode":"03-07","member_number":"l1063","first_name":"CHUCK","last_name":"BROOKS","classification":"A","division":"OPEN","hit_factor":4.7101},{"match_name":"SFA USPSA FEBRUARY 2018","match_date":"2018-02-17","stage_classifiercode":"03-07","member_number":"TY91860","first_name":"COLE","last_name":"HORNBACK","classification":"C","division":"OPEN","hit_factor":4.7099},{"match_name":"BPSA September 2016 USPSA","match_date":"2016-09-25","stage_classifiercode":"03-07","member_number":"TY36282","first_name":"BILL","last_name":"MAHLEY","classification":"B","division":"OPEN","hit_factor":4.7013},{"match_name":"Richmond Hot Shots Oct 16-17-2021 USPSA","match_date":"2021-10-16","stage_classifiercode":"03-07","member_number":"Ty105494","first_name":"JACOB","last_name":"GEIBIG","classification":"B","division":"OPEN","hit_factor":4.7011},{"match_name":"SPSA USPSA December 4th Sat match","match_date":"2017-12-23","stage_classifiercode":"03-07","member_number":"TY88617","first_name":"JESSE","last_name":"BLANKENSHIP","classification":"C","division":"OPEN","hit_factor":4.6993},{"match_name":"SAPSC Monthly USPSA Classifier Match 20150908","match_date":"2015-09-08","stage_classifiercode":"03-07","member_number":"A79845","first_name":"JOHNNY","last_name":"REED","classification":"U","division":"OPEN","hit_factor":4.6993},{"match_name":"NRG September 24th 2016","match_date":"2016-09-24","stage_classifiercode":"03-07","member_number":"\"\"","first_name":"TIM","last_name":"MOROSCO","classification":"B","division":"OPEN","hit_factor":4.698},{"match_name":"Ontelaunee USPSA April 2017","match_date":"2017-04-22","stage_classifiercode":"03-07","member_number":"FY72075","first_name":"\"DAVID \"\"DUCTTAPE\"\"\"","last_name":"MCMORRIS","classification":"B","division":"OPEN","hit_factor":4.6967},{"match_name":"LdF 2nd Saturday USPSA Match","match_date":"2016-12-10","stage_classifiercode":"03-07","member_number":"FY62295","first_name":"DAVID","last_name":"MORRIS","classification":"B","division":"OPEN","hit_factor":4.693},{"match_name":"Bagram Practical Shooters - 6 OCT 2018","match_date":"2018-10-06","stage_classifiercode":"03-07","member_number":"A104727","first_name":"KEVIN","last_name":"STICKLEY","classification":"M","division":"OPEN","hit_factor":4.6924},{"match_name":"CGC 2016-05-14","match_date":"2016-05-14","stage_classifiercode":"03-07","member_number":"TY85797","first_name":"GARY","last_name":"WILLIAMS","classification":"C","division":"OPEN","hit_factor":4.6859},{"match_name":"Ontelaunee USPSA September 2015","match_date":"2015-09-27","stage_classifiercode":"03-07","member_number":"TY77564","first_name":"KEVIN","last_name":"MCPHEE","classification":"C","division":"OPEN","hit_factor":4.6852},{"match_name":"MPSA 042818 USPSA","match_date":"2018-04-28","stage_classifiercode":"03-07","member_number":"TY99308","first_name":"GEORGE","last_name":"MILLER","classification":"C","division":"OPEN","hit_factor":4.6845},{"match_name":"SCAPSA MN05 SUMMER WEEK 7","match_date":"2021-07-20","stage_classifiercode":"03-07","member_number":"L4436","first_name":"JON","last_name":"MCCARTY","classification":"B","division":"OPEN","hit_factor":4.6843},{"match_name":"NRG September 24th 2016","match_date":"2016-09-24","stage_classifiercode":"03-07","member_number":"A15883","first_name":"EDRICK","last_name":"ASUNCION","classification":"M","division":"OPEN","hit_factor":4.6816},{"match_name":"Hawkeye Gun Club February 2016","match_date":"2016-02-20","stage_classifiercode":"03-07","member_number":"A93370","first_name":"CRAIG","last_name":"HOOKS","classification":"B","division":"OPEN","hit_factor":4.6724},{"match_name":"NRG Saturday December 22nd - Includes a Classifier Stage","match_date":"2018-12-22","stage_classifiercode":"03-07","member_number":"TY23403","first_name":"TIM","last_name":"MOROSCO","classification":"B","division":"OPEN","hit_factor":4.6724},{"match_name":"GPS USPSA July 2021","match_date":"2021-07-25","stage_classifiercode":"03-07","member_number":"A100714","first_name":"GIL","last_name":"YOLO","classification":"A","division":"OPEN","hit_factor":4.6716},{"match_name":"Dundee Practical Shooters - June 27 2020 - Points for Pistol","match_date":"2020-06-27","stage_classifiercode":"03-07","member_number":"A87752","first_name":"JOANNE","last_name":"TEGTMEYER","classification":"B","division":"OPEN","hit_factor":4.6713},{"match_name":"Renton USPSA - April 2021 - NW05","match_date":"2021-04-25","stage_classifiercode":"03-07","member_number":"L2396","first_name":"FLOYD","last_name":"SHOEMAKER","classification":"M","division":"OPEN","hit_factor":4.668},{"match_name":"Tropang Vegas All Classifier Match","match_date":"2021-07-11","stage_classifiercode":"03-07","member_number":"L1552","first_name":"JUN","last_name":"ISIDORO","classification":"B","division":"OPEN","hit_factor":4.6619},{"match_name":"October 2015 CAS Match","match_date":"2015-10-04","stage_classifiercode":"03-07","member_number":"FY67892","first_name":"KEITH","last_name":"CRESCIONI","classification":"A","division":"OPEN","hit_factor":4.6612},{"match_name":"WAC August 22nd (4th Sunday) - ALL CLASSIFIER USPSA 6 Stage Match","match_date":"2021-08-22","stage_classifiercode":"03-07","member_number":"Ty124934","first_name":"STEVE","last_name":"TRAFTON","classification":"C","division":"OPEN","hit_factor":4.6606},{"match_name":"Cactus USPSA April 2021","match_date":"2021-04-04","stage_classifiercode":"03-07","member_number":"A104053","first_name":"RAYMOND","last_name":"GALLEGOS","classification":"B","division":"OPEN","hit_factor":4.6597},{"match_name":"SPSA USPSA February 4th Sat match","match_date":"2020-02-22","stage_classifiercode":"03-07","member_number":"TY91263","first_name":"MATTHEW","last_name":"WOLFF","classification":"B","division":"OPEN","hit_factor":4.6585},{"match_name":"MCPSL Pistol 3-12-16","match_date":"2016-03-12","stage_classifiercode":"03-07","member_number":"FY76165","first_name":"BILL","last_name":"JOHNSON","classification":"B","division":"OPEN","hit_factor":4.6535},{"match_name":"Detroit Sportsmens Congress - August 20 2017","match_date":"2017-08-20","stage_classifiercode":"03-07","member_number":"A40780","first_name":"JIM","last_name":"DUVALL","classification":"B","division":"OPEN","hit_factor":4.6524},{"match_name":"MAPSA June Special Classifier","match_date":"2018-06-09","stage_classifiercode":"03-07","member_number":"L4436","first_name":"JON","last_name":"MCCARTY","classification":"B","division":"OPEN","hit_factor":4.65},{"match_name":"MISS USPSA 03/21/2018","match_date":"2018-03-21","stage_classifiercode":"03-07","member_number":"TY88087","first_name":"JOHN","last_name":"CAGAOAN","classification":"B","division":"OPEN","hit_factor":4.6498},{"match_name":"PMRPC USPSA  10Apr21","match_date":"2021-04-10","stage_classifiercode":"03-07","member_number":"A41739","first_name":"MARIO E.","last_name":"FARRULLA","classification":"A","division":"OPEN","hit_factor":4.6456},{"match_name":"LGCSEMPS AUGUST 2020 HANDGUN","match_date":"2020-08-08","stage_classifiercode":"03-07","member_number":"A100654","first_name":"BRANDON","last_name":"RADER","classification":"A","division":"OPEN","hit_factor":4.6348},{"match_name":"EWPSA 5/15/16","match_date":"2016-05-15","stage_classifiercode":"03-07","member_number":"TY42863","first_name":"MIKE","last_name":"MCCARTY","classification":"U","division":"OPEN","hit_factor":4.6341},{"match_name":"BPSA September 2016 USPSA","match_date":"2016-09-25","stage_classifiercode":"03-07","member_number":"A90671","first_name":"COREY","last_name":"YATES","classification":"M","division":"OPEN","hit_factor":4.6335},{"match_name":"October 2015 CAS Match","match_date":"2015-10-04","stage_classifiercode":"03-07","member_number":"L3707","first_name":"WOODY","last_name":"LANDRY","classification":"B","division":"OPEN","hit_factor":4.633},{"match_name":"EWPSA 5/15/16","match_date":"2016-05-15","stage_classifiercode":"03-07","member_number":"FY80708","first_name":"DONALD","last_name":"BROWN","classification":"B","division":"OPEN","hit_factor":4.6305},{"match_name":"NRG Saturday December 22nd - Includes a Classifier Stage","match_date":"2018-12-22","stage_classifiercode":"03-07","member_number":"\"\"","first_name":"JAY","last_name":"HU","classification":"B","division":"OPEN","hit_factor":4.624},{"match_name":"Schultz October 2015","match_date":"2015-10-11","stage_classifiercode":"03-07","member_number":"A71862","first_name":"JOE","last_name":"SINYAKOVICH","classification":"B","division":"OPEN","hit_factor":4.6185},{"match_name":"OREGON ARPC CC05 USPSA Feb 11 2017","match_date":"2017-02-11","stage_classifiercode":"03-07","member_number":"TY45892","first_name":"RICHARD","last_name":"BROWNING","classification":"B","division":"OPEN","hit_factor":4.6147},{"match_name":"CCPS 20170625","match_date":"2017-06-25","stage_classifiercode":"03-07","member_number":"A59267","first_name":"BRAD","last_name":"MCKIERMAN","classification":"M","division":"OPEN","hit_factor":4.6144},{"match_name":"USPSA","match_date":"2016-12-10","stage_classifiercode":"03-07","member_number":"ty75344","first_name":"CARY","last_name":"ROWTON","classification":"B","division":"OPEN","hit_factor":4.6115},{"match_name":"LCAS April 2017 USPSA","match_date":"2017-04-01","stage_classifiercode":"03-07","member_number":"TY28359","first_name":"MIKE","last_name":"FOSTER","classification":"B","division":"OPEN","hit_factor":4.6108},{"match_name":"PCWC USPSA  5 27 2017","match_date":"2017-05-27","stage_classifiercode":"03-07","member_number":"L729","first_name":"ROBERT","last_name":"WALKER","classification":"A","division":"OPEN","hit_factor":4.6088},{"match_name":"Swamp Eagles 2016-04 Pistol","match_date":"2016-04-17","stage_classifiercode":"03-07","member_number":"TY42086","first_name":"BILL","last_name":"JACKSON","classification":"B","division":"OPEN","hit_factor":4.6039},{"match_name":"GPS USPSA July 2021","match_date":"2021-07-25","stage_classifiercode":"03-07","member_number":"A123359","first_name":"DYLAN","last_name":"LORENCE","classification":"C","division":"OPEN","hit_factor":4.5994},{"match_name":"Space Coast Practical Shooters","match_date":"2017-04-01","stage_classifiercode":"03-07","member_number":"TY23169","first_name":"TED","last_name":"KAVAGE","classification":"B","division":"OPEN","hit_factor":4.5928},{"match_name":"North East Ohio Shooters - OH19 - 2016-08-13","match_date":"2016-08-13","stage_classifiercode":"03-07","member_number":"FY83046","first_name":"THOMAS","last_name":"GILLECE","classification":"B","division":"OPEN","hit_factor":4.5916},{"match_name":"FVPS September USPSA Match","match_date":"2016-09-03","stage_classifiercode":"03-07","member_number":"TY78432","first_name":"OUSMANE","last_name":"DIALLO","classification":"C","division":"OPEN","hit_factor":4.5908},{"match_name":"May 2018 USPSA Classifier Special","match_date":"2018-05-12","stage_classifiercode":"03-07","member_number":"F109640","first_name":"JOVENTINO","last_name":"CHAVEZ","classification":"\"\"","division":"OPEN","hit_factor":4.584},{"match_name":"GRPC USPSA JULY 4th BASH 2017-07-02","match_date":"2017-07-02","stage_classifiercode":"03-07","member_number":"A94852","first_name":"RANDY","last_name":"GOODNEY","classification":"U","division":"OPEN","hit_factor":4.5793},{"match_name":"SFPS 8-23-20 USPSA","match_date":"2020-08-23","stage_classifiercode":"03-07","member_number":"TY65769","first_name":"DANIEL","last_name":"NESTHUS","classification":"B","division":"OPEN","hit_factor":4.5739},{"match_name":"2017 Hawktech Arms Idaho Section Hi-cap Match","match_date":"2017-10-21","stage_classifiercode":"03-07","member_number":"A89186","first_name":"JACK","last_name":"COOPER","classification":"C","division":"OPEN","hit_factor":4.5736},{"match_name":"GRRC Week 8 2020","match_date":"2020-06-29","stage_classifiercode":"03-07","member_number":"A101675","first_name":"JUSTIN","last_name":"UNDERWOOD","classification":"U","division":"OPEN","hit_factor":4.5734},{"match_name":"EAGC September 2015 USPSA Pistol Match","match_date":"2015-09-20","stage_classifiercode":"03-07","member_number":"FY28307","first_name":"DAN","last_name":"MITCHELL","classification":"M","division":"OPEN","hit_factor":4.5726},{"match_name":"Richmond Hot Shots Oct 16-17-2021 USPSA","match_date":"2021-10-16","stage_classifiercode":"03-07","member_number":"TY107336","first_name":"JACKIE","last_name":"ZHAO","classification":"C","division":"OPEN","hit_factor":4.5723},{"match_name":"Pioneer Action Shooters Aug 2017 Match","match_date":"2017-08-13","stage_classifiercode":"03-07","member_number":"TY82118","first_name":"PETER","last_name":"GILBERT","classification":"B","division":"OPEN","hit_factor":4.5698},{"match_name":"Richmond Hot Shots August 4th-5th USPSA Pistol Match","match_date":"2018-08-04","stage_classifiercode":"03-07","member_number":"A61934","first_name":"WILLIAM","last_name":"TIU","classification":"B","division":"OPEN","hit_factor":4.5621},{"match_name":"Piscataqua  Master Blasters USPSA Monthly","match_date":"2018-08-05","stage_classifiercode":"03-07","member_number":"A103354","first_name":"STEVEN","last_name":"CHAET","classification":"C","division":"OPEN","hit_factor":4.5567},{"match_name":"January Match","match_date":"2017-01-22","stage_classifiercode":"03-07","member_number":"A71435","first_name":"FEGEE","last_name":"MATLOCK","classification":"A","division":"OPEN","hit_factor":4.5561},{"match_name":"Renton USPSA - April 2021 - NW05","match_date":"2021-04-25","stage_classifiercode":"03-07","member_number":"A83018","first_name":"RAE","last_name":"BALEROS","classification":"B","division":"OPEN","hit_factor":4.5428},{"match_name":"SCRAP USPSA Match - July 2016","match_date":"2016-07-17","stage_classifiercode":"03-07","member_number":"A19503","first_name":"JACK","last_name":"GRAHAM","classification":"M","division":"OPEN","hit_factor":4.5428},{"match_name":"MCPSL Pistol 3-12-16","match_date":"2016-03-12","stage_classifiercode":"03-07","member_number":"PEN","first_name":"MIKE","last_name":"EASTIN","classification":"U","division":"OPEN","hit_factor":4.5411},{"match_name":"Pioneer Action Shooters Aug 2017 Match","match_date":"2017-08-13","stage_classifiercode":"03-07","member_number":"A93279","first_name":"JONAH","last_name":"COLDWELL","classification":"U","division":"OPEN","hit_factor":4.5386},{"match_name":"CASA April USPSA Match","match_date":"2016-04-03","stage_classifiercode":"03-07","member_number":"A23320","first_name":"JOHN","last_name":"STIEDLE","classification":"M","division":"OPEN","hit_factor":4.537},{"match_name":"Space Coast Practical Shooters","match_date":"2017-04-01","stage_classifiercode":"03-07","member_number":"A77998","first_name":"CALVIN","last_name":"CARPENTER","classification":"A","division":"OPEN","hit_factor":4.5323},{"match_name":"LBAS160820","match_date":"2016-08-20","stage_classifiercode":"03-07","member_number":"TY64139","first_name":"KEVIN","last_name":"ACUFF","classification":"M","division":"OPEN","hit_factor":4.5292},{"match_name":"NRG September 24th 2016","match_date":"2016-09-24","stage_classifiercode":"03-07","member_number":"Ty24813","first_name":"RALPH","last_name":"ARREDONDO","classification":"M","division":"OPEN","hit_factor":4.5292},{"match_name":"NRG Saturday November 13th Includes a Classifier Stage","match_date":"2021-11-13","stage_classifiercode":"03-07","member_number":"FY84506","first_name":"MARC","last_name":"BARBANI","classification":"B","division":"OPEN","hit_factor":4.5291},{"match_name":"EWPSA 5/15/16","match_date":"2016-05-15","stage_classifiercode":"03-07","member_number":"FY39579","first_name":"ROBERT","last_name":"SPANGLER","classification":"B","division":"OPEN","hit_factor":4.5265},{"match_name":"TAC2 USPSA AUGUST 2018","match_date":"2018-08-04","stage_classifiercode":"03-07","member_number":"A97527","first_name":"JED","last_name":"MERCER","classification":"B","division":"OPEN","hit_factor":4.5238},{"match_name":"KIdlat September Club Match","match_date":"2018-09-01","stage_classifiercode":"03-07","member_number":"A37103","first_name":"RAIMON","last_name":"ALFONSO","classification":"B","division":"OPEN","hit_factor":4.5204},{"match_name":"OFGC USPSA Match 8-15-21","match_date":"2021-08-15","stage_classifiercode":"03-07","member_number":"A101376","first_name":"SHANE","last_name":"MACON","classification":"U","division":"OPEN","hit_factor":4.5198},{"match_name":"WNPL - USPSA March Snowblind Blowout 2017","match_date":"2017-03-05","stage_classifiercode":"03-07","member_number":"\"\"","first_name":"SEAN","last_name":"O'BRIEN","classification":"U","division":"OPEN","hit_factor":4.5198},{"match_name":"Rio Grande Practical Shooting Club - September 5 2020","match_date":"2020-09-05","stage_classifiercode":"03-07","member_number":"TY24322","first_name":"RANDY","last_name":"RYAN","classification":"M","division":"OPEN","hit_factor":4.5184},{"match_name":"XMG USPSA   Saturday November 6th 2021","match_date":"2021-11-06","stage_classifiercode":"03-07","member_number":"TY72510","first_name":"MICHAEL","last_name":"BATHON","classification":"B","division":"OPEN","hit_factor":4.5169},{"match_name":"ORSA USPSA August 2017 Match","match_date":"2017-08-16","stage_classifiercode":"03-07","member_number":"A102604","first_name":"ADAM","last_name":"BARNES","classification":"U","division":"OPEN","hit_factor":4.5168},{"match_name":"WNPL - USPSA March Snowblind Blowout 2017","match_date":"2017-03-05","stage_classifiercode":"03-07","member_number":"TY75664","first_name":"GREG","last_name":"BLAIR","classification":"B","division":"OPEN","hit_factor":4.5141},{"match_name":"LA05 Tangi September 2nd USPSA Match 2017","match_date":"2017-09-24","stage_classifiercode":"03-07","member_number":"43937","first_name":"ROBERT","last_name":"BRENNAN","classification":"C","division":"OPEN","hit_factor":4.5137},{"match_name":"Ontelaunee USPSA April 2017","match_date":"2017-04-22","stage_classifiercode":"03-07","member_number":"TY27707","first_name":"WILLIAM","last_name":"SCHMITT","classification":"B","division":"OPEN","hit_factor":4.5135},{"match_name":"Nampa USPSA May 17th","match_date":"2020-05-17","stage_classifiercode":"03-07","member_number":"TY30712","first_name":"DENNIS","last_name":"WILSON","classification":"B","division":"OPEN","hit_factor":4.5126},{"match_name":"January Match","match_date":"2017-01-22","stage_classifiercode":"03-07","member_number":"TY69238","first_name":"TONY","last_name":"WALL","classification":"B","division":"OPEN","hit_factor":4.5054},{"match_name":"October 2015 CAS Match","match_date":"2015-10-04","stage_classifiercode":"03-07","member_number":"\"\"","first_name":"JIM","last_name":"RAMOIN","classification":"X","division":"OPEN","hit_factor":4.5049},{"match_name":"Dundee Practical Shooters - June 27 2020 - Points for Pistol","match_date":"2020-06-27","stage_classifiercode":"03-07","member_number":"L3134","first_name":"CARL","last_name":"SCHMIDT","classification":"M","division":"OPEN","hit_factor":4.4986},{"match_name":"HLSL 12-09-2018","match_date":"2018-12-09","stage_classifiercode":"03-07","member_number":"\"\"","first_name":"BOBOT","last_name":"DUQUEZ","classification":"C","division":"OPEN","hit_factor":4.4954},{"match_name":"LdF USPSA Match January 13 2018","match_date":"2018-01-13","stage_classifiercode":"03-07","member_number":"\"\"","first_name":"JIM","last_name":"BUCCELLATO","classification":"M","division":"OPEN","hit_factor":4.49},{"match_name":"NRG Saturday December 22nd - Includes a Classifier Stage","match_date":"2018-12-22","stage_classifiercode":"03-07","member_number":"TY33259","first_name":"WILLIAM","last_name":"PAOLINO","classification":"M","division":"OPEN","hit_factor":4.4845},{"match_name":"MPSA 072118 USPS","match_date":"2018-07-21","stage_classifiercode":"03-07","member_number":"L4120","first_name":"MICHAEL","last_name":"RAMOS","classification":"D","division":"OPEN","hit_factor":4.4831},{"match_name":"Extreme GM USPSA 5-8","match_date":"2021-05-05","stage_classifiercode":"03-07","member_number":"A104504","first_name":"LES","last_name":"HERMAN","classification":"C","division":"OPEN","hit_factor":4.4819},{"match_name":"Dundee Practical Shooters - June 27 2020 - Points for Pistol","match_date":"2020-06-27","stage_classifiercode":"03-07","member_number":"L3893","first_name":"MIKE","last_name":"BURGESS","classification":"M","division":"OPEN","hit_factor":4.4815},{"match_name":"Ontelaunee USPSA April 2017","match_date":"2017-04-22","stage_classifiercode":"03-07","member_number":"\"\"","first_name":"JAMES","last_name":"BYRNE","classification":"B","division":"OPEN","hit_factor":4.4769},{"match_name":"January Match","match_date":"2017-01-22","stage_classifiercode":"03-07","member_number":"Fy69155","first_name":"WES","last_name":"BOLES","classification":"B","division":"OPEN","hit_factor":4.4741},{"match_name":"Detroit Sportsmens Congress - August 20 2017","match_date":"2017-08-20","stage_classifiercode":"03-07","member_number":"A72473","first_name":"FRANK","last_name":"NILO","classification":"C","division":"OPEN","hit_factor":4.4728},{"match_name":"PCSI - July 2017 USPSA","match_date":"2017-07-01","stage_classifiercode":"03-07","member_number":"TY66305","first_name":"HERB","last_name":"SMITH","classification":"B","division":"OPEN","hit_factor":4.4727},{"match_name":"BRRC USPSA April 9 2016","match_date":"2016-04-09","stage_classifiercode":"03-07","member_number":"FY53427","first_name":"TONY","last_name":"FRIEDRICH","classification":"B","division":"OPEN","hit_factor":4.4704},{"match_name":"North East Ohio Shooters - OH19 - 2016-08-13","match_date":"2016-08-13","stage_classifiercode":"03-07","member_number":"\"\"","first_name":"DIENEZ","last_name":"WOLLET","classification":"U","division":"OPEN","hit_factor":4.4701},{"match_name":"PIPS 07-13-2016","match_date":"2016-07-13","stage_classifiercode":"03-07","member_number":"FY69138","first_name":"JOHN","last_name":"CEDARBERG","classification":"B","division":"OPEN","hit_factor":4.4682},{"match_name":"FLPSA USPSA 04.23.2016","match_date":"2016-04-23","stage_classifiercode":"03-07","member_number":"TY73645","first_name":"JOE","last_name":"BENSON","classification":"B","division":"OPEN","hit_factor":4.4647},{"match_name":"PMRPC USPSA  10Apr21","match_date":"2021-04-10","stage_classifiercode":"03-07","member_number":"TY29847","first_name":"ROSS","last_name":"ROSENBERG","classification":"A","division":"OPEN","hit_factor":4.4574},{"match_name":"LdF USPSA Match January 13 2018","match_date":"2018-01-13","stage_classifiercode":"03-07","member_number":"FY62295","first_name":"DAVID","last_name":"MORRIS","classification":"B","division":"OPEN","hit_factor":4.4574},{"match_name":"GCL Wed 5-3-17","match_date":"2017-05-03","stage_classifiercode":"03-07","member_number":"L3750","first_name":"MIKE","last_name":"COLE","classification":"M","division":"OPEN","hit_factor":4.457},{"match_name":"PSOCA USPSA May 23 2020 CAGC","match_date":"2020-05-23","stage_classifiercode":"03-07","member_number":"Ty106020","first_name":"JACOB","last_name":"TAYLOR","classification":"G","division":"OPEN","hit_factor":4.4552},{"match_name":"2018-10-06 USPSA at Phoenix Rod and Gun Club","match_date":"2018-10-06","stage_classifiercode":"03-07","member_number":"TY96866","first_name":"MIKE","last_name":"REED","classification":"B","division":"OPEN","hit_factor":4.455},{"match_name":"RCPS USPSA April 21","match_date":"2018-04-21","stage_classifiercode":"03-07","member_number":"FY35534","first_name":"DUNDEE","last_name":"UY","classification":"A","division":"OPEN","hit_factor":4.4519},{"match_name":"OK15 USPSA at USSA","match_date":"2016-12-11","stage_classifiercode":"03-07","member_number":"A84245","first_name":"BRYAN","last_name":"HOOVER","classification":"C","division":"OPEN","hit_factor":4.4508},{"match_name":"Detroit Sportsmens Congress - August 20 2017","match_date":"2017-08-20","stage_classifiercode":"03-07","member_number":"A104695","first_name":"BRAD","last_name":"RAINEY","classification":"U","division":"OPEN","hit_factor":4.4487},{"match_name":"Nampa USPSA May 17th","match_date":"2020-05-17","stage_classifiercode":"03-07","member_number":"A530","first_name":"JERRY","last_name":"DIX","classification":"M","division":"OPEN","hit_factor":4.4476},{"match_name":"PMSC May 2017","match_date":"2017-05-07","stage_classifiercode":"03-07","member_number":"fy72047","first_name":"GREG","last_name":"ZOMBEK","classification":"B","division":"OPEN","hit_factor":4.4476},{"match_name":"RCPS USPSA April 21","match_date":"2018-04-21","stage_classifiercode":"03-07","member_number":"A71589","first_name":"SCOTTIE","last_name":"ROBERSON","classification":"M","division":"OPEN","hit_factor":4.4465},{"match_name":"TPS USPSA AT CMP MARCH 20 2021","match_date":"2021-03-20","stage_classifiercode":"03-07","member_number":"A130687","first_name":"LEE","last_name":"HENDERSON","classification":"B","division":"OPEN","hit_factor":4.4434},{"match_name":"LdF USPSA Match January 13 2018","match_date":"2018-01-13","stage_classifiercode":"03-07","member_number":"TY43291","first_name":"WILLIAM","last_name":"JEHL","classification":"B","division":"OPEN","hit_factor":4.4423},{"match_name":"Pioneer Action Shooters Aug 2017 Match","match_date":"2017-08-13","stage_classifiercode":"03-07","member_number":"A101407","first_name":"JAMES","last_name":"LAROSA","classification":"B","division":"OPEN","hit_factor":4.4353},{"match_name":"FSA USPSA 01-12-20","match_date":"2020-01-13","stage_classifiercode":"03-07","member_number":"L4558","first_name":"MICHAEL","last_name":"OLSON","classification":"B","division":"OPEN","hit_factor":4.4304},{"match_name":"Competitive Shooters of Lake Norman CORNELIUS Thursday Evening Indoor USPSA Pistol Match North Carolina","match_date":"2020-09-17","stage_classifiercode":"03-07","member_number":"A99427","first_name":"MATTHEW","last_name":"POSVAR","classification":"B","division":"OPEN","hit_factor":4.4286},{"match_name":"NRG September 24th 2016","match_date":"2016-09-24","stage_classifiercode":"03-07","member_number":"\"\"","first_name":"LIANG","last_name":"GUO","classification":"U","division":"OPEN","hit_factor":4.4286},{"match_name":"GCL May 6-2017","match_date":"2017-05-06","stage_classifiercode":"03-07","member_number":"FY45990","first_name":"JOHN","last_name":"MARCAIDA","classification":"M","division":"OPEN","hit_factor":4.428},{"match_name":"ARPC USPSA Match 5-28-17","match_date":"2017-05-28","stage_classifiercode":"03-07","member_number":"TY13859","first_name":"FRANK","last_name":"OBARR","classification":"B","division":"OPEN","hit_factor":4.427},{"match_name":"Renton USPSA - April 2021 - NW05","match_date":"2021-04-25","stage_classifiercode":"03-07","member_number":"A110185","first_name":"RYAN","last_name":"HALWICK","classification":"B","division":"OPEN","hit_factor":4.4258},{"match_name":"Springfield Tactical Shooters 08/02/2018","match_date":"2018-08-02","stage_classifiercode":"03-07","member_number":"L1467","first_name":"CHARLES","last_name":"MORSE","classification":"B","division":"OPEN","hit_factor":4.421},{"match_name":"LdF USPSA Match January 13 2018","match_date":"2018-01-13","stage_classifiercode":"03-07","member_number":"FY39124","first_name":"RAMIRO","last_name":"REYES","classification":"M","division":"OPEN","hit_factor":4.4202},{"match_name":"Ontelaunee USPSA April 2017","match_date":"2017-04-22","stage_classifiercode":"03-07","member_number":"A66127","first_name":"KENNY","last_name":"LEE","classification":"B","division":"OPEN","hit_factor":4.4199},{"match_name":"2018-10-06 USPSA at Phoenix Rod and Gun Club","match_date":"2018-10-06","stage_classifiercode":"03-07","member_number":"TY28855","first_name":"PHILLIP","last_name":"GALLEGOS","classification":"A","division":"OPEN","hit_factor":4.4152},{"match_name":"SAPSA February 2020 Match","match_date":"2020-02-15","stage_classifiercode":"03-07","member_number":"A106054","first_name":"CHRIS","last_name":"FOWLER","classification":"U","division":"OPEN","hit_factor":4.4145},{"match_name":"SFPC December 3 2017 USPSA Match","match_date":"2017-12-03","stage_classifiercode":"03-07","member_number":"A93589","first_name":"GUS","last_name":"COSIO","classification":"C","division":"OPEN","hit_factor":4.4111},{"match_name":"LdF USPSA Match January 13 2018","match_date":"2018-01-13","stage_classifiercode":"03-07","member_number":"A76488","first_name":"MELINDA","last_name":"HENNESSEY","classification":"B","division":"OPEN","hit_factor":4.411},{"match_name":"Marc-On Shooting USPSA January 12th","match_date":"2020-01-12","stage_classifiercode":"03-07","member_number":"A95574","first_name":"CHARLES","last_name":"KIM","classification":"C","division":"OPEN","hit_factor":4.4109},{"match_name":"NRG Saturday December 22nd - Includes a Classifier Stage","match_date":"2018-12-22","stage_classifiercode":"03-07","member_number":"Fy24813","first_name":"RALPH","last_name":"ARREDONDO","classification":"M","division":"OPEN","hit_factor":4.4073},{"match_name":"NRG Saturday November 13th Includes a Classifier Stage","match_date":"2021-11-13","stage_classifiercode":"03-07","member_number":"FY33599","first_name":"WILLIAM","last_name":"PAOLINO","classification":"M","division":"OPEN","hit_factor":4.4059},{"match_name":"Mapsa 2017 O8 12","match_date":"2017-08-11","stage_classifiercode":"03-07","member_number":"PEN","first_name":"ERIC","last_name":"FORREST","classification":"U","division":"OPEN","hit_factor":4.4017},{"match_name":"NRG Saturday December 22nd - Includes a Classifier Stage","match_date":"2018-12-22","stage_classifiercode":"03-07","member_number":"\"\"","first_name":"RANING","last_name":"FELIPE","classification":"B","division":"OPEN","hit_factor":4.3983},{"match_name":"BPSA September 2016 USPSA","match_date":"2016-09-25","stage_classifiercode":"03-07","member_number":"A66934","first_name":"ELIZABETH","last_name":"YOUNG","classification":"C","division":"OPEN","hit_factor":4.3956},{"match_name":"Nampa USPSA May 17th","match_date":"2020-05-17","stage_classifiercode":"03-07","member_number":"A101001","first_name":"TIM","last_name":"AUSTIN","classification":"A","division":"OPEN","hit_factor":4.388},{"match_name":"LGCSEMPS AUGUST 2020 HANDGUN","match_date":"2020-08-08","stage_classifiercode":"03-07","member_number":"TY100079","first_name":"CHRISTOPHER","last_name":"ARACE","classification":"B","division":"OPEN","hit_factor":4.3851},{"match_name":"Springfield Tactical Shooters 08/02/2018","match_date":"2018-08-02","stage_classifiercode":"03-07","member_number":"A99127","first_name":"STEVE","last_name":"FRAZIER","classification":"C","division":"OPEN","hit_factor":4.3796},{"match_name":"Ontelaunee USPSA April 2017","match_date":"2017-04-22","stage_classifiercode":"03-07","member_number":"TY82780","first_name":"JEANNE","last_name":"RUANE","classification":"C","division":"OPEN","hit_factor":4.3759},{"match_name":"GCL May 6-2017","match_date":"2017-05-06","stage_classifiercode":"03-07","member_number":"TY5113","first_name":"PAUL","last_name":"GOODMAN","classification":"B","division":"OPEN","hit_factor":4.3692},{"match_name":"Richmond Classifier Match January 24-2016","match_date":"2016-01-24","stage_classifiercode":"03-07","member_number":"A79956","first_name":"EDWIN","last_name":"CHANG","classification":"U","division":"OPEN","hit_factor":4.3651},{"match_name":"Richmond Hot Shots Oct 16-17-2021 USPSA","match_date":"2021-10-16","stage_classifiercode":"03-07","member_number":"FY121894","first_name":"ENG","last_name":"LIM","classification":"C","division":"OPEN","hit_factor":4.3638},{"match_name":"GCL May 6-2017","match_date":"2017-05-06","stage_classifiercode":"03-07","member_number":"A62449","first_name":"JOHN M","last_name":"KOZIOL","classification":"C","division":"OPEN","hit_factor":4.3629},{"match_name":"LdF 2nd Saturday USPSA Match","match_date":"2016-12-10","stage_classifiercode":"03-07","member_number":"TY82338","first_name":"AL","last_name":"WILLINGHAM","classification":"U","division":"OPEN","hit_factor":4.3587},{"match_name":"NRG Saturday December 22nd - Includes a Classifier Stage","match_date":"2018-12-22","stage_classifiercode":"03-07","member_number":"A64201","first_name":"CLAUDIA","last_name":"VIDANES","classification":"B","division":"OPEN","hit_factor":4.3581},{"match_name":"Afternoon SMPS 09 February 2020 USPSA Classifier Match","match_date":"2020-02-09","stage_classifiercode":"03-07","member_number":"A98070","first_name":"STEVE","last_name":"GREGORY","classification":"U","division":"OPEN","hit_factor":4.3577},{"match_name":"Extreme GM USPSA 5-8","match_date":"2021-05-05","stage_classifiercode":"03-07","member_number":"A107644","first_name":"ISAGANI","last_name":"RIRAO","classification":"C","division":"OPEN","hit_factor":4.3558},{"match_name":"GPS USPSA July 2021","match_date":"2021-07-25","stage_classifiercode":"03-07","member_number":"TY79055","first_name":"WADE","last_name":"PRUETZ","classification":"A","division":"OPEN","hit_factor":4.3539},{"match_name":"LCAS April 2017 USPSA","match_date":"2017-04-01","stage_classifiercode":"03-07","member_number":"L3620","first_name":"STEVE","last_name":"FOUTZ","classification":"B","division":"OPEN","hit_factor":4.3529},{"match_name":"PCSI - July 2017 USPSA","match_date":"2017-07-01","stage_classifiercode":"03-07","member_number":"L2137","first_name":"RICK","last_name":"STEELE","classification":"B","division":"OPEN","hit_factor":4.3498},{"match_name":"Griffin USPSA Jan 2020","match_date":"2020-01-17","stage_classifiercode":"03-07","member_number":"A109161","first_name":"ROY","last_name":"SCHWARZ","classification":"A","division":"OPEN","hit_factor":4.3478},{"match_name":"BRRC USPSA April 9 2016","match_date":"2016-04-09","stage_classifiercode":"03-07","member_number":"L2281","first_name":"J","last_name":"GRIFFIN","classification":"A","division":"OPEN","hit_factor":4.3478},{"match_name":"Richmond Hot Shots Oct 16-17-2021 USPSA","match_date":"2021-10-16","stage_classifiercode":"03-07","member_number":"TY103495","first_name":"RAYMOND","last_name":"IBITA","classification":"U","division":"OPEN","hit_factor":4.3358},{"match_name":"May 2017 USPSA Classifier Special","match_date":"2017-05-13","stage_classifiercode":"03-07","member_number":"TYF87401","first_name":"MICHAEL","last_name":"MAHONEY","classification":"B","division":"OPEN","hit_factor":4.3328},{"match_name":"Shasta Shooters January 2017","match_date":"2017-01-15","stage_classifiercode":"03-07","member_number":"L3873","first_name":"DON","last_name":"SANTORO","classification":"A","division":"OPEN","hit_factor":4.3272},{"match_name":"PMSC May 2017","match_date":"2017-05-07","stage_classifiercode":"03-07","member_number":"ty77032","first_name":"TYLER","last_name":"COKE","classification":"B","division":"OPEN","hit_factor":4.3261},{"match_name":"Richmond Classifier Match January 24-2016","match_date":"2016-01-24","stage_classifiercode":"03-07","member_number":"A83502","first_name":"PAUL","last_name":"CLANTON","classification":"C","division":"OPEN","hit_factor":4.3222},{"match_name":"JCSSA NOV 7 2020","match_date":"2020-11-07","stage_classifiercode":"03-07","member_number":"A47004","first_name":"MAX","last_name":"SPURGEON","classification":"B","division":"OPEN","hit_factor":4.3173},{"match_name":"June 12 2021 The Range At True North USPSA Match","match_date":"2021-06-12","stage_classifiercode":"03-07","member_number":"TY126071","first_name":"JOSHUA","last_name":"SCHROEPFER","classification":"B","division":"OPEN","hit_factor":4.3169},{"match_name":"G2G July 27th USPSA Match","match_date":"2021-07-27","stage_classifiercode":"03-07","member_number":"A135265","first_name":"MATTHEW","last_name":"OKUN","classification":"D","division":"OPEN","hit_factor":4.3148},{"match_name":"MPSA 072118 USPS","match_date":"2018-07-21","stage_classifiercode":"03-07","member_number":"A78083","first_name":"JEFFREY","last_name":"BLITCH","classification":"B","division":"OPEN","hit_factor":4.3035},{"match_name":"LTD Pistol - October 2017","match_date":"2017-10-07","stage_classifiercode":"03-07","member_number":"\"\"","first_name":"JOEL","last_name":"HABARAD","classification":"U","division":"OPEN","hit_factor":4.3031},{"match_name":"ARPC USPSA Match 5-28-17","match_date":"2017-05-28","stage_classifiercode":"03-07","member_number":"A79608","first_name":"DAVID","last_name":"OVERLAND","classification":"B","division":"OPEN","hit_factor":4.303},{"match_name":"MVPSA USPSA Match November 6th 2021","match_date":"2021-11-06","stage_classifiercode":"03-07","member_number":"L4137","first_name":"STEVE","last_name":"PEACOCK","classification":"C","division":"OPEN","hit_factor":4.2996},{"match_name":"TTS   12DEC2020","match_date":"2020-12-12","stage_classifiercode":"03-07","member_number":"A100138","first_name":"MICHAEL","last_name":"MCCOY","classification":"U","division":"OPEN","hit_factor":4.298},{"match_name":"MCAS USPSA October 2016","match_date":"2016-10-15","stage_classifiercode":"03-07","member_number":"FL3702","first_name":"WALTER","last_name":"HORNBY","classification":"C","division":"OPEN","hit_factor":4.2972},{"match_name":"LIPSA - November 4th 2018 - USPSA Classifier Match","match_date":"2018-11-04","stage_classifiercode":"03-07","member_number":"TY33497","first_name":"CLAYTON","last_name":"ERKMANN","classification":"B","division":"OPEN","hit_factor":4.2956},{"match_name":"JCSSA NOV3 2018","match_date":"2018-11-03","stage_classifiercode":"03-07","member_number":"A47004","first_name":"MAX","last_name":"SPURGEON","classification":"B","division":"OPEN","hit_factor":4.2956},{"match_name":"TAPS MARCH MATCH","match_date":"2017-03-11","stage_classifiercode":"03-07","member_number":"A93218","first_name":"AUSTIN","last_name":"HARRIS","classification":"B","division":"OPEN","hit_factor":4.2923},{"match_name":"MPSA 042818 USPSA","match_date":"2018-04-28","stage_classifiercode":"03-07","member_number":"A78083","first_name":"JEFF","last_name":"BLITCH","classification":"B","division":"OPEN","hit_factor":4.2898},{"match_name":"PMRPC USPSA  10Apr21","match_date":"2021-04-10","stage_classifiercode":"03-07","member_number":"TY31824","first_name":"PAUL","last_name":"SHIM","classification":"A","division":"OPEN","hit_factor":4.2876},{"match_name":"ORSA USPSA August 2017 Match","match_date":"2017-08-16","stage_classifiercode":"03-07","member_number":"A85473","first_name":"NATHAN","last_name":"DIVELY","classification":"C","division":"OPEN","hit_factor":4.2857},{"match_name":"PMSC May 2017","match_date":"2017-05-07","stage_classifiercode":"03-07","member_number":"fy83047","first_name":"THOMAS","last_name":"GILLECE","classification":"U","division":"OPEN","hit_factor":4.2747},{"match_name":"Pathfinder June USPSA Match","match_date":"2020-06-21","stage_classifiercode":"03-07","member_number":"L3604","first_name":"JIM","last_name":"WHEELER","classification":"A","division":"OPEN","hit_factor":4.2735},{"match_name":"Rankin Field November Saturday USPSA","match_date":"2021-11-06","stage_classifiercode":"03-07","member_number":"A100211","first_name":"PAUL","last_name":"CHETWOOD","classification":"A","division":"OPEN","hit_factor":4.2697},{"match_name":"Matamoras  USPSA July 2018","match_date":"2018-07-15","stage_classifiercode":"03-07","member_number":"TY104413","first_name":"LEE","last_name":"CANFIELD","classification":"C","division":"OPEN","hit_factor":4.2672},{"match_name":"March 13 2021 The Range At True North USPSA Match","match_date":"2021-03-13","stage_classifiercode":"03-07","member_number":"L4056","first_name":"DILLION","last_name":"WALKER","classification":"A","division":"OPEN","hit_factor":4.2654},{"match_name":"Griffin USPSA Match Oct 15 2016","match_date":"2016-10-15","stage_classifiercode":"03-07","member_number":"TY5396","first_name":"ADAM","last_name":"REAMES","classification":"B","division":"OPEN","hit_factor":4.2654},{"match_name":"Schultz October 2015","match_date":"2015-10-11","stage_classifiercode":"03-07","member_number":"A55556","first_name":"RON","last_name":"EVANS","classification":"B","division":"OPEN","hit_factor":4.264},{"match_name":"Renton USPSA - April 2021 - NW05","match_date":"2021-04-25","stage_classifiercode":"03-07","member_number":"L4865","first_name":"CLIFFORD","last_name":"AGUILAR","classification":"C","division":"OPEN","hit_factor":4.2627},{"match_name":"MAPSA June Special Classifier","match_date":"2018-06-09","stage_classifiercode":"03-07","member_number":"a90911","first_name":"LINCOLN","last_name":"JENSEN","classification":"U","division":"OPEN","hit_factor":4.2592},{"match_name":"RSPP 3rd Saturday April 2016","match_date":"2016-04-16","stage_classifiercode":"03-07","member_number":"TY46968","first_name":"STEVEN","last_name":"REDIES","classification":"A","division":"OPEN","hit_factor":4.2573},{"match_name":"2017 Hawktech Arms Idaho Section Hi-cap Match","match_date":"2017-10-21","stage_classifiercode":"03-07","member_number":"A69178","first_name":"JASON","last_name":"PRICE","classification":"B","division":"OPEN","hit_factor":4.2525},{"match_name":"FLPSA USPSA 04.23.2016","match_date":"2016-04-23","stage_classifiercode":"03-07","member_number":"TY69138","first_name":"JOHN","last_name":"CEDARBERG","classification":"B","division":"OPEN","hit_factor":4.2523},{"match_name":"MCAS USPSA October 2016","match_date":"2016-10-15","stage_classifiercode":"03-07","member_number":"TY25701","first_name":"ANDY","last_name":"ADAMS","classification":"C","division":"OPEN","hit_factor":4.2495},{"match_name":"CGGR September USPSA Match","match_date":"2016-09-17","stage_classifiercode":"03-07","member_number":"A31524","first_name":"COUNCIL","last_name":"BRADSHAW","classification":"G","division":"OPEN","hit_factor":4.2447},{"match_name":"Dundee Practical Shooters - June 27 2020 - Points for Pistol","match_date":"2020-06-27","stage_classifiercode":"03-07","member_number":"L4718","first_name":"LYNSEY","last_name":"PESTES","classification":"U","division":"OPEN","hit_factor":4.2422},{"match_name":"GCL Wed 5-3-17","match_date":"2017-05-03","stage_classifiercode":"03-07","member_number":"A35723","first_name":"DAVE","last_name":"HAVASI","classification":"B","division":"OPEN","hit_factor":4.2359},{"match_name":"Tropang Vegas All Classifier Match","match_date":"2020-12-06","stage_classifiercode":"03-07","member_number":"A100493","first_name":"MARK","last_name":"SANTOS","classification":"B","division":"OPEN","hit_factor":4.2321},{"match_name":"LBAS180217","match_date":"2018-02-17","stage_classifiercode":"03-07","member_number":"A46427","first_name":"LARRY","last_name":"ALEXANDER","classification":"A","division":"OPEN","hit_factor":4.2285},{"match_name":"MAPSA June Special Classifier","match_date":"2018-06-09","stage_classifiercode":"03-07","member_number":"A86183","first_name":"IAN","last_name":"JOHNSON","classification":"C","division":"OPEN","hit_factor":4.2275},{"match_name":"Extreme GM USPSA 5-8","match_date":"2021-05-05","stage_classifiercode":"03-07","member_number":"A110109","first_name":"MICHAEL","last_name":"GARRO","classification":"A","division":"OPEN","hit_factor":4.2254},{"match_name":"ECPS USPSA 15 SEP 18","match_date":"2018-09-15","stage_classifiercode":"03-07","member_number":"L3535","first_name":"TAK","last_name":"ONG","classification":"B","division":"OPEN","hit_factor":4.2234},{"match_name":"RSPP 3rd Saturday April 2016","match_date":"2016-04-16","stage_classifiercode":"03-07","member_number":"TY58233","first_name":"AL","last_name":"BARR","classification":"C","division":"OPEN","hit_factor":4.2229},{"match_name":"NRG Saturday December 22nd - Includes a Classifier Stage","match_date":"2018-12-22","stage_classifiercode":"03-07","member_number":"TY92176","first_name":"JAE","last_name":"AHN","classification":"A","division":"OPEN","hit_factor":4.2213},{"match_name":"LdF 2nd Saturday USPSA Match","match_date":"2016-12-10","stage_classifiercode":"03-07","member_number":"TY16393","first_name":"JIM","last_name":"BUCCELLATO","classification":"M","division":"OPEN","hit_factor":4.2182},{"match_name":"Dundee Practical Shooters - June 27 2020 - Points for Pistol","match_date":"2020-06-27","stage_classifiercode":"03-07","member_number":"A81972","first_name":"ANDREW","last_name":"MERCER","classification":"B","division":"OPEN","hit_factor":4.2155},{"match_name":"Ontelaunee USPSA April 2017","match_date":"2017-04-22","stage_classifiercode":"03-07","member_number":"A86775","first_name":"ALEXANDER","last_name":"REALUYO","classification":"B","division":"OPEN","hit_factor":4.2149},{"match_name":"Castlewood USPSA August 2020 shoot","match_date":"2020-08-22","stage_classifiercode":"03-07","member_number":"ty84357","first_name":"RAY","last_name":"DONCH","classification":"B","division":"OPEN","hit_factor":4.2095},{"match_name":"Oxford OHS05 100321","match_date":"2021-10-03","stage_classifiercode":"03-07","member_number":"Ty101296","first_name":"BEN","last_name":"WENNING","classification":"C","division":"OPEN","hit_factor":4.2045},{"match_name":"TPS USPSA AT CMP MARCH 20 2021","match_date":"2021-03-20","stage_classifiercode":"03-07","member_number":"A120007","first_name":"DIMA","last_name":"ULBERG","classification":"B","division":"OPEN","hit_factor":4.1995},{"match_name":"Fairfax PS USPSA 2020 March","match_date":"2020-03-17","stage_classifiercode":"03-07","member_number":"TY109301","first_name":"DAVID","last_name":"THOMPSON","classification":"B","division":"OPEN","hit_factor":4.1971},{"match_name":"2017 Hawktech Arms Idaho Section Hi-cap Match","match_date":"2017-10-21","stage_classifiercode":"03-07","member_number":"A84188","first_name":"LAWRENCE","last_name":"OLETSKI","classification":"C","division":"OPEN","hit_factor":4.1892},{"match_name":"Richmond Hot Shots Oct 16-17-2021 USPSA","match_date":"2021-10-16","stage_classifiercode":"03-07","member_number":"TY74322","first_name":"ANDRE","last_name":"TAUBE","classification":"M","division":"OPEN","hit_factor":4.1873},{"match_name":"SCAPSA MN05 Spring League 3","match_date":"2017-04-24","stage_classifiercode":"03-07","member_number":"TY29847","first_name":"ROSS","last_name":"ROSENBERG","classification":"A","division":"OPEN","hit_factor":4.181},{"match_name":"RSPP 3rd Saturday April 2016","match_date":"2016-04-16","stage_classifiercode":"03-07","member_number":"A58956","first_name":"RICK","last_name":"KORZEP","classification":"B","division":"OPEN","hit_factor":4.1761},{"match_name":"CRAG USPSA 6-13-2020","match_date":"2020-06-13","stage_classifiercode":"03-07","member_number":"A113372","first_name":"LOGAN","last_name":"MUGGLI","classification":"A","division":"OPEN","hit_factor":4.1761},{"match_name":"Ontelaunee USPSA April 2017","match_date":"2017-04-22","stage_classifiercode":"03-07","member_number":"TY13104","first_name":"GARY","last_name":"VENEROSO","classification":"C","division":"OPEN","hit_factor":4.1704},{"match_name":"NRG Saturday December 22nd - Includes a Classifier Stage","match_date":"2018-12-22","stage_classifiercode":"03-07","member_number":"A26171","first_name":"JOEY","last_name":"CASTILLO","classification":"B","division":"OPEN","hit_factor":4.1647},{"match_name":"Briar  Rabbit July Match 2016 OH20","match_date":"2016-07-24","stage_classifiercode":"03-07","member_number":"A81835","first_name":"DON","last_name":"MAHER","classification":"C","division":"OPEN","hit_factor":4.1631},{"match_name":"SCCCMAY2016","match_date":"2016-05-08","stage_classifiercode":"03-07","member_number":"A87894","first_name":"DEVEN","last_name":"WAGNER","classification":"C","division":"OPEN","hit_factor":4.1625},{"match_name":"NRG September 24th 2016","match_date":"2016-09-24","stage_classifiercode":"03-07","member_number":"A62838","first_name":"AL","last_name":"MINICOLA","classification":"B","division":"OPEN","hit_factor":4.1594},{"match_name":"Klamath USPSA 05/01/16 JSPS OR09","match_date":"2016-05-01","stage_classifiercode":"03-07","member_number":"L1828","first_name":"OMAR","last_name":"NEWBURY","classification":"A","division":"OPEN","hit_factor":4.1566},{"match_name":"Briar  Rabbit July Match 2016 OH20","match_date":"2016-07-24","stage_classifiercode":"03-07","member_number":"A80746","first_name":"MIKE","last_name":"WILSON","classification":"C","division":"OPEN","hit_factor":4.1519},{"match_name":"JPPS USPSA Club Match 6-2-18","match_date":"2018-06-02","stage_classifiercode":"03-07","member_number":"A103819","first_name":"ALEX","last_name":"BIGGER","classification":"B","division":"OPEN","hit_factor":4.1466},{"match_name":"Mapsa 2017 O8 12","match_date":"2017-08-11","stage_classifiercode":"03-07","member_number":"L4275","first_name":"MIKE","last_name":"BERTRAND","classification":"C","division":"OPEN","hit_factor":4.1441},{"match_name":"Castlewood USPSA August 2020 shoot","match_date":"2020-08-22","stage_classifiercode":"03-07","member_number":"A24039","first_name":"ALAN","last_name":"MASLONEK","classification":"A","division":"OPEN","hit_factor":4.1427},{"match_name":"NNRPA USPSA November 2017","match_date":"2017-11-25","stage_classifiercode":"03-07","member_number":"TY40370","first_name":"LEE","last_name":"CATON","classification":"B","division":"OPEN","hit_factor":4.1405},{"match_name":"Pathfinder June USPSA Match","match_date":"2020-06-21","stage_classifiercode":"03-07","member_number":"fy45777","first_name":"THEODORE","last_name":"FIRNSTEIN","classification":"A","division":"OPEN","hit_factor":4.1391},{"match_name":"CGGR September USPSA Match","match_date":"2016-09-17","stage_classifiercode":"03-07","member_number":"A63410","first_name":"EDDIE","last_name":"HUGHES","classification":"C","division":"OPEN","hit_factor":4.1386},{"match_name":"North Lawrence Fish And Game USPSA 10/17/20","match_date":"2020-10-17","stage_classifiercode":"03-07","member_number":"A90421","first_name":"DON","last_name":"BATES","classification":"C","division":"OPEN","hit_factor":4.1386},{"match_name":"BPSA September 2016 USPSA","match_date":"2016-09-25","stage_classifiercode":"03-07","member_number":"TY82463","first_name":"DAVID","last_name":"MARTIAN","classification":"C","division":"OPEN","hit_factor":4.1338},{"match_name":"Matamoras  USPSA July 2018","match_date":"2018-07-15","stage_classifiercode":"03-07","member_number":"TY90513","first_name":"MARK","last_name":"NOVAKOWSKI","classification":"B","division":"OPEN","hit_factor":4.1332},{"match_name":"SCCCMAY2016","match_date":"2016-05-08","stage_classifiercode":"03-07","member_number":"TY61081","first_name":"TOM","last_name":"SCHWENN","classification":"B","division":"OPEN","hit_factor":4.1322},{"match_name":"Rio Grande Practical Shooters - September 2016","match_date":"2016-09-03","stage_classifiercode":"03-07","member_number":"A6063","first_name":"NANCI","last_name":"LAMBERT","classification":"B","division":"OPEN","hit_factor":4.1308},{"match_name":"CSA Sept 2016","match_date":"2016-09-11","stage_classifiercode":"03-07","member_number":"A85695","first_name":"ALAN","last_name":"FRENCH","classification":"C","division":"OPEN","hit_factor":4.1297},{"match_name":"RPGi USPSA Last Minute Match! 18 July 2021","match_date":"2021-07-18","stage_classifiercode":"03-07","member_number":"A133556","first_name":"DION","last_name":"WALKER JR","classification":"U","division":"OPEN","hit_factor":4.1257},{"match_name":"Shoot GTR USPSA 11/29","match_date":"2016-11-29","stage_classifiercode":"03-07","member_number":"A98681","first_name":"JASON","last_name":"PERCY","classification":"U","division":"OPEN","hit_factor":4.1248},{"match_name":"Mesilla Valley P November 2021 USPSA match","match_date":"2021-11-21","stage_classifiercode":"03-07","member_number":"A132156","first_name":"NICK","last_name":"RAY","classification":"U","division":"OPEN","hit_factor":4.1228},{"match_name":"Prescott Action Shooters 1st Saturday USPSA 08-07-21","match_date":"2021-08-07","stage_classifiercode":"03-07","member_number":"L4302","first_name":"JOHN","last_name":"VILLARINO","classification":"C","division":"OPEN","hit_factor":4.1222},{"match_name":"Medford USPSA July 2021 Match","match_date":"2021-07-18","stage_classifiercode":"03-07","member_number":"L4326","first_name":"DAN","last_name":"MCDONNELL","classification":"C","division":"OPEN","hit_factor":4.1219},{"match_name":"Extreme GM USPSA 5-8","match_date":"2021-05-05","stage_classifiercode":"03-07","member_number":"A115455","first_name":"DEXTER","last_name":"CRUZ","classification":"C","division":"OPEN","hit_factor":4.1204},{"match_name":"Cactus USPSA April 2021","match_date":"2021-04-04","stage_classifiercode":"03-07","member_number":"A107072","first_name":"KIM","last_name":"PEDERSON","classification":"U","division":"OPEN","hit_factor":4.1163},{"match_name":"RPGi USPSA Last Minute Match! 18 July 2021","match_date":"2021-07-18","stage_classifiercode":"03-07","member_number":"A124470","first_name":"AKADIAN","last_name":"CAMPBELL","classification":"U","division":"OPEN","hit_factor":4.1156},{"match_name":"PMSC May 2017","match_date":"2017-05-07","stage_classifiercode":"03-07","member_number":"ty84298","first_name":"JUSTIN","last_name":"MILLER","classification":"C","division":"OPEN","hit_factor":4.1143},{"match_name":"October 2015 CAS Match","match_date":"2015-10-04","stage_classifiercode":"03-07","member_number":"A91659","first_name":"PETER","last_name":"KEOLA","classification":"U","division":"OPEN","hit_factor":4.1122},{"match_name":"MCAS USPSA October 2016","match_date":"2016-10-15","stage_classifiercode":"03-07","member_number":"TY49680","first_name":"JEN","last_name":"ADAMS","classification":"B","division":"OPEN","hit_factor":4.1096},{"match_name":"Briar  Rabbit July Match 2016 OH20","match_date":"2016-07-24","stage_classifiercode":"03-07","member_number":"A50721","first_name":"NIK","last_name":"REPASKY","classification":"B","division":"OPEN","hit_factor":4.1083},{"match_name":"OREGON ARPC CC05 USPSA Feb 11 2017","match_date":"2017-02-11","stage_classifiercode":"03-07","member_number":"A-4993","first_name":"BUTCH","last_name":"MASSONI","classification":"M","division":"OPEN","hit_factor":4.1002},{"match_name":"Space Coast Practical Shooters","match_date":"2017-04-01","stage_classifiercode":"03-07","member_number":"a62670","first_name":"DARREN","last_name":"SCHNEIDER","classification":"B","division":"OPEN","hit_factor":4.0936},{"match_name":"Space Coast Practical Shooters","match_date":"2017-04-01","stage_classifiercode":"03-07","member_number":"A62670","first_name":"DARREN","last_name":"SCHENIDER","classification":"B","division":"OPEN","hit_factor":4.0936},{"match_name":"FVPS September USPSA Match","match_date":"2016-09-03","stage_classifiercode":"03-07","member_number":"A68824","first_name":"KELSEY","last_name":"SCHAEFER","classification":"B","division":"OPEN","hit_factor":4.0907},{"match_name":"RCPS USPSA April 21","match_date":"2018-04-21","stage_classifiercode":"03-07","member_number":"TY37473","first_name":"RAFAEL","last_name":"HINLO","classification":"B","division":"OPEN","hit_factor":4.0867},{"match_name":"NRG Saturday December 22nd - Includes a Classifier Stage","match_date":"2018-12-22","stage_classifiercode":"03-07","member_number":"A87556","first_name":"ROB","last_name":"CHOI","classification":"M","division":"OPEN","hit_factor":4.0805},{"match_name":"NHRPC - October 2020 USPSA","match_date":"2020-10-10","stage_classifiercode":"03-07","member_number":"A113919","first_name":"JEFF","last_name":"WILLI","classification":"C","division":"OPEN","hit_factor":4.0712},{"match_name":"PTPC May 2nd USPSA Match","match_date":"2021-05-02","stage_classifiercode":"03-07","member_number":"FY84558","first_name":"CEDRIC","last_name":"CANDO","classification":"B","division":"OPEN","hit_factor":4.0708},{"match_name":"GCL Wed 5-3-17","match_date":"2017-05-03","stage_classifiercode":"03-07","member_number":"TY31997","first_name":"JEFF","last_name":"CURTS","classification":"A","division":"OPEN","hit_factor":4.058},{"match_name":"OREGON ARPC CC05 USPSA Feb 11 2017","match_date":"2017-02-11","stage_classifiercode":"03-07","member_number":"TY80327","first_name":"DAVE","last_name":"LUND","classification":"B","division":"OPEN","hit_factor":4.0547},{"match_name":"Ontelaunee USPSA April 2017","match_date":"2017-04-22","stage_classifiercode":"03-07","member_number":"FY45990","first_name":"JOHN","last_name":"MARCAIDA","classification":"M","division":"OPEN","hit_factor":4.0541},{"match_name":"North East Ohio Shooters - OH19 - 2016-08-13","match_date":"2016-08-13","stage_classifiercode":"03-07","member_number":"A93980","first_name":"KEN","last_name":"LALIBERTE","classification":"U","division":"OPEN","hit_factor":4.0468},{"match_name":"Ontelaunee USPSA April 2017","match_date":"2017-04-22","stage_classifiercode":"03-07","member_number":"L3851","first_name":"JEFF","last_name":"PAULSEN","classification":"B","division":"OPEN","hit_factor":4.0441},{"match_name":"LA05 Tangi September 2nd USPSA Match 2017","match_date":"2017-09-24","stage_classifiercode":"03-07","member_number":"FY31112","first_name":"WINSTON","last_name":"FREEMAN","classification":"C","division":"OPEN","hit_factor":4.0369},{"match_name":"LTD Pistol - October 2017","match_date":"2017-10-07","stage_classifiercode":"03-07","member_number":"TY78631","first_name":"KENNETH","last_name":"WRIGHT","classification":"C","division":"OPEN","hit_factor":4.0313},{"match_name":"XMG USPSA   Saturday November 6th 2021","match_date":"2021-11-06","stage_classifiercode":"03-07","member_number":"A136760","first_name":"MARK","last_name":"CRONE","classification":"U","division":"OPEN","hit_factor":4.0298},{"match_name":"Space Coast Practical Shooters","match_date":"2017-04-01","stage_classifiercode":"03-07","member_number":"A60684","first_name":"SEBASTIAN","last_name":"FORBIS","classification":"C","division":"OPEN","hit_factor":4.0284},{"match_name":"Richmond Boro Gun Club February 2018 USPSA Pistol Match","match_date":"2018-02-03","stage_classifiercode":"03-07","member_number":"TY92927","first_name":"ANTHONY","last_name":"MAINOLFI","classification":"B","division":"OPEN","hit_factor":4.026},{"match_name":"Mapsa 2017 O8 12","match_date":"2017-08-11","stage_classifiercode":"03-07","member_number":"FY53872","first_name":"JON","last_name":"MCCARTY","classification":"B","division":"OPEN","hit_factor":4.023},{"match_name":"HPSP Heartland Practical Shooters June USPSA Shoot","match_date":"2018-06-24","stage_classifiercode":"03-07","member_number":"A102287","first_name":"DUSTIN","last_name":"BAILEY","classification":"C","division":"OPEN","hit_factor":4.0167},{"match_name":"KIdlat September Club Match","match_date":"2018-09-01","stage_classifiercode":"03-07","member_number":"FY63040","first_name":"HENRY","last_name":"MORENO","classification":"B","division":"OPEN","hit_factor":4.0163},{"match_name":"PMRPC USPSA  10Apr21","match_date":"2021-04-10","stage_classifiercode":"03-07","member_number":"A84876","first_name":"BENJIE","last_name":"VILLARRUZ","classification":"A","division":"OPEN","hit_factor":4.0159},{"match_name":"Caja del Rio - March 2016","match_date":"2016-03-19","stage_classifiercode":"03-07","member_number":"L3091","first_name":"CHRISTOPHER","last_name":"LAMBERT","classification":"B","division":"OPEN","hit_factor":4.0158},{"match_name":"BSC Brooklyn Classifier Match Oct 17","match_date":"2021-10-17","stage_classifiercode":"03-07","member_number":"A102493","first_name":"WES","last_name":"MCUMBER","classification":"C","division":"OPEN","hit_factor":4.0155},{"match_name":"KIdlat September Club Match","match_date":"2018-09-01","stage_classifiercode":"03-07","member_number":"TY98162","first_name":"DUANE","last_name":"MENDOZA","classification":"C","division":"OPEN","hit_factor":4.0123},{"match_name":"LdF 2nd Saturday USPSA Match","match_date":"2016-12-10","stage_classifiercode":"03-07","member_number":"A74054","first_name":"EMIL","last_name":"DABU","classification":"A","division":"OPEN","hit_factor":4.0102},{"match_name":"SLOSA March 2018 USPSA MATCH","match_date":"2018-03-10","stage_classifiercode":"03-07","member_number":"A98039","first_name":"MIKE","last_name":"VIGGIANELLI","classification":"B","division":"OPEN","hit_factor":4.0065},{"match_name":"Springfield Tactical Shooters 08/02/2018","match_date":"2018-08-02","stage_classifiercode":"03-07","member_number":"L1467","first_name":"CHARLES","last_name":"MORSE","classification":"B","division":"OPEN","hit_factor":4.0041},{"match_name":"Schultz October 2015","match_date":"2015-10-11","stage_classifiercode":"03-07","member_number":"TY68299","first_name":"ANDY","last_name":"CHOMOR","classification":"U","division":"OPEN","hit_factor":4},{"match_name":"NRG September 24th 2016","match_date":"2016-09-24","stage_classifiercode":"03-07","member_number":"\"\"","first_name":"KURT","last_name":"WAGNER","classification":"X","division":"OPEN","hit_factor":4},{"match_name":"GoShoot Outdoors April 19th reshoot","match_date":"2020-04-19","stage_classifiercode":"03-07","member_number":"A90953","first_name":"DAVID","last_name":"CLAY","classification":"A","division":"OPEN","hit_factor":3.9984},{"match_name":"Pioneer Action Shooters Aug 2017 Match","match_date":"2017-08-13","stage_classifiercode":"03-07","member_number":"\"\"","first_name":"BRENDEN","last_name":"LAU","classification":"U","division":"OPEN","hit_factor":3.9964},{"match_name":"WTPS USPSA November 13th","match_date":"2021-11-13","stage_classifiercode":"03-07","member_number":"Ty57870","first_name":"GREG","last_name":"PRIVETT","classification":"C","division":"OPEN","hit_factor":3.9942},{"match_name":"NPCCC 09-02-2018 USPSA","match_date":"2018-09-02","stage_classifiercode":"03-07","member_number":"A71723","first_name":"JERRY","last_name":"SOLOMON","classification":"C","division":"OPEN","hit_factor":3.9879},{"match_name":"GCL Wed 5-3-17","match_date":"2017-05-03","stage_classifiercode":"03-07","member_number":"A58687","first_name":"ROBERT","last_name":"HILFIKER","classification":"A","division":"OPEN","hit_factor":3.9871},{"match_name":"January Match","match_date":"2017-01-22","stage_classifiercode":"03-07","member_number":"A84245","first_name":"BRYAN","last_name":"HOOVER","classification":"C","division":"OPEN","hit_factor":3.9834},{"match_name":"DSSA 2021-05 USPSA Pistol","match_date":"2021-05-15","stage_classifiercode":"03-07","member_number":"A66934","first_name":"ELIZABETH","last_name":"YOUNG","classification":"C","division":"OPEN","hit_factor":3.9831},{"match_name":"TPS USPSA PISTOL - July 2016 - Talon Range Clone Clone","match_date":"2016-07-02","stage_classifiercode":"03-07","member_number":"L2734","first_name":"DON","last_name":"GIBSON","classification":"U","division":"OPEN","hit_factor":3.9829},{"match_name":"Springfield Tactical Shooters 08/02/2018","match_date":"2018-08-02","stage_classifiercode":"03-07","member_number":"A95946","first_name":"PAUL","last_name":"EMERY","classification":"C","division":"OPEN","hit_factor":3.9828},{"match_name":"Extreme GM USPSA 5-8","match_date":"2021-05-05","stage_classifiercode":"03-07","member_number":"A109427","first_name":"GREGG","last_name":"BAJAMUNDE","classification":"D","division":"OPEN","hit_factor":3.9818},{"match_name":"NWGC USPSA 6","match_date":"2020-07-05","stage_classifiercode":"03-07","member_number":"A104113","first_name":"TUCKER","last_name":"KIEHN","classification":"C","division":"OPEN","hit_factor":3.9781},{"match_name":"Lefthanders Gun Club Practical Shooters October 1 and 2","match_date":"2016-10-01","stage_classifiercode":"03-07","member_number":"TY72670","first_name":"DALE","last_name":"HARDING","classification":"U","division":"OPEN","hit_factor":3.9778},{"match_name":"Space Coast Practical Shooters","match_date":"2017-04-01","stage_classifiercode":"03-07","member_number":"A20966","first_name":"JACK","last_name":"LASKY","classification":"B","division":"OPEN","hit_factor":3.9732},{"match_name":"MVPSA USPSA Match November 6th 2021","match_date":"2021-11-06","stage_classifiercode":"03-07","member_number":"FY129778","first_name":"EMILY","last_name":"HUGHSTON","classification":"C","division":"OPEN","hit_factor":3.9732},{"match_name":"GCL May 6-2017","match_date":"2017-05-06","stage_classifiercode":"03-07","member_number":"A35723","first_name":"DAVE","last_name":"HAVASI","classification":"B","division":"OPEN","hit_factor":3.9725},{"match_name":"NRG September 24th 2016","match_date":"2016-09-24","stage_classifiercode":"03-07","member_number":"A8944","first_name":"FLOREJANE","last_name":"CONDE","classification":"U","division":"OPEN","hit_factor":3.969},{"match_name":"NRG Saturday November 13th Includes a Classifier Stage","match_date":"2021-11-13","stage_classifiercode":"03-07","member_number":"A130565","first_name":"JOSHUA","last_name":"PE","classification":"U","division":"OPEN","hit_factor":3.9683},{"match_name":"Renton USPSA - April 2021 - NW05","match_date":"2021-04-25","stage_classifiercode":"03-07","member_number":"A85321","first_name":"DEAN","last_name":"CLARK","classification":"C","division":"OPEN","hit_factor":3.9667},{"match_name":"WTPS USPSA November 13th","match_date":"2021-11-13","stage_classifiercode":"03-07","member_number":"L4808","first_name":"JORDAN","last_name":"GREGG","classification":"A","division":"OPEN","hit_factor":3.9655},{"match_name":"KIdlat September Club Match","match_date":"2018-09-01","stage_classifiercode":"03-07","member_number":"A74721","first_name":"ALBERT","last_name":"CALDERON","classification":"B","division":"OPEN","hit_factor":3.9595},{"match_name":"Colonial Rifle and Pistol Club May 2021","match_date":"2021-05-01","stage_classifiercode":"03-07","member_number":"L3570","first_name":"KEVIN","last_name":"DRISCOLL","classification":"C","division":"OPEN","hit_factor":3.9589},{"match_name":"RCPS USPSA April 21","match_date":"2018-04-21","stage_classifiercode":"03-07","member_number":"A96308","first_name":"JOHN","last_name":"GOMEZ","classification":"A","division":"OPEN","hit_factor":3.9578},{"match_name":"TTS   12DEC2020","match_date":"2020-12-12","stage_classifiercode":"03-07","member_number":"A46313","first_name":"RICHARD","last_name":"ELMS","classification":"U","division":"OPEN","hit_factor":3.9568},{"match_name":"Oxford OHS05 100321","match_date":"2021-10-03","stage_classifiercode":"03-07","member_number":"A118246","first_name":"MATTHEW","last_name":"TURNER","classification":"B","division":"OPEN","hit_factor":3.9532},{"match_name":"GCL May 6-2017","match_date":"2017-05-06","stage_classifiercode":"03-07","member_number":"A78149","first_name":"ELI","last_name":"SABER","classification":"B","division":"OPEN","hit_factor":3.9526},{"match_name":"Richmond Hot Shots August 4th-5th USPSA Pistol Match","match_date":"2018-08-04","stage_classifiercode":"03-07","member_number":"A85957","first_name":"TRISTAN","last_name":"TOLENTINO","classification":"B","division":"OPEN","hit_factor":3.9514},{"match_name":"North East Ohio Shooters - OH19 - 2016-08-13","match_date":"2016-08-13","stage_classifiercode":"03-07","member_number":"TY91700","first_name":"JEFF","last_name":"MORSE","classification":"C","division":"OPEN","hit_factor":3.9507},{"match_name":"Minot USPSA 2-18-18","match_date":"2018-02-18","stage_classifiercode":"03-07","member_number":"A103957","first_name":"TAYLOR","last_name":"BURACZEWSKI","classification":"U","division":"OPEN","hit_factor":3.9488},{"match_name":"Bayou City USPSA Weekly Mar 25","match_date":"2021-03-25","stage_classifiercode":"03-07","member_number":"A118214","first_name":"ROBERT","last_name":"GATEWOOD","classification":"U","division":"OPEN","hit_factor":3.9487},{"match_name":"Dundee Practical Shooters - June 27 2020 - Points for Pistol","match_date":"2020-06-27","stage_classifiercode":"03-07","member_number":"L4735","first_name":"GEOFFREY","last_name":"PESTES","classification":"B","division":"OPEN","hit_factor":3.9482},{"match_name":"LTD Pistol - October 2017","match_date":"2017-10-07","stage_classifiercode":"03-07","member_number":"A77994","first_name":"TOM","last_name":"DAVIS","classification":"U","division":"OPEN","hit_factor":3.9481},{"match_name":"NRG Saturday November 13th Includes a Classifier Stage","match_date":"2021-11-13","stage_classifiercode":"03-07","member_number":"TY117540","first_name":"VIVIAN","last_name":"HOGAN","classification":"B","division":"OPEN","hit_factor":3.9415},{"match_name":"Dundee Practical Shooters - June 27 2020 - Points for Pistol","match_date":"2020-06-27","stage_classifiercode":"03-07","member_number":"TY80327","first_name":"DAVE","last_name":"LUND","classification":"A","division":"OPEN","hit_factor":3.9389},{"match_name":"JCSSA NOV3 2018","match_date":"2018-11-03","stage_classifiercode":"03-07","member_number":"L2282","first_name":"MICHAEL","last_name":"CLARK","classification":"C","division":"OPEN","hit_factor":3.9317},{"match_name":"USPSA","match_date":"2016-12-10","stage_classifiercode":"03-07","member_number":"L2206","first_name":"SCOTT","last_name":"GRAVES","classification":"A","division":"OPEN","hit_factor":3.9281},{"match_name":"Richmond Classifier Match January 24-2016","match_date":"2016-01-24","stage_classifiercode":"03-07","member_number":"A64949","first_name":"HIROSHI","last_name":"TAKAMA","classification":"C","division":"OPEN","hit_factor":3.9234},{"match_name":"Cactus USPSA April 2021","match_date":"2021-04-04","stage_classifiercode":"03-07","member_number":"a88747","first_name":"GEORGE","last_name":"VESELY","classification":"B","division":"OPEN","hit_factor":3.9224},{"match_name":"OFGC USPSA Match 7/15/2018","match_date":"2018-07-15","stage_classifiercode":"03-07","member_number":"TY34745","first_name":"KEITH","last_name":"HAMMOND","classification":"B","division":"OPEN","hit_factor":3.9153},{"match_name":"June NCPL  Match","match_date":"2018-06-24","stage_classifiercode":"03-07","member_number":"TY96822","first_name":"CRAIG","last_name":"CASEY","classification":"U","division":"OPEN","hit_factor":3.9137},{"match_name":"SFPS 8-23-20 USPSA","match_date":"2020-08-23","stage_classifiercode":"03-07","member_number":"TY87041","first_name":"DIRK","last_name":"DEIGHTON","classification":"C","division":"OPEN","hit_factor":3.9134},{"match_name":"NHRPC - October 2020 USPSA","match_date":"2020-10-10","stage_classifiercode":"03-07","member_number":"TY117640","first_name":"CARL","last_name":"ANDERSON JR","classification":"C","division":"OPEN","hit_factor":3.9097},{"match_name":"Richmond Classifier Match January 24-2016","match_date":"2016-01-24","stage_classifiercode":"03-07","member_number":"A90077","first_name":"DOUG","last_name":"TELLEF","classification":"U","division":"OPEN","hit_factor":3.8967},{"match_name":"PCSI - July 2017 USPSA","match_date":"2017-07-01","stage_classifiercode":"03-07","member_number":"TY65697","first_name":"SCOT","last_name":"HARDESTY","classification":"C","division":"OPEN","hit_factor":3.8961},{"match_name":"Dundee Practical Shooters - June 27 2020 - Points for Pistol","match_date":"2020-06-27","stage_classifiercode":"03-07","member_number":"TY58134","first_name":"DANIEL","last_name":"CARPENTER","classification":"A","division":"OPEN","hit_factor":3.8961},{"match_name":"ECPS USPSA 20 Aug 16","match_date":"2016-08-20","stage_classifiercode":"03-07","member_number":"a34304","first_name":"DON","last_name":"DUBOSE","classification":"M","division":"OPEN","hit_factor":3.8944},{"match_name":"OFGC USPSA Match 8-15-21","match_date":"2021-08-15","stage_classifiercode":"03-07","member_number":"A79715","first_name":"MICHAEL","last_name":"NELSON","classification":"B","division":"OPEN","hit_factor":3.8938},{"match_name":"G2G Practical Shooters 06-16-2020","match_date":"2020-06-16","stage_classifiercode":"03-07","member_number":"FY103687","first_name":"STEVE","last_name":"KEMPE","classification":"C","division":"OPEN","hit_factor":3.8907},{"match_name":"Space Coast Practical Shooters","match_date":"2017-04-01","stage_classifiercode":"03-07","member_number":"A20966","first_name":"JACK","last_name":"LASKY","classification":"B","division":"OPEN","hit_factor":3.8896},{"match_name":"NPCCC 09-02-2018 USPSA","match_date":"2018-09-02","stage_classifiercode":"03-07","member_number":"\"\"","first_name":"JOE","last_name":"BRUSCEMI","classification":"U","division":"OPEN","hit_factor":3.8886},{"match_name":"NHRPC - October 2020 USPSA","match_date":"2020-10-10","stage_classifiercode":"03-07","member_number":"Ty106397","first_name":"BRIAN","last_name":"VEISZ","classification":"A","division":"OPEN","hit_factor":3.8871},{"match_name":"SCAPSA MN05 Spring League 3","match_date":"2017-04-24","stage_classifiercode":"03-07","member_number":"FY53872","first_name":"JON","last_name":"MCCARTY","classification":"B","division":"OPEN","hit_factor":3.8854},{"match_name":"OREGON ARPC CC05 USPSA Feb 11 2017","match_date":"2017-02-11","stage_classifiercode":"03-07","member_number":"ty45897","first_name":"LAWRENCE","last_name":"MULL","classification":"C","division":"OPEN","hit_factor":3.88},{"match_name":"Rio Grande Practical Shooters - September 2016","match_date":"2016-09-03","stage_classifiercode":"03-07","member_number":"A4820","first_name":"JAMES","last_name":"LAMBERT","classification":"A","division":"OPEN","hit_factor":3.8769},{"match_name":"Caja del Rio - March 2016","match_date":"2016-03-19","stage_classifiercode":"03-07","member_number":"A6063","first_name":"NANCI","last_name":"LAMBERT","classification":"B","division":"OPEN","hit_factor":3.8756},{"match_name":"YRPA USPSA Classifier match January 2018 (resubmission)","match_date":"2018-01-28","stage_classifiercode":"03-07","member_number":"TY88365","first_name":"DON","last_name":"AMAN","classification":"U","division":"OPEN","hit_factor":3.8747},{"match_name":"Dundee Practical Shooters - June 27 2020 - Points for Pistol","match_date":"2020-06-27","stage_classifiercode":"03-07","member_number":"A89438","first_name":"NICHOLAS","last_name":"STOCKWELL","classification":"G","division":"OPEN","hit_factor":3.8706},{"match_name":"KIdlat September Club Match","match_date":"2018-09-01","stage_classifiercode":"03-07","member_number":"A106236","first_name":"POCHOLO","last_name":"DIMAYUGA","classification":"U","division":"OPEN","hit_factor":3.8678},{"match_name":"DAPS USPSA at ETTS 4-9-2016","match_date":"2016-04-09","stage_classifiercode":"03-07","member_number":"TY64983","first_name":"NEIL","last_name":"ERASMUS","classification":"B","division":"OPEN","hit_factor":3.8672},{"match_name":"MCAS USPSA October 2016","match_date":"2016-10-15","stage_classifiercode":"03-07","member_number":"PEN","first_name":"ROGER","last_name":"HARDING","classification":"U","division":"OPEN","hit_factor":3.8671},{"match_name":"SAPSC Monthly USPSA Classifier Match 20160913","match_date":"2016-09-13","stage_classifiercode":"03-07","member_number":"TY83004","first_name":"CASEY","last_name":"THERIOT","classification":"U","division":"OPEN","hit_factor":3.8573},{"match_name":"Medford USPSA June 2016 Match","match_date":"2016-06-19","stage_classifiercode":"03-07","member_number":"TY49839","first_name":"CATHY","last_name":"HILL","classification":"C","division":"OPEN","hit_factor":3.8526},{"match_name":"NRG Saturday December 22nd - Includes a Classifier Stage","match_date":"2018-12-22","stage_classifiercode":"03-07","member_number":"L4121","first_name":"NAN","last_name":"WANG","classification":"B","division":"OPEN","hit_factor":3.8479},{"match_name":"OFGC USPSA Match 8-15-21","match_date":"2021-08-15","stage_classifiercode":"03-07","member_number":"TY92125","first_name":"MELISSA","last_name":"NOBLE","classification":"C","division":"OPEN","hit_factor":3.8477},{"match_name":"MCAS USPSA October 2016","match_date":"2016-10-15","stage_classifiercode":"03-07","member_number":"TY78129","first_name":"SHARON","last_name":"ELIASSON","classification":"D","division":"OPEN","hit_factor":3.8445},{"match_name":"BRSP Tuesday Night USPSA Match - July 31","match_date":"2018-07-31","stage_classifiercode":"03-07","member_number":"A104411","first_name":"TANK","last_name":"ALBANIL","classification":"U","division":"OPEN","hit_factor":3.8445},{"match_name":"PMSC May 2017","match_date":"2017-05-07","stage_classifiercode":"03-07","member_number":"a82941","first_name":"DARREN","last_name":"HEROLD","classification":"B","division":"OPEN","hit_factor":3.8442},{"match_name":"PGC May 2021 USPSA ","match_date":"2021-04-30","stage_classifiercode":"03-07","member_number":"A80406","first_name":"LINDA","last_name":"DISCHE","classification":"C","division":"OPEN","hit_factor":3.8397},{"match_name":"PCSI - July 2017 USPSA","match_date":"2017-07-01","stage_classifiercode":"03-07","member_number":"A50721","first_name":"NICK","last_name":"REPASKY","classification":"C","division":"OPEN","hit_factor":3.8279},{"match_name":"March 13 2021 The Range At True North USPSA Match","match_date":"2021-03-13","stage_classifiercode":"03-07","member_number":"L729","first_name":"ROBERT","last_name":"WALKER","classification":"A","division":"OPEN","hit_factor":3.8272},{"match_name":"Castlewood USPSA August 2020 shoot","match_date":"2020-08-22","stage_classifiercode":"03-07","member_number":"Fy39111","first_name":"OLIE","last_name":"ERICKSEN","classification":"B","division":"OPEN","hit_factor":3.8271},{"match_name":"LGCSEMPS AUGUST 2020 HANDGUN","match_date":"2020-08-08","stage_classifiercode":"03-07","member_number":"A116994","first_name":"LEVI","last_name":"GRAVES","classification":"U","division":"OPEN","hit_factor":3.8255},{"match_name":"WTPS USPSA March Classifier 3-10-18","match_date":"2018-03-10","stage_classifiercode":"03-07","member_number":"A75176","first_name":"TEAK-ALLEN","last_name":"BARRY","classification":"U","division":"OPEN","hit_factor":3.8191},{"match_name":"Maine Practical Shooters November 2020","match_date":"2020-11-01","stage_classifiercode":"03-07","member_number":"TY85228","first_name":"BILL","last_name":"LAFRENIERE","classification":"U","division":"OPEN","hit_factor":3.8175},{"match_name":"RSPP 3rd Saturday April 2016","match_date":"2016-04-16","stage_classifiercode":"03-07","member_number":"TY86487","first_name":"JOHN","last_name":"KILLE","classification":"C","division":"OPEN","hit_factor":3.8168},{"match_name":"HLSL 12-09-2018","match_date":"2018-12-09","stage_classifiercode":"03-07","member_number":"FY85757","first_name":"EDGAR","last_name":"VICENTE","classification":"C","division":"OPEN","hit_factor":3.8141},{"match_name":"TPS USPSA AT CMP MARCH 20 2021","match_date":"2021-03-20","stage_classifiercode":"03-07","member_number":"A105033","first_name":"CAMERON","last_name":"TANNER","classification":"A","division":"OPEN","hit_factor":3.8107},{"match_name":"LdF USPSA Match January 13 2018","match_date":"2018-01-13","stage_classifiercode":"03-07","member_number":"A74054","first_name":"EMIL","last_name":"DABU","classification":"A","division":"OPEN","hit_factor":3.8082},{"match_name":"USPSA","match_date":"2016-12-10","stage_classifiercode":"03-07","member_number":"a55330","first_name":"DOUGLAS","last_name":"STOVER","classification":"C","division":"OPEN","hit_factor":3.8069},{"match_name":"Red River Range USPSA 31 March","match_date":"2021-03-31","stage_classifiercode":"03-07","member_number":"A126682","first_name":"BRANDON","last_name":"BRUCE","classification":"U","division":"OPEN","hit_factor":3.799},{"match_name":"OREGON ARPC CC05 USPSA Feb 11 2017","match_date":"2017-02-11","stage_classifiercode":"03-07","member_number":"TY80149","first_name":"JIM","last_name":"BOONE","classification":"C","division":"OPEN","hit_factor":3.7898},{"match_name":"NPCCC 07-02-2017 USPSA","match_date":"2017-07-02","stage_classifiercode":"03-07","member_number":"TY51788","first_name":"JOHN","last_name":"ORNELAS","classification":"B","division":"OPEN","hit_factor":3.7882},{"match_name":"CGC 2016-05-14","match_date":"2016-05-14","stage_classifiercode":"03-07","member_number":"A70169","first_name":"AVERY","last_name":"BISHOP","classification":"A","division":"OPEN","hit_factor":3.7865},{"match_name":"MCPSL Pistol 3-12-16","match_date":"2016-03-12","stage_classifiercode":"03-07","member_number":"TY78821","first_name":"STEVE","last_name":"GIRARD","classification":"C","division":"OPEN","hit_factor":3.7856},{"match_name":"PCWC USPSA  5 27 2017","match_date":"2017-05-27","stage_classifiercode":"03-07","member_number":"A12209","first_name":"RICHARD","last_name":"MOSER","classification":"A","division":"OPEN","hit_factor":3.7853},{"match_name":"NHRPC - October 2020 USPSA","match_date":"2020-10-10","stage_classifiercode":"03-07","member_number":"A96961","first_name":"STEPHEN","last_name":"THOMER","classification":"C","division":"OPEN","hit_factor":3.7827},{"match_name":"NW05 Renton USPSA April 2016","match_date":"2016-04-24","stage_classifiercode":"03-07","member_number":"A90654","first_name":"RONALD","last_name":"TOLENTINO","classification":"U","division":"OPEN","hit_factor":3.7773},{"match_name":"Sage Pistol League USPSA  August 15 2021","match_date":"2021-08-15","stage_classifiercode":"03-07","member_number":"TY 30717","first_name":"GARY","last_name":"TILLEY","classification":"M","division":"OPEN","hit_factor":3.7767},{"match_name":"Cactus USPSA April 2021","match_date":"2021-04-04","stage_classifiercode":"03-07","member_number":"A100726","first_name":"DOMINIC","last_name":"NAPOLITANO","classification":"B","division":"OPEN","hit_factor":3.7766},{"match_name":"PMSC May 2017","match_date":"2017-05-07","stage_classifiercode":"03-07","member_number":"FY72047","first_name":"GREG","last_name":"ZOMBEK","classification":"B","division":"OPEN","hit_factor":3.7752},{"match_name":"CAPS Club July 24 USPSA","match_date":"2021-07-24","stage_classifiercode":"03-07","member_number":"A12134","first_name":"PAUL","last_name":"PAYNE","classification":"C","division":"OPEN","hit_factor":3.7704},{"match_name":"2017 Hawktech Arms Idaho Section Hi-cap Match","match_date":"2017-10-21","stage_classifiercode":"03-07","member_number":"A99310","first_name":"JIM","last_name":"HICKS","classification":"C","division":"OPEN","hit_factor":3.7704},{"match_name":"Ontelaunee USPSA September 2015","match_date":"2015-09-27","stage_classifiercode":"03-07","member_number":"A86765","first_name":"DON","last_name":"STOUT JR","classification":"B","division":"OPEN","hit_factor":3.7703},{"match_name":"Medford USPSA June 2016 Match","match_date":"2016-06-19","stage_classifiercode":"03-07","member_number":"A85507","first_name":"JONATHAN H","last_name":"PURTZER","classification":"B","division":"OPEN","hit_factor":3.769},{"match_name":"NCPS USPSA Handgun Match August 28 2016","match_date":"2016-08-28","stage_classifiercode":"03-07","member_number":"TY47011","first_name":"RANDY","last_name":"ASKINS","classification":"D","division":"OPEN","hit_factor":3.7673},{"match_name":"G2G July 27th USPSA Match","match_date":"2021-07-27","stage_classifiercode":"03-07","member_number":"A104602","first_name":"WILLIAM","last_name":"STOWE","classification":"B","division":"OPEN","hit_factor":3.7627},{"match_name":"NW05 Renton USPSA April 2016","match_date":"2016-04-24","stage_classifiercode":"03-07","member_number":"PEN","first_name":"CHRIS","last_name":"AULD","classification":"U","division":"OPEN","hit_factor":3.7626},{"match_name":"Richmond Hot Shots August 4th-5th USPSA Pistol Match","match_date":"2018-08-04","stage_classifiercode":"03-07","member_number":"10241","first_name":"BRYAN","last_name":"LARSON","classification":"A","division":"OPEN","hit_factor":3.7611},{"match_name":"CRAG USPSA 6-13-2020","match_date":"2020-06-13","stage_classifiercode":"03-07","member_number":"A125844","first_name":"TAD","last_name":"FARMER","classification":"U","division":"OPEN","hit_factor":3.7603},{"match_name":"October 2015 CAS Match","match_date":"2015-10-04","stage_classifiercode":"03-07","member_number":"A76149","first_name":"DARREN","last_name":"CHAMBERS","classification":"C","division":"OPEN","hit_factor":3.7568},{"match_name":"DRRC USPSA Mar2018","match_date":"2018-03-03","stage_classifiercode":"03-07","member_number":"TY81959","first_name":"BILL","last_name":"RYAN","classification":"C","division":"OPEN","hit_factor":3.7555},{"match_name":"OFGC USPSA Match 8-15-21","match_date":"2021-08-15","stage_classifiercode":"03-07","member_number":"A92526","first_name":"BREANNA","last_name":"GARVEY","classification":"C","division":"OPEN","hit_factor":3.7555},{"match_name":"NHRPC - October 2020 USPSA","match_date":"2020-10-10","stage_classifiercode":"03-07","member_number":"A103523","first_name":"RAY","last_name":"SWANK","classification":"C","division":"OPEN","hit_factor":3.7546},{"match_name":"CAPS 9-23-2017","match_date":"2017-09-23","stage_classifiercode":"03-07","member_number":"L3586","first_name":"KENT","last_name":"WAYMENT","classification":"B","division":"OPEN","hit_factor":3.7519},{"match_name":"LdF USPSA Match January 13 2018","match_date":"2018-01-13","stage_classifiercode":"03-07","member_number":"TY99082","first_name":"LUKE","last_name":"WANG","classification":"C","division":"OPEN","hit_factor":3.7494},{"match_name":"BPSA September 2016 USPSA","match_date":"2016-09-25","stage_classifiercode":"03-07","member_number":"A88941","first_name":"JASON","last_name":"SMITH","classification":"C","division":"OPEN","hit_factor":3.7474},{"match_name":"NRG Saturday December 22nd - Includes a Classifier Stage","match_date":"2018-12-22","stage_classifiercode":"03-07","member_number":"\"\"","first_name":"RICHARD","last_name":"HANDARMO","classification":"U","division":"OPEN","hit_factor":3.7408},{"match_name":"RSPP 3rd Saturday April 2016","match_date":"2016-04-16","stage_classifiercode":"03-07","member_number":"CL67","first_name":"ROGER","last_name":"F","classification":"M","division":"OPEN","hit_factor":3.7406},{"match_name":"Caja del Rio - March 2016","match_date":"2016-03-19","stage_classifiercode":"03-07","member_number":"A4820","first_name":"JAMES","last_name":"LAMBERT","classification":"A","division":"OPEN","hit_factor":3.7362},{"match_name":"SPSA USPSA December 4th Sat match","match_date":"2017-12-23","stage_classifiercode":"03-07","member_number":"A105091","first_name":"MATT","last_name":"GINN","classification":"U","division":"OPEN","hit_factor":3.732},{"match_name":"CCPS 20170625","match_date":"2017-06-25","stage_classifiercode":"03-07","member_number":"TY69978","first_name":"DOMINIC","last_name":"KOH","classification":"M","division":"OPEN","hit_factor":3.7313},{"match_name":"MCPSL Pistol 3-12-16","match_date":"2016-03-12","stage_classifiercode":"03-07","member_number":"L1810","first_name":"DAVID","last_name":"FERRAN","classification":"B","division":"OPEN","hit_factor":3.7302},{"match_name":"JPPS Club Match 9-5-2020","match_date":"2020-09-05","stage_classifiercode":"03-07","member_number":"Ty37118","first_name":"WILLIAM","last_name":"SIGLER","classification":"M","division":"OPEN","hit_factor":3.7224},{"match_name":"Ontelaunee USPSA September 2015","match_date":"2015-09-27","stage_classifiercode":"03-07","member_number":"TY13104","first_name":"GARY","last_name":"VENEROSO","classification":"C","division":"OPEN","hit_factor":3.722},{"match_name":"KIdlat September Club Match","match_date":"2018-09-01","stage_classifiercode":"03-07","member_number":"A14869","first_name":"EDDIE","last_name":"JIMENEA","classification":"M","division":"OPEN","hit_factor":3.7212},{"match_name":"PMRPC USPSA  10Apr21","match_date":"2021-04-10","stage_classifiercode":"03-07","member_number":"TY46304","first_name":"JAMES","last_name":"SALINGER","classification":"B","division":"OPEN","hit_factor":3.72},{"match_name":"CAPS 9-23-2017","match_date":"2017-09-23","stage_classifiercode":"03-07","member_number":"L3601","first_name":"BRENT","last_name":"MICHAELSON","classification":"C","division":"OPEN","hit_factor":3.7198},{"match_name":"Richmond Boro Gun Club February 2018 USPSA Pistol Match","match_date":"2018-02-03","stage_classifiercode":"03-07","member_number":"L3570","first_name":"KEVIN","last_name":"DRISCOLL","classification":"C","division":"OPEN","hit_factor":3.7162},{"match_name":"TAC2 USPSA AUGUST 2018","match_date":"2018-08-04","stage_classifiercode":"03-07","member_number":"\"\"","first_name":"CHARLIE","last_name":"KELLER","classification":"U","division":"OPEN","hit_factor":3.7157},{"match_name":"SFPC December 3 2017 USPSA Match","match_date":"2017-12-03","stage_classifiercode":"03-07","member_number":"A93270","first_name":"EDDIE","last_name":"RIVERA","classification":"C","division":"OPEN","hit_factor":3.7117},{"match_name":"Ontelaunee USPSA April 2017","match_date":"2017-04-22","stage_classifiercode":"03-07","member_number":"A93637","first_name":"MICHAEL","last_name":"COSENTINO","classification":"C","division":"OPEN","hit_factor":3.7113},{"match_name":"Piscataqua  Master Blasters USPSA Monthly","match_date":"2018-08-05","stage_classifiercode":"03-07","member_number":"A104656","first_name":"CRAIG","last_name":"TRAHAN","classification":"C","division":"OPEN","hit_factor":3.7019},{"match_name":"2017 Hawktech Arms Idaho Section Hi-cap Match","match_date":"2017-10-21","stage_classifiercode":"03-07","member_number":"TY94890","first_name":"CHRIS","last_name":"CLARK","classification":"B","division":"OPEN","hit_factor":3.6999},{"match_name":"SPSA USPSA February 4th Sat match","match_date":"2020-02-22","stage_classifiercode":"03-07","member_number":"A103527","first_name":"STEVE","last_name":"BLACKWELL","classification":"C","division":"OPEN","hit_factor":3.6993},{"match_name":"DAPS USPSA at ETTS 4-9-2016","match_date":"2016-04-09","stage_classifiercode":"03-07","member_number":"TY 9766","first_name":"PATRICK","last_name":"BASHFORD","classification":"B","division":"OPEN","hit_factor":3.6834},{"match_name":"BMPSA Apr 21 2018","match_date":"2018-04-21","stage_classifiercode":"03-07","member_number":"L4255","first_name":"ELTON","last_name":"COLEMAN","classification":"B","division":"OPEN","hit_factor":3.6769},{"match_name":"Hawkeye Gun Club February 2016","match_date":"2016-02-20","stage_classifiercode":"03-07","member_number":"TY72663","first_name":"EMIL","last_name":"KOZELL","classification":"C","division":"OPEN","hit_factor":3.6755},{"match_name":"GCL May 6-2017","match_date":"2017-05-06","stage_classifiercode":"03-07","member_number":"A100822","first_name":"NICHOLAS","last_name":"ESFORD","classification":"A","division":"OPEN","hit_factor":3.6736},{"match_name":"NRG September 24th 2016","match_date":"2016-09-24","stage_classifiercode":"03-07","member_number":"\"\"","first_name":"IAN","last_name":"ESTERHUIZEN","classification":"U","division":"OPEN","hit_factor":3.6712},{"match_name":"Sage Pistol League USPSA  August 15 2021","match_date":"2021-08-15","stage_classifiercode":"03-07","member_number":"A124468","first_name":"CHARLES","last_name":"MATHER","classification":"D","division":"OPEN","hit_factor":3.6676},{"match_name":"WNPL USPSA Feb 2021","match_date":"2021-02-06","stage_classifiercode":"03-07","member_number":"A55939","first_name":"STEVE","last_name":"SCHUETTE","classification":"B","division":"OPEN","hit_factor":3.6645},{"match_name":"LBAS160820","match_date":"2016-08-20","stage_classifiercode":"03-07","member_number":"A48358","first_name":"KEN","last_name":"COOMBS","classification":"C","division":"OPEN","hit_factor":3.6595},{"match_name":"OREGON ARPC CC05 USPSA Feb 11 2017","match_date":"2017-02-11","stage_classifiercode":"03-07","member_number":"Fy58474","first_name":"JAN","last_name":"MCDONALD","classification":"C","division":"OPEN","hit_factor":3.658},{"match_name":"LCSC Linden USPSA 082221","match_date":"2021-08-21","stage_classifiercode":"03-07","member_number":"Fy59179","first_name":"DAVE","last_name":"BUNN","classification":"B","division":"OPEN","hit_factor":3.6535},{"match_name":"HLSL 12-09-2018","match_date":"2018-12-09","stage_classifiercode":"03-07","member_number":"A105103","first_name":"CLIFF","last_name":"CORPUZ","classification":"U","division":"OPEN","hit_factor":3.6516},{"match_name":"HLSL 12-09-2018","match_date":"2018-12-09","stage_classifiercode":"03-07","member_number":"TY95612","first_name":"NICK","last_name":"DOMINGO","classification":"C","division":"OPEN","hit_factor":3.6466},{"match_name":"Ontelaunee USPSA September 2015","match_date":"2015-09-27","stage_classifiercode":"03-07","member_number":"A82085","first_name":"DAVE","last_name":"HEALEY","classification":"B","division":"OPEN","hit_factor":3.6466},{"match_name":"CGC USPSA 04-10-21","match_date":"2021-04-10","stage_classifiercode":"03-07","member_number":"A131354","first_name":"MIKE","last_name":"ULLOA","classification":"U","division":"OPEN","hit_factor":3.6465},{"match_name":"WTPS USPSA March Classifier 3-10-18","match_date":"2018-03-10","stage_classifiercode":"03-07","member_number":"A101801","first_name":"JEREMY","last_name":"SERVANTEZ","classification":"C","division":"OPEN","hit_factor":3.645},{"match_name":"LCAS April 2017 USPSA","match_date":"2017-04-01","stage_classifiercode":"03-07","member_number":"A101554","first_name":"ALBERT","last_name":"MONTANEZ","classification":"U","division":"OPEN","hit_factor":3.6378},{"match_name":"DSSA 2021-05 USPSA Pistol","match_date":"2021-05-15","stage_classifiercode":"03-07","member_number":"A87169","first_name":"AL","last_name":"PRIETO SR.","classification":"C","division":"OPEN","hit_factor":3.6296},{"match_name":"FSA USPSA 01-12-20","match_date":"2020-01-13","stage_classifiercode":"03-07","member_number":"L4071","first_name":"RAY","last_name":"FEGER","classification":"B","division":"OPEN","hit_factor":3.6255},{"match_name":"GCL May 6-2017","match_date":"2017-05-06","stage_classifiercode":"03-07","member_number":"TY5421","first_name":"TOM","last_name":"BECK","classification":"B","division":"OPEN","hit_factor":3.621},{"match_name":"MPPL 07012017  We the People","match_date":"2017-07-01","stage_classifiercode":"03-07","member_number":"FY26350","first_name":"ZUMEL","last_name":"AGUILAR","classification":"B","division":"OPEN","hit_factor":3.6206},{"match_name":"BRSP Tuesday Night USPSA Match - July 31","match_date":"2018-07-31","stage_classifiercode":"03-07","member_number":"A110231","first_name":"GREG","last_name":"SWANSON","classification":"C","division":"OPEN","hit_factor":3.6196},{"match_name":"NW05 Renton USPSA April 2016","match_date":"2016-04-24","stage_classifiercode":"03-07","member_number":"ty82582","first_name":"GALE","last_name":"BREITKREUTZ","classification":"C","division":"OPEN","hit_factor":3.6183},{"match_name":"CGC 2016-05-14","match_date":"2016-05-14","stage_classifiercode":"03-07","member_number":"A53510","first_name":"BRIAN","last_name":"HICKS","classification":"A","division":"OPEN","hit_factor":3.6145},{"match_name":"USPSA","match_date":"2016-12-10","stage_classifiercode":"03-07","member_number":"fy69155","first_name":"WES","last_name":"BOLES","classification":"B","division":"OPEN","hit_factor":3.6145},{"match_name":"Mapsa 2017 O8 12","match_date":"2017-08-11","stage_classifiercode":"03-07","member_number":"TY20461","first_name":"LARS","last_name":"FLINK","classification":"C","division":"OPEN","hit_factor":3.6139},{"match_name":"CSA Sept 2016","match_date":"2016-09-11","stage_classifiercode":"03-07","member_number":"A85695","first_name":"ALAN","last_name":"FRENCH","classification":"C","division":"OPEN","hit_factor":3.6009},{"match_name":"WSRC USPSA 5-19-2018","match_date":"2018-05-19","stage_classifiercode":"03-07","member_number":"FY70465","first_name":"ROB","last_name":"MALIN","classification":"B","division":"OPEN","hit_factor":3.6004},{"match_name":"Caja del Rio - March 2016","match_date":"2016-03-19","stage_classifiercode":"03-07","member_number":"A76944","first_name":"BRANDON","last_name":"WILL","classification":"B","division":"OPEN","hit_factor":3.5978},{"match_name":"Marc-On Shooting USPSA January 12th","match_date":"2020-01-12","stage_classifiercode":"03-07","member_number":"A - 104990","first_name":"ROB","last_name":"BELCHER","classification":"A","division":"OPEN","hit_factor":3.5968},{"match_name":"Morning SMPS 12 July 2020 USPSA Classifier Match","match_date":"2020-07-12","stage_classifiercode":"03-07","member_number":"A77140","first_name":"MICHAEL","last_name":"ROUNDS","classification":"D","division":"OPEN","hit_factor":3.5913},{"match_name":"NCPS USPSA Handgun Match August 28 2016","match_date":"2016-08-28","stage_classifiercode":"03-07","member_number":"A59813","first_name":"CINDY","last_name":"TUCKER","classification":"B","division":"OPEN","hit_factor":3.5874},{"match_name":"SPSA USPSA February 4th Sat match","match_date":"2020-02-22","stage_classifiercode":"03-07","member_number":"L2568","first_name":"JAMES","last_name":"NORTZ","classification":"G","division":"OPEN","hit_factor":3.5867},{"match_name":"Maine Practical Shooters November 2020","match_date":"2020-11-01","stage_classifiercode":"03-07","member_number":"TY93799","first_name":"JONATHAN","last_name":"WHEATON","classification":"C","division":"OPEN","hit_factor":3.585},{"match_name":"MCPSL Pistol 3-12-16","match_date":"2016-03-12","stage_classifiercode":"03-07","member_number":"Fy48525","first_name":"DAVID","last_name":"KOVAC","classification":"B","division":"OPEN","hit_factor":3.5835},{"match_name":"DRRC USPSA Mar2018","match_date":"2018-03-03","stage_classifiercode":"03-07","member_number":"TY45897","first_name":"LAWRENCE","last_name":"MULL","classification":"C","division":"OPEN","hit_factor":3.5832},{"match_name":"PCWC USPSA  5 27 2017","match_date":"2017-05-27","stage_classifiercode":"03-07","member_number":"A89604","first_name":"EARNEST","last_name":"ALLEN","classification":"B","division":"OPEN","hit_factor":3.5808},{"match_name":"Ontelaunee USPSA September 2015","match_date":"2015-09-27","stage_classifiercode":"03-07","member_number":"A76180","first_name":"JAMES","last_name":"HAUER","classification":"C","division":"OPEN","hit_factor":3.5796},{"match_name":"OFGC USPSA Match 8-15-21","match_date":"2021-08-15","stage_classifiercode":"03-07","member_number":"FY42421","first_name":"DEBBY","last_name":"PANKRATZ","classification":"C","division":"OPEN","hit_factor":3.5794},{"match_name":"Rio Grande Practical Shooting Club - September 5 2020","match_date":"2020-09-05","stage_classifiercode":"03-07","member_number":"TY63885","first_name":"TIMOTHY","last_name":"PROCTOR","classification":"B","division":"OPEN","hit_factor":3.5793},{"match_name":"GCL May 6-2017","match_date":"2017-05-06","stage_classifiercode":"03-07","member_number":"A95806","first_name":"ERIC","last_name":"HOBRON","classification":"D","division":"OPEN","hit_factor":3.5776},{"match_name":"Emmett USPSA November 28th","match_date":"2020-11-28","stage_classifiercode":"03-07","member_number":"A127385","first_name":"JOHN","last_name":"WUNDER","classification":"C","division":"OPEN","hit_factor":3.5773},{"match_name":"Dundee Practical Shooters - June 27 2020 - Points for Pistol","match_date":"2020-06-27","stage_classifiercode":"03-07","member_number":"TY45897","first_name":"LAWRENCE","last_name":"MULL","classification":"C","division":"OPEN","hit_factor":3.5728},{"match_name":"OREGON ARPC CC05 USPSA Feb 11 2017","match_date":"2017-02-11","stage_classifiercode":"03-07","member_number":"TY51199","first_name":"CHRIS","last_name":"FITZMORRIS","classification":"B","division":"OPEN","hit_factor":3.5701},{"match_name":"Bayou City USPSA Weekly Aug 20","match_date":"2020-08-20","stage_classifiercode":"03-07","member_number":"A81745","first_name":"AJ","last_name":"JACKSON","classification":"B","division":"OPEN","hit_factor":3.5695},{"match_name":"WNPL USPSA Feb 2021","match_date":"2021-02-06","stage_classifiercode":"03-07","member_number":"A112924","first_name":"BILL","last_name":"ROSE","classification":"C","division":"OPEN","hit_factor":3.5687},{"match_name":"SPSA USPSA February 4th Sat match","match_date":"2020-02-22","stage_classifiercode":"03-07","member_number":"TY60473","first_name":"KEVIN","last_name":"BARNEY","classification":"C","division":"OPEN","hit_factor":3.5686},{"match_name":"NHRPC - October 2020 USPSA","match_date":"2020-10-10","stage_classifiercode":"03-07","member_number":"A106069","first_name":"ERNESTO","last_name":"FIGUEROA","classification":"C","division":"OPEN","hit_factor":3.5674},{"match_name":"ORSA USPSA August 2017 Match","match_date":"2017-08-16","stage_classifiercode":"03-07","member_number":"A100533","first_name":"CHRIS","last_name":"THOMAS","classification":"C","division":"OPEN","hit_factor":3.562},{"match_name":"OREGON ARPC CC05 USPSA Feb 11 2017","match_date":"2017-02-11","stage_classifiercode":"03-07","member_number":"A95617","first_name":"JOSEPH","last_name":"TYLER","classification":"C","division":"OPEN","hit_factor":3.5597},{"match_name":"RSPP 3rd Saturday April 2016","match_date":"2016-04-16","stage_classifiercode":"03-07","member_number":"A91055","first_name":"BOB","last_name":"WAGNER","classification":"U","division":"OPEN","hit_factor":3.5568},{"match_name":"June 12 2021 The Range At True North USPSA Match","match_date":"2021-06-12","stage_classifiercode":"03-07","member_number":"A134392","first_name":"IKE","last_name":"MAYCOCK","classification":"U","division":"OPEN","hit_factor":3.5567},{"match_name":"RSPP 3rd Saturday April 2016","match_date":"2016-04-16","stage_classifiercode":"03-07","member_number":"TY83994","first_name":"KIM","last_name":"PARSON","classification":"C","division":"OPEN","hit_factor":3.552},{"match_name":"Ontelaunee USPSA April 2017","match_date":"2017-04-22","stage_classifiercode":"03-07","member_number":"TY20395","first_name":"LEO","last_name":"PRIMERO","classification":"B","division":"OPEN","hit_factor":3.544},{"match_name":"North East Ohio Shooters - OH19 - 2016-08-13","match_date":"2016-08-13","stage_classifiercode":"03-07","member_number":"A81835","first_name":"DON","last_name":"MAHER","classification":"C","division":"OPEN","hit_factor":3.5439},{"match_name":"MVPSA USPSA Match November 6th 2021","match_date":"2021-11-06","stage_classifiercode":"03-07","member_number":"A34845","first_name":"DAN","last_name":"QUALLS","classification":"B","division":"OPEN","hit_factor":3.5425},{"match_name":"Prescott Action Shooters 1st Saturday USPSA 4-3-21","match_date":"2021-04-03","stage_classifiercode":"03-07","member_number":"TY82499","first_name":"SCOTT","last_name":"SRIPAPATTANAVONG","classification":"A","division":"OPEN","hit_factor":3.5422},{"match_name":"ARPC USPSA Match 5-28-17","match_date":"2017-05-28","stage_classifiercode":"03-07","member_number":"A1249","first_name":"JAMES","last_name":"COLOMBO","classification":"B","division":"OPEN","hit_factor":3.5408},{"match_name":"October 2015 CAS Match","match_date":"2015-10-04","stage_classifiercode":"03-07","member_number":"A92752","first_name":"ASHLEY","last_name":"YATES","classification":"Unclassified","division":"OPEN","hit_factor":3.5405},{"match_name":"FSA USPSA 01-12-20","match_date":"2020-01-13","stage_classifiercode":"03-07","member_number":"Ty99422","first_name":"CORY","last_name":"TUCHSCHERER","classification":"B","division":"OPEN","hit_factor":3.5398},{"match_name":"JCSSA NOV 7 2020","match_date":"2020-11-07","stage_classifiercode":"03-07","member_number":"A115790","first_name":"CHRISTINE","last_name":"KILLEN (LM)","classification":"C","division":"OPEN","hit_factor":3.5376},{"match_name":"LA05 Tangi September 2nd USPSA Match 2017","match_date":"2017-09-24","stage_classifiercode":"03-07","member_number":"\"\"","first_name":"CHRISTOPHER","last_name":"JUE","classification":"X","division":"OPEN","hit_factor":3.5368},{"match_name":"PMSC May 2017","match_date":"2017-05-07","stage_classifiercode":"03-07","member_number":"ty84298","first_name":"JUSTIN","last_name":"MILLER","classification":"C","division":"OPEN","hit_factor":3.5308},{"match_name":"Hawkeye Gun Club February 2016","match_date":"2016-02-20","stage_classifiercode":"03-07","member_number":"A94155","first_name":"DANNY","last_name":"BRITT","classification":"U","division":"OPEN","hit_factor":3.5273},{"match_name":"GCL Wed 5-3-17","match_date":"2017-05-03","stage_classifiercode":"03-07","member_number":"A95806","first_name":"ERIC","last_name":"HOBRON","classification":"D","division":"OPEN","hit_factor":3.5199},{"match_name":"NRG Saturday December 22nd - Includes a Classifier Stage","match_date":"2018-12-22","stage_classifiercode":"03-07","member_number":"A62838","first_name":"AL","last_name":"MINICOLA","classification":"B","division":"OPEN","hit_factor":3.5198},{"match_name":"BRRC USPSA April 9 2016","match_date":"2016-04-09","stage_classifiercode":"03-07","member_number":"A95259","first_name":"RYAN","last_name":"RIZI","classification":"Unclassified","division":"OPEN","hit_factor":3.5196},{"match_name":"NCPS USPSA Handgun Match August 28 2016","match_date":"2016-08-28","stage_classifiercode":"03-07","member_number":"TY89750","first_name":"JOHN","last_name":"CENDANA","classification":"C","division":"OPEN","hit_factor":3.5183},{"match_name":"SPSA USPSA February 4th Sat match","match_date":"2020-02-22","stage_classifiercode":"03-07","member_number":"L4170","first_name":"STEVE","last_name":"COX","classification":"C","division":"OPEN","hit_factor":3.5113},{"match_name":"NW05 Renton USPSA April 2016","match_date":"2016-04-24","stage_classifiercode":"03-07","member_number":"TY66256","first_name":"TAN","last_name":"LOKE","classification":"M","division":"OPEN","hit_factor":3.5067},{"match_name":"Siouxland Practical Shooters Hawkeye Outdoor 4/10/21","match_date":"2021-04-10","stage_classifiercode":"03-07","member_number":"TY109377","first_name":"STEVE","last_name":"PORTER","classification":"B","division":"OPEN","hit_factor":3.5061},{"match_name":"GoShoot Outdoor October 17th","match_date":"2021-10-17","stage_classifiercode":"03-07","member_number":"TY136839","first_name":"THOMAS","last_name":"KRAKOWIAK","classification":"U","division":"OPEN","hit_factor":3.4993},{"match_name":"LdF USPSA Match January 13 2018","match_date":"2018-01-13","stage_classifiercode":"03-07","member_number":"\"\"","first_name":"DOUGLAS","last_name":"CHAN","classification":"U","division":"OPEN","hit_factor":3.4965},{"match_name":"EAGC September 2018 USPSA Pistol Match","match_date":"2018-09-16","stage_classifiercode":"03-07","member_number":"L3864","first_name":"VINCENT","last_name":"PAINTER","classification":"B","division":"OPEN","hit_factor":3.494},{"match_name":"Lefthanders Gun Club Practical Shooters October 1 and 2","match_date":"2016-10-01","stage_classifiercode":"03-07","member_number":"TY91334","first_name":"BILL","last_name":"SIDELL","classification":"C","division":"OPEN","hit_factor":3.4934},{"match_name":"LdF USPSA Match January 13 2018","match_date":"2018-01-13","stage_classifiercode":"03-07","member_number":"TY94265","first_name":"STEVE","last_name":"BENCE","classification":"C","division":"OPEN","hit_factor":3.493},{"match_name":"NCPS USPSA Handgun Match August 28 2016","match_date":"2016-08-28","stage_classifiercode":"03-07","member_number":"A86047","first_name":"RANCE","last_name":"DEL MAR","classification":"C","division":"OPEN","hit_factor":3.4889},{"match_name":"2017 Hawktech Arms Idaho Section Hi-cap Match","match_date":"2017-10-21","stage_classifiercode":"03-07","member_number":"A530","first_name":"JERRY","last_name":"DIX","classification":"M","division":"OPEN","hit_factor":3.4806},{"match_name":"Mn16 FIRING LINE USPSA 03-03-20","match_date":"2020-03-03","stage_classifiercode":"03-07","member_number":"a109338","first_name":"LOUIS","last_name":"WINSKOWSKI","classification":"U","division":"OPEN","hit_factor":3.4767},{"match_name":"JPPS Club Match 9-5-2020","match_date":"2020-09-05","stage_classifiercode":"03-07","member_number":"Ty116644","first_name":"ANDY","last_name":"INGRAM","classification":"B","division":"OPEN","hit_factor":3.4711},{"match_name":"Bayou City USPSA Weekly Mar 25","match_date":"2021-03-25","stage_classifiercode":"03-07","member_number":"A1013034","first_name":"CHARLES","last_name":"BRADBURY","classification":"U","division":"OPEN","hit_factor":3.4665},{"match_name":"Oxford OHS05 100321","match_date":"2021-10-03","stage_classifiercode":"03-07","member_number":"L5030","first_name":"SARGE","last_name":"SANDERS","classification":"A","division":"OPEN","hit_factor":3.4637},{"match_name":"HPSP Heartland Practical Shooters June USPSA Shoot","match_date":"2018-06-24","stage_classifiercode":"03-07","member_number":"pen","first_name":"PETER","last_name":"LOCKWOOD","classification":"Unclassified","division":"OPEN","hit_factor":3.4632},{"match_name":"Minot USPSA 12-11-16","match_date":"2016-12-11","stage_classifiercode":"03-07","member_number":"FY10629","first_name":"JIM","last_name":"DUFFY","classification":"C","division":"OPEN","hit_factor":3.4594},{"match_name":"Richmond Hot Shots Oct 16-17-2021 USPSA","match_date":"2021-10-16","stage_classifiercode":"03-07","member_number":"L5053","first_name":"RJ","last_name":"FONG","classification":"C","division":"OPEN","hit_factor":3.4564},{"match_name":"Fairfax PS USPSA 2020 March","match_date":"2020-03-17","stage_classifiercode":"03-07","member_number":"TY55989","first_name":"MIKE","last_name":"WHITMAN","classification":"B","division":"OPEN","hit_factor":3.4536},{"match_name":"AL20","match_date":"2021-04-14","stage_classifiercode":"03-07","member_number":"a102484","first_name":"ANDREW","last_name":"STATZ","classification":"U","division":"OPEN","hit_factor":3.4535},{"match_name":"WTPS USPSA March Classifier 3-10-18","match_date":"2018-03-10","stage_classifiercode":"03-07","member_number":"A109330","first_name":"JORDAN","last_name":"RAGAN","classification":"U","division":"OPEN","hit_factor":3.4531},{"match_name":"2018-10-06 USPSA at Phoenix Rod and Gun Club","match_date":"2018-10-06","stage_classifiercode":"03-07","member_number":"TY98350","first_name":"ERIC","last_name":"HAGBERG","classification":"C","division":"OPEN","hit_factor":3.4526},{"match_name":"ORSA USPSA October 2015","match_date":"2015-10-17","stage_classifiercode":"03-07","member_number":"A21270","first_name":"BRUCE","last_name":"IHLENFELD","classification":"C","division":"OPEN","hit_factor":3.4471},{"match_name":"CAPS Club July 24 USPSA","match_date":"2021-07-24","stage_classifiercode":"03-07","member_number":"FY117121","first_name":"ERNEST","last_name":"STEGGINK","classification":"C","division":"OPEN","hit_factor":3.4459},{"match_name":"PMRPC USPSA  10Apr21","match_date":"2021-04-10","stage_classifiercode":"03-07","member_number":"A89910","first_name":"ROB","last_name":"CLAYTON","classification":"B","division":"OPEN","hit_factor":3.4437},{"match_name":"CCPS 20170625","match_date":"2017-06-25","stage_classifiercode":"03-07","member_number":"A87194","first_name":"GARRETT","last_name":"MCKIERMAN","classification":"C","division":"OPEN","hit_factor":3.4429},{"match_name":"HLSL 12-09-2018","match_date":"2018-12-09","stage_classifiercode":"03-07","member_number":"A113332","first_name":"MARIA","last_name":"DUMBRIQUE","classification":"C","division":"OPEN","hit_factor":3.4359},{"match_name":"SLOSA March 2018 USPSA MATCH","match_date":"2018-03-10","stage_classifiercode":"03-07","member_number":"A45414","first_name":"ART","last_name":"LEACH","classification":"U","division":"OPEN","hit_factor":3.4357},{"match_name":"KIdlat September Club Match","match_date":"2018-09-01","stage_classifiercode":"03-07","member_number":"A75212","first_name":"STEVEN","last_name":"MCNAMARA","classification":"B","division":"OPEN","hit_factor":3.4319},{"match_name":"LBAS180217","match_date":"2018-02-17","stage_classifiercode":"03-07","member_number":"TY22616","first_name":"ANNETTE","last_name":"WILLIAMSON","classification":"B","division":"OPEN","hit_factor":3.4296},{"match_name":"NW05 Renton USPSA April 2016","match_date":"2016-04-24","stage_classifiercode":"03-07","member_number":"TY86951","first_name":"EMILIO","last_name":"DOMINGO","classification":"C","division":"OPEN","hit_factor":3.4226},{"match_name":"Richmond Hot Shots August 4th-5th USPSA Pistol Match","match_date":"2018-08-04","stage_classifiercode":"03-07","member_number":"A99185","first_name":"DOMINADOR","last_name":"EDUARDO JR","classification":"C","division":"OPEN","hit_factor":3.4225},{"match_name":"June 12 2021 The Range At True North USPSA Match","match_date":"2021-06-12","stage_classifiercode":"03-07","member_number":"A107525","first_name":"BRIAN","last_name":"HONEYCUTT","classification":"C","division":"OPEN","hit_factor":3.4223},{"match_name":"October 2015 CAS Match","match_date":"2015-10-04","stage_classifiercode":"03-07","member_number":"A66934","first_name":"ELIZABETH","last_name":"YOUNG","classification":"C","division":"OPEN","hit_factor":3.4208},{"match_name":"MPSA 072118 USPS","match_date":"2018-07-21","stage_classifiercode":"03-07","member_number":"A96501","first_name":"CANDACE","last_name":"CALLOWAY","classification":"C","division":"OPEN","hit_factor":3.4181},{"match_name":"NRG Saturday December 22nd - Includes a Classifier Stage","match_date":"2018-12-22","stage_classifiercode":"03-07","member_number":"\"\"","first_name":"JOSIP","last_name":"HANDARMO","classification":"U","division":"OPEN","hit_factor":3.4143},{"match_name":"Colonial Rifle and Pistol Club May 2021","match_date":"2021-05-01","stage_classifiercode":"03-07","member_number":"ty103555","first_name":"JOHN","last_name":"FEVELO","classification":"C","division":"OPEN","hit_factor":3.4107},{"match_name":"WSRC USPSA 5-19-2018","match_date":"2018-05-19","stage_classifiercode":"03-07","member_number":"A7424","first_name":"MARTY","last_name":"GERINGER","classification":"A","division":"OPEN","hit_factor":3.4097},{"match_name":"PMRPC USPSA 12Dec20 - all Classifier","match_date":"2020-12-12","stage_classifiercode":"03-07","member_number":"A104504","first_name":"LESLIE","last_name":"HERMAN","classification":"C","division":"OPEN","hit_factor":3.4067},{"match_name":"Springfield Tactical Shooters 08/02/2018","match_date":"2018-08-02","stage_classifiercode":"03-07","member_number":"A30365","first_name":"ED","last_name":"TRIBBLE","classification":"A","division":"OPEN","hit_factor":3.4004},{"match_name":"FVPS September USPSA Match","match_date":"2016-09-03","stage_classifiercode":"03-07","member_number":"TY13138","first_name":"PIERRE","last_name":"MUNSON","classification":"B","division":"OPEN","hit_factor":3.4001},{"match_name":"TAC2 USPSA AUGUST 2018","match_date":"2018-08-04","stage_classifiercode":"03-07","member_number":"A102022","first_name":"TOM","last_name":"MURRAY","classification":"U","division":"OPEN","hit_factor":3.3961},{"match_name":"OFGC USPSA Match 7/15/2018","match_date":"2018-07-15","stage_classifiercode":"03-07","member_number":"A79174","first_name":"BRIXEY","last_name":"NELSON","classification":"M","division":"OPEN","hit_factor":3.389},{"match_name":"CPS USPSA May 2021","match_date":"2021-05-01","stage_classifiercode":"03-07","member_number":"ty86587","first_name":"STEVEN","last_name":"PETERS","classification":"C","division":"OPEN","hit_factor":3.3886},{"match_name":"Lefthanders Gun Club Practical Shooters October 1 and 2","match_date":"2016-10-01","stage_classifiercode":"03-07","member_number":"A63658","first_name":"JASON","last_name":"CAREY","classification":"D","division":"OPEN","hit_factor":3.3844},{"match_name":"WAC August 22nd (4th Sunday) - ALL CLASSIFIER USPSA 6 Stage Match","match_date":"2021-08-22","stage_classifiercode":"03-07","member_number":"A92734","first_name":"BEN","last_name":"WHITE","classification":"B","division":"OPEN","hit_factor":3.3829},{"match_name":"NCPS USPSA Handgun Match August 28 2016","match_date":"2016-08-28","stage_classifiercode":"03-07","member_number":"TY64320","first_name":"ROBERT","last_name":"SHARP","classification":"B","division":"OPEN","hit_factor":3.3827},{"match_name":"WAC August 22nd (4th Sunday) - ALL CLASSIFIER USPSA 6 Stage Match","match_date":"2021-08-22","stage_classifiercode":"03-07","member_number":"Tu95982","first_name":"JIM","last_name":"KILLORAN","classification":"B","division":"OPEN","hit_factor":3.3806},{"match_name":"SCS USPSA Oct 25 2015","match_date":"2015-10-24","stage_classifiercode":"03-07","member_number":"a72319","first_name":"RENANTE","last_name":"DAVID","classification":"U","division":"OPEN","hit_factor":3.3801},{"match_name":"Matamoras  USPSA July 2018","match_date":"2018-07-15","stage_classifiercode":"03-07","member_number":"L4309","first_name":"CONSTANTINO","last_name":"RIVERA","classification":"C","division":"OPEN","hit_factor":3.3784},{"match_name":"Richmond Hot Shots Oct 16-17-2021 USPSA","match_date":"2021-10-16","stage_classifiercode":"03-07","member_number":"TY93622","first_name":"CARLO","last_name":"PABELICO","classification":"B","division":"OPEN","hit_factor":3.3777},{"match_name":"MPSA 042818 USPSA","match_date":"2018-04-28","stage_classifiercode":"03-07","member_number":"TY82660","first_name":"GERALD","last_name":"PATCH","classification":"C","division":"OPEN","hit_factor":3.377},{"match_name":"NRG Saturday December 22nd - Includes a Classifier Stage","match_date":"2018-12-22","stage_classifiercode":"03-07","member_number":"TY50487","first_name":"ED","last_name":"BENEDETTO","classification":"U","division":"OPEN","hit_factor":3.3744},{"match_name":"GAS July 7th Special Classifier","match_date":"2018-07-07","stage_classifiercode":"03-07","member_number":"A104679","first_name":"LUKE","last_name":"ARCHER","classification":"C","division":"OPEN","hit_factor":3.3696},{"match_name":"EAGC September 2015 USPSA Pistol Match","match_date":"2015-09-20","stage_classifiercode":"03-07","member_number":"A88000","first_name":"KENNEDY","last_name":"NASH","classification":"C","division":"OPEN","hit_factor":3.3692},{"match_name":"TAPS MARCH MATCH","match_date":"2017-03-11","stage_classifiercode":"03-07","member_number":"A70027","first_name":"DOUGLAS","last_name":"MCPHERSON","classification":"U","division":"OPEN","hit_factor":3.3652},{"match_name":"DRRC USPSA Mar2018","match_date":"2018-03-03","stage_classifiercode":"03-07","member_number":"A96567","first_name":"ANDREW","last_name":"JORDON","classification":"U","division":"OPEN","hit_factor":3.3573},{"match_name":"Heartland Practical Shooters USPSA League","match_date":"2020-06-04","stage_classifiercode":"03-07","member_number":"TY68670","first_name":"STEPHEN","last_name":"HAYES","classification":"B","division":"OPEN","hit_factor":3.3532},{"match_name":"TPS USPSA -  December","match_date":"2017-12-09","stage_classifiercode":"03-07","member_number":"TY-31727","first_name":"MIKE","last_name":"DEGUIRE","classification":"B","division":"OPEN","hit_factor":3.3529},{"match_name":"MCPSL Pistol 3-12-16","match_date":"2016-03-12","stage_classifiercode":"03-07","member_number":"A72049","first_name":"MARK","last_name":"KLINEFELTER","classification":"C","division":"OPEN","hit_factor":3.3457},{"match_name":"GCL Wed 5-3-17","match_date":"2017-05-03","stage_classifiercode":"03-07","member_number":"A75013","first_name":"BETH","last_name":"HYNES","classification":"C","division":"OPEN","hit_factor":3.3456},{"match_name":"WGC WI USPSA Monthly Match 12-16-17","match_date":"2017-12-16","stage_classifiercode":"03-07","member_number":"A20556","first_name":"DON","last_name":"ZIMMERMAN","classification":"B","division":"OPEN","hit_factor":3.3441},{"match_name":"NRG Saturday December 22nd - Includes a Classifier Stage","match_date":"2018-12-22","stage_classifiercode":"03-07","member_number":"FY99184","first_name":"RODEL","last_name":"JARDINIANO","classification":"U","division":"OPEN","hit_factor":3.3425},{"match_name":"NRG Saturday November 13th Includes a Classifier Stage","match_date":"2021-11-13","stage_classifiercode":"03-07","member_number":"A136861","first_name":"BRIAN","last_name":"KIM","classification":"U","division":"OPEN","hit_factor":3.3409},{"match_name":"NRG September 24th 2016","match_date":"2016-09-24","stage_classifiercode":"03-07","member_number":"A75568","first_name":"MEL","last_name":"LLIDO","classification":"C","division":"OPEN","hit_factor":3.3404},{"match_name":"Dundee Practical Shooters - June 27 2020 - Points for Pistol","match_date":"2020-06-27","stage_classifiercode":"03-07","member_number":"TY45892","first_name":"RICHARD","last_name":"BROWNING","classification":"B","division":"OPEN","hit_factor":3.3386},{"match_name":"GCL May 6-2017","match_date":"2017-05-06","stage_classifiercode":"03-07","member_number":"A75013","first_name":"BETH","last_name":"HYNES","classification":"C","division":"OPEN","hit_factor":3.3309},{"match_name":"GAS July 7th Special Classifier","match_date":"2018-07-07","stage_classifiercode":"03-07","member_number":"\"\"","first_name":"JONATHAN","last_name":"SCHULTE","classification":"U","division":"OPEN","hit_factor":3.3295},{"match_name":"Renton USPSA - April 2021 - NW05","match_date":"2021-04-25","stage_classifiercode":"03-07","member_number":"Ty86951","first_name":"EMILIO","last_name":"DOMINGO","classification":"A","division":"OPEN","hit_factor":3.3262},{"match_name":"Heartland Practical Shooters USPSA League","match_date":"2020-06-04","stage_classifiercode":"03-07","member_number":"TY68670","first_name":"STEPHEN","last_name":"HAYES","classification":"B","division":"OPEN","hit_factor":3.3235},{"match_name":"NRG Saturday November 13th Includes a Classifier Stage","match_date":"2021-11-13","stage_classifiercode":"03-07","member_number":"L3513","first_name":"PHILLIP","last_name":"WILLMS","classification":"C","division":"OPEN","hit_factor":3.3204},{"match_name":"NCPS USPSA Handgun Match August 28 2016","match_date":"2016-08-28","stage_classifiercode":"03-07","member_number":"A60193","first_name":"JOHN","last_name":"GUIDERO","classification":"C","division":"OPEN","hit_factor":3.3169},{"match_name":"Prescott Action Shooters 1st Saturday USPSA 4-3-21","match_date":"2021-04-03","stage_classifiercode":"03-07","member_number":"A82915","first_name":"CODY","last_name":"VINCENT","classification":"A","division":"OPEN","hit_factor":3.3163},{"match_name":"Prescott Action Shooters 1st Saturday USPSA 08-07-21","match_date":"2021-08-07","stage_classifiercode":"03-07","member_number":"TY118908","first_name":"WALT","last_name":"STRZELEWICZ","classification":"C","division":"OPEN","hit_factor":3.3149},{"match_name":"OREGON ARPC CC05 USPSA Feb 11 2017","match_date":"2017-02-11","stage_classifiercode":"03-07","member_number":"A101001","first_name":"TIM","last_name":"AUSTIN","classification":"U","division":"OPEN","hit_factor":3.3131},{"match_name":"LIPSA - November 4th 2018 - USPSA Classifier Match","match_date":"2018-11-04","stage_classifiercode":"03-07","member_number":"L2939","first_name":"MATT","last_name":"MCMAHON","classification":"A","division":"OPEN","hit_factor":3.3129},{"match_name":"INAS Oct 2020 USPSA","match_date":"2020-10-10","stage_classifiercode":"03-07","member_number":"TY118820","first_name":"RYAN","last_name":"QUIRK","classification":"Unclassified","division":"OPEN","hit_factor":3.3096},{"match_name":"Matamoras  USPSA July 2018","match_date":"2018-07-15","stage_classifiercode":"03-07","member_number":"A112593","first_name":"BEN","last_name":"BOYER","classification":"U","division":"OPEN","hit_factor":3.3069},{"match_name":"RSPP 3rd Saturday April 2016","match_date":"2016-04-16","stage_classifiercode":"03-07","member_number":"A90727","first_name":"DANYELA","last_name":"D'ANGELO","classification":"D","division":"OPEN","hit_factor":3.2982},{"match_name":"Rio Grande Practical Shooting Club - September 5 2020","match_date":"2020-09-05","stage_classifiercode":"03-07","member_number":"A104028","first_name":"BENITO","last_name":"MARTINEZ","classification":"A","division":"OPEN","hit_factor":3.298},{"match_name":"Colonial Rifle and Pistol Club May 2021","match_date":"2021-05-01","stage_classifiercode":"03-07","member_number":"FY92775","first_name":"CLIFFORD","last_name":"AVERSANO","classification":"C","division":"OPEN","hit_factor":3.2945},{"match_name":"MVPSA USPSA Match November 6th 2021","match_date":"2021-11-06","stage_classifiercode":"03-07","member_number":"A93448","first_name":"BOB","last_name":"BEER","classification":"C","division":"OPEN","hit_factor":3.2936},{"match_name":"Minot USPSA 2-18-18","match_date":"2018-02-18","stage_classifiercode":"03-07","member_number":"A52173","first_name":"WESLEY","last_name":"THOMAS","classification":"B","division":"OPEN","hit_factor":3.2924},{"match_name":"LTD Pistol - October 2017","match_date":"2017-10-07","stage_classifiercode":"03-07","member_number":"A14464","first_name":"CARTER","last_name":"REED","classification":"A","division":"OPEN","hit_factor":3.2902},{"match_name":"MPPL 07012017  We the People","match_date":"2017-07-01","stage_classifiercode":"03-07","member_number":"NONE","first_name":"DAVID","last_name":"KIKUKAWA","classification":"X","division":"OPEN","hit_factor":3.2776},{"match_name":"DAPS USPSA at ETTS 4-9-2016","match_date":"2016-04-09","stage_classifiercode":"03-07","member_number":"TY43977","first_name":"BYRON","last_name":"SIMPSON","classification":"D","division":"OPEN","hit_factor":3.2773},{"match_name":"Griffin USPSA AUG 2018","match_date":"2018-08-18","stage_classifiercode":"03-07","member_number":"Pending","first_name":"ADAM","last_name":"REAMES","classification":"B","division":"OPEN","hit_factor":3.2724},{"match_name":"LA05 Tangi September 2nd USPSA Match 2017","match_date":"2017-09-24","stage_classifiercode":"03-07","member_number":"TY78444","first_name":"LARRY","last_name":"SIVILS","classification":"C","division":"OPEN","hit_factor":3.2713},{"match_name":"Lefthanders Gun Club Practical Shooters October 1 and 2","match_date":"2016-10-01","stage_classifiercode":"03-07","member_number":"TY72670","first_name":"DALE","last_name":"HARDING","classification":"U","division":"OPEN","hit_factor":3.268},{"match_name":"SFPS 8-23-20 USPSA","match_date":"2020-08-23","stage_classifiercode":"03-07","member_number":"TY90617","first_name":"BRYAN","last_name":"ZENT","classification":"C","division":"OPEN","hit_factor":3.2646},{"match_name":"PMRPC USPSA  10Apr21","match_date":"2021-04-10","stage_classifiercode":"03-07","member_number":"TY23169","first_name":"TED","last_name":"KAVAGE","classification":"B","division":"OPEN","hit_factor":3.2556},{"match_name":"ECPS USPSA 15 SEP 18","match_date":"2018-09-15","stage_classifiercode":"03-07","member_number":"\"\"","first_name":"DANTE","last_name":"AVERA","classification":"U","division":"OPEN","hit_factor":3.2484},{"match_name":"March 13 2021 The Range At True North USPSA Match","match_date":"2021-03-13","stage_classifiercode":"03-07","member_number":"XXXX","first_name":"TONY","last_name":"NORTON","classification":"U","division":"OPEN","hit_factor":3.2483},{"match_name":"Marc-On Shooting USPSA January 12th","match_date":"2020-01-12","stage_classifiercode":"03-07","member_number":"A105557","first_name":"ELLIOTT","last_name":"WATKINS","classification":"C","division":"OPEN","hit_factor":3.2471},{"match_name":"FSTC Classifier - December 2016","match_date":"2016-12-18","stage_classifiercode":"03-07","member_number":"L3619","first_name":"MARK","last_name":"ROTH","classification":"U","division":"OPEN","hit_factor":3.2468},{"match_name":"SPSA USPSA December 4th Sat match","match_date":"2017-12-23","stage_classifiercode":"03-07","member_number":"A100654","first_name":"BRANDON","last_name":"RADER","classification":"U","division":"OPEN","hit_factor":3.2439},{"match_name":"XMG USPSA   Saturday November 6th 2021","match_date":"2021-11-06","stage_classifiercode":"03-07","member_number":"A109764","first_name":"DAN","last_name":"AUTON","classification":"C","division":"OPEN","hit_factor":3.2438},{"match_name":"WNPL USPSA Feb 2021","match_date":"2021-02-06","stage_classifiercode":"03-07","member_number":"A123515","first_name":"STEVE","last_name":"FLORES","classification":"U","division":"OPEN","hit_factor":3.2421},{"match_name":"Griffin USPSA Match Oct 15 2016","match_date":"2016-10-15","stage_classifiercode":"03-07","member_number":"TY62771","first_name":"JERRY","last_name":"BLAND","classification":"C","division":"OPEN","hit_factor":3.2357},{"match_name":"SFPS 8-23-20 USPSA","match_date":"2020-08-23","stage_classifiercode":"03-07","member_number":"a36760","first_name":"TOM","last_name":"BALKO","classification":"M","division":"OPEN","hit_factor":3.2215},{"match_name":"SCS USPSA Oct 25 2015","match_date":"2015-10-24","stage_classifiercode":"03-07","member_number":"A88904","first_name":"JOHN","last_name":"SIMS","classification":"U","division":"OPEN","hit_factor":3.2192},{"match_name":"LGCSEMPS AUGUST 2020 HANDGUN","match_date":"2020-08-08","stage_classifiercode":"03-07","member_number":"TY80894","first_name":"VINCE","last_name":"PALAZZOLO","classification":"C","division":"OPEN","hit_factor":3.2158},{"match_name":"Detroit Sportsmens Congress - August 20 2017","match_date":"2017-08-20","stage_classifiercode":"03-07","member_number":"TY26739","first_name":"JAY","last_name":"KNIGHT","classification":"U","division":"OPEN","hit_factor":3.2144},{"match_name":"Extreme GM USPSA 5-8","match_date":"2021-05-05","stage_classifiercode":"03-07","member_number":"A16778","first_name":"PAUL","last_name":"RENFRO","classification":"B","division":"OPEN","hit_factor":3.2103},{"match_name":"NRG Saturday December 22nd - Includes a Classifier Stage","match_date":"2018-12-22","stage_classifiercode":"03-07","member_number":"A63645","first_name":"CHARLES","last_name":"YOUNG","classification":"B","division":"OPEN","hit_factor":3.2095},{"match_name":"RSPP 3rd Saturday April 2016","match_date":"2016-04-16","stage_classifiercode":"03-07","member_number":"A26739","first_name":"JAY","last_name":"KNIGHT","classification":"C","division":"OPEN","hit_factor":3.2079},{"match_name":"CGC 2016-05-14","match_date":"2016-05-14","stage_classifiercode":"03-07","member_number":"TY49463","first_name":"RON","last_name":"LAUER","classification":"C","division":"OPEN","hit_factor":3.2053},{"match_name":"BPSA September 2016 USPSA","match_date":"2016-09-25","stage_classifiercode":"03-07","member_number":"A82537","first_name":"HERMAN","last_name":"COX","classification":"U","division":"OPEN","hit_factor":3.2045},{"match_name":"EAGC September 2015 USPSA Pistol Match","match_date":"2015-09-20","stage_classifiercode":"03-07","member_number":"TY28472","first_name":"JF","last_name":"KERSEY","classification":"B","division":"OPEN","hit_factor":3.2016},{"match_name":"October 2015 CAS Match","match_date":"2015-10-04","stage_classifiercode":"03-07","member_number":"A81207","first_name":"CECIL","last_name":"JANISE","classification":"C","division":"OPEN","hit_factor":3.1991},{"match_name":"SPSA USPSA February 4th Sat match","match_date":"2020-02-22","stage_classifiercode":"03-07","member_number":"A82536","first_name":"BRAD","last_name":"BANKS","classification":"A","division":"OPEN","hit_factor":3.1958},{"match_name":"Cactus USPSA April 2021","match_date":"2021-04-04","stage_classifiercode":"03-07","member_number":"A103084","first_name":"RUSSEL","last_name":"NOLASCO","classification":"D","division":"OPEN","hit_factor":3.1956},{"match_name":"Tropang Vegas All Classifier Match","match_date":"2021-07-11","stage_classifiercode":"03-07","member_number":"A135026","first_name":"ARVY","last_name":"DELA CRUZ","classification":"Unclassified","division":"OPEN","hit_factor":3.1933},{"match_name":"RISE Indoor Shooting","match_date":"2018-05-19","stage_classifiercode":"03-07","member_number":"\"\"","first_name":"TREVOR","last_name":"TUNISON","classification":"U","division":"OPEN","hit_factor":3.1922},{"match_name":"SFA USPSA FEBRUARY 2018","match_date":"2018-02-17","stage_classifiercode":"03-07","member_number":"A55939","first_name":"STEVE","last_name":"SCHUETTE","classification":"B","division":"OPEN","hit_factor":3.1878},{"match_name":"BPSA September 2016 USPSA","match_date":"2016-09-25","stage_classifiercode":"03-07","member_number":"A93997","first_name":"JM","last_name":"RAMOIN","classification":"U","division":"OPEN","hit_factor":3.1877},{"match_name":"TAPS MARCH MATCH","match_date":"2017-03-11","stage_classifiercode":"03-07","member_number":"TY86191","first_name":"KENNETH","last_name":"TANNER","classification":"U","division":"OPEN","hit_factor":3.1806},{"match_name":"Minot USPSA 12-11-16","match_date":"2016-12-11","stage_classifiercode":"03-07","member_number":"TY51500","first_name":"DOUG","last_name":"STELTZER","classification":"B","division":"OPEN","hit_factor":3.1784},{"match_name":"SFPC December 3 2017 USPSA Match","match_date":"2017-12-03","stage_classifiercode":"03-07","member_number":"A84350","first_name":"BRESLY","last_name":"JARAMILLO","classification":"C","division":"OPEN","hit_factor":3.1746},{"match_name":"Ontelaunee USPSA April 2017","match_date":"2017-04-22","stage_classifiercode":"03-07","member_number":"A93289","first_name":"MICHAEL","last_name":"ROMIG","classification":"U","division":"OPEN","hit_factor":3.1725},{"match_name":"ARPC USPSA Match 5-28-17","match_date":"2017-05-28","stage_classifiercode":"03-07","member_number":"TY80998","first_name":"JIM","last_name":"ROTHBARTH","classification":"C","division":"OPEN","hit_factor":3.1707},{"match_name":"Ontelaunee USPSA September 2015","match_date":"2015-09-27","stage_classifiercode":"03-07","member_number":"TY70694","first_name":"ALEX","last_name":"SALAZAR","classification":"B","division":"OPEN","hit_factor":3.169},{"match_name":"LBAS180217","match_date":"2018-02-17","stage_classifiercode":"03-07","member_number":"A34448","first_name":"LARRY","last_name":"LEBEAU","classification":"A","division":"OPEN","hit_factor":3.1655},{"match_name":"PCWC USPSA  5 27 2017","match_date":"2017-05-27","stage_classifiercode":"03-07","member_number":"A25745","first_name":"DAN","last_name":"SANDERS","classification":"B","division":"OPEN","hit_factor":3.1653},{"match_name":"Detroit Sportsmens Congress - August 20 2017","match_date":"2017-08-20","stage_classifiercode":"03-07","member_number":"A28004","first_name":"LARRY","last_name":"DEMARS","classification":"B","division":"OPEN","hit_factor":3.1641},{"match_name":"RSPP 3rd Saturday April 2016","match_date":"2016-04-16","stage_classifiercode":"03-07","member_number":"A74253","first_name":"LESLIE","last_name":"KORZEP","classification":"C","division":"OPEN","hit_factor":3.1512},{"match_name":"NISA July 2017","match_date":"2017-07-23","stage_classifiercode":"03-07","member_number":"TY85482","first_name":"MIKE","last_name":"SCHROEDL","classification":"C","division":"OPEN","hit_factor":3.1477},{"match_name":"Rankin Field Sunday USPSA","match_date":"2017-10-15","stage_classifiercode":"03-07","member_number":"\"\"","first_name":"JACK","last_name":"HALL","classification":"U","division":"OPEN","hit_factor":3.1474},{"match_name":"Piscataqua  Master Blasters USPSA Monthly","match_date":"2018-08-05","stage_classifiercode":"03-07","member_number":"TY99763","first_name":"ANDREW","last_name":"CHAN","classification":"D","division":"OPEN","hit_factor":3.1398},{"match_name":"Rio Grande Practical Shooters - September 2016","match_date":"2016-09-03","stage_classifiercode":"03-07","member_number":"PEN","first_name":"BRANDON","last_name":"WILLINGHAM","classification":"U","division":"OPEN","hit_factor":3.1379},{"match_name":"Oxford OHS05 100321","match_date":"2021-10-03","stage_classifiercode":"03-07","member_number":"A114079","first_name":"NICK","last_name":"WILLIAMS","classification":"C","division":"OPEN","hit_factor":3.1361},{"match_name":"SPSA USPSA February 4th Sat match","match_date":"2020-02-22","stage_classifiercode":"03-07","member_number":"A100238","first_name":"ROBERT","last_name":"HUMPHRIES","classification":"C","division":"OPEN","hit_factor":3.1355},{"match_name":"Colonial Rifle and Pistol Club May 2021","match_date":"2021-05-01","stage_classifiercode":"03-07","member_number":"TY31444","first_name":"JOSE","last_name":"OCAMPO","classification":"B","division":"OPEN","hit_factor":3.1344},{"match_name":"ARPC USPSA Match 5-28-17","match_date":"2017-05-28","stage_classifiercode":"03-07","member_number":"FY53427","first_name":"ANTHONY","last_name":"FRIEDRICH","classification":"B","division":"OPEN","hit_factor":3.1283},{"match_name":"DAPS USPSA @ ETTS 10-14-17","match_date":"2017-10-14","stage_classifiercode":"03-07","member_number":"TY72655","first_name":"AIDAN","last_name":"STOCKTON","classification":"C","division":"OPEN","hit_factor":3.122},{"match_name":"HLSL 12-09-2018","match_date":"2018-12-09","stage_classifiercode":"03-07","member_number":"L4356","first_name":"JOHN ERIC","last_name":"VALLEDOR","classification":"U","division":"OPEN","hit_factor":3.1124},{"match_name":"CAPS 9-23-2017","match_date":"2017-09-23","stage_classifiercode":"03-07","member_number":"L3808","first_name":"MARK","last_name":"BROWN","classification":"B","division":"OPEN","hit_factor":3.1088},{"match_name":"RSPP 3rd Saturday April 2016","match_date":"2016-04-16","stage_classifiercode":"03-07","member_number":"TY50145","first_name":"SUE","last_name":"LITTLE","classification":"C","division":"OPEN","hit_factor":3.1083},{"match_name":"Klamath USPSA 05/01/16 JSPS OR09","match_date":"2016-05-01","stage_classifiercode":"03-07","member_number":"TY49859","first_name":"CATHY","last_name":"HILL","classification":"C","division":"OPEN","hit_factor":3.1053},{"match_name":"Shoot GTR USPSA August 2018","match_date":"2018-08-04","stage_classifiercode":"03-07","member_number":"A103100","first_name":"JEREMY","last_name":"KROLAK","classification":"U","division":"OPEN","hit_factor":3.0997},{"match_name":"GCL Wed 5-3-17","match_date":"2017-05-03","stage_classifiercode":"03-07","member_number":"A48848","first_name":"DON","last_name":"WESTER","classification":"B","division":"OPEN","hit_factor":3.0995},{"match_name":"EWPSA 5/15/16","match_date":"2016-05-15","stage_classifiercode":"03-07","member_number":"A57282","first_name":"JOHN","last_name":"MORGAN","classification":"M","division":"OPEN","hit_factor":3.098},{"match_name":"BRSP Tuesday Night USPSA Match - July 31","match_date":"2018-07-31","stage_classifiercode":"03-07","member_number":"\"\"","first_name":"TYR","last_name":"BRAKAHAUGEN","classification":"\"\"","division":"OPEN","hit_factor":3.0958},{"match_name":"Colonial Rifle and Pistol Club May 2021","match_date":"2021-05-01","stage_classifiercode":"03-07","member_number":"TY99029","first_name":"NICK","last_name":"TORRELLI","classification":"D","division":"OPEN","hit_factor":3.0939},{"match_name":"Shoot GTR Tuesday USPSA 07/18/17","match_date":"2017-07-18","stage_classifiercode":"03-07","member_number":"\"\"","first_name":"BILL","last_name":"QUIRK","classification":"\"\"","division":"OPEN","hit_factor":3.0928},{"match_name":"Springfield Tactical Shooters 08/02/2018","match_date":"2018-08-02","stage_classifiercode":"03-07","member_number":"A30365","first_name":"ED","last_name":"TRIBBLE","classification":"A","division":"OPEN","hit_factor":3.0903},{"match_name":"PCSI - July 2017 USPSA","match_date":"2017-07-01","stage_classifiercode":"03-07","member_number":"TY58681","first_name":"RON","last_name":"ALLEN","classification":"D","division":"OPEN","hit_factor":3.0894},{"match_name":"Richmond Boro Gun Club February 2018 USPSA Pistol Match","match_date":"2018-02-03","stage_classifiercode":"03-07","member_number":"FY92775","first_name":"CLIFFORD","last_name":"AVERSANO","classification":"D","division":"OPEN","hit_factor":3.0891},{"match_name":"EAGC September 2015 USPSA Pistol Match","match_date":"2015-09-20","stage_classifiercode":"03-07","member_number":"A70326","first_name":"KENNETH","last_name":"ROSE","classification":"A","division":"OPEN","hit_factor":3.0886},{"match_name":"Afternoon SMPS 09 February 2020 USPSA Classifier Match","match_date":"2020-02-09","stage_classifiercode":"03-07","member_number":"FY15413","first_name":"TOM","last_name":"SUIT","classification":"M","division":"OPEN","hit_factor":3.0835},{"match_name":"TAC2 USPSA AUGUST 2018","match_date":"2018-08-04","stage_classifiercode":"03-07","member_number":"A101992","first_name":"BILLY","last_name":"MILLER","classification":"U","division":"OPEN","hit_factor":3.0802},{"match_name":"PTPC May 2nd USPSA Match","match_date":"2021-05-02","stage_classifiercode":"03-07","member_number":"A44047","first_name":"DONNA","last_name":"BUNTON","classification":"C","division":"OPEN","hit_factor":3.0785},{"match_name":"Fairfax PS USPSA 2020 March","match_date":"2020-03-17","stage_classifiercode":"03-07","member_number":"A88424","first_name":"CRAIG","last_name":"PETERSON","classification":"U","division":"OPEN","hit_factor":3.0758},{"match_name":"CAPS Club July 24 USPSA","match_date":"2021-07-24","stage_classifiercode":"03-07","member_number":"A111928","first_name":"MARK","last_name":"HALL","classification":"C","division":"OPEN","hit_factor":3.0753},{"match_name":"WAC August 22nd (4th Sunday) - ALL CLASSIFIER USPSA 6 Stage Match","match_date":"2021-08-22","stage_classifiercode":"03-07","member_number":"a49543","first_name":"HEATHER","last_name":"ARENAS","classification":"C","division":"OPEN","hit_factor":3.0704},{"match_name":"JCSSA NOV 7 2020","match_date":"2020-11-07","stage_classifiercode":"03-07","member_number":"TY-9766","first_name":"PATRICK","last_name":"BASHFORD","classification":"B","division":"OPEN","hit_factor":3.0664},{"match_name":"OFGC USPSA Match 7/15/2018","match_date":"2018-07-15","stage_classifiercode":"03-07","member_number":"FY34677","first_name":"DALE","last_name":"PANKRATZ","classification":"C","division":"OPEN","hit_factor":3.065},{"match_name":"CGC USPSA 04-10-21","match_date":"2021-04-10","stage_classifiercode":"03-07","member_number":"A106845","first_name":"ALLEN","last_name":"DEAN","classification":"B","division":"OPEN","hit_factor":3.0607},{"match_name":"March 13 2021 The Range At True North USPSA Match","match_date":"2021-03-13","stage_classifiercode":"03-07","member_number":"A97295","first_name":"CHRIS","last_name":"EWEN","classification":"C","division":"OPEN","hit_factor":3.06},{"match_name":"NW05 Renton USPSA April 2016","match_date":"2016-04-24","stage_classifiercode":"03-07","member_number":"ty44166","first_name":"DANIEL","last_name":"LAI","classification":"B","division":"OPEN","hit_factor":3.0557},{"match_name":"PMSC May 2017","match_date":"2017-05-07","stage_classifiercode":"03-07","member_number":"a101973","first_name":"CLAY","last_name":"SHERLOCK","classification":"U","division":"OPEN","hit_factor":3.0557},{"match_name":"Pioneer Action Shooters Aug 2017 Match","match_date":"2017-08-13","stage_classifiercode":"03-07","member_number":"A82210","first_name":"JOHN","last_name":"JONES","classification":"C","division":"OPEN","hit_factor":3.0554},{"match_name":"EAGC September 2018 USPSA Pistol Match","match_date":"2018-09-16","stage_classifiercode":"03-07","member_number":"A88000","first_name":"KENNEDY","last_name":"NASH","classification":"C","division":"OPEN","hit_factor":3.0539},{"match_name":"Extreme GM USPSA 5-8","match_date":"2021-05-05","stage_classifiercode":"03-07","member_number":"A108606","first_name":"STEVEN","last_name":"MORALES","classification":"C","division":"OPEN","hit_factor":3.0528},{"match_name":"NRG Saturday December 22nd - Includes a Classifier Stage","match_date":"2018-12-22","stage_classifiercode":"03-07","member_number":"A44044","first_name":"FROILAN","last_name":"FRANCISCO","classification":"D","division":"OPEN","hit_factor":3.0343},{"match_name":"SCAPSA MN05 Spring League 3","match_date":"2017-04-24","stage_classifiercode":"03-07","member_number":"TY94384","first_name":"ROBERT","last_name":"UPEGUI","classification":"U","division":"OPEN","hit_factor":3.0331},{"match_name":"PGC May 2021 USPSA ","match_date":"2021-04-30","stage_classifiercode":"03-07","member_number":"A80963","first_name":"ADAM","last_name":"FRIEDMAN","classification":"C","division":"OPEN","hit_factor":3.0323},{"match_name":"Coastal Area Practical Shooters 10-28-17","match_date":"2017-10-28","stage_classifiercode":"03-07","member_number":"FY69538","first_name":"ALAN","last_name":"MATTHEWS","classification":"B","division":"OPEN","hit_factor":3.0291},{"match_name":"Oxford OHS05 100321","match_date":"2021-10-03","stage_classifiercode":"03-07","member_number":"TY59608","first_name":"KIMBERLY","last_name":"RUSS","classification":"C","division":"OPEN","hit_factor":3.028},{"match_name":"June 12 2021 The Range At True North USPSA Match","match_date":"2021-06-12","stage_classifiercode":"03-07","member_number":"L4782","first_name":"STEVE","last_name":"DELAGE","classification":"B","division":"OPEN","hit_factor":3.0279},{"match_name":"Minnetonka Game And Fish July 25","match_date":"2018-07-25","stage_classifiercode":"03-07","member_number":"\"\"","first_name":"RYAN","last_name":"SKARDA","classification":"U","division":"OPEN","hit_factor":3.0262},{"match_name":"Pioneer Action Shooters Aug 2017 Match","match_date":"2017-08-13","stage_classifiercode":"03-07","member_number":"A99705","first_name":"NATHAN","last_name":"MARQUES","classification":"B","division":"OPEN","hit_factor":3.0259},{"match_name":"Dundee Practical Shooters - June 27 2020 - Points for Pistol","match_date":"2020-06-27","stage_classifiercode":"03-07","member_number":"A81900","first_name":"JAMES","last_name":"MERCER","classification":"C","division":"OPEN","hit_factor":3.0255},{"match_name":"TAC2 USPSA AUGUST 2018","match_date":"2018-08-04","stage_classifiercode":"03-07","member_number":"TY96579","first_name":"DWIGHT","last_name":"RAINES","classification":"U","division":"OPEN","hit_factor":3.0247},{"match_name":"GCL Wed 5-3-17","match_date":"2017-05-03","stage_classifiercode":"03-07","member_number":"TY5421","first_name":"TOM","last_name":"BECK","classification":"B","division":"OPEN","hit_factor":3.0145},{"match_name":"Richmond Classifier Match January 24-2016","match_date":"2016-01-24","stage_classifiercode":"03-07","member_number":"A77883","first_name":"EPHRAIM","last_name":"SAN FELIPE","classification":"C","division":"OPEN","hit_factor":3.0139},{"match_name":"NRG Saturday November 13th Includes a Classifier Stage","match_date":"2021-11-13","stage_classifiercode":"03-07","member_number":"FY24813","first_name":"RALPH","last_name":"ARREDONDO","classification":"M","division":"OPEN","hit_factor":3.0127},{"match_name":"BPSA September 2016 USPSA","match_date":"2016-09-25","stage_classifiercode":"03-07","member_number":"A69732","first_name":"GERALD","last_name":"FORBES","classification":"C","division":"OPEN","hit_factor":3.009},{"match_name":"FMPSA March Indoor USPSA Super-Classifier Match","match_date":"2021-03-21","stage_classifiercode":"03-07","member_number":"A133402","first_name":"DEREK","last_name":"TOLLEFSON","classification":"\"\"","division":"OPEN","hit_factor":3.0067},{"match_name":"NNRPA USPSA November 2017","match_date":"2017-11-25","stage_classifiercode":"03-07","member_number":"A82479","first_name":"BRENT","last_name":"TAYLOR","classification":"C","division":"OPEN","hit_factor":3.0016},{"match_name":"Richmond Hot Shots Oct 16-17-2021 USPSA","match_date":"2021-10-16","stage_classifiercode":"03-07","member_number":"TY93022","first_name":"BONG","last_name":"BALOMADRES","classification":"C","division":"OPEN","hit_factor":2.9974},{"match_name":"MPPL 07012017  We the People","match_date":"2017-07-01","stage_classifiercode":"03-07","member_number":"L2877","first_name":"KLEMER","last_name":"PRIETO","classification":"C","division":"OPEN","hit_factor":2.9961},{"match_name":"Space Coast Practical Shooters","match_date":"2017-04-01","stage_classifiercode":"03-07","member_number":"ty73281","first_name":"JACK","last_name":"DARTIGALONGUE","classification":"C","division":"OPEN","hit_factor":2.9915},{"match_name":"Medford USPSA July 2021 Match","match_date":"2021-07-18","stage_classifiercode":"03-07","member_number":"TY49839","first_name":"CATHY","last_name":"HILL","classification":"C","division":"OPEN","hit_factor":2.9886},{"match_name":"Matamoras USPSA March 2017","match_date":"2017-04-02","stage_classifiercode":"03-07","member_number":"TY101373","first_name":"JOSEPH","last_name":"JUAREZ","classification":"U","division":"OPEN","hit_factor":2.9882},{"match_name":"Richmond Hot Shots August 4th-5th USPSA Pistol Match","match_date":"2018-08-04","stage_classifiercode":"03-07","member_number":"TY93022","first_name":"VENANCIO","last_name":"BALOMADRES","classification":"U","division":"OPEN","hit_factor":2.9865},{"match_name":"Griffin USPSA Jan 2020","match_date":"2020-01-17","stage_classifiercode":"03-07","member_number":"TY102149","first_name":"GREG","last_name":"CANNON","classification":"C","division":"OPEN","hit_factor":2.9857},{"match_name":"CCPS 20170625","match_date":"2017-06-25","stage_classifiercode":"03-07","member_number":"A56905","first_name":"BLAIR","last_name":"HANSEN","classification":"B","division":"OPEN","hit_factor":2.9836},{"match_name":"LBAS160820","match_date":"2016-08-20","stage_classifiercode":"03-07","member_number":"A86470","first_name":"RICHARD","last_name":"FRASER","classification":"C","division":"OPEN","hit_factor":2.9826},{"match_name":"USPSA","match_date":"2018-02-04","stage_classifiercode":"03-07","member_number":"\"\"","first_name":"PHILIP","last_name":"GUARISCO","classification":"G","division":"OPEN","hit_factor":2.9809},{"match_name":"Renton USPSA - April 2021 - NW05","match_date":"2021-04-25","stage_classifiercode":"03-07","member_number":"FY103459","first_name":"MELISSA","last_name":"WILSON","classification":"C","division":"OPEN","hit_factor":2.9723},{"match_name":"LCAS April 2017 USPSA","match_date":"2017-04-01","stage_classifiercode":"03-07","member_number":"ty73890","first_name":"GARY","last_name":"VAUGHT","classification":"B","division":"OPEN","hit_factor":2.9717},{"match_name":"GCL May 6-2017","match_date":"2017-05-06","stage_classifiercode":"03-07","member_number":"L3750","first_name":"MIKE","last_name":"COLE","classification":"M","division":"OPEN","hit_factor":2.9687},{"match_name":"Pioneer Action Shooters Aug 2017 Match","match_date":"2017-08-13","stage_classifiercode":"03-07","member_number":"\"\"","first_name":"ALLEN","last_name":"LAU","classification":"B","division":"OPEN","hit_factor":2.9647},{"match_name":"April 2017 Devil Dog USPSA  at The Range","match_date":"2017-04-23","stage_classifiercode":"03-07","member_number":"DONTHAVECARDONMEBUTCANPROVIDEWHENIGETTHEREIGAVEITLASTMONTH","first_name":"JAY","last_name":"MEERBERGEN","classification":"U","division":"OPEN","hit_factor":2.9621},{"match_name":"Piscataqua  Master Blasters USPSA Monthly","match_date":"2018-08-05","stage_classifiercode":"03-07","member_number":"A102311","first_name":"ROBERT","last_name":"PEKOWSKY","classification":"D","division":"OPEN","hit_factor":2.9578},{"match_name":"GPS USPSA July 2021","match_date":"2021-07-25","stage_classifiercode":"03-07","member_number":"TY54053","first_name":"ABRAHAN","last_name":"FIGUEROA","classification":"C","division":"OPEN","hit_factor":2.9566},{"match_name":"SUPS USPSA 7/8 Mar 2020","match_date":"2020-03-08","stage_classifiercode":"03-07","member_number":"L3286","first_name":"DANIEL","last_name":"PELAEZ","classification":"C","division":"OPEN","hit_factor":2.9471},{"match_name":"GPS USPSA July 2021","match_date":"2021-07-25","stage_classifiercode":"03-07","member_number":"TY104508","first_name":"CHARITY","last_name":"TAYLOR","classification":"D","division":"OPEN","hit_factor":2.9468},{"match_name":"ORSA USPSA October 2015","match_date":"2015-10-17","stage_classifiercode":"03-07","member_number":"A85866","first_name":"DANIEL","last_name":"OLIVER","classification":"D","division":"OPEN","hit_factor":2.9458},{"match_name":"North Lawrence Fish And Game USPSA 10/17/20","match_date":"2020-10-17","stage_classifiercode":"03-07","member_number":"TY102834","first_name":"DAVID","last_name":"CONLEY","classification":"C","division":"OPEN","hit_factor":2.9434},{"match_name":"PMSC May 2017","match_date":"2017-05-07","stage_classifiercode":"03-07","member_number":"A-90924","first_name":"SOPHIA","last_name":"SMITH","classification":"U","division":"OPEN","hit_factor":2.943},{"match_name":"Richmond Hot Shots Oct 16-17-2021 USPSA","match_date":"2021-10-16","stage_classifiercode":"03-07","member_number":"L4854","first_name":"DEXTER","last_name":"LOPEZ","classification":"B","division":"OPEN","hit_factor":2.9391},{"match_name":"SAPSC Monthly USPSA Classifier Match 20150908","match_date":"2015-09-08","stage_classifiercode":"03-07","member_number":"TY60177","first_name":"CARL","last_name":"RAINEY","classification":"C","division":"OPEN","hit_factor":2.9379},{"match_name":"ORSA USPSA October 2015","match_date":"2015-10-17","stage_classifiercode":"03-07","member_number":"A87027","first_name":"RALEIGH","last_name":"PRINCE","classification":"B","division":"OPEN","hit_factor":2.9319},{"match_name":"EAGC September 2018 USPSA Pistol Match","match_date":"2018-09-16","stage_classifiercode":"03-07","member_number":"A106869","first_name":"JOSEPH","last_name":"POTTER","classification":"C","division":"OPEN","hit_factor":2.9194},{"match_name":"Bayou City USPSA Weekly Aug 20","match_date":"2020-08-20","stage_classifiercode":"03-07","member_number":"A107489","first_name":"CHARLES","last_name":"BRADBURY","classification":"U","division":"OPEN","hit_factor":2.9164},{"match_name":"PMRPC USPSA 12Dec20 - all Classifier","match_date":"2020-12-12","stage_classifiercode":"03-07","member_number":"TY115464","first_name":"MARI","last_name":"HILTZ","classification":"U","division":"OPEN","hit_factor":2.916},{"match_name":"Cactus USPSA April 2021","match_date":"2021-04-04","stage_classifiercode":"03-07","member_number":"FY74995","first_name":"CHUCK","last_name":"EMERY","classification":"D","division":"OPEN","hit_factor":2.9135},{"match_name":"Richmond Hot Shots August 4th-5th USPSA Pistol Match","match_date":"2018-08-04","stage_classifiercode":"03-07","member_number":"\"\"","first_name":"JONATHON","last_name":"AURIGUI","classification":"D","division":"OPEN","hit_factor":2.9044},{"match_name":"Richmond Classifier Match January 24-2016","match_date":"2016-01-24","stage_classifiercode":"03-07","member_number":"A92465","first_name":"JOSE","last_name":"RAPADAS","classification":"U","division":"OPEN","hit_factor":2.9044},{"match_name":"Siouxland Practical Shooters Hawkeye Outdoor 4/10/21","match_date":"2021-04-10","stage_classifiercode":"03-07","member_number":"TY13098","first_name":"DAVID","last_name":"HINELINE","classification":"\"\"","division":"OPEN","hit_factor":2.899},{"match_name":"EAGC September 2015 USPSA Pistol Match","match_date":"2015-09-20","stage_classifiercode":"03-07","member_number":"A88793","first_name":"RACHEL","last_name":"SMITH","classification":"C","division":"OPEN","hit_factor":2.8986},{"match_name":"PMSC May 2017","match_date":"2017-05-07","stage_classifiercode":"03-07","member_number":"a93980","first_name":"KEN","last_name":"LALIBERTE","classification":"C","division":"OPEN","hit_factor":2.8974},{"match_name":"IN18 SCGC USPSA 5 September 2021","match_date":"2021-09-05","stage_classifiercode":"03-07","member_number":"TY82661","first_name":"SHANNON","last_name":"UNSWORTH","classification":"C","division":"OPEN","hit_factor":2.8963},{"match_name":"GAS July 7th Special Classifier","match_date":"2018-07-07","stage_classifiercode":"03-07","member_number":"TY97094","first_name":"TOMMY","last_name":"MCCULLOUGH","classification":"C","division":"OPEN","hit_factor":2.896},{"match_name":"CSA June 2017","match_date":"2017-06-11","stage_classifiercode":"03-07","member_number":"\"\"","first_name":"DANA","last_name":"CAMPBELL","classification":"C","division":"OPEN","hit_factor":2.8926},{"match_name":"WAC August 22nd (4th Sunday) - ALL CLASSIFIER USPSA 6 Stage Match","match_date":"2021-08-22","stage_classifiercode":"03-07","member_number":"TY104937","first_name":"ERIC","last_name":"STERNBERG","classification":"C","division":"OPEN","hit_factor":2.8871},{"match_name":"PMRPC USPSA  10Apr21","match_date":"2021-04-10","stage_classifiercode":"03-07","member_number":"TY115464","first_name":"MARI","last_name":"HILTZ","classification":"C","division":"OPEN","hit_factor":2.8852},{"match_name":"MCPSL Pistol 3-12-16","match_date":"2016-03-12","stage_classifiercode":"03-07","member_number":"ty43257","first_name":"FRED","last_name":"NOBLE","classification":"C","division":"OPEN","hit_factor":2.8823},{"match_name":"LGCSEMPS AUGUST 2020 HANDGUN","match_date":"2020-08-08","stage_classifiercode":"03-07","member_number":"A128530","first_name":"TOSHIO","last_name":"LEWIS","classification":"D","division":"OPEN","hit_factor":2.8729},{"match_name":"RSPP 3rd Saturday April 2016","match_date":"2016-04-16","stage_classifiercode":"03-07","member_number":"A95577","first_name":"MATTHEW","last_name":"KITZMILLER","classification":"U","division":"OPEN","hit_factor":2.8725},{"match_name":"USPSA","match_date":"2020-07-26","stage_classifiercode":"03-07","member_number":"ty11901","first_name":"DAVID","last_name":"LOPEZ","classification":"A","division":"OPEN","hit_factor":2.8689},{"match_name":"ORSA USPSA August 2017 Match","match_date":"2017-08-16","stage_classifiercode":"03-07","member_number":"A90492","first_name":"TRAVIS","last_name":"BOYD","classification":"C","division":"OPEN","hit_factor":2.867},{"match_name":"Caja del Rio - March 2016","match_date":"2016-03-19","stage_classifiercode":"03-07","member_number":"TY84782","first_name":"SCOTT","last_name":"ROSE","classification":"B","division":"OPEN","hit_factor":2.8653},{"match_name":"WSRC USPSA 5-19-2018","match_date":"2018-05-19","stage_classifiercode":"03-07","member_number":"A108608","first_name":"CAMERON","last_name":"BERRY","classification":"U","division":"OPEN","hit_factor":2.865},{"match_name":"G2G July 27th USPSA Match","match_date":"2021-07-27","stage_classifiercode":"03-07","member_number":"A123359","first_name":"DYLAN","last_name":"LORENCE","classification":"C","division":"OPEN","hit_factor":2.8609},{"match_name":"OREGON ARPC CC05 USPSA Feb 11 2017","match_date":"2017-02-11","stage_classifiercode":"03-07","member_number":"TY100470","first_name":"KEITH","last_name":"CORTES","classification":"D","division":"OPEN","hit_factor":2.8571},{"match_name":"OFGC USPSA Match 7/15/2018","match_date":"2018-07-15","stage_classifiercode":"03-07","member_number":"TY55378","first_name":"TRAVIS","last_name":"THOMPSON","classification":"A","division":"OPEN","hit_factor":2.8509},{"match_name":"WGC WI USPSA Monthly Match 12-16-17","match_date":"2017-12-16","stage_classifiercode":"03-07","member_number":"TY67616","first_name":"DAN","last_name":"PAWLAK","classification":"C","division":"OPEN","hit_factor":2.8462},{"match_name":"EWPSA 5/15/16","match_date":"2016-05-15","stage_classifiercode":"03-07","member_number":"A66312","first_name":"VANESSA","last_name":"GOOD","classification":"C","division":"OPEN","hit_factor":2.8436},{"match_name":"NRG Saturday December 22nd - Includes a Classifier Stage","match_date":"2018-12-22","stage_classifiercode":"03-07","member_number":"\"\"","first_name":"JIAHUI","last_name":"LI","classification":"D","division":"OPEN","hit_factor":2.8418},{"match_name":"GCL Wed 5-3-17","match_date":"2017-05-03","stage_classifiercode":"03-07","member_number":"L3750","first_name":"MIKE","last_name":"COLE","classification":"M","division":"OPEN","hit_factor":2.8397},{"match_name":"Maine Practical Shooters November 2020","match_date":"2020-11-01","stage_classifiercode":"03-07","member_number":"A128615","first_name":"JOE","last_name":"BUSQUE","classification":"C","division":"OPEN","hit_factor":2.8383},{"match_name":"DSSA 2021-05 USPSA Pistol","match_date":"2021-05-15","stage_classifiercode":"03-07","member_number":"A93349","first_name":"JONATHAN","last_name":"PARKER","classification":"B","division":"OPEN","hit_factor":2.8377},{"match_name":"Detroit Sportsmens Congress - August 20 2017","match_date":"2017-08-20","stage_classifiercode":"03-07","member_number":"TY43331","first_name":"DENNIS","last_name":"WALDEN","classification":"C","division":"OPEN","hit_factor":2.8366},{"match_name":"YRPA USPSA Classifier match January 2018 (resubmission)","match_date":"2018-01-28","stage_classifiercode":"03-07","member_number":"A100682","first_name":"VICTORIA","last_name":"SCHMIDT","classification":"D","division":"OPEN","hit_factor":2.8238},{"match_name":"HOPS USPSA 052116","match_date":"2016-05-21","stage_classifiercode":"03-07","member_number":"TY69181","first_name":"RICHARD","last_name":"MILLER","classification":"C","division":"OPEN","hit_factor":2.8152},{"match_name":"Triforce Practical Shooters at BigWoodsGoods 5-4-17","match_date":"2017-05-04","stage_classifiercode":"03-07","member_number":"A97282","first_name":"RAY","last_name":"RUTLEDGE","classification":"U","division":"OPEN","hit_factor":2.811},{"match_name":"Mesilla Valley P November 2021 USPSA match","match_date":"2021-11-21","stage_classifiercode":"03-07","member_number":"A124420","first_name":"TERILYN","last_name":"WOOD","classification":"C","division":"OPEN","hit_factor":2.8085},{"match_name":"Siouxland Practical Shooters Hawkeye Outdoor 4/10/21","match_date":"2021-04-10","stage_classifiercode":"03-07","member_number":"a126990","first_name":"KELLY","last_name":"VAN BEEST","classification":"D","division":"OPEN","hit_factor":2.7968},{"match_name":"Mapsa 2017 O8 12","match_date":"2017-08-11","stage_classifiercode":"03-07","member_number":"TY51432","first_name":"FRANK","last_name":"SKOG","classification":"C","division":"OPEN","hit_factor":2.795},{"match_name":"ORSA USPSA October 2015","match_date":"2015-10-17","stage_classifiercode":"03-07","member_number":"NONE","first_name":"TERRY","last_name":"LAMUNYON","classification":"U","division":"OPEN","hit_factor":2.7931},{"match_name":"SPSA USPSA December 4th Sat match","match_date":"2017-12-23","stage_classifiercode":"03-07","member_number":"L4170","first_name":"STEVE","last_name":"COX","classification":"C","division":"OPEN","hit_factor":2.7842},{"match_name":"Rio Grande Practical Shooters - September 2016","match_date":"2016-09-03","stage_classifiercode":"03-07","member_number":"A93278","first_name":"WILLIAM","last_name":"CHANDON","classification":"U","division":"OPEN","hit_factor":2.7831},{"match_name":"Renton USPSA - April 2021 - NW05","match_date":"2021-04-25","stage_classifiercode":"03-07","member_number":"TY114649","first_name":"JORDAN","last_name":"ROGERS","classification":"M","division":"OPEN","hit_factor":2.7762},{"match_name":"January Match","match_date":"2017-01-22","stage_classifiercode":"03-07","member_number":"A74860","first_name":"CHUCK","last_name":"HYDE","classification":"D","division":"OPEN","hit_factor":2.7737},{"match_name":"LBAS160820","match_date":"2016-08-20","stage_classifiercode":"03-07","member_number":"A34448","first_name":"LARRY","last_name":"LEBEAU","classification":"A","division":"OPEN","hit_factor":2.7726},{"match_name":"HPSP Heartland Practical Shooters June USPSA Shoot","match_date":"2018-06-24","stage_classifiercode":"03-07","member_number":"Pen","first_name":"SHAYNE","last_name":"BAYLESS","classification":"Unclassified","division":"OPEN","hit_factor":2.7678},{"match_name":"May 2017 USPSA Classifier Special","match_date":"2017-05-13","stage_classifiercode":"03-07","member_number":"\"\"","first_name":"BRYAN","last_name":"QUINLAN","classification":"U","division":"OPEN","hit_factor":2.7631},{"match_name":"MPSA 072118 USPS","match_date":"2018-07-21","stage_classifiercode":"03-07","member_number":"L4195","first_name":"THOMAS","last_name":"HEARD","classification":"C","division":"OPEN","hit_factor":2.755},{"match_name":"RCPS USPSA April 21","match_date":"2018-04-21","stage_classifiercode":"03-07","member_number":"TJ100969","first_name":"DAVID","last_name":"BARNES","classification":"C","division":"OPEN","hit_factor":2.7423},{"match_name":"SUPS USPSA 7/8 Mar 2020","match_date":"2020-03-08","stage_classifiercode":"03-07","member_number":"A105729","first_name":"DAVE","last_name":"TOWNES","classification":"","division":"OPEN","hit_factor":2.7421},{"match_name":"2018-10-06 USPSA at Phoenix Rod and Gun Club","match_date":"2018-10-06","stage_classifiercode":"03-07","member_number":"A100726","first_name":"DOMINIC","last_name":"NAPOLITANO","classification":"C","division":"OPEN","hit_factor":2.7393},{"match_name":"WSRC USPSA 5-19-2018","match_date":"2018-05-19","stage_classifiercode":"03-07","member_number":"\"\"","first_name":"JEFF","last_name":"MAY","classification":"X","division":"OPEN","hit_factor":2.7382},{"match_name":"DSSA 2021-05 USPSA Pistol","match_date":"2021-05-15","stage_classifiercode":"03-07","member_number":"A101927","first_name":"BOBBY","last_name":"GEER","classification":"B","division":"OPEN","hit_factor":2.731},{"match_name":"JCSSA NOV3 2018","match_date":"2018-11-03","stage_classifiercode":"03-07","member_number":"ty108367","first_name":"MAX","last_name":"FELBER","classification":"U","division":"OPEN","hit_factor":2.7296},{"match_name":"Dundee Practical Shooters - June 27 2020 - Points for Pistol","match_date":"2020-06-27","stage_classifiercode":"03-07","member_number":"FY51479","first_name":"NANCY","last_name":"MARRS","classification":"D","division":"OPEN","hit_factor":2.7165},{"match_name":"LA05 Tangi September 2nd USPSA Match 2017","match_date":"2017-09-24","stage_classifiercode":"03-07","member_number":"A81207","first_name":"CECIL","last_name":"JANISE","classification":"C","division":"OPEN","hit_factor":2.7102},{"match_name":"Medford USPSA June 2016 Match","match_date":"2016-06-19","stage_classifiercode":"03-07","member_number":"TY50112","first_name":"JAMES","last_name":"GRAUER","classification":"B","division":"OPEN","hit_factor":2.7057},{"match_name":"Triforce Practical Shooters at BigWoodsGoods 5-4-17","match_date":"2017-05-04","stage_classifiercode":"03-07","member_number":"A-80964","first_name":"MICHAEL","last_name":"DUPUIS","classification":"U","division":"OPEN","hit_factor":2.7044},{"match_name":"Briar  Rabbit July Match 2016 OH20","match_date":"2016-07-24","stage_classifiercode":"03-07","member_number":"A91422","first_name":"LONNIE","last_name":"MORTENSEN","classification":"U","division":"OPEN","hit_factor":2.7041},{"match_name":"SFPC December 3 2017 USPSA Match","match_date":"2017-12-03","stage_classifiercode":"03-07","member_number":"A93782","first_name":"JORGE","last_name":"PITA","classification":"C","division":"OPEN","hit_factor":2.7041},{"match_name":"Tropang Vegas All Classifier Match","match_date":"2021-07-11","stage_classifiercode":"03-07","member_number":"A128377","first_name":"RICHARD","last_name":"ABELLA","classification":"C","division":"OPEN","hit_factor":2.6997},{"match_name":"Pioneer Action Shooters Aug 2017 Match","match_date":"2017-08-13","stage_classifiercode":"03-07","member_number":"A55823","first_name":"EDWARD","last_name":"UPTON","classification":"X","division":"OPEN","hit_factor":2.6916},{"match_name":"SLOSA March 2018 USPSA MATCH","match_date":"2018-03-10","stage_classifiercode":"03-07","member_number":"\"\"","first_name":"JANET","last_name":"LEACH","classification":"U","division":"OPEN","hit_factor":2.6911},{"match_name":"SCS USPSA Oct 25 2015","match_date":"2015-10-24","stage_classifiercode":"03-07","member_number":"a17372","first_name":"ERIC","last_name":"RONNING","classification":"C","division":"OPEN","hit_factor":2.6849},{"match_name":"PGC USPSA Practice Match 5-30-17","match_date":"2017-05-30","stage_classifiercode":"03-07","member_number":"TY86727","first_name":"GEORGE","last_name":"MORASCH","classification":"D","division":"OPEN","hit_factor":2.6789},{"match_name":"NRG September 24th 2016","match_date":"2016-09-24","stage_classifiercode":"03-07","member_number":"L3950","first_name":"BO","last_name":"WANG","classification":"C","division":"OPEN","hit_factor":2.6782},{"match_name":"NRG September 24th 2016","match_date":"2016-09-24","stage_classifiercode":"03-07","member_number":"\"\"","first_name":"RAY","last_name":"PALACIO","classification":"U","division":"OPEN","hit_factor":2.6716},{"match_name":"BHPSC Weekly Match 1-29-2016","match_date":"2016-01-30","stage_classifiercode":"03-07","member_number":"L1810","first_name":"DAVID","last_name":"FARRAN","classification":"none","division":"OPEN","hit_factor":2.6702},{"match_name":"GCL May 6-2017","match_date":"2017-05-06","stage_classifiercode":"03-07","member_number":"L406","first_name":"JOHN","last_name":"SCOTT","classification":"B","division":"OPEN","hit_factor":2.6694},{"match_name":"Mapsa 2017 O8 12","match_date":"2017-08-11","stage_classifiercode":"03-07","member_number":"A27034","first_name":"BILL","last_name":"HARTMAN","classification":"C","division":"OPEN","hit_factor":2.6636},{"match_name":"FLPSA USPSA 04.23.2016","match_date":"2016-04-23","stage_classifiercode":"03-07","member_number":"A11568","first_name":"JAKE","last_name":"LESNICK","classification":"A","division":"OPEN","hit_factor":2.6578},{"match_name":"Richmond Hot Shots August 4th-5th USPSA Pistol Match","match_date":"2018-08-04","stage_classifiercode":"03-07","member_number":"9695","first_name":"RICKY","last_name":"FONG","classification":"B","division":"OPEN","hit_factor":2.6563},{"match_name":"MPSA 042818 USPSA","match_date":"2018-04-28","stage_classifiercode":"03-07","member_number":"L4105","first_name":"GREG","last_name":"HAMMER","classification":"B","division":"OPEN","hit_factor":2.6498},{"match_name":"Pathfinder June USPSA Match","match_date":"2020-06-21","stage_classifiercode":"03-07","member_number":"TY24181","first_name":"RICH","last_name":"BORRA","classification":"B","division":"OPEN","hit_factor":2.6492},{"match_name":"DRRC USPSA Mar2018","match_date":"2018-03-03","stage_classifiercode":"03-07","member_number":"TY45892","first_name":"RICHARD","last_name":"BROWNING","classification":"B","division":"OPEN","hit_factor":2.6484},{"match_name":"BPSA September 2016 USPSA","match_date":"2016-09-25","stage_classifiercode":"03-07","member_number":"A92752","first_name":"ASHLEY","last_name":"YATES","classification":"C","division":"OPEN","hit_factor":2.6423},{"match_name":"Minot USPSA 2-18-18","match_date":"2018-02-18","stage_classifiercode":"03-07","member_number":"TY51500","first_name":"DOUG","last_name":"STELTZER","classification":"B","division":"OPEN","hit_factor":2.6337},{"match_name":"CGC USPSA 04-10-21","match_date":"2021-04-10","stage_classifiercode":"03-07","member_number":"TY25385","first_name":"MARK","last_name":"STAMPER","classification":"C","division":"OPEN","hit_factor":2.6296},{"match_name":"CGC USPSA 04-10-21","match_date":"2021-04-10","stage_classifiercode":"03-07","member_number":"TY113996","first_name":"LUIS","last_name":"CRESPO","classification":"B","division":"OPEN","hit_factor":2.6257},{"match_name":"SFPC December 3 2017 USPSA Match","match_date":"2017-12-03","stage_classifiercode":"03-07","member_number":"TY82866","first_name":"GARY","last_name":"BRILL","classification":"B","division":"OPEN","hit_factor":2.6239},{"match_name":"CAPS Club July 24 USPSA","match_date":"2021-07-24","stage_classifiercode":"03-07","member_number":"A93545","first_name":"PETER","last_name":"MORACCO","classification":"C","division":"OPEN","hit_factor":2.6165},{"match_name":"NRG Saturday December 22nd - Includes a Classifier Stage","match_date":"2018-12-22","stage_classifiercode":"03-07","member_number":"F107248","first_name":"ZHIPENG","last_name":"WANG","classification":"U","division":"OPEN","hit_factor":2.6102},{"match_name":"BRSP Tuesday Night USPSA Match - July 31","match_date":"2018-07-31","stage_classifiercode":"03-07","member_number":"A113144","first_name":"BEAR","last_name":"BRAKAHAUGEN","classification":"U","division":"OPEN","hit_factor":2.6022},{"match_name":"Number 20 at DECAP","match_date":"2021-08-15","stage_classifiercode":"03-07","member_number":"A118328","first_name":"DAN","last_name":"SPRAGUE","classification":"D","division":"OPEN","hit_factor":2.5989},{"match_name":"Griffin USPSA Jan 2020","match_date":"2020-01-17","stage_classifiercode":"03-07","member_number":"TY109224","first_name":"MATT","last_name":"TYREE","classification":"U","division":"OPEN","hit_factor":2.5959},{"match_name":"ECPS USPSA 15 SEP 18","match_date":"2018-09-15","stage_classifiercode":"03-07","member_number":"A34304","first_name":"DONALD","last_name":"DUBOSE","classification":"M","division":"OPEN","hit_factor":2.5909},{"match_name":"DAPS USPSA @ ETTS 10-14-17","match_date":"2017-10-14","stage_classifiercode":"03-07","member_number":"L3571","first_name":"KEN","last_name":"COBB","classification":"M","division":"OPEN","hit_factor":2.5872},{"match_name":"Marc-On Shooting USPSA January 12th","match_date":"2020-01-12","stage_classifiercode":"03-07","member_number":"A108613","first_name":"LOGAN","last_name":"PONTIUS","classification":"U","division":"OPEN","hit_factor":2.5869},{"match_name":"OREGON ARPC CC05 USPSA Feb 11 2017","match_date":"2017-02-11","stage_classifiercode":"03-07","member_number":"PEN","first_name":"RICHARD","last_name":"LAU","classification":"U","division":"OPEN","hit_factor":2.5865},{"match_name":"NRG September 24th 2016","match_date":"2016-09-24","stage_classifiercode":"03-07","member_number":"TY98440","first_name":"JIONG","last_name":"HE","classification":"U","division":"OPEN","hit_factor":2.5753},{"match_name":"October 2015 CAS Match","match_date":"2015-10-04","stage_classifiercode":"03-07","member_number":"A80391","first_name":"JORDAN","last_name":"WALLEY","classification":"C","division":"OPEN","hit_factor":2.5751},{"match_name":"OFGC USPSA Match 8-15-21","match_date":"2021-08-15","stage_classifiercode":"03-07","member_number":"TY111591","first_name":"MARVIN","last_name":"STEWART","classification":"D","division":"OPEN","hit_factor":2.571},{"match_name":"PMRPC USPSA  10Apr21","match_date":"2021-04-10","stage_classifiercode":"03-07","member_number":"A103795","first_name":"MICHELE","last_name":"THOMAS","classification":"C","division":"OPEN","hit_factor":2.5682},{"match_name":"XMG USPSA   Saturday November 6th 2021","match_date":"2021-11-06","stage_classifiercode":"03-07","member_number":"A137357","first_name":"MICHAEL","last_name":"SPRINKLE","classification":"U","division":"OPEN","hit_factor":2.5641},{"match_name":"Briar  Rabbit July Match 2016 OH20","match_date":"2016-07-24","stage_classifiercode":"03-07","member_number":"A88623","first_name":"JAN","last_name":"CRAWMER","classification":"U","division":"OPEN","hit_factor":2.5633},{"match_name":"RPGi USPSA Last Minute Match! 18 July 2021","match_date":"2021-07-18","stage_classifiercode":"03-07","member_number":"A132930","first_name":"ERIC","last_name":"ROBLEDO","classification":"U","division":"OPEN","hit_factor":2.5631},{"match_name":"LTD Pistol - October 2017","match_date":"2017-10-07","stage_classifiercode":"03-07","member_number":"\"\"","first_name":"RAY","last_name":"MONTALBANO","classification":"U","division":"OPEN","hit_factor":2.5587},{"match_name":"PMRPC USPSA  10Apr21","match_date":"2021-04-10","stage_classifiercode":"03-07","member_number":"TY115465","first_name":"DENNIS","last_name":"HILTZ","classification":"C","division":"OPEN","hit_factor":2.5394},{"match_name":"ORSA USPSA August 2017 Match","match_date":"2017-08-16","stage_classifiercode":"03-07","member_number":"A76179","first_name":"WESTON","last_name":"HENSLEY","classification":"U","division":"OPEN","hit_factor":2.5379},{"match_name":"Pioneer Action Shooters Aug 2017 Match","match_date":"2017-08-13","stage_classifiercode":"03-07","member_number":"A101532","first_name":"DENNIS","last_name":"HARRIMAN","classification":"C","division":"OPEN","hit_factor":2.535},{"match_name":"EWPSA 5/15/16","match_date":"2016-05-15","stage_classifiercode":"03-07","member_number":"TY70904","first_name":"MICHAEL","last_name":"GIMERA","classification":"C","division":"OPEN","hit_factor":2.5287},{"match_name":"PMRPC USPSA 12Dec20 - all Classifier","match_date":"2020-12-12","stage_classifiercode":"03-07","member_number":"TY115465","first_name":"DENNIS","last_name":"HILTZ","classification":"D","division":"OPEN","hit_factor":2.5242},{"match_name":"June 12 2021 The Range At True North USPSA Match","match_date":"2021-06-12","stage_classifiercode":"03-07","member_number":"A116868","first_name":"MICHAEL","last_name":"MADUSKE","classification":"U","division":"OPEN","hit_factor":2.5097},{"match_name":"NRG Saturday December 22nd - Includes a Classifier Stage","match_date":"2018-12-22","stage_classifiercode":"03-07","member_number":"A98034","first_name":"RAYMOND","last_name":"IGNACIO","classification":"C","division":"OPEN","hit_factor":2.5097},{"match_name":"SFA USPSA FEBRUARY 2018","match_date":"2018-02-17","stage_classifiercode":"03-07","member_number":"A47970","first_name":"DAVE","last_name":"ABELOE","classification":"A","division":"OPEN","hit_factor":2.4988},{"match_name":"USPSA - Bridgeville","match_date":"2018-09-02","stage_classifiercode":"03-07","member_number":"TY82429","first_name":"DAVID","last_name":"HEALEY 2","classification":"M","division":"OPEN","hit_factor":2.4985},{"match_name":"Colonial Rifle and Pistol Club May 2021","match_date":"2021-05-01","stage_classifiercode":"03-07","member_number":"A124448","first_name":"ALEX","last_name":"KOKIT","classification":"C","division":"OPEN","hit_factor":2.4928},{"match_name":"Rankin Field Sunday USPSA","match_date":"2017-10-15","stage_classifiercode":"03-07","member_number":"A83627","first_name":"HAL","last_name":"ROBERTS","classification":"C","division":"OPEN","hit_factor":2.4919},{"match_name":"2018-10-06 USPSA at Phoenix Rod and Gun Club","match_date":"2018-10-06","stage_classifiercode":"03-07","member_number":"A86012","first_name":"MICHAEL","last_name":"DE BOLT","classification":"C","division":"OPEN","hit_factor":2.4916},{"match_name":"Schultz October 2015","match_date":"2015-10-11","stage_classifiercode":"03-07","member_number":"PEN","first_name":"TONY","last_name":"GIERKE","classification":"Pen","division":"OPEN","hit_factor":2.4894},{"match_name":"JPPS USPSA Club Match 6-2-18","match_date":"2018-06-02","stage_classifiercode":"03-07","member_number":"A89751","first_name":"TONY","last_name":"DIAMOND TENNEY","classification":"C","division":"OPEN","hit_factor":2.4876},{"match_name":"RSPP 3rd Saturday April 2016","match_date":"2016-04-16","stage_classifiercode":"03-07","member_number":"TY33569","first_name":"WALTER","last_name":"KRADIN","classification":"C","division":"OPEN","hit_factor":2.4849},{"match_name":"LIPSA - November 4th 2018 - USPSA Classifier Match","match_date":"2018-11-04","stage_classifiercode":"03-07","member_number":"TY89184","first_name":"ADAM","last_name":"GORDON","classification":"U","division":"OPEN","hit_factor":2.4804},{"match_name":"XMG USPSA   Saturday November 6th 2021","match_date":"2021-11-06","stage_classifiercode":"03-07","member_number":"A74370","first_name":"TIM","last_name":"RODDY","classification":"C","division":"OPEN","hit_factor":2.4655},{"match_name":"Tropang Vegas All Classifier Match","match_date":"2020-12-06","stage_classifiercode":"03-07","member_number":"A89574","first_name":"MARNINO","last_name":"PARAS","classification":"C","division":"OPEN","hit_factor":2.462},{"match_name":"GoShoot Indoors","match_date":"2017-08-13","stage_classifiercode":"03-07","member_number":"TY99801","first_name":"GREG","last_name":"MANNY","classification":"U","division":"OPEN","hit_factor":2.4577},{"match_name":"NRG Saturday November 13th Includes a Classifier Stage","match_date":"2021-11-13","stage_classifiercode":"03-07","member_number":"A37029","first_name":"WILL","last_name":"ALICANTE","classification":"U","division":"OPEN","hit_factor":2.4345},{"match_name":"DSSA 2021-05 USPSA Pistol","match_date":"2021-05-15","stage_classifiercode":"03-07","member_number":"A50114","first_name":"JAMES","last_name":"MARTIN","classification":"B","division":"OPEN","hit_factor":2.4219},{"match_name":"Dundee Practical Shooters - June 27 2020 - Points for Pistol","match_date":"2020-06-27","stage_classifiercode":"03-07","member_number":"L4199","first_name":"JAN","last_name":"MCDONALD","classification":"C","division":"OPEN","hit_factor":2.419},{"match_name":"ECPS USPSA 20 Aug 16","match_date":"2016-08-20","stage_classifiercode":"03-07","member_number":"A94653","first_name":"SHAWN","last_name":"REISS","classification":"C","division":"OPEN","hit_factor":2.4172},{"match_name":"SAPSC Weekly USPSA Fun Match at Autreys Armory 20170919","match_date":"2017-09-19","stage_classifiercode":"03-07","member_number":"A93439","first_name":"CHRIS","last_name":"ELLIS","classification":"B","division":"OPEN","hit_factor":2.4155},{"match_name":"GTS 7.23.16","match_date":"2016-07-23","stage_classifiercode":"03-07","member_number":"TY96065","first_name":"AMY","last_name":"JOHNSON","classification":"U","division":"OPEN","hit_factor":2.4076},{"match_name":"Triforce Practical Shooters at BigWoodsGoods 5-4-17","match_date":"2017-05-04","stage_classifiercode":"03-07","member_number":"A94721","first_name":"BOB","last_name":"MCCOLL","classification":"D","division":"OPEN","hit_factor":2.4},{"match_name":"Cactus USPSA April 2021","match_date":"2021-04-04","stage_classifiercode":"03-07","member_number":"a21152","first_name":"BRIAN","last_name":"MUEGGE","classification":"A","division":"OPEN","hit_factor":2.392},{"match_name":"OREGON ARPC CC05 USPSA Feb 11 2017","match_date":"2017-02-11","stage_classifiercode":"03-07","member_number":"FY51479","first_name":"NANCY","last_name":"MARRS","classification":"D","division":"OPEN","hit_factor":2.3906},{"match_name":"FSTC Classifier - December 2016","match_date":"2016-12-18","stage_classifiercode":"03-07","member_number":"Fy53791","first_name":"MICHAEL","last_name":"OLSON","classification":"C","division":"OPEN","hit_factor":2.3857},{"match_name":"NW15 Port Townsend Practical Pistol USPSA March 7 2020","match_date":"2020-03-07","stage_classifiercode":"03-07","member_number":"A122402","first_name":"CLIFFORD","last_name":"AGUILAR","classification":"U","division":"OPEN","hit_factor":2.3793},{"match_name":"Dundee Practical Shooters - June 27 2020 - Points for Pistol","match_date":"2020-06-27","stage_classifiercode":"03-07","member_number":"TY57679","first_name":"KENNETH","last_name":"KING","classification":"C","division":"OPEN","hit_factor":2.3738},{"match_name":"Minot USPSA 12-11-16","match_date":"2016-12-11","stage_classifiercode":"03-07","member_number":"L3827","first_name":"JEREMY","last_name":"THOMAS","classification":"C","division":"OPEN","hit_factor":2.3704},{"match_name":"October 2015 CAS Match","match_date":"2015-10-04","stage_classifiercode":"03-07","member_number":"\"\"","first_name":"JON","last_name":"MARINO","classification":"Unclassified","division":"OPEN","hit_factor":2.3674},{"match_name":"Chillicothe September USPSA Match","match_date":"2015-09-27","stage_classifiercode":"03-07","member_number":"NONE","first_name":"PATRICK","last_name":"ELLIOTT","classification":"Unclassified","division":"OPEN","hit_factor":2.3641},{"match_name":"WAC August 22nd (4th Sunday) - ALL CLASSIFIER USPSA 6 Stage Match","match_date":"2021-08-22","stage_classifiercode":"03-07","member_number":"A99805","first_name":"BEETHOVEN","last_name":"AWIT","classification":"U","division":"OPEN","hit_factor":2.3589},{"match_name":"BMPSA Apr 21 2018","match_date":"2018-04-21","stage_classifiercode":"03-07","member_number":"A61509","first_name":"LORI","last_name":"JENSEN","classification":"D","division":"OPEN","hit_factor":2.3533},{"match_name":"Oxford OHS05 100321","match_date":"2021-10-03","stage_classifiercode":"03-07","member_number":"A46956","first_name":"CHRIS","last_name":"KEEN","classification":"G","division":"OPEN","hit_factor":2.3501},{"match_name":"EWPSA 5/15/16","match_date":"2016-05-15","stage_classifiercode":"03-07","member_number":"\"\"","first_name":"BOB","last_name":"HAWKS","classification":"\"\"","division":"OPEN","hit_factor":2.3486},{"match_name":"Richmond Hot Shots August 4th-5th USPSA Pistol Match","match_date":"2018-08-04","stage_classifiercode":"03-07","member_number":"\"\"","first_name":"CARLO","last_name":"PABELICO","classification":"C","division":"OPEN","hit_factor":2.3455},{"match_name":"SGC 2/20/21 USPSA 4 stage Classifier Match","match_date":"2021-02-20","stage_classifiercode":"03-07","member_number":"A129336","first_name":"DAVE","last_name":"HOPKINS","classification":"U","division":"OPEN","hit_factor":2.343},{"match_name":"OREGON ARPC CC05 USPSA Feb 11 2017","match_date":"2017-02-11","stage_classifiercode":"03-07","member_number":"A1000962","first_name":"KEVIN","last_name":"MORRILL","classification":"A","division":"OPEN","hit_factor":2.3425},{"match_name":"GoShoot Outdoors April 19th reshoot","match_date":"2020-04-19","stage_classifiercode":"03-07","member_number":"TY99554","first_name":"SASHA","last_name":"DANJCZEK","classification":"C","division":"OPEN","hit_factor":2.33},{"match_name":"Prescott Action Shooters 1st Saturday USPSA 4-3-21","match_date":"2021-04-03","stage_classifiercode":"03-07","member_number":"TY66406","first_name":"PAUL","last_name":"JOHNSON","classification":"C","division":"OPEN","hit_factor":2.3278},{"match_name":"Pioneer Action Shooters Aug 2017 Match","match_date":"2017-08-13","stage_classifiercode":"03-07","member_number":"A96832","first_name":"DOUG","last_name":"FULLER","classification":"D","division":"OPEN","hit_factor":2.3112},{"match_name":"RSPP 3rd Saturday April 2016","match_date":"2016-04-16","stage_classifiercode":"03-07","member_number":"A94645","first_name":"GENE","last_name":"ERICKSON","classification":"U","division":"OPEN","hit_factor":2.3098},{"match_name":"Richmond Hot Shots August 4th-5th USPSA Pistol Match","match_date":"2018-08-04","stage_classifiercode":"03-07","member_number":"10648","first_name":"CARLSON","last_name":"SETO","classification":"D","division":"OPEN","hit_factor":2.3037},{"match_name":"Briar  Rabbit July Match 2016 OH20","match_date":"2016-07-24","stage_classifiercode":"03-07","member_number":"TY66305","first_name":"HERB","last_name":"SMITH","classification":"B","division":"OPEN","hit_factor":2.3028},{"match_name":"G2G July 27th USPSA Match","match_date":"2021-07-27","stage_classifiercode":"03-07","member_number":"TY134553","first_name":"MARK","last_name":"HOPMANN","classification":"D","division":"OPEN","hit_factor":2.3024},{"match_name":"2017 Hawktech Arms Idaho Section Hi-cap Match","match_date":"2017-10-21","stage_classifiercode":"03-07","member_number":"L2117","first_name":"LARRY","last_name":"ALBAUGH","classification":"A","division":"OPEN","hit_factor":2.3023},{"match_name":"BPSA September 2016 USPSA","match_date":"2016-09-25","stage_classifiercode":"03-07","member_number":"A81207","first_name":"CECIL","last_name":"JANISE","classification":"C","division":"OPEN","hit_factor":2.3003},{"match_name":"Springfield Tactical Shooters 08/02/2018","match_date":"2018-08-02","stage_classifiercode":"03-07","member_number":"A99127","first_name":"STEVE","last_name":"FRAZIER","classification":"C","division":"OPEN","hit_factor":2.2983},{"match_name":"OFGC USPSA Match 7/15/2018","match_date":"2018-07-15","stage_classifiercode":"03-07","member_number":"A107288","first_name":"COREY","last_name":"CHURCHILL","classification":"U","division":"OPEN","hit_factor":2.2982},{"match_name":"ARPC USPSA Match 5-28-17","match_date":"2017-05-28","stage_classifiercode":"03-07","member_number":"A93058","first_name":"BRUCE","last_name":"CURRY","classification":"D","division":"OPEN","hit_factor":2.297},{"match_name":"TAC2 USPSA AUGUST 2018","match_date":"2018-08-04","stage_classifiercode":"03-07","member_number":"\"\"","first_name":"DANIEL","last_name":"ELLIS","classification":"U","division":"OPEN","hit_factor":2.2965},{"match_name":"RSPP 3rd Saturday April 2016","match_date":"2016-04-16","stage_classifiercode":"03-07","member_number":"FY74679","first_name":"RICHARD","last_name":"FORGUE","classification":"D","division":"OPEN","hit_factor":2.2959},{"match_name":"Ontelaunee USPSA April 2017","match_date":"2017-04-22","stage_classifiercode":"03-07","member_number":"TY41042","first_name":"JOSEPH","last_name":"PROCOPIO","classification":"M","division":"OPEN","hit_factor":2.2905},{"match_name":"LTD Pistol - October 2017","match_date":"2017-10-07","stage_classifiercode":"03-07","member_number":"L3808","first_name":"MARK","last_name":"BROWN","classification":"B","division":"OPEN","hit_factor":2.2891},{"match_name":"CCPS 20170625","match_date":"2017-06-25","stage_classifiercode":"03-07","member_number":"A61105","first_name":"SANDRA","last_name":"SOTO","classification":"C","division":"OPEN","hit_factor":2.2888},{"match_name":"INAS Oct 2020 USPSA","match_date":"2020-10-10","stage_classifiercode":"03-07","member_number":"TY105651","first_name":"DALE","last_name":"FORREST","classification":"C","division":"OPEN","hit_factor":2.2769},{"match_name":"CGGR November USPSA Match","match_date":"2017-11-18","stage_classifiercode":"03-07","member_number":"TY99801","first_name":"GREG","last_name":"MANNY","classification":"U","division":"OPEN","hit_factor":2.2379},{"match_name":"Afternoon SMPS 09 February 2020 USPSA Classifier Match","match_date":"2020-02-09","stage_classifiercode":"03-07","member_number":"L4636","first_name":"BARRON","last_name":"ROPER","classification":"C","division":"OPEN","hit_factor":2.2234},{"match_name":"LdF USPSA Match January 13 2018","match_date":"2018-01-13","stage_classifiercode":"03-07","member_number":"\"\"","first_name":"JUSTIN","last_name":"STUART","classification":"U","division":"OPEN","hit_factor":2.2202},{"match_name":"ORSA USPSA October 2015","match_date":"2015-10-17","stage_classifiercode":"03-07","member_number":"012345","first_name":"TIM","last_name":"FOWLER","classification":"U","division":"OPEN","hit_factor":2.2162},{"match_name":"Swamp Eagles 2016-04 Pistol","match_date":"2016-04-17","stage_classifiercode":"03-07","member_number":"A96301","first_name":"SAM","last_name":"PATTANAIK","classification":"U","division":"OPEN","hit_factor":2.2041},{"match_name":"LCSC Linden USPSA 082221","match_date":"2021-08-21","stage_classifiercode":"03-07","member_number":"TY107336","first_name":"JACKIE","last_name":"ZHAO","classification":"C","division":"OPEN","hit_factor":2.2026},{"match_name":"YMM  IPSC 2018_08_12","match_date":"2018-08-12","stage_classifiercode":"03-07","member_number":"A34448","first_name":"LARRY","last_name":"LEBEAU","classification":"A","division":"OPEN","hit_factor":2.1951},{"match_name":"EWPSA 5/15/16","match_date":"2016-05-15","stage_classifiercode":"03-07","member_number":"A67259","first_name":"CHAD","last_name":"SHUMAN","classification":"U","division":"OPEN","hit_factor":2.1944},{"match_name":"CGC 2016-05-14","match_date":"2016-05-14","stage_classifiercode":"03-07","member_number":"A36675","first_name":"ROBERT","last_name":"SINCLAIR SR","classification":"C","division":"OPEN","hit_factor":2.1845},{"match_name":"Mapsa 2017 O8 12","match_date":"2017-08-11","stage_classifiercode":"03-07","member_number":"TY3634","first_name":"GREG","last_name":"THOMAS","classification":"B","division":"OPEN","hit_factor":2.1821},{"match_name":"SCAPSA MN05 Spring League 3","match_date":"2017-04-24","stage_classifiercode":"03-07","member_number":"\"\"","first_name":"GUY","last_name":"ASMUS","classification":"U","division":"OPEN","hit_factor":2.1818},{"match_name":"Ontelaunee USPSA September 2015","match_date":"2015-09-27","stage_classifiercode":"03-07","member_number":"\"\"","first_name":"ERIC","last_name":"GORTER","classification":"X","division":"OPEN","hit_factor":2.1745},{"match_name":"Detroit Sportsmens Congress - August 20 2017","match_date":"2017-08-20","stage_classifiercode":"03-07","member_number":"L3614","first_name":"DIANE","last_name":"PALANSKY","classification":"C","division":"OPEN","hit_factor":2.1708},{"match_name":"WGC WI USPSA Monthly Match 12-16-17","match_date":"2017-12-16","stage_classifiercode":"03-07","member_number":"FY76857","first_name":"MIKE","last_name":"ESSER","classification":"C","division":"OPEN","hit_factor":2.1627},{"match_name":"Mn16 FIRING LINE USPSA 03-03-20","match_date":"2020-03-03","stage_classifiercode":"03-07","member_number":"A101573","first_name":"DUX","last_name":"PAMBUENA","classification":"U","division":"OPEN","hit_factor":2.159},{"match_name":"Chillicothe September USPSA Match","match_date":"2015-09-27","stage_classifiercode":"03-07","member_number":"A91334","first_name":"WILLIAM","last_name":"SIDELL","classification":"C","division":"OPEN","hit_factor":2.1486},{"match_name":"Hawkeye Gun Club February 2016","match_date":"2016-02-20","stage_classifiercode":"03-07","member_number":"Fy66122","first_name":"SAM","last_name":"BLAZIER","classification":"U","division":"OPEN","hit_factor":2.1478},{"match_name":"Richmond Hot Shots August 4th-5th USPSA Pistol Match","match_date":"2018-08-04","stage_classifiercode":"03-07","member_number":"A80595","first_name":"EDGAR","last_name":"ALLAS","classification":"C","division":"OPEN","hit_factor":2.1314},{"match_name":"SAPSC Monthly USPSA Classifier Match 20150908","match_date":"2015-09-08","stage_classifiercode":"03-07","member_number":"A82368","first_name":"GEORGE","last_name":"BREHM","classification":"D","division":"OPEN","hit_factor":2.127},{"match_name":"RCPS USPSA April 21","match_date":"2018-04-21","stage_classifiercode":"03-07","member_number":"A96294","first_name":"WANNITSA","last_name":"GOMEZ","classification":"C","division":"OPEN","hit_factor":2.123},{"match_name":"WSRC USPSA 5-19-2018","match_date":"2018-05-19","stage_classifiercode":"03-07","member_number":"A89931","first_name":"RANDY","last_name":"WILLIAMS","classification":"U","division":"OPEN","hit_factor":2.1178},{"match_name":"Rio Grande Practical Shooting Club - September 5 2020","match_date":"2020-09-05","stage_classifiercode":"03-07","member_number":"TY115092","first_name":"MICHELLE","last_name":"CULPEPPER","classification":"C","division":"OPEN","hit_factor":2.1124},{"match_name":"Cactus USPSA April 2021","match_date":"2021-04-04","stage_classifiercode":"03-07","member_number":"Tu28855","first_name":"PHILLIP","last_name":"GALLEGOS","classification":"A","division":"OPEN","hit_factor":2.0999},{"match_name":"BRRC USPSA April 9 2016","match_date":"2016-04-09","stage_classifiercode":"03-07","member_number":"A94892","first_name":"CHELSEA","last_name":"PARKER","classification":"Unclassified","division":"OPEN","hit_factor":2.0859},{"match_name":"Medford USPSA June 2016 Match","match_date":"2016-06-19","stage_classifiercode":"03-07","member_number":"A63155","first_name":"CHARLIE","last_name":"HALVORSEN","classification":"C","division":"OPEN","hit_factor":2.0851},{"match_name":"WTPS USPSA November 13th","match_date":"2021-11-13","stage_classifiercode":"03-07","member_number":"TY95627","first_name":"RYNN","last_name":"SMITH","classification":"B","division":"OPEN","hit_factor":2.0848},{"match_name":"NCPS USPSA Handgun Match August 28 2016","match_date":"2016-08-28","stage_classifiercode":"03-07","member_number":"A63254","first_name":"EMMANUEL","last_name":"BUENO","classification":"C","division":"OPEN","hit_factor":2.0578},{"match_name":"HOPS USPSA 052116","match_date":"2016-05-21","stage_classifiercode":"03-07","member_number":"TY86727","first_name":"GEORGE","last_name":"MORASCH","classification":"U","division":"OPEN","hit_factor":2.0561},{"match_name":"PMSC May 2017","match_date":"2017-05-07","stage_classifiercode":"03-07","member_number":"a93980","first_name":"KEN","last_name":"LALIBERTE","classification":"C","division":"OPEN","hit_factor":2.0506},{"match_name":"Oxford OHS05 100321","match_date":"2021-10-03","stage_classifiercode":"03-07","member_number":"L4418","first_name":"MIKE","last_name":"GIVEN","classification":"C","division":"OPEN","hit_factor":2.0479},{"match_name":"NCPS USPSA Handgun Match August 28 2016","match_date":"2016-08-28","stage_classifiercode":"03-07","member_number":"TY17701","first_name":"BERNARDO","last_name":"DIONISIO","classification":"B","division":"OPEN","hit_factor":2.0459},{"match_name":"MCAS USPSA October 2016","match_date":"2016-10-15","stage_classifiercode":"03-07","member_number":"A95730","first_name":"PATTI","last_name":"LAHAIE","classification":"D","division":"OPEN","hit_factor":2.0408},{"match_name":"Tropang Vegas All Classifier Match","match_date":"2021-07-11","stage_classifiercode":"03-07","member_number":"A130892","first_name":"CHUCKY","last_name":"COLINARES","classification":"Unclassified","division":"OPEN","hit_factor":2.0342},{"match_name":"Piscataqua  Master Blasters USPSA Monthly","match_date":"2018-08-05","stage_classifiercode":"03-07","member_number":"A4665","first_name":"LIGHTNIN LARRY","last_name":"HUSSEY","classification":"A","division":"OPEN","hit_factor":2.0323},{"match_name":"BRRC USPSA April 9 2016","match_date":"2016-04-09","stage_classifiercode":"03-07","member_number":"TY80998","first_name":"JIM","last_name":"ROTHBARTH","classification":"C","division":"OPEN","hit_factor":2.0088},{"match_name":"Extreme GM USPSA 5-8","match_date":"2021-05-05","stage_classifiercode":"03-07","member_number":"A82594","first_name":"JUDY","last_name":"MACKOWSKI","classification":"B","division":"OPEN","hit_factor":1.9815},{"match_name":"PMSC May 2017","match_date":"2017-05-07","stage_classifiercode":"03-07","member_number":"A-90924","first_name":"SOPHIA","last_name":"SMITH","classification":"U","division":"OPEN","hit_factor":1.9771},{"match_name":"NRG Saturday December 22nd - Includes a Classifier Stage","match_date":"2018-12-22","stage_classifiercode":"03-07","member_number":"TY78877","first_name":"TOMMY","last_name":"HANDOJO","classification":"B","division":"OPEN","hit_factor":1.9766},{"match_name":"Richmond Classifier Match January 24-2016","match_date":"2016-01-24","stage_classifiercode":"03-07","member_number":"A83559","first_name":"JOHN","last_name":"DANPOUR","classification":"U","division":"OPEN","hit_factor":1.9759},{"match_name":"OK15 USPSA at USSA","match_date":"2016-12-11","stage_classifiercode":"03-07","member_number":"30136","first_name":"JERRY","last_name":"QUISENBERRY","classification":"B","division":"OPEN","hit_factor":1.9709},{"match_name":"BRSP Tuesday Night USPSA Match - July 31","match_date":"2018-07-31","stage_classifiercode":"03-07","member_number":"\"\"","first_name":"JASON","last_name":"WOOD","classification":"\"\"","division":"OPEN","hit_factor":1.9703},{"match_name":"Pathfinder June USPSA Match","match_date":"2020-06-21","stage_classifiercode":"03-07","member_number":"A128316","first_name":"CHRIS","last_name":"LOTEY","classification":"U","division":"OPEN","hit_factor":1.9643},{"match_name":"Pioneer Action Shooters Aug 2017 Match","match_date":"2017-08-13","stage_classifiercode":"03-07","member_number":"A70161","first_name":"ROGER","last_name":"BINKERD","classification":"D","division":"OPEN","hit_factor":1.9627},{"match_name":"Oxford OHS05 100321","match_date":"2021-10-03","stage_classifiercode":"03-07","member_number":"A135398","first_name":"JOEY","last_name":"FAIRCHILD","classification":"U","division":"OPEN","hit_factor":1.9595},{"match_name":"April 2021 USPSA Match at C and C Indoor Range","match_date":"2021-04-20","stage_classifiercode":"03-07","member_number":"\"\"","first_name":"CARSON","last_name":"HARRELL","classification":"U","division":"OPEN","hit_factor":1.9573},{"match_name":"Griffin USPSA Jan 2020","match_date":"2020-01-17","stage_classifiercode":"03-07","member_number":"A124192","first_name":"PAUL","last_name":"HALLAS","classification":"","division":"OPEN","hit_factor":1.9458},{"match_name":"FVPS September USPSA Match","match_date":"2016-09-03","stage_classifiercode":"03-07","member_number":"Fy53791","first_name":"MICHAEL","last_name":"OLSON","classification":"C","division":"OPEN","hit_factor":1.9444},{"match_name":"DRRC USPSA Mar2018","match_date":"2018-03-03","stage_classifiercode":"03-07","member_number":"TY82604","first_name":"LISA","last_name":"RYAN","classification":"D","division":"OPEN","hit_factor":1.942},{"match_name":"Afternoon SMPS 12 July 2020 USPSA Classifier Match","match_date":"2020-07-12","stage_classifiercode":"03-07","member_number":"A96731","first_name":"HOWARD","last_name":"KYMPTON","classification":"D","division":"OPEN","hit_factor":1.935},{"match_name":"Castlewood USPSA August 2020 shoot","match_date":"2020-08-22","stage_classifiercode":"03-07","member_number":"FY90924","first_name":"SOPHIA","last_name":"SMITH","classification":"B","division":"OPEN","hit_factor":1.9321},{"match_name":"HLSL 12-09-2018","match_date":"2018-12-09","stage_classifiercode":"03-07","member_number":"A88485","first_name":"BHONG","last_name":"DELOS SANTOS","classification":"U","division":"OPEN","hit_factor":1.9315},{"match_name":"Tropang Vegas All Classifier Match","match_date":"2021-07-11","stage_classifiercode":"03-07","member_number":"Ty128690","first_name":"MARK","last_name":"SANDI","classification":"Unclassified","division":"OPEN","hit_factor":1.9247},{"match_name":"PGC USPSA Practice Match 5-30-17","match_date":"2017-05-30","stage_classifiercode":"03-07","member_number":"TY78821","first_name":"STEVE","last_name":"GIRARD","classification":"C","division":"OPEN","hit_factor":1.9153},{"match_name":"Triforce Practical Shooters at BigWoodsGoods 5-4-17","match_date":"2017-05-04","stage_classifiercode":"03-07","member_number":"\"\"","first_name":"ALLEN","last_name":"DEAN","classification":"U","division":"OPEN","hit_factor":1.9124},{"match_name":"TPS USPSA AT CMP MARCH 20 2021","match_date":"2021-03-20","stage_classifiercode":"03-07","member_number":"FY119892","first_name":"QUINCY","last_name":"MCDONALD","classification":"C","division":"OPEN","hit_factor":1.9045},{"match_name":"Matamoras  USPSA July 2018","match_date":"2018-07-15","stage_classifiercode":"03-07","member_number":"A99130","first_name":"AMEET","last_name":"DAS","classification":"U","division":"OPEN","hit_factor":1.8995},{"match_name":"OREGON ARPC CC05 USPSA Feb 11 2017","match_date":"2017-02-11","stage_classifiercode":"03-07","member_number":"\"\"","first_name":"STEVE","last_name":"NELSON","classification":"U","division":"OPEN","hit_factor":1.8916},{"match_name":"Ontelaunee USPSA April 2017","match_date":"2017-04-22","stage_classifiercode":"03-07","member_number":"A93288","first_name":"DONNA","last_name":"ROMIG","classification":"D","division":"OPEN","hit_factor":1.888},{"match_name":"SFPS 8-23-20 USPSA","match_date":"2020-08-23","stage_classifiercode":"03-07","member_number":"TY62740","first_name":"DAVE","last_name":"SOMMERS","classification":"B","division":"OPEN","hit_factor":1.8809},{"match_name":"EWPSA 5/15/16","match_date":"2016-05-15","stage_classifiercode":"03-07","member_number":"A80665","first_name":"SAMANTHA","last_name":"JOYNER","classification":"C","division":"OPEN","hit_factor":1.8798},{"match_name":"Caja del Rio - March 2016","match_date":"2016-03-19","stage_classifiercode":"03-07","member_number":"FY29737","first_name":"MICHAEL","last_name":"TAYLOR","classification":"B","division":"OPEN","hit_factor":1.8648},{"match_name":"March 13 2021 The Range At True North USPSA Match","match_date":"2021-03-13","stage_classifiercode":"03-07","member_number":"A129373","first_name":"RON","last_name":"BRASWELL","classification":"U","division":"OPEN","hit_factor":1.841},{"match_name":"Pioneer Action Shooters Aug 2017 Match","match_date":"2017-08-13","stage_classifiercode":"03-07","member_number":"TY67480","first_name":"MICHAEL","last_name":"MAYNARD","classification":"D","division":"OPEN","hit_factor":1.8406},{"match_name":"SPSA USPSA December 4th Sat match","match_date":"2017-12-23","stage_classifiercode":"03-07","member_number":"L3896","first_name":"CHRIS","last_name":"WILLAUER","classification":"C","division":"OPEN","hit_factor":1.8355},{"match_name":"GCL May 6-2017","match_date":"2017-05-06","stage_classifiercode":"03-07","member_number":"TY30343","first_name":"BILL","last_name":"KRYSTAN","classification":"B","division":"OPEN","hit_factor":1.8322},{"match_name":"NPCCC 09-02-2018 USPSA","match_date":"2018-09-02","stage_classifiercode":"03-07","member_number":"TY51788","first_name":"JOHN","last_name":"ORNELAS","classification":"B","division":"OPEN","hit_factor":1.8096},{"match_name":"SCS USPSA Oct 25 2015","match_date":"2015-10-24","stage_classifiercode":"03-07","member_number":"a45162","first_name":"SUSAN","last_name":"RONNING","classification":"C","division":"OPEN","hit_factor":1.8043},{"match_name":"Tropang Vegas All Classifier Match","match_date":"2020-12-06","stage_classifiercode":"03-07","member_number":"L1552","first_name":"JUN","last_name":"ISIDORO","classification":"A","division":"OPEN","hit_factor":1.7993},{"match_name":"NTPS-SE January 2017","match_date":"2017-01-21","stage_classifiercode":"03-07","member_number":"A96410","first_name":"DAVID","last_name":"MONGEON","classification":"D","division":"OPEN","hit_factor":1.7947},{"match_name":"USPSA","match_date":"2020-07-26","stage_classifiercode":"03-07","member_number":"A86358","first_name":"THOMAS","last_name":"MAGYAR","classification":"U","division":"OPEN","hit_factor":1.7834},{"match_name":"CGGR November USPSA Match","match_date":"2017-11-18","stage_classifiercode":"03-07","member_number":"A106617","first_name":"CAITLIN","last_name":"PARHAM","classification":"U","division":"OPEN","hit_factor":1.7828},{"match_name":"WTPS USPSA March Classifier 3-10-18","match_date":"2018-03-10","stage_classifiercode":"03-07","member_number":"TY85410","first_name":"CHAD","last_name":"SANDERS","classification":"B","division":"OPEN","hit_factor":1.7773},{"match_name":"Colonial Rifle and Pistol Club May 2021","match_date":"2021-05-01","stage_classifiercode":"03-07","member_number":"A120461","first_name":"ALEX","last_name":"ESPIRITU","classification":"D","division":"OPEN","hit_factor":1.7665},{"match_name":"CCPS 20170625","match_date":"2017-06-25","stage_classifiercode":"03-07","member_number":"TY69880","first_name":"RICHARD","last_name":"SEALS","classification":"C","division":"OPEN","hit_factor":1.7599},{"match_name":"Pioneer Action Shooters Aug 2017 Match","match_date":"2017-08-13","stage_classifiercode":"03-07","member_number":"\"\"","first_name":"WAYNE","last_name":"CORMIER SR.","classification":"U","division":"OPEN","hit_factor":1.7503},{"match_name":"Competitive Shooters of Lake Norman CORNELIUS Thursday Evening Indoor USPSA Pistol Match North Carolina","match_date":"2018-05-03","stage_classifiercode":"03-07","member_number":"PEN","first_name":"JASON","last_name":"ABOODY","classification":"U","division":"OPEN","hit_factor":1.7327},{"match_name":"PSoCA May 2018 Match CAGC","match_date":"2018-05-06","stage_classifiercode":"03-07","member_number":"A39393","first_name":"JERRY","last_name":"FRY","classification":"C","division":"OPEN","hit_factor":1.7217},{"match_name":"Colonial Rifle and Pistol Club May 2021","match_date":"2021-05-01","stage_classifiercode":"03-07","member_number":"A111239","first_name":"GENE","last_name":"RAGUCCI","classification":"D","division":"OPEN","hit_factor":1.7116},{"match_name":"Pioneer Action Shooters Aug 2017 Match","match_date":"2017-08-13","stage_classifiercode":"03-07","member_number":"\"\"","first_name":"CHIP","last_name":"MARK","classification":"U","division":"OPEN","hit_factor":1.6943},{"match_name":"EWPSA 5/15/16","match_date":"2016-05-15","stage_classifiercode":"03-07","member_number":"A54667","first_name":"MIKE","last_name":"GOOD","classification":"B","division":"OPEN","hit_factor":1.6861},{"match_name":"JCSSA NOV 7 2020","match_date":"2020-11-07","stage_classifiercode":"03-07","member_number":"A111665","first_name":"CRAIG","last_name":"KILLEN (BD)","classification":"B","division":"OPEN","hit_factor":1.6793},{"match_name":"Dundee Practical Shooters - June 27 2020 - Points for Pistol","match_date":"2020-06-27","stage_classifiercode":"03-07","member_number":"A122448","first_name":"DENNIS","last_name":"MCCOLLUM","classification":"D","division":"OPEN","hit_factor":1.6647},{"match_name":"LBAS180217","match_date":"2018-02-17","stage_classifiercode":"03-07","member_number":"FY60230","first_name":"ROBERT","last_name":"BALES","classification":"C","division":"OPEN","hit_factor":1.6644},{"match_name":"NCPS USPSA Handgun Match August 28 2016","match_date":"2016-08-28","stage_classifiercode":"03-07","member_number":"TY68979","first_name":"GRIFFIN","last_name":"GUMAGAY","classification":"A","division":"OPEN","hit_factor":1.6565},{"match_name":"Dundee Practical Shooters - June 27 2020 - Points for Pistol","match_date":"2020-06-27","stage_classifiercode":"03-07","member_number":"A128507","first_name":"YARIK","last_name":"GRITSIOUK","classification":"U","division":"OPEN","hit_factor":1.6519},{"match_name":"FSTC Classifier - December 2016","match_date":"2016-12-18","stage_classifiercode":"03-07","member_number":"\"\"","first_name":"RUSH","last_name":"ROTH","classification":"U","division":"OPEN","hit_factor":1.6486},{"match_name":"Sage Pistol League USPSA  August 15 2021","match_date":"2021-08-15","stage_classifiercode":"03-07","member_number":"Ty29486","first_name":"KEVIN","last_name":"KING","classification":"B","division":"OPEN","hit_factor":1.6174},{"match_name":"LdF USPSA Match January 13 2018","match_date":"2018-01-13","stage_classifiercode":"03-07","member_number":"\"\"","first_name":"JOE","last_name":"SUN","classification":"U","division":"OPEN","hit_factor":1.6141},{"match_name":"GPS USPSA July 2021","match_date":"2021-07-25","stage_classifiercode":"03-07","member_number":"000000","first_name":"DANIEL","last_name":"FIGUEROA","classification":"U","division":"OPEN","hit_factor":1.597},{"match_name":"MPSA 072118 USPS","match_date":"2018-07-21","stage_classifiercode":"03-07","member_number":"A21224","first_name":"LOREN","last_name":"BAKER","classification":"C","division":"OPEN","hit_factor":1.5903},{"match_name":"BPSA September 2016 USPSA","match_date":"2016-09-25","stage_classifiercode":"03-07","member_number":"A94846","first_name":"RUTH","last_name":"MAHLEY","classification":"D","division":"OPEN","hit_factor":1.5772},{"match_name":"Chillicothe September USPSA Match","match_date":"2015-09-27","stage_classifiercode":"03-07","member_number":"PEN","first_name":"THERESA","last_name":"KOWALSKI","classification":"Unclassified","division":"OPEN","hit_factor":1.5571},{"match_name":"Minot USPSA 12-11-16","match_date":"2016-12-11","stage_classifiercode":"03-07","member_number":"A52173","first_name":"WESLEY","last_name":"THOMAS","classification":"B","division":"OPEN","hit_factor":1.5564},{"match_name":"April 2017 Devil Dog USPSA  at The Range","match_date":"2017-04-23","stage_classifiercode":"03-07","member_number":"A81138","first_name":"CHRISTOPHER","last_name":"GARRETT","classification":"C","division":"OPEN","hit_factor":1.5446},{"match_name":"Richmond Hot Shots August 4th-5th USPSA Pistol Match","match_date":"2018-08-04","stage_classifiercode":"03-07","member_number":"\"\"","first_name":"ZHIFENG","last_name":"ZHAO","classification":"U","division":"OPEN","hit_factor":1.5431},{"match_name":"Renton USPSA - April 2021 - NW05","match_date":"2021-04-25","stage_classifiercode":"03-07","member_number":"A110099","first_name":"HAROLD","last_name":"MARTINEZ","classification":"A","division":"OPEN","hit_factor":1.5273},{"match_name":"WAC August 22nd (4th Sunday) - ALL CLASSIFIER USPSA 6 Stage Match","match_date":"2021-08-22","stage_classifiercode":"03-07","member_number":"Ty103450","first_name":"RICK","last_name":"HINKLE","classification":"A","division":"OPEN","hit_factor":1.5251},{"match_name":"CGGR November USPSA Match","match_date":"2017-11-18","stage_classifiercode":"03-07","member_number":"L4056","first_name":"DILLION","last_name":"WALKER","classification":"B","division":"OPEN","hit_factor":1.5214},{"match_name":"Siouxland Practical Shooters Hawkeye Outdoor 4/10/21","match_date":"2021-04-10","stage_classifiercode":"03-07","member_number":"ty119416","first_name":"VIC","last_name":"MCKENNA","classification":"D","division":"OPEN","hit_factor":1.5119},{"match_name":"OREGON ARPC CC05 USPSA Feb 11 2017","match_date":"2017-02-11","stage_classifiercode":"03-07","member_number":"TY80056","first_name":"DAVE","last_name":"SAXON","classification":"D","division":"OPEN","hit_factor":1.5118},{"match_name":"SAPSA February 2020 Match","match_date":"2020-02-15","stage_classifiercode":"03-07","member_number":"A124129","first_name":"LAURENCE","last_name":"UY","classification":"U","division":"OPEN","hit_factor":1.5118},{"match_name":"LBAS 180818","match_date":"2018-08-18","stage_classifiercode":"03-07","member_number":"FY60230","first_name":"BOB","last_name":"BALES","classification":"C","division":"OPEN","hit_factor":1.4911},{"match_name":"NW15 Port Townsend Practical Pistol USPSA March 7 2020","match_date":"2020-03-07","stage_classifiercode":"03-07","member_number":"A88243","first_name":"KRIS","last_name":"MCGAUGHEY","classification":"C","division":"OPEN","hit_factor":1.4755},{"match_name":"LCSC Linden USPSA 082221","match_date":"2021-08-21","stage_classifiercode":"03-07","member_number":"TY94643","first_name":"CARLSON","last_name":"SETO","classification":"B","division":"OPEN","hit_factor":1.4753},{"match_name":"OFGC USPSA Match 7/15/2018","match_date":"2018-07-15","stage_classifiercode":"03-07","member_number":"TY96272","first_name":"KELLY","last_name":"BROWN","classification":"C","division":"OPEN","hit_factor":1.4376},{"match_name":"Ontelaunee USPSA September 2015","match_date":"2015-09-27","stage_classifiercode":"03-07","member_number":"A92692","first_name":"JAMES","last_name":"BESHADA","classification":"U","division":"OPEN","hit_factor":1.4301},{"match_name":"Cactus USPSA April 2021","match_date":"2021-04-04","stage_classifiercode":"03-07","member_number":"A131779","first_name":"SCOTT","last_name":"ROWE","classification":"D","division":"OPEN","hit_factor":1.4275},{"match_name":"LCAS April 2017 USPSA","match_date":"2017-04-01","stage_classifiercode":"03-07","member_number":"\"\"","first_name":"DANIEL","last_name":"SCHMITT","classification":"U","division":"OPEN","hit_factor":1.4112},{"match_name":"2017 Hawktech Arms Idaho Section Hi-cap Match","match_date":"2017-10-21","stage_classifiercode":"03-07","member_number":"A70079","first_name":"CAROL","last_name":"MATTERN","classification":"U","division":"OPEN","hit_factor":1.405},{"match_name":"Chillicothe September USPSA Match","match_date":"2015-09-27","stage_classifiercode":"03-07","member_number":"PEN","first_name":"THERESA","last_name":"KOWALSKI","classification":"Unclassified","division":"OPEN","hit_factor":1.3728},{"match_name":"WTPS USPSA March Classifier 3-10-18","match_date":"2018-03-10","stage_classifiercode":"03-07","member_number":"\"\"","first_name":"MICHAEL","last_name":"RAUSCHUBER","classification":"U","division":"OPEN","hit_factor":1.3688},{"match_name":"Ontelaunee USPSA April 2017","match_date":"2017-04-22","stage_classifiercode":"03-07","member_number":"A101299","first_name":"BILL","last_name":"ROMIG","classification":"U","division":"OPEN","hit_factor":1.3556},{"match_name":"RISE Indoor Shooting","match_date":"2018-05-19","stage_classifiercode":"03-07","member_number":"\"\"","first_name":"OMAR","last_name":"ALEMAN","classification":"G","division":"OPEN","hit_factor":1.3306},{"match_name":"Griffin USPSA AUG 2018","match_date":"2018-08-18","stage_classifiercode":"03-07","member_number":"Ty62771","first_name":"JERRY","last_name":"BLAND","classification":"C","division":"OPEN","hit_factor":1.3168},{"match_name":"BRRC USPSA April 9 2016","match_date":"2016-04-09","stage_classifiercode":"03-07","member_number":"PENDING","first_name":"JULIE","last_name":"ALEJO","classification":"Unclassified","division":"OPEN","hit_factor":1.2864},{"match_name":"Dundee Practical Shooters - June 27 2020 - Points for Pistol","match_date":"2020-06-27","stage_classifiercode":"03-07","member_number":"A113796","first_name":"COLIN","last_name":"TYLER","classification":"U","division":"OPEN","hit_factor":1.2706},{"match_name":"GoShoot Indoors","match_date":"2017-08-13","stage_classifiercode":"03-07","member_number":"\"\"","first_name":"CHUCK","last_name":"STEWART","classification":"U","division":"OPEN","hit_factor":1.2695},{"match_name":"DAPS USPSA at ETTS 4-9-2016","match_date":"2016-04-09","stage_classifiercode":"03-07","member_number":"PENDING","first_name":"TONY","last_name":"WURST","classification":"U","division":"OPEN","hit_factor":1.244},{"match_name":"Afternoon SMPS 12 July 2020 USPSA Classifier Match","match_date":"2020-07-12","stage_classifiercode":"03-07","member_number":"A111301","first_name":"RAYMOND S.","last_name":"SCHRIDER","classification":"U","division":"OPEN","hit_factor":1.2389},{"match_name":"NHRPC - October 2020 USPSA","match_date":"2020-10-10","stage_classifiercode":"03-07","member_number":"Ty103917","first_name":"PHIL","last_name":"GRAY","classification":"C","division":"OPEN","hit_factor":1.2379},{"match_name":"North Lawrence Fish And Game USPSA 10/17/20","match_date":"2020-10-17","stage_classifiercode":"03-07","member_number":"TY63998","first_name":"MARTIN","last_name":"LEI","classification":"C","division":"OPEN","hit_factor":1.2028},{"match_name":"Triforce Practical Shooters at BigWoodsGoods 5-4-17","match_date":"2017-05-04","stage_classifiercode":"03-07","member_number":"Ty85797","first_name":"GARY","last_name":"WILLIAMS","classification":"C","division":"OPEN","hit_factor":1.2005},{"match_name":"ORPCI USPSA Saturday 2021.10.16","match_date":"2021-10-16","stage_classifiercode":"03-07","member_number":"TY48388","first_name":"SUE","last_name":"VANBLARICUM","classification":"B","division":"OPEN","hit_factor":1.1966},{"match_name":"NPCCC 09-02-2018 USPSA","match_date":"2018-09-02","stage_classifiercode":"03-07","member_number":"\"\"","first_name":"DANIEL","last_name":"DE GOEY","classification":"U","division":"OPEN","hit_factor":1.1882},{"match_name":"PGC May 2021 USPSA ","match_date":"2021-04-30","stage_classifiercode":"03-07","member_number":"NONE","first_name":"CHRISTI","last_name":"BENNETT","classification":"U","division":"OPEN","hit_factor":1.1618},{"match_name":"NRG Saturday November 13th Includes a Classifier Stage","match_date":"2021-11-13","stage_classifiercode":"03-07","member_number":"TY23403","first_name":"TIM","last_name":"MOROSCO","classification":"B","division":"OPEN","hit_factor":1.1392},{"match_name":"HLSL 12-09-2018","match_date":"2018-12-09","stage_classifiercode":"03-07","member_number":"TY88075","first_name":"WILLIAM","last_name":"SORIANO","classification":"U","division":"OPEN","hit_factor":1.1084},{"match_name":"Colonial Rifle and Pistol Club May 2021","match_date":"2021-05-01","stage_classifiercode":"03-07","member_number":"A133611","first_name":"LISA","last_name":"NAPOLITANO","classification":"U","division":"OPEN","hit_factor":1.1014},{"match_name":"USPSA - Bridgeville","match_date":"2018-09-02","stage_classifiercode":"03-07","member_number":"\"\"","first_name":"ABIGAIL","last_name":"DUDA","classification":"\"\"","division":"OPEN","hit_factor":1.1},{"match_name":"LdF 2nd Saturday USPSA Match","match_date":"2016-12-10","stage_classifiercode":"03-07","member_number":"PEN","first_name":"LONNIE","last_name":"BARBANI","classification":"D","division":"OPEN","hit_factor":1.0984},{"match_name":"SAPSA September 2018","match_date":"2018-09-15","stage_classifiercode":"03-07","member_number":"\"\"","first_name":"ALVIN","last_name":"ESPEDIDO","classification":"U","division":"OPEN","hit_factor":1.0837},{"match_name":"Extreme GM USPSA 5-8","match_date":"2021-05-05","stage_classifiercode":"03-07","member_number":"A98509","first_name":"JOEY","last_name":"EMPAMANO","classification":"B","division":"OPEN","hit_factor":1.0293},{"match_name":"FSTC Classifier - December 2016","match_date":"2016-12-18","stage_classifiercode":"03-07","member_number":"A20556","first_name":"DON","last_name":"ZIMMERMAN","classification":"B","division":"OPEN","hit_factor":1.0276},{"match_name":"SLOSA March 2018 USPSA MATCH","match_date":"2018-03-10","stage_classifiercode":"03-07","member_number":"A4449","first_name":"DANNY","last_name":"VILLAMIN","classification":"M","division":"OPEN","hit_factor":1.0239},{"match_name":"SFPC December 3 2017 USPSA Match","match_date":"2017-12-03","stage_classifiercode":"03-07","member_number":"TY36452","first_name":"SERGIO","last_name":"NUNEZ","classification":"A","division":"OPEN","hit_factor":0.9877},{"match_name":"RCPS USPSA April 21","match_date":"2018-04-21","stage_classifiercode":"03-07","member_number":"A94406","first_name":"MARY","last_name":"RICHARDS","classification":"D","division":"OPEN","hit_factor":0.9864},{"match_name":"HLSL 12-09-2018","match_date":"2018-12-09","stage_classifiercode":"03-07","member_number":"FY113223","first_name":"TONY","last_name":"ABITONG","classification":"U","division":"OPEN","hit_factor":0.9847},{"match_name":"Mn16 FIRING LINE USPSA 03-03-20","match_date":"2020-03-03","stage_classifiercode":"03-07","member_number":"a125424","first_name":"PAT","last_name":"BREWERS","classification":"U","division":"OPEN","hit_factor":0.9482},{"match_name":"WGC WI USPSA Monthly Match 12-16-17","match_date":"2017-12-16","stage_classifiercode":"03-07","member_number":"TY54308","first_name":"GLEN","last_name":"BICKING","classification":"B","division":"OPEN","hit_factor":0.9373},{"match_name":"DSSA 2021-05 USPSA Pistol","match_date":"2021-05-15","stage_classifiercode":"03-07","member_number":"A109836","first_name":"JOHN","last_name":"BUFKIN","classification":"D","division":"OPEN","hit_factor":0.9092},{"match_name":"LBAS180217","match_date":"2018-02-17","stage_classifiercode":"03-07","member_number":"A86470","first_name":"RICHARD","last_name":"FRASER","classification":"B","division":"OPEN","hit_factor":0.9052},{"match_name":"PSoCA May 2018 Match CAGC","match_date":"2018-05-06","stage_classifiercode":"03-07","member_number":"A103614","first_name":"CHRISTOPHER","last_name":"HALL","classification":"\"\"","division":"OPEN","hit_factor":0.9018},{"match_name":"Shoot GTR Tuesday USPSA 07/18/17","match_date":"2017-07-18","stage_classifiercode":"03-07","member_number":"\"\"","first_name":"GIOVANNI","last_name":"DETORRES","classification":"\"\"","division":"OPEN","hit_factor":0.8591},{"match_name":"BPSA September 2016 USPSA","match_date":"2016-09-25","stage_classifiercode":"03-07","member_number":"\"\"","first_name":"CLAYTON","last_name":"DAIGLE","classification":"U","division":"OPEN","hit_factor":0.8392},{"match_name":"ECPS USPSA 15 SEP 18","match_date":"2018-09-15","stage_classifiercode":"03-07","member_number":"A109099","first_name":"JOHN","last_name":"CUMMINGS","classification":"U","division":"OPEN","hit_factor":0.8389},{"match_name":"NRG September 24th 2016","match_date":"2016-09-24","stage_classifiercode":"03-07","member_number":"A79600","first_name":"CYNTHIA","last_name":"HERPIN","classification":"C","division":"OPEN","hit_factor":0.7913},{"match_name":"USPSA","match_date":"2020-07-26","stage_classifiercode":"03-07","member_number":"A115694","first_name":"JOHNY","last_name":"UTAH","classification":"U","division":"OPEN","hit_factor":0.6665},{"match_name":"Dundee Practical Shooters - June 27 2020 - Points for Pistol","match_date":"2020-06-27","stage_classifiercode":"03-07","member_number":"L2957","first_name":"BRIAN","last_name":"BERKLEY","classification":"B","division":"OPEN","hit_factor":0.5665},{"match_name":"Heartland Practical Shooters USPSA League","match_date":"2020-06-04","stage_classifiercode":"03-07","member_number":"TY113822","first_name":"DAVID","last_name":"BLOME","classification":"U","division":"OPEN","hit_factor":0.5614},{"match_name":"Tropang Vegas All Classifier Match","match_date":"2021-07-11","stage_classifiercode":"03-07","member_number":"A123753","first_name":"KYLE","last_name":"GALIZA","classification":"U","division":"OPEN","hit_factor":0.5418},{"match_name":"ASC USPSA ","match_date":"2017-04-15","stage_classifiercode":"03-07","member_number":"A99920","first_name":"FREDDY","last_name":"LADORES","classification":"D","division":"OPEN","hit_factor":0.5197},{"match_name":"Griffin USPSA Match Oct 15 2016","match_date":"2016-10-15","stage_classifiercode":"03-07","member_number":"TY60177","first_name":"CARL","last_name":"RAINEY","classification":"C","division":"OPEN","hit_factor":0.5027},{"match_name":"NRG Saturday December 22nd - Includes a Classifier Stage","match_date":"2018-12-22","stage_classifiercode":"03-07","member_number":"\"\"","first_name":"WILL","last_name":"ALICANTE","classification":"U","division":"OPEN","hit_factor":0.4909},{"match_name":"Detroit Sportsmens Congress - August 20 2017","match_date":"2017-08-20","stage_classifiercode":"03-07","member_number":"TY97991","first_name":"MICHELLE","last_name":"SCHOENEK","classification":"U","division":"OPEN","hit_factor":0.3171},{"match_name":"Ontelaunee USPSA September 2015","match_date":"2015-09-27","stage_classifiercode":"03-07","member_number":"PEN","first_name":"DONNA","last_name":"PETRUSKEVICH","classification":"U","division":"OPEN","hit_factor":0.3161},{"match_name":"CGC 2016-05-14","match_date":"2016-05-14","stage_classifiercode":"03-07","member_number":"A80807","first_name":"JON","last_name":"WASHER","classification":"C","division":"OPEN","hit_factor":0.2733},{"match_name":"YMM  IPSC 2018_08_12","match_date":"2018-08-12","stage_classifiercode":"03-07","member_number":"A113530","first_name":"SILAS","last_name":"RASH","classification":"D","division":"OPEN","hit_factor":0.2492},{"match_name":"GAS July 7th Special Classifier","match_date":"2018-07-07","stage_classifiercode":"03-07","member_number":"A98106","first_name":"JOE","last_name":"HUPTON","classification":"U","division":"OPEN","hit_factor":0.2354},{"match_name":"LTD Pistol - October 2017","match_date":"2017-10-07","stage_classifiercode":"03-07","member_number":"FY63927","first_name":"INEZ","last_name":"COLLINS","classification":"D","division":"OPEN","hit_factor":0.0855}]