[{"match_name":"Armory Indoor League","match_date":"2016-09-23","stage_classifiercode":"99-11","member_number":"A51363","first_name":"KENNY","last_name":"TERRY","classification":"M","division":"LIMITED","hit_factor":12.3142},{"match_name":"USPSA Re-entry","match_date":"2020-05-31","stage_classifiercode":"99-11","member_number":"A106791","first_name":"JOHN","last_name":"DOE","classification":"M","division":"LIMITED","hit_factor":11.7647},{"match_name":"MAPSA June Special Classifier","match_date":"2018-06-09","stage_classifiercode":"99-11","member_number":"A68543","first_name":"BRIAN","last_name":"HANSEN","classification":"M","division":"LIMITED","hit_factor":11.4851},{"match_name":"Brothers N Arms December 2018 USPSA Match","match_date":"2018-12-15","stage_classifiercode":"99-11","member_number":"TY94183","first_name":"DAVID","last_name":"PAPE","classification":"M","division":"LIMITED","hit_factor":11.1789},{"match_name":"WSPS JUNE 2018 USPSA MATCH","match_date":"2018-06-16","stage_classifiercode":"99-11","member_number":"A82072","first_name":"ALFRED","last_name":"MONCH","classification":"M","division":"LIMITED","hit_factor":11.1753},{"match_name":"TGC July 2016 USPSA Classifier Match","match_date":"2016-07-17","stage_classifiercode":"99-11","member_number":"A-88670","first_name":"JAMES","last_name":"GREGG","classification":"A","division":"LIMITED","hit_factor":11.1345},{"match_name":"Nampa USPSA December 4th 2021","match_date":"2021-12-04","stage_classifiercode":"99-11","member_number":"A68393","first_name":"MATTHEW","last_name":"EVANCIC","classification":"M","division":"LIMITED","hit_factor":11.0672},{"match_name":"RSCS USPSA  27 Mar 2016","match_date":"2016-03-27","stage_classifiercode":"99-11","member_number":"A64063","first_name":"CARLOS","last_name":"ANGUIANO","classification":"M","division":"LIMITED","hit_factor":10.987},{"match_name":"Shot Through The Heart Classifiers","match_date":"2018-02-04","stage_classifiercode":"99-11","member_number":"L4081","first_name":"CHRISTOPHER","last_name":"CULPEPPER","classification":"M","division":"LIMITED","hit_factor":10.9533},{"match_name":"PPPS 11-13-16","match_date":"2016-11-13","stage_classifiercode":"99-11","member_number":"L3320","first_name":"CHARLIE","last_name":"PEREZ","classification":"G","division":"LIMITED","hit_factor":10.9504},{"match_name":"Richmond Hot Shots April 30-May 1st USPSA Pistol Match","match_date":"2016-04-30","stage_classifiercode":"99-11","member_number":"TY44130","first_name":"SEBASTIAO","last_name":"FILHO","classification":"M","division":"LIMITED","hit_factor":10.9405},{"match_name":"Rio Salado RSPP 3rd Saturday February 2020","match_date":"2020-02-15","stage_classifiercode":"99-11","member_number":"A82915","first_name":"CODY","last_name":"VINCENT","classification":"M","division":"LIMITED","hit_factor":10.9127},{"match_name":"Augusta USPSA 10-14-18","match_date":"2018-10-14","stage_classifiercode":"99-11","member_number":"L3988","first_name":"BEN","last_name":"STOEGER","classification":"U","division":"LIMITED","hit_factor":10.8949},{"match_name":"SCCCNOVEMBER2016","match_date":"2016-11-13","stage_classifiercode":"99-11","member_number":"a78528","first_name":"TIM","last_name":"MEKOSH","classification":"M","division":"LIMITED","hit_factor":10.8911},{"match_name":"CCPL 01102016 ALL CLASSIFIER MATCH","match_date":"2016-01-10","stage_classifiercode":"99-11","member_number":"TY40865","first_name":"STEVE","last_name":"PORTER","classification":"A","division":"LIMITED","hit_factor":10.8779},{"match_name":"OK15 USPSA at USSA","match_date":"2017-12-10","stage_classifiercode":"99-11","member_number":"TY68934","first_name":"TIM","last_name":"HERRON","classification":"M","division":"LIMITED","hit_factor":10.7692},{"match_name":"Coastal Area Practical Shooters 7-22-17 Special Classifier","match_date":"2017-07-22","stage_classifiercode":"99-11","member_number":"A53949","first_name":"TODD2","last_name":"KENNEDY","classification":"M","division":"LIMITED","hit_factor":10.757},{"match_name":"RSPP 3rd Saturday November 2016","match_date":"2016-11-19","stage_classifiercode":"99-11","member_number":"A61313","first_name":"BRETT","last_name":"BERG","classification":"M","division":"LIMITED","hit_factor":10.7356},{"match_name":"Ontelaunee USPSA July 2016","match_date":"2016-07-23","stage_classifiercode":"99-11","member_number":"\"\"","first_name":"JAMES","last_name":"MCGINTY","classification":"M","division":"LIMITED","hit_factor":10.7143},{"match_name":"Emmett July Match","match_date":"2017-07-21","stage_classifiercode":"99-11","member_number":"A68393","first_name":"MATTHEW","last_name":"EVANCIC","classification":"M","division":"LIMITED","hit_factor":10.7143},{"match_name":"RSPP 3rd Saturday November 2016","match_date":"2016-11-19","stage_classifiercode":"99-11","member_number":"FY77868","first_name":"MICHAEL R","last_name":"AUTUORI JR","classification":"M","division":"LIMITED","hit_factor":10.6618},{"match_name":"MS06 Team Magnolia June 2017 USPSA Match","match_date":"2017-06-04","stage_classifiercode":"99-11","member_number":"A77712","first_name":"STEVEN","last_name":"SANDERS","classification":"G","division":"LIMITED","hit_factor":10.6145},{"match_name":"WVPPS May 2021","match_date":"2021-05-16","stage_classifiercode":"99-11","member_number":"A102630","first_name":"NATE","last_name":"POULSON","classification":"M","division":"LIMITED","hit_factor":10.609},{"match_name":"Prescott 1st Saturday 8-05-17","match_date":"2017-08-05","stage_classifiercode":"99-11","member_number":"L3837","first_name":"NILS","last_name":"JONASSON","classification":"G","division":"LIMITED","hit_factor":10.6033},{"match_name":"LdF USPSA Match January 25 2020","match_date":"2020-01-25","stage_classifiercode":"99-11","member_number":"TY78824","first_name":"MATTHEW","last_name":"CLARK","classification":"G","division":"LIMITED","hit_factor":10.5788},{"match_name":"PPS USPSA Classifiers 2018-05-01","match_date":"2018-05-02","stage_classifiercode":"99-11","member_number":"A90516","first_name":"JARED","last_name":"FOX","classification":"M","division":"LIMITED","hit_factor":10.5578},{"match_name":"LdF USPSA Match May 12 2018","match_date":"2018-05-12","stage_classifiercode":"99-11","member_number":"TY80157","first_name":"DAVE","last_name":"DEZAN","classification":"M","division":"LIMITED","hit_factor":10.536},{"match_name":"Crooked Creek Pistol League - June 2016","match_date":"2016-06-25","stage_classifiercode":"99-11","member_number":"TY85065","first_name":"JAMES","last_name":"JONOVICH","classification":"B","division":"LIMITED","hit_factor":10.5163},{"match_name":"LPRGC - Lower Providence USPSA October 2018","match_date":"2018-10-06","stage_classifiercode":"99-11","member_number":"L4449","first_name":"AJ","last_name":"STUART","classification":"M","division":"LIMITED","hit_factor":10.4762},{"match_name":"Emmett July Match","match_date":"2017-07-21","stage_classifiercode":"99-11","member_number":"A84532","first_name":"KENNY","last_name":"PLATT","classification":"G","division":"LIMITED","hit_factor":10.4743},{"match_name":"OFGC Practical Pistol Match 01-19-2020","match_date":"2020-01-19","stage_classifiercode":"99-11","member_number":"A99926","first_name":"CARL","last_name":"CLITES","classification":"A","division":"LIMITED","hit_factor":10.4701},{"match_name":"FBURG March Level I USPSA","match_date":"2016-03-06","stage_classifiercode":"99-11","member_number":"L2458","first_name":"TODD","last_name":"JARRETT","classification":"G","division":"LIMITED","hit_factor":10.4651},{"match_name":"SLPSA August USPSA Match 2","match_date":"2020-08-15","stage_classifiercode":"99-11","member_number":"TY93975","first_name":"STEPAN","last_name":"GENERALOV","classification":"A","division":"LIMITED","hit_factor":10.4628},{"match_name":"WELD ECO09 20180916","match_date":"2018-09-16","stage_classifiercode":"99-11","member_number":"A67134","first_name":"KIRK","last_name":"WILSON","classification":"M","division":"LIMITED","hit_factor":10.4396},{"match_name":"ENPS 2018 June USPSA Match","match_date":"2018-06-03","stage_classifiercode":"99-11","member_number":"A98625","first_name":"LANE","last_name":"GRIES","classification":"G","division":"LIMITED","hit_factor":10.4},{"match_name":"Emmett July Match","match_date":"2017-07-21","stage_classifiercode":"99-11","member_number":"TY82856","first_name":"JOHN","last_name":"KITSON","classification":"G","division":"LIMITED","hit_factor":10.3383},{"match_name":"PSAC_20161022","match_date":"2016-10-22","stage_classifiercode":"99-11","member_number":"L3320","first_name":"CHARLIE","last_name":"PEREZ","classification":"\"\"","division":"LIMITED","hit_factor":10.3261},{"match_name":"North Mountain PS April","match_date":"2016-04-15","stage_classifiercode":"99-11","member_number":"A72195","first_name":"RYAN","last_name":"CLEMENTS","classification":"M","division":"LIMITED","hit_factor":10.2767},{"match_name":"Omaha Gun Club USPSA February 28th 2018","match_date":"2018-03-01","stage_classifiercode":"99-11","member_number":"A98625","first_name":"LANE","last_name":"GRIES","classification":"M","division":"LIMITED","hit_factor":10.2421},{"match_name":"EAPS July 2017 USPSA","match_date":"2017-07-16","stage_classifiercode":"99-11","member_number":"TY64738","first_name":"GERWIN","last_name":"HENN","classification":"M","division":"LIMITED","hit_factor":10.2317},{"match_name":"CSoS Feb2016 Match","match_date":"2016-02-21","stage_classifiercode":"99-11","member_number":"A31524","first_name":"COUNCIL","last_name":"BRADSHAW","classification":"G","division":"LIMITED","hit_factor":10.1289},{"match_name":"Hopkinton USPSA July 2018","match_date":"2018-07-07","stage_classifiercode":"99-11","member_number":"TY76424","first_name":"HARRISON","last_name":"SCHMIDT","classification":"A","division":"LIMITED","hit_factor":10.1266},{"match_name":"YRPA USPSA MARCH  2018","match_date":"2018-03-25","stage_classifiercode":"99-11","member_number":"A69094","first_name":"AARON","last_name":"LAWS","classification":"M","division":"LIMITED","hit_factor":10.119},{"match_name":"PCSI - September 2017 USPSA","match_date":"2017-09-02","stage_classifiercode":"99-11","member_number":"TY81742","first_name":"BEN","last_name":"WEST","classification":"M","division":"LIMITED","hit_factor":10.1167},{"match_name":"SLPSA August USPSA Match 2","match_date":"2020-08-15","stage_classifiercode":"99-11","member_number":"A70490","first_name":"JOSH","last_name":"WAKAMATSU","classification":"G","division":"LIMITED","hit_factor":10.1103},{"match_name":"17s PSC - Go Fast Don’t Suck 2020 Spring Postal Match (USPSA)","match_date":"2020-05-16","stage_classifiercode":"99-11","member_number":"Ty66707","first_name":"WALLY","last_name":"BURBAGE","classification":"M","division":"LIMITED","hit_factor":10.0971},{"match_name":"YRPA USPSA MARCH  2018","match_date":"2018-03-25","stage_classifiercode":"99-11","member_number":"TY68374","first_name":"MIKAYLA","last_name":"BLOSSER","classification":"M","division":"LIMITED","hit_factor":10.0952},{"match_name":"CGC 4.30.17","match_date":"2017-04-30","stage_classifiercode":"99-11","member_number":"A90490","first_name":"LEE","last_name":"SCHOENIKE","classification":"A","division":"LIMITED","hit_factor":10.076},{"match_name":"2017 Bay bridge Charity Classic - Richmond October 14-15-2017","match_date":"2017-10-14","stage_classifiercode":"99-11","member_number":"TY69633","first_name":"ALEX","last_name":"MA","classification":"GM","division":"LIMITED","hit_factor":10.0707},{"match_name":"APS August 1st Monthly USPSA Match  Classifier Match","match_date":"2021-08-01","stage_classifiercode":"99-11","member_number":"TY113013","first_name":"ZACHARY","last_name":"MYERS","classification":"B","division":"LIMITED","hit_factor":10.0683},{"match_name":"TMGN December 21 Practical Shooter Match","match_date":"2017-12-22","stage_classifiercode":"99-11","member_number":"A72815","first_name":"BRETT","last_name":"DAVENPORT","classification":"\"\"","division":"LIMITED","hit_factor":10.0592},{"match_name":"IN19 ACC USPSA September 23","match_date":"2018-09-23","stage_classifiercode":"99-11","member_number":"A56265","first_name":"JOE","last_name":"ORNELAS","classification":"G","division":"LIMITED","hit_factor":10.0569},{"match_name":"ETRPC-USPSA","match_date":"2021-03-27","stage_classifiercode":"99-11","member_number":"A50568","first_name":"HARMON","last_name":"GREER","classification":"M","division":"LIMITED","hit_factor":10.0173},{"match_name":"MCRC USPSA August 2018","match_date":"2018-08-11","stage_classifiercode":"99-11","member_number":"TY66707","first_name":"WALLY","last_name":"BURBAGE","classification":"M","division":"LIMITED","hit_factor":10},{"match_name":"NW01 Paul Bunyan CS Series May 9 2021","match_date":"2021-05-09","stage_classifiercode":"99-11","member_number":"Ty92223","first_name":"STUART","last_name":"WILSON","classification":"A","division":"LIMITED","hit_factor":10},{"match_name":"SFPC Oct 3 2021   USPSA Monthly Match","match_date":"2021-10-03","stage_classifiercode":"99-11","member_number":"L2988","first_name":"RONALD","last_name":"BROWN","classification":"M","division":"LIMITED","hit_factor":9.9656},{"match_name":"Richmond Hot Shots April 14-15-2018 USPSA Pistol Match","match_date":"2018-04-14","stage_classifiercode":"99-11","member_number":"TY69633","first_name":"ALEX","last_name":"MA","classification":"GM","division":"LIMITED","hit_factor":9.965},{"match_name":"AAPS AAFG Level 1 Match - May 5 2018","match_date":"2018-05-05","stage_classifiercode":"99-11","member_number":"A82072","first_name":"AL","last_name":"MONCH","classification":"M","division":"LIMITED","hit_factor":9.9624},{"match_name":"RPS December 2017 USPSA Match","match_date":"2017-12-09","stage_classifiercode":"99-11","member_number":"A93538","first_name":"JOHN","last_name":"ROYER","classification":"B","division":"LIMITED","hit_factor":9.9448},{"match_name":"SUPS USPSA 20-21 October 2018","match_date":"2018-10-20","stage_classifiercode":"99-11","member_number":"TY87431","first_name":"AARON","last_name":"BREKKE","classification":"A","division":"LIMITED","hit_factor":9.9448},{"match_name":"SWGC USPSA Pistol Match - November 2021","match_date":"2021-11-06","stage_classifiercode":"99-11","member_number":"A84544","first_name":"GERRIT","last_name":"HEINRICH","classification":"M","division":"LIMITED","hit_factor":9.894},{"match_name":"SLPSA July USPSA match","match_date":"2018-07-21","stage_classifiercode":"99-11","member_number":"A51363","first_name":"KENNETH","last_name":"TERRY","classification":"G","division":"LIMITED","hit_factor":9.879},{"match_name":"TAP USPSA Pistol Match Aug 14 2016","match_date":"2016-08-14","stage_classifiercode":"99-11","member_number":"TY69633","first_name":"ALEX","last_name":"MA","classification":"M","division":"LIMITED","hit_factor":9.8787},{"match_name":"CCPL 01102016 ALL CLASSIFIER MATCH","match_date":"2016-01-10","stage_classifiercode":"99-11","member_number":"A78576","first_name":"NICK","last_name":"MERCURIO","classification":"B","division":"LIMITED","hit_factor":9.8446},{"match_name":"Shadow Hawk Defense USPSA Special Classifier","match_date":"2020-11-14","stage_classifiercode":"99-11","member_number":"A119732","first_name":"BRIAN","last_name":"MOONEY","classification":"B","division":"LIMITED","hit_factor":9.8361},{"match_name":"SMPSA 2018-01 Pistol","match_date":"2018-01-14","stage_classifiercode":"99-11","member_number":"TY94183","first_name":"DAVID","last_name":"PAPE","classification":"A","division":"LIMITED","hit_factor":9.8361},{"match_name":"ORPCI USPSA Saturday 2021.07.17","match_date":"2021-07-17","stage_classifiercode":"99-11","member_number":"A86735","first_name":"JOHN","last_name":"COURIS","classification":"A","division":"LIMITED","hit_factor":9.8361},{"match_name":"Palmetto Gun Club - April 2017 USPSA","match_date":"2017-04-08","stage_classifiercode":"99-11","member_number":"TY66707","first_name":"WALLY","last_name":"BURBAGE","classification":"A","division":"LIMITED","hit_factor":9.833},{"match_name":"BRSP Tuesday Night USPSA Match - May 15","match_date":"2018-05-16","stage_classifiercode":"99-11","member_number":"TY97714","first_name":"JUSTIN","last_name":"LARKIN","classification":"A","division":"LIMITED","hit_factor":9.833},{"match_name":"2017-10-07 USPSA at Phoenix Rod and Gun Club","match_date":"2017-10-07","stage_classifiercode":"99-11","member_number":"TY64035","first_name":"CODY","last_name":"MCKENNA","classification":"G","division":"LIMITED","hit_factor":9.8299},{"match_name":"LdF USPSA Match May 12 2018","match_date":"2018-05-12","stage_classifiercode":"99-11","member_number":"A81101","first_name":"LES2","last_name":"ANDERSON","classification":"A","division":"LIMITED","hit_factor":9.8299},{"match_name":"ORPCI 2017 June USPSA Classifer Match","match_date":"2017-06-25","stage_classifiercode":"99-11","member_number":"TY77176","first_name":"DON","last_name":"O'BRADOVICH","classification":"A","division":"LIMITED","hit_factor":9.8266},{"match_name":"CFRPC December USPSA (Classifier)","match_date":"2018-12-16","stage_classifiercode":"99-11","member_number":"A67754","first_name":"ROBERTO","last_name":"BATTISEL","classification":"B","division":"LIMITED","hit_factor":9.8214},{"match_name":"Ontelaunee USPSA  July 2018","match_date":"2018-07-29","stage_classifiercode":"99-11","member_number":"A91710","first_name":"RYAN","last_name":"POBLETE","classification":"A","division":"LIMITED","hit_factor":9.8214},{"match_name":"Brothers N Arms September 2017 USPSA Match","match_date":"2017-09-16","stage_classifiercode":"99-11","member_number":"TY94183","first_name":"DAVID","last_name":"PAPE","classification":"A","division":"LIMITED","hit_factor":9.82},{"match_name":"RSPP 3rd Saturday November 2016","match_date":"2016-11-19","stage_classifiercode":"99-11","member_number":"A64035","first_name":"CODY","last_name":"MCKENNA","classification":"X","division":"LIMITED","hit_factor":9.8182},{"match_name":"SAGC CTX04 Monthly USPSA Match - June USPSA Match","match_date":"2018-06-24","stage_classifiercode":"99-11","member_number":"A15867","first_name":"ALAN W.","last_name":"LAZA","classification":"M","division":"LIMITED","hit_factor":9.8148},{"match_name":"SFPC Oct 3 2021   USPSA Monthly Match","match_date":"2021-10-03","stage_classifiercode":"99-11","member_number":"FY83822","first_name":"ALEJANDRO","last_name":"ONOFRIO","classification":"B","division":"LIMITED","hit_factor":9.7973},{"match_name":"Bc Reshoot","match_date":"2017-07-02","stage_classifiercode":"99-11","member_number":"A93137","first_name":"BILLY","last_name":"DODSON","classification":"A","division":"LIMITED","hit_factor":9.7973},{"match_name":"Pitcairn-Monroeville Sportsmens Club USPSA August 2017","match_date":"2017-08-05","stage_classifiercode":"99-11","member_number":"A89831","first_name":"RICHARD","last_name":"ALLOWAY","classification":"B","division":"LIMITED","hit_factor":9.7786},{"match_name":"Ontelaunee USPSA July 2016","match_date":"2016-07-23","stage_classifiercode":"99-11","member_number":"A78332","first_name":"JAKE","last_name":"DEGENSHEIN","classification":"A","division":"LIMITED","hit_factor":9.7744},{"match_name":"Dawg Valley USPSA Oct 13","match_date":"2018-10-13","stage_classifiercode":"99-11","member_number":"A95021","first_name":"ERIC","last_name":"STONER","classification":"B","division":"LIMITED","hit_factor":9.7744},{"match_name":"Grandbaggers August 2017","match_date":"2017-08-03","stage_classifiercode":"99-11","member_number":"L3902","first_name":"ALEXANDER","last_name":"VALENTINE","classification":"M","division":"LIMITED","hit_factor":9.7701},{"match_name":"Clone Tue","match_date":"2017-03-29","stage_classifiercode":"99-11","member_number":"a63791","first_name":"JAMES","last_name":"ABENOJA","classification":"G","division":"LIMITED","hit_factor":9.7606},{"match_name":"Coyote Tuesday USPSA match 3-28-17 Classifier Match","match_date":"2017-03-29","stage_classifiercode":"99-11","member_number":"A63791","first_name":"JAMES","last_name":"ABENOJA","classification":"G","division":"LIMITED","hit_factor":9.7606},{"match_name":"Shasta Shooters 2021 Nov","match_date":"2021-11-13","stage_classifiercode":"99-11","member_number":"A96344","first_name":"RON","last_name":"HILDEBRANT","classification":"M","division":"LIMITED","hit_factor":9.7561},{"match_name":"2017 Bay bridge Charity Classic - Richmond October 14-15-2017","match_date":"2017-10-14","stage_classifiercode":"99-11","member_number":"FY63012","first_name":"MANUEL","last_name":"NEWMAN","classification":"M","division":"LIMITED","hit_factor":9.7518},{"match_name":"NPCCC 05-07-2017 USPSA","match_date":"2017-05-07","stage_classifiercode":"99-11","member_number":"TY74021","first_name":"MICHAEL","last_name":"BLYAKHER","classification":"M","division":"LIMITED","hit_factor":9.7416},{"match_name":"SAPSC Monthly USPSA Classifier Match at ARO 20180215","match_date":"2018-02-16","stage_classifiercode":"99-11","member_number":"A58496","first_name":"GREG","last_name":"SMITH","classification":"A","division":"LIMITED","hit_factor":9.7378},{"match_name":"SB Action Pistol Match Classifier","match_date":"2017-12-14","stage_classifiercode":"99-11","member_number":"A68543","first_name":"BRIAN","last_name":"HANSEN","classification":"\"\"","division":"LIMITED","hit_factor":9.7378},{"match_name":"Nampa USPSA May 29th 2021","match_date":"2021-05-29","stage_classifiercode":"99-11","member_number":"a75553","first_name":"MARK","last_name":"WEAVER","classification":"M","division":"LIMITED","hit_factor":9.7315},{"match_name":"TPS USPSA at CMP March 18 2017","match_date":"2017-03-18","stage_classifiercode":"99-11","member_number":"A90256","first_name":"KEEGAN","last_name":"SINGLETON","classification":"M","division":"LIMITED","hit_factor":9.707},{"match_name":"CGGR July USPSA Match","match_date":"2018-07-21","stage_classifiercode":"99-11","member_number":"TY94292","first_name":"TJ","last_name":"MEYERS","classification":"A","division":"LIMITED","hit_factor":9.6948},{"match_name":"FBURG July 2018 Level I USPSA ","match_date":"2018-07-01","stage_classifiercode":"99-11","member_number":"A72195","first_name":"RYAN","last_name":"CLEMENTS","classification":"M","division":"LIMITED","hit_factor":9.6939},{"match_name":"TMGN USPSA July 6th Match","match_date":"2017-07-06","stage_classifiercode":"99-11","member_number":"A72815","first_name":"BRETT","last_name":"DAVENPORT","classification":"A","division":"LIMITED","hit_factor":9.6831},{"match_name":"USPSA-Alberta 2018-03 Indoor Classifier 3 at TSE","match_date":"2018-04-29","stage_classifiercode":"99-11","member_number":"TYF89632","first_name":"JEAN-PAUL","last_name":"JOB","classification":"U","division":"LIMITED","hit_factor":9.6774},{"match_name":"NTPS-SE November Classifier 2016","match_date":"2016-11-19","stage_classifiercode":"99-11","member_number":"A87604","first_name":"ETHAN","last_name":"HOWELL","classification":"A","division":"LIMITED","hit_factor":9.6718},{"match_name":"RBGC 2017-06-24","match_date":"2017-06-24","stage_classifiercode":"99-11","member_number":"A27109","first_name":"DARYL","last_name":"SPAETH","classification":"M","division":"LIMITED","hit_factor":9.6715},{"match_name":"RBGC 2017-06-24","match_date":"2017-06-24","stage_classifiercode":"99-11","member_number":"A86971","first_name":"CALEB","last_name":"HELTON","classification":"B","division":"LIMITED","hit_factor":9.6715},{"match_name":"CFRPC April USPSA Match","match_date":"2018-04-15","stage_classifiercode":"99-11","member_number":"A90902","first_name":"JOSH","last_name":"BALDRIDGE","classification":"B","division":"LIMITED","hit_factor":9.6639},{"match_name":"WSPS JUNE 2018 USPSA MATCH","match_date":"2018-06-16","stage_classifiercode":"99-11","member_number":"A94001","first_name":"NICK","last_name":"REYNOLDS","classification":"G","division":"LIMITED","hit_factor":9.6525},{"match_name":"USPSA Strategic Edge SEGR August 21st 2021","match_date":"2021-08-21","stage_classifiercode":"99-11","member_number":"A114058","first_name":"JASON","last_name":"RADSPINNER","classification":"B","division":"LIMITED","hit_factor":9.6429},{"match_name":"Crooked Creek Pistol League - June 2016","match_date":"2016-06-25","stage_classifiercode":"99-11","member_number":"A59597","first_name":"GREG","last_name":"PLATT","classification":"A","division":"LIMITED","hit_factor":9.6284},{"match_name":"BHPSC Monthy World Championship 12-29-2017","match_date":"2017-12-30","stage_classifiercode":"99-11","member_number":"A90516","first_name":"JARED","last_name":"FOX","classification":"M","division":"LIMITED","hit_factor":9.5915},{"match_name":"MCAS March 2018 USPSA","match_date":"2018-03-17","stage_classifiercode":"99-11","member_number":"L4166","first_name":"MATT","last_name":"WAITE","classification":"M","division":"LIMITED","hit_factor":9.5915},{"match_name":"2016-05-07 USPSA at Phoenix Rod and Gun Club","match_date":"2016-05-07","stage_classifiercode":"99-11","member_number":"Ty77868","first_name":"MICHAEL","last_name":"AUTUORI","classification":"A","division":"LIMITED","hit_factor":9.589},{"match_name":"NHRPC - March 2021 USPSA","match_date":"2021-03-14","stage_classifiercode":"99-11","member_number":"Ty98580","first_name":"JASON","last_name":"SENDELSKY","classification":"M","division":"LIMITED","hit_factor":9.5841},{"match_name":"LPRGC - Lower Providence USPSA October 2018","match_date":"2018-10-06","stage_classifiercode":"99-11","member_number":"TY104882","first_name":"CHRISTOPHER","last_name":"GELNETT","classification":"B","division":"LIMITED","hit_factor":9.5764},{"match_name":"Pardoe Sportsmens Association- USPSA Saturday 4-3-21","match_date":"2021-04-03","stage_classifiercode":"99-11","member_number":"Ty109715","first_name":"PATCHES","last_name":"REEDER","classification":"M","division":"LIMITED","hit_factor":9.5477},{"match_name":"PTPC  February 7th USPSA Match","match_date":"2016-02-07","stage_classifiercode":"99-11","member_number":"TY43505","first_name":"DIETER","last_name":"GUTT  JR","classification":"M","division":"LIMITED","hit_factor":9.5406},{"match_name":"TPS USPSA at CMP March 18 2017","match_date":"2017-03-18","stage_classifiercode":"99-11","member_number":"A98278","first_name":"JACK","last_name":"WINDES","classification":"B","division":"LIMITED","hit_factor":9.5406},{"match_name":"WVRPC USPSA 1SEPT2018","match_date":"2018-09-01","stage_classifiercode":"99-11","member_number":"\"\"","first_name":"DAVID","last_name":"BURNS","classification":"M","division":"LIMITED","hit_factor":9.5406},{"match_name":"LdF USPSA Match January 25 2020","match_date":"2020-01-25","stage_classifiercode":"99-11","member_number":"L3216","first_name":"CRAIG","last_name":"UNDERDOWN","classification":"M","division":"LIMITED","hit_factor":9.5238},{"match_name":"Campeonato USPSA 2020","match_date":"2020-05-30","stage_classifiercode":"99-11","member_number":"TY92124","first_name":"GERMAN","last_name":"VELEZ","classification":"B","division":"LIMITED","hit_factor":9.5156},{"match_name":"YRPA USPSA MARCH  2018","match_date":"2018-03-25","stage_classifiercode":"99-11","member_number":"A85658","first_name":"NICK","last_name":"BERGER","classification":"A","division":"LIMITED","hit_factor":9.5149},{"match_name":"Maine Practical Shooters February 2016","match_date":"2016-02-27","stage_classifiercode":"99-11","member_number":"TY81222","first_name":"MASON","last_name":"LANE","classification":"A","division":"LIMITED","hit_factor":9.5082},{"match_name":"Bridgeville - USPSA - Dec","match_date":"2020-12-06","stage_classifiercode":"99-11","member_number":"L4458","first_name":"BILL","last_name":"DUDA","classification":"A","division":"LIMITED","hit_factor":9.5076},{"match_name":"Range E11even January 2018","match_date":"2018-01-27","stage_classifiercode":"99-11","member_number":"A82837","first_name":"DANIEL","last_name":"BOYLSTON","classification":"A","division":"LIMITED","hit_factor":9.5064},{"match_name":"AAPS AAFG Level 1 Match - May 5 2018","match_date":"2018-05-05","stage_classifiercode":"99-11","member_number":"A103667","first_name":"KEANU","last_name":"SY","classification":"M","division":"LIMITED","hit_factor":9.5057},{"match_name":"Pinetucky USPSA 06-16-18","match_date":"2018-06-16","stage_classifiercode":"99-11","member_number":"ty66707","first_name":"WALLY","last_name":"BURBAGE","classification":"M","division":"LIMITED","hit_factor":9.5},{"match_name":"CVSC  09-25-16","match_date":"2016-09-25","stage_classifiercode":"99-11","member_number":"\"\"","first_name":"TOM","last_name":"ROWE","classification":"U","division":"LIMITED","hit_factor":9.4972},{"match_name":"Fairfax PS USPSA  2018 October","match_date":"2018-10-16","stage_classifiercode":"99-11","member_number":"TY103667","first_name":"KEANU","last_name":"SY","classification":"M","division":"LIMITED","hit_factor":9.4926},{"match_name":"IN19 ACC USPSA September 23","match_date":"2018-09-23","stage_classifiercode":"99-11","member_number":"TY92908","first_name":"DAVID","last_name":"BURNS","classification":"M","division":"LIMITED","hit_factor":9.4926},{"match_name":"Hopkinton June  2016","match_date":"2016-06-04","stage_classifiercode":"99-11","member_number":"A27309","first_name":"TERRANCE","last_name":"ROBERTSON","classification":"A","division":"LIMITED","hit_factor":9.4796},{"match_name":"SFPC Aug 8 2021 USPSA Classifier match","match_date":"2021-08-08","stage_classifiercode":"99-11","member_number":"FY83822","first_name":"ALEJANDRO","last_name":"ONOFRIO","classification":"B","division":"LIMITED","hit_factor":9.4527},{"match_name":"LCSC Linden USPSA 092621","match_date":"2021-09-25","stage_classifiercode":"99-11","member_number":"L4894","first_name":"ALEX","last_name":"MA","classification":"G","division":"LIMITED","hit_factor":9.4502},{"match_name":"ISPS 6/19/2016 USPSA","match_date":"2016-06-19","stage_classifiercode":"99-11","member_number":"A84532","first_name":"KENNETH","last_name":"PLATT","classification":"M","division":"LIMITED","hit_factor":9.4474},{"match_name":"FSA USPSA 01-26-20","match_date":"2020-01-27","stage_classifiercode":"99-11","member_number":"A87778","first_name":"WILLIAM","last_name":"HATFIELD","classification":"B","division":"LIMITED","hit_factor":9.4444},{"match_name":"NW01 April da Turd","match_date":"2018-04-04","stage_classifiercode":"99-11","member_number":"TY92488","first_name":"JOHN","last_name":"MORRIS","classification":"M","division":"LIMITED","hit_factor":9.4374},{"match_name":"PTPC April 2nd USPSA Match","match_date":"2017-04-02","stage_classifiercode":"99-11","member_number":"A85072","first_name":"FRANK","last_name":"VALY","classification":"B","division":"LIMITED","hit_factor":9.434},{"match_name":"OFGC USPSA Match Feb 19th 2017","match_date":"2017-02-19","stage_classifiercode":"99-11","member_number":"TY89171","first_name":"AUSTIN","last_name":"CHAMBERLAIN","classification":"A","division":"LIMITED","hit_factor":9.4309},{"match_name":"Rankin Field June Sunday USPSA","match_date":"2020-06-21","stage_classifiercode":"99-11","member_number":"A109094","first_name":"TONY","last_name":"LUNA","classification":"B","division":"LIMITED","hit_factor":9.4215},{"match_name":"Denali September","match_date":"2018-09-07","stage_classifiercode":"99-11","member_number":"A-85536","first_name":"DAVE","last_name":"WHITE","classification":"B","division":"LIMITED","hit_factor":9.4178},{"match_name":"CCAS June 2016","match_date":"2016-06-25","stage_classifiercode":"99-11","member_number":"TY74344","first_name":"LANCE","last_name":"DEHLER","classification":"M","division":"LIMITED","hit_factor":9.4017},{"match_name":"Hopkinton USPSA October 2018","match_date":"2018-10-06","stage_classifiercode":"99-11","member_number":"TY73127","first_name":"SEAN","last_name":"JANICKI","classification":"M","division":"LIMITED","hit_factor":9.4},{"match_name":"Emmett July Match","match_date":"2017-07-21","stage_classifiercode":"99-11","member_number":"TY81469","first_name":"ERIC","last_name":"STEINER","classification":"U","division":"LIMITED","hit_factor":9.3985},{"match_name":"AIPS  USPSA 11-14-15","match_date":"2015-11-14","stage_classifiercode":"99-11","member_number":"TY57269","first_name":"CRAIG","last_name":"TAPPE","classification":"M","division":"LIMITED","hit_factor":9.3972},{"match_name":"BRSP Tuesday Night USPSA Match","match_date":"2021-05-05","stage_classifiercode":"99-11","member_number":"TY97714","first_name":"JUSTIN","last_name":"LARKIN","classification":"M","division":"LIMITED","hit_factor":9.396},{"match_name":"BRSP Tuesday Night USPSA Match - May 15","match_date":"2018-05-16","stage_classifiercode":"99-11","member_number":"FY84358","first_name":"TYLER","last_name":"VIRGIN","classification":"\"\"","division":"LIMITED","hit_factor":9.375},{"match_name":"PPS CLASSIFIER MATCH 2020-01-28","match_date":"2020-01-29","stage_classifiercode":"99-11","member_number":"TY110979","first_name":"JACK","last_name":"BROWN","classification":"B","division":"LIMITED","hit_factor":9.3537},{"match_name":"PRPSA USPSA CHALLENGE PAN AMERICAN","match_date":"2021-07-11","stage_classifiercode":"99-11","member_number":"FY37618","first_name":"CARLOS","last_name":"COLON","classification":"U","division":"LIMITED","hit_factor":9.3525},{"match_name":"Extreme GM USPSA  November","match_date":"2020-11-27","stage_classifiercode":"99-11","member_number":"L4497","first_name":"BILL","last_name":"BAKER","classification":"M","division":"LIMITED","hit_factor":9.3426},{"match_name":"MPSA 010216","match_date":"2016-01-02","stage_classifiercode":"99-11","member_number":"A37163","first_name":"LARRY","last_name":"HUFF","classification":"M","division":"LIMITED","hit_factor":9.3306},{"match_name":"Denali September","match_date":"2018-09-07","stage_classifiercode":"99-11","member_number":"A-85536","first_name":"DAVE","last_name":"WHITE","classification":"B","division":"LIMITED","hit_factor":9.3264},{"match_name":"Richmond Hot Shots January 17-2016 USPSA Pistol","match_date":"2016-01-17","stage_classifiercode":"99-11","member_number":"TY63012","first_name":"MANUEL","last_name":"NEWMAN","classification":"M","division":"LIMITED","hit_factor":9.3264},{"match_name":"MCPSL Pistol 3-10-18","match_date":"2018-03-10","stage_classifiercode":"99-11","member_number":"A90516","first_name":"JARED","last_name":"FOX","classification":"M","division":"LIMITED","hit_factor":9.322},{"match_name":"2017 Bay bridge Charity Classic - Richmond October 14-15-2017","match_date":"2017-10-14","stage_classifiercode":"99-11","member_number":"TY44130","first_name":"SEBASTIAO","last_name":"FILHO","classification":"M","division":"LIMITED","hit_factor":9.311},{"match_name":"Wvpps Nov. 2016","match_date":"2016-11-20","stage_classifiercode":"99-11","member_number":"ty65620","first_name":"SCOTT","last_name":"METCALF","classification":"B","division":"LIMITED","hit_factor":9.2985},{"match_name":"Holmen USPSA 10/30/16","match_date":"2016-10-30","stage_classifiercode":"99-11","member_number":"A82468","first_name":"ADAM","last_name":"MAXWELL","classification":"U","division":"LIMITED","hit_factor":9.2869},{"match_name":"CGGR July USPSA Match","match_date":"2018-07-21","stage_classifiercode":"99-11","member_number":"A63444","first_name":"DYLAN","last_name":"BACHMAN","classification":"A","division":"LIMITED","hit_factor":9.2869},{"match_name":"SFA   USPSA 2/20/2016","match_date":"2016-02-20","stage_classifiercode":"99-11","member_number":"TY73114","first_name":"STEVE","last_name":"TING","classification":"A","division":"LIMITED","hit_factor":9.2764},{"match_name":"PCPS Classifier and Slot Match Jan 2020","match_date":"2020-01-12","stage_classifiercode":"99-11","member_number":"L4387","first_name":"JAMES","last_name":"KNOX","classification":"B","division":"LIMITED","hit_factor":9.2749},{"match_name":"NCPS USPSA Handgun Match November 27 2016","match_date":"2016-11-27","stage_classifiercode":"99-11","member_number":"TY72688","first_name":"BART","last_name":"HIGHTOWER","classification":"A","division":"LIMITED","hit_factor":9.2593},{"match_name":"Armory Indoor League","match_date":"2018-11-08","stage_classifiercode":"99-11","member_number":"A99246","first_name":"ADAM","last_name":"RISER","classification":"U","division":"LIMITED","hit_factor":9.2369},{"match_name":"EWPSA 2016-04","match_date":"2016-04-17","stage_classifiercode":"99-11","member_number":"ty49461","first_name":"DAVID","last_name":"BLOSSER","classification":"M","division":"LIMITED","hit_factor":9.2308},{"match_name":"Richmond Hot Shots October 6-7 USPSA Pistol Match","match_date":"2018-10-06","stage_classifiercode":"99-11","member_number":"TY44130","first_name":"SEBASTIAO","last_name":"FILHO","classification":"G","division":"LIMITED","hit_factor":9.2282},{"match_name":"Hawkeye Gun Club March 19th 2016 Match","match_date":"2016-03-19","stage_classifiercode":"99-11","member_number":"L3700","first_name":"NATHAN","last_name":"CARTER","classification":"A","division":"LIMITED","hit_factor":9.2251},{"match_name":"MSSA Uspsa Club Match","match_date":"2017-08-27","stage_classifiercode":"99-11","member_number":"A54411","first_name":"ANDY","last_name":"WOOD","classification":"G","division":"LIMITED","hit_factor":9.2199},{"match_name":"NPS October 2017 Match","match_date":"2017-10-14","stage_classifiercode":"99-11","member_number":"A68910","first_name":"LINCOLN","last_name":"HASSELL","classification":"M","division":"LIMITED","hit_factor":9.2184},{"match_name":"BPSA May 2016 New Shooter Clinic","match_date":"2016-05-09","stage_classifiercode":"99-11","member_number":"TY64738","first_name":"GERWIN","last_name":"HENN","classification":"M","division":"LIMITED","hit_factor":9.2131},{"match_name":"GAS Special Classifier","match_date":"2016-07-02","stage_classifiercode":"99-11","member_number":"A90796","first_name":"JEREMIAH","last_name":"JONES","classification":"B","division":"LIMITED","hit_factor":9.2105},{"match_name":"SUPS All Classifier Match March 1718 2018","match_date":"2018-03-17","stage_classifiercode":"99-11","member_number":"L3992","first_name":"TIM","last_name":"YACKLEY","classification":"A","division":"LIMITED","hit_factor":9.2105},{"match_name":"NAAS 03-05-2016","match_date":"2017-03-05","stage_classifiercode":"99-11","member_number":"TY81668","first_name":"BRENT","last_name":"WILEY","classification":"B","division":"LIMITED","hit_factor":9.1954},{"match_name":"WVPPS November 2018","match_date":"2018-11-18","stage_classifiercode":"99-11","member_number":"A51967","first_name":"ARON","last_name":"BRIGHT","classification":"A","division":"LIMITED","hit_factor":9.1918},{"match_name":"Tangi May 2016 USPSA","match_date":"2016-05-29","stage_classifiercode":"99-11","member_number":"TY28619","first_name":"SCOTT","last_name":"JACOB","classification":"A","division":"LIMITED","hit_factor":9.1873},{"match_name":"Rio Salado RSPP 3rd Saturday February 2020","match_date":"2020-02-15","stage_classifiercode":"99-11","member_number":"A77381","first_name":"KELLY","last_name":"FLETCHER","classification":"A","division":"LIMITED","hit_factor":9.1854},{"match_name":"CRCPS 2020-08-08","match_date":"2020-08-08","stage_classifiercode":"99-11","member_number":"FY26112","first_name":"RW (2ND GUN)","last_name":"SWAINSON","classification":"M","division":"LIMITED","hit_factor":9.1787},{"match_name":"CGC 4.30.17","match_date":"2017-04-30","stage_classifiercode":"99-11","member_number":"TY77590","first_name":"NICK","last_name":"BRAZZALE","classification":"M","division":"LIMITED","hit_factor":9.1743},{"match_name":"Oakdale USPSA MN07 6-25-2020","match_date":"2020-06-25","stage_classifiercode":"99-11","member_number":"A29923","first_name":"JON","last_name":"HUSPEK","classification":"M","division":"LIMITED","hit_factor":9.1711},{"match_name":"MS06 Team Magnolia February 2018 USPSA Match","match_date":"2018-02-03","stage_classifiercode":"99-11","member_number":"TY74425","first_name":"BILL","last_name":"OGLETREE","classification":"B","division":"LIMITED","hit_factor":9.1667},{"match_name":"Brothers N Arms September 2017 USPSA Match","match_date":"2017-09-16","stage_classifiercode":"99-11","member_number":"A94097","first_name":"STEVE","last_name":"TANNETTA","classification":"A","division":"LIMITED","hit_factor":9.1549},{"match_name":"Shongum Pistol November 2015","match_date":"2015-11-07","stage_classifiercode":"99-11","member_number":"TY77141","first_name":"LOUIE","last_name":"PRIMERO","classification":"B","division":"LIMITED","hit_factor":9.1525},{"match_name":"CJR&PC USPSA  June 10","match_date":"2018-06-10","stage_classifiercode":"99-11","member_number":"TY93686","first_name":"CLIFF","last_name":"AVERSANO JR","classification":"\"\"","division":"LIMITED","hit_factor":9.1503},{"match_name":"CJR&PC USPSA  June 10","match_date":"2018-06-10","stage_classifiercode":"99-11","member_number":"TY16101","first_name":"STEVE","last_name":"BIVENS","classification":"\"\"","division":"LIMITED","hit_factor":9.1493},{"match_name":"MCRC USPSA August 2018","match_date":"2018-08-11","stage_classifiercode":"99-11","member_number":"A69774","first_name":"DAVID","last_name":"FISCHER","classification":"B","division":"LIMITED","hit_factor":9.144},{"match_name":"West Coast IPSC","match_date":"2018-07-22","stage_classifiercode":"99-11","member_number":"A96044","first_name":"SEAN","last_name":"HENSLEY","classification":"A","division":"LIMITED","hit_factor":9.1429},{"match_name":"MS06 Team Magnolia February 2018 USPSA Match","match_date":"2018-02-03","stage_classifiercode":"99-11","member_number":"TY71097","first_name":"CHRIS","last_name":"BAUCUM","classification":"A","division":"LIMITED","hit_factor":9.1388},{"match_name":"PSAC_20161022","match_date":"2016-10-22","stage_classifiercode":"99-11","member_number":"TY16618","first_name":"JEFF","last_name":"MEYER","classification":"\"\"","division":"LIMITED","hit_factor":9.1379},{"match_name":"TMGN August 5th USPSA Match","match_date":"2018-08-05","stage_classifiercode":"99-11","member_number":"TY103667","first_name":"KEANU","last_name":"SY","classification":"\"\"","division":"LIMITED","hit_factor":9.1379},{"match_name":"OK Corral USPSA Classifier Match Feb 18 2017","match_date":"2017-02-18","stage_classifiercode":"99-11","member_number":"TY46304","first_name":"JAMES","last_name":"SALINGER","classification":"\"\"","division":"LIMITED","hit_factor":9.1354},{"match_name":"PCSI - September 2017 USPSA","match_date":"2017-09-02","stage_classifiercode":"99-11","member_number":"TY92693","first_name":"ANDREW","last_name":"DURKEE","classification":"B","division":"LIMITED","hit_factor":9.1228},{"match_name":"BRSP Tuesday Night USPSA Match - Sept 11","match_date":"2018-09-12","stage_classifiercode":"99-11","member_number":"TY97714","first_name":"JUSTIN","last_name":"LARKIN","classification":"M","division":"LIMITED","hit_factor":9.1211},{"match_name":"WSPS AUGUST 2016 USPSA","match_date":"2016-08-20","stage_classifiercode":"99-11","member_number":"A82072","first_name":"AL","last_name":"MONCH","classification":"B","division":"LIMITED","hit_factor":9.1205},{"match_name":"WELD ECO09 20180916","match_date":"2018-09-16","stage_classifiercode":"99-11","member_number":"A23079","first_name":"ARA","last_name":"MALJIAN","classification":"G","division":"LIMITED","hit_factor":9.1078},{"match_name":"USPSA CM99 Special Classifier MO19 Lamar October 9 2016","match_date":"2016-10-09","stage_classifiercode":"99-11","member_number":"a90516","first_name":"JARED","last_name":"FOX","classification":"B","division":"LIMITED","hit_factor":9.1068},{"match_name":"Brothers N Arms April 2016 USPSA Match (22Apr16-08:54:02)","match_date":"2016-04-23","stage_classifiercode":"99-11","member_number":"A58560","first_name":"THOMAS","last_name":"KNIGHT","classification":"M","division":"LIMITED","hit_factor":9.1065},{"match_name":"USPSA AR02 North Arkansas Action Pistol Feb 9th 2020","match_date":"2020-02-09","stage_classifiercode":"99-11","member_number":"FY78276","first_name":"CRAIG","last_name":"OKENFUSS","classification":"A","division":"LIMITED","hit_factor":9.1062},{"match_name":"NPS  May Match","match_date":"2016-05-14","stage_classifiercode":"99-11","member_number":"A72659","first_name":"CHUCK","last_name":"MOODY","classification":"A","division":"LIMITED","hit_factor":9.106},{"match_name":"Ripon Oct USPSA Match","match_date":"2015-10-24","stage_classifiercode":"99-11","member_number":"A19231","first_name":"DARRYL","last_name":"DOUGHERTY","classification":"M","division":"LIMITED","hit_factor":9.0909},{"match_name":"Applied IN25 USPSA December 2016","match_date":"2016-12-23","stage_classifiercode":"99-11","member_number":"TY64065","first_name":"DANIEL","last_name":"HART","classification":"A","division":"LIMITED","hit_factor":9.0909},{"match_name":"CJR&PC USPSA  June 10","match_date":"2018-06-10","stage_classifiercode":"99-11","member_number":"TY98580","first_name":"JASON","last_name":"SENDELSKY","classification":"\"\"","division":"LIMITED","hit_factor":9.0909},{"match_name":"Ontelaunee USPSA  July 2018","match_date":"2018-07-29","stage_classifiercode":"99-11","member_number":"A101876","first_name":"SEAN","last_name":"CONLEY","classification":"U","division":"LIMITED","hit_factor":9.0909},{"match_name":"Prescott Action Shooters 1st Saturday USPSA 7-7-2018","match_date":"2018-07-07","stage_classifiercode":"99-11","member_number":"L3837","first_name":"NILS","last_name":"JONASSON","classification":"G","division":"LIMITED","hit_factor":9.0759},{"match_name":"Springfield Tactical Shooters 04/05/2018","match_date":"2018-04-05","stage_classifiercode":"99-11","member_number":"TY35016","first_name":"ANDREW","last_name":"CATLIN","classification":"B","division":"LIMITED","hit_factor":9.0753},{"match_name":"TAP USPSA Pistol Match Aug 14 2016","match_date":"2016-08-14","stage_classifiercode":"99-11","member_number":"a46690","first_name":"GILBERT","last_name":"GESMUNDO","classification":"G","division":"LIMITED","hit_factor":9.0615},{"match_name":"SCCCNOVEMBER2016","match_date":"2016-11-13","stage_classifiercode":"99-11","member_number":"ty77176","first_name":"DON","last_name":"OBRADOVICH","classification":"B","division":"LIMITED","hit_factor":9.0604},{"match_name":"Grandbaggers August 2017","match_date":"2017-08-03","stage_classifiercode":"99-11","member_number":"A80318","first_name":"JIM","last_name":"ADAME","classification":"M","division":"LIMITED","hit_factor":9.0598},{"match_name":"Brazosland Pistoleros USPSA - Sunday August 8th","match_date":"2021-08-08","stage_classifiercode":"99-11","member_number":"A119231","first_name":"ANTHONY","last_name":"VEITH","classification":"U","division":"LIMITED","hit_factor":9.0484},{"match_name":"AGC_20170903","match_date":"2017-09-03","stage_classifiercode":"99-11","member_number":"A67134","first_name":"KIRK","last_name":"WILSON","classification":"A","division":"LIMITED","hit_factor":9.0468},{"match_name":"WVPPS May 2021","match_date":"2021-05-16","stage_classifiercode":"99-11","member_number":"TY65620","first_name":"SCOTT","last_name":"METCALF","classification":"B","division":"LIMITED","hit_factor":9.0452},{"match_name":"BPSA January 2017 USPSA","match_date":"2017-01-22","stage_classifiercode":"99-11","member_number":"A76040","first_name":"STEVEN","last_name":"MOSHER","classification":"A","division":"LIMITED","hit_factor":9.0426},{"match_name":"2017 Bay bridge Charity Classic - Richmond October 14-15-2017","match_date":"2017-10-14","stage_classifiercode":"99-11","member_number":"L3809","first_name":"GREGORY","last_name":"FIDDES","classification":"M","division":"LIMITED","hit_factor":9.0395},{"match_name":"ARPC USPSA Match 8-23-20","match_date":"2020-08-23","stage_classifiercode":"99-11","member_number":"A100828","first_name":"MICHAEL","last_name":"HARPER","classification":"B","division":"LIMITED","hit_factor":9.0343},{"match_name":"Prescott Action Shooters 1st Saturday USPSA 6-2-2018 ","match_date":"2018-06-03","stage_classifiercode":"99-11","member_number":"TY89865","first_name":"SETH","last_name":"BLAIR","classification":"B","division":"LIMITED","hit_factor":9.0323},{"match_name":"DWB - Deadwood Boys USPSA 20 September 2020  Classifier Match Makeup","match_date":"2020-09-20","stage_classifiercode":"99-11","member_number":"TY123132","first_name":"COYLED","last_name":"COBRA","classification":"B","division":"LIMITED","hit_factor":9.0301},{"match_name":"CASA USPSA  Feb 17","match_date":"2017-02-05","stage_classifiercode":"99-11","member_number":"TY82278","first_name":"ROWDY","last_name":"BRICCO","classification":"U","division":"LIMITED","hit_factor":9.0177},{"match_name":"Target  Sports Central Indiana Championship","match_date":"2020-08-22","stage_classifiercode":"99-11","member_number":"TY116328","first_name":"NEWEL","last_name":"ANDERSON","classification":"B","division":"LIMITED","hit_factor":9.0164},{"match_name":"Richmond Hot Shots April 14-15-2018 USPSA Pistol Match","match_date":"2018-04-14","stage_classifiercode":"99-11","member_number":"FY63012","first_name":"MANUEL","last_name":"NEWMAN","classification":"M","division":"LIMITED","hit_factor":9.0164},{"match_name":"Ontelaunee USPSA July 2016","match_date":"2016-07-23","stage_classifiercode":"99-11","member_number":"A94001","first_name":"NICK","last_name":"REYNOLDS","classification":"C","division":"LIMITED","hit_factor":9.015},{"match_name":"Coyote Tuesday USPSA match 3-28-17 Classifier Match","match_date":"2017-03-29","stage_classifiercode":"99-11","member_number":"31135","first_name":"JAY","last_name":"CHRISTIANSEN","classification":"U","division":"LIMITED","hit_factor":9.015},{"match_name":"Extreme GM USPSA  November","match_date":"2020-11-27","stage_classifiercode":"99-11","member_number":"A79140","first_name":"RALEIGH","last_name":"HART","classification":"A","division":"LIMITED","hit_factor":9.0121},{"match_name":"CGGR July USPSA Match","match_date":"2018-07-21","stage_classifiercode":"99-11","member_number":"A43010","first_name":"MARK","last_name":"DYE","classification":"M","division":"LIMITED","hit_factor":9.009},{"match_name":"PPS CLASSIFIER MATCH 2020-01-28","match_date":"2020-01-29","stage_classifiercode":"99-11","member_number":"TY62910","first_name":"LARRY","last_name":"SCOTT","classification":"B","division":"LIMITED","hit_factor":9.0047},{"match_name":"Pharr action shooters USPSA match at Coyote 02-20-16","match_date":"2016-02-20","stage_classifiercode":"99-11","member_number":"A83205","first_name":"DON","last_name":"SPRINGER","classification":"B","division":"LIMITED","hit_factor":9.0047},{"match_name":"WSRC USPSA","match_date":"2016-10-22","stage_classifiercode":"99-11","member_number":"TY66904","first_name":"KEN","last_name":"RIHANEK","classification":"A","division":"LIMITED","hit_factor":9.0047},{"match_name":"SAGC CTX04 Monthly USPSA Match - September 2020","match_date":"2020-09-27","stage_classifiercode":"99-11","member_number":"A15867","first_name":"ALAN","last_name":"LAZA","classification":"M","division":"LIMITED","hit_factor":9.0038},{"match_name":"GTS Indoor USPSA February 27 2020","match_date":"2020-02-28","stage_classifiercode":"99-11","member_number":"A119856","first_name":"CHRIS","last_name":"RALPH","classification":"U","division":"LIMITED","hit_factor":9},{"match_name":"Laser Ninja Dragon League USPSA July 2nd Special Classifier","match_date":"2017-07-02","stage_classifiercode":"99-11","member_number":"Ty75346","first_name":"CALVIN","last_name":"SMILEY","classification":"B","division":"LIMITED","hit_factor":8.9983},{"match_name":"USPSA CM99 Special Classifier MO19 Lamar October 9 2016","match_date":"2016-10-09","stage_classifiercode":"99-11","member_number":"ty72757","first_name":"MARK","last_name":"CRABTREE","classification":"A","division":"LIMITED","hit_factor":8.9983},{"match_name":"WVPPS November 2018","match_date":"2018-11-18","stage_classifiercode":"99-11","member_number":"TY106367","first_name":"DANIEL","last_name":"MATHIAS","classification":"B","division":"LIMITED","hit_factor":8.9947},{"match_name":"Wvpps Nov. 2016","match_date":"2016-11-20","stage_classifiercode":"99-11","member_number":"a77176","first_name":"DON","last_name":"OBRADOVICH","classification":"B","division":"LIMITED","hit_factor":8.9888},{"match_name":"Baps March Uspsa","match_date":"2016-03-19","stage_classifiercode":"99-11","member_number":"A34763","first_name":"MATT","last_name":"LEM","classification":"A","division":"LIMITED","hit_factor":8.985},{"match_name":"PTPC April 2nd USPSA Match","match_date":"2017-04-02","stage_classifiercode":"99-11","member_number":"TY68407","first_name":"PAUL","last_name":"IRLACHER","classification":"A","division":"LIMITED","hit_factor":8.9767},{"match_name":"ACPSA November 2018","match_date":"2018-11-24","stage_classifiercode":"99-11","member_number":"TY86756","first_name":"RUSS","last_name":"DEAN","classification":"A","division":"LIMITED","hit_factor":8.9723},{"match_name":"Hopkinton USPSA July 2018","match_date":"2018-07-07","stage_classifiercode":"99-11","member_number":"A84437","first_name":"SEBASTIAN","last_name":"YORDAN","classification":"A","division":"LIMITED","hit_factor":8.9701},{"match_name":"Nampa USPSA December 26th 2020","match_date":"2020-12-26","stage_classifiercode":"99-11","member_number":"Ty94890","first_name":"CHRIS","last_name":"CLARK","classification":"A","division":"LIMITED","hit_factor":8.96},{"match_name":"MS06 Team Magnolia June 2017 USPSA Match","match_date":"2017-06-04","stage_classifiercode":"99-11","member_number":"A71708","first_name":"JUSTIN","last_name":"MYERS","classification":"U","division":"LIMITED","hit_factor":8.9552},{"match_name":"Wvpps Nov. 2016","match_date":"2016-11-20","stage_classifiercode":"99-11","member_number":"A51967","first_name":"ARON","last_name":"BRIGHT","classification":"A","division":"LIMITED","hit_factor":8.9506},{"match_name":"Collin County USPSA 04-25-2021","match_date":"2021-04-24","stage_classifiercode":"99-11","member_number":"TY102459","first_name":"MARCELO","last_name":"FARTURA","classification":"B","division":"LIMITED","hit_factor":8.9474},{"match_name":"North Mountain PS April","match_date":"2016-04-15","stage_classifiercode":"99-11","member_number":"TY69728","first_name":"JOSEPH","last_name":"PITHA","classification":"M","division":"LIMITED","hit_factor":8.9457},{"match_name":"MISS USPSA Match 10-5-16","match_date":"2016-10-03","stage_classifiercode":"99-11","member_number":"TY68263","first_name":"ALLEN","last_name":"BORG","classification":"M","division":"LIMITED","hit_factor":8.9431},{"match_name":"BTSA USPSA 2021-7 Aug 7","match_date":"2021-08-07","stage_classifiercode":"99-11","member_number":"FYF91822","first_name":"JEFF","last_name":"ORITA","classification":"U","division":"LIMITED","hit_factor":8.9317},{"match_name":"FBURG March Level I USPSA","match_date":"2016-03-06","stage_classifiercode":"99-11","member_number":"TY66449","first_name":"LEE","last_name":"WILLS","classification":"A","division":"LIMITED","hit_factor":8.9256},{"match_name":"AGC_20151206","match_date":"2015-12-06","stage_classifiercode":"99-11","member_number":"A86598","first_name":"BRUCE","last_name":"MEO","classification":"C","division":"LIMITED","hit_factor":8.9127},{"match_name":"Rio Salado RSPP 3rd Saturday February 2020","match_date":"2020-02-15","stage_classifiercode":"99-11","member_number":"A97078","first_name":"JIM","last_name":"CONNER","classification":"B","division":"LIMITED","hit_factor":8.9109},{"match_name":"BUAS February Match","match_date":"2018-02-11","stage_classifiercode":"99-11","member_number":"a84437","first_name":"SEBASTIAN","last_name":"YORDAN","classification":"A","division":"LIMITED","hit_factor":8.9015},{"match_name":"BAS  April 2017 USPSA","match_date":"2017-04-15","stage_classifiercode":"99-11","member_number":"TY73127","first_name":"SEAN","last_name":"JANICKI","classification":"M","division":"LIMITED","hit_factor":8.8957},{"match_name":"SCCCNOVEMBER2016","match_date":"2016-11-13","stage_classifiercode":"99-11","member_number":"a50141","first_name":"DAVE","last_name":"BUTLER","classification":"M","division":"LIMITED","hit_factor":8.8889},{"match_name":"ENPS 2018 June USPSA Match","match_date":"2018-06-03","stage_classifiercode":"99-11","member_number":"A16178","first_name":"DANNY","last_name":"MILAN","classification":"C","division":"LIMITED","hit_factor":8.8821},{"match_name":"SAPSC Monthly USPSA Classifier Match 20160209","match_date":"2016-02-09","stage_classifiercode":"99-11","member_number":"A79845","first_name":"JOHNNY","last_name":"REED","classification":"A","division":"LIMITED","hit_factor":8.8816},{"match_name":"LdF USPSA Match May 12 2018","match_date":"2018-05-12","stage_classifiercode":"99-11","member_number":"A81018","first_name":"BART","last_name":"DEL RIO","classification":"M","division":"LIMITED","hit_factor":8.8777},{"match_name":"BPC 18 FEB 18","match_date":"2018-02-18","stage_classifiercode":"99-11","member_number":"A83596","first_name":"JAY","last_name":"WHITTAKER","classification":"M","division":"LIMITED","hit_factor":8.8748},{"match_name":"Custer USPSA Mar 7th 2021","match_date":"2021-03-07","stage_classifiercode":"99-11","member_number":"L4898","first_name":"MARCEL","last_name":"ENGLMAIER","classification":"U","division":"LIMITED","hit_factor":8.8725},{"match_name":"Richmond Hot Shots April 14-15-2018 USPSA Pistol Match","match_date":"2018-04-14","stage_classifiercode":"99-11","member_number":"\"\"","first_name":"DOUG","last_name":"LARSON","classification":"A","division":"LIMITED","hit_factor":8.867},{"match_name":"APSC 4th Annual Holiday Hosefest USPSA Match 12-02-17","match_date":"2017-12-02","stage_classifiercode":"99-11","member_number":"A87214","first_name":"CORY","last_name":"KLEMASHEVICH","classification":"G","division":"LIMITED","hit_factor":8.8652},{"match_name":"MISS Match 10-4-17","match_date":"2017-10-04","stage_classifiercode":"99-11","member_number":"A85284","first_name":"ROMAN","last_name":"HRUSKA","classification":"B","division":"LIMITED","hit_factor":8.8647},{"match_name":"Collin County USPSA 04-25-2021","match_date":"2021-04-24","stage_classifiercode":"99-11","member_number":"TY112551","first_name":"TONY EDUARDO","last_name":"HOERHANN","classification":"U","division":"LIMITED","hit_factor":8.8629},{"match_name":"LdF USPSA Match May 12 2018","match_date":"2018-05-12","stage_classifiercode":"99-11","member_number":"A81101","first_name":"LES","last_name":"ANDERSON","classification":"A","division":"LIMITED","hit_factor":8.8586},{"match_name":"Griffin USPSA Match Jan 21 2017","match_date":"2017-01-21","stage_classifiercode":"99-11","member_number":"a95386","first_name":"GRAHAM","last_name":"PAGE","classification":"B","division":"LIMITED","hit_factor":8.8468},{"match_name":"AGC_20151206","match_date":"2015-12-06","stage_classifiercode":"99-11","member_number":"TY65590","first_name":"STEVE","last_name":"STETLER","classification":"A","division":"LIMITED","hit_factor":8.8388},{"match_name":"Clinton County USPSA July 23 2016","match_date":"2016-07-23","stage_classifiercode":"99-11","member_number":"A80011","first_name":"SHAYNE","last_name":"DILLINGER","classification":"B","division":"LIMITED","hit_factor":8.838},{"match_name":"NW01 Paul Bunyan CS Series May 9 2021","match_date":"2021-05-09","stage_classifiercode":"99-11","member_number":"TY78052","first_name":"SERGE","last_name":"DAVIS","classification":"M","division":"LIMITED","hit_factor":8.8285},{"match_name":"Ontelaunee USPSA July 2016","match_date":"2016-07-23","stage_classifiercode":"99-11","member_number":"A76022","first_name":"MASHU","last_name":"KOBAYASHI","classification":"B","division":"LIMITED","hit_factor":8.8189},{"match_name":"USPSA MO21 2Alpha SBRC March 2018","match_date":"2018-03-24","stage_classifiercode":"99-11","member_number":"A101290","first_name":"AUSTIN","last_name":"RIST","classification":"U","division":"LIMITED","hit_factor":8.8183},{"match_name":"RPS November 2018 USPSA Match","match_date":"2018-11-10","stage_classifiercode":"99-11","member_number":"TY47262","first_name":"MIKE","last_name":"CROWELL","classification":"M","division":"LIMITED","hit_factor":8.8141},{"match_name":"PRPSA USPSA CHALLENGE PAN AMERICAN","match_date":"2021-07-11","stage_classifiercode":"99-11","member_number":"A97576","first_name":"RAMON L","last_name":"RIVERA","classification":"","division":"LIMITED","hit_factor":8.805},{"match_name":"Shoot GTR 05/07/17","match_date":"2017-05-07","stage_classifiercode":"99-11","member_number":"A73910","first_name":"JEREMY","last_name":"LIGHTNER","classification":"A","division":"LIMITED","hit_factor":8.804},{"match_name":"RPS November 2018 USPSA Match","match_date":"2018-11-10","stage_classifiercode":"99-11","member_number":"TY82683","first_name":"BRIAN","last_name":"WOLFF","classification":"B","division":"LIMITED","hit_factor":8.8},{"match_name":"BHPSC Weekly Match 2-24-2017 Special Classifier Match","match_date":"2017-02-25","stage_classifiercode":"99-11","member_number":"TY73660","first_name":"JUSTIN","last_name":"GRIFFIS","classification":"A","division":"LIMITED","hit_factor":8.7948},{"match_name":"Ontelaunee USPSA July 2016","match_date":"2016-07-23","stage_classifiercode":"99-11","member_number":"A69256","first_name":"KRAIG","last_name":"BAER","classification":"A","division":"LIMITED","hit_factor":8.7931},{"match_name":"Richmond Hot Shots April 30-May 1st USPSA Pistol Match","match_date":"2016-04-30","stage_classifiercode":"99-11","member_number":"4342562904061429","first_name":"MAURICE","last_name":"CORMIER","classification":"B","division":"LIMITED","hit_factor":8.7873},{"match_name":"Brothers N Arms September 2017 USPSA Match","match_date":"2017-09-16","stage_classifiercode":"99-11","member_number":"A63746","first_name":"ROBERT","last_name":"JONES","classification":"M","division":"LIMITED","hit_factor":8.7838},{"match_name":"CJR&PC USPSA  June 10","match_date":"2018-06-10","stage_classifiercode":"99-11","member_number":"A85855","first_name":"GABE","last_name":"BLARDONY","classification":"\"\"","division":"LIMITED","hit_factor":8.7827},{"match_name":"Brothers N Arms September 2017 USPSA Match","match_date":"2017-09-16","stage_classifiercode":"99-11","member_number":"TY82466","first_name":"THOMAS","last_name":"ARTHUR","classification":"A","division":"LIMITED","hit_factor":8.7774},{"match_name":"Shoot GTR 05/07/17","match_date":"2017-05-07","stage_classifiercode":"99-11","member_number":"\"\"","first_name":"MIKE","last_name":"KEENAN","classification":"\"\"","division":"LIMITED","hit_factor":8.7748},{"match_name":"Target  Sports Central Indiana Championship","match_date":"2020-08-22","stage_classifiercode":"99-11","member_number":"A113061","first_name":"BRANDON","last_name":"CALDWELL","classification":"U","division":"LIMITED","hit_factor":8.7657},{"match_name":"Grandbaggers August 2017","match_date":"2017-08-03","stage_classifiercode":"99-11","member_number":"A97078","first_name":"JIM","last_name":"CONNER","classification":"C","division":"LIMITED","hit_factor":8.7637},{"match_name":"2016-02-06 USPSA at Phoenix Rod and Gun Club","match_date":"2016-02-06","stage_classifiercode":"99-11","member_number":"TY72554","first_name":"IAN","last_name":"KANTOR","classification":"M","division":"LIMITED","hit_factor":8.758},{"match_name":"CGC 03-10-2018","match_date":"2018-03-10","stage_classifiercode":"99-11","member_number":"L3864","first_name":"VINCENT","last_name":"PAINTER","classification":"A","division":"LIMITED","hit_factor":8.758},{"match_name":"Ontelaunee USPSA July 2016","match_date":"2016-07-23","stage_classifiercode":"99-11","member_number":"L3016","first_name":"BOB","last_name":"ARIYAMITR","classification":"A","division":"LIMITED","hit_factor":8.7542},{"match_name":"Rankin Field June Sunday USPSA","match_date":"2020-06-21","stage_classifiercode":"99-11","member_number":"TY90929","first_name":"JOHN","last_name":"DEVERE","classification":"A","division":"LIMITED","hit_factor":8.7542},{"match_name":"Shadow Hawk Defense USPSA Special Classifier","match_date":"2020-11-14","stage_classifiercode":"99-11","member_number":"TY88820","first_name":"DARIN","last_name":"MORRELL","classification":"B","division":"LIMITED","hit_factor":8.7479},{"match_name":"Bigfork Gun Club October Match","match_date":"2016-10-01","stage_classifiercode":"99-11","member_number":"A73573","first_name":"JACK","last_name":"SPILLMAN","classification":"C","division":"LIMITED","hit_factor":8.747},{"match_name":"WVRPC USPSA 1SEPT2018","match_date":"2018-09-01","stage_classifiercode":"99-11","member_number":"FY81341","first_name":"JOEY","last_name":"ZADIK","classification":"M","division":"LIMITED","hit_factor":8.7459},{"match_name":"CCPL 01102016 ALL CLASSIFIER MATCH","match_date":"2016-01-10","stage_classifiercode":"99-11","member_number":"TY87874","first_name":"RODEL","last_name":"JARDINASO","classification":"U","division":"LIMITED","hit_factor":8.7413},{"match_name":"Lin","match_date":"2016-12-17","stage_classifiercode":"99-11","member_number":"\"\"","first_name":"DONNIE","last_name":"SMITH","classification":"A","division":"LIMITED","hit_factor":8.7379},{"match_name":"Benton Gun Club-USPSA September 27","match_date":"2020-09-27","stage_classifiercode":"99-11","member_number":"A96997","first_name":"DAVID","last_name":"GILBERT","classification":"U","division":"LIMITED","hit_factor":8.7363},{"match_name":"Collin County USPSA 04-25-2021","match_date":"2021-04-24","stage_classifiercode":"99-11","member_number":"A86465","first_name":"JUSTIN","last_name":"SHIELDS","classification":"A","division":"LIMITED","hit_factor":8.7289},{"match_name":"CGC 4.30.17","match_date":"2017-04-30","stage_classifiercode":"99-11","member_number":"A81990","first_name":"R LEIGHTON","last_name":"CASH","classification":"A","division":"LIMITED","hit_factor":8.7227},{"match_name":"APSC USPSA 02-15-20","match_date":"2020-02-15","stage_classifiercode":"99-11","member_number":"TY34722","first_name":"LARRY","last_name":"SELLERS","classification":"M","division":"LIMITED","hit_factor":8.7102},{"match_name":"SLPSA July USPSA match","match_date":"2018-07-21","stage_classifiercode":"99-11","member_number":"\"\"","first_name":"TIM","last_name":"PANIC","classification":"U","division":"LIMITED","hit_factor":8.7097},{"match_name":"MS06 Team Magnolia June 2017 USPSA Match","match_date":"2017-06-04","stage_classifiercode":"99-11","member_number":"A67704","first_name":"MICHAEL","last_name":"MCDONALD","classification":"A","division":"LIMITED","hit_factor":8.7092},{"match_name":"BORCC USPSA May 2018","match_date":"2018-05-26","stage_classifiercode":"99-11","member_number":"TY69648","first_name":"STEVE","last_name":"GALKA","classification":"M","division":"LIMITED","hit_factor":8.6957},{"match_name":"ShooT GTR USPSA 1/1/17","match_date":"2017-01-01","stage_classifiercode":"99-11","member_number":"FY77988","first_name":"RICH","last_name":"VALVO","classification":"B","division":"LIMITED","hit_factor":8.6885},{"match_name":"CFRPC December USPSA (Classifier)","match_date":"2018-12-16","stage_classifiercode":"99-11","member_number":"A98681","first_name":"JASON","last_name":"PERCY","classification":"B","division":"LIMITED","hit_factor":8.6826},{"match_name":"BPSA January 2017 USPSA","match_date":"2017-01-22","stage_classifiercode":"99-11","member_number":"A94097","first_name":"STEVEN","last_name":"TANNETTA","classification":"B","division":"LIMITED","hit_factor":8.6817},{"match_name":"Deadwood Boys USPSA All Classifier Match - 29 July 2018","match_date":"2018-07-29","stage_classifiercode":"99-11","member_number":"A101565","first_name":"KYLE","last_name":"LITZIE","classification":"U","division":"LIMITED","hit_factor":8.6811},{"match_name":"Deadwood Boys USPSA All Classifier Match","match_date":"2016-08-07","stage_classifiercode":"99-11","member_number":"A-96044","first_name":"SEAN","last_name":"HENSLEY","classification":"U","division":"LIMITED","hit_factor":8.6806},{"match_name":"Quinton USPSA - July 14 2018","match_date":"2018-07-14","stage_classifiercode":"99-11","member_number":"A94376","first_name":"MARTIN","last_name":"NAUGHTON","classification":"C","division":"LIMITED","hit_factor":8.6806},{"match_name":"CCAS June 2016","match_date":"2016-06-25","stage_classifiercode":"99-11","member_number":"A93137","first_name":"BILLY","last_name":"DODSON","classification":"C","division":"LIMITED","hit_factor":8.6751},{"match_name":"YRPA USPSA MARCH  2018","match_date":"2018-03-25","stage_classifiercode":"99-11","member_number":"A94621","first_name":"BRIAN","last_name":"PEPPER","classification":"B","division":"LIMITED","hit_factor":8.6751},{"match_name":"Benton Gun Club-USPSA May27 2018 CLASIFIER","match_date":"2018-05-27","stage_classifiercode":"99-11","member_number":"A110925","first_name":"SHAUN","last_name":"ROBERSON","classification":"U","division":"LIMITED","hit_factor":8.6697},{"match_name":"GAS Special Classifier","match_date":"2016-07-02","stage_classifiercode":"99-11","member_number":"Fy66190","first_name":"MATT","last_name":"WAITE","classification":"A","division":"LIMITED","hit_factor":8.6687},{"match_name":"USPSA MO21 2Alpha SBRC October 2017","match_date":"2017-10-21","stage_classifiercode":"99-11","member_number":"A102464","first_name":"COLE","last_name":"HUFFMAN","classification":"B","division":"LIMITED","hit_factor":8.6626},{"match_name":"INAS May 2020 USPSA","match_date":"2020-05-09","stage_classifiercode":"99-11","member_number":"TY83460","first_name":"PAT","last_name":"KRENTZ","classification":"M","division":"LIMITED","hit_factor":8.6601},{"match_name":"ARPC USPSA Match 8-23-20","match_date":"2020-08-23","stage_classifiercode":"99-11","member_number":"A26779","first_name":"KEITH","last_name":"LICHAY","classification":"A","division":"LIMITED","hit_factor":8.6587},{"match_name":"STAGE ZERO SHOOTING SUPPLY USPSA","match_date":"2020-07-16","stage_classifiercode":"99-11","member_number":"A112964","first_name":"MATTHEW","last_name":"BEAM RESHOOT","classification":"A","division":"LIMITED","hit_factor":8.6572},{"match_name":"APSC USPSA 02-15-20","match_date":"2020-02-15","stage_classifiercode":"99-11","member_number":"A86908","first_name":"MICHAEL","last_name":"LUNDGREN","classification":"B","division":"LIMITED","hit_factor":8.6567},{"match_name":"17 South - April Fools Match","match_date":"2017-04-01","stage_classifiercode":"99-11","member_number":"A88615","first_name":"ISRAEL","last_name":"GONZALEZ","classification":"B","division":"LIMITED","hit_factor":8.6553},{"match_name":"NW01 April da Turd","match_date":"2018-04-04","stage_classifiercode":"99-11","member_number":"A57006","first_name":"SCOTT","last_name":"PRIES","classification":"GM","division":"LIMITED","hit_factor":8.6553},{"match_name":"Hopkinton USPSA May 2017","match_date":"2017-05-06","stage_classifiercode":"99-11","member_number":"TY76424","first_name":"HARRISON","last_name":"SCHMIDT","classification":"A","division":"LIMITED","hit_factor":8.6505},{"match_name":"AGC_20170903","match_date":"2017-09-03","stage_classifiercode":"99-11","member_number":"FY26112","first_name":"RW","last_name":"SWAINSON","classification":"M","division":"LIMITED","hit_factor":8.6438},{"match_name":"Hawkeye Gun Club July 2016 Match","match_date":"2016-07-16","stage_classifiercode":"99-11","member_number":"L3906","first_name":"ARIC","last_name":"COWAT","classification":"B","division":"LIMITED","hit_factor":8.6438},{"match_name":"PSAC 20171028","match_date":"2017-10-28","stage_classifiercode":"99-11","member_number":"TY81049","first_name":"ROBERT","last_name":"MERKEL","classification":"A","division":"LIMITED","hit_factor":8.64},{"match_name":"Richmond Hot Shots April 30-May 1st USPSA Pistol Match","match_date":"2016-04-30","stage_classifiercode":"99-11","member_number":"A91389","first_name":"RUSSEL","last_name":"BRIDGES","classification":"B","division":"LIMITED","hit_factor":8.6356},{"match_name":"GPS.   August  2016 ","match_date":"2016-08-28","stage_classifiercode":"99-11","member_number":"A60099","first_name":"ROSS","last_name":"APFFEL","classification":"B","division":"LIMITED","hit_factor":8.6342},{"match_name":"LA05 Tangi USPSA 4th Sunday May 2021","match_date":"2021-05-23","stage_classifiercode":"99-11","member_number":"A70036","first_name":"JONATHAN","last_name":"JONES","classification":"A","division":"LIMITED","hit_factor":8.6268},{"match_name":"ORPCI 2017 June USPSA Classifer Match","match_date":"2017-06-25","stage_classifiercode":"99-11","member_number":"PEN","first_name":"ANDREW","last_name":"TILFORD","classification":"U","division":"LIMITED","hit_factor":8.6233},{"match_name":"CFRPC December USPSA (Classifier)","match_date":"2018-12-16","stage_classifiercode":"99-11","member_number":"A7875","first_name":"LOUIS","last_name":"HEMNESS","classification":"A","division":"LIMITED","hit_factor":8.6207},{"match_name":"Matamoras  Wednesday USPSA  Match","match_date":"2017-07-26","stage_classifiercode":"99-11","member_number":"A60297","first_name":"PETER","last_name":"BRICKNER","classification":"B","division":"LIMITED","hit_factor":8.6124},{"match_name":"AGC_20170903","match_date":"2017-09-03","stage_classifiercode":"99-11","member_number":"A77590","first_name":"NICK","last_name":"BRAZZALE","classification":"U","division":"LIMITED","hit_factor":8.6103},{"match_name":"MISS Match 10-4-17","match_date":"2017-10-04","stage_classifiercode":"99-11","member_number":"FY70698","first_name":"JASON","last_name":"CARILLO","classification":"A","division":"LIMITED","hit_factor":8.6066},{"match_name":"Pinetucky USPSA 06-16-18","match_date":"2018-06-16","stage_classifiercode":"99-11","member_number":"A8318","first_name":"BOB","last_name":"BAILEY","classification":"G","division":"LIMITED","hit_factor":8.6022},{"match_name":"Heritage March 2021 USPSA","match_date":"2021-03-13","stage_classifiercode":"99-11","member_number":"A70300","first_name":"DAVE","last_name":"HORN","classification":"A","division":"LIMITED","hit_factor":8.5965},{"match_name":"Prescott Action Shooters 1st Saturday USPSA 6-2-2018 ","match_date":"2018-06-03","stage_classifiercode":"99-11","member_number":"A55525","first_name":"MICHAEL","last_name":"MCDANNELL","classification":"A","division":"LIMITED","hit_factor":8.595},{"match_name":"INAS May 2020 USPSA","match_date":"2020-05-09","stage_classifiercode":"99-11","member_number":"A42720","first_name":"ADAM","last_name":"MCINTOSH","classification":"M","division":"LIMITED","hit_factor":8.589},{"match_name":"Pinetucky USPSA 06-16-18","match_date":"2018-06-16","stage_classifiercode":"99-11","member_number":"Ty53092","first_name":"DEWEY","last_name":"HUTSON","classification":"M","division":"LIMITED","hit_factor":8.589},{"match_name":"Parabellum USPSA May 10 2017","match_date":"2017-05-10","stage_classifiercode":"99-11","member_number":"A51967","first_name":"ARON","last_name":"BRIGHT","classification":"A","division":"LIMITED","hit_factor":8.5859},{"match_name":"TAP USPSA Pistol Match Aug 14 2016","match_date":"2016-08-14","stage_classifiercode":"99-11","member_number":"TY91248","first_name":"DAVID","last_name":"GEORGE","classification":"B","division":"LIMITED","hit_factor":8.5803},{"match_name":"Grandbaggers August 2017","match_date":"2017-08-03","stage_classifiercode":"99-11","member_number":"TY87182","first_name":"MILTON","last_name":"MEANS","classification":"B","division":"LIMITED","hit_factor":8.5799},{"match_name":"Omaha Gun Club USPSA February 28th 2018","match_date":"2018-03-01","stage_classifiercode":"99-11","member_number":"A79735","first_name":"ALEXANDER","last_name":"GAC","classification":"A","division":"LIMITED","hit_factor":8.5763},{"match_name":"LCSA  USPSA April 2017","match_date":"2017-04-08","stage_classifiercode":"99-11","member_number":"A97335","first_name":"JOSEPH","last_name":"WHITE","classification":"B","division":"LIMITED","hit_factor":8.5763},{"match_name":"Ontelaunee USPSA July 2016","match_date":"2016-07-23","stage_classifiercode":"99-11","member_number":"A41482","first_name":"MIKE","last_name":"HESS","classification":"C","division":"LIMITED","hit_factor":8.5761},{"match_name":"PRG - Oh Shoot USPSA February 21st - 3rd Sunday Match","match_date":"2021-02-21","stage_classifiercode":"99-11","member_number":"TY82338","first_name":"ALBERT","last_name":"WILLINGHAM","classification":"B","division":"LIMITED","hit_factor":8.5672},{"match_name":"Coyote USPSA match 4-21-18","match_date":"2018-04-21","stage_classifiercode":"99-11","member_number":"A63791","first_name":"JAMES","last_name":"ABENOJA","classification":"A","division":"LIMITED","hit_factor":8.561},{"match_name":"CCPL 12102017","match_date":"2017-12-08","stage_classifiercode":"99-11","member_number":"TY87874","first_name":"RODEL","last_name":"JARDINASO","classification":"A","division":"LIMITED","hit_factor":8.5537},{"match_name":"NRF 2021-09 USPSA","match_date":"2021-09-04","stage_classifiercode":"99-11","member_number":"A105075","first_name":"WILLIAM","last_name":"DAVENPORT","classification":"A","division":"LIMITED","hit_factor":8.5515},{"match_name":"SUPS All Classifier Match March 1718 2018","match_date":"2018-03-17","stage_classifiercode":"99-11","member_number":"TY10571","first_name":"GLENFRED","last_name":"WONG","classification":"M","division":"LIMITED","hit_factor":8.5515},{"match_name":"Hopkinton USPSA May 2017","match_date":"2017-05-06","stage_classifiercode":"99-11","member_number":"A101577","first_name":"LUKE","last_name":"TUSSING","classification":"\"\"","division":"LIMITED","hit_factor":8.5484},{"match_name":"STAGE ZERO SHOOTING SUPPLY USPSA","match_date":"2020-07-16","stage_classifiercode":"99-11","member_number":"TY129194","first_name":"BENJAMIN","last_name":"FOUSE","classification":"B","division":"LIMITED","hit_factor":8.5443},{"match_name":"Rio Salado RSPP 3rd Saturday February 2020","match_date":"2020-02-15","stage_classifiercode":"99-11","member_number":"A109765","first_name":"CHRIS","last_name":"BREW","classification":"B","division":"LIMITED","hit_factor":8.5386},{"match_name":"Chillicothe February 2021 USPSA Match","match_date":"2021-02-28","stage_classifiercode":"99-11","member_number":"A102630","first_name":"NATE","last_name":"POULSON","classification":"M","division":"LIMITED","hit_factor":8.5299},{"match_name":"Rankin Field Sunday USPSA","match_date":"2018-04-15","stage_classifiercode":"99-11","member_number":"A94718","first_name":"NICKOLAS","last_name":"ROBERTS","classification":"A","division":"LIMITED","hit_factor":8.5284},{"match_name":"MS06 Team Magnolia February 2018 USPSA Match","match_date":"2018-02-03","stage_classifiercode":"99-11","member_number":"A74057","first_name":"JAMIE","last_name":"PRICE","classification":"A","division":"LIMITED","hit_factor":8.5284},{"match_name":"SWGC USPSA Pistol Match - November 2021","match_date":"2021-11-06","stage_classifiercode":"99-11","member_number":"L4602","first_name":"STEPHEN","last_name":"TO","classification":"A","division":"LIMITED","hit_factor":8.526},{"match_name":"Granby Action Shooters Oct 2016","match_date":"2016-10-02","stage_classifiercode":"99-11","member_number":"A19068","first_name":"JAMES P.","last_name":"MARTINO SR.","classification":"\"\"","division":"LIMITED","hit_factor":8.526},{"match_name":"GRPC USPSA WE STOP FOR NO STORM","match_date":"2017-09-03","stage_classifiercode":"99-11","member_number":"A93426","first_name":"SHANE","last_name":"SIMPSON","classification":"A","division":"LIMITED","hit_factor":8.5246},{"match_name":"PCSI - September 2017 USPSA","match_date":"2017-09-02","stage_classifiercode":"99-11","member_number":"A80011","first_name":"SHAYNE","last_name":"DILLINGER","classification":"B","division":"LIMITED","hit_factor":8.5246},{"match_name":"NCPS USPSA Handgun Match November 27 2016","match_date":"2016-11-27","stage_classifiercode":"99-11","member_number":"TY68712","first_name":"JOHN","last_name":"SAOB","classification":"B","division":"LIMITED","hit_factor":8.5236},{"match_name":"Competitive Shooters of Lake Norman CORNELIUS Thursday Evening Indoor USPSA Pistol Match North Carolina","match_date":"2018-12-06","stage_classifiercode":"99-11","member_number":"TY88089","first_name":"DAVID","last_name":"BURTON","classification":"B","division":"LIMITED","hit_factor":8.5236},{"match_name":"LA05 Tangi June USPSA 2020","match_date":"2020-06-28","stage_classifiercode":"99-11","member_number":"TY41717","first_name":"ROBERT","last_name":"KONRADY","classification":"M","division":"LIMITED","hit_factor":8.5209},{"match_name":"CGC 03-10-2018","match_date":"2018-03-10","stage_classifiercode":"99-11","member_number":"A27109","first_name":"DARYL","last_name":"SPAETH","classification":"M","division":"LIMITED","hit_factor":8.5179},{"match_name":"CVSC 10-28-2018 (6 Stage All Classifier Match)","match_date":"2018-10-28","stage_classifiercode":"99-11","member_number":"L4505","first_name":"GREG","last_name":"VAUGHN","classification":"A","division":"LIMITED","hit_factor":8.5174},{"match_name":"BPSA May 2016 New Shooter Clinic","match_date":"2016-05-09","stage_classifiercode":"99-11","member_number":"A76040","first_name":"STEVEN","last_name":"MOSHER","classification":"A","division":"LIMITED","hit_factor":8.5145},{"match_name":"Ontelaunee USPSA  July 2018","match_date":"2018-07-29","stage_classifiercode":"99-11","member_number":"TY54330","first_name":"VICTOR","last_name":"GRILLETTO","classification":"A","division":"LIMITED","hit_factor":8.5137},{"match_name":"GRPC USPSA WE STOP FOR NO STORM","match_date":"2017-09-03","stage_classifiercode":"99-11","member_number":"FY36295","first_name":"PAUL","last_name":"TVAN WYK","classification":"A","division":"LIMITED","hit_factor":8.5069},{"match_name":"USPSA MO21 2Alpha SBRC March 2018","match_date":"2018-03-24","stage_classifiercode":"99-11","member_number":"A102464","first_name":"COLE","last_name":"HUFFMAN","classification":"A","division":"LIMITED","hit_factor":8.5069},{"match_name":"OFGC USPSA Match Feb 19th 2017","match_date":"2017-02-19","stage_classifiercode":"99-11","member_number":"TY55378","first_name":"TRAVIS","last_name":"THOMPSON","classification":"B","division":"LIMITED","hit_factor":8.5069},{"match_name":"MPSA 021817","match_date":"2017-02-18","stage_classifiercode":"99-11","member_number":"A79833","first_name":"STEVEN","last_name":"TAYLOR","classification":"A","division":"LIMITED","hit_factor":8.5069},{"match_name":"Shot Through The Heart Classifiers","match_date":"2018-02-04","stage_classifiercode":"99-11","member_number":"fy102971","first_name":"MICHAEL","last_name":"DERRICK","classification":"B","division":"LIMITED","hit_factor":8.5039},{"match_name":"HPPS 1-16-2021","match_date":"2021-01-16","stage_classifiercode":"99-11","member_number":"L3320","first_name":"CHARLIE","last_name":"PEREZ","classification":"G","division":"LIMITED","hit_factor":8.5014},{"match_name":"LCSC Linden USPSA 092621","match_date":"2021-09-25","stage_classifiercode":"99-11","member_number":"TY89442","first_name":"JIM","last_name":"SUSOY","classification":"A","division":"LIMITED","hit_factor":8.4977},{"match_name":"ANPRACS USPSA 6-3-18","match_date":"2018-06-03","stage_classifiercode":"99-11","member_number":"TY97714","first_name":"JUSTIN","last_name":"LARKIN","classification":"A","division":"LIMITED","hit_factor":8.4906},{"match_name":"SB Action Pistol Match Classifier","match_date":"2017-12-14","stage_classifiercode":"99-11","member_number":"A92403","first_name":"BRIAN","last_name":"FABIAN","classification":"\"\"","division":"LIMITED","hit_factor":8.4871},{"match_name":"Oakdale USPSA MN07 8-12-2021","match_date":"2021-08-12","stage_classifiercode":"99-11","member_number":"Ty103916","first_name":"LANE","last_name":"HUSO","classification":"A","division":"LIMITED","hit_factor":8.4859},{"match_name":"AGC_20170903","match_date":"2017-09-03","stage_classifiercode":"99-11","member_number":"A91485","first_name":"RYAN","last_name":"EMMITE","classification":"B","division":"LIMITED","hit_factor":8.4848},{"match_name":"MCAS March 2021 USPSA","match_date":"2021-03-28","stage_classifiercode":"99-11","member_number":"TY118411","first_name":"JASON","last_name":"SMITH","classification":"B","division":"LIMITED","hit_factor":8.4829},{"match_name":"2016-05-07 USPSA at Phoenix Rod and Gun Club","match_date":"2016-05-07","stage_classifiercode":"99-11","member_number":"a86545","first_name":"JAY","last_name":"WEBB","classification":"B","division":"LIMITED","hit_factor":8.48},{"match_name":"AGC_20170903","match_date":"2017-09-03","stage_classifiercode":"99-11","member_number":"\"\"","first_name":"HENNING","last_name":"WALLGREN","classification":"U","division":"LIMITED","hit_factor":8.4772},{"match_name":"WVRPC USPSA 2APR2016","match_date":"2016-04-02","stage_classifiercode":"99-11","member_number":"TY64065","first_name":"DANIEL","last_name":"HART","classification":"A","division":"LIMITED","hit_factor":8.4746},{"match_name":"Prescott Action Shooters 1st Saturday USPSA 6-2-2018 ","match_date":"2018-06-03","stage_classifiercode":"99-11","member_number":"TY15412","first_name":"RON","last_name":"YOUNGER","classification":"A","division":"LIMITED","hit_factor":8.4746},{"match_name":"Armory Indoor League","match_date":"2018-02-08","stage_classifiercode":"99-11","member_number":"A70490","first_name":"JOSH","last_name":"WAKAMATSU","classification":"G","division":"LIMITED","hit_factor":8.4602},{"match_name":"SFPC June 7 2020 AM     USPSA Monthly Match","match_date":"2020-06-07","stage_classifiercode":"99-11","member_number":"A28266","first_name":"RANDALL","last_name":"RAKESTRAW","classification":"A","division":"LIMITED","hit_factor":8.4592},{"match_name":"SCCCNOVEMBER2016","match_date":"2016-11-13","stage_classifiercode":"99-11","member_number":"fy37438","first_name":"BARRY","last_name":"WEST","classification":"M","division":"LIMITED","hit_factor":8.457},{"match_name":"BSPSC 2017 April Special Classifier","match_date":"2017-04-09","stage_classifiercode":"99-11","member_number":"A54245","first_name":"TIM","last_name":"THOMAS","classification":"A","division":"LIMITED","hit_factor":8.4553},{"match_name":"Castlewood USPSA Sept 2020 shoot","match_date":"2020-09-26","stage_classifiercode":"99-11","member_number":"A130009","first_name":"AUSTEN","last_name":"LEFFLER","classification":"U","division":"LIMITED","hit_factor":8.4437},{"match_name":"CCPL 12102017","match_date":"2017-12-08","stage_classifiercode":"99-11","member_number":"TY87000","first_name":"GREG","last_name":"VAUGHN","classification":"A","division":"LIMITED","hit_factor":8.4425},{"match_name":"Extreme GM","match_date":"2020-06-12","stage_classifiercode":"99-11","member_number":"A113160","first_name":"SEAN","last_name":"GOLDENBERG","classification":"B","division":"LIMITED","hit_factor":8.4416},{"match_name":"Hawkeye Gun Club July 2016 Match","match_date":"2016-07-16","stage_classifiercode":"99-11","member_number":"PEN","first_name":"RALPH","last_name":"CORCIONE","classification":"U","division":"LIMITED","hit_factor":8.4375},{"match_name":"Richmond Hot Shots April 30-May 1st USPSA Pistol Match","match_date":"2016-04-30","stage_classifiercode":"99-11","member_number":"A69633","first_name":"ALEX","last_name":"MA","classification":"M","division":"LIMITED","hit_factor":8.4291},{"match_name":"APSC USPSA 10-06-18","match_date":"2018-10-06","stage_classifiercode":"99-11","member_number":"L3804","first_name":"DAVID","last_name":"BISHOP","classification":"M","division":"LIMITED","hit_factor":8.4279},{"match_name":"17 South - April Fools Match","match_date":"2017-04-01","stage_classifiercode":"99-11","member_number":"Fy83548","first_name":"JEFF","last_name":"CHU","classification":"B","division":"LIMITED","hit_factor":8.4243},{"match_name":"CCPL 12102017","match_date":"2017-12-08","stage_classifiercode":"99-11","member_number":"A65481","first_name":"KEVIN","last_name":"DORAN","classification":"B","division":"LIMITED","hit_factor":8.4227},{"match_name":"Applied IN25 USPSA April Classifier 2018","match_date":"2018-04-17","stage_classifiercode":"99-11","member_number":"A102630","first_name":"NATE","last_name":"POULSON","classification":"A","division":"LIMITED","hit_factor":8.4211},{"match_name":"Brothers N Arms September 2017 USPSA Match","match_date":"2017-09-16","stage_classifiercode":"99-11","member_number":"A67704","first_name":"MICHAEL","last_name":"MCDONALD","classification":"A","division":"LIMITED","hit_factor":8.4211},{"match_name":"CJR&PC USPSA  June 10","match_date":"2018-06-10","stage_classifiercode":"99-11","member_number":"A53864","first_name":"RAFAEL","last_name":"GUERRERO","classification":"\"\"","division":"LIMITED","hit_factor":8.4195},{"match_name":"FBURG March Level I USPSA","match_date":"2016-03-06","stage_classifiercode":"99-11","member_number":"TY51532","first_name":"CHRIS","last_name":"RHINES","classification":"A","division":"LIMITED","hit_factor":8.4192},{"match_name":"Ontelaunee USPSA July 2016","match_date":"2016-07-23","stage_classifiercode":"99-11","member_number":"A82429","first_name":"DAVID","last_name":"HEALEY 2","classification":"A","division":"LIMITED","hit_factor":8.4175},{"match_name":"CSS Oct USPSA","match_date":"2016-10-03","stage_classifiercode":"99-11","member_number":"A78528","first_name":"TIMOTHY","last_name":"MEKOSH","classification":"M","division":"LIMITED","hit_factor":8.4168},{"match_name":"Fairfax PS USPSA September 2017","match_date":"2017-09-19","stage_classifiercode":"99-11","member_number":"A103667","first_name":"KEANU","last_name":"SY","classification":"C","division":"LIMITED","hit_factor":8.4158},{"match_name":"Tangi May 2016 USPSA","match_date":"2016-05-29","stage_classifiercode":"99-11","member_number":"TY71097","first_name":"CHRIS","last_name":"BAUCUM","classification":"\u0000","division":"LIMITED","hit_factor":8.4142},{"match_name":"BORCC USPSA August 2017","match_date":"2017-08-27","stage_classifiercode":"99-11","member_number":"TY38382","first_name":"DOUG","last_name":"HIGHLAN","classification":"B","division":"LIMITED","hit_factor":8.4112},{"match_name":"Target  Sports Central Indiana Championship","match_date":"2020-08-22","stage_classifiercode":"99-11","member_number":"TY108848","first_name":"PAUL","last_name":"WARREN","classification":"B","division":"LIMITED","hit_factor":8.4098},{"match_name":"FBURG March Level I USPSA","match_date":"2016-03-06","stage_classifiercode":"99-11","member_number":"A22830","first_name":"JACK","last_name":"BECKER","classification":"M","division":"LIMITED","hit_factor":8.4098},{"match_name":"Brothers N Arms April 2016 USPSA Match (22Apr16-08:54:02)","match_date":"2016-04-23","stage_classifiercode":"99-11","member_number":"A82331","first_name":"DREW","last_name":"WALTERS","classification":"A","division":"LIMITED","hit_factor":8.402},{"match_name":"IL16 USPSA MAR 20 2016","match_date":"2016-03-20","stage_classifiercode":"99-11","member_number":"Ty63666","first_name":"RYAN","last_name":"STINAR","classification":"A","division":"LIMITED","hit_factor":8.4006},{"match_name":"ISPS 6/19/2016 USPSA","match_date":"2016-06-19","stage_classifiercode":"99-11","member_number":"TY81469","first_name":"ERIC","last_name":"STEINER","classification":"A","division":"LIMITED","hit_factor":8.3994},{"match_name":"Grandbaggers August 2017","match_date":"2017-08-03","stage_classifiercode":"99-11","member_number":"FY66994","first_name":"SCOTT","last_name":"BONOMO","classification":"B","division":"LIMITED","hit_factor":8.3981},{"match_name":"PCPS Classifier and Slot Match Jan 2020","match_date":"2020-01-12","stage_classifiercode":"99-11","member_number":"A76085","first_name":"JOE","last_name":"FAREWELL","classification":"M","division":"LIMITED","hit_factor":8.3942},{"match_name":"Hopkinton June  2016","match_date":"2016-06-04","stage_classifiercode":"99-11","member_number":"A73027","first_name":"JEFF","last_name":"NICOLL","classification":"B","division":"LIMITED","hit_factor":8.3936},{"match_name":"RangeMasters 5-31-2018","match_date":"2018-05-31","stage_classifiercode":"99-11","member_number":"A87497","first_name":"ERIC","last_name":"CASTILLO","classification":"M","division":"LIMITED","hit_factor":8.3893},{"match_name":"Rio Salado UPPL September 2020","match_date":"2020-09-13","stage_classifiercode":"99-11","member_number":"L4835","first_name":"JESSICA","last_name":"JONASSON","classification":"B","division":"LIMITED","hit_factor":8.3824},{"match_name":"Shot Through The Heart Classifiers","match_date":"2018-02-04","stage_classifiercode":"99-11","member_number":"TY95641","first_name":"JOEY","last_name":"MOTT","classification":"U","division":"LIMITED","hit_factor":8.3824},{"match_name":"Collin County USPSA 04-25-2021","match_date":"2021-04-24","stage_classifiercode":"99-11","member_number":"TY78648","first_name":"JOHNATHON","last_name":"MILLER","classification":"M","division":"LIMITED","hit_factor":8.3821},{"match_name":"Dawg Valley USPSA Oct 13","match_date":"2018-10-13","stage_classifiercode":"99-11","member_number":"L4207","first_name":"JAMES","last_name":"WOODS","classification":"M","division":"LIMITED","hit_factor":8.3744},{"match_name":"Rio Salado RSPP 3rd Saturday February 2020","match_date":"2020-02-15","stage_classifiercode":"99-11","member_number":"TY35327","first_name":"KELLY","last_name":"NEAL","classification":"G","division":"LIMITED","hit_factor":8.3736},{"match_name":"The Hollow 6 June 2018","match_date":"2018-08-06","stage_classifiercode":"99-11","member_number":"\"\"","first_name":"MIKE","last_name":"HARVEY","classification":"U","division":"LIMITED","hit_factor":8.3682},{"match_name":"USPSA MO21 2Alpha SBRC December 22 2018","match_date":"2018-12-22","stage_classifiercode":"99-11","member_number":"A93373","first_name":"T.J.","last_name":"KANE","classification":"M","division":"LIMITED","hit_factor":8.3516},{"match_name":"Brazosland Pistoleros USPSA - Sunday August 8th","match_date":"2021-08-08","stage_classifiercode":"99-11","member_number":"A120450","first_name":"SEAN","last_name":"JENNINGS","classification":"B","division":"LIMITED","hit_factor":8.347},{"match_name":"ITPSC January USPSA","match_date":"2017-01-21","stage_classifiercode":"99-11","member_number":"A41980","first_name":"ERIC","last_name":"GAMBILL","classification":"M","division":"LIMITED","hit_factor":8.3333},{"match_name":"Rankin Field June Sunday USPSA","match_date":"2020-06-21","stage_classifiercode":"99-11","member_number":"A94718","first_name":"NICK","last_name":"ROBERTS","classification":"A","division":"LIMITED","hit_factor":8.3333},{"match_name":"Rankin Field June Sunday USPSA","match_date":"2020-06-21","stage_classifiercode":"99-11","member_number":"TY114590","first_name":"JEREMY","last_name":"ALBRIGHT","classification":"A","division":"LIMITED","hit_factor":8.3333},{"match_name":"Dundee USPSA Feb 2016","match_date":"2016-02-27","stage_classifiercode":"99-11","member_number":"L3253","first_name":"SCOTT","last_name":"LEROUX","classification":"M","division":"LIMITED","hit_factor":8.321},{"match_name":"MCPSL Pistol 3-10-18","match_date":"2018-03-10","stage_classifiercode":"99-11","member_number":"A96146","first_name":"BEN","last_name":"DEHAEMERS","classification":"B","division":"LIMITED","hit_factor":8.3203},{"match_name":"NAAS 2018-01-21 Special Classifier Match","match_date":"2018-01-21","stage_classifiercode":"99-11","member_number":"A82809","first_name":"DAVID","last_name":"DARDEN","classification":"A","division":"LIMITED","hit_factor":8.32},{"match_name":"North Mountain PS April","match_date":"2016-04-15","stage_classifiercode":"99-11","member_number":"TY72189","first_name":"KELLY","last_name":"COBEAN","classification":"A","division":"LIMITED","hit_factor":8.32},{"match_name":"BORCC USPSA May 2018","match_date":"2018-05-26","stage_classifiercode":"99-11","member_number":"A52548","first_name":"TERRY","last_name":"WASKUL","classification":"M","division":"LIMITED","hit_factor":8.3195},{"match_name":"Pitcairn-Monroeville Sportsmens Club USPSA August 2017","match_date":"2017-08-05","stage_classifiercode":"99-11","member_number":"A89831","first_name":"RICHARD","last_name":"ALLOWAY","classification":"B","division":"LIMITED","hit_factor":8.3099},{"match_name":"WVPPS November 2020","match_date":"2020-11-15","stage_classifiercode":"99-11","member_number":"TY66824","first_name":"MICHAEL","last_name":"MCCAULEY","classification":"B","division":"LIMITED","hit_factor":8.3099},{"match_name":"NW01 Paul Bunyan CS Series May 9 2021","match_date":"2021-05-09","stage_classifiercode":"99-11","member_number":"A104403","first_name":"AUSTIN J.","last_name":"YOUNG","classification":"M","division":"LIMITED","hit_factor":8.3095},{"match_name":"Competitive Shooters of Lake Norman CORNELIUS Thursday Evening Indoor USPSA Pistol Match North Carolina","match_date":"2018-12-06","stage_classifiercode":"99-11","member_number":"TY104282","first_name":"MATT","last_name":"GROSS","classification":"B","division":"LIMITED","hit_factor":8.3095},{"match_name":"LIPSA -  April 17th 2016 - USPSA Special Classifier Match","match_date":"2016-04-17","stage_classifiercode":"99-11","member_number":"TY20395","first_name":"LEO","last_name":"PRIMERO","classification":"B","division":"LIMITED","hit_factor":8.3082},{"match_name":"ORPCI 2017 June USPSA Classifer Match","match_date":"2017-06-25","stage_classifiercode":"99-11","member_number":"PEN","first_name":"JOSH","last_name":"TILFORD","classification":"U","division":"LIMITED","hit_factor":8.3062},{"match_name":"FBPPC AUGUST 2016 IPSC MATCH","match_date":"2016-08-13","stage_classifiercode":"99-11","member_number":"TY76477","first_name":"JOSE","last_name":"ALEMAN","classification":"B","division":"LIMITED","hit_factor":8.2963},{"match_name":"CCAS June 2016","match_date":"2016-06-25","stage_classifiercode":"99-11","member_number":"A70301","first_name":"JERROD","last_name":"MYERS","classification":"U","division":"LIMITED","hit_factor":8.2956},{"match_name":"Blackstone Shooting Sports November 2016 USPSA Level 1","match_date":"2016-11-08","stage_classifiercode":"99-11","member_number":"A90559","first_name":"IKE","last_name":"STARNES","classification":"B","division":"LIMITED","hit_factor":8.2956},{"match_name":"Baps March Uspsa","match_date":"2016-03-19","stage_classifiercode":"99-11","member_number":"A82935","first_name":"COREY","last_name":"SLIFKO","classification":"B","division":"LIMITED","hit_factor":8.2949},{"match_name":"Prescott 1 st Saturday 12-03-2016","match_date":"2016-12-03","stage_classifiercode":"99-11","member_number":"TY15412","first_name":"RON","last_name":"YOUNGER","classification":"A","division":"LIMITED","hit_factor":8.2942},{"match_name":"MCPSL Pistol 3-10-18","match_date":"2018-03-10","stage_classifiercode":"99-11","member_number":"A100933","first_name":"RON","last_name":"PATERSON","classification":"B","division":"LIMITED","hit_factor":8.2935},{"match_name":"SEPSA July 2017","match_date":"2017-07-08","stage_classifiercode":"99-11","member_number":"A72887","first_name":"KEVIN","last_name":"MCDOWELL","classification":"B","division":"LIMITED","hit_factor":8.2935},{"match_name":"Fairfax PS USPSA September 2017","match_date":"2017-09-19","stage_classifiercode":"99-11","member_number":"A99573","first_name":"JOHN","last_name":"FOLEY","classification":"B","division":"LIMITED","hit_factor":8.2935},{"match_name":"IN18 SCGC USPSA 13 September  2020 ","match_date":"2020-09-13","stage_classifiercode":"99-11","member_number":"a26597","first_name":"MAX","last_name":"BEDWELL","classification":"M","division":"LIMITED","hit_factor":8.2927},{"match_name":"ENPS December 2020 USPSA Match","match_date":"2020-12-06","stage_classifiercode":"99-11","member_number":"TY61813","first_name":"TOM","last_name":"ENGEL","classification":"A","division":"LIMITED","hit_factor":8.2883},{"match_name":"Oakdale USPSA MN07 8-12-2021","match_date":"2021-08-12","stage_classifiercode":"99-11","member_number":"Ty103300","first_name":"CHRIS","last_name":"PEQUIN","classification":"A","division":"LIMITED","hit_factor":8.2883},{"match_name":"Maine Practical Shooters February 2016","match_date":"2016-02-27","stage_classifiercode":"99-11","member_number":"TY49143","first_name":"TAD","last_name":"DAVIDSON","classification":"M","division":"LIMITED","hit_factor":8.2849},{"match_name":"SAGC CTX04 Monthly USPSA Match - June USPSA Match","match_date":"2018-06-24","stage_classifiercode":"99-11","member_number":"A49435","first_name":"JOHN","last_name":"WILKINSON","classification":"M","division":"LIMITED","hit_factor":8.2828},{"match_name":"Shongum Pistol November 2015","match_date":"2015-11-07","stage_classifiercode":"99-11","member_number":"TY20395","first_name":"LEO","last_name":"PRIMERO","classification":"B","division":"LIMITED","hit_factor":8.2822},{"match_name":"WSRC USPSA","match_date":"2016-10-22","stage_classifiercode":"99-11","member_number":"A58761","first_name":"KENNETH","last_name":"KELLEY","classification":"B","division":"LIMITED","hit_factor":8.2822},{"match_name":"BUAS February Match","match_date":"2020-02-09","stage_classifiercode":"99-11","member_number":"a39028","first_name":"JOHN","last_name":"SARDINA","classification":"A","division":"LIMITED","hit_factor":8.2792},{"match_name":"ORSA USPSA October 2017","match_date":"2017-10-21","stage_classifiercode":"99-11","member_number":"TY67629","first_name":"ROBERT","last_name":"GARRETT","classification":"B","division":"LIMITED","hit_factor":8.2729},{"match_name":"Coastal Area Practical Shooters 7-22-17 Special Classifier","match_date":"2017-07-22","stage_classifiercode":"99-11","member_number":"A59053","first_name":"CHIP","last_name":"SAFFERY","classification":"A","division":"LIMITED","hit_factor":8.2729},{"match_name":"MSSA Uspsa Match 1/3/16","match_date":"2016-01-03","stage_classifiercode":"99-11","member_number":"\"\"","first_name":"STEVE","last_name":"HOOVER","classification":"U","division":"LIMITED","hit_factor":8.2718},{"match_name":"AGC_20170903","match_date":"2017-09-03","stage_classifiercode":"99-11","member_number":"FY72585","first_name":"TRUNG","last_name":"NGUYEN","classification":"A","division":"LIMITED","hit_factor":8.2707},{"match_name":"WVRPC USPSA 2APR2016","match_date":"2016-04-02","stage_classifiercode":"99-11","member_number":"FY81341","first_name":"JOE","last_name":"ZADIK","classification":"A","division":"LIMITED","hit_factor":8.2707},{"match_name":"GPS.   August  2016 ","match_date":"2016-08-28","stage_classifiercode":"99-11","member_number":"A93426","first_name":"SHANE","last_name":"SIMPSON","classification":"B","division":"LIMITED","hit_factor":8.2683},{"match_name":"Shoot GTR 05/07/17","match_date":"2017-05-07","stage_classifiercode":"99-11","member_number":"FY49501","first_name":"PJ","last_name":"BRUCAT","classification":"B","division":"LIMITED","hit_factor":8.2683},{"match_name":"CCPL May  Day Match","match_date":"2021-05-23","stage_classifiercode":"99-11","member_number":"A109094","first_name":"TONY","last_name":"LUNA","classification":"A","division":"LIMITED","hit_factor":8.2671},{"match_name":"Tangi May 2016 USPSA","match_date":"2016-05-29","stage_classifiercode":"99-11","member_number":"ty41717","first_name":"ROBERT","last_name":"KONRADY","classification":"M","division":"LIMITED","hit_factor":8.2671},{"match_name":"7-30 Match","match_date":"2017-07-30","stage_classifiercode":"99-11","member_number":"A79180","first_name":"SCOTT","last_name":"KATZ","classification":"U","division":"LIMITED","hit_factor":8.2609},{"match_name":"LIPSA -  April 17th 2016 - USPSA Special Classifier Match","match_date":"2016-04-17","stage_classifiercode":"99-11","member_number":"\"\"","first_name":"CHRIS","last_name":"WONG","classification":"\"\"","division":"LIMITED","hit_factor":8.2583},{"match_name":"Ripon Oct USPSA Match","match_date":"2015-10-24","stage_classifiercode":"99-11","member_number":"A71862","first_name":"JOE","last_name":"SINYAKOVICH","classification":"B","division":"LIMITED","hit_factor":8.2569},{"match_name":"WVPPS May 2021","match_date":"2021-05-16","stage_classifiercode":"99-11","member_number":"A113061","first_name":"BRANDON","last_name":"CALDWELL","classification":"B","division":"LIMITED","hit_factor":8.2555},{"match_name":"Ontelaunee USPSA July 2016","match_date":"2016-07-23","stage_classifiercode":"99-11","member_number":"A75482","first_name":"JET","last_name":"VINCENZO","classification":"A","division":"LIMITED","hit_factor":8.254},{"match_name":"OK15 USPSA at USSA","match_date":"2017-12-10","stage_classifiercode":"99-11","member_number":"A89709","first_name":"BRIAN","last_name":"SMITH","classification":"B","division":"LIMITED","hit_factor":8.254},{"match_name":"CGC 03-10-2018","match_date":"2018-03-10","stage_classifiercode":"99-11","member_number":"TY83004","first_name":"CASEY","last_name":"THERIOT","classification":"B","division":"LIMITED","hit_factor":8.2474},{"match_name":"AGC_20151206","match_date":"2015-12-06","stage_classifiercode":"99-11","member_number":"A77590","first_name":"NICK","last_name":"BRAZZALE","classification":"X","division":"LIMITED","hit_factor":8.2456},{"match_name":"FBURG March Level I USPSA","match_date":"2016-03-06","stage_classifiercode":"99-11","member_number":"A76339","first_name":"MATT","last_name":"SIMMONS","classification":"B","division":"LIMITED","hit_factor":8.2391},{"match_name":"MAPSA June Special Classifier","match_date":"2018-06-09","stage_classifiercode":"99-11","member_number":"A86132","first_name":"DAN","last_name":"BOYLES","classification":"A","division":"LIMITED","hit_factor":8.2386},{"match_name":"Holmen USPSA 10/30/16","match_date":"2016-10-30","stage_classifiercode":"99-11","member_number":"A86548","first_name":"JOSHUA","last_name":"EERNISSE","classification":"A","division":"LIMITED","hit_factor":8.2267},{"match_name":"WSPS Practice Match 010616","match_date":"2016-01-06","stage_classifiercode":"99-11","member_number":"PEN","first_name":"DAVE","last_name":"A","classification":"G","division":"LIMITED","hit_factor":8.2192},{"match_name":"ORSA USPSA October 2017","match_date":"2017-10-21","stage_classifiercode":"99-11","member_number":"A101184","first_name":"JAMES","last_name":"BREEDEN","classification":"U","division":"LIMITED","hit_factor":8.2192},{"match_name":"Benton Gun Club-USPSA March 25 2018","match_date":"2018-03-25","stage_classifiercode":"99-11","member_number":"A99926","first_name":"CARL","last_name":"CLITES","classification":"B","division":"LIMITED","hit_factor":8.2148},{"match_name":"Rio Salado UPPL September 2020","match_date":"2020-09-13","stage_classifiercode":"99-11","member_number":"A82915","first_name":"CODY","last_name":"VINCENT","classification":"M","division":"LIMITED","hit_factor":8.2111},{"match_name":"Maine Practical Shooter December 2018","match_date":"2018-12-15","stage_classifiercode":"99-11","member_number":"TY49143","first_name":"TAD","last_name":"DAVIDSON","classification":"M","division":"LIMITED","hit_factor":8.2111},{"match_name":"AGC_20170903","match_date":"2017-09-03","stage_classifiercode":"99-11","member_number":"TY81049","first_name":"ROBERT","last_name":"MERKEL","classification":"A","division":"LIMITED","hit_factor":8.2077},{"match_name":"USPSA MO21 2Alpha SBRC June 2017","match_date":"2017-06-17","stage_classifiercode":"99-11","member_number":"TY48907","first_name":"DAVID","last_name":"LETSCH","classification":"B","division":"LIMITED","hit_factor":8.2043},{"match_name":"GRRC Wk 8","match_date":"2018-06-25","stage_classifiercode":"99-11","member_number":"ty18237","first_name":"MIKE","last_name":"WOLF","classification":"M","division":"LIMITED","hit_factor":8.1994},{"match_name":"USPSA-Classifier","match_date":"2017-03-26","stage_classifiercode":"99-11","member_number":"A63950","first_name":"EFREN","last_name":"CAMACHO","classification":"B","division":"LIMITED","hit_factor":8.1967},{"match_name":"LBAS160220","match_date":"2016-02-20","stage_classifiercode":"99-11","member_number":"TY31943","first_name":"JOE","last_name":"SHELTON","classification":"B","division":"LIMITED","hit_factor":8.1942},{"match_name":"MCAS March 2021 USPSA","match_date":"2021-03-28","stage_classifiercode":"99-11","member_number":"L4166","first_name":"MATT","last_name":"WAITE","classification":"M","division":"LIMITED","hit_factor":8.1871},{"match_name":"FBURG March Level I USPSA","match_date":"2016-03-06","stage_classifiercode":"99-11","member_number":"A83147","first_name":"KAYLE","last_name":"MILLER","classification":"C","division":"LIMITED","hit_factor":8.1871},{"match_name":"2016-02-06 USPSA at Phoenix Rod and Gun Club","match_date":"2016-02-06","stage_classifiercode":"99-11","member_number":"a55525","first_name":"MICHAEL","last_name":"MCDANNELL","classification":"B","division":"LIMITED","hit_factor":8.1818},{"match_name":"Brothers N Arms September 2017 USPSA Match","match_date":"2017-09-16","stage_classifiercode":"99-11","member_number":"TY96178","first_name":"JAMIE","last_name":"HUMPHREY","classification":"B","division":"LIMITED","hit_factor":8.1752},{"match_name":"Applied IN25 USPSA January 17th 2018","match_date":"2018-01-17","stage_classifiercode":"99-11","member_number":"L4004","first_name":"AARON","last_name":"LORTON","classification":"A","division":"LIMITED","hit_factor":8.1739},{"match_name":"2016-05-07 USPSA at Phoenix Rod and Gun Club","match_date":"2016-05-07","stage_classifiercode":"99-11","member_number":"Ty87182","first_name":"MILTON","last_name":"MEANS","classification":"B","division":"LIMITED","hit_factor":8.1731},{"match_name":"Feb  Ecps At The Range","match_date":"2017-02-26","stage_classifiercode":"99-11","member_number":"TY70157","first_name":"KEN","last_name":"KIESLER","classification":"B","division":"LIMITED","hit_factor":8.1694},{"match_name":"Richmond Hot Shots April 30-May 1st USPSA Pistol Match","match_date":"2016-04-30","stage_classifiercode":"99-11","member_number":"A57508","first_name":"PATRICK","last_name":"CLARK","classification":"B","division":"LIMITED","hit_factor":8.1694},{"match_name":"LBAS160220","match_date":"2016-02-20","stage_classifiercode":"99-11","member_number":"FY22816","first_name":"ROBB","last_name":"WILLOUGHBY","classification":"M","division":"LIMITED","hit_factor":8.1662},{"match_name":"PSAC 20171028","match_date":"2017-10-28","stage_classifiercode":"99-11","member_number":"FY26112","first_name":"RW","last_name":"SWAINSON","classification":"M","division":"LIMITED","hit_factor":8.1604},{"match_name":"MAPSA 2016.04.09","match_date":"2016-04-09","stage_classifiercode":"99-11","member_number":"A90179","first_name":"MICHAEL","last_name":"HALL","classification":"A","division":"LIMITED","hit_factor":8.1602},{"match_name":"Rio Salado UPPL September 2020","match_date":"2020-09-13","stage_classifiercode":"99-11","member_number":"L2820","first_name":"KYLE","last_name":"SCHMIDT","classification":"A","division":"LIMITED","hit_factor":8.1575},{"match_name":"The Hollow 10 Sep 2018","match_date":"2018-09-10","stage_classifiercode":"99-11","member_number":"TY70663","first_name":"NIC","last_name":"SCHEUFLER","classification":"U","division":"LIMITED","hit_factor":8.1514},{"match_name":"WLPS USPSA May 2016","match_date":"2016-05-22","stage_classifiercode":"99-11","member_number":"TY57269","first_name":"CRAIG","last_name":"TAPPE","classification":"M","division":"LIMITED","hit_factor":8.1481},{"match_name":"ORSA USPSA October 2017","match_date":"2017-10-21","stage_classifiercode":"99-11","member_number":"TY77301","first_name":"SHANE","last_name":"CHARLES","classification":"A","division":"LIMITED","hit_factor":8.1439},{"match_name":"CCAS June 2016","match_date":"2016-06-25","stage_classifiercode":"99-11","member_number":"A75346","first_name":"CALVIN","last_name":"SMILEY","classification":"B","division":"LIMITED","hit_factor":8.1429},{"match_name":"LA05 Tangi June USPSA 2020","match_date":"2020-06-28","stage_classifiercode":"99-11","member_number":"A101927","first_name":"BOBBY","last_name":"GEER","classification":"B","division":"LIMITED","hit_factor":8.1395},{"match_name":"SCCCNOVEMBER2016","match_date":"2016-11-13","stage_classifiercode":"99-11","member_number":"a96280","first_name":"TY","last_name":"OBRADOVICH","classification":"U","division":"LIMITED","hit_factor":8.1395},{"match_name":"TBAS USPSA Match 2/23/20","match_date":"2020-02-23","stage_classifiercode":"99-11","member_number":"A92288","first_name":"JUSTIN","last_name":"BERRY","classification":"","division":"LIMITED","hit_factor":8.1395},{"match_name":"Danville Rifle and Pistol Club USPSA IL17 July 7 2018","match_date":"2018-07-07","stage_classifiercode":"99-11","member_number":"A102630","first_name":"NATE","last_name":"POULSON","classification":"M","division":"LIMITED","hit_factor":8.1395},{"match_name":"North Mountain PS April","match_date":"2016-04-15","stage_classifiercode":"99-11","member_number":"A45556","first_name":"SHANNON","last_name":"CAMPBELL","classification":"B","division":"LIMITED","hit_factor":8.1356},{"match_name":"MAPSA 2016.04.09","match_date":"2016-04-09","stage_classifiercode":"99-11","member_number":"A90576","first_name":"CHARLIE","last_name":"ONAN","classification":"U","division":"LIMITED","hit_factor":8.1301},{"match_name":"Prescott Action Shooters 1st Saturday USPSA 6-2-2018 ","match_date":"2018-06-03","stage_classifiercode":"99-11","member_number":"A55572","first_name":"SHANE","last_name":"CELINO","classification":"B","division":"LIMITED","hit_factor":8.1301},{"match_name":"DPSL July 22 2018 All Classifier","match_date":"2018-07-22","stage_classifiercode":"99-11","member_number":"TY78761","first_name":"KALUB","last_name":"JACKSON","classification":"U","division":"LIMITED","hit_factor":8.1277},{"match_name":"Maine Practical Shooters August 2016","match_date":"2016-08-27","stage_classifiercode":"99-11","member_number":"A-91186","first_name":"OLAF","last_name":"SIGAUD","classification":"B","division":"LIMITED","hit_factor":8.1203},{"match_name":"Blackstone Shooting Sports Snow Days January 2017 USPSA Level  1","match_date":"2017-01-08","stage_classifiercode":"99-11","member_number":"TY56396","first_name":"MORGAN","last_name":"ALLEN","classification":"A","division":"LIMITED","hit_factor":8.1169},{"match_name":"AGC_20170903","match_date":"2017-09-03","stage_classifiercode":"99-11","member_number":"TY86616","first_name":"BILL","last_name":"WEEKS","classification":"B","division":"LIMITED","hit_factor":8.1159},{"match_name":"Richmond Hot Shots January 17-2016 USPSA Pistol","match_date":"2016-01-17","stage_classifiercode":"99-11","member_number":"TY85663","first_name":"JASON","last_name":"YU","classification":"C","division":"LIMITED","hit_factor":8.1123},{"match_name":"USPSA Class","match_date":"2020-05-30","stage_classifiercode":"99-11","member_number":"A109072","first_name":"LUIS A.","last_name":"SIERRA VALENTIN","classification":"C","division":"LIMITED","hit_factor":8.1119},{"match_name":"MPSA 050617 Classifier Match","match_date":"2017-05-06","stage_classifiercode":"99-11","member_number":"FY90633","first_name":"BRANT","last_name":"PACE","classification":"C","division":"LIMITED","hit_factor":8.1081},{"match_name":"ETRPC-USPSA","match_date":"2021-03-27","stage_classifiercode":"99-11","member_number":"L4497","first_name":"BILL","last_name":"BAKER","classification":"M","division":"LIMITED","hit_factor":8.1081},{"match_name":"FSTC Classifier - December 2016","match_date":"2016-12-18","stage_classifiercode":"99-11","member_number":"\"\"","first_name":"RAYMOND","last_name":"FEGER","classification":"B","division":"LIMITED","hit_factor":8.1081},{"match_name":"Ontelaunee USPSA  July 2018","match_date":"2018-07-29","stage_classifiercode":"99-11","member_number":"TY76695","first_name":"TODD","last_name":"BOYER","classification":"B","division":"LIMITED","hit_factor":8.1081},{"match_name":"TMGN December 21 Practical Shooter Match","match_date":"2017-12-22","stage_classifiercode":"99-11","member_number":"A102413","first_name":"MARK","last_name":"NEEBE","classification":"\"\"","division":"LIMITED","hit_factor":8.1037},{"match_name":"West Coast IPSC","match_date":"2018-07-22","stage_classifiercode":"99-11","member_number":"TY63363","first_name":"MATT","last_name":"BUNNING","classification":"A","division":"LIMITED","hit_factor":8.1001},{"match_name":"Devil Dog USPSA Classifier Match-Saturday Session","match_date":"2018-03-10","stage_classifiercode":"99-11","member_number":"A104209","first_name":"ROB","last_name":"NOEL","classification":"B","division":"LIMITED","hit_factor":8.0966},{"match_name":"Palmetto Gun Club - April 2017 USPSA","match_date":"2017-04-08","stage_classifiercode":"99-11","member_number":"TY87299","first_name":"SCOTTY","last_name":"SIMPSON","classification":"B","division":"LIMITED","hit_factor":8.0893},{"match_name":"USPSA AR02 North Arkansas Action Pistol April 11th","match_date":"2021-04-11","stage_classifiercode":"99-11","member_number":"A45506","first_name":"SISK","last_name":"MIKE","classification":"A","division":"LIMITED","hit_factor":8.0893},{"match_name":"CFRPC April USPSA Match","match_date":"2018-04-15","stage_classifiercode":"99-11","member_number":"A67754","first_name":"ROBERTO","last_name":"BATTISTEL JR","classification":"A","division":"LIMITED","hit_factor":8.0858},{"match_name":"PSAC_20161022","match_date":"2016-10-22","stage_classifiercode":"99-11","member_number":"A89748","first_name":"VINCENT","last_name":"DAVIES","classification":"\"\"","division":"LIMITED","hit_factor":8.0851},{"match_name":"Nampa USPSA December 4th 2021","match_date":"2021-12-04","stage_classifiercode":"99-11","member_number":"TY125375","first_name":"TRENT","last_name":"MILLER","classification":"M","division":"LIMITED","hit_factor":8.0824},{"match_name":"TCGC Polo July 2017","match_date":"2017-07-23","stage_classifiercode":"99-11","member_number":"L3823","first_name":"RICHARD","last_name":"GEGZNAS","classification":"B","division":"LIMITED","hit_factor":8.0824},{"match_name":"Brothers N Arms December 2018 USPSA Match","match_date":"2018-12-15","stage_classifiercode":"99-11","member_number":"A67704","first_name":"MICHAEL","last_name":"MCDONALD","classification":"A","division":"LIMITED","hit_factor":8.0808},{"match_name":"USPSA MO21 2Alpha SBRC June 2017","match_date":"2017-06-17","stage_classifiercode":"99-11","member_number":"A93373","first_name":"TJ","last_name":"KANE","classification":"B","division":"LIMITED","hit_factor":8.0808},{"match_name":"TriggerGuard USPSA","match_date":"2016-10-01","stage_classifiercode":"99-11","member_number":"fy43352","first_name":"DOUG","last_name":"STEPHENS","classification":"B","division":"LIMITED","hit_factor":8.0692},{"match_name":"Competitive Shooters of Lake Norman CORNELIUS Thursday Evening Indoor USPSA Pistol Match North Carolina","match_date":"2018-12-06","stage_classifiercode":"99-11","member_number":"Ty71861","first_name":"EDDIE","last_name":"RUSSMAN","classification":"B","division":"LIMITED","hit_factor":8.0692},{"match_name":"STAGE ZERO SHOOTING SUPPLY USPSA","match_date":"2020-07-16","stage_classifiercode":"99-11","member_number":"A104367","first_name":"PAUL","last_name":"WILKERSON","classification":"A","division":"LIMITED","hit_factor":8.0668},{"match_name":"Armory Indoor League","match_date":"2018-11-08","stage_classifiercode":"99-11","member_number":"A102872","first_name":"ALEXANDER","last_name":"WENDT","classification":"C","division":"LIMITED","hit_factor":8.0645},{"match_name":"Hose Monster Action ","match_date":"2020-07-19","stage_classifiercode":"99-11","member_number":"A106623","first_name":"DAVID","last_name":"BRADY","classification":"B","division":"LIMITED","hit_factor":8.0597},{"match_name":"Dundee USPSA Feb 2016","match_date":"2016-02-27","stage_classifiercode":"99-11","member_number":"TY77877","first_name":"GABRIEL","last_name":"WHITE","classification":"M","division":"LIMITED","hit_factor":8.0495},{"match_name":"LdF USPSA Match May 12 2018","match_date":"2018-05-12","stage_classifiercode":"99-11","member_number":"A78063","first_name":"MIKE","last_name":"PAPS","classification":"B","division":"LIMITED","hit_factor":8.0477},{"match_name":"MS06 Team Magnolia June 2017 USPSA Match","match_date":"2017-06-04","stage_classifiercode":"99-11","member_number":"TY72594","first_name":"THOMAS","last_name":"LOVELL JR","classification":"B","division":"LIMITED","hit_factor":8.046},{"match_name":"HSC USPSA October 7th 2017","match_date":"2017-10-06","stage_classifiercode":"99-11","member_number":"A74936","first_name":"ROGER","last_name":"ELDER","classification":"B","division":"LIMITED","hit_factor":8.046},{"match_name":"Shoot Gtr USPSA 10/18","match_date":"2016-10-18","stage_classifiercode":"99-11","member_number":"TY91423","first_name":"LAURENCE","last_name":"MAT AN","classification":"B","division":"LIMITED","hit_factor":8.0442},{"match_name":"CFRPC December USPSA (Classifier)","match_date":"2018-12-16","stage_classifiercode":"99-11","member_number":"A67754","first_name":"ROBERTO","last_name":"BATTISEL","classification":"B","division":"LIMITED","hit_factor":8.0402},{"match_name":"Blackstone Shooting Sports May 2017 USPSA Pistol Level 1","match_date":"2017-05-09","stage_classifiercode":"99-11","member_number":"A96709","first_name":"MASON","last_name":"HERRING","classification":"U","division":"LIMITED","hit_factor":8.0381},{"match_name":"SSS USPSA October 2018","match_date":"2018-10-21","stage_classifiercode":"99-11","member_number":"A104252","first_name":"ROBERT","last_name":"TEAGUE","classification":"C (C Class)","division":"LIMITED","hit_factor":8.0381},{"match_name":"Richmond Hot Shots April 30-May 1st USPSA Pistol Match","match_date":"2016-04-30","stage_classifiercode":"99-11","member_number":"FY-62950","first_name":"DARRELL","last_name":"INOUYE","classification":"A","division":"LIMITED","hit_factor":8.0381},{"match_name":"Rankin Field Sunday USPSA","match_date":"2018-04-15","stage_classifiercode":"99-11","member_number":"A65481","first_name":"KEVIN","last_name":"DORAN","classification":"B","division":"LIMITED","hit_factor":8.0357},{"match_name":"Devil Dog USPSA Classifier Match-Saturday Session","match_date":"2018-03-10","stage_classifiercode":"99-11","member_number":"A107611","first_name":"RICHARD","last_name":"BANKS","classification":"U","division":"LIMITED","hit_factor":8.0344},{"match_name":"BRC_20180114","match_date":"2018-01-14","stage_classifiercode":"99-11","member_number":"TY65590","first_name":"STEVE","last_name":"STETLER","classification":"M","division":"LIMITED","hit_factor":8.0292},{"match_name":"OK15 USPSA at USSA","match_date":"2017-12-10","stage_classifiercode":"99-11","member_number":"A20546","first_name":"JESS","last_name":"ANDERSON","classification":"M","division":"LIMITED","hit_factor":8.0282},{"match_name":"The Hollow 6 June 2018","match_date":"2018-08-06","stage_classifiercode":"99-11","member_number":"\"\"","first_name":"MIKE","last_name":"HARVEY","classification":"U","division":"LIMITED","hit_factor":8.0214},{"match_name":"Crooked Creek Pistol League - June 2016","match_date":"2016-06-25","stage_classifiercode":"99-11","member_number":"TY85065","first_name":"JAMES","last_name":"JONOVICH","classification":"B","division":"LIMITED","hit_factor":8.0205},{"match_name":"PTPC April 2nd USPSA Match","match_date":"2017-04-02","stage_classifiercode":"99-11","member_number":"A85284","first_name":"ROMAN","last_name":"HRUSKA","classification":"B","division":"LIMITED","hit_factor":8.0175},{"match_name":"Richmond Hot Shots April 14-15-2018 USPSA Pistol Match","match_date":"2018-04-14","stage_classifiercode":"99-11","member_number":"TY67007","first_name":"JAMES","last_name":"MUEHLNER","classification":"A","division":"LIMITED","hit_factor":8.0119},{"match_name":"CRCPS 2020-08-08","match_date":"2020-08-08","stage_classifiercode":"99-11","member_number":"A87559","first_name":"MIKE","last_name":"BACHMAN","classification":"C","division":"LIMITED","hit_factor":8.011},{"match_name":"OK Corral USPSA Classifier Match Feb 18 2017","match_date":"2017-02-18","stage_classifiercode":"99-11","member_number":"A83423","first_name":"WILLIAM","last_name":"HILL","classification":"A","division":"LIMITED","hit_factor":8.011},{"match_name":"FBURG July 2018 Level I USPSA ","match_date":"2018-07-01","stage_classifiercode":"99-11","member_number":"A26088","first_name":"ERIK","last_name":"HESS","classification":"U","division":"LIMITED","hit_factor":8.0068},{"match_name":"Wvpps Nov. 2016","match_date":"2016-11-20","stage_classifiercode":"99-11","member_number":"a96280","first_name":"TY","last_name":"OBRADOVICH","classification":"U","division":"LIMITED","hit_factor":8.0058},{"match_name":"Richmond Hot Shots April 14-15-2018 USPSA Pistol Match","match_date":"2018-04-14","stage_classifiercode":"99-11","member_number":"L3809","first_name":"GREGORY","last_name":"FIDDES","classification":"M","division":"LIMITED","hit_factor":8},{"match_name":"SUPS All Classifier Match March 1718 2018","match_date":"2018-03-17","stage_classifiercode":"99-11","member_number":"A87431","first_name":"AARON","last_name":"BREKKE2","classification":"A","division":"LIMITED","hit_factor":8},{"match_name":"SSS USPSA February 2020","match_date":"2020-02-16","stage_classifiercode":"99-11","member_number":"a115023","first_name":"JEFF","last_name":"HUNTER","classification":"U (Unclassified)","division":"LIMITED","hit_factor":7.9946},{"match_name":"IN19 ACC USPSA September 23","match_date":"2018-09-23","stage_classifiercode":"99-11","member_number":"A52087","first_name":"JOHN","last_name":"BLACKWELL","classification":"A","division":"LIMITED","hit_factor":7.994},{"match_name":"Richmond Hot Shots April 14-15-2018 USPSA Pistol Match","match_date":"2018-04-14","stage_classifiercode":"99-11","member_number":"TY44130","first_name":"SEBASTIAO","last_name":"FILHO","classification":"GM","division":"LIMITED","hit_factor":7.9935},{"match_name":"Custer USPSA Mar 7th 2021","match_date":"2021-03-07","stage_classifiercode":"99-11","member_number":"A104403","first_name":"AUSTIN","last_name":"YOUNG","classification":"M","division":"LIMITED","hit_factor":7.9932},{"match_name":"Ontelaunee USPSA  July 2018","match_date":"2018-07-29","stage_classifiercode":"99-11","member_number":"TY82663","first_name":"KEVIN","last_name":"O'BRIEN","classification":"B","division":"LIMITED","hit_factor":7.989},{"match_name":"Rankin field Sunday match Clone","match_date":"2016-07-17","stage_classifiercode":"99-11","member_number":"TY87000","first_name":"GREG","last_name":"VAUGHN","classification":"B","division":"LIMITED","hit_factor":7.9886},{"match_name":"USPSA MO21 2Alpha SBRC Classifier 2016","match_date":"2016-11-26","stage_classifiercode":"99-11","member_number":"A93373","first_name":"TJ","last_name":"KANE","classification":"B","division":"LIMITED","hit_factor":7.9872},{"match_name":"GoShoot Indoors","match_date":"2017-06-11","stage_classifiercode":"99-11","member_number":"TY61567","first_name":"PHIL","last_name":"HOWELL","classification":"B","division":"LIMITED","hit_factor":7.9838},{"match_name":"Competitive Shooters of Lake Norman CORNELIUS Thursday Evening Indoor USPSA Pistol Match North Carolina","match_date":"2018-12-06","stage_classifiercode":"99-11","member_number":"A92582","first_name":"JEFF","last_name":"MANGLE","classification":"C","division":"LIMITED","hit_factor":7.9819},{"match_name":"Grandbaggers August 2017","match_date":"2017-08-03","stage_classifiercode":"99-11","member_number":"FY72117","first_name":"MARK","last_name":"GARDNER","classification":"A","division":"LIMITED","hit_factor":7.9772},{"match_name":"NW01 Paul Bunyan CS Series May 9 2021","match_date":"2021-05-09","stage_classifiercode":"99-11","member_number":"L4494","first_name":"VINH","last_name":"HOANG","classification":"M","division":"LIMITED","hit_factor":7.9734},{"match_name":"Coyote USPSA match 4-21-18","match_date":"2018-04-21","stage_classifiercode":"99-11","member_number":"FY101606","first_name":"KIRK","last_name":"CLARK","classification":"U","division":"LIMITED","hit_factor":7.9734},{"match_name":"Pitcairn-Monroeville Sportsmens Club USPSA August 2017","match_date":"2017-08-05","stage_classifiercode":"99-11","member_number":"TY76571","first_name":"BOB","last_name":"SEREMBO","classification":"B","division":"LIMITED","hit_factor":7.973},{"match_name":"BAS  April 2017 USPSA","match_date":"2017-04-15","stage_classifiercode":"99-11","member_number":"A90172","first_name":"WILLIAM","last_name":"METZLER","classification":"U","division":"LIMITED","hit_factor":7.9688},{"match_name":"ShooT GTR USPSA 1/1/17","match_date":"2017-01-01","stage_classifiercode":"99-11","member_number":"\"\"","first_name":"BUD","last_name":"EHRMANN","classification":"U","division":"LIMITED","hit_factor":7.967},{"match_name":"LPRGC - Lower Providence USPSA October 2018","match_date":"2018-10-06","stage_classifiercode":"99-11","member_number":"TY105682","first_name":"STEVE","last_name":"ZINK","classification":"C","division":"LIMITED","hit_factor":7.9659},{"match_name":"Rio Salado UPPL September 2020","match_date":"2020-09-13","stage_classifiercode":"99-11","member_number":"A55572","first_name":"SHANE","last_name":"CELINO","classification":"A","division":"LIMITED","hit_factor":7.9646},{"match_name":"SB Action Pistol Match Classifier","match_date":"2017-12-14","stage_classifiercode":"99-11","member_number":"A81305","first_name":"DREW","last_name":"BECKMAN","classification":"\"\"","division":"LIMITED","hit_factor":7.9602},{"match_name":"Armory Indoor League","match_date":"2017-10-12","stage_classifiercode":"99-11","member_number":"TY94967","first_name":"JARED","last_name":"STEPP","classification":"B","division":"LIMITED","hit_factor":7.9585},{"match_name":"OK15 USPSA at USSA May 6th 2018","match_date":"2018-05-06","stage_classifiercode":"99-11","member_number":"TY98513","first_name":"JASON","last_name":"BRADLEY","classification":"M","division":"LIMITED","hit_factor":7.9563},{"match_name":"2016-02-06 USPSA at Phoenix Rod and Gun Club","match_date":"2016-02-06","stage_classifiercode":"99-11","member_number":"A77066","first_name":"MARCELO","last_name":"MARIANO III","classification":"A","division":"LIMITED","hit_factor":7.9545},{"match_name":"Crooked Creek Pistol League - June 2016","match_date":"2016-06-25","stage_classifiercode":"99-11","member_number":"A46225","first_name":"JEFF","last_name":"WHITAKER","classification":"A","division":"LIMITED","hit_factor":7.9491},{"match_name":"SSS USPSA October 2018","match_date":"2018-10-21","stage_classifiercode":"99-11","member_number":"L4497","first_name":"BILL","last_name":"BAKER","classification":"A (A Class)","division":"LIMITED","hit_factor":7.9439},{"match_name":"NCPS USPSA Handgun Match June 24 2018","match_date":"2018-06-24","stage_classifiercode":"99-11","member_number":"A63407","first_name":"MORENO","last_name":"VILLANUEVA","classification":"B","division":"LIMITED","hit_factor":7.9439},{"match_name":"WVRPC USPSA 1APR2017 CLASSIFIER","match_date":"2017-04-01","stage_classifiercode":"99-11","member_number":"L2615","first_name":"STEVEN","last_name":"MARSDEN","classification":"M","division":"LIMITED","hit_factor":7.9399},{"match_name":"CSA Coalfield Shooters Association USPSA March 2020","match_date":"2020-03-08","stage_classifiercode":"99-11","member_number":"\"\"","first_name":"JOE","last_name":"KELLEY","classification":"\"\"","division":"LIMITED","hit_factor":7.931},{"match_name":"TAP USPSA Pistol Match Aug 14 2016","match_date":"2016-08-14","stage_classifiercode":"99-11","member_number":"ty82728","first_name":"KIRILL","last_name":"FILIMONOV","classification":"B","division":"LIMITED","hit_factor":7.9304},{"match_name":"Lefthanders Gun Club Practical Shooters October","match_date":"2017-09-30","stage_classifiercode":"99-11","member_number":"NA","first_name":"JOSEPH M","last_name":"SMITHERS","classification":"U","division":"LIMITED","hit_factor":7.9295},{"match_name":"Shoot GTR USPSA MAY 24","match_date":"2016-05-24","stage_classifiercode":"99-11","member_number":"A87746","first_name":"WILL","last_name":"HERRING","classification":"U","division":"LIMITED","hit_factor":7.9295},{"match_name":"Parabellum USPSA May 10 2017","match_date":"2017-05-10","stage_classifiercode":"99-11","member_number":"A86159","first_name":"ALFRED","last_name":"LOPEZ","classification":"B","division":"LIMITED","hit_factor":7.9268},{"match_name":"PSAC_20161022","match_date":"2016-10-22","stage_classifiercode":"99-11","member_number":"A86598","first_name":"BRUCE","last_name":"MEO","classification":"\"\"","division":"LIMITED","hit_factor":7.919},{"match_name":"SKSC USPSA April 2018 Match","match_date":"2018-04-21","stage_classifiercode":"99-11","member_number":"Ty54728","first_name":"SHEILA","last_name":"HOEKSTRA","classification":"B","division":"LIMITED","hit_factor":7.9179},{"match_name":"APSC USPSA 10-06-18","match_date":"2018-10-06","stage_classifiercode":"99-11","member_number":"A86908","first_name":"MICHAEL","last_name":"LUNDGREN","classification":"B","division":"LIMITED","hit_factor":7.9148},{"match_name":"OK Corral Action Challenge October","match_date":"2015-10-24","stage_classifiercode":"99-11","member_number":"A41305","first_name":"MARCK","last_name":"SUCHY","classification":"B","division":"LIMITED","hit_factor":7.9148},{"match_name":"LdF USPSA Match May 12 2018","match_date":"2018-05-12","stage_classifiercode":"99-11","member_number":"A69003","first_name":"JOHN","last_name":"WOOLFREY","classification":"A","division":"LIMITED","hit_factor":7.9148},{"match_name":"OKCGC USPSA June 2018","match_date":"2018-06-02","stage_classifiercode":"99-11","member_number":"TY-17240","first_name":"DAVID","last_name":"JAMES","classification":"A","division":"LIMITED","hit_factor":7.9127},{"match_name":"Quantico Shooting Club Mar USPSA","match_date":"2020-03-08","stage_classifiercode":"99-11","member_number":"A101186","first_name":"ZACH","last_name":"BASICH","classification":"A","division":"LIMITED","hit_factor":7.9125},{"match_name":"CASA USPSA  Feb 17","match_date":"2017-02-05","stage_classifiercode":"99-11","member_number":"L3718","first_name":"MATT","last_name":"OWENS","classification":"B","division":"LIMITED","hit_factor":7.9104},{"match_name":"LdF USPSA Match January 25 2020","match_date":"2020-01-25","stage_classifiercode":"99-11","member_number":"TY82338","first_name":"ALBERT","last_name":"WILLINGHAM","classification":"B","division":"LIMITED","hit_factor":7.9096},{"match_name":"MPSA 081818 USPSA","match_date":"2018-08-18","stage_classifiercode":"99-11","member_number":"A17730","first_name":"STANLEY","last_name":"WADE","classification":"B","division":"LIMITED","hit_factor":7.9096},{"match_name":"Lafayette Practical Shooters - WED-THUR - Dec 19-20 - CLASSIFIER MATCH","match_date":"2018-12-20","stage_classifiercode":"99-11","member_number":"L4430","first_name":"MIKE","last_name":"RUSSELL","classification":"C","division":"LIMITED","hit_factor":7.9063},{"match_name":"Crooked Creek Pistol League - June 2016","match_date":"2016-06-25","stage_classifiercode":"99-11","member_number":"\"\"","first_name":"CHRIS","last_name":"TRYON","classification":"X","division":"LIMITED","hit_factor":7.9057},{"match_name":"Hawkeye Gun Club March 19th 2016 Match","match_date":"2016-03-19","stage_classifiercode":"99-11","member_number":"\"\"","first_name":"TIM","last_name":"DRUM","classification":"C","division":"LIMITED","hit_factor":7.9019},{"match_name":"TGC USPSA JANUARY 2018","match_date":"2018-01-20","stage_classifiercode":"99-11","member_number":"Ty83591","first_name":"JIM","last_name":"SANDERS","classification":"B","division":"LIMITED","hit_factor":7.8989},{"match_name":"SEPSA July 2017","match_date":"2017-07-08","stage_classifiercode":"99-11","member_number":"A59053","first_name":"CHIP","last_name":"SAFFERY","classification":"A","division":"LIMITED","hit_factor":7.8989},{"match_name":"Cactus USPSA ALL CLASSIFIER August 2020","match_date":"2020-08-02","stage_classifiercode":"99-11","member_number":"A77918","first_name":"TIM","last_name":"COKER","classification":"A","division":"LIMITED","hit_factor":7.8989},{"match_name":"Crooked Creek Pistol League - June 2016","match_date":"2016-06-25","stage_classifiercode":"99-11","member_number":"FY65487","first_name":"BRETTON","last_name":"REBOL","classification":"B","division":"LIMITED","hit_factor":7.8987},{"match_name":"CCPL 01102016 ALL CLASSIFIER MATCH","match_date":"2016-01-10","stage_classifiercode":"99-11","member_number":"TY87000","first_name":"GREG","last_name":"VAUGHN","classification":"B","division":"LIMITED","hit_factor":7.8947},{"match_name":"WVPPS November 2018","match_date":"2018-11-18","stage_classifiercode":"99-11","member_number":"TY65620","first_name":"SCOTT","last_name":"METCALF","classification":"B","division":"LIMITED","hit_factor":7.8947},{"match_name":"SAPSC Weekly USPSA Classifier Match 20170221","match_date":"2017-02-22","stage_classifiercode":"99-11","member_number":"TY71861","first_name":"ED","last_name":"RUSSMAN","classification":"B","division":"LIMITED","hit_factor":7.8912},{"match_name":"2017 Bay bridge Charity Classic - Richmond October 14-15-2017","match_date":"2017-10-14","stage_classifiercode":"99-11","member_number":"A46690","first_name":"GILBERT","last_name":"GESMUNDO","classification":"A","division":"LIMITED","hit_factor":7.8905},{"match_name":"Richmond Hot Shots April 30-May 1st USPSA Pistol Match","match_date":"2016-04-30","stage_classifiercode":"99-11","member_number":"TY74150","first_name":"CHRIS","last_name":"COLRIDGE","classification":"A","division":"LIMITED","hit_factor":7.8905},{"match_name":"Coastal Area Practical Shooters 7-22-17 Special Classifier","match_date":"2017-07-22","stage_classifiercode":"99-11","member_number":"TY86756","first_name":"RUSS2","last_name":"DEAN","classification":"A","division":"LIMITED","hit_factor":7.8873},{"match_name":"PPPS 11-13-16","match_date":"2016-11-13","stage_classifiercode":"99-11","member_number":"TY77793","first_name":"ROBERT","last_name":"CHRISTIE","classification":"A","division":"LIMITED","hit_factor":7.8859},{"match_name":"BHPC USPSA Monthly Match 7-8-18 IOWA","match_date":"2018-07-08","stage_classifiercode":"99-11","member_number":"TY68680","first_name":"HERB","last_name":"MARTIN","classification":"B","division":"LIMITED","hit_factor":7.8838},{"match_name":"ORGC CLASSIFIER 07-04-2017","match_date":"2017-07-04","stage_classifiercode":"99-11","member_number":"TY78149","first_name":"ELI","last_name":"SABER","classification":"U","division":"LIMITED","hit_factor":7.8804},{"match_name":"MCPSL Pistol 3-10-18","match_date":"2018-03-10","stage_classifiercode":"99-11","member_number":"A90285","first_name":"CHRIS","last_name":"HOOVER","classification":"B","division":"LIMITED","hit_factor":7.8762},{"match_name":"Benton Gun Club-USPSA April 25","match_date":"2021-04-25","stage_classifiercode":"99-11","member_number":"A70740","first_name":"RYAN","last_name":"REED","classification":"A","division":"LIMITED","hit_factor":7.8689},{"match_name":"HSA USPSA March 2020","match_date":"2020-03-04","stage_classifiercode":"99-11","member_number":"TY99130","first_name":"AMEET","last_name":"DAS","classification":"B","division":"LIMITED","hit_factor":7.8689},{"match_name":"HOPS USPSA 072118","match_date":"2018-07-21","stage_classifiercode":"99-11","member_number":"TY79064","first_name":"SAM","last_name":"BLACK","classification":"B","division":"LIMITED","hit_factor":7.8684},{"match_name":"CCAS June 2016","match_date":"2016-06-25","stage_classifiercode":"99-11","member_number":"PEN","first_name":"LONNY","last_name":"GUPTON","classification":"U","division":"LIMITED","hit_factor":7.8652},{"match_name":"CAPS USPSA June 2021","match_date":"2021-06-05","stage_classifiercode":"99-11","member_number":"a62932","first_name":"RICHARD","last_name":"LANE","classification":"B","division":"LIMITED","hit_factor":7.8635},{"match_name":"TMGN USPSA July 6th Match","match_date":"2017-07-06","stage_classifiercode":"99-11","member_number":"A100896","first_name":"MATTHEW A","last_name":"CHURCH 2","classification":"B","division":"LIMITED","hit_factor":7.8616},{"match_name":"IN19 ACC USPSA September 23","match_date":"2018-09-23","stage_classifiercode":"99-11","member_number":"A86159","first_name":"ALFRED","last_name":"LOPEZ","classification":"B","division":"LIMITED","hit_factor":7.8616},{"match_name":"MESQUITE MAYHEM SEPT 10TH USPSA","match_date":"2017-09-10","stage_classifiercode":"99-11","member_number":"L2747","first_name":"RON","last_name":"AVERY","classification":"GM","division":"LIMITED","hit_factor":7.8534},{"match_name":"USPSA Strategic Edge SEGR August 21st 2021","match_date":"2021-08-21","stage_classifiercode":"99-11","member_number":"A35114","first_name":"REMO","last_name":"HINLO","classification":"A","division":"LIMITED","hit_factor":7.8519},{"match_name":"SLPSA July USPSA match","match_date":"2018-07-21","stage_classifiercode":"99-11","member_number":"TY90173","first_name":"BRIAN","last_name":"CHUNG","classification":"B","division":"LIMITED","hit_factor":7.8493},{"match_name":"Richmond Hot Shots April 14-15-2018 USPSA Pistol Match","match_date":"2018-04-14","stage_classifiercode":"99-11","member_number":"A78576","first_name":"NICK","last_name":"MERCURIO","classification":"A","division":"LIMITED","hit_factor":7.8488},{"match_name":"SAPSC Monthly USPSA Classifier Match 20160209","match_date":"2016-02-09","stage_classifiercode":"99-11","member_number":"A92227","first_name":"BRANDON","last_name":"MALTBIE","classification":"C","division":"LIMITED","hit_factor":7.8431},{"match_name":"Extreme GM USPSA  November","match_date":"2020-11-27","stage_classifiercode":"99-11","member_number":"A87471","first_name":"LUKE","last_name":"RENIBGER","classification":"U","division":"LIMITED","hit_factor":7.8431},{"match_name":"CAPS USPSA June 2021","match_date":"2021-06-05","stage_classifiercode":"99-11","member_number":"A67903","first_name":"JON","last_name":"HUMKE","classification":"B","division":"LIMITED","hit_factor":7.8431},{"match_name":"Clinton County USPSA July 23 2016","match_date":"2016-07-23","stage_classifiercode":"99-11","member_number":"A90573","first_name":"MATT","last_name":"BUSHMAN","classification":"B","division":"LIMITED","hit_factor":7.8431},{"match_name":"LPRGC - Lower Providence USPSA Match November 2021","match_date":"2021-11-06","stage_classifiercode":"99-11","member_number":"TY21185","first_name":"GARY","last_name":"BERTOLET","classification":"M","division":"LIMITED","hit_factor":7.8378},{"match_name":"Palmetto Gun Club - April 2017 USPSA","match_date":"2017-04-08","stage_classifiercode":"99-11","member_number":"A69774","first_name":"DAVID","last_name":"FISCHER","classification":"B","division":"LIMITED","hit_factor":7.8348},{"match_name":"Collin County USPSA 04-25-2021","match_date":"2021-04-24","stage_classifiercode":"99-11","member_number":"L4497","first_name":"BILL","last_name":"BAKER","classification":"M","division":"LIMITED","hit_factor":7.8313},{"match_name":"APSC 4th Annual Holiday Hosefest USPSA Match 12-02-17","match_date":"2017-12-02","stage_classifiercode":"99-11","member_number":"TY90283","first_name":"BRANDON","last_name":"WILLIAMSON","classification":"B","division":"LIMITED","hit_factor":7.8287},{"match_name":"GPSL 10-4-2016","match_date":"2016-10-04","stage_classifiercode":"99-11","member_number":"A82809","first_name":"DAVID","last_name":"DARDEN","classification":"B","division":"LIMITED","hit_factor":7.8221},{"match_name":"Rio Salado Hosemasters February 2021","match_date":"2021-02-27","stage_classifiercode":"99-11","member_number":"TY109765","first_name":"CHRIS","last_name":"BREW","classification":"B","division":"LIMITED","hit_factor":7.8212},{"match_name":"Hopkinton USPSA July 2018","match_date":"2018-07-07","stage_classifiercode":"99-11","member_number":"TY90354","first_name":"BRIAN","last_name":"HARRINGTON","classification":"A","division":"LIMITED","hit_factor":7.8195},{"match_name":"FSTC Classifier - December 2016","match_date":"2016-12-18","stage_classifiercode":"99-11","member_number":"TY54308","first_name":"GLEN","last_name":"BICKING","classification":"A","division":"LIMITED","hit_factor":7.8195},{"match_name":"Applied IN25 USPSA August 15th 2018","match_date":"2018-08-15","stage_classifiercode":"99-11","member_number":"L4004","first_name":"AARON","last_name":"LORTON","classification":"M","division":"LIMITED","hit_factor":7.8195},{"match_name":"MCPSL Pistol 8-12-17","match_date":"2017-08-12","stage_classifiercode":"99-11","member_number":"TY95238","first_name":"JUSTIN","last_name":"MCELROY","classification":"B","division":"LIMITED","hit_factor":7.8189},{"match_name":"CJR&PC USPSA  June 10","match_date":"2018-06-10","stage_classifiercode":"99-11","member_number":"TY54330","first_name":"VICTOR","last_name":"GRILLETTO","classification":"\"\"","division":"LIMITED","hit_factor":7.815},{"match_name":"Chillicothe February 2021 USPSA Match","match_date":"2021-02-28","stage_classifiercode":"99-11","member_number":"TY92908","first_name":"DAVID","last_name":"BURNS","classification":"M","division":"LIMITED","hit_factor":7.8148},{"match_name":"WSPS AUGUST 2016 USPSA","match_date":"2016-08-20","stage_classifiercode":"99-11","member_number":"TY76695","first_name":"TODD","last_name":"BOYER","classification":"B","division":"LIMITED","hit_factor":7.8146},{"match_name":"West Coast IPSC","match_date":"2018-07-22","stage_classifiercode":"99-11","member_number":"TY8228","first_name":"WALTER","last_name":"MICHALOWSKI","classification":"B","division":"LIMITED","hit_factor":7.8125},{"match_name":"CRCPS 2020-08-08","match_date":"2020-08-08","stage_classifiercode":"99-11","member_number":"ty104718","first_name":"FRANK","last_name":"MCCULLA","classification":"C","division":"LIMITED","hit_factor":7.8103},{"match_name":"Wvpps Nov. 2016","match_date":"2016-11-20","stage_classifiercode":"99-11","member_number":"a89896","first_name":"MIKE","last_name":"RILEY","classification":"C","division":"LIMITED","hit_factor":7.8103},{"match_name":"SCCCNOVEMBER2016","match_date":"2016-11-13","stage_classifiercode":"99-11","member_number":"a77376","first_name":"WELKER","last_name":"RON","classification":"C","division":"LIMITED","hit_factor":7.8082},{"match_name":"Ontelaunee USPSA  July 2018","match_date":"2018-07-29","stage_classifiercode":"99-11","member_number":"A93032","first_name":"PAUL","last_name":"TEVALD","classification":"B","division":"LIMITED","hit_factor":7.8078},{"match_name":"BPSA January 2017 USPSA","match_date":"2017-01-22","stage_classifiercode":"99-11","member_number":"TY94183","first_name":"DAVID","last_name":"PAPE","classification":"B","division":"LIMITED","hit_factor":7.7994},{"match_name":"MVPSA USPSA 9-15-18","match_date":"2018-09-15","stage_classifiercode":"99-11","member_number":"A98329","first_name":"TRESA","last_name":"WEAVER","classification":"B","division":"LIMITED","hit_factor":7.7961},{"match_name":"Hopkinton June  2016","match_date":"2016-06-04","stage_classifiercode":"99-11","member_number":"TY90354","first_name":"BRIAN","last_name":"HARRINGTON","classification":"B","division":"LIMITED","hit_factor":7.7944},{"match_name":"Springfield Tactical Shooters 04/05/2018","match_date":"2018-04-05","stage_classifiercode":"99-11","member_number":"A46159","first_name":"JOHN","last_name":"DORSEY","classification":"M","division":"LIMITED","hit_factor":7.7876},{"match_name":"RPS November 2018 USPSA Match","match_date":"2018-11-10","stage_classifiercode":"99-11","member_number":"TY93538","first_name":"JOHN","last_name":"ROYER","classification":"A","division":"LIMITED","hit_factor":7.7834},{"match_name":"Pardoe Sportsmens Association-WPA14-2017-10-01","match_date":"2017-10-01","stage_classifiercode":"99-11","member_number":"A59597","first_name":"GREG","last_name":"PLATT","classification":"A","division":"LIMITED","hit_factor":7.781},{"match_name":"WVPPS November 2020","match_date":"2020-11-15","stage_classifiercode":"99-11","member_number":"TY65620","first_name":"SCOTT","last_name":"METCALF","classification":"B","division":"LIMITED","hit_factor":7.7778},{"match_name":"Pharr action shooters USPSA match at Coyote 02-20-16","match_date":"2016-02-20","stage_classifiercode":"99-11","member_number":"TY-50475","first_name":"ROLAND","last_name":"VILLARREAL","classification":"B","division":"LIMITED","hit_factor":7.776},{"match_name":"Dundee USPSA Feb 2016","match_date":"2016-02-27","stage_classifiercode":"99-11","member_number":"A77934","first_name":"ADAM","last_name":"SORENSON","classification":"B","division":"LIMITED","hit_factor":7.776},{"match_name":"Brothers N Arms December 2018 USPSA Match","match_date":"2018-12-15","stage_classifiercode":"99-11","member_number":"A105075","first_name":"WILLIAM","last_name":"DAVENPORT","classification":"B","division":"LIMITED","hit_factor":7.7748},{"match_name":"Hawkeye Gun Club July 2016 Match","match_date":"2016-07-16","stage_classifiercode":"99-11","member_number":"A82837","first_name":"DANIEL","last_name":"BOYLSTON","classification":"B","division":"LIMITED","hit_factor":7.7744},{"match_name":"RBGC 2017-06-24","match_date":"2017-06-24","stage_classifiercode":"99-11","member_number":"A98278","first_name":"JACK","last_name":"WINDES","classification":"M","division":"LIMITED","hit_factor":7.7644},{"match_name":"CJR&PC USPSA  June 10","match_date":"2018-06-10","stage_classifiercode":"99-11","member_number":"TY22346","first_name":"BUCKY","last_name":"POLLARD","classification":"\"\"","division":"LIMITED","hit_factor":7.7626},{"match_name":"Danville Rifle and Pistol Club USPSA IL17 July 7 2018","match_date":"2018-07-07","stage_classifiercode":"99-11","member_number":"TY90126","first_name":"TOM","last_name":"BURZYNSKI","classification":"B","division":"LIMITED","hit_factor":7.7612},{"match_name":"CGGR July USPSA Match","match_date":"2018-07-21","stage_classifiercode":"99-11","member_number":"A49560","first_name":"LACY","last_name":"LOCKLEAR","classification":"B","division":"LIMITED","hit_factor":7.7599},{"match_name":"SCCCNOVEMBER2016","match_date":"2016-11-13","stage_classifiercode":"99-11","member_number":"a40338","first_name":"BARRY","last_name":"ELLIS","classification":"B","division":"LIMITED","hit_factor":7.7562},{"match_name":"MSSA USPSA June  10 2017","match_date":"2017-06-10","stage_classifiercode":"99-11","member_number":"A72997","first_name":"DAVID","last_name":"HARNESS","classification":"C","division":"LIMITED","hit_factor":7.7551},{"match_name":"Springfield Tactical Shooters 05/06/2021","match_date":"2021-05-06","stage_classifiercode":"99-11","member_number":"A106901","first_name":"WILLIAM","last_name":"AMES","classification":"C","division":"LIMITED","hit_factor":7.7532},{"match_name":"PRG 2017 Classifier Match","match_date":"2017-02-19","stage_classifiercode":"99-11","member_number":"TY92176","first_name":"JAE","last_name":"AHN","classification":"A","division":"LIMITED","hit_factor":7.7532},{"match_name":"Quinton USPSA - August 11 2018","match_date":"2018-08-11","stage_classifiercode":"99-11","member_number":"TY106050","first_name":"COREY","last_name":"MULHOLLAND","classification":"C","division":"LIMITED","hit_factor":7.7465},{"match_name":"APSC USPSA 10-06-18","match_date":"2018-10-06","stage_classifiercode":"99-11","member_number":"A83285","first_name":"GARY","last_name":"AU","classification":"A","division":"LIMITED","hit_factor":7.7465},{"match_name":"PRG - Oh Shoot USPSA February 21st - 3rd Sunday Match","match_date":"2021-02-21","stage_classifiercode":"99-11","member_number":"Ty102539","first_name":"THOMAS","last_name":"MILLER","classification":"B","division":"LIMITED","hit_factor":7.7428},{"match_name":"Maryland Practical Shooters Association July 2018","match_date":"2018-07-22","stage_classifiercode":"99-11","member_number":"A64726","first_name":"JOHNNY","last_name":"GREGORY","classification":"B","division":"LIMITED","hit_factor":7.7409},{"match_name":"Pitcairn-Monroeville Sportsmens Club USPSA August 2017","match_date":"2017-08-05","stage_classifiercode":"99-11","member_number":"TY47047","first_name":"MARK","last_name":"CLEAVER","classification":"A","division":"LIMITED","hit_factor":7.7399},{"match_name":"BHPSC Weekly Match 2-24-2017 Special Classifier Match","match_date":"2017-02-25","stage_classifiercode":"99-11","member_number":"A90285","first_name":"CHRIS","last_name":"HOOVER","classification":"B","division":"LIMITED","hit_factor":7.7399},{"match_name":"LCSA  USPSA April 2017","match_date":"2017-04-08","stage_classifiercode":"99-11","member_number":"TY85681","first_name":"ROBERT","last_name":"MCCLAIN","classification":"B","division":"LIMITED","hit_factor":7.739},{"match_name":"2016-05-07 USPSA at Phoenix Rod and Gun Club","match_date":"2016-05-07","stage_classifiercode":"99-11","member_number":"TY73639","first_name":"HEZEKAIH","last_name":"HELERA","classification":"B","division":"LIMITED","hit_factor":7.7381},{"match_name":"ORSA USPSA October 2017","match_date":"2017-10-21","stage_classifiercode":"99-11","member_number":"RD6","first_name":"MIKE","last_name":"FOLEY","classification":"G","division":"LIMITED","hit_factor":7.7381},{"match_name":"Dundee Practical Shooters - Single Stack Challenge - Jan 23 2021","match_date":"2021-01-23","stage_classifiercode":"99-11","member_number":"A-61446","first_name":"KEN","last_name":"FLOOD","classification":"B","division":"LIMITED","hit_factor":7.7372},{"match_name":"LCSA USPSA March Match","match_date":"2016-03-12","stage_classifiercode":"99-11","member_number":"PEN","first_name":"CARL","last_name":"MASON","classification":"X","division":"LIMITED","hit_factor":7.7348},{"match_name":"HOPS USPSA 072118","match_date":"2018-07-21","stage_classifiercode":"99-11","member_number":"TY65313","first_name":"DON","last_name":"SHIPMAN","classification":"B","division":"LIMITED","hit_factor":7.7348},{"match_name":"FBURG July 2018 Level I USPSA ","match_date":"2018-07-01","stage_classifiercode":"99-11","member_number":"A98365","first_name":"TYLER","last_name":"HOUSTON","classification":"C","division":"LIMITED","hit_factor":7.7273},{"match_name":"Ripon Oct USPSA Match","match_date":"2015-10-24","stage_classifiercode":"99-11","member_number":"A74632","first_name":"SETH","last_name":"GYLDENVAND","classification":"B","division":"LIMITED","hit_factor":7.7266},{"match_name":"LPRGC - Lower Providence USPSA October 2018","match_date":"2018-10-06","stage_classifiercode":"99-11","member_number":"TY99130","first_name":"AMEET","last_name":"DAS","classification":"B","division":"LIMITED","hit_factor":7.7247},{"match_name":"LdF USPSA Match May 12 2018","match_date":"2018-05-12","stage_classifiercode":"99-11","member_number":"A93991","first_name":"CODY","last_name":"GALLANT","classification":"U","division":"LIMITED","hit_factor":7.7193},{"match_name":"Blackstone Shooting Sports Snow Days January 2017 USPSA Level  1","match_date":"2017-01-08","stage_classifiercode":"99-11","member_number":"TY72553","first_name":"BRIAN","last_name":"DEMMA","classification":"B","division":"LIMITED","hit_factor":7.716},{"match_name":"GAS July 7th Special Classifier","match_date":"2018-07-07","stage_classifiercode":"99-11","member_number":"A102201","first_name":"WADE","last_name":"TINGEY","classification":"B","division":"LIMITED","hit_factor":7.7139},{"match_name":"CCC Shooting Complex November 2017","match_date":"2017-11-05","stage_classifiercode":"99-11","member_number":"\"\"","first_name":"TAYLOR","last_name":"LATHAM","classification":"U","division":"LIMITED","hit_factor":7.7135},{"match_name":"RPS December 2017 USPSA Match","match_date":"2017-12-09","stage_classifiercode":"99-11","member_number":"A95240","first_name":"SAM","last_name":"STEPHENS","classification":"A","division":"LIMITED","hit_factor":7.7055},{"match_name":"CCC Shooting Complex November 2017","match_date":"2017-11-05","stage_classifiercode":"99-11","member_number":"TY2227","first_name":"TOMMY","last_name":"TEAS","classification":"B","division":"LIMITED","hit_factor":7.7052},{"match_name":"Impact Match  2/24/2016","match_date":"2016-02-24","stage_classifiercode":"99-11","member_number":"A68393","first_name":"MATT","last_name":"EVANCIC","classification":"M","division":"LIMITED","hit_factor":7.7037},{"match_name":"Richmond Hot Shots October 6-7 USPSA Pistol Match","match_date":"2018-10-06","stage_classifiercode":"99-11","member_number":"A99969","first_name":"KARL","last_name":"MACARAIG","classification":"B","division":"LIMITED","hit_factor":7.7033},{"match_name":"Maine Practical Shooters March 2018","match_date":"2018-03-24","stage_classifiercode":"99-11","member_number":"TY49143","first_name":"TAD","last_name":"DAVIDSON","classification":"M","division":"LIMITED","hit_factor":7.7031},{"match_name":"AGC_20170903","match_date":"2017-09-03","stage_classifiercode":"99-11","member_number":"TY65590","first_name":"STEVE","last_name":"STETLER","classification":"M","division":"LIMITED","hit_factor":7.7029},{"match_name":"Palmetto Gun Club - April 2017 USPSA","match_date":"2017-04-08","stage_classifiercode":"99-11","member_number":"A75765","first_name":"DAVID","last_name":"WHITE","classification":"X","division":"LIMITED","hit_factor":7.6923},{"match_name":"COPS Dec 2015 USPSA","match_date":"2015-12-06","stage_classifiercode":"99-11","member_number":"L2515","first_name":"JEFF","last_name":"COCKRUM","classification":"A","division":"LIMITED","hit_factor":7.6923},{"match_name":"Benton Gun Club-USPSA March 25 2018","match_date":"2018-03-25","stage_classifiercode":"99-11","member_number":"TY82570","first_name":"LARRY","last_name":"VINT","classification":"B","division":"LIMITED","hit_factor":7.6923},{"match_name":"Lafayette Practical Shooters - WED-THUR - Dec 19-20 - CLASSIFIER MATCH","match_date":"2018-12-20","stage_classifiercode":"99-11","member_number":"FY38991","first_name":"MIKE","last_name":"ADAM","classification":"A","division":"LIMITED","hit_factor":7.6923},{"match_name":"CGGR July USPSA Match","match_date":"2018-07-21","stage_classifiercode":"99-11","member_number":"A104209","first_name":"ROB","last_name":"NOEL","classification":"B","division":"LIMITED","hit_factor":7.6821},{"match_name":"LIPSA -  April 17th 2016 - USPSA Special Classifier Match","match_date":"2016-04-17","stage_classifiercode":"99-11","member_number":"L3570","first_name":"KEVIN","last_name":"DRISCOLL","classification":"B","division":"LIMITED","hit_factor":7.6818},{"match_name":"WNPL USPSA - Nov 2017","match_date":"2017-11-05","stage_classifiercode":"99-11","member_number":"A91378","first_name":"CHRISTOPHER","last_name":"BUENDIA","classification":"U","division":"LIMITED","hit_factor":7.6814},{"match_name":"RBGC 2017-06-24","match_date":"2017-06-24","stage_classifiercode":"99-11","member_number":"A83702","first_name":"HUMBERTO","last_name":"VALERO","classification":"X","division":"LIMITED","hit_factor":7.6814},{"match_name":"WVPPS November 2018","match_date":"2018-11-18","stage_classifiercode":"99-11","member_number":"A86158","first_name":"JONATHAN","last_name":"MAGALLANES","classification":"U","division":"LIMITED","hit_factor":7.6809},{"match_name":"DAPS USPSA at ETTS 7-8-17","match_date":"2017-07-08","stage_classifiercode":"99-11","member_number":"PEN","first_name":"JEFF","last_name":"KRANZ","classification":"\"\"","division":"LIMITED","hit_factor":7.6803},{"match_name":"CSA Coalfield Shooters Association USPSA March 2020","match_date":"2020-03-08","stage_classifiercode":"99-11","member_number":"A109622","first_name":"AARON","last_name":"MESSER","classification":"\"\"","division":"LIMITED","hit_factor":7.6712},{"match_name":"TriggerGuard USPSA","match_date":"2016-10-01","stage_classifiercode":"99-11","member_number":"A-95083","first_name":"SHAWN","last_name":"MCGROGAN","classification":"C","division":"LIMITED","hit_factor":7.6705},{"match_name":"SEPSA July 2017","match_date":"2017-07-08","stage_classifiercode":"99-11","member_number":"TY86756","first_name":"RUSS","last_name":"DEAN","classification":"A","division":"LIMITED","hit_factor":7.6705},{"match_name":"2016-05-07 USPSA at Phoenix Rod and Gun Club","match_date":"2016-05-07","stage_classifiercode":"99-11","member_number":"A80039","first_name":"STEVE","last_name":"STEPHENS","classification":"C","division":"LIMITED","hit_factor":7.6692},{"match_name":"Lafayette Practical Shooters - WED - Nov 4","match_date":"2020-11-05","stage_classifiercode":"99-11","member_number":"A108820","first_name":"COLIN","last_name":"MONTGOMERY","classification":"A","division":"LIMITED","hit_factor":7.6687},{"match_name":"OK15 USPSA at USSA","match_date":"2017-12-10","stage_classifiercode":"99-11","member_number":"TY82278","first_name":"ROWDY","last_name":"BRICCO","classification":"A","division":"LIMITED","hit_factor":7.6642},{"match_name":"Maine Practical Shooters August 2016","match_date":"2016-08-27","stage_classifiercode":"99-11","member_number":"A82210","first_name":"JOHN","last_name":"JONES","classification":"C","division":"LIMITED","hit_factor":7.6618},{"match_name":"WPGC 8-7-2017","match_date":"2017-08-07","stage_classifiercode":"99-11","member_number":"A64636","first_name":"MATTHEW","last_name":"DAVIS","classification":"B","division":"LIMITED","hit_factor":7.6602},{"match_name":"STAGE ZERO SHOOTING SUPPLY USPSA","match_date":"2020-07-16","stage_classifiercode":"99-11","member_number":"A112087","first_name":"JONAH","last_name":"GELIGOFF","classification":"B","division":"LIMITED","hit_factor":7.6596},{"match_name":"17s PSC - Go Fast Don’t Suck 2020 Spring Postal Match (USPSA)","match_date":"2020-05-16","stage_classifiercode":"99-11","member_number":"A118354","first_name":"TROY","last_name":"WHITE","classification":"D","division":"LIMITED","hit_factor":7.6577},{"match_name":"Armory Indoor League","match_date":"2017-10-12","stage_classifiercode":"99-11","member_number":"A51363","first_name":"KENNY","last_name":"TERRY","classification":"M","division":"LIMITED","hit_factor":7.6577},{"match_name":"GAS July 7th Special Classifier","match_date":"2018-07-07","stage_classifiercode":"99-11","member_number":"A90239","first_name":"KYNAN","last_name":"SUTTER","classification":"C","division":"LIMITED","hit_factor":7.6577},{"match_name":"PSS USPSA Classifier Match August 14 2021","match_date":"2021-08-14","stage_classifiercode":"99-11","member_number":"TY84119","first_name":"RAFAEL","last_name":"FUENTES","classification":"U","division":"LIMITED","hit_factor":7.657},{"match_name":"DWB - Deadwood Boys USPSA 20 September 2020  Classifier Match Makeup","match_date":"2020-09-20","stage_classifiercode":"99-11","member_number":"Ty122227","first_name":"ZARTAN","last_name":".","classification":"C","division":"LIMITED","hit_factor":7.657},{"match_name":"Baghdad USPSA Special Classifier Lightning Interrupted 6 May 2017","match_date":"2017-05-06","stage_classifiercode":"99-11","member_number":"TY51119","first_name":"CHRIS","last_name":"MOLNAR","classification":"U","division":"LIMITED","hit_factor":7.6555},{"match_name":"ENPS December 2020 USPSA Match","match_date":"2020-12-06","stage_classifiercode":"99-11","member_number":"TY89507","first_name":"JUSTYN","last_name":"RILEY","classification":"B","division":"LIMITED","hit_factor":7.6495},{"match_name":"WVPPS November 2020","match_date":"2020-11-15","stage_classifiercode":"99-11","member_number":"TY116328","first_name":"NOEL","last_name":"ANDERSON","classification":"A","division":"LIMITED","hit_factor":7.6495},{"match_name":"MESQUITE MAYHEM SEPT 10TH USPSA","match_date":"2017-09-10","stage_classifiercode":"99-11","member_number":"A67361","first_name":"KEVIN","last_name":"BASSINGER","classification":"A","division":"LIMITED","hit_factor":7.6433},{"match_name":"MCRC USPSA August 2018","match_date":"2018-08-11","stage_classifiercode":"99-11","member_number":"TY101839","first_name":"LUCKY","last_name":"GRAY","classification":"B","division":"LIMITED","hit_factor":7.6408},{"match_name":"2016-05-07 USPSA at Phoenix Rod and Gun Club","match_date":"2016-05-07","stage_classifiercode":"99-11","member_number":"A77066","first_name":"MARCELO","last_name":"MARIANO","classification":"A","division":"LIMITED","hit_factor":7.6369},{"match_name":"ETRPC-USPSA","match_date":"2021-03-27","stage_classifiercode":"99-11","member_number":"L1790","first_name":"DICK","last_name":"BURKHARDT","classification":"G","division":"LIMITED","hit_factor":7.6369},{"match_name":"SSS USPSA October 2018","match_date":"2018-10-21","stage_classifiercode":"99-11","member_number":"A102564","first_name":"DONALD","last_name":"POWERS","classification":"M (Master)","division":"LIMITED","hit_factor":7.6347},{"match_name":"Ontelaunee USPSA July 2016","match_date":"2016-07-23","stage_classifiercode":"99-11","member_number":"A54332","first_name":"RICH","last_name":"BROWN","classification":"A","division":"LIMITED","hit_factor":7.6336},{"match_name":"Ontelaunee USPSA  July 2018","match_date":"2018-07-29","stage_classifiercode":"99-11","member_number":"A85855","first_name":"GABE","last_name":"BLARDONY","classification":"B","division":"LIMITED","hit_factor":7.6324},{"match_name":"SAPS Match 1/16/2021","match_date":"2021-01-16","stage_classifiercode":"99-11","member_number":"TY72948","first_name":"WILLIAM","last_name":"VANNI","classification":"B","division":"LIMITED","hit_factor":7.6316},{"match_name":"WSPS JUNE 2018 USPSA MATCH","match_date":"2018-06-16","stage_classifiercode":"99-11","member_number":"TY70283","first_name":"RACHAEL","last_name":"GRANICO","classification":"B","division":"LIMITED","hit_factor":7.6316},{"match_name":"NW01 Paul Bunyan CS Series May 9 2021","match_date":"2021-05-09","stage_classifiercode":"99-11","member_number":"L3253","first_name":"SCOTT","last_name":"LEROUX","classification":"M","division":"LIMITED","hit_factor":7.6283},{"match_name":"CRC/SVPS AUGUST  2018","match_date":"2018-08-17","stage_classifiercode":"99-11","member_number":"A101489","first_name":"TODD","last_name":"WOITZEL","classification":"U","division":"LIMITED","hit_factor":7.6259},{"match_name":"Emmett July Match","match_date":"2017-07-21","stage_classifiercode":"99-11","member_number":"ty30712","first_name":"DENNIS","last_name":"WILSON","classification":"A","division":"LIMITED","hit_factor":7.6259},{"match_name":"ORPCI USPSA Saturday 2021.07.17","match_date":"2021-07-17","stage_classifiercode":"99-11","member_number":"A121606","first_name":"JACOB","last_name":"EAMES","classification":"C","division":"LIMITED","hit_factor":7.6256},{"match_name":"LCHG September 2018 USPSA Special Classifier","match_date":"2018-09-08","stage_classifiercode":"99-11","member_number":"A111357","first_name":"DALE","last_name":"COCHRELL","classification":"C","division":"LIMITED","hit_factor":7.6233},{"match_name":"Deadwood Boys USPSA All Classifier Match - 29 July 2018","match_date":"2018-07-29","stage_classifiercode":"99-11","member_number":"TY83392","first_name":"JON","last_name":"BARRETT","classification":"A","division":"LIMITED","hit_factor":7.6225},{"match_name":"Target  Sports Central Indiana Championship","match_date":"2020-08-22","stage_classifiercode":"99-11","member_number":"FY111692","first_name":"ROSE","last_name":"WRIGHT","classification":"U","division":"LIMITED","hit_factor":7.622},{"match_name":"USPSA MO21 2Alpha SBRC March 2018","match_date":"2018-03-24","stage_classifiercode":"99-11","member_number":"A72757","first_name":"MARK","last_name":"CRABTREE","classification":"M","division":"LIMITED","hit_factor":7.6208},{"match_name":"Denali Practical Pistol April","match_date":"2017-04-08","stage_classifiercode":"99-11","member_number":"A75031","first_name":"BLAKE","last_name":"KOROUS","classification":"B","division":"LIMITED","hit_factor":7.6203},{"match_name":"Blackstone Shooting Sports May 2017 USPSA Pistol Level 1","match_date":"2017-05-09","stage_classifiercode":"99-11","member_number":"A95240","first_name":"SAM","last_name":"STEPHENS","classification":"B","division":"LIMITED","hit_factor":7.6104},{"match_name":"MVS USPSA 9-20-17","match_date":"2017-09-20","stage_classifiercode":"99-11","member_number":"A100631","first_name":"BRIAN","last_name":"HONG","classification":"C","division":"LIMITED","hit_factor":7.6104},{"match_name":"RPS November 2018 USPSA Match","match_date":"2018-11-10","stage_classifiercode":"99-11","member_number":"TY83413","first_name":"DOUG","last_name":"HARDING","classification":"B","division":"LIMITED","hit_factor":7.6101},{"match_name":"Pardoe Sportsmens Association- USPSA Saturday 4-3-21","match_date":"2021-04-03","stage_classifiercode":"99-11","member_number":"A110098","first_name":"ADAM","last_name":"KNOX","classification":"B","division":"LIMITED","hit_factor":7.6072},{"match_name":"WSPS JUNE 2018 USPSA MATCH","match_date":"2018-06-16","stage_classifiercode":"99-11","member_number":"FY88040","first_name":"STEPHEN","last_name":"HOSAGE","classification":"B","division":"LIMITED","hit_factor":7.6056},{"match_name":"ARPC USPSA Match 5-27-18","match_date":"2018-05-27","stage_classifiercode":"99-11","member_number":"A87057","first_name":"KEVIN","last_name":"STEWART","classification":"A","division":"LIMITED","hit_factor":7.6056},{"match_name":"Coastal Area Practical Shooters 7-22-17 Special Classifier","match_date":"2017-07-22","stage_classifiercode":"99-11","member_number":"A102527","first_name":"ADAM2","last_name":"HOOVER","classification":"B","division":"LIMITED","hit_factor":7.6056},{"match_name":"RPS December 2017 USPSA Match","match_date":"2017-12-09","stage_classifiercode":"99-11","member_number":"TY77480","first_name":"GORDON","last_name":"SNADEN","classification":"B","division":"LIMITED","hit_factor":7.604},{"match_name":"Tangi May 2016 USPSA","match_date":"2016-05-29","stage_classifiercode":"99-11","member_number":"A90094","first_name":"DANIEL","last_name":"LUXICH","classification":"C","division":"LIMITED","hit_factor":7.6006},{"match_name":"GoShoot Indoors","match_date":"2017-06-11","stage_classifiercode":"99-11","member_number":"L4097","first_name":"JEFF","last_name":"WALLACE","classification":"A","division":"LIMITED","hit_factor":7.6},{"match_name":"Brazosland Pistoleros January 17 2016--USPSA","match_date":"2016-01-17","stage_classifiercode":"99-11","member_number":"FY16969","first_name":"GREG","last_name":"THOEDE","classification":"B","division":"LIMITED","hit_factor":7.5949},{"match_name":"Griffin USPSA Match Dec 2017","match_date":"2017-12-16","stage_classifiercode":"99-11","member_number":"A90102","first_name":"ROBERT","last_name":"BODRON","classification":"B","division":"LIMITED","hit_factor":7.5829},{"match_name":"WVPPS May 2021","match_date":"2021-05-16","stage_classifiercode":"99-11","member_number":"TY66824","first_name":"MICHAEL","last_name":"MCCAULEY","classification":"B","division":"LIMITED","hit_factor":7.5823},{"match_name":"DAPS USPSA at ETTS 7-8-17","match_date":"2017-07-08","stage_classifiercode":"99-11","member_number":"A22936","first_name":"CARINA","last_name":"RANDOLPH","classification":"A","division":"LIMITED","hit_factor":7.5714},{"match_name":"OKCGC USPSA June 2018","match_date":"2018-06-02","stage_classifiercode":"99-11","member_number":"A67199","first_name":"GREG","last_name":"GOODE","classification":"B","division":"LIMITED","hit_factor":7.571},{"match_name":"USPSA MO21 2Alpha SBRC Classifier 2016","match_date":"2016-11-26","stage_classifiercode":"99-11","member_number":"TY92908","first_name":"DAVID","last_name":"BURNS","classification":"B","division":"LIMITED","hit_factor":7.5697},{"match_name":"MSSA USPSA June  10 2017","match_date":"2017-06-10","stage_classifiercode":"99-11","member_number":"A79446","first_name":"BEN","last_name":"BLANKENSHIP","classification":"B","division":"LIMITED","hit_factor":7.5697},{"match_name":"Ontelaunee USPSA July 2016","match_date":"2016-07-23","stage_classifiercode":"99-11","member_number":"FY88040","first_name":"STEPHEN","last_name":"HOSAGE","classification":"U","division":"LIMITED","hit_factor":7.5676},{"match_name":"Richmond Hot Shots April 30-May 1st USPSA Pistol Match","match_date":"2016-04-30","stage_classifiercode":"99-11","member_number":"A82878","first_name":"RICHARD","last_name":"WILLIAMS","classification":"C","division":"LIMITED","hit_factor":7.5676},{"match_name":"CISSA USPSA Classier Match Dec 8th 2018","match_date":"2018-12-08","stage_classifiercode":"99-11","member_number":"F108386","first_name":"ALES","last_name":"CEVELA","classification":"\"\"","division":"LIMITED","hit_factor":7.5662},{"match_name":"ACPSA November 2018","match_date":"2018-11-24","stage_classifiercode":"99-11","member_number":"A72887","first_name":"KEVIN","last_name":"MCDOWELL","classification":"B","division":"LIMITED","hit_factor":7.5658},{"match_name":"SAPS Match 1/16/2021","match_date":"2021-01-16","stage_classifiercode":"99-11","member_number":"l2628","first_name":"SALIM","last_name":"DOMINGUEZ","classification":"A","division":"LIMITED","hit_factor":7.5653},{"match_name":"Holmen USPSA 10/30/16","match_date":"2016-10-30","stage_classifiercode":"99-11","member_number":"A83117","first_name":"BOB","last_name":"NAVRESTAD","classification":"U","division":"LIMITED","hit_factor":7.563},{"match_name":"WSRC USPSA","match_date":"2016-10-22","stage_classifiercode":"99-11","member_number":"A74548","first_name":"BRIAN","last_name":"HAYS","classification":"B","division":"LIMITED","hit_factor":7.5619},{"match_name":"DPSL July 22 2018 All Classifier","match_date":"2018-07-22","stage_classifiercode":"99-11","member_number":"TY22475","first_name":"JEFFREY","last_name":"JOHN","classification":"A","division":"LIMITED","hit_factor":7.5606},{"match_name":"Lefthanders Gun Club Practical Shooters October","match_date":"2017-09-30","stage_classifiercode":"99-11","member_number":"TY92908","first_name":"DAVID","last_name":"BURNS","classification":"A","division":"LIMITED","hit_factor":7.5591},{"match_name":"CSA Coalfield Shooters Association USPSA March 2020","match_date":"2020-03-08","stage_classifiercode":"99-11","member_number":"TY119141","first_name":"LEO","last_name":"ARAUJO","classification":"\"\"","division":"LIMITED","hit_factor":7.5529},{"match_name":"Ontelaunee USPSA  July 2018","match_date":"2018-07-29","stage_classifiercode":"99-11","member_number":"TY68809","first_name":"JAMES","last_name":"GRAZIANO SR","classification":"B","division":"LIMITED","hit_factor":7.5499},{"match_name":"EWPSA 2018-10","match_date":"2018-10-20","stage_classifiercode":"99-11","member_number":"A69094","first_name":"AARON","last_name":"LAWS","classification":"M","division":"LIMITED","hit_factor":7.5472},{"match_name":"HPSP Heartland Practical Shooters June USPSA Shoot","match_date":"2018-06-24","stage_classifiercode":"99-11","member_number":"A87467","first_name":"JAREN","last_name":"HILGER","classification":"D","division":"LIMITED","hit_factor":7.5472},{"match_name":"MSSA USPSA June  10 2017","match_date":"2017-06-10","stage_classifiercode":"99-11","member_number":"\"\"","first_name":"HUNTER","last_name":"SYKES","classification":"\"\"","division":"LIMITED","hit_factor":7.5472},{"match_name":"Georgia Run N Gun 1-28-2016","match_date":"2016-01-29","stage_classifiercode":"99-11","member_number":"A79673","first_name":"DANIELL","last_name":"RICHARDSON","classification":"A","division":"LIMITED","hit_factor":7.5444},{"match_name":"BGSL Classifier Match ","match_date":"2018-10-06","stage_classifiercode":"99-11","member_number":"a102695","first_name":"MARK","last_name":"CARDWELL","classification":"C","division":"LIMITED","hit_factor":7.5397},{"match_name":"ARPC USPSA Match 5-27-18","match_date":"2018-05-27","stage_classifiercode":"99-11","member_number":"FY70186","first_name":"SONYA","last_name":"CORUM","classification":"B","division":"LIMITED","hit_factor":7.5397},{"match_name":"WLPS USPSA May 2016","match_date":"2016-05-22","stage_classifiercode":"99-11","member_number":"A81724","first_name":"ROBERT","last_name":"WELCH","classification":"B","division":"LIMITED","hit_factor":7.5391},{"match_name":"WVRPC Speed Shoot Spectacular Dec 2017","match_date":"2017-12-16","stage_classifiercode":"99-11","member_number":"A80429","first_name":"JOHN","last_name":"WILSON","classification":"B","division":"LIMITED","hit_factor":7.5377},{"match_name":"GAS Special Classifier","match_date":"2016-07-02","stage_classifiercode":"99-11","member_number":"L3409","first_name":"BRUCE","last_name":"REID","classification":"B","division":"LIMITED","hit_factor":7.5362},{"match_name":"2016-02-06 USPSA at Phoenix Rod and Gun Club","match_date":"2016-02-06","stage_classifiercode":"99-11","member_number":"A57645","first_name":"BRIAN","last_name":"BAKKE","classification":"A","division":"LIMITED","hit_factor":7.5332},{"match_name":"MCRC USPSA August 2018","match_date":"2018-08-11","stage_classifiercode":"99-11","member_number":"A106052","first_name":"NATHAN","last_name":"GRAY","classification":"C","division":"LIMITED","hit_factor":7.5325},{"match_name":"INAS May 2020 USPSA","match_date":"2020-05-09","stage_classifiercode":"99-11","member_number":"A75946","first_name":"ERIK","last_name":"PETERSON","classification":"B","division":"LIMITED","hit_factor":7.5301},{"match_name":"Heritage March 2021 USPSA","match_date":"2021-03-13","stage_classifiercode":"99-11","member_number":"Fy71098","first_name":"T.J.","last_name":"TURNER","classification":"M","division":"LIMITED","hit_factor":7.5301},{"match_name":"MCPSL Pistol 8-12-17","match_date":"2017-08-12","stage_classifiercode":"99-11","member_number":"A96597","first_name":"MATT","last_name":"KRAINBILL","classification":"B","division":"LIMITED","hit_factor":7.5297},{"match_name":"LIPSA -  April 17th 2016 - USPSA Special Classifier Match","match_date":"2016-04-17","stage_classifiercode":"99-11","member_number":"TY77141","first_name":"LOUIE","last_name":"PRIMERO","classification":"A","division":"LIMITED","hit_factor":7.529},{"match_name":"OKCGC USPSA June 2018","match_date":"2018-06-02","stage_classifiercode":"99-11","member_number":"A82143","first_name":"ROBAIRE  JR","last_name":"PULLICAR","classification":"B","division":"LIMITED","hit_factor":7.5253},{"match_name":"OFGC USPSA Match Feb 19th 2017","match_date":"2017-02-19","stage_classifiercode":"99-11","member_number":"A92527","first_name":"JAKE","last_name":"NOBLE","classification":"C","division":"LIMITED","hit_factor":7.5198},{"match_name":"SLPSA August USPSA Match 2","match_date":"2020-08-15","stage_classifiercode":"99-11","member_number":"TY49638","first_name":"DAN","last_name":"WARD","classification":"B","division":"LIMITED","hit_factor":7.5137},{"match_name":"Tangi May 2016 USPSA","match_date":"2016-05-29","stage_classifiercode":"99-11","member_number":"A94183","first_name":"DAVID","last_name":"PAPE","classification":"C","division":"LIMITED","hit_factor":7.513},{"match_name":"BSPSC 2017 April Special Classifier","match_date":"2017-04-09","stage_classifiercode":"99-11","member_number":"TY73486","first_name":"AL","last_name":"ROY","classification":"B","division":"LIMITED","hit_factor":7.5104},{"match_name":"Richmond Hot Shots April 30-May 1st USPSA Pistol Match","match_date":"2016-04-30","stage_classifiercode":"99-11","member_number":"ty63997","first_name":"DOUG","last_name":"LARSON","classification":"A","division":"LIMITED","hit_factor":7.5085},{"match_name":"PSAC_20161022","match_date":"2016-10-22","stage_classifiercode":"99-11","member_number":"A88191","first_name":"DAVID","last_name":"BEEBE","classification":"\"\"","division":"LIMITED","hit_factor":7.5075},{"match_name":"RPS December 2017 USPSA Match","match_date":"2017-12-09","stage_classifiercode":"99-11","member_number":"TY88693","first_name":"ANDY","last_name":"POTEAT","classification":"B","division":"LIMITED","hit_factor":7.5075},{"match_name":"CRCPS 2021-08-14","match_date":"2021-08-14","stage_classifiercode":"99-11","member_number":"A101580","first_name":"DAVID","last_name":"VALDEZ","classification":"U","division":"LIMITED","hit_factor":7.5075},{"match_name":"Holmen USPSA 10/30/16","match_date":"2016-10-30","stage_classifiercode":"99-11","member_number":"TY67949","first_name":"JOSH","last_name":"STOOS","classification":"B","division":"LIMITED","hit_factor":7.5071},{"match_name":"Silver Practical 7-16-2016","match_date":"2016-07-10","stage_classifiercode":"99-11","member_number":"\"\"","first_name":"COLE","last_name":"POTTS","classification":"U","division":"LIMITED","hit_factor":7.5071},{"match_name":"LdF USPSA Match January 25 2020","match_date":"2020-01-25","stage_classifiercode":"99-11","member_number":"A74209","first_name":"JAMIE","last_name":"FRANKS","classification":"U","division":"LIMITED","hit_factor":7.5067},{"match_name":"OK Corral Action Challenge October","match_date":"2015-10-24","stage_classifiercode":"99-11","member_number":"A83118","first_name":"ADAM","last_name":"WEINSTEIN","classification":"C","division":"LIMITED","hit_factor":7.5067},{"match_name":"FBURG July 2018 Level I USPSA ","match_date":"2018-07-01","stage_classifiercode":"99-11","member_number":"A22830","first_name":"JACK","last_name":"BECKER","classification":"M","division":"LIMITED","hit_factor":7.5047},{"match_name":"HTF Practical Shooters","match_date":"2018-07-01","stage_classifiercode":"99-11","member_number":"A100328","first_name":"JOSH","last_name":"TAYLOR","classification":"A","division":"LIMITED","hit_factor":7.5041},{"match_name":"Maryland Practical Shooters Association July 2018","match_date":"2018-07-22","stage_classifiercode":"99-11","member_number":"A105337","first_name":"ALECA105","last_name":"HESS","classification":"U","division":"LIMITED","hit_factor":7.5041},{"match_name":"2016-05-07 USPSA at Phoenix Rod and Gun Club","match_date":"2016-05-07","stage_classifiercode":"99-11","member_number":"A55525","first_name":"MICHAEL","last_name":"MCDANNELL","classification":"B","division":"LIMITED","hit_factor":7.5038},{"match_name":"2016-07 Bone Creek USPSA","match_date":"2016-07-03","stage_classifiercode":"99-11","member_number":"A78550","first_name":"BILLY","last_name":"YORK","classification":"B","division":"LIMITED","hit_factor":7.5038},{"match_name":"MCRC USPSA August 2018","match_date":"2018-08-11","stage_classifiercode":"99-11","member_number":"A104252","first_name":"ROBERT","last_name":"TEAGUE","classification":"C","division":"LIMITED","hit_factor":7.5036},{"match_name":"WNPL USPSA - Nov 2017","match_date":"2017-11-05","stage_classifiercode":"99-11","member_number":"TY105683","first_name":"ALEX","last_name":"ARKHANGELSKIY","classification":"U","division":"LIMITED","hit_factor":7.5032},{"match_name":"MCRC USPSA August 2018","match_date":"2018-08-11","stage_classifiercode":"99-11","member_number":"A103559","first_name":"SAM","last_name":"POWERS","classification":"A","division":"LIMITED","hit_factor":7.5},{"match_name":"USPSA MO21 2Alpha SBRC December 22 2018","match_date":"2018-12-22","stage_classifiercode":"99-11","member_number":"A102640","first_name":"BEAU","last_name":"PHILLIPS","classification":"B","division":"LIMITED","hit_factor":7.5},{"match_name":"SLOSA NOVEMBER 2017 USPSA MATCH","match_date":"2017-11-11","stage_classifiercode":"99-11","member_number":"FY82690","first_name":"MARK","last_name":"SALAZAR","classification":"C","division":"LIMITED","hit_factor":7.5},{"match_name":"INAS Jan 2016 USPSA","match_date":"2016-01-16","stage_classifiercode":"99-11","member_number":"A81373","first_name":"TIM","last_name":"KROHN","classification":"U","division":"LIMITED","hit_factor":7.4963},{"match_name":"CGC 4.30.17","match_date":"2017-04-30","stage_classifiercode":"99-11","member_number":"TY55863","first_name":"SEAN","last_name":"MYHRE","classification":"B","division":"LIMITED","hit_factor":7.4954},{"match_name":"Danville Rifle and Pistol Club USPSA IL17 July 7 2018","match_date":"2018-07-07","stage_classifiercode":"99-11","member_number":"TY92908","first_name":"DAVID","last_name":"BURNS","classification":"M","division":"LIMITED","hit_factor":7.4901},{"match_name":"MCPSL Pistol 8-12-17","match_date":"2017-08-12","stage_classifiercode":"99-11","member_number":"A94098","first_name":"PETE","last_name":"SCHLEICHER","classification":"C","division":"LIMITED","hit_factor":7.4883},{"match_name":"ARPC USPSA Match 5-27-18","match_date":"2018-05-27","stage_classifiercode":"99-11","member_number":"A26779","first_name":"KEITH","last_name":"LICHAY","classification":"B","division":"LIMITED","hit_factor":7.4866},{"match_name":"TriggerGuard USPSA Classifier Match","match_date":"2018-03-24","stage_classifiercode":"99-11","member_number":"a105403","first_name":"MICAH","last_name":"PUCKETT","classification":"U","division":"LIMITED","hit_factor":7.4866},{"match_name":"SLPSA August USPSA Match 2","match_date":"2020-08-15","stage_classifiercode":"99-11","member_number":"FY88704","first_name":"GARY","last_name":"HANSEN","classification":"B","division":"LIMITED","hit_factor":7.4841},{"match_name":"WSPS JUNE 2018 USPSA MATCH","match_date":"2018-06-16","stage_classifiercode":"99-11","member_number":"L3944","first_name":"DAVID","last_name":"BLACK","classification":"A","division":"LIMITED","hit_factor":7.4841},{"match_name":"CGC 4.30.17","match_date":"2017-04-30","stage_classifiercode":"99-11","member_number":"TY86616","first_name":"WILLIAM","last_name":"WEEKS","classification":"C","division":"LIMITED","hit_factor":7.483},{"match_name":"BRSP Tuesday Night USPSA Match - Sept 11","match_date":"2018-09-12","stage_classifiercode":"99-11","member_number":"\"\"","first_name":"RUSTIN","last_name":"SLAUGHTER","classification":"\"\"","division":"LIMITED","hit_factor":7.482},{"match_name":"CGGR July USPSA Match","match_date":"2018-07-21","stage_classifiercode":"99-11","member_number":"A90559","first_name":"IKE","last_name":"STARNES","classification":"B","division":"LIMITED","hit_factor":7.4753},{"match_name":"TriggerGuard USPSA","match_date":"2017-08-05","stage_classifiercode":"99-11","member_number":"\"\"","first_name":"DOUG","last_name":"STEPHENS","classification":"U","division":"LIMITED","hit_factor":7.4753},{"match_name":"Blackstone Shooting Sports November 2016 USPSA Level 1","match_date":"2016-11-08","stage_classifiercode":"99-11","member_number":"A31524","first_name":"COUNCIL","last_name":"BRADSHAW","classification":"G","division":"LIMITED","hit_factor":7.4738},{"match_name":"17 South - April Fools Match","match_date":"2017-04-01","stage_classifiercode":"99-11","member_number":"A75337","first_name":"JIMMY","last_name":"OLIVER","classification":"A","division":"LIMITED","hit_factor":7.4713},{"match_name":"BRC_20180114","match_date":"2018-01-14","stage_classifiercode":"99-11","member_number":"\"\"","first_name":"PAUL","last_name":"ROHDE","classification":"U","division":"LIMITED","hit_factor":7.4713},{"match_name":"Lefthanders Gun Club Practical Shooters October","match_date":"2017-09-30","stage_classifiercode":"99-11","member_number":"A97039","first_name":"JON L","last_name":"BOURNE","classification":"B","division":"LIMITED","hit_factor":7.4713},{"match_name":"Wvpps Nov. 2017","match_date":"2017-11-19","stage_classifiercode":"99-11","member_number":"TY66824","first_name":"MICHAEL","last_name":"MCCAULEY","classification":"B","division":"LIMITED","hit_factor":7.4646},{"match_name":"Shadow Hawk Defense USPSA Special Classifier","match_date":"2020-11-14","stage_classifiercode":"99-11","member_number":"A93612","first_name":"PAUL","last_name":"RANDAZZO","classification":"B","division":"LIMITED","hit_factor":7.4597},{"match_name":"Rankin field Sunday match Clone","match_date":"2016-07-17","stage_classifiercode":"99-11","member_number":"A65481","first_name":"KEVIN","last_name":"DORAN","classification":"B","division":"LIMITED","hit_factor":7.4581},{"match_name":"Collin County USPSA 04-25-2021","match_date":"2021-04-24","stage_classifiercode":"99-11","member_number":"A46662","first_name":"BOB","last_name":"PARKER","classification":"B","division":"LIMITED","hit_factor":7.4576},{"match_name":"GPS.   August  2016 ","match_date":"2016-08-28","stage_classifiercode":"99-11","member_number":"fy38991","first_name":"MIKE","last_name":"ADAM","classification":"A","division":"LIMITED","hit_factor":7.4567},{"match_name":"AAPS AAFG Level 1 Match - May 5 2018","match_date":"2018-05-05","stage_classifiercode":"99-11","member_number":"A103615","first_name":"CODY","last_name":"WERTZ","classification":"C","division":"LIMITED","hit_factor":7.455},{"match_name":"CRCPS 2020-08-08","match_date":"2020-08-08","stage_classifiercode":"99-11","member_number":"FY26112","first_name":"RW","last_name":"SWAINSON","classification":"M","division":"LIMITED","hit_factor":7.4543},{"match_name":"Klamath USPSA 06/05/16 JSPS OR09","match_date":"2016-06-05","stage_classifiercode":"99-11","member_number":"A88720","first_name":"SCOTT","last_name":"LARSON","classification":"B","division":"LIMITED","hit_factor":7.4543},{"match_name":"CRCPS 2021-08-14","match_date":"2021-08-14","stage_classifiercode":"99-11","member_number":"ty104718","first_name":"FRANK","last_name":"MCCULLA","classification":"C","division":"LIMITED","hit_factor":7.4543},{"match_name":"NCPS USPSA Handgun Match November 27 2016","match_date":"2016-11-27","stage_classifiercode":"99-11","member_number":"A57508","first_name":"PATRICK","last_name":"CLARK","classification":"B","division":"LIMITED","hit_factor":7.4526},{"match_name":"ENPS 2018 June USPSA Match","match_date":"2018-06-03","stage_classifiercode":"99-11","member_number":"TY61813","first_name":"TOM","last_name":"ENGEL","classification":"A","division":"LIMITED","hit_factor":7.4516},{"match_name":"CSS February 2016","match_date":"2016-02-12","stage_classifiercode":"99-11","member_number":"TY69326","first_name":"DEREK","last_name":"DESCANT","classification":"U","division":"LIMITED","hit_factor":7.4516},{"match_name":"WI21 June 24 2018 Points Match","match_date":"2018-06-06","stage_classifiercode":"99-11","member_number":"A106244","first_name":"JOE","last_name":"KUMMERER","classification":"C","division":"LIMITED","hit_factor":7.4499},{"match_name":"SWGC USPSA Pistol Match - November 2021","match_date":"2021-11-06","stage_classifiercode":"99-11","member_number":"FY94752","first_name":"CHRIS","last_name":"DEBRUIN","classification":"B","division":"LIMITED","hit_factor":7.4495},{"match_name":"Wvpps Nov. 2017","match_date":"2017-11-19","stage_classifiercode":"99-11","member_number":"ty92174","first_name":"BRIAN","last_name":"LACY","classification":"C","division":"LIMITED","hit_factor":7.4495},{"match_name":"ORPCI 2018.03.31 USPSA Special","match_date":"2018-03-31","stage_classifiercode":"99-11","member_number":"A106367","first_name":"DANIEL","last_name":"MATHIAS","classification":"U","division":"LIMITED","hit_factor":7.4468},{"match_name":"USPSA CM99 Special Classifier MO19 Lamar October 9 2016","match_date":"2016-10-09","stage_classifiercode":"99-11","member_number":"TY48907","first_name":"DAVID","last_name":"LETSCH","classification":"B","division":"LIMITED","hit_factor":7.4453},{"match_name":"Freeport  Oct 2020 The Goodfellas Match","match_date":"2020-10-04","stage_classifiercode":"99-11","member_number":"TY109517","first_name":"DAN","last_name":"LUTZ","classification":"B","division":"LIMITED","hit_factor":7.4434},{"match_name":"GAS Special Classifier","match_date":"2016-07-02","stage_classifiercode":"99-11","member_number":"A73486","first_name":"AL","last_name":"ROY","classification":"B","division":"LIMITED","hit_factor":7.4405},{"match_name":"ECPS USPSA 19 May 18","match_date":"2018-05-19","stage_classifiercode":"99-11","member_number":"A59817","first_name":"SAMUEL","last_name":"SHEW","classification":"B","division":"LIMITED","hit_factor":7.4392},{"match_name":"Ontelaunee USPSA July 2016","match_date":"2016-07-23","stage_classifiercode":"99-11","member_number":"A91710","first_name":"RYAN","last_name":"POBLETE","classification":"A","division":"LIMITED","hit_factor":7.4364},{"match_name":"OREGON ARPC CC05 USPSA AUGUST 12 2017","match_date":"2017-08-12","stage_classifiercode":"99-11","member_number":"TY90908","first_name":"CHRIS","last_name":"STORMS","classification":"B","division":"LIMITED","hit_factor":7.4359},{"match_name":"LdF USPSA Match May 12 2018","match_date":"2018-05-12","stage_classifiercode":"99-11","member_number":"TY110175","first_name":"JASON","last_name":"HURST","classification":"U","division":"LIMITED","hit_factor":7.4316},{"match_name":"TAP USPSA Pistol Match Aug 14 2016","match_date":"2016-08-14","stage_classifiercode":"99-11","member_number":"A58508","first_name":"PATRICK","last_name":"CLARK","classification":"B","division":"LIMITED","hit_factor":7.4286},{"match_name":"MCPSL Pistol 3-10-18","match_date":"2018-03-10","stage_classifiercode":"99-11","member_number":"TY95238","first_name":"JUSTIN","last_name":"MCELROY","classification":"A","division":"LIMITED","hit_factor":7.4275},{"match_name":"EWPSA 2016-04","match_date":"2016-04-17","stage_classifiercode":"99-11","member_number":"TY82308","first_name":"CURT","last_name":"BERGER","classification":"B","division":"LIMITED","hit_factor":7.4242},{"match_name":"CCAS June 2016","match_date":"2016-06-25","stage_classifiercode":"99-11","member_number":"A80255","first_name":"JAMES","last_name":"TORREZ","classification":"B","division":"LIMITED","hit_factor":7.4236},{"match_name":"SLPSA August USPSA Match 2","match_date":"2020-08-15","stage_classifiercode":"99-11","member_number":"TY93975","first_name":"STEPAN","last_name":"GENERALOV","classification":"M","division":"LIMITED","hit_factor":7.4227},{"match_name":"WNPL USPSA - REDEMPTION - NOVEMBER 2016","match_date":"2016-11-06","stage_classifiercode":"99-11","member_number":"A83271","first_name":"JOSH","last_name":"PERRY","classification":"B","division":"LIMITED","hit_factor":7.418},{"match_name":"Maryland Practical Shooters Association July 2018","match_date":"2018-07-22","stage_classifiercode":"99-11","member_number":"A26088","first_name":"ERIK","last_name":"HESS","classification":"U","division":"LIMITED","hit_factor":7.4135},{"match_name":"OK15 USPSA at USSA May 6th 2018","match_date":"2018-05-06","stage_classifiercode":"99-11","member_number":"A108361","first_name":"ZACHARIAH","last_name":"POWELL","classification":"C","division":"LIMITED","hit_factor":7.4135},{"match_name":"Laser Ninja Dragon League USPSA July 2nd Special Classifier","match_date":"2017-07-02","stage_classifiercode":"99-11","member_number":"A99689","first_name":"LONNY","last_name":"GUPTON","classification":"B","division":"LIMITED","hit_factor":7.4128},{"match_name":"HPSP Heartland Practical Shooters June USPSA Shoot","match_date":"2018-06-24","stage_classifiercode":"99-11","member_number":"Pen","first_name":"TYLER","last_name":"NITZ","classification":"Unclassified","division":"LIMITED","hit_factor":7.4074},{"match_name":"Ontelaunee USPSA  July 2018","match_date":"2018-07-29","stage_classifiercode":"99-11","member_number":"TY105682","first_name":"STEPHEN","last_name":"ZINK","classification":"U","division":"LIMITED","hit_factor":7.4074},{"match_name":"Pinetucky USPSA 06-16-18","match_date":"2018-06-16","stage_classifiercode":"99-11","member_number":"A104005","first_name":"BILL","last_name":"BAKER","classification":"B","division":"LIMITED","hit_factor":7.4074},{"match_name":"Oakdale USPSA MN07 6-25-2020","match_date":"2020-06-25","stage_classifiercode":"99-11","member_number":"A57121","first_name":"JOE","last_name":"GRIFFIN","classification":"B","division":"LIMITED","hit_factor":7.4026},{"match_name":"Rio Salado UPPL September 2020","match_date":"2020-09-13","stage_classifiercode":"99-11","member_number":"TY22852","first_name":"DEBBIE","last_name":"KEEHART","classification":"B","division":"LIMITED","hit_factor":7.402},{"match_name":"Blackstone Shooting Sports May 2017 USPSA Pistol Level 1","match_date":"2017-05-09","stage_classifiercode":"99-11","member_number":"A96421","first_name":"BRANDON","last_name":"RATLIFF","classification":"B","division":"LIMITED","hit_factor":7.402},{"match_name":"Tangi May 2016 USPSA","match_date":"2016-05-29","stage_classifiercode":"99-11","member_number":"A74371","first_name":"MICHELE","last_name":"LEMOINE","classification":"\u0000","division":"LIMITED","hit_factor":7.398},{"match_name":"Competitive Shooters of Lake Norman CORNELIUS Thursday Evening Indoor USPSA Pistol Match North Carolina","match_date":"2021-09-16","stage_classifiercode":"99-11","member_number":"TY88089","first_name":"DAVID","last_name":"BURTON","classification":"B","division":"LIMITED","hit_factor":7.3973},{"match_name":"WNPL USPSA - REDEMPTION - NOVEMBER 2016","match_date":"2016-11-06","stage_classifiercode":"99-11","member_number":"A91971","first_name":"LARRY","last_name":"SKINNER","classification":"C","division":"LIMITED","hit_factor":7.3973},{"match_name":"2020-03 Bone Creek USPSA","match_date":"2020-03-01","stage_classifiercode":"99-11","member_number":"A101550","first_name":"ERIC","last_name":"SCHNITZER","classification":"C","division":"LIMITED","hit_factor":7.3969},{"match_name":"2017 Bay bridge Charity Classic - Richmond October 14-15-2017","match_date":"2017-10-14","stage_classifiercode":"99-11","member_number":"A101186","first_name":"ZACH","last_name":"BASICH","classification":"C","division":"LIMITED","hit_factor":7.3925},{"match_name":"Ontelaunee USPSA Hose Fest","match_date":"2021-01-02","stage_classifiercode":"99-11","member_number":"TY93194","first_name":"DAN","last_name":"LONDON","classification":"B","division":"LIMITED","hit_factor":7.3925},{"match_name":"EAPS July 2017 USPSA","match_date":"2017-07-16","stage_classifiercode":"99-11","member_number":"A58364","first_name":"LANCE","last_name":"JOSHLIN","classification":"C","division":"LIMITED","hit_factor":7.3913},{"match_name":"Shongum Pistol November 2015","match_date":"2015-11-07","stage_classifiercode":"99-11","member_number":"\"\"","first_name":"RUSS","last_name":"TEITSMA","classification":"U","division":"LIMITED","hit_factor":7.3871},{"match_name":"NVSA USPSA 1609","match_date":"2016-09-04","stage_classifiercode":"99-11","member_number":"A92291","first_name":"JOSEPH","last_name":"LAMBERT","classification":"C","division":"LIMITED","hit_factor":7.3836},{"match_name":"BRSP Tuesday Night USPSA Match - Oct 31","match_date":"2017-11-01","stage_classifiercode":"99-11","member_number":"TY97714","first_name":"JUSTIN","last_name":"LARKIN","classification":"\"\"","division":"LIMITED","hit_factor":7.377},{"match_name":"Omaha Gun Club USPSA February 28th 2018","match_date":"2018-03-01","stage_classifiercode":"99-11","member_number":"TY96710","first_name":"ZACHARY","last_name":"BRODER","classification":"C","division":"LIMITED","hit_factor":7.3759},{"match_name":"March 2018 USPSA Classifier Special","match_date":"2018-03-17","stage_classifiercode":"99-11","member_number":"F97214","first_name":"PAUL","last_name":"COCKBURN","classification":"\"\"","division":"LIMITED","hit_factor":7.3759},{"match_name":"Devil Dog USPSA Classifier Match-Saturday Session","match_date":"2018-03-10","stage_classifiercode":"99-11","member_number":"TY60329","first_name":"KELLY","last_name":"SNOW","classification":"A","division":"LIMITED","hit_factor":7.3759},{"match_name":"NW01 April da Turd","match_date":"2018-04-04","stage_classifiercode":"99-11","member_number":"A76039","first_name":"PAUL","last_name":"COTIE","classification":"M","division":"LIMITED","hit_factor":7.3746},{"match_name":"CVSC 07-29-2018","match_date":"2018-07-29","stage_classifiercode":"99-11","member_number":"A100612","first_name":"ZACK","last_name":"SMITH","classification":"U","division":"LIMITED","hit_factor":7.3718},{"match_name":"CVSC 07-29-2018","match_date":"2018-07-29","stage_classifiercode":"99-11","member_number":"\"\"","first_name":"PAUL","last_name":"CHETWOOD","classification":"U","division":"LIMITED","hit_factor":7.3699},{"match_name":"Target  Sports Central Indiana Championship","match_date":"2020-08-22","stage_classifiercode":"99-11","member_number":"A89246","first_name":"LARRY","last_name":"FRANCIS","classification":"B","division":"LIMITED","hit_factor":7.3698},{"match_name":"NTPS-SE November Classifier 2016","match_date":"2016-11-19","stage_classifiercode":"99-11","member_number":"A98458","first_name":"ERIK","last_name":"SCHALL","classification":"U","division":"LIMITED","hit_factor":7.367},{"match_name":"MPSA 07182020 USPSA","match_date":"2020-07-18","stage_classifiercode":"99-11","member_number":"A112380","first_name":"JASON","last_name":"BOLLING","classification":"C","division":"LIMITED","hit_factor":7.3658},{"match_name":"Prescott 1 st Saturday 12-03-2016","match_date":"2016-12-03","stage_classifiercode":"99-11","member_number":"\"\"","first_name":"CHRIS","last_name":"MYHRE","classification":"A","division":"LIMITED","hit_factor":7.3654},{"match_name":"APS August 1st Monthly USPSA Match  Classifier Match","match_date":"2021-08-01","stage_classifiercode":"99-11","member_number":"A125597","first_name":"JORGE","last_name":"DE LA TORRE","classification":"B","division":"LIMITED","hit_factor":7.3654},{"match_name":"NVSA USPSA 2106","match_date":"2021-06-20","stage_classifiercode":"99-11","member_number":"A16730","first_name":"RON","last_name":"SECHLER","classification":"B","division":"LIMITED","hit_factor":7.3654},{"match_name":"TBAS USPSA Match 2/23/20","match_date":"2020-02-23","stage_classifiercode":"99-11","member_number":"TY84886","first_name":"STEWART","last_name":"HENDERSON","classification":"B","division":"LIMITED","hit_factor":7.3654},{"match_name":"WSRC USPSA 11/19/2017","match_date":"2017-11-19","stage_classifiercode":"99-11","member_number":"A97899","first_name":"ANDREW","last_name":"BRUMMETT","classification":"B","division":"LIMITED","hit_factor":7.3643},{"match_name":"Rio Salado UPPL September 2020","match_date":"2020-09-13","stage_classifiercode":"99-11","member_number":"A89241","first_name":"KENDALL","last_name":"ERETH","classification":"B","division":"LIMITED","hit_factor":7.3628},{"match_name":"MSSA Uspsa Match 1/3/16","match_date":"2016-01-03","stage_classifiercode":"99-11","member_number":"A86747","first_name":"ANDREW","last_name":"GILLIAM","classification":"U","division":"LIMITED","hit_factor":7.36},{"match_name":"BHPSC Monthly Match - Jul 2020","match_date":"2020-07-31","stage_classifiercode":"99-11","member_number":"A121434","first_name":"GREGORY","last_name":"LANGNER","classification":"B","division":"LIMITED","hit_factor":7.3574},{"match_name":"2016-02-06 USPSA at Phoenix Rod and Gun Club","match_date":"2016-02-06","stage_classifiercode":"99-11","member_number":"FY72117","first_name":"MARK","last_name":"GARDNER","classification":"A","division":"LIMITED","hit_factor":7.3569},{"match_name":"MS06 Team Magnolia June 2017 USPSA Match","match_date":"2017-06-04","stage_classifiercode":"99-11","member_number":"TY3936","first_name":"TOMMY","last_name":"CABELL","classification":"A","division":"LIMITED","hit_factor":7.3552},{"match_name":"SUPS All Classifier Match March 1718 2018","match_date":"2018-03-17","stage_classifiercode":"99-11","member_number":"A73629","first_name":"CHAD","last_name":"LARSON","classification":"C","division":"LIMITED","hit_factor":7.3511},{"match_name":"Pitcairn-Monroeville Sportsmens Club USPSA August 2017","match_date":"2017-08-05","stage_classifiercode":"99-11","member_number":"a101973","first_name":"CLAY","last_name":"SHERLOCK","classification":"U","division":"LIMITED","hit_factor":7.3507},{"match_name":"Richmond Hot Shots January 17-2016 USPSA Pistol","match_date":"2016-01-17","stage_classifiercode":"99-11","member_number":"FY62950","first_name":"DARRELL","last_name":"INOUYE","classification":"A","division":"LIMITED","hit_factor":7.3487},{"match_name":"CSoS Feb2016 Match","match_date":"2016-02-21","stage_classifiercode":"99-11","member_number":"TY72553","first_name":"BRIAN","last_name":"DEMMA","classification":"B","division":"LIMITED","hit_factor":7.3463},{"match_name":"WSPS AUGUST 2016 USPSA","match_date":"2016-08-20","stage_classifiercode":"99-11","member_number":"A40021","first_name":"STEPHEN","last_name":"SHRADER","classification":"B","division":"LIMITED","hit_factor":7.3431},{"match_name":"Prescott 1st Saturday 8-05-17","match_date":"2017-08-05","stage_classifiercode":"99-11","member_number":"TY53718","first_name":"TOM","last_name":"SLOTA","classification":"B","division":"LIMITED","hit_factor":7.3431},{"match_name":"OREGON ARPC CC05 USPSA AUGUST 12 2017","match_date":"2017-08-12","stage_classifiercode":"99-11","member_number":"A73298","first_name":"DAVID","last_name":"LESLIE","classification":"B","division":"LIMITED","hit_factor":7.3407},{"match_name":"PRG - Oh Shoot USPSA February 21st - 3rd Sunday Match","match_date":"2021-02-21","stage_classifiercode":"99-11","member_number":"A116257","first_name":"KEVIN","last_name":"WONG","classification":"B","division":"LIMITED","hit_factor":7.337},{"match_name":"WI21 June 24 2018 Points Match","match_date":"2018-06-06","stage_classifiercode":"99-11","member_number":"TY64993","first_name":"STEVE","last_name":"WYNVEEN","classification":"M","division":"LIMITED","hit_factor":7.3359},{"match_name":"OFGC USPSA Match Feb 19th 2017","match_date":"2017-02-19","stage_classifiercode":"99-11","member_number":"TY72436","first_name":"ROBERT","last_name":"TERBIETEN","classification":"B","division":"LIMITED","hit_factor":7.3359},{"match_name":"RCPS USPSA March 10","match_date":"2018-03-10","stage_classifiercode":"99-11","member_number":"\"\"","first_name":"SHANE","last_name":"SUDDARTH","classification":"B","division":"LIMITED","hit_factor":7.3343},{"match_name":"WSRC USPSA 11/19/2017","match_date":"2017-11-19","stage_classifiercode":"99-11","member_number":"A103943","first_name":"GRAHAM","last_name":"ROPER","classification":"C","division":"LIMITED","hit_factor":7.3333},{"match_name":"PCSI USPSA March 6th 2021","match_date":"2020-11-28","stage_classifiercode":"99-11","member_number":"A118008","first_name":"RANDY","last_name":"DUVALL","classification":"B","division":"LIMITED","hit_factor":7.3306},{"match_name":"Competitive Shooters of Lake Norman CORNELIUS Thursday Evening Indoor USPSA Pistol Match North Carolina","match_date":"2018-12-06","stage_classifiercode":"99-11","member_number":"A90517","first_name":"CLAYTON","last_name":"ALT","classification":"B","division":"LIMITED","hit_factor":7.3298},{"match_name":"Grandbaggers August 2017","match_date":"2017-08-03","stage_classifiercode":"99-11","member_number":"A57103","first_name":"JT","last_name":"SLADE","classification":"U","division":"LIMITED","hit_factor":7.3282},{"match_name":"MVS USPSA 9-20-17","match_date":"2017-09-20","stage_classifiercode":"99-11","member_number":"A100631","first_name":"BRIAN","last_name":"HONG","classification":"C","division":"LIMITED","hit_factor":7.3282},{"match_name":"USPSA MO21 2Alpha SBRC March 2018","match_date":"2018-03-24","stage_classifiercode":"99-11","member_number":"\"\"","first_name":"KIRK","last_name":"BROYLES","classification":"U","division":"LIMITED","hit_factor":7.327},{"match_name":"Crooked Creek Pistol League - June 2016","match_date":"2016-06-25","stage_classifiercode":"99-11","member_number":"L2450","first_name":"BUD","last_name":"CONNOLLY","classification":"B","division":"LIMITED","hit_factor":7.327},{"match_name":"BGS Hudson Week 1","match_date":"2017-11-26","stage_classifiercode":"99-11","member_number":"PEN","first_name":"DILLON","last_name":"STAPLES","classification":"X","division":"LIMITED","hit_factor":7.3248},{"match_name":"LCSC Linden USPSA 092621","match_date":"2021-09-25","stage_classifiercode":"99-11","member_number":"FY63012","first_name":"MANUEL","last_name":"NEWMAN","classification":"M","division":"LIMITED","hit_factor":7.3239},{"match_name":"CVSC 10-28-2018 (6 Stage All Classifier Match)","match_date":"2018-10-28","stage_classifiercode":"99-11","member_number":"\"\"","first_name":"ERRAN","last_name":"MAYFIELD","classification":"U","division":"LIMITED","hit_factor":7.3232},{"match_name":"SCCCNOVEMBER2016","match_date":"2016-11-13","stage_classifiercode":"99-11","member_number":"L2615","first_name":"STEVE","last_name":"MARSDEN","classification":"G","division":"LIMITED","hit_factor":7.3218},{"match_name":"SCCCNOVEMBER2016","match_date":"2016-11-13","stage_classifiercode":"99-11","member_number":"A86735","first_name":"JOHN","last_name":"COURIS","classification":"U","division":"LIMITED","hit_factor":7.3206},{"match_name":"WVPPS November 2020","match_date":"2020-11-15","stage_classifiercode":"99-11","member_number":"TY92908","first_name":"DAVID","last_name":"BURNS","classification":"M","division":"LIMITED","hit_factor":7.3203},{"match_name":"BGSL Classifier Match ","match_date":"2018-10-06","stage_classifiercode":"99-11","member_number":"a105549","first_name":"DEXTER","last_name":"SPURLOCK","classification":"U","division":"LIMITED","hit_factor":7.3171},{"match_name":"Pitcairn-Monroeville Sportsmens Club USPSA August 2017","match_date":"2017-08-05","stage_classifiercode":"99-11","member_number":"TY42401","first_name":"KEVIN","last_name":"BLAKE","classification":"A","division":"LIMITED","hit_factor":7.3171},{"match_name":"Ontelaunee USPSA  July 2018","match_date":"2018-07-29","stage_classifiercode":"99-11","member_number":"TY104882","first_name":"CHRISTOPHER","last_name":"GELNETT","classification":"B","division":"LIMITED","hit_factor":7.3171},{"match_name":"OK15 USPSA at USSA","match_date":"2017-12-10","stage_classifiercode":"99-11","member_number":"TY-78427","first_name":"DILLEN","last_name":"EASLEY","classification":"B","division":"LIMITED","hit_factor":7.3171},{"match_name":"North Mountain PS April","match_date":"2016-04-15","stage_classifiercode":"99-11","member_number":"PEN","first_name":"JOSH","last_name":"WARD","classification":"U","division":"LIMITED","hit_factor":7.314},{"match_name":"ORPCI 2017 June USPSA Classifer Match","match_date":"2017-06-25","stage_classifiercode":"99-11","member_number":"PEN","first_name":"AARON","last_name":"WILLIS","classification":"\"\"","division":"LIMITED","hit_factor":7.3136},{"match_name":"SAPSA January 2020 Match","match_date":"2020-01-18","stage_classifiercode":"99-11","member_number":"A72887","first_name":"KEVIN","last_name":"MCDOWELL","classification":"B","division":"LIMITED","hit_factor":7.3107},{"match_name":"OK Corral Action Challenge October","match_date":"2015-10-24","stage_classifiercode":"99-11","member_number":"\"\"","first_name":"SCOTT","last_name":"JOHNSON","classification":"U","division":"LIMITED","hit_factor":7.3059},{"match_name":"LCSA USPSA July Classifier Match","match_date":"2016-07-30","stage_classifiercode":"99-11","member_number":"a95147","first_name":"JON","last_name":"MELTON","classification":"C","division":"LIMITED","hit_factor":7.3041},{"match_name":"Hopkinton USPSA October 2018","match_date":"2018-10-06","stage_classifiercode":"99-11","member_number":"TY76424","first_name":"HARRISON","last_name":"SCHMIDT","classification":"A","division":"LIMITED","hit_factor":7.3034},{"match_name":"MCRC USPSA August 2018","match_date":"2018-08-11","stage_classifiercode":"99-11","member_number":"A63611","first_name":"DIANA","last_name":"ADAMS","classification":"B","division":"LIMITED","hit_factor":7.3025},{"match_name":"NCPL 2017 March","match_date":"2017-03-26","stage_classifiercode":"99-11","member_number":"A15252","first_name":"BOB","last_name":"SAYLOR","classification":"A","division":"LIMITED","hit_factor":7.3012},{"match_name":"LPRGC-Lower Providence USPSA May-1 2017","match_date":"2017-05-05","stage_classifiercode":"99-11","member_number":"TY72492","first_name":"BRUCE","last_name":"CRAWFORD","classification":"U","division":"LIMITED","hit_factor":7.3012},{"match_name":"Palmetto Gun Club - April 2017 USPSA","match_date":"2017-04-08","stage_classifiercode":"99-11","member_number":"TY70556","first_name":"BRUCE","last_name":"BELVIN","classification":"B","division":"LIMITED","hit_factor":7.3005},{"match_name":"SWGC USPSA Pistol Match - November 2021","match_date":"2021-11-06","stage_classifiercode":"99-11","member_number":"A107611","first_name":"RICHARD","last_name":"BANKS","classification":"G","division":"LIMITED","hit_factor":7.2993},{"match_name":"NCPS USPSA Handgun Match June 24 2018","match_date":"2018-06-24","stage_classifiercode":"99-11","member_number":"A92291","first_name":"JOSEPH","last_name":"LAMBERT","classification":"B","division":"LIMITED","hit_factor":7.2993},{"match_name":"NTPS-SE November Classifier 2016","match_date":"2016-11-19","stage_classifiercode":"99-11","member_number":"A99650","first_name":"JORDAN","last_name":"RUSSELL","classification":"U","division":"LIMITED","hit_factor":7.2993},{"match_name":"Augusta USPSA 10-14-18","match_date":"2018-10-14","stage_classifiercode":"99-11","member_number":"TY83117","first_name":"BOB","last_name":"NAVRESTAD","classification":"B","division":"LIMITED","hit_factor":7.2973},{"match_name":"ECPS USPSA 19 May 18","match_date":"2018-05-19","stage_classifiercode":"99-11","member_number":"A110388","first_name":"ZACH","last_name":"PUTNAM","classification":"U","division":"LIMITED","hit_factor":7.2961},{"match_name":"AGC_20170903","match_date":"2017-09-03","stage_classifiercode":"99-11","member_number":"A96319","first_name":"CHRIS","last_name":"MEEKER","classification":"C","division":"LIMITED","hit_factor":7.2956},{"match_name":"Springfield Tactical Shooters 05/06/2021","match_date":"2021-05-06","stage_classifiercode":"99-11","member_number":"A62932","first_name":"RICHARD","last_name":"LANE","classification":"B","division":"LIMITED","hit_factor":7.2917},{"match_name":"STAGE ZERO SHOOTING SUPPLY USPSA","match_date":"2020-07-16","stage_classifiercode":"99-11","member_number":"A129265","first_name":"RICHARD","last_name":"TAYLOR","classification":"U","division":"LIMITED","hit_factor":7.2886},{"match_name":"WELD ECO09 20180916","match_date":"2018-09-16","stage_classifiercode":"99-11","member_number":"A90694","first_name":"JONAH","last_name":"PRES","classification":"C","division":"LIMITED","hit_factor":7.2886},{"match_name":"USPSA MO21 2Alpha SBRC June 2017","match_date":"2017-06-17","stage_classifiercode":"99-11","member_number":"A101632","first_name":"GREG","last_name":"YEN","classification":"C","division":"LIMITED","hit_factor":7.2848},{"match_name":"Prescott Action Shooters 1st Saturday USPSA 7-7-2018","match_date":"2018-07-07","stage_classifiercode":"99-11","member_number":"TY101251","first_name":"TOM","last_name":"SHARP","classification":"C","division":"LIMITED","hit_factor":7.2829},{"match_name":"USPSA-Classifier","match_date":"2017-03-26","stage_classifiercode":"99-11","member_number":"A97576","first_name":"RAMON","last_name":"RIVERA","classification":"B","division":"LIMITED","hit_factor":7.2829},{"match_name":"APSC 4th Annual Holiday Hosefest USPSA Match 12-02-17","match_date":"2017-12-02","stage_classifiercode":"99-11","member_number":"L3804","first_name":"DAVID","last_name":"BISHOP","classification":"M","division":"LIMITED","hit_factor":7.2816},{"match_name":"GRPC USPSA WE STOP FOR NO STORM","match_date":"2017-09-03","stage_classifiercode":"99-11","member_number":"A56629","first_name":"ROMAN","last_name":"GWISCZ","classification":"B","division":"LIMITED","hit_factor":7.2797},{"match_name":"MSSA Uspsa Club Match","match_date":"2017-08-27","stage_classifiercode":"99-11","member_number":"A50757","first_name":"JOHN","last_name":"NETTLES","classification":"B","division":"LIMITED","hit_factor":7.2797},{"match_name":"FBURG July 2018 Level I USPSA ","match_date":"2018-07-01","stage_classifiercode":"99-11","member_number":"A97243","first_name":"NATE","last_name":"LINDSLEY-2","classification":"U","division":"LIMITED","hit_factor":7.2785},{"match_name":"USPSA MO21 2Alpha SBRC June 2017","match_date":"2017-06-17","stage_classifiercode":"99-11","member_number":"\"\"","first_name":"CHRIS","last_name":"WHELAN","classification":"U","division":"LIMITED","hit_factor":7.278},{"match_name":"WI21 June 24 2018 Points Match","match_date":"2018-06-06","stage_classifiercode":"99-11","member_number":"A52479","first_name":"LORI","last_name":"CASPER","classification":"A","division":"LIMITED","hit_factor":7.2776},{"match_name":"Blackstone Shooting Sports Snow Days January 2017 USPSA Level  1","match_date":"2017-01-08","stage_classifiercode":"99-11","member_number":"A82837","first_name":"DANIEL","last_name":"BOYLSTON","classification":"B","division":"LIMITED","hit_factor":7.2753},{"match_name":"Blackstone Shooting Sports May 2017 USPSA Pistol Level 1","match_date":"2017-05-09","stage_classifiercode":"99-11","member_number":"A93538","first_name":"JOHN","last_name":"ROYER","classification":"C","division":"LIMITED","hit_factor":7.2751},{"match_name":"BRC_20180114","match_date":"2018-01-14","stage_classifiercode":"99-11","member_number":"TY88191","first_name":"DAVID","last_name":"BEEBE","classification":"U","division":"LIMITED","hit_factor":7.2727},{"match_name":"COPS Dec 2015 USPSA","match_date":"2015-12-06","stage_classifiercode":"99-11","member_number":"A19657","first_name":"BOB","last_name":"PERRY","classification":"B","division":"LIMITED","hit_factor":7.2727},{"match_name":"LGCSEMPS April 2018 Special Classifier","match_date":"2018-04-08","stage_classifiercode":"99-11","member_number":"A103121","first_name":"KYLE","last_name":"EVANS","classification":"U","division":"LIMITED","hit_factor":7.2727},{"match_name":"SSS USPSA February 2020","match_date":"2020-02-16","stage_classifiercode":"99-11","member_number":"A58000","first_name":"JAMES LIM","last_name":"SMITH","classification":"U (Unclassified)","division":"LIMITED","hit_factor":7.2727},{"match_name":"Augusta USPSA 10-14-18","match_date":"2018-10-14","stage_classifiercode":"99-11","member_number":"A84867","first_name":"SCOTT","last_name":"GROSS","classification":"B","division":"LIMITED","hit_factor":7.2682},{"match_name":"CVSC  09-25-16","match_date":"2016-09-25","stage_classifiercode":"99-11","member_number":"\"\"","first_name":"ERRAN","last_name":"MAYFIELD","classification":"M","division":"LIMITED","hit_factor":7.2678},{"match_name":"GRPC USPSA WE STOP FOR NO STORM","match_date":"2017-09-03","stage_classifiercode":"99-11","member_number":"TY101025","first_name":"VINH","last_name":"LAM","classification":"C","division":"LIMITED","hit_factor":7.2643},{"match_name":"ORPCI USPSA Saturday 2020.07.18","match_date":"2020-07-18","stage_classifiercode":"99-11","member_number":"TY123979","first_name":"DREW","last_name":"NEWBERRY","classification":"","division":"LIMITED","hit_factor":7.2626},{"match_name":"MSSA Uspsa Match 1/3/16","match_date":"2016-01-03","stage_classifiercode":"99-11","member_number":"A89614","first_name":"JERRY","last_name":"ROSE","classification":"U","division":"LIMITED","hit_factor":7.2626},{"match_name":"SAPSC Monthly USPSA Classifier Match 20160209","match_date":"2016-02-09","stage_classifiercode":"99-11","member_number":"A65182","first_name":"BUCK","last_name":"CAMPBELL","classification":"B","division":"LIMITED","hit_factor":7.2611},{"match_name":"WVRPC USPSA 1SEPT2018","match_date":"2018-09-01","stage_classifiercode":"99-11","member_number":"A56105","first_name":"KINSEY","last_name":"SKILLEN","classification":"A","division":"LIMITED","hit_factor":7.2607},{"match_name":"WPGC 10-1-18","match_date":"2018-10-01","stage_classifiercode":"99-11","member_number":"L3320","first_name":"CHARLIE","last_name":"PEREZ","classification":"G","division":"LIMITED","hit_factor":7.2595},{"match_name":"SFPS 8-5-18 USPSA Match","match_date":"2018-08-05","stage_classifiercode":"99-11","member_number":"A50695","first_name":"TIM","last_name":"THOMAS","classification":"B","division":"LIMITED","hit_factor":7.2569},{"match_name":"SCCCNOVEMBER2016","match_date":"2016-11-13","stage_classifiercode":"99-11","member_number":"a76174","first_name":"KEVIN","last_name":"MAYFIELD","classification":"U","division":"LIMITED","hit_factor":7.2569},{"match_name":"FBURG July 2018 Level I USPSA ","match_date":"2018-07-01","stage_classifiercode":"99-11","member_number":"A103368","first_name":"KEITH","last_name":"SHELTON","classification":"B","division":"LIMITED","hit_factor":7.2559},{"match_name":"RSPP 3rd Saturday November 2016","match_date":"2016-11-19","stage_classifiercode":"99-11","member_number":"FY46196","first_name":"DALE","last_name":"CALVERT","classification":"A","division":"LIMITED","hit_factor":7.2464},{"match_name":"Oakdale USPSA MN07 8-12-2021","match_date":"2021-08-12","stage_classifiercode":"99-11","member_number":"A96738","first_name":"KEVIN","last_name":"HARTMAN","classification":"B","division":"LIMITED","hit_factor":7.2464},{"match_name":"PPS CLASSIFIER MATCH 2020-01-28","match_date":"2020-01-29","stage_classifiercode":"99-11","member_number":"TY107190","first_name":"SCOTT","last_name":"BROWN","classification":"C","division":"LIMITED","hit_factor":7.2438},{"match_name":"WVPPS November 2020","match_date":"2020-11-15","stage_classifiercode":"99-11","member_number":"TY104591","first_name":"DAVID","last_name":"HEUSS","classification":"B","division":"LIMITED","hit_factor":7.2423},{"match_name":"RSCS USPSA  27 Mar 2016","match_date":"2016-03-27","stage_classifiercode":"99-11","member_number":"A-79569","first_name":"RUSS","last_name":"GOULD","classification":"M","division":"LIMITED","hit_factor":7.2414},{"match_name":"Armory Indoor League","match_date":"2016-09-23","stage_classifiercode":"99-11","member_number":"A89867","first_name":"ZANE","last_name":"HAVILAND","classification":"B","division":"LIMITED","hit_factor":7.2404},{"match_name":"Lefthanders Gun Club Practical Shooters October","match_date":"2017-09-30","stage_classifiercode":"99-11","member_number":"A96810","first_name":"JASON","last_name":"PALMER","classification":"B","division":"LIMITED","hit_factor":7.2398},{"match_name":"MAPSA June Special Classifier","match_date":"2018-06-09","stage_classifiercode":"99-11","member_number":"TY59462","first_name":"RICHARD","last_name":"KAVANAGH","classification":"B","division":"LIMITED","hit_factor":7.2378},{"match_name":"EIPS 12/6/2018","match_date":"2018-12-06","stage_classifiercode":"99-11","member_number":"A112163","first_name":"ROBB","last_name":"HOLTZ","classification":"D","division":"LIMITED","hit_factor":7.2359},{"match_name":"MCRC USPSA August 2018","match_date":"2018-08-11","stage_classifiercode":"99-11","member_number":"A100125","first_name":"JOHN","last_name":"EDENS","classification":"B","division":"LIMITED","hit_factor":7.2351},{"match_name":"RDS USPSA 8.13.16","match_date":"2016-08-13","stage_classifiercode":"99-11","member_number":"A85282","first_name":"RANDEE","last_name":"KAISER","classification":"B","division":"LIMITED","hit_factor":7.2351},{"match_name":"IN19 ACC USPSA September 23","match_date":"2018-09-23","stage_classifiercode":"99-11","member_number":"Ty86867","first_name":"ANDREW","last_name":"HEATH","classification":"G","division":"LIMITED","hit_factor":7.234},{"match_name":"RBGC 2017-06-24","match_date":"2017-06-24","stage_classifiercode":"99-11","member_number":"A88659","first_name":"MICHAEL","last_name":"LEE","classification":"B","division":"LIMITED","hit_factor":7.2289},{"match_name":"CSoS Feb2016 Match","match_date":"2016-02-21","stage_classifiercode":"99-11","member_number":"TY88089","first_name":"DAVID","last_name":"BURTON","classification":"C","division":"LIMITED","hit_factor":7.225},{"match_name":"BGSL Classifier Match ","match_date":"2018-10-06","stage_classifiercode":"99-11","member_number":"a112488","first_name":"MIKE","last_name":"DUPILKA","classification":"U","division":"LIMITED","hit_factor":7.2222},{"match_name":"LIPSA -  April 17th 2016 - USPSA Special Classifier Match","match_date":"2016-04-17","stage_classifiercode":"99-11","member_number":"A80356","first_name":"TOM","last_name":"DANZIG","classification":"U","division":"LIMITED","hit_factor":7.2197},{"match_name":"Custer USPSA Mar 7th 2021","match_date":"2021-03-07","stage_classifiercode":"99-11","member_number":"TY92223","first_name":"STUART","last_name":"WILSON","classification":"A","division":"LIMITED","hit_factor":7.2183},{"match_name":"Rankin Field June Sunday USPSA","match_date":"2020-06-21","stage_classifiercode":"99-11","member_number":"L4505","first_name":"GREG","last_name":"VAUGHN","classification":"A","division":"LIMITED","hit_factor":7.2183},{"match_name":"PSAC_20161022","match_date":"2016-10-22","stage_classifiercode":"99-11","member_number":"TY60555","first_name":"JESS SR","last_name":"JOHNSON","classification":"\"\"","division":"LIMITED","hit_factor":7.2165},{"match_name":"BSPSC 2017 April Special Classifier","match_date":"2017-04-09","stage_classifiercode":"99-11","member_number":"A87989","first_name":"BENJAMIN","last_name":"CHAMBERS","classification":"B","division":"LIMITED","hit_factor":7.2096},{"match_name":"SLPSA July USPSA match","match_date":"2018-07-21","stage_classifiercode":"99-11","member_number":"70778","first_name":"ANDY","last_name":"PETERSON","classification":"A","division":"LIMITED","hit_factor":7.2096},{"match_name":"CGGR July USPSA Match","match_date":"2018-07-21","stage_classifiercode":"99-11","member_number":"A107611","first_name":"RICHARD","last_name":"BANKS","classification":"A","division":"LIMITED","hit_factor":7.2072},{"match_name":"MPSA 07182020 USPSA","match_date":"2020-07-18","stage_classifiercode":"99-11","member_number":"TY110243","first_name":"SHAN","last_name":"SMITH","classification":"U","division":"LIMITED","hit_factor":7.2061},{"match_name":"FBURG July 2018 Level I USPSA ","match_date":"2018-07-01","stage_classifiercode":"99-11","member_number":"A35631","first_name":"JACK","last_name":"OLINICK","classification":"C","division":"LIMITED","hit_factor":7.2061},{"match_name":"Rankin Field June Sunday USPSA","match_date":"2020-06-21","stage_classifiercode":"99-11","member_number":"FY96702","first_name":"BRUCE","last_name":"LE","classification":"B","division":"LIMITED","hit_factor":7.2011},{"match_name":"Lefthanders Gun Club Practical Shooters October","match_date":"2017-09-30","stage_classifiercode":"99-11","member_number":"A102630","first_name":"NATE","last_name":"POULSON","classification":"C","division":"LIMITED","hit_factor":7.2},{"match_name":"Applied IN25 USPSA January 17th 2018","match_date":"2018-01-17","stage_classifiercode":"99-11","member_number":"A88967","first_name":"BRENT","last_name":"LYKINS","classification":"B","division":"LIMITED","hit_factor":7.199},{"match_name":"Dawg Valley USPSA Oct 13","match_date":"2018-10-13","stage_classifiercode":"99-11","member_number":"TY90792","first_name":"BRAD","last_name":"KRUMME","classification":"A","division":"LIMITED","hit_factor":7.1984},{"match_name":"CSA For PCGC","match_date":"2016-06-26","stage_classifiercode":"99-11","member_number":"TY85570","first_name":"DAVID","last_name":"MILLER","classification":"G","division":"LIMITED","hit_factor":7.197},{"match_name":"RBGC 2017-06-24","match_date":"2017-06-24","stage_classifiercode":"99-11","member_number":"A79470","first_name":"DAVID","last_name":"BUENGER","classification":"X","division":"LIMITED","hit_factor":7.1923},{"match_name":"LCHG May USPSA","match_date":"2017-05-21","stage_classifiercode":"99-11","member_number":"ty43042","first_name":"DAN","last_name":"HASH","classification":"A","division":"LIMITED","hit_factor":7.1923},{"match_name":"AGC_20151206","match_date":"2015-12-06","stage_classifiercode":"99-11","member_number":"A85442","first_name":"SPENCER","last_name":"STEIN","classification":"M","division":"LIMITED","hit_factor":7.1918},{"match_name":"MPSA 042118 USPSA","match_date":"2018-04-21","stage_classifiercode":"99-11","member_number":"FY90633","first_name":"BRANT","last_name":"PACE","classification":"B","division":"LIMITED","hit_factor":7.1918},{"match_name":"PPS CLASSIFIER MATCH 2020-01-28","match_date":"2020-01-29","stage_classifiercode":"99-11","member_number":"TY107190","first_name":"SCOTT","last_name":"BROWN","classification":"C","division":"LIMITED","hit_factor":7.1895},{"match_name":"MCAS March 2021 USPSA","match_date":"2021-03-28","stage_classifiercode":"99-11","member_number":"L3409","first_name":"BRUCE","last_name":"REID","classification":"B","division":"LIMITED","hit_factor":7.1887},{"match_name":"Hose Monster Action ","match_date":"2020-07-19","stage_classifiercode":"99-11","member_number":"Ty86621","first_name":"RICK","last_name":"SERVANDO","classification":"A","division":"LIMITED","hit_factor":7.1885},{"match_name":"Maryland Practical Shooters Association July 2018","match_date":"2018-07-22","stage_classifiercode":"99-11","member_number":"A104882","first_name":"CHRISTOPHER","last_name":"GELNETT","classification":"B","division":"LIMITED","hit_factor":7.1885},{"match_name":"TGC July 2016 USPSA Classifier Match","match_date":"2016-07-17","stage_classifiercode":"99-11","member_number":"TY-92077","first_name":"DONNIE","last_name":"STONE","classification":"C","division":"LIMITED","hit_factor":7.1864},{"match_name":"CGGR July USPSA Match","match_date":"2018-07-21","stage_classifiercode":"99-11","member_number":"A74003","first_name":"RODNEY","last_name":"HARRIS","classification":"A","division":"LIMITED","hit_factor":7.1823},{"match_name":"Pitcairn-Monroeville Sportsmens Club USPSA August 2017","match_date":"2017-08-05","stage_classifiercode":"99-11","member_number":"TY40651","first_name":"RON","last_name":"RODGERS","classification":"B","division":"LIMITED","hit_factor":7.1823},{"match_name":"Applied IN25 USPSA August 15th 2018","match_date":"2018-08-15","stage_classifiercode":"99-11","member_number":"TY102132","first_name":"DAN","last_name":"QUESENBERY","classification":"B","division":"LIMITED","hit_factor":7.1809},{"match_name":"CCPL 12102017","match_date":"2017-12-08","stage_classifiercode":"99-11","member_number":"A91855","first_name":"PEDRO","last_name":"BRAZ","classification":"B","division":"LIMITED","hit_factor":7.1795},{"match_name":"RDS Dec 2nd 2017 USPSA Classifier Match","match_date":"2017-12-02","stage_classifiercode":"99-11","member_number":"A66300","first_name":"HANEESH","last_name":"BAGGA","classification":"B","division":"LIMITED","hit_factor":7.1776},{"match_name":"Pinetucky USPSA 06-16-18","match_date":"2018-06-16","stage_classifiercode":"99-11","member_number":"TY67776","first_name":"NICK","last_name":"ORTALAZA","classification":"B","division":"LIMITED","hit_factor":7.1742},{"match_name":"INAS USPSA Nov 2017","match_date":"2017-11-12","stage_classifiercode":"99-11","member_number":"TY21925","first_name":"WILLIAM","last_name":"PARKS III","classification":"B","division":"LIMITED","hit_factor":7.1736},{"match_name":"PRG 2017 Classifier Match","match_date":"2017-02-19","stage_classifiercode":"99-11","member_number":"TY82298","first_name":"WALTER","last_name":"MICHALOWSKI","classification":"C","division":"LIMITED","hit_factor":7.1713},{"match_name":"PAS October USPSA","match_date":"2017-10-21","stage_classifiercode":"99-11","member_number":"A97799","first_name":"JASON","last_name":"STEWART","classification":"C","division":"LIMITED","hit_factor":7.1693},{"match_name":"CCPL 12102017","match_date":"2017-12-08","stage_classifiercode":"99-11","member_number":"A100211","first_name":"PAUL","last_name":"CHETWOOD","classification":"C","division":"LIMITED","hit_factor":7.1685},{"match_name":"WVPPS May 2021","match_date":"2021-05-16","stage_classifiercode":"99-11","member_number":"TY93493","first_name":"COLIN","last_name":"AUSTIN","classification":"B","division":"LIMITED","hit_factor":7.1656},{"match_name":"SUPS All Classifier Match March 1718 2018","match_date":"2018-03-17","stage_classifiercode":"99-11","member_number":"FY102971","first_name":"MICHEAL","last_name":"DERRICK","classification":"A","division":"LIMITED","hit_factor":7.1642},{"match_name":"MPSA 050617 Classifier Match","match_date":"2017-05-06","stage_classifiercode":"99-11","member_number":"A60634","first_name":"MIKE","last_name":"SLAY","classification":"C","division":"LIMITED","hit_factor":7.1633},{"match_name":"Pelham USPSA 2016-09-18","match_date":"2016-09-18","stage_classifiercode":"99-11","member_number":"A84948","first_name":"ANDREW","last_name":"HOLBROOK","classification":"U","division":"LIMITED","hit_factor":7.1611},{"match_name":"ORPCI USPSA Saturday 2020.07.18","match_date":"2020-07-18","stage_classifiercode":"99-11","member_number":"A89770","first_name":"TOM","last_name":"WELBORN","classification":"","division":"LIMITED","hit_factor":7.1531},{"match_name":"CCSC USPSA Match","match_date":"2021-09-11","stage_classifiercode":"99-11","member_number":"A127490","first_name":"JESSE","last_name":"MUTCHLER","classification":"C","division":"LIMITED","hit_factor":7.1529},{"match_name":"MVS USPSA 9-20-17","match_date":"2017-09-20","stage_classifiercode":"99-11","member_number":"\"\"","first_name":"VALERIY","last_name":"PLOTNIKOV","classification":"\"\"","division":"LIMITED","hit_factor":7.1527},{"match_name":"MCPSL Pistol 8-12-17","match_date":"2017-08-12","stage_classifiercode":"99-11","member_number":"TY65313","first_name":"DON","last_name":"SHIPMAN","classification":"B","division":"LIMITED","hit_factor":7.1525},{"match_name":"MS06 Team Magnolia June 2017 USPSA Match","match_date":"2017-06-04","stage_classifiercode":"99-11","member_number":"L4105","first_name":"GREG","last_name":"HAMMER","classification":"B","division":"LIMITED","hit_factor":7.1523},{"match_name":"Clinton County USPSA July 23 2016","match_date":"2016-07-23","stage_classifiercode":"99-11","member_number":"A89947","first_name":"MIKE","last_name":"ABSHIRE","classification":"U","division":"LIMITED","hit_factor":7.1515},{"match_name":"ORPCI USPSA Saturday 2020.07.18","match_date":"2020-07-18","stage_classifiercode":"99-11","member_number":"FY101688","first_name":"DONALD","last_name":"APPLEGARTH","classification":"B","division":"LIMITED","hit_factor":7.1429},{"match_name":"ORPCI 2017 June USPSA Classifer Match","match_date":"2017-06-25","stage_classifiercode":"99-11","member_number":"\"\"","first_name":"TYLER","last_name":"HUFF","classification":"U","division":"LIMITED","hit_factor":7.1429},{"match_name":"STAGE ZERO SHOOTING SUPPLY USPSA","match_date":"2020-07-16","stage_classifiercode":"99-11","member_number":"A112964","first_name":"MATTHEW","last_name":"BEAM","classification":"A","division":"LIMITED","hit_factor":7.1429},{"match_name":"CAPS USPSA June 2021","match_date":"2021-06-05","stage_classifiercode":"99-11","member_number":"A16729","first_name":"MIKE","last_name":"FARNIOK","classification":"A","division":"LIMITED","hit_factor":7.1429},{"match_name":"Maryland Practical Shooters Association July 2018","match_date":"2018-07-22","stage_classifiercode":"99-11","member_number":"A86535","first_name":"RICK","last_name":"PAUKSTITUS","classification":"C","division":"LIMITED","hit_factor":7.1429},{"match_name":"MISS USPSA Match 10-5-16","match_date":"2016-10-03","stage_classifiercode":"99-11","member_number":"A85284","first_name":"ROMAN","last_name":"HRUSKA","classification":"B","division":"LIMITED","hit_factor":7.1429},{"match_name":"USPSA Iron Springs Practical Shooters 7","match_date":"2016-09-24","stage_classifiercode":"99-11","member_number":"A83022","first_name":"WESTON","last_name":"TULLIS","classification":"U","division":"LIMITED","hit_factor":7.1429},{"match_name":"PSAC 20171028","match_date":"2017-10-28","stage_classifiercode":"99-11","member_number":"TY60555","first_name":"JESS SR","last_name":"JOHNSON","classification":"B","division":"LIMITED","hit_factor":7.1342},{"match_name":"CGGR July USPSA Match","match_date":"2018-07-21","stage_classifiercode":"99-11","member_number":"\"\"","first_name":"JASON","last_name":"BYERLY","classification":"\"\"","division":"LIMITED","hit_factor":7.1331},{"match_name":"Ontelaunee USPSA July 2016","match_date":"2016-07-23","stage_classifiercode":"99-11","member_number":"A96935","first_name":"JAMES","last_name":"MEOLA","classification":"U","division":"LIMITED","hit_factor":7.1329},{"match_name":"RPS November 2018 USPSA Match","match_date":"2018-11-10","stage_classifiercode":"99-11","member_number":"TY77480","first_name":"GORDON","last_name":"SNADEN","classification":"B","division":"LIMITED","hit_factor":7.1327},{"match_name":"SUPS USPSA 20-21 October 2018","match_date":"2018-10-20","stage_classifiercode":"99-11","member_number":"A16031","first_name":"DAVE","last_name":"WHEELER","classification":"C","division":"LIMITED","hit_factor":7.1327},{"match_name":"Hopkinton June  2016","match_date":"2016-06-04","stage_classifiercode":"99-11","member_number":"TY73127","first_name":"SEAN","last_name":"JANICKI","classification":"A","division":"LIMITED","hit_factor":7.1298},{"match_name":"GAS July 7th Special Classifier","match_date":"2018-07-07","stage_classifiercode":"99-11","member_number":"L3409","first_name":"BRUCE","last_name":"REID","classification":"B","division":"LIMITED","hit_factor":7.125},{"match_name":"West Coast IPSC","match_date":"2018-07-22","stage_classifiercode":"99-11","member_number":"A56897","first_name":"BRUCE","last_name":"FUNK","classification":"B","division":"LIMITED","hit_factor":7.125},{"match_name":"RSPP 3rd Saturday November 2016","match_date":"2016-11-19","stage_classifiercode":"99-11","member_number":"A79727","first_name":"MIKE","last_name":"LARKIN","classification":"B","division":"LIMITED","hit_factor":7.1247},{"match_name":"CAPS USPSA June 2021","match_date":"2021-06-05","stage_classifiercode":"99-11","member_number":"Ty92908","first_name":"DAVID","last_name":"BURNS","classification":"M","division":"LIMITED","hit_factor":7.1247},{"match_name":"WELD ECO09 20180916","match_date":"2018-09-16","stage_classifiercode":"99-11","member_number":"A68397","first_name":"MATT","last_name":"UNGER","classification":"B","division":"LIMITED","hit_factor":7.1247},{"match_name":"Blackstone Shooting Sports May 2017 USPSA Pistol Level 1","match_date":"2017-05-09","stage_classifiercode":"99-11","member_number":"A96652","first_name":"DOUG","last_name":"PRESSON","classification":"C","division":"LIMITED","hit_factor":7.124},{"match_name":"Nampa USPSA December 26th 2020","match_date":"2020-12-26","stage_classifiercode":"99-11","member_number":"A103248","first_name":"CALVIN","last_name":"JAMES","classification":"B","division":"LIMITED","hit_factor":7.1237},{"match_name":"Hose Monster Action ","match_date":"2020-07-19","stage_classifiercode":"99-11","member_number":"TY75970","first_name":"STEVE","last_name":"HUCKABONE","classification":"\"\"","division":"LIMITED","hit_factor":7.1233},{"match_name":"PTPC  February 7th USPSA Match","match_date":"2016-02-07","stage_classifiercode":"99-11","member_number":"TY68407","first_name":"PAUL","last_name":"IRLACHER","classification":"B","division":"LIMITED","hit_factor":7.1229},{"match_name":"Wvpps Nov. 2017","match_date":"2017-11-19","stage_classifiercode":"99-11","member_number":"A86403","first_name":"JUSTIN","last_name":"WILLIAMS","classification":"M","division":"LIMITED","hit_factor":7.1217},{"match_name":"SLPSA July USPSA match","match_date":"2018-07-21","stage_classifiercode":"99-11","member_number":"A49638","first_name":"DANIEL","last_name":"WARD","classification":"B","division":"LIMITED","hit_factor":7.1166},{"match_name":"Castlewood USPSA Sept 2020 shoot","match_date":"2020-09-26","stage_classifiercode":"99-11","member_number":"ty95936","first_name":"DAN","last_name":"HUBERT","classification":"C","division":"LIMITED","hit_factor":7.1151},{"match_name":"Pinetucky USPSA 06-16-18","match_date":"2018-06-16","stage_classifiercode":"99-11","member_number":"A107959","first_name":"TYLER","last_name":"MARZOFKA","classification":"C","division":"LIMITED","hit_factor":7.1146},{"match_name":"NW01 April da Turd","match_date":"2018-04-04","stage_classifiercode":"99-11","member_number":"A103022","first_name":"NICK","last_name":"PRATHER","classification":"B","division":"LIMITED","hit_factor":7.1124},{"match_name":"GAS July 7th Special Classifier","match_date":"2018-07-07","stage_classifiercode":"99-11","member_number":"TY73486","first_name":"AL","last_name":"ROY","classification":"B","division":"LIMITED","hit_factor":7.1111},{"match_name":"Shot Through The Heart Classifiers","match_date":"2018-02-04","stage_classifiercode":"99-11","member_number":"TY94878","first_name":"DAVID","last_name":"FERNANDEZ","classification":"C","division":"LIMITED","hit_factor":7.1111},{"match_name":"ISPS 6/19/2016 USPSA","match_date":"2016-06-19","stage_classifiercode":"99-11","member_number":"A84438","first_name":"TYSON","last_name":"DIXON","classification":"B","division":"LIMITED","hit_factor":7.1097},{"match_name":"FBURG July 2018 Level I USPSA ","match_date":"2018-07-01","stage_classifiercode":"99-11","member_number":"A102388","first_name":"BRENDAN","last_name":"WARSHAUER","classification":"C","division":"LIMITED","hit_factor":7.1097},{"match_name":"TAPS MARCH MATCH","match_date":"2017-03-11","stage_classifiercode":"99-11","member_number":"A93218","first_name":"AUSTIN","last_name":"HARRIS","classification":"B","division":"LIMITED","hit_factor":7.1097},{"match_name":"WSPS AUGUST 2016 USPSA","match_date":"2016-08-20","stage_classifiercode":"99-11","member_number":"FY88040","first_name":"STEPHEN","last_name":"HOSAGE","classification":"U","division":"LIMITED","hit_factor":7.1059},{"match_name":"Pinetucky USPSA 06-16-18","match_date":"2018-06-16","stage_classifiercode":"99-11","member_number":"TY64616","first_name":"JOSEPH","last_name":"BRADRICK","classification":"C","division":"LIMITED","hit_factor":7.1059},{"match_name":"MVPSA USPSA 9-15-18","match_date":"2018-09-15","stage_classifiercode":"99-11","member_number":"TY57751","first_name":"BOB","last_name":"HARRIS","classification":"A","division":"LIMITED","hit_factor":7.1048},{"match_name":"July 2016 H&H Match","match_date":"2016-07-24","stage_classifiercode":"99-11","member_number":"A93404","first_name":"DAKOTA","last_name":"POLK","classification":"C","division":"LIMITED","hit_factor":7.1046},{"match_name":"MCPSL Pistol 3-10-18","match_date":"2018-03-10","stage_classifiercode":"99-11","member_number":"A91071","first_name":"MICHAEL","last_name":"SIRNA","classification":"B","division":"LIMITED","hit_factor":7.1031},{"match_name":"RBPS April Pistol","match_date":"2016-04-17","stage_classifiercode":"99-11","member_number":"A81223","first_name":"TIM (REENTRY)","last_name":"FRIEDAY","classification":"U","division":"LIMITED","hit_factor":7.0991},{"match_name":"WSRC USPSA 11/19/2017","match_date":"2017-11-19","stage_classifiercode":"99-11","member_number":"A32149","first_name":"LASZLO","last_name":"SZABO","classification":"C","division":"LIMITED","hit_factor":7.0991},{"match_name":"PSAC 20171028","match_date":"2017-10-28","stage_classifiercode":"99-11","member_number":"A104073","first_name":"TONY","last_name":"CARR","classification":"C","division":"LIMITED","hit_factor":7.0976},{"match_name":"TriggerGuard Classifier","match_date":"2016-05-07","stage_classifiercode":"99-11","member_number":"L3354","first_name":"RYAN","last_name":"DOLL","classification":"C","division":"LIMITED","hit_factor":7.0959},{"match_name":"GPSL 10-4-2016","match_date":"2016-10-04","stage_classifiercode":"99-11","member_number":"A82809","first_name":"DAVID","last_name":"DARDEN","classification":"B","division":"LIMITED","hit_factor":7.0959},{"match_name":"MCAS March 2021 USPSA","match_date":"2021-03-28","stage_classifiercode":"99-11","member_number":"A53465","first_name":"SHANE","last_name":"SKILLEN","classification":"A","division":"LIMITED","hit_factor":7.095},{"match_name":"CCPL May  Day Match","match_date":"2021-05-23","stage_classifiercode":"99-11","member_number":"FY96702","first_name":"BRUCE","last_name":"LE","classification":"A","division":"LIMITED","hit_factor":7.0941},{"match_name":"Lefthanders Gun Club Practical Shooters October","match_date":"2017-09-30","stage_classifiercode":"99-11","member_number":"TY92908","first_name":"DAVID","last_name":"BURNS","classification":"A","division":"LIMITED","hit_factor":7.0934},{"match_name":"FBURG July 2018 Level I USPSA ","match_date":"2018-07-01","stage_classifiercode":"99-11","member_number":"TY41485","first_name":"DJ","last_name":"VIAR","classification":"C","division":"LIMITED","hit_factor":7.0912},{"match_name":"GAS Special Classifier","match_date":"2016-07-02","stage_classifiercode":"99-11","member_number":"A36278","first_name":"DENNIS","last_name":"GENTRY","classification":"A","division":"LIMITED","hit_factor":7.0909},{"match_name":"Brazosland Pistoleros August 20 2017","match_date":"2017-08-20","stage_classifiercode":"99-11","member_number":"A93426","first_name":"SHANE","last_name":"SIMPSON","classification":"A","division":"LIMITED","hit_factor":7.0896},{"match_name":"CVSC  09-25-16","match_date":"2016-09-25","stage_classifiercode":"99-11","member_number":"\"\"","first_name":"JASON","last_name":"PIERCE","classification":"U","division":"LIMITED","hit_factor":7.0876},{"match_name":"APS August 1st Monthly USPSA Match  Classifier Match","match_date":"2021-08-01","stage_classifiercode":"99-11","member_number":"A134656","first_name":"PATRICK","last_name":"BECKHAM","classification":"U","division":"LIMITED","hit_factor":7.0833},{"match_name":"RDS November 2020 USPSA","match_date":"2020-11-07","stage_classifiercode":"99-11","member_number":"A-51402","first_name":"WAYNE","last_name":"WELSHER","classification":"B","division":"LIMITED","hit_factor":7.0818},{"match_name":"PRG - Oh Shoot USPSA February 21st - 3rd Sunday Match","match_date":"2021-02-21","stage_classifiercode":"99-11","member_number":"TY131162","first_name":"PAUL","last_name":"WANG","classification":"C","division":"LIMITED","hit_factor":7.0818},{"match_name":"CSA Coalfield Shooters Association USPSA March 2020","match_date":"2020-03-08","stage_classifiercode":"99-11","member_number":"TY119141","first_name":"LEO","last_name":"ARAUJO","classification":"\"\"","division":"LIMITED","hit_factor":7.0818},{"match_name":"BRC_20180114","match_date":"2018-01-14","stage_classifiercode":"99-11","member_number":"A67134","first_name":"KIRK","last_name":"WILSON","classification":"A","division":"LIMITED","hit_factor":7.0812},{"match_name":"Hawkeye Gun Club July 2016 Match","match_date":"2016-07-16","stage_classifiercode":"99-11","member_number":"A78495","first_name":"BILL","last_name":"KEULER","classification":"B","division":"LIMITED","hit_factor":7.0796},{"match_name":"CGGR July USPSA Match","match_date":"2018-07-21","stage_classifiercode":"99-11","member_number":"A106793","first_name":"TIM","last_name":"WILSON","classification":"C","division":"LIMITED","hit_factor":7.0783},{"match_name":"Granby Action Shooters Oct 2016","match_date":"2016-10-02","stage_classifiercode":"99-11","member_number":"A60885","first_name":"LOU","last_name":"DENYS","classification":"\"\"","division":"LIMITED","hit_factor":7.0773},{"match_name":"LCSA  USPSA April 2017","match_date":"2017-04-08","stage_classifiercode":"99-11","member_number":"ty65386","first_name":"DAVID","last_name":"MULOCK","classification":"B","division":"LIMITED","hit_factor":7.0773},{"match_name":"Nampa USPSA December 4th 2021","match_date":"2021-12-04","stage_classifiercode":"99-11","member_number":"a78063","first_name":"MIKE","last_name":"PAPS","classification":"B","division":"LIMITED","hit_factor":7.0769},{"match_name":"Dundee USPSA Feb 2016","match_date":"2016-02-27","stage_classifiercode":"99-11","member_number":"FY44882","first_name":"MARK","last_name":"MCDONALD","classification":"B","division":"LIMITED","hit_factor":7.0735},{"match_name":"ETRPC-USPSA","match_date":"2021-03-27","stage_classifiercode":"99-11","member_number":"TY71605","first_name":"TOMMY","last_name":"THOMAS","classification":"B","division":"LIMITED","hit_factor":7.0732},{"match_name":"WI21 June 24 2018 Points Match","match_date":"2018-06-06","stage_classifiercode":"99-11","member_number":"A112300","first_name":"WILL","last_name":"WOOD","classification":"U","division":"LIMITED","hit_factor":7.0721},{"match_name":"SSS USPSA June 2020 FATHERS DAY Match","match_date":"2020-06-21","stage_classifiercode":"99-11","member_number":"A105219","first_name":"ROB","last_name":"RAVINA","classification":"A (A Class)","division":"LIMITED","hit_factor":7.0681},{"match_name":"Brothers N Arms December 2018 USPSA Match","match_date":"2018-12-15","stage_classifiercode":"99-11","member_number":"L4158","first_name":"CHRIS","last_name":"BROWN","classification":"B","division":"LIMITED","hit_factor":7.0667},{"match_name":"Hawkeye Gun Club July 2016 Match","match_date":"2016-07-16","stage_classifiercode":"99-11","member_number":"A88173","first_name":"STUART","last_name":"MARTIN","classification":"B","division":"LIMITED","hit_factor":7.0661},{"match_name":"OK15 USPSA at USSA May 6th 2018","match_date":"2018-05-06","stage_classifiercode":"99-11","member_number":"A88314","first_name":"TIM","last_name":"DOUGLAS","classification":"C","division":"LIMITED","hit_factor":7.0621},{"match_name":"LCSC Linden USPSA 092621","match_date":"2021-09-25","stage_classifiercode":"99-11","member_number":"A109030","first_name":"RUBEN","last_name":"GARCIA","classification":"U","division":"LIMITED","hit_factor":7.0605},{"match_name":"CGGR July USPSA Match","match_date":"2018-07-21","stage_classifiercode":"99-11","member_number":"A97905","first_name":"PAUL","last_name":"BAKER","classification":"C","division":"LIMITED","hit_factor":7.0588},{"match_name":"KSA USPSA March 2017","match_date":"2017-03-04","stage_classifiercode":"99-11","member_number":"A91874","first_name":"EVAN","last_name":"THURSBY","classification":"B","division":"LIMITED","hit_factor":7.0588},{"match_name":"MCAS March 2021 USPSA","match_date":"2021-03-28","stage_classifiercode":"99-11","member_number":"Ty35678","first_name":"RUSS","last_name":"MCELYEA","classification":"B","division":"LIMITED","hit_factor":7.0588},{"match_name":"Benton Gun Club-USPSA June 28  9AM","match_date":"2020-06-28","stage_classifiercode":"99-11","member_number":"A70740","first_name":"RYAN","last_name":"REED","classification":"A","division":"LIMITED","hit_factor":7.0588},{"match_name":"ARPC USPSA Match 8-23-20","match_date":"2020-08-23","stage_classifiercode":"99-11","member_number":"TY92354","first_name":"ROBERT","last_name":"PUCKETT","classification":"B","division":"LIMITED","hit_factor":7.0571},{"match_name":"HSC USPSA May 5th 2018","match_date":"2018-05-05","stage_classifiercode":"99-11","member_number":"A94921","first_name":"PAUL","last_name":"TAYLOR","classification":"B","division":"LIMITED","hit_factor":7.0529},{"match_name":"PSAC 20171028","match_date":"2017-10-28","stage_classifiercode":"99-11","member_number":"A81984","first_name":"TOM","last_name":"FINN","classification":"B","division":"LIMITED","hit_factor":7.0529},{"match_name":"CSA Coalfield Shooters Association USPSA SEPTEMBER 2020","match_date":"2020-09-12","stage_classifiercode":"99-11","member_number":"TY2931","first_name":"ROGER","last_name":"RAMEY2","classification":"B","division":"LIMITED","hit_factor":7.0522},{"match_name":"OFGC USPSA Match Feb 19th 2017","match_date":"2017-02-19","stage_classifiercode":"99-11","member_number":"A5104","first_name":"DOC","last_name":"WELSHER","classification":"B","division":"LIMITED","hit_factor":7.0496},{"match_name":"BUAS December Match","match_date":"2016-12-11","stage_classifiercode":"99-11","member_number":"A70318","first_name":"JOE","last_name":"DEMAGGIO","classification":"B","division":"LIMITED","hit_factor":7.0496},{"match_name":"Collin County USPSA 04-25-2021","match_date":"2021-04-24","stage_classifiercode":"99-11","member_number":"A78475","first_name":"JOHN","last_name":"SIMMONS","classification":"B","division":"LIMITED","hit_factor":7.0496},{"match_name":"Richmond Hot Shots April 14-15-2018 USPSA Pistol Match","match_date":"2018-04-14","stage_classifiercode":"99-11","member_number":"FY84916","first_name":"JOHN","last_name":"MITCHELL","classification":"C","division":"LIMITED","hit_factor":7.049},{"match_name":"Deadwood Boys USPSA All Classifier Match - 29 July 2018","match_date":"2018-07-29","stage_classifiercode":"99-11","member_number":"A106082","first_name":"ALEX","last_name":"CABRERA","classification":"\"\"","division":"LIMITED","hit_factor":7.0474},{"match_name":"OK15 USPSA at USSA","match_date":"2017-12-10","stage_classifiercode":"99-11","member_number":"TY99661","first_name":"LARAMIE","last_name":"FRANK","classification":"U","division":"LIMITED","hit_factor":7.0461},{"match_name":"MCAS March 2021 USPSA","match_date":"2021-03-28","stage_classifiercode":"99-11","member_number":"A102201","first_name":"WADE","last_name":"TINGEY","classification":"B","division":"LIMITED","hit_factor":7.0457},{"match_name":"LdF USPSA Match May 12 2018","match_date":"2018-05-12","stage_classifiercode":"99-11","member_number":"A109851","first_name":"TONY","last_name":"EBITNER","classification":"U","division":"LIMITED","hit_factor":7.0447},{"match_name":"APSA August 2018 USPSA Match","match_date":"2018-08-11","stage_classifiercode":"99-11","member_number":"A99379","first_name":"SAMUEL","last_name":"PARHAM","classification":"C","division":"LIMITED","hit_factor":7.0444},{"match_name":"APSC 4th Annual Holiday Hosefest USPSA Match 12-02-17","match_date":"2017-12-02","stage_classifiercode":"99-11","member_number":"A83285","first_name":"GARY","last_name":"AU","classification":"B","division":"LIMITED","hit_factor":7.0442},{"match_name":"Rio Salado RSPP 3rd Saturday February 2020","match_date":"2020-02-15","stage_classifiercode":"99-11","member_number":"A55572","first_name":"SHANE","last_name":"CELINO","classification":"A","division":"LIMITED","hit_factor":7.0442},{"match_name":"Competitive Shooters of Lake Norman Thursday evening indoor USPSA pistol match North Carolina","match_date":"2017-08-03","stage_classifiercode":"99-11","member_number":"TY88693","first_name":"CRAIG A","last_name":"POTEAT","classification":"B","division":"LIMITED","hit_factor":7.0442},{"match_name":"Laser Ninja Dragon League USPSA July 2nd Special Classifier","match_date":"2017-07-02","stage_classifiercode":"99-11","member_number":"A99942","first_name":"JOHN","last_name":"MORRISON","classification":"B","division":"LIMITED","hit_factor":7.044},{"match_name":"Pardoe Sportsmens Association-WPA14-2017-10-01","match_date":"2017-10-01","stage_classifiercode":"99-11","member_number":"\"\"","first_name":"MARK","last_name":"HERRING","classification":"\"\"","division":"LIMITED","hit_factor":7.0423},{"match_name":"North Mountain PS April","match_date":"2016-04-15","stage_classifiercode":"99-11","member_number":"TY41669","first_name":"LUCITO","last_name":"LARA","classification":"B","division":"LIMITED","hit_factor":7.0385},{"match_name":"HSC USPSA May 5th 2018","match_date":"2018-05-05","stage_classifiercode":"99-11","member_number":"PEN","first_name":"JASON","last_name":"CLARK","classification":"U","division":"LIMITED","hit_factor":7.0365},{"match_name":"Competitive Shooters of Lake Norman CORNELIUS Thursday Evening Indoor USPSA Pistol Match North Carolina","match_date":"2020-09-17","stage_classifiercode":"99-11","member_number":"L3906","first_name":"ARIC","last_name":"COWART","classification":"B","division":"LIMITED","hit_factor":7.0359},{"match_name":"BORCC USPSA May 2018","match_date":"2018-05-26","stage_classifiercode":"99-11","member_number":"A56265","first_name":"JOE","last_name":"ORNELAS","classification":"G","division":"LIMITED","hit_factor":7.0342},{"match_name":"Bgs Hudson Week 6","match_date":"2017-02-19","stage_classifiercode":"99-11","member_number":"a96378","first_name":"KEVIN","last_name":"HARTMAN","classification":"U","division":"LIMITED","hit_factor":7.0332},{"match_name":"Hose Monster Action ","match_date":"2020-07-19","stage_classifiercode":"99-11","member_number":"TY81157","first_name":"MARK","last_name":"VEJAR","classification":"B","division":"LIMITED","hit_factor":7.0323},{"match_name":"MPSA 021817","match_date":"2017-02-18","stage_classifiercode":"99-11","member_number":"A17730","first_name":"STANLEY","last_name":"WADE","classification":"B","division":"LIMITED","hit_factor":7.0323},{"match_name":"GTS WY02 USPSA Special Classifier","match_date":"2017-07-08","stage_classifiercode":"99-11","member_number":"A41410","first_name":"PAUL","last_name":"NASH","classification":"B","division":"LIMITED","hit_factor":7.0301},{"match_name":"June 2018 CAS USPSA","match_date":"2018-06-03","stage_classifiercode":"99-11","member_number":"A27201","first_name":"KEITH","last_name":"LEMOINE","classification":"B","division":"LIMITED","hit_factor":7.0292},{"match_name":"RPS November 2018 USPSA Match","match_date":"2018-11-10","stage_classifiercode":"99-11","member_number":"TY80548","first_name":"DAN","last_name":"DOIRON","classification":"B","division":"LIMITED","hit_factor":7.027},{"match_name":"CSA Coalfield Shooters Association USPSA SEPTEMBER 2020","match_date":"2020-09-12","stage_classifiercode":"99-11","member_number":"A87413","first_name":"JEFF","last_name":"ADKINS2","classification":"B","division":"LIMITED","hit_factor":7.0234},{"match_name":"AGC_20170903","match_date":"2017-09-03","stage_classifiercode":"99-11","member_number":"TY87911","first_name":"KEITH","last_name":"MARKEY","classification":"B","division":"LIMITED","hit_factor":7.0225},{"match_name":"USPSA MO21 2Alpha SBRC October 2017","match_date":"2017-10-21","stage_classifiercode":"99-11","member_number":"A41069","first_name":"JOHN","last_name":"LUNTSFORD","classification":"B","division":"LIMITED","hit_factor":7.0225},{"match_name":"TriggerGuard USPSA","match_date":"2016-10-01","stage_classifiercode":"99-11","member_number":"L3354","first_name":"RYAN","last_name":"DOLL","classification":"C","division":"LIMITED","hit_factor":7.0221},{"match_name":"USPSA MO21 2Alpha SBRC March 2018","match_date":"2018-03-24","stage_classifiercode":"99-11","member_number":"A53234","first_name":"CODY","last_name":"MARBUT","classification":"B","division":"LIMITED","hit_factor":7.0175},{"match_name":"Crooked Creek Pistol League - June 2016","match_date":"2016-06-25","stage_classifiercode":"99-11","member_number":"TY35253","first_name":"THOMAS","last_name":"SCHUSTER","classification":"B","division":"LIMITED","hit_factor":7.0175},{"match_name":"Lafayette Practical Shooters - THURS - Jun 25 - Big Squads","match_date":"2020-06-25","stage_classifiercode":"99-11","member_number":"TY99446","first_name":"SKIP","last_name":"RICHARDSON","classification":"B","division":"LIMITED","hit_factor":7.0175},{"match_name":"HTF Practical Shooters","match_date":"2017-11-30","stage_classifiercode":"99-11","member_number":"\"\"","first_name":"KELLY","last_name":"O'REAR","classification":"U","division":"LIMITED","hit_factor":7.0175},{"match_name":"Blackstone Shooting Sports Snow Days January 2017 USPSA Level  1","match_date":"2017-01-08","stage_classifiercode":"99-11","member_number":"L1613","first_name":"MIKE","last_name":"LOY","classification":"C","division":"LIMITED","hit_factor":7.0175},{"match_name":"ENPS December 2020 USPSA Match","match_date":"2020-12-06","stage_classifiercode":"99-11","member_number":"A89115","first_name":"ERIC","last_name":"WHITE","classification":"C","division":"LIMITED","hit_factor":7.0153},{"match_name":"Maine Practical Shooters February 2020","match_date":"2020-02-22","stage_classifiercode":"99-11","member_number":"TY85228","first_name":"BILL","last_name":"LAFRENIERE","classification":"B","division":"LIMITED","hit_factor":7.0153},{"match_name":"MSSA USPSA June  10 2017","match_date":"2017-06-10","stage_classifiercode":"99-11","member_number":"A89613","first_name":"JERRY","last_name":"ROSE","classification":"B","division":"LIMITED","hit_factor":7.0151},{"match_name":"MISS USPSA Oct 6th 2021","match_date":"2021-10-06","stage_classifiercode":"99-11","member_number":"TY69648","first_name":"STEVE","last_name":"GALKA","classification":"M","division":"LIMITED","hit_factor":7.014},{"match_name":"LCSA  USPSA April 2017","match_date":"2017-04-08","stage_classifiercode":"99-11","member_number":"l3048","first_name":"DOUG","last_name":"BRYANT","classification":"A","division":"LIMITED","hit_factor":7.0126},{"match_name":"Georgia Run N Gun 1-28-2016","match_date":"2016-01-29","stage_classifiercode":"99-11","member_number":"\"\"","first_name":"DAVID","last_name":"MARTINO","classification":"U","division":"LIMITED","hit_factor":7.0117},{"match_name":"Deadwood Boys USPSA All Classifier Match","match_date":"2016-08-07","stage_classifiercode":"99-11","member_number":"A97924","first_name":"ERIC","last_name":"YOUNG","classification":"U","division":"LIMITED","hit_factor":7.0111},{"match_name":"OK15 USPSA at USSA","match_date":"2017-12-10","stage_classifiercode":"99-11","member_number":"A107030","first_name":"MITCHELL","last_name":"GRAF","classification":"U","division":"LIMITED","hit_factor":7.0088},{"match_name":"FSTC Classifier - December 2016","match_date":"2016-12-18","stage_classifiercode":"99-11","member_number":"A75859","first_name":"BECKY","last_name":"YACKLEY","classification":"C","division":"LIMITED","hit_factor":7.0073},{"match_name":"Quinton USPSA - August 11 2018","match_date":"2018-08-11","stage_classifiercode":"99-11","member_number":"A106520","first_name":"BEN","last_name":"PLAPPERT","classification":"C","division":"LIMITED","hit_factor":7.0064},{"match_name":"CCPL 12102017","match_date":"2017-12-08","stage_classifiercode":"99-11","member_number":"\"\"","first_name":"LARRY","last_name":"CASADO","classification":"U","division":"LIMITED","hit_factor":7.0064},{"match_name":"RPS December 2017 USPSA Match","match_date":"2017-12-09","stage_classifiercode":"99-11","member_number":"TY82683","first_name":"BRIAN","last_name":"WOLFF","classification":"B","division":"LIMITED","hit_factor":7.0064},{"match_name":"Bayou City USPSA Weekly June 4","match_date":"2020-06-04","stage_classifiercode":"99-11","member_number":"A92868","first_name":"TODD","last_name":"RITZ","classification":"B","division":"LIMITED","hit_factor":7.0039},{"match_name":"WSRC USPSA","match_date":"2016-10-22","stage_classifiercode":"99-11","member_number":"A89183","first_name":"STEVE","last_name":"CASH","classification":"C","division":"LIMITED","hit_factor":7.0025},{"match_name":"APSC 4th Annual Holiday Hosefest USPSA Match 12-02-17","match_date":"2017-12-02","stage_classifiercode":"99-11","member_number":"\"\"","first_name":"RYAN","last_name":"YOUNGBLOOD","classification":"C","division":"LIMITED","hit_factor":7},{"match_name":"TCGC Polo July 2017","match_date":"2017-07-23","stage_classifiercode":"99-11","member_number":"TY85154","first_name":"JAMES","last_name":"JENSEN","classification":"C","division":"LIMITED","hit_factor":6.9959},{"match_name":"2016-02-06 USPSA at Phoenix Rod and Gun Club","match_date":"2016-02-06","stage_classifiercode":"99-11","member_number":"a86705","first_name":"ROB","last_name":"GAGE","classification":"C","division":"LIMITED","hit_factor":6.9948},{"match_name":"Richmond Hot Shots April 30-May 1st USPSA Pistol Match","match_date":"2016-04-30","stage_classifiercode":"99-11","member_number":"A46690","first_name":"GILBERT","last_name":"GESMUNDO","classification":"A","division":"LIMITED","hit_factor":6.994},{"match_name":"LCSA  USPSA April 2017","match_date":"2017-04-08","stage_classifiercode":"99-11","member_number":"ty77956","first_name":"TIMOTHY","last_name":"HADLEY","classification":"A","division":"LIMITED","hit_factor":6.993},{"match_name":"CVSC 07-29-2018","match_date":"2018-07-29","stage_classifiercode":"99-11","member_number":"TY99954","first_name":"JOHN","last_name":"HELM","classification":"C","division":"LIMITED","hit_factor":6.9913},{"match_name":"AGC_20151206","match_date":"2015-12-06","stage_classifiercode":"99-11","member_number":"A81984","first_name":"TOM","last_name":"FINN","classification":"B","division":"LIMITED","hit_factor":6.9905},{"match_name":"SSS USPSA February 2020","match_date":"2020-02-16","stage_classifiercode":"99-11","member_number":"A93775","first_name":"JOHN","last_name":"WESTBROOK JR","classification":"C (C Class)","division":"LIMITED","hit_factor":6.9905},{"match_name":"2017 Bay bridge Charity Classic - Richmond October 14-15-2017","match_date":"2017-10-14","stage_classifiercode":"99-11","member_number":"TY73546","first_name":"WILLIAM","last_name":"MCCABE","classification":"B","division":"LIMITED","hit_factor":6.9892},{"match_name":"FAS Sunday Indoors USPSA Match","match_date":"2021-02-07","stage_classifiercode":"99-11","member_number":"A115535","first_name":"RAMSEY","last_name":"GREENE","classification":"C","division":"LIMITED","hit_factor":6.9892},{"match_name":"Blackstone Shooting Sports November 2016 USPSA Level 1","match_date":"2016-11-08","stage_classifiercode":"99-11","member_number":"A91007","first_name":"GIL","last_name":"NARVAEZ","classification":"C","division":"LIMITED","hit_factor":6.9886},{"match_name":"NCPS USPSA Handgun Match June 24 2018","match_date":"2018-06-24","stage_classifiercode":"99-11","member_number":"L3531","first_name":"DANNY","last_name":"MINTER","classification":"B","division":"LIMITED","hit_factor":6.9886},{"match_name":"Bossier Parish Practical Shooters August 16 2020","match_date":"2020-08-16","stage_classifiercode":"99-11","member_number":"A105405","first_name":"JOHN","last_name":"DIPASQUALE","classification":"C","division":"LIMITED","hit_factor":6.9858},{"match_name":"CAPS USPSA June 2021","match_date":"2021-06-05","stage_classifiercode":"99-11","member_number":"a96810","first_name":"JASON","last_name":"PALMER","classification":"B","division":"LIMITED","hit_factor":6.9858},{"match_name":"Competitive Shooters of Lake Norman CORNELIUS Thursday Evening Indoor USPSA Pistol Match North Carolina","match_date":"2018-12-06","stage_classifiercode":"99-11","member_number":"A101892","first_name":"BARRY","last_name":"STEVENS","classification":"C","division":"LIMITED","hit_factor":6.9858},{"match_name":"EWPSA 2018-10","match_date":"2018-10-20","stage_classifiercode":"99-11","member_number":"B6","first_name":"M DWIGHT","last_name":"HUGHES","classification":"A","division":"LIMITED","hit_factor":6.9837},{"match_name":"CCPL 12102017","match_date":"2017-12-08","stage_classifiercode":"99-11","member_number":"\"\"","first_name":"ALLAN","last_name":"ABREA","classification":"U","division":"LIMITED","hit_factor":6.9832},{"match_name":"Ontelaunee USPSA  July 2018","match_date":"2018-07-29","stage_classifiercode":"99-11","member_number":"TY84200","first_name":"PAUL","last_name":"MARTELLO","classification":"B","division":"LIMITED","hit_factor":6.9829},{"match_name":"Springfield Tactical Shooters 04/05/2018","match_date":"2018-04-05","stage_classifiercode":"99-11","member_number":"A99127","first_name":"STEVE","last_name":"FRAZIER","classification":"C","division":"LIMITED","hit_factor":6.9825},{"match_name":"2016-05-07 USPSA at Phoenix Rod and Gun Club","match_date":"2016-05-07","stage_classifiercode":"99-11","member_number":"A91723","first_name":"CURTIS","last_name":"DOUGLAS","classification":"B","division":"LIMITED","hit_factor":6.9808},{"match_name":"Applied IN25 USPSA January 17th 2018","match_date":"2018-01-17","stage_classifiercode":"99-11","member_number":"A-31839","first_name":"ROBERT","last_name":"PATTON","classification":"C","division":"LIMITED","hit_factor":6.9799},{"match_name":"Brothers N Arms December 2018 USPSA Match","match_date":"2018-12-15","stage_classifiercode":"99-11","member_number":"FY87811","first_name":"CLAYTON","last_name":"PATTERSON","classification":"B","division":"LIMITED","hit_factor":6.9799},{"match_name":"AGC_20170903","match_date":"2017-09-03","stage_classifiercode":"99-11","member_number":"A91619","first_name":"SONNY","last_name":"CHAN","classification":"B","division":"LIMITED","hit_factor":6.9795},{"match_name":"Blackstone Shooting Sports November 2016 USPSA Level 1","match_date":"2016-11-08","stage_classifiercode":"99-11","member_number":"A96421","first_name":"BRANDON","last_name":"RATLIFF","classification":"C","division":"LIMITED","hit_factor":6.9767},{"match_name":"RBPS April Pistol","match_date":"2016-04-17","stage_classifiercode":"99-11","member_number":"A75685","first_name":"JEFFREY  (REENTRY)","last_name":"WIEDRICK","classification":"U","division":"LIMITED","hit_factor":6.9767},{"match_name":"Custer Feb USPSA","match_date":"2018-02-04","stage_classifiercode":"99-11","member_number":"TY97470","first_name":"DENNIS","last_name":"MAHLE","classification":"B","division":"LIMITED","hit_factor":6.9767},{"match_name":"SFPS 8-5-18 USPSA Match","match_date":"2018-08-05","stage_classifiercode":"99-11","member_number":"A96689","first_name":"ANDREW","last_name":"ERICKSON","classification":"C","division":"LIMITED","hit_factor":6.9767},{"match_name":"Brothers N Arms September 2017 USPSA Match","match_date":"2017-09-16","stage_classifiercode":"99-11","member_number":"TY72594","first_name":"THOMAS","last_name":"LOVELL JR.","classification":"B","division":"LIMITED","hit_factor":6.9767},{"match_name":"COPS Dec 2015 USPSA","match_date":"2015-12-06","stage_classifiercode":"99-11","member_number":"TY78370","first_name":"JAMIE","last_name":"CHOATE","classification":"U","division":"LIMITED","hit_factor":6.9737},{"match_name":"Klamath USPSA 06/05/16 JSPS OR09","match_date":"2016-06-05","stage_classifiercode":"99-11","member_number":"A29540","first_name":"STEVE P","last_name":"HALL","classification":"M","division":"LIMITED","hit_factor":6.9737},{"match_name":"OK15 USPSA at USSA","match_date":"2017-12-10","stage_classifiercode":"99-11","member_number":"TY77717","first_name":"ROBERT","last_name":"HAAS","classification":"B","division":"LIMITED","hit_factor":6.9735},{"match_name":"Maine Practical Shooters February 2016","match_date":"2016-02-27","stage_classifiercode":"99-11","member_number":"TY50805","first_name":"DAN","last_name":"WORCESTER","classification":"B","division":"LIMITED","hit_factor":6.9705},{"match_name":"SB Action Pistol Match Classifier","match_date":"2017-12-14","stage_classifiercode":"99-11","member_number":"TY90341","first_name":"DAVID","last_name":"LOVER","classification":"\"\"","division":"LIMITED","hit_factor":6.9672},{"match_name":"CVSC 07-29-2018","match_date":"2018-07-29","stage_classifiercode":"99-11","member_number":"L4505","first_name":"GREG","last_name":"VAUGHN","classification":"A","division":"LIMITED","hit_factor":6.9632},{"match_name":"Dundee Practical Shooters - Single Stack Challenge - Jan 23 2021","match_date":"2021-01-23","stage_classifiercode":"99-11","member_number":"TY98312","first_name":"STEVEN","last_name":"WRIGHT","classification":"C","division":"LIMITED","hit_factor":6.9597},{"match_name":"USPSA MO21 2Alpha SBRC March 2018","match_date":"2018-03-24","stage_classifiercode":"99-11","member_number":"L2880","first_name":"ANDREW","last_name":"BARKSDALE","classification":"C","division":"LIMITED","hit_factor":6.9588},{"match_name":"Prescott Action Shooters 1st Saturday USPSA 7-7-2018","match_date":"2018-07-07","stage_classifiercode":"99-11","member_number":"A56116","first_name":"DAVID","last_name":"MONROE","classification":"B","division":"LIMITED","hit_factor":6.9588},{"match_name":"GAS Special Classifier","match_date":"2016-07-02","stage_classifiercode":"99-11","member_number":"A94775","first_name":"WES","last_name":"SARTAIN","classification":"U","division":"LIMITED","hit_factor":6.9577},{"match_name":"Target  Sports Central Indiana Championship","match_date":"2020-08-22","stage_classifiercode":"99-11","member_number":"FY81341","first_name":"JOEY","last_name":"ZADIK","classification":"M","division":"LIMITED","hit_factor":6.9565},{"match_name":"CGGR July USPSA Match","match_date":"2018-07-21","stage_classifiercode":"99-11","member_number":"L3618","first_name":"RANDY","last_name":"CARTER","classification":"C","division":"LIMITED","hit_factor":6.9532},{"match_name":"BORCC USPSA August 2017","match_date":"2017-08-27","stage_classifiercode":"99-11","member_number":"A96871","first_name":"CORY","last_name":"WISELEY","classification":"C","division":"LIMITED","hit_factor":6.9463},{"match_name":"WSRC USPSA 11/19/2017","match_date":"2017-11-19","stage_classifiercode":"99-11","member_number":"TY89183","first_name":"STEVE","last_name":"CASH","classification":"B","division":"LIMITED","hit_factor":6.9444},{"match_name":"Pitcairn-Monroeville Sportsmens Club USPSA August 2017","match_date":"2017-08-05","stage_classifiercode":"99-11","member_number":"TY76571","first_name":"BOB","last_name":"SEREMBO","classification":"B","division":"LIMITED","hit_factor":6.9426},{"match_name":"MAPSA June Special Classifier","match_date":"2018-06-09","stage_classifiercode":"99-11","member_number":"a90911","first_name":"LINCOLN","last_name":"JENSEN","classification":"U","division":"LIMITED","hit_factor":6.9409},{"match_name":"Hawkeye Gun Club July 2016 Match","match_date":"2016-07-16","stage_classifiercode":"99-11","member_number":"TY48495","first_name":"GEORGE","last_name":"BLAZIER","classification":"A","division":"LIMITED","hit_factor":6.9388},{"match_name":"UVPS Practice 6-19-21","match_date":"2021-06-19","stage_classifiercode":"99-11","member_number":"A54034","first_name":"NEIL","last_name":"VAUGHAN","classification":"U","division":"LIMITED","hit_factor":6.9382},{"match_name":"AGC_20151206","match_date":"2015-12-06","stage_classifiercode":"99-11","member_number":"TY79422","first_name":"BRANDON","last_name":"WISNER","classification":"B","division":"LIMITED","hit_factor":6.9372},{"match_name":"EAPS July 2017 USPSA","match_date":"2017-07-16","stage_classifiercode":"99-11","member_number":"TY23142","first_name":"ROBERT","last_name":"RIVET","classification":"B","division":"LIMITED","hit_factor":6.9364},{"match_name":"Griffin USPSA Match Dec 2017","match_date":"2017-12-16","stage_classifiercode":"99-11","member_number":"A100051","first_name":"BRIAN","last_name":"SHARP","classification":"C","division":"LIMITED","hit_factor":6.9357},{"match_name":"FBURG July 2018 Level I USPSA ","match_date":"2018-07-01","stage_classifiercode":"99-11","member_number":"FY88516","first_name":"SEAN","last_name":"KELLNER","classification":"A","division":"LIMITED","hit_factor":6.9355},{"match_name":"HSC USPSA May 5th 2018","match_date":"2018-05-05","stage_classifiercode":"99-11","member_number":"Ty84298","first_name":"JUSTIN","last_name":"MILLER","classification":"C","division":"LIMITED","hit_factor":6.9348},{"match_name":"LPRGC-Lower Providence USPSA May-1 2017","match_date":"2017-05-05","stage_classifiercode":"99-11","member_number":"TY68809","first_name":"JAMES","last_name":"GRAZIANO SR","classification":"B","division":"LIMITED","hit_factor":6.933},{"match_name":"PTPC  February 7th USPSA Match","match_date":"2016-02-07","stage_classifiercode":"99-11","member_number":"TY1274","first_name":"RON","last_name":"VANDERGRIFT","classification":"B","division":"LIMITED","hit_factor":6.9322},{"match_name":"MVS ANPRACS USPSA 2-21-16","match_date":"2016-02-21","stage_classifiercode":"99-11","member_number":"A73074","first_name":"STEVE","last_name":"COULTER","classification":"B","division":"LIMITED","hit_factor":6.9295},{"match_name":"Pitcairn-Monroeville Sportsmens Club USPSA August 2017","match_date":"2017-08-05","stage_classifiercode":"99-11","member_number":"a101973","first_name":"CLAY","last_name":"SHERLOCK","classification":"U","division":"LIMITED","hit_factor":6.9277},{"match_name":"LdF USPSA Match January 25 2020","match_date":"2020-01-25","stage_classifiercode":"99-11","member_number":"TY54449","first_name":"TOM","last_name":"GRAY","classification":"C","division":"LIMITED","hit_factor":6.9252},{"match_name":"Clone Tue","match_date":"2017-03-29","stage_classifiercode":"99-11","member_number":"a90542","first_name":"MICHAEL","last_name":"CATEORA","classification":"\"\"","division":"LIMITED","hit_factor":6.9252},{"match_name":"BSPSC 2017 April Special Classifier","match_date":"2017-04-09","stage_classifiercode":"99-11","member_number":"A96355","first_name":"BRENNAN","last_name":"RICHARDSON","classification":"C","division":"LIMITED","hit_factor":6.9252},{"match_name":"IN19 ACC USPSA September 23","match_date":"2018-09-23","stage_classifiercode":"99-11","member_number":"TY80201","first_name":"THOMAS","last_name":"RAPALA","classification":"B","division":"LIMITED","hit_factor":6.9252},{"match_name":"Brazosland Pistoleros January 17 2016--USPSA","match_date":"2016-01-17","stage_classifiercode":"99-11","member_number":"A87214","first_name":"CORY","last_name":"KLEMASHEVICH","classification":"B","division":"LIMITED","hit_factor":6.9241},{"match_name":"CASA USPSA December 3  2017","match_date":"2017-12-03","stage_classifiercode":"99-11","member_number":"A99926","first_name":"CARL","last_name":"CLITES","classification":"B","division":"LIMITED","hit_factor":6.9204},{"match_name":"GoShoot Indoors","match_date":"2017-06-11","stage_classifiercode":"99-11","member_number":"A98772","first_name":"JUSTIN","last_name":"KRAFT","classification":"B","division":"LIMITED","hit_factor":6.9182},{"match_name":"KY 19 USPSA ","match_date":"2020-01-22","stage_classifiercode":"99-11","member_number":"fy43270","first_name":"MIKE","last_name":"DAME","classification":"G","division":"LIMITED","hit_factor":6.9182},{"match_name":"Pitcairn-Monroeville Sportsmens Club USPSA August 2017","match_date":"2017-08-05","stage_classifiercode":"99-11","member_number":"A65386","first_name":"DAVID R","last_name":"MULOCK","classification":"B","division":"LIMITED","hit_factor":6.9182},{"match_name":"WPGC 8-7-2017","match_date":"2017-08-07","stage_classifiercode":"99-11","member_number":"A82785","first_name":"DAVID","last_name":"DOWNEY","classification":"B","division":"LIMITED","hit_factor":6.9164},{"match_name":"PPS USPSA Classifiers 2018-05-01","match_date":"2018-05-02","stage_classifiercode":"99-11","member_number":"A100933","first_name":"RON","last_name":"PATERSON","classification":"B","division":"LIMITED","hit_factor":6.9164},{"match_name":"Tangi May 2016 USPSA","match_date":"2016-05-29","stage_classifiercode":"99-11","member_number":"TY50680","first_name":"WALT","last_name":"LATAPIE","classification":"G","division":"LIMITED","hit_factor":6.9159},{"match_name":"Trigger Guard USPSA","match_date":"2016-04-02","stage_classifiercode":"99-11","member_number":"A-94622","first_name":"CHAD","last_name":"GRAHAM","classification":"U","division":"LIMITED","hit_factor":6.9149},{"match_name":"PBR USPSA Club Match","match_date":"2018-12-11","stage_classifiercode":"99-11","member_number":"A101892","first_name":"BARRY","last_name":"STEVENS","classification":"C","division":"LIMITED","hit_factor":6.9149},{"match_name":"RPS November 2018 USPSA Match","match_date":"2018-11-10","stage_classifiercode":"99-11","member_number":"A109144","first_name":"MARK","last_name":"SCHULTE","classification":"C","division":"LIMITED","hit_factor":6.9124},{"match_name":"APSA May 2016 USPSA Match","match_date":"2016-05-14","stage_classifiercode":"99-11","member_number":"A87382","first_name":"CHRIS","last_name":"BRITT","classification":"C","division":"LIMITED","hit_factor":6.9111},{"match_name":"2020-03 Bone Creek USPSA","match_date":"2020-03-01","stage_classifiercode":"99-11","member_number":"A106540","first_name":"CAMERON","last_name":"CAHN","classification":"C","division":"LIMITED","hit_factor":6.91},{"match_name":"West Coast IPSC","match_date":"2018-07-22","stage_classifiercode":"99-11","member_number":"TY35404","first_name":"STEVE","last_name":"DOUGLASS","classification":"B","division":"LIMITED","hit_factor":6.91},{"match_name":"AGC_20151206","match_date":"2015-12-06","stage_classifiercode":"99-11","member_number":"A79953","first_name":"SEAN","last_name":"HICKEY","classification":"A","division":"LIMITED","hit_factor":6.9079},{"match_name":"MS06 Team Magnolia February 2018 USPSA Match","match_date":"2018-02-03","stage_classifiercode":"99-11","member_number":"A105187","first_name":"RICHARD","last_name":"LUKE","classification":"C","division":"LIMITED","hit_factor":6.9065},{"match_name":"BSPSC 2017 April Special Classifier","match_date":"2017-04-09","stage_classifiercode":"99-11","member_number":"TY78558","first_name":"JOEL","last_name":"MUDRI","classification":"C","division":"LIMITED","hit_factor":6.9051},{"match_name":"Hawkeye Gun Club July 2016 Match","match_date":"2016-07-16","stage_classifiercode":"99-11","member_number":"A87032","first_name":"TRE","last_name":"ROACH","classification":"B","division":"LIMITED","hit_factor":6.9009},{"match_name":"NHRPC - March 2021 USPSA","match_date":"2021-03-14","stage_classifiercode":"99-11","member_number":"A92036","first_name":"MIKE","last_name":"MCKERNS","classification":"B","division":"LIMITED","hit_factor":6.8966},{"match_name":"Shongum October 2017 Match","match_date":"2017-10-07","stage_classifiercode":"99-11","member_number":"TY82166","first_name":"HOWARD","last_name":"SCHOENBERGER","classification":"C","division":"LIMITED","hit_factor":6.8966},{"match_name":"LdF USPSA Match May 12 2018","match_date":"2018-05-12","stage_classifiercode":"99-11","member_number":"FY63382","first_name":"MICHAEL","last_name":"SUEDA","classification":"M","division":"LIMITED","hit_factor":6.8966},{"match_name":"WSPS JUNE 2018 USPSA MATCH","match_date":"2018-06-16","stage_classifiercode":"99-11","member_number":"TY90469","first_name":"CHARLES","last_name":"HURSH","classification":"C","division":"LIMITED","hit_factor":6.8924},{"match_name":"OKCGC USPSA June 2018","match_date":"2018-06-02","stage_classifiercode":"99-11","member_number":"A91228","first_name":"DANNY","last_name":"KEEF","classification":"C","division":"LIMITED","hit_factor":6.8919},{"match_name":"MAPSA June Special Classifier","match_date":"2018-06-09","stage_classifiercode":"99-11","member_number":"fy97194","first_name":"IAN","last_name":"ANDREWS","classification":"B","division":"LIMITED","hit_factor":6.8881},{"match_name":"Nampa USPSA December 4th 2021","match_date":"2021-12-04","stage_classifiercode":"99-11","member_number":"A103248","first_name":"CALVIN","last_name":"JAMES","classification":"B","division":"LIMITED","hit_factor":6.8878},{"match_name":"RSPP 3rd Saturday November 2016","match_date":"2016-11-19","stage_classifiercode":"99-11","member_number":"A88635","first_name":"ROB","last_name":"MCDOWELL","classification":"C","division":"LIMITED","hit_factor":6.8878},{"match_name":"LGCSEMPS April 2018 Special Classifier","match_date":"2018-04-08","stage_classifiercode":"99-11","member_number":"L4337","first_name":"KEVIN","last_name":"KORCHMAROS","classification":"C","division":"LIMITED","hit_factor":6.8874},{"match_name":"Heritage March 2021 USPSA","match_date":"2021-03-13","stage_classifiercode":"99-11","member_number":"FY64995","first_name":"KEN","last_name":"DOWDY","classification":"B","division":"LIMITED","hit_factor":6.8874},{"match_name":"USPSA MO21 2Alpha SBRC December 22 2018","match_date":"2018-12-22","stage_classifiercode":"99-11","member_number":"A102464","first_name":"COLE","last_name":"HUFFMAN","classification":"A","division":"LIMITED","hit_factor":6.8871},{"match_name":"Applied IN25 USPSA December 2016","match_date":"2016-12-23","stage_classifiercode":"99-11","member_number":"\"\"","first_name":"BEN","last_name":"BEUTLER","classification":"C","division":"LIMITED","hit_factor":6.8871},{"match_name":"MAPSA 2016.10.08","match_date":"2016-10-08","stage_classifiercode":"99-11","member_number":"A95626","first_name":"DAVID","last_name":"KNOSALLA","classification":"D","division":"LIMITED","hit_factor":6.8871},{"match_name":"North Mountain PS April","match_date":"2016-04-15","stage_classifiercode":"99-11","member_number":"TY81778","first_name":"TIM","last_name":"HOYT","classification":"B","division":"LIMITED","hit_factor":6.8867},{"match_name":"CSA For PCGC","match_date":"2016-06-26","stage_classifiercode":"99-11","member_number":"TY85570","first_name":"DAVID","last_name":"MILLER","classification":"G","division":"LIMITED","hit_factor":6.8826},{"match_name":"GAS Special Classifier","match_date":"2016-07-02","stage_classifiercode":"99-11","member_number":"TY13940","first_name":"MAC","last_name":"CLARK","classification":"B","division":"LIMITED","hit_factor":6.88},{"match_name":"MAPSA 2016.04.09","match_date":"2016-04-09","stage_classifiercode":"99-11","member_number":"TY68444","first_name":"MONTE","last_name":"BRUESEWITZ","classification":"U","division":"LIMITED","hit_factor":6.879},{"match_name":"Shoot GTR USPSA MAY 24","match_date":"2016-05-24","stage_classifiercode":"99-11","member_number":"A91423","first_name":"LAU","last_name":"MAT AN","classification":"B","division":"LIMITED","hit_factor":6.8776},{"match_name":"Matamoras USPSA August Match","match_date":"2017-08-27","stage_classifiercode":"99-11","member_number":"\"\"","first_name":"SETH","last_name":"DOTEY","classification":"U","division":"LIMITED","hit_factor":6.8768},{"match_name":"Rankin Field June Sunday USPSA","match_date":"2020-06-21","stage_classifiercode":"99-11","member_number":"A65481","first_name":"KEVIN","last_name":"DORAN","classification":"B","division":"LIMITED","hit_factor":6.8759},{"match_name":"AGC_20170903","match_date":"2017-09-03","stage_classifiercode":"99-11","member_number":"TY60555","first_name":"JESS SR","last_name":"JOHNSON","classification":"B","division":"LIMITED","hit_factor":6.8758},{"match_name":"Freeport  Sept 5 2021","match_date":"2021-09-05","stage_classifiercode":"99-11","member_number":"TY101332","first_name":"EDWARD","last_name":"BUJNAK","classification":"B","division":"LIMITED","hit_factor":6.8758},{"match_name":"SUPS All Classifier Match March 1718 2018","match_date":"2018-03-17","stage_classifiercode":"99-11","member_number":"A74530","first_name":"BOB","last_name":"WOLF","classification":"C","division":"LIMITED","hit_factor":6.8742},{"match_name":"OK Corral USPSA Classifier Match Feb 18 2017","match_date":"2017-02-18","stage_classifiercode":"99-11","member_number":"A77897","first_name":"FRANK","last_name":"BARTUS","classification":"\"\"","division":"LIMITED","hit_factor":6.8724},{"match_name":"Lafayette Practical Shooters - WED- June 20","match_date":"2018-06-20","stage_classifiercode":"99-11","member_number":"FY38991","first_name":"MIKE","last_name":"ADAM","classification":"A","division":"LIMITED","hit_factor":6.8724},{"match_name":"INAS Jan 2016 USPSA","match_date":"2016-01-16","stage_classifiercode":"99-11","member_number":"TY21925","first_name":"WILL","last_name":"PARKS","classification":"B","division":"LIMITED","hit_factor":6.872},{"match_name":"IN19 ACC USPSA September 23","match_date":"2018-09-23","stage_classifiercode":"99-11","member_number":"ty74911","first_name":"DAVID","last_name":"HERSH","classification":"C","division":"LIMITED","hit_factor":6.8712},{"match_name":"MVS USPSA 9-20-17","match_date":"2017-09-20","stage_classifiercode":"99-11","member_number":"A100631","first_name":"BRIAN","last_name":"HONG","classification":"C","division":"LIMITED","hit_factor":6.8681},{"match_name":"MRPC OHS02 042218","match_date":"2018-04-21","stage_classifiercode":"99-11","member_number":"A95630","first_name":"DERRICK","last_name":"ALLEN","classification":"M","division":"LIMITED","hit_factor":6.8677},{"match_name":"CGC 4.30.17","match_date":"2017-04-30","stage_classifiercode":"99-11","member_number":"A85424","first_name":"RICHARD","last_name":"CLARE","classification":"B","division":"LIMITED","hit_factor":6.867},{"match_name":"Baghdad IPSC Match 8-5-2017","match_date":"2017-08-05","stage_classifiercode":"99-11","member_number":"TY91830","first_name":"MIKE","last_name":"REAGAN","classification":"\"\"","division":"LIMITED","hit_factor":6.867},{"match_name":"BHPC USPSA Monthly Match 9-10-17 IOWA","match_date":"2017-09-10","stage_classifiercode":"99-11","member_number":"TY77018","first_name":"ROD","last_name":"DOSTART","classification":"C","division":"LIMITED","hit_factor":6.8664},{"match_name":"USPSA-Classifier","match_date":"2017-03-26","stage_classifiercode":"99-11","member_number":"L2534","first_name":"ALFREDO","last_name":"COLON","classification":"A","division":"LIMITED","hit_factor":6.8657},{"match_name":"HSC USPSA May 5th 2018","match_date":"2018-05-05","stage_classifiercode":"99-11","member_number":"A98209","first_name":"ROBERT","last_name":"STAPH","classification":"U","division":"LIMITED","hit_factor":6.8639},{"match_name":"LdF USPSA Match May 12 2018","match_date":"2018-05-12","stage_classifiercode":"99-11","member_number":"A86247","first_name":"SEAN","last_name":"DAVIS2","classification":"B","division":"LIMITED","hit_factor":6.8615},{"match_name":"CSoS Feb2016 Match","match_date":"2016-02-21","stage_classifiercode":"99-11","member_number":"A92288","first_name":"JUSTIN","last_name":"BERRY","classification":"C","division":"LIMITED","hit_factor":6.8587},{"match_name":"CSA For PCGC","match_date":"2016-06-26","stage_classifiercode":"99-11","member_number":"A87413","first_name":"JEFF","last_name":"ADKINS","classification":"D","division":"LIMITED","hit_factor":6.8587},{"match_name":"CASA USPSA December 3  2017","match_date":"2017-12-03","stage_classifiercode":"99-11","member_number":"TY88683","first_name":"JERRY","last_name":"WATTS","classification":"B","division":"LIMITED","hit_factor":6.8587},{"match_name":"APSC USPSA 02-15-20","match_date":"2020-02-15","stage_classifiercode":"99-11","member_number":"TY74988","first_name":"GREG","last_name":"COOPER","classification":"U","division":"LIMITED","hit_factor":6.8571},{"match_name":"APSC USPSA 10-06-18","match_date":"2018-10-06","stage_classifiercode":"99-11","member_number":"A103601","first_name":"RYAN","last_name":"YOUNGBLOOD","classification":"C","division":"LIMITED","hit_factor":6.8571},{"match_name":"BHPSC Weekly Match 2-24-2017 Special Classifier Match","match_date":"2017-02-25","stage_classifiercode":"99-11","member_number":"A96275","first_name":"SCOTT","last_name":"PLACKE","classification":"D","division":"LIMITED","hit_factor":6.8543},{"match_name":"LCSA USPSA March Match","match_date":"2016-03-12","stage_classifiercode":"99-11","member_number":"ty40651","first_name":"RON","last_name":"RODGERS","classification":"B","division":"LIMITED","hit_factor":6.8528},{"match_name":"USPSA MO21 2Alpha SBRC March 2018","match_date":"2018-03-24","stage_classifiercode":"99-11","member_number":"A41069","first_name":"JOHN","last_name":"LUNTSFORD","classification":"B","division":"LIMITED","hit_factor":6.8511},{"match_name":"ANPRACS USPSA 2-1-20","match_date":"2020-02-01","stage_classifiercode":"99-11","member_number":"TY65829","first_name":"MICHAEL","last_name":"HANRAHAN","classification":"C","division":"LIMITED","hit_factor":6.851},{"match_name":"Augusta USPSA 10-14-18","match_date":"2018-10-14","stage_classifiercode":"99-11","member_number":"A105266","first_name":"ERIC","last_name":"FORREST","classification":"U","division":"LIMITED","hit_factor":6.8474},{"match_name":"CCPL 01102016 ALL CLASSIFIER MATCH","match_date":"2016-01-10","stage_classifiercode":"99-11","member_number":"A84240","first_name":"MIKE","last_name":"KENNEDY","classification":"C","division":"LIMITED","hit_factor":6.8456},{"match_name":"DWB - Deadwood Boys USPSA 20 September 2020  Classifier Match Makeup","match_date":"2020-09-20","stage_classifiercode":"99-11","member_number":"TY112098","first_name":"SAMUEL","last_name":"BRIGGS","classification":"B","division":"LIMITED","hit_factor":6.8452},{"match_name":"Prescott 1st Saturday 8-05-17","match_date":"2017-08-05","stage_classifiercode":"99-11","member_number":"L1828","first_name":"OMAR","last_name":"NEWBURY","classification":"A","division":"LIMITED","hit_factor":6.8447},{"match_name":"Prescott 1st Saturday 8-05-17","match_date":"2017-08-05","stage_classifiercode":"99-11","member_number":"TU95703","first_name":"GEORGE","last_name":"LOVE","classification":"B","division":"LIMITED","hit_factor":6.8421},{"match_name":"RPS November 2018 USPSA Match","match_date":"2018-11-10","stage_classifiercode":"99-11","member_number":"TY91263","first_name":"MATTHEW","last_name":"WOLFF","classification":"B","division":"LIMITED","hit_factor":6.8413},{"match_name":"RSCS USPSA  27 Mar 2016","match_date":"2016-03-27","stage_classifiercode":"99-11","member_number":"A71800","first_name":"RANDALL","last_name":"SMITH","classification":"B","division":"LIMITED","hit_factor":6.8399},{"match_name":"Competitive Shooters of Lake Norman CORNELIUS Thursday Evening Indoor USPSA Pistol Match North Carolina","match_date":"2018-12-06","stage_classifiercode":"99-11","member_number":"A99523","first_name":"ANTHONY","last_name":"TURK","classification":"C","division":"LIMITED","hit_factor":6.8376},{"match_name":"Omaha Gun Club USPSA February 28th 2018","match_date":"2018-03-01","stage_classifiercode":"99-11","member_number":"Ty61813","first_name":"TOM","last_name":"ENGEL","classification":"A","division":"LIMITED","hit_factor":6.8376},{"match_name":"Richmond Boro Gun Club April 2017 USPSA Pistol Match","match_date":"2017-04-08","stage_classifiercode":"99-11","member_number":"TY89184","first_name":"ADAM","last_name":"GORDON","classification":"C","division":"LIMITED","hit_factor":6.8365},{"match_name":"MISS USPSA Oct 6th 2021","match_date":"2021-10-06","stage_classifiercode":"99-11","member_number":"TY115518","first_name":"JERRY","last_name":"LIS","classification":"A","division":"LIMITED","hit_factor":6.8345},{"match_name":"NPS October 2017 Match","match_date":"2017-10-14","stage_classifiercode":"99-11","member_number":"A72659","first_name":"CHUCK","last_name":"MOODY","classification":"A","division":"LIMITED","hit_factor":6.8301},{"match_name":"GRRC Wk 8","match_date":"2018-06-25","stage_classifiercode":"99-11","member_number":"ty65770","first_name":"BOB","last_name":"LINDER","classification":"C","division":"LIMITED","hit_factor":6.8299},{"match_name":"Dundee USPSA Feb 2016","match_date":"2016-02-27","stage_classifiercode":"99-11","member_number":"TY76143","first_name":"BEN","last_name":"LALONDE","classification":"C","division":"LIMITED","hit_factor":6.8293},{"match_name":"Springfield Tactical Shooters 04/05/2018","match_date":"2018-04-05","stage_classifiercode":"99-11","member_number":"TY35016","first_name":"ANDREW","last_name":"CATLIN","classification":"B","division":"LIMITED","hit_factor":6.8279},{"match_name":"Rio Salado UPPL September 2020","match_date":"2020-09-13","stage_classifiercode":"99-11","member_number":"A77381","first_name":"KELLY","last_name":"FLETCHER","classification":"A","division":"LIMITED","hit_factor":6.8259},{"match_name":"Shot Through The Heart Classifiers","match_date":"2018-02-04","stage_classifiercode":"99-11","member_number":"TY-103672","first_name":"NATHAN","last_name":"ECHEVERRIA","classification":"D","division":"LIMITED","hit_factor":6.8249},{"match_name":"Springfield Tactical Shooters 05/06/2021","match_date":"2021-05-06","stage_classifiercode":"99-11","member_number":"A106901","first_name":"WILLIAM","last_name":"AMES","classification":"C","division":"LIMITED","hit_factor":6.8241},{"match_name":"Shadow Hawk Defense USPSA Special Classifier","match_date":"2020-11-14","stage_classifiercode":"99-11","member_number":"A97515","first_name":"JOHN","last_name":"YUN","classification":"U","division":"LIMITED","hit_factor":6.8217},{"match_name":"SWGC USPSA Pistol Match - November 2021","match_date":"2021-11-06","stage_classifiercode":"99-11","member_number":"A63389","first_name":"TOM","last_name":"THOMPSON","classification":"U","division":"LIMITED","hit_factor":6.8211},{"match_name":"SLPSA July USPSA match","match_date":"2018-07-21","stage_classifiercode":"99-11","member_number":"A63952","first_name":"TIM","last_name":"ALLEN","classification":"B","division":"LIMITED","hit_factor":6.8211},{"match_name":"PRG - Oh Shoot USPSA February 21st - 3rd Sunday Match","match_date":"2021-02-21","stage_classifiercode":"99-11","member_number":"FY114465","first_name":"AXEL","last_name":"BUENDIA","classification":"U","division":"LIMITED","hit_factor":6.821},{"match_name":"Deadwood Boys USPSA All Classifier Match - 29 July 2018","match_date":"2018-07-29","stage_classifiercode":"99-11","member_number":"A40050","first_name":"JEFF","last_name":"CHURCH","classification":"B","division":"LIMITED","hit_factor":6.8182},{"match_name":"AGC_20151206","match_date":"2015-12-06","stage_classifiercode":"99-11","member_number":"TY60555","first_name":"JESS SR","last_name":"JOHNSON","classification":"B","division":"LIMITED","hit_factor":6.8182},{"match_name":"TAP USPSA Pistol Match Aug 14 2016","match_date":"2016-08-14","stage_classifiercode":"99-11","member_number":"L4008","first_name":"CHANCE","last_name":"LANDRENEAUX","classification":"B","division":"LIMITED","hit_factor":6.8182},{"match_name":"SFA   USPSA 2/20/2016","match_date":"2016-02-20","stage_classifiercode":"99-11","member_number":"TY75664","first_name":"GREG","last_name":"BLAIR","classification":"A","division":"LIMITED","hit_factor":6.8182},{"match_name":"Klamath USPSA 06/05/16 JSPS OR09","match_date":"2016-06-05","stage_classifiercode":"99-11","member_number":"A80128","first_name":"DANIEL","last_name":"PHARISS","classification":"C","division":"LIMITED","hit_factor":6.8152},{"match_name":"Castlewood USPSA Sept 2020 shoot","match_date":"2020-09-26","stage_classifiercode":"99-11","member_number":"TY119981","first_name":"JOHN","last_name":"RODGERS","classification":"C","division":"LIMITED","hit_factor":6.815},{"match_name":"LBAS160220","match_date":"2016-02-20","stage_classifiercode":"99-11","member_number":"A59582","first_name":"SEAN","last_name":"VAN HORN","classification":"B","division":"LIMITED","hit_factor":6.8143},{"match_name":"Benton Gun Club-USPSA March 25 2018","match_date":"2018-03-25","stage_classifiercode":"99-11","member_number":"ty88683","first_name":"JERRY","last_name":"WATTS","classification":"B","division":"LIMITED","hit_factor":6.8116},{"match_name":"OK Corral USPSA Classifier Match Feb 18 2017","match_date":"2017-02-18","stage_classifiercode":"99-11","member_number":"TY55336","first_name":"JAMES","last_name":"LACASSE","classification":"\"\"","division":"LIMITED","hit_factor":6.8091},{"match_name":"WILLISTON PRACTICAL SHOOTERS CLUB","match_date":"2020-10-03","stage_classifiercode":"99-11","member_number":"FY77988","first_name":"RICH","last_name":"VALVO","classification":"A","division":"LIMITED","hit_factor":6.8085},{"match_name":"MPSA 021817","match_date":"2017-02-18","stage_classifiercode":"99-11","member_number":"A60634","first_name":"MICHAEL","last_name":"SLAY","classification":"C","division":"LIMITED","hit_factor":6.8047},{"match_name":"Prescott Action Shooters 1st Saturday USPSA 6-2-2018 ","match_date":"2018-06-03","stage_classifiercode":"99-11","member_number":"TY92849","first_name":"TIMOTHY","last_name":"MOMJIAN","classification":"C","division":"LIMITED","hit_factor":6.8044},{"match_name":"Range54 USPSA","match_date":"2018-06-08","stage_classifiercode":"99-11","member_number":"A109772","first_name":"ANDREW","last_name":"GEE","classification":"U","division":"LIMITED","hit_factor":6.8027},{"match_name":"Denali September","match_date":"2018-09-07","stage_classifiercode":"99-11","member_number":"A113681","first_name":"BRANDON","last_name":"BOYD","classification":"X","division":"LIMITED","hit_factor":6.8019},{"match_name":"SAPSC Monthly USPSA Classifier Match 20160209","match_date":"2016-02-09","stage_classifiercode":"99-11","member_number":"A83004","first_name":"CASEY","last_name":"THERIOT","classification":"C","division":"LIMITED","hit_factor":6.801},{"match_name":"West Coast IPSC","match_date":"2018-07-22","stage_classifiercode":"99-11","member_number":"TY92479","first_name":"JOEL","last_name":"GONZALES","classification":"B","division":"LIMITED","hit_factor":6.801},{"match_name":"Rio Salado Hosemasters February 2021","match_date":"2021-02-27","stage_classifiercode":"99-11","member_number":"A127938","first_name":"JEREMY","last_name":"EVANS","classification":"B","division":"LIMITED","hit_factor":6.8},{"match_name":"OK15 USPSA at USSA May 6th 2018","match_date":"2018-05-06","stage_classifiercode":"99-11","member_number":"\"\"","first_name":"TYLER","last_name":"HAGA","classification":"U","division":"LIMITED","hit_factor":6.7995},{"match_name":"SWGC USPSA Pistol Match - November 2021","match_date":"2021-11-06","stage_classifiercode":"99-11","member_number":"TY36459","first_name":"EDDIE","last_name":"GAMMONS","classification":"G","division":"LIMITED","hit_factor":6.7993},{"match_name":"APSC 4th Annual Holiday Hosefest USPSA Match 12-02-17","match_date":"2017-12-02","stage_classifiercode":"99-11","member_number":"A86908","first_name":"MICHAEL","last_name":"LUNDGREN","classification":"U","division":"LIMITED","hit_factor":6.7989},{"match_name":"BHPSC 11-20-2020","match_date":"2020-11-21","stage_classifiercode":"99-11","member_number":"L4806","first_name":"KEITH","last_name":"STEPHENSON","classification":"B","division":"LIMITED","hit_factor":6.7985},{"match_name":"Lefthanders Gun Club Practical Shooters October","match_date":"2017-09-30","stage_classifiercode":"99-11","member_number":"TY89535","first_name":"DENNIS","last_name":"RAINVILLE","classification":"C","division":"LIMITED","hit_factor":6.7974},{"match_name":"USPSA MO21 2Alpha SBRC March 2018","match_date":"2018-03-24","stage_classifiercode":"99-11","member_number":"\"\"","first_name":"CLINT","last_name":"COBERLEY","classification":"U","division":"LIMITED","hit_factor":6.7935},{"match_name":"Hopkinton USPSA May 2017","match_date":"2017-05-06","stage_classifiercode":"99-11","member_number":"A58698","first_name":"HOWIE","last_name":"GELLER","classification":"C","division":"LIMITED","hit_factor":6.7925},{"match_name":"Laser Ninja Dragon League USPSA July 2nd Special Classifier","match_date":"2017-07-02","stage_classifiercode":"99-11","member_number":"A99597","first_name":"AUSTIN","last_name":"POE","classification":"D","division":"LIMITED","hit_factor":6.7925},{"match_name":"Lefthanders Gun Club Practical Shooters October","match_date":"2017-09-30","stage_classifiercode":"99-11","member_number":"A16729","first_name":"MICHAEL","last_name":"FARNIOK","classification":"A","division":"LIMITED","hit_factor":6.7925},{"match_name":"WELD ECO09 20180916","match_date":"2018-09-16","stage_classifiercode":"99-11","member_number":"A81984","first_name":"TOM","last_name":"FINN","classification":"B","division":"LIMITED","hit_factor":6.7901},{"match_name":"Prescott Action Shooters 1st Saturday USPSA 7-7-2018","match_date":"2018-07-07","stage_classifiercode":"99-11","member_number":"TY94645","first_name":"GENE","last_name":"ERICKSON","classification":"C","division":"LIMITED","hit_factor":6.7893},{"match_name":"TriggerGuard USPSA Classifier Match","match_date":"2018-03-24","stage_classifiercode":"99-11","member_number":"A109897","first_name":"MICHAEL","last_name":"WARREN","classification":"U","division":"LIMITED","hit_factor":6.7885},{"match_name":"MCAS March 2021 USPSA","match_date":"2021-03-28","stage_classifiercode":"99-11","member_number":"A87737","first_name":"PATRICK","last_name":"MCCORMICK","classification":"C","division":"LIMITED","hit_factor":6.7862},{"match_name":"AIPS  USPSA Monthly CrossRoads Match 16 November 2016","match_date":"2016-11-16","stage_classifiercode":"99-11","member_number":"TY82873","first_name":"BEN","last_name":"OLESON","classification":"B","division":"LIMITED","hit_factor":6.7857},{"match_name":"Emmett July Match","match_date":"2017-07-21","stage_classifiercode":"99-11","member_number":"fy31867","first_name":"FRED","last_name":"LINDSTROM","classification":"B","division":"LIMITED","hit_factor":6.7843},{"match_name":"Ontelaunee USPSA July 2016","match_date":"2016-07-23","stage_classifiercode":"99-11","member_number":"A85855","first_name":"GABE","last_name":"BLARDONY","classification":"C","division":"LIMITED","hit_factor":6.7821},{"match_name":"Brazosland Pistoleros August 20 2017","match_date":"2017-08-20","stage_classifiercode":"99-11","member_number":"\"\"","first_name":"TAYLOR","last_name":"LATHAM","classification":"U","division":"LIMITED","hit_factor":6.7797},{"match_name":"Rankin Field Sunday USPSA","match_date":"2018-04-15","stage_classifiercode":"99-11","member_number":"TY87000","first_name":"GREG","last_name":"VAUGHN","classification":"A","division":"LIMITED","hit_factor":6.7797},{"match_name":"CJR&PC USPSA  June 10","match_date":"2018-06-10","stage_classifiercode":"99-11","member_number":"A96732","first_name":"KEVIN","last_name":"CALICHIO","classification":"\"\"","division":"LIMITED","hit_factor":6.7797},{"match_name":"CFRPC April USPSA Match","match_date":"2018-04-15","stage_classifiercode":"99-11","member_number":"TY70425","first_name":"JOHN","last_name":"WALKER","classification":"C","division":"LIMITED","hit_factor":6.7775},{"match_name":"Brazosland Pistoleros August 20 2017","match_date":"2017-08-20","stage_classifiercode":"99-11","member_number":"A104958","first_name":"SETH","last_name":"ABBOTT","classification":"U","division":"LIMITED","hit_factor":6.7754},{"match_name":"USPSA-Classifier","match_date":"2017-03-26","stage_classifiercode":"99-11","member_number":"A92864","first_name":"EDWIN","last_name":"PEREZ","classification":"U","division":"LIMITED","hit_factor":6.7754},{"match_name":"EAPS July 2017 USPSA","match_date":"2017-07-16","stage_classifiercode":"99-11","member_number":"A98482","first_name":"AARON","last_name":"FITZGERALD","classification":"C","division":"LIMITED","hit_factor":6.7734},{"match_name":"WPGC 10-1-18","match_date":"2018-10-01","stage_classifiercode":"99-11","member_number":"A100067","first_name":"DANIEL","last_name":"OLSON","classification":"D","division":"LIMITED","hit_factor":6.7715},{"match_name":"Ontelaunee USPSA  July 2018","match_date":"2018-07-29","stage_classifiercode":"99-11","member_number":"TY98580","first_name":"JASON","last_name":"SENDELSKY","classification":"C","division":"LIMITED","hit_factor":6.7715},{"match_name":"Dundee Practical Shooters - Oct 27 2018","match_date":"2018-10-27","stage_classifiercode":"99-11","member_number":"A108736","first_name":"LOGAN","last_name":"SOMERS","classification":"C","division":"LIMITED","hit_factor":6.7708},{"match_name":"BUAS December Match","match_date":"2016-12-11","stage_classifiercode":"99-11","member_number":"A77418","first_name":"JOHN","last_name":"IACOMINI","classification":"U","division":"LIMITED","hit_factor":6.7696},{"match_name":"Rankin field Sunday match Clone","match_date":"2016-07-17","stage_classifiercode":"99-11","member_number":"\"\"","first_name":"JORDAN","last_name":"HALL","classification":"M","division":"LIMITED","hit_factor":6.7682},{"match_name":"Target  Sports Central Indiana Championship","match_date":"2020-08-22","stage_classifiercode":"99-11","member_number":"A110587","first_name":"JAY","last_name":"WEHRLE","classification":"C","division":"LIMITED","hit_factor":6.768},{"match_name":"CVSC 10-28-2018 (6 Stage All Classifier Match)","match_date":"2018-10-28","stage_classifiercode":"99-11","member_number":"\"\"","first_name":"HENRY","last_name":"AVILA","classification":"U","division":"LIMITED","hit_factor":6.7669},{"match_name":"TGC July 2016 USPSA Classifier Match","match_date":"2016-07-17","stage_classifiercode":"99-11","member_number":"A83616","first_name":"LELAND","last_name":"JOHNSON","classification":"C","division":"LIMITED","hit_factor":6.7661},{"match_name":"WSPS JUNE 2018 USPSA MATCH","match_date":"2018-06-16","stage_classifiercode":"99-11","member_number":"A104882","first_name":"CHRISTOPHER","last_name":"GELNETT","classification":"C","division":"LIMITED","hit_factor":6.7639},{"match_name":"NHRPC - March 2021 USPSA","match_date":"2021-03-14","stage_classifiercode":"99-11","member_number":"A113919","first_name":"JEFF","last_name":"WILLI","classification":"C","division":"LIMITED","hit_factor":6.762},{"match_name":"Rio Salado RSPP 3rd Saturday February 2020","match_date":"2020-02-15","stage_classifiercode":"99-11","member_number":"A103575","first_name":"STEVE","last_name":"SCACCIA (1)","classification":"U","division":"LIMITED","hit_factor":6.7588},{"match_name":"EAPS July 2017 USPSA","match_date":"2017-07-16","stage_classifiercode":"99-11","member_number":"A92150","first_name":"JAMES","last_name":"NELSON","classification":"C","division":"LIMITED","hit_factor":6.7568},{"match_name":"Quinton USPSA - July 14 2018","match_date":"2018-07-14","stage_classifiercode":"99-11","member_number":"A106520","first_name":"BEN","last_name":"PLAPPERT","classification":"C","division":"LIMITED","hit_factor":6.7568},{"match_name":"SAPSA January 2020 Match","match_date":"2020-01-18","stage_classifiercode":"99-11","member_number":"A59053","first_name":"CHIP","last_name":"SAFFERY","classification":"U","division":"LIMITED","hit_factor":6.7516},{"match_name":"Emmett July Match","match_date":"2017-07-21","stage_classifiercode":"99-11","member_number":"a103720","first_name":"MIKE","last_name":"AUSTIN","classification":"C","division":"LIMITED","hit_factor":6.7511},{"match_name":"Pitcairn-Monroeville Sportsmens Club USPSA August 2017","match_date":"2017-08-05","stage_classifiercode":"99-11","member_number":"TY47047","first_name":"MARK","last_name":"CLEAVER","classification":"A","division":"LIMITED","hit_factor":6.7485},{"match_name":"2016-05-07 USPSA at Phoenix Rod and Gun Club","match_date":"2016-05-07","stage_classifiercode":"99-11","member_number":"L3678","first_name":"RICHARD","last_name":"BHELLA","classification":"A","division":"LIMITED","hit_factor":6.7476},{"match_name":"Shot Through The Heart Classifiers","match_date":"2018-02-04","stage_classifiercode":"99-11","member_number":"A105631","first_name":"CAINE","last_name":"PAVLOSKY","classification":"C","division":"LIMITED","hit_factor":6.7476},{"match_name":"Douglas Ridge USPSA March 7","match_date":"2020-03-07","stage_classifiercode":"99-11","member_number":"L4718","first_name":"LYNSEY","last_name":"PESTES","classification":"C","division":"LIMITED","hit_factor":6.7476},{"match_name":"RPS November 2018 USPSA Match","match_date":"2018-11-10","stage_classifiercode":"99-11","member_number":"A90559","first_name":"IKE","last_name":"STARNES","classification":"B","division":"LIMITED","hit_factor":6.7456},{"match_name":"June 22 2016 A Zone","match_date":"2016-06-22","stage_classifiercode":"99-11","member_number":"A87214","first_name":"CORY","last_name":"KLEMASHEVICH","classification":"B","division":"LIMITED","hit_factor":6.7416},{"match_name":"Richmond Hot Shots January 17-2016 USPSA Pistol","match_date":"2016-01-17","stage_classifiercode":"99-11","member_number":"A60784","first_name":"CHRISTOPHER","last_name":"LUGOS","classification":"B","division":"LIMITED","hit_factor":6.7402},{"match_name":"Crooked Creek Pistol League - June 2016","match_date":"2016-06-25","stage_classifiercode":"99-11","member_number":"A87115","first_name":"DOUGLAS","last_name":"ELLIS","classification":"B","division":"LIMITED","hit_factor":6.7385},{"match_name":"PRG 2017 Classifier Match","match_date":"2017-02-19","stage_classifiercode":"99-11","member_number":"A83686","first_name":"DAVID","last_name":"KAFFEL","classification":"B","division":"LIMITED","hit_factor":6.7376},{"match_name":"WVPPS May 2021","match_date":"2021-05-16","stage_classifiercode":"99-11","member_number":"TY64065","first_name":"DANIEL","last_name":"HART","classification":"M","division":"LIMITED","hit_factor":6.7376},{"match_name":"North Mountain PS April","match_date":"2016-04-15","stage_classifiercode":"99-11","member_number":"A71480","first_name":"DAVID","last_name":"SCORDY","classification":"U","division":"LIMITED","hit_factor":6.7376},{"match_name":"SLPSA July USPSA match","match_date":"2018-07-21","stage_classifiercode":"99-11","member_number":"A96333","first_name":"GABRIEL","last_name":"JOHNSON","classification":"C","division":"LIMITED","hit_factor":6.735},{"match_name":"Armory Indoor League","match_date":"2018-02-08","stage_classifiercode":"99-11","member_number":"A85536","first_name":"DAVID","last_name":"WHITE","classification":"B","division":"LIMITED","hit_factor":6.7344},{"match_name":"BRSP Tuesday Night USPSA Match - Oct 31","match_date":"2017-11-01","stage_classifiercode":"99-11","member_number":"FY75508","first_name":"TRACY","last_name":"HARTLESS","classification":"\"\"","division":"LIMITED","hit_factor":6.7344},{"match_name":"LdF USPSA Match May 12 2018","match_date":"2018-05-12","stage_classifiercode":"99-11","member_number":"A109851","first_name":"TONY","last_name":"EBITNER","classification":"U","division":"LIMITED","hit_factor":6.7335},{"match_name":"Afternoon SMPS 09 February 2020 USPSA Classifier Match","match_date":"2020-02-09","stage_classifiercode":"99-11","member_number":"TY102317","first_name":"PAUL","last_name":"EARP","classification":"C","division":"LIMITED","hit_factor":6.7308},{"match_name":"RPS December 2017 USPSA Match","match_date":"2017-12-09","stage_classifiercode":"99-11","member_number":"A100423","first_name":"JASMINE","last_name":"GORDON","classification":"B","division":"LIMITED","hit_factor":6.7308},{"match_name":"2016-02-06 USPSA at Phoenix Rod and Gun Club","match_date":"2016-02-06","stage_classifiercode":"99-11","member_number":"A80039","first_name":"STEVE","last_name":"STEPHENS","classification":"C","division":"LIMITED","hit_factor":6.7282},{"match_name":"MPSA 07182020 USPSA","match_date":"2020-07-18","stage_classifiercode":"99-11","member_number":"FY39690","first_name":"MCCONNELL","last_name":"HART","classification":"B","division":"LIMITED","hit_factor":6.7251},{"match_name":"Shongum Pistol November 2015","match_date":"2015-11-07","stage_classifiercode":"99-11","member_number":"TY77457","first_name":"DRAGON","last_name":"CHOW","classification":"C","division":"LIMITED","hit_factor":6.7237},{"match_name":"Georgia Run N Gun 1-28-2016","match_date":"2016-01-29","stage_classifiercode":"99-11","member_number":"\"\"","first_name":"JASON","last_name":"PRUETT","classification":"U","division":"LIMITED","hit_factor":6.7227},{"match_name":"RPS November 2018 USPSA Match","match_date":"2018-11-10","stage_classifiercode":"99-11","member_number":"A106507","first_name":"KEITH","last_name":"NAGELSKI","classification":"C","division":"LIMITED","hit_factor":6.7227},{"match_name":"Heritage March 2021 USPSA","match_date":"2021-03-13","stage_classifiercode":"99-11","member_number":"A108214","first_name":"JOSHUA","last_name":"BENNETT","classification":"D","division":"LIMITED","hit_factor":6.7227},{"match_name":"MS06 Team Magnolia February 2018 USPSA Match","match_date":"2018-02-03","stage_classifiercode":"99-11","member_number":"TY66899","first_name":"JOHN","last_name":"HOFFMAN","classification":"B","division":"LIMITED","hit_factor":6.7207},{"match_name":"GRB JAN USPSA  at Cav","match_date":"2017-01-21","stage_classifiercode":"99-11","member_number":"FY88516","first_name":"SEAN","last_name":"KELLNER","classification":"C","division":"LIMITED","hit_factor":6.7204},{"match_name":"Hopkinton USPSA October 2018","match_date":"2018-10-06","stage_classifiercode":"99-11","member_number":"L4262","first_name":"STEWART","last_name":"GINSBERG","classification":"B","division":"LIMITED","hit_factor":6.7188},{"match_name":"WNPL - USPSA March Snowblind Blowout 2017","match_date":"2017-03-05","stage_classifiercode":"99-11","member_number":"A81703","first_name":"DAVID","last_name":"BORWICK","classification":"B","division":"LIMITED","hit_factor":6.7183},{"match_name":"CVSC 07-29-2018","match_date":"2018-07-29","stage_classifiercode":"99-11","member_number":"A82654","first_name":"JIMMIE","last_name":"RABINA","classification":"C","division":"LIMITED","hit_factor":6.7183},{"match_name":"OREGON ARPC CC05 USPSA AUGUST 12 2017","match_date":"2017-08-12","stage_classifiercode":"99-11","member_number":"L3452","first_name":"MARK","last_name":"GOSS","classification":"B","division":"LIMITED","hit_factor":6.7174},{"match_name":"LdF USPSA Match January 25 2020","match_date":"2020-01-25","stage_classifiercode":"99-11","member_number":"TY97861","first_name":"BEN","last_name":"SCHULTE","classification":"B","division":"LIMITED","hit_factor":6.7155},{"match_name":"Deadwood Boys USPSA All Classifier Match - 29 July 2018","match_date":"2018-07-29","stage_classifiercode":"99-11","member_number":"TY95542","first_name":"FRITO","last_name":"BANDITO","classification":"C","division":"LIMITED","hit_factor":6.7138},{"match_name":"FBURG March Level I USPSA","match_date":"2016-03-06","stage_classifiercode":"99-11","member_number":"Ty66753","first_name":"JIM","last_name":"DYSON","classification":"C","division":"LIMITED","hit_factor":6.713},{"match_name":"Richmond Hot Shots October 6-7 USPSA Pistol Match","match_date":"2018-10-06","stage_classifiercode":"99-11","member_number":"TY75970","first_name":"STEVE","last_name":"HUCKABONE","classification":"B","division":"LIMITED","hit_factor":6.7097},{"match_name":"Tangi January 2016 USPSA","match_date":"2016-01-23","stage_classifiercode":"99-11","member_number":"ty62332","first_name":"JOHN","last_name":"HUBER","classification":"D","division":"LIMITED","hit_factor":6.7089},{"match_name":"EWPSA 2018-10","match_date":"2018-10-20","stage_classifiercode":"99-11","member_number":"A114732","first_name":"RYAN","last_name":"PAULSON","classification":"U","division":"LIMITED","hit_factor":6.7055},{"match_name":"USPSA CM99 Special Classifier MO19 Lamar October 9 2016","match_date":"2016-10-09","stage_classifiercode":"99-11","member_number":"a51402","first_name":"DOC","last_name":"WELSHER","classification":"B","division":"LIMITED","hit_factor":6.7052},{"match_name":"2016-02-06 USPSA at Phoenix Rod and Gun Club","match_date":"2016-02-06","stage_classifiercode":"99-11","member_number":"A90353","first_name":"TRAVIS","last_name":"MCCAMISH","classification":"U","division":"LIMITED","hit_factor":6.7039},{"match_name":"Springfield Tactical Shooters 04/05/2018","match_date":"2018-04-05","stage_classifiercode":"99-11","member_number":"A95946","first_name":"PAUL","last_name":"EMERY","classification":"C","division":"LIMITED","hit_factor":6.7031},{"match_name":"NW01 April da Turd","match_date":"2018-04-04","stage_classifiercode":"99-11","member_number":"A85786","first_name":"NOEL","last_name":"DOMINGO","classification":"B","division":"LIMITED","hit_factor":6.6998},{"match_name":"Campeonato USPSA 2020","match_date":"2020-05-30","stage_classifiercode":"99-11","member_number":"TY94373","first_name":"ROMAN","last_name":"SIFUENTES-PEREZ","classification":"B","division":"LIMITED","hit_factor":6.6991},{"match_name":"SEPSA July 2017","match_date":"2017-07-08","stage_classifiercode":"99-11","member_number":"A90679","first_name":"BRIAN","last_name":"TURNER","classification":"B","division":"LIMITED","hit_factor":6.698},{"match_name":"Blackstone Shooting Sports May 2017 USPSA Pistol Level 1","match_date":"2017-05-09","stage_classifiercode":"99-11","member_number":"A89585","first_name":"ASHTON","last_name":"JOHNSON","classification":"C","division":"LIMITED","hit_factor":6.6946},{"match_name":"AGC_20170903","match_date":"2017-09-03","stage_classifiercode":"99-11","member_number":"A88488","first_name":"MARCUS","last_name":"WEEKS","classification":"C","division":"LIMITED","hit_factor":6.6934},{"match_name":"Lefthanders Gun Club Practical Shooters October","match_date":"2017-09-30","stage_classifiercode":"99-11","member_number":"TY56034","first_name":"DAVE","last_name":"DIRKSMEYER","classification":"C","division":"LIMITED","hit_factor":6.6924},{"match_name":"EWPSA 2016-04","match_date":"2016-04-17","stage_classifiercode":"99-11","member_number":"TY5401","first_name":"MIKE","last_name":"ENSMINGER","classification":"B","division":"LIMITED","hit_factor":6.6914},{"match_name":"Dundee Practical Shooters - Oct 27 2018","match_date":"2018-10-27","stage_classifiercode":"99-11","member_number":"\"\"","first_name":"KYLE","last_name":"SCHMIDT","classification":"U","division":"LIMITED","hit_factor":6.6914},{"match_name":"Lefthanders Gun Club Practical Shooters October","match_date":"2017-09-30","stage_classifiercode":"99-11","member_number":"NA","first_name":"BILL","last_name":"MILLER","classification":"U","division":"LIMITED","hit_factor":6.6897},{"match_name":"Palmetto Gun Club - April 2017 USPSA","match_date":"2017-04-08","stage_classifiercode":"99-11","member_number":"TY75124","first_name":"ROBBY","last_name":"HEWITT","classification":"B","division":"LIMITED","hit_factor":6.6895},{"match_name":"PSAC_20161022","match_date":"2016-10-22","stage_classifiercode":"99-11","member_number":"FY26112","first_name":"RW","last_name":"SWAINSON","classification":"\"\"","division":"LIMITED","hit_factor":6.6865},{"match_name":"NHRPC - March 2021 USPSA","match_date":"2021-03-14","stage_classifiercode":"99-11","member_number":"A94001","first_name":"NICK","last_name":"REYNOLDS","classification":"G","division":"LIMITED","hit_factor":6.6845},{"match_name":"NW01 Paul Bunyan CS Series May 9 2021","match_date":"2021-05-09","stage_classifiercode":"99-11","member_number":"A51227","first_name":"KEVIN","last_name":"OLSON","classification":"A","division":"LIMITED","hit_factor":6.6845},{"match_name":"WSRC USPSA 11/19/2017","match_date":"2017-11-19","stage_classifiercode":"99-11","member_number":"A95932","first_name":"ROBERT","last_name":"TURNER","classification":"C","division":"LIMITED","hit_factor":6.6835},{"match_name":"LdF USPSA Match May 12 2018","match_date":"2018-05-12","stage_classifiercode":"99-11","member_number":"\"\"","first_name":"ANTHONY","last_name":"WILLIAMS","classification":"U","division":"LIMITED","hit_factor":6.6832},{"match_name":"Hopkinton June  2016","match_date":"2016-06-04","stage_classifiercode":"99-11","member_number":"L1571","first_name":"ROBERT","last_name":"BOUDRIE","classification":"A","division":"LIMITED","hit_factor":6.6826},{"match_name":"MSSA Uspsa Match 1/3/16","match_date":"2016-01-03","stage_classifiercode":"99-11","member_number":"A6441","first_name":"ANDY","last_name":"WOOD","classification":"G","division":"LIMITED","hit_factor":6.679},{"match_name":"Prescott Action Shooters 1st Saturday USPSA 6-2-2018 ","match_date":"2018-06-03","stage_classifiercode":"99-11","member_number":"TY53718","first_name":"TOM","last_name":"SLOTA","classification":"B","division":"LIMITED","hit_factor":6.6778},{"match_name":"Bossier Parish Practical Shooters August 16 2020","match_date":"2020-08-16","stage_classifiercode":"99-11","member_number":"A122138","first_name":"BUCK","last_name":"BURNS","classification":"C","division":"LIMITED","hit_factor":6.6761},{"match_name":"WLPS USPSA May 2016","match_date":"2016-05-22","stage_classifiercode":"99-11","member_number":"A84539","first_name":"JUSTIN","last_name":"ADAMS","classification":"D","division":"LIMITED","hit_factor":6.6756},{"match_name":"GTS WY02 USPSA Special Classifier","match_date":"2017-07-08","stage_classifiercode":"99-11","member_number":"A100243","first_name":"TATE","last_name":"AABERG","classification":"U","division":"LIMITED","hit_factor":6.6752},{"match_name":"CSoS Feb2016 Match","match_date":"2016-02-21","stage_classifiercode":"99-11","member_number":"a82683","first_name":"BRIAN","last_name":"WOLFF","classification":"C","division":"LIMITED","hit_factor":6.6749},{"match_name":"STAGE ZERO SHOOTING SUPPLY USPSA","match_date":"2020-07-16","stage_classifiercode":"99-11","member_number":"A127049","first_name":"CODY","last_name":"THOMAS RESHOOT","classification":"C","division":"LIMITED","hit_factor":6.6748},{"match_name":"Range54 USPSA","match_date":"2018-06-08","stage_classifiercode":"99-11","member_number":"\"\"","first_name":"STEADY","last_name":"STEADY","classification":"U","division":"LIMITED","hit_factor":6.6746},{"match_name":"NVSA USPSA 1609","match_date":"2016-09-04","stage_classifiercode":"99-11","member_number":"TY85343","first_name":"ALAN","last_name":"WONG","classification":"C","division":"LIMITED","hit_factor":6.6667},{"match_name":"SEPSA July 2017","match_date":"2017-07-08","stage_classifiercode":"99-11","member_number":"L3555","first_name":"DAVE","last_name":"OBRIEN","classification":"B","division":"LIMITED","hit_factor":6.6667},{"match_name":"CSA Coalfield Shooters Association USPSA SEPTEMBER 2020","match_date":"2020-09-12","stage_classifiercode":"99-11","member_number":"TY2931","first_name":"ROGER","last_name":"RAMEY","classification":"B","division":"LIMITED","hit_factor":6.6667},{"match_name":"Firing Line Classifier","match_date":"2018-01-26","stage_classifiercode":"99-11","member_number":"A100417","first_name":"ROBERT","last_name":"GALE","classification":"C","division":"LIMITED","hit_factor":6.6667},{"match_name":"FSA USPSA 01-26-20","match_date":"2020-01-27","stage_classifiercode":"99-11","member_number":"A123694","first_name":"JUSTIN","last_name":"ANDERSON","classification":"U","division":"LIMITED","hit_factor":6.6667},{"match_name":"SSS USPSA February 2020","match_date":"2020-02-16","stage_classifiercode":"99-11","member_number":"A110509","first_name":"MATTHEW","last_name":"JACKSON","classification":"C (C Class)","division":"LIMITED","hit_factor":6.6667},{"match_name":"Richmond Hot Shots April 30-May 1st USPSA Pistol Match","match_date":"2016-04-30","stage_classifiercode":"99-11","member_number":"TY49645","first_name":"ED","last_name":"ESPINOZA","classification":"B","division":"LIMITED","hit_factor":6.6667},{"match_name":"Coastal Area Practical Shooters 7-22-17 Special Classifier","match_date":"2017-07-22","stage_classifiercode":"99-11","member_number":"A90679","first_name":"BRIAN2","last_name":"TURNER","classification":"B","division":"LIMITED","hit_factor":6.6587},{"match_name":"RCPS USPSA March 10","match_date":"2018-03-10","stage_classifiercode":"99-11","member_number":"TY81767","first_name":"WILLIAM","last_name":"KODADEK","classification":"C","division":"LIMITED","hit_factor":6.6584},{"match_name":"2017 EOD Warrior Foundation Match","match_date":"2017-04-29","stage_classifiercode":"99-11","member_number":"\"\"","first_name":"JASON","last_name":"BANKSTON","classification":"U","division":"LIMITED","hit_factor":6.6574},{"match_name":"Sharp Practical Shooters November  USPSA - Indoor","match_date":"2021-11-28","stage_classifiercode":"99-11","member_number":"FY14401","first_name":"PATRICK","last_name":"KELLEY","classification":"M","division":"LIMITED","hit_factor":6.6561},{"match_name":"Competitive Shooters of Lake Norman CORNELIUS Thursday Evening Indoor USPSA Pistol Match North Carolina","match_date":"2018-12-06","stage_classifiercode":"99-11","member_number":"PEN","first_name":"JOHN","last_name":"KRAUSE","classification":"U","division":"LIMITED","hit_factor":6.6519},{"match_name":"CVSC  09-25-16","match_date":"2016-09-25","stage_classifiercode":"99-11","member_number":"\"\"","first_name":"PAUL","last_name":"CHETWOOD","classification":"U","division":"LIMITED","hit_factor":6.6511},{"match_name":"SCAPSA MN05 Summer League 8","match_date":"2017-08-01","stage_classifiercode":"99-11","member_number":"TY58815","first_name":"MIKE","last_name":"VAN MEETEREN","classification":"U","division":"LIMITED","hit_factor":6.6505},{"match_name":"Ontelaunee USPSA Hose Fest","match_date":"2021-01-02","stage_classifiercode":"99-11","member_number":"A129719","first_name":"JOEL","last_name":"SCHREIBER","classification":"C","division":"LIMITED","hit_factor":6.6496},{"match_name":"Pinetucky USPSA 06-16-18","match_date":"2018-06-16","stage_classifiercode":"99-11","member_number":"A90561","first_name":"RICK","last_name":"GILDER","classification":"B","division":"LIMITED","hit_factor":6.6496},{"match_name":"SUPS USPSA 20-21 October 2018","match_date":"2018-10-20","stage_classifiercode":"99-11","member_number":"A74530","first_name":"BOB","last_name":"WOLF","classification":"B","division":"LIMITED","hit_factor":6.6493},{"match_name":"GRPC USPSA WE STOP FOR NO STORM","match_date":"2017-09-03","stage_classifiercode":"99-11","member_number":"B51","first_name":"SAMUEL","last_name":"BHARKSUWAN","classification":"B","division":"LIMITED","hit_factor":6.6489},{"match_name":"CASA USPSA  Feb 17","match_date":"2017-02-05","stage_classifiercode":"99-11","member_number":"TY92908","first_name":"DAVID","last_name":"BURNS","classification":"A","division":"LIMITED","hit_factor":6.6489},{"match_name":"IN18 SCGC USPSA 13 September  2020 ","match_date":"2020-09-13","stage_classifiercode":"99-11","member_number":"a96298","first_name":"MIKEL","last_name":"ROSS","classification":"C","division":"LIMITED","hit_factor":6.6486},{"match_name":"Steel City USPSA December 2 2017","match_date":"2017-12-02","stage_classifiercode":"99-11","member_number":"\"\"","first_name":"THOMAS","last_name":"BREWER","classification":"X","division":"LIMITED","hit_factor":6.6482},{"match_name":"NW01 April da Turd","match_date":"2018-04-04","stage_classifiercode":"99-11","member_number":"TY38663","first_name":"STEVE","last_name":"BELL","classification":"B","division":"LIMITED","hit_factor":6.6465},{"match_name":"USPSA MO21 2Alpha SBRC June 2017","match_date":"2017-06-17","stage_classifiercode":"99-11","member_number":"A41069","first_name":"JOHN","last_name":"LUNTSFORD","classification":"B","division":"LIMITED","hit_factor":6.6438},{"match_name":"Prescott 1st Saturday 8-05-17","match_date":"2017-08-05","stage_classifiercode":"99-11","member_number":"A65474","first_name":"TONY","last_name":"OWENS","classification":"C","division":"LIMITED","hit_factor":6.6438},{"match_name":"GFDS 2021 POSTAL MATCH at 17s PSC ","match_date":"2021-10-16","stage_classifiercode":"99-11","member_number":"A106861","first_name":"BOB","last_name":"ROCKEFELLER","classification":"U","division":"LIMITED","hit_factor":6.6429},{"match_name":"MAPSA 2016.04.09","match_date":"2016-04-09","stage_classifiercode":"99-11","member_number":"A86610","first_name":"RYAN","last_name":"WESTPHAL","classification":"B","division":"LIMITED","hit_factor":6.6425},{"match_name":"SFPC July USPSA Level 1 Match","match_date":"2016-07-03","stage_classifiercode":"99-11","member_number":"L3969","first_name":"JOHN","last_name":"CICOS","classification":"D","division":"LIMITED","hit_factor":6.6421},{"match_name":"RPS December 2017 USPSA Match","match_date":"2017-12-09","stage_classifiercode":"99-11","member_number":"A104282","first_name":"MATTHEW","last_name":"GROSS","classification":"C","division":"LIMITED","hit_factor":6.6421},{"match_name":"STAGE ZERO SHOOTING SUPPLY USPSA","match_date":"2020-07-16","stage_classifiercode":"99-11","member_number":"A122140","first_name":"MICHAEL","last_name":"WELCH","classification":"C","division":"LIMITED","hit_factor":6.6411},{"match_name":"OK15 USPSA at USSA","match_date":"2017-12-10","stage_classifiercode":"99-11","member_number":"A91228","first_name":"DANNY","last_name":"KEEF","classification":"C","division":"LIMITED","hit_factor":6.6384},{"match_name":"Target  Sports Central Indiana Championship","match_date":"2020-08-22","stage_classifiercode":"99-11","member_number":"A117291","first_name":"DEAN","last_name":"MAKISHIMA","classification":"C","division":"LIMITED","hit_factor":6.6351},{"match_name":"Matamoras USPSA August Match","match_date":"2017-08-27","stage_classifiercode":"99-11","member_number":"A96935","first_name":"JAMES","last_name":"MEOLA","classification":"C","division":"LIMITED","hit_factor":6.6351},{"match_name":"Shoot Gtr USPSA 10/18","match_date":"2016-10-18","stage_classifiercode":"99-11","member_number":"A88489","first_name":"ANNISTON","last_name":"BALUYOT","classification":"B","division":"LIMITED","hit_factor":6.6351},{"match_name":"BRC_20180114","match_date":"2018-01-14","stage_classifiercode":"99-11","member_number":"A62630","first_name":"ROB","last_name":"OTIS","classification":"A","division":"LIMITED","hit_factor":6.6339},{"match_name":"Prescott Action Shooters 1st Saturday USPSA 6-2-2018 ","match_date":"2018-06-03","stage_classifiercode":"99-11","member_number":"TY98416","first_name":"DANIEL","last_name":"SEALE","classification":"D","division":"LIMITED","hit_factor":6.6339},{"match_name":"ARPC USPSA Match 3-26-17","match_date":"2017-03-26","stage_classifiercode":"99-11","member_number":"A92354","first_name":"ROBERT","last_name":"PUCKETT","classification":"C","division":"LIMITED","hit_factor":6.6333},{"match_name":"Crooked Creek Pistol League - June 2016","match_date":"2016-06-25","stage_classifiercode":"99-11","member_number":"A43234","first_name":"TROY","last_name":"DUNCAN","classification":"B","division":"LIMITED","hit_factor":6.6327},{"match_name":"USPSA CM99 Special Classifier MO19 Lamar October 9 2016","match_date":"2016-10-09","stage_classifiercode":"99-11","member_number":"a85282","first_name":"RANDEE","last_name":"KAISER","classification":"B","division":"LIMITED","hit_factor":6.6327},{"match_name":"Pitcairn-Monroeville Sportsmens Club USPSA August 2017","match_date":"2017-08-05","stage_classifiercode":"99-11","member_number":"TY40651","first_name":"RON","last_name":"RODGERS","classification":"B","division":"LIMITED","hit_factor":6.632},{"match_name":"ENPS 2018 June USPSA Match","match_date":"2018-06-03","stage_classifiercode":"99-11","member_number":"A101413","first_name":"BROOKS","last_name":"RILEY","classification":"C","division":"LIMITED","hit_factor":6.6313},{"match_name":"Trigger Guard USPSA","match_date":"2016-04-02","stage_classifiercode":"99-11","member_number":"L3354","first_name":"RYAN","last_name":"DOLL","classification":"C","division":"LIMITED","hit_factor":6.6282},{"match_name":"ISPS 6/19/2016 USPSA","match_date":"2016-06-19","stage_classifiercode":"99-11","member_number":"A86642","first_name":"ROBERT","last_name":"WHITE","classification":"C","division":"LIMITED","hit_factor":6.6265},{"match_name":"Rio Salado UPPL September 2020","match_date":"2020-09-13","stage_classifiercode":"99-11","member_number":"TY116032","first_name":"JEFF","last_name":"STANLEY","classification":"C","division":"LIMITED","hit_factor":6.6242},{"match_name":"EWPSA 2016-04","match_date":"2016-04-17","stage_classifiercode":"99-11","member_number":"A87989","first_name":"BENJAMIN","last_name":"CHAMBERS","classification":"C","division":"LIMITED","hit_factor":6.6242},{"match_name":"June 2018 CAS USPSA","match_date":"2018-06-03","stage_classifiercode":"99-11","member_number":"TY89705","first_name":"BOB","last_name":"GONZALEZ","classification":"C","division":"LIMITED","hit_factor":6.6225},{"match_name":"OKCGC USPSA June 2018","match_date":"2018-06-02","stage_classifiercode":"99-11","member_number":"\"\"","first_name":"MIKE","last_name":"HOLLAND","classification":"U","division":"LIMITED","hit_factor":6.6214},{"match_name":"MS06 Team Magnolia June 2017 USPSA Match","match_date":"2017-06-04","stage_classifiercode":"99-11","member_number":"A61700","first_name":"STEVE","last_name":"ROBERTS","classification":"B","division":"LIMITED","hit_factor":6.6207},{"match_name":"Crooked Creek Pistol League - June 2016","match_date":"2016-06-25","stage_classifiercode":"99-11","member_number":"TY75462","first_name":"JASON","last_name":"HUGHES","classification":"B","division":"LIMITED","hit_factor":6.6194},{"match_name":"Crooked Creek Pistol League - June 2017","match_date":"2017-06-24","stage_classifiercode":"99-11","member_number":"A87115","first_name":"DOUGLAS","last_name":"ELLIS","classification":"B","division":"LIMITED","hit_factor":6.6187},{"match_name":"MCRC USPSA August 2018","match_date":"2018-08-11","stage_classifiercode":"99-11","member_number":"TY70556","first_name":"BRUCE","last_name":"BELVIN","classification":"B","division":"LIMITED","hit_factor":6.6185},{"match_name":"Rio Salado Hosemasters February 2021","match_date":"2021-02-27","stage_classifiercode":"99-11","member_number":"A89241","first_name":"KENDALL","last_name":"ERETH","classification":"B","division":"LIMITED","hit_factor":6.6176},{"match_name":"SMPSA 2018-01 Pistol","match_date":"2018-01-14","stage_classifiercode":"99-11","member_number":"TY94097","first_name":"STEVE","last_name":"TANNETTA","classification":"A","division":"LIMITED","hit_factor":6.6176},{"match_name":"JPPS Club Match","match_date":"2018-04-21","stage_classifiercode":"99-11","member_number":"A46855","first_name":"STEVEN","last_name":"EATON","classification":"B","division":"LIMITED","hit_factor":6.6176},{"match_name":"NW01 April da Turd","match_date":"2018-04-04","stage_classifiercode":"99-11","member_number":"A88085","first_name":"EVAN","last_name":"TISLER","classification":"B","division":"LIMITED","hit_factor":6.6154},{"match_name":"Rio Salado UPPL September 2020","match_date":"2020-09-13","stage_classifiercode":"99-11","member_number":"A120256","first_name":"DAVID","last_name":"MIERS","classification":"D","division":"LIMITED","hit_factor":6.6148},{"match_name":"Brazosland Pistoleros August 20 2017","match_date":"2017-08-20","stage_classifiercode":"99-11","member_number":"A102564","first_name":"DONALD","last_name":"POWERS","classification":"C","division":"LIMITED","hit_factor":6.6129},{"match_name":"Deadwood Boys USPSA All Classifier Match","match_date":"2016-08-07","stage_classifiercode":"99-11","member_number":"TY83392","first_name":"JON","last_name":"BARRETT","classification":"A","division":"LIMITED","hit_factor":6.6129},{"match_name":"Crooked Creek Pistol League - June 2016","match_date":"2016-06-25","stage_classifiercode":"99-11","member_number":"A89886","first_name":"DANIEL","last_name":"TUSTIN","classification":"C","division":"LIMITED","hit_factor":6.6125},{"match_name":"EAPS July 2017 USPSA","match_date":"2017-07-16","stage_classifiercode":"99-11","member_number":"A93349","first_name":"JONATHAN","last_name":"PARKER","classification":"C","division":"LIMITED","hit_factor":6.6125},{"match_name":"BHPC USPSA Monthly Match 7-8-18 IOWA","match_date":"2018-07-08","stage_classifiercode":"99-11","member_number":"A96505","first_name":"TONY","last_name":"RATH","classification":"C","division":"LIMITED","hit_factor":6.6116},{"match_name":"Springfield Tactical Shooters 04/05/2018","match_date":"2018-04-05","stage_classifiercode":"99-11","member_number":"\"\"","first_name":"JON","last_name":"PURVIANCE","classification":"\"\"","division":"LIMITED","hit_factor":6.6092},{"match_name":"Crooked Creek Pistol League - June 2017","match_date":"2017-06-24","stage_classifiercode":"99-11","member_number":"L2450","first_name":"BUD","last_name":"CONNOLLY","classification":"B","division":"LIMITED","hit_factor":6.6079},{"match_name":"PTPC April 2nd USPSA Match","match_date":"2017-04-02","stage_classifiercode":"99-11","member_number":"TY87295","first_name":"DANIEL","last_name":"REINEKING","classification":"C","division":"LIMITED","hit_factor":6.6074},{"match_name":"Prescott Action Shooters 1st Saturday USPSA 6-2-2018 ","match_date":"2018-06-03","stage_classifiercode":"99-11","member_number":"A56116","first_name":"DAVID","last_name":"MONROE","classification":"B","division":"LIMITED","hit_factor":6.6074},{"match_name":"EWPSA 2016-04","match_date":"2016-04-17","stage_classifiercode":"99-11","member_number":"54529","first_name":"TIM","last_name":"KING","classification":"B","division":"LIMITED","hit_factor":6.6069},{"match_name":"NCPS USPSA Handgun Match June 24 2018","match_date":"2018-06-24","stage_classifiercode":"99-11","member_number":"TY95382","first_name":"TONY","last_name":"CHEN","classification":"C","division":"LIMITED","hit_factor":6.6066},{"match_name":"RBGC 2017-06-24","match_date":"2017-06-24","stage_classifiercode":"99-11","member_number":"A94632","first_name":"HANNAH","last_name":"HADDEN","classification":"C","division":"LIMITED","hit_factor":6.6059},{"match_name":"SEPSA July 2017","match_date":"2017-07-08","stage_classifiercode":"99-11","member_number":"A92531","first_name":"DEAN","last_name":"WILSON","classification":"D","division":"LIMITED","hit_factor":6.6059},{"match_name":"Competitive Shooters of Lake Norman Thursday evening indoor USPSA pistol match North Carolina","match_date":"2017-08-03","stage_classifiercode":"99-11","member_number":"A-102980","first_name":"JOSEPH","last_name":"CIUCA","classification":"U","division":"LIMITED","hit_factor":6.6059},{"match_name":"North Mountain PS April","match_date":"2016-04-15","stage_classifiercode":"99-11","member_number":"TY80840","first_name":"WILL","last_name":"MELTON","classification":"C","division":"LIMITED","hit_factor":6.6038},{"match_name":"Maine Practical Shooters March 2018","match_date":"2018-03-24","stage_classifiercode":"99-11","member_number":"A82210","first_name":"JOHN","last_name":"JONES","classification":"B","division":"LIMITED","hit_factor":6.6038},{"match_name":"Griffin USPSA Match Dec 2017","match_date":"2017-12-16","stage_classifiercode":"99-11","member_number":"PEN","first_name":"JAMES","last_name":"GORDON","classification":"U","division":"LIMITED","hit_factor":6.6015},{"match_name":"Target  Sports Central Indiana Championship","match_date":"2020-08-22","stage_classifiercode":"99-11","member_number":"A62192","first_name":"JEFF","last_name":"OAKES","classification":"U","division":"LIMITED","hit_factor":6.5984},{"match_name":"CGGR July USPSA Match","match_date":"2018-07-21","stage_classifiercode":"99-11","member_number":"TY80548","first_name":"DAN","last_name":"DOIRON","classification":"B","division":"LIMITED","hit_factor":6.5977},{"match_name":"CRCPS 2020-08-08","match_date":"2020-08-08","stage_classifiercode":"99-11","member_number":"A122589","first_name":"MARK","last_name":"REPELLA","classification":"U","division":"LIMITED","hit_factor":6.5972},{"match_name":"Castlewood USPSA Sept 2020 shoot","match_date":"2020-09-26","stage_classifiercode":"99-11","member_number":"TY114813","first_name":"MICHAEL","last_name":"ANGERMEIER 2","classification":"D","division":"LIMITED","hit_factor":6.5949},{"match_name":"Hopkinton June  2016","match_date":"2016-06-04","stage_classifiercode":"99-11","member_number":"TY70926","first_name":"MICHAEL","last_name":"EISENHOWER","classification":"C","division":"LIMITED","hit_factor":6.5934},{"match_name":"RBGC 2017-06-24","match_date":"2017-06-24","stage_classifiercode":"99-11","member_number":"A97112","first_name":"BRETT","last_name":"TYLER","classification":"U","division":"LIMITED","hit_factor":6.5934},{"match_name":"PSAC 20171028","match_date":"2017-10-28","stage_classifiercode":"99-11","member_number":"A104773","first_name":"MATT","last_name":"GALLANT","classification":"U","division":"LIMITED","hit_factor":6.5934},{"match_name":"Denali September","match_date":"2018-09-07","stage_classifiercode":"99-11","member_number":"A109791","first_name":"GARRETT","last_name":"PENROSE","classification":"U","division":"LIMITED","hit_factor":6.5882},{"match_name":"Palmetto Gun Club - April 2017 USPSA","match_date":"2017-04-08","stage_classifiercode":"99-11","member_number":"L4174","first_name":"BARRY","last_name":"SOCIA","classification":"C","division":"LIMITED","hit_factor":6.5868},{"match_name":"Pardoe Sportsmens Association-WPA14-2017-10-01","match_date":"2017-10-01","stage_classifiercode":"99-11","member_number":"A91802","first_name":"STEVEN","last_name":"WESCOTT","classification":"B","division":"LIMITED","hit_factor":6.5839},{"match_name":"MVS USPSA 9-20-17","match_date":"2017-09-20","stage_classifiercode":"99-11","member_number":"A100631","first_name":"BRIAN","last_name":"HONG","classification":"C","division":"LIMITED","hit_factor":6.5823},{"match_name":"Benton Gun Club-USPSA June 28  9AM","match_date":"2020-06-28","stage_classifiercode":"99-11","member_number":"ty88683","first_name":"JERRY","last_name":"WATTS","classification":"B","division":"LIMITED","hit_factor":6.5823},{"match_name":"Dawg Valley USPSA Oct 13","match_date":"2018-10-13","stage_classifiercode":"99-11","member_number":"A112317","first_name":"STEVEN","last_name":"MCQUINN","classification":"U","division":"LIMITED","hit_factor":6.5823},{"match_name":"Maine Practical Shooters August 2016","match_date":"2016-08-27","stage_classifiercode":"99-11","member_number":"TY23169","first_name":"TED","last_name":"KAVAGE","classification":"C","division":"LIMITED","hit_factor":6.5823},{"match_name":"RBGC 2017-06-24","match_date":"2017-06-24","stage_classifiercode":"99-11","member_number":"A84202","first_name":"DOUG","last_name":"RUTLEDGE","classification":"B","division":"LIMITED","hit_factor":6.5814},{"match_name":"SFA   USPSA 2/20/2016","match_date":"2016-02-20","stage_classifiercode":"99-11","member_number":"A81703","first_name":"DAVID","last_name":"BORWICK","classification":"B","division":"LIMITED","hit_factor":6.5773},{"match_name":"Lafayette Practical Shooters - WED- June 20","match_date":"2018-06-20","stage_classifiercode":"99-11","member_number":"TY99446","first_name":"STEVEN","last_name":"RICHARDSON","classification":"C","division":"LIMITED","hit_factor":6.5744},{"match_name":"NVSA USPSA 1811","match_date":"2018-11-04","stage_classifiercode":"99-11","member_number":"FY85274","first_name":"AARON","last_name":"MOE","classification":"B","division":"LIMITED","hit_factor":6.574},{"match_name":"BPSA January 2017 USPSA","match_date":"2017-01-22","stage_classifiercode":"99-11","member_number":"A93349","first_name":"JONATHAN","last_name":"PARKER","classification":"U","division":"LIMITED","hit_factor":6.5728},{"match_name":"WSRC USPSA 11/19/2017","match_date":"2017-11-19","stage_classifiercode":"99-11","member_number":"A101790","first_name":"SCOTT","last_name":"CORRIGAN","classification":"C","division":"LIMITED","hit_factor":6.5714},{"match_name":"MISS Match 10-4-17","match_date":"2017-10-04","stage_classifiercode":"99-11","member_number":"A78070","first_name":"MARK","last_name":"SORENSEN","classification":"M","division":"LIMITED","hit_factor":6.5714},{"match_name":"Blackstone Shooting Sports May 2017 USPSA Pistol Level 1","match_date":"2017-05-09","stage_classifiercode":"99-11","member_number":"A91007","first_name":"GIL","last_name":"NARVAEZ","classification":"B","division":"LIMITED","hit_factor":6.5693},{"match_name":"USPSA MO21 2Alpha SBRC Classifier 2016","match_date":"2016-11-26","stage_classifiercode":"99-11","member_number":"A84946","first_name":"GINA","last_name":"COATS","classification":"C","division":"LIMITED","hit_factor":6.5685},{"match_name":"WSPS JUNE 2018 USPSA MATCH","match_date":"2018-06-16","stage_classifiercode":"99-11","member_number":"A111272","first_name":"TOM","last_name":"YURCHISON","classification":"U","division":"LIMITED","hit_factor":6.5668},{"match_name":"2016-02-06 USPSA at Phoenix Rod and Gun Club","match_date":"2016-02-06","stage_classifiercode":"99-11","member_number":"ty80622","first_name":"BRADLEY","last_name":"KITCHIN","classification":"C","division":"LIMITED","hit_factor":6.5651},{"match_name":"FBURG USPSA November 2020","match_date":"2020-11-01","stage_classifiercode":"99-11","member_number":"L4594","first_name":"TIM","last_name":"YAGLA","classification":"B","division":"LIMITED","hit_factor":6.5637},{"match_name":"SWGC USPSA Pistol Match - November 2021","match_date":"2021-11-06","stage_classifiercode":"99-11","member_number":"A97425","first_name":"JORDAN","last_name":"PARKER","classification":"U","division":"LIMITED","hit_factor":6.563},{"match_name":"Rankin field Sunday match Clone","match_date":"2016-07-17","stage_classifiercode":"99-11","member_number":"\"\"","first_name":"MADDUX","last_name":"LE","classification":"U","division":"LIMITED","hit_factor":6.5594},{"match_name":"WSPS AUGUST 2016 USPSA","match_date":"2016-08-20","stage_classifiercode":"99-11","member_number":"A53984","first_name":"RICK","last_name":"VAHALY","classification":"C","division":"LIMITED","hit_factor":6.5593},{"match_name":"WVPPS November 2018","match_date":"2018-11-18","stage_classifiercode":"99-11","member_number":"FY90994","first_name":"PAUL","last_name":"BENSON","classification":"C","division":"LIMITED","hit_factor":6.5574},{"match_name":"MVS ANPRACS USPSA 2-21-16","match_date":"2016-02-21","stage_classifiercode":"99-11","member_number":"TY83723","first_name":"BENJAMIN","last_name":"HIGGINS","classification":"U","division":"LIMITED","hit_factor":6.5574},{"match_name":"Danville Rifle and Pistol Club USPSA IL17 July 7 2018","match_date":"2018-07-07","stage_classifiercode":"99-11","member_number":"A102630","first_name":"NATE","last_name":"POULSON","classification":"M","division":"LIMITED","hit_factor":6.5574},{"match_name":"Devil Dog USPSA Classifier Match-Saturday Session","match_date":"2018-03-10","stage_classifiercode":"99-11","member_number":"A101609","first_name":"GREG","last_name":"TARPLEY","classification":"C","division":"LIMITED","hit_factor":6.5554},{"match_name":"MCPSL Pistol 3-10-18","match_date":"2018-03-10","stage_classifiercode":"99-11","member_number":"PEN","first_name":"MIKE","last_name":"COTT","classification":"U","division":"LIMITED","hit_factor":6.5534},{"match_name":"Pitcairn-Monroeville Sportsmens Club USPSA August 2017","match_date":"2017-08-05","stage_classifiercode":"99-11","member_number":"ty53951","first_name":"DOUG","last_name":"BEREZANSKY","classification":"B","division":"LIMITED","hit_factor":6.5534},{"match_name":"Deadwood Boys USPSA All Classifier Match","match_date":"2016-08-07","stage_classifiercode":"99-11","member_number":"A94290","first_name":"CODY","last_name":"WILLIAMSON","classification":"X","division":"LIMITED","hit_factor":6.5534},{"match_name":"Douglas Ridge USPSA March 7","match_date":"2020-03-07","stage_classifiercode":"99-11","member_number":"TY84121","first_name":"GABOR","last_name":"MAGONY","classification":"M","division":"LIMITED","hit_factor":6.5476},{"match_name":"MRPC OHS02 042218","match_date":"2018-04-21","stage_classifiercode":"99-11","member_number":"A110770","first_name":"THOMAS","last_name":"MAKSYMOWSKI","classification":"U","division":"LIMITED","hit_factor":6.5445},{"match_name":"RPS November 2018 USPSA Match","match_date":"2018-11-10","stage_classifiercode":"99-11","member_number":"L3700","first_name":"NATHAN","last_name":"CARTER","classification":"M","division":"LIMITED","hit_factor":6.5436},{"match_name":"Payson Practical Shooters USPSA Jan 2 2021","match_date":"2021-01-02","stage_classifiercode":"99-11","member_number":"TY109112","first_name":"JASON","last_name":"TUTAY","classification":"U","division":"LIMITED","hit_factor":6.5421},{"match_name":"ORPCI USPSA Friday 2021.07.16","match_date":"2021-07-16","stage_classifiercode":"99-11","member_number":"A57495","first_name":"LEWIS","last_name":"HAMBLIN","classification":"","division":"LIMITED","hit_factor":6.5409},{"match_name":"APSC 4th Annual Holiday Hosefest USPSA Match 12-02-17","match_date":"2017-12-02","stage_classifiercode":"99-11","member_number":"A90282","first_name":"MICHAEL","last_name":"MADDOX","classification":"C","division":"LIMITED","hit_factor":6.5385},{"match_name":"Baps March Uspsa","match_date":"2016-03-19","stage_classifiercode":"99-11","member_number":"TY51892","first_name":"ROBIN","last_name":"WOODS","classification":"B","division":"LIMITED","hit_factor":6.5367},{"match_name":"WVRPC USPSA 1APR2017 CLASSIFIER","match_date":"2017-04-01","stage_classifiercode":"99-11","member_number":"\"\"","first_name":"JAMES","last_name":"PURDY","classification":"U","division":"LIMITED","hit_factor":6.5359},{"match_name":"Dundee Practical Shooters - Oct 27 2018","match_date":"2018-10-27","stage_classifiercode":"99-11","member_number":"A106116","first_name":"GEOFFREY","last_name":"PESTES","classification":"C","division":"LIMITED","hit_factor":6.5359},{"match_name":"CRC/SVPS AUGUST  2018","match_date":"2018-08-17","stage_classifiercode":"99-11","member_number":"A113361","first_name":"SAM","last_name":"TUCKER","classification":"U","division":"LIMITED","hit_factor":6.5359},{"match_name":"CSoS Feb2016 Match","match_date":"2016-02-21","stage_classifiercode":"99-11","member_number":"A93719","first_name":"JOHN","last_name":"WESTBOOK","classification":"U","division":"LIMITED","hit_factor":6.535},{"match_name":"Range54 USPSA","match_date":"2018-05-04","stage_classifiercode":"99-11","member_number":"ty47716","first_name":"ANTHONY","last_name":"NIXON","classification":"A","division":"LIMITED","hit_factor":6.5341},{"match_name":"WVPPS November 2018","match_date":"2018-11-18","stage_classifiercode":"99-11","member_number":"FY92174","first_name":"BRIAN","last_name":"LACY","classification":"B","division":"LIMITED","hit_factor":6.5333},{"match_name":"PBR USPSA Classifier Match","match_date":"2018-06-11","stage_classifiercode":"99-11","member_number":"A110203","first_name":"JEFF","last_name":"CORDERO","classification":"U","division":"LIMITED","hit_factor":6.5327},{"match_name":"Springfield Tactical Shooters 05/06/2021","match_date":"2021-05-06","stage_classifiercode":"99-11","member_number":"A129727","first_name":"MATHIEU","last_name":"ROBILLARD","classification":"","division":"LIMITED","hit_factor":6.5306},{"match_name":"BA USPSA Jun 17-2017","match_date":"2017-06-11","stage_classifiercode":"99-11","member_number":"A85584","first_name":"CHARLES","last_name":"YEAGER","classification":"A","division":"LIMITED","hit_factor":6.5306},{"match_name":"Ontelaunee USPSA  July 2018","match_date":"2018-07-29","stage_classifiercode":"99-11","member_number":"TY70604","first_name":"RYAN","last_name":"FRANCIA","classification":"C","division":"LIMITED","hit_factor":6.5296},{"match_name":"17s PSC - Go Fast Don’t Suck 2020 Spring Postal Match (USPSA)","match_date":"2020-05-16","stage_classifiercode":"99-11","member_number":"A114948","first_name":"AIR","last_name":"SOUKHAMNEUT","classification":"U","division":"LIMITED","hit_factor":6.5274},{"match_name":"GRPC USPSA WE STOP FOR NO STORM","match_date":"2017-09-03","stage_classifiercode":"99-11","member_number":"TY97871","first_name":"ROBB","last_name":"STARR","classification":"D","division":"LIMITED","hit_factor":6.5265},{"match_name":"Dundee USPSA Feb 2016","match_date":"2016-02-27","stage_classifiercode":"99-11","member_number":"TY55787","first_name":"VINH","last_name":"HOANG","classification":"M","division":"LIMITED","hit_factor":6.5253},{"match_name":"PSAC 20171028","match_date":"2017-10-28","stage_classifiercode":"99-11","member_number":"A88191","first_name":"DAVID","last_name":"BEEBE","classification":"U","division":"LIMITED","hit_factor":6.5243},{"match_name":"Richmond Hot Shots April 14-15-2018 USPSA Pistol Match","match_date":"2018-04-14","stage_classifiercode":"99-11","member_number":"A50508","first_name":"PATRICK","last_name":"CLARK","classification":"B","division":"LIMITED","hit_factor":6.5217},{"match_name":"Grandbaggers August 2017","match_date":"2017-08-03","stage_classifiercode":"99-11","member_number":"\"\"","first_name":"RICK","last_name":"LAKE","classification":"B","division":"LIMITED","hit_factor":6.5217},{"match_name":"Brothers N Arms December 2018 USPSA Match","match_date":"2018-12-15","stage_classifiercode":"99-11","member_number":"FY95567","first_name":"PAUL","last_name":"HARRIS","classification":"C","division":"LIMITED","hit_factor":6.5191},{"match_name":"JPPS Club Match","match_date":"2018-04-21","stage_classifiercode":"99-11","member_number":"A79446","first_name":"BEN","last_name":"BLANKENSHIP","classification":"B","division":"LIMITED","hit_factor":6.5189},{"match_name":"MSSA USPSA June  10 2017","match_date":"2017-06-10","stage_classifiercode":"99-11","member_number":"A101642","first_name":"MATTHEW","last_name":"RODGERS","classification":"B","division":"LIMITED","hit_factor":6.5156},{"match_name":"CVSC  09-25-16","match_date":"2016-09-25","stage_classifiercode":"99-11","member_number":"A73456","first_name":"JORDAN","last_name":"HALL","classification":"A","division":"LIMITED","hit_factor":6.5147},{"match_name":"Griffin USPSA Match Jan 21 2017","match_date":"2017-01-21","stage_classifiercode":"99-11","member_number":"\"\"","first_name":"JOHN","last_name":"RAMSEY","classification":"U","division":"LIMITED","hit_factor":6.5147},{"match_name":"Shongum Pistol November 2015","match_date":"2015-11-07","stage_classifiercode":"99-11","member_number":"A76739","first_name":"EDUARDO","last_name":"BIANZON","classification":"C","division":"LIMITED","hit_factor":6.5111},{"match_name":"Pelham USPSA 2016-09-18","match_date":"2016-09-18","stage_classifiercode":"99-11","member_number":"TY54685","first_name":"BRENT","last_name":"CARLTON","classification":"U","division":"LIMITED","hit_factor":6.5104},{"match_name":"CRCPS 2021-08-14","match_date":"2021-08-14","stage_classifiercode":"99-11","member_number":"A129162","first_name":"CHRIS","last_name":"ANDREWS","classification":"\"\"","division":"LIMITED","hit_factor":6.5095},{"match_name":"11 March Classifier Match","match_date":"2018-03-10","stage_classifiercode":"99-11","member_number":"A103088","first_name":"TROY","last_name":"JOHNSON","classification":"U","division":"LIMITED","hit_factor":6.5081},{"match_name":"ARPC USPSA Match 8-23-20","match_date":"2020-08-23","stage_classifiercode":"99-11","member_number":"TY109506","first_name":"SHANE","last_name":"HAMMOND","classification":"C","division":"LIMITED","hit_factor":6.5081},{"match_name":"RSPP 3rd Saturday November 2016","match_date":"2016-11-19","stage_classifiercode":"99-11","member_number":"TY95703","first_name":"GEORGE","last_name":"LOVE","classification":"C","division":"LIMITED","hit_factor":6.5068},{"match_name":"ENPS 2018 June USPSA Match","match_date":"2018-06-03","stage_classifiercode":"99-11","member_number":"A90387","first_name":"JOHN","last_name":"GASKO","classification":"B","division":"LIMITED","hit_factor":6.5064},{"match_name":"FSA-USPSA-03-11-2018","match_date":"2018-03-11","stage_classifiercode":"99-11","member_number":"a93246","first_name":"MCKENNA","last_name":"BURLESON","classification":"C","division":"LIMITED","hit_factor":6.5051},{"match_name":"SWGC USPSA Pistol Match - November 2021","match_date":"2021-11-06","stage_classifiercode":"99-11","member_number":"FY77480","first_name":"GORDON","last_name":"SNADEN","classification":"B","division":"LIMITED","hit_factor":6.502},{"match_name":"17s PSC - Go Fast Don’t Suck 2020 Spring Postal Match (USPSA)","match_date":"2020-05-16","stage_classifiercode":"99-11","member_number":"FY85092","first_name":"MICHAEL","last_name":"WOODLAND","classification":"B","division":"LIMITED","hit_factor":6.5},{"match_name":"Benton Gun Club-USPSA March 25 2018","match_date":"2018-03-25","stage_classifiercode":"99-11","member_number":"A96080","first_name":"JAMES","last_name":"GREGORY","classification":"U","division":"LIMITED","hit_factor":6.5},{"match_name":"Maine Practical Shooters February 2020","match_date":"2020-02-22","stage_classifiercode":"99-11","member_number":"A60271","first_name":"JASON","last_name":"LONGLEY","classification":"M","division":"LIMITED","hit_factor":6.5},{"match_name":"Castlewood USPSA Sept 2020 shoot","match_date":"2020-09-26","stage_classifiercode":"99-11","member_number":"Ty69964","first_name":"JEFF","last_name":"BATTY","classification":"B","division":"LIMITED","hit_factor":6.4987},{"match_name":"GAS July 7th Special Classifier","match_date":"2018-07-07","stage_classifiercode":"99-11","member_number":"A101628","first_name":"CLINT","last_name":"MARCOTT","classification":"C","division":"LIMITED","hit_factor":6.4987},{"match_name":"2018-05 Bone Creek USPSA","match_date":"2018-05-06","stage_classifiercode":"99-11","member_number":"\"\"","first_name":"JONATHAN","last_name":"BOARDMAN","classification":"U","division":"LIMITED","hit_factor":6.4972},{"match_name":"Deadwood Boys USPSA All Classifier Match - 29 July 2018","match_date":"2018-07-29","stage_classifiercode":"99-11","member_number":"TY75469","first_name":"OSCAR","last_name":"ACENCIO","classification":"C","division":"LIMITED","hit_factor":6.4935},{"match_name":"GAS June Special Classifier","match_date":"2017-06-03","stage_classifiercode":"99-11","member_number":"A102201","first_name":"WADE","last_name":"TINGEY","classification":"U","division":"LIMITED","hit_factor":6.4935},{"match_name":"WVPPS November 2018","match_date":"2018-11-18","stage_classifiercode":"99-11","member_number":"TY104591","first_name":"DAVID","last_name":"HEUSS","classification":"B","division":"LIMITED","hit_factor":6.4919},{"match_name":"LdF USPSA Match May 12 2018","match_date":"2018-05-12","stage_classifiercode":"99-11","member_number":"TY78824","first_name":"MATTHEW","last_name":"CLARK","classification":"G","division":"LIMITED","hit_factor":6.4909},{"match_name":"LdF USPSA Match May 12 2018","match_date":"2018-05-12","stage_classifiercode":"99-11","member_number":"TY95545","first_name":"ANDY","last_name":"ONGUN","classification":"C","division":"LIMITED","hit_factor":6.4901},{"match_name":"PTPC  February 7th USPSA Match","match_date":"2016-02-07","stage_classifiercode":"99-11","member_number":"TY24302","first_name":"TIM","last_name":"KARAVISH","classification":"B","division":"LIMITED","hit_factor":6.489},{"match_name":"CSA Coalfield Shooters Association USPSA March 2020","match_date":"2020-03-08","stage_classifiercode":"99-11","member_number":"\"\"","first_name":"BRADLEY","last_name":"PERRY","classification":"U","division":"LIMITED","hit_factor":6.489},{"match_name":"FBURG March Level I USPSA","match_date":"2016-03-06","stage_classifiercode":"99-11","member_number":"A72815","first_name":"BRETT","last_name":"DAVENPORT","classification":"A","division":"LIMITED","hit_factor":6.4873},{"match_name":"MVS ANPRACS USPSA 2-21-16","match_date":"2016-02-21","stage_classifiercode":"99-11","member_number":"FY47478","first_name":"ALLEN","last_name":"CHAPMAN","classification":"C","division":"LIMITED","hit_factor":6.4865},{"match_name":"CISSA USPSA Classier Match Dec 8th 2018","match_date":"2018-12-08","stage_classifiercode":"99-11","member_number":"TY108435","first_name":"EDDIE","last_name":"MCLEAN","classification":"\"\"","division":"LIMITED","hit_factor":6.4865},{"match_name":"Hopkinton June  2016","match_date":"2016-06-04","stage_classifiercode":"99-11","member_number":"A79813","first_name":"JOEL","last_name":"PENNEY","classification":"U","division":"LIMITED","hit_factor":6.4857},{"match_name":"CSA Coalfield Shooters Association USPSA March 2020","match_date":"2020-03-08","stage_classifiercode":"99-11","member_number":"A118213","first_name":"MICHAEL","last_name":"CHAPMAN","classification":"U","division":"LIMITED","hit_factor":6.4851},{"match_name":"OK15 USPSA at USSA","match_date":"2017-12-10","stage_classifiercode":"99-11","member_number":"\"\"","first_name":"TYLER","last_name":"HAGA","classification":"U","division":"LIMITED","hit_factor":6.4826},{"match_name":"USPSA MO21 2Alpha SBRC Classifier 2016","match_date":"2016-11-26","stage_classifiercode":"99-11","member_number":"\"\"","first_name":"GREG","last_name":"YEN","classification":"U","division":"LIMITED","hit_factor":6.4815},{"match_name":"SSS USPSA February 2020","match_date":"2020-02-16","stage_classifiercode":"99-11","member_number":"FY-85092","first_name":"MICHAEL","last_name":"WOODLAND","classification":"B (B Class)","division":"LIMITED","hit_factor":6.4815},{"match_name":"GRB JAN USPSA  at Cav","match_date":"2017-01-21","stage_classifiercode":"99-11","member_number":"\"\"","first_name":"CHRIS","last_name":"DYE","classification":"C","division":"LIMITED","hit_factor":6.4804},{"match_name":"CASA USPSA December 3  2017","match_date":"2017-12-03","stage_classifiercode":"99-11","member_number":"TY82570","first_name":"LARRY","last_name":"VINT","classification":"B","division":"LIMITED","hit_factor":6.4801},{"match_name":"SAPS Match 1/16/2021","match_date":"2021-01-16","stage_classifiercode":"99-11","member_number":"ty65942","first_name":"MARK","last_name":"BOOTH","classification":"B","division":"LIMITED","hit_factor":6.4792},{"match_name":"Armory Indoor League","match_date":"2018-02-08","stage_classifiercode":"99-11","member_number":"A99246","first_name":"ADAM","last_name":"RISER","classification":"U","division":"LIMITED","hit_factor":6.4777},{"match_name":"CASA USPSA December 3  2017","match_date":"2017-12-03","stage_classifiercode":"99-11","member_number":"A92527","first_name":"JAKE","last_name":"NOBLE","classification":"B","division":"LIMITED","hit_factor":6.4757},{"match_name":"PTPC  February 7th USPSA Match","match_date":"2016-02-07","stage_classifiercode":"99-11","member_number":"TY75820","first_name":"ERIC","last_name":"LINDEMAN","classification":"C","division":"LIMITED","hit_factor":6.4748},{"match_name":"FBURG March Level I USPSA","match_date":"2016-03-06","stage_classifiercode":"99-11","member_number":"TY72189","first_name":"KELLY","last_name":"COBEAN","classification":"A","division":"LIMITED","hit_factor":6.4715},{"match_name":"Prescott 1 st Saturday 12-03-2016","match_date":"2016-12-03","stage_classifiercode":"99-11","member_number":"A93043","first_name":"BILL","last_name":"GREENLAND","classification":"C","division":"LIMITED","hit_factor":6.4713},{"match_name":"17s PSC - Go Fast Don’t Suck 2020 Spring Postal Match (USPSA)","match_date":"2020-05-16","stage_classifiercode":"99-11","member_number":"A108306","first_name":"ANDREW","last_name":"BRANNING","classification":"X","division":"LIMITED","hit_factor":6.4671},{"match_name":"WVRPC USPSA 1SEPT2018","match_date":"2018-09-01","stage_classifiercode":"99-11","member_number":"TY54958","first_name":"MARK","last_name":"BUTLER","classification":"C","division":"LIMITED","hit_factor":6.4671},{"match_name":"Maine Practical Shooters March 2018","match_date":"2018-03-24","stage_classifiercode":"99-11","member_number":"TY50805","first_name":"DANIEL","last_name":"WORCESTER","classification":"B","division":"LIMITED","hit_factor":6.466},{"match_name":"ISPS 6/19/2016 USPSA","match_date":"2016-06-19","stage_classifiercode":"99-11","member_number":"A89573","first_name":"DEREK","last_name":"WEBB","classification":"D","division":"LIMITED","hit_factor":6.4639},{"match_name":"Springfield Tactical Shooters 05/06/2021","match_date":"2021-05-06","stage_classifiercode":"99-11","member_number":"TY18223","first_name":"JEFFREY","last_name":"RETTIG","classification":"B","division":"LIMITED","hit_factor":6.463},{"match_name":"Competitive Shooters of Lake Norman CORNELIUS Thursday Evening Indoor USPSA Pistol Match North Carolina","match_date":"2018-12-06","stage_classifiercode":"99-11","member_number":"A109144","first_name":"MARK","last_name":"SCHULTE","classification":"C","division":"LIMITED","hit_factor":6.4626},{"match_name":"TMGN April 5 USPSA Classifiers Match","match_date":"2018-04-05","stage_classifiercode":"99-11","member_number":"A99935","first_name":"EMIL","last_name":"PUIZINA","classification":"\"\"","division":"LIMITED","hit_factor":6.462},{"match_name":"SKSC USPSA April 2018 Match","match_date":"2018-04-21","stage_classifiercode":"99-11","member_number":"\"\"","first_name":"RYAN","last_name":"KILPATRICK","classification":"\"\"","division":"LIMITED","hit_factor":6.4611},{"match_name":"Brazosland Pistoleros August 20 2017","match_date":"2017-08-20","stage_classifiercode":"99-11","member_number":"A98517","first_name":"CHRIS","last_name":"WHITT","classification":"C","division":"LIMITED","hit_factor":6.4593},{"match_name":"Matamoras USPSA August Match","match_date":"2017-08-27","stage_classifiercode":"99-11","member_number":"A101690","first_name":"MIKE","last_name":"ACCETTA","classification":"U","division":"LIMITED","hit_factor":6.4593},{"match_name":"PCSI - September 2017 USPSA","match_date":"2017-09-02","stage_classifiercode":"99-11","member_number":"A57535","first_name":"JASON","last_name":"CONRAD","classification":"B","division":"LIMITED","hit_factor":6.4572},{"match_name":"FBPPC AUGUST 2016 IPSC MATCH","match_date":"2016-08-13","stage_classifiercode":"99-11","member_number":"PEN","first_name":"JESUS","last_name":"MUNIZ","classification":"U","division":"LIMITED","hit_factor":6.457},{"match_name":"Palmetto Gun Club - April 2017 USPSA","match_date":"2017-04-08","stage_classifiercode":"99-11","member_number":"A62570","first_name":"MIKE","last_name":"ADAMS","classification":"B","division":"LIMITED","hit_factor":6.457},{"match_name":"Hose Monster Action ","match_date":"2020-07-19","stage_classifiercode":"99-11","member_number":"FY95503","first_name":"KEVIN","last_name":"ALLISON","classification":"B","division":"LIMITED","hit_factor":6.4516},{"match_name":"USPSA - Bridgeville DE - lvl 1 Clone","match_date":"2018-07-01","stage_classifiercode":"99-11","member_number":"\"\"","first_name":"TERRY","last_name":"STEWART","classification":"U","division":"LIMITED","hit_factor":6.4516},{"match_name":"WSRC USPSA 11/19/2017","match_date":"2017-11-19","stage_classifiercode":"99-11","member_number":"A105996","first_name":"BILL","last_name":"MILLER","classification":"U","division":"LIMITED","hit_factor":6.4516},{"match_name":"2016-05-07 USPSA at Phoenix Rod and Gun Club","match_date":"2016-05-07","stage_classifiercode":"99-11","member_number":"a89358","first_name":"TOM","last_name":"KELLER","classification":"C","division":"LIMITED","hit_factor":6.4516},{"match_name":"Prescott 1 st Saturday 12-03-2016","match_date":"2016-12-03","stage_classifiercode":"99-11","member_number":"TY89865","first_name":"SETH","last_name":"BLAIR","classification":"Unclassified","division":"LIMITED","hit_factor":6.4516},{"match_name":"USPSA MO21 2Alpha SBRC March 2018","match_date":"2018-03-24","stage_classifiercode":"99-11","member_number":"A14123","first_name":"BRIAN","last_name":"PAYNE","classification":"B","division":"LIMITED","hit_factor":6.4516},{"match_name":"Competitive Shooters of Lake Norman CORNELIUS Thursday Evening Indoor USPSA Pistol Match North Carolina","match_date":"2018-12-06","stage_classifiercode":"99-11","member_number":"A103468","first_name":"JIM","last_name":"JARRETT","classification":"C","division":"LIMITED","hit_factor":6.4516},{"match_name":"LGCSEMPS April 2018 Special Classifier","match_date":"2018-04-08","stage_classifiercode":"99-11","member_number":"A84893","first_name":"RYAN","last_name":"KRILL","classification":"C","division":"LIMITED","hit_factor":6.4516},{"match_name":"SLPSA July USPSA match","match_date":"2018-07-21","stage_classifiercode":"99-11","member_number":"A99024","first_name":"FELIPE","last_name":"CERVANTES","classification":"B","division":"LIMITED","hit_factor":6.4516},{"match_name":"CVSC 07-29-2018","match_date":"2018-07-29","stage_classifiercode":"99-11","member_number":"A108446","first_name":"VICTOR","last_name":"THAO","classification":"U","division":"LIMITED","hit_factor":6.4516},{"match_name":"Pitcairn-Monroeville Sportsmens Club USPSA August 2017","match_date":"2017-08-05","stage_classifiercode":"99-11","member_number":"a76954","first_name":"DAN","last_name":"PACELLA","classification":"M","division":"LIMITED","hit_factor":6.4481},{"match_name":"RangeMasters 5-31-2018","match_date":"2018-05-31","stage_classifiercode":"99-11","member_number":"TY43045","first_name":"BOB","last_name":"ALLMAN","classification":"B","division":"LIMITED","hit_factor":6.4477},{"match_name":"WNPL USPSA - Nov 2017","match_date":"2017-11-05","stage_classifiercode":"99-11","member_number":"TY50453","first_name":"ARNOLD","last_name":"PETERSON","classification":"M","division":"LIMITED","hit_factor":6.4463},{"match_name":"Brazosland Pistoleros USPSA - Sunday August 8th","match_date":"2021-08-08","stage_classifiercode":"99-11","member_number":"A102903","first_name":"EDWIN","last_name":"BUCHWALTER","classification":"C","division":"LIMITED","hit_factor":6.4444},{"match_name":"Danville Rifle and Pistol Club USPSA IL17 July 7 2018","match_date":"2018-07-07","stage_classifiercode":"99-11","member_number":"\"\"","first_name":"JIM","last_name":"DARLING","classification":"U","division":"LIMITED","hit_factor":6.443},{"match_name":"PRG 2017 Classifier Match","match_date":"2017-02-19","stage_classifiercode":"99-11","member_number":"A98726","first_name":"CALEB","last_name":"BAER","classification":"C","division":"LIMITED","hit_factor":6.4426},{"match_name":"WNPL USPSA - Nov 2017","match_date":"2017-11-05","stage_classifiercode":"99-11","member_number":"A106137","first_name":"MICHAEL","last_name":"CLARK","classification":"U","division":"LIMITED","hit_factor":6.4422},{"match_name":"Palmetto Gun Club - April 2017 USPSA","match_date":"2017-04-08","stage_classifiercode":"99-11","member_number":"FY81806","first_name":"ANDREW","last_name":"CRENSHAW","classification":"B","division":"LIMITED","hit_factor":6.4412},{"match_name":"LCHG May USPSA","match_date":"2017-05-21","stage_classifiercode":"99-11","member_number":"L3409","first_name":"BRUCE","last_name":"REID","classification":"B","division":"LIMITED","hit_factor":6.4389},{"match_name":"CCPL 01102016 ALL CLASSIFIER MATCH","match_date":"2016-01-10","stage_classifiercode":"99-11","member_number":"\"\"","first_name":"TOM","last_name":"ROWE","classification":"U","division":"LIMITED","hit_factor":6.4384},{"match_name":"WVPPS May 2021","match_date":"2021-05-16","stage_classifiercode":"99-11","member_number":"A113489","first_name":"MICHELLE","last_name":"EHRICH","classification":"C","division":"LIMITED","hit_factor":6.4384},{"match_name":"OKCGC USPSA June 2018","match_date":"2018-06-02","stage_classifiercode":"99-11","member_number":"TY89882","first_name":"TRAVIS","last_name":"LOWRY","classification":"C","division":"LIMITED","hit_factor":6.4368},{"match_name":"Rankin field Sunday match Clone","match_date":"2016-07-17","stage_classifiercode":"99-11","member_number":"\"\"","first_name":"CHRIS","last_name":"KIMES","classification":"B","division":"LIMITED","hit_factor":6.4356},{"match_name":"MPSA 021817","match_date":"2017-02-18","stage_classifiercode":"99-11","member_number":"FY39690","first_name":"MAC","last_name":"HART","classification":"B","division":"LIMITED","hit_factor":6.4356},{"match_name":"BPSA January 2017 USPSA","match_date":"2017-01-22","stage_classifiercode":"99-11","member_number":"FY49991","first_name":"CHRIS","last_name":"LEWIS","classification":"B","division":"LIMITED","hit_factor":6.4343},{"match_name":"AGC_20170903","match_date":"2017-09-03","stage_classifiercode":"99-11","member_number":"TY94756","first_name":"PAUL","last_name":"HAUSER","classification":"B","division":"LIMITED","hit_factor":6.4336},{"match_name":"Pinetucky USPSA 04-23-16","match_date":"2016-04-23","stage_classifiercode":"99-11","member_number":"ty60619","first_name":"JESUS","last_name":"HERNANDEZ","classification":"C","division":"LIMITED","hit_factor":6.4334},{"match_name":"WVPPS November 2020","match_date":"2020-11-15","stage_classifiercode":"99-11","member_number":"FY92174","first_name":"BRIAN","last_name":"LACY","classification":"B","division":"LIMITED","hit_factor":6.4304},{"match_name":"Blackstone Shooting Sports Snow Days January 2017 USPSA Level  1","match_date":"2017-01-08","stage_classifiercode":"99-11","member_number":"TY80548","first_name":"DAN","last_name":"DOIRON","classification":"C","division":"LIMITED","hit_factor":6.4294},{"match_name":"EIPS  4/20/2017","match_date":"2017-04-20","stage_classifiercode":"99-11","member_number":"\"\"","first_name":"DREW","last_name":"GADBERRY","classification":"U","division":"LIMITED","hit_factor":6.4286},{"match_name":"Hawkeye Gun Club March 19th 2016 Match","match_date":"2016-03-19","stage_classifiercode":"99-11","member_number":"A85039","first_name":"NEIL","last_name":"OWENS","classification":"C","division":"LIMITED","hit_factor":6.4277},{"match_name":"BRSP Tuesday Night USPSA Match - May 15","match_date":"2018-05-16","stage_classifiercode":"99-11","member_number":"A104784","first_name":"CODY","last_name":"HOLLAND","classification":"C","division":"LIMITED","hit_factor":6.4263},{"match_name":"Brothers N Arms September 2017 USPSA Match","match_date":"2017-09-16","stage_classifiercode":"99-11","member_number":"A95567","first_name":"PAUL","last_name":"HARRIS","classification":"C","division":"LIMITED","hit_factor":6.4262},{"match_name":"Lefthanders Gun Club Practical Shooters October","match_date":"2017-09-30","stage_classifiercode":"99-11","member_number":"A96810","first_name":"JASON","last_name":"PALMER","classification":"B","division":"LIMITED","hit_factor":6.4252},{"match_name":"MAPSA 2016.10.08","match_date":"2016-10-08","stage_classifiercode":"99-11","member_number":"A86132","first_name":"DAN","last_name":"BOYLES","classification":"U","division":"LIMITED","hit_factor":6.4252},{"match_name":"Brazosland Pistoleros January 17 2016--USPSA","match_date":"2016-01-17","stage_classifiercode":"99-11","member_number":"\"\"","first_name":"CLINT","last_name":"DAVIS","classification":"U","division":"LIMITED","hit_factor":6.4234},{"match_name":"OK Corral USPSA Classifier Match Feb 18 2017","match_date":"2017-02-18","stage_classifiercode":"99-11","member_number":"A86123","first_name":"DARREN","last_name":"GORDON","classification":"\"\"","division":"LIMITED","hit_factor":6.4232},{"match_name":"Colonial RPC Inaugural USPSA Match","match_date":"2018-04-07","stage_classifiercode":"99-11","member_number":"TY-93686","first_name":"CLIFF","last_name":"AVERSANO JR","classification":"B","division":"LIMITED","hit_factor":6.4232},{"match_name":"Shasta Shooters 2018 June Special Classifier","match_date":"2018-06-09","stage_classifiercode":"99-11","member_number":"TY77203","first_name":"VIC","last_name":"FINK","classification":"C","division":"LIMITED","hit_factor":6.423},{"match_name":"SLPSA July USPSA match","match_date":"2018-07-21","stage_classifiercode":"99-11","member_number":"TY72404","first_name":"DAVE","last_name":"MOORE","classification":"C","division":"LIMITED","hit_factor":6.422},{"match_name":"Pardoe Sportsmens Association-WPA14-2017-10-01","match_date":"2017-10-01","stage_classifiercode":"99-11","member_number":"FY65487","first_name":"BRETTON","last_name":"REBOL","classification":"B","division":"LIMITED","hit_factor":6.4208},{"match_name":"APSC USPSA 10-06-18","match_date":"2018-10-06","stage_classifiercode":"99-11","member_number":"TY34722","first_name":"LARRY","last_name":"SELLERS","classification":"M","division":"LIMITED","hit_factor":6.4189},{"match_name":"MISS Match 10-4-17","match_date":"2017-10-04","stage_classifiercode":"99-11","member_number":"TY78070","first_name":"MICHAEL","last_name":"CALDERISI","classification":"A","division":"LIMITED","hit_factor":6.4189},{"match_name":"ARPC USPSA Match 5-27-18","match_date":"2018-05-27","stage_classifiercode":"99-11","member_number":"TY53943","first_name":"CHUCK","last_name":"DELANEY","classification":"M","division":"LIMITED","hit_factor":6.4177},{"match_name":"LdF USPSA Match May 12 2018","match_date":"2018-05-12","stage_classifiercode":"99-11","member_number":"L2320","first_name":"WALT","last_name":"SCHMIDTKE","classification":"C","division":"LIMITED","hit_factor":6.4177},{"match_name":"Maine Practical Shooters March 2018","match_date":"2018-03-24","stage_classifiercode":"99-11","member_number":"TY85228","first_name":"BILL","last_name":"LAFRENIERE","classification":"B","division":"LIMITED","hit_factor":6.4165},{"match_name":"Brothers N Arms December 2018 USPSA Match","match_date":"2018-12-15","stage_classifiercode":"99-11","member_number":"TY36956","first_name":"CLIFF","last_name":"GADDIS","classification":"B","division":"LIMITED","hit_factor":6.4133},{"match_name":"BUAS December Match","match_date":"2016-12-11","stage_classifiercode":"99-11","member_number":"a98726","first_name":"CALEB","last_name":"BAER","classification":"C","division":"LIMITED","hit_factor":6.412},{"match_name":"EAPS July 2017 USPSA","match_date":"2017-07-16","stage_classifiercode":"99-11","member_number":"A93094","first_name":"TREVOR","last_name":"CAZES","classification":"U","division":"LIMITED","hit_factor":6.4103},{"match_name":"Pinetucky USPSA 06-16-18","match_date":"2018-06-16","stage_classifiercode":"99-11","member_number":"A99812","first_name":"NANCY","last_name":"GRUNNET","classification":"C","division":"LIMITED","hit_factor":6.4085},{"match_name":"MPSA 070718 USPSA","match_date":"2018-07-07","stage_classifiercode":"99-11","member_number":"TY91659","first_name":"PETER","last_name":"KEOLA","classification":"C","division":"LIMITED","hit_factor":6.4073},{"match_name":"CFRPC April USPSA Match","match_date":"2018-04-15","stage_classifiercode":"99-11","member_number":"A83209","first_name":"PETE","last_name":"BANDSTRA","classification":"C","division":"LIMITED","hit_factor":6.4073},{"match_name":"West Coast IPSC","match_date":"2018-07-22","stage_classifiercode":"99-11","member_number":"L4372","first_name":"XIAOZAO","last_name":"ZHAO","classification":"\"\"","division":"LIMITED","hit_factor":6.4073},{"match_name":"LdF USPSA Match January 25 2020","match_date":"2020-01-25","stage_classifiercode":"99-11","member_number":"TY86631","first_name":"MARK","last_name":"CRAFTS","classification":"C","division":"LIMITED","hit_factor":6.407},{"match_name":"Rankin Field Sunday USPSA","match_date":"2018-04-15","stage_classifiercode":"99-11","member_number":"TY109346","first_name":"MADDUX","last_name":"LE","classification":"U","division":"LIMITED","hit_factor":6.4057},{"match_name":"USPSA BGSL Jan 4th Weekend ","match_date":"2020-01-25","stage_classifiercode":"99-11","member_number":"a108955","first_name":"JUSTIN","last_name":"SKAGGS","classification":"U","division":"LIMITED","hit_factor":6.4028},{"match_name":"SUPS All Classifier Match March 1718 2018","match_date":"2018-03-17","stage_classifiercode":"99-11","member_number":"TY88859","first_name":"MICHAEL","last_name":"KELLY","classification":"C","division":"LIMITED","hit_factor":6.4024},{"match_name":"ORPCI 2018.03.31 USPSA Special","match_date":"2018-03-31","stage_classifiercode":"99-11","member_number":"A96318","first_name":"TYLER","last_name":"HUFF","classification":"U","division":"LIMITED","hit_factor":6.402},{"match_name":"Bridgeville - USPSA - Dec","match_date":"2020-12-06","stage_classifiercode":"99-11","member_number":"A117138","first_name":"MICHAEL","last_name":"THOMPSON","classification":"U","division":"LIMITED","hit_factor":6.3978},{"match_name":"San Juan Shooters ","match_date":"2017-07-08","stage_classifiercode":"99-11","member_number":"\"\"","first_name":"IAN","last_name":"KNEZ","classification":"U","division":"LIMITED","hit_factor":6.3961},{"match_name":"Blackstone Shooting Sports Snow Days January 2017 USPSA Level  1","match_date":"2017-01-08","stage_classifiercode":"99-11","member_number":"A94200","first_name":"HAROLD","last_name":"PRESSLEY","classification":"U","division":"LIMITED","hit_factor":6.3953},{"match_name":"CRCPS 2020-08-08","match_date":"2020-08-08","stage_classifiercode":"99-11","member_number":"A129235","first_name":"JACKSON","last_name":"CRAWFORD","classification":"U","division":"LIMITED","hit_factor":6.3939},{"match_name":"NAAS 2018-01-21 Special Classifier Match","match_date":"2018-01-21","stage_classifiercode":"99-11","member_number":"A85054","first_name":"ROB","last_name":"CHAVOUS","classification":"U","division":"LIMITED","hit_factor":6.3934},{"match_name":"LCHG September 2018 USPSA Special Classifier","match_date":"2018-09-08","stage_classifiercode":"99-11","member_number":"L3409","first_name":"BRUCE","last_name":"REID","classification":"B","division":"LIMITED","hit_factor":6.3932},{"match_name":"North Mountain PS April","match_date":"2016-04-15","stage_classifiercode":"99-11","member_number":"A32476","first_name":"WADE","last_name":"STOCKTON","classification":"B","division":"LIMITED","hit_factor":6.3932},{"match_name":"Klamath USPSA 06/05/16 JSPS OR09","match_date":"2016-06-05","stage_classifiercode":"99-11","member_number":"PEN","first_name":"RAFE","last_name":"NATHO","classification":"U","division":"LIMITED","hit_factor":6.3927},{"match_name":"TCGC Polo July 2017","match_date":"2017-07-23","stage_classifiercode":"99-11","member_number":"A104102","first_name":"BRAD","last_name":"EDWARDS","classification":"U","division":"LIMITED","hit_factor":6.3927},{"match_name":"LdF USPSA Match January 25 2020","match_date":"2020-01-25","stage_classifiercode":"99-11","member_number":"TY117736","first_name":"JIMMY","last_name":"CADE","classification":"B","division":"LIMITED","hit_factor":6.3885},{"match_name":"Danville Rifle and Pistol Club USPSA IL17 July 7 2018","match_date":"2018-07-07","stage_classifiercode":"99-11","member_number":"TY90126","first_name":"TOM","last_name":"BURZYNSKI","classification":"B","division":"LIMITED","hit_factor":6.3879},{"match_name":"Fairfax PS USPSA  2018 October","match_date":"2018-10-16","stage_classifiercode":"99-11","member_number":"A30181","first_name":"JOE","last_name":"STAGNATO","classification":"B","division":"LIMITED","hit_factor":6.3877},{"match_name":"GAS Special Classifier","match_date":"2016-07-02","stage_classifiercode":"99-11","member_number":"A36277","first_name":"JO","last_name":"ROSENCRANTZ","classification":"B","division":"LIMITED","hit_factor":6.3857},{"match_name":"CJR&PC USPSA  June 10","match_date":"2018-06-10","stage_classifiercode":"99-11","member_number":"A102569","first_name":"MICHAEL","last_name":"MONTALTO","classification":"\"\"","division":"LIMITED","hit_factor":6.3855},{"match_name":"SSS USPSA June 2020 FATHERS DAY Match","match_date":"2020-06-21","stage_classifiercode":"99-11","member_number":"ty100125","first_name":"JOHN","last_name":"EDENS","classification":"B (B Class)","division":"LIMITED","hit_factor":6.383},{"match_name":"RPS November 2018 USPSA Match","match_date":"2018-11-10","stage_classifiercode":"99-11","member_number":"L4473","first_name":"ULRICH","last_name":"BABSAAY","classification":"D","division":"LIMITED","hit_factor":6.383},{"match_name":"GPS.   August  2016 ","match_date":"2016-08-28","stage_classifiercode":"99-11","member_number":"\"\"","first_name":"CARLO","last_name":"CHAVEZ","classification":"C","division":"LIMITED","hit_factor":6.383},{"match_name":"March 2018 USPSA Classifier Special","match_date":"2018-03-17","stage_classifiercode":"99-11","member_number":"f109640","first_name":"JOE","last_name":"CHAVEZ","classification":"\"\"","division":"LIMITED","hit_factor":6.3804},{"match_name":"WVPPS November 2018","match_date":"2018-11-18","stage_classifiercode":"99-11","member_number":"A114814","first_name":"CALEB","last_name":"HESS","classification":"U","division":"LIMITED","hit_factor":6.38},{"match_name":"PSAC_20161022","match_date":"2016-10-22","stage_classifiercode":"99-11","member_number":"A57903","first_name":"STEVEN","last_name":"CLINE","classification":"\"\"","division":"LIMITED","hit_factor":6.3781},{"match_name":"IL16 USPSA MAR 20 2016","match_date":"2016-03-20","stage_classifiercode":"99-11","member_number":"A90793","first_name":"NOEL","last_name":"ZEMAN","classification":"C","division":"LIMITED","hit_factor":6.3758},{"match_name":"MSSA USPSA June  10 2017","match_date":"2017-06-10","stage_classifiercode":"99-11","member_number":"A91827","first_name":"PRESTON","last_name":"KING","classification":"B","division":"LIMITED","hit_factor":6.3758},{"match_name":"PSAC_20161022","match_date":"2016-10-22","stage_classifiercode":"99-11","member_number":"A80196","first_name":"JOHN","last_name":"CROSS","classification":"\"\"","division":"LIMITED","hit_factor":6.3754},{"match_name":"MPSA 07182020 USPSA","match_date":"2020-07-18","stage_classifiercode":"99-11","member_number":"A122536","first_name":"JONATHAN","last_name":"PAYNE","classification":"C","division":"LIMITED","hit_factor":6.3745},{"match_name":"Cactus USPSA ALL CLASSIFIER August 2020","match_date":"2020-08-02","stage_classifiercode":"99-11","member_number":"A114041","first_name":"WAYNE","last_name":"BAKER","classification":"C","division":"LIMITED","hit_factor":6.3733},{"match_name":"BHPSC 11-20-2020","match_date":"2020-11-21","stage_classifiercode":"99-11","member_number":"A121434","first_name":"GREGORY","last_name":"LANGNER","classification":"B","division":"LIMITED","hit_factor":6.3733},{"match_name":"Hose Monster Action ","match_date":"2020-07-19","stage_classifiercode":"99-11","member_number":"TY100394","first_name":"NICHOLAS","last_name":"STUYT","classification":"C","division":"LIMITED","hit_factor":6.3725},{"match_name":"Rankin Field Sunday USPSA","match_date":"2018-04-15","stage_classifiercode":"99-11","member_number":"TY87001","first_name":"LARRY","last_name":"CASADO","classification":"B","division":"LIMITED","hit_factor":6.3725},{"match_name":"Crooked Creek Pistol League - June 2017","match_date":"2017-06-24","stage_classifiercode":"99-11","member_number":"TY65487","first_name":"BRETTON","last_name":"REBOL","classification":"U","division":"LIMITED","hit_factor":6.3719},{"match_name":"ORSA USPSA October 2017","match_date":"2017-10-21","stage_classifiercode":"99-11","member_number":"A63667","first_name":"JIM","last_name":"ELKINS","classification":"B","division":"LIMITED","hit_factor":6.3719},{"match_name":"MPSA 010216","match_date":"2016-01-02","stage_classifiercode":"99-11","member_number":"A82331","first_name":"DREW","last_name":"WALTERS","classification":"A","division":"LIMITED","hit_factor":6.3717},{"match_name":"Clinton County USPSA July 23 2016","match_date":"2016-07-23","stage_classifiercode":"99-11","member_number":"A92359","first_name":"TONY","last_name":"WELLS","classification":"C","division":"LIMITED","hit_factor":6.3694},{"match_name":"PSAC_20161022","match_date":"2016-10-22","stage_classifiercode":"99-11","member_number":"A60546","first_name":"DAVE","last_name":"ROGALSKI","classification":"\"\"","division":"LIMITED","hit_factor":6.3666},{"match_name":"APSC USPSA 02-15-20","match_date":"2020-02-15","stage_classifiercode":"99-11","member_number":"L173","first_name":"DAVID","last_name":"CARRUTHERS","classification":"B","division":"LIMITED","hit_factor":6.3616},{"match_name":"CCPL 01102016 ALL CLASSIFIER MATCH","match_date":"2016-01-10","stage_classifiercode":"99-11","member_number":"A79092","first_name":"RUSTY","last_name":"GERBER","classification":"C","division":"LIMITED","hit_factor":6.3613},{"match_name":"Ontelaunee USPSA Hose Fest","match_date":"2021-01-02","stage_classifiercode":"99-11","member_number":"A112477","first_name":"RICK","last_name":"WEISE","classification":"C","division":"LIMITED","hit_factor":6.3604},{"match_name":"SCAPSA MN05 Summer League 8","match_date":"2017-08-01","stage_classifiercode":"99-11","member_number":"TY102238","first_name":"SHAWN","last_name":"KUPERUS","classification":"U","division":"LIMITED","hit_factor":6.3599},{"match_name":"Hopkinton USPSA October 2018","match_date":"2018-10-06","stage_classifiercode":"99-11","member_number":"TY70926","first_name":"MICHAEL","last_name":"EISENHOWER","classification":"B","division":"LIMITED","hit_factor":6.3599},{"match_name":"ISPS 6/19/2016 USPSA","match_date":"2016-06-19","stage_classifiercode":"99-11","member_number":"\"\"","first_name":"TONY","last_name":"SMITH","classification":"U","division":"LIMITED","hit_factor":6.3584},{"match_name":"RSCS USPSA  27 Mar 2016","match_date":"2016-03-27","stage_classifiercode":"99-11","member_number":"A95905","first_name":"KELLEN","last_name":"GERARD","classification":"U","division":"LIMITED","hit_factor":6.3576},{"match_name":"OK15 USPSA at USSA May 6th 2018","match_date":"2018-05-06","stage_classifiercode":"99-11","member_number":"A20546","first_name":"JESS","last_name":"ANDERSON","classification":"M","division":"LIMITED","hit_factor":6.3576},{"match_name":"North Mountain PS April","match_date":"2016-04-15","stage_classifiercode":"99-11","member_number":"A91520","first_name":"JEFF","last_name":"WHEELER","classification":"C","division":"LIMITED","hit_factor":6.3574},{"match_name":"BPSA January 2017 USPSA","match_date":"2017-01-22","stage_classifiercode":"99-11","member_number":"A82466","first_name":"THOMAS","last_name":"ARTHUR","classification":"B","division":"LIMITED","hit_factor":6.3545},{"match_name":"CGC 4.30.17","match_date":"2017-04-30","stage_classifiercode":"99-11","member_number":"a91619","first_name":"SONNY","last_name":"CHAN","classification":"B","division":"LIMITED","hit_factor":6.354},{"match_name":"Shoot Gtr USPSA 10/18","match_date":"2016-10-18","stage_classifiercode":"99-11","member_number":"TY77144","first_name":"ALEXANDRA","last_name":"FERRIS","classification":"C","division":"LIMITED","hit_factor":6.3536},{"match_name":"LA05 Tangi June USPSA 2020","match_date":"2020-06-28","stage_classifiercode":"99-11","member_number":"L714","first_name":"LLOYD","last_name":"LANDRY","classification":"B","division":"LIMITED","hit_factor":6.3512},{"match_name":"PSAC_20161022","match_date":"2016-10-22","stage_classifiercode":"99-11","member_number":"NA","first_name":"NATHAN","last_name":"BRAIN","classification":"\"\"","division":"LIMITED","hit_factor":6.3492},{"match_name":"HSC USPSA October 7th 2017","match_date":"2017-10-06","stage_classifiercode":"99-11","member_number":"PEN","first_name":"JASON","last_name":"CLARK","classification":"U","division":"LIMITED","hit_factor":6.3492},{"match_name":"WGC WI USPSA League 11-8-2016","match_date":"2016-11-09","stage_classifiercode":"99-11","member_number":"\"\"","first_name":"AARON","last_name":"KIPPLEY","classification":"U","division":"LIMITED","hit_factor":6.3492},{"match_name":"Devil Dog USPSA Classifier Match-Saturday Session","match_date":"2018-03-10","stage_classifiercode":"99-11","member_number":"A106793","first_name":"TIM","last_name":"WILSON","classification":"U","division":"LIMITED","hit_factor":6.3492},{"match_name":"WSRC USPSA 11/19/2017","match_date":"2017-11-19","stage_classifiercode":"99-11","member_number":"FY70186","first_name":"SONYA","last_name":"CORUM","classification":"C","division":"LIMITED","hit_factor":6.3474},{"match_name":"USPSA CM99 Special Classifier MO19 Lamar October 9 2016","match_date":"2016-10-09","stage_classifiercode":"99-11","member_number":"ty82666","first_name":"KYLE","last_name":"SHAFER","classification":"C","division":"LIMITED","hit_factor":6.3455},{"match_name":"MVS USPSA 9-20-17","match_date":"2017-09-20","stage_classifiercode":"99-11","member_number":"A100631","first_name":"BRIAN","last_name":"HONG","classification":"C","division":"LIMITED","hit_factor":6.3444},{"match_name":"BA USPSA Jun 17-2017","match_date":"2017-06-11","stage_classifiercode":"99-11","member_number":"L2133","first_name":"GARY","last_name":"STEVENS","classification":"B","division":"LIMITED","hit_factor":6.3433},{"match_name":"ARPC USPSA Match 8-23-20","match_date":"2020-08-23","stage_classifiercode":"99-11","member_number":"A79810","first_name":"RICH","last_name":"BUSCH","classification":"B","division":"LIMITED","hit_factor":6.3428},{"match_name":"USPSA - Bridgeville DE - lvl 1 Clone","match_date":"2018-07-01","stage_classifiercode":"99-11","member_number":"A108064","first_name":"RYAN","last_name":"DUKO","classification":"U","division":"LIMITED","hit_factor":6.3415},{"match_name":"Bagram Practical Shooters - Thanksgiving Tournament","match_date":"2018-11-22","stage_classifiercode":"99-11","member_number":"a107019","first_name":"FINNY","last_name":"FINN","classification":"U","division":"LIMITED","hit_factor":6.3415},{"match_name":"FBURG July 2018 Level I USPSA ","match_date":"2018-07-01","stage_classifiercode":"99-11","member_number":"TY82648","first_name":"JIM","last_name":"SANTORO","classification":"B","division":"LIMITED","hit_factor":6.3408},{"match_name":"OK15 USPSA at USSA May 6th 2018","match_date":"2018-05-06","stage_classifiercode":"99-11","member_number":"A104239","first_name":"JASON","last_name":"QUALLS","classification":"C","division":"LIMITED","hit_factor":6.3408},{"match_name":"HSA USPSA March 2020","match_date":"2020-03-04","stage_classifiercode":"99-11","member_number":"A121316","first_name":"JASON","last_name":"STEM","classification":"C","division":"LIMITED","hit_factor":6.3401},{"match_name":"Hopkinton June  2016","match_date":"2016-06-04","stage_classifiercode":"99-11","member_number":"A68158","first_name":"DENNIS","last_name":"MARAGIOGLIO","classification":"C","division":"LIMITED","hit_factor":6.3389},{"match_name":"USPSA MO21 2Alpha SBRC June 2017","match_date":"2017-06-17","stage_classifiercode":"99-11","member_number":"\"\"","first_name":"STEVE","last_name":"SKOPEC","classification":"U","division":"LIMITED","hit_factor":6.3388},{"match_name":"Pardoe Sportsmens Association- USPSA Saturday 4-3-21","match_date":"2021-04-03","stage_classifiercode":"99-11","member_number":"A74936","first_name":"ROGER","last_name":"ELDER","classification":"B","division":"LIMITED","hit_factor":6.338},{"match_name":"BHPSC Monthy World Championship 12-29-2017","match_date":"2017-12-30","stage_classifiercode":"99-11","member_number":"A90876","first_name":"JEFF","last_name":"BEYER","classification":"C","division":"LIMITED","hit_factor":6.3337},{"match_name":"Hawkeye Gun Club March 19th 2016 Match","match_date":"2016-03-19","stage_classifiercode":"99-11","member_number":"L3834","first_name":"MATTHEW","last_name":"CHILDS","classification":"B","division":"LIMITED","hit_factor":6.3333},{"match_name":"Winter League # 6","match_date":"2018-01-05","stage_classifiercode":"99-11","member_number":"A100903","first_name":"CALEB","last_name":"MCNETT","classification":"C","division":"LIMITED","hit_factor":6.3319},{"match_name":"INAS Jan 2016 USPSA","match_date":"2016-01-16","stage_classifiercode":"99-11","member_number":"A89478","first_name":"DAN","last_name":"ASHE","classification":"D","division":"LIMITED","hit_factor":6.3277},{"match_name":"USPSA-Classifier","match_date":"2017-03-26","stage_classifiercode":"99-11","member_number":"A90736","first_name":"LUIS","last_name":"SANTOS","classification":"C","division":"LIMITED","hit_factor":6.326},{"match_name":"Applied IN25 USPSA April Classifier 2018","match_date":"2018-04-17","stage_classifiercode":"99-11","member_number":"TY92980","first_name":"DAVID","last_name":"BURNS","classification":"M","division":"LIMITED","hit_factor":6.3248},{"match_name":"SLPSA August USPSA Match 2","match_date":"2020-08-15","stage_classifiercode":"99-11","member_number":"A123763","first_name":"JEROMY","last_name":"CAMP","classification":"C","division":"LIMITED","hit_factor":6.3235},{"match_name":"17s PSC - Go Fast Don’t Suck 2020 Spring Postal Match (USPSA)","match_date":"2020-05-16","stage_classifiercode":"99-11","member_number":"A127675","first_name":"PIERCE","last_name":"WERNER","classification":"U","division":"LIMITED","hit_factor":6.3232},{"match_name":"RPS December 2017 USPSA Match","match_date":"2017-12-09","stage_classifiercode":"99-11","member_number":"TY88089","first_name":"DAVID","last_name":"BURTON","classification":"B","division":"LIMITED","hit_factor":6.3211},{"match_name":"CSA For PCGC","match_date":"2016-06-26","stage_classifiercode":"99-11","member_number":"A89121","first_name":"JAMIE","last_name":"DICKENS","classification":"C","division":"LIMITED","hit_factor":6.3197},{"match_name":"Richmond Hot Shots April 30-May 1st USPSA Pistol Match","match_date":"2016-04-30","stage_classifiercode":"99-11","member_number":"TY82728","first_name":"KIRILL","last_name":"FILIMONOV","classification":"B","division":"LIMITED","hit_factor":6.3191},{"match_name":"Pitcairn-Monroeville Sportsmens Club USPSA August 2017","match_date":"2017-08-05","stage_classifiercode":"99-11","member_number":"ty74142","first_name":"GARY","last_name":"DEAN","classification":"U","division":"LIMITED","hit_factor":6.3183},{"match_name":"USPSA MO21 2Alpha SBRC June 2017","match_date":"2017-06-17","stage_classifiercode":"99-11","member_number":"A99991","first_name":"DENTON","last_name":"ADAM","classification":"C","division":"LIMITED","hit_factor":6.3174},{"match_name":"CCAS June 2016","match_date":"2016-06-25","stage_classifiercode":"99-11","member_number":"A91713","first_name":"SHAWN","last_name":"SMITH","classification":"C","division":"LIMITED","hit_factor":6.3172},{"match_name":"Deadwood Boys USPSA All Classifier Match","match_date":"2016-08-07","stage_classifiercode":"99-11","member_number":"A92237","first_name":"JESUS","last_name":"GONZALEZ","classification":"C","division":"LIMITED","hit_factor":6.3172},{"match_name":"AGC_20170903","match_date":"2017-09-03","stage_classifiercode":"99-11","member_number":"\"\"","first_name":"JAMES","last_name":"BURNS","classification":"U","division":"LIMITED","hit_factor":6.317},{"match_name":"CJR&PC USPSA  June 10","match_date":"2018-06-10","stage_classifiercode":"99-11","member_number":"TY55306","first_name":"FELIX","last_name":"KOGAN","classification":"\"\"","division":"LIMITED","hit_factor":6.3158},{"match_name":"CVSC 10-28-2018 (6 Stage All Classifier Match)","match_date":"2018-10-28","stage_classifiercode":"99-11","member_number":"A92260","first_name":"LAURI","last_name":"VAUGHN","classification":"C","division":"LIMITED","hit_factor":6.3146},{"match_name":"SSS USPSA October 2018","match_date":"2018-10-21","stage_classifiercode":"99-11","member_number":"a100125","first_name":"JOHN","last_name":"EDENS","classification":"B (B Class)","division":"LIMITED","hit_factor":6.3131},{"match_name":"LCSA USPSA March Match","match_date":"2016-03-12","stage_classifiercode":"99-11","member_number":"A91964","first_name":"JACOB","last_name":"WILLSON","classification":"C","division":"LIMITED","hit_factor":6.3128},{"match_name":"Grandbaggers August 2017","match_date":"2017-08-03","stage_classifiercode":"99-11","member_number":"TY96346","first_name":"CHRIS","last_name":"STADLER","classification":"C","division":"LIMITED","hit_factor":6.3128},{"match_name":"Fairfax PS USPSA September 2017","match_date":"2017-09-19","stage_classifiercode":"99-11","member_number":"A56261","first_name":"JASON","last_name":"BOURLAND","classification":"U","division":"LIMITED","hit_factor":6.3128},{"match_name":"Pinetucky USPSA 06-16-18","match_date":"2018-06-16","stage_classifiercode":"99-11","member_number":"A106052","first_name":"NATHAN","last_name":"GRAY","classification":"C","division":"LIMITED","hit_factor":6.3114},{"match_name":"Shasta Shooters 2017 June Classifier Match","match_date":"2017-06-10","stage_classifiercode":"99-11","member_number":"A33123","first_name":"DAREN","last_name":"HUSA","classification":"B","division":"LIMITED","hit_factor":6.3063},{"match_name":"2017 Bay bridge Charity Classic - Richmond October 14-15-2017","match_date":"2017-10-14","stage_classifiercode":"99-11","member_number":"TY82728","first_name":"KIRILL","last_name":"FILIMONOV","classification":"B","division":"LIMITED","hit_factor":6.3063},{"match_name":"Rio Salado UPPL September 2020","match_date":"2020-09-13","stage_classifiercode":"99-11","member_number":"A96698","first_name":"JOHN","last_name":"JENSON","classification":"C","division":"LIMITED","hit_factor":6.3053},{"match_name":"SCCC CLASSIFIER MATCH 7_23_17","match_date":"2017-07-23","stage_classifiercode":"99-11","member_number":"TY101688","first_name":"DONALD","last_name":"APPLEGARTH 2","classification":"U","division":"LIMITED","hit_factor":6.303},{"match_name":"Shoot GTR USPSA MAY 24","match_date":"2016-05-24","stage_classifiercode":"99-11","member_number":"A89367","first_name":"BO","last_name":"WALTERS","classification":"U","division":"LIMITED","hit_factor":6.3014},{"match_name":"BUAS February Match","match_date":"2018-02-11","stage_classifiercode":"99-11","member_number":"ty86431","first_name":"NEAL","last_name":"LIDDLE","classification":"B","division":"LIMITED","hit_factor":6.3014},{"match_name":"CGGR July USPSA Match","match_date":"2018-07-21","stage_classifiercode":"99-11","member_number":"A106324","first_name":"ERICK","last_name":"COLLINS","classification":"B","division":"LIMITED","hit_factor":6.3005},{"match_name":"SFPS 8-5-18 USPSA Match","match_date":"2018-08-05","stage_classifiercode":"99-11","member_number":"TY90617","first_name":"BRYAN","last_name":"ZENT","classification":"C","division":"LIMITED","hit_factor":6.2972},{"match_name":"Dundee Practical Shooters - Oct 27 2018","match_date":"2018-10-27","stage_classifiercode":"99-11","member_number":"\"\"","first_name":"JESSICA","last_name":"BESSLER","classification":"U","division":"LIMITED","hit_factor":6.2972},{"match_name":"Brothers N Arms September 2017 USPSA Match","match_date":"2017-09-16","stage_classifiercode":"99-11","member_number":"L4158","first_name":"CHRIS","last_name":"BROWN","classification":"B","division":"LIMITED","hit_factor":6.2963},{"match_name":"Applied IN25 USPSA January 17th 2018","match_date":"2018-01-17","stage_classifiercode":"99-11","member_number":"A106525","first_name":"EUGENE","last_name":"HESSION","classification":"U","division":"LIMITED","hit_factor":6.2959},{"match_name":"LCHG May USPSA","match_date":"2017-05-21","stage_classifiercode":"99-11","member_number":"A82155","first_name":"BOB","last_name":"EVANS","classification":"U","division":"LIMITED","hit_factor":6.2954},{"match_name":"CASA USPSA  Jul 2016","match_date":"2016-07-09","stage_classifiercode":"99-11","member_number":"A88683","first_name":"JERRY","last_name":"WATTS","classification":"C","division":"LIMITED","hit_factor":6.2937},{"match_name":"LdF USPSA Match January 25 2020","match_date":"2020-01-25","stage_classifiercode":"99-11","member_number":"TY86401","first_name":"JOSEPH","last_name":"DEMATTIA","classification":"C","division":"LIMITED","hit_factor":6.2929},{"match_name":"IL16 USPSA MAR 20 2016","match_date":"2016-03-20","stage_classifiercode":"99-11","member_number":"A69428","first_name":"CARTER","last_name":"JONES","classification":"B","division":"LIMITED","hit_factor":6.2929},{"match_name":"SLOSA NOVEMBER 2017 USPSA MATCH","match_date":"2017-11-11","stage_classifiercode":"99-11","member_number":"A101938","first_name":"LOYD","last_name":"WENZEL","classification":"C","division":"LIMITED","hit_factor":6.291},{"match_name":"Pardoe Sportsmens Association-WPA14-2017-10-01","match_date":"2017-10-01","stage_classifiercode":"99-11","member_number":"A95904","first_name":"JONATHAN","last_name":"MCCLAIN","classification":"C","division":"LIMITED","hit_factor":6.2907},{"match_name":"Brazosland Pistoleros January 17 2016--USPSA","match_date":"2016-01-17","stage_classifiercode":"99-11","member_number":"\"\"","first_name":"JUSTIN","last_name":"GOR","classification":"U","division":"LIMITED","hit_factor":6.2893},{"match_name":"USPSA MO21 2Alpha SBRC June 2017","match_date":"2017-06-17","stage_classifiercode":"99-11","member_number":"A98118","first_name":"JORDAN","last_name":"EPPS","classification":"C","division":"LIMITED","hit_factor":6.2874},{"match_name":"Deadwood Boys USPSA All Classifier Match - 29 July 2018","match_date":"2018-07-29","stage_classifiercode":"99-11","member_number":"A104513","first_name":"AUSTIN","last_name":"ARISS","classification":"U","division":"LIMITED","hit_factor":6.2864},{"match_name":"Collin County USPSA 04-25-2021","match_date":"2021-04-24","stage_classifiercode":"99-11","member_number":"TY59751","first_name":"KENNETH","last_name":"NAFFZIGER","classification":"M","division":"LIMITED","hit_factor":6.2857},{"match_name":"SKSC USPSA April 2018 Match","match_date":"2018-04-21","stage_classifiercode":"99-11","member_number":"TY89422","first_name":"KURT","last_name":"KEHOE","classification":"C","division":"LIMITED","hit_factor":6.2827},{"match_name":"Deadwood Boys USPSA All Classifier Match - 29 July 2018","match_date":"2018-07-29","stage_classifiercode":"99-11","member_number":"TY96556","first_name":"KEITH","last_name":"JUNG","classification":"C","division":"LIMITED","hit_factor":6.2814},{"match_name":"Maine Practical Shooter December 2018","match_date":"2018-12-15","stage_classifiercode":"99-11","member_number":"TY89230","first_name":"SCOTT","last_name":"HOSSLER","classification":"C","division":"LIMITED","hit_factor":6.2814},{"match_name":"CSA For PCGC","match_date":"2016-06-26","stage_classifiercode":"99-11","member_number":"TY8880","first_name":"GENE","last_name":"RICHMOND","classification":"B","division":"LIMITED","hit_factor":6.2814},{"match_name":"Ripon Oct USPSA Match","match_date":"2015-10-24","stage_classifiercode":"99-11","member_number":"TY54308","first_name":"GLEN","last_name":"BICKING","classification":"A","division":"LIMITED","hit_factor":6.2802},{"match_name":"PRPSA USPSA CHALLENGE PAN AMERICAN","match_date":"2021-07-11","stage_classifiercode":"99-11","member_number":"TY92124","first_name":"GERMAN","last_name":"VELEZ","classification":"","division":"LIMITED","hit_factor":6.2802},{"match_name":"WVRPC USPSA 1SEPT2018","match_date":"2018-09-01","stage_classifiercode":"99-11","member_number":"TY80201","first_name":"THOMAS S","last_name":"RAPALA","classification":"B","division":"LIMITED","hit_factor":6.2796},{"match_name":"WVRPC USPSA 1SEPT2018","match_date":"2018-09-01","stage_classifiercode":"99-11","member_number":"A113110","first_name":"JOSH","last_name":"MAWHORR","classification":"U","division":"LIMITED","hit_factor":6.2796},{"match_name":"Maryland Practical Shooters Association July 2018","match_date":"2018-07-22","stage_classifiercode":"99-11","member_number":"A30181","first_name":"JOE","last_name":"STAGNATO","classification":"B","division":"LIMITED","hit_factor":6.2791},{"match_name":"ISPS 6/19/2016 USPSA","match_date":"2016-06-19","stage_classifiercode":"99-11","member_number":"A92669","first_name":"SCOTT","last_name":"VICKERS","classification":"B","division":"LIMITED","hit_factor":6.2785},{"match_name":"MVS USPSA 9-20-17","match_date":"2017-09-20","stage_classifiercode":"99-11","member_number":"A100631","first_name":"BRIAN","last_name":"HONG","classification":"C","division":"LIMITED","hit_factor":6.2767},{"match_name":"SFA   USPSA 2/20/2016","match_date":"2016-02-20","stage_classifiercode":"99-11","member_number":"A78467","first_name":"LYNDA","last_name":"TURNBULL","classification":"C","division":"LIMITED","hit_factor":6.2762},{"match_name":"2017 EOD Warrior Foundation Match","match_date":"2017-04-29","stage_classifiercode":"99-11","member_number":"A95107","first_name":"CHARLES","last_name":"SWARTZ","classification":"U","division":"LIMITED","hit_factor":6.2745},{"match_name":"Baps March Uspsa","match_date":"2016-03-19","stage_classifiercode":"99-11","member_number":"\"\"","first_name":"WILLIAM","last_name":"KOMIACK","classification":"U","division":"LIMITED","hit_factor":6.2745},{"match_name":"Granby Action Shooters Oct 2016","match_date":"2016-10-02","stage_classifiercode":"99-11","member_number":"\"\"","first_name":"MATT","last_name":"HOLMES","classification":"\"\"","division":"LIMITED","hit_factor":6.2735},{"match_name":"BRSP Tuesday Night USPSA Match - May 15","match_date":"2018-05-16","stage_classifiercode":"99-11","member_number":"A106443","first_name":"LYLE","last_name":"ROWE","classification":"D","division":"LIMITED","hit_factor":6.2735},{"match_name":"BRSP Tuesday Night USPSA Match - May 15","match_date":"2018-05-16","stage_classifiercode":"99-11","member_number":"A111475","first_name":"MIKE","last_name":"ARWINE","classification":"\"\"","division":"LIMITED","hit_factor":6.2735},{"match_name":"CJR&PC USPSA  June 10","match_date":"2018-06-10","stage_classifiercode":"99-11","member_number":"A57982","first_name":"JUN","last_name":"TIOZON","classification":"\"\"","division":"LIMITED","hit_factor":6.2726},{"match_name":"MPSA 081818 USPSA","match_date":"2018-08-18","stage_classifiercode":"99-11","member_number":"Fy39690","first_name":"MAC","last_name":"HART","classification":"B","division":"LIMITED","hit_factor":6.2722},{"match_name":"Competitive Shooters of Lake Norman CORNELIUS Thursday Evening Indoor USPSA Pistol Match North Carolina","match_date":"2018-12-06","stage_classifiercode":"99-11","member_number":"TY106507","first_name":"KEITH","last_name":"NAGELSKI","classification":"C","division":"LIMITED","hit_factor":6.2722},{"match_name":"Deadwood Boys USPSA All Classifier Match","match_date":"2016-08-07","stage_classifiercode":"99-11","member_number":"TY-87459","first_name":"AARON","last_name":"RUNYAN","classification":"C","division":"LIMITED","hit_factor":6.2722},{"match_name":"USPSA MO21 2Alpha SBRC June 2017","match_date":"2017-06-17","stage_classifiercode":"99-11","member_number":"A97624","first_name":"MICHAEL","last_name":"MARTIN","classification":"C","division":"LIMITED","hit_factor":6.2718},{"match_name":"WSRC USPSA","match_date":"2016-10-22","stage_classifiercode":"99-11","member_number":"\"\"","first_name":"MATT","last_name":"JAIMES","classification":"X","division":"LIMITED","hit_factor":6.2714},{"match_name":"SFA   USPSA 2/20/2016","match_date":"2016-02-20","stage_classifiercode":"99-11","member_number":"A83271","first_name":"JOSH","last_name":"PERRY","classification":"B","division":"LIMITED","hit_factor":6.2706},{"match_name":"FBURG USPSA November 2020","match_date":"2020-11-01","stage_classifiercode":"99-11","member_number":"TY113190","first_name":"BRENDEN","last_name":"FRISK","classification":"B","division":"LIMITED","hit_factor":6.2642},{"match_name":"MPSA 042118 USPSA","match_date":"2018-04-21","stage_classifiercode":"99-11","member_number":"A108242","first_name":"CASEY","last_name":"GRISSETT","classification":"U","division":"LIMITED","hit_factor":6.2585},{"match_name":"SAPSC Monthly USPSA Classifier Match at ARO 20180215","match_date":"2018-02-16","stage_classifiercode":"99-11","member_number":"A100051","first_name":"BRIAN","last_name":"SHARP","classification":"C","division":"LIMITED","hit_factor":6.2578},{"match_name":"Steel City USPSA December 2 2017","match_date":"2017-12-02","stage_classifiercode":"99-11","member_number":"\"\"","first_name":"STEVEN","last_name":"RITCHIE","classification":"X","division":"LIMITED","hit_factor":6.2578},{"match_name":"EIPS 12/6/2018","match_date":"2018-12-06","stage_classifiercode":"99-11","member_number":"A111017","first_name":"ANDY","last_name":"BINDEWALD","classification":"U","division":"LIMITED","hit_factor":6.2577},{"match_name":"SSS USPSA February 2020","match_date":"2020-02-16","stage_classifiercode":"99-11","member_number":"L4350","first_name":"TOM","last_name":"BYRUM","classification":"C (C Class)","division":"LIMITED","hit_factor":6.2577},{"match_name":"Bgs Hudson Week 6","match_date":"2017-02-19","stage_classifiercode":"99-11","member_number":"\"\"","first_name":"BRAD","last_name":"RONGITSCH","classification":"U","division":"LIMITED","hit_factor":6.2575},{"match_name":"SAPS USPSA June 2017","match_date":"2017-06-17","stage_classifiercode":"99-11","member_number":"L4255","first_name":"ELTON","last_name":"COLEMAN","classification":"C","division":"LIMITED","hit_factor":6.2575},{"match_name":"GRB JAN USPSA  at Cav","match_date":"2017-01-21","stage_classifiercode":"99-11","member_number":"A94779","first_name":"DANIEL","last_name":"LOWE","classification":"U","division":"LIMITED","hit_factor":6.2571},{"match_name":"SLOSA NOVEMBER 2017 USPSA MATCH","match_date":"2017-11-11","stage_classifiercode":"99-11","member_number":"\"\"","first_name":"CRAIG","last_name":"LOVERIDGE","classification":"C","division":"LIMITED","hit_factor":6.2569},{"match_name":"WSPS Practice Match 022816","match_date":"2016-02-28","stage_classifiercode":"99-11","member_number":"a91178","first_name":"MATT","last_name":"SANTO","classification":"U","division":"LIMITED","hit_factor":6.2567},{"match_name":"SSS USPSA June 2020 FATHERS DAY Match","match_date":"2020-06-21","stage_classifiercode":"99-11","member_number":"A120621","first_name":"JASON","last_name":"KARSTEDT","classification":"C (C Class)","division":"LIMITED","hit_factor":6.2567},{"match_name":"Granby Action Shooters Oct 2016","match_date":"2016-10-02","stage_classifiercode":"99-11","member_number":"A84437","first_name":"SEBASTIAN","last_name":"YORDAN","classification":"U","division":"LIMITED","hit_factor":6.25},{"match_name":"EWPSA 2016-04","match_date":"2016-04-17","stage_classifiercode":"99-11","member_number":"TY80395","first_name":"KAJSA","last_name":"WEAVER","classification":"C","division":"LIMITED","hit_factor":6.25},{"match_name":"WSPS JUNE 2018 USPSA MATCH","match_date":"2018-06-16","stage_classifiercode":"99-11","member_number":"TY88229","first_name":"BEN","last_name":"FECK","classification":"C","division":"LIMITED","hit_factor":6.25},{"match_name":"MPSA 021817","match_date":"2017-02-18","stage_classifiercode":"99-11","member_number":"A71172","first_name":"DAN","last_name":"STREET","classification":"B","division":"LIMITED","hit_factor":6.25},{"match_name":"CVSC 07-29-2018","match_date":"2018-07-29","stage_classifiercode":"99-11","member_number":"A65481","first_name":"KEVIN","last_name":"DORAN","classification":"B","division":"LIMITED","hit_factor":6.25},{"match_name":"PPPS 11-13-16","match_date":"2016-11-13","stage_classifiercode":"99-11","member_number":"TY41016","first_name":"NAPOLEAN","last_name":"BAGCAL","classification":"B","division":"LIMITED","hit_factor":6.2426},{"match_name":"Rankin Field Sunday USPSA","match_date":"2018-04-15","stage_classifiercode":"99-11","member_number":"A92260","first_name":"LAURI","last_name":"VAUGHN","classification":"C","division":"LIMITED","hit_factor":6.2425},{"match_name":"CSA Coalfield Shooters Association USPSA March 2020","match_date":"2020-03-08","stage_classifiercode":"99-11","member_number":"\"\"","first_name":"BRADLEY 2","last_name":"PERRY","classification":"B","division":"LIMITED","hit_factor":6.2425},{"match_name":"Denali September","match_date":"2018-09-07","stage_classifiercode":"99-11","member_number":"A113681","first_name":"BRANDON","last_name":"BOYD","classification":"X","division":"LIMITED","hit_factor":6.2422},{"match_name":"Shasta Shooters April 2016","match_date":"2016-04-09","stage_classifiercode":"99-11","member_number":"A30368","first_name":"P WAYNE","last_name":"FACCA","classification":"B","division":"LIMITED","hit_factor":6.2419},{"match_name":"OREGON ARPC CC05 USPSA AUGUST 12 2017","match_date":"2017-08-12","stage_classifiercode":"99-11","member_number":"TY84121","first_name":"GABOR","last_name":"MAGONY","classification":"B","division":"LIMITED","hit_factor":6.2415},{"match_name":"NCPS USPSA Handgun Match November 27 2016","match_date":"2016-11-27","stage_classifiercode":"99-11","member_number":"A84625","first_name":"TROY","last_name":"DENNY","classification":"U","division":"LIMITED","hit_factor":6.2415},{"match_name":"Emmett July Match","match_date":"2017-07-21","stage_classifiercode":"99-11","member_number":"A50757","first_name":"JOHN","last_name":"NETTLES","classification":"U","division":"LIMITED","hit_factor":6.2415},{"match_name":"Shasta Shooters April 2016","match_date":"2016-04-09","stage_classifiercode":"99-11","member_number":"A91711","first_name":"MITCH","last_name":"CARLSON","classification":"C","division":"LIMITED","hit_factor":6.2397},{"match_name":"Maine Practical Shooters August 2016","match_date":"2016-08-27","stage_classifiercode":"99-11","member_number":"A96126","first_name":"LUKE","last_name":"HILTON","classification":"U","division":"LIMITED","hit_factor":6.2338},{"match_name":"SLPSA July USPSA match","match_date":"2018-07-21","stage_classifiercode":"99-11","member_number":"FY80275","first_name":"JASON","last_name":"MILLER","classification":"B","division":"LIMITED","hit_factor":6.2327},{"match_name":"LPRGC-Lower Providence USPSA May-1 2017","match_date":"2017-05-05","stage_classifiercode":"99-11","member_number":"\"\"","first_name":"KRAIG","last_name":"BAER","classification":"A","division":"LIMITED","hit_factor":6.23},{"match_name":"FBURG July 2018 Level I USPSA ","match_date":"2018-07-01","stage_classifiercode":"99-11","member_number":"A104682","first_name":"KEVIN","last_name":"GOROSPE","classification":"B","division":"LIMITED","hit_factor":6.229},{"match_name":"CVSC 10-28-2018 (6 Stage All Classifier Match)","match_date":"2018-10-28","stage_classifiercode":"99-11","member_number":"A107370","first_name":"GERARD","last_name":"MEDEIROS","classification":"C","division":"LIMITED","hit_factor":6.2288},{"match_name":"FAS Sunday Indoors USPSA Match","match_date":"2021-02-07","stage_classifiercode":"99-11","member_number":"A115535","first_name":"RAMSEY","last_name":"GREENE","classification":"C","division":"LIMITED","hit_factor":6.2267},{"match_name":"2017 EOD Warrior Foundation Match","match_date":"2017-04-29","stage_classifiercode":"99-11","member_number":"A99679","first_name":"ROBBIE","last_name":"LIGHTFOOT","classification":"C","division":"LIMITED","hit_factor":6.2257},{"match_name":"BUAS February Match","match_date":"2018-02-11","stage_classifiercode":"99-11","member_number":"a598","first_name":"KENNETH","last_name":"RUEFFERT","classification":"A","division":"LIMITED","hit_factor":6.2252},{"match_name":"Shot Through The Heart Classifiers","match_date":"2018-02-04","stage_classifiercode":"99-11","member_number":"A108232","first_name":"SAMUEL","last_name":"BOND","classification":"U","division":"LIMITED","hit_factor":6.2246},{"match_name":"SUPS All Classifier Match March 1718 2018","match_date":"2018-03-17","stage_classifiercode":"99-11","member_number":"A100817","first_name":"CHRISTOPHER","last_name":"HARWARD","classification":"C","division":"LIMITED","hit_factor":6.2235},{"match_name":"USPSA MO21 2Alpha SBRC December 22 2018","match_date":"2018-12-22","stage_classifiercode":"99-11","member_number":"A109913","first_name":"CHASE","last_name":"GARRISON","classification":"C","division":"LIMITED","hit_factor":6.2222},{"match_name":"SLPSA July USPSA match","match_date":"2018-07-21","stage_classifiercode":"99-11","member_number":"\"\"","first_name":"LENNON","last_name":"STONEBRAKER","classification":"U","division":"LIMITED","hit_factor":6.2217},{"match_name":"SAPS Match 1/16/2021","match_date":"2021-01-16","stage_classifiercode":"99-11","member_number":"TY48466","first_name":"PHILLIP","last_name":"ROBERTS","classification":"B","division":"LIMITED","hit_factor":6.2212},{"match_name":"INAS USPSA Nov 2017","match_date":"2017-11-12","stage_classifiercode":"99-11","member_number":"TY71416","first_name":"BILL","last_name":"HANEY","classification":"C","division":"LIMITED","hit_factor":6.2212},{"match_name":"FSA USPSA 01-26-20","match_date":"2020-01-27","stage_classifiercode":"99-11","member_number":"TY106244","first_name":"JOE","last_name":"KUMMERER","classification":"B","division":"LIMITED","hit_factor":6.2195},{"match_name":"MCRC USPSA August 2018","match_date":"2018-08-11","stage_classifiercode":"99-11","member_number":"A11862","first_name":"BRYAN","last_name":"BLANK","classification":"C","division":"LIMITED","hit_factor":6.2155},{"match_name":"Steel City USPSA December 2 2017","match_date":"2017-12-02","stage_classifiercode":"99-11","member_number":"A102553","first_name":"FRANK","last_name":"SWEET","classification":"U","division":"LIMITED","hit_factor":6.2147},{"match_name":"Custer Feb USPSA","match_date":"2018-02-04","stage_classifiercode":"99-11","member_number":"\"\"","first_name":"CARLO","last_name":"SULICIPAN","classification":"U","division":"LIMITED","hit_factor":6.2127},{"match_name":"WNPL USPSA - REDEMPTION - NOVEMBER 2016","match_date":"2016-11-06","stage_classifiercode":"99-11","member_number":"A87496","first_name":"ROBERT","last_name":"KOLVET","classification":"C","division":"LIMITED","hit_factor":6.2112},{"match_name":"CRCPS 2021-08-14","match_date":"2021-08-14","stage_classifiercode":"99-11","member_number":"ty104718","first_name":"FRANK","last_name":"MCCULLA","classification":"C","division":"LIMITED","hit_factor":6.2096},{"match_name":"Blackstone Shooting Sports November 2016 USPSA Level 1","match_date":"2016-11-08","stage_classifiercode":"99-11","member_number":"A88724","first_name":"JESSICA","last_name":"DOIRON","classification":"C","division":"LIMITED","hit_factor":6.2084},{"match_name":"NPCCC 05-07-2017 USPSA","match_date":"2017-05-07","stage_classifiercode":"99-11","member_number":"A56265","first_name":"JOE","last_name":"ORNELAS","classification":"M","division":"LIMITED","hit_factor":6.2069},{"match_name":"NPCCC 05-07-2017 USPSA","match_date":"2017-05-07","stage_classifiercode":"99-11","member_number":"A98779","first_name":"SCOTT","last_name":"COLLINS","classification":"U","division":"LIMITED","hit_factor":6.2057},{"match_name":"WNPL USPSA - Nov 2017","match_date":"2017-11-05","stage_classifiercode":"99-11","member_number":"A76415","first_name":"SHAY","last_name":"MARCY","classification":"D","division":"LIMITED","hit_factor":6.2053},{"match_name":"Pinetucky USPSA 04-23-16","match_date":"2016-04-23","stage_classifiercode":"99-11","member_number":"TY61427","first_name":"MICHAEL","last_name":"NYLAND","classification":"B","division":"LIMITED","hit_factor":6.2016},{"match_name":"TPS USPSA at CMP March 18 2017","match_date":"2017-03-18","stage_classifiercode":"99-11","member_number":"A97670","first_name":"NATHAN","last_name":"BURKE","classification":"U","division":"LIMITED","hit_factor":6.2016},{"match_name":"WNPL USPSA - REDEMPTION - NOVEMBER 2016","match_date":"2016-11-06","stage_classifiercode":"99-11","member_number":"\"\"","first_name":"JEREMIAH","last_name":"KIRKLAND","classification":"U","division":"LIMITED","hit_factor":6.2016},{"match_name":"Custer USPSA Mar 7th 2021","match_date":"2021-03-07","stage_classifiercode":"99-11","member_number":"A125553","first_name":"PHILLIP","last_name":"OCONNOR","classification":"C","division":"LIMITED","hit_factor":6.2007},{"match_name":"WVPPS November 2018","match_date":"2018-11-18","stage_classifiercode":"99-11","member_number":"TY53740","first_name":"MARY ANN","last_name":"COOPER","classification":"C","division":"LIMITED","hit_factor":6.2007},{"match_name":"WVRPC USPSA 2APR2016","match_date":"2016-04-02","stage_classifiercode":"99-11","member_number":"A90672","first_name":"CHRIS","last_name":"DUNN","classification":"U","division":"LIMITED","hit_factor":6.1995},{"match_name":"Brazosland Pistoleros August 20 2017","match_date":"2017-08-20","stage_classifiercode":"99-11","member_number":"A81359","first_name":"LAN","last_name":"NGUYEN","classification":"A","division":"LIMITED","hit_factor":6.1977},{"match_name":"RPS November 2018 USPSA Match","match_date":"2018-11-10","stage_classifiercode":"99-11","member_number":"A63549","first_name":"JEFFREY","last_name":"ABERNATHY","classification":"C","division":"LIMITED","hit_factor":6.1972},{"match_name":"Hopkinton June  2016","match_date":"2016-06-04","stage_classifiercode":"99-11","member_number":"A39028","first_name":"JOHN","last_name":"SARDINA","classification":"M","division":"LIMITED","hit_factor":6.1962},{"match_name":"PTPC April 2nd USPSA Match","match_date":"2017-04-02","stage_classifiercode":"99-11","member_number":"PEN","first_name":"JOEL","last_name":"REIRICH","classification":"U","division":"LIMITED","hit_factor":6.1947},{"match_name":"Springfield Tactical Shooters 04/05/2018","match_date":"2018-04-05","stage_classifiercode":"99-11","member_number":"A107600","first_name":"GEORGE","last_name":"BURNS","classification":"\"\"","division":"LIMITED","hit_factor":6.1937},{"match_name":"Richmond Boro Gun Club April 2017 USPSA Pistol Match","match_date":"2017-04-08","stage_classifiercode":"99-11","member_number":"TY93686","first_name":"CLIFF","last_name":"AVERSANO JR","classification":"U","division":"LIMITED","hit_factor":6.1935},{"match_name":"Ontelaunee USPSA  July 2018","match_date":"2018-07-29","stage_classifiercode":"99-11","member_number":"A72328","first_name":"RONALDO","last_name":"PARAN","classification":"C","division":"LIMITED","hit_factor":6.1905},{"match_name":"Armory Indoor League","match_date":"2018-02-08","stage_classifiercode":"99-11","member_number":"A99024","first_name":"FELIPE","last_name":"CERVANTES","classification":"C","division":"LIMITED","hit_factor":6.1889},{"match_name":"Grandbaggers 07-05-2018","match_date":"2018-07-05","stage_classifiercode":"99-11","member_number":"TY110238","first_name":"ZACK","last_name":"FISHER","classification":"C","division":"LIMITED","hit_factor":6.1856},{"match_name":"Blackstone Shooting Sports May 2017 USPSA Pistol Level 1","match_date":"2017-05-09","stage_classifiercode":"99-11","member_number":"A100423","first_name":"JASMINE","last_name":"GORDON","classification":"C","division":"LIMITED","hit_factor":6.1856},{"match_name":"LGCSEMPS April 2018 Special Classifier","match_date":"2018-04-08","stage_classifiercode":"99-11","member_number":"TY85415","first_name":"SALAM","last_name":"FATOHI","classification":"C","division":"LIMITED","hit_factor":6.1856},{"match_name":"RBGC 2017-06-24","match_date":"2017-06-24","stage_classifiercode":"99-11","member_number":"TY78219","first_name":"GUSTAVO","last_name":"REYES","classification":"X","division":"LIMITED","hit_factor":6.1844},{"match_name":"Applied IN25 USPSA April Classifier 2018","match_date":"2018-04-17","stage_classifiercode":"99-11","member_number":"a78635","first_name":"ROB","last_name":"MCGUIRE","classification":"B","division":"LIMITED","hit_factor":6.1828},{"match_name":"Hopkinton USPSA May 2017","match_date":"2017-05-06","stage_classifiercode":"99-11","member_number":"TY76786","first_name":"ROB","last_name":"LACROIX","classification":"M","division":"LIMITED","hit_factor":6.1798},{"match_name":"Rio Salado UPPL September 2020","match_date":"2020-09-13","stage_classifiercode":"99-11","member_number":"FY28831","first_name":"ALAN","last_name":"GLICKMAN","classification":"B","division":"LIMITED","hit_factor":6.1785},{"match_name":"ANPRACS USPSA 5/16/21 CLASSIFIER MATCH","match_date":"2021-05-16","stage_classifiercode":"99-11","member_number":"TY96203","first_name":"GENE","last_name":"VANNI","classification":"C","division":"LIMITED","hit_factor":6.1785},{"match_name":"SAPSC Weekly USPSA Classifier Match 20170221","match_date":"2017-02-22","stage_classifiercode":"99-11","member_number":"A85815","first_name":"TODD","last_name":"KELLAR","classification":"C","division":"LIMITED","hit_factor":6.1785},{"match_name":"PSAC_20161022","match_date":"2016-10-22","stage_classifiercode":"99-11","member_number":"L3928","first_name":"BENJAMIN","last_name":"GO","classification":"\"\"","division":"LIMITED","hit_factor":6.1776},{"match_name":"Ontelaunee USPSA July 2016","match_date":"2016-07-23","stage_classifiercode":"99-11","member_number":"FY82148","first_name":"CLYDE","last_name":"FORMILLEZA","classification":"D","division":"LIMITED","hit_factor":6.1776},{"match_name":"PSAC_20161022","match_date":"2016-10-22","stage_classifiercode":"99-11","member_number":"A90490","first_name":"LEE","last_name":"SCHOENIKE","classification":"\"\"","division":"LIMITED","hit_factor":6.177},{"match_name":"2017 EOD Warrior Foundation Match","match_date":"2017-04-29","stage_classifiercode":"99-11","member_number":"L4120","first_name":"MICHAEL","last_name":"RAMOS","classification":"C","division":"LIMITED","hit_factor":6.1768},{"match_name":"ARPC USPSA Match 3-26-17","match_date":"2017-03-26","stage_classifiercode":"99-11","member_number":"TY41747","first_name":"GENE","last_name":"GHILARDI","classification":"B","division":"LIMITED","hit_factor":6.1768},{"match_name":"UVPS Practice 6-19-21","match_date":"2021-06-19","stage_classifiercode":"99-11","member_number":"A134980","first_name":"OWEN","last_name":"ATKINS","classification":"U","division":"LIMITED","hit_factor":6.1742},{"match_name":"Ontelaunee USPSA  July 2018","match_date":"2018-07-29","stage_classifiercode":"99-11","member_number":"FY83386","first_name":"PAUL","last_name":"ZEBRO","classification":"B","division":"LIMITED","hit_factor":6.1728},{"match_name":"CSA Coalfield Shooters Association USPSA SEPTEMBER 2020","match_date":"2020-09-12","stage_classifiercode":"99-11","member_number":"A87413","first_name":"JEFF","last_name":"ADKINS","classification":"B","division":"LIMITED","hit_factor":6.1728},{"match_name":"Extreme GM","match_date":"2020-06-12","stage_classifiercode":"99-11","member_number":"FY88426","first_name":"FRANCISCO","last_name":"ROMERO","classification":"C","division":"LIMITED","hit_factor":6.1714},{"match_name":"BSPSC 2021 July Geo Thompson Single Stack Classic","match_date":"2021-07-11","stage_classifiercode":"99-11","member_number":"A43042","first_name":"DAN","last_name":"HASH","classification":"A","division":"LIMITED","hit_factor":6.1669},{"match_name":"TriggerGuard USPSA Classifier Match","match_date":"2018-03-24","stage_classifiercode":"99-11","member_number":"A108361","first_name":"ZACHARIAH","last_name":"POWELL","classification":"U","division":"LIMITED","hit_factor":6.1662},{"match_name":"AGC_20170903","match_date":"2017-09-03","stage_classifiercode":"99-11","member_number":"F43496","first_name":"HOWARD","last_name":"FRYER","classification":"C","division":"LIMITED","hit_factor":6.1644},{"match_name":"Richmond Hot Shots January 17-2016 USPSA Pistol","match_date":"2016-01-17","stage_classifiercode":"99-11","member_number":"TY72664","first_name":"ROMIL","last_name":"JIMENEZ","classification":"C","division":"LIMITED","hit_factor":6.1633},{"match_name":"San Juan Shooters ","match_date":"2017-07-08","stage_classifiercode":"99-11","member_number":"TY68119","first_name":"DANIEL","last_name":"LAMBERT","classification":"D","division":"LIMITED","hit_factor":6.1628},{"match_name":"Payson Practical Shooters Action Shooting ","match_date":"2021-11-04","stage_classifiercode":"99-11","member_number":"TY65635","first_name":"CHRIS","last_name":"COLLINS","classification":"C","division":"LIMITED","hit_factor":6.1617},{"match_name":"NPCCC 05-07-2017 USPSA","match_date":"2017-05-07","stage_classifiercode":"99-11","member_number":"B55","first_name":"CHRISTOPHER","last_name":"OAKES","classification":"C","division":"LIMITED","hit_factor":6.1594},{"match_name":"Target  Sports Central Indiana Championship","match_date":"2020-08-22","stage_classifiercode":"99-11","member_number":"TY80201","first_name":"TOM","last_name":"RAPALA","classification":"B","division":"LIMITED","hit_factor":6.159},{"match_name":"Maine Practical Shooters August 2016","match_date":"2016-08-27","stage_classifiercode":"99-11","member_number":"A97314","first_name":"STEVEN","last_name":"BURGESS","classification":"U","division":"LIMITED","hit_factor":6.159},{"match_name":"Target  Sports Central Indiana Championship","match_date":"2020-08-22","stage_classifiercode":"99-11","member_number":"TY70828","first_name":"MICHAEL","last_name":"WESSLER","classification":"U","division":"LIMITED","hit_factor":6.1584},{"match_name":"LIPSA -  April 17th 2016 - USPSA Special Classifier Match","match_date":"2016-04-17","stage_classifiercode":"99-11","member_number":"A85390","first_name":"EDWARD","last_name":"DUARTE","classification":"U","division":"LIMITED","hit_factor":6.1574},{"match_name":"MISS USPSA Match 10-5-16","match_date":"2016-10-03","stage_classifiercode":"99-11","member_number":"TY74021","first_name":"MIKHAIL","last_name":"BLYAKHER","classification":"M","division":"LIMITED","hit_factor":6.1567},{"match_name":"Crooked Creek Pistol League - June 2017","match_date":"2017-06-24","stage_classifiercode":"99-11","member_number":"TY91700","first_name":"JEFF","last_name":"MORSE","classification":"C","division":"LIMITED","hit_factor":6.1562},{"match_name":"Cactus USPSA ALL CLASSIFIER August 2020","match_date":"2020-08-02","stage_classifiercode":"99-11","member_number":"TY89600","first_name":"TODD","last_name":"CROSBY","classification":"U","division":"LIMITED","hit_factor":6.1562},{"match_name":"HOPS USPSA 072118","match_date":"2018-07-21","stage_classifiercode":"99-11","member_number":"TY75981","first_name":"BENNY","last_name":"HEFLEY","classification":"B","division":"LIMITED","hit_factor":6.156},{"match_name":"2016-02-06 USPSA at Phoenix Rod and Gun Club","match_date":"2016-02-06","stage_classifiercode":"99-11","member_number":"A73590","first_name":"JW","last_name":"PHILLIPS","classification":"A","division":"LIMITED","hit_factor":6.156},{"match_name":"Lafayette Practical Shooters - WED- June 20","match_date":"2018-06-20","stage_classifiercode":"99-11","member_number":"A108820","first_name":"COLIN","last_name":"MONTGOMERY","classification":"C","division":"LIMITED","hit_factor":6.1556},{"match_name":"MAPSA June Special Classifier","match_date":"2018-06-09","stage_classifiercode":"99-11","member_number":"L4043","first_name":"THOMAS","last_name":"KREBSBACH","classification":"C","division":"LIMITED","hit_factor":6.1538},{"match_name":"CSoS Feb2016 Match","match_date":"2016-02-21","stage_classifiercode":"99-11","member_number":"Ty54321","first_name":"BRANDON","last_name":"BEAUDRY","classification":"C","division":"LIMITED","hit_factor":6.1538},{"match_name":"Baps March Uspsa","match_date":"2016-03-19","stage_classifiercode":"99-11","member_number":"L3297","first_name":"JACK","last_name":"SWEET","classification":"C","division":"LIMITED","hit_factor":6.1521},{"match_name":"Prescott 1st Saturday 8-05-17","match_date":"2017-08-05","stage_classifiercode":"99-11","member_number":"A85099","first_name":"JESSICA","last_name":"NIETZEL","classification":"B","division":"LIMITED","hit_factor":6.1518},{"match_name":"SKSC USPSA April 2018 Match","match_date":"2018-04-21","stage_classifiercode":"99-11","member_number":"\"\"","first_name":"JACOB","last_name":"HOLST","classification":"\"\"","division":"LIMITED","hit_factor":6.1506},{"match_name":"WGC April 2017 USPSA","match_date":"2017-04-23","stage_classifiercode":"99-11","member_number":"TY71159","first_name":"DENNIS","last_name":"LEBEAU","classification":"C","division":"LIMITED","hit_factor":6.1506},{"match_name":"BAS  April 2017 USPSA","match_date":"2017-04-15","stage_classifiercode":"99-11","member_number":"L3330","first_name":"WADE","last_name":"PRICE","classification":"U","division":"LIMITED","hit_factor":6.1503},{"match_name":"Fairfax PS USPSA September 2017","match_date":"2017-09-19","stage_classifiercode":"99-11","member_number":"A88424","first_name":"CRAIG","last_name":"PETERSON","classification":"C","division":"LIMITED","hit_factor":6.1503},{"match_name":"USPSA MO21 2Alpha SBRC December 22 2018","match_date":"2018-12-22","stage_classifiercode":"99-11","member_number":"TY111485","first_name":"WESTON","last_name":"HUNTER","classification":"U","division":"LIMITED","hit_factor":6.1501},{"match_name":"USPSA","match_date":"2017-09-03","stage_classifiercode":"99-11","member_number":"TY89752","first_name":"JD","last_name":"FAIRCHILD","classification":"\"\"","division":"LIMITED","hit_factor":6.1501},{"match_name":"MVS USPSA 9-20-17","match_date":"2017-09-20","stage_classifiercode":"99-11","member_number":"\"\"","first_name":"VALERIY","last_name":"PLOTNIKOV","classification":"\"\"","division":"LIMITED","hit_factor":6.1497},{"match_name":"Matamoras USPSA August Match","match_date":"2017-08-27","stage_classifiercode":"99-11","member_number":"A60297","first_name":"PETER","last_name":"BRICKNER","classification":"B","division":"LIMITED","hit_factor":6.1497},{"match_name":"DAPS USPSA at ETTS 7-8-17","match_date":"2017-07-08","stage_classifiercode":"99-11","member_number":"A59968","first_name":"TIBOR","last_name":"KOVACS","classification":"B","division":"LIMITED","hit_factor":6.1493},{"match_name":"Richmond Hot Shots April 14-15-2018 USPSA Pistol Match","match_date":"2018-04-14","stage_classifiercode":"99-11","member_number":"A101186","first_name":"ZACH","last_name":"BASICH","classification":"B","division":"LIMITED","hit_factor":6.1489},{"match_name":"ISPS 6/19/2016 USPSA","match_date":"2016-06-19","stage_classifiercode":"99-11","member_number":"A73101","first_name":"RALPH","last_name":"GRIENINGER","classification":"B","division":"LIMITED","hit_factor":6.1485},{"match_name":"NCPL 2017 March","match_date":"2017-03-26","stage_classifiercode":"99-11","member_number":"A45120","first_name":"TIM","last_name":"JONES","classification":"B","division":"LIMITED","hit_factor":6.1485},{"match_name":"Shasta Shooters 2017 June Classifier Match","match_date":"2017-06-10","stage_classifiercode":"99-11","member_number":"TY21065","first_name":"PETE","last_name":"RAY","classification":"C","division":"LIMITED","hit_factor":6.1475},{"match_name":"WNPL USPSA - Nov 2017","match_date":"2017-11-05","stage_classifiercode":"99-11","member_number":"TY91971","first_name":"LARRY","last_name":"SKINNER","classification":"B","division":"LIMITED","hit_factor":6.146},{"match_name":"INAS May 2020 USPSA","match_date":"2020-05-09","stage_classifiercode":"99-11","member_number":"TY102762","first_name":"RANDY","last_name":"LEWIS","classification":"Unclassified","division":"LIMITED","hit_factor":6.146},{"match_name":"Fairfax PS USPSA  2018 October","match_date":"2018-10-16","stage_classifiercode":"99-11","member_number":"A88424","first_name":"CRAIG","last_name":"PETERSON","classification":"C","division":"LIMITED","hit_factor":6.1433},{"match_name":"NTPS-SE November Classifier 2016","match_date":"2016-11-19","stage_classifiercode":"99-11","member_number":"A80553","first_name":"RYAN","last_name":"CALHOON","classification":"\"\"","division":"LIMITED","hit_factor":6.1417},{"match_name":"MPSA 021817","match_date":"2017-02-18","stage_classifiercode":"99-11","member_number":"L4120","first_name":"MICHAEL","last_name":"RAMOS","classification":"C","division":"LIMITED","hit_factor":6.1414},{"match_name":"IN19 ACC USPSA September 23","match_date":"2018-09-23","stage_classifiercode":"99-11","member_number":"TY53740","first_name":"MARYANN","last_name":"COOPER","classification":"C","division":"LIMITED","hit_factor":6.1414},{"match_name":"Kettlefoot May 2021 USPSA","match_date":"2021-05-15","stage_classifiercode":"99-11","member_number":"A18438","first_name":"JOHN","last_name":"ANDERSON","classification":"","division":"LIMITED","hit_factor":6.1404},{"match_name":"PSAC_20161022","match_date":"2016-10-22","stage_classifiercode":"99-11","member_number":"FY41015","first_name":"ROGER","last_name":"MEDINA","classification":"\"\"","division":"LIMITED","hit_factor":6.135},{"match_name":"BUAS December Match","match_date":"2016-12-11","stage_classifiercode":"99-11","member_number":"a446","first_name":"DAN","last_name":"SIERPINA","classification":"B","division":"LIMITED","hit_factor":6.1343},{"match_name":"Veterans 3 Gun PM Classifier Benefit Match","match_date":"2020-02-22","stage_classifiercode":"99-11","member_number":"A110008","first_name":"DAN","last_name":"FARMER","classification":"C","division":"LIMITED","hit_factor":6.1336},{"match_name":"FBPPC AUGUST 2016 IPSC MATCH","match_date":"2016-08-13","stage_classifiercode":"99-11","member_number":"TY16870","first_name":"RANDY","last_name":"O'CONNOR","classification":"C","division":"LIMITED","hit_factor":6.1321},{"match_name":"Grandbaggers August 2017","match_date":"2017-08-03","stage_classifiercode":"99-11","member_number":"A81261","first_name":"THOMAS","last_name":"CLYDE","classification":"U","division":"LIMITED","hit_factor":6.1314},{"match_name":"LRC USPSA 2016-6-15","match_date":"2016-06-15","stage_classifiercode":"99-11","member_number":"\"\"","first_name":"DENNIS","last_name":"BIZEAU","classification":"U","division":"LIMITED","hit_factor":6.1311},{"match_name":"PRG 2017 Classifier Match","match_date":"2017-02-19","stage_classifiercode":"99-11","member_number":"A99176","first_name":"JOSEPH","last_name":"ELUMBA","classification":"U","division":"LIMITED","hit_factor":6.1303},{"match_name":"2016-05-07 USPSA at Phoenix Rod and Gun Club","match_date":"2016-05-07","stage_classifiercode":"99-11","member_number":"A86225","first_name":"BRYSON","last_name":"KOROLSKY","classification":"D","division":"LIMITED","hit_factor":6.1275},{"match_name":"Hallstead USPSA  July Match","match_date":"2020-07-25","stage_classifiercode":"99-11","member_number":"A108852","first_name":"JERRY","last_name":"PAGLIA","classification":"C","division":"LIMITED","hit_factor":6.1275},{"match_name":"Matamoras USPSA August Match","match_date":"2017-08-27","stage_classifiercode":"99-11","member_number":"A101389","first_name":"SHAWN","last_name":"DOVE","classification":"C","division":"LIMITED","hit_factor":6.1275},{"match_name":"PSAC_20161022","match_date":"2016-10-22","stage_classifiercode":"99-11","member_number":"TY65590","first_name":"STEVE","last_name":"STETLER","classification":"\"\"","division":"LIMITED","hit_factor":6.1258},{"match_name":"Competitive Shooters of Lake Norman Thursday evening indoor USPSA pistol match North Carolina","match_date":"2017-08-03","stage_classifiercode":"99-11","member_number":"A104282","first_name":"MATTHEW","last_name":"GROSS","classification":"D","division":"LIMITED","hit_factor":6.1249},{"match_name":"NPCCC 05-07-2017 USPSA","match_date":"2017-05-07","stage_classifiercode":"99-11","member_number":"A69369","first_name":"GLENN","last_name":"NYENHUIS","classification":"B","division":"LIMITED","hit_factor":6.1249},{"match_name":"SKSC USPSA April 2018 Match","match_date":"2018-04-21","stage_classifiercode":"99-11","member_number":"A96871","first_name":"CORY","last_name":"WISELEY","classification":"C","division":"LIMITED","hit_factor":6.1224},{"match_name":"HOPS USPSA 072118","match_date":"2018-07-21","stage_classifiercode":"99-11","member_number":"A104729","first_name":"KEITH","last_name":"STEPHENSON","classification":"B","division":"LIMITED","hit_factor":6.1224},{"match_name":"SAPSA January 2020 Match","match_date":"2020-01-18","stage_classifiercode":"99-11","member_number":"A123620","first_name":"MIKE","last_name":"COOK","classification":"U","division":"LIMITED","hit_factor":6.1224},{"match_name":"ECPS USPSA 19 May 18","match_date":"2018-05-19","stage_classifiercode":"99-11","member_number":"A108424","first_name":"CASEY","last_name":"GRISSETT","classification":"U","division":"LIMITED","hit_factor":6.1224},{"match_name":"WVPPS November 2018","match_date":"2018-11-18","stage_classifiercode":"99-11","member_number":"TY66824","first_name":"MICHAEL","last_name":"MCCAULEY","classification":"B","division":"LIMITED","hit_factor":6.1176},{"match_name":"ORPCI 2017 June USPSA Classifer Match","match_date":"2017-06-25","stage_classifiercode":"99-11","member_number":"\"\"","first_name":"MICKI","last_name":"PETKOVIC","classification":"X","division":"LIMITED","hit_factor":6.1155},{"match_name":"ORPCI USPSA Friday 2021.07.16","match_date":"2021-07-16","stage_classifiercode":"99-11","member_number":"TY123534","first_name":"DAVID","last_name":"GREGORY","classification":"C","division":"LIMITED","hit_factor":6.114},{"match_name":"HSA USPSA March 2020","match_date":"2020-03-04","stage_classifiercode":"99-11","member_number":"A94001","first_name":"NICK","last_name":"REYNOLDS","classification":"G","division":"LIMITED","hit_factor":6.1135},{"match_name":"CJR&PC USPSA  June 10","match_date":"2018-06-10","stage_classifiercode":"99-11","member_number":"TY70371","first_name":"DAN","last_name":"RICHMOND","classification":"\"\"","division":"LIMITED","hit_factor":6.1125},{"match_name":"Coastal Area Practical Shooters 7-22-17 Special Classifier","match_date":"2017-07-22","stage_classifiercode":"99-11","member_number":"A104657","first_name":"JAMEY2","last_name":"SAUNDERS","classification":"U","division":"LIMITED","hit_factor":6.1105},{"match_name":"HOPS USPSA 072118","match_date":"2018-07-21","stage_classifiercode":"99-11","member_number":"A104029","first_name":"BRODY","last_name":"ADKISON","classification":"D","division":"LIMITED","hit_factor":6.1086},{"match_name":"SMPSA 2018-01 Pistol","match_date":"2018-01-14","stage_classifiercode":"99-11","member_number":"FY97066","first_name":"CHRIS","last_name":"DAVIS","classification":"C","division":"LIMITED","hit_factor":6.1078},{"match_name":"MSSA Uspsa Match 1/3/16","match_date":"2016-01-03","stage_classifiercode":"99-11","member_number":"A79446","first_name":"BEN","last_name":"BLANKENSHIP","classification":"C","division":"LIMITED","hit_factor":6.1078},{"match_name":"Silver Practical 7-16-2016","match_date":"2016-07-10","stage_classifiercode":"99-11","member_number":"\"\"","first_name":"ATIM","last_name":"COPPERSTONE","classification":"U","division":"LIMITED","hit_factor":6.1069},{"match_name":"NAAS 03-05-2016","match_date":"2017-03-05","stage_classifiercode":"99-11","member_number":"TY81668","first_name":"BRENT","last_name":"WILEY","classification":"B","division":"LIMITED","hit_factor":6.1039},{"match_name":"Tangi May 2016 USPSA","match_date":"2016-05-29","stage_classifiercode":"99-11","member_number":"TY66899","first_name":"JOHN","last_name":"HOFFMAN","classification":"B","division":"LIMITED","hit_factor":6.1033},{"match_name":"CCAS June 2016","match_date":"2016-06-25","stage_classifiercode":"99-11","member_number":"A80243","first_name":"BRAD","last_name":"DAY","classification":"C","division":"LIMITED","hit_factor":6.1017},{"match_name":"MPSA 021817","match_date":"2017-02-18","stage_classifiercode":"99-11","member_number":"A100694","first_name":"MICHAEL","last_name":"BROLASKI","classification":"U","division":"LIMITED","hit_factor":6.1017},{"match_name":"CASA USPSA  Jul 2016","match_date":"2016-07-09","stage_classifiercode":"99-11","member_number":"A74027","first_name":"JUNIOR","last_name":"SIMS","classification":"C","division":"LIMITED","hit_factor":6.1017},{"match_name":"Augusta USPSA 10-14-18","match_date":"2018-10-14","stage_classifiercode":"99-11","member_number":"TY83098","first_name":"KRYSTAL","last_name":"DUNN","classification":"C","division":"LIMITED","hit_factor":6.099},{"match_name":"BSPSC 2017 April Special Classifier","match_date":"2017-04-09","stage_classifiercode":"99-11","member_number":"A101150","first_name":"BYRON","last_name":"WHITNEY","classification":"U","division":"LIMITED","hit_factor":6.099},{"match_name":"RDS November 2020 USPSA","match_date":"2020-11-07","stage_classifiercode":"99-11","member_number":"TY93346","first_name":"GREG","last_name":"FANCHER","classification":"C","division":"LIMITED","hit_factor":6.0976},{"match_name":"Crooked Creek Pistol League - June 2016","match_date":"2016-06-25","stage_classifiercode":"99-11","member_number":"A85633","first_name":"JOSH","last_name":"TARRANT","classification":"\u0000","division":"LIMITED","hit_factor":6.0976},{"match_name":"NCPS USPSA Handgun Match November 27 2016","match_date":"2016-11-27","stage_classifiercode":"99-11","member_number":"L3404","first_name":"GAYL","last_name":"MORSE","classification":"A","division":"LIMITED","hit_factor":6.0976},{"match_name":"APSC 4th Annual Holiday Hosefest USPSA Match 12-02-17","match_date":"2017-12-02","stage_classifiercode":"99-11","member_number":"\"\"","first_name":"LUAN","last_name":"NGUYEN","classification":"U","division":"LIMITED","hit_factor":6.0961},{"match_name":"Ontelaunee USPSA  July 2018","match_date":"2018-07-29","stage_classifiercode":"99-11","member_number":"TY78049","first_name":"PAUL","last_name":"KNIGHT","classification":"C","division":"LIMITED","hit_factor":6.0961},{"match_name":"MSSA Uspsa Match 1/3/16","match_date":"2016-01-03","stage_classifiercode":"99-11","member_number":"A92427","first_name":"JAY","last_name":"REEDY","classification":"U","division":"LIMITED","hit_factor":6.0948},{"match_name":"RPS December 2017 USPSA Match","match_date":"2017-12-09","stage_classifiercode":"99-11","member_number":"\"\"","first_name":"MARK","last_name":"LAYSON","classification":"U","division":"LIMITED","hit_factor":6.0948},{"match_name":"OK15 USPSA at USSA","match_date":"2017-12-10","stage_classifiercode":"99-11","member_number":"TY96845","first_name":"GARRETT","last_name":"GROVER","classification":"U","division":"LIMITED","hit_factor":6.0942},{"match_name":"Rio Salado Hosemasters February 2021","match_date":"2021-02-27","stage_classifiercode":"99-11","member_number":"A82915","first_name":"CODY","last_name":"VINCENT","classification":"M","division":"LIMITED","hit_factor":6.0938},{"match_name":"GTS Indoor USPSA February 27 2020","match_date":"2020-02-28","stage_classifiercode":"99-11","member_number":"A-100243","first_name":"TATE","last_name":"AABERG","classification":"B","division":"LIMITED","hit_factor":6.0938},{"match_name":"Winter League # 6","match_date":"2018-01-05","stage_classifiercode":"99-11","member_number":"A94731","first_name":"BILL","last_name":"ROBERTS","classification":"C","division":"LIMITED","hit_factor":6.0936},{"match_name":"TBAS USPSA Match 2/23/20","match_date":"2020-02-23","stage_classifiercode":"99-11","member_number":"A100877","first_name":"RORY","last_name":"MCBRIDE","classification":"C","division":"LIMITED","hit_factor":6.0927},{"match_name":"ITPSC January USPSA","match_date":"2017-01-21","stage_classifiercode":"99-11","member_number":"A41980","first_name":"ERIC","last_name":"GAMBILL","classification":"M","division":"LIMITED","hit_factor":6.0914},{"match_name":"STAGE ZERO SHOOTING SUPPLY USPSA","match_date":"2020-07-16","stage_classifiercode":"99-11","member_number":"A127375","first_name":"HEATH","last_name":"ISAAC","classification":"U","division":"LIMITED","hit_factor":6.0914},{"match_name":"PBR USPSA Classifier Match","match_date":"2018-06-11","stage_classifiercode":"99-11","member_number":"Ty82683","first_name":"BRIAN","last_name":"WOLFF","classification":"B","division":"LIMITED","hit_factor":6.0914},{"match_name":"Prescott 1st Saturday 8-05-17","match_date":"2017-08-05","stage_classifiercode":"99-11","member_number":"CL46","first_name":"ROSCOE","last_name":"LIVINGSTON","classification":"B","division":"LIMITED","hit_factor":6.0908},{"match_name":"Deadwood Boys USPSA All Classifier Match - 29 July 2018","match_date":"2018-07-29","stage_classifiercode":"99-11","member_number":"TY82298","first_name":"WALTER","last_name":"MICHALOWSKI","classification":"U","division":"LIMITED","hit_factor":6.0897},{"match_name":"Rio Salado Hosemasters February 2021","match_date":"2021-02-27","stage_classifiercode":"99-11","member_number":"TY99718","first_name":"CHRISTOPHER","last_name":"CAMPBELL","classification":"C","division":"LIMITED","hit_factor":6.0879},{"match_name":"Range54 USPSA","match_date":"2018-05-04","stage_classifiercode":"99-11","member_number":"\"\"","first_name":"JEREMY","last_name":"HARDIN","classification":"C","division":"LIMITED","hit_factor":6.087},{"match_name":"DAPS USPSA at ETTS 7-8-17","match_date":"2017-07-08","stage_classifiercode":"99-11","member_number":"PEN","first_name":"ANDREW","last_name":"ADAMSON","classification":"U","division":"LIMITED","hit_factor":6.087},{"match_name":"Dundee Practical Shooters - Single Stack Challenge - Jan 23 2021","match_date":"2021-01-23","stage_classifiercode":"99-11","member_number":"A131153","first_name":"JESSE","last_name":"ANDERSEN","classification":"U","division":"LIMITED","hit_factor":6.0847},{"match_name":"Clone Tue","match_date":"2017-03-29","stage_classifiercode":"99-11","member_number":"ty87616","first_name":"MITCH","last_name":"BARLOW","classification":"M","division":"LIMITED","hit_factor":6.0837},{"match_name":"Coyote Tuesday USPSA match 3-28-17 Classifier Match","match_date":"2017-03-29","stage_classifiercode":"99-11","member_number":"TY87616","first_name":"MITCH","last_name":"BARLOW","classification":"M","division":"LIMITED","hit_factor":6.0837},{"match_name":"AGC_20170903","match_date":"2017-09-03","stage_classifiercode":"99-11","member_number":"\"\"","first_name":"BERNT ERIK","last_name":"ROST","classification":"U","division":"LIMITED","hit_factor":6.0827},{"match_name":"COPS Dec 2015 USPSA","match_date":"2015-12-06","stage_classifiercode":"99-11","member_number":"A92697","first_name":"ELI","last_name":"KOYN","classification":"C","division":"LIMITED","hit_factor":6.0827},{"match_name":"OREGON ARPC CC05 USPSA AUGUST 12 2017","match_date":"2017-08-12","stage_classifiercode":"99-11","member_number":"A87752","first_name":"JOANNE","last_name":"TEGTMEYER","classification":"B","division":"LIMITED","hit_factor":6.0819},{"match_name":"LCSA USPSA March Match","match_date":"2016-03-12","stage_classifiercode":"99-11","member_number":"\"\"","first_name":"JONATHAN","last_name":"MCCLAIN","classification":"X","division":"LIMITED","hit_factor":6.0811},{"match_name":"Hawkeye Gun Club July 2016 Match","match_date":"2016-07-16","stage_classifiercode":"99-11","member_number":"L3834","first_name":"MATTHEW","last_name":"CHILDS","classification":"B","division":"LIMITED","hit_factor":6.08},{"match_name":"HTF Practical Shooters","match_date":"2018-07-01","stage_classifiercode":"99-11","member_number":"A97854","first_name":"CONNOR","last_name":"WILLIAMS","classification":"B","division":"LIMITED","hit_factor":6.0797},{"match_name":"Coastal Area Practical Shooters 7-22-17 Special Classifier","match_date":"2017-07-22","stage_classifiercode":"99-11","member_number":"\"\"","first_name":"NICHOLAS","last_name":"MARLOW","classification":"U","division":"LIMITED","hit_factor":6.079},{"match_name":"Heritage March 2021 USPSA","match_date":"2021-03-13","stage_classifiercode":"99-11","member_number":"A33562","first_name":"PATRICK","last_name":"KANGETER","classification":"A","division":"LIMITED","hit_factor":6.079},{"match_name":"Crooked Creek Pistol League - June 2016","match_date":"2016-06-25","stage_classifiercode":"99-11","member_number":"A89245","first_name":"CHRIS","last_name":"TRYON","classification":"B","division":"LIMITED","hit_factor":6.0764},{"match_name":"Shoot GTR USPSA MAY 24","match_date":"2016-05-24","stage_classifiercode":"99-11","member_number":"A88489","first_name":"ANNISTON","last_name":"BALUYOT","classification":"C","division":"LIMITED","hit_factor":6.0748},{"match_name":"Emmett July Match","match_date":"2017-07-21","stage_classifiercode":"99-11","member_number":"A92669","first_name":"SCOTT","last_name":"VICKERS","classification":"B","division":"LIMITED","hit_factor":6.0741},{"match_name":"CVSC  09-25-16","match_date":"2016-09-25","stage_classifiercode":"99-11","member_number":"TY79039","first_name":"WILLY","last_name":"CHERRY","classification":"C","division":"LIMITED","hit_factor":6.0738},{"match_name":"Bgs Hudson Week 6","match_date":"2017-02-19","stage_classifiercode":"99-11","member_number":"\"\"","first_name":"DENNIS","last_name":"FALAAS","classification":"U","division":"LIMITED","hit_factor":6.0738},{"match_name":"WVRPC USPSA 1SEPT2018","match_date":"2018-09-01","stage_classifiercode":"99-11","member_number":"FY90994","first_name":"PAUL","last_name":"BENSON","classification":"C","division":"LIMITED","hit_factor":6.0729},{"match_name":"LCSA  USPSA April 2017","match_date":"2017-04-08","stage_classifiercode":"99-11","member_number":"ty65386","first_name":"DAVID R","last_name":"MULOCK","classification":"B","division":"LIMITED","hit_factor":6.0719},{"match_name":"Springfield Tactical Shooters 04/05/2018","match_date":"2018-04-05","stage_classifiercode":"99-11","member_number":"A40542","first_name":"JOEL","last_name":"RIPPER","classification":"A","division":"LIMITED","hit_factor":6.069},{"match_name":"OK15 USPSA at USSA May 6th 2018","match_date":"2018-05-06","stage_classifiercode":"99-11","member_number":"A102348","first_name":"JERRY","last_name":"NUNNALLY","classification":"C","division":"LIMITED","hit_factor":6.069},{"match_name":"Pinetucky USPSA 04-23-16","match_date":"2016-04-23","stage_classifiercode":"99-11","member_number":"Ty93534","first_name":"DANNY","last_name":"IDICA","classification":"D","division":"LIMITED","hit_factor":6.0683},{"match_name":"CAPS USPSA June 2021","match_date":"2021-06-05","stage_classifiercode":"99-11","member_number":"TY92023","first_name":"PHILLIP","last_name":"FORTNEY","classification":"C","division":"LIMITED","hit_factor":6.0683},{"match_name":"RDS USPSA 8.13.16","match_date":"2016-08-13","stage_classifiercode":"99-11","member_number":"A77529","first_name":"JOSH","last_name":"PINCHES","classification":"B","division":"LIMITED","hit_factor":6.0683},{"match_name":"PSAC 20171028","match_date":"2017-10-28","stage_classifiercode":"99-11","member_number":"TY80572","first_name":"JONATHAN","last_name":"DEGENHARDT","classification":"U","division":"LIMITED","hit_factor":6.068},{"match_name":"MCPSL Pistol 3-10-18","match_date":"2018-03-10","stage_classifiercode":"99-11","member_number":"PEN","first_name":"JORDAN","last_name":"BUCHANAN","classification":"U","division":"LIMITED","hit_factor":6.0677},{"match_name":"OK15 USPSA at USSA May 6th 2018","match_date":"2018-05-06","stage_classifiercode":"99-11","member_number":"A89956","first_name":"JEFF","last_name":"GLANTON","classification":"C","division":"LIMITED","hit_factor":6.0677},{"match_name":"2018-05 Bone Creek USPSA","match_date":"2018-05-06","stage_classifiercode":"99-11","member_number":"\"\"","first_name":"RYAN","last_name":"NEWCOMB","classification":"U","division":"LIMITED","hit_factor":6.0674},{"match_name":"Coyote USPSA match 4-21-18","match_date":"2018-04-21","stage_classifiercode":"99-11","member_number":"A105344","first_name":"ERIC","last_name":"MAYBERRY","classification":"D","division":"LIMITED","hit_factor":6.0606},{"match_name":"Deadwood Boys USPSA All Classifier Match - 29 July 2018","match_date":"2018-07-29","stage_classifiercode":"99-11","member_number":"A90455","first_name":"CHEN","last_name":"LEE","classification":"U","division":"LIMITED","hit_factor":6.0606},{"match_name":"BRSP Tuesday Night USPSA Match - May 15","match_date":"2018-05-16","stage_classifiercode":"99-11","member_number":"\"\"","first_name":"TOM","last_name":"KOLOSKI","classification":"\"\"","division":"LIMITED","hit_factor":6.0606},{"match_name":"Trigger Guard USPSA","match_date":"2016-04-02","stage_classifiercode":"99-11","member_number":"L3354","first_name":"RYAN","last_name":"DOLL","classification":"C","division":"LIMITED","hit_factor":6.0606},{"match_name":"Ontelaunee USPSA  July 2018","match_date":"2018-07-29","stage_classifiercode":"99-11","member_number":"A95308","first_name":"DAVID","last_name":"AZZOLI","classification":"C","division":"LIMITED","hit_factor":6.0606},{"match_name":"WVPPS November 2018","match_date":"2018-11-18","stage_classifiercode":"99-11","member_number":"TY99798","first_name":"ROBERT","last_name":"VAN SICKLE","classification":"C","division":"LIMITED","hit_factor":6.0606},{"match_name":"BHPSC Monthly Match - Jul 2020","match_date":"2020-07-31","stage_classifiercode":"99-11","member_number":"A100139","first_name":"JON","last_name":"MAYFIELD","classification":"C","division":"LIMITED","hit_factor":6.0606},{"match_name":"FBURG July 2018 Level I USPSA ","match_date":"2018-07-01","stage_classifiercode":"99-11","member_number":"A97243","first_name":"NATE","last_name":"LINDSLEY","classification":"U","division":"LIMITED","hit_factor":6.0606},{"match_name":"WPGC 10-1-18","match_date":"2018-10-01","stage_classifiercode":"99-11","member_number":"TY87914","first_name":"PATRICE","last_name":"SUTTER","classification":"C","division":"LIMITED","hit_factor":6.0574},{"match_name":"TPS USPSA at CMP March 18 2017","match_date":"2017-03-18","stage_classifiercode":"99-11","member_number":"A89181","first_name":"VINCE","last_name":"LAW","classification":"C","division":"LIMITED","hit_factor":6.0574},{"match_name":"SMPSA 2018-01 Pistol","match_date":"2018-01-14","stage_classifiercode":"99-11","member_number":"A93349","first_name":"JONATHAN","last_name":"PARKER","classification":"C","division":"LIMITED","hit_factor":6.057},{"match_name":"MCPSL Pistol 8-12-17","match_date":"2017-08-12","stage_classifiercode":"99-11","member_number":"A80581","first_name":"JOHN","last_name":"SNYDER","classification":"C","division":"LIMITED","hit_factor":6.0567},{"match_name":"Maine Practical Shooters August 2016","match_date":"2016-08-27","stage_classifiercode":"99-11","member_number":"a98632","first_name":"ZAC","last_name":"GREENIER","classification":"U","division":"LIMITED","hit_factor":6.0559},{"match_name":"Fairfax PS USPSA September 2017","match_date":"2017-09-19","stage_classifiercode":"99-11","member_number":"A105221","first_name":"QUANG","last_name":"BUI","classification":"U","division":"LIMITED","hit_factor":6.0543},{"match_name":"MRPC OHS02 042218","match_date":"2018-04-21","stage_classifiercode":"99-11","member_number":"A108335","first_name":"JAMES","last_name":"LUDWICK","classification":"C","division":"LIMITED","hit_factor":6.053},{"match_name":"MVS ANPRACS USPSA 2-21-16","match_date":"2016-02-21","stage_classifiercode":"99-11","member_number":"\"\"","first_name":"GABERIEL","last_name":"NIESEN","classification":"U","division":"LIMITED","hit_factor":6.053},{"match_name":"Bayou City USPSA Weekly Dec 17","match_date":"2020-12-18","stage_classifiercode":"99-11","member_number":"A86195","first_name":"TONY","last_name":"KAMMERER","classification":"C","division":"LIMITED","hit_factor":6.053},{"match_name":"CSoS Feb2016 Match","match_date":"2016-02-21","stage_classifiercode":"99-11","member_number":"A93673","first_name":"JOE","last_name":"NEWTON","classification":"U","division":"LIMITED","hit_factor":6.0523},{"match_name":"HTF Practical Shooters","match_date":"2018-10-04","stage_classifiercode":"99-11","member_number":"A70300","first_name":"DAVE","last_name":"HORN","classification":"A","division":"LIMITED","hit_factor":6.0523},{"match_name":"MAPSA 2016.10.08","match_date":"2016-10-08","stage_classifiercode":"99-11","member_number":"TY64637","first_name":"KEVIN","last_name":"COLLINS","classification":"B","division":"LIMITED","hit_factor":6.0504},{"match_name":"CJR&PC USPSA  June 10","match_date":"2018-06-10","stage_classifiercode":"99-11","member_number":"A98285","first_name":"WOJCIECH","last_name":"DZIADOSZ","classification":"\"\"","division":"LIMITED","hit_factor":6.0502},{"match_name":"Campeonato USPSA 2020","match_date":"2020-05-30","stage_classifiercode":"99-11","member_number":"A89235","first_name":"LUIS A.","last_name":"QUILICHINI-ALBORS","classification":"U","division":"LIMITED","hit_factor":6.0489},{"match_name":"CVSC 07-29-2018","match_date":"2018-07-29","stage_classifiercode":"99-11","member_number":"TY105155","first_name":"ALBERT","last_name":"COITO","classification":"U","division":"LIMITED","hit_factor":6.048},{"match_name":"IN19 ACC USPSA September 23","match_date":"2018-09-23","stage_classifiercode":"99-11","member_number":"FY81341","first_name":"JOEY","last_name":"ZADIK","classification":"M","division":"LIMITED","hit_factor":6.0465},{"match_name":"WVRPC USPSA 1SEPT2018","match_date":"2018-09-01","stage_classifiercode":"99-11","member_number":"A108848","first_name":"PAUL","last_name":"WARREN","classification":"C","division":"LIMITED","hit_factor":6.0459},{"match_name":"Shot Through The Heart Classifiers","match_date":"2018-02-04","stage_classifiercode":"99-11","member_number":"A107754","first_name":"MATTHEW","last_name":"VIAMONTES","classification":"\"\"","division":"LIMITED","hit_factor":6.0445},{"match_name":"OFGC Practical Pistol Match 01-19-2020","match_date":"2020-01-19","stage_classifiercode":"99-11","member_number":"TY78645","first_name":"LOREN","last_name":"PENDERGRASS","classification":"A","division":"LIMITED","hit_factor":6.044},{"match_name":"MVS USPSA 9-20-17","match_date":"2017-09-20","stage_classifiercode":"99-11","member_number":"A100631","first_name":"BRIAN","last_name":"HONG","classification":"C","division":"LIMITED","hit_factor":6.0413},{"match_name":"APSC 4th Annual Holiday Hosefest USPSA Match 12-02-17","match_date":"2017-12-02","stage_classifiercode":"99-11","member_number":"\"\"","first_name":"BRIAN","last_name":"PURKISS","classification":"U","division":"LIMITED","hit_factor":6.041},{"match_name":"Strongpoint August 2017 Match","match_date":"2017-08-05","stage_classifiercode":"99-11","member_number":"A66318","first_name":"BARRY","last_name":"PEPPERS","classification":"B","division":"LIMITED","hit_factor":6.0403},{"match_name":"HTF Practical Shooters","match_date":"2017-09-24","stage_classifiercode":"99-11","member_number":"A100599","first_name":"JOSE","last_name":"RODRIGUEZ","classification":"D","division":"LIMITED","hit_factor":6.0395},{"match_name":"LdF USPSA Match January 25 2020","match_date":"2020-01-25","stage_classifiercode":"99-11","member_number":"TY80157","first_name":"DAVE","last_name":"DEZAN","classification":"M","division":"LIMITED","hit_factor":6.0391},{"match_name":"Prescott Action Shooters 1st Saturday USPSA 7-7-2018","match_date":"2018-07-07","stage_classifiercode":"99-11","member_number":"TY63763","first_name":"MARK","last_name":"MARKLEY","classification":"B","division":"LIMITED","hit_factor":6.0377},{"match_name":"Prescott Action Shooters 1st Saturday USPSA 7-7-2018","match_date":"2018-07-07","stage_classifiercode":"99-11","member_number":"A106877","first_name":"CODY","last_name":"CATES","classification":"B","division":"LIMITED","hit_factor":6.0377},{"match_name":"RDS USPSA 8.13.16","match_date":"2016-08-13","stage_classifiercode":"99-11","member_number":"L3030","first_name":"KHAN","last_name":"SCHWANHAUSSER","classification":"B","division":"LIMITED","hit_factor":6.0377},{"match_name":"NPCCC 05-07-2017 USPSA","match_date":"2017-05-07","stage_classifiercode":"99-11","member_number":"L3823","first_name":"RICHARD","last_name":"GEGZNAS","classification":"B","division":"LIMITED","hit_factor":6.0377},{"match_name":"SWGC USPSA Pistol Match - November 2021","match_date":"2021-11-06","stage_classifiercode":"99-11","member_number":"A117382","first_name":"MARCUS","last_name":"TURNER","classification":"B","division":"LIMITED","hit_factor":6.0373},{"match_name":"Freeport March 13-2021","match_date":"2021-03-12","stage_classifiercode":"99-11","member_number":"TY101332","first_name":"EDWARD","last_name":"BUJNAK","classification":"B","division":"LIMITED","hit_factor":6.0357},{"match_name":"SAPSC Weekly USPSA Classifier Match 20170221","match_date":"2017-02-22","stage_classifiercode":"99-11","member_number":"TY84121","first_name":"GABOR","last_name":"MAGONY","classification":"C","division":"LIMITED","hit_factor":6.0335},{"match_name":"OK Corral USPSA Classifier Match Feb 18 2017","match_date":"2017-02-18","stage_classifiercode":"99-11","member_number":"A98893","first_name":"NICHOLAS","last_name":"BYRD","classification":"\"\"","division":"LIMITED","hit_factor":6.0325},{"match_name":"OK Corral USPSA Classifier Match Feb 18 2017","match_date":"2017-02-18","stage_classifiercode":"99-11","member_number":"A101057","first_name":"SCOTT","last_name":"JOHNSON","classification":"\"\"","division":"LIMITED","hit_factor":6.0302},{"match_name":"Steel City USPSA December 2 2017","match_date":"2017-12-02","stage_classifiercode":"99-11","member_number":"TY89877","first_name":"JOHN","last_name":"HABLITZ","classification":"C","division":"LIMITED","hit_factor":6.0284},{"match_name":"FBURG March Level I USPSA","match_date":"2016-03-06","stage_classifiercode":"99-11","member_number":"A88424","first_name":"CRAIG","last_name":"PETERSON","classification":"C","division":"LIMITED","hit_factor":6.0254},{"match_name":"Ontelaunee USPSA  July 2018","match_date":"2018-07-29","stage_classifiercode":"99-11","member_number":"L3944","first_name":"DAVID","last_name":"BLACK","classification":"A","division":"LIMITED","hit_factor":6.0241},{"match_name":"LIPSA -  April 17th 2016 - USPSA Special Classifier Match","match_date":"2016-04-17","stage_classifiercode":"99-11","member_number":"A-84680","first_name":"BRADLEY","last_name":"MILLER","classification":"U","division":"LIMITED","hit_factor":6.0241},{"match_name":"LCHG September 2018 USPSA Special Classifier","match_date":"2018-09-08","stage_classifiercode":"99-11","member_number":"A111439","first_name":"CHARLENE","last_name":"MARTIN","classification":"C","division":"LIMITED","hit_factor":6.0228},{"match_name":"Springfield Tactical Shooters 04/05/2018","match_date":"2018-04-05","stage_classifiercode":"99-11","member_number":"A106901","first_name":"WILLIAM","last_name":"AMES","classification":"\"\"","division":"LIMITED","hit_factor":6.0168},{"match_name":"APSC USPSA 02-15-20","match_date":"2020-02-15","stage_classifiercode":"99-11","member_number":"A122240","first_name":"EMILIO","last_name":"CASTILLO","classification":"C","division":"LIMITED","hit_factor":6.016},{"match_name":"Wvpps Nov. 2017","match_date":"2017-11-19","stage_classifiercode":"99-11","member_number":"ty80201","first_name":"THOMAS S","last_name":"RAPALA","classification":"B","division":"LIMITED","hit_factor":6.0159},{"match_name":"ISPS 6/19/2016 USPSA","match_date":"2016-06-19","stage_classifiercode":"99-11","member_number":"A80263","first_name":"STEVE","last_name":"HARRIS","classification":"B","division":"LIMITED","hit_factor":6.015},{"match_name":"Crooked Creek Pistol League - June 2017","match_date":"2017-06-24","stage_classifiercode":"99-11","member_number":"A97294","first_name":"EDWARD","last_name":"WAGNER","classification":"C","division":"LIMITED","hit_factor":6.015},{"match_name":"Ontelaunee USPSA  July 2018","match_date":"2018-07-29","stage_classifiercode":"99-11","member_number":"NA","first_name":"FRANK","last_name":"PAWLOSKI","classification":"U","division":"LIMITED","hit_factor":6.015},{"match_name":"BRSP Tuesday Night USPSA Match - Sept 11","match_date":"2018-09-12","stage_classifiercode":"99-11","member_number":"A104930","first_name":"DON","last_name":"EASTERLY","classification":"C","division":"LIMITED","hit_factor":6.015},{"match_name":"2017 Bay bridge Charity Classic - Richmond October 14-15-2017","match_date":"2017-10-14","stage_classifiercode":"99-11","member_number":"A82061","first_name":"PAUL","last_name":"PADRON","classification":"C","division":"LIMITED","hit_factor":6.015},{"match_name":"Deadwood Boys USPSA All Classifier Match","match_date":"2016-08-07","stage_classifiercode":"99-11","member_number":"ty70363","first_name":"JON","last_name":"BIRDT","classification":"C","division":"LIMITED","hit_factor":6.0134},{"match_name":"RSPP 3rd Saturday November 2016","match_date":"2016-11-19","stage_classifiercode":"99-11","member_number":"A97078","first_name":"JIM","last_name":"CONNER","classification":"U","division":"LIMITED","hit_factor":6.0116},{"match_name":"Shasta Shooters 2018 June Special Classifier","match_date":"2018-06-09","stage_classifiercode":"99-11","member_number":"A33123","first_name":"DAREN","last_name":"HUSA","classification":"B","division":"LIMITED","hit_factor":6.0116},{"match_name":"HTF Practical Shooters Classifier","match_date":"2017-12-07","stage_classifiercode":"99-11","member_number":"A100328","first_name":"JOSH","last_name":"TAYLOR","classification":"A","division":"LIMITED","hit_factor":6.0109},{"match_name":"USPSA MO21 2Alpha SBRC June 2017","match_date":"2017-06-17","stage_classifiercode":"99-11","member_number":"TY78608","first_name":"JONATHAN","last_name":"LUNA","classification":"D","division":"LIMITED","hit_factor":6.0096},{"match_name":"Granby Action Shooters Oct 2016","match_date":"2016-10-02","stage_classifiercode":"99-11","member_number":"\"\"","first_name":"TOBY","last_name":"WESKOSKY","classification":"D","division":"LIMITED","hit_factor":6.0075},{"match_name":"Augusta USPSA 10-14-18","match_date":"2018-10-14","stage_classifiercode":"99-11","member_number":"\"\"","first_name":"GARY","last_name":"CROSBY","classification":"C","division":"LIMITED","hit_factor":6.0071},{"match_name":"Wvpps Nov. 2017","match_date":"2017-11-19","stage_classifiercode":"99-11","member_number":"TY65620","first_name":"SCOTT","last_name":"METCALF","classification":"B","division":"LIMITED","hit_factor":6.0071},{"match_name":"PTPC April 2nd USPSA Match","match_date":"2017-04-02","stage_classifiercode":"99-11","member_number":"A77281","first_name":"BILL","last_name":"LEWIS","classification":"B","division":"LIMITED","hit_factor":6.006},{"match_name":"Competitive Shooters of Lake Norman CORNELIUS Thursday Evening Indoor USPSA Pistol Match North Carolina","match_date":"2018-12-06","stage_classifiercode":"99-11","member_number":"L4473","first_name":"ULRICH","last_name":"BABSAAY","classification":"C","division":"LIMITED","hit_factor":6.006},{"match_name":"SFA   USPSA 2/20/2016","match_date":"2016-02-20","stage_classifiercode":"99-11","member_number":"A91860","first_name":"COLE","last_name":"HORNBACK","classification":"U","division":"LIMITED","hit_factor":6.0052},{"match_name":"Payson Practical Shooters USPSA Jan 2 2021","match_date":"2021-01-02","stage_classifiercode":"99-11","member_number":"Ty81620","first_name":"MICHAEL","last_name":"MCCRITE","classification":"C","division":"LIMITED","hit_factor":6.0046},{"match_name":"Bgs Hudson Week 6","match_date":"2017-02-19","stage_classifiercode":"99-11","member_number":"\"\"","first_name":"JON","last_name":"WIEBUSCH","classification":"U","division":"LIMITED","hit_factor":6.0046},{"match_name":"MRPC OHS02 042218","match_date":"2018-04-21","stage_classifiercode":"99-11","member_number":"A95677","first_name":"TAKUMI","last_name":"ALLEN","classification":"A","division":"LIMITED","hit_factor":6.0034},{"match_name":"JPPS Club Match","match_date":"2018-04-21","stage_classifiercode":"99-11","member_number":"A83072","first_name":"JOHN","last_name":"BOYD","classification":"C","division":"LIMITED","hit_factor":6.0027},{"match_name":"Applied IN25 USPSA April Classifier 2018","match_date":"2018-04-17","stage_classifiercode":"99-11","member_number":"TY90126","first_name":"TOM","last_name":"BURZYNSKI","classification":"U","division":"LIMITED","hit_factor":6.0024},{"match_name":"COPS Dec 2015 USPSA","match_date":"2015-12-06","stage_classifiercode":"99-11","member_number":"A-32149","first_name":"LASZLO","last_name":"SZABO","classification":"C","division":"LIMITED","hit_factor":6},{"match_name":"San Juan Shooters ","match_date":"2017-07-08","stage_classifiercode":"99-11","member_number":"TY85349","first_name":"TROY","last_name":"DAVID","classification":"B","division":"LIMITED","hit_factor":6},{"match_name":"CSS February 2016","match_date":"2016-02-12","stage_classifiercode":"99-11","member_number":"\"\"","first_name":"MIKE","last_name":"CRAWFORD","classification":"U","division":"LIMITED","hit_factor":5.9979},{"match_name":"Shadow Hawk Defense USPSA Special Classifier","match_date":"2020-11-14","stage_classifiercode":"99-11","member_number":"A108990","first_name":"ED","last_name":"KELLY","classification":"U","division":"LIMITED","hit_factor":5.9977},{"match_name":"BLUE RIDGE ARSENAL July 6 Classifier Match","match_date":"2018-07-06","stage_classifiercode":"99-11","member_number":"A105623","first_name":"CHRIS","last_name":"SHERRILL","classification":"U","division":"LIMITED","hit_factor":5.997},{"match_name":"RPS November 2018 USPSA Match","match_date":"2018-11-10","stage_classifiercode":"99-11","member_number":"A79727","first_name":"MIKE","last_name":"LARKIN","classification":"B","division":"LIMITED","hit_factor":5.9946},{"match_name":"Ontelaunee USPSA  July 2018","match_date":"2018-07-29","stage_classifiercode":"99-11","member_number":"A104786","first_name":"GREG","last_name":"BRASKIE","classification":"U","division":"LIMITED","hit_factor":5.994},{"match_name":"BGSL Classifier Match ","match_date":"2018-10-06","stage_classifiercode":"99-11","member_number":"ty28399","first_name":"MIKE","last_name":"GOSS","classification":"C","division":"LIMITED","hit_factor":5.9937},{"match_name":"SSS USPSA October 2018","match_date":"2018-10-21","stage_classifiercode":"99-11","member_number":"A11862","first_name":"BRYAN","last_name":"BLANK","classification":"C (C Class)","division":"LIMITED","hit_factor":5.9925},{"match_name":"Maine Practical Shooters March 2017","match_date":"2017-03-25","stage_classifiercode":"99-11","member_number":"TY50805","first_name":"DAN","last_name":"WORCESTER","classification":"B","division":"LIMITED","hit_factor":5.9925},{"match_name":"Total Defense 3-7-18 Points Series 4","match_date":"2018-03-07","stage_classifiercode":"99-11","member_number":"A96227","first_name":"KAYLA","last_name":"BARDEN","classification":"C","division":"LIMITED","hit_factor":5.9913},{"match_name":"Devil Dog USPSA Classifier Match-Sunday Session","match_date":"2018-03-11","stage_classifiercode":"99-11","member_number":"A87132","first_name":"TONY","last_name":"BICHLER","classification":"B","division":"LIMITED","hit_factor":5.9913},{"match_name":"WNPL - USPSA March Snowblind Blowout 2017","match_date":"2017-03-05","stage_classifiercode":"99-11","member_number":"A91971","first_name":"LARRY","last_name":"SKINNER","classification":"C","division":"LIMITED","hit_factor":5.9908},{"match_name":"LCHG May USPSA","match_date":"2017-05-21","stage_classifiercode":"99-11","member_number":"A92874","first_name":"DARIN","last_name":"HOLLAWAY","classification":"C","division":"LIMITED","hit_factor":5.9908},{"match_name":"CJR&PC USPSA  June 10","match_date":"2018-06-10","stage_classifiercode":"99-11","member_number":"A80731","first_name":"BRIAN","last_name":"MILLER","classification":"\"\"","division":"LIMITED","hit_factor":5.9896},{"match_name":"WVRPC Speed Shoot Spectacular Dec 2017","match_date":"2017-12-16","stage_classifiercode":"99-11","member_number":"TY38382","first_name":"DOUG","last_name":"HIGHLAN","classification":"A","division":"LIMITED","hit_factor":5.9891},{"match_name":"Competitive Shooters of Lake Norman CORNELIUS Thursday Evening Indoor USPSA Pistol Match North Carolina","match_date":"2018-12-06","stage_classifiercode":"99-11","member_number":"A115520","first_name":"HOUSTON","last_name":"LOWDER","classification":"U","division":"LIMITED","hit_factor":5.9891},{"match_name":"WSRC USPSA 11/19/2017","match_date":"2017-11-19","stage_classifiercode":"99-11","member_number":"A99557","first_name":"KIRK","last_name":"WRIGHT","classification":"U","division":"LIMITED","hit_factor":5.988},{"match_name":"Pinetucky USPSA 04-23-16","match_date":"2016-04-23","stage_classifiercode":"99-11","member_number":"TY90372","first_name":"CLARK","last_name":"SMITH","classification":"C","division":"LIMITED","hit_factor":5.988},{"match_name":"OK15 USPSA at USSA May 6th 2018","match_date":"2018-05-06","stage_classifiercode":"99-11","member_number":"TY-102186","first_name":"SEAN","last_name":"MOORE","classification":"D","division":"LIMITED","hit_factor":5.988},{"match_name":"Afternoon SMPS 09 February 2020 USPSA Classifier Match","match_date":"2020-02-09","stage_classifiercode":"99-11","member_number":"TY100998","first_name":"MICHAEL","last_name":"BRINDZA","classification":"C","division":"LIMITED","hit_factor":5.9874},{"match_name":"Patriot Action Shooters June 2016 Match","match_date":"2016-06-18","stage_classifiercode":"99-11","member_number":"TY85556","first_name":"WILLIAM","last_name":"POWELL","classification":"B","division":"LIMITED","hit_factor":5.9871},{"match_name":"Target  Sports Central Indiana Championship","match_date":"2020-08-22","stage_classifiercode":"99-11","member_number":"TY117950","first_name":"LANCE","last_name":"BARTON","classification":"B","division":"LIMITED","hit_factor":5.9843},{"match_name":"EWPSA 2018-10","match_date":"2018-10-20","stage_classifiercode":"99-11","member_number":"A92411","first_name":"CRAIG","last_name":"WORRELL","classification":"B","division":"LIMITED","hit_factor":5.9839},{"match_name":"EIPS 12/6/2018","match_date":"2018-12-06","stage_classifiercode":"99-11","member_number":"A112534","first_name":"TOM","last_name":"KEEFE","classification":"U","division":"LIMITED","hit_factor":5.9839},{"match_name":"Springfield Tactical Shooters 04/05/2018","match_date":"2018-04-05","stage_classifiercode":"99-11","member_number":"\"\"","first_name":"NATHAN","last_name":"GRIFFEL","classification":"\"\"","division":"LIMITED","hit_factor":5.9839},{"match_name":"Pinetucky USPSA 06-16-18","match_date":"2018-06-16","stage_classifiercode":"99-11","member_number":"a100125","first_name":"JOHN","last_name":"EDENS","classification":"B","division":"LIMITED","hit_factor":5.9839},{"match_name":"MS06 Team Magnolia February 2018 USPSA Match","match_date":"2018-02-03","stage_classifiercode":"99-11","member_number":"TY56197","first_name":"DANNY","last_name":"WARREN","classification":"B","division":"LIMITED","hit_factor":5.9829},{"match_name":"AAPS AAFG Level 1 Match - May 5 2018","match_date":"2018-05-05","stage_classifiercode":"99-11","member_number":"A89510","first_name":"BRIAN","last_name":"ONG","classification":"C","division":"LIMITED","hit_factor":5.9811},{"match_name":"GWPP January 2016 Pistol","match_date":"2016-01-09","stage_classifiercode":"99-11","member_number":"L3297","first_name":"JACK","last_name":"SWEET","classification":"C","division":"LIMITED","hit_factor":5.9811},{"match_name":"Crooked Creek Pistol League - June 2016","match_date":"2016-06-25","stage_classifiercode":"99-11","member_number":"A85868","first_name":"SHELDON","last_name":"KATZ","classification":"C","division":"LIMITED","hit_factor":5.9809},{"match_name":"Rankin field Sunday match Clone","match_date":"2016-07-17","stage_classifiercode":"99-11","member_number":"A77900","first_name":"JONATHAN","last_name":"COLLADO","classification":"C","division":"LIMITED","hit_factor":5.9789},{"match_name":"IL16 USPSA MAR 20 2016","match_date":"2016-03-20","stage_classifiercode":"99-11","member_number":"A92908","first_name":"DAVID","last_name":"BURNS","classification":"U","division":"LIMITED","hit_factor":5.9752},{"match_name":"OKCGC USPSA June 2018","match_date":"2018-06-02","stage_classifiercode":"99-11","member_number":"A109189","first_name":"DAVID","last_name":"SIMILLY","classification":"C","division":"LIMITED","hit_factor":5.9744},{"match_name":"Deadwood Boys USPSA All Classifier Match","match_date":"2016-08-07","stage_classifiercode":"99-11","member_number":"Ty92176","first_name":"JAE","last_name":"AHN","classification":"B","division":"LIMITED","hit_factor":5.9744},{"match_name":"Palmetto Gun Club - April 2017 USPSA","match_date":"2017-04-08","stage_classifiercode":"99-11","member_number":"A95249","first_name":"BRAD","last_name":"SMITH","classification":"U","division":"LIMITED","hit_factor":5.9737},{"match_name":"Maine Practical Shooters February 2016","match_date":"2016-02-27","stage_classifiercode":"99-11","member_number":"A90785","first_name":"AUSTIN","last_name":"DENIS","classification":"C","division":"LIMITED","hit_factor":5.9735},{"match_name":"PSAC_20161022","match_date":"2016-10-22","stage_classifiercode":"99-11","member_number":"A73032","first_name":"SHANNON","last_name":"KIMBER","classification":"\"\"","division":"LIMITED","hit_factor":5.9727},{"match_name":"WGC Winsboro ","match_date":"2016-08-28","stage_classifiercode":"99-11","member_number":"TY71159","first_name":"DENNIS","last_name":"LEBEAU","classification":"C","division":"LIMITED","hit_factor":5.9719},{"match_name":"Benton Gun Club-USPSA March 25 2018","match_date":"2018-03-25","stage_classifiercode":"99-11","member_number":"\"\"","first_name":"AHREN","last_name":"GEILENFELDT","classification":"U","division":"LIMITED","hit_factor":5.9701},{"match_name":"Ontelaunee USPSA July 2016","match_date":"2016-07-23","stage_classifiercode":"99-11","member_number":"A82780","first_name":"JEANNE","last_name":"RUANE","classification":"C","division":"LIMITED","hit_factor":5.9701},{"match_name":" IPSC93 Oct 2021","match_date":"2021-10-29","stage_classifiercode":"99-11","member_number":"TY51119","first_name":"CHRIS","last_name":"MOLNAR","classification":"A","division":"LIMITED","hit_factor":5.9701},{"match_name":"ARPC USPSA Match 3-26-17","match_date":"2017-03-26","stage_classifiercode":"99-11","member_number":"TY86060","first_name":"NANCHO","last_name":"RODRIGUEZ","classification":"B","division":"LIMITED","hit_factor":5.9701},{"match_name":"Palmetto Gun Club - April 2017 USPSA","match_date":"2017-04-08","stage_classifiercode":"99-11","member_number":"TY53092","first_name":"DEWEY","last_name":"HUTSON","classification":"M","division":"LIMITED","hit_factor":5.9671},{"match_name":"TMGN December 8th Pistol Match","match_date":"2016-12-09","stage_classifiercode":"99-11","member_number":"\"\"","first_name":"MATT","last_name":"CHURCH","classification":"none","division":"LIMITED","hit_factor":5.9666},{"match_name":"Richmond Hot Shots April 14-15-2018 USPSA Pistol Match","match_date":"2018-04-14","stage_classifiercode":"99-11","member_number":"A98006","first_name":"REBECCA","last_name":"KWONG","classification":"C","division":"LIMITED","hit_factor":5.9663},{"match_name":"MCRC USPSA August 2018","match_date":"2018-08-11","stage_classifiercode":"99-11","member_number":"TY96072","first_name":"SCOTT","last_name":"FORTSON","classification":"C","division":"LIMITED","hit_factor":5.9638},{"match_name":"Total Defense 3-7-18 Points Series 4","match_date":"2018-03-07","stage_classifiercode":"99-11","member_number":"\"\"","first_name":"GREGG","last_name":"STEFFEN","classification":"\"\"","division":"LIMITED","hit_factor":5.9633},{"match_name":"Tangi May 2016 USPSA","match_date":"2016-05-29","stage_classifiercode":"99-11","member_number":"A94097","first_name":"STEVEN","last_name":"TANNETTA","classification":"D","division":"LIMITED","hit_factor":5.9613},{"match_name":"MSSA Uspsa Match 1/3/16","match_date":"2016-01-03","stage_classifiercode":"99-11","member_number":"A83082","first_name":"JOHN","last_name":"BOYD","classification":"C","division":"LIMITED","hit_factor":5.9611},{"match_name":"June 2018 CAS USPSA","match_date":"2018-06-03","stage_classifiercode":"99-11","member_number":"A103974","first_name":"MICHAEL","last_name":"ALLEN","classification":"U","division":"LIMITED","hit_factor":5.9609},{"match_name":"Deadwood Boys USPSA All Classifier Match - 29 July 2018","match_date":"2018-07-29","stage_classifiercode":"99-11","member_number":"TY113142","first_name":"ERIK","last_name":"SLISKOVICH","classification":"U","division":"LIMITED","hit_factor":5.9603},{"match_name":"Baps March Uspsa","match_date":"2016-03-19","stage_classifiercode":"99-11","member_number":"TY39532","first_name":"NORM","last_name":"LEE","classification":"\"\"","division":"LIMITED","hit_factor":5.9595},{"match_name":"WGC WI USPSA League 11-8-2016","match_date":"2016-11-09","stage_classifiercode":"99-11","member_number":"A96522","first_name":"MIKE","last_name":"GRIFFIN","classification":"C","division":"LIMITED","hit_factor":5.9595},{"match_name":"BRSP Tuesday Night USPSA Match - May 15","match_date":"2018-05-16","stage_classifiercode":"99-11","member_number":"A110593","first_name":"RAY","last_name":"DELA ROSA","classification":"U","division":"LIMITED","hit_factor":5.9569},{"match_name":"Deadwood Boys USPSA All Classifier Match","match_date":"2016-08-07","stage_classifiercode":"99-11","member_number":"A96556","first_name":"KEITH","last_name":"JUNG","classification":"U","division":"LIMITED","hit_factor":5.9565},{"match_name":"Oakdale USPSA MN07 8-12-2021","match_date":"2021-08-12","stage_classifiercode":"99-11","member_number":"A135460","first_name":"MATT","last_name":"PETERSON","classification":"U","division":"LIMITED","hit_factor":5.9537},{"match_name":"BUAS February Match","match_date":"2020-02-09","stage_classifiercode":"99-11","member_number":"a120023","first_name":"LEWIS","last_name":"BISONO","classification":"C","division":"LIMITED","hit_factor":5.9524},{"match_name":"STAGE ZERO SHOOTING SUPPLY USPSA","match_date":"2020-07-16","stage_classifiercode":"99-11","member_number":"A120266","first_name":"CRAIG","last_name":"RUBENSTEIN","classification":"C","division":"LIMITED","hit_factor":5.9524},{"match_name":"LGCSEMPS April 2018 Special Classifier","match_date":"2018-04-08","stage_classifiercode":"99-11","member_number":"TY86689","first_name":"DONALD","last_name":"HASSELBACH","classification":"B","division":"LIMITED","hit_factor":5.9497},{"match_name":"Ontelaunee USPSA Hose Fest","match_date":"2021-01-02","stage_classifiercode":"99-11","member_number":"A112593","first_name":"BEN","last_name":"BOYER","classification":"B","division":"LIMITED","hit_factor":5.9494},{"match_name":"CJR&PC USPSA  June 10","match_date":"2018-06-10","stage_classifiercode":"99-11","member_number":"A93032","first_name":"PAUL","last_name":"TEVALD","classification":"\"\"","division":"LIMITED","hit_factor":5.949},{"match_name":"Hallstead USPSA  July Match","match_date":"2020-07-25","stage_classifiercode":"99-11","member_number":"122860","first_name":"RICK","last_name":"PAGLIA","classification":"U","division":"LIMITED","hit_factor":5.948},{"match_name":"Omaha Gun Club USPSA February 28th 2018","match_date":"2018-03-01","stage_classifiercode":"99-11","member_number":"TY105204","first_name":"MATTHEW","last_name":"VAN HOOK","classification":"U","division":"LIMITED","hit_factor":5.9459},{"match_name":"GAS June Special Classifier","match_date":"2017-06-03","stage_classifiercode":"99-11","member_number":"FY89101","first_name":"DAN","last_name":"PRENTICE","classification":"B","division":"LIMITED","hit_factor":5.9453},{"match_name":"HTF Practical Shooters Classifier","match_date":"2017-12-07","stage_classifiercode":"99-11","member_number":"A106631","first_name":"JOEY","last_name":"TOMLINSON","classification":"U","division":"LIMITED","hit_factor":5.9453},{"match_name":"Pharr action shooters USPSA match at Coyote 02-20-16","match_date":"2016-02-20","stage_classifiercode":"99-11","member_number":"\"\"","first_name":"CHARLIE","last_name":"HILLER","classification":"B","division":"LIMITED","hit_factor":5.9451},{"match_name":"SLPSA July USPSA match","match_date":"2018-07-21","stage_classifiercode":"99-11","member_number":"FY68897","first_name":"LEONARD","last_name":"DELEON","classification":"G","division":"LIMITED","hit_factor":5.9441},{"match_name":"May 2018 4th Tues CAPS USPSA Level 1 - Range At Ballantyne","match_date":"2018-05-20","stage_classifiercode":"99-11","member_number":"A60634","first_name":"MICHAEL","last_name":"SLAY","classification":"B","division":"LIMITED","hit_factor":5.9435},{"match_name":"ORPCI 2018.03.31 USPSA Special","match_date":"2018-03-31","stage_classifiercode":"99-11","member_number":"TY78920","first_name":"MIKE","last_name":"MOSER","classification":"M","division":"LIMITED","hit_factor":5.9406},{"match_name":"Bgs Hudson Week 6","match_date":"2017-02-19","stage_classifiercode":"99-11","member_number":"\"\"","first_name":"JUSTIN","last_name":"BOCK","classification":"U","division":"LIMITED","hit_factor":5.9406},{"match_name":"CSA For PCGC","match_date":"2016-06-26","stage_classifiercode":"99-11","member_number":"A89121","first_name":"JAMIE","last_name":"DICKENS","classification":"C","division":"LIMITED","hit_factor":5.9406},{"match_name":"MPSA 010216","match_date":"2016-01-02","stage_classifiercode":"99-11","member_number":"A17746","first_name":"STANLEY","last_name":"WADE","classification":"X","division":"LIMITED","hit_factor":5.9392},{"match_name":"PRG - Oh Shoot USPSA February 21st - 3rd Sunday Match","match_date":"2021-02-21","stage_classifiercode":"99-11","member_number":"A108080","first_name":"STERLYN","last_name":"RIGSBY","classification":"B","division":"LIMITED","hit_factor":5.939},{"match_name":"Pitcairn-Monroeville Sportsmens Club USPSA August 2017","match_date":"2017-08-05","stage_classifiercode":"99-11","member_number":"a96649","first_name":"RICK","last_name":"LOWRY","classification":"D","division":"LIMITED","hit_factor":5.9385},{"match_name":"Prescott 1 st Saturday 12-03-2016","match_date":"2016-12-03","stage_classifiercode":"99-11","member_number":"TY63763","first_name":"MARK","last_name":"MARKLEY","classification":"B","division":"LIMITED","hit_factor":5.9382},{"match_name":"WNPL USPSA - REDEMPTION - NOVEMBER 2016","match_date":"2016-11-06","stage_classifiercode":"99-11","member_number":"A95382","first_name":"TONY","last_name":"CHEN","classification":"C","division":"LIMITED","hit_factor":5.9382},{"match_name":"ORPCI 2018.03.31 USPSA Special","match_date":"2018-03-31","stage_classifiercode":"99-11","member_number":"A104217","first_name":"AARON","last_name":"WILLIS","classification":"U","division":"LIMITED","hit_factor":5.9375},{"match_name":"Maine Practical Shooters March 2017","match_date":"2017-03-25","stage_classifiercode":"99-11","member_number":"A96745","first_name":"NATHANIAL","last_name":"BALLEW","classification":"C","division":"LIMITED","hit_factor":5.9375},{"match_name":"Benton Gun Club-USPSA May27 2018 CLASIFIER","match_date":"2018-05-27","stage_classifiercode":"99-11","member_number":"A96080","first_name":"JAMES","last_name":"GREGORY","classification":"U","division":"LIMITED","hit_factor":5.9355},{"match_name":"WPGC 8-7-2017","match_date":"2017-08-07","stage_classifiercode":"99-11","member_number":"TY96175","first_name":"SHANNON","last_name":"COUNSIL","classification":"C","division":"LIMITED","hit_factor":5.9351},{"match_name":"2016-05-07 USPSA at Phoenix Rod and Gun Club","match_date":"2016-05-07","stage_classifiercode":"99-11","member_number":"123456","first_name":"BEN","last_name":"SCHULTE","classification":"U","division":"LIMITED","hit_factor":5.9341},{"match_name":"Grandbaggers August 2017","match_date":"2017-08-03","stage_classifiercode":"99-11","member_number":"A100039","first_name":"BEN","last_name":"FERLAND","classification":"D","division":"LIMITED","hit_factor":5.9312},{"match_name":"TPS USPSA -  August Classifier Match 2020","match_date":"2020-08-01","stage_classifiercode":"99-11","member_number":"A105556","first_name":"MCKENZIE","last_name":"FITZPATRICK","classification":"U","division":"LIMITED","hit_factor":5.9312},{"match_name":"LPRGC - Lower Providence USPSA October 2018","match_date":"2018-10-06","stage_classifiercode":"99-11","member_number":"A112577","first_name":"JASON","last_name":"MAHONEY","classification":"C","division":"LIMITED","hit_factor":5.9302},{"match_name":"WGC WI USPSA League 11-8-2016","match_date":"2016-11-09","stage_classifiercode":"99-11","member_number":"\"\"","first_name":"J R","last_name":"BRIMMER","classification":"B","division":"LIMITED","hit_factor":5.9295},{"match_name":"CGGR July USPSA Match","match_date":"2018-07-21","stage_classifiercode":"99-11","member_number":"\"\"","first_name":"GARRETT","last_name":"HOWELL","classification":"U","division":"LIMITED","hit_factor":5.9284},{"match_name":"Prescott Action Shooters 1st Saturday USPSA 7-7-2018","match_date":"2018-07-07","stage_classifiercode":"99-11","member_number":"TY95703","first_name":"GEORGE","last_name":"LOVE","classification":"B","division":"LIMITED","hit_factor":5.9282},{"match_name":"LdF USPSA Match May 12 2018","match_date":"2018-05-12","stage_classifiercode":"99-11","member_number":"\"\"","first_name":"ANTHONY","last_name":"WILLIAMS","classification":"U","division":"LIMITED","hit_factor":5.9278},{"match_name":"RPS December 2017 USPSA Match","match_date":"2017-12-09","stage_classifiercode":"99-11","member_number":"A79299","first_name":"ED","last_name":"ROTHSCHILD","classification":"U","division":"LIMITED","hit_factor":5.9276},{"match_name":"Pardoe Sportsmens Association-WPA14-2017-10-01","match_date":"2017-10-01","stage_classifiercode":"99-11","member_number":"\"\"","first_name":"ROBERT","last_name":"DILLEN","classification":"\"\"","division":"LIMITED","hit_factor":5.9276},{"match_name":"Nampa USPSA May 29th 2021","match_date":"2021-05-29","stage_classifiercode":"99-11","member_number":"Ty114812","first_name":"TONY","last_name":"KENDALL","classification":"B","division":"LIMITED","hit_factor":5.9271},{"match_name":"Lefthanders Gun Club Practical Shooters October","match_date":"2017-09-30","stage_classifiercode":"99-11","member_number":"A62932","first_name":"RICHARD","last_name":"LANE","classification":"B","division":"LIMITED","hit_factor":5.9242},{"match_name":"ARPC USPSA Match 8-23-20","match_date":"2020-08-23","stage_classifiercode":"99-11","member_number":"TY61235","first_name":"STEPHEN","last_name":"FILLA","classification":"C","division":"LIMITED","hit_factor":5.9242},{"match_name":"Chillicothe February 2021 USPSA Match","match_date":"2021-02-28","stage_classifiercode":"99-11","member_number":"FY10528","first_name":"JOHN","last_name":"SMITH","classification":"M","division":"LIMITED","hit_factor":5.9233},{"match_name":"ANPRACS USPSA 2-1-20","match_date":"2020-02-01","stage_classifiercode":"99-11","member_number":"A121470","first_name":"KRISTEN","last_name":"SNOWDEN","classification":"U","division":"LIMITED","hit_factor":5.9219},{"match_name":"Rio Salado RSPP 3rd Saturday February 2020","match_date":"2020-02-15","stage_classifiercode":"99-11","member_number":"FY28831","first_name":"ALAN","last_name":"GLICKMAN","classification":"B","division":"LIMITED","hit_factor":5.9218},{"match_name":"USPSA MO21 2Alpha SBRC December 22 2018","match_date":"2018-12-22","stage_classifiercode":"99-11","member_number":"A82858","first_name":"RICHARD","last_name":"ZARCONE","classification":"C","division":"LIMITED","hit_factor":5.9203},{"match_name":"Pitcairn-Monroeville Sportsmens Club USPSA August 2017","match_date":"2017-08-05","stage_classifiercode":"99-11","member_number":"l3045","first_name":"DOUG","last_name":"SESTOCK","classification":"G","division":"LIMITED","hit_factor":5.92},{"match_name":"OK Corral USPSA Classifier Match Feb 18 2017","match_date":"2017-02-18","stage_classifiercode":"99-11","member_number":"A86383","first_name":"WARREN","last_name":"SONNE","classification":"\"\"","division":"LIMITED","hit_factor":5.9197},{"match_name":"COPS Dec 2015 USPSA","match_date":"2015-12-06","stage_classifiercode":"99-11","member_number":"A10920","first_name":"JOHN","last_name":"COATS","classification":"U","division":"LIMITED","hit_factor":5.9197},{"match_name":"MCAS March 2018 USPSA","match_date":"2018-03-17","stage_classifiercode":"99-11","member_number":"a47293","first_name":"JASON","last_name":"FLAHERTY","classification":"U","division":"LIMITED","hit_factor":5.919},{"match_name":"RSPP 3rd Saturday November 2016","match_date":"2016-11-19","stage_classifiercode":"99-11","member_number":"A47027","first_name":"JACK","last_name":"JOHNSTON","classification":"D","division":"LIMITED","hit_factor":5.9184},{"match_name":"LPRGC-Lower Providence USPSA May-1 2017","match_date":"2017-05-05","stage_classifiercode":"99-11","member_number":"L3957","first_name":"MARK","last_name":"EVANS","classification":"C","division":"LIMITED","hit_factor":5.9172},{"match_name":"Pelham USPSA 2016-09-18","match_date":"2016-09-18","stage_classifiercode":"99-11","member_number":"L3434","first_name":"JEFF","last_name":"ROSENBERGER","classification":"C","division":"LIMITED","hit_factor":5.9165},{"match_name":"June 22 2016 A Zone","match_date":"2016-06-22","stage_classifiercode":"99-11","member_number":"A93959","first_name":"STEPHEN","last_name":"CONWILL","classification":"U","division":"LIMITED","hit_factor":5.9158},{"match_name":"SMPS USPSA Feb 9 2020 AM Classifier","match_date":"2020-02-05","stage_classifiercode":"99-11","member_number":"L4636","first_name":"BARRON","last_name":"ROPER","classification":"C","division":"LIMITED","hit_factor":5.9158},{"match_name":"Benton Gun Club-USPSA May27 2018 CLASIFIER","match_date":"2018-05-27","stage_classifiercode":"99-11","member_number":"\"\"","first_na