[{"match_name":"BA USPSA Sep  23/2017","match_date":"2017-09-23","stage_classifiercode":"09-04","member_number":"TY42975","first_name":"JASON","last_name":"RATLIFF","classification":"U","division":"PCC","hit_factor":16.9643},{"match_name":"HPPS 6-19-2021","match_date":"2021-06-19","stage_classifiercode":"09-04","member_number":"TY90095","first_name":"BRETT","last_name":"LOHMAN","classification":"M","division":"PCC","hit_factor":15.8103},{"match_name":"LRC USPSA October 2020","match_date":"2020-10-03","stage_classifiercode":"09-04","member_number":"TY88318","first_name":"MIKE","last_name":"HALL","classification":"M","division":"PCC","hit_factor":15.3846},{"match_name":"RCPS USPSA October 13","match_date":"2018-10-13","stage_classifiercode":"09-04","member_number":"\"\"","first_name":"STEFAN","last_name":"WIGGINS","classification":"GM","division":"PCC","hit_factor":14.5749},{"match_name":"SSPSC USPSA  June 6-7 2020","match_date":"2020-06-04","stage_classifiercode":"09-04","member_number":"A105539","first_name":"NEIL","last_name":"POSTLEWAITE","classification":"","division":"PCC","hit_factor":14.5455},{"match_name":"NAAS 2017-10-15","match_date":"2017-10-15","stage_classifiercode":"09-04","member_number":"A82223","first_name":"BRETT","last_name":"NETTLETON","classification":"G","division":"PCC","hit_factor":14.3426},{"match_name":"SSPSC USPSA  June 6-7 2020","match_date":"2020-06-04","stage_classifiercode":"09-04","member_number":"FY60102","first_name":"JOHN","last_name":"MCCLAIN","classification":"","division":"PCC","hit_factor":14.2259},{"match_name":"Castlewood USPSA Sept 2020 shoot","match_date":"2020-09-26","stage_classifiercode":"09-04","member_number":"A46243","first_name":"JEFFW","last_name":"WOLFE","classification":"M","division":"PCC","hit_factor":14.218},{"match_name":"Bayou City USPSA Weekly June 28","match_date":"2018-06-28","stage_classifiercode":"09-04","member_number":"A09541","first_name":"GARRY","last_name":"NEWTON","classification":"B","division":"PCC","hit_factor":14.0496},{"match_name":"Grandbaggers October 2017","match_date":"2017-10-05","stage_classifiercode":"09-04","member_number":"\"\"","first_name":"ALEX","last_name":"LIM","classification":"U","division":"PCC","hit_factor":13.7931},{"match_name":"USPSA","match_date":"2020-12-06","stage_classifiercode":"09-04","member_number":"A115659","first_name":"BOOT","last_name":"CHUMBLEY","classification":"C","division":"PCC","hit_factor":13.6752},{"match_name":"SSPSC USPSA  June 6-7 2020","match_date":"2020-06-04","stage_classifiercode":"09-04","member_number":"A105539","first_name":"NEIL","last_name":"POSTLEWAITE","classification":"","division":"PCC","hit_factor":13.617},{"match_name":"TPS USPSA at CMP July 21 2018","match_date":"2018-07-21","stage_classifiercode":"09-04","member_number":"a98278","first_name":"JACK","last_name":"WINDES","classification":"G","division":"PCC","hit_factor":13.6},{"match_name":"RSPP 3rd Saturday August 2018","match_date":"2018-08-18","stage_classifiercode":"09-04","member_number":"A49393","first_name":"NAIM","last_name":"SAITI","classification":"G","division":"PCC","hit_factor":13.5135},{"match_name":"DGC USPSA 07-26-20","match_date":"2020-07-26","stage_classifiercode":"09-04","member_number":"ty16020","first_name":"A.J.","last_name":"MCCARTNEY","classification":"G","division":"PCC","hit_factor":13.2404},{"match_name":"DSS - USPSA - 21-07-24","match_date":"2021-07-24","stage_classifiercode":"09-04","member_number":"TY108877","first_name":"ADAM","last_name":"LITKE","classification":"B","division":"PCC","hit_factor":13.2353},{"match_name":"OREGON ARPC CC05 USPSA - Classifier Match - APR 10 2021","match_date":"2021-04-10","stage_classifiercode":"09-04","member_number":"A102894","first_name":"COBRA","last_name":"JACK","classification":"M","division":"PCC","hit_factor":13.1783},{"match_name":"Bare Arms 10/20/2018","match_date":"2018-10-20","stage_classifiercode":"09-04","member_number":"\"\"","first_name":"SAMUEL","last_name":"CRAGER","classification":"\"\"","division":"PCC","hit_factor":13.1687},{"match_name":"WGC USPSA Special Classifier 4-17-2021","match_date":"2021-04-17","stage_classifiercode":"09-04","member_number":"TY111367","first_name":"BRAD","last_name":"THOMAS","classification":"B","division":"PCC","hit_factor":13.1034},{"match_name":"DWB - Deadwood Boys USPSA 20 September 2020  Classifier Match Makeup","match_date":"2020-09-20","stage_classifiercode":"09-04","member_number":"TY-94897","first_name":"SHAWN","last_name":"WALTERS","classification":"U","division":"PCC","hit_factor":13.0909},{"match_name":"HPPS 6-19-2021","match_date":"2021-06-19","stage_classifiercode":"09-04","member_number":"A104773","first_name":"MATT","last_name":"GALLANT","classification":"M","division":"PCC","hit_factor":13.0841},{"match_name":"GAS MAY 2020 USPSA SLOT MATCH","match_date":"2020-05-02","stage_classifiercode":"09-04","member_number":"Ty29750","first_name":"CRAIG","last_name":"BOYD","classification":"M","division":"PCC","hit_factor":13.0769},{"match_name":"WPGC 12-5-16","match_date":"2016-12-04","stage_classifiercode":"09-04","member_number":"TY61531","first_name":"CURTIS","last_name":"BROTHERSTON","classification":"M","division":"PCC","hit_factor":13.0612},{"match_name":"SSPSC USPSA  June 6-7 2020","match_date":"2020-06-04","stage_classifiercode":"09-04","member_number":"TY88859","first_name":"MICHAEL","last_name":"KELLY","classification":"B","division":"PCC","hit_factor":13.0435},{"match_name":"TBAS USPSA Match 2/21/21","match_date":"2021-02-21","stage_classifiercode":"09-04","member_number":"A114253","first_name":"ZACH","last_name":"PARKER","classification":"U","division":"PCC","hit_factor":12.9278},{"match_name":"RSPP 3rd Saturday January 2017","match_date":"2017-01-21","stage_classifiercode":"09-04","member_number":"TY92330","first_name":"MATTHEW","last_name":"BHELLA","classification":"U","division":"PCC","hit_factor":12.9252},{"match_name":"Coyote USPSA  Classifier Match 8-22-17","match_date":"2017-08-23","stage_classifiercode":"09-04","member_number":"Ty87616","first_name":"MITCH","last_name":"BARLOW","classification":"U","division":"PCC","hit_factor":12.9032},{"match_name":"Hawkeye Feb Match","match_date":"2017-02-18","stage_classifiercode":"09-04","member_number":"TY81220","first_name":"ED","last_name":"SHULMAN","classification":"M","division":"PCC","hit_factor":12.8514},{"match_name":"Nampa USPSA May 1st 2021","match_date":"2021-05-01","stage_classifiercode":"09-04","member_number":"TY52406","first_name":"GARY","last_name":"CHAN","classification":"G","division":"PCC","hit_factor":12.8302},{"match_name":"NCPS USPSA Handgun Match July 22 2018a","match_date":"2018-07-22","stage_classifiercode":"09-04","member_number":"TY64320","first_name":"ROBERT","last_name":"SHARP","classification":"A","division":"PCC","hit_factor":12.8205},{"match_name":"July 27 2016 A Zone","match_date":"2016-07-27","stage_classifiercode":"09-04","member_number":"L3082","first_name":"ROY","last_name":"STEDMAN","classification":"G","division":"PCC","hit_factor":12.7586},{"match_name":"2019-03 USPSA at Shadow Hawk Defense","match_date":"2020-03-14","stage_classifiercode":"09-04","member_number":"FY15413","first_name":"TOM","last_name":"SUIT","classification":"G","division":"PCC","hit_factor":12.7341},{"match_name":"ANPRACS USPSA 6-17-18","match_date":"2018-06-17","stage_classifiercode":"09-04","member_number":"A73074","first_name":"STEVE","last_name":"COULTER","classification":"G","division":"PCC","hit_factor":12.7119},{"match_name":"RSPP 3rd Saturday August 2018","match_date":"2018-08-18","stage_classifiercode":"09-04","member_number":"A80318","first_name":"JIM","last_name":"ADAME","classification":"M","division":"PCC","hit_factor":12.6394},{"match_name":"WELD ECO09 20180415","match_date":"2018-04-15","stage_classifiercode":"09-04","member_number":"FY96118","first_name":"JOHN","last_name":"GRANNER","classification":"U","division":"PCC","hit_factor":12.5461},{"match_name":"DSS - USPSA - 21-07-24","match_date":"2021-07-24","stage_classifiercode":"09-04","member_number":"A102072","first_name":"ANTHONY","last_name":"ZABONIK","classification":"M","division":"PCC","hit_factor":12.5},{"match_name":"RPGi USPSA Last Minute Match 29 May 2021","match_date":"2021-05-29","stage_classifiercode":"09-04","member_number":"TY118547","first_name":"BRENDAN","last_name":"SOUDER","classification":"M","division":"PCC","hit_factor":12.4567},{"match_name":"RangeMasters 3-29-18","match_date":"2018-03-29","stage_classifiercode":"09-04","member_number":"TY26527","first_name":"DAVE","last_name":"CAMPBELL","classification":"M","division":"PCC","hit_factor":12.4138},{"match_name":"Rio Salado UPPL June 2020","match_date":"2020-06-14","stage_classifiercode":"09-04","member_number":"L4092","first_name":"LEIGHTON","last_name":"OOSTHUISEN","classification":"M","division":"PCC","hit_factor":12.4031},{"match_name":"ECO15 USPSA  3/10/2018","match_date":"2018-03-09","stage_classifiercode":"09-04","member_number":"a35242","first_name":"CHAD","last_name":"KIEHN","classification":"U","division":"PCC","hit_factor":12.3552},{"match_name":"Space Coast Practical Shooters","match_date":"2018-04-07","stage_classifiercode":"09-04","member_number":"A21361","first_name":"JIMMY","last_name":"OWENS","classification":"G","division":"PCC","hit_factor":12.3552},{"match_name":"Castlewood USPSA Sept 2020 shoot","match_date":"2020-09-26","stage_classifiercode":"09-04","member_number":"A46243","first_name":"JEFFREY","last_name":"WOLFE","classification":"A","division":"PCC","hit_factor":12.3457},{"match_name":"August 16 2017   a zone chicken ranch ","match_date":"2017-08-16","stage_classifiercode":"09-04","member_number":"A87214","first_name":"CORY","last_name":"KLEMASHEVICH","classification":"G","division":"PCC","hit_factor":12.3288},{"match_name":"CRCPS 2020-08-08","match_date":"2020-08-08","stage_classifiercode":"09-04","member_number":"A102318","first_name":"TED (2ND GUN)","last_name":"NISCHAN","classification":"U","division":"PCC","hit_factor":12.3188},{"match_name":"OREGON ARPC CC05 USPSA - Classifier Match - APR 10 2021","match_date":"2021-04-10","stage_classifiercode":"09-04","member_number":"TY84121","first_name":"GABOR","last_name":"MAGONY","classification":"G","division":"PCC","hit_factor":12.3077},{"match_name":"SAGC CTX04 Monthly USPSA Match - October 2020","match_date":"2020-10-25","stage_classifiercode":"09-04","member_number":"Ty64204","first_name":"BLAKE","last_name":"LILES","classification":"U","division":"PCC","hit_factor":12.2302},{"match_name":"WELD ECO09 20180415","match_date":"2018-04-15","stage_classifiercode":"09-04","member_number":"A61086","first_name":"CY","last_name":"SOTO","classification":"M","division":"PCC","hit_factor":12.2137},{"match_name":"Lin","match_date":"2017-06-10","stage_classifiercode":"09-04","member_number":"\"\"","first_name":"DONNIE","last_name":"SMITH","classification":"A","division":"PCC","hit_factor":12.1622},{"match_name":"YMM IPSC02 2017_11_12","match_date":"2017-11-12","stage_classifiercode":"09-04","member_number":"L2757","first_name":"RICK","last_name":"PUNU","classification":"M","division":"PCC","hit_factor":12.1622},{"match_name":"FBURG July 2017 Level I USPSA ","match_date":"2017-07-01","stage_classifiercode":"09-04","member_number":"TY69728","first_name":"JOSEPH","last_name":"PITHA","classification":"U","division":"PCC","hit_factor":12.1429},{"match_name":"Brazosland Pistoleros USPSA - Sunday September 12th","match_date":"2021-09-12","stage_classifiercode":"09-04","member_number":"A87214","first_name":"CORY","last_name":"KLEMASHEVICH","classification":"G","division":"PCC","hit_factor":12.1429},{"match_name":"DRRC USPSA Aug2018","match_date":"2018-08-04","stage_classifiercode":"09-04","member_number":"TY80327","first_name":"DAVE","last_name":"LUND","classification":"M","division":"PCC","hit_factor":12.1212},{"match_name":"Castlewood USPSA Sept 2020 shoot","match_date":"2020-09-26","stage_classifiercode":"09-04","member_number":"TY-51935","first_name":"RICH","last_name":"DAUGHERTY","classification":"A","division":"PCC","hit_factor":12.0996},{"match_name":"WPGC 12-5-16","match_date":"2016-12-04","stage_classifiercode":"09-04","member_number":"L2598","first_name":"HOSER","last_name":"FREEMAN","classification":"G","division":"PCC","hit_factor":12.0805},{"match_name":"Grandbaggers October 2017","match_date":"2017-10-05","stage_classifiercode":"09-04","member_number":"A49393","first_name":"NAIM","last_name":"SAITI","classification":"M","division":"PCC","hit_factor":12.0253},{"match_name":"Oh Shoot-PRG  May 2nd - 1st Sunday Match","match_date":"2021-05-02","stage_classifiercode":"09-04","member_number":"TY127703","first_name":"MARC","last_name":"MAGLINTE","classification":"A","division":"PCC","hit_factor":12.0141},{"match_name":"Taxman Special ORSA USPSA 21 Apr 2018","match_date":"2018-04-21","stage_classifiercode":"09-04","member_number":"TY100944","first_name":"STEVE","last_name":"MARMADUKE","classification":"B","division":"PCC","hit_factor":12},{"match_name":"Emmett November Match","match_date":"2018-11-24","stage_classifiercode":"09-04","member_number":"A84188","first_name":"LARRY","last_name":"OLETSKI","classification":"A","division":"PCC","hit_factor":12},{"match_name":"Coyote USPSA  Classifier Match 8-22-17","match_date":"2017-08-23","stage_classifiercode":"09-04","member_number":"Ty90174","first_name":"JAMES","last_name":"PURCELL","classification":"U","division":"PCC","hit_factor":11.9718},{"match_name":"EWPSA  2018-02","match_date":"2018-02-18","stage_classifiercode":"09-04","member_number":"TY49461","first_name":"DAVID","last_name":"BLOSSER","classification":"M","division":"PCC","hit_factor":11.9403},{"match_name":"GoShoot Indoors","match_date":"2018-01-14","stage_classifiercode":"09-04","member_number":"A106066","first_name":"CJ","last_name":"PERRY","classification":"U","division":"PCC","hit_factor":11.9298},{"match_name":"Medford USPSA  June 2020","match_date":"2020-06-21","stage_classifiercode":"09-04","member_number":"A88720","first_name":"SCOTT","last_name":"LARSON","classification":"M","division":"PCC","hit_factor":11.9298},{"match_name":"June 28 2018 A-Zone  classifier","match_date":"2018-06-28","stage_classifiercode":"09-04","member_number":"L3259","first_name":"KARL PCC","last_name":"REHN","classification":"M","division":"PCC","hit_factor":11.8812},{"match_name":"Shoot GTR USPSA  July 01 2018","match_date":"2018-07-01","stage_classifiercode":"09-04","member_number":"TY86924","first_name":"MICAHAEL","last_name":"STACK","classification":"M","division":"PCC","hit_factor":11.838},{"match_name":"DWB - Deadwood Boys USPSA 20 September 2020  Classifier Match Makeup","match_date":"2020-09-20","stage_classifiercode":"09-04","member_number":"TY98956","first_name":"ED","last_name":"HOFILENA","classification":"B","division":"PCC","hit_factor":11.8081},{"match_name":"CGC 10-14-2017","match_date":"2017-10-14","stage_classifiercode":"09-04","member_number":"A84201","first_name":"ZANE","last_name":"RUTLEDGE","classification":"A","division":"PCC","hit_factor":11.7647},{"match_name":"Nampa USPSA May 1st 2021","match_date":"2021-05-01","stage_classifiercode":"09-04","member_number":"TY82305","first_name":"J ARLEN","last_name":"BATES","classification":"M","division":"PCC","hit_factor":11.7647},{"match_name":"MPSA 2021-07-17","match_date":"2021-07-17","stage_classifiercode":"09-04","member_number":"A6205","first_name":"GREG","last_name":"PATE","classification":"B","division":"PCC","hit_factor":11.7647},{"match_name":"2019-03 USPSA at Shadow Hawk Defense","match_date":"2020-03-14","stage_classifiercode":"09-04","member_number":"TY83220","first_name":"NICK","last_name":"WILLIAMS","classification":"G","division":"PCC","hit_factor":11.7647},{"match_name":"Maine Practical Shooters May 2018","match_date":"2018-05-12","stage_classifiercode":"09-04","member_number":"L4396","first_name":"CURT","last_name":"CASERTA","classification":"A","division":"PCC","hit_factor":11.7264},{"match_name":"Dawg Valley USPSA April 14 2018","match_date":"2018-04-14","stage_classifiercode":"09-04","member_number":"Fy92359","first_name":"TONY","last_name":"WELLS","classification":"\"\"","division":"PCC","hit_factor":11.7264},{"match_name":"RSPP 3rd Saturday August 2018","match_date":"2018-08-18","stage_classifiercode":"09-04","member_number":"L2842","first_name":"PAUL","last_name":"CAUDILL","classification":"A","division":"PCC","hit_factor":11.7241},{"match_name":"LCHG April USPSA","match_date":"2017-04-15","stage_classifiercode":"09-04","member_number":"A85465","first_name":"AARON","last_name":"PUGH","classification":"U","division":"PCC","hit_factor":11.6505},{"match_name":"DRRC USPSA Aug2018","match_date":"2018-08-04","stage_classifiercode":"09-04","member_number":"TY84121","first_name":"GABOR","last_name":"MAGONY","classification":"M","division":"PCC","hit_factor":11.6364},{"match_name":"Triforce Practical Shooters at BigWoodsGoods 4-26-18","match_date":"2018-04-26","stage_classifiercode":"09-04","member_number":"A109098","first_name":"FRANK","last_name":"PUCCI","classification":"U","division":"PCC","hit_factor":11.6279},{"match_name":"PRG-USPSA - Oh Shoot November 15th - 3rd Sunday","match_date":"2020-11-15","stage_classifiercode":"09-04","member_number":"A81018","first_name":"BART","last_name":"DEL RIO","classification":"A","division":"PCC","hit_factor":11.6183},{"match_name":"DWB - Deadwood Boys USPSA 20 September 2020  Classifier Match Makeup","match_date":"2020-09-20","stage_classifiercode":"09-04","member_number":"A91936","first_name":"CHRISTOPHER","last_name":"GURNETT","classification":"D","division":"PCC","hit_factor":11.6071},{"match_name":"Homestead USPSA Oct 25","match_date":"2017-10-25","stage_classifiercode":"09-04","member_number":"FY78729","first_name":"EDDIE","last_name":"DIAZ","classification":"M","division":"PCC","hit_factor":11.6041},{"match_name":"HSA USPSA January 2020","match_date":"2020-01-08","stage_classifiercode":"09-04","member_number":"A115899","first_name":"MIKE","last_name":"SEIFFERT","classification":"G","division":"PCC","hit_factor":11.6041},{"match_name":"2019-03 USPSA at Shadow Hawk Defense","match_date":"2020-03-14","stage_classifiercode":"09-04","member_number":"TY83360","first_name":"JESSE","last_name":"DOVE","classification":"M","division":"PCC","hit_factor":11.6041},{"match_name":"2019-03 USPSA at Shadow Hawk Defense","match_date":"2020-03-14","stage_classifiercode":"09-04","member_number":"TY83821","first_name":"DEREK","last_name":"EINSIG","classification":"M","division":"PCC","hit_factor":11.6041},{"match_name":"Brazosland Pistoleros August 20 2017","match_date":"2017-08-20","stage_classifiercode":"09-04","member_number":"A87214","first_name":"CORY","last_name":"KLEMASHEVICH","classification":"M","division":"PCC","hit_factor":11.5854},{"match_name":"PTPC February 4th Classifier Match","match_date":"2018-02-04","stage_classifiercode":"09-04","member_number":"FY70698","first_name":"JAY","last_name":"CARILLO","classification":"A","division":"PCC","hit_factor":11.583},{"match_name":"RPGi USPSA Last Minute Match 29 May 2021","match_date":"2021-05-29","stage_classifiercode":"09-04","member_number":"A126018","first_name":"GATLIN","last_name":"JOHNSON","classification":"M","division":"PCC","hit_factor":11.5646},{"match_name":"WPGC 12-5-16","match_date":"2016-12-04","stage_classifiercode":"09-04","member_number":"A86526","first_name":"DOUGLAS","last_name":"NORMAN","classification":"A","division":"PCC","hit_factor":11.5523},{"match_name":"ANPRACS USPSA12-17-17","match_date":"2017-12-17","stage_classifiercode":"09-04","member_number":"A73074","first_name":"STEVE","last_name":"COULTER","classification":"M","division":"PCC","hit_factor":11.5385},{"match_name":"AGC_20170402","match_date":"2017-04-02","stage_classifiercode":"09-04","member_number":"\"\"","first_name":"JIMMY","last_name":"HOLDSWORTH","classification":"U","division":"PCC","hit_factor":11.4865},{"match_name":"ANPRACS USPSA 6-17-18","match_date":"2018-06-17","stage_classifiercode":"09-04","member_number":"FY83723","first_name":"BEN","last_name":"HIGGINS","classification":"A","division":"PCC","hit_factor":11.4804},{"match_name":"Grandbaggers October 2017","match_date":"2017-10-05","stage_classifiercode":"09-04","member_number":"TY99353","first_name":"TRAVIS","last_name":"MCCAMISH","classification":"M","division":"PCC","hit_factor":11.4286},{"match_name":"FBURG July 2017 Level I USPSA ","match_date":"2017-07-01","stage_classifiercode":"09-04","member_number":"A82592","first_name":"TOM","last_name":"KOH","classification":"A","division":"PCC","hit_factor":11.4068},{"match_name":"RSPP 3rd Saturday August 2018","match_date":"2018-08-18","stage_classifiercode":"09-04","member_number":"A98371","first_name":"BRANDON","last_name":"SCHILLING","classification":"U","division":"PCC","hit_factor":11.3772},{"match_name":"Veterans 3 Gun PM Classifier Benefit Match","match_date":"2020-02-22","stage_classifiercode":"09-04","member_number":"TY106753","first_name":"JC","last_name":"SCHUMACHER","classification":"U","division":"PCC","hit_factor":11.3565},{"match_name":"Brazosland Pistoleros August 20 2017","match_date":"2017-08-20","stage_classifiercode":"09-04","member_number":"\"\"","first_name":"DOUGLAS","last_name":"CAMPBELL","classification":"U","division":"PCC","hit_factor":11.3565},{"match_name":"GRPC USPSA DO YOU FEEL LUCKY","match_date":"2020-03-01","stage_classifiercode":"09-04","member_number":"A81745","first_name":"AJ","last_name":"JACKSON","classification":"A","division":"PCC","hit_factor":11.3433},{"match_name":"EHPSA USPSA 26 August 2018","match_date":"2018-08-26","stage_classifiercode":"09-04","member_number":"L3026","first_name":"DAVE","last_name":"DORISIO","classification":"A","division":"PCC","hit_factor":11.3333},{"match_name":"Oakdale USPSA MN07 7-30-2020","match_date":"2020-07-30","stage_classifiercode":"09-04","member_number":"TY119536","first_name":"RYAN","last_name":"VOLOVSEK","classification":"M","division":"PCC","hit_factor":11.2782},{"match_name":"Triforce Practical Shooters at BigWoodsGoods 4-26-18","match_date":"2018-04-26","stage_classifiercode":"09-04","member_number":"A84201","first_name":"ZANE","last_name":"RUTLEDGE","classification":"G","division":"PCC","hit_factor":11.2583},{"match_name":"Brazosland Pistoleros USPSA - Sunday September 12th","match_date":"2021-09-12","stage_classifiercode":"09-04","member_number":"A91497","first_name":"SCOTT","last_name":"REEH","classification":"M","division":"PCC","hit_factor":11.215},{"match_name":"CGC 10-14-2017","match_date":"2017-10-14","stage_classifiercode":"09-04","member_number":"A70169","first_name":"AVERY","last_name":"BISHOP","classification":"B","division":"PCC","hit_factor":11.2},{"match_name":"DRRC USPSA Aug2018","match_date":"2018-08-04","stage_classifiercode":"09-04","member_number":"TY80327","first_name":"DAVID","last_name":"LUND","classification":"M","division":"PCC","hit_factor":11.1888},{"match_name":"Veterans 3 Gun AM Classifier Benefit Match","match_date":"2020-02-22","stage_classifiercode":"09-04","member_number":"A97425","first_name":"JORDAN","last_name":"PARKER","classification":"U","division":"PCC","hit_factor":11.1765},{"match_name":"MVPSA USPSA 12-15-18 CLASSIFIER","match_date":"2018-12-15","stage_classifiercode":"09-04","member_number":"A61146","first_name":"MARK","last_name":"HOFFMIER","classification":"C","division":"PCC","hit_factor":11.1554},{"match_name":"WELD ECO09 20180415","match_date":"2018-04-15","stage_classifiercode":"09-04","member_number":"L3719","first_name":"MATT","last_name":"HESS","classification":"A","division":"PCC","hit_factor":11.1111},{"match_name":"OREGON ARPC CC05 USPSA APRIL 8 2017","match_date":"2017-04-08","stage_classifiercode":"09-04","member_number":"a87653","first_name":"DENNIS","last_name":"OHEARN","classification":"U","division":"PCC","hit_factor":11.0769},{"match_name":"Space Coast Practical Shooters","match_date":"2018-04-07","stage_classifiercode":"09-04","member_number":"A77998","first_name":"CALVIN","last_name":"CARPENTER","classification":"M","division":"PCC","hit_factor":11.0749},{"match_name":"MSSA Uspsa Club Match","match_date":"2017-09-09","stage_classifiercode":"09-04","member_number":"A104151","first_name":"SETH","last_name":"MCMAHAN","classification":"B","division":"PCC","hit_factor":11.0749},{"match_name":"Bare Arms Apr 21/2018","match_date":"2018-04-21","stage_classifiercode":"09-04","member_number":"\"\"","first_name":"SAMUEL","last_name":"CRAGER","classification":"\"\"","division":"PCC","hit_factor":11.0727},{"match_name":"MSSA Uspsa Club Match","match_date":"2017-09-09","stage_classifiercode":"09-04","member_number":"L843","first_name":"LYNN","last_name":"JONES","classification":"A","division":"PCC","hit_factor":11.0727},{"match_name":"HPPS 6-19-2021","match_date":"2021-06-19","stage_classifiercode":"09-04","member_number":"TY90386","first_name":"ALEX","last_name":"IGLESIAS","classification":"M","division":"PCC","hit_factor":11.0701},{"match_name":"RSPP 3rd Saturday January 2018","match_date":"2018-01-20","stage_classifiercode":"09-04","member_number":"TY61938","first_name":"TIM","last_name":"SMITH","classification":"M","division":"PCC","hit_factor":11.0672},{"match_name":"Brazosland Pistoleros August 20 2017","match_date":"2017-08-20","stage_classifiercode":"09-04","member_number":"A74846","first_name":"KYLE","last_name":"POST","classification":"U","division":"PCC","hit_factor":11.039},{"match_name":"PRG-USPSA - Oh Shoot November 15th - 3rd Sunday","match_date":"2020-11-15","stage_classifiercode":"09-04","member_number":"TY101012","first_name":"MICHAEL","last_name":"BOYLE","classification":"B","division":"PCC","hit_factor":11.039},{"match_name":"PRG-USPSA - Oh Shoot November 15th - 3rd Sunday","match_date":"2020-11-15","stage_classifiercode":"09-04","member_number":"Ty68331","first_name":"AZIZ","last_name":"BROU","classification":"A","division":"PCC","hit_factor":11.0345},{"match_name":" 2018 \"","match_date":"2018-07-21","stage_classifiercode":"09-04","member_number":"A88985","first_name":"GREG","last_name":"HERRELL","classification":"M","division":"PCC","hit_factor":11.0294},{"match_name":"FLSC February Classifier Match","match_date":"2017-02-04","stage_classifiercode":"09-04","member_number":"FY62355","first_name":"JUSTIN","last_name":"JOHNSON","classification":"U","division":"PCC","hit_factor":11.0145},{"match_name":"MVPSA USPSA 12-15-18 CLASSIFIER","match_date":"2018-12-15","stage_classifiercode":"09-04","member_number":"TY57751","first_name":"BOB","last_name":"HARRIS","classification":"A","division":"PCC","hit_factor":10.9966},{"match_name":"SWGC USPSA Pistol Match - March 2021","match_date":"2021-03-06","stage_classifiercode":"09-04","member_number":"A79827","first_name":"DAVID","last_name":"LANCASTER","classification":"A","division":"PCC","hit_factor":10.989},{"match_name":"WPGC 12-5-16","match_date":"2016-12-04","stage_classifiercode":"09-04","member_number":"A56290","first_name":"FRANK","last_name":"WINN","classification":"A","division":"PCC","hit_factor":10.9827},{"match_name":"DGC USPSA 07-26-20","match_date":"2020-07-26","stage_classifiercode":"09-04","member_number":"A110418","first_name":"NASSER","last_name":"SAMUY","classification":"A","division":"PCC","hit_factor":10.9756},{"match_name":"5 Dogs September 2016 USPSA","match_date":"2016-09-04","stage_classifiercode":"09-04","member_number":"TY22721","first_name":"WAYDE","last_name":"SHIMODA","classification":"C","division":"PCC","hit_factor":10.9756},{"match_name":"ARPC USPSA Match 11-25-18","match_date":"2018-11-25","stage_classifiercode":"09-04","member_number":"A67446","first_name":"DAN","last_name":"SPRAUL","classification":"B","division":"PCC","hit_factor":10.9589},{"match_name":"Bossier Parish Practical Shooters June 13 2020","match_date":"2020-06-13","stage_classifiercode":"09-04","member_number":"L3696","first_name":"ROBERT","last_name":"HALSELL","classification":"M","division":"PCC","hit_factor":10.951},{"match_name":"DSS - USPSA - 21-07-24","match_date":"2021-07-24","stage_classifiercode":"09-04","member_number":"A116426","first_name":"TOM","last_name":"AHOLA","classification":"B","division":"PCC","hit_factor":10.9489},{"match_name":"Steel City USPSA April 1 2017","match_date":"2017-04-01","stage_classifiercode":"09-04","member_number":"A60070","first_name":"ROBERT","last_name":"MOORE","classification":"U","division":"PCC","hit_factor":10.9422},{"match_name":"ARPC USPSA Match 11-25-18","match_date":"2018-11-25","stage_classifiercode":"09-04","member_number":"A92234","first_name":"BOB","last_name":"KOKOTOVICH","classification":"B","division":"PCC","hit_factor":10.9325},{"match_name":"Fernan USPSA August 2021","match_date":"2021-08-21","stage_classifiercode":"09-04","member_number":"L1275","first_name":"J.D.","last_name":"DOVER","classification":"A","division":"PCC","hit_factor":10.9325},{"match_name":"SLOSA February 2018 USPSA MATCH","match_date":"2018-02-10","stage_classifiercode":"09-04","member_number":"A82686","first_name":"CASEY","last_name":"RYAN","classification":"A","division":"PCC","hit_factor":10.9215},{"match_name":"RSPP 3rd Saturday January 2018","match_date":"2018-01-20","stage_classifiercode":"09-04","member_number":"A80318","first_name":"JIM","last_name":"ADAME","classification":"M","division":"PCC","hit_factor":10.9215},{"match_name":"Brazosland Pistoleros August 20 2017","match_date":"2017-08-20","stage_classifiercode":"09-04","member_number":"A94852","first_name":"RANDY","last_name":"GOODNEY","classification":"A","division":"PCC","hit_factor":10.9195},{"match_name":"HPPS 6-19-2021","match_date":"2021-06-19","stage_classifiercode":"09-04","member_number":"TY103254","first_name":"REGIS","last_name":"FRANK","classification":"B","division":"PCC","hit_factor":10.9091},{"match_name":"GoShoot Indoors","match_date":"2018-01-14","stage_classifiercode":"09-04","member_number":"L3974","first_name":"ANDY","last_name":"KWON","classification":"U","division":"PCC","hit_factor":10.8974},{"match_name":"MISS USPSA 5-30-18","match_date":"2018-05-30","stage_classifiercode":"09-04","member_number":"A73683","first_name":"BRYAN","last_name":"TECSON","classification":"M","division":"PCC","hit_factor":10.8949},{"match_name":"Homestead USPSA Oct 25","match_date":"2017-10-25","stage_classifiercode":"09-04","member_number":"FY70733","first_name":"RICK","last_name":"LUND","classification":"G","division":"PCC","hit_factor":10.8761},{"match_name":"SWGC USPSA Pistol Match - March 2021","match_date":"2021-03-06","stage_classifiercode":"09-04","member_number":"L4842","first_name":"JOSH","last_name":"WEEKS","classification":"U","division":"PCC","hit_factor":10.8626},{"match_name":"TCSC USPSA Level I June club match","match_date":"2021-06-26","stage_classifiercode":"09-04","member_number":"L4521","first_name":"MIKE","last_name":"ENGLAND","classification":"B","division":"PCC","hit_factor":10.8475},{"match_name":"ORPCI 2018.03.31 USPSA Special","match_date":"2018-03-31","stage_classifiercode":"09-04","member_number":"A82559","first_name":"TRAVIS","last_name":"FITZPATRICK","classification":"M","division":"PCC","hit_factor":10.8303},{"match_name":"FBURG July 2017 Level I USPSA ","match_date":"2017-07-01","stage_classifiercode":"09-04","member_number":"A85896","first_name":"JOHN","last_name":"MCQUEEN","classification":"B","division":"PCC","hit_factor":10.828},{"match_name":"2019-03 USPSA at Shadow Hawk Defense","match_date":"2020-03-14","stage_classifiercode":"09-04","member_number":"L4331","first_name":"BRANDON","last_name":"HIGBEE","classification":"G","division":"PCC","hit_factor":10.828},{"match_name":"SFPC Annual Picnic Match","match_date":"2017-02-12","stage_classifiercode":"09-04","member_number":"A77482","first_name":"TODD","last_name":"LOUIS","classification":"U","division":"PCC","hit_factor":10.8108},{"match_name":"RCPS USPSA October 13","match_date":"2018-10-13","stage_classifiercode":"09-04","member_number":"L3655","first_name":"DARREN","last_name":"MULFORD","classification":"M","division":"PCC","hit_factor":10.8108},{"match_name":"FBURG July 2017 Level I USPSA ","match_date":"2017-07-01","stage_classifiercode":"09-04","member_number":"FY62313","first_name":"TONY","last_name":"GIMMELLIE","classification":"U","division":"PCC","hit_factor":10.8108},{"match_name":"SWGC USPSA Pistol Match - March 2021","match_date":"2021-03-06","stage_classifiercode":"09-04","member_number":"A108049","first_name":"TERRY","last_name":"DEROUSSE","classification":"C","division":"PCC","hit_factor":10.7744},{"match_name":"Prescott Action Shooters 1st Saturday USPSA 5-01-21","match_date":"2021-05-01","stage_classifiercode":"09-04","member_number":"ty6671","first_name":"MICHAEL","last_name":"CHAMBERS","classification":"M","division":"PCC","hit_factor":10.7744},{"match_name":"RCPS USPSA October 13","match_date":"2018-10-13","stage_classifiercode":"09-04","member_number":"FY73907","first_name":"THOMAS","last_name":"MASSEY","classification":"B","division":"PCC","hit_factor":10.7595},{"match_name":"USPSA","match_date":"2017-03-05","stage_classifiercode":"09-04","member_number":"TY89288","first_name":"BRUCE","last_name":"TAYLOR","classification":"\"\"","division":"PCC","hit_factor":10.7527},{"match_name":"Grandbaggers December 2017","match_date":"2017-12-07","stage_classifiercode":"09-04","member_number":"A22810","first_name":"KERRY","last_name":"PEARSON","classification":"M","division":"PCC","hit_factor":10.7383},{"match_name":"PCGC USPSA July 2018","match_date":"2018-07-22","stage_classifiercode":"09-04","member_number":"TY72738","first_name":"MICHAEL","last_name":"THOMPSON","classification":"B","division":"PCC","hit_factor":10.7256},{"match_name":"Coyote USPSA  Classifier Match 8-22-17","match_date":"2017-08-23","stage_classifiercode":"09-04","member_number":"a18138","first_name":"MARK","last_name":"SELF","classification":"U","division":"PCC","hit_factor":10.7143},{"match_name":"Steel City USPSA April 1 2017","match_date":"2017-04-01","stage_classifiercode":"09-04","member_number":"A100328","first_name":"JOSH","last_name":"TAYLOR","classification":"A","division":"PCC","hit_factor":10.7143},{"match_name":"Rio Salado UPPL June 2020","match_date":"2020-06-14","stage_classifiercode":"09-04","member_number":"L3417","first_name":"JAMES","last_name":"ROBERTS","classification":"A","division":"PCC","hit_factor":10.7042},{"match_name":"Medford USPSA  June 2020","match_date":"2020-06-21","stage_classifiercode":"09-04","member_number":"A115266","first_name":"JASON","last_name":"KODYSZ","classification":"B","division":"PCC","hit_factor":10.7023},{"match_name":"NW01 Mt  Rainier Shadow April 20th 2021 Match","match_date":"2021-04-21","stage_classifiercode":"09-04","member_number":"Ty100358","first_name":"KELLY","last_name":"BENNETT","classification":"M","division":"PCC","hit_factor":10.6825},{"match_name":"FBURG July 2017 Level I USPSA ","match_date":"2017-07-01","stage_classifiercode":"09-04","member_number":"FY83588","first_name":"IAN","last_name":"MEYERS","classification":"G","division":"PCC","hit_factor":10.6583},{"match_name":"GAS MAY 2020 USPSA SLOT MATCH","match_date":"2020-05-02","stage_classifiercode":"09-04","member_number":"A27824","first_name":"JOE","last_name":"REINSCH","classification":"U","division":"PCC","hit_factor":10.6509},{"match_name":"MPSA 2021-07-17","match_date":"2021-07-17","stage_classifiercode":"09-04","member_number":"A78083","first_name":"JEFFREY","last_name":"BLITCH","classification":"B","division":"PCC","hit_factor":10.625},{"match_name":"HSA USPSA January 2021","match_date":"2021-01-05","stage_classifiercode":"09-04","member_number":"Ty97411","first_name":"JOE","last_name":"VELAZQUEZ","classification":"B","division":"PCC","hit_factor":10.6195},{"match_name":"Taxman Special ORSA USPSA 21 Apr 2018","match_date":"2018-04-21","stage_classifiercode":"09-04","member_number":"A77313","first_name":"DAVID","last_name":"STRUCKOFF","classification":"A","division":"PCC","hit_factor":10.6195},{"match_name":"Brazosland Pistoleros August 20 2017","match_date":"2017-08-20","stage_classifiercode":"09-04","member_number":"TY56894","first_name":"CHRIS","last_name":"PEDUTO","classification":"U","division":"PCC","hit_factor":10.6195},{"match_name":"H&H July Match","match_date":"2017-07-23","stage_classifiercode":"09-04","member_number":"A93174","first_name":"SCOTT","last_name":"CUDE","classification":"A","division":"PCC","hit_factor":10.6195},{"match_name":"CVSC 04-22-2018","match_date":"2018-04-22","stage_classifiercode":"09-04","member_number":"\"\"","first_name":"JIM","last_name":"WILKERSON","classification":"U","division":"PCC","hit_factor":10.5919},{"match_name":"ARPC USPSA Match 11-29-20","match_date":"2020-11-29","stage_classifiercode":"09-04","member_number":"A115575","first_name":"DYLAN","last_name":"HARPER","classification":"GM","division":"PCC","hit_factor":10.5882},{"match_name":"Devil Dog USPSA Classifier Match-Saturday Session","match_date":"2018-03-10","stage_classifiercode":"09-04","member_number":"A78407","first_name":"TODD","last_name":"JESSEE","classification":"M","division":"PCC","hit_factor":10.5691},{"match_name":"Prescott Action Shooters 1st Saturday USPSA 5-01-21","match_date":"2021-05-01","stage_classifiercode":"09-04","member_number":"A96388","first_name":"CHRISTOPHER","last_name":"JOHNSON","classification":"M","division":"PCC","hit_factor":10.5634},{"match_name":"BORCC USPSA Classifier Match January 2017","match_date":"2017-01-22","stage_classifiercode":"09-04","member_number":"FY70698","first_name":"JASON","last_name":"CARILLO","classification":"U","division":"PCC","hit_factor":10.5611},{"match_name":"Nampa USPSA May 1st 2021","match_date":"2021-05-01","stage_classifiercode":"09-04","member_number":"TY87846","first_name":"JOHN","last_name":"JENSEN","classification":"B","division":"PCC","hit_factor":10.5611},{"match_name":"SWGC USPSA Pistol Match - March 2021","match_date":"2021-03-06","stage_classifiercode":"09-04","member_number":"FY88724","first_name":"JESSICA","last_name":"DOIRON","classification":"M","division":"PCC","hit_factor":10.559},{"match_name":"OREGON ARPC CC05 USPSA - Classifier Match - APR 10 2021","match_date":"2021-04-10","stage_classifiercode":"09-04","member_number":"TY45892","first_name":"RICHARD N","last_name":"BROWNING","classification":"C","division":"PCC","hit_factor":10.559},{"match_name":"WGC USPSA Special Classifier 4-17-2021","match_date":"2021-04-17","stage_classifiercode":"09-04","member_number":"A83637","first_name":"ANDREW","last_name":"YACKLEY","classification":"U","division":"PCC","hit_factor":10.5263},{"match_name":"PPPS 10-8-17","match_date":"2017-10-08","stage_classifiercode":"09-04","member_number":"TY55863","first_name":"SEAN","last_name":"MYHRE","classification":"A","division":"PCC","hit_factor":10.5263},{"match_name":"Rio Salado RSPP January 2021","match_date":"2021-01-16","stage_classifiercode":"09-04","member_number":"FY108641","first_name":"CHRIS","last_name":"DEGLER","classification":"B","division":"PCC","hit_factor":10.5263},{"match_name":"WELD ECO09 20180415","match_date":"2018-04-15","stage_classifiercode":"09-04","member_number":"L4280","first_name":"DAVE","last_name":"BENSON","classification":"B","division":"PCC","hit_factor":10.5263},{"match_name":"LA05 Tangi October Gator warm up match 2018","match_date":"2018-10-14","stage_classifiercode":"09-04","member_number":"TY75540","first_name":"JAMES","last_name":"MAY","classification":"A","division":"PCC","hit_factor":10.4956},{"match_name":"SLOSA February 2018 USPSA MATCH","match_date":"2018-02-10","stage_classifiercode":"09-04","member_number":"TY87139","first_name":"EFREN","last_name":"CABREROS","classification":"M","division":"PCC","hit_factor":10.4918},{"match_name":"CRCPS 2020-08-08","match_date":"2020-08-08","stage_classifiercode":"09-04","member_number":"A102318","first_name":"TED","last_name":"NISCHAN","classification":"U","division":"PCC","hit_factor":10.4895},{"match_name":"5 Dogs September 2016 USPSA","match_date":"2016-09-04","stage_classifiercode":"09-04","member_number":"\"\"","first_name":"WESLEY","last_name":"SHIMODA","classification":"D","division":"PCC","hit_factor":10.4895},{"match_name":"FLSC February Classifier Match","match_date":"2017-02-04","stage_classifiercode":"09-04","member_number":"A86548","first_name":"JOSH","last_name":"EERNISSE","classification":"U","division":"PCC","hit_factor":10.4651},{"match_name":"CSA Annual Classifier Classic","match_date":"2018-03-18","stage_classifiercode":"09-04","member_number":"TY85570","first_name":"DAVID","last_name":"MILLER","classification":"M","division":"PCC","hit_factor":10.4615},{"match_name":"SEPSA March 2021","match_date":"2021-03-13","stage_classifiercode":"09-04","member_number":"TY73281","first_name":"JACK","last_name":"DARTIGALONGUE","classification":"B","division":"PCC","hit_factor":10.4478},{"match_name":"Richmond Hot Shots 2018 USPSA Special Classifier Match - Jan 28 2018","match_date":"2018-01-28","stage_classifiercode":"09-04","member_number":"TY79621","first_name":"STEPHEN","last_name":"COLLEN","classification":"B","division":"PCC","hit_factor":10.4348},{"match_name":"GoShoot Indoors","match_date":"2018-01-14","stage_classifiercode":"09-04","member_number":"FY86526","first_name":"DOUGLAS","last_name":"NORMAN","classification":"M","division":"PCC","hit_factor":10.4294},{"match_name":"Space Coast Practical Shooters","match_date":"2018-04-07","stage_classifiercode":"09-04","member_number":"A69150","first_name":"DERRICK","last_name":"CHEN-LUKE","classification":"A","division":"PCC","hit_factor":10.4089},{"match_name":"Uspsa Classifier","match_date":"2018-05-06","stage_classifiercode":"09-04","member_number":"TYF96516","first_name":"CRAIG","last_name":"CHADDOCK","classification":"U","division":"PCC","hit_factor":10.4046},{"match_name":"HPPS 6-19-2021","match_date":"2021-06-19","stage_classifiercode":"09-04","member_number":"a123157","first_name":"MIKE","last_name":"GONCALVES","classification":"B","division":"PCC","hit_factor":10.3896},{"match_name":"ORGC October 2018 Pistol Match","match_date":"2018-10-14","stage_classifiercode":"09-04","member_number":"A61412","first_name":"KEITH","last_name":"BOURGEOIS","classification":"A","division":"PCC","hit_factor":10.3806},{"match_name":"Rio Salado UPPL June 2020","match_date":"2020-06-14","stage_classifiercode":"09-04","member_number":"TY82499","first_name":"SCOTT","last_name":"SRIPAPATTANAVONG","classification":"M","division":"PCC","hit_factor":10.3806},{"match_name":"SWGC USPSA Pistol Match - March 2021","match_date":"2021-03-06","stage_classifiercode":"09-04","member_number":"A132117","first_name":"GABE","last_name":"WILSON","classification":"U","division":"PCC","hit_factor":10.3746},{"match_name":"Rio Salado UPPL June 2020","match_date":"2020-06-14","stage_classifiercode":"09-04","member_number":"A66294","first_name":"DAVID","last_name":"NUNLEY","classification":"A","division":"PCC","hit_factor":10.3659},{"match_name":"SWGC USPSA Pistol Match - March 2021","match_date":"2021-03-06","stage_classifiercode":"09-04","member_number":"TY97327","first_name":"TIM","last_name":"WEBSTER","classification":"B","division":"PCC","hit_factor":10.356},{"match_name":"SAGC CTX04 Monthly USPSA Match - October 2020","match_date":"2020-10-25","stage_classifiercode":"09-04","member_number":"A117202","first_name":"STACEY","last_name":"CALDER","classification":"C","division":"PCC","hit_factor":10.356},{"match_name":"Shoot GTR USPSA  July 01 2018","match_date":"2018-07-01","stage_classifiercode":"09-04","member_number":"TY53290","first_name":"KENT","last_name":"CORI","classification":"M","division":"PCC","hit_factor":10.3343},{"match_name":"RangeMasters 3-29-18","match_date":"2018-03-29","stage_classifiercode":"09-04","member_number":"A94852","first_name":"RANDY","last_name":"GOODNEY","classification":"A","division":"PCC","hit_factor":10.3152},{"match_name":"PRG-USPSA - Oh Shoot November 15th - 3rd Sunday","match_date":"2020-11-15","stage_classifiercode":"09-04","member_number":"try6047","first_name":"JIMMY","last_name":"ORDONEZ","classification":"A","division":"PCC","hit_factor":10.303},{"match_name":"NNRPA USPSA January 2021","match_date":"2021-01-23","stage_classifiercode":"09-04","member_number":"TY29032","first_name":"THOMAS","last_name":"STANNARD","classification":"B","division":"PCC","hit_factor":10.303},{"match_name":"HRRB 11-20-2021","match_date":"2021-11-20","stage_classifiercode":"09-04","member_number":"FY61621","first_name":"DERICK","last_name":"HIPOL","classification":"U","division":"PCC","hit_factor":10.303},{"match_name":"XMG USPSA March 20 2021","match_date":"2021-03-20","stage_classifiercode":"09-04","member_number":"TY103871","first_name":"STEVE","last_name":"BURROUGHS","classification":"A","division":"PCC","hit_factor":10.2857},{"match_name":"XMG USPSA March 20 2021","match_date":"2021-03-20","stage_classifiercode":"09-04","member_number":"TY66303","first_name":"BRIAN","last_name":"HURST","classification":"B","division":"PCC","hit_factor":10.2719},{"match_name":"August 16 2017 A Zone","match_date":"2017-08-16","stage_classifiercode":"09-04","member_number":"A87214","first_name":"CORY","last_name":"KLEMASHEVICH","classification":"G","division":"PCC","hit_factor":10.2426},{"match_name":"Lin","match_date":"2017-06-10","stage_classifiercode":"09-04","member_number":"\"\"","first_name":"DONNIE","last_name":"SMITH","classification":"A","division":"PCC","hit_factor":10.2426},{"match_name":"Cowtown Pistol Club USPSA December 28 2020","match_date":"2020-12-29","stage_classifiercode":"09-04","member_number":"TY120819","first_name":"DANIEL","last_name":"FLETCHER","classification":"A","division":"PCC","hit_factor":10.241},{"match_name":"PCGC October 2016","match_date":"2016-10-23","stage_classifiercode":"09-04","member_number":"A85584","first_name":"CHARLES","last_name":"YEAGER","classification":"B","division":"PCC","hit_factor":10.2041},{"match_name":"RSPP 3rd Saturday January 2018","match_date":"2018-01-20","stage_classifiercode":"09-04","member_number":"\"\"","first_name":"TRAVIS","last_name":"MCCAMISH","classification":"M","division":"PCC","hit_factor":10.1983},{"match_name":"LCSC Linden USPSA 112518 with Shooting for Glory","match_date":"2018-11-25","stage_classifiercode":"09-04","member_number":"Ty88773","first_name":"EPHRAIM","last_name":"SAN FELIPE","classification":"B","division":"PCC","hit_factor":10.1911},{"match_name":"LPRGC - Lower Providence USPSA August 2018","match_date":"2018-08-04","stage_classifiercode":"09-04","member_number":"TY85668","first_name":"SCOTT","last_name":"APPOLDT","classification":"M","division":"PCC","hit_factor":10.1796},{"match_name":"WELD ECO09 20180415","match_date":"2018-04-15","stage_classifiercode":"09-04","member_number":"\"\"","first_name":"ANDERS","last_name":"ALBERTSSON","classification":"U","division":"PCC","hit_factor":10.1796},{"match_name":"SAGC CTX04 Monthly USPSA Match - October 2020","match_date":"2020-10-25","stage_classifiercode":"09-04","member_number":"A117289","first_name":"ERNEST","last_name":"GARZA","classification":"C","division":"PCC","hit_factor":10.1796},{"match_name":"Dawg Valley USPSA April 14 2018","match_date":"2018-04-14","stage_classifiercode":"09-04","member_number":"A57378","first_name":"RYAN","last_name":"ZAMBERLAN","classification":"\"\"","division":"PCC","hit_factor":10.1587},{"match_name":"PCWC USPSA  6 23 2018","match_date":"2018-06-23","stage_classifiercode":"09-04","member_number":"A93396","first_name":"MICHAEL","last_name":"COSTLEY","classification":"B","division":"PCC","hit_factor":10.1587},{"match_name":"MISS USPSA 5-30-18","match_date":"2018-05-30","stage_classifiercode":"09-04","member_number":"A89163","first_name":"MARTY","last_name":"SCHANER","classification":"C","division":"PCC","hit_factor":10.1493},{"match_name":"RangeMasters 3-29-18","match_date":"2018-03-29","stage_classifiercode":"09-04","member_number":"A87497","first_name":"ERIC","last_name":"CASTILLO","classification":"M","division":"PCC","hit_factor":10.1493},{"match_name":"Hallstead USPSA July 24th","match_date":"2021-07-24","stage_classifiercode":"09-04","member_number":"TY-23199","first_name":"DAN","last_name":"VAILLANCOURT","classification":"U","division":"PCC","hit_factor":10.1493},{"match_name":" 2018 \"","match_date":"2018-07-21","stage_classifiercode":"09-04","member_number":"A99001","first_name":"MATT","last_name":"SPANNAN","classification":"U","division":"PCC","hit_factor":10.1493},{"match_name":"ARPC USPSA Match 11-25-18","match_date":"2018-11-25","stage_classifiercode":"09-04","member_number":"TY56427","first_name":"STEVE","last_name":"ROESCH","classification":"B","division":"PCC","hit_factor":10.1266},{"match_name":"LPRGC - Lower Providence USPSA August 2018","match_date":"2018-08-04","stage_classifiercode":"09-04","member_number":"\"\"","first_name":"JOSE","last_name":"SOUSA","classification":"A","division":"PCC","hit_factor":10.1266},{"match_name":"Brazosland Pistoleros USPSA - Sunday September 12th","match_date":"2021-09-12","stage_classifiercode":"09-04","member_number":"A81745","first_name":"AJ","last_name":"JACKSON","classification":"A","division":"PCC","hit_factor":10.119},{"match_name":"CAPS 7-22-2017","match_date":"2017-07-22","stage_classifiercode":"09-04","member_number":"TY47118","first_name":"RUSS","last_name":"REEDER","classification":"A","division":"PCC","hit_factor":10.1124},{"match_name":"Taxman Special ORSA USPSA 21 Apr 2018","match_date":"2018-04-21","stage_classifiercode":"09-04","member_number":"TY70657","first_name":"DAVID","last_name":"PEREZ","classification":"C","division":"PCC","hit_factor":10.089},{"match_name":"Grandbaggers December 2017","match_date":"2017-12-07","stage_classifiercode":"09-04","member_number":"A48182","first_name":"RICH","last_name":"HIGGINS","classification":"B","division":"PCC","hit_factor":10.089},{"match_name":"Uspsa Classifier","match_date":"2018-05-06","stage_classifiercode":"09-04","member_number":"F99888","first_name":"KANG","last_name":"LEE","classification":"U","division":"PCC","hit_factor":10.084},{"match_name":"Medford USPSA  June 2020","match_date":"2020-06-21","stage_classifiercode":"09-04","member_number":"A115354","first_name":"CHRISTINE","last_name":"KODYSZ","classification":"B","division":"PCC","hit_factor":10.084},{"match_name":"Oh Shoot-PRG  May 2nd - 1st Sunday Match","match_date":"2021-05-02","stage_classifiercode":"09-04","member_number":"A2581","first_name":"ROSS","last_name":"DEANE","classification":"M","division":"PCC","hit_factor":10.0671},{"match_name":"ARPC USPSA Match 11-29-20","match_date":"2020-11-29","stage_classifiercode":"09-04","member_number":"TY89183","first_name":"STEVE","last_name":"CASH","classification":"A","division":"PCC","hit_factor":10.0629},{"match_name":"RangeMasters 3-29-18","match_date":"2018-03-29","stage_classifiercode":"09-04","member_number":"\"\"","first_name":"BILL","last_name":"MURRAY","classification":"M","division":"PCC","hit_factor":10.0592},{"match_name":"Bayou City USPSA Weekly June 28","match_date":"2018-06-28","stage_classifiercode":"09-04","member_number":"A92443","first_name":"RAY","last_name":"FISHEL","classification":"U","division":"PCC","hit_factor":10.0559},{"match_name":"PRG-USPSA - Oh Shoot November 15th - 3rd Sunday","match_date":"2020-11-15","stage_classifiercode":"09-04","member_number":"TY127703","first_name":"MARC","last_name":"MAGLINTE","classification":"C","division":"PCC","hit_factor":10.0334},{"match_name":"Chillicothe April-2017 USPSA Match","match_date":"2017-04-23","stage_classifiercode":"09-04","member_number":"TY72670","first_name":"DALE","last_name":"HARDING","classification":"C","division":"PCC","hit_factor":10.0313},{"match_name":"CGC 10-14-2017","match_date":"2017-10-14","stage_classifiercode":"09-04","member_number":"TY57617","first_name":"ERIC","last_name":"DAVIS","classification":"B","division":"PCC","hit_factor":10},{"match_name":"PCSI USPSA July 3rd 2021 Patriot Match READ DESCRIPTION","match_date":"2021-07-03","stage_classifiercode":"09-04","member_number":"A118978","first_name":"DAN","last_name":"GLENN","classification":"A","division":"PCC","hit_factor":10},{"match_name":"FLSC February Classifier Match","match_date":"2017-02-04","stage_classifiercode":"09-04","member_number":"A90179","first_name":"MICHAEL","last_name":"HALL","classification":"A","division":"PCC","hit_factor":10},{"match_name":"EWPSA  2018-02","match_date":"2018-02-18","stage_classifiercode":"09-04","member_number":"TY82326","first_name":"WARREN","last_name":"HARPER","classification":"B","division":"PCC","hit_factor":10},{"match_name":"H&H July Match","match_date":"2017-07-23","stage_classifiercode":"09-04","member_number":"A84245","first_name":"BRYAN","last_name":"HOOVER","classification":"B","division":"PCC","hit_factor":10},{"match_name":"SSPSC USPSA  June 6-7 2020","match_date":"2020-06-04","stage_classifiercode":"09-04","member_number":"L2702","first_name":"MATT","last_name":"LAMPH","classification":"","division":"PCC","hit_factor":10},{"match_name":"Applied IN25 USPSA April 2017","match_date":"2017-04-26","stage_classifiercode":"09-04","member_number":"TY86867","first_name":"ANDREW","last_name":"HEATH","classification":"A","division":"PCC","hit_factor":10},{"match_name":"SWGC USPSA Pistol Match - March 2021","match_date":"2021-03-06","stage_classifiercode":"09-04","member_number":"A93396","first_name":"MICHAEL","last_name":"COSTLEY","classification":"A","division":"PCC","hit_factor":9.9707},{"match_name":"ORPCI 2018.03.31 USPSA Special","match_date":"2018-03-31","stage_classifiercode":"09-04","member_number":"FY43270","first_name":"MIKE","last_name":"DAME","classification":"\"\"","division":"PCC","hit_factor":9.9707},{"match_name":"WGC WI USPSA Monthly Match 4-21-18","match_date":"2018-04-21","stage_classifiercode":"09-04","member_number":"A104067","first_name":"ZACH","last_name":"LEAVENS","classification":"C","division":"PCC","hit_factor":9.9688},{"match_name":"ORSA USPSA Dogs Days Of Summer August 2018","match_date":"2018-08-17","stage_classifiercode":"09-04","member_number":"A100234","first_name":"TONY","last_name":"MARTIN","classification":"M","division":"PCC","hit_factor":9.9688},{"match_name":"WAC February(4th Sunday) - USPSA 6 Classifier Match","match_date":"2020-02-23","stage_classifiercode":"09-04","member_number":"Ty115775","first_name":"TOM","last_name":"LARSON","classification":"C","division":"PCC","hit_factor":9.9668},{"match_name":"WGC WI USPSA Monthly Match 4-21-18","match_date":"2018-04-21","stage_classifiercode":"09-04","member_number":"FY63847","first_name":"JOHN","last_name":"FAVREAU","classification":"B","division":"PCC","hit_factor":9.9668},{"match_name":"Lenny Magill's Glockstore Nashville Indoor Level One USPSA NOVEMBER 13 2021 11\\13\\2021","match_date":"2021-11-12","stage_classifiercode":"09-04","member_number":"A133963","first_name":"DON","last_name":"BARNES","classification":"B","division":"PCC","hit_factor":9.9476},{"match_name":"Brazosland Pistoleros USPSA - Sunday September 12th","match_date":"2021-09-12","stage_classifiercode":"09-04","member_number":"FY2227","first_name":"TOMMY","last_name":"TEAS","classification":"C","division":"PCC","hit_factor":9.9448},{"match_name":"Competitive Shooters of Lake Norman CORNELIUS Thursday Evening Indoor USPSA Pistol Match North Carolina","match_date":"2021-07-01","stage_classifiercode":"09-04","member_number":"TY106507","first_name":"KEITH","last_name":"NAGELSKI","classification":"B","division":"PCC","hit_factor":9.9415},{"match_name":"5 Dogs September 2016 USPSA","match_date":"2016-09-04","stage_classifiercode":"09-04","member_number":"L3810","first_name":"ERIC","last_name":"BERG","classification":"U","division":"PCC","hit_factor":9.9379},{"match_name":"Bossier Parish Practical Shooters June 13 2020","match_date":"2020-06-13","stage_classifiercode":"09-04","member_number":"TY103814","first_name":"BRANDON","last_name":"MCCARTNEY","classification":"U","division":"PCC","hit_factor":9.9125},{"match_name":"Taxman Special ORSA USPSA 21 Apr 2018","match_date":"2018-04-21","stage_classifiercode":"09-04","member_number":"A101972","first_name":"KENNETH","last_name":"MESSER","classification":"B","division":"PCC","hit_factor":9.9071},{"match_name":"HPPS 6-19-2021","match_date":"2021-06-19","stage_classifiercode":"09-04","member_number":"TY96577","first_name":"JAMES","last_name":"DOMENICO","classification":"A","division":"PCC","hit_factor":9.8901},{"match_name":"Applied IN25 USPSA April Classifier 2018","match_date":"2018-04-17","stage_classifiercode":"09-04","member_number":"a78635","first_name":"ROB","last_name":"MCGUIRE","classification":"A","division":"PCC","hit_factor":9.8765},{"match_name":"RSPP 3rd Saturday January 2017","match_date":"2017-01-21","stage_classifiercode":"09-04","member_number":"L3678","first_name":"RICHARD","last_name":"BHELLA","classification":"U","division":"PCC","hit_factor":9.8701},{"match_name":"NAAS 2018-04-15","match_date":"2018-04-15","stage_classifiercode":"09-04","member_number":"A107729","first_name":"BOBBY","last_name":"DONNELLY","classification":"U","division":"PCC","hit_factor":9.863},{"match_name":"Maine Practical Shooters November 2018","match_date":"2018-11-18","stage_classifiercode":"09-04","member_number":"A54089","first_name":"STEPHEN","last_name":"BADE","classification":"B","division":"PCC","hit_factor":9.863},{"match_name":"YMM IPSC02 2017_11_12","match_date":"2017-11-12","stage_classifiercode":"09-04","member_number":"TY43564","first_name":"BRIAN","last_name":"WILLIAMSON","classification":"G","division":"PCC","hit_factor":9.8485},{"match_name":"B&R USPSA 6","match_date":"2018-06-30","stage_classifiercode":"09-04","member_number":"a112108","first_name":"ED","last_name":"MCCAMISH","classification":"U","division":"PCC","hit_factor":9.8446},{"match_name":"WGC USPSA Special Classifier 4-17-2021","match_date":"2021-04-17","stage_classifiercode":"09-04","member_number":"A130367","first_name":"DAVE","last_name":"JACKLEY","classification":"U","division":"PCC","hit_factor":9.8361},{"match_name":"Prescott Action Shooters 1st Saturday USPSA 5-01-21","match_date":"2021-05-01","stage_classifiercode":"09-04","member_number":"L4851","first_name":"BEN","last_name":"KREUTZBERG","classification":"M","division":"PCC","hit_factor":9.8266},{"match_name":"Applied IN25 USPSA October 2017 Classifier","match_date":"2017-10-18","stage_classifiercode":"09-04","member_number":"TY90274","first_name":"MICHAEL","last_name":"CONROY","classification":"U","division":"PCC","hit_factor":9.8191},{"match_name":"CSA Annual Classifier Classic","match_date":"2018-03-18","stage_classifiercode":"09-04","member_number":"A109352","first_name":"NICK","last_name":"MCDONALD","classification":"U","division":"PCC","hit_factor":9.816},{"match_name":"Brazosland Pistoleros August 20 2017","match_date":"2017-08-20","stage_classifiercode":"09-04","member_number":"A65587","first_name":"AARON","last_name":"VEZORAK","classification":"U","division":"PCC","hit_factor":9.816},{"match_name":"Taxman Special ORSA USPSA 21 Apr 2018","match_date":"2018-04-21","stage_classifiercode":"09-04","member_number":"TY92055","first_name":"BRYAN","last_name":"KISER","classification":"B","division":"PCC","hit_factor":9.7983},{"match_name":"Chillicothe April-2017 USPSA Match","match_date":"2017-04-23","stage_classifiercode":"09-04","member_number":"L3332","first_name":"KYLE","last_name":"GLEASON","classification":"B","division":"PCC","hit_factor":9.7983},{"match_name":"HSA USPSA January 2020","match_date":"2020-01-08","stage_classifiercode":"09-04","member_number":"TY97411","first_name":"JOE","last_name":"VELAZQUEZ","classification":"B","division":"PCC","hit_factor":9.7983},{"match_name":"GAS MAY 2020 USPSA SLOT MATCH","match_date":"2020-05-02","stage_classifiercode":"09-04","member_number":"A111990","first_name":"MASON","last_name":"ZIER","classification":"A","division":"PCC","hit_factor":9.7701},{"match_name":"Bossier Parish Practical Shooters June 13 2020","match_date":"2020-06-13","stage_classifiercode":"09-04","member_number":"L4553","first_name":"MIKE","last_name":"PIPES","classification":"B","division":"PCC","hit_factor":9.7701},{"match_name":"NAAS 2017-10-15","match_date":"2017-10-15","stage_classifiercode":"09-04","member_number":"\"\"","first_name":"HARLEY","last_name":"WIEGERT","classification":"U","division":"PCC","hit_factor":9.7421},{"match_name":"Brazosland Pistoleros USPSA - Sunday September 12th","match_date":"2021-09-12","stage_classifiercode":"09-04","member_number":"FY129638","first_name":"KEVIN","last_name":"COATS","classification":"U","division":"PCC","hit_factor":9.7421},{"match_name":"NCPS USPSA Handgun Match July 22 2018a","match_date":"2018-07-22","stage_classifiercode":"09-04","member_number":"TY88318","first_name":"MIKE","last_name":"HALL","classification":"A","division":"PCC","hit_factor":9.7297},{"match_name":"RSPP 3rd Saturday January 2017","match_date":"2017-01-21","stage_classifiercode":"09-04","member_number":"TY46992","first_name":"RON","last_name":"ASCHENBACH","classification":"U","division":"PCC","hit_factor":9.7297},{"match_name":"FAS Sunday USPSA","match_date":"2018-12-02","stage_classifiercode":"09-04","member_number":"A112345","first_name":"ZACHARY","last_name":"MCLAUGHLIN","classification":"B","division":"PCC","hit_factor":9.7297},{"match_name":"SAGC CTX04 Monthly USPSA Match - October 2018","match_date":"2018-10-28","stage_classifiercode":"09-04","member_number":"L2181","first_name":"DALE","last_name":"ALCORN","classification":"A","division":"PCC","hit_factor":9.7222},{"match_name":"PCSI USPSA July 3rd 2021 Patriot Match READ DESCRIPTION","match_date":"2021-07-03","stage_classifiercode":"09-04","member_number":"A52646","first_name":"JEFF","last_name":"FERGUSON","classification":"M","division":"PCC","hit_factor":9.6774},{"match_name":"MSSA Uspsa Club Match","match_date":"2017-09-09","stage_classifiercode":"09-04","member_number":"L843","first_name":"LYNN","last_name":"JONES","classification":"A","division":"PCC","hit_factor":9.6774},{"match_name":"Richmond Hot Shots 2018 USPSA Special Classifier Match - Jan 28 2018","match_date":"2018-01-28","stage_classifiercode":"09-04","member_number":"FY59179","first_name":"DAVE","last_name":"BUNN","classification":"C","division":"PCC","hit_factor":9.6692},{"match_name":"LRC USPSA October 2020","match_date":"2020-10-03","stage_classifiercode":"09-04","member_number":"TY101811","first_name":"BRENT","last_name":"VETOVITZ","classification":"B","division":"PCC","hit_factor":9.6677},{"match_name":"Maine Pracrical Shooters-July 2017 USPSA","match_date":"2017-07-09","stage_classifiercode":"09-04","member_number":"A54089","first_name":"STEPHEN","last_name":"BADE","classification":"B","division":"PCC","hit_factor":9.6463},{"match_name":"Sharp Practical Shooters March USPSA Match","match_date":"2018-03-25","stage_classifiercode":"09-04","member_number":"A84525","first_name":"KEVIN","last_name":"VAUGHN","classification":"A","division":"PCC","hit_factor":9.6447},{"match_name":"Applied IN25 USPSA October 2017 Classifier","match_date":"2017-10-18","stage_classifiercode":"09-04","member_number":"L4004","first_name":"AARON","last_name":"LORTON","classification":"B","division":"PCC","hit_factor":9.6257},{"match_name":"IPSC93 September 2020","match_date":"2020-09-28","stage_classifiercode":"09-04","member_number":"TY51119","first_name":"CHRIS","last_name":"MOLNAR","classification":"B","division":"PCC","hit_factor":9.6096},{"match_name":"TBAS USPSA Match 2/23/20","match_date":"2020-02-23","stage_classifiercode":"09-04","member_number":"TY88333","first_name":"JACK","last_name":"DOUTHIT","classification":"","division":"PCC","hit_factor":9.6096},{"match_name":"Springfield Tactical Shooters 03/04/2021","match_date":"2021-03-04","stage_classifiercode":"09-04","member_number":"FY83614","first_name":"GARY","last_name":"GRAY","classification":"B","division":"PCC","hit_factor":9.6045},{"match_name":"YMM IPSC02 2017_11_12","match_date":"2017-11-12","stage_classifiercode":"09-04","member_number":"A87721","first_name":"JAMES","last_name":"TAWZER","classification":"C","division":"PCC","hit_factor":9.6},{"match_name":"USPSA MO21 2Alpha SBRC October 2016","match_date":"2016-10-22","stage_classifiercode":"09-04","member_number":"A14123","first_name":"BRIAN","last_name":"PAYNE","classification":"U","division":"PCC","hit_factor":9.6},{"match_name":"Taxman Special ORSA USPSA 21 Apr 2018","match_date":"2018-04-21","stage_classifiercode":"09-04","member_number":"TY62447","first_name":"ADRIAN","last_name":"COBB","classification":"A","division":"PCC","hit_factor":9.5808},{"match_name":"Brazosland Pistoleros August 20 2017","match_date":"2017-08-20","stage_classifiercode":"09-04","member_number":"A81359","first_name":"LAN","last_name":"NGUYEN","classification":"U","division":"PCC","hit_factor":9.5745},{"match_name":"Grandbaggers December 2017","match_date":"2017-12-07","stage_classifiercode":"09-04","member_number":"TY85822","first_name":"MATT","last_name":"WERNER","classification":"B","division":"PCC","hit_factor":9.5745},{"match_name":"Emmett November Match","match_date":"2018-11-24","stage_classifiercode":"09-04","member_number":"Ty94890","first_name":"CHRIS","last_name":"CLARK","classification":"M","division":"PCC","hit_factor":9.5541},{"match_name":"Devil Dog USPSA Classifier Match-Saturday Session","match_date":"2018-03-10","stage_classifiercode":"09-04","member_number":"TY64132","first_name":"MIKE","last_name":"KERR","classification":"B","division":"PCC","hit_factor":9.5522},{"match_name":"NAAS 08-19-2018","match_date":"2018-08-19","stage_classifiercode":"09-04","member_number":"A97112","first_name":"BRETT","last_name":"TYLER","classification":"A","division":"PCC","hit_factor":9.5506},{"match_name":"Coyote USPSA  Classifier Match 8-22-17","match_date":"2017-08-23","stage_classifiercode":"09-04","member_number":"a99858","first_name":"AARON","last_name":"MEZA","classification":"\"\"","division":"PCC","hit_factor":9.5506},{"match_name":"Uspsa Classifier","match_date":"2018-05-06","stage_classifiercode":"09-04","member_number":"TYF-7687","first_name":"ROD","last_name":"DICKENS","classification":"U","division":"PCC","hit_factor":9.5506},{"match_name":"GPSL 7-11-2017","match_date":"2017-07-11","stage_classifiercode":"09-04","member_number":"A87318","first_name":"DAVID","last_name":"DOWDAKIN","classification":"U","division":"PCC","hit_factor":9.5238},{"match_name":"Lenny Magill's Glockstore Nashville Indoor Level One USPSA NOVEMBER 13 2021 11\\13\\2021","match_date":"2021-11-12","stage_classifiercode":"09-04","member_number":"A127606","first_name":"HERNAN","last_name":"DELGADO","classification":"M","division":"PCC","hit_factor":9.5238},{"match_name":"Applied IN25 USPSA October 2017 Classifier","match_date":"2017-10-18","stage_classifiercode":"09-04","member_number":"a-78635","first_name":"ROB","last_name":"MCGUIRE","classification":"U","division":"PCC","hit_factor":9.5238},{"match_name":"Parabellum USPSA Jan 25 2017","match_date":"2017-01-25","stage_classifiercode":"09-04","member_number":"TY86867","first_name":"ANDREW","last_name":"HEATH","classification":"A","division":"PCC","hit_factor":9.5238},{"match_name":"OREGON ARPC CC05 USPSA - Classifier Match - APR 10 2021","match_date":"2021-04-10","stage_classifiercode":"09-04","member_number":"A121896","first_name":"KYLE","last_name":"JAMESON","classification":"U","division":"PCC","hit_factor":9.5238},{"match_name":"NW01 March Madness 17","match_date":"2017-03-12","stage_classifiercode":"09-04","member_number":"TY37515","first_name":"TOD","last_name":"SHERMAN","classification":"B","division":"PCC","hit_factor":9.5238},{"match_name":"ECO15 USPSA  3/10/2018","match_date":"2018-03-09","stage_classifiercode":"09-04","member_number":"ty90095","first_name":"BRETT","last_name":"LOHMAN","classification":"U","division":"PCC","hit_factor":9.4972},{"match_name":"WGC USPSA Special Classifier 4-17-2021","match_date":"2021-04-17","stage_classifiercode":"09-04","member_number":"L4974","first_name":"BECKY","last_name":"YACKLEY","classification":"U","division":"PCC","hit_factor":9.4972},{"match_name":"Yakima YRPA January Indoor classifier 2017","match_date":"2017-01-29","stage_classifiercode":"09-04","member_number":"L3269","first_name":"BRIAN","last_name":"HUMANN","classification":"U","division":"PCC","hit_factor":9.4972},{"match_name":"COPS Dec 2016 USPSA Match","match_date":"2016-12-04","stage_classifiercode":"09-04","member_number":"A60217","first_name":"GARY","last_name":"SANDERS","classification":"U","division":"PCC","hit_factor":9.4955},{"match_name":"SWGC USPSA Pistol Match - March 2021","match_date":"2021-03-06","stage_classifiercode":"09-04","member_number":"TY98245","first_name":"MIKE","last_name":"SHARRETT","classification":"B","division":"PCC","hit_factor":9.4737},{"match_name":"WPGC 12-5-16","match_date":"2016-12-04","stage_classifiercode":"09-04","member_number":"TY81628","first_name":"CLAY","last_name":"TURNER","classification":"A","division":"PCC","hit_factor":9.4737},{"match_name":"TPS USPSA at CMP July 21 2018","match_date":"2018-07-21","stage_classifiercode":"09-04","member_number":"A25385","first_name":"MARK","last_name":"STAMPER","classification":"B","division":"PCC","hit_factor":9.4675},{"match_name":"PRG-USPSA - Oh Shoot November 15th - 3rd Sunday","match_date":"2020-11-15","stage_classifiercode":"09-04","member_number":"A2581","first_name":"ROSS","last_name":"DEANE","classification":"M","division":"PCC","hit_factor":9.4637},{"match_name":"Rio Salado UPPL June 2020","match_date":"2020-06-14","stage_classifiercode":"09-04","member_number":"TY22721","first_name":"WAYDE","last_name":"SHIMODA","classification":"A","division":"PCC","hit_factor":9.4488},{"match_name":"H&H July Match","match_date":"2017-07-23","stage_classifiercode":"09-04","member_number":"TY69238","first_name":"TONY","last_name":"WALL","classification":"A","division":"PCC","hit_factor":9.4276},{"match_name":"BORCC USPSA March 2018 Classifier Match","match_date":"2018-03-24","stage_classifiercode":"09-04","member_number":"L3378","first_name":"CHRISTOPHER","last_name":"GILSON","classification":"A","division":"PCC","hit_factor":9.4241},{"match_name":"Blue Ridge Arsenal Nov 8 All Classifier match","match_date":"2018-11-08","stage_classifiercode":"09-04","member_number":"TY92038","first_name":"AJ","last_name":"SAULLS","classification":"U","division":"PCC","hit_factor":9.4183},{"match_name":"Palmetto Gun Club - February 2018 USPSA","match_date":"2018-02-03","stage_classifiercode":"09-04","member_number":"A69787","first_name":"SHANE","last_name":"COX","classification":"A","division":"PCC","hit_factor":9.4118},{"match_name":"OREGON ARPC CC05 USPSA APRIL 8 2017","match_date":"2017-04-08","stage_classifiercode":"09-04","member_number":"TY53715","first_name":"DAN","last_name":"ORME","classification":"U","division":"PCC","hit_factor":9.375},{"match_name":"July 27 2016 A Zone","match_date":"2016-07-27","stage_classifiercode":"09-04","member_number":"A9640","first_name":"KARL","last_name":"REHN","classification":"U","division":"PCC","hit_factor":9.375},{"match_name":"CFL07 WILLISTON PRACTICAL SHOOTERS CLUB","match_date":"2018-05-05","stage_classifiercode":"09-04","member_number":"A58143","first_name":"WAYNE","last_name":"ACKETT","classification":"U","division":"PCC","hit_factor":9.375},{"match_name":"RSPP 3rd Saturday August 2018","match_date":"2018-08-18","stage_classifiercode":"09-04","member_number":"TY87182","first_name":"MILTON","last_name":"MEANS","classification":"B","division":"PCC","hit_factor":9.3567},{"match_name":"SAPS Match 5/15/2021","match_date":"2021-05-15","stage_classifiercode":"09-04","member_number":"L4455","first_name":"KEVIN","last_name":"LAMB","classification":"G","division":"PCC","hit_factor":9.3458},{"match_name":"SAPS Match 5/15/2021","match_date":"2021-05-15","stage_classifiercode":"09-04","member_number":"FY65434","first_name":"GABE","last_name":"CARMEN","classification":"A","division":"PCC","hit_factor":9.3294},{"match_name":"USPSA MO19 Lamar Mar 25 2028","match_date":"2018-03-25","stage_classifiercode":"09-04","member_number":"TY48907","first_name":"DAVID","last_name":"LETSCH","classification":"A","division":"PCC","hit_factor":9.3023},{"match_name":"CGC CTX02 Monthly USPSA Match - July 2021","match_date":"2021-07-18","stage_classifiercode":"09-04","member_number":"L2181","first_name":"DALE","last_name":"ALCORN","classification":"A","division":"PCC","hit_factor":9.3023},{"match_name":"LCSC Linden USPSA 112518 with Shooting for Glory","match_date":"2018-11-25","stage_classifiercode":"09-04","member_number":"L4510","first_name":"ERIC","last_name":"GAO","classification":"U","division":"PCC","hit_factor":9.2896},{"match_name":"Hawkeye Feb Match","match_date":"2017-02-18","stage_classifiercode":"09-04","member_number":"A87032","first_name":"TRE","last_name":"ROACH","classification":"B","division":"PCC","hit_factor":9.2896},{"match_name":"Renton USPSA April 2017","match_date":"2017-04-23","stage_classifiercode":"09-04","member_number":"ty53715","first_name":"DAN","last_name":"ORME","classification":"U","division":"PCC","hit_factor":9.2879},{"match_name":"PPPS 10-8-17","match_date":"2017-10-08","stage_classifiercode":"09-04","member_number":"L2598","first_name":"HOSER","last_name":"FREEMAN","classification":"\"\"","division":"PCC","hit_factor":9.2715},{"match_name":"BMPSA Feb 17 2018","match_date":"2018-02-17","stage_classifiercode":"09-04","member_number":"A74760","first_name":"JAMES","last_name":"KIBBE","classification":"U","division":"PCC","hit_factor":9.2715},{"match_name":"Chillicothe April-2017 USPSA Match","match_date":"2017-04-23","stage_classifiercode":"09-04","member_number":"TY76261","first_name":"DAN","last_name":"LONG","classification":"B","division":"PCC","hit_factor":9.2683},{"match_name":"ORPCI 2018.03.31 USPSA Special","match_date":"2018-03-31","stage_classifiercode":"09-04","member_number":"A77176","first_name":"DON","last_name":"O'BRADOVICH","classification":"G","division":"PCC","hit_factor":9.2664},{"match_name":"Lin","match_date":"2017-06-10","stage_classifiercode":"09-04","member_number":"\"\"","first_name":"DONNIE","last_name":"SMITH","classification":"A","division":"PCC","hit_factor":9.2643},{"match_name":"APSC USPSA 09-18-21","match_date":"2021-09-18","stage_classifiercode":"09-04","member_number":"TY70687","first_name":"ROMMEL","last_name":"MERCADO","classification":"A","division":"PCC","hit_factor":9.2308},{"match_name":"CASA   USPSA  Dec 2018","match_date":"2018-12-01","stage_classifiercode":"09-04","member_number":"A82964","first_name":"EDWARD","last_name":"EMRICH","classification":"B","division":"PCC","hit_factor":9.2233},{"match_name":"APSC USPSA 10-06-18","match_date":"2018-10-06","stage_classifiercode":"09-04","member_number":"\"\"","first_name":"TOM","last_name":"HEMKER","classification":"A","division":"PCC","hit_factor":9.2105},{"match_name":"RPGi USPSA Last Minute Match 29 May 2021","match_date":"2021-05-29","stage_classifiercode":"09-04","member_number":"TY101981","first_name":"THANA","last_name":"CHAITHA","classification":"B","division":"PCC","hit_factor":9.1954},{"match_name":"Alpha Mike  Oct 2016","match_date":"2016-10-16","stage_classifiercode":"09-04","member_number":"A45036","first_name":"MARIAN","last_name":"KUPCZYNSKI","classification":"U","division":"PCC","hit_factor":9.1892},{"match_name":"Oakdale USPSA MN07 7-30-2020","match_date":"2020-07-30","stage_classifiercode":"09-04","member_number":"L4062","first_name":"KEN","last_name":"SPOONER","classification":"B","division":"PCC","hit_factor":9.1837},{"match_name":"SAGC CTX04 Monthly USPSA Match - October 2018","match_date":"2018-10-28","stage_classifiercode":"09-04","member_number":"A89593","first_name":"GARY","last_name":"DICKERSON","classification":"U","division":"PCC","hit_factor":9.1803},{"match_name":"EHPSA USPSA 26 August 2018","match_date":"2018-08-26","stage_classifiercode":"09-04","member_number":"TY84357","first_name":"RAY","last_name":"DONCH","classification":"C","division":"PCC","hit_factor":9.1691},{"match_name":"DRRC USPSA Aug2018","match_date":"2018-08-04","stage_classifiercode":"09-04","member_number":"TY80149","first_name":"JIM","last_name":"BOONE","classification":"A","division":"PCC","hit_factor":9.1691},{"match_name":"PCGC USPSA July 2018","match_date":"2018-07-22","stage_classifiercode":"09-04","member_number":"TY8880","first_name":"GENE","last_name":"RICHMOND","classification":"B","division":"PCC","hit_factor":9.1644},{"match_name":"PPPS 10-8-17","match_date":"2017-10-08","stage_classifiercode":"09-04","member_number":"A73532","first_name":"STEPHEN","last_name":"CASH","classification":"C","division":"PCC","hit_factor":9.1429},{"match_name":"Chillicothe April-2017 USPSA Match","match_date":"2017-04-23","stage_classifiercode":"09-04","member_number":"FY47125","first_name":"KEVIN","last_name":"MONK","classification":"C","division":"PCC","hit_factor":9.1429},{"match_name":"OREGON ARPC CC05 USPSA - Classifier Match - APR 10 2021","match_date":"2021-04-10","stage_classifiercode":"09-04","member_number":"A121272","first_name":"MICHAEL","last_name":"HENRY","classification":"B","division":"PCC","hit_factor":9.1429},{"match_name":"Crooked Creek Pistol League - July 2017","match_date":"2017-07-22","stage_classifiercode":"09-04","member_number":"L3860","first_name":"DAVID","last_name":"SNETHKAMP","classification":"U","division":"PCC","hit_factor":9.1398},{"match_name":"RSPP 3rd Saturday January 2017","match_date":"2017-01-21","stage_classifiercode":"09-04","member_number":"FY24902","first_name":"KEVIN","last_name":"LAMB","classification":"A","division":"PCC","hit_factor":9.1153},{"match_name":"HRRB 12-01-2018","match_date":"2018-12-01","stage_classifiercode":"09-04","member_number":"A104329","first_name":"DAVID","last_name":"KIKUKAWA","classification":"M","division":"PCC","hit_factor":9.1139},{"match_name":"Brazosland Pistoleros August 20 2017","match_date":"2017-08-20","stage_classifiercode":"09-04","member_number":"A2369","first_name":"SCOTT","last_name":"YORK","classification":"U","division":"PCC","hit_factor":9.0909},{"match_name":"TBAS USPSA Match 2/21/21","match_date":"2021-02-21","stage_classifiercode":"09-04","member_number":"A111791","first_name":"JOHN","last_name":"DANIELSON","classification":"","division":"PCC","hit_factor":9.0909},{"match_name":"USPSA MO21 2Alpha SBRC October 2016","match_date":"2016-10-22","stage_classifiercode":"09-04","member_number":"TY48907","first_name":"DAVID","last_name":"LETSCH","classification":"U","division":"PCC","hit_factor":9.0909},{"match_name":"RCPS USPSA October 13","match_date":"2018-10-13","stage_classifiercode":"09-04","member_number":"TY26587","first_name":"MARK","last_name":"RUSCHAK","classification":"M","division":"PCC","hit_factor":9.068},{"match_name":"Springfield Tactical Shooters 03/04/2021","match_date":"2021-03-04","stage_classifiercode":"09-04","member_number":"\"\"","first_name":"AARON","last_name":"RENTSCHLER","classification":"\"\"","division":"PCC","hit_factor":9.0667},{"match_name":"DSS - USPSA - 21-07-24","match_date":"2021-07-24","stage_classifiercode":"09-04","member_number":"A112153","first_name":"DANIEL","last_name":"TOOTHMAN","classification":"B","division":"PCC","hit_factor":9.0652},{"match_name":"CGC CTX02 Monthly USPSA Match - July 2021","match_date":"2021-07-18","stage_classifiercode":"09-04","member_number":"fy96408","first_name":"LARRY","last_name":"ZIENTEK","classification":"U","division":"PCC","hit_factor":9.0634},{"match_name":"Castlewood USPSA Sept 2020 shoot","match_date":"2020-09-26","stage_classifiercode":"09-04","member_number":"Fy39111","first_name":"OLIE","last_name":"ERICKSEN","classification":"B","division":"PCC","hit_factor":9.0592},{"match_name":"AIPS  USPSA Weekly 25 July 2017","match_date":"2017-07-25","stage_classifiercode":"09-04","member_number":"A74374","first_name":"DOUG","last_name":"CATRON","classification":"B","division":"PCC","hit_factor":9.0592},{"match_name":"PCSI USPSA July 3rd 2021 Patriot Match READ DESCRIPTION","match_date":"2021-07-03","stage_classifiercode":"09-04","member_number":"A102072","first_name":"ANTHONY","last_name":"ZABONIK","classification":"M","division":"PCC","hit_factor":9.0476},{"match_name":"Lin","match_date":"2017-06-10","stage_classifiercode":"09-04","member_number":"\"\"","first_name":"DONNIE","last_name":"SMITH","classification":"A","division":"PCC","hit_factor":9.0452},{"match_name":"TCSC USPSA Level I June club match","match_date":"2021-06-26","stage_classifiercode":"09-04","member_number":"A120434","first_name":"KAREN","last_name":"ZEIGLER","classification":"C","division":"PCC","hit_factor":9.0452},{"match_name":"CGC CTX02 Monthly USPSA Match - July 2021","match_date":"2021-07-18","stage_classifiercode":"09-04","member_number":"L2484","first_name":"ALEX","last_name":"WAKAL","classification":"A","division":"PCC","hit_factor":9.0452},{"match_name":"Space Coast Practical Shooters","match_date":"2018-04-07","stage_classifiercode":"09-04","member_number":"Ty86380","first_name":"JOHN","last_name":"PENNELLA","classification":"A","division":"PCC","hit_factor":9.0426},{"match_name":"WGC June 2017 USPSA","match_date":"2017-06-11","stage_classifiercode":"09-04","member_number":"A72613","first_name":"DONNIE","last_name":"SMITH","classification":"U","division":"PCC","hit_factor":9.0426},{"match_name":"CASA   USPSA  Dec 2018","match_date":"2018-12-01","stage_classifiercode":"09-04","member_number":"A70740","first_name":"RYAN","last_name":"REED","classification":"A","division":"PCC","hit_factor":9.0395},{"match_name":"WPGC 12-5-16","match_date":"2016-12-04","stage_classifiercode":"09-04","member_number":"A86526","first_name":"DOUGLAS","last_name":"NORMAN","classification":"A","division":"PCC","hit_factor":9.0361},{"match_name":"GPS May 2018","match_date":"2018-05-20","stage_classifiercode":"09-04","member_number":"A91331","first_name":"DEREK","last_name":"RABUCK","classification":"C","division":"PCC","hit_factor":9.0278},{"match_name":"Palmetto Gun Club - February 2018 USPSA","match_date":"2018-02-03","stage_classifiercode":"09-04","member_number":"\"\"","first_name":"DEREK","last_name":"HICKS","classification":"U","division":"PCC","hit_factor":9.0226},{"match_name":"Grandbaggers October 2017","match_date":"2017-10-05","stage_classifiercode":"09-04","member_number":"FY95577","first_name":"MATTHEW","last_name":"KITZMILLER","classification":"U","division":"PCC","hit_factor":9.0186},{"match_name":"NW01 Mt  Rainier Shadow April 20th 2021 Match","match_date":"2021-04-21","stage_classifiercode":"09-04","member_number":"Fy89148","first_name":"DAVID","last_name":"DUPREE","classification":"B","division":"PCC","hit_factor":9.0186},{"match_name":"ORPCI 2018.03.31 USPSA Special","match_date":"2018-03-31","stage_classifiercode":"09-04","member_number":"TY109432","first_name":"MICKI","last_name":"PETKOVIC","classification":"X","division":"PCC","hit_factor":9.0141},{"match_name":"WAC February(4th Sunday) - USPSA 6 Classifier Match","match_date":"2020-02-23","stage_classifiercode":"09-04","member_number":"L3681","first_name":"JOHN","last_name":"BEACH","classification":"A","division":"PCC","hit_factor":8.9965},{"match_name":"Castlewood USPSA Sept 2020 shoot","match_date":"2020-09-26","stage_classifiercode":"09-04","member_number":"A110098","first_name":"ADAM","last_name":"KNOX","classification":"U","division":"PCC","hit_factor":8.9888},{"match_name":"USPSA MO21 2Alpha SBRC October 2016","match_date":"2016-10-22","stage_classifiercode":"09-04","member_number":"L1536","first_name":"CRAIG","last_name":"NORDGREN","classification":"U","division":"PCC","hit_factor":8.9888},{"match_name":"NAAS 08-19-2018","match_date":"2018-08-19","stage_classifiercode":"09-04","member_number":"A25385","first_name":"MARK","last_name":"STAMPER","classification":"B","division":"PCC","hit_factor":8.982},{"match_name":"CSA Annual Classifier Classic","match_date":"2018-03-18","stage_classifiercode":"09-04","member_number":"A92696","first_name":"BJ","last_name":"MILLER","classification":"D","division":"PCC","hit_factor":8.982},{"match_name":"ANPRACS USPSA 6-17-18","match_date":"2018-06-17","stage_classifiercode":"09-04","member_number":"TY85802","first_name":"JOHN","last_name":"CLER","classification":"C","division":"PCC","hit_factor":8.971},{"match_name":"OREGON ARPC CC05 USPSA - Classifier Match - APR 10 2021","match_date":"2021-04-10","stage_classifiercode":"09-04","member_number":"L4778","first_name":"TODD","last_name":"SCHLENKER","classification":"C","division":"PCC","hit_factor":8.9636},{"match_name":"Dawg Valley USPSA April 14 2018","match_date":"2018-04-14","stage_classifiercode":"09-04","member_number":"A98952","first_name":"KEVIN","last_name":"PATELLOS","classification":"\"\"","division":"PCC","hit_factor":8.9636},{"match_name":"Parabellum USPSA Jan 25 2017","match_date":"2017-01-25","stage_classifiercode":"09-04","member_number":"A52987","first_name":"JAKE","last_name":"MARTENS","classification":"A","division":"PCC","hit_factor":8.9474},{"match_name":"SWGC USPSA Pistol Match - March 2021","match_date":"2021-03-06","stage_classifiercode":"09-04","member_number":"TY78922","first_name":"DONALD","last_name":"ADAM","classification":"A","division":"PCC","hit_factor":8.9412},{"match_name":"WAC February(4th Sunday) - USPSA 6 Classifier Match","match_date":"2020-02-23","stage_classifiercode":"09-04","member_number":"TY107825","first_name":"RAPHAEL","last_name":"BALATBAT","classification":"A","division":"PCC","hit_factor":8.9385},{"match_name":"2018-06 Bone Creek USPSA","match_date":"2018-06-03","stage_classifiercode":"09-04","member_number":"A68778","first_name":"CHRIS","last_name":"FARRIS","classification":"B","division":"PCC","hit_factor":8.9286},{"match_name":"NTPS-SE January 2018","match_date":"2018-01-20","stage_classifiercode":"09-04","member_number":"TY79675","first_name":"HENRY","last_name":"AMBROSE","classification":"U","division":"PCC","hit_factor":8.9239},{"match_name":"CGC CTX02 Monthly USPSA Match - July 2021","match_date":"2021-07-18","stage_classifiercode":"09-04","member_number":"A117202","first_name":"STACEY","last_name":"CALDER","classification":"C","division":"PCC","hit_factor":8.9239},{"match_name":"Idaho ISPS September 1st 2018","match_date":"2018-09-01","stage_classifiercode":"09-04","member_number":"TY82305","first_name":"J ARLEN","last_name":"BATES","classification":"A","division":"PCC","hit_factor":8.9147},{"match_name":"USPSA MO19 Lamar September 2017 Special Classifier","match_date":"2017-09-24","stage_classifiercode":"09-04","member_number":"TY48907","first_name":"DAVID","last_name":"LETSCH","classification":"B","division":"PCC","hit_factor":8.9136},{"match_name":"CCPL 07082018","match_date":"2018-07-06","stage_classifiercode":"09-04","member_number":"TY87404","first_name":"MARIO","last_name":"RODRIGUEZ","classification":"U","division":"PCC","hit_factor":8.9109},{"match_name":"Bossier Parish Practical Shooters June 13 2020","match_date":"2020-06-13","stage_classifiercode":"09-04","member_number":"TY50568","first_name":"HARMON","last_name":"GREER","classification":"M","division":"PCC","hit_factor":8.9069},{"match_name":"PCGC October 2016","match_date":"2016-10-23","stage_classifiercode":"09-04","member_number":"A88347","first_name":"MATT","last_name":"BOWEN","classification":"B","division":"PCC","hit_factor":8.9021},{"match_name":"ANPRACS USPSA 1-19-20","match_date":"2020-01-19","stage_classifiercode":"09-04","member_number":"FY47478","first_name":"ALLEN","last_name":"CHAPMAN","classification":"A","division":"PCC","hit_factor":8.9005},{"match_name":"ANPRACS USPSA 6-17-18","match_date":"2018-06-17","stage_classifiercode":"09-04","member_number":"TY47478","first_name":"ALLEN","last_name":"CHAPMAN","classification":"B","division":"PCC","hit_factor":8.9005},{"match_name":"TBAS USPSA Match 2/23/20","match_date":"2020-02-23","stage_classifiercode":"09-04","member_number":"A116613","first_name":"TRAVIS","last_name":"GEDROSE","classification":"","division":"PCC","hit_factor":8.9005},{"match_name":"Yakima YRPA January Indoor classifier 2017","match_date":"2017-01-29","stage_classifiercode":"09-04","member_number":"A61872","first_name":"KURT","last_name":"BEARCHUM","classification":"U","division":"PCC","hit_factor":8.8773},{"match_name":"USPSA MO19 Lamar Mar 25 2028","match_date":"2018-03-25","stage_classifiercode":"09-04","member_number":"TY74180","first_name":"GIOVANNI","last_name":"BREDICE","classification":"U","division":"PCC","hit_factor":8.8757},{"match_name":"Bare Arms 10/20/2018","match_date":"2018-10-20","stage_classifiercode":"09-04","member_number":"\"\"","first_name":"KEVIN","last_name":"CHRISTIAN","classification":"\"\"","division":"PCC","hit_factor":8.8643},{"match_name":"NAAS 2018-04-15","match_date":"2018-04-15","stage_classifiercode":"09-04","member_number":"A97112","first_name":"BRETT","last_name":"TYLER","classification":"A","division":"PCC","hit_factor":8.8643},{"match_name":"USPSA 4","match_date":"2017-07-16","stage_classifiercode":"09-04","member_number":"TY28946","first_name":"KEVIN","last_name":"KING","classification":"U","division":"PCC","hit_factor":8.8578},{"match_name":"SAPS Match 5/15/2021","match_date":"2021-05-15","stage_classifiercode":"09-04","member_number":"Ty87313","first_name":"JUAN","last_name":"SANCHEZ","classification":"A","division":"PCC","hit_factor":8.8452},{"match_name":"SSS USPSA June 2018 09-04","match_date":"2018-06-10","stage_classifiercode":"09-04","member_number":"A108656","first_name":"NELSON","last_name":"BERMAS","classification":"U (Unclassified)","division":"PCC","hit_factor":8.8312},{"match_name":"BORCC USPSA March 2018 Classifier Match","match_date":"2018-03-24","stage_classifiercode":"09-04","member_number":"A77486","first_name":"JOHN","last_name":"LOGAN","classification":"B","division":"PCC","hit_factor":8.8235},{"match_name":"ANPRACS USPSA12-17-17","match_date":"2017-12-17","stage_classifiercode":"09-04","member_number":"A96203","first_name":"EUGENE","last_name":"VANNI","classification":"C","division":"PCC","hit_factor":8.7977},{"match_name":"Uspsa Classifier","match_date":"2018-05-06","stage_classifiercode":"09-04","member_number":"F88530","first_name":"IAN","last_name":"JOHNSTON","classification":"U","division":"PCC","hit_factor":8.7855},{"match_name":"2020-10 Bone Creek USPSA","match_date":"2020-10-04","stage_classifiercode":"09-04","member_number":"A117501","first_name":"ROD","last_name":"COLEMAN","classification":"B","division":"PCC","hit_factor":8.7719},{"match_name":"CAPS 7-22-2017","match_date":"2017-07-22","stage_classifiercode":"09-04","member_number":"A74797","first_name":"CHRIS","last_name":"LARSON","classification":"C","division":"PCC","hit_factor":8.7671},{"match_name":"JCSSA Aug2017","match_date":"2017-08-04","stage_classifiercode":"09-04","member_number":"TY9766","first_name":"PAT","last_name":"BASHFORD","classification":"B","division":"PCC","hit_factor":8.7629},{"match_name":"HRRB 12-01-2018","match_date":"2018-12-01","stage_classifiercode":"09-04","member_number":"FY61621","first_name":"DERICK","last_name":"HIPOL","classification":"U","division":"PCC","hit_factor":8.7629},{"match_name":"Parabellum USPSA Jan 25 2017","match_date":"2017-01-25","stage_classifiercode":"09-04","member_number":"A99585","first_name":"JAMES","last_name":"PETERS","classification":"U","division":"PCC","hit_factor":8.7464},{"match_name":"Richmond Hot Shots 2018 USPSA Special Classifier Match - Jan 28 2018","match_date":"2018-01-28","stage_classifiercode":"09-04","member_number":"A82878","first_name":"RICHARD","last_name":"WILLIAMS","classification":"U","division":"PCC","hit_factor":8.7432},{"match_name":"Springfield Tactical Shooters 03/04/2021","match_date":"2021-03-04","stage_classifiercode":"09-04","member_number":"A29017","first_name":"ED","last_name":"ANDERSON","classification":"\"\"","division":"PCC","hit_factor":8.7404},{"match_name":"August 2018 CAS USPSA","match_date":"2018-08-05","stage_classifiercode":"09-04","member_number":"FY53269","first_name":"FORREST","last_name":"BOUDREAUX","classification":"U","division":"PCC","hit_factor":8.7193},{"match_name":"RCPS USPSA October 13","match_date":"2018-10-13","stage_classifiercode":"09-04","member_number":"\"\"","first_name":"TIM","last_name":"ARDLEY","classification":"U","division":"PCC","hit_factor":8.7179},{"match_name":"Dawg Valley USPSA April 14 2018","match_date":"2018-04-14","stage_classifiercode":"09-04","member_number":"A90105","first_name":"CHRIS","last_name":"MULFORD","classification":"\"\"","division":"PCC","hit_factor":8.7179},{"match_name":"Oh Shoot-PRG  May 2nd - 1st Sunday Match","match_date":"2021-05-02","stage_classifiercode":"09-04","member_number":"a34739","first_name":"RON","last_name":"SINGSON","classification":"B","division":"PCC","hit_factor":8.7179},{"match_name":"RSPP 3rd Saturday January 2018","match_date":"2018-01-20","stage_classifiercode":"09-04","member_number":"TY46374","first_name":"LARRY","last_name":"STOKES","classification":"B","division":"PCC","hit_factor":8.7167},{"match_name":"NAAS 2018-04-15","match_date":"2018-04-15","stage_classifiercode":"09-04","member_number":"A107497","first_name":"HARLEY","last_name":"WIEGERT","classification":"C","division":"PCC","hit_factor":8.6957},{"match_name":"CGC 10-14-2017","match_date":"2017-10-14","stage_classifiercode":"09-04","member_number":"L4293","first_name":"BILLY","last_name":"CHAU","classification":"U","division":"PCC","hit_factor":8.6957},{"match_name":"ARPC USPSA Match 11-29-20","match_date":"2020-11-29","stage_classifiercode":"09-04","member_number":"NONE","first_name":"DON","last_name":"MCDONALD","classification":"Unclassified","division":"PCC","hit_factor":8.6957},{"match_name":"Alpha Mike  Oct 2016","match_date":"2016-10-16","stage_classifiercode":"09-04","member_number":"a28015","first_name":"BRENT","last_name":"CAMPBELL","classification":"U","division":"PCC","hit_factor":8.6957},{"match_name":"B&R USPSA 6","match_date":"2018-06-30","stage_classifiercode":"09-04","member_number":"A78066","first_name":"MICHAEL","last_name":"SOUTHARD","classification":"B","division":"PCC","hit_factor":8.6758},{"match_name":"Sharp Practical Shooters March USPSA Match","match_date":"2018-03-25","stage_classifiercode":"09-04","member_number":"A100181","first_name":"RON","last_name":"VAUGHN","classification":"B","division":"PCC","hit_factor":8.6735},{"match_name":"RSPP 3rd Saturday August 2018","match_date":"2018-08-18","stage_classifiercode":"09-04","member_number":"A21582","first_name":"JOHN","last_name":"MURRAY","classification":"M","division":"PCC","hit_factor":8.6735},{"match_name":"NW01 March Madness 17","match_date":"2017-03-12","stage_classifiercode":"09-04","member_number":"A42954","first_name":"NEAL","last_name":"KNUDSON","classification":"U","division":"PCC","hit_factor":8.6721},{"match_name":"SMPSA 2018-03 Pistol PM Corrected","match_date":"2018-03-22","stage_classifiercode":"09-04","member_number":"FY81419","first_name":"JOHN","last_name":"NGUYEN","classification":"M","division":"PCC","hit_factor":8.6687},{"match_name":"RSPP 3rd Saturday January 2017","match_date":"2017-01-21","stage_classifiercode":"09-04","member_number":"TY78923","first_name":"JEREMY","last_name":"MULLIGAN","classification":"U","division":"PCC","hit_factor":8.6538},{"match_name":"Space Coast Practical Shooters","match_date":"2018-04-07","stage_classifiercode":"09-04","member_number":"ty73281","first_name":"JACK","last_name":"DARTIGALONGUE","classification":"B","division":"PCC","hit_factor":8.6538},{"match_name":"Coyote USPSA  Classifier Match 8-22-17","match_date":"2017-08-23","stage_classifiercode":"09-04","member_number":"A99857","first_name":"RUFUS","last_name":"CASTRO","classification":"U","division":"PCC","hit_factor":8.6364},{"match_name":"HPPS 6-19-2021","match_date":"2021-06-19","stage_classifiercode":"09-04","member_number":"TY96945","first_name":"ANNE","last_name":"KONNATH","classification":"A","division":"PCC","hit_factor":8.6331},{"match_name":"WELD ECO09 20180415","match_date":"2018-04-15","stage_classifiercode":"09-04","member_number":"A52572","first_name":"DAN","last_name":"TROXEL","classification":"U","division":"PCC","hit_factor":8.6331},{"match_name":"Brazosland Pistoleros August 20 2017","match_date":"2017-08-20","stage_classifiercode":"09-04","member_number":"L3935","first_name":"DANIEL","last_name":"DUBUISSON","classification":"C","division":"PCC","hit_factor":8.6253},{"match_name":"ARPC USPSA Match 11-25-18","match_date":"2018-11-25","stage_classifiercode":"09-04","member_number":"TY89183","first_name":"STEVE","last_name":"CASH","classification":"B","division":"PCC","hit_factor":8.6207},{"match_name":"Taxman Special ORSA USPSA 21 Apr 2018","match_date":"2018-04-21","stage_classifiercode":"09-04","member_number":"A108666","first_name":"DAVID","last_name":"FRAZIER","classification":"U","division":"PCC","hit_factor":8.6154},{"match_name":"Castlewood USPSA Sept 2020 shoot","match_date":"2020-09-26","stage_classifiercode":"09-04","member_number":"FY85746","first_name":"JIM","last_name":"LASKOWSKI","classification":"B","division":"PCC","hit_factor":8.6093},{"match_name":"LdF USPSA Match  March 24 2018","match_date":"2018-03-24","stage_classifiercode":"09-04","member_number":"TY80057","first_name":"CHRIS","last_name":"SOUSOUNIS","classification":"C","division":"PCC","hit_factor":8.596},{"match_name":"Triforce Practical Shooters at BigWoodsGoods 4-26-18","match_date":"2018-04-26","stage_classifiercode":"09-04","member_number":"A97112","first_name":"BRETT","last_name":"TYLER","classification":"A","division":"PCC","hit_factor":8.596},{"match_name":"APSC USPSA 10-06-18","match_date":"2018-10-06","stage_classifiercode":"09-04","member_number":"A52499","first_name":"JAKOB","last_name":"DAUDE","classification":"U","division":"PCC","hit_factor":8.5791},{"match_name":"APSC USPSA 09-18-21","match_date":"2021-09-18","stage_classifiercode":"09-04","member_number":"4147202457152948","first_name":"DAVID","last_name":"PICKERING","classification":"C","division":"PCC","hit_factor":8.5714},{"match_name":"Whitewater USPSA 2-17-2018","match_date":"2018-02-17","stage_classifiercode":"09-04","member_number":"A106234","first_name":"FRANK","last_name":"GODEL","classification":"U","division":"PCC","hit_factor":8.5642},{"match_name":"Lafayette Practical Shooters - THURSDAY - Oct 18","match_date":"2018-10-18","stage_classifiercode":"09-04","member_number":"A108876","first_name":"ERIK","last_name":"BELSOM","classification":"U","division":"PCC","hit_factor":8.5627},{"match_name":"NW01 March Madness 17","match_date":"2017-03-12","stage_classifiercode":"09-04","member_number":"FY27156","first_name":"STEVE","last_name":"CLEMO","classification":"U","division":"PCC","hit_factor":8.5561},{"match_name":"PTPC February 4th Classifier Match","match_date":"2018-02-04","stage_classifiercode":"09-04","member_number":"TY85154","first_name":"JAMES","last_name":"JENSEN","classification":"B","division":"PCC","hit_factor":8.5561},{"match_name":"RCPS USPSA October 13","match_date":"2018-10-13","stage_classifiercode":"09-04","member_number":"\"\"","first_name":"EVAN","last_name":"ASHBY","classification":"U","division":"PCC","hit_factor":8.5333},{"match_name":"LdF USPSA Match  March 24 2018","match_date":"2018-03-24","stage_classifiercode":"09-04","member_number":"FY77491","first_name":"TODD","last_name":"MAO2","classification":"U","division":"PCC","hit_factor":8.5227},{"match_name":"Shoot GTR USPSA  July 01 2018","match_date":"2018-07-01","stage_classifiercode":"09-04","member_number":"L1240","first_name":"TONY","last_name":"HYATT","classification":"A","division":"PCC","hit_factor":8.5213},{"match_name":"DWB - Deadwood Boys USPSA 20 September 2020  Classifier Match Makeup","match_date":"2020-09-20","stage_classifiercode":"09-04","member_number":"fy-82995","first_name":"JEFFREY","last_name":"HUNT","classification":"A","division":"PCC","hit_factor":8.5213},{"match_name":"PRG-USPSA - Oh Shoot November 15th - 3rd Sunday","match_date":"2020-11-15","stage_classifiercode":"09-04","member_number":"TY73599","first_name":"DAVID","last_name":"PRICE 2","classification":"C","division":"PCC","hit_factor":8.5106},{"match_name":"COPS Dec 2016 USPSA Match","match_date":"2016-12-04","stage_classifiercode":"09-04","member_number":"L2515","first_name":"JEFF","last_name":"COCKRUM","classification":"U","division":"PCC","hit_factor":8.5106},{"match_name":"ORSA USPSA Dogs Days Of Summer August 2018","match_date":"2018-08-17","stage_classifiercode":"09-04","member_number":"TY92055","first_name":"BRYAN","last_name":"KISER","classification":"A","division":"PCC","hit_factor":8.5106},{"match_name":"Springfield Tactical Shooters 03/04/2021","match_date":"2021-03-04","stage_classifiercode":"09-04","member_number":"\"\"","first_name":"AARON","last_name":"RENTSCHLER","classification":"\"\"","division":"PCC","hit_factor":8.5106},{"match_name":"Springfield Tactical Shooters 03/04/2021","match_date":"2021-03-04","stage_classifiercode":"09-04","member_number":"A55905","first_name":"BARRY","last_name":"OLIVER","classification":"B","division":"PCC","hit_factor":8.5},{"match_name":"EHPSA USPSA 26 August 2018","match_date":"2018-08-26","stage_classifiercode":"09-04","member_number":"A60017","first_name":"JOSEPH","last_name":"HOUDA","classification":"C","division":"PCC","hit_factor":8.4986},{"match_name":"5 Dogs September 2016 USPSA","match_date":"2016-09-04","stage_classifiercode":"09-04","member_number":"A97768","first_name":"KEN","last_name":"GONDER","classification":"U","division":"PCC","hit_factor":8.4926},{"match_name":"Grandbaggers October 2017","match_date":"2017-10-05","stage_classifiercode":"09-04","member_number":"A34501","first_name":"RON","last_name":"FUCHS","classification":"A","division":"PCC","hit_factor":8.4881},{"match_name":"WELD ECO09 20180415","match_date":"2018-04-15","stage_classifiercode":"09-04","member_number":"A84025","first_name":"ROBERT","last_name":"MARKHAM","classification":"C","division":"PCC","hit_factor":8.4881},{"match_name":"Bayou City USPSA Weekly Oct 22","match_date":"2020-10-22","stage_classifiercode":"09-04","member_number":"TY105098","first_name":"DON","last_name":"SAME","classification":"C","division":"PCC","hit_factor":8.4821},{"match_name":"2020-10 Bone Creek USPSA","match_date":"2020-10-04","stage_classifiercode":"09-04","member_number":"TY69614","first_name":"JIM","last_name":"WOODFORD","classification":"B","division":"PCC","hit_factor":8.4788},{"match_name":"CGC CTX02 Monthly USPSA Match - July 2021","match_date":"2021-07-18","stage_classifiercode":"09-04","member_number":"A127725","first_name":"DAN","last_name":"NGUYEN","classification":"C","division":"PCC","hit_factor":8.4746},{"match_name":"NAAS 2017-10-15","match_date":"2017-10-15","stage_classifiercode":"09-04","member_number":"A94807","first_name":"JAMES","last_name":"GARNER","classification":"U","division":"PCC","hit_factor":8.4706},{"match_name":"CRCPS 2020-08-08","match_date":"2020-08-08","stage_classifiercode":"09-04","member_number":"TY103254","first_name":"REGIS","last_name":"FRANK","classification":"B","division":"PCC","hit_factor":8.4691},{"match_name":"ORPCI 2018.03.31 USPSA Special","match_date":"2018-03-31","stage_classifiercode":"09-04","member_number":"\"\"","first_name":"KEVIN","last_name":"RUSSELL","classification":"\"\"","division":"PCC","hit_factor":8.4691},{"match_name":"GAS MAY 2020 USPSA SLOT MATCH","match_date":"2020-05-02","stage_classifiercode":"09-04","member_number":"Ty65280","first_name":"TRAVIS","last_name":"MCKLOSKY","classification":"M","division":"PCC","hit_factor":8.4633},{"match_name":"SWGC USPSA Pistol Match - March 2021","match_date":"2021-03-06","stage_classifiercode":"09-04","member_number":"TY39654","first_name":"LEE","last_name":"DENNEY","classification":"B","division":"PCC","hit_factor":8.4577},{"match_name":"FLSC February Classifier Match","match_date":"2017-02-04","stage_classifiercode":"09-04","member_number":"TY82562","first_name":"GUNNAR","last_name":"AN","classification":"U","division":"PCC","hit_factor":8.4444},{"match_name":"SFPC Annual Picnic Match","match_date":"2017-02-12","stage_classifiercode":"09-04","member_number":"TY70667","first_name":"JORGE","last_name":"RODRIGUEZ","classification":"U","division":"PCC","hit_factor":8.4433},{"match_name":"Sharp Practical Shooters March USPSA Match","match_date":"2018-03-25","stage_classifiercode":"09-04","member_number":"L3695","first_name":"BRUCE","last_name":"HEGGSTROM","classification":"U","division":"PCC","hit_factor":8.4433},{"match_name":"EIPS Classifier Match 3/18/18","match_date":"2018-03-18","stage_classifiercode":"09-04","member_number":"A74933","first_name":"JEFF","last_name":"CORY","classification":"C","division":"PCC","hit_factor":8.4367},{"match_name":"Shoot GTR USPSA  July 01 2018","match_date":"2018-07-01","stage_classifiercode":"09-04","member_number":"TY52498","first_name":"SCOTTY","last_name":"HUBBARD","classification":"C","division":"PCC","hit_factor":8.4367},{"match_name":"ORSA USPSA Dogs Days Of Summer August 2018","match_date":"2018-08-17","stage_classifiercode":"09-04","member_number":"TY66458","first_name":"ERIC","last_name":"EVANS","classification":"B","division":"PCC","hit_factor":8.4367},{"match_name":"JCSSA Aug2017","match_date":"2017-08-04","stage_classifiercode":"09-04","member_number":"TY12021","first_name":"RAGS","last_name":"CONNAWAY","classification":"\"\"","division":"PCC","hit_factor":8.4257},{"match_name":"Coyote USPSA  Classifier Match 8-22-17","match_date":"2017-08-23","stage_classifiercode":"09-04","member_number":"A97187","first_name":"LORENZO","last_name":"RODRIGUEZ","classification":"U","division":"PCC","hit_factor":8.4211},{"match_name":"Brazosland Pistoleros USPSA - Sunday September 12th","match_date":"2021-09-12","stage_classifiercode":"09-04","member_number":"A102903","first_name":"EDWIN","last_name":"BUCHWALTER","classification":"C","division":"PCC","hit_factor":8.4211},{"match_name":"August 2018 CAS USPSA","match_date":"2018-08-05","stage_classifiercode":"09-04","member_number":"L2311","first_name":"BRYAN","last_name":"GUILLORY","classification":"A","division":"PCC","hit_factor":8.4158},{"match_name":"NCPS USPSA Handgun Match July 22 2018a","match_date":"2018-07-22","stage_classifiercode":"09-04","member_number":"TY76839","first_name":"THOMAS","last_name":"WU","classification":"B","division":"PCC","hit_factor":8.4034},{"match_name":"SFPS 9-23-18 USPSA Match","match_date":"2018-09-23","stage_classifiercode":"09-04","member_number":"A50695","first_name":"TIMOTHY","last_name":"THOMAS","classification":"B","division":"PCC","hit_factor":8.4034},{"match_name":"NAAS 2017-10-15","match_date":"2017-10-15","stage_classifiercode":"09-04","member_number":"L1028","first_name":"TATA","last_name":"EUESBIO","classification":"A","division":"PCC","hit_factor":8.399},{"match_name":"TCSC USPSA Level I June club match","match_date":"2021-06-26","stage_classifiercode":"09-04","member_number":"A111754","first_name":"GEORGE","last_name":"TAMULA","classification":"B","division":"PCC","hit_factor":8.3951},{"match_name":"WELD ECO09 20180415","match_date":"2018-04-15","stage_classifiercode":"09-04","member_number":"A96539","first_name":"BECKY","last_name":"MULLER","classification":"M","division":"PCC","hit_factor":8.3871},{"match_name":"Richmond Hot Shots 2018 USPSA Special Classifier Match - Jan 28 2018","match_date":"2018-01-28","stage_classifiercode":"09-04","member_number":"TY68229","first_name":"JC","last_name":"SMITH","classification":"C","division":"PCC","hit_factor":8.3857},{"match_name":"Castlewood USPSA Sept 2020 shoot","match_date":"2020-09-26","stage_classifiercode":"09-04","member_number":"TY114374","first_name":"JONATHAN","last_name":"MINTEER","classification":"A","division":"PCC","hit_factor":8.3721},{"match_name":"5 Dogs October USPSA 2020","match_date":"2020-10-04","stage_classifiercode":"09-04","member_number":"XXXX","first_name":"DON","last_name":"MOUSSEAU","classification":"U","division":"PCC","hit_factor":8.3721},{"match_name":"NAAS 08-19-2018","match_date":"2018-08-19","stage_classifiercode":"09-04","member_number":"FY54490","first_name":"JOHNATHAN","last_name":"ALVARADO","classification":"U","division":"PCC","hit_factor":8.3565},{"match_name":"Palmetto Gun Club - February 2018 USPSA","match_date":"2018-02-03","stage_classifiercode":"09-04","member_number":"A64374","first_name":"MICHAEL","last_name":"CUTLER","classification":"C","division":"PCC","hit_factor":8.3551},{"match_name":"ORPCI 2018.03.31 USPSA Special","match_date":"2018-03-31","stage_classifiercode":"09-04","member_number":"A89356","first_name":"CHASE","last_name":"HARBER","classification":"M","division":"PCC","hit_factor":8.3551},{"match_name":"Cowtown Pistol Club USPSA December 28 2020","match_date":"2020-12-29","stage_classifiercode":"09-04","member_number":"Ty78536","first_name":"BRADLEY","last_name":"HULSEY","classification":"B","division":"PCC","hit_factor":8.3538},{"match_name":"NW01 March Madness 17","match_date":"2017-03-12","stage_classifiercode":"09-04","member_number":"a83609","first_name":"SCOTT","last_name":"WHITING","classification":"U","division":"PCC","hit_factor":8.3527},{"match_name":"EHPSA USPSA 26 August 2018","match_date":"2018-08-26","stage_classifiercode":"09-04","member_number":"A82693","first_name":"LINDA","last_name":"DORISIO","classification":"B","division":"PCC","hit_factor":8.3333},{"match_name":"Rio Salado RSPP January 2021","match_date":"2021-01-16","stage_classifiercode":"09-04","member_number":"L4342","first_name":"RICHARD","last_name":"MACE","classification":"A","division":"PCC","hit_factor":8.3333},{"match_name":"5 Dogs September 2016 USPSA","match_date":"2016-09-04","stage_classifiercode":"09-04","member_number":"TY34688","first_name":"BOB","last_name":"SEITZ","classification":"X","division":"PCC","hit_factor":8.3333},{"match_name":"MSSA Uspsa Club Match","match_date":"2017-09-09","stage_classifiercode":"09-04","member_number":"A78858","first_name":"WILLIAM","last_name":"ASHABRANNER","classification":"U","division":"PCC","hit_factor":8.3333},{"match_name":"ECO15 USPSA  3/10/2018","match_date":"2018-03-09","stage_classifiercode":"09-04","member_number":"a73453","first_name":"MIKE","last_name":"WILLEY","classification":"U","division":"PCC","hit_factor":8.3141},{"match_name":"WAC February(4th Sunday) - USPSA 6 Classifier Match","match_date":"2020-02-23","stage_classifiercode":"09-04","member_number":"A116570","first_name":"IAN","last_name":"SCHUMAKER","classification":"U","division":"PCC","hit_factor":8.3141},{"match_name":"GWPP January 2021Pistol","match_date":"2021-01-09","stage_classifiercode":"09-04","member_number":"L3738","first_name":"JAY","last_name":"OLMSTEAD","classification":"B","division":"PCC","hit_factor":8.313},{"match_name":"MISS Match 2-15-17","match_date":"2017-02-14","stage_classifiercode":"09-04","member_number":"A73683","first_name":"BRYAN","last_name":"TECSON","classification":"U","division":"PCC","hit_factor":8.3102},{"match_name":"Grandbaggers October 2017","match_date":"2017-10-05","stage_classifiercode":"09-04","member_number":"A22810","first_name":"KERRY","last_name":"PEARSON","classification":"GM","division":"PCC","hit_factor":8.3045},{"match_name":"Kidlat  May Club Match","match_date":"2017-05-06","stage_classifiercode":"09-04","member_number":"TY86420","first_name":"BJ","last_name":"BURTON","classification":"B","division":"PCC","hit_factor":8.2949},{"match_name":"Blue Ridge Arsenal Nov 8 All Classifier match","match_date":"2018-11-08","stage_classifiercode":"09-04","member_number":"Ty97341","first_name":"JAMES","last_name":"HAN","classification":"U","division":"PCC","hit_factor":8.2927},{"match_name":"ORPCI 2018.03.31 USPSA Special","match_date":"2018-03-31","stage_classifiercode":"09-04","member_number":"A78528","first_name":"TIM","last_name":"MEKOSH","classification":"\"\"","division":"PCC","hit_factor":8.2873},{"match_name":"Blue Ridge Arsenal Nov 8 All Classifier match","match_date":"2018-11-08","stage_classifiercode":"09-04","member_number":"A108310","first_name":"ROSENDO","last_name":"DOMINGO","classification":"U","division":"PCC","hit_factor":8.2816},{"match_name":"Palmetto Gun Club - February 2018 USPSA","match_date":"2018-02-03","stage_classifiercode":"09-04","member_number":"A83077","first_name":"ROBERT","last_name":"SCHULTZ","classification":"C","division":"PCC","hit_factor":8.2524},{"match_name":"TBAS USPSA Match 2/21/21","match_date":"2021-02-21","stage_classifiercode":"09-04","member_number":"A100877","first_name":"RORY","last_name":"MCBRIDE","classification":"C","division":"PCC","hit_factor":8.2524},{"match_name":"Space Coast Practical Shooters","match_date":"2018-04-07","stage_classifiercode":"09-04","member_number":"L1240","first_name":"TONY","last_name":"HYATT","classification":"A","division":"PCC","hit_factor":8.2262},{"match_name":"GWPP January 2021Pistol","match_date":"2021-01-09","stage_classifiercode":"09-04","member_number":"TY16696","first_name":"SCOTT","last_name":"MILLER","classification":"B","division":"PCC","hit_factor":8.2192},{"match_name":"EWPSA  2018-02","match_date":"2018-02-18","stage_classifiercode":"09-04","member_number":"A104247","first_name":"MATTHEW","last_name":"MAYHAK","classification":"C","division":"PCC","hit_factor":8.2051},{"match_name":"TCSC USPSA Level I June club match","match_date":"2021-06-26","stage_classifiercode":"09-04","member_number":"TY36345","first_name":"\"JOHN \"\"MIG\"\"\"","last_name":"MIGLIACCIO","classification":"M","division":"PCC","hit_factor":8.2019},{"match_name":"CGC 10-14-2017","match_date":"2017-10-14","stage_classifiercode":"09-04","member_number":"TY67044","first_name":"JOHN","last_name":"MACDONALD","classification":"C","division":"PCC","hit_factor":8.1818},{"match_name":"WGC USPSA Special Classifier 4-17-2021","match_date":"2021-04-17","stage_classifiercode":"09-04","member_number":"TY105933","first_name":"CRAIG","last_name":"SCHROEDER","classification":"B","division":"PCC","hit_factor":8.1744},{"match_name":"PTPC February 4th Classifier Match","match_date":"2018-02-04","stage_classifiercode":"09-04","member_number":"FY63847","first_name":"JOHN","last_name":"FAVREAU","classification":"C","division":"PCC","hit_factor":8.1744},{"match_name":"CSA Annual Classifier Classic","match_date":"2018-03-18","stage_classifiercode":"09-04","member_number":"A92696","first_name":"BJ","last_name":"MILLER","classification":"D","division":"PCC","hit_factor":8.1633},{"match_name":"RangeMasters 3-29-18","match_date":"2018-03-29","stage_classifiercode":"09-04","member_number":"A79973","first_name":"GREGG","last_name":"MCHENRY","classification":"C","division":"PCC","hit_factor":8.1633},{"match_name":"Vaxd Retd  USPSA Master Blasters ","match_date":"2021-09-30","stage_classifiercode":"09-04","member_number":"L4888","first_name":"BRIAN","last_name":"CHAREST","classification":"C","division":"PCC","hit_factor":8.1545},{"match_name":"Hawkeye Feb Match","match_date":"2017-02-18","stage_classifiercode":"09-04","member_number":"A96050","first_name":"MIKE","last_name":"GINN","classification":"C","division":"PCC","hit_factor":8.1448},{"match_name":"Uspsa Classifier","match_date":"2018-05-06","stage_classifiercode":"09-04","member_number":"TYF93988","first_name":"OSCAR","last_name":"TRACHMANN","classification":"U","division":"PCC","hit_factor":8.134},{"match_name":"2020-10 Bone Creek USPSA","match_date":"2020-10-04","stage_classifiercode":"09-04","member_number":"L-1870","first_name":"LES","last_name":"COX","classification":"U","division":"PCC","hit_factor":8.134},{"match_name":"Taxman Special ORSA USPSA 21 Apr 2018","match_date":"2018-04-21","stage_classifiercode":"09-04","member_number":"A98607","first_name":"ROBERT","last_name":"KRING","classification":"U","division":"PCC","hit_factor":8.1218},{"match_name":"ORPCI 2018.03.31 USPSA Special","match_date":"2018-03-31","stage_classifiercode":"09-04","member_number":"FY80376","first_name":"DAN","last_name":"RAINBOLT","classification":"D","division":"PCC","hit_factor":8.1081},{"match_name":"Rio Salado RSPP January 2021","match_date":"2021-01-16","stage_classifiercode":"09-04","member_number":"A89861","first_name":"LEON","last_name":"SMITH","classification":"C","division":"PCC","hit_factor":8.1081},{"match_name":"Yakima YRPA January Indoor classifier 2017","match_date":"2017-01-29","stage_classifiercode":"09-04","member_number":"L3238","first_name":"MATT","last_name":"NEWBURN","classification":"U","division":"PCC","hit_factor":8.0997},{"match_name":"LdF USPSA Match  March 24 2018","match_date":"2018-03-24","stage_classifiercode":"09-04","member_number":"A81101","first_name":"LES","last_name":"ANDERSON","classification":"A","division":"PCC","hit_factor":8.0925},{"match_name":"ARPC USPSA Match 11-29-20","match_date":"2020-11-29","stage_classifiercode":"09-04","member_number":"A32149","first_name":"LASZLO","last_name":"SZABO","classification":"B","division":"PCC","hit_factor":8.076},{"match_name":"OREGON ARPC CC05 USPSA - Classifier Match - APR 10 2021","match_date":"2021-04-10","stage_classifiercode":"09-04","member_number":"A98700","first_name":"MITCHELL","last_name":"PHAN","classification":"U","division":"PCC","hit_factor":8.0717},{"match_name":"ANPRACS USPSA12-17-17","match_date":"2017-12-17","stage_classifiercode":"09-04","member_number":"A94396","first_name":"KEVIN","last_name":"FELLER","classification":"U","division":"PCC","hit_factor":8.0537},{"match_name":"BRSP Tuesday Night USPSA Match - April 24","match_date":"2018-04-25","stage_classifiercode":"09-04","member_number":"A104784","first_name":"CODY","last_name":"HOLLAND","classification":"U","division":"PCC","hit_factor":8.0537},{"match_name":"SLOSA February 2018 USPSA MATCH","match_date":"2018-02-10","stage_classifiercode":"09-04","member_number":"TY79621","first_name":"STEPHEN","last_name":"COLLEN","classification":"A","division":"PCC","hit_factor":8.0495},{"match_name":"2019-03 USPSA at Shadow Hawk Defense","match_date":"2020-03-14","stage_classifiercode":"09-04","member_number":"L397","first_name":"JERRY","last_name":"WISECARVER","classification":"B","division":"PCC","hit_factor":8.0402},{"match_name":"Grandbaggers October 2017","match_date":"2017-10-05","stage_classifiercode":"09-04","member_number":"A91531","first_name":"DIANA","last_name":"BRAFFORD","classification":"B","division":"PCC","hit_factor":8.0357},{"match_name":"Puerto Rico USPSA Championship 2018","match_date":"2018-02-09","stage_classifiercode":"09-04","member_number":"A97126","first_name":"JUDIBELLE","last_name":"MELENDEZ ALCARAZ","classification":"U","division":"PCC","hit_factor":8.0357},{"match_name":"Fairfax PS USPSA January 2017","match_date":"2017-01-17","stage_classifiercode":"09-04","member_number":"TY83821","first_name":"DEREK","last_name":"EINSIG","classification":"U","division":"PCC","hit_factor":8.0214},{"match_name":"Competitive Shooters of Lake Norman CORNELIUS Thursday Evening Indoor USPSA Pistol Match North Carolina","match_date":"2021-01-07","stage_classifiercode":"09-04","member_number":"TY88089","first_name":"DAVID","last_name":"BURTON","classification":"B","division":"PCC","hit_factor":8.0189},{"match_name":"PTPC February 4th Classifier Match","match_date":"2018-02-04","stage_classifiercode":"09-04","member_number":"A85284","first_name":"ROMAN","last_name":"HRUSKA","classification":"U","division":"PCC","hit_factor":8.0189},{"match_name":"NAAS 2017-10-15","match_date":"2017-10-15","stage_classifiercode":"09-04","member_number":"A94807","first_name":"JAMES","last_name":"GARNER","classification":"U","division":"PCC","hit_factor":8},{"match_name":"USPSA MO19 Lamar Mar 25 2028","match_date":"2018-03-25","stage_classifiercode":"09-04","member_number":"TY94217","first_name":"DUSTIN","last_name":"CHAMBERLAIN","classification":"B","division":"PCC","hit_factor":8},{"match_name":"Medford USPSA  June 2020","match_date":"2020-06-21","stage_classifiercode":"09-04","member_number":"TY43784","first_name":"PHILLIP","last_name":"DODDRIDGE","classification":"B","division":"PCC","hit_factor":8},{"match_name":"  Maine Practical Shooters August 2020","match_date":"2020-08-08","stage_classifiercode":"09-04","member_number":"TY65806","first_name":"BRIAN","last_name":"KRAMPERT","classification":"C","division":"PCC","hit_factor":7.984},{"match_name":"PCGC October 2016","match_date":"2016-10-23","stage_classifiercode":"09-04","member_number":"A72738","first_name":"MICHAEL","last_name":"THOMPSON","classification":"U","division":"PCC","hit_factor":7.98},{"match_name":"August Summers End Match","match_date":"2017-08-27","stage_classifiercode":"09-04","member_number":"TY89958","first_name":"JESSE","last_name":"NEWTON","classification":"U","division":"PCC","hit_factor":7.9734},{"match_name":"ARPC USPSA Match 11-29-20","match_date":"2020-11-29","stage_classifiercode":"09-04","member_number":"A67988","first_name":"BILL","last_name":"LEMEN","classification":"B","division":"PCC","hit_factor":7.9576},{"match_name":"RPGi USPSA Last Minute Match 29 May 2021","match_date":"2021-05-29","stage_classifiercode":"09-04","member_number":"FY72883","first_name":"CHRIS","last_name":"ZAMBESI","classification":"D","division":"PCC","hit_factor":7.9511},{"match_name":"PRG-USPSA - Oh Shoot November 15th - 3rd Sunday","match_date":"2020-11-15","stage_classifiercode":"09-04","member_number":"TY103264","first_name":"ALEXIS","last_name":"AFAGHI","classification":"C","division":"PCC","hit_factor":7.9498},{"match_name":"SSPSC USPSA  June 6-7 2020","match_date":"2020-06-04","stage_classifiercode":"09-04","member_number":"A104233","first_name":"JOHN","last_name":"GATUS","classification":"","division":"PCC","hit_factor":7.9365},{"match_name":"Taxman Special ORSA USPSA 21 Apr 2018","match_date":"2018-04-21","stage_classifiercode":"09-04","member_number":"NA","first_name":"DEVIN","last_name":"KISER","classification":"U","division":"PCC","hit_factor":7.9332},{"match_name":"CGC 10-14-2017","match_date":"2017-10-14","stage_classifiercode":"09-04","member_number":"FY72288","first_name":"SEAN","last_name":"BOWEN","classification":"U","division":"PCC","hit_factor":7.9332},{"match_name":"Richmond Hot Shots 2018 USPSA Special Classifier Match - Jan 28 2018","match_date":"2018-01-28","stage_classifiercode":"09-04","member_number":"TY16297","first_name":"BERNARD","last_name":"VELASCO","classification":"U","division":"PCC","hit_factor":7.9295},{"match_name":"WGC USPSA Special Classifier 4-17-2021","match_date":"2021-04-17","stage_classifiercode":"09-04","member_number":"TY81966","first_name":"WYATT","last_name":"CARPENTER","classification":"U","division":"PCC","hit_factor":7.9254},{"match_name":"SAPSA October 2016","match_date":"2016-10-15","stage_classifiercode":"09-04","member_number":"A21361","first_name":"JIMMY","last_name":"OWENS","classification":"U","division":"PCC","hit_factor":7.9254},{"match_name":"EWPSA  2018-02","match_date":"2018-02-18","stage_classifiercode":"09-04","member_number":"A80982","first_name":"LARRY","last_name":"ROMAINE","classification":"U","division":"PCC","hit_factor":7.9121},{"match_name":"PRG-USPSA - Oh Shoot November 15th - 3rd Sunday","match_date":"2020-11-15","stage_classifiercode":"09-04","member_number":"a121410","first_name":"GEO","last_name":"OCULTO","classification":"D","division":"PCC","hit_factor":7.9096},{"match_name":"BHPSC Monthly Match - Feb 2020","match_date":"2020-02-29","stage_classifiercode":"09-04","member_number":"TY97338","first_name":"SHAWN","last_name":"VADNAIS","classification":"C","division":"PCC","hit_factor":7.907},{"match_name":"DRRC USPSA Aug2018","match_date":"2018-08-04","stage_classifiercode":"09-04","member_number":"L3012","first_name":"JIM","last_name":"SELL","classification":"B","division":"PCC","hit_factor":7.907},{"match_name":"Richmond Hot Shots 2018 USPSA Special Classifier Match - Jan 28 2018","match_date":"2018-01-28","stage_classifiercode":"09-04","member_number":"A101829","first_name":"MARC","last_name":"VETOVITZ","classification":"U","division":"PCC","hit_factor":7.8947},{"match_name":"DWB - Deadwood Boys USPSA 20 September 2020  Classifier Match Makeup","match_date":"2020-09-20","stage_classifiercode":"09-04","member_number":"TY-93265","first_name":"BILL","last_name":"DUNN","classification":"D","division":"PCC","hit_factor":7.8947},{"match_name":"BRSP Tuesday Night USPSA Match - April 24","match_date":"2018-04-25","stage_classifiercode":"09-04","member_number":"\"\"","first_name":"ANTHONY","last_name":"PETERS","classification":"\"\"","division":"PCC","hit_factor":7.8886},{"match_name":"CASA   USPSA  Dec 2018","match_date":"2018-12-01","stage_classifiercode":"09-04","member_number":"\"\"","first_name":"TOM","last_name":"FLEMING","classification":"U","division":"PCC","hit_factor":7.8818},{"match_name":"Triforce Practical Shooters at BigWoodsGoods 4-26-18","match_date":"2018-04-26","stage_classifiercode":"09-04","member_number":"Ty85797","first_name":"GARY","last_name":"WILLIAMS","classification":"B","division":"PCC","hit_factor":7.8818},{"match_name":"CAPS 7-22-2017","match_date":"2017-07-22","stage_classifiercode":"09-04","member_number":"A76929","first_name":"RODNEY","last_name":"BOWEN","classification":"U","division":"PCC","hit_factor":7.8775},{"match_name":"Maine Practical Shooters May 2018","match_date":"2018-05-12","stage_classifiercode":"09-04","member_number":"A94475","first_name":"GLENN","last_name":"STILWELL","classification":"B","division":"PCC","hit_factor":7.8522},{"match_name":"TCSC USPSA Level I June club match","match_date":"2021-06-26","stage_classifiercode":"09-04","member_number":"A110246","first_name":"BEA","last_name":"L","classification":"C","division":"PCC","hit_factor":7.8522},{"match_name":"Uspsa Classifier","match_date":"2018-05-06","stage_classifiercode":"09-04","member_number":"F107928","first_name":"LEN","last_name":"BASSO","classification":"U","division":"PCC","hit_factor":7.8431},{"match_name":"April 2017 OPSC USPSA","match_date":"2017-04-09","stage_classifiercode":"09-04","member_number":"PEN","first_name":"DAN","last_name":"VAUGHAN","classification":"U","division":"PCC","hit_factor":7.8431},{"match_name":"Richmond Hot Shots 2018 USPSA Special Classifier Match - Jan 28 2018","match_date":"2018-01-28","stage_classifiercode":"09-04","member_number":"TY79457","first_name":"LARRY","last_name":"MODELL","classification":"C","division":"PCC","hit_factor":7.8431},{"match_name":"Richmond Hot Shots August 6-7 USPSA Pistol Match","match_date":"2016-08-06","stage_classifiercode":"09-04","member_number":"A79956","first_name":"EDWIN","last_name":"CHANG","classification":"U","division":"PCC","hit_factor":7.8431},{"match_name":"BORCC USPSA March 2018 Classifier Match","match_date":"2018-03-24","stage_classifiercode":"09-04","member_number":"TY49380","first_name":"SHANNAN","last_name":"CHADA","classification":"U","division":"PCC","hit_factor":7.8431},{"match_name":"Space Coast Practical Shooters","match_date":"2018-04-07","stage_classifiercode":"09-04","member_number":"A59244","first_name":"ANDY","last_name":"ZAVALLA","classification":"M","division":"PCC","hit_factor":7.8358},{"match_name":"WGC WI USPSA Monthly Match 4-21-18","match_date":"2018-04-21","stage_classifiercode":"09-04","member_number":"TY26421","first_name":"RANDY","last_name":"HEFFNER","classification":"C","division":"PCC","hit_factor":7.8341},{"match_name":"Cowtown Pistol Club USPSA December 28 2020","match_date":"2020-12-29","stage_classifiercode":"09-04","member_number":"A88737","first_name":"GEORGE","last_name":"VESELY","classification":"B","division":"PCC","hit_factor":7.824},{"match_name":"PRG-USPSA - Oh Shoot November 15th - 3rd Sunday","match_date":"2020-11-15","stage_classifiercode":"09-04","member_number":"A113147","first_name":"JAMES","last_name":"CARDENAS","classification":"U","division":"PCC","hit_factor":7.8161},{"match_name":"YMM IPSC02 2017_11_12","match_date":"2017-11-12","stage_classifiercode":"09-04","member_number":"A66244","first_name":"JIM","last_name":"SUMMARELL","classification":"C","division":"PCC","hit_factor":7.8161},{"match_name":"PCGC October 2016","match_date":"2016-10-23","stage_classifiercode":"09-04","member_number":"TY85570","first_name":"DAVID","last_name":"MILLER","classification":"U","division":"PCC","hit_factor":7.8067},{"match_name":"EWPSA  2018-02","match_date":"2018-02-18","stage_classifiercode":"09-04","member_number":"B6","first_name":"DWIGHT","last_name":"HUGHES","classification":"U","division":"PCC","hit_factor":7.8049},{"match_name":"APSC USPSA 09-18-21","match_date":"2021-09-18","stage_classifiercode":"09-04","member_number":"FY92760","first_name":"MIKE","last_name":"REED","classification":"C","division":"PCC","hit_factor":7.7922},{"match_name":"FBURG July 2017 Level I USPSA ","match_date":"2017-07-01","stage_classifiercode":"09-04","member_number":"TY83821","first_name":"DEREK","last_name":"EINSIG","classification":"A","division":"PCC","hit_factor":7.7922},{"match_name":"PTPC February 4th Classifier Match","match_date":"2018-02-04","stage_classifiercode":"09-04","member_number":"FY57913","first_name":"DIRK","last_name":"SCHLUETER","classification":"C","division":"PCC","hit_factor":7.7859},{"match_name":"NAAS 08-19-2018","match_date":"2018-08-19","stage_classifiercode":"09-04","member_number":"TY94807","first_name":"JAMES M","last_name":"GARNER","classification":"B","division":"PCC","hit_factor":7.7803},{"match_name":"Richmond Hot Shots August 6-7 USPSA Pistol Match","match_date":"2016-08-06","stage_classifiercode":"09-04","member_number":"TY24456","first_name":"RANDY","last_name":"MELTON","classification":"U","division":"PCC","hit_factor":7.7778},{"match_name":"RangeMasters 3-29-18","match_date":"2018-03-29","stage_classifiercode":"09-04","member_number":"L3738","first_name":"JAY","last_name":"OLMSTEAD","classification":"B","division":"PCC","hit_factor":7.767},{"match_name":"BORCC USPSA August 2017","match_date":"2017-08-27","stage_classifiercode":"09-04","member_number":"A77486","first_name":"JOHN","last_name":"LOGAN","classification":"B","division":"PCC","hit_factor":7.767},{"match_name":"WAC February(4th Sunday) - USPSA 6 Classifier Match","match_date":"2020-02-23","stage_classifiercode":"09-04","member_number":"ty102198","first_name":"JIM","last_name":"BLACKMAN","classification":"U","division":"PCC","hit_factor":7.7626},{"match_name":"TPS USPSA at CMP July 21 2018","match_date":"2018-07-21","stage_classifiercode":"09-04","member_number":"TY98974","first_name":"JOHN","last_name":"KUROSKI","classification":"\"\"","division":"PCC","hit_factor":7.7626},{"match_name":"NAAS 08-19-2018","match_date":"2018-08-19","stage_classifiercode":"09-04","member_number":"A82223","first_name":"BRETT","last_name":"NETTLETON","classification":"G","division":"PCC","hit_factor":7.7551},{"match_name":"Coyote USPSA  Classifier Match 8-22-17","match_date":"2017-08-23","stage_classifiercode":"09-04","member_number":"ty92997","first_name":"ARMANDO","last_name":"HERRERA JR","classification":"U","division":"PCC","hit_factor":7.7348},{"match_name":"Richmond Hot Shots 2018 USPSA Special Classifier Match - Jan 28 2018","match_date":"2018-01-28","stage_classifiercode":"09-04","member_number":"A95231","first_name":"ERIK","last_name":"MARSHALL","classification":"B","division":"PCC","hit_factor":7.7348},{"match_name":"Brazosland Pistoleros August 20 2017","match_date":"2017-08-20","stage_classifiercode":"09-04","member_number":"TY3880","first_name":"BILL","last_name":"MURRAY","classification":"A","division":"PCC","hit_factor":7.732},{"match_name":"YMM IPSC02 2017_11_12","match_date":"2017-11-12","stage_classifiercode":"09-04","member_number":"A48846","first_name":"ALLEN","last_name":"NELSON","classification":"C","division":"PCC","hit_factor":7.7295},{"match_name":"Taxman Special ORSA USPSA 21 Apr 2018","match_date":"2018-04-21","stage_classifiercode":"09-04","member_number":"TY98638","first_name":"WENDY","last_name":"WINE","classification":"B","division":"PCC","hit_factor":7.6923},{"match_name":"Kidlat February Club Match","match_date":"2017-02-04","stage_classifiercode":"09-04","member_number":"A36295","first_name":"PAUL","last_name":"VAN WYK","classification":"U","division":"PCC","hit_factor":7.6923},{"match_name":"Rio Salado RSPP January 2021","match_date":"2021-01-16","stage_classifiercode":"09-04","member_number":"TY95703","first_name":"GEORGE","last_name":"LOVE","classification":"C","division":"PCC","hit_factor":7.6768},{"match_name":"EHPSA Apr 2017","match_date":"2017-04-23","stage_classifiercode":"09-04","member_number":"A38302","first_name":"JEFF","last_name":"GRESSMAN","classification":"U","division":"PCC","hit_factor":7.6759},{"match_name":"MSSA Uspsa Club Match","match_date":"2017-09-09","stage_classifiercode":"09-04","member_number":"A87329","first_name":"BRUCE","last_name":"EVANS","classification":"U","division":"PCC","hit_factor":7.6759},{"match_name":"RCPS USPSA 13 Aug 2016","match_date":"2016-08-13","stage_classifiercode":"09-04","member_number":"TY66517","first_name":"WILL","last_name":"JONES","classification":"U","division":"PCC","hit_factor":7.6642},{"match_name":"Palmetto Gun Club - February 2018 USPSA","match_date":"2018-02-03","stage_classifiercode":"09-04","member_number":"A92002","first_name":"DAVID","last_name":"REDD","classification":"B","division":"PCC","hit_factor":7.6577},{"match_name":"APSC USPSA 09-18-21","match_date":"2021-09-18","stage_classifiercode":"09-04","member_number":"FY88668","first_name":"CARROLL","last_name":"VICK","classification":"C","division":"PCC","hit_factor":7.6459},{"match_name":"August 2018 CAS USPSA","match_date":"2018-08-05","stage_classifiercode":"09-04","member_number":"\"\"","first_name":"CHIP","last_name":"NOEL","classification":"U","division":"PCC","hit_factor":7.6372},{"match_name":"LdF USPSA Match September 5 2021","match_date":"2021-09-05","stage_classifiercode":"09-04","member_number":"TY122069","first_name":"WILLIAM","last_name":"MCNEESE","classification":"C","division":"PCC","hit_factor":7.6305},{"match_name":"Prescott Action Shooters 1st Saturday USPSA 5-01-21","match_date":"2021-05-01","stage_classifiercode":"09-04","member_number":"L3243","first_name":"PETE","last_name":"CONNAL","classification":"C","division":"PCC","hit_factor":7.5949},{"match_name":"CAPS 7-22-2017","match_date":"2017-07-22","stage_classifiercode":"09-04","member_number":"A82658","first_name":"MIKE","last_name":"PEARCE","classification":"C","division":"PCC","hit_factor":7.5893},{"match_name":"Richmond Hot Shots 2018 USPSA Special Classifier Match - Jan 28 2018","match_date":"2018-01-28","stage_classifiercode":"09-04","member_number":"A101811","first_name":"BRENT","last_name":"VETOVITZ","classification":"U","division":"PCC","hit_factor":7.5893},{"match_name":"SEPSA March 2021","match_date":"2021-03-13","stage_classifiercode":"09-04","member_number":"L144","first_name":"JOHN","last_name":"HARBISON","classification":"U","division":"PCC","hit_factor":7.5724},{"match_name":"SSPSC USPSA  June 6-7 2020","match_date":"2020-06-04","stage_classifiercode":"09-04","member_number":"TY40354","first_name":"JERRY","last_name":"BONURA","classification":"","division":"PCC","hit_factor":7.5676},{"match_name":"NCPS USPSA Handgun Match July 22 2018a","match_date":"2018-07-22","stage_classifiercode":"09-04","member_number":"A68590","first_name":"STEVE","last_name":"AMES","classification":"C","division":"PCC","hit_factor":7.563},{"match_name":"2019-03 USPSA at Shadow Hawk Defense","match_date":"2020-03-14","stage_classifiercode":"09-04","member_number":"A108310","first_name":"ROSENDO","last_name":"DOMINGO","classification":"C","division":"PCC","hit_factor":7.5567},{"match_name":"RSPP 3rd Saturday January 2017","match_date":"2017-01-21","stage_classifiercode":"09-04","member_number":"L2842","first_name":"PAUL","last_name":"CAUDILL","classification":"U","division":"PCC","hit_factor":7.5472},{"match_name":"DWB - Deadwood Boys USPSA 20 September 2020  Classifier Match Makeup","match_date":"2020-09-20","stage_classifiercode":"09-04","member_number":"A112254","first_name":"JOAQUIN","last_name":"SERRATO","classification":"A","division":"PCC","hit_factor":7.541},{"match_name":"BORCC USPSA March 2018 Classifier Match","match_date":"2018-03-24","stage_classifiercode":"09-04","member_number":"TY91956","first_name":"JEREMY","last_name":"STEPHAN","classification":"U","division":"PCC","hit_factor":7.5377},{"match_name":"PCGC USPSA July 2018","match_date":"2018-07-22","stage_classifiercode":"09-04","member_number":"A99386","first_name":"CHRIS","last_name":"HENDERSON","classification":"U","division":"PCC","hit_factor":7.5294},{"match_name":"BORCC USPSA Classifier Match January 2017","match_date":"2017-01-22","stage_classifiercode":"09-04","member_number":"L3378","first_name":"CHRISTOPHER","last_name":"GILSON","classification":"U","division":"PCC","hit_factor":7.5067},{"match_name":"WAC February(4th Sunday) - USPSA 6 Classifier Match","match_date":"2020-02-23","stage_classifiercode":"09-04","member_number":"ty84597","first_name":"NORMAN","last_name":"DAVIS","classification":"C","division":"PCC","hit_factor":7.5},{"match_name":"APSC USPSA 10-06-18","match_date":"2018-10-06","stage_classifiercode":"09-04","member_number":"\"\"","first_name":"GRADY","last_name":"STIEREN","classification":"M","division":"PCC","hit_factor":7.5},{"match_name":"TPS USPSA at CMP July 21 2018","match_date":"2018-07-21","stage_classifiercode":"09-04","member_number":"TY110009","first_name":"MARTIN","last_name":"TREPTAU","classification":"B","division":"PCC","hit_factor":7.5},{"match_name":"LRC USPSA October 2020","match_date":"2020-10-03","stage_classifiercode":"09-04","member_number":"A110613","first_name":"CONRAD","last_name":"GUIANG","classification":"U","division":"PCC","hit_factor":7.4951},{"match_name":"August 2018 CAS USPSA","match_date":"2018-08-05","stage_classifiercode":"09-04","member_number":"A73959","first_name":"KIRK","last_name":"KLEINPETER","classification":"U","division":"PCC","hit_factor":7.4766},{"match_name":"SFPC Annual Picnic Match","match_date":"2017-02-12","stage_classifiercode":"09-04","member_number":"A67363","first_name":"ERNIE","last_name":"PALACIOS","classification":"U","division":"PCC","hit_factor":7.4725},{"match_name":"Richmond Hot Shots 2018 USPSA Special Classifier Match - Jan 28 2018","match_date":"2018-01-28","stage_classifiercode":"09-04","member_number":"A89517","first_name":"JOHN","last_name":"RICCHIUTO","classification":"C","division":"PCC","hit_factor":7.4419},{"match_name":"Crooked Creek Pistol League - July 2017","match_date":"2017-07-22","stage_classifiercode":"09-04","member_number":"A93212","first_name":"DAVID","last_name":"GILLES","classification":"U","division":"PCC","hit_factor":7.4419},{"match_name":"ECO15 USPSA  3/10/2018","match_date":"2018-03-09","stage_classifiercode":"09-04","member_number":"A72628","first_name":"DEAN","last_name":"MARSH","classification":"C","division":"PCC","hit_factor":7.4398},{"match_name":"H&H July Match","match_date":"2017-07-23","stage_classifiercode":"09-04","member_number":"A100497","first_name":"TYLER","last_name":"BRANSTETTER","classification":"U","division":"PCC","hit_factor":7.4271},{"match_name":"TGC USPSA June 2018","match_date":"2018-06-16","stage_classifiercode":"09-04","member_number":"L3507","first_name":"AARON","last_name":"MARCO","classification":"M","division":"PCC","hit_factor":7.4219},{"match_name":"HPPS 6-19-2021","match_date":"2021-06-19","stage_classifiercode":"09-04","member_number":"Ty59267","first_name":"BRAD","last_name":"MCKIERNAN","classification":"A","division":"PCC","hit_factor":7.4219},{"match_name":"CVSC 04-22-2018","match_date":"2018-04-22","stage_classifiercode":"09-04","member_number":"TY96702","first_name":"BRUCE","last_name":"LE","classification":"B","division":"PCC","hit_factor":7.4074},{"match_name":"Idaho ISPS September 1st 2018","match_date":"2018-09-01","stage_classifiercode":"09-04","member_number":"A113712","first_name":"RAY","last_name":"COSTELLO","classification":"U","division":"PCC","hit_factor":7.4074},{"match_name":"Richmond Hot Shots August 6-7 USPSA Pistol Match","match_date":"2016-08-06","stage_classifiercode":"09-04","member_number":"A87650","first_name":"ALEX","last_name":"GOETZE","classification":"U","division":"PCC","hit_factor":7.4074},{"match_name":"Springfield Tactical Shooters 03/04/2021","match_date":"2021-03-04","stage_classifiercode":"09-04","member_number":"A107625","first_name":"CHUCK","last_name":"MCLAUGHLIN","classification":"\"\"","division":"PCC","hit_factor":7.3913},{"match_name":"TPS USPSA at CMP July 21 2018","match_date":"2018-07-21","stage_classifiercode":"09-04","member_number":"A104245","first_name":"MATT","last_name":"SCOTT","classification":"B","division":"PCC","hit_factor":7.3879},{"match_name":"CGC 10-14-2017","match_date":"2017-10-14","stage_classifiercode":"09-04","member_number":"TY85797","first_name":"GARY","last_name":"WILLIAMS","classification":"B","division":"PCC","hit_factor":7.377},{"match_name":"Griffin USPSA December 17 2016","match_date":"2016-12-17","stage_classifiercode":"09-04","member_number":"TY57617","first_name":"ERIC","last_name":"DAVIS","classification":"U","division":"PCC","hit_factor":7.3643},{"match_name":"SFPC Annual Picnic Match","match_date":"2017-02-12","stage_classifiercode":"09-04","member_number":"A61072","first_name":"VIRGIL","last_name":"BOTTI","classification":"U","division":"PCC","hit_factor":7.3593},{"match_name":"CVSC 04-22-2018","match_date":"2018-04-22","stage_classifiercode":"09-04","member_number":"\"\"","first_name":"DAVID","last_name":"SIMPSON","classification":"X","division":"PCC","hit_factor":7.332},{"match_name":"CCPL 07082018","match_date":"2018-07-06","stage_classifiercode":"09-04","member_number":"A105122","first_name":"CHRIS","last_name":"MIRANDA","classification":"B","division":"PCC","hit_factor":7.3298},{"match_name":"FLSC February Classifier Match","match_date":"2017-02-04","stage_classifiercode":"09-04","member_number":"A95822","first_name":"ERIC","last_name":"MARTIN","classification":"U","division":"PCC","hit_factor":7.3276},{"match_name":"APSC USPSA 10-06-18","match_date":"2018-10-06","stage_classifiercode":"09-04","member_number":"TY74988","first_name":"GREG","last_name":"COOPER","classification":"C","division":"PCC","hit_factor":7.3118},{"match_name":"Richmond Hot Shots 2018 USPSA Special Classifier Match - Jan 28 2018","match_date":"2018-01-28","stage_classifiercode":"09-04","member_number":"L4134","first_name":"CHRISTOPHER","last_name":"WALLACE","classification":"U","division":"PCC","hit_factor":7.3077},{"match_name":"RSPP 3rd Saturday January 2017","match_date":"2017-01-21","stage_classifiercode":"09-04","member_number":"A97240","first_name":"CHRIS","last_name":"TOUNGET","classification":"C","division":"PCC","hit_factor":7.3022},{"match_name":"ORPCI 2018.03.31 USPSA Special","match_date":"2018-03-31","stage_classifiercode":"09-04","member_number":"\"\"","first_name":"JEFF","last_name":"RUSSELL","classification":"U","division":"PCC","hit_factor":7.2961},{"match_name":"CRCPS 2020-08-08","match_date":"2020-08-08","stage_classifiercode":"09-04","member_number":"TY99488","first_name":"KIRT","last_name":"MCKENNA","classification":"A","division":"PCC","hit_factor":7.2917},{"match_name":"CAPS 7-22-2017","match_date":"2017-07-22","stage_classifiercode":"09-04","member_number":"A45158","first_name":"MIKE","last_name":"NEEDHAM","classification":"B","division":"PCC","hit_factor":7.2829},{"match_name":"Emmett November Match","match_date":"2018-11-24","stage_classifiercode":"09-04","member_number":"A84732","first_name":"AIMEE","last_name":"WILLIAMS","classification":"U","division":"PCC","hit_factor":7.2727},{"match_name":"PTPC February 4th Classifier Match","match_date":"2018-02-04","stage_classifiercode":"09-04","member_number":"FY10528","first_name":"JOHN","last_name":"SMITH","classification":"U","division":"PCC","hit_factor":7.2727},{"match_name":"EHPSA Apr 2017","match_date":"2017-04-23","stage_classifiercode":"09-04","member_number":"A91964","first_name":"JACOB","last_name":"WILLSON","classification":"U","division":"PCC","hit_factor":7.2562},{"match_name":"CASA   USPSA  Dec 2018","match_date":"2018-12-01","stage_classifiercode":"09-04","member_number":"TY53177","first_name":"CLEVE","last_name":"MATHEWS","classification":"B","division":"PCC","hit_factor":7.2539},{"match_name":"Maine Pracrical Shooters-July 2017 USPSA","match_date":"2017-07-09","stage_classifiercode":"09-04","member_number":"A94475","first_name":"GLENN","last_name":"STILWELL","classification":"C","division":"PCC","hit_factor":7.2435},{"match_name":"HRRB 12-01-2018","match_date":"2018-12-01","stage_classifiercode":"09-04","member_number":"L4313","first_name":"ART","last_name":"RIVERA","classification":"U","division":"PCC","hit_factor":7.234},{"match_name":"ACC  June  27th Saturday","match_date":"2020-06-27","stage_classifiercode":"09-04","member_number":"A122335","first_name":"PAUL","last_name":"SPRANGER","classification":"B","division":"PCC","hit_factor":7.2289},{"match_name":"Chillicothe April-2017 USPSA Match","match_date":"2017-04-23","stage_classifiercode":"09-04","member_number":"L3332","first_name":"KYLE","last_name":"GLEASON","classification":"B","division":"PCC","hit_factor":7.2289},{"match_name":"Bayou City USPSA Weekly Oct 22","match_date":"2020-10-22","stage_classifiercode":"09-04","member_number":"A107489","first_name":"CHARLES","last_name":"BRADBURY","classification":"C","division":"PCC","hit_factor":7.2144},{"match_name":"OREGON ARPC CC05 USPSA - Classifier Match - APR 10 2021","match_date":"2021-04-10","stage_classifiercode":"09-04","member_number":"a126737","first_name":"ASHLIE","last_name":"JAMESON","classification":"U","division":"PCC","hit_factor":7.2115},{"match_name":"CGC CTX02 Monthly USPSA Match - July 2021","match_date":"2021-07-18","stage_classifiercode":"09-04","member_number":"TY41061","first_name":"KIRBY","last_name":"DAHL","classification":"C","division":"PCC","hit_factor":7.2115},{"match_name":"Richmond Hot Shots 2018 USPSA Special Classifier Match - Jan 28 2018","match_date":"2018-01-28","stage_classifiercode":"09-04","member_number":"TY99745","first_name":"JONATHAN","last_name":"OWYANG","classification":"A","division":"PCC","hit_factor":7.197},{"match_name":"GRPC USPSA Fall Back Match ","match_date":"2016-11-06","stage_classifiercode":"09-04","member_number":"\"\"","first_name":"DAVE","last_name":"EICKHOFF","classification":"C","division":"PCC","hit_factor":7.1651},{"match_name":"CRCPS 2020-08-08","match_date":"2020-08-08","stage_classifiercode":"09-04","member_number":"A129706","first_name":"SEAN","last_name":"HEWITT","classification":"U","division":"PCC","hit_factor":7.1429},{"match_name":"LdF USPSA Match  March 24 2018","match_date":"2018-03-24","stage_classifiercode":"09-04","member_number":"L3251","first_name":"BUDDY","last_name":"BAUTISTA","classification":"U","division":"PCC","hit_factor":7.1429},{"match_name":"DRRC USPSA Aug2018","match_date":"2018-08-04","stage_classifiercode":"09-04","member_number":"TY84121","first_name":"GABOR","last_name":"MAGONY","classification":"M","division":"PCC","hit_factor":7.1429},{"match_name":"Maine Practical Shooters May 2018","match_date":"2018-05-12","stage_classifiercode":"09-04","member_number":"TY84597","first_name":"NORMAN","last_name":"DAVIS","classification":"C","division":"PCC","hit_factor":7.1287},{"match_name":"CSA Annual Classifier Classic","match_date":"2018-03-18","stage_classifiercode":"09-04","member_number":"A98649","first_name":"MATTHEW","last_name":"MOORE","classification":"U","division":"PCC","hit_factor":7.1279},{"match_name":"Renton USPSA April 2017","match_date":"2017-04-23","stage_classifiercode":"09-04","member_number":"a84564","first_name":"RYAN","last_name":"REIBMAN","classification":"U","division":"PCC","hit_factor":7.0981},{"match_name":"USPSA MO19 Lamar September 2017 Special Classifier","match_date":"2017-09-24","stage_classifiercode":"09-04","member_number":"A96267","first_name":"MYLEE","last_name":"CHAMBERLAIN","classification":"D","division":"PCC","hit_factor":7.0981},{"match_name":"SMPSA 2018-03 Pistol PM Corrected","match_date":"2018-03-22","stage_classifiercode":"09-04","member_number":"A46930","first_name":"GERALD","last_name":"BENTON","classification":"A","division":"PCC","hit_factor":7.0845},{"match_name":"ARPC USPSA Match 11-25-18","match_date":"2018-11-25","stage_classifiercode":"09-04","member_number":"A32149","first_name":"LASZLO","last_name":"SZABO","classification":"A","division":"PCC","hit_factor":7.0796},{"match_name":"FLSC February Classifier Match","match_date":"2017-02-04","stage_classifiercode":"09-04","member_number":"A92342","first_name":"TODD","last_name":"OVERLAND","classification":"U","division":"PCC","hit_factor":7.0796},{"match_name":"Richmond Hot Shots 2018 USPSA Special Classifier Match - Jan 28 2018","match_date":"2018-01-28","stage_classifiercode":"09-04","member_number":"A75194","first_name":"BOB","last_name":"PRICE","classification":"U","division":"PCC","hit_factor":7.0796},{"match_name":"Richmond Hot Shots 2018 USPSA Special Classifier Match - Jan 28 2018","match_date":"2018-01-28","stage_classifiercode":"09-04","member_number":"A59860","first_name":"JAMES","last_name":"GRIFFITHS","classification":"U","division":"PCC","hit_factor":7.0686},{"match_name":"EHPSA USPSA 26 August 2018","match_date":"2018-08-26","stage_classifiercode":"09-04","member_number":"A82693","first_name":"LINDA","last_name":"DORISIO","classification":"B","division":"PCC","hit_factor":7.0588},{"match_name":"WGC WI USPSA Monthly Match 4-21-18","match_date":"2018-04-21","stage_classifiercode":"09-04","member_number":"A106197","first_name":"DOUG","last_name":"ANDERSON","classification":"U","division":"PCC","hit_factor":7.0588},{"match_name":"Coastal Area Practical Shooters 7-23-16","match_date":"2016-07-23","stage_classifiercode":"09-04","member_number":"A60473","first_name":"KEVIN","last_name":"BARNEY","classification":"U","division":"PCC","hit_factor":7.0588},{"match_name":"Oh Shoot-PRG  May 2nd - 1st Sunday Match","match_date":"2021-05-02","stage_classifiercode":"09-04","member_number":"TY129989","first_name":"JASON","last_name":"JOVES","classification":"C","division":"PCC","hit_factor":7.0501},{"match_name":"PCGC October 2016","match_date":"2016-10-23","stage_classifiercode":"09-04","member_number":"A93641","first_name":"JOSEPH","last_name":"KELLEY","classification":"B","division":"PCC","hit_factor":7.0423},{"match_name":"WGC USPSA Special Classifier 4-17-2021","match_date":"2021-04-17","stage_classifiercode":"09-04","member_number":"TY70451","first_name":"AARON","last_name":"KIPPLEY","classification":"C","division":"PCC","hit_factor":7.0352},{"match_name":"  Maine Practical Shooters August 2020","match_date":"2020-08-08","stage_classifiercode":"09-04","member_number":"TY84597","first_name":"NORMAN","last_name":"DAVIS","classification":"C","division":"PCC","hit_factor":7.027},{"match_name":"LdF USPSA Match September 5 2021","match_date":"2021-09-05","stage_classifiercode":"09-04","member_number":"A84256","first_name":"TASSY","last_name":"HENNESSY","classification":"C","division":"PCC","hit_factor":7.0175},{"match_name":"Applied IN25 USPSA October 2017 Classifier","match_date":"2017-10-18","stage_classifiercode":"09-04","member_number":"A51967","first_name":"ARON","last_name":"BRIGHT","classification":"U","division":"PCC","hit_factor":7.0175},{"match_name":"DSS - USPSA - 21-07-24","match_date":"2021-07-24","stage_classifiercode":"09-04","member_number":"A100953","first_name":"BRETT","last_name":"FRASER","classification":"B","division":"PCC","hit_factor":7.0111},{"match_name":"APSC USPSA 10-06-18","match_date":"2018-10-06","stage_classifiercode":"09-04","member_number":"TY76826","first_name":"JAIME","last_name":"KARPINSKI","classification":"C","division":"PCC","hit_factor":7.0111},{"match_name":"MPSA 2021-07-17","match_date":"2021-07-17","stage_classifiercode":"09-04","member_number":"A96501","first_name":"CANDACE","last_name":"ZIMMERMAN","classification":"B","division":"PCC","hit_factor":7.0093},{"match_name":"RPGi USPSA Last Minute Match 29 May 2021","match_date":"2021-05-29","stage_classifiercode":"09-04","member_number":"A131562","first_name":"ASHLYN","last_name":"CHAMPAGNE","classification":"C","division":"PCC","hit_factor":6.9959},{"match_name":"EHPSA USPSA 26 August 2018","match_date":"2018-08-26","stage_classifiercode":"09-04","member_number":"L1063","first_name":"CHUCK","last_name":"BROOKS","classification":"A","division":"PCC","hit_factor":6.993},{"match_name":"CASA   USPSA  Dec 2018","match_date":"2018-12-01","stage_classifiercode":"09-04","member_number":"TY96041","first_name":"ERNIE","last_name":"DECKER","classification":"C","division":"PCC","hit_factor":6.9903},{"match_name":"ORPCI 2018.03.31 USPSA Special","match_date":"2018-03-31","stage_classifiercode":"09-04","member_number":"A53250","first_name":"DON","last_name":"SLUSHER","classification":"C","division":"PCC","hit_factor":6.9815},{"match_name":"TCSC USPSA Level I June club match","match_date":"2021-06-26","stage_classifiercode":"09-04","member_number":"A110246","first_name":"BEA","last_name":"L2","classification":"U","division":"PCC","hit_factor":6.9815},{"match_name":"Coyote USPSA  Classifier Match 8-22-17","match_date":"2017-08-23","stage_classifiercode":"09-04","member_number":"A99859","first_name":"DIEGO","last_name":"RODRIGUEZ","classification":"U","division":"PCC","hit_factor":6.9767},{"match_name":"PCGC USPSA July 2018","match_date":"2018-07-22","stage_classifiercode":"09-04","member_number":"TY72738","first_name":"MICHAEL","last_name":"THOMPSON","classification":"A","division":"PCC","hit_factor":6.9767},{"match_name":"H&H July Match","match_date":"2017-07-23","stage_classifiercode":"09-04","member_number":"A78454","first_name":"GRANT","last_name":"GAINES","classification":"A","division":"PCC","hit_factor":6.9767},{"match_name":"LA05 Tangi October Gator warm up match 2018","match_date":"2018-10-14","stage_classifiercode":"09-04","member_number":"TY66899","first_name":"JOHN","last_name":"HOFFMAN","classification":"C","division":"PCC","hit_factor":6.9479},{"match_name":"HPPS 6-19-2021","match_date":"2021-06-19","stage_classifiercode":"09-04","member_number":"A77605","first_name":"ALLEN","last_name":"NEVA","classification":"U","division":"PCC","hit_factor":6.9264},{"match_name":"Brazosland Pistoleros August 20 2017","match_date":"2017-08-20","stage_classifiercode":"09-04","member_number":"\"\"","first_name":"MICHAEL","last_name":"KELLETT","classification":"C","division":"PCC","hit_factor":6.9106},{"match_name":"BORCC USPSA March 2018 Classifier Match","match_date":"2018-03-24","stage_classifiercode":"09-04","member_number":"A95856","first_name":"DAVID","last_name":"HOEKSEMA","classification":"U","division":"PCC","hit_factor":6.9091},{"match_name":"CASA   USPSA  Dec 2018","match_date":"2018-12-01","stage_classifiercode":"09-04","member_number":"A70740","first_name":"RYAN","last_name":"REED","classification":"A","division":"PCC","hit_factor":6.9069},{"match_name":"LdF USPSA Match  March 24 2018","match_date":"2018-03-24","stage_classifiercode":"09-04","member_number":"A86645","first_name":"KELLY","last_name":"ZAMORA","classification":"C","division":"PCC","hit_factor":6.8966},{"match_name":"Shasta Shooters 2020 Jan","match_date":"2020-01-11","stage_classifiercode":"09-04","member_number":"A100575","first_name":"SCOTT","last_name":"JACKSON","classification":"M","division":"PCC","hit_factor":6.8852},{"match_name":"CFL07 WILLISTON PRACTICAL SHOOTERS CLUB","match_date":"2018-05-05","stage_classifiercode":"09-04","member_number":"a92823","first_name":"JANELLE","last_name":"WEATHERS","classification":"U","division":"PCC","hit_factor":6.8834},{"match_name":"Uspsa Classifier","match_date":"2018-05-06","stage_classifiercode":"09-04","member_number":"A102393","first_name":"JOHN","last_name":"VANDER MOLEN","classification":"U","division":"PCC","hit_factor":6.8817},{"match_name":"USPSA","match_date":"2020-12-06","stage_classifiercode":"09-04","member_number":"TY2958","first_name":"PETE","last_name":"CARPENTIER JR","classification":"B","division":"PCC","hit_factor":6.8702},{"match_name":"TPS USPSA at CMP July 21 2018","match_date":"2018-07-21","stage_classifiercode":"09-04","member_number":"FY54490","first_name":"JOHNATHAN","last_name":"ALVARADO","classification":"C","division":"PCC","hit_factor":6.8571},{"match_name":"PCGC October 2016","match_date":"2016-10-23","stage_classifiercode":"09-04","member_number":"\"\"","first_name":"CHRIS","last_name":"HENDERSON","classification":"\"\"","division":"PCC","hit_factor":6.8548},{"match_name":"BORCC USPSA March 2018 Classifier Match","match_date":"2018-03-24","stage_classifiercode":"09-04","member_number":"TY11389","first_name":"JEFF","last_name":"BING","classification":"C","division":"PCC","hit_factor":6.8548},{"match_name":"Rio Salado UPPL June 2020","match_date":"2020-06-14","stage_classifiercode":"09-04","member_number":"TY72937","first_name":"CHRISTOPHER","last_name":"OOSTHUISEN","classification":"M","division":"PCC","hit_factor":6.8536},{"match_name":"Springfield Tactical Shooters 03/04/2021","match_date":"2021-03-04","stage_classifiercode":"09-04","member_number":"A132269","first_name":"JOSH","last_name":"GRAY","classification":"U","division":"PCC","hit_factor":6.846},{"match_name":"BORCC USPSA August 2017","match_date":"2017-08-27","stage_classifiercode":"09-04","member_number":"L324","first_name":"MIKE","last_name":"BACA","classification":"U","division":"PCC","hit_factor":6.841},{"match_name":"ANPRACS USPSA12-17-17","match_date":"2017-12-17","stage_classifiercode":"09-04","member_number":"FY85802","first_name":"JOHN","last_name":"CLER","classification":"\"\"","division":"PCC","hit_factor":6.8182},{"match_name":"2019-03 USPSA at Shadow Hawk Defense","match_date":"2020-03-14","stage_classifiercode":"09-04","member_number":"A111754","first_name":"GEORGE","last_name":"TAMULA","classification":"B","division":"PCC","hit_factor":6.8143},{"match_name":"ANPRACS USPSA 6-17-18","match_date":"2018-06-17","stage_classifiercode":"09-04","member_number":"TY65829","first_name":"MICHAEL","last_name":"HANRAHAN","classification":"C","division":"PCC","hit_factor":6.8136},{"match_name":"SAGC CTX04 Monthly USPSA Match - October 2020","match_date":"2020-10-25","stage_classifiercode":"09-04","member_number":"fy96408","first_name":"LARRY","last_name":"ZIENTEK","classification":"B","division":"PCC","hit_factor":6.81},{"match_name":"LCAS August 2018 USPSA","match_date":"2018-08-04","stage_classifiercode":"09-04","member_number":"A99945","first_name":"ANDRES","last_name":"PADILLA","classification":"C","division":"PCC","hit_factor":6.8085},{"match_name":"Richmond Hot Shots 2018 USPSA Special Classifier Match - Jan 28 2018","match_date":"2018-01-28","stage_classifiercode":"09-04","member_number":"L2531","first_name":"BRIAN","last_name":"CHIN","classification":"U","division":"PCC","hit_factor":6.8053},{"match_name":"LPRGC - Lower Providence USPSA August 2018","match_date":"2018-08-04","stage_classifiercode":"09-04","member_number":"L4449","first_name":"AJ","last_name":"STUART","classification":"M","division":"PCC","hit_factor":6.7925},{"match_name":"August 2018 CAS USPSA","match_date":"2018-08-05","stage_classifiercode":"09-04","member_number":"TY66899","first_name":"JOHN","last_name":"HOFFMAN","classification":"C","division":"PCC","hit_factor":6.7873},{"match_name":"Dawg Valley USPSA April 14 2018","match_date":"2018-04-14","stage_classifiercode":"09-04","member_number":"\"\"","first_name":"LISA","last_name":"IVERSEN","classification":"\"\"","division":"PCC","hit_factor":6.7616},{"match_name":"SWGC USPSA Pistol Match - March 2021","match_date":"2021-03-06","stage_classifiercode":"09-04","member_number":"TY59220","first_name":"LARRY","last_name":"TALBOTT","classification":"A","division":"PCC","hit_factor":6.746},{"match_name":"OREGON ARPC CC05 USPSA APRIL 8 2017","match_date":"2017-04-08","stage_classifiercode":"09-04","member_number":"TY47743","first_name":"NORMAN","last_name":"BRIGHT","classification":"M","division":"PCC","hit_factor":6.746},{"match_name":"Blue Ridge Arsenal Nov 8 All Classifier match","match_date":"2018-11-08","stage_classifiercode":"09-04","member_number":"A104708","first_name":"HAO","last_name":"LUAN","classification":"U","division":"PCC","hit_factor":6.7376},{"match_name":"FLSC February Classifier Match","match_date":"2017-02-04","stage_classifiercode":"09-04","member_number":"A84170","first_name":"CHRIS","last_name":"VANDENBURG","classification":"U","division":"PCC","hit_factor":6.7164},{"match_name":"ANPRACS USPSA12-17-17","match_date":"2017-12-17","stage_classifiercode":"09-04","member_number":"FY83723","first_name":"BENJAMIN","last_name":"HIGGINS","classification":"A","division":"PCC","hit_factor":6.7138},{"match_name":"BORCC USPSA July 2018 Classifier Match","match_date":"2018-07-02","stage_classifiercode":"09-04","member_number":"A103922","first_name":"RIK","last_name":"OTT","classification":"U","division":"PCC","hit_factor":6.7114},{"match_name":"CSA Annual Classifier Classic","match_date":"2018-03-18","stage_classifiercode":"09-04","member_number":"TY8880","first_name":"GENE","last_name":"RICHMOND","classification":"C","division":"PCC","hit_factor":6.6986},{"match_name":"HRRB 11-20-2021","match_date":"2021-11-20","stage_classifiercode":"09-04","member_number":"A117692","first_name":"RODEL","last_name":"BAYSA","classification":"U","division":"PCC","hit_factor":6.6946},{"match_name":"WPGC 12-5-16","match_date":"2016-12-04","stage_classifiercode":"09-04","member_number":"A56290","first_name":"FRANK","last_name":"WINN","classification":"A","division":"PCC","hit_factor":6.6946},{"match_name":"SWGC USPSA Pistol Match - March 2021","match_date":"2021-03-06","stage_classifiercode":"09-04","member_number":"FY25813","first_name":"WILLIAM","last_name":"BRACEY","classification":"D","division":"PCC","hit_factor":6.6929},{"match_name":"RSPP 3rd Saturday January 2017","match_date":"2017-01-21","stage_classifiercode":"09-04","member_number":"FY41475","first_name":"DAVE","last_name":"SABIA","classification":"U","division":"PCC","hit_factor":6.6852},{"match_name":"WGC WI USPSA Monthly Match 4-21-18","match_date":"2018-04-21","stage_classifiercode":"09-04","member_number":"A43562","first_name":"NATHAN","last_name":"VESTAL","classification":"U","division":"PCC","hit_factor":6.6815},{"match_name":"CGC 10-14-2017","match_date":"2017-10-14","stage_classifiercode":"09-04","member_number":"A94603","first_name":"RONALDO","last_name":"BORGES","classification":"C","division":"PCC","hit_factor":6.6798},{"match_name":"Prescott Action Shooters 1st Saturday USPSA 5-01-21","match_date":"2021-05-01","stage_classifiercode":"09-04","member_number":"A-98325","first_name":"BRONCO","last_name":"LANE","classification":"B","division":"PCC","hit_factor":6.6798},{"match_name":"APSC USPSA 09-18-21","match_date":"2021-09-18","stage_classifiercode":"09-04","member_number":"A83616","first_name":"LELAND","last_name":"JOHNSON","classification":"C","division":"PCC","hit_factor":6.6778},{"match_name":"CSA Annual Classifier Classic","match_date":"2018-03-18","stage_classifiercode":"09-04","member_number":"FY54303","first_name":"DANA","last_name":"CAMPBELL","classification":"U","division":"PCC","hit_factor":6.6667},{"match_name":"MISS USPSA 5-30-18","match_date":"2018-05-30","stage_classifiercode":"09-04","member_number":"A85284","first_name":"ROMAN","last_name":"HRUSKA","classification":"A","division":"PCC","hit_factor":6.6667},{"match_name":"SLOSA February 2018 USPSA MATCH","match_date":"2018-02-10","stage_classifiercode":"09-04","member_number":"\"\"","first_name":"KYLE","last_name":"CARSON","classification":"X","division":"PCC","hit_factor":6.6667},{"match_name":"Maine Pracrical Shooters-July 2017 USPSA","match_date":"2017-07-09","stage_classifiercode":"09-04","member_number":"A65806","first_name":"BRIAN","last_name":"KRAMPERT","classification":"D","division":"PCC","hit_factor":6.6543},{"match_name":"CGC 10-14-2017","match_date":"2017-10-14","stage_classifiercode":"09-04","member_number":"TY94807","first_name":"JIM","last_name":"GARNER","classification":"U","division":"PCC","hit_factor":6.6519},{"match_name":"NAAS 2018-04-15","match_date":"2018-04-15","stage_classifiercode":"09-04","member_number":"L1028","first_name":"SANCHO","last_name":"EUSEBIO","classification":"A","division":"PCC","hit_factor":6.6508},{"match_name":"Grandbaggers December 2017","match_date":"2017-12-07","stage_classifiercode":"09-04","member_number":"FY51387","first_name":"WILLIAM","last_name":"HOLLON","classification":"C","division":"PCC","hit_factor":6.6421},{"match_name":"JCSSA Aug2017","match_date":"2017-08-04","stage_classifiercode":"09-04","member_number":"A75201","first_name":"KEN","last_name":"SYDOW","classification":"D","division":"PCC","hit_factor":6.6406},{"match_name":"RSPP 3rd Saturday January 2017","match_date":"2017-01-21","stage_classifiercode":"09-04","member_number":"TY46374","first_name":"LARRY","last_name":"STOKES","classification":"U","division":"PCC","hit_factor":6.6406},{"match_name":"DWB - Deadwood Boys USPSA 20 September 2020  Classifier Match Makeup","match_date":"2020-09-20","stage_classifiercode":"09-04","member_number":"TY120064","first_name":"JEFF","last_name":"SHLAKMAN","classification":"U","division":"PCC","hit_factor":6.6298},{"match_name":"RSPP 3rd Saturday January 2017","match_date":"2017-01-21","stage_classifiercode":"09-04","member_number":"TY65635","first_name":"CHRIS","last_name":"COLLINS","classification":"U","division":"PCC","hit_factor":6.6277},{"match_name":"PRG-USPSA - Oh Shoot November 15th - 3rd Sunday","match_date":"2020-11-15","stage_classifiercode":"09-04","member_number":"TY73599","first_name":"DAVID","last_name":"PRICE","classification":"C","division":"PCC","hit_factor":6.6253},{"match_name":"CSA Annual Classifier Classic","match_date":"2018-03-18","stage_classifiercode":"09-04","member_number":"L4135","first_name":"TOM","last_name":"SARGENT","classification":"U","division":"PCC","hit_factor":6.6202},{"match_name":"Space Coast Practical Shooters","match_date":"2018-04-07","stage_classifiercode":"09-04","member_number":"A56832","first_name":"DON","last_name":"PODSIADLO","classification":"D","division":"PCC","hit_factor":6.6116},{"match_name":"TGC USPSA June 2018","match_date":"2018-06-16","stage_classifiercode":"09-04","member_number":"a44650","first_name":"DARRELL","last_name":"DAUDE","classification":"C","division":"PCC","hit_factor":6.6055},{"match_name":"ARPC USPSA Match 11-29-20","match_date":"2020-11-29","stage_classifiercode":"09-04","member_number":"TY92234","first_name":"BOB","last_name":"KOKOTOVICH","classification":"A","division":"PCC","hit_factor":6.6038},{"match_name":"FLSC February Classifier Match","match_date":"2017-02-04","stage_classifiercode":"09-04","member_number":"A27034","first_name":"BILL","last_name":"HARTMAN","classification":"U","division":"PCC","hit_factor":6.5858},{"match_name":"Coyote USPSA  Classifier Match 8-22-17","match_date":"2017-08-23","stage_classifiercode":"09-04","member_number":"Ty44301","first_name":"BOB","last_name":"BELL","classification":"D","division":"PCC","hit_factor":6.5764},{"match_name":"Richmond Hot Shots 2018 USPSA Special Classifier Match - Jan 28 2018","match_date":"2018-01-28","stage_classifiercode":"09-04","member_number":"A100462","first_name":"TOM","last_name":"CAMPBELL","classification":"U","division":"PCC","hit_factor":6.5637},{"match_name":"Taxman Special ORSA USPSA 21 Apr 2018","match_date":"2018-04-21","stage_classifiercode":"09-04","member_number":"A107013","first_name":"MATT","last_name":"MALONE","classification":"B","division":"PCC","hit_factor":6.5574},{"match_name":"  Maine Practical Shooters August 2020","match_date":"2020-08-08","stage_classifiercode":"09-04","member_number":"A84220","first_name":"CHRIS","last_name":"NOWINSKI","classification":"U","division":"PCC","hit_factor":6.5574},{"match_name":"HSA USPSA January 2020","match_date":"2020-01-08","stage_classifiercode":"09-04","member_number":"32792","first_name":"JOANNA","last_name":"LENCZEWSKA","classification":"U","division":"PCC","hit_factor":6.5502},{"match_name":"JCSSA Aug2017","match_date":"2017-08-04","stage_classifiercode":"09-04","member_number":"A98941","first_name":"JAMIE","last_name":"GILDER","classification":"\"\"","division":"PCC","hit_factor":6.544},{"match_name":"Medford USPSA  June 2020","match_date":"2020-06-21","stage_classifiercode":"09-04","member_number":"A24497","first_name":"TOM","last_name":"CAIL","classification":"B","division":"PCC","hit_factor":6.5341},{"match_name":"CRAG USPSA 6-13-2020","match_date":"2020-06-13","stage_classifiercode":"09-04","member_number":"Ty29750","first_name":"CRAIG","last_name":"BOYD","classification":"M","division":"PCC","hit_factor":6.5292},{"match_name":"LdF USPSA Match  March 24 2018","match_date":"2018-03-24","stage_classifiercode":"09-04","member_number":"L4294","first_name":"ALAN","last_name":"JENKINS","classification":"M","division":"PCC","hit_factor":6.5292},{"match_name":"Taxman Special ORSA USPSA 21 Apr 2018","match_date":"2018-04-21","stage_classifiercode":"09-04","member_number":"A98757","first_name":"DENNIS","last_name":"KRIEGER","classification":"C","division":"PCC","hit_factor":6.5268},{"match_name":"WGC WI USPSA Monthly Match 4-21-18","match_date":"2018-04-21","stage_classifiercode":"09-04","member_number":"L2222","first_name":"DAN","last_name":"VESTAL","classification":"U","division":"PCC","hit_factor":6.5268},{"match_name":"XMG USPSA March 20 2021","match_date":"2021-03-20","stage_classifiercode":"09-04","member_number":"A116131","first_name":"DAVE","last_name":"REID","classification":"B","division":"PCC","hit_factor":6.5268},{"match_name":"ARPC USPSA Match 11-25-18","match_date":"2018-11-25","stage_classifiercode":"09-04","member_number":"A67988","first_name":"WILLIAM","last_name":"LEMEN","classification":"C","division":"PCC","hit_factor":6.5259},{"match_name":"Kidlat February Club Match","match_date":"2017-02-04","stage_classifiercode":"09-04","member_number":"TY84396","first_name":"MIKE","last_name":"WILSON","classification":"U","division":"PCC","hit_factor":6.4982},{"match_name":"August 2018 CAS USPSA","match_date":"2018-08-05","stage_classifiercode":"09-04","member_number":"TY89705","first_name":"BOB","last_name":"GONZALEZ","classification":"U","division":"PCC","hit_factor":6.4982},{"match_name":"Springfield Tactical Shooters 03/04/2021","match_date":"2021-03-04","stage_classifiercode":"09-04","member_number":"A55905","first_name":"BARRY","last_name":"OLIVER","classification":"B","division":"PCC","hit_factor":6.4965},{"match_name":"Griffin USPSA December 17 2016","match_date":"2016-12-17","stage_classifiercode":"09-04","member_number":"TY84121","first_name":"GABOR","last_name":"MAGONY","classification":"B","division":"PCC","hit_factor":6.4885},{"match_name":"LPRGC - Lower Providence USPSA July 2017","match_date":"2017-07-01","stage_classifiercode":"09-04","member_number":"A53984","first_name":"RICK","last_name":"VAHALY","classification":"U","division":"PCC","hit_factor":6.4748},{"match_name":"USPSA","match_date":"2017-03-05","stage_classifiercode":"09-04","member_number":"TY90467","first_name":"JEFF","last_name":"WOODS","classification":"\"\"","division":"PCC","hit_factor":6.4516},{"match_name":"TBAS USPSA Match 2/23/20","match_date":"2020-02-23","stage_classifiercode":"09-04","member_number":"A117925","first_name":"HEIDI","last_name":"CONLON","classification":"U","division":"PCC","hit_factor":6.4516},{"match_name":"Oh Shoot-PRG  May 2nd - 1st Sunday Match","match_date":"2021-05-02","stage_classifiercode":"09-04","member_number":"Ty33624","first_name":"ERIC","last_name":"CANSICIO","classification":"B","division":"PCC","hit_factor":6.4378},{"match_name":"Rio Salado UPPL June 2020","match_date":"2020-06-14","stage_classifiercode":"09-04","member_number":"B73","first_name":"JOHN","last_name":"CATTERALL","classification":"C","division":"PCC","hit_factor":6.4286},{"match_name":"Bare Arms Apr 21/2018","match_date":"2018-04-21","stage_classifiercode":"09-04","member_number":"\"\"","first_name":"KEVIN","last_name":"CHRISTIAN","classification":"\"\"","division":"PCC","hit_factor":6.4272},{"match_name":"Emmett November Match","match_date":"2018-11-24","stage_classifiercode":"09-04","member_number":"TY87846","first_name":"JOHN","last_name":"JENSEN","classification":"U","division":"PCC","hit_factor":6.4272},{"match_name":"RSPP 3rd Saturday January 2018","match_date":"2018-01-20","stage_classifiercode":"09-04","member_number":"TY37812","first_name":"SAL","last_name":"WONG","classification":"U","division":"PCC","hit_factor":6.4272},{"match_name":"CVSC 04-22-2018","match_date":"2018-04-22","stage_classifiercode":"09-04","member_number":"TY109346","first_name":"MADDUX","last_name":"LE","classification":"U","division":"PCC","hit_factor":6.4257},{"match_name":"Palmetto Gun Club - February 2018 USPSA","match_date":"2018-02-03","stage_classifiercode":"09-04","member_number":"A17751","first_name":"RICK","last_name":"TERHUNE","classification":"C","division":"PCC","hit_factor":6.4189},{"match_name":"CAPS 7-22-2017","match_date":"2017-07-22","stage_classifiercode":"09-04","member_number":"A64300","first_name":"JOHN","last_name":"COOK","classification":"C","division":"PCC","hit_factor":6.4151},{"match_name":"Chillicothe April-2017 USPSA Match","match_date":"2017-04-23","stage_classifiercode":"09-04","member_number":"A81914","first_name":"JIM","last_name":"RIPPER","classification":"U","division":"PCC","hit_factor":6.4128},{"match_name":"Springfield Tactical Shooters 03/04/2021","match_date":"2021-03-04","stage_classifiercode":"09-04","member_number":"FY83614","first_name":"GARY","last_name":"GRAY","classification":"B","division":"PCC","hit_factor":6.4},{"match_name":"Space Coast Practical Shooters","match_date":"2018-04-07","stage_classifiercode":"09-04","member_number":"A105052","first_name":"RAY","last_name":"MACKOWSKI","classification":"C","division":"PCC","hit_factor":6.3781},{"match_name":"Bare Arms Apr 21/2018","match_date":"2018-04-21","stage_classifiercode":"09-04","member_number":"TY42975","first_name":"JASON","last_name":"RATLIFF","classification":"M","division":"PCC","hit_factor":6.3559},{"match_name":"Uspsa Classifier","match_date":"2018-05-06","stage_classifiercode":"09-04","member_number":"TYF95245","first_name":"JOHN","last_name":"MUSCAT","classification":"U","division":"PCC","hit_factor":6.3492},{"match_name":"Coyote USPSA  Classifier Match 8-22-17","match_date":"2017-08-23","stage_classifiercode":"09-04","member_number":"TY87589","first_name":"BOB","last_name":"ALDERMAN","classification":"U","division":"PCC","hit_factor":6.3433},{"match_name":"Richmond Hot Shots 2018 USPSA Special Classifier Match - Jan 28 2018","match_date":"2018-01-28","stage_classifiercode":"09-04","member_number":"A88398","first_name":"DAN","last_name":"PEKNIK","classification":"C","division":"PCC","hit_factor":6.3197},{"match_name":"EWPSA  2018-02","match_date":"2018-02-18","stage_classifiercode":"09-04","member_number":"TY82325","first_name":"PAM","last_name":"HARPER","classification":"U","division":"PCC","hit_factor":6.3158},{"match_name":"Castlewood USPSA Sept 2020 shoot","match_date":"2020-09-26","stage_classifiercode":"09-04","member_number":"A129887","first_name":"JOHNNY","last_name":"WOLFE","classification":"U","division":"PCC","hit_factor":6.2963},{"match_name":"PCGC USPSA July 2018","match_date":"2018-07-22","stage_classifiercode":"09-04","member_number":"TY8880","first_name":"GENE","last_name":"RICHMOND","classification":"B","division":"PCC","hit_factor":6.2954},{"match_name":"Idaho ISPS September 1st 2018","match_date":"2018-09-01","stage_classifiercode":"09-04","member_number":"A80359","first_name":"JD","last_name":"MCCORD","classification":"C","division":"PCC","hit_factor":6.2762},{"match_name":"5 Dogs October USPSA 2020","match_date":"2020-10-04","stage_classifiercode":"09-04","member_number":"TY82952","first_name":"STUART","last_name":"GORDON","classification":"U","division":"PCC","hit_factor":6.2603},{"match_name":"YRPA  USPSA June 2018","match_date":"2018-06-23","stage_classifiercode":"09-04","member_number":"TY61539","first_name":"ANN","last_name":"BLOSSER","classification":"A","division":"PCC","hit_factor":6.25},{"match_name":"TBAS USPSA Match 2/23/20","match_date":"2020-02-23","stage_classifiercode":"09-04","member_number":"FY102188","first_name":"CORY","last_name":"GOFF","classification":"B","division":"PCC","hit_factor":6.25},{"match_name":"Richmond Hot Shots August 6-7 USPSA Pistol Match","match_date":"2016-08-06","stage_classifiercode":"09-04","member_number":"TY33484","first_name":"CARLOS","last_name":"KATALBAS","classification":"U","division":"PCC","hit_factor":6.2193},{"match_name":"Medford USPSA  June 2020","match_date":"2020-06-21","stage_classifiercode":"09-04","member_number":"A20753","first_name":"EDWARD","last_name":"VERNON","classification":"B","division":"PCC","hit_factor":6.2136},{"match_name":"Hawkeye Feb Match","match_date":"2017-02-18","stage_classifiercode":"09-04","member_number":"A86799","first_name":"BILL","last_name":"ROACH","classification":"C","division":"PCC","hit_factor":6.2053},{"match_name":"SSPSC USPSA  June 6-7 2020","match_date":"2020-06-04","stage_classifiercode":"09-04","member_number":"A75516","first_name":"CRAIG","last_name":"NORFLEET","classification":"","division":"PCC","hit_factor":6.1983},{"match_name":"FLSC February Classifier Match","match_date":"2017-02-04","stage_classifiercode":"09-04","member_number":"A90576","first_name":"CHARLIE","last_name":"ONAN","classification":"U","division":"PCC","hit_factor":6.1931},{"match_name":"USPSA","match_date":"2017-03-05","stage_classifiercode":"09-04","member_number":"A98545","first_name":"JAMES","last_name":"ARMENTROUT","classification":"\"\"","division":"PCC","hit_factor":6.1931},{"match_name":"Maine Practical Shooters May 2018","match_date":"2018-05-12","stage_classifiercode":"09-04","member_number":"A65806","first_name":"BRIAN","last_name":"KRAMPERT","classification":"C","division":"PCC","hit_factor":6.1706},{"match_name":"Coyote USPSA  Classifier Match 8-22-17","match_date":"2017-08-23","stage_classifiercode":"09-04","member_number":"a45644","first_name":"TRACY","last_name":"SELF","classification":"U","division":"PCC","hit_factor":6.1674},{"match_name":"SWGC USPSA Pistol Match - March 2021","match_date":"2021-03-06","stage_classifiercode":"09-04","member_number":"FY62418","first_name":"RAY","last_name":"WINKEL","classification":"C","division":"PCC","hit_factor":6.1538},{"match_name":"AIPS  USPSA Weekly 25 July 2017","match_date":"2017-07-25","stage_classifiercode":"09-04","member_number":"TY76232","first_name":"DAN","last_name":"KESTER","classification":"Unclassified","division":"PCC","hit_factor":6.1538},{"match_name":"Coyote USPSA  Classifier Match 8-22-17","match_date":"2017-08-23","stage_classifiercode":"09-04","member_number":"ty85728","first_name":"BOBBI","last_name":"HOLLAND","classification":"U","division":"PCC","hit_factor":6.1372},{"match_name":"PRG-USPSA - Oh Shoot November 15th - 3rd Sunday","match_date":"2020-11-15","stage_classifiercode":"09-04","member_number":"A126733","first_name":"ALEX","last_name":"SEGISMUNDO","classification":"U","division":"PCC","hit_factor":6.1329},{"match_name":"NAAS 2018-04-15","match_date":"2018-04-15","stage_classifiercode":"09-04","member_number":"A80807","first_name":"JON","last_name":"WASHER","classification":"A","division":"PCC","hit_factor":6.1093},{"match_name":"LRC USPSA October 2020","match_date":"2020-10-03","stage_classifiercode":"09-04","member_number":"A128576","first_name":"TIM","last_name":"CUTTING","classification":"D","division":"PCC","hit_factor":6.1017},{"match_name":"2020-10 Bone Creek USPSA","match_date":"2020-10-04","stage_classifiercode":"09-04","member_number":"A108675","first_name":"JERRY","last_name":"MCCULLICK","classification":"A","division":"PCC","hit_factor":6.0976},{"match_name":"PCGC October 2016","match_date":"2016-10-23","stage_classifiercode":"09-04","member_number":"L3887","first_name":"ADAM","last_name":"BIRKHIMER","classification":"U","division":"PCC","hit_factor":6.0606},{"match_name":"PTPC February 4th Classifier Match","match_date":"2018-02-04","stage_classifiercode":"09-04","member_number":"L4223","first_name":"DARRYL","last_name":"DOUGHERTY","classification":"A","division":"PCC","hit_factor":6.051},{"match_name":"Palmetto Gun Club - February 2018 USPSA","match_date":"2018-02-03","stage_classifiercode":"09-04","member_number":"\"\"","first_name":"RICHARD","last_name":"GUERRERO","classification":"U","division":"PCC","hit_factor":6.0491},{"match_name":"CGC 10-14-2017","match_date":"2017-10-14","stage_classifiercode":"09-04","member_number":"TY75767","first_name":"BUDDY","last_name":"BRIDWELL","classification":"C","division":"PCC","hit_factor":6.0413},{"match_name":"Castlewood USPSA Sept 2020 shoot","match_date":"2020-09-26","stage_classifiercode":"09-04","member_number":"CA240","first_name":"DAN","last_name":"SMITH","classification":"U","division":"PCC","hit_factor":6.0317},{"match_name":"PCSI USPSA 2-1-20","match_date":"2020-02-01","stage_classifiercode":"09-04","member_number":"FY92359","first_name":"TONY","last_name":"WELLS","classification":"M","division":"PCC","hit_factor":6.0284},{"match_name":"Palmetto Gun Club - February 2018 USPSA","match_date":"2018-02-03","stage_classifiercode":"09-04","member_number":"\"\"","first_name":"JEFF","last_name":"WADE","classification":"U","division":"PCC","hit_factor":6.0284},{"match_name":"NTPS-SE January 2018","match_date":"2018-01-20","stage_classifiercode":"09-04","member_number":"\"\"","first_name":"JOHN","last_name":"MASON","classification":"U","division":"PCC","hit_factor":6.0264},{"match_name":"WVRPC USPSA 3SEPT2016","match_date":"2016-09-03","stage_classifiercode":"09-04","member_number":"\"\"","first_name":"DAVID","last_name":"REPPERT","classification":"none","division":"PCC","hit_factor":6.0201},{"match_name":"NAAS 2018-04-15","match_date":"2018-04-15","stage_classifiercode":"09-04","member_number":"TY54348","first_name":"JOEL","last_name":"THOMAS","classification":"U","division":"PCC","hit_factor":6.0201},{"match_name":"Bare Arms Apr 21/2018","match_date":"2018-04-21","stage_classifiercode":"09-04","member_number":"\"\"","first_name":"SABASTIAN","last_name":"YOUNG","classification":"\"\"","division":"PCC","hit_factor":6.0127},{"match_name":"TPS USPSA at CMP July 21 2018","match_date":"2018-07-21","stage_classifiercode":"09-04","member_number":"A94603","first_name":"RONALDO","last_name":"BORGES","classification":"B","division":"PCC","hit_factor":5.9896},{"match_name":"IPSC93 September 2020","match_date":"2020-09-28","stage_classifiercode":"09-04","member_number":"A100606","first_name":"MARK","last_name":"HARDY","classification":"U","division":"PCC","hit_factor":5.988},{"match_name":"NAAS 08-19-2018","match_date":"2018-08-19","stage_classifiercode":"09-04","member_number":"A80807","first_name":"JON","last_name":"WASHER","classification":"A","division":"PCC","hit_factor":5.9859},{"match_name":"Sharp Practical Shooters March USPSA Match","match_date":"2018-03-25","stage_classifiercode":"09-04","member_number":"a12478","first_name":"ROBERT","last_name":"CLAIR","classification":"U","division":"PCC","hit_factor":5.9801},{"match_name":"TPS USPSA at CMP July 21 2018","match_date":"2018-07-21","stage_classifiercode":"09-04","member_number":"TY78088","first_name":"MIKE","last_name":"GOEBEL","classification":"C","division":"PCC","hit_factor":5.9649},{"match_name":"Bayou City USPSA Weekly June 28","match_date":"2018-06-28","stage_classifiercode":"09-04","member_number":"A107489","first_name":"CHARLES","last_name":"BRADBURY","classification":"U","division":"PCC","hit_factor":5.949},{"match_name":"RPGi USPSA Last Minute Match 29 May 2021","match_date":"2021-05-29","stage_classifiercode":"09-04","member_number":"A99202","first_name":"RUSS","last_name":"SCHREINER","classification":"U","division":"PCC","hit_factor":5.9406},{"match_name":"PRG-USPSA - Oh Shoot November 15th - 3rd Sunday","match_date":"2020-11-15","stage_classifiercode":"09-04","member_number":"A10270","first_name":"DANNY","last_name":"DE JESUS","classification":"M","division":"PCC","hit_factor":5.9375},{"match_name":"SFPC Annual Picnic Match","match_date":"2017-02-12","stage_classifiercode":"09-04","member_number":"TY90993","first_name":"WAYNE","last_name":"OWENSBY","classification":"U","division":"PCC","hit_factor":5.9337},{"match_name":"USPSA","match_date":"2020-12-06","stage_classifiercode":"09-04","member_number":"A35452","first_name":"ALAN","last_name":"CLARK","classification":"\"\"","division":"PCC","hit_factor":5.9282},{"match_name":"Prescott Action Shooters 1st Saturday USPSA 5-01-21","match_date":"2021-05-01","stage_classifiercode":"09-04","member_number":"A72667","first_name":"KEN","last_name":"STUBBE","classification":"C","division":"PCC","hit_factor":5.9282},{"match_name":"GPS May 2018","match_date":"2018-05-20","stage_classifiercode":"09-04","member_number":"A85089","first_name":"JOEL","last_name":"CRUZ","classification":"U","division":"PCC","hit_factor":5.915},{"match_name":"CTASA - 3rd Sunday USPSA at Triple C Range - 6-21-2020","match_date":"2020-06-21","stage_classifiercode":"09-04","member_number":"TY72525","first_name":"MARK","last_name":"DAVIS","classification":"C","division":"PCC","hit_factor":5.9098},{"match_name":"Steel City USPSA April 1 2017","match_date":"2017-04-01","stage_classifiercode":"09-04","member_number":"TY78088","first_name":"MIKE","last_name":"GOEBEL","classification":"C","division":"PCC","hit_factor":5.9098},{"match_name":"Coastal Area Practical Shooters 7-23-16","match_date":"2016-07-23","stage_classifiercode":"09-04","member_number":"TY83837","first_name":"BOB","last_name":"GUNDEL","classification":"U","division":"PCC","hit_factor":5.9016},{"match_name":"LdF USPSA Match September 5 2021","match_date":"2021-09-05","stage_classifiercode":"09-04","member_number":"TY46745","first_name":"DANIEL","last_name":"STRAGIER","classification":"C","division":"PCC","hit_factor":5.8824},{"match_name":"RCPS USPSA October 13","match_date":"2018-10-13","stage_classifiercode":"09-04","member_number":"\"\"","first_name":"LEAH","last_name":"WIGGINS","classification":"C","division":"PCC","hit_factor":5.8824},{"match_name":"Rio Salado UPPL June 2020","match_date":"2020-06-14","stage_classifiercode":"09-04","member_number":"A114163","first_name":"STEVEN","last_name":"MERLA","classification":"D","division":"PCC","hit_factor":5.8728},{"match_name":"Blue Ridge Arsenal Nov 8 All Classifier match","match_date":"2018-11-08","stage_classifiercode":"09-04","member_number":"A108940","first_name":"LARRY","last_name":"KNOSP","classification":"C","division":"PCC","hit_factor":5.8722},{"match_name":"Castlewood USPSA Sept 2020 shoot","match_date":"2020-09-26","stage_classifiercode":"09-04","member_number":"not a member","first_name":"ROBERT","last_name":"MOLNAR","classification":"U","division":"PCC","hit_factor":5.8632},{"match_name":"RPGi USPSA Last Minute Match 29 May 2021","match_date":"2021-05-29","stage_classifiercode":"09-04","member_number":"A133333","first_name":"ASHLEE","last_name":"CAMPBELL","classification":"U","division":"PCC","hit_factor":5.8621},{"match_name":"EHPSA USPSA 26 August 2018","match_date":"2018-08-26","stage_classifiercode":"09-04","member_number":"A109635","first_name":"JENNIFER","last_name":"HOUDA","classification":"C","division":"PCC","hit_factor":5.8559},{"match_name":"NCPS USPSA Handgun Match July 22 2018a","match_date":"2018-07-22","stage_classifiercode":"09-04","member_number":"A88900","first_name":"JAYSON","last_name":"GAMBOA","classification":"C","division":"PCC","hit_factor":5.8455},{"match_name":"Springfield Tactical Shooters 03/04/2021","match_date":"2021-03-04","stage_classifiercode":"09-04","member_number":"A107625","first_name":"CHUCK","last_name":"MCLAUGHLIN","classification":"\"\"","division":"PCC","hit_factor":5.8394},{"match_name":"RSPP 3rd Saturday August 2018","match_date":"2018-08-18","stage_classifiercode":"09-04","member_number":"FY71052","first_name":"NEIL","last_name":"SORENSEN","classification":"U","division":"PCC","hit_factor":5.8319},{"match_name":"NAAS 2017-10-15","match_date":"2017-10-15","stage_classifiercode":"09-04","member_number":"TY54348","first_name":"JOEL","last_name":"THOMAS","classification":"A","division":"PCC","hit_factor":5.8288},{"match_name":"Renton USPSA April 2017","match_date":"2017-04-23","stage_classifiercode":"09-04","member_number":"a100047","first_name":"ANDRIA","last_name":"MORRIS","classification":"U","division":"PCC","hit_factor":5.8282},{"match_name":"HSA USPSA January 2020","match_date":"2020-01-08","stage_classifiercode":"09-04","member_number":"FY63095","first_name":"KENNETH","last_name":"ORTBACH","classification":"U","division":"PCC","hit_factor":5.7935},{"match_name":"Kidlat February Club Match","match_date":"2017-02-04","stage_classifiercode":"09-04","member_number":"TY86420","first_name":"BJ","last_name":"BURTON","classification":"B","division":"PCC","hit_factor":5.7851},{"match_name":"Rio Salado UPPL June 2020","match_date":"2020-06-14","stage_classifiercode":"09-04","member_number":"A115227","first_name":"DANA","last_name":"AMAGSILA","classification":"U","division":"PCC","hit_factor":5.7831},{"match_name":"Hawkeye Feb Match","match_date":"2017-02-18","stage_classifiercode":"09-04","member_number":"A94849","first_name":"KENT","last_name":"SILVERTHORN","classification":"C","division":"PCC","hit_factor":5.7762},{"match_name":"Puerto Rico USPSA Championship 2018","match_date":"2018-02-09","stage_classifiercode":"09-04","member_number":"A88194","first_name":"HECTOR","last_name":"ROSARIO SERRANO","classification":"U","division":"PCC","hit_factor":5.7725},{"match_name":"BORCC USPSA March 2018 Classifier Match","match_date":"2018-03-24","stage_classifiercode":"09-04","member_number":"TY77343","first_name":"JENNIFER","last_name":"WYATT","classification":"D","division":"PCC","hit_factor":5.7627},{"match_name":"Triforce Practical Shooters at BigWoodsGoods 4-26-18","match_date":"2018-04-26","stage_classifiercode":"09-04","member_number":"\"\"","first_name":"EARNEST","last_name":"JONES","classification":"U","division":"PCC","hit_factor":5.7613},{"match_name":"TPS USPSA at CMP July 21 2018","match_date":"2018-07-21","stage_classifiercode":"09-04","member_number":"TY83047","first_name":"FRANK","last_name":"POLACK","classification":"C","division":"PCC","hit_factor":5.76},{"match_name":"ORSA USPSA Dogs Days Of Summer August 2018","match_date":"2018-08-17","stage_classifiercode":"09-04","member_number":"A104850","first_name":"BRIAN","last_name":"FERGUSON","classification":"C","division":"PCC","hit_factor":5.7451},{"match_name":"Devil Dog USPSA Classifier Match-Saturday Session","match_date":"2018-03-10","stage_classifiercode":"09-04","member_number":"A109463","first_name":"MAX","last_name":"SEDA","classification":"U","division":"PCC","hit_factor":5.7432},{"match_name":"2019-03 USPSA at Shadow Hawk Defense","match_date":"2020-03-14","stage_classifiercode":"09-04","member_number":"A95966","first_name":"DAVID","last_name":"LANG","classification":"M","division":"PCC","hit_factor":5.7402},{"match_name":"Springfield Tactical Shooters 03/04/2021","match_date":"2021-03-04","stage_classifiercode":"09-04","member_number":"\"\"","first_name":"RICK","last_name":"WENNEBORG","classification":"\"\"","division":"PCC","hit_factor":5.7389},{"match_name":"Taxman Special ORSA USPSA 21 Apr 2018","match_date":"2018-04-21","stage_classifiercode":"09-04","member_number":"A104850","first_name":"BRIAN","last_name":"FERGUSON","classification":"U","division":"PCC","hit_factor":5.7336},{"match_name":"NAAS 2017-10-15","match_date":"2017-10-15","stage_classifiercode":"09-04","member_number":"\"\"","first_name":"BOBBY","last_name":"GRACEY","classification":"U","division":"PCC","hit_factor":5.7315},{"match_name":"2020-10 Bone Creek USPSA","match_date":"2020-10-04","stage_classifiercode":"09-04","member_number":"FY83466","first_name":"EMIL","last_name":"KASERMAN","classification":"U","division":"PCC","hit_factor":5.7252},{"match_name":"PCWC USPSA  6 23 2018","match_date":"2018-06-23","stage_classifiercode":"09-04","member_number":"Ty52476","first_name":"JOHN","last_name":"TISCHLER","classification":"A","division":"PCC","hit_factor":5.7221},{"match_name":"Shoot GTR USPSA  July 01 2018","match_date":"2018-07-01","stage_classifiercode":"09-04","member_number":"TY70086","first_name":"LARRY","last_name":"COLSON","classification":"C","division":"PCC","hit_factor":5.7143},{"match_name":"YRPA  USPSA June 2018","match_date":"2018-06-23","stage_classifiercode":"09-04","member_number":"A104946","first_name":"DUSTIN","last_name":"FERGUSON","classification":"U","division":"PCC","hit_factor":5.7052},{"match_name":"AVAP 9218","match_date":"2018-09-02","stage_classifiercode":"09-04","member_number":"A103780","first_name":"ALLEN","last_name":"RODIL","classification":"C","division":"PCC","hit_factor":5.7047},{"match_name":"WPGC 12-5-16","match_date":"2016-12-04","stage_classifiercode":"09-04","member_number":"A73532","first_name":"STEPHEN","last_name":"CASH","classification":"B","division":"PCC","hit_factor":5.7041},{"match_name":"Grandbaggers October 2017","match_date":"2017-10-05","stage_classifiercode":"09-04","member_number":"A77997","first_name":"TOM","last_name":"MCCONLOGUE","classification":"U","division":"PCC","hit_factor":5.6782},{"match_name":"Kidlat February Club Match","match_date":"2017-02-04","stage_classifiercode":"09-04","member_number":"FY71894","first_name":"NEAL","last_name":"NANDIN","classification":"U","division":"PCC","hit_factor":5.6693},{"match_name":"SFPC Annual Picnic Match","match_date":"2017-02-12","stage_classifiercode":"09-04","member_number":"A88436","first_name":"BOBBY","last_name":"DICKMANN","classification":"U","division":"PCC","hit_factor":5.6604},{"match_name":"CGC 10-14-2017","match_date":"2017-10-14","stage_classifiercode":"09-04","member_number":"\"\"","first_name":"GRANT","last_name":"SCOTT","classification":"U","division":"PCC","hit_factor":5.6604},{"match_name":"NISA June 2021","match_date":"2021-06-27","stage_classifiercode":"09-04","member_number":"Ty105933","first_name":"CRAIG","last_name":"SCHROEDER","classification":"B","division":"PCC","hit_factor":5.6604},{"match_name":"Rio Salado UPPL June 2020","match_date":"2020-06-14","stage_classifiercode":"09-04","member_number":"L4342","first_name":"RICHARD","last_name":"MACE","classification":"A","division":"PCC","hit_factor":5.6604},{"match_name":"WELD ECO09 20180415","match_date":"2018-04-15","stage_classifiercode":"09-04","member_number":"A88944","first_name":"FOREST","last_name":"LATHROP","classification":"B","division":"PCC","hit_factor":5.6537},{"match_name":"SSPSC USPSA  June 6-7 2020","match_date":"2020-06-04","stage_classifiercode":"09-04","member_number":"A102985","first_name":"JENN","last_name":"FERNANDEZ","classification":"U","division":"PCC","hit_factor":5.6537},{"match_name":"Richmond Hot Shots 2018 USPSA Special Classifier Match - Jan 28 2018","match_date":"2018-01-28","stage_classifiercode":"09-04","member_number":"A107946","first_name":"DAVID","last_name":"WEST","classification":"U","division":"PCC","hit_factor":5.6497},{"match_name":"Grandbaggers December 2017","match_date":"2017-12-07","stage_classifiercode":"09-04","member_number":"CL164","first_name":"BOB","last_name":"RIPPY","classification":"U","division":"PCC","hit_factor":5.6497},{"match_name":"Richmond Hot Shots 2018 USPSA Special Classifier Match - Jan 28 2018","match_date":"2018-01-28","stage_classifiercode":"09-04","member_number":"TY32822","first_name":"JERRY","last_name":"YAO","classification":"U","division":"PCC","hit_factor":5.6478},{"match_name":"G2G Practical Shooters September 14th USPSA Match","match_date":"2021-09-14","stage_classifiercode":"09-04","member_number":"A132627","first_name":"RALPH","last_name":"MIGRINO","classification":"D","division":"PCC","hit_factor":5.6478},{"match_name":"Puerto Rico USPSA Championship 2018","match_date":"2018-02-09","stage_classifiercode":"09-04","member_number":"\"\"","first_name":"FRANCISCO","last_name":"RODRIGUEZ DIAZ","classification":"U","division":"PCC","hit_factor":5.6478},{"match_name":"TBAS USPSA Match 2/23/20","match_date":"2020-02-23","stage_classifiercode":"09-04","member_number":"L4796","first_name":"ALEC","last_name":"LAUB","classification":"U","division":"PCC","hit_factor":5.6385},{"match_name":"PRG-USPSA - Oh Shoot November 15th - 3rd Sunday","match_date":"2020-11-15","stage_classifiercode":"09-04","member_number":"TY129989","first_name":"JASON","last_name":"JOVES","classification":"U","division":"PCC","hit_factor":5.6338},{"match_name":"Bayou City USPSA Weekly June 28","match_date":"2018-06-28","stage_classifiercode":"09-04","member_number":"\"\"","first_name":"DARIN","last_name":"OHO","classification":"U","division":"PCC","hit_factor":5.618},{"match_name":"Puerto Rico USPSA Championship 2018","match_date":"2018-02-09","stage_classifiercode":"09-04","member_number":"A90765","first_name":"HEBER","last_name":"SOTO","classification":"C","division":"PCC","hit_factor":5.6162},{"match_name":"Applied IN25 USPSA October 2017 Classifier","match_date":"2017-10-18","stage_classifiercode":"09-04","member_number":"L4004","first_name":"AARON","last_name":"LORTON1","classification":"B","division":"PCC","hit_factor":5.6075},{"match_name":"Richmond Hot Shots 2018 USPSA Special Classifier Match - Jan 28 2018","match_date":"2018-01-28","stage_classifiercode":"09-04","member_number":"TY98176","first_name":"TERI","last_name":"DEMMON","classification":"D","division":"PCC","hit_factor":5.6013},{"match_name":"Chillicothe April-2017 USPSA Match","match_date":"2017-04-23","stage_classifiercode":"09-04","member_number":"TY27544","first_name":"DON","last_name":"DANSBY","classification":"U","division":"PCC","hit_factor":5.597},{"match_name":"YRPA  USPSA June 2018","match_date":"2018-06-23","stage_classifiercode":"09-04","member_number":"NONE","first_name":"REESE","last_name":"CRENSHAW","classification":"X","division":"PCC","hit_factor":5.5814},{"match_name":"NW01 Winter Wonderland","match_date":"2017-01-08","stage_classifiercode":"09-04","member_number":"L465","first_name":"TOM","last_name":"KETTELLS","classification":"M","division":"PCC","hit_factor":5.58},{"match_name":"SAPSA October 2016","match_date":"2016-10-15","stage_classifiercode":"09-04","member_number":"TY70086","first_name":"LARRY","last_name":"COLSON","classification":"U","division":"PCC","hit_factor":5.5646},{"match_name":"Grandbaggers December 2017","match_date":"2017-12-07","stage_classifiercode":"09-04","member_number":"TY50145","first_name":"SUE","last_name":"LITTLE","classification":"U","division":"PCC","hit_factor":5.5646},{"match_name":"NCPS USPSA Handgun Match July 22 2018a","match_date":"2018-07-22","stage_classifiercode":"09-04","member_number":"TY85413","first_name":"PAOLO","last_name":"TANDOC","classification":"U","division":"PCC","hit_factor":5.5556},{"match_name":"B&R USPSA 6","match_date":"2018-06-30","stage_classifiercode":"09-04","member_number":"A89433","first_name":"JIM","last_name":"SHEETS","classification":"C","division":"PCC","hit_factor":5.5459},{"match_name":"Brazosland Pistoleros August 20 2017","match_date":"2017-08-20","stage_classifiercode":"09-04","member_number":"A77442","first_name":"MARY","last_name":"DUBUISSON","classification":"C","division":"PCC","hit_factor":5.5453},{"match_name":"PAS June 2018","match_date":"2018-06-14","stage_classifiercode":"09-04","member_number":"a70574","first_name":"MARK","last_name":"ZIEBART","classification":"U","division":"PCC","hit_factor":5.5394},{"match_name":"RPGi USPSA Last Minute Match 29 May 2021","match_date":"2021-05-29","stage_classifiercode":"09-04","member_number":"FY66838","first_name":"LINDY","last_name":"BAILEY","classification":"B","division":"PCC","hit_factor":5.5394},{"match_name":"HSA USPSA January 2020","match_date":"2020-01-08","stage_classifiercode":"09-04","member_number":"TY112148","first_name":"JOHN","last_name":"MARK","classification":"U","division":"PCC","hit_factor":5.53},{"match_name":"NAAS 08-19-2018","match_date":"2018-08-19","stage_classifiercode":"09-04","member_number":"A107729","first_name":"BOBBY","last_name":"DONNELLY","classification":"A","division":"PCC","hit_factor":5.5195},{"match_name":"PCWC USPSA  6 23 2018","match_date":"2018-06-23","stage_classifiercode":"09-04","member_number":"A65896","first_name":"JON","last_name":"YOUNG","classification":"B","division":"PCC","hit_factor":5.5147},{"match_name":"Extreme GM USPSA  April 11 classifier","match_date":"2021-04-10","stage_classifiercode":"09-04","member_number":"A130100","first_name":"ANTHONY","last_name":"DUCOS","classification":"D","division":"PCC","hit_factor":5.5046},{"match_name":"2019-03 USPSA at Shadow Hawk Defense","match_date":"2020-03-14","stage_classifiercode":"09-04","member_number":"TY-36345","first_name":"\"JOHN \"\"MIG\"\"\"","last_name":"MIGLIACCIO","classification":"A","division":"PCC","hit_factor":5.4839},{"match_name":"Kidlat February Club Match","match_date":"2017-02-04","stage_classifiercode":"09-04","member_number":"TY3880","first_name":"BILL","last_name":"MURRAY","classification":"U","division":"PCC","hit_factor":5.4745},{"match_name":"BSPSC 2017 April Special Classifier","match_date":"2017-04-09","stage_classifiercode":"09-04","member_number":"A4995","first_name":"JOEL","last_name":"PETERS","classification":"U","division":"PCC","hit_factor":5.4622},{"match_name":"DSS - USPSA - 21-07-24","match_date":"2021-07-24","stage_classifiercode":"09-04","member_number":"TV112916","first_name":"ED","last_name":"MONTGOMERY","classification":"\"\"","division":"PCC","hit_factor":5.4598},{"match_name":"Castlewood USPSA Sept 2020 shoot","match_date":"2020-09-26","stage_classifiercode":"09-04","member_number":"L-1919","first_name":"WILLIAM","last_name":"TRACY","classification":"U","division":"PCC","hit_factor":5.4575},{"match_name":"RSPP 3rd Saturday August 2018","match_date":"2018-08-18","stage_classifiercode":"09-04","member_number":"\"\"","first_name":"DANA","last_name":"AMAGSILA","classification":"U","division":"PCC","hit_factor":5.4475},{"match_name":"RSPP 3rd Saturday August 2018","match_date":"2018-08-18","stage_classifiercode":"09-04","member_number":"TY72239","first_name":"CINDY","last_name":"REDIES","classification":"U","division":"PCC","hit_factor":5.4463},{"match_name":"TGC USPSA June 2018","match_date":"2018-06-16","stage_classifiercode":"09-04","member_number":"A83616","first_name":"LELAND","last_name":"JOHNSON","classification":"C","division":"PCC","hit_factor":5.4381},{"match_name":"APSC USPSA Match 06-18-16","match_date":"2016-06-18","stage_classifiercode":"09-04","member_number":"\"\"","first_name":"BRENT","last_name":"CAMPBELL","classification":"B","division":"PCC","hit_factor":5.4146},{"match_name":"LRC USPSA October 2020","match_date":"2020-10-03","stage_classifiercode":"09-04","member_number":"TY101829","first_name":"MARC","last_name":"VETOVITZ","classification":"B","division":"PCC","hit_factor":5.3985},{"match_name":"BMPSA Feb 17 2018","match_date":"2018-02-17","stage_classifiercode":"09-04","member_number":"TY27768","first_name":"JEFF","last_name":"SODERQUIST","classification":"U","division":"PCC","hit_factor":5.3872},{"match_name":"Uspsa Classifier","match_date":"2018-05-06","stage_classifiercode":"09-04","member_number":"F107461","first_name":"SOON","last_name":"YONG","classification":"U","division":"PCC","hit_factor":5.3613},{"match_name":"Palmetto Gun Club - February 2018 USPSA","match_date":"2018-02-03","stage_classifiercode":"09-04","member_number":"A88255","first_name":"MARIO","last_name":"ACCARDO","classification":"U","division":"PCC","hit_factor":5.3537},{"match_name":"G2G November 9th USPSA ALL CLASSIFIER","match_date":"2021-11-09","stage_classifiercode":"09-04","member_number":"TY94508","first_name":"ANTHONY","last_name":"SMALLWOOD","classification":"B","division":"PCC","hit_factor":5.3292},{"match_name":"SLOSA February 2018 USPSA MATCH","match_date":"2018-02-10","stage_classifiercode":"09-04","member_number":"\"\"","first_name":"KESHA","last_name":"TOLER","classification":"U","division":"PCC","hit_factor":5.3097},{"match_name":"OREGON ARPC CC05 USPSA APRIL 8 2017","match_date":"2017-04-08","stage_classifiercode":"09-04","member_number":"A77086","first_name":"AARON","last_name":"GEISLER","classification":"U","division":"PCC","hit_factor":5.3042},{"match_name":"SWGC USPSA Pistol Match - March 2021","match_date":"2021-03-06","stage_classifiercode":"09-04","member_number":"TY23656","first_name":"RAY","last_name":"WELLS","classification":"B","division":"PCC","hit_factor":5.303},{"match_name":"Devil Dog USPSA Classifier Match-Sunday Session","match_date":"2018-03-11","stage_classifiercode":"09-04","member_number":"A93396","first_name":"MICHAEL","last_name":"COSTLEY","classification":"B","division":"PCC","hit_factor":5.2995},{"match_name":"5 Dogs October USPSA 2020","match_date":"2020-10-04","stage_classifiercode":"09-04","member_number":"A78107","first_name":"DAVID","last_name":"BRATCHER","classification":"U","division":"PCC","hit_factor":5.2877},{"match_name":"Richmond Hot Shots 2018 USPSA Special Classifier Match - Jan 28 2018","match_date":"2018-01-28","stage_classifiercode":"09-04","member_number":"TY84211","first_name":"GEORGE","last_name":"TY","classification":"B","division":"PCC","hit_factor":5.2752},{"match_name":"PTPC February 4th Classifier Match","match_date":"2018-02-04","stage_classifiercode":"09-04","member_number":"A77507","first_name":"LARRY","last_name":"HEMMENS","classification":"C","division":"PCC","hit_factor":5.2632},{"match_name":"PCSI USPSA July 3rd 2021 Patriot Match READ DESCRIPTION","match_date":"2021-07-03","stage_classifiercode":"09-04","member_number":"L2137","first_name":"RICK","last_name":"STEELE","classification":"C","division":"PCC","hit_factor":5.2506},{"match_name":"WGC USPSA Special Classifier 4-17-2021","match_date":"2021-04-17","stage_classifiercode":"09-04","member_number":"A133912","first_name":"AMY","last_name":"SCHROEDER","classification":"U","division":"PCC","hit_factor":5.2459},{"match_name":"RSPP 3rd Saturday January 2018","match_date":"2018-01-20","stage_classifiercode":"09-04","member_number":"FY74679","first_name":"RICHARD","last_name":"FORGUE","classification":"D","division":"PCC","hit_factor":5.2434},{"match_name":"SSPSC USPSA  June 6-7 2020","match_date":"2020-06-04","stage_classifiercode":"09-04","member_number":"TY98289","first_name":"BART","last_name":"CARTER","classification":"","division":"PCC","hit_factor":5.2265},{"match_name":"5 Dogs October USPSA 2020","match_date":"2020-10-04","stage_classifiercode":"09-04","member_number":"A111715","first_name":"BRYANT","last_name":"ASTLE","classification":"C","division":"PCC","hit_factor":5.2174},{"match_name":"DWB - Deadwood Boys USPSA 20 September 2020  Classifier Match Makeup","match_date":"2020-09-20","stage_classifiercode":"09-04","member_number":"A122400","first_name":"HENRY","last_name":"KIM","classification":"C","division":"PCC","hit_factor":5.1724},{"match_name":"Port Townsend Practical Pistol USPSA - October 6 2018","match_date":"2018-10-06","stage_classifiercode":"09-04","member_number":"A111193","first_name":"TODD","last_name":"JOHANSSON","classification":"U","division":"PCC","hit_factor":5.1724},{"match_name":"MISS Match 2-15-17","match_date":"2017-02-14","stage_classifiercode":"09-04","member_number":"TY71723","first_name":"JERRY","last_name":"SOLOMON","classification":"U","division":"PCC","hit_factor":5.163},{"match_name":"FLSC February Classifier Match","match_date":"2017-02-04","stage_classifiercode":"09-04","member_number":"A92341","first_name":"DAKOTA","last_name":"OVERLAND","classification":"U","division":"PCC","hit_factor":5.1613},{"match_name":"PTPC February 4th Classifier Match","match_date":"2018-02-04","stage_classifiercode":"09-04","member_number":"A73683","first_name":"BRYAN","last_name":"TECSON","classification":"A","division":"PCC","hit_factor":5.1515},{"match_name":"Steel City USPSA April 1 2017","match_date":"2017-04-01","stage_classifiercode":"09-04","member_number":"\"\"","first_name":"JAY","last_name":"RICHARDSON","classification":"X ","division":"PCC","hit_factor":5.1429},{"match_name":"Brazosland Pistoleros USPSA - Sunday September 12th","match_date":"2021-09-12","stage_classifiercode":"09-04","member_number":"FY73704","first_name":"GARY","last_name":"BRISCO","classification":"C","division":"PCC","hit_factor":5.1376},{"match_name":"TPS USPSA at CMP July 21 2018","match_date":"2018-07-21","stage_classifiercode":"09-04","member_number":"TY41492","first_name":"MARK","last_name":"HEARN","classification":"B","division":"PCC","hit_factor":5.136},{"match_name":"APSC USPSA 09-18-21","match_date":"2021-09-18","stage_classifiercode":"09-04","member_number":"A12134","first_name":"PAUL","last_name":"PAYNE","classification":"C","division":"PCC","hit_factor":5.1355},{"match_name":"IPSC93 September 2020","match_date":"2020-09-28","stage_classifiercode":"09-04","member_number":"A60231","first_name":"JOHN","last_name":"DUCKWORTH","classification":"B","division":"PCC","hit_factor":5.1282},{"match_name":"April 2017 OPSC USPSA","match_date":"2017-04-09","stage_classifiercode":"09-04","member_number":"A81447","first_name":"MIKE","last_name":"JAMES","classification":"X","division":"PCC","hit_factor":5.1282},{"match_name":"PRG-USPSA - Oh Shoot November 15th - 3rd Sunday","match_date":"2020-11-15","stage_classifiercode":"09-04","member_number":"TY130861","first_name":"ALAINA","last_name":"HICKS","classification":"U","division":"PCC","hit_factor":5.0934},{"match_name":"Coastal Area Practical Shooters 7-23-16","match_date":"2016-07-23","stage_classifiercode":"09-04","member_number":"A70288","first_name":"TED","last_name":"BROCK","classification":"X","division":"PCC","hit_factor":5.0898},{"match_name":"Coyote USPSA  Classifier Match 8-22-17","match_date":"2017-08-23","stage_classifiercode":"09-04","member_number":"A104864","first_name":"DINA","last_name":"TUNBERG","classification":"D","division":"PCC","hit_factor":5.0676},{"match_name":"SFPC Annual Picnic Match","match_date":"2017-02-12","stage_classifiercode":"09-04","member_number":"FY60057","first_name":"CARLOS","last_name":"NOGUERA","classification":"U","division":"PCC","hit_factor":5.0633},{"match_name":"Rio Salado UPPL June 2020","match_date":"2020-06-14","stage_classifiercode":"09-04","member_number":"A121959","first_name":"KEN","last_name":"ORGERON","classification":"A","division":"PCC","hit_factor":5.0595},{"match_name":"June 2021 USPSA Match at C and C Indoor Range","match_date":"2021-06-15","stage_classifiercode":"09-04","member_number":"A105181","first_name":"GREG","last_name":"LEITCH","classification":"B","division":"PCC","hit_factor":5.0526},{"match_name":"SSPSC USPSA  June 6-7 2020","match_date":"2020-06-04","stage_classifiercode":"09-04","member_number":"TY81615","first_name":"ALLEN","last_name":"WEINTRAUB","classification":"","division":"PCC","hit_factor":5.0505},{"match_name":"Richmond Hot Shots August 6-7 USPSA Pistol Match","match_date":"2016-08-06","stage_classifiercode":"09-04","member_number":"TY83559","first_name":"JOHN","last_name":"DANPOUR","classification":"U","division":"PCC","hit_factor":5.042},{"match_name":"Palmetto Gun Club - February 2018 USPSA","match_date":"2018-02-03","stage_classifiercode":"09-04","member_number":"TY22192","first_name":"ART","last_name":"BROWN","classification":"B","division":"PCC","hit_factor":5.0314},{"match_name":"NVSA USPSA 1806","match_date":"2018-06-03","stage_classifiercode":"09-04","member_number":"\"\"","first_name":"JAY","last_name":"KUCA","classification":"U","division":"PCC","hit_factor":5.0125},{"match_name":"TPS USPSA at CMP July 21 2018","match_date":"2018-07-21","stage_classifiercode":"09-04","member_number":"TY101310","first_name":"ARIEL","last_name":"ALVARADO","classification":"U","division":"PCC","hit_factor":5.0096},{"match_name":"GAS MAY 2020 USPSA SLOT MATCH","match_date":"2020-05-02","stage_classifiercode":"09-04","member_number":"A65854","first_name":"TAMMY","last_name":"NIELSEN","classification":"B","division":"PCC","hit_factor":5.0089},{"match_name":"YRPA  USPSA June 2018","match_date":"2018-06-23","stage_classifiercode":"09-04","member_number":"A106857","first_name":"CHRISTINA","last_name":"PAHL","classification":"D","division":"PCC","hit_factor":5.0078},{"match_name":"OREGON ARPC CC05 USPSA APRIL 8 2017","match_date":"2017-04-08","stage_classifiercode":"09-04","member_number":"A68175","first_name":"CHRIS","last_name":"GLODT","classification":"C","division":"PCC","hit_factor":4.9927},{"match_name":"HRRB 11-20-2021","match_date":"2021-11-20","stage_classifiercode":"09-04","member_number":"FY87328","first_name":"JIMRIZ","last_name":"ANCHETA","classification":"D","division":"PCC","hit_factor":4.9911},{"match_name":"Kidlat  May Club Match","match_date":"2017-05-06","stage_classifiercode":"09-04","member_number":"TY69476","first_name":"PETER PAUL","last_name":"ALCAZAREN","classification":"U","division":"PCC","hit_factor":4.9724},{"match_name":"RangeMasters 7-26-2018","match_date":"2018-07-26","stage_classifiercode":"09-04","member_number":"A97357","first_name":"JIM","last_name":"DIECKOW","classification":"D","division":"PCC","hit_factor":4.9673},{"match_name":"RangeMasters 3-29-18","match_date":"2018-03-29","stage_classifiercode":"09-04","member_number":"A97357","first_name":"JIM","last_name":"DIECKOW","classification":"U","division":"PCC","hit_factor":4.9635},{"match_name":"5 Dogs October USPSA 2020","match_date":"2020-10-04","stage_classifiercode":"09-04","member_number":"A97768","first_name":"KEN","last_name":"GONDER","classification":"B","division":"PCC","hit_factor":4.9524},{"match_name":"LdF USPSA Match  March 24 2018","match_date":"2018-03-24","stage_classifiercode":"09-04","member_number":"A88221","first_name":"JON","last_name":"BAUSTISTA","classification":"U","division":"PCC","hit_factor":4.9242},{"match_name":"CFL07 WILLISTON PRACTICAL SHOOTERS CLUB","match_date":"2018-05-05","stage_classifiercode":"09-04","member_number":"TY46072","first_name":"BOB","last_name":"GOSSELIN","classification":"C","division":"PCC","hit_factor":4.9231},{"match_name":"RSPP 3rd Saturday January 2017","match_date":"2017-01-21","stage_classifiercode":"09-04","member_number":"A48182","first_name":"RICH","last_name":"HIGGINS","classification":"U","division":"PCC","hit_factor":4.9116},{"match_name":"Springfield Tactical Shooters 03/04/2021","match_date":"2021-03-04","stage_classifiercode":"09-04","member_number":"A132269","first_name":"JOSH","last_name":"GRAY","classification":"U","division":"PCC","hit_factor":4.8837},{"match_name":"Dawg Valley USPSA April 14 2018","match_date":"2018-04-14","stage_classifiercode":"09-04","member_number":"A96708","first_name":"YURIY","last_name":"BORZENKO","classification":"\"\"","division":"PCC","hit_factor":4.878},{"match_name":"Grandbaggers December 2017","match_date":"2017-12-07","stage_classifiercode":"09-04","member_number":"A47213","first_name":"LARRY","last_name":"DRAKE","classification":"C","division":"PCC","hit_factor":4.8711},{"match_name":"SWGC USPSA Pistol Match - March 2021","match_date":"2021-03-06","stage_classifiercode":"09-04","member_number":"A123661","first_name":"DAVE","last_name":"HENDERSON","classification":"U","division":"PCC","hit_factor":4.8622},{"match_name":"ORSA USPSA Dogs Days Of Summer August 2018","match_date":"2018-08-17","stage_classifiercode":"09-04","member_number":"A99451","first_name":"STEVEN","last_name":"REDDING","classification":"C","division":"PCC","hit_factor":4.8583},{"match_name":"SAGC CTX04 Monthly USPSA Match - October 2020","match_date":"2020-10-25","stage_classifiercode":"09-04","member_number":"A127725","first_name":"DAN","last_name":"NGUYEN","classification":"C","division":"PCC","hit_factor":4.8507},{"match_name":"Taxman Special ORSA USPSA 21 Apr 2018","match_date":"2018-04-21","stage_classifiercode":"09-04","member_number":"TY96579","first_name":"DWIGHT","last_name":"RAINES","classification":"C","division":"PCC","hit_factor":4.8499},{"match_name":"Space Coast Practical Shooters","match_date":"2018-04-07","stage_classifiercode":"09-04","member_number":"FY85272","first_name":"TORY","last_name":"JORDAN","classification":"C","division":"PCC","hit_factor":4.8499},{"match_name":"Palmetto Gun Club - February 2018 USPSA","match_date":"2018-02-03","stage_classifiercode":"09-04","member_number":"A98997","first_name":"TODD","last_name":"SYSSA","classification":"U","division":"PCC","hit_factor":4.8452},{"match_name":"Uspsa Classifier","match_date":"2018-05-06","stage_classifiercode":"09-04","member_number":"TYF84385","first_name":"CRAIG","last_name":"RICHIE","classification":"U","division":"PCC","hit_factor":4.8387},{"match_name":"WELD ECO09 20180415","match_date":"2018-04-15","stage_classifiercode":"09-04","member_number":"A23079","first_name":"ARA","last_name":"MALJIAN","classification":"U","division":"PCC","hit_factor":4.8387},{"match_name":"RSPP 3rd Saturday January 2017","match_date":"2017-01-21","stage_classifiercode":"09-04","member_number":"TY66465","first_name":"JEFF","last_name":"WEGENER","classification":"U","division":"PCC","hit_factor":4.8346},{"match_name":"August Summers End Match","match_date":"2017-08-27","stage_classifiercode":"09-04","member_number":"a103143","first_name":"DOUGLAS","last_name":"GUSTAFSON","classification":"D","division":"PCC","hit_factor":4.8276},{"match_name":"BSPSC 2017 April Special Classifier","match_date":"2017-04-09","stage_classifiercode":"09-04","member_number":"TY43523","first_name":"JASON","last_name":"RITTER","classification":"U","division":"PCC","hit_factor":4.8223},{"match_name":"ARPC USPSA Match 11-25-18","match_date":"2018-11-25","stage_classifiercode":"09-04","member_number":"NONE","first_name":"DONOVAN","last_name":"MCDONALD","classification":"Unclassified","division":"PCC","hit_factor":4.8193},{"match_name":"Richmond Hot Shots 2018 USPSA Special Classifier Match - Jan 28 2018","match_date":"2018-01-28","stage_classifiercode":"09-04","member_number":"TY104839","first_name":"DUNCAN","last_name":"CLINE","classification":"U","division":"PCC","hit_factor":4.8023},{"match_name":"PTPC February 4th Classifier Match","match_date":"2018-02-04","stage_classifiercode":"09-04","member_number":"A89602","first_name":"CHARLEY","last_name":"APPLE","classification":"B","division":"PCC","hit_factor":4.8017},{"match_name":"NW01 March Madness 17","match_date":"2017-03-12","stage_classifiercode":"09-04","member_number":"TY53715","first_name":"DAN","last_name":"ORME","classification":"U","division":"PCC","hit_factor":4.7486},{"match_name":"PPPS 10-8-17","match_date":"2017-10-08","stage_classifiercode":"09-04","member_number":"L2598","first_name":"HOSER","last_name":"FREEMAN","classification":"\"\"","division":"PCC","hit_factor":4.7468},{"match_name":"Puerto Rico USPSA Championship 2018","match_date":"2018-02-09","stage_classifiercode":"09-04","member_number":"TY91054","first_name":"WILBERTO","last_name":"ALAMO","classification":"U","division":"PCC","hit_factor":4.7445},{"match_name":"PCSI USPSA July 3rd 2021 Patriot Match READ DESCRIPTION","match_date":"2021-07-03","stage_classifiercode":"09-04","member_number":"A110754","first_name":"AARON","last_name":"SELLERS","classification":"G","division":"PCC","hit_factor":4.7244},{"match_name":"USPSA","match_date":"2020-12-06","stage_classifiercode":"09-04","member_number":"A131752","first_name":"GABRIEL","last_name":"CLARK","classification":"\"\"","division":"PCC","hit_factor":4.7244},{"match_name":"Space Coast Practical Shooters","match_date":"2018-04-07","stage_classifiercode":"09-04","member_number":"A103877","first_name":"CORY","last_name":"GRIESSE","classification":"U","division":"PCC","hit_factor":4.7146},{"match_name":"Lenny Magill's Glockstore Nashville Indoor Level One USPSA NOVEMBER 13 2021 11\\13\\2021","match_date":"2021-11-12","stage_classifiercode":"09-04","member_number":"A41055","first_name":"TERRY","last_name":"GODFREY","classification":"C","division":"PCC","hit_factor":4.6667},{"match_name":"Brazosland Pistoleros August 20 2017","match_date":"2017-08-20","stage_classifiercode":"09-04","member_number":"TY97196","first_name":"DALE","last_name":"HAMM","classification":"U","division":"PCC","hit_factor":4.6512},{"match_name":"RSPP 3rd Saturday January 2017","match_date":"2017-01-21","stage_classifiercode":"09-04","member_number":"A49709","first_name":"JOHN","last_name":"BRINJAK","classification":"U","division":"PCC","hit_factor":4.6512},{"match_name":"NW01 Mt  Rainier Shadow April 20th 2021 Match","match_date":"2021-04-21","stage_classifiercode":"09-04","member_number":"ty63903","first_name":"BILL","last_name":"JOHNSTON","classification":"B","division":"PCC","hit_factor":4.6229},{"match_name":"OREGON ARPC CC05 USPSA APRIL 8 2017","match_date":"2017-04-08","stage_classifiercode":"09-04","member_number":"ty46746","first_name":"TREVOR","last_name":"OTT","classification":"U","division":"PCC","hit_factor":4.6053},{"match_name":"HPPS 6-19-2021","match_date":"2021-06-19","stage_classifiercode":"09-04","member_number":"NA","first_name":"RICHARD","last_name":"SAUNDERS","classification":"","division":"PCC","hit_factor":4.5872},{"match_name":"ARPC USPSA Match 11-25-18","match_date":"2018-11-25","stage_classifiercode":"09-04","member_number":"TY57677","first_name":"JOE","last_name":"SHADDUCK","classification":"Unclassified","division":"PCC","hit_factor":4.578},{"match_name":"Rio Salado UPPL June 2020","match_date":"2020-06-14","stage_classifiercode":"09-04","member_number":"L2359","first_name":"YVETTE","last_name":"LASS","classification":"U","division":"PCC","hit_factor":4.578},{"match_name":" 2018 \"","match_date":"2018-07-21","stage_classifiercode":"09-04","member_number":"TY82662","first_name":"PHIL","last_name":"DICKEY","classification":"C","division":"PCC","hit_factor":4.5726},{"match_name":"Oh Shoot-PRG  May 2nd - 1st Sunday Match","match_date":"2021-05-02","stage_classifiercode":"09-04","member_number":"A114513","first_name":"EDGAR","last_name":"LAGUILLES","classification":"U","division":"PCC","hit_factor":4.5714},{"match_name":"ARPC USPSA Match 11-29-20","match_date":"2020-11-29","stage_classifiercode":"09-04","member_number":"TY93949","first_name":"KEITH","last_name":"SHORT","classification":"C","division":"PCC","hit_factor":4.5635},{"match_name":"Brazosland Pistoleros August 20 2017","match_date":"2017-08-20","stage_classifiercode":"09-04","member_number":"A104379","first_name":"ALEX","last_name":"YORK","classification":"U","division":"PCC","hit_factor":4.5627},{"match_name":"IPSC93 September 2020","match_date":"2020-09-28","stage_classifiercode":"09-04","member_number":"A82195","first_name":"VICTORIA","last_name":"MOLNAR","classification":"U","division":"PCC","hit_factor":4.5519},{"match_name":"SWGC USPSA Pistol Match - March 2021","match_date":"2021-03-06","stage_classifiercode":"09-04","member_number":"TY125781","first_name":"ISAAC","last_name":"HANSEN","classification":"G","division":"PCC","hit_factor":4.5455},{"match_name":"LRC USPSA October 2020","match_date":"2020-10-03","stage_classifiercode":"09-04","member_number":"A97087","first_name":"JOSHUA","last_name":"HEUER","classification":"C","division":"PCC","hit_factor":4.5455},{"match_name":"RSPP 3rd Saturday January 2017","match_date":"2017-01-21","stage_classifiercode":"09-04","member_number":"TY77188","first_name":"PAT","last_name":"FISHER","classification":"U","division":"PCC","hit_factor":4.5346},{"match_name":"Puerto Rico USPSA Championship 2018","match_date":"2018-02-09","stage_classifiercode":"09-04","member_number":"A100581","first_name":"ERNESTO JOSE","last_name":"RODRIGUEZ","classification":"D","division":"PCC","hit_factor":4.5134},{"match_name":"JCSSA Aug2017","match_date":"2017-08-04","stage_classifiercode":"09-04","member_number":"TY79534","first_name":"CLINT","last_name":"BYER","classification":"C","division":"PCC","hit_factor":4.5007},{"match_name":"PRG-USPSA - Oh Shoot November 15th - 3rd Sunday","match_date":"2020-11-15","stage_classifiercode":"09-04","member_number":"A130857","first_name":"CHRISMINOV","last_name":"MARFIL","classification":"U","division":"PCC","hit_factor":4.4914},{"match_name":"DGC USPSA 07-26-20","match_date":"2020-07-26","stage_classifiercode":"09-04","member_number":"A120143","first_name":"KYLE","last_name":"BEAN","classification":"B","division":"PCC","hit_factor":4.4674},{"match_name":"Lafayette Practical Shooters - THURSDAY - Oct 18","match_date":"2018-10-18","stage_classifiercode":"09-04","member_number":"A111463","first_name":"REESE","last_name":"HAWLEY","classification":"U","division":"PCC","hit_factor":4.4402},{"match_name":"EWPSA  2018-02","match_date":"2018-02-18","stage_classifiercode":"09-04","member_number":"TY61539","first_name":"ANN","last_name":"BLOSSER","classification":"A","division":"PCC","hit_factor":4.4386},{"match_name":"OREGON ARPC CC05 USPSA APRIL 8 2017","match_date":"2017-04-08","stage_classifiercode":"09-04","member_number":"A-93052","first_name":"AREN","last_name":"GONZALEZ","classification":"U","division":"PCC","hit_factor":4.4304},{"match_name":"Richmond Hot Shots 2018 USPSA Special Classifier Match - Jan 28 2018","match_date":"2018-01-28","stage_classifiercode":"09-04","member_number":"A101653","first_name":"JONATHAN","last_name":"DIAZ","classification":"B","division":"PCC","hit_factor":4.3928},{"match_name":"ARPC USPSA Match 11-29-20","match_date":"2020-11-29","stage_classifiercode":"09-04","member_number":"A53836","first_name":"DON","last_name":"HART","classification":"D","division":"PCC","hit_factor":4.3902},{"match_name":"CAPS 7-22-2017","match_date":"2017-07-22","stage_classifiercode":"09-04","member_number":"PEN","first_name":"SCOTT","last_name":"CANNON","classification":"U","division":"PCC","hit_factor":4.388},{"match_name":"NISA June 2021","match_date":"2021-06-27","stage_classifiercode":"09-04","member_number":"A128706","first_name":"DON","last_name":"MONROE","classification":"B","division":"PCC","hit_factor":4.3771},{"match_name":"Maine Pracrical Shooters-July 2017 USPSA","match_date":"2017-07-09","stage_classifiercode":"09-04","member_number":"TY84597","first_name":"NORMAN","last_name":"DAVIS","classification":"C","division":"PCC","hit_factor":4.3758},{"match_name":"CSA Annual Classifier Classic","match_date":"2018-03-18","stage_classifiercode":"09-04","member_number":"A88677","first_name":"MICHELE","last_name":"SARGENT","classification":"U","division":"PCC","hit_factor":4.3656},{"match_name":"HPPS 6-19-2021","match_date":"2021-06-19","stage_classifiercode":"09-04","member_number":"L3719","first_name":"MATTHEW","last_name":"HESS","classification":"M","division":"PCC","hit_factor":4.3614},{"match_name":"B&R USPSA 6","match_date":"2018-06-30","stage_classifiercode":"09-04","member_number":"A65896","first_name":"JON","last_name":"YOUNG","classification":"B","division":"PCC","hit_factor":4.2929},{"match_name":"SWGC USPSA Pistol Match - March 2021","match_date":"2021-03-06","stage_classifiercode":"09-04","member_number":"TY47034","first_name":"BUDDY","last_name":"PITTMAN","classification":"D","division":"PCC","hit_factor":4.2831},{"match_name":"PRG-USPSA - Oh Shoot November 15th - 3rd Sunday","match_date":"2020-11-15","stage_classifiercode":"09-04","member_number":"A53107","first_name":"ROMIE","last_name":"OGALINO","classification":"U","division":"PCC","hit_factor":4.2506},{"match_name":"HPPS 6-19-2021","match_date":"2021-06-19","stage_classifiercode":"09-04","member_number":"A96539","first_name":"BECKY","last_name":"MUELLER","classification":"M","division":"PCC","hit_factor":4.2373},{"match_name":"SAPSA October 2016","match_date":"2016-10-15","stage_classifiercode":"09-04","member_number":"L1240","first_name":"TONY","last_name":"HYATT","classification":"U","division":"PCC","hit_factor":4.2303},{"match_name":"CGC 10-14-2017","match_date":"2017-10-14","stage_classifiercode":"09-04","member_number":"A97112","first_name":"BRETT","last_name":"TYLER","classification":"U","division":"PCC","hit_factor":4.2084},{"match_name":"Flagstaff Fun Shoot November 10 2018","match_date":"2018-11-10","stage_classifiercode":"09-04","member_number":"A114032","first_name":"EDUARDO","last_name":"PINSON","classification":"\"\"","division":"PCC","hit_factor":4.1943},{"match_name":"YMM IPSC02 2017_11_12","match_date":"2017-11-12","stage_classifiercode":"09-04","member_number":"TY71290","first_name":"JON","last_name":"BREAZEAL","classification":"U","division":"PCC","hit_factor":4.1899},{"match_name":"5 Dogs October USPSA 2020","match_date":"2020-10-04","stage_classifiercode":"09-04","member_number":"FY112564","first_name":"HERMAN","last_name":"NOORA","classification":"U","division":"PCC","hit_factor":4.1725},{"match_name":"PCGC USPSA July 2018","match_date":"2018-07-22","stage_classifiercode":"09-04","member_number":"TY112328","first_name":"KENLEY","last_name":"THOMPSON","classification":"U","division":"PCC","hit_factor":4.1667},{"match_name":"Steel City USPSA April 1 2017","match_date":"2017-04-01","stage_classifiercode":"09-04","member_number":"\"\"","first_name":"JAY","last_name":"TOMLIN","classification":"X ","division":"PCC","hit_factor":4.1284},{"match_name":"JCSSA Aug2017","match_date":"2017-08-04","stage_classifiercode":"09-04","member_number":"A40263","first_name":"MIKE","last_name":"THOMPSON","classification":"\"\"","division":"PCC","hit_factor":4.119},{"match_name":"USPSA","match_date":"2017-09-03","stage_classifiercode":"09-04","member_number":"TY89752","first_name":"JD","last_name":"FAIRCHILD","classification":"\"\"","division":"PCC","hit_factor":4.1096},{"match_name":"Applied IN25 USPSA April Classifier 2018","match_date":"2018-04-17","stage_classifiercode":"09-04","member_number":"TY90274","first_name":"MICHAEL","last_name":"CONROY","classification":"B","division":"PCC","hit_factor":4.1063},{"match_name":"Denver Defense APC 04-17","match_date":"2017-04-17","stage_classifiercode":"09-04","member_number":"\"\"","first_name":"MIKE","last_name":"REAVIS","classification":"\"\"","division":"PCC","hit_factor":4.0968},{"match_name":"PTPC February 4th Classifier Match","match_date":"2018-02-04","stage_classifiercode":"09-04","member_number":"FY60870","first_name":"MIKE","last_name":"CALDERISI","classification":"U","division":"PCC","hit_factor":4.0964},{"match_name":"CSA Annual Classifier Classic","match_date":"2018-03-18","stage_classifiercode":"09-04","member_number":"A88677","first_name":"MICHELE","last_name":"SARGENT","classification":"U","division":"PCC","hit_factor":4.0712},{"match_name":"FLSC February Classifier Match","match_date":"2017-02-04","stage_classifiercode":"09-04","member_number":"a100773","first_name":"HUNTER","last_name":"OVERLAND","classification":"U","division":"PCC","hit_factor":4.0685},{"match_name":"Applied IN25 USPSA October 2017 Classifier","match_date":"2017-10-18","stage_classifiercode":"09-04","member_number":"A99585","first_name":"JAMES","last_name":"PETERS","classification":"A","division":"PCC","hit_factor":4.0541},{"match_name":"Oh Shoot-PRG  May 2nd - 1st Sunday Match","match_date":"2021-05-02","stage_classifiercode":"09-04","member_number":"TY3264","first_name":"ALEXIS","last_name":"AFAGHI","classification":"C","division":"PCC","hit_factor":4.0431},{"match_name":"PCGC USPSA July 2018","match_date":"2018-07-22","stage_classifiercode":"09-04","member_number":"A88677","first_name":"MICHELE","last_name":"SARGENT","classification":"C","division":"PCC","hit_factor":4.0404},{"match_name":"SLOSA February 2018 USPSA MATCH","match_date":"2018-02-10","stage_classifiercode":"09-04","member_number":"\"\"","first_name":"VANCE","last_name":"VILLAPANIA","classification":"U","division":"PCC","hit_factor":4.0404},{"match_name":"SSPSC USPSA  June 6-7 2020","match_date":"2020-06-04","stage_classifiercode":"09-04","member_number":"TY94878","first_name":"DAVID","last_name":"FERNANDEZ JR","classification":"U","division":"PCC","hit_factor":4.0323},{"match_name":"NTPS-SE January 2018","match_date":"2018-01-20","stage_classifiercode":"09-04","member_number":"A89678","first_name":"JOEL","last_name":"VALLEJO","classification":"U","division":"PCC","hit_factor":4.0214},{"match_name":"AVAP 9218","match_date":"2018-09-02","stage_classifiercode":"09-04","member_number":"A94308","first_name":"TAKASHI","last_name":"FUJIKAWA","classification":"U","division":"PCC","hit_factor":4.0193},{"match_name":"Crooked Creek Pistol League - July 2017","match_date":"2017-07-22","stage_classifiercode":"09-04","member_number":"TY86084","first_name":"CUONG","last_name":"NGUYEN","classification":"C","division":"PCC","hit_factor":4},{"match_name":"WELD ECO09 20180415","match_date":"2018-04-15","stage_classifiercode":"09-04","member_number":"\"\"","first_name":"PAUL","last_name":"ROHDE","classification":"U","division":"PCC","hit_factor":3.9916},{"match_name":"USPSA MO21 2Alpha SBRC October 2016","match_date":"2016-10-22","stage_classifiercode":"09-04","member_number":"TY84223","first_name":"CRAIG","last_name":"HEIDEMANN","classification":"U","division":"PCC","hit_factor":3.9535},{"match_name":"NAAS 08-19-2018","match_date":"2018-08-19","stage_classifiercode":"09-04","member_number":"A111991","first_name":"WILLARD (BILL)","last_name":"HARLOW","classification":"U","division":"PCC","hit_factor":3.9517},{"match_name":"Bayou City USPSA Weekly June 28","match_date":"2018-06-28","stage_classifiercode":"09-04","member_number":"A103350","first_name":"BLAINE","last_name":"NEWLIN","classification":"B","division":"PCC","hit_factor":3.9049},{"match_name":"August 2018 CAS USPSA","match_date":"2018-08-05","stage_classifiercode":"09-04","member_number":"fy39825","first_name":"BARBARA","last_name":"THIBODAUX","classification":"U","division":"PCC","hit_factor":3.8929},{"match_name":"Fairfax PS USPSA January 2017","match_date":"2017-01-17","stage_classifiercode":"09-04","member_number":"A72727","first_name":"GREG","last_name":"JONES","classification":"U","division":"PCC","hit_factor":3.886},{"match_name":"SEPSA March 2021","match_date":"2021-03-13","stage_classifiercode":"09-04","member_number":"A119647","first_name":"CHARLES","last_name":"BONNET","classification":"U","division":"PCC","hit_factor":3.8655},{"match_name":"ORPCI 2018.03.31 USPSA Special","match_date":"2018-03-31","stage_classifiercode":"09-04","member_number":"Ty105883","first_name":"JAMES","last_name":"ARNETT","classification":"U","division":"PCC","hit_factor":3.8636},{"match_name":"PCGC October 2016","match_date":"2016-10-23","stage_classifiercode":"09-04","member_number":"TY8880","first_name":"GENE","last_name":"RICHMOND","classification":"U","division":"PCC","hit_factor":3.8462},{"match_name":"PRG-USPSA - Oh Shoot November 15th - 3rd Sunday","match_date":"2020-11-15","stage_classifiercode":"09-04","member_number":"A114513","first_name":"EDGAR","last_name":"LAGUILLES","classification":"U","division":"PCC","hit_factor":3.8333},{"match_name":" 2018 \"","match_date":"2018-07-21","stage_classifiercode":"09-04","member_number":"TY53701","first_name":"RON","last_name":"COOPER","classification":"B","division":"PCC","hit_factor":3.8323},{"match_name":"Prescott Action Shooters 1st Saturday USPSA 5-01-21","match_date":"2021-05-01","stage_classifiercode":"09-04","member_number":"TY93062","first_name":"SARAH","last_name":"OOSTHUISEN","classification":"Unclassified","division":"PCC","hit_factor":3.8268},{"match_name":"Taxman Special ORSA USPSA 21 Apr 2018","match_date":"2018-04-21","stage_classifiercode":"09-04","member_number":"A00000","first_name":"KELLY","last_name":"STILES","classification":"U","division":"PCC","hit_factor":3.8023},{"match_name":"WAC February(4th Sunday) - USPSA 6 Classifier Match","match_date":"2020-02-23","stage_classifiercode":"09-04","member_number":"A125897","first_name":"KELVIN","last_name":"MELARA","classification":"U","division":"PCC","hit_factor":3.7906},{"match_name":"HRRB 11-20-2021","match_date":"2021-11-20","stage_classifiercode":"09-04","member_number":"L4313","first_name":"ART","last_name":"RIVERA","classification":"C","division":"PCC","hit_factor":3.7838},{"match_name":"2019-03 USPSA at Shadow Hawk Defense","match_date":"2020-03-14","stage_classifiercode":"09-04","member_number":"A120434","first_name":"KAREN","last_name":"ZEIGLER","classification":"C","division":"PCC","hit_factor":3.7549},{"match_name":"SLOSA February 2018 USPSA MATCH","match_date":"2018-02-10","stage_classifiercode":"09-04","member_number":"TY97989","first_name":"MELISSA","last_name":"CABREROS","classification":"C","division":"PCC","hit_factor":3.7534},{"match_name":"WPGC 12-5-16","match_date":"2016-12-04","stage_classifiercode":"09-04","member_number":"TY81628","first_name":"CLAY","last_name":"TURNER","classification":"A","division":"PCC","hit_factor":3.7406},{"match_name":"2020-10 Bone Creek USPSA","match_date":"2020-10-04","stage_classifiercode":"09-04","member_number":"TY21537","first_name":"LONNIE","last_name":"LIPOGLAV","classification":"U","division":"PCC","hit_factor":3.7363},{"match_name":"PCGC USPSA July 2018","match_date":"2018-07-22","stage_classifiercode":"09-04","member_number":"A88677","first_name":"MICHELE","last_name":"SARGENT","classification":"C","division":"PCC","hit_factor":3.7281},{"match_name":"SAGC CTX04 Monthly USPSA Match - October 2018","match_date":"2018-10-28","stage_classifiercode":"09-04","member_number":"None","first_name":"TERRY","last_name":"ASHTON","classification":"U","division":"PCC","hit_factor":3.7123},{"match_name":"LdF USPSA Match  March 24 2018","match_date":"2018-03-24","stage_classifiercode":"09-04","member_number":"\"\"","first_name":"SONNY","last_name":"SARTE","classification":"U","division":"PCC","hit_factor":3.6778},{"match_name":"RSPP 3rd Saturday January 2018","match_date":"2018-01-20","stage_classifiercode":"09-04","member_number":"L1697","first_name":"DENNY","last_name":"SHADEL","classification":"C","division":"PCC","hit_factor":3.6398},{"match_name":"CSA Annual Classifier Classic","match_date":"2018-03-18","stage_classifiercode":"09-04","member_number":"L4135","first_name":"TOM","last_name":"SARGENT","classification":"U","division":"PCC","hit_factor":3.6364},{"match_name":"  Maine Practical Shooters August 2020","match_date":"2020-08-08","stage_classifiercode":"09-04","member_number":"TY61007","first_name":"STEVE","last_name":"RICHENS","classification":"C","division":"PCC","hit_factor":3.6269},{"match_name":"USPSA MO21 2Alpha SBRC October 2016","match_date":"2016-10-22","stage_classifiercode":"09-04","member_number":"FY70323","first_name":"LEE","last_name":"SUTTON","classification":"U","division":"PCC","hit_factor":3.6247},{"match_name":"PCWC USPSA  6 23 2018","match_date":"2018-06-23","stage_classifiercode":"09-04","member_number":"\"\"","first_name":"MARCUS","last_name":"JEANNETTE","classification":"\"\"","division":"PCC","hit_factor":3.617},{"match_name":"MVPSA USPSA 12-15-18 CLASSIFIER","match_date":"2018-12-15","stage_classifiercode":"09-04","member_number":"a103837","first_name":"NORMAN","last_name":"HATKE","classification":"C","division":"PCC","hit_factor":3.5865},{"match_name":"NTPS-SE January 2018","match_date":"2018-01-20","stage_classifiercode":"09-04","member_number":"\"\"","first_name":"JEREMIAH","last_name":"NINK","classification":"U","division":"PCC","hit_factor":3.5821},{"match_name":"HSA USPSA January 2020","match_date":"2020-01-08","stage_classifiercode":"09-04","member_number":"A116840","first_name":"RONNIE","last_name":"SIEGEL","classification":"U","division":"PCC","hit_factor":3.5752},{"match_name":"Grandbaggers December 2017","match_date":"2017-12-07","stage_classifiercode":"09-04","member_number":"\"\"","first_name":"RON","last_name":"MERRITT","classification":"U","division":"PCC","hit_factor":3.5647},{"match_name":"SAPS Match 5/15/2021","match_date":"2021-05-15","stage_classifiercode":"09-04","member_number":"FY76764","first_name":"CHUCK","last_name":"PHILPOT","classification":"A","division":"PCC","hit_factor":3.5503},{"match_name":"Steel City USPSA April 1 2017","match_date":"2017-04-01","stage_classifiercode":"09-04","member_number":"TY-83732","first_name":"SAM","last_name":"HENDERSON","classification":"U","division":"PCC","hit_factor":3.5058},{"match_name":"CFL07 WILLISTON PRACTICAL SHOOTERS CLUB","match_date":"2018-05-05","stage_classifiercode":"09-04","member_number":"a99825","first_name":"CALEB","last_name":"MIDDLETON","classification":"U","division":"PCC","hit_factor":3.4483},{"match_name":"YRPA  USPSA June 2018","match_date":"2018-06-23","stage_classifiercode":"09-04","member_number":"TY70904","first_name":"MICHAEL","last_name":"GIMERA","classification":"B","division":"PCC","hit_factor":3.4211},{"match_name":"RPGi USPSA Last Minute Match 29 May 2021","match_date":"2021-05-29","stage_classifiercode":"09-04","member_number":"A132560","first_name":"MADELYN","last_name":"ROEDEL","classification":"U","division":"PCC","hit_factor":3.3195},{"match_name":"CGC 10-14-2017","match_date":"2017-10-14","stage_classifiercode":"09-04","member_number":"A80807","first_name":"JON","last_name":"WASHER","classification":"B","division":"PCC","hit_factor":3.3113},{"match_name":"Kidlat February Club Match","match_date":"2017-02-04","stage_classifiercode":"09-04","member_number":"A59158","first_name":"BOBBY","last_name":"LIM","classification":"U","division":"PCC","hit_factor":3.2787},{"match_name":"RSPP 3rd Saturday August 2018","match_date":"2018-08-18","stage_classifiercode":"09-04","member_number":"TY46968","first_name":"STEVE","last_name":"REDIES","classification":"B","division":"PCC","hit_factor":3.2787},{"match_name":"BMPSA Feb 17 2018","match_date":"2018-02-17","stage_classifiercode":"09-04","member_number":"\"\"","first_name":"JOHN","last_name":"NADASI","classification":"U","division":"PCC","hit_factor":3.2609},{"match_name":"ANPRACS USPSA12-17-17","match_date":"2017-12-17","stage_classifiercode":"09-04","member_number":"TY95886","first_name":"LOREN","last_name":"ZEIGLER","classification":"U","division":"PCC","hit_factor":3.212},{"match_name":"CASA   USPSA  Dec 2018","match_date":"2018-12-01","stage_classifiercode":"09-04","member_number":"\"\"","first_name":"ERIC","last_name":"PIERCE","classification":"X","division":"PCC","hit_factor":3.2086},{"match_name":"HPPS 6-19-2021","match_date":"2021-06-19","stage_classifiercode":"09-04","member_number":"a123157","first_name":"MIKE","last_name":"GONCALVES","classification":"B","division":"PCC","hit_factor":3.183},{"match_name":"RCPS USPSA October 13","match_date":"2018-10-13","stage_classifiercode":"09-04","member_number":"TY100969","first_name":"DAVID","last_name":"BARNES","classification":"C","division":"PCC","hit_factor":3.172},{"match_name":"ORSA USPSA Dogs Days Of Summer August 2018","match_date":"2018-08-17","stage_classifiercode":"09-04","member_number":"A93867","first_name":"RAY","last_name":"CHAN","classification":"U","division":"PCC","hit_factor":3.1614},{"match_name":"SFPC Annual Picnic Match","match_date":"2017-02-12","stage_classifiercode":"09-04","member_number":"A98748","first_name":"JAMES","last_name":"BEMBANASTE","classification":"U","division":"PCC","hit_factor":3.1405},{"match_name":"PRG-USPSA - Oh Shoot November 15th - 3rd Sunday","match_date":"2020-11-15","stage_classifiercode":"09-04","member_number":"TY95644","first_name":"ARIES","last_name":"TUBIANOSA","classification":"U","division":"PCC","hit_factor":3.1046},{"match_name":"Palmetto Gun Club - February 2018 USPSA","match_date":"2018-02-03","stage_classifiercode":"09-04","member_number":"\"\"","first_name":"KENDALL","last_name":"EDSON","classification":"U","division":"PCC","hit_factor":3.1008},{"match_name":"GPS May 2018","match_date":"2018-05-20","stage_classifiercode":"09-04","member_number":"000000","first_name":"ANGELITO","last_name":"SOMERA","classification":"U","division":"PCC","hit_factor":3.0954},{"match_name":"DRRC USPSA Aug2018","match_date":"2018-08-04","stage_classifiercode":"09-04","member_number":"A108736","first_name":"LOGAN","last_name":"SOMERS","classification":"U","division":"PCC","hit_factor":3.0864},{"match_name":"NCPS USPSA Handgun Match July 22 2018a","match_date":"2018-07-22","stage_classifiercode":"09-04","member_number":"TY5906","first_name":"JOHN","last_name":"HARTSOCK","classification":"U","division":"PCC","hit_factor":3.0504},{"match_name":"LCSC Linden USPSA 112518 with Shooting for Glory","match_date":"2018-11-25","stage_classifiercode":"09-04","member_number":"Ty80794","first_name":"ALAIN","last_name":"RAMIREZ","classification":"U","division":"PCC","hit_factor":3.0488},{"match_name":"Bossier Parish Practical Shooters June 13 2020","match_date":"2020-06-13","stage_classifiercode":"09-04","member_number":"A121184","first_name":"CYNTHIA","last_name":"ROWELL","classification":"D","division":"PCC","hit_factor":3.0447},{"match_name":"BSPSC 2017 April Special Classifier","match_date":"2017-04-09","stage_classifiercode":"09-04","member_number":"B44","first_name":"SCOTT","last_name":"BAIR","classification":"U","division":"PCC","hit_factor":3.0303},{"match_name":"LdF USPSA Match  March 24 2018","match_date":"2018-03-24","stage_classifiercode":"09-04","member_number":"TY86401","first_name":"JOE","last_name":"DEMATTIA","classification":"C","division":"PCC","hit_factor":3.0227},{"match_name":"JCSSA Aug2017","match_date":"2017-08-04","stage_classifiercode":"09-04","member_number":"A78835","first_name":"ALDEN","last_name":"THOMPSON","classification":"\"\"","division":"PCC","hit_factor":3.0151},{"match_name":"PCGC USPSA July 2018","match_date":"2018-07-22","stage_classifiercode":"09-04","member_number":"\"\"","first_name":"COLE","last_name":"HENDERSON","classification":"U","division":"PCC","hit_factor":2.988},{"match_name":"Brazosland Pistoleros USPSA - Sunday September 12th","match_date":"2021-09-12","stage_classifiercode":"09-04","member_number":"A14418","first_name":"RANDY","last_name":"CALLISON","classification":"A","division":"PCC","hit_factor":2.9762},{"match_name":"HPPS 6-19-2021","match_date":"2021-06-19","stage_classifiercode":"09-04","member_number":"ty77793","first_name":"ROBERT","last_name":"CHRISTIE","classification":"A","division":"PCC","hit_factor":2.9126},{"match_name":"PSoCA November Match CAGC","match_date":"2018-11-04","stage_classifiercode":"09-04","member_number":"A65004","first_name":"MICHELLE","last_name":"PEEL","classification":"U","division":"PCC","hit_factor":2.8401},{"match_name":"CFL07 WILLISTON PRACTICAL SHOOTERS CLUB","match_date":"2018-05-05","stage_classifiercode":"09-04","member_number":"\"\"","first_name":"RANDY","last_name":"CHAFIN","classification":"U","division":"PCC","hit_factor":2.82},{"match_name":"Space Coast Practical Shooters","match_date":"2018-04-07","stage_classifiercode":"09-04","member_number":"Ty91351","first_name":"FERNANDO","last_name":"ALMEIDA","classification":"B","division":"PCC","hit_factor":2.795},{"match_name":"DSS - USPSA - 21-07-24","match_date":"2021-07-24","stage_classifiercode":"09-04","member_number":"A110754","first_name":"AARON","last_name":"SELLERS","classification":"G","division":"PCC","hit_factor":2.7778},{"match_name":"GPSL 8-2-2016","match_date":"2016-08-02","stage_classifiercode":"09-04","member_number":"A94600","first_name":"RONALDO","last_name":"BORGES","classification":"U","division":"PCC","hit_factor":2.72},{"match_name":"CSA Annual Classifier Classic","match_date":"2018-03-18","stage_classifiercode":"09-04","member_number":"\"\"","first_name":"AMBER","last_name":"BRINEGAR","classification":"\"\"","division":"PCC","hit_factor":2.6316},{"match_name":"TBAS USPSA Match 2/23/20","match_date":"2020-02-23","stage_classifiercode":"09-04","member_number":"A111791","first_name":"JOHN","last_name":"DANIELSON","classification":"","division":"PCC","hit_factor":2.6081},{"match_name":"Bayou City USPSA Weekly Oct 22","match_date":"2020-10-22","stage_classifiercode":"09-04","member_number":"A92443","first_name":"RAY","last_name":"FISHEL","classification":"B","division":"PCC","hit_factor":2.5974},{"match_name":"Grandbaggers December 2017","match_date":"2017-12-07","stage_classifiercode":"09-04","member_number":"CL164","first_name":"BOB","last_name":"RIPPY","classification":"U","division":"PCC","hit_factor":2.5572},{"match_name":"SSPSC USPSA  June 6-7 2020","match_date":"2020-06-04","stage_classifiercode":"09-04","member_number":"A124877","first_name":"AUSTIN","last_name":"ALVAREZ","classification":"","division":"PCC","hit_factor":2.5346},{"match_name":"LdF USPSA Match September 5 2021","match_date":"2021-09-05","stage_classifiercode":"09-04","member_number":"TY37963","first_name":"ED","last_name":"FERRELL","classification":"B","division":"PCC","hit_factor":2.514},{"match_name":"USPSA MO21 2Alpha SBRC October 2016","match_date":"2016-10-22","stage_classifiercode":"09-04","member_number":"L2515","first_name":"JEFF","last_name":"COCKRUM","classification":"U","division":"PCC","hit_factor":2.4845},{"match_name":"PCGC October 2016","match_date":"2016-10-23","stage_classifiercode":"09-04","member_number":"\"\"","first_name":"KENLEY","last_name":"THOMPSON","classification":"U","division":"PCC","hit_factor":2.3841},{"match_name":"5 Dogs September 2016 USPSA","match_date":"2016-09-04","stage_classifiercode":"09-04","member_number":"\"\"","first_name":"HIDEO","last_name":"SHIMODA","classification":"U","division":"PCC","hit_factor":2.3551},{"match_name":"CSA Annual Classifier Classic","match_date":"2018-03-18","stage_classifiercode":"09-04","member_number":"TY89288","first_name":"BRUCE","last_name":"TAYLOR","classification":"M","division":"PCC","hit_factor":2.3256},{"match_name":"DRRC USPSA Aug2018","match_date":"2018-08-04","stage_classifiercode":"09-04","member_number":"L3346","first_name":"FRED","last_name":"FAGUE","classification":"D","division":"PCC","hit_factor":2.3196},{"match_name":" 2018 \"","match_date":"2018-07-21","stage_classifiercode":"09-04","member_number":"TY90274","first_name":"MICHAEL","last_name":"CONROY","classification":"B","division":"PCC","hit_factor":2.2378},{"match_name":"SFPC Annual Picnic Match","match_date":"2017-02-12","stage_classifiercode":"09-04","member_number":"A79127","first_name":"KEN","last_name":"FUSCO","classification":"U","division":"PCC","hit_factor":2.1372},{"match_name":"DSS - USPSA - 21-07-24","match_date":"2021-07-24","stage_classifiercode":"09-04","member_number":"TY63998","first_name":"MARTIN","last_name":"LEI","classification":"C","division":"PCC","hit_factor":2.0752},{"match_name":"BORCC USPSA March 2018 Classifier Match","match_date":"2018-03-24","stage_classifiercode":"09-04","member_number":"FY14034","first_name":"MARK","last_name":"KATT","classification":"C","division":"PCC","hit_factor":2.0245},{"match_name":"Chillicothe April-2017 USPSA Match","match_date":"2017-04-23","stage_classifiercode":"09-04","member_number":"TY58309","first_name":"ERIC","last_name":"HENSON","classification":"C","division":"PCC","hit_factor":2.013},{"match_name":"CCPL 07082018","match_date":"2018-07-06","stage_classifiercode":"09-04","member_number":"\"\"","first_name":"STEPHEN","last_name":"POLFER","classification":"U","division":"PCC","hit_factor":1.9789},{"match_name":"Richmond Hot Shots 2018 USPSA Special Classifier Match - Jan 28 2018","match_date":"2018-01-28","stage_classifiercode":"09-04","member_number":"L3859","first_name":"JAMES","last_name":"HOLMES","classification":"U","division":"PCC","hit_factor":1.9597},{"match_name":"NW01 Winter Wonderland","match_date":"2017-01-08","stage_classifiercode":"09-04","member_number":"FY27156","first_name":"STEVE","last_name":"CLEMO","classification":"B","division":"PCC","hit_factor":1.8935},{"match_name":"CCPL 07082018","match_date":"2018-07-06","stage_classifiercode":"09-04","member_number":"A112745","first_name":"NICK","last_name":"HARRISON","classification":"U","division":"PCC","hit_factor":1.8391},{"match_name":"LCAS August 2018 USPSA","match_date":"2018-08-04","stage_classifiercode":"09-04","member_number":"A53035","first_name":"MATT","last_name":"YANKUSKIE","classification":"U","division":"PCC","hit_factor":1.8219},{"match_name":"HRRB 11-20-2021","match_date":"2021-11-20","stage_classifiercode":"09-04","member_number":"NONE","first_name":"HUGH","last_name":"MADULA","classification":"U","division":"PCC","hit_factor":1.8207},{"match_name":"GRPC USPSA DO YOU FEEL LUCKY","match_date":"2020-03-01","stage_classifiercode":"09-04","member_number":"FY36295","first_name":"PAUL","last_name":"VAN WYK","classification":"M","division":"PCC","hit_factor":1.7544},{"match_name":"WGC WI USPSA Monthly Match 4-21-18","match_date":"2018-04-21","stage_classifiercode":"09-04","member_number":"FY91203","first_name":"DOUGLAS","last_name":"QUAMME","classification":"C","division":"PCC","hit_factor":1.7505},{"match_name":"RSPP 3rd Saturday August 2018","match_date":"2018-08-18","stage_classifiercode":"09-04","member_number":"A77316","first_name":"JOSEPH","last_name":"MURRAY","classification":"B","division":"PCC","hit_factor":1.6026},{"match_name":"Grandbaggers December 2017","match_date":"2017-12-07","stage_classifiercode":"09-04","member_number":"TY46374","first_name":"LARRY","last_name":"STOKES","classification":"B","division":"PCC","hit_factor":1.5524},{"match_name":"Coastal Area Practical Shooters 7-23-16","match_date":"2016-07-23","stage_classifiercode":"09-04","member_number":"A68296","first_name":"TIM","last_name":"CURRIE","classification":"U","division":"PCC","hit_factor":1.5385},{"match_name":"DGC USPSA 07-26-20","match_date":"2020-07-26","stage_classifiercode":"09-04","member_number":"A120525","first_name":"CHARLES","last_name":"COGLE","classification":"U","division":"PCC","hit_factor":1.5284},{"match_name":"2020-10 Bone Creek USPSA","match_date":"2020-10-04","stage_classifiercode":"09-04","member_number":"FY36467","first_name":"JAMES","last_name":"POPE","classification":"B","division":"PCC","hit_factor":1.5238},{"match_name":"Parabellum USPSA Jan 25 2017","match_date":"2017-01-25","stage_classifiercode":"09-04","member_number":"A86159","first_name":"ALFRED","last_name":"LOPEZ","classification":"B","division":"PCC","hit_factor":1.4974},{"match_name":"AGC_20170402","match_date":"2017-04-02","stage_classifiercode":"09-04","member_number":"TY55863","first_name":"SEAN","last_name":"MYHRE","classification":"B","division":"PCC","hit_factor":1.4706},{"match_name":"Palmetto Gun Club - February 2018 USPSA","match_date":"2018-02-03","stage_classifiercode":"09-04","member_number":"A102958","first_name":"JOSHUA","last_name":"COPE","classification":"U","division":"PCC","hit_factor":1.3333},{"match_name":"EWPSA  2018-02","match_date":"2018-02-18","stage_classifiercode":"09-04","member_number":"TY76664","first_name":"JEFF","last_name":"WEAVER","classification":"A","division":"PCC","hit_factor":1.3115},{"match_name":"NAAS 2017-10-15","match_date":"2017-10-15","stage_classifiercode":"09-04","member_number":"A80807","first_name":"JON","last_name":"WASHER","classification":"B","division":"PCC","hit_factor":1.3072},{"match_name":"ORPCI 2018.03.31 USPSA Special","match_date":"2018-03-31","stage_classifiercode":"09-04","member_number":"A109998","first_name":"DAVE","last_name":"SKELTON","classification":"U","division":"PCC","hit_factor":1.3068},{"match_name":"Medford USPSA  June 2020","match_date":"2020-06-21","stage_classifiercode":"09-04","member_number":"A103515","first_name":"SEAN","last_name":"SNEARLY","classification":"B","division":"PCC","hit_factor":1.2969},{"match_name":"RSPP 3rd Saturday August 2018","match_date":"2018-08-18","stage_classifiercode":"09-04","member_number":"A58956","first_name":"RICK","last_name":"KORZEP","classification":"M","division":"PCC","hit_factor":1.2945},{"match_name":"AVAP 9218","match_date":"2018-09-02","stage_classifiercode":"09-04","member_number":"FY22372","first_name":"CHUCK","last_name":"ROSSI","classification":"U","division":"PCC","hit_factor":1.2821},{"match_name":"Space Coast Practical Shooters","match_date":"2018-04-07","stage_classifiercode":"09-04","member_number":"\"\"","first_name":"CESAR","last_name":"RODRIGUEZ","classification":"U","division":"PCC","hit_factor":1.2116},{"match_name":"NW01 March Madness 17","match_date":"2017-03-12","stage_classifiercode":"09-04","member_number":"L465","first_name":"TOM","last_name":"KETTELLS","classification":"U","division":"PCC","hit_factor":1.1299},{"match_name":"MVPSA USPSA 12-15-18 CLASSIFIER","match_date":"2018-12-15","stage_classifiercode":"09-04","member_number":"a103560","first_name":"RILEY1","last_name":"COOPER","classification":"U","division":"PCC","hit_factor":1.1019},{"match_name":"YMM IPSC02 2017_11_12","match_date":"2017-11-12","stage_classifiercode":"09-04","member_number":"TY63399","first_name":"JOHNNIE","last_name":"CADY","classification":"D","division":"PCC","hit_factor":1.0811},{"match_name":"RSPP 3rd Saturday January 2018","match_date":"2018-01-20","stage_classifiercode":"09-04","member_number":"A58956","first_name":"RICK","last_name":"KORZEP","classification":"M","division":"PCC","hit_factor":1.0753},{"match_name":"RangeMasters 3-29-18","match_date":"2018-03-29","stage_classifiercode":"09-04","member_number":"TY96553","first_name":"DANNY","last_name":"NARAMORE","classification":"C","division":"PCC","hit_factor":1.0638},{"match_name":"RSPP 3rd Saturday January 2017","match_date":"2017-01-21","stage_classifiercode":"09-04","member_number":"TY65813","first_name":"JOSEPH","last_name":"HANNIS","classification":"D","division":"PCC","hit_factor":1.0594},{"match_name":"Palmetto Gun Club - February 2018 USPSA","match_date":"2018-02-03","stage_classifiercode":"09-04","member_number":"A106301","first_name":"TIMOTHY","last_name":"BANKS","classification":"U","division":"PCC","hit_factor":1.0518},{"match_name":"Taxman Special ORSA USPSA 21 Apr 2018","match_date":"2018-04-21","stage_classifiercode":"09-04","member_number":"A94279","first_name":"ED","last_name":"POTTER","classification":"U","division":"PCC","hit_factor":1.039},{"match_name":"LRC USPSA October 2020","match_date":"2020-10-03","stage_classifiercode":"09-04","member_number":"TY96443","first_name":"RUSTY","last_name":"WILSON","classification":"U","division":"PCC","hit_factor":0.9736},{"match_name":"HRRB 11-20-2021","match_date":"2021-11-20","stage_classifiercode":"09-04","member_number":"NONE","first_name":"MARK","last_name":"PAZ","classification":"U","division":"PCC","hit_factor":0.9514},{"match_name":"Taxman Special ORSA USPSA 21 Apr 2018","match_date":"2018-04-21","stage_classifiercode":"09-04","member_number":"TY92869","first_name":"CSABA","last_name":"FOLDES","classification":"B","division":"PCC","hit_factor":0.9063},{"match_name":"Fairfax PS USPSA January 2017","match_date":"2017-01-17","stage_classifiercode":"09-04","member_number":"A100356","first_name":"CALEB","last_name":"FITZGERALD","classification":"\"\"","division":"PCC","hit_factor":0.7435},{"match_name":"Springfield Tactical Shooters 03/04/2021","match_date":"2021-03-04","stage_classifiercode":"09-04","member_number":"L3651","first_name":"RYAN","last_name":"BRADLEY","classification":"A","division":"PCC","hit_factor":0.7326},{"match_name":"WGC WI USPSA Monthly Match 4-21-18","match_date":"2018-04-21","stage_classifiercode":"09-04","member_number":"TY72120","first_name":"DAVE","last_name":"DEYOE","classification":"A","division":"PCC","hit_factor":0.6826},{"match_name":"Springfield Tactical Shooters 03/04/2021","match_date":"2021-03-04","stage_classifiercode":"09-04","member_number":"L3651","first_name":"RYAN","last_name":"BRADLEY","classification":"A","division":"PCC","hit_factor":0.6026},{"match_name":"Renton USPSA April 2017","match_date":"2017-04-23","stage_classifiercode":"09-04","member_number":"FY27156","first_name":"STEVE","last_name":"CLEMO","classification":"U","division":"PCC","hit_factor":0.5917},{"match_name":"APSC USPSA 10-06-18","match_date":"2018-10-06","stage_classifiercode":"09-04","member_number":"A44650","first_name":"DARRELL","last_name":"DAUDE","classification":"C","division":"PCC","hit_factor":0.5464},{"match_name":"EHPSA Apr 2017","match_date":"2017-04-23","stage_classifiercode":"09-04","member_number":"A42456","first_name":"GARRY","last_name":"LITTLE","classification":"B","division":"PCC","hit_factor":0.5075},{"match_name":"Alpha Mike  Oct 2016","match_date":"2016-10-16","stage_classifiercode":"09-04","member_number":"TY60319","first_name":"STEVE","last_name":"LAUFF","classification":"U","division":"PCC","hit_factor":0.1607},{"match_name":"Dawg Valley USPSA April 14 2018","match_date":"2018-04-14","stage_classifiercode":"09-04","member_number":"A103465","first_name":"CORY","last_name":"WYATT","classification":"U","division":"PCC","hit_factor":0.0644}]