[{"match_name":"EAGC March 2020 USPSA Pistol Match","match_date":"2020-03-15","stage_classifiercode":"19-03","member_number":"L3208","first_name":"RANDY","last_name":"ARROWOOD","classification":"G","division":"SINGLE STACK","hit_factor":7.3955},{"match_name":"TCSC USPSA Level I April club match","match_date":"2021-04-24","stage_classifiercode":"19-03","member_number":"A57842","first_name":"MICHAEL","last_name":"DANJCZEK","classification":"M","division":"SINGLE STACK","hit_factor":7.2423},{"match_name":"Rio Salado RMAP October 2021","match_date":"2021-10-17","stage_classifiercode":"19-03","member_number":"A61313","first_name":"BRETT","last_name":"BERG","classification":"M","division":"SINGLE STACK","hit_factor":6.9565},{"match_name":"ESPS USPSA April","match_date":"2021-04-23","stage_classifiercode":"19-03","member_number":"A57842","first_name":"MICHAEL","last_name":"DANJCZEK","classification":"M","division":"SINGLE STACK","hit_factor":6.9426},{"match_name":"Chillicothe Sportsmens Club November USPSA","match_date":"2021-11-20","stage_classifiercode":"19-03","member_number":"TY69648","first_name":"STEVE","last_name":"GALKA","classification":"A","division":"SINGLE STACK","hit_factor":6.8653},{"match_name":"TCSC USPSA Level I April club match","match_date":"2021-04-24","stage_classifiercode":"19-03","member_number":"A83744","first_name":"SCOTT","last_name":"RADER","classification":"U","division":"SINGLE STACK","hit_factor":6.7584},{"match_name":"USPSA MO21 Ozarks Classic Level II 2Alpha SBRC May 30 2020","match_date":"2020-05-30","stage_classifiercode":"19-03","member_number":"A95169","first_name":"JEFF","last_name":"CAWTHON","classification":"M","division":"SINGLE STACK","hit_factor":6.2104},{"match_name":"Pinetucky USPSA 02-15-20","match_date":"2020-02-15","stage_classifiercode":"19-03","member_number":"TY53092","first_name":"DEWEY","last_name":"HUTSON","classification":"A","division":"SINGLE STACK","hit_factor":6.1538},{"match_name":"TRSC Payson USPSA Aug 8 2020","match_date":"2020-08-08","stage_classifiercode":"19-03","member_number":"A81261","first_name":"THOMAS","last_name":"CLYDE","classification":"A","division":"SINGLE STACK","hit_factor":6.0241},{"match_name":"Cameo USPSA Match July 18 2020","match_date":"2020-07-18","stage_classifiercode":"19-03","member_number":"TY87711","first_name":"WALT","last_name":"PROULX","classification":"A","division":"SINGLE STACK","hit_factor":5.9867},{"match_name":"Go Fast Don’t Suck 2020 Spring Postal Match (USPSA) (clone)","match_date":"2020-03-01","stage_classifiercode":"19-03","member_number":"A97514","first_name":"BRADY","last_name":"HARDIN","classification":"M","division":"SINGLE STACK","hit_factor":5.951},{"match_name":"PIPS 06-24-2020","match_date":"2020-06-24","stage_classifiercode":"19-03","member_number":"TY86610","first_name":"RYAN","last_name":"WESTPHAL","classification":"B","division":"SINGLE STACK","hit_factor":5.9437},{"match_name":"SMPS 8 March 2020 USPSA Match","match_date":"2020-03-08","stage_classifiercode":"19-03","member_number":"A57842","first_name":"MICHAEL","last_name":"DANJCZEK","classification":"M","division":"SINGLE STACK","hit_factor":5.9371},{"match_name":"ESPS USPSA April","match_date":"2021-04-23","stage_classifiercode":"19-03","member_number":"TY84322","first_name":"SLIM JIM","last_name":"DILLEY","classification":"B","division":"SINGLE STACK","hit_factor":5.8617},{"match_name":"SOAP June 2021 USPSA Match","match_date":"2021-06-13","stage_classifiercode":"19-03","member_number":"A64278","first_name":"JOHN","last_name":"SPIER","classification":"A","division":"SINGLE STACK","hit_factor":5.7734},{"match_name":"LdF Practice May 9 2020","match_date":"2020-05-09","stage_classifiercode":"19-03","member_number":"TY68331","first_name":"AZIZ","last_name":"BROU","classification":"M","division":"SINGLE STACK","hit_factor":5.7734},{"match_name":"2020 Florida State USPSA Championship","match_date":"2020-01-17","stage_classifiercode":"19-03","member_number":"F123476","first_name":"ROBERT","last_name":"CERNIGOJ","classification":"U","division":"SINGLE STACK","hit_factor":5.7644},{"match_name":"Coyote Arms Classifier Match 10-31-21","match_date":"2021-10-31","stage_classifiercode":"19-03","member_number":"A106606","first_name":"ERIC","last_name":"SALAZAR","classification":"X","division":"SINGLE STACK","hit_factor":5.7634},{"match_name":"NCPS USPSA Handgun Match June 27-28 2020a","match_date":"2020-06-27","stage_classifiercode":"19-03","member_number":"TY93105","first_name":"BEN","last_name":"HARDT","classification":"A","division":"SINGLE STACK","hit_factor":5.7343},{"match_name":"Coyote Arms Classifier Match 10-31-21","match_date":"2021-10-31","stage_classifiercode":"19-03","member_number":"A63791","first_name":"JAMES","last_name":"ABENOJA","classification":"X","division":"SINGLE STACK","hit_factor":5.6047},{"match_name":"Oh Shoot/PRG 5.11 Championship Series - January 2021","match_date":"2021-01-02","stage_classifiercode":"19-03","member_number":"A123581","first_name":"MATTHEW","last_name":"THOMPSON","classification":"B","division":"SINGLE STACK","hit_factor":5.5208},{"match_name":"2020 Florida State USPSA Championship","match_date":"2020-01-17","stage_classifiercode":"19-03","member_number":"A69280","first_name":"ROBERT","last_name":"BOWERS","classification":"M","division":"SINGLE STACK","hit_factor":5.423},{"match_name":"RBGC 2020-1-25","match_date":"2020-01-25","stage_classifiercode":"19-03","member_number":"TY89704","first_name":"ROB","last_name":"MOORE","classification":"B","division":"SINGLE STACK","hit_factor":5.4002},{"match_name":"CCPS May 2021 USPSA","match_date":"2021-05-02","stage_classifiercode":"19-03","member_number":"L4806","first_name":"KEITH","last_name":"STEPHENSON","classification":"B","division":"SINGLE STACK","hit_factor":5.3691},{"match_name":"Temple Gun Club USPSA August 2021","match_date":"2021-08-01","stage_classifiercode":"19-03","member_number":"Ty70687","first_name":"ROMMEL","last_name":"MERCADO","classification":"B","division":"SINGLE STACK","hit_factor":5.3459},{"match_name":"Rio Salado UPPL July 2020 ALL CLASSIFIER MATCH","match_date":"2020-07-12","stage_classifiercode":"19-03","member_number":"TY91008","first_name":"KARL","last_name":"ROBINSON","classification":"U","division":"SINGLE STACK","hit_factor":5.3319},{"match_name":"TCSC USPSA Level I April club match","match_date":"2021-04-24","stage_classifiercode":"19-03","member_number":"TY77488","first_name":"OLEG","last_name":"SHEIN","classification":"B","division":"SINGLE STACK","hit_factor":5.3153},{"match_name":"Gem City Gun Club 10-3 and 10-4-2020","match_date":"2020-10-03","stage_classifiercode":"19-03","member_number":"TY112027","first_name":"BRIAN","last_name":"JOHNSON","classification":"C","division":"SINGLE STACK","hit_factor":5.314},{"match_name":"Cameo USPSA Match July 18 2020","match_date":"2020-07-18","stage_classifiercode":"19-03","member_number":"TY87712","first_name":"AUSTIN","last_name":"PROULX","classification":"M","division":"SINGLE STACK","hit_factor":5.2885},{"match_name":"BGSL CLASSIFIER","match_date":"2020-03-01","stage_classifiercode":"19-03","member_number":"RD6","first_name":"MIKE","last_name":"FOLEY","classification":"M","division":"SINGLE STACK","hit_factor":5.2486},{"match_name":"SFPS 5-17-20 USPSA","match_date":"2020-05-17","stage_classifiercode":"19-03","member_number":"L4421","first_name":"ROBERT","last_name":"OLSON","classification":"A","division":"SINGLE STACK","hit_factor":5.2356},{"match_name":"OKCGC USPSA March 2021 Match","match_date":"2021-03-06","stage_classifiercode":"19-03","member_number":"L4975","first_name":"BRYAN","last_name":"TAYLOR","classification":"B","division":"SINGLE STACK","hit_factor":5.2356},{"match_name":"Rio Salado RMAP October 2021","match_date":"2021-10-17","stage_classifiercode":"19-03","member_number":"A81261","first_name":"THOMAS","last_name":"CLYDE","classification":"A","division":"SINGLE STACK","hit_factor":5.2201},{"match_name":"LTD Pistol - Feb 2020","match_date":"2020-02-01","stage_classifiercode":"19-03","member_number":"A90644","first_name":"TOM","last_name":"NELSON","classification":"A","division":"SINGLE STACK","hit_factor":5.2114},{"match_name":"Rio Salado RMAP October 2021","match_date":"2021-10-17","stage_classifiercode":"19-03","member_number":"FY90171","first_name":"PETE","last_name":"UNDLIN","classification":"M","division":"SINGLE STACK","hit_factor":5.2083},{"match_name":"AREA 59 SUMMER OF 2020 ALL CLASSIFIER","match_date":"2020-08-29","stage_classifiercode":"19-03","member_number":"L4428","first_name":"ROSS","last_name":"APFFEL","classification":"B","division":"SINGLE STACK","hit_factor":5.1878},{"match_name":"OPSC USPSA September 2020","match_date":"2020-09-13","stage_classifiercode":"19-03","member_number":"ty42351","first_name":"JOE","last_name":"TSUI","classification":"B","division":"SINGLE STACK","hit_factor":5.1873},{"match_name":"PIPS 06-24-2020","match_date":"2020-06-24","stage_classifiercode":"19-03","member_number":"TY65888","first_name":"GREG","last_name":"BESTLAND","classification":"C","division":"SINGLE STACK","hit_factor":5.1587},{"match_name":"OREGON ARPC CC05 USPSA June 13 2020","match_date":"2020-06-13","stage_classifiercode":"19-03","member_number":"TY98534","first_name":"CLIFF","last_name":"WRIGHT","classification":"C","division":"SINGLE STACK","hit_factor":5.1282},{"match_name":"AREA 59 SUMMER OF 2020 ALL CLASSIFIER","match_date":"2020-08-29","stage_classifiercode":"19-03","member_number":"TY103350","first_name":"BLAINE","last_name":"NEWLIN","classification":"D","division":"SINGLE STACK","hit_factor":5.1088},{"match_name":"Oh Shoot/PRG 5.11 Championship Series - January 2021","match_date":"2021-01-02","stage_classifiercode":"19-03","member_number":"TY104374","first_name":"KEVIN","last_name":"MARGETTA","classification":"B","division":"SINGLE STACK","hit_factor":5.0926},{"match_name":"Wallis Orchard Practical Shooters August 2020 All Classifier Match","match_date":"2020-08-16","stage_classifiercode":"19-03","member_number":"FY93921","first_name":"PAT","last_name":"BYRNE","classification":"B","division":"SINGLE STACK","hit_factor":5.0186},{"match_name":"NVSA USPSA 2104","match_date":"2021-04-18","stage_classifiercode":"19-03","member_number":"A106051","first_name":"ROBERT","last_name":"SLABAUGH","classification":"U","division":"SINGLE STACK","hit_factor":5.0096},{"match_name":"IPSC66 WCRHC Special Classifier $30 July 26 2020 USPSA","match_date":"2020-07-26","stage_classifiercode":"19-03","member_number":"A81280","first_name":"JAY JAY","last_name":"LIMBO","classification":"A","division":"SINGLE STACK","hit_factor":4.9569},{"match_name":"EAGC January 2021 USPSA Classifier Match","match_date":"2021-01-30","stage_classifiercode":"19-03","member_number":"FY89922","first_name":"CHRIS","last_name":"WORKMAN","classification":"A","division":"SINGLE STACK","hit_factor":4.8884},{"match_name":"RCPS USPSA Mar 14","match_date":"2020-03-14","stage_classifiercode":"19-03","member_number":"TY60976","first_name":"DAVID","last_name":"HYLTON","classification":"B","division":"SINGLE STACK","hit_factor":4.8736},{"match_name":"MCTS - USPSA February 2020 Classifier Match ","match_date":"2020-02-14","stage_classifiercode":"19-03","member_number":"A126342","first_name":"RICHARD","last_name":"GOODYEAR","classification":"U","division":"SINGLE STACK","hit_factor":4.7915},{"match_name":"SUPS USPSA 15/16 Feb 2020 ","match_date":"2020-02-13","stage_classifiercode":"19-03","member_number":"A84409","first_name":"JALISE","last_name":"WILLIAMS","classification":"M","division":"SINGLE STACK","hit_factor":4.7865},{"match_name":"EAGC January 2021 USPSA Classifier Match","match_date":"2021-01-30","stage_classifiercode":"19-03","member_number":"A111956","first_name":"FREDERICK","last_name":"BROOME","classification":"U","division":"SINGLE STACK","hit_factor":4.7297},{"match_name":"Wickenburg Action Shooters Pistol USPSA 4 stage classifier match 09-11-2021","match_date":"2021-09-11","stage_classifiercode":"19-03","member_number":"A128788","first_name":"NICK","last_name":"ROBERTS","classification":"A","division":"SINGLE STACK","hit_factor":4.7179},{"match_name":"OKCGC USPSA March 2021 Match","match_date":"2021-03-06","stage_classifiercode":"19-03","member_number":"A112707","first_name":"CHRIS","last_name":"WILSON","classification":"B","division":"SINGLE STACK","hit_factor":4.7144},{"match_name":"Shongum October 2020 USPSA Match","match_date":"2020-10-03","stage_classifiercode":"19-03","member_number":"A6741","first_name":"ROGER","last_name":"READ","classification":"U","division":"SINGLE STACK","hit_factor":4.6861},{"match_name":"MCRC USPSA Feb 2020","match_date":"2020-02-08","stage_classifiercode":"19-03","member_number":"A107746","first_name":"DANIEL","last_name":"DOUGHTON","classification":"B","division":"SINGLE STACK","hit_factor":4.6667},{"match_name":"EWPSA 2021-04","match_date":"2021-04-17","stage_classifiercode":"19-03","member_number":"TY106402","first_name":"ART","last_name":"TORDINI","classification":"B","division":"SINGLE STACK","hit_factor":4.6632},{"match_name":"LTD Pistol - Feb 2020","match_date":"2020-02-01","stage_classifiercode":"19-03","member_number":"A119702","first_name":"COLTON","last_name":"GILMORE","classification":"U","division":"SINGLE STACK","hit_factor":4.655},{"match_name":"Bossier Parish Practical Shooters August 16 2020","match_date":"2020-08-16","stage_classifiercode":"19-03","member_number":"A117184","first_name":"KEVIN","last_name":"WOOD","classification":"B","division":"SINGLE STACK","hit_factor":4.641},{"match_name":"Shongum October 2020 USPSA Match","match_date":"2020-10-03","stage_classifiercode":"19-03","member_number":"TY97466","first_name":"TED","last_name":"ZAJAC","classification":"B","division":"SINGLE STACK","hit_factor":4.6296},{"match_name":"TCSC USPSA Level I April club match","match_date":"2021-04-24","stage_classifiercode":"19-03","member_number":"L4776","first_name":"NOEL","last_name":"ZARZA","classification":"A","division":"SINGLE STACK","hit_factor":4.6218},{"match_name":"Rio Salado RMAP October 2021","match_date":"2021-10-17","stage_classifiercode":"19-03","member_number":"L4050","first_name":"CHRIS","last_name":"NOWACK","classification":"U","division":"SINGLE STACK","hit_factor":4.6087},{"match_name":"CCAS June 2020","match_date":"2020-06-20","stage_classifiercode":"19-03","member_number":"TY55041","first_name":"MARK","last_name":"DZIAMSKI","classification":"B","division":"SINGLE STACK","hit_factor":4.6064},{"match_name":"IPSC66 WCRHC Special Classifier $30 July 26 2020 USPSA","match_date":"2020-07-26","stage_classifiercode":"19-03","member_number":"TY78445","first_name":"ALLIE","last_name":"FLUENT","classification":"U","division":"SINGLE STACK","hit_factor":4.5957},{"match_name":"5 Dogs June USPSA 2021","match_date":"2021-06-06","stage_classifiercode":"19-03","member_number":"FY61674","first_name":"CHRIS","last_name":"HIRT","classification":"B","division":"SINGLE STACK","hit_factor":4.557},{"match_name":"2020 Florida State USPSA Championship","match_date":"2020-01-17","stage_classifiercode":"19-03","member_number":"TY113767","first_name":"ELNAR","last_name":"SAFAR","classification":"C","division":"SINGLE STACK","hit_factor":4.5408},{"match_name":"NCPS USPSA Handgun Match June 27-28 2020a","match_date":"2020-06-27","stage_classifiercode":"19-03","member_number":"A16730","first_name":"RON","last_name":"SECHLER","classification":"B","division":"SINGLE STACK","hit_factor":4.4902},{"match_name":"5 Dogs June USPSA 2021","match_date":"2021-06-06","stage_classifiercode":"19-03","member_number":"A104528","first_name":"NAOMI","last_name":"MOSS","classification":"B","division":"SINGLE STACK","hit_factor":4.4603},{"match_name":"USPSA MO21 Ozarks Classic Level II 2Alpha SBRC May 30 2020","match_date":"2020-05-30","stage_classifiercode":"19-03","member_number":"L485","first_name":"RAY","last_name":"HIRST","classification":"B","division":"SINGLE STACK","hit_factor":4.4575},{"match_name":"BGSL CLASSIFIER","match_date":"2020-03-01","stage_classifiercode":"19-03","member_number":"TY92832","first_name":"JEFF","last_name":"PERDUE","classification":"B","division":"SINGLE STACK","hit_factor":4.44},{"match_name":"Springfield Tactical Shooters 12/03/2020","match_date":"2020-12-03","stage_classifiercode":"19-03","member_number":"A17057","first_name":"JIM","last_name":"KATES","classification":"B","division":"SINGLE STACK","hit_factor":4.4374},{"match_name":"Chillicothe Sportsmens Club November USPSA","match_date":"2021-11-20","stage_classifiercode":"19-03","member_number":"TY6162","first_name":"PAUL","last_name":"BRENKMAN","classification":"A","division":"SINGLE STACK","hit_factor":4.4271},{"match_name":"USPSA MO21 Ozarks Classic Level II 2Alpha SBRC May 30 2020","match_date":"2020-05-30","stage_classifiercode":"19-03","member_number":"A84946","first_name":"GINA","last_name":"COATS","classification":"B","division":"SINGLE STACK","hit_factor":4.4255},{"match_name":"RCSC Classifier Match 14 Jun 20","match_date":"2020-06-14","stage_classifiercode":"19-03","member_number":"TY91247","first_name":"TONY","last_name":"CABRERA","classification":"U","division":"SINGLE STACK","hit_factor":4.417},{"match_name":"LCSA USPSA  JUNE MATCH","match_date":"2021-06-12","stage_classifiercode":"19-03","member_number":"TY95936","first_name":"DAN","last_name":"HUBERT","classification":"C","division":"SINGLE STACK","hit_factor":4.3974},{"match_name":"WVPPS June 2021","match_date":"2021-06-20","stage_classifiercode":"19-03","member_number":"A97039","first_name":"JON","last_name":"BOURNE","classification":"B","division":"SINGLE STACK","hit_factor":4.3919},{"match_name":"Square Deal Sportsman USPSA June 2020","match_date":"2020-06-07","stage_classifiercode":"19-03","member_number":"TY90822","first_name":"DALE","last_name":"WILDENSTEIN","classification":"C","division":"SINGLE STACK","hit_factor":4.3902},{"match_name":"SFPS 5-17-20 USPSA","match_date":"2020-05-17","stage_classifiercode":"19-03","member_number":"A117144","first_name":"MICHAEL","last_name":"HERBST","classification":"U","division":"SINGLE STACK","hit_factor":4.3725},{"match_name":"Medford USPSA March 2020","match_date":"2020-03-15","stage_classifiercode":"19-03","member_number":"TY48245","first_name":"ERIC","last_name":"HILL","classification":"B","division":"SINGLE STACK","hit_factor":4.3553},{"match_name":"EWPSA 2021-04","match_date":"2021-04-17","stage_classifiercode":"19-03","member_number":"FY105750","first_name":"LEE","last_name":"BOYLE","classification":"C","division":"SINGLE STACK","hit_factor":4.3515},{"match_name":"DTR  USPSA 8/20","match_date":"2020-08-08","stage_classifiercode":"19-03","member_number":"A53154","first_name":"HADEN","last_name":"HARGUS","classification":"A","division":"SINGLE STACK","hit_factor":4.3436},{"match_name":"Bitterroot Blasters  USPSA May 2021","match_date":"2021-05-23","stage_classifiercode":"19-03","member_number":"A109732","first_name":"DYLAN","last_name":"VANDAM","classification":"B","division":"SINGLE STACK","hit_factor":4.3408},{"match_name":"DSSA 2021-02 USPSA Pistol","match_date":"2021-02-28","stage_classifiercode":"19-03","member_number":"TY84389","first_name":"ETHAN","last_name":"BOUDREAUX","classification":"A","division":"SINGLE STACK","hit_factor":4.3384},{"match_name":"HPDMT USPSA Classifier Match","match_date":"2021-10-30","stage_classifiercode":"19-03","member_number":"A48726","first_name":"JERRY","last_name":"MCCLAIN","classification":"U","division":"SINGLE STACK","hit_factor":4.3339},{"match_name":"SFPS 5-16-21 Super Classifier","match_date":"2021-05-16","stage_classifiercode":"19-03","member_number":"l4421","first_name":"ROBERT","last_name":"OLSON","classification":"A","division":"SINGLE STACK","hit_factor":4.3204},{"match_name":"Temple Gun Club USPSA August 2021","match_date":"2021-08-01","stage_classifiercode":"19-03","member_number":"A120139","first_name":"RAUL","last_name":"GONZALEZ","classification":"U","division":"SINGLE STACK","hit_factor":4.2776},{"match_name":"CCPS 20210425","match_date":"2021-04-25","stage_classifiercode":"19-03","member_number":"A25335","first_name":"HENNING","last_name":"WALLGREN","classification":"U","division":"SINGLE STACK","hit_factor":4.253},{"match_name":"Oh Shoot/PRG 5.11 Championship Series - January 2021","match_date":"2021-01-02","stage_classifiercode":"19-03","member_number":"A75787","first_name":"MIKE","last_name":"DIXON","classification":"A","division":"SINGLE STACK","hit_factor":4.2311},{"match_name":"PASA USPSA IL 09 Club Match August 16 2020","match_date":"2020-08-16","stage_classifiercode":"19-03","member_number":"A49418","first_name":"WILLIAM","last_name":"BROCK","classification":"C","division":"SINGLE STACK","hit_factor":4.2254},{"match_name":"CTASA - 3rd Sunday USPSA at Triple C Range - 8-16-2020","match_date":"2020-08-16","stage_classifiercode":"19-03","member_number":"TY61608","first_name":"BOB","last_name":"RAO","classification":"C","division":"SINGLE STACK","hit_factor":4.2125},{"match_name":"Havasu Herd Immunity Match","match_date":"2020-05-16","stage_classifiercode":"19-03","member_number":"FY52259","first_name":"TERRANCE","last_name":"SULLIVAN","classification":"B","division":"SINGLE STACK","hit_factor":4.2065},{"match_name":"5 Dogs March USPSA 2020","match_date":"2020-03-01","stage_classifiercode":"19-03","member_number":"TY61674","first_name":"CHRISTOPHER","last_name":"HIRT","classification":"B","division":"SINGLE STACK","hit_factor":4.1945},{"match_name":"USPSA MO21 Ozarks Classic Level II 2Alpha SBRC May 30 2020","match_date":"2020-05-30","stage_classifiercode":"19-03","member_number":"A89335","first_name":"CYRIL","last_name":"FIDER","classification":"B","division":"SINGLE STACK","hit_factor":4.1935},{"match_name":"SFPS 5-17-20 USPSA","match_date":"2020-05-17","stage_classifiercode":"19-03","member_number":"L3232","first_name":"THOMAS","last_name":"HOWARD","classification":"A","division":"SINGLE STACK","hit_factor":4.1475},{"match_name":"Nampa USPSA February 1st","match_date":"2020-02-01","stage_classifiercode":"19-03","member_number":"L3630","first_name":"TRAVIS","last_name":"GIBSON","classification":"U","division":"SINGLE STACK","hit_factor":4.1349},{"match_name":"SFPC Dec 6 2020   USPSA Monthly Match","match_date":"2020-12-06","stage_classifiercode":"19-03","member_number":"TY113767","first_name":"ELNAR","last_name":"SAFAR","classification":"C","division":"SINGLE STACK","hit_factor":4.0475},{"match_name":"EAGC March 2020 USPSA Pistol Match","match_date":"2020-03-15","stage_classifiercode":"19-03","member_number":"FY66318","first_name":"BARRY","last_name":"PEPPERS","classification":"B","division":"SINGLE STACK","hit_factor":4.0169},{"match_name":"PASA USPSA IL 09 Club Match August 16 2020","match_date":"2020-08-16","stage_classifiercode":"19-03","member_number":"TY75156","first_name":"JASON","last_name":"DARNELL","classification":"C","division":"SINGLE STACK","hit_factor":4.0062},{"match_name":"PIPS 06-24-2020","match_date":"2020-06-24","stage_classifiercode":"19-03","member_number":"A86892","first_name":"KEVIN","last_name":"ARHELGER","classification":"C","division":"SINGLE STACK","hit_factor":3.9483},{"match_name":"OPSC USPSA September 2020","match_date":"2020-09-13","stage_classifiercode":"19-03","member_number":"A65099","first_name":"JOHN","last_name":"MURPHY","classification":"C","division":"SINGLE STACK","hit_factor":3.9424},{"match_name":"AREA 59 SUMMER OF 2020 ALL CLASSIFIER","match_date":"2020-08-29","stage_classifiercode":"19-03","member_number":"A119231","first_name":"ANTHONY","last_name":"VEITH","classification":"U","division":"SINGLE STACK","hit_factor":3.9322},{"match_name":"MCTS - USPSA February 2020 Classifier Match ","match_date":"2020-02-14","stage_classifiercode":"19-03","member_number":"A115410","first_name":"GEOFF","last_name":"WEBB","classification":"U","division":"SINGLE STACK","hit_factor":3.9157},{"match_name":"Medford USPSA March 2020","match_date":"2020-03-15","stage_classifiercode":"19-03","member_number":"TY81123","first_name":"JAKE","last_name":"NELSON","classification":"B","division":"SINGLE STACK","hit_factor":3.9014},{"match_name":"Rio Salado RMAP October 2021","match_date":"2021-10-17","stage_classifiercode":"19-03","member_number":"FY28831","first_name":"ALAN","last_name":"GLICKMAN","classification":"B","division":"SINGLE STACK","hit_factor":3.8754},{"match_name":"PASA USPSA IL 09 Club Match August 16 2020","match_date":"2020-08-16","stage_classifiercode":"19-03","member_number":"TY56034","first_name":"DAVE","last_name":"DIRKSMEYER","classification":"C","division":"SINGLE STACK","hit_factor":3.8576},{"match_name":"ACC  Movement Classifier Match May 31","match_date":"2020-05-31","stage_classifiercode":"19-03","member_number":"A52087","first_name":"JOHN","last_name":"BLACKWELL","classification":"A","division":"SINGLE STACK","hit_factor":3.8523},{"match_name":"NW15 Port Townsend Practical Pistol USPSA November 7 2020","match_date":"2020-11-07","stage_classifiercode":"19-03","member_number":"TY106402","first_name":"ART","last_name":"TORDINI","classification":"U","division":"SINGLE STACK","hit_factor":3.8517},{"match_name":"Fort Wayne USPSA July 2020","match_date":"2020-07-19","stage_classifiercode":"19-03","member_number":"A52087","first_name":"JOHN","last_name":"BLACKWELL","classification":"A","division":"SINGLE STACK","hit_factor":3.8321},{"match_name":"Gem City Gun Club 10-3 and 10-4-2020","match_date":"2020-10-03","stage_classifiercode":"19-03","member_number":"A110991","first_name":"JAMES","last_name":"JOHNSON","classification":"C","division":"SINGLE STACK","hit_factor":3.8292},{"match_name":"PASA USPSA IL 09 Club Match August 16 2020","match_date":"2020-08-16","stage_classifiercode":"19-03","member_number":"a58824","first_name":"DANIEL","last_name":"ROYALTY","classification":"C","division":"SINGLE STACK","hit_factor":3.7931},{"match_name":"RBGC 2020-1-25","match_date":"2020-01-25","stage_classifiercode":"19-03","member_number":"FY68930","first_name":"NOAH","last_name":"TEAL","classification":"C","division":"SINGLE STACK","hit_factor":3.7846},{"match_name":"Texarkana Gun Club USPSA Match - March Classifier Mania!","match_date":"2021-03-06","stage_classifiercode":"19-03","member_number":"L4462","first_name":"JIM","last_name":"FOWLER","classification":"U","division":"SINGLE STACK","hit_factor":3.7833},{"match_name":"ARPC USPSA Match 4-25-21","match_date":"2021-04-25","stage_classifiercode":"19-03","member_number":"TY70803","first_name":"JEFFREY","last_name":"PHILIPH","classification":"B","division":"SINGLE STACK","hit_factor":3.77},{"match_name":"2020 Florida State USPSA Championship","match_date":"2020-01-17","stage_classifiercode":"19-03","member_number":"TY87131","first_name":"JONATHAN","last_name":"BAGLEY","classification":"C","division":"SINGLE STACK","hit_factor":3.7234},{"match_name":"Mesquite Mayhem Monthly USPSA Match","match_date":"2021-02-27","stage_classifiercode":"19-03","member_number":"ty86699","first_name":"BRUCE","last_name":"LANDVIK","classification":"C","division":"SINGLE STACK","hit_factor":3.7196},{"match_name":"SFPS 5-16-21 Super Classifier","match_date":"2021-05-16","stage_classifiercode":"19-03","member_number":"A112127","first_name":"RYAN","last_name":"MARTINSON","classification":"U","division":"SINGLE STACK","hit_factor":3.7194},{"match_name":"WVPPS June 2021","match_date":"2021-06-20","stage_classifiercode":"19-03","member_number":"L4706","first_name":"JOSH","last_name":"MAWHORR","classification":"U","division":"SINGLE STACK","hit_factor":3.7185},{"match_name":"Wallis Orchard Practical Shooters August 2021 All Classifier Match","match_date":"2021-08-12","stage_classifiercode":"19-03","member_number":"Fy93921","first_name":"PAT","last_name":"BYRNE","classification":"B","division":"SINGLE STACK","hit_factor":3.7182},{"match_name":"DSSA 2021-02 USPSA Pistol","match_date":"2021-02-28","stage_classifiercode":"19-03","member_number":"L4158","first_name":"CHRIS","last_name":"BROWN","classification":"B","division":"SINGLE STACK","hit_factor":3.6775},{"match_name":"WPS USPSA Monthly Match","match_date":"2020-10-31","stage_classifiercode":"19-03","member_number":"A81150","first_name":"DARREN","last_name":"EMERY","classification":"C","division":"SINGLE STACK","hit_factor":3.671},{"match_name":"GRB USPSA JULY 2020 AT CAVALIER","match_date":"2020-07-18","stage_classifiercode":"19-03","member_number":"TY49256","first_name":"RAY","last_name":"MEAD","classification":"B","division":"SINGLE STACK","hit_factor":3.6559},{"match_name":"Springfield Tactical Shooters 12/03/2020","match_date":"2020-12-03","stage_classifiercode":"19-03","member_number":"A29017","first_name":"ED","last_name":"ANDERSON","classification":"\"\"","division":"SINGLE STACK","hit_factor":3.6417},{"match_name":"AREA 59 SUMMER OF 2020 ALL CLASSIFIER","match_date":"2020-08-29","stage_classifiercode":"19-03","member_number":"FY93921","first_name":"PAT","last_name":"BYRNE","classification":"B","division":"SINGLE STACK","hit_factor":3.6406},{"match_name":"CAS 3ed weekend makeup match","match_date":"2020-06-21","stage_classifiercode":"19-03","member_number":"TY39825","first_name":"BARBARA","last_name":"THIBODAUX","classification":"C","division":"SINGLE STACK","hit_factor":3.6391},{"match_name":"Pinetucky USPSA 02-15-20","match_date":"2020-02-15","stage_classifiercode":"19-03","member_number":"A107746","first_name":"DANIEL","last_name":"DOUGHTON","classification":"B","division":"SINGLE STACK","hit_factor":3.6315},{"match_name":"Rio Salado UPPL July 2020 ALL CLASSIFIER MATCH","match_date":"2020-07-12","stage_classifiercode":"19-03","member_number":"L3475","first_name":"MICHAEL","last_name":"MAYMAN","classification":"B","division":"SINGLE STACK","hit_factor":3.6107},{"match_name":"EAGC March 2020 USPSA Pistol Match","match_date":"2020-03-15","stage_classifiercode":"19-03","member_number":"TY75726","first_name":"PEDRO","last_name":"QUINONES","classification":"B","division":"SINGLE STACK","hit_factor":3.6088},{"match_name":"SMPS 8 March 2020 USPSA Match","match_date":"2020-03-08","stage_classifiercode":"19-03","member_number":"A114947","first_name":"W.G.","last_name":"HASKINS","classification":"C","division":"SINGLE STACK","hit_factor":3.6066},{"match_name":"Briar Rabbit June 2021","match_date":"2021-06-27","stage_classifiercode":"19-03","member_number":"A103072","first_name":"SHANE","last_name":"CLAUSING","classification":"B","division":"SINGLE STACK","hit_factor":3.5714},{"match_name":"BGSL CLASSIFIER","match_date":"2020-03-01","stage_classifiercode":"19-03","member_number":"A102440","first_name":"DANNY","last_name":"KORN","classification":"C","division":"SINGLE STACK","hit_factor":3.5587},{"match_name":"Oh Shoot/PRG 5.11 Championship Series - January 2021","match_date":"2021-01-02","stage_classifiercode":"19-03","member_number":"TY109002","first_name":"JEFF","last_name":"LYNCH","classification":"B","division":"SINGLE STACK","hit_factor":3.5547},{"match_name":"NCPS USPSA Handgun Match June 27-28 2020a","match_date":"2020-06-27","stage_classifiercode":"19-03","member_number":"L3855","first_name":"MARCI","last_name":"MINTER","classification":"C","division":"SINGLE STACK","hit_factor":3.5503},{"match_name":"MCTA MS19 October 4","match_date":"2020-10-04","stage_classifiercode":"19-03","member_number":"TY88701","first_name":"ROBERT","last_name":"CAMPBELL","classification":"C","division":"SINGLE STACK","hit_factor":3.5354},{"match_name":"Emmett April Match","match_date":"2020-04-25","stage_classifiercode":"19-03","member_number":"L4033","first_name":"JERRY","last_name":"WESTCOTT","classification":"M","division":"SINGLE STACK","hit_factor":3.528},{"match_name":"SAPS Match 3/21/2020","match_date":"2020-03-21","stage_classifiercode":"19-03","member_number":"A120323","first_name":"TODD","last_name":"WAGNER","classification":"U","division":"SINGLE STACK","hit_factor":3.5258},{"match_name":"2020 Florida State USPSA Championship","match_date":"2020-01-17","stage_classifiercode":"19-03","member_number":"TY120140","first_name":"ELIZABETH","last_name":"KIM","classification":"C","division":"SINGLE STACK","hit_factor":3.5162},{"match_name":"LCSA USPSA October 2020","match_date":"2020-10-08","stage_classifiercode":"19-03","member_number":"A68017","first_name":"MICHAEL","last_name":"BATTS","classification":"B","division":"SINGLE STACK","hit_factor":3.5071},{"match_name":"Nampa USPSA February 1st","match_date":"2020-02-01","stage_classifiercode":"19-03","member_number":"Ty82856","first_name":"JOHN","last_name":"KITSON","classification":"M","division":"SINGLE STACK","hit_factor":3.4948},{"match_name":"SPCGC Hosts the Kidlat Shooters USPSA 8/19/21","match_date":"2021-08-19","stage_classifiercode":"19-03","member_number":"A83339","first_name":"NIC","last_name":"BLADES","classification":"C","division":"SINGLE STACK","hit_factor":3.4876},{"match_name":"DSSA 2021-02 USPSA Pistol","match_date":"2021-02-28","stage_classifiercode":"19-03","member_number":"A4850","first_name":"PAUL","last_name":"CRECHALE","classification":"U","division":"SINGLE STACK","hit_factor":3.4875},{"match_name":"Matamoras USPSA September 2020","match_date":"2020-09-20","stage_classifiercode":"19-03","member_number":"A93194","first_name":"DAN","last_name":"LONDON","classification":"B","division":"SINGLE STACK","hit_factor":3.481},{"match_name":"PMRPC USPSA August 2020  - ALL CLASSIFIER STAGES","match_date":"2020-08-08","stage_classifiercode":"19-03","member_number":"TY129612","first_name":"DAVID","last_name":"FISCHER","classification":"U","division":"SINGLE STACK","hit_factor":3.4689},{"match_name":"Rio Salado RMAP October 2021","match_date":"2021-10-17","stage_classifiercode":"19-03","member_number":"L3475","first_name":"MICHAEL","last_name":"MAYMAN","classification":"B","division":"SINGLE STACK","hit_factor":3.4586},{"match_name":"SMPS 8 March 2020 USPSA Match","match_date":"2020-03-08","stage_classifiercode":"19-03","member_number":"TY61811","first_name":"JARED","last_name":"WOOD","classification":"C","division":"SINGLE STACK","hit_factor":3.4529},{"match_name":"Warsaw USPSA 7-12-2020 IN21 WRPC","match_date":"2020-07-12","stage_classifiercode":"19-03","member_number":"A52087","first_name":"JOHN","last_name":"BLACKWELL","classification":"A","division":"SINGLE STACK","hit_factor":3.4515},{"match_name":"EAGC January 2021 USPSA Classifier Match","match_date":"2021-01-30","stage_classifiercode":"19-03","member_number":"TY106020","first_name":"JACOB","last_name":"TAYLOR","classification":"U","division":"SINGLE STACK","hit_factor":3.4364},{"match_name":"LPRGC USPSA Easter Weekend Match April 2021","match_date":"2021-04-03","stage_classifiercode":"19-03","member_number":"A103188","first_name":"TOM","last_name":"NGUYEN","classification":"B","division":"SINGLE STACK","hit_factor":3.4355},{"match_name":"Shongum October 2021 USPSA Match","match_date":"2021-10-02","stage_classifiercode":"19-03","member_number":"A20395","first_name":"LEO","last_name":"PRIMERO III","classification":"B","division":"SINGLE STACK","hit_factor":3.4259},{"match_name":"NW01 Paul Bunyan USPSA July 11 Match","match_date":"2021-07-11","stage_classifiercode":"19-03","member_number":"fy27156","first_name":"STEVE","last_name":"CLEMO","classification":"B","division":"SINGLE STACK","hit_factor":3.4224},{"match_name":"Rio Salado UPPL July 2020 ALL CLASSIFIER MATCH","match_date":"2020-07-12","stage_classifiercode":"19-03","member_number":"A911142","first_name":"SHELTON","last_name":"FLOWERS","classification":"U","division":"SINGLE STACK","hit_factor":3.4167},{"match_name":"Square Deal Sportsman USPSA June 2020","match_date":"2020-06-07","stage_classifiercode":"19-03","member_number":"A108852","first_name":"JERRY","last_name":"PAGLIA","classification":"C","division":"SINGLE STACK","hit_factor":3.4119},{"match_name":"2021-05-01 USPSA with 2 Classifiers at Phoenix Rod and Gun Club","match_date":"2021-05-01","stage_classifiercode":"19-03","member_number":"A94324","first_name":"DONNA","last_name":"AUER","classification":"U","division":"SINGLE STACK","hit_factor":3.4024},{"match_name":"OREGON ARPC CC05 USPSA June 13 2020","match_date":"2020-06-13","stage_classifiercode":"19-03","member_number":"L4400","first_name":"AARON","last_name":"ERICKSON","classification":"C","division":"SINGLE STACK","hit_factor":3.3966},{"match_name":"Wallis Orchard Practical Shooters August 2020 All Classifier Match","match_date":"2020-08-16","stage_classifiercode":"19-03","member_number":"TY67519","first_name":"EMMAN","last_name":"ALCOSEBA","classification":"C","division":"SINGLE STACK","hit_factor":3.3898},{"match_name":"LPRGC USPSA Easter Weekend Match April 2021","match_date":"2021-04-03","stage_classifiercode":"19-03","member_number":"TY21185","first_name":"GARY","last_name":"BERTOLET","classification":"A","division":"SINGLE STACK","hit_factor":3.3898},{"match_name":"Wickenburg Action Shooters Pistol USPSA 4 stage classifier match 09-11-2021","match_date":"2021-09-11","stage_classifiercode":"19-03","member_number":"A2643","first_name":"TOM","last_name":"CALANDRA","classification":"A","division":"SINGLE STACK","hit_factor":3.3872},{"match_name":"NVGC Practical Shooters August 2020","match_date":"2020-08-08","stage_classifiercode":"19-03","member_number":"A64743","first_name":"JOEL","last_name":"LABTIC","classification":"\"\"","division":"SINGLE STACK","hit_factor":3.3727},{"match_name":"Rio Salado RMAP October 2021","match_date":"2021-10-17","stage_classifiercode":"19-03","member_number":"TY80294","first_name":"GARY","last_name":"SMITH","classification":"C","division":"SINGLE STACK","hit_factor":3.3716},{"match_name":"SFPC Dec 6 2020   USPSA Monthly Match","match_date":"2020-12-06","stage_classifiercode":"19-03","member_number":"TY83822","first_name":"ALEJANDRO","last_name":"ONOFRIO","classification":"U","division":"SINGLE STACK","hit_factor":3.3708},{"match_name":"Pinetucky USPSA 02-15-20","match_date":"2020-02-15","stage_classifiercode":"19-03","member_number":"A69714","first_name":"MARK","last_name":"GAINEY","classification":"D","division":"SINGLE STACK","hit_factor":3.3661},{"match_name":"CCSC USPSA All Classifier Match","match_date":"2021-06-12","stage_classifiercode":"19-03","member_number":"A127539","first_name":"DAVID","last_name":"WHITE","classification":"D","division":"SINGLE STACK","hit_factor":3.3613},{"match_name":"NW01 Paul Bunyan USPSA July 11 Match","match_date":"2021-07-11","stage_classifiercode":"19-03","member_number":"TY106402","first_name":"ART","last_name":"TORDINI","classification":"B","division":"SINGLE STACK","hit_factor":3.3482},{"match_name":"Lafayette Practical Shooters - WED - Dec 9 - CLASSIFIER MATCH","match_date":"2020-12-10","stage_classifiercode":"19-03","member_number":"TY76050","first_name":"STEPHEN","last_name":"WILLIAMS","classification":"B","division":"SINGLE STACK","hit_factor":3.3117},{"match_name":"ESPS USPSA April","match_date":"2021-04-23","stage_classifiercode":"19-03","member_number":"A85450","first_name":"ANDY","last_name":"PERSHALL","classification":"B","division":"SINGLE STACK","hit_factor":3.3106},{"match_name":"Oh Shoot/PRG 5.11 Championship Series - January 2021","match_date":"2021-01-02","stage_classifiercode":"19-03","member_number":"A78063","first_name":"MIKE","last_name":"PAPS","classification":"B","division":"SINGLE STACK","hit_factor":3.2977},{"match_name":"WNYPPL September 2020 USPSA","match_date":"2020-09-27","stage_classifiercode":"19-03","member_number":"TY53986","first_name":"SEAN","last_name":"FALLON","classification":"C","division":"SINGLE STACK","hit_factor":3.2938},{"match_name":"WI21 Jul 26 2020 Classifier","match_date":"2020-07-26","stage_classifiercode":"19-03","member_number":"TY90193","first_name":"KEITH","last_name":"HOFFMANN","classification":"D","division":"SINGLE STACK","hit_factor":3.2828},{"match_name":"Coastal Area Practical Shooters 8-22-20 Special Classifer","match_date":"2020-08-22","stage_classifiercode":"19-03","member_number":"L4833","first_name":"MICHAEL","last_name":"HARBISON","classification":"U","division":"SINGLE STACK","hit_factor":3.2759},{"match_name":"Rio Salado UPPL July 2020 ALL CLASSIFIER MATCH","match_date":"2020-07-12","stage_classifiercode":"19-03","member_number":"L3417","first_name":"JAMES","last_name":"ROBERTS","classification":"B","division":"SINGLE STACK","hit_factor":3.2689},{"match_name":"Springfield Tactical Shooters 12/03/2020","match_date":"2020-12-03","stage_classifiercode":"19-03","member_number":"A17057","first_name":"JIM","last_name":"KATES","classification":"B","division":"SINGLE STACK","hit_factor":3.2589},{"match_name":"SOAP June 2021 USPSA Match","match_date":"2021-06-13","stage_classifiercode":"19-03","member_number":"FY95274","first_name":"OSWALDO","last_name":"RUIZ","classification":"C","division":"SINGLE STACK","hit_factor":3.2566},{"match_name":"USPSA","match_date":"2020-03-01","stage_classifiercode":"19-03","member_number":"TY103588","first_name":"CHIP","last_name":"MEADOR","classification":"C","division":"SINGLE STACK","hit_factor":3.2296},{"match_name":"NW01 Paul Bunyan USPSA September12 Match","match_date":"2021-09-12","stage_classifiercode":"19-03","member_number":"Ty92223","first_name":"STUART","last_name":"WILSON","classification":"A","division":"SINGLE STACK","hit_factor":3.2258},{"match_name":"Sharp Practical Shooters July USPSA ","match_date":"2020-07-25","stage_classifiercode":"19-03","member_number":"TY77818","first_name":"ANDREW","last_name":"JOHNSON","classification":"B","division":"SINGLE STACK","hit_factor":3.2235},{"match_name":"Go Fast Don’t Suck 2020 Spring Postal Match (USPSA) (clone)","match_date":"2020-03-01","stage_classifiercode":"19-03","member_number":"TY102553","first_name":"FRANK","last_name":"SWEET","classification":"C","division":"SINGLE STACK","hit_factor":3.2209},{"match_name":"Coastal Area Practical Shooters 8-22-20 Special Classifer","match_date":"2020-08-22","stage_classifiercode":"19-03","member_number":"TY86756","first_name":"RUSS","last_name":"DEAN","classification":"M","division":"SINGLE STACK","hit_factor":3.1818},{"match_name":"PASA USPSA IL 09 Club Match August 16 2020","match_date":"2020-08-16","stage_classifiercode":"19-03","member_number":"L3195","first_name":"RICK","last_name":"HAMANN","classification":"B","division":"SINGLE STACK","hit_factor":3.1746},{"match_name":"FVPS USPSA Point Series Match July 4th","match_date":"2020-07-04","stage_classifiercode":"19-03","member_number":"TY112322","first_name":"SANDRA MARIE","last_name":"DIALLO","classification":"D","division":"SINGLE STACK","hit_factor":3.1471},{"match_name":"Bitterroot Blasters  USPSA May 2021","match_date":"2021-05-23","stage_classifiercode":"19-03","member_number":"A109562","first_name":"DAVID","last_name":"BRIDGES","classification":"C","division":"SINGLE STACK","hit_factor":3.1456},{"match_name":"Nampa USPSA February 1st","match_date":"2020-02-01","stage_classifiercode":"19-03","member_number":"TY106096","first_name":"BRIAN","last_name":"GRAY","classification":"U","division":"SINGLE STACK","hit_factor":3.1414},{"match_name":"Gem City Gun Club 10-3 and 10-4-2020","match_date":"2020-10-03","stage_classifiercode":"19-03","member_number":"L3880","first_name":"JOSEPH","last_name":"PARADISI","classification":"B","division":"SINGLE STACK","hit_factor":3.125},{"match_name":"SMPS 8 March 2020 USPSA Match","match_date":"2020-03-08","stage_classifiercode":"19-03","member_number":"L4181","first_name":"MIKE","last_name":"HASKIN","classification":"B","division":"SINGLE STACK","hit_factor":3.1227},{"match_name":"Texarkana Gun Club USPSA Match - March Classifier Mania!","match_date":"2021-03-06","stage_classifiercode":"19-03","member_number":"A34353","first_name":"DOUGLAS","last_name":"BREAUX","classification":"B","division":"SINGLE STACK","hit_factor":3.1125},{"match_name":"MASTER BLASTERS & SSFGA USPSA - July","match_date":"2020-07-18","stage_classifiercode":"19-03","member_number":"A96901","first_name":"JOE","last_name":"WOO","classification":"U","division":"SINGLE STACK","hit_factor":3.1037},{"match_name":"Shongum October 2021 USPSA Match","match_date":"2021-10-02","stage_classifiercode":"19-03","member_number":"A125701","first_name":"JAMES","last_name":"RICK JR","classification":"D","division":"SINGLE STACK","hit_factor":3.1017},{"match_name":"5 Dogs March USPSA 2020","match_date":"2020-03-01","stage_classifiercode":"19-03","member_number":"TY124013","first_name":"STEPHEN","last_name":"MOSS","classification":"U","division":"SINGLE STACK","hit_factor":3.0942},{"match_name":"EAGC March 2020 USPSA Pistol Match","match_date":"2020-03-15","stage_classifiercode":"19-03","member_number":"FY28307","first_name":"DAN","last_name":"MITCHELL","classification":"A","division":"SINGLE STACK","hit_factor":3.087},{"match_name":"MPSA 030720 USPSA","match_date":"2020-03-07","stage_classifiercode":"19-03","member_number":"A79833","first_name":"STEVEN","last_name":"TAYLOR","classification":"U","division":"SINGLE STACK","hit_factor":3.0572},{"match_name":"PMRPC USPSA August 2020  - ALL CLASSIFIER STAGES","match_date":"2020-08-08","stage_classifiercode":"19-03","member_number":"TY74354","first_name":"DUANE","last_name":"CHARTER","classification":"U","division":"SINGLE STACK","hit_factor":3.0494},{"match_name":"MCRC USPSA Feb 2020","match_date":"2020-02-08","stage_classifiercode":"19-03","member_number":"TY30485","first_name":"RICHARD","last_name":"PUGH","classification":"C","division":"SINGLE STACK","hit_factor":3.0303},{"match_name":"WVPPS May  2020","match_date":"2020-05-31","stage_classifiercode":"19-03","member_number":"A97039","first_name":"JON L","last_name":"BOURNE","classification":"B","division":"SINGLE STACK","hit_factor":3.0253},{"match_name":"CAS 3ed weekend makeup match","match_date":"2020-06-21","stage_classifiercode":"19-03","member_number":"TY23129","first_name":"GARY","last_name":"THIBODAUX","classification":"A","division":"SINGLE STACK","hit_factor":3.0229},{"match_name":"Chillicothe Sportsmens Club November USPSA","match_date":"2021-11-20","stage_classifiercode":"19-03","member_number":"TY78157","first_name":"KIM","last_name":"BRENKMAN","classification":"C","division":"SINGLE STACK","hit_factor":3.0027},{"match_name":"WSPS JULY 2021 USPSA","match_date":"2021-07-17","stage_classifiercode":"19-03","member_number":"A83852","first_name":"JEANICE","last_name":"NAULTY","classification":"C","division":"SINGLE STACK","hit_factor":2.9944},{"match_name":"NHRPC - September 2021 USPSA","match_date":"2021-09-11","stage_classifiercode":"19-03","member_number":"A83852","first_name":"JEANICE","last_name":"NAULTY","classification":"C","division":"SINGLE STACK","hit_factor":2.9922},{"match_name":"Bossier Parish Practical Shooters August 16 2020","match_date":"2020-08-16","stage_classifiercode":"19-03","member_number":"A126549","first_name":"STEFAN","last_name":"LOCKTON","classification":"U","division":"SINGLE STACK","hit_factor":2.9902},{"match_name":"WGC WI USPSA Special Classifier","match_date":"2020-05-31","stage_classifiercode":"19-03","member_number":"A76510","first_name":"JORGE","last_name":"CABALLERO","classification":"D","division":"SINGLE STACK","hit_factor":2.967},{"match_name":"CCSC USPSA All Classifier Match","match_date":"2020-05-23","stage_classifiercode":"19-03","member_number":"A127539","first_name":"DAVID","last_name":"WHITE","classification":"U","division":"SINGLE STACK","hit_factor":2.9605},{"match_name":"Pinetucky USPSA 02-15-20","match_date":"2020-02-15","stage_classifiercode":"19-03","member_number":"TY61427","first_name":"MICHAEL","last_name":"NYLAND","classification":"U","division":"SINGLE STACK","hit_factor":2.954},{"match_name":"LPRGC USPSA Easter Weekend Match April 2021","match_date":"2021-04-03","stage_classifiercode":"19-03","member_number":"A8758","first_name":"STEPHEN","last_name":"MIRANDA","classification":"C","division":"SINGLE STACK","hit_factor":2.9529},{"match_name":"NVGC Practical Shooters August 2020","match_date":"2020-08-08","stage_classifiercode":"19-03","member_number":"TY76339","first_name":"MATT","last_name":"SIMMONS","classification":"\"\"","division":"SINGLE STACK","hit_factor":2.9326},{"match_name":"Warsaw USPSA 7-12-2020 IN21 WRPC","match_date":"2020-07-12","stage_classifiercode":"19-03","member_number":"TY77794","first_name":"PAUL","last_name":"ROGERS","classification":"C","division":"SINGLE STACK","hit_factor":2.9268},{"match_name":"EDPS USPSA October 10","match_date":"2020-10-10","stage_classifiercode":"19-03","member_number":"a-90270","first_name":"DAVID","last_name":"HONG","classification":"D","division":"SINGLE STACK","hit_factor":2.9106},{"match_name":"Oak Hill Gun Club 8/9/20","match_date":"2020-08-09","stage_classifiercode":"19-03","member_number":"A81616","first_name":"PAM","last_name":"VERVILLE","classification":"C","division":"SINGLE STACK","hit_factor":2.9059},{"match_name":"USPSA MO21 Ozarks Classic Level II 2Alpha SBRC May 30 2020","match_date":"2020-05-30","stage_classifiercode":"19-03","member_number":"A11823","first_name":"LARRY","last_name":"FLETCHER","classification":"A","division":"SINGLE STACK","hit_factor":2.8946},{"match_name":"Pinetucky USPSA 02-15-20","match_date":"2020-02-15","stage_classifiercode":"19-03","member_number":"TY90414","first_name":"KATE","last_name":"BAILEY","classification":"U","division":"SINGLE STACK","hit_factor":2.8932},{"match_name":"GTS Super Classifier","match_date":"2020-05-09","stage_classifiercode":"19-03","member_number":"TY31561","first_name":"KEVIN","last_name":"EBERLE","classification":"M","division":"SINGLE STACK","hit_factor":2.8884},{"match_name":"MPPL 20200301","match_date":"2020-03-01","stage_classifiercode":"19-03","member_number":"L1136","first_name":"RICHARD","last_name":"ABE","classification":"","division":"SINGLE STACK","hit_factor":2.8669},{"match_name":"Texarkana Gun Club USPSA Match - March Classifier Mania!","match_date":"2021-03-06","stage_classifiercode":"19-03","member_number":"L3718","first_name":"MATT","last_name":"OWENS","classification":"C","division":"SINGLE STACK","hit_factor":2.8526},{"match_name":"NCPS USPSA Handgun Match June 27-28 2020a","match_date":"2020-06-27","stage_classifiercode":"19-03","member_number":"A63254","first_name":"EMMANUEL","last_name":"BUENO","classification":"U","division":"SINGLE STACK","hit_factor":2.8431},{"match_name":"EDPS USPSA October 10","match_date":"2020-10-10","stage_classifiercode":"19-03","member_number":"None","first_name":"ESTEVAN","last_name":"QUANT","classification":"U","division":"SINGLE STACK","hit_factor":2.7674},{"match_name":"Texarkana Gun Club USPSA Match - March Classifier Mania!","match_date":"2021-03-06","stage_classifiercode":"19-03","member_number":"A117129","first_name":"EITAN","last_name":"GROSS","classification":"D","division":"SINGLE STACK","hit_factor":2.7518},{"match_name":"WGC WI USPSA Special Classifier","match_date":"2020-05-31","stage_classifiercode":"19-03","member_number":"TY87104","first_name":"JOHN","last_name":"BARGHUSEN","classification":"C","division":"SINGLE STACK","hit_factor":2.7475},{"match_name":"DSSA 2020-02 USPSA Pistol","match_date":"2020-02-23","stage_classifiercode":"19-03","member_number":"A65429","first_name":"KEN","last_name":"CORNWELL","classification":"U","division":"SINGLE STACK","hit_factor":2.7335},{"match_name":"WVPPS May  2020","match_date":"2020-05-31","stage_classifiercode":"19-03","member_number":"TY74911","first_name":"DAVID","last_name":"HERSH","classification":"B","division":"SINGLE STACK","hit_factor":2.72},{"match_name":"Oh Shoot/PRG 5.11 Championship Series - January 2021","match_date":"2021-01-02","stage_classifiercode":"19-03","member_number":"TY102414","first_name":"AARON","last_name":"LEPLEY","classification":"U","division":"SINGLE STACK","hit_factor":2.7186},{"match_name":"NVSA USPSA 2006A","match_date":"2020-06-21","stage_classifiercode":"19-03","member_number":"A62603","first_name":"RANDY","last_name":"HOOD","classification":"C","division":"SINGLE STACK","hit_factor":2.6873},{"match_name":"NW15 Port Townsend Practical Pistol USPSA November 7 2020","match_date":"2020-11-07","stage_classifiercode":"19-03","member_number":"A83244","first_name":"STEVE","last_name":"BLAZINA","classification":"C","division":"SINGLE STACK","hit_factor":2.6855},{"match_name":"SOAP June 2021 USPSA Match","match_date":"2021-06-13","stage_classifiercode":"19-03","member_number":"FY95777","first_name":"SEBASTIAN","last_name":"MUNOZ","classification":"U","division":"SINGLE STACK","hit_factor":2.668},{"match_name":"ACC  Movement Classifier Match May 31","match_date":"2020-05-31","stage_classifiercode":"19-03","member_number":"A124123","first_name":"CALEB","last_name":"MANN","classification":"U","division":"SINGLE STACK","hit_factor":2.6618},{"match_name":"ECPS  USPSA 16 May 2020","match_date":"2020-05-16","stage_classifiercode":"19-03","member_number":"TY6381","first_name":"ROBBY","last_name":"HARRIS","classification":"C","division":"SINGLE STACK","hit_factor":2.6542},{"match_name":"WGC WI USPSA Special Classifier","match_date":"2020-05-31","stage_classifiercode":"19-03","member_number":"TY-19370","first_name":"DAVIN","last_name":"KOTAJARVI","classification":"C","division":"SINGLE STACK","hit_factor":2.6273},{"match_name":"NW15 Port Townsend Practical Pistol USPSA November 7 2020","match_date":"2020-11-07","stage_classifiercode":"19-03","member_number":"TY66184","first_name":"RAY","last_name":"NARIMATSU","classification":"U","division":"SINGLE STACK","hit_factor":2.6209},{"match_name":"Square Deal Sportsman USPSA June 2020","match_date":"2020-06-07","stage_classifiercode":"19-03","member_number":"L2271","first_name":"EDWARD","last_name":"PUTNAM","classification":"A","division":"SINGLE STACK","hit_factor":2.5888},{"match_name":"WNYPPL September 2020 USPSA","match_date":"2020-09-27","stage_classifiercode":"19-03","member_number":"A86497","first_name":"ERNEST","last_name":"PENN JR.","classification":"C","division":"SINGLE STACK","hit_factor":2.5622},{"match_name":"Wickenburg Action Shooters Pistol USPSA 4 stage classifier match 09-11-2021","match_date":"2021-09-11","stage_classifiercode":"19-03","member_number":"A133878","first_name":"TIMOTHY","last_name":"KLAFKA","classification":"C","division":"SINGLE STACK","hit_factor":2.5573},{"match_name":"Bitterroot Blasters  USPSA May 2021","match_date":"2021-05-23","stage_classifiercode":"19-03","member_number":"A133309","first_name":"CIARA","last_name":"MARIE","classification":"C","division":"SINGLE STACK","hit_factor":2.5435},{"match_name":"RCPS USPSA Mar 14","match_date":"2020-03-14","stage_classifiercode":"19-03","member_number":"A123491","first_name":"HUNTER","last_name":"WOMACK","classification":"C","division":"SINGLE STACK","hit_factor":2.5381},{"match_name":"BGSL CLASSIFIER","match_date":"2020-03-01","stage_classifiercode":"19-03","member_number":"A109746","first_name":"LAFE","last_name":"KUNKEL","classification":"B","division":"SINGLE STACK","hit_factor":2.5218},{"match_name":"WSPS JULY 2021 USPSA","match_date":"2021-07-17","stage_classifiercode":"19-03","member_number":"L3944","first_name":"DAVID","last_name":"BLACK","classification":"B","division":"SINGLE STACK","hit_factor":2.5162},{"match_name":"NHRPC - September 2021 USPSA","match_date":"2021-09-11","stage_classifiercode":"19-03","member_number":"133415","first_name":"CRAIG","last_name":"MORITZ","classification":"U","division":"SINGLE STACK","hit_factor":2.516},{"match_name":"SOAP June 2021 USPSA Match","match_date":"2021-06-13","stage_classifiercode":"19-03","member_number":"a90270","first_name":"DAVID","last_name":"HONG","classification":"C","division":"SINGLE STACK","hit_factor":2.5049},{"match_name":"USPSA MO21 Ozarks Classic Level II 2Alpha SBRC May 30 2020","match_date":"2020-05-30","stage_classifiercode":"19-03","member_number":"FY84534","first_name":"DENNIS","last_name":"LAWRENCE","classification":"B","division":"SINGLE STACK","hit_factor":2.5015},{"match_name":"WCPS ECO09 07-19-2020","match_date":"2020-07-19","stage_classifiercode":"19-03","member_number":"A111694","first_name":"THOMAS B","last_name":"BURGETT","classification":"U","division":"SINGLE STACK","hit_factor":2.4977},{"match_name":"Rio Salado RMAP October 2021","match_date":"2021-10-17","stage_classifiercode":"19-03","member_number":"ty67256","first_name":"BRUCE","last_name":"BILTON","classification":"B","division":"SINGLE STACK","hit_factor":2.4718},{"match_name":"2020 Florida State USPSA Championship","match_date":"2020-01-17","stage_classifiercode":"19-03","member_number":"TYF123445","first_name":"TIZIANO","last_name":"OGNIBENE","classification":"U","division":"SINGLE STACK","hit_factor":2.466},{"match_name":"July USPSA Match at C and C Indoor Range","match_date":"2020-07-21","stage_classifiercode":"19-03","member_number":"A117232","first_name":"TODD","last_name":"DAVIS","classification":"U","division":"SINGLE STACK","hit_factor":2.4342},{"match_name":"ESPS USPSA April","match_date":"2021-04-23","stage_classifiercode":"19-03","member_number":"A72786","first_name":"JON","last_name":"HODGES","classification":"U","division":"SINGLE STACK","hit_factor":2.4226},{"match_name":"WLPS May 2021 ALL USPSA Classifier Match ","match_date":"2021-05-23","stage_classifiercode":"19-03","member_number":"TY126424","first_name":"JASON","last_name":"SMITH","classification":"U","division":"SINGLE STACK","hit_factor":2.3974},{"match_name":"Coyote Arms Classifier Match 10-31-21","match_date":"2021-10-31","stage_classifiercode":"19-03","member_number":"A137280","first_name":"TREVIN","last_name":"MOORE","classification":"","division":"SINGLE STACK","hit_factor":2.3904},{"match_name":"DSSA 2020-02 USPSA Pistol","match_date":"2020-02-23","stage_classifiercode":"19-03","member_number":"A84425","first_name":"MIKE","last_name":"STRONG","classification":"U","division":"SINGLE STACK","hit_factor":2.3444},{"match_name":"USPSA MO21 Ozarks Classic Level II 2Alpha SBRC May 30 2020","match_date":"2020-05-30","stage_classifiercode":"19-03","member_number":"TY56748","first_name":"DONALD","last_name":"LEE","classification":"D","division":"SINGLE STACK","hit_factor":2.3316},{"match_name":"USPSA MO21 Ozarks Classic Level II 2Alpha SBRC May 30 2020","match_date":"2020-05-30","stage_classifiercode":"19-03","member_number":"A118027","first_name":"DONNA","last_name":"DOWELL","classification":"D","division":"SINGLE STACK","hit_factor":2.3256},{"match_name":"BGSL CLASSIFIER","match_date":"2020-03-01","stage_classifiercode":"19-03","member_number":"A113850","first_name":"GREG","last_name":"GADBERRY","classification":"U","division":"SINGLE STACK","hit_factor":2.3205},{"match_name":"SOAP March 2020 USPSA Match","match_date":"2020-03-08","stage_classifiercode":"19-03","member_number":"TY93002","first_name":"ERIC","last_name":"CARGO","classification":"B","division":"SINGLE STACK","hit_factor":2.3188},{"match_name":"Cactus USPSA ALL CLASSIFIER August 2020","match_date":"2020-08-02","stage_classifiercode":"19-03","member_number":"A122800","first_name":"GLENN W","last_name":"REINIER","classification":"D","division":"SINGLE STACK","hit_factor":2.2787},{"match_name":"DSC Go Fast Don’t Suck 2020 Spring Postal Match (USPSA) ","match_date":"2020-07-19","stage_classifiercode":"19-03","member_number":"A116831","first_name":"DALE","last_name":"PATTERSON","classification":"U","division":"SINGLE STACK","hit_factor":2.275},{"match_name":"Texarkana Gun Club USPSA Match - March Classifier Mania!","match_date":"2021-03-06","stage_classifiercode":"19-03","member_number":"A9387","first_name":"RON","last_name":"HARDEE","classification":"D","division":"SINGLE STACK","hit_factor":2.251},{"match_name":"ESPS USPSA April","match_date":"2021-04-23","stage_classifiercode":"19-03","member_number":"TY99554","first_name":"SASHA","last_name":"DANJCZEK","classification":"C","division":"SINGLE STACK","hit_factor":2.249},{"match_name":"DSSA 2021-02 USPSA Pistol","match_date":"2021-02-28","stage_classifiercode":"19-03","member_number":"A111663","first_name":"JIM","last_name":"KRANTZ","classification":"M","division":"SINGLE STACK","hit_factor":2.1918},{"match_name":"WAC February(4th Sunday) - USPSA 6 Classifier Match","match_date":"2020-02-23","stage_classifiercode":"19-03","member_number":"A36252","first_name":"STEVE","last_name":"BELEW","classification":"C","division":"SINGLE STACK","hit_factor":2.1688},{"match_name":"GRB USPSA JULY 2020 AT CAVALIER","match_date":"2020-07-18","stage_classifiercode":"19-03","member_number":"TY83585","first_name":"ERIC","last_name":"LESLIE","classification":"C","division":"SINGLE STACK","hit_factor":2.1637},{"match_name":"EAGC Classifier Match 1 February","match_date":"2020-02-02","stage_classifiercode":"19-03","member_number":"A123491","first_name":"HUNTER","last_name":"WOMACK","classification":"U","division":"SINGLE STACK","hit_factor":2.1418},{"match_name":"LGCSEMPS April 2021 Special Classifier","match_date":"2021-04-11","stage_classifiercode":"19-03","member_number":"A102862","first_name":"JOSHUA","last_name":"BAKER","classification":"C","division":"SINGLE STACK","hit_factor":2.1378},{"match_name":"OPSC USPSA September 2020","match_date":"2020-09-13","stage_classifiercode":"19-03","member_number":"TY105889","first_name":"DANNY","last_name":"YAO","classification":"D","division":"SINGLE STACK","hit_factor":2.1322},{"match_name":"NCPS USPSA Handgun Match June 27-28 2020a","match_date":"2020-06-27","stage_classifiercode":"19-03","member_number":"A74924","first_name":"SCOTT","last_name":"BELCHAMBER","classification":"D","division":"SINGLE STACK","hit_factor":2.1292},{"match_name":"CCPL 05-09-2020","match_date":"2020-05-09","stage_classifiercode":"19-03","member_number":"A107815","first_name":"CHARLIE","last_name":"JENSEN","classification":"U","division":"SINGLE STACK","hit_factor":2.1081},{"match_name":"Cameo USPSA Match July 18 2020","match_date":"2020-07-18","stage_classifiercode":"19-03","member_number":"L4234","first_name":"DAVID","last_name":"THROOP","classification":"C","division":"SINGLE STACK","hit_factor":2.1019},{"match_name":"EAGC March 2020 USPSA Pistol Match","match_date":"2020-03-15","stage_classifiercode":"19-03","member_number":"NA","first_name":"GARY","last_name":"BAKER","classification":"U","division":"SINGLE STACK","hit_factor":2.0983},{"match_name":"CASA USPSA Sept. 6 2020","match_date":"2020-09-06","stage_classifiercode":"19-03","member_number":"A117129","first_name":"EITAN","last_name":"GROSS","classification":"\"\"","division":"SINGLE STACK","hit_factor":2.0922},{"match_name":"TCSC USPSA Level I April club match","match_date":"2021-04-24","stage_classifiercode":"19-03","member_number":"A83038","first_name":"CODY","last_name":"CLAXTON","classification":"U","division":"SINGLE STACK","hit_factor":2.08},{"match_name":"Gem City Gun Club 10-3 and 10-4-2020","match_date":"2020-10-03","stage_classifiercode":"19-03","member_number":"FY61788","first_name":"DAVID","last_name":"SOMERS","classification":"D","division":"SINGLE STACK","hit_factor":2.0695},{"match_name":"LPRGC USPSA Easter Weekend Match April 2021","match_date":"2021-04-03","stage_classifiercode":"19-03","member_number":"TY78049","first_name":"PAUL","last_name":"KNIGHT","classification":"C","division":"SINGLE STACK","hit_factor":2.0651},{"match_name":"Cameo USPSA Match July 18 2020","match_date":"2020-07-18","stage_classifiercode":"19-03","member_number":"A126830","first_name":"SKYLAR","last_name":"TUBBS","classification":"U","division":"SINGLE STACK","hit_factor":1.9658},{"match_name":"2021-05-01 USPSA with 2 Classifiers at Phoenix Rod and Gun Club","match_date":"2021-05-01","stage_classifiercode":"19-03","member_number":"A85524","first_name":"FRANK","last_name":"SCIABICA","classification":"C","division":"SINGLE STACK","hit_factor":1.9555},{"match_name":"NCPS USPSA Handgun Match June 27-28 2020a","match_date":"2020-06-27","stage_classifiercode":"19-03","member_number":"FY52535","first_name":"KARL","last_name":"MESSERSCHMIDT","classification":"B","division":"SINGLE STACK","hit_factor":1.9433},{"match_name":"Springfield Tactical Shooters 12/03/2020","match_date":"2020-12-03","stage_classifiercode":"19-03","member_number":"L3943","first_name":"KURT","last_name":"JOHNSON","classification":"B","division":"SINGLE STACK","hit_factor":1.9079},{"match_name":"5 Dogs June USPSA 2021","match_date":"2021-06-06","stage_classifiercode":"19-03","member_number":"A99194","first_name":"DAVID","last_name":"CONAWAY","classification":"D","division":"SINGLE STACK","hit_factor":1.8966},{"match_name":"LCSC Linden USPSA 062721","match_date":"2021-06-26","stage_classifiercode":"19-03","member_number":"000000","first_name":"TRISTAN","last_name":"DAY","classification":"U","division":"SINGLE STACK","hit_factor":1.8878},{"match_name":"BGSL CLASSIFIER","match_date":"2020-03-01","stage_classifiercode":"19-03","member_number":"a37438","first_name":"BARRY","last_name":"WEST","classification":"A","division":"SINGLE STACK","hit_factor":1.8797},{"match_name":"NCPS USPSA Handgun Match September 25-26 2021z","match_date":"2021-09-25","stage_classifiercode":"19-03","member_number":"TY79938","first_name":"KENNETH","last_name":"HEICHMAN","classification":"B","division":"SINGLE STACK","hit_factor":1.8754},{"match_name":"DSC Go Fast Don’t Suck 2020 Spring Postal Match (USPSA) ","match_date":"2020-07-19","stage_classifiercode":"19-03","member_number":"a121526","first_name":"ANTHONY","last_name":"GILL","classification":"U","division":"SINGLE STACK","hit_factor":1.8605},{"match_name":"Oak Hill Gun Club 8/9/20","match_date":"2020-08-09","stage_classifiercode":"19-03","member_number":"TY45041","first_name":"GERRY","last_name":"DONOVAN","classification":"D","division":"SINGLE STACK","hit_factor":1.7877},{"match_name":"Cameo USPSA Match July 18 2020","match_date":"2020-07-18","stage_classifiercode":"19-03","member_number":"A126282","first_name":"JIM","last_name":"KELLY","classification":"U","division":"SINGLE STACK","hit_factor":1.7677},{"match_name":"LTD Pistol - Feb 2020","match_date":"2020-02-01","stage_classifiercode":"19-03","member_number":"TY73425","first_name":"ALEX","last_name":"LYONS","classification":"U","division":"SINGLE STACK","hit_factor":1.7578},{"match_name":"Wallis Orchard Practical Shooters August 2021 All Classifier Match","match_date":"2021-08-12","stage_classifiercode":"19-03","member_number":"TY54824","first_name":"CRAIG","last_name":"BELLAMY","classification":"A","division":"SINGLE STACK","hit_factor":1.7522},{"match_name":"PIPS 06-24-2020","match_date":"2020-06-24","stage_classifiercode":"19-03","member_number":"A65112","first_name":"DOUGLAS","last_name":"ANDERSON","classification":"D","division":"SINGLE STACK","hit_factor":1.7467},{"match_name":"XMG USPSA Special Classifier Match  September 13th 2020","match_date":"2020-09-13","stage_classifiercode":"19-03","member_number":"l3611","first_name":"RAYMOND","last_name":"VAN VALKENBURG","classification":"U","division":"SINGLE STACK","hit_factor":1.7455},{"match_name":"NCPS USPSA Handgun Match June 27-28 2020a","match_date":"2020-06-27","stage_classifiercode":"19-03","member_number":"L1644","first_name":"RON","last_name":"TROYER","classification":"C","division":"SINGLE STACK","hit_factor":1.7388},{"match_name":"Shongum October 2021 USPSA Match","match_date":"2021-10-02","stage_classifiercode":"19-03","member_number":"A83305","first_name":"RUSSELL","last_name":"TAGLIARENI","classification":"C","division":"SINGLE STACK","hit_factor":1.7341},{"match_name":"WTPS USPSA Match 1.9.21","match_date":"2021-01-09","stage_classifiercode":"19-03","member_number":"TY55041","first_name":"MARK","last_name":"DZIAMSKI","classification":"B","division":"SINGLE STACK","hit_factor":1.7313},{"match_name":"NVSA USPSA 2006A","match_date":"2020-06-21","stage_classifiercode":"19-03","member_number":"TY94401","first_name":"JOHN","last_name":"BASS","classification":"D","division":"SINGLE STACK","hit_factor":1.7241},{"match_name":"TCSC USPSA Level I April club match","match_date":"2021-04-24","stage_classifiercode":"19-03","member_number":"FY20457","first_name":"SCOTT","last_name":"WARREN","classification":"M","division":"SINGLE STACK","hit_factor":1.7148},{"match_name":"WNYPPL September 2020 USPSA","match_date":"2020-09-27","stage_classifiercode":"19-03","member_number":"TY112038","first_name":"DON","last_name":"DEROSE","classification":"U","division":"SINGLE STACK","hit_factor":1.7107},{"match_name":"LdF Practice May 9 2020","match_date":"2020-05-09","stage_classifiercode":"19-03","member_number":"TY99819","first_name":"KEVIN","last_name":"GROSS","classification":"C","division":"SINGLE STACK","hit_factor":1.7059},{"match_name":"Mesilla Valley P May 2021","match_date":"2021-05-01","stage_classifiercode":"19-03","member_number":"A117766","first_name":"DAVID","last_name":"ROBERTS","classification":"U","division":"SINGLE STACK","hit_factor":1.6775},{"match_name":"Temple Gun Club USPSA August 2021","match_date":"2021-08-01","stage_classifiercode":"19-03","member_number":"A133674","first_name":"CHARLES","last_name":"CHAPMAN","classification":"X","division":"SINGLE STACK","hit_factor":1.6752},{"match_name":"WI21 Jul 26 2020 Classifier","match_date":"2020-07-26","stage_classifiercode":"19-03","member_number":"fy71268","first_name":"JIM","last_name":"FORBES","classification":"C","division":"SINGLE STACK","hit_factor":1.6381},{"match_name":"WAC February(4th Sunday) - USPSA 6 Classifier Match","match_date":"2020-02-23","stage_classifiercode":"19-03","member_number":"A85829","first_name":"RON","last_name":"BENNETT","classification":"U","division":"SINGLE STACK","hit_factor":1.6192},{"match_name":"Cameo USPSA Match July 18 2020","match_date":"2020-07-18","stage_classifiercode":"19-03","member_number":"A81750","first_name":"PAUL","last_name":"KROGH","classification":"C","division":"SINGLE STACK","hit_factor":1.6096},{"match_name":"Number 10 at DECAP","match_date":"2020-03-08","stage_classifiercode":"19-03","member_number":"TY113716","first_name":"JOSEPH","last_name":"BRAGG","classification":"U","division":"SINGLE STACK","hit_factor":1.608},{"match_name":"IPSC66 WCRHC Special Classifier $30 July 26 2020 USPSA","match_date":"2020-07-26","stage_classifiercode":"19-03","member_number":"A101019","first_name":"MARK","last_name":"NELSON","classification":"X","division":"SINGLE STACK","hit_factor":1.6038},{"match_name":"WNYPPL September 2020 USPSA","match_date":"2020-09-27","stage_classifiercode":"19-03","member_number":"TY118440","first_name":"GUS","last_name":"GUSAKOV","classification":"U","division":"SINGLE STACK","hit_factor":1.5776},{"match_name":"SAPS Match 3/21/2020","match_date":"2020-03-21","stage_classifiercode":"19-03","member_number":"FY25992","first_name":"DAVE","last_name":"HANNA","classification":"C","division":"SINGLE STACK","hit_factor":1.5772},{"match_name":"Shongum October 2020 USPSA Match","match_date":"2020-10-03","stage_classifiercode":"19-03","member_number":"A125701","first_name":"JAMES","last_name":"RICK JR","classification":"U","division":"SINGLE STACK","hit_factor":1.5666},{"match_name":"WCPS ECO09 07-19-2020","match_date":"2020-07-19","stage_classifiercode":"19-03","member_number":"TY91017","first_name":"JON","last_name":"MANNA","classification":"B","division":"SINGLE STACK","hit_factor":1.535},{"match_name":"NCPS USPSA Handgun Match September 25-26 2021z","match_date":"2021-09-25","stage_classifiercode":"19-03","member_number":"L3855","first_name":"MARCI","last_name":"MINTER","classification":"C","division":"SINGLE STACK","hit_factor":1.5102},{"match_name":"MPSA 030720 USPSA","match_date":"2020-03-07","stage_classifiercode":"19-03","member_number":"FY72883","first_name":"CHRISTOPHER","last_name":"ZAMBESI","classification":"D","division":"SINGLE STACK","hit_factor":1.5069},{"match_name":"SOAP March 2020 USPSA Match","match_date":"2020-03-08","stage_classifiercode":"19-03","member_number":"A110038","first_name":"JOHN","last_name":"ORUM","classification":"C","division":"SINGLE STACK","hit_factor":1.5006},{"match_name":"SMPS 8 March 2020 USPSA Match","match_date":"2020-03-08","stage_classifiercode":"19-03","member_number":"TY78167","first_name":"LES","last_name":"MASON","classification":"D","division":"SINGLE STACK","hit_factor":1.4771},{"match_name":"DSC Go Fast Don’t Suck 2020 Spring Postal Match (USPSA) ","match_date":"2020-07-19","stage_classifiercode":"19-03","member_number":"ty127251","first_name":"WALT","last_name":"KORSZYLOWSKYJ","classification":"U","division":"SINGLE STACK","hit_factor":1.4706},{"match_name":"Cameo USPSA Match July 18 2020","match_date":"2020-07-18","stage_classifiercode":"19-03","member_number":"A91314","first_name":"CHRIS","last_name":"OLIVER","classification":"A","division":"SINGLE STACK","hit_factor":1.4689},{"match_name":"TRSC Payson USPSA Aug 8 2020","match_date":"2020-08-08","stage_classifiercode":"19-03","member_number":"TY81620","first_name":"MICHAEL","last_name":"MCCRITE","classification":"C","division":"SINGLE STACK","hit_factor":1.4612},{"match_name":"MVPSA USPSA 2-1-2020","match_date":"2020-01-31","stage_classifiercode":"19-03","member_number":"FY111341","first_name":"DENE","last_name":"MILLER","classification":"D","division":"SINGLE STACK","hit_factor":1.4362},{"match_name":"BGSL CLASSIFIER","match_date":"2020-03-01","stage_classifiercode":"19-03","member_number":"A82407","first_name":"HILLAREY","last_name":"KRIEGLER","classification":"C","division":"SINGLE STACK","hit_factor":1.4277},{"match_name":"SOAP March 2020 USPSA Match","match_date":"2020-03-08","stage_classifiercode":"19-03","member_number":"TY119858","first_name":"JON","last_name":"BLASINGAME","classification":"U","division":"SINGLE STACK","hit_factor":1.3905},{"match_name":"MASTER BLASTERS & SSFGA USPSA - July","match_date":"2020-07-18","stage_classifiercode":"19-03","member_number":"FY105540","first_name":"STEVE","last_name":"BOYD","classification":"D","division":"SINGLE STACK","hit_factor":1.3735},{"match_name":"Cameo USPSA Match July 18 2020","match_date":"2020-07-18","stage_classifiercode":"19-03","member_number":"TY113864","first_name":"MARK","last_name":"DOYLE","classification":"U","division":"SINGLE STACK","hit_factor":1.3688},{"match_name":"FVPS USPSA Point Series Match July 4th","match_date":"2020-07-04","stage_classifiercode":"19-03","member_number":"TY90193","first_name":"KEITH","last_name":"HOFFMANN","classification":"D","division":"SINGLE STACK","hit_factor":1.3575},{"match_name":"Pioneer Practical Shooters Classifier Match","match_date":"2020-05-23","stage_classifiercode":"19-03","member_number":"TY56748","first_name":"DONALD","last_name":"LEE","classification":"U","division":"SINGLE STACK","hit_factor":1.3226},{"match_name":"MCPSL Pistol 6-13-20","match_date":"2020-06-13","stage_classifiercode":"19-03","member_number":"TY56748","first_name":"DONALD","last_name":"LEE","classification":"D","division":"SINGLE STACK","hit_factor":1.3134},{"match_name":"NCPS USPSA Handgun Match June 27-28 2020a","match_date":"2020-06-27","stage_classifiercode":"19-03","member_number":"FY95274","first_name":"OSWALDO","last_name":"RUIZ","classification":"C","division":"SINGLE STACK","hit_factor":1.3088},{"match_name":"NVSA USPSA 2104","match_date":"2021-04-18","stage_classifiercode":"19-03","member_number":"FY94401","first_name":"JOHN","last_name":"BASS","classification":"D","division":"SINGLE STACK","hit_factor":1.292},{"match_name":"NCPS USPSA Handgun Match June 27-28 2020a","match_date":"2020-06-27","stage_classifiercode":"19-03","member_number":"TY118657","first_name":"TONY","last_name":"DESIMONE","classification":"C","division":"SINGLE STACK","hit_factor":1.2658},{"match_name":"2020 Florida State USPSA Championship","match_date":"2020-01-17","stage_classifiercode":"19-03","member_number":"FY94000","first_name":"MICHAEL","last_name":"MORGAN","classification":"B","division":"SINGLE STACK","hit_factor":1.2613},{"match_name":"PASA USPSA IL 09 Club Match August 16 2020","match_date":"2020-08-16","stage_classifiercode":"19-03","member_number":"FY60529","first_name":"DIANE","last_name":"ROYALTY","classification":"D","division":"SINGLE STACK","hit_factor":1.2587},{"match_name":"KSA USPSA 4 JULY 2020","match_date":"2020-07-04","stage_classifiercode":"19-03","member_number":"A65776","first_name":"CHAD","last_name":"VANKUREN","classification":"C","division":"SINGLE STACK","hit_factor":1.2486},{"match_name":"Rio Salado RMAP October 2021","match_date":"2021-10-17","stage_classifiercode":"19-03","member_number":"A76720","first_name":"TIM","last_name":"MUSA","classification":"M","division":"SINGLE STACK","hit_factor":1.2431},{"match_name":"DSSA 2021-02 USPSA Pistol","match_date":"2021-02-28","stage_classifiercode":"19-03","member_number":"A70041","first_name":"JEROME","last_name":"FORD","classification":"D","division":"SINGLE STACK","hit_factor":1.2142},{"match_name":"Pinetucky USPSA 02-15-20","match_date":"2020-02-15","stage_classifiercode":"19-03","member_number":"A33671","first_name":"MARK","last_name":"SULLIVAN","classification":"B","division":"SINGLE STACK","hit_factor":1.2112},{"match_name":"2021-05-01 USPSA with 2 Classifiers at Phoenix Rod and Gun Club","match_date":"2021-05-01","stage_classifiercode":"19-03","member_number":"A134193","first_name":"BILL","last_name":"ROACH","classification":"U","division":"SINGLE STACK","hit_factor":1.1973},{"match_name":"Rio Salado RMAP October 2021","match_date":"2021-10-17","stage_classifiercode":"19-03","member_number":"fy99173","first_name":"ROSS","last_name":"CHU","classification":"B","division":"SINGLE STACK","hit_factor":1.1792},{"match_name":"Wickenburg Action Shooters Pistol USPSA 4 stage classifier match 09-11-2021","match_date":"2021-09-11","stage_classifiercode":"19-03","member_number":"TY134193","first_name":"BILL","last_name":"ROACH","classification":"U","division":"SINGLE STACK","hit_factor":1.1744},{"match_name":"LGCSEMPS April 2021 Special Classifier","match_date":"2021-04-11","stage_classifiercode":"19-03","member_number":"A81280","first_name":"JAYJAY","last_name":"LIMBO","classification":"A","division":"SINGLE STACK","hit_factor":1.1742},{"match_name":"Oh Shoot/PRG 5.11 Championship Series - January 2021","match_date":"2021-01-02","stage_classifiercode":"19-03","member_number":"TY99819","first_name":"KEVIN","last_name":"GROSS","classification":"C","division":"SINGLE STACK","hit_factor":1.1611},{"match_name":"PASA USPSA IL 09 Club Match August 16 2020","match_date":"2020-08-16","stage_classifiercode":"19-03","member_number":"TY78197","first_name":"MIKE","last_name":"NOBIS","classification":"D","division":"SINGLE STACK","hit_factor":1.1549},{"match_name":"KSA USPSA 4 JULY 2020","match_date":"2020-07-04","stage_classifiercode":"19-03","member_number":"A125521","first_name":"AMY","last_name":"PASCALE","classification":"U","division":"SINGLE STACK","hit_factor":1.0828},{"match_name":"PIPS 06-24-2020","match_date":"2020-06-24","stage_classifiercode":"19-03","member_number":"A92701","first_name":"KRISTI","last_name":"NELSON","classification":"C","division":"SINGLE STACK","hit_factor":1.0471},{"match_name":"2021-05-01 USPSA with 2 Classifiers at Phoenix Rod and Gun Club","match_date":"2021-05-01","stage_classifiercode":"19-03","member_number":"L275","first_name":"RICHARD","last_name":"SHEPPERD","classification":"D","division":"SINGLE STACK","hit_factor":0.9883},{"match_name":"Rio Salado RMAP October 2021","match_date":"2021-10-17","stage_classifiercode":"19-03","member_number":"L3417","first_name":"JAMES","last_name":"ROBERTS","classification":"B","division":"SINGLE STACK","hit_factor":0.9452},{"match_name":"WLPS USPSA July 2020","match_date":"2020-07-19","stage_classifiercode":"19-03","member_number":"A120253","first_name":"NICHOLAS","last_name":"FAITH","classification":"C","division":"SINGLE STACK","hit_factor":0.9441},{"match_name":"SLPSA November USPSA Match 2","match_date":"2021-11-20","stage_classifiercode":"19-03","member_number":"A137348","first_name":"STEVE","last_name":"BITTER","classification":"U","division":"SINGLE STACK","hit_factor":0.935},{"match_name":"Texarkana Gun Club USPSA Match - March Classifier Mania!","match_date":"2021-03-06","stage_classifiercode":"19-03","member_number":"A117129","first_name":"EITAN","last_name":"GROSS","classification":"D","division":"SINGLE STACK","hit_factor":0.8912},{"match_name":"RBGC 2020-1-25","match_date":"2020-01-25","stage_classifiercode":"19-03","member_number":"A120369","first_name":"DANIEL","last_name":"PARKER","classification":"U","division":"SINGLE STACK","hit_factor":0.7782},{"match_name":"LdF Practice May 9 2020","match_date":"2020-05-09","stage_classifiercode":"19-03","member_number":"A104374","first_name":"KEVIN","last_name":"MARGETTA","classification":"B","division":"SINGLE STACK","hit_factor":0.7258},{"match_name":"Sharp Practical Shooters September USPSA - Outdoor Classifier Match","match_date":"2021-09-25","stage_classifiercode":"19-03","member_number":"A65928","first_name":"MARK S","last_name":"GARDNER","classification":"C","division":"SINGLE STACK","hit_factor":0.6203},{"match_name":"Wallis Orchard Practical Shooters August 2020 All Classifier Match","match_date":"2020-08-16","stage_classifiercode":"19-03","member_number":"A104167","first_name":"JEFFREY","last_name":"POLK","classification":"U","division":"SINGLE STACK","hit_factor":0.6173},{"match_name":"Rio Salado UPPL July 2020 ALL CLASSIFIER MATCH","match_date":"2020-07-12","stage_classifiercode":"19-03","member_number":"A96049","first_name":"DONALD","last_name":"FLOWERS","classification":"U","division":"SINGLE STACK","hit_factor":0.6081},{"match_name":"LdF Practice May 9 2020","match_date":"2020-05-09","stage_classifiercode":"19-03","member_number":"FY27761","first_name":"LARRY","last_name":"CZOKA","classification":"B","division":"SINGLE STACK","hit_factor":0.5764},{"match_name":"Wallis Orchard Practical Shooters August 2020 All Classifier Match","match_date":"2020-08-16","stage_classifiercode":"19-03","member_number":"TY97196","first_name":"DALE","last_name":"HAMM","classification":"D","division":"SINGLE STACK","hit_factor":0.5431},{"match_name":"LPRGC USPSA Easter Weekend Match April 2021","match_date":"2021-04-03","stage_classifiercode":"19-03","member_number":"A83852","first_name":"JEANICE","last_name":"NAULTY","classification":"C","division":"SINGLE STACK","hit_factor":0.5408},{"match_name":"Coyote Arms Classifier Match 10-31-21","match_date":"2021-10-31","stage_classifiercode":"19-03","member_number":"A127064","first_name":"RODNEY","last_name":"LABROSSE","classification":"D","division":"SINGLE STACK","hit_factor":0.5319},{"match_name":"ACC  Movement Classifier Match May 31","match_date":"2020-05-31","stage_classifiercode":"19-03","member_number":"A114486","first_name":"KEN","last_name":"DAVIS","classification":"D","division":"SINGLE STACK","hit_factor":0.5123},{"match_name":"MPSA 030720 USPSA","match_date":"2020-03-07","stage_classifiercode":"19-03","member_number":"n/a","first_name":"GARY","last_name":"BAKER","classification":"U","division":"SINGLE STACK","hit_factor":0.4862},{"match_name":"Gem City Gun Club 10-3 and 10-4-2020","match_date":"2020-10-03","stage_classifiercode":"19-03","member_number":"A129198","first_name":"CHRISTOPHER","last_name":"HESS","classification":"U","division":"SINGLE STACK","hit_factor":0.4518},{"match_name":"FAS Sunday USPSA Match","match_date":"2020-06-07","stage_classifiercode":"19-03","member_number":"A127864","first_name":"DAVID","last_name":"DURHAM","classification":"U","division":"SINGLE STACK","hit_factor":0.3845},{"match_name":"Rio Salado RMAP October 2021","match_date":"2021-10-17","stage_classifiercode":"19-03","member_number":"Ty104450","first_name":"JOLEEN","last_name":"TURNER","classification":"C","division":"SINGLE STACK","hit_factor":0.3454},{"match_name":"NW01 Paul Bunyan USPSA July 11 Match","match_date":"2021-07-11","stage_classifiercode":"19-03","member_number":"Ty126829","first_name":"AUGUSTO","last_name":"CABANILLA","classification":"C","division":"SINGLE STACK","hit_factor":0.336},{"match_name":"MPPL 20200301","match_date":"2020-03-01","stage_classifiercode":"19-03","member_number":"A123786","first_name":"ANTHONY","last_name":"RENON","classification":"U","division":"SINGLE STACK","hit_factor":0.288},{"match_name":"Triforce Practical Shooters at Big Woods Goods 07-22-2021","match_date":"2021-07-22","stage_classifiercode":"19-03","member_number":"A131287","first_name":"MARTIN","last_name":"VIVANCO","classification":"U","division":"SINGLE STACK","hit_factor":0.2723},{"match_name":"USPSA MO21 Ozarks Classic Level II 2Alpha SBRC May 30 2020","match_date":"2020-05-30","stage_classifiercode":"19-03","member_number":"TY55005","first_name":"ROGER","last_name":"REID","classification":"U","division":"SINGLE STACK","hit_factor":0.1445},{"match_name":"GTS Super Classifier","match_date":"2020-05-09","stage_classifiercode":"19-03","member_number":"A125360","first_name":"SKEETER","last_name":"REDDING","classification":"U","division":"SINGLE STACK","hit_factor":0.0522},{"match_name":"NHRPC - September 2021 USPSA","match_date":"2021-09-11","stage_classifiercode":"19-03","member_number":"A133429","first_name":"SALLY","last_name":"MORITZ","classification":"U","division":"SINGLE STACK","hit_factor":0.0276}]