[{"match_name":"Pinetucky USPSA 09-26-15","match_date":"2015-09-26","stage_classifiercode":"99-12","member_number":"A78528","first_name":"TIM","last_name":"MEKOSH","classification":"M","division":"OPEN","hit_factor":10.1968},{"match_name":"LIPSA - November 4th 2018 - USPSA Classifier Match","match_date":"2018-11-04","stage_classifiercode":"99-12","member_number":"TY90280","first_name":"ANTHONY","last_name":"BRUNO","classification":"M","division":"OPEN","hit_factor":10},{"match_name":"BHPSC Monthly Match - Feb 2020","match_date":"2020-02-29","stage_classifiercode":"99-12","member_number":"A100931","first_name":"CALEB","last_name":"PATERSON","classification":"M","division":"OPEN","hit_factor":9.9494},{"match_name":"YMM IPSC02 2016_09_11","match_date":"2016-09-11","stage_classifiercode":"99-12","member_number":"TY43564","first_name":"BRIAN","last_name":"WILLIAMSON","classification":"G","division":"OPEN","hit_factor":9.8958},{"match_name":"ENPS May 2018 USPSA Match","match_date":"2018-05-06","stage_classifiercode":"99-12","member_number":"TY57269","first_name":"CRAIG","last_name":"TAPPE","classification":"G","division":"OPEN","hit_factor":9.839},{"match_name":"PCGC  June 2017","match_date":"2017-06-25","stage_classifiercode":"99-12","member_number":"A81837","first_name":"CODY","last_name":"BAKER","classification":"G","division":"OPEN","hit_factor":9.5969},{"match_name":"HPS September Club Fun Shoot","match_date":"2018-09-01","stage_classifiercode":"99-12","member_number":"A55833","first_name":"FROILAN","last_name":"RIVERO","classification":"G","division":"OPEN","hit_factor":9.5868},{"match_name":"FPS USPSA April2017","match_date":"2017-04-02","stage_classifiercode":"99-12","member_number":"TY85379","first_name":"JOE","last_name":"TOLENO","classification":"A","division":"OPEN","hit_factor":9.5575},{"match_name":"Laser Ninja Dragon League USPSA August 2017","match_date":"2017-08-06","stage_classifiercode":"99-12","member_number":"\"\"","first_name":"COLT","last_name":"WILKINSON","classification":"M","division":"OPEN","hit_factor":9.5238},{"match_name":"DGC USPSA 07-08-18","match_date":"2018-07-08","stage_classifiercode":"99-12","member_number":"FY15086","first_name":"JAMIE","last_name":"CRAIG","classification":"G","division":"OPEN","hit_factor":9.5238},{"match_name":"Tangi January 2016 USPSA","match_date":"2016-01-23","stage_classifiercode":"99-12","member_number":"TY44221","first_name":"BRANDON","last_name":"GUILLORY","classification":"M","division":"OPEN","hit_factor":9.4778},{"match_name":"12-19-18 MISS Match","match_date":"2018-12-19","stage_classifiercode":"99-12","member_number":"TY68791","first_name":"MIKE","last_name":"GNYRA","classification":"G","division":"OPEN","hit_factor":9.427},{"match_name":"FBURG April 2017 Level I USPSA ","match_date":"2017-04-01","stage_classifiercode":"99-12","member_number":"TY83654","first_name":"JASON","last_name":"ROBERTS","classification":"A","division":"OPEN","hit_factor":9.3694},{"match_name":"Shongum Pistol November 2015","match_date":"2015-11-07","stage_classifiercode":"99-12","member_number":"L2483","first_name":"BRYAN","last_name":"JONES","classification":"M","division":"OPEN","hit_factor":9.3548},{"match_name":"DGC USPSA 07-08-18","match_date":"2018-07-08","stage_classifiercode":"99-12","member_number":"FY15086","first_name":"JAMIE","last_name":"CRAIG","classification":"G","division":"OPEN","hit_factor":9.2624},{"match_name":"EWPSA 2016-04","match_date":"2016-04-17","stage_classifiercode":"99-12","member_number":"A87873","first_name":"SCOTT","last_name":"MEREDITH","classification":"B","division":"OPEN","hit_factor":9.164},{"match_name":"PCGC  June 2017","match_date":"2017-06-25","stage_classifiercode":"99-12","member_number":"L4135","first_name":"TOM","last_name":"SARGENT","classification":"M","division":"OPEN","hit_factor":9.1562},{"match_name":"AIPS Classifier 12 Nov 2016","match_date":"2016-11-12","stage_classifiercode":"99-12","member_number":"TY76605","first_name":"MARK","last_name":"MCCARNEY","classification":"U","division":"OPEN","hit_factor":9.0909},{"match_name":"LIPSA - April 30th 2017 - USPSA Match Special Classifier","match_date":"2017-04-30","stage_classifiercode":"99-12","member_number":"TY9036","first_name":"STANLEY","last_name":"DOROSKI","classification":"A","division":"OPEN","hit_factor":9.0767},{"match_name":"ECPS February 28th USPSA Pistol Match","match_date":"2016-02-28","stage_classifiercode":"99-12","member_number":"a73332","first_name":"BRENT","last_name":"LORTON","classification":"M","division":"OPEN","hit_factor":9.0121},{"match_name":"Hosemasters  3rd Sunday Feburary 2017","match_date":"2017-02-12","stage_classifiercode":"99-12","member_number":"TY61938","first_name":"TIM","last_name":"SMITH","classification":"G","division":"OPEN","hit_factor":8.9965},{"match_name":"Hosemasters  3rd Sunday Feburary 2017","match_date":"2017-02-12","stage_classifiercode":"99-12","member_number":"A49035","first_name":"EDDIE","last_name":"GARCIA","classification":"G","division":"OPEN","hit_factor":8.9606},{"match_name":"MPSA 2021-08-21","match_date":"2021-08-21","stage_classifiercode":"99-12","member_number":"A92885","first_name":"TAYLOR","last_name":"ZIMMERMAN","classification":"M","division":"OPEN","hit_factor":8.9041},{"match_name":"Hosemasters  3rd Sunday Feburary 2017","match_date":"2017-02-12","stage_classifiercode":"99-12","member_number":"TY5553","first_name":"TIM","last_name":"HIBBS","classification":"M","division":"OPEN","hit_factor":8.8889},{"match_name":"Hosemasters  3rd Sunday Feburary 2017","match_date":"2017-02-12","stage_classifiercode":"99-12","member_number":"L684","first_name":"ROB","last_name":"LEATHAM","classification":"G","division":"OPEN","hit_factor":8.871},{"match_name":"HPS September Club Fun Shoot","match_date":"2018-09-01","stage_classifiercode":"99-12","member_number":"A45196","first_name":"NESTOR","last_name":"TANI","classification":"A","division":"OPEN","hit_factor":8.8525},{"match_name":"Emmett September Match","match_date":"2016-09-24","stage_classifiercode":"99-12","member_number":"ty85172","first_name":"MIKE","last_name":"O'LEARY","classification":"M","division":"OPEN","hit_factor":8.8012},{"match_name":"EWPSA 2016-04","match_date":"2016-04-17","stage_classifiercode":"99-12","member_number":"A85264","first_name":"SPENCER","last_name":"MORENO","classification":"B","division":"OPEN","hit_factor":8.7873},{"match_name":"GMPS 5/7/17","match_date":"2017-05-06","stage_classifiercode":"99-12","member_number":"TY21947","first_name":"RAYMOND","last_name":"LOPES","classification":"G","division":"OPEN","hit_factor":8.744},{"match_name":"BRC_20170611","match_date":"2017-06-11","stage_classifiercode":"99-12","member_number":"A85442","first_name":"SPENCER","last_name":"STEIN","classification":"M","division":"OPEN","hit_factor":8.7423},{"match_name":"Nampa USPSA February 1st","match_date":"2020-02-01","stage_classifiercode":"99-12","member_number":"Ty85172","first_name":"MIKE","last_name":"O'LEARY","classification":"M","division":"OPEN","hit_factor":8.7423},{"match_name":"LIPSA - November 4th 2018 - USPSA Classifier Match","match_date":"2018-11-04","stage_classifiercode":"99-12","member_number":"L3463","first_name":"DEMETRI","last_name":"KATOS","classification":"A","division":"OPEN","hit_factor":8.7025},{"match_name":"USPSA MO21 Special Classifier 2Alpha SBRC February 27 2021","match_date":"2021-02-27","stage_classifiercode":"99-12","member_number":"RD6","first_name":"MIKE","last_name":"FOLEY","classification":"M","division":"OPEN","hit_factor":8.6957},{"match_name":"LIPSA - April 30th 2017 - USPSA Match Special Classifier","match_date":"2017-04-30","stage_classifiercode":"99-12","member_number":"TY9036","first_name":"STANLEY","last_name":"DOROSKI","classification":"A","division":"OPEN","hit_factor":8.6705},{"match_name":"Collin County USPSA Nov. 27 2016","match_date":"2016-11-25","stage_classifiercode":"99-12","member_number":"L3571","first_name":"KEN","last_name":"COBB","classification":"M","division":"OPEN","hit_factor":8.6697},{"match_name":"NTPS-SE August 2016","match_date":"2016-08-20","stage_classifiercode":"99-12","member_number":"TY65499","first_name":"JASON","last_name":"WARD","classification":"B","division":"OPEN","hit_factor":8.6587},{"match_name":"ENPS May 2018 USPSA Match","match_date":"2018-05-06","stage_classifiercode":"99-12","member_number":"TY53045","first_name":"AUSTIN","last_name":"GRIFFITH","classification":"M","division":"OPEN","hit_factor":8.6572},{"match_name":"PIPS 06-14-2017","match_date":"2017-06-14","stage_classifiercode":"99-12","member_number":"FY69138","first_name":"JOHN","last_name":"CEDARBERG","classification":"B","division":"OPEN","hit_factor":8.6181},{"match_name":"Danville Rifle and Pistol Club USPSA IL17 April 21 2018","match_date":"2018-04-21","stage_classifiercode":"99-12","member_number":"A102630","first_name":"NATE","last_name":"POULSON","classification":"U","division":"OPEN","hit_factor":8.6003},{"match_name":"LIPSA - April 30th 2017 - USPSA Match Special Classifier","match_date":"2017-04-30","stage_classifiercode":"99-12","member_number":"L3463","first_name":"DEMETRI","last_name":"KATOS","classification":"A","division":"OPEN","hit_factor":8.5973},{"match_name":"OK15 USPSA AT USSA","match_date":"2016-07-10","stage_classifiercode":"99-12","member_number":"TY54207","first_name":"JAY","last_name":"MACKEY","classification":"M","division":"OPEN","hit_factor":8.5761},{"match_name":"Hosemasters  3rd Sunday Feburary 2017","match_date":"2017-02-12","stage_classifiercode":"99-12","member_number":"A18698","first_name":"MICHAEL","last_name":"DALE","classification":"M","division":"OPEN","hit_factor":8.5714},{"match_name":"PCGC  June 2017","match_date":"2017-06-25","stage_classifiercode":"99-12","member_number":"L4135","first_name":"TOM","last_name":"SARGENT","classification":"M","division":"OPEN","hit_factor":8.5616},{"match_name":"LIPSA - November 4th 2018 - USPSA Classifier Match","match_date":"2018-11-04","stage_classifiercode":"99-12","member_number":"A81323","first_name":"JOE","last_name":"DRAGHI","classification":"A","division":"OPEN","hit_factor":8.5},{"match_name":"BRC_20170611","match_date":"2017-06-11","stage_classifiercode":"99-12","member_number":"L3762","first_name":"LANCE","last_name":"FOSTER","classification":"A","division":"OPEN","hit_factor":8.4672},{"match_name":"Richmond Hot Shots USPSA Classifier Match Sat April 8-2017","match_date":"2017-04-08","stage_classifiercode":"99-12","member_number":"A84616","first_name":"MJ","last_name":"FINEZA","classification":"A","division":"OPEN","hit_factor":8.4211},{"match_name":"EWPSA 2016-04","match_date":"2016-04-17","stage_classifiercode":"99-12","member_number":"A80666","first_name":"SHANE","last_name":"HILL","classification":"M","division":"OPEN","hit_factor":8.4158},{"match_name":"LIPSA - April 30th 2017 - USPSA Match Special Classifier","match_date":"2017-04-30","stage_classifiercode":"99-12","member_number":"L3851","first_name":"JEFF","last_name":"PAULSEN","classification":"B","division":"OPEN","hit_factor":8.4112},{"match_name":"12-19-18 MISS Match","match_date":"2018-12-19","stage_classifiercode":"99-12","member_number":"A78070","first_name":"MARK","last_name":"SORENSEN","classification":"M","division":"OPEN","hit_factor":8.3799},{"match_name":"FBURG April 2017 Level I USPSA ","match_date":"2017-04-01","stage_classifiercode":"99-12","member_number":"A88350","first_name":"DAVID","last_name":"WAMPLER","classification":"G","division":"OPEN","hit_factor":8.3714},{"match_name":"Maine Practical Shooters May 2018","match_date":"2018-05-12","stage_classifiercode":"99-12","member_number":"A105968","first_name":"JAY","last_name":"BEAL","classification":"A","division":"OPEN","hit_factor":8.3587},{"match_name":"RBGC 2018-7-28","match_date":"2018-07-28","stage_classifiercode":"99-12","member_number":"TY19303","first_name":"BRAD","last_name":"GRIFFIN","classification":"G","division":"OPEN","hit_factor":8.3333},{"match_name":"LdF USPSA Match July 14 2018","match_date":"2018-07-14","stage_classifiercode":"99-12","member_number":"A38618","first_name":"HENRY","last_name":"TORIBIO","classification":"M","division":"OPEN","hit_factor":8.284},{"match_name":"12-19-18 MISS Match","match_date":"2018-12-19","stage_classifiercode":"99-12","member_number":"TY88087","first_name":"JOHN","last_name":"CAGAOAN","classification":"B","division":"OPEN","hit_factor":8.277},{"match_name":"SPSA USPSA March 4th Sat match","match_date":"2017-03-25","stage_classifiercode":"99-12","member_number":"A92288","first_name":"JUSTIN","last_name":"BERRY","classification":"B","division":"OPEN","hit_factor":8.2569},{"match_name":"Prescott 3rd Sunday USPSA 11-20-2016","match_date":"2016-11-20","stage_classifiercode":"99-12","member_number":"A12460","first_name":"ED","last_name":"SERICH","classification":"A","division":"OPEN","hit_factor":8.2474},{"match_name":"Brothers N Arms February 2018 USPSA Match","match_date":"2018-02-17","stage_classifiercode":"99-12","member_number":"A86980","first_name":"BRYAN","last_name":"TULLOS","classification":"A","division":"OPEN","hit_factor":8.2386},{"match_name":"DWB - Deadwood Boys USPSA 18 February 2018","match_date":"2018-02-18","stage_classifiercode":"99-12","member_number":"A98726","first_name":"CALEB","last_name":"BAER","classification":"A","division":"OPEN","hit_factor":8.2317},{"match_name":"WNPL USPSA - Labour Day Weekend - Sept 2017","match_date":"2017-09-02","stage_classifiercode":"99-12","member_number":"A84616","first_name":"MJ","last_name":"FINEZA","classification":"A","division":"OPEN","hit_factor":8.1994},{"match_name":"Brothers N Arms February 2018 USPSA Match","match_date":"2018-02-17","stage_classifiercode":"99-12","member_number":"A106584","first_name":"PHILLIP","last_name":"SEXTON","classification":"C","division":"OPEN","hit_factor":8.1991},{"match_name":"Hosemasters  3rd Sunday Feburary 2017","match_date":"2017-02-12","stage_classifiercode":"99-12","member_number":"TY83533","first_name":"ANDY","last_name":"FEIGIN","classification":"B","division":"OPEN","hit_factor":8.1575},{"match_name":"17s PSC - Feb 2017 - USPSA match","match_date":"2017-02-04","stage_classifiercode":"99-12","member_number":"L2897","first_name":"DONN","last_name":"HILL","classification":"A","division":"OPEN","hit_factor":8.1481},{"match_name":"NTPS-SE August 2016","match_date":"2016-08-20","stage_classifiercode":"99-12","member_number":"TY45937","first_name":"RANDEE","last_name":"UY","classification":"M","division":"OPEN","hit_factor":8.126},{"match_name":"H&H June Match","match_date":"2016-06-26","stage_classifiercode":"99-12","member_number":"TY58871","first_name":"HEATH","last_name":"VINCENT","classification":"M","division":"OPEN","hit_factor":8.1218},{"match_name":"Richmond Hot Shots February 7-2016 USPSA Match","match_date":"2016-02-07","stage_classifiercode":"99-12","member_number":"A84616","first_name":"MJ","last_name":"FINEZA","classification":"B","division":"OPEN","hit_factor":8.1164},{"match_name":"CGC 2017_05_13","match_date":"2017-05-13","stage_classifiercode":"99-12","member_number":"TY52571","first_name":"PETER","last_name":"OLIVER","classification":"M","division":"OPEN","hit_factor":8.1001},{"match_name":"Richmond Hot Shots USPSA Classifier Match Sat April 8-2017","match_date":"2017-04-08","stage_classifiercode":"99-12","member_number":"TY91248","first_name":"DAVID","last_name":"GEORGE","classification":"B","division":"OPEN","hit_factor":8.096},{"match_name":"Stock & Barrel MN18 November 2020 USPSA Classifier Match","match_date":"2020-11-01","stage_classifiercode":"99-12","member_number":"Fy69138","first_name":"JOHN","last_name":"CEDARBERG","classification":"M","division":"OPEN","hit_factor":8.0764},{"match_name":"TAC2 USPSA August 2017","match_date":"2017-08-05","stage_classifiercode":"99-12","member_number":"A73262","first_name":"KEVIN","last_name":"SUFFRIDGE","classification":"U","division":"OPEN","hit_factor":8.0622},{"match_name":"Belton Gun Club USPSA January MATCH 1-30-21","match_date":"2021-01-30","stage_classifiercode":"99-12","member_number":"L4897","first_name":"PATRICK","last_name":"CHAMBERLAIN","classification":"A","division":"OPEN","hit_factor":8.0597},{"match_name":"HRRB 5-20-2017","match_date":"2017-05-20","stage_classifiercode":"99-12","member_number":"A91552","first_name":"AUREL","last_name":"TEMPORAL","classification":"B","division":"OPEN","hit_factor":8.046},{"match_name":"Tangi January 2016 USPSA","match_date":"2016-01-23","stage_classifiercode":"99-12","member_number":"a85466","first_name":"CHRIS","last_name":"CARNEY","classification":"A","division":"OPEN","hit_factor":8.0182},{"match_name":"Collin County USPSA Nov. 27 2016","match_date":"2016-11-25","stage_classifiercode":"99-12","member_number":"TY53799","first_name":"LEE","last_name":"NEEL","classification":"G","division":"OPEN","hit_factor":8},{"match_name":"GCL Wed 1-29-20","match_date":"2020-01-29","stage_classifiercode":"99-12","member_number":"A80418","first_name":"ALVA","last_name":"ENGLISH","classification":"A","division":"OPEN","hit_factor":7.9939},{"match_name":"Palmetto Gun Club - February 2018 USPSA","match_date":"2018-02-03","stage_classifiercode":"99-12","member_number":"A88984","first_name":"NEREO","last_name":"PARRENO","classification":"B","division":"OPEN","hit_factor":7.9812},{"match_name":"Colonial Rifle and Pistol Club June 2018 Special Classifier","match_date":"2018-06-02","stage_classifiercode":"99-12","member_number":"TY93363","first_name":"DEAN","last_name":"CHASSE","classification":"B","division":"OPEN","hit_factor":7.9295},{"match_name":"XMG USPSA   Saturday September  4th 2021","match_date":"2021-09-04","stage_classifiercode":"99-12","member_number":"TY72510","first_name":"MICHAEL","last_name":"BATHON","classification":"B","division":"OPEN","hit_factor":7.891},{"match_name":"GCL December 12-2-17","match_date":"2017-12-02","stage_classifiercode":"99-12","member_number":"L3750","first_name":"MIKE","last_name":"COLE","classification":"M","division":"OPEN","hit_factor":7.8838},{"match_name":"Prescott 3rd Sunday USPSA 11-20-2016","match_date":"2016-11-20","stage_classifiercode":"99-12","member_number":"A18698","first_name":"MICHAEL","last_name":"DALE","classification":"M","division":"OPEN","hit_factor":7.8762},{"match_name":"PCGC  June 2017","match_date":"2017-06-25","stage_classifiercode":"99-12","member_number":"TY79620","first_name":"DAVID","last_name":"BLAIR 2","classification":"B","division":"OPEN","hit_factor":7.8684},{"match_name":"Fairfax PS USPSA  2018 September","match_date":"2018-09-18","stage_classifiercode":"99-12","member_number":"A96020","first_name":"SCOTT CONCEALED","last_name":"JEDLINSKI","classification":"A","division":"OPEN","hit_factor":7.8669},{"match_name":"NISA April Classifer Match 2016","match_date":"2016-04-24","stage_classifiercode":"99-12","member_number":"A55556","first_name":"RON","last_name":"EVANS","classification":"B","division":"OPEN","hit_factor":7.8603},{"match_name":"Nampa USPSA February 1st","match_date":"2020-02-01","stage_classifiercode":"99-12","member_number":"A530","first_name":"JERRY","last_name":"DIX","classification":"M","division":"OPEN","hit_factor":7.8488},{"match_name":"HRRB 5-20-2017","match_date":"2017-05-20","stage_classifiercode":"99-12","member_number":"FY49431","first_name":"APOLONIO","last_name":"DULATRE","classification":"M","division":"OPEN","hit_factor":7.8484},{"match_name":"SFPC September USPSA Special Classifier match","match_date":"2016-09-04","stage_classifiercode":"99-12","member_number":"FY66957","first_name":"MIKE","last_name":"ENGLAND","classification":"B","division":"OPEN","hit_factor":7.8459},{"match_name":"AAPS AAFG Special Classifier Match - March 31 2018","match_date":"2018-03-31","stage_classifiercode":"99-12","member_number":"TY89408","first_name":"CHRISTOPHER","last_name":"AN","classification":"U","division":"OPEN","hit_factor":7.8329},{"match_name":"EL06 USPSA June 27 2021","match_date":"2021-06-27","stage_classifiercode":"99-12","member_number":"A 112035","first_name":"JUSTIN","last_name":"KILGORE","classification":"U","division":"OPEN","hit_factor":7.8322},{"match_name":"GCL Wed 1-29-20","match_date":"2020-01-29","stage_classifiercode":"99-12","member_number":"TY95157","first_name":"JIM","last_name":"CIVITELLO","classification":"A","division":"OPEN","hit_factor":7.83},{"match_name":"North Mountain July ","match_date":"2016-07-17","stage_classifiercode":"99-12","member_number":"A82592","first_name":"THOMAS","last_name":"KOH","classification":"A","division":"OPEN","hit_factor":7.8212},{"match_name":"GCL Wed 1-29-20","match_date":"2020-01-29","stage_classifiercode":"99-12","member_number":"A103919","first_name":"JUSTIN","last_name":"HENDERSON","classification":"C","division":"OPEN","hit_factor":7.8014},{"match_name":"MPSA 2021-08-21","match_date":"2021-08-21","stage_classifiercode":"99-12","member_number":"TY42086","first_name":"BILL","last_name":"JACKSON","classification":"A","division":"OPEN","hit_factor":7.7852},{"match_name":"LIPSA - April 30th 2017 - USPSA Match Special Classifier","match_date":"2017-04-30","stage_classifiercode":"99-12","member_number":"TY77141","first_name":"KEN (LOUIE)","last_name":"PRIMERO","classification":"U","division":"OPEN","hit_factor":7.781},{"match_name":"HPS September Club Fun Shoot","match_date":"2018-09-01","stage_classifiercode":"99-12","member_number":"A91552","first_name":"AUREL","last_name":"TEMPORAL","classification":"B","division":"OPEN","hit_factor":7.781},{"match_name":"MCPSL Pistol 4-9-16","match_date":"2016-04-09","stage_classifiercode":"99-12","member_number":"L3768","first_name":"BOB","last_name":"BARKER","classification":"A","division":"OPEN","hit_factor":7.7796},{"match_name":"OK15 USPSA at USSA","match_date":"2017-12-10","stage_classifiercode":"99-12","member_number":"A95417","first_name":"CHANCE","last_name":"DEASON","classification":"B","division":"OPEN","hit_factor":7.7728},{"match_name":"Nampa USPSA February 1st","match_date":"2020-02-01","stage_classifiercode":"99-12","member_number":"TY81469","first_name":"ERIC","last_name":"STEINER","classification":"M","division":"OPEN","hit_factor":7.767},{"match_name":"Shoot GTR USPSA 11/6","match_date":"2016-11-06","stage_classifiercode":"99-12","member_number":"A87477","first_name":"WILL","last_name":"JENSEN","classification":"B","division":"OPEN","hit_factor":7.7657},{"match_name":"OFGC Practical Pistol Match Jan 17 2016","match_date":"2016-01-17","stage_classifiercode":"99-12","member_number":"TY55378","first_name":"TRAVIS","last_name":"THOMPSON","classification":"B","division":"OPEN","hit_factor":7.7333},{"match_name":"Hosemasters  3rd Sunday Feburary 2017","match_date":"2017-02-12","stage_classifiercode":"99-12","member_number":"A80318","first_name":"JIM","last_name":"ADAME","classification":"G","division":"OPEN","hit_factor":7.7259},{"match_name":"SFPS 05-21-17 Superclassifier Gun1","match_date":"2017-05-21","stage_classifiercode":"99-12","member_number":"TY65769","first_name":"DANIEL","last_name":"NESTHUS","classification":"B","division":"OPEN","hit_factor":7.7253},{"match_name":"AIPS  USPSA Monthly 12 November 2016","match_date":"2016-11-12","stage_classifiercode":"99-12","member_number":"TY81149","first_name":"BRAD","last_name":"POLAND","classification":"B","division":"OPEN","hit_factor":7.7247},{"match_name":"DGC USPSA 07-08-18","match_date":"2018-07-08","stage_classifiercode":"99-12","member_number":"TY87135","first_name":"ENVER","last_name":"FOCAKOVIC","classification":"A","division":"OPEN","hit_factor":7.7039},{"match_name":"North Mountain July ","match_date":"2016-07-17","stage_classifiercode":"99-12","member_number":"TY55989","first_name":"MIKE","last_name":"WHITMAN","classification":"B","division":"OPEN","hit_factor":7.6821},{"match_name":"MCPSL Pistol 4-8-17","match_date":"2017-04-08","stage_classifiercode":"99-12","member_number":"A81921","first_name":"TODD","last_name":"MAYTA","classification":"U","division":"OPEN","hit_factor":7.6818},{"match_name":"DRRC Dec2016","match_date":"2016-12-03","stage_classifiercode":"99-12","member_number":"TY80327","first_name":"DAVE","last_name":"LUND","classification":"U","division":"OPEN","hit_factor":7.6816},{"match_name":"MPPL USPSA Match 01072017","match_date":"2017-01-07","stage_classifiercode":"99-12","member_number":"TY75056","first_name":"ELMER","last_name":"BANEZ","classification":"A","division":"OPEN","hit_factor":7.6602},{"match_name":"Nampa USPSA February 1st","match_date":"2020-02-01","stage_classifiercode":"99-12","member_number":"A108060","first_name":"LUCAS","last_name":"DINA","classification":"B","division":"OPEN","hit_factor":7.6602},{"match_name":"XMG USPSA   Saturday September  4th 2021","match_date":"2021-09-04","stage_classifiercode":"99-12","member_number":"A111665","first_name":"CRAIG","last_name":"KILLEN (BD)","classification":"B","division":"OPEN","hit_factor":7.651},{"match_name":"XMG USPSA   Saturday September  4th 2021","match_date":"2021-09-04","stage_classifiercode":"99-12","member_number":"l3611","first_name":"RAYMOND","last_name":"VAN VALKENBURG","classification":"A","division":"OPEN","hit_factor":7.6149},{"match_name":"SSP Super Classifier 1-30-16","match_date":"2016-01-30","stage_classifiercode":"99-12","member_number":"A27294","first_name":"ALLEN","last_name":"ROONEY2","classification":"A","division":"OPEN","hit_factor":7.604},{"match_name":"LIPSA - April 30th 2017 - USPSA Match Special Classifier","match_date":"2017-04-30","stage_classifiercode":"99-12","member_number":"TY82399","first_name":"JAMES","last_name":"BYRNE","classification":"B","division":"OPEN","hit_factor":7.6023},{"match_name":"LCSA USPSA ALL CLASSIFIER ","match_date":"2018-06-30","stage_classifiercode":"99-12","member_number":"TY91700","first_name":"JEFF","last_name":"MORSE","classification":"B","division":"OPEN","hit_factor":7.5988},{"match_name":"OK15 USPSA at USSA","match_date":"2017-12-10","stage_classifiercode":"99-12","member_number":"FY69155","first_name":"WES","last_name":"BOLES","classification":"B","division":"OPEN","hit_factor":7.5967},{"match_name":"GCL December 12-2-17","match_date":"2017-12-02","stage_classifiercode":"99-12","member_number":"A80418","first_name":"ALVA","last_name":"ENGLISH","classification":"A","division":"OPEN","hit_factor":7.5843},{"match_name":"SCCPSA USPSA Mar 17","match_date":"2018-03-17","stage_classifiercode":"99-12","member_number":"L1158","first_name":"JIM","last_name":"HAND","classification":"M","division":"OPEN","hit_factor":7.5738},{"match_name":"ORSA USPSA October 2016","match_date":"2016-10-15","stage_classifiercode":"99-12","member_number":"TY62447","first_name":"ADRIAN","last_name":"COBB","classification":"M","division":"OPEN","hit_factor":7.5385},{"match_name":"Richmond Hot Shots February 7-2016 USPSA Match","match_date":"2016-02-07","stage_classifiercode":"99-12","member_number":"TY24456","first_name":"RANDY","last_name":"MELTON","classification":"M","division":"OPEN","hit_factor":7.5099},{"match_name":"LdF 4th Saturday Match","match_date":"2016-01-23","stage_classifiercode":"99-12","member_number":"FY39124","first_name":"RAMIRO","last_name":"REYES","classification":"M","division":"OPEN","hit_factor":7.478},{"match_name":"H&H June Match","match_date":"2016-06-26","stage_classifiercode":"99-12","member_number":"A71435","first_name":"FEGEE","last_name":"MATLOCK","classification":"A","division":"OPEN","hit_factor":7.4627},{"match_name":"TAC2 USPSA August 2017","match_date":"2017-08-05","stage_classifiercode":"99-12","member_number":"A45411","first_name":"JASON","last_name":"EDWARDS","classification":"U","division":"OPEN","hit_factor":7.4586},{"match_name":"OK15 USPSA AT USSA","match_date":"2016-07-10","stage_classifiercode":"99-12","member_number":"A71435","first_name":"FEEGEE","last_name":"MATLOCK","classification":"A","division":"OPEN","hit_factor":7.4425},{"match_name":"Emmett September Match","match_date":"2016-09-24","stage_classifiercode":"99-12","member_number":"TY80321","first_name":"DAN","last_name":"HAWKINS","classification":"B","division":"OPEN","hit_factor":7.4369},{"match_name":"CCPL 04102016","match_date":"2016-04-10","stage_classifiercode":"99-12","member_number":"A88732","first_name":"THI","last_name":"NGUYEN","classification":"A","division":"OPEN","hit_factor":7.4316},{"match_name":"Richmond Hot Shots February 7-2016 USPSA Match","match_date":"2016-02-07","stage_classifiercode":"99-12","member_number":"TY74322","first_name":"ANDRE","last_name":"TAUBE","classification":"A","division":"OPEN","hit_factor":7.4294},{"match_name":"North Mountain July ","match_date":"2016-07-17","stage_classifiercode":"99-12","member_number":"L3315","first_name":"JEFF","last_name":"SALZBERG","classification":"A","division":"OPEN","hit_factor":7.4219},{"match_name":"Richmond Hot Shots February 7-2016 USPSA Match","match_date":"2016-02-07","stage_classifiercode":"99-12","member_number":"FY18635","first_name":"JAMES","last_name":"SABUROMARU","classification":"M","division":"OPEN","hit_factor":7.4184},{"match_name":"Holmen USPSA Mar 26 2017","match_date":"2017-03-26","stage_classifiercode":"99-12","member_number":"TY71386","first_name":"STUART","last_name":"LEINBACH","classification":"B","division":"OPEN","hit_factor":7.4128},{"match_name":"FPS USPSA April2017","match_date":"2017-04-02","stage_classifiercode":"99-12","member_number":"Ty82399","first_name":"JIMMY","last_name":"BYRNE","classification":"B","division":"OPEN","hit_factor":7.4074},{"match_name":"Sept 3rd Uspsa   Pickaway","match_date":"2016-09-03","stage_classifiercode":"99-12","member_number":"A81837","first_name":"CODY","last_name":"BAKER","classification":"G","division":"OPEN","hit_factor":7.4074},{"match_name":"Danville Rifle and Pistol Club USPSA IL17 April 21 2018","match_date":"2018-04-21","stage_classifiercode":"99-12","member_number":"Ty100795","first_name":"JOHN","last_name":"KLENDWORTH","classification":"B","division":"OPEN","hit_factor":7.402},{"match_name":"Amarillo Action April  USPSA","match_date":"2016-04-23","stage_classifiercode":"99-12","member_number":"TY57268","first_name":"PHIL","last_name":"TAPPE","classification":"U","division":"OPEN","hit_factor":7.3925},{"match_name":"OK15 USPSA AT USSA","match_date":"2016-07-10","stage_classifiercode":"99-12","member_number":"TY-55378","first_name":"TRAVIS","last_name":"THOMPSON","classification":"A","division":"OPEN","hit_factor":7.3879},{"match_name":"FBURG April 2017 Level I USPSA ","match_date":"2017-04-01","stage_classifiercode":"99-12","member_number":"\"\"","first_name":"DENNIS","last_name":"VIAR","classification":"M","division":"OPEN","hit_factor":7.3864},{"match_name":"Minnetonka Game And Fish May 23","match_date":"2018-05-23","stage_classifiercode":"99-12","member_number":"A97255","first_name":"DARIN","last_name":"MAGER","classification":"U","division":"OPEN","hit_factor":7.3826},{"match_name":"USPSA MO21 Special Classifier 2Alpha SBRC February 27 2021","match_date":"2021-02-27","stage_classifiercode":"99-12","member_number":"A108097","first_name":"JOSEPH","last_name":"HICKS","classification":"B","division":"OPEN","hit_factor":7.3611},{"match_name":"Richmond Hot Shots USPSA Classifier Match Sat April 8-2017","match_date":"2017-04-08","stage_classifiercode":"99-12","member_number":"A96836","first_name":"JOSEF","last_name":"RAPADAS","classification":"B","division":"OPEN","hit_factor":7.3239},{"match_name":"Shongum April 2017 USPSA Match","match_date":"2017-04-01","stage_classifiercode":"99-12","member_number":"TY20395","first_name":"LEO","last_name":"PRIMERO","classification":"B","division":"OPEN","hit_factor":7.3203},{"match_name":"MSSA Uspsa Match","match_date":"2017-04-08","stage_classifiercode":"99-12","member_number":"L1325","first_name":"MARC","last_name":"REINHARDT","classification":"M","division":"OPEN","hit_factor":7.3132},{"match_name":"GCL Wed 1-29-20","match_date":"2020-01-29","stage_classifiercode":"99-12","member_number":"FY105696","first_name":"STUART","last_name":"WEAVER","classification":"B","division":"OPEN","hit_factor":7.3087},{"match_name":"LIPSA - November 4th 2018 - USPSA Classifier Match","match_date":"2018-11-04","stage_classifiercode":"99-12","member_number":"L2939","first_name":"MATT","last_name":"MCMAHON","classification":"A","division":"OPEN","hit_factor":7.3003},{"match_name":"GCL Wed 1-29-20","match_date":"2020-01-29","stage_classifiercode":"99-12","member_number":"L4570","first_name":"ELI","last_name":"SABER","classification":"M","division":"OPEN","hit_factor":7.297},{"match_name":"Collin County USPSA Nov. 27 2016","match_date":"2016-11-25","stage_classifiercode":"99-12","member_number":"A69625","first_name":"KEITH","last_name":"GYGER","classification":"B","division":"OPEN","hit_factor":7.2848},{"match_name":"GCL December 12-2-17","match_date":"2017-12-02","stage_classifiercode":"99-12","member_number":"A84855","first_name":"BRIAN","last_name":"HARRISON","classification":"U","division":"OPEN","hit_factor":7.2773},{"match_name":"LIPSA - April 30th 2017 - USPSA Match Special Classifier","match_date":"2017-04-30","stage_classifiercode":"99-12","member_number":"TY41042","first_name":"JOSEPH","last_name":"PROCOPIO","classification":"M","division":"OPEN","hit_factor":7.2727},{"match_name":"DGC USPSA 07-08-18","match_date":"2018-07-08","stage_classifiercode":"99-12","member_number":"A106020","first_name":"JACOB","last_name":"TAYLOR","classification":"A","division":"OPEN","hit_factor":7.2704},{"match_name":"11 March Classifier Match","match_date":"2018-03-10","stage_classifiercode":"99-12","member_number":"A105266","first_name":"ERIC","last_name":"FORREST","classification":"B","division":"OPEN","hit_factor":7.2633},{"match_name":"MVPSA USPSA July 17th","match_date":"2021-07-17","stage_classifiercode":"99-12","member_number":"TY89492","first_name":"JESSE","last_name":"CLAUSSE","classification":"G","division":"OPEN","hit_factor":7.2595},{"match_name":"OFGC USPSA Match Feb 19th 2017","match_date":"2017-02-19","stage_classifiercode":"99-12","member_number":"A81825","first_name":"IAN","last_name":"ZACHER","classification":"B","division":"OPEN","hit_factor":7.2464},{"match_name":"SFPC March USPSA Match 2017","match_date":"2017-03-05","stage_classifiercode":"99-12","member_number":"FY66957","first_name":"MIKE","last_name":"ENGLAND","classification":"B","division":"OPEN","hit_factor":7.2445},{"match_name":"MPSA 2021-08-21","match_date":"2021-08-21","stage_classifiercode":"99-12","member_number":"A107778","first_name":"TIM","last_name":"PATTERSON","classification":"A","division":"OPEN","hit_factor":7.2273},{"match_name":"PCGC  June 2017","match_date":"2017-06-25","stage_classifiercode":"99-12","member_number":"L3887","first_name":"ADAM","last_name":"BIRKHIMER","classification":"B","division":"OPEN","hit_factor":7.2229},{"match_name":"Belton Gun Club USPSA January MATCH 1-30-21","match_date":"2021-01-30","stage_classifiercode":"99-12","member_number":"A87382","first_name":"CHRIS","last_name":"BRITT","classification":"B","division":"OPEN","hit_factor":7.215},{"match_name":"Richmond Hot Shots February 7-2016 USPSA Match","match_date":"2016-02-07","stage_classifiercode":"99-12","member_number":"A38711","first_name":"KENNETH","last_name":"MELTON","classification":"B","division":"OPEN","hit_factor":7.2059},{"match_name":"OK15 USPSA AT USSA","match_date":"2016-07-10","stage_classifiercode":"99-12","member_number":"TY75344","first_name":"CARY","last_name":"ROWTON","classification":"B","division":"OPEN","hit_factor":7.2},{"match_name":"Springfield Tactical Shooters 09/03/2020","match_date":"2020-09-03","stage_classifiercode":"99-12","member_number":"FY99127","first_name":"STEVE","last_name":"FRAZIER","classification":"B","division":"OPEN","hit_factor":7.1979},{"match_name":"Hosemasters  3rd Sunday Feburary 2017","match_date":"2017-02-12","stage_classifiercode":"99-12","member_number":"A89169","first_name":"PHIL","last_name":"GRUBBS","classification":"C","division":"OPEN","hit_factor":7.1713},{"match_name":"MSSA Uspsa Match","match_date":"2017-04-08","stage_classifiercode":"99-12","member_number":"TY19950","first_name":"JOHN","last_name":"KELLER","classification":"M","division":"OPEN","hit_factor":7.1703},{"match_name":"GCL December 12-2-17","match_date":"2017-12-02","stage_classifiercode":"99-12","member_number":"A96946","first_name":"GREG","last_name":"TRASS","classification":"U","division":"OPEN","hit_factor":7.1633},{"match_name":"Payson Practical Pistol Sept 03 2016","match_date":"2016-09-03","stage_classifiercode":"99-12","member_number":"A87474","first_name":"DAVID","last_name":"FRAZIER","classification":"U","division":"OPEN","hit_factor":7.1629},{"match_name":"Collin County USPSA Nov. 27 2016","match_date":"2016-11-25","stage_classifiercode":"99-12","member_number":"A12924","first_name":"CHRIS","last_name":"DAVIES","classification":"A","division":"OPEN","hit_factor":7.1625},{"match_name":"MVPSA USPSA August 7th Classifier Match","match_date":"2021-08-07","stage_classifiercode":"99-12","member_number":"A102491","first_name":"CARL","last_name":"JOHNSTON","classification":"D","division":"OPEN","hit_factor":7.1611},{"match_name":"Richmond Hot Shots February 7-2016 USPSA Match","match_date":"2016-02-07","stage_classifiercode":"99-12","member_number":"A51918","first_name":"TIM","last_name":"BOFMAN","classification":"A","division":"OPEN","hit_factor":7.1318},{"match_name":"Brothers N Arms August 2018 USPSA Match","match_date":"2018-08-18","stage_classifiercode":"99-12","member_number":"A107778","first_name":"TIM","last_name":"PATTERSON","classification":"C","division":"OPEN","hit_factor":7.1244},{"match_name":"OK15 USPSA AT USSA","match_date":"2016-07-10","stage_classifiercode":"99-12","member_number":"Ty69238","first_name":"TONY","last_name":"WALL","classification":"B","division":"OPEN","hit_factor":7.1156},{"match_name":"Emmett September Match","match_date":"2016-09-24","stage_classifiercode":"99-12","member_number":"a16541","first_name":"JIM","last_name":"FLACK","classification":"B","division":"OPEN","hit_factor":7.1038},{"match_name":"LdF USPSA Match July 14 2018","match_date":"2018-07-14","stage_classifiercode":"99-12","member_number":"TY16393","first_name":"JIM","last_name":"BUCCELLATO","classification":"M","division":"OPEN","hit_factor":7.1023},{"match_name":"HRRB 3-5-16","match_date":"2016-03-05","stage_classifiercode":"99-12","member_number":"a85569","first_name":"RYAN","last_name":"DIEZ","classification":"C","division":"OPEN","hit_factor":7.1006},{"match_name":"PCGC  June 2017","match_date":"2017-06-25","stage_classifiercode":"99-12","member_number":"A100061","first_name":"JASON","last_name":"HOLLEY","classification":"B","division":"OPEN","hit_factor":7.0984},{"match_name":"Maine Practical Shooters May 2018","match_date":"2018-05-12","stage_classifiercode":"99-12","member_number":"A96126","first_name":"LUKE","last_name":"HILTON","classification":"U","division":"OPEN","hit_factor":7.0959},{"match_name":"OK15 USPSA at USSA","match_date":"2017-12-10","stage_classifiercode":"99-12","member_number":"TY75344","first_name":"CARY","last_name":"ROWTON","classification":"A","division":"OPEN","hit_factor":7.0912},{"match_name":"WPS USPSA Monthly Match September 2018","match_date":"2018-09-01","stage_classifiercode":"99-12","member_number":"A101569","first_name":"VINCENT","last_name":"PERRONE","classification":"B","division":"OPEN","hit_factor":7.0761},{"match_name":"Hosemasters  3rd Sunday Feburary 2017","match_date":"2017-02-12","stage_classifiercode":"99-12","member_number":"A22810","first_name":"KERRY","last_name":"PEARSON","classification":"G","division":"OPEN","hit_factor":7.0652},{"match_name":"WPS USPSA Monthly Match September 2018","match_date":"2018-09-01","stage_classifiercode":"99-12","member_number":"FY38874","first_name":"ALDO","last_name":"GONZALEZ","classification":"B","division":"OPEN","hit_factor":7.0637},{"match_name":"EWPSA 2016-04","match_date":"2016-04-17","stage_classifiercode":"99-12","member_number":"A54667","first_name":"MIKE","last_name":"GOOD","classification":"B","division":"OPEN","hit_factor":7.0504},{"match_name":"RBGC 2018-7-28","match_date":"2018-07-28","stage_classifiercode":"99-12","member_number":"L3945","first_name":"ERIC","last_name":"HAGAN","classification":"B","division":"OPEN","hit_factor":7.0402},{"match_name":"DRRC Dec2016","match_date":"2016-12-03","stage_classifiercode":"99-12","member_number":"TY58134","first_name":"DANIEL","last_name":"CARPENTER","classification":"B","division":"OPEN","hit_factor":7.0243},{"match_name":"Emmett September Match","match_date":"2016-09-24","stage_classifiercode":"99-12","member_number":"l3630","first_name":"TRAVIS","last_name":"GIBSON","classification":"A","division":"OPEN","hit_factor":7.0175},{"match_name":"HRRB 3-5-16","match_date":"2016-03-05","stage_classifiercode":"99-12","member_number":"A68491","first_name":"JOJO","last_name":"BALINO","classification":"A","division":"OPEN","hit_factor":7.0122},{"match_name":"OFGC Practical Pistol Match Jan 17 2016","match_date":"2016-01-17","stage_classifiercode":"99-12","member_number":"A69412","first_name":"GREYSON","last_name":"LEE","classification":"A","division":"OPEN","hit_factor":6.9863},{"match_name":"GCL December 12-2-17","match_date":"2017-12-02","stage_classifiercode":"99-12","member_number":"A35723","first_name":"DAVE","last_name":"HAVASI","classification":"B","division":"OPEN","hit_factor":6.9628},{"match_name":"AIPS  USPSA Monthly 12 November 2016","match_date":"2016-11-12","stage_classifiercode":"99-12","member_number":"A65348","first_name":"CRAIG","last_name":"HABEL","classification":"B","division":"OPEN","hit_factor":6.9565},{"match_name":"Laser Ninja Dragon League USPSA August 2017","match_date":"2017-08-06","stage_classifiercode":"99-12","member_number":"\"\"","first_name":"RON","last_name":"WEAVER","classification":"U","division":"OPEN","hit_factor":6.9554},{"match_name":"Belton Gun Club USPSA January MATCH 1-30-21","match_date":"2021-01-30","stage_classifiercode":"99-12","member_number":"ty91263","first_name":"MATTHEW","last_name":"WOLFF","classification":"A","division":"OPEN","hit_factor":6.9532},{"match_name":"PIPS 06-14-2017","match_date":"2017-06-14","stage_classifiercode":"99-12","member_number":"TY3634","first_name":"GREGORY","last_name":"THOMAS","classification":"B","division":"OPEN","hit_factor":6.9293},{"match_name":"MSSA Uspsa Match","match_date":"2017-04-08","stage_classifiercode":"99-12","member_number":"TY37118","first_name":"WILLIAM","last_name":"SIGLER","classification":"M","division":"OPEN","hit_factor":6.9221},{"match_name":"Richmond Hot Shots February 7-2016 USPSA Match","match_date":"2016-02-07","stage_classifiercode":"99-12","member_number":"A33147","first_name":"VINCE","last_name":"DIONISIO","classification":"B","division":"OPEN","hit_factor":6.9168},{"match_name":"Tangi January 2016 USPSA","match_date":"2016-01-23","stage_classifiercode":"99-12","member_number":"ty63531","first_name":"CHARLES","last_name":"ALEXANDER","classification":"B","division":"OPEN","hit_factor":6.9106},{"match_name":"DWB - Deadwood Boys USPSA 18 February 2018","match_date":"2018-02-18","stage_classifiercode":"99-12","member_number":"\"\"","first_name":"JT","last_name":"TABION","classification":"U","division":"OPEN","hit_factor":6.9095},{"match_name":"COPS Feb 2017 USPSA Match","match_date":"2017-02-05","stage_classifiercode":"99-12","member_number":"A79174","first_name":"BRIXEY","last_name":"NELSON","classification":"M","division":"OPEN","hit_factor":6.8966},{"match_name":"ECPS February 28th USPSA Pistol Match","match_date":"2016-02-28","stage_classifiercode":"99-12","member_number":"A78407","first_name":"TODD","last_name":"JESSEE","classification":"A","division":"OPEN","hit_factor":6.8922},{"match_name":"Hosemasters  3rd Sunday Feburary 2017","match_date":"2017-02-12","stage_classifiercode":"99-12","member_number":"A91055","first_name":"BOB","last_name":"WAGNER","classification":"B","division":"OPEN","hit_factor":6.8845},{"match_name":"OFGC Practical Pistol Match Jan 17 2016","match_date":"2016-01-17","stage_classifiercode":"99-12","member_number":"TY69238","first_name":"TONY","last_name":"WALL","classification":"B","division":"OPEN","hit_factor":6.8836},{"match_name":"LdF 4th Saturday Match","match_date":"2016-01-23","stage_classifiercode":"99-12","member_number":"A18808","first_name":"LUIS","last_name":"PAZ","classification":"A","division":"OPEN","hit_factor":6.882},{"match_name":"MCPSL Pistol 4-8-17","match_date":"2017-04-08","stage_classifiercode":"99-12","member_number":"TY29453","first_name":"JD","last_name":"SMITH","classification":"M","division":"OPEN","hit_factor":6.875},{"match_name":"WNPL USPSA - Labour Day Weekend - Sept 2017","match_date":"2017-09-02","stage_classifiercode":"99-12","member_number":"A91661","first_name":"MATTHEW","last_name":"HORNBACK","classification":"C","division":"OPEN","hit_factor":6.8712},{"match_name":"Hosemasters  3rd Sunday Feburary 2017","match_date":"2017-02-12","stage_classifiercode":"99-12","member_number":"\"\"","first_name":"HIRO","last_name":"YAMAGUCHI","classification":"M","division":"OPEN","hit_factor":6.8702},{"match_name":"MRPC USPSA Mar 2017","match_date":"2017-03-26","stage_classifiercode":"99-12","member_number":"A87894","first_name":"DEVEN","last_name":"WAGNER","classification":"B","division":"OPEN","hit_factor":6.8702},{"match_name":"SFPC March USPSA Match 2017","match_date":"2017-03-05","stage_classifiercode":"99-12","member_number":"TY82866","first_name":"GARY","last_name":"BRILL","classification":"B","division":"OPEN","hit_factor":6.8627},{"match_name":"SPSA USPSA March 4th Sat match","match_date":"2017-03-25","stage_classifiercode":"99-12","member_number":"A84265","first_name":"ROD","last_name":"GOFORTH","classification":"B","division":"OPEN","hit_factor":6.8613},{"match_name":"GCL Wed 1-29-20","match_date":"2020-01-29","stage_classifiercode":"99-12","member_number":"L3750","first_name":"MIKE","last_name":"COLE","classification":"M","division":"OPEN","hit_factor":6.8546},{"match_name":"HRRB 3-5-16","match_date":"2016-03-05","stage_classifiercode":"99-12","member_number":"FY49431","first_name":"APOLONIO","last_name":"DULATRE","classification":"M","division":"OPEN","hit_factor":6.8475},{"match_name":"WNPL USPSA - Labour Day Weekend - Sept 2017","match_date":"2017-09-02","stage_classifiercode":"99-12","member_number":"TY91860","first_name":"COLE","last_name":"HORNBACK","classification":"C","division":"OPEN","hit_factor":6.8345},{"match_name":"GCL December 12-2-17","match_date":"2017-12-02","stage_classifiercode":"99-12","member_number":"FY45990","first_name":"JOHN","last_name":"MARCAIDA","classification":"M","division":"OPEN","hit_factor":6.8299},{"match_name":"LdF USPSA Match July 14 2018","match_date":"2018-07-14","stage_classifiercode":"99-12","member_number":"TY17381","first_name":"JOHN","last_name":"HURST","classification":"M","division":"OPEN","hit_factor":6.8182},{"match_name":"North Mountain July ","match_date":"2016-07-17","stage_classifiercode":"99-12","member_number":"\"\"","first_name":"RUSSELL","last_name":"FORTNEY","classification":"A","division":"OPEN","hit_factor":6.8069},{"match_name":"GRPC USPSA MARCH MAD HATTER","match_date":"2018-03-02","stage_classifiercode":"99-12","member_number":"A56629","first_name":"ROMAN","last_name":"GWISCZ","classification":"B","division":"OPEN","hit_factor":6.8044},{"match_name":"Richmond Hot Shots February 7-2016 USPSA Match","match_date":"2016-02-07","stage_classifiercode":"99-12","member_number":"L1620","first_name":"THOMAS","last_name":"CHAN","classification":"A","division":"OPEN","hit_factor":6.7949},{"match_name":"LdF 4th Saturday Match","match_date":"2016-01-23","stage_classifiercode":"99-12","member_number":"FY62295","first_name":"DAVID","last_name":"MORRIS","classification":"B","division":"OPEN","hit_factor":6.7857},{"match_name":"Minnetonka Game And Fish May 23","match_date":"2018-05-23","stage_classifiercode":"99-12","member_number":"A105972","first_name":"BEN","last_name":"MOORE","classification":"B","division":"OPEN","hit_factor":6.7715},{"match_name":"USPSA MO21 Special Classifier 2Alpha SBRC February 27 2021","match_date":"2021-02-27","stage_classifiercode":"99-12","member_number":"A130070","first_name":"CHRIS","last_name":"SHORT","classification":"U","division":"OPEN","hit_factor":6.7701},{"match_name":"Powell County Action Shooters July 17 2021","match_date":"2021-07-17","stage_classifiercode":"99-12","member_number":"A90239","first_name":"KYNAN","last_name":"SUTTER","classification":"U","division":"OPEN","hit_factor":6.7568},{"match_name":"LIPSA - April 30th 2017 - USPSA Match Special Classifier","match_date":"2017-04-30","stage_classifiercode":"99-12","member_number":"TY82399","first_name":"JAMES","last_name":"BYRNE","classification":"B","division":"OPEN","hit_factor":6.7548},{"match_name":"SFPC September USPSA Special Classifier match","match_date":"2016-09-04","stage_classifiercode":"99-12","member_number":"TY82866","first_name":"GARY","last_name":"BRILL","classification":"B","division":"OPEN","hit_factor":6.7536},{"match_name":"Palmetto Gun Club - February 2018 USPSA","match_date":"2018-02-03","stage_classifiercode":"99-12","member_number":"A63410","first_name":"EDDIE","last_name":"HUGHES","classification":"B","division":"OPEN","hit_factor":6.75},{"match_name":"SPSA USPSA March 4th Sat match","match_date":"2017-03-25","stage_classifiercode":"99-12","member_number":"A95144","first_name":"JACOB","last_name":"BRANT","classification":"C","division":"OPEN","hit_factor":6.7493},{"match_name":"PCGC  June 2017","match_date":"2017-06-25","stage_classifiercode":"99-12","member_number":"TY79620","first_name":"DAVID","last_name":"BLAIR","classification":"B","division":"OPEN","hit_factor":6.747},{"match_name":"Laser Ninja Dragon League USPSA August 2017","match_date":"2017-08-06","stage_classifiercode":"99-12","member_number":"TY 28359","first_name":"MIKE","last_name":"FOSTER","classification":"B","division":"OPEN","hit_factor":6.7456},{"match_name":"Piscataqua  Master Blasters USPSA Special Classifier","match_date":"2017-12-03","stage_classifiercode":"99-12","member_number":"A106156","first_name":"DAVID","last_name":"SEAVEY","classification":"U","division":"OPEN","hit_factor":6.7445},{"match_name":"Hosemasters  3rd Sunday Feburary 2017","match_date":"2017-02-12","stage_classifiercode":"99-12","member_number":"CL67","first_name":"ROGER","last_name":"F","classification":"M","division":"OPEN","hit_factor":6.7416},{"match_name":"MPSA 2021-08-21","match_date":"2021-08-21","stage_classifiercode":"99-12","member_number":"TY76693","first_name":"LEE","last_name":"FRAISER","classification":"B","division":"OPEN","hit_factor":6.7248},{"match_name":"SFPS 05-21-17 Superclassifier Gun1","match_date":"2017-05-21","stage_classifiercode":"99-12","member_number":"A65630","first_name":"JOSHUA","last_name":"KELLOGG","classification":"U","division":"OPEN","hit_factor":6.6991},{"match_name":"WPS USPSA Monthly Match September 2018","match_date":"2018-09-01","stage_classifiercode":"99-12","member_number":"TY11901","first_name":"DAVID","last_name":"LOPEZ","classification":"A","division":"OPEN","hit_factor":6.6906},{"match_name":"CRGC USPSA Special Classifier 08-15-21","match_date":"2021-08-15","stage_classifiercode":"99-12","member_number":"A54034","first_name":"NEIL","last_name":"VAUGHAN","classification":"","division":"OPEN","hit_factor":6.6852},{"match_name":"Collin County USPSA Nov. 27 2016","match_date":"2016-11-25","stage_classifiercode":"99-12","member_number":"\"\"","first_name":"JASON","last_name":"KELLAR","classification":"U","division":"OPEN","hit_factor":6.6741},{"match_name":"LIPSA - November 4th 2018 - USPSA Classifier Match","match_date":"2018-11-04","stage_classifiercode":"99-12","member_number":"TY89184","first_name":"ADAM","last_name":"GORDON","classification":"U","division":"OPEN","hit_factor":6.6667},{"match_name":"Shoot GTR USPSA 11/6","match_date":"2016-11-06","stage_classifiercode":"99-12","member_number":"TY34497","first_name":"PATRICK","last_name":"GAUVIN","classification":"A","division":"OPEN","hit_factor":6.6586},{"match_name":"GCL December 12-2-17","match_date":"2017-12-02","stage_classifiercode":"99-12","member_number":"A102572","first_name":"DAVE","last_name":"WILDE","classification":"C","division":"OPEN","hit_factor":6.6505},{"match_name":"Laser Ninja Dragon League USPSA August 2017","match_date":"2017-08-06","stage_classifiercode":"99-12","member_number":"A101554","first_name":"ALBERT","last_name":"MONTANEZ","classification":"C","division":"OPEN","hit_factor":6.6502},{"match_name":"WTPS USPSA April Classifier Match 4-8-17","match_date":"2017-04-08","stage_classifiercode":"99-12","member_number":"TY57268","first_name":"PHILLIP","last_name":"TAPPE","classification":"A","division":"OPEN","hit_factor":6.6486},{"match_name":"NISA April Classifer Match 2016","match_date":"2016-04-24","stage_classifiercode":"99-12","member_number":"a71862","first_name":"JOSEPH","last_name":"SINYAKOVICH","classification":"B","division":"OPEN","hit_factor":6.6216},{"match_name":"Sept 3rd Uspsa   Pickaway","match_date":"2016-09-03","stage_classifiercode":"99-12","member_number":"A85085","first_name":"RICK","last_name":"NEASE","classification":"B","division":"OPEN","hit_factor":6.6207},{"match_name":"Pinetucky USPSA 11-19-16","match_date":"2016-11-19","stage_classifiercode":"99-12","member_number":"TY-51383","first_name":"JOSHUA","last_name":"SIGHTLER","classification":"M","division":"OPEN","hit_factor":6.6176},{"match_name":"Brothers N Arms August 2018 USPSA Match","match_date":"2018-08-18","stage_classifiercode":"99-12","member_number":"TY42086","first_name":"BILL","last_name":"JACKSON","classification":"B","division":"OPEN","hit_factor":6.6074},{"match_name":"HRRB 3-5-16","match_date":"2016-03-05","stage_classifiercode":"99-12","member_number":"TY75056","first_name":"ELMER","last_name":"BANEZ","classification":"A","division":"OPEN","hit_factor":6.5963},{"match_name":"FBPPC DECEMBER 2016 SPECIAL CLASSIFIER MATCH","match_date":"2016-12-10","stage_classifiercode":"99-12","member_number":"TY3959","first_name":"FRANCIS","last_name":"LIVINGSTON","classification":"G","division":"OPEN","hit_factor":6.5916},{"match_name":"Springfield Tactical Shooters 09/03/2020","match_date":"2020-09-03","stage_classifiercode":"99-12","member_number":"FY99127","first_name":"STEVE","last_name":"FRAZIER","classification":"B","division":"OPEN","hit_factor":6.582},{"match_name":"HRRB 5-20-2017","match_date":"2017-05-20","stage_classifiercode":"99-12","member_number":"L4210","first_name":"BONG","last_name":"BARRANCO","classification":"B","division":"OPEN","hit_factor":6.5789},{"match_name":"TAC2 USPSA August 2017","match_date":"2017-08-05","stage_classifiercode":"99-12","member_number":"A96527","first_name":"JED","last_name":"MERCER","classification":"U","division":"OPEN","hit_factor":6.5744},{"match_name":"Richmond Hot Shots February 7-2016 USPSA Match","match_date":"2016-02-07","stage_classifiercode":"99-12","member_number":"A88607","first_name":"FRANCO","last_name":"GESMUNDO","classification":"B","division":"OPEN","hit_factor":6.5463},{"match_name":"Brothers N Arms February 2018 USPSA Match","match_date":"2018-02-17","stage_classifiercode":"99-12","member_number":"A105642","first_name":"CHRISTOPHER","last_name":"MULLETT","classification":"U","division":"OPEN","hit_factor":6.5445},{"match_name":"LPRGC-Lower Providence USPSA May-2 2017","match_date":"2017-05-13","stage_classifiercode":"99-12","member_number":"TY16248","first_name":"BARRY","last_name":"RUANE","classification":"M","division":"OPEN","hit_factor":6.5436},{"match_name":"Emmett September Match","match_date":"2016-09-24","stage_classifiercode":"99-12","member_number":"a71703","first_name":"DON","last_name":"MARTIN","classification":"B","division":"OPEN","hit_factor":6.5421},{"match_name":"HRRB 3-5-16","match_date":"2016-03-05","stage_classifiercode":"99-12","member_number":"TY50135","first_name":"HEHERSON","last_name":"LUNA","classification":"C","division":"OPEN","hit_factor":6.5333},{"match_name":"YMM IPSC02 2016_09_11","match_date":"2016-09-11","stage_classifiercode":"99-12","member_number":"TY22616","first_name":"ANNETTE","last_name":"WILLIAMSON","classification":"B","division":"OPEN","hit_factor":6.5315},{"match_name":"Danville Rifle and Pistol Club USPSA IL17 April 21 2018","match_date":"2018-04-21","stage_classifiercode":"99-12","member_number":"Ty100795","first_name":"JOHN","last_name":"KLENDWORTH","classification":"B","division":"OPEN","hit_factor":6.5306},{"match_name":"SFPC September USPSA Special Classifier match","match_date":"2016-09-04","stage_classifiercode":"99-12","member_number":"TY59666","first_name":"NESTOR","last_name":"SANCHEZ","classification":"B","division":"OPEN","hit_factor":6.516},{"match_name":"Hosemasters  3rd Sunday Feburary 2017","match_date":"2017-02-12","stage_classifiercode":"99-12","member_number":"A86225","first_name":"BRYSON","last_name":"KOROLSKY","classification":"B","division":"OPEN","hit_factor":6.5139},{"match_name":"NISA April Classifer Match 2016","match_date":"2016-04-24","stage_classifiercode":"99-12","member_number":"ty8469","first_name":"ISIAH","last_name":"STROUD","classification":"A","division":"OPEN","hit_factor":6.5068},{"match_name":"Brothers N Arms February 2018 USPSA Match","match_date":"2018-02-17","stage_classifiercode":"99-12","member_number":"A98482","first_name":"AARON","last_name":"FITZGERALD","classification":"B","division":"OPEN","hit_factor":6.505},{"match_name":"Prescott 3rd Sunday USPSA 11-20-2016","match_date":"2016-11-20","stage_classifiercode":"99-12","member_number":"A56187","first_name":"MICHAEL","last_name":"FILOSOFO","classification":"C","division":"OPEN","hit_factor":6.4982},{"match_name":"Rockcastle USPSA Nov 28 2015","match_date":"2015-11-28","stage_classifiercode":"99-12","member_number":"FY48392","first_name":"RICK","last_name":"VANBLARICUM","classification":"A","division":"OPEN","hit_factor":6.4935},{"match_name":"Richmond Hot Shots February 7-2016 USPSA Match","match_date":"2016-02-07","stage_classifiercode":"99-12","member_number":"A77462","first_name":"LENNIE","last_name":"VILLIADOS","classification":"C","division":"OPEN","hit_factor":6.4846},{"match_name":"PCGC  June 2017","match_date":"2017-06-25","stage_classifiercode":"99-12","member_number":"TY85085","first_name":"RICK","last_name":"NEASE","classification":"B","division":"OPEN","hit_factor":6.4803},{"match_name":"Richmond Hot Shots February 7-2016 USPSA Match","match_date":"2016-02-07","stage_classifiercode":"99-12","member_number":"FY81272","first_name":"GAYLORD","last_name":"GABRIEL","classification":"B","division":"OPEN","hit_factor":6.474},{"match_name":"Danville Rifle and Pistol Club USPSA IL17 April 21 2018","match_date":"2018-04-21","stage_classifiercode":"99-12","member_number":"L2281","first_name":"J","last_name":"GRIFFIN","classification":"A","division":"OPEN","hit_factor":6.4677},{"match_name":"MSSA Uspsa Match","match_date":"2017-04-08","stage_classifiercode":"99-12","member_number":"A23320","first_name":"JOHN","last_name":"STIEDLE","classification":"M","division":"OPEN","hit_factor":6.4677},{"match_name":"Belton Gun Club USPSA January MATCH 1-30-21","match_date":"2021-01-30","stage_classifiercode":"99-12","member_number":"A132539","first_name":"JUSTIN","last_name":"MANGLITZ","classification":"U","division":"OPEN","hit_factor":6.4607},{"match_name":"SPSA USPSA March 4th Sat match","match_date":"2017-03-25","stage_classifiercode":"99-12","member_number":"TY100721","first_name":"JOHN","last_name":"BUCKLEY","classification":"U","division":"OPEN","hit_factor":6.4516},{"match_name":"SSP Super Classifier 1-30-16","match_date":"2016-01-30","stage_classifiercode":"99-12","member_number":"A88904","first_name":"JOHN","last_name":"SIMS","classification":"C","division":"OPEN","hit_factor":6.4516},{"match_name":"LPRGC-Lower Providence USPSA May-2 2017","match_date":"2017-05-13","stage_classifiercode":"99-12","member_number":"A33985","first_name":"DONALD","last_name":"SEIGLE","classification":"M","division":"OPEN","hit_factor":6.4516},{"match_name":"BRC_20170611","match_date":"2017-06-11","stage_classifiercode":"99-12","member_number":"Ty16618","first_name":"JEFFREY","last_name":"MEYER","classification":"A","division":"OPEN","hit_factor":6.4516},{"match_name":"BHPSC Monthly Match - Feb 2020","match_date":"2020-02-29","stage_classifiercode":"99-12","member_number":"A90285","first_name":"CHRIS","last_name":"HOOVER","classification":"B","division":"OPEN","hit_factor":6.4426},{"match_name":"SCAPSA MN05 Summer League 1","match_date":"2017-06-05","stage_classifiercode":"99-12","member_number":"TY29847","first_name":"ROSS","last_name":"ROSENBERG","classification":"A","division":"OPEN","hit_factor":6.4252},{"match_name":"HPS September Club Fun Shoot","match_date":"2018-09-01","stage_classifiercode":"99-12","member_number":"TY92048","first_name":"HAROLD","last_name":"DOMINGO","classification":"C","division":"OPEN","hit_factor":6.423},{"match_name":"Pelham USPSA 2016-09-18","match_date":"2016-09-18","stage_classifiercode":"99-12","member_number":"TY82118","first_name":"PETER","last_name":"GILBERT","classification":"B","division":"OPEN","hit_factor":6.4208},{"match_name":"Laser Ninja Dragon League USPSA August 2017","match_date":"2017-08-06","stage_classifiercode":"99-12","member_number":"Ty64204","first_name":"BLAKE","last_name":"LILES","classification":"G","division":"OPEN","hit_factor":6.4189},{"match_name":"GCL December 12-2-17","match_date":"2017-12-02","stage_classifiercode":"99-12","member_number":"TY78149","first_name":"ELI","last_name":"SABER","classification":"A","division":"OPEN","hit_factor":6.4136},{"match_name":"Hosemasters  3rd Sunday Feburary 2017","match_date":"2017-02-12","stage_classifiercode":"99-12","member_number":"TY65635","first_name":"CHRIS","last_name":"COLLINS","classification":"B","division":"OPEN","hit_factor":6.4087},{"match_name":"OFGC USPSA Match 10-21-18","match_date":"2018-10-21","stage_classifiercode":"99-12","member_number":"A101870","first_name":"SETH","last_name":"BAGBY","classification":"U","division":"OPEN","hit_factor":6.4},{"match_name":"OFGC USPSA Match 10-21-18","match_date":"2018-10-21","stage_classifiercode":"99-12","member_number":"TY98513","first_name":"JASON","last_name":"BRADLEY","classification":"U","division":"OPEN","hit_factor":6.383},{"match_name":"XMG USPSA   Saturday September  4th 2021","match_date":"2021-09-04","stage_classifiercode":"99-12","member_number":"A74370","first_name":"TIM","last_name":"RODDY","classification":"C","division":"OPEN","hit_factor":6.3636},{"match_name":"RBGC 2018-7-28","match_date":"2018-07-28","stage_classifiercode":"99-12","member_number":"TY93235","first_name":"JENNIFER","last_name":"PETTY","classification":"B","division":"OPEN","hit_factor":6.3532},{"match_name":"Richmond Hot Shots February 7-2016 USPSA Match","match_date":"2016-02-07","stage_classifiercode":"99-12","member_number":"FY57197","first_name":"ALLEN","last_name":"JOSON","classification":"C","division":"OPEN","hit_factor":6.3472},{"match_name":"GMPS 5/7/17","match_date":"2017-05-06","stage_classifiercode":"99-12","member_number":"TY77493","first_name":"TYLER","last_name":"BADEAU","classification":"B","division":"OPEN","hit_factor":6.3441},{"match_name":"LdF USPSA Match July 14 2018","match_date":"2018-07-14","stage_classifiercode":"99-12","member_number":"FY77491","first_name":"TODD","last_name":"MAO","classification":"B","division":"OPEN","hit_factor":6.3433},{"match_name":"Fairfax PS USPSA  2018 September","match_date":"2018-09-18","stage_classifiercode":"99-12","member_number":"L4478","first_name":"ARTIE","last_name":"HAGLICH","classification":"B","division":"OPEN","hit_factor":6.3306},{"match_name":"Shasta Shooters August 2016","match_date":"2016-08-13","stage_classifiercode":"99-12","member_number":"L3873","first_name":"DON","last_name":"SANTORO","classification":"A","division":"OPEN","hit_factor":6.3172},{"match_name":"SFPC September USPSA Special Classifier match","match_date":"2016-09-04","stage_classifiercode":"99-12","member_number":"B50","first_name":"LUIGI","last_name":"LI","classification":"B","division":"OPEN","hit_factor":6.3158},{"match_name":"FPS USPSA April2017","match_date":"2017-04-02","stage_classifiercode":"99-12","member_number":"TY90280","first_name":"ANTHONY","last_name":"BRUNO","classification":"A","division":"OPEN","hit_factor":6.3142},{"match_name":"GCL December 12-2-17","match_date":"2017-12-02","stage_classifiercode":"99-12","member_number":"TY5113","first_name":"PAUL","last_name":"GOODMAN","classification":"B","division":"OPEN","hit_factor":6.3095},{"match_name":"Tangi January 2016 USPSA","match_date":"2016-01-23","stage_classifiercode":"99-12","member_number":"A86980","first_name":"BRYAN","last_name":"TULLOS","classification":"U","division":"OPEN","hit_factor":6.3095},{"match_name":"WNPL USPSA - Labour Day Weekend - Sept 2017","match_date":"2017-09-02","stage_classifiercode":"99-12","member_number":"A78467","first_name":"LYNDA","last_name":"TURNBULL","classification":"A","division":"OPEN","hit_factor":6.3014},{"match_name":"LCSA USPSA ALL CLASSIFIER ","match_date":"2018-06-30","stage_classifiercode":"99-12","member_number":"FY90924","first_name":"SOPHIA","last_name":"SMITH","classification":"C","division":"OPEN","hit_factor":6.3011},{"match_name":"RBGC 2018-7-28","match_date":"2018-07-28","stage_classifiercode":"99-12","member_number":"FY49008","first_name":"MOON","last_name":"JEONG","classification":"A","division":"OPEN","hit_factor":6.2975},{"match_name":"PCGC  June 2017","match_date":"2017-06-25","stage_classifiercode":"99-12","member_number":"FY54303","first_name":"DANA","last_name":"CAMPBELL","classification":"C","division":"OPEN","hit_factor":6.2963},{"match_name":"DCPA USPSA 9-11-2016","match_date":"2016-09-09","stage_classifiercode":"99-12","member_number":"TY11901","first_name":"DAVID","last_name":"LOPEZ","classification":"A","division":"OPEN","hit_factor":6.2937},{"match_name":"MPSA USPSA 111817","match_date":"2017-11-18","stage_classifiercode":"99-12","member_number":"L4105","first_name":"GREG","last_name":"HAMMER","classification":"C","division":"OPEN","hit_factor":6.2937},{"match_name":"TAC2 USPSA August 2017","match_date":"2017-08-05","stage_classifiercode":"99-12","member_number":"A85473","first_name":"NATHAN","last_name":"DIVELY","classification":"U","division":"OPEN","hit_factor":6.2885},{"match_name":"MCPSL Pistol 4-8-17","match_date":"2017-04-08","stage_classifiercode":"99-12","member_number":"A100931","first_name":"CALEB","last_name":"PATERSON","classification":"U","division":"OPEN","hit_factor":6.2851},{"match_name":"WPS USPSA Monthly Match September 2018","match_date":"2018-09-01","stage_classifiercode":"99-12","member_number":"A95671","first_name":"DUG","last_name":"DUTCHER","classification":"B","division":"OPEN","hit_factor":6.278},{"match_name":"LPRGC-Lower Providence USPSA May-2 2017","match_date":"2017-05-13","stage_classifiercode":"99-12","member_number":"L1476","first_name":"JAMES","last_name":"CHESTNUT","classification":"A","division":"OPEN","hit_factor":6.2775},{"match_name":"PCGC  June 2017","match_date":"2017-06-25","stage_classifiercode":"99-12","member_number":"A81837","first_name":"CODY","last_name":"BAKER","classification":"G","division":"OPEN","hit_factor":6.2774},{"match_name":"LIPSA - April 30th 2017 - USPSA Match Special Classifier","match_date":"2017-04-30","stage_classifiercode":"99-12","member_number":"L3924","first_name":"MANNY","last_name":"CAMEAN","classification":"C","division":"OPEN","hit_factor":6.2726},{"match_name":"Shongum Pistol November 2015","match_date":"2015-11-07","stage_classifiercode":"99-12","member_number":"L2421","first_name":"GEORGE","last_name":"JONES","classification":"A","division":"OPEN","hit_factor":6.2654},{"match_name":"GCL Wed 1-29-20","match_date":"2020-01-29","stage_classifiercode":"99-12","member_number":"A61412","first_name":"KEITH","last_name":"BOURGEOIS","classification":"A","division":"OPEN","hit_factor":6.2537},{"match_name":"Laser Ninja Dragon League USPSA August 2017","match_date":"2017-08-06","stage_classifiercode":"99-12","member_number":"A74908","first_name":"KAREN","last_name":"CHIASSON","classification":"B","division":"OPEN","hit_factor":6.2361},{"match_name":"SFPC September USPSA Special Classifier match","match_date":"2016-09-04","stage_classifiercode":"99-12","member_number":"TY36452","first_name":"SERGIO","last_name":"NUNEZ`","classification":"A","division":"OPEN","hit_factor":6.2331},{"match_name":"Laser Ninja Dragon League USPSA August 2017","match_date":"2017-08-06","stage_classifiercode":"99-12","member_number":"A75176","first_name":"TEAK-ALLEN","last_name":"BARRY","classification":"U","division":"OPEN","hit_factor":6.2315},{"match_name":"GCL Wed 1-29-20","match_date":"2020-01-29","stage_classifiercode":"99-12","member_number":"A103919","first_name":"JUSTIN","last_name":"HENDERSON","classification":"B","division":"OPEN","hit_factor":6.2025},{"match_name":"DRRC Dec2016","match_date":"2016-12-03","stage_classifiercode":"99-12","member_number":"A91567","first_name":"ADAM","last_name":"BELFUS","classification":"B","division":"OPEN","hit_factor":6.2024},{"match_name":"CVSC 06-25-2017","match_date":"2017-06-25","stage_classifiercode":"99-12","member_number":"TY87000","first_name":"GREG","last_name":"VAUGHN","classification":"A","division":"OPEN","hit_factor":6.1881},{"match_name":"Payson Practical Pistol Sept 03 2016","match_date":"2016-09-03","stage_classifiercode":"99-12","member_number":"A86225","first_name":"BRYSON","last_name":"KOROLSKY","classification":"U","division":"OPEN","hit_factor":6.1881},{"match_name":"DRRC Dec2016","match_date":"2016-12-03","stage_classifiercode":"99-12","member_number":"TY45892","first_name":"RICHARD  N.","last_name":"BROWNING","classification":"B","division":"OPEN","hit_factor":6.1834},{"match_name":"GCL Wed 1-29-20","match_date":"2020-01-29","stage_classifiercode":"99-12","member_number":"A80418","first_name":"ALVA","last_name":"ENGLISH","classification":"A","division":"OPEN","hit_factor":6.1824},{"match_name":"LCHG May USPSA","match_date":"2017-05-21","stage_classifiercode":"99-12","member_number":"TY89426","first_name":"LARRY","last_name":"SCUSA","classification":"C","division":"OPEN","hit_factor":6.1728},{"match_name":"Laser Ninja Dragon League USPSA August 2017","match_date":"2017-08-06","stage_classifiercode":"99-12","member_number":"A101336","first_name":"BOBBY","last_name":"IVESTER","classification":"B","division":"OPEN","hit_factor":6.1713},{"match_name":"MPPL USPSA Match 01072017","match_date":"2017-01-07","stage_classifiercode":"99-12","member_number":"FY66771","first_name":"ORLINO","last_name":"CARDENAS","classification":"C","division":"OPEN","hit_factor":6.1665},{"match_name":"Richmond Hot Shots February 7-2016 USPSA Match","match_date":"2016-02-07","stage_classifiercode":"99-12","member_number":"A25441","first_name":"WALTER","last_name":"HASHIMOTO","classification":"A","division":"OPEN","hit_factor":6.1518},{"match_name":"MCPSL Pistol 4-9-16","match_date":"2016-04-09","stage_classifiercode":"99-12","member_number":"L1810","first_name":"DAVID","last_name":"FERRAN","classification":"B","division":"OPEN","hit_factor":6.1446},{"match_name":"2020-03 Bone Creek USPSA","match_date":"2020-03-01","stage_classifiercode":"99-12","member_number":"TY73010","first_name":"KYLE","last_name":"SAYRE","classification":"B","division":"OPEN","hit_factor":6.1336},{"match_name":"Smoke & Hope USPSA Apr 22 2017","match_date":"2017-04-22","stage_classifiercode":"99-12","member_number":"F20463","first_name":"DENNIS","last_name":"BAUER","classification":"M","division":"OPEN","hit_factor":6.1308},{"match_name":"BRC_20170611","match_date":"2017-06-11","stage_classifiercode":"99-12","member_number":"\"\"","first_name":"ERIK","last_name":"ROST","classification":"U","division":"OPEN","hit_factor":6.129},{"match_name":"PCGC  June 2017","match_date":"2017-06-25","stage_classifiercode":"99-12","member_number":"TY61820","first_name":"ANDREW","last_name":"GLASSCOCK","classification":"B","division":"OPEN","hit_factor":6.1224},{"match_name":"GCL Wed 1-29-20","match_date":"2020-01-29","stage_classifiercode":"99-12","member_number":"FY39257","first_name":"PAUL","last_name":"ROBERTS","classification":"M","division":"OPEN","hit_factor":6.1164},{"match_name":"TPS USPSA - September 2016 - Talon Range","match_date":"2016-09-03","stage_classifiercode":"99-12","member_number":"Fy29424","first_name":"JIM","last_name":"FESSLER","classification":"B","division":"OPEN","hit_factor":6.113},{"match_name":"Chillicothe May-2017 USPSA Match","match_date":"2017-05-28","stage_classifiercode":"99-12","member_number":"L2281","first_name":"J","last_name":"GRIFFIN","classification":"A","division":"OPEN","hit_factor":6.1069},{"match_name":"Springfield Tactical Shooters 06-07-2018","match_date":"2018-06-07","stage_classifiercode":"99-12","member_number":"A30365","first_name":"ED","last_name":"TRIBBLE","classification":"A","division":"OPEN","hit_factor":6.106},{"match_name":"CCPL 04102016","match_date":"2016-04-10","stage_classifiercode":"99-12","member_number":"A72602","first_name":"STEVE","last_name":"MURRAY","classification":"B","division":"OPEN","hit_factor":6.092},{"match_name":"XMG USPSA   Saturday September  4th 2021","match_date":"2021-09-04","stage_classifiercode":"99-12","member_number":"A106102","first_name":"SEAN","last_name":"SUNGLAO","classification":"A","division":"OPEN","hit_factor":6.0773},{"match_name":"LCSA USPSA ALL CLASSIFIER ","match_date":"2018-06-30","stage_classifiercode":"99-12","member_number":"FY39111","first_name":"OLIE","last_name":"ERICKSEN","classification":"B","division":"OPEN","hit_factor":6.0748},{"match_name":"LIPSA - April 30th 2017 - USPSA Match Special Classifier","match_date":"2017-04-30","stage_classifiercode":"99-12","member_number":"L2939","first_name":"MATT","last_name":"MCMAHON","classification":"A","division":"OPEN","hit_factor":6.0724},{"match_name":"LdF USPSA Match July 14 2018","match_date":"2018-07-14","stage_classifiercode":"99-12","member_number":"TY99082","first_name":"LUKE","last_name":"WANG","classification":"B","division":"OPEN","hit_factor":6.0526},{"match_name":"AIPS  USPSA Monthly 12 November 2016","match_date":"2016-11-12","stage_classifiercode":"99-12","member_number":"TY4180","first_name":"JAY","last_name":"TAPPE","classification":"A","division":"OPEN","hit_factor":6.0268},{"match_name":"Danville Rifle and Pistol Club USPSA IL17 April 21 2018","match_date":"2018-04-21","stage_classifiercode":"99-12","member_number":"A69428","first_name":"CARTER","last_name":"JONES","classification":"C","division":"OPEN","hit_factor":6.0241},{"match_name":"Danville Rifle and Pistol Club USPSA IL17 April 21 2018","match_date":"2018-04-21","stage_classifiercode":"99-12","member_number":"L3651","first_name":"RYAN","last_name":"BRADLEY","classification":"U","division":"OPEN","hit_factor":6.0226},{"match_name":"LdF USPSA Match July 14 2018","match_date":"2018-07-14","stage_classifiercode":"99-12","member_number":"A81093","first_name":"LEX","last_name":"BELTRAN","classification":"U","division":"OPEN","hit_factor":6.0226},{"match_name":"Holmen USPSA Mar 26 2017","match_date":"2017-03-26","stage_classifiercode":"99-12","member_number":"FY53791","first_name":"MIKE","last_name":"OLSON","classification":"C","division":"OPEN","hit_factor":6.0213},{"match_name":"OFGC USPSA Match Feb 19th 2017","match_date":"2017-02-19","stage_classifiercode":"99-12","member_number":"A92527","first_name":"JAKE","last_name":"NOBLE","classification":"U","division":"OPEN","hit_factor":6.0204},{"match_name":"MVPSA USPSA July 17th","match_date":"2021-07-17","stage_classifiercode":"99-12","member_number":"A102491","first_name":"CARL","last_name":"JOHNSTON","classification":"B","division":"OPEN","hit_factor":6.0197},{"match_name":"AIPS  USPSA Monthly 12 November 2016","match_date":"2016-11-12","stage_classifiercode":"99-12","member_number":"PEN","first_name":"JASON","last_name":"VENNARD","classification":"Unclassified","division":"OPEN","hit_factor":6.0116},{"match_name":"LdF 4th Saturday Match","match_date":"2016-01-23","stage_classifiercode":"99-12","member_number":"TY63365","first_name":"COREY","last_name":"MAGERS","classification":"B","division":"OPEN","hit_factor":6.0091},{"match_name":"SCCPSA USPSA Mar 17","match_date":"2018-03-17","stage_classifiercode":"99-12","member_number":"TY93356","first_name":"DOMINICK","last_name":"GATTUSO","classification":"C","division":"OPEN","hit_factor":5.9976},{"match_name":"BSTRC Dec 20 2017","match_date":"2017-12-20","stage_classifiercode":"99-12","member_number":"A99120","first_name":"CHRIS","last_name":"GEORGE","classification":"U","division":"OPEN","hit_factor":5.9937},{"match_name":"Springfield Tactical Shooters 06-07-2018","match_date":"2018-06-07","stage_classifiercode":"99-12","member_number":"A99127","first_name":"STEVE","last_name":"FRAZIER","classification":"C","division":"OPEN","hit_factor":5.9908},{"match_name":"Danville Rifle and Pistol Club USPSA IL17 April 21 2018","match_date":"2018-04-21","stage_classifiercode":"99-12","member_number":"Ty72670","first_name":"DALE","last_name":"HARDING","classification":"B","division":"OPEN","hit_factor":5.9776},{"match_name":"GCL Wed 1-29-20","match_date":"2020-01-29","stage_classifiercode":"99-12","member_number":"A79401","first_name":"JAY","last_name":"TOVEY","classification":"A","division":"OPEN","hit_factor":5.969},{"match_name":"OFGC USPSA Match 10-21-18","match_date":"2018-10-21","stage_classifiercode":"99-12","member_number":"TY34745","first_name":"KEITH","last_name":"HAMMOND","classification":"B","division":"OPEN","hit_factor":5.9669},{"match_name":"LdF USPSA Match July 14 2018","match_date":"2018-07-14","stage_classifiercode":"99-12","member_number":"TY67188","first_name":"IVAN","last_name":"GARCIA","classification":"B","division":"OPEN","hit_factor":5.9588},{"match_name":"MSSA Uspsa Match","match_date":"2017-04-08","stage_classifiercode":"99-12","member_number":"FY75422","first_name":"BRANTLEY","last_name":"GAITHER","classification":"B","division":"OPEN","hit_factor":5.9524},{"match_name":"HPS September Club Fun Shoot","match_date":"2018-09-01","stage_classifiercode":"99-12","member_number":"TY75056","first_name":"ELMER","last_name":"BANEZ","classification":"A","division":"OPEN","hit_factor":5.9524},{"match_name":"2020-03 Bone Creek USPSA","match_date":"2020-03-01","stage_classifiercode":"99-12","member_number":"A126477","first_name":"ERIC","last_name":"GRAY","classification":"U","division":"OPEN","hit_factor":5.9341},{"match_name":"LdF USPSA Match July 14 2018","match_date":"2018-07-14","stage_classifiercode":"99-12","member_number":"TY94265","first_name":"STEVE","last_name":"BENCE2","classification":"C","division":"OPEN","hit_factor":5.9341},{"match_name":"ENPS May 2018 USPSA Match","match_date":"2018-05-06","stage_classifiercode":"99-12","member_number":"TY63885","first_name":"TIMOTHY","last_name":"PROCTOR","classification":"U","division":"OPEN","hit_factor":5.9219},{"match_name":"OFGC USPSA Match 10-21-18","match_date":"2018-10-21","stage_classifiercode":"99-12","member_number":"A107288","first_name":"COREY","last_name":"CHURCHILL","classification":"C","division":"OPEN","hit_factor":5.9197},{"match_name":"COPS Feb 2017 USPSA Match","match_date":"2017-02-05","stage_classifiercode":"99-12","member_number":"a79715","first_name":"MIKE","last_name":"NELSON","classification":"B","division":"OPEN","hit_factor":5.914},{"match_name":"GAS October 6th Match","match_date":"2018-10-06","stage_classifiercode":"99-12","member_number":"\"\"","first_name":"ASHLEY","last_name":"BELL","classification":"C","division":"OPEN","hit_factor":5.9123},{"match_name":"OFGC USPSA Match Feb 19th 2017","match_date":"2017-02-19","stage_classifiercode":"99-12","member_number":"A74027","first_name":"JUNIOR","last_name":"SIMS","classification":"U","division":"OPEN","hit_factor":5.9091},{"match_name":"OFGC Practical Pistol Match Jan 17 2016","match_date":"2016-01-17","stage_classifiercode":"99-12","member_number":"TY50326","first_name":"ROB","last_name":"ELSTON","classification":"B","division":"OPEN","hit_factor":5.902},{"match_name":"Nampa USPSA February 1st","match_date":"2020-02-01","stage_classifiercode":"99-12","member_number":"Ty99310","first_name":"JIM","last_name":"HICKS","classification":"B","division":"OPEN","hit_factor":5.8945},{"match_name":"Brothers N Arms August 2018 USPSA Match","match_date":"2018-08-18","stage_classifiercode":"99-12","member_number":"TY98602","first_name":"NEIL","last_name":"DRENNAN","classification":"B","division":"OPEN","hit_factor":5.8891},{"match_name":"Richmond Hot Shots USPSA Classifier Match Sat April 8-2017","match_date":"2017-04-08","stage_classifiercode":"99-12","member_number":"A84617","first_name":"MIKE","last_name":"FINEZA","classification":"B","division":"OPEN","hit_factor":5.8763},{"match_name":"PCGC  June 2017","match_date":"2017-06-25","stage_classifiercode":"99-12","member_number":"\"\"","first_name":"DAVID","last_name":"BOWEN","classification":"U","division":"OPEN","hit_factor":5.8757},{"match_name":"Hosemasters  3rd Sunday Feburary 2017","match_date":"2017-02-12","stage_classifiercode":"99-12","member_number":"TY92648","first_name":"E.T.","last_name":"SAFFON","classification":"A","division":"OPEN","hit_factor":5.8683},{"match_name":"Richmond Hot Shots February 7-2016 USPSA Match","match_date":"2016-02-07","stage_classifiercode":"99-12","member_number":"A84617","first_name":"MIKE","last_name":"FINEZA","classification":"U","division":"OPEN","hit_factor":5.8628},{"match_name":"CRGC USPSA Special Classifier 08-15-21","match_date":"2021-08-15","stage_classifiercode":"99-12","member_number":"TY110530","first_name":"BRIAN","last_name":"WHITNEY","classification":"","division":"OPEN","hit_factor":5.8621},{"match_name":"LdF 4th Saturday Match","match_date":"2016-01-23","stage_classifiercode":"99-12","member_number":"A74054","first_name":"EMIL","last_name":"DABU","classification":"D","division":"OPEN","hit_factor":5.8427},{"match_name":"GAS October 6th Match","match_date":"2018-10-06","stage_classifiercode":"99-12","member_number":"A113372","first_name":"LOGAN","last_name":"MUGGLI","classification":"U","division":"OPEN","hit_factor":5.8296},{"match_name":"BHPSC Monthly Match - Feb 2020","match_date":"2020-02-29","stage_classifiercode":"99-12","member_number":"TY78821","first_name":"STEVE","last_name":"GIRARD","classification":"C","division":"OPEN","hit_factor":5.8242},{"match_name":"FPS USPSA April2017","match_date":"2017-04-02","stage_classifiercode":"99-12","member_number":"L3851","first_name":"JEFF","last_name":"PAULSEN","classification":"B","division":"OPEN","hit_factor":5.8224},{"match_name":"OFGC USPSA Match Feb 19th 2017","match_date":"2017-02-19","stage_classifiercode":"99-12","member_number":"A73637","first_name":"JAMES","last_name":"JONES","classification":"U","division":"OPEN","hit_factor":5.8166},{"match_name":"GMPS 5/7/17","match_date":"2017-05-06","stage_classifiercode":"99-12","member_number":"TY61164","first_name":"ROD","last_name":"FISHER","classification":"C","division":"OPEN","hit_factor":5.8114},{"match_name":"Springfield Tactical Shooters 06-07-2018","match_date":"2018-06-07","stage_classifiercode":"99-12","member_number":"A99127","first_name":"STEVE","last_name":"FRAZIER","classification":"C","division":"OPEN","hit_factor":5.8091},{"match_name":"HRRB 3-5-16","match_date":"2016-03-05","stage_classifiercode":"99-12","member_number":"TY68195","first_name":"JESSIE","last_name":"VISCONDE","classification":"B","division":"OPEN","hit_factor":5.8025},{"match_name":"Brothers N Arms February 2018 USPSA Match","match_date":"2018-02-17","stage_classifiercode":"99-12","member_number":"A98602","first_name":"NEIL","last_name":"DRENNAN","classification":"B","division":"OPEN","hit_factor":5.802},{"match_name":"SCAPSA MN05 Summer League 1","match_date":"2017-06-05","stage_classifiercode":"99-12","member_number":"FY53872","first_name":"JON","last_name":"MCCARTY","classification":"B","division":"OPEN","hit_factor":5.8002},{"match_name":"OFGC USPSA Match Feb 19th 2017","match_date":"2017-02-19","stage_classifiercode":"99-12","member_number":"TY72436","first_name":"ROBERT","last_name":"TERBIETEN","classification":"B","division":"OPEN","hit_factor":5.8002},{"match_name":"Pelham USPSA 2016-09-18","match_date":"2016-09-18","stage_classifiercode":"99-12","member_number":"L1876","first_name":"SIMEON","last_name":"GOUROUSIS","classification":"B","division":"OPEN","hit_factor":5.7842},{"match_name":"Richmond Hot Shots February 7-2016 USPSA Match","match_date":"2016-02-07","stage_classifiercode":"99-12","member_number":"ty81079","first_name":"MIKE","last_name":"SAWYER","classification":"B","division":"OPEN","hit_factor":5.7831},{"match_name":"Brothers N Arms August 2018 USPSA Match","match_date":"2018-08-18","stage_classifiercode":"99-12","member_number":"TY76693","first_name":"LEE","last_name":"FRAISER","classification":"B","division":"OPEN","hit_factor":5.7754},{"match_name":"Green Valley February 2017","match_date":"2017-02-25","stage_classifiercode":"99-12","member_number":"FY91941","first_name":"JEFF","last_name":"STEIN","classification":"U","division":"OPEN","hit_factor":5.7732},{"match_name":"PCGC  June 2017","match_date":"2017-06-25","stage_classifiercode":"99-12","member_number":"FY54303","first_name":"DANA","last_name":"CAMPBELL","classification":"C","division":"OPEN","hit_factor":5.7692},{"match_name":"OK15 USPSA AT USSA","match_date":"2016-07-10","stage_classifiercode":"99-12","member_number":"FY69155","first_name":"WES","last_name":"BOLES","classification":"B","division":"OPEN","hit_factor":5.7692},{"match_name":"SCAPSA MN05 Summer League 1","match_date":"2017-06-05","stage_classifiercode":"99-12","member_number":"TY51432","first_name":"FRANK","last_name":"SKOG","classification":"C","division":"OPEN","hit_factor":5.7654},{"match_name":"MCPSL Pistol 4-8-17","match_date":"2017-04-08","stage_classifiercode":"99-12","member_number":"FY72619","first_name":"JIM","last_name":"THOMAS","classification":"C","division":"OPEN","hit_factor":5.7631},{"match_name":"LdF USPSA Match July 14 2018","match_date":"2018-07-14","stage_classifiercode":"99-12","member_number":"TY43291","first_name":"WILLIAM","last_name":"JEHL","classification":"B","division":"OPEN","hit_factor":5.7609},{"match_name":"Fairfax PS USPSA  2018 September","match_date":"2018-09-18","stage_classifiercode":"99-12","member_number":"ty55989","first_name":"MIKE","last_name":"WHITMAN","classification":"B","division":"OPEN","hit_factor":5.7518},{"match_name":"COPS Feb 2017 USPSA Match","match_date":"2017-02-05","stage_classifiercode":"99-12","member_number":"A87386","first_name":"MATT","last_name":"OPFER","classification":"C","division":"OPEN","hit_factor":5.7471},{"match_name":"GCL December 12-2-17","match_date":"2017-12-02","stage_classifiercode":"99-12","member_number":"A62449","first_name":"JOHN M","last_name":"KOZIOL","classification":"B","division":"OPEN","hit_factor":5.7416},{"match_name":"Sept 3rd Uspsa   Pickaway","match_date":"2016-09-03","stage_classifiercode":"99-12","member_number":"TY79620","first_name":"DAVID","last_name":"BLAIR","classification":"C","division":"OPEN","hit_factor":5.7402},{"match_name":"OFGC Practical Pistol Match Jan 17 2016","match_date":"2016-01-17","stage_classifiercode":"99-12","member_number":"A87613","first_name":"MIKE","last_name":"WILLIAMS","classification":"C","division":"OPEN","hit_factor":5.7386},{"match_name":"PCGC  June 2017","match_date":"2017-06-25","stage_classifiercode":"99-12","member_number":"\"\"","first_name":"DAVID","last_name":"BOWEN","classification":"U","division":"OPEN","hit_factor":5.7297},{"match_name":"SSP Super Classifier 1-30-16","match_date":"2016-01-30","stage_classifiercode":"99-12","member_number":"A70574","first_name":"MARK","last_name":"ZIEBART","classification":"A","division":"OPEN","hit_factor":5.7225},{"match_name":"Palmetto Gun Club - February 2018 USPSA","match_date":"2018-02-03","stage_classifiercode":"99-12","member_number":"A33652","first_name":"BENNY","last_name":"YUMOL","classification":"C","division":"OPEN","hit_factor":5.7203},{"match_name":"MCPSL Pistol 4-8-17","match_date":"2017-04-08","stage_classifiercode":"99-12","member_number":"TY65313","first_name":"DON","last_name":"SHIPMAN","classification":"U","division":"OPEN","hit_factor":5.7172},{"match_name":"BSTRC Dec 20 2017","match_date":"2017-12-20","stage_classifiercode":"99-12","member_number":"A95479","first_name":"MICHAEL","last_name":"PEASE","classification":"C","division":"OPEN","hit_factor":5.7172},{"match_name":"EASTER EGG HUNT AREA 59  ALL CLASSFIER MATCH","match_date":"2017-04-15","stage_classifiercode":"99-12","member_number":"a-88273","first_name":"ANDREW","last_name":"BUTLER","classification":"X","division":"OPEN","hit_factor":5.7022},{"match_name":"Hosemasters  3rd Sunday Feburary 2017","match_date":"2017-02-12","stage_classifiercode":"99-12","member_number":"TY18312","first_name":"GEORGE","last_name":"WAGNER","classification":"B","division":"OPEN","hit_factor":5.6983},{"match_name":"MCPSL Pistol 4-9-16","match_date":"2016-04-09","stage_classifiercode":"99-12","member_number":"A85988","first_name":"TYLER","last_name":"HILL","classification":"D","division":"OPEN","hit_factor":5.6928},{"match_name":"Maine Practical Shooters May 2018","match_date":"2018-05-12","stage_classifiercode":"99-12","member_number":"A98632","first_name":"ZAC","last_name":"GREENIER","classification":"U","division":"OPEN","hit_factor":5.6801},{"match_name":"Richmond Hot Shots February 7-2016 USPSA Match","match_date":"2016-02-07","stage_classifiercode":"99-12","member_number":"A51896","first_name":"LORI","last_name":"BOFMAN","classification":"B","division":"OPEN","hit_factor":5.6738},{"match_name":"SPSA USPSA March 4th Sat match","match_date":"2017-03-25","stage_classifiercode":"99-12","member_number":"A86799","first_name":"BILL","last_name":"ROACH","classification":"C","division":"OPEN","hit_factor":5.6676},{"match_name":"Richmond Hot Shots February 7-2016 USPSA Match","match_date":"2016-02-07","stage_classifiercode":"99-12","member_number":"A86599","first_name":"SEAN","last_name":"AGUAS","classification":"U","division":"OPEN","hit_factor":5.6383},{"match_name":"Woodland Heights Practical Shooters Tactical Rifle Match","match_date":"2021-09-19","stage_classifiercode":"99-12","member_number":"Life 1936","first_name":"AL","last_name":"NIELSEN","classification":"B","division":"OPEN","hit_factor":5.638},{"match_name":"SSS USPSA February 2020","match_date":"2020-02-16","stage_classifiercode":"99-12","member_number":"TY98542","first_name":"BARRON","last_name":"SMITH","classification":"C (C Class)","division":"OPEN","hit_factor":5.6338},{"match_name":"Hosemasters  3rd Sunday Feburary 2017","match_date":"2017-02-12","stage_classifiercode":"99-12","member_number":"TY16908","first_name":"SPENCE","last_name":"CUTRELL","classification":"A","division":"OPEN","hit_factor":5.6257},{"match_name":"Emmett September Match","match_date":"2016-09-24","stage_classifiercode":"99-12","member_number":"a68354","first_name":"DAVID","last_name":"WALL","classification":"D","division":"OPEN","hit_factor":5.6225},{"match_name":"BGS NORTH  Week 9","match_date":"2016-03-13","stage_classifiercode":"99-12","member_number":"TY73645","first_name":"JOE","last_name":"BENSON","classification":"C","division":"OPEN","hit_factor":5.618},{"match_name":"South Texas Tactical USPSA","match_date":"2017-07-08","stage_classifiercode":"99-12","member_number":"A86283","first_name":"MEL","last_name":"RODERO","classification":"G","division":"OPEN","hit_factor":5.6159},{"match_name":"OFGC USPSA Match Feb 19th 2017","match_date":"2017-02-19","stage_classifiercode":"99-12","member_number":"TY50326","first_name":"ROB","last_name":"ELSTON","classification":"B","division":"OPEN","hit_factor":5.6095},{"match_name":"RBGC 2018-7-28","match_date":"2018-07-28","stage_classifiercode":"99-12","member_number":"A27940","first_name":"RICK","last_name":"DOBBS","classification":"A","division":"OPEN","hit_factor":5.5944},{"match_name":"LIPSA - April 30th 2017 - USPSA Match Special Classifier","match_date":"2017-04-30","stage_classifiercode":"99-12","member_number":"TY90280","first_name":"ANTHONY","last_name":"BRUNO","classification":"A","division":"OPEN","hit_factor":5.5944},{"match_name":"Medford USPSA April 2018 Match","match_date":"2018-04-15","stage_classifiercode":"99-12","member_number":"A7116","first_name":"ED","last_name":"BOENING","classification":"M","division":"OPEN","hit_factor":5.5728},{"match_name":"LCSA USPSA ALL CLASSIFIER ","match_date":"2018-06-30","stage_classifiercode":"99-12","member_number":"FY90924","first_name":"SOPHIA","last_name":"SMITH","classification":"C","division":"OPEN","hit_factor":5.5666},{"match_name":"CCPL 04102016","match_date":"2016-04-10","stage_classifiercode":"99-12","member_number":"A34139","first_name":"LEE","last_name":"ROWE","classification":"A","division":"OPEN","hit_factor":5.5617},{"match_name":"NNRPA USPSA May 2018","match_date":"2018-05-26","stage_classifiercode":"99-12","member_number":"TY74321","first_name":"STEPHEN","last_name":"PRICE","classification":"B","division":"OPEN","hit_factor":5.5556},{"match_name":"GMPS 5/7/17","match_date":"2017-05-06","stage_classifiercode":"99-12","member_number":"A94649","first_name":"GINA","last_name":"NILSON","classification":"X","division":"OPEN","hit_factor":5.5451},{"match_name":"Sept 3rd Uspsa   Pickaway","match_date":"2016-09-03","stage_classifiercode":"99-12","member_number":"A50721","first_name":"NIK","last_name":"REPASKY","classification":"B","division":"OPEN","hit_factor":5.5396},{"match_name":"CCPL 04102016","match_date":"2016-04-10","stage_classifiercode":"99-12","member_number":"A83627","first_name":"HAL","last_name":"ROBERTS","classification":"D","division":"OPEN","hit_factor":5.5344},{"match_name":"Shoot GTR USPSA 11/6","match_date":"2016-11-06","stage_classifiercode":"99-12","member_number":"FY29424","first_name":"JIM","last_name":"FESSLER","classification":"B","division":"OPEN","hit_factor":5.5324},{"match_name":"BRC_20170611","match_date":"2017-06-11","stage_classifiercode":"99-12","member_number":"A80049","first_name":"RONALD","last_name":"NG","classification":"C","division":"OPEN","hit_factor":5.5276},{"match_name":"HPS September Club Fun Shoot","match_date":"2018-09-01","stage_classifiercode":"99-12","member_number":"FY85757","first_name":"EDGAR","last_name":"VICENTE","classification":"C","division":"OPEN","hit_factor":5.5276},{"match_name":"HRRB 5-20-2017","match_date":"2017-05-20","stage_classifiercode":"99-12","member_number":"A42988","first_name":"\"HERMAN \"\"BOBOT \"\"\"","last_name":"DUQUEZ","classification":"C","division":"OPEN","hit_factor":5.5081},{"match_name":"LIPSA - April 30th 2017 - USPSA Match Special Classifier","match_date":"2017-04-30","stage_classifiercode":"99-12","member_number":"TY80361","first_name":"PHIL","last_name":"PIAZZA","classification":"C","division":"OPEN","hit_factor":5.4732},{"match_name":"BGS NORTH  Week 9","match_date":"2016-03-13","stage_classifiercode":"99-12","member_number":"A90179","first_name":"MICHAEL","last_name":"HALL","classification":"U","division":"OPEN","hit_factor":5.4705},{"match_name":"LCSA USPSA ALL CLASSIFIER ","match_date":"2018-06-30","stage_classifiercode":"99-12","member_number":"TY84357","first_name":"RAY","last_name":"DONCH","classification":"C","division":"OPEN","hit_factor":5.4705},{"match_name":"Laser Ninja Dragon League USPSA August 2017","match_date":"2017-08-06","stage_classifiercode":"99-12","member_number":"TY 73898","first_name":"GARY","last_name":"VAUGHT","classification":"B","division":"OPEN","hit_factor":5.4698},{"match_name":"SCCPSA USPSA Mar 17","match_date":"2018-03-17","stage_classifiercode":"99-12","member_number":"A96961","first_name":"STEPHEN","last_name":"THOMER","classification":"C","division":"OPEN","hit_factor":5.4696},{"match_name":"OFGC USPSA Match Feb 19th 2017","match_date":"2017-02-19","stage_classifiercode":"99-12","member_number":"TY92057","first_name":"CAMERON","last_name":"DASSO","classification":"C","division":"OPEN","hit_factor":5.4622},{"match_name":"LPRGC-Lower Providence USPSA May-2 2017","match_date":"2017-05-13","stage_classifiercode":"99-12","member_number":"TY82780","first_name":"JEANNE","last_name":"RUANE","classification":"C","division":"OPEN","hit_factor":5.4583},{"match_name":"Richmond Hot Shots February 7-2016 USPSA Match","match_date":"2016-02-07","stage_classifiercode":"99-12","member_number":"A88866","first_name":"CHARLIE","last_name":"MENDOZA","classification":"D","division":"OPEN","hit_factor":5.4565},{"match_name":"Minnetonka Game And Fish May 23","match_date":"2018-05-23","stage_classifiercode":"99-12","member_number":"A107988","first_name":"TROY","last_name":"HOLIEN","classification":"U","division":"OPEN","hit_factor":5.4507},{"match_name":"Hosemasters  3rd Sunday Feburary 2017","match_date":"2017-02-12","stage_classifiercode":"99-12","member_number":"TY83994","first_name":"KIM","last_name":"PARSON","classification":"C","division":"OPEN","hit_factor":5.4502},{"match_name":"MCPSL Pistol 4-8-17","match_date":"2017-04-08","stage_classifiercode":"99-12","member_number":"A61078","first_name":"WES","last_name":"CALL","classification":"A","division":"OPEN","hit_factor":5.4334},{"match_name":"HRRB 3-5-16","match_date":"2016-03-05","stage_classifiercode":"99-12","member_number":"\"\"","first_name":"FRED","last_name":"TAMAYO","classification":"D","division":"OPEN","hit_factor":5.4324},{"match_name":"LCSA USPSA ALL CLASSIFIER ","match_date":"2018-06-30","stage_classifiercode":"99-12","member_number":"TY105000","first_name":"KEN","last_name":"STYS","classification":"U","division":"OPEN","hit_factor":5.4307},{"match_name":"GAS October 6th Match","match_date":"2018-10-06","stage_classifiercode":"99-12","member_number":"A104679","first_name":"LUKE","last_name":"ARCHER","classification":"C","division":"OPEN","hit_factor":5.4192},{"match_name":"GAS October 6th Match","match_date":"2018-10-06","stage_classifiercode":"99-12","member_number":"\"\"","first_name":"TOMMY","last_name":"MCCULLOUGH","classification":"C","division":"OPEN","hit_factor":5.4108},{"match_name":"Shongum April 2017 USPSA Match","match_date":"2017-04-01","stage_classifiercode":"99-12","member_number":"A68001","first_name":"GUS","last_name":"VANETTEN","classification":"B","division":"OPEN","hit_factor":5.4094},{"match_name":"FBURG April 2017 Level I USPSA ","match_date":"2017-04-01","stage_classifiercode":"99-12","member_number":"A71480","first_name":"DAVID","last_name":"SCORDY","classification":"B","division":"OPEN","hit_factor":5.3927},{"match_name":"USPSA MO21 Special Classifier 2Alpha SBRC February 27 2021","match_date":"2021-02-27","stage_classifiercode":"99-12","member_number":"A102464","first_name":"COLE","last_name":"HUFFMAN","classification":"B","division":"OPEN","hit_factor":5.3856},{"match_name":"SCCPSA USPSA Mar 17","match_date":"2018-03-17","stage_classifiercode":"99-12","member_number":"A85259","first_name":"JOJO","last_name":"SANTOS","classification":"C","division":"OPEN","hit_factor":5.3816},{"match_name":"BHPSC Monthly Match - Feb 2020","match_date":"2020-02-29","stage_classifiercode":"99-12","member_number":"A104630","first_name":"PATRICK","last_name":"MITCHELL","classification":"C","division":"OPEN","hit_factor":5.3731},{"match_name":"RBGC 2018-7-28","match_date":"2018-07-28","stage_classifiercode":"99-12","member_number":"A94603","first_name":"RONALDO","last_name":"BORGES","classification":"B","division":"OPEN","hit_factor":5.3654},{"match_name":"Brothers N Arms February 2018 USPSA Match","match_date":"2018-02-17","stage_classifiercode":"99-12","member_number":"A106657","first_name":"ADAM","last_name":"MYERS","classification":"U","division":"OPEN","hit_factor":5.3648},{"match_name":"BGS NORTH  Week 9","match_date":"2016-03-13","stage_classifiercode":"99-12","member_number":"ty77067","first_name":"KEN","last_name":"SPOONER","classification":"U","division":"OPEN","hit_factor":5.3553},{"match_name":"HRRB 3-5-16","match_date":"2016-03-05","stage_classifiercode":"99-12","member_number":"TY38050","first_name":"PAT","last_name":"ACACIO","classification":"B","division":"OPEN","hit_factor":5.3493},{"match_name":"Springfield Tactical Shooters 06-07-2018","match_date":"2018-06-07","stage_classifiercode":"99-12","member_number":"A95946","first_name":"PAUL","last_name":"EMERY","classification":"C","division":"OPEN","hit_factor":5.3452},{"match_name":"BRC_20170611","match_date":"2017-06-11","stage_classifiercode":"99-12","member_number":"A56905","first_name":"BLAIR","last_name":"HANSEN","classification":"B","division":"OPEN","hit_factor":5.3421},{"match_name":"LCSA USPSA ALL CLASSIFIER ","match_date":"2018-06-30","stage_classifiercode":"99-12","member_number":"A80108","first_name":"KEN","last_name":"DITTIG","classification":"C","division":"OPEN","hit_factor":5.3403},{"match_name":"LPRGC-Lower Providence USPSA May-2 2017","match_date":"2017-05-13","stage_classifiercode":"99-12","member_number":"FY57927","first_name":"PETER","last_name":"PAN","classification":"U","division":"OPEN","hit_factor":5.3321},{"match_name":"Green Valley USPSA May Classifier","match_date":"2018-05-09","stage_classifiercode":"99-12","member_number":"A110363","first_name":"JERROD","last_name":"BRYAN","classification":"U","division":"OPEN","hit_factor":5.3248},{"match_name":"FBURG April 2017 Level I USPSA ","match_date":"2017-04-01","stage_classifiercode":"99-12","member_number":"TY41485","first_name":"DJ","last_name":"VIAR","classification":"B","division":"OPEN","hit_factor":5.3224},{"match_name":"Springfield Tactical Shooters 06-07-2018","match_date":"2018-06-07","stage_classifiercode":"99-12","member_number":"L1467","first_name":"CHARLES","last_name":"MORSE","classification":"B","division":"OPEN","hit_factor":5.3191},{"match_name":"HPS September Club Fun Shoot","match_date":"2018-09-01","stage_classifiercode":"99-12","member_number":"L2624","first_name":"MARIO","last_name":"LAYUGAN","classification":"A","division":"OPEN","hit_factor":5.3121},{"match_name":"11 March Classifier Match","match_date":"2018-03-10","stage_classifiercode":"99-12","member_number":"A105557","first_name":"ELLIOTT","last_name":"WATKINS","classification":"U","division":"OPEN","hit_factor":5.3079},{"match_name":"LIPSA - April 30th 2017 - USPSA Match Special Classifier","match_date":"2017-04-30","stage_classifiercode":"99-12","member_number":"TY33497","first_name":"CLAY","last_name":"ERKMANN","classification":"B","division":"OPEN","hit_factor":5.2993},{"match_name":"Collin County USPSA Nov. 27 2016","match_date":"2016-11-25","stage_classifiercode":"99-12","member_number":"PEN","first_name":"JAMES","last_name":"LAYA","classification":"U","division":"OPEN","hit_factor":5.2974},{"match_name":"Richmond Hot Shots February 7-2016 USPSA Match","match_date":"2016-02-07","stage_classifiercode":"99-12","member_number":"A85939","first_name":"NILO","last_name":"NUNEZ II","classification":"M","division":"OPEN","hit_factor":5.2867},{"match_name":"Atlanta Practical Shooters March 2016 USPSA - Classifier Match","match_date":"2016-03-06","stage_classifiercode":"99-12","member_number":"A85800","first_name":"ERIC","last_name":"GAGNON","classification":"U","division":"OPEN","hit_factor":5.2789},{"match_name":"GRPC USPSA MARCH MAD HATTER","match_date":"2018-03-02","stage_classifiercode":"99-12","member_number":"TY98162","first_name":"DUANE","last_name":"MENDOZA","classification":"C","division":"OPEN","hit_factor":5.2684},{"match_name":"Palmetto Gun Club - February 2018 USPSA","match_date":"2018-02-03","stage_classifiercode":"99-12","member_number":"A100438","first_name":"RENE","last_name":"QUINDO","classification":"U","division":"OPEN","hit_factor":5.2632},{"match_name":"MPPL USPSA Match 01072017","match_date":"2017-01-07","stage_classifiercode":"99-12","member_number":"A77755","first_name":"PASCUAL(LITO)","last_name":"SERIO","classification":"C","division":"OPEN","hit_factor":5.2632},{"match_name":"Springfield Tactical Shooters 06-07-2018","match_date":"2018-06-07","stage_classifiercode":"99-12","member_number":"L2281","first_name":"J","last_name":"GRIFFIN","classification":"A","division":"OPEN","hit_factor":5.2632},{"match_name":"MSSA Uspsa Match","match_date":"2017-04-08","stage_classifiercode":"99-12","member_number":"L2056","first_name":"RICK","last_name":"CRAIG","classification":"U","division":"OPEN","hit_factor":5.2489},{"match_name":"YMM IPSC02 2016_09_11","match_date":"2016-09-11","stage_classifiercode":"99-12","member_number":"A87721","first_name":"JAMES","last_name":"TAWZER","classification":"C","division":"OPEN","hit_factor":5.2427},{"match_name":"LCSA USPSA ALL CLASSIFIER ","match_date":"2018-06-30","stage_classifiercode":"99-12","member_number":"A110041","first_name":"BILL","last_name":"IGO","classification":"U","division":"OPEN","hit_factor":5.2376},{"match_name":"FBPPC DECEMBER 2016 SPECIAL CLASSIFIER MATCH","match_date":"2016-12-10","stage_classifiercode":"99-12","member_number":"TY61480","first_name":"STEVE","last_name":"SELIGMAN","classification":"B","division":"OPEN","hit_factor":5.228},{"match_name":"GCL December 12-2-17","match_date":"2017-12-02","stage_classifiercode":"99-12","member_number":"A75013","first_name":"BETH","last_name":"HYNES","classification":"C","division":"OPEN","hit_factor":5.2147},{"match_name":"PCGC  June 2017","match_date":"2017-06-25","stage_classifiercode":"99-12","member_number":"A81586","first_name":"LARRY","last_name":"BAKER","classification":"C","division":"OPEN","hit_factor":5.2124},{"match_name":"Danville Rifle and Pistol Club USPSA IL17 April 21 2018","match_date":"2018-04-21","stage_classifiercode":"99-12","member_number":"Ty69724","first_name":"CRAIG","last_name":"HANSEN","classification":"B","division":"OPEN","hit_factor":5.2106},{"match_name":"MPPL USPSA Match 01072017","match_date":"2017-01-07","stage_classifiercode":"99-12","member_number":"A88006","first_name":"BOBBY","last_name":"REGALARIO","classification":"D","division":"OPEN","hit_factor":5.2094},{"match_name":"LIPSA - November 4th 2018 - USPSA Classifier Match","match_date":"2018-11-04","stage_classifiercode":"99-12","member_number":"TY33497","first_name":"CLAYTON","last_name":"ERKMANN","classification":"B","division":"OPEN","hit_factor":5.1971},{"match_name":"COPS Feb 2017 USPSA Match","match_date":"2017-02-05","stage_classifiercode":"99-12","member_number":"ty57362","first_name":"OWEN","last_name":"RAYSOR","classification":"B","division":"OPEN","hit_factor":5.1867},{"match_name":"OK15 USPSA AT USSA","match_date":"2016-07-10","stage_classifiercode":"99-12","member_number":"A57933","first_name":"LANCE","last_name":"JENSEN","classification":"U","division":"OPEN","hit_factor":5.1788},{"match_name":"17s PSC - Feb 2017 - USPSA match","match_date":"2017-02-04","stage_classifiercode":"99-12","member_number":"L4002","first_name":"STUART","last_name":"MURRAY","classification":"U","division":"OPEN","hit_factor":5.176},{"match_name":"Triforce Practical Shooters at BigWoodsGoods","match_date":"2016-09-22","stage_classifiercode":"99-12","member_number":"A85797","first_name":"GARY","last_name":"WILLIAMS","classification":"C","division":"OPEN","hit_factor":5.1706},{"match_name":"SSFGA & Master Blasters USPSA Classifier","match_date":"2018-11-17","stage_classifiercode":"99-12","member_number":"A4665","first_name":"LIGHTNIN LARRY","last_name":"HUSSEY","classification":"A","division":"OPEN","hit_factor":5.1677},{"match_name":"DGC USPSA 07-08-18","match_date":"2018-07-08","stage_classifiercode":"99-12","member_number":"A99144","first_name":"CADYN","last_name":"CARROLL","classification":"C","division":"OPEN","hit_factor":5.1675},{"match_name":"GAS Special Classifier","match_date":"2015-09-05","stage_classifiercode":"99-12","member_number":"A21997","first_name":"AL","last_name":"PINGREY","classification":"B","division":"OPEN","hit_factor":5.1661},{"match_name":"Hosemasters  3rd Sunday Feburary 2017","match_date":"2017-02-12","stage_classifiercode":"99-12","member_number":"TY67883","first_name":"JOSEPH","last_name":"PASQUALI","classification":"C","division":"OPEN","hit_factor":5.163},{"match_name":"Colonial Rifle and Pistol Club June 2018 Special Classifier","match_date":"2018-06-02","stage_classifiercode":"99-12","member_number":"TY83520","first_name":"JAMES","last_name":"MARQUEZ","classification":"C","division":"OPEN","hit_factor":5.1607},{"match_name":"SPSA USPSA March 4th Sat match","match_date":"2017-03-25","stage_classifiercode":"99-12","member_number":"L3724","first_name":"JACK","last_name":"SUBER","classification":"A","division":"OPEN","hit_factor":5.132},{"match_name":"Emmett September Match","match_date":"2016-09-24","stage_classifiercode":"99-12","member_number":"ty30712","first_name":"DENNIS","last_name":"WILSON","classification":"B","division":"OPEN","hit_factor":5.1308},{"match_name":"MCPSL Pistol 4-9-16","match_date":"2016-04-09","stage_classifiercode":"99-12","member_number":"Ty69970","first_name":"MATTHEW","last_name":"CURTICE","classification":"C","division":"OPEN","hit_factor":5.1202},{"match_name":"Fairfax PS USPSA  2018 September","match_date":"2018-09-18","stage_classifiercode":"99-12","member_number":"A109301","first_name":"DAVID","last_name":"THOMPSON","classification":"U","division":"OPEN","hit_factor":5.1151},{"match_name":"GCL December 12-2-17","match_date":"2017-12-02","stage_classifiercode":"99-12","member_number":"TY5421","first_name":"TOM","last_name":"BECK","classification":"B","division":"OPEN","hit_factor":5.1142},{"match_name":"FBURG April 2017 Level I USPSA ","match_date":"2017-04-01","stage_classifiercode":"99-12","member_number":"TY66449","first_name":"LEE","last_name":"WILLS","classification":"G","division":"OPEN","hit_factor":5.1107},{"match_name":"HRRB 5-20-2017","match_date":"2017-05-20","stage_classifiercode":"99-12","member_number":"A88006","first_name":"BOBBY","last_name":"REGALARIO","classification":"D","division":"OPEN","hit_factor":5.0992},{"match_name":"LIPSA - April 30th 2017 - USPSA Match Special Classifier","match_date":"2017-04-30","stage_classifiercode":"99-12","member_number":"A93928","first_name":"RICHIE","last_name":"CHEN","classification":"C","division":"OPEN","hit_factor":5.0955},{"match_name":"MVPSA USPSA July 17th","match_date":"2021-07-17","stage_classifiercode":"99-12","member_number":"L4137","first_name":"STEVE","last_name":"PEACOCK","classification":"C","division":"OPEN","hit_factor":5.0941},{"match_name":"SFPS 05-21-17 Superclassifier Gun1","match_date":"2017-05-21","stage_classifiercode":"99-12","member_number":"A91137","first_name":"ROGER","last_name":"BERGGREN","classification":"U","division":"OPEN","hit_factor":5.0883},{"match_name":"FPS USPSA April2017","match_date":"2017-04-02","stage_classifiercode":"99-12","member_number":"A93928","first_name":"RICHIE","last_name":"CHEN","classification":"C","division":"OPEN","hit_factor":5.0633},{"match_name":"GCL December 12-2-17","match_date":"2017-12-02","stage_classifiercode":"99-12","member_number":"A58687","first_name":"ROBERT","last_name":"HILFIKER","classification":"M","division":"OPEN","hit_factor":5.0633},{"match_name":"HPS September Club Fun Shoot","match_date":"2018-09-01","stage_classifiercode":"99-12","member_number":"FY90392","first_name":"CLYDE","last_name":"JACINTO","classification":"U","division":"OPEN","hit_factor":5.0622},{"match_name":"Hosemasters  3rd Sunday Feburary 2017","match_date":"2017-02-12","stage_classifiercode":"99-12","member_number":"A49393","first_name":"NAIM","last_name":"SAITI","classification":"G","division":"OPEN","hit_factor":5.059},{"match_name":"ENPS May 2018 USPSA Match","match_date":"2018-05-06","stage_classifiercode":"99-12","member_number":"A48607","first_name":"GUY","last_name":"GRIFFITH","classification":"B","division":"OPEN","hit_factor":5.0562},{"match_name":"MCPSL Pistol 4-8-17","match_date":"2017-04-08","stage_classifiercode":"99-12","member_number":"TY78821","first_name":"STEVE","last_name":"GIRARD","classification":"C","division":"OPEN","hit_factor":5.0485},{"match_name":"DWB - Deadwood Boys USPSA 18 February 2018","match_date":"2018-02-18","stage_classifiercode":"99-12","member_number":"\"\"","first_name":"THEO","last_name":"AGUIRRE","classification":"U","division":"OPEN","hit_factor":5.0485},{"match_name":"Piscataqua  Master Blasters USPSA Special Classifier","match_date":"2017-12-03","stage_classifiercode":"99-12","member_number":"A104656","first_name":"CRAIG","last_name":"TRAHAN","classification":"U","division":"OPEN","hit_factor":5.045},{"match_name":"Woodland Heights Practical Shooters USPSA Match","match_date":"2021-09-19","stage_classifiercode":"99-12","member_number":"A55262","first_name":"DEAN","last_name":"GOMEZ","classification":"B","division":"OPEN","hit_factor":5.0352},{"match_name":"TPS USPSA PISTOL - May 2016 - Talon Range","match_date":"2016-05-07","stage_classifiercode":"99-12","member_number":"ty31727","first_name":"MIKE","last_name":"DEGUIRE","classification":"B","division":"OPEN","hit_factor":5.0339},{"match_name":"COPS Feb 2017 USPSA Match","match_date":"2017-02-05","stage_classifiercode":"99-12","member_number":"TY78481","first_name":"TERRY","last_name":"LAUWERS","classification":"C","division":"OPEN","hit_factor":5.0328},{"match_name":"Emmett September Match","match_date":"2016-09-24","stage_classifiercode":"99-12","member_number":"a89072","first_name":"CODY","last_name":"KROPP","classification":"A","division":"OPEN","hit_factor":5.029},{"match_name":"MPPL USPSA Match 01072017","match_date":"2017-01-07","stage_classifiercode":"99-12","member_number":"A88485","first_name":"BHONG","last_name":"DELOS SANTOS","classification":"C","division":"OPEN","hit_factor":5.0139},{"match_name":"COPS Feb 2017 USPSA Match","match_date":"2017-02-05","stage_classifiercode":"99-12","member_number":"TY94217","first_name":"DUSTIN","last_name":"CHAMBERLAIN","classification":"C","division":"OPEN","hit_factor":5.0098},{"match_name":"Medford USPSA April 2018 Match","match_date":"2018-04-15","stage_classifiercode":"99-12","member_number":"TY49839","first_name":"CATHY","last_name":"HILL","classification":"C","division":"OPEN","hit_factor":5.0053},{"match_name":"FBPPC DECEMBER 2016 SPECIAL CLASSIFIER MATCH","match_date":"2016-12-10","stage_classifiercode":"99-12","member_number":"L1956","first_name":"ARLIN","last_name":"GURLEY","classification":"B","division":"OPEN","hit_factor":5},{"match_name":"WTPS USPSA April Classifier Match 4-8-17","match_date":"2017-04-08","stage_classifiercode":"99-12","member_number":"TY85410","first_name":"CHAD","last_name":"SANDERS","classification":"C","division":"OPEN","hit_factor":5},{"match_name":"MPSA 2021-08-21","match_date":"2021-08-21","stage_classifiercode":"99-12","member_number":"A108012","first_name":"JASON","last_name":"WOODRUFF","classification":"U","division":"OPEN","hit_factor":4.9743},{"match_name":"Collin County USPSA Nov. 27 2016","match_date":"2016-11-25","stage_classifiercode":"99-12","member_number":"\"\"","first_name":"TEREN","last_name":"HOLSEY","classification":"U","division":"OPEN","hit_factor":4.9645},{"match_name":"EWPSA 2016-04","match_date":"2016-04-17","stage_classifiercode":"99-12","member_number":"L3238","first_name":"MATT","last_name":"NEWBURN","classification":"B","division":"OPEN","hit_factor":4.9595},{"match_name":"MCPSL Pistol 4-8-17","match_date":"2017-04-08","stage_classifiercode":"99-12","member_number":"TY43257","first_name":"FRED","last_name":"NOBLE","classification":"C","division":"OPEN","hit_factor":4.9594},{"match_name":"Richmond Hot Shots February 7-2016 USPSA Match","match_date":"2016-02-07","stage_classifiercode":"99-12","member_number":"TY32985","first_name":"DAVID","last_name":"PONCE","classification":"M","division":"OPEN","hit_factor":4.9575},{"match_name":"Woodland Heights Practical Shooters Tactical Rifle Match","match_date":"2021-09-19","stage_classifiercode":"99-12","member_number":"TY91043","first_name":"DAVID","last_name":"MURPHY","classification":"U","division":"OPEN","hit_factor":4.9563},{"match_name":"Palmetto Gun Club - February 2018 USPSA","match_date":"2018-02-03","stage_classifiercode":"99-12","member_number":"A80405","first_name":"LINDA","last_name":"DISCHE","classification":"C","division":"OPEN","hit_factor":4.9394},{"match_name":"NVSA USPSA 1711","match_date":"2017-11-05","stage_classifiercode":"99-12","member_number":"A14162","first_name":"RUSS","last_name":"HOLETZ","classification":"U","division":"OPEN","hit_factor":4.9336},{"match_name":"HRRB 3-5-16","match_date":"2016-03-05","stage_classifiercode":"99-12","member_number":"\"\"","first_name":"ERIC","last_name":"CAMPOS JR","classification":"U","division":"OPEN","hit_factor":4.9323},{"match_name":"Laser Ninja Dragon League USPSA August 2017","match_date":"2017-08-06","stage_classifiercode":"99-12","member_number":"A92463","first_name":"DAN","last_name":"STABER","classification":"C","division":"OPEN","hit_factor":4.9255},{"match_name":"RD Shooters May 6th USPSA  match","match_date":"2017-05-06","stage_classifiercode":"99-12","member_number":"TY92057","first_name":"CAMERON","last_name":"DASSO","classification":"C","division":"OPEN","hit_factor":4.922},{"match_name":"Belton Gun Club USPSA January MATCH 1-30-21","match_date":"2021-01-30","stage_classifiercode":"99-12","member_number":"TY113996","first_name":"LUIS","last_name":"CRESPO","classification":"B","division":"OPEN","hit_factor":4.9161},{"match_name":"MPPL USPSA Match 01072017","match_date":"2017-01-07","stage_classifiercode":"99-12","member_number":"TY23019","first_name":"ROB","last_name":"LOUI","classification":"B","division":"OPEN","hit_factor":4.9133},{"match_name":"BGS NORTH  Week 9","match_date":"2016-03-13","stage_classifiercode":"99-12","member_number":"TY73645","first_name":"JOE","last_name":"BENSON","classification":"C","division":"OPEN","hit_factor":4.908},{"match_name":"LdF 4th Saturday Match","match_date":"2016-01-23","stage_classifiercode":"99-12","member_number":"A84164","first_name":"CAMERON","last_name":"WALES","classification":"C","division":"OPEN","hit_factor":4.9043},{"match_name":"Emmett September Match","match_date":"2016-09-24","stage_classifiercode":"99-12","member_number":"a69178","first_name":"JASON","last_name":"PRICE","classification":"B","division":"OPEN","hit_factor":4.8897},{"match_name":"ECPS February 28th USPSA Pistol Match","match_date":"2016-02-28","stage_classifiercode":"99-12","member_number":"\"\"","first_name":"FRANK","last_name":"GLOVER","classification":"\"\"","division":"OPEN","hit_factor":4.8802},{"match_name":"MVPSA USPSA July 17th","match_date":"2021-07-17","stage_classifiercode":"99-12","member_number":"A129778","first_name":"EMILY","last_name":"HUGHSTON","classification":"C","division":"OPEN","hit_factor":4.8801},{"match_name":"Paul Bunyan April 7th-8th All Classifier Match NW01","match_date":"2018-04-07","stage_classifiercode":"99-12","member_number":"A88243","first_name":"KRIS","last_name":"MCGAUGHEY","classification":"C","division":"OPEN","hit_factor":4.878},{"match_name":"GMPS 5/7/17","match_date":"2017-05-06","stage_classifiercode":"99-12","member_number":"A70161","first_name":"ROGER","last_name":"BINKERD","classification":"U","division":"OPEN","hit_factor":4.8736},{"match_name":"2020-03 Bone Creek USPSA","match_date":"2020-03-01","stage_classifiercode":"99-12","member_number":"FY83466","first_name":"EMIL","last_name":"KASERMAN","classification":"C","division":"OPEN","hit_factor":4.8669},{"match_name":"Brothers N Arms August 2018 USPSA Match","match_date":"2018-08-18","stage_classifiercode":"99-12","member_number":"A66934","first_name":"ELIZABETH","last_name":"YOUNG","classification":"C","division":"OPEN","hit_factor":4.8649},{"match_name":"HRRB 5-20-2017","match_date":"2017-05-20","stage_classifiercode":"99-12","member_number":"\"\"","first_name":"EDGAR","last_name":"VICENTE","classification":"C","division":"OPEN","hit_factor":4.8617},{"match_name":"SPSA USPSA March 4th Sat match","match_date":"2017-03-25","stage_classifiercode":"99-12","member_number":"L3896","first_name":"CHRIS","last_name":"WILLAUER","classification":"C","division":"OPEN","hit_factor":4.8552},{"match_name":"DWB - Deadwood Boys USPSA 18 February 2018","match_date":"2018-02-18","stage_classifiercode":"99-12","member_number":"TY42673","first_name":"CHUCK","last_name":"CHURCH","classification":"C","division":"OPEN","hit_factor":4.849},{"match_name":"MPSA USPSA 111817","match_date":"2017-11-18","stage_classifiercode":"99-12","member_number":"L4195","first_name":"THOMAS","last_name":"HEARD","classification":"D","division":"OPEN","hit_factor":4.8417},{"match_name":"HPS September Club Fun Shoot","match_date":"2018-09-01","stage_classifiercode":"99-12","member_number":"FY66771","first_name":"ORLINO","last_name":"CARDENAS","classification":"C","division":"OPEN","hit_factor":4.8405},{"match_name":"Chillicothe May-2017 USPSA Match","match_date":"2017-05-28","stage_classifiercode":"99-12","member_number":"A69428","first_name":"CARTER","last_name":"JONES","classification":"C","division":"OPEN","hit_factor":4.8203},{"match_name":"LIPSA - April 30th 2017 - USPSA Match Special Classifier","match_date":"2017-04-30","stage_classifiercode":"99-12","member_number":"TY93363","first_name":"DEAN","last_name":"CHASSE","classification":"C","division":"OPEN","hit_factor":4.8104},{"match_name":"MPPL USPSA Match 01072017","match_date":"2017-01-07","stage_classifiercode":"99-12","member_number":"TY67177","first_name":"EDGAR","last_name":"CARAANG","classification":"C","division":"OPEN","hit_factor":4.8043},{"match_name":"Smoke & Hope USPSA Apr 22 2017","match_date":"2017-04-22","stage_classifiercode":"99-12","member_number":"TY29750","first_name":"CRAIG","last_name":"BOYD","classification":"A","division":"OPEN","hit_factor":4.8019},{"match_name":"Stock & Barrel MN18 November 2020 USPSA Classifier Match","match_date":"2020-11-01","stage_classifiercode":"99-12","member_number":"A116283","first_name":"TIM","last_name":"DUNDERI","classification":"U","division":"OPEN","hit_factor":4.7988},{"match_name":"Griffin USPSA Match Aug 2017","match_date":"2017-08-19","stage_classifiercode":"99-12","member_number":"A82404","first_name":"JEFF","last_name":"JOHNSTON","classification":"C","division":"OPEN","hit_factor":4.7977},{"match_name":"Colonial Rifle and Pistol Club June 2018 Special Classifier","match_date":"2018-06-02","stage_classifiercode":"99-12","member_number":"TY31444","first_name":"JOSE","last_name":"OCAMPO","classification":"B","division":"OPEN","hit_factor":4.7868},{"match_name":"Pelham USPSA 2016-09-18","match_date":"2016-09-18","stage_classifiercode":"99-12","member_number":"A34817","first_name":"DAN","last_name":"DIGIOVINE","classification":"A","division":"OPEN","hit_factor":4.7753},{"match_name":"ORSA USPSA October 2016","match_date":"2016-10-15","stage_classifiercode":"99-12","member_number":"A28682","first_name":"DAN","last_name":"FOWLER","classification":"B","division":"OPEN","hit_factor":4.7573},{"match_name":"CVSC 06-25-2017","match_date":"2017-06-25","stage_classifiercode":"99-12","member_number":"A72602","first_name":"STEVE","last_name":"MURRAY","classification":"B","division":"OPEN","hit_factor":4.7532},{"match_name":"H&H June Match","match_date":"2016-06-26","stage_classifiercode":"99-12","member_number":"A74860","first_name":"CHUCK","last_name":"HYDE","classification":"D","division":"OPEN","hit_factor":4.7516},{"match_name":"GCL Wed 1-29-20","match_date":"2020-01-29","stage_classifiercode":"99-12","member_number":"TY1907","first_name":"JEFF","last_name":"CURTS","classification":"A","division":"OPEN","hit_factor":4.7244},{"match_name":"Rockcastle USPSA Nov 28 2015","match_date":"2015-11-28","stage_classifiercode":"99-12","member_number":"FY48388","first_name":"SUE","last_name":"VANBLARICUM","classification":"B","division":"OPEN","hit_factor":4.7141},{"match_name":"SPSA USPSA March 4th Sat match","match_date":"2017-03-25","stage_classifiercode":"99-12","member_number":"A31524","first_name":"COUNCIL","last_name":"BRADSHAW","classification":"G","division":"OPEN","hit_factor":4.7088},{"match_name":"Richmond Hot Shots February 7-2016 USPSA Match","match_date":"2016-02-07","stage_classifiercode":"99-12","member_number":"A81878","first_name":"CHRIS","last_name":"WALLACE","classification":"C","division":"OPEN","hit_factor":4.7018},{"match_name":"Paul Bunyan April 7th-8th All Classifier Match NW01","match_date":"2018-04-07","stage_classifiercode":"99-12","member_number":"L3001","first_name":"LARRY","last_name":"LEONE","classification":"B","division":"OPEN","hit_factor":4.6944},{"match_name":"DGC USPSA 07-08-18","match_date":"2018-07-08","stage_classifiercode":"99-12","member_number":"FY94000","first_name":"MICHAEL","last_name":"MORGAN","classification":"B","division":"OPEN","hit_factor":4.6911},{"match_name":"EWPSA 2016-04","match_date":"2016-04-17","stage_classifiercode":"99-12","member_number":"A80665","first_name":"SAMANTHA","last_name":"JOYNER","classification":"C","division":"OPEN","hit_factor":4.6746},{"match_name":"North Mountain July ","match_date":"2016-07-17","stage_classifiercode":"99-12","member_number":"FY80523","first_name":"JERRY","last_name":"SITEK","classification":"D","division":"OPEN","hit_factor":4.6729},{"match_name":"APSA February 2017 USPSA Match","match_date":"2017-02-11","stage_classifiercode":"99-12","member_number":"TY85933","first_name":"STEVE","last_name":"KELLY","classification":"C","division":"OPEN","hit_factor":4.672},{"match_name":"CGC 2017_05_13","match_date":"2017-05-13","stage_classifiercode":"99-12","member_number":"TY93235","first_name":"JENNIFER","last_name":"PETTY","classification":"C","division":"OPEN","hit_factor":4.6418},{"match_name":"USC August 2016","match_date":"2016-08-13","stage_classifiercode":"99-12","member_number":"A14981","first_name":"JOHN","last_name":"MCGUIRE","classification":"B","division":"OPEN","hit_factor":4.6351},{"match_name":"SFPS 05-21-17 Superclassifier Gun1","match_date":"2017-05-21","stage_classifiercode":"99-12","member_number":"a97008","first_name":"MATTHEW","last_name":"HITCHCOCK","classification":"U","division":"OPEN","hit_factor":4.6154},{"match_name":"Prescott 3rd Sunday USPSA 11-20-2016","match_date":"2016-11-20","stage_classifiercode":"99-12","member_number":"TY30283","first_name":"LARRY","last_name":"FOUTZ","classification":"B","division":"OPEN","hit_factor":4.6064},{"match_name":"BRC_20170611","match_date":"2017-06-11","stage_classifiercode":"99-12","member_number":"TY5392","first_name":"ROGER","last_name":"BRIDEN","classification":"B","division":"OPEN","hit_factor":4.5948},{"match_name":"Hosemasters  3rd Sunday Feburary 2017","match_date":"2017-02-12","stage_classifiercode":"99-12","member_number":"L1697","first_name":"DENNY","last_name":"SHADEL","classification":"C","division":"OPEN","hit_factor":4.5898},{"match_name":"Rendezvous 8-24-16","match_date":"2016-08-25","stage_classifiercode":"99-12","member_number":"\"\"","first_name":"FERRIN","last_name":"F","classification":"U","division":"OPEN","hit_factor":4.5864},{"match_name":"USPSA MO21 Special Classifier 2Alpha SBRC February 27 2021","match_date":"2021-02-27","stage_classifiercode":"99-12","member_number":"A127396","first_name":"JOSHUA","last_name":"SMITH","classification":"U","division":"OPEN","hit_factor":4.5692},{"match_name":"RangeMasters 12-17-2015","match_date":"2015-12-17","stage_classifiercode":"99-12","member_number":"L3738","first_name":"JAY","last_name":"OLMSTEAD","classification":"C","division":"OPEN","hit_factor":4.5497},{"match_name":"OFGC USPSA Match Feb 19th 2017","match_date":"2017-02-19","stage_classifiercode":"99-12","member_number":"\"\"","first_name":"CODY","last_name":"GRAHAM","classification":"U","division":"OPEN","hit_factor":4.5455},{"match_name":"SPSA USPSA March 4th Sat match","match_date":"2017-03-25","stage_classifiercode":"99-12","member_number":"L3838","first_name":"NATHAN","last_name":"THOMPSON","classification":"M","division":"OPEN","hit_factor":4.5383},{"match_name":"Chillicothe May-2017 USPSA Match","match_date":"2017-05-28","stage_classifiercode":"99-12","member_number":"\"\"","first_name":"MARK","last_name":"SELLNER","classification":"A","division":"OPEN","hit_factor":4.5293},{"match_name":"Chillicothe May-2017 USPSA Match","match_date":"2017-05-28","stage_classifiercode":"99-12","member_number":"TY72670","first_name":"DALE","last_name":"HARDING","classification":"C","division":"OPEN","hit_factor":4.5257},{"match_name":"RBGC 2018-7-28","match_date":"2018-07-28","stage_classifiercode":"99-12","member_number":"TY52571","first_name":"PETER","last_name":"OLIVER","classification":"M","division":"OPEN","hit_factor":4.5198},{"match_name":"MSSA Uspsa Match","match_date":"2017-04-08","stage_classifiercode":"99-12","member_number":"TY17417","first_name":"BILL","last_name":"GREWE","classification":"U","division":"OPEN","hit_factor":4.4917},{"match_name":"FPS USPSA April2017","match_date":"2017-04-02","stage_classifiercode":"99-12","member_number":"A81896","first_name":"PAUL","last_name":"IANNOTTA","classification":"C","division":"OPEN","hit_factor":4.4789},{"match_name":"Atlanta Practical Shooters March 2016 USPSA - Classifier Match","match_date":"2016-03-06","stage_classifiercode":"99-12","member_number":"A88793","first_name":"RACHEL","last_name":"SMITH","classification":"C","division":"OPEN","hit_factor":4.4723},{"match_name":"PCGC  June 2017","match_date":"2017-06-25","stage_classifiercode":"99-12","member_number":"FY35196","first_name":"BILL","last_name":"FLOOD","classification":"B","division":"OPEN","hit_factor":4.4658},{"match_name":"HPS September Club Fun Shoot","match_date":"2018-09-01","stage_classifiercode":"99-12","member_number":"L4015","first_name":"ANGELO","last_name":"BARRANCO","classification":"B","division":"OPEN","hit_factor":4.461},{"match_name":"Springfield Tactical Shooters 06-07-2018","match_date":"2018-06-07","stage_classifiercode":"99-12","member_number":"TY26842","first_name":"ERIC","last_name":"PREWITT","classification":"\"\"","division":"OPEN","hit_factor":4.455},{"match_name":"RangeMasters 12-17-2015","match_date":"2015-12-17","stage_classifiercode":"99-12","member_number":"A33941","first_name":"JACK","last_name":"HERSHBERGER","classification":"A","division":"OPEN","hit_factor":4.454},{"match_name":"Collin County USPSA Nov. 27 2016","match_date":"2016-11-25","stage_classifiercode":"99-12","member_number":"TY9766","first_name":"PATRICK","last_name":"BASHFORD","classification":"B","division":"OPEN","hit_factor":4.436},{"match_name":"HRRB 3-5-16","match_date":"2016-03-05","stage_classifiercode":"99-12","member_number":"Fy85757","first_name":"EDGAR","last_name":"VICINTE","classification":"C","division":"OPEN","hit_factor":4.424},{"match_name":"Medford USPSA April 2018 Match","match_date":"2018-04-15","stage_classifiercode":"99-12","member_number":"L4326","first_name":"DAN","last_name":"MCDONALD","classification":"U","division":"OPEN","hit_factor":4.4152},{"match_name":"Hosemasters  3rd Sunday Feburary 2017","match_date":"2017-02-12","stage_classifiercode":"99-12","member_number":"TY28301","first_name":"BOBBI","last_name":"WAGNER","classification":"C","division":"OPEN","hit_factor":4.413},{"match_name":"ENPS May 2018 USPSA Match","match_date":"2018-05-06","stage_classifiercode":"99-12","member_number":"\"\"","first_name":"KENNETH","last_name":"NGUYEN","classification":"U","division":"OPEN","hit_factor":4.4118},{"match_name":"Fairfax PS USPSA  2018 September","match_date":"2018-09-18","stage_classifiercode":"99-12","member_number":"A104708","first_name":"HAO","last_name":"LUAN","classification":"D","division":"OPEN","hit_factor":4.4019},{"match_name":"HRRB 5-20-2017","match_date":"2017-05-20","stage_classifiercode":"99-12","member_number":"TY98598","first_name":"MARK","last_name":"PAZ","classification":"U","division":"OPEN","hit_factor":4.3981},{"match_name":"SFPC March USPSA Match 2017","match_date":"2017-03-05","stage_classifiercode":"99-12","member_number":"A93270","first_name":"EDDIE","last_name":"RIVERA","classification":"C","division":"OPEN","hit_factor":4.3946},{"match_name":"RBGC 2018-7-28","match_date":"2018-07-28","stage_classifiercode":"99-12","member_number":"TY94721","first_name":"BOB","last_name":"MCCOLL","classification":"C","division":"OPEN","hit_factor":4.3729},{"match_name":"CRGC USPSA Special Classifier 08-15-21","match_date":"2021-08-15","stage_classifiercode":"99-12","member_number":"A136433","first_name":"IVAN","last_name":"CRUZ","classification":"","division":"OPEN","hit_factor":4.3678},{"match_name":"Hosemasters  3rd Sunday Feburary 2017","match_date":"2017-02-12","stage_classifiercode":"99-12","member_number":"\"\"","first_name":"DAVID","last_name":"LARSON","classification":"U","division":"OPEN","hit_factor":4.3668},{"match_name":"OK15 USPSA AT USSA","match_date":"2016-07-10","stage_classifiercode":"99-12","member_number":"TY-94217","first_name":"DUSTIN","last_name":"CHAMBERLAIN","classification":"U","division":"OPEN","hit_factor":4.3633},{"match_name":"Collin County USPSA Nov. 27 2016","match_date":"2016-11-25","stage_classifiercode":"99-12","member_number":"\"\"","first_name":"DANIEL","last_name":"MARTINEZ","classification":"U","division":"OPEN","hit_factor":4.3597},{"match_name":"PCGC  June 2017","match_date":"2017-06-25","stage_classifiercode":"99-12","member_number":"A88347","first_name":"MATT","last_name":"BOWEN","classification":"C","division":"OPEN","hit_factor":4.3537},{"match_name":"RBGC 2018-7-28","match_date":"2018-07-28","stage_classifiercode":"99-12","member_number":"L3865","first_name":"VINCENT","last_name":"PAINTER","classification":"U","division":"OPEN","hit_factor":4.3522},{"match_name":"Prescott 3rd Sunday USPSA 11-20-2016","match_date":"2016-11-20","stage_classifiercode":"99-12","member_number":"L3243","first_name":"PETE","last_name":"CONNAL","classification":"B","division":"OPEN","hit_factor":4.3429},{"match_name":"CGC 2017_05_13","match_date":"2017-05-13","stage_classifiercode":"99-12","member_number":"TY85797","first_name":"GARY","last_name":"WILLIAMS","classification":"C","division":"OPEN","hit_factor":4.3243},{"match_name":"MCPSL Pistol 4-9-16","match_date":"2016-04-09","stage_classifiercode":"99-12","member_number":"A568","first_name":"RICK","last_name":"BYFIELD","classification":"G","division":"OPEN","hit_factor":4.3103},{"match_name":"HRRB 3-5-16","match_date":"2016-03-05","stage_classifiercode":"99-12","member_number":"FY66771","first_name":"ORLINO","last_name":"CARDENAS","classification":"C","division":"OPEN","hit_factor":4.3019},{"match_name":"GRPC USPSA MARCH MAD HATTER","match_date":"2018-03-02","stage_classifiercode":"99-12","member_number":"TY70210","first_name":"MYRNA","last_name":"RUSSIAN","classification":"C","division":"OPEN","hit_factor":4.2969},{"match_name":"Ducky Shoot August","match_date":"2018-08-18","stage_classifiercode":"99-12","member_number":"A-87813","first_name":"DON","last_name":"ADAMS","classification":"D","division":"OPEN","hit_factor":4.2965},{"match_name":"Green Valley February 2017","match_date":"2017-02-25","stage_classifiercode":"99-12","member_number":"PEN","first_name":"PAUL","last_name":"EGGEMAN","classification":"U","division":"OPEN","hit_factor":4.2959},{"match_name":"Richmond Hot Shots February 7-2016 USPSA Match","match_date":"2016-02-07","stage_classifiercode":"99-12","member_number":"TY17701","first_name":"BERNARDO","last_name":"DIONISIO","classification":"B","division":"OPEN","hit_factor":4.2868},{"match_name":"USC August 2016","match_date":"2016-08-13","stage_classifiercode":"99-12","member_number":"A78543","first_name":"WILLIAM","last_name":"SIMPSON","classification":"C","division":"OPEN","hit_factor":4.2791},{"match_name":"SFPC September USPSA Special Classifier match","match_date":"2016-09-04","stage_classifiercode":"99-12","member_number":"TY78145","first_name":"WILLIAM","last_name":"DANAHER","classification":"C","division":"OPEN","hit_factor":4.2741},{"match_name":"Danville Rifle and Pistol Club USPSA IL17 April 21 2018","match_date":"2018-04-21","stage_classifiercode":"99-12","member_number":"TY71495","first_name":"JEANNIE","last_name":"HANSEN","classification":"C","division":"OPEN","hit_factor":4.2714},{"match_name":"LPRGC-Lower Providence USPSA May-2 2017","match_date":"2017-05-13","stage_classifiercode":"99-12","member_number":"A82014","first_name":"TONY","last_name":"SPINILLO","classification":"B","division":"OPEN","hit_factor":4.2689},{"match_name":"DGC USPSA 07-08-18","match_date":"2018-07-08","stage_classifiercode":"99-12","member_number":"101051","first_name":"JUD","last_name":"SPIVEY","classification":"U","division":"OPEN","hit_factor":4.2629},{"match_name":"Richmond Hot Shots February 7-2016 USPSA Match","match_date":"2016-02-07","stage_classifiercode":"99-12","member_number":"a83502","first_name":"PAUL","last_name":"CLANTON","classification":"C","division":"OPEN","hit_factor":4.262},{"match_name":"Payson Practical Pistol Sept 03 2016","match_date":"2016-09-03","stage_classifiercode":"99-12","member_number":"TY45927","first_name":"BOB","last_name":"LEE","classification":"U","division":"OPEN","hit_factor":4.262},{"match_name":"MCPSL Pistol 4-9-16","match_date":"2016-04-09","stage_classifiercode":"99-12","member_number":"L3778","first_name":"GREG","last_name":"GOYETTE","classification":"C","division":"OPEN","hit_factor":4.2169},{"match_name":"MVPSA USPSA August 7th Classifier Match","match_date":"2021-08-07","stage_classifiercode":"99-12","member_number":"A34845","first_name":"DAN","last_name":"QUALLS","classification":"B","division":"OPEN","hit_factor":4.2155},{"match_name":"Richmond Hot Shots February 7-2016 USPSA Match","match_date":"2016-02-07","stage_classifiercode":"99-12","member_number":"a80595","first_name":"EDGAR","last_name":"ALLAS","classification":"C","division":"OPEN","hit_factor":4.2084},{"match_name":"Brothers N Arms February 2018 USPSA Match","match_date":"2018-02-17","stage_classifiercode":"99-12","member_number":"A107778","first_name":"TIM","last_name":"PATTERSON","classification":"U","division":"OPEN","hit_factor":4.2027},{"match_name":"PCGC  June 2017","match_date":"2017-06-25","stage_classifiercode":"99-12","member_number":"A85695","first_name":"ALAN","last_name":"FRENCH","classification":"B","division":"OPEN","hit_factor":4.191},{"match_name":"SPSA USPSA March 4th Sat match","match_date":"2017-03-25","stage_classifiercode":"99-12","member_number":"L4170","first_name":"STEVE","last_name":"COX","classification":"C","division":"OPEN","hit_factor":4.1879},{"match_name":"Nampa USPSA February 1st","match_date":"2020-02-01","stage_classifiercode":"99-12","member_number":"FY80359","first_name":"JD","last_name":"MCCORD","classification":"C","division":"OPEN","hit_factor":4.1806},{"match_name":"USPSA MO21 Special Classifier 2Alpha SBRC February 27 2021","match_date":"2021-02-27","stage_classifiercode":"99-12","member_number":"A113874","first_name":"DAVID","last_name":"HANCOCK","classification":"C","division":"OPEN","hit_factor":4.1771},{"match_name":"LCHG May USPSA","match_date":"2017-05-21","stage_classifiercode":"99-12","member_number":"TY97094","first_name":"TOMMY","last_name":"MCCULLOUGH","classification":"U","division":"OPEN","hit_factor":4.1731},{"match_name":"GCL December 12-2-17","match_date":"2017-12-02","stage_classifiercode":"99-12","member_number":"FY39257","first_name":"PAUL","last_name":"ROBERTS","classification":"M","division":"OPEN","hit_factor":4.1729},{"match_name":"NNRPA USPSA May 2018","match_date":"2018-05-26","stage_classifiercode":"99-12","member_number":"TY74310","first_name":"LAURA","last_name":"PRICE","classification":"C","division":"OPEN","hit_factor":4.1703},{"match_name":"Springfield Tactical Shooters 06-07-2018","match_date":"2018-06-07","stage_classifiercode":"99-12","member_number":"A95946","first_name":"PAUL","last_name":"EMERY","classification":"C","division":"OPEN","hit_factor":4.1667},{"match_name":"LIPSA - April 30th 2017 - USPSA Match Special Classifier","match_date":"2017-04-30","stage_classifiercode":"99-12","member_number":"TY19188","first_name":"WARREN E","last_name":"SONNER","classification":"C","division":"OPEN","hit_factor":4.1569},{"match_name":"NNRPA USPSA May 2018","match_date":"2018-05-26","stage_classifiercode":"99-12","member_number":"TY51797","first_name":"DENNIS","last_name":"MARSH","classification":"U","division":"OPEN","hit_factor":4.1462},{"match_name":"Springfield Tactical Shooters 09/03/2020","match_date":"2020-09-03","stage_classifiercode":"99-12","member_number":"\"\"","first_name":"TONY","last_name":"NUDO","classification":"\"\"","division":"OPEN","hit_factor":4.1439},{"match_name":"CRGC USPSA Special Classifier 08-15-21","match_date":"2021-08-15","stage_classifiercode":"99-12","member_number":"TY93799","first_name":"JONATHAN","last_name":"WHEATON","classification":"","division":"OPEN","hit_factor":4.1424},{"match_name":"Chillicothe May-2017 USPSA Match","match_date":"2017-05-28","stage_classifiercode":"99-12","member_number":"TY76261","first_name":"DAN","last_name":"LONG","classification":"C","division":"OPEN","hit_factor":4.126},{"match_name":"Colonial Rifle and Pistol Club June 2018 Special Classifier","match_date":"2018-06-02","stage_classifiercode":"99-12","member_number":"A105434","first_name":"FRED","last_name":"LAFEMINA","classification":"U","division":"OPEN","hit_factor":4.1193},{"match_name":"APSA February 2017 USPSA Match","match_date":"2017-02-11","stage_classifiercode":"99-12","member_number":"A94155","first_name":"DANNY","last_name":"BRITT","classification":"C","division":"OPEN","hit_factor":4.1082},{"match_name":"HPS September Club Fun Shoot","match_date":"2018-09-01","stage_classifiercode":"99-12","member_number":"\"\"","first_name":"MIKE","last_name":"GUILLEN","classification":"X","division":"OPEN","hit_factor":4.1041},{"match_name":"LdF USPSA Match July 14 2018","match_date":"2018-07-14","stage_classifiercode":"99-12","member_number":"FY39124","first_name":"RAMIRO","last_name":"REYES","classification":"M","division":"OPEN","hit_factor":4.104},{"match_name":"Payson Practical Pistol Sept 03 2016","match_date":"2016-09-03","stage_classifiercode":"99-12","member_number":"A96728","first_name":"JOHN","last_name":"RAVEN","classification":"C","division":"OPEN","hit_factor":4.1026},{"match_name":"RBGC 2018-7-28","match_date":"2018-07-28","stage_classifiercode":"99-12","member_number":"A97367","first_name":"JOHN","last_name":"FABIAN","classification":"D","division":"OPEN","hit_factor":4.0724},{"match_name":"USPSA MO21 Special Classifier 2Alpha SBRC February 27 2021","match_date":"2021-02-27","stage_classifiercode":"99-12","member_number":"A82858","first_name":"RICHARD","last_name":"ZARCONE","classification":"B","division":"OPEN","hit_factor":4.0692},{"match_name":"PCGC  June 2017","match_date":"2017-06-25","stage_classifiercode":"99-12","member_number":"A103069","first_name":"CHANCE","last_name":"BILLINGS","classification":"U","division":"OPEN","hit_factor":4.0522},{"match_name":"HRRB 3-5-16","match_date":"2016-03-05","stage_classifiercode":"99-12","member_number":"\"\"","first_name":"NESTOR","last_name":"TANI","classification":"A","division":"OPEN","hit_factor":4.0509},{"match_name":"Laser Ninja Dragon League USPSA August 2017","match_date":"2017-08-06","stage_classifiercode":"99-12","member_number":"FY95342","first_name":"ROLAND","last_name":"WOLF","classification":"C","division":"OPEN","hit_factor":4.0427},{"match_name":"OFGC Practical Pistol Match Jan 17 2016","match_date":"2016-01-17","stage_classifiercode":"99-12","member_number":"\"\"","first_name":"ROBERT","last_name":"TERBIETEN","classification":"C","division":"OPEN","hit_factor":4.0312},{"match_name":"XMG USPSA   Saturday September  4th 2021","match_date":"2021-09-04","stage_classifiercode":"99-12","member_number":"A134446","first_name":"GREGG","last_name":"EARNHART","classification":"U","division":"OPEN","hit_factor":4.023},{"match_name":"ENPS May 2018 USPSA Match","match_date":"2018-05-06","stage_classifiercode":"99-12","member_number":"A106136","first_name":"RYAN","last_name":"MARQUIS","classification":"U","division":"OPEN","hit_factor":4.0076},{"match_name":"Collin County USPSA Nov. 27 2016","match_date":"2016-11-25","stage_classifiercode":"99-12","member_number":"A75681","first_name":"CHRISTINE","last_name":"WEBSTER","classification":"C","division":"OPEN","hit_factor":4.0043},{"match_name":"SCCPSA USPSA Mar 17","match_date":"2018-03-17","stage_classifiercode":"99-12","member_number":"\"\"","first_name":"DOMENIC","last_name":"PASCALE","classification":"U","division":"OPEN","hit_factor":4.0033},{"match_name":"ECPS February 28th USPSA Pistol Match","match_date":"2016-02-28","stage_classifiercode":"99-12","member_number":"\"\"","first_name":"RUSTY","last_name":"THOMAS","classification":"\"\"","division":"OPEN","hit_factor":3.997},{"match_name":"MCPSL Pistol 4-9-16","match_date":"2016-04-09","stage_classifiercode":"99-12","member_number":"TY78821","first_name":"STEVE","last_name":"GIRARD","classification":"C","division":"OPEN","hit_factor":3.9941},{"match_name":"Payson Practical Pistol Sept 03 2016","match_date":"2016-09-03","stage_classifiercode":"99-12","member_number":"A86225","first_name":"BRYSON","last_name":"KOROLSKY","classification":"D","division":"OPEN","hit_factor":3.9867},{"match_name":"FPS USPSA April2017","match_date":"2017-04-02","stage_classifiercode":"99-12","member_number":"A83520","first_name":"JAMES C","last_name":"MARQUEZ JR","classification":"C","division":"OPEN","hit_factor":3.9801},{"match_name":"Colonial Rifle and Pistol Club June 2018 Special Classifier","match_date":"2018-06-02","stage_classifiercode":"99-12","member_number":"A107578","first_name":"JOE","last_name":"SANTIAGO","classification":"U","division":"OPEN","hit_factor":3.9786},{"match_name":"Smoke & Hope USPSA Apr 22 2017","match_date":"2017-04-22","stage_classifiercode":"99-12","member_number":"TY78129","first_name":"SHARON","last_name":"ELIASSON","classification":"C","division":"OPEN","hit_factor":3.9773},{"match_name":"Baghdad Practical Shooters USPSA 6-23","match_date":"2018-06-23","stage_classifiercode":"99-12","member_number":"A70400","first_name":"TONY","last_name":"PARISI","classification":"U","division":"OPEN","hit_factor":3.9688},{"match_name":"Maine Practical Shooters May 2018","match_date":"2018-05-12","stage_classifiercode":"99-12","member_number":"TY87309","first_name":"ANTHONY","last_name":"CHASE","classification":"A","division":"OPEN","hit_factor":3.963},{"match_name":"Minnetonka Game And Fish May 23","match_date":"2018-05-23","stage_classifiercode":"99-12","member_number":"TY29847","first_name":"ROSS","last_name":"ROSENBERG","classification":"A","division":"OPEN","hit_factor":3.9554},{"match_name":"PCGC  June 2017","match_date":"2017-06-25","stage_classifiercode":"99-12","member_number":"A85695","first_name":"ALAN","last_name":"FRENCH","classification":"B","division":"OPEN","hit_factor":3.9542},{"match_name":"Castlewood WPA13 Halloween Oct 22 2016","match_date":"2016-10-22","stage_classifiercode":"99-12","member_number":"\"\"","first_name":"WADE","last_name":"SHANER","classification":"U","division":"OPEN","hit_factor":3.9526},{"match_name":"USPSA AUG. 26th. TCCC Match","match_date":"2018-08-26","stage_classifiercode":"99-12","member_number":"A108550","first_name":"PAUL","last_name":"KESLER","classification":"U","division":"OPEN","hit_factor":3.933},{"match_name":"NISA April Classifer Match 2016","match_date":"2016-04-24","stage_classifiercode":"99-12","member_number":"A91934","first_name":"ALFRED","last_name":"LADORES","classification":"B","division":"OPEN","hit_factor":3.9316},{"match_name":"SCAPSA MN05 Summer League 1","match_date":"2017-06-05","stage_classifiercode":"99-12","member_number":"TY81530","first_name":"MIKE","last_name":"BERTRAND","classification":"C","division":"OPEN","hit_factor":3.931},{"match_name":"CRGC USPSA Special Classifier 08-15-21","match_date":"2021-08-15","stage_classifiercode":"99-12","member_number":"L4888","first_name":"BRIAN","last_name":"CHAREST","classification":"","division":"OPEN","hit_factor":3.9269},{"match_name":"OK15 USPSA AT USSA","match_date":"2016-07-10","stage_classifiercode":"99-12","member_number":"A81825","first_name":"IAN","last_name":"ZACHER","classification":"B","division":"OPEN","hit_factor":3.9216},{"match_name":"Smoke & Hope USPSA Apr 22 2017","match_date":"2017-04-22","stage_classifiercode":"99-12","member_number":"L3916","first_name":"TAMI","last_name":"WAITE","classification":"C","division":"OPEN","hit_factor":3.9216},{"match_name":"LIPSA - April 30th 2017 - USPSA Match Special Classifier","match_date":"2017-04-30","stage_classifiercode":"99-12","member_number":"TY85181","first_name":"JEFF","last_name":"MELWORM","classification":"C","division":"OPEN","hit_factor":3.9216},{"match_name":"PIPS 06-14-2017","match_date":"2017-06-14","stage_classifiercode":"99-12","member_number":"A81396","first_name":"TERRY","last_name":"ESTREM","classification":"C","division":"OPEN","hit_factor":3.9216},{"match_name":"HPS September Club Fun Shoot","match_date":"2018-09-01","stage_classifiercode":"99-12","member_number":"TY95612","first_name":"NICK","last_name":"DOMINGO","classification":"C","division":"OPEN","hit_factor":3.9071},{"match_name":"Richmond Hot Shots USPSA Classifier Match Sat April 8-2017","match_date":"2017-04-08","stage_classifiercode":"99-12","member_number":"TY86792","first_name":"MARVIN","last_name":"ESPINO","classification":"U","division":"OPEN","hit_factor":3.9057},{"match_name":"Colonial Rifle and Pistol Club June 2018 Special Classifier","match_date":"2018-06-02","stage_classifiercode":"99-12","member_number":"A83515","first_name":"JAMES","last_name":"VALERIANO","classification":"D","division":"OPEN","hit_factor":3.8989},{"match_name":"Piscataqua  Master Blasters USPSA Special Classifier","match_date":"2017-12-03","stage_classifiercode":"99-12","member_number":"A4665","first_name":"MD-LIGHTNIN' LARRY","last_name":"HUSSEY","classification":"A","division":"OPEN","hit_factor":3.8986},{"match_name":"WTPS USPSA April Classifier Match 4-8-17","match_date":"2017-04-08","stage_classifiercode":"99-12","member_number":"A92463","first_name":"DAN","last_name":"STABER","classification":"U","division":"OPEN","hit_factor":3.8835},{"match_name":"Paul Bunyan April 7th-8th All Classifier Match NW01","match_date":"2018-04-07","stage_classifiercode":"99-12","member_number":"TY97470","first_name":"DENNIS","last_name":"MAHLE","classification":"B","division":"OPEN","hit_factor":3.8669},{"match_name":"HRRB 5-20-2017","match_date":"2017-05-20","stage_classifiercode":"99-12","member_number":"FY87328","first_name":"JIMRIZ","last_name":"ANCHETA","classification":"U","division":"OPEN","hit_factor":3.8644},{"match_name":"Payson Practical Pistol Sept 03 2016","match_date":"2016-09-03","stage_classifiercode":"99-12","member_number":"A80039","first_name":"STEPHEN","last_name":"STEPHENS","classification":"C","division":"OPEN","hit_factor":3.8589},{"match_name":"SPSA USPSA March 4th Sat match","match_date":"2017-03-25","stage_classifiercode":"99-12","member_number":"TY67776","first_name":"NICK","last_name":"ORTALAZA","classification":"B","division":"OPEN","hit_factor":3.8521},{"match_name":"OFGC USPSA Match Feb 19th 2017","match_date":"2017-02-19","stage_classifiercode":"99-12","member_number":"TY34745","first_name":"KEITH","last_name":"HAMMOND","classification":"B","division":"OPEN","hit_factor":3.8503},{"match_name":"SCCPSA USPSA Mar 17","match_date":"2018-03-17","stage_classifiercode":"99-12","member_number":"FY56443","first_name":"ART","last_name":"LEE","classification":"C","division":"OPEN","hit_factor":3.8432},{"match_name":"Chillicothe May-2017 USPSA Match","match_date":"2017-05-28","stage_classifiercode":"99-12","member_number":"TY91334","first_name":"BILL","last_name":"SIDELL","classification":"B","division":"OPEN","hit_factor":3.8356},{"match_name":"DCPA USPSA 9-11-2016","match_date":"2016-09-09","stage_classifiercode":"99-12","member_number":"FY73895","first_name":"GERRY","last_name":"MAGALONA","classification":"C","division":"OPEN","hit_factor":3.8306},{"match_name":"HRRB 3-5-16","match_date":"2016-03-05","stage_classifiercode":"99-12","member_number":"\"\"","first_name":"BOBBY","last_name":"REGALARIO","classification":"U","division":"OPEN","hit_factor":3.8244},{"match_name":"Maine Practical Shooters May 2018","match_date":"2018-05-12","stage_classifiercode":"99-12","member_number":"A109219","first_name":"BRANDON","last_name":"TRUNDY","classification":"U","division":"OPEN","hit_factor":3.8174},{"match_name":"Richmond Hot Shots February 7-2016 USPSA Match","match_date":"2016-02-07","stage_classifiercode":"99-12","member_number":"TY79621","first_name":"STEPHEN","last_name":"COLLEN","classification":"U","division":"OPEN","hit_factor":3.8162},{"match_name":"DWB - Deadwood Boys USPSA 18 February 2018","match_date":"2018-02-18","stage_classifiercode":"99-12","member_number":"A104962","first_name":"JERRY","last_name":"ESPINA","classification":"U","division":"OPEN","hit_factor":3.8156},{"match_name":"SFPS 05-21-17 Superclassifier Gun1","match_date":"2017-05-21","stage_classifiercode":"99-12","member_number":"TY72577","first_name":"RANDY","last_name":"BALLARD","classification":"B","division":"OPEN","hit_factor":3.8095},{"match_name":"CVSC 06-25-2017","match_date":"2017-06-25","stage_classifiercode":"99-12","member_number":"TY96532","first_name":"ALLAN","last_name":"WEBSTER","classification":"C","division":"OPEN","hit_factor":3.8033},{"match_name":"COPS Feb 2017 USPSA Match","match_date":"2017-02-05","stage_classifiercode":"99-12","member_number":"A93058","first_name":"BRUCE","last_name":"CURRY","classification":"U","division":"OPEN","hit_factor":3.7975},{"match_name":"LIPSA - November 4th 2018 - USPSA Classifier Match","match_date":"2018-11-04","stage_classifiercode":"99-12","member_number":"TY82399","first_name":"JAMES","last_name":"BYRNE","classification":"B","division":"OPEN","hit_factor":3.7901},{"match_name":"DWB - Deadwood Boys USPSA 18 February 2018","match_date":"2018-02-18","stage_classifiercode":"99-12","member_number":"A103264","first_name":"ALEXIS","last_name":"AFAGHI","classification":"U","division":"OPEN","hit_factor":3.7843},{"match_name":"BHPSC Monthly Match - Feb 2020","match_date":"2020-02-29","stage_classifiercode":"99-12","member_number":"TY78821","first_name":"STEVE","last_name":"GIRARD","classification":"C","division":"OPEN","hit_factor":3.7696},{"match_name":"Piscataqua  Master Blasters USPSA Special Classifier","match_date":"2017-12-03","stage_classifiercode":"99-12","member_number":"A103213","first_name":"TIM","last_name":"LEVESQUE","classification":"U","division":"OPEN","hit_factor":3.7601},{"match_name":"USPSA","match_date":"2018-04-28","stage_classifiercode":"99-12","member_number":"\"\"","first_name":"ROBERT","last_name":"WESTENDORF","classification":"\"\"","division":"OPEN","hit_factor":3.7559},{"match_name":"BRSP Tuesday Night USPSA Match - Nov 14","match_date":"2017-11-15","stage_classifiercode":"99-12","member_number":"A104411","first_name":"TANK","last_name":"ALBANIL","classification":"\"\"","division":"OPEN","hit_factor":3.7365},{"match_name":"ENPS May 2018 USPSA Match","match_date":"2018-05-06","stage_classifiercode":"99-12","member_number":"TY50574","first_name":"KENNETH","last_name":"YOUNG","classification":"D","division":"OPEN","hit_factor":3.7242},{"match_name":"WSPS OCTOBER 2017 USPSA MATCH","match_date":"2017-10-21","stage_classifiercode":"99-12","member_number":"TY76180","first_name":"JIM","last_name":"HAUER","classification":"C","division":"OPEN","hit_factor":3.7227},{"match_name":"Colonial Rifle and Pistol Club June 2018 Special Classifier","match_date":"2018-06-02","stage_classifiercode":"99-12","member_number":"FY92775","first_name":"CLIFFORD","last_name":"AVERSANO SR","classification":"D","division":"OPEN","hit_factor":3.709},{"match_name":"Colonial Rifle and Pistol Club June 2018 Special Classifier","match_date":"2018-06-02","stage_classifiercode":"99-12","member_number":"A111239","first_name":"GENE","last_name":"RAGUCCI","classification":"U","division":"OPEN","hit_factor":3.7008},{"match_name":"Richmond Hot Shots February 7-2016 USPSA Match","match_date":"2016-02-07","stage_classifiercode":"99-12","member_number":"A92465","first_name":"JOSE","last_name":"RAPADAS","classification":"U","division":"OPEN","hit_factor":3.6721},{"match_name":"LdF USPSA Match July 14 2018","match_date":"2018-07-14","stage_classifiercode":"99-12","member_number":"\"\"","first_name":"ROGER","last_name":"HOLDMAN","classification":"U","division":"OPEN","hit_factor":3.6671},{"match_name":"MCPSL Pistol 4-9-16","match_date":"2016-04-09","stage_classifiercode":"99-12","member_number":"ty43257","first_name":"FRED","last_name":"NOBLE","classification":"C","division":"OPEN","hit_factor":3.6474},{"match_name":"HRRB 3-5-16","match_date":"2016-03-05","stage_classifiercode":"99-12","member_number":"\"\"","first_name":"NICK","last_name":"DOMINGO","classification":"X","division":"OPEN","hit_factor":3.6364},{"match_name":"H&H June Match","match_date":"2016-06-26","stage_classifiercode":"99-12","member_number":"TY69238","first_name":"TONY","last_name":"WALL","classification":"B","division":"OPEN","hit_factor":3.6284},{"match_name":"OK15 USPSA at USSA","match_date":"2017-12-10","stage_classifiercode":"99-12","member_number":"A71435","first_name":"FEEGEE","last_name":"MATLOCK","classification":"A","division":"OPEN","hit_factor":3.6145},{"match_name":"SSS USPSA February 2020","match_date":"2020-02-16","stage_classifiercode":"99-12","member_number":"TY94159","first_name":"LINDEN","last_name":"BURNSTEIN","classification":"C (C Class)","division":"OPEN","hit_factor":3.6113},{"match_name":"Shoot GTR USPSA 11/6","match_date":"2016-11-06","stage_classifiercode":"99-12","member_number":"TY69089","first_name":"MATT","last_name":"MITCHELL","classification":"A","division":"OPEN","hit_factor":3.6025},{"match_name":"SFPC September USPSA Special Classifier match","match_date":"2016-09-04","stage_classifiercode":"99-12","member_number":"ty31514","first_name":"WARREN","last_name":"ROSEN","classification":"C","division":"OPEN","hit_factor":3.5995},{"match_name":"MPPL USPSA Match 01072017","match_date":"2017-01-07","stage_classifiercode":"99-12","member_number":"A91584","first_name":"JACEN","last_name":"CEREDON","classification":"X","division":"OPEN","hit_factor":3.5819},{"match_name":"WPS USPSA Monthly Match September 2018","match_date":"2018-09-01","stage_classifiercode":"99-12","member_number":"FY29046","first_name":"DEAN","last_name":"BROWN","classification":"B","division":"OPEN","hit_factor":3.58},{"match_name":"Chillicothe May-2017 USPSA Match","match_date":"2017-05-28","stage_classifiercode":"99-12","member_number":"L3709","first_name":"TONY","last_name":"WICKENHEISER","classification":"C","division":"OPEN","hit_factor":3.5782},{"match_name":"SFPC September USPSA Special Classifier match","match_date":"2016-09-04","stage_classifiercode":"99-12","member_number":"A93270","first_name":"EDDIE","last_name":"RIVERA","classification":"C","division":"OPEN","hit_factor":3.578},{"match_name":"Hosemasters  3rd Sunday Feburary 2017","match_date":"2017-02-12","stage_classifiercode":"99-12","member_number":"TY33569","first_name":"WALTER","last_name":"KRADIN","classification":"C","division":"OPEN","hit_factor":3.5714},{"match_name":"CGC 2017_05_13","match_date":"2017-05-13","stage_classifiercode":"99-12","member_number":"A97367","first_name":"JOHN","last_name":"FABIAN","classification":"D","division":"OPEN","hit_factor":3.5644},{"match_name":"MCPSL Pistol 4-8-17","match_date":"2017-04-08","stage_classifiercode":"99-12","member_number":"TY37712","first_name":"AUDRA","last_name":"GOYETTE","classification":"D","division":"OPEN","hit_factor":3.539},{"match_name":"Brothers N Arms February 2018 USPSA Match","match_date":"2018-02-17","stage_classifiercode":"99-12","member_number":"TY99308","first_name":"GEORGE","last_name":"MILLER","classification":"U","division":"OPEN","hit_factor":3.5366},{"match_name":"Hosemasters  3rd Sunday Feburary 2017","match_date":"2017-02-12","stage_classifiercode":"99-12","member_number":"\"\"","first_name":"CLAY","last_name":"THORMODSGARD","classification":"D","division":"OPEN","hit_factor":3.504},{"match_name":"Atlanta Practical Shooters March 2016 USPSA - Classifier Match","match_date":"2016-03-06","stage_classifiercode":"99-12","member_number":"a36675","first_name":"ROBERT","last_name":"SINCLAIR SR","classification":"C","division":"OPEN","hit_factor":3.5038},{"match_name":"FBURG April 2017 Level I USPSA ","match_date":"2017-04-01","stage_classifiercode":"99-12","member_number":"PEN","first_name":"CURT","last_name":"SALTER","classification":"U","division":"OPEN","hit_factor":3.4819},{"match_name":"MCPSL Pistol 4-9-16","match_date":"2016-04-09","stage_classifiercode":"99-12","member_number":"Fy48525","first_name":"DAVID","last_name":"KOVAC","classification":"B","division":"OPEN","hit_factor":3.4813},{"match_name":"11 March Classifier Match","match_date":"2018-03-10","stage_classifiercode":"99-12","member_number":"A107689","first_name":"BRANDON","last_name":"ZIMMERMANN","classification":"\"\"","division":"OPEN","hit_factor":3.4773},{"match_name":"Colonial Rifle and Pistol Club June 2018 Special Classifier","match_date":"2018-06-02","stage_classifiercode":"99-12","member_number":"A109293","first_name":"DANNY","last_name":"LEE","classification":"U","division":"OPEN","hit_factor":3.4736},{"match_name":"Danville Rifle and Pistol Club USPSA IL17 April 21 2018","match_date":"2018-04-21","stage_classifiercode":"99-12","member_number":"\"\"","first_name":"TERRY","last_name":"DINES","classification":"U","division":"OPEN","hit_factor":3.4653},{"match_name":"TAC2 USPSA August 2017","match_date":"2017-08-05","stage_classifiercode":"99-12","member_number":"\"\"","first_name":"JOHN","last_name":"KENNEDY 2G","classification":"U","division":"OPEN","hit_factor":3.4582},{"match_name":"XMG USPSA   Saturday September  4th 2021","match_date":"2021-09-04","stage_classifiercode":"99-12","member_number":"Ty82289","first_name":"JEREMY","last_name":"DYER","classification":"B","division":"OPEN","hit_factor":3.4537},{"match_name":"Colonial Rifle and Pistol Club June 2018 Special Classifier","match_date":"2018-06-02","stage_classifiercode":"99-12","member_number":"A74383","first_name":"PAUL","last_name":"ROBINSON","classification":"U","division":"OPEN","hit_factor":3.4505},{"match_name":"Nampa USPSA February 1st","match_date":"2020-02-01","stage_classifiercode":"99-12","member_number":"A84438","first_name":"TYSON","last_name":"DIXON","classification":"D","division":"OPEN","hit_factor":3.4483},{"match_name":"Laser Ninja Dragon League USPSA August 2017","match_date":"2017-08-06","stage_classifiercode":"99-12","member_number":"A73178","first_name":"JOE","last_name":"WILLIS","classification":"A","division":"OPEN","hit_factor":3.4439},{"match_name":"GCL December 12-2-17","match_date":"2017-12-02","stage_classifiercode":"99-12","member_number":"TY30343","first_name":"BILL","last_name":"KRYSTAN","classification":"B","division":"OPEN","hit_factor":3.4431},{"match_name":"SFPC September USPSA Special Classifier match","match_date":"2016-09-04","stage_classifiercode":"99-12","member_number":"TY94466","first_name":"JORGE","last_name":"MARSAL","classification":"U","division":"OPEN","hit_factor":3.4413},{"match_name":"ENPS May 2018 USPSA Match","match_date":"2018-05-06","stage_classifiercode":"99-12","member_number":"\"\"","first_name":"ALLEN","last_name":"MCCREA","classification":"U","division":"OPEN","hit_factor":3.4348},{"match_name":"Triforce Practical Shooters at BigWoodsGoods","match_date":"2016-09-22","stage_classifiercode":"99-12","member_number":"A-80964","first_name":"MICHAEL","last_name":"DUPUIS","classification":"U","division":"OPEN","hit_factor":3.4276},{"match_name":"YMM IPSC02 2016_09_11","match_date":"2016-09-11","stage_classifiercode":"99-12","member_number":"\"\"","first_name":"JORDAN","last_name":"MUNK","classification":"U","division":"OPEN","hit_factor":3.4218},{"match_name":"OFGC USPSA Match 10-21-18","match_date":"2018-10-21","stage_classifiercode":"99-12","member_number":"\"\"","first_name":"TRAVIS","last_name":"MENDEZ","classification":"U","division":"OPEN","hit_factor":3.4175},{"match_name":"Nampa USPSA February 1st","match_date":"2020-02-01","stage_classifiercode":"99-12","member_number":"L4252","first_name":"GALE","last_name":"BREITKREUTZ","classification":"C","division":"OPEN","hit_factor":3.3977},{"match_name":"LdF USPSA Match July 14 2018","match_date":"2018-07-14","stage_classifiercode":"99-12","member_number":"\"\"","first_name":"STEVE","last_name":"BENCE","classification":"C","division":"OPEN","hit_factor":3.3776},{"match_name":"ECPS USPSA 17 Feb 18","match_date":"2018-02-16","stage_classifiercode":"99-12","member_number":"A34304","first_name":"DON","last_name":"DUBOSE","classification":"M","division":"OPEN","hit_factor":3.3699},{"match_name":"MPPL USPSA Match 01072017","match_date":"2017-01-07","stage_classifiercode":"99-12","member_number":"TY68195","first_name":"JESSIE","last_name":"VISCONDE","classification":"B","division":"OPEN","hit_factor":3.3632},{"match_name":"LIPSA - April 30th 2017 - USPSA Match Special Classifier","match_date":"2017-04-30","stage_classifiercode":"99-12","member_number":"TY20395","first_name":"LEO","last_name":"PRIMERO","classification":"B","division":"OPEN","hit_factor":3.3566},{"match_name":"ENPS May 2018 USPSA Match","match_date":"2018-05-06","stage_classifiercode":"99-12","member_number":"\"\"","first_name":"BOB","last_name":"MCKELCEY","classification":"U","division":"OPEN","hit_factor":3.3386},{"match_name":"AAPS AAFG Special Classifier Match - March 31 2018","match_date":"2018-03-31","stage_classifiercode":"99-12","member_number":"TY49425","first_name":"MARK","last_name":"SILVERMAN","classification":"C","division":"OPEN","hit_factor":3.338},{"match_name":"Minnetonka Game And Fish May 23","match_date":"2018-05-23","stage_classifiercode":"99-12","member_number":"Fy51432","first_name":"FRANK","last_name":"SKOG","classification":"C","division":"OPEN","hit_factor":3.3308},{"match_name":"Richmond Hot Shots February 7-2016 USPSA Match","match_date":"2016-02-07","stage_classifiercode":"99-12","member_number":"TY61608","first_name":"BOB","last_name":"RAO","classification":"C","division":"OPEN","hit_factor":3.3298},{"match_name":"WNPL USPSA - Labour Day Weekend - Sept 2017","match_date":"2017-09-02","stage_classifiercode":"99-12","member_number":"L2908","first_name":"JONNY","last_name":"LIM","classification":"A","division":"OPEN","hit_factor":3.3271},{"match_name":"Ducky Shoot August","match_date":"2018-08-18","stage_classifiercode":"99-12","member_number":"TY-99800","first_name":"DAWSON","last_name":"MATTER","classification":"U","division":"OPEN","hit_factor":3.3233},{"match_name":"TPS USPSA PISTOL - May 2016 - Talon Range","match_date":"2016-05-07","stage_classifiercode":"99-12","member_number":"a95513","first_name":"AJ","last_name":"ZOGHBI","classification":"U","division":"OPEN","hit_factor":3.2813},{"match_name":"NISA April Classifer Match 2016","match_date":"2016-04-24","stage_classifiercode":"99-12","member_number":"A76615","first_name":"VIRGIL","last_name":"CORRO","classification":"U","division":"OPEN","hit_factor":3.2777},{"match_name":"OFGC USPSA Match Feb 19th 2017","match_date":"2017-02-19","stage_classifiercode":"99-12","member_number":"TY94217","first_name":"DUSTIN","last_name":"CHAMBERLAIN","classification":"C","division":"OPEN","hit_factor":3.2609},{"match_name":"Hosemasters  3rd Sunday Feburary 2017","match_date":"2017-02-12","stage_classifiercode":"99-12","member_number":"TY28856","first_name":"PHILLIP","last_name":"GALLEGOS","classification":"A","division":"OPEN","hit_factor":3.2407},{"match_name":"Richmond Hot Shots February 7-2016 USPSA Match","match_date":"2016-02-07","stage_classifiercode":"99-12","member_number":"A83436","first_name":"\"MOACIR. \"\" MO \"\"\"","last_name":"RAMOS","classification":"C","division":"OPEN","hit_factor":3.2374},{"match_name":"Richmond Hot Shots February 7-2016 USPSA Match","match_date":"2016-02-07","stage_classifiercode":"99-12","member_number":"A64949","first_name":"HIROSHI","last_name":"TAKAMA","classification":"C","division":"OPEN","hit_factor":3.233},{"match_name":"HRRB 5-20-2017","match_date":"2017-05-20","stage_classifiercode":"99-12","member_number":"\"\"","first_name":"DOMINIC","last_name":"DUMBRIQUE","classification":"X","division":"OPEN","hit_factor":3.2277},{"match_name":"Powell County Action Shooters July 17 2021","match_date":"2021-07-17","stage_classifiercode":"99-12","member_number":"A102386","first_name":"LLOYD","last_name":"HEFFERNAN","classification":"U","division":"OPEN","hit_factor":3.2162},{"match_name":"Hosemasters  3rd Sunday Feburary 2017","match_date":"2017-02-12","stage_classifiercode":"99-12","member_number":"\"\"","first_name":"BOB","last_name":"CLARK","classification":"U","division":"OPEN","hit_factor":3.2129},{"match_name":"HRRB 5-20-2017","match_date":"2017-05-20","stage_classifiercode":"99-12","member_number":"FY66771","first_name":"ORLINO","last_name":"CARDENAS","classification":"C","division":"OPEN","hit_factor":3.1797},{"match_name":"GCL December 12-2-17","match_date":"2017-12-02","stage_classifiercode":"99-12","member_number":"A102572","first_name":"DAVE","last_name":"WILDE","classification":"C","division":"OPEN","hit_factor":3.1526},{"match_name":"Brothers N Arms February 2018 USPSA Match","match_date":"2018-02-17","stage_classifiercode":"99-12","member_number":"A100694","first_name":"MICHAEL","last_name":"BROLASKI","classification":"C","division":"OPEN","hit_factor":3.1447},{"match_name":"Henry Coumty Gun Club USPSA","match_date":"2021-05-15","stage_classifiercode":"99-12","member_number":"TY107557","first_name":"GRANT","last_name":"LAIRD","classification":"C","division":"OPEN","hit_factor":3.125},{"match_name":"Springfield Tactical Shooters 09/03/2020","match_date":"2020-09-03","stage_classifiercode":"99-12","member_number":"FY95946","first_name":"PAUL","last_name":"EMERY","classification":"B","division":"OPEN","hit_factor":3.1204},{"match_name":"Shongum April 2017 USPSA Match","match_date":"2017-04-01","stage_classifiercode":"99-12","member_number":"\"\"","first_name":"KEVIN","last_name":"COLQUHOUN","classification":"U","division":"OPEN","hit_factor":3.1103},{"match_name":"CASA Classifier match April 2018","match_date":"2018-04-08","stage_classifiercode":"99-12","member_number":"L4462","first_name":"JIM","last_name":"FOWLER","classification":"A","division":"OPEN","hit_factor":3.1065},{"match_name":"FPS USPSA April2017","match_date":"2017-04-02","stage_classifiercode":"99-12","member_number":"TY85181","first_name":"JEFF M","last_name":"MELWORM","classification":"C","division":"OPEN","hit_factor":3.0861},{"match_name":"Piscataqua  Master Blasters USPSA Special Classifier","match_date":"2017-12-03","stage_classifiercode":"99-12","member_number":"A656","first_name":"DAVID","last_name":"TRAHAN","classification":"U","division":"OPEN","hit_factor":3.0797},{"match_name":"OFGC Practical Pistol Match Jan 17 2016","match_date":"2016-01-17","stage_classifiercode":"99-12","member_number":"A79174","first_name":"BRIXEY","last_name":"NELSON","classification":"B","division":"OPEN","hit_factor":3.0667},{"match_name":"GRPC USPSA MARCH MAD HATTER","match_date":"2018-03-02","stage_classifiercode":"99-12","member_number":"A94852","first_name":"RANDY","last_name":"GOODNEY","classification":"A","division":"OPEN","hit_factor":3.0612},{"match_name":"Maine Practical Shooters May 2018","match_date":"2018-05-12","stage_classifiercode":"99-12","member_number":"A106194","first_name":"NICK","last_name":"BEAL","classification":"C","division":"OPEN","hit_factor":3.0601},{"match_name":"MCPSL Pistol 4-8-17","match_date":"2017-04-08","stage_classifiercode":"99-12","member_number":"TY15566","first_name":"KEN","last_name":"RICKEY","classification":"C","division":"OPEN","hit_factor":3.0583},{"match_name":"OFGC USPSA Match Feb 19th 2017","match_date":"2017-02-19","stage_classifiercode":"99-12","member_number":"A92627","first_name":"CHRIS","last_name":"YATES","classification":"U","division":"OPEN","hit_factor":3.0405},{"match_name":"LCSA USPSA ALL CLASSIFIER ","match_date":"2018-06-30","stage_classifiercode":"99-12","member_number":"L2555","first_name":"TERRY","last_name":"HALDIN","classification":"C","division":"OPEN","hit_factor":3.0227},{"match_name":"ECPS USPSA 17 Feb 18","match_date":"2018-02-16","stage_classifiercode":"99-12","member_number":"\"\"","first_name":"JOHN","last_name":"CUMMINGS","classification":"U","division":"OPEN","hit_factor":3.0168},{"match_name":"MSSA Uspsa Match","match_date":"2017-04-08","stage_classifiercode":"99-12","member_number":"TY34082","first_name":"ADELO","last_name":"AQUINO","classification":"A","division":"OPEN","hit_factor":3.0146},{"match_name":"Palmetto Gun Club - February 2018 USPSA","match_date":"2018-02-03","stage_classifiercode":"99-12","member_number":"\"\"","first_name":"TY","last_name":"LAFRAMBOISE","classification":"U","division":"OPEN","hit_factor":3.0084},{"match_name":"Southern Arizona Practical Shooters 05_5_18","match_date":"2018-05-05","stage_classifiercode":"99-12","member_number":"a104976","first_name":"MARCOS 1","last_name":"DIAZ","classification":"C","division":"OPEN","hit_factor":3.0009},{"match_name":"EIPS  1/19/2017","match_date":"2017-01-19","stage_classifiercode":"99-12","member_number":"TY68681","first_name":"LAURA","last_name":"MARTIN","classification":"U","division":"OPEN","hit_factor":2.9947},{"match_name":"Pinetucky USPSA 11-19-16","match_date":"2016-11-19","stage_classifiercode":"99-12","member_number":"\"\"","first_name":"ERIK","last_name":"JENSEN JR","classification":"U","division":"OPEN","hit_factor":2.9851},{"match_name":"SFPC March USPSA Match 2017","match_date":"2017-03-05","stage_classifiercode":"99-12","member_number":"\"\"","first_name":"BRESLY","last_name":"JARAMILLO","classification":"C","division":"OPEN","hit_factor":2.9703},{"match_name":"WNPL USPSA - Labour Day Weekend - Sept 2017","match_date":"2017-09-02","stage_classifiercode":"99-12","member_number":"L1542","first_name":"JEFF","last_name":"IGNATOVICH","classification":"C","division":"OPEN","hit_factor":2.9616},{"match_name":"Pelham USPSA 2016-09-18","match_date":"2016-09-18","stage_classifiercode":"99-12","member_number":"TY43644","first_name":"JEFFREY","last_name":"BRENNAN","classification":"C","division":"OPEN","hit_factor":2.957},{"match_name":"CGC 2017_05_13","match_date":"2017-05-13","stage_classifiercode":"99-12","member_number":"A94603","first_name":"RONALDO","last_name":"BORGES","classification":"B","division":"OPEN","hit_factor":2.938},{"match_name":"Griffin USPSA Match Aug 2017","match_date":"2017-08-19","stage_classifiercode":"99-12","member_number":"TY60177","first_name":"CARL","last_name":"RAINEY","classification":"C","division":"OPEN","hit_factor":2.9197},{"match_name":"MPPL USPSA Match 01072017","match_date":"2017-01-07","stage_classifiercode":"99-12","member_number":"A95612","first_name":"NICK","last_name":"DOMINGO","classification":"C","division":"OPEN","hit_factor":2.8889},{"match_name":"Piscataqua  Master Blasters USPSA Special Classifier","match_date":"2017-12-03","stage_classifiercode":"99-12","member_number":"A106886","first_name":"AARON","last_name":"VIGNEAULT","classification":"U","division":"OPEN","hit_factor":2.8835},{"match_name":"RangeMasters 12-17-2015","match_date":"2015-12-17","stage_classifiercode":"99-12","member_number":"\"\"","first_name":"RANDY","last_name":"GOODNEY","classification":"U","division":"OPEN","hit_factor":2.8571},{"match_name":"OFGC USPSA Match Feb 19th 2017","match_date":"2017-02-19","stage_classifiercode":"99-12","member_number":"TY73010","first_name":"KYLE","last_name":"SAYRE","classification":"B","division":"OPEN","hit_factor":2.8497},{"match_name":"NTPS-SE August 2016","match_date":"2016-08-20","stage_classifiercode":"99-12","member_number":"A97492","first_name":"NATHAN","last_name":"PAYNE","classification":"U","division":"OPEN","hit_factor":2.8458},{"match_name":"GMPS 5/7/17","match_date":"2017-05-06","stage_classifiercode":"99-12","member_number":"TY67027","first_name":"DOMINIQUE","last_name":"LAFOND","classification":"D","division":"OPEN","hit_factor":2.844},{"match_name":"Rockcastle USPSA Nov 28 2015","match_date":"2015-11-28","stage_classifiercode":"99-12","member_number":"A81793","first_name":"RICKEY","last_name":"BRAZLE","classification":"U","division":"OPEN","hit_factor":2.8243},{"match_name":"SFPC March USPSA Match 2017","match_date":"2017-03-05","stage_classifiercode":"99-12","member_number":"TY73854","first_name":"BARRY","last_name":"BERGER","classification":"U","division":"OPEN","hit_factor":2.8209},{"match_name":"PCGC  June 2017","match_date":"2017-06-25","stage_classifiercode":"99-12","member_number":"A103069","first_name":"CHANCE","last_name":"BILLINGS","classification":"U","division":"OPEN","hit_factor":2.8196},{"match_name":"Southern Arizona Practical Shooters 05_5_18","match_date":"2018-05-05","stage_classifiercode":"99-12","member_number":"a104976","first_name":"MARCOS 2","last_name":"DIAZ","classification":"C","division":"OPEN","hit_factor":2.8067},{"match_name":"Atlanta Practical Shooters March 2016 USPSA - Classifier Match","match_date":"2016-03-06","stage_classifiercode":"99-12","member_number":"a82013","first_name":"ELIJAH","last_name":"SABA","classification":"C","division":"OPEN","hit_factor":2.8065},{"match_name":"HRRB 3-5-16","match_date":"2016-03-05","stage_classifiercode":"99-12","member_number":"A95131","first_name":"LILY","last_name":"BALINO","classification":"X","division":"OPEN","hit_factor":2.8037},{"match_name":"LdF 4th Saturday Match","match_date":"2016-01-23","stage_classifiercode":"99-12","member_number":"\"\"","first_name":"LONNIE","last_name":"BARBANI","classification":"U","division":"OPEN","hit_factor":2.7721},{"match_name":"Richmond Hot Shots February 7-2016 USPSA Match","match_date":"2016-02-07","stage_classifiercode":"99-12","member_number":"A90183","first_name":"GABRIELLE","last_name":"LOPEZ","classification":"B","division":"OPEN","hit_factor":2.7716},{"match_name":"Springfield Tactical Shooters 06-07-2018","match_date":"2018-06-07","stage_classifiercode":"99-12","member_number":"A30365","first_name":"ED","last_name":"TRIBBLE","classification":"A","division":"OPEN","hit_factor":2.7711},{"match_name":"Range E11even Feb 2018 USPSA","match_date":"2018-02-24","stage_classifiercode":"99-12","member_number":"TY90912","first_name":"TJ","last_name":"YARBROUGH","classification":"U","division":"OPEN","hit_factor":2.7647},{"match_name":"Pelham USPSA 2016-09-18","match_date":"2016-09-18","stage_classifiercode":"99-12","member_number":"\"\"","first_name":"ELIJAH","last_name":"SHALOME","classification":"Unclassified","division":"OPEN","hit_factor":2.7441},{"match_name":"APSA February 2017 USPSA Match","match_date":"2017-02-11","stage_classifiercode":"99-12","member_number":"A92556","first_name":"JOHN","last_name":"NELSON","classification":"D","division":"OPEN","hit_factor":2.7439},{"match_name":"North Mountain July ","match_date":"2016-07-17","stage_classifiercode":"99-12","member_number":"A76608","first_name":"BRUCE","last_name":"ADAMS","classification":"B","division":"OPEN","hit_factor":2.7167},{"match_name":"Brothers N Arms February 2018 USPSA Match","match_date":"2018-02-17","stage_classifiercode":"99-12","member_number":"TY76693","first_name":"LEE","last_name":"FRAISER","classification":"C","division":"OPEN","hit_factor":2.6891},{"match_name":"Triforce Practical Shooters at BigWoodsGoods","match_date":"2016-09-22","stage_classifiercode":"99-12","member_number":"A94721","first_name":"BOB","last_name":"MCCOLL","classification":"D","division":"OPEN","hit_factor":2.6684},{"match_name":"USPSA","match_date":"2018-04-28","stage_classifiercode":"99-12","member_number":"\"\"","first_name":"KENNY","last_name":"THORSTENSON","classification":"\"\"","division":"OPEN","hit_factor":2.6618},{"match_name":"Springfield Tactical Shooters 06-07-2018","match_date":"2018-06-07","stage_classifiercode":"99-12","member_number":"L1467","first_name":"CHARLES","last_name":"MORSE","classification":"B","division":"OPEN","hit_factor":2.6362},{"match_name":"DWB - Deadwood Boys USPSA 18 February 2018","match_date":"2018-02-18","stage_classifiercode":"99-12","member_number":"\"\"","first_name":"IS","last_name":"ANGELES","classification":"U","division":"OPEN","hit_factor":2.635},{"match_name":"Rio Grande Practical Shooters - December 2016","match_date":"2016-12-03","stage_classifiercode":"99-12","member_number":"TY38613","first_name":"THOMAS R","last_name":"CAMPBELL","classification":"B","division":"OPEN","hit_factor":2.6224},{"match_name":"FPS USPSA April2017","match_date":"2017-04-02","stage_classifiercode":"99-12","member_number":"L2823","first_name":"DANNY","last_name":"GAMBELLA","classification":"B","division":"OPEN","hit_factor":2.6087},{"match_name":"ECPS USPSA 17 Feb 18","match_date":"2018-02-16","stage_classifiercode":"99-12","member_number":"\"\"","first_name":"CHRIS","last_name":"GOAD","classification":"U","division":"OPEN","hit_factor":2.5615},{"match_name":"PCGC  June 2017","match_date":"2017-06-25","stage_classifiercode":"99-12","member_number":"L4192","first_name":"ROBERT","last_name":"STOEHR","classification":"C","division":"OPEN","hit_factor":2.5267},{"match_name":"Prescott 3rd Sunday USPSA 11-20-2016","match_date":"2016-11-20","stage_classifiercode":"99-12","member_number":"\"\"","first_name":"LUEL","last_name":"BAYLON","classification":"U","division":"OPEN","hit_factor":2.5165},{"match_name":"WTPS USPSA April Classifier Match 4-8-17","match_date":"2017-04-08","stage_classifiercode":"99-12","member_number":"A-95627","first_name":"RYNN","last_name":"SMITH","classification":"C","division":"OPEN","hit_factor":2.457},{"match_name":"Minnetonka Game And Fish May 23","match_date":"2018-05-23","stage_classifiercode":"99-12","member_number":"A101047","first_name":"CINDY","last_name":"BOEPPLE","classification":"D","division":"OPEN","hit_factor":2.4548},{"match_name":"Danville Rifle and Pistol Club USPSA IL17 April 21 2018","match_date":"2018-04-21","stage_classifiercode":"99-12","member_number":"a95946","first_name":"PAUL","last_name":"EMERY","classification":"D","division":"OPEN","hit_factor":2.454},{"match_name":"OK15 USPSA at USSA","match_date":"2017-12-10","stage_classifiercode":"99-12","member_number":"\"\"","first_name":"PATCHES","last_name":"EASON","classification":"X","division":"OPEN","hit_factor":2.4268},{"match_name":"COPS Feb 2017 USPSA Match","match_date":"2017-02-05","stage_classifiercode":"99-12","member_number":"\"\"","first_name":"AARON","last_name":"SALSMAN","classification":"U","division":"OPEN","hit_factor":2.4136},{"match_name":"ENPS May 2018 USPSA Match","match_date":"2018-05-06","stage_classifiercode":"99-12","member_number":"FY47278","first_name":"KENNETH","last_name":"ANDERSEN","classification":"A","division":"OPEN","hit_factor":2.4045},{"match_name":"RBGC 2018-7-28","match_date":"2018-07-28","stage_classifiercode":"99-12","member_number":"TY111727","first_name":"PAUL","last_name":"VAN OUDHEUSDEN","classification":"U","division":"OPEN","hit_factor":2.3724},{"match_name":"ORSA USPSA October 2016","match_date":"2016-10-15","stage_classifiercode":"99-12","member_number":"L1789","first_name":"ROBERT","last_name":"BALLARD","classification":"C","division":"OPEN","hit_factor":2.3592},{"match_name":"USPSA MO21 Special Classifier 2Alpha SBRC February 27 2021","match_date":"2021-02-27","stage_classifiercode":"99-12","member_number":"TY126537","first_name":"LANE","last_name":"SIMMONS","classification":"U","division":"OPEN","hit_factor":2.3576},{"match_name":"Laser Ninja Dragon League USPSA August 2017","match_date":"2017-08-06","stage_classifiercode":"99-12","member_number":"Ty21646","first_name":"JAMES","last_name":"JONES","classification":"B","division":"OPEN","hit_factor":2.3512},{"match_name":"Paul Bunyan April 7th-8th All Classifier Match NW01","match_date":"2018-04-07","stage_classifiercode":"99-12","member_number":"TY70115","first_name":"DUSTIN","last_name":"TAWATAO","classification":"U","division":"OPEN","hit_factor":2.3333},{"match_name":"CGC 2017_05_13","match_date":"2017-05-13","stage_classifiercode":"99-12","member_number":"A97282","first_name":"RAY","last_name":"RUTLEDGE","classification":"D","division":"OPEN","hit_factor":2.3046},{"match_name":"SSFGA & Master Blasters USPSA Classifier","match_date":"2018-11-17","stage_classifiercode":"99-12","member_number":"A101142","first_name":"HARRY","last_name":"WARREN","classification":"U","division":"OPEN","hit_factor":2.2712},{"match_name":"HRRB 5-20-2017","match_date":"2017-05-20","stage_classifiercode":"99-12","member_number":"TY92048","first_name":"HAROLD","last_name":"DOMINGO","classification":"C","division":"OPEN","hit_factor":2.2665},{"match_name":"GCL December 12-2-17","match_date":"2017-12-02","stage_classifiercode":"99-12","member_number":"A102561","first_name":"RACHEL","last_name":"WILDE","classification":"D","division":"OPEN","hit_factor":2.2575},{"match_name":"MSA USPSA Special Classifier 12-4-16","match_date":"2016-12-04","stage_classifiercode":"99-12","member_number":"TY 28359","first_name":"MIKE","last_name":"FOSTER","classification":"B","division":"OPEN","hit_factor":2.245},{"match_name":"Richmond Hot Shots USPSA Classifier Match Sat April 8-2017","match_date":"2017-04-08","stage_classifiercode":"99-12","member_number":"A95984","first_name":"JOEL","last_name":"GEOFFREY","classification":"U","division":"OPEN","hit_factor":2.2289},{"match_name":"DRRC Dec2016","match_date":"2016-12-03","stage_classifiercode":"99-12","member_number":"L3346","first_name":"FRED","last_name":"FAGUE","classification":"C","division":"OPEN","hit_factor":2.2213},{"match_name":"Colonial Rifle and Pistol Club June 2018 Special Classifier","match_date":"2018-06-02","stage_classifiercode":"99-12","member_number":"A109304","first_name":"ROBERT","last_name":"AGOGLIA","classification":"U","division":"OPEN","hit_factor":2.1767},{"match_name":"GAS Special Classifier","match_date":"2015-09-05","stage_classifiercode":"99-12","member_number":"A86570","first_name":"MIKE","last_name":"MCAULIFFE","classification":"C","division":"OPEN","hit_factor":2.1117},{"match_name":"Henry Coumty Gun Club USPSA","match_date":"2021-05-15","stage_classifiercode":"99-12","member_number":"TY104851","first_name":"ROBERT","last_name":"TILLERY","classification":"B","division":"OPEN","hit_factor":2.097},{"match_name":"USPSA","match_date":"2016-06-04","stage_classifiercode":"99-12","member_number":"\"\"","first_name":"CAROLYN","last_name":"BARNETTE","classification":"U","division":"OPEN","hit_factor":2.0601},{"match_name":"Richmond Hot Shots February 7-2016 USPSA Match","match_date":"2016-02-07","stage_classifiercode":"99-12","member_number":"A85957","first_name":"TRISTAN","last_name":"TOLENTINO","classification":"B","division":"OPEN","hit_factor":2.0593},{"match_name":"ENPS May 2018 USPSA Match","match_date":"2018-05-06","stage_classifiercode":"99-12","member_number":"TY96710","first_name":"ZACHARY","last_name":"BRODER","classification":"U","division":"OPEN","hit_factor":2.0537},{"match_name":"SCCPSA USPSA Mar 17","match_date":"2018-03-17","stage_classifiercode":"99-12","member_number":"A106069","first_name":"ERNESTO","last_name":"FIGUEROA","classification":"U","division":"OPEN","hit_factor":2.0424},{"match_name":"Colonial Rifle and Pistol Club June 2018 Special Classifier","match_date":"2018-06-02","stage_classifiercode":"99-12","member_number":"A35208","first_name":"ALEXIUS","last_name":"GARGANO JR.","classification":"U","division":"OPEN","hit_factor":1.9909},{"match_name":"Griffin USPSA Match Aug 2017","match_date":"2017-08-19","stage_classifiercode":"99-12","member_number":"A98697","first_name":"CRAIG","last_name":"HENDRIX","classification":"C","division":"OPEN","hit_factor":1.9886},{"match_name":"Springfield Tactical Shooters 09/03/2020","match_date":"2020-09-03","stage_classifiercode":"99-12","member_number":"\"\"","first_name":"TONY","last_name":"NUDO","classification":"\"\"","division":"OPEN","hit_factor":1.9776},{"match_name":"Piscataqua  Master Blasters USPSA Special Classifier","match_date":"2017-12-03","stage_classifiercode":"99-12","member_number":"A106852","first_name":"JOSEPH","last_name":"PASSANISI","classification":"U","division":"OPEN","hit_factor":1.9558},{"match_name":"Brothers N Arms February 2018 USPSA Match","match_date":"2018-02-17","stage_classifiercode":"99-12","member_number":"TY65599","first_name":"GALE","last_name":"BUTLER","classification":"B","division":"OPEN","hit_factor":1.9108},{"match_name":"TPS USPSA - September 2016 - Talon Range","match_date":"2016-09-03","stage_classifiercode":"99-12","member_number":"L2734","first_name":"DON","last_name":"GIBSON","classification":"C","division":"OPEN","hit_factor":1.8868},{"match_name":"PCGC  June 2017","match_date":"2017-06-25","stage_classifiercode":"99-12","member_number":"A88347","first_name":"MATT","last_name":"BOWEN","classification":"C","division":"OPEN","hit_factor":1.875},{"match_name":"Green Valley February 2017","match_date":"2017-02-25","stage_classifiercode":"99-12","member_number":"A-36032","first_name":"CATHY","last_name":"ERGOVICH","classification":"C","division":"OPEN","hit_factor":1.8613},{"match_name":"Coastal Area Practical Shooters 10-24-20","match_date":"2020-10-24","stage_classifiercode":"99-12","member_number":"TY82637","first_name":"BUTCH","last_name":"FAULKNER","classification":"U","division":"OPEN","hit_factor":1.8323},{"match_name":"GMPS 5/7/17","match_date":"2017-05-06","stage_classifiercode":"99-12","member_number":"L2938","first_name":"LEE","last_name":"GILLIES","classification":"B","division":"OPEN","hit_factor":1.7972},{"match_name":"HRRB 5-20-2017","match_date":"2017-05-20","stage_classifiercode":"99-12","member_number":"L4015","first_name":"MARK ANGELO","last_name":"BARRANCO","classification":"B","division":"OPEN","hit_factor":1.7834},{"match_name":"SSFGA & Master Blasters USPSA Classifier","match_date":"2018-11-17","stage_classifiercode":"99-12","member_number":"TY115219","first_name":"JOSHUA","last_name":"RICH","classification":"U","division":"OPEN","hit_factor":1.7685},{"match_name":"USPSA MO21 Special Classifier 2Alpha SBRC February 27 2021","match_date":"2021-02-27","stage_classifiercode":"99-12","member_number":"A102640","first_name":"BEAU","last_name":"PHILLIPS","classification":"A","division":"OPEN","hit_factor":1.729},{"match_name":"Gunsmoke Action Shooters USPSA April 18","match_date":"2018-04-07","stage_classifiercode":"99-12","member_number":"\"\"","first_name":"DARRIN","last_name":"CAIN","classification":"U","division":"OPEN","hit_factor":1.7135},{"match_name":"LdF 4th Saturday Match","match_date":"2016-01-23","stage_classifiercode":"99-12","member_number":"TY77491","first_name":"TODD","last_name":"MAO","classification":"U","division":"OPEN","hit_factor":1.703},{"match_name":"FPS USPSA April2017","match_date":"2017-04-02","stage_classifiercode":"99-12","member_number":"A83515","first_name":"JAMES","last_name":"VALERIANO","classification":"D","division":"OPEN","hit_factor":1.6908},{"match_name":"LdF USPSA Match July 14 2018","match_date":"2018-07-14","stage_classifiercode":"99-12","member_number":"A68241","first_name":"FELIX","last_name":"COSTA","classification":"U","division":"OPEN","hit_factor":1.67},{"match_name":"LdF 4th Saturday Match","match_date":"2016-01-23","stage_classifiercode":"99-12","member_number":"FY51774","first_name":"ED","last_name":"CHINCHILLA","classification":"M","division":"OPEN","hit_factor":1.6447},{"match_name":"USPSA","match_date":"2016-06-04","stage_classifiercode":"99-12","member_number":"ty46905","first_name":"HAROLD","last_name":"NORRIS","classification":"B","division":"OPEN","hit_factor":1.6073},{"match_name":"RangeMasters 12-17-2015","match_date":"2015-12-17","stage_classifiercode":"99-12","member_number":"\"\"","first_name":"DANNY","last_name":"NARAMORE","classification":"U","division":"OPEN","hit_factor":1.5744},{"match_name":"BGS NORTH  Week 9","match_date":"2016-03-13","stage_classifiercode":"99-12","member_number":"A90179","first_name":"MICHAEL","last_name":"HALL","classification":"U","division":"OPEN","hit_factor":1.5591},{"match_name":"YMM IPSC02 2016_09_11","match_date":"2016-09-11","stage_classifiercode":"99-12","member_number":"A24900","first_name":"BILL","last_name":"HOOGENDOORN","classification":"B","division":"OPEN","hit_factor":1.5385},{"match_name":"Stock & Barrel MN18 November 2020 USPSA Classifier Match","match_date":"2020-11-01","stage_classifiercode":"99-12","member_number":"A122586","first_name":"RALPH","last_name":"CHU","classification":"U","division":"OPEN","hit_factor":1.5204},{"match_name":"MCPSL Pistol 4-8-17","match_date":"2017-04-08","stage_classifiercode":"99-12","member_number":"PEN","first_name":"JENS","last_name":"SIMPSON","classification":"U","division":"OPEN","hit_factor":1.5075},{"match_name":"Emmett September Match","match_date":"2016-09-24","stage_classifiercode":"99-12","member_number":"fy80359","first_name":"JOHN","last_name":"MCCORD","classification":"C","division":"OPEN","hit_factor":1.4567},{"match_name":"WTPS USPSA April Classifier Match 4-8-17","match_date":"2017-04-08","stage_classifiercode":"99-12","member_number":"\"\"","first_name":"CHAT","last_name":"SAYSON","classification":"U","division":"OPEN","hit_factor":1.3978},{"match_name":"AAPS AAFG Special Classifier Match - March 31 2018","match_date":"2018-03-31","stage_classifiercode":"99-12","member_number":"A81446","first_name":"RANDY","last_name":"RONZITTI","classification":"D","division":"OPEN","hit_factor":1.3751},{"match_name":"Shongum April 2017 USPSA Match","match_date":"2017-04-01","stage_classifiercode":"99-12","member_number":"TY20395","first_name":"LEO","last_name":"PRIMERO","classification":"B","division":"OPEN","hit_factor":1.3717},{"match_name":"Shongum April 2017 USPSA Match","match_date":"2017-04-01","stage_classifiercode":"99-12","member_number":"A87347","first_name":"AUSTIN","last_name":"NEARY","classification":"C","division":"OPEN","hit_factor":1.3631},{"match_name":"EWPSA 2016-04","match_date":"2016-04-17","stage_classifiercode":"99-12","member_number":"TY70904","first_name":"MICHAEL","last_name":"GIMERA","classification":"C","division":"OPEN","hit_factor":1.326},{"match_name":"Atlanta Practical Shooters March 2016 USPSA - Classifier Match","match_date":"2016-03-06","stage_classifiercode":"99-12","member_number":"A83702","first_name":"HUMBERTO","last_name":"VALERO","classification":"B","division":"OPEN","hit_factor":1.3072},{"match_name":"EWPSA 2016-04","match_date":"2016-04-17","stage_classifiercode":"99-12","member_number":"A67259","first_name":"CHAD","last_name":"SHUMAN","classification":"C","division":"OPEN","hit_factor":1.2998},{"match_name":"LIPSA - November 4th 2018 - USPSA Classifier Match","match_date":"2018-11-04","stage_classifiercode":"99-12","member_number":"TY93363","first_name":"DEAN","last_name":"CHASSE","classification":"A","division":"OPEN","hit_factor":1.1725},{"match_name":"H&H June Match","match_date":"2016-06-26","stage_classifiercode":"99-12","member_number":"\"\"","first_name":"PACO","last_name":"PALACIOS","classification":"U","division":"OPEN","hit_factor":1.1628},{"match_name":"CVSC 06-25-2017","match_date":"2017-06-25","stage_classifiercode":"99-12","member_number":"\"\"","first_name":"WINDY","last_name":"OWENS","classification":"U","division":"OPEN","hit_factor":1.1341},{"match_name":"MPPL USPSA Match 01072017","match_date":"2017-01-07","stage_classifiercode":"99-12","member_number":"A45983","first_name":"ROLLY","last_name":"MEDRANO","classification":"C","division":"OPEN","hit_factor":1.0292},{"match_name":"Chillicothe May-2017 USPSA Match","match_date":"2017-05-28","stage_classifiercode":"99-12","member_number":"TY58309","first_name":"ERIC","last_name":"HENSON","classification":"C","division":"OPEN","hit_factor":1.0093},{"match_name":"COPS Feb 2017 USPSA Match","match_date":"2017-02-05","stage_classifiercode":"99-12","member_number":"\"\"","first_name":"KEITH","last_name":"RUSSELL","classification":"U","division":"OPEN","hit_factor":0.9871},{"match_name":"MPPL USPSA Match 01072017","match_date":"2017-01-07","stage_classifiercode":"99-12","member_number":"\"\"","first_name":"LARRY","last_name":"CORTEZ","classification":"\"\"","division":"OPEN","hit_factor":0.8684},{"match_name":"NTPS-SE August 2016","match_date":"2016-08-20","stage_classifiercode":"99-12","member_number":"TY53537","first_name":"THOMAS","last_name":"TURNER","classification":"D","division":"OPEN","hit_factor":0.8081},{"match_name":"HRRB 5-20-2017","match_date":"2017-05-20","stage_classifiercode":"99-12","member_number":"TY27435","first_name":"CARLOS","last_name":"VIERNES","classification":"B","division":"OPEN","hit_factor":0.7286},{"match_name":"Colonial Rifle and Pistol Club June 2018 Special Classifier","match_date":"2018-06-02","stage_classifiercode":"99-12","member_number":"A111233","first_name":"LUDWIG","last_name":"D'ANGELO","classification":"U","division":"OPEN","hit_factor":0.6117},{"match_name":"Danville Rifle and Pistol Club USPSA IL17 April 21 2018","match_date":"2018-04-21","stage_classifiercode":"99-12","member_number":"A102630","first_name":"NATE","last_name":"POULSON","classification":"U","division":"OPEN","hit_factor":0.6098},{"match_name":"LdF 4th Saturday Match","match_date":"2016-01-23","stage_classifiercode":"99-12","member_number":"TY91328","first_name":"ROLLY","last_name":"ABADA","classification":"D","division":"OPEN","hit_factor":0.4975},{"match_name":"HPS September Club Fun Shoot","match_date":"2018-09-01","stage_classifiercode":"99-12","member_number":"TY88006","first_name":"BOBBY","last_name":"REGALARIO","classification":"C","division":"OPEN","hit_factor":0.4562},{"match_name":"NISA April Classifer Match 2016","match_date":"2016-04-24","stage_classifiercode":"99-12","member_number":"A43930","first_name":"DAVID","last_name":"GAGE","classification":"U","division":"OPEN","hit_factor":0.4084}]