[{"match_name":"ORSA USPSA July 2021","match_date":"2021-07-17","stage_classifiercode":"99-42","member_number":"A76179","first_name":"WESTON","last_name":"HENSLEY","classification":"G","division":"PRODUCTION","hit_factor":10},{"match_name":"SUPS All Classifier Match March 1718 2018","match_date":"2018-03-17","stage_classifiercode":"99-42","member_number":"A84390","first_name":"JUSTINE","last_name":"WILLIAMS","classification":"M","division":"PRODUCTION","hit_factor":9.8074},{"match_name":"RBGC 2017-08-26","match_date":"2017-08-26","stage_classifiercode":"99-42","member_number":"A84978","first_name":"TYLER","last_name":"TURNER","classification":"G","division":"PRODUCTION","hit_factor":9.699},{"match_name":"MISS Match 11-2-16","match_date":"2016-10-31","stage_classifiercode":"99-42","member_number":"L3857","first_name":"LES","last_name":"KISMARTONI","classification":"G","division":"PRODUCTION","hit_factor":9.5076},{"match_name":"RBGC 2017-08-26","match_date":"2017-08-26","stage_classifiercode":"99-42","member_number":"A81982","first_name":"MICAH","last_name":"WAITS","classification":"M","division":"PRODUCTION","hit_factor":9.2652},{"match_name":"ORSA USPSA Chuck Berry Memorial Match 15 April","match_date":"2017-04-15","stage_classifiercode":"99-42","member_number":"TY32342","first_name":"GILBERT","last_name":"PEREZ","classification":"G","division":"PRODUCTION","hit_factor":8.9109},{"match_name":"2020-10-03 USPSA  at Phoenix Rod and Gun Club","match_date":"2020-10-03","stage_classifiercode":"99-42","member_number":"A61313","first_name":"BRETT","last_name":"BERG","classification":"M","division":"PRODUCTION","hit_factor":8.9109},{"match_name":"FLPSA USPSA Pistol League 06.28.2016","match_date":"2016-06-28","stage_classifiercode":"99-42","member_number":"TY83581","first_name":"PAUL","last_name":"WOLLMUTH","classification":"A","division":"PRODUCTION","hit_factor":8.903},{"match_name":"RBGC 2017-08-26","match_date":"2017-08-26","stage_classifiercode":"99-42","member_number":"A76603","first_name":"TYLER","last_name":"INGRAM","classification":"G","division":"PRODUCTION","hit_factor":8.8525},{"match_name":"FBURG April 2017 Level I USPSA ","match_date":"2017-04-01","stage_classifiercode":"99-42","member_number":"TY83220","first_name":"NICK","last_name":"WILLIAMS","classification":"A","division":"PRODUCTION","hit_factor":8.805},{"match_name":"MISS Match 11-2-16","match_date":"2016-10-31","stage_classifiercode":"99-42","member_number":"L4109","first_name":"MATT","last_name":"LITTLE","classification":"M","division":"PRODUCTION","hit_factor":8.7114},{"match_name":"Shongum October 2016 USPSA Match","match_date":"2016-10-01","stage_classifiercode":"99-42","member_number":"\"\"","first_name":"CHRIS","last_name":"JARONSKY","classification":"M","division":"PRODUCTION","hit_factor":8.6093},{"match_name":"LGCSEMPS 2017 SPECIAL CLASSIFIER","match_date":"2017-04-09","stage_classifiercode":"99-42","member_number":"A91766","first_name":"QUINTON","last_name":"HO","classification":"M","division":"PRODUCTION","hit_factor":8.5106},{"match_name":"MCPSL Pistol 4-9-16","match_date":"2016-04-09","stage_classifiercode":"99-42","member_number":"Ty60095","first_name":"MATT","last_name":"HOPKINS","classification":"G","division":"PRODUCTION","hit_factor":8.4375},{"match_name":"APSC USPSA Special Classifier 04-02-16","match_date":"2016-04-02","stage_classifiercode":"99-42","member_number":"A78421","first_name":"BEN","last_name":"GILMAN","classification":"M","division":"PRODUCTION","hit_factor":8.3582},{"match_name":"Richmond Hot Shots 2021 USPSA Special Classifier Match - Jan 24 2021","match_date":"2021-01-24","stage_classifiercode":"99-42","member_number":"TY71640","first_name":"JAMES","last_name":"YEOM","classification":"M","division":"PRODUCTION","hit_factor":8.321},{"match_name":"CTASA 3rd Sunday USPSA - March 2018","match_date":"2018-03-18","stage_classifiercode":"99-42","member_number":"TY93241","first_name":"DAZHI","last_name":"ZHANG","classification":"M","division":"PRODUCTION","hit_factor":8.2596},{"match_name":"CFRPC USPSA 2017 JUNE","match_date":"2017-06-18","stage_classifiercode":"99-42","member_number":"A83892","first_name":"CHARLES","last_name":"GAUTIER","classification":"A","division":"PRODUCTION","hit_factor":8.1991},{"match_name":"Enps May 2021 USPSA MATCH-All Classifier","match_date":"2021-05-02","stage_classifiercode":"99-42","member_number":"TY50841","first_name":"JOEL","last_name":"PARK","classification":"G","division":"PRODUCTION","hit_factor":8.1991},{"match_name":"Minnetonka Game And Fish May 3","match_date":"2017-05-03","stage_classifiercode":"99-42","member_number":"A78033","first_name":"CASEY","last_name":"REED","classification":"G","division":"PRODUCTION","hit_factor":8.062},{"match_name":"ORSA USPSA Chuck Berry Memorial Match 15 April","match_date":"2017-04-15","stage_classifiercode":"99-42","member_number":"A76179","first_name":"WESTON","last_name":"HENSLEY","classification":"G","division":"PRODUCTION","hit_factor":8.0139},{"match_name":"2021-06-05 USPSA  at Phoenix Rod and Gun Club","match_date":"2021-06-05","stage_classifiercode":"99-42","member_number":"TY80590","first_name":"STEVE","last_name":"DITTMANN","classification":"M","division":"PRODUCTION","hit_factor":8},{"match_name":"CCPL 03-08-2020","match_date":"2020-03-08","stage_classifiercode":"99-42","member_number":"A125760","first_name":"MATTHEW","last_name":"MAGYAR","classification":"U","division":"PRODUCTION","hit_factor":7.9877},{"match_name":"Cactus USPSA ALL CLASSIFIER September 2020","match_date":"2020-09-06","stage_classifiercode":"99-42","member_number":"A21582","first_name":"JOHN","last_name":"MURRAY","classification":"M","division":"PRODUCTION","hit_factor":7.9787},{"match_name":"Wvpps May2016","match_date":"2016-05-15","stage_classifiercode":"99-42","member_number":"TY86867","first_name":"ANDREW","last_name":"HEATH","classification":"A","division":"PRODUCTION","hit_factor":7.9389},{"match_name":"FBURG April 2017 Level I USPSA ","match_date":"2017-04-01","stage_classifiercode":"99-42","member_number":"L974","first_name":"RANDY","last_name":"CLICK","classification":"M","division":"PRODUCTION","hit_factor":7.9295},{"match_name":"RBGC 2017-08-26","match_date":"2017-08-26","stage_classifiercode":"99-42","member_number":"A80656","first_name":"ANDREAS","last_name":"YANKOPOLUS","classification":"G","division":"PRODUCTION","hit_factor":7.7348},{"match_name":"ANPRACS Classifier  Match 6-19-16","match_date":"2016-06-19","stage_classifiercode":"99-42","member_number":"\"\"","first_name":"KELLY","last_name":"MEARS","classification":"\"\"","division":"PRODUCTION","hit_factor":7.7128},{"match_name":"1ra Fecha USPSA","match_date":"2016-01-10","stage_classifiercode":"99-42","member_number":"A86185","first_name":"WILFREDO","last_name":"SOTO","classification":"B","division":"PRODUCTION","hit_factor":7.6712},{"match_name":"Wvpps May2016","match_date":"2016-05-15","stage_classifiercode":"99-42","member_number":"A77176","first_name":"DON","last_name":"O'BRADOVICH","classification":"B","division":"PRODUCTION","hit_factor":7.6705},{"match_name":"Shoot GTR USPSA 11/22","match_date":"2016-11-22","stage_classifiercode":"99-42","member_number":"TY69089","first_name":"MATT","last_name":"MITCHELL","classification":"M","division":"PRODUCTION","hit_factor":7.6696},{"match_name":"Richmond Hot Shots February 5-2017 USPSA Pistol Match","match_date":"2017-02-05","stage_classifiercode":"99-42","member_number":"FY25171","first_name":"KEVIN","last_name":"CHU","classification":"A","division":"PRODUCTION","hit_factor":7.6271},{"match_name":"WGC October 2018 USPSA 2","match_date":"2018-10-28","stage_classifiercode":"99-42","member_number":"A82324","first_name":"COREY","last_name":"MITCHELL","classification":"M","division":"PRODUCTION","hit_factor":7.6164},{"match_name":"NCPS USPSA Handgun Match January 28 2018a","match_date":"2018-01-28","stage_classifiercode":"99-42","member_number":"FY92636","first_name":"JORDAN","last_name":"SU","classification":"M","division":"PRODUCTION","hit_factor":7.6104},{"match_name":"Minot USPSA 7-8-18","match_date":"2018-07-07","stage_classifiercode":"99-42","member_number":"A103957","first_name":"TAYLOR","last_name":"BURACZEWSKI","classification":"B","division":"PRODUCTION","hit_factor":7.5802},{"match_name":"FBURG April 2017 Level I USPSA ","match_date":"2017-04-01","stage_classifiercode":"99-42","member_number":"A83979","first_name":"MATTHEW","last_name":"NASH","classification":"A","division":"PRODUCTION","hit_factor":7.563},{"match_name":"SLPSA  USPSA","match_date":"2016-09-17","stage_classifiercode":"99-42","member_number":"A88381","first_name":"WYATT","last_name":"MCNEILL","classification":"G","division":"PRODUCTION","hit_factor":7.5524},{"match_name":"FBURG April 2017 Level I USPSA ","match_date":"2017-04-01","stage_classifiercode":"99-42","member_number":"FY63108","first_name":"JUSTIN","last_name":"TITUS","classification":"A","division":"PRODUCTION","hit_factor":7.537},{"match_name":"SLPSA  USPSA","match_date":"2016-09-17","stage_classifiercode":"99-42","member_number":"A51363","first_name":"KENNY","last_name":"TERRY","classification":"A","division":"PRODUCTION","hit_factor":7.5188},{"match_name":"Wvpps May2016","match_date":"2016-05-15","stage_classifiercode":"99-42","member_number":"FY54293","first_name":"JAKE","last_name":"FEARNOW","classification":"A","division":"PRODUCTION","hit_factor":7.513},{"match_name":"FLPSA USPSA Pistol League 06.28.2016","match_date":"2016-06-28","stage_classifiercode":"99-42","member_number":"TY82562","first_name":"GUNNAR","last_name":"AN","classification":"B","division":"PRODUCTION","hit_factor":7.4738},{"match_name":"CFRPC June USPSA","match_date":"2018-06-17","stage_classifiercode":"99-42","member_number":"\"\"","first_name":"TONY","last_name":"VICHITTRA","classification":"U","division":"PRODUCTION","hit_factor":7.4349},{"match_name":"SUPS All Classifier Match March 1718 2018","match_date":"2018-03-17","stage_classifiercode":"99-42","member_number":"A91529","first_name":"ROSSEN","last_name":"HRISTOV2","classification":"GM","division":"PRODUCTION","hit_factor":7.418},{"match_name":"HAS May 2016 Pistol Match","match_date":"2016-05-08","stage_classifiercode":"99-42","member_number":"TY77534","first_name":"KIVA","last_name":"SUTTON","classification":"A","division":"PRODUCTION","hit_factor":7.4176},{"match_name":"MISS Match 11-2-16","match_date":"2016-10-31","stage_classifiercode":"99-42","member_number":"A89698","first_name":"ERIC","last_name":"KAMPS","classification":"M","division":"PRODUCTION","hit_factor":7.4074},{"match_name":"Shoot GTR USPSA 11/22","match_date":"2016-11-22","stage_classifiercode":"99-42","member_number":"TY71265","first_name":"STEVEN","last_name":"BOTTCHER","classification":"M","division":"PRODUCTION","hit_factor":7.4074},{"match_name":"EWPSA 2018-05","match_date":"2018-05-20","stage_classifiercode":"99-42","member_number":"TY35490","first_name":"MARK","last_name":"BRADLEY","classification":"G","division":"PRODUCTION","hit_factor":7.377},{"match_name":"Crooked Creek Pistol League - April 2017","match_date":"2017-04-22","stage_classifiercode":"99-42","member_number":"A87537","first_name":"KEN","last_name":"RYAN","classification":"A","division":"PRODUCTION","hit_factor":7.367},{"match_name":"FLPSA USPSA Pistol League 06.28.2016","match_date":"2016-06-28","stage_classifiercode":"99-42","member_number":"A72549","first_name":"ANDRE'","last_name":"DESAUTEL","classification":"M","division":"PRODUCTION","hit_factor":7.3282},{"match_name":"RBGC 2017-08-26","match_date":"2017-08-26","stage_classifiercode":"99-42","member_number":"A58496","first_name":"GREG","last_name":"SMITH","classification":"M","division":"PRODUCTION","hit_factor":7.2838},{"match_name":"Richmond Hot Shots February 5-2017 USPSA Pistol Match","match_date":"2017-02-05","stage_classifiercode":"99-42","member_number":"A93504","first_name":"KEVIN","last_name":"NGU","classification":"B","division":"PRODUCTION","hit_factor":7.2829},{"match_name":"Shasta Shooters August 2017","match_date":"2017-08-12","stage_classifiercode":"99-42","member_number":"A80323","first_name":"JEREMY","last_name":"NUNES","classification":"G","division":"PRODUCTION","hit_factor":7.2785},{"match_name":"Crooked Creek Pistol League - March 26-27 2016","match_date":"2016-03-26","stage_classifiercode":"99-42","member_number":"A46225","first_name":"JEFF","last_name":"WHITAKER","classification":"A","division":"PRODUCTION","hit_factor":7.2524},{"match_name":"FLPSA USPSA Pistol League 06.28.2016","match_date":"2016-06-28","stage_classifiercode":"99-42","member_number":"L2504","first_name":"STEVE","last_name":"ZERWAS","classification":"A","division":"PRODUCTION","hit_factor":7.215},{"match_name":"Shasta Shooters March 2017","match_date":"2017-03-11","stage_classifiercode":"99-42","member_number":"TY94941","first_name":"JEREMY","last_name":"BAKER","classification":"A","division":"PRODUCTION","hit_factor":7.1979},{"match_name":"MCTS USPSA 10-08-2016","match_date":"2016-10-08","stage_classifiercode":"99-42","member_number":"A83760","first_name":"KING","last_name":"DRUMMOND","classification":"B","division":"PRODUCTION","hit_factor":7.1618},{"match_name":"OFGC Practical Pistol Match 8-16-20","match_date":"2020-08-16","stage_classifiercode":"99-42","member_number":"A113711","first_name":"MARK","last_name":"KELLY","classification":"C","division":"PRODUCTION","hit_factor":7.152},{"match_name":"TPS USPSA at CMP Dec 19 2020 Special Classifier Match","match_date":"2020-12-19","stage_classifiercode":"99-42","member_number":"A123491","first_name":"HUNTER","last_name":"WOMACK","classification":"U","division":"PRODUCTION","hit_factor":7.1253},{"match_name":"MS06 Team Magnolia USPSA October Match","match_date":"2016-10-01","stage_classifiercode":"99-42","member_number":"A67704","first_name":"MICHAEL","last_name":"MCDONALD","classification":"M","division":"PRODUCTION","hit_factor":7.1156},{"match_name":"MCTS USPSA 10-08-2016","match_date":"2016-10-08","stage_classifiercode":"99-42","member_number":"A35114","first_name":"REMO","last_name":"HINLO","classification":"B","division":"PRODUCTION","hit_factor":7.1146},{"match_name":"OFGC Practical Pistol Match 8-16-20","match_date":"2020-08-16","stage_classifiercode":"99-42","member_number":"TY78645","first_name":"LOREN","last_name":"PENDERGRASS","classification":"M","division":"PRODUCTION","hit_factor":7.0922},{"match_name":"EWPSA 2018-04","match_date":"2018-04-15","stage_classifiercode":"99-42","member_number":"TY35490","first_name":"MARK","last_name":"BRADLEY","classification":"GM","division":"PRODUCTION","hit_factor":7.0671},{"match_name":"Richmond Hot Shots February 5-2017 USPSA Pistol Match","match_date":"2017-02-05","stage_classifiercode":"99-42","member_number":"A84913","first_name":"ANDREW","last_name":"LY","classification":"C","division":"PRODUCTION","hit_factor":7.0496},{"match_name":"BSPSC  2016 NRS Slot Match","match_date":"2016-05-08","stage_classifiercode":"99-42","member_number":"A87311","first_name":"SETH","last_name":"BERGLEE","classification":"B","division":"PRODUCTION","hit_factor":7.0485},{"match_name":"SLPSA  USPSA","match_date":"2016-09-17","stage_classifiercode":"99-42","member_number":"A88383","first_name":"JOHN","last_name":"MCNEILL","classification":"A","division":"PRODUCTION","hit_factor":7.0474},{"match_name":"STest_Apr25","match_date":"2016-04-29","stage_classifiercode":"99-42","member_number":"\"\"","first_name":"JEFF","last_name":"CARVER","classification":"A","division":"PRODUCTION","hit_factor":7.0423},{"match_name":"Crooked Creek Pistol League - April 2017","match_date":"2017-04-22","stage_classifiercode":"99-42","member_number":"A36953","first_name":"RYAN","last_name":"RAINES","classification":"A","division":"PRODUCTION","hit_factor":7.0404},{"match_name":"USPSA","match_date":"2016-09-25","stage_classifiercode":"99-42","member_number":"\"\"","first_name":"BEEN","last_name":"MARRIED","classification":"M","division":"PRODUCTION","hit_factor":7.0404},{"match_name":"FBURG April 2017 Level I USPSA ","match_date":"2017-04-01","stage_classifiercode":"99-42","member_number":"L3413","first_name":"CLAY","last_name":"KLEMM","classification":"A","division":"PRODUCTION","hit_factor":7.0381},{"match_name":"APSC USPSA Special Classifier 04-02-16","match_date":"2016-04-02","stage_classifiercode":"99-42","member_number":"A78159","first_name":"ERIC","last_name":"WISE","classification":"B","division":"PRODUCTION","hit_factor":7.0263},{"match_name":"EWPSA 2018-05","match_date":"2018-05-20","stage_classifiercode":"99-42","member_number":"A51545","first_name":"PERRY","last_name":"MCBREAIRTY","classification":"A","division":"PRODUCTION","hit_factor":7.0175},{"match_name":"NCPS USPSA Handgun Match January 28 2018a","match_date":"2018-01-28","stage_classifiercode":"99-42","member_number":"A54989","first_name":"JOHN","last_name":"PRALL","classification":"M","division":"PRODUCTION","hit_factor":6.9592},{"match_name":"2021-06-05 USPSA  at Phoenix Rod and Gun Club","match_date":"2021-06-05","stage_classifiercode":"99-42","member_number":"A103714","first_name":"DAN","last_name":"TYLER","classification":"A","division":"PRODUCTION","hit_factor":6.9588},{"match_name":"Minnetonka Game And Fish May 3","match_date":"2017-05-03","stage_classifiercode":"99-42","member_number":"L-3008","first_name":"MIKE","last_name":"BOFENKAMP","classification":"A","division":"PRODUCTION","hit_factor":6.9544},{"match_name":"SAPS Match 6/6/2020","match_date":"2020-06-06","stage_classifiercode":"99-42","member_number":"A74239","first_name":"WESTON","last_name":"HAYES","classification":"B","division":"PRODUCTION","hit_factor":6.9164},{"match_name":"SAPSA April 2016","match_date":"2016-04-16","stage_classifiercode":"99-42","member_number":"TY53949","first_name":"TODD","last_name":"KENNEDY","classification":"G","division":"PRODUCTION","hit_factor":6.9156},{"match_name":"GRB Jan USPSA @Cav","match_date":"2016-01-16","stage_classifiercode":"99-42","member_number":"A94294","first_name":"PJ","last_name":"KARONIS","classification":"U","division":"PRODUCTION","hit_factor":6.9057},{"match_name":"SPSA USPSA February 4th Sat match","match_date":"2018-02-24","stage_classifiercode":"99-42","member_number":"FY42385","first_name":"JOHN","last_name":"HILL","classification":"M","division":"PRODUCTION","hit_factor":6.8878},{"match_name":"RBGC 2017-08-26","match_date":"2017-08-26","stage_classifiercode":"99-42","member_number":"A90273","first_name":"ISMAEL","last_name":"VEGA","classification":"A","division":"PRODUCTION","hit_factor":6.8776},{"match_name":"GPS March 2021 at Wallis-Orchard Gun Range","match_date":"2021-03-28","stage_classifiercode":"99-42","member_number":"Ty100128","first_name":"KYLE","last_name":"MCCORD","classification":"M","division":"PRODUCTION","hit_factor":6.8571},{"match_name":"APSC USPSA Special Classifier 04-02-16","match_date":"2016-04-02","stage_classifiercode":"99-42","member_number":"A89702","first_name":"SCOTT","last_name":"JENNINGS","classification":"C","division":"PRODUCTION","hit_factor":6.8354},{"match_name":"HPS March Pistol Funshoot","match_date":"2017-03-18","stage_classifiercode":"99-42","member_number":"A94023","first_name":"CHRIS","last_name":"GYURGYIK","classification":"C","division":"PRODUCTION","hit_factor":6.795},{"match_name":"Atlanta Practical Shooters November 2016 USPSA","match_date":"2016-11-06","stage_classifiercode":"99-42","member_number":"L4117","first_name":"SALVADOR","last_name":"LUNA","classification":"C","division":"PRODUCTION","hit_factor":6.7826},{"match_name":"DGC USPSA Classifier Match","match_date":"2017-07-30","stage_classifiercode":"99-42","member_number":"A82422","first_name":"LAWTON","last_name":"SEGLER","classification":"B","division":"PRODUCTION","hit_factor":6.7797},{"match_name":"Richmond Hot Shots February 5-2017 USPSA Pistol Match","match_date":"2017-02-05","stage_classifiercode":"99-42","member_number":"A46690","first_name":"GILBERT","last_name":"GESMUNDO","classification":"U","division":"PRODUCTION","hit_factor":6.7701},{"match_name":"SAPSA April 2016","match_date":"2016-04-16","stage_classifiercode":"99-42","member_number":"A45634","first_name":"MARK","last_name":"NUNNALLY","classification":"B","division":"PRODUCTION","hit_factor":6.7389},{"match_name":"Springfield Tactical Shooters 01-05-2017","match_date":"2017-01-05","stage_classifiercode":"99-42","member_number":"A91182","first_name":"MATTHEW","last_name":"ACKER","classification":"B","division":"PRODUCTION","hit_factor":6.7207},{"match_name":"3ra Fecha USPSA","match_date":"2018-03-24","stage_classifiercode":"99-42","member_number":"TY70567","first_name":"HANZEL","last_name":"MIRANDA","classification":"A","division":"PRODUCTION","hit_factor":6.7204},{"match_name":"Alpha Mike June 2021  ","match_date":"2021-06-20","stage_classifiercode":"99-42","member_number":"L3662","first_name":"MICHAEL","last_name":"GREEN","classification":"M","division":"PRODUCTION","hit_factor":6.6946},{"match_name":"MS06 Team Magnolia USPSA October Match","match_date":"2016-10-01","stage_classifiercode":"99-42","member_number":"L-1610","first_name":"CLIFF","last_name":"CARGILL","classification":"M","division":"PRODUCTION","hit_factor":6.6906},{"match_name":"CFRPC June USPSA","match_date":"2018-06-17","stage_classifiercode":"99-42","member_number":"a83892","first_name":"CHARLES","last_name":"GAUTIER","classification":"M","division":"PRODUCTION","hit_factor":6.6752},{"match_name":"CFRPC USPSA 2017 JUNE","match_date":"2017-06-18","stage_classifiercode":"99-42","member_number":"A83725","first_name":"RAFY","last_name":"RIJOS","classification":"B","division":"PRODUCTION","hit_factor":6.6667},{"match_name":"1ra Fecha USPSA","match_date":"2016-01-10","stage_classifiercode":"99-42","member_number":"A89235","first_name":"LUIS ALBERTO","last_name":"QUILICHINI ALBORS","classification":"C","division":"PRODUCTION","hit_factor":6.6667},{"match_name":"SAPSA April 2016","match_date":"2016-04-16","stage_classifiercode":"99-42","member_number":"L2633","first_name":"BRUCE","last_name":"WALLACE","classification":"M","division":"PRODUCTION","hit_factor":6.6581},{"match_name":"Eagles Nest July 17th","match_date":"2016-07-17","stage_classifiercode":"99-42","member_number":"A36953","first_name":"RYAN","last_name":"RAINES","classification":"A","division":"PRODUCTION","hit_factor":6.6581},{"match_name":"Crooked Creek Pistol League - April 2017","match_date":"2017-04-22","stage_classifiercode":"99-42","member_number":"A82711","first_name":"TIM","last_name":"LOGAN","classification":"B","division":"PRODUCTION","hit_factor":6.6421},{"match_name":"Baghdad USPSA Special Classifier Lightning Interrupted 6 May 2017","match_date":"2017-05-06","stage_classifiercode":"99-42","member_number":"TY51119","first_name":"CHRIS","last_name":"MOLNAR","classification":"A","division":"PRODUCTION","hit_factor":6.6362},{"match_name":"PIPS 08-03-2016","match_date":"2016-08-03","stage_classifiercode":"99-42","member_number":"A90188","first_name":"BLAKE","last_name":"MAMER","classification":"B","division":"PRODUCTION","hit_factor":6.6351},{"match_name":"MCTS USPSA 10-08-2016","match_date":"2016-10-08","stage_classifiercode":"99-42","member_number":"A83610","first_name":"JARED","last_name":"GABRIEL","classification":"B","division":"PRODUCTION","hit_factor":6.6258},{"match_name":"Atlanta Practical Shooters March 2016 USPSA - Classifier Match","match_date":"2016-03-06","stage_classifiercode":"99-42","member_number":"A86556","first_name":"KEVIN","last_name":"DEASE","classification":"A","division":"PRODUCTION","hit_factor":6.621},{"match_name":"Shasta Shooters August 2017","match_date":"2017-08-12","stage_classifiercode":"99-42","member_number":"TY94941","first_name":"JEREMY","last_name":"BAKER","classification":"M","division":"PRODUCTION","hit_factor":6.5823},{"match_name":"Baghdad USPSA Special Classifier Lightning Interrupted 6 May 2017","match_date":"2017-05-06","stage_classifiercode":"99-42","member_number":"TY100359","first_name":"DESTIN","last_name":"MOUNTS","classification":"U","division":"PRODUCTION","hit_factor":6.5703},{"match_name":"FBURG April 2017 Level I USPSA ","match_date":"2017-04-01","stage_classifiercode":"99-42","member_number":"TY91494","first_name":"ALAN","last_name":"HARRIS","classification":"B","division":"PRODUCTION","hit_factor":6.5693},{"match_name":"Crooked Creek Pistol League - April 2017","match_date":"2017-04-22","stage_classifiercode":"99-42","member_number":"A97335","first_name":"JOSEPH","last_name":"WHITE","classification":"A","division":"PRODUCTION","hit_factor":6.5693},{"match_name":"NCPS USPSA Handgun Match January 28 2018a","match_date":"2018-01-28","stage_classifiercode":"99-42","member_number":"A105624","first_name":"COLTON","last_name":"BROWN","classification":"C","division":"PRODUCTION","hit_factor":6.5621},{"match_name":"Enps May 2021 USPSA MATCH-All Classifier","match_date":"2021-05-02","stage_classifiercode":"99-42","member_number":"A96710","first_name":"ZACHARY","last_name":"BRODER","classification":"C","division":"PRODUCTION","hit_factor":6.5574},{"match_name":"Minnetonka Game And Fish May 3","match_date":"2017-05-03","stage_classifiercode":"99-42","member_number":"\"\"","first_name":"TONY","last_name":"STOCKEY","classification":"A","division":"PRODUCTION","hit_factor":6.5491},{"match_name":"SPSA USPSA February 4th Sat match","match_date":"2018-02-24","stage_classifiercode":"99-42","member_number":"A100739","first_name":"ROSS","last_name":"KAPRON","classification":"C","division":"PRODUCTION","hit_factor":6.5463},{"match_name":"Richmond Boro Gun Club March 2020 USPSA Match","match_date":"2020-03-14","stage_classifiercode":"99-42","member_number":"A110413","first_name":"ROB","last_name":"EPIFANIA","classification":"A","division":"PRODUCTION","hit_factor":6.5189},{"match_name":"MS06 Team Magnolia USPSA October Match","match_date":"2016-10-01","stage_classifiercode":"99-42","member_number":"A81552","first_name":"RUSS","last_name":"SMITH","classification":"B","division":"PRODUCTION","hit_factor":6.5081},{"match_name":"LGCSEMPS 2017 SPECIAL CLASSIFIER","match_date":"2017-04-09","stage_classifiercode":"99-42","member_number":"TY73397","first_name":"ELMER","last_name":"HERSCHELMAN","classification":"B","division":"PRODUCTION","hit_factor":6.4982},{"match_name":"PCWC USPSA 4 22 2017","match_date":"2017-04-22","stage_classifiercode":"99-42","member_number":"A71719","first_name":"ED","last_name":"CHASE","classification":"A","division":"PRODUCTION","hit_factor":6.4935},{"match_name":"Richmond Hot Shots February 5-2017 USPSA Pistol Match","match_date":"2017-02-05","stage_classifiercode":"99-42","member_number":"A67001","first_name":"KENT","last_name":"HIGGINBOTHAM","classification":"M","division":"PRODUCTION","hit_factor":6.4815},{"match_name":"GAS July 7th Special Classifier","match_date":"2018-07-07","stage_classifiercode":"99-42","member_number":"A96894","first_name":"COLT","last_name":"HUBBS","classification":"B","division":"PRODUCTION","hit_factor":6.4683},{"match_name":"GRB USPSA FEB at CAV","match_date":"2018-02-17","stage_classifiercode":"99-42","member_number":"A71719","first_name":"ED","last_name":"CHASE","classification":"A","division":"PRODUCTION","hit_factor":6.4683},{"match_name":"Shasta Shooters March 2017","match_date":"2017-03-11","stage_classifiercode":"99-42","member_number":"TY94941","first_name":"JEREMY","last_name":"BAKER","classification":"A","division":"PRODUCTION","hit_factor":6.4516},{"match_name":"Steel City USPSA July 2016","match_date":"2016-07-02","stage_classifiercode":"99-42","member_number":"A71261","first_name":"TONY","last_name":"DONATELLI","classification":"A","division":"PRODUCTION","hit_factor":6.4516},{"match_name":"CCPL 03-08-2020","match_date":"2020-03-08","stage_classifiercode":"99-42","member_number":"FY82690","first_name":"MARK","last_name":"SALAZAR","classification":"B","division":"PRODUCTION","hit_factor":6.4336},{"match_name":"USPSA","match_date":"2016-09-25","stage_classifiercode":"99-42","member_number":"\"\"","first_name":"SCOTT","last_name":"WEINER","classification":"B","division":"PRODUCTION","hit_factor":6.4118},{"match_name":"CFRPC USPSA 2017 JUNE","match_date":"2017-06-18","stage_classifiercode":"99-42","member_number":"A88252","first_name":"MARK","last_name":"HILLIARD","classification":"M","division":"PRODUCTION","hit_factor":6.4085},{"match_name":"AIPS  USPSA Weekly 22 August 2017","match_date":"2017-08-22","stage_classifiercode":"99-42","member_number":"A54718","first_name":"SCOTT","last_name":"ARNBURG","classification":"M","division":"PRODUCTION","hit_factor":6.3961},{"match_name":"Shasta Shooters March 2017","match_date":"2017-03-11","stage_classifiercode":"99-42","member_number":"A96344","first_name":"RON","last_name":"HILDEBRANT","classification":"B","division":"PRODUCTION","hit_factor":6.3905},{"match_name":"EWPSA 2018-04","match_date":"2018-04-15","stage_classifiercode":"99-42","member_number":"A90658","first_name":"RACHEL","last_name":"HARPER","classification":"A","division":"PRODUCTION","hit_factor":6.3889},{"match_name":"Shasta Shooters March 2017","match_date":"2017-03-11","stage_classifiercode":"99-42","member_number":"fy89662","first_name":"TODD","last_name":"CANCILLA","classification":"B","division":"PRODUCTION","hit_factor":6.3882},{"match_name":"Patriot Action Shooters 2016 Special Classifier","match_date":"2016-03-19","stage_classifiercode":"99-42","member_number":"Ty66762","first_name":"DEAN","last_name":"WHITELAW","classification":"B","division":"PRODUCTION","hit_factor":6.383},{"match_name":"MCTS USPSA 10-08-2016","match_date":"2016-10-08","stage_classifiercode":"99-42","member_number":"A83939","first_name":"JOHN","last_name":"FINKLE","classification":"B","division":"PRODUCTION","hit_factor":6.3776},{"match_name":"2020-10-03 USPSA  at Phoenix Rod and Gun Club","match_date":"2020-10-03","stage_classifiercode":"99-42","member_number":"58638","first_name":"SEAN","last_name":"MURTAUGH","classification":"B","division":"PRODUCTION","hit_factor":6.3776},{"match_name":"Trigger Guard USPSA","match_date":"2016-04-02","stage_classifiercode":"99-42","member_number":"A89295","first_name":"CHASE","last_name":"FARKAS","classification":"U","division":"PRODUCTION","hit_factor":6.3725},{"match_name":"CFRPC June USPSA","match_date":"2018-06-17","stage_classifiercode":"99-42","member_number":"L3615","first_name":"BOBBY","last_name":"RIVERA","classification":"M","division":"PRODUCTION","hit_factor":6.3694},{"match_name":"MVPSA USPSA June 19th 2021","match_date":"2021-06-19","stage_classifiercode":"99-42","member_number":"A123504","first_name":"CADE","last_name":"BAUGH","classification":"U","division":"PRODUCTION","hit_factor":6.3694},{"match_name":"SAPSA April 2016","match_date":"2016-04-16","stage_classifiercode":"99-42","member_number":"A92232","first_name":"DARREN","last_name":"CRIBBS","classification":"B","division":"PRODUCTION","hit_factor":6.3604},{"match_name":"FBURG April 2017 Level I USPSA ","match_date":"2017-04-01","stage_classifiercode":"99-42","member_number":"TY82414","first_name":"DAVID","last_name":"ANKENY","classification":"B","division":"PRODUCTION","hit_factor":6.3584},{"match_name":"Crooked Creek Pistol League - April 2017","match_date":"2017-04-22","stage_classifiercode":"99-42","member_number":"TY85173","first_name":"RYAN","last_name":"ZAMBRZYCKI","classification":"A","division":"PRODUCTION","hit_factor":6.3337},{"match_name":"PCWC USPSA 4 22 2017","match_date":"2017-04-22","stage_classifiercode":"99-42","member_number":"L2841","first_name":"CHRIS","last_name":"EDWARDS","classification":"B","division":"PRODUCTION","hit_factor":6.3241},{"match_name":"MVPJan2017","match_date":"2017-01-07","stage_classifiercode":"99-42","member_number":"A44808","first_name":"BILL","last_name":"MILLER","classification":"A","division":"PRODUCTION","hit_factor":6.3158},{"match_name":"Alpha Mike June 2021  ","match_date":"2021-06-20","stage_classifiercode":"99-42","member_number":"A42337","first_name":"MIKE","last_name":"MANSILLA","classification":"A","division":"PRODUCTION","hit_factor":6.2726},{"match_name":"Shasta Shooters March 2017","match_date":"2017-03-11","stage_classifiercode":"99-42","member_number":"fy89662","first_name":"TODD","last_name":"CANCILLA","classification":"B","division":"PRODUCTION","hit_factor":6.271},{"match_name":"1ra Fecha USPSA","match_date":"2016-01-10","stage_classifiercode":"99-42","member_number":"A83938","first_name":"ELIUD M","last_name":"DIAZ RIVERA","classification":"B","division":"PRODUCTION","hit_factor":6.2703},{"match_name":"OFGC USPSA August 21 2016","match_date":"2016-08-21","stage_classifiercode":"99-42","member_number":"A89709","first_name":"BRIAN","last_name":"SMITH","classification":"C","division":"PRODUCTION","hit_factor":6.2645},{"match_name":"3ra Fecha USPSA","match_date":"2018-03-24","stage_classifiercode":"99-42","member_number":"A86185","first_name":"WILLIE","last_name":"SOTO","classification":"A","division":"PRODUCTION","hit_factor":6.214},{"match_name":"Steel City USPSA July 2016","match_date":"2016-07-02","stage_classifiercode":"99-42","member_number":"TY84186","first_name":"CHRIS","last_name":"MAGYAR","classification":"B","division":"PRODUCTION","hit_factor":6.214},{"match_name":"MPSA 071616","match_date":"2016-07-16","stage_classifiercode":"99-42","member_number":"A92885","first_name":"TAYLOR","last_name":"ZIMMERMAN","classification":"B","division":"PRODUCTION","hit_factor":6.214},{"match_name":"RBGC 2017-08-26","match_date":"2017-08-26","stage_classifiercode":"99-42","member_number":"A96933","first_name":"DAVID","last_name":"BLANTON","classification":"A","division":"PRODUCTION","hit_factor":6.2059},{"match_name":"Steel City USPSA July 2016","match_date":"2016-07-02","stage_classifiercode":"99-42","member_number":"A49374","first_name":"JOHN","last_name":"GOBBELS","classification":"B","division":"PRODUCTION","hit_factor":6.2032},{"match_name":"SAPSA April 2016","match_date":"2016-04-16","stage_classifiercode":"99-42","member_number":"A74960","first_name":"KENNY","last_name":"DARLING","classification":"B","division":"PRODUCTION","hit_factor":6.1905},{"match_name":"GAS July 7th Special Classifier","match_date":"2018-07-07","stage_classifiercode":"99-42","member_number":"TY24066","first_name":"GEORGE","last_name":"MANDES","classification":"A","division":"PRODUCTION","hit_factor":6.1805},{"match_name":"Richmond Hot Shots February 5-2017 USPSA Pistol Match","match_date":"2017-02-05","stage_classifiercode":"99-42","member_number":"A93293","first_name":"ROSS","last_name":"SAN","classification":"B","division":"PRODUCTION","hit_factor":6.1367},{"match_name":"GAS July 7th Special Classifier","match_date":"2018-07-07","stage_classifiercode":"99-42","member_number":"TY30573","first_name":"SAM","last_name":"BUCKMAN","classification":"C","division":"PRODUCTION","hit_factor":6.1176},{"match_name":"Richmond Hot Shots 2021 USPSA Special Classifier Match - Jan 24 2021","match_date":"2021-01-24","stage_classifiercode":"99-42","member_number":"A111807","first_name":"KAYLA","last_name":"HARRIS","classification":"C","division":"PRODUCTION","hit_factor":6.11},{"match_name":"Wvpps May2016","match_date":"2016-05-15","stage_classifiercode":"99-42","member_number":"TY66824","first_name":"MICHAEL","last_name":"MCCAULEY","classification":"B","division":"PRODUCTION","hit_factor":6.105},{"match_name":"Wvpps May2016","match_date":"2016-05-15","stage_classifiercode":"99-42","member_number":"TY86952","first_name":"REED","last_name":"HUGHES","classification":"B","division":"PRODUCTION","hit_factor":6.1017},{"match_name":"WPS USPSA Monthly Match November 2016","match_date":"2016-11-05","stage_classifiercode":"99-42","member_number":"A72159","first_name":"TRAVIS","last_name":"LITTS","classification":"A","division":"PRODUCTION","hit_factor":6.0991},{"match_name":"SUPS All Classifier Match March 1718 2018","match_date":"2018-03-17","stage_classifiercode":"99-42","member_number":"TY10571","first_name":"GLENFRED","last_name":"WONG","classification":"A","division":"PRODUCTION","hit_factor":6.0847},{"match_name":"Shasta Shooters March 2017","match_date":"2017-03-11","stage_classifiercode":"99-42","member_number":"TY94941","first_name":"JEREMY","last_name":"BAKER","classification":"A","division":"PRODUCTION","hit_factor":6.082},{"match_name":"Enps May 2021 USPSA MATCH-All Classifier","match_date":"2021-05-02","stage_classifiercode":"99-42","member_number":"A116970","first_name":"JAY","last_name":"MCKEOWN","classification":"C","division":"PRODUCTION","hit_factor":6.0733},{"match_name":"Shasta Shooters August 2017","match_date":"2017-08-12","stage_classifiercode":"99-42","member_number":"A85793","first_name":"CHRIS","last_name":"PEPLOW","classification":"C","division":"PRODUCTION","hit_factor":6.0606},{"match_name":"Shoot GTR USPSA 11/22","match_date":"2016-11-22","stage_classifiercode":"99-42","member_number":"A89727","first_name":"JONATHAN","last_name":"CHEON","classification":"C","division":"PRODUCTION","hit_factor":6.0606},{"match_name":"Hampden RPC August USPSA Match","match_date":"2020-08-09","stage_classifiercode":"99-42","member_number":"TY47777","first_name":"DONALD","last_name":"FENDERSON","classification":"B","division":"PRODUCTION","hit_factor":6.0533},{"match_name":"Richmond Hot Shots 2021 USPSA Special Classifier Match - Jan 24 2021","match_date":"2021-01-24","stage_classifiercode":"99-42","member_number":"FY102048","first_name":"FRANK","last_name":"ZHENG","classification":"B","division":"PRODUCTION","hit_factor":6.047},{"match_name":"RCPS USPSA Feb 17","match_date":"2018-02-17","stage_classifiercode":"99-42","member_number":"A106515","first_name":"JASON","last_name":"GILLIAM","classification":"C","division":"PRODUCTION","hit_factor":6.0417},{"match_name":"RBGC 2017-08-26","match_date":"2017-08-26","stage_classifiercode":"99-42","member_number":"TY90524","first_name":"ANDREW","last_name":"LARRIER","classification":"B","division":"PRODUCTION","hit_factor":6.0335},{"match_name":"GPS March 2021 at Wallis-Orchard Gun Range","match_date":"2021-03-28","stage_classifiercode":"99-42","member_number":"A123884","first_name":"GENNADY","last_name":"KHOKHORIN","classification":"C","division":"PRODUCTION","hit_factor":6.0314},{"match_name":"SLPSA  USPSA","match_date":"2016-09-17","stage_classifiercode":"99-42","member_number":"A94408","first_name":"BRETT","last_name":"THOMAS","classification":"B","division":"PRODUCTION","hit_factor":6.028},{"match_name":"Springfield Tactical Shooters 01-05-2017","match_date":"2017-01-05","stage_classifiercode":"99-42","member_number":"TY78203","first_name":"JIM","last_name":"SHURES","classification":"U","division":"PRODUCTION","hit_factor":6.0134},{"match_name":"Alpha Mike June 2021  ","match_date":"2021-06-20","stage_classifiercode":"99-42","member_number":"A8032","first_name":"WILLIAM","last_name":"GO","classification":"A","division":"PRODUCTION","hit_factor":6.0116},{"match_name":"PASA USPSA 3-18-18","match_date":"2018-03-18","stage_classifiercode":"99-42","member_number":"L3231","first_name":"ERIC","last_name":"GRIGGS","classification":"A","division":"PRODUCTION","hit_factor":5.9908},{"match_name":"MVPJan2017","match_date":"2017-01-07","stage_classifiercode":"99-42","member_number":"TY26269","first_name":"ALLEN","last_name":"PARSONS","classification":"A","division":"PRODUCTION","hit_factor":5.9893},{"match_name":"Brothers N Arms August 2017 USPSA Match","match_date":"2017-08-19","stage_classifiercode":"99-42","member_number":"A82324","first_name":"COREY","last_name":"MITCHELL","classification":"A","division":"PRODUCTION","hit_factor":5.9864},{"match_name":"Atlanta Practical Shooters March 2016 USPSA - Classifier Match","match_date":"2016-03-06","stage_classifiercode":"99-42","member_number":"A68985","first_name":"CHRIS","last_name":"FARNAN","classification":"B","division":"PRODUCTION","hit_factor":5.9856},{"match_name":"Cactus USPSA ALL CLASSIFIER September 2020","match_date":"2020-09-06","stage_classifiercode":"99-42","member_number":"TY93834","first_name":"THOMAS","last_name":"SMITH","classification":"B","division":"PRODUCTION","hit_factor":5.9801},{"match_name":"AIPS  USPSA Weekly 22 August 2017","match_date":"2017-08-22","stage_classifiercode":"99-42","member_number":"A68875","first_name":"STACY","last_name":"NIEMANN","classification":"A","division":"PRODUCTION","hit_factor":5.9666},{"match_name":"Pathfinder July USPSA Match","match_date":"2017-07-16","stage_classifiercode":"99-42","member_number":"TY88063","first_name":"SCOTT","last_name":"SALLADIN","classification":"C","division":"PRODUCTION","hit_factor":5.9406},{"match_name":"CFRPC June USPSA","match_date":"2018-06-17","stage_classifiercode":"99-42","member_number":"TY64277","first_name":"PAT","last_name":"ISARANKURA","classification":"A","division":"PRODUCTION","hit_factor":5.9299},{"match_name":"MCPSL Pistol 4-9-16","match_date":"2016-04-09","stage_classifiercode":"99-42","member_number":"A85914","first_name":"JUSTIN","last_name":"BARDWELL","classification":"B","division":"PRODUCTION","hit_factor":5.9293},{"match_name":"HPS March Pistol Funshoot","match_date":"2017-03-18","stage_classifiercode":"99-42","member_number":"A74095","first_name":"MYRON","last_name":"HOEFER","classification":"C","division":"PRODUCTION","hit_factor":5.9244},{"match_name":"Enps May 2021 USPSA MATCH-All Classifier","match_date":"2021-05-02","stage_classifiercode":"99-42","member_number":"TY101521","first_name":"JEFF","last_name":"KING","classification":"A","division":"PRODUCTION","hit_factor":5.9238},{"match_name":"GPS March 2021 at Wallis-Orchard Gun Range","match_date":"2021-03-28","stage_classifiercode":"99-42","member_number":"TY83644","first_name":"BRETT","last_name":"THOMPSON","classification":"B","division":"PRODUCTION","hit_factor":5.9197},{"match_name":"EWPSA 2018-04","match_date":"2018-04-15","stage_classifiercode":"99-42","member_number":"A92411","first_name":"CRAIG","last_name":"WORRELL","classification":"B","division":"PRODUCTION","hit_factor":5.9186},{"match_name":"Richmond Hot Shots February 5-2017 USPSA Pistol Match","match_date":"2017-02-05","stage_classifiercode":"99-42","member_number":"TY70680","first_name":"SERGE","last_name":"LUBATINSKY","classification":"M","division":"PRODUCTION","hit_factor":5.9186},{"match_name":"MS06 Team Magnolia USPSA October Match","match_date":"2016-10-01","stage_classifiercode":"99-42","member_number":"FY61451","first_name":"JIMMY","last_name":"CALLENDER","classification":"A","division":"PRODUCTION","hit_factor":5.9172},{"match_name":"MPSA 071616","match_date":"2016-07-16","stage_classifiercode":"99-42","member_number":"A46987","first_name":"PAUL","last_name":"JACCOD","classification":"B","division":"PRODUCTION","hit_factor":5.9134},{"match_name":"GAS July 7th Special Classifier","match_date":"2018-07-07","stage_classifiercode":"99-42","member_number":"ty37009","first_name":"NATE","last_name":"MARTIN","classification":"M","division":"PRODUCTION","hit_factor":5.8824},{"match_name":"SFA USPSA OCTOBER 2020","match_date":"2020-10-17","stage_classifiercode":"99-42","member_number":"A116560","first_name":"MICHAEL","last_name":"MILOVICH","classification":"B","division":"PRODUCTION","hit_factor":5.8568},{"match_name":"NOCPC June 2018","match_date":"2018-06-10","stage_classifiercode":"99-42","member_number":"A94998","first_name":"STEVEN","last_name":"WARNER","classification":"U","division":"PRODUCTION","hit_factor":5.8409},{"match_name":"Wvpps May2016","match_date":"2016-05-15","stage_classifiercode":"99-42","member_number":"A29311","first_name":"DAVE","last_name":"DILLIER","classification":"C","division":"PRODUCTION","hit_factor":5.8409},{"match_name":"GRB USPSA FEB at CAV","match_date":"2018-02-17","stage_classifiercode":"99-42","member_number":"TY60783","first_name":"GUNNAR","last_name":"GRAFF","classification":"C","division":"PRODUCTION","hit_factor":5.8394},{"match_name":"HCGC TN","match_date":"2020-03-14","stage_classifiercode":"99-42","member_number":"L4779","first_name":"PAUL","last_name":"CARSEN","classification":"U","division":"PRODUCTION","hit_factor":5.8361},{"match_name":"Shasta Shooters March 2017","match_date":"2017-03-11","stage_classifiercode":"99-42","member_number":"A91711","first_name":"MITCH","last_name":"CARLSON","classification":"C","division":"PRODUCTION","hit_factor":5.8343},{"match_name":"TPS USPSA at CMP Dec 19 2020 Special Classifier Match","match_date":"2020-12-19","stage_classifiercode":"99-42","member_number":"TY75726","first_name":"PEDRO","last_name":"QUINONES","classification":"B","division":"PRODUCTION","hit_factor":5.8252},{"match_name":"MVPJan2017","match_date":"2017-01-07","stage_classifiercode":"99-42","member_number":"L2683","first_name":"ROBERT","last_name":"MULLAN","classification":"M","division":"PRODUCTION","hit_factor":5.8124},{"match_name":"Wvpps May2016","match_date":"2016-05-15","stage_classifiercode":"99-42","member_number":"A90427","first_name":"RALPH","last_name":"RAMSEY","classification":"B","division":"PRODUCTION","hit_factor":5.787},{"match_name":"FLPSA USPSA Pistol League 06.28.2016","match_date":"2016-06-28","stage_classifiercode":"99-42","member_number":"A89445","first_name":"AJ","last_name":"QUINN","classification":"B","division":"PRODUCTION","hit_factor":5.7714},{"match_name":"WVRPC USPSA 1APR2017 CLASSIFIER","match_date":"2017-04-01","stage_classifiercode":"99-42","member_number":"A77328","first_name":"ZACH","last_name":"YOUNG","classification":"G","division":"PRODUCTION","hit_factor":5.7692},{"match_name":"AIPS  USPSA Weekly 22 August 2017","match_date":"2017-08-22","stage_classifiercode":"99-42","member_number":"TY49876","first_name":"BRIAN","last_name":"HOOD","classification":"B","division":"PRODUCTION","hit_factor":5.7692},{"match_name":"Southkent USPSA MAY match","match_date":"2017-05-20","stage_classifiercode":"99-42","member_number":"A52414","first_name":"RICHARD","last_name":"SERRY","classification":"A","division":"PRODUCTION","hit_factor":5.7692},{"match_name":"GRB USPSA FEB at CAV","match_date":"2018-02-17","stage_classifiercode":"99-42","member_number":"A106616","first_name":"BASILIO","last_name":"KEMBLE","classification":"U","division":"PRODUCTION","hit_factor":5.765},{"match_name":"WGC August 2018 USPSA 2","match_date":"2018-08-26","stage_classifiercode":"99-42","member_number":"TY48703","first_name":"TERRY","last_name":"JOHNSON","classification":"M","division":"PRODUCTION","hit_factor":5.7554},{"match_name":"Crooked Creek Pistol League - April 2017","match_date":"2017-04-22","stage_classifiercode":"99-42","member_number":"A36953","first_name":"RYAN","last_name":"RAINES","classification":"A","division":"PRODUCTION","hit_factor":5.75},{"match_name":"GRB USPSA FEB at CAV","match_date":"2018-02-17","stage_classifiercode":"99-42","member_number":"A107440","first_name":"CASEY","last_name":"MIKUS","classification":"U","division":"PRODUCTION","hit_factor":5.741},{"match_name":"Wvpps May2016","match_date":"2016-05-15","stage_classifiercode":"99-42","member_number":"A86158","first_name":"JONATHAN","last_name":"MAGALLANES","classification":"A","division":"PRODUCTION","hit_factor":5.7364},{"match_name":"RBGC 2017-08-26","match_date":"2017-08-26","stage_classifiercode":"99-42","member_number":"L4293","first_name":"BILLY","last_name":"CHAU","classification":"B","division":"PRODUCTION","hit_factor":5.7348},{"match_name":"APSC USPSA Special Classifier 04-02-16","match_date":"2016-04-02","stage_classifiercode":"99-42","member_number":"A85221","first_name":"MICHAEL","last_name":"URTULA","classification":"A","division":"PRODUCTION","hit_factor":5.7211},{"match_name":"Richmond Hot Shots February 5-2017 USPSA Pistol Match","match_date":"2017-02-05","stage_classifiercode":"99-42","member_number":"TY88874","first_name":"A JOHN","last_name":"BREGLIA","classification":"B","division":"PRODUCTION","hit_factor":5.7208},{"match_name":"CCPL 07102016","match_date":"2016-07-10","stage_classifiercode":"99-42","member_number":"A79092","first_name":"RUSTY","last_name":"GERBER","classification":"B","division":"PRODUCTION","hit_factor":5.7203},{"match_name":"Maine Practical Shooters October 2018","match_date":"2018-10-14","stage_classifiercode":"99-42","member_number":"A82266","first_name":"JOSH","last_name":"HOLMES","classification":"B","division":"PRODUCTION","hit_factor":5.7197},{"match_name":"1ra Fecha USPSA","match_date":"2016-01-10","stage_classifiercode":"99-42","member_number":"F74171","first_name":"MAX","last_name":"RIVERA","classification":"A","division":"PRODUCTION","hit_factor":5.7143},{"match_name":"LGCSEMPS 2017 SPECIAL CLASSIFIER","match_date":"2017-04-09","stage_classifiercode":"99-42","member_number":"A80247","first_name":"JOE","last_name":"PALAZZOLO","classification":"C","division":"PRODUCTION","hit_factor":5.7143},{"match_name":"Shoot GTR USPSA 11/22","match_date":"2016-11-22","stage_classifiercode":"99-42","member_number":"\"\"","first_name":"TYRONE","last_name":"LEE","classification":"X","division":"PRODUCTION","hit_factor":5.7087},{"match_name":"SFA July 2016 CLASSIFIED","match_date":"2016-07-16","stage_classifiercode":"99-42","member_number":"A70458","first_name":"SHAWN","last_name":"KONO","classification":"B","division":"PRODUCTION","hit_factor":5.708},{"match_name":"SAPSA April 2016","match_date":"2016-04-16","stage_classifiercode":"99-42","member_number":"A60272","first_name":"RICKY","last_name":"HAYES","classification":"B","division":"PRODUCTION","hit_factor":5.6948},{"match_name":"OFGC USPSA August 21 2016","match_date":"2016-08-21","stage_classifiercode":"99-42","member_number":"TY78645","first_name":"LOREN","last_name":"PENDERGRASS","classification":"M","division":"PRODUCTION","hit_factor":5.6948},{"match_name":"SPSA USPSA February 4th Sat match","match_date":"2018-02-24","stage_classifiercode":"99-42","member_number":"A91991","first_name":"GLENN","last_name":"GREEN","classification":"B","division":"PRODUCTION","hit_factor":5.6872},{"match_name":"PSAC_20170923","match_date":"2017-09-23","stage_classifiercode":"99-42","member_number":"TY91017","first_name":"JON","last_name":"MANNA","classification":"B","division":"PRODUCTION","hit_factor":5.6738},{"match_name":"AIPS  USPSA Weekly 22 August 2017","match_date":"2017-08-22","stage_classifiercode":"99-42","member_number":"FY39721","first_name":"JIM","last_name":"SNYDER","classification":"B","division":"PRODUCTION","hit_factor":5.6723},{"match_name":"SAPSA April 2016","match_date":"2016-04-16","stage_classifiercode":"99-42","member_number":"A90368","first_name":"JONATHAN","last_name":"TURNPOWER","classification":"U","division":"PRODUCTION","hit_factor":5.6623},{"match_name":"LCAS August 2016 USPSA","match_date":"2016-08-06","stage_classifiercode":"99-42","member_number":"a91850","first_name":"DAN","last_name":"HARRIS","classification":"M","division":"PRODUCTION","hit_factor":5.6358},{"match_name":"WPS USPSA Monthly Match November 2016","match_date":"2016-11-05","stage_classifiercode":"99-42","member_number":"A95671","first_name":"DUG","last_name":"DUTCHER","classification":"B","division":"PRODUCTION","hit_factor":5.625},{"match_name":"FBURG April 2017 Level I USPSA ","match_date":"2017-04-01","stage_classifiercode":"99-42","member_number":"A101953","first_name":"ANDONI","last_name":"GIBB","classification":"C","division":"PRODUCTION","hit_factor":5.6196},{"match_name":"Richmond Hot Shots 2021 USPSA Special Classifier Match - Jan 24 2021","match_date":"2021-01-24","stage_classifiercode":"99-42","member_number":"TY128570","first_name":"LOGAN","last_name":"YEOM","classification":"C","division":"PRODUCTION","hit_factor":5.6169},{"match_name":"Baghdad USPSA Special Classifier Lightning Interrupted 6 May 2017","match_date":"2017-05-06","stage_classifiercode":"99-42","member_number":"\"\"","first_name":"JAMIE","last_name":"GILL","classification":"U","division":"PRODUCTION","hit_factor":5.6117},{"match_name":"Pathfinder July USPSA Match","match_date":"2017-07-16","stage_classifiercode":"99-42","member_number":"FY23055","first_name":"DOUG","last_name":"HAGUE","classification":"B","division":"PRODUCTION","hit_factor":5.6095},{"match_name":"NCPS USPSA Handgun Match January 28 2018a","match_date":"2018-01-28","stage_classifiercode":"99-42","member_number":"A89965","first_name":"JONG","last_name":"CHOI","classification":"C","division":"PRODUCTION","hit_factor":5.6034},{"match_name":"USPSA","match_date":"2016-09-25","stage_classifiercode":"99-42","member_number":"PEN","first_name":"MATT","last_name":"MADSEN","classification":"none","division":"PRODUCTION","hit_factor":5.5928},{"match_name":"CFRPC USPSA 2017 JUNE","match_date":"2017-06-18","stage_classifiercode":"99-42","member_number":"FY64560","first_name":"ROBERT","last_name":"GRAY","classification":"C","division":"PRODUCTION","hit_factor":5.5888},{"match_name":"MS06 Team Magnolia USPSA October Match","match_date":"2016-10-01","stage_classifiercode":"99-42","member_number":"A98139","first_name":"CARL","last_name":"BERNSTEIN","classification":"C","division":"PRODUCTION","hit_factor":5.5843},{"match_name":"PCWC USPSA 4 22 2017","match_date":"2017-04-22","stage_classifiercode":"99-42","member_number":"a101524","first_name":"TIM","last_name":"USSERY","classification":"U","division":"PRODUCTION","hit_factor":5.5734},{"match_name":"MCPSL Pistol 4-9-16","match_date":"2016-04-09","stage_classifiercode":"99-42","member_number":"A63252","first_name":"DAVID","last_name":"BAKER","classification":"B","division":"PRODUCTION","hit_factor":5.5728},{"match_name":"PIPS 08-03-2016","match_date":"2016-08-03","stage_classifiercode":"99-42","member_number":"TY65888","first_name":"GREGORY","last_name":"BESTLAND","classification":"B","division":"PRODUCTION","hit_factor":5.5684},{"match_name":"WGC August 2018 USPSA 2","match_date":"2018-08-26","stage_classifiercode":"99-42","member_number":"A82324","first_name":"COREY","last_name":"MITCHELL","classification":"M","division":"PRODUCTION","hit_factor":5.5639},{"match_name":"CCPL 03-08-2020","match_date":"2020-03-08","stage_classifiercode":"99-42","member_number":"A83657","first_name":"ROBERT","last_name":"RABINO","classification":"B","division":"PRODUCTION","hit_factor":5.5491},{"match_name":"WPS USPSA Special Classifier October 2017","match_date":"2017-10-28","stage_classifiercode":"99-42","member_number":"PEN","first_name":"JEFF","last_name":"KELLY","classification":"U","division":"PRODUCTION","hit_factor":5.5441},{"match_name":"MS06 Team Magnolia USPSA October Match","match_date":"2016-10-01","stage_classifiercode":"99-42","member_number":"TY78023","first_name":"BRUCE","last_name":"BARTLEY","classification":"A","division":"PRODUCTION","hit_factor":5.5427},{"match_name":"Shasta Shooters August 2017","match_date":"2017-08-12","stage_classifiercode":"99-42","member_number":"A96344","first_name":"RON","last_name":"HILDEBRANT","classification":"A","division":"PRODUCTION","hit_factor":5.5398},{"match_name":"SPSA USPSA February 4th Sat match","match_date":"2018-02-24","stage_classifiercode":"99-42","member_number":"A98914","first_name":"MATTHEW","last_name":"FOX","classification":"B","division":"PRODUCTION","hit_factor":5.5378},{"match_name":"NCPS USPSA Handgun Match January 28 2018a","match_date":"2018-01-28","stage_classifiercode":"99-42","member_number":"A46690","first_name":"GILBERT","last_name":"GESMUNDO","classification":"B","division":"PRODUCTION","hit_factor":5.5378},{"match_name":"3ra Fecha USPSA","match_date":"2018-03-24","stage_classifiercode":"99-42","member_number":"TYF74171","first_name":"MAX","last_name":"RIVERA","classification":"A","division":"PRODUCTION","hit_factor":5.5249},{"match_name":"Shasta Shooters March 2017","match_date":"2017-03-11","stage_classifiercode":"99-42","member_number":"TY94941","first_name":"JEREMY","last_name":"BAKER","classification":"A","division":"PRODUCTION","hit_factor":5.5241},{"match_name":"USPSA MO21 2Alpha SBRC July 25 2020","match_date":"2020-07-25","stage_classifiercode":"99-42","member_number":"A111008","first_name":"CODY","last_name":"SHERMAN","classification":"B","division":"PRODUCTION","hit_factor":5.5236},{"match_name":"SFA USPSA OCTOBER 2020","match_date":"2020-10-17","stage_classifiercode":"99-42","member_number":"A73456","first_name":"JORDAN","last_name":"HALL","classification":"M","division":"PRODUCTION","hit_factor":5.5227},{"match_name":"LBAS160917 Pistol","match_date":"2016-09-17","stage_classifiercode":"99-42","member_number":"A54861","first_name":"DENNIS","last_name":"WALKER","classification":"B","division":"PRODUCTION","hit_factor":5.5207},{"match_name":"GRB USPSA FEB at CAV","match_date":"2018-02-17","stage_classifiercode":"99-42","member_number":"A104180","first_name":"LUCAS","last_name":"DEBRUHL","classification":"U","division":"PRODUCTION","hit_factor":5.5202},{"match_name":"Springfield Tactical Shooters 01/04/2018","match_date":"2018-01-04","stage_classifiercode":"99-42","member_number":"TY78203","first_name":"JIM","last_name":"SHURES","classification":"\"\"","division":"PRODUCTION","hit_factor":5.5172},{"match_name":"3ra Fecha USPSA","match_date":"2018-03-24","stage_classifiercode":"99-42","member_number":"F106795","first_name":"YED","last_name":"DOMINGUEZ-RIVERA","classification":"U","division":"PRODUCTION","hit_factor":5.5102},{"match_name":"LGCSEMPS 2017 SPECIAL CLASSIFIER","match_date":"2017-04-09","stage_classifiercode":"99-42","member_number":"F27488","first_name":"JOE","last_name":"CABA","classification":"C","division":"PRODUCTION","hit_factor":5.5102},{"match_name":"SAPSA April 2016","match_date":"2016-04-16","stage_classifiercode":"99-42","member_number":"A87317","first_name":"MICHAEL","last_name":"DUKES","classification":"C","division":"PRODUCTION","hit_factor":5.5069},{"match_name":"5 Dogs July USPSA","match_date":"2016-07-03","stage_classifiercode":"99-42","member_number":"A88899","first_name":"SCOTT","last_name":"MCDOWELL","classification":"C","division":"PRODUCTION","hit_factor":5.5066},{"match_name":"Shasta Shooters March 2017","match_date":"2017-03-11","stage_classifiercode":"99-42","member_number":"fy89662","first_name":"TODD","last_name":"CANCILLA","classification":"B","division":"PRODUCTION","hit_factor":5.5034},{"match_name":"GRB Jan USPSA @Cav","match_date":"2016-01-16","stage_classifiercode":"99-42","member_number":"A64571","first_name":"CHRIS","last_name":"DYE","classification":"C","division":"PRODUCTION","hit_factor":5.499},{"match_name":"HAS May 2016 Pistol Match","match_date":"2016-05-08","stage_classifiercode":"99-42","member_number":"A84437","first_name":"SEBASTIAN","last_name":"YORDAN","classification":"A","division":"PRODUCTION","hit_factor":5.4931},{"match_name":"DGC USPSA Classifier Match","match_date":"2017-07-30","stage_classifiercode":"99-42","member_number":"FY90633","first_name":"BRANT","last_name":"PACE","classification":"B","division":"PRODUCTION","hit_factor":5.493},{"match_name":"Hampden RPC August USPSA Match","match_date":"2020-08-09","stage_classifiercode":"99-42","member_number":"A122220","first_name":"COREY","last_name":"SMITH","classification":"D","division":"PRODUCTION","hit_factor":5.4857},{"match_name":"Holmen USPSA 10/30/16","match_date":"2016-10-30","stage_classifiercode":"99-42","member_number":"A89893","first_name":"DAN","last_name":"SAVOY","classification":"B","division":"PRODUCTION","hit_factor":5.4852},{"match_name":"SAPS Match 6/6/2020","match_date":"2020-06-06","stage_classifiercode":"99-42","member_number":"A-41730","first_name":"MARC","last_name":"BATTAGLINI","classification":"B","division":"PRODUCTION","hit_factor":5.4822},{"match_name":"APSC USPSA Special Classifier 04-02-16","match_date":"2016-04-02","stage_classifiercode":"99-42","member_number":"l3947","first_name":"ALBERTO","last_name":"RODRIGUEZ","classification":"B","division":"PRODUCTION","hit_factor":5.4795},{"match_name":"MS06 Team Magnolia USPSA October Match","match_date":"2016-10-01","stage_classifiercode":"99-42","member_number":"Ty55093","first_name":"MIKE","last_name":"PIZZOLATTO","classification":"M","division":"PRODUCTION","hit_factor":5.4679},{"match_name":"CCPS March 2020 USPSA","match_date":"2020-03-01","stage_classifiercode":"99-42","member_number":"A57180","first_name":"TROY","last_name":"WILLARD","classification":"X","division":"PRODUCTION","hit_factor":5.4665},{"match_name":"NCPS USPSA Handgun Match January 28 2018a","match_date":"2018-01-28","stage_classifiercode":"99-42","member_number":"A93292","first_name":"ROSS","last_name":"SAN","classification":"A","division":"PRODUCTION","hit_factor":5.4581},{"match_name":"Brothers N Arms August 2017 USPSA Match","match_date":"2017-08-19","stage_classifiercode":"99-42","member_number":"A67704","first_name":"MICHAEL","last_name":"MCDONALD","classification":"M","division":"PRODUCTION","hit_factor":5.4484},{"match_name":"Baghdad USPSA Special Classifier Lightning Interrupted 6 May 2017","match_date":"2017-05-06","stage_classifiercode":"99-42","member_number":"A100606","first_name":"MARK","last_name":"HARDY","classification":"U","division":"PRODUCTION","hit_factor":5.4326},{"match_name":"LNDL June 3rd 2018","match_date":"2018-06-03","stage_classifiercode":"99-42","member_number":"A103491","first_name":"NORMAN","last_name":"ODUCADO","classification":"C","division":"PRODUCTION","hit_factor":5.428},{"match_name":"Crooked Creek Pistol League - April 2017","match_date":"2017-04-22","stage_classifiercode":"99-42","member_number":"A91544","first_name":"BRIAN","last_name":"CLONAN","classification":"B","division":"PRODUCTION","hit_factor":5.4271},{"match_name":"FBURG April 2017 Level I USPSA ","match_date":"2017-04-01","stage_classifiercode":"99-42","member_number":"TY82370","first_name":"MARK","last_name":"ATTANASIO","classification":"C","division":"PRODUCTION","hit_factor":5.423},{"match_name":"RBGC 2017-08-26","match_date":"2017-08-26","stage_classifiercode":"99-42","member_number":"A105180","first_name":"JIM","last_name":"PRUITT","classification":"U","division":"PRODUCTION","hit_factor":5.4171},{"match_name":"LGCSEMPS 2017 SPECIAL CLASSIFIER","match_date":"2017-04-09","stage_classifiercode":"99-42","member_number":"A87440","first_name":"KIYOKAZU","last_name":"NAKAGAWA","classification":"U","division":"PRODUCTION","hit_factor":5.4171},{"match_name":"RCPS USPSA Feb 17","match_date":"2018-02-17","stage_classifiercode":"99-42","member_number":"A105709","first_name":"PHILLIP","last_name":"BAJORAS","classification":"B","division":"PRODUCTION","hit_factor":5.3993},{"match_name":"STest_Apr25","match_date":"2016-04-29","stage_classifiercode":"99-42","member_number":"\"\"","first_name":"TOO","last_name":"LATE","classification":"A","division":"PRODUCTION","hit_factor":5.3927},{"match_name":"CFRPC USPSA 2017 JUNE","match_date":"2017-06-18","stage_classifiercode":"99-42","member_number":"L3615","first_name":"BOBBY","last_name":"RIVERA","classification":"M","division":"PRODUCTION","hit_factor":5.3838},{"match_name":"MISS Match 11-2-16","match_date":"2016-10-31","stage_classifiercode":"99-42","member_number":"A76607","first_name":"TERRY","last_name":"BROWN","classification":"B","division":"PRODUCTION","hit_factor":5.3821},{"match_name":"FRAPC USPSA  League 4","match_date":"2018-06-05","stage_classifiercode":"99-42","member_number":"A72016","first_name":"SAMUEL","last_name":"SCHMITT","classification":"B","division":"PRODUCTION","hit_factor":5.3738},{"match_name":"Southkent USPSA MAY match","match_date":"2017-05-20","stage_classifiercode":"99-42","member_number":"A102492","first_name":"TANNER","last_name":"POND","classification":"D","division":"PRODUCTION","hit_factor":5.3664},{"match_name":"NCPS USPSA Handgun Match January 28 2018a","match_date":"2018-01-28","stage_classifiercode":"99-42","member_number":"A101928","first_name":"JUSTIN","last_name":"GRYGIERCZYK","classification":"U","division":"PRODUCTION","hit_factor":5.3631},{"match_name":"OFGC Practical Pistol Match 8-16-20","match_date":"2020-08-16","stage_classifiercode":"99-42","member_number":"A92527","first_name":"JAKE","last_name":"NOBLE","classification":"C","division":"PRODUCTION","hit_factor":5.3613},{"match_name":"2020-10-03 USPSA  at Phoenix Rod and Gun Club","match_date":"2020-10-03","stage_classifiercode":"99-42","member_number":"A103714","first_name":"DAN","last_name":"TYLER","classification":"B","division":"PRODUCTION","hit_factor":5.3468},{"match_name":"Pathfinder July USPSA Match","match_date":"2017-07-16","stage_classifiercode":"99-42","member_number":"A1037","first_name":"ALBERT","last_name":"DESIDERIO","classification":"C","division":"PRODUCTION","hit_factor":5.3384},{"match_name":"Crooked Creek Pistol League - April 2017","match_date":"2017-04-22","stage_classifiercode":"99-42","member_number":"A101245","first_name":"NICK","last_name":"FATICA","classification":"B","division":"PRODUCTION","hit_factor":5.3307},{"match_name":"Shoot GTR USPSA 11/22","match_date":"2016-11-22","stage_classifiercode":"99-42","member_number":"A65542","first_name":"JAMES","last_name":"RAMOS","classification":"U","division":"PRODUCTION","hit_factor":5.3305},{"match_name":"CFRPC USPSA 2017 JUNE","match_date":"2017-06-18","stage_classifiercode":"99-42","member_number":"A96592","first_name":"RUSSELL","last_name":"PATE","classification":"B","division":"PRODUCTION","hit_factor":5.3302},{"match_name":"PIPS 08-03-2016","match_date":"2016-08-03","stage_classifiercode":"99-42","member_number":"A46789","first_name":"JERRY","last_name":"JOHNSON","classification":"B","division":"PRODUCTION","hit_factor":5.3232},{"match_name":"Springfield Tactical Shooters 01-05-2017","match_date":"2017-01-05","stage_classifiercode":"99-42","member_number":"A91182","first_name":"MATTHEW","last_name":"ACKER","classification":"B","division":"PRODUCTION","hit_factor":5.317},{"match_name":"CCPL 07102016","match_date":"2016-07-10","stage_classifiercode":"99-42","member_number":"A94432","first_name":"GRANT","last_name":"SCOTT","classification":"C","division":"PRODUCTION","hit_factor":5.3016},{"match_name":"USPSA","match_date":"2016-09-25","stage_classifiercode":"99-42","member_number":"ty69645","first_name":"GARY","last_name":"MCCONNELL","classification":"C","division":"PRODUCTION","hit_factor":5.3012},{"match_name":"ORSA USPSA July 2021","match_date":"2021-07-17","stage_classifiercode":"99-42","member_number":"TY102283","first_name":"SHERWIN","last_name":"OCAMPO","classification":"B","division":"PRODUCTION","hit_factor":5.3007},{"match_name":"Richmond Hot Shots 2021 USPSA Special Classifier Match - Jan 24 2021","match_date":"2021-01-24","stage_classifiercode":"99-42","member_number":"L2531","first_name":"BRIAN","last_name":"CHIN","classification":"C","division":"PRODUCTION","hit_factor":5.298},{"match_name":"Southkent USPSA MAY match","match_date":"2017-05-20","stage_classifiercode":"99-42","member_number":"\"\"","first_name":"JAKE","last_name":"GOOSSEN","classification":"U","division":"PRODUCTION","hit_factor":5.2941},{"match_name":"Shasta Shooters March 2017","match_date":"2017-03-11","stage_classifiercode":"99-42","member_number":"A96344","first_name":"RON","last_name":"HILDEBRANT","classification":"B","division":"PRODUCTION","hit_factor":5.2922},{"match_name":"3ra Fecha USPSA","match_date":"2018-03-24","stage_classifiercode":"99-42","member_number":"A104236","first_name":"SANDRO J","last_name":"GONZALEZ-ALVAREZ","classification":"C","division":"PRODUCTION","hit_factor":5.283},{"match_name":"APSC USPSA Special Classifier 04-02-16","match_date":"2016-04-02","stage_classifiercode":"99-42","member_number":"A94815","first_name":"NICK","last_name":"GILMAN","classification":"U","division":"PRODUCTION","hit_factor":5.2786},{"match_name":"SAPSA April 2016","match_date":"2016-04-16","stage_classifiercode":"99-42","member_number":"A88003","first_name":"RICH","last_name":"OTT","classification":"B","division":"PRODUCTION","hit_factor":5.2752},{"match_name":"Sharp Practical Shooters March USPSA Match","match_date":"2018-03-25","stage_classifiercode":"99-42","member_number":"A95272","first_name":"WADE","last_name":"MEYER","classification":"U","division":"PRODUCTION","hit_factor":5.2743},{"match_name":"Richmond Hot Shots 2021 USPSA Special Classifier Match - Jan 24 2021","match_date":"2021-01-24","stage_classifiercode":"99-42","member_number":"TY93243","first_name":"TONY","last_name":"LUONG","classification":"B","division":"PRODUCTION","hit_factor":5.2734},{"match_name":"HAS May 2016 Pistol Match","match_date":"2016-05-08","stage_classifiercode":"99-42","member_number":"\"\"","first_name":"AARON","last_name":"PACYNA","classification":"X","division":"PRODUCTION","hit_factor":5.2695},{"match_name":"PSAC_20170923","match_date":"2017-09-23","stage_classifiercode":"99-42","member_number":"FY92911","first_name":"JOHN","last_name":"COOREMAN","classification":"U","division":"PRODUCTION","hit_factor":5.2687},{"match_name":"Richmond Hot Shots 2021 USPSA Special Classifier Match - Jan 24 2021","match_date":"2021-01-24","stage_classifiercode":"99-42","member_number":"A103694","first_name":"GEORGE","last_name":"WAGNER","classification":"C","division":"PRODUCTION","hit_factor":5.2569},{"match_name":"Baghdad USPSA Special Classifier Lightning Interrupted 6 May 2017","match_date":"2017-05-06","stage_classifiercode":"99-42","member_number":"\"\"","first_name":"JOEL","last_name":"SCHENKEL","classification":"U","division":"PRODUCTION","hit_factor":5.2356},{"match_name":"PIPS 08-03-2016","match_date":"2016-08-03","stage_classifiercode":"99-42","member_number":"A92852","first_name":"DAN","last_name":"LINDAHL","classification":"U","division":"PRODUCTION","hit_factor":5.2356},{"match_name":"Richmond Hot Shots February 5-2017 USPSA Pistol Match","match_date":"2017-02-05","stage_classifiercode":"99-42","member_number":"A79352","first_name":"HEATHER","last_name":"PRICE","classification":"C","division":"PRODUCTION","hit_factor":5.2332},{"match_name":"USPSA MO21 2Alpha SBRC July 25 2020","match_date":"2020-07-25","stage_classifiercode":"99-42","member_number":"A101290","first_name":"AUSTIN","last_name":"RIST","classification":"A","division":"PRODUCTION","hit_factor":5.2298},{"match_name":"1ra Fecha USPSA","match_date":"2016-01-10","stage_classifiercode":"99-42","member_number":"A90954","first_name":"ROBERTO","last_name":"MORALES","classification":"U","division":"PRODUCTION","hit_factor":5.2261},{"match_name":"NCPS USPSA Handgun Match January 28 2018a","match_date":"2018-01-28","stage_classifiercode":"99-42","member_number":"TY56287","first_name":"CHAD","last_name":"CASE","classification":"M","division":"PRODUCTION","hit_factor":5.2239},{"match_name":"MCAS December 2018","match_date":"2018-12-15","stage_classifiercode":"99-42","member_number":"A101416","first_name":"SLADE","last_name":"BETTENHAUSEN","classification":"B","division":"PRODUCTION","hit_factor":5.2158},{"match_name":"LNDL June 3rd 2018","match_date":"2018-06-03","stage_classifiercode":"99-42","member_number":"A104777","first_name":"RAY","last_name":"GALLARDO","classification":"B","division":"PRODUCTION","hit_factor":5.2139},{"match_name":"Atlanta Practical Shooters March 2016 USPSA - Classifier Match","match_date":"2016-03-06","stage_classifiercode":"99-42","member_number":"A85628","first_name":"CHRIS","last_name":"MOORE","classification":"B","division":"PRODUCTION","hit_factor":5.2117},{"match_name":"Shongum October 2016 USPSA Match","match_date":"2016-10-01","stage_classifiercode":"99-42","member_number":"A-83305","first_name":"RUSSELL","last_name":"TAGLIARENI","classification":"C","division":"PRODUCTION","hit_factor":5.2061},{"match_name":"Holmen USPSA 10/30/16","match_date":"2016-10-30","stage_classifiercode":"99-42","member_number":"L3466","first_name":"RYAN","last_name":"VIERZBA","classification":"B","division":"PRODUCTION","hit_factor":5.2029},{"match_name":"Crooked Creek Pistol League - March 26-27 2016","match_date":"2016-03-26","stage_classifiercode":"99-42","member_number":"A83391","first_name":"BRIAN","last_name":"BOEHRINGER","classification":"B","division":"PRODUCTION","hit_factor":5.2018},{"match_name":"MPSA 071616","match_date":"2016-07-16","stage_classifiercode":"99-42","member_number":"A78083","first_name":"JEFFREY","last_name":"BLITCH","classification":"B","division":"PRODUCTION","hit_factor":5.1948},{"match_name":"CCPS March 2020 USPSA","match_date":"2020-03-01","stage_classifiercode":"99-42","member_number":"FY81556","first_name":"BRAD","last_name":"PACEY","classification":"B","division":"PRODUCTION","hit_factor":5.1919},{"match_name":"Hampden RPC August USPSA Match","match_date":"2020-08-09","stage_classifiercode":"99-42","member_number":"TY61007","first_name":"STEVE","last_name":"RICHENS","classification":"B","division":"PRODUCTION","hit_factor":5.1802},{"match_name":"WPS USPSA Monthly Match November 2016","match_date":"2016-11-05","stage_classifiercode":"99-42","member_number":"A61698","first_name":"VINCENT","last_name":"PASCALE","classification":"C","division":"PRODUCTION","hit_factor":5.1793},{"match_name":"CFRPC June USPSA","match_date":"2018-06-17","stage_classifiercode":"99-42","member_number":"TY66971","first_name":"BILL","last_name":"CAPERS","classification":"B","division":"PRODUCTION","hit_factor":5.1708},{"match_name":"GRB Jan USPSA @Cav","match_date":"2016-01-16","stage_classifiercode":"99-42","member_number":"FY37038","first_name":"CHRIS","last_name":"VIVERETTE","classification":"B","division":"PRODUCTION","hit_factor":5.1625},{"match_name":"Richmond Boro Gun Club March 2020 USPSA Match","match_date":"2020-03-14","stage_classifiercode":"99-42","member_number":"TY120227","first_name":"RAY","last_name":"CHAN","classification":"C","division":"PRODUCTION","hit_factor":5.16},{"match_name":"LGCSEMPS 2017 SPECIAL CLASSIFIER","match_date":"2017-04-09","stage_classifiercode":"99-42","member_number":"A86063","first_name":"DOUG","last_name":"BRIGGS","classification":"B","division":"PRODUCTION","hit_factor":5.1597},{"match_name":"CFRPC June USPSA","match_date":"2018-06-17","stage_classifiercode":"99-42","member_number":"A99063","first_name":"THOMAS","last_name":"KRIEGER","classification":"C","division":"PRODUCTION","hit_factor":5.1587},{"match_name":"Atlanta Practical Shooters November 2016 USPSA","match_date":"2016-11-06","stage_classifiercode":"99-42","member_number":"TY95372","first_name":"CHRISTOPHER","last_name":"LEE","classification":"C","division":"PRODUCTION","hit_factor":5.1576},{"match_name":"MISS Match 11-2-16","match_date":"2016-10-31","stage_classifiercode":"99-42","member_number":"TY77227","first_name":"THOMAS","last_name":"BEHNKE","classification":"B","division":"PRODUCTION","hit_factor":5.1546},{"match_name":"Wvpps May2016","match_date":"2016-05-15","stage_classifiercode":"99-42","member_number":"TY93667","first_name":"AARON","last_name":"WILSON","classification":"\"\"","division":"PRODUCTION","hit_factor":5.1536},{"match_name":"CFRPC USPSA 2017 JUNE","match_date":"2017-06-18","stage_classifiercode":"99-42","member_number":"A73571","first_name":"TONY","last_name":"VICHITTRA","classification":"M","division":"PRODUCTION","hit_factor":5.1527},{"match_name":"Shasta Shooters March 2017","match_date":"2017-03-11","stage_classifiercode":"99-42","member_number":"A85793","first_name":"CHRIS","last_name":"PEPLOW","classification":"U","division":"PRODUCTION","hit_factor":5.1485},{"match_name":"Baghdad USPSA Special Classifier Lightning Interrupted 6 May 2017","match_date":"2017-05-06","stage_classifiercode":"99-42","member_number":"A99956","first_name":"RAY","last_name":"HULSMAN","classification":"C","division":"PRODUCTION","hit_factor":5.1471},{"match_name":"5 Dogs July USPSA","match_date":"2016-07-03","stage_classifiercode":"99-42","member_number":"\"\"","first_name":"ALLAN","last_name":"WEBSTER","classification":"Unclassified","division":"PRODUCTION","hit_factor":5.1462},{"match_name":"FVPS August USPSA Match","match_date":"2018-08-04","stage_classifiercode":"99-42","member_number":"A110152","first_name":"DAVID","last_name":"EBERHART","classification":"C","division":"PRODUCTION","hit_factor":5.1392},{"match_name":"WGC October 2018 USPSA 2","match_date":"2018-10-28","stage_classifiercode":"99-42","member_number":"A98139","first_name":"CARL","last_name":"BERNSTEIN","classification":"B","division":"PRODUCTION","hit_factor":5.1387},{"match_name":"Richmond Hot Shots February 5-2017 USPSA Pistol Match","match_date":"2017-02-05","stage_classifiercode":"99-42","member_number":"TY71210","first_name":"BLADE","last_name":"BENSON","classification":"C","division":"PRODUCTION","hit_factor":5.1383},{"match_name":"USPSA Bass River June 2017","match_date":"2017-06-04","stage_classifiercode":"99-42","member_number":"A56982","first_name":"ARIEL","last_name":"WEISBERG","classification":"\"\"","division":"PRODUCTION","hit_factor":5.1376},{"match_name":"1ra Fecha USPSA","match_date":"2016-01-10","stage_classifiercode":"99-42","member_number":"TY84536","first_name":"IVAN","last_name":"SERRANO AVILA","classification":"C","division":"PRODUCTION","hit_factor":5.1376},{"match_name":"Minnetonka Game And Fish May 3","match_date":"2017-05-03","stage_classifiercode":"99-42","member_number":"L2504","first_name":"STEVEN","last_name":"ZERWAS","classification":"A","division":"PRODUCTION","hit_factor":5.1337},{"match_name":"CFRPC USPSA 2017 JUNE","match_date":"2017-06-18","stage_classifiercode":"99-42","member_number":"A96584","first_name":"RYAN","last_name":"NASH","classification":"C","division":"PRODUCTION","hit_factor":5.1282},{"match_name":"HAS May 2016 Pistol Match","match_date":"2016-05-08","stage_classifiercode":"99-42","member_number":"A37843","first_name":"RICHARD","last_name":"KINNEY","classification":"C","division":"PRODUCTION","hit_factor":5.1233},{"match_name":"3ra Fecha USPSA","match_date":"2018-03-24","stage_classifiercode":"99-42","member_number":"TY84044","first_name":"KATHIA","last_name":"RIVERA-MELENDEZ","classification":"C","division":"PRODUCTION","hit_factor":5.1232},{"match_name":"USPSA","match_date":"2016-09-25","stage_classifiercode":"99-42","member_number":"A90289","first_name":"ARIEL","last_name":"DELA FUENTE","classification":"none","division":"PRODUCTION","hit_factor":5.1232},{"match_name":"USPSA","match_date":"2016-09-25","stage_classifiercode":"99-42","member_number":"A43849","first_name":"DAREN","last_name":"KIRTS","classification":"B","division":"PRODUCTION","hit_factor":5.1176},{"match_name":"MCPSL Pistol 4-9-16","match_date":"2016-04-09","stage_classifiercode":"99-42","member_number":"PEN","first_name":"BRIAN","last_name":"TRIGG","classification":"U","division":"PRODUCTION","hit_factor":5.1081},{"match_name":"Minnetonka Game And Fish May 3","match_date":"2017-05-03","stage_classifiercode":"99-42","member_number":"\"\"","first_name":"MAX","last_name":"LIEN","classification":"U","division":"PRODUCTION","hit_factor":5.1064},{"match_name":"RBGC 2017-08-26","match_date":"2017-08-26","stage_classifiercode":"99-42","member_number":"A94675","first_name":"RICK","last_name":"THOMPSON","classification":"X","division":"PRODUCTION","hit_factor":5.1054},{"match_name":"FBURG April 2017 Level I USPSA ","match_date":"2017-04-01","stage_classifiercode":"99-42","member_number":"L3124","first_name":"ROBERT","last_name":"EPPERSON","classification":"B","division":"PRODUCTION","hit_factor":5.104},{"match_name":"PASA USPSA 3-18-18","match_date":"2018-03-18","stage_classifiercode":"99-42","member_number":"TY76538","first_name":"JAMIE","last_name":"DANIELS","classification":"C","division":"PRODUCTION","hit_factor":5.104},{"match_name":"CCPL 03-08-2020","match_date":"2020-03-08","stage_classifiercode":"99-42","member_number":"TY105155","first_name":"ALBERT","last_name":"COITO","classification":"B","division":"PRODUCTION","hit_factor":5.103},{"match_name":"Richmond Boro Gun Club March 2020 USPSA Match","match_date":"2020-03-14","stage_classifiercode":"99-42","member_number":"A120176","first_name":"MATT","last_name":"WESTGATE","classification":"C","division":"PRODUCTION","hit_factor":5.102},{"match_name":"SAPSA April 2016","match_date":"2016-04-16","stage_classifiercode":"99-42","member_number":"A68933","first_name":"JEFF","last_name":"BILOTTI","classification":"B","division":"PRODUCTION","hit_factor":5.0847},{"match_name":"CCPS March 2020 USPSA","match_date":"2020-03-01","stage_classifiercode":"99-42","member_number":"A123810","first_name":"WAYLON","last_name":"STEINMAN","classification":"D","division":"PRODUCTION","hit_factor":5.0833},{"match_name":"Enps May 2021 USPSA MATCH-All Classifier","match_date":"2021-05-02","stage_classifiercode":"99-42","member_number":"A122124","first_name":"AUSTIN","last_name":"ADAMS","classification":"U","division":"PRODUCTION","hit_factor":5.0805},{"match_name":"Atlanta Practical Shooters March 2016 USPSA - Classifier Match","match_date":"2016-03-06","stage_classifiercode":"99-42","member_number":"A90194","first_name":"DARRELL","last_name":"WILSON","classification":"C","division":"PRODUCTION","hit_factor":5.08},{"match_name":"LGCSEMPS 2017 SPECIAL CLASSIFIER","match_date":"2017-04-09","stage_classifiercode":"99-42","member_number":"\"\"","first_name":"DON","last_name":"HOUGH","classification":"U","division":"PRODUCTION","hit_factor":5.0781},{"match_name":"5 Dogs July USPSA","match_date":"2016-07-03","stage_classifiercode":"99-42","member_number":"\"\"","first_name":"DANE","last_name":"HERNDON","classification":"B","division":"PRODUCTION","hit_factor":5.0686},{"match_name":"MCPSL Pistol 4-9-16","match_date":"2016-04-09","stage_classifiercode":"99-42","member_number":"A81902","first_name":"JUSTIN","last_name":"MORRIS","classification":"A","division":"PRODUCTION","hit_factor":5.068},{"match_name":"LBAS160917 Pistol","match_date":"2016-09-17","stage_classifiercode":"99-42","member_number":"A83985","first_name":"STEVEN","last_name":"NOVELL","classification":"B","division":"PRODUCTION","hit_factor":5.0633},{"match_name":"Brothers N Arms August 2017 USPSA Match","match_date":"2017-08-19","stage_classifiercode":"99-42","member_number":"A102073","first_name":"WILLIAM","last_name":"WALKER","classification":"U","division":"PRODUCTION","hit_factor":5.0609},{"match_name":"FBURG April 2017 Level I USPSA ","match_date":"2017-04-01","stage_classifiercode":"99-42","member_number":"TY72189","first_name":"KELLY","last_name":"COBEAN","classification":"B","division":"PRODUCTION","hit_factor":5.0556},{"match_name":"GRB Jan USPSA @Cav","match_date":"2016-01-16","stage_classifiercode":"99-42","member_number":"\"\"","first_name":"CARRIE","last_name":"CARLSON","classification":"B","division":"PRODUCTION","hit_factor":5.0505},{"match_name":"Briar Rabbit August Match 2016","match_date":"2016-08-28","stage_classifiercode":"99-42","member_number":"A92987","first_name":"JERRY","last_name":"PROFFITT","classification":"D","division":"PRODUCTION","hit_factor":5.0505},{"match_name":"MCPSL Pistol 4-9-16","match_date":"2016-04-09","stage_classifiercode":"99-42","member_number":"A92348","first_name":"CHARLIE","last_name":"MODEREGER","classification":"U","division":"PRODUCTION","hit_factor":5.0485},{"match_name":"Enps May 2021 USPSA MATCH-All Classifier","match_date":"2021-05-02","stage_classifiercode":"99-42","member_number":"A100602","first_name":"CHRIS","last_name":"STUART","classification":"U","division":"PRODUCTION","hit_factor":5.0485},{"match_name":"LGCSEMPS 2017 SPECIAL CLASSIFIER","match_date":"2017-04-09","stage_classifiercode":"99-42","member_number":"\"\"","first_name":"TANNER","last_name":"POND","classification":"U","division":"PRODUCTION","hit_factor":5.0479},{"match_name":"STest_Apr25","match_date":"2016-04-29","stage_classifiercode":"99-42","member_number":"\"\"","first_name":"CHRIS","last_name":"DEBRUIN","classification":"U","division":"PRODUCTION","hit_factor":5.0459},{"match_name":"Cactus USPSA ALL CLASSIFIER September 2020","match_date":"2020-09-06","stage_classifiercode":"99-42","member_number":"A71500","first_name":"BRIAN","last_name":"GREEN","classification":"C","division":"PRODUCTION","hit_factor":5.045},{"match_name":"Richmond Hot Shots February 5-2017 USPSA Pistol Match","match_date":"2017-02-05","stage_classifiercode":"99-42","member_number":"L4027","first_name":"JULES","last_name":"VANFAU","classification":"C","division":"PRODUCTION","hit_factor":5.045},{"match_name":"CCPL 07102016","match_date":"2016-07-10","stage_classifiercode":"99-42","member_number":"TY96532","first_name":"ALLAN","last_name":"WEBSTER","classification":"U","division":"PRODUCTION","hit_factor":5.0401},{"match_name":"Eagles Nest July 17th","match_date":"2016-07-17","stage_classifiercode":"99-42","member_number":"A97336","first_name":"JOHN","last_name":"TURNER","classification":"U","division":"PRODUCTION","hit_factor":5.0347},{"match_name":"NOCPC June 2018","match_date":"2018-06-10","stage_classifiercode":"99-42","member_number":"L4176","first_name":"BRUCE","last_name":"SCHRADER","classification":"B","division":"PRODUCTION","hit_factor":5.0251},{"match_name":"SPSA USPSA February 4th Sat match","match_date":"2018-02-24","stage_classifiercode":"99-42","member_number":"A106222","first_name":"DANIEL","last_name":"LEITH","classification":"B","division":"PRODUCTION","hit_factor":5.0204},{"match_name":"CTASA 3rd Sunday USPSA - March 2018","match_date":"2018-03-18","stage_classifiercode":"99-42","member_number":"A84416","first_name":"JOSH","last_name":"COON","classification":"U","division":"PRODUCTION","hit_factor":5.0145},{"match_name":"Brothers N Arms August 2017 USPSA Match","match_date":"2017-08-19","stage_classifiercode":"99-42","member_number":"A39712","first_name":"WADE","last_name":"REAVES","classification":"U","division":"PRODUCTION","hit_factor":5.0139},{"match_name":"GRB USPSA FEB at CAV","match_date":"2018-02-17","stage_classifiercode":"99-42","member_number":"TY99991","first_name":"DENTON","last_name":"ADAM","classification":"U","division":"PRODUCTION","hit_factor":5.0119},{"match_name":"SAPS Match 6/6/2020","match_date":"2020-06-06","stage_classifiercode":"99-42","member_number":"A120358","first_name":"MATT","last_name":"FOREMAN","classification":"C","division":"PRODUCTION","hit_factor":5.0096},{"match_name":"MCAS December 2018","match_date":"2018-12-15","stage_classifiercode":"99-42","member_number":"A82360","first_name":"MARK","last_name":"TURNER","classification":"C","division":"PRODUCTION","hit_factor":5.0046},{"match_name":"Prescott 1 st Saturday Uspsa 11-05-2016","match_date":"2016-11-05","stage_classifiercode":"99-42","member_number":"A97929","first_name":"JERAD","last_name":"RICHARDSON","classification":"U","division":"PRODUCTION","hit_factor":5},{"match_name":"ORSA USPSA Chuck Berry Memorial Match 15 April","match_date":"2017-04-15","stage_classifiercode":"99-42","member_number":"A63387","first_name":"FRANK","last_name":"CASTIGLIA","classification":"B","division":"PRODUCTION","hit_factor":5},{"match_name":"SAPSA April 2016","match_date":"2016-04-16","stage_classifiercode":"99-42","member_number":"A78372","first_name":"BILL","last_name":"HARRIS","classification":"B","division":"PRODUCTION","hit_factor":4.9892},{"match_name":"MVPJan2017","match_date":"2017-01-07","stage_classifiercode":"99-42","member_number":"\"\"","first_name":"JUSTIN","last_name":"MARTINEZ","classification":"U","division":"PRODUCTION","hit_factor":4.9793},{"match_name":"CCPL 07102016","match_date":"2016-07-10","stage_classifiercode":"99-42","member_number":"A77402","first_name":"BRIAN","last_name":"LUM","classification":"B","division":"PRODUCTION","hit_factor":4.9704},{"match_name":"GRB USPSA FEB at CAV","match_date":"2018-02-17","stage_classifiercode":"99-42","member_number":"A103880","first_name":"DJ","last_name":"PALOMBO","classification":"U","division":"PRODUCTION","hit_factor":4.9618},{"match_name":"LGCSEMPS 2017 SPECIAL CLASSIFIER","match_date":"2017-04-09","stage_classifiercode":"99-42","member_number":"TY88910","first_name":"LITO","last_name":"JULIANO","classification":"U","division":"PRODUCTION","hit_factor":4.9571},{"match_name":"FBURG April 2017 Level I USPSA ","match_date":"2017-04-01","stage_classifiercode":"99-42","member_number":"L975","first_name":"LORI","last_name":"CLICK","classification":"C","division":"PRODUCTION","hit_factor":4.9541},{"match_name":"1ra Fecha USPSA","match_date":"2016-01-10","stage_classifiercode":"99-42","member_number":"TY83896","first_name":"EDDIE","last_name":"LABRADOR ORTIZ","classification":"B","division":"PRODUCTION","hit_factor":4.9505},{"match_name":"LGCSEMPS 2017 SPECIAL CLASSIFIER","match_date":"2017-04-09","stage_classifiercode":"99-42","member_number":"A96087","first_name":"CRAIG","last_name":"HALSETH","classification":"U","division":"PRODUCTION","hit_factor":4.9505},{"match_name":"Crooked Creek Pistol League - April 2017","match_date":"2017-04-22","stage_classifiercode":"99-42","member_number":"A57000","first_name":"TIM","last_name":"WEBB","classification":"B","division":"PRODUCTION","hit_factor":4.9332},{"match_name":"FBURG April 2017 Level I USPSA ","match_date":"2017-04-01","stage_classifiercode":"99-42","member_number":"\"\"","first_name":"CRAIG","last_name":"KLEEMANN","classification":"U","division":"PRODUCTION","hit_factor":4.932},{"match_name":"APSC USPSA Special Classifier 04-02-16","match_date":"2016-04-02","stage_classifiercode":"99-42","member_number":"A87128","first_name":"ROB","last_name":"STINE","classification":"C","division":"PRODUCTION","hit_factor":4.9242},{"match_name":"PCWC USPSA 4 22 2017","match_date":"2017-04-22","stage_classifiercode":"99-42","member_number":"A93231","first_name":"VITTORIO","last_name":"COTTINI","classification":"B","division":"PRODUCTION","hit_factor":4.9231},{"match_name":"CCPL 07102016","match_date":"2016-07-10","stage_classifiercode":"99-42","member_number":"A93243","first_name":"TONY","last_name":"LUONG","classification":"C","division":"PRODUCTION","hit_factor":4.9164},{"match_name":"Springfield Tactical Shooters 01-05-2017","match_date":"2017-01-05","stage_classifiercode":"99-42","member_number":"TY78203","first_name":"JIM","last_name":"SHURES","classification":"U","division":"PRODUCTION","hit_factor":4.9145},{"match_name":"LPC April 2016 USPSA Match","match_date":"2016-04-03","stage_classifiercode":"99-42","member_number":"A82297","first_name":"GEN","last_name":"QUALE","classification":"B","division":"PRODUCTION","hit_factor":4.9145},{"match_name":"Prescott 1 st Saturday Uspsa 11-05-2016","match_date":"2016-11-05","stage_classifiercode":"99-42","member_number":"A54668","first_name":"DAVID","last_name":"ZINK","classification":"G","division":"PRODUCTION","hit_factor":4.9102},{"match_name":"Atlanta Practical Shooters November 2016 USPSA","match_date":"2016-11-06","stage_classifiercode":"99-42","member_number":"A92805","first_name":"DAVID","last_name":"MAYS","classification":"C","division":"PRODUCTION","hit_factor":4.903},{"match_name":"Eagles Nest July 17th","match_date":"2016-07-17","stage_classifiercode":"99-42","member_number":"TY85173","first_name":"RYAN","last_name":"ZAMBRZYCKI","classification":"A","division":"PRODUCTION","hit_factor":4.902},{"match_name":"FLPSA USPSA Pistol League 06.28.2016","match_date":"2016-06-28","stage_classifiercode":"99-42","member_number":"A91699","first_name":"SHANE","last_name":"WURST","classification":"U","division":"PRODUCTION","hit_factor":4.8951},{"match_name":"CFRPC June USPSA","match_date":"2018-06-17","stage_classifiercode":"99-42","member_number":"A105024","first_name":"SEAN","last_name":"GLENVILLE","classification":"C","division":"PRODUCTION","hit_factor":4.893},{"match_name":"EAGC July 2016 USPSA Pistol Match","match_date":"2016-07-17","stage_classifiercode":"99-42","member_number":"A83950","first_name":"BRANDON","last_name":"REYNOLDS","classification":"B","division":"PRODUCTION","hit_factor":4.8813},{"match_name":"Hampden RPC August USPSA Match","match_date":"2020-08-09","stage_classifiercode":"99-42","member_number":"TY101366","first_name":"HANK","last_name":"POIRIER","classification":"B","division":"PRODUCTION","hit_factor":4.878},{"match_name":"PSAC_20170923","match_date":"2017-09-23","stage_classifiercode":"99-42","member_number":"TY105105","first_name":"EDWARD","last_name":"ABE","classification":"U","division":"PRODUCTION","hit_factor":4.8726},{"match_name":"Crooked Creek Pistol League - March 26-27 2016","match_date":"2016-03-26","stage_classifiercode":"99-42","member_number":"\"\"","first_name":"DAVID","last_name":"MCCAMMON","classification":"U","division":"PRODUCTION","hit_factor":4.8701},{"match_name":"ORSA USPSA July 2021","match_date":"2021-07-17","stage_classifiercode":"99-42","member_number":"A72343","first_name":"PAUL","last_name":"AVERY","classification":"B","division":"PRODUCTION","hit_factor":4.8569},{"match_name":"FBURG April 2017 Level I USPSA ","match_date":"2017-04-01","stage_classifiercode":"99-42","member_number":"L3413","first_name":"CLAY","last_name":"KLEMM","classification":"A","division":"PRODUCTION","hit_factor":4.8472},{"match_name":"Richmond Boro Gun Club March 2020 USPSA Match","match_date":"2020-03-14","stage_classifiercode":"99-42","member_number":"A121446","first_name":"SAL","last_name":"AMATO","classification":"C","division":"PRODUCTION","hit_factor":4.8472},{"match_name":"GRB Jan USPSA @Cav","match_date":"2016-01-16","stage_classifiercode":"99-42","member_number":"A90562","first_name":"CHRIS","last_name":"JACKSON","classification":"B","division":"PRODUCTION","hit_factor":4.8462},{"match_name":"SAPSA April 2016","match_date":"2016-04-16","stage_classifiercode":"99-42","member_number":"TY59431","first_name":"RICKY","last_name":"CHAVARRIAGA","classification":"B","division":"PRODUCTION","hit_factor":4.8417},{"match_name":"NVSA USPSA 2101","match_date":"2021-01-17","stage_classifiercode":"99-42","member_number":"A90270","first_name":"DAVID","last_name":"HONG","classification":"C","division":"PRODUCTION","hit_factor":4.8293},{"match_name":"Prescott 1 st Saturday Uspsa 11-05-2016","match_date":"2016-11-05","stage_classifiercode":"99-42","member_number":"TY58975","first_name":"BEN","last_name":"SMITH","classification":"B","division":"PRODUCTION","hit_factor":4.8216},{"match_name":"Patriot Action Shooters 2016 Special Classifier","match_date":"2016-03-19","stage_classifiercode":"99-42","member_number":"Ty57870","first_name":"GREG","last_name":"PRIVETT","classification":"B","division":"PRODUCTION","hit_factor":4.8214},{"match_name":"Richmond Boro Gun Club March 2020 USPSA Match","match_date":"2020-03-14","stage_classifiercode":"99-42","member_number":"A106866","first_name":"MIKHAIL","last_name":"OSTROV","classification":"C","division":"PRODUCTION","hit_factor":4.8193},{"match_name":"Richmond Hot Shots February 5-2017 USPSA Pistol Match","match_date":"2017-02-05","stage_classifiercode":"99-42","member_number":"TY80590","first_name":"STEVE","last_name":"DITTMANN","classification":"M","division":"PRODUCTION","hit_factor":4.8177},{"match_name":"GAS July 7th Special Classifier","match_date":"2018-07-07","stage_classifiercode":"99-42","member_number":"L4483","first_name":"BRENT","last_name":"GAWRYLUK","classification":"B","division":"PRODUCTION","hit_factor":4.8123},{"match_name":"Shoot GTR USPSA 11/22","match_date":"2016-11-22","stage_classifiercode":"99-42","member_number":"A55594","first_name":"GENE","last_name":"WILKERSON","classification":"B","division":"PRODUCTION","hit_factor":4.8048},{"match_name":"Steel City USPSA July 2016","match_date":"2016-07-02","stage_classifiercode":"99-42","member_number":"A97648","first_name":"ZAC","last_name":"JOINER","classification":"U","division":"PRODUCTION","hit_factor":4.8043},{"match_name":"FBURG April 2017 Level I USPSA ","match_date":"2017-04-01","stage_classifiercode":"99-42","member_number":"A98620","first_name":"MATTHEW","last_name":"OLSEN","classification":"D","division":"PRODUCTION","hit_factor":4.7986},{"match_name":"GAS July 7th Special Classifier","match_date":"2018-07-07","stage_classifiercode":"99-42","member_number":"A110256","first_name":"GRAHAM","last_name":"NICHOLAS","classification":"U","division":"PRODUCTION","hit_factor":4.7945},{"match_name":"FBURG April 2017 Level I USPSA ","match_date":"2017-04-01","stage_classifiercode":"99-42","member_number":"L3439","first_name":"AL","last_name":"WILLIAMSON","classification":"B","division":"PRODUCTION","hit_factor":4.7853},{"match_name":"Baghdad USPSA Special Classifier Lightning Interrupted 6 May 2017","match_date":"2017-05-06","stage_classifiercode":"99-42","member_number":"\"\"","first_name":"CHRIS","last_name":"BITTICK","classification":"U","division":"PRODUCTION","hit_factor":4.7838},{"match_name":"USPSA Bass River June 2017","match_date":"2017-06-04","stage_classifiercode":"99-42","member_number":"A77552","first_name":"CLEO","last_name":"ALLEN","classification":"\"\"","division":"PRODUCTION","hit_factor":4.7822},{"match_name":"Minnetonka Game And Fish May 3","match_date":"2017-05-03","stage_classifiercode":"99-42","member_number":"TY70196","first_name":"MIKE","last_name":"MCKAY","classification":"C","division":"PRODUCTION","hit_factor":4.7794},{"match_name":"SAPSA April 2016","match_date":"2016-04-16","stage_classifiercode":"99-42","member_number":"A7739","first_name":"JIM","last_name":"TICE","classification":"A","division":"PRODUCTION","hit_factor":4.7755},{"match_name":"HAS May 2016 Pistol Match","match_date":"2016-05-08","stage_classifiercode":"99-42","member_number":"A77221","first_name":"CARL","last_name":"SMITH","classification":"D","division":"PRODUCTION","hit_factor":4.7733},{"match_name":"MVPJan2017","match_date":"2017-01-07","stage_classifiercode":"99-42","member_number":"A63002","first_name":"JEREMY","last_name":"STORY","classification":"A","division":"PRODUCTION","hit_factor":4.7714},{"match_name":"CFRPC June USPSA","match_date":"2018-06-17","stage_classifiercode":"99-42","member_number":"A93315","first_name":"MICHAEL","last_name":"MURRAY","classification":"C","division":"PRODUCTION","hit_factor":4.7706},{"match_name":"Hampden RPC August USPSA Match","match_date":"2020-08-09","stage_classifiercode":"99-42","member_number":"A127461","first_name":"MORGAN","last_name":"CALL","classification":"C","division":"PRODUCTION","hit_factor":4.7671},{"match_name":"Holmen USPSA 10/30/16","match_date":"2016-10-30","stage_classifiercode":"99-42","member_number":"A95748","first_name":"NICK","last_name":"NEUBAUER","classification":"B","division":"PRODUCTION","hit_factor":4.7666},{"match_name":"RBGC 2017-08-26","match_date":"2017-08-26","stage_classifiercode":"99-42","member_number":"TY75523","first_name":"BILAL","last_name":"SINNO","classification":"M","division":"PRODUCTION","hit_factor":4.7619},{"match_name":"Crooked Creek Pistol League - April 2017","match_date":"2017-04-22","stage_classifiercode":"99-42","member_number":"A91544","first_name":"BRIAN","last_name":"CLONAN","classification":"B","division":"PRODUCTION","hit_factor":4.7619},{"match_name":"Southkent USPSA MAY match","match_date":"2017-05-20","stage_classifiercode":"99-42","member_number":"TY61733","first_name":"KEITH","last_name":"HAFER","classification":"A","division":"PRODUCTION","hit_factor":4.7574},{"match_name":"USPSA","match_date":"2016-09-25","stage_classifiercode":"99-42","member_number":"\"\"","first_name":"MARK","last_name":"FOULKROD","classification":"none","division":"PRODUCTION","hit_factor":4.7541},{"match_name":"LGCSEMPS 2017 SPECIAL CLASSIFIER","match_date":"2017-04-09","stage_classifiercode":"99-42","member_number":"A94541","first_name":"BRIAN","last_name":"BAUMGARTNER","classification":"C","division":"PRODUCTION","hit_factor":4.7525},{"match_name":"CRCPS 2021-08-14","match_date":"2021-08-14","stage_classifiercode":"99-42","member_number":"Ty88502","first_name":"CHRISTIAN","last_name":"PETERSON","classification":"A","division":"PRODUCTION","hit_factor":4.7445},{"match_name":"1ra Fecha USPSA","match_date":"2016-01-10","stage_classifiercode":"99-42","member_number":"A92124","first_name":"GERMAN","last_name":"VELEZ","classification":"U","division":"PRODUCTION","hit_factor":4.7431},{"match_name":"Pathfinder July USPSA Match","match_date":"2017-07-16","stage_classifiercode":"99-42","member_number":"A59003","first_name":"MICHAEL","last_name":"HOURIHAN","classification":"B","division":"PRODUCTION","hit_factor":4.7431},{"match_name":"Southkent USPSA MAY match","match_date":"2017-05-20","stage_classifiercode":"99-42","member_number":"A96360","first_name":"STEVE","last_name":"DUMOND","classification":"D","division":"PRODUCTION","hit_factor":4.7417},{"match_name":"OFGC USPSA August 21 2016","match_date":"2016-08-21","stage_classifiercode":"99-42","member_number":"A75893","first_name":"JAMES","last_name":"SHELLY","classification":"D","division":"PRODUCTION","hit_factor":4.7386},{"match_name":"HPSP Heartland Practical Shooters October Handgun Shoot","match_date":"2016-10-23","stage_classifiercode":"99-42","member_number":"A90202","first_name":"JACOB","last_name":"SCHWAN","classification":"C","division":"PRODUCTION","hit_factor":4.7348},{"match_name":"HAS May 2016 Pistol Match","match_date":"2016-05-08","stage_classifiercode":"99-42","member_number":"A6125","first_name":"GREG","last_name":"NEWMAN","classification":"B","division":"PRODUCTION","hit_factor":4.7304},{"match_name":"WGC August 2018 USPSA 2","match_date":"2018-08-26","stage_classifiercode":"99-42","member_number":"TY50501","first_name":"BERNIE","last_name":"MCHUGH","classification":"M","division":"PRODUCTION","hit_factor":4.7297},{"match_name":"Crooked Creek Pistol League - April 2017","match_date":"2017-04-22","stage_classifiercode":"99-42","member_number":"A85635","first_name":"PAUL","last_name":"SNYDER","classification":"B","division":"PRODUCTION","hit_factor":4.7191},{"match_name":"APSC USPSA Special Classifier 04-02-16","match_date":"2016-04-02","stage_classifiercode":"99-42","member_number":"TY70687","first_name":"ROMMEL","last_name":"MERCADO","classification":"B","division":"PRODUCTION","hit_factor":4.7179},{"match_name":"PSAC_20170923","match_date":"2017-09-23","stage_classifiercode":"99-42","member_number":"FY20707","first_name":"PAUL SR","last_name":"CLARK","classification":"C","division":"PRODUCTION","hit_factor":4.7178},{"match_name":"YMM IPSC02 2017_09_24","match_date":"2017-09-24","stage_classifiercode":"99-42","member_number":"\"\"","first_name":"RICK","last_name":"LABISTRE","classification":"U","division":"PRODUCTION","hit_factor":4.7144},{"match_name":"USPSA MO21 2Alpha SBRC July 25 2020","match_date":"2020-07-25","stage_classifiercode":"99-42","member_number":"A104380","first_name":"MELISSA","last_name":"ODOM","classification":"C","division":"PRODUCTION","hit_factor":4.7125},{"match_name":"Richmond Hot Shots February 5-2017 USPSA Pistol Match","match_date":"2017-02-05","stage_classifiercode":"99-42","member_number":"A99050","first_name":"CLIFF","last_name":"JAO","classification":"U","division":"PRODUCTION","hit_factor":4.7038},{"match_name":"OFGC USPSA August 21 2016","match_date":"2016-08-21","stage_classifiercode":"99-42","member_number":"A96307","first_name":"JONATHAN","last_name":"FEERO","classification":"U","division":"PRODUCTION","hit_factor":4.7032},{"match_name":"OFGC Practical Pistol Match 8-16-20","match_date":"2020-08-16","stage_classifiercode":"99-42","member_number":"TY109700","first_name":"BRAD","last_name":"WILEY","classification":"C","division":"PRODUCTION","hit_factor":4.7014},{"match_name":"ANPRACS USPSA 7-15-18","match_date":"2018-07-15","stage_classifiercode":"99-42","member_number":"Ty95886","first_name":"LOREN","last_name":"ZEIGLER 2","classification":"D","division":"PRODUCTION","hit_factor":4.698},{"match_name":"SAPSA April 2016","match_date":"2016-04-16","stage_classifiercode":"99-42","member_number":"TY62017","first_name":"STEVEN","last_name":"LOH","classification":"B","division":"PRODUCTION","hit_factor":4.6954},{"match_name":"OFGC Practical Pistol Match 8-16-20","match_date":"2020-08-16","stage_classifiercode":"99-42","member_number":"TY98546","first_name":"BRYAN","last_name":"BROWN","classification":"B","division":"PRODUCTION","hit_factor":4.6917},{"match_name":"Shasta Shooters August 2017","match_date":"2017-08-12","stage_classifiercode":"99-42","member_number":"A100575","first_name":"SCOTT","last_name":"JACKSON","classification":"D","division":"PRODUCTION","hit_factor":4.6829},{"match_name":"CFRPC USPSA 2017 JUNE","match_date":"2017-06-18","stage_classifiercode":"99-42","member_number":"A93315","first_name":"MIKE","last_name":"MURRAY","classification":"C","division":"PRODUCTION","hit_factor":4.6773},{"match_name":"MCTS USPSA 10-08-2016","match_date":"2016-10-08","stage_classifiercode":"99-42","member_number":"A84888","first_name":"JOSHUA","last_name":"SHARP","classification":"C","division":"PRODUCTION","hit_factor":4.6729},{"match_name":"ORSA USPSA Chuck Berry Memorial Match 15 April","match_date":"2017-04-15","stage_classifiercode":"99-42","member_number":"TY65815","first_name":"HANK","last_name":"KLOECKLER","classification":"B","division":"PRODUCTION","hit_factor":4.6729},{"match_name":"Prescott 1 st Saturday Uspsa 11-05-2016","match_date":"2016-11-05","stage_classifiercode":"99-42","member_number":"TY99478","first_name":"DENIS","last_name":"LAPKO","classification":"unclassified","division":"PRODUCTION","hit_factor":4.6713},{"match_name":"Pathfinder August USPSA","match_date":"2020-08-16","stage_classifiercode":"99-42","member_number":"A122324","first_name":"NICK","last_name":"ALTIER","classification":"D","division":"PRODUCTION","hit_factor":4.6672},{"match_name":"EWPSA 2018-04","match_date":"2018-04-15","stage_classifiercode":"99-42","member_number":"A55355","first_name":"RANDY","last_name":"BAYUK","classification":"B","division":"PRODUCTION","hit_factor":4.6647},{"match_name":"Maine Practical Shooters October 2018","match_date":"2018-10-14","stage_classifiercode":"99-42","member_number":"A101366","first_name":"HANK","last_name":"POIRIER","classification":"C","division":"PRODUCTION","hit_factor":4.6589},{"match_name":"CFRPC USPSA 2017 JUNE","match_date":"2017-06-18","stage_classifiercode":"99-42","member_number":"A86597","first_name":"EDWARD","last_name":"LUCIANO","classification":"C","division":"PRODUCTION","hit_factor":4.6512},{"match_name":"3ra Fecha USPSA","match_date":"2018-03-24","stage_classifiercode":"99-42","member_number":"A97082","first_name":"ROBERTO","last_name":"SANCHEZ","classification":"C","division":"PRODUCTION","hit_factor":4.6425},{"match_name":"LIPSA - April 30th 2017 - USPSA Match Special Classifier","match_date":"2017-04-30","stage_classifiercode":"99-42","member_number":"A97814","first_name":"JUSTIN","last_name":"WONG","classification":"C","division":"PRODUCTION","hit_factor":4.6418},{"match_name":"Wvpps May2016","match_date":"2016-05-15","stage_classifiercode":"99-42","member_number":"a77328","first_name":"ZACH","last_name":"YOUNG","classification":"A","division":"PRODUCTION","hit_factor":4.6404},{"match_name":"WPS USPSA Monthly Match November 2016","match_date":"2016-11-05","stage_classifiercode":"99-42","member_number":"A85515","first_name":"STEVEN","last_name":"KEARNEY","classification":"U","division":"PRODUCTION","hit_factor":4.64},{"match_name":"ANPRACS USPSA 7-15-18","match_date":"2018-07-15","stage_classifiercode":"99-42","member_number":"TY65829","first_name":"MICHAEL","last_name":"HANRAHAN","classification":"C","division":"PRODUCTION","hit_factor":4.6346},{"match_name":"LCHG August USPSA","match_date":"2016-08-07","stage_classifiercode":"99-42","member_number":"TY58975","first_name":"BEN","last_name":"SMITH","classification":"B","division":"PRODUCTION","hit_factor":4.6319},{"match_name":"CFRPC USPSA 2017 JUNE","match_date":"2017-06-18","stage_classifiercode":"99-42","member_number":"A95166","first_name":"ELIJAH","last_name":"TORRES","classification":"C","division":"PRODUCTION","hit_factor":4.6287},{"match_name":"MCPSL Pistol 4-9-16","match_date":"2016-04-09","stage_classifiercode":"99-42","member_number":"A85915","first_name":"KURT","last_name":"WEIGEL","classification":"C","division":"PRODUCTION","hit_factor":4.6252},{"match_name":"2018-05-20 Practical at Phoenix Rod and Gun Club","match_date":"2018-05-20","stage_classifiercode":"99-42","member_number":"TY102049","first_name":"BEN","last_name":"QUINATA","classification":"C","division":"PRODUCTION","hit_factor":4.6181},{"match_name":"MCPSL Pistol 4-9-16","match_date":"2016-04-09","stage_classifiercode":"99-42","member_number":"A56257","first_name":"JOHN","last_name":"PODOLANKO","classification":"B","division":"PRODUCTION","hit_factor":4.6168},{"match_name":"Hampden RPC August USPSA Match","match_date":"2020-08-09","stage_classifiercode":"99-42","member_number":"TY101923","first_name":"CHRISTINA","last_name":"BAKER","classification":"C","division":"PRODUCTION","hit_factor":4.6154},{"match_name":"CRCPS 2021-08-14","match_date":"2021-08-14","stage_classifiercode":"99-42","member_number":"L4346","first_name":"STEVE","last_name":"LIERMAN","classification":"B","division":"PRODUCTION","hit_factor":4.6154},{"match_name":"Shasta Shooters August 2017","match_date":"2017-08-12","stage_classifiercode":"99-42","member_number":"TY68537","first_name":"MARK","last_name":"BALL","classification":"C","division":"PRODUCTION","hit_factor":4.614},{"match_name":"MISS Match 11-2-16","match_date":"2016-10-31","stage_classifiercode":"99-42","member_number":"L3675","first_name":"MICHAEL","last_name":"FRY","classification":"C","division":"PRODUCTION","hit_factor":4.6099},{"match_name":"Shasta Shooters August 2017","match_date":"2017-08-12","stage_classifiercode":"99-42","member_number":"A88368","first_name":"TOM","last_name":"FULLER","classification":"C","division":"PRODUCTION","hit_factor":4.6046},{"match_name":"1ra Fecha USPSA","match_date":"2016-01-10","stage_classifiercode":"99-42","member_number":"A88118","first_name":"JOSEPH","last_name":"MELENDEZ REYES","classification":"B","division":"PRODUCTION","hit_factor":4.6021},{"match_name":"PSAC_20170923","match_date":"2017-09-23","stage_classifiercode":"99-42","member_number":"A88502","first_name":"CHRIS","last_name":"PETERSON","classification":"U","division":"PRODUCTION","hit_factor":4.602},{"match_name":"1ra Fecha USPSA","match_date":"2016-01-10","stage_classifiercode":"99-42","member_number":"A89226","first_name":"MJ","last_name":"BRENES","classification":"B","division":"PRODUCTION","hit_factor":4.5977},{"match_name":"LGCSEMPS 2017 SPECIAL CLASSIFIER","match_date":"2017-04-09","stage_classifiercode":"99-42","member_number":"A101956","first_name":"XAVIER","last_name":"FAJARDO","classification":"U","division":"PRODUCTION","hit_factor":4.5977},{"match_name":"HPS March Pistol Funshoot","match_date":"2017-03-18","stage_classifiercode":"99-42","member_number":"A96401","first_name":"GREGORY","last_name":"HAMPTON","classification":"U","division":"PRODUCTION","hit_factor":4.5956},{"match_name":"Minot USPSA 7-8-18","match_date":"2018-07-07","stage_classifiercode":"99-42","member_number":"TY83994","first_name":"KIM","last_name":"PARSON","classification":"C","division":"PRODUCTION","hit_factor":4.5929},{"match_name":"ORSA USPSA Chuck Berry Memorial Match 15 April","match_date":"2017-04-15","stage_classifiercode":"99-42","member_number":"A72343","first_name":"PAUL","last_name":"AVERY","classification":"B","division":"PRODUCTION","hit_factor":4.5889},{"match_name":"DGC USPSA Classifier Match","match_date":"2017-07-30","stage_classifiercode":"99-42","member_number":"A101403","first_name":"BOB","last_name":"CURRY","classification":"U","division":"PRODUCTION","hit_factor":4.5886},{"match_name":"2020-10-03 USPSA  at Phoenix Rod and Gun Club","match_date":"2020-10-03","stage_classifiercode":"99-42","member_number":"A126707","first_name":"BRANDON","last_name":"MOORE","classification":"U","division":"PRODUCTION","hit_factor":4.584},{"match_name":"LNDL June 3rd 2018","match_date":"2018-06-03","stage_classifiercode":"99-42","member_number":"A105562","first_name":"RANDY","last_name":"HEINTZ","classification":"C","division":"PRODUCTION","hit_factor":4.5815},{"match_name":"Atlanta Practical Shooters November 2016 USPSA","match_date":"2016-11-06","stage_classifiercode":"99-42","member_number":"A97112","first_name":"BRETT","last_name":"TYLER","classification":"D","division":"PRODUCTION","hit_factor":4.5671},{"match_name":"Shasta Shooters August 2017","match_date":"2017-08-12","stage_classifiercode":"99-42","member_number":"A95105","first_name":"DOUGLAS","last_name":"DALSKE","classification":"C","division":"PRODUCTION","hit_factor":4.5633},{"match_name":"Steel City USPSA July 2016","match_date":"2016-07-02","stage_classifiercode":"99-42","member_number":"TY81879","first_name":"DAVID","last_name":"KIZER","classification":"U","division":"PRODUCTION","hit_factor":4.5627},{"match_name":"WLPS May2017","match_date":"2017-05-28","stage_classifiercode":"99-42","member_number":"A81724","first_name":"ROBERT","last_name":"WELCH","classification":"B","division":"PRODUCTION","hit_factor":4.5623},{"match_name":"OFGC Practical Pistol Match 8-16-20","match_date":"2020-08-16","stage_classifiercode":"99-42","member_number":"TY99926","first_name":"CARL","last_name":"CLITES","classification":"A","division":"PRODUCTION","hit_factor":4.5573},{"match_name":"NCPS USPSA Handgun Match January 28 2018a","match_date":"2018-01-28","stage_classifiercode":"99-42","member_number":"L3933","first_name":"DEAN","last_name":"DIPIETRO","classification":"C","division":"PRODUCTION","hit_factor":4.5566},{"match_name":"Caja del Rio - July 2017","match_date":"2017-07-15","stage_classifiercode":"99-42","member_number":"A97978","first_name":"HEATH","last_name":"HISLOP","classification":"C","division":"PRODUCTION","hit_factor":4.5562},{"match_name":"Shongum October 2016 USPSA Match","match_date":"2016-10-01","stage_classifiercode":"99-42","member_number":"TY76045","first_name":"ELVIN","last_name":"ABORDO","classification":"C","division":"PRODUCTION","hit_factor":4.5528},{"match_name":"NCPS USPSA Handgun Match January 28 2018a","match_date":"2018-01-28","stage_classifiercode":"99-42","member_number":"A102101","first_name":"DAVID","last_name":"DAUS","classification":"U","division":"PRODUCTION","hit_factor":4.5412},{"match_name":"2021-06-05 USPSA  at Phoenix Rod and Gun Club","match_date":"2021-06-05","stage_classifiercode":"99-42","member_number":"TY119070","first_name":"TONY","last_name":"SQUAGLIA","classification":"C","division":"PRODUCTION","hit_factor":4.5375},{"match_name":"Maine Practical Shooters May 2021","match_date":"2021-05-08","stage_classifiercode":"99-42","member_number":"TY128695","first_name":"RICK","last_name":"BARKER","classification":"B","division":"PRODUCTION","hit_factor":4.5296},{"match_name":"LGCSEMPS 2017 SPECIAL CLASSIFIER","match_date":"2017-04-09","stage_classifiercode":"99-42","member_number":"A96397","first_name":"MICHAEL","last_name":"HALL","classification":"D","division":"PRODUCTION","hit_factor":4.5271},{"match_name":"Holmen USPSA 10/30/16","match_date":"2016-10-30","stage_classifiercode":"99-42","member_number":"A95668","first_name":"ADRIAN","last_name":"POLODNA","classification":"U","division":"PRODUCTION","hit_factor":4.5226},{"match_name":"Southkent USPSA MAY match","match_date":"2017-05-20","stage_classifiercode":"99-42","member_number":"A76095","first_name":"JEFF","last_name":"SLUSSER","classification":"B","division":"PRODUCTION","hit_factor":4.5056},{"match_name":"Richmond Boro Gun Club March 2020 USPSA Match","match_date":"2020-03-14","stage_classifiercode":"99-42","member_number":"A106529","first_name":"FRANK","last_name":"RIZZI","classification":"C","division":"PRODUCTION","hit_factor":4.5055},{"match_name":"Shasta Shooters March 2017","match_date":"2017-03-11","stage_classifiercode":"99-42","member_number":"A95105","first_name":"DOUGLAS","last_name":"DALSKE","classification":"C","division":"PRODUCTION","hit_factor":4.4944},{"match_name":"USPSA Bass River June 2017","match_date":"2017-06-04","stage_classifiercode":"99-42","member_number":"FY59373","first_name":"PAIGE","last_name":"BUCKLEY","classification":"C","division":"PRODUCTION","hit_factor":4.4944},{"match_name":"2020-10-03 USPSA  at Phoenix Rod and Gun Club","match_date":"2020-10-03","stage_classifiercode":"99-42","member_number":"TY60944","first_name":"RICK","last_name":"YOST","classification":"B","division":"PRODUCTION","hit_factor":4.4908},{"match_name":"Southkent USPSA MAY match","match_date":"2017-05-20","stage_classifiercode":"99-42","member_number":"TY77408","first_name":"DALE","last_name":"WYATT","classification":"C","division":"PRODUCTION","hit_factor":4.4888},{"match_name":"RBGC 2017-08-26","match_date":"2017-08-26","stage_classifiercode":"99-42","member_number":"A96831","first_name":"DAVID","last_name":"OLGUIN","classification":"B","division":"PRODUCTION","hit_factor":4.4872},{"match_name":"GAS July 7th Special Classifier","match_date":"2018-07-07","stage_classifiercode":"99-42","member_number":"A99293","first_name":"ADAM","last_name":"BURT","classification":"C","division":"PRODUCTION","hit_factor":4.4866},{"match_name":"HCGC TN","match_date":"2020-03-14","stage_classifiercode":"99-42","member_number":"A123351","first_name":"CALVIN","last_name":"CRANOR","classification":"U","division":"PRODUCTION","hit_factor":4.4843},{"match_name":"ORSA USPSA Chuck Berry Memorial Match 15 April","match_date":"2017-04-15","stage_classifiercode":"99-42","member_number":"A102283","first_name":"SHERWIN","last_name":"OCAMPO","classification":"U","division":"PRODUCTION","hit_factor":4.4818},{"match_name":"Springfield Tactical Shooters 01/04/2018","match_date":"2018-01-04","stage_classifiercode":"99-42","member_number":"A99127","first_name":"STEVE","last_name":"FRAZIER","classification":"C","division":"PRODUCTION","hit_factor":4.4789},{"match_name":"1ra Fecha USPSA","match_date":"2016-01-10","stage_classifiercode":"99-42","member_number":"A92818","first_name":"WILLIAM","last_name":"PREWITT COLN","classification":"U","division":"PRODUCTION","hit_factor":4.4788},{"match_name":"Atlanta Practical Shooters March 2016 USPSA - Classifier Match","match_date":"2016-03-06","stage_classifiercode":"99-42","member_number":"A35948","first_name":"SHANE","last_name":"ALRED","classification":"U","division":"PRODUCTION","hit_factor":4.4715},{"match_name":"HAS May 2016 Pistol Match","match_date":"2016-05-08","stage_classifiercode":"99-42","member_number":"A86431","first_name":"NEAL","last_name":"LIDDLE","classification":"X","division":"PRODUCTION","hit_factor":4.4632},{"match_name":"PCWC USPSA 4 22 2017","match_date":"2017-04-22","stage_classifiercode":"99-42","member_number":"a69177","first_name":"JEFF","last_name":"WHITE","classification":"A","division":"PRODUCTION","hit_factor":4.4632},{"match_name":"Springfield Tactical Shooters 01-05-2017","match_date":"2017-01-05","stage_classifiercode":"99-42","member_number":"FY83614","first_name":"GARY","last_name":"GRAY","classification":"C","division":"PRODUCTION","hit_factor":4.4586},{"match_name":"Enps May 2021 USPSA MATCH-All Classifier","match_date":"2021-05-02","stage_classifiercode":"99-42","member_number":"TY100802","first_name":"BYRON","last_name":"THOMPSON","classification":"C","division":"PRODUCTION","hit_factor":4.4524},{"match_name":"Baghdad USPSA Special Classifier Lightning Interrupted 6 May 2017","match_date":"2017-05-06","stage_classifiercode":"99-42","member_number":"A99458","first_name":"BILLY","last_name":"MORRIS","classification":"C","division":"PRODUCTION","hit_factor":4.4515},{"match_name":"SFA July 2016 CLASSIFIED","match_date":"2016-07-16","stage_classifiercode":"99-42","member_number":"A87948","first_name":"SCOTT","last_name":"GREENE","classification":"M","division":"PRODUCTION","hit_factor":4.4413},{"match_name":"PIPS 08-03-2016","match_date":"2016-08-03","stage_classifiercode":"99-42","member_number":"PEN","first_name":"KEVIN","last_name":"LEPEL","classification":"U","division":"PRODUCTION","hit_factor":4.4408},{"match_name":"Springfield Tactical Shooters 01/04/2018","match_date":"2018-01-04","stage_classifiercode":"99-42","member_number":"A104414","first_name":"STEVE","last_name":"EDGE","classification":"\"\"","division":"PRODUCTION","hit_factor":4.4335},{"match_name":"Crooked Creek Pistol League - April 2017","match_date":"2017-04-22","stage_classifiercode":"99-42","member_number":"TY87113","first_name":"MARK","last_name":"HEPLER","classification":"C","division":"PRODUCTION","hit_factor":4.4321},{"match_name":"CCPL 07102016","match_date":"2016-07-10","stage_classifiercode":"99-42","member_number":"TY84531","first_name":"ERIC","last_name":"SWISHER","classification":"B","division":"PRODUCTION","hit_factor":4.4248},{"match_name":"EAGC July 2016 USPSA Pistol Match","match_date":"2016-07-17","stage_classifiercode":"99-42","member_number":"A93701","first_name":"DARYL","last_name":"SHIRAH","classification":"U","division":"PRODUCTION","hit_factor":4.4239},{"match_name":"Crooked Creek Pistol League - March 26-27 2016","match_date":"2016-03-26","stage_classifiercode":"99-42","member_number":"\"\"","first_name":"RICH","last_name":"MANSFIELD","classification":"X","division":"PRODUCTION","hit_factor":4.4199},{"match_name":"LIPSA - April 30th 2017 - USPSA Match Special Classifier","match_date":"2017-04-30","stage_classifiercode":"99-42","member_number":"TY85181","first_name":"JEFF","last_name":"MELWORM","classification":"C","division":"PRODUCTION","hit_factor":4.4199},{"match_name":"Steel City USPSA July 2016","match_date":"2016-07-02","stage_classifiercode":"99-42","member_number":"PEN","first_name":"CHARLES","last_name":"HARMON","classification":"U","division":"PRODUCTION","hit_factor":4.4188},{"match_name":"TPS USPSA at CMP Dec 19 2020 Special Classifier Match","match_date":"2020-12-19","stage_classifiercode":"99-42","member_number":"A123421","first_name":"GEORGE","last_name":"CAVALLO","classification":"C","division":"PRODUCTION","hit_factor":4.4181},{"match_name":"OREGON ARPC CC05 USPSA Nov 13 2021","match_date":"2021-11-13","stage_classifiercode":"99-42","member_number":"TY111252","first_name":"TYRELL","last_name":"RANKIN","classification":"B","division":"PRODUCTION","hit_factor":4.4153},{"match_name":"LGCSEMPS 2017 SPECIAL CLASSIFIER","match_date":"2017-04-09","stage_classifiercode":"99-42","member_number":"TY53760","first_name":"DAVID","last_name":"LEE","classification":"A","division":"PRODUCTION","hit_factor":4.4131},{"match_name":"Wvpps May2016","match_date":"2016-05-15","stage_classifiercode":"99-42","member_number":"A88753","first_name":"ALYSSA","last_name":"BRIGHT","classification":"D","division":"PRODUCTION","hit_factor":4.4118},{"match_name":"LNDL June 3rd 2018","match_date":"2018-06-03","stage_classifiercode":"99-42","member_number":"TY99871","first_name":"ROBERT","last_name":"DUNNING","classification":"C","division":"PRODUCTION","hit_factor":4.4092},{"match_name":"Springfield Tactical Shooters 01-05-2017","match_date":"2017-01-05","stage_classifiercode":"99-42","member_number":"A87747","first_name":"BARRY","last_name":"ROWE","classification":"B","division":"PRODUCTION","hit_factor":4.4019},{"match_name":"EAGC July 2016 USPSA Pistol Match","match_date":"2016-07-17","stage_classifiercode":"99-42","member_number":"A96831","first_name":"DAVID","last_name":"OLGUIN","classification":"U","division":"PRODUCTION","hit_factor":4.3996},{"match_name":"Shasta Shooters August 2017","match_date":"2017-08-12","stage_classifiercode":"99-42","member_number":"Fy89662","first_name":"TODD","last_name":"CANCILLA","classification":"B","division":"PRODUCTION","hit_factor":4.3941},{"match_name":"Richmond Hot Shots 2021 USPSA Special Classifier Match - Jan 24 2021","match_date":"2021-01-24","stage_classifiercode":"99-42","member_number":"TY91483","first_name":"MICHAEL","last_name":"NEUBAUER","classification":"C","division":"PRODUCTION","hit_factor":4.3938},{"match_name":"Shongum October 2016 USPSA Match","match_date":"2016-10-01","stage_classifiercode":"99-42","member_number":"TY85850","first_name":"BOB","last_name":"LOCK","classification":"C","division":"PRODUCTION","hit_factor":4.3725},{"match_name":"NVSA USPSA 2101","match_date":"2021-01-17","stage_classifiercode":"99-42","member_number":"A130544","first_name":"JAY","last_name":"MARKUS","classification":"C","division":"PRODUCTION","hit_factor":4.3636},{"match_name":"EAGC July 2016 USPSA Pistol Match","match_date":"2016-07-17","stage_classifiercode":"99-42","member_number":"PEND","first_name":"BRUCE","last_name":"STONE","classification":"U","division":"PRODUCTION","hit_factor":4.3568},{"match_name":"WGC October 2018 USPSA 2","match_date":"2018-10-28","stage_classifiercode":"99-42","member_number":"A114918","first_name":"JAMIE","last_name":"EPPINETTE","classification":"U","division":"PRODUCTION","hit_factor":4.3544},{"match_name":"3ra Fecha USPSA","match_date":"2018-03-24","stage_classifiercode":"99-42","member_number":"A90954","first_name":"ROBERTO","last_name":"MORALES","classification":"A","division":"PRODUCTION","hit_factor":4.352},{"match_name":"PCWC USPSA 4 22 2017","match_date":"2017-04-22","stage_classifiercode":"99-42","member_number":"\"\"","first_name":"SEAN","last_name":"POWELL","classification":"X","division":"PRODUCTION","hit_factor":4.3478},{"match_name":"SPSA USPSA February 4th Sat match","match_date":"2018-02-24","stage_classifiercode":"99-42","member_number":"TY25081","first_name":"PAUL","last_name":"VALONE","classification":"C","division":"PRODUCTION","hit_factor":4.344},{"match_name":"RBGC 2017-08-26","match_date":"2017-08-26","stage_classifiercode":"99-42","member_number":"A83594","first_name":"TIM","last_name":"BOWDEN","classification":"C","division":"PRODUCTION","hit_factor":4.3435},{"match_name":"AIPS  USPSA Weekly 22 August 2017","match_date":"2017-08-22","stage_classifiercode":"99-42","member_number":"A91881","first_name":"BRIAN","last_name":"LARSON","classification":"C","division":"PRODUCTION","hit_factor":4.3403},{"match_name":"MCAS December 2018","match_date":"2018-12-15","stage_classifiercode":"99-42","member_number":"A96523","first_name":"DAN","last_name":"DOOLEY","classification":"D","division":"PRODUCTION","hit_factor":4.3377},{"match_name":"CCC Shooting Complex September 2016","match_date":"2016-09-03","stage_classifiercode":"99-42","member_number":"TY66521","first_name":"CASEY","last_name":"DUDECK","classification":"M","division":"PRODUCTION","hit_factor":4.3371},{"match_name":"LIPSA - April 30th 2017 - USPSA Match Special Classifier","match_date":"2017-04-30","stage_classifiercode":"99-42","member_number":"TY76590","first_name":"AMANTE","last_name":"MARINAS","classification":"C","division":"PRODUCTION","hit_factor":4.3307},{"match_name":"PASA USPSA 3-18-18","match_date":"2018-03-18","stage_classifiercode":"99-42","member_number":"A2594","first_name":"DUANE","last_name":"LONG","classification":"B","division":"PRODUCTION","hit_factor":4.3299},{"match_name":"SFA July 2016 CLASSIFIED","match_date":"2016-07-16","stage_classifiercode":"99-42","member_number":"A86005","first_name":"RICH","last_name":"FRY","classification":"U","division":"PRODUCTION","hit_factor":4.3282},{"match_name":"Baghdad USPSA Special Classifier Lightning Interrupted 6 May 2017","match_date":"2017-05-06","stage_classifiercode":"99-42","member_number":"\"\"","first_name":"BENJAMIN","last_name":"BURCH","classification":"U","division":"PRODUCTION","hit_factor":4.3251},{"match_name":"SLPSA  USPSA","match_date":"2016-09-17","stage_classifiercode":"99-42","member_number":"A91798","first_name":"RANDY","last_name":"MOUSLEY","classification":"D","division":"PRODUCTION","hit_factor":4.3251},{"match_name":"USPSA MO21 2Alpha SBRC July 25 2020","match_date":"2020-07-25","stage_classifiercode":"99-42","member_number":"A124984","first_name":"DARIN","last_name":"ANDREWS","classification":"C","division":"PRODUCTION","hit_factor":4.3235},{"match_name":"Springfield Tactical Shooters 01-05-2017","match_date":"2017-01-05","stage_classifiercode":"99-42","member_number":"A63433","first_name":"ROB","last_name":"LEWIS","classification":"C","division":"PRODUCTION","hit_factor":4.3215},{"match_name":"Shasta Shooters August 2017","match_date":"2017-08-12","stage_classifiercode":"99-42","member_number":"A104921","first_name":"PAUL","last_name":"JOHNSON","classification":"U","division":"PRODUCTION","hit_factor":4.3192},{"match_name":"3ra Fecha USPSA","match_date":"2018-03-24","stage_classifiercode":"99-42","member_number":"A95283","first_name":"JADE","last_name":"OSORIO","classification":"C","division":"PRODUCTION","hit_factor":4.3011},{"match_name":"Pathfinder August USPSA","match_date":"2020-08-16","stage_classifiercode":"99-42","member_number":"TY126681","first_name":"KEVIN","last_name":"SAINTEY","classification":"U","division":"PRODUCTION","hit_factor":4.2989},{"match_name":"Shongum October 2016 USPSA Match","match_date":"2016-10-01","stage_classifiercode":"99-42","member_number":"A78830","first_name":"SEAN","last_name":"COLE","classification":"C","division":"PRODUCTION","hit_factor":4.2868},{"match_name":"Shoot GTR USPSA 11/22","match_date":"2016-11-22","stage_classifiercode":"99-42","member_number":"A89407","first_name":"WILLIAM","last_name":"DIGIORGIO","classification":"D","division":"PRODUCTION","hit_factor":4.2845},{"match_name":"SUPS All Classifier Match March 1718 2018","match_date":"2018-03-17","stage_classifiercode":"99-42","member_number":"A91631","first_name":"RYAN","last_name":"GAN","classification":"U","division":"PRODUCTION","hit_factor":4.2845},{"match_name":"DGC USPSA Classifier Match","match_date":"2017-07-30","stage_classifiercode":"99-42","member_number":"A99192","first_name":"PAUL","last_name":"DILLINGHAM","classification":"U","division":"PRODUCTION","hit_factor":4.2813},{"match_name":"Steel City USPSA July 2016","match_date":"2016-07-02","stage_classifiercode":"99-42","member_number":"PEN","first_name":"WADE","last_name":"LYNTON","classification":"U","division":"PRODUCTION","hit_factor":4.2781},{"match_name":"Minnetonka Game And Fish May 3","match_date":"2017-05-03","stage_classifiercode":"99-42","member_number":"\"\"","first_name":"MATT","last_name":"MATTSON","classification":"U","division":"PRODUCTION","hit_factor":4.2772},{"match_name":"Springfield Tactical Shooters 01-05-2017","match_date":"2017-01-05","stage_classifiercode":"99-42","member_number":"A63433","first_name":"ROB","last_name":"LEWIS","classification":"C","division":"PRODUCTION","hit_factor":4.2743},{"match_name":"OFGC USPSA August 21 2016","match_date":"2016-08-21","stage_classifiercode":"99-42","member_number":"A93174","first_name":"SCOTT","last_name":"CUDE","classification":"U","division":"PRODUCTION","hit_factor":4.2699},{"match_name":"WVRPC USPSA 1APR2017 CLASSIFIER","match_date":"2017-04-01","stage_classifiercode":"99-42","member_number":"A102134","first_name":"AARON","last_name":"SENESAC","classification":"U","division":"PRODUCTION","hit_factor":4.2693},{"match_name":"Patriot Action Shooters 2016 Special Classifier","match_date":"2016-03-19","stage_classifiercode":"99-42","member_number":"A84801","first_name":"LARRY","last_name":"THOMPSON","classification":"C","division":"PRODUCTION","hit_factor":4.2662},{"match_name":"GAS July 7th Special Classifier","match_date":"2018-07-07","stage_classifiercode":"99-42","member_number":"A111523","first_name":"COLIN","last_name":"WHITNEY","classification":"U","division":"PRODUCTION","hit_factor":4.2658},{"match_name":"Hampden RPC August USPSA Match","match_date":"2020-08-09","stage_classifiercode":"99-42","member_number":"A101724","first_name":"JIM","last_name":"STOUT","classification":"C","division":"PRODUCTION","hit_factor":4.262},{"match_name":"USPSA","match_date":"2016-09-25","stage_classifiercode":"99-42","member_number":"A94352","first_name":"BRYAN","last_name":"MARRA","classification":"C","division":"PRODUCTION","hit_factor":4.253},{"match_name":"FBURG April 2017 Level I USPSA ","match_date":"2017-04-01","stage_classifiercode":"99-42","member_number":"TY80526","first_name":"VIRGINIA","last_name":"MEDEIROS","classification":"C","division":"PRODUCTION","hit_factor":4.2521},{"match_name":"CFRPC USPSA 2017 JUNE","match_date":"2017-06-18","stage_classifiercode":"99-42","member_number":"\"\"","first_name":"ANTONIO","last_name":"LUGO","classification":"U","division":"PRODUCTION","hit_factor":4.2516},{"match_name":"CRCPS 2021-08-14","match_date":"2021-08-14","stage_classifiercode":"99-42","member_number":"L4346","first_name":"STEVE","last_name":"LIERMAN","classification":"B","division":"PRODUCTION","hit_factor":4.2512},{"match_name":"Richmond Boro Gun Club March 2020 USPSA Match","match_date":"2020-03-14","stage_classifiercode":"99-42","member_number":"TY109237","first_name":"CURT","last_name":"WIENER","classification":"C","division":"PRODUCTION","hit_factor":4.2487},{"match_name":"NVSA USPSA 2101","match_date":"2021-01-17","stage_classifiercode":"99-42","member_number":"TY128008","first_name":"TAMMY","last_name":"BENNETT","classification":"D","division":"PRODUCTION","hit_factor":4.2478},{"match_name":"Atlanta Practical Shooters March 2016 USPSA - Classifier Match","match_date":"2016-03-06","stage_classifiercode":"99-42","member_number":"A89464","first_name":"EMORY","last_name":"GOGGANS","classification":"C","division":"PRODUCTION","hit_factor":4.2478},{"match_name":"Brothers N Arms August 2017 USPSA Match","match_date":"2017-08-19","stage_classifiercode":"99-42","member_number":"A96232","first_name":"DAVID","last_name":"BERNARDI","classification":"D","division":"PRODUCTION","hit_factor":4.2424},{"match_name":"Richmond Hot Shots February 5-2017 USPSA Pistol Match","match_date":"2017-02-05","stage_classifiercode":"99-42","member_number":"FY68887","first_name":"VENTZISLAV","last_name":"MITKOV","classification":"C","division":"PRODUCTION","hit_factor":4.2357},{"match_name":"Enps May 2021 USPSA MATCH-All Classifier","match_date":"2021-05-02","stage_classifiercode":"99-42","member_number":"TY119209","first_name":"KEVIN","last_name":"HARTZELL","classification":"C","division":"PRODUCTION","hit_factor":4.2345},{"match_name":"Eagles Nest July 17th","match_date":"2016-07-17","stage_classifiercode":"99-42","member_number":"\"\"","first_name":"NEAL","last_name":"WOOMER","classification":"none","division":"PRODUCTION","hit_factor":4.2337},{"match_name":"LIPSA - April 30th 2017 - USPSA Match Special Classifier","match_date":"2017-04-30","stage_classifiercode":"99-42","member_number":"A102344","first_name":"ERIC","last_name":"FLORIO","classification":"U","division":"PRODUCTION","hit_factor":4.2328},{"match_name":"CFRPC June USPSA","match_date":"2018-06-17","stage_classifiercode":"99-42","member_number":"TY79474","first_name":"JOSE","last_name":"ORTIZ","classification":"B","division":"PRODUCTION","hit_factor":4.2237},{"match_name":"LGCSEMPS 2017 SPECIAL CLASSIFIER","match_date":"2017-04-09","stage_classifiercode":"99-42","member_number":"FL4088","first_name":"NICHOLAS","last_name":"ANGELI","classification":"U","division":"PRODUCTION","hit_factor":4.2216},{"match_name":"Enps May 2021 USPSA MATCH-All Classifier","match_date":"2021-05-02","stage_classifiercode":"99-42","member_number":"A120080","first_name":"KELLEN","last_name":"HARTZELL","classification":"C","division":"PRODUCTION","hit_factor":4.2117},{"match_name":"Crooked Creek Pistol League - March 26-27 2016","match_date":"2016-03-26","stage_classifiercode":"99-42","member_number":"L3426","first_name":"ROB","last_name":"WARE","classification":"U","division":"PRODUCTION","hit_factor":4.2076},{"match_name":"USPSA Bass River June 2017","match_date":"2017-06-04","stage_classifiercode":"99-42","member_number":"A86494","first_name":"JOE","last_name":"RITA","classification":"\"\"","division":"PRODUCTION","hit_factor":4.2071},{"match_name":"Springfield Tactical Shooters 01-05-2017","match_date":"2017-01-05","stage_classifiercode":"99-42","member_number":"A92047","first_name":"KYLE","last_name":"SPENCER","classification":"B","division":"PRODUCTION","hit_factor":4.2009},{"match_name":"Pathfinder July USPSA Match","match_date":"2017-07-16","stage_classifiercode":"99-42","member_number":"A100137","first_name":"MICHAEL","last_name":"MASTRI","classification":"U","division":"PRODUCTION","hit_factor":4.2003},{"match_name":"Crooked Creek Pistol League - March 26-27 2016","match_date":"2016-03-26","stage_classifiercode":"99-42","member_number":"A83391","first_name":"BRIAN","last_name":"BOEHRINGER","classification":"B","division":"PRODUCTION","hit_factor":4.1982},{"match_name":"CBS GC08 May USPSA pistol","match_date":"2018-05-06","stage_classifiercode":"99-42","member_number":"A104434","first_name":"ROBERT","last_name":"ZUNIGA","classification":"U","division":"PRODUCTION","hit_factor":4.1935},{"match_name":"MS06 Team Magnolia USPSA October Match","match_date":"2016-10-01","stage_classifiercode":"99-42","member_number":"A73014","first_name":"JAMES","last_name":"SIKES","classification":"C","division":"PRODUCTION","hit_factor":4.1921},{"match_name":"LIPSA - April 30th 2017 - USPSA Match Special Classifier","match_date":"2017-04-30","stage_classifiercode":"99-42","member_number":"TY13743","first_name":"RICK","last_name":"ESPOSITO","classification":"B","division":"PRODUCTION","hit_factor":4.1905},{"match_name":"OFGC Practical Pistol Match 8-16-20","match_date":"2020-08-16","stage_classifiercode":"99-42","member_number":"A120200","first_name":"MIKE","last_name":"GAWF","classification":"U","division":"PRODUCTION","hit_factor":4.1834},{"match_name":"LNDL June 3rd 2018","match_date":"2018-06-03","stage_classifiercode":"99-42","member_number":"\"\"","first_name":"GARRETT","last_name":"WACHTEL","classification":"U","division":"PRODUCTION","hit_factor":4.1828},{"match_name":"Crooked Creek Pistol League - March 26-27 2016","match_date":"2016-03-26","stage_classifiercode":"99-42","member_number":"PEN","first_name":"GARY","last_name":"MILLS","classification":"U","division":"PRODUCTION","hit_factor":4.1801},{"match_name":"Crooked Creek Pistol League - April 2017","match_date":"2017-04-22","stage_classifiercode":"99-42","member_number":"A102934","first_name":"JIM","last_name":"CALANDRA","classification":"U","division":"PRODUCTION","hit_factor":4.1787},{"match_name":"Richmond Hot Shots February 5-2017 USPSA Pistol Match","match_date":"2017-02-05","stage_classifiercode":"99-42","member_number":"A90398","first_name":"RICHARD","last_name":"MOTTA","classification":"C","division":"PRODUCTION","hit_factor":4.1701},{"match_name":"NCPS USPSA Handgun Match January 28 2018a","match_date":"2018-01-28","stage_classifiercode":"99-42","member_number":"TY95999","first_name":"MINH","last_name":"HOANG","classification":"A","division":"PRODUCTION","hit_factor":4.1667},{"match_name":"MS06 Team Magnolia USPSA October Match","match_date":"2016-10-01","stage_classifiercode":"99-42","member_number":"A72385","first_name":"JIM","last_name":"LOWMAN","classification":"C","division":"PRODUCTION","hit_factor":4.1667},{"match_name":"HAS May 2016 Pistol Match","match_date":"2016-05-08","stage_classifiercode":"99-42","member_number":"A93462","first_name":"TYLER","last_name":"STEVENSON","classification":"U","division":"PRODUCTION","hit_factor":4.1558},{"match_name":"HAS May 2016 Pistol Match","match_date":"2016-05-08","stage_classifiercode":"99-42","member_number":"A90717","first_name":"SUE","last_name":"PARA","classification":"C","division":"PRODUCTION","hit_factor":4.1554},{"match_name":"Richmond Hot Shots 2021 USPSA Special Classifier Match - Jan 24 2021","match_date":"2021-01-24","stage_classifiercode":"99-42","member_number":"FY131227","first_name":"MATTHEW","last_name":"GIUDICE","classification":"U","division":"PRODUCTION","hit_factor":4.1543},{"match_name":"1ra Fecha USPSA","match_date":"2016-01-10","stage_classifiercode":"99-42","member_number":"\"\"","first_name":"ELIUD M","last_name":"DIAZ GONZALES","classification":"B","division":"PRODUCTION","hit_factor":4.15},{"match_name":"OFGC USPSA August 21 2016","match_date":"2016-08-21","stage_classifiercode":"99-42","member_number":"A73637","first_name":"JAMES","last_name":"JONES","classification":"C","division":"PRODUCTION","hit_factor":4.1487},{"match_name":"GAS July 7th Special Classifier","match_date":"2018-07-07","stage_classifiercode":"99-42","member_number":"A35678","first_name":"RUSS","last_name":"MCELYEA","classification":"C","division":"PRODUCTION","hit_factor":4.1481},{"match_name":"CCPL 03-08-2020","match_date":"2020-03-08","stage_classifiercode":"99-42","member_number":"A105543","first_name":"TRENT","last_name":"KING","classification":"C","division":"PRODUCTION","hit_factor":4.1451},{"match_name":"Pathfinder July USPSA Match","match_date":"2017-07-16","stage_classifiercode":"99-42","member_number":"A102897","first_name":"TODD","last_name":"WAY 2","classification":"U","division":"PRODUCTION","hit_factor":4.1441},{"match_name":"Baghdad USPSA Special Classifier Lightning Interrupted 6 May 2017","match_date":"2017-05-06","stage_classifiercode":"99-42","member_number":"\"\"","first_name":"JARED","last_name":"LUCERO","classification":"U","division":"PRODUCTION","hit_factor":4.1359},{"match_name":"LGCSEMPS 2017 SPECIAL CLASSIFIER","match_date":"2017-04-09","stage_classifiercode":"99-42","member_number":"A102292","first_name":"FRANK","last_name":"MAROTTA","classification":"U","division":"PRODUCTION","hit_factor":4.1253},{"match_name":"FBURG April 2017 Level I USPSA ","match_date":"2017-04-01","stage_classifiercode":"99-42","member_number":"A98618","first_name":"WILLIAM","last_name":"PATTERSON","classification":"B","division":"PRODUCTION","hit_factor":4.1249},{"match_name":"Richmond Hot Shots 2021 USPSA Special Classifier Match - Jan 24 2021","match_date":"2021-01-24","stage_classifiercode":"99-42","member_number":"A128825","first_name":"BEN","last_name":"LAZARUS","classification":"D","division":"PRODUCTION","hit_factor":4.1237},{"match_name":"LIPSA - April 30th 2017 - USPSA Match Special Classifier","match_date":"2017-04-30","stage_classifiercode":"99-42","member_number":"TY68191","first_name":"DAVE","last_name":"WISSEMANN","classification":"C","division":"PRODUCTION","hit_factor":4.1237},{"match_name":"Wvpps May2016","match_date":"2016-05-15","stage_classifiercode":"99-42","member_number":"A80429","first_name":"JOHN","last_name":"WILSON","classification":"B","division":"PRODUCTION","hit_factor":4.1206},{"match_name":"FLPSA USPSA Pistol League 06.28.2016","match_date":"2016-06-28","stage_classifiercode":"99-42","member_number":"\"\"","first_name":"RYAN","last_name":"CARLSON","classification":"U","division":"PRODUCTION","hit_factor":4.1136},{"match_name":"Eagles Nest July 17th","match_date":"2016-07-17","stage_classifiercode":"99-42","member_number":"A13645","first_name":"BILL","last_name":"RAINES","classification":"A","division":"PRODUCTION","hit_factor":4.1096},{"match_name":"HPSP Heartland Practical Shooters October Handgun Shoot","match_date":"2016-10-23","stage_classifiercode":"99-42","member_number":"A-80261","first_name":"DMITRI","last_name":"FOMENKO","classification":"C","division":"PRODUCTION","hit_factor":4.1076},{"match_name":"FLPSA USPSA Pistol League 06.28.2016","match_date":"2016-06-28","stage_classifiercode":"99-42","member_number":"TY83255","first_name":"KATE","last_name":"ARNZEN","classification":"B","division":"PRODUCTION","hit_factor":4.102},{"match_name":"PCWC USPSA 4 22 2017","match_date":"2017-04-22","stage_classifiercode":"99-42","member_number":"\"\"","first_name":"SKYE","last_name":"STONE","classification":"U","division":"PRODUCTION","hit_factor":4.1009},{"match_name":"HPS March Pistol Funshoot","match_date":"2017-03-18","stage_classifiercode":"99-42","member_number":"A85781","first_name":"SHELDON","last_name":"MIYAKADO","classification":"B","division":"PRODUCTION","hit_factor":4.0984},{"match_name":"Prescott 1 st Saturday Uspsa 11-05-2016","match_date":"2016-11-05","stage_classifiercode":"99-42","member_number":"\"\"","first_name":"DANIEL","last_name":"DUDZIAK","classification":"U","division":"PRODUCTION","hit_factor":4.0936},{"match_name":"Shongum October 2016 USPSA Match","match_date":"2016-10-01","stage_classifiercode":"99-42","member_number":"A84313","first_name":"ILYA","last_name":"SEMENOV","classification":"C","division":"PRODUCTION","hit_factor":4.0897},{"match_name":"Crooked Creek Pistol League - April 2017","match_date":"2017-04-22","stage_classifiercode":"99-42","member_number":"A90552","first_name":"BRIAN","last_name":"ANGELL","classification":"U","division":"PRODUCTION","hit_factor":4.0889},{"match_name":"Pathfinder July USPSA Match","match_date":"2017-07-16","stage_classifiercode":"99-42","member_number":"\"\"","first_name":"DOUGLAS","last_name":"OWEN","classification":"none","division":"PRODUCTION","hit_factor":4.0846},{"match_name":"LCHG August USPSA","match_date":"2016-08-07","stage_classifiercode":"99-42","member_number":"\"\"","first_name":"TIM","last_name":"DARUK","classification":"Unclassified","division":"PRODUCTION","hit_factor":4.0844},{"match_name":"WPS USPSA Special Classifier October 2017","match_date":"2017-10-28","stage_classifiercode":"99-42","member_number":"TY81485","first_name":"RICH","last_name":"VIZZINI","classification":"B","division":"PRODUCTION","hit_factor":4.0816},{"match_name":"EWPSA 2018-05","match_date":"2018-05-20","stage_classifiercode":"99-42","member_number":"A80667","first_name":"OLIVIA","last_name":"BAYUK","classification":"B","division":"PRODUCTION","hit_factor":4.0752},{"match_name":"Pathfinder July USPSA Match","match_date":"2017-07-16","stage_classifiercode":"99-42","member_number":"A101567","first_name":"ROBERT","last_name":"CRONK","classification":"U","division":"PRODUCTION","hit_factor":4.0693},{"match_name":"CFRPC June USPSA","match_date":"2018-06-17","stage_classifiercode":"99-42","member_number":"A101884","first_name":"ANTHONY","last_name":"PARRA","classification":"C","division":"PRODUCTION","hit_factor":4.0692},{"match_name":"MS06 Team Magnolia USPSA October Match","match_date":"2016-10-01","stage_classifiercode":"99-42","member_number":"A75881","first_name":"DUSTY","last_name":"AUSTIN","classification":"B","division":"PRODUCTION","hit_factor":4.0644},{"match_name":"Richmond Hot Shots February 5-2017 USPSA Pistol Match","match_date":"2017-02-05","stage_classifiercode":"99-42","member_number":"A91879","first_name":"ALAN","last_name":"CALLAWAY","classification":"C","division":"PRODUCTION","hit_factor":4.0498},{"match_name":"MCPSL Pistol 4-9-16","match_date":"2016-04-09","stage_classifiercode":"99-42","member_number":"A95586","first_name":"JOE","last_name":"JANSSEN","classification":"U","division":"PRODUCTION","hit_factor":4.0453},{"match_name":"Wvpps May2016","match_date":"2016-05-15","stage_classifiercode":"99-42","member_number":"PEN","first_name":"TY","last_name":"O'BRADOVICH","classification":"U","division":"PRODUCTION","hit_factor":4.0323},{"match_name":"PSAC_20170923","match_date":"2017-09-23","stage_classifiercode":"99-42","member_number":"A94589","first_name":"JOE","last_name":"TREGENZA","classification":"B","division":"PRODUCTION","hit_factor":4.0323},{"match_name":"PIPS 08-03-2016","match_date":"2016-08-03","stage_classifiercode":"99-42","member_number":"A95667","first_name":"THOMAS","last_name":"HALVORSEN","classification":"D","division":"PRODUCTION","hit_factor":4.0317},{"match_name":"WPS USPSA Special Classifier October 2017","match_date":"2017-10-28","stage_classifiercode":"99-42","member_number":"A90790","first_name":"JESSICA","last_name":"BRAUN","classification":"U","division":"PRODUCTION","hit_factor":4.0279},{"match_name":"Southkent USPSA MAY match","match_date":"2017-05-20","stage_classifiercode":"99-42","member_number":"A94729","first_name":"CALEB","last_name":"DUMOND","classification":"X","division":"PRODUCTION","hit_factor":4.0268},{"match_name":"DGC USPSA Classifier Match","match_date":"2017-07-30","stage_classifiercode":"99-42","member_number":"A101101","first_name":"BERT","last_name":"CHAMPION","classification":"C","division":"PRODUCTION","hit_factor":4.021},{"match_name":"CFRPC USPSA 2017 JUNE","match_date":"2017-06-18","stage_classifiercode":"99-42","member_number":"L3471","first_name":"MARC","last_name":"WEIR","classification":"C","division":"PRODUCTION","hit_factor":4.0183},{"match_name":"Shoot GTR USPSA 11/22","match_date":"2016-11-22","stage_classifiercode":"99-42","member_number":"\"\"","first_name":"TYSON","last_name":"LEE","classification":"\"\"","division":"PRODUCTION","hit_factor":4.014},{"match_name":"Springfield Tactical Shooters 01/04/2018","match_date":"2018-01-04","stage_classifiercode":"99-42","member_number":"TY78203","first_name":"JIM","last_name":"SHURES","classification":"\"\"","division":"PRODUCTION","hit_factor":4.013},{"match_name":"Baghdad USPSA Special Classifier Lightning Interrupted 6 May 2017","match_date":"2017-05-06","stage_classifiercode":"99-42","member_number":"L3109","first_name":"PHILLIP","last_name":"CROWLEY","classification":"U","division":"PRODUCTION","hit_factor":4.0076},{"match_name":"GRB USPSA FEB at CAV","match_date":"2018-02-17","stage_classifiercode":"99-42","member_number":"A99524","first_name":"CHARLES","last_name":"HARTLEY","classification":"C","division":"PRODUCTION","hit_factor":4.0028},{"match_name":"MVPJan2017","match_date":"2017-01-07","stage_classifiercode":"99-42","member_number":"\"\"","first_name":"NORMAN","last_name":"CROSS","classification":"U","division":"PRODUCTION","hit_factor":4},{"match_name":"3ra Fecha USPSA","match_date":"2018-03-24","stage_classifiercode":"99-42","member_number":"TY83896","first_name":"EDDIE","last_name":"LABRADOR ORTIZ","classification":"B","division":"PRODUCTION","hit_factor":3.9957},{"match_name":"Baghdad USPSA Special Classifier Lightning Interrupted 6 May 2017","match_date":"2017-05-06","stage_classifiercode":"99-42","member_number":"A99454","first_name":"KRISTI","last_name":"SAROSIK","classification":"D","division":"PRODUCTION","hit_factor":3.9896},{"match_name":"PCWC USPSA 4 22 2017","match_date":"2017-04-22","stage_classifiercode":"99-42","member_number":"A99032","first_name":"DALE","last_name":"MUSSELWHITE","classification":"C","division":"PRODUCTION","hit_factor":3.9848},{"match_name":"SAPSA April 2016","match_date":"2016-04-16","stage_classifiercode":"99-42","member_number":"A62597","first_name":"TANNER","last_name":"TRUNNELL","classification":"A","division":"PRODUCTION","hit_factor":3.9818},{"match_name":"HPS March Pistol Funshoot","match_date":"2017-03-18","stage_classifiercode":"99-42","member_number":"\"\"","first_name":"BEN","last_name":"TUMAHAI","classification":"U","division":"PRODUCTION","hit_factor":3.9777},{"match_name":"USPSA","match_date":"2016-09-25","stage_classifiercode":"99-42","member_number":"TY97632","first_name":"BEN","last_name":"SIMCOX","classification":"none","division":"PRODUCTION","hit_factor":3.9759},{"match_name":"NCPS USPSA Handgun Match January 28 2018a","match_date":"2018-01-28","stage_classifiercode":"99-42","member_number":"A93504","first_name":"KEVIN MAN","last_name":"NGU","classification":"A","division":"PRODUCTION","hit_factor":3.9744},{"match_name":"Brothers N Arms August 2017 USPSA Match","match_date":"2017-08-19","stage_classifiercode":"99-42","member_number":"A64744","first_name":"KALYN","last_name":"ULMER","classification":"C","division":"PRODUCTION","hit_factor":3.9735},{"match_name":"Southkent USPSA MAY match","match_date":"2017-05-20","stage_classifiercode":"99-42","member_number":"TY45940","first_name":"BRUCE","last_name":"WARREN","classification":"B","division":"PRODUCTION","hit_factor":3.9705},{"match_name":"Patriot Action Shooters 2016 Special Classifier","match_date":"2016-03-19","stage_classifiercode":"99-42","member_number":"TY81199","first_name":"PETER","last_name":"PFAU","classification":"U","division":"PRODUCTION","hit_factor":3.9683},{"match_name":"ANPRACS USPSA 7-15-18","match_date":"2018-07-15","stage_classifiercode":"99-42","member_number":"TY91250","first_name":"ED","last_name":"JACKSON","classification":"U","division":"PRODUCTION","hit_factor":3.9675},{"match_name":"Richmond Hot Shots February 5-2017 USPSA Pistol Match","match_date":"2017-02-05","stage_classifiercode":"99-42","member_number":"PEN","first_name":"DAVID","last_name":"KADOSH","classification":"U","division":"PRODUCTION","hit_factor":3.9632},{"match_name":"SUPS All Classifier Match March 1718 2018","match_date":"2018-03-17","stage_classifiercode":"99-42","member_number":"A109647","first_name":"DUSTIN","last_name":"ROCK","classification":"U","division":"PRODUCTION","hit_factor":3.9623},{"match_name":"FBURG April 2017 Level I USPSA ","match_date":"2017-04-01","stage_classifiercode":"99-42","member_number":"L4026","first_name":"CHRIS","last_name":"JACKSON","classification":"B","division":"PRODUCTION","hit_factor":3.9616},{"match_name":"ANPRACS Classifier  Match 6-19-16","match_date":"2016-06-19","stage_classifiercode":"99-42","member_number":"A93950","first_name":"LUCAS","last_name":"LOHT","classification":"U","division":"PRODUCTION","hit_factor":3.9544},{"match_name":"Springfield Tactical Shooters 01/04/2018","match_date":"2018-01-04","stage_classifiercode":"99-42","member_number":"A104414","first_name":"STEVE","last_name":"EDGE","classification":"\"\"","division":"PRODUCTION","hit_factor":3.9463},{"match_name":"FBURG April 2017 Level I USPSA ","match_date":"2017-04-01","stage_classifiercode":"99-42","member_number":"TY75668","first_name":"JIM","last_name":"LIANG","classification":"C","division":"PRODUCTION","hit_factor":3.9462},{"match_name":"CCPL 07102016","match_date":"2016-07-10","stage_classifiercode":"99-42","member_number":"A93562","first_name":"NICHOLAS","last_name":"BRANTLEY","classification":"C","division":"PRODUCTION","hit_factor":3.9459},{"match_name":"Springfield Tactical Shooters 01/04/2018","match_date":"2018-01-04","stage_classifiercode":"99-42","member_number":"A63433","first_name":"ROB","last_name":"LEWIS","classification":"\"\"","division":"PRODUCTION","hit_factor":3.9432},{"match_name":"Shongum October 2016 USPSA Match","match_date":"2016-10-01","stage_classifiercode":"99-42","member_number":"A87347","first_name":"AUSTIN","last_name":"NEARY","classification":"C","division":"PRODUCTION","hit_factor":3.9424},{"match_name":"Wvpps May2016","match_date":"2016-05-15","stage_classifiercode":"99-42","member_number":"ty94898","first_name":"NICK","last_name":"COOPER","classification":"U","division":"PRODUCTION","hit_factor":3.9416},{"match_name":"Sharp Practical Shooters March USPSA Match","match_date":"2018-03-25","stage_classifiercode":"99-42","member_number":"A38038","first_name":"RICK","last_name":"DACAYANAN","classification":"U","division":"PRODUCTION","hit_factor":3.9416},{"match_name":"SAPS Match 6/6/2020","match_date":"2020-06-06","stage_classifiercode":"99-42","member_number":"A126144","first_name":"ROBERT","last_name":"KIERNAN","classification":"U","division":"PRODUCTION","hit_factor":3.9391},{"match_name":"Ripon USPSA 3-25-17","match_date":"2017-03-25","stage_classifiercode":"99-42","member_number":"TY98195","first_name":"ROBERT","last_name":"FARRELL","classification":"U","division":"PRODUCTION","hit_factor":3.9377},{"match_name":"1ra Fecha USPSA","match_date":"2016-01-10","stage_classifiercode":"99-42","member_number":"A85967","first_name":"MANUEL","last_name":"CAMPOS","classification":"C","division":"PRODUCTION","hit_factor":3.9344},{"match_name":"3ra Fecha USPSA","match_date":"2018-03-24","stage_classifiercode":"99-42","member_number":"A104070","first_name":"FELIX W.","last_name":"SOTO-CRUZ","classification":"D","division":"PRODUCTION","hit_factor":3.9283},{"match_name":"CFRPC USPSA 2017 JUNE","match_date":"2017-06-18","stage_classifiercode":"99-42","member_number":"A88251","first_name":"LINDA","last_name":"HILTON","classification":"B","division":"PRODUCTION","hit_factor":3.9197},{"match_name":"Shasta Shooters March 2017","match_date":"2017-03-11","stage_classifiercode":"99-42","member_number":"A98589","first_name":"CASEY","last_name":"CANCILLA","classification":"U","division":"PRODUCTION","hit_factor":3.9192},{"match_name":"PSAC_20170923","match_date":"2017-09-23","stage_classifiercode":"99-42","member_number":"L3928","first_name":"BENJAMIN","last_name":"GO","classification":"B","division":"PRODUCTION","hit_factor":3.9157},{"match_name":"Eagles Nest July 17th","match_date":"2016-07-17","stage_classifiercode":"99-42","member_number":"PEN","first_name":"BILL","last_name":"WEHRLE","classification":"U","division":"PRODUCTION","hit_factor":3.9136},{"match_name":"Baghdad USPSA Special Classifier Lightning Interrupted 6 May 2017","match_date":"2017-05-06","stage_classifiercode":"99-42","member_number":"\"\"","first_name":"SULAIMAN","last_name":"ALZANGANAH","classification":"U","division":"PRODUCTION","hit_factor":3.9124},{"match_name":"PSAC_20170923","match_date":"2017-09-23","stage_classifiercode":"99-42","member_number":"A88105","first_name":"DAVID","last_name":"HELLSTERN","classification":"U","division":"PRODUCTION","hit_factor":3.9116},{"match_name":"WPS USPSA Monthly Match November 2016","match_date":"2016-11-05","stage_classifiercode":"99-42","member_number":"A6595","first_name":"FRED","last_name":"DIMMICK","classification":"U","division":"PRODUCTION","hit_factor":3.9098},{"match_name":"NOCPC June 2018","match_date":"2018-06-10","stage_classifiercode":"99-42","member_number":"TY49447","first_name":"ERIC","last_name":"WALKER","classification":"D","division":"PRODUCTION","hit_factor":3.9093},{"match_name":"GRB Jan USPSA @Cav","match_date":"2016-01-16","stage_classifiercode":"99-42","member_number":"FYI71201","first_name":"BARRON","last_name":"ROPER","classification":"C","division":"PRODUCTION","hit_factor":3.9088},{"match_name":"3ra Fecha USPSA","match_date":"2018-03-24","stage_classifiercode":"99-42","member_number":"A85967","first_name":"MANUEL","last_name":"CAMPOS","classification":"B","division":"PRODUCTION","hit_factor":3.9079},{"match_name":"Maine Practical Shooters May 2021","match_date":"2021-05-08","stage_classifiercode":"99-42","member_number":"Ty101366","first_name":"HANK","last_name":"POIRIER","classification":"B","division":"PRODUCTION","hit_factor":3.901},{"match_name":"Richmond Hot Shots 2021 USPSA Special Classifier Match - Jan 24 2021","match_date":"2021-01-24","stage_classifiercode":"99-42","member_number":"A113130","first_name":"SCOTT","last_name":"ALBRECHT","classification":"C","division":"PRODUCTION","hit_factor":3.9002},{"match_name":"Holmen USPSA 10/30/16","match_date":"2016-10-30","stage_classifiercode":"99-42","member_number":"PENDING","first_name":"ALEX","last_name":"MANN","classification":"U","division":"PRODUCTION","hit_factor":3.895},{"match_name":"CCPS March 2020 USPSA","match_date":"2020-03-01","stage_classifiercode":"99-42","member_number":"A50587","first_name":"RIICHIRO","last_name":"SUZUKI","classification":"C","division":"PRODUCTION","hit_factor":3.895},{"match_name":"CRCPS 2021-08-14","match_date":"2021-08-14","stage_classifiercode":"99-42","member_number":"Ty88502","first_name":"CHRISTIAN","last_name":"PETERSON","classification":"A","division":"PRODUCTION","hit_factor":3.8932},{"match_name":"AIPS  USPSA Weekly 22 August 2017","match_date":"2017-08-22","stage_classifiercode":"99-42","member_number":"A98867","first_name":"ASHTON","last_name":"TRENT","classification":"D","division":"PRODUCTION","hit_factor":3.8914},{"match_name":"MS06 Team Magnolia USPSA October Match","match_date":"2016-10-01","stage_classifiercode":"99-42","member_number":"A-98602","first_name":"NEIL","last_name":"DRENNAN","classification":"U","division":"PRODUCTION","hit_factor":3.8863},{"match_name":"NVSA USPSA 1608","match_date":"2016-08-07","stage_classifiercode":"99-42","member_number":"A81824","first_name":"GILBERT","last_name":"SANDLER","classification":"C","division":"PRODUCTION","hit_factor":3.8848},{"match_name":"Trigger Guard USPSA","match_date":"2016-04-02","stage_classifiercode":"99-42","member_number":"A91554","first_name":"MICHAEL","last_name":"ISHIDA","classification":"C","division":"PRODUCTION","hit_factor":3.8825},{"match_name":"MCAS December 2018","match_date":"2018-12-15","stage_classifiercode":"99-42","member_number":"A87737","first_name":"PATRICK","last_name":"MCCORMICK","classification":"U","division":"PRODUCTION","hit_factor":3.8825},{"match_name":"Enps May 2021 USPSA MATCH-All Classifier","match_date":"2021-05-02","stage_classifiercode":"99-42","member_number":"A134010","first_name":"JOHN","last_name":"HAY","classification":"U","division":"PRODUCTION","hit_factor":3.8819},{"match_name":"HCGC TN","match_date":"2020-03-14","stage_classifiercode":"99-42","member_number":"A123817","first_name":"JUSTIN","last_name":"KING","classification":"U","division":"PRODUCTION","hit_factor":3.8804},{"match_name":"FBURG April 2017 Level I USPSA ","match_date":"2017-04-01","stage_classifiercode":"99-42","member_number":"\"\"","first_name":"TES","last_name":"SALB","classification":"C","division":"PRODUCTION","hit_factor":3.8765},{"match_name":"Crooked Creek Pistol League - April 2017","match_date":"2017-04-22","stage_classifiercode":"99-42","member_number":"TY49277","first_name":"PAUL","last_name":"SCHRAY","classification":"C","division":"PRODUCTION","hit_factor":3.876},{"match_name":"LBAS160917 Pistol","match_date":"2016-09-17","stage_classifiercode":"99-42","member_number":"A54861","first_name":"DENNIS","last_name":"WALKER","classification":"B","division":"PRODUCTION","hit_factor":3.8631},{"match_name":"Hose Monster fun ","match_date":"2021-11-07","stage_classifiercode":"99-42","member_number":"a137372","first_name":"VERNE","last_name":"TAYLOR","classification":"U","division":"PRODUCTION","hit_factor":3.8547},{"match_name":"CCPL 07102016","match_date":"2016-07-10","stage_classifiercode":"99-42","member_number":"A96216","first_name":"MATT","last_name":"FEAVER","classification":"D","division":"PRODUCTION","hit_factor":3.8497},{"match_name":"PASA USPSA 3-18-18","match_date":"2018-03-18","stage_classifiercode":"99-42","member_number":"TY74474","first_name":"GARY","last_name":"BELL","classification":"C","division":"PRODUCTION","hit_factor":3.8436},{"match_name":"PCWC USPSA 4 22 2017","match_date":"2017-04-22","stage_classifiercode":"99-42","member_number":"A-83722","first_name":"PATRICK","last_name":"HILL","classification":"U","division":"PRODUCTION","hit_factor":3.8428},{"match_name":"Wvpps May2016","match_date":"2016-05-15","stage_classifiercode":"99-42","member_number":"A86403","first_name":"JUSTIN","last_name":"WILLIAMS","classification":"A","division":"PRODUCTION","hit_factor":3.8411},{"match_name":"FBURG April 2017 Level I USPSA ","match_date":"2017-04-01","stage_classifiercode":"99-42","member_number":"TY84515","first_name":"MAC","last_name":"TYREE","classification":"C","division":"PRODUCTION","hit_factor":3.8397},{"match_name":"SFA July 2016 CLASSIFIED","match_date":"2016-07-16","stage_classifiercode":"99-42","member_number":"A93780","first_name":"NATE","last_name":"HANSHEW","classification":"C","division":"PRODUCTION","hit_factor":3.8391},{"match_name":"Richmond Hot Shots 2021 USPSA Special Classifier Match - Jan 24 2021","match_date":"2021-01-24","stage_classifiercode":"99-42","member_number":"A128595","first_name":"ALEX","last_name":"MAK","classification":"C","division":"PRODUCTION","hit_factor":3.8333},{"match_name":"WPS USPSA Special Classifier October 2017","match_date":"2017-10-28","stage_classifiercode":"99-42","member_number":"A72159","first_name":"TRAVIS","last_name":"LITTS","classification":"A","division":"PRODUCTION","hit_factor":3.8278},{"match_name":"NVSA USPSA 1608","match_date":"2016-08-07","stage_classifiercode":"99-42","member_number":"XXX","first_name":"SHANNON","last_name":"CUNHA","classification":"U","division":"PRODUCTION","hit_factor":3.8278},{"match_name":"GRB Jan USPSA @Cav","match_date":"2016-01-16","stage_classifiercode":"99-42","member_number":"\"\"","first_name":"WILLIAM","last_name":"MOORE","classification":"U","division":"PRODUCTION","hit_factor":3.8251},{"match_name":"Richmond Hot Shots February 5-2017 USPSA Pistol Match","match_date":"2017-02-05","stage_classifiercode":"99-42","member_number":"A93243","first_name":"TONY","last_name":"LUONG","classification":"C","division":"PRODUCTION","hit_factor":3.8246},{"match_name":"MCPSL Pistol 4-9-16","match_date":"2016-04-09","stage_classifiercode":"99-42","member_number":"A92974","first_name":"JERRY","last_name":"WEINSTOCK","classification":"U","division":"PRODUCTION","hit_factor":3.819},{"match_name":"SFA July 2016 CLASSIFIED","match_date":"2016-07-16","stage_classifiercode":"99-42","member_number":"A55939","first_name":"STEVE","last_name":"SCHUETTE","classification":"C","division":"PRODUCTION","hit_factor":3.8151},{"match_name":"WPS USPSA Monthly Match November 2016","match_date":"2016-11-05","stage_classifiercode":"99-42","member_number":"TY61239","first_name":"ERIC","last_name":"SCHINDLER","classification":"D","division":"PRODUCTION","hit_factor":3.8139},{"match_name":"CFRPC USPSA 2017 JUNE","match_date":"2017-06-18","stage_classifiercode":"99-42","member_number":"TY81649","first_name":"DAVID","last_name":"WOODARD","classification":"B","division":"PRODUCTION","hit_factor":3.8132},{"match_name":"Atlanta Practical Shooters November 2016 USPSA","match_date":"2016-11-06","stage_classifiercode":"99-42","member_number":"\"\"","first_name":"MATT","last_name":"ANDRUS","classification":"\"\"","division":"PRODUCTION","hit_factor":3.8113},{"match_name":"BSPSC  2016 NRS Slot Match","match_date":"2016-05-08","stage_classifiercode":"99-42","member_number":"A31011","first_name":"BRYCE","last_name":"DEMERS","classification":"X","division":"PRODUCTION","hit_factor":3.8095},{"match_name":"Pathfinder August USPSA","match_date":"2020-08-16","stage_classifiercode":"99-42","member_number":"A122322","first_name":"JOE","last_name":"ALTIER","classification":"C","division":"PRODUCTION","hit_factor":3.8095},{"match_name":"SFA USPSA OCTOBER 2020","match_date":"2020-10-17","stage_classifiercode":"99-42","member_number":"A113899","first_name":"EMILY","last_name":"PADUA","classification":"D","division":"PRODUCTION","hit_factor":3.8095},{"match_name":"Briar Rabbit August Match 2016","match_date":"2016-08-28","stage_classifiercode":"99-42","member_number":"A96163","first_name":"JOEL","last_name":"MOORE","classification":"D","division":"PRODUCTION","hit_factor":3.8055},{"match_name":"ORSA USPSA July 2021","match_date":"2021-07-17","stage_classifiercode":"99-42","member_number":"A124620","first_name":"SEAN","last_name":"HEARNE","classification":"B","division":"PRODUCTION","hit_factor":3.8018},{"match_name":"WLPS May2017","match_date":"2017-05-28","stage_classifiercode":"99-42","member_number":"A101725","first_name":"JACOB","last_name":"CLAUSSEN","classification":"U","division":"PRODUCTION","hit_factor":3.7961},{"match_name":"Springfield Tactical Shooters 01/04/2018","match_date":"2018-01-04","stage_classifiercode":"99-42","member_number":"A104414","first_name":"STEVE","last_name":"EDGE","classification":"\"\"","division":"PRODUCTION","hit_factor":3.7929},{"match_name":"Hampden RPC August USPSA Match","match_date":"2020-08-09","stage_classifiercode":"99-42","member_number":"TY68707","first_name":"B.P.","last_name":"MURPHY","classification":"C","division":"PRODUCTION","hit_factor":3.786},{"match_name":"WPS USPSA Monthly Match November 2016","match_date":"2016-11-05","stage_classifiercode":"99-42","member_number":"A95069","first_name":"JAMIE","last_name":"KALLNER","classification":"U","division":"PRODUCTION","hit_factor":3.7842},{"match_name":"Crooked Creek Pistol League - April 2017","match_date":"2017-04-22","stage_classifiercode":"99-42","member_number":"A88144","first_name":"TOM","last_name":"LONG","classification":"C","division":"PRODUCTION","hit_factor":3.7821},{"match_name":"WVRPC USPSA 1APR2017 CLASSIFIER","match_date":"2017-04-01","stage_classifiercode":"99-42","member_number":"A80923","first_name":"MARK","last_name":"TOWNSEND","classification":"C","division":"PRODUCTION","hit_factor":3.7755},{"match_name":"Brothers N Arms August 2017 USPSA Match","match_date":"2017-08-19","stage_classifiercode":"99-42","member_number":"TY88701","first_name":"ROBERT","last_name":"CAMPBELL","classification":"C","division":"PRODUCTION","hit_factor":3.7736},{"match_name":"1ra Fecha USPSA","match_date":"2016-01-10","stage_classifiercode":"99-42","member_number":"\"\"","first_name":"FRANCISCO","last_name":"RODRGUEZ DAZ","classification":"U","division":"PRODUCTION","hit_factor":3.7736},{"match_name":"Baghdad USPSA Special Classifier Lightning Interrupted 6 May 2017","match_date":"2017-05-06","stage_classifiercode":"99-42","member_number":"\"\"","first_name":"STEVE","last_name":"HARE","classification":"U","division":"PRODUCTION","hit_factor":3.772},{"match_name":"Richmond Boro Gun Club March 2020 USPSA Match","match_date":"2020-03-14","stage_classifiercode":"99-42","member_number":"TT79471","first_name":"FREDDIE","last_name":"DEPEREZ","classification":"B","division":"PRODUCTION","hit_factor":3.7711},{"match_name":"HPSP Heartland Practical Shooters October Handgun Shoot","match_date":"2016-10-23","stage_classifiercode":"99-42","member_number":"PEN","first_name":"DUSTIN","last_name":"BAILEY","classification":"Unclassified","division":"PRODUCTION","hit_factor":3.7705},{"match_name":"Shasta Shooters August 2017","match_date":"2017-08-12","stage_classifiercode":"99-42","member_number":"A98589","first_name":"CASEY","last_name":"CANCILLA","classification":"D","division":"PRODUCTION","hit_factor":3.7677},{"match_name":"Richmond Hot Shots February 5-2017 USPSA Pistol Match","match_date":"2017-02-05","stage_classifiercode":"99-42","member_number":"TY78995","first_name":"DON","last_name":"HAFICH","classification":"C","division":"PRODUCTION","hit_factor":3.7671},{"match_name":"MS06 Team Magnolia USPSA October Match","match_date":"2016-10-01","stage_classifiercode":"99-42","member_number":"TY44848","first_name":"MICHAEL","last_name":"MCARTHUR","classification":"C","division":"PRODUCTION","hit_factor":3.7545},{"match_name":"Richmond Hot Shots February 5-2017 USPSA Pistol Match","match_date":"2017-02-05","stage_classifiercode":"99-42","member_number":"TY88656","first_name":"BENJAMIN","last_name":"SANTA MARIA","classification":"B","division":"PRODUCTION","hit_factor":3.7512},{"match_name":"3ra Fecha USPSA","match_date":"2018-03-24","stage_classifiercode":"99-42","member_number":"L4385","first_name":"JOSE R","last_name":"FUENTES-RODRIGUEZ","classification":"C","division":"PRODUCTION","hit_factor":3.7481},{"match_name":"Wvpps May2016","match_date":"2016-05-15","stage_classifiercode":"99-42","member_number":"A81004","first_name":"JIM","last_name":"KOUTSOUMPAS","classification":"C","division":"PRODUCTION","hit_factor":3.7429},{"match_name":"LIPSA - April 30th 2017 - USPSA Match Special Classifier","match_date":"2017-04-30","stage_classifiercode":"99-42","member_number":"A53342","first_name":"NICK","last_name":"BONIS","classification":"C","division":"PRODUCTION","hit_factor":3.736},{"match_name":"Pathfinder July USPSA Match","match_date":"2017-07-16","stage_classifiercode":"99-42","member_number":"PEND","first_name":"MIKE","last_name":"LAPE 2","classification":"none","division":"PRODUCTION","hit_factor":3.7351},{"match_name":"Shasta Shooters March 2017","match_date":"2017-03-11","stage_classifiercode":"99-42","member_number":"TY68537","first_name":"MARK","last_name":"BALL","classification":"C","division":"PRODUCTION","hit_factor":3.7307},{"match_name":"Briar Rabbit August Match 2016","match_date":"2016-08-28","stage_classifiercode":"99-42","member_number":"A50424","first_name":"BILL","last_name":"GARDNER","classification":"C","division":"PRODUCTION","hit_factor":3.7286},{"match_name":"Crooked Creek Pistol League - April 2017","match_date":"2017-04-22","stage_classifiercode":"99-42","member_number":"L3426","first_name":"ROBERT","last_name":"WARE","classification":"C","division":"PRODUCTION","hit_factor":3.7277},{"match_name":"MS06 Team Magnolia USPSA October Match","match_date":"2016-10-01","stage_classifiercode":"99-42","member_number":"TY88702","first_name":"ARCHIE","last_name":"NICHOLS","classification":"C","division":"PRODUCTION","hit_factor":3.7257},{"match_name":"CFRPC June USPSA","match_date":"2018-06-17","stage_classifiercode":"99-42","member_number":"A76854","first_name":"LAURENCE","last_name":"GREENE","classification":"B","division":"PRODUCTION","hit_factor":3.723},{"match_name":"WLPS May2017","match_date":"2017-05-28","stage_classifiercode":"99-42","member_number":"TY79193","first_name":"LELAND","last_name":"BELDING","classification":"U","division":"PRODUCTION","hit_factor":3.7169},{"match_name":"Shasta Shooters August 2017","match_date":"2017-08-12","stage_classifiercode":"99-42","member_number":"A85793","first_name":"CHRIS","last_name":"PEPLOW","classification":"C","division":"PRODUCTION","hit_factor":3.7155},{"match_name":"USPSA MO21 2Alpha SBRC July 25 2020","match_date":"2020-07-25","stage_classifiercode":"99-42","member_number":"A129389","first_name":"JOSEPH","last_name":"TAGGART","classification":"U","division":"PRODUCTION","hit_factor":3.7139},{"match_name":"Richmond Boro Gun Club March 2020 USPSA Match","match_date":"2020-03-14","stage_classifiercode":"99-42","member_number":"TY99029","first_name":"NICK","last_name":"TORRELLI","classification":"C","division":"PRODUCTION","hit_factor":3.7108},{"match_name":"FLPSA USPSA Pistol League 06.28.2016","match_date":"2016-06-28","stage_classifiercode":"99-42","member_number":"\"\"","first_name":"JEFF","last_name":"MUELLER","classification":"U","division":"PRODUCTION","hit_factor":3.7104},{"match_name":"SPSA USPSA February 4th Sat match","match_date":"2018-02-24","stage_classifiercode":"99-42","member_number":"A107013","first_name":"MATT","last_name":"MALONE","classification":"U","division":"PRODUCTION","hit_factor":3.7037},{"match_name":"LIPSA - April 30th 2017 - USPSA Match Special Classifier","match_date":"2017-04-30","stage_classifiercode":"99-42","member_number":"TY90728","first_name":"STEVE","last_name":"MICHAELS","classification":"U","division":"PRODUCTION","hit_factor":3.6961},{"match_name":"Southkent USPSA MAY match","match_date":"2017-05-20","stage_classifiercode":"99-42","member_number":"\"\"","first_name":"AARON","last_name":"DEHAAN","classification":"U","division":"PRODUCTION","hit_factor":3.6907},{"match_name":"Minnetonka Game And Fish May 3","match_date":"2017-05-03","stage_classifiercode":"99-42","member_number":"A-95926","first_name":"BUG","last_name":"SCHRADER","classification":"C","division":"PRODUCTION","hit_factor":3.6889},{"match_name":"3ra Fecha USPSA","match_date":"2018-03-24","stage_classifiercode":"99-42","member_number":"TY97157","first_name":"REBECCA","last_name":"AGUIRRE-HERNANDEZ","classification":"D","division":"PRODUCTION","hit_factor":3.6866},{"match_name":"Maine Practical Shooters May 2021","match_date":"2021-05-08","stage_classifiercode":"99-42","member_number":"A86762","first_name":"NATE","last_name":"LAKE","classification":"A","division":"PRODUCTION","hit_factor":3.6835},{"match_name":"EAGC July 2016 USPSA Pistol Match","match_date":"2016-07-17","stage_classifiercode":"99-42","member_number":"\"\"","first_name":"PAUL","last_name":"DILLINGHAM","classification":"U","division":"PRODUCTION","hit_factor":3.681},{"match_name":"Shongum October 2016 USPSA Match","match_date":"2016-10-01","stage_classifiercode":"99-42","member_number":"A98581","first_name":"CHRIS","last_name":"SENDELSKY","classification":"U","division":"PRODUCTION","hit_factor":3.6749},{"match_name":"Prescott 1 st Saturday Uspsa 11-05-2016","match_date":"2016-11-05","stage_classifiercode":"99-42","member_number":"\"\"","first_name":"DON","last_name":"GAGNON","classification":"U","division":"PRODUCTION","hit_factor":3.6685},{"match_name":"BSPSC  2016 NRS Slot Match","match_date":"2016-05-08","stage_classifiercode":"99-42","member_number":"NA","first_name":"DEREK","last_name":"ALFORD","classification":"U","division":"PRODUCTION","hit_factor":3.6649},{"match_name":"CTASA 3rd Sunday USPSA - March 2018","match_date":"2018-03-18","stage_classifiercode":"99-42","member_number":"A105749","first_name":"STEVE","last_name":"TOFT","classification":"U","division":"PRODUCTION","hit_factor":3.6613},{"match_name":"Patriot Action Shooters 2016 Special Classifier","match_date":"2016-03-19","stage_classifiercode":"99-42","member_number":"PEN","first_name":"BRYAN","last_name":"ROCCO","classification":"U","division":"PRODUCTION","hit_factor":3.6491},{"match_name":"FLPSA USPSA Pistol League 06.28.2016","match_date":"2016-06-28","stage_classifiercode":"99-42","member_number":"\"\"","first_name":"MARK","last_name":"TUTILA","classification":"U","division":"PRODUCTION","hit_factor":3.6479},{"match_name":"HAS May 2016 Pistol Match","match_date":"2016-05-08","stage_classifiercode":"99-42","member_number":"TY56216","first_name":"AL","last_name":"SENESI","classification":"B","division":"PRODUCTION","hit_factor":3.6454},{"match_name":"HAS May 2016 Pistol Match","match_date":"2016-05-08","stage_classifiercode":"99-42","member_number":"TY73574","first_name":"MICHAEL","last_name":"LABOSSIERE","classification":"B","division":"PRODUCTION","hit_factor":3.6428},{"match_name":"SAPSA April 2016","match_date":"2016-04-16","stage_classifiercode":"99-42","member_number":"TY70086","first_name":"LARRY","last_name":"COLSON","classification":"C","division":"PRODUCTION","hit_factor":3.6413},{"match_name":"Richmond Hot Shots February 5-2017 USPSA Pistol Match","match_date":"2017-02-05","stage_classifiercode":"99-42","member_number":"A63857","first_name":"HAIM","last_name":"BERESSI","classification":"U","division":"PRODUCTION","hit_factor":3.6388},{"match_name":"FLPSA USPSA Pistol League 06.28.2016","match_date":"2016-06-28","stage_classifiercode":"99-42","member_number":"A92341","first_name":"DAKOTA","last_name":"OVERLAND","classification":"D","division":"PRODUCTION","hit_factor":3.634},{"match_name":"MCTS USPSA 10-08-2016","match_date":"2016-10-08","stage_classifiercode":"99-42","member_number":"\"\"","first_name":"DANIEL","last_name":"SAYLES","classification":"X","division":"PRODUCTION","hit_factor":3.6313},{"match_name":"LIPSA - April 30th 2017 - USPSA Match Special Classifier","match_date":"2017-04-30","stage_classifiercode":"99-42","member_number":"L3915","first_name":"SALVATORE","last_name":"RUSSO","classification":"C","division":"PRODUCTION","hit_factor":3.6265},{"match_name":"EWPSA 2018-04","match_date":"2018-04-15","stage_classifiercode":"99-42","member_number":"A80667","first_name":"OLIVIA","last_name":"BAYUK","classification":"B","division":"PRODUCTION","hit_factor":3.6125},{"match_name":"Atlanta Practical Shooters November 2016 USPSA","match_date":"2016-11-06","stage_classifiercode":"99-42","member_number":"\"\"","first_name":"PATRICK","last_name":"KANE","classification":"U","division":"PRODUCTION","hit_factor":3.6111},{"match_name":"Minot USPSA 7-8-18","match_date":"2018-07-07","stage_classifiercode":"99-42","member_number":"A100992","first_name":"TYLER","last_name":"AMUNDSON","classification":"C","division":"PRODUCTION","hit_factor":3.6088},{"match_name":"SAPSA April 2016","match_date":"2016-04-16","stage_classifiercode":"99-42","member_number":"A75065","first_name":"BRIAN","last_name":"BIGELOW","classification":"B","division":"PRODUCTION","hit_factor":3.6088},{"match_name":"Shasta Shooters August 2017","match_date":"2017-08-12","stage_classifiercode":"99-42","member_number":"A97890","first_name":"SEAN","last_name":"STORY","classification":"D","division":"PRODUCTION","hit_factor":3.6078},{"match_name":"Maine Practical Shooters May 2021","match_date":"2021-05-08","stage_classifiercode":"99-42","member_number":"A130712","first_name":"LUTHER","last_name":"HYSLOP","classification":"B","division":"PRODUCTION","hit_factor":3.6027},{"match_name":"EAGC July 2016 USPSA Pistol Match","match_date":"2016-07-17","stage_classifiercode":"99-42","member_number":"FY75376","first_name":"COMER","last_name":"BUTLER","classification":"C","division":"PRODUCTION","hit_factor":3.5967},{"match_name":"SAPS Match 6/6/2020","match_date":"2020-06-06","stage_classifiercode":"99-42","member_number":"A120323","first_name":"TODD","last_name":"WAGNER","classification":"D","division":"PRODUCTION","hit_factor":3.5945},{"match_name":"WLPS May2017","match_date":"2017-05-28","stage_classifiercode":"99-42","member_number":"A102921","first_name":"JAY","last_name":"MONTGOMERY","classification":"U","division":"PRODUCTION","hit_factor":3.592},{"match_name":"Richmond Boro Gun Club March 2020 USPSA Match","match_date":"2020-03-14","stage_classifiercode":"99-42","member_number":"A126284","first_name":"JOSEPH","last_name":"LANGONE","classification":"U","division":"PRODUCTION","hit_factor":3.5887},{"match_name":"Richmond Boro Gun Club March 2020 USPSA Match","match_date":"2020-03-14","stage_classifiercode":"99-42","member_number":"FY96404","first_name":"ANNA","last_name":"ROINA","classification":"C","division":"PRODUCTION","hit_factor":3.5867},{"match_name":"MISS Match 11-2-16","match_date":"2016-10-31","stage_classifiercode":"99-42","member_number":"A59961","first_name":"VINCENT","last_name":"JAMISON","classification":"C","division":"PRODUCTION","hit_factor":3.5861},{"match_name":"Richmond Hot Shots 2021 USPSA Special Classifier Match - Jan 24 2021","match_date":"2021-01-24","stage_classifiercode":"99-42","member_number":"A131662","first_name":"KAREN","last_name":"NAKAMURA","classification":"U","division":"PRODUCTION","hit_factor":3.5849},{"match_name":"CBS - USPSA June 12 2016","match_date":"2016-06-12","stage_classifiercode":"99-42","member_number":"TY74796","first_name":"SETH","last_name":"CLAGG","classification":"\"\"","division":"PRODUCTION","hit_factor":3.5831},{"match_name":"Minnetonka Game And Fish May 3","match_date":"2017-05-03","stage_classifiercode":"99-42","member_number":"TY81562","first_name":"JOE","last_name":"SMITH","classification":"B","division":"PRODUCTION","hit_factor":3.5787},{"match_name":"PASA USPSA 3-18-18","match_date":"2018-03-18","stage_classifiercode":"99-42","member_number":"A86672","first_name":"DONALD","last_name":"HITCHINGS","classification":"C","division":"PRODUCTION","hit_factor":3.5772},{"match_name":"Atlanta Practical Shooters November 2016 USPSA","match_date":"2016-11-06","stage_classifiercode":"99-42","member_number":"A84202","first_name":"DOUG","last_name":"RUTLEDGE","classification":"B","division":"PRODUCTION","hit_factor":3.5714},{"match_name":"Prescott 1 st Saturday Uspsa 11-05-2016","match_date":"2016-11-05","stage_classifiercode":"99-42","member_number":"A66902","first_name":"JAMES","last_name":"FREEMAN","classification":"C","division":"PRODUCTION","hit_factor":3.5684},{"match_name":"SFA July 2016 CLASSIFIED","match_date":"2016-07-16","stage_classifiercode":"99-42","member_number":"TY14807","first_name":"KEN","last_name":"JOHNSON","classification":"C","division":"PRODUCTION","hit_factor":3.5663},{"match_name":"LGCSEMPS 2017 SPECIAL CLASSIFIER","match_date":"2017-04-09","stage_classifiercode":"99-42","member_number":"F99914","first_name":"MATTHEW","last_name":"SCOTT","classification":"U","division":"PRODUCTION","hit_factor":3.5635},{"match_name":"Pathfinder July USPSA Match","match_date":"2017-07-16","stage_classifiercode":"99-42","member_number":"A95042","first_name":"JIM","last_name":"ANGIOLILLO","classification":"D","division":"PRODUCTION","hit_factor":3.5635},{"match_name":"CCPL 03-08-2020","match_date":"2020-03-08","stage_classifiercode":"99-42","member_number":"A123219","first_name":"DANIEL","last_name":"MORALES-RUIZ","classification":"U","division":"PRODUCTION","hit_factor":3.559},{"match_name":"OFGC USPSA August 21 2016","match_date":"2016-08-21","stage_classifiercode":"99-42","member_number":"A92125","first_name":"MELISSA","last_name":"NOBLE","classification":"U","division":"PRODUCTION","hit_factor":3.5529},{"match_name":"WPS USPSA Special Classifier October 2017","match_date":"2017-10-28","stage_classifiercode":"99-42","member_number":"A38205","first_name":"DALE","last_name":"NELSON","classification":"U","division":"PRODUCTION","hit_factor":3.5499},{"match_name":"CCPL 07102016","match_date":"2016-07-10","stage_classifiercode":"99-42","member_number":"A87001","first_name":"LARRY","last_name":"CASADO","classification":"C","division":"PRODUCTION","hit_factor":3.5427},{"match_name":"AIPS  USPSA Weekly 22 August 2017","match_date":"2017-08-22","stage_classifiercode":"99-42","member_number":"A98857","first_name":"CHANDY","last_name":"SOUVATRAT","classification":"C","division":"PRODUCTION","hit_factor":3.5373},{"match_name":"Pathfinder July USPSA Match","match_date":"2017-07-16","stage_classifiercode":"99-42","member_number":"L295","first_name":"JOHN","last_name":"AMIDON","classification":"B","division":"PRODUCTION","hit_factor":3.537},{"match_name":"Springfield Tactical Shooters 01-05-2017","match_date":"2017-01-05","stage_classifiercode":"99-42","member_number":"\"\"","first_name":"JOSH","last_name":"LONGHTA","classification":"\"\"","division":"PRODUCTION","hit_factor":3.5344},{"match_name":"FAS Sunday Member Appreciation USPSA Match","match_date":"2021-08-15","stage_classifiercode":"99-42","member_number":"TY112863","first_name":"AMANDA","last_name":"ZIMMER","classification":"C","division":"PRODUCTION","hit_factor":3.5314},{"match_name":"Holmen USPSA 10/30/16","match_date":"2016-10-30","stage_classifiercode":"99-42","member_number":"A94704","first_name":"JOHN","last_name":"BUDNAITIS","classification":"C","division":"PRODUCTION","hit_factor":3.5247},{"match_name":"GRB USPSA FEB at CAV","match_date":"2018-02-17","stage_classifiercode":"99-42","member_number":"\"\"","first_name":"GRANT","last_name":"HOWSER","classification":"D","division":"PRODUCTION","hit_factor":3.5216},{"match_name":"Richmond Borough Gun ClubJuly 1st 2017 USPSA Pistol Match","match_date":"2017-07-01","stage_classifiercode":"99-42","member_number":"A100170","first_name":"RYAN","last_name":"CHAN","classification":"U","division":"PRODUCTION","hit_factor":3.5206},{"match_name":"Maine Practical Shooters May 2021","match_date":"2021-05-08","stage_classifiercode":"99-42","member_number":"A101919","first_name":"FRED","last_name":"ROIG","classification":"D","division":"PRODUCTION","hit_factor":3.5206},{"match_name":"Pathfinder July USPSA Match","match_date":"2017-07-16","stage_classifiercode":"99-42","member_number":"A95495","first_name":"LAURA","last_name":"FRITZ","classification":"C","division":"PRODUCTION","hit_factor":3.5191},{"match_name":"HPSP Heartland Practical Shooters October Handgun Shoot","match_date":"2016-10-23","stage_classifiercode":"99-42","member_number":"A98894","first_name":"TOM","last_name":"CROSS","classification":"Unclassified","division":"PRODUCTION","hit_factor":3.5167},{"match_name":"SLPSA  USPSA","match_date":"2016-09-17","stage_classifiercode":"99-42","member_number":"A95199","first_name":"CRAIG","last_name":"JOHNSON","classification":"C","division":"PRODUCTION","hit_factor":3.5135},{"match_name":"GRB USPSA FEB at CAV","match_date":"2018-02-17","stage_classifiercode":"99-42","member_number":"A104834","first_name":"LOGAN","last_name":"SAUNDERS","classification":"U","division":"PRODUCTION","hit_factor":3.5135},{"match_name":"USPSA","match_date":"2016-09-25","stage_classifiercode":"99-42","member_number":"\"\"","first_name":"JULIUS","last_name":"MCADAMS","classification":"U","division":"PRODUCTION","hit_factor":3.5135},{"match_name":"FRAPC USPSA  League 4","match_date":"2018-06-05","stage_classifiercode":"99-42","member_number":"\"\"","first_name":"TODD","last_name":"HAUGAARD","classification":"\"\"","division":"PRODUCTION","hit_factor":3.5117},{"match_name":"LPC April 2016 USPSA Match","match_date":"2016-04-03","stage_classifiercode":"99-42","member_number":"A95489","first_name":"TODD","last_name":"ELLSWORTH","classification":"U","division":"PRODUCTION","hit_factor":3.5105},{"match_name":"NCPS USPSA Handgun Match January 28 2018a","match_date":"2018-01-28","stage_classifiercode":"99-42","member_number":"A48595","first_name":"JOHN","last_name":"MERCURIO","classification":"A","division":"PRODUCTION","hit_factor":3.5019},{"match_name":"LIPSA - April 30th 2017 - USPSA Match Special Classifier","match_date":"2017-04-30","stage_classifiercode":"99-42","member_number":"A76448","first_name":"MICHAEL","last_name":"VOLDO","classification":"D","division":"PRODUCTION","hit_factor":3.4934},{"match_name":"NCPS USPSA Handgun Match January 28 2018a","match_date":"2018-01-28","stage_classifiercode":"99-42","member_number":"A105617","first_name":"MEGAN","last_name":"CARNES","classification":"D","division":"PRODUCTION","hit_factor":3.4929},{"match_name":"USPSA","match_date":"2016-09-25","stage_classifiercode":"99-42","member_number":"\"\"","first_name":"ELAINE","last_name":"ESTES","classification":"none","division":"PRODUCTION","hit_factor":3.4921},{"match_name":"Baghdad USPSA Special Classifier Lightning Interrupted 6 May 2017","match_date":"2017-05-06","stage_classifiercode":"99-42","member_number":"L4189","first_name":"JONATHAN","last_name":"GONZALES","classification":"C","division":"PRODUCTION","hit_factor":3.481},{"match_name":"USPSA Bass River June 2017","match_date":"2017-06-04","stage_classifiercode":"99-42","member_number":"\"\"","first_name":"JOHN","last_name":"HARTY","classification":"\"\"","division":"PRODUCTION","hit_factor":3.481},{"match_name":"USPSA","match_date":"2016-12-18","stage_classifiercode":"99-42","member_number":"TY76300","first_name":"ZACK","last_name":"HAYMAN","classification":"C","division":"PRODUCTION","hit_factor":3.4795},{"match_name":"Pathfinder July USPSA Match","match_date":"2017-07-16","stage_classifiercode":"99-42","member_number":"A88067","first_name":"CHARLIE","last_name":"FRITZ","classification":"C","division":"PRODUCTION","hit_factor":3.4752},{"match_name":"HPS March Pistol Funshoot","match_date":"2017-03-18","stage_classifiercode":"99-42","member_number":"A77673","first_name":"AUDIE","last_name":"GERILLA","classification":"C","division":"PRODUCTION","hit_factor":3.4688},{"match_name":"WLPS May2017","match_date":"2017-05-28","stage_classifiercode":"99-42","member_number":"TY95959","first_name":"RODNEY","last_name":"STUART","classification":"D","division":"PRODUCTION","hit_factor":3.4682},{"match_name":"Prescott 1 st Saturday Uspsa 11-05-2016","match_date":"2016-11-05","stage_classifiercode":"99-42","member_number":"A59326","first_name":"TOM","last_name":"KING","classification":"B","division":"PRODUCTION","hit_factor":3.4682},{"match_name":"Hampden RPC August USPSA Match","match_date":"2020-08-09","stage_classifiercode":"99-42","member_number":"A78257","first_name":"GEREMY","last_name":"SEIFERT","classification":"B","division":"PRODUCTION","hit_factor":3.4649},{"match_name":"FBURG April 2017 Level I USPSA ","match_date":"2017-04-01","stage_classifiercode":"99-42","member_number":"\"\"","first_name":"LUKE","last_name":"DOAK","classification":"A","division":"PRODUCTION","hit_factor":3.4619},{"match_name":"SLPSA  USPSA","match_date":"2016-09-17","stage_classifiercode":"99-42","member_number":"TY91979","first_name":"MIKE","last_name":"HOTTINGER","classification":"C","division":"PRODUCTION","hit_factor":3.4597},{"match_name":"HAS May 2016 Pistol Match","match_date":"2016-05-08","stage_classifiercode":"99-42","member_number":"\"\"","first_name":"DAVE","last_name":"SALANI","classification":"X","division":"PRODUCTION","hit_factor":3.4554},{"match_name":"Atlanta Practical Shooters March 2016 USPSA - Classifier Match","match_date":"2016-03-06","stage_classifiercode":"99-42","member_number":"L","first_name":"CHRIS","last_name":"PALMER","classification":"C","division":"PRODUCTION","hit_factor":3.4549},{"match_name":"ORSA USPSA July 2021","match_date":"2021-07-17","stage_classifiercode":"99-42","member_number":"A105249","first_name":"MARK","last_name":"MEFFORD","classification":"A","division":"PRODUCTION","hit_factor":3.4521},{"match_name":"SFA July 2016 CLASSIFIED","match_date":"2016-07-16","stage_classifiercode":"99-42","member_number":"TY70226","first_name":"LARRY","last_name":"RHODES","classification":"C","division":"PRODUCTION","hit_factor":3.4483},{"match_name":"Shoot GTR USPSA 11/22","match_date":"2016-11-22","stage_classifiercode":"99-42","member_number":"A91538","first_name":"JAY","last_name":"ROMARAOG","classification":"C","division":"PRODUCTION","hit_factor":3.4435},{"match_name":"LIPSA - April 30th 2017 - USPSA Match Special Classifier","match_date":"2017-04-30","stage_classifiercode":"99-42","member_number":"L3570","first_name":"KEVIN","last_name":"DRISCOLL","classification":"C","division":"PRODUCTION","hit_factor":3.4419},{"match_name":"APSC USPSA Special Classifier 04-02-16","match_date":"2016-04-02","stage_classifiercode":"99-42","member_number":"A87488","first_name":"BAIN","last_name":"MULLINS","classification":"U","division":"PRODUCTION","hit_factor":3.4415},{"match_name":"Hose Monster fun ","match_date":"2021-11-07","stage_classifiercode":"99-42","member_number":"9999","first_name":"RICK","last_name":"BACHMAN","classification":"U","division":"PRODUCTION","hit_factor":3.4395},{"match_name":"OREGON ARPC CC05 USPSA Nov 13 2021","match_date":"2021-11-13","stage_classifiercode":"99-42","member_number":"Ty107590","first_name":"LEE","last_name":"CLIFTON","classification":"C","division":"PRODUCTION","hit_factor":3.4373},{"match_name":"FLPSA USPSA Pistol League 06.28.2016","match_date":"2016-06-28","stage_classifiercode":"99-42","member_number":"A97255","first_name":"DARIN","last_name":"MAGER","classification":"U","division":"PRODUCTION","hit_factor":3.4323},{"match_name":"Shasta Shooters March 2017","match_date":"2017-03-11","stage_classifiercode":"99-42","member_number":"\"\"","first_name":"RICK","last_name":"FREITAS","classification":"U","division":"PRODUCTION","hit_factor":3.4301},{"match_name":"BSPSC  2016 NRS Slot Match","match_date":"2016-05-08","stage_classifiercode":"99-42","member_number":"\"\"","first_name":"MATT","last_name":"BOWMAN","classification":"\"\"","division":"PRODUCTION","hit_factor":3.4286},{"match_name":"CCPL 03-08-2020","match_date":"2020-03-08","stage_classifiercode":"99-42","member_number":"A107307","first_name":"ALLAN","last_name":"ABREA","classification":"B","division":"PRODUCTION","hit_factor":3.424},{"match_name":"Shoot GTR Tuesday Match 09/05/2017","match_date":"2017-09-05","stage_classifiercode":"99-42","member_number":"A104272","first_name":"RICHARD","last_name":"GILL 2","classification":"X","division":"PRODUCTION","hit_factor":3.4238},{"match_name":"CFRPC USPSA 2017 JUNE","match_date":"2017-06-18","stage_classifiercode":"99-42","member_number":"\"\"","first_name":"JOEY","last_name":"EMPAMANO","classification":"U","division":"PRODUCTION","hit_factor":3.4233},{"match_name":"MVPSA USPSA June 19th 2021","match_date":"2021-06-19","stage_classifiercode":"99-42","member_number":"FY111341","first_name":"DENE","last_name":"MILLER","classification":"D","division":"PRODUCTION","hit_factor":3.4221},{"match_name":"5 Dogs July USPSA","match_date":"2016-07-03","stage_classifiercode":"99-42","member_number":"\"\"","first_name":"MATT","last_name":"WHITE","classification":"Unclassified","division":"PRODUCTION","hit_factor":3.408},{"match_name":"Richmond Hot Shots 2021 USPSA Special Classifier Match - Jan 24 2021","match_date":"2021-01-24","stage_classifiercode":"99-42","member_number":"A132263","first_name":"DAVID","last_name":"VANSTEEN","classification":"U","division":"PRODUCTION","hit_factor":3.4076},{"match_name":"RBGC 2017-08-26","match_date":"2017-08-26","stage_classifiercode":"99-42","member_number":"A105212","first_name":"MICHAEL","last_name":"FABIAN","classification":"U","division":"PRODUCTION","hit_factor":3.3994},{"match_name":"Ripon USPSA 3-25-17","match_date":"2017-03-25","stage_classifiercode":"99-42","member_number":"TY54099","first_name":"SCOTT","last_name":"DORMAN","classification":"C","division":"PRODUCTION","hit_factor":3.3967},{"match_name":"FLPSA USPSA Pistol League 06.28.2016","match_date":"2016-06-28","stage_classifiercode":"99-42","member_number":"A51616","first_name":"DICK","last_name":"ROLES","classification":"U","division":"PRODUCTION","hit_factor":3.3941},{"match_name":"MSSA USPSA Club Match","match_date":"2017-10-22","stage_classifiercode":"99-42","member_number":"A97863","first_name":"WES","last_name":"CARROLL","classification":"C","division":"PRODUCTION","hit_factor":3.3882},{"match_name":"EWPSA 2018-05","match_date":"2018-05-20","stage_classifiercode":"99-42","member_number":"\"\"","first_name":"DOUG","last_name":"TRIEBELHORN","classification":"U","division":"PRODUCTION","hit_factor":3.3821},{"match_name":"NCPS USPSA Handgun Match January 28 2018a","match_date":"2018-01-28","stage_classifiercode":"99-42","member_number":"A93417","first_name":"TONY","last_name":"LE","classification":"C","division":"PRODUCTION","hit_factor":3.3799},{"match_name":"Steel City USPSA July 2016","match_date":"2016-07-02","stage_classifiercode":"99-42","member_number":"\"\"","first_name":"MICHAEL","last_name":"MANSON","classification":"U","division":"PRODUCTION","hit_factor":3.3735},{"match_name":"LIPSA - April 30th 2017 - USPSA Match Special Classifier","match_date":"2017-04-30","stage_classifiercode":"99-42","member_number":"A85779","first_name":"SCOTT","last_name":"DIRUSSO","classification":"C","division":"PRODUCTION","hit_factor":3.3729},{"match_name":"5 Dogs July USPSA","match_date":"2016-07-03","stage_classifiercode":"99-42","member_number":"\"\"","first_name":"MARK","last_name":"SMITH","classification":"Unclassified","division":"PRODUCTION","hit_factor":3.37},{"match_name":"SAPSA April 2016","match_date":"2016-04-16","stage_classifiercode":"99-42","member_number":"L3565","first_name":"GERARDO","last_name":"FLORES","classification":"C","division":"PRODUCTION","hit_factor":3.3679},{"match_name":"LGCSEMPS 2017 SPECIAL CLASSIFIER","match_date":"2017-04-09","stage_classifiercode":"99-42","member_number":"\"\"","first_name":"KENNETH","last_name":"WURM","classification":"U","division":"PRODUCTION","hit_factor":3.367},{"match_name":"GRB Jan USPSA @Cav","match_date":"2016-01-16","stage_classifiercode":"99-42","member_number":"A76884","first_name":"DOUG","last_name":"PADGETT","classification":"C","division":"PRODUCTION","hit_factor":3.365},{"match_name":"PIPS 08-03-2016","match_date":"2016-08-03","stage_classifiercode":"99-42","member_number":"A91025","first_name":"DICK","last_name":"ANNEKE","classification":"D","division":"PRODUCTION","hit_factor":3.36},{"match_name":"FRAPC USPSA  League 4","match_date":"2018-06-05","stage_classifiercode":"99-42","member_number":"\"\"","first_name":"BRENT","last_name":"PETERSON","classification":"\"\"","division":"PRODUCTION","hit_factor":3.359},{"match_name":"USPSA Bass River June 2017","match_date":"2017-06-04","stage_classifiercode":"99-42","member_number":"\"\"","first_name":"DAN","last_name":"GRAFTON","classification":"\"\"","division":"PRODUCTION","hit_factor":3.3588},{"match_name":"Baghdad USPSA Special Classifier Lightning Interrupted 6 May 2017","match_date":"2017-05-06","stage_classifiercode":"99-42","member_number":"\"\"","first_name":"BOBBY","last_name":"HARLAN","classification":"U","division":"PRODUCTION","hit_factor":3.3571},{"match_name":"Briar Rabbit August Match 2016","match_date":"2016-08-28","stage_classifiercode":"99-42","member_number":"A96708","first_name":"YURIY","last_name":"BORZENKO","classification":"C","division":"PRODUCTION","hit_factor":3.3493},{"match_name":"Richmond Hot Shots February 5-2017 USPSA Pistol Match","match_date":"2017-02-05","stage_classifiercode":"99-42","member_number":"\"\"","first_name":"ZACH","last_name":"ROY","classification":"U","division":"PRODUCTION","hit_factor":3.3486},{"match_name":"EWPSA 2018-05","match_date":"2018-05-20","stage_classifiercode":"99-42","member_number":"A105708","first_name":"JEFF","last_name":"SIDEBOTTOM","classification":"U","division":"PRODUCTION","hit_factor":3.3455},{"match_name":"Baghdad USPSA Special Classifier Lightning Interrupted 6 May 2017","match_date":"2017-05-06","stage_classifiercode":"99-42","member_number":"A101050","first_name":"GREG","last_name":"JOHNSON","classification":"U","division":"PRODUCTION","hit_factor":3.3378},{"match_name":"Crooked Creek Pistol League - April 2017","match_date":"2017-04-22","stage_classifiercode":"99-42","member_number":"TY57001","first_name":"STUART","last_name":"SARKISIAN","classification":"C","division":"PRODUCTION","hit_factor":3.3333},{"match_name":"HAS May 2016 Pistol Match","match_date":"2016-05-08","stage_classifiercode":"99-42","member_number":"A86029","first_name":"PATRICK","last_name":"NIXON","classification":"\u0000","division":"PRODUCTION","hit_factor":3.3228},{"match_name":"Baghdad USPSA Special Classifier Lightning Interrupted 6 May 2017","match_date":"2017-05-06","stage_classifiercode":"99-42","member_number":"\"\"","first_name":"JONATHAN","last_name":"ALBRECHT","classification":"U","division":"PRODUCTION","hit_factor":3.3184},{"match_name":"LGCSEMPS 2017 SPECIAL CLASSIFIER","match_date":"2017-04-09","stage_classifiercode":"99-42","member_number":"\"\"","first_name":"ROBERT","last_name":"DEGRYSE","classification":"U","division":"PRODUCTION","hit_factor":3.3141},{"match_name":"Richmond Borough Gun ClubJuly 1st 2017 USPSA Pistol Match","match_date":"2017-07-01","stage_classifiercode":"99-42","member_number":"A100045","first_name":"TAE HOON (KYLE)","last_name":"KIM","classification":"U","division":"PRODUCTION","hit_factor":3.312},{"match_name":"Steel City USPSA July 2016","match_date":"2016-07-02","stage_classifiercode":"99-42","member_number":"A34628","first_name":"DAVE","last_name":"WRIGHT","classification":"U","division":"PRODUCTION","hit_factor":3.3071},{"match_name":"Caja del Rio - July 2017","match_date":"2017-07-15","stage_classifiercode":"99-42","member_number":"A102786","first_name":"K-MART","last_name":"MARTINEZ","classification":"C","division":"PRODUCTION","hit_factor":3.2947},{"match_name":"LGCSEMPS 2017 SPECIAL CLASSIFIER","match_date":"2017-04-09","stage_classifiercode":"99-42","member_number":"PEN","first_name":"SCOTT","last_name":"ST.LAURENT","classification":"U","division":"PRODUCTION","hit_factor":3.2916},{"match_name":"ORSA USPSA Chuck Berry Memorial Match 15 April","match_date":"2017-04-15","stage_classifiercode":"99-42","member_number":"A98607","first_name":"ROBERT","last_name":"KRING","classification":"U","division":"PRODUCTION","hit_factor":3.2899},{"match_name":"APSC USPSA Special Classifier 04-02-16","match_date":"2016-04-02","stage_classifiercode":"99-42","member_number":"TY85932","first_name":"CHARLES","last_name":"LE","classification":"U","division":"PRODUCTION","hit_factor":3.2867},{"match_name":"Richmond Hot Shots February 5-2017 USPSA Pistol Match","match_date":"2017-02-05","stage_classifiercode":"99-42","member_number":"\"\"","first_name":"DAVID","last_name":"BELL","classification":"U","division":"PRODUCTION","hit_factor":3.2805},{"match_name":"WVRPC USPSA 1APR2017 CLASSIFIER","match_date":"2017-04-01","stage_classifiercode":"99-42","member_number":"A50174","first_name":"MIKE","last_name":"ELZINGA","classification":"X","division":"PRODUCTION","hit_factor":3.2787},{"match_name":"Southkent USPSA MAY match","match_date":"2017-05-20","stage_classifiercode":"99-42","member_number":"\"\"","first_name":"GARY","last_name":"GIBBONS","classification":"U","division":"PRODUCTION","hit_factor":3.2653},{"match_name":"PCWC USPSA 4 22 2017","match_date":"2017-04-22","stage_classifiercode":"99-42","member_number":"\"\"","first_name":"MICHAEL","last_name":"TYRREL","classification":"U","division":"PRODUCTION","hit_factor":3.2602},{"match_name":"Prescott 1 st Saturday Uspsa 11-05-2016","match_date":"2016-11-05","stage_classifiercode":"99-42","member_number":"A88990","first_name":"AUSTIN","last_name":"FAULKNER","classification":"B","division":"PRODUCTION","hit_factor":3.2401},{"match_name":"LIPSA - April 30th 2017 - USPSA Match Special Classifier","match_date":"2017-04-30","stage_classifiercode":"99-42","member_number":"A91801","first_name":"BO","last_name":"TIAN","classification":"C","division":"PRODUCTION","hit_factor":3.2305},{"match_name":"Crooked Creek Pistol League - April 2017","match_date":"2017-04-22","stage_classifiercode":"99-42","member_number":"TY75462","first_name":"JASON","last_name":"HUGHES","classification":"C","division":"PRODUCTION","hit_factor":3.2187},{"match_name":"LIPSA - April 30th 2017 - USPSA Match Special Classifier","match_date":"2017-04-30","stage_classifiercode":"99-42","member_number":"A55119","first_name":"NICHOLAS","last_name":"ANDRONICA","classification":"U","division":"PRODUCTION","hit_factor":3.2181},{"match_name":"GRB Jan USPSA @Cav","match_date":"2016-01-16","stage_classifiercode":"99-42","member_number":"A82831","first_name":"MATT","last_name":"BABB","classification":"A","division":"PRODUCTION","hit_factor":3.2043},{"match_name":"Briar Rabbit August Match 2016","match_date":"2016-08-28","stage_classifiercode":"99-42","member_number":"\"\"","first_name":"LUKE","last_name":"PROFFITT","classification":"U","division":"PRODUCTION","hit_factor":3.2039},{"match_name":"YMM IPSC02 2017_09_24","match_date":"2017-09-24","stage_classifiercode":"99-42","member_number":"\"\"","first_name":"AL","last_name":"BARRAGAN","classification":"U","division":"PRODUCTION","hit_factor":3.2009},{"match_name":"MISS Match 11-2-16","match_date":"2016-10-31","stage_classifiercode":"99-42","member_number":"A99280","first_name":"MAREK","last_name":"DUDEK","classification":"U","division":"PRODUCTION","hit_factor":3.2},{"match_name":"1ra Fecha USPSA","match_date":"2016-01-10","stage_classifiercode":"99-42","member_number":"\"\"","first_name":"NESTOR A.","last_name":"FLORES ACOSTA","classification":"U","division":"PRODUCTION","hit_factor":3.1983},{"match_name":"CFRPC USPSA 2017 JUNE","match_date":"2017-06-18","stage_classifiercode":"99-42","member_number":"TY93457","first_name":"JOE","last_name":"BARTOLOTTA","classification":"D","division":"PRODUCTION","hit_factor":3.1967},{"match_name":"APSC USPSA Special Classifier 04-02-16","match_date":"2016-04-02","stage_classifiercode":"99-42","member_number":"89824","first_name":"MIKE","last_name":"WIERDSMA","classification":"C","division":"PRODUCTION","hit_factor":3.1941},{"match_name":"Atlanta Practical Shooters March 2016 USPSA - Classifier Match","match_date":"2016-03-06","stage_classifiercode":"99-42","member_number":"\"\"","first_name":"PATRICK","last_name":"MARCACCI","classification":"U","division":"PRODUCTION","hit_factor":3.1888},{"match_name":"HAS May 2016 Pistol Match","match_date":"2016-05-08","stage_classifiercode":"99-42","member_number":"A91161","first_name":"PATRICE","last_name":"CASIAN","classification":"D","division":"PRODUCTION","hit_factor":3.1861},{"match_name":"Wvpps May2016","match_date":"2016-05-15","stage_classifiercode":"99-42","member_number":"A26509","first_name":"MICHAEL","last_name":"PADGETT","classification":"\"\"","division":"PRODUCTION","hit_factor":3.1792},{"match_name":"Enps May 2021 USPSA MATCH-All Classifier","match_date":"2021-05-02","stage_classifiercode":"99-42","member_number":"A118926","first_name":"ALAN","last_name":"NEESEN","classification":"D","division":"PRODUCTION","hit_factor":3.1767},{"match_name":"FLPSA USPSA Pistol League 06.28.2016","match_date":"2016-06-28","stage_classifiercode":"99-42","member_number":"A96815","first_name":"DAN","last_name":"DARROW","classification":"U","division":"PRODUCTION","hit_factor":3.1603},{"match_name":"Pathfinder July USPSA Match","match_date":"2017-07-16","stage_classifiercode":"99-42","member_number":"\"\"","first_name":"MIKE","last_name":"CALHOUN","classification":"none","division":"PRODUCTION","hit_factor":3.156},{"match_name":"RCPS USPSA Feb 17","match_date":"2018-02-17","stage_classifiercode":"99-42","member_number":"\"\"","first_name":"AUSTIN","last_name":"KELLETT","classification":"U","division":"PRODUCTION","hit_factor":3.1442},{"match_name":"Steel City USPSA July 2016","match_date":"2016-07-02","stage_classifiercode":"99-42","member_number":"A88537","first_name":"ROBBIE","last_name":"NICHOLS","classification":"U","division":"PRODUCTION","hit_factor":3.1442},{"match_name":"NVSA USPSA 1608","match_date":"2016-08-07","stage_classifiercode":"99-42","member_number":"A86718","first_name":"JACK","last_name":"RICE","classification":"C","division":"PRODUCTION","hit_factor":3.1288},{"match_name":"SPSA USPSA February 4th Sat match","match_date":"2018-02-24","stage_classifiercode":"99-42","member_number":"\"\"","first_name":"RON","last_name":"LEAVITT","classification":"U","division":"PRODUCTION","hit_factor":3.1169},{"match_name":"MVPJan2017","match_date":"2017-01-07","stage_classifiercode":"99-42","member_number":"\"\"","first_name":"WARREN","last_name":"ZEMAN","classification":"U","division":"PRODUCTION","hit_factor":3.1149},{"match_name":"Richmond Boro Gun Club March 2020 USPSA Match","match_date":"2020-03-14","stage_classifiercode":"99-42","member_number":"A121921","first_name":"IGOR","last_name":"SHAFRAN","classification":"U","division":"PRODUCTION","hit_factor":3.1131},{"match_name":"FVPS August USPSA Match","match_date":"2018-08-04","stage_classifiercode":"99-42","member_number":"TY100837","first_name":"WILL","last_name":"MCCLUSKEY","classification":"U","division":"PRODUCTION","hit_factor":3.0973},{"match_name":"Crooked Creek Pistol League - April 2017","match_date":"2017-04-22","stage_classifiercode":"99-42","member_number":"\"\"","first_name":"JACK","last_name":"SHEPARD","classification":"U","division":"PRODUCTION","hit_factor":3.0917},{"match_name":"CFRPC USPSA 2017 JUNE","match_date":"2017-06-18","stage_classifiercode":"99-42","member_number":"A99961","first_name":"NICK","last_name":"KINNAN","classification":"U","division":"PRODUCTION","hit_factor":3.0789},{"match_name":"Crooked Creek Pistol League - March 26-27 2016","match_date":"2016-03-26","stage_classifiercode":"99-42","member_number":"TY72951","first_name":"LEAH","last_name":"WARE","classification":"X","division":"PRODUCTION","hit_factor":3.0787},{"match_name":"Crooked Creek Pistol League - March 26-27 2016","match_date":"2016-03-26","stage_classifiercode":"99-42","member_number":"TY82348","first_name":"TERRENCE","last_name":"BURNETT","classification":"C","division":"PRODUCTION","hit_factor":3.0769},{"match_name":"BSPSC  2016 NRS Slot Match","match_date":"2016-05-08","stage_classifiercode":"99-42","member_number":"\"\"","first_name":"JACK","last_name":"DICKSON","classification":"\"\"","division":"PRODUCTION","hit_factor":3.0738},{"match_name":"Richmond Hot Shots February 5-2017 USPSA Pistol Match","match_date":"2017-02-05","stage_classifiercode":"99-42","member_number":"TY88744","first_name":"KIRK","last_name":"BOZIN","classification":"A","division":"PRODUCTION","hit_factor":3.0722},{"match_name":"Baghdad USPSA Special Classifier Lightning Interrupted 6 May 2017","match_date":"2017-05-06","stage_classifiercode":"99-42","member_number":"\"\"","first_name":"ADAM","last_name":"RUSSO","classification":"U","division":"PRODUCTION","hit_factor":3.0708},{"match_name":"FRAPC USPSA  League 4","match_date":"2018-06-05","stage_classifiercode":"99-42","member_number":"TY72545","first_name":"MARK","last_name":"MIELKE","classification":"\"\"","division":"PRODUCTION","hit_factor":3.0706},{"match_name":"Ripon USPSA 3-25-17","match_date":"2017-03-25","stage_classifiercode":"99-42","member_number":"\"\"","first_name":"BROCK","last_name":"KUBAT","classification":"U","division":"PRODUCTION","hit_factor":3.0573},{"match_name":"Crooked Creek Pistol League - April 2017","match_date":"2017-04-22","stage_classifiercode":"99-42","member_number":"A97690","first_name":"WALTER","last_name":"ZIMMER","classification":"D","division":"PRODUCTION","hit_factor":3.0554},{"match_name":"FVPS August USPSA Match","match_date":"2018-08-04","stage_classifiercode":"99-42","member_number":"A106704","first_name":"CHAD","last_name":"SINKLER","classification":"C","division":"PRODUCTION","hit_factor":3.0541},{"match_name":"MVPSA USPSA August 7th Classifier Match","match_date":"2021-08-07","stage_classifiercode":"99-42","member_number":"FY111341","first_name":"DENE","last_name":"MILLER","classification":"D","division":"PRODUCTION","hit_factor":3.0524},{"match_name":"WLPS May2017","match_date":"2017-05-28","stage_classifiercode":"99-42","member_number":"A102200","first_name":"JOHN","last_name":"MAYLAND","classification":"U","division":"PRODUCTION","hit_factor":3.0504},{"match_name":"Shasta Shooters August 2017","match_date":"2017-08-12","stage_classifiercode":"99-42","member_number":"Ty95027","first_name":"ZAC","last_name":"MCMORDIE","classification":"C","division":"PRODUCTION","hit_factor":3.0482},{"match_name":"BSPSC  2016 NRS Slot Match","match_date":"2016-05-08","stage_classifiercode":"99-42","member_number":"pending","first_name":"DAMON","last_name":"ALMOND","classification":"U","division":"PRODUCTION","hit_factor":3.0468},{"match_name":"PIPS 08-03-2016","match_date":"2016-08-03","stage_classifiercode":"99-42","member_number":"TY67266","first_name":"MARK","last_name":"SLETNER","classification":"C","division":"PRODUCTION","hit_factor":3.0435},{"match_name":"Richmond Hot Shots 2021 USPSA Special Classifier Match - Jan 24 2021","match_date":"2021-01-24","stage_classifiercode":"99-42","member_number":"FY80180","first_name":"WILLIAM","last_name":"KWOK","classification":"C","division":"PRODUCTION","hit_factor":3.0418},{"match_name":"1ra Fecha USPSA","match_date":"2016-01-10","stage_classifiercode":"99-42","member_number":"A91054","first_name":"WILBERTO","last_name":"ALAMO","classification":"U","division":"PRODUCTION","hit_factor":3.0405},{"match_name":"BSPSC  2016 NRS Slot Match","match_date":"2016-05-08","stage_classifiercode":"99-42","member_number":"None","first_name":"COLT","last_name":"HUBBS","classification":"U","division":"PRODUCTION","hit_factor":3.0362},{"match_name":"ANPRACS USPSA 7-15-18","match_date":"2018-07-15","stage_classifiercode":"99-42","member_number":"A100319","first_name":"TIM","last_name":"LEZAMA","classification":"C","division":"PRODUCTION","hit_factor":3.0353},{"match_name":"Baghdad USPSA Special Classifier Lightning Interrupted 6 May 2017","match_date":"2017-05-06","stage_classifiercode":"99-42","member_number":"A101018","first_name":"JOHNNY","last_name":"BAKER","classification":"U","division":"PRODUCTION","hit_factor":3.0341},{"match_name":"CCPL 07102016","match_date":"2016-07-10","stage_classifiercode":"99-42","member_number":"A97718","first_name":"CHRIS","last_name":"NEUWIRTH","classification":"U","division":"PRODUCTION","hit_factor":3.0256},{"match_name":"OFGC USPSA August 21 2016","match_date":"2016-08-21","stage_classifiercode":"99-42","member_number":"PENDING","first_name":"BRYAN","last_name":"BROWN","classification":"U","division":"PRODUCTION","hit_factor":3.025},{"match_name":"NVSA USPSA 1608","match_date":"2016-08-07","stage_classifiercode":"99-42","member_number":"A8928222","first_name":"REMMINGTON","last_name":"SANDLER","classification":"C","division":"PRODUCTION","hit_factor":3.0231},{"match_name":"PIPS 08-03-2016","match_date":"2016-08-03","stage_classifiercode":"99-42","member_number":"A52641","first_name":"GERALD","last_name":"JOHNSON","classification":"D","division":"PRODUCTION","hit_factor":3.0201},{"match_name":"Springfield Tactical Shooters 01-05-2017","match_date":"2017-01-05","stage_classifiercode":"99-42","member_number":"FY83614","first_name":"GARY","last_name":"GRAY","classification":"C","division":"PRODUCTION","hit_factor":3.0198},{"match_name":"OFGC USPSA August 21 2016","match_date":"2016-08-21","stage_classifiercode":"99-42","member_number":"FC5480071690","first_name":"RON","last_name":"NEWBY","classification":"U","division":"PRODUCTION","hit_factor":3.0193},{"match_name":"Pathfinder July USPSA Match","match_date":"2017-07-16","stage_classifiercode":"99-42","member_number":"L3604","first_name":"JIM","last_name":"WHEELER","classification":"B","division":"PRODUCTION","hit_factor":3.0165},{"match_name":"MCPSL Pistol 4-9-16","match_date":"2016-04-09","stage_classifiercode":"99-42","member_number":"A96139","first_name":"CHARLIE","last_name":"BALLENGER","classification":"U","division":"PRODUCTION","hit_factor":3.0155},{"match_name":"WLPS May2017","match_date":"2017-05-28","stage_classifiercode":"99-42","member_number":"\"\"","first_name":"A","last_name":"MORALES","classification":"U","division":"PRODUCTION","hit_factor":3.01},{"match_name":"Southkent USPSA MAY match","match_date":"2017-05-20","stage_classifiercode":"99-42","member_number":"\"\"","first_name":"ALEX","last_name":"AXTELL","classification":"U","division":"PRODUCTION","hit_factor":3.0083},{"match_name":"USPSA MO21 2Alpha SBRC July 25 2020","match_date":"2020-07-25","stage_classifiercode":"99-42","member_number":"A100752","first_name":"SUSAN","last_name":"MYERS","classification":"D","division":"PRODUCTION","hit_factor":3.0055},{"match_name":"CCPS March 2020 USPSA","match_date":"2020-03-01","stage_classifiercode":"99-42","member_number":"A90516","first_name":"JARED","last_name":"FOX","classification":"M","division":"PRODUCTION","hit_factor":3.0023},{"match_name":"Crooked Creek Pistol League - April 2017","match_date":"2017-04-22","stage_classifiercode":"99-42","member_number":"A102936","first_name":"BEN","last_name":"JOHNSTON","classification":"U","division":"PRODUCTION","hit_factor":3.0012},{"match_name":"EWPSA 2018-05","match_date":"2018-05-20","stage_classifiercode":"99-42","member_number":"A111030","first_name":"GRACE","last_name":"OHARA","classification":"U","division":"PRODUCTION","hit_factor":2.9851},{"match_name":"USPSA Bass River June 2017","match_date":"2017-06-04","stage_classifiercode":"99-42","member_number":"TY41128","first_name":"TOM","last_name":"WHALEN","classification":"\"\"","division":"PRODUCTION","hit_factor":2.9851},{"match_name":"DGC USPSA Classifier Match","match_date":"2017-07-30","stage_classifiercode":"99-42","member_number":"A103705","first_name":"BLAKE","last_name":"ARNOLD","classification":"U","division":"PRODUCTION","hit_factor":2.9838},{"match_name":"WLPS May2017","match_date":"2017-05-28","stage_classifiercode":"99-42","member_number":"A95875","first_name":"SEAN","last_name":"MCMANN","classification":"C","division":"PRODUCTION","hit_factor":2.9793},{"match_name":"HAS May 2016 Pistol Match","match_date":"2016-05-08","stage_classifiercode":"99-42","member_number":"A89128","first_name":"SCOTT","last_name":"LANE","classification":"X","division":"PRODUCTION","hit_factor":2.973},{"match_name":"OFGC USPSA August 21 2016","match_date":"2016-08-21","stage_classifiercode":"99-42","member_number":"A92164","first_name":"STEVE","last_name":"NOBLE","classification":"U","division":"PRODUCTION","hit_factor":2.9693},{"match_name":"Richmond Hot Shots February 5-2017 USPSA Pistol Match","match_date":"2017-02-05","stage_classifiercode":"99-42","member_number":"A91483","first_name":"MICHAEL","last_name":"NEUBAUER","classification":"D","division":"PRODUCTION","hit_factor":2.9687},{"match_name":"Shongum October 2016 USPSA Match","match_date":"2016-10-01","stage_classifiercode":"99-42","member_number":"TY-88444","first_name":"COLIN","last_name":"MCCARTHY","classification":"C","division":"PRODUCTION","hit_factor":2.9664},{"match_name":"Patriot Action Shooters 2016 Special Classifier","match_date":"2016-03-19","stage_classifiercode":"99-42","member_number":"PEN","first_name":"MATTHEW","last_name":"LEE","classification":"\"\"","division":"PRODUCTION","hit_factor":2.957},{"match_name":"CTASA 3rd Sunday USPSA - March 2018","match_date":"2018-03-18","stage_classifiercode":"99-42","member_number":"\"\"","first_name":"TOMMY","last_name":"HILL","classification":"U","division":"PRODUCTION","hit_factor":2.9506},{"match_name":"PCWC USPSA 4 22 2017","match_date":"2017-04-22","stage_classifiercode":"99-42","member_number":"A99730","first_name":"TONY","last_name":"GARDNER","classification":"D","division":"PRODUCTION","hit_factor":2.9478},{"match_name":"Crooked Creek Pistol League - April 2017","match_date":"2017-04-22","stage_classifiercode":"99-42","member_number":"A91566","first_name":"DAVID A","last_name":"TREASTER","classification":"C","division":"PRODUCTION","hit_factor":2.9464},{"match_name":"LIPSA - April 30th 2017 - USPSA Match Special Classifier","match_date":"2017-04-30","stage_classifiercode":"99-42","member_number":"A102434","first_name":"BRIAN","last_name":"OLSEN","classification":"U","division":"PRODUCTION","hit_factor":2.9352},{"match_name":"HAS May 2016 Pistol Match","match_date":"2016-05-08","stage_classifiercode":"99-42","member_number":"A83029","first_name":"FRANK","last_name":"LILLEY","classification":"D","division":"PRODUCTION","hit_factor":2.9345},{"match_name":"LIPSA - April 30th 2017 - USPSA Match Special Classifier","match_date":"2017-04-30","stage_classifiercode":"99-42","member_number":"A96417","first_name":"STEVEN","last_name":"BURG","classification":"U","division":"PRODUCTION","hit_factor":2.9318},{"match_name":"Maine Practical Shooters May 2021","match_date":"2021-05-08","stage_classifiercode":"99-42","member_number":"A124495","first_name":"LINDA","last_name":"POOL","classification":"D","division":"PRODUCTION","hit_factor":2.912},{"match_name":"Baghdad USPSA Special Classifier Lightning Interrupted 6 May 2017","match_date":"2017-05-06","stage_classifiercode":"99-42","member_number":"\"\"","first_name":"KRISTIN","last_name":"MAGUIRE","classification":"U","division":"PRODUCTION","hit_factor":2.9115},{"match_name":"Briar Rabbit August Match 2016","match_date":"2016-08-28","stage_classifiercode":"99-42","member_number":"A97350","first_name":"HOWARD","last_name":"WILLIAMS","classification":"B","division":"PRODUCTION","hit_factor":2.8986},{"match_name":"Springfield Tactical Shooters 01/04/2018","match_date":"2018-01-04","stage_classifiercode":"99-42","member_number":"A63433","first_name":"ROB","last_name":"LEWIS","classification":"\"\"","division":"PRODUCTION","hit_factor":2.8975},{"match_name":"TPS USPSA at CMP Dec 19 2020 Special Classifier Match","match_date":"2020-12-19","stage_classifiercode":"99-42","member_number":"A130714","first_name":"RODNEY","last_name":"HAWKINS","classification":"U","division":"PRODUCTION","hit_factor":2.8857},{"match_name":"HAS May 2016 Pistol Match","match_date":"2016-05-08","stage_classifiercode":"99-42","member_number":"\"\"","first_name":"AJ","last_name":"SALANI","classification":"X","division":"PRODUCTION","hit_factor":2.8854},{"match_name":"LGCSEMPS 2017 SPECIAL CLASSIFIER","match_date":"2017-04-09","stage_classifiercode":"99-42","member_number":"\"\"","first_name":"MAT","last_name":"KRISTUFEC","classification":"U","division":"PRODUCTION","hit_factor":2.8831},{"match_name":"Richmond Borough Gun ClubJuly 1st 2017 USPSA Pistol Match","match_date":"2017-07-01","stage_classifiercode":"99-42","member_number":"\"\"","first_name":"VLAD","last_name":"ARAKCHEYEV","classification":"U","division":"PRODUCTION","hit_factor":2.8826},{"match_name":"HPS March Pistol Funshoot","match_date":"2017-03-18","stage_classifiercode":"99-42","member_number":"L2787","first_name":"JESSIE","last_name":"FLORES","classification":"B","division":"PRODUCTION","hit_factor":2.8642},{"match_name":"PIPS 08-03-2016","match_date":"2016-08-03","stage_classifiercode":"99-42","member_number":"A74052","first_name":"TED","last_name":"ZWIEG","classification":"D","division":"PRODUCTION","hit_factor":2.8623},{"match_name":"Atlanta Practical Shooters March 2016 USPSA - Classifier Match","match_date":"2016-03-06","stage_classifiercode":"99-42","member_number":"A80656","first_name":"ANDREAS","last_name":"YANKOPOLUS","classification":"M","division":"PRODUCTION","hit_factor":2.8612},{"match_name":"PCWC USPSA 4 22 2017","match_date":"2017-04-22","stage_classifiercode":"99-42","member_number":"a102619","first_name":"BRETT","last_name":"FERRIS","classification":"U","division":"PRODUCTION","hit_factor":2.8483},{"match_name":"PSAC_20170923","match_date":"2017-09-23","stage_classifiercode":"99-42","member_number":"L3719","first_name":"MATTHEW","last_name":"HESS","classification":"A","division":"PRODUCTION","hit_factor":2.8483},{"match_name":"LIPSA - April 30th 2017 - USPSA Match Special Classifier","match_date":"2017-04-30","stage_classifiercode":"99-42","member_number":"A100261","first_name":"LENIN","last_name":"ANDRADE","classification":"C","division":"PRODUCTION","hit_factor":2.8402},{"match_name":"FBURG April 2017 Level I USPSA ","match_date":"2017-04-01","stage_classifiercode":"99-42","member_number":"A99148","first_name":"NOUREEN","last_name":"CLEMENTS","classification":"U","division":"PRODUCTION","hit_factor":2.8387},{"match_name":"MCPSL Pistol 4-9-16","match_date":"2016-04-09","stage_classifiercode":"99-42","member_number":"A94862","first_name":"TROY","last_name":"CHAMBERLAIN","classification":"U","division":"PRODUCTION","hit_factor":2.8319},{"match_name":"Springfield Tactical Shooters 01/04/2018","match_date":"2018-01-04","stage_classifiercode":"99-42","member_number":"A99127","first_name":"STEVE","last_name":"FRAZIER","classification":"C","division":"PRODUCTION","hit_factor":2.8317},{"match_name":"5 Dogs July USPSA","match_date":"2016-07-03","stage_classifiercode":"99-42","member_number":"PEN","first_name":"STUART","last_name":"GORDON","classification":"U","division":"PRODUCTION","hit_factor":2.8302},{"match_name":"Holmen USPSA 10/30/16","match_date":"2016-10-30","stage_classifiercode":"99-42","member_number":"A99259","first_name":"VINCENT","last_name":"NORRIS","classification":"U","division":"PRODUCTION","hit_factor":2.8249},{"match_name":"Southkent USPSA MAY match","match_date":"2017-05-20","stage_classifiercode":"99-42","member_number":"\"\"","first_name":"JANE","last_name":"MCCULLOUGH","classification":"U","division":"PRODUCTION","hit_factor":2.82},{"match_name":"SAPSA April 2016","match_date":"2016-04-16","stage_classifiercode":"99-42","member_number":"A84977","first_name":"GARY","last_name":"SWANSON","classification":"C","division":"PRODUCTION","hit_factor":2.8169},{"match_name":"SLPSA  USPSA","match_date":"2016-09-17","stage_classifiercode":"99-42","member_number":"A96258","first_name":"ELVIS","last_name":"CERNJUL","classification":"D","division":"PRODUCTION","hit_factor":2.8121},{"match_name":"WPS USPSA Monthly Match November 2016","match_date":"2016-11-05","stage_classifiercode":"99-42","member_number":"PEN","first_name":"TONY","last_name":"FERRI","classification":"U","division":"PRODUCTION","hit_factor":2.8115},{"match_name":"CCPL 07102016","match_date":"2016-07-10","stage_classifiercode":"99-42","member_number":"\"\"","first_name":"JASON","last_name":"LAWTON","classification":"U","division":"PRODUCTION","hit_factor":2.8115},{"match_name":"Southkent USPSA MAY match","match_date":"2017-05-20","stage_classifiercode":"99-42","member_number":"A102745","first_name":"CALEB","last_name":"BELTZ","classification":"U","division":"PRODUCTION","hit_factor":2.8101},{"match_name":"Crooked Creek Pistol League - April 2017","match_date":"2017-04-22","stage_classifiercode":"99-42","member_number":"A102936","first_name":"BEN","last_name":"JOHNSTON","classification":"U","division":"PRODUCTION","hit_factor":2.8087},{"match_name":"BSPSC  2016 NRS Slot Match","match_date":"2016-05-08","stage_classifiercode":"99-42","member_number":"\"\"","first_name":"JOHN","last_name":"GRAIG","classification":"\"\"","division":"PRODUCTION","hit_factor":2.807},{"match_name":"MCPSL Pistol 4-9-16","match_date":"2016-04-09","stage_classifiercode":"99-42","member_number":"PEN","first_name":"PATRICK","last_name":"MCGUIRE","classification":"U","division":"PRODUCTION","hit_factor":2.806},{"match_name":"Crooked Creek Pistol League - March 26-27 2016","match_date":"2016-03-26","stage_classifiercode":"99-42","member_number":"\"\"","first_name":"RICH","last_name":"MANSFIELD","classification":"X","division":"PRODUCTION","hit_factor":2.7998},{"match_name":"Cactus USPSA ALL CLASSIFIER September 2020","match_date":"2020-09-06","stage_classifiercode":"99-42","member_number":"A21152","first_name":"BRIAN","last_name":"MUEGGE","classification":"A","division":"PRODUCTION","hit_factor":2.7988},{"match_name":"Richmond Boro Gun Club March 2020 USPSA Match","match_date":"2020-03-14","stage_classifiercode":"99-42","member_number":"A117388","first_name":"GERALD","last_name":"SARMIENTO","classification":"C","division":"PRODUCTION","hit_factor":2.7848},{"match_name":"Hose Monster fun ","match_date":"2021-11-07","stage_classifiercode":"99-42","member_number":"A136110","first_name":"PAUL","last_name":"PIERCE","classification":"U","division":"PRODUCTION","hit_factor":2.7778},{"match_name":"Richmond Hot Shots 2021 USPSA Special Classifier Match - Jan 24 2021","match_date":"2021-01-24","stage_classifiercode":"99-42","member_number":"A131955","first_name":"PUCK","last_name":"ANANTA","classification":"U","division":"PRODUCTION","hit_factor":2.7763},{"match_name":"LNDL June 3rd 2018","match_date":"2018-06-03","stage_classifiercode":"99-42","member_number":"TY78653","first_name":"EDDIE","last_name":"SOSAYA","classification":"D","division":"PRODUCTION","hit_factor":2.7628},{"match_name":"USPSA Bass River June 2017","match_date":"2017-06-04","stage_classifiercode":"99-42","member_number":"PENDING","first_name":"BRAD","last_name":"BOUCHARD","classification":"\"\"","division":"PRODUCTION","hit_factor":2.7586},{"match_name":"CFRPC USPSA 2017 JUNE","match_date":"2017-06-18","stage_classifiercode":"99-42","member_number":"TY88426","first_name":"FRANCISCO","last_name":"ROMERO","classification":"B","division":"PRODUCTION","hit_factor":2.7556},{"match_name":"Eagles Nest July 17th","match_date":"2016-07-17","stage_classifiercode":"99-42","member_number":"TY81624","first_name":"JON","last_name":"TWOREK","classification":"C","division":"PRODUCTION","hit_factor":2.7514},{"match_name":"Richmond Borough Gun ClubJuly 1st 2017 USPSA Pistol Match","match_date":"2017-07-01","stage_classifiercode":"99-42","member_number":"A92054","first_name":"GREGORY","last_name":"FELICETTI","classification":"U","division":"PRODUCTION","hit_factor":2.7426},{"match_name":"SPSA USPSA February 4th Sat match","match_date":"2018-02-24","stage_classifiercode":"99-42","member_number":"A98983","first_name":"JAMES","last_name":"POOLE","classification":"C","division":"PRODUCTION","hit_factor":2.7169},{"match_name":"Brothers N Arms August 2017 USPSA Match","match_date":"2017-08-19","stage_classifiercode":"99-42","member_number":"A105176","first_name":"JOSEPH","last_name":"BUEHLMAN","classification":"U","division":"PRODUCTION","hit_factor":2.7132},{"match_name":"Minnetonka Game And Fish May 3","match_date":"2017-05-03","stage_classifiercode":"99-42","member_number":"\"\"","first_name":"SHELBY","last_name":"ROERING","classification":"U","division":"PRODUCTION","hit_factor":2.7111},{"match_name":"Atlanta Practical Shooters March 2016 USPSA - Classifier Match","match_date":"2016-03-06","stage_classifiercode":"99-42","member_number":"A91528","first_name":"ALEX","last_name":"MERRILL","classification":"D","division":"PRODUCTION","hit_factor":2.7069},{"match_name":"WPS USPSA Monthly Match November 2016","match_date":"2016-11-05","stage_classifiercode":"99-42","member_number":"A61611","first_name":"TONY","last_name":"DORANGRICHIA","classification":"D","division":"PRODUCTION","hit_factor":2.7046},{"match_name":"NVSA USPSA 1608","match_date":"2016-08-07","stage_classifiercode":"99-42","member_number":"A94780","first_name":"DRAGOS","last_name":"COJOCARU","classification":"D","division":"PRODUCTION","hit_factor":2.7027},{"match_name":"AIPS  USPSA Weekly 22 August 2017","match_date":"2017-08-22","stage_classifiercode":"99-42","member_number":"PEN","first_name":"CODY","last_name":"RUSSELL","classification":"Unclassified","division":"PRODUCTION","hit_factor":2.6958},{"match_name":"PASA USPSA 3-18-18","match_date":"2018-03-18","stage_classifiercode":"99-42","member_number":"A103198","first_name":"TAYLOR","last_name":"DANIELS","classification":"D","division":"PRODUCTION","hit_factor":2.6936},{"match_name":"Atlanta Practical Shooters March 2016 USPSA - Classifier Match","match_date":"2016-03-06","stage_classifiercode":"99-42","member_number":"TY88016","first_name":"MICHAEL","last_name":"MOORE","classification":"D","division":"PRODUCTION","hit_factor":2.6932},{"match_name":"PASA USPSA 3-18-18","match_date":"2018-03-18","stage_classifiercode":"99-42","member_number":"A90025","first_name":"JACQUELINE","last_name":"SUBLETTE","classification":"D","division":"PRODUCTION","hit_factor":2.6763},{"match_name":"BSPSC  2016 NRS Slot Match","match_date":"2016-05-08","stage_classifiercode":"99-42","member_number":"A82739","first_name":"RANDY","last_name":"HUTCHESON","classification":"C","division":"PRODUCTION","hit_factor":2.6756},{"match_name":"Green Valley October 2016 USPSA","match_date":"2016-10-21","stage_classifiercode":"99-42","member_number":"A87806","first_name":"JIM","last_name":"SUBLETT","classification":"C","division":"PRODUCTION","hit_factor":2.6712},{"match_name":"HPS March Pistol Funshoot","match_date":"2017-03-18","stage_classifiercode":"99-42","member_number":"A94855","first_name":"LIANN","last_name":"CAGLE","classification":"U","division":"PRODUCTION","hit_factor":2.6701},{"match_name":"MVPJan2017","match_date":"2017-01-07","stage_classifiercode":"99-42","member_number":"\"\"","first_name":"JAMES","last_name":"HERBERT","classification":"U","division":"PRODUCTION","hit_factor":2.6681},{"match_name":"Richmond Hot Shots February 5-2017 USPSA Pistol Match","match_date":"2017-02-05","stage_classifiercode":"99-42","member_number":"TY96290","first_name":"DOYLE","last_name":"SLAPE","classification":"D","division":"PRODUCTION","hit_factor":2.6656},{"match_name":"Enps May 2021 USPSA MATCH-All Classifier","match_date":"2021-05-02","stage_classifiercode":"99-42","member_number":"A132730","first_name":"ZACH","last_name":"COOK","classification":"U","division":"PRODUCTION","hit_factor":2.6622},{"match_name":"MCTS USPSA 10-08-2016","match_date":"2016-10-08","stage_classifiercode":"99-42","member_number":"\"\"","first_name":"AUSTIN","last_name":"MARIETTA","classification":"X","division":"PRODUCTION","hit_factor":2.6578},{"match_name":"SAPSA April 2016","match_date":"2016-04-16","stage_classifiercode":"99-42","member_number":"TY68888","first_name":"TOM","last_name":"POWELL","classification":"D","division":"PRODUCTION","hit_factor":2.6574},{"match_name":"SAPSA April 2016","match_date":"2016-04-16","stage_classifiercode":"99-42","member_number":"A93842","first_name":"HOWARD","last_name":"FEINGOLD","classification":"U","division":"PRODUCTION","hit_factor":2.6549},{"match_name":"BSPSC  2016 NRS Slot Match","match_date":"2016-05-08","stage_classifiercode":"99-42","member_number":"\"\"","first_name":"KYLE","last_name":"BERTELSEN","classification":"\"\"","division":"PRODUCTION","hit_factor":2.6495},{"match_name":"NCPS USPSA Handgun Match January 28 2018a","match_date":"2018-01-28","stage_classifiercode":"99-42","member_number":"A88174","first_name":"DYLAN","last_name":"DIPIETRO","classification":"C","division":"PRODUCTION","hit_factor":2.6475},{"match_name":"Springfield Tactical Shooters 01/04/2018","match_date":"2018-01-04","stage_classifiercode":"99-42","member_number":"TY90402","first_name":"DWAIN","last_name":"HILL","classification":"\"\"","division":"PRODUCTION","hit_factor":2.6432},{"match_name":"SFA July 2016 CLASSIFIED","match_date":"2016-07-16","stage_classifiercode":"99-42","member_number":"TY85029","first_name":"BRAD","last_name":"STOCKING","classification":"C","division":"PRODUCTION","hit_factor":2.6415},{"match_name":"Trigger Guard USPSA","match_date":"2016-04-02","stage_classifiercode":"99-42","member_number":"A89295","first_name":"CHASE","last_name":"FARKAS","classification":"U","division":"PRODUCTION","hit_factor":2.6346},{"match_name":"PIPS 08-03-2016","match_date":"2016-08-03","stage_classifiercode":"99-42","member_number":"A97791","first_name":"JEFF","last_name":"CANAKES","classification":"U","division":"PRODUCTION","hit_factor":2.6316},{"match_name":"Shasta Shooters March 2017","match_date":"2017-03-11","stage_classifiercode":"99-42","member_number":"A88368","first_name":"TOM","last_name":"FULLER","classification":"C","division":"PRODUCTION","hit_factor":2.6292},{"match_name":"3ra Fecha USPSA","match_date":"2018-03-24","stage_classifiercode":"99-42","member_number":"\"\"","first_name":"ORLANDO A.","last_name":"RAMIREZ-RODRIGUEZ","classification":"U","division":"PRODUCTION","hit_factor":2.6266},{"match_name":"WPS USPSA Monthly Match November 2016","match_date":"2016-11-05","stage_classifiercode":"99-42","member_number":"TY76494","first_name":"GAIL","last_name":"VENEZIO","classification":"D","division":"PRODUCTION","hit_factor":2.623},{"match_name":"Richmond Hot Shots February 5-2017 USPSA Pistol Match","match_date":"2017-02-05","stage_classifiercode":"99-42","member_number":"TY87259","first_name":"YEE-MIN","last_name":"LIN","classification":"B","division":"PRODUCTION","hit_factor":2.6096},{"match_name":"RBGC 2017-08-26","match_date":"2017-08-26","stage_classifiercode":"99-42","member_number":"A59667","first_name":"BENNI","last_name":"JONSSON","classification":"C","division":"PRODUCTION","hit_factor":2.6059},{"match_name":"Richmond Borough Gun ClubJuly 1st 2017 USPSA Pistol Match","match_date":"2017-07-01","stage_classifiercode":"99-42","member_number":"A102656","first_name":"JAMES","last_name":"PONA","classification":"U","division":"PRODUCTION","hit_factor":2.595},{"match_name":"RBGC 2017-08-26","match_date":"2017-08-26","stage_classifiercode":"99-42","member_number":"\"\"","first_name":"DENISE","last_name":"THOMPSON","classification":"U","division":"PRODUCTION","hit_factor":2.5886},{"match_name":"Shasta Shooters August 2017","match_date":"2017-08-12","stage_classifiercode":"99-42","member_number":"A102631","first_name":"RICK","last_name":"FREITAS","classification":"U","division":"PRODUCTION","hit_factor":2.5876},{"match_name":"GRB USPSA FEB at CAV","match_date":"2018-02-17","stage_classifiercode":"99-42","member_number":"A99927","first_name":"JENNY","last_name":"KIM","classification":"U","division":"PRODUCTION","hit_factor":2.5853},{"match_name":"USPSA Bass River June 2017","match_date":"2017-06-04","stage_classifiercode":"99-42","member_number":"A101971","first_name":"BRANDON","last_name":"BOUCHARD","classification":"\"\"","division":"PRODUCTION","hit_factor":2.5847},{"match_name":"MCPSL Pistol 4-9-16","match_date":"2016-04-09","stage_classifiercode":"99-42","member_number":"CL164","first_name":"BOB","last_name":"RIPPY","classification":"C","division":"PRODUCTION","hit_factor":2.5838},{"match_name":"RBGC 2017-08-26","match_date":"2017-08-26","stage_classifiercode":"99-42","member_number":"A88177","first_name":"CHRIS","last_name":"SMITH","classification":"A","division":"PRODUCTION","hit_factor":2.5825},{"match_name":"GRB USPSA FEB at CAV","match_date":"2018-02-17","stage_classifiercode":"99-42","member_number":"A100646","first_name":"JOHN","last_name":"KOENINGER","classification":"D","division":"PRODUCTION","hit_factor":2.5701},{"match_name":"LGCSEMPS 2017 SPECIAL CLASSIFIER","match_date":"2017-04-09","stage_classifiercode":"99-42","member_number":"\"\"","first_name":"MIKE","last_name":"AGIUS","classification":"U","division":"PRODUCTION","hit_factor":2.5668},{"match_name":"CFRPC USPSA 2017 JUNE","match_date":"2017-06-18","stage_classifiercode":"99-42","member_number":"A92896","first_name":"JOHNNATTAN","last_name":"GUADAGNO","classification":"C","division":"PRODUCTION","hit_factor":2.557},{"match_name":"Crooked Creek Pistol League - March 26-27 2016","match_date":"2016-03-26","stage_classifiercode":"99-42","member_number":"\"\"","first_name":"MIKE","last_name":"SUSTIN","classification":"U","division":"PRODUCTION","hit_factor":2.557},{"match_name":"USPSA","match_date":"2016-09-25","stage_classifiercode":"99-42","member_number":"\"\"","first_name":"DAVID","last_name":"KENNEY","classification":"none","division":"PRODUCTION","hit_factor":2.5457},{"match_name":"Crooked Creek Pistol League - April 2017","match_date":"2017-04-22","stage_classifiercode":"99-42","member_number":"A102112","first_name":"DAMIAN","last_name":"DION","classification":"D","division":"PRODUCTION","hit_factor":2.5451},{"match_name":"Springfield Tactical Shooters 01/04/2018","match_date":"2018-01-04","stage_classifiercode":"99-42","member_number":"\"\"","first_name":"GREG","last_name":"WILSON","classification":"\"\"","division":"PRODUCTION","hit_factor":2.5424},{"match_name":"BSPSC  2016 NRS Slot Match","match_date":"2016-05-08","stage_classifiercode":"99-42","member_number":"pending","first_name":"KJ","last_name":"KAHNLE","classification":"U","division":"PRODUCTION","hit_factor":2.5329},{"match_name":"Shoot GTR Tuesday Match 09/05/2017","match_date":"2017-09-05","stage_classifiercode":"99-42","member_number":"A104272","first_name":"RICHARD","last_name":"GILL","classification":"X","division":"PRODUCTION","hit_factor":2.5328},{"match_name":"Atlanta Practical Shooters November 2016 USPSA","match_date":"2016-11-06","stage_classifiercode":"99-42","member_number":"\"\"","first_name":"JORDAN","last_name":"FLORES","classification":"U","division":"PRODUCTION","hit_factor":2.5265},{"match_name":"Shasta Shooters August 2017","match_date":"2017-08-12","stage_classifiercode":"99-42","member_number":"A97890","first_name":"SEAN","last_name":"STORY","classification":"D","division":"PRODUCTION","hit_factor":2.5239},{"match_name":"USPSA","match_date":"2016-09-25","stage_classifiercode":"99-42","member_number":"\"\"","first_name":"MIKE","last_name":"COMPTON","classification":"U","division":"PRODUCTION","hit_factor":2.5165},{"match_name":"Richmond Boro Gun Club March 2020 USPSA Match","match_date":"2020-03-14","stage_classifiercode":"99-42","member_number":"A110627","first_name":"JEFFREY","last_name":"DOLCIMASCOLO","classification":"D","division":"PRODUCTION","hit_factor":2.5128},{"match_name":"WPS USPSA Monthly Match November 2016","match_date":"2016-11-05","stage_classifiercode":"99-42","member_number":"A90670","first_name":"FRANCIS","last_name":"FORENZO","classification":"D","division":"PRODUCTION","hit_factor":2.5118},{"match_name":"Crooked Creek Pistol League - March 26-27 2016","match_date":"2016-03-26","stage_classifiercode":"99-42","member_number":"A92709","first_name":"ELIZABETH","last_name":"BOEHRINGER","classification":"D","division":"PRODUCTION","hit_factor":2.5105},{"match_name":"Wvpps May2016","match_date":"2016-05-15","stage_classifiercode":"99-42","member_number":"FY83753","first_name":"JONEL","last_name":"YAP","classification":"C","division":"PRODUCTION","hit_factor":2.4938},{"match_name":"1ra Fecha USPSA","match_date":"2016-01-10","stage_classifiercode":"99-42","member_number":"TY91989","first_name":"ALFREDO","last_name":"MELENDEZ","classification":"U","division":"PRODUCTION","hit_factor":2.4915},{"match_name":"Steel City USPSA July 2016","match_date":"2016-07-02","stage_classifiercode":"99-42","member_number":"A97647","first_name":"JAMEY","last_name":"HARRIS","classification":"U","division":"PRODUCTION","hit_factor":2.4905},{"match_name":"MCPSL Pistol 4-9-16","match_date":"2016-04-09","stage_classifiercode":"99-42","member_number":"A87187","first_name":"SHAWN","last_name":"ARMSTRONG","classification":"C","division":"PRODUCTION","hit_factor":2.4803},{"match_name":"ORSA USPSA Chuck Berry Memorial Match 15 April","match_date":"2017-04-15","stage_classifiercode":"99-42","member_number":"TY94248","first_name":"ROBERT","last_name":"THIEDA","classification":"C","division":"PRODUCTION","hit_factor":2.4798},{"match_name":"SFA July 2016 CLASSIFIED","match_date":"2016-07-16","stage_classifiercode":"99-42","member_number":"A17426","first_name":"PAUL","last_name":"TESSIER","classification":"U","division":"PRODUCTION","hit_factor":2.4788},{"match_name":"WLPS May2017","match_date":"2017-05-28","stage_classifiercode":"99-42","member_number":"TY90436","first_name":"JIM","last_name":"ALVAREZ","classification":"B","division":"PRODUCTION","hit_factor":2.4775},{"match_name":"RBGC 2017-08-26","match_date":"2017-08-26","stage_classifiercode":"99-42","member_number":"\"\"","first_name":"JASON","last_name":"KNIGHT","classification":"U","division":"PRODUCTION","hit_factor":2.4765},{"match_name":"NCPS USPSA Handgun Match January 28 2018a","match_date":"2018-01-28","stage_classifiercode":"99-42","member_number":"A90114","first_name":"SUSAN","last_name":"WILL","classification":"C","division":"PRODUCTION","hit_factor":2.4631},{"match_name":"WGC October 2018 USPSA 2","match_date":"2018-10-28","stage_classifiercode":"99-42","member_number":"FY77820","first_name":"SCOTTY","last_name":"MEADOR","classification":"U","division":"PRODUCTION","hit_factor":2.4623},{"match_name":"Minnetonka Game And Fish May 3","match_date":"2017-05-03","stage_classifiercode":"99-42","member_number":"\"\"","first_name":"JACOB","last_name":"FLIEHR","classification":"U","division":"PRODUCTION","hit_factor":2.4566},{"match_name":"SFA July 2016 CLASSIFIED","match_date":"2016-07-16","stage_classifiercode":"99-42","member_number":"\"\"","first_name":"KEVIN","last_name":"WOODS","classification":"X","division":"PRODUCTION","hit_factor":2.4534},{"match_name":"MS06 Team Magnolia USPSA October Match","match_date":"2016-10-01","stage_classifiercode":"99-42","member_number":"TY88750","first_name":"LADONNA","last_name":"NICHOLS","classification":"D","division":"PRODUCTION","hit_factor":2.4485},{"match_name":"Southkent USPSA MAY match","match_date":"2017-05-20","stage_classifiercode":"99-42","member_number":"A71514","first_name":"BOB","last_name":"HANN","classification":"D","division":"PRODUCTION","hit_factor":2.4482},{"match_name":"APSC USPSA Special Classifier 04-02-16","match_date":"2016-04-02","stage_classifiercode":"99-42","member_number":"A79268","first_name":"JACK","last_name":"REYNOLDS","classification":"D","division":"PRODUCTION","hit_factor":2.4476},{"match_name":"LPC April 2016 USPSA Match","match_date":"2016-04-03","stage_classifiercode":"99-42","member_number":"PEND","first_name":"TOM","last_name":"LEACHMAN","classification":"U","division":"PRODUCTION","hit_factor":2.4413},{"match_name":"Crooked Creek Pistol League - April 2017","match_date":"2017-04-22","stage_classifiercode":"99-42","member_number":"L4041","first_name":"LEAH","last_name":"WARE","classification":"D","division":"PRODUCTION","hit_factor":2.4403},{"match_name":"Alpha Mike June 2021  ","match_date":"2021-06-20","stage_classifiercode":"99-42","member_number":"A135021","first_name":"YIFAN","last_name":"YANG","classification":"U","division":"PRODUCTION","hit_factor":2.4403},{"match_name":"Minnetonka Game And Fish May 3","match_date":"2017-05-03","stage_classifiercode":"99-42","member_number":"\"\"","first_name":"TODD","last_name":"FITZGERALD","classification":"U","division":"PRODUCTION","hit_factor":2.4346},{"match_name":"Richmond Hot Shots 2021 USPSA Special Classifier Match - Jan 24 2021","match_date":"2021-01-24","stage_classifiercode":"99-42","member_number":"000","first_name":"STEVE","last_name":"GIROLAMI","classification":"U","division":"PRODUCTION","hit_factor":2.4295},{"match_name":"Richmond Borough Gun ClubJuly 1st 2017 USPSA Pistol Match","match_date":"2017-07-01","stage_classifiercode":"99-42","member_number":"1718","first_name":"JON-VINCENT","last_name":"TESTACCIO","classification":"C","division":"PRODUCTION","hit_factor":2.4249},{"match_name":"WPS USPSA Special Classifier October 2017","match_date":"2017-10-28","stage_classifiercode":"99-42","member_number":"TY76494","first_name":"GAIL","last_name":"VENEZIO","classification":"D","division":"PRODUCTION","hit_factor":2.4108},{"match_name":"DGC USPSA Classifier Match","match_date":"2017-07-30","stage_classifiercode":"99-42","member_number":"A99941","first_name":"LEONARD","last_name":"ZEILER","classification":"U","division":"PRODUCTION","hit_factor":2.4022},{"match_name":"Shasta Shooters August 2017","match_date":"2017-08-12","stage_classifiercode":"99-42","member_number":"PEN","first_name":"DON","last_name":"BURNS","classification":"U","division":"PRODUCTION","hit_factor":2.3956},{"match_name":"EAGC July 2016 USPSA Pistol Match","match_date":"2016-07-17","stage_classifiercode":"99-42","member_number":"\"\"","first_name":"JOHN","last_name":"PERRY","classification":"U","division":"PRODUCTION","hit_factor":2.3952},{"match_name":"CCPL 03-08-2020","match_date":"2020-03-08","stage_classifiercode":"99-42","member_number":"A126473","first_name":"DENISE","last_name":"SPILLMAN","classification":"U","division":"PRODUCTION","hit_factor":2.3831},{"match_name":"Crooked Creek Pistol League - April 2017","match_date":"2017-04-22","stage_classifiercode":"99-42","member_number":"A95977","first_name":"NATE","last_name":"FELDKAMP","classification":"D","division":"PRODUCTION","hit_factor":2.3767},{"match_name":"PIPS 08-03-2016","match_date":"2016-08-03","stage_classifiercode":"99-42","member_number":"PEN","first_name":"SCOTT","last_name":"RADDATZ","classification":"U","division":"PRODUCTION","hit_factor":2.3713},{"match_name":"USPSA Bass River June 2017","match_date":"2017-06-04","stage_classifiercode":"99-42","member_number":"\"\"","first_name":"KATHY","last_name":"MARTIN","classification":"\"\"","division":"PRODUCTION","hit_factor":2.3663},{"match_name":"USPSA","match_date":"2016-09-25","stage_classifiercode":"99-42","member_number":"\"\"","first_name":"JENNIFER","last_name":"HOLMES","classification":"none","division":"PRODUCTION","hit_factor":2.3622},{"match_name":"Steel City USPSA July 2016","match_date":"2016-07-02","stage_classifiercode":"99-42","member_number":"PEN","first_name":"JAY","last_name":"RICHARDSON","classification":"U","division":"PRODUCTION","hit_factor":2.3504},{"match_name":"APSC USPSA Special Classifier 04-02-16","match_date":"2016-04-02","stage_classifiercode":"99-42","member_number":"\"\"","first_name":"JAMES","last_name":"LYLES","classification":"U","division":"PRODUCTION","hit_factor":2.3381},{"match_name":"LGCSEMPS 2017 SPECIAL CLASSIFIER","match_date":"2017-04-09","stage_classifiercode":"99-42","member_number":"A98811","first_name":"ARUEL","last_name":"TANGUILIG","classification":"U","division":"PRODUCTION","hit_factor":2.3324},{"match_name":"USPSA MO21 2Alpha SBRC July 25 2020","match_date":"2020-07-25","stage_classifiercode":"99-42","member_number":"A113404","first_name":"BRIAN","last_name":"STANEK","classification":"C","division":"PRODUCTION","hit_factor":2.3144},{"match_name":"WPS USPSA Special Classifier October 2017","match_date":"2017-10-28","stage_classifiercode":"99-42","member_number":"A98865","first_name":"RANDY","last_name":"SWART","classification":"D","division":"PRODUCTION","hit_factor":2.2966},{"match_name":"Baghdad USPSA Special Classifier Lightning Interrupted 6 May 2017","match_date":"2017-05-06","stage_classifiercode":"99-42","member_number":"\"\"","first_name":"HALEY","last_name":"COTTRELL","classification":"U","division":"PRODUCTION","hit_factor":2.2953},{"match_name":"WPS USPSA Monthly Match November 2016","match_date":"2016-11-05","stage_classifiercode":"99-42","member_number":"A64814","first_name":"DAVID","last_name":"GREENE","classification":"D","division":"PRODUCTION","hit_factor":2.2936},{"match_name":"PCWC USPSA 4 22 2017","match_date":"2017-04-22","stage_classifiercode":"99-42","member_number":"A78414","first_name":"TYLER","last_name":"ATWOOD","classification":"C","division":"PRODUCTION","hit_factor":2.279},{"match_name":"Enps May 2021 USPSA MATCH-All Classifier","match_date":"2021-05-02","stage_classifiercode":"99-42","member_number":"TY95959","first_name":"ROD","last_name":"STUART","classification":"C","division":"PRODUCTION","hit_factor":2.2757},{"match_name":"Richmond Boro Gun Club March 2020 USPSA Match","match_date":"2020-03-14","stage_classifiercode":"99-42","member_number":"A115776","first_name":"ANTHONY","last_name":"LIMONE","classification":"D","division":"PRODUCTION","hit_factor":2.2698},{"match_name":"WPS USPSA Monthly Match November 2016","match_date":"2016-11-05","stage_classifiercode":"99-42","member_number":"PEN","first_name":"KRIS","last_name":"REED","classification":"U","division":"PRODUCTION","hit_factor":2.268},{"match_name":"Crooked Creek Pistol League - April 2017","match_date":"2017-04-22","stage_classifiercode":"99-42","member_number":"A58843","first_name":"KEN","last_name":"WEZEY","classification":"C","division":"PRODUCTION","hit_factor":2.2645},{"match_name":"Springfield Tactical Shooters 01-05-2017","match_date":"2017-01-05","stage_classifiercode":"99-42","member_number":"\"\"","first_name":"KENNY","last_name":"ROWE","classification":"\"\"","division":"PRODUCTION","hit_factor":2.2523},{"match_name":"PSAC_20170923","match_date":"2017-09-23","stage_classifiercode":"99-42","member_number":"A104392","first_name":"JENNIFER","last_name":"SCRANTON","classification":"U","division":"PRODUCTION","hit_factor":2.2515},{"match_name":"CCPL 07102016","match_date":"2016-07-10","stage_classifiercode":"99-42","member_number":"\"\"","first_name":"JEFFREY","last_name":"LUM","classification":"U","division":"PRODUCTION","hit_factor":2.2493},{"match_name":"SFA July 2016 CLASSIFIED","match_date":"2016-07-16","stage_classifiercode":"99-42","member_number":"A91924","first_name":"THERESA","last_name":"SKINNER","classification":"D","division":"PRODUCTION","hit_factor":2.2445},{"match_name":"MCPSL Pistol 4-9-16","match_date":"2016-04-09","stage_classifiercode":"99-42","member_number":"PEN","first_name":"AUSTIN","last_name":"ANDREWS","classification":"U","division":"PRODUCTION","hit_factor":2.2406},{"match_name":"WPS USPSA Special Classifier October 2017","match_date":"2017-10-28","stage_classifiercode":"99-42","member_number":"A101477","first_name":"WALT","last_name":"BOICE","classification":"U","division":"PRODUCTION","hit_factor":2.2399},{"match_name":"Atlanta Practical Shooters March 2016 USPSA - Classifier Match","match_date":"2016-03-06","stage_classifiercode":"99-42","member_number":"A88371","first_name":"SETH","last_name":"GORDON","classification":"D","division":"PRODUCTION","hit_factor":2.2384},{"match_name":"Eagles Nest July 17th","match_date":"2016-07-17","stage_classifiercode":"99-42","member_number":"PEN","first_name":"CHRISTIAN","last_name":"HANES","classification":"U","division":"PRODUCTION","hit_factor":2.2366},{"match_name":"GRB Jan USPSA @Cav","match_date":"2016-01-16","stage_classifiercode":"99-42","member_number":"A84515","first_name":"MAC","last_name":"TYREE","classification":"D","division":"PRODUCTION","hit_factor":2.2312},{"match_name":"Shoot GTR USPSA 11/22","match_date":"2016-11-22","stage_classifiercode":"99-42","member_number":"A48535","first_name":"P.G.","last_name":"GAUVIN","classification":"\"\"","division":"PRODUCTION","hit_factor":2.2202},{"match_name":"WLPS May2017","match_date":"2017-05-28","stage_classifiercode":"99-42","member_number":"NONE","first_name":"LEO","last_name":"BERTLING","classification":"U","division":"PRODUCTION","hit_factor":2.2194},{"match_name":"SFA July 2016 CLASSIFIED","match_date":"2016-07-16","stage_classifiercode":"99-42","member_number":"A95121","first_name":"WENDY","last_name":"DURAS","classification":"U","division":"PRODUCTION","hit_factor":2.2169},{"match_name":"GRB USPSA FEB at CAV","match_date":"2018-02-17","stage_classifiercode":"99-42","member_number":"A108540","first_name":"JACOB","last_name":"JACKSON","classification":"U","division":"PRODUCTION","hit_factor":2.2122},{"match_name":"WPS USPSA Monthly Match November 2016","match_date":"2016-11-05","stage_classifiercode":"99-42","member_number":"PEN","first_name":"CHRIS","last_name":"SWANSON","classification":"U","division":"PRODUCTION","hit_factor":2.2099},{"match_name":"LIPSA - April 30th 2017 - USPSA Match Special Classifier","match_date":"2017-04-30","stage_classifiercode":"99-42","member_number":"A94344","first_name":"FRANK","last_name":"HORAN","classification":"C","division":"PRODUCTION","hit_factor":2.2047},{"match_name":"Brothers N Arms August 2017 USPSA Match","match_date":"2017-08-19","stage_classifiercode":"99-42","member_number":"A96459","first_name":"KRISTI","last_name":"KNIGHT","classification":"U","division":"PRODUCTION","hit_factor":2.2029},{"match_name":"PASA USPSA 3-18-18","match_date":"2018-03-18","stage_classifiercode":"99-42","member_number":"TY77762","first_name":"RICK","last_name":"SUBLETTE","classification":"D","division":"PRODUCTION","hit_factor":2.1908},{"match_name":"BSPSC  2016 NRS Slot Match","match_date":"2016-05-08","stage_classifiercode":"99-42","member_number":"None","first_name":"RAMON","last_name":"MERCADO","classification":"U","division":"PRODUCTION","hit_factor":2.1807},{"match_name":"Enps May 2021 USPSA MATCH-All Classifier","match_date":"2021-05-02","stage_classifiercode":"99-42","member_number":"A101977","first_name":"ASHER","last_name":"LANGTON","classification":"B","division":"PRODUCTION","hit_factor":2.1668},{"match_name":"Crooked Creek Pistol League - April 2017","match_date":"2017-04-22","stage_classifiercode":"99-42","member_number":"A75791","first_name":"DAVID","last_name":"GALE","classification":"U","division":"PRODUCTION","hit_factor":2.1658},{"match_name":"WPS USPSA Monthly Match November 2016","match_date":"2016-11-05","stage_classifiercode":"99-42","member_number":"A98865","first_name":"RANDY","last_name":"SWART","classification":"U","division":"PRODUCTION","hit_factor":2.1525},{"match_name":"HPS March Pistol Funshoot","match_date":"2017-03-18","stage_classifiercode":"99-42","member_number":"A91279","first_name":"TRACY","last_name":"KAU","classification":"U","division":"PRODUCTION","hit_factor":2.1515},{"match_name":"1ra Fecha USPSA","match_date":"2016-01-10","stage_classifiercode":"99-42","member_number":"\"\"","first_name":"LUIS","last_name":"RODRIGUEZ","classification":"U","division":"PRODUCTION","hit_factor":2.1467},{"match_name":"Crooked Creek Pistol League - April 2017","match_date":"2017-04-22","stage_classifiercode":"99-42","member_number":"A93212","first_name":"DAVID","last_name":"GILLES","classification":"C","division":"PRODUCTION","hit_factor":2.1429},{"match_name":"USPSA MO21 2Alpha SBRC July 25 2020","match_date":"2020-07-25","stage_classifiercode":"99-42","member_number":"A126957","first_name":"JOSHUA","last_name":"WILSON","classification":"D","division":"PRODUCTION","hit_factor":2.1412},{"match_name":"MCPSL Pistol 4-9-16","match_date":"2016-04-09","stage_classifiercode":"99-42","member_number":"PEN","first_name":"ISAAC","last_name":"KEELER","classification":"U","division":"PRODUCTION","hit_factor":2.1341},{"match_name":"LIPSA - April 30th 2017 - USPSA Match Special Classifier","match_date":"2017-04-30","stage_classifiercode":"99-42","member_number":"A95989","first_name":"BO","last_name":"ZHANG","classification":"D","division":"PRODUCTION","hit_factor":2.1302},{"match_name":"OFGC Practical Pistol Match 8-16-20","match_date":"2020-08-16","stage_classifiercode":"99-42","member_number":"A92166","first_name":"WILLIAM","last_name":"MORTON","classification":"B","division":"PRODUCTION","hit_factor":2.1277},{"match_name":"Springfield Tactical Shooters 01/04/2018","match_date":"2018-01-04","stage_classifiercode":"99-42","member_number":"\"\"","first_name":"GREG","last_name":"WILSON","classification":"\"\"","division":"PRODUCTION","hit_factor":2.1267},{"match_name":"Southkent USPSA MAY match","match_date":"2017-05-20","stage_classifiercode":"99-42","member_number":"A101770","first_name":"GARRY","last_name":"BRAND","classification":"U","division":"PRODUCTION","hit_factor":2.1236},{"match_name":"Shongum October 2016 USPSA Match","match_date":"2016-10-01","stage_classifiercode":"99-42","member_number":"A98580","first_name":"JASON","last_name":"SENDELSKY","classification":"U","division":"PRODUCTION","hit_factor":2.1212},{"match_name":"PIPS 08-03-2016","match_date":"2016-08-03","stage_classifiercode":"99-42","member_number":"PEN","first_name":"KARL","last_name":"STORTZ","classification":"U","division":"PRODUCTION","hit_factor":2.1133},{"match_name":"2018-05-20 Practical at Phoenix Rod and Gun Club","match_date":"2018-05-20","stage_classifiercode":"99-42","member_number":"A108057","first_name":"KAYLA","last_name":"MORRISON","classification":"U","division":"PRODUCTION","hit_factor":2.1097},{"match_name":"Shasta Shooters March 2017","match_date":"2017-03-11","stage_classifiercode":"99-42","member_number":"\"\"","first_name":"DAVID","last_name":"SHOFFNER","classification":"U","division":"PRODUCTION","hit_factor":2.1013},{"match_name":"Hose Monster fun ","match_date":"2021-11-07","stage_classifiercode":"99-42","member_number":"TY136460","first_name":"MATT","last_name":"FELTON","classification":"U","division":"PRODUCTION","hit_factor":2.0974},{"match_name":"WPS USPSA Monthly Match November 2016","match_date":"2016-11-05","stage_classifiercode":"99-42","member_number":"TY53479","first_name":"KIMBERLY","last_name":"BUCKLAND","classification":"U","division":"PRODUCTION","hit_factor":2.091},{"match_name":"Crooked Creek Pistol League - March 26-27 2016","match_date":"2016-03-26","stage_classifiercode":"99-42","member_number":"\"\"","first_name":"LOGAN","last_name":"GILLES","classification":"U","division":"PRODUCTION","hit_factor":2.09},{"match_name":"CCPL 07102016","match_date":"2016-07-10","stage_classifiercode":"99-42","member_number":"A92260","first_name":"LAURI","last_name":"VAUGHN","classification":"D","division":"PRODUCTION","hit_factor":2.0803},{"match_name":"USPSA Bass River June 2017","match_date":"2017-06-04","stage_classifiercode":"99-42","member_number":"TY84608","first_name":"GORDON","last_name":"FRASER","classification":"\"\"","division":"PRODUCTION","hit_factor":2.0801},{"match_name":"Richmond Borough Gun ClubJuly 1st 2017 USPSA Pistol Match","match_date":"2017-07-01","stage_classifiercode":"99-42","member_number":"\"\"","first_name":"MARC","last_name":"TASMAN","classification":"U","division":"PRODUCTION","hit_factor":2.0735},{"match_name":"NOCPC June 2018","match_date":"2018-06-10","stage_classifiercode":"99-42","member_number":"L4235","first_name":"BRIAN","last_name":"BAUMGARTNER","classification":"C","division":"PRODUCTION","hit_factor":2.0595},{"match_name":"HAS May 2016 Pistol Match","match_date":"2016-05-08","stage_classifiercode":"99-42","member_number":"\"\"","first_name":"MICHAEL","last_name":"KEBADJIAN","classification":"X","division":"PRODUCTION","hit_factor":2.0481},{"match_name":"Hampden RPC August USPSA Match","match_date":"2020-08-09","stage_classifiercode":"99-42","member_number":"TY128206","first_name":"WILLIAM","last_name":"FISHER","classification":"U","division":"PRODUCTION","hit_factor":2.0389},{"match_name":"NOCPC June 2018","match_date":"2018-06-10","stage_classifiercode":"99-42","member_number":"\"\"","first_name":"GILES","last_name":"COOPER","classification":"U","division":"PRODUCTION","hit_factor":2.0365},{"match_name":"WLPS May2017","match_date":"2017-05-28","stage_classifiercode":"99-42","member_number":"A83656","first_name":"KENNETH","last_name":"HARTMAN","classification":"U","division":"PRODUCTION","hit_factor":2.0221},{"match_name":"Springfield Tactical Shooters 01/04/2018","match_date":"2018-01-04","stage_classifiercode":"99-42","member_number":"\"\"","first_name":"MIKE","last_name":"SCHREY","classification":"\"\"","division":"PRODUCTION","hit_factor":2.0061},{"match_name":"MS06 Team Magnolia USPSA October Match","match_date":"2016-10-01","stage_classifiercode":"99-42","member_number":"A98146","first_name":"CASSEY","last_name":"BERNSTEIN","classification":"D","division":"PRODUCTION","hit_factor":2.0034},{"match_name":"LGCSEMPS 2017 SPECIAL CLASSIFIER","match_date":"2017-04-09","stage_classifiercode":"99-42","member_number":"PEN","first_name":"MIKE","last_name":"SWANSON","classification":"U","division":"PRODUCTION","hit_factor":1.9917},{"match_name":"MCPSL Pistol 4-9-16","match_date":"2016-04-09","stage_classifiercode":"99-42","member_number":"A90876","first_name":"JEFF","last_name":"BEYER","classification":"U","division":"PRODUCTION","hit_factor":1.9904},{"match_name":"Wvpps May2016","match_date":"2016-05-15","stage_classifiercode":"99-42","member_number":"A87549","first_name":"CHRIS","last_name":"SMITH","classification":"C","division":"PRODUCTION","hit_factor":1.9892},{"match_name":"ORSA USPSA Chuck Berry Memorial Match 15 April","match_date":"2017-04-15","stage_classifiercode":"99-42","member_number":"A102380","first_name":"NICK","last_name":"MILLSAPS","classification":"U","division":"PRODUCTION","hit_factor":1.9758},{"match_name":"Shasta Shooters March 2017","match_date":"2017-03-11","stage_classifiercode":"99-42","member_number":"TY95027","first_name":"ZAC","last_name":"MCMORDIE","classification":"C","division":"PRODUCTION","hit_factor":1.9755},{"match_name":"Baghdad USPSA Special Classifier Lightning Interrupted 6 May 2017","match_date":"2017-05-06","stage_classifiercode":"99-42","member_number":"\"\"","first_name":"BRADY","last_name":"PERDUE","classification":"U","division":"PRODUCTION","hit_factor":1.9665},{"match_name":"MVPJan2017","match_date":"2017-01-07","stage_classifiercode":"99-42","member_number":"\"\"","first_name":"JUAN","last_name":"CEDILLO","classification":"U","division":"PRODUCTION","hit_factor":1.9621},{"match_name":"5 Dogs July USPSA","match_date":"2016-07-03","stage_classifiercode":"99-42","member_number":"\"\"","first_name":"JOSE","last_name":"LOMELI","classification":"none","division":"PRODUCTION","hit_factor":1.9616},{"match_name":"Shongum October 2016 USPSA Match","match_date":"2016-10-01","stage_classifiercode":"99-42","member_number":"A-97053","first_name":"ADAM","last_name":"KATZ","classification":"U","division":"PRODUCTION","hit_factor":1.9589},{"match_name":"BSPSC  2016 NRS Slot Match","match_date":"2016-05-08","stage_classifiercode":"99-42","member_number":"pending","first_name":"MARCI","last_name":"ALMOND","classification":"U","division":"PRODUCTION","hit_factor":1.9558},{"match_name":"1ra Fecha USPSA","match_date":"2016-01-10","stage_classifiercode":"99-42","member_number":"\"\"","first_name":"LUIS MANUEL","last_name":"SANTIAGO BIBILONI","classification":"U","division":"PRODUCTION","hit_factor":1.9516},{"match_name":"Baghdad USPSA Special Classifier Lightning Interrupted 6 May 2017","match_date":"2017-05-06","stage_classifiercode":"99-42","member_number":"\"\"","first_name":"OLIVIA","last_name":"STONE","classification":"U","division":"PRODUCTION","hit_factor":1.9448},{"match_name":"CFRPC June USPSA","match_date":"2018-06-17","stage_classifiercode":"99-42","member_number":"A11122","first_name":"ARCHIE","last_name":"OCA","classification":"U","division":"PRODUCTION","hit_factor":1.9443},{"match_name":"OFGC USPSA August 21 2016","match_date":"2016-08-21","stage_classifiercode":"99-42","member_number":"A98164","first_name":"SELENA","last_name":"SHELLY","classification":"U","division":"PRODUCTION","hit_factor":1.9291},{"match_name":"Rio Grande Practical Shooting Club - Mar 6th 2021","match_date":"2021-03-06","stage_classifiercode":"99-42","member_number":"TY95604","first_name":"DANIEL","last_name":"BROWN","classification":"C","division":"PRODUCTION","hit_factor":1.9286},{"match_name":"Holmen USPSA 10/30/16","match_date":"2016-10-30","stage_classifiercode":"99-42","member_number":"A86404","first_name":"MARY LOU","last_name":"GROSS","classification":"D","division":"PRODUCTION","hit_factor":1.9279},{"match_name":"Caja del Rio - July 2017","match_date":"2017-07-15","stage_classifiercode":"99-42","member_number":"TY92318","first_name":"ROBERT","last_name":"PAUL","classification":"D","division":"PRODUCTION","hit_factor":1.9268},{"match_name":"PIPS 08-03-2016","match_date":"2016-08-03","stage_classifiercode":"99-42","member_number":"ty65929","first_name":"CONNIE","last_name":"BENJAMIN","classification":"C","division":"PRODUCTION","hit_factor":1.9159},{"match_name":"Springfield Tactical Shooters 01/04/2018","match_date":"2018-01-04","stage_classifiercode":"99-42","member_number":"\"\"","first_name":"DEREK","last_name":"EDGE","classification":"\"\"","division":"PRODUCTION","hit_factor":1.9139},{"match_name":"Shasta Shooters March 2017","match_date":"2017-03-11","stage_classifiercode":"99-42","member_number":"\"\"","first_name":"DAVE","last_name":"COMPOMIZZO","classification":"U","division":"PRODUCTION","hit_factor":1.9136},{"match_name":"Crooked Creek Pistol League - March 26-27 2016","match_date":"2016-03-26","stage_classifiercode":"99-42","member_number":"A93212","first_name":"DAVID","last_name":"GILLES","classification":"U","division":"PRODUCTION","hit_factor":1.907},{"match_name":"Southkent USPSA MAY match","match_date":"2017-05-20","stage_classifiercode":"99-42","member_number":"A101893","first_name":"TYLER","last_name":"SELK","classification":"U","division":"PRODUCTION","hit_factor":1.9048},{"match_name":"Baghdad USPSA Special Classifier Lightning Interrupted 6 May 2017","match_date":"2017-05-06","stage_classifiercode":"99-42","member_number":"\"\"","first_name":"PAT","last_name":"BROWN","classification":"U","division":"PRODUCTION","hit_factor":1.901},{"match_name":"MPSA 071616","match_date":"2016-07-16","stage_classifiercode":"99-42","member_number":"A90846","first_name":"MICHAEL","last_name":"COFER","classification":"D","division":"PRODUCTION","hit_factor":1.8987},{"match_name":"USPSA Bass River June 2017","match_date":"2017-06-04","stage_classifiercode":"99-42","member_number":"A103019","first_name":"STEVE","last_name":"BIEHL","classification":"\"\"","division":"PRODUCTION","hit_factor":1.8972},{"match_name":"EWPSA 2018-05","match_date":"2018-05-20","stage_classifiercode":"99-42","member_number":"A55355","first_name":"RANDY","last_name":"BAYUK","classification":"B","division":"PRODUCTION","hit_factor":1.8832},{"match_name":"CFRPC USPSA 2017 JUNE","match_date":"2017-06-18","stage_classifiercode":"99-42","member_number":"A102625","first_name":"ALEX","last_name":"BERMUDEZ","classification":"U","division":"PRODUCTION","hit_factor":1.8799},{"match_name":"Springfield Tactical Shooters 01-05-2017","match_date":"2017-01-05","stage_classifiercode":"99-42","member_number":"A93023","first_name":"SCOTT","last_name":"HUNGERFORD","classification":"U","division":"PRODUCTION","hit_factor":1.8753},{"match_name":"Briar Rabbit August Match 2016","match_date":"2016-08-28","stage_classifiercode":"99-42","member_number":"\"\"","first_name":"LARRY","last_name":"HOLLAND","classification":"\"\"","division":"PRODUCTION","hit_factor":1.8737},{"match_name":"5 Dogs July USPSA","match_date":"2016-07-03","stage_classifiercode":"99-42","member_number":"\"\"","first_name":"DANIEL","last_name":"DALLAS","classification":"\"\"","division":"PRODUCTION","hit_factor":1.8709},{"match_name":"Minnetonka Game And Fish May 3","match_date":"2017-05-03","stage_classifiercode":"99-42","member_number":"\"\"","first_name":"MIKE","last_name":"DAVEY","classification":"U","division":"PRODUCTION","hit_factor":1.8587},{"match_name":"LIPSA - April 30th 2017 - USPSA Match Special Classifier","match_date":"2017-04-30","stage_classifiercode":"99-42","member_number":"A102215","first_name":"PATRICK","last_name":"GUIDICE","classification":"U","division":"PRODUCTION","hit_factor":1.8574},{"match_name":"FBURG April 2017 Level I USPSA ","match_date":"2017-04-01","stage_classifiercode":"99-42","member_number":"A96782","first_name":"STEPHEN","last_name":"MEIMA","classification":"U","division":"PRODUCTION","hit_factor":1.8546},{"match_name":"LIPSA - April 30th 2017 - USPSA Match Special Classifier","match_date":"2017-04-30","stage_classifiercode":"99-42","member_number":"A99754","first_name":"NEIL","last_name":"MIGLIORE","classification":"U","division":"PRODUCTION","hit_factor":1.8456},{"match_name":"Trigger Guard USPSA","match_date":"2016-04-02","stage_classifiercode":"99-42","member_number":"A91554","first_name":"MICHAEL","last_name":"ISHIDA","classification":"C","division":"PRODUCTION","hit_factor":1.8413},{"match_name":"EAGC July 2016 USPSA Pistol Match","match_date":"2016-07-17","stage_classifiercode":"99-42","member_number":"A96638","first_name":"SANGDO","last_name":"CHOI","classification":"U","division":"PRODUCTION","hit_factor":1.8391},{"match_name":"Maine Practical Shooters October 2018","match_date":"2018-10-14","stage_classifiercode":"99-42","member_number":"PEN","first_name":"WENDY","last_name":"RANCOURT","classification":"\"\"","division":"PRODUCTION","hit_factor":1.8379},{"match_name":"AIPS  USPSA Weekly 22 August 2017","match_date":"2017-08-22","stage_classifiercode":"99-42","member_number":"A100884","first_name":"SHEENA","last_name":"GREEN","classification":"U","division":"PRODUCTION","hit_factor":1.832},{"match_name":"Holmen USPSA 10/30/16","match_date":"2016-10-30","stage_classifiercode":"99-42","member_number":"A96004","first_name":"NATHAN","last_name":"SEGAR","classification":"U","division":"PRODUCTION","hit_factor":1.8311},{"match_name":"GPS March 2021 at Wallis-Orchard Gun Range","match_date":"2021-03-28","stage_classifiercode":"99-42","member_number":"A95439","first_name":"KEVIN","last_name":"BAKER","classification":"C","division":"PRODUCTION","hit_factor":1.8018},{"match_name":"SAPSA April 2016","match_date":"2016-04-16","stage_classifiercode":"99-42","member_number":"A95648","first_name":"BLAINE","last_name":"DAPRA","classification":"U","division":"PRODUCTION","hit_factor":1.791},{"match_name":"SUPS All Classifier Match March 1718 2018","match_date":"2018-03-17","stage_classifiercode":"99-42","member_number":"PEN","first_name":"DALE","last_name":"MAZOROW","classification":"\"\"","division":"PRODUCTION","hit_factor":1.7847},{"match_name":"Shoot GTR USPSA 11/22","match_date":"2016-11-22","stage_classifiercode":"99-42","member_number":"A97295","first_name":"CHRIS","last_name":"EWEN","classification":"U","division":"PRODUCTION","hit_factor":1.765},{"match_name":"USPSA","match_date":"2016-09-25","stage_classifiercode":"99-42","member_number":"\"\"","first_name":"PARRY","last_name":"KETCHMARK","classification":"none","division":"PRODUCTION","hit_factor":1.7558},{"match_name":"LGCSEMPS 2017 SPECIAL CLASSIFIER","match_date":"2017-04-09","stage_classifiercode":"99-42","member_number":"\"\"","first_name":"CONNER","last_name":"DEGRYSE","classification":"U","division":"PRODUCTION","hit_factor":1.7502},{"match_name":"Richmond Borough Gun ClubJuly 1st 2017 USPSA Pistol Match","match_date":"2017-07-01","stage_classifiercode":"99-42","member_number":"\"\"","first_name":"MIKHAIL","last_name":"OSTROV","classification":"\"\"","division":"PRODUCTION","hit_factor":1.7199},{"match_name":"PIPS 08-03-2016","match_date":"2016-08-03","stage_classifiercode":"99-42","member_number":"TY65394","first_name":"SCOTT","last_name":"HARRISON","classification":"C","division":"PRODUCTION","hit_factor":1.7147},{"match_name":"PCWC USPSA 4 22 2017","match_date":"2017-04-22","stage_classifiercode":"99-42","member_number":"a102253","first_name":"DAN","last_name":"DRAKE","classification":"U","division":"PRODUCTION","hit_factor":1.7145},{"match_name":"Richmond Boro Gun Club March 2020 USPSA Match","match_date":"2020-03-14","stage_classifiercode":"99-42","member_number":"TY101332","first_name":"EDWARD","last_name":"BUJNAK","classification":"C","division":"PRODUCTION","hit_factor":1.7094},{"match_name":"CCPL 07102016","match_date":"2016-07-10","stage_classifiercode":"99-42","member_number":"\"\"","first_name":"RYAN","last_name":"ORIAN","classification":"U","division":"PRODUCTION","hit_factor":1.7077},{"match_name":"Steel City USPSA July 2016","match_date":"2016-07-02","stage_classifiercode":"99-42","member_number":"A97432","first_name":"MATTHEW","last_name":"ALEXANDER","classification":"U","division":"PRODUCTION","hit_factor":1.7073},{"match_name":"WLPS May2017","match_date":"2017-05-28","stage_classifiercode":"99-42","member_number":"\"\"","first_name":"MICHELLE","last_name":"BUSH","classification":"U","division":"PRODUCTION","hit_factor":1.7029},{"match_name":"MCPSL Pistol 4-9-16","match_date":"2016-04-09","stage_classifiercode":"99-42","member_number":"A49257","first_name":"JEREMY","last_name":"HALL","classification":"U","division":"PRODUCTION","hit_factor":1.7015},{"match_name":"LIPSA - April 30th 2017 - USPSA Match Special Classifier","match_date":"2017-04-30","stage_classifiercode":"99-42","member_number":"PEN","first_name":"RYAN","last_name":"MUNGAVIN","classification":"U","division":"PRODUCTION","hit_factor":1.6845},{"match_name":"Springfield Tactical Shooters 01/04/2018","match_date":"2018-01-04","stage_classifiercode":"99-42","member_number":"\"\"","first_name":"MIKE","last_name":"SCHREY","classification":"\"\"","division":"PRODUCTION","hit_factor":1.6829},{"match_name":"Richmond Hot Shots February 5-2017 USPSA Pistol Match","match_date":"2017-02-05","stage_classifiercode":"99-42","member_number":"A88051","first_name":"RICHARD","last_name":"MENAR","classification":"C","division":"PRODUCTION","hit_factor":1.6678},{"match_name":"PIPS 08-03-2016","match_date":"2016-08-03","stage_classifiercode":"99-42","member_number":"TY81464","first_name":"BRAD","last_name":"BRECH","classification":"D","division":"PRODUCTION","hit_factor":1.6656},{"match_name":"Baghdad USPSA Special Classifier Lightning Interrupted 6 May 2017","match_date":"2017-05-06","stage_classifiercode":"99-42","member_number":"\"\"","first_name":"SHANE","last_name":"MEDLEY","classification":"U","division":"PRODUCTION","hit_factor":1.6598},{"match_name":"Crooked Creek Pistol League - April 2017","match_date":"2017-04-22","stage_classifiercode":"99-42","member_number":"\"\"","first_name":"JOHN","last_name":"REDELLA","classification":"U","division":"PRODUCTION","hit_factor":1.6588},{"match_name":"Steel City USPSA July 2016","match_date":"2016-07-02","stage_classifiercode":"99-42","member_number":"PEN","first_name":"PAUL","last_name":"HEDGEPATH","classification":"U","division":"PRODUCTION","hit_factor":1.6553},{"match_name":"Richmond Borough Gun ClubJuly 1st 2017 USPSA Pistol Match","match_date":"2017-07-01","stage_classifiercode":"99-42","member_number":"A99029","first_name":"NICHOLAS","last_name":"TORRELLI","classification":"U","division":"PRODUCTION","hit_factor":1.6393},{"match_name":"PIPS 08-03-2016","match_date":"2016-08-03","stage_classifiercode":"99-42","member_number":"PEN","first_name":"WILL","last_name":"BRATRUD","classification":"U","division":"PRODUCTION","hit_factor":1.6354},{"match_name":"MCPSL Pistol 4-9-16","match_date":"2016-04-09","stage_classifiercode":"99-42","member_number":"A90190","first_name":"STEVEN","last_name":"BEHRENDS","classification":"D","division":"PRODUCTION","hit_factor":1.6321},{"match_name":"SFA July 2016 CLASSIFIED","match_date":"2016-07-16","stage_classifiercode":"99-42","member_number":"A96992","first_name":"ERICK","last_name":"SQUIRES","classification":"U","division":"PRODUCTION","hit_factor":1.6308},{"match_name":"OFGC USPSA August 21 2016","match_date":"2016-08-21","stage_classifiercode":"99-42","member_number":"\"\"","first_name":"CHARLIE","last_name":"WILHELM","classification":"U","division":"PRODUCTION","hit_factor":1.6211},{"match_name":"Springfield Tactical Shooters 01/04/2018","match_date":"2018-01-04","stage_classifiercode":"99-42","member_number":"\"\"","first_name":"RAY","last_name":"WATERS","classification":"\"\"","division":"PRODUCTION","hit_factor":1.6097},{"match_name":"HPS March Pistol Funshoot","match_date":"2017-03-18","stage_classifiercode":"99-42","member_number":"TY78748","first_name":"LEE","last_name":"BARNES","classification":"C","division":"PRODUCTION","hit_factor":1.6088},{"match_name":"1ra Fecha USPSA","match_date":"2016-01-10","stage_classifiercode":"99-42","member_number":"\"\"","first_name":"GUILLERMO","last_name":"TRUJILLO","classification":"U","division":"PRODUCTION","hit_factor":1.6012},{"match_name":"Crooked Creek Pistol League - April 2017","match_date":"2017-04-22","stage_classifiercode":"99-42","member_number":"A85753","first_name":"PATRICK","last_name":"QUINN","classification":"D","division":"PRODUCTION","hit_factor":1.5924},{"match_name":"Crooked Creek Pistol League - March 26-27 2016","match_date":"2016-03-26","stage_classifiercode":"99-42","member_number":"A76813","first_name":"ADAM","last_name":"LITKE","classification":"X","division":"PRODUCTION","hit_factor":1.592},{"match_name":"DGC USPSA Classifier Match","match_date":"2017-07-30","stage_classifiercode":"99-42","member_number":"A62296","first_name":"DAVID","last_name":"BRIGHAM","classification":"U","division":"PRODUCTION","hit_factor":1.5748},{"match_name":"Atlanta Practical Shooters March 2016 USPSA - Classifier Match","match_date":"2016-03-06","stage_classifiercode":"99-42","member_number":"TY94024","first_name":"DANIELLE","last_name":"SNOWDON","classification":"D","division":"PRODUCTION","hit_factor":1.5656},{"match_name":"CRCPS 2021-08-14","match_date":"2021-08-14","stage_classifiercode":"99-42","member_number":"TY96994","first_name":"NORM","last_name":"SPAHR","classification":"C","division":"PRODUCTION","hit_factor":1.5643},{"match_name":"Crooked Creek Pistol League - March 26-27 2016","match_date":"2016-03-26","stage_classifiercode":"99-42","member_number":"PEN","first_name":"NATHANIEL","last_name":"FELDKAMP","classification":"U","division":"PRODUCTION","hit_factor":1.5617},{"match_name":"USPSA Bass River June 2017","match_date":"2017-06-04","stage_classifiercode":"99-42","member_number":"TY72402","first_name":"SUSAN","last_name":"WHITLOCK","classification":"D","division":"PRODUCTION","hit_factor":1.5448},{"match_name":"Eagles Nest July 17th","match_date":"2016-07-17","stage_classifiercode":"99-42","member_number":"\"\"","first_name":"ROB","last_name":"BROWN","classification":"U","division":"PRODUCTION","hit_factor":1.5411},{"match_name":"FBURG April 2017 Level I USPSA ","match_date":"2017-04-01","stage_classifiercode":"99-42","member_number":"80874","first_name":"CONNIE","last_name":"LEATHERS","classification":"U","division":"PRODUCTION","hit_factor":1.5377},{"match_name":"WPS USPSA Special Classifier October 2017","match_date":"2017-10-28","stage_classifiercode":"99-42","member_number":"A102465","first_name":"GINGER","last_name":"CERVINI","classification":"U","division":"PRODUCTION","hit_factor":1.5172},{"match_name":"Richmond Boro Gun Club March 2020 USPSA Match","match_date":"2020-03-14","stage_classifiercode":"99-42","member_number":"A119974","first_name":"SEAN","last_name":"SLEVIN","classification":"D","division":"PRODUCTION","hit_factor":1.5152},{"match_name":"USPSA","match_date":"2016-12-18","stage_classifiercode":"99-42","member_number":"\"\"","first_name":"FRANK","last_name":"GONSETHLL","classification":"U","division":"PRODUCTION","hit_factor":1.5093},{"match_name":"TPS USPSA at CMP Dec 19 2020 Special Classifier Match","match_date":"2020-12-19","stage_classifiercode":"99-42","member_number":"A127561","first_name":"DANIEL","last_name":"ANDERSON","classification":"U","division":"PRODUCTION","hit_factor":1.5079},{"match_name":"HPS March Pistol Funshoot","match_date":"2017-03-18","stage_classifiercode":"99-42","member_number":"A101412","first_name":"CARL","last_name":"ABALI","classification":"U","division":"PRODUCTION","hit_factor":1.5},{"match_name":"PSAC_20170923","match_date":"2017-09-23","stage_classifiercode":"99-42","member_number":"TY91017","first_name":"JON","last_name":"MANNA","classification":"B","division":"PRODUCTION","hit_factor":1.4953},{"match_name":"Steel City USPSA July 2016","match_date":"2016-07-02","stage_classifiercode":"99-42","member_number":"A90535","first_name":"JEFF","last_name":"HARROLLE","classification":"C","division":"PRODUCTION","hit_factor":1.4885},{"match_name":"Springfield Tactical Shooters 01/04/2018","match_date":"2018-01-04","stage_classifiercode":"99-42","member_number":"A102327","first_name":"WOODY","last_name":"HESTER","classification":"D","division":"PRODUCTION","hit_factor":1.4882},{"match_name":"Springfield Tactical Shooters 01/04/2018","match_date":"2018-01-04","stage_classifiercode":"99-42","member_number":"\"\"","first_name":"RAY","last_name":"WATERS","classification":"\"\"","division":"PRODUCTION","hit_factor":1.484},{"match_name":"Richmond Borough Gun ClubJuly 1st 2017 USPSA Pistol Match","match_date":"2017-07-01","stage_classifiercode":"99-42","member_number":"TY91965","first_name":"JOSEPH","last_name":"STEINHAUER","classification":"D","division":"PRODUCTION","hit_factor":1.4595},{"match_name":"Holmen USPSA 10/30/16","match_date":"2016-10-30","stage_classifiercode":"99-42","member_number":"TY77476","first_name":"PAUL","last_name":"FOSTER","classification":"C","division":"PRODUCTION","hit_factor":1.4435},{"match_name":"SAPSA April 2016","match_date":"2016-04-16","stage_classifiercode":"99-42","member_number":"A94246","first_name":"MIKE","last_name":"RUBIN","classification":"U","division":"PRODUCTION","hit_factor":1.4405},{"match_name":"FBURG April 2017 Level I USPSA ","match_date":"2017-04-01","stage_classifiercode":"99-42","member_number":"A101449","first_name":"JOSHUA","last_name":"SIEGEL","classification":"U","division":"PRODUCTION","hit_factor":1.4401},{"match_name":"Hampden RPC August USPSA Match","match_date":"2020-08-09","stage_classifiercode":"99-42","member_number":"A100277","first_name":"CHRIS","last_name":"MILLS","classification":"D","division":"PRODUCTION","hit_factor":1.4308},{"match_name":"MVPJan2017","match_date":"2017-01-07","stage_classifiercode":"99-42","member_number":"a99992","first_name":"RICK","last_name":"WILLIAMS","classification":"U","division":"PRODUCTION","hit_factor":1.4267},{"match_name":"Shasta Shooters August 2017","match_date":"2017-08-12","stage_classifiercode":"99-42","member_number":"PEN","first_name":"AARON","last_name":"RODRIGUES","classification":"\"\"","division":"PRODUCTION","hit_factor":1.4237},{"match_name":"Maine Practical Shooters May 2021","match_date":"2021-05-08","stage_classifiercode":"99-42","member_number":"A101724","first_name":"JIM","last_name":"STOUT","classification":"C","division":"PRODUCTION","hit_factor":1.4188},{"match_name":"Richmond Borough Gun ClubJuly 1st 2017 USPSA Pistol Match","match_date":"2017-07-01","stage_classifiercode":"99-42","member_number":"A70768","first_name":"THOMAS","last_name":"RUSSO","classification":"D","division":"PRODUCTION","hit_factor":1.4046},{"match_name":"Springfield Tactical Shooters 01/04/2018","match_date":"2018-01-04","stage_classifiercode":"99-42","member_number":"A102327","first_name":"WOODY","last_name":"HESTER","classification":"D","division":"PRODUCTION","hit_factor":1.4008},{"match_name":"CCPL 07102016","match_date":"2016-07-10","stage_classifiercode":"99-42","member_number":"A83657","first_name":"ROBERT","last_name":"RABINO","classification":"C","division":"PRODUCTION","hit_factor":1.391},{"match_name":"CFRPC USPSA 2017 JUNE","match_date":"2017-06-18","stage_classifiercode":"99-42","member_number":"\"\"","first_name":"ALAN","last_name":"CUNADA","classification":"U","division":"PRODUCTION","hit_factor":1.3889},{"match_name":"LIPSA - April 30th 2017 - USPSA Match Special Classifier","match_date":"2017-04-30","stage_classifiercode":"99-42","member_number":"TY83420","first_name":"SAL","last_name":"RUSSO","classification":"U","division":"PRODUCTION","hit_factor":1.3796},{"match_name":"Pathfinder August USPSA","match_date":"2020-08-16","stage_classifiercode":"99-42","member_number":"TY113134","first_name":"CHARLIE","last_name":"GIOVO","classification":"U","division":"PRODUCTION","hit_factor":1.3772},{"match_name":"EWPSA 2018-04","match_date":"2018-04-15","stage_classifiercode":"99-42","member_number":"A110403","first_name":"TINA","last_name":"FRASIER","classification":"U","division":"PRODUCTION","hit_factor":1.3761},{"match_name":"HAS May 2016 Pistol Match","match_date":"2016-05-08","stage_classifiercode":"99-42","member_number":"TY76424","first_name":"HARRISON","last_name":"SCHMIDT","classification":"A","division":"PRODUCTION","hit_factor":1.3699},{"match_name":"MCPSL Pistol 4-9-16","match_date":"2016-04-09","stage_classifiercode":"99-42","member_number":"PEN","first_name":"THOMAS","last_name":"HEILMAN","classification":"U","division":"PRODUCTION","hit_factor":1.3552},{"match_name":"Crooked Creek Pistol League - April 2017","match_date":"2017-04-22","stage_classifiercode":"99-42","member_number":"A102337","first_name":"DON","last_name":"BURKLEY","classification":"D","division":"PRODUCTION","hit_factor":1.348},{"match_name":"Richmond Borough Gun ClubJuly 1st 2017 USPSA Pistol Match","match_date":"2017-07-01","stage_classifiercode":"99-42","member_number":"\"\"","first_name":"ALEX","last_name":"ARAKCHEYEV","classification":"U","division":"PRODUCTION","hit_factor":1.3403},{"match_name":"1ra Fecha USPSA","match_date":"2016-01-10","stage_classifiercode":"99-42","member_number":"A90232","first_name":"RAFAEL","last_name":"RODRIGUEZ FERNANDEZ","classification":"U","division":"PRODUCTION","hit_factor":1.3318},{"match_name":"Shasta Shooters August 2017","match_date":"2017-08-12","stage_classifiercode":"99-42","member_number":"PEN","first_name":"JOHN","last_name":"HEATH","classification":"\"\"","division":"PRODUCTION","hit_factor":1.3127},{"match_name":"EWPSA 2018-04","match_date":"2018-04-15","stage_classifiercode":"99-42","member_number":"\"\"","first_name":"GRACE","last_name":"O'HARA","classification":"U","division":"PRODUCTION","hit_factor":1.3109},{"match_name":"Minnetonka Game And Fish May 3","match_date":"2017-05-03","stage_classifiercode":"99-42","member_number":"A-59932","first_name":"MARK","last_name":"ERICKSON","classification":"C","division":"PRODUCTION","hit_factor":1.3031},{"match_name":"PCWC USPSA 4 22 2017","match_date":"2017-04-22","stage_classifiercode":"99-42","member_number":"L2664","first_name":"JIMMIE","last_name":"HONEYCUTT","classification":"M","division":"PRODUCTION","hit_factor":1.2959},{"match_name":"Shongum October 2016 USPSA Match","match_date":"2016-10-01","stage_classifiercode":"99-42","member_number":"A97474","first_name":"GARVIN","last_name":"WALSH","classification":"D","division":"PRODUCTION","hit_factor":1.2952},{"match_name":"SAPSA April 2016","match_date":"2016-04-16","stage_classifiercode":"99-42","member_number":"TY74630","first_name":"ANNE","last_name":"COLSON","classification":"D","division":"PRODUCTION","hit_factor":1.2903},{"match_name":"SPSA USPSA February 4th Sat match","match_date":"2018-02-24","stage_classifiercode":"99-42","member_number":"\"\"","first_name":"JEFFERY","last_name":"MCELRATH","classification":"U","division":"PRODUCTION","hit_factor":1.2805},{"match_name":"FLPSA USPSA Pistol League 06.28.2016","match_date":"2016-06-28","stage_classifiercode":"99-42","member_number":"\"\"","first_name":"TIFFANY","last_name":"OVERLAND","classification":"U","division":"PRODUCTION","hit_factor":1.2794},{"match_name":"Prescott 1 st Saturday Uspsa 11-05-2016","match_date":"2016-11-05","stage_classifiercode":"99-42","member_number":"\"\"","first_name":"TYLER","last_name":"GREEN","classification":"unclassified","division":"PRODUCTION","hit_factor":1.2589},{"match_name":"Crooked Creek Pistol League - April 2017","match_date":"2017-04-22","stage_classifiercode":"99-42","member_number":"\"\"","first_name":"EVAN","last_name":"GARDNER","classification":"U","division":"PRODUCTION","hit_factor":1.257},{"match_name":"5 Dogs July USPSA","match_date":"2016-07-03","stage_classifiercode":"99-42","member_number":"\"\"","first_name":"BLAKE","last_name":"BASTAIN","classification":"Unclassified","division":"PRODUCTION","hit_factor":1.227},{"match_name":"Steel City USPSA July 2016","match_date":"2016-07-02","stage_classifiercode":"99-42","member_number":"PEN","first_name":"JAMES","last_name":"WRIGHT","classification":"U","division":"PRODUCTION","hit_factor":1.2136},{"match_name":"ORSA USPSA Chuck Berry Memorial Match 15 April","match_date":"2017-04-15","stage_classifiercode":"99-42","member_number":"A102030","first_name":"CARLO","last_name":"CERENO","classification":"U","division":"PRODUCTION","hit_factor":1.2094},{"match_name":"Atlanta Practical Shooters March 2016 USPSA - Classifier Match","match_date":"2016-03-06","stage_classifiercode":"99-42","member_number":"A88177","first_name":"CHRIS","last_name":"SMITH","classification":"B","division":"PRODUCTION","hit_factor":1.1996},{"match_name":"SFA July 2016 CLASSIFIED","match_date":"2016-07-16","stage_classifiercode":"99-42","member_number":"TY63124","first_name":"SABRA","last_name":"GILBERT-YOUNG","classification":"U","division":"PRODUCTION","hit_factor":1.1989},{"match_name":"Shasta Shooters August 2017","match_date":"2017-08-12","stage_classifiercode":"99-42","member_number":"PEN","first_name":"MAX","last_name":"STORY","classification":"U","division":"PRODUCTION","hit_factor":1.1896},{"match_name":"WPS USPSA Special Classifier October 2017","match_date":"2017-10-28","stage_classifiercode":"99-42","member_number":"A103655","first_name":"NORMA","last_name":"MCGUIRE","classification":"U","division":"PRODUCTION","hit_factor":1.1815},{"match_name":"Richmond Hot Shots 2021 USPSA Special Classifier Match - Jan 24 2021","match_date":"2021-01-24","stage_classifiercode":"99-42","member_number":"A114315","first_name":"B. JAMES","last_name":"YEN","classification":"D","division":"PRODUCTION","hit_factor":1.1619},{"match_name":"RCPS USPSA Feb 17","match_date":"2018-02-17","stage_classifiercode":"99-42","member_number":"A108714","first_name":"MICHAEL","last_name":"NIX","classification":"U","division":"PRODUCTION","hit_factor":1.1583},{"match_name":"Southkent USPSA MAY match","match_date":"2017-05-20","stage_classifiercode":"99-42","member_number":"\"\"","first_name":"JONATHAN","last_name":"BRAATEN","classification":"U","division":"PRODUCTION","hit_factor":1.158},{"match_name":"APSC USPSA Special Classifier 04-02-16","match_date":"2016-04-02","stage_classifiercode":"99-42","member_number":"\"\"","first_name":"GIL","last_name":"MOLL","classification":"\"\"","division":"PRODUCTION","hit_factor":1.1536},{"match_name":"PIPS 08-03-2016","match_date":"2016-08-03","stage_classifiercode":"99-42","member_number":"A92109","first_name":"HENRY","last_name":"HOCRAFFER","classification":"D","division":"PRODUCTION","hit_factor":1.1536},{"match_name":"Hose Monster fun ","match_date":"2021-11-07","stage_classifiercode":"99-42","member_number":"A104196","first_name":"BRE","last_name":"SANDOVAL","classification":"C","division":"PRODUCTION","hit_factor":1.1472},{"match_name":"FBURG April 2017 Level I USPSA ","match_date":"2017-04-01","stage_classifiercode":"99-42","member_number":"\"\"","first_name":"CHRIS","last_name":"DECKER","classification":"X","division":"PRODUCTION","hit_factor":1.1351},{"match_name":"WLPS May2017","match_date":"2017-05-28","stage_classifiercode":"99-42","member_number":"A103197","first_name":"CHAD","last_name":"ALLRED","classification":"U","division":"PRODUCTION","hit_factor":1.1166},{"match_name":"SFA July 2016 CLASSIFIED","match_date":"2016-07-16","stage_classifiercode":"99-42","member_number":"\"\"","first_name":"CALVIN","last_name":"TAYLOR","classification":"X","division":"PRODUCTION","hit_factor":1.1094},{"match_name":"Richmond Borough Gun ClubJuly 1st 2017 USPSA Pistol Match","match_date":"2017-07-01","stage_classifiercode":"99-42","member_number":"A102307","first_name":"HOWARD","last_name":"KUTZLER","classification":"U","division":"PRODUCTION","hit_factor":1.0989},{"match_name":"LGCSEMPS 2017 SPECIAL CLASSIFIER","match_date":"2017-04-09","stage_classifiercode":"99-42","member_number":"A102197","first_name":"ERIC","last_name":"SWANSON","classification":"U","division":"PRODUCTION","hit_factor":1.0899},{"match_name":"LGCSEMPS 2017 SPECIAL CLASSIFIER","match_date":"2017-04-09","stage_classifiercode":"99-42","member_number":"A102462","first_name":"ERIC","last_name":"WOLFE","classification":"U","division":"PRODUCTION","hit_factor":1.0805},{"match_name":"LIPSA - April 30th 2017 - USPSA Match Special Classifier","match_date":"2017-04-30","stage_classifiercode":"99-42","member_number":"FY79274","first_name":"WILLIAM","last_name":"PEARSON","classification":"C","division":"PRODUCTION","hit_factor":1.0766},{"match_name":"Richmond Hot Shots 2021 USPSA Special Classifier Match - Jan 24 2021","match_date":"2021-01-24","stage_classifiercode":"99-42","member_number":"FY55227","first_name":"NICK","last_name":"CHOW","classification":"U","division":"PRODUCTION","hit_factor":1.061},{"match_name":"Richmond Hot Shots 2021 USPSA Special Classifier Match - Jan 24 2021","match_date":"2021-01-24","stage_classifiercode":"99-42","member_number":"A131897","first_name":"LOUIE","last_name":"DOLOR","classification":"U","division":"PRODUCTION","hit_factor":1.051},{"match_name":"LIPSA - April 30th 2017 - USPSA Match Special Classifier","match_date":"2017-04-30","stage_classifiercode":"99-42","member_number":"TY53756","first_name":"GERALD","last_name":"BUSHART","classification":"D","division":"PRODUCTION","hit_factor":1.0505},{"match_name":"Hose Monster fun ","match_date":"2021-11-07","stage_classifiercode":"99-42","member_number":"A102392","first_name":"MATTHEW","last_name":"SCHENE","classification":"D","division":"PRODUCTION","hit_factor":1.0473},{"match_name":"5 Dogs July USPSA","match_date":"2016-07-03","stage_classifiercode":"99-42","member_number":"\"\"","first_name":"MANUEL","last_name":"ADAME","classification":"\"\"","division":"PRODUCTION","hit_factor":1.0363},{"match_name":"Crooked Creek Pistol League - April 2017","match_date":"2017-04-22","stage_classifiercode":"99-42","member_number":"\"\"","first_name":"LOGAN","last_name":"GILLES","classification":"U","division":"PRODUCTION","hit_factor":1.0172},{"match_name":"Richmond Borough Gun ClubJuly 1st 2017 USPSA Pistol Match","match_date":"2017-07-01","stage_classifiercode":"99-42","member_number":"\"\"","first_name":"MIRON","last_name":"FAYNGERSH","classification":"U","division":"PRODUCTION","hit_factor":1.0127},{"match_name":"Richmond Borough Gun ClubJuly 1st 2017 USPSA Pistol Match","match_date":"2017-07-01","stage_classifiercode":"99-42","member_number":"1709","first_name":"JAMES","last_name":"MULCAHEY","classification":"U","division":"PRODUCTION","hit_factor":0.9969},{"match_name":"USPSA","match_date":"2016-12-18","stage_classifiercode":"99-42","member_number":"\"\"","first_name":"ERIC","last_name":"SEVERSON","classification":"\"\"","division":"PRODUCTION","hit_factor":0.9894},{"match_name":"CCPL 07102016","match_date":"2016-07-10","stage_classifiercode":"99-42","member_number":"TY10323","first_name":"JOHN","last_name":"LINENBACH","classification":"A","division":"PRODUCTION","hit_factor":0.979},{"match_name":"ORSA USPSA Chuck Berry Memorial Match 15 April","match_date":"2017-04-15","stage_classifiercode":"99-42","member_number":"NONE","first_name":"MATTHEW","last_name":"BIRETA","classification":"U","division":"PRODUCTION","hit_factor":0.9574},{"match_name":"MVPJan2017","match_date":"2017-01-07","stage_classifiercode":"99-42","member_number":"\"\"","first_name":"BEN","last_name":"CHENG","classification":"U","division":"PRODUCTION","hit_factor":0.9466},{"match_name":"Southkent USPSA MAY match","match_date":"2017-05-20","stage_classifiercode":"99-42","member_number":"TY98976","first_name":"JUDITH","last_name":"WORDEN","classification":"D","division":"PRODUCTION","hit_factor":0.9233},{"match_name":"EWPSA 2018-04","match_date":"2018-04-15","stage_classifiercode":"99-42","member_number":"\"\"","first_name":"RYAN","last_name":"BLOSSER","classification":"U","division":"PRODUCTION","hit_factor":0.9206},{"match_name":"PSAC_20170923","match_date":"2017-09-23","stage_classifiercode":"99-42","member_number":"\"\"","first_name":"JARED","last_name":"O'REILLY","classification":"U","division":"PRODUCTION","hit_factor":0.9105},{"match_name":"Richmond Boro Gun Club March 2020 USPSA Match","match_date":"2020-03-14","stage_classifiercode":"99-42","member_number":"A119395","first_name":"RODRIGO","last_name":"ALIPIO","classification":"U","division":"PRODUCTION","hit_factor":0.9036},{"match_name":"EWPSA 2018-04","match_date":"2018-04-15","stage_classifiercode":"99-42","member_number":"\"\"","first_name":"MATT","last_name":"O'HARA","classification":"U","division":"PRODUCTION","hit_factor":0.8977},{"match_name":"Minot USPSA 7-8-18","match_date":"2018-07-07","stage_classifiercode":"99-42","member_number":"\"\"","first_name":"NICK","last_name":"BRISTOW","classification":"U","division":"PRODUCTION","hit_factor":0.8729},{"match_name":"CCPL 07102016","match_date":"2016-07-10","stage_classifiercode":"99-42","member_number":"\"\"","first_name":"JOE","last_name":"NISHIMOTO","classification":"U","division":"PRODUCTION","hit_factor":0.8709},{"match_name":"Richmond Borough Gun ClubJuly 1st 2017 USPSA Pistol Match","match_date":"2017-07-01","stage_classifiercode":"99-42","member_number":"A98330","first_name":"ROBERT","last_name":"PODLUCKY","classification":"D","division":"PRODUCTION","hit_factor":0.8669},{"match_name":"5 Dogs July USPSA","match_date":"2016-07-03","stage_classifiercode":"99-42","member_number":"\"\"","first_name":"CASEY","last_name":"CROWN","classification":"\"\"","division":"PRODUCTION","hit_factor":0.8547},{"match_name":"Minot USPSA 7-8-18","match_date":"2018-07-07","stage_classifiercode":"99-42","member_number":"A104588","first_name":"NICK","last_name":"WALDER","classification":"U","division":"PRODUCTION","hit_factor":0.8518},{"match_name":"Richmond Boro Gun Club March 2020 USPSA Match","match_date":"2020-03-14","stage_classifiercode":"99-42","member_number":"A123543","first_name":"ROSE","last_name":"JOSKOW","classification":"U","division":"PRODUCTION","hit_factor":0.8471},{"match_name":"NCPS USPSA Handgun Match January 28 2018a","match_date":"2018-01-28","stage_classifiercode":"99-42","member_number":"A102818","first_name":"ALANNBERT","last_name":"MILLENDEZ","classification":"D","division":"PRODUCTION","hit_factor":0.8467},{"match_name":"SPSA USPSA February 4th Sat match","match_date":"2018-02-24","stage_classifiercode":"99-42","member_number":"TY86053","first_name":"LORI","last_name":"VALONE","classification":"D","division":"PRODUCTION","hit_factor":0.8434},{"match_name":"USPSA","match_date":"2016-09-25","stage_classifiercode":"99-42","member_number":"\"\"","first_name":"CHRIS","last_name":"KEMP","classification":"U","division":"PRODUCTION","hit_factor":0.8396},{"match_name":"Baghdad USPSA Special Classifier Lightning Interrupted 6 May 2017","match_date":"2017-05-06","stage_classifiercode":"99-42","member_number":"\"\"","first_name":"ROB","last_name":"GILLETTE","classification":"U","division":"PRODUCTION","hit_factor":0.8287},{"match_name":"Prescott 1 st Saturday Uspsa 11-05-2016","match_date":"2016-11-05","stage_classifiercode":"99-42","member_number":"\"\"","first_name":"ANDREW","last_name":"TAYLOR","classification":"unclassified","division":"PRODUCTION","hit_factor":0.8055},{"match_name":"Enps May 2021 USPSA MATCH-All Classifier","match_date":"2021-05-02","stage_classifiercode":"99-42","member_number":"A117703","first_name":"JON","last_name":"DIXON","classification":"U","division":"PRODUCTION","hit_factor":0.7937},{"match_name":"Springfield Tactical Shooters 01/04/2018","match_date":"2018-01-04","stage_classifiercode":"99-42","member_number":"\"\"","first_name":"DEREK","last_name":"EDGE","classification":"\"\"","division":"PRODUCTION","hit_factor":0.7922},{"match_name":"Hampden RPC August USPSA Match","match_date":"2020-08-09","stage_classifiercode":"99-42","member_number":"A128214","first_name":"WESLEY","last_name":"RAYMOND","classification":"U","division":"PRODUCTION","hit_factor":0.7874},{"match_name":"Springfield Tactical Shooters 01/04/2018","match_date":"2018-01-04","stage_classifiercode":"99-42","member_number":"\"\"","first_name":"KIM","last_name":"FOSTER","classification":"\"\"","division":"PRODUCTION","hit_factor":0.7748},{"match_name":"LGCSEMPS 2017 SPECIAL CLASSIFIER","match_date":"2017-04-09","stage_classifiercode":"99-42","member_number":"\"\"","first_name":"JESSICA","last_name":"KIELKOPF","classification":"U","division":"PRODUCTION","hit_factor":0.7619},{"match_name":"Cactus USPSA ALL CLASSIFIER September 2020","match_date":"2020-09-06","stage_classifiercode":"99-42","member_number":"A129195","first_name":"RICHARD","last_name":"ARTHUR","classification":"U","division":"PRODUCTION","hit_factor":0.7246},{"match_name":"Wvpps May2016","match_date":"2016-05-15","stage_classifiercode":"99-42","member_number":"TY80388","first_name":"MATT","last_name":"DENNIS","classification":"B","division":"PRODUCTION","hit_factor":0.7194},{"match_name":"Enps May 2021 USPSA MATCH-All Classifier","match_date":"2021-05-02","stage_classifiercode":"99-42","member_number":"L4658","first_name":"JOSHUA","last_name":"RANDAZZO","classification":"C","division":"PRODUCTION","hit_factor":0.7194},{"match_name":"NCPS USPSA Handgun Match January 28 2018a","match_date":"2018-01-28","stage_classifiercode":"99-42","member_number":"TY107305","first_name":"JO","last_name":"DUNLAP","classification":"U","division":"PRODUCTION","hit_factor":0.719},{"match_name":"HCGC TN","match_date":"2020-03-14","stage_classifiercode":"99-42","member_number":"A125688","first_name":"JOHN","last_name":"KING","classification":"U","division":"PRODUCTION","hit_factor":0.7147},{"match_name":"FBURG April 2017 Level I USPSA ","match_date":"2017-04-01","stage_classifiercode":"99-42","member_number":"A101572","first_name":"BRIAN","last_name":"DENT","classification":"U","division":"PRODUCTION","hit_factor":0.7137},{"match_name":"CCC Shooting Complex September 2016","match_date":"2016-09-03","stage_classifiercode":"99-42","member_number":"\"\"","first_name":"DALIN","last_name":"HAMM","classification":"U","division":"PRODUCTION","hit_factor":0.707},{"match_name":"Springfield Tactical Shooters 01/04/2018","match_date":"2018-01-04","stage_classifiercode":"99-42","member_number":"A106677","first_name":"CURT","last_name":"CHRISTENSEN","classification":"U","division":"PRODUCTION","hit_factor":0.707},{"match_name":"HPSP Heartland Practical Shooters October Handgun Shoot","match_date":"2016-10-23","stage_classifiercode":"99-42","member_number":"PEN","first_name":"TYLER","last_name":"ERICSON","classification":"Unclassified","division":"PRODUCTION","hit_factor":0.6907},{"match_name":"Crooked Creek Pistol League - April 2017","match_date":"2017-04-22","stage_classifiercode":"99-42","member_number":"\"\"","first_name":"PJ","last_name":"MUTTI","classification":"U","division":"PRODUCTION","hit_factor":0.6791},{"match_name":"Springfield Tactical Shooters 01/04/2018","match_date":"2018-01-04","stage_classifiercode":"99-42","member_number":"\"\"","first_name":"JIM","last_name":"HARTWIG","classification":"\"\"","division":"PRODUCTION","hit_factor":0.665},{"match_name":"USPSA Bass River June 2017","match_date":"2017-06-04","stage_classifiercode":"99-42","member_number":"\"\"","first_name":"BRUCE","last_name":"BOUCHARD","classification":"\"\"","division":"PRODUCTION","hit_factor":0.6623},{"match_name":"HAS May 2016 Pistol Match","match_date":"2016-05-08","stage_classifiercode":"99-42","member_number":"\"\"","first_name":"ANTON","last_name":"YU","classification":"X","division":"PRODUCTION","hit_factor":0.6613},{"match_name":"Springfield Tactical Shooters 01/04/2018","match_date":"2018-01-04","stage_classifiercode":"99-42","member_number":"\"\"","first_name":"JIM","last_name":"HARTWIG","classification":"\"\"","division":"PRODUCTION","hit_factor":0.6579},{"match_name":"CCPS March 2020 USPSA","match_date":"2020-03-01","stage_classifiercode":"99-42","member_number":"L1716","first_name":"JOE","last_name":"LOPEZ","classification":"B","division":"PRODUCTION","hit_factor":0.6532},{"match_name":"SFA July 2016 CLASSIFIED","match_date":"2016-07-16","stage_classifiercode":"99-42","member_number":"A94942","first_name":"ALBERT","last_name":"ALVAREZ","classification":"C","division":"PRODUCTION","hit_factor":0.6512},{"match_name":"Crooked Creek Pistol League - April 2017","match_date":"2017-04-22","stage_classifiercode":"99-42","member_number":"A96811","first_name":"TODD","last_name":"EDDY","classification":"C","division":"PRODUCTION","hit_factor":0.647},{"match_name":"FLPSA USPSA Pistol League 06.28.2016","match_date":"2016-06-28","stage_classifiercode":"99-42","member_number":"\"\"","first_name":"JEFF","last_name":"WALSH","classification":"U","division":"PRODUCTION","hit_factor":0.6323},{"match_name":"Minnetonka Game And Fish May 3","match_date":"2017-05-03","stage_classifiercode":"99-42","member_number":"A68346","first_name":"SHAWN","last_name":"MCKINNEY","classification":"B","division":"PRODUCTION","hit_factor":0.6239},{"match_name":"Crooked Creek Pistol League - March 26-27 2016","match_date":"2016-03-26","stage_classifiercode":"99-42","member_number":"\"\"","first_name":"GREG","last_name":"RIVIOTTA","classification":"X","division":"PRODUCTION","hit_factor":0.5833},{"match_name":"MCPSL Pistol 4-9-16","match_date":"2016-04-09","stage_classifiercode":"99-42","member_number":"TY86462","first_name":"MIKE","last_name":"CADDELL","classification":"U","division":"PRODUCTION","hit_factor":0.5384},{"match_name":"ORSA USPSA Chuck Berry Memorial Match 15 April","match_date":"2017-04-15","stage_classifiercode":"99-42","member_number":"A99368","first_name":"JIM","last_name":"LINDSAY","classification":"D","division":"PRODUCTION","hit_factor":0.5299},{"match_name":"PIPS 08-03-2016","match_date":"2016-08-03","stage_classifiercode":"99-42","member_number":"A90034","first_name":"BOB","last_name":"ANDREWS","classification":"C","division":"PRODUCTION","hit_factor":0.5076},{"match_name":"LGCSEMPS 2017 SPECIAL CLASSIFIER","match_date":"2017-04-09","stage_classifiercode":"99-42","member_number":"A101621","first_name":"APRIL","last_name":"DERTIAN","classification":"U","division":"PRODUCTION","hit_factor":0.5004},{"match_name":"HPS March Pistol Funshoot","match_date":"2017-03-18","stage_classifiercode":"99-42","member_number":"A91280","first_name":"LESLIE","last_name":"QUON","classification":"U","division":"PRODUCTION","hit_factor":0.4852},{"match_name":"AIPS  USPSA Weekly 22 August 2017","match_date":"2017-08-22","stage_classifiercode":"99-42","member_number":"A68898","first_name":"MARSHALL","last_name":"LITTLE","classification":"B","division":"PRODUCTION","hit_factor":0.4753},{"match_name":"LGCSEMPS 2017 SPECIAL CLASSIFIER","match_date":"2017-04-09","stage_classifiercode":"99-42","member_number":"FY96207","first_name":"DAVID","last_name":"MCNARNEY","classification":"C","division":"PRODUCTION","hit_factor":0.4322},{"match_name":"LGCSEMPS 2017 SPECIAL CLASSIFIER","match_date":"2017-04-09","stage_classifiercode":"99-42","member_number":"TY59102","first_name":"RON","last_name":"LAWLER","classification":"B","division":"PRODUCTION","hit_factor":0.4105},{"match_name":"APSC USPSA Special Classifier 04-02-16","match_date":"2016-04-02","stage_classifiercode":"99-42","member_number":"A88699","first_name":"DEREK","last_name":"GUTHRIE","classification":"C","division":"PRODUCTION","hit_factor":0.3922},{"match_name":"FRAPC USPSA  League 4","match_date":"2018-06-05","stage_classifiercode":"99-42","member_number":"A49494","first_name":"JACK","last_name":"STIRZL","classification":"\"\"","division":"PRODUCTION","hit_factor":0.3893},{"match_name":"PCWC USPSA 4 22 2017","match_date":"2017-04-22","stage_classifiercode":"99-42","member_number":"\"\"","first_name":"CHRIS","last_name":"GARRETT","classification":"U","division":"PRODUCTION","hit_factor":0.3609},{"match_name":"LIPSA - April 30th 2017 - USPSA Match Special Classifier","match_date":"2017-04-30","stage_classifiercode":"99-42","member_number":"TY101594","first_name":"LEO","last_name":"HE","classification":"U","division":"PRODUCTION","hit_factor":0.3555},{"match_name":"Crooked Creek Pistol League - April 2017","match_date":"2017-04-22","stage_classifiercode":"99-42","member_number":"\"\"","first_name":"BRIAN","last_name":"KLJUN","classification":"U","division":"PRODUCTION","hit_factor":0.3534},{"match_name":"Wvpps May2016","match_date":"2016-05-15","stage_classifiercode":"99-42","member_number":"TY82031","first_name":"JEFF","last_name":"JONES","classification":"B","division":"PRODUCTION","hit_factor":0.3401},{"match_name":"BSPSC  2016 NRS Slot Match","match_date":"2016-05-08","stage_classifiercode":"99-42","member_number":"\"\"","first_name":"ROBERT","last_name":"RAMSEY","classification":"\"\"","division":"PRODUCTION","hit_factor":0.3285},{"match_name":"BSPSC  2016 NRS Slot Match","match_date":"2016-05-08","stage_classifiercode":"99-42","member_number":"TY62923","first_name":"TERRY","last_name":"MCCREA","classification":"C","division":"PRODUCTION","hit_factor":0.2982},{"match_name":"MISS Match 11-2-16","match_date":"2016-10-31","stage_classifiercode":"99-42","member_number":"FY77479","first_name":"BRIAN","last_name":"MITCHELL","classification":"C","division":"PRODUCTION","hit_factor":0.2786},{"match_name":"Springfield Tactical Shooters 01-05-2017","match_date":"2017-01-05","stage_classifiercode":"99-42","member_number":"\"\"","first_name":"MIKEY","last_name":"ROWE","classification":"U","division":"PRODUCTION","hit_factor":0.2473},{"match_name":"EWPSA 2018-05","match_date":"2018-05-20","stage_classifiercode":"99-42","member_number":"A105870","first_name":"ERIK","last_name":"BECK","classification":"C","division":"PRODUCTION","hit_factor":0.2203},{"match_name":"APSC USPSA Special Classifier 04-02-16","match_date":"2016-04-02","stage_classifiercode":"99-42","member_number":"TY82918","first_name":"JOHN","last_name":"DONOVAN","classification":"U","division":"PRODUCTION","hit_factor":0.1515},{"match_name":"EWPSA 2018-05","match_date":"2018-05-20","stage_classifiercode":"99-42","member_number":"\"\"","first_name":"THOMAS","last_name":"BECK","classification":"U","division":"PRODUCTION","hit_factor":0.1012},{"match_name":"Enps May 2021 USPSA MATCH-All Classifier","match_date":"2021-05-02","stage_classifiercode":"99-42","member_number":"A132542","first_name":"REESE","last_name":"BOSWELL","classification":"U","division":"PRODUCTION","hit_factor":0.093},{"match_name":"Richmond Boro Gun Club March 2020 USPSA Match","match_date":"2020-03-14","stage_classifiercode":"99-42","member_number":"TY109293","first_name":"DANNY","last_name":"LEE","classification":"D","division":"PRODUCTION","hit_factor":0.0797},{"match_name":"HAS May 2016 Pistol Match","match_date":"2016-05-08","stage_classifiercode":"99-42","member_number":"A84331","first_name":"SCOTT","last_name":"HARRIS","classification":"D","division":"PRODUCTION","hit_factor":0.0773},{"match_name":"Richmond Borough Gun ClubJuly 1st 2017 USPSA Pistol Match","match_date":"2017-07-01","stage_classifiercode":"99-42","member_number":"A91897","first_name":"AL","last_name":"GAMA","classification":"D","division":"PRODUCTION","hit_factor":0.0437}]