[{"match_name":"OPSC USPSA 7-10-2016","match_date":"2016-07-10","stage_classifiercode":"13-01","member_number":"TY68791","first_name":"MICHAEL","last_name":"GNYRA","classification":"G","division":"LIMITED","hit_factor":10.9589},{"match_name":"SCCCApril2017","match_date":"2017-04-09","stage_classifiercode":"13-01","member_number":"\"\"","first_name":"MICHELE","last_name":"GA-NEER-UH","classification":"U","division":"LIMITED","hit_factor":9.375},{"match_name":"Minnetonka Game and Fish July 8th Match","match_date":"2020-07-08","stage_classifiercode":"13-01","member_number":"A78033","first_name":"CASEY","last_name":"REED","classification":"M","division":"LIMITED","hit_factor":9.3588},{"match_name":"PPPS 3-12-17","match_date":"2017-03-12","stage_classifiercode":"13-01","member_number":"L3320","first_name":"CHARLIE","last_name":"PEREZ","classification":"G","division":"LIMITED","hit_factor":9.3063},{"match_name":"NHRPC - October 2020 USPSA","match_date":"2020-10-10","stage_classifiercode":"13-01","member_number":"A94001","first_name":"NICK","last_name":"REYNOLDS","classification":"G","division":"LIMITED","hit_factor":9.3063},{"match_name":"USPSA MO21 2Alpha SBRC April 25 2020","match_date":"2020-04-25","stage_classifiercode":"13-01","member_number":"A93373","first_name":"T.J.","last_name":"KANE","classification":"G","division":"LIMITED","hit_factor":9.2803},{"match_name":"YVPS USPSA Oct 2021","match_date":"2021-10-09","stage_classifiercode":"13-01","member_number":"L3320","first_name":"CHARLIE","last_name":"PEREZ","classification":"G","division":"LIMITED","hit_factor":9.2784},{"match_name":"Red River Range October USPSA Level 1","match_date":"2021-10-27","stage_classifiercode":"13-01","member_number":"L4114","first_name":"JEFF","last_name":"SMITH","classification":"M","division":"LIMITED","hit_factor":9.2127},{"match_name":"SFA USPSA AUGUST 2018","match_date":"2018-08-18","stage_classifiercode":"13-01","member_number":"A84097","first_name":"GIANNI","last_name":"GIORDANO","classification":"M","division":"LIMITED","hit_factor":9.1667},{"match_name":"PCWC USPSA  9-25-2021","match_date":"2021-09-25","stage_classifiercode":"13-01","member_number":"A84544","first_name":"GERRIT","last_name":"HEINRICH","classification":"M","division":"LIMITED","hit_factor":9.0762},{"match_name":"CTASA 3rd Sunday USPSA at Triple C Tactical - 7-15-2018","match_date":"2018-07-15","stage_classifiercode":"13-01","member_number":"TY78648","first_name":"JOHNATHON","last_name":"MILLER","classification":"M","division":"LIMITED","hit_factor":8.982},{"match_name":"Fairfax PS USPSA August 2018","match_date":"2018-08-21","stage_classifiercode":"13-01","member_number":"TY103667","first_name":"KEANU","last_name":"SY","classification":"M","division":"LIMITED","hit_factor":8.8748},{"match_name":"PCWC USPSA  9-25-2021","match_date":"2021-09-25","stage_classifiercode":"13-01","member_number":"L3329","first_name":"CHAD","last_name":"THOMPSON","classification":"G","division":"LIMITED","hit_factor":8.8424},{"match_name":"Grandbaggers September 2017","match_date":"2017-09-07","stage_classifiercode":"13-01","member_number":"L3837","first_name":"NILS","last_name":"JOHNSON","classification":"G","division":"LIMITED","hit_factor":8.8328},{"match_name":"TCSC USPSA Level I September club match","match_date":"2020-09-27","stage_classifiercode":"13-01","member_number":"TY103667","first_name":"KEANU","last_name":"SY","classification":"M","division":"LIMITED","hit_factor":8.7171},{"match_name":"ORGC Tuesday Classifier CM 13-01 Disaster Factor","match_date":"2021-05-18","stage_classifiercode":"13-01","member_number":"A105445","first_name":"STEPHEN","last_name":"GEORGIA","classification":"A","division":"LIMITED","hit_factor":8.6179},{"match_name":"SLPSA May USPSA Match","match_date":"2020-05-16","stage_classifiercode":"13-01","member_number":"TY93975","first_name":"STEPAN","last_name":"GENERALOV","classification":"M","division":"LIMITED","hit_factor":8.5457},{"match_name":"WPGC 8-1-16","match_date":"2016-08-01","stage_classifiercode":"13-01","member_number":"L3320","first_name":"CHARLIE","last_name":"PEREZ","classification":"G","division":"LIMITED","hit_factor":8.489},{"match_name":"Clairton Apr 09; 2017","match_date":"2017-04-09","stage_classifiercode":"13-01","member_number":"A73017","first_name":"MIKE","last_name":"WITHROW","classification":"B","division":"LIMITED","hit_factor":8.4227},{"match_name":"BRSP Annual Members Only Tues Night USPSA Match - May 12","match_date":"2020-05-13","stage_classifiercode":"13-01","member_number":"TY97714","first_name":"JUSTIN","last_name":"LARKIN","classification":"M","division":"LIMITED","hit_factor":8.4158},{"match_name":"Strongpoint April 2018 USPSA Match","match_date":"2018-04-07","stage_classifiercode":"13-01","member_number":"L3119","first_name":"JOHN","last_name":"BROWNING","classification":"G","division":"LIMITED","hit_factor":8.3994},{"match_name":"ISPS January Impact","match_date":"2016-01-27","stage_classifiercode":"13-01","member_number":"A68393","first_name":"MATT","last_name":"EVANCIC","classification":"M","division":"LIMITED","hit_factor":8.3601},{"match_name":"HOPS USPSA 071517","match_date":"2017-07-15","stage_classifiercode":"13-01","member_number":"A90516","first_name":"JARED","last_name":"FOX","classification":"M","division":"LIMITED","hit_factor":8.3601},{"match_name":"Bitterroot Blasters March Club Match","match_date":"2016-03-26","stage_classifiercode":"13-01","member_number":"L2781","first_name":"SCOTT","last_name":"GIESICK","classification":"M","division":"LIMITED","hit_factor":8.3062},{"match_name":"CRC USPSA August 2021","match_date":"2021-08-14","stage_classifiercode":"13-01","member_number":"A68880","first_name":"JOSH","last_name":"WILGOCKI","classification":"M","division":"LIMITED","hit_factor":8.2892},{"match_name":"WELD ECO09 20180313","match_date":"2018-03-18","stage_classifiercode":"13-01","member_number":"TY32509","first_name":"MIKE","last_name":"WORTMAN","classification":"A","division":"LIMITED","hit_factor":8.2609},{"match_name":"SFPC October Trophy match","match_date":"2016-10-02","stage_classifiercode":"13-01","member_number":"TY68109","first_name":"BEN","last_name":"MIZRAHI","classification":"B","division":"LIMITED","hit_factor":8.2192},{"match_name":"SAPSC Monthly USPSA Classifier Match at ARO 20161020","match_date":"2016-10-20","stage_classifiercode":"13-01","member_number":"A90256","first_name":"KEEGAN","last_name":"SINGLETON","classification":"M","division":"LIMITED","hit_factor":8.189},{"match_name":"CGGR February USPSA Match","match_date":"2016-02-20","stage_classifiercode":"13-01","member_number":"TY39081","first_name":"ROB","last_name":"JESSEE","classification":"G","division":"LIMITED","hit_factor":8.179},{"match_name":"Bitterroot Blasters March Club Match","match_date":"2016-03-26","stage_classifiercode":"13-01","member_number":"a54245","first_name":"TIM","last_name":"THOMAS","classification":"A","division":"LIMITED","hit_factor":8.1514},{"match_name":"Shongum February 2017 USPSA Match","match_date":"2017-02-04","stage_classifiercode":"13-01","member_number":"\"\"","first_name":"SMIGEL","last_name":"CRAIG","classification":"M","division":"LIMITED","hit_factor":8.1361},{"match_name":"Eagle USPSA 03-29-2021","match_date":"2021-03-29","stage_classifiercode":"13-01","member_number":"fy70698","first_name":"JAY","last_name":"CARILLO","classification":"G","division":"LIMITED","hit_factor":8.1081},{"match_name":"PIPS 06-30-2021","match_date":"2021-06-30","stage_classifiercode":"13-01","member_number":"A101542","first_name":"COLIN","last_name":"MAXON","classification":"A","division":"LIMITED","hit_factor":8.0793},{"match_name":"LdF USPSA Match August 22 2020","match_date":"2020-08-22","stage_classifiercode":"13-01","member_number":"TY80157","first_name":"DAVE","last_name":"DEZAN","classification":"M","division":"LIMITED","hit_factor":8.046},{"match_name":"OPSC USPSA 7-10-2016","match_date":"2016-07-10","stage_classifiercode":"13-01","member_number":"TY69648","first_name":"STEVEN","last_name":"GALKA","classification":"M","division":"LIMITED","hit_factor":8.0425},{"match_name":"PPS CLASSIFIER MATCH 2020-02-25","match_date":"2020-02-26","stage_classifiercode":"13-01","member_number":"A98829","first_name":"ALEXIS","last_name":"PENA","classification":"U","division":"LIMITED","hit_factor":8},{"match_name":"Laser Ninja Dragon League MSA USPSA January 21st 2017","match_date":"2017-01-21","stage_classifiercode":"13-01","member_number":"A91005","first_name":"PRESTON","last_name":"CLARK","classification":"M","division":"LIMITED","hit_factor":7.9618},{"match_name":"RCSC USPSA 26 Feb 2017","match_date":"2017-02-26","stage_classifiercode":"13-01","member_number":"A63791","first_name":"JAMES","last_name":"ABENOJA","classification":"A","division":"LIMITED","hit_factor":7.9545},{"match_name":"CGGR February USPSA Match","match_date":"2016-02-20","stage_classifiercode":"13-01","member_number":"l3329","first_name":"CHAD","last_name":"THOMPSON","classification":"G","division":"LIMITED","hit_factor":7.946},{"match_name":"Applied IN25 USPSA October Classifier Match 2018","match_date":"2018-10-17","stage_classifiercode":"13-01","member_number":"L4004","first_name":"AARON","last_name":"LORTON","classification":"M","division":"LIMITED","hit_factor":7.9341},{"match_name":"ACC Oct Saturday 24th USPSA","match_date":"2020-10-24","stage_classifiercode":"13-01","member_number":"TY117950","first_name":"LANCE","last_name":"BARTON","classification":"A","division":"LIMITED","hit_factor":7.9268},{"match_name":"Low Country USPSA Mar 31st","match_date":"2018-03-31","stage_classifiercode":"13-01","member_number":"A108977","first_name":"RJ","last_name":"MCVOY","classification":"U","division":"LIMITED","hit_factor":7.8947},{"match_name":"SPSA USPSA October 1st Sat Match","match_date":"2020-10-03","stage_classifiercode":"13-01","member_number":"A68323","first_name":"JOSH","last_name":"LOTHER","classification":"M","division":"LIMITED","hit_factor":7.8788},{"match_name":"MCRC USPSA October 2018","match_date":"2018-10-13","stage_classifiercode":"13-01","member_number":"TY79433","first_name":"MARLIN","last_name":"FRY","classification":"A","division":"LIMITED","hit_factor":7.8571},{"match_name":"New Holland USPSA - October 2016","match_date":"2016-10-09","stage_classifiercode":"13-01","member_number":"A94001","first_name":"NICK","last_name":"REYNOLDS","classification":"B","division":"LIMITED","hit_factor":7.8519},{"match_name":"APSC USPSA Match 08-04-18","match_date":"2018-08-04","stage_classifiercode":"13-01","member_number":"TY34722","first_name":"LARRY","last_name":"SELLERS","classification":"M","division":"LIMITED","hit_factor":7.8459},{"match_name":"LdF USPSA Match August 22 2020","match_date":"2020-08-22","stage_classifiercode":"13-01","member_number":"L4294","first_name":"ALAN","last_name":"JENKINS","classification":"M","division":"LIMITED","hit_factor":7.8322},{"match_name":"NRG Saturday July 22nd- Classifier","match_date":"2017-07-22","stage_classifiercode":"13-01","member_number":"A83686","first_name":"DAVID","last_name":"KAFFEL","classification":"A","division":"LIMITED","hit_factor":7.8195},{"match_name":"Range54 USPSA Match","match_date":"2021-11-12","stage_classifiercode":"13-01","member_number":"a109772","first_name":"ANDREW","last_name":"GEE","classification":"A","division":"LIMITED","hit_factor":7.8148},{"match_name":"AIPS  USPSA Weekly 30 August 2016","match_date":"2016-08-30","stage_classifiercode":"13-01","member_number":"TY57269","first_name":"CRAIG","last_name":"TAPPE","classification":"G","division":"LIMITED","hit_factor":7.8125},{"match_name":"INAS Jan 2018 USPSA PM","match_date":"2018-01-22","stage_classifiercode":"13-01","member_number":"A49382","first_name":"BRENDAN","last_name":"NANGLE","classification":"A","division":"LIMITED","hit_factor":7.8035},{"match_name":"Sharp Practical Shooters December USPSA Match","match_date":"2018-12-30","stage_classifiercode":"13-01","member_number":"A111024","first_name":"JESSE","last_name":"CAMPBELL","classification":"B","division":"LIMITED","hit_factor":7.7844},{"match_name":"RCSC USPSA 26 Feb 2017","match_date":"2017-02-26","stage_classifiercode":"13-01","member_number":"TY64063","first_name":"CARLOS","last_name":"ANGUIANO","classification":"M","division":"LIMITED","hit_factor":7.7496},{"match_name":"MCRC USPSA October 2018","match_date":"2018-10-13","stage_classifiercode":"13-01","member_number":"TY53092","first_name":"DEWEY","last_name":"HUTSON","classification":"M","division":"LIMITED","hit_factor":7.7496},{"match_name":"TCSC USPSA Level I September club match","match_date":"2020-09-27","stage_classifiercode":"13-01","member_number":"A80174","first_name":"JOHNATHAN","last_name":"PEPPER","classification":"B","division":"LIMITED","hit_factor":7.7372},{"match_name":"Palmetto Gun Club - January 2016 USPSA","match_date":"2016-01-02","stage_classifiercode":"13-01","member_number":"TY83202","first_name":"BRIAN","last_name":"SMITH","classification":"A","division":"LIMITED","hit_factor":7.6596},{"match_name":"Rankin Field Sunday USPSA","match_date":"2018-06-17","stage_classifiercode":"13-01","member_number":"A73456","first_name":"JORDAN","last_name":"HALL","classification":"M","division":"LIMITED","hit_factor":7.6539},{"match_name":"Sharp Practical Shooters December USPSA Match","match_date":"2018-12-30","stage_classifiercode":"13-01","member_number":"A87751","first_name":"DYLAN","last_name":"ERVIN","classification":"M","division":"LIMITED","hit_factor":7.6233},{"match_name":"USPSA MO21 2Alpha SBRC April 25 2020","match_date":"2020-04-25","stage_classifiercode":"13-01","member_number":"A98829","first_name":"ALEXIS","last_name":"PENA","classification":"A","division":"LIMITED","hit_factor":7.6006},{"match_name":"COPS Jan 2016 USPSA Match","match_date":"2016-01-03","stage_classifiercode":"13-01","member_number":"A73587","first_name":"COLIN","last_name":"WALTERS","classification":"A","division":"LIMITED","hit_factor":7.5967},{"match_name":"LdF USPSA Match August 22 2020","match_date":"2020-08-22","stage_classifiercode":"13-01","member_number":"L3216","first_name":"CRAIG","last_name":"UNDERDOWN","classification":"M","division":"LIMITED","hit_factor":7.5899},{"match_name":"PRG - Oh Shoot  March 20th - 3rd Saturday Match","match_date":"2021-03-20","stage_classifiercode":"13-01","member_number":"Ty102539","first_name":"THOMAS","last_name":"MILLER","classification":"B","division":"LIMITED","hit_factor":7.5881},{"match_name":"WELD ECO09 20180313","match_date":"2018-03-18","stage_classifiercode":"13-01","member_number":"A91485","first_name":"RYAN","last_name":"EMMITE","classification":"B","division":"LIMITED","hit_factor":7.5873},{"match_name":"NAAS 2018-01-21 Special Classifier Match","match_date":"2018-01-21","stage_classifiercode":"13-01","member_number":"A85054","first_name":"ROB","last_name":"CHAVOUS","classification":"U","division":"LIMITED","hit_factor":7.5862},{"match_name":"Buas February Match","match_date":"2016-02-14","stage_classifiercode":"13-01","member_number":"TY73127","first_name":"SEAN","last_name":"JANICKI","classification":"U","division":"LIMITED","hit_factor":7.5843},{"match_name":"SCCCApril2017","match_date":"2017-04-09","stage_classifiercode":"13-01","member_number":"ty54513","first_name":"CHRISTOPHER","last_name":"OLKA","classification":"A","division":"LIMITED","hit_factor":7.5843},{"match_name":"WY02 GTS 5.5.18","match_date":"2018-05-05","stage_classifiercode":"13-01","member_number":"A41410","first_name":"PAUL","last_name":"NASH","classification":"B","division":"LIMITED","hit_factor":7.5653},{"match_name":"ISPS Nov 5th 2016","match_date":"2016-11-05","stage_classifiercode":"13-01","member_number":"A84532","first_name":"KENNETH","last_name":"PLATT","classification":"G","division":"LIMITED","hit_factor":7.5653},{"match_name":"Clairton Apr 09; 2017","match_date":"2017-04-09","stage_classifiercode":"13-01","member_number":"76954","first_name":"DANIEL","last_name":"PACELLA","classification":"M","division":"LIMITED","hit_factor":7.5472},{"match_name":"Idaho ISPS August 4th 2018","match_date":"2018-08-04","stage_classifiercode":"13-01","member_number":"a75553","first_name":"MARK","last_name":"WEAVER","classification":"M","division":"LIMITED","hit_factor":7.4967},{"match_name":"Rio Salado UPPL 2nd Sunday January 2020","match_date":"2020-01-11","stage_classifiercode":"13-01","member_number":"A77381","first_name":"KELLY","last_name":"FLETCHER","classification":"A","division":"LIMITED","hit_factor":7.4753},{"match_name":"GRB USPSA SEPTEMBER 2021 AT CAVALIER","match_date":"2021-09-18","stage_classifiercode":"13-01","member_number":"L4602","first_name":"STEPHEN","last_name":"TO","classification":"A","division":"LIMITED","hit_factor":7.4695},{"match_name":"Hopkinton USPSA July 2018","match_date":"2018-07-07","stage_classifiercode":"13-01","member_number":"TY76424","first_name":"HARRISON","last_name":"SCHMIDT","classification":"A","division":"LIMITED","hit_factor":7.4607},{"match_name":"Hopkinton USPSA July 2018","match_date":"2018-07-07","stage_classifiercode":"13-01","member_number":"TY90354","first_name":"BRIAN","last_name":"HARRINGTON","classification":"A","division":"LIMITED","hit_factor":7.4605},{"match_name":"ORPCI 2016.03.19 Pistol","match_date":"2016-03-19","stage_classifiercode":"13-01","member_number":"TY35546","first_name":"MIKE","last_name":"MOORE","classification":"A","division":"LIMITED","hit_factor":7.451},{"match_name":"Low Country USPSA Mar 31st","match_date":"2018-03-31","stage_classifiercode":"13-01","member_number":"TY79433","first_name":"MARLIN","last_name":"FRY","classification":"A","division":"LIMITED","hit_factor":7.451},{"match_name":"Strongpoint April 2018 USPSA Match","match_date":"2018-04-07","stage_classifiercode":"13-01","member_number":"FY89922","first_name":"CHRIS","last_name":"WORKMAN","classification":"B","division":"LIMITED","hit_factor":7.4413},{"match_name":"SAPSC Monthly USPSA Classifier Match at ARO 20161020","match_date":"2016-10-20","stage_classifiercode":"13-01","member_number":"A90256","first_name":"KEEGAN","last_name":"SINGLETON","classification":"M","division":"LIMITED","hit_factor":7.4392},{"match_name":"BRC_20160313","match_date":"2016-03-13","stage_classifiercode":"13-01","member_number":"TY54845","first_name":"MARK","last_name":"MUTZ","classification":"X","division":"LIMITED","hit_factor":7.4344},{"match_name":"1/8/17 GMPS","match_date":"2017-01-08","stage_classifiercode":"13-01","member_number":"A68740","first_name":"JAMES","last_name":"FUCCI","classification":"G","division":"LIMITED","hit_factor":7.4324},{"match_name":"BUAS November Match","match_date":"2018-11-04","stage_classifiercode":"13-01","member_number":"TY73127","first_name":"SEAN","last_name":"JANICKI","classification":"M","division":"LIMITED","hit_factor":7.4236},{"match_name":"USPSA MO21 2Alpha SBRC April 25 2020","match_date":"2020-04-25","stage_classifiercode":"13-01","member_number":"FY78276","first_name":"CRAIG","last_name":"OKENFUSS","classification":"M","division":"LIMITED","hit_factor":7.4176},{"match_name":"Patriot Action Shooters December 2015 Match","match_date":"2015-12-19","stage_classifiercode":"13-01","member_number":"TY46913","first_name":"MARK L","last_name":"MILLER","classification":"B","division":"LIMITED","hit_factor":7.4172},{"match_name":"Renton USPSA May 2018 - NW05","match_date":"2018-05-27","stage_classifiercode":"13-01","member_number":"TY55787","first_name":"VINH","last_name":"HOANG","classification":"M","division":"LIMITED","hit_factor":7.4128},{"match_name":"DSC September 2016","match_date":"2016-09-18","stage_classifiercode":"13-01","member_number":"A71307","first_name":"RYAN","last_name":"SPENCER","classification":"A","division":"LIMITED","hit_factor":7.4074},{"match_name":"JCSSA NOV 7 2020","match_date":"2020-11-07","stage_classifiercode":"13-01","member_number":"A86465","first_name":"JUSTIN","last_name":"SHIELDS","classification":"B","division":"LIMITED","hit_factor":7.4026},{"match_name":"WELD ECO09 20180313","match_date":"2018-03-18","stage_classifiercode":"13-01","member_number":"A104773","first_name":"MATT","last_name":"GALLANT","classification":"C","division":"LIMITED","hit_factor":7.4018},{"match_name":"USPSA MO21 2Alpha SBRC April 25 2020","match_date":"2020-04-25","stage_classifiercode":"13-01","member_number":"A90516","first_name":"JARED","last_name":"FOX","classification":"M","division":"LIMITED","hit_factor":7.3969},{"match_name":"Patriot Action Shooters December 2015 Match","match_date":"2015-12-19","stage_classifiercode":"13-01","member_number":"FY71339","first_name":"ACE","last_name":"BOLES","classification":"G","division":"LIMITED","hit_factor":7.3836},{"match_name":"GPSL 7-10-2018","match_date":"2018-07-10","stage_classifiercode":"13-01","member_number":"A52643","first_name":"STEPHEN","last_name":"LEE","classification":"B","division":"LIMITED","hit_factor":7.3713},{"match_name":"ENPS April USPSA Match","match_date":"2017-04-02","stage_classifiercode":"13-01","member_number":"A85168","first_name":"CODY","last_name":"AXON","classification":"U","division":"LIMITED","hit_factor":7.365},{"match_name":"NHRPC - August 2016 USPSA","match_date":"2016-08-14","stage_classifiercode":"13-01","member_number":"A-94001","first_name":"NICK","last_name":"REYNOLDS","classification":"C","division":"LIMITED","hit_factor":7.3611},{"match_name":"Nampa USPSA September 20th 2020","match_date":"2020-09-20","stage_classifiercode":"13-01","member_number":"A75553","first_name":"MARK","last_name":"WEAVER","classification":"M","division":"LIMITED","hit_factor":7.3569},{"match_name":"OPSC USPSA 7-10-2016","match_date":"2016-07-10","stage_classifiercode":"13-01","member_number":"A67043","first_name":"DON","last_name":"FREDENHAGEN","classification":"B","division":"LIMITED","hit_factor":7.3365},{"match_name":"ORPCI 2018.03.31 USPSA Special","match_date":"2018-03-31","stage_classifiercode":"13-01","member_number":"TY78920","first_name":"MIKE","last_name":"MOSER","classification":"M","division":"LIMITED","hit_factor":7.3353},{"match_name":"ORPCI 2018.03.31 USPSA Special","match_date":"2018-03-31","stage_classifiercode":"13-01","member_number":"TY79695","first_name":"JOHN","last_name":"VLIEGER","classification":"M","division":"LIMITED","hit_factor":7.3333},{"match_name":"ISPS Nov 5th 2016","match_date":"2016-11-05","stage_classifiercode":"13-01","member_number":"A75553","first_name":"MARK","last_name":"WEAVER","classification":"A","division":"LIMITED","hit_factor":7.3107},{"match_name":"MRCPS USPSA Feb    2016","match_date":"2016-02-21","stage_classifiercode":"13-01","member_number":"A76039","first_name":"PAUL","last_name":"COTIE","classification":"M","division":"LIMITED","hit_factor":7.2993},{"match_name":"Tarheel USPSA July 2016","match_date":"2016-07-09","stage_classifiercode":"13-01","member_number":"\"\"","first_name":"PAUL","last_name":"BAKER","classification":"U","division":"LIMITED","hit_factor":7.275},{"match_name":"SLOSA January 2018 USPSA MATCH","match_date":"2018-01-13","stage_classifiercode":"13-01","member_number":"A82686","first_name":"CASEY","last_name":"RYAN","classification":"U","division":"LIMITED","hit_factor":7.2727},{"match_name":"FSA USPSA 12/30/2018 WI 22","match_date":"2018-12-30","stage_classifiercode":"13-01","member_number":"A97566","first_name":"ERIC","last_name":"ROGERS","classification":"B","division":"LIMITED","hit_factor":7.2678},{"match_name":"Tarheel USPSA July 2016","match_date":"2016-07-09","stage_classifiercode":"13-01","member_number":"A93068","first_name":"JEFF","last_name":"WALLACE","classification":"C","division":"LIMITED","hit_factor":7.2633},{"match_name":"MVPSA Apr 72018","match_date":"2018-04-07","stage_classifiercode":"13-01","member_number":"A103560","first_name":"RILEY","last_name":"COOPER","classification":"U","division":"LIMITED","hit_factor":7.2483},{"match_name":"Tehama Shooters May 2020 USPSA","match_date":"2020-05-23","stage_classifiercode":"13-01","member_number":"A96344","first_name":"RON","last_name":"HILDEBRANT","classification":"M","division":"LIMITED","hit_factor":7.2178},{"match_name":"CCPS  USPSA  2016 July","match_date":"2016-07-17","stage_classifiercode":"13-01","member_number":"TY53551","first_name":"JOHN G","last_name":"BILLS","classification":"A","division":"LIMITED","hit_factor":7.2122},{"match_name":"GRPC USPSA SOME LIKE IT HOT","match_date":"2018-08-05","stage_classifiercode":"13-01","member_number":"TY101025","first_name":"VINH","last_name":"LAM","classification":"A","division":"LIMITED","hit_factor":7.2096},{"match_name":"AAFG USPSA Special Classifier April 29  2017","match_date":"2017-04-23","stage_classifiercode":"13-01","member_number":"A82072","first_name":"AL","last_name":"MONCH","classification":"B","division":"LIMITED","hit_factor":7.2011},{"match_name":"RCSC USPSA 26 Feb 2017","match_date":"2017-02-26","stage_classifiercode":"13-01","member_number":"A87599","first_name":"ADRIAN","last_name":"HERNANDEZ","classification":"C","division":"LIMITED","hit_factor":7.2011},{"match_name":"Idaho ISPS August 4th 2018","match_date":"2018-08-04","stage_classifiercode":"13-01","member_number":"TY84532","first_name":"KENNY","last_name":"PLATT","classification":"G","division":"LIMITED","hit_factor":7.1831},{"match_name":"PRG Pistol Match 5 Feb 2017","match_date":"2017-02-04","stage_classifiercode":"13-01","member_number":"A75787","first_name":"MIKE","last_name":"DIXON","classification":"A","division":"LIMITED","hit_factor":7.1719},{"match_name":"Danville Rifle and Pistol Club USPSA IL17 Classifier Match August 18th 2018","match_date":"2018-08-18","stage_classifiercode":"13-01","member_number":"A106367","first_name":"DANIEL","last_name":"MATHIAS","classification":"B","division":"LIMITED","hit_factor":7.1703},{"match_name":"NHRPC - October 2020 USPSA","match_date":"2020-10-10","stage_classifiercode":"13-01","member_number":"A92036","first_name":"MIKE","last_name":"MCKERNS","classification":"B","division":"LIMITED","hit_factor":7.1703},{"match_name":"NRG December 10th 2016","match_date":"2016-12-10","stage_classifiercode":"13-01","member_number":"TY63633","first_name":"MATT","last_name":"BUNNING","classification":"B","division":"LIMITED","hit_factor":7.1531},{"match_name":"Dundee Practical Shooters - June 10 2020 - Summer Series","match_date":"2020-06-11","stage_classifiercode":"13-01","member_number":"TY78052","first_name":"SERGE","last_name":"DAVIS","classification":"M","division":"LIMITED","hit_factor":7.1429},{"match_name":"PCWC USPSA  7 23 2016","match_date":"2016-07-23","stage_classifiercode":"13-01","member_number":"A90780","first_name":"RYAN","last_name":"CARVER","classification":"A","division":"LIMITED","hit_factor":7.1429},{"match_name":"SEPSA June 2016","match_date":"2016-06-11","stage_classifiercode":"13-01","member_number":"TY84112","first_name":"BRAD","last_name":"WALKER","classification":"B","division":"LIMITED","hit_factor":7.1334},{"match_name":"EAPS  January 2016","match_date":"2016-01-17","stage_classifiercode":"13-01","member_number":"TY59545","first_name":"MICHAEL","last_name":"HUTCHINSON","classification":"A","division":"LIMITED","hit_factor":7.1331},{"match_name":"NTPS-SE February 2017","match_date":"2017-02-18","stage_classifiercode":"13-01","member_number":"TY65912","first_name":"AARON","last_name":"HOWALD","classification":"M","division":"LIMITED","hit_factor":7.1331},{"match_name":"MSSA USPSA","match_date":"2016-11-06","stage_classifiercode":"13-01","member_number":"A91827","first_name":"PRESTON","last_name":"KING","classification":"B","division":"LIMITED","hit_factor":7.124},{"match_name":"Devil Dog USPSA Classifier Match-Saturday Session","match_date":"2018-03-10","stage_classifiercode":"13-01","member_number":"A101383","first_name":"JERRY","last_name":"BRAY","classification":"C","division":"LIMITED","hit_factor":7.124},{"match_name":"DSS - USPSA - 2020 Club Championship","match_date":"2020-08-08","stage_classifiercode":"13-01","member_number":"A111100","first_name":"RAMEEN","last_name":"SALEHI","classification":"A","division":"LIMITED","hit_factor":7.1151},{"match_name":"OPSC USPSA OCTOBER 2018","match_date":"2018-10-14","stage_classifiercode":"13-01","member_number":"A78070","first_name":"MARK","last_name":"SORENSEN","classification":"M","division":"LIMITED","hit_factor":7.1031},{"match_name":"Rankin Field Sunday USPSA","match_date":"2018-06-17","stage_classifiercode":"13-01","member_number":"\"\"","first_name":"GREG","last_name":"VAUGHN","classification":"A","division":"LIMITED","hit_factor":7.0976},{"match_name":"MS06 Team Magnolia July 2017 USPSA Match","match_date":"2017-07-01","stage_classifiercode":"13-01","member_number":"A81552","first_name":"RUSS","last_name":"SMITH","classification":"B","division":"LIMITED","hit_factor":7.0876},{"match_name":"NHRPC - August 2016 USPSA","match_date":"2016-08-14","stage_classifiercode":"13-01","member_number":"A78332","first_name":"JAKE","last_name":"DEGENSHEIN","classification":"A","division":"LIMITED","hit_factor":7.0876},{"match_name":"Rankin Field April (ALL CLASSIFIER) Saturday USPSA","match_date":"2021-04-03","stage_classifiercode":"13-01","member_number":"L4505","first_name":"GREG","last_name":"VAUGHN","classification":"A","division":"LIMITED","hit_factor":7.0866},{"match_name":"Hopkinton USPSA July 2018","match_date":"2018-07-07","stage_classifiercode":"13-01","member_number":"A84437","first_name":"SEBASTIAN","last_name":"YORDAN","classification":"A","division":"LIMITED","hit_factor":7.0833},{"match_name":"Green Valley September 2016","match_date":"2016-09-24","stage_classifiercode":"13-01","member_number":"TY71534","first_name":"PETER","last_name":"EIBERGER","classification":"A","division":"LIMITED","hit_factor":7.0785},{"match_name":"The Armory Indoor League","match_date":"2016-03-11","stage_classifiercode":"13-01","member_number":"A91848","first_name":"AUSTIN","last_name":"BLAIN","classification":"U","division":"LIMITED","hit_factor":7.0773},{"match_name":"BHPSC Weekly Match 9-30-2016","match_date":"2016-09-30","stage_classifiercode":"13-01","member_number":"\"\"","first_name":"JUSTIN","last_name":"MCELROY","classification":"U","division":"LIMITED","hit_factor":7.0603},{"match_name":"MSSA USPSA June  10 2017","match_date":"2017-06-10","stage_classifiercode":"13-01","member_number":"\"\"","first_name":"HUNTER","last_name":"SYKES","classification":"\"\"","division":"LIMITED","hit_factor":7.0556},{"match_name":"SWGC USPSA Pistol Match - February 2021","match_date":"2021-02-06","stage_classifiercode":"13-01","member_number":"L4602","first_name":"STEPHEN","last_name":"TO","classification":"A","division":"LIMITED","hit_factor":7.0504},{"match_name":"DWB - Deadwood Boys USPSA February 4 2018","match_date":"2018-02-04","stage_classifiercode":"13-01","member_number":"TY83392","first_name":"JON","last_name":"BARRETT","classification":"A","division":"LIMITED","hit_factor":7.0461},{"match_name":"MVPSA Apr 72018","match_date":"2018-04-07","stage_classifiercode":"13-01","member_number":"A68393","first_name":"MATTHEW","last_name":"EVANCIC","classification":"M","division":"LIMITED","hit_factor":7.0352},{"match_name":"PSAC_20170527","match_date":"2017-05-27","stage_classifiercode":"13-01","member_number":"A28779","first_name":"PAUL JR","last_name":"CLARK","classification":"X","division":"LIMITED","hit_factor":7.0201},{"match_name":"Alpha Mike June 2016","match_date":"2016-06-19","stage_classifiercode":"13-01","member_number":"A83062","first_name":"PAUL","last_name":"WILLIAMS","classification":"A","division":"LIMITED","hit_factor":7.0199},{"match_name":"PCSI March 2016 USPSA","match_date":"2016-03-05","stage_classifiercode":"13-01","member_number":"A57535","first_name":"JASON","last_name":"CONRAD","classification":"none","division":"LIMITED","hit_factor":7.0197},{"match_name":"Havana May 7 2016 USPSA Match","match_date":"2016-05-07","stage_classifiercode":"13-01","member_number":"Ty76261","first_name":"DAN","last_name":"LONG","classification":"C","division":"LIMITED","hit_factor":7.0048},{"match_name":"ISPS Nov 5th 2016","match_date":"2016-11-05","stage_classifiercode":"13-01","member_number":"TY81469","first_name":"ERIC","last_name":"STEINER","classification":"M","division":"LIMITED","hit_factor":6.9909},{"match_name":"Clinton County USPSA","match_date":"2016-03-26","stage_classifiercode":"13-01","member_number":"\"\"","first_name":"BEN","last_name":"WEST","classification":"A","division":"LIMITED","hit_factor":6.9876},{"match_name":"MRCPS USPSA Feb    2016","match_date":"2016-02-21","stage_classifiercode":"13-01","member_number":"A83199","first_name":"ANDREW","last_name":"HONG","classification":"M","division":"LIMITED","hit_factor":6.9767},{"match_name":"PCSI March 2016 USPSA","match_date":"2016-03-05","stage_classifiercode":"13-01","member_number":"TY81742","first_name":"BEN","last_name":"WEST","classification":"none","division":"LIMITED","hit_factor":6.9697},{"match_name":"MVPSA Apr 72018","match_date":"2018-04-07","stage_classifiercode":"13-01","member_number":"A85985","first_name":"CHRISTOPHER","last_name":"COLLINS","classification":"C","division":"LIMITED","hit_factor":6.9672},{"match_name":"SAPS Match 1/04/2020","match_date":"2020-01-04","stage_classifiercode":"13-01","member_number":"l2628","first_name":"SALIM","last_name":"DOMINGUEZ","classification":"A","division":"LIMITED","hit_factor":6.9612},{"match_name":"1/8/17 GMPS","match_date":"2017-01-08","stage_classifiercode":"13-01","member_number":"A67962","first_name":"MAC","last_name":"CASHIN","classification":"M","division":"LIMITED","hit_factor":6.9554},{"match_name":"LTD Pistol - May 2017","match_date":"2017-05-06","stage_classifiercode":"13-01","member_number":"\"\"","first_name":"NIK","last_name":"PARKER","classification":"U","division":"LIMITED","hit_factor":6.9444},{"match_name":"AIPS  USPSA Weekly 30 August 2016","match_date":"2016-08-30","stage_classifiercode":"13-01","member_number":"A71452","first_name":"JON","last_name":"FISHER","classification":"A","division":"LIMITED","hit_factor":6.9388},{"match_name":"Idaho ISPS August 4th 2018","match_date":"2018-08-04","stage_classifiercode":"13-01","member_number":"A-02669","first_name":"JIM","last_name":"WALL","classification":"G","division":"LIMITED","hit_factor":6.9348},{"match_name":"LdF USPSA Match August 22 2020","match_date":"2020-08-22","stage_classifiercode":"13-01","member_number":"FY63382","first_name":"MICHAEL","last_name":"SUEDA","classification":"M","division":"LIMITED","hit_factor":6.9333},{"match_name":"Red River Range October USPSA Level 1","match_date":"2021-10-27","stage_classifiercode":"13-01","member_number":"TY117184","first_name":"KEVIN","last_name":"WOOD","classification":"U","division":"LIMITED","hit_factor":6.9307},{"match_name":"RMAP 3rd sunday August 2017","match_date":"2017-08-20","stage_classifiercode":"13-01","member_number":"A61313","first_name":"BRETT","last_name":"BERG","classification":"M","division":"LIMITED","hit_factor":6.9156},{"match_name":"Tarheel USPSA July 2016","match_date":"2016-07-09","stage_classifiercode":"13-01","member_number":"\"\"","first_name":"RYAN","last_name":"CARVER","classification":"A","division":"LIMITED","hit_factor":6.9057},{"match_name":"Buas February Match","match_date":"2016-02-14","stage_classifiercode":"13-01","member_number":"A70318","first_name":"JOE","last_name":"DEMAGGIO","classification":"C","division":"LIMITED","hit_factor":6.8966},{"match_name":"SFPC October Trophy match","match_date":"2016-10-02","stage_classifiercode":"13-01","member_number":"FY57013","first_name":"KFIR","last_name":"LEBOVICH","classification":"A","division":"LIMITED","hit_factor":6.8966},{"match_name":"USPSA Basics - all classifier 27JULY2021","match_date":"2021-07-27","stage_classifiercode":"13-01","member_number":"Ty119938","first_name":"MARCO","last_name":"ARIAS","classification":"B","division":"LIMITED","hit_factor":6.8966},{"match_name":"SPSA USPSA August 4th Sat match","match_date":"2016-08-27","stage_classifiercode":"13-01","member_number":"A78495","first_name":"BILL","last_name":"KEULER","classification":"B","division":"LIMITED","hit_factor":6.8966},{"match_name":"SAPS Match 1/04/2020","match_date":"2020-01-04","stage_classifiercode":"13-01","member_number":"FY88974","first_name":"JUSTIN","last_name":"SMITH","classification":"A","division":"LIMITED","hit_factor":6.8858},{"match_name":"DSS - USPSA - 2020 Club Championship","match_date":"2020-08-08","stage_classifiercode":"13-01","member_number":"A101411","first_name":"JIM","last_name":"PAPPAS","classification":"A","division":"LIMITED","hit_factor":6.8742},{"match_name":"WELD ECO09 20180313","match_date":"2018-03-18","stage_classifiercode":"13-01","member_number":"FY72585","first_name":"TRUNG","last_name":"NGUYEN","classification":"A","division":"LIMITED","hit_factor":6.8692},{"match_name":"Competitive Shooters of Lake Norman CORNELIUS Thursday Evening Indoor USPSA Pistol Match North Carolina","match_date":"2018-04-05","stage_classifiercode":"13-01","member_number":"TY72553","first_name":"BRIAN","last_name":"DEMMA","classification":"A","division":"LIMITED","hit_factor":6.8564},{"match_name":"OPSC USPSA OCTOBER 2018","match_date":"2018-10-14","stage_classifiercode":"13-01","member_number":"L3823","first_name":"RICHARD","last_name":"GEGZNAS","classification":"A","division":"LIMITED","hit_factor":6.8441},{"match_name":"ALL CLASSIFIER SUMMERSLAM  -  AREA 59 2018","match_date":"2018-06-30","stage_classifiercode":"13-01","member_number":"FY46389","first_name":"DON","last_name":"SANDERS","classification":"A","division":"LIMITED","hit_factor":6.8123},{"match_name":"SPSA USPSA August 4th Sat match","match_date":"2016-08-27","stage_classifiercode":"13-01","member_number":"A79003","first_name":"ASHLEY","last_name":"RHEUARK","classification":"A","division":"LIMITED","hit_factor":6.7961},{"match_name":"BAPS USPSA October","match_date":"2018-10-20","stage_classifiercode":"13-01","member_number":"TY87524","first_name":"BRUCE","last_name":"MEUTH","classification":"B","division":"LIMITED","hit_factor":6.7925},{"match_name":"BPSA January 2017 USPSA","match_date":"2017-01-22","stage_classifiercode":"13-01","member_number":"A76040","first_name":"STEVEN","last_name":"MOSHER","classification":"A","division":"LIMITED","hit_factor":6.7909},{"match_name":"PGC USPSA  Practice Match 11-28-17","match_date":"2017-11-28","stage_classifiercode":"13-01","member_number":"TY62910","first_name":"LARRY","last_name":"SCOTT","classification":"B","division":"LIMITED","hit_factor":6.7885},{"match_name":"GAS September 2020 USPSA","match_date":"2020-09-05","stage_classifiercode":"13-01","member_number":"TY101587","first_name":"SKEET","last_name":"\"ARCHER \"\"ROOSTER\"\"\"","classification":"B","division":"LIMITED","hit_factor":6.7839},{"match_name":"Richmond Hot Shots Dec 2-3-2017 USPSA Pistol Match","match_date":"2017-12-02","stage_classifiercode":"13-01","member_number":"FY63012","first_name":"MANUEL","last_name":"NEWMAN","classification":"M","division":"LIMITED","hit_factor":6.7797},{"match_name":"Laser Ninja Dragon League MSA USPSA January 21st 2017","match_date":"2017-01-21","stage_classifiercode":"13-01","member_number":"TY75346","first_name":"CALVIN","last_name":"SMILEY","classification":"B","division":"LIMITED","hit_factor":6.7734},{"match_name":"Palmetto Gun Club - January 2016 USPSA","match_date":"2016-01-02","stage_classifiercode":"13-01","member_number":"TY66707","first_name":"WALLY","last_name":"BURBAGE","classification":"A","division":"LIMITED","hit_factor":6.7708},{"match_name":"Low Country USPSA Mar 31st","match_date":"2018-03-31","stage_classifiercode":"13-01","member_number":"TY94292","first_name":"TJ","last_name":"MEYERS","classification":"A","division":"LIMITED","hit_factor":6.7708},{"match_name":"COPS Jan 2016 USPSA Match","match_date":"2016-01-03","stage_classifiercode":"13-01","member_number":"A64553","first_name":"DAVID","last_name":"MARLOW","classification":"U","division":"LIMITED","hit_factor":6.7659},{"match_name":"Mvpsa April 2","match_date":"2016-04-02","stage_classifiercode":"13-01","member_number":"A84593","first_name":"JESSE","last_name":"POSELEY","classification":"B","division":"LIMITED","hit_factor":6.7588},{"match_name":"RCPS USPSA 9 Jan 2016 Special Classifier Match","match_date":"2016-01-09","stage_classifiercode":"13-01","member_number":"A82589","first_name":"ROBERT","last_name":"COPPENS","classification":"U","division":"LIMITED","hit_factor":6.7568},{"match_name":"Low Country USPSA Mar 31st","match_date":"2018-03-31","stage_classifiercode":"13-01","member_number":"A49560","first_name":"LACY","last_name":"LOCKLEAR","classification":"B","division":"LIMITED","hit_factor":6.7516},{"match_name":"CGGR February USPSA Match","match_date":"2016-02-20","stage_classifiercode":"13-01","member_number":"L3700","first_name":"NATHAN","last_name":"CARTER","classification":"A","division":"LIMITED","hit_factor":6.7358},{"match_name":"Shasta Shooters 2020 Jan","match_date":"2020-01-11","stage_classifiercode":"13-01","member_number":"A96344","first_name":"RON","last_name":"HILDEBRANT","classification":"M","division":"LIMITED","hit_factor":6.7358},{"match_name":"HOPS USPSA 071517","match_date":"2017-07-15","stage_classifiercode":"13-01","member_number":"TY21785","first_name":"JIM","last_name":"MISTLER","classification":"A","division":"LIMITED","hit_factor":6.727},{"match_name":"OPSC USPSA OCTOBER 2018","match_date":"2018-10-14","stage_classifiercode":"13-01","member_number":"A69369","first_name":"GLENN","last_name":"NYENHUIS","classification":"B","division":"LIMITED","hit_factor":6.727},{"match_name":"17s PSC - USPSA - July 2020","match_date":"2020-07-18","stage_classifiercode":"13-01","member_number":"TY34715","first_name":"TONY","last_name":"ELY","classification":"A","division":"LIMITED","hit_factor":6.7227},{"match_name":"PCWC USPSA  9-25-2021","match_date":"2021-09-25","stage_classifiercode":"13-01","member_number":"L4602","first_name":"STEPHEN","last_name":"TO","classification":"A","division":"LIMITED","hit_factor":6.7133},{"match_name":"Low Country USPSA Mar 31st","match_date":"2018-03-31","stage_classifiercode":"13-01","member_number":"A96755","first_name":"TIM","last_name":"REGRUT","classification":"C","division":"LIMITED","hit_factor":6.7066},{"match_name":"Palmetto Gun Club - January 2016 USPSA","match_date":"2016-01-02","stage_classifiercode":"13-01","member_number":"A62570","first_name":"MIKE","last_name":"ADAMS","classification":"B","division":"LIMITED","hit_factor":6.6998},{"match_name":"SLPSA Feb USPSA","match_date":"2018-02-17","stage_classifiercode":"13-01","member_number":"A51363","first_name":"KENNY","last_name":"TERRY","classification":"G","division":"LIMITED","hit_factor":6.6775},{"match_name":"PCWC USPSA  7 23 2016","match_date":"2016-07-23","stage_classifiercode":"13-01","member_number":"L729","first_name":"ROBERT","last_name":"WALKER","classification":"M","division":"LIMITED","hit_factor":6.6756},{"match_name":"Schultz March USPSA match","match_date":"2020-03-08","stage_classifiercode":"13-01","member_number":"A117250","first_name":"STEPHEN","last_name":"STYZA","classification":"C","division":"LIMITED","hit_factor":6.6751},{"match_name":"Shasta Shooters 2020 Jan","match_date":"2020-01-11","stage_classifiercode":"13-01","member_number":"L4425","first_name":"MITCH","last_name":"MORA","classification":"M","division":"LIMITED","hit_factor":6.6749},{"match_name":"MS06 Team Magnolia July 2017 USPSA Match","match_date":"2017-07-01","stage_classifiercode":"13-01","member_number":"A77712","first_name":"STEVEN","last_name":"SANDERS","classification":"G","division":"LIMITED","hit_factor":6.6587},{"match_name":"Sharp Practical Shooters December USPSA Match","match_date":"2018-12-30","stage_classifiercode":"13-01","member_number":"Ty93274","first_name":"JOSHUA","last_name":"FANT","classification":"B","division":"LIMITED","hit_factor":6.6576},{"match_name":"CGGR February USPSA Match","match_date":"2016-02-20","stage_classifiercode":"13-01","member_number":"TY70157","first_name":"KENNETH","last_name":"KIESLER","classification":"B","division":"LIMITED","hit_factor":6.6421},{"match_name":"OPSC USPSA 7-10-2016","match_date":"2016-07-10","stage_classifiercode":"13-01","member_number":"A23682","first_name":"GLENN","last_name":"JOHNSON","classification":"B","division":"LIMITED","hit_factor":6.6416},{"match_name":"CGGR February USPSA Match","match_date":"2016-02-20","stage_classifiercode":"13-01","member_number":"A90780","first_name":"RYAN","last_name":"CARVER","classification":"B","division":"LIMITED","hit_factor":6.6406},{"match_name":"Griffin USPSA Match Sep 17 2016","match_date":"2016-09-17","stage_classifiercode":"13-01","member_number":"TY78673","first_name":"BRIAN","last_name":"RIVERS","classification":"B","division":"LIMITED","hit_factor":6.6396},{"match_name":"GRB USPSA SEPTEMBER 2021 AT CAVALIER","match_date":"2021-09-18","stage_classifiercode":"13-01","member_number":"A83742","first_name":"ROBBIE","last_name":"WATSON","classification":"B","division":"LIMITED","hit_factor":6.639},{"match_name":"Buas February Match","match_date":"2016-02-14","stage_classifiercode":"13-01","member_number":"ty70926","first_name":"MICHAEL","last_name":"EISENHOWER","classification":"U","division":"LIMITED","hit_factor":6.6345},{"match_name":"MCRC USPSA October 2018","match_date":"2018-10-13","stage_classifiercode":"13-01","member_number":"A69774","first_name":"DAVID","last_name":"FISCHER","classification":"A","division":"LIMITED","hit_factor":6.632},{"match_name":"WELD ECO09 20180313","match_date":"2018-03-18","stage_classifiercode":"13-01","member_number":"A95219","first_name":"LUKE","last_name":"POOLE","classification":"C","division":"LIMITED","hit_factor":6.6258},{"match_name":"ENPS April USPSA Match","match_date":"2017-04-02","stage_classifiercode":"13-01","member_number":"A95628","first_name":"LANE","last_name":"GRIES","classification":"D","division":"LIMITED","hit_factor":6.6207},{"match_name":"Superior Practical Shooters June 2018 Match","match_date":"2018-06-06","stage_classifiercode":"13-01","member_number":"TY96561","first_name":"STEPHEN","last_name":"TO","classification":"B","division":"LIMITED","hit_factor":6.6176},{"match_name":"Richmond Hot Shots Dec 2-3-2017 USPSA Pistol Match","match_date":"2017-12-02","stage_classifiercode":"13-01","member_number":"TY69633","first_name":"ALEX","last_name":"MA","classification":"G","division":"LIMITED","hit_factor":6.6125},{"match_name":"GWPP January 2021Pistol","match_date":"2021-01-09","stage_classifiercode":"13-01","member_number":"FY98060","first_name":"ANDREW","last_name":"SCHWARTZ","classification":"C","division":"LIMITED","hit_factor":6.6059},{"match_name":"Danville Rifle and Pistol Club USPSA IL17 Classifier Match August 18th 2018","match_date":"2018-08-18","stage_classifiercode":"13-01","member_number":"TY92908","first_name":"DAVID","last_name":"BURNS","classification":"M","division":"LIMITED","hit_factor":6.6026},{"match_name":"LTD Pistol - May 2017","match_date":"2017-05-06","stage_classifiercode":"13-01","member_number":"A70490","first_name":"JOSH","last_name":"WAKAMATSU","classification":"G","division":"LIMITED","hit_factor":6.5967},{"match_name":"PTPC February 4th Classifier Match","match_date":"2018-02-04","stage_classifiercode":"13-01","member_number":"FY46658","first_name":"ANTHONY","last_name":"RACIAK","classification":"B","division":"LIMITED","hit_factor":6.5878},{"match_name":"Idaho ISPS August 4th 2018","match_date":"2018-08-04","stage_classifiercode":"13-01","member_number":"TY65491","first_name":"JIM","last_name":"LOVE","classification":"U","division":"LIMITED","hit_factor":6.5868},{"match_name":"SLPSA Feb USPSA","match_date":"2018-02-17","stage_classifiercode":"13-01","member_number":"A73183","first_name":"CHUCK","last_name":"CALDER","classification":"B","division":"LIMITED","hit_factor":6.5823},{"match_name":"EAPS  January 2016","match_date":"2016-01-17","stage_classifiercode":"13-01","member_number":"L3707","first_name":"WOODY","last_name":"LANDRY","classification":"A","division":"LIMITED","hit_factor":6.5789},{"match_name":"GPSL 7-10-2018","match_date":"2018-07-10","stage_classifiercode":"13-01","member_number":"A82809","first_name":"DAVID","last_name":"DARDEN","classification":"A","division":"LIMITED","hit_factor":6.5757},{"match_name":"Havana May 7 2016 USPSA Match","match_date":"2016-05-07","stage_classifiercode":"13-01","member_number":"FY87089","first_name":"MIKE","last_name":"WHEELER","classification":"B","division":"LIMITED","hit_factor":6.5722},{"match_name":"Low Country USPSA Mar 31st","match_date":"2018-03-31","stage_classifiercode":"13-01","member_number":"A103429","first_name":"JODY","last_name":"TAYLOR","classification":"U","division":"LIMITED","hit_factor":6.5711},{"match_name":"SLPSA May USPSA Match","match_date":"2020-05-16","stage_classifiercode":"13-01","member_number":"A103771","first_name":"COLLIN","last_name":"LEWIS","classification":"U","division":"LIMITED","hit_factor":6.5657},{"match_name":"EAGLE USPSA 12-18-2017","match_date":"2017-12-18","stage_classifiercode":"13-01","member_number":"FY70698","first_name":"JASON","last_name":"CARILLO","classification":"M","division":"LIMITED","hit_factor":6.5621},{"match_name":"ISPS Nov 5th 2016","match_date":"2016-11-05","stage_classifiercode":"13-01","member_number":"A94890","first_name":"CHRIS","last_name":"CLARK","classification":"C","division":"LIMITED","hit_factor":6.5554},{"match_name":"Devil Dog USPSA Classifier Match-Saturday Session","match_date":"2018-03-10","stage_classifiercode":"13-01","member_number":"A93069","first_name":"KEVIN","last_name":"MANGIN","classification":"U","division":"LIMITED","hit_factor":6.5554},{"match_name":"Hammer Down USPSA Tue Night","match_date":"2017-11-22","stage_classifiercode":"13-01","member_number":"TY90792","first_name":"BRAD","last_name":"KRUMME","classification":"B","division":"LIMITED","hit_factor":6.5469},{"match_name":"ORPCI USPSA Saturday 2020.09.19","match_date":"2020-09-19","stage_classifiercode":"13-01","member_number":"A86735","first_name":"JOHN","last_name":"COURIS","classification":"B","division":"LIMITED","hit_factor":6.5409},{"match_name":"Renton USPSA May 2018 - NW05","match_date":"2018-05-27","stage_classifiercode":"13-01","member_number":"Ty92223","first_name":"STUART","last_name":"WILSON","classification":"B","division":"LIMITED","hit_factor":6.5351},{"match_name":"SUPS USPSA 5/7/2016","match_date":"2016-05-07","stage_classifiercode":"13-01","member_number":"TY10571","first_name":"GLENFRED","last_name":"WONG","classification":"M","division":"LIMITED","hit_factor":6.5327},{"match_name":"BRC_20160313","match_date":"2016-03-13","stage_classifiercode":"13-01","member_number":"A86598","first_name":"BRUCE","last_name":"MEO","classification":"A","division":"LIMITED","hit_factor":6.5312},{"match_name":"SLOSA Feburary 2016 USPSA","match_date":"2016-02-13","stage_classifiercode":"13-01","member_number":"A84627","first_name":"DANIEL","last_name":"CHARBONNEAU","classification":"B","division":"LIMITED","hit_factor":6.5282},{"match_name":"Lafayette Practical Shooters - WED-THUR - Dec 19-20 - CLASSIFIER MATCH","match_date":"2018-12-20","stage_classifiercode":"13-01","member_number":"FY38991","first_name":"MIKE","last_name":"ADAM","classification":"A","division":"LIMITED","hit_factor":6.5278},{"match_name":"NRG Saturday July 10th Includes a Classifier Stage","match_date":"2021-07-10","stage_classifiercode":"13-01","member_number":"TY75634","first_name":"DANN","last_name":"SCOTT","classification":"B","division":"LIMITED","hit_factor":6.5274},{"match_name":"NHRPC - August 2016 USPSA","match_date":"2016-08-14","stage_classifiercode":"13-01","member_number":"TY77141","first_name":"KEN","last_name":"PRIMERO","classification":"A","division":"LIMITED","hit_factor":6.5191},{"match_name":"PSAC 20210905","match_date":"2021-09-05","stage_classifiercode":"13-01","member_number":"A72585","first_name":"TRUNG","last_name":"NGUYEN","classification":"A","division":"LIMITED","hit_factor":6.5081},{"match_name":"Tarheel USPSA July 2016","match_date":"2016-07-09","stage_classifiercode":"13-01","member_number":"A91900","first_name":"JARED","last_name":"SCHAFFER","classification":"C","division":"LIMITED","hit_factor":6.5081},{"match_name":"EAPS February 2018 USPSA","match_date":"2018-02-18","stage_classifiercode":"13-01","member_number":"A27201","first_name":"KEITH","last_name":"LEMOINE","classification":"B","division":"LIMITED","hit_factor":6.506},{"match_name":"Rankin Field Sunday USPSA","match_date":"2018-09-16","stage_classifiercode":"13-01","member_number":"TY96702","first_name":"BRUCE","last_name":"LE","classification":"B","division":"LIMITED","hit_factor":6.5041},{"match_name":"North East Ohio Shooters - OHN06 - 2017-06-24","match_date":"2017-06-24","stage_classifiercode":"13-01","member_number":"\"\"","first_name":"SEAN","last_name":"CONNER","classification":"U","division":"LIMITED","hit_factor":6.502},{"match_name":"SLPSA Feb USPSA","match_date":"2018-02-17","stage_classifiercode":"13-01","member_number":"A14464","first_name":"CARTER","last_name":"REED","classification":"A","division":"LIMITED","hit_factor":6.5},{"match_name":"OPSC USPSA 7-10-2016","match_date":"2016-07-10","stage_classifiercode":"13-01","member_number":"A17310","first_name":"JOE","last_name":"MARSZALEK","classification":"A","division":"LIMITED","hit_factor":6.4968},{"match_name":"2018-08-04 USPSA at Phoenix Rod and Gun Club","match_date":"2018-08-04","stage_classifiercode":"13-01","member_number":"\"\"","first_name":"MARK","last_name":"GARDNER","classification":"A","division":"LIMITED","hit_factor":6.4951},{"match_name":"WELD ECO09 20180313","match_date":"2018-03-18","stage_classifiercode":"13-01","member_number":"TY87911","first_name":"KEITH","last_name":"MARKEY","classification":"B","division":"LIMITED","hit_factor":6.4919},{"match_name":"LdF USPSA Match August 22 2020","match_date":"2020-08-22","stage_classifiercode":"13-01","member_number":"A81101","first_name":"LES","last_name":"ANDERSON","classification":"M","division":"LIMITED","hit_factor":6.4915},{"match_name":"DAPS USPSA at ETTS 4-8-2017","match_date":"2017-04-08","stage_classifiercode":"13-01","member_number":"A75709","first_name":"BRYAN","last_name":"WEBSTER","classification":"B","division":"LIMITED","hit_factor":6.4885},{"match_name":"Rio Grande Practical Shooters - February 2017","match_date":"2017-02-04","stage_classifiercode":"13-01","member_number":"L3564","first_name":"PAUL J","last_name":"BENSON","classification":"B","division":"LIMITED","hit_factor":6.4871},{"match_name":"17s PSC - USPSA - July 2020","match_date":"2020-07-18","stage_classifiercode":"13-01","member_number":"A118354","first_name":"TROY","last_name":"WHITE","classification":"D","division":"LIMITED","hit_factor":6.4846},{"match_name":"Clinton County USPSA","match_date":"2016-03-26","stage_classifiercode":"13-01","member_number":"\"\"","first_name":"ERIC","last_name":"WEST","classification":"A","division":"LIMITED","hit_factor":6.4803},{"match_name":"SLOSA Feburary 2016 USPSA","match_date":"2016-02-13","stage_classifiercode":"13-01","member_number":"TY62447","first_name":"ADRIAN","last_name":"COBB","classification":"M","division":"LIMITED","hit_factor":6.4782},{"match_name":"SCCCApril2017","match_date":"2017-04-09","stage_classifiercode":"13-01","member_number":"ty98156","first_name":"JIM","last_name":"GIEGER","classification":"U","division":"LIMITED","hit_factor":6.4677},{"match_name":"Green Valley September 2016","match_date":"2016-09-24","stage_classifiercode":"13-01","member_number":"A93167","first_name":"CHRIS","last_name":"NEIMAN","classification":"U","division":"LIMITED","hit_factor":6.4649},{"match_name":"TMGN December 2 USPSA Classifier Match","match_date":"2018-12-03","stage_classifiercode":"13-01","member_number":"A102388","first_name":"BRENDAN","last_name":"WARSHAUER","classification":"B","division":"LIMITED","hit_factor":6.4644},{"match_name":"PCWC USPSA  9 22 2018","match_date":"2018-09-22","stage_classifiercode":"13-01","member_number":"A62764","first_name":"TIM","last_name":"SELLERS","classification":"A","division":"LIMITED","hit_factor":6.4596},{"match_name":"12a Fecha USPSA","match_date":"2017-11-12","stage_classifiercode":"13-01","member_number":"A63950","first_name":"EFREN","last_name":"CAMACHO","classification":"A","division":"LIMITED","hit_factor":6.4593},{"match_name":"OKCGC USPSA Dec 2017 Match","match_date":"2017-12-02","stage_classifiercode":"13-01","member_number":"fy49733","first_name":"KURT","last_name":"MILLER","classification":"M","division":"LIMITED","hit_factor":6.4516},{"match_name":"MRCPS USPSA Feb    2016","match_date":"2016-02-21","stage_classifiercode":"13-01","member_number":"A76637","first_name":"JEFF","last_name":"SNOPE","classification":"B","division":"LIMITED","hit_factor":6.4477},{"match_name":"Clairton Apr 09; 2017","match_date":"2017-04-09","stage_classifiercode":"13-01","member_number":"\"\"","first_name":"RON","last_name":"RODGERS","classification":"U","division":"LIMITED","hit_factor":6.441},{"match_name":"JCSSA NOV 7 2020","match_date":"2020-11-07","stage_classifiercode":"13-01","member_number":"A127283","first_name":"RICHARD","last_name":"PETTIS","classification":"B","division":"LIMITED","hit_factor":6.4394},{"match_name":"Griffin USPSA Match Sep 17 2016","match_date":"2016-09-17","stage_classifiercode":"13-01","member_number":"A91864","first_name":"ANDREA","last_name":"BOONE","classification":"B","division":"LIMITED","hit_factor":6.4368},{"match_name":"Double Taps USPSA November USPSA Match","match_date":"2017-11-29","stage_classifiercode":"13-01","member_number":"\"\"","first_name":"SHAWN","last_name":"NAULT","classification":"M","division":"LIMITED","hit_factor":6.432},{"match_name":"WPGC 8-1-16","match_date":"2016-08-01","stage_classifiercode":"13-01","member_number":"TY77793","first_name":"ROBERT","last_name":"CHRISTIE","classification":"A","division":"LIMITED","hit_factor":6.4267},{"match_name":"New Holland USPSA - October 2016","match_date":"2016-10-09","stage_classifiercode":"13-01","member_number":"A76956","first_name":"KERRY","last_name":"WOODS","classification":"C","division":"LIMITED","hit_factor":6.4242},{"match_name":"8a Fecha USPSA Classifier","match_date":"2018-08-12","stage_classifiercode":"13-01","member_number":"A86185","first_name":"WILLIE","last_name":"SOTO","classification":"U","division":"LIMITED","hit_factor":6.4209},{"match_name":"OPSC USPSA 7-10-2016","match_date":"2016-07-10","stage_classifiercode":"13-01","member_number":"FY10528","first_name":"JOHN","last_name":"SMITH","classification":"M","division":"LIMITED","hit_factor":6.4151},{"match_name":"8a Fecha USPSA Classifier","match_date":"2018-08-12","stage_classifiercode":"13-01","member_number":"A97576","first_name":"RAMON L","last_name":"RIVERA COLON","classification":"B","division":"LIMITED","hit_factor":6.4133},{"match_name":"IN19 ACC USPSA May 23 2021","match_date":"2021-05-23","stage_classifiercode":"13-01","member_number":"TY64065","first_name":"DANIEL","last_name":"HART","classification":"M","division":"LIMITED","hit_factor":6.4039},{"match_name":"Patriot Action Shooters December 2015 Match","match_date":"2015-12-19","stage_classifiercode":"13-01","member_number":"FY80542","first_name":"DIANA","last_name":"DRISCOLL","classification":"B","division":"LIMITED","hit_factor":6.4028},{"match_name":"NRG Saturday January 13th - Includes a Classifier Stage","match_date":"2018-01-13","stage_classifiercode":"13-01","member_number":"TY71084","first_name":"ROBERT","last_name":"WEIDE","classification":"M","division":"LIMITED","hit_factor":6.3973},{"match_name":"BPSA January 2017 USPSA","match_date":"2017-01-22","stage_classifiercode":"13-01","member_number":"TY94183","first_name":"DAVID","last_name":"PAPE","classification":"B","division":"LIMITED","hit_factor":6.3932},{"match_name":"Armory Indoor League","match_date":"2017-08-17","stage_classifiercode":"13-01","member_number":"TY93975","first_name":"STEPAN","last_name":"GENERALOV","classification":"B","division":"LIMITED","hit_factor":6.391},{"match_name":"MCRC USPSA October 2018","match_date":"2018-10-13","stage_classifiercode":"13-01","member_number":"A102564","first_name":"DONALD","last_name":"POWERS","classification":"M","division":"LIMITED","hit_factor":6.3882},{"match_name":"Tarheel USPSA July 2016","match_date":"2016-07-09","stage_classifiercode":"13-01","member_number":"\"\"","first_name":"CODY","last_name":"HENLEY","classification":"U","division":"LIMITED","hit_factor":6.383},{"match_name":"SAPSC Monthly USPSA Classifier Match at ARO 20161020","match_date":"2016-10-20","stage_classifiercode":"13-01","member_number":"A74807","first_name":"DUANE","last_name":"KORYTKO","classification":"U","division":"LIMITED","hit_factor":6.3804},{"match_name":"PIPS 05-30-2018","match_date":"2018-05-29","stage_classifiercode":"13-01","member_number":"TY70399","first_name":"BRAD","last_name":"OLSON","classification":"M","division":"LIMITED","hit_factor":6.38},{"match_name":"ENPS April USPSA Match","match_date":"2017-04-02","stage_classifiercode":"13-01","member_number":"A89507","first_name":"JUSTYN A","last_name":"RILEY","classification":"B","division":"LIMITED","hit_factor":6.3725},{"match_name":"SLPSA Feb USPSA","match_date":"2018-02-17","stage_classifiercode":"13-01","member_number":"TY22391","first_name":"LANCE","last_name":"EDWARDS","classification":"A","division":"LIMITED","hit_factor":6.3709},{"match_name":"Rankin Field August Sunday USPSA","match_date":"2020-08-16","stage_classifiercode":"13-01","member_number":"A94718","first_name":"NICK","last_name":"ROBERTS","classification":"A","division":"LIMITED","hit_factor":6.3665},{"match_name":"Strongpoint April 2018 USPSA Match","match_date":"2018-04-07","stage_classifiercode":"13-01","member_number":"L3864","first_name":"VINCE","last_name":"PAINTER","classification":"A","division":"LIMITED","hit_factor":6.3636},{"match_name":"SWGC USPSA Pistol Match - February 2021","match_date":"2021-02-06","stage_classifiercode":"13-01","member_number":"A101944","first_name":"THOMAS","last_name":"SHERWOOD","classification":"B","division":"LIMITED","hit_factor":6.3636},{"match_name":"PCSI March 2016 USPSA","match_date":"2016-03-05","stage_classifiercode":"13-01","member_number":"FY85560","first_name":"TJ","last_name":"CHEONG","classification":"B","division":"LIMITED","hit_factor":6.3593},{"match_name":"Hopkinton May 2018","match_date":"2018-05-05","stage_classifiercode":"13-01","member_number":"A73027","first_name":"JEFF","last_name":"NICOLL","classification":"M","division":"LIMITED","hit_factor":6.3518},{"match_name":"Palmetto Gun Club - January 2016 USPSA","match_date":"2016-01-02","stage_classifiercode":"13-01","member_number":"TY75124","first_name":"ROBBY","last_name":"HEWITT","classification":"B","division":"LIMITED","hit_factor":6.3492},{"match_name":"Palmetto Gun Club - January 2016 USPSA","match_date":"2016-01-02","stage_classifiercode":"13-01","member_number":"A71057","first_name":"MICHAEL","last_name":"GORBY","classification":"U","division":"LIMITED","hit_factor":6.3492},{"match_name":"AIPS  USPSA Weekly 30 August 2016","match_date":"2016-08-30","stage_classifiercode":"13-01","member_number":"L3842","first_name":"MARK","last_name":"WIEDENFELD","classification":"B","division":"LIMITED","hit_factor":6.3337},{"match_name":"MRCPS USPSA Feb    2016","match_date":"2016-02-21","stage_classifiercode":"13-01","member_number":"TY71576","first_name":"JEMY","last_name":"HUANG","classification":"B","division":"LIMITED","hit_factor":6.3277},{"match_name":"GPSL 11-1-16","match_date":"2016-11-01","stage_classifiercode":"13-01","member_number":"A82809","first_name":"DAVID","last_name":"DARDEN","classification":"B","division":"LIMITED","hit_factor":6.326},{"match_name":"WAC May 23rd (4th Sunday) - USPSA 6 Stage Match","match_date":"2021-05-23","stage_classifiercode":"13-01","member_number":"FY79868","first_name":"DERRICK","last_name":"SPAIN","classification":"B","division":"LIMITED","hit_factor":6.3246},{"match_name":"May 2018 at MPSA","match_date":"2018-05-27","stage_classifiercode":"13-01","member_number":"A94749","first_name":"JOHN","last_name":"BURCH","classification":"A","division":"LIMITED","hit_factor":6.3241},{"match_name":"Clinton County USPSA","match_date":"2016-03-26","stage_classifiercode":"13-01","member_number":"\"\"","first_name":"ROY","last_name":"HESS","classification":"B","division":"LIMITED","hit_factor":6.3197},{"match_name":"DWB - Deadwood Boys USPSA 03 June 2018","match_date":"2018-06-03","stage_classifiercode":"13-01","member_number":"TY82298","first_name":"WALTER","last_name":"MICHALOWSKI","classification":"B","division":"LIMITED","hit_factor":6.3134},{"match_name":"GAS September 2020 USPSA","match_date":"2020-09-05","stage_classifiercode":"13-01","member_number":"L3409","first_name":"BRUCE","last_name":"REID","classification":"B","division":"LIMITED","hit_factor":6.3107},{"match_name":"USPSA BC 2016 February - Level 1 Special Handgun Match","match_date":"2016-02-28","stage_classifiercode":"13-01","member_number":"F89802","first_name":"SAM","last_name":"YU","classification":"C","division":"LIMITED","hit_factor":6.3084},{"match_name":"IN19 ACC USPSA May 23 2021","match_date":"2021-05-23","stage_classifiercode":"13-01","member_number":"A68663","first_name":"JUSTIN","last_name":"SHIRAR","classification":"B","division":"LIMITED","hit_factor":6.3041},{"match_name":"Shasta Shooters July 2016 Special Classifier","match_date":"2016-07-09","stage_classifiercode":"13-01","member_number":"A91711","first_name":"MITCH","last_name":"CARLSON","classification":"B","division":"LIMITED","hit_factor":6.302},{"match_name":"BPSA January 2017 USPSA","match_date":"2017-01-22","stage_classifiercode":"13-01","member_number":"A94097","first_name":"STEVEN","last_name":"TANNETTA","classification":"B","division":"LIMITED","hit_factor":6.3001},{"match_name":"Palmetto Gun Club - January 2016 USPSA","match_date":"2016-01-02","stage_classifiercode":"13-01","member_number":"FY42385","first_name":"JOHN","last_name":"HILL","classification":"M","division":"LIMITED","hit_factor":6.2885},{"match_name":"LCSA USPSA July","match_date":"2016-07-08","stage_classifiercode":"13-01","member_number":"TY53244","first_name":"MATTHEW","last_name":"DYLEWSKI","classification":"B","division":"LIMITED","hit_factor":6.2871},{"match_name":"May 2018 at MPSA","match_date":"2018-05-27","stage_classifiercode":"13-01","member_number":"A104882","first_name":"CHRIS","last_name":"GELNETT","classification":"C","division":"LIMITED","hit_factor":6.2827},{"match_name":"CCC Shooting Complex February 2017","match_date":"2017-02-05","stage_classifiercode":"13-01","member_number":"TY2227","first_name":"TOMMY","last_name":"TEAS","classification":"B","division":"LIMITED","hit_factor":6.2802},{"match_name":"Parma January USPSA","match_date":"2020-01-18","stage_classifiercode":"13-01","member_number":"TY85985","first_name":"CHRISTOPHER","last_name":"COLLINS","classification":"M","division":"LIMITED","hit_factor":6.2735},{"match_name":"SLPSA May USPSA Match","match_date":"2020-05-16","stage_classifiercode":"13-01","member_number":"A96797","first_name":"ANDREW","last_name":"ANDERSON JR","classification":"B","division":"LIMITED","hit_factor":6.2722},{"match_name":"EIPS 6/16/2016","match_date":"2016-06-16","stage_classifiercode":"13-01","member_number":"A84539","first_name":"JUSTIN","last_name":"ADAMS","classification":"D","division":"LIMITED","hit_factor":6.2722},{"match_name":"RCPS USPSA 9 Jan 2016 Special Classifier Match","match_date":"2016-01-09","stage_classifiercode":"13-01","member_number":"A65338","first_name":"JAMES","last_name":"CLARK","classification":"B","division":"LIMITED","hit_factor":6.271},{"match_name":"Tarheel USPSA July 2016","match_date":"2016-07-09","stage_classifiercode":"13-01","member_number":"\"\"","first_name":"LUKE","last_name":"ADAMS","classification":"B","division":"LIMITED","hit_factor":6.2657},{"match_name":"LdF USPSA Match August 22 2020","match_date":"2020-08-22","stage_classifiercode":"13-01","member_number":"TY67188","first_name":"IVAN","last_name":"GARCIA","classification":"B","division":"LIMITED","hit_factor":6.2651},{"match_name":"5 Dogs April 2017 USPSA","match_date":"2017-04-02","stage_classifiercode":"13-01","member_number":"TY78127","first_name":"MIKE","last_name":"SWANEY","classification":"A","division":"LIMITED","hit_factor":6.2645},{"match_name":"SCCCApril2017","match_date":"2017-04-09","stage_classifiercode":"13-01","member_number":"fy81341","first_name":"JOEY","last_name":"ZADIK","classification":"M","division":"LIMITED","hit_factor":6.2609},{"match_name":"FSA-USPSA-12-03-2017","match_date":"2017-12-04","stage_classifiercode":"13-01","member_number":"A51560","first_name":"MICHAEL","last_name":"HIMMEL","classification":"B","division":"LIMITED","hit_factor":6.258},{"match_name":"SFA USPSA AUG 2018 RESHOOT","match_date":"2018-08-19","stage_classifiercode":"13-01","member_number":"TY91971","first_name":"LARRY","last_name":"SKINNER","classification":"B","division":"LIMITED","hit_factor":6.25},{"match_name":"SCCCApril2017","match_date":"2017-04-09","stage_classifiercode":"13-01","member_number":"a71839","first_name":"JONATHAN","last_name":"COWEN","classification":"B","division":"LIMITED","hit_factor":6.25},{"match_name":"TMGN USPSA May 4th Pistol Match","match_date":"2017-05-04","stage_classifiercode":"13-01","member_number":"\"\"","first_name":"CHARLES","last_name":"SNOW","classification":"C","division":"LIMITED","hit_factor":6.25},{"match_name":"SAPS Match 1/04/2020","match_date":"2020-01-04","stage_classifiercode":"13-01","member_number":"TY72948","first_name":"WILLIAM","last_name":"VANNI","classification":"B","division":"LIMITED","hit_factor":6.2433},{"match_name":"PCWC USPSA  7 23 2016","match_date":"2016-07-23","stage_classifiercode":"13-01","member_number":"A23656","first_name":"RAY","last_name":"WELLS","classification":"A","division":"LIMITED","hit_factor":6.2428},{"match_name":"WSPS SEPTEMBER 2017 USPSA MATCH","match_date":"2017-09-16","stage_classifiercode":"13-01","member_number":"TY76695","first_name":"TODD","last_name":"BOYER","classification":"B","division":"LIMITED","hit_factor":6.2426},{"match_name":"Griffin USPSA Match Oct 2017","match_date":"2017-10-21","stage_classifiercode":"13-01","member_number":"Ty101146","first_name":"JUSTIN","last_name":"KRAGE","classification":"B","division":"LIMITED","hit_factor":6.2344},{"match_name":"WAC May 23rd (4th Sunday) - USPSA 6 Stage Match","match_date":"2021-05-23","stage_classifiercode":"13-01","member_number":"A93451","first_name":"JASON","last_name":"MASTERS","classification":"M","division":"LIMITED","hit_factor":6.2284},{"match_name":"Patriot Action Shooters December 2015 Match","match_date":"2015-12-19","stage_classifiercode":"13-01","member_number":"TY85556","first_name":"WILLIAM","last_name":"POWELL","classification":"B","division":"LIMITED","hit_factor":6.2252},{"match_name":"NW15 Port Townsend Practical Pistol USPSA September 4 2021","match_date":"2021-09-04","stage_classifiercode":"13-01","member_number":"l3253","first_name":"SCOTT","last_name":"LEROUX","classification":"M","division":"LIMITED","hit_factor":6.2207},{"match_name":"Palmetto Gun Club - January 2016 USPSA","match_date":"2016-01-02","stage_classifiercode":"13-01","member_number":"A93929","first_name":"TRAVIS","last_name":"BRODIE","classification":"U","division":"LIMITED","hit_factor":6.2201},{"match_name":"Coastal Area Practical Shooters 4-28-18","match_date":"2018-04-28","stage_classifiercode":"13-01","member_number":"A67361","first_name":"KEVIN","last_name":"BASSINGER","classification":"A","division":"LIMITED","hit_factor":6.2119},{"match_name":"Gem City Gun Club 1-04 and 1-05 2020","match_date":"2020-01-04","stage_classifiercode":"13-01","member_number":"TY85173","first_name":"RYAN","last_name":"ZAMBRZYCKI","classification":"A","division":"LIMITED","hit_factor":6.2087},{"match_name":"Laser Ninja Dragon League MSA USPSA January 21st 2017","match_date":"2017-01-21","stage_classifiercode":"13-01","member_number":"A99689","first_name":"LONNY","last_name":"GUPTON","classification":"C","division":"LIMITED","hit_factor":6.2053},{"match_name":"Clinton County USPSA","match_date":"2016-03-26","stage_classifiercode":"13-01","member_number":"\"\"","first_name":"CHRIS","last_name":"GARRISON","classification":"\"\"","division":"LIMITED","hit_factor":6.1998},{"match_name":"NRG Saturday July 22nd- Classifier","match_date":"2017-07-22","stage_classifiercode":"13-01","member_number":"TY92176","first_name":"JAE","last_name":"AHN","classification":"A","division":"LIMITED","hit_factor":6.1972},{"match_name":"Hopkinton March Mini-Match","match_date":"2020-03-14","stage_classifiercode":"13-01","member_number":"A39028","first_name":"JOHN","last_name":"SARDINA","classification":"M","division":"LIMITED","hit_factor":6.1818},{"match_name":"DWB - Deadwood Boys USPSA February 4 2018","match_date":"2018-02-04","stage_classifiercode":"13-01","member_number":"fy51880","first_name":"ARWIN","last_name":"PLETE","classification":"C","division":"LIMITED","hit_factor":6.1805},{"match_name":"INAS Dec 2016 USPSA","match_date":"2016-12-17","stage_classifiercode":"13-01","member_number":"A49382","first_name":"BRENDAN","last_name":"NANGLE","classification":"B","division":"LIMITED","hit_factor":6.1765},{"match_name":"DWB - Deadwood Boys USPSA February 4 2018","match_date":"2018-02-04","stage_classifiercode":"13-01","member_number":"TY82298","first_name":"WALTER","last_name":"MICHALOWSKI","classification":"B","division":"LIMITED","hit_factor":6.1758},{"match_name":"CPS USPSA Apr 2018","match_date":"2018-04-07","stage_classifiercode":"13-01","member_number":"A-102523","first_name":"THOMAS","last_name":"BENGE","classification":"B","division":"LIMITED","hit_factor":6.1728},{"match_name":"Richmond Hot Shots November 17-18 USPSA Pistol Match","match_date":"2018-11-17","stage_classifiercode":"13-01","member_number":"A99969","first_name":"KARL","last_name":"MACARAIG","classification":"B","division":"LIMITED","hit_factor":6.17},{"match_name":"PAS April USPSA","match_date":"2018-04-21","stage_classifiercode":"13-01","member_number":"ty93848","first_name":"CASEY","last_name":"BROWN","classification":"U","division":"LIMITED","hit_factor":6.17},{"match_name":"HOPS USPSA 071517","match_date":"2017-07-15","stage_classifiercode":"13-01","member_number":"TY81279","first_name":"JARROD","last_name":"GROVE","classification":"B","division":"LIMITED","hit_factor":6.1644},{"match_name":"SEPSA June 2016","match_date":"2016-06-11","stage_classifiercode":"13-01","member_number":"L3824","first_name":"BRUCE","last_name":"WELLS","classification":"B","division":"LIMITED","hit_factor":6.1637},{"match_name":"SPSA USPSA August 4th Sat match","match_date":"2016-08-27","stage_classifiercode":"13-01","member_number":"A92288","first_name":"JUSTIN","last_name":"BERRY","classification":"B","division":"LIMITED","hit_factor":6.1617},{"match_name":"Buas February Match","match_date":"2016-02-14","stage_classifiercode":"13-01","member_number":"a76272","first_name":"NICK","last_name":"BEDIO","classification":"A","division":"LIMITED","hit_factor":6.1611},{"match_name":"Brazosland Pistoleros August 20 2017","match_date":"2017-08-20","stage_classifiercode":"13-01","member_number":"A102564","first_name":"DONALD","last_name":"POWERS","classification":"C","division":"LIMITED","hit_factor":6.1594},{"match_name":"NRG December 10th 2016","match_date":"2016-12-10","stage_classifiercode":"13-01","member_number":"TY86860","first_name":"CHRIS","last_name":"SKAHILL","classification":"B","division":"LIMITED","hit_factor":6.1571},{"match_name":"CGGR February USPSA Match","match_date":"2016-02-20","stage_classifiercode":"13-01","member_number":"ty47262","first_name":"MIKE","last_name":"CROWELL","classification":"A","division":"LIMITED","hit_factor":6.1538},{"match_name":"OPSC USPSA 7-10-2016","match_date":"2016-07-10","stage_classifiercode":"13-01","member_number":"A88087","first_name":"JOHN","last_name":"CAGAOAN","classification":"A","division":"LIMITED","hit_factor":6.1514},{"match_name":"WAC May 23rd (4th Sunday) - USPSA 6 Stage Match","match_date":"2021-05-23","stage_classifiercode":"13-01","member_number":"A125466","first_name":"DAVID","last_name":"LOWER","classification":"B","division":"LIMITED","hit_factor":6.1503},{"match_name":"APSC USPSA Match 08-04-18","match_date":"2018-08-04","stage_classifiercode":"13-01","member_number":"L3804","first_name":"DAVID","last_name":"BISHOP","classification":"M","division":"LIMITED","hit_factor":6.1485},{"match_name":"SPSA USPSA August 4th Sat match","match_date":"2016-08-27","stage_classifiercode":"13-01","member_number":"A88173","first_name":"STUART","last_name":"MARTIN","classification":"B","division":"LIMITED","hit_factor":6.146},{"match_name":"AIPS  USPSA Weekly 30 August 2016","match_date":"2016-08-30","stage_classifiercode":"13-01","member_number":"A65348","first_name":"CRAIG","last_name":"HABEL","classification":"B","division":"LIMITED","hit_factor":6.1433},{"match_name":"MRCPS USPSA Feb    2016","match_date":"2016-02-21","stage_classifiercode":"13-01","member_number":"L3591","first_name":"ZACHARY","last_name":"CAMPBELL","classification":"A","division":"LIMITED","hit_factor":6.1417},{"match_name":"WTPS USPSA April Classifier Match 4-8-17","match_date":"2017-04-08","stage_classifiercode":"13-01","member_number":"TY98496","first_name":"ADRIAN","last_name":"HUBER","classification":"U","division":"LIMITED","hit_factor":6.1294},{"match_name":"SLOSA Feburary 2016 USPSA","match_date":"2016-02-13","stage_classifiercode":"13-01","member_number":"TY87000","first_name":"GREG","last_name":"VAUGHN","classification":"B","division":"LIMITED","hit_factor":6.1272},{"match_name":"Hopkinton May 2018","match_date":"2018-05-05","stage_classifiercode":"13-01","member_number":"L2545","first_name":"MICHAEL","last_name":"CHLUDENSKI","classification":"B","division":"LIMITED","hit_factor":6.1224},{"match_name":"DWB - Deadwood Boys USPSA 03 June 2018","match_date":"2018-06-03","stage_classifiercode":"13-01","member_number":"\"\"","first_name":"JAMES","last_name":"MANAHAN","classification":"C","division":"LIMITED","hit_factor":6.1224},{"match_name":"Renton USPSA May 2018 - NW05","match_date":"2018-05-27","stage_classifiercode":"13-01","member_number":"TY72819","first_name":"JASON","last_name":"DINGLEDINE","classification":"B","division":"LIMITED","hit_factor":6.1201},{"match_name":"PRG - Oh Shoot  March 20th - 3rd Saturday Match","match_date":"2021-03-20","stage_classifiercode":"13-01","member_number":"A81101","first_name":"LES","last_name":"ANDERSON","classification":"M","division":"LIMITED","hit_factor":6.1192},{"match_name":"Havana May 7 2016 USPSA Match","match_date":"2016-05-07","stage_classifiercode":"13-01","member_number":"A69428","first_name":"CARTER","last_name":"JONES","classification":"B","division":"LIMITED","hit_factor":6.1111},{"match_name":"Richmond Hot Shots November 17-18 USPSA Pistol Match","match_date":"2018-11-17","stage_classifiercode":"13-01","member_number":"A46690","first_name":"GILBERT","last_name":"GESMUNDO","classification":"A","division":"LIMITED","hit_factor":6.1097},{"match_name":"Rankin Field Sunday USPSA","match_date":"2018-09-16","stage_classifiercode":"13-01","member_number":"A109094","first_name":"TONY","last_name":"LUNA","classification":"U","division":"LIMITED","hit_factor":6.105},{"match_name":"SPSA USPSA August 4th Sat match","match_date":"2016-08-27","stage_classifiercode":"13-01","member_number":"TY3777","first_name":"MIKE","last_name":"MORRIS","classification":"A","division":"LIMITED","hit_factor":6.1033},{"match_name":"Shasta Shooters 2020 Jan","match_date":"2020-01-11","stage_classifiercode":"13-01","member_number":"TY67645","first_name":"MARK","last_name":"HICKS","classification":"C","division":"LIMITED","hit_factor":6.1028},{"match_name":"BMPSA Apr 21 2018","match_date":"2018-04-21","stage_classifiercode":"13-01","member_number":"TY96773","first_name":"BUCKY","last_name":"OLSON","classification":"B","division":"LIMITED","hit_factor":6.099},{"match_name":"Applied IN25 USPSA March classifier","match_date":"2017-03-21","stage_classifiercode":"13-01","member_number":"TY92908","first_name":"DAVID","last_name":"BURNS","classification":"A","division":"LIMITED","hit_factor":6.0908},{"match_name":"Laser Ninja Dragon League MSA USPSA January 21st 2017","match_date":"2017-01-21","stage_classifiercode":"13-01","member_number":"A-90978","first_name":"KANE","last_name":"KOLISEK","classification":"B","division":"LIMITED","hit_factor":6.0901},{"match_name":"Devil Dog USPSA Classifier Match-Saturday Session","match_date":"2018-03-10","stage_classifiercode":"13-01","member_number":"A104209","first_name":"ROB","last_name":"NOEL","classification":"B","division":"LIMITED","hit_factor":6.0901},{"match_name":"Idaho ISPS August 4th 2018","match_date":"2018-08-04","stage_classifiercode":"13-01","member_number":"A85985","first_name":"CHRISTOPHER","last_name":"COLLINS","classification":"B","division":"LIMITED","hit_factor":6.0883},{"match_name":"2020 Minot USPSA Club Championship","match_date":"2020-08-09","stage_classifiercode":"13-01","member_number":"A101132","first_name":"TRAVIS","last_name":"FRIESZ","classification":"M","division":"LIMITED","hit_factor":6.0837},{"match_name":"FSA USPSA POINT SERIES 03-08-20","match_date":"2020-03-08","stage_classifiercode":"13-01","member_number":"A123608","first_name":"HOWARD","last_name":"HAZEN","classification":"U","division":"LIMITED","hit_factor":6.0802},{"match_name":"Tropang Vegas All Classifier Match","match_date":"2021-07-11","stage_classifiercode":"13-01","member_number":"A81025","first_name":"DEWANE","last_name":"FERRIN","classification":"B","division":"LIMITED","hit_factor":6.0606},{"match_name":"RCPS USPSA 9 Jan 2016 Special Classifier Match","match_date":"2016-01-09","stage_classifiercode":"13-01","member_number":"A82472","first_name":"JONATHAN","last_name":"JOHANNESMEYER","classification":"C","division":"LIMITED","hit_factor":6.0606},{"match_name":"LCSA USPSA July","match_date":"2016-07-08","stage_classifiercode":"13-01","member_number":"A95147","first_name":"JON","last_name":"MELTON","classification":"C","division":"LIMITED","hit_factor":6.0606},{"match_name":"Applied IN25 USPSA April Classifier 2018","match_date":"2018-04-17","stage_classifiercode":"13-01","member_number":"A102630","first_name":"NATE","last_name":"POULSON","classification":"A","division":"LIMITED","hit_factor":6.0561},{"match_name":"Laser Ninja Dragon League July Special Classifier","match_date":"2018-07-01","stage_classifiercode":"13-01","member_number":"Ty104591","first_name":"DAVID","last_name":"HEUSS","classification":"C","division":"LIMITED","hit_factor":6.0559},{"match_name":"RCSC USPSA 26 Feb 2017","match_date":"2017-02-26","stage_classifiercode":"13-01","member_number":"TY79569","first_name":"RUSS","last_name":"GOULD","classification":"M","division":"LIMITED","hit_factor":6.0538},{"match_name":"Lafayette Practical Shooters - WED - JUL 1 - Tee Times","match_date":"2020-07-01","stage_classifiercode":"13-01","member_number":"TY99446","first_name":"SKIP","last_name":"RICHARDSON","classification":"B","division":"LIMITED","hit_factor":6.0536},{"match_name":"BORCC USPSA July 2018 Classifier Match","match_date":"2018-07-02","stage_classifiercode":"13-01","member_number":"A99883","first_name":"ANGELA","last_name":"SPALLA","classification":"U","division":"LIMITED","hit_factor":6.0533},{"match_name":"Competitive Shooters of Lake Norman CORNELIUS Thursday Evening Indoor USPSA Pistol Match North Carolina","match_date":"2018-04-05","stage_classifiercode":"13-01","member_number":"TY93719","first_name":"JOHN","last_name":"WESTBROOK","classification":"B","division":"LIMITED","hit_factor":6.0502},{"match_name":"SCCPSA USPSA Aug 19 2017","match_date":"2017-08-19","stage_classifiercode":"13-01","member_number":"TY68809","first_name":"JAMES","last_name":"GRAZIANO","classification":"B","division":"LIMITED","hit_factor":6.0433},{"match_name":"8a Fecha USPSA Classifier","match_date":"2018-08-12","stage_classifiercode":"13-01","member_number":"FY52680","first_name":"JOSE RAFAEL","last_name":"PADILLA","classification":"M","division":"LIMITED","hit_factor":6.041},{"match_name":"FSA USPSA Summer Classifier Match","match_date":"2017-08-27","stage_classifiercode":"13-01","member_number":"a97566","first_name":"ERIC","last_name":"ROGERS","classification":"U","division":"LIMITED","hit_factor":6.0386},{"match_name":"Shongum February 2017 USPSA Match","match_date":"2017-02-04","stage_classifiercode":"13-01","member_number":"TY77141","first_name":"KEN (LOUIE)","last_name":"PRIMERO","classification":"A","division":"LIMITED","hit_factor":6.0355},{"match_name":"Mvpsa April 2","match_date":"2016-04-02","stage_classifiercode":"13-01","member_number":"TY28156","first_name":"DAVE","last_name":"COOK","classification":"A","division":"LIMITED","hit_factor":6.0325},{"match_name":"HOPS USPSA 071517","match_date":"2017-07-15","stage_classifiercode":"13-01","member_number":"A94960","first_name":"RAYMOND","last_name":"PETRIK","classification":"C","division":"LIMITED","hit_factor":6.0307},{"match_name":"BORCC USPSA July 2018 Classifier Match","match_date":"2018-07-02","stage_classifiercode":"13-01","member_number":"A106367","first_name":"DANIEL","last_name":"MATHIAS","classification":"B","division":"LIMITED","hit_factor":6.0296},{"match_name":"Rankin Field Sunday USPSA","match_date":"2018-06-17","stage_classifiercode":"13-01","member_number":"TY109346","first_name":"MADDUX","last_name":"LE","classification":"U","division":"LIMITED","hit_factor":6.0268},{"match_name":"BAPS USPSA July","match_date":"2021-07-17","stage_classifiercode":"13-01","member_number":"A83862","first_name":"KENEDY","last_name":"NGUYEN","classification":"C","division":"LIMITED","hit_factor":6.0241},{"match_name":"Tehama Shooters May 2020 USPSA","match_date":"2020-05-23","stage_classifiercode":"13-01","member_number":"A77906","first_name":"JASON","last_name":"CHIPLEY","classification":"B","division":"LIMITED","hit_factor":6.0209},{"match_name":"OPSC USPSA 7-10-2016","match_date":"2016-07-10","stage_classifiercode":"13-01","member_number":"A68902","first_name":"STEVE","last_name":"PARKER","classification":"C","division":"LIMITED","hit_factor":6.0201},{"match_name":"WSPS SEPTEMBER 2017 USPSA MATCH","match_date":"2017-09-16","stage_classifiercode":"13-01","member_number":"A82072","first_name":"AL","last_name":"MONCH","classification":"M","division":"LIMITED","hit_factor":6.0172},{"match_name":"MS06 Team Magnolia July 2017 USPSA Match","match_date":"2017-07-01","stage_classifiercode":"13-01","member_number":"FY23129","first_name":"GARY","last_name":"THIBODAUX","classification":"A","division":"LIMITED","hit_factor":6.0071},{"match_name":"RCPS USPSA August 11","match_date":"2018-08-11","stage_classifiercode":"13-01","member_number":"TY103787","first_name":"JAMEY","last_name":"THOMAS","classification":"U","division":"LIMITED","hit_factor":6.0052},{"match_name":"SLPSA Feb USPSA","match_date":"2018-02-17","stage_classifiercode":"13-01","member_number":"A92822","first_name":"TERENCE","last_name":"VANG","classification":"B","division":"LIMITED","hit_factor":5.9937},{"match_name":"EAPS February 2018 USPSA","match_date":"2018-02-18","stage_classifiercode":"13-01","member_number":"FY53269","first_name":"FORREST","last_name":"BOUDREAUX","classification":"B","division":"LIMITED","hit_factor":5.9908},{"match_name":"Double Taps USPSA November USPSA Match","match_date":"2017-11-29","stage_classifiercode":"13-01","member_number":"TYF93552","first_name":"DOUG","last_name":"ENGSTROM","classification":"U","division":"LIMITED","hit_factor":5.9908},{"match_name":"SPSA USPSA October 1st Sat Match","match_date":"2020-10-03","stage_classifiercode":"13-01","member_number":"A120621","first_name":"JASON","last_name":"KARSTEDT","classification":"C","division":"LIMITED","hit_factor":5.9874},{"match_name":"Rio Salado UPPL 2nd Sunday January 2020","match_date":"2020-01-11","stage_classifiercode":"13-01","member_number":"A55572","first_name":"SHANE","last_name":"CELINO","classification":"A","division":"LIMITED","hit_factor":5.9789},{"match_name":"PTPC February 4th Classifier Match","match_date":"2018-02-04","stage_classifiercode":"13-01","member_number":"A86957","first_name":"SCOTT","last_name":"WITTKE","classification":"C","division":"LIMITED","hit_factor":5.9789},{"match_name":"RDS Aug 52017 USPSA  Match","match_date":"2017-08-05","stage_classifiercode":"13-01","member_number":"TY85282","first_name":"RANDEE","last_name":"KAISER","classification":"B","division":"LIMITED","hit_factor":5.9748},{"match_name":"Palmetto Gun Club - January 2016 USPSA","match_date":"2016-01-02","stage_classifiercode":"13-01","member_number":"A63410","first_name":"EDDIE","last_name":"HUGHES","classification":"B","division":"LIMITED","hit_factor":5.9701},{"match_name":"LIPSA - October 2nd 2020 - Mini USPSA Match","match_date":"2020-10-04","stage_classifiercode":"13-01","member_number":"A87771","first_name":"MICHAEL","last_name":"SCLAFANI","classification":"U","division":"LIMITED","hit_factor":5.9653},{"match_name":"IL 16 USPSA FEB 7 2016","match_date":"2016-02-07","stage_classifiercode":"13-01","member_number":"Ty53381","first_name":"ROB","last_name":"KOSACK","classification":"B","division":"LIMITED","hit_factor":5.9633},{"match_name":"Richmond Hot Shots November 17-18 USPSA Pistol Match","match_date":"2018-11-17","stage_classifiercode":"13-01","member_number":"TY89442","first_name":"JIM","last_name":"SUSOY","classification":"A","division":"LIMITED","hit_factor":5.9593},{"match_name":"DWB - Deadwood Boys USPSA February 4 2018","match_date":"2018-02-04","stage_classifiercode":"13-01","member_number":"\"\"","first_name":"SENSEI","last_name":"D","classification":"C","division":"LIMITED","hit_factor":5.951},{"match_name":"Gem City Gun Club 1-04 and 1-05 2020","match_date":"2020-01-04","stage_classifiercode":"13-01","member_number":"A100953","first_name":"BRETT","last_name":"FRASER","classification":"C","division":"LIMITED","hit_factor":5.948},{"match_name":"CCPS  USPSA  2016 July","match_date":"2016-07-17","stage_classifiercode":"13-01","member_number":"\"\"","first_name":"CALEB","last_name":"PATTERSON","classification":"\"\"","division":"LIMITED","hit_factor":5.9471},{"match_name":"FSTC  12-17-17","match_date":"2017-12-17","stage_classifiercode":"13-01","member_number":"TY95610","first_name":"CHAD","last_name":"MOLL","classification":"C","division":"LIMITED","hit_factor":5.9448},{"match_name":"SLPSA May USPSA Match","match_date":"2020-05-16","stage_classifiercode":"13-01","member_number":"TY49638","first_name":"DAN","last_name":"WARD","classification":"B","division":"LIMITED","hit_factor":5.9448},{"match_name":"IL 16 USPSA FEB 7 2016","match_date":"2016-02-07","stage_classifiercode":"13-01","member_number":"A90192","first_name":"TIM","last_name":"TYLER","classification":"B","division":"LIMITED","hit_factor":5.9417},{"match_name":"HOPS USPSA 071517","match_date":"2017-07-15","stage_classifiercode":"13-01","member_number":"TY68934","first_name":"TIM","last_name":"HERRON","classification":"M","division":"LIMITED","hit_factor":5.9406},{"match_name":"Hose Monster Action Classifier","match_date":"2020-03-15","stage_classifiercode":"13-01","member_number":"fy95503","first_name":"KEVIN","last_name":"ALLISON","classification":"B","division":"LIMITED","hit_factor":5.9394},{"match_name":"ACC Oct Saturday 24th USPSA","match_date":"2020-10-24","stage_classifiercode":"13-01","member_number":"FY111692","first_name":"ROSE","last_name":"WRIGHT","classification":"B","division":"LIMITED","hit_factor":5.9385},{"match_name":"A3G-APS August 5th USPSA Classifier Match","match_date":"2018-08-05","stage_classifiercode":"13-01","member_number":"A100051","first_name":"BRIAN","last_name":"SHARP","classification":"B","division":"LIMITED","hit_factor":5.9371},{"match_name":"April 2017 FOP 72 2 Gun","match_date":"2017-04-16","stage_classifiercode":"13-01","member_number":"A29461","first_name":"JOE","last_name":"MIER","classification":"M","division":"LIMITED","hit_factor":5.9371},{"match_name":"CGGR February USPSA Match","match_date":"2016-02-20","stage_classifiercode":"13-01","member_number":"A50506","first_name":"SCOTT","last_name":"HENKLE","classification":"A","division":"LIMITED","hit_factor":5.9361},{"match_name":"PCWC USPSA  7 23 2016","match_date":"2016-07-23","stage_classifiercode":"13-01","member_number":"TY52476","first_name":"JOHN","last_name":"TISCHLER","classification":"B","division":"LIMITED","hit_factor":5.9351},{"match_name":"GPSL 11-1-16","match_date":"2016-11-01","stage_classifiercode":"13-01","member_number":"A86759","first_name":"CANDICE","last_name":"JULIANO","classification":"U","division":"LIMITED","hit_factor":5.9333},{"match_name":"Shasta Shooters 2020 Jan","match_date":"2020-01-11","stage_classifiercode":"13-01","member_number":"A121289","first_name":"WAYNE","last_name":"ALLEN III","classification":"B","division":"LIMITED","hit_factor":5.9278},{"match_name":"FBURG March 2017 Level I USPSA ","match_date":"2017-03-04","stage_classifiercode":"13-01","member_number":"TY28555","first_name":"TODD","last_name":"SINDELAR","classification":"M","division":"LIMITED","hit_factor":5.9246},{"match_name":"Gem City Gun Club 1-04 and 1-05 2020","match_date":"2020-01-04","stage_classifiercode":"13-01","member_number":"L1963","first_name":"DENNIS","last_name":"MICHALI","classification":"A","division":"LIMITED","hit_factor":5.9242},{"match_name":"Buas February Match","match_date":"2016-02-14","stage_classifiercode":"13-01","member_number":"a60707","first_name":"DAVE","last_name":"SOLIMINI","classification":"A","division":"LIMITED","hit_factor":5.9218},{"match_name":"Tarheel USPSA July 2016","match_date":"2016-07-09","stage_classifiercode":"13-01","member_number":"\"\"","first_name":"PATRICK","last_name":"HARALSON","classification":"U","division":"LIMITED","hit_factor":5.9211},{"match_name":"TBAS USPSA Match 1/26/2020","match_date":"2020-01-26","stage_classifiercode":"13-01","member_number":"FY101468","first_name":"JASON","last_name":"HAWK","classification":"C","division":"LIMITED","hit_factor":5.9172},{"match_name":"FBURG March 2017 Level I USPSA ","match_date":"2017-03-04","stage_classifiercode":"13-01","member_number":"TY55299","first_name":"DAVID","last_name":"BEAM","classification":"G","division":"LIMITED","hit_factor":5.9172},{"match_name":"5 Dogs April 2017 USPSA","match_date":"2017-04-02","stage_classifiercode":"13-01","member_number":"TY75163","first_name":"MIKE","last_name":"LILJEROOS","classification":"B","division":"LIMITED","hit_factor":5.9146},{"match_name":"SWGC USPSA Pistol Match - February 2021","match_date":"2021-02-06","stage_classifiercode":"13-01","member_number":"FY80548","first_name":"DAN","last_name":"DOIRON","classification":"B","division":"LIMITED","hit_factor":5.9102},{"match_name":"8a Fecha USPSA Classifier","match_date":"2018-08-12","stage_classifiercode":"13-01","member_number":"TY92124","first_name":"GERMAN","last_name":"VELEZ","classification":"B","division":"LIMITED","hit_factor":5.9024},{"match_name":"MVPSA Apr 72018","match_date":"2018-04-07","stage_classifiercode":"13-01","member_number":"A109683","first_name":"BEAU","last_name":"BLY","classification":"U","division":"LIMITED","hit_factor":5.8974},{"match_name":"IL 16 USPSA FEB 7 2016","match_date":"2016-02-07","stage_classifiercode":"13-01","member_number":"TY47125","first_name":"KEVIN","last_name":"MONK","classification":"X","division":"LIMITED","hit_factor":5.8962},{"match_name":"SLOSA Feburary 2016 USPSA","match_date":"2016-02-13","stage_classifiercode":"13-01","member_number":"TY-79621","first_name":"STEPHEN","last_name":"COLLEN","classification":"B","division":"LIMITED","hit_factor":5.8962},{"match_name":"Griffin USPSA Match Sep 17 2016","match_date":"2016-09-17","stage_classifiercode":"13-01","member_number":"TY85712","first_name":"MANDI","last_name":"MACDONALD","classification":"B","division":"LIMITED","hit_factor":5.8952},{"match_name":"Rankin Field August Sunday USPSA","match_date":"2020-08-16","stage_classifiercode":"13-01","member_number":"A86712","first_name":"CHRIS","last_name":"KIMES","classification":"A","division":"LIMITED","hit_factor":5.895},{"match_name":"SWGC USPSA Pistol Match - February 2021","match_date":"2021-02-06","stage_classifiercode":"13-01","member_number":"L4842","first_name":"JOSH","last_name":"WEEKS","classification":"M","division":"LIMITED","hit_factor":5.891},{"match_name":"SCCPSA USPSA Aug 19 2017","match_date":"2017-08-19","stage_classifiercode":"13-01","member_number":"TY22346","first_name":"BUCKY","last_name":"POLLARD","classification":"A","division":"LIMITED","hit_factor":5.8891},{"match_name":"Gem City Gun Club 1-04 and 1-05 2020","match_date":"2020-01-04","stage_classifiercode":"13-01","member_number":"L2450","first_name":"BUD","last_name":"CONNOLLY","classification":"B","division":"LIMITED","hit_factor":5.8824},{"match_name":"Blackstone Shooting Sports Snow Days January 2017 USPSA Level  1","match_date":"2017-01-08","stage_classifiercode":"13-01","member_number":"TY80548","first_name":"DAN","last_name":"DOIRON","classification":"C","division":"LIMITED","hit_factor":5.8757},{"match_name":"ACC Oct Saturday 24th USPSA","match_date":"2020-10-24","stage_classifiercode":"13-01","member_number":"TY104591","first_name":"DAVID","last_name":"HEUSS","classification":"B","division":"LIMITED","hit_factor":5.8756},{"match_name":"North East Ohio Shooters - OHN06 - 2017-06-24","match_date":"2017-06-24","stage_classifiercode":"13-01","member_number":"A92898","first_name":"JON","last_name":"STRAIN","classification":"C","division":"LIMITED","hit_factor":5.8745},{"match_name":"LCSA USPSA July","match_date":"2016-07-08","stage_classifiercode":"13-01","member_number":"A87855","first_name":"JUSTIN","last_name":"MEYER","classification":"U","division":"LIMITED","hit_factor":5.8733},{"match_name":"EAPS September 2016 USPSA","match_date":"2016-09-18","stage_classifiercode":"13-01","member_number":"A94183","first_name":"DAVID","last_name":"PAPE","classification":"B","division":"LIMITED","hit_factor":5.8698},{"match_name":"GRPC USPSA SOME LIKE IT HOT","match_date":"2018-08-05","stage_classifiercode":"13-01","member_number":"TY97870","first_name":"WILLIAM","last_name":"CHAN","classification":"D","division":"LIMITED","hit_factor":5.868},{"match_name":"PBR USPSA Classifier Match","match_date":"2018-06-11","stage_classifiercode":"13-01","member_number":"Ty82683","first_name":"BRIAN","last_name":"WOLFF","classification":"B","division":"LIMITED","hit_factor":5.8677},{"match_name":"DAPS USPSA at ETTS 4-8-2017","match_date":"2017-04-08","stage_classifiercode":"13-01","member_number":"TY66303","first_name":"BRIAN","last_name":"HURST","classification":"C","division":"LIMITED","hit_factor":5.8648},{"match_name":"NHRPC - October 2020 USPSA","match_date":"2020-10-10","stage_classifiercode":"13-01","member_number":"A129719","first_name":"JOEL","last_name":"SCHREIBER","classification":"U","division":"LIMITED","hit_factor":5.8625},{"match_name":"WSPS SEPTEMBER 2017 USPSA MATCH","match_date":"2017-09-16","stage_classifiercode":"13-01","member_number":"L1158","first_name":"JIM","last_name":"HAND","classification":"M","division":"LIMITED","hit_factor":5.8589},{"match_name":"Crooked Creek Pistol League - July 2018","match_date":"2018-07-14","stage_classifiercode":"13-01","member_number":"TY35253","first_name":"THOMAS","last_name":"SCHUSTER","classification":"A","division":"LIMITED","hit_factor":5.8583},{"match_name":"17s PSC - USPSA - July 2020","match_date":"2020-07-18","stage_classifiercode":"13-01","member_number":"A94623","first_name":"VERNON","last_name":"PASCUAL","classification":"X","division":"LIMITED","hit_factor":5.8564},{"match_name":"8a Fecha USPSA Classifier","match_date":"2018-08-12","stage_classifiercode":"13-01","member_number":"A63950","first_name":"EFREN","last_name":"CAMACHO","classification":"A","division":"LIMITED","hit_factor":5.8548},{"match_name":"PTPC February 4th Classifier Match","match_date":"2018-02-04","stage_classifiercode":"13-01","member_number":"FY51334","first_name":"JIM","last_name":"STOBAUGH","classification":"B","division":"LIMITED","hit_factor":5.8505},{"match_name":"MASTER BLASTERS & SSFGA USPSA - November","match_date":"2020-11-21","stage_classifiercode":"13-01","member_number":"TY94392","first_name":"ZACK","last_name":"ROBERGE","classification":"B","division":"LIMITED","hit_factor":5.8496},{"match_name":"Mvpsa April 2","match_date":"2016-04-02","stage_classifiercode":"13-01","member_number":"A89949","first_name":"TOM","last_name":"YOUNG","classification":"C","division":"LIMITED","hit_factor":5.848},{"match_name":"BRC_20160313","match_date":"2016-03-13","stage_classifiercode":"13-01","member_number":"A42083","first_name":"JIMMY","last_name":"HOLDSWORTH","classification":"X","division":"LIMITED","hit_factor":5.8465},{"match_name":"MVPSA June 2016 Points Match","match_date":"2016-06-04","stage_classifiercode":"13-01","member_number":"TY57751","first_name":"BOB","last_name":"HARRIS","classification":"A","division":"LIMITED","hit_factor":5.8309},{"match_name":"NRG Saturday July 10th Includes a Classifier Stage","match_date":"2021-07-10","stage_classifiercode":"13-01","member_number":"A101186","first_name":"ZACH","last_name":"BASICH","classification":"A","division":"LIMITED","hit_factor":5.8296},{"match_name":"Clairton Apr 09; 2017","match_date":"2017-04-09","stage_classifiercode":"13-01","member_number":"\"\"","first_name":"MARK","last_name":"CLEAVER","classification":"U","division":"LIMITED","hit_factor":5.8275},{"match_name":"USPSA AR02 North Arkansas Action Pistol July 9 2017","match_date":"2017-07-09","stage_classifiercode":"13-01","member_number":"TY48907","first_name":"DAVID","last_name":"LETSCH","classification":"B","division":"LIMITED","hit_factor":5.8263},{"match_name":"Tarheel USPSA July 2016","match_date":"2016-07-09","stage_classifiercode":"13-01","member_number":"TY70157","first_name":"KENNETH","last_name":"KIESLER","classification":"B","division":"LIMITED","hit_factor":5.8231},{"match_name":"A3G-APS August 5th USPSA Classifier Match","match_date":"2018-08-05","stage_classifiercode":"13-01","member_number":"FY65623","first_name":"ERIK","last_name":"KOPP","classification":"\"\"","division":"LIMITED","hit_factor":5.8152},{"match_name":"GAS September 2020 USPSA","match_date":"2020-09-05","stage_classifiercode":"13-01","member_number":"A122307","first_name":"DARREN","last_name":"COUNTS","classification":"C","division":"LIMITED","hit_factor":5.814},{"match_name":"Richmond Hot Shots Dec 2-3-2017 USPSA Pistol Match","match_date":"2017-12-02","stage_classifiercode":"13-01","member_number":"TY91248","first_name":"DAVID","last_name":"GEORGE","classification":"B","division":"LIMITED","hit_factor":5.814},{"match_name":"RMAP 3rd sunday August 2017","match_date":"2017-08-20","stage_classifiercode":"13-01","member_number":"TY78036","first_name":"MICHAEL","last_name":"PACHECO","classification":"B","division":"LIMITED","hit_factor":5.8114},{"match_name":"Patriot Action Shooters December 2015 Match","match_date":"2015-12-19","stage_classifiercode":"13-01","member_number":"TY85410","first_name":"CHAD","last_name":"SANDERS","classification":"C","division":"LIMITED","hit_factor":5.8111},{"match_name":"ISPS Nov 5th 2016","match_date":"2016-11-05","stage_classifiercode":"13-01","member_number":"A84188","first_name":"LAWRENCE","last_name":"OLETSKI","classification":"C","division":"LIMITED","hit_factor":5.8111},{"match_name":"INAS Dec 2016 USPSA","match_date":"2016-12-17","stage_classifiercode":"13-01","member_number":"A81373","first_name":"TIM","last_name":"KROHN","classification":"B","division":"LIMITED","hit_factor":5.8041},{"match_name":"WTPS USPSA April Classifier Match 4-8-17","match_date":"2017-04-08","stage_classifiercode":"13-01","member_number":"TY85410","first_name":"CHAD","last_name":"SANDERS","classification":"C","division":"LIMITED","hit_factor":5.7971},{"match_name":"FPS USPSA April2017","match_date":"2017-04-02","stage_classifiercode":"13-01","member_number":"A98599","first_name":"MIKE T","last_name":"DIGIOVANNI","classification":"C","division":"LIMITED","hit_factor":5.7937},{"match_name":"2021-03 Bone Creek USPSA","match_date":"2021-03-07","stage_classifiercode":"13-01","member_number":"A95318","first_name":"JOSEPH","last_name":"NEWCOMB","classification":"C","division":"LIMITED","hit_factor":5.787},{"match_name":"NHRPC - October 2020 USPSA","match_date":"2020-10-10","stage_classifiercode":"13-01","member_number":"A111789","first_name":"NATHAN","last_name":"GORENSTEIN","classification":"C","division":"LIMITED","hit_factor":5.7692},{"match_name":"Range54 USPSA","match_date":"2018-05-04","stage_classifiercode":"13-01","member_number":"ty47716","first_name":"ANTHONY","last_name":"NIXON","classification":"A","division":"LIMITED","hit_factor":5.7671},{"match_name":"EAPS  January 2016","match_date":"2016-01-17","stage_classifiercode":"13-01","member_number":"TY57707","first_name":"JOE","last_name":"JONES","classification":"B","division":"LIMITED","hit_factor":5.7644},{"match_name":"CRC USPSA August 2021","match_date":"2021-08-14","stage_classifiercode":"13-01","member_number":"TY68981","first_name":"JOEL","last_name":"LUDWIG","classification":"B","division":"LIMITED","hit_factor":5.7641},{"match_name":"Havana May 7 2016 USPSA Match","match_date":"2016-05-07","stage_classifiercode":"13-01","member_number":"Ty49550","first_name":"CRAIG","last_name":"BERGMAN","classification":"C","division":"LIMITED","hit_factor":5.7631},{"match_name":"Lafayette Practical Shooters - THURS - Oct 7","match_date":"2021-10-07","stage_classifiercode":"13-01","member_number":"A108820","first_name":"COLIN","last_name":"MONTGOMERY","classification":"A","division":"LIMITED","hit_factor":5.7623},{"match_name":"PCWC USPSA  9 22 2018","match_date":"2018-09-22","stage_classifiercode":"13-01","member_number":"TY96561","first_name":"STEPHEN","last_name":"TO","classification":"B","division":"LIMITED","hit_factor":5.7618},{"match_name":"Hopkinton March Mini-Match","match_date":"2020-03-14","stage_classifiercode":"13-01","member_number":"A118659","first_name":"COREY","last_name":"LAMMERDING","classification":"C","division":"LIMITED","hit_factor":5.7554},{"match_name":"Brazosland Pistoleros August 20 2017","match_date":"2017-08-20","stage_classifiercode":"13-01","member_number":"A98517","first_name":"CHRIS","last_name":"WHITT","classification":"C","division":"LIMITED","hit_factor":5.7508},{"match_name":"BRRC GAS USPSA MAY 12 2018","match_date":"2018-05-12","stage_classifiercode":"13-01","member_number":"TY63182","first_name":"RUSTIN","last_name":"BERNSKOETTER","classification":"U","division":"LIMITED","hit_factor":5.75},{"match_name":"PTPC February 4th Classifier Match","match_date":"2018-02-04","stage_classifiercode":"13-01","member_number":"TY76261","first_name":"DAN","last_name":"LONG","classification":"B","division":"LIMITED","hit_factor":5.7405},{"match_name":"Fairfax PS USPSA August 2018","match_date":"2018-08-21","stage_classifiercode":"13-01","member_number":"A93612","first_name":"PAUL","last_name":"RANDAZZO","classification":"B","division":"LIMITED","hit_factor":5.7357},{"match_name":"BRSP Tuesday Night USPSA Match - Aug 14","match_date":"2018-08-15","stage_classifiercode":"13-01","member_number":"Ty97714","first_name":"JUSTIN","last_name":"LARKIN","classification":"M","division":"LIMITED","hit_factor":5.731},{"match_name":"Morning SMPS 12 July 2020 USPSA Classifier Match","match_date":"2020-07-12","stage_classifiercode":"13-01","member_number":"L4368","first_name":"JOHN","last_name":"FINLEY","classification":"U","division":"LIMITED","hit_factor":5.7303},{"match_name":"BRRC GAS USPSA MAY 12 2018","match_date":"2018-05-12","stage_classifiercode":"13-01","member_number":"TY81279","first_name":"JARROD","last_name":"GROVE","classification":"B","division":"LIMITED","hit_factor":5.7292},{"match_name":"YMM IPSC02 2017_10_08","match_date":"2017-10-08","stage_classifiercode":"13-01","member_number":"A103276","first_name":"AMOS","last_name":"AUBERRY","classification":"D","division":"LIMITED","hit_factor":5.7292},{"match_name":"Blackstone Shooting Sports Snow Days January 2017 USPSA Level  1","match_date":"2017-01-08","stage_classifiercode":"13-01","member_number":"A82837","first_name":"DANIEL","last_name":"BOYLSTON","classification":"B","division":"LIMITED","hit_factor":5.7285},{"match_name":"NHRPC - August 2016 USPSA","match_date":"2016-08-14","stage_classifiercode":"13-01","member_number":"A98254","first_name":"MARK","last_name":"HARBOLD","classification":"U","division":"LIMITED","hit_factor":5.7279},{"match_name":"Tarheel USPSA July 2016","match_date":"2016-07-09","stage_classifiercode":"13-01","member_number":"\"\"","first_name":"JOHN","last_name":"PARKS","classification":"U","division":"LIMITED","hit_factor":5.7274},{"match_name":"BAPS USPSA October","match_date":"2018-10-20","stage_classifiercode":"13-01","member_number":"A14332","first_name":"ERIC","last_name":"MCCAMPBELL","classification":"C","division":"LIMITED","hit_factor":5.7239},{"match_name":"NRG Saturday January 13th - Includes a Classifier Stage","match_date":"2018-01-13","stage_classifiercode":"13-01","member_number":"A62919","first_name":"PATRICK","last_name":"DOUGHERTY","classification":"U","division":"LIMITED","hit_factor":5.7217},{"match_name":"CGGR February USPSA Match","match_date":"2016-02-20","stage_classifiercode":"13-01","member_number":"\"\"","first_name":"KYLE","last_name":"SOLE","classification":"U","division":"LIMITED","hit_factor":5.7211},{"match_name":"LTD Pistol - May 2017","match_date":"2017-05-06","stage_classifiercode":"13-01","member_number":"A99024","first_name":"FELIPE","last_name":"CERVANTES","classification":"C","division":"LIMITED","hit_factor":5.7143},{"match_name":"EAPS February 2018 USPSA","match_date":"2018-02-18","stage_classifiercode":"13-01","member_number":"TY94097","first_name":"STEVE","last_name":"TANNETTA","classification":"A","division":"LIMITED","hit_factor":5.7143},{"match_name":"OPSC USPSA 7-10-2016","match_date":"2016-07-10","stage_classifiercode":"13-01","member_number":"TY1274","first_name":"RON","last_name":"VANDERGRIFT","classification":"B","division":"LIMITED","hit_factor":5.7143},{"match_name":"MPSA 080418 USPSA","match_date":"2018-08-04","stage_classifiercode":"13-01","member_number":"FY94000","first_name":"MICHAEL","last_name":"MORGAN","classification":"B","division":"LIMITED","hit_factor":5.7143},{"match_name":"BRRC GAS USPSA MAY 12 2018","match_date":"2018-05-12","stage_classifiercode":"13-01","member_number":"TY73189","first_name":"BILL","last_name":"CARTER","classification":"C","division":"LIMITED","hit_factor":5.7085},{"match_name":"BRRC GAS USPSA MAY 12 2018","match_date":"2018-05-12","stage_classifiercode":"13-01","member_number":"A98832","first_name":"BRANDON","last_name":"CREPS","classification":"B","division":"LIMITED","hit_factor":5.7078},{"match_name":"DAPS USPSA at ETTS 4-8-2017","match_date":"2017-04-08","stage_classifiercode":"13-01","member_number":"A94608","first_name":"ESTUARDO","last_name":"BALDERAS","classification":"B","division":"LIMITED","hit_factor":5.7001},{"match_name":"HRC December 2015","match_date":"2015-12-06","stage_classifiercode":"13-01","member_number":"L3056","first_name":"CHRIS","last_name":"FILA","classification":"A","division":"LIMITED","hit_factor":5.6902},{"match_name":"LTD Pistol - May 2017","match_date":"2017-05-06","stage_classifiercode":"13-01","member_number":"A89867","first_name":"ZANE","last_name":"HAVILAND","classification":"A","division":"LIMITED","hit_factor":5.6899},{"match_name":"SPSA USPSA October 1st Sat Match","match_date":"2020-10-03","stage_classifiercode":"13-01","member_number":"A94555","first_name":"ALAN","last_name":"CRANFORD","classification":"C","division":"LIMITED","hit_factor":5.6877},{"match_name":"DWB - Deadwood Boys USPSA 03 June 2018","match_date":"2018-06-03","stage_classifiercode":"13-01","member_number":"TY78872","first_name":"BRANDON","last_name":"CHIN","classification":"U","division":"LIMITED","hit_factor":5.6848},{"match_name":"RDS Aug 52017 USPSA  Match","match_date":"2017-08-05","stage_classifiercode":"13-01","member_number":"A99960","first_name":"TYLER","last_name":"BUCHOLZ","classification":"U","division":"LIMITED","hit_factor":5.6806},{"match_name":"WELD ECO09 20180617","match_date":"2018-06-17","stage_classifiercode":"13-01","member_number":"TY87911","first_name":"KEITH","last_name":"MARKEY","classification":"B","division":"LIMITED","hit_factor":5.6805},{"match_name":"AIPS Weekly USPSA 17 April 2018","match_date":"2018-04-17","stage_classifiercode":"13-01","member_number":"TY49258","first_name":"BRIAN","last_name":"HOOD","classification":"B","division":"LIMITED","hit_factor":5.6793},{"match_name":"Applied IN25 USPSA March classifier","match_date":"2017-03-21","stage_classifiercode":"13-01","member_number":"L4004","first_name":"AARON","last_name":"LORTON","classification":"C","division":"LIMITED","hit_factor":5.6793},{"match_name":"DAPS USPSA at ETTS 4-8-2017","match_date":"2017-04-08","stage_classifiercode":"13-01","member_number":"PENDING","first_name":"RILEY","last_name":"KROPFF","classification":"U","division":"LIMITED","hit_factor":5.679},{"match_name":"BPSA January 2017 USPSA","match_date":"2017-01-22","stage_classifiercode":"13-01","member_number":"A98844","first_name":"BRYCE","last_name":"DUPUY","classification":"U","division":"LIMITED","hit_factor":5.6745},{"match_name":"SLPSA Feb USPSA","match_date":"2018-02-17","stage_classifiercode":"13-01","member_number":"\"\"","first_name":"JAMES","last_name":"LITZ","classification":"U","division":"LIMITED","hit_factor":5.6711},{"match_name":"12a Fecha USPSA","match_date":"2017-11-12","stage_classifiercode":"13-01","member_number":"A92124","first_name":"GERMAN","last_name":"VELEZ","classification":"C","division":"LIMITED","hit_factor":5.6701},{"match_name":"SFA USPSA AUGUST 2018","match_date":"2018-08-18","stage_classifiercode":"13-01","member_number":"A99017","first_name":"GUY","last_name":"CUNNINGHAM","classification":"C","division":"LIMITED","hit_factor":5.6701},{"match_name":"PPPS 3-12-17","match_date":"2017-03-12","stage_classifiercode":"13-01","member_number":"A92674","first_name":"BEN","last_name":"TARVER","classification":"U","division":"LIMITED","hit_factor":5.6684},{"match_name":"ISPS Nov 5th 2016","match_date":"2016-11-05","stage_classifiercode":"13-01","member_number":"A92669","first_name":"SCOTT","last_name":"VICKERS","classification":"B","division":"LIMITED","hit_factor":5.6663},{"match_name":"EWPSA 2018-07","match_date":"2018-07-14","stage_classifiercode":"13-01","member_number":"A69094","first_name":"AARON","last_name":"LAWS","classification":"M","division":"LIMITED","hit_factor":5.6662},{"match_name":"COPS Jan 2016 USPSA Match","match_date":"2016-01-03","stage_classifiercode":"13-01","member_number":"\"\"","first_name":"KIRK","last_name":"BROYLES","classification":"A","division":"LIMITED","hit_factor":5.6564},{"match_name":"PSAC 20210905","match_date":"2021-09-05","stage_classifiercode":"13-01","member_number":"FY129660","first_name":"SCOTT","last_name":"DOUGHERTY","classification":"C","division":"LIMITED","hit_factor":5.6537},{"match_name":"SLPSA May USPSA Match","match_date":"2020-05-16","stage_classifiercode":"13-01","member_number":"TY7218","first_name":"MARK","last_name":"WAKI","classification":"G","division":"LIMITED","hit_factor":5.6537},{"match_name":"BAPS USPSA October","match_date":"2018-10-20","stage_classifiercode":"13-01","member_number":"FY78742","first_name":"CASEY","last_name":"PARSONS","classification":"U","division":"LIMITED","hit_factor":5.6503},{"match_name":"SLPSA Feb USPSA","match_date":"2018-02-17","stage_classifiercode":"13-01","member_number":"TY88704","first_name":"GARY","last_name":"HANSEN","classification":"C","division":"LIMITED","hit_factor":5.6497},{"match_name":"SPSA USPSA October 1st Sat Match","match_date":"2020-10-03","stage_classifiercode":"13-01","member_number":"TY108779","first_name":"DARRELL","last_name":"BISHOP","classification":"C","division":"LIMITED","hit_factor":5.6471},{"match_name":"SPSA USPSA August 4th Sat match","match_date":"2016-08-27","stage_classifiercode":"13-01","member_number":"A94555","first_name":"ALAN","last_name":"CRANFORD","classification":"C","division":"LIMITED","hit_factor":5.6471},{"match_name":"AIPS  USPSA Weekly 30 August 2016","match_date":"2016-08-30","stage_classifiercode":"13-01","member_number":"TY31876","first_name":"BRAD","last_name":"WADE","classification":"B","division":"LIMITED","hit_factor":5.646},{"match_name":"ORPCI 2016.03.19 Pistol","match_date":"2016-03-19","stage_classifiercode":"13-01","member_number":"TY66195","first_name":"ADAM","last_name":"DEWUS","classification":"C","division":"LIMITED","hit_factor":5.6443},{"match_name":"MS06 Team Magnolia July 2017 USPSA Match","match_date":"2017-07-01","stage_classifiercode":"13-01","member_number":"A45690","first_name":"BILL","last_name":"BERTHOLD","classification":"U","division":"LIMITED","hit_factor":5.6416},{"match_name":"NOCPC Jan 2018","match_date":"2018-01-21","stage_classifiercode":"13-01","member_number":"A79637","first_name":"JOE","last_name":"KRISPIN","classification":"U","division":"LIMITED","hit_factor":5.641},{"match_name":"LdF USPSA Match August 22 2020","match_date":"2020-08-22","stage_classifiercode":"13-01","member_number":"TY97709","first_name":"DAVID JR.","last_name":"DEZAN","classification":"C","division":"LIMITED","hit_factor":5.6399},{"match_name":"Mvpsa April 2","match_date":"2016-04-02","stage_classifiercode":"13-01","member_number":"\"\"","first_name":"ERIC","last_name":"HERZOG","classification":"U","division":"LIMITED","hit_factor":5.6373},{"match_name":"Morning SMPS 12 July 2020 USPSA Classifier Match","match_date":"2020-07-12","stage_classifiercode":"13-01","member_number":"A44903","first_name":"BILL","last_name":"SCHWAB","classification":"M","division":"LIMITED","hit_factor":5.6338},{"match_name":"Renton USPSA May 2018 - NW05","match_date":"2018-05-27","stage_classifiercode":"13-01","member_number":"ty92838","first_name":"GREG","last_name":"BECK","classification":"B","division":"LIMITED","hit_factor":5.6338},{"match_name":"MVPSA Apr 72018","match_date":"2018-04-07","stage_classifiercode":"13-01","member_number":"A103631","first_name":"MICHEAL","last_name":"COOPER","classification":"C","division":"LIMITED","hit_factor":5.632},{"match_name":"MSSA USPSA June  10 2017","match_date":"2017-06-10","stage_classifiercode":"13-01","member_number":"A91827","first_name":"PRESTON","last_name":"KING","classification":"B","division":"LIMITED","hit_factor":5.6319},{"match_name":"Havana May 7 2016 USPSA Match","match_date":"2016-05-07","stage_classifiercode":"13-01","member_number":"A62932","first_name":"RICHARD","last_name":"LANE","classification":"B","division":"LIMITED","hit_factor":5.6257},{"match_name":"MSSA USPSA June  10 2017","match_date":"2017-06-10","stage_classifiercode":"13-01","member_number":"A79446","first_name":"BEN","last_name":"BLANKENSHIP","classification":"B","division":"LIMITED","hit_factor":5.618},{"match_name":"MVPSA June 2016 Points Match","match_date":"2016-06-04","stage_classifiercode":"13-01","member_number":"A92017","first_name":"GAVIN","last_name":"WRIGLEY","classification":"U","division":"LIMITED","hit_factor":5.6144},{"match_name":"Pioneer Action Shooters USPSA 5-23-21 Special Classifer","match_date":"2021-05-23","stage_classifiercode":"13-01","member_number":"L5032","first_name":"DEVIN","last_name":"MCMANUS","classification":"U","division":"LIMITED","hit_factor":5.614},{"match_name":"TGC USPSA September 2017","match_date":"2017-09-16","stage_classifiercode":"13-01","member_number":"A83285","first_name":"GARY","last_name":"AU - LIMITED","classification":"B","division":"LIMITED","hit_factor":5.5992},{"match_name":"OKCGC USPSA Dec 2017 Match","match_date":"2017-12-02","stage_classifiercode":"13-01","member_number":"A106614","first_name":"PARKER","last_name":"GREENLEE","classification":"U","division":"LIMITED","hit_factor":5.5959},{"match_name":"PGC USPSA  Practice Match 11-28-17","match_date":"2017-11-28","stage_classifiercode":"13-01","member_number":"A90516","first_name":"JARED","last_name":"FOX","classification":"M","division":"LIMITED","hit_factor":5.5921},{"match_name":"MCRC USPSA October 2018","match_date":"2018-10-13","stage_classifiercode":"13-01","member_number":"A54598","first_name":"PAUL","last_name":"RICHARDSON","classification":"U","division":"LIMITED","hit_factor":5.5907},{"match_name":"Morning SMPS 12 July 2020 USPSA Classifier Match","match_date":"2020-07-12","stage_classifiercode":"13-01","member_number":"TY115166","first_name":"DAVID","last_name":"METCALFE","classification":"U","division":"LIMITED","hit_factor":5.5901},{"match_name":"MCRC USPSA October 2018","match_date":"2018-10-13","stage_classifiercode":"13-01","member_number":"TY90372","first_name":"CLARK","last_name":"SMITH","classification":"B","division":"LIMITED","hit_factor":5.5854},{"match_name":"Rankin Field August Sunday USPSA","match_date":"2020-08-16","stage_classifiercode":"13-01","member_number":"A119545","first_name":"RICHARD","last_name":"GUERZON","classification":"C","division":"LIMITED","hit_factor":5.5843},{"match_name":"Tarheel USPSA July 2016","match_date":"2016-07-09","stage_classifiercode":"13-01","member_number":"\"\"","first_name":"MILES","last_name":"KIHARA","classification":"U","division":"LIMITED","hit_factor":5.5838},{"match_name":"CVSC 12-31-2017","match_date":"2017-12-31","stage_classifiercode":"13-01","member_number":"TY52971","first_name":"BRAD","last_name":"HOLT","classification":"M","division":"LIMITED","hit_factor":5.5807},{"match_name":"Richmond Hot Shots Dec 2-3-2017 USPSA Pistol Match","match_date":"2017-12-02","stage_classifiercode":"13-01","member_number":"FY84916","first_name":"JOHN","last_name":"MITCHELL","classification":"C","division":"LIMITED","hit_factor":5.5738},{"match_name":"MRCPS USPSA Feb    2016","match_date":"2016-02-21","stage_classifiercode":"13-01","member_number":"A85786","first_name":"NOEL","last_name":"DOMINGO","classification":"C","division":"LIMITED","hit_factor":5.5734},{"match_name":"Palmetto Gun Club - January 2016 USPSA","match_date":"2016-01-02","stage_classifiercode":"13-01","member_number":"A90458","first_name":"WILL","last_name":"JOHNSON","classification":"U","division":"LIMITED","hit_factor":5.5718},{"match_name":"WTPS USPSA April Classifier Match 4-8-17","match_date":"2017-04-08","stage_classifiercode":"13-01","member_number":"A99678","first_name":"LONNY","last_name":"GUPTON","classification":"C","division":"LIMITED","hit_factor":5.5687},{"match_name":"GRPC USPSA SOME LIKE IT HOT","match_date":"2018-08-05","stage_classifiercode":"13-01","member_number":"A97249","first_name":"CHET","last_name":"JONES","classification":"C","division":"LIMITED","hit_factor":5.5684},{"match_name":"2018-08-04 USPSA at Phoenix Rod and Gun Club","match_date":"2018-08-04","stage_classifiercode":"13-01","member_number":"\"\"","first_name":"JUSTIN","last_name":"SHERIFF","classification":"\"\"","division":"LIMITED","hit_factor":5.5675},{"match_name":"MS06 Team Magnolia July 2017 USPSA Match","match_date":"2017-07-01","stage_classifiercode":"13-01","member_number":"A67704","first_name":"MICHAEL","last_name":"MCDONALD","classification":"A","division":"LIMITED","hit_factor":5.5623},{"match_name":"Richmond Hot Shots Dec 2-3-2017 USPSA Pistol Match","match_date":"2017-12-02","stage_classifiercode":"13-01","member_number":"A60621","first_name":"JUN","last_name":"AMPIL","classification":"B","division":"LIMITED","hit_factor":5.5556},{"match_name":"LCSA USPSA July","match_date":"2016-07-08","stage_classifiercode":"13-01","member_number":"A87855","first_name":"JUSTIN","last_name":"MEYER","classification":"U","division":"LIMITED","hit_factor":5.5556},{"match_name":"Tarheel USPSA July 2016","match_date":"2016-07-09","stage_classifiercode":"13-01","member_number":"\"\"","first_name":"JEAN-CLAUDE","last_name":"FILS-AIME","classification":"U","division":"LIMITED","hit_factor":5.5556},{"match_name":"LdF USPSA Match August 22 2020","match_date":"2020-08-22","stage_classifiercode":"13-01","member_number":"L4366","first_name":"IGOR","last_name":"CADEZ","classification":"A","division":"LIMITED","hit_factor":5.5556},{"match_name":"SUPS USPSA19-20JUN2021","match_date":"2021-06-19","stage_classifiercode":"13-01","member_number":"FY110670","first_name":"WILL","last_name":"MACLEOD","classification":"C","division":"LIMITED","hit_factor":5.5556},{"match_name":"APSC USPSA Match 08-04-18","match_date":"2018-08-04","stage_classifiercode":"13-01","member_number":"\"\"","first_name":"KYLEIGH","last_name":"HAYWORTH","classification":"U","division":"LIMITED","hit_factor":5.5491},{"match_name":"Minnetonka Game And Fish July 12","match_date":"2017-07-12","stage_classifiercode":"13-01","member_number":"A-7045","first_name":"DAVID","last_name":"HORN","classification":"A","division":"LIMITED","hit_factor":5.5485},{"match_name":"ACC Oct Saturday 24th USPSA","match_date":"2020-10-24","stage_classifiercode":"13-01","member_number":"A89246","first_name":"LARRY","last_name":"FRANCIS","classification":"B","division":"LIMITED","hit_factor":5.5441},{"match_name":"CVSC 12-31-2017","match_date":"2017-12-31","stage_classifiercode":"13-01","member_number":"\"\"","first_name":"ERRAN","last_name":"MAYFIELD","classification":"U","division":"LIMITED","hit_factor":5.5394},{"match_name":"APSC USPSA Match 08-04-18","match_date":"2018-08-04","stage_classifiercode":"13-01","member_number":"A68686","first_name":"ANDREW","last_name":"HOWE","classification":"U","division":"LIMITED","hit_factor":5.5371},{"match_name":"SLPSA Feb USPSA","match_date":"2018-02-17","stage_classifiercode":"13-01","member_number":"A89867","first_name":"ZANE","last_name":"HAVILAND","classification":"A","division":"LIMITED","hit_factor":5.5292},{"match_name":"Alpha Mike June 2016","match_date":"2016-06-19","stage_classifiercode":"13-01","member_number":"A62697","first_name":"STEVE","last_name":"PEDERSON","classification":"C","division":"LIMITED","hit_factor":5.5266},{"match_name":"CGC CTX02 Monthly USPSA Match - March 2021","match_date":"2021-03-21","stage_classifiercode":"13-01","member_number":"A3710","first_name":"BRAD","last_name":"WILKINSON","classification":"B","division":"LIMITED","hit_factor":5.5236},{"match_name":"Brazosland Pistoleros USPSA - Sunday February 16","match_date":"2020-02-16","stage_classifiercode":"13-01","member_number":"a94696","first_name":"JASON","last_name":"WILSON","classification":"M","division":"LIMITED","hit_factor":5.5229},{"match_name":"TCGC Polo March 2016 Classifier Match","match_date":"2016-03-20","stage_classifiercode":"13-01","member_number":"TY69648","first_name":"STEVE","last_name":"GALKA","classification":"\"\"","division":"LIMITED","hit_factor":5.5224},{"match_name":"CGC CTX02 Monthly USPSA Match - March 2021","match_date":"2021-03-21","stage_classifiercode":"13-01","member_number":"Ty99880","first_name":"JEREMY","last_name":"LUSTER","classification":"B","division":"LIMITED","hit_factor":5.5195},{"match_name":"Clairton Apr 09; 2017","match_date":"2017-04-09","stage_classifiercode":"13-01","member_number":"TY65386","first_name":"DAVID R","last_name":"MULOCK","classification":"B","division":"LIMITED","hit_factor":5.5127},{"match_name":"USPSA MO21 2Alpha SBRC April 25 2020","match_date":"2020-04-25","stage_classifiercode":"13-01","member_number":"A107705","first_name":"LANCE","last_name":"PEDERSEN","classification":"C","division":"LIMITED","hit_factor":5.5094},{"match_name":"TGSS March Tac Match","match_date":"2016-04-01","stage_classifiercode":"13-01","member_number":"\"\"","first_name":"RICH","last_name":"BUSCH","classification":"\"\"","division":"LIMITED","hit_factor":5.5085},{"match_name":"Coastal Area Practical Shooters 4-28-18","match_date":"2018-04-28","stage_classifiercode":"13-01","member_number":"TY108760","first_name":"BRADY","last_name":"WHITE","classification":"U","division":"LIMITED","hit_factor":5.508},{"match_name":"5 Dogs April 2017 USPSA","match_date":"2017-04-02","stage_classifiercode":"13-01","member_number":"TY42859","first_name":"MIKE","last_name":"RICHEY","classification":"B","division":"LIMITED","hit_factor":5.5066},{"match_name":"BORCC USPSA July 2018 Classifier Match","match_date":"2018-07-02","stage_classifiercode":"13-01","member_number":"A89246","first_name":"LARRY","last_name":"FRANCIS","classification":"C","division":"LIMITED","hit_factor":5.5036},{"match_name":"PSAC 20210905","match_date":"2021-09-05","stage_classifiercode":"13-01","member_number":"L3928","first_name":"BENJAMIN","last_name":"GO","classification":"B","division":"LIMITED","hit_factor":5.5026},{"match_name":"WAC May 23rd (4th Sunday) - USPSA 6 Stage Match","match_date":"2021-05-23","stage_classifiercode":"13-01","member_number":"A7875","first_name":"LOUIS","last_name":"HEMNESS","classification":"A","division":"LIMITED","hit_factor":5.4994},{"match_name":"CGGR February USPSA Match","match_date":"2016-02-20","stage_classifiercode":"13-01","member_number":"A92624","first_name":"MATT","last_name":"LEVINER","classification":"U","division":"LIMITED","hit_factor":5.499},{"match_name":"IL 16 USPSA FEB 7 2016","match_date":"2016-02-07","stage_classifiercode":"13-01","member_number":"Ty76261","first_name":"DAN","last_name":"LONG","classification":"C","division":"LIMITED","hit_factor":5.4979},{"match_name":"Buas February Match","match_date":"2016-02-14","stage_classifiercode":"13-01","member_number":"a598","first_name":"KENNETH","last_name":"RUEFFERT","classification":"A","division":"LIMITED","hit_factor":5.491},{"match_name":"Palmetto Gun Club - January 2016 USPSA","match_date":"2016-01-02","stage_classifiercode":"13-01","member_number":"A55997","first_name":"LEE","last_name":"KING","classification":"A","division":"LIMITED","hit_factor":5.4902},{"match_name":"Palmetto Gun Club - January 2016 USPSA","match_date":"2016-01-02","stage_classifiercode":"13-01","member_number":"\"\"","first_name":"RENE","last_name":"QUINDO","classification":"U","division":"LIMITED","hit_factor":5.4857},{"match_name":"DSS - USPSA 18-03-24","match_date":"2018-03-24","stage_classifiercode":"13-01","member_number":"A100496","first_name":"DAVID","last_name":"LILES","classification":"C","division":"LIMITED","hit_factor":5.4852},{"match_name":"SPSA USPSA August 4th Sat match","match_date":"2016-08-27","stage_classifiercode":"13-01","member_number":"A82837","first_name":"DANIEL","last_name":"BOYLSTON","classification":"B","division":"LIMITED","hit_factor":5.4847},{"match_name":"BMPSA Apr 21 2018","match_date":"2018-04-21","stage_classifiercode":"13-01","member_number":"TY87268","first_name":"BRYCE","last_name":"PARISIEN","classification":"B","division":"LIMITED","hit_factor":5.481},{"match_name":"PPPS 3-12-17","match_date":"2017-03-12","stage_classifiercode":"13-01","member_number":"FY26112","first_name":"ROBERT","last_name":"SWAINSON","classification":"M","division":"LIMITED","hit_factor":5.4809},{"match_name":"PIPS 05-30-2018","match_date":"2018-05-29","stage_classifiercode":"13-01","member_number":"A103536","first_name":"SHAWN","last_name":"DONAHUE","classification":"C","division":"LIMITED","hit_factor":5.478},{"match_name":"TMGN December 2 USPSA Classifier Match","match_date":"2018-12-03","stage_classifiercode":"13-01","member_number":"A104040","first_name":"JOHN","last_name":"MAUNEY","classification":"D","division":"LIMITED","hit_factor":5.4779},{"match_name":"PCWC USPSA  7 23 2016","match_date":"2016-07-23","stage_classifiercode":"13-01","member_number":"A87275","first_name":"SCOTT","last_name":"MAHL","classification":"C","division":"LIMITED","hit_factor":5.4752},{"match_name":"Competitive Shooters of Lake Norman CORNELIUS Thursday Evening Indoor USPSA Pistol Match North Carolina","match_date":"2018-04-05","stage_classifiercode":"13-01","member_number":"TY88089","first_name":"DAVID","last_name":"BURTON","classification":"B","division":"LIMITED","hit_factor":5.4721},{"match_name":"Renton USPSA May 2018 - NW05","match_date":"2018-05-27","stage_classifiercode":"13-01","member_number":"A85786","first_name":"NOEL","last_name":"DOMINGO","classification":"B","division":"LIMITED","hit_factor":5.4678},{"match_name":"MSSA USPSA","match_date":"2016-11-06","stage_classifiercode":"13-01","member_number":"A99095","first_name":"JASON","last_name":"PADAWER","classification":"U","division":"LIMITED","hit_factor":5.4665},{"match_name":"GRPC USPSA SOME LIKE IT HOT","match_date":"2018-08-05","stage_classifiercode":"13-01","member_number":"A109961","first_name":"NICK","last_name":"MILKS","classification":"U","division":"LIMITED","hit_factor":5.4622},{"match_name":"May 2018 at MPSA","match_date":"2018-05-27","stage_classifiercode":"13-01","member_number":"TY99274","first_name":"KAMIL","last_name":"RADZYMINSKI","classification":"C","division":"LIMITED","hit_factor":5.4616},{"match_name":"RangeMasters 3-29-18","match_date":"2018-03-29","stage_classifiercode":"13-01","member_number":"TY101025","first_name":"VINH","last_name":"LAM","classification":"A","division":"LIMITED","hit_factor":5.4545},{"match_name":"MVPSA June 2016 Points Match","match_date":"2016-06-04","stage_classifiercode":"13-01","member_number":"A61500","first_name":"DAVID","last_name":"FRICK","classification":"B","division":"LIMITED","hit_factor":5.4545},{"match_name":"SPSA USPSA August 4th Sat match","match_date":"2016-08-27","stage_classifiercode":"13-01","member_number":"TY75124","first_name":"ROBBY","last_name":"HEWITT","classification":"B","division":"LIMITED","hit_factor":5.4524},{"match_name":"OPSC USPSA OCTOBER 2018","match_date":"2018-10-14","stage_classifiercode":"13-01","member_number":"A86957","first_name":"SCOTT","last_name":"WITTKE","classification":"B","division":"LIMITED","hit_factor":5.4492},{"match_name":"SUPS USPSA 5/7/2016","match_date":"2016-05-07","stage_classifiercode":"13-01","member_number":"A36748","first_name":"BOB","last_name":"WOLF","classification":"\"\"","division":"LIMITED","hit_factor":5.4336},{"match_name":"PCWC USPSA  7 23 2016","match_date":"2016-07-23","stage_classifiercode":"13-01","member_number":"TY94292","first_name":"TJ","last_name":"MEYERS","classification":"C","division":"LIMITED","hit_factor":5.4303},{"match_name":"Lafayette Practical Shooters - WED-THUR - Dec 19-20 - CLASSIFIER MATCH","match_date":"2018-12-20","stage_classifiercode":"13-01","member_number":"A108945","first_name":"JASON","last_name":"CHIASSON","classification":"U","division":"LIMITED","hit_factor":5.4223},{"match_name":"Rio Grande Practical Shooters - February 2017","match_date":"2017-02-04","stage_classifiercode":"13-01","member_number":"FY69551","first_name":"MIKE","last_name":"WHITTET","classification":"B","division":"LIMITED","hit_factor":5.4204},{"match_name":"Idaho ISPS August 4th 2018","match_date":"2018-08-04","stage_classifiercode":"13-01","member_number":"A34980","first_name":"DENNIS","last_name":"MAGEE","classification":"B","division":"LIMITED","hit_factor":5.4183},{"match_name":"NRG Saturday July 10th Includes a Classifier Stage","match_date":"2021-07-10","stage_classifiercode":"13-01","member_number":"A86806","first_name":"RANDY","last_name":"VILLANUEVA","classification":"B","division":"LIMITED","hit_factor":5.4176},{"match_name":"Patriot Action Shooters December 2015 Match","match_date":"2015-12-19","stage_classifiercode":"13-01","member_number":"A90794","first_name":"RANDY","last_name":"PRATT","classification":"C","division":"LIMITED","hit_factor":5.4162},{"match_name":"NRG December 10th 2016","match_date":"2016-12-10","stage_classifiercode":"13-01","member_number":"TY82298","first_name":"WALTER","last_name":"MICHALOWSKI","classification":"C","division":"LIMITED","hit_factor":5.414},{"match_name":"Applied IN25 USPSA October 2017 Classifier","match_date":"2017-10-18","stage_classifiercode":"13-01","member_number":"A88967","first_name":"BRENT","last_name":"LYKINS","classification":"U","division":"LIMITED","hit_factor":5.4113},{"match_name":"AIPS  USPSA Weekly 30 August 2016","match_date":"2016-08-30","stage_classifiercode":"13-01","member_number":"FY48057","first_name":"EARL","last_name":"HILL","classification":"C","division":"LIMITED","hit_factor":5.4054},{"match_name":"OPSC USPSA 7-10-2016","match_date":"2016-07-10","stage_classifiercode":"13-01","member_number":"TY82895","first_name":"JON","last_name":"ADLOF","classification":"D","division":"LIMITED","hit_factor":5.3998},{"match_name":"GAS September 2020 USPSA","match_date":"2020-09-05","stage_classifiercode":"13-01","member_number":"TY114014","first_name":"GARY","last_name":"YOST III","classification":"U","division":"LIMITED","hit_factor":5.3993},{"match_name":"Palmetto Gun Club - January 2016 USPSA","match_date":"2016-01-02","stage_classifiercode":"13-01","member_number":"A69774","first_name":"DAVID","last_name":"FISCHER","classification":"B","division":"LIMITED","hit_factor":5.3991},{"match_name":"NTPS-SE February 2017","match_date":"2017-02-18","stage_classifiercode":"13-01","member_number":"A99516","first_name":"MATTHEW","last_name":"PENINGER","classification":"U","division":"LIMITED","hit_factor":5.3991},{"match_name":"RMAP 3rd sunday August 2017","match_date":"2017-08-20","stage_classifiercode":"13-01","member_number":"A100659","first_name":"KERRY","last_name":"SARUWATARI","classification":"C","division":"LIMITED","hit_factor":5.3988},{"match_name":"New Holland USPSA - October 2016","match_date":"2016-10-09","stage_classifiercode":"13-01","member_number":"FY88040","first_name":"STEPHEN","last_name":"HOSAGE","classification":"B","division":"LIMITED","hit_factor":5.3968},{"match_name":"SFPC October Trophy match","match_date":"2016-10-02","stage_classifiercode":"13-01","member_number":"A32540","first_name":"MOSHE","last_name":"MIZRAHI","classification":"B","division":"LIMITED","hit_factor":5.395},{"match_name":"Clairton Apr 09; 2017","match_date":"2017-04-09","stage_classifiercode":"13-01","member_number":"\"\"","first_name":"JENNIFER","last_name":"TUROVSKY","classification":"C","division":"LIMITED","hit_factor":5.3946},{"match_name":"ENPS April USPSA Match","match_date":"2017-04-02","stage_classifiercode":"13-01","member_number":"A90387","first_name":"JOHN","last_name":"GASKO","classification":"C","division":"LIMITED","hit_factor":5.3933},{"match_name":"GWPP April 2016 Pistol","match_date":"2016-04-09","stage_classifiercode":"13-01","member_number":"A13721","first_name":"BILL","last_name":"HUNTER","classification":"C","division":"LIMITED","hit_factor":5.3911},{"match_name":"LCSA USPSA July","match_date":"2016-07-08","stage_classifiercode":"13-01","member_number":"A95936","first_name":"DAN","last_name":"HUBERT","classification":"U","division":"LIMITED","hit_factor":5.3886},{"match_name":"JCSSA NOV 7 2020","match_date":"2020-11-07","stage_classifiercode":"13-01","member_number":"A43366","first_name":"TIM","last_name":"CAVAZOS","classification":"C","division":"LIMITED","hit_factor":5.3886},{"match_name":"Triforce Practical Shooters at BigWoodsGoods 3-23-17","match_date":"2017-03-23","stage_classifiercode":"13-01","member_number":"A84202","first_name":"DOUG","last_name":"RUTLEDGE","classification":"B","division":"LIMITED","hit_factor":5.3879},{"match_name":"Shasta Shooters July 2016 Special Classifier","match_date":"2016-07-09","stage_classifiercode":"13-01","member_number":"A33123","first_name":"DAREN A","last_name":"HUSA","classification":"B","division":"LIMITED","hit_factor":5.3846},{"match_name":"LTD Pistol - May 2017","match_date":"2017-05-06","stage_classifiercode":"13-01","member_number":"TY72404","first_name":"DAVE","last_name":"MOORE","classification":"C","division":"LIMITED","hit_factor":5.383},{"match_name":"Bayou City USPSA Weekly Feb 13","match_date":"2020-02-14","stage_classifiercode":"13-01","member_number":"FY101009","first_name":"MARK","last_name":"LUTZEL","classification":"C","division":"LIMITED","hit_factor":5.3816},{"match_name":"Shoot GTR USPSA 06/06/12","match_date":"2017-06-06","stage_classifiercode":"13-01","member_number":"FY49501","first_name":"PJ","last_name":"BRUCAT","classification":"B","division":"LIMITED","hit_factor":5.379},{"match_name":"FSA - USPSA  8","match_date":"2017-02-12","stage_classifiercode":"13-01","member_number":"A51560","first_name":"MIKE","last_name":"HIMMEL","classification":"C","division":"LIMITED","hit_factor":5.3785},{"match_name":"The Range at Austin USPSA MAR2020","match_date":"2020-03-12","stage_classifiercode":"13-01","member_number":"TY112742","first_name":"ISAAC","last_name":"LERMA","classification":"C","division":"LIMITED","hit_factor":5.3775},{"match_name":"MCRC USPSA October 2018","match_date":"2018-10-13","stage_classifiercode":"13-01","member_number":"A82828","first_name":"JACK","last_name":"GASSAWAY","classification":"B","division":"LIMITED","hit_factor":5.3751},{"match_name":"SPSA USPSA October 1st Sat Match","match_date":"2020-10-03","stage_classifiercode":"13-01","member_number":"A87382","first_name":"CHRIS","last_name":"BRITT","classification":"B","division":"LIMITED","hit_factor":5.3748},{"match_name":"Competitive Shooters of Lake Norman CORNELIUS Thursday Evening Indoor USPSA Pistol Match North Carolina","match_date":"2018-04-05","stage_classifiercode":"13-01","member_number":"A93538","first_name":"JOHN","last_name":"ROYER","classification":"A","division":"LIMITED","hit_factor":5.3748},{"match_name":"MSSA USPSA","match_date":"2016-11-06","stage_classifiercode":"13-01","member_number":"\"\"","first_name":"BOB","last_name":"DUBOIS(2ND)","classification":"none","division":"LIMITED","hit_factor":5.3743},{"match_name":"WY02 GTS 5.5.18","match_date":"2018-05-05","stage_classifiercode":"13-01","member_number":"\"\"","first_name":"BEN","last_name":"MAYLAND","classification":"U","division":"LIMITED","hit_factor":5.3704},{"match_name":"Brazosland Pistoleros USPSA - Sunday February 16","match_date":"2020-02-16","stage_classifiercode":"13-01","member_number":"TY2227","first_name":"TOMMY","last_name":"TEAS","classification":"B","division":"LIMITED","hit_factor":5.3681},{"match_name":"TBAS USPSA Match 3/21/2021","match_date":"2021-03-21","stage_classifiercode":"13-01","member_number":"TY84886","first_name":"STEWART","last_name":"HENDERSON","classification":"B","division":"LIMITED","hit_factor":5.3676},{"match_name":"MCRC USPSA October 2018","match_date":"2018-10-13","stage_classifiercode":"13-01","member_number":"A62570","first_name":"MIKE","last_name":"ADAMS","classification":"B","division":"LIMITED","hit_factor":5.3628},{"match_name":"Medford USPSA November 2017 Match","match_date":"2017-11-19","stage_classifiercode":"13-01","member_number":"A24497","first_name":"TOM","last_name":"CAIL","classification":"B","division":"LIMITED","hit_factor":5.3613},{"match_name":"PTPC February 4th Classifier Match","match_date":"2018-02-04","stage_classifiercode":"13-01","member_number":"L3823","first_name":"RICHARD","last_name":"GEGZNAS","classification":"A","division":"LIMITED","hit_factor":5.3611},{"match_name":"COPS Jan 2016 USPSA Match","match_date":"2016-01-03","stage_classifiercode":"13-01","member_number":"A19657","first_name":"BOB","last_name":"PERRY","classification":"U","division":"LIMITED","hit_factor":5.3589},{"match_name":"Devil Dog USPSA Classifier Match-Sunday Session","match_date":"2018-03-11","stage_classifiercode":"13-01","member_number":"A87132","first_name":"TONY","last_name":"BICHLER","classification":"B","division":"LIMITED","hit_factor":5.3554},{"match_name":"USPSA MO21 2Alpha SBRC April 25 2020","match_date":"2020-04-25","stage_classifiercode":"13-01","member_number":"A116852","first_name":"ZACHARY","last_name":"WHITAKER","classification":"B","division":"LIMITED","hit_factor":5.3535},{"match_name":"Coastal Area Practical Shooters 4-28-18","match_date":"2018-04-28","stage_classifiercode":"13-01","member_number":"TY65408","first_name":"ANDY","last_name":"WILBUR","classification":"C","division":"LIMITED","hit_factor":5.3518},{"match_name":"MRCPS USPSA Feb    2016","match_date":"2016-02-21","stage_classifiercode":"13-01","member_number":"TY71173","first_name":"TAVIS","last_name":"MILLER","classification":"C","division":"LIMITED","hit_factor":5.3503},{"match_name":"Tropang Vegas All Classifier Match","match_date":"2021-07-11","stage_classifiercode":"13-01","member_number":"L4901","first_name":"DONNIE","last_name":"STELLY","classification":"C","division":"LIMITED","hit_factor":5.3476},{"match_name":"PRG Pistol Match 5 Feb 2017","match_date":"2017-02-04","stage_classifiercode":"13-01","member_number":"L3073","first_name":"FLORA","last_name":"YANG","classification":"B","division":"LIMITED","hit_factor":5.3459},{"match_name":"COPS Jan 2016 USPSA Match","match_date":"2016-01-03","stage_classifiercode":"13-01","member_number":"TY48907","first_name":"DAVID","last_name":"LETSCH","classification":"B","division":"LIMITED","hit_factor":5.3421},{"match_name":"USPSA Basics 26OCT2021","match_date":"2021-10-26","stage_classifiercode":"13-01","member_number":"A101100","first_name":"STEVEN","last_name":"ADAMS","classification":"U","division":"LIMITED","hit_factor":5.3407},{"match_name":"DSS - USPSA - 2020 Club Championship","match_date":"2020-08-08","stage_classifiercode":"13-01","member_number":"A113982","first_name":"JAMES","last_name":"PURDY","classification":"C","division":"LIMITED","hit_factor":5.3398},{"match_name":"Lafayette Practical Shooters - WED-THUR - Dec 19-20 - CLASSIFIER MATCH","match_date":"2018-12-20","stage_classifiercode":"13-01","member_number":"TY99446","first_name":"STEVEN","last_name":"RICHARDSON","classification":"C","division":"LIMITED","hit_factor":5.3374},{"match_name":"Danville Rifle and Pistol Club USPSA IL17 Classifier Match August 18th 2018","match_date":"2018-08-18","stage_classifiercode":"13-01","member_number":"Ty90126","first_name":"TOM","last_name":"BURZYNSKI","classification":"B","division":"LIMITED","hit_factor":5.3333},{"match_name":"The Armory USPSA - OHN05 - 2017-03-11","match_date":"2017-03-11","stage_classifiercode":"13-01","member_number":"A99051","first_name":"CAM","last_name":"WORKMAN","classification":"C","division":"LIMITED","hit_factor":5.3333},{"match_name":"SCCPSA USPSA Aug 19 2017","match_date":"2017-08-19","stage_classifiercode":"13-01","member_number":"A13928","first_name":"HUGH","last_name":"MANNISTO","classification":"B","division":"LIMITED","hit_factor":5.3305},{"match_name":"Benton Gun Club-USPSA Classifier Match","match_date":"2016-04-10","stage_classifiercode":"13-01","member_number":"A828116","first_name":"GABRIEL","last_name":"BRUCE","classification":"X","division":"LIMITED","hit_factor":5.3305},{"match_name":"COPS Jan 2016 USPSA Match","match_date":"2016-01-03","stage_classifiercode":"13-01","member_number":"TY78370","first_name":"JAMIE","last_name":"CHOATE","classification":"U","division":"LIMITED","hit_factor":5.3261},{"match_name":"Rankin Field August Sunday USPSA","match_date":"2020-08-16","stage_classifiercode":"13-01","member_number":"TY87001","first_name":"LAWRENCE","last_name":"CASADO","classification":"B","division":"LIMITED","hit_factor":5.3241},{"match_name":"DWB - Deadwood Boys USPSA February 4 2018","match_date":"2018-02-04","stage_classifiercode":"13-01","member_number":"A40050","first_name":"JEFF","last_name":"CHURCH","classification":"B","division":"LIMITED","hit_factor":5.3241},{"match_name":"CGGR February USPSA Match","match_date":"2016-02-20","stage_classifiercode":"13-01","member_number":"TY60329","first_name":"KELLY","last_name":"SNOW","classification":"C","division":"LIMITED","hit_factor":5.3228},{"match_name":"GRB USPSA SEPTEMBER 2021 AT CAVALIER","match_date":"2021-09-18","stage_classifiercode":"13-01","member_number":"A120266","first_name":"CRAIG","last_name":"RUBENSTEIN","classification":"B","division":"LIMITED","hit_factor":5.3159},{"match_name":"Crooked Creek Pistol League - July 2018","match_date":"2018-07-14","stage_classifiercode":"13-01","member_number":"A42876","first_name":"JAMES","last_name":"EIERMANN","classification":"C","division":"LIMITED","hit_factor":5.3125},{"match_name":"ORPCI 2016.03.19 Pistol","match_date":"2016-03-19","stage_classifiercode":"13-01","member_number":"A59495","first_name":"LEWIS","last_name":"HAMBLEN","classification":"C","division":"LIMITED","hit_factor":5.3118},{"match_name":"DAPS USPSA at ETTS 4-8-2017","match_date":"2017-04-08","stage_classifiercode":"13-01","member_number":"A22936","first_name":"CARINA","last_name":"RANDOLPH","classification":"A","division":"LIMITED","hit_factor":5.3115},{"match_name":"SLPSA May USPSA Match","match_date":"2020-05-16","stage_classifiercode":"13-01","member_number":"A81202","first_name":"KEVIN","last_name":"CHILDRESS","classification":"B","division":"LIMITED","hit_factor":5.3106},{"match_name":"PCWC USPSA  9 22 2018","match_date":"2018-09-22","stage_classifiercode":"13-01","member_number":"A91636","first_name":"LUKE","last_name":"ADAMS","classification":"M","division":"LIMITED","hit_factor":5.3085},{"match_name":"Schultz March USPSA match","match_date":"2020-03-08","stage_classifiercode":"13-01","member_number":"A119124","first_name":"CHRISTOPHER","last_name":"ST CLAIR","classification":"C","division":"LIMITED","hit_factor":5.3073},{"match_name":"Clairton Apr 09; 2017","match_date":"2017-04-09","stage_classifiercode":"13-01","member_number":"l3048","first_name":"DOUGLAS","last_name":"BRYANT","classification":"A","division":"LIMITED","hit_factor":5.3061},{"match_name":"Hose Monster Action Classifier","match_date":"2020-03-15","stage_classifiercode":"13-01","member_number":"ty58878","first_name":"ALFONSO","last_name":"BOMBITA","classification":"U","division":"LIMITED","hit_factor":5.3039},{"match_name":"Benton Gun Club-USPSA Classifier Match","match_date":"2016-04-10","stage_classifiercode":"13-01","member_number":"a95924","first_name":"KIM","last_name":"CRUTCHFIELD","classification":"X","division":"LIMITED","hit_factor":5.3039},{"match_name":"OPSC USPSA 7-10-2016","match_date":"2016-07-10","stage_classifiercode":"13-01","member_number":"TY69369","first_name":"GLENN","last_name":"NYENHUIS","classification":"B","division":"LIMITED","hit_factor":5.303},{"match_name":"North East Ohio Shooters - OHN06 - 2017-06-24","match_date":"2017-06-24","stage_classifiercode":"13-01","member_number":"A100496","first_name":"DAVID","last_name":"LILES","classification":"C","division":"LIMITED","hit_factor":5.3023},{"match_name":"17s PSC - USPSA - July 2020","match_date":"2020-07-18","stage_classifiercode":"13-01","member_number":"A129220","first_name":"REID","last_name":"RODICH","classification":"\"\"","division":"LIMITED","hit_factor":5.3007},{"match_name":"Renton USPSA May 2018 - NW05","match_date":"2018-05-27","stage_classifiercode":"13-01","member_number":"A91246","first_name":"JIM","last_name":"STEWARD","classification":"C","division":"LIMITED","hit_factor":5.2993},{"match_name":"PPPS 3-12-17","match_date":"2017-03-12","stage_classifiercode":"13-01","member_number":"TY96175","first_name":"SHANNON","last_name":"COUNSIL","classification":"U","division":"LIMITED","hit_factor":5.2922},{"match_name":"PCSI - August 2017 USPSA","match_date":"2017-08-05","stage_classifiercode":"13-01","member_number":"\"\"","first_name":"DAN","last_name":"O'CARROLL","classification":"X","division":"LIMITED","hit_factor":5.291},{"match_name":"MCRC USPSA October 2018","match_date":"2018-10-13","stage_classifiercode":"13-01","member_number":"TY70556","first_name":"BRUCE","last_name":"BELVIN","classification":"B","division":"LIMITED","hit_factor":5.2903},{"match_name":"BORCC USPSA Classifier Match February 2017","match_date":"2017-02-11","stage_classifiercode":"13-01","member_number":"TY56707","first_name":"GREG","last_name":"SANDERS","classification":"A","division":"LIMITED","hit_factor":5.2897},{"match_name":"Hopkinton March Mini-Match","match_date":"2020-03-14","stage_classifiercode":"13-01","member_number":"TY76786","first_name":"ROBERT","last_name":"LACROIX","classification":"M","division":"LIMITED","hit_factor":5.2897},{"match_name":"RDS November 2021 USPSA","match_date":"2021-11-06","stage_classifiercode":"13-01","member_number":"TY93346","first_name":"GREG","last_name":"FANCHER","classification":"B","division":"LIMITED","hit_factor":5.2889},{"match_name":"Trigger Guard USPSA","match_date":"2016-04-02","stage_classifiercode":"13-01","member_number":"L3354","first_name":"RYAN","last_name":"DOLL","classification":"C","division":"LIMITED","hit_factor":5.2805},{"match_name":"EAPS September 2016 USPSA","match_date":"2016-09-18","stage_classifiercode":"13-01","member_number":"\"\"","first_name":"ROBERT","last_name":"RIVET","classification":"B","division":"LIMITED","hit_factor":5.2786},{"match_name":"OFGC Practical Pistol Match 7-19-2020","match_date":"2020-07-19","stage_classifiercode":"13-01","member_number":"A99926","first_name":"CARL","last_name":"CLITES","classification":"M","division":"LIMITED","hit_factor":5.2778},{"match_name":"Gem City Gun Club 1-04 and 1-05 2020","match_date":"2020-01-04","stage_classifiercode":"13-01","member_number":"TY108399","first_name":"JAY","last_name":"FREY","classification":"Unclassified","division":"LIMITED","hit_factor":5.2764},{"match_name":"RDS November 2021 USPSA","match_date":"2021-11-06","stage_classifiercode":"13-01","member_number":"A102348","first_name":"JERRY","last_name":"NUNNALLY","classification":"B","division":"LIMITED","hit_factor":5.2752},{"match_name":"Havana May 7 2016 USPSA Match","match_date":"2016-05-07","stage_classifiercode":"13-01","member_number":"A92908","first_name":"DAVID","last_name":"BURNS","classification":"C","division":"LIMITED","hit_factor":5.2736},{"match_name":"Idaho ISPS August 4th 2018","match_date":"2018-08-04","stage_classifiercode":"13-01","member_number":"A505757","first_name":"JOHN","last_name":"NETTLES","classification":"B","division":"LIMITED","hit_factor":5.2692},{"match_name":"COPS Jan 2016 USPSA Match","match_date":"2016-01-03","stage_classifiercode":"13-01","member_number":"TY18990","first_name":"BOB","last_name":"DELP","classification":"B","division":"LIMITED","hit_factor":5.2632},{"match_name":"Woodland Heights Practical Shooters USPSA Match 9-20","match_date":"2020-09-20","stage_classifiercode":"13-01","member_number":"A112534","first_name":"TOM","last_name":"KEEFE","classification":"C","division":"LIMITED","hit_factor":5.258},{"match_name":"TCGC April 2018","match_date":"2018-04-29","stage_classifiercode":"13-01","member_number":"A8859","first_name":"TIMOTHY","last_name":"SCHWINGLE","classification":"B","division":"LIMITED","hit_factor":5.2578},{"match_name":"Pinetucky USPSA 12-17-16","match_date":"2016-12-17","stage_classifiercode":"13-01","member_number":"A91952","first_name":"PHILIP","last_name":"LEE","classification":"C","division":"LIMITED","hit_factor":5.2573},{"match_name":"PIPS 06-30-2021","match_date":"2021-06-30","stage_classifiercode":"13-01","member_number":"L4622","first_name":"KEVIN","last_name":"COLLINS","classification":"B","division":"LIMITED","hit_factor":5.257},{"match_name":"WSPS SEPTEMBER 2017 USPSA MATCH","match_date":"2017-09-16","stage_classifiercode":"13-01","member_number":"FY88040","first_name":"STEPHEN","last_name":"HOSAGE","classification":"B","division":"LIMITED","hit_factor":5.2567},{"match_name":"DSC September 2016","match_date":"2016-09-18","stage_classifiercode":"13-01","member_number":"TY47197","first_name":"ROY","last_name":"NEAL","classification":"M","division":"LIMITED","hit_factor":5.2553},{"match_name":"2018-08-04 USPSA at Phoenix Rod and Gun Club","match_date":"2018-08-04","stage_classifiercode":"13-01","member_number":"A89241","first_name":"KENDALL","last_name":"ERETH","classification":"B","division":"LIMITED","hit_factor":5.2475},{"match_name":"MCRC USPSA October 2018","match_date":"2018-10-13","stage_classifiercode":"13-01","member_number":"TY83853","first_name":"MIKE","last_name":"FRITS","classification":"B","division":"LIMITED","hit_factor":5.2427},{"match_name":"Flagstaff Fun Shoot March 25 2017","match_date":"2017-03-25","stage_classifiercode":"13-01","member_number":"TY-98159","first_name":"TOBY","last_name":"WALSH","classification":"\"\"","division":"LIMITED","hit_factor":5.2419},{"match_name":"Bitterroot Blasters March Club Match","match_date":"2016-03-26","stage_classifiercode":"13-01","member_number":"A85423","first_name":"MIKE","last_name":"MOCABEE","classification":"D","division":"LIMITED","hit_factor":5.2415},{"match_name":"SPSA USPSA October 1st Sat Match","match_date":"2020-10-03","stage_classifiercode":"13-01","member_number":"TY3777","first_name":"MIKE","last_name":"MORRIS","classification":"A","division":"LIMITED","hit_factor":5.2406},{"match_name":"SAPSC Monthly USPSA Classifier Match at ARO 20161020","match_date":"2016-10-20","stage_classifiercode":"13-01","member_number":"A79845","first_name":"JOHNNY","last_name":"REED","classification":"A","division":"LIMITED","hit_factor":5.2395},{"match_name":"New Holland USPSA - October 2016","match_date":"2016-10-09","stage_classifiercode":"13-01","member_number":"A98254","first_name":"MARK","last_name":"HARBOLD","classification":"U","division":"LIMITED","hit_factor":5.2392},{"match_name":"PTPC February 4th Classifier Match","match_date":"2018-02-04","stage_classifiercode":"13-01","member_number":"TY74021","first_name":"MICHAEL","last_name":"BLYAKHER","classification":"M","division":"LIMITED","hit_factor":5.2373},{"match_name":"2018-08-04 USPSA at Phoenix Rod and Gun Club","match_date":"2018-08-04","stage_classifiercode":"13-01","member_number":"\"\"","first_name":"DONNIE","last_name":"TISDALE","classification":"C","division":"LIMITED","hit_factor":5.2314},{"match_name":"OKCGC USPSA Dec 2016","match_date":"2016-12-03","stage_classifiercode":"13-01","member_number":"A67199","first_name":"GREG","last_name":"GOODE","classification":"B","division":"LIMITED","hit_factor":5.2304},{"match_name":"WTPS USPSA April Classifier Match 4-8-17","match_date":"2017-04-08","stage_classifiercode":"13-01","member_number":"A86469","first_name":"CORY","last_name":"WHITTAKER","classification":"U","division":"LIMITED","hit_factor":5.2261},{"match_name":"SLOSA Feburary 2016 USPSA","match_date":"2016-02-13","stage_classifiercode":"13-01","member_number":"a32585","first_name":"ROLANDO","last_name":"SARABIA","classification":"A","division":"LIMITED","hit_factor":5.2239},{"match_name":"Range E11even July 2017","match_date":"2017-07-22","stage_classifiercode":"13-01","member_number":"A96755","first_name":"TIM","last_name":"REGRUT","classification":"C","division":"LIMITED","hit_factor":5.2239},{"match_name":"North East Ohio Shooters - OHN06 - 2017-06-24","match_date":"2017-06-24","stage_classifiercode":"13-01","member_number":"A99051","first_name":"CAM","last_name":"WORKMAN","classification":"B","division":"LIMITED","hit_factor":5.2219},{"match_name":"1/8/17 GMPS","match_date":"2017-01-08","stage_classifiercode":"13-01","member_number":"A75538","first_name":"TONY","last_name":"SCARZELLO","classification":"X","division":"LIMITED","hit_factor":5.2139},{"match_name":"BORCC USPSA Classifier Match February 2017","match_date":"2017-02-11","stage_classifiercode":"13-01","member_number":"TY64028","first_name":"JOSEPH","last_name":"MARGHERONE","classification":"M","division":"LIMITED","hit_factor":5.2126},{"match_name":"SWGC USPSA Pistol Match - February 2021","match_date":"2021-02-06","stage_classifiercode":"13-01","member_number":"A117382","first_name":"MARCUS","last_name":"TURNER","classification":"U","division":"LIMITED","hit_factor":5.2114},{"match_name":"EASTER EGG HUNT AREA 59  ALL CLASSFIER MATCH","match_date":"2017-04-15","stage_classifiercode":"13-01","member_number":"A98298","first_name":"MICHAEL","last_name":"BENITEZ","classification":"U","division":"LIMITED","hit_factor":5.2111},{"match_name":"Blue Ridge Arsenal 1-18-18 Match With Classfier","match_date":"2018-01-18","stage_classifiercode":"13-01","member_number":"a93612","first_name":"PAUL","last_name":"RANDAZZO","classification":"D","division":"LIMITED","hit_factor":5.2093},{"match_name":"NISA August 2017","match_date":"2017-08-27","stage_classifiercode":"13-01","member_number":"FY79706","first_name":"HELMUT","last_name":"ANGERER","classification":"C","division":"LIMITED","hit_factor":5.2073},{"match_name":"NHRPC - August 2016 USPSA","match_date":"2016-08-14","stage_classifiercode":"13-01","member_number":"A91710","first_name":"RYAN","last_name":"POBLETE","classification":"A","division":"LIMITED","hit_factor":5.2069},{"match_name":"PSAC 20210905","match_date":"2021-09-05","stage_classifiercode":"13-01","member_number":"TY79422","first_name":"BRANDON","last_name":"WISNER","classification":"X","division":"LIMITED","hit_factor":5.2055},{"match_name":"RDS Aug 52017 USPSA  Match","match_date":"2017-08-05","stage_classifiercode":"13-01","member_number":"A102348","first_name":"JERRY","last_name":"NUNNALLY","classification":"C","division":"LIMITED","hit_factor":5.2052},{"match_name":"DSC September 2016","match_date":"2016-09-18","stage_classifiercode":"13-01","member_number":"TY77249","first_name":"ERIC","last_name":"SCHUTT","classification":"B","division":"LIMITED","hit_factor":5.2052},{"match_name":"ORPCI 2016.03.19 Pistol","match_date":"2016-03-19","stage_classifiercode":"13-01","member_number":"TY82031","first_name":"JEFF","last_name":"JONES","classification":"B","division":"LIMITED","hit_factor":5.2036},{"match_name":"PSAC 20210905","match_date":"2021-09-05","stage_classifiercode":"13-01","member_number":"A81984","first_name":"TOM","last_name":"FINN","classification":"B","division":"LIMITED","hit_factor":5.2034},{"match_name":"SCCPSA USPSA Aug 19 2017","match_date":"2017-08-19","stage_classifiercode":"13-01","member_number":"A46862","first_name":"JAMES","last_name":"ELLIS","classification":"B","division":"LIMITED","hit_factor":5.2004},{"match_name":"Benton Gun Club-USPSA Classifier Match","match_date":"2016-04-10","stage_classifiercode":"13-01","member_number":"ty53177","first_name":"CLEVE","last_name":"MATHEWS","classification":"B","division":"LIMITED","hit_factor":5.2},{"match_name":"17s PSC - USPSA - July 2020","match_date":"2020-07-18","stage_classifiercode":"13-01","member_number":"A103550","first_name":"JOSEPH","last_name":"ROBERTS","classification":"C","division":"LIMITED","hit_factor":5.2},{"match_name":"SLPSA Feb USPSA","match_date":"2018-02-17","stage_classifiercode":"13-01","member_number":"A49638","first_name":"DANIEL","last_name":"WARD","classification":"B","division":"LIMITED","hit_factor":5.1991},{"match_name":"RangeMasters 6-30-2016","match_date":"2016-06-30","stage_classifiercode":"13-01","member_number":"A87497","first_name":"ERIC","last_name":"CASTILLO","classification":"C","division":"LIMITED","hit_factor":5.1975},{"match_name":"TriggerGuard USPSA Classifier Match","match_date":"2018-03-24","stage_classifiercode":"13-01","member_number":"A109897","first_name":"MICHAEL","last_name":"WARREN","classification":"U","division":"LIMITED","hit_factor":5.1975},{"match_name":"April 2017 FOP 72 2 Gun","match_date":"2017-04-16","stage_classifiercode":"13-01","member_number":"FY52844","first_name":"CARLOS A","last_name":"RUIZ","classification":"U","division":"LIMITED","hit_factor":5.1948},{"match_name":"ORPCI 2018.03.31 USPSA Special","match_date":"2018-03-31","stage_classifiercode":"13-01","member_number":"\"\"","first_name":"ADAM","last_name":"REECE","classification":"U","division":"LIMITED","hit_factor":5.1913},{"match_name":"Palmetto Gun Club - January 2016 USPSA","match_date":"2016-01-02","stage_classifiercode":"13-01","member_number":"A82129","first_name":"MITCH","last_name":"WRIGHT","classification":"X","division":"LIMITED","hit_factor":5.1838},{"match_name":"Richmond Hot Shots Dec 2-3-2017 USPSA Pistol Match","match_date":"2017-12-02","stage_classifiercode":"13-01","member_number":"A94643","first_name":"CARLSON","last_name":"SETO","classification":"D","division":"LIMITED","hit_factor":5.1838},{"match_name":"TCGC Polo March 2016 Classifier Match","match_date":"2016-03-20","stage_classifiercode":"13-01","member_number":"A76956","first_name":"KERRY","last_name":"WOODS","classification":"C","division":"LIMITED","hit_factor":5.1808},{"match_name":"A3G-APS August 5th USPSA Classifier Match","match_date":"2018-08-05","stage_classifiercode":"13-01","member_number":"A106074","first_name":"ANTHONY","last_name":"JOHNSON","classification":"D","division":"LIMITED","hit_factor":5.1793},{"match_name":"OKCGC USPSA Dec 2016","match_date":"2016-12-03","stage_classifiercode":"13-01","member_number":"L3565","first_name":"MICHAEL","last_name":"RUSH","classification":"B","division":"LIMITED","hit_factor":5.1774},{"match_name":"FBURG March 2017 Level I USPSA ","match_date":"2017-03-04","stage_classifiercode":"13-01","member_number":"L4084","first_name":"KEVIN","last_name":"MCPHEE","classification":"C","division":"LIMITED","hit_factor":5.1771},{"match_name":"Laser Ninja Dragon League MSA USPSA January 21st 2017","match_date":"2017-01-21","stage_classifiercode":"13-01","member_number":"l4037","first_name":"MARK","last_name":"MILLER","classification":"B","division":"LIMITED","hit_factor":5.1637},{"match_name":"OPSC USPSA 7-10-2016","match_date":"2016-07-10","stage_classifiercode":"13-01","member_number":"L3823","first_name":"RICHARD","last_name":"GEGZNAS","classification":"B","division":"LIMITED","hit_factor":5.1604},{"match_name":"SCCCApril2017","match_date":"2017-04-09","stage_classifiercode":"13-01","member_number":"\"\"","first_name":"ALAN","last_name":"SAUL","classification":"U","division":"LIMITED","hit_factor":5.1576},{"match_name":"Clinton County USPSA","match_date":"2016-03-26","stage_classifiercode":"13-01","member_number":"a92359","first_name":"TONY","last_name":"WELLS","classification":"C","division":"LIMITED","hit_factor":5.1493},{"match_name":"ORPCI 2018.03.31 USPSA Special","match_date":"2018-03-31","stage_classifiercode":"13-01","member_number":"A105741","first_name":"CJ","last_name":"SMITH","classification":"C","division":"LIMITED","hit_factor":5.1471},{"match_name":"Low Country USPSA Mar 31st","match_date":"2018-03-31","stage_classifiercode":"13-01","member_number":"A103447","first_name":"JOSH","last_name":"TAYLOR","classification":"U","division":"LIMITED","hit_factor":5.1447},{"match_name":"Griffin USPSA Match Sep 17 2016","match_date":"2016-09-17","stage_classifiercode":"13-01","member_number":"a94631","first_name":"TIM","last_name":"HADDEN","classification":"C","division":"LIMITED","hit_factor":5.1447},{"match_name":"Applied IN25 USPSA April Classifier 2018","match_date":"2018-04-17","stage_classifiercode":"13-01","member_number":"TY92980","first_name":"DAVID","last_name":"BURNS","classification":"M","division":"LIMITED","hit_factor":5.1443},{"match_name":"Naas 07-16-17","match_date":"2017-07-16","stage_classifiercode":"13-01","member_number":"A71211","first_name":"DEAN","last_name":"COLE","classification":"C","division":"LIMITED","hit_factor":5.1406},{"match_name":"CVSC 12-31-2017","match_date":"2017-12-31","stage_classifiercode":"13-01","member_number":"\"\"","first_name":"JASON","last_name":"PIERCE","classification":"U","division":"LIMITED","hit_factor":5.1383},{"match_name":"SCCCApril2017","match_date":"2017-04-09","stage_classifiercode":"13-01","member_number":"a64681","first_name":"ANTHONY","last_name":"CALDWELL","classification":"C","division":"LIMITED","hit_factor":5.1342},{"match_name":"Palmetto Gun Club - January 2016 USPSA","match_date":"2016-01-02","stage_classifiercode":"13-01","member_number":"A90912","first_name":"TJ","last_name":"YARBROUGH","classification":"C","division":"LIMITED","hit_factor":5.1331},{"match_name":"Crooked Creek Pistol League - July 2018","match_date":"2018-07-14","stage_classifiercode":"13-01","member_number":"A106911","first_name":"DAN","last_name":"PATCHIN","classification":"C","division":"LIMITED","hit_factor":5.1331},{"match_name":"Rio Salado UPPL 2nd Sunday January 2020","match_date":"2020-01-11","stage_classifiercode":"13-01","member_number":"FY66994","first_name":"SCOTT","last_name":"BONOMO","classification":"B","division":"LIMITED","hit_factor":5.1316},{"match_name":"NAAS  11-18-2018","match_date":"2018-11-18","stage_classifiercode":"13-01","member_number":"A71211","first_name":"DEAN","last_name":"COLE","classification":"C","division":"LIMITED","hit_factor":5.1282},{"match_name":"OPSC USPSA OCTOBER 2018","match_date":"2018-10-14","stage_classifiercode":"13-01","member_number":"FY57172","first_name":"GLENN","last_name":"JOHNSON","classification":"B","division":"LIMITED","hit_factor":5.1282},{"match_name":"Tarheel USPSA July 2016","match_date":"2016-07-09","stage_classifiercode":"13-01","member_number":"27276","first_name":"GABE","last_name":"D","classification":"U","division":"LIMITED","hit_factor":5.1247},{"match_name":"TMGN July 1st USPSA Match","match_date":"2018-07-01","stage_classifiercode":"13-01","member_number":"\"\"","first_name":"MATT","last_name":"CHURCH","classification":"U","division":"LIMITED","hit_factor":5.1157},{"match_name":"Grandbaggers September 2017","match_date":"2017-09-07","stage_classifiercode":"13-01","member_number":"L3902","first_name":"ALEXANDER","last_name":"VALENTINE","classification":"M","division":"LIMITED","hit_factor":5.1155},{"match_name":"Competitive Shooters of Lake Norman CORNELIUS Thursday Evening Indoor USPSA Pistol Match North Carolina","match_date":"2018-04-05","stage_classifiercode":"13-01","member_number":"A103468","first_name":"JIM","last_name":"JARRETT","classification":"C","division":"LIMITED","hit_factor":5.1136},{"match_name":"Shasta Shooters 2018 June Special Classifier","match_date":"2018-06-09","stage_classifiercode":"13-01","member_number":"A95105","first_name":"DOUGLAS","last_name":"DALSKE","classification":"U","division":"LIMITED","hit_factor":5.1115},{"match_name":"JCSSA OCT ","match_date":"2016-10-01","stage_classifiercode":"13-01","member_number":"A78475","first_name":"JOHN","last_name":"SIMMONS","classification":"C","division":"LIMITED","hit_factor":5.104},{"match_name":"Triforce Practical Shooters at BigWoodsGoods 3-23-17","match_date":"2017-03-23","stage_classifiercode":"13-01","member_number":"A96758","first_name":"WILL","last_name":"ROWND","classification":"U","division":"LIMITED","hit_factor":5.1033},{"match_name":"Medford USPSA November 2017 Match","match_date":"2017-11-19","stage_classifiercode":"13-01","member_number":"\"\"","first_name":"VINCENT","last_name":"CLEMENTS","classification":"U","division":"LIMITED","hit_factor":5.103},{"match_name":"INAS Dec 2016 USPSA","match_date":"2016-12-17","stage_classifiercode":"13-01","member_number":"TY21925","first_name":"WILLIAM H","last_name":"PARKS III","classification":"B","division":"LIMITED","hit_factor":5.0943},{"match_name":"EIPS 6/4/2016","match_date":"2016-06-04","stage_classifiercode":"13-01","member_number":"\"\"","first_name":"GARY","last_name":"PAPE","classification":"\"\"","division":"LIMITED","hit_factor":5.0926},{"match_name":"SCCPSA USPSA Aug 19 2017","match_date":"2017-08-19","stage_classifiercode":"13-01","member_number":"TY53922","first_name":"RON","last_name":"JONES","classification":"B","division":"LIMITED","hit_factor":5.0919},{"match_name":"Trigger Guard USPSA","match_date":"2016-04-02","stage_classifiercode":"13-01","member_number":"A-94622","first_name":"CHAD","last_name":"GRAHAM","classification":"U","division":"LIMITED","hit_factor":5.0916},{"match_name":"OKCGC USPSA Dec 2017 Match","match_date":"2017-12-02","stage_classifiercode":"13-01","member_number":"A83912","first_name":"MONTY","last_name":"MONTGOMERY","classification":"C","division":"LIMITED","hit_factor":5.0913},{"match_name":"PRG Pistol Match 5 Feb 2017","match_date":"2017-02-04","stage_classifiercode":"13-01","member_number":"A82561","first_name":"VICTOR","last_name":"ALBERTO","classification":"C","division":"LIMITED","hit_factor":5.0885},{"match_name":"Patriot Action Shooters December 2015 Match","match_date":"2015-12-19","stage_classifiercode":"13-01","member_number":"TY71940","first_name":"DEREK","last_name":"DRISCOLL","classification":"M","division":"LIMITED","hit_factor":5.0872},{"match_name":"OPSC USPSA OCTOBER 2018","match_date":"2018-10-14","stage_classifiercode":"13-01","member_number":"TY69798","first_name":"ELIZABETH","last_name":"MANNING","classification":"C","division":"LIMITED","hit_factor":5.0864},{"match_name":"EIPS 6/4/2016","match_date":"2016-06-04","stage_classifiercode":"13-01","member_number":"A71452","first_name":"JON","last_name":"FISHER","classification":"A","division":"LIMITED","hit_factor":5.0847},{"match_name":"North East Ohio Shooters - OHN06 - 2017-06-24","match_date":"2017-06-24","stage_classifiercode":"13-01","member_number":"A90421","first_name":"DON","last_name":"BATES","classification":"C","division":"LIMITED","hit_factor":5.0831},{"match_name":"Clairton Apr 09; 2017","match_date":"2017-04-09","stage_classifiercode":"13-01","member_number":"A95147","first_name":"JON","last_name":"MELTON","classification":"B","division":"LIMITED","hit_factor":5.0802},{"match_name":"MSSA USPSA June  10 2017","match_date":"2017-06-10","stage_classifiercode":"13-01","member_number":"A91827","first_name":"PRESTON","last_name":"KING","classification":"B","division":"LIMITED","hit_factor":5.079},{"match_name":"NRG December 10th 2016","match_date":"2016-12-10","stage_classifiercode":"13-01","member_number":"TY55229","first_name":"LUKE","last_name":"AGAJANIAN","classification":"A","division":"LIMITED","hit_factor":5.0781},{"match_name":"WSPS SEPTEMBER 2017 USPSA MATCH","match_date":"2017-09-16","stage_classifiercode":"13-01","member_number":"A53984","first_name":"RICK","last_name":"VAHALY","classification":"C","division":"LIMITED","hit_factor":5.0725},{"match_name":"Springfield Tactical Shooters 10/05/2017","match_date":"2017-10-05","stage_classifiercode":"13-01","member_number":"A70754","first_name":"PATRICK","last_name":"KEEN","classification":"C","division":"LIMITED","hit_factor":5.071},{"match_name":"MASTER BLASTERS & SSFGA USPSA - November","match_date":"2020-11-21","stage_classifiercode":"13-01","member_number":"a116218","first_name":"NAN","last_name":"ZHANG","classification":"U","division":"LIMITED","hit_factor":5.0657},{"match_name":"USPSA Basics 26OCT2021","match_date":"2021-10-26","stage_classifiercode":"13-01","member_number":"A114539","first_name":"GRANT HAMILTON","last_name":"MEEK","classification":"U","division":"LIMITED","hit_factor":5.0633},{"match_name":"Triforce Practical Shooters at BigWoodsGoods 3-23-17","match_date":"2017-03-23","stage_classifiercode":"13-01","member_number":"\"\"","first_name":"CODY","last_name":"GARLAND","classification":"U","division":"LIMITED","hit_factor":5.0633},{"match_name":"CRC USPSA August 2021","match_date":"2021-08-14","stage_classifiercode":"13-01","member_number":"A16178","first_name":"DANIEL","last_name":"MILAN","classification":"B","division":"LIMITED","hit_factor":5.0633},{"match_name":"BPSA January 2017 USPSA","match_date":"2017-01-22","stage_classifiercode":"13-01","member_number":"A98845","first_name":"BLAYNE","last_name":"DUPUY","classification":"U","division":"LIMITED","hit_factor":5.0605},{"match_name":"SLOSA January 2018 USPSA MATCH","match_date":"2018-01-13","stage_classifiercode":"13-01","member_number":"A97700","first_name":"TONY","last_name":"RAMAGE","classification":"D","division":"LIMITED","hit_factor":5.0549},{"match_name":"IN19 ACC USPSA May 23 2021","match_date":"2021-05-23","stage_classifiercode":"13-01","member_number":"Ty104591","first_name":"DAVID","last_name":"HEUSS","classification":"B","division":"LIMITED","hit_factor":5.0546},{"match_name":"NRG Saturday January 13th - Includes a Classifier Stage","match_date":"2018-01-13","stage_classifiercode":"13-01","member_number":"TY98901","first_name":"CHRISTIAN","last_name":"CALVEZ","classification":"C","division":"LIMITED","hit_factor":5.0517},{"match_name":"OKCGC USPSA Dec 2017 Match","match_date":"2017-12-02","stage_classifiercode":"13-01","member_number":"TY75066","first_name":"STEVE","last_name":"MCGINLEY","classification":"C","division":"LIMITED","hit_factor":5.0515},{"match_name":"Applied IN25 USPSA October 2017 Classifier","match_date":"2017-10-18","stage_classifiercode":"13-01","member_number":"A93257","first_name":"ALEX","last_name":"BAKKEN","classification":"U","division":"LIMITED","hit_factor":5.0505},{"match_name":"NHRPC - October 2020 USPSA","match_date":"2020-10-10","stage_classifiercode":"13-01","member_number":"A118293","first_name":"LOLA","last_name":"MCKERNS","classification":"C","division":"LIMITED","hit_factor":5.0476},{"match_name":"EIPS 6/4/2016","match_date":"2016-06-04","stage_classifiercode":"13-01","member_number":"A89906","first_name":"ERIC","last_name":"BONG","classification":"U","division":"LIMITED","hit_factor":5.0435},{"match_name":"CVSC 12-31-2017","match_date":"2017-12-31","stage_classifiercode":"13-01","member_number":"A97718","first_name":"CHRIS","last_name":"NEUWIRTH","classification":"C","division":"LIMITED","hit_factor":5.0431},{"match_name":"RDS Aug 52017 USPSA  Match","match_date":"2017-08-05","stage_classifiercode":"13-01","member_number":"\"\"","first_name":"JUSTIN","last_name":"GOGGANS","classification":"U","division":"LIMITED","hit_factor":5.0428},{"match_name":"New Holland USPSA - October 2016","match_date":"2016-10-09","stage_classifiercode":"13-01","member_number":"A60896","first_name":"MATTHEW","last_name":"SCHAPPELL","classification":"B","division":"LIMITED","hit_factor":5.042},{"match_name":"Danville Rifle and Pistol Club USPSA IL17 Classifier Match August 18th 2018","match_date":"2018-08-18","stage_classifiercode":"13-01","member_number":"FY90994","first_name":"PAUL","last_name":"BENSON","classification":"C","division":"LIMITED","hit_factor":5.0403},{"match_name":"NAAS  11-18-2018","match_date":"2018-11-18","stage_classifiercode":"13-01","member_number":"TY105125","first_name":"JOE","last_name":"GEORGE","classification":"A","division":"LIMITED","hit_factor":5.0388},{"match_name":"Laser Ninja Dragon League July Special Classifier","match_date":"2018-07-01","stage_classifiercode":"13-01","member_number":"A104295","first_name":"DARRELL","last_name":"SMITH","classification":"U","division":"LIMITED","hit_factor":5.0383},{"match_name":"MASTER BLASTERS & SSFGA USPSA - November","match_date":"2020-11-21","stage_classifiercode":"13-01","member_number":"A112057","first_name":"ZACK","last_name":"HOOPER","classification":"C","division":"LIMITED","hit_factor":5.0383},{"match_name":"Rankin Field April (ALL CLASSIFIER) Saturday USPSA","match_date":"2021-04-03","stage_classifiercode":"13-01","member_number":"TY114590","first_name":"JEREMY","last_name":"ALBRIGHT","classification":"A","division":"LIMITED","hit_factor":5.0378},{"match_name":"LCSA USPSA July","match_date":"2016-07-08","stage_classifiercode":"13-01","member_number":"TY87293","first_name":"EARL","last_name":"COWHER","classification":"C","division":"LIMITED","hit_factor":5.0373},{"match_name":"Blackstone Shooting Sports Snow Days January 2017 USPSA Level  1","match_date":"2017-01-08","stage_classifiercode":"13-01","member_number":"A94309","first_name":"CHRIS","last_name":"LOVETT","classification":"C","division":"LIMITED","hit_factor":5.0367},{"match_name":"8a Fecha USPSA Classifier","match_date":"2018-08-12","stage_classifiercode":"13-01","member_number":"TY94373","first_name":"ROMAN","last_name":"SIFUENTES-PEREZ","classification":"B","division":"LIMITED","hit_factor":5.0366},{"match_name":"ACC Oct Saturday 24th USPSA","match_date":"2020-10-24","stage_classifiercode":"13-01","member_number":"TY66824","first_name":"MICHAEL","last_name":"MCCAULEY","classification":"B","division":"LIMITED","hit_factor":5.0314},{"match_name":"RCPS USPSA August 11","match_date":"2018-08-11","stage_classifiercode":"13-01","member_number":"A65338","first_name":"JAMES","last_name":"CLARK","classification":"B","division":"LIMITED","hit_factor":5.0314},{"match_name":"HOPS USPSA 071517","match_date":"2017-07-15","stage_classifiercode":"13-01","member_number":"L4224","first_name":"PETER","last_name":"EIBERGER","classification":"A","division":"LIMITED","hit_factor":5.0305},{"match_name":"RCPS USPSA 9 Jan 2016 Special Classifier Match","match_date":"2016-01-09","stage_classifiercode":"13-01","member_number":"TY22341","first_name":"ARISTO","last_name":"VON HOFFMAN","classification":"B","division":"LIMITED","hit_factor":5.0233},{"match_name":"WTPS USPSA April Classifier Match 4-8-17","match_date":"2017-04-08","stage_classifiercode":"13-01","member_number":"A95294","first_name":"AARON","last_name":"SUTTON","classification":"C","division":"LIMITED","hit_factor":5.0154},{"match_name":"RMAP 3rd sunday August 2017","match_date":"2017-08-20","stage_classifiercode":"13-01","member_number":"F43496","first_name":"HOWARD","last_name":"FRYER","classification":"C","division":"LIMITED","hit_factor":5.015},{"match_name":"Hose Monster Fun","match_date":"2021-05-02","stage_classifiercode":"13-01","member_number":"ty86621","first_name":"RICK","last_name":"SERVANDO","classification":"A","division":"LIMITED","hit_factor":5.0139},{"match_name":"ALL CLASSIFIER SUMMERSLAM  -  AREA 59 2018","match_date":"2018-06-30","stage_classifiercode":"13-01","member_number":"A104836","first_name":"BILL","last_name":"KINSTLEY","classification":"C","division":"LIMITED","hit_factor":5.0137},{"match_name":"PSAC 20210905","match_date":"2021-09-05","stage_classifiercode":"13-01","member_number":"TY65590","first_name":"STEVE","last_name":"STETLER","classification":"M","division":"LIMITED","hit_factor":5.0129},{"match_name":"PCSI March 2016 USPSA","match_date":"2016-03-05","stage_classifiercode":"13-01","member_number":"A72557","first_name":"RYAN","last_name":"LEAS","classification":"none","division":"LIMITED","hit_factor":5.0125},{"match_name":"SEPSA June 2016","match_date":"2016-06-11","stage_classifiercode":"13-01","member_number":"A88615","first_name":"ISRAEL","last_name":"GONZALEZ","classification":"B","division":"LIMITED","hit_factor":5.0122},{"match_name":"FAS Special Saturday All Classifier Match","match_date":"2021-01-16","stage_classifiercode":"13-01","member_number":"a132410","first_name":"BEN","last_name":"PENNINGTON","classification":"U","division":"LIMITED","hit_factor":5.0109},{"match_name":"EASTER EGG HUNT AREA 59  ALL CLASSFIER MATCH","match_date":"2017-04-15","stage_classifiercode":"13-01","member_number":"A96920","first_name":"SYDNEY","last_name":"JIM","classification":"U","division":"LIMITED","hit_factor":5.0104},{"match_name":"SAPS Match 1/04/2020","match_date":"2020-01-04","stage_classifiercode":"13-01","member_number":"A120323","first_name":"TODD","last_name":"WAGNER","classification":"C","division":"LIMITED","hit_factor":5.0093},{"match_name":"Low Country USPSA Mar 31st","match_date":"2018-03-31","stage_classifiercode":"13-01","member_number":"TY105752","first_name":"JEREMY","last_name":"SHOFF","classification":"U","division":"LIMITED","hit_factor":5.007},{"match_name":"BRRC GAS USPSA MAY 12 2018","match_date":"2018-05-12","stage_classifiercode":"13-01","member_number":"L4224","first_name":"PETER","last_name":"EIBERGER","classification":"A","division":"LIMITED","hit_factor":5.0068},{"match_name":"TASC 4-16-16 (15Apr16-10:27:18)","match_date":"2016-04-16","stage_classifiercode":"13-01","member_number":"TY-91248","first_name":"DAVID","last_name":"GEORGE","classification":"U","division":"LIMITED","hit_factor":5.0054},{"match_name":"Idaho ISPS August 4th 2018","match_date":"2018-08-04","stage_classifiercode":"13-01","member_number":"A100033","first_name":"ANTHONY","last_name":"FRANK","classification":"C","division":"LIMITED","hit_factor":5},{"match_name":"Springfield Tactical Shooters 10/05/2017","match_date":"2017-10-05","stage_classifiercode":"13-01","member_number":"A95946","first_name":"PAUL","last_name":"EMERY","classification":"C","division":"LIMITED","hit_factor":5},{"match_name":"RMAP 3rd sunday August 2017","match_date":"2017-08-20","stage_classifiercode":"13-01","member_number":"TY22852","first_name":"DEBBIE","last_name":"KEEHART","classification":"B","division":"LIMITED","hit_factor":5},{"match_name":"Inner 10 August Classifier","match_date":"2018-08-13","stage_classifiercode":"13-01","member_number":"A101489","first_name":"TODD","last_name":"WOITZEL","classification":"U","division":"LIMITED","hit_factor":5},{"match_name":"Renton USPSA May 2018 - NW05","match_date":"2018-05-27","stage_classifiercode":"13-01","member_number":"TY100095","first_name":"MARK","last_name":"BANTA","classification":"C","division":"LIMITED","hit_factor":5},{"match_name":"Rankin Field August Sunday USPSA","match_date":"2020-08-16","stage_classifiercode":"13-01","member_number":"TY92260","first_name":"LAURI","last_name":"VAUGHN","classification":"C","division":"LIMITED","hit_factor":4.9955},{"match_name":"ALL CLASSIFIER SUMMERSLAM  -  AREA 59 2018","match_date":"2018-06-30","stage_classifiercode":"13-01","member_number":"TY97851","first_name":"ALAN","last_name":"REGALA","classification":"D","division":"LIMITED","hit_factor":4.9948},{"match_name":"DWB - Deadwood Boys USPSA 03 June 2018","match_date":"2018-06-03","stage_classifiercode":"13-01","member_number":"\"\"","first_name":"JJ","last_name":"HERMAN","classification":"C","division":"LIMITED","hit_factor":4.9906},{"match_name":"Double Taps April Match","match_date":"2017-04-19","stage_classifiercode":"13-01","member_number":"F91513","first_name":"RONALDO","last_name":"URBANO","classification":"U","division":"LIMITED","hit_factor":4.9869},{"match_name":"TCSC USPSA Level I September club match","match_date":"2020-09-27","stage_classifiercode":"13-01","member_number":"FY104040","first_name":"JOHN","last_name":"MAUNEY","classification":"B","division":"LIMITED","hit_factor":4.9861},{"match_name":"IL 16 USPSA FEB 7 2016","match_date":"2016-02-07","stage_classifiercode":"13-01","member_number":"Ty34796","first_name":"JAMES","last_name":"DAVIDSON","classification":"A","division":"LIMITED","hit_factor":4.9859},{"match_name":"Hose Monster Action Classifier","match_date":"2020-03-15","stage_classifiercode":"13-01","member_number":"Ty125785","first_name":"SUNNY","last_name":"LE3","classification":"U","division":"LIMITED","hit_factor":4.9856},{"match_name":"MVPSA June 2016 Points Match","match_date":"2016-06-04","stage_classifiercode":"13-01","member_number":"A89067","first_name":"ELVIS","last_name":"KARARIC","classification":"C","division":"LIMITED","hit_factor":4.9853},{"match_name":"OPSC USPSA 7-10-2016","match_date":"2016-07-10","stage_classifiercode":"13-01","member_number":"FY60870","first_name":"MIKE","last_name":"CALDERISI","classification":"B","division":"LIMITED","hit_factor":4.9853},{"match_name":"USPSA MO21 2Alpha SBRC April 25 2020","match_date":"2020-04-25","stage_classifiercode":"13-01","member_number":"TY78370","first_name":"JAMES","last_name":"CHOATE","classification":"B","division":"LIMITED","hit_factor":4.9853},{"match_name":"2da Copa Nacional USPSA ","match_date":"2016-05-22","stage_classifiercode":"13-01","member_number":"\"\"","first_name":"EDWIN","last_name":"PEREZ","classification":"B","division":"LIMITED","hit_factor":4.9828},{"match_name":"BRC_20160313","match_date":"2016-03-13","stage_classifiercode":"13-01","member_number":"TY74985","first_name":"PRICE","last_name":"MCDONALD","classification":"A","division":"LIMITED","hit_factor":4.9803},{"match_name":"Hose Monster Action Classifier","match_date":"2020-03-15","stage_classifiercode":"13-01","member_number":"l1350","first_name":"GARY","last_name":"ORR","classification":"B","division":"LIMITED","hit_factor":4.9782},{"match_name":"RCPS USPSA August 11","match_date":"2018-08-11","stage_classifiercode":"13-01","member_number":"A33669","first_name":"MATT","last_name":"LOWERY","classification":"C","division":"LIMITED","hit_factor":4.977},{"match_name":"2020 Minot USPSA Club Championship","match_date":"2020-08-09","stage_classifiercode":"13-01","member_number":"A102530","first_name":"ANDREW","last_name":"SUDBRINK","classification":"B","division":"LIMITED","hit_factor":4.9756},{"match_name":"LTD Pistol - May 2017","match_date":"2017-05-06","stage_classifiercode":"13-01","member_number":"TY88704","first_name":"GARY","last_name":"HANSEN","classification":"C","division":"LIMITED","hit_factor":4.973},{"match_name":"Rio Salado UPPL 2nd Sunday January 2020","match_date":"2020-01-11","stage_classifiercode":"13-01","member_number":"TY85802","first_name":"JOHN","last_name":"CLER","classification":"C","division":"LIMITED","hit_factor":4.9622},{"match_name":"LCSA USPSA July","match_date":"2016-07-08","stage_classifiercode":"13-01","member_number":"a89831","first_name":"RICHARD","last_name":"ALLOWAY","classification":"B","division":"LIMITED","hit_factor":4.9618},{"match_name":"RTSP December 2015 USPSA Pistol Match","match_date":"2015-12-20","stage_classifiercode":"13-01","member_number":"L3767","first_name":"BEN","last_name":"HSIAO","classification":"B","division":"LIMITED","hit_factor":4.9598},{"match_name":"Laser Ninja Dragon League July Special Classifier","match_date":"2018-07-01","stage_classifiercode":"13-01","member_number":"A101336","first_name":"BOBBY","last_name":"IVESTER","classification":"U","division":"LIMITED","hit_factor":4.9587},{"match_name":"RCSC USPSA 26 Feb 2017","match_date":"2017-02-26","stage_classifiercode":"13-01","member_number":"A83119","first_name":"MIKE","last_name":"RICKMAN","classification":"U","division":"LIMITED","hit_factor":4.9571},{"match_name":"CGGR February USPSA Match","match_date":"2016-02-20","stage_classifiercode":"13-01","member_number":"L3618","first_name":"RANDY","last_name":"CARTER","classification":"C","division":"LIMITED","hit_factor":4.9565},{"match_name":"FBURG March 2017 Level I USPSA ","match_date":"2017-03-04","stage_classifiercode":"13-01","member_number":"NA","first_name":"PATRICK","last_name":"KALUSH","classification":"U","division":"LIMITED","hit_factor":4.955},{"match_name":"Applied USPSA Nov/2016","match_date":"2016-11-15","stage_classifiercode":"13-01","member_number":"A92595","first_name":"BEN","last_name":"BEUTLER","classification":"C","division":"LIMITED","hit_factor":4.9541},{"match_name":"Palmetto Gun Club - January 2016 USPSA","match_date":"2016-01-02","stage_classifiercode":"13-01","member_number":"A63611","first_name":"DIANA","last_name":"ADAMS","classification":"C","division":"LIMITED","hit_factor":4.9526},{"match_name":"Shasta Shooters 2018 June Special Classifier","match_date":"2018-06-09","stage_classifiercode":"13-01","member_number":"Ty95027","first_name":"ZACHARY","last_name":"MCMORDIE","classification":"U","division":"LIMITED","hit_factor":4.9516},{"match_name":"Idaho ISPS August 4th 2018","match_date":"2018-08-04","stage_classifiercode":"13-01","member_number":"a71703","first_name":"DONALD","last_name":"MARTIN","classification":"B","division":"LIMITED","hit_factor":4.9505},{"match_name":"Tarheel USPSA July 2016","match_date":"2016-07-09","stage_classifiercode":"13-01","member_number":"\"\"","first_name":"MORRIS","last_name":"THOMPSON","classification":"U","division":"LIMITED","hit_factor":4.9505},{"match_name":"OPSC USPSA 7-10-2016","match_date":"2016-07-10","stage_classifiercode":"13-01","member_number":"TY73249","first_name":"BOB","last_name":"THALL","classification":"U","division":"LIMITED","hit_factor":4.9477},{"match_name":"CCPS  USPSA  2016 July","match_date":"2016-07-17","stage_classifiercode":"13-01","member_number":"TY61228","first_name":"RICK","last_name":"NICHOLSON","classification":"C","division":"LIMITED","hit_factor":4.9457},{"match_name":"WELD ECO09 20180313","match_date":"2018-03-18","stage_classifiercode":"13-01","member_number":"A101939","first_name":"LANDON","last_name":"CLEMENT","classification":"U","division":"LIMITED","hit_factor":4.9456},{"match_name":"Clairton Apr 09; 2017","match_date":"2017-04-09","stage_classifiercode":"13-01","member_number":"\"\"","first_name":"JENNIFER","last_name":"TUROVSKY","classification":"C","division":"LIMITED","hit_factor":4.9372},{"match_name":"Richmond Hot Shots Dec 2-3-2017 USPSA Pistol Match","match_date":"2017-12-02","stage_classifiercode":"13-01","member_number":"L4027","first_name":"JULES","last_name":"VANFAU","classification":"C","division":"LIMITED","hit_factor":4.9336},{"match_name":"CTASA 3rd Sunday USPSA at Triple C Tactical - 7-15-2018","match_date":"2018-07-15","stage_classifiercode":"13-01","member_number":"ty107477","first_name":"MATT","last_name":"MORDECAI","classification":"U","division":"LIMITED","hit_factor":4.9315},{"match_name":"NRG Saturday July 22nd- Classifier","match_date":"2017-07-22","stage_classifiercode":"13-01","member_number":"\"\"","first_name":"JERRED","last_name":"BESHEER","classification":"U","division":"LIMITED","hit_factor":4.931},{"match_name":"BPSA January 2017 USPSA","match_date":"2017-01-22","stage_classifiercode":"13-01","member_number":"FY49991","first_name":"CHRIS","last_name":"LEWIS","classification":"B","division":"LIMITED","hit_factor":4.9303},{"match_name":"Tarheel USPSA July 2016","match_date":"2016-07-09","stage_classifiercode":"13-01","member_number":"\"\"","first_name":"JUSTIN","last_name":"KRAFT","classification":"U","division":"LIMITED","hit_factor":4.9275},{"match_name":"New Holland USPSA - October 2016","match_date":"2016-10-09","stage_classifiercode":"13-01","member_number":"A53984","first_name":"RICK","last_name":"VAHALY","classification":"C","division":"LIMITED","hit_factor":4.9209},{"match_name":"Gem City Gun Club 1-04 and 1-05 2020","match_date":"2020-01-04","stage_classifiercode":"13-01","member_number":"A32195","first_name":"GLENN","last_name":"TOKOS","classification":"D","division":"LIMITED","hit_factor":4.9194},{"match_name":"MS06 Team Magnolia July 2017 USPSA Match","match_date":"2017-07-01","stage_classifiercode":"13-01","member_number":"A37113","first_name":"JOE","last_name":"TOUCHTON","classification":"B","division":"LIMITED","hit_factor":4.9149},{"match_name":"LTD Pistol - May 2017","match_date":"2017-05-06","stage_classifiercode":"13-01","member_number":"TY18144","first_name":"MARK","last_name":"ARNOLD","classification":"C","division":"LIMITED","hit_factor":4.9143},{"match_name":"Hose Monster Action Classifier","match_date":"2020-03-15","stage_classifiercode":"13-01","member_number":"fy122762","first_name":"BRIAN","last_name":"SANDERS","classification":"U","division":"LIMITED","hit_factor":4.9103},{"match_name":"SWGC USPSA Pistol Match - February 2021","match_date":"2021-02-06","stage_classifiercode":"13-01","member_number":"TY116927","first_name":"BILL","last_name":"HARDIE","classification":"C","division":"LIMITED","hit_factor":4.9093},{"match_name":"WSPS SEPTEMBER 2017 USPSA MATCH","match_date":"2017-09-16","stage_classifiercode":"13-01","member_number":"A69256","first_name":"KRAIG","last_name":"BAER","classification":"A","division":"LIMITED","hit_factor":4.9088},{"match_name":"EAPS September 2016 USPSA","match_date":"2016-09-18","stage_classifiercode":"13-01","member_number":"\"\"","first_name":"STEPHEN","last_name":"RUSSO","classification":"B","division":"LIMITED","hit_factor":4.9074},{"match_name":"Griffin USPSA Match Oct 2017","match_date":"2017-10-21","stage_classifiercode":"13-01","member_number":"A82788","first_name":"ROBERT","last_name":"STROTHER","classification":"U","division":"LIMITED","hit_factor":4.9057},{"match_name":"2018-08-04 USPSA at Phoenix Rod and Gun Club","match_date":"2018-08-04","stage_classifiercode":"13-01","member_number":"A91733","first_name":"CARSON","last_name":"MASON","classification":"C","division":"LIMITED","hit_factor":4.9041},{"match_name":"Clairton Apr 09; 2017","match_date":"2017-04-09","stage_classifiercode":"13-01","member_number":"A96026","first_name":"JENNY","last_name":"MELTON","classification":"D","division":"LIMITED","hit_factor":4.901},{"match_name":"BRRC GAS USPSA MAY 12 2018","match_date":"2018-05-12","stage_classifiercode":"13-01","member_number":"FY70323","first_name":"ROGER","last_name":"SUTTON","classification":"B","division":"LIMITED","hit_factor":4.898},{"match_name":"LIPSA - October 2nd 2020 - Mini USPSA Match","match_date":"2020-10-04","stage_classifiercode":"13-01","member_number":"TY110649","first_name":"JOSEPH","last_name":"MERCURI","classification":"C","division":"LIMITED","hit_factor":4.8926},{"match_name":"PGC USPSA  Practice Match 11-28-17","match_date":"2017-11-28","stage_classifiercode":"13-01","member_number":"A104729","first_name":"KEITH","last_name":"STEPHENSON","classification":"U","division":"LIMITED","hit_factor":4.8908},{"match_name":"Havana May 7 2016 USPSA Match","match_date":"2016-05-07","stage_classifiercode":"13-01","member_number":"TY58309","first_name":"ERIC","last_name":"HENSON","classification":"B","division":"LIMITED","hit_factor":4.8876},{"match_name":"SLPSA May USPSA Match","match_date":"2020-05-16","stage_classifiercode":"13-01","member_number":"TY88704","first_name":"GARY","last_name":"HANSEN","classification":"B","division":"LIMITED","hit_factor":4.8837},{"match_name":"BRSP Annual Members Only Tues Night USPSA Match - May 12","match_date":"2020-05-13","stage_classifiercode":"13-01","member_number":"TY96203","first_name":"GENE","last_name":"VANNI","classification":"C","division":"LIMITED","hit_factor":4.8828},{"match_name":"Palmetto Gun Club - January 2016 USPSA","match_date":"2016-01-02","stage_classifiercode":"13-01","member_number":"A72715","first_name":"MICHAEL","last_name":"GASKINS","classification":"C","division":"LIMITED","hit_factor":4.8826},{"match_name":"Applied IN25 USPSA March classifier","match_date":"2017-03-21","stage_classifiercode":"13-01","member_number":"Ty88153","first_name":"PAUL","last_name":"NURMI","classification":"C","division":"LIMITED","hit_factor":4.8804},{"match_name":"Schultz March USPSA match","match_date":"2020-03-08","stage_classifiercode":"13-01","member_number":"A125144","first_name":"EDWARD","last_name":"RHODES","classification":"U","division":"LIMITED","hit_factor":4.878},{"match_name":"NRG Saturday January 13th - Includes a Classifier Stage","match_date":"2018-01-13","stage_classifiercode":"13-01","member_number":"A105877","first_name":"SUNNY","last_name":"BERTSCH2","classification":"U","division":"LIMITED","hit_factor":4.878},{"match_name":"Pinetucky USPSA 12-17-16","match_date":"2016-12-17","stage_classifiercode":"13-01","member_number":"A-98920","first_name":"CHRIS","last_name":"SHIRER","classification":"U","division":"LIMITED","hit_factor":4.8758},{"match_name":"DWB - Deadwood Boys USPSA February 4 2018","match_date":"2018-02-04","stage_classifiercode":"13-01","member_number":"A107293","first_name":"MARCUS","last_name":"ENFIEDJIAN","classification":"U","division":"LIMITED","hit_factor":4.8729},{"match_name":"WPGC 8-1-16","match_date":"2016-08-01","stage_classifiercode":"13-01","member_number":"A55863","first_name":"SEAN","last_name":"MYHRE","classification":"B","division":"LIMITED","hit_factor":4.8726},{"match_name":"ENPS April USPSA Match","match_date":"2017-04-02","stage_classifiercode":"13-01","member_number":"A86172","first_name":"TRAVIS","last_name":"CALDWELL","classification":"B","division":"LIMITED","hit_factor":4.8726},{"match_name":"RangeMasters 10-25-2018","match_date":"2018-10-25","stage_classifiercode":"13-01","member_number":"TY101025","first_name":"VINH","last_name":"LAM","classification":"A","division":"LIMITED","hit_factor":4.8659},{"match_name":"ORPCI 2016.03.19 Pistol","match_date":"2016-03-19","stage_classifiercode":"13-01","member_number":"A59483","first_name":"OTIS","last_name":"FOX","classification":"B","division":"LIMITED","hit_factor":4.8654},{"match_name":"Shasta Shooters 2018 June Special Classifier","match_date":"2018-06-09","stage_classifiercode":"13-01","member_number":"A107725","first_name":"RUDY","last_name":"MORA","classification":"U","division":"LIMITED","hit_factor":4.8626},{"match_name":"MVPSA June 2016 Points Match","match_date":"2016-06-04","stage_classifiercode":"13-01","member_number":"A84593","first_name":"JESSE","last_name":"POSELEY","classification":"B","division":"LIMITED","hit_factor":4.862},{"match_name":"OPSC USPSA 7-10-2016","match_date":"2016-07-10","stage_classifiercode":"13-01","member_number":"FY62123","first_name":"DOUG","last_name":"FISHER","classification":"C","division":"LIMITED","hit_factor":4.8611},{"match_name":"PPPS 3-12-17","match_date":"2017-03-12","stage_classifiercode":"13-01","member_number":"A82441","first_name":"JOSEPH","last_name":"DOBRUSKY","classification":"D","division":"LIMITED","hit_factor":4.8561},{"match_name":"IL 16 USPSA FEB 7 2016","match_date":"2016-02-07","stage_classifiercode":"13-01","member_number":"\"\"","first_name":"DENNIS","last_name":"RAINVILLE","classification":"X","division":"LIMITED","hit_factor":4.8553},{"match_name":"Brazosland Pistoleros January 17 2016--USPSA","match_date":"2016-01-17","stage_classifiercode":"13-01","member_number":"A87214","first_name":"CORY","last_name":"KLEMASHEVICH","classification":"B","division":"LIMITED","hit_factor":4.8485},{"match_name":"ISPS Nov 5th 2016","match_date":"2016-11-05","stage_classifiercode":"13-01","member_number":"\"\"","first_name":"JASON","last_name":"CONELY","classification":"\"\"","division":"LIMITED","hit_factor":4.8463},{"match_name":"BPSA January 2017 USPSA","match_date":"2017-01-22","stage_classifiercode":"13-01","member_number":"A97066","first_name":"CHRIS","last_name":"DAVIS","classification":"D","division":"LIMITED","hit_factor":4.8462},{"match_name":"Buas February Match","match_date":"2016-02-14","stage_classifiercode":"13-01","member_number":"a446","first_name":"DAN","last_name":"SIERPINA","classification":"B","division":"LIMITED","hit_factor":4.8436},{"match_name":"BRRC GAS USPSA MAY 12 2018","match_date":"2018-05-12","stage_classifiercode":"13-01","member_number":"\"\"","first_name":"RYAN","last_name":"CLASPILLE","classification":"U","division":"LIMITED","hit_factor":4.8436},{"match_name":"OPSC USPSA 7-10-2016","match_date":"2016-07-10","stage_classifiercode":"13-01","member_number":"L2367","first_name":"AARON","last_name":"BROADDUS","classification":"B","division":"LIMITED","hit_factor":4.8433},{"match_name":"North East Ohio Shooters - OHN06 - 2017-06-24","match_date":"2017-06-24","stage_classifiercode":"13-01","member_number":"A80646","first_name":"BOUNTHAVY","last_name":"SOUNGPRADITH","classification":"B","division":"LIMITED","hit_factor":4.8409},{"match_name":"PCSI March 2016 USPSA","match_date":"2016-03-05","stage_classifiercode":"13-01","member_number":"A85570","first_name":"DAVID","last_name":"MILLER","classification":"none","division":"LIMITED","hit_factor":4.8408},{"match_name":"RCPS USPSA 9 Jan 2016 Special Classifier Match","match_date":"2016-01-09","stage_classifiercode":"13-01","member_number":"PEN","first_name":"CHUCK","last_name":"YOUNG","classification":"U","division":"LIMITED","hit_factor":4.8344},{"match_name":"NHRPC - August 2016 USPSA","match_date":"2016-08-14","stage_classifiercode":"13-01","member_number":"A88049","first_name":"STEVE","last_name":"GIANACOPOULOS","classification":"C","division":"LIMITED","hit_factor":4.8341},{"match_name":"USPSA Basics 26OCT2021","match_date":"2021-10-26","stage_classifiercode":"13-01","member_number":"A132884","first_name":"KYLE","last_name":"GREENE","classification":"C","division":"LIMITED","hit_factor":4.8246},{"match_name":"A3G-APS August 5th USPSA Classifier Match","match_date":"2018-08-05","stage_classifiercode":"13-01","member_number":"a103559","first_name":"SAM","last_name":"POWERS","classification":"A","division":"LIMITED","hit_factor":4.8193},{"match_name":"ISPS Nov 5th 2016","match_date":"2016-11-05","stage_classifiercode":"13-01","member_number":"A73101","first_name":"RALPH","last_name":"GRIENINGER","classification":"B","division":"LIMITED","hit_factor":4.8159},{"match_name":"EAPS February 2018 USPSA","match_date":"2018-02-18","stage_classifiercode":"13-01","member_number":"A99396","first_name":"SAL","last_name":"LABRUZZA","classification":"U","division":"LIMITED","hit_factor":4.8156},{"match_name":"Tarheel USPSA July 2016","match_date":"2016-07-09","stage_classifiercode":"13-01","member_number":"28660","first_name":"ANDY","last_name":"KWON","classification":"A","division":"LIMITED","hit_factor":4.8114},{"match_name":"EIPS 6/7/2016","match_date":"2016-06-07","stage_classifiercode":"13-01","member_number":"A50601","first_name":"JASON","last_name":"ROSS","classification":"C","division":"LIMITED","hit_factor":4.8089},{"match_name":"Applied IN25 USPSA April Classifier 2018","match_date":"2018-04-17","stage_classifiercode":"13-01","member_number":"Ty88153","first_name":"PAUL","last_name":"NURMI","classification":"B","division":"LIMITED","hit_factor":4.8068},{"match_name":"Palmetto Gun Club - January 2016 USPSA","match_date":"2016-01-02","stage_classifiercode":"13-01","member_number":"\"\"","first_name":"ZACH","last_name":"MILLER","classification":"U","division":"LIMITED","hit_factor":4.8048},{"match_name":"SPSA USPSA October 1st Sat Match","match_date":"2020-10-03","stage_classifiercode":"13-01","member_number":"TY78711","first_name":"JON","last_name":"WAKEMAN","classification":"B","division":"LIMITED","hit_factor":4.7985},{"match_name":"NRG Saturday January 13th - Includes a Classifier Stage","match_date":"2018-01-13","stage_classifiercode":"13-01","member_number":"A101479","first_name":"NEIL","last_name":"LASPINAS","classification":"U","division":"LIMITED","hit_factor":4.7945},{"match_name":"Briar Rabbit April 2021","match_date":"2021-04-25","stage_classifiercode":"13-01","member_number":"A117807","first_name":"JUSTIN","last_name":"MESSENGER","classification":"C","division":"LIMITED","hit_factor":4.7927},{"match_name":"PRG - Oh Shoot  March 20th - 3rd Saturday Match","match_date":"2021-03-20","stage_classifiercode":"13-01","member_number":"Ty 17381","first_name":"JOHN","last_name":"HURST","classification":"M","division":"LIMITED","hit_factor":4.7926},{"match_name":"BRSP Tuesday Night USPSA Match - Aug 14","match_date":"2018-08-15","stage_classifiercode":"13-01","member_number":"\"\"","first_name":"TOM","last_name":"KOLOSKI","classification":"U","division":"LIMITED","hit_factor":4.7904},{"match_name":"A3G-APS August 5th USPSA Classifier Match","match_date":"2018-08-05","stage_classifiercode":"13-01","member_number":"TY95338","first_name":"JODY","last_name":"MARSHALL","classification":"C","division":"LIMITED","hit_factor":4.7893},{"match_name":"MSSA USPSA June  10 2017","match_date":"2017-06-10","stage_classifiercode":"13-01","member_number":"A101642","first_name":"MATTHEW","last_name":"RODGERS","classification":"B","division":"LIMITED","hit_factor":4.7817},{"match_name":"Range E11even July 2017","match_date":"2017-07-22","stage_classifiercode":"13-01","member_number":"TY77480","first_name":"GORDON","last_name":"SNADEN","classification":"B","division":"LIMITED","hit_factor":4.7809},{"match_name":"SLPSA Feb USPSA","match_date":"2018-02-17","stage_classifiercode":"13-01","member_number":"A96333","first_name":"GABRIEL","last_name":"JOHNSON","classification":"D","division":"LIMITED","hit_factor":4.7786},{"match_name":"Palmetto Gun Club - January 2016 USPSA","match_date":"2016-01-02","stage_classifiercode":"13-01","member_number":"A83853","first_name":"MIKE","last_name":"FRITS","classification":"C","division":"LIMITED","hit_factor":4.7785},{"match_name":"AAFG USPSA Special Classifier April 29  2017","match_date":"2017-04-23","stage_classifiercode":"13-01","member_number":"TY94766","first_name":"RICK","last_name":"CASAREZ","classification":"U","division":"LIMITED","hit_factor":4.7755},{"match_name":"SCCPSA USPSA Aug 19 2017","match_date":"2017-08-19","stage_classifiercode":"13-01","member_number":"TY68827","first_name":"JAMES","last_name":"GRAZIANO III","classification":"B","division":"LIMITED","hit_factor":4.7733},{"match_name":"BAPS USPSA July","match_date":"2021-07-17","stage_classifiercode":"13-01","member_number":"B51","first_name":"SAM","last_name":"BHARKSUWAN","classification":"B","division":"LIMITED","hit_factor":4.7674},{"match_name":"2da Copa Nacional USPSA ","match_date":"2016-05-22","stage_classifiercode":"13-01","member_number":"A85595","first_name":"FERNANDO","last_name":"RODRIGUEZ","classification":"D","division":"LIMITED","hit_factor":4.7664},{"match_name":"Texarkana Gun Club USPSA Match - Level 1 for June 2021","match_date":"2021-06-05","stage_classifiercode":"13-01","member_number":"A58482","first_name":"KELLY","last_name":"MURRAY","classification":"B","division":"LIMITED","hit_factor":4.7664},{"match_name":"USPSA MO21 2Alpha SBRC April 25 2020","match_date":"2020-04-25","stage_classifiercode":"13-01","member_number":"TY75981","first_name":"BENNY","last_name":"HEFLEY","classification":"B","division":"LIMITED","hit_factor":4.7663},{"match_name":"BRC_20160313","match_date":"2016-03-13","stage_classifiercode":"13-01","member_number":"TY65590","first_name":"STEVE","last_name":"STETLER","classification":"A","division":"LIMITED","hit_factor":4.7619},{"match_name":"FBURG March 2017 Level I USPSA ","match_date":"2017-03-04","stage_classifiercode":"13-01","member_number":"TY22431","first_name":"ARISTO","last_name":"VON HOFFMAN","classification":"B","division":"LIMITED","hit_factor":4.7619},{"match_name":"OKCGC USPSA Dec 2016","match_date":"2016-12-03","stage_classifiercode":"13-01","member_number":"\"\"","first_name":"RAY","last_name":"KING","classification":"U","division":"LIMITED","hit_factor":4.7619},{"match_name":"SEPSA June 2016","match_date":"2016-06-11","stage_classifiercode":"13-01","member_number":"A78415","first_name":"ZAC","last_name":"BARR","classification":"B","division":"LIMITED","hit_factor":4.7562},{"match_name":"COPS Jan 2016 USPSA Match","match_date":"2016-01-03","stage_classifiercode":"13-01","member_number":"A75981","first_name":"BENNY","last_name":"HEFLEY","classification":"C","division":"LIMITED","hit_factor":4.7523},{"match_name":"PTPC February 4th Classifier Match","match_date":"2018-02-04","stage_classifiercode":"13-01","member_number":"TY99997","first_name":"MIKE","last_name":"POTTS","classification":"U","division":"LIMITED","hit_factor":4.7521},{"match_name":"SCCPSA USPSA Aug 19 2017","match_date":"2017-08-19","stage_classifiercode":"13-01","member_number":"A81512","first_name":"MICHAEL","last_name":"MCCOURT","classification":"U","division":"LIMITED","hit_factor":4.7489},{"match_name":"DWB - Deadwood Boys USPSA 03 June 2018","match_date":"2018-06-03","stage_classifiercode":"13-01","member_number":"A83686","first_name":"DAVID","last_name":"KAFFEL","classification":"A","division":"LIMITED","hit_factor":4.7473},{"match_name":"SAPS Match 8/07/2021","match_date":"2021-08-07","stage_classifiercode":"13-01","member_number":"l2628","first_name":"SALIM","last_name":"DOMINGUEZ","classification":"A","division":"LIMITED","hit_factor":4.7454},{"match_name":"DSC September 2016","match_date":"2016-09-18","stage_classifiercode":"13-01","member_number":"A85373","first_name":"SEAN","last_name":"DOELLE","classification":"D","division":"LIMITED","hit_factor":4.7442},{"match_name":"IL 16 USPSA FEB 7 2016","match_date":"2016-02-07","stage_classifiercode":"13-01","member_number":"Fy85612","first_name":"STEPHEN","last_name":"STEWART","classification":"B","division":"LIMITED","hit_factor":4.7431},{"match_name":"Alpha Mike June 2016","match_date":"2016-06-19","stage_classifiercode":"13-01","member_number":"a68457","first_name":"VAL","last_name":"PENDON","classification":"A","division":"LIMITED","hit_factor":4.742},{"match_name":"PRG Pistol Match 5 Feb 2017","match_date":"2017-02-04","stage_classifiercode":"13-01","member_number":"TY71084","first_name":"ROBERT","last_name":"WEIDE","classification":"M","division":"LIMITED","hit_factor":4.7401},{"match_name":"MPSA 080418 USPSA","match_date":"2018-08-04","stage_classifiercode":"13-01","member_number":"FY39690","first_name":"MAC","last_name":"HART","classification":"B","division":"LIMITED","hit_factor":4.7393},{"match_name":"Prescott 3rd Sunday USPSA 04-17-2016","match_date":"2016-04-17","stage_classifiercode":"13-01","member_number":"TY46419","first_name":"DAVE","last_name":"BANKHEAD","classification":"C","division":"LIMITED","hit_factor":4.7384},{"match_name":"MRCPS USPSA Feb    2016","match_date":"2016-02-21","stage_classifiercode":"13-01","member_number":"A81373","first_name":"TIM","last_name":"KROHN","classification":"B","division":"LIMITED","hit_factor":4.7374},{"match_name":"WTPS USPSA April Classifier Match 4-8-17","match_date":"2017-04-08","stage_classifiercode":"13-01","member_number":"A101808","first_name":"TYLER","last_name":"SPINKS","classification":"U","division":"LIMITED","hit_factor":4.7374},{"match_name":"Laser Ninja Dragon League MSA USPSA January 21st 2017","match_date":"2017-01-21","stage_classifiercode":"13-01","member_number":"A91499","first_name":"ERNEST","last_name":"LEE","classification":"U","division":"LIMITED","hit_factor":4.7348},{"match_name":"MS06 Team Magnolia July 2017 USPSA Match","match_date":"2017-07-01","stage_classifiercode":"13-01","member_number":"A103381","first_name":"ROBERT","last_name":"MCNAYLOR","classification":"U","division":"LIMITED","hit_factor":4.7321},{"match_name":"DAPS USPSA at ETTS 4-8-2017","match_date":"2017-04-08","stage_classifiercode":"13-01","member_number":"TY45359","first_name":"OLIN","last_name":"WILLIFORD","classification":"C","division":"LIMITED","hit_factor":4.7316},{"match_name":"SLPSA Feb USPSA","match_date":"2018-02-17","stage_classifiercode":"13-01","member_number":"A72760","first_name":"MONTE","last_name":"JOHNSON","classification":"M","division":"LIMITED","hit_factor":4.7315},{"match_name":"Griffin USPSA Match Oct 2017","match_date":"2017-10-21","stage_classifiercode":"13-01","member_number":"PEN","first_name":"TOM","last_name":"MINKO","classification":"U","division":"LIMITED","hit_factor":4.7297},{"match_name":"Schultz March USPSA match","match_date":"2020-03-08","stage_classifiercode":"13-01","member_number":"A123657","first_name":"STEVEN","last_name":"CROOKS","classification":"C","division":"LIMITED","hit_factor":4.7297},{"match_name":"Applied IN25 USPSA October Classifier Match 2018","match_date":"2018-10-17","stage_classifiercode":"13-01","member_number":"TY106367","first_name":"DANIEL","last_name":"MATHIAS","classification":"B","division":"LIMITED","hit_factor":4.7288},{"match_name":"Danville Rifle And Pistol Club USPSA Classifier Match","match_date":"2017-11-11","stage_classifiercode":"13-01","member_number":"TY92908","first_name":"DAVID","last_name":"BURNS","classification":"M","division":"LIMITED","hit_factor":4.7264},{"match_name":"Applied IN25 USPSA October 2017 Classifier","match_date":"2017-10-18","stage_classifiercode":"13-01","member_number":"A-102132","first_name":"DAN","last_name":"QUESENBERY","classification":"C","division":"LIMITED","hit_factor":4.7261},{"match_name":"ORPCI USPSA Saturday 2020.09.19","match_date":"2020-09-19","stage_classifiercode":"13-01","member_number":"A59483","first_name":"OTIS","last_name":"FOX","classification":"B","division":"LIMITED","hit_factor":4.723},{"match_name":"Patriot Action Shooters December 2015 Match","match_date":"2015-12-19","stage_classifiercode":"13-01","member_number":"A71494","first_name":"KEONE","last_name":"BROWN","classification":"B","division":"LIMITED","hit_factor":4.721},{"match_name":"MS06 Team Magnolia July 2017 USPSA Match","match_date":"2017-07-01","stage_classifiercode":"13-01","member_number":"FY81259","first_name":"WAYNE","last_name":"COLEY","classification":"C","division":"LIMITED","hit_factor":4.7162},{"match_name":"ISPS Nov 5th 2016","match_date":"2016-11-05","stage_classifiercode":"13-01","member_number":"A81839","first_name":"PHIL","last_name":"O'CONNELL","classification":"C","division":"LIMITED","hit_factor":4.7153},{"match_name":"MPSA 2021-05-15","match_date":"2021-05-15","stage_classifiercode":"13-01","member_number":"A132891","first_name":"BRADY","last_name":"MONTGOMERY","classification":"U","division":"LIMITED","hit_factor":4.7105},{"match_name":"NRG December 10th 2016","match_date":"2016-12-10","stage_classifiercode":"13-01","member_number":"TY61353","first_name":"ANDIE","last_name":"BUENCAMINO","classification":"B","division":"LIMITED","hit_factor":4.7101},{"match_name":"EAPS February 2018 USPSA","match_date":"2018-02-18","stage_classifiercode":"13-01","member_number":"TY29304","first_name":"DANIEL","last_name":"HIDALGO","classification":"M","division":"LIMITED","hit_factor":4.7078},{"match_name":"NCPS USPSA Handgun Match November 28 2021x","match_date":"2021-11-28","stage_classifiercode":"13-01","member_number":"FY83788","first_name":"ROBERT","last_name":"WARN","classification":"C","division":"LIMITED","hit_factor":4.7069},{"match_name":"DWB - Deadwood Boys USPSA February 4 2018","match_date":"2018-02-04","stage_classifiercode":"13-01","member_number":"A98127","first_name":"MYRO","last_name":"CABAONG","classification":"D","division":"LIMITED","hit_factor":4.7046},{"match_name":"EIPS 6/7/2016","match_date":"2016-06-07","stage_classifiercode":"13-01","member_number":"\"\"","first_name":"TY","last_name":"VANWEELDEN","classification":"\"\"","division":"LIMITED","hit_factor":4.7035},{"match_name":"MVPSA USPSA 5-15-2020 League 1","match_date":"2020-05-15","stage_classifiercode":"13-01","member_number":"TY105231","first_name":"THOMAS","last_name":"OCONNELL","classification":"B","division":"LIMITED","hit_factor":4.7028},{"match_name":"SCCPSA USPSA Aug 19 2017","match_date":"2017-08-19","stage_classifiercode":"13-01","member_number":"A69256","first_name":"KRAIG","last_name":"BAER","classification":"A","division":"LIMITED","hit_factor":4.7026},{"match_name":"ORPCI 2016.03.19 Pistol","match_date":"2016-03-19","stage_classifiercode":"13-01","member_number":"A57373","first_name":"KEITH","last_name":"DUNCAN","classification":"C","division":"LIMITED","hit_factor":4.7014},{"match_name":"BRRC GAS USPSA MAY 12 2018","match_date":"2018-05-12","stage_classifiercode":"13-01","member_number":"A86039","first_name":"MICHAEL","last_name":"SIMONS","classification":"C","division":"LIMITED","hit_factor":4.7005},{"match_name":"Danville Rifle And Pistol Club USPSA Classifier Match","match_date":"2017-11-11","stage_classifiercode":"13-01","member_number":"TY94427","first_name":"CHRIS","last_name":"SMITH","classification":"C","division":"LIMITED","hit_factor":4.6992},{"match_name":"Buas February Match","match_date":"2016-02-14","stage_classifiercode":"13-01","member_number":"l1571","first_name":"ROBERT","last_name":"BOUDRIE","classification":"A","division":"LIMITED","hit_factor":4.6986},{"match_name":"IN19 ACC USPSA May 23 2021","match_date":"2021-05-23","stage_classifiercode":"13-01","member_number":"Ty93493","first_name":"COLIN","last_name":"AUSTIN","classification":"B","division":"LIMITED","hit_factor":4.6944},{"match_name":"Springfield Tactical Shooters 10/05/2017","match_date":"2017-10-05","stage_classifiercode":"13-01","member_number":"A62932","first_name":"RICHARD","last_name":"LANE","classification":"B","division":"LIMITED","hit_factor":4.6936},{"match_name":"Crooked Creek Pistol League - July 2018","match_date":"2018-07-14","stage_classifiercode":"13-01","member_number":"A59597","first_name":"GREG","last_name":"PLATT","classification":"A","division":"LIMITED","hit_factor":4.6936},{"match_name":"NHRPC - October 2020 USPSA","match_date":"2020-10-10","stage_classifiercode":"13-01","member_number":"A53984","first_name":"RICK","last_name":"VAHALY","classification":"C","division":"LIMITED","hit_factor":4.6928},{"match_name":"LTD Pistol - May 2017","match_date":"2017-05-06","stage_classifiercode":"13-01","member_number":"a98982","first_name":"MANNY","last_name":"MERAZ","classification":"U","division":"LIMITED","hit_factor":4.6832},{"match_name":"WELD ECO09 20180617","match_date":"2018-06-17","stage_classifiercode":"13-01","member_number":"TY82173","first_name":"JOHN","last_name":"HALL","classification":"C","division":"LIMITED","hit_factor":4.6809},{"match_name":"INAS Dec 2016 USPSA","match_date":"2016-12-17","stage_classifiercode":"13-01","member_number":"TY69162","first_name":"FRANK","last_name":"LARNED","classification":"U","division":"LIMITED","hit_factor":4.6805},{"match_name":"Griffin USPSA Match Oct 2017","match_date":"2017-10-21","stage_classifiercode":"13-01","member_number":"ty85712","first_name":"MANDI","last_name":"MACDONALD","classification":"B","division":"LIMITED","hit_factor":4.6796},{"match_name":"Blackstone Shooting Sports Snow Days January 2017 USPSA Level  1","match_date":"2017-01-08","stage_classifiercode":"13-01","member_number":"a80881","first_name":"DONNIE","last_name":"FLOWE","classification":"U","division":"LIMITED","hit_factor":4.6759},{"match_name":"SRAPS Amarillo Action July","match_date":"2016-07-23","stage_classifiercode":"13-01","member_number":"\"\"","first_name":"DAVID","last_name":"PIERCE","classification":"\"\"","division":"LIMITED","hit_factor":4.6753},{"match_name":"Palmetto Gun Club - January 2016 USPSA","match_date":"2016-01-02","stage_classifiercode":"13-01","member_number":"A86756","first_name":"RUSS","last_name":"DEAN","classification":"B","division":"LIMITED","hit_factor":4.6719},{"match_name":"SPSA USPSA August 4th Sat match","match_date":"2016-08-27","stage_classifiercode":"13-01","member_number":"A95144","first_name":"JACOB","last_name":"BRANT","classification":"D","division":"LIMITED","hit_factor":4.6719},{"match_name":"Danville Rifle And Pistol Club USPSA Classifier Match","match_date":"2017-11-11","stage_classifiercode":"13-01","member_number":"TY68673","first_name":"NOEL","last_name":"ZARZA","classification":"B","division":"LIMITED","hit_factor":4.6717},{"match_name":"Maine Practical Shooters-December 2017","match_date":"2017-12-16","stage_classifiercode":"13-01","member_number":"A82210","first_name":"JOHN","last_name":"JONES","classification":"B","division":"LIMITED","hit_factor":4.6685},{"match_name":"PPPS 3-12-17","match_date":"2017-03-12","stage_classifiercode":"13-01","member_number":"A83337","first_name":"KENNY","last_name":"REAVES","classification":"X","division":"LIMITED","hit_factor":4.6685},{"match_name":"CGGR February USPSA Match","match_date":"2016-02-20","stage_classifiercode":"13-01","member_number":"A88352","first_name":"JASON","last_name":"BYERLY","classification":"\"\"","division":"LIMITED","hit_factor":4.6667},{"match_name":"1/8/17 GMPS","match_date":"2017-01-08","stage_classifiercode":"13-01","member_number":"TY66052","first_name":"ADAM","last_name":"NILSON","classification":"A","division":"LIMITED","hit_factor":4.6667},{"match_name":"TCGC April 2018","match_date":"2018-04-29","stage_classifiercode":"13-01","member_number":"TY64781","first_name":"DANIEL","last_name":"MOROWITZ","classification":"B","division":"LIMITED","hit_factor":4.6653},{"match_name":"FSA USPSA POINT SERIES 03-08-20","match_date":"2020-03-08","stage_classifiercode":"13-01","member_number":"TY106244","first_name":"JOE","last_name":"KUMMERER","classification":"B","division":"LIMITED","hit_factor":4.6642},{"match_name":"Dundee Practical Shooters - June 10 2020 - Summer Series","match_date":"2020-06-11","stage_classifiercode":"13-01","member_number":"L3452","first_name":"MARK","last_name":"GOSS","classification":"B","division":"LIMITED","hit_factor":4.6622},{"match_name":"SLOSA Feburary 2016 USPSA","match_date":"2016-02-13","stage_classifiercode":"13-01","member_number":"TY-87459","first_name":"AARON","last_name":"RUNYAN","classification":"C","division":"LIMITED","hit_factor":4.6614},{"match_name":"SLPSA Feb USPSA","match_date":"2018-02-17","stage_classifiercode":"13-01","member_number":"\"\"","first_name":"MICHAEL","last_name":"SWAN","classification":"U","division":"LIMITED","hit_factor":4.6595},{"match_name":"NRG Saturday January 13th - Includes a Classifier Stage","match_date":"2018-01-13","stage_classifiercode":"13-01","member_number":"A105956","first_name":"JOEY","last_name":"AIELLO","classification":"C","division":"LIMITED","hit_factor":4.6575},{"match_name":"May 2018 at MPSA","match_date":"2018-05-27","stage_classifiercode":"13-01","member_number":"A71480","first_name":"DAVID","last_name":"SCORDY","classification":"B","division":"LIMITED","hit_factor":4.6463},{"match_name":"Rio Salado UPPL 2nd Sunday January 2020","match_date":"2020-01-11","stage_classifiercode":"13-01","member_number":"A109765","first_name":"CHRIS","last_name":"BREW","classification":"B","division":"LIMITED","hit_factor":4.6455},{"match_name":"Shasta Shooters 2020 Jan","match_date":"2020-01-11","stage_classifiercode":"13-01","member_number":"A33123","first_name":"DAREN","last_name":"HUSA","classification":"B","division":"LIMITED","hit_factor":4.6448},{"match_name":"Benton Gun Club-USPSA Classifier Match","match_date":"2016-04-10","stage_classifiercode":"13-01","member_number":"ty53176","first_name":"BARRY","last_name":"ROBINSON","classification":"C","division":"LIMITED","hit_factor":4.6443},{"match_name":"NW15 Port Townsend Practical Pistol USPSA September 4 2021","match_date":"2021-09-04","stage_classifiercode":"13-01","member_number":"A111915","first_name":"DANE","last_name":"SANDS","classification":"C","division":"LIMITED","hit_factor":4.6425},{"match_name":"MSSA USPSA June  10 2017","match_date":"2017-06-10","stage_classifiercode":"13-01","member_number":"A89613","first_name":"JERRY","last_name":"ROSE","classification":"B","division":"LIMITED","hit_factor":4.6392},{"match_name":"Medford USPSA November 2017 Match","match_date":"2017-11-19","stage_classifiercode":"13-01","member_number":"A62645","first_name":"TODD","last_name":"OVERTURF","classification":"C","division":"LIMITED","hit_factor":4.6382},{"match_name":"CCC Shooting Complex February 2017","match_date":"2017-02-05","stage_classifiercode":"13-01","member_number":"\"\"","first_name":"HUNTER","last_name":"THOMPSON","classification":"U","division":"LIMITED","hit_factor":4.6365},{"match_name":"WSPS SEPTEMBER 2017 USPSA MATCH","match_date":"2017-09-16","stage_classifiercode":"13-01","member_number":"A98541","first_name":"RYAN","last_name":"GRIMES","classification":"U","division":"LIMITED","hit_factor":4.6329},{"match_name":"Rio Salado UPPL May 2021","match_date":"2021-05-09","stage_classifiercode":"13-01","member_number":"A102899","first_name":"STEVE","last_name":"CRAWFORD","classification":"C","division":"LIMITED","hit_factor":4.6322},{"match_name":"Palmetto Gun Club - January 2016 USPSA","match_date":"2016-01-02","stage_classifiercode":"13-01","member_number":"FY81806","first_name":"ANDREW","last_name":"CRENSHAW","classification":"B","division":"LIMITED","hit_factor":4.6263},{"match_name":"ISPS Nov 5th 2016","match_date":"2016-11-05","stage_classifiercode":"13-01","member_number":"FY74073","first_name":"AARON","last_name":"HUGHSTON","classification":"B","division":"LIMITED","hit_factor":4.6263},{"match_name":"Competitive Shooters of Lake Norman CORNELIUS Thursday Evening Indoor USPSA Pistol Match North Carolina","match_date":"2018-04-05","stage_classifiercode":"13-01","member_number":"A109144","first_name":"MARK","last_name":"SCHULTE","classification":"U","division":"LIMITED","hit_factor":4.6256},{"match_name":"FBURG March 2017 Level I USPSA ","match_date":"2017-03-04","stage_classifiercode":"13-01","member_number":"A98365","first_name":"TYLER","last_name":"HOUSTON","classification":"U","division":"LIMITED","hit_factor":4.6243},{"match_name":"SCCPSA USPSA Aug 19 2017","match_date":"2017-08-19","stage_classifiercode":"13-01","member_number":"A105240","first_name":"TOM","last_name":"PARR","classification":"U","division":"LIMITED","hit_factor":4.6238},{"match_name":"CCPS  USPSA  2016 July","match_date":"2016-07-17","stage_classifiercode":"13-01","member_number":"A88558","first_name":"JAKE","last_name":"ENDRES","classification":"\"\"","division":"LIMITED","hit_factor":4.6233},{"match_name":"GRPC USPSA SOME LIKE IT HOT","match_date":"2018-08-05","stage_classifiercode":"13-01","member_number":"A102903","first_name":"EDWIN","last_name":"BUCHWALTER","classification":"C","division":"LIMITED","hit_factor":4.6231},{"match_name":"ENPS April USPSA Match","match_date":"2017-04-02","stage_classifiercode":"13-01","member_number":"a98540","first_name":"NIC","last_name":"LUCART","classification":"U","division":"LIMITED","hit_factor":4.6211},{"match_name":"PCWC USPSA  9 22 2018","match_date":"2018-09-22","stage_classifiercode":"13-01","member_number":"A87724","first_name":"TODD","last_name":"ADAMS","classification":"A","division":"LIMITED","hit_factor":4.6196},{"match_name":"Laser Ninja Dragon League MSA USPSA January 21st 2017","match_date":"2017-01-21","stage_classifiercode":"13-01","member_number":"A99942","first_name":"JOHN","last_name":"MORRISON (LIMITED)","classification":"U","division":"LIMITED","hit_factor":4.6185},{"match_name":"Richmond Hot Shots November 17-18 USPSA Pistol Match","match_date":"2018-11-17","stage_classifiercode":"13-01","member_number":"L4027","first_name":"JULES","last_name":"VANFAU","classification":"C","division":"LIMITED","hit_factor":4.6103},{"match_name":"USPSA MO21 2Alpha SBRC April 25 2020","match_date":"2020-04-25","stage_classifiercode":"13-01","member_number":"TY14961","first_name":"ROY","last_name":"BOWLING","classification":"B","division":"LIMITED","hit_factor":4.6073},{"match_name":"Idaho ISPS August 4th 2018","match_date":"2018-08-04","stage_classifiercode":"13-01","member_number":"FY81838","first_name":"JIM","last_name":"PARKER","classification":"C","division":"LIMITED","hit_factor":4.6046},{"match_name":"Rio Salado UPPL May 2021","match_date":"2021-05-09","stage_classifiercode":"13-01","member_number":"A131286","first_name":"IAN","last_name":"ROSARIO","classification":"C","division":"LIMITED","hit_factor":4.6039},{"match_name":"Rankin Field April (ALL CLASSIFIER) Saturday USPSA","match_date":"2021-04-03","stage_classifiercode":"13-01","member_number":"A96105","first_name":"JEFFREY","last_name":"KINDLER","classification":"D","division":"LIMITED","hit_factor":4.5933},{"match_name":"NRG Saturday July 22nd- Classifier","match_date":"2017-07-22","stage_classifiercode":"13-01","member_number":"TY61353","first_name":"ANDIE","last_name":"BUENCAMINO","classification":"B","division":"LIMITED","hit_factor":4.5902},{"match_name":"NRG Saturday January 13th - Includes a Classifier Stage","match_date":"2018-01-13","stage_classifiercode":"13-01","member_number":"A106671","first_name":"CHRISTOPHER","last_name":"ILLIANO","classification":"U","division":"LIMITED","hit_factor":4.5872},{"match_name":"SLOSA January 2018 USPSA MATCH","match_date":"2018-01-13","stage_classifiercode":"13-01","member_number":"TY46706","first_name":"STEVE","last_name":"HOVE","classification":"D","division":"LIMITED","hit_factor":4.582},{"match_name":"YMM IPSC02 2017_10_08","match_date":"2017-10-08","stage_classifiercode":"13-01","member_number":"FY56992","first_name":"JOHN","last_name":"GLOVER","classification":"A","division":"LIMITED","hit_factor":4.582},{"match_name":"PPPS 3-12-17","match_date":"2017-03-12","stage_classifiercode":"13-01","member_number":"A92674","first_name":"BEN","last_name":"TARVER","classification":"U","division":"LIMITED","hit_factor":4.5795},{"match_name":"SPSA USPSA October 1st Sat Match","match_date":"2020-10-03","stage_classifiercode":"13-01","member_number":"TY71466","first_name":"JEFF","last_name":"DAMPAC","classification":"C","division":"LIMITED","hit_factor":4.5734},{"match_name":"APSC USPSA Match 08-04-18","match_date":"2018-08-04","stage_classifiercode":"13-01","member_number":"A105946","first_name":"TY","last_name":"ARNOLD","classification":"B","division":"LIMITED","hit_factor":4.5721},{"match_name":"SPSA USPSA August 4th Sat match","match_date":"2016-08-27","stage_classifiercode":"13-01","member_number":"L1583","first_name":"EDDIE","last_name":"WAGNER","classification":"B","division":"LIMITED","hit_factor":4.5685},{"match_name":"2020 Minot USPSA Club Championship","match_date":"2020-08-09","stage_classifiercode":"13-01","member_number":"TY96773","first_name":"BUCKY","last_name":"OLSON","classification":"B","division":"LIMITED","hit_factor":4.5673},{"match_name":"Clinton County USPSA","match_date":"2016-03-26","stage_classifiercode":"13-01","member_number":"\"\"","first_name":"NATE","last_name":"RITCHEY","classification":"U","division":"LIMITED","hit_factor":4.5658},{"match_name":"WELD ECO09 20180313","match_date":"2018-03-18","stage_classifiercode":"13-01","member_number":"\"\"","first_name":"JOHN","last_name":"PEABODY","classification":"U","division":"LIMITED","hit_factor":4.565},{"match_name":"SLOSA Feburary 2016 USPSA","match_date":"2016-02-13","stage_classifiercode":"13-01","member_number":"PEN","first_name":"CHRISTIAN","last_name":"GOINS","classification":"U","division":"LIMITED","hit_factor":4.5647},{"match_name":"Devil Dog USPSA Classifier Match-Saturday Session","match_date":"2018-03-10","stage_classifiercode":"13-01","member_number":"A101609","first_name":"GREG","last_name":"TARPLEY","classification":"C","division":"LIMITED","hit_factor":4.5647},{"match_name":"WPGC 8-1-16","match_date":"2016-08-01","stage_classifiercode":"13-01","member_number":"A87914","first_name":"PATRICE","last_name":"SUTTER","classification":"C","division":"LIMITED","hit_factor":4.562},{"match_name":"FBURG March 2017 Level I USPSA ","match_date":"2017-03-04","stage_classifiercode":"13-01","member_number":"A99573","first_name":"JOHN","last_name":"FOLEY","classification":"U","division":"LIMITED","hit_factor":4.5603},{"match_name":"BRRC GAS USPSA MAY 12 2018","match_date":"2018-05-12","stage_classifiercode":"13-01","member_number":"A14123","first_name":"BRIAN","last_name":"PAYNE","classification":"B","division":"LIMITED","hit_factor":4.5603},{"match_name":"WELD ECO09 20180313","match_date":"2018-03-18","stage_classifiercode":"13-01","member_number":"\"\"","first_name":"PAUL","last_name":"ROHDE","classification":"U","division":"LIMITED","hit_factor":4.5584},{"match_name":"SLPSA Feb USPSA","match_date":"2018-02-17","stage_classifiercode":"13-01","member_number":"A107968","first_name":"COLTON","last_name":"STEPHENS","classification":"C","division":"LIMITED","hit_factor":4.5545},{"match_name":"CGGR February USPSA Match","match_date":"2016-02-20","stage_classifiercode":"13-01","member_number":"A20987","first_name":"BUZ","last_name":"KNIGHT","classification":"B","division":"LIMITED","hit_factor":4.5539},{"match_name":"The Range at Austin USPSA MAR2020","match_date":"2020-03-12","stage_classifiercode":"13-01","member_number":"a118925","first_name":"JULIO","last_name":"VILLAREAL","classification":"U","division":"LIMITED","hit_factor":4.5491},{"match_name":"Shasta Shooters 2020 Jan","match_date":"2020-01-11","stage_classifiercode":"13-01","member_number":"a109862","first_name":"JONATHAN","last_name":"WILTSHIRE","classification":"B","division":"LIMITED","hit_factor":4.5455},{"match_name":"Applied IN25 USPSA October Classifier Match 2018","match_date":"2018-10-17","stage_classifiercode":"13-01","member_number":"FY90994","first_name":"PAUL","last_name":"BENSON","classification":"C","division":"LIMITED","hit_factor":4.5369},{"match_name":"Superior Practical Shooters - Let Freedom Ring","match_date":"2016-07-06","stage_classifiercode":"13-01","member_number":"A82831","first_name":"MATT","last_name":"BABB","classification":"U","division":"LIMITED","hit_factor":4.5346},{"match_name":"FBURG March 2017 Level I USPSA ","match_date":"2017-03-04","stage_classifiercode":"13-01","member_number":"\"\"","first_name":"BRYAN","last_name":"CASTELLANO","classification":"U","division":"LIMITED","hit_factor":4.5338},{"match_name":"The Armory Indoor League","match_date":"2016-03-11","stage_classifiercode":"13-01","member_number":"A94992","first_name":"DANIEL","last_name":"CHERKIS","classification":"\"\"","division":"LIMITED","hit_factor":4.5336},{"match_name":"Applied IN25 USPSA October 2017 Classifier","match_date":"2017-10-18","stage_classifiercode":"13-01","member_number":"L4004","first_name":"AARON","last_name":"LORTON","classification":"B","division":"LIMITED","hit_factor":4.5296},{"match_name":"USPSA AR02 North Arkansas Action Pistol July 9 2017","match_date":"2017-07-09","stage_classifiercode":"13-01","member_number":"A-101632","first_name":"GREG","last_name":"YEN","classification":"C","division":"LIMITED","hit_factor":4.5288},{"match_name":"Blackstone Shooting Sports Snow Days January 2017 USPSA Level  1","match_date":"2017-01-08","stage_classifiercode":"13-01","member_number":"TY72553","first_name":"BRIAN","last_name":"DEMMA","classification":"B","division":"LIMITED","hit_factor":4.5288},{"match_name":"5 Dogs April 2017 USPSA","match_date":"2017-04-02","stage_classifiercode":"13-01","member_number":"A90745","first_name":"JEREMY","last_name":"SCHAEFFER","classification":"C","division":"LIMITED","hit_factor":4.5283},{"match_name":"BRRC GAS USPSA MAY 12 2018","match_date":"2018-05-12","stage_classifiercode":"13-01","member_number":"TY84519","first_name":"ROB","last_name":"SANAZARO","classification":"C","division":"LIMITED","hit_factor":4.526},{"match_name":"SFA USPSA AUGUST 2018","match_date":"2018-08-18","stage_classifiercode":"13-01","member_number":"TY54695","first_name":"RODEL","last_name":"SAMONTE","classification":"C","division":"LIMITED","hit_factor":4.5257},{"match_name":"MS06 Team Magnolia July 2017 USPSA Match","match_date":"2017-07-01","stage_classifiercode":"13-01","member_number":"TY71097","first_name":"CHRIS","last_name":"BAUCUM","classification":"U","division":"LIMITED","hit_factor":4.5255},{"match_name":"Fairfax PS USPSA August 2018","match_date":"2018-08-21","stage_classifiercode":"13-01","member_number":"A88424","first_name":"CRAIG","last_name":"PETERSON","classification":"C","division":"LIMITED","hit_factor":4.524},{"match_name":"CPS USPSA Apr 2018","match_date":"2018-04-07","stage_classifiercode":"13-01","member_number":"A76547","first_name":"KENT","last_name":"NEUMANN","classification":"C","division":"LIMITED","hit_factor":4.524},{"match_name":"TMGN July 1st USPSA Match","match_date":"2018-07-01","stage_classifiercode":"13-01","member_number":"A111903","first_name":"JEFFREY","last_name":"MIX","classification":"\"\"","division":"LIMITED","hit_factor":4.5216},{"match_name":"TMGN December 2 USPSA Classifier Match","match_date":"2018-12-03","stage_classifiercode":"13-01","member_number":"TY104434","first_name":"ROBERT","last_name":"ZUNIGA","classification":"B","division":"LIMITED","hit_factor":4.5205},{"match_name":"WELD ECO09 20180617","match_date":"2018-06-17","stage_classifiercode":"13-01","member_number":"A91619","first_name":"SONNY","last_name":"CHAN","classification":"B","division":"LIMITED","hit_factor":4.5184},{"match_name":"2018-08-04 USPSA at Phoenix Rod and Gun Club","match_date":"2018-08-04","stage_classifiercode":"13-01","member_number":"TY86705","first_name":"ROB","last_name":"GAGE","classification":"B","division":"LIMITED","hit_factor":4.5167},{"match_name":"ORPCI 2018.03.31 USPSA Special","match_date":"2018-03-31","stage_classifiercode":"13-01","member_number":"A96318","first_name":"TYLER","last_name":"HUFF","classification":"U","division":"LIMITED","hit_factor":4.5161},{"match_name":"ISPS Nov 5th 2016","match_date":"2016-11-05","stage_classifiercode":"13-01","member_number":"A97864","first_name":"JAMES","last_name":"DERRICK","classification":"C","division":"LIMITED","hit_factor":4.5139},{"match_name":"Rankin Field August Sunday USPSA","match_date":"2020-08-16","stage_classifiercode":"13-01","member_number":"L4505","first_name":"GREG","last_name":"VAUGHN","classification":"A","division":"LIMITED","hit_factor":4.5122},{"match_name":"WPGC 8-1-16","match_date":"2016-08-01","stage_classifiercode":"13-01","member_number":"A69226","first_name":"RON","last_name":"BURNS","classification":"B","division":"LIMITED","hit_factor":4.51},{"match_name":"LTD Pistol - May 2017","match_date":"2017-05-06","stage_classifiercode":"13-01","member_number":"A93975","first_name":"STEPAN","last_name":"GENERALOV","classification":"U","division":"LIMITED","hit_factor":4.5087},{"match_name":"Medford USPSA November 2017 Match","match_date":"2017-11-19","stage_classifiercode":"13-01","member_number":"A106395","first_name":"BOB","last_name":"KELTY","classification":"U","division":"LIMITED","hit_factor":4.5052},{"match_name":"Green Valley September 2016","match_date":"2016-09-24","stage_classifiercode":"13-01","member_number":"A59509","first_name":"J.J.","last_name":"BRADSHAW","classification":"C","division":"LIMITED","hit_factor":4.5038},{"match_name":"OFGC Practical Pistol Match 7-19-2020","match_date":"2020-07-19","stage_classifiercode":"13-01","member_number":"A60291","first_name":"ROBERT","last_name":"MCDANIEL","classification":"B","division":"LIMITED","hit_factor":4.5038},{"match_name":"CCC Shooting Complex February 2017","match_date":"2017-02-05","stage_classifiercode":"13-01","member_number":"\"\"","first_name":"TAYLOR","last_name":"LATHAM","classification":"M","division":"LIMITED","hit_factor":4.5024},{"match_name":"RCPS USPSA August 11","match_date":"2018-08-11","stage_classifiercode":"13-01","member_number":"TY81767","first_name":"WILLIAM","last_name":"KODADEK","classification":"B","division":"LIMITED","hit_factor":4.501},{"match_name":"The Armory Indoor League","match_date":"2016-03-11","stage_classifiercode":"13-01","member_number":"\"\"","first_name":"ADAM","last_name":"RISER","classification":"U","division":"LIMITED","hit_factor":4.5005},{"match_name":"LCSA USPSA July","match_date":"2016-07-08","stage_classifiercode":"13-01","member_number":"a91802","first_name":"STEVE","last_name":"WESCOTT","classification":"C","division":"LIMITED","hit_factor":4.4966},{"match_name":"FBURG March 2017 Level I USPSA ","match_date":"2017-03-04","stage_classifiercode":"13-01","member_number":"A62654","first_name":"CHRIS","last_name":"FIELD","classification":"U","division":"LIMITED","hit_factor":4.4966},{"match_name":"DWB - Deadwood Boys USPSA February 4 2018","match_date":"2018-02-04","stage_classifiercode":"13-01","member_number":"\"\"","first_name":"JAE","last_name":"SUN","classification":"U","division":"LIMITED","hit_factor":4.4966},{"match_name":"FSTC  12-17-17","match_date":"2017-12-17","stage_classifiercode":"13-01","member_number":"TY96657","first_name":"JUSTIN","last_name":"FRITZ","classification":"U","division":"LIMITED","hit_factor":4.4944},{"match_name":"MSSA USPSA June  10 2017","match_date":"2017-06-10","stage_classifiercode":"13-01","member_number":"\"\"","first_name":"STEVEN","last_name":"SANDERS","classification":"G","division":"LIMITED","hit_factor":4.4931},{"match_name":"EAPS February 2018 USPSA","match_date":"2018-02-18","stage_classifiercode":"13-01","member_number":"A102947","first_name":"PATRICK","last_name":"DELANEY","classification":"D","division":"LIMITED","hit_factor":4.4924},{"match_name":"Inner 10 August Classifier","match_date":"2018-08-13","stage_classifiercode":"13-01","member_number":"A-95559","first_name":"ZACH J","last_name":"COLHOUR","classification":"U","division":"LIMITED","hit_factor":4.4902},{"match_name":"CCC Shooting Complex September 2016","match_date":"2016-09-03","stage_classifiercode":"13-01","member_number":"\"\"","first_name":"HUNTER","last_name":"THOMPSON","classification":"U","division":"LIMITED","hit_factor":4.4898},{"match_name":"OPSC USPSA OCTOBER 2018","match_date":"2018-10-14","stage_classifiercode":"13-01","member_number":"FY84558","first_name":"CEDRIC","last_name":"CANDO","classification":"B","division":"LIMITED","hit_factor":4.4837},{"match_name":"WELD ECO09 20180313","match_date":"2018-03-18","stage_classifiercode":"13-01","member_number":"TY80989","first_name":"LARRY","last_name":"MELTZER","classification":"B","division":"LIMITED","hit_factor":4.4776},{"match_name":"NRG Saturday January 13th - Includes a Classifier Stage","match_date":"2018-01-13","stage_classifiercode":"13-01","member_number":"TY92176","first_name":"JAE","last_name":"AHN","classification":"A","division":"LIMITED","hit_factor":4.4776},{"match_name":"2016-10 Bone Creek USPSA","match_date":"2016-10-02","stage_classifiercode":"13-01","member_number":"A11448","first_name":"JENS","last_name":"BARCLAY","classification":"C","division":"LIMITED","hit_factor":4.4764},{"match_name":"ALL CLASSIFIER SUMMERSLAM  -  AREA 59 2018","match_date":"2018-06-30","stage_classifiercode":"13-01","member_number":"A109249","first_name":"YI","last_name":"SHU","classification":"U","division":"LIMITED","hit_factor":4.4764},{"match_name":"SLOSA Feburary 2016 USPSA","match_date":"2016-02-13","stage_classifiercode":"13-01","member_number":"L1137","first_name":"JEROME","last_name":"TURNER","classification":"U","division":"LIMITED","hit_factor":4.4752},{"match_name":"2016-10 Bone Creek USPSA","match_date":"2016-10-02","stage_classifiercode":"13-01","member_number":"\"\"","first_name":"CODY","last_name":"BACON","classification":"U","division":"LIMITED","hit_factor":4.4747},{"match_name":"IN19 ACC USPSA May 23 2021","match_date":"2021-05-23","stage_classifiercode":"13-01","member_number":"TY103992","first_name":"GREG","last_name":"MCCOY","classification":"B","division":"LIMITED","hit_factor":4.4725},{"match_name":"Griffin USPSA Match Oct 2017","match_date":"2017-10-21","stage_classifiercode":"13-01","member_number":"ty87166","first_name":"KATHLEEN","last_name":"FALLIN","classification":"B","division":"LIMITED","hit_factor":4.4708},{"match_name":"Benton Gun Club-USPSA May27 2018 CLASIFIER","match_date":"2018-05-27","stage_classifiercode":"13-01","member_number":"A110925","first_name":"SHAUN","last_name":"ROBERSON","classification":"U","division":"LIMITED","hit_factor":4.47},{"match_name":"COPS Jan 2016 USPSA Match","match_date":"2016-01-03","stage_classifiercode":"13-01","member_number":"A82914","first_name":"TIM","last_name":"ELLS","classification":"C","division":"LIMITED","hit_factor":4.467},{"match_name":"NRG December 10th 2016","match_date":"2016-12-10","stage_classifiercode":"13-01","member_number":"A54827","first_name":"JOHN","last_name":"LEVIS","classification":"A","division":"LIMITED","hit_factor":4.4669},{"match_name":"Brazosland Pistoleros January 17 2016--USPSA","match_date":"2016-01-17","stage_classifiercode":"13-01","member_number":"\"\"","first_name":"CLINT","last_name":"DAVIS","classification":"U","division":"LIMITED","hit_factor":4.4622},{"match_name":"Benton Gun Club-USPSA Classifier Match","match_date":"2016-04-10","stage_classifiercode":"13-01","member_number":"A-91009","first_name":"GREG","last_name":"TINNEY","classification":"C","division":"LIMITED","hit_factor":4.4617},{"match_name":"MRCPS USPSA Feb    2016","match_date":"2016-02-21","stage_classifiercode":"13-01","member_number":"A85321","first_name":"DEAN","last_name":"CLARK","classification":"C","division":"LIMITED","hit_factor":4.4593},{"match_name":"Richmond Hot Shots Dec 2-3-2017 USPSA Pistol Match","match_date":"2017-12-02","stage_classifiercode":"13-01","member_number":"TY36021","first_name":"TODD","last_name":"CROW","classification":"M","division":"LIMITED","hit_factor":4.4586},{"match_name":"SCCCApril2017","match_date":"2017-04-09","stage_classifiercode":"13-01","member_number":"a47581","first_name":"JOHN","last_name":"CAMBRON","classification":"B","division":"LIMITED","hit_factor":4.4586},{"match_name":"Bills Gun Shop Circle Pines December 3 2017","match_date":"2017-12-03","stage_classifiercode":"13-01","member_number":"A68543","first_name":"BRIAN","last_name":"HANSEN","classification":"M","division":"LIMITED","hit_factor":4.4586},{"match_name":"CCPS  USPSA  2016 July","match_date":"2016-07-17","stage_classifiercode":"13-01","member_number":"\"\"","first_name":"RON","last_name":"PATTERSON","classification":"\"\"","division":"LIMITED","hit_factor":4.4528},{"match_name":"PCWC USPSA  7 23 2016","match_date":"2016-07-23","stage_classifiercode":"13-01","member_number":"TY63839","first_name":"BEN","last_name":"SMITH","classification":"C","division":"LIMITED","hit_factor":4.4518},{"match_name":"TCSC USPSA Level I September club match","match_date":"2020-09-27","stage_classifiercode":"13-01","member_number":"TY77488","first_name":"OLEG","last_name":"SHEIN SAT","classification":"B","division":"LIMITED","hit_factor":4.4499},{"match_name":"ENPS April USPSA Match","match_date":"2017-04-02","stage_classifiercode":"13-01","member_number":"A96843","first_name":"ROBERT","last_name":"WAITE","classification":"D","division":"LIMITED","hit_factor":4.4444},{"match_name":"Range E11even July 2017","match_date":"2017-07-22","stage_classifiercode":"13-01","member_number":"A104005","first_name":"BILL","last_name":"BAKER","classification":"U","division":"LIMITED","hit_factor":4.4444},{"match_name":"2da Copa Nacional USPSA ","match_date":"2016-05-22","stage_classifiercode":"13-01","member_number":"F78832","first_name":"ERNESTO","last_name":"RODRIGUEZ","classification":"C","division":"LIMITED","hit_factor":4.4406},{"match_name":"PRG Pistol Match 5 Feb 2017","match_date":"2017-02-04","stage_classifiercode":"13-01","member_number":"\"\"","first_name":"CHRISTIAN","last_name":"CALVEZ","classification":"U","division":"LIMITED","hit_factor":4.4366},{"match_name":"Richmond Hot Shots November 17-18 USPSA Pistol Match","match_date":"2018-11-17","stage_classifiercode":"13-01","member_number":"FY57508","first_name":"PATRICK","last_name":"CLARK","classification":"B","division":"LIMITED","hit_factor":4.4355},{"match_name":"G2G Practical Shooters 05-15-2018","match_date":"2018-05-15","stage_classifiercode":"13-01","member_number":"A104836","first_name":"BILL","last_name":"KINSTLEY","classification":"D","division":"LIMITED","hit_factor":4.4351},{"match_name":"Havana May 7 2016 USPSA Match","match_date":"2016-05-07","stage_classifiercode":"13-01","member_number":"TY-87586","first_name":"MICHAEL","last_name":"JEFFERS","classification":"C","division":"LIMITED","hit_factor":4.4319},{"match_name":"EASTER EGG HUNT AREA 59  ALL CLASSFIER MATCH","match_date":"2017-04-15","stage_classifiercode":"13-01","member_number":"TY102734","first_name":"CHARLES","last_name":"JACKSON","classification":"U","division":"LIMITED","hit_factor":4.4309},{"match_name":"IL 16 USPSA FEB 7 2016","match_date":"2016-02-07","stage_classifiercode":"13-01","member_number":"A90793","first_name":"NOEL","last_name":"ZEMAN","classification":"C","division":"LIMITED","hit_factor":4.4284},{"match_name":"Mvpsa April 2","match_date":"2016-04-02","stage_classifiercode":"13-01","member_number":"A76845","first_name":"CHRIS","last_name":"WARD","classification":"C","division":"LIMITED","hit_factor":4.428},{"match_name":"Briar Rabbit April 2021","match_date":"2021-04-25","stage_classifiercode":"13-01","member_number":"TY56546","first_name":"DREW","last_name":"BENNETT","classification":"A","division":"LIMITED","hit_factor":4.4234},{"match_name":"CCC Shooting Complex February 2017","match_date":"2017-02-05","stage_classifiercode":"13-01","member_number":"\"\"","first_name":"CLINT","last_name":"DAVIS","classification":"U","division":"LIMITED","hit_factor":4.4164},{"match_name":"RISE FEBRUARY USPSA","match_date":"2020-02-15","stage_classifiercode":"13-01","member_number":"A105603","first_name":"CHRIS","last_name":"WOOD","classification":"U","division":"LIMITED","hit_factor":4.4132},{"match_name":"FBPPC NOVEMBER 2015","match_date":"2015-11-14","stage_classifiercode":"13-01","member_number":"FY-5938","first_name":"ROCKY","last_name":"SPEER","classification":"X","division":"LIMITED","hit_factor":4.4131},{"match_name":"Feb 25th Marc-On  Classifier","match_date":"2018-02-25","stage_classifiercode":"13-01","member_number":"A101975","first_name":"WADE","last_name":"REED","classification":"\"\"","division":"LIMITED","hit_factor":4.4088},{"match_name":"PBR USPSA Classifier Match","match_date":"2018-06-11","stage_classifiercode":"13-01","member_number":"TY88693","first_name":"ANDY","last_name":"POTEAT","classification":"B","division":"LIMITED","hit_factor":4.4084},{"match_name":"INAS Jan 2018 USPSA PM","match_date":"2018-01-22","stage_classifiercode":"13-01","member_number":"A88885","first_name":"ROB","last_name":"PILGRIM","classification":"C","division":"LIMITED","hit_factor":4.4077},{"match_name":"Renton USPSA May 2018 - NW05","match_date":"2018-05-27","stage_classifiercode":"13-01","member_number":"A89231","first_name":"CHRIS","last_name":"PUKALO","classification":"C","division":"LIMITED","hit_factor":4.4049},{"match_name":"AIPS  USPSA Weekly 30 August 2016","match_date":"2016-08-30","stage_classifiercode":"13-01","member_number":"A93741","first_name":"CODY","last_name":"PERRY","classification":"C","division":"LIMITED","hit_factor":4.401},{"match_name":"Brazosland Pistoleros August 20 2017","match_date":"2017-08-20","stage_classifiercode":"13-01","member_number":"A104958","first_name":"SETH","last_name":"ABBOTT","classification":"U","division":"LIMITED","hit_factor":4.397},{"match_name":"WTPS USPSA April Classifier Match 4-8-17","match_date":"2017-04-08","stage_classifiercode":"13-01","member_number":"A102129","first_name":"TRAVIS","last_name":"CLEMENTS","classification":"U","division":"LIMITED","hit_factor":4.3946},{"match_name":"NAAS  2016-07-17 Special DBL Classifier Match","match_date":"2016-07-17","stage_classifiercode":"13-01","member_number":"A82809","first_name":"DAVID","last_name":"DARDEN","classification":"B","division":"LIMITED","hit_factor":4.3931},{"match_name":"Tarheel USPSA July 2016","match_date":"2016-07-09","stage_classifiercode":"13-01","member_number":"L3143","first_name":"JOHN","last_name":"HERATH","classification":"B","division":"LIMITED","hit_factor":4.3922},{"match_name":"SCCCApril2017","match_date":"2017-04-09","stage_classifiercode":"13-01","member_number":"\"\"","first_name":"JAMES","last_name":"MUELLER","classification":"U","division":"LIMITED","hit_factor":4.3897},{"match_name":"PPS CLASSIFIER MATCH 2020-02-25","match_date":"2020-02-26","stage_classifiercode":"13-01","member_number":"TY62910","first_name":"LARRY","last_name":"SCOTT","classification":"B","division":"LIMITED","hit_factor":4.3893},{"match_name":"Low Country USPSA Mar 31st","match_date":"2018-03-31","stage_classifiercode":"13-01","member_number":"A109541","first_name":"GRAHAM","last_name":"OSWALD","classification":"U","division":"LIMITED","hit_factor":4.3876},{"match_name":"EAPS  January 2016","match_date":"2016-01-17","stage_classifiercode":"13-01","member_number":"A74371","first_name":"MICHELE","last_name":"LEMOINE","classification":"C","division":"LIMITED","hit_factor":4.3874},{"match_name":"BPSA January 2017 USPSA","match_date":"2017-01-22","stage_classifiercode":"13-01","member_number":"A94451","first_name":"TODD","last_name":"DEMPSTER","classification":"C","division":"LIMITED","hit_factor":4.387},{"match_name":"AAFG USPSA Special Classifier April 29  2017","match_date":"2017-04-23","stage_classifiercode":"13-01","member_number":"A101236","first_name":"ISAAC","last_name":"GROSFELD-KATZ","classification":"U","division":"LIMITED","hit_factor":4.3845},{"match_name":"TriggerGuard USPSA Classifier Match","match_date":"2018-03-24","stage_classifiercode":"13-01","member_number":"A107583","first_name":"TODD","last_name":"REIFSCHNEIDER","classification":"U","division":"LIMITED","hit_factor":4.376},{"match_name":"Rio Grande Practical Shooters - February 2017","match_date":"2017-02-04","stage_classifiercode":"13-01","member_number":"A7721","first_name":"CHARLIE","last_name":"MYERS","classification":"M","division":"LIMITED","hit_factor":4.3742},{"match_name":"OKCGC USPSA Dec 2017 Match","match_date":"2017-12-02","stage_classifiercode":"13-01","member_number":"A106457","first_name":"JOSH","last_name":"HODGES","classification":"U","division":"LIMITED","hit_factor":4.3722},{"match_name":"SAPSC USPSA CLASSIFIER MATCH AT AUTREYS ARMORY 04132021","match_date":"2021-04-13","stage_classifiercode":"13-01","member_number":"L3387","first_name":"STEVEN","last_name":"BLACKWELL","classification":"C","division":"LIMITED","hit_factor":4.3706},{"match_name":"WAC May 23rd (4th Sunday) - USPSA 6 Stage Match","match_date":"2021-05-23","stage_classifiercode":"13-01","member_number":"TY65542","first_name":"JAMES","last_name":"RAMOS","classification":"M","division":"LIMITED","hit_factor":4.3706},{"match_name":"CCC Shooting Complex February 2017","match_date":"2017-02-05","stage_classifiercode":"13-01","member_number":"\"\"","first_name":"CHRIS","last_name":"RHODES","classification":"U","division":"LIMITED","hit_factor":4.3694},{"match_name":"ASPS MI20 August Hot Barrels","match_date":"2020-08-15","stage_classifiercode":"13-01","member_number":"a7552","first_name":"BOB","last_name":"GERAK","classification":"B","division":"LIMITED","hit_factor":4.3689},{"match_name":"SLPSA Feb USPSA","match_date":"2018-02-17","stage_classifiercode":"13-01","member_number":"A71332","first_name":"MIKE","last_name":"LARSON","classification":"C","division":"LIMITED","hit_factor":4.3676},{"match_name":"Hose Monster Action Classifier","match_date":"2020-03-15","stage_classifiercode":"13-01","member_number":"Ty111313","first_name":"JASON","last_name":"BRYNGELSON2","classification":"U","division":"LIMITED","hit_factor":4.3668},{"match_name":"Patriot Action Shooters December 2015 Match","match_date":"2015-12-19","stage_classifiercode":"13-01","member_number":"A93428","first_name":"DERRIK","last_name":"NEACE","classification":"U","division":"LIMITED","hit_factor":4.3651},{"match_name":"CVSC 12-31-2017","match_date":"2017-12-31","stage_classifiercode":"13-01","member_number":"A65481","first_name":"KEVIN","last_name":"DORAN","classification":"B","division":"LIMITED","hit_factor":4.3632},{"match_name":"Pioneer Action Shooters USPSA 5-23-21 Special Classifer","match_date":"2021-05-23","stage_classifiercode":"13-01","member_number":"A111576","first_name":"CARL","last_name":"LABERGE","classification":"B","division":"LIMITED","hit_factor":4.3578},{"match_name":"FBPPC NOVEMBER 2015","match_date":"2015-11-14","stage_classifiercode":"13-01","member_number":"PEN","first_name":"ROGER","last_name":"CLAEPS","classification":"X","division":"LIMITED","hit_factor":4.3548},{"match_name":"PSAC_20170527","match_date":"2017-05-27","stage_classifiercode":"13-01","member_number":"A82441","first_name":"JOSEPH","last_name":"DOBRUSKY","classification":"C","division":"LIMITED","hit_factor":4.3519},{"match_name":"Griffin USPSA Match Sep 17 2016","match_date":"2016-09-17","stage_classifiercode":"13-01","member_number":"A-82423","first_name":"NICK","last_name":"REAVES","classification":"C","division":"LIMITED","hit_factor":4.3516},{"match_name":"HRC December 2015","match_date":"2015-12-06","stage_classifiercode":"13-01","member_number":"A39468","first_name":"DAVE","last_name":"CANNEY","classification":"U","division":"LIMITED","hit_factor":4.3511},{"match_name":"DAPS USPSA at ETTS 4-8-2017","match_date":"2017-04-08","stage_classifiercode":"13-01","member_number":"A74370","first_name":"TIM","last_name":"RODDY","classification":"D","division":"LIMITED","hit_factor":4.3478},{"match_name":"ENPS April USPSA Match","match_date":"2017-04-02","stage_classifiercode":"13-01","member_number":"TY68981","first_name":"JOEL","last_name":"LUDWIG","classification":"B","division":"LIMITED","hit_factor":4.3429},{"match_name":"MRCPS USPSA Feb    2016","match_date":"2016-02-21","stage_classifiercode":"13-01","member_number":"TY41939","first_name":"GARY","last_name":"WALL","classification":"B","division":"LIMITED","hit_factor":4.3403},{"match_name":"OPSC USPSA 7-10-2016","match_date":"2016-07-10","stage_classifiercode":"13-01","member_number":"A88909","first_name":"RICHARD","last_name":"RANSOM","classification":"C","division":"LIMITED","hit_factor":4.3403},{"match_name":"Palmetto Gun Club - January 2016 USPSA","match_date":"2016-01-02","stage_classifiercode":"13-01","member_number":"A18382","first_name":"MIKE","last_name":"WARD","classification":"C","division":"LIMITED","hit_factor":4.34},{"match_name":"Range54 USPSA","match_date":"2018-05-04","stage_classifiercode":"13-01","member_number":"\"\"","first_name":"JOEY","last_name":"CLORE","classification":"U","division":"LIMITED","hit_factor":4.34},{"match_name":"minot uspsa  11-11-18","match_date":"2018-11-11","stage_classifiercode":"13-01","member_number":"A114132","first_name":"MARTIN","last_name":"SMITH","classification":"U","division":"LIMITED","hit_factor":4.3388},{"match_name":"PPS CLASSIFIER MATCH 2020-02-25","match_date":"2020-02-26","stage_classifiercode":"13-01","member_number":"A99903","first_name":"TROY","last_name":"HAMM","classification":"U","division":"LIMITED","hit_factor":4.3371},{"match_name":"PCSI March 2016 USPSA","match_date":"2016-03-05","stage_classifiercode":"13-01","member_number":"A39282","first_name":"MCCORD","last_name":"JOE","classification":"\"\"","division":"LIMITED","hit_factor":4.3365},{"match_name":"Griffin USPSA Match Sep 17 2016","match_date":"2016-09-17","stage_classifiercode":"13-01","member_number":"A95386","first_name":"GRAHAM","last_name":"PAGE","classification":"B","division":"LIMITED","hit_factor":4.3337},{"match_name":"EIPS 6/4/2016","match_date":"2016-06-04","stage_classifiercode":"13-01","member_number":"\"\"","first_name":"JEREMY","last_name":"DUVEL","classification":"\"\"","division":"LIMITED","hit_factor":4.3333},{"match_name":"CRGC USPSA Match 5-20-18","match_date":"2018-05-20","stage_classifiercode":"13-01","member_number":"A97258","first_name":"JASON","last_name":"SUTHERLAND","classification":"\"\"","division":"LIMITED","hit_factor":4.3304},{"match_name":"Havana May 7 2016 USPSA Match","match_date":"2016-05-07","stage_classifiercode":"13-01","member_number":"Ty90994","first_name":"PAUL","last_name":"BENSON","classification":"C","division":"LIMITED","hit_factor":4.3294},{"match_name":"PPPS 3-12-17","match_date":"2017-03-12","stage_classifiercode":"13-01","member_number":"A87914","first_name":"PATRICE","last_name":"SUTTER","classification":"C","division":"LIMITED","hit_factor":4.329},{"match_name":"WELD ECO09 20180313","match_date":"2018-03-18","stage_classifiercode":"13-01","member_number":"FY68397","first_name":"MATT","last_name":"UNGER","classification":"C","division":"LIMITED","hit_factor":4.3285},{"match_name":"TGC USPSA September 2017","match_date":"2017-09-16","stage_classifiercode":"13-01","member_number":"TY68041","first_name":"RICHARD","last_name":"BOYES","classification":"X","division":"LIMITED","hit_factor":4.3269},{"match_name":"SPSA USPSA October 1st Sat Match","match_date":"2020-10-03","stage_classifiercode":"13-01","member_number":"TY100125","first_name":"JOHN","last_name":"EDENS","classification":"B","division":"LIMITED","hit_factor":4.3261},{"match_name":"RangeMasters 3-29-18","match_date":"2018-03-29","stage_classifiercode":"13-01","member_number":"\"\"","first_name":"DAVID","last_name":"TOM","classification":"B","division":"LIMITED","hit_factor":4.3253},{"match_name":"ISPS Nov 5th 2016","match_date":"2016-11-05","stage_classifiercode":"13-01","member_number":"TY80815","first_name":"JOHN","last_name":"DANIELSON","classification":"C","division":"LIMITED","hit_factor":4.3239},{"match_name":"ORPCI 2018.03.31 USPSA Special","match_date":"2018-03-31","stage_classifiercode":"13-01","member_number":"A104217","first_name":"AARON","last_name":"WILLIS","classification":"U","division":"LIMITED","hit_factor":4.3237},{"match_name":"IN19 ACC USPSA May 23 2021","match_date":"2021-05-23","stage_classifiercode":"13-01","member_number":"TY66824","first_name":"MICHAEL","last_name":"MCCAULEY","classification":"B","division":"LIMITED","hit_factor":4.3231},{"match_name":"Rio Grande Practical Shooters - February 2017","match_date":"2017-02-04","stage_classifiercode":"13-01","member_number":"A93430","first_name":"RICHARD","last_name":"IVEY","classification":"X","division":"LIMITED","hit_factor":4.3178},{"match_name":"SPSA USPSA August 4th Sat match","match_date":"2016-08-27","stage_classifiercode":"13-01","member_number":"TY87299","first_name":"SCOTTY","last_name":"SIMPSON","classification":"B","division":"LIMITED","hit_factor":4.3165},{"match_name":"North East Ohio Shooters - OHN06 - 2017-06-24","match_date":"2017-06-24","stage_classifiercode":"13-01","member_number":"TY63998","first_name":"MARTIN","last_name":"LEI","classification":"C","division":"LIMITED","hit_factor":4.3147},{"match_name":"TCGC Polo March 2016 Classifier Match","match_date":"2016-03-20","stage_classifiercode":"13-01","member_number":"TY82895","first_name":"JON","last_name":"ADLOF","classification":"\"\"","division":"LIMITED","hit_factor":4.3118},{"match_name":"Crooked Creek Pistol League - July 2018","match_date":"2018-07-14","stage_classifiercode":"13-01","member_number":"L2450","first_name":"BUD","last_name":"CONNOLLY","classification":"B","division":"LIMITED","hit_factor":4.3113},{"match_name":"Clinton County USPSA","match_date":"2016-03-26","stage_classifiercode":"13-01","member_number":"\"\"","first_name":"FRED","last_name":"COPLEY","classification":"U","division":"LIMITED","hit_factor":4.3088},{"match_name":"APSC USPSA Match 08-04-18","match_date":"2018-08-04","stage_classifiercode":"13-01","member_number":"TY113304","first_name":"BOBBY","last_name":"GIBBONS","classification":"U","division":"LIMITED","hit_factor":4.3082},{"match_name":"PCWC USPSA  7 23 2016","match_date":"2016-07-23","stage_classifiercode":"13-01","member_number":"A62764","first_name":"TIM","last_name":"SELLERS","classification":"A","division":"LIMITED","hit_factor":4.3071},{"match_name":"GAS September 2020 USPSA","match_date":"2020-09-05","stage_classifiercode":"13-01","member_number":"A130276","first_name":"MATT","last_name":"KRUEGER","classification":"U","division":"LIMITED","hit_factor":4.305},{"match_name":"FSA USPSA POINT SERIES 03-08-20","match_date":"2020-03-08","stage_classifiercode":"13-01","member_number":"A121951","first_name":"JASEN","last_name":"SLATTERY","classification":"C","division":"LIMITED","hit_factor":4.3031},{"match_name":"BRC_20160313","match_date":"2016-03-13","stage_classifiercode":"13-01","member_number":"A94756","first_name":"PAUL","last_name":"HAUSER","classification":"U","division":"LIMITED","hit_factor":4.3031},{"match_name":"Woodland Heights Practical Shooters USPSA Match 9-20","match_date":"2020-09-20","stage_classifiercode":"13-01","member_number":"TY-25721","first_name":"MARK","last_name":"VOGEL","classification":"C","division":"LIMITED","hit_factor":4.3019},{"match_name":"Griffin USPSA Match Sep 17 2016","match_date":"2016-09-17","stage_classifiercode":"13-01","member_number":"PEN","first_name":"STEVE","last_name":"NEALE","classification":"U","division":"LIMITED","hit_factor":4.2959},{"match_name":"GRB USPSA SEPTEMBER 2021 AT CAVALIER","match_date":"2021-09-18","stage_classifiercode":"13-01","member_number":"A116830","first_name":"BRIAN","last_name":"DEWAR","classification":"B","division":"LIMITED","hit_factor":4.2936},{"match_name":"OKCGC USPSA Dec 2017 Match","match_date":"2017-12-02","stage_classifiercode":"13-01","member_number":"L3565","first_name":"MICHAEL","last_name":"RUSH","classification":"B","division":"LIMITED","hit_factor":4.2918},{"match_name":"LTD Pistol - May 2017","match_date":"2017-05-06","stage_classifiercode":"13-01","member_number":"A81202","first_name":"KEVIN","last_name":"CHILDRESS","classification":"B","division":"LIMITED","hit_factor":4.2904},{"match_name":"SCCCApril2017","match_date":"2017-04-09","stage_classifiercode":"13-01","member_number":"\"\"","first_name":"RICK","last_name":"KOENIG","classification":"U","division":"LIMITED","hit_factor":4.2898},{"match_name":"CCSC USPSA Match","match_date":"2021-07-10","stage_classifiercode":"13-01","member_number":"Ty113872","first_name":"LEVI","last_name":"ROCHE","classification":"C","division":"LIMITED","hit_factor":4.287},{"match_name":"DAPS USPSA at ETTS 4-8-2017","match_date":"2017-04-08","stage_classifiercode":"13-01","member_number":"TY65343","first_name":"MIKE","last_name":"HOILES","classification":"B","division":"LIMITED","hit_factor":4.2857},{"match_name":"Tarheel USPSA July 2016","match_date":"2016-07-09","stage_classifiercode":"13-01","member_number":"\"\"","first_name":"ANDREW","last_name":"PEARSON","classification":"U","division":"LIMITED","hit_factor":4.2846},{"match_name":"Gem City Gun Club 1-04 and 1-05 2020","match_date":"2020-01-04","stage_classifiercode":"13-01","member_number":"x","first_name":"SCOTT","last_name":"STEVENS","classification":"Unclassified","division":"LIMITED","hit_factor":4.2827},{"match_name":"MCRC USPSA October 2018","match_date":"2018-10-13","stage_classifiercode":"13-01","member_number":"A87032","first_name":"TRE","last_name":"ROACH","classification":"A","division":"LIMITED","hit_factor":4.2818},{"match_name":"OKCGC USPSA Dec 2017 Match","match_date":"2017-12-02","stage_classifiercode":"13-01","member_number":"\"\"","first_name":"DAVID","last_name":"JENSEN","classification":"U","division":"LIMITED","hit_factor":4.2798},{"match_name":"Patriot Action Shooters December 2015 Match","match_date":"2015-12-19","stage_classifiercode":"13-01","member_number":"TY88018","first_name":"JOHN","last_name":"WOODCOCK","classification":"B","division":"LIMITED","hit_factor":4.2797},{"match_name":"Bills Gun Shop Circle Pines December 3 2017","match_date":"2017-12-03","stage_classifiercode":"13-01","member_number":"A89445","first_name":"A.J.","last_name":"QUINN","classification":"B","division":"LIMITED","hit_factor":4.2797},{"match_name":"PTPC February 4th Classifier Match","match_date":"2018-02-04","stage_classifiercode":"13-01","member_number":"A48558","first_name":"CHUCK","last_name":"SCHANK","classification":"C","division":"LIMITED","hit_factor":4.2781},{"match_name":"BRC_20160313","match_date":"2016-03-13","stage_classifiercode":"13-01","member_number":"TY77590","first_name":"NICK","last_name":"BRAZZALE","classification":"M","division":"LIMITED","hit_factor":4.2773},{"match_name":"PBR USPSA Classifier Match","match_date":"2018-06-11","stage_classifiercode":"13-01","member_number":"A110203","first_name":"JEFF","last_name":"CORDERO","classification":"U","division":"LIMITED","hit_factor":4.2763},{"match_name":"NRG Saturday January 13th - Includes a Classifier Stage","match_date":"2018-01-13","stage_classifiercode":"13-01","member_number":"TY97487","first_name":"JON","last_name":"GOLVEO","classification":"U","division":"LIMITED","hit_factor":4.2748},{"match_name":"Clairton Apr 09; 2017","match_date":"2017-04-09","stage_classifiercode":"13-01","member_number":"ty72728","first_name":"KIRK","last_name":"SWEGER","classification":"B","division":"LIMITED","hit_factor":4.2735},{"match_name":"COPS Jan 2016 USPSA Match","match_date":"2016-01-03","stage_classifiercode":"13-01","member_number":"A11823","first_name":"LARRY","last_name":"FLETCHER","classification":"M","division":"LIMITED","hit_factor":4.2726},{"match_name":"May 2018 at MPSA","match_date":"2018-05-27","stage_classifiercode":"13-01","member_number":"A104221","first_name":"RICHARD","last_name":"FRANCE","classification":"U","division":"LIMITED","hit_factor":4.2724},{"match_name":"ISPS January Impact","match_date":"2016-01-27","stage_classifiercode":"13-01","member_number":"A94638","first_name":"JAMES","last_name":"BAILEY","classification":"U","division":"LIMITED","hit_factor":4.2722},{"match_name":"Rio Grande Practical Shooters - February 2017","match_date":"2017-02-04","stage_classifiercode":"13-01","member_number":"TY100627","first_name":"STEVE","last_name":"BOWMAN","classification":"U","division":"LIMITED","hit_factor":4.2714},{"match_name":"The Range at Austin USPSA MAR2020","match_date":"2020-03-12","stage_classifiercode":"13-01","member_number":"TY106022","first_name":"MANI","last_name":"NAIR","classification":"U","division":"LIMITED","hit_factor":4.2699},{"match_name":"PPPS 3-12-17","match_date":"2017-03-12","stage_classifiercode":"13-01","member_number":"\"\"","first_name":"STEWART","last_name":"OPJORDEN","classification":"none","division":"LIMITED","hit_factor":4.2699},{"match_name":"A3G-APS August 5th USPSA Classifier Match","match_date":"2018-08-05","stage_classifiercode":"13-01","member_number":"A106854","first_name":"ODED","last_name":"ZYSSMAN","classification":"B","division":"LIMITED","hit_factor":4.2683},{"match_name":"Shasta Shooters 2018 June Special Classifier","match_date":"2018-06-09","stage_classifiercode":"13-01","member_number":"TY99690","first_name":"SCOTT","last_name":"STANFIELD","classification":"C","division":"LIMITED","hit_factor":4.2678},{"match_name":"EAPS  January 2016","match_date":"2016-01-17","stage_classifiercode":"13-01","member_number":"A94451","first_name":"TODD","last_name":"DEMPSTER","classification":"U","division":"LIMITED","hit_factor":4.2673},{"match_name":"AIPS  USPSA Weekly 30 August 2016","match_date":"2016-08-30","stage_classifiercode":"13-01","member_number":"A95108","first_name":"EVAN","last_name":"NICHOLS","classification":"B","division":"LIMITED","hit_factor":4.2659},{"match_name":"Shongum February 2017 USPSA Match","match_date":"2017-02-04","stage_classifiercode":"13-01","member_number":"TY77141","first_name":"KEN (LOUIE)","last_name":"PRIMERO","classification":"A","division":"LIMITED","hit_factor":4.2636},{"match_name":"NRG Saturday January 13th - Includes a Classifier Stage","match_date":"2018-01-13","stage_classifiercode":"13-01","member_number":"\"\"","first_name":"SKOT","last_name":"RICHARDS","classification":"U","division":"LIMITED","hit_factor":4.2627},{"match_name":"Richmond Hot Shots November 17-18 USPSA Pistol Match","match_date":"2018-11-17","stage_classifiercode":"13-01","member_number":"A86976","first_name":"MIKE","last_name":"BOUVIER","classification":"C","division":"LIMITED","hit_factor":4.2623},{"match_name":"Gem City Gun Club 1-04 and 1-05 2020","match_date":"2020-01-04","stage_classifiercode":"13-01","member_number":"A43232","first_name":"VAUGHN","last_name":"PLATT","classification":"B","division":"LIMITED","hit_factor":4.2623},{"match_name":"EAPS September 2016 USPSA","match_date":"2016-09-18","stage_classifiercode":"13-01","member_number":"A92150","first_name":"JAMES","last_name":"NELSON","classification":"D","division":"LIMITED","hit_factor":4.2618},{"match_name":"YMM IPSC02 2017_10_08","match_date":"2017-10-08","stage_classifiercode":"13-01","member_number":"\"\"","first_name":"ZACH","last_name":"ACHZIGER","classification":"\"\"","division":"LIMITED","hit_factor":4.2588},{"match_name":"TASC 4-16-16 (15Apr16-10:27:18)","match_date":"2016-04-16","stage_classifiercode":"13-01","member_number":"A68217","first_name":"ART","last_name":"JENKINS","classification":"C","division":"LIMITED","hit_factor":4.2553},{"match_name":"Chattanooga Practical Shooting Association Monthly -USPSA  November 11th","match_date":"2018-11-11","stage_classifiercode":"13-01","member_number":"A114715","first_name":"BROOK","last_name":"WILLIS","classification":"D","division":"LIMITED","hit_factor":4.2553},{"match_name":"Idaho ISPS August 4th 2018","match_date":"2018-08-04","stage_classifiercode":"13-01","member_number":"TY99406","first_name":"RICK","last_name":"JUNGE","classification":"C","division":"LIMITED","hit_factor":4.2536},{"match_name":"PTPC February 4th Classifier Match","match_date":"2018-02-04","stage_classifiercode":"13-01","member_number":"A89602","first_name":"CHARLEY","last_name":"APPLE","classification":"B","division":"LIMITED","hit_factor":4.2531},{"match_name":"ORPCI 2016.03.19 Pistol","match_date":"2016-03-19","stage_classifiercode":"13-01","member_number":"A6528","first_name":"JERRY","last_name":"DILLARD","classification":"A","division":"LIMITED","hit_factor":4.2504},{"match_name":"MSSA USPSA June  10 2017","match_date":"2017-06-10","stage_classifiercode":"13-01","member_number":"A97297","first_name":"MATTHEW","last_name":"EATON","classification":"C","division":"LIMITED","hit_factor":4.2424},{"match_name":"Bills Gun Shop Circle Pines December 3 2017","match_date":"2017-12-03","stage_classifiercode":"13-01","member_number":"A100417","first_name":"ROBERT","last_name":"GALE","classification":"C","division":"LIMITED","hit_factor":4.2389},{"match_name":"Oakdale USPSA MN07 5-13-2021","match_date":"2021-05-13","stage_classifiercode":"13-01","member_number":"ty56844","first_name":"LES","last_name":"HAMMOND","classification":"B","division":"LIMITED","hit_factor":4.2365},{"match_name":"OPSC USPSA 7-10-2016","match_date":"2016-07-10","stage_classifiercode":"13-01","member_number":"A96701","first_name":"DOMINICK","last_name":"DIOMEDE","classification":"U","division":"LIMITED","hit_factor":4.2348},{"match_name":"SPSA USPSA August 4th Sat match","match_date":"2016-08-27","stage_classifiercode":"13-01","member_number":"TY88089","first_name":"DAVID","last_name":"BURTON","classification":"C","division":"LIMITED","hit_factor":4.2339},{"match_name":"PCWC USPSA  7 23 2016","match_date":"2016-07-23","stage_classifiercode":"13-01","member_number":"A87132","first_name":"ANTHONY","last_name":"BICHLER","classification":"C","division":"LIMITED","hit_factor":4.2333},{"match_name":"Woodland Heights Practical Shooters USPSA Match 9-20","match_date":"2020-09-20","stage_classifiercode":"13-01","member_number":"Ty113324","first_name":"BRIAN","last_name":"HIBBS","classification":"C","division":"LIMITED","hit_factor":4.2328},{"match_name":"SPSA USPSA August 4th Sat match","match_date":"2016-08-27","stage_classifiercode":"13-01","member_number":"A82536","first_name":"BRAD","last_name":"BANKS","classification":"C","division":"LIMITED","hit_factor":4.2316},{"match_name":"Brazosland Pistoleros January 17 2016--USPSA","match_date":"2016-01-17","stage_classifiercode":"13-01","member_number":"\"\"","first_name":"JUSTIN","last_name":"GOR","classification":"U","division":"LIMITED","hit_factor":4.2316},{"match_name":"Richmond Hot Shots November 17-18 USPSA Pistol Match","match_date":"2018-11-17","stage_classifiercode":"13-01","member_number":"TY79457","first_name":"LARRY","last_name":"MODELL","classification":"U","division":"LIMITED","hit_factor":4.2291},{"match_name":"PCWC USPSA  9 22 2018","match_date":"2018-09-22","stage_classifiercode":"13-01","member_number":"A84860","first_name":"MATT","last_name":"MAINWARING","classification":"C","division":"LIMITED","hit_factor":4.2291},{"match_name":"The Range at Austin USPSA MAR2020","match_date":"2020-03-12","stage_classifiercode":"13-01","member_number":"TY123097","first_name":"ROD","last_name":"NAPIER","classification":"U","division":"LIMITED","hit_factor":4.2291},{"match_name":"COPS Jan 2016 USPSA Match","match_date":"2016-01-03","stage_classifiercode":"13-01","member_number":"TY70323","first_name":"LEE","last_name":"SUTTON","classification":"C","division":"LIMITED","hit_factor":4.2267},{"match_name":"MS06 Team Magnolia July 2017 USPSA Match","match_date":"2017-07-01","stage_classifiercode":"13-01","member_number":"A78185","first_name":"DREW","last_name":"HOLLIS","classification":"B","division":"LIMITED","hit_factor":4.2254},{"match_name":"DAPS USPSA at ETTS 4-8-2017","match_date":"2017-04-08","stage_classifiercode":"13-01","member_number":"TY69644","first_name":"CHRIS","last_name":"ALCEDO","classification":"C","division":"LIMITED","hit_factor":4.2254},{"match_name":"HRC December 2015","match_date":"2015-12-06","stage_classifiercode":"13-01","member_number":"A84948","first_name":"ANDREW","last_name":"HOLBROOK","classification":"U","division":"LIMITED","hit_factor":4.2254},{"match_name":"EASTER EGG HUNT AREA 59  ALL CLASSFIER MATCH","match_date":"2017-04-15","stage_classifiercode":"13-01","member_number":"TY89028","first_name":"HUNG","last_name":"TA","classification":"U","division":"LIMITED","hit_factor":4.2213},{"match_name":"BPSA January 2017 USPSA","match_date":"2017-01-22","stage_classifiercode":"13-01","member_number":"A99679","first_name":"ROBBIE","last_name":"LIGHTFOOT","classification":"U","division":"LIMITED","hit_factor":4.2186},{"match_name":"WTPS USPSA April Classifier Match 4-8-17","match_date":"2017-04-08","stage_classifiercode":"13-01","member_number":"A101995","first_name":"DAVID","last_name":"DUCKETT","classification":"U","division":"LIMITED","hit_factor":4.2174},{"match_name":"RMAP 3rd sunday August 2017","match_date":"2017-08-20","stage_classifiercode":"13-01","member_number":"A74517","first_name":"CLIFF","last_name":"ROLLE","classification":"C","division":"LIMITED","hit_factor":4.2169},{"match_name":"Briar Rabbit April 2021","match_date":"2021-04-25","stage_classifiercode":"13-01","member_number":"TY113872","first_name":"LEVI","last_name":"ROCHE","classification":"U","division":"LIMITED","hit_factor":4.2163},{"match_name":"Hammer Down USPSA Tue Night","match_date":"2017-11-22","stage_classifiercode":"13-01","member_number":"A103823","first_name":"BARLOW","last_name":"HUMPHREY","classification":"C","division":"LIMITED","hit_factor":4.2155},{"match_name":"EAPS September 2016 USPSA","match_date":"2016-09-18","stage_classifiercode":"13-01","member_number":"A94097","first_name":"STEVEN","last_name":"TANNETTA","classification":"D","division":"LIMITED","hit_factor":4.2155},{"match_name":"RCSC USPSA 26 Feb 2017","match_date":"2017-02-26","stage_classifiercode":"13-01","member_number":"A44650","first_name":"DARRELL","last_name":"DAUDE","classification":"C","division":"LIMITED","hit_factor":4.2152},{"match_name":"IL 16 USPSA FEB 7 2016","match_date":"2016-02-07","stage_classifiercode":"13-01","member_number":"TY90994","first_name":"PAUL","last_name":"BENSON","classification":"C","division":"LIMITED","hit_factor":4.213},{"match_name":"Rio Salado UPPL May 2021","match_date":"2021-05-09","stage_classifiercode":"13-01","member_number":"A71332","first_name":"MIKE","last_name":"LARSON","classification":"C","division":"LIMITED","hit_factor":4.2082},{"match_name":"CGGR February USPSA Match","match_date":"2016-02-20","stage_classifiercode":"13-01","member_number":"TY77480","first_name":"GORDON","last_name":"SNADEN","classification":"B","division":"LIMITED","hit_factor":4.2071},{"match_name":"LTD Pistol - May 2017","match_date":"2017-05-06","stage_classifiercode":"13-01","member_number":"\"\"","first_name":"BRIAN","last_name":"LOWE","classification":"U","division":"LIMITED","hit_factor":4.2068},{"match_name":"MPSA 091617","match_date":"2017-09-16","stage_classifiercode":"13-01","member_number":"A60634","first_name":"MICHAEL","last_name":"SLAY","classification":"B","division":"LIMITED","hit_factor":4.2067},{"match_name":"USPSA MO21 2Alpha SBRC April 25 2020","match_date":"2020-04-25","stage_classifiercode":"13-01","member_number":"TY53943","first_name":"CHUCK","last_name":"DELANEY","classification":"","division":"LIMITED","hit_factor":4.205},{"match_name":"CCC Shooting Complex February 2017","match_date":"2017-02-05","stage_classifiercode":"13-01","member_number":"\"\"","first_name":"JUSTIN","last_name":"GOR","classification":"U","division":"LIMITED","hit_factor":4.2017},{"match_name":"Laser Ninja Dragon League July Special Classifier","match_date":"2018-07-01","stage_classifiercode":"13-01","member_number":"A110535","first_name":"HUNTER","last_name":"BARTLETT","classification":"U","division":"LIMITED","hit_factor":4.2017},{"match_name":"APSA October 2017 USPSA Match","match_date":"2017-10-14","stage_classifiercode":"13-01","member_number":"\"\"","first_name":"DARRELL","last_name":"BISHOP","classification":"U","division":"LIMITED","hit_factor":4.1991},{"match_name":"LCSA USPSA July","match_date":"2016-07-08","stage_classifiercode":"13-01","member_number":"a95589","first_name":"CARL","last_name":"MASON","classification":"U","division":"LIMITED","hit_factor":4.1989},{"match_name":"USPSA","match_date":"2020-02-02","stage_classifiercode":"13-01","member_number":"L1930","first_name":"MARK","last_name":"OTTO","classification":"B","division":"LIMITED","hit_factor":4.1985},{"match_name":"GWPP Pistol October 2016","match_date":"2016-10-07","stage_classifiercode":"13-01","member_number":"PEN","first_name":"CHRIS","last_name":"LINDER","classification":"U","division":"LIMITED","hit_factor":4.1985},{"match_name":"RangeMasters 6-30-2016","match_date":"2016-06-30","stage_classifiercode":"13-01","member_number":"\"\"","first_name":"JASON","last_name":"MITCHELL","classification":"B","division":"LIMITED","hit_factor":4.1973},{"match_name":"MCRC USPSA October 2018","match_date":"2018-10-13","stage_classifiercode":"13-01","member_number":"TY87087","first_name":"KENNETH","last_name":"GUPTON","classification":"C","division":"LIMITED","hit_factor":4.1948},{"match_name":"Minnetonka Game And Fish July 12","match_date":"2017-07-12","stage_classifiercode":"13-01","member_number":"A-26232","first_name":"JOHN","last_name":"BURNIECE","classification":"B","division":"LIMITED","hit_factor":4.1916},{"match_name":"Fairfax PS USPSA August 2018","match_date":"2018-08-21","stage_classifiercode":"13-01","member_number":"A30181","first_name":"JOE","last_name":"STAGNATO","classification":"B","division":"LIMITED","hit_factor":4.1906},{"match_name":"MVPSA Apr 72018","match_date":"2018-04-07","stage_classifiercode":"13-01","member_number":"A92726","first_name":"ADAM","last_name":"HILL","classification":"C","division":"LIMITED","hit_factor":4.1903},{"match_name":"GAS September 2020 USPSA","match_date":"2020-09-05","stage_classifiercode":"13-01","member_number":"A111357","first_name":"DALE","last_name":"COCHRELL","classification":"B","division":"LIMITED","hit_factor":4.1885},{"match_name":"INAS Jan 2018 USPSA AM","match_date":"2018-01-20","stage_classifiercode":"13-01","member_number":"FY78563","first_name":"BILLY","last_name":"MCLEMORE","classification":"U","division":"LIMITED","hit_factor":4.1856},{"match_name":"Flagstaff Fun Shoot March 25 2017","match_date":"2017-03-25","stage_classifiercode":"13-01","member_number":"L3215","first_name":"TOM","last_name":"CHESTERMAN","classification":"\"\"","division":"LIMITED","hit_factor":4.1828},{"match_name":"Hopkinton USPSA July 2018","match_date":"2018-07-07","stage_classifiercode":"13-01","member_number":"TY90354","first_name":"BRIAN","last_name":"HARRINGTON","classification":"A","division":"LIMITED","hit_factor":4.1812},{"match_name":"Bills Gun Shop Circle Pines December 3 2017","match_date":"2017-12-03","stage_classifiercode":"13-01","member_number":"TY91732","first_name":"WILLIAM","last_name":"HALL","classification":"C","division":"LIMITED","hit_factor":4.1803},{"match_name":"RCPS USPSA August 11","match_date":"2018-08-11","stage_classifiercode":"13-01","member_number":"\"\"","first_name":"MICHAEL","last_name":"PATTERSON","classification":"U","division":"LIMITED","hit_factor":4.1771},{"match_name":"BUAS November Match","match_date":"2018-11-04","stage_classifiercode":"13-01","member_number":"a598","first_name":"KENNETH","last_name":"RUEFFERT","classification":"A","division":"LIMITED","hit_factor":4.1769},{"match_name":"DSC September 2016","match_date":"2016-09-18","stage_classifiercode":"13-01","member_number":"A88910","first_name":"LITO","last_name":"JULIANO","classification":"C","division":"LIMITED","hit_factor":4.1761},{"match_name":"FAS  Sunday USPSA","match_date":"2018-11-04","stage_classifiercode":"13-01","member_number":"A99713","first_name":"AL","last_name":"MCCOOK","classification":"U","division":"LIMITED","hit_factor":4.175},{"match_name":"MPSA 2021-05-15","match_date":"2021-05-15","stage_classifiercode":"13-01","member_number":"a119434","first_name":"ANTHONY","last_name":"EVANS","classification":"C","division":"LIMITED","hit_factor":4.1718},{"match_name":"PCSI - August 2017 USPSA","match_date":"2017-08-05","stage_classifiercode":"13-01","member_number":"A57535","first_name":"JASON","last_name":"CONRAD","classification":"B","division":"LIMITED","hit_factor":4.1711},{"match_name":"LdF USPSA Match August 22 2020","match_date":"2020-08-22","stage_classifiercode":"13-01","member_number":"A86815","first_name":"TYLER","last_name":"IRWIN","classification":"C","division":"LIMITED","hit_factor":4.1711},{"match_name":"TGC USPSA September 2017","match_date":"2017-09-16","stage_classifiercode":"13-01","member_number":"0000000000","first_name":"WESLEY","last_name":"LUEG","classification":"B","division":"LIMITED","hit_factor":4.1704},{"match_name":"Griffin USPSA Match Oct 2017","match_date":"2017-10-21","stage_classifiercode":"13-01","member_number":"L1665","first_name":"HAROLD","last_name":"HAM","classification":"A","division":"LIMITED","hit_factor":4.1699},{"match_name":"ORPCI 2018.03.31 USPSA Special","match_date":"2018-03-31","stage_classifiercode":"13-01","member_number":"A110085","first_name":"MATT","last_name":"COOGLE","classification":"U","division":"LIMITED","hit_factor":4.1667},{"match_name":"CGGR February USPSA Match","match_date":"2016-02-20","stage_classifiercode":"13-01","member_number":"a87724","first_name":"TODD","last_name":"ADAMS","classification":"B","division":"LIMITED","hit_factor":4.1623},{"match_name":"FAS Special Saturday All Classifier Match","match_date":"2021-01-16","stage_classifiercode":"13-01","member_number":"TY88936","first_name":"ZACHARY","last_name":"WELLS","classification":"U","division":"LIMITED","hit_factor":4.1597},{"match_name":"WAC May 23rd (4th Sunday) - USPSA 6 Stage Match","match_date":"2021-05-23","stage_classifiercode":"13-01","member_number":"A89116","first_name":"GIANNA","last_name":"NUGUIT","classification":"B","division":"LIMITED","hit_factor":4.158},{"match_name":"EAPS September 2016 USPSA","match_date":"2016-09-18","stage_classifiercode":"13-01","member_number":"\"\"","first_name":"KEITH","last_name":"LEMOINE","classification":"C","division":"LIMITED","hit_factor":4.1578},{"match_name":"PCWC USPSA  9-25-2021","match_date":"2021-09-25","stage_classifiercode":"13-01","member_number":"Ty102619","first_name":"BRETT","last_name":"FERRIS","classification":"B","division":"LIMITED","hit_factor":4.1549},{"match_name":"LTD Pistol - May 2017","match_date":"2017-05-06","stage_classifiercode":"13-01","member_number":"TY99270","first_name":"TYLER","last_name":"ELLER","classification":"U","division":"LIMITED","hit_factor":4.1543},{"match_name":"Laser Ninja Dragon League MSA USPSA January 21st 2017","match_date":"2017-01-21","stage_classifiercode":"13-01","member_number":"A80743","first_name":"JERRY","last_name":"SAYSON","classification":"D","division":"LIMITED","hit_factor":4.1525},{"match_name":"PCWC USPSA  9-25-2021","match_date":"2021-09-25","stage_classifiercode":"13-01","member_number":"TY90697","first_name":"JACK","last_name":"MURRAY","classification":"C","division":"LIMITED","hit_factor":4.1494},{"match_name":"PTPC February 4th Classifier Match","match_date":"2018-02-04","stage_classifiercode":"13-01","member_number":"TY73422","first_name":"MIKE","last_name":"BRANDONISIO","classification":"C","division":"LIMITED","hit_factor":4.1494},{"match_name":"Tarheel USPSA July 2016","match_date":"2016-07-09","stage_classifiercode":"13-01","member_number":"A88807","first_name":"LUNCHBOX","last_name":"BECHTEL","classification":"U","division":"LIMITED","hit_factor":4.1485},{"match_name":"NRG Saturday January 13th - Includes a Classifier Stage","match_date":"2018-01-13","stage_classifiercode":"13-01","member_number":"FY84041","first_name":"JAY","last_name":"REBLANDO","classification":"C","division":"LIMITED","hit_factor":4.147},{"match_name":"Springfield Tactical Shooters 10/05/2017","match_date":"2017-10-05","stage_classifiercode":"13-01","member_number":"\"\"","first_name":"CHUCK","last_name":"MCLAUGHLIN","classification":"\"\"","division":"LIMITED","hit_factor":4.1451},{"match_name":"JCSSA OCT ","match_date":"2016-10-01","stage_classifiercode":"13-01","member_number":"A59968","first_name":"TIBOR","last_name":"KOVACS","classification":"B","division":"LIMITED","hit_factor":4.1451},{"match_name":"Laser Ninja Dragon League July Special Classifier","match_date":"2018-07-01","stage_classifiercode":"13-01","member_number":"A106099","first_name":"CHASE","last_name":"RAINS","classification":"U","division":"LIMITED","hit_factor":4.1444},{"match_name":"SEPSA June 2016","match_date":"2016-06-11","stage_classifiercode":"13-01","member_number":"A72887","first_name":"KEVIN","last_name":"MCDOWELL","classification":"B","division":"LIMITED","hit_factor":4.1405},{"match_name":"Benton Gun Club-USPSA May27 2018 CLASIFIER","match_date":"2018-05-27","stage_classifiercode":"13-01","member_number":"\"\"","first_name":"RICHARD","last_name":"WOMACK","classification":"U","division":"LIMITED","hit_factor":4.1392},{"match_name":"Crooked Creek Pistol League - July 2018","match_date":"2018-07-14","stage_classifiercode":"13-01","member_number":"A112294","first_name":"BEN","last_name":"DUBSKY","classification":"U","division":"LIMITED","hit_factor":4.1391},{"match_name":"PIPS 05-30-2018","match_date":"2018-05-29","stage_classifiercode":"13-01","member_number":"TY58623","first_name":"MATT","last_name":"WEAVER","classification":"D","division":"LIMITED","hit_factor":4.1379},{"match_name":"WSPS SEPTEMBER 2017 USPSA MATCH","match_date":"2017-09-16","stage_classifiercode":"13-01","member_number":"\"\"","first_name":"KEN","last_name":"STIRLING","classification":"U","division":"LIMITED","hit_factor":4.1374},{"match_name":"AIPS  USPSA Weekly 30 August 2016","match_date":"2016-08-30","stage_classifiercode":"13-01","member_number":"A81278","first_name":"DANIELLE","last_name":"EGANHOUSE-CLOE","classification":"D","division":"LIMITED","hit_factor":4.1368},{"match_name":"BRRC GAS USPSA MAY 12 2018","match_date":"2018-05-12","stage_classifiercode":"13-01","member_number":"A105478","first_name":"MARK","last_name":"GILLEY","classification":"D","division":"LIMITED","hit_factor":4.1322},{"match_name":"JPPS Club Match 9-8-18","match_date":"2018-09-08","stage_classifiercode":"13-01","member_number":"A16438","first_name":"BOB","last_name":"ROBERTSON","classification":"B","division":"LIMITED","hit_factor":4.1316},{"match_name":"GA Firing Line USPSA 2020-09-10  - Valid Times","match_date":"2020-09-10","stage_classifiercode":"13-01","member_number":"A115773","first_name":"ANDRE","last_name":"AVENA","classification":"U - Unclassified","division":"LIMITED","hit_factor":4.1298},{"match_name":"ENPS April USPSA Match","match_date":"2017-04-02","stage_classifiercode":"13-01","member_number":"TY44974","first_name":"RICHARD J","last_name":"SIMANDL","classification":"C","division":"LIMITED","hit_factor":4.1298},{"match_name":"DWB - Deadwood Boys USPSA 03 June 2018","match_date":"2018-06-03","stage_classifiercode":"13-01","member_number":"A102282","first_name":"DENNIS","last_name":"MANALO","classification":"D","division":"LIMITED","hit_factor":4.1298},{"match_name":"12a Fecha USPSA","match_date":"2017-11-12","stage_classifiercode":"13-01","member_number":"A90736","first_name":"LUIS","last_name":"SANTOS","classification":"C","division":"LIMITED","hit_factor":4.1288},{"match_name":"PBR USPSA Classifier Match","match_date":"2018-06-11","stage_classifiercode":"13-01","member_number":"A109144","first_name":"MARK","last_name":"SCHULTE","classification":"U","division":"LIMITED","hit_factor":4.1262},{"match_name":"Benton Gun Club-USPSA Classifier Match","match_date":"2016-04-10","stage_classifiercode":"13-01","member_number":"A82570","first_name":"LARRY","last_name":"VINT","classification":"U","division":"LIMITED","hit_factor":4.1257},{"match_name":"The Armory USPSA - OHN05 - 2017-03-11","match_date":"2017-03-11","stage_classifiercode":"13-01","member_number":"A83704","first_name":"D. SCOTT","last_name":"BEEBE","classification":"B","division":"LIMITED","hit_factor":4.1249},{"match_name":"NHRPC - August 2016 USPSA","match_date":"2016-08-14","stage_classifiercode":"13-01","member_number":"A53984","first_name":"RICK","last_name":"VAHALY","classification":"C","division":"LIMITED","hit_factor":4.1211},{"match_name":"Laser Ninja Dragon League July Special Classifier","match_date":"2018-07-01","stage_classifiercode":"13-01","member_number":"A104777","first_name":"RAY","last_name":"GALLARDO","classification":"U","division":"LIMITED","hit_factor":4.1206},{"match_name":"Morning SMPS 12 July 2020 USPSA Classifier Match","match_date":"2020-07-12","stage_classifiercode":"13-01","member_number":"L4636","first_name":"BARRON","last_name":"ROPER","classification":"C","division":"LIMITED","hit_factor":4.1204},{"match_name":"RCPS USPSA 9 Jan 2016 Special Classifier Match","match_date":"2016-01-09","stage_classifiercode":"13-01","member_number":"A90642","first_name":"JESSE","last_name":"CHALEUNPHONE","classification":"U","division":"LIMITED","hit_factor":4.1204},{"match_name":"Griffin USPSA Match Sep 17 2016","match_date":"2016-09-17","stage_classifiercode":"13-01","member_number":"L3316","first_name":"RONALD","last_name":"ADAMS","classification":"C","division":"LIMITED","hit_factor":4.1193},{"match_name":"APSC USPSA Match 08-04-18","match_date":"2018-08-04","stage_classifiercode":"13-01","member_number":"TY86863","first_name":"CINDI","last_name":"MARTIN","classification":"C","division":"LIMITED","hit_factor":4.1152},{"match_name":"BUAS November Match","match_date":"2018-11-04","stage_classifiercode":"13-01","member_number":"a70318","first_name":"JOSEPH","last_name":"DEMAGGIO","classification":"B","division":"LIMITED","hit_factor":4.1112},{"match_name":"TCGC Polo March 2016 Classifier Match","match_date":"2016-03-20","stage_classifiercode":"13-01","member_number":"TY85622","first_name":"KURT","last_name":"KOLDEN","classification":"U","division":"LIMITED","hit_factor":4.111},{"match_name":"SCCCApril2017","match_date":"2017-04-09","stage_classifiercode":"13-01","member_number":"A101596","first_name":"COREY","last_name":"TAYLOR","classification":"U","division":"LIMITED","hit_factor":4.1108},{"match_name":"Griffin USPSA Match Oct 2017","match_date":"2017-10-21","stage_classifiercode":"13-01","member_number":"A90202","first_name":"ROBERT","last_name":"BODRON","classification":"B","division":"LIMITED","hit_factor":4.1106},{"match_name":"PSAC 20210905","match_date":"2021-09-05","stage_classifiercode":"13-01","member_number":"Fy20707","first_name":"PAUL","last_name":"CLARK","classification":"C","division":"LIMITED","hit_factor":4.1045},{"match_name":"CFL07 WILLISTON PRACTICAL SHOOTERS","match_date":"2018-09-01","stage_classifiercode":"13-01","member_number":"FY49501","first_name":"PHILIP","last_name":"BRUCAT","classification":"B","division":"LIMITED","hit_factor":4.1002},{"match_name":"MVPSA June 2016 Points Match","match_date":"2016-06-04","stage_classifiercode":"13-01","member_number":"A90446","first_name":"CLAYTON","last_name":"BISHOP","classification":"C","division":"LIMITED","hit_factor":4.0998},{"match_name":"EAPS February 2018 USPSA","match_date":"2018-02-18","stage_classifiercode":"13-01","member_number":"A93349","first_name":"JONATHAN","last_name":"PARKER","classification":"C","division":"LIMITED","hit_factor":4.0984},{"match_name":"Palmetto Gun Club - January 2016 USPSA","match_date":"2016-01-02","stage_classifiercode":"13-01","member_number":"A67072","first_name":"BRUCE","last_name":"CYR","classification":"C","division":"LIMITED","hit_factor":4.0976},{"match_name":"HPSP Heartland Practical Shooters July USPSA Shoot","match_date":"2018-07-22","stage_classifiercode":"13-01","member_number":"ty68981","first_name":"JOEL","last_name":"LUDWIG","classification":"B","division":"LIMITED","hit_factor":4.0959},{"match_name":"Richmond Hot Shots Dec 2-3-2017 USPSA Pistol Match","match_date":"2017-12-02","stage_classifiercode":"13-01","member_number":"TY82728","first_name":"KIRILL","last_name":"FILIMONOV","classification":"B","division":"LIMITED","hit_factor":4.0943},{"match_name":"PCWC USPSA  7 23 2016","match_date":"2016-07-23","stage_classifiercode":"13-01","member_number":"FY28545","first_name":"GREG","last_name":"MORANDO","classification":"M","division":"LIMITED","hit_factor":4.0943},{"match_name":"Griffin USPSA Match Oct 2017","match_date":"2017-10-21","stage_classifiercode":"13-01","member_number":"A29593","first_name":"RICHARD","last_name":"SELLERS","classification":"B","division":"LIMITED","hit_factor":4.0889},{"match_name":"Lafayette Practical Shooters - THURS - Oct 7","match_date":"2021-10-07","stage_classifiercode":"13-01","member_number":"TY76050","first_name":"STEPHEN","last_name":"WILLIAMS","classification":"B","division":"LIMITED","hit_factor":4.0863},{"match_name":"SLOSA Feburary 2016 USPSA","match_date":"2016-02-13","stage_classifiercode":"13-01","member_number":"PEN","first_name":"BRIAN","last_name":"HERRIN","classification":"U","division":"LIMITED","hit_factor":4.0816},{"match_name":"SLPSA May USPSA Match","match_date":"2020-05-16","stage_classifiercode":"13-01","member_number":"TY43250","first_name":"DON","last_name":"ANDERSON","classification":"C","division":"LIMITED","hit_factor":4.08},{"match_name":"WAC May 23rd (4th Sunday) - USPSA 6 Stage Match","match_date":"2021-05-23","stage_classifiercode":"13-01","member_number":"A112897","first_name":"DARRELL","last_name":"DEWICK","classification":"D","division":"LIMITED","hit_factor":4.0782},{"match_name":"CGGR February USPSA Match","match_date":"2016-02-20","stage_classifiercode":"13-01","member_number":"A53524","first_name":"DAVE","last_name":"GRIFFITH","classification":"C","division":"LIMITED","hit_factor":4.0767},{"match_name":"Devil Dog USPSA Classifier Match-Saturday Session","match_date":"2018-03-10","stage_classifiercode":"13-01","member_number":"A109442","first_name":"AARON","last_name":"BYRD","classification":"\"\"","division":"LIMITED","hit_factor":4.0741},{"match_name":"DAPS USPSA at ETTS 4-8-2017","match_date":"2017-04-08","stage_classifiercode":"13-01","member_number":"PENDING","first_name":"BRET","last_name":"HART","classification":"U","division":"LIMITED","hit_factor":4.073},{"match_name":"SFA USPSA AUGUST 2018","match_date":"2018-08-18","stage_classifiercode":"13-01","member_number":"PENDING","first_name":"MATTHEW","last_name":"DURHAM","classification":"U - I don't know and don't care","division":"LIMITED","hit_factor":4.0724},{"match_name":"Rankin Field Sunday USPSA","match_date":"2018-06-17","stage_classifiercode":"13-01","member_number":"\"\"","first_name":"JEFFERSON","last_name":"CAMARCE","classification":"U","division":"LIMITED","hit_factor":4.0704},{"match_name":"DWB - Deadwood Boys USPSA February 4 2018","match_date":"2018-02-04","stage_classifiercode":"13-01","member_number":"A96882","first_name":"ROMMEL","last_name":"DEL ROSARIO","classification":"D","division":"LIMITED","hit_factor":4.0692},{"match_name":"1/8/17 GMPS","match_date":"2017-01-08","stage_classifiercode":"13-01","member_number":"TY62473","first_name":"JEFF","last_name":"LAFOND","classification":"C","division":"LIMITED","hit_factor":4.0672},{"match_name":"Rankin Field Sunday USPSA","match_date":"2018-09-16","stage_classifiercode":"13-01","member_number":"A105998","first_name":"TIM","last_name":"HARMENING","classification":"B","division":"LIMITED","hit_factor":4.0661},{"match_name":"MPSA 2021-05-15","match_date":"2021-05-15","stage_classifiercode":"13-01","member_number":"A132911","first_name":"JAY","last_name":"TYNES","classification":"U","division":"LIMITED","hit_factor":4.0658},{"match_name":"NOCPC Aug 2018","match_date":"2018-08-12","stage_classifiercode":"13-01","member_number":"A80566","first_name":"RISE","last_name":"FRITZ","classification":"C","division":"LIMITED","hit_factor":4.065},{"match_name":"PRG Pistol Match 5 Feb 2017","match_date":"2017-02-04","stage_classifiercode":"13-01","member_number":"A98783","first_name":"MIKE","last_name":"CHANG","classification":"U","division":"LIMITED","hit_factor":4.065},{"match_name":"PIPS 05-30-2018","match_date":"2018-05-29","stage_classifiercode":"13-01","member_number":"FY97194","first_name":"IAN","last_name":"ANDREWS","classification":"B","division":"LIMITED","hit_factor":4.0621},{"match_name":"TGC USPSA September 2017","match_date":"2017-09-16","stage_classifiercode":"13-01","member_number":"TY84373","first_name":"BRIAN","last_name":"LEVY","classification":"U","division":"LIMITED","hit_factor":4.0615},{"match_name":"ORPCI 2018.03.31 USPSA Special","match_date":"2018-03-31","stage_classifiercode":"13-01","member_number":"A104801","first_name":"AUSTIN","last_name":"ARNOLD","classification":"U","division":"LIMITED","hit_factor":4.0609},{"match_name":"OKCGC USPSA Dec 2017 Match","match_date":"2017-12-02","stage_classifiercode":"13-01","member_number":"A105403","first_name":"MICAH","last_name":"PUCKETT","classification":"U","division":"LIMITED","hit_factor":4.0609},{"match_name":"LCSA USPSA July","match_date":"2016-07-08","stage_classifiercode":"13-01","member_number":"fy39111","first_name":"OLIE","last_name":"ERICKSEN","classification":"B","division":"LIMITED","hit_factor":4.0598},{"match_name":"FAS  Sunday USPSA","match_date":"2018-11-04","stage_classifiercode":"13-01","member_number":"A115049","first_name":"CHRIS","last_name":"HODAL","classification":"U","division":"LIMITED","hit_factor":4.0562},{"match_name":"WTPS USPSA April Classifier Match 4-8-17","match_date":"2017-04-08","stage_classifiercode":"13-01","member_number":"A96244","first_name":"MARK","last_name":"SOUTHERLAND","classification":"U","division":"LIMITED","hit_factor":4.0541},{"match_name":"Crooked Creek Pistol League - July 2018","match_date":"2018-07-14","stage_classifiercode":"13-01","member_number":"A99060","first_name":"FRANK","last_name":"EIDENS","classification":"C","division":"LIMITED","hit_factor":4.0524},{"match_name":"USPSA MO21 2Alpha SBRC April 25 2020","match_date":"2020-04-25","stage_classifiercode":"13-01","member_number":"A107973","first_name":"GARY","last_name":"NEUBAUM","classification":"","division":"LIMITED","hit_factor":4.0516},{"match_name":"YMM IPSC02 2017_10_08","match_date":"2017-10-08","stage_classifiercode":"13-01","member_number":"A68844","first_name":"DONALD","last_name":"HONAKER","classification":"C","division":"LIMITED","hit_factor":4.0512},{"match_name":"BMPSA Apr 21 2018","match_date":"2018-04-21","stage_classifiercode":"13-01","member_number":"A110359","first_name":"DAVID","last_name":"SMITH","classification":"U","division":"LIMITED","hit_factor":4.051},{"match_name":"MRCPS USPSA Feb    2016","match_date":"2016-02-21","stage_classifiercode":"13-01","member_number":"A71578","first_name":"KEITH","last_name":"TSANG","classification":"B","division":"LIMITED","hit_factor":4.0486},{"match_name":"CCC Shooting Complex February 2017","match_date":"2017-02-05","stage_classifiercode":"13-01","member_number":"\"\"","first_name":"RICHARD","last_name":"ELMS","classification":"U","division":"LIMITED","hit_factor":4.0469},{"match_name":"Griffin USPSA Match Oct 2017","match_date":"2017-10-21","stage_classifiercode":"13-01","member_number":"A90100","first_name":"KAYLA","last_name":"BODRON","classification":"C","division":"LIMITED","hit_factor":4.0415},{"match_name":"FAS  Sunday USPSA","match_date":"2018-11-04","stage_classifiercode":"13-01","member_number":"A115045","first_name":"ANTHONY","last_name":"HORVATH","classification":"U","division":"LIMITED","hit_factor":4.0404},{"match_name":"CVSC 12-31-2017","match_date":"2017-12-31","stage_classifiercode":"13-01","member_number":"\"\"","first_name":"MIKE","last_name":"KING","classification":"\"\"","division":"LIMITED","hit_factor":4.0404},{"match_name":"Shongum February 2017 USPSA Match","match_date":"2017-02-04","stage_classifiercode":"13-01","member_number":"FY83386","first_name":"PAUL","last_name":"ZEBRO","classification":"B","division":"LIMITED","hit_factor":4.0394},{"match_name":"Blackstone Shooting Sports Snow Days January 2017 USPSA Level  1","match_date":"2017-01-08","stage_classifiercode":"13-01","member_number":"A88634","first_name":"KEN","last_name":"KILLI","classification":"B","division":"LIMITED","hit_factor":4.039},{"match_name":"CCC Shooting Complex September 2016","match_date":"2016-09-03","stage_classifiercode":"13-01","member_number":"\"\"","first_name":"KYLE","last_name":"CORCORAN","classification":"U","division":"LIMITED","hit_factor":4.038},{"match_name":"LTD Pistol - May 2017","match_date":"2017-05-06","stage_classifiercode":"13-01","member_number":"\"\"","first_name":"CAMERON","last_name":"BEVAN","classification":"U","division":"LIMITED","hit_factor":4.0348},{"match_name":"ACC Oct Saturday 24th USPSA","match_date":"2020-10-24","stage_classifiercode":"13-01","member_number":"A82359","first_name":"ANITA","last_name":"CORKWELL","classification":"D","division":"LIMITED","hit_factor":4.0302},{"match_name":"GA Firing Line USPSA 2020-09-10  - Valid Times","match_date":"2020-09-10","stage_classifiercode":"13-01","member_number":"A81601","first_name":"CARLTON","last_name":"JONES","classification":"A","division":"LIMITED","hit_factor":4.0288},{"match_name":"EAPS February 2018 USPSA","match_date":"2018-02-18","stage_classifiercode":"13-01","member_number":"TY63532","first_name":"GEORGE","last_name":"HEMSTAD","classification":"A","division":"LIMITED","hit_factor":4.0286},{"match_name":"PCWC USPSA  9 22 2018","match_date":"2018-09-22","stage_classifiercode":"13-01","member_number":"TY78922","first_name":"DON","last_name":"ADAM","classification":"B","division":"LIMITED","hit_factor":4.0284},{"match_name":"5 Dogs April 2017 USPSA","match_date":"2017-04-02","stage_classifiercode":"13-01","member_number":"A79733","first_name":"SCOTT","last_name":"MAWSON","classification":"A","division":"LIMITED","hit_factor":4.0278},{"match_name":"SLPSA May USPSA Match","match_date":"2020-05-16","stage_classifiercode":"13-01","member_number":"A109091","first_name":"MARK","last_name":"HOUSER","classification":"U","division":"LIMITED","hit_factor":4.0274},{"match_name":"CGGR February USPSA Match","match_date":"2016-02-20","stage_classifiercode":"13-01","member_number":"L729","first_name":"ROBERT","last_name":"WALKER","classification":"M","division":"LIMITED","hit_factor":4.0268},{"match_name":"Morning SMPS 12 July 2020 USPSA Classifier Match","match_date":"2020-07-12","stage_classifiercode":"13-01","member_number":"FY79231","first_name":"GREGORY","last_name":"BANTA","classification":"C","division":"LIMITED","hit_factor":4.0268},{"match_name":"8a Fecha USPSA Classifier","match_date":"2018-08-12","stage_classifiercode":"13-01","member_number":"A92051","first_name":"MARCO","last_name":"DOSAL-SANTINI","classification":"C","division":"LIMITED","hit_factor":4.0268},{"match_name":"8a Fecha USPSA Classifier","match_date":"2018-08-12","stage_classifiercode":"13-01","member_number":"TYF82011","first_name":"GUILLERMO","last_name":"TORRUELLA","classification":"C","division":"LIMITED","hit_factor":4.0254},{"match_name":"DSS - USPSA 18-03-24","match_date":"2018-03-24","stage_classifiercode":"13-01","member_number":"TY75791","first_name":"DAVID","last_name":"GALE","classification":"D","division":"LIMITED","hit_factor":4.0248},{"match_name":"Mvpsa April 2","match_date":"2016-04-02","stage_classifiercode":"13-01","member_number":"\"\"","first_name":"ROSS","last_name":"MASON","classification":"U","division":"LIMITED","hit_factor":4.0225},{"match_name":"Superior Practical Shooters - Let Freedom Ring","match_date":"2016-07-06","stage_classifiercode":"13-01","member_number":"A-95764","first_name":"DEAN","last_name":"L'HOSTE","classification":"A","division":"LIMITED","hit_factor":4.021},{"match_name":"North East Ohio Shooters - OHN06 - 2017-06-24","match_date":"2017-06-24","stage_classifiercode":"13-01","member_number":"\"\"","first_name":"JOSEPH","last_name":"GRENIG","classification":"X","division":"LIMITED","hit_factor":4.0183},{"match_name":"SLOSA Feburary 2016 USPSA","match_date":"2016-02-13","stage_classifiercode":"13-01","member_number":"\"\"","first_name":"LOYD","last_name":"WENZEL","classification":"U","division":"LIMITED","hit_factor":4.0152},{"match_name":"Rankin Field Sunday USPSA","match_date":"2018-06-17","stage_classifiercode":"13-01","member_number":"A111934","first_name":"JULLA","last_name":"BLAND","classification":"U","division":"LIMITED","hit_factor":4.0146},{"match_name":"FBURG March 2017 Level I USPSA ","match_date":"2017-03-04","stage_classifiercode":"13-01","member_number":"TY76339","first_name":"MATT","last_name":"SIMMONS","classification":"B","division":"LIMITED","hit_factor":4.0138},{"match_name":"TBAS USPSA Match 1/26/2020","match_date":"2020-01-26","stage_classifiercode":"13-01","member_number":"A101710","first_name":"SHAWN","last_name":"METZ","classification":"U","division":"LIMITED","hit_factor":4.0128},{"match_name":"MPSA 091617","match_date":"2017-09-16","stage_classifiercode":"13-01","member_number":"A99679","first_name":"ROBBIE","last_name":"LIGHTFOOT","classification":"C","division":"LIMITED","hit_factor":4.0128},{"match_name":"Lafayette Practical Shooters - CLASSIFIER MATCH - May 30-31","match_date":"2018-05-30","stage_classifiercode":"13-01","member_number":"A108820","first_name":"COLIN","last_name":"MONTGOMERY","classification":"D","division":"LIMITED","hit_factor":4.007},{"match_name":"2016-10 Bone Creek USPSA","match_date":"2016-10-02","stage_classifiercode":"13-01","member_number":"\"\"","first_name":"JON","last_name":"MAYFIELD","classification":"U","division":"LIMITED","hit_factor":4.0064},{"match_name":"Bitterroot Blasters March Club Match","match_date":"2016-03-26","stage_classifiercode":"13-01","member_number":"A81811","first_name":"ROBERT","last_name":"MOROZUMI","classification":"C","division":"LIMITED","hit_factor":4.006},{"match_name":"Triforce Practical Shooters at BigWoodsGoods 3-23-17","match_date":"2017-03-23","stage_classifiercode":"13-01","member_number":"\"\"","first_name":"ANTHONY JR","last_name":"BROWN","classification":"X","division":"LIMITED","hit_factor":4.0031},{"match_name":"Oakdale USPSA MN07 5-13-2021","match_date":"2021-05-13","stage_classifiercode":"13-01","member_number":"A57121","first_name":"JOE","last_name":"GRIFFIN","classification":"B","division":"LIMITED","hit_factor":3.9947},{"match_name":"WTPS USPSA April Classifier Match 4-8-17","match_date":"2017-04-08","stage_classifiercode":"13-01","member_number":"TY86524","first_name":"DOUG","last_name":"SMITH","classification":"B","division":"LIMITED","hit_factor":3.9903},{"match_name":"BORCC USPSA Classifier Match February 2017","match_date":"2017-02-11","stage_classifiercode":"13-01","member_number":"TY91447","first_name":"SAL","last_name":"LOMAGRO","classification":"D","division":"LIMITED","hit_factor":3.9874},{"match_name":"MPSA 091617","match_date":"2017-09-16","stage_classifiercode":"13-01","member_number":"FY39690","first_name":"MAC","last_name":"HART","classification":"B","division":"LIMITED","hit_factor":3.987},{"match_name":"NRG December 10th 2016","match_date":"2016-12-10","stage_classifiercode":"13-01","member_number":"L3692","first_name":"ANDREW","last_name":"CATBAGAN","classification":"A","division":"LIMITED","hit_factor":3.9863},{"match_name":"WTPS USPSA April Classifier Match 4-8-17","match_date":"2017-04-08","stage_classifiercode":"13-01","member_number":"A69018","first_name":"DARRYL","last_name":"BOKMAN","classification":"C","division":"LIMITED","hit_factor":3.9855},{"match_name":"NRG December 10th 2016","match_date":"2016-12-10","stage_classifiercode":"13-01","member_number":"L2720","first_name":"JOEL","last_name":"PLETE","classification":"B","division":"LIMITED","hit_factor":3.9847},{"match_name":"12a Fecha USPSA","match_date":"2017-11-12","stage_classifiercode":"13-01","member_number":"A101761","first_name":"GABRIEL","last_name":"FERNANDEZ","classification":"U","division":"LIMITED","hit_factor":3.9827},{"match_name":"WY02 GTS 5.5.18","match_date":"2018-05-05","stage_classifiercode":"13-01","member_number":"A106106","first_name":"JASON","last_name":"MAGNUSON","classification":"U","division":"LIMITED","hit_factor":3.981},{"match_name":"RCSC USPSA 26 Feb 2017","match_date":"2017-02-26","stage_classifiercode":"13-01","member_number":"A89916","first_name":"ROB","last_name":"PENDERGEST","classification":"U","division":"LIMITED","hit_factor":3.9807},{"match_name":"SFPC October Trophy match","match_date":"2016-10-02","stage_classifiercode":"13-01","member_number":"A84805","first_name":"ENRICO","last_name":"NUNEZ","classification":"C","division":"LIMITED","hit_factor":3.9791},{"match_name":"COPS Jan 2016 USPSA Match","match_date":"2016-01-03","stage_classifiercode":"13-01","member_number":"A91525","first_name":"MICHAEL","last_name":"HORNSEY","classification":"D","division":"LIMITED","hit_factor":3.9778},{"match_name":"17s PSC - USPSA - July 2020","match_date":"2020-07-18","stage_classifiercode":"13-01","member_number":"A114948","first_name":"AIR","last_name":"SOUKHAMNEUT","classification":"U","division":"LIMITED","hit_factor":3.9778},{"match_name":"RCSC USPSA 26 Feb 2017","match_date":"2017-02-26","stage_classifiercode":"13-01","member_number":"A79642","first_name":"SOPHIA","last_name":"PARAFINA","classification":"U","division":"LIMITED","hit_factor":3.9768},{"match_name":"JCSSA OCT ","match_date":"2016-10-01","stage_classifiercode":"13-01","member_number":"A43366","first_name":"TIM","last_name":"CAVAZOS","classification":"C","division":"LIMITED","hit_factor":3.9735},{"match_name":"Pioneer Action Shooters USPSA 5-23-21 Special Classifer","match_date":"2021-05-23","stage_classifiercode":"13-01","member_number":"A132334","first_name":"JOSE","last_name":"AINAGAS","classification":"U","division":"LIMITED","hit_factor":3.9735},{"match_name":"FBPPC NOVEMBER 2015","match_date":"2015-11-14","stage_classifiercode":"13-01","member_number":"A93228","first_name":"ROBERT","last_name":"WATSON","classification":"U","division":"LIMITED","hit_factor":3.9735},{"match_name":"WTPS USPSA April Classifier Match 4-8-17","match_date":"2017-04-08","stage_classifiercode":"13-01","member_number":"TY76134","first_name":"JOSH","last_name":"REID","classification":"M","division":"LIMITED","hit_factor":3.9726},{"match_name":"COPS Jan 2016 USPSA Match","match_date":"2016-01-03","stage_classifiercode":"13-01","member_number":"L3962","first_name":"JIM","last_name":"SHANAHAN","classification":"G","division":"LIMITED","hit_factor":3.9722},{"match_name":"UD MATCH  MAY 15 2016","match_date":"2016-05-15","stage_classifiercode":"13-01","member_number":"\"\"","first_name":"BEN","last_name":"BULLOCK","classification":"\"\"","division":"LIMITED","hit_factor":3.9677},{"match_name":"SLPSA Feb USPSA","match_date":"2018-02-17","stage_classifiercode":"13-01","member_number":"A99024","first_name":"FELIPE","last_name":"CERVANTES","classification":"C","division":"LIMITED","hit_factor":3.9672},{"match_name":"SLOSA January 2018 USPSA MATCH","match_date":"2018-01-13","stage_classifiercode":"13-01","member_number":"\"\"","first_name":"LOU","last_name":"SALSEDA","classification":"U","division":"LIMITED","hit_factor":3.964},{"match_name":"UD MATCH  MAY 15 2016","match_date":"2016-05-15","stage_classifiercode":"13-01","member_number":"PENDING","first_name":"GORDON","last_name":"LANE","classification":"U","division":"LIMITED","hit_factor":3.9637},{"match_name":"Patriot Action Shooters December 2015 Match","match_date":"2015-12-19","stage_classifiercode":"13-01","member_number":"A80211","first_name":"TY","last_name":"MOYERS","classification":"C","division":"LIMITED","hit_factor":3.9634},{"match_name":"Griffin USPSA Match Sep 17 2016","match_date":"2016-09-17","stage_classifiercode":"13-01","member_number":"ty76107","first_name":"GARY","last_name":"GOLDEN","classification":"B","division":"LIMITED","hit_factor":3.9593},{"match_name":"RDS November 2021 USPSA","match_date":"2021-11-06","stage_classifiercode":"13-01","member_number":"A-51402","first_name":"DOC (WAYNE)","last_name":"WELSHER","classification":"B","division":"LIMITED","hit_factor":3.9571},{"match_name":"Armory Indoor League","match_date":"2017-08-17","stage_classifiercode":"13-01","member_number":"A92624","first_name":"MATT","last_name":"LEVINER","classification":"D","division":"LIMITED","hit_factor":3.956},{"match_name":"HSA USPSA April 2021","match_date":"2021-04-06","stage_classifiercode":"13-01","member_number":"41482","first_name":"MICHAEL","last_name":"HESS","classification":"B","division":"LIMITED","hit_factor":3.956},{"match_name":"Richmond Boro Gun Club March USPSA Pistol Match","match_date":"2016-03-12","stage_classifiercode":"13-01","member_number":"A78252","first_name":"CHRISTOPHER","last_name":"WONG","classification":"B","division":"LIMITED","hit_factor":3.9548},{"match_name":"Lafayette Practical Shooters - WED-THUR - Dec 19-20 - CLASSIFIER MATCH","match_date":"2018-12-20","stage_classifiercode":"13-01","member_number":"A114785","first_name":"RONALD","last_name":"BRUNT","classification":"U","division":"LIMITED","hit_factor":3.9548},{"match_name":"SLPSA Feb USPSA","match_date":"2018-02-17","stage_classifiercode":"13-01","member_number":"\"\"","first_name":"JAMES","last_name":"GREENWOOD","classification":"U","division":"LIMITED","hit_factor":3.9519},{"match_name":"BRRC GAS USPSA MAY 12 2018","match_date":"2018-05-12","stage_classifiercode":"13-01","member_number":"TY79064","first_name":"SAM","last_name":"BLACK","classification":"B","division":"LIMITED","hit_factor":3.951},{"match_name":"Griffin USPSA Match Oct 2017","match_date":"2017-10-21","stage_classifiercode":"13-01","member_number":"\"\"","first_name":"JOHN","last_name":"KRAUSE","classification":"U","division":"LIMITED","hit_factor":3.9501},{"match_name":"WELD ECO09 20180617","match_date":"2018-06-17","stage_classifiercode":"13-01","member_number":"A94756","first_name":"PAUL","last_name":"HOUSER","classification":"B","division":"LIMITED","hit_factor":3.9488},{"match_name":"Rio Salado UPPL 2nd Sunday January 2020","match_date":"2020-01-11","stage_classifiercode":"13-01","member_number":"A47027","first_name":"JACK","last_name":"JOHNSTON","classification":"C","division":"LIMITED","hit_factor":3.9484},{"match_name":"LdF USPSA Match August 22 2020","match_date":"2020-08-22","stage_classifiercode":"13-01","member_number":"TY82338","first_name":"ALBERT","last_name":"WILLINGHAM","classification":"B","division":"LIMITED","hit_factor":3.9461},{"match_name":"Rio Salado UPPL 2nd Sunday January 2020","match_date":"2020-01-11","stage_classifiercode":"13-01","member_number":"TY65635","first_name":"CHRIS","last_name":"COLLINS","classification":"B","division":"LIMITED","hit_factor":3.946},{"match_name":"Hopkinton May 2018","match_date":"2018-05-05","stage_classifiercode":"13-01","member_number":"L4341","first_name":"MASON","last_name":"LANE","classification":"U","division":"LIMITED","hit_factor":3.9454},{"match_name":"BHPSC Monthly USPSA Indoor Match - Jan 2021","match_date":"2021-01-30","stage_classifiercode":"13-01","member_number":"A100139","first_name":"JON","last_name":"MAYFIELD","classification":"C","division":"LIMITED","hit_factor":3.9451},{"match_name":"FSA-USPSA-03-25-2018","match_date":"2018-03-25","stage_classifiercode":"13-01","member_number":"Ty20716","first_name":"JOE","last_name":"ANDERSON","classification":"C","division":"LIMITED","hit_factor":3.9419},{"match_name":"SCCCApril2017","match_date":"2017-04-09","stage_classifiercode":"13-01","member_number":"ty45633","first_name":"KEVIN","last_name":"HIGGINS","classification":"A","division":"LIMITED","hit_factor":3.9419},{"match_name":"RangeMasters 4-28-2014","match_date":"2016-04-28","stage_classifiercode":"13-01","member_number":"\"\"","first_name":"DAVID","last_name":"TOM","classification":"B","division":"LIMITED","hit_factor":3.9417},{"match_name":"Briar Rabbit April 2021","match_date":"2021-04-25","stage_classifiercode":"13-01","member_number":"A110232","first_name":"JAY","last_name":"COCHRAN","classification":"C","division":"LIMITED","hit_factor":3.9385},{"match_name":"WY02 GTS 5.5.18","match_date":"2018-05-05","stage_classifiercode":"13-01","member_number":"A87352","first_name":"WES","last_name":"BEER","classification":"U","division":"LIMITED","hit_factor":3.9352},{"match_name":"Springfield Tactical Shooters 10/05/2017","match_date":"2017-10-05","stage_classifiercode":"13-01","member_number":"A70754","first_name":"PATRICK","last_name":"KEEN","classification":"C","division":"LIMITED","hit_factor":3.9326},{"match_name":"Crooked Creek Pistol League - July 2018","match_date":"2018-07-14","stage_classifiercode":"13-01","member_number":"TY75791","first_name":"DAVID","last_name":"GALE","classification":"D","division":"LIMITED","hit_factor":3.931},{"match_name":"ORPCI 2016.03.19 Pistol","match_date":"2016-03-19","stage_classifiercode":"13-01","member_number":"\"\"","first_name":"DAREN","last_name":"THOMPSON","classification":"X","division":"LIMITED","hit_factor":3.9275},{"match_name":"Armory Indoor League","match_date":"2017-08-17","stage_classifiercode":"13-01","member_number":"\"\"","first_name":"TRAVIS","last_name":"HOWELLS","classification":"U","division":"LIMITED","hit_factor":3.9249},{"match_name":"CCC Shooting Complex September 2016","match_date":"2016-09-03","stage_classifiercode":"13-01","member_number":"\"\"","first_name":"ROGER","last_name":"LEE","classification":"U","division":"LIMITED","hit_factor":3.9191},{"match_name":"Rio Salado UPPL 2nd Sunday January 2020","match_date":"2020-01-11","stage_classifiercode":"13-01","member_number":"A102576","first_name":"MEL","last_name":"BEHNKE","classification":"C","division":"LIMITED","hit_factor":3.9186},{"match_name":"ISPS Nov 5th 2016","match_date":"2016-11-05","stage_classifiercode":"13-01","member_number":"A68393","first_name":"MATT","last_name":"EVANCIC","classification":"M","division":"LIMITED","hit_factor":3.9182},{"match_name":"PTPC February 4th Classifier Match","match_date":"2018-02-04","stage_classifiercode":"13-01","member_number":"A96712","first_name":"JEFF","last_name":"JOHNSON","classification":"C","division":"LIMITED","hit_factor":3.9177},{"match_name":"ORPCI 2016.03.19 Pistol","match_date":"2016-03-19","stage_classifiercode":"13-01","member_number":"\"\"","first_name":"GREG","last_name":"GABEL","classification":"\"\"","division":"LIMITED","hit_factor":3.9171},{"match_name":"TMGN December 2 USPSA Classifier Match","match_date":"2018-12-03","stage_classifiercode":"13-01","member_number":"L4555","first_name":"TIM","last_name":"STEDMAN","classification":"U","division":"LIMITED","hit_factor":3.915},{"match_name":"SFPC October Trophy match","match_date":"2016-10-02","stage_classifiercode":"13-01","member_number":"\"\"","first_name":"JOHN","last_name":"PERRY","classification":"U","division":"LIMITED","hit_factor":3.912},{"match_name":"GRB USPSA SEPTEMBER 2021 AT CAVALIER","match_date":"2021-09-18","stage_classifiercode":"13-01","member_number":"A82588","first_name":"JUDY","last_name":"MCFARLAND","classification":"C","division":"LIMITED","hit_factor":3.9116},{"match_name":"Benton Gun Club-USPSA Classifier Match","match_date":"2016-04-10","stage_classifiercode":"13-01","member_number":"\"\"","first_name":"DAVID","last_name":"BREWER","classification":"X","division":"LIMITED","hit_factor":3.9116},{"match_name":"Range54 USPSA","match_date":"2018-05-04","stage_classifiercode":"13-01","member_number":"a106540","first_name":"CAMERON","last_name":"CAHN","classification":"D","division":"LIMITED","hit_factor":3.9088},{"match_name":"Pinetucky USPSA 12-17-16","match_date":"2016-12-17","stage_classifiercode":"13-01","member_number":"A92315","first_name":"JEFFREY","last_name":"GARLINGTON","classification":"U","division":"LIMITED","hit_factor":3.9063},{"match_name":"MVPSA Apr 72018","match_date":"2018-04-07","stage_classifiercode":"13-01","member_number":"\"\"","first_name":"CLAY","last_name":"SMITH","classification":"U","division":"LIMITED","hit_factor":3.9057},{"match_name":"OKCGC USPSA Dec 2017 Match","match_date":"2017-12-02","stage_classifiercode":"13-01","member_number":"A99040","first_name":"KEVIN","last_name":"ODELL","classification":"C","division":"LIMITED","hit_factor":3.9054},{"match_name":"2da Copa Nacional USPSA ","match_date":"2016-05-22","stage_classifiercode":"13-01","member_number":"A88194","first_name":"HECTOR","last_name":"ROSARIO SERRANO","classification":"D","division":"LIMITED","hit_factor":3.9016},{"match_name":"AIPS Weekly USPSA 17 April 2018","match_date":"2018-04-17","stage_classifiercode":"13-01","member_number":"A105745","first_name":"RICK","last_name":"LARGESSE","classification":"U","division":"LIMITED","hit_factor":3.9},{"match_name":"GWPP April 2016 Pistol","match_date":"2016-04-09","stage_classifiercode":"13-01","member_number":"TY41987","first_name":"FRED","last_name":"CANNETA","classification":"B","division":"LIMITED","hit_factor":3.8997},{"match_name":"8a Fecha USPSA Classifier","match_date":"2018-08-12","stage_classifiercode":"13-01","member_number":"A109072","first_name":"LUIS A.","last_name":"SIERRA-VALENTIN","classification":"U","division":"LIMITED","hit_factor":3.8983},{"match_name":"CVSC 12-31-2017","match_date":"2017-12-31","stage_classifiercode":"13-01","member_number":"A87403","first_name":"ROD","last_name":"PFITZER","classification":"C","division":"LIMITED","hit_factor":3.8947},{"match_name":"DAPS USPSA at ETTS 4-8-2017","match_date":"2017-04-08","stage_classifiercode":"13-01","member_number":"A59968","first_name":"TIBOR","last_name":"KOVACS","classification":"B","division":"LIMITED","hit_factor":3.8922},{"match_name":"BPSA January 2017 USPSA","match_date":"2017-01-22","stage_classifiercode":"13-01","member_number":"\"\"","first_name":"JAY","last_name":"MERRITT","classification":"U","division":"LIMITED","hit_factor":3.8917},{"match_name":"2018-08-04 USPSA at Phoenix Rod and Gun Club","match_date":"2018-08-04","stage_classifiercode":"13-01","member_number":"\"\"","first_name":"SCOTT","last_name":"BONOMO","classification":"B","division":"LIMITED","hit_factor":3.8905},{"match_name":"Alpha Mike June 2016","match_date":"2016-06-19","stage_classifiercode":"13-01","member_number":"A92042","first_name":"JOSEPHINE","last_name":"BEDNAREK","classification":"U","division":"LIMITED","hit_factor":3.8884},{"match_name":"8a Fecha USPSA Classifier","match_date":"2018-08-12","stage_classifiercode":"13-01","member_number":"\"\"","first_name":"VICTOR","last_name":"PLAZA-RODRIGUEZ","classification":"U","division":"LIMITED","hit_factor":3.8869},{"match_name":"SLOSA Feburary 2016 USPSA","match_date":"2016-02-13","stage_classifiercode":"13-01","member_number":"TY87404","first_name":"MARIO","last_name":"RODRIGUEZ","classification":"C","division":"LIMITED","hit_factor":3.8866},{"match_name":"NRG Saturday January 13th - Includes a Classifier Stage","match_date":"2018-01-13","stage_classifiercode":"13-01","member_number":"TY105936","first_name":"CHENHAN","last_name":"ZHAO","classification":"U","division":"LIMITED","hit_factor":3.8851},{"match_name":"PIPS 05-30-2018","match_date":"2018-05-29","stage_classifiercode":"13-01","member_number":"TY92852","first_name":"DAN","last_name":"LINDAHL","classification":"B","division":"LIMITED","hit_factor":3.8822},{"match_name":"Renton USPSA May 2018 - NW05","match_date":"2018-05-27","stage_classifiercode":"13-01","member_number":"A110310","first_name":"JONATHAN","last_name":"NELSON","classification":"U","division":"LIMITED","hit_factor":3.8804},{"match_name":"Afternoon SMPS 12 July 2020 USPSA Classifier Match","match_date":"2020-07-12","stage_classifiercode":"13-01","member_number":"TY37097","first_name":"TIM","last_name":"DUEHRING","classification":"B","division":"LIMITED","hit_factor":3.8793},{"match_name":"INAS Dec 2016 USPSA","match_date":"2016-12-17","stage_classifiercode":"13-01","member_number":"A93183","first_name":"ANDREW","last_name":"ZIMMER","classification":"U","division":"LIMITED","hit_factor":3.8781},{"match_name":"MS06 Team Magnolia July 2017 USPSA Match","match_date":"2017-07-01","stage_classifiercode":"13-01","member_number":"TY74425","first_name":"BILL","last_name":"OGLETREE","classification":"B","division":"LIMITED","hit_factor":3.8778},{"match_name":"DAPS USPSA at ETTS 4-8-2017","match_date":"2017-04-08","stage_classifiercode":"13-01","member_number":"A71960","first_name":"ROBERT","last_name":"QUINN","classification":"B","division":"LIMITED","hit_factor":3.8776},{"match_name":"APSC USPSA Match 08-04-18","match_date":"2018-08-04","stage_classifiercode":"13-01","member_number":"\"\"","first_name":"JOSIAH","last_name":"BENNETT","classification":"U","division":"LIMITED","hit_factor":3.876},{"match_name":"Clairton Apr 09; 2017","match_date":"2017-04-09","stage_classifiercode":"13-01","member_number":"a93386","first_name":"RYAN","last_name":"SHEWCHUK","classification":"C","division":"LIMITED","hit_factor":3.8732},{"match_name":"SRAPS Amarillo Action July","match_date":"2016-07-23","stage_classifiercode":"13-01","member_number":"A89689","first_name":"TRENTON","last_name":"GRANT","classification":"U","division":"LIMITED","hit_factor":3.8702},{"match_name":"Brazosland Pistoleros August 20 2017","match_date":"2017-08-20","stage_classifiercode":"13-01","member_number":"A104118","first_name":"CHRISTOPHER","last_name":"BOATCALLIE","classification":"U","division":"LIMITED","hit_factor":3.8686},{"match_name":"RangeMasters 6-30-2016","match_date":"2016-06-30","stage_classifiercode":"13-01","member_number":"TY43045","first_name":"BOB","last_name":"ALLMAN","classification":"B","division":"LIMITED","hit_factor":3.8678},{"match_name":"Rankin Field Sunday USPSA","match_date":"2018-06-17","stage_classifiercode":"13-01","member_number":"A66993","first_name":"LAWNNA","last_name":"PORTER","classification":"C","division":"LIMITED","hit_factor":3.8662},{"match_name":"Morning SMPS 12 July 2020 USPSA Classifier Match","match_date":"2020-07-12","stage_classifiercode":"13-01","member_number":"FY66562","first_name":"JONATHAN","last_name":"MARUCUT","classification":"U","division":"LIMITED","hit_factor":3.8662},{"match_name":"Devil Dog USPSA Classifier Match-Saturday Session","match_date":"2018-03-10","stage_classifiercode":"13-01","member_number":"TY60329","first_name":"KELLY","last_name":"SNOW","classification":"A","division":"LIMITED","hit_factor":3.866},{"match_name":"Tarheel USPSA July 2016","match_date":"2016-07-09","stage_classifiercode":"13-01","member_number":"\"\"","first_name":"TJ","last_name":"READLING","classification":"U","division":"LIMITED","hit_factor":3.8647},{"match_name":"RDS Aug 52017 USPSA  Match","match_date":"2017-08-05","stage_classifiercode":"13-01","member_number":"A104239","first_name":"JASON","last_name":"QUALLS","classification":"U","division":"LIMITED","hit_factor":3.8638},{"match_name":"Pinetucky USPSA 12-17-16","match_date":"2016-12-17","stage_classifiercode":"13-01","member_number":"\"\"","first_name":"MARTIN","last_name":"MORRIS","classification":"U","division":"LIMITED","hit_factor":3.8636},{"match_name":"DSC September 2016","match_date":"2016-09-18","stage_classifiercode":"13-01","member_number":"A45073","first_name":"ARLAN","last_name":"TUSSING","classification":"B","division":"LIMITED","hit_factor":3.8627},{"match_name":"Trigger Guard USPSA","match_date":"2016-04-02","stage_classifiercode":"13-01","member_number":"L3354","first_name":"RYAN","last_name":"DOLL","classification":"C","division":"LIMITED","hit_factor":3.8622},{"match_name":"May 2018 at MPSA","match_date":"2018-05-27","stage_classifiercode":"13-01","member_number":"A109733","first_name":"FINN","last_name":"JOHANNESSEN","classification":"U","division":"LIMITED","hit_factor":3.8585},{"match_name":"FAS  Sunday USPSA","match_date":"2018-11-04","stage_classifiercode":"13-01","member_number":"\"\"","first_name":"ERIC","last_name":"NELSON","classification":"U","division":"LIMITED","hit_factor":3.8579},{"match_name":"Applied IN25 USPSA April Classifier 2018","match_date":"2018-04-17","stage_classifiercode":"13-01","member_number":"A107873","first_name":"CHRIS","last_name":"STEPHENS","classification":"D","division":"LIMITED","hit_factor":3.8567},{"match_name":"Coastal Area Practical Shooters 4-28-18","match_date":"2018-04-28","stage_classifiercode":"13-01","member_number":"A59004","first_name":"CARTER","last_name":"RAMSEY","classification":"C","division":"LIMITED","hit_factor":3.856},{"match_name":"NHRPC - August 2016 USPSA","match_date":"2016-08-14","stage_classifiercode":"13-01","member_number":"a76956","first_name":"KERRY","last_name":"WOODS","classification":"C","division":"LIMITED","hit_factor":3.8552},{"match_name":"CGGR February USPSA Match","match_date":"2016-02-20","stage_classifiercode":"13-01","member_number":"A81974","first_name":"JONATHAN","last_name":"GARCIA","classification":"B","division":"LIMITED","hit_factor":3.8497},{"match_name":"RCPS USPSA 9 Jan 2016 Special Classifier Match","match_date":"2016-01-09","stage_classifiercode":"13-01","member_number":"A87028","first_name":"MATTHEW","last_name":"SHERRILL","classification":"C","division":"LIMITED","hit_factor":3.8494},{"match_name":"Medford USPSA November 2017 Match","match_date":"2017-11-19","stage_classifiercode":"13-01","member_number":"Ty75560","first_name":"JOSH","last_name":"WESLEY","classification":"A","division":"LIMITED","hit_factor":3.8462},{"match_name":"Gem City Gun Club 1-04 and 1-05 2020","match_date":"2020-01-04","stage_classifiercode":"13-01","member_number":"A100346","first_name":"JAMES","last_name":"SINGER","classification":"C","division":"LIMITED","hit_factor":3.8462},{"match_name":"LCSA USPSA July","match_date":"2016-07-08","stage_classifiercode":"13-01","member_number":"\"\"","first_name":"BILL","last_name":"IGO","classification":"U","division":"LIMITED","hit_factor":3.8425},{"match_name":"JCSSA NOV 7 2020","match_date":"2020-11-07","stage_classifiercode":"13-01","member_number":"A78475","first_name":"JOHN","last_name":"SIMMONS","classification":"B","division":"LIMITED","hit_factor":3.8419},{"match_name":"Prescott 3rd Sunday USPSA 04-17-2016","match_date":"2016-04-17","stage_classifiercode":"13-01","member_number":"L1016","first_name":"ALLEN","last_name":"BAUDER","classification":"D","division":"LIMITED","hit_factor":3.8384},{"match_name":"SLPSA Feb USPSA","match_date":"2018-02-17","stage_classifiercode":"13-01","member_number":"TY72404","first_name":"DAVE","last_name":"MOORE","classification":"C","division":"LIMITED","hit_factor":3.8382},{"match_name":"NHRPC - October 2020 USPSA","match_date":"2020-10-10","stage_classifiercode":"13-01","member_number":"A73983","first_name":"ALEX","last_name":"MACFARLANE","classification":"C","division":"LIMITED","hit_factor":3.8373},{"match_name":"Laser Ninja Dragon League MSA USPSA January 21st 2017","match_date":"2017-01-21","stage_classifiercode":"13-01","member_number":"A-100365","first_name":"KLATE","last_name":"GRAHAM","classification":"U","division":"LIMITED","hit_factor":3.8361},{"match_name":"PSAC_20170527","match_date":"2017-05-27","stage_classifiercode":"13-01","member_number":"TY86616","first_name":"BILL","last_name":"WEEKS","classification":"B","division":"LIMITED","hit_factor":3.836},{"match_name":"RMAP 3rd sunday August 2017","match_date":"2017-08-20","stage_classifiercode":"13-01","member_number":"A103147","first_name":"DONN","last_name":"COOK","classification":"U","division":"LIMITED","hit_factor":3.8333},{"match_name":"HOPS USPSA 071517","match_date":"2017-07-15","stage_classifiercode":"13-01","member_number":"\"\"","first_name":"PAYTON","last_name":"BROWN","classification":"U","division":"LIMITED","hit_factor":3.8314},{"match_name":"Armory Indoor League","match_date":"2017-08-17","stage_classifiercode":"13-01","member_number":"A99024","first_name":"FELIPE","last_name":"CERVANTES","classification":"C","division":"LIMITED","hit_factor":3.8306},{"match_name":"Grandbaggers September 2017","match_date":"2017-09-07","stage_classifiercode":"13-01","member_number":"A99598","first_name":"MATT","last_name":"MCCALL","classification":"U","division":"LIMITED","hit_factor":3.8301},{"match_name":"OKCGC USPSA Dec 2017 Match","match_date":"2017-12-02","stage_classifiercode":"13-01","member_number":"\"\"","first_name":"MITCHELL","last_name":"GRAF","classification":"U","division":"LIMITED","hit_factor":3.8278},{"match_name":"GPSL 11-1-16","match_date":"2016-11-01","stage_classifiercode":"13-01","member_number":"TY76209","first_name":"LOUIS","last_name":"SAWYER","classification":"C","division":"LIMITED","hit_factor":3.8267},{"match_name":"CTASA 3rd Sunday USPSA at Triple C Tactical - 7-15-2018","match_date":"2018-07-15","stage_classifiercode":"13-01","member_number":"YT102469","first_name":"JOHN","last_name":"BAKER","classification":"U","division":"LIMITED","hit_factor":3.8263},{"match_name":"Crooked Creek Pistol League - July 2018","match_date":"2018-07-14","stage_classifiercode":"13-01","member_number":"A100346","first_name":"JAMES","last_name":"SINGER","classification":"C","division":"LIMITED","hit_factor":3.8251},{"match_name":"BAPS USPSA October","match_date":"2018-10-20","stage_classifiercode":"13-01","member_number":"PEN","first_name":"KYLE","last_name":"PARSONS","classification":"U","division":"LIMITED","hit_factor":3.8238},{"match_name":"MRCPS USPSA Feb    2016","match_date":"2016-02-21","stage_classifiercode":"13-01","member_number":"A91246","first_name":"JIM","last_name":"STEWARD","classification":"D","division":"LIMITED","hit_factor":3.8225},{"match_name":"YMM IPSC02 2017_10_08","match_date":"2017-10-08","stage_classifiercode":"13-01","member_number":"\"\"","first_name":"SEAN","last_name":"MONGEON","classification":"U","division":"LIMITED","hit_factor":3.8217},{"match_name":"DWB - Deadwood Boys USPSA February 4 2018","match_date":"2018-02-04","stage_classifiercode":"13-01","member_number":"TY103223","first_name":"LOUIS","last_name":"SALSEDA","classification":"U","division":"LIMITED","hit_factor":3.819},{"match_name":"MVPSA June 2016 Points Match","match_date":"2016-06-04","stage_classifiercode":"13-01","member_number":"A93448","first_name":"BOB","last_name":"BEER","classification":"U","division":"LIMITED","hit_factor":3.8179},{"match_name":"BPSA January 2017 USPSA","match_date":"2017-01-22","stage_classifiercode":"13-01","member_number":"A93349","first_name":"JONATHAN","last_name":"PARKER","classification":"U","division":"LIMITED","hit_factor":3.8176},{"match_name":"SLPSA Feb USPSA","match_date":"2018-02-17","stage_classifiercode":"13-01","member_number":"A99246","first_name":"ADAM","last_name":"RISER","classification":"U","division":"LIMITED","hit_factor":3.8168},{"match_name":"USPSA Bass River October 2017","match_date":"2017-10-01","stage_classifiercode":"13-01","member_number":"A83258","first_name":"JON","last_name":"GREENE","classification":"\"\"","division":"LIMITED","hit_factor":3.8153},{"match_name":"APSC USPSA Match 08-04-18","match_date":"2018-08-04","stage_classifiercode":"13-01","member_number":"\"\"","first_name":"GUANG ZHI","last_name":"CHEN","classification":"\"\"","division":"LIMITED","hit_factor":3.8125},{"match_name":"DSS - USPSA - 2020 Club Championship","match_date":"2020-08-08","stage_classifiercode":"13-01","member_number":"A115744","first_name":"STEPHEN","last_name":"CHAPMAN","classification":"U","division":"LIMITED","hit_factor":3.8095},{"match_name":"Trigger Guard USPSA","match_date":"2016-04-02","stage_classifiercode":"13-01","member_number":"A-94622","first_name":"CHAD","last_name":"GRAHAM","classification":"U","division":"LIMITED","hit_factor":3.8062},{"match_name":"PCWC USPSA  9-25-2021","match_date":"2021-09-25","stage_classifiercode":"13-01","member_number":"A134163","first_name":"JIM","last_name":"STEELE","classification":"C","division":"LIMITED","hit_factor":3.8018},{"match_name":"FSA-USPSA-12-03-2017","match_date":"2017-12-04","stage_classifiercode":"13-01","member_number":"\"\"","first_name":"MICHAEL","last_name":"DECOSTER","classification":"C","division":"LIMITED","hit_factor":3.8009},{"match_name":"MVPSA Apr 72018","match_date":"2018-04-07","stage_classifiercode":"13-01","member_number":"TY97549","first_name":"ERIC","last_name":"HERZOG","classification":"B","division":"LIMITED","hit_factor":3.8009},{"match_name":"Tarheel USPSA July 2016","match_date":"2016-07-09","stage_classifiercode":"13-01","member_number":"A91637","first_name":"FREDERIC","last_name":"DESCOUST","classification":"U","division":"LIMITED","hit_factor":3.8},{"match_name":"GRB USPSA SEPTEMBER 2021 AT CAVALIER","match_date":"2021-09-18","stage_classifiercode":"13-01","member_number":"TY83654","first_name":"JASON","last_name":"ROBERTS","classification":"M","division":"LIMITED","hit_factor":3.7994},{"match_name":"NRG Saturday July 22nd- Classifier","match_date":"2017-07-22","stage_classifiercode":"13-01","member_number":"TY98135","first_name":"PHILLIP","last_name":"HOANG","classification":"D","division":"LIMITED","hit_factor":3.7975},{"match_name":"TCSC USPSA Level I September club match","match_date":"2020-09-27","stage_classifiercode":"13-01","member_number":"A121008","first_name":"KYE","last_name":"STEPHENSON","classification":"\"\"","division":"LIMITED","hit_factor":3.7964},{"match_name":"SLPSA Feb USPSA","match_date":"2018-02-17","stage_classifiercode":"13-01","member_number":"A63952","first_name":"TIM","last_name":"ALLEN","classification":"B","division":"LIMITED","hit_factor":3.7946},{"match_name":"TMGN USPSA May 4th Pistol Match","match_date":"2017-05-04","stage_classifiercode":"13-01","member_number":"A98248","first_name":"ERIC","last_name":"WONG","classification":"U","division":"LIMITED","hit_factor":3.7934},{"match_name":"GWPP January 2021Pistol","match_date":"2021-01-09","stage_classifiercode":"13-01","member_number":"A78945","first_name":"GRANT","last_name":"MILLER","classification":"C","division":"LIMITED","hit_factor":3.7926},{"match_name":"TGC USPSA September 2017","match_date":"2017-09-16","stage_classifiercode":"13-01","member_number":"A83616","first_name":"LELAND","last_name":"JOHNSON","classification":"C","division":"LIMITED","hit_factor":3.7915},{"match_name":"ISPS Nov 5th 2016","match_date":"2016-11-05","stage_classifiercode":"13-01","member_number":"A42490","first_name":"MIKE","last_name":"MARTIN","classification":"C","division":"LIMITED","hit_factor":3.7915},{"match_name":"MVPSA Apr 72018","match_date":"2018-04-07","stage_classifiercode":"13-01","member_number":"A84593","first_name":"JESSE","last_name":"POSELEY","classification":"A","division":"LIMITED","hit_factor":3.7915},{"match_name":"Flagstaff Fun Shoot March 25 2017","match_date":"2017-03-25","stage_classifiercode":"13-01","member_number":"A-84474","first_name":"BOB","last_name":"WHEELER","classification":"\"\"","division":"LIMITED","hit_factor":3.7898},{"match_name":"FSA-USPSA-12-03-2017","match_date":"2017-12-04","stage_classifiercode":"13-01","member_number":"A92903","first_name":"PHILIP","last_name":"PLESETZ","classification":"C","division":"LIMITED","hit_factor":3.7893},{"match_name":"Hose Monster Fun","match_date":"2021-05-02","stage_classifiercode":"13-01","member_number":"a121056","first_name":"TOM","last_name":"BECK","classification":"C","division":"LIMITED","hit_factor":3.7879},{"match_name":"ISPS Nov 5th 2016","match_date":"2016-11-05","stage_classifiercode":"13-01","member_number":"TY91986","first_name":"TRAVIS","last_name":"DEMARAY","classification":"C","division":"LIMITED","hit_factor":3.7851},{"match_name":"Griffin USPSA Match Sep 17 2016","match_date":"2016-09-17","stage_classifiercode":"13-01","member_number":"A79470","first_name":"DAVID","last_name":"BUENGER","classification":"B","division":"LIMITED","hit_factor":3.7849},{"match_name":"Richmond Hot Shots November 17-18 USPSA Pistol Match","match_date":"2018-11-17","stage_classifiercode":"13-01","member_number":"A63407","first_name":"MORENO","last_name":"VILLANUEVA","classification":"B","division":"LIMITED","hit_factor":3.7838},{"match_name":"TCSC USPSA Level I September club match","match_date":"2020-09-27","stage_classifiercode":"13-01","member_number":"FY88229","first_name":"BEN","last_name":"FECK","classification":"B","division":"LIMITED","hit_factor":3.7791},{"match_name":"WSPS SEPTEMBER 2017 USPSA MATCH","match_date":"2017-09-16","stage_classifiercode":"13-01","member_number":"A99467","first_name":"JEN","last_name":"SANTO","classification":"U","division":"LIMITED","hit_factor":3.777},{"match_name":"Gem City Gun Club 1-04 and 1-05 2020","match_date":"2020-01-04","stage_classifiercode":"13-01","member_number":"A37872","first_name":"DAVE","last_name":"MOORE","classification":"C","division":"LIMITED","hit_factor":3.777},{"match_name":"1/8/17 GMPS","match_date":"2017-01-08","stage_classifiercode":"13-01","member_number":"L531","first_name":"JOHN","last_name":"BOWLES","classification":"B","division":"LIMITED","hit_factor":3.7736},{"match_name":"SLOSA Feburary 2016 USPSA","match_date":"2016-02-13","stage_classifiercode":"13-01","member_number":"A69506","first_name":"CHRIS","last_name":"BAKER","classification":"C","division":"LIMITED","hit_factor":3.7736},{"match_name":"Alpha Mike June 2016","match_date":"2016-06-19","stage_classifiercode":"13-01","member_number":"A67583","first_name":"JOHN","last_name":"HARRIS","classification":"C","division":"LIMITED","hit_factor":3.771},{"match_name":"EAPS  January 2016","match_date":"2016-01-17","stage_classifiercode":"13-01","member_number":"A92150","first_name":"JAMES","last_name":"NELSON","classification":"U","division":"LIMITED","hit_factor":3.7708},{"match_name":"ACC Oct Saturday 24th USPSA","match_date":"2020-10-24","stage_classifiercode":"13-01","member_number":"A117291","first_name":"DEAN","last_name":"MAKISHIMA","classification":"C","division":"LIMITED","hit_factor":3.7694},{"match_name":"2da Copa Nacional USPSA ","match_date":"2016-05-22","stage_classifiercode":"13-01","member_number":"F93563","first_name":"JORGE L.","last_name":"ENCARNACIN","classification":"D","division":"LIMITED","hit_factor":3.7679},{"match_name":"New Holland USPSA - October 2016","match_date":"2016-10-09","stage_classifiercode":"13-01","member_number":"TY97945","first_name":"SPENCER","last_name":"GAMBLE","classification":"C","division":"LIMITED","hit_factor":3.7671},{"match_name":"TGC USPSA September 2017","match_date":"2017-09-16","stage_classifiercode":"13-01","member_number":"TY34722","first_name":"LARRY","last_name":"SELLERS","classification":"M","division":"LIMITED","hit_factor":3.7657},{"match_name":"Applied IN25 USPSA April Classifier 2018","match_date":"2018-04-17","stage_classifiercode":"13-01","member_number":"TY101667","first_name":"KIRYL","last_name":"DATSENKA","classification":"D","division":"LIMITED","hit_factor":3.7627},{"match_name":"NRG December 10th 2016","match_date":"2016-12-10","stage_classifiercode":"13-01","member_number":"A99659","first_name":"BYRON","last_name":"RODGERS","classification":"U","division":"LIMITED","hit_factor":3.7627},{"match_name":"Fairfax PS USPSA August 2018","match_date":"2018-08-21","stage_classifiercode":"13-01","member_number":"a102413","first_name":"MARK","last_name":"NEEBE","classification":"A","division":"LIMITED","hit_factor":3.7618},{"match_name":"SUPS USPSA 5/7/2016","match_date":"2016-05-07","stage_classifiercode":"13-01","member_number":"A83026","first_name":"DAVE","last_name":"BARTON","classification":"C","division":"LIMITED","hit_factor":3.7615},{"match_name":"ORPCI 2016.03.19 Pistol","match_date":"2016-03-19","stage_classifiercode":"13-01","member_number":"A72788","first_name":"RANDY","last_name":"KING","classification":"C","division":"LIMITED","hit_factor":3.7604},{"match_name":"PCWC USPSA  9 22 2018","match_date":"2018-09-22","stage_classifiercode":"13-01","member_number":"\"\"","first_name":"ZACH","last_name":"LOUDENBACK","classification":"U","division":"LIMITED","hit_factor":3.7601},{"match_name":"PSAC_20170527","match_date":"2017-05-27","stage_classifiercode":"13-01","member_number":"A79172","first_name":"TIM","last_name":"BARRY","classification":"C","division":"LIMITED","hit_factor":3.7578},{"match_name":"GWPP April 2016 Pistol","match_date":"2016-04-09","stage_classifiercode":"13-01","member_number":"A67872","first_name":"BOB","last_name":"ESTRADA","classification":"U","division":"LIMITED","hit_factor":3.7574},{"match_name":"SLPSA Feb USPSA","match_date":"2018-02-17","stage_classifiercode":"13-01","member_number":"TY43250","first_name":"DON","last_name":"ANDERSON","classification":"C","division":"LIMITED","hit_factor":3.7572},{"match_name":"NHRPC - August 2016 USPSA","match_date":"2016-08-14","stage_classifiercode":"13-01","member_number":"TY97945","first_name":"SPENCER","last_name":"GAMBLE","classification":"U","division":"LIMITED","hit_factor":3.7555},{"match_name":"PCSI March 2016 USPSA","match_date":"2016-03-05","stage_classifiercode":"13-01","member_number":"A85908","first_name":"BOB","last_name":"LAUER","classification":"none","division":"LIMITED","hit_factor":3.7543},{"match_name":"Prescott 3rd Sunday USPSA 04-17-2016","match_date":"2016-04-17","stage_classifiercode":"13-01","member_number":"L3214","first_name":"TOM","last_name":"CHESTERMAN","classification":"B","division":"LIMITED","hit_factor":3.7519},{"match_name":"BAPS USPSA October","match_date":"2018-10-20","stage_classifiercode":"13-01","member_number":"TY113089","first_name":"RONALD","last_name":"POTIER","classification":"U","division":"LIMITED","hit_factor":3.75},{"match_name":"Applied IN25 USPSA April Classifier 2018","match_date":"2018-04-17","stage_classifiercode":"13-01","member_number":"TY90126","first_name":"TOM","last_name":"BURZYNSKI","classification":"U","division":"LIMITED","hit_factor":3.75},{"match_name":"MCRC USPSA October 2018","match_date":"2018-10-13","stage_classifiercode":"13-01","member_number":"TY94159","first_name":"LINDEN","last_name":"BURNSTEIN","classification":"C","division":"LIMITED","hit_factor":3.749},{"match_name":"FSTC  12-17-17","match_date":"2017-12-17","stage_classifiercode":"13-01","member_number":"\"\"","first_name":"JOE","last_name":"KINNEY","classification":"U","division":"LIMITED","hit_factor":3.7487},{"match_name":"SPSA USPSA August 4th Sat match","match_date":"2016-08-27","stage_classifiercode":"13-01","member_number":"TY72553","first_name":"BRIAN","last_name":"DEMMA","classification":"B","division":"LIMITED","hit_factor":3.7485},{"match_name":"2020-11-15 - Osseo Gun Club USPSA","match_date":"2020-11-15","stage_classifiercode":"13-01","member_number":"TY59462","first_name":"RICHARD","last_name":"KAVANAGH","classification":"B","division":"LIMITED","hit_factor":3.7467},{"match_name":"Griffin USPSA Match Oct 2017","match_date":"2017-10-21","stage_classifiercode":"13-01","member_number":"PEN","first_name":"CRAIG","last_name":"HEISEY","classification":"U","division":"LIMITED","hit_factor":3.7464},{"match_name":"2016-10 Bone Creek USPSA","match_date":"2016-10-02","stage_classifiercode":"13-01","member_number":"A95318","first_name":"JOSEPH","last_name":"NEWCOMB","classification":"D","division":"LIMITED","hit_factor":3.7459},{"match_name":"SUPS USPSA 5/7/2016","match_date":"2016-05-07","stage_classifiercode":"13-01","member_number":"\"\"","first_name":"SPENCER","last_name":"FRANDSEN","classification":"\"\"","division":"LIMITED","hit_factor":3.7459},{"match_name":"RCPS USPSA 9 Jan 2016 Special Classifier Match","match_date":"2016-01-09","stage_classifiercode":"13-01","member_number":"A73717","first_name":"KEVIN","last_name":"KANGETER","classification":"B","division":"LIMITED","hit_factor":3.744},{"match_name":"ORPCI 2016.03.19 Pistol","match_date":"2016-03-19","stage_classifiercode":"13-01","member_number":"A38929","first_name":"JOHN","last_name":"WEDIG","classification":"B","division":"LIMITED","hit_factor":3.7412},{"match_name":"PCWC USPSA  9 22 2018","match_date":"2018-09-22","stage_classifiercode":"13-01","member_number":"ty63839","first_name":"BEN","last_name":"SMITH","classification":"C","division":"LIMITED","hit_factor":3.741},{"match_name":"8a Fecha USPSA Classifier","match_date":"2018-08-12","stage_classifiercode":"13-01","member_number":"A113494","first_name":"OMAR","last_name":"MORALES-RIVERA","classification":"U","division":"LIMITED","hit_factor":3.7383},{"match_name":"Tarheel USPSA July 2016","match_date":"2016-07-09","stage_classifiercode":"13-01","member_number":"\"\"","first_name":"TODD","last_name":"ADAMS","classification":"B","division":"LIMITED","hit_factor":3.7383},{"match_name":"ALL CLASSIFIER SUMMERSLAM  -  AREA 59 2018","match_date":"2018-06-30","stage_classifiercode":"13-01","member_number":"A109883","first_name":"ERIC","last_name":"ONISHI","classification":"U","division":"LIMITED","hit_factor":3.7344},{"match_name":"New Holland USPSA - October 2016","match_date":"2016-10-09","stage_classifiercode":"13-01","member_number":"A73983","first_name":"ALEXANDER","last_name":"MACFARLANE IV","classification":"C","division":"LIMITED","hit_factor":3.7307},{"match_name":"SLOSA January 2018 USPSA MATCH","match_date":"2018-01-13","stage_classifiercode":"13-01","member_number":"A89420","first_name":"WAYNE","last_name":"CHAPIN","classification":"U","division":"LIMITED","hit_factor":3.7279},{"match_name":"Tropang Vegas All Classifier Match","match_date":"2021-07-11","stage_classifiercode":"13-01","member_number":"A118747","first_name":"HUGO","last_name":"GUNZALEZ","classification":"Unclassified","division":"LIMITED","hit_factor":3.7223},{"match_name":"Lafayette Practical Shooters - CLASSIFIER MATCH - May 30-31","match_date":"2018-05-30","stage_classifiercode":"13-01","member_number":"A111853","first_name":"BRETT","last_name":"DAVIS","classification":"U","division":"LIMITED","hit_factor":3.7209},{"match_name":"SPSA USPSA August 4th Sat match","match_date":"2016-08-27","stage_classifiercode":"13-01","member_number":"TY39820","first_name":"MARK","last_name":"WAGNER","classification":"C","division":"LIMITED","hit_factor":3.7209},{"match_name":"NRG Saturday January 13th - Includes a Classifier Stage","match_date":"2018-01-13","stage_classifiercode":"13-01","member_number":"\"\"","first_name":"BING","last_name":"VILORIA","classification":"C","division":"LIMITED","hit_factor":3.7205},{"match_name":"Crooked Creek Pistol League - July 2018","match_date":"2018-07-14","stage_classifiercode":"13-01","member_number":"A97294","first_name":"EDWARD","last_name":"WAGNER","classification":"C","division":"LIMITED","hit_factor":3.7152},{"match_name":"MSSA USPSA June  10 2017","match_date":"2017-06-10","stage_classifiercode":"13-01","member_number":"\"\"","first_name":"FEDERICK","last_name":"MOSCON","classification":"\"\"","division":"LIMITED","hit_factor":3.7147},{"match_name":"Idaho ISPS August 4th 2018","match_date":"2018-08-04","stage_classifiercode":"13-01","member_number":"A98329","first_name":"TRESA","last_name":"WEAVER","classification":"B","division":"LIMITED","hit_factor":3.7123},{"match_name":"Pinetucky USPSA 12-17-16","match_date":"2016-12-17","stage_classifiercode":"13-01","member_number":"\"\"","first_name":"RONALD","last_name":"FRANKLIN","classification":"U","division":"LIMITED","hit_factor":3.7094},{"match_name":"Hopkinton May 2018","match_date":"2018-05-05","stage_classifiercode":"13-01","member_number":"L1571","first_name":"ROB","last_name":"BOUDRIE","classification":"A","division":"LIMITED","hit_factor":3.7087},{"match_name":"TBAS USPSA Match 1/26/2020","match_date":"2020-01-26","stage_classifiercode":"13-01","member_number":"A108997","first_name":"BRENT","last_name":"SMITH","classification":"C","division":"LIMITED","hit_factor":3.7073},{"match_name":"OPSC USPSA OCTOBER 2018","match_date":"2018-10-14","stage_classifiercode":"13-01","member_number":"\"\"","first_name":"JOHN","last_name":"BUCKLEY","classification":"U","division":"LIMITED","hit_factor":3.7068},{"match_name":"Tehama Shooters May 2020 USPSA","match_date":"2020-05-23","stage_classifiercode":"13-01","member_number":"A115589","first_name":"MONTY","last_name":"BAKER","classification":"C","division":"LIMITED","hit_factor":3.7037},{"match_name":"The Armory Indoor League","match_date":"2016-03-11","stage_classifiercode":"13-01","member_number":"\"\"","first_name":"TYLER","last_name":"THOMPSON","classification":"\"\"","division":"LIMITED","hit_factor":3.6987},{"match_name":"Eagle USPSA 03-29-2021","match_date":"2021-03-29","stage_classifiercode":"13-01","member_number":"A130055","first_name":"DAVID","last_name":"COLON","classification":"C","division":"LIMITED","hit_factor":3.6986},{"match_name":"OPSC USPSA 7-10-2016","match_date":"2016-07-10","stage_classifiercode":"13-01","member_number":"FY70698","first_name":"JASON","last_name":"CARILLO","classification":"M","division":"LIMITED","hit_factor":3.6982},{"match_name":"WPS USPSA  Classifier Match 2021","match_date":"2021-10-18","stage_classifiercode":"13-01","member_number":"TY101247","first_name":"PAUL","last_name":"SACCOCCIE","classification":"U","division":"LIMITED","hit_factor":3.6969},{"match_name":"OPSC USPSA 7-10-2016","match_date":"2016-07-10","stage_classifiercode":"13-01","member_number":"A45045","first_name":"CHRIS","last_name":"SEARS","classification":"C","division":"LIMITED","hit_factor":3.6955},{"match_name":"WELD ECO09 20180313","match_date":"2018-03-18","stage_classifiercode":"13-01","member_number":"A62630","first_name":"ROBERT","last_name":"OTIS","classification":"B","division":"LIMITED","hit_factor":3.6949},{"match_name":"Rio Salado UPPL 2nd Sunday January 2020","match_date":"2020-01-11","stage_classifiercode":"13-01","member_number":"A89241","first_name":"KENDALL","last_name":"ERETH","classification":"B","division":"LIMITED","hit_factor":3.6948},{"match_name":"CCC Shooting Complex February 2017","match_date":"2017-02-05","stage_classifiercode":"13-01","member_number":"TY63503","first_name":"CHARLES","last_name":"MORRIS","classification":"B","division":"LIMITED","hit_factor":3.6934},{"match_name":"TBAS USPSA Match 1/26/2020","match_date":"2020-01-26","stage_classifiercode":"13-01","member_number":"A113596","first_name":"PARKER","last_name":"RUBY","classification":"C","division":"LIMITED","hit_factor":3.6929},{"match_name":"TCSC USPSA Level I September club match","match_date":"2020-09-27","stage_classifiercode":"13-01","member_number":"A82072","first_name":"AL","last_name":"MONCH","classification":"M","division":"LIMITED","hit_factor":3.6923},{"match_name":"HOPS USPSA 071517","match_date":"2017-07-15","stage_classifiercode":"13-01","member_number":"A104525","first_name":"STEVE","last_name":"GROSHONG","classification":"U","division":"LIMITED","hit_factor":3.6923},{"match_name":"ENPS April USPSA Match","match_date":"2017-04-02","stage_classifiercode":"13-01","member_number":"NA","first_name":"PATRICK","last_name":"VOICHAHOSKE","classification":"U","division":"LIMITED","hit_factor":3.69},{"match_name":"Rio Salado UPPL May 2021","match_date":"2021-05-09","stage_classifiercode":"13-01","member_number":"A127938","first_name":"JEREMY","last_name":"EVANS","classification":"B","division":"LIMITED","hit_factor":3.69},{"match_name":"CVSC 12-31-2017","match_date":"2017-12-31","stage_classifiercode":"13-01","member_number":"A100105","first_name":"WADE","last_name":"KAMMER","classification":"C","division":"LIMITED","hit_factor":3.6889},{"match_name":"OPSC USPSA 7-10-2016","match_date":"2016-07-10","stage_classifiercode":"13-01","member_number":"\"\"","first_name":"JEFF","last_name":"GOODSPEED","classification":"X","division":"LIMITED","hit_factor":3.6889},{"match_name":"OKCGC USPSA Dec 2017 Match","match_date":"2017-12-02","stage_classifiercode":"13-01","member_number":"a61442","first_name":"SHANNON","last_name":"CONLEY","classification":"C","division":"LIMITED","hit_factor":3.6866},{"match_name":"MRCPS USPSA Feb    2016","match_date":"2016-02-21","stage_classifiercode":"13-01","member_number":"A88883","first_name":"RICK","last_name":"HUGGINS","classification":"C","division":"LIMITED","hit_factor":3.6853},{"match_name":"Alpha Mike June 2016","match_date":"2016-06-19","stage_classifiercode":"13-01","member_number":"\"\"","first_name":"JESSE","last_name":"FLORES","classification":"U","division":"LIMITED","hit_factor":3.6842},{"match_name":"FBURG March 2017 Level I USPSA ","match_date":"2017-03-04","stage_classifiercode":"13-01","member_number":"A95349","first_name":"NATHAN","last_name":"HEVNER","classification":"C","division":"LIMITED","hit_factor":3.6837},{"match_name":"Brazosland Pistoleros August 20 2017","match_date":"2017-08-20","stage_classifiercode":"13-01","member_number":"\"\"","first_name":"TAYLOR","last_name":"LATHAM","classification":"U","division":"LIMITED","hit_factor":3.683},{"match_name":"Bills Gun Shop Circle Pines December 3 2017","match_date":"2017-12-03","stage_classifiercode":"13-01","member_number":"L4043","first_name":"THOMAS","last_name":"KREBSBACH","classification":"B","division":"LIMITED","hit_factor":3.6827},{"match_name":"SCCCApril2017","match_date":"2017-04-09","stage_classifiercode":"13-01","member_number":"\"\"","first_name":"GREG","last_name":"NIEMAN","classification":"U","division":"LIMITED","hit_factor":3.6822},{"match_name":"Rankin Field Sunday USPSA","match_date":"2018-06-17","stage_classifiercode":"13-01","member_number":"A107307","first_name":"ALLAN","last_name":"ABREA","classification":"U","division":"LIMITED","hit_factor":3.6799},{"match_name":"NRG Saturday January 13th - Includes a Classifier Stage","match_date":"2018-01-13","stage_classifiercode":"13-01","member_number":"L2720","first_name":"JOEL","last_name":"PLETE","classification":"B","division":"LIMITED","hit_factor":3.676},{"match_name":"BUAS November Match","match_date":"2018-11-04","stage_classifiercode":"13-01","member_number":"ty106510","first_name":"TAYLOR","last_name":"THORNE","classification":"C","division":"LIMITED","hit_factor":3.6753},{"match_name":"Shasta Shooters 2018 June Special Classifier","match_date":"2018-06-09","stage_classifiercode":"13-01","member_number":"A30368","first_name":"WAYNE","last_name":"FACCA","classification":"B","division":"LIMITED","hit_factor":3.6747},{"match_name":"Range54 USPSA","match_date":"2018-05-04","stage_classifiercode":"13-01","member_number":"\"\"","first_name":"TODD","last_name":"HOPKINS","classification":"U","division":"LIMITED","hit_factor":3.6741},{"match_name":"BHPSC Monthly USPSA Indoor Match - Jan 2021","match_date":"2021-01-30","stage_classifiercode":"13-01","member_number":"A132228","first_name":"CHRISTIAN","last_name":"WAKIM","classification":"U","division":"LIMITED","hit_factor":3.6711},{"match_name":"MVPSA June 2016 Points Match","match_date":"2016-06-04","stage_classifiercode":"13-01","member_number":"\"\"","first_name":"ERIC","last_name":"HERZOG","classification":"U","division":"LIMITED","hit_factor":3.6697},{"match_name":"New Holland USPSA - October 2016","match_date":"2016-10-09","stage_classifiercode":"13-01","member_number":"A95308","first_name":"DAVID","last_name":"AZZOLI","classification":"U","division":"LIMITED","hit_factor":3.6641},{"match_name":"TGC USPSA September 2017","match_date":"2017-09-16","stage_classifiercode":"13-01","member_number":"A44650","first_name":"DARRELL","last_name":"DAUDE","classification":"C","division":"LIMITED","hit_factor":3.663},{"match_name":"Triforce Practical Shooters at BigWoodsGoods 3-23-17","match_date":"2017-03-23","stage_classifiercode":"13-01","member_number":"A96103","first_name":"MARK","last_name":"BUCHHEIT","classification":"C","division":"LIMITED","hit_factor":3.663},{"match_name":"ENPS April USPSA Match","match_date":"2017-04-02","stage_classifiercode":"13-01","member_number":"\"\"","first_name":"JAMES","last_name":"MCCOLOUGH","classification":"U","division":"LIMITED","hit_factor":3.6617},{"match_name":"Flagstaff Fun Shoot March 25 2017","match_date":"2017-03-25","stage_classifiercode":"13-01","member_number":"A-833733","first_name":"CRAIG","last_name":"MORGAN","classification":"\"\"","division":"LIMITED","hit_factor":3.6617},{"match_name":"GWPP April 2016 Pistol","match_date":"2016-04-09","stage_classifiercode":"13-01","member_number":"\"\"","first_name":"DAVE","last_name":"NORTON","classification":"U","division":"LIMITED","hit_factor":3.661},{"match_name":"Crooked Creek Pistol League - July 2018","match_date":"2018-07-14","stage_classifiercode":"13-01","member_number":"TY75791","first_name":"DAVID","last_name":"GALE","classification":"D","division":"LIMITED","hit_factor":3.6576},{"match_name":"ORPCI 2018.03.31 USPSA Special","match_date":"2018-03-31","stage_classifiercode":"13-01","member_number":"A105637","first_name":"DANIEL","last_name":"ROBERTS","classification":"U","division":"LIMITED","hit_factor":3.6561},{"match_name":"SLOSA Feburary 2016 USPSA","match_date":"2016-02-13","stage_classifiercode":"13-01","member_number":"Pen","first_name":"GAVIN","last_name":"PICKERING","classification":"X","division":"LIMITED","hit_factor":3.6525},{"match_name":"NRG Saturday January 13th - Includes a Classifier Stage","match_date":"2018-01-13","stage_classifiercode":"13-01","member_number":"A63645","first_name":"CHARLES","last_name":"YOUNG","classification":"C","division":"LIMITED","hit_factor":3.6496},{"match_name":"DAPS USPSA at ETTS 4-8-2017","match_date":"2017-04-08","stage_classifiercode":"13-01","member_number":"A93735","first_name":"DAVID","last_name":"CALHOUN","classification":"C","division":"LIMITED","hit_factor":3.6483},{"match_name":"Pioneer Action Shooters USPSA 5-23-21 Special Classifer","match_date":"2021-05-23","stage_classifiercode":"13-01","member_number":"FY111430","first_name":"SEAN","last_name":"MCCLURE","classification":"B","division":"LIMITED","hit_factor":3.6471},{"match_name":"ALL CLASSIFIER SUMMERSLAM  -  AREA 59 2018","match_date":"2018-06-30","stage_classifiercode":"13-01","member_number":"A106468","first_name":"ROBERT","last_name":"FRAZIER","classification":"U","division":"LIMITED","hit_factor":3.6458},{"match_name":"DWB - Deadwood Boys USPSA 03 June 2018","match_date":"2018-06-03","stage_classifiercode":"13-01","member_number":"TY109178","first_name":"CHARLIE","last_name":"HOPKINS","classification":"U","division":"LIMITED","hit_factor":3.6454},{"match_name":"PCWC USPSA  7 23 2016","match_date":"2016-07-23","stage_classifiercode":"13-01","member_number":"TY63926","first_name":"WYATT","last_name":"COLTRAIN","classification":"C","division":"LIMITED","hit_factor":3.645},{"match_name":"GRB USPSA SEPTEMBER 2021 AT CAVALIER","match_date":"2021-09-18","stage_classifiercode":"13-01","member_number":"A125316","first_name":"JOSHUA","last_name":"HARVEY","classification":"U","division":"LIMITED","hit_factor":3.642},{"match_name":"Rankin Field April (ALL CLASSIFIER) Saturday USPSA","match_date":"2021-04-03","stage_classifiercode":"13-01","member_number":"A107521","first_name":"MARK","last_name":"MELLO","classification":"U","division":"LIMITED","hit_factor":3.6395},{"match_name":"USPSA","match_date":"2020-02-02","stage_classifiercode":"13-01","member_number":"A124140","first_name":"JOSHUA","last_name":"BENWARE","classification":"U","division":"LIMITED","hit_factor":3.6394},{"match_name":"MPPL 20210703- Independence Match","match_date":"2021-07-03","stage_classifiercode":"13-01","member_number":"TY98810","first_name":"RICHARD","last_name":"WHITING","classification":"U","division":"LIMITED","hit_factor":3.6392},{"match_name":"Benton Gun Club-USPSA Classifier Match","match_date":"2016-04-10","stage_classifiercode":"13-01","member_number":"\"\"","first_name":"BRANDON","last_name":"DOSTERT","classification":"X","division":"LIMITED","hit_factor":3.6391},{"match_name":"Griffin USPSA Match Oct 2017","match_date":"2017-10-21","stage_classifiercode":"13-01","member_number":"\"\"","first_name":"DAVID","last_name":"LOCKHART","classification":"U","division":"LIMITED","hit_factor":3.639},{"match_name":"NRG Saturday July 22nd- Classifier","match_date":"2017-07-22","stage_classifiercode":"13-01","member_number":"A55599","first_name":"CHARLES","last_name":"DE SALME","classification":"M","division":"LIMITED","hit_factor":3.6388},{"match_name":"Red River Range October USPSA Level 1","match_date":"2021-10-27","stage_classifiercode":"13-01","member_number":"A137739","first_name":"JOHN","last_name":"GESN","classification":"U","division":"LIMITED","hit_factor":3.6383},{"match_name":"EAPS September 2016 USPSA","match_date":"2016-09-18","stage_classifiercode":"13-01","member_number":"TY39825","first_name":"BARBARA","last_name":"THIBODAUX","classification":"B","division":"LIMITED","hit_factor":3.6378},{"match_name":"Sharp Practical Shooters December USPSA Match","match_date":"2018-12-30","stage_classifiercode":"13-01","member_number":"\"\"","first_name":"PAT","last_name":"KRENTZ","classification":"B","division":"LIMITED","hit_factor":3.6364},{"match_name":"Richmond Hot Shots November 17-18 USPSA Pistol Match","match_date":"2018-11-17","stage_classifiercode":"13-01","member_number":"A107140","first_name":"ROWELL","last_name":"FERRER","classification":"C","division":"LIMITED","hit_factor":3.6329},{"match_name":"Hopkinton March Mini-Match","match_date":"2020-03-14","stage_classifiercode":"13-01","member_number":"L4262","first_name":"STEWART","last_name":"GINSBERG","classification":"C","division":"LIMITED","hit_factor":3.6322},{"match_name":"Devil Dog USPSA Classifier Match-Saturday Session","match_date":"2018-03-10","stage_classifiercode":"13-01","member_number":"A96425","first_name":"RUSTY","last_name":"THOMAS","classification":"C","division":"LIMITED","hit_factor":3.6298},{"match_name":"SLPSA Feb USPSA","match_date":"2018-02-17","stage_classifiercode":"13-01","member_number":"\"\"","first_name":"BRYCE","last_name":"KUSZMAUL","classification":"U","division":"LIMITED","hit_factor":3.6238},{"match_name":"Dubuque USPSA Aug 23 2018","match_date":"2018-08-20","stage_classifiercode":"13-01","member_number":"\"\"","first_name":"JOE","last_name":"PEACOCK","classification":"U","division":"LIMITED","hit_factor":3.6232},{"match_name":"SLPSA May USPSA Match","match_date":"2020-05-16","stage_classifiercode":"13-01","member_number":"A71332","first_name":"MIKE","last_name":"LARSON","classification":"C","division":"LIMITED","hit_factor":3.6209},{"match_name":"2da Copa Nacional USPSA ","match_date":"2016-05-22","stage_classifiercode":"13-01","member_number":"TY94373","first_name":"ROMN","last_name":"SIFUENTES PREZ","classification":"U","division":"LIMITED","hit_factor":3.6192},{"match_name":"NNRPA USPSA April 2021","match_date":"2021-04-24","stage_classifiercode":"13-01","member_number":"A83350","first_name":"MIKE","last_name":"JENNINGS","classification":"C","division":"LIMITED","hit_factor":3.619},{"match_name":"BRRC GAS USPSA MAY 12 2018","match_date":"2018-05-12","stage_classifiercode":"13-01","member_number":"A110144","first_name":"DOUGLAS","last_name":"DOWLING","classification":"U","division":"LIMITED","hit_factor":3.6189},{"match_name":"PCWC USPSA  7 23 2016","match_date":"2016-07-23","stage_classifiercode":"13-01","member_number":"TY39081","first_name":"ROB","last_name":"JESSEE","classification":"G","division":"LIMITED","hit_factor":3.6181},{"match_name":"NRG December 10th 2016","match_date":"2016-12-10","stage_classifiercode":"13-01","member_number":"FY53414","first_name":"LISA","last_name":"LEVIS","classification":"C","division":"LIMITED","hit_factor":3.6176},{"match_name":"Applied IN25 USPSA March classifier","match_date":"2017-03-21","stage_classifiercode":"13-01","member_number":"A-101691","first_name":"JEFFREY","last_name":"COOMER","classification":"U","division":"LIMITED","hit_factor":3.6153},{"match_name":"BRRC GAS USPSA MAY 12 2018","match_date":"2018-05-12","stage_classifiercode":"13-01","member_number":"A99557","first_name":"KIRK","last_name":"WRIGHT","classification":"C","division":"LIMITED","hit_factor":3.6133},{"match_name":"NAAS  11-18-2018","match_date":"2018-11-18","stage_classifiercode":"13-01","member_number":"A85054","first_name":"ROB","last_name":"CHAVOUS","classification":"U","division":"LIMITED","hit_factor":3.6127},{"match_name":"TGC USPSA September 2017","match_date":"2017-09-16","stage_classifiercode":"13-01","member_number":"TY83983","first_name":"CHUCK","last_name":"PARMENTER","classification":"D","division":"LIMITED","hit_factor":3.612},{"match_name":"Springfield Tactical Shooters 10/05/2017","match_date":"2017-10-05","stage_classifiercode":"13-01","member_number":"A99127","first_name":"STEVE","last_name":"FRAZIER","classification":"C","division":"LIMITED","hit_factor":3.6058},{"match_name":"DSC September 2016","match_date":"2016-09-18","stage_classifiercode":"13-01","member_number":"L3670","first_name":"DAN","last_name":"CLICK","classification":"B","division":"LIMITED","hit_factor":3.6048},{"match_name":"Maine Practical Shooters-December 2017","match_date":"2017-12-16","stage_classifiercode":"13-01","member_number":"\"\"","first_name":"DARREN","last_name":"PETTEGROW","classification":"\"\"","division":"LIMITED","hit_factor":3.6023},{"match_name":"PCWC USPSA  9 22 2018","match_date":"2018-09-22","stage_classifiercode":"13-01","member_number":"TY84726","first_name":"JIM","last_name":"HORNER","classification":"C","division":"LIMITED","hit_factor":3.6022},{"match_name":"LCSA USPSA July","match_date":"2016-07-08","stage_classifiercode":"13-01","member_number":"\"\"","first_name":"JACOB","last_name":"WILLSON","classification":"B","division":"LIMITED","hit_factor":3.5971},{"match_name":"EAPS  January 2016","match_date":"2016-01-17","stage_classifiercode":"13-01","member_number":"A75405","first_name":"DORLA","last_name":"PIZZOLATTO","classification":"D","division":"LIMITED","hit_factor":3.595},{"match_name":"CRGC USPSA Match 5-20-18","match_date":"2018-05-20","stage_classifiercode":"13-01","member_number":"A99785","first_name":"GLENN","last_name":"BEGLEY","classification":"\"\"","division":"LIMITED","hit_factor":3.5939},{"match_name":"RangeMasters 4-28-2014","match_date":"2016-04-28","stage_classifiercode":"13-01","member_number":"A87497","first_name":"ERIC","last_name":"CASTILLO","classification":"D","division":"LIMITED","hit_factor":3.5934},{"match_name":"Idaho ISPS August 4th 2018","match_date":"2018-08-04","stage_classifiercode":"13-01","member_number":"A103528","first_name":"MATTHEW","last_name":"FISHBACK","classification":"D","division":"LIMITED","hit_factor":3.5918},{"match_name":"CTASA 3rd Sunday USPSA at Triple C Tactical - 7-15-2018","match_date":"2018-07-15","stage_classifiercode":"13-01","member_number":"fy78664","first_name":"CHARLES","last_name":"SEXTON","classification":"C","division":"LIMITED","hit_factor":3.5915},{"match_name":"New Holland USPSA - October 2016","match_date":"2016-10-09","stage_classifiercode":"13-01","member_number":"A88049","first_name":"STEVE","last_name":"GIANACOPOULOS","classification":"C","division":"LIMITED","hit_factor":3.5909},{"match_name":"SLOSA Feburary 2016 USPSA","match_date":"2016-02-13","stage_classifiercode":"13-01","member_number":"A29360","first_name":"JIM","last_name":"DAVIS","classification":"A","division":"LIMITED","hit_factor":3.5883},{"match_name":"OKCGC USPSA Dec 2017 Match","match_date":"2017-12-02","stage_classifiercode":"13-01","member_number":"\"\"","first_name":"NELSON","last_name":"DOUGHERTY","classification":"X","division":"LIMITED","hit_factor":3.588},{"match_name":"SLOSA January 2018 USPSA MATCH","match_date":"2018-01-13","stage_classifiercode":"13-01","member_number":"A101938","first_name":"LOYD","last_name":"WENZEL","classification":"C","division":"LIMITED","hit_factor":3.5879},{"match_name":"Range54 USPSA Match","match_date":"2021-11-12","stage_classifiercode":"13-01","member_number":"A107583","first_name":"TODD","last_name":"REIFSCHNEIDER","classification":"C","division":"LIMITED","hit_factor":3.587},{"match_name":"PCWC USPSA  7 23 2016","match_date":"2016-07-23","stage_classifiercode":"13-01","member_number":"A90139","first_name":"GEORGE","last_name":"GOKING","classification":"\"\"","division":"LIMITED","hit_factor":3.5861},{"match_name":"PTPC February 4th Classifier Match","match_date":"2018-02-04","stage_classifiercode":"13-01","member_number":"TY65231","first_name":"ERIC","last_name":"GALE","classification":"B","division":"LIMITED","hit_factor":3.5827},{"match_name":"RCPS USPSA 9 Jan 2016 Special Classifier Match","match_date":"2016-01-09","stage_classifiercode":"13-01","member_number":"TY73907","first_name":"THOMAS","last_name":"MASSEY","classification":"C","division":"LIMITED","hit_factor":3.5821},{"match_name":"HRC December 2015","match_date":"2015-12-06","stage_classifiercode":"13-01","member_number":"\"\"","first_name":"CHRIS","last_name":"RAWSON","classification":"U","division":"LIMITED","hit_factor":3.5778},{"match_name":"ISPS January Impact","match_date":"2016-01-27","stage_classifiercode":"13-01","member_number":"L2813","first_name":"JOHN","last_name":"FISHBACK","classification":"B","division":"LIMITED","hit_factor":3.5748},{"match_name":"Richmond Hot Shots November 17-18 USPSA Pistol Match","match_date":"2018-11-17","stage_classifiercode":"13-01","member_number":"TY78995","first_name":"DONALD","last_name":"HAFICH","classification":"U","division":"LIMITED","hit_factor":3.5714},{"match_name":"PBR USPSA Classifier Match","match_date":"2018-06-11","stage_classifiercode":"13-01","member_number":"A-81356","first_name":"GARY","last_name":"PREZIOSI","classification":"U","division":"LIMITED","hit_factor":3.5714},{"match_name":"GWPP April 2016 Pistol","match_date":"2016-04-09","stage_classifiercode":"13-01","member_number":"TY39532","first_name":"NORM","last_name":"LEE","classification":"B","division":"LIMITED","hit_factor":3.5681},{"match_name":"CTASA 3rd Sunday USPSA at Triple C Tactical - 7-15-2018","match_date":"2018-07-15","stage_classifiercode":"13-01","member_number":"a109345","first_name":"CORY","last_name":"MATHIS","classification":"U","division":"LIMITED","hit_factor":3.5678},{"match_name":"GRPC USPSA SOME LIKE IT HOT","match_date":"2018-08-05","stage_classifiercode":"13-01","member_number":"A61861","first_name":"JASON","last_name":"BRINKLEY","classification":"G","division":"LIMITED","hit_factor":3.567},{"match_name":"RDS Aug 52017 USPSA  Match","match_date":"2017-08-05","stage_classifiercode":"13-01","member_number":"\"\"","first_name":"DICK","last_name":"CLARK","classification":"X","division":"LIMITED","hit_factor":3.5635},{"match_name":"Blackstone Shooting Sports Snow Days January 2017 USPSA Level  1","match_date":"2017-01-08","stage_classifiercode":"13-01","member_number":"A94200","first_name":"HAROLD","last_name":"PRESSLEY","classification":"U","division":"LIMITED","hit_factor":3.5623},{"match_name":"TASC 4-16-16 (15Apr16-10:27:18)","match_date":"2016-04-16","stage_classifiercode":"13-01","member_number":"a85939","first_name":"NUNEZ","last_name":"NILO","classification":"A","division":"LIMITED","hit_factor":3.5613},{"match_name":"PIPS 05-30-2018","match_date":"2018-05-29","stage_classifiercode":"13-01","member_number":"A102576","first_name":"MEL","last_name":"BEHNKE","classification":"C","division":"LIMITED","hit_factor":3.5605},{"match_name":"Clinton County USPSA","match_date":"2016-03-26","stage_classifiercode":"13-01","member_number":"\"\"","first_name":"JAMES","last_name":"WOODS","classification":"U","division":"LIMITED","hit_factor":3.5604},{"match_name":"Triforce Practical Shooters at BigWoodsGoods 3-23-17","match_date":"2017-03-23","stage_classifiercode":"13-01","member_number":"\"\"","first_name":"MICAH","last_name":"NEIDHART","classification":"U","division":"LIMITED","hit_factor":3.5599},{"match_name":"INAS Dec 2016 USPSA","match_date":"2016-12-17","stage_classifiercode":"13-01","member_number":"\"\"","first_name":"NATE","last_name":"HOEKSEMA","classification":"U","division":"LIMITED","hit_factor":3.5582},{"match_name":"PSAC_20170527","match_date":"2017-05-27","stage_classifiercode":"13-01","member_number":"A52572","first_name":"DAN","last_name":"TROXEL","classification":"C","division":"LIMITED","hit_factor":3.5577},{"match_name":"Mvpsa April 2","match_date":"2016-04-02","stage_classifiercode":"13-01","member_number":"A93448","first_name":"BOB","last_name":"BEER","classification":"U","division":"LIMITED","hit_factor":3.5576},{"match_name":"AIPS Weekly USPSA 17 April 2018","match_date":"2018-04-17","stage_classifiercode":"13-01","member_number":"TY98904","first_name":"VIKRAM","last_name":"NAVALE","classification":"D","division":"LIMITED","hit_factor":3.5563},{"match_name":"5 Dogs April 2017 USPSA","match_date":"2017-04-02","stage_classifiercode":"13-01","member_number":"A65481","first_name":"KEVIN","last_name":"DORAN","classification":"B","division":"LIMITED","hit_factor":3.5543},{"match_name":"DSC September 2016","match_date":"2016-09-18","stage_classifiercode":"13-01","member_number":"TY74524","first_name":"RENNY","last_name":"FRITZ","classification":"U","division":"LIMITED","hit_factor":3.5537},{"match_name":"EAPS February 2018 USPSA","match_date":"2018-02-18","stage_classifiercode":"13-01","member_number":"A108820","first_name":"COLIN","last_name":"MONTGOMERY","classification":"U","division":"LIMITED","hit_factor":3.5537},{"match_name":"Blackstone Shooting Sports Snow Days January 2017 USPSA Level  1","match_date":"2017-01-08","stage_classifiercode":"13-01","member_number":"A88693","first_name":"ANDY","last_name":"POTEAT","classification":"C","division":"LIMITED","hit_factor":3.5516},{"match_name":"TGC USPSA September 2017","match_date":"2017-09-16","stage_classifiercode":"13-01","member_number":"TY55289","first_name":"RON","last_name":"MODEQUILLO","classification":"X","division":"LIMITED","hit_factor":3.5514},{"match_name":"TBAS USPSA Match 1/26/2020","match_date":"2020-01-26","stage_classifiercode":"13-01","member_number":"A100877","first_name":"RORY","last_name":"MCBRIDE","classification":"C","division":"LIMITED","hit_factor":3.5497},{"match_name":"Red River Range October USPSA Level 1","match_date":"2021-10-27","stage_classifiercode":"13-01","member_number":"A137729","first_name":"MORVANT","last_name":"LANDON","classification":"C","division":"LIMITED","hit_factor":3.5497},{"match_name":"EIPS 6/4/2016","match_date":"2016-06-04","stage_classifiercode":"13-01","member_number":"\"\"","first_name":"ERIC","last_name":"CIZMADIA","classification":"\"\"","division":"LIMITED","hit_factor":3.5473},{"match_name":"DWB - Deadwood Boys USPSA 03 June 2018","match_date":"2018-06-03","stage_classifiercode":"13-01","member_number":"TY75469","first_name":"OSCAR","last_name":"ACENCIO","classification":"C","division":"LIMITED","hit_factor":3.5468},{"match_name":"MVPSA Apr 72018","match_date":"2018-04-07","stage_classifiercode":"13-01","member_number":"A80705","first_name":"AARON","last_name":"ENDRES","classification":"C","division":"LIMITED","hit_factor":3.5449},{"match_name":"MVPSA June 2016 Points Match","match_date":"2016-06-04","stage_classifiercode":"13-01","member_number":"A92229","first_name":"JANINA","last_name":"WEBB","classification":"D","division":"LIMITED","hit_factor":3.5439},{"match_name":"ISPS Nov 5th 2016","match_date":"2016-11-05","stage_classifiercode":"13-01","member_number":"L3771","first_name":"CHUCK","last_name":"GALLOWAY","classification":"C","division":"LIMITED","hit_factor":3.5436},{"match_name":"Superior Practical Shooters June 2018 Match","match_date":"2018-06-06","stage_classifiercode":"13-01","member_number":"\"\"","first_name":"JAMES","last_name":"SHIREY","classification":"U","division":"LIMITED","hit_factor":3.5431},{"match_name":"OFGC Practical Pistol Match 7-19-2020","match_date":"2020-07-19","stage_classifiercode":"13-01","member_number":"TY93346","first_name":"GREG","last_name":"FANCHER","classification":"C","division":"LIMITED","hit_factor":3.5425},{"match_name":"NISA August 2017","match_date":"2017-08-27","stage_classifiercode":"13-01","member_number":"A54941","first_name":"ROBERT","last_name":"MINSHALL","classification":"B","division":"LIMITED","hit_factor":3.5415},{"match_name":"OKCGC USPSA Dec 2016","match_date":"2016-12-03","stage_classifiercode":"13-01","member_number":"A61442","first_name":"SHANNON","last_name":"CONLEY","classification":"C","division":"LIMITED","hit_factor":3.5388},{"match_name":"Green Valley September 2016","match_date":"2016-09-24","stage_classifiercode":"13-01","member_number":"A82068","first_name":"DAVID","last_name":"BROWN","classification":"C","division":"LIMITED","hit_factor":3.5377},{"match_name":"5 Dogs April 2017 USPSA","match_date":"2017-04-02","stage_classifiercode":"13-01","member_number":"A529539","first_name":"DUDLEY","last_name":"BAKER","classification":"U","division":"LIMITED","hit_factor":3.5339},{"match_name":"Range E11even July 2017","match_date":"2017-07-22","stage_classifiercode":"13-01","member_number":"A53524","first_name":"DAVE","last_name":"GRIFFITH","classification":"C","division":"LIMITED","hit_factor":3.5326},{"match_name":"Sharp Practical Shooters December USPSA Match","match_date":"2018-12-30","stage_classifiercode":"13-01","member_number":"\"\"","first_name":"PETER","last_name":"VAN","classification":"\"\"","division":"LIMITED","hit_factor":3.532},{"match_name":"CGGR February USPSA Match","match_date":"2016-02-20","stage_classifiercode":"13-01","member_number":"TY88089","first_name":"DAVID","last_name":"BURTON","classification":"C","division":"LIMITED","hit_factor":3.5318},{"match_name":"Sharp Practical Shooters December USPSA Match","match_date":"2018-12-30","stage_classifiercode":"13-01","member_number":"a83376","first_name":"ANDY","last_name":"JOHNSTON","classification":"M","division":"LIMITED","hit_factor":3.5309},{"match_name":"ALL CLASSIFIER SUMMERSLAM  -  AREA 59 2018","match_date":"2018-06-30","stage_classifiercode":"13-01","member_number":"A112557","first_name":"LAURYN","last_name":"BERGER","classification":"U","division":"LIMITED","hit_factor":3.5303},{"match_name":"PRSC GP6 March 2018","match_date":"2018-03-11","stage_classifiercode":"13-01","member_number":"TY93029","first_name":"MARTIN","last_name":"JOHNSON","classification":"B","division":"LIMITED","hit_factor":3.5302},{"match_name":"Hopkinton May 2018","match_date":"2018-05-05","stage_classifiercode":"13-01","member_number":"TY98355","first_name":"BRIAN","last_name":"LASKA","classification":"D","division":"LIMITED","hit_factor":3.5302},{"match_name":"ISPS Nov 5th 2016","match_date":"2016-11-05","stage_classifiercode":"13-01","member_number":"\"\"","first_name":"DAN","last_name":"COIL","classification":"U","division":"LIMITED","hit_factor":3.5294},{"match_name":"PCSI - August 2017 USPSA","match_date":"2017-08-05","stage_classifiercode":"13-01","member_number":"\"\"","first_name":"PHIL","last_name":"KLEMAN","classification":"U","division":"LIMITED","hit_factor":3.5267},{"match_name":"NRG Saturday July 10th Includes a Classifier Stage","match_date":"2021-07-10","stage_classifiercode":"13-01","member_number":"FY99184","first_name":"RODEL","last_name":"JARDINIANO","classification":"U","division":"LIMITED","hit_factor":3.5256},{"match_name":"LdF USPSA Match August 22 2020","match_date":"2020-08-22","stage_classifiercode":"13-01","member_number":"L3802","first_name":"JIM","last_name":"LEVIS","classification":"M","division":"LIMITED","hit_factor":3.5242},{"match_name":"NHRPC - October 2020 USPSA","match_date":"2020-10-10","stage_classifiercode":"13-01","member_number":"A81058","first_name":"RAY","last_name":"COSTANZO","classification":"C","division":"LIMITED","hit_factor":3.5185},{"match_name":"Applied IN25 USPSA March classifier","match_date":"2017-03-21","stage_classifiercode":"13-01","member_number":"A100708","first_name":"MARK","last_name":"RUBY","classification":"U","division":"LIMITED","hit_factor":3.5176},{"match_name":"NRG Saturday January 13th - Includes a Classifier Stage","match_date":"2018-01-13","stage_classifiercode":"13-01","member_number":"\"\"","first_name":"IAN","last_name":"DONAHUE","classification":"U","division":"LIMITED","hit_factor":3.5144},{"match_name":"CCC Shooting Complex February 2017","match_date":"2017-02-05","stage_classifiercode":"13-01","member_number":"\"\"","first_name":"GARRETT","last_name":"HOUSE","classification":"U","division":"LIMITED","hit_factor":3.5137},{"match_name":"MVPSA June 2016 Points Match","match_date":"2016-06-04","stage_classifiercode":"13-01","member_number":"\"\"","first_name":"MULKEY","last_name":"JOSH","classification":"A","division":"LIMITED","hit_factor":3.5119},{"match_name":"NNRPA USPSA April 2021","match_date":"2021-04-24","stage_classifiercode":"13-01","member_number":"TY51797","first_name":"DENNIS","last_name":"MARSH","classification":"C","division":"LIMITED","hit_factor":3.5117},{"match_name":"Range54 USPSA","match_date":"2018-05-04","stage_classifiercode":"13-01","member_number":"A107831","first_name":"TRAVIS","last_name":"CORWELL","classification":"U","division":"LIMITED","hit_factor":3.5088},{"match_name":"MCRC USPSA October 2018","match_date":"2018-10-13","stage_classifiercode":"13-01","member_number":"A113254","first_name":"JAMES","last_name":"BLACKWELL","classification":"U","division":"LIMITED","hit_factor":3.5088},{"match_name":"Rankin Field Sunday USPSA","match_date":"2018-09-16","stage_classifiercode":"13-01","member_number":"\"\"","first_name":"RICHARD","last_name":"CASTILLO","classification":"U","division":"LIMITED","hit_factor":3.5088},{"match_name":"PGC USPSA  Practice Match 11-28-17","match_date":"2017-11-28","stage_classifiercode":"13-01","member_number":"\"\"","first_name":"DREW","last_name":"BOWMAN","classification":"U","division":"LIMITED","hit_factor":3.5067},{"match_name":"LdF USPSA Match August 22 2020","match_date":"2020-08-22","stage_classifiercode":"13-01","member_number":"TY63347","first_name":"MICHAEL","last_name":"ZOLEZZI","classification":"A","division":"LIMITED","hit_factor":3.5063},{"match_name":"YMM IPSC02 2017_10_08","match_date":"2017-10-08","stage_classifiercode":"13-01","member_number":"\"\"","first_name":"DANIEL","last_name":"BOGAN","classification":"U","division":"LIMITED","hit_factor":3.5019},{"match_name":"MCRC USPSA October 2018","match_date":"2018-10-13","stage_classifiercode":"13-01","member_number":"TY101414","first_name":"RON","last_name":"LEGASPI","classification":"D","division":"LIMITED","hit_factor":3.4976},{"match_name":"Shasta Shooters 2018 June Special Classifier","match_date":"2018-06-09","stage_classifiercode":"13-01","member_number":"FY89297","first_name":"STEPHEN J","last_name":"ECKARD","classification":"D","division":"LIMITED","hit_factor":3.496},{"match_name":"Rio Salado UPPL May 2021","match_date":"2021-05-09","stage_classifiercode":"13-01","member_number":"TY22852","first_name":"DEBBIE","last_name":"KEEHART","classification":"B","division":"LIMITED","hit_factor":3.496},{"match_name":"BRRC GAS USPSA MAY 12 2018","match_date":"2018-05-12","stage_classifiercode":"13-01","member_number":"A75024","first_name":"ROBERT","last_name":"BRUCE","classification":"C","division":"LIMITED","hit_factor":3.4949},{"match_name":"EAPS  January 2016","match_date":"2016-01-17","stage_classifiercode":"13-01","member_number":"A60170","first_name":"DAVE","last_name":"DELGER","classification":"C","division":"LIMITED","hit_factor":3.4894},{"match_name":"Rio Salado UPPL 2nd Sunday January 2020","match_date":"2020-01-11","stage_classifiercode":"13-01","member_number":"A85099","first_name":"JESSICA","last_name":"NIETZEL","classification":"B","division":"LIMITED","hit_factor":3.4884},{"match_name":"TriggerGuard USPSA Classifier Match","match_date":"2018-03-24","stage_classifiercode":"13-01","member_number":"A108361","first_name":"ZACHARIAH","last_name":"POWELL","classification":"U","division":"LIMITED","hit_factor":3.4873},{"match_name":"ENPS April USPSA Match","match_date":"2017-04-02","stage_classifiercode":"13-01","member_number":"PEN","first_name":"JAMES","last_name":"HOLTMEYER","classification":"U","division":"LIMITED","hit_factor":3.4861},{"match_name":"RDS Aug 52017 USPSA  Match","match_date":"2017-08-05","stage_classifiercode":"13-01","member_number":"\"\"","first_name":"EDGAR","last_name":"ZIMIN","classification":"U","division":"LIMITED","hit_factor":3.481},{"match_name":"Shasta Shooters July 2016 Special Classifier","match_date":"2016-07-09","stage_classifiercode":"13-01","member_number":"A30368","first_name":"P WAYNE","last_name":"FACCA","classification":"B","division":"LIMITED","hit_factor":3.479},{"match_name":"Grandbaggers September 2017","match_date":"2017-09-07","stage_classifiercode":"13-01","member_number":"A103193","first_name":"LARRY","last_name":"LOBE","classification":"D","division":"LIMITED","hit_factor":3.4783},{"match_name":"CPS USPSA Apr 2018","match_date":"2018-04-07","stage_classifiercode":"13-01","member_number":"\"\"","first_name":"RUSS","last_name":"PURTZER","classification":"U","division":"LIMITED","hit_factor":3.4774},{"match_name":"Mvpsa April 2","match_date":"2016-04-02","stage_classifiercode":"13-01","member_number":"\"\"","first_name":"RON","last_name":"RITCHIE","classification":"U","division":"LIMITED","hit_factor":3.4739},{"match_name":"PCWC USPSA  7 23 2016","match_date":"2016-07-23","stage_classifiercode":"13-01","member_number":"A84726","first_name":"JIM","last_name":"HORNER","classification":"U","division":"LIMITED","hit_factor":3.4717},{"match_name":"CCC Shooting Complex February 2017","match_date":"2017-02-05","stage_classifiercode":"13-01","member_number":"\"\"","first_name":"PHIL","last_name":"ROSS","classification":"U","division":"LIMITED","hit_factor":3.4682},{"match_name":"PSAC_20170527","match_date":"2017-05-27","stage_classifiercode":"13-01","member_number":"A87914","first_name":"PATRICE","last_name":"SUTTER","classification":"U","division":"LIMITED","hit_factor":3.4662},{"match_name":"PTPC February 4th Classifier Match","match_date":"2018-02-04","stage_classifiercode":"13-01","member_number":"FY79706","first_name":"HELMUT","last_name":"ANGERER","classification":"C","division":"LIMITED","hit_factor":3.4579},{"match_name":"Strongpoint April 2018 USPSA Match","match_date":"2018-04-07","stage_classifiercode":"13-01","member_number":"\"\"","first_name":"DAVID","last_name":"VALE","classification":"U","division":"LIMITED","hit_factor":3.4483},{"match_name":"NCPS USPSA Handgun Match November 28 2021x","match_date":"2021-11-28","stage_classifiercode":"13-01","member_number":"L3404","first_name":"GAYLORD","last_name":"MORSE","classification":"A","division":"LIMITED","hit_factor":3.4483},{"match_name":"SPSA USPSA October 1st Sat Match","match_date":"2020-10-03","stage_classifiercode":"13-01","member_number":"A125767","first_name":"JAKE","last_name":"NIERGARTH","classification":"C","division":"LIMITED","hit_factor":3.4483},{"match_name":"Renton USPSA May 2018 - NW05","match_date":"2018-05-27","stage_classifiercode":"13-01","member_number":"TY92214","first_name":"STEVE","last_name":"PARKISON","classification":"C","division":"LIMITED","hit_factor":3.4457},{"match_name":"ORPCI USPSA Saturday 2020.09.19","match_date":"2020-09-19","stage_classifiercode":"13-01","member_number":"TY98156","first_name":"JIM","last_name":"GEIGER","classification":"D","division":"LIMITED","hit_factor":3.4454},{"match_name":"Lafayette Practical Shooters - WED-THUR - Dec 19-20 - CLASSIFIER MATCH","match_date":"2018-12-20","stage_classifiercode":"13-01","member_number":"L4430","first_name":"MIKE","last_name":"RUSSELL","classification":"C","division":"LIMITED","hit_factor":3.4439},{"match_name":"OPSC USPSA OCTOBER 2018","match_date":"2018-10-14","stage_classifiercode":"13-01","member_number":"A86352","first_name":"TED","last_name":"SALANI","classification":"D","division":"LIMITED","hit_factor":3.4435},{"match_name":"WTPS USPSA April Classifier Match 4-8-17","match_date":"2017-04-08","stage_classifiercode":"13-01","member_number":"TY90615","first_name":"RAY","last_name":"KEITH","classification":"C","division":"LIMITED","hit_factor":3.4415},{"match_name":"SEPSA June 2016","match_date":"2016-06-11","stage_classifiercode":"13-01","member_number":"A86924","first_name":"MICHAEL","last_name":"STACK","classification":"X","division":"LIMITED","hit_factor":3.4402},{"match_name":"Hopkinton May 2018","match_date":"2018-05-05","stage_classifiercode":"13-01","member_number":"TY76424","first_name":"HARRISON","last_name":"SCHMIDT","classification":"A","division":"LIMITED","hit_factor":3.4395},{"match_name":"SCCCApril2017","match_date":"2017-04-09","stage_classifiercode":"13-01","member_number":"a102128","first_name":"MIKE","last_name":"KING","classification":"U","division":"LIMITED","hit_factor":3.4359},{"match_name":"Laser Ninja Dragon League July Special Classifier","match_date":"2018-07-01","stage_classifiercode":"13-01","member_number":"TY93137","first_name":"BILLY","last_name":"DODSON","classification":"M","division":"LIMITED","hit_factor":3.4356},{"match_name":"SCCPSA USPSA Aug 19 2017","match_date":"2017-08-19","stage_classifiercode":"13-01","member_number":"TY29481","first_name":"WILLIAM","last_name":"EVANS","classification":"C","division":"LIMITED","hit_factor":3.4343},{"match_name":"PAS April USPSA","match_date":"2018-04-21","stage_classifiercode":"13-01","member_number":"a84801","first_name":"LARRY","last_name":"THOMPSON","classification":"U","division":"LIMITED","hit_factor":3.4342},{"match_name":"Devil Dog USPSA Classifier Match-Saturday Session","match_date":"2018-03-10","stage_classifiercode":"13-01","member_number":"A108038","first_name":"CHRISTOPHER","last_name":"FALANGA","classification":"U","division":"LIMITED","hit_factor":3.4328},{"match_name":"NRG December 10th 2016","match_date":"2016-12-10","stage_classifiercode":"13-01","member_number":"TY71084","first_name":"ROBERT","last_name":"WEIDE","classification":"M","division":"LIMITED","hit_factor":3.4307},{"match_name":"NAAS  2016-07-17 Special DBL Classifier Match","match_date":"2016-07-17","stage_classifiercode":"13-01","member_number":"A94807","first_name":"JAMES","last_name":"GARNER","classification":"C","division":"LIMITED","hit_factor":3.4291},{"match_name":"COPS Jan 2016 USPSA Match","match_date":"2016-01-03","stage_classifiercode":"13-01","member_number":"\"\"","first_name":"KYLE","last_name":"COOK","classification":"U","division":"LIMITED","hit_factor":3.4276},{"match_name":"Crooked Creek Pistol League - July 2018","match_date":"2018-07-14","stage_classifiercode":"13-01","member_number":"TY99363","first_name":"JESSE","last_name":"MORTON","classification":"B","division":"LIMITED","hit_factor":3.4211},{"match_name":"SFA USPSA AUGUST 2018","match_date":"2018-08-18","stage_classifiercode":"13-01","member_number":"A9779","first_name":"TIM","last_name":"PIERSON","classification":"B","division":"LIMITED","hit_factor":3.4203},{"match_name":"Griffin USPSA Match Oct 2017","match_date":"2017-10-21","stage_classifiercode":"13-01","member_number":"PEN","first_name":"CARLOS","last_name":"LAYSON","classification":"U","division":"LIMITED","hit_factor":3.4201},{"match_name":"Shasta Shooters July 2016 Special Classifier","match_date":"2016-07-09","stage_classifiercode":"13-01","member_number":"a43454","first_name":"ADRIAN","last_name":"BORTOLIN","classification":"C","division":"LIMITED","hit_factor":3.4188},{"match_name":"Rankin Field Sunday USPSA","match_date":"2018-09-16","stage_classifiercode":"13-01","member_number":"A111934","first_name":"JULIA","last_name":"BLAND","classification":"U","division":"LIMITED","hit_factor":3.4182},{"match_name":"Applied IN25 USPSA October Classifier Match 2018","match_date":"2018-10-17","stage_classifiercode":"13-01","member_number":"A107571","first_name":"JASON","last_name":"PARSELL","classification":"U","division":"LIMITED","hit_factor":3.4164},{"match_name":"TMGN USPSA May 4th Pistol Match","match_date":"2017-05-04","stage_classifiercode":"13-01","member_number":"A99530","first_name":"CHRIS","last_name":"RICHTER","classification":"U","division":"LIMITED","hit_factor":3.4149},{"match_name":"Briar Rabbit April 2021","match_date":"2021-04-25","stage_classifiercode":"13-01","member_number":"L3670","first_name":"DAN","last_name":"CLICK","classification":"A","division":"LIMITED","hit_factor":3.4134},{"match_name":"Shasta Shooters 2018 June Special Classifier","match_date":"2018-06-09","stage_classifiercode":"13-01","member_number":"A33123","first_name":"DAREN","last_name":"HUSA","classification":"B","division":"LIMITED","hit_factor":3.4133},{"match_name":"WTPS USPSA April Classifier Match 4-8-17","match_date":"2017-04-08","stage_classifiercode":"13-01","member_number":"A15867","first_name":"ALAN W.","last_name":"LAZA","classification":"M","division":"LIMITED","hit_factor":3.4121},{"match_name":"SUPS USPSA 5/7/2016","match_date":"2016-05-07","stage_classifiercode":"13-01","member_number":"\"\"","first_name":"MEGAN","last_name":"THOMAS","classification":"U","division":"LIMITED","hit_factor":3.4115},{"match_name":"SWGC USPSA Pistol Match - February 2021","match_date":"2021-02-06","stage_classifiercode":"13-01","member_number":"FY77480","first_name":"GORDON","last_name":"SNADEN","classification":"B","division":"LIMITED","hit_factor":3.4091},{"match_name":"WTPS USPSA April Classifier Match 4-8-17","match_date":"2017-04-08","stage_classifiercode":"13-01","member_number":"A101801","first_name":"JEREMY","last_name":"SERVANTEZ","classification":"U","division":"LIMITED","hit_factor":3.4075},{"match_name":"FBURG March 2017 Level I USPSA ","match_date":"2017-03-04","stage_classifiercode":"13-01","member_number":"A70829","first_name":"WILLIAM","last_name":"HIETT","classification":"A","division":"LIMITED","hit_factor":3.407},{"match_name":"PRSC GP6 March 2018","match_date":"2018-03-11","stage_classifiercode":"13-01","member_number":"\"\"","first_name":"SHAWN","last_name":"PETERSON","classification":"A","division":"LIMITED","hit_factor":3.4065},{"match_name":"Patriot Action Shooters December 2015 Match","match_date":"2015-12-19","stage_classifiercode":"13-01","member_number":"A84801","first_name":"LARRY","last_name":"THOMPSON","classification":"C","division":"LIMITED","hit_factor":3.4056},{"match_name":"Medford USPSA November 2017 Match","match_date":"2017-11-19","stage_classifiercode":"13-01","member_number":"\"\"","first_name":"TOM","last_name":"THICKETT","classification":"U","division":"LIMITED","hit_factor":3.4034},{"match_name":"Rankin Field Sunday USPSA","match_date":"2018-06-17","stage_classifiercode":"13-01","member_number":"TY105155","first_name":"ALBERT","last_name":"COITO","classification":"D","division":"LIMITED","hit_factor":3.4029},{"match_name":"DAPS USPSA at ETTS 4-8-2017","match_date":"2017-04-08","stage_classifiercode":"13-01","member_number":"PENDING","first_name":"ZACH","last_name":"STONE","classification":"U","division":"LIMITED","hit_factor":3.4029},{"match_name":"PPPS 3-12-17","match_date":"2017-03-12","stage_classifiercode":"13-01","member_number":"A92683","first_name":"CONNOR","last_name":"TARVER","classification":"C","division":"LIMITED","hit_factor":3.3958},{"match_name":"APSA October 2017 USPSA Match","match_date":"2017-10-14","stage_classifiercode":"13-01","member_number":"\"\"","first_name":"LARRY","last_name":"OHL","classification":"\"\"","division":"LIMITED","hit_factor":3.3948},{"match_name":"FSA USPSA POINT SERIES 03-08-20","match_date":"2020-03-08","stage_classifiercode":"13-01","member_number":"A112322","first_name":"SANDRA","last_name":"MARIE","classification":"C","division":"LIMITED","hit_factor":3.3898},{"match_name":"ORPCI 2018.03.31 USPSA Special","match_date":"2018-03-31","stage_classifiercode":"13-01","member_number":"A106367","first_name":"DANIEL","last_name":"MATHIAS","classification":"U","division":"LIMITED","hit_factor":3.3898},{"match_name":"GRPC USPSA SOME LIKE IT HOT","match_date":"2018-08-05","stage_classifiercode":"13-01","member_number":"TY86420","first_name":"BJ","last_name":"BURTON","classification":"A","division":"LIMITED","hit_factor":3.3877},{"match_name":"Hose Monster Action Classifier","match_date":"2020-03-15","stage_classifiercode":"13-01","member_number":"A127027","first_name":"ANASTASIA","last_name":"STUYT","classification":"\"\"","division":"LIMITED","hit_factor":3.3873},{"match_name":"PSAC_20170527","match_date":"2017-05-27","stage_classifiercode":"13-01","member_number":"A86473","first_name":"GEORGE","last_name":"TEZAK","classification":"U","division":"LIMITED","hit_factor":3.3873},{"match_name":"ISPS January Impact","match_date":"2016-01-27","stage_classifiercode":"13-01","member_number":"A84481","first_name":"DEREK","last_name":"POLLARD","classification":"A","division":"LIMITED","hit_factor":3.3854},{"match_name":"JPPS Club Match 9-8-18","match_date":"2018-09-08","stage_classifiercode":"13-01","member_number":"A89751","first_name":"TONY","last_name":"DIAMOND TENNEY","classification":"C","division":"LIMITED","hit_factor":3.3844},{"match_name":"COPS Jan 2016 USPSA Match","match_date":"2016-01-03","stage_classifiercode":"13-01","member_number":"\"\"","first_name":"PHILIP","last_name":"CONJERTI","classification":"U","division":"LIMITED","hit_factor":3.3832},{"match_name":"OKCGC USPSA Dec 2016","match_date":"2016-12-03","stage_classifiercode":"13-01","member_number":"A62938","first_name":"RICK","last_name":"MEANS","classification":"C","division":"LIMITED","hit_factor":3.3821},{"match_name":"Superior Practical Shooters June 2018 Match","match_date":"2018-06-06","stage_classifiercode":"13-01","member_number":"A106237","first_name":"NICHOLAS","last_name":"WARREN","classification":"U","division":"LIMITED","hit_factor":3.3812},{"match_name":"MCRC USPSA October 2018","match_date":"2018-10-13","stage_classifiercode":"13-01","member_number":"A100125","first_name":"JOHN","last_name":"EDENS","classification":"B","division":"LIMITED","hit_factor":3.3769},{"match_name":"INAS Jan 2018 USPSA AM","match_date":"2018-01-20","stage_classifiercode":"13-01","member_number":"TY21925","first_name":"WILLIAM","last_name":"PARKS III","classification":"B","division":"LIMITED","hit_factor":3.3759},{"match_name":"OKCGC USPSA Dec 2016","match_date":"2016-12-03","stage_classifiercode":"13-01","member_number":"\"\"","first_name":"WILLIAM","last_name":"STRANGE","classification":"U","division":"LIMITED","hit_factor":3.3755},{"match_name":"2018-08-04 USPSA at Phoenix Rod and Gun Club","match_date":"2018-08-04","stage_classifiercode":"13-01","member_number":"\"\"","first_name":"BRUCE","last_name":"ROSS","classification":"B","division":"LIMITED","hit_factor":3.3686},{"match_name":"MCRC USPSA October 2018","match_date":"2018-10-13","stage_classifiercode":"13-01","member_number":"A106088","first_name":"ROCK","last_name":"UNDERWOOD","classification":"D","division":"LIMITED","hit_factor":3.3681},{"match_name":"PCSI March 2016 USPSA","match_date":"2016-03-05","stage_classifiercode":"13-01","member_number":"A88347","first_name":"MATT","last_name":"BOWEN","classification":"none","division":"LIMITED","hit_factor":3.3604},{"match_name":"RMAP 3rd sunday August 2017","match_date":"2017-08-20","stage_classifiercode":"13-01","member_number":"\"\"","first_name":"TIM","last_name":"MCDONALD","classification":"U","division":"LIMITED","hit_factor":3.3585},{"match_name":"Medford USPSA November 2017 Match","match_date":"2017-11-19","stage_classifiercode":"13-01","member_number":"A94338","first_name":"RON","last_name":"HARDIN","classification":"U","division":"LIMITED","hit_factor":3.3582},{"match_name":"TMGN USPSA May 4th Pistol Match","match_date":"2017-05-04","stage_classifiercode":"13-01","member_number":"\"\"","first_name":"MATT","last_name":"CHURCH","classification":"B","division":"LIMITED","hit_factor":3.355},{"match_name":"APSA October 2017 USPSA Match","match_date":"2017-10-14","stage_classifiercode":"13-01","member_number":"A85650","first_name":"ERIC","last_name":"LAWHERN","classification":"B","division":"LIMITED","hit_factor":3.355},{"match_name":"Double Taps April Match","match_date":"2017-04-19","stage_classifiercode":"13-01","member_number":"TYF96113","first_name":"NORM","last_name":"FRANKFURT","classification":"U","division":"LIMITED","hit_factor":3.3534},{"match_name":"DWB - Deadwood Boys USPSA February 4 2018","match_date":"2018-02-04","stage_classifiercode":"13-01","member_number":"A106736","first_name":"ENRIQUE","last_name":"ARAGON","classification":"U","division":"LIMITED","hit_factor":3.351},{"match_name":"Grandbaggers September 2017","match_date":"2017-09-07","stage_classifiercode":"13-01","member_number":"A104011","first_name":"JOHN","last_name":"SWAIN","classification":"D","division":"LIMITED","hit_factor":3.3503},{"match_name":"EASTER EGG HUNT AREA 59  ALL CLASSFIER MATCH","match_date":"2017-04-15","stage_classifiercode":"13-01","member_number":"A97402","first_name":"STEVEN","last_name":"ROLAND","classification":"U","division":"LIMITED","hit_factor":3.3501},{"match_name":"Iron Springs Practical Shooters Patriot#4. ","match_date":"2016-07-22","stage_classifiercode":"13-01","member_number":"\"\"","first_name":"ROCK","last_name":"TUCKER","classification":"U","division":"LIMITED","hit_factor":3.347},{"match_name":"Bitterroot Blasters March Club Match","match_date":"2016-03-26","stage_classifiercode":"13-01","member_number":"FY13159","first_name":"MIKE","last_name":"SHAPIRO","classification":"B","division":"LIMITED","hit_factor":3.3449},{"match_name":"PAS April USPSA","match_date":"2018-04-21","stage_classifiercode":"13-01","member_number":"\"\"","first_name":"SAM","last_name":"FORSHER","classification":"U","division":"LIMITED","hit_factor":3.3441},{"match_name":"Richmond Hot Shots Dec 2-3-2017 USPSA Pistol Match","match_date":"2017-12-02","stage_classifiercode":"13-01","member_number":"\"\"","first_name":"NICK","last_name":"MERCURIO","classification":"A","division":"LIMITED","hit_factor":3.3419},{"match_name":"Minnetonka Game And Fish July 12","match_date":"2017-07-12","stage_classifiercode":"13-01","member_number":"ty51687","first_name":"WILLIAM","last_name":"KIMMEL","classification":"C","division":"LIMITED","hit_factor":3.3419},{"match_name":"Range54 USPSA","match_date":"2018-05-04","stage_classifiercode":"13-01","member_number":"\"\"","first_name":"MIKE","last_name":"MEZA","classification":"U","division":"LIMITED","hit_factor":3.34},{"match_name":"SLPSA Feb USPSA","match_date":"2018-02-17","stage_classifiercode":"13-01","member_number":"FY80275","first_name":"JASON","last_name":"MILLER","classification":"B","division":"LIMITED","hit_factor":3.3378},{"match_name":"Blackstone Shooting Sports Snow Days January 2017 USPSA Level  1","match_date":"2017-01-08","stage_classifiercode":"13-01","member_number":"TY56396","first_name":"MORGAN","last_name":"ALLEN","classification":"A","division":"LIMITED","hit_factor":3.3366},{"match_name":"Laser Ninja Dragon League July Special Classifier","match_date":"2018-07-01","stage_classifiercode":"13-01","member_number":"TY-106769","first_name":"ANDY","last_name":"HEPPEARD","classification":"D","division":"LIMITED","hit_factor":3.3333},{"match_name":"CCPS  USPSA  2016 July","match_date":"2016-07-17","stage_classifiercode":"13-01","member_number":"A10738","first_name":"BLAISE","last_name":"CORNELL-DECHERT","classification":"B","division":"LIMITED","hit_factor":3.3333},{"match_name":"NW15 Port Townsend Practical Pistol USPSA September 4 2021","match_date":"2021-09-04","stage_classifiercode":"13-01","member_number":"A112110","first_name":"COLLIN","last_name":"WEST III","classification":"U","division":"LIMITED","hit_factor":3.3295},{"match_name":"Danville Rifle and Pistol Club USPSA IL17 Classifier Match August 18th 2018","match_date":"2018-08-18","stage_classifiercode":"13-01","member_number":"A111530","first_name":"JIM","last_name":"SCHIFO","classification":"U","division":"LIMITED","hit_factor":3.3287},{"match_name":"WY02 GTS 5.5.18","match_date":"2018-05-05","stage_classifiercode":"13-01","member_number":"A100243","first_name":"TATE","last_name":"AABERG","classification":"C","division":"LIMITED","hit_factor":3.3275},{"match_name":"BAPS USPSA October","match_date":"2018-10-20","stage_classifiercode":"13-01","member_number":"A75212","first_name":"STEVEN","last_name":"MCNAMARA","classification":"C","division":"LIMITED","hit_factor":3.3272},{"match_name":"Idaho ISPS August 4th 2018","match_date":"2018-08-04","stage_classifiercode":"13-01","member_number":"Ty94890","first_name":"CHRIS","last_name":"CLARK","classification":"A","division":"LIMITED","hit_factor":3.3252},{"match_name":"AIPS Weekly USPSA 17 April 2018","match_date":"2018-04-17","stage_classifiercode":"13-01","member_number":"FY77740","first_name":"KELLY","last_name":"CHRISTIANS","classification":"C","division":"LIMITED","hit_factor":3.3243},{"match_name":"PSAC_20170527","match_date":"2017-05-27","stage_classifiercode":"13-01","member_number":"TY81049","first_name":"ROBERT","last_name":"MERKEL","classification":"B","division":"LIMITED","hit_factor":3.3238},{"match_name":"MRCPS USPSA Feb    2016","match_date":"2016-02-21","stage_classifiercode":"13-01","member_number":"TY37515","first_name":"TOD","last_name":"SHERMAN","classification":"C","division":"LIMITED","hit_factor":3.3214},{"match_name":"RCSC USPSA 26 Feb 2017","match_date":"2017-02-26","stage_classifiercode":"13-01","member_number":"PEND","first_name":"HUBERT","last_name":"GONZALES","classification":"U","division":"LIMITED","hit_factor":3.3214},{"match_name":"ENPS April USPSA Match","match_date":"2017-04-02","stage_classifiercode":"13-01","member_number":"A95228","first_name":"CHARLES","last_name":"BRITTAIN","classification":"U","division":"LIMITED","hit_factor":3.3157},{"match_name":"LTD Pistol - May 2017","match_date":"2017-05-06","stage_classifiercode":"13-01","member_number":"\"\"","first_name":"JEREMY","last_name":"BRUMMETT","classification":"U","division":"LIMITED","hit_factor":3.3153},{"match_name":"SAPS Match 1/04/2020","match_date":"2020-01-04","stage_classifiercode":"13-01","member_number":"A103804","first_name":"GEOFF","last_name":"GERRISH","classification":"C","division":"LIMITED","hit_factor":3.3143},{"match_name":"BAPS USPSA July","match_date":"2021-07-17","stage_classifiercode":"13-01","member_number":"A91275","first_name":"ANGELA","last_name":"RABUCK","classification":"C","division":"LIMITED","hit_factor":3.3113},{"match_name":"SFA USPSA AUGUST 2018","match_date":"2018-08-18","stage_classifiercode":"13-01","member_number":"TY91971","first_name":"LARRY","last_name":"SKINNER","classification":"B","division":"LIMITED","hit_factor":3.3113},{"match_name":"PIPS 06-30-2021","match_date":"2021-06-30","stage_classifiercode":"13-01","member_number":"A133321","first_name":"ED","last_name":"TERRY","classification":"U","division":"LIMITED","hit_factor":3.3083},{"match_name":"DSS - USPSA 18-03-24","match_date":"2018-03-24","stage_classifiercode":"13-01","member_number":"\"\"","first_name":"CORY","last_name":"BAKER","classification":"U","division":"LIMITED","hit_factor":3.3058},{"match_name":"HOPS USPSA 071517","match_date":"2017-07-15","stage_classifiercode":"13-01","member_number":"TY104309","first_name":"STEVEN","last_name":"SKAGGS","classification":"U","division":"LIMITED","hit_factor":3.3058},{"match_name":"PPPS 3-12-17","match_date":"2017-03-12","stage_classifiercode":"13-01","member_number":"A99377","first_name":"NATHAN","last_name":"BRAIN","classification":"U","division":"LIMITED","hit_factor":3.3028},{"match_name":"SFPC October Trophy match","match_date":"2016-10-02","stage_classifiercode":"13-01","member_number":"A74826","first_name":"ANTHONY","last_name":"YEBER","classification":"B","division":"LIMITED","hit_factor":3.3025},{"match_name":"SUPS USPSA 5/7/2016","match_date":"2016-05-07","stage_classifiercode":"13-01","member_number":"A78730","first_name":"JIM","last_name":"TACTAY","classification":"B","division":"LIMITED","hit_factor":3.2999},{"match_name":"ACC Oct Saturday 24th USPSA","match_date":"2020-10-24","stage_classifiercode":"13-01","member_number":"TY53740","first_name":"MARY ANN","last_name":"COOPER","classification":"C","division":"LIMITED","hit_factor":3.2976},{"match_name":"EASTER EGG HUNT AREA 59  ALL CLASSFIER MATCH","match_date":"2017-04-15","stage_classifiercode":"13-01","member_number":"TY58743","first_name":"FERNIE","last_name":"AVELINO","classification":"U","division":"LIMITED","hit_factor":3.2974},{"match_name":"APSC USPSA Match 08-04-18","match_date":"2018-08-04","stage_classifiercode":"13-01","member_number":"\"\"","first_name":"RYAN","last_name":"CANADY","classification":"U","division":"LIMITED","hit_factor":3.2967},{"match_name":"Naas 07-16-17","match_date":"2017-07-16","stage_classifiercode":"13-01","member_number":"A97112","first_name":"BRETT","last_name":"TYLER","classification":"U","division":"LIMITED","hit_factor":3.2967},{"match_name":"SLOSA Feburary 2016 USPSA","match_date":"2016-02-13","stage_classifiercode":"13-01","member_number":"A61982","first_name":"ROB","last_name":"PICKERING","classification":"X","division":"LIMITED","hit_factor":3.2958},{"match_name":"BHPSC Weekly Match 9-30-2016","match_date":"2016-09-30","stage_classifiercode":"13-01","member_number":"\"\"","first_name":"VANDY","last_name":"THOMSEN","classification":"D","division":"LIMITED","hit_factor":3.2949},{"match_name":"CRGC USPSA Match 5-20-18","match_date":"2018-05-20","stage_classifiercode":"13-01","member_number":"\"\"","first_name":"BOB","last_name":"KOHLER","classification":"\"\"","division":"LIMITED","hit_factor":3.2941},{"match_name":"OFGC Practical Pistol Match 7-19-2020","match_date":"2020-07-19","stage_classifiercode":"13-01","member_number":"A74027","first_name":"JUNIOR","last_name":"SIMS","classification":"B","division":"LIMITED","hit_factor":3.2927},{"match_name":"JCSSA NOV 7 2020","match_date":"2020-11-07","stage_classifiercode":"13-01","member_number":"A125927","first_name":"JOEL","last_name":"JACKSON","classification":"U","division":"LIMITED","hit_factor":3.2895},{"match_name":"SCCPSA USPSA Aug 19 2017","match_date":"2017-08-19","stage_classifiercode":"13-01","member_number":"TY87151","first_name":"RICH","last_name":"LIERO","classification":"C","division":"LIMITED","hit_factor":3.2889},{"match_name":"PCWC USPSA  9 22 2018","match_date":"2018-09-22","stage_classifiercode":"13-01","member_number":"TY96982","first_name":"TOM","last_name":"HORNER","classification":"D","division":"LIMITED","hit_factor":3.2881},{"match_name":"Tarheel USPSA July 2016","match_date":"2016-07-09","stage_classifiercode":"13-01","member_number":"9104899780","first_name":"CINDI","last_name":"DIETRICH","classification":"U","division":"LIMITED","hit_factor":3.2872},{"match_name":"Range E11even July 2017","match_date":"2017-07-22","stage_classifiercode":"13-01","member_number":"\"\"","first_name":"FRANKLIN","last_name":"JOYNER","classification":"U","division":"LIMITED","hit_factor":3.2854},{"match_name":"MVPSA Apr 72018","match_date":"2018-04-07","stage_classifiercode":"13-01","member_number":"A94886","first_name":"TODD","last_name":"DALRYMPLE","classification":"C","division":"LIMITED","hit_factor":3.2839},{"match_name":"SPSA USPSA August 4th Sat match","match_date":"2016-08-27","stage_classifiercode":"13-01","member_number":"0","first_name":"MEGAN","last_name":"KLEIN","classification":"U","division":"LIMITED","hit_factor":3.281},{"match_name":"COPS Jan 2016 USPSA Match","match_date":"2016-01-03","stage_classifiercode":"13-01","member_number":"TY82688","first_name":"SEAN","last_name":"FOURNIER","classification":"C","division":"LIMITED","hit_factor":3.2768},{"match_name":"8a Fecha USPSA Classifier","match_date":"2018-08-12","stage_classifiercode":"13-01","member_number":"TY90765","first_name":"HEBER","last_name":"SOTO","classification":"C","division":"LIMITED","hit_factor":3.2738},{"match_name":"NISA August 2017","match_date":"2017-08-27","stage_classifiercode":"13-01","member_number":"PEN","first_name":"CHAD","last_name":"BINTER","classification":"U","division":"LIMITED","hit_factor":3.2717},{"match_name":"Briar Rabbit April 2021","match_date":"2021-04-25","stage_classifiercode":"13-01","member_number":"A129476","first_name":"OWEN","last_name":"KETRON","classification":"","division":"LIMITED","hit_factor":3.268},{"match_name":"Rankin Field Sunday USPSA","match_date":"2018-09-16","stage_classifiercode":"13-01","member_number":"\"\"","first_name":"MIKE","last_name":"BARDONE","classification":"U","division":"LIMITED","hit_factor":3.2659},{"match_name":"ACC Oct Saturday 24th USPSA","match_date":"2020-10-24","stage_classifiercode":"13-01","member_number":"TY30459","first_name":"JOSEPH","last_name":"VIRAY","classification":"C","division":"LIMITED","hit_factor":3.2653},{"match_name":"PTPC February 4th Classifier Match","match_date":"2018-02-04","stage_classifiercode":"13-01","member_number":"A107121","first_name":"BRAD","last_name":"GERACE","classification":"U","division":"LIMITED","hit_factor":3.2632},{"match_name":"RCSC USPSA 26 Feb 2017","match_date":"2017-02-26","stage_classifiercode":"13-01","member_number":"PEND","first_name":"ROBERT","last_name":"KONKOL","classification":"C","division":"LIMITED","hit_factor":3.263},{"match_name":"Shoot GTR USPSA Classifier 13-01","match_date":"2018-01-08","stage_classifiercode":"13-01","member_number":"A103100","first_name":"JEREMY","last_name":"KROLAK","classification":"U","division":"LIMITED","hit_factor":3.263},{"match_name":"BAPS USPSA October","match_date":"2018-10-20","stage_classifiercode":"13-01","member_number":"FY556","first_name":"MICKEY","last_name":"GALLAWAY","classification":"B","division":"LIMITED","hit_factor":3.2628},{"match_name":"SCCPSA USPSA Aug 19 2017","match_date":"2017-08-19","stage_classifiercode":"13-01","member_number":"A72786","first_name":"JON","last_name":"HODGES","classification":"D","division":"LIMITED","hit_factor":3.2587},{"match_name":"RCPS USPSA 9 Jan 2016 Special Classifier Match","match_date":"2016-01-09","stage_classifiercode":"13-01","member_number":"A90422","first_name":"KIM","last_name":"SUSOR","classification":"U","division":"LIMITED","hit_factor":3.2587},{"match_name":"MVPSA USPSA 5-15-2020 League 1","match_date":"2020-05-15","stage_classifiercode":"13-01","member_number":"TY109685","first_name":"JENNIFER","last_name":"BLY","classification":"C","division":"LIMITED","hit_factor":3.2573},{"match_name":"Pinetucky USPSA 12-17-16","match_date":"2016-12-17","stage_classifiercode":"13-01","member_number":"ty60619","first_name":"JESUS","last_name":"HERNANDEZ","classification":"C","division":"LIMITED","hit_factor":3.257},{"match_name":"DWB - Deadwood Boys USPSA February 4 2018","match_date":"2018-02-04","stage_classifiercode":"13-01","member_number":"ty98093","first_name":"FRED","last_name":"LINDLEY","classification":"U","division":"LIMITED","hit_factor":3.2568},{"match_name":"Applied IN25 USPSA October 2017 Classifier","match_date":"2017-10-18","stage_classifiercode":"13-01","member_number":"A103789","first_name":"ROBERT","last_name":"PFAFF","classification":"U","division":"LIMITED","hit_factor":3.2562},{"match_name":"PRG Pistol Match 5 Feb 2017","match_date":"2017-02-04","stage_classifiercode":"13-01","member_number":"\"\"","first_name":"NORMAN","last_name":"MAGTIBAY","classification":"U","division":"LIMITED","hit_factor":3.2558},{"match_name":"2018-08-04 USPSA at Phoenix Rod and Gun Club","match_date":"2018-08-04","stage_classifiercode":"13-01","member_number":"A110928","first_name":"NANCY","last_name":"CARON","classification":"D","division":"LIMITED","hit_factor":3.2542},{"match_name":"1/8/17 GMPS","match_date":"2017-01-08","stage_classifiercode":"13-01","member_number":"A86813","first_name":"SHAWN","last_name":"DRAGOO","classification":"C","division":"LIMITED","hit_factor":3.2534},{"match_name":"Lafayette Practical Shooters - WED - Dec 9 - CLASSIFIER MATCH","match_date":"2020-12-10","stage_classifiercode":"13-01","member_number":"L4827","first_name":"JOHN","last_name":"BACON","classification":"C","division":"LIMITED","hit_factor":3.2528},{"match_name":"FAS  Sunday USPSA","match_date":"2018-11-04","stage_classifiercode":"13-01","member_number":"A102336","first_name":"KATHRYN","last_name":"SMITH","classification":"D","division":"LIMITED","hit_factor":3.2527},{"match_name":"MPSA 091617","match_date":"2017-09-16","stage_classifiercode":"13-01","member_number":"A97977","first_name":"MARK","last_name":"VAN NORMAN","classification":"C","division":"LIMITED","hit_factor":3.2506},{"match_name":"NNRPA USPSA April 2021","match_date":"2021-04-24","stage_classifiercode":"13-01","member_number":"TY92480","first_name":"AMOS","last_name":"RADDATZ","classification":"B","division":"LIMITED","hit_factor":3.2495},{"match_name":"USPSA MO21 2Alpha SBRC April 25 2020","match_date":"2020-04-25","stage_classifiercode":"13-01","member_number":"A101335","first_name":"TONY","last_name":"ALLEN","classification":"C","division":"LIMITED","hit_factor":3.2491},{"match_name":"Maine Practical Shooters-December 2017","match_date":"2017-12-16","stage_classifiercode":"13-01","member_number":"A93259","first_name":"MATT","last_name":"BOWEN","classification":"C","division":"LIMITED","hit_factor":3.2489},{"match_name":"JPPS Club Match 9-8-18","match_date":"2018-09-08","stage_classifiercode":"13-01","member_number":"A79446","first_name":"BEN","last_name":"BLANKENSHIP","classification":"B","division":"LIMITED","hit_factor":3.2483},{"match_name":"Double Taps USPSA November USPSA Match","match_date":"2017-11-29","stage_classifiercode":"13-01","member_number":"F93671","first_name":"NELSON","last_name":"DOAN","classification":"B","division":"LIMITED","hit_factor":3.2479},{"match_name":"FSA - USPSA  8","match_date":"2017-02-12","stage_classifiercode":"13-01","member_number":"A351304","first_name":"JOE","last_name":"ANDERSON","classification":"U","division":"LIMITED","hit_factor":3.2462},{"match_name":"PCWC USPSA  9-25-2021","match_date":"2021-09-25","stage_classifiercode":"13-01","member_number":"A54829","first_name":"DALE","last_name":"PRICE","classification":"B","division":"LIMITED","hit_factor":3.2441},{"match_name":"NW15 Port Townsend Practical Pistol USPSA September 4 2021","match_date":"2021-09-04","stage_classifiercode":"13-01","member_number":"TY12765","first_name":"PHILLIP","last_name":"MEYERS","classification":"C","division":"LIMITED","hit_factor":3.2396},{"match_name":"IN19 ACC USPSA May 23 2021","match_date":"2021-05-23","stage_classifiercode":"13-01","member_number":"TY117291","first_name":"DEAN","last_name":"MAKISHIMA","classification":"C","division":"LIMITED","hit_factor":3.2359},{"match_name":"TCSC USPSA Level I September club match","match_date":"2020-09-27","stage_classifiercode":"13-01","member_number":"TY95700","first_name":"BILL","last_name":"RYAN","classification":"C","division":"LIMITED","hit_factor":3.2345},{"match_name":"INAS Dec 2016 USPSA","match_date":"2016-12-17","stage_classifiercode":"13-01","member_number":"A80821","first_name":"K VINCE","last_name":"ZIMMER","classification":"C","division":"LIMITED","hit_factor":3.2321},{"match_name":"SEPSA June 2016","match_date":"2016-06-11","stage_classifiercode":"13-01","member_number":"A73107","first_name":"STEVEN","last_name":"BUNCH","classification":"C","division":"LIMITED","hit_factor":3.2314},{"match_name":"SCCPSA USPSA Aug 19 2017","match_date":"2017-08-19","stage_classifiercode":"13-01","member_number":"A35653","first_name":"JOHN","last_name":"HENDRY","classification":"B","division":"LIMITED","hit_factor":3.2312},{"match_name":"EAPS September 2016 USPSA","match_date":"2016-09-18","stage_classifiercode":"13-01","member_number":"A93601","first_name":"PATRICK","last_name":"STRAWN","classification":"U","division":"LIMITED","hit_factor":3.231},{"match_name":"NTPS-SE February 2017","match_date":"2017-02-18","stage_classifiercode":"13-01","member_number":"TY34715","first_name":"TONY","last_name":"ELY","classification":"U","division":"LIMITED","hit_factor":3.23},{"match_name":"MS06 Team Magnolia July 2017 USPSA Match","match_date":"2017-07-01","stage_classifiercode":"13-01","member_number":"\"\"","first_name":"MATTHEW","last_name":"GRAHAM","classification":"U","division":"LIMITED","hit_factor":3.2285},{"match_name":"WY02 GTS 5.5.18","match_date":"2018-05-05","stage_classifiercode":"13-01","member_number":"A46135","first_name":"LEE","last_name":"KREMERS","classification":"C","division":"LIMITED","hit_factor":3.2258},{"match_name":"Oakdale USPSA MN07 5-13-2021","match_date":"2021-05-13","stage_classifiercode":"13-01","member_number":"A117786","first_name":"NEIL","last_name":"SCHNAGL","classification":"C","division":"LIMITED","hit_factor":3.2172},{"match_name":"LRC USPSA   2017-03-15","match_date":"2017-03-15","stage_classifiercode":"13-01","member_number":"A87552","first_name":"JUSTIN","last_name":"CLARK","classification":"C","division":"LIMITED","hit_factor":3.2151},{"match_name":"BRRC GAS USPSA MAY 12 2018","match_date":"2018-05-12","stage_classifiercode":"13-01","member_number":"A103167","first_name":"TOBIN","last_name":"BRADWELL","classification":"D","division":"LIMITED","hit_factor":3.2132},{"match_name":"Richmond Boro Gun Club May 2017 USPSA Pistol Match","match_date":"2017-05-20","stage_classifiercode":"13-01","member_number":"A93432","first_name":"DOMINICK","last_name":"FASANELLA","classification":"U","division":"LIMITED","hit_factor":3.2086},{"match_name":"PPS CLASSIFIER MATCH 2020-02-25","match_date":"2020-02-26","stage_classifiercode":"13-01","member_number":"A116104","first_name":"STEVE","last_name":"CASKEY","classification":"U","division":"LIMITED","hit_factor":3.2051},{"match_name":"NTPS-SE February 2017","match_date":"2017-02-18","stage_classifiercode":"13-01","member_number":"TY64849","first_name":"DAVID","last_name":"PETERSON","classification":"U","division":"LIMITED","hit_factor":3.2031},{"match_name":"BRSP Tuesday Night USPSA Match - Aug 14","match_date":"2018-08-15","stage_classifiercode":"13-01","member_number":"A-104930","first_name":"DON","last_name":"EASTERLY","classification":"D","division":"LIMITED","hit_factor":3.2025},{"match_name":"SPSA USPSA August 4th Sat match","match_date":"2016-08-27","stage_classifiercode":"13-01","member_number":"A70970","first_name":"ALLAN","last_name":"KIDD","classification":"B","division":"LIMITED","hit_factor":3.202},{"match_name":"MPSA 2021-05-15","match_date":"2021-05-15","stage_classifiercode":"13-01","member_number":"FY39690","first_name":"MAC","last_name":"HART","classification":"B","division":"LIMITED","hit_factor":3.2017},{"match_name":"JCSSA OCT ","match_date":"2016-10-01","stage_classifiercode":"13-01","member_number":"A91630","first_name":"LARRY","last_name":"WALDRIP","classification":"C","division":"LIMITED","hit_factor":3.1993},{"match_name":"EWPSA 2018-07","match_date":"2018-07-14","stage_classifiercode":"13-01","member_number":"A111029","first_name":"NICHOLAS","last_name":"CRAWFORD","classification":"U","division":"LIMITED","hit_factor":3.1989},{"match_name":"WTPS USPSA April Classifier Match 4-8-17","match_date":"2017-04-08","stage_classifiercode":"13-01","member_number":"A101672","first_name":"DANNY","last_name":"GREGG","classification":"U","division":"LIMITED","hit_factor":3.1979},{"match_name":"Woodland Heights Practical Shooters USPSA Match 9-20","match_date":"2020-09-20","stage_classifiercode":"13-01","member_number":"A126424","first_name":"JASON","last_name":"SMITH","classification":"U","division":"LIMITED","hit_factor":3.1953},{"match_name":"CVSC 12-31-2017","match_date":"2017-12-31","stage_classifiercode":"13-01","member_number":"A94497","first_name":"RENE","last_name":"FORBES-PFITZER","classification":"D","division":"LIMITED","hit_factor":3.1944},{"match_name":"ORPCI 2018.03.31 USPSA Special","match_date":"2018-03-31","stage_classifiercode":"13-01","member_number":"A104827","first_name":"MICHAEL","last_name":"ARNOLD","classification":"U","division":"LIMITED","hit_factor":3.193},{"match_name":"12a Fecha USPSA","match_date":"2017-11-12","stage_classifiercode":"13-01","member_number":"F78832","first_name":"ERNESTO","last_name":"RODRIGUEZ","classification":"C","division":"LIMITED","hit_factor":3.1926},{"match_name":"Rankin Field April (ALL CLASSIFIER) Saturday USPSA","match_date":"2021-04-03","stage_classifiercode":"13-01","member_number":"A133685","first_name":"EFREN","last_name":"LIZARRAGA","classification":"U","division":"LIMITED","hit_factor":3.1907},{"match_name":"NHRPC - August 2016 USPSA","match_date":"2016-08-14","stage_classifiercode":"13-01","member_number":"\"\"","first_name":"ERIC","last_name":"LOFURNO","classification":"U","division":"LIMITED","hit_factor":3.1907},{"match_name":"SAPSC USPSA CLASSIFIER MATCH AT AUTREYS ARMORY 04132021","match_date":"2021-04-13","stage_classifiercode":"13-01","member_number":"A115517","first_name":"CURT","last_name":"SIMMONS","classification":"C","division":"LIMITED","hit_factor":3.1858},{"match_name":"CVSC 12-31-2017","match_date":"2017-12-31","stage_classifiercode":"13-01","member_number":"\"\"","first_name":"JIM","last_name":"WILKERSON","classification":"U","division":"LIMITED","hit_factor":3.1853},{"match_name":"NTPS-SE February 2017","match_date":"2017-02-18","stage_classifiercode":"13-01","member_number":"A92579","first_name":"HOUSTON","last_name":"RUSSELL","classification":"U","division":"LIMITED","hit_factor":3.1847},{"match_name":"SLPSA May USPSA Match","match_date":"2020-05-16","stage_classifiercode":"13-01","member_number":"FY68897","first_name":"LEONARD","last_name":"DELEON","classification":"G","division":"LIMITED","hit_factor":3.1847},{"match_name":"SRAPS Amarillo Action July","match_date":"2016-07-23","stage_classifiercode":"13-01","member_number":"\"\"","first_name":"SCOTT","last_name":"KARCHER","classification":"\"\"","division":"LIMITED","hit_factor":3.1834},{"match_name":"OPSC USPSA 7-10-2016","match_date":"2016-07-10","stage_classifiercode":"13-01","member_number":"A238041","first_name":"MICHAEL","last_name":"PRETE","classification":"U","division":"LIMITED","hit_factor":3.1792},{"match_name":"GRB USPSA SEPTEMBER 2021 AT CAVALIER","match_date":"2021-09-18","stage_classifiercode":"13-01","member_number":"A45556","first_name":"SHANNON","last_name":"CAMPBELL","classification":"M","division":"LIMITED","hit_factor":3.1782},{"match_name":"Blackstone Shooting Sports Snow Days January 2017 USPSA Level  1","match_date":"2017-01-08","stage_classifiercode":"13-01","member_number":"L1613","first_name":"MIKE","last_name":"LOY","classification":"C","division":"LIMITED","hit_factor":3.178},{"match_name":"Idaho ISPS August 4th 2018","match_date":"2018-08-04","stage_classifiercode":"13-01","member_number":"A98645","first_name":"JIM","last_name":"BUXTON","classification":"D","division":"LIMITED","hit_factor":3.1767},{"match_name":"SEPSA June 2016","match_date":"2016-06-11","stage_classifiercode":"13-01","member_number":"A36737","first_name":"NEBRASKA","last_name":"MOORE","classification":"C","division":"LIMITED","hit_factor":3.1765},{"match_name":"MCRC USPSA October 2018","match_date":"2018-10-13","stage_classifiercode":"13-01","member_number":"A63611","first_name":"DIANA","last_name":"ADAMS","classification":"B","division":"LIMITED","hit_factor":3.176},{"match_name":"PSAC_20170527","match_date":"2017-05-27","stage_classifiercode":"13-01","member_number":"TY59441","first_name":"JOEY","last_name":"MIZUFUKA","classification":"C","division":"LIMITED","hit_factor":3.1726},{"match_name":"PRG Pistol Match 5 Feb 2017","match_date":"2017-02-04","stage_classifiercode":"13-01","member_number":"\"\"","first_name":"COLBY","last_name":"COOKSON","classification":"U","division":"LIMITED","hit_factor":3.1724},{"match_name":"CCC Shooting Complex February 2017","match_date":"2017-02-05","stage_classifiercode":"13-01","member_number":"\"\"","first_name":"BEN","last_name":"KILGORE","classification":"U","division":"LIMITED","hit_factor":3.1688},{"match_name":"SPSA USPSA October 1st Sat Match","match_date":"2020-10-03","stage_classifiercode":"13-01","member_number":"A71464","first_name":"LIZA","last_name":"DAMPAC","classification":"U","division":"LIMITED","hit_factor":3.168},{"match_name":"Trigger Guard USPSA","match_date":"2016-04-02","stage_classifiercode":"13-01","member_number":"A-95083","first_name":"SHAWN","last_name":"MCGROGAN","classification":"U","division":"LIMITED","hit_factor":3.1634},{"match_name":"SPSA USPSA October 1st Sat Match","match_date":"2020-10-03","stage_classifiercode":"13-01","member_number":"A22910","first_name":"STEVEN","last_name":"ALEXANDER","classification":"B","division":"LIMITED","hit_factor":3.163},{"match_name":"SLPSA Feb USPSA","match_date":"2018-02-17","stage_classifiercode":"13-01","member_number":"A107821","first_name":"RYAN","last_name":"VANBEEKUM","classification":"U","division":"LIMITED","hit_factor":3.1579},{"match_name":"Clinton County USPSA","match_date":"2016-03-26","stage_classifiercode":"13-01","member_number":"\"\"","first_name":"WALTER","last_name":"BIENIEK","classification":"C","division":"LIMITED","hit_factor":3.1536},{"match_name":"Superior Practical Shooters June 2018 Match","match_date":"2018-06-06","stage_classifiercode":"13-01","member_number":"\"\"","first_name":"JEFFREY","last_name":"JACOB","classification":"U","division":"LIMITED","hit_factor":3.1508},{"match_name":"BORCC USPSA July 2018 Classifier Match","match_date":"2018-07-02","stage_classifiercode":"13-01","member_number":"TY112945","first_name":"NICHOLAS","last_name":"HARIG","classification":"U","division":"LIMITED","hit_factor":3.1504},{"match_name":"FAS  Sunday USPSA","match_date":"2018-11-04","stage_classifiercode":"13-01","member_number":"TY86191","first_name":"KEN","last_name":"TANNER","classification":"D","division":"LIMITED","hit_factor":3.1496},{"match_name":"RDS Aug 52017 USPSA  Match","match_date":"2017-08-05","stage_classifiercode":"13-01","member_number":"A104758","first_name":"DANIEL","last_name":"RASMUSSEN","classification":"U","division":"LIMITED","hit_factor":3.1487},{"match_name":"SCCCApril2017","match_date":"2017-04-09","stage_classifiercode":"13-01","member_number":"\"\"","first_name":"TIMMAH","last_name":"MEKOSH","classification":"G","division":"LIMITED","hit_factor":3.1469},{"match_name":"12a Fecha USPSA","match_date":"2017-11-12","stage_classifiercode":"13-01","member_number":"\"\"","first_name":"BRYAN","last_name":"RAMOS HERNANDEZ","classification":"U","division":"LIMITED","hit_factor":3.1447},{"match_name":"PCWC USPSA  7 23 2016","match_date":"2016-07-23","stage_classifiercode":"13-01","member_number":"A65896","first_name":"JON","last_name":"YOUNG","classification":"B","division":"LIMITED","hit_factor":3.1441},{"match_name":"CCC Shooting Complex September 2016","match_date":"2016-09-03","stage_classifiercode":"13-01","member_number":"\"\"","first_name":"BENSON","last_name":"KILGORE","classification":"D","division":"LIMITED","hit_factor":3.1437},{"match_name":"Applied IN25 USPSA April Classifier 2018","match_date":"2018-04-17","stage_classifiercode":"13-01","member_number":"A101157","first_name":"LEIF","last_name":"OBRIEN","classification":"C","division":"LIMITED","hit_factor":3.1409},{"match_name":"DSC September 2016","match_date":"2016-09-18","stage_classifiercode":"13-01","member_number":"TY76993","first_name":"ROBERT","last_name":"REILLY","classification":"C","division":"LIMITED","hit_factor":3.1395},{"match_name":"North East Ohio Shooters - OHN06 - 2017-06-24","match_date":"2017-06-24","stage_classifiercode":"13-01","member_number":"A81237","first_name":"PAUL","last_name":"PITZ","classification":"C","division":"LIMITED","hit_factor":3.1394},{"match_name":"Gem City Gun Club 1-04 and 1-05 2020","match_date":"2020-01-04","stage_classifiercode":"13-01","member_number":"A118149","first_name":"CRAIG","last_name":"WOLLAND","classification":"D","division":"LIMITED","hit_factor":3.1383},{"match_name":"Rio Grande Practical Shooters - February 2017","match_date":"2017-02-04","stage_classifiercode":"13-01","member_number":"A95944","first_name":"REBECCA","last_name":"IVEY","classification":"D","division":"LIMITED","hit_factor":3.1382},{"match_name":"ORPCI 2018.03.31 USPSA Special","match_date":"2018-03-31","stage_classifiercode":"13-01","member_number":"A109981","first_name":"PETE","last_name":"TOFANI","classification":"U","division":"LIMITED","hit_factor":3.1368},{"match_name":"17s PSC - USPSA - July 2020","match_date":"2020-07-18","stage_classifiercode":"13-01","member_number":"TY120573","first_name":"JORDAN","last_name":"MARTINELLI","classification":"\"\"","division":"LIMITED","hit_factor":3.1365},{"match_name":"TBAS USPSA Match 1/26/2020","match_date":"2020-01-26","stage_classifiercode":"13-01","member_number":"A92288","first_name":"JUSTIN","last_name":"BERRY","classification":"B","division":"LIMITED","hit_factor":3.1328},{"match_name":"ISPS Nov 5th 2016","match_date":"2016-11-05","stage_classifiercode":"13-01","member_number":"A87660","first_name":"ARIC","last_name":"TENEYCK","classification":"D","division":"LIMITED","hit_factor":3.1311},{"match_name":"PGC USPSA  Practice Match 11-28-17","match_date":"2017-11-28","stage_classifiercode":"13-01","member_number":"A89378","first_name":"MICHAEL","last_name":"WRIGHT","classification":"D","division":"LIMITED","hit_factor":3.1309},{"match_name":"PRSC GP6 March 2018","match_date":"2018-03-11","stage_classifiercode":"13-01","member_number":"TY91316","first_name":"TODD","last_name":"ADKISSON","classification":"B","division":"LIMITED","hit_factor":3.129},{"match_name":"Grandbaggers September 2017","match_date":"2017-09-07","stage_classifiercode":"13-01","member_number":"A104122","first_name":"LEONARD","last_name":"BACA","classification":"C","division":"LIMITED","hit_factor":3.1289},{"match_name":"USPSA Basics 25MAY2021","match_date":"2021-05-25","stage_classifiercode":"13-01","member_number":"A126609","first_name":"ED","last_name":"BONAWITZ","classification":"D","division":"LIMITED","hit_factor":3.1278},{"match_name":"Competitive Shooters of Lake Norman CORNELIUS Thursday Evening Indoor USPSA Pistol Match North Carolina","match_date":"2018-04-05","stage_classifiercode":"13-01","member_number":"A98932","first_name":"BILL","last_name":"HOWARD","classification":"D","division":"LIMITED","hit_factor":3.125},{"match_name":"DAPS USPSA at ETTS 4-8-2017","match_date":"2017-04-08","stage_classifiercode":"13-01","member_number":"TY68247","first_name":"JACALYN","last_name":"SCHROEDER","classification":"C","division":"LIMITED","hit_factor":3.1226},{"match_name":"SUPS USPSA 5/7/2016","match_date":"2016-05-07","stage_classifiercode":"13-01","member_number":"TY79826","first_name":"CHRIS","last_name":"BAIN","classification":"B","division":"LIMITED","hit_factor":3.1222},{"match_name":"JCSSA NOV 7 2020","match_date":"2020-11-07","stage_classifiercode":"13-01","member_number":"A","first_name":"MARK","last_name":"SWANSON","classification":"U","division":"LIMITED","hit_factor":3.12},{"match_name":"USPSA MO21 2Alpha SBRC April 25 2020","match_date":"2020-04-25","stage_classifiercode":"13-01","member_number":"A115575","first_name":"DYLAN","last_name":"HARPER","classification":"B","division":"LIMITED","hit_factor":3.1183},{"match_name":"BUAS November Match","match_date":"2018-11-04","stage_classifiercode":"13-01","member_number":"l4262","first_name":"STEWART","last_name":"GINSBERG","classification":"C","division":"LIMITED","hit_factor":3.1106},{"match_name":"PSAC_20170527","match_date":"2017-05-27","stage_classifiercode":"13-01","member_number":"A98203","first_name":"ROGER","last_name":"OBERLE","classification":"C","division":"LIMITED","hit_factor":3.1103},{"match_name":"17s PSC - USPSA - July 2020","match_date":"2020-07-18","stage_classifiercode":"13-01","member_number":"L4036","first_name":"MARK","last_name":"COMPTON","classification":"C","division":"LIMITED","hit_factor":3.1102},{"match_name":"Patriot Action Shooters December 2015 Match","match_date":"2015-12-19","stage_classifiercode":"13-01","member_number":"A93848","first_name":"CASEY","last_name":"BROWN","classification":"U","division":"LIMITED","hit_factor":3.1056},{"match_name":"Green Valley September 2016","match_date":"2016-09-24","stage_classifiercode":"13-01","member_number":"A98835","first_name":"CHARLES","last_name":"TURNER","classification":"U","division":"LIMITED","hit_factor":3.1025},{"match_name":"ORPCI 2018.03.31 USPSA Special","match_date":"2018-03-31","stage_classifiercode":"13-01","member_number":"\"\"","first_name":"STEVE","last_name":"WHITE","classification":"\"\"","division":"LIMITED","hit_factor":3.1019},{"match_name":"BRC_20160313","match_date":"2016-03-13","stage_classifiercode":"13-01","member_number":"A86863","first_name":"CINDI","last_name":"MARTIN","classification":"D","division":"LIMITED","hit_factor":3.1008},{"match_name":"RCPS USPSA 9 Jan 2016 Special Classifier Match","match_date":"2016-01-09","stage_classifiercode":"13-01","member_number":"TY82184","first_name":"HANK","last_name":"PERKINS","classification":"D","division":"LIMITED","hit_factor":3.1008},{"match_name":"ASPS MI20 August Hot Barrels","match_date":"2020-08-15","stage_classifiercode":"13-01","member_number":"ty88543","first_name":"TERRY","last_name":"TATARCHUK","classification":"C","division":"LIMITED","hit_factor":3.0996},{"match_name":"2da Copa Nacional USPSA ","match_date":"2016-05-22","stage_classifiercode":"13-01","member_number":"\"\"","first_name":"NESTOR A.","last_name":"FLORES ACOSTA","classification":"U","division":"LIMITED","hit_factor":3.0988},{"match_name":"Pinetucky USPSA 12-17-16","match_date":"2016-12-17","stage_classifiercode":"13-01","member_number":"A69714","first_name":"MARK","last_name":"GAINEY","classification":"C","division":"LIMITED","hit_factor":3.0988},{"match_name":"BRC_20160313","match_date":"2016-03-13","stage_classifiercode":"13-01","member_number":"A87194","first_name":"GARRETT","last_name":"MCKIERNAN","classification":"D","division":"LIMITED","hit_factor":3.0986},{"match_name":"FBURG March 2017 Level I USPSA ","match_date":"2017-03-04","stage_classifiercode":"13-01","member_number":"\"\"","first_name":"SASHA","last_name":"DUKIC","classification":"U","division":"LIMITED","hit_factor":3.0968},{"match_name":"8a Fecha USPSA Classifier","match_date":"2018-08-12","stage_classifiercode":"13-01","member_number":"TY99726","first_name":"BERNARDO","last_name":"BRAVO-ACOSTA","classification":"C","division":"LIMITED","hit_factor":3.0952},{"match_name":"INAS Dec 2016 USPSA","match_date":"2016-12-17","stage_classifiercode":"13-01","member_number":"\"\"","first_name":"JOHN A","last_name":"HAMILL","classification":"U","division":"LIMITED","hit_factor":3.0928},{"match_name":"MVPSA USPSA 5-15-2020 League 1","match_date":"2020-05-15","stage_classifiercode":"13-01","member_number":"TY108723","first_name":"MERRIDITH","last_name":"JOHNSTON","classification":"U","division":"LIMITED","hit_factor":3.0901},{"match_name":"NRG December 10th 2016","match_date":"2016-12-10","stage_classifiercode":"13-01","member_number":"A98858","first_name":"ORVIELLE","last_name":"ENRIQUEZ","classification":"U","division":"LIMITED","hit_factor":3.0899},{"match_name":"COPS Jan 2016 USPSA Match","match_date":"2016-01-03","stage_classifiercode":"13-01","member_number":"A82858","first_name":"RICHARD","last_name":"ZARCONE","classification":"D","division":"LIMITED","hit_factor":3.0894},{"match_name":"SCCCApril2017","match_date":"2017-04-09","stage_classifiercode":"13-01","member_number":"\"\"","first_name":"CLAUDE","last_name":"PUTNAM","classification":"U","division":"LIMITED","hit_factor":3.0883},{"match_name":"RCPS USPSA August 11","match_date":"2018-08-11","stage_classifiercode":"13-01","member_number":"TY99669","first_name":"STEPHEN","last_name":"COUNCIL","classification":"D","division":"LIMITED","hit_factor":3.0872},{"match_name":"Danville Rifle And Pistol Club USPSA Classifier Match","match_date":"2017-11-11","stage_classifiercode":"13-01","member_number":"\"\"","first_name":"RAY","last_name":"STORM","classification":"U","division":"LIMITED","hit_factor":3.086},{"match_name":"SPSA USPSA October 1st Sat Match","match_date":"2020-10-03","stage_classifiercode":"13-01","member_number":"TY79557","first_name":"DAVE","last_name":"PAYNE","classification":"C","division":"LIMITED","hit_factor":3.086},{"match_name":"Bitterroot Blasters March Club Match","match_date":"2016-03-26","stage_classifiercode":"13-01","member_number":"\"\"","first_name":"RAY","last_name":"MCBRIDE","classification":"G","division":"LIMITED","hit_factor":3.0852},{"match_name":"NRG December 10th 2016","match_date":"2016-12-10","stage_classifiercode":"13-01","member_number":"A63645","first_name":"CHARLES","last_name":"YOUNG","classification":"B","division":"LIMITED","hit_factor":3.0837},{"match_name":"CTASA 3rd Sunday USPSA at Triple C Tactical - 7-15-2018","match_date":"2018-07-15","stage_classifiercode":"13-01","member_number":"\"\"","first_name":"JEREMY","last_name":"HILL","classification":"U","division":"LIMITED","hit_factor":3.0812},{"match_name":"MVPSA USPSA 5-15-2020 League 1","match_date":"2020-05-15","stage_classifiercode":"13-01","member_number":"A103631","first_name":"MIKE","last_name":"COOPER","classification":"B","division":"LIMITED","hit_factor":3.081},{"match_name":"SCCCApril2017","match_date":"2017-04-09","stage_classifiercode":"13-01","member_number":"a101215","first_name":"TANNER","last_name":"FOLEY","classification":"U","division":"LIMITED","hit_factor":3.0793},{"match_name":"Havana May 7 2016 USPSA Match","match_date":"2016-05-07","stage_classifiercode":"13-01","member_number":"FY69201","first_name":"LOUIS","last_name":"BRAGHINI","classification":"B","division":"LIMITED","hit_factor":3.0786},{"match_name":"RCPS USPSA 9 Jan 2016 Special Classifier Match","match_date":"2016-01-09","stage_classifiercode":"13-01","member_number":"PEN","first_name":"MATT","last_name":"COWAN","classification":"U","division":"LIMITED","hit_factor":3.078},{"match_name":"Renton USPSA May 2018 - NW05","match_date":"2018-05-27","stage_classifiercode":"13-01","member_number":"a352305","first_name":"BRIAN","last_name":"ROWE","classification":"U","division":"LIMITED","hit_factor":3.0769},{"match_name":"Lafayette Practical Shooters - CLASSIFIER MATCH - May 30-31","match_date":"2018-05-30","stage_classifiercode":"13-01","member_number":"A109966","first_name":"MARC","last_name":"CHAISSON","classification":"U","division":"LIMITED","hit_factor":3.0731},{"match_name":"SWGC USPSA Pistol Match - February 2021","match_date":"2021-02-06","stage_classifiercode":"13-01","member_number":"TY71997","first_name":"JIMMIE","last_name":"HONEYCUTT","classification":"C","division":"LIMITED","hit_factor":3.0729},{"match_name":"TCSC USPSA Level I September club match","match_date":"2020-09-27","stage_classifiercode":"13-01","member_number":"TY105682","first_name":"STEPHEN","last_name":"ZINK","classification":"C","division":"LIMITED","hit_factor":3.0708},{"match_name":"INAS Dec 2016 USPSA","match_date":"2016-12-17","stage_classifiercode":"13-01","member_number":"TY69078","first_name":"LORI","last_name":"COOK","classification":"C","division":"LIMITED","hit_factor":3.0683},{"match_name":"BRRC GAS USPSA MAY 12 2018","match_date":"2018-05-12","stage_classifiercode":"13-01","member_number":"A92132","first_name":"JIM","last_name":"WHITE","classification":"C","division":"LIMITED","hit_factor":3.068},{"match_name":"COPS Jan 2016 USPSA Match","match_date":"2016-01-03","stage_classifiercode":"13-01","member_number":"TY-94033","first_name":"BRYAN","last_name":"WILLIAMS","classification":"U","division":"LIMITED","hit_factor":3.0675},{"match_name":"COPS Jan 2016 USPSA Match","match_date":"2016-01-03","stage_classifiercode":"13-01","member_number":"\"\"","first_name":"CONNOR","last_name":"MALLOY","classification":"U","division":"LIMITED","hit_factor":3.0631},{"match_name":"PRG Pistol Match 5 Feb 2017","match_date":"2017-02-04","stage_classifiercode":"13-01","member_number":"\"\"","first_name":"DANTE","last_name":"CABELINO","classification":"U","division":"LIMITED","hit_factor":3.0612},{"match_name":"Afternoon SMPS 12 July 2020 USPSA Classifier Match","match_date":"2020-07-12","stage_classifiercode":"13-01","member_number":"FY102317","first_name":"PAUL","last_name":"EARP","classification":"C","division":"LIMITED","hit_factor":3.0594},{"match_name":"Bills Gun Shop Circle Pines December 3 2017","match_date":"2017-12-03","stage_classifiercode":"13-01","member_number":"\"\"","first_name":"MICHAEL","last_name":"DEZELAR","classification":"X","division":"LIMITED","hit_factor":3.0594},{"match_name":"TMGN December 2 USPSA Classifier Match","match_date":"2018-12-03","stage_classifiercode":"13-01","member_number":"A105655","first_name":"CHARLES","last_name":"PYE","classification":"U","division":"LIMITED","hit_factor":3.0552},{"match_name":"CGGR February USPSA Match","match_date":"2016-02-20","stage_classifiercode":"13-01","member_number":"A82170","first_name":"MIKE","last_name":"KEENAN","classification":"B","division":"LIMITED","hit_factor":3.0534},{"match_name":"INAS Dec 2016 USPSA","match_date":"2016-12-17","stage_classifiercode":"13-01","member_number":"A100023","first_name":"JUSTIN","last_name":"SCOTCH","classification":"U","division":"LIMITED","hit_factor":3.0534},{"match_name":"USPSA AR02 North Arkansas Action Pistol July 9 2017","match_date":"2017-07-09","stage_classifiercode":"13-01","member_number":"A101611","first_name":"BLAKE","last_name":"BOYD","classification":"D","division":"LIMITED","hit_factor":3.0527},{"match_name":"Clinton County USPSA","match_date":"2016-03-26","stage_classifiercode":"13-01","member_number":"\"\"","first_name":"JEFF","last_name":"JOHNSON","classification":"U","division":"LIMITED","hit_factor":3.0527},{"match_name":"SEPSA June 2016","match_date":"2016-06-11","stage_classifiercode":"13-01","member_number":"\"\"","first_name":"VEASNA","last_name":"HEM","classification":"U","division":"LIMITED","hit_factor":3.0526},{"match_name":"Rankin Field August Sunday USPSA","match_date":"2020-08-16","stage_classifiercode":"13-01","member_number":"FY96702","first_name":"BRUCE","last_name":"LE","classification":"B","division":"LIMITED","hit_factor":3.0513},{"match_name":"ORPCI 2016.03.19 Pistol","match_date":"2016-03-19","stage_classifiercode":"13-01","member_number":"\"\"","first_name":"GLENN","last_name":"WHITTEN","classification":"U","division":"LIMITED","hit_factor":3.0488},{"match_name":"FAS Special Saturday All Classifier Match","match_date":"2021-01-16","stage_classifiercode":"13-01","member_number":"A127580","first_name":"MATT","last_name":"REECE","classification":"C","division":"LIMITED","hit_factor":3.0488},{"match_name":"OKCGC USPSA Dec 2017 Match","match_date":"2017-12-02","stage_classifiercode":"13-01","member_number":"A106108","first_name":"JEFF","last_name":"WALKER","classification":"U","division":"LIMITED","hit_factor":3.0488},{"match_name":"FSA-USPSA-03-25-2018","match_date":"2018-03-25","stage_classifiercode":"13-01","member_number":"ty95610","first_name":"CHAD","last_name":"MOLL","classification":"B","division":"LIMITED","hit_factor":3.0481},{"match_name":"Feb 25th Marc-On  Classifier","match_date":"2018-02-25","stage_classifiercode":"13-01","member_number":"A108897","first_name":"RUSS","last_name":"COPELAND","classification":"\"\"","division":"LIMITED","hit_factor":3.0466},{"match_name":"Richmond Hot Shots November 17-18 USPSA Pistol Match","match_date":"2018-11-17","stage_classifiercode":"13-01","member_number":"A106623","first_name":"DAVID","last_name":"BRADY","classification":"C","division":"LIMITED","hit_factor":3.0462},{"match_name":"BUAS November Match","match_date":"2018-11-04","stage_classifiercode":"13-01","member_number":"ty78926","first_name":"ROBERT","last_name":"DZAMKO","classification":"C","division":"LIMITED","hit_factor":3.0443},{"match_name":"The Armory Indoor League","match_date":"2016-03-11","stage_classifiercode":"13-01","member_number":"\"\"","first_name":"MEGAN","last_name":"THOMAS","classification":"\"\"","division":"LIMITED","hit_factor":3.0422},{"match_name":"SPSA USPSA August 4th Sat match","match_date":"2016-08-27","stage_classifiercode":"13-01","member_number":"NONE","first_name":"MARK","last_name":"KLEIN","classification":"U","division":"LIMITED","hit_factor":3.0408},{"match_name":"RCSC USPSA 26 Feb 2017","match_date":"2017-02-26","stage_classifiercode":"13-01","member_number":"A67583","first_name":"JOHN","last_name":"HARRIS","classification":"C","division":"LIMITED","hit_factor":3.0403},{"match_name":"SLPSA Feb USPSA","match_date":"2018-02-17","stage_classifiercode":"13-01","member_number":"A100040","first_name":"KISA","last_name":"LIBBY","classification":"D","division":"LIMITED","hit_factor":3.0398},{"match_name":"2021-03 Bone Creek USPSA","match_date":"2021-03-07","stage_classifiercode":"13-01","member_number":"TY46953","first_name":"TOM","last_name":"KUMOROWSKI","classification":"B","division":"LIMITED","hit_factor":3.0392},{"match_name":"OKCGC USPSA Dec 2017 Match","match_date":"2017-12-02","stage_classifiercode":"13-01","member_number":"TY-94723","first_name":"ERIC","last_name":"HOWARD","classification":"C","division":"LIMITED","hit_factor":3.0392},{"match_name":"2018-08-04 USPSA at Phoenix Rod and Gun Club","match_date":"2018-08-04","stage_classifiercode":"13-01","member_number":"\"\"","first_name":"MIKE","last_name":"SCHROEDER","classification":"U","division":"LIMITED","hit_factor":3.035},{"match_name":"SLOSA Feburary 2016 USPSA","match_date":"2016-02-13","stage_classifiercode":"13-01","member_number":"ty42241","first_name":"CRAIG","last_name":"LOVERIDGE","classification":"C","division":"LIMITED","hit_factor":3.033},{"match_name":"WSPS SEPTEMBER 2017 USPSA MATCH","match_date":"2017-09-16","stage_classifiercode":"13-01","member_number":"TY101926","first_name":"MATTHEW","last_name":"CLAEYS","classification":"C","division":"LIMITED","hit_factor":3.0327},{"match_name":"BORCC USPSA Classifier Match February 2017","match_date":"2017-02-11","stage_classifiercode":"13-01","member_number":"A100521","first_name":"ZAQ","last_name":"WEAVER","classification":"C","division":"LIMITED","hit_factor":3.0303},{"match_name":"WELD ECO09 20180313","match_date":"2018-03-18","stage_classifiercode":"13-01","member_number":"TY71925","first_name":"LAUREN","last_name":"HORNER","classification":"A","division":"LIMITED","hit_factor":3.0303},{"match_name":"BRRC GAS USPSA MAY 12 2018","match_date":"2018-05-12","stage_classifiercode":"13-01","member_number":"L3186","first_name":"CHARLEY","last_name":"HORN","classification":"C","division":"LIMITED","hit_factor":3.0303},{"match_name":"Benton Gun Club-USPSA May27 2018 CLASIFIER","match_date":"2018-05-27","stage_classifiercode":"13-01","member_number":"A96080","first_name":"JAMES","last_name":"GREGORY","classification":"U","division":"LIMITED","hit_factor":3.0275},{"match_name":"SPSA USPSA August 4th Sat match","match_date":"2016-08-27","stage_classifiercode":"13-01","member_number":"A88693","first_name":"ANDY","last_name":"POTEAT","classification":"C","division":"LIMITED","hit_factor":3.0268},{"match_name":"TMGN December 2 USPSA Classifier Match","match_date":"2018-12-03","stage_classifiercode":"13-01","member_number":"A114874","first_name":"ADAM","last_name":"KOVATCH","classification":"U","division":"LIMITED","hit_factor":3.0186},{"match_name":"DWB - Deadwood Boys USPSA 03 June 2018","match_date":"2018-06-03","stage_classifiercode":"13-01","member_number":"\"\"","first_name":"ANGEL","last_name":"DE LEON","classification":"B","division":"LIMITED","hit_factor":3.0185},{"match_name":"SLPSA Feb USPSA","match_date":"2018-02-17","stage_classifiercode":"13-01","member_number":"TY90173","first_name":"BRIAN","last_name":"CHUNG","classification":"B","division":"LIMITED","hit_factor":3.0151},{"match_name":"WAC May 23rd (4th Sunday) - USPSA 6 Stage Match","match_date":"2021-05-23","stage_classifiercode":"13-01","member_number":"A131786","first_name":"ROBERT","last_name":"STROZ","classification":"U","division":"LIMITED","hit_factor":3.0116},{"match_name":"PTPC February 4th Classifier Match","match_date":"2018-02-04","stage_classifiercode":"13-01","member_number":"FY87295","first_name":"DAN","last_name":"REINEKING","classification":"C","division":"LIMITED","hit_factor":3.0095},{"match_name":"Brazosland Pistoleros August 20 2017","match_date":"2017-08-20","stage_classifiercode":"13-01","member_number":"A81359","first_name":"LAN","last_name":"NGUYEN","classification":"A","division":"LIMITED","hit_factor":3.0093},{"match_name":"New Holland USPSA - October 2016","match_date":"2016-10-09","stage_classifiercode":"13-01","member_number":"A97858","first_name":"DAMOND","last_name":"KLOC","classification":"U","division":"LIMITED","hit_factor":3.0069},{"match_name":"MCRC USPSA October 2018","match_date":"2018-10-13","stage_classifiercode":"13-01","member_number":"A94849","first_name":"KENT","last_name":"SILVERTHORN","classification":"C","division":"LIMITED","hit_factor":3.0068},{"match_name":"TMGN July 1st USPSA Match","match_date":"2018-07-01","stage_classifiercode":"13-01","member_number":"A68299","first_name":"ANDY","last_name":"CHOMOR","classification":"\"\"","division":"LIMITED","hit_factor":3.0052},{"match_name":"SLOSA Feburary 2016 USPSA","match_date":"2016-02-13","stage_classifiercode":"13-01","member_number":"A84565","first_name":"VINCENT","last_name":"PARSICK","classification":"D","division":"LIMITED","hit_factor":3.0043},{"match_name":"Clairton Apr 09; 2017","match_date":"2017-04-09","stage_classifiercode":"13-01","member_number":"\"\"","first_name":"JACK","last_name":"MIECKOWSKI","classification":"U","division":"LIMITED","hit_factor":3.0038},{"match_name":"SEPSA June 2016","match_date":"2016-06-11","stage_classifiercode":"13-01","member_number":"A88013","first_name":"CARLOS","last_name":"HERNANDEZ","classification":"D","division":"LIMITED","hit_factor":3.0025},{"match_name":"MVPSA Apr 72018","match_date":"2018-04-07","stage_classifiercode":"13-01","member_number":"A109802","first_name":"JARED","last_name":"FERREE","classification":"U","division":"LIMITED","hit_factor":2.9994},{"match_name":"OKCGC USPSA Dec 2016","match_date":"2016-12-03","stage_classifiercode":"13-01","member_number":"TY75066","first_name":"STEVE","last_name":"MCGINLEY","classification":"C","division":"LIMITED","hit_factor":2.9968},{"match_name":"Palmetto Gun Club - January 2016 USPSA","match_date":"2016-01-02","stage_classifiercode":"13-01","member_number":"TY70685","first_name":"JOHN","last_name":"RIDGEWAY","classification":"U","division":"LIMITED","hit_factor":2.9952},{"match_name":"GRPC USPSA SOME LIKE IT HOT","match_date":"2018-08-05","stage_classifiercode":"13-01","member_number":"A100573","first_name":"DAVID","last_name":"CHOW","classification":"C","division":"LIMITED","hit_factor":2.9949},{"match_name":"PAS April USPSA","match_date":"2018-04-21","stage_classifiercode":"13-01","member_number":"a101808","first_name":"TYLER","last_name":"SPINKS","classification":"U","division":"LIMITED","hit_factor":2.9936},{"match_name":"Applied IN25 USPSA October 2017 Classifier","match_date":"2017-10-18","stage_classifiercode":"13-01","member_number":"a-78635","first_name":"ROB","last_name":"MCGUIRE","classification":"U","division":"LIMITED","hit_factor":2.9935},{"match_name":"Griffin USPSA Match Sep 17 2016","match_date":"2016-09-17","stage_classifiercode":"13-01","member_number":"A-91622","first_name":"TOM","last_name":"LACKLEY","classification":"A","division":"LIMITED","hit_factor":2.9915},{"match_name":"Brazosland Pistoleros August 20 2017","match_date":"2017-08-20","stage_classifiercode":"13-01","member_number":"A77442","first_name":"MARY","last_name":"DUBUISSON","classification":"D","division":"LIMITED","hit_factor":2.989},{"match_name":"RDS Aug 52017 USPSA  Match","match_date":"2017-08-05","stage_classifiercode":"13-01","member_number":"TY93346","first_name":"GREG","last_name":"FANCHER","classification":"U","division":"LIMITED","hit_factor":2.9839},{"match_name":"FBURG March 2017 Level I USPSA ","match_date":"2017-03-04","stage_classifiercode":"13-01","member_number":"A81524","first_name":"TONY","last_name":"ROSENZWEIG","classification":"C","division":"LIMITED","hit_factor":2.9836},{"match_name":"WTPS USPSA April Classifier Match 4-8-17","match_date":"2017-04-08","stage_classifiercode":"13-01","member_number":"A101945","first_name":"VICENTE","last_name":"MARTINEZ","classification":"U","division":"LIMITED","hit_factor":2.9831},{"match_name":"NAAS 2018-01-21 Special Classifier Match","match_date":"2018-01-21","stage_classifiercode":"13-01","member_number":"A82809","first_name":"DAVID","last_name":"DARDEN","classification":"A","division":"LIMITED","hit_factor":2.983},{"match_name":"RMAP 3rd sunday August 2017","match_date":"2017-08-20","stage_classifiercode":"13-01","member_number":"L2970","first_name":"HARRIET S","last_name":"CARUTHERS","classification":"D","division":"LIMITED","hit_factor":2.9817},{"match_name":"NHRPC - August 2016 USPSA","match_date":"2016-08-14","stage_classifiercode":"13-01","member_number":"TY29481","first_name":"WILLIAM","last_name":"EVANS","classification":"C","division":"LIMITED","hit_factor":2.9815},{"match_name":"MSSA USPSA June  10 2017","match_date":"2017-06-10","stage_classifiercode":"13-01","member_number":"\"\"","first_name":"DUSTIN","last_name":"HERRINGTON","classification":"U","division":"LIMITED","hit_factor":2.9815},{"match_name":"RCSC USPSA 26 Feb 2017","match_date":"2017-02-26","stage_classifiercode":"13-01","member_number":"PEND","first_name":"GABE","last_name":"MONREAL","classification":"U","division":"LIMITED","hit_factor":2.977},{"match_name":"DSS - USPSA 18-03-24","match_date":"2018-03-24","stage_classifiercode":"13-01","member_number":"A108215","first_name":"GARY","last_name":"SPIKOWSKI","classification":"U","division":"LIMITED","hit_factor":2.9713},{"match_name":"Applied USPSA Nov/2016","match_date":"2016-11-15","stage_classifiercode":"13-01","member_number":"L4004","first_name":"AARON","last_name":"LORTON","classification":"C","division":"LIMITED","hit_factor":2.9703},{"match_name":"Armory Indoor League","match_date":"2017-08-17","stage_classifiercode":"13-01","member_number":"A87110","first_name":"ERIK","last_name":"SEO","classification":"B","division":"LIMITED","hit_factor":2.9691},{"match_name":"NOCPC Aug 2018","match_date":"2018-08-12","stage_classifiercode":"13-01","member_number":"A92820","first_name":"JEFF","last_name":"PUGH","classification":"C","division":"LIMITED","hit_factor":2.9691},{"match_name":"DAPS USPSA at ETTS 4-8-2017","match_date":"2017-04-08","stage_classifiercode":"13-01","member_number":"A99121","first_name":"JARED","last_name":"NOBLE","classification":"U","division":"LIMITED","hit_factor":2.9683},{"match_name":"NRG December 10th 2016","match_date":"2016-12-10","stage_classifiercode":"13-01","member_number":"TY45256","first_name":"GORDON","last_name":"CAMERON","classification":"B","division":"LIMITED","hit_factor":2.9611},{"match_name":"TCGC April 2018","match_date":"2018-04-29","stage_classifiercode":"13-01","member_number":"A106700","first_name":"JASON","last_name":"MILLER","classification":"D","division":"LIMITED","hit_factor":2.9601},{"match_name":"PCWC USPSA  9-25-2021","match_date":"2021-09-25","stage_classifiercode":"13-01","member_number":"TY93982","first_name":"TOM","last_name":"HORNER","classification":"D","division":"LIMITED","hit_factor":2.9598},{"match_name":"FAS  Sunday USPSA","match_date":"2018-11-04","stage_classifiercode":"13-01","member_number":"A99966","first_name":"LAURA","last_name":"CATALANO","classification":"D","division":"LIMITED","hit_factor":2.9596},{"match_name":"12a Fecha USPSA","match_date":"2017-11-12","stage_classifiercode":"13-01","member_number":"A92864","first_name":"EDWIN","last_name":"PEREZ","classification":"U","division":"LIMITED","hit_factor":2.9543},{"match_name":"12a Fecha USPSA","match_date":"2017-11-12","stage_classifiercode":"13-01","member_number":"\"\"","first_name":"JAVIER","last_name":"JIMENEZ-VAZQUEZ","classification":"U","division":"LIMITED","hit_factor":2.9532},{"match_name":"LTD Pistol - May 2017","match_date":"2017-05-06","stage_classifiercode":"13-01","member_number":"\"\"","first_name":"JESSE","last_name":"COLLINS","classification":"U","division":"LIMITED","hit_factor":2.9499},{"match_name":"Briar Rabbit April 2021","match_date":"2021-04-25","stage_classifiercode":"13-01","member_number":"TY101227","first_name":"ALYSSA","last_name":"GERACI","classification":"D","division":"LIMITED","hit_factor":2.9486},{"match_name":"COPS Jan 2016 USPSA Match","match_date":"2016-01-03","stage_classifiercode":"13-01","member_number":"A59509","first_name":"J.J.","last_name":"BRADSHAW","classification":"C","division":"LIMITED","hit_factor":2.9459},{"match_name":"PCWC USPSA  9-25-2021","match_date":"2021-09-25","stage_classifiercode":"13-01","member_number":"Ty63839","first_name":"BEN","last_name":"SMITH","classification":"C","division":"LIMITED","hit_factor":2.9412},{"match_name":"Applied IN25 USPSA October 2017 Classifier","match_date":"2017-10-18","stage_classifiercode":"13-01","member_number":"A101691","first_name":"JEFF","last_name":"COOMER","classification":"D","division":"LIMITED","hit_factor":2.9412},{"match_name":"BRSP Tuesday Night USPSA Match - Aug 14","match_date":"2018-08-15","stage_classifiercode":"13-01","member_number":"A96203","first_name":"GENE","last_name":"VANNI","classification":"C","division":"LIMITED","hit_factor":2.9412},{"match_name":"PCWC USPSA  9 22 2018","match_date":"2018-09-22","stage_classifiercode":"13-01","member_number":"A113052","first_name":"NICOLE","last_name":"WESSELL","classification":"U","division":"LIMITED","hit_factor":2.9374},{"match_name":"ENPS April USPSA Match","match_date":"2017-04-02","stage_classifiercode":"13-01","member_number":"PEN","first_name":"ALEX","last_name":"STOVER","classification":"U","division":"LIMITED","hit_factor":2.9367},{"match_name":"PSAC_20170527","match_date":"2017-05-27","stage_classifiercode":"13-01","member_number":"A96319","first_name":"CHRIS","last_name":"MEEKER","classification":"C","division":"LIMITED","hit_factor":2.9348},{"match_name":"CGGR February USPSA Match","match_date":"2016-02-20","stage_classifiercode":"13-01","member_number":"L3402","first_name":"ANDREW","last_name":"WALKER","classification":"C","division":"LIMITED","hit_factor":2.9338},{"match_name":"NRG Saturday January 13th - Includes a Classifier Stage","match_date":"2018-01-13","stage_classifiercode":"13-01","member_number":"TY45256","first_name":"GORDON","last_name":"CAMERON","classification":"B","division":"LIMITED","hit_factor":2.9297},{"match_name":"May 2018 at MPSA","match_date":"2018-05-27","stage_classifiercode":"13-01","member_number":"FY93729","first_name":"ROBERT","last_name":"FANJOY","classification":"C","division":"LIMITED","hit_factor":2.9294},{"match_name":"USPSA Bass River October 2017","match_date":"2017-10-01","stage_classifiercode":"13-01","member_number":"TY29024","first_name":"RAY","last_name":"GOGUEN","classification":"\"\"","division":"LIMITED","hit_factor":2.9289},{"match_name":"CCC Shooting Complex February 2017","match_date":"2017-02-05","stage_classifiercode":"13-01","member_number":"\"\"","first_name":"BOB","last_name":"BUCKBEE","classification":"U","division":"LIMITED","hit_factor":2.9279},{"match_name":"CGC CTX02 Monthly USPSA Match - March 2021","match_date":"2021-03-21","stage_classifiercode":"13-01","member_number":"A53155","first_name":"JEROME","last_name":"HARGUS","classification":"B","division":"LIMITED","hit_factor":2.9248},{"match_name":"Triforce Practical Shooters at BigWoodsGoods 3-23-17","match_date":"2017-03-23","stage_classifiercode":"13-01","member_number":"A84201","first_name":"ZANE","last_name":"RUTLEDGE","classification":"B","division":"LIMITED","hit_factor":2.9246},{"match_name":"ORPCI 2018.03.31 USPSA Special","match_date":"2018-03-31","stage_classifiercode":"13-01","member_number":"\"\"","first_name":"COLT","last_name":"MULLIS","classification":"\"\"","division":"LIMITED","hit_factor":2.9245},{"match_name":"Green Valley September 2016","match_date":"2016-09-24","stage_classifiercode":"13-01","member_number":"TY60255","first_name":"FLOYD","last_name":"BAKER","classification":"C","division":"LIMITED","hit_factor":2.9229},{"match_name":"PCSI - August 2017 USPSA","match_date":"2017-08-05","stage_classifiercode":"13-01","member_number":"FY85560","first_name":"TJ","last_name":"CHEONG","classification":"B","division":"LIMITED","hit_factor":2.9216},{"match_name":"BPSA January 2017 USPSA","match_date":"2017-01-22","stage_classifiercode":"13-01","member_number":"A98482","first_name":"AARON","last_name":"FITZGERALD","classification":"U","division":"LIMITED","hit_factor":2.9197},{"match_name":"Shongum February 2017 USPSA Match","match_date":"2017-02-04","stage_classifiercode":"13-01","member_number":"A98580","first_name":"JASON","last_name":"SENDELSKY","classification":"U","division":"LIMITED","hit_factor":2.9188},{"match_name":"Bitterroot Blasters March Club Match","match_date":"2016-03-26","stage_classifiercode":"13-01","member_number":"A91993","first_name":"KATIE","last_name":"MOROZUMI","classification":"U","division":"LIMITED","hit_factor":2.9183},{"match_name":"LTD Pistol - May 2017","match_date":"2017-05-06","stage_classifiercode":"13-01","member_number":"TY73467","first_name":"JEREMY","last_name":"ALLEN","classification":"B","division":"LIMITED","hit_factor":2.9178},{"match_name":"LTD Pistol - May 2017","match_date":"2017-05-06","stage_classifiercode":"13-01","member_number":"TY86297","first_name":"RICHARD","last_name":"PINGEL","classification":"D","division":"LIMITED","hit_factor":2.9133},{"match_name":"ISPS January Impact","match_date":"2016-01-27","stage_classifiercode":"13-01","member_number":"\"\"","first_name":"CHARLES","last_name":"ANDERSON","classification":"U","division":"LIMITED","hit_factor":2.9088},{"match_name":"CRAG USPSA 6-13-2020","match_date":"2020-06-13","stage_classifiercode":"13-01","member_number":"A106855","first_name":"JAMIE","last_name":"JARVIS","classification":"C","division":"LIMITED","hit_factor":2.907},{"match_name":"12a Fecha USPSA","match_date":"2017-11-12","stage_classifiercode":"13-01","member_number":"A99726","first_name":"BERNARDO","last_name":"BRAVO ACOSTA","classification":"D","division":"LIMITED","hit_factor":2.9053},{"match_name":"NHRPC - August 2016 USPSA","match_date":"2016-08-14","stage_classifiercode":"13-01","member_number":"a73983","first_name":"ALEX","last_name":"MACFARLANE","classification":"C","division":"LIMITED","hit_factor":2.9039},{"match_name":"BRSP Tuesday Night USPSA Match - Aug 14","match_date":"2018-08-15","stage_classifiercode":"13-01","member_number":"\"\"","first_name":"BRADLEY","last_name":"PETERSON","classification":"U","division":"LIMITED","hit_factor":2.9024},{"match_name":"OKCGC USPSA Dec 2016","match_date":"2016-12-03","stage_classifiercode":"13-01","member_number":"\"\"","first_name":"RICHARD E","last_name":"MEANS","classification":"\"\"","division":"LIMITED","hit_factor":2.9022},{"match_name":"Pioneer Action Shooters USPSA 5-23-21 Special Classifer","match_date":"2021-05-23","stage_classifiercode":"13-01","member_number":"A95430","first_name":"MARK","last_name":"WHITE","classification":"C","division":"LIMITED","hit_factor":2.9016},{"match_name":"Rio Salado UPPL May 2021","match_date":"2021-05-09","stage_classifiercode":"13-01","member_number":"A114949","first_name":"CLIF","last_name":"PATTEN","classification":"U","division":"LIMITED","hit_factor":2.8962},{"match_name":"FSTC  12-17-17","match_date":"2017-12-17","stage_classifiercode":"13-01","member_number":"\"\"","first_name":"TYLER","last_name":"HUFF","classification":"U","division":"LIMITED","hit_factor":2.8939},{"match_name":"Gem City Gun Club 1-04 and 1-05 2020","match_date":"2020-01-04","stage_classifiercode":"13-01","member_number":"A37984","first_name":"JEFF","last_name":"WALTERS","classification":"B","division":"LIMITED","hit_factor":2.8902},{"match_name":"Pinetucky USPSA 12-17-16","match_date":"2016-12-17","stage_classifiercode":"13-01","member_number":"TY61427","first_name":"MICHAEL","last_name":"NYLAND","classification":"B","division":"LIMITED","hit_factor":2.8896},{"match_name":"USPSA MO21 2Alpha SBRC April 25 2020","match_date":"2020-04-25","stage_classifiercode":"13-01","member_number":"TY109909","first_name":"SHAWN","last_name":"GARRISON","classification":"U","division":"LIMITED","hit_factor":2.8894},{"match_name":"APSC USPSA Match 08-04-18","match_date":"2018-08-04","stage_classifiercode":"13-01","member_number":"A62546","first_name":"DAVID","last_name":"PICKERING","classification":"U","division":"LIMITED","hit_factor":2.8881},{"match_name":"PRSC GP6 March 2018","match_date":"2018-03-11","stage_classifiercode":"13-01","member_number":"\"\"","first_name":"DANIEL","last_name":"NOLDA","classification":"C","division":"LIMITED","hit_factor":2.8871},{"match_name":"SCCCApril2017","match_date":"2017-04-09","stage_classifiercode":"13-01","member_number":"ty59608","first_name":"KIMBERLY","last_name":"RUSS","classification":"C","division":"LIMITED","hit_factor":2.8846},{"match_name":"Palmetto Gun Club - January 2016 USPSA","match_date":"2016-01-02","stage_classifiercode":"13-01","member_number":"\"\"","first_name":"BRENT","last_name":"GUNN","classification":"U","division":"LIMITED","hit_factor":2.883},{"match_name":"DSC September 2016","match_date":"2016-09-18","stage_classifiercode":"13-01","member_number":"TY46160","first_name":"MARK","last_name":"JOYCE","classification":"C","division":"LIMITED","hit_factor":2.8816},{"match_name":"ASPS MI20 August Hot Barrels","match_date":"2020-08-15","stage_classifiercode":"13-01","member_number":"ty98394","first_name":"JIM","last_name":"MONFORTON","classification":"D","division":"LIMITED","hit_factor":2.8812},{"match_name":"April 2017 FOP 72 2 Gun","match_date":"2017-04-16","stage_classifiercode":"13-01","member_number":"A71639","first_name":"OMAR","last_name":"MUNOZ","classification":"X","division":"LIMITED","hit_factor":2.8789},{"match_name":"INAS Dec 2016 USPSA","match_date":"2016-12-17","stage_classifiercode":"13-01","member_number":"A81654","first_name":"JON E","last_name":"COLEMAN","classification":"U","division":"LIMITED","hit_factor":2.8777},{"match_name":"CVSC 12-31-2017","match_date":"2017-12-31","stage_classifiercode":"13-01","member_number":"\"\"","first_name":"NICK","last_name":"HARRISON","classification":"U","division":"LIMITED","hit_factor":2.8758},{"match_name":"PSAC_20170527","match_date":"2017-05-27","stage_classifiercode":"13-01","member_number":"A91485","first_name":"RYAN","last_name":"EMMITE","classification":"B","division":"LIMITED","hit_factor":2.8758},{"match_name":"Coastal Area Practical Shooters 4-28-18","match_date":"2018-04-28","stage_classifiercode":"13-01","member_number":"\"\"","first_name":"RICK","last_name":"PERRITT","classification":"U","division":"LIMITED","hit_factor":2.8743},{"match_name":"Patriot Action Shooters December 2015 Match","match_date":"2015-12-19","stage_classifiercode":"13-01","member_number":"PEN","first_name":"JEREMIAH","last_name":"ALDER","classification":"U","division":"LIMITED","hit_factor":2.8736},{"match_name":"MVPSA USPSA 5-15-2020 League 1","match_date":"2020-05-15","stage_classifiercode":"13-01","member_number":"A103631","first_name":"MIKE","last_name":"COOPER","classification":"B","division":"LIMITED","hit_factor":2.8736},{"match_name":"The Armory Indoor League","match_date":"2016-03-11","stage_classifiercode":"13-01","member_number":"\"\"","first_name":"JASON","last_name":"LUHR","classification":"\"\"","division":"LIMITED","hit_factor":2.8721},{"match_name":"WELD ECO09 20180617","match_date":"2018-06-17","stage_classifiercode":"13-01","member_number":"A98316","first_name":"DAVID","last_name":"HAY","classification":"C","division":"LIMITED","hit_factor":2.8721},{"match_name":"PCWC USPSA  7 23 2016","match_date":"2016-07-23","stage_classifiercode":"13-01","member_number":"PEN","first_name":"TOM","last_name":"MILLER","classification":"X","division":"LIMITED","hit_factor":2.8716},{"match_name":"IL 16 USPSA FEB 7 2016","match_date":"2016-02-07","stage_classifiercode":"13-01","member_number":"\"\"","first_name":"SCOTT","last_name":"MACK","classification":"X","division":"LIMITED","hit_factor":2.8708},{"match_name":"DAPS USPSA at ETTS 4-8-2017","match_date":"2017-04-08","stage_classifiercode":"13-01","member_number":"TY72510","first_name":"MICHAEL","last_name":"BATHON","classification":"C","division":"LIMITED","hit_factor":2.87},{"match_name":"MS06 Team Magnolia July 2017 USPSA Match","match_date":"2017-07-01","stage_classifiercode":"13-01","member_number":"FY39825","first_name":"BARBARA","last_name":"THIBODAUX","classification":"B","division":"LIMITED","hit_factor":2.8689},{"match_name":"Bitterroot Blasters March Club Match","match_date":"2016-03-26","stage_classifiercode":"13-01","member_number":"FY75569","first_name":"FRANK","last_name":"VELLA","classification":"D","division":"LIMITED","hit_factor":2.8682},{"match_name":"Pioneer Action Shooters USPSA 5-23-21 Special Classifer","match_date":"2021-05-23","stage_classifiercode":"13-01","member_number":"TY110881","first_name":"JOE","last_name":"STAGNER","classification":"U","division":"LIMITED","hit_factor":2.8668},{"match_name":"Crooked Creek Pistol League - July 2018","match_date":"2018-07-14","stage_classifiercode":"13-01","member_number":"A78482","first_name":"MICHAEL","last_name":"FRISKY","classification":"U","division":"LIMITED","hit_factor":2.8646},{"match_name":"TCGC April 2018","match_date":"2018-04-29","stage_classifiercode":"13-01","member_number":"A54665","first_name":"HAL","last_name":"LENNON","classification":"C","division":"LIMITED","hit_factor":2.8637},{"match_name":"SPSA USPSA October 1st Sat Match","match_date":"2020-10-03","stage_classifiercode":"13-01","member_number":"L3906","first_name":"ARIC","last_name":"COWART","classification":"B","division":"LIMITED","hit_factor":2.8634},{"match_name":"Applied USPSA Nov/2016","match_date":"2016-11-15","stage_classifiercode":"13-01","member_number":"\"\"","first_name":"LEIF","last_name":"O'BRIEN","classification":"\"\"","division":"LIMITED","hit_factor":2.863},{"match_name":"FAS Special Saturday All Classifier Match","match_date":"2021-01-16","stage_classifiercode":"13-01","member_number":"A115535","first_name":"RAMSEY","last_name":"GREENE","classification":"C","division":"LIMITED","hit_factor":2.862},{"match_name":"MVPSA USPSA 5-15-2020 League 1","match_date":"2020-05-15","stage_classifiercode":"13-01","member_number":"A127440","first_name":"AARON","last_name":"ANDAZOLA","classification":"U","division":"LIMITED","hit_factor":2.8604},{"match_name":"DWB - Deadwood Boys USPSA 03 June 2018","match_date":"2018-06-03","stage_classifiercode":"13-01","member_number":"A103264","first_name":"ALEXIS","last_name":"AFAGHI","classification":"C","division":"LIMITED","hit_factor":2.8596},{"match_name":"IL 16 USPSA FEB 7 2016","match_date":"2016-02-07","stage_classifiercode":"13-01","member_number":"\"\"","first_name":"PAUL","last_name":"GERKE","classification":"X","division":"LIMITED","hit_factor":2.8571},{"match_name":"MCRC USPSA October 2018","match_date":"2018-10-13","stage_classifiercode":"13-01","member_number":"FY78960","first_name":"TIM","last_name":"FRITZ","classification":"B","division":"LIMITED","hit_factor":2.8571},{"match_name":"17s PSC - USPSA - July 2020","match_date":"2020-07-18","stage_classifiercode":"13-01","member_number":"A129327","first_name":"DUSTIN","last_name":"BIDDLE","classification":"\"\"","division":"LIMITED","hit_factor":2.8552},{"match_name":"Springfield Tactical Shooters 10/05/2017","match_date":"2017-10-05","stage_classifiercode":"13-01","member_number":"\"\"","first_name":"RICK","last_name":"WENNEBORG","classification":"\"\"","division":"LIMITED","hit_factor":2.8551},{"match_name":"Crooked Creek Pistol League - July 2018","match_date":"2018-07-14","stage_classifiercode":"13-01","member_number":"\"\"","first_name":"RUSTY","last_name":"SHAFER","classification":"U","division":"LIMITED","hit_factor":2.8543},{"match_name":"Devil Dog USPSA Classifier Match-Saturday Session","match_date":"2018-03-10","stage_classifiercode":"13-01","member_number":"A87710","first_name":"JOE","last_name":"HESTER","classification":"U","division":"LIMITED","hit_factor":2.8539},{"match_name":"SFA USPSA AUGUST 2018","match_date":"2018-08-18","stage_classifiercode":"13-01","member_number":"A112183","first_name":"ANGEL","last_name":"BAUTISTA","classification":"U - I don't know and don't care","division":"LIMITED","hit_factor":2.8522},{"match_name":"Rankin Field Sunday USPSA","match_date":"2018-06-17","stage_classifiercode":"13-01","member_number":"\"\"","first_name":"GERARD","last_name":"MEDEIROS","classification":"D","division":"LIMITED","hit_factor":2.851},{"match_name":"ENPS April USPSA Match","match_date":"2017-04-02","stage_classifiercode":"13-01","member_number":"FY46314","first_name":"GARY","last_name":"SCHENAMAN","classification":"C","division":"LIMITED","hit_factor":2.8483},{"match_name":"IL 16 USPSA FEB 7 2016","match_date":"2016-02-07","stage_classifiercode":"13-01","member_number":"A92908","first_name":"DAVID","last_name":"BURNS","classification":"U","division":"LIMITED","hit_factor":2.8465},{"match_name":"Benton Gun Club-USPSA May27 2018 CLASIFIER","match_date":"2018-05-27","stage_classifiercode":"13-01","member_number":"\"\"","first_name":"CLAYTON","last_name":"ROBBINS","classification":"U","division":"LIMITED","hit_factor":2.8428},{"match_name":"ISPS Nov 5th 2016","match_date":"2016-11-05","stage_classifiercode":"13-01","member_number":"\"\"","first_name":"GARY","last_name":"HOERTKORN","classification":"U","division":"LIMITED","hit_factor":2.8424},{"match_name":"Clinton County USPSA","match_date":"2016-03-26","stage_classifiercode":"13-01","member_number":"\"\"","first_name":"MIKE","last_name":"WEST","classification":"B","division":"LIMITED","hit_factor":2.8353},{"match_name":"Pinetucky USPSA 12-17-16","match_date":"2016-12-17","stage_classifiercode":"13-01","member_number":"T93173","first_name":"CAROL","last_name":"CAMPBELL","classification":"D","division":"LIMITED","hit_factor":2.8335},{"match_name":"CCC Shooting Complex February 2017","match_date":"2017-02-05","stage_classifiercode":"13-01","member_number":"TY63502","first_name":"KIM  J","last_name":"MORRIS","classification":"C","division":"LIMITED","hit_factor":2.8309},{"match_name":"17s PSC - USPSA - July 2020","match_date":"2020-07-18","stage_classifiercode":"13-01","member_number":"A129136","first_name":"JOSHUA","last_name":"BUTCHER","classification":"\"\"","division":"LIMITED","hit_factor":2.8295},{"match_name":"MCRC USPSA October 2018","match_date":"2018-10-13","stage_classifiercode":"13-01","member_number":"TY58046","first_name":"PATRICK","last_name":"NOLAN","classification":"C","division":"LIMITED","hit_factor":2.8249},{"match_name":"A3G-APS August 5th USPSA Classifier Match","match_date":"2018-08-05","stage_classifiercode":"13-01","member_number":"A112303","first_name":"MICHAEL","last_name":"BERGER","classification":"U","division":"LIMITED","hit_factor":2.8207},{"match_name":"LRC USPSA   2017-03-15","match_date":"2017-03-15","stage_classifiercode":"13-01","member_number":"TY91830","first_name":"MIKE","last_name":"REAGAN","classification":"D","division":"LIMITED","hit_factor":2.8186},{"match_name":"Danville Rifle And Pistol Club USPSA Classifier Match","match_date":"2017-11-11","stage_classifiercode":"13-01","member_number":"A96810","first_name":"JASON","last_name":"PALMER","classification":"B","division":"LIMITED","hit_factor":2.8169},{"match_name":"Prescott 3rd Sunday USPSA 04-17-2016","match_date":"2016-04-17","stage_classifiercode":"13-01","member_number":"PEN","first_name":"CHRISTOPHER","last_name":"JOHNSON","classification":"U","division":"LIMITED","hit_factor":2.8157},{"match_name":"DAPS USPSA at ETTS 4-8-2017","match_date":"2017-04-08","stage_classifiercode":"13-01","member_number":"PENDING","first_name":"BRIAN","last_name":"SINGLETON","classification":"U","division":"LIMITED","hit_factor":2.8116},{"match_name":"RCSC USPSA 26 Feb 2017","match_date":"2017-02-26","stage_classifiercode":"13-01","member_number":"PEND","first_name":"VAL","last_name":"PENDON","classification":"M","division":"LIMITED","hit_factor":2.8056},{"match_name":"WELD ECO09 20180313","match_date":"2018-03-18","stage_classifiercode":"13-01","member_number":"\"\"","first_name":"ANDREW","last_name":"CLUBER","classification":"U","division":"LIMITED","hit_factor":2.8046},{"match_name":"CCC Shooting Complex February 2017","match_date":"2017-02-05","stage_classifiercode":"13-01","member_number":"\"\"","first_name":"BENSON","last_name":"KILGORE","classification":"D","division":"LIMITED","hit_factor":2.8044},{"match_name":"CCSC USPSA Match","match_date":"2021-07-10","stage_classifiercode":"13-01","member_number":"A127490","first_name":"JESSE","last_name":"MUTCHLER","classification":"C","division":"LIMITED","hit_factor":2.8037},{"match_name":"PCWC USPSA  9 22 2018","match_date":"2018-09-22","stage_classifiercode":"13-01","member_number":"A-95752","first_name":"PAYTON","last_name":"SAUTER","classification":"C","division":"LIMITED","hit_factor":2.8014},{"match_name":"MASTER BLASTERS & SSFGA USPSA - November","match_date":"2020-11-21","stage_classifiercode":"13-01","member_number":"A97999","first_name":"MIC","last_name":"KANE","classification":"D","division":"LIMITED","hit_factor":2.7981},{"match_name":"RangeMasters 4-28-2014","match_date":"2016-04-28","stage_classifiercode":"13-01","member_number":"\"\"","first_name":"JASON","last_name":"MITCHELL","classification":"B","division":"LIMITED","hit_factor":2.7979},{"match_name":"CCC Shooting Complex September 2016","match_date":"2016-09-03","stage_classifiercode":"13-01","member_number":"TY2227","first_name":"TOMMY","last_name":"TEAS","classification":"C","division":"LIMITED","hit_factor":2.7954},{"match_name":"OKCGC USPSA Dec 2016","match_date":"2016-12-03","stage_classifiercode":"13-01","member_number":"a91228","first_name":"DANNY","last_name":"KEEF","classification":"C","division":"LIMITED","hit_factor":2.7893},{"match_name":"Griffin USPSA Match Sep 17 2016","match_date":"2016-09-17","stage_classifiercode":"13-01","member_number":"TY87398","first_name":"PHIL","last_name":"DESOUZA","classification":"C","division":"LIMITED","hit_factor":2.7885},{"match_name":"DSS - USPSA - 2020 Club Championship","match_date":"2020-08-08","stage_classifiercode":"13-01","member_number":"A110232","first_name":"JAY","last_name":"COCHRAN","classification":"C","division":"LIMITED","hit_factor":2.7864},{"match_name":"5 Dogs April 2017 USPSA","match_date":"2017-04-02","stage_classifiercode":"13-01","member_number":"A473602","first_name":"JAYSON","last_name":"BRYAN","classification":"U","division":"LIMITED","hit_factor":2.7851},{"match_name":"SLPSA May USPSA Match","match_date":"2020-05-16","stage_classifiercode":"13-01","member_number":"A101002","first_name":"KURT","last_name":"HARDING","classification":"C","division":"LIMITED","hit_factor":2.7845},{"match_name":"Pinetucky USPSA 12-17-16","match_date":"2016-12-17","stage_classifiercode":"13-01","member_number":"A99812","first_name":"JONNEY","last_name":"GRUNNET","classification":"U","division":"LIMITED","hit_factor":2.7833},{"match_name":"2016-10 Bone Creek USPSA","match_date":"2016-10-02","stage_classifiercode":"13-01","member_number":"\"\"","first_name":"CHARLES","last_name":"SULLINS","classification":"U","division":"LIMITED","hit_factor":2.782},{"match_name":"Rankin Field Sunday USPSA","match_date":"2018-09-16","stage_classifiercode":"13-01","member_number":"\"\"","first_name":"CHRIS","last_name":"KIMES","classification":"A","division":"LIMITED","hit_factor":2.7805},{"match_name":"Feb 25th Marc-On  Classifier","match_date":"2018-02-25","stage_classifiercode":"13-01","member_number":"\"\"","first_name":"ZACH","last_name":"BUCK","classification":"\"\"","division":"LIMITED","hit_factor":2.7799},{"match_name":"Tropang Vegas All Classifier Match","match_date":"2021-07-11","stage_classifiercode":"13-01","member_number":"A131211","first_name":"JOSH","last_name":"BRAUN","classification":"C","division":"LIMITED","hit_factor":2.7778},{"match_name":"SLPSA May USPSA Match","match_date":"2020-05-16","stage_classifiercode":"13-01","member_number":"A123899","first_name":"JOHN","last_name":"GRIFFIN","classification":"U","division":"LIMITED","hit_factor":2.7778},{"match_name":"MVPSA June 2016 Points Match","match_date":"2016-06-04","stage_classifiercode":"13-01","member_number":"A89117","first_name":"FORREST","last_name":"ANDERSEN","classification":"U","division":"LIMITED","hit_factor":2.7725},{"match_name":"BORCC USPSA Classifier Match February 2017","match_date":"2017-02-11","stage_classifiercode":"13-01","member_number":"A100927","first_name":"DAVID","last_name":"FITZSTEPHENS","classification":"U","division":"LIMITED","hit_factor":2.7708},{"match_name":"RCPS USPSA 9 Jan 2016 Special Classifier Match","match_date":"2016-01-09","stage_classifiercode":"13-01","member_number":"PEN","first_name":"LANCE","last_name":"JOYNER","classification":"U","division":"LIMITED","hit_factor":2.7702},{"match_name":"New Holland USPSA - October 2016","match_date":"2016-10-09","stage_classifiercode":"13-01","member_number":"A88042","first_name":"DOUGLAS","last_name":"BOWER","classification":"C","division":"LIMITED","hit_factor":2.7685},{"match_name":"SLPSA Feb USPSA","match_date":"2018-02-17","stage_classifiercode":"13-01","member_number":"\"\"","first_name":"DANIEL","last_name":"HANSON","classification":"U","division":"LIMITED","hit_factor":2.7638},{"match_name":"8a Fecha USPSA Classifier","match_date":"2018-08-12","stage_classifiercode":"13-01","member_number":"\"\"","first_name":"DOMINGO","last_name":"PEREZ","classification":"U","division":"LIMITED","hit_factor":2.7621},{"match_name":"Grandbaggers September 2017","match_date":"2017-09-07","stage_classifiercode":"13-01","member_number":"A91293","first_name":"BRAD","last_name":"FULGHUM","classification":"D","division":"LIMITED","hit_factor":2.7613},{"match_name":"HOPS USPSA 071517","match_date":"2017-07-15","stage_classifiercode":"13-01","member_number":"A96196","first_name":"RICHARD","last_name":"LANNING","classification":"B","division":"LIMITED","hit_factor":2.761},{"match_name":"CCC Shooting Complex February 2017","match_date":"2017-02-05","stage_classifiercode":"13-01","member_number":"\"\"","first_name":"STEPHEN","last_name":"GARON","classification":"U","division":"LIMITED","hit_factor":2.7596},{"match_name":"Danville Rifle and Pistol Club USPSA IL17 Classifier Match August 18th 2018","match_date":"2018-08-18","stage_classifiercode":"13-01","member_number":"A-105390","first_name":"SCOTT","last_name":"GIVENS","classification":"C","division":"LIMITED","hit_factor":2.7595},{"match_name":"ISPS Nov 5th 2016","match_date":"2016-11-05","stage_classifiercode":"13-01","member_number":"A99406","first_name":"RICK","last_name":"JUNGE","classification":"U","division":"LIMITED","hit_factor":2.7594},{"match_name":"RCPS USPSA 9 Jan 2016 Special Classifier Match","match_date":"2016-01-09","stage_classifiercode":"13-01","member_number":"A83843","first_name":"HAROLD","last_name":"PARKS","classification":"D","division":"LIMITED","hit_factor":2.7578},{"match_name":"SLOSA January 2018 USPSA MATCH","match_date":"2018-01-13","stage_classifiercode":"13-01","member_number":"A98002","first_name":"SHANE","last_name":"GOLDMAN","classification":"C","division":"LIMITED","hit_factor":2.7569},{"match_name":"SAPSC Monthly USPSA Classifier Match at ARO 20161020","match_date":"2016-10-20","stage_classifiercode":"13-01","member_number":"\"\"","first_name":"GLENN","last_name":"MARSHALL","classification":"U","division":"LIMITED","hit_factor":2.7569},{"match_name":"2018-08-04 USPSA at Phoenix Rod and Gun Club","match_date":"2018-08-04","stage_classifiercode":"13-01","member_number":"TY91049","first_name":"KIMBERLY","last_name":"KRAFFT","classification":"C","division":"LIMITED","hit_factor":2.7537},{"match_name":"HPSP Heartland Practical Shooters July USPSA Shoot","match_date":"2018-07-22","stage_classifiercode":"13-01","member_number":"ty75470","first_name":"BRENDEN","last_name":"SCHERBARTH","classification":"C","division":"LIMITED","hit_factor":2.7532},{"match_name":"MSSA USPSA June  10 2017","match_date":"2017-06-10","stage_cl