[{"match_name":"GoShoot Outdoors July 25th","match_date":"2020-07-25","stage_classifiercode":"99-22","member_number":"l2664","first_name":"JIM","last_name":"HILSENBECK","classification":"M","division":"PCC","hit_factor":12.963},{"match_name":"MESQUITE MAYHEM APRIL USPSA match 2018","match_date":"2018-04-15","stage_classifiercode":"99-22","member_number":"A89753","first_name":"MAX","last_name":"LEOGRANDIS","classification":"G","division":"PCC","hit_factor":12.7962},{"match_name":"CCPL - July 2021","match_date":"2021-07-17","stage_classifiercode":"99-22","member_number":"TY92969","first_name":"COREY","last_name":"SCHEEL","classification":"G","division":"PCC","hit_factor":11.811},{"match_name":"ARPC USPSA 2-15-21","match_date":"2021-02-15","stage_classifiercode":"99-22","member_number":"A124175","first_name":"MICHAEL","last_name":"LIES","classification":"M","division":"PCC","hit_factor":11.4165},{"match_name":"Rio Salado RMAP August 2021","match_date":"2021-08-15","stage_classifiercode":"99-22","member_number":"A81418","first_name":"REED","last_name":"GABRIELSON","classification":"B","division":"PCC","hit_factor":11.4068},{"match_name":"CCPL - July 2021","match_date":"2021-07-17","stage_classifiercode":"99-22","member_number":"A107915","first_name":"KYLE","last_name":"KONOPA","classification":"M","division":"PCC","hit_factor":11.2621},{"match_name":"Ontelaunee USPSA Hose Fest","match_date":"2021-01-02","stage_classifiercode":"99-22","member_number":"L3851","first_name":"JEFF","last_name":"PAULSEN","classification":"G","division":"PCC","hit_factor":11.0906},{"match_name":"NRG Saturday April 28th- Includes a Classifier Stage","match_date":"2018-04-28","stage_classifiercode":"99-22","member_number":"A98726","first_name":"CALEB","last_name":"BAER","classification":"A","division":"PCC","hit_factor":11.0701},{"match_name":"MESQUITE MAYHEM APRIL USPSA match 2018","match_date":"2018-04-15","stage_classifiercode":"99-22","member_number":"TY101875","first_name":"MARCO","last_name":"CABAHUG","classification":"A","division":"PCC","hit_factor":10.79},{"match_name":"Mesquite Mayhem Shooters Society April USPSA Match 2018","match_date":"2018-04-15","stage_classifiercode":"99-22","member_number":"ty101875","first_name":"MARCO","last_name":"CABAHUG","classification":"A","division":"PCC","hit_factor":10.79},{"match_name":"LCSA USPSA ALL CLASSIFIER ","match_date":"2018-06-30","stage_classifiercode":"99-22","member_number":"\"\"","first_name":"DIENEZ","last_name":"WOLLET","classification":"\"\"","division":"PCC","hit_factor":10.7209},{"match_name":"MESQUITE MAYHEM APRIL USPSA match 2018","match_date":"2018-04-15","stage_classifiercode":"99-22","member_number":"ty96532","first_name":"ALLAN","last_name":"WEBSTER","classification":"A","division":"PCC","hit_factor":10.7011},{"match_name":"USPSA Strategic Edge SEGR June 19th 2021","match_date":"2021-06-19","stage_classifiercode":"99-22","member_number":"TY54880","first_name":"STEFAN","last_name":"WIGGINS","classification":"U","division":"PCC","hit_factor":10.5906},{"match_name":"Firing Line Classifier","match_date":"2018-01-26","stage_classifiercode":"99-22","member_number":"ty94384","first_name":"ROBERT","last_name":"UPEGUI","classification":"B","division":"PCC","hit_factor":10.5448},{"match_name":"MESQUITE MAYHEM APRIL USPSA match 2018","match_date":"2018-04-15","stage_classifiercode":"99-22","member_number":"a72319","first_name":"RENANTE","last_name":"DAVID","classification":"B","division":"PCC","hit_factor":10.4046},{"match_name":"Oakdale USPSA MN07 7-29-2021","match_date":"2021-07-29","stage_classifiercode":"99-22","member_number":"TY119536","first_name":"RYAN","last_name":"VOLOVSEK","classification":"M","division":"PCC","hit_factor":10.3792},{"match_name":"MESQUITE MAYHEM MONTHLY USPSA  10-11-2020","match_date":"2020-10-11","stage_classifiercode":"99-22","member_number":"A57100","first_name":"BRANDON","last_name":"BADGER","classification":"M","division":"PCC","hit_factor":10.3757},{"match_name":"Hopkinton USPSA July 2017","match_date":"2017-07-01","stage_classifiercode":"99-22","member_number":"TY73127","first_name":"SEAN","last_name":"JANICKI","classification":"G","division":"PCC","hit_factor":10.3627},{"match_name":"PCSI - August 2018 USPSA","match_date":"2018-08-04","stage_classifiercode":"99-22","member_number":"A96708","first_name":"YURIY","last_name":"BORZENKO","classification":"G","division":"PCC","hit_factor":10.3627},{"match_name":"EDPS USPSA June 5 2021","match_date":"2021-06-05","stage_classifiercode":"99-22","member_number":"a108638","first_name":"SHAUN","last_name":"GARDNER","classification":"G","division":"PCC","hit_factor":10.3175},{"match_name":"NRG Saturday August 26th - Classifier","match_date":"2017-08-26","stage_classifiercode":"99-22","member_number":"\"\"","first_name":"JOJO","last_name":"VIDANES","classification":"U","division":"PCC","hit_factor":10.2916},{"match_name":"NRG Sunday June 18 -1st match at PRADO","match_date":"2017-06-18","stage_classifiercode":"99-22","member_number":"TY93001","first_name":"HENDRIX","last_name":"DE LEON","classification":"B","division":"PCC","hit_factor":10.2916},{"match_name":"2020-03 Bone Creek USPSA","match_date":"2020-03-01","stage_classifiercode":"99-22","member_number":"A101550","first_name":"ERIC","last_name":"SCHNITZER","classification":"B","division":"PCC","hit_factor":10.2837},{"match_name":"MESQUITE MAYHEM APRIL USPSA match 2018","match_date":"2018-04-15","stage_classifiercode":"99-22","member_number":"a37520","first_name":"ROBERT JR.","last_name":"RAMIREZ","classification":"A","division":"PCC","hit_factor":10.1351},{"match_name":"Bossier Parish Practical Shooters August 16 2020","match_date":"2020-08-16","stage_classifiercode":"99-22","member_number":"ty97639","first_name":"JASON","last_name":"WATTS","classification":"B","division":"PCC","hit_factor":10.1351},{"match_name":"MAPSA Beaverbrook September Match","match_date":"2018-09-08","stage_classifiercode":"99-22","member_number":"Ty91806","first_name":"JOSH","last_name":"FROELICH","classification":"U","division":"PCC","hit_factor":10.0971},{"match_name":"SFPC June 7 2020 PM     USPSA Monthly Match","match_date":"2020-06-07","stage_classifiercode":"99-22","member_number":"TY89888","first_name":"EDWARD","last_name":"SMITH","classification":"A","division":"PCC","hit_factor":10.087},{"match_name":"BAre Arms  Indoor 02-24-18","match_date":"2018-02-24","stage_classifiercode":"99-22","member_number":"TY42975","first_name":"JASON","last_name":"RATLIFF","classification":"M","division":"PCC","hit_factor":10.0746},{"match_name":"LdF USPSA Match June 23 2018","match_date":"2018-06-23","stage_classifiercode":"99-22","member_number":"A90353","first_name":"TRAVIS","last_name":"MCCAMISH","classification":"M","division":"PCC","hit_factor":10.0559},{"match_name":"Gem City Gun Club 3-17 and 3-18-2018","match_date":"2018-03-17","stage_classifiercode":"99-22","member_number":"A92969","first_name":"COREY","last_name":"SCHEEL","classification":"B","division":"PCC","hit_factor":9.9265},{"match_name":"Deadwood Boys USPSA All Classifier Match - 11 June 2017","match_date":"2017-06-11","stage_classifiercode":"99-22","member_number":"A78856","first_name":"CRIS","last_name":"CARPENTER","classification":"A","division":"PCC","hit_factor":9.8592},{"match_name":"Paul Bunyan April 7th-8th All Classifier Match NW01","match_date":"2018-04-07","stage_classifiercode":"99-22","member_number":"a104728","first_name":"SEAN","last_name":"STRADLEY","classification":"U","division":"PCC","hit_factor":9.8361},{"match_name":"EDPS USPSA June 5 2021","match_date":"2021-06-05","stage_classifiercode":"99-22","member_number":"A109417","first_name":"ANDREW","last_name":"KELLEY","classification":"M","division":"PCC","hit_factor":9.8182},{"match_name":"D.I.D -USPSA- 1-10-21","match_date":"2021-01-10","stage_classifiercode":"99-22","member_number":"a129128","first_name":"AUSTIN","last_name":"KIGER","classification":"A","division":"PCC","hit_factor":9.7731},{"match_name":"MAPSA Beaverbrook September Match","match_date":"2018-09-08","stage_classifiercode":"99-22","member_number":"A110076","first_name":"JON","last_name":"OSTROM","classification":"U","division":"PCC","hit_factor":9.7649},{"match_name":"WELD ECO09 20181021","match_date":"2018-10-21","stage_classifiercode":"99-22","member_number":"A104773","first_name":"MATT","last_name":"GALLANT","classification":"U","division":"PCC","hit_factor":9.7561},{"match_name":"Magnolia Rifle and Pistol Club July 2020 USPSA Match","match_date":"2020-07-05","stage_classifiercode":"99-22","member_number":"L3696","first_name":"ROBERT","last_name":"HALSELL","classification":"M","division":"PCC","hit_factor":9.7087},{"match_name":"D.I.D -USPSA- 1-10-21","match_date":"2021-01-10","stage_classifiercode":"99-22","member_number":"a118054","first_name":"ROGER","last_name":"MIKER","classification":"A","division":"PCC","hit_factor":9.6774},{"match_name":"Firing Line Classifier","match_date":"2018-01-26","stage_classifiercode":"99-22","member_number":"A102438","first_name":"NEIL","last_name":"BRUCHU","classification":"U","division":"PCC","hit_factor":9.6296},{"match_name":"Gem City Gun Club 3-17 and 3-18-2018","match_date":"2018-03-17","stage_classifiercode":"99-22","member_number":"A85633","first_name":"JOSH","last_name":"TARRANT","classification":"B","division":"PCC","hit_factor":9.5238},{"match_name":"NRG Sunday June 18 -1st match at PRADO","match_date":"2017-06-18","stage_classifiercode":"99-22","member_number":"a78607","first_name":"YASUNARI","last_name":"AKITA","classification":"U","division":"PCC","hit_factor":9.4915},{"match_name":"USPSA Bass River June 2017","match_date":"2017-06-04","stage_classifiercode":"99-22","member_number":"TY35185","first_name":"MATT","last_name":"JOE","classification":"\"\"","division":"PCC","hit_factor":9.4771},{"match_name":"Cactus USPSA ALL CLASSIFIER January 2021","match_date":"2021-01-03","stage_classifiercode":"99-22","member_number":"A127989","first_name":"RYAN","last_name":"VOYKIN","classification":"B","division":"PCC","hit_factor":9.4463},{"match_name":"Prescott 1st Saturday 5-06-17","match_date":"2017-05-06","stage_classifiercode":"99-22","member_number":"TY31924","first_name":"OTIS","last_name":"AUSTIN","classification":"A","division":"PCC","hit_factor":9.4192},{"match_name":"NRG Sunday June 18 -1st match at PRADO","match_date":"2017-06-18","stage_classifiercode":"99-22","member_number":"a92629","first_name":"IKEDA","last_name":"YASUAKI","classification":"U","division":"PCC","hit_factor":9.4118},{"match_name":"CCPL - July 2021","match_date":"2021-07-17","stage_classifiercode":"99-22","member_number":"A116426","first_name":"TOM","last_name":"AHOLA","classification":"B","division":"PCC","hit_factor":9.4118},{"match_name":"SSPSC USPSA Jul  4-5 2020","match_date":"2020-07-01","stage_classifiercode":"99-22","member_number":"TY76261","first_name":"DAN","last_name":"LONG","classification":"G","division":"PCC","hit_factor":9.4044},{"match_name":"USPSA Strategic Edge SEGR June 19th 2021","match_date":"2021-06-19","stage_classifiercode":"99-22","member_number":"A133963","first_name":"DON","last_name":"BARNES","classification":"U","division":"PCC","hit_factor":9.3851},{"match_name":"INAS Jan 2018 USPSA AM","match_date":"2018-01-20","stage_classifiercode":"99-22","member_number":"FY87913","first_name":"JONATHAN","last_name":"MOORE","classification":"M","division":"PCC","hit_factor":9.3426},{"match_name":"DSS - USPSA 20-07-25","match_date":"2020-07-25","stage_classifiercode":"99-22","member_number":"A112153","first_name":"DANIEL","last_name":"TOOTHMAN","classification":"B","division":"PCC","hit_factor":9.3333},{"match_name":"Ontelaunee USPSA Hose Fest","match_date":"2021-01-02","stage_classifiercode":"99-22","member_number":"A105042","first_name":"SHAUN","last_name":"TAYLOR","classification":"B","division":"PCC","hit_factor":9.3333},{"match_name":"OPSA November 2017","match_date":"2017-11-26","stage_classifiercode":"99-22","member_number":"TY3959","first_name":"FRANCIS","last_name":"LIVINGSTON","classification":"U","division":"PCC","hit_factor":9.3313},{"match_name":"NRG Saturday Nov 14th - Includes a Classifier Stage","match_date":"2020-11-14","stage_classifiercode":"99-22","member_number":"A2581","first_name":"ROSS","last_name":"DEANE","classification":"M","division":"PCC","hit_factor":9.2943},{"match_name":"Deadwood Boys USPSA All Classifier Match - 11 June 2017","match_date":"2017-06-11","stage_classifiercode":"99-22","member_number":"A100612","first_name":"ZACK","last_name":"SMITH","classification":"A","division":"PCC","hit_factor":9.2257},{"match_name":"EWPSA 2020-08","match_date":"2020-08-16","stage_classifiercode":"99-22","member_number":"L4822","first_name":"ANN","last_name":"BLOSSER","classification":"A","division":"PCC","hit_factor":9.215},{"match_name":"FMPSA USPSA Super Classifier Indoor Match","match_date":"2020-03-15","stage_classifiercode":"99-22","member_number":"Ty106379","first_name":"DANIEL","last_name":"BESTE","classification":"A","division":"PCC","hit_factor":9.2035},{"match_name":"Richmond Hot Shots May 19-20-2018 USPSA Pistol Match","match_date":"2018-05-19","stage_classifiercode":"99-22","member_number":"A51928","first_name":"CESAR","last_name":"MATA","classification":"M","division":"PCC","hit_factor":9.1993},{"match_name":"Prescott 1st Saturday 5-06-17","match_date":"2017-05-06","stage_classifiercode":"99-22","member_number":"TY67499","first_name":"BILL","last_name":"MUNGER","classification":"A","division":"PCC","hit_factor":9.1873},{"match_name":"CCPL - July 2021","match_date":"2021-07-17","stage_classifiercode":"99-22","member_number":"TY108884","first_name":"DAVID","last_name":"WOOD","classification":"A","division":"PCC","hit_factor":9.1627},{"match_name":"FMPSA USPSA Super Classifier Indoor Match","match_date":"2020-03-15","stage_classifiercode":"99-22","member_number":"Ty83581","first_name":"PAUL","last_name":"WOLLMUTH","classification":"U","division":"PCC","hit_factor":9.1503},{"match_name":"SSPSC USPSA Jul  4-5 2020","match_date":"2020-07-01","stage_classifiercode":"99-22","member_number":"A111670","first_name":"JAY","last_name":"BLANZA","classification":"A","division":"PCC","hit_factor":9.1429},{"match_name":"CGC CTX02 Monthly USPSA Match - January 2021","match_date":"2021-01-17","stage_classifiercode":"99-22","member_number":"Ty64204","first_name":"BLAKE","last_name":"LILES","classification":"M","division":"PCC","hit_factor":9.1408},{"match_name":"Grandbaggers 06-07-2018","match_date":"2018-06-07","stage_classifiercode":"99-22","member_number":"A48182","first_name":"RICH","last_name":"HIGGINS","classification":"M","division":"PCC","hit_factor":9.1195},{"match_name":"Richmond Hot Shots May 19-20-2018 USPSA Pistol Match","match_date":"2018-05-19","stage_classifiercode":"99-22","member_number":"TY99745","first_name":"JONATHAN","last_name":"OWYANG","classification":"A","division":"PCC","hit_factor":9.0909},{"match_name":"Grandbaggers September 2017","match_date":"2017-09-07","stage_classifiercode":"99-22","member_number":"A49393","first_name":"NAIM","last_name":"SAITI","classification":"M","division":"PCC","hit_factor":9.0202},{"match_name":"NRG Saturday August 26th - Classifier","match_date":"2017-08-26","stage_classifiercode":"99-22","member_number":"A27973","first_name":"VINKY","last_name":"CASTILLO","classification":"\"\"","division":"PCC","hit_factor":8.9922},{"match_name":"DSS - USPSA 20-07-25","match_date":"2020-07-25","stage_classifiercode":"99-22","member_number":"FY85869","first_name":"KHORY","last_name":"KATZ","classification":"B","division":"PCC","hit_factor":8.985},{"match_name":"PCSI - August 2018 USPSA","match_date":"2018-08-04","stage_classifiercode":"99-22","member_number":"A98952","first_name":"KEVIN","last_name":"PATELLOS","classification":"A","division":"PCC","hit_factor":8.9552},{"match_name":"NPCCC 07-01-2018 USPSA","match_date":"2018-07-01","stage_classifiercode":"99-22","member_number":"A73683","first_name":"BRYAN","last_name":"TECSON","classification":"M","division":"PCC","hit_factor":8.9404},{"match_name":"SSPSC USPSA Jul  4-5 2020","match_date":"2020-07-01","stage_classifiercode":"99-22","member_number":"TY88859","first_name":"MICHAEL","last_name":"KELLY","classification":"A","division":"PCC","hit_factor":8.9368},{"match_name":"EDPS USPSA January 4 2020","match_date":"2020-01-04","stage_classifiercode":"99-22","member_number":"A109417","first_name":"ANDREW","last_name":"KELLEY","classification":"B","division":"PCC","hit_factor":8.9314},{"match_name":"Applied IN25 USPSA October Classifier Match 2018","match_date":"2018-10-17","stage_classifiercode":"99-22","member_number":"a78635","first_name":"ROBERT","last_name":"MCGUIRE","classification":"M","division":"PCC","hit_factor":8.9231},{"match_name":"Richmond Hot Shots May 19-20-2018 USPSA Pistol Match","match_date":"2018-05-19","stage_classifiercode":"99-22","member_number":"A101653","first_name":"JONATHAN","last_name":"DIAZ","classification":"B","division":"PCC","hit_factor":8.9194},{"match_name":"LIPSA - February 26th 2017 - USPSA Match","match_date":"2017-02-26","stage_classifiercode":"99-22","member_number":"TY49897","first_name":"ROBERT","last_name":"NOVAK","classification":"U","division":"PCC","hit_factor":8.9153},{"match_name":"Griffin USPSA April 2017","match_date":"2017-04-15","stage_classifiercode":"99-22","member_number":"A82404","first_name":"JEFF","last_name":"JOHNSTON","classification":"B","division":"PCC","hit_factor":8.8816},{"match_name":"NRG Saturday Nov 14th - Includes a Classifier Stage","match_date":"2020-11-14","stage_classifiercode":"99-22","member_number":"A96984","first_name":"ANDY","last_name":"LU","classification":"B","division":"PCC","hit_factor":8.8725},{"match_name":"GRPC USPSA YOU CAN'T BUY LOVE","match_date":"2021-02-07","stage_classifiercode":"99-22","member_number":"A91497","first_name":"SCOTT","last_name":"REEH","classification":"M","division":"PCC","hit_factor":8.855},{"match_name":"SHFC Action Pistol Sept 16","match_date":"2021-09-16","stage_classifiercode":"99-22","member_number":"ty95950","first_name":"MIKE","last_name":"SCHUTT","classification":"M","division":"PCC","hit_factor":8.8468},{"match_name":"APSC USPSA  2-1-20","match_date":"2020-02-01","stage_classifiercode":"99-22","member_number":"A102843","first_name":"AARON","last_name":"LAFARY","classification":"B","division":"PCC","hit_factor":8.8285},{"match_name":"Grandbaggers 06-07-2018","match_date":"2018-06-07","stage_classifiercode":"99-22","member_number":"A34501","first_name":"RON","last_name":"FUCHS","classification":"A","division":"PCC","hit_factor":8.828},{"match_name":"WELD ECO09 20181021","match_date":"2018-10-21","stage_classifiercode":"99-22","member_number":"FY77537","first_name":"KRIS","last_name":"VANWAGNER","classification":"U","division":"PCC","hit_factor":8.8235},{"match_name":"GRB USPSA SEPTEMBER 2020 AT CAVALIER","match_date":"2020-09-19","stage_classifiercode":"99-22","member_number":"A115914","first_name":"ERIC","last_name":"WILSON","classification":"C","division":"PCC","hit_factor":8.8106},{"match_name":"Brothers N Arms August 2017 USPSA Match","match_date":"2017-08-19","stage_classifiercode":"99-22","member_number":"TY3936","first_name":"TOMMY","last_name":"CABELL","classification":"U","division":"PCC","hit_factor":8.7719},{"match_name":"PRPS  October 2016","match_date":"2016-10-23","stage_classifiercode":"99-22","member_number":"TY85172","first_name":"MIKE D","last_name":"OLEARY","classification":"U","division":"PCC","hit_factor":8.7363},{"match_name":"Richmond Hot Shots Jan 4-5-2020 USPSA Pistol","match_date":"2020-01-04","stage_classifiercode":"99-22","member_number":"A89517","first_name":"JOHN","last_name":"RICCHIUTO","classification":"A","division":"PCC","hit_factor":8.7349},{"match_name":"DWB - Deadwood Boys USPSA 20 September 2020  Classifier Match Makeup","match_date":"2020-09-20","stage_classifiercode":"99-22","member_number":"A91936","first_name":"CHRISTOPHER","last_name":"GURNETT","classification":"D","division":"PCC","hit_factor":8.7336},{"match_name":"NRG Saturday Nov 14th - Includes a Classifier Stage","match_date":"2020-11-14","stage_classifiercode":"99-22","member_number":"A45204","first_name":"RJ","last_name":"JANOLINO","classification":"B","division":"PCC","hit_factor":8.6826},{"match_name":"Oakdale USPSA MN07 7-29-2021","match_date":"2021-07-29","stage_classifiercode":"99-22","member_number":"L4062","first_name":"KEN","last_name":"SPOONER","classification":"B","division":"PCC","hit_factor":8.6553},{"match_name":"USPSA MO21 2Alpha SBRC April 2018 Special Classifier","match_date":"2018-04-28","stage_classifiercode":"99-22","member_number":"FY70323","first_name":"ROGER","last_name":"SUTTON","classification":"A","division":"PCC","hit_factor":8.6444},{"match_name":"NRG Sunday June 18 -1st match at PRADO","match_date":"2017-06-18","stage_classifiercode":"99-22","member_number":"L3692","first_name":"ANDREW","last_name":"CATBAGAN","classification":"B","division":"PCC","hit_factor":8.6379},{"match_name":"Bossier Parish Practical Shooters August 16 2020","match_date":"2020-08-16","stage_classifiercode":"99-22","member_number":"TY116299","first_name":"JUSTIN","last_name":"HEATON","classification":"U","division":"PCC","hit_factor":8.6154},{"match_name":"BORCC USPSA May 2018","match_date":"2018-05-26","stage_classifiercode":"99-22","member_number":"\"\"","first_name":"KENNY","last_name":"HUNT","classification":"C","division":"PCC","hit_factor":8.6154},{"match_name":"Richmond Hot Shots Jan 4-5-2020 USPSA Pistol","match_date":"2020-01-04","stage_classifiercode":"99-22","member_number":"TY88773","first_name":"EPHRAIM","last_name":"SAN FELIPE","classification":"A","division":"PCC","hit_factor":8.6053},{"match_name":"PRPS  October 2016","match_date":"2016-10-23","stage_classifiercode":"99-22","member_number":"TY75281","first_name":"CRAIG M","last_name":"LUNT","classification":"A","division":"PCC","hit_factor":8.5926},{"match_name":"DWB Deadwood Boys USPSA 04 December 2016","match_date":"2016-12-04","stage_classifiercode":"99-22","member_number":"ty83392","first_name":"JON","last_name":"BARRETT","classification":"B","division":"PCC","hit_factor":8.5851},{"match_name":"Paul Bunyan April 7th-8th All Classifier Match NW01","match_date":"2018-04-07","stage_classifiercode":"99-22","member_number":"Ty100358","first_name":"KELLY","last_name":"BENNETT","classification":"B","division":"PCC","hit_factor":8.5616},{"match_name":"USPSA MO21 2Alpha SBRC April 2018 Special Classifier","match_date":"2018-04-28","stage_classifiercode":"99-22","member_number":"A14123","first_name":"BRIAN","last_name":"PAYNE","classification":"A","division":"PCC","hit_factor":8.542},{"match_name":"USPSA MO21 2Alpha SBRC April 2018 Special Classifier","match_date":"2018-04-28","stage_classifiercode":"99-22","member_number":"A97624","first_name":"MIKE","last_name":"MARTIN","classification":"B","division":"PCC","hit_factor":8.5366},{"match_name":"APSC USPSA Match 09-02-17","match_date":"2017-09-02","stage_classifiercode":"99-22","member_number":"A87214","first_name":"CORY","last_name":"KLEMASHEVICH","classification":"G","division":"PCC","hit_factor":8.5246},{"match_name":"NRG Sunday June 18 -1st match at PRADO","match_date":"2017-06-18","stage_classifiercode":"99-22","member_number":"\"\"","first_name":"JOEY","last_name":"CASTILLO","classification":"U","division":"PCC","hit_factor":8.5044},{"match_name":"BAPS USPSA November","match_date":"2017-11-18","stage_classifiercode":"99-22","member_number":"\"\"","first_name":"JOHN","last_name":"NIXON","classification":"A","division":"PCC","hit_factor":8.4795},{"match_name":"Richmond Hot Shots May 19-20-2018 USPSA Pistol Match","match_date":"2018-05-19","stage_classifiercode":"99-22","member_number":"TY73903","first_name":"JOSEPH","last_name":"AUSTRIA","classification":"A","division":"PCC","hit_factor":8.472},{"match_name":"DSS - USPSA 20-07-25","match_date":"2020-07-25","stage_classifiercode":"99-22","member_number":"A116426","first_name":"TOM","last_name":"AHOLA","classification":"B","division":"PCC","hit_factor":8.4592},{"match_name":"BORCC USPSA May 2018","match_date":"2018-05-26","stage_classifiercode":"99-22","member_number":"\"\"","first_name":"JOHN","last_name":"WILSON","classification":"U","division":"PCC","hit_factor":8.4337},{"match_name":"Richmond Hot Shots May 19-20-2018 USPSA Pistol Match","match_date":"2018-05-19","stage_classifiercode":"99-22","member_number":"TY92465","first_name":"JOSE","last_name":"RAPADAS","classification":"B","division":"PCC","hit_factor":8.3958},{"match_name":"LCSA USPSA ALL CLASSIFIER ","match_date":"2018-06-30","stage_classifiercode":"99-22","member_number":"TY81249","first_name":"BRIAN","last_name":"MILLER","classification":"M","division":"PCC","hit_factor":8.3958},{"match_name":"Targetmasters USPSA Aug 7&8 2021","match_date":"2021-08-07","stage_classifiercode":"99-22","member_number":"A11035","first_name":"JOE","last_name":"MORROW","classification":"A","division":"PCC","hit_factor":8.3721},{"match_name":"Pinetucky USPSA CLASSIFIER MATCH 07-21-18","match_date":"2018-07-21","stage_classifiercode":"99-22","member_number":"A8700","first_name":"MICHAEL","last_name":"HOWARD","classification":"U","division":"PCC","hit_factor":8.3682},{"match_name":"BORCC USPSA Classifier Match February 2017","match_date":"2017-02-11","stage_classifiercode":"99-22","member_number":"L3378","first_name":"CHRISTOPHER","last_name":"GILSON","classification":"A","division":"PCC","hit_factor":8.3612},{"match_name":"TCGC Polo July 2021","match_date":"2021-07-25","stage_classifiercode":"99-22","member_number":"TY85154","first_name":"JAMES","last_name":"JENSEN","classification":"M","division":"PCC","hit_factor":8.3478},{"match_name":"LCSA USPSA ALL CLASSIFIER ","match_date":"2018-06-30","stage_classifiercode":"99-22","member_number":"TY69964","first_name":"JEFF","last_name":"BATTY","classification":"B","division":"PCC","hit_factor":8.3462},{"match_name":"Richmond Hot Shots Jan 4-5-2020 USPSA Pistol","match_date":"2020-01-04","stage_classifiercode":"99-22","member_number":"L3809","first_name":"GREGORY","last_name":"FIDDES","classification":"M","division":"PCC","hit_factor":8.3462},{"match_name":"EDPS USPSA January 4 2020","match_date":"2020-01-04","stage_classifiercode":"99-22","member_number":"None","first_name":"ADAM","last_name":"WALKER","classification":"U","division":"PCC","hit_factor":8.3462},{"match_name":"ACPSA October 2017","match_date":"2017-10-28","stage_classifiercode":"99-22","member_number":"\"\"","first_name":"MICHAEL","last_name":"STACK","classification":"M","division":"PCC","hit_factor":8.3333},{"match_name":"BAPS USPSA November","match_date":"2017-11-18","stage_classifiercode":"99-22","member_number":"TY79055","first_name":"WADE","last_name":"PRUETZ","classification":"A","division":"PCC","hit_factor":8.3214},{"match_name":"Pinetucky USPSA 05-20-17","match_date":"2017-05-20","stage_classifiercode":"99-22","member_number":"Fy75827","first_name":"KYLE","last_name":"HOLSCLAW","classification":"A","division":"PCC","hit_factor":8.321},{"match_name":"LdF USPSA Match June 23 2018","match_date":"2018-06-23","stage_classifiercode":"99-22","member_number":"TY52406","first_name":"GARY","last_name":"CHAN","classification":"M","division":"PCC","hit_factor":8.3095},{"match_name":"LA05 Tangi Oct 4th Sunday 2021","match_date":"2021-10-24","stage_classifiercode":"99-22","member_number":"A114417","first_name":"GUS","last_name":"O’KREPKI","classification":"U","division":"PCC","hit_factor":8.2822},{"match_name":"EDPS USPSA January 4 2020","match_date":"2020-01-04","stage_classifiercode":"99-22","member_number":"a108638","first_name":"SHAUN","last_name":"GARDNER","classification":"M","division":"PCC","hit_factor":8.2645},{"match_name":"DSS - USPSA 20-07-25","match_date":"2020-07-25","stage_classifiercode":"99-22","member_number":"A102072","first_name":"ANTHONY","last_name":"ZABONIK","classification":"A","division":"PCC","hit_factor":8.2443},{"match_name":"DWB Deadwood Boys USPSA 04 December 2016","match_date":"2016-12-04","stage_classifiercode":"99-22","member_number":"\"\"","first_name":"JOEY","last_name":"CASTILLO","classification":"U","division":"PCC","hit_factor":8.2305},{"match_name":"BORCC USPSA Classifier Match February 2017","match_date":"2017-02-11","stage_classifiercode":"99-22","member_number":"FY98750","first_name":"VAN","last_name":"GURLEY","classification":"U","division":"PCC","hit_factor":8.2079},{"match_name":"WNPL USPSA - Nov 2017","match_date":"2017-11-05","stage_classifiercode":"99-22","member_number":"L2391","first_name":"RUSS","last_name":"SPILKER","classification":"B","division":"PCC","hit_factor":8.2079},{"match_name":"DWB Deadwood Boys USPSA 04 December 2016","match_date":"2016-12-04","stage_classifiercode":"99-22","member_number":"TY73444","first_name":"KYLE","last_name":"FRAZIER","classification":"U","division":"PCC","hit_factor":8.1967},{"match_name":"Grandbaggers September 2017","match_date":"2017-09-07","stage_classifiercode":"99-22","member_number":"L1849","first_name":"PAUL","last_name":"THOMPSON","classification":"A","division":"PCC","hit_factor":8.1818},{"match_name":"DWB - Deadwood Boys USPSA 20 September 2020  Classifier Match Makeup","match_date":"2020-09-20","stage_classifiercode":"99-22","member_number":"fy-82995","first_name":"JEFFREY","last_name":"HUNT","classification":"A","division":"PCC","hit_factor":8.1805},{"match_name":"Grandbaggers September 2017","match_date":"2017-09-07","stage_classifiercode":"99-22","member_number":"TY35327","first_name":"KELLY","last_name":"NEAL","classification":"U","division":"PCC","hit_factor":8.169},{"match_name":"Gunsmoke  Action Shooters June USPSA Match","match_date":"2021-06-05","stage_classifiercode":"99-22","member_number":"TY81802","first_name":"DREW","last_name":"ESTELL","classification":"A","division":"PCC","hit_factor":8.1575},{"match_name":"Bossier Parish Practical Shooters August 16 2020","match_date":"2020-08-16","stage_classifiercode":"99-22","member_number":"Ty71839","first_name":"JONATHAN","last_name":"COWEN","classification":"U","division":"PCC","hit_factor":8.1411},{"match_name":"Cactus USPSA ALL CLASSIFIER January 2021","match_date":"2021-01-03","stage_classifiercode":"99-22","member_number":"TY120819","first_name":"DANIEL","last_name":"FLETCHER","classification":"A","division":"PCC","hit_factor":8.1377},{"match_name":"APSC USPSA Match 09-02-17","match_date":"2017-09-02","stage_classifiercode":"99-22","member_number":"L3507","first_name":"AARON","last_name":"MARCO","classification":"M","division":"PCC","hit_factor":8.1191},{"match_name":"APSC USPSA  2-1-20","match_date":"2020-02-01","stage_classifiercode":"99-22","member_number":"A110067","first_name":"GREG","last_name":"HESCH","classification":"B","division":"PCC","hit_factor":8.1159},{"match_name":"BRSP Tuesday Night USPSA Match","match_date":"2021-08-25","stage_classifiercode":"99-22","member_number":"TY88816","first_name":"WILLIAM","last_name":"PEARCH","classification":"B","division":"PCC","hit_factor":8.1123},{"match_name":"Grandbaggers September 2017","match_date":"2017-09-07","stage_classifiercode":"99-22","member_number":"TY37467","first_name":"MIKE","last_name":"TROMBLEY","classification":"U","division":"PCC","hit_factor":8.0838},{"match_name":"Oakdale USPSA MN07 7-29-2021","match_date":"2021-07-29","stage_classifiercode":"99-22","member_number":"A29923","first_name":"JON","last_name":"HUSPEK","classification":"A","division":"PCC","hit_factor":8.0808},{"match_name":"LCSA USPSA ALL CLASSIFIER ","match_date":"2018-06-30","stage_classifiercode":"99-22","member_number":"TY81249","first_name":"BRIAN","last_name":"MILLER","classification":"M","division":"PCC","hit_factor":8.0775},{"match_name":"DWB - Deadwood Boys USPSA 20 September 2020  Classifier Match Makeup","match_date":"2020-09-20","stage_classifiercode":"99-22","member_number":"TY98956","first_name":"ED","last_name":"HOFILENA","classification":"B","division":"PCC","hit_factor":8.0692},{"match_name":"LA05 Tangi 5th Sunday USPSA AUGUST 2020","match_date":"2020-08-29","stage_classifiercode":"99-22","member_number":"A114369","first_name":"TREVOR","last_name":"DAVIDGE","classification":"B","division":"PCC","hit_factor":8.0668},{"match_name":"Salt City practical shooting league at CKGC","match_date":"2020-01-26","stage_classifiercode":"99-22","member_number":"A106540","first_name":"CAMERON","last_name":"CAHN","classification":"U","division":"PCC","hit_factor":8.0221},{"match_name":"Richmond Hot Shots May 19-20-2018 USPSA Pistol Match","match_date":"2018-05-19","stage_classifiercode":"99-22","member_number":"A88607","first_name":"FRANCO","last_name":"GESMUNDO","classification":"U","division":"PCC","hit_factor":8.0123},{"match_name":"IL16 JAN 21 2018","match_date":"2018-01-21","stage_classifiercode":"99-22","member_number":"A79514","first_name":"KIP","last_name":"JACOBSEN","classification":"B","division":"PCC","hit_factor":8},{"match_name":"NRG Saturday Feb 27th Includes a Classifier Stage","match_date":"2021-02-27","stage_classifiercode":"99-22","member_number":"A130592","first_name":"PATRICK","last_name":"POSADAS","classification":"U","division":"PCC","hit_factor":7.9877},{"match_name":"Richmond Hot Shots May 19-20-2018 USPSA Pistol Match","match_date":"2018-05-19","stage_classifiercode":"99-22","member_number":"TY24456","first_name":"RANDY","last_name":"MELTON","classification":"M","division":"PCC","hit_factor":7.9867},{"match_name":"Richmond Hot Shots May 19-20-2018 USPSA Pistol Match","match_date":"2018-05-19","stage_classifiercode":"99-22","member_number":"A100949","first_name":"MICHAEL","last_name":"CHING","classification":"B","division":"PCC","hit_factor":7.9561},{"match_name":"NRG Sunday June 18 -1st match at PRADO","match_date":"2017-06-18","stage_classifiercode":"99-22","member_number":"L3822","first_name":"LEO","last_name":"SOLOVEICHIK","classification":"A","division":"PCC","hit_factor":7.9511},{"match_name":"SFPC June 7 2020 PM     USPSA Monthly Match","match_date":"2020-06-07","stage_classifiercode":"99-22","member_number":"A83243","first_name":"GIL","last_name":"ELNATAN","classification":"B","division":"PCC","hit_factor":7.9491},{"match_name":"CGC CTX02 Monthly USPSA Match - January 2021","match_date":"2021-01-17","stage_classifiercode":"99-22","member_number":"Ty63662","first_name":"CRAIG","last_name":"STEFFEK","classification":"M","division":"PCC","hit_factor":7.947},{"match_name":"TAC2 USPSA Sept 2016","match_date":"2016-09-03","stage_classifiercode":"99-22","member_number":"A53958","first_name":"JAMIE","last_name":"MCREYNOLDS","classification":"U","division":"PCC","hit_factor":7.9235},{"match_name":"Gem City Gun Club 3-17 and 3-18-2018","match_date":"2018-03-17","stage_classifiercode":"99-22","member_number":"A55021","first_name":"GARY","last_name":"SCHLICHT","classification":"B","division":"PCC","hit_factor":7.9063},{"match_name":"SAPSA August 2018","match_date":"2018-08-18","stage_classifiercode":"99-22","member_number":"TY2540","first_name":"SCOTT","last_name":"CARNAHAN","classification":"U","division":"PCC","hit_factor":7.9019},{"match_name":"EDPS USPSA January 4 2020","match_date":"2020-01-04","stage_classifiercode":"99-22","member_number":"fy33484","first_name":"CARLOS","last_name":"KATALBAS","classification":"G","division":"PCC","hit_factor":7.9019},{"match_name":"OPSA November 2017","match_date":"2017-11-26","stage_classifiercode":"99-22","member_number":"TY71940","first_name":"DEREK","last_name":"DRISCOLL","classification":"A","division":"PCC","hit_factor":7.8804},{"match_name":"PTPC January 7th USPSA Match","match_date":"2018-01-07","stage_classifiercode":"99-22","member_number":"A89602","first_name":"CHARLEY","last_name":"APPLE","classification":"C","division":"PCC","hit_factor":7.8697},{"match_name":"DWB Deadwood Boys USPSA 04 December 2016","match_date":"2016-12-04","stage_classifiercode":"99-22","member_number":"a78856","first_name":"CRIS","last_name":"CARPENTER","classification":"A","division":"PCC","hit_factor":7.8652},{"match_name":"FAS  Sunday USPSA","match_date":"2018-11-04","stage_classifiercode":"99-22","member_number":"A112345","first_name":"ZACHARY","last_name":"MCLAUGHLIN","classification":"B","division":"PCC","hit_factor":7.8603},{"match_name":"Extreme GM USPSA February","match_date":"2020-02-21","stage_classifiercode":"99-22","member_number":"A107034","first_name":"DANIEL","last_name":"SIEMS","classification":"U","division":"PCC","hit_factor":7.8431},{"match_name":"Deadwood Boys USPSA All Classifier Match - 11 June 2017","match_date":"2017-06-11","stage_classifiercode":"99-22","member_number":"a100803","first_name":"KENJI","last_name":"IWAMIZU","classification":"U","division":"PCC","hit_factor":7.8227},{"match_name":"2020-03 Bone Creek USPSA","match_date":"2020-03-01","stage_classifiercode":"99-22","member_number":"A108675","first_name":"JERRY","last_name":"MCCULLICK","classification":"M","division":"PCC","hit_factor":7.8148},{"match_name":"APSC USPSA  2-1-20","match_date":"2020-02-01","stage_classifiercode":"99-22","member_number":"A120450","first_name":"SEAN","last_name":"JENNINGS","classification":"C","division":"PCC","hit_factor":7.8148},{"match_name":"PRG 2017 Classifier Match","match_date":"2017-02-19","stage_classifiercode":"99-22","member_number":"TY85661","first_name":"KEITH","last_name":"SORRELL","classification":"A","division":"PCC","hit_factor":7.8023},{"match_name":"IL16 JAN 21 2018","match_date":"2018-01-21","stage_classifiercode":"99-22","member_number":"FY59095","first_name":"SHELBY","last_name":"STOCKTON","classification":"A","division":"PCC","hit_factor":7.7957},{"match_name":"SSPSC USPSA Jul  4-5 2020","match_date":"2020-07-01","stage_classifiercode":"99-22","member_number":"A99583","first_name":"ERIC","last_name":"SUNIGA","classification":"M","division":"PCC","hit_factor":7.7748},{"match_name":"Prescott 1st Saturday 5-06-17","match_date":"2017-05-06","stage_classifiercode":"99-22","member_number":"A54861","first_name":"DENNIS","last_name":"WALKER","classification":"M","division":"PCC","hit_factor":7.767},{"match_name":"NRG Saturday Feb 27th Includes a Classifier Stage","match_date":"2021-02-27","stage_classifiercode":"99-22","member_number":"A38012","first_name":"PAUL","last_name":"CABIGAO","classification":"A","division":"PCC","hit_factor":7.764},{"match_name":"EDPS USPSA June 5 2021","match_date":"2021-06-05","stage_classifiercode":"99-22","member_number":"Ty102986","first_name":"JOHN","last_name":"YUTANGCO","classification":"B","division":"PCC","hit_factor":7.7586},{"match_name":"PRG 2017 Classifier Match","match_date":"2017-02-19","stage_classifiercode":"99-22","member_number":"A37933","first_name":"CHUCK","last_name":"STRELECKY","classification":"U","division":"PCC","hit_factor":7.754},{"match_name":"NRG Sunday June 18 -1st match at PRADO","match_date":"2017-06-18","stage_classifiercode":"99-22","member_number":"\"\"","first_name":"ALVIN","last_name":"NATIVIDAD","classification":"U","division":"PCC","hit_factor":7.732},{"match_name":"Grandbaggers September 2017","match_date":"2017-09-07","stage_classifiercode":"99-22","member_number":"L2820","first_name":"KYLE","last_name":"SCHMIDT","classification":"U","division":"PCC","hit_factor":7.7135},{"match_name":"Rio Salado RMAP August 2021","match_date":"2021-08-15","stage_classifiercode":"99-22","member_number":"FY108641","first_name":"CHRIS","last_name":"DEGLER","classification":"B","division":"PCC","hit_factor":7.7121},{"match_name":"Superior Practical Shooters March  Match","match_date":"2020-03-04","stage_classifiercode":"99-22","member_number":"A99949","first_name":"TOMAS","last_name":"TAPIA","classification":"C","division":"PCC","hit_factor":7.7029},{"match_name":"YMM IPSC02 2020_08_09","match_date":"2020-08-09","stage_classifiercode":"99-22","member_number":"FY56992","first_name":"JOHN","last_name":"GLOVER","classification":"","division":"PCC","hit_factor":7.7022},{"match_name":"CGC CTX02 Monthly USPSA Match - January 2021","match_date":"2021-01-17","stage_classifiercode":"99-22","member_number":"L2181","first_name":"DALE","last_name":"ALCORN","classification":"A","division":"PCC","hit_factor":7.6923},{"match_name":"CCPL - July 2021","match_date":"2021-07-17","stage_classifiercode":"99-22","member_number":"FY39111","first_name":"OLIE","last_name":"ERICKSEN","classification":"B","division":"PCC","hit_factor":7.6814},{"match_name":"LA05 Tangi 5th Sunday USPSA AUGUST 2020","match_date":"2020-08-29","stage_classifiercode":"99-22","member_number":"A63746","first_name":"ROBERT","last_name":"JONES","classification":"U","division":"PCC","hit_factor":7.6705},{"match_name":"SAPSA August 2017","match_date":"2017-08-19","stage_classifiercode":"99-22","member_number":"TY53290","first_name":"KENT","last_name":"CORI","classification":"A","division":"PCC","hit_factor":7.6583},{"match_name":"Pioneer Action Shooters Jun 2017 Match","match_date":"2017-06-25","stage_classifiercode":"99-22","member_number":"FY44021","first_name":"DON","last_name":"SELESKY","classification":"U","division":"PCC","hit_factor":7.6531},{"match_name":"Deadwood Boys USPSA All Classifier Match - 11 June 2017","match_date":"2017-06-11","stage_classifiercode":"99-22","member_number":"A94923","first_name":"WILSON","last_name":"PARK","classification":"C","division":"PCC","hit_factor":7.6517},{"match_name":"LCSA USPSA ALL CLASSIFIER ","match_date":"2018-06-30","stage_classifiercode":"99-22","member_number":"TY84357","first_name":"RAY","last_name":"DONCH","classification":"B","division":"PCC","hit_factor":7.6433},{"match_name":"NRG Sunday June 18 -1st match at PRADO","match_date":"2017-06-18","stage_classifiercode":"99-22","member_number":"\"\"","first_name":"BRIAN","last_name":"DRAKE","classification":"U","division":"PCC","hit_factor":7.6294},{"match_name":"Griffin USPSA April 2017","match_date":"2017-04-15","stage_classifiercode":"99-22","member_number":"Ty71861","first_name":"ED","last_name":"RUSSMAN","classification":"U","division":"PCC","hit_factor":7.6239},{"match_name":"Superior Practical Shooters April 2018 Match","match_date":"2018-04-04","stage_classifiercode":"99-22","member_number":"A96673","first_name":"JACK","last_name":"STEPHENS II","classification":"C","division":"PCC","hit_factor":7.6164},{"match_name":"Paul Bunyan April 7th-8th All Classifier Match NW01","match_date":"2018-04-07","stage_classifiercode":"99-22","member_number":"Ty94333","first_name":"JONATHON","last_name":"PORTER","classification":"B","division":"PCC","hit_factor":7.5912},{"match_name":"Richmond Hot Shots May 19-20-2018 USPSA Pistol Match","match_date":"2018-05-19","stage_classifiercode":"99-22","member_number":"A88783","first_name":"JOHNMAR","last_name":"SAMSON","classification":"B","division":"PCC","hit_factor":7.5881},{"match_name":"SFPC June 7 2020 PM     USPSA Monthly Match","match_date":"2020-06-07","stage_classifiercode":"99-22","member_number":"A106034","first_name":"CHARLE","last_name":"DE MICHELE","classification":"B","division":"PCC","hit_factor":7.571},{"match_name":"GRPC USPSA YOU CAN'T BUY LOVE","match_date":"2021-02-07","stage_classifiercode":"99-22","member_number":"A106355","first_name":"RYAN","last_name":"ALICAYA","classification":"D","division":"PCC","hit_factor":7.563},{"match_name":"USPSA MO21 2Alpha SBRC April 2018 Special Classifier","match_date":"2018-04-28","stage_classifiercode":"99-22","member_number":"A101856","first_name":"NICHOLAS","last_name":"GROSS","classification":"C","division":"PCC","hit_factor":7.5619},{"match_name":"USPSA AR02 North Arkansas Action Pistol July 8th 2018","match_date":"2018-07-08","stage_classifiercode":"99-22","member_number":"TY48907","first_name":"DAVID","last_name":"LETSCH","classification":"\"\"","division":"PCC","hit_factor":7.537},{"match_name":"Pinetucky USPSA CLASSIFIER MATCH 07-21-18 Clone","match_date":"2018-07-22","stage_classifiercode":"99-22","member_number":"A93151","first_name":"TYLER","last_name":"BUSSEY","classification":"U","division":"PCC","hit_factor":7.537},{"match_name":"MVS ANPRACS USPSA 3-19-17","match_date":"2017-03-19","stage_classifiercode":"99-22","member_number":"A97714","first_name":"JUSTIN","last_name":"LARKIN","classification":"U","division":"PCC","hit_factor":7.5314},{"match_name":"CCPL - July 2021","match_date":"2021-07-17","stage_classifiercode":"99-22","member_number":"A117995","first_name":"CALVIN","last_name":"PACK","classification":"B","division":"PCC","hit_factor":7.5235},{"match_name":"NRG Sunday June 18 -1st match at PRADO","match_date":"2017-06-18","stage_classifiercode":"99-22","member_number":"A94923","first_name":"WILSON","last_name":"PARK","classification":"B","division":"PCC","hit_factor":7.5032},{"match_name":"Grandbaggers 06-07-2018","match_date":"2018-06-07","stage_classifiercode":"99-22","member_number":"A105604","first_name":"NATHAN","last_name":"INGRAO","classification":"B","division":"PCC","hit_factor":7.5032},{"match_name":"WGC WI USPSA Monthly Match 1-25-2020","match_date":"2020-01-25","stage_classifiercode":"99-22","member_number":"FY39325","first_name":"DAVID","last_name":"RICHMAN","classification":"B","division":"PCC","hit_factor":7.5},{"match_name":"WGC July 2017 USPSA 2","match_date":"2017-07-23","stage_classifiercode":"99-22","member_number":"A72613","first_name":"DONNIE","last_name":"SMITH","classification":"B","division":"PCC","hit_factor":7.5},{"match_name":"Targetmasters USPSA Aug 7&8 2021","match_date":"2021-08-07","stage_classifiercode":"99-22","member_number":"A33147","first_name":"VINCENT","last_name":"DIONISIO","classification":"B","division":"PCC","hit_factor":7.4766},{"match_name":"NRG Sunday June 18 -1st match at PRADO","match_date":"2017-06-18","stage_classifiercode":"99-22","member_number":"A83686","first_name":"DAVID","last_name":"KAFFEL","classification":"B","division":"PCC","hit_factor":7.4713},{"match_name":"Range E11even January 2018","match_date":"2018-01-27","stage_classifiercode":"99-22","member_number":"A103235","first_name":"SAM","last_name":"HEWITT","classification":"U","division":"PCC","hit_factor":7.4667},{"match_name":"CGC 03-10-2018","match_date":"2018-03-10","stage_classifiercode":"99-22","member_number":"A70169","first_name":"AVERY","last_name":"BISHOP","classification":"M","division":"PCC","hit_factor":7.4468},{"match_name":"EDPS USPSA January 4 2020","match_date":"2020-01-04","stage_classifiercode":"99-22","member_number":"A16730","first_name":"RON","last_name":"SECHLER","classification":"B","division":"PCC","hit_factor":7.4349},{"match_name":"Grandbaggers September 2017","match_date":"2017-09-07","stage_classifiercode":"99-22","member_number":"A80318","first_name":"JIM","last_name":"ADAME","classification":"U","division":"PCC","hit_factor":7.418},{"match_name":"BAPS USPSA November","match_date":"2017-11-18","stage_classifiercode":"99-22","member_number":"A71359","first_name":"DOUG","last_name":"DILLON","classification":"U","division":"PCC","hit_factor":7.4074},{"match_name":"GPSL 8-7-18","match_date":"2018-08-07","stage_classifiercode":"99-22","member_number":"A25385","first_name":"MARK","last_name":"STAMPER","classification":"B","division":"PCC","hit_factor":7.4074},{"match_name":"NRG Sunday June 18 -1st match at PRADO","match_date":"2017-06-18","stage_classifiercode":"99-22","member_number":"\"\"","first_name":"DANGIE","last_name":"NAZARENO","classification":"U","division":"PCC","hit_factor":7.3983},{"match_name":"BAPS USPSA November","match_date":"2017-11-18","stage_classifiercode":"99-22","member_number":"FY36295","first_name":"PAUL","last_name":"VAN WYK","classification":"B","division":"PCC","hit_factor":7.3973},{"match_name":"LdF USPSA Match June 23 2018","match_date":"2018-06-23","stage_classifiercode":"99-22","member_number":"FY60951","first_name":"LAWRENCE","last_name":"MATTHEWS","classification":"M","division":"PCC","hit_factor":7.3885},{"match_name":"LA05 Tangi Oct 4th Sunday 2021","match_date":"2021-10-24","stage_classifiercode":"99-22","member_number":"A92067","first_name":"DON","last_name":"ALBARES","classification":"A","division":"PCC","hit_factor":7.377},{"match_name":"WNPL USPSA - Nov 2017","match_date":"2017-11-05","stage_classifiercode":"99-22","member_number":"A103102","first_name":"PETE","last_name":"RUSSELL","classification":"C","division":"PCC","hit_factor":7.3698},{"match_name":"NRG Saturday Feb 27th Includes a Classifier Stage","match_date":"2021-02-27","stage_classifiercode":"99-22","member_number":"A118119","first_name":"ENRIQUE","last_name":"DONDONAY","classification":"C","division":"PCC","hit_factor":7.3511},{"match_name":"LCSA USPSA ALL CLASSIFIER ","match_date":"2018-06-30","stage_classifiercode":"99-22","member_number":"TY91802","first_name":"STEVEN","last_name":"WESCOTT","classification":"C","division":"PCC","hit_factor":7.3491},{"match_name":"Cactus USPSA ALL CLASSIFIER January 2021","match_date":"2021-01-03","stage_classifiercode":"99-22","member_number":"A71500","first_name":"BRIAN","last_name":"GREEN","classification":"B","division":"PCC","hit_factor":7.3491},{"match_name":"Gem City Gun Club 3-17 and 3-18-2018","match_date":"2018-03-17","stage_classifiercode":"99-22","member_number":"A107915","first_name":"KYLE","last_name":"KONOPA","classification":"U","division":"PCC","hit_factor":7.3469},{"match_name":"PRG 2017 Classifier Match","match_date":"2017-02-19","stage_classifiercode":"99-22","member_number":"A40807","first_name":"NOEL","last_name":"WILTERDING","classification":"U","division":"PCC","hit_factor":7.3446},{"match_name":"EDPS USPSA June 5 2021","match_date":"2021-06-05","stage_classifiercode":"99-22","member_number":"L1644","first_name":"RON","last_name":"TROYER","classification":"B","division":"PCC","hit_factor":7.3418},{"match_name":"NRG Saturday April 28th- Includes a Classifier Stage","match_date":"2018-04-28","stage_classifiercode":"99-22","member_number":"TY99955","first_name":"RAY","last_name":"PALACIO","classification":"C","division":"PCC","hit_factor":7.326},{"match_name":"SAPSA August 2018","match_date":"2018-08-18","stage_classifiercode":"99-22","member_number":"A106054","first_name":"CHRIS","last_name":"FOWLER","classification":"A","division":"PCC","hit_factor":7.3211},{"match_name":"TCGC Polo July 2021","match_date":"2021-07-25","stage_classifiercode":"99-22","member_number":"TY101888","first_name":"NICK","last_name":"HOWLAND","classification":"U","division":"PCC","hit_factor":7.314},{"match_name":"BORCC USPSA Classifier Match February 2017","match_date":"2017-02-11","stage_classifiercode":"99-22","member_number":"A77486","first_name":"JOHN","last_name":"LOGAN","classification":"U","division":"PCC","hit_factor":7.2956},{"match_name":"Brock's Gap USPSA September 4 2021","match_date":"2021-09-04","stage_classifiercode":"99-22","member_number":"TY104668","first_name":"TONY","last_name":"CLECKLER","classification":"A","division":"PCC","hit_factor":7.2931},{"match_name":"DWB Deadwood Boys USPSA 04 December 2016","match_date":"2016-12-04","stage_classifiercode":"99-22","member_number":"TY85661","first_name":"KEITH","last_name":"SORRELL","classification":"B","division":"PCC","hit_factor":7.2829},{"match_name":"MS06 Team Magnolia August 2017 USPSA Match","match_date":"2017-08-06","stage_classifiercode":"99-22","member_number":"TY82463","first_name":"DAVID","last_name":"MARTIAN","classification":"U","division":"PCC","hit_factor":7.2829},{"match_name":"GPSL 8-7-18","match_date":"2018-08-07","stage_classifiercode":"99-22","member_number":"TY94807","first_name":"JAMES","last_name":"GARNER","classification":"B","division":"PCC","hit_factor":7.2822},{"match_name":"2020-03 Bone Creek USPSA","match_date":"2020-03-01","stage_classifiercode":"99-22","member_number":"A116852","first_name":"ZACHARY","last_name":"WHITAKER","classification":"U","division":"PCC","hit_factor":7.2727},{"match_name":"Gem City Gun Club 3-17 and 3-18-2018","match_date":"2018-03-17","stage_classifiercode":"99-22","member_number":"L1963","first_name":"DENNY","last_name":"MICHALI","classification":"B","division":"PCC","hit_factor":7.2727},{"match_name":"EDPS USPSA January 4 2020","match_date":"2020-01-04","stage_classifiercode":"99-22","member_number":"A92291","first_name":"JOSEPH","last_name":"LAMBERT","classification":"U","division":"PCC","hit_factor":7.2591},{"match_name":"LA05 Tangi 5th Sunday USPSA AUGUST 2020","match_date":"2020-08-29","stage_classifiercode":"99-22","member_number":"A114417","first_name":"GUS","last_name":"O’KREPKI","classification":"B","division":"PCC","hit_factor":7.2319},{"match_name":"Gem City Gun Club 3-17 and 3-18-2018","match_date":"2018-03-17","stage_classifiercode":"99-22","member_number":"A100346","first_name":"JAMES","last_name":"SINGER","classification":"C","division":"PCC","hit_factor":7.2319},{"match_name":"PTPC January 7th USPSA Match","match_date":"2018-01-07","stage_classifiercode":"99-22","member_number":"TY85154","first_name":"JAMES","last_name":"JENSEN","classification":"C","division":"PCC","hit_factor":7.2222},{"match_name":"TCGC Polo July 2021","match_date":"2021-07-25","stage_classifiercode":"99-22","member_number":"A48165","first_name":"ROBERT","last_name":"HALE","classification":"B","division":"PCC","hit_factor":7.2165},{"match_name":"PTPC January 7th USPSA Match","match_date":"2018-01-07","stage_classifiercode":"99-22","member_number":"FY57913","first_name":"DIRK","last_name":"SCHLUETER","classification":"U","division":"PCC","hit_factor":7.2139},{"match_name":"Richmond Hot Shots Jan 4-5-2020 USPSA Pistol","match_date":"2020-01-04","stage_classifiercode":"99-22","member_number":"L2859","first_name":"MARK","last_name":"TURRIN","classification":"B","division":"PCC","hit_factor":7.2096},{"match_name":"PRG 2017 Classifier Match","match_date":"2017-02-19","stage_classifiercode":"99-22","member_number":"A78607","first_name":"AKITA","last_name":"YASUNARI","classification":"B","division":"PCC","hit_factor":7.2},{"match_name":"NRG Saturday Nov 14th - Includes a Classifier Stage","match_date":"2020-11-14","stage_classifiercode":"99-22","member_number":"TY112872","first_name":"ROBERT","last_name":"CAVAZOS","classification":"C","division":"PCC","hit_factor":7.2},{"match_name":"2020-03 Bone Creek USPSA","match_date":"2020-03-01","stage_classifiercode":"99-22","member_number":"FY36467","first_name":"JAMES","last_name":"POPE","classification":"B","division":"PCC","hit_factor":7.1856},{"match_name":"LdF USPSA Match June 23 2018","match_date":"2018-06-23","stage_classifiercode":"99-22","member_number":"A38618","first_name":"HENRY","last_name":"TORIBIO","classification":"A","division":"PCC","hit_factor":7.1839},{"match_name":"Bossier Parish Practical Shooters August 16 2020","match_date":"2020-08-16","stage_classifiercode":"99-22","member_number":"A118326","first_name":"RODNEY","last_name":"BLACK","classification":"U","division":"PCC","hit_factor":7.1823},{"match_name":"Armory Indoor League","match_date":"2016-11-10","stage_classifiercode":"99-22","member_number":"A68897","first_name":"LEONARD","last_name":"DELEON","classification":"U","division":"PCC","hit_factor":7.1823},{"match_name":"Range E11even January 2018","match_date":"2018-01-27","stage_classifiercode":"99-22","member_number":"A92146","first_name":"RYAN","last_name":"RASSOULI","classification":"U","division":"PCC","hit_factor":7.177},{"match_name":"Pioneer Action Shooters Jun 2017 Match","match_date":"2017-06-25","stage_classifiercode":"99-22","member_number":"A77713","first_name":"GREG","last_name":"SMUSHKIN","classification":"C","division":"PCC","hit_factor":7.1599},{"match_name":"NRG Sunday June 18 -1st match at PRADO","match_date":"2017-06-18","stage_classifiercode":"99-22","member_number":"A97344","first_name":"DANIEL","last_name":"FRAZIER","classification":"C","division":"PCC","hit_factor":7.1429},{"match_name":"Payson Practical Pistol Sept 03 2016","match_date":"2016-09-03","stage_classifiercode":"99-22","member_number":"L1849","first_name":"PAUL","last_name":"THOMPSON","classification":"U","division":"PCC","hit_factor":7.1338},{"match_name":"MISS USPSA 4-18-18","match_date":"2018-04-18","stage_classifiercode":"99-22","member_number":"A73683","first_name":"BRYAN","last_name":"TECSON","classification":"A","division":"PCC","hit_factor":7.1259},{"match_name":"ISPS  7/17/16 USPSA","match_date":"2016-07-17","stage_classifiercode":"99-22","member_number":"L3972","first_name":"EVANS","last_name":"KUO","classification":"U","division":"PCC","hit_factor":7.1253},{"match_name":"LPRGC - Lower Providence USPSA November 2018","match_date":"2018-11-03","stage_classifiercode":"99-22","member_number":"A108419","first_name":"ANDREW","last_name":"LATYSZONEK","classification":"C","division":"PCC","hit_factor":7.1156},{"match_name":"SLPSA June USPSA","match_date":"2017-06-17","stage_classifiercode":"99-22","member_number":"L4146","first_name":"CAREY","last_name":"PALMER","classification":"A","division":"PCC","hit_factor":7.0959},{"match_name":"WELD ECO09 20181021","match_date":"2018-10-21","stage_classifiercode":"99-22","member_number":"L4490","first_name":"GENE","last_name":"BRAY","classification":"B","division":"PCC","hit_factor":7.0886},{"match_name":"Paul Bunyan April 7th-8th All Classifier Match NW01","match_date":"2018-04-07","stage_classifiercode":"99-22","member_number":"fy27156","first_name":"STEVEN","last_name":"CLEMO","classification":"B","division":"PCC","hit_factor":7.0748},{"match_name":"YMM IPSC02 2020_08_09","match_date":"2020-08-09","stage_classifiercode":"99-22","member_number":"NO","first_name":"JOSEPH","last_name":"BARRIOS","classification":"U","division":"PCC","hit_factor":7.0707},{"match_name":"Low Country  USPSA  June 23 ","match_date":"2018-06-22","stage_classifiercode":"99-22","member_number":"A107976","first_name":"STEVE","last_name":"SPEAR","classification":"B","division":"PCC","hit_factor":7.0646},{"match_name":"INAS Jan 2018 USPSA PM","match_date":"2018-01-22","stage_classifiercode":"99-22","member_number":"TY21925","first_name":"WILLIAM","last_name":"PARKS III","classification":"B","division":"PCC","hit_factor":7.0588},{"match_name":"LdF USPSA Match June 23 2018","match_date":"2018-06-23","stage_classifiercode":"99-22","member_number":"A106729","first_name":"DEREK","last_name":"HARLAN","classification":"U","division":"PCC","hit_factor":7.0588},{"match_name":"LPRGC - Lower Providence USPSA November 2018","match_date":"2018-11-03","stage_classifiercode":"99-22","member_number":"A76695","first_name":"TODD","last_name":"BOYER","classification":"U","division":"PCC","hit_factor":7.0313},{"match_name":"TBAS USPSA Match 3/21/2021","match_date":"2021-03-21","stage_classifiercode":"99-22","member_number":"A111791","first_name":"JOHN","last_name":"DANIELSON","classification":"","division":"PCC","hit_factor":7.0263},{"match_name":"LdF USPSA Match June 23 2018","match_date":"2018-06-23","stage_classifiercode":"99-22","member_number":"A68331","first_name":"AZIZ","last_name":"BROU","classification":"B","division":"PCC","hit_factor":7.0263},{"match_name":"Targetmasters USPSA Aug 7&8 2021","match_date":"2021-08-07","stage_classifiercode":"99-22","member_number":"A134112","first_name":"ROMMEL","last_name":"BALILO","classification":"C","division":"PCC","hit_factor":7.0263},{"match_name":"GPSL 8-7-18","match_date":"2018-08-07","stage_classifiercode":"99-22","member_number":"A110673","first_name":"OLIVER","last_name":"KAO","classification":"U","division":"PCC","hit_factor":7.0258},{"match_name":"Paul Bunyan April 7th-8th All Classifier Match NW01","match_date":"2018-04-07","stage_classifiercode":"99-22","member_number":"A51227","first_name":"KEVIN","last_name":"OLSON","classification":"B","division":"PCC","hit_factor":7.0225},{"match_name":"Extreme GM USPSA February","match_date":"2020-02-21","stage_classifiercode":"99-22","member_number":"A28277","first_name":"BUD","last_name":"EHRMANN","classification":"A","division":"PCC","hit_factor":7.0175},{"match_name":"IL16 JAN 21 2018","match_date":"2018-01-21","stage_classifiercode":"99-22","member_number":"L3332","first_name":"KYLE","last_name":"GLEASON","classification":"B","division":"PCC","hit_factor":7.0093},{"match_name":"2020-03 Bone Creek USPSA","match_date":"2020-03-01","stage_classifiercode":"99-22","member_number":"A117501","first_name":"ROD","last_name":"COLEMAN","classification":"C","division":"PCC","hit_factor":7.0048},{"match_name":"NRG Saturday April 28th- Includes a Classifier Stage","match_date":"2018-04-28","stage_classifiercode":"99-22","member_number":"L2678","first_name":"CHRIS","last_name":"ENDERSBY","classification":"M","division":"PCC","hit_factor":6.9948},{"match_name":"NRG Saturday August 26th - Classifier","match_date":"2017-08-26","stage_classifiercode":"99-22","member_number":"A99955","first_name":"RAY","last_name":"PALACIO","classification":"C","division":"PCC","hit_factor":6.9735},{"match_name":"NRG Saturday Nov 14th - Includes a Classifier Stage","match_date":"2020-11-14","stage_classifiercode":"99-22","member_number":"TY37520","first_name":"ROBERT","last_name":"RAMIREZ JR","classification":"M","division":"PCC","hit_factor":6.9525},{"match_name":"Hampden RPC June USPSA Match","match_date":"2021-06-13","stage_classifiercode":"99-22","member_number":"TY86025","first_name":"ALAN","last_name":"MACAULAY","classification":"B","division":"PCC","hit_factor":6.9498},{"match_name":"RDS USPSA Nov 12 2016 Match","match_date":"2016-11-12","stage_classifiercode":"99-22","member_number":"A6900","first_name":"BILLY","last_name":"MCCOY","classification":"B","division":"PCC","hit_factor":6.9444},{"match_name":"CCPL - July 2021","match_date":"2021-07-17","stage_classifiercode":"99-22","member_number":"A112153","first_name":"DANIEL","last_name":"TOOTHMAN","classification":"B","division":"PCC","hit_factor":6.9421},{"match_name":"Pinetucky USPSA 05-20-17","match_date":"2017-05-20","stage_classifiercode":"99-22","member_number":"A93151","first_name":"TYLER","last_name":"BUSSEY","classification":"U","division":"PCC","hit_factor":6.9378},{"match_name":"WELD ECO09 20181021","match_date":"2018-10-21","stage_classifiercode":"99-22","member_number":"L4280","first_name":"DAVE","last_name":"BENSON","classification":"B","division":"PCC","hit_factor":6.9241},{"match_name":"Richmond Hot Shots Jan 4-5-2020 USPSA Pistol","match_date":"2020-01-04","stage_classifiercode":"99-22","member_number":"TY69128","first_name":"TONY","last_name":"YEH","classification":"B","division":"PCC","hit_factor":6.9124},{"match_name":"NRG Saturday Nov 14th - Includes a Classifier Stage","match_date":"2020-11-14","stage_classifiercode":"99-22","member_number":"A46996","first_name":"REY","last_name":"ATIENZA","classification":"C","division":"PCC","hit_factor":6.9054},{"match_name":"Grandbaggers September 2017","match_date":"2017-09-07","stage_classifiercode":"99-22","member_number":"A34065","first_name":"ROB","last_name":"SEWELL","classification":"U","division":"PCC","hit_factor":6.8966},{"match_name":"Gem City Gun Club 3-17 and 3-18-2018","match_date":"2018-03-17","stage_classifiercode":"99-22","member_number":"A46120","first_name":"JON","last_name":"NIELSEN","classification":"B","division":"PCC","hit_factor":6.8796},{"match_name":"LCSA USPSA ALL CLASSIFIER ","match_date":"2018-06-30","stage_classifiercode":"99-22","member_number":"TY81368","first_name":"JEFFREY","last_name":"KILLINGER","classification":"C","division":"PCC","hit_factor":6.8639},{"match_name":"NRG Saturday Feb 27th Includes a Classifier Stage","match_date":"2021-02-27","stage_classifiercode":"99-22","member_number":"TY33624","first_name":"ERIC","last_name":"CANCISIO","classification":"C","division":"PCC","hit_factor":6.8493},{"match_name":"APSC USPSA Match 09-02-17","match_date":"2017-09-02","stage_classifiercode":"99-22","member_number":"A89702","first_name":"SCOTT","last_name":"JENNINGS","classification":"C","division":"PCC","hit_factor":6.8337},{"match_name":"Quantico QPS USPSA Match August 13 2016","match_date":"2016-08-13","stage_classifiercode":"99-22","member_number":"FY52523","first_name":"BRETT","last_name":"TAYLOR","classification":"B","division":"PCC","hit_factor":6.8337},{"match_name":"Crooked Creek Pistol League - December 2017","match_date":"2017-12-03","stage_classifiercode":"99-22","member_number":"A101281","first_name":"DIENEZ","last_name":"WOLLET","classification":"A","division":"PCC","hit_factor":6.8301},{"match_name":"NRG Sunday June 18 -1st match at PRADO","match_date":"2017-06-18","stage_classifiercode":"99-22","member_number":"A44789","first_name":"KEN","last_name":"TICZON","classification":"A","division":"PCC","hit_factor":6.8155},{"match_name":"INAS PM January 2017 USPSA","match_date":"2017-01-07","stage_classifiercode":"99-22","member_number":"A81890","first_name":"DON","last_name":"TRIPPLET","classification":"A","division":"PCC","hit_factor":6.8063},{"match_name":"CGC CTX02 Monthly USPSA Match - January 2021","match_date":"2021-01-17","stage_classifiercode":"99-22","member_number":"A15867","first_name":"ALAN","last_name":"LAZA","classification":"U","division":"PCC","hit_factor":6.7995},{"match_name":"Magnolia Rifle and Pistol Club July 2020 USPSA Match","match_date":"2020-07-05","stage_classifiercode":"99-22","member_number":"A73527","first_name":"STEPHEN","last_name":"SANDRIDGE","classification":"U","division":"PCC","hit_factor":6.7995},{"match_name":"Targetmasters USPSA Aug 7&8 2021","match_date":"2021-08-07","stage_classifiercode":"99-22","member_number":"A80595","first_name":"EDGAR","last_name":"ALLAS","classification":"B","division":"PCC","hit_factor":6.7961},{"match_name":"Crooked Creek Pistol League - December 2017","match_date":"2017-12-03","stage_classifiercode":"99-22","member_number":"TY75462","first_name":"JASON","last_name":"HUGHES","classification":"U","division":"PCC","hit_factor":6.795},{"match_name":"North East Ohio Shooters - OHN06 - 2017-08-13","match_date":"2017-08-13","stage_classifiercode":"99-22","member_number":"L3860","first_name":"DAVID","last_name":"SNETHKAMP","classification":"A","division":"PCC","hit_factor":6.7925},{"match_name":"NHRPC - January 2020 USPSA","match_date":"2020-01-12","stage_classifiercode":"99-22","member_number":"TY92719","first_name":"DEAN","last_name":"MIOLI","classification":"B","division":"PCC","hit_factor":6.7879},{"match_name":"NRG Saturday Feb 27th Includes a Classifier Stage","match_date":"2021-02-27","stage_classifiercode":"99-22","member_number":"TY6047","first_name":"JIMMY","last_name":"ORDONEZ","classification":"A","division":"PCC","hit_factor":6.7873},{"match_name":"12a Fecha USPSA","match_date":"2017-11-12","stage_classifiercode":"99-22","member_number":"F78832","first_name":"ERNESTO","last_name":"RODRIGUEZ","classification":"C","division":"PCC","hit_factor":6.7873},{"match_name":"Richmond Hot Shots May 19-20-2018 USPSA Pistol Match","match_date":"2018-05-19","stage_classifiercode":"99-22","member_number":"TY79457","first_name":"LARRY","last_name":"MODELL","classification":"B","division":"PCC","hit_factor":6.7797},{"match_name":"Gem City Gun Club 3-4 and 3-5-17","match_date":"2017-03-04","stage_classifiercode":"99-22","member_number":"l1963","first_name":"DENNY","last_name":"MICHALI","classification":"U","division":"PCC","hit_factor":6.7754},{"match_name":"Paul Bunyan April 7th-8th All Classifier Match NW01","match_date":"2018-04-07","stage_classifiercode":"99-22","member_number":"TY47022","first_name":"BRUCE","last_name":"WOOD","classification":"U","division":"PCC","hit_factor":6.7751},{"match_name":"YMM IPSC02 2020_08_09","match_date":"2020-08-09","stage_classifiercode":"99-22","member_number":"FY105640","first_name":"CHRISTIAN","last_name":"ZAZUETA","classification":"C","division":"PCC","hit_factor":6.747},{"match_name":"Hopkinton USPSA July 2017","match_date":"2017-07-01","stage_classifiercode":"99-22","member_number":"TY62105","first_name":"CURT","last_name":"CASERTA","classification":"B","division":"PCC","hit_factor":6.7416},{"match_name":"USPSA MO21 2Alpha SBRC April 2018 Special Classifier","match_date":"2018-04-28","stage_classifiercode":"99-22","member_number":"A109971","first_name":"AUSTIN","last_name":"KENNEDY","classification":"U","division":"PCC","hit_factor":6.7332},{"match_name":"Prescott 1st Saturday 5-06-17","match_date":"2017-05-06","stage_classifiercode":"99-22","member_number":"A6671","first_name":"MIKE","last_name":"CHAMBERS","classification":"unclassified","division":"PCC","hit_factor":6.7189},{"match_name":"TAC2 USPSA Sept 2016","match_date":"2016-09-03","stage_classifiercode":"99-22","member_number":"\"\"","first_name":"DAVID 2G","last_name":"NOE","classification":"U","division":"PCC","hit_factor":6.7146},{"match_name":"DWB - Deadwood Boys USPSA December 17 2017","match_date":"2017-12-17","stage_classifiercode":"99-22","member_number":"A80416","first_name":"LAURENCE","last_name":"GURULE","classification":"C","division":"PCC","hit_factor":6.7081},{"match_name":"Grandbaggers September 2017","match_date":"2017-09-07","stage_classifiercode":"99-22","member_number":"A91055","first_name":"BOB","last_name":"WAGNER","classification":"B","division":"PCC","hit_factor":6.7039},{"match_name":"TBAS USPSA Match  5/17/20","match_date":"2020-05-17","stage_classifiercode":"99-22","member_number":"FY88644","first_name":"CHRIS","last_name":"LAUCK","classification":"","division":"PCC","hit_factor":6.7024},{"match_name":"Targetmasters USPSA Aug 7&8 2021","match_date":"2021-08-07","stage_classifiercode":"99-22","member_number":"A16730","first_name":"RON","last_name":"SECHLER","classification":"B","division":"PCC","hit_factor":6.6998},{"match_name":"Gunsmoke  Action Shooters June USPSA Match","match_date":"2021-06-05","stage_classifiercode":"99-22","member_number":"A109379","first_name":"MATT","last_name":"DOWNING","classification":"C","division":"PCC","hit_factor":6.6593},{"match_name":"Richmond Hot Shots May 19-20-2018 USPSA Pistol Match","match_date":"2018-05-19","stage_classifiercode":"99-22","member_number":"A81430","first_name":"PAUL","last_name":"VALMORES","classification":"C","division":"PCC","hit_factor":6.659},{"match_name":"GA Firing Line USPSA 2021-08-12","match_date":"2021-08-12","stage_classifiercode":"99-22","member_number":"A111089","first_name":"JOEY","last_name":"MILAM","classification":"B","division":"PCC","hit_factor":6.6421},{"match_name":"WELD ECO09 20181021","match_date":"2018-10-21","stage_classifiercode":"99-22","member_number":"A52572","first_name":"DAN","last_name":"TROXEL","classification":"B","division":"PCC","hit_factor":6.6362},{"match_name":"MSA USPSA Special Classifier 12-4-16","match_date":"2016-12-04","stage_classifiercode":"99-22","member_number":"A92760","first_name":"MIKE","last_name":"REED - PCC","classification":"U","division":"PCC","hit_factor":6.621},{"match_name":"TBAS USPSA Match 3/21/2021","match_date":"2021-03-21","stage_classifiercode":"99-22","member_number":"TY88333","first_name":"JACK","last_name":"DOUTHIT","classification":"B","division":"PCC","hit_factor":6.6129},{"match_name":"Bossier Parish Practical Shooters August 16 2020","match_date":"2020-08-16","stage_classifiercode":"99-22","member_number":"A120065","first_name":"FRANK","last_name":"MARULLI","classification":"U","division":"PCC","hit_factor":6.6015},{"match_name":"Pioneer Action Shooters Jun 2017 Match","match_date":"2017-06-25","stage_classifiercode":"99-22","member_number":"A86227","first_name":"NEAL","last_name":"MERRILL","classification":"U","division":"PCC","hit_factor":6.596},{"match_name":"PCWC USPSA  1 27 2018","match_date":"2018-01-27","stage_classifiercode":"99-22","member_number":"\"\"","first_name":"MATT","last_name":"DOWNING","classification":"U","division":"PCC","hit_factor":6.5909},{"match_name":"APSC USPSA Match 09-02-17","match_date":"2017-09-02","stage_classifiercode":"99-22","member_number":"A83285","first_name":"GARY","last_name":"AU","classification":"A","division":"PCC","hit_factor":6.5882},{"match_name":"Deadwood Boys USPSA All Classifier Match - 11 June 2017","match_date":"2017-06-11","stage_classifiercode":"99-22","member_number":"TY82995","first_name":"JEFF","last_name":"HUNT","classification":"U","division":"PCC","hit_factor":6.5882},{"match_name":"BAPS USPSA November","match_date":"2017-11-18","stage_classifiercode":"99-22","member_number":"FY24941","first_name":"ROBERT","last_name":"HOLLIER","classification":"C","division":"PCC","hit_factor":6.5789},{"match_name":"Cactus USPSA ALL CLASSIFIER January 2021","match_date":"2021-01-03","stage_classifiercode":"99-22","member_number":"A120402","first_name":"JOHN","last_name":"COCHRAN","classification":"C","division":"PCC","hit_factor":6.574},{"match_name":"MVS ANPRACS USPSA 3-19-17","match_date":"2017-03-19","stage_classifiercode":"99-22","member_number":"FY47478","first_name":"ALLEN","last_name":"CHAPMAN","classification":"B","division":"PCC","hit_factor":6.5646},{"match_name":"Lafayette Practical Shooters - THURS - May 6 (36 rds)","match_date":"2021-05-06","stage_classifiercode":"99-22","member_number":"A120002","first_name":"CAITLIN","last_name":"GAUB","classification":"C","division":"PCC","hit_factor":6.5617},{"match_name":"DWB - Deadwood Boys USPSA 20 September 2020  Classifier Match Makeup","match_date":"2020-09-20","stage_classifiercode":"99-22","member_number":"TY120064","first_name":"JEFF","last_name":"SHLAKMAN","classification":"U","division":"PCC","hit_factor":6.5611},{"match_name":"Bossier Parish Practical Shooters August 16 2020","match_date":"2020-08-16","stage_classifiercode":"99-22","member_number":"A34831","first_name":"ERROL","last_name":"SHARP","classification":"U","division":"PCC","hit_factor":6.5463},{"match_name":"Ontelaunee USPSA Hose Fest","match_date":"2021-01-02","stage_classifiercode":"99-22","member_number":"FY117388","first_name":"GERALD","last_name":"SARMIENTO","classification":"C","division":"PCC","hit_factor":6.5327},{"match_name":"OFGC USPSA August 21 2016","match_date":"2016-08-21","stage_classifiercode":"99-22","member_number":"\"\"","first_name":"ROBB","last_name":"ELLIOTT","classification":"U","division":"PCC","hit_factor":6.5288},{"match_name":"NRG Saturday April 28th- Includes a Classifier Stage","match_date":"2018-04-28","stage_classifiercode":"99-22","member_number":"\"\"","first_name":"DING","last_name":"AQUINO","classification":"U","division":"PCC","hit_factor":6.5268},{"match_name":"Richmond Hot Shots Jan 4-5-2020 USPSA Pistol","match_date":"2020-01-04","stage_classifiercode":"99-22","member_number":"TY84211","first_name":"GEORGE","last_name":"TY","classification":"M","division":"PCC","hit_factor":6.5116},{"match_name":"TAC2 USPSA Sept 2016","match_date":"2016-09-03","stage_classifiercode":"99-22","member_number":"PEN","first_name":"ROCCO","last_name":"PRESTON","classification":"U","division":"PCC","hit_factor":6.5056},{"match_name":"YMM IPSC02 2020_08_09","match_date":"2020-08-09","stage_classifiercode":"99-22","member_number":"TY87721","first_name":"JIM","last_name":"TAWZER","classification":"B","division":"PCC","hit_factor":6.502},{"match_name":"FMPSA USPSA Super Classifier Indoor Match","match_date":"2020-03-15","stage_classifiercode":"99-22","member_number":"A112197","first_name":"SHANE","last_name":"KROGSTAD","classification":"B","division":"PCC","hit_factor":6.5007},{"match_name":"Pioneer Action Shooters Jun 2017 Match","match_date":"2017-06-25","stage_classifiercode":"99-22","member_number":"TY79987","first_name":"JIM","last_name":"DUNHAM","classification":"X","division":"PCC","hit_factor":6.495},{"match_name":"Brock's Gap USPSA September 4 2021","match_date":"2021-09-04","stage_classifiercode":"99-22","member_number":"A125651","first_name":"THOMAS","last_name":"THRIFT","classification":"B","division":"PCC","hit_factor":6.4804},{"match_name":"Pioneer Action Shooters Jun 2017 Match","match_date":"2017-06-25","stage_classifiercode":"99-22","member_number":"TY69179","first_name":"BEN","last_name":"LINEBERRY","classification":"C","division":"PCC","hit_factor":6.4732},{"match_name":"CGC 03-10-2018","match_date":"2018-03-10","stage_classifiercode":"99-22","member_number":"TY89180","first_name":"CHARLES","last_name":"HOLLANDS","classification":"D","division":"PCC","hit_factor":6.4665},{"match_name":"CGC 03-10-2018","match_date":"2018-03-10","stage_classifiercode":"99-22","member_number":"A94603","first_name":"RONALDO","last_name":"BORGES","classification":"C","division":"PCC","hit_factor":6.4665},{"match_name":"LdF USPSA Match June 23 2018","match_date":"2018-06-23","stage_classifiercode":"99-22","member_number":"TY101012","first_name":"MICHAEL","last_name":"BOYLE","classification":"C","division":"PCC","hit_factor":6.466},{"match_name":"TMGN March 22 USPSA Match","match_date":"2018-03-22","stage_classifiercode":"99-22","member_number":"TY109443","first_name":"JASON","last_name":"TAJIMA","classification":"\"\"","division":"PCC","hit_factor":6.4655},{"match_name":"Extreme GM USPSA February","match_date":"2020-02-21","stage_classifiercode":"99-22","member_number":"A59244","first_name":"ANDY","last_name":"ZAVALLA","classification":"M","division":"PCC","hit_factor":6.4603},{"match_name":"GPSL 8-7-18","match_date":"2018-08-07","stage_classifiercode":"99-22","member_number":"F54490","first_name":"JONATHAN","last_name":"ALVARADO","classification":"\"\"","division":"PCC","hit_factor":6.4588},{"match_name":"North East Ohio Shooters - OHN06 - 2017-08-13","match_date":"2017-08-13","stage_classifiercode":"99-22","member_number":"A89886","first_name":"DANIEL","last_name":"TUSTIN","classification":"B","division":"PCC","hit_factor":6.4439},{"match_name":"Richmond Hot Shots May 19-20-2018 USPSA Pistol Match","match_date":"2018-05-19","stage_classifiercode":"99-22","member_number":"FY61207","first_name":"DAVID","last_name":"MISISCO","classification":"C","division":"PCC","hit_factor":6.4277},{"match_name":"CCPL - July 2021","match_date":"2021-07-17","stage_classifiercode":"99-22","member_number":"A117995","first_name":"CALVIN","last_name":"PACK","classification":"B","division":"PCC","hit_factor":6.425},{"match_name":"PTPC January 7th USPSA Match","match_date":"2018-01-07","stage_classifiercode":"99-22","member_number":"FY104506","first_name":"KEVIN","last_name":"OWENS","classification":"U","division":"PCC","hit_factor":6.4171},{"match_name":"SAPSA August 2018","match_date":"2018-08-18","stage_classifiercode":"99-22","member_number":"TY70086","first_name":"LARRY","last_name":"COLSON","classification":"C","division":"PCC","hit_factor":6.4147},{"match_name":"Crooked Creek Pistol League - December 2017","match_date":"2017-12-03","stage_classifiercode":"99-22","member_number":"TY84357","first_name":"RAY","last_name":"DONCH","classification":"B","division":"PCC","hit_factor":6.4147},{"match_name":"Targetmasters USPSA Aug 7&8 2021","match_date":"2021-08-07","stage_classifiercode":"99-22","member_number":"A113215","first_name":"RALPH","last_name":"PERKINS","classification":"B","division":"PCC","hit_factor":6.4103},{"match_name":"Coastal Area Practical Shooters 4-22-17","match_date":"2017-04-22","stage_classifiercode":"99-22","member_number":"A78423","first_name":"TOM","last_name":"LASKOWSKI","classification":"B","division":"PCC","hit_factor":6.4088},{"match_name":"DWB - Deadwood Boys USPSA 20 September 2020  Classifier Match Makeup","match_date":"2020-09-20","stage_classifiercode":"99-22","member_number":"A112254","first_name":"JOAQUIN","last_name":"SERRATO","classification":"A","division":"PCC","hit_factor":6.4039},{"match_name":"MISS USPSA 4-18-18","match_date":"2018-04-18","stage_classifiercode":"99-22","member_number":"A89151","first_name":"MICHAEL","last_name":"STERN","classification":"C","division":"PCC","hit_factor":6.402},{"match_name":"CCPL - July 2021","match_date":"2021-07-17","stage_classifiercode":"99-22","member_number":"TY95820","first_name":"BILL","last_name":"WEHRLE","classification":"C","division":"PCC","hit_factor":6.4018},{"match_name":"PTPC January 7th USPSA Match","match_date":"2018-01-07","stage_classifiercode":"99-22","member_number":"A73683","first_name":"BRYAN","last_name":"TECSON","classification":"A","division":"PCC","hit_factor":6.3939},{"match_name":"Paul Bunyan April 7th-8th All Classifier Match NW01","match_date":"2018-04-07","stage_classifiercode":"99-22","member_number":"TY106641","first_name":"KEVIN","last_name":"JONES","classification":"U","division":"PCC","hit_factor":6.3877},{"match_name":"DWB - Deadwood Boys USPSA 20 September 2020  Classifier Match Makeup","match_date":"2020-09-20","stage_classifiercode":"99-22","member_number":"A122400","first_name":"HENRY","last_name":"KIM","classification":"C","division":"PCC","hit_factor":6.3854},{"match_name":"Bossier Parish Practical Shooters August 16 2020","match_date":"2020-08-16","stage_classifiercode":"99-22","member_number":"L4553","first_name":"MIKE","last_name":"PIPES","classification":"B","division":"PCC","hit_factor":6.383},{"match_name":"MCTS - USPSA April 2020 #2","match_date":"2020-04-24","stage_classifiercode":"99-22","member_number":"A109379","first_name":"MATT","last_name":"DOWNING","classification":"U","division":"PCC","hit_factor":6.3806},{"match_name":"Gem City Gun Club 3-17 and 3-18-2018","match_date":"2018-03-17","stage_classifiercode":"99-22","member_number":"A102572","first_name":"DAVID","last_name":"WILDE","classification":"U","division":"PCC","hit_factor":6.3804},{"match_name":"SSS Pistol Match March 2017","match_date":"2017-03-12","stage_classifiercode":"99-22","member_number":"TY85974","first_name":"JAMES","last_name":"BASCIO","classification":"B (B Class)","division":"PCC","hit_factor":6.3736},{"match_name":"Bossier Parish Practical Shooters August 16 2020","match_date":"2020-08-16","stage_classifiercode":"99-22","member_number":"A122214","first_name":"CARLOS","last_name":"PERAZZA","classification":"B","division":"PCC","hit_factor":6.3725},{"match_name":"12-03-16 Points Match","match_date":"2016-12-03","stage_classifiercode":"99-22","member_number":"A89067","first_name":"ELVIS","last_name":"KARARIC","classification":"B","division":"PCC","hit_factor":6.3647},{"match_name":"DWB Deadwood Boys USPSA 04 December 2016","match_date":"2016-12-04","stage_classifiercode":"99-22","member_number":"\"\"","first_name":"LITO","last_name":"ISIDRO","classification":"U","division":"PCC","hit_factor":6.3529},{"match_name":"ARPC USPSA 2-15-21","match_date":"2021-02-15","stage_classifiercode":"99-22","member_number":"A124581","first_name":"KAREN","last_name":"LIES","classification":"A","division":"PCC","hit_factor":6.326},{"match_name":"Grandbaggers September 2017","match_date":"2017-09-07","stage_classifiercode":"99-22","member_number":"A82150","first_name":"JOSHUA","last_name":"FRY","classification":"U","division":"PCC","hit_factor":6.3224},{"match_name":"AIPS  USPSA Weekly 29 August 2017","match_date":"2017-08-29","stage_classifiercode":"99-22","member_number":"A74374","first_name":"DOUG","last_name":"CATRON","classification":"B","division":"PCC","hit_factor":6.3187},{"match_name":"ACPSA October 2017","match_date":"2017-10-28","stage_classifiercode":"99-22","member_number":"A106054","first_name":"CHRIS","last_name":"FOWLER","classification":"U","division":"PCC","hit_factor":6.3158},{"match_name":"DSS - USPSA 20-07-25","match_date":"2020-07-25","stage_classifiercode":"99-22","member_number":"TY108877","first_name":"ADAM","last_name":"LITKE","classification":"U","division":"PCC","hit_factor":6.3075},{"match_name":"PRG 2017 Classifier Match","match_date":"2017-02-19","stage_classifiercode":"99-22","member_number":"TY93001","first_name":"HENDRIX","last_name":"DELEON","classification":"U","division":"PCC","hit_factor":6.3043},{"match_name":"Rio Salado RMAP August 2021","match_date":"2021-08-15","stage_classifiercode":"99-22","member_number":"A114163","first_name":"STEVEN","last_name":"MERLA","classification":"C","division":"PCC","hit_factor":6.2959},{"match_name":"LA05 Tangi Oct 4th Sunday 2021","match_date":"2021-10-24","stage_classifiercode":"99-22","member_number":"A114369","first_name":"TREVOR","last_name":"DAVIDGE","classification":"B","division":"PCC","hit_factor":6.2927},{"match_name":"Texarkana Gun Club USPSA Match - June 2018","match_date":"2018-06-02","stage_classifiercode":"99-22","member_number":"\"\"","first_name":"TIM","last_name":"O'NEAL","classification":"U","division":"PCC","hit_factor":6.2921},{"match_name":"ARPC USPSA 2-15-21","match_date":"2021-02-15","stage_classifiercode":"99-22","member_number":"TY81342","first_name":"JIM","last_name":"WAUGH","classification":"C","division":"PCC","hit_factor":6.2839},{"match_name":"Richmond Hot Shots May 19-20-2018 USPSA Pistol Match","match_date":"2018-05-19","stage_classifiercode":"99-22","member_number":"A88900","first_name":"JAYSON","last_name":"GAMBOA","classification":"C","division":"PCC","hit_factor":6.2682},{"match_name":"ANPRACS USPSA 10-21-18","match_date":"2018-10-21","stage_classifiercode":"99-22","member_number":"FY47478","first_name":"H. ALLEN","last_name":"CHAPMAN","classification":"A","division":"PCC","hit_factor":6.263},{"match_name":"WNPL USPSA - Nov 2017","match_date":"2017-11-05","stage_classifiercode":"99-22","member_number":"A43862","first_name":"TOM","last_name":"MCCORMICK","classification":"B","division":"PCC","hit_factor":6.2567},{"match_name":"Maine Practical Shooters October USPSA","match_date":"2017-10-15","stage_classifiercode":"99-22","member_number":"A94475","first_name":"GLENN","last_name":"STILWELL","classification":"B","division":"PCC","hit_factor":6.25},{"match_name":"EWPSA 2017-11","match_date":"2017-11-18","stage_classifiercode":"99-22","member_number":"TY82326","first_name":"WARREN","last_name":"HARPER","classification":"U","division":"PCC","hit_factor":6.2327},{"match_name":"USPSA MO21 2Alpha SBRC April 2018 Special Classifier","match_date":"2018-04-28","stage_classifiercode":"99-22","member_number":"A56843","first_name":"JIM","last_name":"EDWARDS","classification":"U","division":"PCC","hit_factor":6.2305},{"match_name":"APSC USPSA  2-1-20","match_date":"2020-02-01","stage_classifiercode":"99-22","member_number":"TY77711","first_name":"DAVID","last_name":"REICHEK","classification":"A","division":"PCC","hit_factor":6.2305},{"match_name":"Brock's Gap USPSA September 4 2021","match_date":"2021-09-04","stage_classifiercode":"99-22","member_number":"TY108549","first_name":"MICHAEL","last_name":"COLE","classification":"M","division":"PCC","hit_factor":6.2264},{"match_name":"LIPSA - February 26th 2017 - USPSA Match","match_date":"2017-02-26","stage_classifiercode":"99-22","member_number":"\"\"","first_name":"CHARLEY","last_name":"VANDERHYDE","classification":"U","division":"PCC","hit_factor":6.2232},{"match_name":"Richmond Hot Shots Dec 4-2016 USPSA Pistol match (03Dec16-05:01:39)","match_date":"2016-12-04","stage_classifiercode":"99-22","member_number":"A79956","first_name":"EDWIN","last_name":"CHANG","classification":"U","division":"PCC","hit_factor":6.2112},{"match_name":"Gem City Gun Club 3-17 and 3-18-2018","match_date":"2018-03-17","stage_classifiercode":"99-22","member_number":"A102572","first_name":"DAVE","last_name":"WILDE","classification":"U","division":"PCC","hit_factor":6.1966},{"match_name":"Richmond Hot Shots May 19-20-2018 USPSA Pistol Match","match_date":"2018-05-19","stage_classifiercode":"99-22","member_number":"TY68229","first_name":"JC","last_name":"SMITH","classification":"B","division":"PCC","hit_factor":6.1947},{"match_name":"Extreme GM USPSA February","match_date":"2020-02-21","stage_classifiercode":"99-22","member_number":"TY93457","first_name":"JOE","last_name":"BARTOLOTTA","classification":"U","division":"PCC","hit_factor":6.1644},{"match_name":"Paul Bunyan April 7th-8th All Classifier Match NW01","match_date":"2018-04-07","stage_classifiercode":"99-22","member_number":"Ty107432","first_name":"REZNER","last_name":"ABUBAKAR","classification":"C","division":"PCC","hit_factor":6.1602},{"match_name":"DWB Deadwood Boys USPSA 04 December 2016","match_date":"2016-12-04","stage_classifiercode":"99-22","member_number":"A93614","first_name":"ANDY","last_name":"BONETTO","classification":"U","division":"PCC","hit_factor":6.1602},{"match_name":"NTPS-SE October 2017","match_date":"2017-10-21","stage_classifiercode":"99-22","member_number":"A55498","first_name":"SCOTT","last_name":"RANDOLPH","classification":"B","division":"PCC","hit_factor":6.1441},{"match_name":"NRG Saturday April 28th- Includes a Classifier Stage","match_date":"2018-04-28","stage_classifiercode":"99-22","member_number":"\"\"","first_name":"ENA","last_name":"MOTORS","classification":"C","division":"PCC","hit_factor":6.1404},{"match_name":"Bossier Parish Practical Shooters August 16 2020","match_date":"2020-08-16","stage_classifiercode":"99-22","member_number":"TY48703","first_name":"TERRY","last_name":"JOHNSON","classification":"A","division":"PCC","hit_factor":6.1392},{"match_name":"Richmond Hot Shots May 19-20-2018 USPSA Pistol Match","match_date":"2018-05-19","stage_classifiercode":"99-22","member_number":"TY88773","first_name":"EPHRAIM","last_name":"SAN FELIPE","classification":"B","division":"PCC","hit_factor":6.1381},{"match_name":"YMM IPSC02 2020_08_09","match_date":"2020-08-09","stage_classifiercode":"99-22","member_number":"FY52259","first_name":"TERRANCE","last_name":"SULLIVAN","classification":"B","division":"PCC","hit_factor":6.1381},{"match_name":"CCPL - July 2021","match_date":"2021-07-17","stage_classifiercode":"99-22","member_number":"TY108877","first_name":"ADAM","last_name":"LITKE","classification":"B","division":"PCC","hit_factor":6.136},{"match_name":"GRPC USPSA YOU CAN'T BUY LOVE","match_date":"2021-02-07","stage_classifiercode":"99-22","member_number":"TY109190","first_name":"MENGYU","last_name":"YUE","classification":"U","division":"PCC","hit_factor":6.1287},{"match_name":"IL16 JAN 21 2018","match_date":"2018-01-21","stage_classifiercode":"99-22","member_number":"A23181","first_name":"HERB","last_name":"SCHILDT","classification":"B","division":"PCC","hit_factor":6.1181},{"match_name":"ANPRACS USPSA 10-21-18","match_date":"2018-10-21","stage_classifiercode":"99-22","member_number":"A94396","first_name":"KEVIN","last_name":"FELLER","classification":"B","division":"PCC","hit_factor":6.1176},{"match_name":"EWPSA 2020-08","match_date":"2020-08-16","stage_classifiercode":"99-22","member_number":"L3238","first_name":"MATT","last_name":"NEWBURN","classification":"M","division":"PCC","hit_factor":6.1103},{"match_name":"USPSA MO21 2Alpha SBRC April 2018 Special Classifier","match_date":"2018-04-28","stage_classifiercode":"99-22","member_number":"A110966","first_name":"TROY","last_name":"POTTER","classification":"U","division":"PCC","hit_factor":6.11},{"match_name":"Richmond Hot Shots Jan 4-5-2020 USPSA Pistol","match_date":"2020-01-04","stage_classifiercode":"99-22","member_number":"FY112519","first_name":"CYRUS WAI HO","last_name":"YU","classification":"C","division":"PCC","hit_factor":6.1017},{"match_name":"North East Ohio Shooters - OHN06 - 2017-08-13","match_date":"2017-08-13","stage_classifiercode":"99-22","member_number":"\"\"","first_name":"TIM","last_name":"PONZI","classification":"X","division":"PCC","hit_factor":6.1002},{"match_name":"NRG Saturday August 26th - Classifier","match_date":"2017-08-26","stage_classifiercode":"99-22","member_number":"A92254","first_name":"STEVE","last_name":"NGO","classification":"U","division":"PCC","hit_factor":6.0988},{"match_name":"Quantico QPS USPSA Match August 13 2016","match_date":"2016-08-13","stage_classifiercode":"99-22","member_number":"L3315","first_name":"\"JEFF \"\"LIGHTNING\"\"\"","last_name":"SALZBERG","classification":"U","division":"PCC","hit_factor":6.0948},{"match_name":"GPSL 8-7-18","match_date":"2018-08-07","stage_classifiercode":"99-22","member_number":"A108934","first_name":"LUIS","last_name":"ORTIZ","classification":"U","division":"PCC","hit_factor":6.087},{"match_name":"CCPL - July 2021","match_date":"2021-07-17","stage_classifiercode":"99-22","member_number":"A110098","first_name":"ADAM","last_name":"KNOX","classification":"B","division":"PCC","hit_factor":6.087},{"match_name":"NRG Saturday August 26th - Classifier","match_date":"2017-08-26","stage_classifiercode":"99-22","member_number":"A64201","first_name":"CLAUDIA","last_name":"VIDANES","classification":"U","division":"PCC","hit_factor":6.0819},{"match_name":"DWB - Deadwood Boys USPSA December 17 2017","match_date":"2017-12-17","stage_classifiercode":"99-22","member_number":"A93613","first_name":"SEAN","last_name":"HUGHES","classification":"U","division":"PCC","hit_factor":6.079},{"match_name":"BAPS USPSA November","match_date":"2017-11-18","stage_classifiercode":"99-22","member_number":"FY11963","first_name":"TONY","last_name":"PHAN","classification":"M","division":"PCC","hit_factor":6.0738},{"match_name":"PTPC January 7th USPSA Match","match_date":"2018-01-07","stage_classifiercode":"99-22","member_number":"TY88087","first_name":"JOHN FEDERICO","last_name":"CAGAOAN","classification":"U","division":"PCC","hit_factor":6.068},{"match_name":"March 2018 USPSA Classifier Special","match_date":"2018-03-17","stage_classifiercode":"99-22","member_number":"F100662","first_name":"ADAM","last_name":"CARL","classification":"\"\"","division":"PCC","hit_factor":6.0669},{"match_name":"EDPS USPSA January 4 2020","match_date":"2020-01-04","stage_classifiercode":"99-22","member_number":"L1644","first_name":"RON","last_name":"TROYER","classification":"B","division":"PCC","hit_factor":6.0606},{"match_name":"PCWC USPSA  1 27 2018","match_date":"2018-01-27","stage_classifiercode":"99-22","member_number":"A-47202","first_name":"JACK","last_name":"CRAIG","classification":"U","division":"PCC","hit_factor":6.0484},{"match_name":"Bossier Parish Practical Shooters August 16 2020","match_date":"2020-08-16","stage_classifiercode":"99-22","member_number":"A105855","first_name":"BARRY","last_name":"BOOKER","classification":"C","division":"PCC","hit_factor":6.0447},{"match_name":"Applied IN25 USPSA October Classifier Match 2018","match_date":"2018-10-17","stage_classifiercode":"99-22","member_number":"\"\"","first_name":"DAVE","last_name":"MASON","classification":"U","division":"PCC","hit_factor":6.0335},{"match_name":"DSS - USPSA - 21-09-25","match_date":"2021-09-25","stage_classifiercode":"99-22","member_number":"L2450","first_name":"BUD","last_name":"CONNOLLY","classification":"C","division":"PCC","hit_factor":6.0201},{"match_name":"Targetmasters USPSA Aug 7&8 2021","match_date":"2021-08-07","stage_classifiercode":"99-22","member_number":"L1280","first_name":"BLAKE","last_name":"BENNETT","classification":"B","division":"PCC","hit_factor":6.0181},{"match_name":"MESQUITE MAYHEM APRIL USPSA match 2018","match_date":"2018-04-15","stage_classifiercode":"99-22","member_number":"L4437","first_name":"BRADFORD","last_name":"BARNES","classification":"C","division":"PCC","hit_factor":6.0127},{"match_name":"Mesquite Mayhem Shooters Society April USPSA Match 2018","match_date":"2018-04-15","stage_classifiercode":"99-22","member_number":"A98494","first_name":"BRADFORD","last_name":"BARNES","classification":"C","division":"PCC","hit_factor":6.0127},{"match_name":"OFGC USPSA August 21 2016","match_date":"2016-08-21","stage_classifiercode":"99-22","member_number":"TY34745","first_name":"KEITH","last_name":"HAMMOND","classification":"U","division":"PCC","hit_factor":6.012},{"match_name":"Extreme GM USPSA February","match_date":"2020-02-21","stage_classifiercode":"99-22","member_number":"A106562","first_name":"MARK","last_name":"AVERY","classification":"B","division":"PCC","hit_factor":6.0096},{"match_name":"Bossier Parish Practical Shooters August 16 2020","match_date":"2020-08-16","stage_classifiercode":"99-22","member_number":"A117525","first_name":"JUSTIN","last_name":"MCDONNELL","classification":"U","division":"PCC","hit_factor":6.0067},{"match_name":"ACPSA October 2017","match_date":"2017-10-28","stage_classifiercode":"99-22","member_number":"A69229","first_name":"CHARLIE","last_name":"NELSON","classification":"C","division":"PCC","hit_factor":6.006},{"match_name":"NRG Saturday August 26th - Classifier","match_date":"2017-08-26","stage_classifiercode":"99-22","member_number":"L2678","first_name":"CHRIS","last_name":"ENDERSBY","classification":"M","division":"PCC","hit_factor":6},{"match_name":"SSPSC USPSA Jul  4-5 2020","match_date":"2020-07-01","stage_classifiercode":"99-22","member_number":"A105539","first_name":"NEIL","last_name":"POSTLEWAITE","classification":"A","division":"PCC","hit_factor":6},{"match_name":"LdF USPSA Match June 23 2018","match_date":"2018-06-23","stage_classifiercode":"99-22","member_number":"TY95319","first_name":"JEREMIAH","last_name":"GROSS","classification":"U","division":"PCC","hit_factor":5.9952},{"match_name":"SLOSA Feburary 2017 USPSA","match_date":"2017-02-11","stage_classifiercode":"99-22","member_number":"TY87139","first_name":"EFREN","last_name":"CABREROS","classification":"B","division":"PCC","hit_factor":5.994},{"match_name":"USPSA MO21 2Alpha SBRC April 2018 Special Classifier","match_date":"2018-04-28","stage_classifiercode":"99-22","member_number":"FY36467","first_name":"JAMES","last_name":"POPE","classification":"U","division":"PCC","hit_factor":5.9933},{"match_name":"BRSP Tuesday Night USPSA Match - Feb 6","match_date":"2018-02-07","stage_classifiercode":"99-22","member_number":"\"\"","first_name":"ALEX","last_name":"TOOMEY","classification":"\"\"","division":"PCC","hit_factor":5.9765},{"match_name":"NRG Saturday Nov 14th - Includes a Classifier Stage","match_date":"2020-11-14","stage_classifiercode":"99-22","member_number":"TY130585","first_name":"GERALD","last_name":"GULLAS","classification":"U","division":"PCC","hit_factor":5.9765},{"match_name":"NTPS-SE October 2017","match_date":"2017-10-21","stage_classifiercode":"99-22","member_number":"TY79675","first_name":"HENRY","last_name":"AMBROSE","classification":"U","division":"PCC","hit_factor":5.9761},{"match_name":"APSC USPSA Match 09-02-17","match_date":"2017-09-02","stage_classifiercode":"99-22","member_number":"A62546","first_name":"DAVID","last_name":"PICKERING","classification":"X","division":"PCC","hit_factor":5.9735},{"match_name":"Grandbaggers September 2017","match_date":"2017-09-07","stage_classifiercode":"99-22","member_number":"A91055","first_name":"BOB","last_name":"WAGNER","classification":"B","division":"PCC","hit_factor":5.9701},{"match_name":"INAS Jan 2018 USPSA AM","match_date":"2018-01-20","stage_classifiercode":"99-22","member_number":"A100181","first_name":"RON","last_name":"VAUGHN","classification":"B","division":"PCC","hit_factor":5.9666},{"match_name":"MVS ANPRACS USPSA 3-19-17","match_date":"2017-03-19","stage_classifiercode":"99-22","member_number":"\"\"","first_name":"ALAN","last_name":"WILDE","classification":"U","division":"PCC","hit_factor":5.9583},{"match_name":"Grandbaggers September 2017","match_date":"2017-09-07","stage_classifiercode":"99-22","member_number":"TY99173","first_name":"ROSS","last_name":"CHU","classification":"U","division":"PCC","hit_factor":5.9583},{"match_name":"Brock's Gap USPSA September 4 2021","match_date":"2021-09-04","stage_classifiercode":"99-22","member_number":"TY94006","first_name":"PAUL","last_name":"SIMS","classification":"C","division":"PCC","hit_factor":5.9548},{"match_name":"Extreme GM USPSA February","match_date":"2020-02-21","stage_classifiercode":"99-22","member_number":"A69150","first_name":"DERRICK","last_name":"CHEN LUKE","classification":"A","division":"PCC","hit_factor":5.9548},{"match_name":"BHPSC Monthly USPSA Indoor Match - Feb 2021 Special Classifier Match","match_date":"2021-02-27","stage_classifiercode":"99-22","member_number":"TY97339","first_name":"RICK","last_name":"ZEITUN","classification":"U","division":"PCC","hit_factor":5.9537},{"match_name":"NRG Saturday August 26th - Classifier","match_date":"2017-08-26","stage_classifiercode":"99-22","member_number":"A26171","first_name":"JOEY","last_name":"CASTILLO","classification":"U","division":"PCC","hit_factor":5.9406},{"match_name":"USPSA MO21 2Alpha SBRC April 2018 Special Classifier","match_date":"2018-04-28","stage_classifiercode":"99-22","member_number":"TY101632","first_name":"GREG","last_name":"YEN","classification":"G","division":"PCC","hit_factor":5.9387},{"match_name":"CGC CTX02 Monthly USPSA Match - January 2021","match_date":"2021-01-17","stage_classifiercode":"99-22","member_number":"A117289","first_name":"ERNEST","last_name":"GARZA","classification":"B","division":"PCC","hit_factor":5.9289},{"match_name":"INAS PM January 2017 USPSA","match_date":"2017-01-07","stage_classifiercode":"99-22","member_number":"TY86504","first_name":"WILLIE","last_name":"HANEY","classification":"U","division":"PCC","hit_factor":5.9063},{"match_name":"BSPSC 2018 August Special Classifier","match_date":"2018-08-12","stage_classifiercode":"99-22","member_number":"A12197","first_name":"JED","last_name":"SIMON","classification":"B","division":"PCC","hit_factor":5.9024},{"match_name":"Extreme GM USPSA February","match_date":"2020-02-21","stage_classifiercode":"99-22","member_number":"A125903","first_name":"KEN","last_name":"SLOAN","classification":"U","division":"PCC","hit_factor":5.8943},{"match_name":"TBAS USPSA Match 3/21/2021","match_date":"2021-03-21","stage_classifiercode":"99-22","member_number":"A100877","first_name":"RORY","last_name":"MCBRIDE","classification":"C","division":"PCC","hit_factor":5.8893},{"match_name":"EWPSA 2017-11","match_date":"2017-11-18","stage_classifiercode":"99-22","member_number":"TY70904","first_name":"MICHAEL","last_name":"GIMERA","classification":"B","division":"PCC","hit_factor":5.8824},{"match_name":"CGC 03-10-2018","match_date":"2018-03-10","stage_classifiercode":"99-22","member_number":"TY75767","first_name":"BUDDY","last_name":"BRIDWELL","classification":"C","division":"PCC","hit_factor":5.8766},{"match_name":"PRG 2017 Classifier Match","match_date":"2017-02-19","stage_classifiercode":"99-22","member_number":"TY88518","first_name":"MICHAEL","last_name":"IBARRA","classification":"U","division":"PCC","hit_factor":5.8764},{"match_name":"CCPL - July 2021","match_date":"2021-07-17","stage_classifiercode":"99-22","member_number":"FY85869","first_name":"KHORY","last_name":"KATZ","classification":"M","division":"PCC","hit_factor":5.8728},{"match_name":"BPSA August 2016 Classifier Match","match_date":"2016-08-07","stage_classifiercode":"99-22","member_number":"A46930","first_name":"GERALD","last_name":"BENTON","classification":"U","division":"PCC","hit_factor":5.8708},{"match_name":"12a Fecha USPSA","match_date":"2017-11-12","stage_classifiercode":"99-22","member_number":"\"\"","first_name":"FRANCISCO","last_name":"RODRIGUEZ DIAZ","classification":"U","division":"PCC","hit_factor":5.8608},{"match_name":"NRG Saturday August 26th - Classifier","match_date":"2017-08-26","stage_classifiercode":"99-22","member_number":"L3405","first_name":"ALVIN","last_name":"NATIVIDAD","classification":"U","division":"PCC","hit_factor":5.8568},{"match_name":"Rio Grande Practical Shooting Club - February 20th 2021","match_date":"2021-02-20","stage_classifiercode":"99-22","member_number":"A15343","first_name":"CLYDE","last_name":"KAINE","classification":"B","division":"PCC","hit_factor":5.8505},{"match_name":"GWPP August 2020 Pistol","match_date":"2020-08-08","stage_classifiercode":"99-22","member_number":"L3738","first_name":"JAY","last_name":"OLMSTEAD","classification":"B","division":"PCC","hit_factor":5.848},{"match_name":"NRG Sunday June 18 -1st match at PRADO","match_date":"2017-06-18","stage_classifiercode":"99-22","member_number":"TY82579","first_name":"IAN","last_name":"ESTERHUIZEN","classification":"B","division":"PCC","hit_factor":5.848},{"match_name":"LdF USPSA Match June 23 2018","match_date":"2018-06-23","stage_classifiercode":"99-22","member_number":"\"\"","first_name":"DAVID","last_name":"MORRIS","classification":"B","division":"PCC","hit_factor":5.8378},{"match_name":"Eagle USPSA 08-31-2020 CLASSIFIER MATCH","match_date":"2020-08-31","stage_classifiercode":"99-22","member_number":"Ty98078","first_name":"ALBERT","last_name":"YAU","classification":"U","division":"PCC","hit_factor":5.8345},{"match_name":"PRPS  October 2016","match_date":"2016-10-23","stage_classifiercode":"99-22","member_number":"A76398","first_name":"MATT E","last_name":"DICKINSON","classification":"C","division":"PCC","hit_factor":5.7915},{"match_name":"BSPSC 2018 August Special Classifier","match_date":"2018-08-12","stage_classifiercode":"99-22","member_number":"TY77203","first_name":"VIC","last_name":"FINK","classification":"U","division":"PCC","hit_factor":5.7851},{"match_name":"LIPSA - February 26th 2017 - USPSA Match","match_date":"2017-02-26","stage_classifiercode":"99-22","member_number":"L3570","first_name":"KEVIN","last_name":"DRISCOLL","classification":"U","division":"PCC","hit_factor":5.7803},{"match_name":"PCWC USPSA  1 27 2018","match_date":"2018-01-27","stage_classifiercode":"99-22","member_number":"Ty52476","first_name":"JOHN","last_name":"TISCHLER","classification":"A","division":"PCC","hit_factor":5.7803},{"match_name":"TCGC Polo July 2021","match_date":"2021-07-25","stage_classifiercode":"99-22","member_number":"A77507","first_name":"LARRY","last_name":"HEMMENS","classification":"C","division":"PCC","hit_factor":5.7792},{"match_name":"LPRGC - Lower Providence USPSA November 2018","match_date":"2018-11-03","stage_classifiercode":"99-22","member_number":"FY86391","first_name":"MARK","last_name":"RODRIGUEZ","classification":"B","division":"PCC","hit_factor":5.7748},{"match_name":"Deadwood Boys USPSA All Classifier Match - 11 June 2017","match_date":"2017-06-11","stage_classifiercode":"99-22","member_number":"Fy70363","first_name":"JON","last_name":"BIRDT","classification":"U","division":"PCC","hit_factor":5.7711},{"match_name":"JPPS Club Match 7-18-20","match_date":"2020-07-18","stage_classifiercode":"99-22","member_number":"A16438","first_name":"BOB","last_name":"ROBERTSON","classification":"B","division":"PCC","hit_factor":5.7597},{"match_name":"Payson Practical Pistol Sept 03 2016","match_date":"2016-09-03","stage_classifiercode":"99-22","member_number":"TY65634","first_name":"CHRIS","last_name":"COLLINS","classification":"U","division":"PCC","hit_factor":5.7582},{"match_name":"LCSA USPSA ALL CLASSIFIER ","match_date":"2018-06-30","stage_classifiercode":"99-22","member_number":"FY90924","first_name":"SOPHIA","last_name":"SMITH","classification":"C","division":"PCC","hit_factor":5.7522},{"match_name":"BAPS USPSA November","match_date":"2017-11-18","stage_classifiercode":"99-22","member_number":"L3738","first_name":"JAY","last_name":"OLMSTEAD","classification":"C","division":"PCC","hit_factor":5.7318},{"match_name":"GRPC USPSA YOU CAN'T BUY LOVE","match_date":"2021-02-07","stage_classifiercode":"99-22","member_number":"TY97871","first_name":"ROBB","last_name":"STARR","classification":"C","division":"PCC","hit_factor":5.7197},{"match_name":"NTPS-SE October 2017","match_date":"2017-10-21","stage_classifiercode":"99-22","member_number":"A104670","first_name":"NICK","last_name":"RHOADES","classification":"U","division":"PCC","hit_factor":5.7143},{"match_name":"OFGC USPSA August 21 2016","match_date":"2016-08-21","stage_classifiercode":"99-22","member_number":"A6900","first_name":"BILLY","last_name":"MCCOY","classification":"U","division":"PCC","hit_factor":5.7088},{"match_name":"D.I.D -USPSA- 1-10-21","match_date":"2021-01-10","stage_classifiercode":"99-22","member_number":"a118278","first_name":"ANTHONY","last_name":"VENDITTI","classification":"C","division":"PCC","hit_factor":5.7029},{"match_name":"USPSA Bass River June 2017","match_date":"2017-06-04","stage_classifiercode":"99-22","member_number":"\"\"","first_name":"STEVEN","last_name":"DANIELS","classification":"\"\"","division":"PCC","hit_factor":5.6795},{"match_name":"DWB Deadwood Boys USPSA 04 December 2016","match_date":"2016-12-04","stage_classifiercode":"99-22","member_number":"A40050","first_name":"JEFF","last_name":"CHURCH","classification":"U","division":"PCC","hit_factor":5.6663},{"match_name":"DWB Deadwood Boys USPSA 04 December 2016","match_date":"2016-12-04","stage_classifiercode":"99-22","member_number":"ty96659","first_name":"SAM","last_name":"HOUSTON","classification":"U","division":"PCC","hit_factor":5.6585},{"match_name":"Payson Practical Pistol Sept 03 2016","match_date":"2016-09-03","stage_classifiercode":"99-22","member_number":"A80039","first_name":"STEVE","last_name":"STEPHENS","classification":"U","division":"PCC","hit_factor":5.6585},{"match_name":"BHPSC Monthly USPSA Indoor Match - Feb 2021 Special Classifier Match","match_date":"2021-02-27","stage_classifiercode":"99-22","member_number":"TY97339","first_name":"RICK","last_name":"ZEITUN","classification":"A","division":"PCC","hit_factor":5.6585},{"match_name":"BAPS USPSA November","match_date":"2017-11-18","stage_classifiercode":"99-22","member_number":"TY84396","first_name":"MIKE","last_name":"WILSON","classification":"C","division":"PCC","hit_factor":5.653},{"match_name":"Paul Bunyan April 7th-8th All Classifier Match NW01","match_date":"2018-04-07","stage_classifiercode":"99-22","member_number":"A90654","first_name":"RONALD","last_name":"TOLENTINO","classification":"C","division":"PCC","hit_factor":5.6485},{"match_name":"Richmond Hot Shots Dec 4-2016 USPSA Pistol match (03Dec16-05:01:39)","match_date":"2016-12-04","stage_classifiercode":"99-22","member_number":"TY33484","first_name":"CARLOS","last_name":"KATALBAS","classification":"M","division":"PCC","hit_factor":5.6391},{"match_name":"NRG Saturday August 26th - Classifier","match_date":"2017-08-26","stage_classifiercode":"99-22","member_number":"A37933","first_name":"CHUCK","last_name":"STRELECKY","classification":"A","division":"PCC","hit_factor":5.6241},{"match_name":"Paul Bunyan April 7th-8th All Classifier Match NW01","match_date":"2018-04-07","stage_classifiercode":"99-22","member_number":"A98674","first_name":"JONATHAN","last_name":"GIESER","classification":"U","division":"PCC","hit_factor":5.6225},{"match_name":"Grandbaggers September 2017","match_date":"2017-09-07","stage_classifiercode":"99-22","member_number":"TY100245","first_name":"CHRISTOPHER","last_name":"NOLAN","classification":"U","division":"PCC","hit_factor":5.6202},{"match_name":"SSPSC USPSA Jul  4-5 2020","match_date":"2020-07-01","stage_classifiercode":"99-22","member_number":"L4714","first_name":"JONATHAN","last_name":"WAKIDA","classification":"B","division":"PCC","hit_factor":5.618},{"match_name":"BORCC USPSA May 2018","match_date":"2018-05-26","stage_classifiercode":"99-22","member_number":"A77486","first_name":"JOHN","last_name":"LOGAN","classification":"B","division":"PCC","hit_factor":5.6147},{"match_name":"Richmond Hot Shots Jan 4-5-2020 USPSA Pistol","match_date":"2020-01-04","stage_classifiercode":"99-22","member_number":"L3301","first_name":"KEITH","last_name":"MIYASAKI","classification":"B","division":"PCC","hit_factor":5.6095},{"match_name":"EWPSA 2020-08","match_date":"2020-08-16","stage_classifiercode":"99-22","member_number":"L4637","first_name":"PAMELA","last_name":"HARPER","classification":"B","division":"PCC","hit_factor":5.6017},{"match_name":"LCSA USPSA ALL CLASSIFIER ","match_date":"2018-06-30","stage_classifiercode":"99-22","member_number":"FY90924","first_name":"SOPHIA","last_name":"SMITH","classification":"C","division":"PCC","hit_factor":5.5918},{"match_name":"MCAS April 2018 USPSA","match_date":"2018-04-21","stage_classifiercode":"99-22","member_number":"A63967","first_name":"JOHN","last_name":"CLAYTON","classification":"C","division":"PCC","hit_factor":5.5823},{"match_name":"Bayou City USPSA Weekly Jan 21","match_date":"2021-01-22","stage_classifiercode":"99-22","member_number":"A92443","first_name":"RAY","last_name":"FISHEL","classification":"B","division":"PCC","hit_factor":5.5807},{"match_name":"ENPS October 2020 USPSA Match","match_date":"2020-10-04","stage_classifiercode":"99-22","member_number":"TY22456","first_name":"TIM","last_name":"KLEPPER","classification":"B","division":"PCC","hit_factor":5.5788},{"match_name":"Richmond Hot Shots May 19-20-2018 USPSA Pistol Match","match_date":"2018-05-19","stage_classifiercode":"99-22","member_number":"\"\"","first_name":"CRAIG","last_name":"MORIMOTO","classification":"U","division":"PCC","hit_factor":5.5785},{"match_name":"Bayou City USPSA Weekly Jan 21","match_date":"2021-01-22","stage_classifiercode":"99-22","member_number":"TY83291","first_name":"RONALD","last_name":"GILLORY JR.","classification":"U","division":"PCC","hit_factor":5.5769},{"match_name":"GWPP March 2020 Pistol","match_date":"2020-03-14","stage_classifiercode":"99-22","member_number":"L3738","first_name":"C. JAY","last_name":"OLMSTEAD","classification":"B","division":"PCC","hit_factor":5.5728},{"match_name":"Gem City Gun Club 3-17 and 3-18-2018","match_date":"2018-03-17","stage_classifiercode":"99-22","member_number":"PEN","first_name":"SCOTT","last_name":"STEVENS","classification":"Unclassified","division":"PCC","hit_factor":5.5662},{"match_name":"MVS ANPRACS USPSA 3-19-17","match_date":"2017-03-19","stage_classifiercode":"99-22","member_number":"A85802","first_name":"JOHN","last_name":"CLER","classification":"C","division":"PCC","hit_factor":5.5659},{"match_name":"PRG 2017 Classifier Match","match_date":"2017-02-19","stage_classifiercode":"99-22","member_number":"A98143","first_name":"REX","last_name":"HO","classification":"U","division":"PCC","hit_factor":5.5556},{"match_name":"GWPP May 2021 Pistol","match_date":"2021-05-08","stage_classifiercode":"99-22","member_number":"L3738","first_name":"JAY","last_name":"OLMSTEAD","classification":"B","division":"PCC","hit_factor":5.5556},{"match_name":"February USPSA Match at C and C Indoor Range","match_date":"2020-02-18","stage_classifiercode":"99-22","member_number":"A126245","first_name":"DYLAN","last_name":"LEWIS","classification":"","division":"PCC","hit_factor":5.5556},{"match_name":"Lafayette Practical Shooters - THURS - May 6 (36 rds)","match_date":"2021-05-06","stage_classifiercode":"99-22","member_number":"TY114438","first_name":"STAN","last_name":"UHLIN","classification":"C","division":"PCC","hit_factor":5.55},{"match_name":"MESQUITE MAYHEM MONTHLY USPSA  10-11-2020","match_date":"2020-10-11","stage_classifiercode":"99-22","member_number":"A34448","first_name":"LARRY","last_name":"LEBEAU","classification":"B","division":"PCC","hit_factor":5.5453},{"match_name":"ACPSA October 2017","match_date":"2017-10-28","stage_classifiercode":"99-22","member_number":"TY70086","first_name":"LARRY","last_name":"COLSON","classification":"C","division":"PCC","hit_factor":5.5449},{"match_name":"Richmond Hot Shots Jan 4-5-2020 USPSA Pistol","match_date":"2020-01-04","stage_classifiercode":"99-22","member_number":"TY104400","first_name":"REECE","last_name":"PADRIGON","classification":"C","division":"PCC","hit_factor":5.5449},{"match_name":"DWB - Deadwood Boys USPSA December 17 2017","match_date":"2017-12-17","stage_classifiercode":"99-22","member_number":"A94923","first_name":"WILSON","last_name":"PARK","classification":"B","division":"PCC","hit_factor":5.5446},{"match_name":"Superior Practical Shooters April 2018 Match","match_date":"2018-04-04","stage_classifiercode":"99-22","member_number":"A96226","first_name":"JUDE","last_name":"AURILIO","classification":"U","division":"PCC","hit_factor":5.5402},{"match_name":"Grandbaggers 06-07-2018","match_date":"2018-06-07","stage_classifiercode":"99-22","member_number":"A99441","first_name":"LUCAS","last_name":"FERINGA","classification":"U","division":"PCC","hit_factor":5.5396},{"match_name":"BORCC USPSA May 2018","match_date":"2018-05-26","stage_classifiercode":"99-22","member_number":"A107259","first_name":"CULLEN","last_name":"COOKE","classification":"U","division":"PCC","hit_factor":5.5281},{"match_name":"EWPSA 2020-08","match_date":"2020-08-16","stage_classifiercode":"99-22","member_number":"TY120660","first_name":"RICHARD","last_name":"NELSON","classification":"C","division":"PCC","hit_factor":5.527},{"match_name":"CCPL - July 2021","match_date":"2021-07-17","stage_classifiercode":"99-22","member_number":"TY73110","first_name":"PHIL","last_name":"MCKENZIE","classification":"C","division":"PCC","hit_factor":5.526},{"match_name":"Coastal Area Practical Shooters 4-22-17","match_date":"2017-04-22","stage_classifiercode":"99-22","member_number":"TY83837","first_name":"BOB","last_name":"GUNDEL","classification":"C","division":"PCC","hit_factor":5.5227},{"match_name":"Richmond Hot Shots Jan 4-5-2020 USPSA Pistol","match_date":"2020-01-04","stage_classifiercode":"99-22","member_number":"TY48163","first_name":"ALBERTO","last_name":"TOPETE","classification":"U","division":"PCC","hit_factor":5.5198},{"match_name":"Richmond Hot Shots Dec 4-2016 USPSA Pistol match (03Dec16-05:01:39)","match_date":"2016-12-04","stage_classifiercode":"99-22","member_number":"\"\"","first_name":"LENNIE","last_name":"VILLIADOS","classification":"U","division":"PCC","hit_factor":5.5058},{"match_name":"EWPSA 2020-08","match_date":"2020-08-16","stage_classifiercode":"99-22","member_number":"A106857","first_name":"CHRISTINA","last_name":"PAHL","classification":"C","division":"PCC","hit_factor":5.5046},{"match_name":"USPSA AR02 North Arkansas Action Pistol June 11 2017","match_date":"2017-06-11","stage_classifiercode":"99-22","member_number":"\"\"","first_name":"WALT","last_name":"COLTRIN","classification":"U","division":"PCC","hit_factor":5.5028},{"match_name":"Grandbaggers 06-07-2018","match_date":"2018-06-07","stage_classifiercode":"99-22","member_number":"A83368","first_name":"DAVID","last_name":"GIBSON","classification":"U","division":"PCC","hit_factor":5.5006},{"match_name":"MS06 Team Magnolia August 2017 USPSA Match","match_date":"2017-08-06","stage_classifiercode":"99-22","member_number":"A64151","first_name":"DON","last_name":"GRANIER","classification":"U","division":"PCC","hit_factor":5.492},{"match_name":"ACPSA October 2017","match_date":"2017-10-28","stage_classifiercode":"99-22","member_number":"A90368","first_name":"JONATHON","last_name":"TRUMPOWER","classification":"U","division":"PCC","hit_factor":5.4848},{"match_name":"GWPP May 2021 Pistol","match_date":"2021-05-08","stage_classifiercode":"99-22","member_number":"TY16696","first_name":"SCOTT","last_name":"MILLER","classification":"B","division":"PCC","hit_factor":5.4845},{"match_name":"BORCC USPSA May 2018","match_date":"2018-05-26","stage_classifiercode":"99-22","member_number":"A107723","first_name":"AVERY","last_name":"MOLDEN","classification":"U","division":"PCC","hit_factor":5.4795},{"match_name":"PTPC January 7th USPSA Match","match_date":"2018-01-07","stage_classifiercode":"99-22","member_number":"A70578","first_name":"ED","last_name":"NICHOLS","classification":"U","division":"PCC","hit_factor":5.4717},{"match_name":"NRG Saturday Nov 14th - Includes a Classifier Stage","match_date":"2020-11-14","stage_classifiercode":"99-22","member_number":"TY33624","first_name":"ERIC","last_name":"CANSICIO","classification":"C","division":"PCC","hit_factor":5.4688},{"match_name":"BSTRC Apr 18 2018","match_date":"2018-04-18","stage_classifiercode":"99-22","member_number":"A100396","first_name":"MICHAEL","last_name":"SABIN","classification":"U","division":"PCC","hit_factor":5.4665},{"match_name":"CCPL - July 2021","match_date":"2021-07-17","stage_classifiercode":"99-22","member_number":"TY43238","first_name":"RICHARD A","last_name":"KONNERTH","classification":"C","division":"PCC","hit_factor":5.4622},{"match_name":"NRG Saturday April 28th- Includes a Classifier Stage","match_date":"2018-04-28","stage_classifiercode":"99-22","member_number":"\"\"","first_name":"RUSSELL","last_name":"BOBAREZ","classification":"U","division":"PCC","hit_factor":5.4565},{"match_name":"GWPP August 2020 Pistol","match_date":"2020-08-08","stage_classifiercode":"99-22","member_number":"TY16696","first_name":"SCOTT","last_name":"MILLER","classification":"B","division":"PCC","hit_factor":5.4563},{"match_name":"NHRPC - January 2020 USPSA","match_date":"2020-01-12","stage_classifiercode":"99-22","member_number":"A102632","first_name":"BILL","last_name":"COLEMAN","classification":"U","division":"PCC","hit_factor":5.4496},{"match_name":"PRG 2017 Classifier Match","match_date":"2017-02-19","stage_classifiercode":"99-22","member_number":"\"\"","first_name":"DANIEL","last_name":"LYONS","classification":"U","division":"PCC","hit_factor":5.449},{"match_name":"Richmond Hot Shots Jan 4-5-2020 USPSA Pistol","match_date":"2020-01-04","stage_classifiercode":"99-22","member_number":"FY102048","first_name":"FRANK","last_name":"ZHENG","classification":"C","division":"PCC","hit_factor":5.446},{"match_name":"MVS ANPRACS USPSA 3-19-17","match_date":"2017-03-19","stage_classifiercode":"99-22","member_number":"A73074","first_name":"STEVE","last_name":"COULTER","classification":"A","division":"PCC","hit_factor":5.4393},{"match_name":"Grandbaggers September 2017","match_date":"2017-09-07","stage_classifiercode":"99-22","member_number":"TY18312","first_name":"GEORGE","last_name":"WAGNER","classification":"U","division":"PCC","hit_factor":5.4381},{"match_name":"2020-03 Bone Creek USPSA","match_date":"2020-03-01","stage_classifiercode":"99-22","member_number":"A109656","first_name":"JOE","last_name":"MISTEK","classification":"U","division":"PCC","hit_factor":5.4316},{"match_name":"CGC 03-10-2018","match_date":"2018-03-10","stage_classifiercode":"99-22","member_number":"\"\"","first_name":"GRANT","last_name":"SCOTT","classification":"X","division":"PCC","hit_factor":5.4307},{"match_name":"March 2018 USPSA Classifier Special","match_date":"2018-03-17","stage_classifiercode":"99-22","member_number":"F98084","first_name":"LARRY","last_name":"CARL","classification":"\"\"","division":"PCC","hit_factor":5.4289},{"match_name":"Richmond Hot Shots Jan 4-5-2020 USPSA Pistol","match_date":"2020-01-04","stage_classifiercode":"99-22","member_number":"A55099","first_name":"MATTHEW","last_name":"LEONG","classification":"B","division":"PCC","hit_factor":5.4217},{"match_name":"NRG Saturday Nov 14th - Includes a Classifier Stage","match_date":"2020-11-14","stage_classifiercode":"99-22","member_number":"A96531","first_name":"BERNARD","last_name":"PONCE","classification":"U","division":"PCC","hit_factor":5.4176},{"match_name":"NRG Saturday Feb 27th Includes a Classifier Stage","match_date":"2021-02-27","stage_classifiercode":"99-22","member_number":"A131682","first_name":"HECTOR","last_name":"PILAPIL","classification":"U","division":"PCC","hit_factor":5.3996},{"match_name":"Richmond Hot Shots Jan 4-5-2020 USPSA Pistol","match_date":"2020-01-04","stage_classifiercode":"99-22","member_number":"TY68229","first_name":"J.C.","last_name":"SMITH","classification":"B","division":"PCC","hit_factor":5.3922},{"match_name":"YMM IPSC02 2020_08_09","match_date":"2020-08-09","stage_classifiercode":"99-22","member_number":"TY22616","first_name":"ANNETTE","last_name":"WILLIAMSON","classification":"C","division":"PCC","hit_factor":5.3846},{"match_name":"SSPSC USPSA Jul  4-5 2020","match_date":"2020-07-01","stage_classifiercode":"99-22","member_number":"A104233","first_name":"JOHN","last_name":"GATUS","classification":"B","division":"PCC","hit_factor":5.3763},{"match_name":"Pinetucky USPSA 05-20-17","match_date":"2017-05-20","stage_classifiercode":"99-22","member_number":"A83077","first_name":"ROBERT","last_name":"SCHULTZ","classification":"U","division":"PCC","hit_factor":5.3678},{"match_name":"GA Firing Line USPSA 2021-08-12","match_date":"2021-08-12","stage_classifiercode":"99-22","member_number":"A130449","first_name":"ALEXANDER","last_name":"CASTIGLIONE","classification":"U - Unclassified","division":"PCC","hit_factor":5.3589},{"match_name":"Coastal Area Practical Shooters 4-22-17","match_date":"2017-04-22","stage_classifiercode":"99-22","member_number":"A68296","first_name":"TIMOTHY","last_name":"CURRIE","classification":"C","division":"PCC","hit_factor":5.3589},{"match_name":"Crooked Creek Pistol League - December 2017","match_date":"2017-12-03","stage_classifiercode":"99-22","member_number":"A100346","first_name":"JAMES","last_name":"SINGER","classification":"C","division":"PCC","hit_factor":5.3456},{"match_name":"Eagle USPSA 08-31-2020 CLASSIFIER MATCH","match_date":"2020-08-31","stage_classifiercode":"99-22","member_number":"A126579","first_name":"JONDAE","last_name":"KING","classification":"U","division":"PCC","hit_factor":5.3443},{"match_name":"BAPS USPSA November","match_date":"2017-11-18","stage_classifiercode":"99-22","member_number":"A67608","first_name":"GERRIT","last_name":"MILKS","classification":"C","division":"PCC","hit_factor":5.3412},{"match_name":"PRG 2017 Classifier Match","match_date":"2017-02-19","stage_classifiercode":"99-22","member_number":"A99955","first_name":"RAY","last_name":"PALACIO","classification":"U","division":"PCC","hit_factor":5.3393},{"match_name":"Bulletstop USPSA","match_date":"2016-09-30","stage_classifiercode":"99-22","member_number":"A-93320","first_name":"JOSH","last_name":"LUINSTRA","classification":"U","division":"PCC","hit_factor":5.3381},{"match_name":"PRG 2017 Classifier Match","match_date":"2017-02-19","stage_classifiercode":"99-22","member_number":"A100335","first_name":"SANTIAGO","last_name":"LABOS","classification":"U","division":"PCC","hit_factor":5.3076},{"match_name":"TAP USPSA Pistol Classifier Match July 31 2016 (31Jul16-07:37:59)","match_date":"2016-07-31","stage_classifiercode":"99-22","member_number":"TY76839","first_name":"THOMAS","last_name":"WU","classification":"U","division":"PCC","hit_factor":5.298},{"match_name":"TAP USPSA Pistol Classifier Match July 31 2016 (31Jul16-07:37:59)","match_date":"2016-07-31","stage_classifiercode":"99-22","member_number":"TY33484","first_name":"CARLOS","last_name":"KATALBAS","classification":"U","division":"PCC","hit_factor":5.2957},{"match_name":"Extreme GM USPSA February","match_date":"2020-02-21","stage_classifiercode":"99-22","member_number":"TY97123","first_name":"FERNANDO","last_name":"FERREIRA","classification":"A","division":"PCC","hit_factor":5.2953},{"match_name":"Deadwood Boys USPSA All Classifier Match - 11 June 2017","match_date":"2017-06-11","stage_classifiercode":"99-22","member_number":"a95542","first_name":"FRITO","last_name":"BANDITO","classification":"U","division":"PCC","hit_factor":5.2941},{"match_name":"Superior Practical Shooters April 2018 Match","match_date":"2018-04-04","stage_classifiercode":"99-22","member_number":"\"\"","first_name":"AARON","last_name":"BUTSKO","classification":"U","division":"PCC","hit_factor":5.2934},{"match_name":"Crooked Creek Pistol League - December 2017","match_date":"2017-12-03","stage_classifiercode":"99-22","member_number":"A68311","first_name":"TILL","last_name":"ZIMMERMANN","classification":"U","division":"PCC","hit_factor":5.293},{"match_name":"PRG 2017 Classifier Match","match_date":"2017-02-19","stage_classifiercode":"99-22","member_number":"TY73536","first_name":"LIEF","last_name":"RUTZBECK","classification":"U","division":"PCC","hit_factor":5.2775},{"match_name":"LIPSA - February 26th 2017 - USPSA Match","match_date":"2017-02-26","stage_classifiercode":"99-22","member_number":"A55119","first_name":"NICHOLAS","last_name":"ANDRONICA","classification":"U","division":"PCC","hit_factor":5.2743},{"match_name":"PCWC USPSA  1 27 2018","match_date":"2018-01-27","stage_classifiercode":"99-22","member_number":"A64200","first_name":"LOUIS","last_name":"WEAVER","classification":"B","division":"PCC","hit_factor":5.2701},{"match_name":"Hampden RPC June USPSA Match","match_date":"2021-06-13","stage_classifiercode":"99-22","member_number":"TY61007","first_name":"STEVE","last_name":"RICHENS","classification":"B","division":"PCC","hit_factor":5.2693},{"match_name":"Pinetucky USPSA 05-20-17","match_date":"2017-05-20","stage_classifiercode":"99-22","member_number":"A102579","first_name":"CAITLIN","last_name":"VORAVUDHI","classification":"U","division":"PCC","hit_factor":5.2681},{"match_name":"SLPSA June USPSA","match_date":"2017-06-17","stage_classifiercode":"99-22","member_number":"\"\"","first_name":"MICHAEL","last_name":"HARRISON","classification":"U","division":"PCC","hit_factor":5.2632},{"match_name":"PRG 2017 Classifier Match","match_date":"2017-02-19","stage_classifiercode":"99-22","member_number":"L3950","first_name":"BO","last_name":"WANG","classification":"U","division":"PCC","hit_factor":5.2574},{"match_name":"MS06 Team Magnolia USPSA","match_date":"2017-02-05","stage_classifiercode":"99-22","member_number":"TY36282","first_name":"BILL","last_name":"MAHLEY","classification":"U","division":"PCC","hit_factor":5.2562},{"match_name":"PTPC January 7th USPSA Match","match_date":"2018-01-07","stage_classifiercode":"99-22","member_number":"L4151","first_name":"KENNY","last_name":"POLHAMUS","classification":"U","division":"PCC","hit_factor":5.2434},{"match_name":"MS06 Team Magnolia August 2017 USPSA Match","match_date":"2017-08-06","stage_classifiercode":"99-22","member_number":"TY72594","first_name":"THOMAS","last_name":"LOVELL JR","classification":"U","division":"PCC","hit_factor":5.2385},{"match_name":"WNPL USPSA - Nov 2017","match_date":"2017-11-05","stage_classifiercode":"99-22","member_number":"A17426","first_name":"PAUL","last_name":"TESSIER","classification":"C","division":"PCC","hit_factor":5.2356},{"match_name":"EWPSA 2017-11","match_date":"2017-11-18","stage_classifiercode":"99-22","member_number":"A28830","first_name":"HARLAN","last_name":"BRADLEY","classification":"U","division":"PCC","hit_factor":5.2299},{"match_name":"GWPP March 2020 Pistol","match_date":"2020-03-14","stage_classifiercode":"99-22","member_number":"A57537","first_name":"SID","last_name":"KULCAK","classification":"C","division":"PCC","hit_factor":5.2288},{"match_name":"USPSA AR02 North Arkansas Action Pistol June 11 2017","match_date":"2017-06-11","stage_classifiercode":"99-22","member_number":"a71962","first_name":"BRIAN","last_name":"CALLIHAN","classification":"U","division":"PCC","hit_factor":5.2275},{"match_name":"Brock's Gap USPSA September 4 2021","match_date":"2021-09-04","stage_classifiercode":"99-22","member_number":"A133265","first_name":"DOUG","last_name":"FERRELL","classification":"U","division":"PCC","hit_factor":5.2224},{"match_name":"ASPS MI20  SEPTEMBER ","match_date":"2020-09-19","stage_classifiercode":"99-22","member_number":"fy92491","first_name":"RON","last_name":"RICHARDS","classification":"C","division":"PCC","hit_factor":5.2158},{"match_name":"PRPS USPSA  September 24 2017","match_date":"2017-09-17","stage_classifiercode":"99-22","member_number":"A89161","first_name":"JARED","last_name":"STANGER","classification":"M","division":"PCC","hit_factor":5.2156},{"match_name":"Rankin Field Saturday USPSA","match_date":"2017-09-02","stage_classifiercode":"99-22","member_number":"A92660","first_name":"LAURI","last_name":"VAUGHN","classification":"C","division":"PCC","hit_factor":5.2104},{"match_name":"MAPSA Beaverbrook September Match","match_date":"2018-09-08","stage_classifiercode":"99-22","member_number":"L2789","first_name":"BILL","last_name":"MCCARTY","classification":"C","division":"PCC","hit_factor":5.2093},{"match_name":"GWPP March 2020 Pistol","match_date":"2020-03-14","stage_classifiercode":"99-22","member_number":"TY67960","first_name":"JIM","last_name":"BARRETT","classification":"U","division":"PCC","hit_factor":5.2023},{"match_name":"Superior Practical Shooters April 2018 Match","match_date":"2018-04-04","stage_classifiercode":"99-22","member_number":"A109463","first_name":"MAX","last_name":"SEDA","classification":"D","division":"PCC","hit_factor":5.1903},{"match_name":"EDPS USPSA January 4 2020","match_date":"2020-01-04","stage_classifiercode":"99-22","member_number":"Fy98474","first_name":"TONY","last_name":"PETERSON","classification":"C","division":"PCC","hit_factor":5.1903},{"match_name":"BAPS USPSA November","match_date":"2017-11-18","stage_classifiercode":"99-22","member_number":"A104889","first_name":"SUSANA","last_name":"PURIN","classification":"\"\"","division":"PCC","hit_factor":5.1867},{"match_name":"Paul Bunyan April 7th-8th All Classifier Match NW01","match_date":"2018-04-07","stage_classifiercode":"99-22","member_number":"TY47022","first_name":"BRUCE","last_name":"WOOD (2)","classification":"U","division":"PCC","hit_factor":5.186},{"match_name":"Extreme GM USPSA February","match_date":"2020-02-21","stage_classifiercode":"99-22","member_number":"A95368","first_name":"BRYAN","last_name":"AMBROSIO","classification":"C","division":"PCC","hit_factor":5.1643},{"match_name":"Yakima YRPA February Indoor USPSA  2017","match_date":"2017-02-25","stage_classifiercode":"99-22","member_number":"TY61539","first_name":"ANN","last_name":"BLOSSER","classification":"U","division":"PCC","hit_factor":5.1639},{"match_name":"BRSP Tuesday Night USPSA Match - Feb 6","match_date":"2018-02-07","stage_classifiercode":"99-22","member_number":"FY83723","first_name":"BEN","last_name":"HIGGINS","classification":"A","division":"PCC","hit_factor":5.1601},{"match_name":"BSTRC Apr 18 2018","match_date":"2018-04-18","stage_classifiercode":"99-22","member_number":"A14360","first_name":"RICK","last_name":"RUETER","classification":"C","division":"PCC","hit_factor":5.1565},{"match_name":"DWB - Deadwood Boys USPSA December 17 2017","match_date":"2017-12-17","stage_classifiercode":"99-22","member_number":"TY93614","first_name":"ANDY","last_name":"BONETTO","classification":"C","division":"PCC","hit_factor":5.1418},{"match_name":"SAPSA August 2017","match_date":"2017-08-19","stage_classifiercode":"99-22","member_number":"TY81871","first_name":"ADAM","last_name":"GINDEN","classification":"X","division":"PCC","hit_factor":5.1418},{"match_name":"July NCPL Match","match_date":"2018-07-22","stage_classifiercode":"99-22","member_number":"TY67972","first_name":"SCOTT","last_name":"SAVERCOOL","classification":"U","division":"PCC","hit_factor":5.1376},{"match_name":"Gem City Gun Club 3-4 and 3-5-17","match_date":"2017-03-04","stage_classifiercode":"99-22","member_number":"A18876","first_name":"ED","last_name":"NIELSEN","classification":"U","division":"PCC","hit_factor":5.1333},{"match_name":"OFGC USPSA August 21 2016","match_date":"2016-08-21","stage_classifiercode":"99-22","member_number":"A50566","first_name":"NICK","last_name":"GOLDEN","classification":"U","division":"PCC","hit_factor":5.1326},{"match_name":"LIPSA - February 26th 2017 - USPSA Match","match_date":"2017-02-26","stage_classifiercode":"99-22","member_number":"\"\"","first_name":"CHARLES","last_name":"ZAMBITO","classification":"U","division":"PCC","hit_factor":5.1237},{"match_name":"NRG Saturday August 26th - Classifier","match_date":"2017-08-26","stage_classifiercode":"99-22","member_number":"\"\"","first_name":"JOHNNY","last_name":"RECLUSADO","classification":"U","division":"PCC","hit_factor":5.1235},{"match_name":"LCSA USPSA ALL CLASSIFIER ","match_date":"2018-06-30","stage_classifiercode":"99-22","member_number":"A103419","first_name":"GEORGE","last_name":"OLSAKOVSKY","classification":"C","division":"PCC","hit_factor":5.1146},{"match_name":"PRG 2017 Classifier Match","match_date":"2017-02-19","stage_classifiercode":"99-22","member_number":"L2080","first_name":"ERIC","last_name":"GANAC","classification":"U","division":"PCC","hit_factor":5.1125},{"match_name":"Brothers N Arms August 2017 USPSA Match","match_date":"2017-08-19","stage_classifiercode":"99-22","member_number":"A105060","first_name":"DANIEL","last_name":"HARRIS","classification":"U","division":"PCC","hit_factor":5.1048},{"match_name":"SAPSA August 2018","match_date":"2018-08-18","stage_classifiercode":"99-22","member_number":"A69229","first_name":"CHARLIE","last_name":"NELSON","classification":"C","division":"PCC","hit_factor":5.1011},{"match_name":"PRG 2017 Classifier Match","match_date":"2017-02-19","stage_classifiercode":"99-22","member_number":"A91972","first_name":"TOM","last_name":"HAGAN","classification":"U","division":"PCC","hit_factor":5.0967},{"match_name":"NRG Sunday June 18 -1st match at PRADO","match_date":"2017-06-18","stage_classifiercode":"99-22","member_number":"TY83895","first_name":"PATRICK","last_name":"RUNION","classification":"U","division":"PCC","hit_factor":5.0909},{"match_name":"G2G Practical Shooters 08-21-2018","match_date":"2018-08-21","stage_classifiercode":"99-22","member_number":"L4190","first_name":"LARRY","last_name":"HARRISON","classification":"C","division":"PCC","hit_factor":5.0813},{"match_name":"Low Country  USPSA  June 23 ","match_date":"2018-06-22","stage_classifiercode":"99-22","member_number":"A110754","first_name":"AARON","last_name":"SELLERS","classification":"U","division":"PCC","hit_factor":5.0788},{"match_name":"Extreme GM USPSA February","match_date":"2020-02-21","stage_classifiercode":"99-22","member_number":"A115625","first_name":"RAFAEL","last_name":"SERRANO","classification":"C","division":"PCC","hit_factor":5.0788},{"match_name":"NRG Saturday Nov 14th - Includes a Classifier Stage","match_date":"2020-11-14","stage_classifiercode":"99-22","member_number":"A99077","first_name":"DANTE","last_name":"CABELINO","classification":"C","division":"PCC","hit_factor":5.074},{"match_name":"Ontelaunee USPSA Hose Fest","match_date":"2021-01-02","stage_classifiercode":"99-22","member_number":"A107606","first_name":"JOHN","last_name":"KOREA","classification":"U","division":"PCC","hit_factor":5.0633},{"match_name":"NRG Saturday August 26th - Classifier","match_date":"2017-08-26","stage_classifiercode":"99-22","member_number":"A73286","first_name":"JD","last_name":"MADAMBA","classification":"U","division":"PCC","hit_factor":5.0479},{"match_name":"OFGC USPSA August 21 2016","match_date":"2016-08-21","stage_classifiercode":"99-22","member_number":"FY45785","first_name":"BRUCE","last_name":"BETHELL","classification":"U","division":"PCC","hit_factor":5.0479},{"match_name":"WELD ECO09 20181021","match_date":"2018-10-21","stage_classifiercode":"99-22","member_number":"TY82090","first_name":"MATT","last_name":"GROSJEAN PCC","classification":"U","division":"PCC","hit_factor":5.0439},{"match_name":"2020-03 Bone Creek USPSA","match_date":"2020-03-01","stage_classifiercode":"99-22","member_number":"TY104525","first_name":"STEVE","last_name":"GROSHONG","classification":"U","division":"PCC","hit_factor":5.042},{"match_name":"ENPS October 2020 USPSA Match","match_date":"2020-10-04","stage_classifiercode":"99-22","member_number":"A109253","first_name":"TODD","last_name":"REZNICEK","classification":"C","division":"PCC","hit_factor":5.042},{"match_name":"NRG Saturday April 28th- Includes a Classifier Stage","match_date":"2018-04-28","stage_classifiercode":"99-22","member_number":"A104521","first_name":"ANDREW","last_name":"GENKUONG","classification":"U","division":"PCC","hit_factor":5.0407},{"match_name":"SSS Pistol Match March 2017","match_date":"2017-03-12","stage_classifiercode":"99-22","member_number":"\"\"","first_name":"KENNETH","last_name":"CASH","classification":"U (Unclassified)","division":"PCC","hit_factor":5.0251},{"match_name":"INAS PM January 2017 USPSA","match_date":"2017-01-07","stage_classifiercode":"99-22","member_number":"TY71416","first_name":"BILL","last_name":"HANEY","classification":"C","division":"PCC","hit_factor":5.0224},{"match_name":"NRG Saturday Nov 14th - Includes a Classifier Stage","match_date":"2020-11-14","stage_classifiercode":"99-22","member_number":"TY103264","first_name":"ALEXIS","last_name":"AFAGHI","classification":"C","division":"PCC","hit_factor":5.0193},{"match_name":"2020-03 Bone Creek USPSA","match_date":"2020-03-01","stage_classifiercode":"99-22","member_number":"A102504","first_name":"JAVIS","last_name":"MCGEE","classification":"U","division":"PCC","hit_factor":5},{"match_name":"PRG 2017 Classifier Match","match_date":"2017-02-19","stage_classifiercode":"99-22","member_number":"A75568","first_name":"MEL","last_name":"LLIDO","classification":"U","division":"PCC","hit_factor":4.9948},{"match_name":"CTASA 3rd Sunday USPSA at Triple C Tactical - 6-17- 2018","match_date":"2018-06-17","stage_classifiercode":"99-22","member_number":"a96761","first_name":"RICHARD","last_name":"HAERTLING","classification":"C","division":"PCC","hit_factor":4.9875},{"match_name":"Paul Bunyan April 7th-8th All Classifier Match NW01","match_date":"2018-04-07","stage_classifiercode":"99-22","member_number":"A-83609","first_name":"SCOTT","last_name":"WHITING","classification":"U","division":"PCC","hit_factor":4.9793},{"match_name":"SFPC June 7 2020 PM     USPSA Monthly Match","match_date":"2020-06-07","stage_classifiercode":"99-22","member_number":"TY118183","first_name":"CHRISTOPHER","last_name":"GAITANIS","classification":"U","division":"PCC","hit_factor":4.9793},{"match_name":"Deadwood Boys USPSA All Classifier Match - 11 June 2017","match_date":"2017-06-11","stage_classifiercode":"99-22","member_number":"A95457","first_name":"JOHN","last_name":"JARAMILLO","classification":"U","division":"PCC","hit_factor":4.9734},{"match_name":"Gem City Gun Club 3-17 and 3-18-2018","match_date":"2018-03-17","stage_classifiercode":"99-22","member_number":"A18876","first_name":"ED","last_name":"NIELSEN","classification":"B","division":"PCC","hit_factor":4.9678},{"match_name":"BSPSC 2018 August Special Classifier","match_date":"2018-08-12","stage_classifiercode":"99-22","member_number":"TY77508","first_name":"LEE","last_name":"BERGMAN","classification":"B","division":"PCC","hit_factor":4.9645},{"match_name":"Richmond Hot Shots May 19-20-2018 USPSA Pistol Match","match_date":"2018-05-19","stage_classifiercode":"99-22","member_number":"A105150","first_name":"MARK","last_name":"RONAN","classification":"U","division":"PCC","hit_factor":4.9603},{"match_name":"Cops September 2016 USPSA CLASSIFIER","match_date":"2016-09-04","stage_classifiercode":"99-22","member_number":"a19657","first_name":"BOB","last_name":"PERRY","classification":"B","division":"PCC","hit_factor":4.9603},{"match_name":"GA Firing Line USPSA 2021-08-12","match_date":"2021-08-12","stage_classifiercode":"99-22","member_number":"A127568","first_name":"CARL","last_name":"FLORES","classification":"U - Unclassified","division":"PCC","hit_factor":4.9312},{"match_name":"FMPSA Super Classifier March 19th 2017","match_date":"2017-03-19","stage_classifiercode":"99-22","member_number":"A5341","first_name":"LARRY","last_name":"MANNING","classification":"\"\"","division":"PCC","hit_factor":4.9289},{"match_name":"Texarkana Gun Club USPSA Match - June 2018","match_date":"2018-06-02","stage_classifiercode":"99-22","member_number":"\"\"","first_name":"T.J.","last_name":"OWENS","classification":"U","division":"PCC","hit_factor":4.9123},{"match_name":"DWB - Deadwood Boys USPSA 20 September 2020  Classifier Match Makeup","match_date":"2020-09-20","stage_classifiercode":"99-22","member_number":"TY-93265","first_name":"BILL","last_name":"DUNN","classification":"D","division":"PCC","hit_factor":4.9068},{"match_name":"USPSA Bass River June 2017","match_date":"2017-06-04","stage_classifiercode":"99-22","member_number":"A43588","first_name":"DENNIS","last_name":"GARANT","classification":"\"\"","division":"PCC","hit_factor":4.9037},{"match_name":"NRG Saturday Feb 27th Includes a Classifier Stage","match_date":"2021-02-27","stage_classifiercode":"99-22","member_number":"A129907","first_name":"DONG","last_name":"PADING","classification":"D","division":"PCC","hit_factor":4.8994},{"match_name":"LCSA USPSA ALL CLASSIFIER ","match_date":"2018-06-30","stage_classifiercode":"99-22","member_number":"41520","first_name":"KEITH","last_name":"MOORE","classification":"U","division":"PCC","hit_factor":4.8863},{"match_name":"LdF USPSA Match June 23 2018","match_date":"2018-06-23","stage_classifiercode":"99-22","member_number":"A109567","first_name":"PAUL","last_name":"BRETTON","classification":"U","division":"PCC","hit_factor":4.878},{"match_name":"NRG Saturday Nov 14th - Includes a Classifier Stage","match_date":"2020-11-14","stage_classifiercode":"99-22","member_number":"TY74329","first_name":"KITA","last_name":"BUSSE","classification":"U","division":"PCC","hit_factor":4.8699},{"match_name":"Cactus USPSA ALL CLASSIFIER January 2021","match_date":"2021-01-03","stage_classifiercode":"99-22","member_number":"TY12765","first_name":"PHILLIP","last_name":"MEYERS","classification":"U","division":"PCC","hit_factor":4.8696},{"match_name":"GWPP May 2021 Pistol","match_date":"2021-05-08","stage_classifiercode":"99-22","member_number":"TY13721","first_name":"BILL","last_name":"HUNTER","classification":"C","division":"PCC","hit_factor":4.8662},{"match_name":"USPSA MO21 2Alpha SBRC April 2018 Special Classifier","match_date":"2018-04-28","stage_classifiercode":"99-22","member_number":"A98119","first_name":"STEVE","last_name":"VESTAL","classification":"U","division":"PCC","hit_factor":4.8536},{"match_name":"Paul Bunyan April 7th-8th All Classifier Match NW01","match_date":"2018-04-07","stage_classifiercode":"99-22","member_number":"A96809","first_name":"JUSTIN","last_name":"HILL","classification":"U","division":"PCC","hit_factor":4.8309},{"match_name":"Rio Salado RMAP August 2021","match_date":"2021-08-15","stage_classifiercode":"99-22","member_number":"L2359","first_name":"YVETTE","last_name":"LASS","classification":"D","division":"PCC","hit_factor":4.8234},{"match_name":"BRSP Tuesday Night USPSA Match","match_date":"2021-08-25","stage_classifiercode":"99-22","member_number":"A135385","first_name":"NATALYN","last_name":"WOOD","classification":"U","division":"PCC","hit_factor":4.8193},{"match_name":"Brothers N Arms August 2017 USPSA Match","match_date":"2017-08-19","stage_classifiercode":"99-22","member_number":"A99028","first_name":"JOHN","last_name":"CAUSEY","classification":"U","division":"PCC","hit_factor":4.8133},{"match_name":"Pioneer Action Shooters Jun 2017 Match","match_date":"2017-06-25","stage_classifiercode":"99-22","member_number":"A96901","first_name":"JOE","last_name":"WOO","classification":"U","division":"PCC","hit_factor":4.8128},{"match_name":"Hampden RPC June USPSA Match","match_date":"2021-06-13","stage_classifiercode":"99-22","member_number":"TY84597","first_name":"NORMAN","last_name":"DAVIS","classification":"C","division":"PCC","hit_factor":4.8043},{"match_name":"NRG Saturday Nov 14th - Includes a Classifier Stage","match_date":"2020-11-14","stage_classifiercode":"99-22","member_number":"A125350","first_name":"EDWIN","last_name":"DE LEON","classification":"D","division":"PCC","hit_factor":4.7882},{"match_name":"Extreme GM USPSA February","match_date":"2020-02-21","stage_classifiercode":"99-22","member_number":"A62670","first_name":"DARREN","last_name":"SCHNEIDER","classification":"M","division":"PCC","hit_factor":4.7809},{"match_name":"APSC USPSA  2-1-20","match_date":"2020-02-01","stage_classifiercode":"99-22","member_number":"NA","first_name":"GREG","last_name":"UMBAY","classification":"U","division":"PCC","hit_factor":4.7619},{"match_name":"FAS Sunday USPSA Match","match_date":"2020-02-16","stage_classifiercode":"99-22","member_number":"A126158","first_name":"SAM","last_name":"TERWILLIGER","classification":"U","division":"PCC","hit_factor":4.7468},{"match_name":"LPRGC - Lower Providence USPSA November 2018","match_date":"2018-11-03","stage_classifiercode":"99-22","member_number":"TY8758","first_name":"STEPHEN","last_name":"MIRANDA","classification":"U","division":"PCC","hit_factor":4.7465},{"match_name":"BORCC USPSA May 2018","match_date":"2018-05-26","stage_classifiercode":"99-22","member_number":"L3568","first_name":"DAVE","last_name":"WARREN","classification":"C","division":"PCC","hit_factor":4.7458},{"match_name":"Superior Practical Shooters March  Match","match_date":"2020-03-04","stage_classifiercode":"99-22","member_number":"A112248","first_name":"AARON","last_name":"BUTSKO","classification":"B","division":"PCC","hit_factor":4.7404},{"match_name":"SAPSA August 2017","match_date":"2017-08-19","stage_classifiercode":"99-22","member_number":"A7739","first_name":"JIM","last_name":"TICE","classification":"A","division":"PCC","hit_factor":4.7377},{"match_name":"12-03-16 Points Match","match_date":"2016-12-03","stage_classifiercode":"99-22","member_number":"\"\"","first_name":"CLAYTON","last_name":"BISHOP","classification":"none","division":"PCC","hit_factor":4.7348},{"match_name":"March 2018 USPSA Classifier Special","match_date":"2018-03-17","stage_classifiercode":"99-22","member_number":"F107405","first_name":"RICK","last_name":"TEPER","classification":"\"\"","division":"PCC","hit_factor":4.7231},{"match_name":"Pioneer Action Shooters Jun 2017 Match","match_date":"2017-06-25","stage_classifiercode":"99-22","member_number":"A77615","first_name":"JAMES","last_name":"SQUIRES","classification":"C","division":"PCC","hit_factor":4.7207},{"match_name":"Richmond Hot Shots Dec 4-2016 USPSA Pistol match (03Dec16-05:01:39)","match_date":"2016-12-04","stage_classifiercode":"99-22","member_number":"L2249","first_name":"NORBERT","last_name":"BARAOIDAN","classification":"U","division":"PCC","hit_factor":4.717},{"match_name":"FAS  Sunday USPSA","match_date":"2018-11-04","stage_classifiercode":"99-22","member_number":"TY90397","first_name":"JOEY","last_name":"MARRAPODI","classification":"B","division":"PCC","hit_factor":4.7131},{"match_name":"BRSP Tuesday Night USPSA Match","match_date":"2021-08-25","stage_classifiercode":"99-22","member_number":"A135361","first_name":"CHRIS","last_name":"OLDS","classification":"B","division":"PCC","hit_factor":4.7019},{"match_name":"Applied IN25 USPSA October Classifier Match 2018","match_date":"2018-10-17","stage_classifiercode":"99-22","member_number":"A106525","first_name":"GENO","last_name":"HESSION","classification":"C","division":"PCC","hit_factor":4.6943},{"match_name":"INAS PM January 2017 USPSA","match_date":"2017-01-07","stage_classifiercode":"99-22","member_number":"TY69078","first_name":"LORI","last_name":"COOK","classification":"C","division":"PCC","hit_factor":4.6916},{"match_name":"SSPSC USPSA Jul  4-5 2020","match_date":"2020-07-01","stage_classifiercode":"99-22","member_number":"A102985","first_name":"JENN","last_name":"FERNANDEZ","classification":"C","division":"PCC","hit_factor":4.6847},{"match_name":"Bossier Parish Practical Shooters August 16 2020","match_date":"2020-08-16","stage_classifiercode":"99-22","member_number":"TY116349","first_name":"OWEN","last_name":"MCDONNELL","classification":"U","division":"PCC","hit_factor":4.662},{"match_name":"LIPSA - February 26th 2017 - USPSA Match","match_date":"2017-02-26","stage_classifiercode":"99-22","member_number":"\"\"","first_name":"ROB","last_name":"SEAMAN","classification":"U","division":"PCC","hit_factor":4.6591},{"match_name":"DWB Deadwood Boys USPSA 04 December 2016","match_date":"2016-12-04","stage_classifiercode":"99-22","member_number":"ty20772","first_name":"JUAN","last_name":"HERNANDEZ","classification":"U","division":"PCC","hit_factor":4.6549},{"match_name":"TCGC Polo July 2021","match_date":"2021-07-25","stage_classifiercode":"99-22","member_number":"L1697","first_name":"DENNY","last_name":"SHADEL","classification":"C","division":"PCC","hit_factor":4.6358},{"match_name":"Superior Practical Shooters March  Match","match_date":"2020-03-04","stage_classifiercode":"99-22","member_number":"A115914","first_name":"ERIC","last_name":"WILSON","classification":"U","division":"PCC","hit_factor":4.6296},{"match_name":"Gem City Gun Club 3-17 and 3-18-2018","match_date":"2018-03-17","stage_classifiercode":"99-22","member_number":"L3880","first_name":"JOE","last_name":"PARADISI","classification":"C","division":"PCC","hit_factor":4.6281},{"match_name":"MS06 Team Magnolia August 2017 USPSA Match","match_date":"2017-08-06","stage_classifiercode":"99-22","member_number":"TY3936","first_name":"TOMMY","last_name":"CABELL","classification":"U","division":"PCC","hit_factor":4.6281},{"match_name":"Richmond Hot Shots May 19-20-2018 USPSA Pistol Match","match_date":"2018-05-19","stage_classifiercode":"99-22","member_number":"L1620","first_name":"THOMAS","last_name":"CHAN","classification":"U","division":"PCC","hit_factor":4.6092},{"match_name":"LPRGC - Lower Providence USPSA November 2018","match_date":"2018-11-03","stage_classifiercode":"99-22","member_number":"\"\"","first_name":"JEFFREY","last_name":"BRUNELLE","classification":"U","division":"PCC","hit_factor":4.5997},{"match_name":"Deadwood Boys USPSA All Classifier Match - 11 June 2017","match_date":"2017-06-11","stage_classifiercode":"99-22","member_number":"a98325","first_name":"BRONCO","last_name":"LANE","classification":"U","division":"PCC","hit_factor":4.5922},{"match_name":"12a Fecha USPSA","match_date":"2017-11-12","stage_classifiercode":"99-22","member_number":"A90765","first_name":"HEBER","last_name":"SOTO","classification":"U","division":"PCC","hit_factor":4.5767},{"match_name":"NRG Saturday April 28th- Includes a Classifier Stage","match_date":"2018-04-28","stage_classifiercode":"99-22","member_number":"TY98135","first_name":"PHILLIP","last_name":"HOANG","classification":"B","division":"PCC","hit_factor":4.5732},{"match_name":"ENPS October 2020 USPSA Match","match_date":"2020-10-04","stage_classifiercode":"99-22","member_number":"TY91960","first_name":"RODNEY","last_name":"DEWEY","classification":"C","division":"PCC","hit_factor":4.5726},{"match_name":"Cactus USPSA ALL CLASSIFIER January 2021","match_date":"2021-01-03","stage_classifiercode":"99-22","member_number":"TY105571","first_name":"JAMES","last_name":"JOHNSON","classification":"U","division":"PCC","hit_factor":4.5677},{"match_name":"Gem City Gun Club 3-4 and 3-5-17","match_date":"2017-03-04","stage_classifiercode":"99-22","member_number":"PEN","first_name":"SHANNON","last_name":"MOORE","classification":"U","division":"PCC","hit_factor":4.5662},{"match_name":"NRG Sunday June 18 -1st match at PRADO","match_date":"2017-06-18","stage_classifiercode":"99-22","member_number":"FY60197","first_name":"MAGGIE","last_name":"REESE","classification":"U","division":"PCC","hit_factor":4.5593},{"match_name":"ACPSA October 2017","match_date":"2017-10-28","stage_classifiercode":"99-22","member_number":"FY92025","first_name":"MATT","last_name":"MORRISON","classification":"U","division":"PCC","hit_factor":4.5588},{"match_name":"GWPP August 2020 Pistol","match_date":"2020-08-08","stage_classifiercode":"99-22","member_number":"A50232","first_name":"MARK","last_name":"MEYERS","classification":"B","division":"PCC","hit_factor":4.551},{"match_name":"USPSA Strategic Edge SEGR June 19th 2021","match_date":"2021-06-19","stage_classifiercode":"99-22","member_number":"A117129","first_name":"EITAN","last_name":"GROSS","classification":"C","division":"PCC","hit_factor":4.5386},{"match_name":"Gem City Gun Club 3-17 and 3-18-2018","match_date":"2018-03-17","stage_classifiercode":"99-22","member_number":"TY95584","first_name":"MICHAEL","last_name":"ORLANDI","classification":"D","division":"PCC","hit_factor":4.5365},{"match_name":"North East Ohio Shooters - OHN06 - 2017-08-13","match_date":"2017-08-13","stage_classifiercode":"99-22","member_number":"TY83262","first_name":"RANDY","last_name":"ROSCOE","classification":"U","division":"PCC","hit_factor":4.534},{"match_name":"Crooked Creek Pistol League - December 2017","match_date":"2017-12-03","stage_classifiercode":"99-22","member_number":"L2450","first_name":"BUD","last_name":"CONNOLLY","classification":"U","division":"PCC","hit_factor":4.5296},{"match_name":"Richmond Hot Shots May 19-20-2018 USPSA Pistol Match","match_date":"2018-05-19","stage_classifiercode":"99-22","member_number":"L3415","first_name":"RICKY","last_name":"FONG","classification":"C","division":"PCC","hit_factor":4.5283},{"match_name":"SSPSC USPSA Jul  4-5 2020","match_date":"2020-07-01","stage_classifiercode":"99-22","member_number":"TY94878","first_name":"DAVID","last_name":"FERNANDEZ","classification":"C","division":"PCC","hit_factor":4.5198},{"match_name":"WELD ECO09 20181021","match_date":"2018-10-21","stage_classifiercode":"99-22","member_number":"A14360","first_name":"RICK","last_name":"RUETER","classification":"C","division":"PCC","hit_factor":4.5167},{"match_name":"USPSA MO21 2Alpha SBRC April 2018 Special Classifier","match_date":"2018-04-28","stage_classifiercode":"99-22","member_number":"A41069","first_name":"JOHN","last_name":"LUNTSFORD","classification":"U","division":"PCC","hit_factor":4.5155},{"match_name":"PRG 2017 Classifier Match","match_date":"2017-02-19","stage_classifiercode":"99-22","member_number":"A91926","first_name":"AMIE","last_name":"HAGAN","classification":"U","division":"PCC","hit_factor":4.5151},{"match_name":"GWPP March 2020 Pistol","match_date":"2020-03-14","stage_classifiercode":"99-22","member_number":"A107246","first_name":"MARK","last_name":"PARRINELLO","classification":"U","division":"PCC","hit_factor":4.5038},{"match_name":"WNPL USPSA - Nov 2017","match_date":"2017-11-05","stage_classifiercode":"99-22","member_number":"A29487","first_name":"BILL","last_name":"BOWERS","classification":"U","division":"PCC","hit_factor":4.5016},{"match_name":"Prescott 1st Saturday 5-06-17","match_date":"2017-05-06","stage_classifiercode":"99-22","member_number":"A96388","first_name":"CHRISTOPHER","last_name":"JOHNSON","classification":"unclassified","division":"PCC","hit_factor":4.4966},{"match_name":"LCSA USPSA ALL CLASSIFIER ","match_date":"2018-06-30","stage_classifiercode":"99-22","member_number":"A60017","first_name":"JOSEPH","last_name":"HOUDA","classification":"U","division":"PCC","hit_factor":4.4944},{"match_name":"NRG Saturday August 26th - Classifier","match_date":"2017-08-26","stage_classifiercode":"99-22","member_number":"\"\"","first_name":"BRIAN","last_name":"URBANO","classification":"U","division":"PCC","hit_factor":4.4883},{"match_name":"NRG Saturday Nov 14th - Includes a Classifier Stage","match_date":"2020-11-14","stage_classifiercode":"99-22","member_number":"TY97188","first_name":"SANDY","last_name":"BERNAS","classification":"U","division":"PCC","hit_factor":4.4822},{"match_name":"AIPS  USPSA Weekly 29 August 2017","match_date":"2017-08-29","stage_classifiercode":"99-22","member_number":"A72010","first_name":"JANET","last_name":"NIEMANN","classification":"Unclassified","division":"PCC","hit_factor":4.4764},{"match_name":"TAP USPSA Pistol Classifier Match July 31 2016 (31Jul16-07:37:59)","match_date":"2016-07-31","stage_classifiercode":"99-22","member_number":"FY57197","first_name":"ALLEN","last_name":"JOSON","classification":"U","division":"PCC","hit_factor":4.465},{"match_name":"Griffin USPSA April 2017","match_date":"2017-04-15","stage_classifiercode":"99-22","member_number":"A37609","first_name":"TOM","last_name":"MULLIGAN","classification":"C","division":"PCC","hit_factor":4.4479},{"match_name":"G2G Practical Shooters 08-21-2018","match_date":"2018-08-21","stage_classifiercode":"99-22","member_number":"A42337","first_name":"MIKE","last_name":"MANSILLA","classification":"A","division":"PCC","hit_factor":4.4372},{"match_name":"LdF USPSA Match June 23 2018","match_date":"2018-06-23","stage_classifiercode":"99-22","member_number":"\"\"","first_name":"ARNEL","last_name":"ARCAL","classification":"U","division":"PCC","hit_factor":4.4321},{"match_name":"Targetmasters USPSA Aug 7&8 2021","match_date":"2021-08-07","stage_classifiercode":"99-22","member_number":"TY121364","first_name":"TROY","last_name":"MCCLINTOCK","classification":"B","division":"PCC","hit_factor":4.4236},{"match_name":"Prescott 1st Saturday 5-06-17","match_date":"2017-05-06","stage_classifiercode":"99-22","member_number":"A72667","first_name":"KEN","last_name":"STUBBE","classification":"unclassified","division":"PCC","hit_factor":4.4207},{"match_name":"NRG Saturday Nov 14th - Includes a Classifier Stage","match_date":"2020-11-14","stage_classifiercode":"99-22","member_number":"F114073","first_name":"MARK","last_name":"MANUELI","classification":"U","division":"PCC","hit_factor":4.419},{"match_name":"SMPS Classifier July 2016","match_date":"2016-07-10","stage_classifiercode":"99-22","member_number":"A78817","first_name":"JOE","last_name":"MAIDA","classification":"U","division":"PCC","hit_factor":4.4174},{"match_name":"FAS Sunday USPSA Match","match_date":"2020-02-16","stage_classifiercode":"99-22","member_number":"A121168","first_name":"LILY ANN","last_name":"REECE","classification":"D","division":"PCC","hit_factor":4.417},{"match_name":"Superior Practical Shooters April 2018 Match","match_date":"2018-04-04","stage_classifiercode":"99-22","member_number":"A96225","first_name":"JAMES","last_name":"LOMPERO","classification":"U","division":"PCC","hit_factor":4.3897},{"match_name":"GWPP May 2021 Pistol","match_date":"2021-05-08","stage_classifiercode":"99-22","member_number":"L4022","first_name":"JOHN","last_name":"GRIMES","classification":"C","division":"PCC","hit_factor":4.3867},{"match_name":"NRG Saturday Feb 27th Includes a Classifier Stage","match_date":"2021-02-27","stage_classifiercode":"99-22","member_number":"A99077","first_name":"DANTE","last_name":"CABELINO","classification":"C","division":"PCC","hit_factor":4.3808},{"match_name":"Extreme GM USPSA February","match_date":"2020-02-21","stage_classifiercode":"99-22","member_number":"a114121","first_name":"ZAVI","last_name":"COHEN","classification":"U","division":"PCC","hit_factor":4.3685},{"match_name":"LdF USPSA Match June 23 2018","match_date":"2018-06-23","stage_classifiercode":"99-22","member_number":"\"\"","first_name":"ROGER","last_name":"HOLDMAN","classification":"U","division":"PCC","hit_factor":4.3597},{"match_name":"Cactus USPSA ALL CLASSIFIER January 2021","match_date":"2021-01-03","stage_classifiercode":"99-22","member_number":"A120812","first_name":"ERNIE","last_name":"FLOTTO","classification":"D","division":"PCC","hit_factor":4.3515},{"match_name":"TMGN March 22 USPSA Match","match_date":"2018-03-22","stage_classifiercode":"99-22","member_number":"\"\"","first_name":"MATT","last_name":"PRICE","classification":"\"\"","division":"PCC","hit_factor":4.3426},{"match_name":"USPSA MO21 2Alpha SBRC April 2018 Special Classifier","match_date":"2018-04-28","stage_classifiercode":"99-22","member_number":"A107478","first_name":"TEAGAN","last_name":"MACON","classification":"U","division":"PCC","hit_factor":4.3219},{"match_name":"CGC 03-10-2018","match_date":"2018-03-10","stage_classifiercode":"99-22","member_number":"TY57617","first_name":"ERIC","last_name":"DAVIS","classification":"A","division":"PCC","hit_factor":4.3194},{"match_name":"WGC July 2017 USPSA 2","match_date":"2017-07-23","stage_classifiercode":"99-22","member_number":"TY70973","first_name":"KATHY","last_name":"DYCUS","classification":"U","division":"PCC","hit_factor":4.3103},{"match_name":"LdF USPSA Match June 23 2018","match_date":"2018-06-23","stage_classifiercode":"99-22","member_number":"A111060","first_name":"ROBBIE","last_name":"ROBINSON","classification":"U","division":"PCC","hit_factor":4.2857},{"match_name":"SSS Pistol Match March 2017","match_date":"2017-03-12","stage_classifiercode":"99-22","member_number":"A88500","first_name":"ADAM","last_name":"DAVINO","classification":"C (C Class)","division":"PCC","hit_factor":4.2841},{"match_name":"North East Ohio Shooters - OHN06 - 2017-08-13","match_date":"2017-08-13","stage_classifiercode":"99-22","member_number":"A100496","first_name":"DAVID","last_name":"LILES","classification":"U","division":"PCC","hit_factor":4.2781},{"match_name":"TBAS USPSA Match  5/17/20","match_date":"2020-05-17","stage_classifiercode":"99-22","member_number":"A111791","first_name":"JOHN","last_name":"DANIELSON","classification":"","division":"PCC","hit_factor":4.2718},{"match_name":"Prescott 1st Saturday 5-06-17","match_date":"2017-05-06","stage_classifiercode":"99-22","member_number":"A98325","first_name":"BRONCO","last_name":"LANE","classification":"unclassified","division":"PCC","hit_factor":4.2644},{"match_name":"MS06 Team Magnolia August 2017 USPSA Match","match_date":"2017-08-06","stage_classifiercode":"99-22","member_number":"TY70489","first_name":"RICK","last_name":"KWACZ","classification":"U","division":"PCC","hit_factor":4.2523},{"match_name":"USPSA MO21 2Alpha SBRC April 2018 Special Classifier","match_date":"2018-04-28","stage_classifiercode":"99-22","member_number":"A76279","first_name":"TIM","last_name":"QUIRARTE","classification":"U","division":"PCC","hit_factor":4.252},{"match_name":"Prescott 1st Saturday 5-06-17","match_date":"2017-05-06","stage_classifiercode":"99-22","member_number":"TY86661","first_name":"JOHN","last_name":"VILLARINO","classification":"unclassified","division":"PCC","hit_factor":4.2413},{"match_name":"MS06 Team Magnolia USPSA","match_date":"2017-02-05","stage_classifiercode":"99-22","member_number":"\"\"","first_name":"SHAPPLEY","last_name":"HARRIS","classification":"U","division":"PCC","hit_factor":4.2029},{"match_name":"DWB - Deadwood Boys USPSA December 17 2017","match_date":"2017-12-17","stage_classifiercode":"99-22","member_number":"a65323","first_name":"JOEL","last_name":"MANAHAN","classification":"U","division":"PCC","hit_factor":4.2},{"match_name":"GRPC USPSA THE FINAL COUNTDOWN","match_date":"2020-11-01","stage_classifiercode":"99-22","member_number":"A122646","first_name":"ZACH","last_name":"HARVEY","classification":"M","division":"PCC","hit_factor":4.1905},{"match_name":"Monthly Club Match with Classifiers by Tropang Vegas","match_date":"2018-11-04","stage_classifiercode":"99-22","member_number":"A93299","first_name":"EDWARD JAMES","last_name":"REYES","classification":"C","division":"PCC","hit_factor":4.1739},{"match_name":"APSC USPSA Match 09-02-17","match_date":"2017-09-02","stage_classifiercode":"99-22","member_number":"\"\"","first_name":"WILLIAM","last_name":"LAVOIE","classification":"U","division":"PCC","hit_factor":4.1518},{"match_name":"Bayou City USPSA Weekly July 5","match_date":"2018-07-05","stage_classifiercode":"99-22","member_number":"A107489","first_name":"CHARLES","last_name":"BRADBURY","classification":"C","division":"PCC","hit_factor":4.1369},{"match_name":"Bulletstop USPSA","match_date":"2016-09-30","stage_classifiercode":"99-22","member_number":"A-93320","first_name":"JOSH","last_name":"LUINSTRA","classification":"U","division":"PCC","hit_factor":4.1331},{"match_name":"WNPL USPSA - Nov 2017","match_date":"2017-11-05","stage_classifiercode":"99-22","member_number":"A6778","first_name":"JOHN","last_name":"MCKEAN","classification":"C","division":"PCC","hit_factor":4.1254},{"match_name":"Grandbaggers September 2017","match_date":"2017-09-07","stage_classifiercode":"99-22","member_number":"A103123","first_name":"GORDON","last_name":"KAISER","classification":"U","division":"PCC","hit_factor":4.1237},{"match_name":"ENPS October 2020 USPSA Match","match_date":"2020-10-04","stage_classifiercode":"99-22","member_number":"A101681","first_name":"MICHELLE","last_name":"WOITZEL","classification":"U","division":"PCC","hit_factor":4.1123},{"match_name":"FAS  Sunday USPSA","match_date":"2018-11-04","stage_classifiercode":"99-22","member_number":"TY36580","first_name":"MARK","last_name":"HARRIGER","classification":"U","division":"PCC","hit_factor":4.1047},{"match_name":"DWB - Deadwood Boys USPSA 20 September 2020  Classifier Match Makeup","match_date":"2020-09-20","stage_classifiercode":"99-22","member_number":"TY-94897","first_name":"SHAWN","last_name":"WALTERS","classification":"U","division":"PCC","hit_factor":4.1005},{"match_name":"Richmond Hot Shots May 19-20-2018 USPSA Pistol Match","match_date":"2018-05-19","stage_classifiercode":"99-22","member_number":"L3301","first_name":"KEITH","last_name":"MIYASAKI","classification":"B","division":"PCC","hit_factor":4.0966},{"match_name":"MESQUITE MAYHEM MONTHLY USPSA  10-11-2020","match_date":"2020-10-11","stage_classifiercode":"99-22","member_number":"A104233","first_name":"JOHN","last_name":"GATUS","classification":"B","division":"PCC","hit_factor":4.0892},{"match_name":"Bossier Parish Practical Shooters August 16 2020","match_date":"2020-08-16","stage_classifiercode":"99-22","member_number":"A129971","first_name":"ADEN","last_name":"MONTOYA","classification":"U","division":"PCC","hit_factor":4.0789},{"match_name":"GWPP March 2020 Pistol","match_date":"2020-03-14","stage_classifiercode":"99-22","member_number":"L4022","first_name":"JOHN","last_name":"GRIMES","classification":"C","division":"PCC","hit_factor":4.075},{"match_name":"LCSA USPSA ALL CLASSIFIER ","match_date":"2018-06-30","stage_classifiercode":"99-22","member_number":"A109635","first_name":"JENNIFER","last_name":"HOUDA","classification":"C","division":"PCC","hit_factor":4.0733},{"match_name":"LIPSA - February 26th 2017 - USPSA Match","match_date":"2017-02-26","stage_classifiercode":"99-22","member_number":"A85299","first_name":"JOE","last_name":"LEBKUECHER","classification":"D","division":"PCC","hit_factor":4.0706},{"match_name":"MVS ANPRACS USPSA 3-19-17","match_date":"2017-03-19","stage_classifiercode":"99-22","member_number":"A96203","first_name":"EUGENE","last_name":"VANNI","classification":"C","division":"PCC","hit_factor":4.065},{"match_name":"Richmond Hot Shots May 19-20-2018 USPSA Pistol Match","match_date":"2018-05-19","stage_classifiercode":"99-22","member_number":"A94893","first_name":"KEVIN","last_name":"KWAN","classification":"U","division":"PCC","hit_factor":4.0632},{"match_name":"Texarkana Gun Club USPSA Match - June 2018","match_date":"2018-06-02","stage_classifiercode":"99-22","member_number":"\"\"","first_name":"ROBERT","last_name":"SHULL","classification":"U","division":"PCC","hit_factor":4.0452},{"match_name":"INAS PM January 2017 USPSA","match_date":"2017-01-07","stage_classifiercode":"99-22","member_number":"TY21925","first_name":"WILLIAM H","last_name":"PARKS III","classification":"B","division":"PCC","hit_factor":4.039},{"match_name":"SSPSC USPSA Jul  4-5 2020","match_date":"2020-07-01","stage_classifiercode":"99-22","member_number":"L2335","first_name":"HENRY","last_name":"CHEESMAN","classification":"M","division":"PCC","hit_factor":4.0369},{"match_name":"PCWC USPSA  1 27 2018","match_date":"2018-01-27","stage_classifiercode":"99-22","member_number":"\"\"","first_name":"MARCUS","last_name":"JEANNETTE","classification":"G","division":"PCC","hit_factor":4.0306},{"match_name":"LPRGC - Lower Providence USPSA November 2018","match_date":"2018-11-03","stage_classifiercode":"99-22","member_number":"A82492","first_name":"JOSE","last_name":"SOUSA","classification":"A","division":"PCC","hit_factor":4.0302},{"match_name":"Augusta USPSA 08-13-17","match_date":"2017-08-13","stage_classifiercode":"99-22","member_number":"PENDING","first_name":"DUSTIN","last_name":"ANDERL","classification":"U","division":"PCC","hit_factor":4.0185},{"match_name":"SLOSA Feburary 2017 USPSA","match_date":"2017-02-11","stage_classifiercode":"99-22","member_number":"NONE","first_name":"DAVID","last_name":"IRWIN","classification":"X","division":"PCC","hit_factor":4.0111},{"match_name":"TBAS USPSA Match 3/21/2021","match_date":"2021-03-21","stage_classifiercode":"99-22","member_number":"A117925","first_name":"HEIDI","last_name":"CONLON","classification":"U","division":"PCC","hit_factor":3.9943},{"match_name":"BSTRC Apr 18 2018","match_date":"2018-04-18","stage_classifiercode":"99-22","member_number":"A92252","first_name":"CHRIS","last_name":"BAKER","classification":"U","division":"PCC","hit_factor":3.9827},{"match_name":"July NCPL Match","match_date":"2018-07-22","stage_classifiercode":"99-22","member_number":"TY109699","first_name":"STEPHANIE","last_name":"CASEY","classification":"U","division":"PCC","hit_factor":3.9808},{"match_name":"Paul Bunyan April 7th-8th All Classifier Match NW01","match_date":"2018-04-07","stage_classifiercode":"99-22","member_number":"\"\"","first_name":"AARON","last_name":"SCHMITT","classification":"U","division":"PCC","hit_factor":3.9631},{"match_name":"MS06 Team Magnolia August 2017 USPSA Match","match_date":"2017-08-06","stage_classifiercode":"99-22","member_number":"\"\"","first_name":"JOHN","last_name":"CAUSEY","classification":"U","division":"PCC","hit_factor":3.9241},{"match_name":"BORCC USPSA Classifier Match February 2017","match_date":"2017-02-11","stage_classifiercode":"99-22","member_number":"TY91447","first_name":"SAL","last_name":"LOMAGRO","classification":"U","division":"PCC","hit_factor":3.9194},{"match_name":"CCPL - July 2021","match_date":"2021-07-17","stage_classifiercode":"99-22","member_number":"A112930","first_name":"MIMI","last_name":"LONG","classification":"U","division":"PCC","hit_factor":3.9079},{"match_name":"Rio Grande Practical Shooting Club - February 20th 2021","match_date":"2021-02-20","stage_classifiercode":"99-22","member_number":"A110242","first_name":"DONOVAN","last_name":"BUTLER","classification":"D","division":"PCC","hit_factor":3.9049},{"match_name":"SAPSA August 2018","match_date":"2018-08-18","stage_classifiercode":"99-22","member_number":"TY73281","first_name":"JACK","last_name":"DARTIGALONGUE","classification":"B","division":"PCC","hit_factor":3.9007},{"match_name":"Bossier Parish Practical Shooters August 16 2020","match_date":"2020-08-16","stage_classifiercode":"99-22","member_number":"TY112434","first_name":"BILL","last_name":"CARROLL","classification":"U","division":"PCC","hit_factor":3.8961},{"match_name":"The Armory Indoor League 03-24-16","match_date":"2016-03-24","stage_classifiercode":"99-22","member_number":"A87661","first_name":"JIMMY","last_name":"LACAVA","classification":"U","division":"PCC","hit_factor":3.8926},{"match_name":"BAPS USPSA November","match_date":"2017-11-18","stage_classifiercode":"99-22","member_number":"TY96553","first_name":"DANNY","last_name":"NARAMORE","classification":"C","division":"PCC","hit_factor":3.8866},{"match_name":"INAS Jan 2018 USPSA PM","match_date":"2018-01-22","stage_classifiercode":"99-22","member_number":"TY69078","first_name":"LORI","last_name":"COOK","classification":"C","division":"PCC","hit_factor":3.8789},{"match_name":"Hampden RPC June USPSA Match","match_date":"2021-06-13","stage_classifiercode":"99-22","member_number":"A54181","first_name":"EDWIN","last_name":"LEE","classification":"B","division":"PCC","hit_factor":3.8716},{"match_name":"Magnolia Rifle and Pistol Club July 2020 USPSA Match","match_date":"2020-07-05","stage_classifiercode":"99-22","member_number":"TY110761","first_name":"EDDIE","last_name":"HANEBUTH","classification":"U","division":"PCC","hit_factor":3.8567},{"match_name":"NTPS-SE October 2017","match_date":"2017-10-21","stage_classifiercode":"99-22","member_number":"A106233","first_name":"KEVIN","last_name":"WILCOX","classification":"U","division":"PCC","hit_factor":3.842},{"match_name":"Targetmasters USPSA Aug 7&8 2021","match_date":"2021-08-07","stage_classifiercode":"99-22","member_number":"TY5906","first_name":"JOHN","last_name":"HARTSOCK","classification":"C","division":"PCC","hit_factor":3.8233},{"match_name":"Cactus USPSA ALL CLASSIFIER January 2021","match_date":"2021-01-03","stage_classifiercode":"99-22","member_number":"TY95703","first_name":"GEORGE","last_name":"LOVE","classification":"U","division":"PCC","hit_factor":3.8225},{"match_name":"Richmond Hot Shots Dec 4-2016 USPSA Pistol match (03Dec16-05:01:39)","match_date":"2016-12-04","stage_classifiercode":"99-22","member_number":"\"\"","first_name":"RUEL","last_name":"CORDERO","classification":"U","division":"PCC","hit_factor":3.8173},{"match_name":"USPSA MO21 2Alpha SBRC April 2018 Special Classifier","match_date":"2018-04-28","stage_classifiercode":"99-22","member_number":"A22632","first_name":"BILL","last_name":"YEP","classification":"U","division":"PCC","hit_factor":3.8126},{"match_name":"Pinetucky USPSA CLASSIFIER MATCH 07-21-18","match_date":"2018-07-21","stage_classifiercode":"99-22","member_number":"A106493","first_name":"ERIC","last_name":"PETZOLDT","classification":"U","division":"PCC","hit_factor":3.8033},{"match_name":"Gem City Gun Club 3-17 and 3-18-2018","match_date":"2018-03-17","stage_classifiercode":"99-22","member_number":"A43229","first_name":"RICK","last_name":"BAUER","classification":"C","division":"PCC","hit_factor":3.7936},{"match_name":"PTPC January 7th USPSA Match","match_date":"2018-01-07","stage_classifiercode":"99-22","member_number":"FY63847","first_name":"JOHN","last_name":"FAVREAU","classification":"U","division":"PCC","hit_factor":3.7736},{"match_name":"DSS - USPSA - 21-09-25","match_date":"2021-09-25","stage_classifiercode":"99-22","member_number":"A110754","first_name":"AARON","last_name":"SELLERS","classification":"G","division":"PCC","hit_factor":3.7567},{"match_name":"PCSI - August 2018 USPSA","match_date":"2018-08-04","stage_classifiercode":"99-22","member_number":"A109775","first_name":"ALEC","last_name":"CARDELLINO","classification":"B","division":"PCC","hit_factor":3.7433},{"match_name":"Grandbaggers September 2017","match_date":"2017-09-07","stage_classifiercode":"99-22","member_number":"A34501","first_name":"RON","last_name":"FUCHS","classification":"U","division":"PCC","hit_factor":3.7323},{"match_name":"2020-03 Bone Creek USPSA","match_date":"2020-03-01","stage_classifiercode":"99-22","member_number":"A106540","first_name":"CAMERON","last_name":"CAHN","classification":"U","division":"PCC","hit_factor":3.7321},{"match_name":"Richmond Hot Shots May 19-20-2018 USPSA Pistol Match","match_date":"2018-05-19","stage_classifiercode":"99-22","member_number":"A53296","first_name":"DONALD","last_name":"WYMAN","classification":"U","division":"PCC","hit_factor":3.7175},{"match_name":"Richmond Hot Shots May 19-20-2018 USPSA Pistol Match","match_date":"2018-05-19","stage_classifiercode":"99-22","member_number":"TY84211","first_name":"GEORGE","last_name":"TY","classification":"A","division":"PCC","hit_factor":3.7132},{"match_name":"Brothers N Arms August 2017 USPSA Match","match_date":"2017-08-19","stage_classifiercode":"99-22","member_number":"PENDING","first_name":"TAI","last_name":"CURRY-FOX","classification":"U","division":"PCC","hit_factor":3.7013},{"match_name":"CGC 03-10-2018","match_date":"2018-03-10","stage_classifiercode":"99-22","member_number":"A52754","first_name":"TEDDY","last_name":"ROBERTS","classification":"U","division":"PCC","hit_factor":3.6932},{"match_name":"Superior Practical Shooters April 2018 Match","match_date":"2018-04-04","stage_classifiercode":"99-22","member_number":"A92935","first_name":"JOHN","last_name":"JACKSON","classification":"U","division":"PCC","hit_factor":3.6923},{"match_name":"WNPL USPSA - Nov 2017","match_date":"2017-11-05","stage_classifiercode":"99-22","member_number":"TY83039","first_name":"STEVE","last_name":"LEYDECKER","classification":"U","division":"PCC","hit_factor":3.6896},{"match_name":"TBAS USPSA Match  5/17/20","match_date":"2020-05-17","stage_classifiercode":"99-22","member_number":"TY88333","first_name":"JACK","last_name":"DOUTHIT","classification":"","division":"PCC","hit_factor":3.6885},{"match_name":"Maine Practical Shooters October USPSA","match_date":"2017-10-15","stage_classifiercode":"99-22","member_number":"TY84597","first_name":"NORMAN","last_name":"DAVIS","classification":"C","division":"PCC","hit_factor":3.671},{"match_name":"ACPSA October 2017","match_date":"2017-10-28","stage_classifiercode":"99-22","member_number":"\"\"","first_name":"SARA","last_name":"ARNETT","classification":"U","division":"PCC","hit_factor":3.6585},{"match_name":"USPSA MO21 2Alpha SBRC April 2018 Special Classifier","match_date":"2018-04-28","stage_classifiercode":"99-22","member_number":"A106591","first_name":"AUSTIN","last_name":"HILL","classification":"U","division":"PCC","hit_factor":3.6411},{"match_name":"SMPS Classifier July 2016","match_date":"2016-07-10","stage_classifiercode":"99-22","member_number":"A78666","first_name":"MARY","last_name":"PICARD","classification":"U","division":"PCC","hit_factor":3.6389},{"match_name":"Square Deal Sportsmen USPSA Sept 2020","match_date":"2020-09-06","stage_classifiercode":"99-22","member_number":"TY116746","first_name":"TIMOTHY","last_name":"MOON","classification":"U","division":"PCC","hit_factor":3.6385},{"match_name":"PRG 2017 Classifier Match","match_date":"2017-02-19","stage_classifiercode":"99-22","member_number":"A87556","first_name":"ROB","last_name":"CHOI","classification":"U","division":"PCC","hit_factor":3.6237},{"match_name":"Targetmasters USPSA Aug 7&8 2021","match_date":"2021-08-07","stage_classifiercode":"99-22","member_number":"A60873","first_name":"TONZEL","last_name":"PRINCE","classification":"C","division":"PCC","hit_factor":3.6044},{"match_name":"PRG 2017 Classifier Match","match_date":"2017-02-19","stage_classifiercode":"99-22","member_number":"L4112","first_name":"JAY","last_name":"HU","classification":"U","division":"PCC","hit_factor":3.5961},{"match_name":"Collin County USPSA Nov 6 2016","match_date":"2016-11-06","stage_classifiercode":"99-22","member_number":"A99312","first_name":"BRYAN","last_name":"BELL","classification":"U","division":"PCC","hit_factor":3.5952},{"match_name":"Crooked Creek Pistol League - December 2017","match_date":"2017-12-03","stage_classifiercode":"99-22","member_number":"TY75791","first_name":"DAVID","last_name":"GALE","classification":"U","division":"PCC","hit_factor":3.5831},{"match_name":"Bayou City USPSA Weekly July 5","match_date":"2018-07-05","stage_classifiercode":"99-22","member_number":"A106461","first_name":"DARREN","last_name":"HO","classification":"U","division":"PCC","hit_factor":3.5663},{"match_name":"USPSA MO21 2Alpha SBRC April 2018 Special Classifier","match_date":"2018-04-28","stage_classifiercode":"99-22","member_number":"A99328","first_name":"ED","last_name":"WILSON","classification":"C","division":"PCC","hit_factor":3.5539},{"match_name":"Gem City Gun Club 3-17 and 3-18-2018","match_date":"2018-03-17","stage_classifiercode":"99-22","member_number":"A72574","first_name":"DAN","last_name":"SKOCZYLAS","classification":"C","division":"PCC","hit_factor":3.543},{"match_name":"WELD ECO09 20181021","match_date":"2018-10-21","stage_classifiercode":"99-22","member_number":"L4346","first_name":"STEVE","last_name":"LIERMAN","classification":"U","division":"PCC","hit_factor":3.532},{"match_name":"CCPL - July 2021","match_date":"2021-07-17","stage_classifiercode":"99-22","member_number":"L2450","first_name":"BUD","last_name":"CONNOLLY","classification":"C","division":"PCC","hit_factor":3.528},{"match_name":"MS06 Team Magnolia August 2017 USPSA Match","match_date":"2017-08-06","stage_classifiercode":"99-22","member_number":"A83166","first_name":"CJ","last_name":"WILLIAMS","classification":"D","division":"PCC","hit_factor":3.5276},{"match_name":"SSPSC USPSA Jul  4-5 2020","match_date":"2020-07-01","stage_classifiercode":"99-22","member_number":"A104233","first_name":"JOHN","last_name":"GATUS","classification":"B","division":"PCC","hit_factor":3.5211},{"match_name":"GRPC USPSA THE FINAL COUNTDOWN","match_date":"2020-11-01","stage_classifiercode":"99-22","member_number":"TY94508","first_name":"ANTHONY","last_name":"SMALLWOOD","classification":"B","division":"PCC","hit_factor":3.4553},{"match_name":"SLPSA June USPSA","match_date":"2017-06-17","stage_classifiercode":"99-22","member_number":"A101173","first_name":"RYAN","last_name":"LARSEN","classification":"U","division":"PCC","hit_factor":3.4542},{"match_name":"North East Ohio Shooters - OHN06 - 2017-08-13","match_date":"2017-08-13","stage_classifiercode":"99-22","member_number":"\"\"","first_name":"JACK","last_name":"JAUCH","classification":"U","division":"PCC","hit_factor":3.4503},{"match_name":"NPCCC 07-01-2018 USPSA","match_date":"2018-07-01","stage_classifiercode":"99-22","member_number":"Ty81019","first_name":"PETE","last_name":"HARTMAN","classification":"U","division":"PCC","hit_factor":3.4414},{"match_name":"MS06 Team Magnolia August 2017 USPSA Match","match_date":"2017-08-06","stage_classifiercode":"99-22","member_number":"A86101","first_name":"BERNIE","last_name":"RHINES","classification":"D","division":"PCC","hit_factor":3.4266},{"match_name":"ACPSA October 2017","match_date":"2017-10-28","stage_classifiercode":"99-22","member_number":"\"\"","first_name":"BILL","last_name":"CREWS","classification":"U","division":"PCC","hit_factor":3.4001},{"match_name":"Richmond Hot Shots May 19-20-2018 USPSA Pistol Match","match_date":"2018-05-19","stage_classifiercode":"99-22","member_number":"TY109994","first_name":"MICHAEL","last_name":"LOOK","classification":"U","division":"PCC","hit_factor":3.3948},{"match_name":"YMM IPSC02 2020_08_09","match_date":"2020-08-09","stage_classifiercode":"99-22","member_number":"TY63399","first_name":"JOHNNIE","last_name":"CADY","classification":"C","division":"PCC","hit_factor":3.3874},{"match_name":"Pioneer Action Shooters Jun 2017 Match","match_date":"2017-06-25","stage_classifiercode":"99-22","member_number":"A103015","first_name":"CHRIS","last_name":"STOAKES","classification":"U","division":"PCC","hit_factor":3.3849},{"match_name":"Gem City Gun Club 3-17 and 3-18-2018","match_date":"2018-03-17","stage_classifiercode":"99-22","member_number":"A107358","first_name":"GINA","last_name":"ROBERTS","classification":"U","division":"PCC","hit_factor":3.3819},{"match_name":"SMPS Classifier July 2016","match_date":"2016-07-10","stage_classifiercode":"99-22","member_number":"TY80525","first_name":"JAKE","last_name":"SWIERCZEK","classification":"U","division":"PCC","hit_factor":3.367},{"match_name":"Bayou City USPSA Weekly July 5","match_date":"2018-07-05","stage_classifiercode":"99-22","member_number":"A81745","first_name":"AJ","last_name":"JACKSON","classification":"B","division":"PCC","hit_factor":3.3589},{"match_name":"Oakdale USPSA MN07 7-29-2021","match_date":"2021-07-29","stage_classifiercode":"99-22","member_number":"A119029","first_name":"ALISON","last_name":"HOWARD","classification":"D","division":"PCC","hit_factor":3.3573},{"match_name":"Bayou City USPSA Weekly July 29","match_date":"2021-07-29","stage_classifiercode":"99-22","member_number":"A127665","first_name":"JOSEPH","last_name":"REYES","classification":"C","division":"PCC","hit_factor":3.3573},{"match_name":"INAS Jan 2018 USPSA PM","match_date":"2018-01-22","stage_classifiercode":"99-22","member_number":"A106339","first_name":"ERIC J","last_name":"NELSON","classification":"D","division":"PCC","hit_factor":3.341},{"match_name":"Gem City Gun Club 3-17 and 3-18-2018","match_date":"2018-03-17","stage_classifiercode":"99-22","member_number":"TY61270","first_name":"JAMIE","last_name":"MC DONOUGH","classification":"U","division":"PCC","hit_factor":3.338},{"match_name":"March 25 Classifier","match_date":"2018-03-24","stage_classifiercode":"99-22","member_number":"A108613","first_name":"LOGAN","last_name":"PONTIUS","classification":"\"\"","division":"PCC","hit_factor":3.3269},{"match_name":"Crooked Creek Pistol League - December 2017","match_date":"2017-12-03","stage_classifiercode":"99-22","member_number":"A75237","first_name":"MIKE","last_name":"HARRISON","classification":"C","division":"PCC","hit_factor":3.3259},{"match_name":"MCAS April 2018 USPSA","match_date":"2018-04-21","stage_classifiercode":"99-22","member_number":"TY29750","first_name":"CRAIG","last_name":"BOYD","classification":"B","division":"PCC","hit_factor":3.3123},{"match_name":"Rio Salado RMAP August 2021","match_date":"2021-08-15","stage_classifiercode":"99-22","member_number":"TY87182","first_name":"MILTON","last_name":"MEANS","classification":"B","division":"PCC","hit_factor":3.2922},{"match_name":"Extreme GM USPSA February","match_date":"2020-02-21","stage_classifiercode":"99-22","member_number":"a100028","first_name":"CHRIS","last_name":"MAGLALANG","classification":"A","division":"PCC","hit_factor":3.2864},{"match_name":"PCSI - August 2018 USPSA","match_date":"2018-08-04","stage_classifiercode":"99-22","member_number":"A32462","first_name":"BRADLEY","last_name":"BOYD","classification":"C","division":"PCC","hit_factor":3.2832},{"match_name":"Grandbaggers September 2017","match_date":"2017-09-07","stage_classifiercode":"99-22","member_number":"A57603","first_name":"GALE","last_name":"ASCHENBACH","classification":"U","division":"PCC","hit_factor":3.2759},{"match_name":"Crooked Creek Pistol League - December 2017","match_date":"2017-12-03","stage_classifiercode":"99-22","member_number":"A99895","first_name":"NORMAN","last_name":"DRAGON","classification":"U","division":"PCC","hit_factor":3.2666},{"match_name":"Gem City Gun Club 3-4 and 3-5-17","match_date":"2017-03-04","stage_classifiercode":"99-22","member_number":"A43229","first_name":"RICK","last_name":"BAUER","classification":"D","division":"PCC","hit_factor":3.2569},{"match_name":"Gem City Gun Club 3-17 and 3-18-2018","match_date":"2018-03-17","stage_classifiercode":"99-22","member_number":"A77447","first_name":"SEAN","last_name":"MAHAN","classification":"C","division":"PCC","hit_factor":3.2564},{"match_name":"APSC USPSA  2-1-20","match_date":"2020-02-01","stage_classifiercode":"99-22","member_number":"A120451","first_name":"JAMIE","last_name":"JENNINGS","classification":"D","division":"PCC","hit_factor":3.2457},{"match_name":"EDPS USPSA June 5 2021","match_date":"2021-06-05","stage_classifiercode":"99-22","member_number":"Ty96443","first_name":"RUSTY","last_name":"WILSON","classification":"C","division":"PCC","hit_factor":3.2357},{"match_name":"GRB USPSA SEPTEMBER 2020 AT CAVALIER","match_date":"2020-09-19","stage_classifiercode":"99-22","member_number":"A66709","first_name":"LARRY","last_name":"BLACKMON","classification":"C","division":"PCC","hit_factor":3.2218},{"match_name":"GRPC USPSA YOU CAN'T BUY LOVE","match_date":"2021-02-07","stage_classifiercode":"99-22","member_number":"TY76330","first_name":"MARLON","last_name":"PORALAN","classification":"U","division":"PCC","hit_factor":3.21},{"match_name":"CGC CTX02 Monthly USPSA Match - January 2021","match_date":"2021-01-17","stage_classifiercode":"99-22","member_number":"L2484","first_name":"ALEX","last_name":"WAKAL","classification":"A","division":"PCC","hit_factor":3.2068},{"match_name":"LIPSA - February 26th 2017 - USPSA Match","match_date":"2017-02-26","stage_classifiercode":"99-22","member_number":"A49357","first_name":"TONY","last_name":"BYKOV","classification":"U","division":"PCC","hit_factor":3.1674},{"match_name":"EWPSA 2017-11","match_date":"2017-11-18","stage_classifiercode":"99-22","member_number":"A61656","first_name":"BOB","last_name":"HAWKS","classification":"D","division":"PCC","hit_factor":3.1615},{"match_name":"12a Fecha USPSA","match_date":"2017-11-12","stage_classifiercode":"99-22","member_number":"A97126","first_name":"JUDIBELLE","last_name":"MELENDEZ ALCARAZ","classification":"U","division":"PCC","hit_factor":3.1563},{"match_name":"ANPRACS USPSA 10-21-18","match_date":"2018-10-21","stage_classifiercode":"99-22","member_number":"TY85802","first_name":"JOHN","last_name":"CLER","classification":"B","division":"PCC","hit_factor":3.1066},{"match_name":"SFPC June 7 2020 PM     USPSA Monthly Match","match_date":"2020-06-07","stage_classifiercode":"99-22","member_number":"TY88436","first_name":"BOBBY","last_name":"DICKMANN","classification":"C","division":"PCC","hit_factor":3.096},{"match_name":"NRG Sunday June 18 -1st match at PRADO","match_date":"2017-06-18","stage_classifiercode":"99-22","member_number":"\"\"","first_name":"VINKY","last_name":"CASTILLO","classification":"U","division":"PCC","hit_factor":3.0787},{"match_name":"BRSP Tuesday Night USPSA Match - Feb 6","match_date":"2018-02-07","stage_classifiercode":"99-22","member_number":"TY95886","first_name":"LOREN","last_name":"ZEIGLER","classification":"U","division":"PCC","hit_factor":3.0782},{"match_name":"PRG 2017 Classifier Match","match_date":"2017-02-19","stage_classifiercode":"99-22","member_number":"A88977","first_name":"CHAD","last_name":"CHEUNG","classification":"U","division":"PCC","hit_factor":3.0362},{"match_name":"Eagle USPSA 01-08-2018","match_date":"2018-01-09","stage_classifiercode":"99-22","member_number":"A85291","first_name":"DAVID","last_name":"GERBER","classification":"U","division":"PCC","hit_factor":3.0154},{"match_name":"Richmond Hot Shots May 19-20-2018 USPSA Pistol Match","match_date":"2018-05-19","stage_classifiercode":"99-22","member_number":"A107946","first_name":"DAVID","last_name":"WEST","classification":"C","division":"PCC","hit_factor":3.0146},{"match_name":"Gem City Gun Club 3-4 and 3-5-17","match_date":"2017-03-04","stage_classifiercode":"99-22","member_number":"A88573","first_name":"ROB","last_name":"SHAFFER","classification":"U","division":"PCC","hit_factor":3.0033},{"match_name":"BSPSC 2018 August Special Classifier","match_date":"2018-08-12","stage_classifiercode":"99-22","member_number":"FY75569","first_name":"FRANK","last_name":"VELLA","classification":"U","division":"PCC","hit_factor":2.9937},{"match_name":"NTPS-SE October 2017","match_date":"2017-10-21","stage_classifiercode":"99-22","member_number":"A41055","first_name":"TERRY","last_name":"GODFREY","classification":"\"\"","division":"PCC","hit_factor":2.9693},{"match_name":"MS06 Team Magnolia USPSA","match_date":"2017-02-05","stage_classifiercode":"99-22","member_number":"A86101","first_name":"BERNIE","last_name":"RHINES","classification":"U","division":"PCC","hit_factor":2.9688},{"match_name":"GWPP March 2020 Pistol","match_date":"2020-03-14","stage_classifiercode":"99-22","member_number":"TY13721","first_name":"BILL","last_name":"HUNTER","classification":"C","division":"PCC","hit_factor":2.9335},{"match_name":"ACPSA October 2017","match_date":"2017-10-28","stage_classifiercode":"99-22","member_number":"\"\"","first_name":"MIKE","last_name":"HICKS","classification":"U","division":"PCC","hit_factor":2.9233},{"match_name":"LA05 Tangi 5th Sunday USPSA AUGUST 2020","match_date":"2020-08-29","stage_classifiercode":"99-22","member_number":"TY121741","first_name":"JACK","last_name":"LANCASTER","classification":"U","division":"PCC","hit_factor":2.9197},{"match_name":"Monthly Club Match with Classifiers by Tropang Vegas","match_date":"2018-11-04","stage_classifiercode":"99-22","member_number":"A32931","first_name":"MIKE","last_name":"AGONCILLO","classification":"U","division":"PCC","hit_factor":2.8868},{"match_name":"Monthly Club Match with Classifiers by Tropang Vegas","match_date":"2018-11-04","stage_classifiercode":"99-22","member_number":"A30481","first_name":"EDUARDO","last_name":"BACHO","classification":"U","division":"PCC","hit_factor":2.8634},{"match_name":"Bayou City USPSA Weekly Jan 21","match_date":"2021-01-22","stage_classifiercode":"99-22","member_number":"A79434","first_name":"GARRY","last_name":"NEWTON","classification":"M","division":"PCC","hit_factor":2.847},{"match_name":"DSS - USPSA 20-07-25","match_date":"2020-07-25","stage_classifiercode":"99-22","member_number":"A118637","first_name":"CHRIS","last_name":"JENNER","classification":"C","division":"PCC","hit_factor":2.8285},{"match_name":"Extreme GM USPSA February","match_date":"2020-02-21","stage_classifiercode":"99-22","member_number":"A102166","first_name":"MICHAEL","last_name":"GEE","classification":"B","division":"PCC","hit_factor":2.8249},{"match_name":"Richmond Hot Shots Jan 4-5-2020 USPSA Pistol","match_date":"2020-01-04","stage_classifiercode":"99-22","member_number":"TY104136","first_name":"RICK","last_name":"NAKASHOJI","classification":"U","division":"PCC","hit_factor":2.8037},{"match_name":"ORPCI  USPSA  Friday 2020.11.20","match_date":"2020-11-20","stage_classifiercode":"99-22","member_number":"A128561","first_name":"RUSSELL","last_name":"DUTY","classification":"","division":"PCC","hit_factor":2.7611},{"match_name":"EDPS USPSA January 4 2020","match_date":"2020-01-04","stage_classifiercode":"99-22","member_number":"TY114713","first_name":"ANN","last_name":"RANLETT","classification":"U","division":"PCC","hit_factor":2.7535},{"match_name":"INAS Jan 2018 USPSA AM","match_date":"2018-01-20","stage_classifiercode":"99-22","member_number":"A102801","first_name":"CHRISTOPHER","last_name":"HOWARD","classification":"U","division":"PCC","hit_factor":2.7464},{"match_name":"PRG 2017 Classifier Match","match_date":"2017-02-19","stage_classifiercode":"99-22","member_number":"A101129","first_name":"EMMANUAL","last_name":"CORDERO","classification":"U","division":"PCC","hit_factor":2.7257},{"match_name":"JPPS Club Match 7-18-20","match_date":"2020-07-18","stage_classifiercode":"99-22","member_number":"A114616","first_name":"DAVID","last_name":"MCCOLLUM","classification":"U","division":"PCC","hit_factor":2.7129},{"match_name":"Paul Bunyan April 7th-8th All Classifier Match NW01","match_date":"2018-04-07","stage_classifiercode":"99-22","member_number":"TY-81957","first_name":"MARK","last_name":"PLUMMER","classification":"U","division":"PCC","hit_factor":2.7027},{"match_name":"Paul Bunyan April 7th-8th All Classifier Match NW01","match_date":"2018-04-07","stage_classifiercode":"99-22","member_number":"TY72819","first_name":"JASON","last_name":"DINGLEDINE","classification":"U","division":"PCC","hit_factor":2.6965},{"match_name":"NRG Saturday Nov 14th - Includes a Classifier Stage","match_date":"2020-11-14","stage_classifiercode":"99-22","member_number":"A101068","first_name":"KELLI","last_name":"MCKERNAN","classification":"D","division":"PCC","hit_factor":2.6698},{"match_name":"LCSA USPSA ALL CLASSIFIER ","match_date":"2018-06-30","stage_classifiercode":"99-22","member_number":"A96427","first_name":"BRIAN","last_name":"CICCO","classification":"B","division":"PCC","hit_factor":2.669},{"match_name":"CCPL - July 2021","match_date":"2021-07-17","stage_classifiercode":"99-22","member_number":"A78482","first_name":"MICHAEL","last_name":"FRISKY","classification":"U","division":"PCC","hit_factor":2.6616},{"match_name":"OFGC USPSA August 21 2016","match_date":"2016-08-21","stage_classifiercode":"99-22","member_number":"\"\"","first_name":"WILLIAM","last_name":"STRIPLIN","classification":"U","division":"PCC","hit_factor":2.6527},{"match_name":"MESQUITE MAYHEM APRIL USPSA match 2018","match_date":"2018-04-15","stage_classifiercode":"99-22","member_number":"A76697","first_name":"IVAN","last_name":"DUENAS","classification":"C","division":"PCC","hit_factor":2.6505},{"match_name":"Richmond Hot Shots Jan 4-5-2020 USPSA Pistol","match_date":"2020-01-04","stage_classifiercode":"99-22","member_number":"A51484","first_name":"DANILO","last_name":"MABALO","classification":"U","division":"PCC","hit_factor":2.6423},{"match_name":"WNPL USPSA - Nov 2017","match_date":"2017-11-05","stage_classifiercode":"99-22","member_number":"A100873","first_name":"SERGIO","last_name":"VILLAREAL","classification":"C","division":"PCC","hit_factor":2.6298},{"match_name":"BPSA August 2016 Classifier Match","match_date":"2016-08-07","stage_classifiercode":"99-22","member_number":"A63240","first_name":"DON","last_name":"EVANS","classification":"U","division":"PCC","hit_factor":2.6064},{"match_name":"Gem City Gun Club 3-4 and 3-5-17","match_date":"2017-03-04","stage_classifiercode":"99-22","member_number":"A95584","first_name":"MICHAEL","last_name":"ORLANDI","classification":"U","division":"PCC","hit_factor":2.6048},{"match_name":"USPSA Bass River June 2017","match_date":"2017-06-04","stage_classifiercode":"99-22","member_number":"TY88472","first_name":"JIM","last_name":"HOULE","classification":"\"\"","division":"PCC","hit_factor":2.5943},{"match_name":"MS06 Team Magnolia August 2017 USPSA Match","match_date":"2017-08-06","stage_classifiercode":"99-22","member_number":"TY94846","first_name":"RUTH","last_name":"MAHLEY","classification":"D","division":"PCC","hit_factor":2.5929},{"match_name":"MVS ANPRACS USPSA 3-19-17","match_date":"2017-03-19","stage_classifiercode":"99-22","member_number":"TY65829","first_name":"MICHAEL","last_name":"HANRAHAN","classification":"U","division":"PCC","hit_factor":2.5801},{"match_name":"TCGC Polo July 2021","match_date":"2021-07-25","stage_classifiercode":"99-22","member_number":"A123775","first_name":"JEFFREY","last_name":"FIELDSEND","classification":"B","division":"PCC","hit_factor":2.5435},{"match_name":"MVPSA 3-10-18","match_date":"2018-03-10","stage_classifiercode":"99-22","member_number":"A61146","first_name":"MARK","last_name":"HOFFMIER","classification":"D","division":"PCC","hit_factor":2.5113},{"match_name":"WELD ECO09 20181021","match_date":"2018-10-21","stage_classifiercode":"99-22","member_number":"FY87456","first_name":"SHARON","last_name":"SMITH","classification":"U","division":"PCC","hit_factor":2.4904},{"match_name":"GWPP August 2020 Pistol","match_date":"2020-08-08","stage_classifiercode":"99-22","member_number":"L4725","first_name":"DAVID","last_name":"GILBERTSON #2","classification":"U","division":"PCC","hit_factor":2.4788},{"match_name":"North East Ohio Shooters - OHN06 - 2017-08-13","match_date":"2017-08-13","stage_classifiercode":"99-22","member_number":"\"\"","first_name":"MICHAEL","last_name":"DAY","classification":"U","division":"PCC","hit_factor":2.4249},{"match_name":"PRG 2017 Classifier Match","match_date":"2017-02-19","stage_classifiercode":"99-22","member_number":"PEN","first_name":"KELLI","last_name":"MCKERNAN","classification":"U","division":"PCC","hit_factor":2.4242},{"match_name":"PRG 2017 Classifier Match","match_date":"2017-02-19","stage_classifiercode":"99-22","member_number":"\"\"","first_name":"DESI","last_name":"LOPEZ","classification":"U","division":"PCC","hit_factor":2.4008},{"match_name":"Bayou City USPSA Weekly July 5","match_date":"2018-07-05","stage_classifiercode":"99-22","member_number":"A92443","first_name":"RAY","last_name":"FISHEL","classification":"U","division":"PCC","hit_factor":2.3952},{"match_name":"GWPP May 2021 Pistol","match_date":"2021-05-08","stage_classifiercode":"99-22","member_number":"A129931","first_name":"BUBBA","last_name":"ORR","classification":"U","division":"PCC","hit_factor":2.3911},{"match_name":"FAS Sunday USPSA Match","match_date":"2020-02-16","stage_classifiercode":"99-22","member_number":"A95711","first_name":"RYAN","last_name":"YURONG","classification":"C","division":"PCC","hit_factor":2.3529},{"match_name":"Bossier Parish Practical Shooters August 16 2020","match_date":"2020-08-16","stage_classifiercode":"99-22","member_number":"A121184","first_name":"CYNTHIA","last_name":"ROWELL","classification":"D","division":"PCC","hit_factor":2.3326},{"match_name":"PCSI - August 2018 USPSA","match_date":"2018-08-04","stage_classifiercode":"99-22","member_number":"A105760","first_name":"BRADY","last_name":"ROENKER","classification":"U","division":"PCC","hit_factor":2.2418},{"match_name":"Payson Practical Pistol Sept 03 2016","match_date":"2016-09-03","stage_classifiercode":"99-22","member_number":"TY65813","first_name":"JOE","last_name":"HANNIS","classification":"C","division":"PCC","hit_factor":2.2159},{"match_name":"Payson Practical Pistol Sept 03 2016","match_date":"2016-09-03","stage_classifiercode":"99-22","member_number":"A77066","first_name":"MARCELO","last_name":"MARIANO","classification":"U","division":"PCC","hit_factor":2.175},{"match_name":"PCSI - August 2018 USPSA","match_date":"2018-08-04","stage_classifiercode":"99-22","member_number":"A80646","first_name":"BOUNTHAVY","last_name":"SOUNGPRADITH","classification":"A","division":"PCC","hit_factor":2.1562},{"match_name":"Cops September 2016 USPSA CLASSIFIER","match_date":"2016-09-04","stage_classifiercode":"99-22","member_number":"A81279","first_name":"JARROD","last_name":"GROVE","classification":"U","division":"PCC","hit_factor":2.148},{"match_name":"NRG Saturday Nov 14th - Includes a Classifier Stage","match_date":"2020-11-14","stage_classifiercode":"99-22","member_number":"A96852","first_name":"ELMER","last_name":"CABRERA","classification":"U","division":"PCC","hit_factor":2.1277},{"match_name":"March 2018 USPSA Classifier Special","match_date":"2018-03-17","stage_classifiercode":"99-22","member_number":"F79951","first_name":"ROY","last_name":"FALCON","classification":"\"\"","division":"PCC","hit_factor":2.0675},{"match_name":"EDPS USPSA June 5 2021","match_date":"2021-06-05","stage_classifiercode":"99-22","member_number":"Fy98474","first_name":"TONY","last_name":"PETERSON","classification":"B","division":"PCC","hit_factor":1.9841},{"match_name":"NRG Saturday April 28th- Includes a Classifier Stage","match_date":"2018-04-28","stage_classifiercode":"99-22","member_number":"A96678","first_name":"PAUL","last_name":"GOMEZ","classification":"U","division":"PCC","hit_factor":1.9701},{"match_name":"Hampden RPC June USPSA Match","match_date":"2021-06-13","stage_classifiercode":"99-22","member_number":"TY128206","first_name":"WILLIAM","last_name":"FISHER","classification":"Unclassified","division":"PCC","hit_factor":1.9677},{"match_name":"Paul Bunyan April 7th-8th All Classifier Match NW01","match_date":"2018-04-07","stage_classifiercode":"99-22","member_number":"L2124","first_name":"BRUCE","last_name":"BENNETT","classification":"U","division":"PCC","hit_factor":1.891},{"match_name":"SMPS Classifier July 2016","match_date":"2016-07-10","stage_classifiercode":"99-22","member_number":"L4049","first_name":"CHRISTIAN VET","last_name":"VIVERETTE","classification":"U","division":"PCC","hit_factor":1.7408},{"match_name":"OFGC USPSA August 21 2016","match_date":"2016-08-21","stage_classifiercode":"99-22","member_number":"\"\"","first_name":"CJ","last_name":"STRIPLIN","classification":"U","division":"PCC","hit_factor":1.7104},{"match_name":"Coastal Area Practical Shooters 4-22-17","match_date":"2017-04-22","stage_classifiercode":"99-22","member_number":"A59004","first_name":"CARTER","last_name":"RAMSEY","classification":"U","division":"PCC","hit_factor":1.6875},{"match_name":"DWB - Deadwood Boys USPSA December 17 2017","match_date":"2017-12-17","stage_classifiercode":"99-22","member_number":"\"\"","first_name":"JOHN","last_name":"DOE","classification":"U","division":"PCC","hit_factor":1.6708},{"match_name":"MVS ANPRACS USPSA 3-19-17","match_date":"2017-03-19","stage_classifiercode":"99-22","member_number":"TY20252","first_name":"BARRY","last_name":"WILLIAMS","classification":"U","division":"PCC","hit_factor":1.6644},{"match_name":"NRG Saturday Feb 27th Includes a Classifier Stage","match_date":"2021-02-27","stage_classifiercode":"99-22","member_number":"A79600","first_name":"CYNTHIA","last_name":"HERPIN","classification":"U","division":"PCC","hit_factor":1.5994},{"match_name":"Richmond Hot Shots May 19-20-2018 USPSA Pistol Match","match_date":"2018-05-19","stage_classifiercode":"99-22","member_number":"\"\"","first_name":"MICKY","last_name":"T","classification":"U","division":"PCC","hit_factor":1.5868},{"match_name":"NRG Saturday Feb 27th Includes a Classifier Stage","match_date":"2021-02-27","stage_classifiercode":"99-22","member_number":"A46996","first_name":"REY","last_name":"ATIENZA","classification":"U","division":"PCC","hit_factor":1.5056},{"match_name":"EWPSA 2020-08","match_date":"2020-08-16","stage_classifiercode":"99-22","member_number":"L4628","first_name":"WARREN","last_name":"HARPER","classification":"G","division":"PCC","hit_factor":1.4493},{"match_name":"Richmond Hot Shots May 19-20-2018 USPSA Pistol Match","match_date":"2018-05-19","stage_classifiercode":"99-22","member_number":"L2249","first_name":"NORBERT","last_name":"BARAOIDAN","classification":"A","division":"PCC","hit_factor":1.4091},{"match_name":"BAre Arms  Indoor 02-24-18","match_date":"2018-02-24","stage_classifiercode":"99-22","member_number":"L2133","first_name":"GARY","last_name":"STEVENS","classification":"C","division":"PCC","hit_factor":1.3473},{"match_name":"TBAS USPSA Match  5/17/20","match_date":"2020-05-17","stage_classifiercode":"99-22","member_number":"TY101016","first_name":"TOM","last_name":"LAUBACH","classification":"","division":"PCC","hit_factor":1.3468},{"match_name":"Richmond Hot Shots May 19-20-2018 USPSA Pistol Match","match_date":"2018-05-19","stage_classifiercode":"99-22","member_number":"A88344","first_name":"CHRISTIAN","last_name":"ESPIRITU","classification":"U","division":"PCC","hit_factor":1.3084},{"match_name":"WGC WI USPSA Monthly Match 1-25-2020","match_date":"2020-01-25","stage_classifiercode":"99-22","member_number":"TY89958","first_name":"JESSE","last_name":"NEWTON","classification":"A","division":"PCC","hit_factor":1.2216},{"match_name":"TBAS USPSA Match 3/21/2021","match_date":"2021-03-21","stage_classifiercode":"99-22","member_number":"A107819","first_name":"RITCHIE","last_name":"HOY","classification":"","division":"PCC","hit_factor":1.2185},{"match_name":"Gem City Gun Club 3-4 and 3-5-17","match_date":"2017-03-04","stage_classifiercode":"99-22","member_number":"a10052","first_name":"PAT","last_name":"EAKIN","classification":"U","division":"PCC","hit_factor":1.1905},{"match_name":"LIPSA - February 26th 2017 - USPSA Match","match_date":"2017-02-26","stage_classifiercode":"99-22","member_number":"NA","first_name":"LOUIS","last_name":"GUIDONE","classification":"U","division":"PCC","hit_factor":1.1688},{"match_name":"NRG Saturday Nov 14th - Includes a Classifier Stage","match_date":"2020-11-14","stage_classifiercode":"99-22","member_number":"A96514","first_name":"VON RAYMUND","last_name":"VALENZONA","classification":"U","division":"PCC","hit_factor":1.1134},{"match_name":"MCAS April 2018 USPSA","match_date":"2018-04-21","stage_classifiercode":"99-22","member_number":"A97062","first_name":"PAUL","last_name":"MCKEAN","classification":"C","division":"PCC","hit_factor":1.1038},{"match_name":"BAPS USPSA November","match_date":"2017-11-18","stage_classifiercode":"99-22","member_number":"TY16844","first_name":"STEVE","last_name":"DEARDORFF","classification":"U","division":"PCC","hit_factor":1.0436},{"match_name":"TBAS USPSA Match  5/17/20","match_date":"2020-05-17","stage_classifiercode":"99-22","member_number":"A117925","first_name":"HEIDI","last_name":"CONLON","classification":"U","division":"PCC","hit_factor":0.9585},{"match_name":"Richmond Hot Shots May 19-20-2018 USPSA Pistol Match","match_date":"2018-05-19","stage_classifiercode":"99-22","member_number":"FY81272","first_name":"GAYLORD","last_name":"GABRIEL","classification":"B","division":"PCC","hit_factor":0.8833},{"match_name":"Armory Indoor League","match_date":"2016-11-10","stage_classifiercode":"99-22","member_number":"TY87879","first_name":"ROBERT","last_name":"WYATT","classification":"U","division":"PCC","hit_factor":0.8571},{"match_name":"MCAS April 2018 USPSA","match_date":"2018-04-21","stage_classifiercode":"99-22","member_number":"L3920","first_name":"ANDY","last_name":"RIO","classification":"D","division":"PCC","hit_factor":0.7721},{"match_name":"NRG Sunday June 18 -1st match at PRADO","match_date":"2017-06-18","stage_classifiercode":"99-22","member_number":"PENDING","first_name":"KC","last_name":"TICZON","classification":"U","division":"PCC","hit_factor":0.7344},{"match_name":"Rankin Field Saturday USPSA","match_date":"2017-09-02","stage_classifiercode":"99-22","member_number":"\"\"","first_name":"BRUCE","last_name":"LE","classification":"U","division":"PCC","hit_factor":0.6552},{"match_name":"MS06 Team Magnolia August 2017 USPSA Match","match_date":"2017-08-06","stage_classifiercode":"99-22","member_number":"\"\"","first_name":"TAI","last_name":"CURRY-FOX","classification":"U","division":"PCC","hit_factor":0.623},{"match_name":"Brothers N Arms August 2017 USPSA Match","match_date":"2017-08-19","stage_classifiercode":"99-22","member_number":"PENDING","first_name":"BRANDON","last_name":"KOONCE","classification":"U","division":"PCC","hit_factor":0.3299}]